03:54:58.566710 IP 192.168.43.124.8880 > 192.168.43.195.7771: UDP, length 120
03:54:58.632657 IP 192.168.43.124.8880 > 192.168.43.195.7771: UDP, length 120
03:54:58.662265 IP 192.168.43.124.8880 > 192.168.43.195.7771: UDP, length 120
03:54:58.696900 IP 192.168.43.124.8880 > 192.168.43.195.7771: UDP, length 120
03:54:58.732651 IP 192.168.43.124.8880 > 192.168.43.195.7771: UDP, length 120
03:54:58.788314 IP 192.168.43.124.8880 > 192.168.43.195.7771: UDP, length 120
03:54:58.830388 IP 192.168.43.124.8880 > 192.168.43.195.7771: UDP, length 120
03:54:58.905139 IP 192.168.43.124.8880 > 192.168.43.195.7771: UDP, length 120
03:54:58.926138 IP 192.168.43.124.8880 > 192.168.43.195.7771: UDP, length 120
03:54:58.979232 IP 192.168.43.124.8880 > 192.168.43.195.7771: UDP, length 120
03:54:59.026113 IP 192.168.43.124.8880 > 192.168.43.195.7771: UDP, length 120
03:54:59.078377 IP 192.168.43.124.8880 > 192.168.43.195.7771: UDP, length 120
03:54:59.134649 IP 192.168.43.124.8880 > 192.168.43.195.7771: UDP, length 120
03:54:59.176129 IP 192.168.43.124.8880 > 192.168.43.195.7771: UDP, length 120
03:54:59.208504 IP 192.168.43.195.8880 > 192.168.43.124.7772: UDP, length 120
03:54:59.222803 IP 192.168.43.124.8880 > 192.168.43.195.7771: UDP, length 120
03:54:59.258555 IP 192.168.43.195.8880 > 192.168.43.124.7772: UDP, length 120
03:54:59.273489 IP 192.168.43.124.8880 > 192.168.43.195.7771: UDP, length 120
03:54:59.308534 IP 192.168.43.195.8880 > 192.168.43.124.7772: UDP, length 120
03:54:59.358526 IP 192.168.43.195.8880 > 192.168.43.124.7772: UDP, length 120
03:54:59.408528 IP 192.168.43.195.8880 > 192.168.43.124.7772: UDP, length 120
03:54:59.434627 IP 192.168.43.124.8880 > 192.168.43.195.7771: UDP, length 120
03:54:59.434866 IP 192.168.43.124.8880 > 192.168.43.195.7771: UDP, length 120
03:54:59.434981 IP 192.168.43.124.8880 > 192.168.43.195.7771: UDP, length 120
03:54:59.458538 IP 192.168.43.195.8880 > 192.168.43.124.7772: UDP, length 120
03:54:59.471272 IP 192.168.43.124.8880 > 192.168.43.195.7771: UDP, length 120
03:54:59.508532 IP 192.168.43.195.8880 > 192.168.43.124.7772: UDP, length 120
03:54:59.522799 IP 192.168.43.124.8880 > 192.168.43.195.7771: UDP, length 120
03:54:59.558539 IP 192.168.43.195.8880 > 192.168.43.124.7772: UDP, length 120
03:54:59.573952 IP 192.168.43.124.8880 > 192.168.43.195.7771: UDP, length 120
03:54:59.608542 IP 192.168.43.195.8880 > 192.168.43.124.7772: UDP, length 120
03:54:59.621386 IP 192.168.43.124.8880 > 192.168.43.195.7771: UDP, length 120
03:54:59.658542 IP 192.168.43.195.8880 > 192.168.43.124.7772: UDP, length 120
03:54:59.673039 IP 192.168.43.124.8880 > 192.168.43.195.7771: UDP, length 120
03:54:59.708537 IP 192.168.43.195.8880 > 192.168.43.124.7772: UDP, length 120
03:54:59.723108 IP 192.168.43.124.8880 > 192.168.43.195.7771: UDP, length 120
03:54:59.758530 IP 192.168.43.195.8880 > 192.168.43.124.7772: UDP, length 120
03:54:59.771209 IP 192.168.43.124.8880 > 192.168.43.195.7771: UDP, length 120
03:54:59.808533 IP 192.168.43.195.8880 > 192.168.43.124.7772: UDP, length 120
03:54:59.858527 IP 192.168.43.195.8880 > 192.168.43.124.7772: UDP, length 120
03:54:59.881880 IP 192.168.43.124.8880 > 192.168.43.195.7771: UDP, length 120
03:54:59.906171 IP 192.168.43.124.8880 > 192.168.43.195.7771: UDP, length 120
03:54:59.908537 IP 192.168.43.195.8880 > 192.168.43.124.7772: UDP, length 120
03:54:59.958535 IP 192.168.43.195.8880 > 192.168.43.124.7772: UDP, length 120
03:54:59.986871 IP 192.168.43.124.8880 > 192.168.43.195.7771: UDP, length 120
03:55:00.001368 IP 192.168.43.124.8880 > 192.168.43.195.7771: UDP, length 120
03:55:00.008538 IP 192.168.43.195.8880 > 192.168.43.124.7772: UDP, length 120
03:55:00.058528 IP 192.168.43.195.8880 > 192.168.43.124.7772: UDP, length 120
03:55:00.104144 IP 192.168.43.124.8880 > 192.168.43.195.7771: UDP, length 120
03:55:00.108529 IP 192.168.43.195.8880 > 192.168.43.124.7772: UDP, length 120
03:55:00.158535 IP 192.168.43.195.8880 > 192.168.43.124.7772: UDP, length 120
03:55:00.187477 IP 192.168.43.124.8880 > 192.168.43.195.7771: UDP, length 120
03:55:00.199183 IP 192.168.43.124.8880 > 192.168.43.195.7771: UDP, length 120
03:55:00.208536 IP 192.168.43.195.8880 > 192.168.43.124.7772: UDP, length 120
03:55:00.236839 IP 192.168.43.124.8880 > 192.168.43.195.7771: UDP, length 120
03:55:00.258533 IP 192.168.43.195.8880 > 192.168.43.124.7772: UDP, length 120
03:55:00.272433 IP 192.168.43.124.8880 > 192.168.43.195.7771: UDP, length 120
03:55:00.308554 IP 192.168.43.195.8880 > 192.168.43.124.7772: UDP, length 120
03:55:00.358579 IP 192.168.43.195.8880 > 192.168.43.124.7772: UDP, length 120
03:55:00.370999 IP 192.168.43.124.8880 > 192.168.43.195.7771: UDP, length 120
03:55:00.396241 IP 192.168.43.124.8880 > 192.168.43.195.7771: UDP, length 120
03:55:00.408547 IP 192.168.43.195.8880 > 192.168.43.124.7772: UDP, length 120
03:55:00.458535 IP 192.168.43.195.8880 > 192.168.43.124.7772: UDP, length 120
03:55:00.508541 IP 192.168.43.195.8880 > 192.168.43.124.7772: UDP, length 120
03:55:00.558531 IP 192.168.43.195.8880 > 192.168.43.124.7772: UDP, length 120
03:55:00.608530 IP 192.168.43.195.8880 > 192.168.43.124.7772: UDP, length 120
03:55:00.631522 IP 192.168.43.124.8880 > 192.168.43.195.7771: UDP, length 120
03:55:00.642956 IP 192.168.43.124.8880 > 192.168.43.195.7771: UDP, length 120
03:55:00.658534 IP 192.168.43.195.8880 > 192.168.43.124.7772: UDP, length 120
03:55:00.708534 IP 192.168.43.195.8880 > 192.168.43.124.7772: UDP, length 120
03:55:00.754895 IP 192.168.43.124.8880 > 192.168.43.195.7771: UDP, length 120
03:55:00.758526 IP 192.168.43.195.8880 > 192.168.43.124.7772: UDP, length 120
03:55:00.799048 IP 192.168.43.124.8880 > 192.168.43.195.7771: UDP, length 120
03:55:00.808530 IP 192.168.43.195.8880 > 192.168.43.124.7772: UDP, length 120
03:55:00.858526 IP 192.168.43.195.8880 > 192.168.43.124.7772: UDP, length 120
03:55:00.905577 IP 192.168.43.124.8880 > 192.168.43.195.7771: UDP, length 120
03:55:00.908526 IP 192.168.43.195.8880 > 192.168.43.124.7772: UDP, length 120
03:55:00.909062 IP 192.168.43.124.8880 > 192.168.43.195.7771: UDP, length 120
03:55:00.958539 IP 192.168.43.195.8880 > 192.168.43.124.7772: UDP, length 120
03:55:00.998654 IP 192.168.43.124.8880 > 192.168.43.195.7771: UDP, length 120
03:55:00.999477 IP 192.168.43.124.8880 > 192.168.43.195.7771: UDP, length 120
03:55:01.008591 IP 192.168.43.195.8880 > 192.168.43.124.7772: UDP, length 120
03:55:01.058571 IP 192.168.43.195.8880 > 192.168.43.124.7772: UDP, length 120
03:55:01.108535 IP 192.168.43.195.8880 > 192.168.43.124.7772: UDP, length 120
03:55:01.111948 IP 192.168.43.124.8880 > 192.168.43.195.7771: UDP, length 120
03:55:01.158530 IP 192.168.43.195.8880 > 192.168.43.124.7772: UDP, length 120
03:55:01.181236 IP 192.168.43.124.8880 > 192.168.43.195.7771: UDP, length 120
03:55:01.184292 IP 192.168.43.124.8880 > 192.168.43.195.7771: UDP, length 120
03:55:01.208528 IP 192.168.43.195.8880 > 192.168.43.124.7772: UDP, length 120
03:55:01.258524 IP 192.168.43.195.8880 > 192.168.43.124.7772: UDP, length 120
03:55:01.298673 IP 192.168.43.124.8880 > 192.168.43.195.7771: UDP, length 120
03:55:01.308534 IP 192.168.43.195.8880 > 192.168.43.124.7772: UDP, length 120
03:55:01.358524 IP 192.168.43.195.8880 > 192.168.43.124.7772: UDP, length 120
03:55:01.387204 IP 192.168.43.124.8880 > 192.168.43.195.7771: UDP, length 120
03:55:01.387814 IP 192.168.43.124.8880 > 192.168.43.195.7771: UDP, length 120
03:55:01.408529 IP 192.168.43.195.8880 > 192.168.43.124.7772: UDP, length 120
03:55:01.456405 IP 192.168.43.124.8880 > 192.168.43.195.7771: UDP, length 120
03:55:01.458525 IP 192.168.43.195.8880 > 192.168.43.124.7772: UDP, length 120
03:55:01.474438 IP 192.168.43.124.8880 > 192.168.43.195.7771: UDP, length 120
03:55:01.508531 IP 192.168.43.195.8880 > 192.168.43.124.7772: UDP, length 120
03:55:01.523116 IP 192.168.43.124.8880 > 192.168.43.195.7771: UDP, length 120
03:55:01.558542 IP 192.168.43.195.8880 > 192.168.43.124.7772: UDP, length 120
03:55:01.572830 IP 192.168.43.124.8880 > 192.168.43.195.7771: UDP, length 120
03:55:01.608536 IP 192.168.43.195.8880 > 192.168.43.124.7772: UDP, length 120
03:55:01.623162 IP 192.168.43.124.8880 > 192.168.43.195.7771: UDP, length 120
03:55:01.658550 IP 192.168.43.195.8880 > 192.168.43.124.7772: UDP, length 120
03:55:01.673052 IP 192.168.43.124.8880 > 192.168.43.195.7771: UDP, length 120
03:55:01.708531 IP 192.168.43.195.8880 > 192.168.43.124.7772: UDP, length 120
03:55:01.724084 IP 192.168.43.124.8880 > 192.168.43.195.7771: UDP, length 120
03:55:01.758530 IP 192.168.43.195.8880 > 192.168.43.124.7772: UDP, length 120
03:55:01.773436 IP 192.168.43.124.8880 > 192.168.43.195.7771: UDP, length 120
03:55:01.808535 IP 192.168.43.195.8880 > 192.168.43.124.7772: UDP, length 120
03:55:01.822526 IP 192.168.43.124.8880 > 192.168.43.195.7771: UDP, length 120
03:55:01.858566 IP 192.168.43.195.8880 > 192.168.43.124.7772: UDP, length 120
03:55:01.893985 IP 192.168.43.124.8880 > 192.168.43.195.7771: UDP, length 120
03:55:01.908528 IP 192.168.43.195.8880 > 192.168.43.124.7772: UDP, length 120
03:55:01.924119 IP 192.168.43.124.8880 > 192.168.43.195.7771: UDP, length 120
03:55:01.958543 IP 192.168.43.195.8880 > 192.168.43.124.7772: UDP, length 120
03:55:01.973310 IP 192.168.43.124.8880 > 192.168.43.195.7771: UDP, length 120
03:55:02.008537 IP 192.168.43.195.8880 > 192.168.43.124.7772: UDP, length 120
03:55:02.025355 IP 192.168.43.124.8880 > 192.168.43.195.7771: UDP, length 120
03:55:02.058529 IP 192.168.43.195.8880 > 192.168.43.124.7772: UDP, length 120
03:55:02.073491 IP 192.168.43.124.8880 > 192.168.43.195.7771: UDP, length 120
03:55:02.108527 IP 192.168.43.195.8880 > 192.168.43.124.7772: UDP, length 120
03:55:02.122842 IP 192.168.43.124.8880 > 192.168.43.195.7771: UDP, length 120
03:55:02.158533 IP 192.168.43.195.8880 > 192.168.43.124.7772: UDP, length 120
03:55:02.173071 IP 192.168.43.124.8880 > 192.168.43.195.7771: UDP, length 120
03:55:02.208527 IP 192.168.43.195.8880 > 192.168.43.124.7772: UDP, length 120
03:55:02.223357 IP 192.168.43.124.8880 > 192.168.43.195.7771: UDP, length 120
03:55:02.258539 IP 192.168.43.195.8880 > 192.168.43.124.7772: UDP, length 120
03:55:02.273450 IP 192.168.43.124.8880 > 192.168.43.195.7771: UDP, length 120
03:55:02.308528 IP 192.168.43.195.8880 > 192.168.43.124.7772: UDP, length 120
03:55:02.325569 IP 192.168.43.124.8880 > 192.168.43.195.7771: UDP, length 120
03:55:02.358527 IP 192.168.43.195.8880 > 192.168.43.124.7772: UDP, length 120
03:55:02.373886 IP 192.168.43.124.8880 > 192.168.43.195.7771: UDP, length 120
03:55:02.408528 IP 192.168.43.195.8880 > 192.168.43.124.7772: UDP, length 120
03:55:02.423059 IP 192.168.43.124.8880 > 192.168.43.195.7771: UDP, length 120
03:55:02.458527 IP 192.168.43.195.8880 > 192.168.43.124.7772: UDP, length 120
03:55:02.473076 IP 192.168.43.124.8880 > 192.168.43.195.7771: UDP, length 120
03:55:02.508535 IP 192.168.43.195.8880 > 192.168.43.124.7772: UDP, length 120
03:55:02.522816 IP 192.168.43.124.8880 > 192.168.43.195.7771: UDP, length 120
03:55:02.558529 IP 192.168.43.195.8880 > 192.168.43.124.7772: UDP, length 120
03:55:02.572812 IP 192.168.43.124.8880 > 192.168.43.195.7771: UDP, length 120
03:55:02.608530 IP 192.168.43.195.8880 > 192.168.43.124.7772: UDP, length 120
03:55:02.622887 IP 192.168.43.124.8880 > 192.168.43.195.7771: UDP, length 120
03:55:02.658537 IP 192.168.43.195.8880 > 192.168.43.124.7772: UDP, length 120
03:55:02.673150 IP 192.168.43.124.8880 > 192.168.43.195.7771: UDP, length 120
03:55:02.708530 IP 192.168.43.195.8880 > 192.168.43.124.7772: UDP, length 120
03:55:02.723759 IP 192.168.43.124.8880 > 192.168.43.195.7771: UDP, length 120
03:55:02.758542 IP 192.168.43.195.8880 > 192.168.43.124.7772: UDP, length 120
03:55:02.773197 IP 192.168.43.124.8880 > 192.168.43.195.7771: UDP, length 120
03:55:02.808536 IP 192.168.43.195.8880 > 192.168.43.124.7772: UDP, length 120
03:55:02.822816 IP 192.168.43.124.8880 > 192.168.43.195.7771: UDP, length 120
03:55:02.858530 IP 192.168.43.195.8880 > 192.168.43.124.7772: UDP, length 120
03:55:02.872833 IP 192.168.43.124.8880 > 192.168.43.195.7771: UDP, length 120
03:55:02.908540 IP 192.168.43.195.8880 > 192.168.43.124.7772: UDP, length 120
03:55:02.922903 IP 192.168.43.124.8880 > 192.168.43.195.7771: UDP, length 120
03:55:02.958540 IP 192.168.43.195.8880 > 192.168.43.124.7772: UDP, length 120
03:55:02.973414 IP 192.168.43.124.8880 > 192.168.43.195.7771: UDP, length 120
03:55:03.008547 IP 192.168.43.195.8880 > 192.168.43.124.7772: UDP, length 120
03:55:03.023161 IP 192.168.43.124.8880 > 192.168.43.195.7771: UDP, length 120
03:55:03.058532 IP 192.168.43.195.8880 > 192.168.43.124.7772: UDP, length 120
03:55:03.074362 IP 192.168.43.124.8880 > 192.168.43.195.7771: UDP, length 120
03:55:03.108530 IP 192.168.43.195.8880 > 192.168.43.124.7772: UDP, length 120
03:55:03.154414 IP 192.168.43.124.8880 > 192.168.43.195.7771: UDP, length 120
03:55:03.158526 IP 192.168.43.195.8880 > 192.168.43.124.7772: UDP, length 120
03:55:03.187174 IP 192.168.43.124.8880 > 192.168.43.195.7771: UDP, length 120
03:55:03.208538 IP 192.168.43.195.8880 > 192.168.43.124.7772: UDP, length 120
03:55:03.221672 IP 192.168.43.124.8880 > 192.168.43.195.7771: UDP, length 120
03:55:03.258539 IP 192.168.43.195.8880 > 192.168.43.124.7772: UDP, length 120
03:55:03.283574 IP 192.168.43.124.8880 > 192.168.43.195.7771: UDP, length 120
03:55:03.308530 IP 192.168.43.195.8880 > 192.168.43.124.7772: UDP, length 120
03:55:03.323350 IP 192.168.43.124.8880 > 192.168.43.195.7771: UDP, length 120
03:55:03.358568 IP 192.168.43.195.8880 > 192.168.43.124.7772: UDP, length 120
03:55:03.376258 IP 192.168.43.124.8880 > 192.168.43.195.7771: UDP, length 120
03:55:03.408532 IP 192.168.43.195.8880 > 192.168.43.124.7772: UDP, length 120
03:55:03.422831 IP 192.168.43.124.8880 > 192.168.43.195.7771: UDP, length 120
03:55:03.458541 IP 192.168.43.195.8880 > 192.168.43.124.7772: UDP, length 120
03:55:03.472404 IP 192.168.43.124.8880 > 192.168.43.195.7771: UDP, length 120
03:55:03.508538 IP 192.168.43.195.8880 > 192.168.43.124.7772: UDP, length 120
03:55:03.522894 IP 192.168.43.124.8880 > 192.168.43.195.7771: UDP, length 120
03:55:03.558539 IP 192.168.43.195.8880 > 192.168.43.124.7772: UDP, length 120
03:55:03.574400 IP 192.168.43.124.8880 > 192.168.43.195.7771: UDP, length 120
03:55:03.608532 IP 192.168.43.195.8880 > 192.168.43.124.7772: UDP, length 120
03:55:03.622869 IP 192.168.43.124.8880 > 192.168.43.195.7771: UDP, length 120
03:55:03.658540 IP 192.168.43.195.8880 > 192.168.43.124.7772: UDP, length 120
03:55:03.673087 IP 192.168.43.124.8880 > 192.168.43.195.7771: UDP, length 120
03:55:03.708529 IP 192.168.43.195.8880 > 192.168.43.124.7772: UDP, length 120
03:55:03.723108 IP 192.168.43.124.8880 > 192.168.43.195.7771: UDP, length 120
03:55:03.758543 IP 192.168.43.195.8880 > 192.168.43.124.7772: UDP, length 120
03:55:03.773939 IP 192.168.43.124.8880 > 192.168.43.195.7771: UDP, length 120
03:55:03.808540 IP 192.168.43.195.8880 > 192.168.43.124.7772: UDP, length 120
03:55:03.822877 IP 192.168.43.124.8880 > 192.168.43.195.7771: UDP, length 120
03:55:03.858531 IP 192.168.43.195.8880 > 192.168.43.124.7772: UDP, length 120
03:55:03.874152 IP 192.168.43.124.8880 > 192.168.43.195.7771: UDP, length 120
03:55:03.908537 IP 192.168.43.195.8880 > 192.168.43.124.7772: UDP, length 120
03:55:03.921633 IP 192.168.43.124.8880 > 192.168.43.195.7771: UDP, length 120
03:55:03.958524 IP 192.168.43.195.8880 > 192.168.43.124.7772: UDP, length 120
03:55:03.972520 IP 192.168.43.124.8880 > 192.168.43.195.7771: UDP, length 120
03:55:04.008562 IP 192.168.43.195.8880 > 192.168.43.124.7772: UDP, length 120
03:55:04.022019 IP 192.168.43.124.8880 > 192.168.43.195.7771: UDP, length 120
03:55:04.058532 IP 192.168.43.195.8880 > 192.168.43.124.7772: UDP, length 120
03:55:04.073119 IP 192.168.43.124.8880 > 192.168.43.195.7771: UDP, length 120
03:55:04.108533 IP 192.168.43.195.8880 > 192.168.43.124.7772: UDP, length 120
03:55:04.127271 IP 192.168.43.124.8880 > 192.168.43.195.7771: UDP, length 120
03:55:04.158543 IP 192.168.43.195.8880 > 192.168.43.124.7772: UDP, length 120
03:55:04.173918 IP 192.168.43.124.8880 > 192.168.43.195.7771: UDP, length 120
03:55:04.208531 IP 192.168.43.195.8880 > 192.168.43.124.7772: UDP, length 120
03:55:04.223964 IP 192.168.43.124.8880 > 192.168.43.195.7771: UDP, length 120
03:55:04.258529 IP 192.168.43.195.8880 > 192.168.43.124.7772: UDP, length 120
03:55:04.273102 IP 192.168.43.124.8880 > 192.168.43.195.7771: UDP, length 120
03:55:04.308528 IP 192.168.43.195.8880 > 192.168.43.124.7772: UDP, length 120
03:55:04.323147 IP 192.168.43.124.8880 > 192.168.43.195.7771: UDP, length 120
03:55:04.358530 IP 192.168.43.195.8880 > 192.168.43.124.7772: UDP, length 120
03:55:04.373222 IP 192.168.43.124.8880 > 192.168.43.195.7771: UDP, length 120
03:55:04.408523 IP 192.168.43.195.8880 > 192.168.43.124.7772: UDP, length 120
03:55:04.444970 IP 192.168.43.124.8880 > 192.168.43.195.7771: UDP, length 120
03:55:04.458534 IP 192.168.43.195.8880 > 192.168.43.124.7772: UDP, length 120
03:55:04.474631 IP 192.168.43.124.8880 > 192.168.43.195.7771: UDP, length 120
03:55:04.508537 IP 192.168.43.195.8880 > 192.168.43.124.7772: UDP, length 120
03:55:04.523172 IP 192.168.43.124.8880 > 192.168.43.195.7771: UDP, length 120
03:55:04.558526 IP 192.168.43.195.8880 > 192.168.43.124.7772: UDP, length 120
03:55:04.572870 IP 192.168.43.124.8880 > 192.168.43.195.7771: UDP, length 120
03:55:04.608528 IP 192.168.43.195.8880 > 192.168.43.124.7772: UDP, length 120
03:55:04.623131 IP 192.168.43.124.8880 > 192.168.43.195.7771: UDP, length 120
03:55:04.658529 IP 192.168.43.195.8880 > 192.168.43.124.7772: UDP, length 120
03:55:04.673167 IP 192.168.43.124.8880 > 192.168.43.195.7771: UDP, length 120
03:55:04.708525 IP 192.168.43.195.8880 > 192.168.43.124.7772: UDP, length 120
03:55:04.722860 IP 192.168.43.124.8880 > 192.168.43.195.7771: UDP, length 120
03:55:04.758542 IP 192.168.43.195.8880 > 192.168.43.124.7772: UDP, length 120
03:55:04.773743 IP 192.168.43.124.8880 > 192.168.43.195.7771: UDP, length 120
03:55:04.808542 IP 192.168.43.195.8880 > 192.168.43.124.7772: UDP, length 120
03:55:04.823171 IP 192.168.43.124.8880 > 192.168.43.195.7771: UDP, length 120
03:55:04.858566 IP 192.168.43.195.8880 > 192.168.43.124.7772: UDP, length 120
03:55:04.873138 IP 192.168.43.124.8880 > 192.168.43.195.7771: UDP, length 120
03:55:04.908527 IP 192.168.43.195.8880 > 192.168.43.124.7772: UDP, length 120
03:55:04.922994 IP 192.168.43.124.8880 > 192.168.43.195.7771: UDP, length 120
03:55:04.958527 IP 192.168.43.195.8880 > 192.168.43.124.7772: UDP, length 120
03:55:04.973180 IP 192.168.43.124.8880 > 192.168.43.195.7771: UDP, length 120
03:55:05.008544 IP 192.168.43.195.8880 > 192.168.43.124.7772: UDP, length 120
03:55:05.022878 IP 192.168.43.124.8880 > 192.168.43.195.7771: UDP, length 120
03:55:05.058528 IP 192.168.43.195.8880 > 192.168.43.124.7772: UDP, length 120
03:55:05.072894 IP 192.168.43.124.8880 > 192.168.43.195.7771: UDP, length 120
03:55:05.108524 IP 192.168.43.195.8880 > 192.168.43.124.7772: UDP, length 120
03:55:05.123153 IP 192.168.43.124.8880 > 192.168.43.195.7771: UDP, length 120
03:55:05.158525 IP 192.168.43.195.8880 > 192.168.43.124.7772: UDP, length 120
03:55:05.173395 IP 192.168.43.124.8880 > 192.168.43.195.7771: UDP, length 120
03:55:05.208523 IP 192.168.43.195.8880 > 192.168.43.124.7772: UDP, length 120
03:55:05.258523 IP 192.168.43.195.8880 > 192.168.43.124.7772: UDP, length 120
03:55:05.275872 IP 192.168.43.124.8880 > 192.168.43.195.7771: UDP, length 120
03:55:05.308530 IP 192.168.43.195.8880 > 192.168.43.124.7772: UDP, length 120
03:55:05.312768 IP 192.168.43.124.8880 > 192.168.43.195.7771: UDP, length 120
03:55:05.348489 IP 192.168.43.124.8880 > 192.168.43.195.7771: UDP, length 120
03:55:05.358523 IP 192.168.43.195.8880 > 192.168.43.124.7772: UDP, length 120
03:55:05.406524 IP 192.168.43.124.8880 > 192.168.43.195.7771: UDP, length 120
03:55:05.408522 IP 192.168.43.195.8880 > 192.168.43.124.7772: UDP, length 120
03:55:05.458522 IP 192.168.43.195.8880 > 192.168.43.124.7772: UDP, length 120
03:55:05.508671 IP 192.168.43.195.8880 > 192.168.43.124.7772: UDP, length 120
03:55:05.512050 IP 192.168.43.124.8880 > 192.168.43.195.7771: UDP, length 120
03:55:05.512290 IP 192.168.43.124.8880 > 192.168.43.195.7771: UDP, length 120
03:55:05.558533 IP 192.168.43.195.8880 > 192.168.43.124.7772: UDP, length 120
03:55:05.604798 IP 192.168.43.124.8880 > 192.168.43.195.7771: UDP, length 120
03:55:05.605039 IP 192.168.43.124.8880 > 192.168.43.195.7771: UDP, length 120
03:55:05.608523 IP 192.168.43.195.8880 > 192.168.43.124.7772: UDP, length 120
03:55:05.658525 IP 192.168.43.195.8880 > 192.168.43.124.7772: UDP, length 120
03:55:05.686919 IP 192.168.43.124.8880 > 192.168.43.195.7771: UDP, length 120
03:55:05.687163 IP 192.168.43.124.8880 > 192.168.43.195.7771: UDP, length 120
03:55:05.708526 IP 192.168.43.195.8880 > 192.168.43.124.7772: UDP, length 120
03:55:05.751368 IP 192.168.43.124.8880 > 192.168.43.195.7771: UDP, length 120
03:55:05.758521 IP 192.168.43.195.8880 > 192.168.43.124.7772: UDP, length 120
03:55:05.805364 IP 192.168.43.124.8880 > 192.168.43.195.7771: UDP, length 120
03:55:05.808529 IP 192.168.43.195.8880 > 192.168.43.124.7772: UDP, length 120
03:55:05.858527 IP 192.168.43.195.8880 > 192.168.43.124.7772: UDP, length 120
03:55:05.861182 IP 192.168.43.124.8880 > 192.168.43.195.7771: UDP, length 120
03:55:05.872933 IP 192.168.43.124.8880 > 192.168.43.195.7771: UDP, length 120
03:55:05.908529 IP 192.168.43.195.8880 > 192.168.43.124.7772: UDP, length 120
03:55:05.924797 IP 192.168.43.124.8880 > 192.168.43.195.7771: UDP, length 120
03:55:05.958542 IP 192.168.43.195.8880 > 192.168.43.124.7772: UDP, length 120
03:55:05.973036 IP 192.168.43.124.8880 > 192.168.43.195.7771: UDP, length 120
03:55:06.008552 IP 192.168.43.195.8880 > 192.168.43.124.7772: UDP, length 120
03:55:06.021521 IP 192.168.43.124.8880 > 192.168.43.195.7771: UDP, length 120
03:55:06.058532 IP 192.168.43.195.8880 > 192.168.43.124.7772: UDP, length 120
03:55:06.072891 IP 192.168.43.124.8880 > 192.168.43.195.7771: UDP, length 120
03:55:06.108525 IP 192.168.43.195.8880 > 192.168.43.124.7772: UDP, length 120
03:55:06.123146 IP 192.168.43.124.8880 > 192.168.43.195.7771: UDP, length 120
03:55:06.158526 IP 192.168.43.195.8880 > 192.168.43.124.7772: UDP, length 120
03:55:06.172934 IP 192.168.43.124.8880 > 192.168.43.195.7771: UDP, length 120
03:55:06.208537 IP 192.168.43.195.8880 > 192.168.43.124.7772: UDP, length 120
03:55:06.223811 IP 192.168.43.124.8880 > 192.168.43.195.7771: UDP, length 120
03:55:06.258536 IP 192.168.43.195.8880 > 192.168.43.124.7772: UDP, length 120
03:55:06.274103 IP 192.168.43.124.8880 > 192.168.43.195.7771: UDP, length 120
03:55:06.308536 IP 192.168.43.195.8880 > 192.168.43.124.7772: UDP, length 120
03:55:06.324878 IP 192.168.43.124.8880 > 192.168.43.195.7771: UDP, length 120
03:55:06.358565 IP 192.168.43.195.8880 > 192.168.43.124.7772: UDP, length 120
03:55:06.374442 IP 192.168.43.124.8880 > 192.168.43.195.7771: UDP, length 120
03:55:06.408527 IP 192.168.43.195.8880 > 192.168.43.124.7772: UDP, length 120
03:55:06.423186 IP 192.168.43.124.8880 > 192.168.43.195.7771: UDP, length 120
03:55:06.458545 IP 192.168.43.195.8880 > 192.168.43.124.7772: UDP, length 120
03:55:06.473162 IP 192.168.43.124.8880 > 192.168.43.195.7771: UDP, length 120
03:55:06.508535 IP 192.168.43.195.8880 > 192.168.43.124.7772: UDP, length 120
03:55:06.523150 IP 192.168.43.124.8880 > 192.168.43.195.7771: UDP, length 120
03:55:06.558539 IP 192.168.43.195.8880 > 192.168.43.124.7772: UDP, length 120
03:55:06.572143 IP 192.168.43.124.8880 > 192.168.43.195.7771: UDP, length 120
03:55:06.608525 IP 192.168.43.195.8880 > 192.168.43.124.7772: UDP, length 120
03:55:06.623147 IP 192.168.43.124.8880 > 192.168.43.195.7771: UDP, length 120
03:55:06.658535 IP 192.168.43.195.8880 > 192.168.43.124.7772: UDP, length 120
03:55:06.672894 IP 192.168.43.124.8880 > 192.168.43.195.7771: UDP, length 120
03:55:06.708526 IP 192.168.43.195.8880 > 192.168.43.124.7772: UDP, length 120
03:55:06.723716 IP 192.168.43.124.8880 > 192.168.43.195.7771: UDP, length 120
03:55:06.758540 IP 192.168.43.195.8880 > 192.168.43.124.7772: UDP, length 120
03:55:06.773751 IP 192.168.43.124.8880 > 192.168.43.195.7771: UDP, length 120
03:55:06.808544 IP 192.168.43.195.8880 > 192.168.43.124.7772: UDP, length 120
03:55:06.822904 IP 192.168.43.124.8880 > 192.168.43.195.7771: UDP, length 120
03:55:06.858532 IP 192.168.43.195.8880 > 192.168.43.124.7772: UDP, length 120
03:55:06.908528 IP 192.168.43.195.8880 > 192.168.43.124.7772: UDP, length 120
03:55:06.911958 IP 192.168.43.124.8880 > 192.168.43.195.7771: UDP, length 120
03:55:06.923121 IP 192.168.43.124.8880 > 192.168.43.195.7771: UDP, length 120
03:55:06.958539 IP 192.168.43.195.8880 > 192.168.43.124.7772: UDP, length 120
03:55:06.973164 IP 192.168.43.124.8880 > 192.168.43.195.7771: UDP, length 120
03:55:07.008540 IP 192.168.43.195.8880 > 192.168.43.124.7772: UDP, length 120
03:55:07.023038 IP 192.168.43.124.8880 > 192.168.43.195.7771: UDP, length 120
03:55:07.058527 IP 192.168.43.195.8880 > 192.168.43.124.7772: UDP, length 120
03:55:07.071726 IP 192.168.43.124.8880 > 192.168.43.195.7771: UDP, length 120
03:55:07.108536 IP 192.168.43.195.8880 > 192.168.43.124.7772: UDP, length 120
03:55:07.135797 IP 192.168.43.124.8880 > 192.168.43.195.7771: UDP, length 120
03:55:07.158525 IP 192.168.43.195.8880 > 192.168.43.124.7772: UDP, length 120
03:55:07.173141 IP 192.168.43.124.8880 > 192.168.43.195.7771: UDP, length 120
03:55:07.208524 IP 192.168.43.195.8880 > 192.168.43.124.7772: UDP, length 120
03:55:07.222916 IP 192.168.43.124.8880 > 192.168.43.195.7771: UDP, length 120
03:55:07.258525 IP 192.168.43.195.8880 > 192.168.43.124.7772: UDP, length 120
03:55:07.271686 IP 192.168.43.124.8880 > 192.168.43.195.7771: UDP, length 120
03:55:07.308524 IP 192.168.43.195.8880 > 192.168.43.124.7772: UDP, length 120
03:55:07.323465 IP 192.168.43.124.8880 > 192.168.43.195.7771: UDP, length 120
03:55:07.358524 IP 192.168.43.195.8880 > 192.168.43.124.7772: UDP, length 120
03:55:07.374701 IP 192.168.43.124.8880 > 192.168.43.195.7771: UDP, length 120
03:55:07.408523 IP 192.168.43.195.8880 > 192.168.43.124.7772: UDP, length 120
03:55:07.426038 IP 192.168.43.124.8880 > 192.168.43.195.7771: UDP, length 120
03:55:07.458528 IP 192.168.43.195.8880 > 192.168.43.124.7772: UDP, length 120
03:55:07.481855 IP 192.168.43.124.8880 > 192.168.43.195.7771: UDP, length 120
03:55:07.508526 IP 192.168.43.195.8880 > 192.168.43.124.7772: UDP, length 120
03:55:07.522921 IP 192.168.43.124.8880 > 192.168.43.195.7771: UDP, length 120
03:55:07.558523 IP 192.168.43.195.8880 > 192.168.43.124.7772: UDP, length 120
03:55:07.574741 IP 192.168.43.124.8880 > 192.168.43.195.7771: UDP, length 120
03:55:07.608525 IP 192.168.43.195.8880 > 192.168.43.124.7772: UDP, length 120
03:55:07.623239 IP 192.168.43.124.8880 > 192.168.43.195.7771: UDP, length 120
03:55:07.658527 IP 192.168.43.195.8880 > 192.168.43.124.7772: UDP, length 120
03:55:07.687170 IP 192.168.43.124.8880 > 192.168.43.195.7771: UDP, length 120
03:55:07.708537 IP 192.168.43.195.8880 > 192.168.43.124.7772: UDP, length 120
03:55:07.723075 IP 192.168.43.124.8880 > 192.168.43.195.7771: UDP, length 120
03:55:07.758524 IP 192.168.43.195.8880 > 192.168.43.124.7772: UDP, length 120
03:55:07.774897 IP 192.168.43.124.8880 > 192.168.43.195.7771: UDP, length 120
03:55:07.808528 IP 192.168.43.195.8880 > 192.168.43.124.7772: UDP, length 120
03:55:07.822958 IP 192.168.43.124.8880 > 192.168.43.195.7771: UDP, length 120
03:55:07.858563 IP 192.168.43.195.8880 > 192.168.43.124.7772: UDP, length 120
03:55:07.873209 IP 192.168.43.124.8880 > 192.168.43.195.7771: UDP, length 120
03:55:07.908526 IP 192.168.43.195.8880 > 192.168.43.124.7772: UDP, length 120
03:55:07.923188 IP 192.168.43.124.8880 > 192.168.43.195.7771: UDP, length 120
03:55:07.958545 IP 192.168.43.195.8880 > 192.168.43.124.7772: UDP, length 120
03:55:07.975077 IP 192.168.43.124.8880 > 192.168.43.195.7771: UDP, length 120
03:55:08.008545 IP 192.168.43.195.8880 > 192.168.43.124.7772: UDP, length 120
03:55:08.022957 IP 192.168.43.124.8880 > 192.168.43.195.7771: UDP, length 120
03:55:08.058540 IP 192.168.43.195.8880 > 192.168.43.124.7772: UDP, length 120
03:55:08.075322 IP 192.168.43.124.8880 > 192.168.43.195.7771: UDP, length 120
03:55:08.108535 IP 192.168.43.195.8880 > 192.168.43.124.7772: UDP, length 120
03:55:08.123407 IP 192.168.43.124.8880 > 192.168.43.195.7771: UDP, length 120
03:55:08.158531 IP 192.168.43.195.8880 > 192.168.43.124.7772: UDP, length 120
03:55:08.175085 IP 192.168.43.124.8880 > 192.168.43.195.7771: UDP, length 120
03:55:08.208535 IP 192.168.43.195.8880 > 192.168.43.124.7772: UDP, length 120
03:55:08.221564 IP 192.168.43.124.8880 > 192.168.43.195.7771: UDP, length 120
03:55:08.258537 IP 192.168.43.195.8880 > 192.168.43.124.7772: UDP, length 120
03:55:08.308523 IP 192.168.43.195.8880 > 192.168.43.124.7772: UDP, length 120
03:55:08.358523 IP 192.168.43.195.8880 > 192.168.43.124.7772: UDP, length 120
03:55:08.408528 IP 192.168.43.195.8880 > 192.168.43.124.7772: UDP, length 120
03:55:08.415199 IP 192.168.43.124.8880 > 192.168.43.195.7771: UDP, length 120
03:55:08.415444 IP 192.168.43.124.8880 > 192.168.43.195.7771: UDP, length 120
03:55:08.458539 IP 192.168.43.195.8880 > 192.168.43.124.7772: UDP, length 120
03:55:08.508577 IP 192.168.43.195.8880 > 192.168.43.124.7772: UDP, length 120
03:55:08.515042 IP 192.168.43.124.8880 > 192.168.43.195.7771: UDP, length 120
03:55:08.515308 IP 192.168.43.124.8880 > 192.168.43.195.7771: UDP, length 120
03:55:08.558529 IP 192.168.43.195.8880 > 192.168.43.124.7772: UDP, length 120
03:55:08.608523 IP 192.168.43.195.8880 > 192.168.43.124.7772: UDP, length 120
03:55:08.615119 IP 192.168.43.124.8880 > 192.168.43.195.7771: UDP, length 120
03:55:08.615362 IP 192.168.43.124.8880 > 192.168.43.195.7771: UDP, length 120
03:55:08.658529 IP 192.168.43.195.8880 > 192.168.43.124.7772: UDP, length 120
03:55:08.708541 IP 192.168.43.195.8880 > 192.168.43.124.7772: UDP, length 120
03:55:08.715798 IP 192.168.43.124.8880 > 192.168.43.195.7771: UDP, length 120
03:55:08.716045 IP 192.168.43.124.8880 > 192.168.43.195.7771: UDP, length 120
03:55:08.758533 IP 192.168.43.195.8880 > 192.168.43.124.7772: UDP, length 120
03:55:08.808527 IP 192.168.43.195.8880 > 192.168.43.124.7772: UDP, length 120
03:55:08.815183 IP 192.168.43.124.8880 > 192.168.43.195.7771: UDP, length 120
03:55:08.815434 IP 192.168.43.124.8880 > 192.168.43.195.7771: UDP, length 120
03:55:08.858530 IP 192.168.43.195.8880 > 192.168.43.124.7772: UDP, length 120
03:55:08.908539 IP 192.168.43.195.8880 > 192.168.43.124.7772: UDP, length 120
03:55:08.915110 IP 192.168.43.124.8880 > 192.168.43.195.7771: UDP, length 120
03:55:08.915394 IP 192.168.43.124.8880 > 192.168.43.195.7771: UDP, length 120
03:55:08.958534 IP 192.168.43.195.8880 > 192.168.43.124.7772: UDP, length 120
03:55:09.008560 IP 192.168.43.195.8880 > 192.168.43.124.7772: UDP, length 120
03:55:09.016862 IP 192.168.43.124.8880 > 192.168.43.195.7771: UDP, length 120
03:55:09.017174 IP 192.168.43.124.8880 > 192.168.43.195.7771: UDP, length 120
03:55:09.058558 IP 192.168.43.195.8880 > 192.168.43.124.7772: UDP, length 120
03:55:09.108539 IP 192.168.43.195.8880 > 192.168.43.124.7772: UDP, length 120
03:55:09.115511 IP 192.168.43.124.8880 > 192.168.43.195.7771: UDP, length 120
03:55:09.115781 IP 192.168.43.124.8880 > 192.168.43.195.7771: UDP, length 120
03:55:09.158549 IP 192.168.43.195.8880 > 192.168.43.124.7772: UDP, length 120
03:55:09.208533 IP 192.168.43.195.8880 > 192.168.43.124.7772: UDP, length 120
03:55:09.216470 IP 192.168.43.124.8880 > 192.168.43.195.7771: UDP, length 120
03:55:09.216603 IP 192.168.43.124.8880 > 192.168.43.195.7771: UDP, length 120
03:55:09.258548 IP 192.168.43.195.8880 > 192.168.43.124.7772: UDP, length 120
03:55:09.308520 IP 192.168.43.195.8880 > 192.168.43.124.7772: UDP, length 120
03:55:09.320351 IP 192.168.43.124.8880 > 192.168.43.195.7771: UDP, length 120
03:55:09.320699 IP 192.168.43.124.8880 > 192.168.43.195.7771: UDP, length 120
03:55:09.358581 IP 192.168.43.195.8880 > 192.168.43.124.7772: UDP, length 120
03:55:09.408526 IP 192.168.43.195.8880 > 192.168.43.124.7772: UDP, length 120
03:55:09.418054 IP 192.168.43.124.8880 > 192.168.43.195.7771: UDP, length 120
03:55:09.418304 IP 192.168.43.124.8880 > 192.168.43.195.7771: UDP, length 120
03:55:09.458560 IP 192.168.43.195.8880 > 192.168.43.124.7772: UDP, length 120
03:55:09.508533 IP 192.168.43.195.8880 > 192.168.43.124.7772: UDP, length 120
03:55:09.516890 IP 192.168.43.124.8880 > 192.168.43.195.7771: UDP, length 120
03:55:09.517163 IP 192.168.43.124.8880 > 192.168.43.195.7771: UDP, length 120
03:55:09.558535 IP 192.168.43.195.8880 > 192.168.43.124.7772: UDP, length 120
03:55:09.608524 IP 192.168.43.195.8880 > 192.168.43.124.7772: UDP, length 120
03:55:09.626079 IP 192.168.43.124.8880 > 192.168.43.195.7771: UDP, length 120
03:55:09.626311 IP 192.168.43.124.8880 > 192.168.43.195.7771: UDP, length 120
03:55:09.658533 IP 192.168.43.195.8880 > 192.168.43.124.7772: UDP, length 120
03:55:09.708523 IP 192.168.43.195.8880 > 192.168.43.124.7772: UDP, length 120
03:55:09.726119 IP 192.168.43.124.8880 > 192.168.43.195.7771: UDP, length 120
03:55:09.726390 IP 192.168.43.124.8880 > 192.168.43.195.7771: UDP, length 120
03:55:09.758539 IP 192.168.43.195.8880 > 192.168.43.124.7772: UDP, length 120
03:55:09.808535 IP 192.168.43.195.8880 > 192.168.43.124.7772: UDP, length 120
03:55:09.827697 IP 192.168.43.124.8880 > 192.168.43.195.7771: UDP, length 120
03:55:09.827933 IP 192.168.43.124.8880 > 192.168.43.195.7771: UDP, length 120
03:55:09.828057 IP 192.168.43.124.8880 > 192.168.43.195.7771: UDP, length 120
03:55:09.858530 IP 192.168.43.195.8880 > 192.168.43.124.7772: UDP, length 120
03:55:09.908527 IP 192.168.43.195.8880 > 192.168.43.124.7772: UDP, length 120
03:55:09.925040 IP 192.168.43.124.8880 > 192.168.43.195.7771: UDP, length 120
03:55:09.925280 IP 192.168.43.124.8880 > 192.168.43.195.7771: UDP, length 120
03:55:09.958531 IP 192.168.43.195.8880 > 192.168.43.124.7772: UDP, length 120
03:55:10.008555 IP 192.168.43.195.8880 > 192.168.43.124.7772: UDP, length 120
03:55:10.058533 IP 192.168.43.195.8880 > 192.168.43.124.7772: UDP, length 120
03:55:10.059511 IP 192.168.43.124.8880 > 192.168.43.195.7771: UDP, length 120
03:55:10.059776 IP 192.168.43.124.8880 > 192.168.43.195.7771: UDP, length 120
03:55:10.108527 IP 192.168.43.195.8880 > 192.168.43.124.7772: UDP, length 120
03:55:10.158530 IP 192.168.43.195.8880 > 192.168.43.124.7772: UDP, length 120
03:55:10.166175 IP 192.168.43.124.8880 > 192.168.43.195.7771: UDP, length 120
03:55:10.167113 IP 192.168.43.124.8880 > 192.168.43.195.7771: UDP, length 120
03:55:10.208527 IP 192.168.43.195.8880 > 192.168.43.124.7772: UDP, length 120
03:55:10.258521 IP 192.168.43.195.8880 > 192.168.43.124.7772: UDP, length 120
03:55:10.265759 IP 192.168.43.124.8880 > 192.168.43.195.7771: UDP, length 120
03:55:10.265880 IP 192.168.43.124.8880 > 192.168.43.195.7771: UDP, length 120
03:55:10.308534 IP 192.168.43.195.8880 > 192.168.43.124.7772: UDP, length 120
03:55:10.358521 IP 192.168.43.195.8880 > 192.168.43.124.7772: UDP, length 120
03:55:10.365753 IP 192.168.43.124.8880 > 192.168.43.195.7771: UDP, length 120
03:55:10.366575 IP 192.168.43.124.8880 > 192.168.43.195.7771: UDP, length 120
03:55:10.408523 IP 192.168.43.195.8880 > 192.168.43.124.7772: UDP, length 120
03:55:10.458521 IP 192.168.43.195.8880 > 192.168.43.124.7772: UDP, length 120
03:55:10.466052 IP 192.168.43.124.8880 > 192.168.43.195.7771: UDP, length 120
03:55:10.466891 IP 192.168.43.124.8880 > 192.168.43.195.7771: UDP, length 120
03:55:10.508528 IP 192.168.43.195.8880 > 192.168.43.124.7772: UDP, length 120
03:55:10.558534 IP 192.168.43.195.8880 > 192.168.43.124.7772: UDP, length 120
03:55:10.575208 IP 192.168.43.124.8880 > 192.168.43.195.7771: UDP, length 120
03:55:10.575473 IP 192.168.43.124.8880 > 192.168.43.195.7771: UDP, length 120
03:55:10.575592 IP 192.168.43.124.8880 > 192.168.43.195.7771: UDP, length 120
03:55:10.608527 IP 192.168.43.195.8880 > 192.168.43.124.7772: UDP, length 120
03:55:10.658521 IP 192.168.43.195.8880 > 192.168.43.124.7772: UDP, length 120
03:55:10.673348 IP 192.168.43.124.8880 > 192.168.43.195.7771: UDP, length 120
03:55:10.673597 IP 192.168.43.124.8880 > 192.168.43.195.7771: UDP, length 120
03:55:10.708525 IP 192.168.43.195.8880 > 192.168.43.124.7772: UDP, length 120
03:55:10.723278 IP 192.168.43.124.8880 > 192.168.43.195.7771: UDP, length 120
03:55:10.758524 IP 192.168.43.195.8880 > 192.168.43.124.7772: UDP, length 120
03:55:10.773357 IP 192.168.43.124.8880 > 192.168.43.195.7771: UDP, length 120
03:55:10.808527 IP 192.168.43.195.8880 > 192.168.43.124.7772: UDP, length 120
03:55:10.854780 IP 192.168.43.124.8880 > 192.168.43.195.7771: UDP, length 120
03:55:10.858563 IP 192.168.43.195.8880 > 192.168.43.124.7772: UDP, length 120
03:55:10.873237 IP 192.168.43.124.8880 > 192.168.43.195.7771: UDP, length 120
03:55:10.908537 IP 192.168.43.195.8880 > 192.168.43.124.7772: UDP, length 120
03:55:10.923175 IP 192.168.43.124.8880 > 192.168.43.195.7771: UDP, length 120
03:55:10.958525 IP 192.168.43.195.8880 > 192.168.43.124.7772: UDP, length 120
03:55:10.973349 IP 192.168.43.124.8880 > 192.168.43.195.7771: UDP, length 120
03:55:11.008530 IP 192.168.43.195.8880 > 192.168.43.124.7772: UDP, length 120
03:55:11.025277 IP 192.168.43.124.8880 > 192.168.43.195.7771: UDP, length 120
03:55:11.058525 IP 192.168.43.195.8880 > 192.168.43.124.7772: UDP, length 120
03:55:11.073378 IP 192.168.43.124.8880 > 192.168.43.195.7771: UDP, length 120
03:55:11.108523 IP 192.168.43.195.8880 > 192.168.43.124.7772: UDP, length 120
03:55:11.126341 IP 192.168.43.124.8880 > 192.168.43.195.7771: UDP, length 120
03:55:11.158566 IP 192.168.43.195.8880 > 192.168.43.124.7772: UDP, length 120
03:55:11.172996 IP 192.168.43.124.8880 > 192.168.43.195.7771: UDP, length 120
03:55:11.208535 IP 192.168.43.195.8880 > 192.168.43.124.7772: UDP, length 120
03:55:11.223225 IP 192.168.43.124.8880 > 192.168.43.195.7771: UDP, length 120
03:55:11.258539 IP 192.168.43.195.8880 > 192.168.43.124.7772: UDP, length 120
03:55:11.273238 IP 192.168.43.124.8880 > 192.168.43.195.7771: UDP, length 120
03:55:11.308525 IP 192.168.43.195.8880 > 192.168.43.124.7772: UDP, length 120
03:55:11.323043 IP 192.168.43.124.8880 > 192.168.43.195.7771: UDP, length 120
03:55:11.358523 IP 192.168.43.195.8880 > 192.168.43.124.7772: UDP, length 120
03:55:11.373095 IP 192.168.43.124.8880 > 192.168.43.195.7771: UDP, length 120
03:55:11.408530 IP 192.168.43.195.8880 > 192.168.43.124.7772: UDP, length 120
03:55:11.424935 IP 192.168.43.124.8880 > 192.168.43.195.7771: UDP, length 120
03:55:11.458524 IP 192.168.43.195.8880 > 192.168.43.124.7772: UDP, length 120
03:55:11.473767 IP 192.168.43.124.8880 > 192.168.43.195.7771: UDP, length 120
03:55:11.508529 IP 192.168.43.195.8880 > 192.168.43.124.7772: UDP, length 120
03:55:11.523289 IP 192.168.43.124.8880 > 192.168.43.195.7771: UDP, length 120
03:55:11.558526 IP 192.168.43.195.8880 > 192.168.43.124.7772: UDP, length 120
03:55:11.573780 IP 192.168.43.124.8880 > 192.168.43.195.7771: UDP, length 120
03:55:11.608524 IP 192.168.43.195.8880 > 192.168.43.124.7772: UDP, length 120
03:55:11.623289 IP 192.168.43.124.8880 > 192.168.43.195.7771: UDP, length 120
03:55:11.658528 IP 192.168.43.195.8880 > 192.168.43.124.7772: UDP, length 120
03:55:11.675535 IP 192.168.43.124.8880 > 192.168.43.195.7771: UDP, length 120
03:55:11.708526 IP 192.168.43.195.8880 > 192.168.43.124.7772: UDP, length 120
03:55:11.723037 IP 192.168.43.124.8880 > 192.168.43.195.7771: UDP, length 120
03:55:11.758532 IP 192.168.43.195.8880 > 192.168.43.124.7772: UDP, length 120
03:55:11.781741 IP 192.168.43.124.8880 > 192.168.43.195.7771: UDP, length 120
03:55:11.808533 IP 192.168.43.195.8880 > 192.168.43.124.7772: UDP, length 120
03:55:11.823238 IP 192.168.43.124.8880 > 192.168.43.195.7771: UDP, length 120
03:55:11.858525 IP 192.168.43.195.8880 > 192.168.43.124.7772: UDP, length 120
03:55:11.884257 IP 192.168.43.124.8880 > 192.168.43.195.7771: UDP, length 120
03:55:11.908525 IP 192.168.43.195.8880 > 192.168.43.124.7772: UDP, length 120
03:55:11.924371 IP 192.168.43.124.8880 > 192.168.43.195.7771: UDP, length 120
03:55:11.958525 IP 192.168.43.195.8880 > 192.168.43.124.7772: UDP, length 120
03:55:11.973700 IP 192.168.43.124.8880 > 192.168.43.195.7771: UDP, length 120
03:55:12.008531 IP 192.168.43.195.8880 > 192.168.43.124.7772: UDP, length 120
03:55:12.023278 IP 192.168.43.124.8880 > 192.168.43.195.7771: UDP, length 120
03:55:12.058530 IP 192.168.43.195.8880 > 192.168.43.124.7772: UDP, length 120
03:55:12.074445 IP 192.168.43.124.8880 > 192.168.43.195.7771: UDP, length 120
03:55:12.108529 IP 192.168.43.195.8880 > 192.168.43.124.7772: UDP, length 120
03:55:12.125006 IP 192.168.43.124.8880 > 192.168.43.195.7771: UDP, length 120
03:55:12.158524 IP 192.168.43.195.8880 > 192.168.43.124.7772: UDP, length 120
03:55:12.173263 IP 192.168.43.124.8880 > 192.168.43.195.7771: UDP, length 120
03:55:12.208532 IP 192.168.43.195.8880 > 192.168.43.124.7772: UDP, length 120
03:55:12.223063 IP 192.168.43.124.8880 > 192.168.43.195.7771: UDP, length 120
03:55:12.258527 IP 192.168.43.195.8880 > 192.168.43.124.7772: UDP, length 120
03:55:12.274099 IP 192.168.43.124.8880 > 192.168.43.195.7771: UDP, length 120
03:55:12.308539 IP 192.168.43.195.8880 > 192.168.43.124.7772: UDP, length 120
03:55:12.323139 IP 192.168.43.124.8880 > 192.168.43.195.7771: UDP, length 120
03:55:12.358581 IP 192.168.43.195.8880 > 192.168.43.124.7772: UDP, length 120
03:55:12.373679 IP 192.168.43.124.8880 > 192.168.43.195.7771: UDP, length 120
03:55:12.408530 IP 192.168.43.195.8880 > 192.168.43.124.7772: UDP, length 120
03:55:12.423342 IP 192.168.43.124.8880 > 192.168.43.195.7771: UDP, length 120
03:55:12.458526 IP 192.168.43.195.8880 > 192.168.43.124.7772: UDP, length 120
03:55:12.473326 IP 192.168.43.124.8880 > 192.168.43.195.7771: UDP, length 120
03:55:12.508528 IP 192.168.43.195.8880 > 192.168.43.124.7772: UDP, length 120
03:55:12.523077 IP 192.168.43.124.8880 > 192.168.43.195.7771: UDP, length 120
03:55:12.558538 IP 192.168.43.195.8880 > 192.168.43.124.7772: UDP, length 120
03:55:12.573305 IP 192.168.43.124.8880 > 192.168.43.195.7771: UDP, length 120
03:55:12.608536 IP 192.168.43.195.8880 > 192.168.43.124.7772: UDP, length 120
03:55:12.623371 IP 192.168.43.124.8880 > 192.168.43.195.7771: UDP, length 120
03:55:12.658522 IP 192.168.43.195.8880 > 192.168.43.124.7772: UDP, length 120
03:55:12.675455 IP 192.168.43.124.8880 > 192.168.43.195.7771: UDP, length 120
03:55:12.708526 IP 192.168.43.195.8880 > 192.168.43.124.7772: UDP, length 120
03:55:12.723425 IP 192.168.43.124.8880 > 192.168.43.195.7771: UDP, length 120
03:55:12.758525 IP 192.168.43.195.8880 > 192.168.43.124.7772: UDP, length 120
03:55:12.773310 IP 192.168.43.124.8880 > 192.168.43.195.7771: UDP, length 120
03:55:12.808539 IP 192.168.43.195.8880 > 192.168.43.124.7772: UDP, length 120
03:55:12.823156 IP 192.168.43.124.8880 > 192.168.43.195.7771: UDP, length 120
03:55:12.858537 IP 192.168.43.195.8880 > 192.168.43.124.7772: UDP, length 120
03:55:12.873334 IP 192.168.43.124.8880 > 192.168.43.195.7771: UDP, length 120
03:55:12.908529 IP 192.168.43.195.8880 > 192.168.43.124.7772: UDP, length 120
03:55:12.923135 IP 192.168.43.124.8880 > 192.168.43.195.7771: UDP, length 120
03:55:12.958529 IP 192.168.43.195.8880 > 192.168.43.124.7772: UDP, length 120
03:55:12.974714 IP 192.168.43.124.8880 > 192.168.43.195.7771: UDP, length 120
03:55:13.008533 IP 192.168.43.195.8880 > 192.168.43.124.7772: UDP, length 120
03:55:13.021636 IP 192.168.43.124.8880 > 192.168.43.195.7771: UDP, length 120
03:55:13.058526 IP 192.168.43.195.8880 > 192.168.43.124.7772: UDP, length 120
03:55:13.074366 IP 192.168.43.124.8880 > 192.168.43.195.7771: UDP, length 120
03:55:13.108535 IP 192.168.43.195.8880 > 192.168.43.124.7772: UDP, length 120
03:55:13.124415 IP 192.168.43.124.8880 > 192.168.43.195.7771: UDP, length 120
03:55:13.158537 IP 192.168.43.195.8880 > 192.168.43.124.7772: UDP, length 120
03:55:13.173340 IP 192.168.43.124.8880 > 192.168.43.195.7771: UDP, length 120
03:55:13.208526 IP 192.168.43.195.8880 > 192.168.43.124.7772: UDP, length 120
03:55:13.223363 IP 192.168.43.124.8880 > 192.168.43.195.7771: UDP, length 120
03:55:13.258526 IP 192.168.43.195.8880 > 192.168.43.124.7772: UDP, length 120
03:55:13.273371 IP 192.168.43.124.8880 > 192.168.43.195.7771: UDP, length 120
03:55:13.308533 IP 192.168.43.195.8880 > 192.168.43.124.7772: UDP, length 120
03:55:13.323062 IP 192.168.43.124.8880 > 192.168.43.195.7771: UDP, length 120
03:55:13.358536 IP 192.168.43.195.8880 > 192.168.43.124.7772: UDP, length 120
03:55:13.373332 IP 192.168.43.124.8880 > 192.168.43.195.7771: UDP, length 120
03:55:13.408530 IP 192.168.43.195.8880 > 192.168.43.124.7772: UDP, length 120
03:55:13.423291 IP 192.168.43.124.8880 > 192.168.43.195.7771: UDP, length 120
03:55:13.458526 IP 192.168.43.195.8880 > 192.168.43.124.7772: UDP, length 120
03:55:13.472997 IP 192.168.43.124.8880 > 192.168.43.195.7771: UDP, length 120
03:55:13.508529 IP 192.168.43.195.8880 > 192.168.43.124.7772: UDP, length 120
03:55:13.521737 IP 192.168.43.124.8880 > 192.168.43.195.7771: UDP, length 120
03:55:13.558531 IP 192.168.43.195.8880 > 192.168.43.124.7772: UDP, length 120
03:55:13.571738 IP 192.168.43.124.8880 > 192.168.43.195.7771: UDP, length 120
03:55:13.608537 IP 192.168.43.195.8880 > 192.168.43.124.7772: UDP, length 120
03:55:13.623632 IP 192.168.43.124.8880 > 192.168.43.195.7771: UDP, length 120
03:55:13.658528 IP 192.168.43.195.8880 > 192.168.43.124.7772: UDP, length 120
03:55:13.673270 IP 192.168.43.124.8880 > 192.168.43.195.7771: UDP, length 120
03:55:13.708524 IP 192.168.43.195.8880 > 192.168.43.124.7772: UDP, length 120
03:55:13.725204 IP 192.168.43.124.8880 > 192.168.43.195.7771: UDP, length 120
03:55:13.758525 IP 192.168.43.195.8880 > 192.168.43.124.7772: UDP, length 120
03:55:13.775074 IP 192.168.43.124.8880 > 192.168.43.195.7771: UDP, length 120
03:55:13.808526 IP 192.168.43.195.8880 > 192.168.43.124.7772: UDP, length 120
03:55:13.826997 IP 192.168.43.124.8880 > 192.168.43.195.7771: UDP, length 120
03:55:13.858578 IP 192.168.43.195.8880 > 192.168.43.124.7772: UDP, length 120
03:55:13.873358 IP 192.168.43.124.8880 > 192.168.43.195.7771: UDP, length 120
03:55:13.908548 IP 192.168.43.195.8880 > 192.168.43.124.7772: UDP, length 120
03:55:13.933304 IP 192.168.43.124.8880 > 192.168.43.195.7771: UDP, length 120
03:55:13.958532 IP 192.168.43.195.8880 > 192.168.43.124.7772: UDP, length 120
03:55:13.973384 IP 192.168.43.124.8880 > 192.168.43.195.7771: UDP, length 120
03:55:14.008550 IP 192.168.43.195.8880 > 192.168.43.124.7772: UDP, length 120
03:55:14.033366 IP 192.168.43.124.8880 > 192.168.43.195.7771: UDP, length 120
03:55:14.058534 IP 192.168.43.195.8880 > 192.168.43.124.7772: UDP, length 120
03:55:14.075676 IP 192.168.43.124.8880 > 192.168.43.195.7771: UDP, length 120
03:55:14.108535 IP 192.168.43.195.8880 > 192.168.43.124.7772: UDP, length 120
03:55:14.124185 IP 192.168.43.124.8880 > 192.168.43.195.7771: UDP, length 120
03:55:14.158542 IP 192.168.43.195.8880 > 192.168.43.124.7772: UDP, length 120
03:55:14.173320 IP 192.168.43.124.8880 > 192.168.43.195.7771: UDP, length 120
03:55:14.208535 IP 192.168.43.195.8880 > 192.168.43.124.7772: UDP, length 120
03:55:14.224247 IP 192.168.43.124.8880 > 192.168.43.195.7771: UDP, length 120
03:55:14.258527 IP 192.168.43.195.8880 > 192.168.43.124.7772: UDP, length 120
03:55:14.271767 IP 192.168.43.124.8880 > 192.168.43.195.7771: UDP, length 120
03:55:14.308526 IP 192.168.43.195.8880 > 192.168.43.124.7772: UDP, length 120
03:55:14.323300 IP 192.168.43.124.8880 > 192.168.43.195.7771: UDP, length 120
03:55:14.358536 IP 192.168.43.195.8880 > 192.168.43.124.7772: UDP, length 120
03:55:14.373293 IP 192.168.43.124.8880 > 192.168.43.195.7771: UDP, length 120
03:55:14.408536 IP 192.168.43.195.8880 > 192.168.43.124.7772: UDP, length 120
03:55:14.423538 IP 192.168.43.124.8880 > 192.168.43.195.7771: UDP, length 120
03:55:14.458528 IP 192.168.43.195.8880 > 192.168.43.124.7772: UDP, length 120
03:55:14.473355 IP 192.168.43.124.8880 > 192.168.43.195.7771: UDP, length 120
03:55:14.508523 IP 192.168.43.195.8880 > 192.168.43.124.7772: UDP, length 120
03:55:14.524957 IP 192.168.43.124.8880 > 192.168.43.195.7771: UDP, length 120
03:55:14.558524 IP 192.168.43.195.8880 > 192.168.43.124.7772: UDP, length 120
03:55:14.571830 IP 192.168.43.124.8880 > 192.168.43.195.7771: UDP, length 120
03:55:14.608524 IP 192.168.43.195.8880 > 192.168.43.124.7772: UDP, length 120
03:55:14.623341 IP 192.168.43.124.8880 > 192.168.43.195.7771: UDP, length 120
03:55:14.658528 IP 192.168.43.195.8880 > 192.168.43.124.7772: UDP, length 120
03:55:14.689499 IP 192.168.43.124.8880 > 192.168.43.195.7771: UDP, length 120
03:55:14.708525 IP 192.168.43.195.8880 > 192.168.43.124.7772: UDP, length 120
03:55:14.723604 IP 192.168.43.124.8880 > 192.168.43.195.7771: UDP, length 120
03:55:14.758527 IP 192.168.43.195.8880 > 192.168.43.124.7772: UDP, length 120
03:55:14.773794 IP 192.168.43.124.8880 > 192.168.43.195.7771: UDP, length 120
03:55:14.808530 IP 192.168.43.195.8880 > 192.168.43.124.7772: UDP, length 120
03:55:14.825896 IP 192.168.43.124.8880 > 192.168.43.195.7771: UDP, length 120
03:55:14.858526 IP 192.168.43.195.8880 > 192.168.43.124.7772: UDP, length 120
03:55:14.873878 IP 192.168.43.124.8880 > 192.168.43.195.7771: UDP, length 120
03:55:14.908526 IP 192.168.43.195.8880 > 192.168.43.124.7772: UDP, length 120
03:55:14.922938 IP 192.168.43.124.8880 > 192.168.43.195.7771: UDP, length 120
03:55:14.958530 IP 192.168.43.195.8880 > 192.168.43.124.7772: UDP, length 120
03:55:14.973483 IP 192.168.43.124.8880 > 192.168.43.195.7771: UDP, length 120
03:55:15.008540 IP 192.168.43.195.8880 > 192.168.43.124.7772: UDP, length 120
03:55:15.023431 IP 192.168.43.124.8880 > 192.168.43.195.7771: UDP, length 120
03:55:15.058527 IP 192.168.43.195.8880 > 192.168.43.124.7772: UDP, length 120
03:55:15.073528 IP 192.168.43.124.8880 > 192.168.43.195.7771: UDP, length 120
03:55:15.108525 IP 192.168.43.195.8880 > 192.168.43.124.7772: UDP, length 120
03:55:15.126065 IP 192.168.43.124.8880 > 192.168.43.195.7771: UDP, length 120
03:55:15.158525 IP 192.168.43.195.8880 > 192.168.43.124.7772: UDP, length 120
03:55:15.173057 IP 192.168.43.124.8880 > 192.168.43.195.7771: UDP, length 120
03:55:15.208524 IP 192.168.43.195.8880 > 192.168.43.124.7772: UDP, length 120
03:55:15.223286 IP 192.168.43.124.8880 > 192.168.43.195.7771: UDP, length 120
03:55:15.258529 IP 192.168.43.195.8880 > 192.168.43.124.7772: UDP, length 120
03:55:15.273128 IP 192.168.43.124.8880 > 192.168.43.195.7771: UDP, length 120
03:55:15.308529 IP 192.168.43.195.8880 > 192.168.43.124.7772: UDP, length 120
03:55:15.323098 IP 192.168.43.124.8880 > 192.168.43.195.7771: UDP, length 120
03:55:15.358575 IP 192.168.43.195.8880 > 192.168.43.124.7772: UDP, length 120
03:55:15.373381 IP 192.168.43.124.8880 > 192.168.43.195.7771: UDP, length 120
03:55:15.408545 IP 192.168.43.195.8880 > 192.168.43.124.7772: UDP, length 120
03:55:15.423645 IP 192.168.43.124.8880 > 192.168.43.195.7771: UDP, length 120
03:55:15.458526 IP 192.168.43.195.8880 > 192.168.43.124.7772: UDP, length 120
03:55:15.473393 IP 192.168.43.124.8880 > 192.168.43.195.7771: UDP, length 120
03:55:15.508543 IP 192.168.43.195.8880 > 192.168.43.124.7772: UDP, length 120
03:55:15.523461 IP 192.168.43.124.8880 > 192.168.43.195.7771: UDP, length 120
03:55:15.558537 IP 192.168.43.195.8880 > 192.168.43.124.7772: UDP, length 120
03:55:15.573348 IP 192.168.43.124.8880 > 192.168.43.195.7771: UDP, length 120
03:55:15.608533 IP 192.168.43.195.8880 > 192.168.43.124.7772: UDP, length 120
03:55:15.623420 IP 192.168.43.124.8880 > 192.168.43.195.7771: UDP, length 120
03:55:15.658528 IP 192.168.43.195.8880 > 192.168.43.124.7772: UDP, length 120
03:55:15.673133 IP 192.168.43.124.8880 > 192.168.43.195.7771: UDP, length 120
03:55:15.708524 IP 192.168.43.195.8880 > 192.168.43.124.7772: UDP, length 120
03:55:15.723472 IP 192.168.43.124.8880 > 192.168.43.195.7771: UDP, length 120
03:55:15.758524 IP 192.168.43.195.8880 > 192.168.43.124.7772: UDP, length 120
03:55:15.773459 IP 192.168.43.124.8880 > 192.168.43.195.7771: UDP, length 120
03:55:15.808541 IP 192.168.43.195.8880 > 192.168.43.124.7772: UDP, length 120
03:55:15.823363 IP 192.168.43.124.8880 > 192.168.43.195.7771: UDP, length 120
03:55:15.858537 IP 192.168.43.195.8880 > 192.168.43.124.7772: UDP, length 120
03:55:15.876072 IP 192.168.43.124.8880 > 192.168.43.195.7771: UDP, length 120
03:55:15.908528 IP 192.168.43.195.8880 > 192.168.43.124.7772: UDP, length 120
03:55:15.925991 IP 192.168.43.124.8880 > 192.168.43.195.7771: UDP, length 120
03:55:15.958530 IP 192.168.43.195.8880 > 192.168.43.124.7772: UDP, length 120
03:55:15.981949 IP 192.168.43.124.8880 > 192.168.43.195.7771: UDP, length 120
03:55:16.008535 IP 192.168.43.195.8880 > 192.168.43.124.7772: UDP, length 120
03:55:16.023360 IP 192.168.43.124.8880 > 192.168.43.195.7771: UDP, length 120
03:55:16.058550 IP 192.168.43.195.8880 > 192.168.43.124.7772: UDP, length 120
03:55:16.074229 IP 192.168.43.124.8880 > 192.168.43.195.7771: UDP, length 120
03:55:16.108537 IP 192.168.43.195.8880 > 192.168.43.124.7772: UDP, length 120
03:55:16.123366 IP 192.168.43.124.8880 > 192.168.43.195.7771: UDP, length 120
03:55:16.158532 IP 192.168.43.195.8880 > 192.168.43.124.7772: UDP, length 120
03:55:16.182889 IP 192.168.43.124.8880 > 192.168.43.195.7771: UDP, length 120
03:55:16.208532 IP 192.168.43.195.8880 > 192.168.43.124.7772: UDP, length 120
03:55:16.223349 IP 192.168.43.124.8880 > 192.168.43.195.7771: UDP, length 120
03:55:16.258529 IP 192.168.43.195.8880 > 192.168.43.124.7772: UDP, length 120
03:55:16.274253 IP 192.168.43.124.8880 > 192.168.43.195.7771: UDP, length 120
03:55:16.308537 IP 192.168.43.195.8880 > 192.168.43.124.7772: UDP, length 120
03:55:16.323120 IP 192.168.43.124.8880 > 192.168.43.195.7771: UDP, length 120
03:55:16.358536 IP 192.168.43.195.8880 > 192.168.43.124.7772: UDP, length 120
03:55:16.374715 IP 192.168.43.124.8880 > 192.168.43.195.7771: UDP, length 120
03:55:16.408535 IP 192.168.43.195.8880 > 192.168.43.124.7772: UDP, length 120
03:55:16.423346 IP 192.168.43.124.8880 > 192.168.43.195.7771: UDP, length 120
03:55:16.458526 IP 192.168.43.195.8880 > 192.168.43.124.7772: UDP, length 120
03:55:16.473361 IP 192.168.43.124.8880 > 192.168.43.195.7771: UDP, length 120
03:55:16.508528 IP 192.168.43.195.8880 > 192.168.43.124.7772: UDP, length 120
03:55:16.523400 IP 192.168.43.124.8880 > 192.168.43.195.7771: UDP, length 120
03:55:16.558543 IP 192.168.43.195.8880 > 192.168.43.124.7772: UDP, length 120
03:55:16.574695 IP 192.168.43.124.8880 > 192.168.43.195.7771: UDP, length 120
03:55:16.608527 IP 192.168.43.195.8880 > 192.168.43.124.7772: UDP, length 120
03:55:16.623290 IP 192.168.43.124.8880 > 192.168.43.195.7771: UDP, length 120
03:55:16.658525 IP 192.168.43.195.8880 > 192.168.43.124.7772: UDP, length 120
03:55:16.674614 IP 192.168.43.124.8880 > 192.168.43.195.7771: UDP, length 120
03:55:16.708537 IP 192.168.43.195.8880 > 192.168.43.124.7772: UDP, length 120
03:55:16.723155 IP 192.168.43.124.8880 > 192.168.43.195.7771: UDP, length 120
03:55:16.758525 IP 192.168.43.195.8880 > 192.168.43.124.7772: UDP, length 120
03:55:16.773439 IP 192.168.43.124.8880 > 192.168.43.195.7771: UDP, length 120
03:55:16.808525 IP 192.168.43.195.8880 > 192.168.43.124.7772: UDP, length 120
03:55:16.826046 IP 192.168.43.124.8880 > 192.168.43.195.7771: UDP, length 120
03:55:16.858575 IP 192.168.43.195.8880 > 192.168.43.124.7772: UDP, length 120
03:55:16.874024 IP 192.168.43.124.8880 > 192.168.43.195.7771: UDP, length 120
03:55:16.908534 IP 192.168.43.195.8880 > 192.168.43.124.7772: UDP, length 120
03:55:16.923795 IP 192.168.43.124.8880 > 192.168.43.195.7771: UDP, length 120
03:55:16.958525 IP 192.168.43.195.8880 > 192.168.43.124.7772: UDP, length 120
03:55:16.974438 IP 192.168.43.124.8880 > 192.168.43.195.7771: UDP, length 120
03:55:17.008531 IP 192.168.43.195.8880 > 192.168.43.124.7772: UDP, length 120
03:55:17.025142 IP 192.168.43.124.8880 > 192.168.43.195.7771: UDP, length 120
03:55:17.058537 IP 192.168.43.195.8880 > 192.168.43.124.7772: UDP, length 120
03:55:17.073417 IP 192.168.43.124.8880 > 192.168.43.195.7771: UDP, length 120
03:55:17.108524 IP 192.168.43.195.8880 > 192.168.43.124.7772: UDP, length 120
03:55:17.123626 IP 192.168.43.124.8880 > 192.168.43.195.7771: UDP, length 120
03:55:17.158524 IP 192.168.43.195.8880 > 192.168.43.124.7772: UDP, length 120
03:55:17.175200 IP 192.168.43.124.8880 > 192.168.43.195.7771: UDP, length 120
03:55:17.208523 IP 192.168.43.195.8880 > 192.168.43.124.7772: UDP, length 120
03:55:17.258521 IP 192.168.43.195.8880 > 192.168.43.124.7772: UDP, length 120
03:55:17.308532 IP 192.168.43.195.8880 > 192.168.43.124.7772: UDP, length 120
03:55:17.358521 IP 192.168.43.195.8880 > 192.168.43.124.7772: UDP, length 120
03:55:17.375375 IP 192.168.43.124.8880 > 192.168.43.195.7771: UDP, length 120
03:55:17.375838 IP 192.168.43.124.8880 > 192.168.43.195.7771: UDP, length 120
03:55:17.375961 IP 192.168.43.124.8880 > 192.168.43.195.7771: UDP, length 120
03:55:17.408527 IP 192.168.43.195.8880 > 192.168.43.124.7772: UDP, length 120
03:55:17.458522 IP 192.168.43.195.8880 > 192.168.43.124.7772: UDP, length 120
03:55:17.508520 IP 192.168.43.195.8880 > 192.168.43.124.7772: UDP, length 120
03:55:17.515952 IP 192.168.43.124.8880 > 192.168.43.195.7771: UDP, length 120
03:55:17.516213 IP 192.168.43.124.8880 > 192.168.43.195.7771: UDP, length 120
03:55:17.558533 IP 192.168.43.195.8880 > 192.168.43.124.7772: UDP, length 120
03:55:17.608529 IP 192.168.43.195.8880 > 192.168.43.124.7772: UDP, length 120
03:55:17.615797 IP 192.168.43.124.8880 > 192.168.43.195.7771: UDP, length 120
03:55:17.616060 IP 192.168.43.124.8880 > 192.168.43.195.7771: UDP, length 120
03:55:17.658531 IP 192.168.43.195.8880 > 192.168.43.124.7772: UDP, length 120
03:55:17.708524 IP 192.168.43.195.8880 > 192.168.43.124.7772: UDP, length 120
03:55:17.717301 IP 192.168.43.124.8880 > 192.168.43.195.7771: UDP, length 120
03:55:17.717766 IP 192.168.43.124.8880 > 192.168.43.195.7771: UDP, length 120
03:55:17.758526 IP 192.168.43.195.8880 > 192.168.43.124.7772: UDP, length 120
03:55:17.808533 IP 192.168.43.195.8880 > 192.168.43.124.7772: UDP, length 120
03:55:17.816469 IP 192.168.43.124.8880 > 192.168.43.195.7771: UDP, length 120
03:55:17.816616 IP 192.168.43.124.8880 > 192.168.43.195.7771: UDP, length 120
03:55:17.858524 IP 192.168.43.195.8880 > 192.168.43.124.7772: UDP, length 120
03:55:17.908522 IP 192.168.43.195.8880 > 192.168.43.124.7772: UDP, length 120
03:55:17.917500 IP 192.168.43.124.8880 > 192.168.43.195.7771: UDP, length 120
03:55:17.917658 IP 192.168.43.124.8880 > 192.168.43.195.7771: UDP, length 120
03:55:17.958522 IP 192.168.43.195.8880 > 192.168.43.124.7772: UDP, length 120
03:55:18.008530 IP 192.168.43.195.8880 > 192.168.43.124.7772: UDP, length 120
03:55:18.015373 IP 192.168.43.124.8880 > 192.168.43.195.7771: UDP, length 120
03:55:18.015628 IP 192.168.43.124.8880 > 192.168.43.195.7771: UDP, length 120
03:55:18.058528 IP 192.168.43.195.8880 > 192.168.43.124.7772: UDP, length 120
03:55:18.108534 IP 192.168.43.195.8880 > 192.168.43.124.7772: UDP, length 120
03:55:18.126382 IP 192.168.43.124.8880 > 192.168.43.195.7771: UDP, length 120
03:55:18.126621 IP 192.168.43.124.8880 > 192.168.43.195.7771: UDP, length 120
03:55:18.158522 IP 192.168.43.195.8880 > 192.168.43.124.7772: UDP, length 120
03:55:18.208522 IP 192.168.43.195.8880 > 192.168.43.124.7772: UDP, length 120
03:55:18.226084 IP 192.168.43.124.8880 > 192.168.43.195.7771: UDP, length 120
03:55:18.226204 IP 192.168.43.124.8880 > 192.168.43.195.7771: UDP, length 120
03:55:18.258523 IP 192.168.43.195.8880 > 192.168.43.124.7772: UDP, length 120
03:55:18.308523 IP 192.168.43.195.8880 > 192.168.43.124.7772: UDP, length 120
03:55:18.327133 IP 192.168.43.124.8880 > 192.168.43.195.7771: UDP, length 120
03:55:18.327374 IP 192.168.43.124.8880 > 192.168.43.195.7771: UDP, length 120
03:55:18.327487 IP 192.168.43.124.8880 > 192.168.43.195.7771: UDP, length 120
03:55:18.358577 IP 192.168.43.195.8880 > 192.168.43.124.7772: UDP, length 120
03:55:18.408539 IP 192.168.43.195.8880 > 192.168.43.124.7772: UDP, length 120
03:55:18.458521 IP 192.168.43.195.8880 > 192.168.43.124.7772: UDP, length 120
03:55:18.467266 IP 192.168.43.124.8880 > 192.168.43.195.7771: UDP, length 120
03:55:18.467543 IP 192.168.43.124.8880 > 192.168.43.195.7771: UDP, length 120
03:55:18.508524 IP 192.168.43.195.8880 > 192.168.43.124.7772: UDP, length 120
03:55:18.558529 IP 192.168.43.195.8880 > 192.168.43.124.7772: UDP, length 120
03:55:18.565467 IP 192.168.43.124.8880 > 192.168.43.195.7771: UDP, length 120
03:55:18.565594 IP 192.168.43.124.8880 > 192.168.43.195.7771: UDP, length 120
03:55:18.608536 IP 192.168.43.195.8880 > 192.168.43.124.7772: UDP, length 120
03:55:18.658538 IP 192.168.43.195.8880 > 192.168.43.124.7772: UDP, length 120
03:55:18.666843 IP 192.168.43.124.8880 > 192.168.43.195.7771: UDP, length 120
03:55:18.667767 IP 192.168.43.124.8880 > 192.168.43.195.7771: UDP, length 120
03:55:18.708549 IP 192.168.43.195.8880 > 192.168.43.124.7772: UDP, length 120
03:55:18.758535 IP 192.168.43.195.8880 > 192.168.43.124.7772: UDP, length 120
03:55:18.765940 IP 192.168.43.124.8880 > 192.168.43.195.7771: UDP, length 120
03:55:18.766076 IP 192.168.43.124.8880 > 192.168.43.195.7771: UDP, length 120
03:55:18.808538 IP 192.168.43.195.8880 > 192.168.43.124.7772: UDP, length 120
03:55:18.858527 IP 192.168.43.195.8880 > 192.168.43.124.7772: UDP, length 120
03:55:18.865257 IP 192.168.43.124.8880 > 192.168.43.195.7771: UDP, length 120
03:55:18.865382 IP 192.168.43.124.8880 > 192.168.43.195.7771: UDP, length 120
03:55:18.908555 IP 192.168.43.195.8880 > 192.168.43.124.7772: UDP, length 120
03:55:18.958538 IP 192.168.43.195.8880 > 192.168.43.124.7772: UDP, length 120
03:55:18.965944 IP 192.168.43.124.8880 > 192.168.43.195.7771: UDP, length 120
03:55:18.966098 IP 192.168.43.124.8880 > 192.168.43.195.7771: UDP, length 120
03:55:19.008558 IP 192.168.43.195.8880 > 192.168.43.124.7772: UDP, length 120
03:55:19.058535 IP 192.168.43.195.8880 > 192.168.43.124.7772: UDP, length 120
03:55:19.068702 IP 192.168.43.124.8880 > 192.168.43.195.7771: UDP, length 120
03:55:19.068925 IP 192.168.43.124.8880 > 192.168.43.195.7771: UDP, length 120
03:55:19.108535 IP 192.168.43.195.8880 > 192.168.43.124.7772: UDP, length 120
03:55:19.158526 IP 192.168.43.195.8880 > 192.168.43.124.7772: UDP, length 120
03:55:19.175476 IP 192.168.43.124.8880 > 192.168.43.195.7771: UDP, length 120
03:55:19.176313 IP 192.168.43.124.8880 > 192.168.43.195.7771: UDP, length 120
03:55:19.208547 IP 192.168.43.195.8880 > 192.168.43.124.7772: UDP, length 120
03:55:19.258535 IP 192.168.43.195.8880 > 192.168.43.124.7772: UDP, length 120
03:55:19.272380 IP 192.168.43.124.8880 > 192.168.43.195.7771: UDP, length 120
03:55:19.272507 IP 192.168.43.124.8880 > 192.168.43.195.7771: UDP, length 120
03:55:19.308537 IP 192.168.43.195.8880 > 192.168.43.124.7772: UDP, length 120
03:55:19.358526 IP 192.168.43.195.8880 > 192.168.43.124.7772: UDP, length 120
03:55:19.383602 IP 192.168.43.124.8880 > 192.168.43.195.7771: UDP, length 120
03:55:19.383819 IP 192.168.43.124.8880 > 192.168.43.195.7771: UDP, length 120
03:55:19.383944 IP 192.168.43.124.8880 > 192.168.43.195.7771: UDP, length 120
03:55:19.408529 IP 192.168.43.195.8880 > 192.168.43.124.7772: UDP, length 120
03:55:19.458526 IP 192.168.43.195.8880 > 192.168.43.124.7772: UDP, length 120
03:55:19.508556 IP 192.168.43.195.8880 > 192.168.43.124.7772: UDP, length 120
03:55:19.533743 IP 192.168.43.124.8880 > 192.168.43.195.7771: UDP, length 120
03:55:19.533964 IP 192.168.43.124.8880 > 192.168.43.195.7771: UDP, length 120
03:55:19.534082 IP 192.168.43.124.8880 > 192.168.43.195.7771: UDP, length 120
03:55:19.558555 IP 192.168.43.195.8880 > 192.168.43.124.7772: UDP, length 120
03:55:19.608531 IP 192.168.43.195.8880 > 192.168.43.124.7772: UDP, length 120
03:55:19.658523 IP 192.168.43.195.8880 > 192.168.43.124.7772: UDP, length 120
03:55:19.694529 IP 192.168.43.124.8880 > 192.168.43.195.7771: UDP, length 120
03:55:19.694688 IP 192.168.43.124.8880 > 192.168.43.195.7771: UDP, length 120
03:55:19.694831 IP 192.168.43.124.8880 > 192.168.43.195.7771: UDP, length 120
03:55:19.708537 IP 192.168.43.195.8880 > 192.168.43.124.7772: UDP, length 120
03:55:19.758525 IP 192.168.43.195.8880 > 192.168.43.124.7772: UDP, length 120
03:55:19.808523 IP 192.168.43.195.8880 > 192.168.43.124.7772: UDP, length 120
03:55:19.834330 IP 192.168.43.124.8880 > 192.168.43.195.7771: UDP, length 120
03:55:19.834520 IP 192.168.43.124.8880 > 192.168.43.195.7771: UDP, length 120
03:55:19.834636 IP 192.168.43.124.8880 > 192.168.43.195.7771: UDP, length 120
03:55:19.858576 IP 192.168.43.195.8880 > 192.168.43.124.7772: UDP, length 120
03:55:19.908524 IP 192.168.43.195.8880 > 192.168.43.124.7772: UDP, length 120
03:55:19.958519 IP 192.168.43.195.8880 > 192.168.43.124.7772: UDP, length 120
03:55:19.984309 IP 192.168.43.124.8880 > 192.168.43.195.7771: UDP, length 120
03:55:19.984440 IP 192.168.43.124.8880 > 192.168.43.195.7771: UDP, length 120
03:55:19.984557 IP 192.168.43.124.8880 > 192.168.43.195.7771: UDP, length 120
03:55:20.008533 IP 192.168.43.195.8880 > 192.168.43.124.7772: UDP, length 120
03:55:20.058520 IP 192.168.43.195.8880 > 192.168.43.124.7772: UDP, length 120
03:55:20.107458 IP 192.168.43.124.8880 > 192.168.43.195.7771: UDP, length 120
03:55:20.107626 IP 192.168.43.124.8880 > 192.168.43.195.7771: UDP, length 120
03:55:20.108523 IP 192.168.43.195.8880 > 192.168.43.124.7772: UDP, length 120
03:55:20.158531 IP 192.168.43.195.8880 > 192.168.43.124.7772: UDP, length 120
03:55:20.208562 IP 192.168.43.195.8880 > 192.168.43.124.7772: UDP, length 120
03:55:20.214840 IP 192.168.43.124.8880 > 192.168.43.195.7771: UDP, length 120
03:55:20.215743 IP 192.168.43.124.8880 > 192.168.43.195.7771: UDP, length 120
03:55:20.256880 IP 192.168.43.124.8880 > 192.168.43.195.7771: UDP, length 120
03:55:20.258533 IP 192.168.43.195.8880 > 192.168.43.124.7772: UDP, length 120
03:55:20.281232 IP 192.168.43.124.8880 > 192.168.43.195.7771: UDP, length 120
03:55:20.308526 IP 192.168.43.195.8880 > 192.168.43.124.7772: UDP, length 120
03:55:20.323437 IP 192.168.43.124.8880 > 192.168.43.195.7771: UDP, length 120
03:55:20.358523 IP 192.168.43.195.8880 > 192.168.43.124.7772: UDP, length 120
03:55:20.382291 IP 192.168.43.124.8880 > 192.168.43.195.7771: UDP, length 120
03:55:20.408523 IP 192.168.43.195.8880 > 192.168.43.124.7772: UDP, length 120
03:55:20.424272 IP 192.168.43.124.8880 > 192.168.43.195.7771: UDP, length 120
03:55:20.458536 IP 192.168.43.195.8880 > 192.168.43.124.7772: UDP, length 120
03:55:20.473723 IP 192.168.43.124.8880 > 192.168.43.195.7771: UDP, length 120
03:55:20.508534 IP 192.168.43.195.8880 > 192.168.43.124.7772: UDP, length 120
03:55:20.522498 IP 192.168.43.124.8880 > 192.168.43.195.7771: UDP, length 120
03:55:20.558525 IP 192.168.43.195.8880 > 192.168.43.124.7772: UDP, length 120
03:55:20.574013 IP 192.168.43.124.8880 > 192.168.43.195.7771: UDP, length 120
03:55:20.608524 IP 192.168.43.195.8880 > 192.168.43.124.7772: UDP, length 120
03:55:20.623427 IP 192.168.43.124.8880 > 192.168.43.195.7771: UDP, length 120
03:55:20.658528 IP 192.168.43.195.8880 > 192.168.43.124.7772: UDP, length 120
03:55:20.673471 IP 192.168.43.124.8880 > 192.168.43.195.7771: UDP, length 120
03:55:20.708528 IP 192.168.43.195.8880 > 192.168.43.124.7772: UDP, length 120
03:55:20.723448 IP 192.168.43.124.8880 > 192.168.43.195.7771: UDP, length 120
03:55:20.758532 IP 192.168.43.195.8880 > 192.168.43.124.7772: UDP, length 120
03:55:20.773685 IP 192.168.43.124.8880 > 192.168.43.195.7771: UDP, length 120
03:55:20.808533 IP 192.168.43.195.8880 > 192.168.43.124.7772: UDP, length 120
03:55:20.823459 IP 192.168.43.124.8880 > 192.168.43.195.7771: UDP, length 120
03:55:20.858528 IP 192.168.43.195.8880 > 192.168.43.124.7772: UDP, length 120
03:55:20.875227 IP 192.168.43.124.8880 > 192.168.43.195.7771: UDP, length 120
03:55:20.908524 IP 192.168.43.195.8880 > 192.168.43.124.7772: UDP, length 120
03:55:20.923453 IP 192.168.43.124.8880 > 192.168.43.195.7771: UDP, length 120
03:55:20.958529 IP 192.168.43.195.8880 > 192.168.43.124.7772: UDP, length 120
03:55:20.975761 IP 192.168.43.124.8880 > 192.168.43.195.7771: UDP, length 120
03:55:21.008543 IP 192.168.43.195.8880 > 192.168.43.124.7772: UDP, length 120
03:55:21.023493 IP 192.168.43.124.8880 > 192.168.43.195.7771: UDP, length 120
03:55:21.058527 IP 192.168.43.195.8880 > 192.168.43.124.7772: UDP, length 120
03:55:21.088292 IP 192.168.43.124.8880 > 192.168.43.195.7771: UDP, length 120
03:55:21.108526 IP 192.168.43.195.8880 > 192.168.43.124.7772: UDP, length 120
03:55:21.123817 IP 192.168.43.124.8880 > 192.168.43.195.7771: UDP, length 120
03:55:21.158527 IP 192.168.43.195.8880 > 192.168.43.124.7772: UDP, length 120
03:55:21.176102 IP 192.168.43.124.8880 > 192.168.43.195.7771: UDP, length 120
03:55:21.208526 IP 192.168.43.195.8880 > 192.168.43.124.7772: UDP, length 120
03:55:21.224957 IP 192.168.43.124.8880 > 192.168.43.195.7771: UDP, length 120
03:55:21.258530 IP 192.168.43.195.8880 > 192.168.43.124.7772: UDP, length 120
03:55:21.277410 IP 192.168.43.124.8880 > 192.168.43.195.7771: UDP, length 120
03:55:21.308526 IP 192.168.43.195.8880 > 192.168.43.124.7772: UDP, length 120
03:55:21.325282 IP 192.168.43.124.8880 > 192.168.43.195.7771: UDP, length 120
03:55:21.358575 IP 192.168.43.195.8880 > 192.168.43.124.7772: UDP, length 120
03:55:21.372912 IP 192.168.43.124.8880 > 192.168.43.195.7771: UDP, length 120
03:55:21.408536 IP 192.168.43.195.8880 > 192.168.43.124.7772: UDP, length 120
03:55:21.423496 IP 192.168.43.124.8880 > 192.168.43.195.7771: UDP, length 120
03:55:21.458527 IP 192.168.43.195.8880 > 192.168.43.124.7772: UDP, length 120
03:55:21.473770 IP 192.168.43.124.8880 > 192.168.43.195.7771: UDP, length 120
03:55:21.508529 IP 192.168.43.195.8880 > 192.168.43.124.7772: UDP, length 120
03:55:21.523452 IP 192.168.43.124.8880 > 192.168.43.195.7771: UDP, length 120
03:55:21.558529 IP 192.168.43.195.8880 > 192.168.43.124.7772: UDP, length 120
03:55:21.573284 IP 192.168.43.124.8880 > 192.168.43.195.7771: UDP, length 120
03:55:21.608527 IP 192.168.43.195.8880 > 192.168.43.124.7772: UDP, length 120
03:55:21.623543 IP 192.168.43.124.8880 > 192.168.43.195.7771: UDP, length 120
03:55:21.658530 IP 192.168.43.195.8880 > 192.168.43.124.7772: UDP, length 120
03:55:21.673536 IP 192.168.43.124.8880 > 192.168.43.195.7771: UDP, length 120
03:55:21.708528 IP 192.168.43.195.8880 > 192.168.43.124.7772: UDP, length 120
03:55:21.723505 IP 192.168.43.124.8880 > 192.168.43.195.7771: UDP, length 120
03:55:21.758528 IP 192.168.43.195.8880 > 192.168.43.124.7772: UDP, length 120
03:55:21.773491 IP 192.168.43.124.8880 > 192.168.43.195.7771: UDP, length 120
03:55:21.808536 IP 192.168.43.195.8880 > 192.168.43.124.7772: UDP, length 120
03:55:21.823513 IP 192.168.43.124.8880 > 192.168.43.195.7771: UDP, length 120
03:55:21.858527 IP 192.168.43.195.8880 > 192.168.43.124.7772: UDP, length 120
03:55:21.873472 IP 192.168.43.124.8880 > 192.168.43.195.7771: UDP, length 120
03:55:21.908552 IP 192.168.43.195.8880 > 192.168.43.124.7772: UDP, length 120
03:55:21.923464 IP 192.168.43.124.8880 > 192.168.43.195.7771: UDP, length 120
03:55:21.958543 IP 192.168.43.195.8880 > 192.168.43.124.7772: UDP, length 120
03:55:21.973560 IP 192.168.43.124.8880 > 192.168.43.195.7771: UDP, length 120
03:55:22.008539 IP 192.168.43.195.8880 > 192.168.43.124.7772: UDP, length 120
03:55:22.023464 IP 192.168.43.124.8880 > 192.168.43.195.7771: UDP, length 120
03:55:22.058524 IP 192.168.43.195.8880 > 192.168.43.124.7772: UDP, length 120
03:55:22.074420 IP 192.168.43.124.8880 > 192.168.43.195.7771: UDP, length 120
03:55:22.108535 IP 192.168.43.195.8880 > 192.168.43.124.7772: UDP, length 120
03:55:22.123234 IP 192.168.43.124.8880 > 192.168.43.195.7771: UDP, length 120
03:55:22.158523 IP 192.168.43.195.8880 > 192.168.43.124.7772: UDP, length 120
03:55:22.173472 IP 192.168.43.124.8880 > 192.168.43.195.7771: UDP, length 120
03:55:22.208535 IP 192.168.43.195.8880 > 192.168.43.124.7772: UDP, length 120
03:55:22.224919 IP 192.168.43.124.8880 > 192.168.43.195.7771: UDP, length 120
03:55:22.258533 IP 192.168.43.195.8880 > 192.168.43.124.7772: UDP, length 120
03:55:22.275865 IP 192.168.43.124.8880 > 192.168.43.195.7771: UDP, length 120
03:55:22.308522 IP 192.168.43.195.8880 > 192.168.43.124.7772: UDP, length 120
03:55:22.325802 IP 192.168.43.124.8880 > 192.168.43.195.7771: UDP, length 120
03:55:22.358522 IP 192.168.43.195.8880 > 192.168.43.124.7772: UDP, length 120
03:55:22.373510 IP 192.168.43.124.8880 > 192.168.43.195.7771: UDP, length 120
03:55:22.408523 IP 192.168.43.195.8880 > 192.168.43.124.7772: UDP, length 120
03:55:22.431654 IP 192.168.43.124.8880 > 192.168.43.195.7771: UDP, length 120
03:55:22.458535 IP 192.168.43.195.8880 > 192.168.43.124.7772: UDP, length 120
03:55:22.473842 IP 192.168.43.124.8880 > 192.168.43.195.7771: UDP, length 120
03:55:22.508538 IP 192.168.43.195.8880 > 192.168.43.124.7772: UDP, length 120
03:55:22.525655 IP 192.168.43.124.8880 > 192.168.43.195.7771: UDP, length 120
03:55:22.558524 IP 192.168.43.195.8880 > 192.168.43.124.7772: UDP, length 120
03:55:22.574752 IP 192.168.43.124.8880 > 192.168.43.195.7771: UDP, length 120
03:55:22.608526 IP 192.168.43.195.8880 > 192.168.43.124.7772: UDP, length 120
03:55:22.623468 IP 192.168.43.124.8880 > 192.168.43.195.7771: UDP, length 120
03:55:22.658526 IP 192.168.43.195.8880 > 192.168.43.124.7772: UDP, length 120
03:55:22.671922 IP 192.168.43.124.8880 > 192.168.43.195.7771: UDP, length 120
03:55:22.708551 IP 192.168.43.195.8880 > 192.168.43.124.7772: UDP, length 120
03:55:22.724314 IP 192.168.43.124.8880 > 192.168.43.195.7771: UDP, length 120
03:55:22.758535 IP 192.168.43.195.8880 > 192.168.43.124.7772: UDP, length 120
03:55:22.773622 IP 192.168.43.124.8880 > 192.168.43.195.7771: UDP, length 120
03:55:22.808536 IP 192.168.43.195.8880 > 192.168.43.124.7772: UDP, length 120
03:55:22.823271 IP 192.168.43.124.8880 > 192.168.43.195.7771: UDP, length 120
03:55:22.858577 IP 192.168.43.195.8880 > 192.168.43.124.7772: UDP, length 120
03:55:22.873523 IP 192.168.43.124.8880 > 192.168.43.195.7771: UDP, length 120
03:55:22.908570 IP 192.168.43.195.8880 > 192.168.43.124.7772: UDP, length 120
03:55:22.924586 IP 192.168.43.124.8880 > 192.168.43.195.7771: UDP, length 120
03:55:22.958530 IP 192.168.43.195.8880 > 192.168.43.124.7772: UDP, length 120
03:55:22.973494 IP 192.168.43.124.8880 > 192.168.43.195.7771: UDP, length 120
03:55:23.008534 IP 192.168.43.195.8880 > 192.168.43.124.7772: UDP, length 120
03:55:23.025420 IP 192.168.43.124.8880 > 192.168.43.195.7771: UDP, length 120
03:55:23.058525 IP 192.168.43.195.8880 > 192.168.43.124.7772: UDP, length 120
03:55:23.073471 IP 192.168.43.124.8880 > 192.168.43.195.7771: UDP, length 120
03:55:23.108522 IP 192.168.43.195.8880 > 192.168.43.124.7772: UDP, length 120
03:55:23.123240 IP 192.168.43.124.8880 > 192.168.43.195.7771: UDP, length 120
03:55:23.158535 IP 192.168.43.195.8880 > 192.168.43.124.7772: UDP, length 120
03:55:23.173244 IP 192.168.43.124.8880 > 192.168.43.195.7771: UDP, length 120
03:55:23.208522 IP 192.168.43.195.8880 > 192.168.43.124.7772: UDP, length 120
03:55:23.225212 IP 192.168.43.124.8880 > 192.168.43.195.7771: UDP, length 120
03:55:23.258524 IP 192.168.43.195.8880 > 192.168.43.124.7772: UDP, length 120
03:55:23.274199 IP 192.168.43.124.8880 > 192.168.43.195.7771: UDP, length 120
03:55:23.308523 IP 192.168.43.195.8880 > 192.168.43.124.7772: UDP, length 120
03:55:23.333513 IP 192.168.43.124.8880 > 192.168.43.195.7771: UDP, length 120
03:55:23.358524 IP 192.168.43.195.8880 > 192.168.43.124.7772: UDP, length 120
03:55:23.373881 IP 192.168.43.124.8880 > 192.168.43.195.7771: UDP, length 120
03:55:23.408523 IP 192.168.43.195.8880 > 192.168.43.124.7772: UDP, length 120
03:55:23.423538 IP 192.168.43.124.8880 > 192.168.43.195.7771: UDP, length 120
03:55:23.458532 IP 192.168.43.195.8880 > 192.168.43.124.7772: UDP, length 120
03:55:23.473295 IP 192.168.43.124.8880 > 192.168.43.195.7771: UDP, length 120
03:55:23.508538 IP 192.168.43.195.8880 > 192.168.43.124.7772: UDP, length 120
03:55:23.558527 IP 192.168.43.195.8880 > 192.168.43.124.7772: UDP, length 120
03:55:23.608522 IP 192.168.43.195.8880 > 192.168.43.124.7772: UDP, length 120
03:55:23.658523 IP 192.168.43.195.8880 > 192.168.43.124.7772: UDP, length 120
03:55:23.708523 IP 192.168.43.195.8880 > 192.168.43.124.7772: UDP, length 120
03:55:23.758533 IP 192.168.43.195.8880 > 192.168.43.124.7772: UDP, length 120
03:55:23.808523 IP 192.168.43.195.8880 > 192.168.43.124.7772: UDP, length 120
03:55:23.858521 IP 192.168.43.195.8880 > 192.168.43.124.7772: UDP, length 120
03:55:23.908536 IP 192.168.43.195.8880 > 192.168.43.124.7772: UDP, length 120
03:55:23.958541 IP 192.168.43.195.8880 > 192.168.43.124.7772: UDP, length 120
03:55:24.008550 IP 192.168.43.195.8880 > 192.168.43.124.7772: UDP, length 120
03:55:24.058527 IP 192.168.43.195.8880 > 192.168.43.124.7772: UDP, length 120
03:55:24.108527 IP 192.168.43.195.8880 > 192.168.43.124.7772: UDP, length 120
03:55:24.158527 IP 192.168.43.195.8880 > 192.168.43.124.7772: UDP, length 120
