01:31:48.742874 IP 192.168.43.146.8880 > 192.168.43.147.7772: UDP, length 120
01:31:48.812032 IP 192.168.43.146.8880 > 192.168.43.147.7772: UDP, length 120
01:31:48.844832 IP 192.168.43.146.8880 > 192.168.43.147.7772: UDP, length 120
01:31:48.896750 IP 192.168.43.147.8880 > 192.168.43.124.7773: UDP, length 120
01:31:48.900020 IP 192.168.43.146.8880 > 192.168.43.147.7772: UDP, length 120
01:31:48.946793 IP 192.168.43.147.8880 > 192.168.43.124.7773: UDP, length 120
01:31:48.948310 IP 192.168.43.146.8880 > 192.168.43.147.7772: UDP, length 120
01:31:48.996775 IP 192.168.43.147.8880 > 192.168.43.124.7773: UDP, length 120
01:31:49.000032 IP 192.168.43.146.8880 > 192.168.43.147.7772: UDP, length 120
01:31:49.045086 IP 192.168.43.146.8880 > 192.168.43.147.7772: UDP, length 120
01:31:49.046775 IP 192.168.43.147.8880 > 192.168.43.124.7773: UDP, length 120
01:31:49.093040 IP 192.168.43.146.8880 > 192.168.43.147.7772: UDP, length 120
01:31:49.096772 IP 192.168.43.147.8880 > 192.168.43.124.7773: UDP, length 120
01:31:49.146773 IP 192.168.43.147.8880 > 192.168.43.124.7773: UDP, length 120
01:31:49.150029 IP 192.168.43.146.8880 > 192.168.43.147.7772: UDP, length 120
01:31:49.195502 IP 192.168.43.146.8880 > 192.168.43.147.7772: UDP, length 120
01:31:49.196772 IP 192.168.43.147.8880 > 192.168.43.124.7773: UDP, length 120
01:31:49.244961 IP 192.168.43.146.8880 > 192.168.43.147.7772: UDP, length 120
01:31:49.246773 IP 192.168.43.147.8880 > 192.168.43.124.7773: UDP, length 120
01:31:49.296772 IP 192.168.43.147.8880 > 192.168.43.124.7773: UDP, length 120
01:31:49.300008 IP 192.168.43.146.8880 > 192.168.43.147.7772: UDP, length 120
01:31:49.344890 IP 192.168.43.146.8880 > 192.168.43.147.7772: UDP, length 120
01:31:49.346772 IP 192.168.43.147.8880 > 192.168.43.124.7773: UDP, length 120
01:31:49.394931 IP 192.168.43.146.8880 > 192.168.43.147.7772: UDP, length 120
01:31:49.396773 IP 192.168.43.147.8880 > 192.168.43.124.7773: UDP, length 120
01:31:49.446773 IP 192.168.43.147.8880 > 192.168.43.124.7773: UDP, length 120
01:31:49.451352 IP 192.168.43.146.8880 > 192.168.43.147.7772: UDP, length 120
01:31:49.495281 IP 192.168.43.146.8880 > 192.168.43.147.7772: UDP, length 120
01:31:49.496773 IP 192.168.43.147.8880 > 192.168.43.124.7773: UDP, length 120
01:31:49.545706 IP 192.168.43.146.8880 > 192.168.43.147.7772: UDP, length 120
01:31:49.546772 IP 192.168.43.147.8880 > 192.168.43.124.7773: UDP, length 120
01:31:49.596771 IP 192.168.43.147.8880 > 192.168.43.124.7773: UDP, length 120
01:31:49.600007 IP 192.168.43.146.8880 > 192.168.43.147.7772: UDP, length 120
01:31:49.646776 IP 192.168.43.147.8880 > 192.168.43.124.7773: UDP, length 120
01:31:49.646777 IP 192.168.43.146.8880 > 192.168.43.147.7772: UDP, length 120
01:31:49.694425 IP 192.168.43.146.8880 > 192.168.43.147.7772: UDP, length 120
01:31:49.696815 IP 192.168.43.147.8880 > 192.168.43.124.7773: UDP, length 120
01:31:49.746790 IP 192.168.43.147.8880 > 192.168.43.124.7773: UDP, length 120
01:31:49.750048 IP 192.168.43.146.8880 > 192.168.43.147.7772: UDP, length 120
01:31:49.795075 IP 192.168.43.146.8880 > 192.168.43.147.7772: UDP, length 120
01:31:49.796780 IP 192.168.43.147.8880 > 192.168.43.124.7773: UDP, length 120
01:31:49.846782 IP 192.168.43.147.8880 > 192.168.43.124.7773: UDP, length 120
01:31:49.848249 IP 192.168.43.146.8880 > 192.168.43.147.7772: UDP, length 120
01:31:49.896777 IP 192.168.43.147.8880 > 192.168.43.124.7773: UDP, length 120
01:31:49.902238 IP 192.168.43.146.8880 > 192.168.43.147.7772: UDP, length 120
01:31:49.946025 IP 192.168.43.146.8880 > 192.168.43.147.7772: UDP, length 120
01:31:49.946774 IP 192.168.43.147.8880 > 192.168.43.124.7773: UDP, length 120
01:31:49.996770 IP 192.168.43.147.8880 > 192.168.43.124.7773: UDP, length 120
01:31:50.000877 IP 192.168.43.146.8880 > 192.168.43.147.7772: UDP, length 120
01:31:50.044923 IP 192.168.43.146.8880 > 192.168.43.147.7772: UDP, length 120
01:31:50.046775 IP 192.168.43.147.8880 > 192.168.43.124.7773: UDP, length 120
01:31:50.096771 IP 192.168.43.147.8880 > 192.168.43.124.7773: UDP, length 120
01:31:50.100036 IP 192.168.43.146.8880 > 192.168.43.147.7772: UDP, length 120
01:31:50.146774 IP 192.168.43.147.8880 > 192.168.43.124.7773: UDP, length 120
01:31:50.156355 IP 192.168.43.146.8880 > 192.168.43.147.7772: UDP, length 120
01:31:50.195561 IP 192.168.43.146.8880 > 192.168.43.147.7772: UDP, length 120
01:31:50.196772 IP 192.168.43.147.8880 > 192.168.43.124.7773: UDP, length 120
01:31:50.246772 IP 192.168.43.147.8880 > 192.168.43.124.7773: UDP, length 120
01:31:50.251390 IP 192.168.43.146.8880 > 192.168.43.147.7772: UDP, length 120
01:31:50.296773 IP 192.168.43.147.8880 > 192.168.43.124.7773: UDP, length 120
01:31:50.296888 IP 192.168.43.146.8880 > 192.168.43.147.7772: UDP, length 120
01:31:50.346773 IP 192.168.43.147.8880 > 192.168.43.124.7773: UDP, length 120
01:31:50.352393 IP 192.168.43.146.8880 > 192.168.43.147.7772: UDP, length 120
01:31:50.395055 IP 192.168.43.146.8880 > 192.168.43.147.7772: UDP, length 120
01:31:50.396773 IP 192.168.43.147.8880 > 192.168.43.124.7773: UDP, length 120
01:31:50.446772 IP 192.168.43.147.8880 > 192.168.43.124.7773: UDP, length 120
01:31:50.446897 IP 192.168.43.146.8880 > 192.168.43.147.7772: UDP, length 120
01:31:50.496773 IP 192.168.43.147.8880 > 192.168.43.124.7773: UDP, length 120
01:31:50.501521 IP 192.168.43.146.8880 > 192.168.43.147.7772: UDP, length 120
01:31:50.546774 IP 192.168.43.147.8880 > 192.168.43.124.7773: UDP, length 120
01:31:50.547432 IP 192.168.43.146.8880 > 192.168.43.147.7772: UDP, length 120
01:31:50.595496 IP 192.168.43.146.8880 > 192.168.43.147.7772: UDP, length 120
01:31:50.596774 IP 192.168.43.147.8880 > 192.168.43.124.7773: UDP, length 120
01:31:50.646773 IP 192.168.43.147.8880 > 192.168.43.124.7773: UDP, length 120
01:31:50.650302 IP 192.168.43.146.8880 > 192.168.43.147.7772: UDP, length 120
01:31:50.696774 IP 192.168.43.147.8880 > 192.168.43.124.7773: UDP, length 120
01:31:50.697305 IP 192.168.43.146.8880 > 192.168.43.147.7772: UDP, length 120
01:31:50.745836 IP 192.168.43.146.8880 > 192.168.43.147.7772: UDP, length 120
01:31:50.746771 IP 192.168.43.147.8880 > 192.168.43.124.7773: UDP, length 120
01:31:50.796773 IP 192.168.43.147.8880 > 192.168.43.124.7773: UDP, length 120
01:31:50.800033 IP 192.168.43.146.8880 > 192.168.43.147.7772: UDP, length 120
01:31:50.845655 IP 192.168.43.146.8880 > 192.168.43.147.7772: UDP, length 120
01:31:50.846790 IP 192.168.43.147.8880 > 192.168.43.124.7773: UDP, length 120
01:31:50.896778 IP 192.168.43.147.8880 > 192.168.43.124.7773: UDP, length 120
01:31:50.897893 IP 192.168.43.146.8880 > 192.168.43.147.7772: UDP, length 120
01:31:50.946776 IP 192.168.43.147.8880 > 192.168.43.124.7773: UDP, length 120
01:31:50.950013 IP 192.168.43.146.8880 > 192.168.43.147.7772: UDP, length 120
01:31:50.996029 IP 192.168.43.146.8880 > 192.168.43.147.7772: UDP, length 120
01:31:50.996773 IP 192.168.43.147.8880 > 192.168.43.124.7773: UDP, length 120
01:31:51.045742 IP 192.168.43.146.8880 > 192.168.43.147.7772: UDP, length 120
01:31:51.046774 IP 192.168.43.147.8880 > 192.168.43.124.7773: UDP, length 120
01:31:51.096769 IP 192.168.43.147.8880 > 192.168.43.124.7773: UDP, length 120
01:31:51.100038 IP 192.168.43.146.8880 > 192.168.43.147.7772: UDP, length 120
01:31:51.145656 IP 192.168.43.146.8880 > 192.168.43.147.7772: UDP, length 120
01:31:51.146773 IP 192.168.43.147.8880 > 192.168.43.124.7773: UDP, length 120
01:31:51.195986 IP 192.168.43.146.8880 > 192.168.43.147.7772: UDP, length 120
01:31:51.196783 IP 192.168.43.147.8880 > 192.168.43.124.7773: UDP, length 120
01:31:51.246802 IP 192.168.43.147.8880 > 192.168.43.124.7773: UDP, length 120
01:31:51.250087 IP 192.168.43.146.8880 > 192.168.43.147.7772: UDP, length 120
01:31:51.296777 IP 192.168.43.147.8880 > 192.168.43.124.7773: UDP, length 120
01:31:51.297240 IP 192.168.43.146.8880 > 192.168.43.147.7772: UDP, length 120
01:31:51.346079 IP 192.168.43.146.8880 > 192.168.43.147.7772: UDP, length 120
01:31:51.346773 IP 192.168.43.147.8880 > 192.168.43.124.7773: UDP, length 120
01:31:51.396771 IP 192.168.43.147.8880 > 192.168.43.124.7773: UDP, length 120
01:31:51.400005 IP 192.168.43.146.8880 > 192.168.43.147.7772: UDP, length 120
01:31:51.445437 IP 192.168.43.146.8880 > 192.168.43.147.7772: UDP, length 120
01:31:51.446773 IP 192.168.43.147.8880 > 192.168.43.124.7773: UDP, length 120
01:31:51.495317 IP 192.168.43.146.8880 > 192.168.43.147.7772: UDP, length 120
01:31:51.496773 IP 192.168.43.147.8880 > 192.168.43.124.7773: UDP, length 120
01:31:51.546771 IP 192.168.43.147.8880 > 192.168.43.124.7773: UDP, length 120
01:31:51.550014 IP 192.168.43.146.8880 > 192.168.43.147.7772: UDP, length 120
01:31:51.596244 IP 192.168.43.146.8880 > 192.168.43.147.7772: UDP, length 120
01:31:51.596773 IP 192.168.43.147.8880 > 192.168.43.124.7773: UDP, length 120
01:31:51.646460 IP 192.168.43.146.8880 > 192.168.43.147.7772: UDP, length 120
01:31:51.646773 IP 192.168.43.147.8880 > 192.168.43.124.7773: UDP, length 120
01:31:51.696769 IP 192.168.43.147.8880 > 192.168.43.124.7773: UDP, length 120
01:31:51.700027 IP 192.168.43.146.8880 > 192.168.43.147.7772: UDP, length 120
01:31:51.746772 IP 192.168.43.147.8880 > 192.168.43.124.7773: UDP, length 120
01:31:51.747574 IP 192.168.43.146.8880 > 192.168.43.147.7772: UDP, length 120
01:31:51.796772 IP 192.168.43.147.8880 > 192.168.43.124.7773: UDP, length 120
01:31:51.806405 IP 192.168.43.146.8880 > 192.168.43.147.7772: UDP, length 120
01:31:51.845514 IP 192.168.43.146.8880 > 192.168.43.147.7772: UDP, length 120
01:31:51.846796 IP 192.168.43.147.8880 > 192.168.43.124.7773: UDP, length 120
01:31:51.896815 IP 192.168.43.147.8880 > 192.168.43.124.7773: UDP, length 120
01:31:51.900306 IP 192.168.43.146.8880 > 192.168.43.147.7772: UDP, length 120
01:31:51.946811 IP 192.168.43.147.8880 > 192.168.43.124.7773: UDP, length 120
01:31:51.946902 IP 192.168.43.146.8880 > 192.168.43.147.7772: UDP, length 120
01:31:51.996800 IP 192.168.43.147.8880 > 192.168.43.124.7773: UDP, length 120
01:31:52.000243 IP 192.168.43.146.8880 > 192.168.43.147.7772: UDP, length 120
01:31:52.046899 IP 192.168.43.147.8880 > 192.168.43.124.7773: UDP, length 120
01:31:52.047470 IP 192.168.43.146.8880 > 192.168.43.147.7772: UDP, length 120
01:31:52.096887 IP 192.168.43.147.8880 > 192.168.43.124.7773: UDP, length 120
01:31:52.097005 IP 192.168.43.146.8880 > 192.168.43.147.7772: UDP, length 120
01:31:52.146844 IP 192.168.43.147.8880 > 192.168.43.124.7773: UDP, length 120
01:31:52.152685 IP 192.168.43.146.8880 > 192.168.43.147.7772: UDP, length 120
01:31:52.195378 IP 192.168.43.146.8880 > 192.168.43.147.7772: UDP, length 120
01:31:52.196877 IP 192.168.43.147.8880 > 192.168.43.124.7773: UDP, length 120
01:31:52.246835 IP 192.168.43.147.8880 > 192.168.43.124.7773: UDP, length 120
01:31:52.250185 IP 192.168.43.146.8880 > 192.168.43.147.7772: UDP, length 120
01:31:52.295303 IP 192.168.43.146.8880 > 192.168.43.147.7772: UDP, length 120
01:31:52.296863 IP 192.168.43.147.8880 > 192.168.43.124.7773: UDP, length 120
01:31:52.346536 IP 192.168.43.146.8880 > 192.168.43.147.7772: UDP, length 120
01:31:52.346841 IP 192.168.43.147.8880 > 192.168.43.124.7773: UDP, length 120
01:31:52.396882 IP 192.168.43.147.8880 > 192.168.43.124.7773: UDP, length 120
01:31:52.401757 IP 192.168.43.146.8880 > 192.168.43.147.7772: UDP, length 120
01:31:52.446836 IP 192.168.43.147.8880 > 192.168.43.124.7773: UDP, length 120
01:31:52.447352 IP 192.168.43.146.8880 > 192.168.43.147.7772: UDP, length 120
01:31:52.495077 IP 192.168.43.146.8880 > 192.168.43.147.7772: UDP, length 120
01:31:52.496795 IP 192.168.43.147.8880 > 192.168.43.124.7773: UDP, length 120
01:31:52.546771 IP 192.168.43.147.8880 > 192.168.43.124.7773: UDP, length 120
01:31:52.550006 IP 192.168.43.146.8880 > 192.168.43.147.7772: UDP, length 120
01:31:52.596774 IP 192.168.43.147.8880 > 192.168.43.124.7773: UDP, length 120
01:31:52.621961 IP 192.168.43.146.8880 > 192.168.43.147.7772: UDP, length 120
01:31:52.646772 IP 192.168.43.147.8880 > 192.168.43.124.7773: UDP, length 120
01:31:52.650263 IP 192.168.43.146.8880 > 192.168.43.147.7772: UDP, length 120
01:31:52.696773 IP 192.168.43.147.8880 > 192.168.43.124.7773: UDP, length 120
01:31:52.722375 IP 192.168.43.146.8880 > 192.168.43.147.7772: UDP, length 120
01:31:52.746799 IP 192.168.43.147.8880 > 192.168.43.124.7773: UDP, length 120
01:31:52.754415 IP 192.168.43.146.8880 > 192.168.43.147.7772: UDP, length 120
01:31:52.796775 IP 192.168.43.147.8880 > 192.168.43.124.7773: UDP, length 120
01:31:52.844667 IP 192.168.43.146.8880 > 192.168.43.147.7772: UDP, length 120
01:31:52.846779 IP 192.168.43.147.8880 > 192.168.43.124.7773: UDP, length 120
01:31:52.886888 IP 192.168.43.146.8880 > 192.168.43.147.7772: UDP, length 120
01:31:52.894229 IP 192.168.43.146.8880 > 192.168.43.147.7772: UDP, length 120
01:31:52.896783 IP 192.168.43.147.8880 > 192.168.43.124.7773: UDP, length 120
01:31:52.946778 IP 192.168.43.147.8880 > 192.168.43.124.7773: UDP, length 120
01:31:52.958918 IP 192.168.43.146.8880 > 192.168.43.147.7772: UDP, length 120
01:31:52.996774 IP 192.168.43.147.8880 > 192.168.43.124.7773: UDP, length 120
01:31:53.029330 IP 192.168.43.146.8880 > 192.168.43.147.7772: UDP, length 120
01:31:53.046779 IP 192.168.43.147.8880 > 192.168.43.124.7773: UDP, length 120
01:31:53.060503 IP 192.168.43.146.8880 > 192.168.43.147.7772: UDP, length 120
01:31:53.096773 IP 192.168.43.147.8880 > 192.168.43.124.7773: UDP, length 120
01:31:53.100203 IP 192.168.43.146.8880 > 192.168.43.147.7772: UDP, length 120
01:31:53.146775 IP 192.168.43.147.8880 > 192.168.43.124.7773: UDP, length 120
01:31:53.173573 IP 192.168.43.146.8880 > 192.168.43.147.7772: UDP, length 120
01:31:53.196770 IP 192.168.43.147.8880 > 192.168.43.124.7773: UDP, length 120
01:31:53.207524 IP 192.168.43.146.8880 > 192.168.43.147.7772: UDP, length 120
01:31:53.246774 IP 192.168.43.147.8880 > 192.168.43.124.7773: UDP, length 120
01:31:53.257375 IP 192.168.43.146.8880 > 192.168.43.147.7772: UDP, length 120
01:31:53.296771 IP 192.168.43.147.8880 > 192.168.43.124.7773: UDP, length 120
01:31:53.321543 IP 192.168.43.146.8880 > 192.168.43.147.7772: UDP, length 120
01:31:53.346772 IP 192.168.43.147.8880 > 192.168.43.124.7773: UDP, length 120
01:31:53.359116 IP 192.168.43.146.8880 > 192.168.43.147.7772: UDP, length 120
01:31:53.396772 IP 192.168.43.147.8880 > 192.168.43.124.7773: UDP, length 120
01:31:53.400192 IP 192.168.43.146.8880 > 192.168.43.147.7772: UDP, length 120
01:31:53.446772 IP 192.168.43.147.8880 > 192.168.43.124.7773: UDP, length 120
01:31:53.485311 IP 192.168.43.146.8880 > 192.168.43.147.7772: UDP, length 120
01:31:53.496771 IP 192.168.43.147.8880 > 192.168.43.124.7773: UDP, length 120
01:31:53.542381 IP 192.168.43.146.8880 > 192.168.43.147.7772: UDP, length 120
01:31:53.546772 IP 192.168.43.147.8880 > 192.168.43.124.7773: UDP, length 120
01:31:53.596771 IP 192.168.43.147.8880 > 192.168.43.124.7773: UDP, length 120
01:31:53.646774 IP 192.168.43.147.8880 > 192.168.43.124.7773: UDP, length 120
01:31:53.688494 IP 192.168.43.146.8880 > 192.168.43.147.7772: UDP, length 120
01:31:53.688569 IP 192.168.43.146.8880 > 192.168.43.147.7772: UDP, length 120
01:31:53.688640 IP 192.168.43.146.8880 > 192.168.43.147.7772: UDP, length 120
01:31:53.696773 IP 192.168.43.147.8880 > 192.168.43.124.7773: UDP, length 120
01:31:53.746783 IP 192.168.43.147.8880 > 192.168.43.124.7773: UDP, length 120
01:31:53.756837 IP 192.168.43.146.8880 > 192.168.43.147.7772: UDP, length 120
01:31:53.756986 IP 192.168.43.146.8880 > 192.168.43.147.7772: UDP, length 120
01:31:53.796779 IP 192.168.43.147.8880 > 192.168.43.124.7773: UDP, length 120
01:31:53.846786 IP 192.168.43.147.8880 > 192.168.43.124.7773: UDP, length 120
01:31:53.848188 IP 192.168.43.146.8880 > 192.168.43.147.7772: UDP, length 120
01:31:53.885354 IP 192.168.43.146.8880 > 192.168.43.147.7772: UDP, length 120
01:31:53.896776 IP 192.168.43.147.8880 > 192.168.43.124.7773: UDP, length 120
01:31:53.916921 IP 192.168.43.146.8880 > 192.168.43.147.7772: UDP, length 120
01:31:53.946777 IP 192.168.43.147.8880 > 192.168.43.124.7773: UDP, length 120
01:31:53.946859 IP 192.168.43.146.8880 > 192.168.43.147.7772: UDP, length 120
01:31:53.996778 IP 192.168.43.147.8880 > 192.168.43.124.7773: UDP, length 120
01:31:54.000275 IP 192.168.43.146.8880 > 192.168.43.147.7772: UDP, length 120
01:31:54.043792 IP 192.168.43.146.8880 > 192.168.43.147.7772: UDP, length 120
01:31:54.046778 IP 192.168.43.147.8880 > 192.168.43.124.7773: UDP, length 120
01:31:54.096515 IP 192.168.43.146.8880 > 192.168.43.147.7772: UDP, length 120
01:31:54.096773 IP 192.168.43.147.8880 > 192.168.43.124.7773: UDP, length 120
01:31:54.146772 IP 192.168.43.147.8880 > 192.168.43.124.7773: UDP, length 120
01:31:54.150080 IP 192.168.43.146.8880 > 192.168.43.147.7772: UDP, length 120
01:31:54.196772 IP 192.168.43.147.8880 > 192.168.43.124.7773: UDP, length 120
01:31:54.198302 IP 192.168.43.146.8880 > 192.168.43.147.7772: UDP, length 120
01:31:54.246810 IP 192.168.43.147.8880 > 192.168.43.124.7773: UDP, length 120
01:31:54.246931 IP 192.168.43.146.8880 > 192.168.43.147.7772: UDP, length 120
01:31:54.296776 IP 192.168.43.147.8880 > 192.168.43.124.7773: UDP, length 120
01:31:54.302109 IP 192.168.43.146.8880 > 192.168.43.147.7772: UDP, length 120
01:31:54.342720 IP 192.168.43.146.8880 > 192.168.43.147.7772: UDP, length 120
01:31:54.346774 IP 192.168.43.147.8880 > 192.168.43.124.7773: UDP, length 120
01:31:54.395277 IP 192.168.43.146.8880 > 192.168.43.147.7772: UDP, length 120
01:31:54.396770 IP 192.168.43.147.8880 > 192.168.43.124.7773: UDP, length 120
01:31:54.446771 IP 192.168.43.147.8880 > 192.168.43.124.7773: UDP, length 120
01:31:54.450089 IP 192.168.43.146.8880 > 192.168.43.147.7772: UDP, length 120
01:31:54.496363 IP 192.168.43.146.8880 > 192.168.43.147.7772: UDP, length 120
01:31:54.496772 IP 192.168.43.147.8880 > 192.168.43.124.7773: UDP, length 120
01:31:54.546771 IP 192.168.43.147.8880 > 192.168.43.124.7773: UDP, length 120
01:31:54.552531 IP 192.168.43.146.8880 > 192.168.43.147.7772: UDP, length 120
01:31:54.595162 IP 192.168.43.146.8880 > 192.168.43.147.7772: UDP, length 120
01:31:54.596773 IP 192.168.43.147.8880 > 192.168.43.124.7773: UDP, length 120
01:31:54.646774 IP 192.168.43.147.8880 > 192.168.43.124.7773: UDP, length 120
01:31:54.650012 IP 192.168.43.146.8880 > 192.168.43.147.7772: UDP, length 120
01:31:54.695770 IP 192.168.43.146.8880 > 192.168.43.147.7772: UDP, length 120
01:31:54.696774 IP 192.168.43.147.8880 > 192.168.43.124.7773: UDP, length 120
01:31:54.746174 IP 192.168.43.146.8880 > 192.168.43.147.7772: UDP, length 120
01:31:54.746771 IP 192.168.43.147.8880 > 192.168.43.124.7773: UDP, length 120
01:31:54.796771 IP 192.168.43.147.8880 > 192.168.43.124.7773: UDP, length 120
01:31:54.800274 IP 192.168.43.146.8880 > 192.168.43.147.7772: UDP, length 120
01:31:54.846778 IP 192.168.43.147.8880 > 192.168.43.124.7773: UDP, length 120
01:31:54.872550 IP 192.168.43.146.8880 > 192.168.43.147.7772: UDP, length 120
01:31:54.896241 IP 192.168.43.146.8880 > 192.168.43.147.7772: UDP, length 120
01:31:54.896774 IP 192.168.43.147.8880 > 192.168.43.124.7773: UDP, length 120
01:31:54.946771 IP 192.168.43.147.8880 > 192.168.43.124.7773: UDP, length 120
01:31:54.958405 IP 192.168.43.146.8880 > 192.168.43.147.7772: UDP, length 120
01:31:54.996774 IP 192.168.43.147.8880 > 192.168.43.124.7773: UDP, length 120
01:31:55.000235 IP 192.168.43.146.8880 > 192.168.43.147.7772: UDP, length 120
01:31:55.046779 IP 192.168.43.147.8880 > 192.168.43.124.7773: UDP, length 120
01:31:55.050368 IP 192.168.43.146.8880 > 192.168.43.147.7772: UDP, length 120
01:31:55.096132 IP 192.168.43.146.8880 > 192.168.43.147.7772: UDP, length 120
01:31:55.096772 IP 192.168.43.147.8880 > 192.168.43.124.7773: UDP, length 120
01:31:55.146771 IP 192.168.43.147.8880 > 192.168.43.124.7773: UDP, length 120
01:31:55.151781 IP 192.168.43.146.8880 > 192.168.43.147.7772: UDP, length 120
01:31:55.196772 IP 192.168.43.147.8880 > 192.168.43.124.7773: UDP, length 120
01:31:55.198493 IP 192.168.43.146.8880 > 192.168.43.147.7772: UDP, length 120
01:31:55.246772 IP 192.168.43.147.8880 > 192.168.43.124.7773: UDP, length 120
01:31:55.254230 IP 192.168.43.146.8880 > 192.168.43.147.7772: UDP, length 120
01:31:55.296771 IP 192.168.43.147.8880 > 192.168.43.124.7773: UDP, length 120
01:31:55.301965 IP 192.168.43.146.8880 > 192.168.43.147.7772: UDP, length 120
01:31:55.345614 IP 192.168.43.146.8880 > 192.168.43.147.7772: UDP, length 120
01:31:55.346772 IP 192.168.43.147.8880 > 192.168.43.124.7773: UDP, length 120
01:31:55.396771 IP 192.168.43.147.8880 > 192.168.43.124.7773: UDP, length 120
01:31:55.400039 IP 192.168.43.146.8880 > 192.168.43.147.7772: UDP, length 120
01:31:55.446430 IP 192.168.43.146.8880 > 192.168.43.147.7772: UDP, length 120
01:31:55.446771 IP 192.168.43.147.8880 > 192.168.43.124.7773: UDP, length 120
01:31:55.496772 IP 192.168.43.147.8880 > 192.168.43.124.7773: UDP, length 120
01:31:55.497522 IP 192.168.43.146.8880 > 192.168.43.147.7772: UDP, length 120
01:31:55.546772 IP 192.168.43.147.8880 > 192.168.43.124.7773: UDP, length 120
01:31:55.550188 IP 192.168.43.146.8880 > 192.168.43.147.7772: UDP, length 120
01:31:55.595731 IP 192.168.43.146.8880 > 192.168.43.147.7772: UDP, length 120
01:31:55.596773 IP 192.168.43.147.8880 > 192.168.43.124.7773: UDP, length 120
01:31:55.645435 IP 192.168.43.146.8880 > 192.168.43.147.7772: UDP, length 120
01:31:55.646776 IP 192.168.43.147.8880 > 192.168.43.124.7773: UDP, length 120
01:31:55.693465 IP 192.168.43.146.8880 > 192.168.43.147.7772: UDP, length 120
01:31:55.696772 IP 192.168.43.147.8880 > 192.168.43.124.7773: UDP, length 120
01:31:55.745425 IP 192.168.43.146.8880 > 192.168.43.147.7772: UDP, length 120
01:31:55.746800 IP 192.168.43.147.8880 > 192.168.43.124.7773: UDP, length 120
01:31:55.796773 IP 192.168.43.147.8880 > 192.168.43.124.7773: UDP, length 120
01:31:55.800016 IP 192.168.43.146.8880 > 192.168.43.147.7772: UDP, length 120
01:31:55.846779 IP 192.168.43.147.8880 > 192.168.43.124.7773: UDP, length 120
01:31:55.848893 IP 192.168.43.146.8880 > 192.168.43.147.7772: UDP, length 120
01:31:55.895307 IP 192.168.43.146.8880 > 192.168.43.147.7772: UDP, length 120
01:31:55.896775 IP 192.168.43.147.8880 > 192.168.43.124.7773: UDP, length 120
01:31:55.946771 IP 192.168.43.147.8880 > 192.168.43.124.7773: UDP, length 120
01:31:55.950313 IP 192.168.43.146.8880 > 192.168.43.147.7772: UDP, length 120
01:31:55.996772 IP 192.168.43.147.8880 > 192.168.43.124.7773: UDP, length 120
01:31:55.997042 IP 192.168.43.146.8880 > 192.168.43.147.7772: UDP, length 120
01:31:56.045226 IP 192.168.43.146.8880 > 192.168.43.147.7772: UDP, length 120
01:31:56.046776 IP 192.168.43.147.8880 > 192.168.43.124.7773: UDP, length 120
01:31:56.096774 IP 192.168.43.147.8880 > 192.168.43.124.7773: UDP, length 120
01:31:56.100379 IP 192.168.43.146.8880 > 192.168.43.147.7772: UDP, length 120
01:31:56.145276 IP 192.168.43.146.8880 > 192.168.43.147.7772: UDP, length 120
01:31:56.146775 IP 192.168.43.147.8880 > 192.168.43.124.7773: UDP, length 120
01:31:56.196772 IP 192.168.43.147.8880 > 192.168.43.124.7773: UDP, length 120
01:31:56.200811 IP 192.168.43.146.8880 > 192.168.43.147.7772: UDP, length 120
01:31:56.246179 IP 192.168.43.146.8880 > 192.168.43.147.7772: UDP, length 120
01:31:56.246774 IP 192.168.43.147.8880 > 192.168.43.124.7773: UDP, length 120
01:31:56.296770 IP 192.168.43.147.8880 > 192.168.43.124.7773: UDP, length 120
01:31:56.300456 IP 192.168.43.146.8880 > 192.168.43.147.7772: UDP, length 120
01:31:56.346772 IP 192.168.43.147.8880 > 192.168.43.124.7773: UDP, length 120
01:31:56.349373 IP 192.168.43.146.8880 > 192.168.43.147.7772: UDP, length 120
01:31:56.395342 IP 192.168.43.146.8880 > 192.168.43.147.7772: UDP, length 120
01:31:56.396773 IP 192.168.43.147.8880 > 192.168.43.124.7773: UDP, length 120
01:31:56.446772 IP 192.168.43.147.8880 > 192.168.43.124.7773: UDP, length 120
01:31:56.452033 IP 192.168.43.146.8880 > 192.168.43.147.7772: UDP, length 120
01:31:56.495350 IP 192.168.43.146.8880 > 192.168.43.147.7772: UDP, length 120
01:31:56.496773 IP 192.168.43.147.8880 > 192.168.43.124.7773: UDP, length 120
01:31:56.546771 IP 192.168.43.147.8880 > 192.168.43.124.7773: UDP, length 120
01:31:56.550104 IP 192.168.43.146.8880 > 192.168.43.147.7772: UDP, length 120
01:31:56.596772 IP 192.168.43.147.8880 > 192.168.43.124.7773: UDP, length 120
01:31:56.600013 IP 192.168.43.146.8880 > 192.168.43.147.7772: UDP, length 120
01:31:56.645443 IP 192.168.43.146.8880 > 192.168.43.147.7772: UDP, length 120
01:31:56.646777 IP 192.168.43.147.8880 > 192.168.43.124.7773: UDP, length 120
01:31:56.695483 IP 192.168.43.146.8880 > 192.168.43.147.7772: UDP, length 120
01:31:56.696771 IP 192.168.43.147.8880 > 192.168.43.124.7773: UDP, length 120
01:31:56.746771 IP 192.168.43.147.8880 > 192.168.43.124.7773: UDP, length 120
01:31:56.754790 IP 192.168.43.146.8880 > 192.168.43.147.7772: UDP, length 120
01:31:56.795371 IP 192.168.43.146.8880 > 192.168.43.147.7772: UDP, length 120
01:31:56.796772 IP 192.168.43.147.8880 > 192.168.43.124.7773: UDP, length 120
01:31:56.846791 IP 192.168.43.147.8880 > 192.168.43.124.7773: UDP, length 120
01:31:56.850307 IP 192.168.43.146.8880 > 192.168.43.147.7772: UDP, length 120
01:31:56.896352 IP 192.168.43.146.8880 > 192.168.43.147.7772: UDP, length 120
01:31:56.896809 IP 192.168.43.147.8880 > 192.168.43.124.7773: UDP, length 120
01:31:56.945853 IP 192.168.43.146.8880 > 192.168.43.147.7772: UDP, length 120
01:31:56.946798 IP 192.168.43.147.8880 > 192.168.43.124.7773: UDP, length 120
01:31:56.996796 IP 192.168.43.147.8880 > 192.168.43.124.7773: UDP, length 120
01:31:57.000827 IP 192.168.43.146.8880 > 192.168.43.147.7772: UDP, length 120
01:31:57.046571 IP 192.168.43.146.8880 > 192.168.43.147.7772: UDP, length 120
01:31:57.046799 IP 192.168.43.147.8880 > 192.168.43.124.7773: UDP, length 120
01:31:57.096797 IP 192.168.43.147.8880 > 192.168.43.124.7773: UDP, length 120
01:31:57.100200 IP 192.168.43.146.8880 > 192.168.43.147.7772: UDP, length 120
01:31:57.146810 IP 192.168.43.147.8880 > 192.168.43.124.7773: UDP, length 120
01:31:57.150437 IP 192.168.43.146.8880 > 192.168.43.147.7772: UDP, length 120
01:31:57.195601 IP 192.168.43.146.8880 > 192.168.43.147.7772: UDP, length 120
01:31:57.196806 IP 192.168.43.147.8880 > 192.168.43.124.7773: UDP, length 120
01:31:57.246271 IP 192.168.43.146.8880 > 192.168.43.147.7772: UDP, length 120
01:31:57.246835 IP 192.168.43.147.8880 > 192.168.43.124.7773: UDP, length 120
01:31:57.296798 IP 192.168.43.147.8880 > 192.168.43.124.7773: UDP, length 120
01:31:57.302548 IP 192.168.43.146.8880 > 192.168.43.147.7772: UDP, length 120
01:31:57.345804 IP 192.168.43.146.8880 > 192.168.43.147.7772: UDP, length 120
01:31:57.346799 IP 192.168.43.147.8880 > 192.168.43.124.7773: UDP, length 120
01:31:57.396799 IP 192.168.43.147.8880 > 192.168.43.124.7773: UDP, length 120
01:31:57.399787 IP 192.168.43.146.8880 > 192.168.43.147.7772: UDP, length 120
01:31:57.446822 IP 192.168.43.147.8880 > 192.168.43.124.7773: UDP, length 120
01:31:57.450686 IP 192.168.43.146.8880 > 192.168.43.147.7772: UDP, length 120
01:31:57.495721 IP 192.168.43.146.8880 > 192.168.43.147.7772: UDP, length 120
01:31:57.496854 IP 192.168.43.147.8880 > 192.168.43.124.7773: UDP, length 120
01:31:57.545639 IP 192.168.43.146.8880 > 192.168.43.147.7772: UDP, length 120
01:31:57.546951 IP 192.168.43.147.8880 > 192.168.43.124.7773: UDP, length 120
01:31:57.596848 IP 192.168.43.147.8880 > 192.168.43.124.7773: UDP, length 120
01:31:57.628613 IP 192.168.43.146.8880 > 192.168.43.147.7772: UDP, length 120
01:31:57.646863 IP 192.168.43.147.8880 > 192.168.43.124.7773: UDP, length 120
01:31:57.673282 IP 192.168.43.146.8880 > 192.168.43.147.7772: UDP, length 120
01:31:57.696851 IP 192.168.43.147.8880 > 192.168.43.124.7773: UDP, length 120
01:31:57.697015 IP 192.168.43.146.8880 > 192.168.43.147.7772: UDP, length 120
01:31:57.746829 IP 192.168.43.147.8880 > 192.168.43.124.7773: UDP, length 120
01:31:57.774483 IP 192.168.43.146.8880 > 192.168.43.147.7772: UDP, length 120
01:31:57.796844 IP 192.168.43.147.8880 > 192.168.43.124.7773: UDP, length 120
01:31:57.830791 IP 192.168.43.146.8880 > 192.168.43.147.7772: UDP, length 120
01:31:57.846896 IP 192.168.43.147.8880 > 192.168.43.124.7773: UDP, length 120
01:31:57.891883 IP 192.168.43.146.8880 > 192.168.43.147.7772: UDP, length 120
01:31:57.896875 IP 192.168.43.147.8880 > 192.168.43.124.7773: UDP, length 120
01:31:57.921039 IP 192.168.43.146.8880 > 192.168.43.147.7772: UDP, length 120
01:31:57.946815 IP 192.168.43.147.8880 > 192.168.43.124.7773: UDP, length 120
01:31:57.959048 IP 192.168.43.146.8880 > 192.168.43.147.7772: UDP, length 120
01:31:57.996201 IP 192.168.43.146.8880 > 192.168.43.147.7772: UDP, length 120
01:31:57.996778 IP 192.168.43.147.8880 > 192.168.43.124.7773: UDP, length 120
01:31:58.046774 IP 192.168.43.147.8880 > 192.168.43.124.7773: UDP, length 120
01:31:58.081218 IP 192.168.43.146.8880 > 192.168.43.147.7772: UDP, length 120
01:31:58.096772 IP 192.168.43.147.8880 > 192.168.43.124.7773: UDP, length 120
01:31:58.127609 IP 192.168.43.146.8880 > 192.168.43.147.7772: UDP, length 120
01:31:58.146782 IP 192.168.43.147.8880 > 192.168.43.124.7773: UDP, length 120
01:31:58.196777 IP 192.168.43.147.8880 > 192.168.43.124.7773: UDP, length 120
01:31:58.197309 IP 192.168.43.146.8880 > 192.168.43.147.7772: UDP, length 120
01:31:58.199426 IP 192.168.43.146.8880 > 192.168.43.147.7772: UDP, length 120
01:31:58.246776 IP 192.168.43.147.8880 > 192.168.43.124.7773: UDP, length 120
01:31:58.266889 IP 192.168.43.146.8880 > 192.168.43.147.7772: UDP, length 120
01:31:58.295919 IP 192.168.43.146.8880 > 192.168.43.147.7772: UDP, length 120
01:31:58.296773 IP 192.168.43.147.8880 > 192.168.43.124.7773: UDP, length 120
01:31:58.346773 IP 192.168.43.147.8880 > 192.168.43.124.7773: UDP, length 120
01:31:58.353273 IP 192.168.43.146.8880 > 192.168.43.147.7772: UDP, length 120
01:31:58.396772 IP 192.168.43.147.8880 > 192.168.43.124.7773: UDP, length 120
01:31:58.435337 IP 192.168.43.146.8880 > 192.168.43.147.7772: UDP, length 120
01:31:58.446253 IP 192.168.43.146.8880 > 192.168.43.147.7772: UDP, length 120
01:31:58.446774 IP 192.168.43.147.8880 > 192.168.43.124.7773: UDP, length 120
01:31:58.496771 IP 192.168.43.147.8880 > 192.168.43.124.7773: UDP, length 120
01:31:58.504170 IP 192.168.43.146.8880 > 192.168.43.147.7772: UDP, length 120
01:31:58.546773 IP 192.168.43.147.8880 > 192.168.43.124.7773: UDP, length 120
01:31:58.550009 IP 192.168.43.146.8880 > 192.168.43.147.7772: UDP, length 120
01:31:58.596771 IP 192.168.43.147.8880 > 192.168.43.124.7773: UDP, length 120
01:31:58.602402 IP 192.168.43.146.8880 > 192.168.43.147.7772: UDP, length 120
01:31:58.646773 IP 192.168.43.147.8880 > 192.168.43.124.7773: UDP, length 120
01:31:58.675004 IP 192.168.43.146.8880 > 192.168.43.147.7772: UDP, length 120
01:31:58.696771 IP 192.168.43.147.8880 > 192.168.43.124.7773: UDP, length 120
01:31:58.700288 IP 192.168.43.146.8880 > 192.168.43.147.7772: UDP, length 120
01:31:58.746813 IP 192.168.43.147.8880 > 192.168.43.124.7773: UDP, length 120
01:31:58.752554 IP 192.168.43.146.8880 > 192.168.43.147.7772: UDP, length 120
01:31:58.796779 IP 192.168.43.147.8880 > 192.168.43.124.7773: UDP, length 120
01:31:58.800030 IP 192.168.43.146.8880 > 192.168.43.147.7772: UDP, length 120
01:31:58.846787 IP 192.168.43.147.8880 > 192.168.43.124.7773: UDP, length 120
01:31:58.855252 IP 192.168.43.146.8880 > 192.168.43.147.7772: UDP, length 120
01:31:58.896776 IP 192.168.43.147.8880 > 192.168.43.124.7773: UDP, length 120
01:31:58.906116 IP 192.168.43.146.8880 > 192.168.43.147.7772: UDP, length 120
01:31:58.946772 IP 192.168.43.147.8880 > 192.168.43.124.7773: UDP, length 120
01:31:58.947373 IP 192.168.43.146.8880 > 192.168.43.147.7772: UDP, length 120
01:31:58.996772 IP 192.168.43.147.8880 > 192.168.43.124.7773: UDP, length 120
01:31:59.000015 IP 192.168.43.146.8880 > 192.168.43.147.7772: UDP, length 120
01:31:59.046773 IP 192.168.43.147.8880 > 192.168.43.124.7773: UDP, length 120
01:31:59.096772 IP 192.168.43.147.8880 > 192.168.43.124.7773: UDP, length 120
01:31:59.121913 IP 192.168.43.146.8880 > 192.168.43.147.7772: UDP, length 120
01:31:59.122054 IP 192.168.43.146.8880 > 192.168.43.147.7772: UDP, length 120
01:31:59.146772 IP 192.168.43.147.8880 > 192.168.43.124.7773: UDP, length 120
01:31:59.160910 IP 192.168.43.146.8880 > 192.168.43.147.7772: UDP, length 120
01:31:59.196773 IP 192.168.43.147.8880 > 192.168.43.124.7773: UDP, length 120
01:31:59.204429 IP 192.168.43.146.8880 > 192.168.43.147.7772: UDP, length 120
01:31:59.246775 IP 192.168.43.147.8880 > 192.168.43.124.7773: UDP, length 120
01:31:59.296772 IP 192.168.43.147.8880 > 192.168.43.124.7773: UDP, length 120
01:31:59.309707 IP 192.168.43.146.8880 > 192.168.43.147.7772: UDP, length 120
01:31:59.309787 IP 192.168.43.146.8880 > 192.168.43.147.7772: UDP, length 120
01:31:59.346775 IP 192.168.43.147.8880 > 192.168.43.124.7773: UDP, length 120
01:31:59.350806 IP 192.168.43.146.8880 > 192.168.43.147.7772: UDP, length 120
01:31:59.396222 IP 192.168.43.146.8880 > 192.168.43.147.7772: UDP, length 120
01:31:59.396770 IP 192.168.43.147.8880 > 192.168.43.124.7773: UDP, length 120
01:31:59.446771 IP 192.168.43.147.8880 > 192.168.43.124.7773: UDP, length 120
01:31:59.452547 IP 192.168.43.146.8880 > 192.168.43.147.7772: UDP, length 120
01:31:59.495909 IP 192.168.43.146.8880 > 192.168.43.147.7772: UDP, length 120
01:31:59.496771 IP 192.168.43.147.8880 > 192.168.43.124.7773: UDP, length 120
01:31:59.542559 IP 192.168.43.146.8880 > 192.168.43.147.7772: UDP, length 120
01:31:59.546771 IP 192.168.43.147.8880 > 192.168.43.124.7773: UDP, length 120
01:31:59.596771 IP 192.168.43.147.8880 > 192.168.43.124.7773: UDP, length 120
01:31:59.605190 IP 192.168.43.146.8880 > 192.168.43.147.7772: UDP, length 120
01:31:59.645831 IP 192.168.43.146.8880 > 192.168.43.147.7772: UDP, length 120
01:31:59.646778 IP 192.168.43.147.8880 > 192.168.43.124.7773: UDP, length 120
01:31:59.695655 IP 192.168.43.146.8880 > 192.168.43.147.7772: UDP, length 120
01:31:59.696772 IP 192.168.43.147.8880 > 192.168.43.124.7773: UDP, length 120
01:31:59.746774 IP 192.168.43.147.8880 > 192.168.43.124.7773: UDP, length 120
01:31:59.750466 IP 192.168.43.146.8880 > 192.168.43.147.7772: UDP, length 120
01:31:59.792423 IP 192.168.43.146.8880 > 192.168.43.147.7772: UDP, length 120
01:31:59.796771 IP 192.168.43.147.8880 > 192.168.43.124.7773: UDP, length 120
01:31:59.842576 IP 192.168.43.146.8880 > 192.168.43.147.7772: UDP, length 120
01:31:59.846780 IP 192.168.43.147.8880 > 192.168.43.124.7773: UDP, length 120
01:31:59.896773 IP 192.168.43.147.8880 > 192.168.43.124.7773: UDP, length 120
01:31:59.901074 IP 192.168.43.146.8880 > 192.168.43.147.7772: UDP, length 120
01:31:59.945518 IP 192.168.43.146.8880 > 192.168.43.147.7772: UDP, length 120
01:31:59.946770 IP 192.168.43.147.8880 > 192.168.43.124.7773: UDP, length 120
01:31:59.995541 IP 192.168.43.146.8880 > 192.168.43.147.7772: UDP, length 120
01:31:59.996770 IP 192.168.43.147.8880 > 192.168.43.124.7773: UDP, length 120
01:32:00.046771 IP 192.168.43.147.8880 > 192.168.43.124.7773: UDP, length 120
01:32:00.050452 IP 192.168.43.146.8880 > 192.168.43.147.7772: UDP, length 120
01:32:00.095460 IP 192.168.43.146.8880 > 192.168.43.147.7772: UDP, length 120
01:32:00.096770 IP 192.168.43.147.8880 > 192.168.43.124.7773: UDP, length 120
01:32:00.146775 IP 192.168.43.147.8880 > 192.168.43.124.7773: UDP, length 120
01:32:00.151104 IP 192.168.43.146.8880 > 192.168.43.147.7772: UDP, length 120
01:32:00.196058 IP 192.168.43.146.8880 > 192.168.43.147.7772: UDP, length 120
01:32:00.196771 IP 192.168.43.147.8880 > 192.168.43.124.7773: UDP, length 120
01:32:00.245889 IP 192.168.43.146.8880 > 192.168.43.147.7772: UDP, length 120
01:32:00.246811 IP 192.168.43.147.8880 > 192.168.43.124.7773: UDP, length 120
01:32:00.296782 IP 192.168.43.147.8880 > 192.168.43.124.7773: UDP, length 120
01:32:00.300027 IP 192.168.43.146.8880 > 192.168.43.147.7772: UDP, length 120
01:32:00.345580 IP 192.168.43.146.8880 > 192.168.43.147.7772: UDP, length 120
01:32:00.346780 IP 192.168.43.147.8880 > 192.168.43.124.7773: UDP, length 120
01:32:00.395429 IP 192.168.43.146.8880 > 192.168.43.147.7772: UDP, length 120
01:32:00.396772 IP 192.168.43.147.8880 > 192.168.43.124.7773: UDP, length 120
01:32:00.446771 IP 192.168.43.147.8880 > 192.168.43.124.7773: UDP, length 120
01:32:00.450013 IP 192.168.43.146.8880 > 192.168.43.147.7772: UDP, length 120
01:32:00.496772 IP 192.168.43.147.8880 > 192.168.43.124.7773: UDP, length 120
01:32:00.496952 IP 192.168.43.146.8880 > 192.168.43.147.7772: UDP, length 120
01:32:00.546755 IP 192.168.43.146.8880 > 192.168.43.147.7772: UDP, length 120
01:32:00.546822 IP 192.168.43.147.8880 > 192.168.43.124.7773: UDP, length 120
01:32:00.596771 IP 192.168.43.147.8880 > 192.168.43.124.7773: UDP, length 120
01:32:00.600419 IP 192.168.43.146.8880 > 192.168.43.147.7772: UDP, length 120
01:32:00.646774 IP 192.168.43.147.8880 > 192.168.43.124.7773: UDP, length 120
01:32:00.649877 IP 192.168.43.146.8880 > 192.168.43.147.7772: UDP, length 120
01:32:00.696773 IP 192.168.43.147.8880 > 192.168.43.124.7773: UDP, length 120
01:32:00.699022 IP 192.168.43.146.8880 > 192.168.43.147.7772: UDP, length 120
01:32:00.746772 IP 192.168.43.147.8880 > 192.168.43.124.7773: UDP, length 120
01:32:00.750421 IP 192.168.43.146.8880 > 192.168.43.147.7772: UDP, length 120
01:32:00.795564 IP 192.168.43.146.8880 > 192.168.43.147.7772: UDP, length 120
01:32:00.796773 IP 192.168.43.147.8880 > 192.168.43.124.7773: UDP, length 120
01:32:00.846038 IP 192.168.43.146.8880 > 192.168.43.147.7772: UDP, length 120
01:32:00.846780 IP 192.168.43.147.8880 > 192.168.43.124.7773: UDP, length 120
01:32:00.896773 IP 192.168.43.147.8880 > 192.168.43.124.7773: UDP, length 120
01:32:00.900517 IP 192.168.43.146.8880 > 192.168.43.147.7772: UDP, length 120
01:32:00.946775 IP 192.168.43.147.8880 > 192.168.43.124.7773: UDP, length 120
01:32:00.949536 IP 192.168.43.146.8880 > 192.168.43.147.7772: UDP, length 120
01:32:00.996772 IP 192.168.43.147.8880 > 192.168.43.124.7773: UDP, length 120
01:32:01.005221 IP 192.168.43.146.8880 > 192.168.43.147.7772: UDP, length 120
01:32:01.046816 IP 192.168.43.147.8880 > 192.168.43.124.7773: UDP, length 120
01:32:01.050093 IP 192.168.43.146.8880 > 192.168.43.147.7772: UDP, length 120
01:32:01.096780 IP 192.168.43.147.8880 > 192.168.43.124.7773: UDP, length 120
01:32:01.101195 IP 192.168.43.146.8880 > 192.168.43.147.7772: UDP, length 120
01:32:01.145463 IP 192.168.43.146.8880 > 192.168.43.147.7772: UDP, length 120
01:32:01.146773 IP 192.168.43.147.8880 > 192.168.43.124.7773: UDP, length 120
01:32:01.196771 IP 192.168.43.147.8880 > 192.168.43.124.7773: UDP, length 120
01:32:01.200517 IP 192.168.43.146.8880 > 192.168.43.147.7772: UDP, length 120
01:32:01.245915 IP 192.168.43.146.8880 > 192.168.43.147.7772: UDP, length 120
01:32:01.246773 IP 192.168.43.147.8880 > 192.168.43.124.7773: UDP, length 120
01:32:01.296772 IP 192.168.43.147.8880 > 192.168.43.124.7773: UDP, length 120
01:32:01.300743 IP 192.168.43.146.8880 > 192.168.43.147.7772: UDP, length 120
01:32:01.346777 IP 192.168.43.147.8880 > 192.168.43.124.7773: UDP, length 120
01:32:01.347156 IP 192.168.43.146.8880 > 192.168.43.147.7772: UDP, length 120
01:32:01.395519 IP 192.168.43.146.8880 > 192.168.43.147.7772: UDP, length 120
01:32:01.396775 IP 192.168.43.147.8880 > 192.168.43.124.7773: UDP, length 120
01:32:01.446771 IP 192.168.43.147.8880 > 192.168.43.124.7773: UDP, length 120
01:32:01.454878 IP 192.168.43.146.8880 > 192.168.43.147.7772: UDP, length 120
01:32:01.496774 IP 192.168.43.147.8880 > 192.168.43.124.7773: UDP, length 120
01:32:01.499477 IP 192.168.43.146.8880 > 192.168.43.147.7772: UDP, length 120
01:32:01.546771 IP 192.168.43.147.8880 > 192.168.43.124.7773: UDP, length 120
01:32:01.546837 IP 192.168.43.146.8880 > 192.168.43.147.7772: UDP, length 120
01:32:01.596773 IP 192.168.43.147.8880 > 192.168.43.124.7773: UDP, length 120
