01:31:48.334213 IP 192.168.43.124.8880 > 192.168.43.146.7771: UDP, length 120
01:31:48.387707 IP 192.168.43.124.8880 > 192.168.43.146.7771: UDP, length 120
01:31:48.441922 IP 192.168.43.124.8880 > 192.168.43.146.7771: UDP, length 120
01:31:48.477197 IP 192.168.43.124.8880 > 192.168.43.146.7771: UDP, length 120
01:31:48.527651 IP 192.168.43.124.8880 > 192.168.43.146.7771: UDP, length 120
01:31:48.586157 IP 192.168.43.124.8880 > 192.168.43.146.7771: UDP, length 120
01:31:48.625266 IP 192.168.43.124.8880 > 192.168.43.146.7771: UDP, length 120
01:31:48.687361 IP 192.168.43.124.8880 > 192.168.43.146.7771: UDP, length 120
01:31:48.725389 IP 192.168.43.124.8880 > 192.168.43.146.7771: UDP, length 120
01:31:48.770198 IP 192.168.43.146.8880 > 192.168.43.147.7772: UDP, length 120
01:31:48.773591 IP 192.168.43.124.8880 > 192.168.43.146.7771: UDP, length 120
01:31:48.820335 IP 192.168.43.146.8880 > 192.168.43.147.7772: UDP, length 120
01:31:48.841182 IP 192.168.43.124.8880 > 192.168.43.146.7771: UDP, length 120
01:31:48.870289 IP 192.168.43.146.8880 > 192.168.43.147.7772: UDP, length 120
01:31:48.874113 IP 192.168.43.124.8880 > 192.168.43.146.7771: UDP, length 120
01:31:48.920263 IP 192.168.43.146.8880 > 192.168.43.147.7772: UDP, length 120
01:31:48.932099 IP 192.168.43.124.8880 > 192.168.43.146.7771: UDP, length 120
01:31:48.970225 IP 192.168.43.146.8880 > 192.168.43.147.7772: UDP, length 120
01:31:48.973479 IP 192.168.43.124.8880 > 192.168.43.146.7771: UDP, length 120
01:31:49.020221 IP 192.168.43.146.8880 > 192.168.43.147.7772: UDP, length 120
01:31:49.031948 IP 192.168.43.124.8880 > 192.168.43.146.7771: UDP, length 120
01:31:49.070289 IP 192.168.43.146.8880 > 192.168.43.147.7772: UDP, length 120
01:31:49.073749 IP 192.168.43.124.8880 > 192.168.43.146.7771: UDP, length 120
01:31:49.120281 IP 192.168.43.146.8880 > 192.168.43.147.7772: UDP, length 120
01:31:49.123070 IP 192.168.43.124.8880 > 192.168.43.146.7771: UDP, length 120
01:31:49.170266 IP 192.168.43.146.8880 > 192.168.43.147.7772: UDP, length 120
01:31:49.181398 IP 192.168.43.124.8880 > 192.168.43.146.7771: UDP, length 120
01:31:49.220226 IP 192.168.43.146.8880 > 192.168.43.147.7772: UDP, length 120
01:31:49.223472 IP 192.168.43.124.8880 > 192.168.43.146.7771: UDP, length 120
01:31:49.270218 IP 192.168.43.146.8880 > 192.168.43.147.7772: UDP, length 120
01:31:49.273468 IP 192.168.43.124.8880 > 192.168.43.146.7771: UDP, length 120
01:31:49.320221 IP 192.168.43.146.8880 > 192.168.43.147.7772: UDP, length 120
01:31:49.331908 IP 192.168.43.124.8880 > 192.168.43.146.7771: UDP, length 120
01:31:49.370221 IP 192.168.43.146.8880 > 192.168.43.147.7772: UDP, length 120
01:31:49.373482 IP 192.168.43.124.8880 > 192.168.43.146.7771: UDP, length 120
01:31:49.420215 IP 192.168.43.146.8880 > 192.168.43.147.7772: UDP, length 120
01:31:49.423474 IP 192.168.43.124.8880 > 192.168.43.146.7771: UDP, length 120
01:31:49.470213 IP 192.168.43.146.8880 > 192.168.43.147.7772: UDP, length 120
01:31:49.483292 IP 192.168.43.124.8880 > 192.168.43.146.7771: UDP, length 120
01:31:49.520213 IP 192.168.43.146.8880 > 192.168.43.147.7772: UDP, length 120
01:31:49.523480 IP 192.168.43.124.8880 > 192.168.43.146.7771: UDP, length 120
01:31:49.570214 IP 192.168.43.146.8880 > 192.168.43.147.7772: UDP, length 120
01:31:49.573467 IP 192.168.43.124.8880 > 192.168.43.146.7771: UDP, length 120
01:31:49.620214 IP 192.168.43.146.8880 > 192.168.43.147.7772: UDP, length 120
01:31:49.631972 IP 192.168.43.124.8880 > 192.168.43.146.7771: UDP, length 120
01:31:49.670214 IP 192.168.43.146.8880 > 192.168.43.147.7772: UDP, length 120
01:31:49.673473 IP 192.168.43.124.8880 > 192.168.43.146.7771: UDP, length 120
01:31:49.720213 IP 192.168.43.146.8880 > 192.168.43.147.7772: UDP, length 120
01:31:49.723469 IP 192.168.43.124.8880 > 192.168.43.146.7771: UDP, length 120
01:31:49.770213 IP 192.168.43.146.8880 > 192.168.43.147.7772: UDP, length 120
01:31:49.781746 IP 192.168.43.124.8880 > 192.168.43.146.7771: UDP, length 120
01:31:49.820222 IP 192.168.43.146.8880 > 192.168.43.147.7772: UDP, length 120
01:31:49.823664 IP 192.168.43.124.8880 > 192.168.43.146.7771: UDP, length 120
01:31:49.870214 IP 192.168.43.146.8880 > 192.168.43.147.7772: UDP, length 120
01:31:49.874258 IP 192.168.43.124.8880 > 192.168.43.146.7771: UDP, length 120
01:31:49.920214 IP 192.168.43.146.8880 > 192.168.43.147.7772: UDP, length 120
01:31:49.934271 IP 192.168.43.124.8880 > 192.168.43.146.7771: UDP, length 120
01:31:49.970214 IP 192.168.43.146.8880 > 192.168.43.147.7772: UDP, length 120
01:31:49.973473 IP 192.168.43.124.8880 > 192.168.43.146.7771: UDP, length 120
01:31:50.020213 IP 192.168.43.146.8880 > 192.168.43.147.7772: UDP, length 120
01:31:50.032951 IP 192.168.43.124.8880 > 192.168.43.146.7771: UDP, length 120
01:31:50.070215 IP 192.168.43.146.8880 > 192.168.43.147.7772: UDP, length 120
01:31:50.073475 IP 192.168.43.124.8880 > 192.168.43.146.7771: UDP, length 120
01:31:50.120215 IP 192.168.43.146.8880 > 192.168.43.147.7772: UDP, length 120
01:31:50.125952 IP 192.168.43.124.8880 > 192.168.43.146.7771: UDP, length 120
01:31:50.170274 IP 192.168.43.146.8880 > 192.168.43.147.7772: UDP, length 120
01:31:50.188414 IP 192.168.43.124.8880 > 192.168.43.146.7771: UDP, length 120
01:31:50.220248 IP 192.168.43.146.8880 > 192.168.43.147.7772: UDP, length 120
01:31:50.223486 IP 192.168.43.124.8880 > 192.168.43.146.7771: UDP, length 120
01:31:50.270218 IP 192.168.43.146.8880 > 192.168.43.147.7772: UDP, length 120
01:31:50.283381 IP 192.168.43.124.8880 > 192.168.43.146.7771: UDP, length 120
01:31:50.320214 IP 192.168.43.146.8880 > 192.168.43.147.7772: UDP, length 120
01:31:50.323453 IP 192.168.43.124.8880 > 192.168.43.146.7771: UDP, length 120
01:31:50.370219 IP 192.168.43.146.8880 > 192.168.43.147.7772: UDP, length 120
01:31:50.384450 IP 192.168.43.124.8880 > 192.168.43.146.7771: UDP, length 120
01:31:50.420249 IP 192.168.43.146.8880 > 192.168.43.147.7772: UDP, length 120
01:31:50.423525 IP 192.168.43.124.8880 > 192.168.43.146.7771: UDP, length 120
01:31:50.470221 IP 192.168.43.146.8880 > 192.168.43.147.7772: UDP, length 120
01:31:50.473652 IP 192.168.43.124.8880 > 192.168.43.146.7771: UDP, length 120
01:31:50.520213 IP 192.168.43.146.8880 > 192.168.43.147.7772: UDP, length 120
01:31:50.533626 IP 192.168.43.124.8880 > 192.168.43.146.7771: UDP, length 120
01:31:50.570216 IP 192.168.43.146.8880 > 192.168.43.147.7772: UDP, length 120
01:31:50.575701 IP 192.168.43.124.8880 > 192.168.43.146.7771: UDP, length 120
01:31:50.620215 IP 192.168.43.146.8880 > 192.168.43.147.7772: UDP, length 120
01:31:50.623460 IP 192.168.43.124.8880 > 192.168.43.146.7771: UDP, length 120
01:31:50.670216 IP 192.168.43.146.8880 > 192.168.43.147.7772: UDP, length 120
01:31:50.682295 IP 192.168.43.124.8880 > 192.168.43.146.7771: UDP, length 120
01:31:50.720212 IP 192.168.43.146.8880 > 192.168.43.147.7772: UDP, length 120
01:31:50.723450 IP 192.168.43.124.8880 > 192.168.43.146.7771: UDP, length 120
01:31:50.770217 IP 192.168.43.146.8880 > 192.168.43.147.7772: UDP, length 120
01:31:50.773468 IP 192.168.43.124.8880 > 192.168.43.146.7771: UDP, length 120
01:31:50.820218 IP 192.168.43.146.8880 > 192.168.43.147.7772: UDP, length 120
01:31:50.831954 IP 192.168.43.124.8880 > 192.168.43.146.7771: UDP, length 120
01:31:50.870215 IP 192.168.43.146.8880 > 192.168.43.147.7772: UDP, length 120
01:31:50.873453 IP 192.168.43.124.8880 > 192.168.43.146.7771: UDP, length 120
01:31:50.920214 IP 192.168.43.146.8880 > 192.168.43.147.7772: UDP, length 120
01:31:50.923452 IP 192.168.43.124.8880 > 192.168.43.146.7771: UDP, length 120
01:31:50.970214 IP 192.168.43.146.8880 > 192.168.43.147.7772: UDP, length 120
01:31:50.981518 IP 192.168.43.124.8880 > 192.168.43.146.7771: UDP, length 120
01:31:51.020216 IP 192.168.43.146.8880 > 192.168.43.147.7772: UDP, length 120
01:31:51.024069 IP 192.168.43.124.8880 > 192.168.43.146.7771: UDP, length 120
01:31:51.070217 IP 192.168.43.146.8880 > 192.168.43.147.7772: UDP, length 120
01:31:51.073457 IP 192.168.43.124.8880 > 192.168.43.146.7771: UDP, length 120
01:31:51.120237 IP 192.168.43.146.8880 > 192.168.43.147.7772: UDP, length 120
01:31:51.132121 IP 192.168.43.124.8880 > 192.168.43.146.7771: UDP, length 120
01:31:51.170225 IP 192.168.43.146.8880 > 192.168.43.147.7772: UDP, length 120
01:31:51.173983 IP 192.168.43.124.8880 > 192.168.43.146.7771: UDP, length 120
01:31:51.220266 IP 192.168.43.146.8880 > 192.168.43.147.7772: UDP, length 120
01:31:51.223548 IP 192.168.43.124.8880 > 192.168.43.146.7771: UDP, length 120
01:31:51.270221 IP 192.168.43.146.8880 > 192.168.43.147.7772: UDP, length 120
01:31:51.282116 IP 192.168.43.124.8880 > 192.168.43.146.7771: UDP, length 120
01:31:51.320216 IP 192.168.43.146.8880 > 192.168.43.147.7772: UDP, length 120
01:31:51.323461 IP 192.168.43.124.8880 > 192.168.43.146.7771: UDP, length 120
01:31:51.370215 IP 192.168.43.146.8880 > 192.168.43.147.7772: UDP, length 120
01:31:51.373455 IP 192.168.43.124.8880 > 192.168.43.146.7771: UDP, length 120
01:31:51.420216 IP 192.168.43.146.8880 > 192.168.43.147.7772: UDP, length 120
01:31:51.423453 IP 192.168.43.124.8880 > 192.168.43.146.7771: UDP, length 120
01:31:51.470223 IP 192.168.43.146.8880 > 192.168.43.147.7772: UDP, length 120
01:31:51.473461 IP 192.168.43.124.8880 > 192.168.43.146.7771: UDP, length 120
01:31:51.520216 IP 192.168.43.146.8880 > 192.168.43.147.7772: UDP, length 120
01:31:51.523456 IP 192.168.43.124.8880 > 192.168.43.146.7771: UDP, length 120
01:31:51.570213 IP 192.168.43.146.8880 > 192.168.43.147.7772: UDP, length 120
01:31:51.581984 IP 192.168.43.124.8880 > 192.168.43.146.7771: UDP, length 120
01:31:51.620216 IP 192.168.43.146.8880 > 192.168.43.147.7772: UDP, length 120
01:31:51.623456 IP 192.168.43.124.8880 > 192.168.43.146.7771: UDP, length 120
01:31:51.670215 IP 192.168.43.146.8880 > 192.168.43.147.7772: UDP, length 120
01:31:51.673453 IP 192.168.43.124.8880 > 192.168.43.146.7771: UDP, length 120
01:31:51.720213 IP 192.168.43.146.8880 > 192.168.43.147.7772: UDP, length 120
01:31:51.731963 IP 192.168.43.124.8880 > 192.168.43.146.7771: UDP, length 120
01:31:51.770214 IP 192.168.43.146.8880 > 192.168.43.147.7772: UDP, length 120
01:31:51.773938 IP 192.168.43.124.8880 > 192.168.43.146.7771: UDP, length 120
01:31:51.820220 IP 192.168.43.146.8880 > 192.168.43.147.7772: UDP, length 120
01:31:51.838426 IP 192.168.43.124.8880 > 192.168.43.146.7771: UDP, length 120
01:31:51.870214 IP 192.168.43.146.8880 > 192.168.43.147.7772: UDP, length 120
01:31:51.873455 IP 192.168.43.124.8880 > 192.168.43.146.7771: UDP, length 120
01:31:51.920249 IP 192.168.43.146.8880 > 192.168.43.147.7772: UDP, length 120
01:31:51.932293 IP 192.168.43.124.8880 > 192.168.43.146.7771: UDP, length 120
01:31:51.970220 IP 192.168.43.146.8880 > 192.168.43.147.7772: UDP, length 120
01:31:51.974289 IP 192.168.43.124.8880 > 192.168.43.146.7771: UDP, length 120
01:31:52.020214 IP 192.168.43.146.8880 > 192.168.43.147.7772: UDP, length 120
01:31:52.032136 IP 192.168.43.124.8880 > 192.168.43.146.7771: UDP, length 120
01:31:52.070214 IP 192.168.43.146.8880 > 192.168.43.147.7772: UDP, length 120
01:31:52.073663 IP 192.168.43.124.8880 > 192.168.43.146.7771: UDP, length 120
01:31:52.120216 IP 192.168.43.146.8880 > 192.168.43.147.7772: UDP, length 120
01:31:52.123455 IP 192.168.43.124.8880 > 192.168.43.146.7771: UDP, length 120
01:31:52.170214 IP 192.168.43.146.8880 > 192.168.43.147.7772: UDP, length 120
01:31:52.184561 IP 192.168.43.124.8880 > 192.168.43.146.7771: UDP, length 120
01:31:52.220261 IP 192.168.43.146.8880 > 192.168.43.147.7772: UDP, length 120
01:31:52.223539 IP 192.168.43.124.8880 > 192.168.43.146.7771: UDP, length 120
01:31:52.270242 IP 192.168.43.146.8880 > 192.168.43.147.7772: UDP, length 120
01:31:52.282072 IP 192.168.43.124.8880 > 192.168.43.146.7771: UDP, length 120
01:31:52.320215 IP 192.168.43.146.8880 > 192.168.43.147.7772: UDP, length 120
01:31:52.323456 IP 192.168.43.124.8880 > 192.168.43.146.7771: UDP, length 120
01:31:52.370214 IP 192.168.43.146.8880 > 192.168.43.147.7772: UDP, length 120
01:31:52.373451 IP 192.168.43.124.8880 > 192.168.43.146.7771: UDP, length 120
01:31:52.420215 IP 192.168.43.146.8880 > 192.168.43.147.7772: UDP, length 120
01:31:52.433701 IP 192.168.43.124.8880 > 192.168.43.146.7771: UDP, length 120
01:31:52.470216 IP 192.168.43.146.8880 > 192.168.43.147.7772: UDP, length 120
01:31:52.473474 IP 192.168.43.124.8880 > 192.168.43.146.7771: UDP, length 120
01:31:52.520222 IP 192.168.43.146.8880 > 192.168.43.147.7772: UDP, length 120
01:31:52.523456 IP 192.168.43.124.8880 > 192.168.43.146.7771: UDP, length 120
01:31:52.570215 IP 192.168.43.146.8880 > 192.168.43.147.7772: UDP, length 120
01:31:52.581957 IP 192.168.43.124.8880 > 192.168.43.146.7771: UDP, length 120
01:31:52.620243 IP 192.168.43.146.8880 > 192.168.43.147.7772: UDP, length 120
01:31:52.624138 IP 192.168.43.124.8880 > 192.168.43.146.7771: UDP, length 120
01:31:52.670238 IP 192.168.43.146.8880 > 192.168.43.147.7772: UDP, length 120
01:31:52.674325 IP 192.168.43.124.8880 > 192.168.43.146.7771: UDP, length 120
01:31:52.720237 IP 192.168.43.146.8880 > 192.168.43.147.7772: UDP, length 120
01:31:52.754405 IP 192.168.43.124.8880 > 192.168.43.146.7771: UDP, length 120
01:31:52.770237 IP 192.168.43.146.8880 > 192.168.43.147.7772: UDP, length 120
01:31:52.773946 IP 192.168.43.124.8880 > 192.168.43.146.7771: UDP, length 120
01:31:52.820243 IP 192.168.43.146.8880 > 192.168.43.147.7772: UDP, length 120
01:31:52.839310 IP 192.168.43.124.8880 > 192.168.43.146.7771: UDP, length 120
01:31:52.870238 IP 192.168.43.146.8880 > 192.168.43.147.7772: UDP, length 120
01:31:52.873627 IP 192.168.43.124.8880 > 192.168.43.146.7771: UDP, length 120
01:31:52.920237 IP 192.168.43.146.8880 > 192.168.43.147.7772: UDP, length 120
01:31:52.923957 IP 192.168.43.124.8880 > 192.168.43.146.7771: UDP, length 120
01:31:52.970237 IP 192.168.43.146.8880 > 192.168.43.147.7772: UDP, length 120
01:31:52.986315 IP 192.168.43.124.8880 > 192.168.43.146.7771: UDP, length 120
01:31:53.020240 IP 192.168.43.146.8880 > 192.168.43.147.7772: UDP, length 120
01:31:53.023655 IP 192.168.43.124.8880 > 192.168.43.146.7771: UDP, length 120
01:31:53.070237 IP 192.168.43.146.8880 > 192.168.43.147.7772: UDP, length 120
01:31:53.073631 IP 192.168.43.124.8880 > 192.168.43.146.7771: UDP, length 120
01:31:53.120240 IP 192.168.43.146.8880 > 192.168.43.147.7772: UDP, length 120
01:31:53.132231 IP 192.168.43.124.8880 > 192.168.43.146.7771: UDP, length 120
01:31:53.170236 IP 192.168.43.146.8880 > 192.168.43.147.7772: UDP, length 120
01:31:53.173625 IP 192.168.43.124.8880 > 192.168.43.146.7771: UDP, length 120
01:31:53.220303 IP 192.168.43.146.8880 > 192.168.43.147.7772: UDP, length 120
01:31:53.223757 IP 192.168.43.124.8880 > 192.168.43.146.7771: UDP, length 120
01:31:53.270253 IP 192.168.43.146.8880 > 192.168.43.147.7772: UDP, length 120
01:31:53.282462 IP 192.168.43.124.8880 > 192.168.43.146.7771: UDP, length 120
01:31:53.320241 IP 192.168.43.146.8880 > 192.168.43.147.7772: UDP, length 120
01:31:53.323634 IP 192.168.43.124.8880 > 192.168.43.146.7771: UDP, length 120
01:31:53.370237 IP 192.168.43.146.8880 > 192.168.43.147.7772: UDP, length 120
01:31:53.373628 IP 192.168.43.124.8880 > 192.168.43.146.7771: UDP, length 120
01:31:53.420289 IP 192.168.43.146.8880 > 192.168.43.147.7772: UDP, length 120
01:31:53.432214 IP 192.168.43.124.8880 > 192.168.43.146.7771: UDP, length 120
01:31:53.470246 IP 192.168.43.146.8880 > 192.168.43.147.7772: UDP, length 120
01:31:53.473663 IP 192.168.43.124.8880 > 192.168.43.146.7771: UDP, length 120
01:31:53.520243 IP 192.168.43.146.8880 > 192.168.43.147.7772: UDP, length 120
01:31:53.523673 IP 192.168.43.124.8880 > 192.168.43.146.7771: UDP, length 120
01:31:53.570250 IP 192.168.43.146.8880 > 192.168.43.147.7772: UDP, length 120
01:31:53.573665 IP 192.168.43.124.8880 > 192.168.43.146.7771: UDP, length 120
01:31:53.620250 IP 192.168.43.146.8880 > 192.168.43.147.7772: UDP, length 120
01:31:53.640972 IP 192.168.43.124.8880 > 192.168.43.146.7771: UDP, length 120
01:31:53.670244 IP 192.168.43.146.8880 > 192.168.43.147.7772: UDP, length 120
01:31:53.673639 IP 192.168.43.124.8880 > 192.168.43.146.7771: UDP, length 120
01:31:53.720240 IP 192.168.43.146.8880 > 192.168.43.147.7772: UDP, length 120
01:31:53.723633 IP 192.168.43.124.8880 > 192.168.43.146.7771: UDP, length 120
01:31:53.770237 IP 192.168.43.146.8880 > 192.168.43.147.7772: UDP, length 120
01:31:53.788935 IP 192.168.43.124.8880 > 192.168.43.146.7771: UDP, length 120
01:31:53.820256 IP 192.168.43.146.8880 > 192.168.43.147.7772: UDP, length 120
01:31:53.823658 IP 192.168.43.124.8880 > 192.168.43.146.7771: UDP, length 120
01:31:53.870243 IP 192.168.43.146.8880 > 192.168.43.147.7772: UDP, length 120
01:31:53.877079 IP 192.168.43.124.8880 > 192.168.43.146.7771: UDP, length 120
01:31:53.920329 IP 192.168.43.146.8880 > 192.168.43.147.7772: UDP, length 120
01:31:53.925274 IP 192.168.43.124.8880 > 192.168.43.146.7771: UDP, length 120
01:31:53.970349 IP 192.168.43.146.8880 > 192.168.43.147.7772: UDP, length 120
01:31:53.973976 IP 192.168.43.124.8880 > 192.168.43.146.7771: UDP, length 120
01:31:54.020294 IP 192.168.43.146.8880 > 192.168.43.147.7772: UDP, length 120
01:31:54.032173 IP 192.168.43.124.8880 > 192.168.43.146.7771: UDP, length 120
01:31:54.070261 IP 192.168.43.146.8880 > 192.168.43.147.7772: UDP, length 120
01:31:54.073773 IP 192.168.43.124.8880 > 192.168.43.146.7771: UDP, length 120
01:31:54.120296 IP 192.168.43.146.8880 > 192.168.43.147.7772: UDP, length 120
01:31:54.124440 IP 192.168.43.124.8880 > 192.168.43.146.7771: UDP, length 120
01:31:54.170282 IP 192.168.43.146.8880 > 192.168.43.147.7772: UDP, length 120
01:31:54.182115 IP 192.168.43.124.8880 > 192.168.43.146.7771: UDP, length 120
01:31:54.220279 IP 192.168.43.146.8880 > 192.168.43.147.7772: UDP, length 120
01:31:54.227394 IP 192.168.43.124.8880 > 192.168.43.146.7771: UDP, length 120
01:31:54.270281 IP 192.168.43.146.8880 > 192.168.43.147.7772: UDP, length 120
01:31:54.273693 IP 192.168.43.124.8880 > 192.168.43.146.7771: UDP, length 120
01:31:54.320287 IP 192.168.43.146.8880 > 192.168.43.147.7772: UDP, length 120
01:31:54.334348 IP 192.168.43.124.8880 > 192.168.43.146.7771: UDP, length 120
01:31:54.370292 IP 192.168.43.146.8880 > 192.168.43.147.7772: UDP, length 120
01:31:54.372775 IP 192.168.43.124.8880 > 192.168.43.146.7771: UDP, length 120
01:31:54.420256 IP 192.168.43.146.8880 > 192.168.43.147.7772: UDP, length 120
01:31:54.423511 IP 192.168.43.124.8880 > 192.168.43.146.7771: UDP, length 120
01:31:54.470222 IP 192.168.43.146.8880 > 192.168.43.147.7772: UDP, length 120
01:31:54.482017 IP 192.168.43.124.8880 > 192.168.43.146.7771: UDP, length 120
01:31:54.520214 IP 192.168.43.146.8880 > 192.168.43.147.7772: UDP, length 120
01:31:54.523454 IP 192.168.43.124.8880 > 192.168.43.146.7771: UDP, length 120
01:31:54.570215 IP 192.168.43.146.8880 > 192.168.43.147.7772: UDP, length 120
01:31:54.582740 IP 192.168.43.124.8880 > 192.168.43.146.7771: UDP, length 120
01:31:54.620220 IP 192.168.43.146.8880 > 192.168.43.147.7772: UDP, length 120
01:31:54.623474 IP 192.168.43.124.8880 > 192.168.43.146.7771: UDP, length 120
01:31:54.670227 IP 192.168.43.146.8880 > 192.168.43.147.7772: UDP, length 120
01:31:54.681752 IP 192.168.43.124.8880 > 192.168.43.146.7771: UDP, length 120
01:31:54.720219 IP 192.168.43.146.8880 > 192.168.43.147.7772: UDP, length 120
01:31:54.723457 IP 192.168.43.124.8880 > 192.168.43.146.7771: UDP, length 120
01:31:54.770233 IP 192.168.43.146.8880 > 192.168.43.147.7772: UDP, length 120
01:31:54.774427 IP 192.168.43.124.8880 > 192.168.43.146.7771: UDP, length 120
01:31:54.820223 IP 192.168.43.146.8880 > 192.168.43.147.7772: UDP, length 120
01:31:54.832219 IP 192.168.43.124.8880 > 192.168.43.146.7771: UDP, length 120
01:31:54.870214 IP 192.168.43.146.8880 > 192.168.43.147.7772: UDP, length 120
01:31:54.873453 IP 192.168.43.124.8880 > 192.168.43.146.7771: UDP, length 120
01:31:54.920249 IP 192.168.43.146.8880 > 192.168.43.147.7772: UDP, length 120
01:31:54.923536 IP 192.168.43.124.8880 > 192.168.43.146.7771: UDP, length 120
01:31:54.970224 IP 192.168.43.146.8880 > 192.168.43.147.7772: UDP, length 120
01:31:54.990285 IP 192.168.43.124.8880 > 192.168.43.146.7771: UDP, length 120
01:31:55.020216 IP 192.168.43.146.8880 > 192.168.43.147.7772: UDP, length 120
01:31:55.023457 IP 192.168.43.124.8880 > 192.168.43.146.7771: UDP, length 120
01:31:55.070215 IP 192.168.43.146.8880 > 192.168.43.147.7772: UDP, length 120
01:31:55.082181 IP 192.168.43.124.8880 > 192.168.43.146.7771: UDP, length 120
01:31:55.120214 IP 192.168.43.146.8880 > 192.168.43.147.7772: UDP, length 120
01:31:55.123457 IP 192.168.43.124.8880 > 192.168.43.146.7771: UDP, length 120
01:31:55.170213 IP 192.168.43.146.8880 > 192.168.43.147.7772: UDP, length 120
01:31:55.183629 IP 192.168.43.124.8880 > 192.168.43.146.7771: UDP, length 120
01:31:55.220262 IP 192.168.43.146.8880 > 192.168.43.147.7772: UDP, length 120
01:31:55.223569 IP 192.168.43.124.8880 > 192.168.43.146.7771: UDP, length 120
01:31:55.270229 IP 192.168.43.146.8880 > 192.168.43.147.7772: UDP, length 120
01:31:55.273485 IP 192.168.43.124.8880 > 192.168.43.146.7771: UDP, length 120
01:31:55.320217 IP 192.168.43.146.8880 > 192.168.43.147.7772: UDP, length 120
01:31:55.335315 IP 192.168.43.124.8880 > 192.168.43.146.7771: UDP, length 120
01:31:55.370215 IP 192.168.43.146.8880 > 192.168.43.147.7772: UDP, length 120
01:31:55.372991 IP 192.168.43.124.8880 > 192.168.43.146.7771: UDP, length 120
01:31:55.420214 IP 192.168.43.146.8880 > 192.168.43.147.7772: UDP, length 120
01:31:55.431950 IP 192.168.43.124.8880 > 192.168.43.146.7771: UDP, length 120
01:31:55.470213 IP 192.168.43.146.8880 > 192.168.43.147.7772: UDP, length 120
01:31:55.473472 IP 192.168.43.124.8880 > 192.168.43.146.7771: UDP, length 120
01:31:55.520214 IP 192.168.43.146.8880 > 192.168.43.147.7772: UDP, length 120
01:31:55.523463 IP 192.168.43.124.8880 > 192.168.43.146.7771: UDP, length 120
01:31:55.570214 IP 192.168.43.146.8880 > 192.168.43.147.7772: UDP, length 120
01:31:55.582026 IP 192.168.43.124.8880 > 192.168.43.146.7771: UDP, length 120
01:31:55.620216 IP 192.168.43.146.8880 > 192.168.43.147.7772: UDP, length 120
01:31:55.623475 IP 192.168.43.124.8880 > 192.168.43.146.7771: UDP, length 120
01:31:55.670222 IP 192.168.43.146.8880 > 192.168.43.147.7772: UDP, length 120
01:31:55.673472 IP 192.168.43.124.8880 > 192.168.43.146.7771: UDP, length 120
01:31:55.720219 IP 192.168.43.146.8880 > 192.168.43.147.7772: UDP, length 120
01:31:55.723456 IP 192.168.43.124.8880 > 192.168.43.146.7771: UDP, length 120
01:31:55.770216 IP 192.168.43.146.8880 > 192.168.43.147.7772: UDP, length 120
01:31:55.773464 IP 192.168.43.124.8880 > 192.168.43.146.7771: UDP, length 120
01:31:55.820222 IP 192.168.43.146.8880 > 192.168.43.147.7772: UDP, length 120
01:31:55.831926 IP 192.168.43.124.8880 > 192.168.43.146.7771: UDP, length 120
01:31:55.870216 IP 192.168.43.146.8880 > 192.168.43.147.7772: UDP, length 120
01:31:55.873456 IP 192.168.43.124.8880 > 192.168.43.146.7771: UDP, length 120
01:31:55.920214 IP 192.168.43.146.8880 > 192.168.43.147.7772: UDP, length 120
01:31:55.923458 IP 192.168.43.124.8880 > 192.168.43.146.7771: UDP, length 120
01:31:55.970213 IP 192.168.43.146.8880 > 192.168.43.147.7772: UDP, length 120
01:31:55.982174 IP 192.168.43.124.8880 > 192.168.43.146.7771: UDP, length 120
01:31:56.020214 IP 192.168.43.146.8880 > 192.168.43.147.7772: UDP, length 120
01:31:56.023455 IP 192.168.43.124.8880 > 192.168.43.146.7771: UDP, length 120
01:31:56.070214 IP 192.168.43.146.8880 > 192.168.43.147.7772: UDP, length 120
01:31:56.073456 IP 192.168.43.124.8880 > 192.168.43.146.7771: UDP, length 120
01:31:56.120216 IP 192.168.43.146.8880 > 192.168.43.147.7772: UDP, length 120
01:31:56.132246 IP 192.168.43.124.8880 > 192.168.43.146.7771: UDP, length 120
01:31:56.170211 IP 192.168.43.146.8880 > 192.168.43.147.7772: UDP, length 120
01:31:56.173450 IP 192.168.43.124.8880 > 192.168.43.146.7771: UDP, length 120
01:31:56.220213 IP 192.168.43.146.8880 > 192.168.43.147.7772: UDP, length 120
01:31:56.232332 IP 192.168.43.124.8880 > 192.168.43.146.7771: UDP, length 120
01:31:56.270212 IP 192.168.43.146.8880 > 192.168.43.147.7772: UDP, length 120
01:31:56.274769 IP 192.168.43.124.8880 > 192.168.43.146.7771: UDP, length 120
01:31:56.320213 IP 192.168.43.146.8880 > 192.168.43.147.7772: UDP, length 120
01:31:56.332265 IP 192.168.43.124.8880 > 192.168.43.146.7771: UDP, length 120
01:31:56.370214 IP 192.168.43.146.8880 > 192.168.43.147.7772: UDP, length 120
01:31:56.378154 IP 192.168.43.124.8880 > 192.168.43.146.7771: UDP, length 120
01:31:56.420252 IP 192.168.43.146.8880 > 192.168.43.147.7772: UDP, length 120
01:31:56.423537 IP 192.168.43.124.8880 > 192.168.43.146.7771: UDP, length 120
01:31:56.470219 IP 192.168.43.146.8880 > 192.168.43.147.7772: UDP, length 120
01:31:56.483916 IP 192.168.43.124.8880 > 192.168.43.146.7771: UDP, length 120
01:31:56.520214 IP 192.168.43.146.8880 > 192.168.43.147.7772: UDP, length 120
01:31:56.523452 IP 192.168.43.124.8880 > 192.168.43.146.7771: UDP, length 120
01:31:56.570183 IP 192.168.43.146.8880 > 192.168.43.147.7772: UDP, length 120
01:31:56.584186 IP 192.168.43.124.8880 > 192.168.43.146.7771: UDP, length 120
01:31:56.620229 IP 192.168.43.146.8880 > 192.168.43.147.7772: UDP, length 120
01:31:56.632190 IP 192.168.43.124.8880 > 192.168.43.146.7771: UDP, length 120
01:31:56.670216 IP 192.168.43.146.8880 > 192.168.43.147.7772: UDP, length 120
01:31:56.673459 IP 192.168.43.124.8880 > 192.168.43.146.7771: UDP, length 120
01:31:56.720220 IP 192.168.43.146.8880 > 192.168.43.147.7772: UDP, length 120
01:31:56.723467 IP 192.168.43.124.8880 > 192.168.43.146.7771: UDP, length 120
01:31:56.770219 IP 192.168.43.146.8880 > 192.168.43.147.7772: UDP, length 120
01:31:56.786657 IP 192.168.43.124.8880 > 192.168.43.146.7771: UDP, length 120
01:31:56.820229 IP 192.168.43.146.8880 > 192.168.43.147.7772: UDP, length 120
01:31:56.823475 IP 192.168.43.124.8880 > 192.168.43.146.7771: UDP, length 120
01:31:56.870216 IP 192.168.43.146.8880 > 192.168.43.147.7772: UDP, length 120
01:31:56.882002 IP 192.168.43.124.8880 > 192.168.43.146.7771: UDP, length 120
01:31:56.920219 IP 192.168.43.146.8880 > 192.168.43.147.7772: UDP, length 120
01:31:56.925018 IP 192.168.43.124.8880 > 192.168.43.146.7771: UDP, length 120
01:31:56.970213 IP 192.168.43.146.8880 > 192.168.43.147.7772: UDP, length 120
01:31:56.973456 IP 192.168.43.124.8880 > 192.168.43.146.7771: UDP, length 120
01:31:57.020215 IP 192.168.43.146.8880 > 192.168.43.147.7772: UDP, length 120
01:31:57.032284 IP 192.168.43.124.8880 > 192.168.43.146.7771: UDP, length 120
01:31:57.070214 IP 192.168.43.146.8880 > 192.168.43.147.7772: UDP, length 120
01:31:57.073181 IP 192.168.43.124.8880 > 192.168.43.146.7771: UDP, length 120
01:31:57.120216 IP 192.168.43.146.8880 > 192.168.43.147.7772: UDP, length 120
01:31:57.123469 IP 192.168.43.124.8880 > 192.168.43.146.7771: UDP, length 120
01:31:57.170213 IP 192.168.43.146.8880 > 192.168.43.147.7772: UDP, length 120
01:31:57.183001 IP 192.168.43.124.8880 > 192.168.43.146.7771: UDP, length 120
01:31:57.220304 IP 192.168.43.146.8880 > 192.168.43.147.7772: UDP, length 120
01:31:57.223704 IP 192.168.43.124.8880 > 192.168.43.146.7771: UDP, length 120
01:31:57.270291 IP 192.168.43.146.8880 > 192.168.43.147.7772: UDP, length 120
01:31:57.273495 IP 192.168.43.124.8880 > 192.168.43.146.7771: UDP, length 120
01:31:57.320268 IP 192.168.43.146.8880 > 192.168.43.147.7772: UDP, length 120
01:31:57.334009 IP 192.168.43.124.8880 > 192.168.43.146.7771: UDP, length 120
01:31:57.370233 IP 192.168.43.146.8880 > 192.168.43.147.7772: UDP, length 120
01:31:57.373475 IP 192.168.43.124.8880 > 192.168.43.146.7771: UDP, length 120
01:31:57.420220 IP 192.168.43.146.8880 > 192.168.43.147.7772: UDP, length 120
01:31:57.423491 IP 192.168.43.124.8880 > 192.168.43.146.7771: UDP, length 120
01:31:57.470216 IP 192.168.43.146.8880 > 192.168.43.147.7772: UDP, length 120
01:31:57.482332 IP 192.168.43.124.8880 > 192.168.43.146.7771: UDP, length 120
01:31:57.520215 IP 192.168.43.146.8880 > 192.168.43.147.7772: UDP, length 120
01:31:57.523468 IP 192.168.43.124.8880 > 192.168.43.146.7771: UDP, length 120
01:31:57.570215 IP 192.168.43.146.8880 > 192.168.43.147.7772: UDP, length 120
01:31:57.573477 IP 192.168.43.124.8880 > 192.168.43.146.7771: UDP, length 120
01:31:57.620246 IP 192.168.43.146.8880 > 192.168.43.147.7772: UDP, length 120
01:31:57.632287 IP 192.168.43.124.8880 > 192.168.43.146.7771: UDP, length 120
01:31:57.670240 IP 192.168.43.146.8880 > 192.168.43.147.7772: UDP, length 120
01:31:57.673665 IP 192.168.43.124.8880 > 192.168.43.146.7771: UDP, length 120
01:31:57.720241 IP 192.168.43.146.8880 > 192.168.43.147.7772: UDP, length 120
01:31:57.723673 IP 192.168.43.124.8880 > 192.168.43.146.7771: UDP, length 120
01:31:57.770251 IP 192.168.43.146.8880 > 192.168.43.147.7772: UDP, length 120
01:31:57.782442 IP 192.168.43.124.8880 > 192.168.43.146.7771: UDP, length 120
01:31:57.820265 IP 192.168.43.146.8880 > 192.168.43.147.7772: UDP, length 120
01:31:57.823679 IP 192.168.43.124.8880 > 192.168.43.146.7771: UDP, length 120
01:31:57.870250 IP 192.168.43.146.8880 > 192.168.43.147.7772: UDP, length 120
01:31:57.873673 IP 192.168.43.124.8880 > 192.168.43.146.7771: UDP, length 120
01:31:57.920289 IP 192.168.43.146.8880 > 192.168.43.147.7772: UDP, length 120
01:31:57.923733 IP 192.168.43.124.8880 > 192.168.43.146.7771: UDP, length 120
01:31:57.970249 IP 192.168.43.146.8880 > 192.168.43.147.7772: UDP, length 120
01:31:57.991084 IP 192.168.43.124.8880 > 192.168.43.146.7771: UDP, length 120
01:31:58.020238 IP 192.168.43.146.8880 > 192.168.43.147.7772: UDP, length 120
01:31:58.023631 IP 192.168.43.124.8880 > 192.168.43.146.7771: UDP, length 120
01:31:58.070238 IP 192.168.43.146.8880 > 192.168.43.147.7772: UDP, length 120
01:31:58.082063 IP 192.168.43.124.8880 > 192.168.43.146.7771: UDP, length 120
01:31:58.120239 IP 192.168.43.146.8880 > 192.168.43.147.7772: UDP, length 120
01:31:58.123626 IP 192.168.43.124.8880 > 192.168.43.146.7771: UDP, length 120
01:31:58.170237 IP 192.168.43.146.8880 > 192.168.43.147.7772: UDP, length 120
01:31:58.173632 IP 192.168.43.124.8880 > 192.168.43.146.7771: UDP, length 120
01:31:58.220237 IP 192.168.43.146.8880 > 192.168.43.147.7772: UDP, length 120
01:31:58.226214 IP 192.168.43.124.8880 > 192.168.43.146.7771: UDP, length 120
01:31:58.270239 IP 192.168.43.146.8880 > 192.168.43.147.7772: UDP, length 120
01:31:58.273639 IP 192.168.43.124.8880 > 192.168.43.146.7771: UDP, length 120
01:31:58.320323 IP 192.168.43.146.8880 > 192.168.43.147.7772: UDP, length 120
01:31:58.324319 IP 192.168.43.124.8880 > 192.168.43.146.7771: UDP, length 120
01:31:58.370371 IP 192.168.43.146.8880 > 192.168.43.147.7772: UDP, length 120
01:31:58.382191 IP 192.168.43.124.8880 > 192.168.43.146.7771: UDP, length 120
01:31:58.420281 IP 192.168.43.146.8880 > 192.168.43.147.7772: UDP, length 120
01:31:58.425177 IP 192.168.43.124.8880 > 192.168.43.146.7771: UDP, length 120
01:31:58.470246 IP 192.168.43.146.8880 > 192.168.43.147.7772: UDP, length 120
01:31:58.474358 IP 192.168.43.124.8880 > 192.168.43.146.7771: UDP, length 120
01:31:58.520242 IP 192.168.43.146.8880 > 192.168.43.147.7772: UDP, length 120
01:31:58.535990 IP 192.168.43.124.8880 > 192.168.43.146.7771: UDP, length 120
01:31:58.570240 IP 192.168.43.146.8880 > 192.168.43.147.7772: UDP, length 120
01:31:58.573635 IP 192.168.43.124.8880 > 192.168.43.146.7771: UDP, length 120
01:31:58.620241 IP 192.168.43.146.8880 > 192.168.43.147.7772: UDP, length 120
01:31:58.634288 IP 192.168.43.124.8880 > 192.168.43.146.7771: UDP, length 120
01:31:58.670241 IP 192.168.43.146.8880 > 192.168.43.147.7772: UDP, length 120
01:31:58.673650 IP 192.168.43.124.8880 > 192.168.43.146.7771: UDP, length 120
01:31:58.720246 IP 192.168.43.146.8880 > 192.168.43.147.7772: UDP, length 120
01:31:58.723665 IP 192.168.43.124.8880 > 192.168.43.146.7771: UDP, length 120
01:31:58.770241 IP 192.168.43.146.8880 > 192.168.43.147.7772: UDP, length 120
01:31:58.783996 IP 192.168.43.124.8880 > 192.168.43.146.7771: UDP, length 120
01:31:58.820254 IP 192.168.43.146.8880 > 192.168.43.147.7772: UDP, length 120
01:31:58.824522 IP 192.168.43.124.8880 > 192.168.43.146.7771: UDP, length 120
01:31:58.870251 IP 192.168.43.146.8880 > 192.168.43.147.7772: UDP, length 120
01:31:58.873677 IP 192.168.43.124.8880 > 192.168.43.146.7771: UDP, length 120
01:31:58.920243 IP 192.168.43.146.8880 > 192.168.43.147.7772: UDP, length 120
01:31:58.932202 IP 192.168.43.124.8880 > 192.168.43.146.7771: UDP, length 120
01:31:58.970240 IP 192.168.43.146.8880 > 192.168.43.147.7772: UDP, length 120
01:31:58.973678 IP 192.168.43.124.8880 > 192.168.43.146.7771: UDP, length 120
01:31:59.020240 IP 192.168.43.146.8880 > 192.168.43.147.7772: UDP, length 120
01:31:59.023696 IP 192.168.43.124.8880 > 192.168.43.146.7771: UDP, length 120
01:31:59.070239 IP 192.168.43.146.8880 > 192.168.43.147.7772: UDP, length 120
01:31:59.082220 IP 192.168.43.124.8880 > 192.168.43.146.7771: UDP, length 120
01:31:59.120240 IP 192.168.43.146.8880 > 192.168.43.147.7772: UDP, length 120
01:31:59.126315 IP 192.168.43.124.8880 > 192.168.43.146.7771: UDP, length 120
01:31:59.170240 IP 192.168.43.146.8880 > 192.168.43.147.7772: UDP, length 120
01:31:59.173673 IP 192.168.43.124.8880 > 192.168.43.146.7771: UDP, length 120
01:31:59.220239 IP 192.168.43.146.8880 > 192.168.43.147.7772: UDP, length 120
01:31:59.232306 IP 192.168.43.124.8880 > 192.168.43.146.7771: UDP, length 120
01:31:59.270239 IP 192.168.43.146.8880 > 192.168.43.147.7772: UDP, length 120
01:31:59.273678 IP 192.168.43.124.8880 > 192.168.43.146.7771: UDP, length 120
01:31:59.320238 IP 192.168.43.146.8880 > 192.168.43.147.7772: UDP, length 120
01:31:59.323699 IP 192.168.43.124.8880 > 192.168.43.146.7771: UDP, length 120
01:31:59.370238 IP 192.168.43.146.8880 > 192.168.43.147.7772: UDP, length 120
01:31:59.390789 IP 192.168.43.124.8880 > 192.168.43.146.7771: UDP, length 120
01:31:59.420341 IP 192.168.43.146.8880 > 192.168.43.147.7772: UDP, length 120
01:31:59.423904 IP 192.168.43.124.8880 > 192.168.43.146.7771: UDP, length 120
01:31:59.470359 IP 192.168.43.146.8880 > 192.168.43.147.7772: UDP, length 120
01:31:59.485349 IP 192.168.43.124.8880 > 192.168.43.146.7771: UDP, length 120
01:31:59.520293 IP 192.168.43.146.8880 > 192.168.43.147.7772: UDP, length 120
01:31:59.523746 IP 192.168.43.124.8880 > 192.168.43.146.7771: UDP, length 120
01:31:59.570301 IP 192.168.43.146.8880 > 192.168.43.147.7772: UDP, length 120
01:31:59.572293 IP 192.168.43.124.8880 > 192.168.43.146.7771: UDP, length 120
01:31:59.620301 IP 192.168.43.146.8880 > 192.168.43.147.7772: UDP, length 120
01:31:59.636894 IP 192.168.43.124.8880 > 192.168.43.146.7771: UDP, length 120
01:31:59.670271 IP 192.168.43.146.8880 > 192.168.43.147.7772: UDP, length 120
01:31:59.673674 IP 192.168.43.124.8880 > 192.168.43.146.7771: UDP, length 120
01:31:59.720301 IP 192.168.43.146.8880 > 192.168.43.147.7772: UDP, length 120
01:31:59.723652 IP 192.168.43.124.8880 > 192.168.43.146.7771: UDP, length 120
01:31:59.770301 IP 192.168.43.146.8880 > 192.168.43.147.7772: UDP, length 120
01:31:59.782149 IP 192.168.43.124.8880 > 192.168.43.146.7771: UDP, length 120
01:31:59.820286 IP 192.168.43.146.8880 > 192.168.43.147.7772: UDP, length 120
01:31:59.822378 IP 192.168.43.124.8880 > 192.168.43.146.7771: UDP, length 120
01:31:59.870264 IP 192.168.43.146.8880 > 192.168.43.147.7772: UDP, length 120
01:31:59.872224 IP 192.168.43.124.8880 > 192.168.43.146.7771: UDP, length 120
01:31:59.920232 IP 192.168.43.146.8880 > 192.168.43.147.7772: UDP, length 120
01:31:59.932684 IP 192.168.43.124.8880 > 192.168.43.146.7771: UDP, length 120
01:31:59.970222 IP 192.168.43.146.8880 > 192.168.43.147.7772: UDP, length 120
01:31:59.973474 IP 192.168.43.124.8880 > 192.168.43.146.7771: UDP, length 120
01:32:00.020222 IP 192.168.43.146.8880 > 192.168.43.147.7772: UDP, length 120
01:32:00.023471 IP 192.168.43.124.8880 > 192.168.43.146.7771: UDP, length 120
01:32:00.070214 IP 192.168.43.146.8880 > 192.168.43.147.7772: UDP, length 120
01:32:00.082142 IP 192.168.43.124.8880 > 192.168.43.146.7771: UDP, length 120
01:32:00.120215 IP 192.168.43.146.8880 > 192.168.43.147.7772: UDP, length 120
01:32:00.123469 IP 192.168.43.124.8880 > 192.168.43.146.7771: UDP, length 120
01:32:00.170213 IP 192.168.43.146.8880 > 192.168.43.147.7772: UDP, length 120
01:32:00.182823 IP 192.168.43.124.8880 > 192.168.43.146.7771: UDP, length 120
01:32:00.220215 IP 192.168.43.146.8880 > 192.168.43.147.7772: UDP, length 120
01:32:00.223457 IP 192.168.43.124.8880 > 192.168.43.146.7771: UDP, length 120
01:32:00.270213 IP 192.168.43.146.8880 > 192.168.43.147.7772: UDP, length 120
01:32:00.273458 IP 192.168.43.124.8880 > 192.168.43.146.7771: UDP, length 120
01:32:00.320213 IP 192.168.43.146.8880 > 192.168.43.147.7772: UDP, length 120
01:32:00.331258 IP 192.168.43.124.8880 > 192.168.43.146.7771: UDP, length 120
01:32:00.370214 IP 192.168.43.146.8880 > 192.168.43.147.7772: UDP, length 120
01:32:00.373453 IP 192.168.43.124.8880 > 192.168.43.146.7771: UDP, length 120
01:32:00.420264 IP 192.168.43.146.8880 > 192.168.43.147.7772: UDP, length 120
01:32:00.423564 IP 192.168.43.124.8880 > 192.168.43.146.7771: UDP, length 120
01:32:00.470225 IP 192.168.43.146.8880 > 192.168.43.147.7772: UDP, length 120
01:32:00.481596 IP 192.168.43.124.8880 > 192.168.43.146.7771: UDP, length 120
01:32:00.520214 IP 192.168.43.146.8880 > 192.168.43.147.7772: UDP, length 120
01:32:00.523462 IP 192.168.43.124.8880 > 192.168.43.146.7771: UDP, length 120
01:32:00.570214 IP 192.168.43.146.8880 > 192.168.43.147.7772: UDP, length 120
01:32:00.575405 IP 192.168.43.124.8880 > 192.168.43.146.7771: UDP, length 120
01:32:00.620214 IP 192.168.43.146.8880 > 192.168.43.147.7772: UDP, length 120
01:32:00.632109 IP 192.168.43.124.8880 > 192.168.43.146.7771: UDP, length 120
01:32:00.670214 IP 192.168.43.146.8880 > 192.168.43.147.7772: UDP, length 120
01:32:00.679335 IP 192.168.43.124.8880 > 192.168.43.146.7771: UDP, length 120
01:32:00.720213 IP 192.168.43.146.8880 > 192.168.43.147.7772: UDP, length 120
01:32:00.723460 IP 192.168.43.124.8880 > 192.168.43.146.7771: UDP, length 120
01:32:00.770214 IP 192.168.43.146.8880 > 192.168.43.147.7772: UDP, length 120
01:32:00.781992 IP 192.168.43.124.8880 > 192.168.43.146.7771: UDP, length 120
01:32:00.820227 IP 192.168.43.146.8880 > 192.168.43.147.7772: UDP, length 120
01:32:00.823469 IP 192.168.43.124.8880 > 192.168.43.146.7771: UDP, length 120
01:32:00.870217 IP 192.168.43.146.8880 > 192.168.43.147.7772: UDP, length 120
01:32:00.873458 IP 192.168.43.124.8880 > 192.168.43.146.7771: UDP, length 120
01:32:00.920249 IP 192.168.43.146.8880 > 192.168.43.147.7772: UDP, length 120
01:32:00.932135 IP 192.168.43.124.8880 > 192.168.43.146.7771: UDP, length 120
01:32:00.970238 IP 192.168.43.146.8880 > 192.168.43.147.7772: UDP, length 120
01:32:00.973489 IP 192.168.43.124.8880 > 192.168.43.146.7771: UDP, length 120
01:32:01.020257 IP 192.168.43.146.8880 > 192.168.43.147.7772: UDP, length 120
01:32:01.032141 IP 192.168.43.124.8880 > 192.168.43.146.7771: UDP, length 120
01:32:01.070229 IP 192.168.43.146.8880 > 192.168.43.147.7772: UDP, length 120
01:32:01.073483 IP 192.168.43.124.8880 > 192.168.43.146.7771: UDP, length 120
01:32:01.120218 IP 192.168.43.146.8880 > 192.168.43.147.7772: UDP, length 120
01:32:01.132756 IP 192.168.43.124.8880 > 192.168.43.146.7771: UDP, length 120
01:32:01.170215 IP 192.168.43.146.8880 > 192.168.43.147.7772: UDP, length 120
01:32:01.173463 IP 192.168.43.124.8880 > 192.168.43.146.7771: UDP, length 120
01:32:01.220215 IP 192.168.43.146.8880 > 192.168.43.147.7772: UDP, length 120
01:32:01.232111 IP 192.168.43.124.8880 > 192.168.43.146.7771: UDP, length 120
01:32:01.270217 IP 192.168.43.146.8880 > 192.168.43.147.7772: UDP, length 120
01:32:01.273480 IP 192.168.43.124.8880 > 192.168.43.146.7771: UDP, length 120
01:32:01.320218 IP 192.168.43.146.8880 > 192.168.43.147.7772: UDP, length 120
