23:14:00.647560 IP 192.168.43.124.8880 > 192.168.43.195.7771: UDP, length 120
23:14:00.697709 IP 192.168.43.124.8880 > 192.168.43.195.7771: UDP, length 120
23:14:00.747709 IP 192.168.43.124.8880 > 192.168.43.195.7771: UDP, length 120
23:14:00.797709 IP 192.168.43.124.8880 > 192.168.43.195.7771: UDP, length 120
23:14:00.847709 IP 192.168.43.124.8880 > 192.168.43.195.7771: UDP, length 120
23:14:00.897708 IP 192.168.43.124.8880 > 192.168.43.195.7771: UDP, length 120
23:14:00.947758 IP 192.168.43.124.8880 > 192.168.43.195.7771: UDP, length 120
23:14:00.997759 IP 192.168.43.124.8880 > 192.168.43.195.7771: UDP, length 120
23:14:01.047758 IP 192.168.43.124.8880 > 192.168.43.195.7771: UDP, length 120
23:14:01.097759 IP 192.168.43.124.8880 > 192.168.43.195.7771: UDP, length 120
23:14:01.147760 IP 192.168.43.124.8880 > 192.168.43.195.7771: UDP, length 120
23:14:01.197759 IP 192.168.43.124.8880 > 192.168.43.195.7771: UDP, length 120
23:14:01.247671 IP 192.168.43.124.8880 > 192.168.43.195.7771: UDP, length 120
23:14:01.297708 IP 192.168.43.124.8880 > 192.168.43.195.7771: UDP, length 120
23:14:01.347708 IP 192.168.43.124.8880 > 192.168.43.195.7771: UDP, length 120
23:14:01.397710 IP 192.168.43.124.8880 > 192.168.43.195.7771: UDP, length 120
23:14:01.447707 IP 192.168.43.124.8880 > 192.168.43.195.7771: UDP, length 120
23:14:01.497708 IP 192.168.43.124.8880 > 192.168.43.195.7771: UDP, length 120
23:14:01.547708 IP 192.168.43.124.8880 > 192.168.43.195.7771: UDP, length 120
23:14:01.597709 IP 192.168.43.124.8880 > 192.168.43.195.7771: UDP, length 120
23:14:01.647708 IP 192.168.43.124.8880 > 192.168.43.195.7771: UDP, length 120
23:14:01.697710 IP 192.168.43.124.8880 > 192.168.43.195.7771: UDP, length 120
23:14:01.747708 IP 192.168.43.124.8880 > 192.168.43.195.7771: UDP, length 120
23:14:01.797706 IP 192.168.43.124.8880 > 192.168.43.195.7771: UDP, length 120
23:14:01.847709 IP 192.168.43.124.8880 > 192.168.43.195.7771: UDP, length 120
23:14:01.897709 IP 192.168.43.124.8880 > 192.168.43.195.7771: UDP, length 120
23:14:01.947708 IP 192.168.43.124.8880 > 192.168.43.195.7771: UDP, length 120
23:14:01.997709 IP 192.168.43.124.8880 > 192.168.43.195.7771: UDP, length 120
23:14:02.047709 IP 192.168.43.124.8880 > 192.168.43.195.7771: UDP, length 120
23:14:02.097708 IP 192.168.43.124.8880 > 192.168.43.195.7771: UDP, length 120
23:14:02.147708 IP 192.168.43.124.8880 > 192.168.43.195.7771: UDP, length 120
23:14:02.197710 IP 192.168.43.124.8880 > 192.168.43.195.7771: UDP, length 120
23:14:02.247710 IP 192.168.43.124.8880 > 192.168.43.195.7771: UDP, length 120
23:14:02.297708 IP 192.168.43.124.8880 > 192.168.43.195.7771: UDP, length 120
23:14:02.347708 IP 192.168.43.124.8880 > 192.168.43.195.7771: UDP, length 120
23:14:02.397709 IP 192.168.43.124.8880 > 192.168.43.195.7771: UDP, length 120
23:14:02.447708 IP 192.168.43.124.8880 > 192.168.43.195.7771: UDP, length 120
23:14:02.497707 IP 192.168.43.124.8880 > 192.168.43.195.7771: UDP, length 120
23:14:02.547708 IP 192.168.43.124.8880 > 192.168.43.195.7771: UDP, length 120
23:14:02.597712 IP 192.168.43.124.8880 > 192.168.43.195.7771: UDP, length 120
23:14:02.647758 IP 192.168.43.124.8880 > 192.168.43.195.7771: UDP, length 120
23:14:02.697760 IP 192.168.43.124.8880 > 192.168.43.195.7771: UDP, length 120
23:14:02.747760 IP 192.168.43.124.8880 > 192.168.43.195.7771: UDP, length 120
23:14:02.797759 IP 192.168.43.124.8880 > 192.168.43.195.7771: UDP, length 120
23:14:02.847762 IP 192.168.43.124.8880 > 192.168.43.195.7771: UDP, length 120
23:14:02.897759 IP 192.168.43.124.8880 > 192.168.43.195.7771: UDP, length 120
23:14:02.947759 IP 192.168.43.124.8880 > 192.168.43.195.7771: UDP, length 120
23:14:02.997760 IP 192.168.43.124.8880 > 192.168.43.195.7771: UDP, length 120
23:14:03.047760 IP 192.168.43.124.8880 > 192.168.43.195.7771: UDP, length 120
23:14:03.097759 IP 192.168.43.124.8880 > 192.168.43.195.7771: UDP, length 120
23:14:03.147758 IP 192.168.43.124.8880 > 192.168.43.195.7771: UDP, length 120
23:14:03.197760 IP 192.168.43.124.8880 > 192.168.43.195.7771: UDP, length 120
23:14:03.247710 IP 192.168.43.124.8880 > 192.168.43.195.7771: UDP, length 120
23:14:03.297709 IP 192.168.43.124.8880 > 192.168.43.195.7771: UDP, length 120
23:14:03.347710 IP 192.168.43.124.8880 > 192.168.43.195.7771: UDP, length 120
23:14:03.397759 IP 192.168.43.124.8880 > 192.168.43.195.7771: UDP, length 120
23:14:03.447756 IP 192.168.43.124.8880 > 192.168.43.195.7771: UDP, length 120
23:14:03.497756 IP 192.168.43.124.8880 > 192.168.43.195.7771: UDP, length 120
23:14:03.547760 IP 192.168.43.124.8880 > 192.168.43.195.7771: UDP, length 120
23:14:03.597708 IP 192.168.43.124.8880 > 192.168.43.195.7771: UDP, length 120
23:14:03.647711 IP 192.168.43.124.8880 > 192.168.43.195.7771: UDP, length 120
23:14:03.697712 IP 192.168.43.124.8880 > 192.168.43.195.7771: UDP, length 120
23:14:03.747711 IP 192.168.43.124.8880 > 192.168.43.195.7771: UDP, length 120
23:14:03.797713 IP 192.168.43.124.8880 > 192.168.43.195.7771: UDP, length 120
23:14:03.847712 IP 192.168.43.124.8880 > 192.168.43.195.7771: UDP, length 120
23:14:03.897714 IP 192.168.43.124.8880 > 192.168.43.195.7771: UDP, length 120
23:14:03.947642 IP 192.168.43.124.8880 > 192.168.43.195.7771: UDP, length 120
23:14:03.997646 IP 192.168.43.124.8880 > 192.168.43.195.7771: UDP, length 120
23:14:04.047657 IP 192.168.43.124.8880 > 192.168.43.195.7771: UDP, length 120
23:14:04.097708 IP 192.168.43.124.8880 > 192.168.43.195.7771: UDP, length 120
23:14:04.147708 IP 192.168.43.124.8880 > 192.168.43.195.7771: UDP, length 120
23:14:04.197707 IP 192.168.43.124.8880 > 192.168.43.195.7771: UDP, length 120
23:14:04.247709 IP 192.168.43.124.8880 > 192.168.43.195.7771: UDP, length 120
23:14:04.297711 IP 192.168.43.124.8880 > 192.168.43.195.7771: UDP, length 120
23:14:04.347710 IP 192.168.43.124.8880 > 192.168.43.195.7771: UDP, length 120
23:14:04.397710 IP 192.168.43.124.8880 > 192.168.43.195.7771: UDP, length 120
23:14:04.447759 IP 192.168.43.124.8880 > 192.168.43.195.7771: UDP, length 120
23:14:04.497760 IP 192.168.43.124.8880 > 192.168.43.195.7771: UDP, length 120
23:14:04.547759 IP 192.168.43.124.8880 > 192.168.43.195.7771: UDP, length 120
23:14:04.597760 IP 192.168.43.124.8880 > 192.168.43.195.7771: UDP, length 120
23:14:04.647759 IP 192.168.43.124.8880 > 192.168.43.195.7771: UDP, length 120
23:14:04.697759 IP 192.168.43.124.8880 > 192.168.43.195.7771: UDP, length 120
23:14:04.747762 IP 192.168.43.124.8880 > 192.168.43.195.7771: UDP, length 120
23:14:04.797760 IP 192.168.43.124.8880 > 192.168.43.195.7771: UDP, length 120
23:14:04.847761 IP 192.168.43.124.8880 > 192.168.43.195.7771: UDP, length 120
23:14:04.897760 IP 192.168.43.124.8880 > 192.168.43.195.7771: UDP, length 120
23:14:04.947761 IP 192.168.43.124.8880 > 192.168.43.195.7771: UDP, length 120
23:14:04.997759 IP 192.168.43.124.8880 > 192.168.43.195.7771: UDP, length 120
23:14:05.047761 IP 192.168.43.124.8880 > 192.168.43.195.7771: UDP, length 120
23:14:05.097760 IP 192.168.43.124.8880 > 192.168.43.195.7771: UDP, length 120
23:14:05.147759 IP 192.168.43.124.8880 > 192.168.43.195.7771: UDP, length 120
23:14:05.197759 IP 192.168.43.124.8880 > 192.168.43.195.7771: UDP, length 120
23:14:05.247819 IP 192.168.43.124.8880 > 192.168.43.195.7771: UDP, length 120
23:14:05.297716 IP 192.168.43.124.8880 > 192.168.43.195.7771: UDP, length 120
23:14:05.347709 IP 192.168.43.124.8880 > 192.168.43.195.7771: UDP, length 120
23:14:05.397709 IP 192.168.43.124.8880 > 192.168.43.195.7771: UDP, length 120
23:14:05.447708 IP 192.168.43.124.8880 > 192.168.43.195.7771: UDP, length 120
23:14:05.497709 IP 192.168.43.124.8880 > 192.168.43.195.7771: UDP, length 120
23:14:05.547707 IP 192.168.43.124.8880 > 192.168.43.195.7771: UDP, length 120
23:14:05.597710 IP 192.168.43.124.8880 > 192.168.43.195.7771: UDP, length 120
23:14:05.647708 IP 192.168.43.124.8880 > 192.168.43.195.7771: UDP, length 120
23:14:05.697709 IP 192.168.43.124.8880 > 192.168.43.195.7771: UDP, length 120
23:14:05.747844 IP 192.168.43.124.8880 > 192.168.43.195.7771: UDP, length 120
23:14:05.797708 IP 192.168.43.124.8880 > 192.168.43.195.7771: UDP, length 120
23:14:05.847709 IP 192.168.43.124.8880 > 192.168.43.195.7771: UDP, length 120
23:14:05.897708 IP 192.168.43.124.8880 > 192.168.43.195.7771: UDP, length 120
23:14:05.947708 IP 192.168.43.124.8880 > 192.168.43.195.7771: UDP, length 120
23:14:05.997709 IP 192.168.43.124.8880 > 192.168.43.195.7771: UDP, length 120
23:14:06.047710 IP 192.168.43.124.8880 > 192.168.43.195.7771: UDP, length 120
23:14:06.097710 IP 192.168.43.124.8880 > 192.168.43.195.7771: UDP, length 120
23:14:06.147709 IP 192.168.43.124.8880 > 192.168.43.195.7771: UDP, length 120
23:14:06.197708 IP 192.168.43.124.8880 > 192.168.43.195.7771: UDP, length 120
23:14:06.247708 IP 192.168.43.124.8880 > 192.168.43.195.7771: UDP, length 120
23:14:06.297709 IP 192.168.43.124.8880 > 192.168.43.195.7771: UDP, length 120
23:14:06.347708 IP 192.168.43.124.8880 > 192.168.43.195.7771: UDP, length 120
23:14:06.397709 IP 192.168.43.124.8880 > 192.168.43.195.7771: UDP, length 120
23:14:06.447708 IP 192.168.43.124.8880 > 192.168.43.195.7771: UDP, length 120
23:14:06.497707 IP 192.168.43.124.8880 > 192.168.43.195.7771: UDP, length 120
23:14:06.547709 IP 192.168.43.124.8880 > 192.168.43.195.7771: UDP, length 120
23:14:06.597709 IP 192.168.43.124.8880 > 192.168.43.195.7771: UDP, length 120
23:14:06.647708 IP 192.168.43.124.8880 > 192.168.43.195.7771: UDP, length 120
23:14:06.697708 IP 192.168.43.124.8880 > 192.168.43.195.7771: UDP, length 120
23:14:06.747710 IP 192.168.43.124.8880 > 192.168.43.195.7771: UDP, length 120
23:14:06.797709 IP 192.168.43.124.8880 > 192.168.43.195.7771: UDP, length 120
23:14:06.847708 IP 192.168.43.124.8880 > 192.168.43.195.7771: UDP, length 120
23:14:06.897709 IP 192.168.43.124.8880 > 192.168.43.195.7771: UDP, length 120
23:14:06.947758 IP 192.168.43.124.8880 > 192.168.43.195.7771: UDP, length 120
23:14:06.997759 IP 192.168.43.124.8880 > 192.168.43.195.7771: UDP, length 120
23:14:07.047758 IP 192.168.43.124.8880 > 192.168.43.195.7771: UDP, length 120
23:14:07.097760 IP 192.168.43.124.8880 > 192.168.43.195.7771: UDP, length 120
23:14:07.147759 IP 192.168.43.124.8880 > 192.168.43.195.7771: UDP, length 120
23:14:07.197761 IP 192.168.43.124.8880 > 192.168.43.195.7771: UDP, length 120
23:14:07.247669 IP 192.168.43.124.8880 > 192.168.43.195.7771: UDP, length 120
23:14:07.297710 IP 192.168.43.124.8880 > 192.168.43.195.7771: UDP, length 120
23:14:07.347709 IP 192.168.43.124.8880 > 192.168.43.195.7771: UDP, length 120
23:14:07.397707 IP 192.168.43.124.8880 > 192.168.43.195.7771: UDP, length 120
23:14:07.447709 IP 192.168.43.124.8880 > 192.168.43.195.7771: UDP, length 120
23:14:07.497708 IP 192.168.43.124.8880 > 192.168.43.195.7771: UDP, length 120
23:14:07.547708 IP 192.168.43.124.8880 > 192.168.43.195.7771: UDP, length 120
23:14:07.597708 IP 192.168.43.124.8880 > 192.168.43.195.7771: UDP, length 120
23:14:07.647707 IP 192.168.43.124.8880 > 192.168.43.195.7771: UDP, length 120
23:14:07.697708 IP 192.168.43.124.8880 > 192.168.43.195.7771: UDP, length 120
23:14:07.747709 IP 192.168.43.124.8880 > 192.168.43.195.7771: UDP, length 120
23:14:07.797706 IP 192.168.43.124.8880 > 192.168.43.195.7771: UDP, length 120
23:14:07.847709 IP 192.168.43.124.8880 > 192.168.43.195.7771: UDP, length 120
23:14:07.898294 IP 192.168.43.124.8880 > 192.168.43.195.7771: UDP, length 120
23:14:07.947756 IP 192.168.43.124.8880 > 192.168.43.195.7771: UDP, length 120
23:14:07.997760 IP 192.168.43.124.8880 > 192.168.43.195.7771: UDP, length 120
23:14:08.047758 IP 192.168.43.124.8880 > 192.168.43.195.7771: UDP, length 120
23:14:08.097755 IP 192.168.43.124.8880 > 192.168.43.195.7771: UDP, length 120
23:14:08.147758 IP 192.168.43.124.8880 > 192.168.43.195.7771: UDP, length 120
23:14:08.197755 IP 192.168.43.124.8880 > 192.168.43.195.7771: UDP, length 120
23:14:08.247669 IP 192.168.43.124.8880 > 192.168.43.195.7771: UDP, length 120
23:14:08.297709 IP 192.168.43.124.8880 > 192.168.43.195.7771: UDP, length 120
23:14:08.347709 IP 192.168.43.124.8880 > 192.168.43.195.7771: UDP, length 120
23:14:08.397709 IP 192.168.43.124.8880 > 192.168.43.195.7771: UDP, length 120
23:14:08.447708 IP 192.168.43.124.8880 > 192.168.43.195.7771: UDP, length 120
23:14:08.497709 IP 192.168.43.124.8880 > 192.168.43.195.7771: UDP, length 120
23:14:08.547709 IP 192.168.43.124.8880 > 192.168.43.195.7771: UDP, length 120
23:14:08.597709 IP 192.168.43.124.8880 > 192.168.43.195.7771: UDP, length 120
23:14:08.647708 IP 192.168.43.124.8880 > 192.168.43.195.7771: UDP, length 120
23:14:08.697709 IP 192.168.43.124.8880 > 192.168.43.195.7771: UDP, length 120
23:14:08.747707 IP 192.168.43.124.8880 > 192.168.43.195.7771: UDP, length 120
23:14:08.797710 IP 192.168.43.124.8880 > 192.168.43.195.7771: UDP, length 120
23:14:08.847708 IP 192.168.43.124.8880 > 192.168.43.195.7771: UDP, length 120
23:14:08.897709 IP 192.168.43.124.8880 > 192.168.43.195.7771: UDP, length 120
23:14:08.947708 IP 192.168.43.124.8880 > 192.168.43.195.7771: UDP, length 120
23:14:08.997707 IP 192.168.43.124.8880 > 192.168.43.195.7771: UDP, length 120
23:14:09.047694 IP 192.168.43.124.8880 > 192.168.43.195.7771: UDP, length 120
23:14:09.097639 IP 192.168.43.124.8880 > 192.168.43.195.7771: UDP, length 120
23:14:09.147662 IP 192.168.43.124.8880 > 192.168.43.195.7771: UDP, length 120
23:14:09.197708 IP 192.168.43.124.8880 > 192.168.43.195.7771: UDP, length 120
23:14:09.247707 IP 192.168.43.124.8880 > 192.168.43.195.7771: UDP, length 120
23:14:09.297708 IP 192.168.43.124.8880 > 192.168.43.195.7771: UDP, length 120
23:14:09.347672 IP 192.168.43.124.8880 > 192.168.43.195.7771: UDP, length 120
23:14:09.397710 IP 192.168.43.124.8880 > 192.168.43.195.7771: UDP, length 120
23:14:09.513194 IP 192.168.43.124.8880 > 192.168.43.195.7771: UDP, length 120
23:14:09.513344 IP 192.168.43.124.8880 > 192.168.43.195.7771: UDP, length 120
23:14:09.547710 IP 192.168.43.124.8880 > 192.168.43.195.7771: UDP, length 120
23:14:09.597709 IP 192.168.43.124.8880 > 192.168.43.195.7771: UDP, length 120
23:14:09.647673 IP 192.168.43.124.8880 > 192.168.43.195.7771: UDP, length 120
23:14:09.697703 IP 192.168.43.124.8880 > 192.168.43.195.7771: UDP, length 120
23:14:09.862171 IP 192.168.43.124.8880 > 192.168.43.195.7771: UDP, length 120
23:14:09.862322 IP 192.168.43.124.8880 > 192.168.43.195.7771: UDP, length 120
23:14:09.862326 IP 192.168.43.124.8880 > 192.168.43.195.7771: UDP, length 120
23:14:09.898301 IP 192.168.43.124.8880 > 192.168.43.195.7771: UDP, length 120
23:14:09.947675 IP 192.168.43.124.8880 > 192.168.43.195.7771: UDP, length 120
23:14:09.997708 IP 192.168.43.124.8880 > 192.168.43.195.7771: UDP, length 120
23:14:10.047674 IP 192.168.43.124.8880 > 192.168.43.195.7771: UDP, length 120
23:14:10.211384 IP 192.168.43.124.8880 > 192.168.43.195.7771: UDP, length 120
23:14:10.211536 IP 192.168.43.124.8880 > 192.168.43.195.7771: UDP, length 120
23:14:10.211540 IP 192.168.43.124.8880 > 192.168.43.195.7771: UDP, length 120
23:14:10.247706 IP 192.168.43.124.8880 > 192.168.43.195.7771: UDP, length 120
23:14:10.297712 IP 192.168.43.124.8880 > 192.168.43.195.7771: UDP, length 120
23:14:10.347662 IP 192.168.43.124.8880 > 192.168.43.195.7771: UDP, length 120
23:14:10.397709 IP 192.168.43.124.8880 > 192.168.43.195.7771: UDP, length 120
23:14:10.562067 IP 192.168.43.124.8880 > 192.168.43.195.7771: UDP, length 120
23:14:10.562218 IP 192.168.43.124.8880 > 192.168.43.195.7771: UDP, length 120
23:14:10.562222 IP 192.168.43.124.8880 > 192.168.43.195.7771: UDP, length 120
23:14:10.597708 IP 192.168.43.124.8880 > 192.168.43.195.7771: UDP, length 120
23:14:10.647706 IP 192.168.43.124.8880 > 192.168.43.195.7771: UDP, length 120
23:14:10.697707 IP 192.168.43.124.8880 > 192.168.43.195.7771: UDP, length 120
23:14:10.747706 IP 192.168.43.124.8880 > 192.168.43.195.7771: UDP, length 120
23:14:10.910062 IP 192.168.43.124.8880 > 192.168.43.195.7771: UDP, length 120
23:14:10.910212 IP 192.168.43.124.8880 > 192.168.43.195.7771: UDP, length 120
23:14:10.910216 IP 192.168.43.124.8880 > 192.168.43.195.7771: UDP, length 120
23:14:10.947662 IP 192.168.43.124.8880 > 192.168.43.195.7771: UDP, length 120
23:14:10.997707 IP 192.168.43.124.8880 > 192.168.43.195.7771: UDP, length 120
23:14:11.047669 IP 192.168.43.124.8880 > 192.168.43.195.7771: UDP, length 120
23:14:11.097704 IP 192.168.43.124.8880 > 192.168.43.195.7771: UDP, length 120
23:14:11.258332 IP 192.168.43.124.8880 > 192.168.43.195.7771: UDP, length 120
23:14:11.258485 IP 192.168.43.124.8880 > 192.168.43.195.7771: UDP, length 120
23:14:11.258489 IP 192.168.43.124.8880 > 192.168.43.195.7771: UDP, length 120
23:14:11.297707 IP 192.168.43.124.8880 > 192.168.43.195.7771: UDP, length 120
23:14:11.347946 IP 192.168.43.124.8880 > 192.168.43.195.7771: UDP, length 120
23:14:11.397706 IP 192.168.43.124.8880 > 192.168.43.195.7771: UDP, length 120
23:14:11.447708 IP 192.168.43.124.8880 > 192.168.43.195.7771: UDP, length 120
23:14:11.606342 IP 192.168.43.124.8880 > 192.168.43.195.7771: UDP, length 120
23:14:11.606493 IP 192.168.43.124.8880 > 192.168.43.195.7771: UDP, length 120
23:14:11.606498 IP 192.168.43.124.8880 > 192.168.43.195.7771: UDP, length 120
23:14:11.647708 IP 192.168.43.124.8880 > 192.168.43.195.7771: UDP, length 120
23:14:11.697703 IP 192.168.43.124.8880 > 192.168.43.195.7771: UDP, length 120
23:14:11.747706 IP 192.168.43.124.8880 > 192.168.43.195.7771: UDP, length 120
23:14:11.797704 IP 192.168.43.124.8880 > 192.168.43.195.7771: UDP, length 120
23:14:11.954068 IP 192.168.43.124.8880 > 192.168.43.195.7771: UDP, length 120
23:14:11.954221 IP 192.168.43.124.8880 > 192.168.43.195.7771: UDP, length 120
23:14:11.954226 IP 192.168.43.124.8880 > 192.168.43.195.7771: UDP, length 120
23:14:11.997706 IP 192.168.43.124.8880 > 192.168.43.195.7771: UDP, length 120
23:14:12.047708 IP 192.168.43.124.8880 > 192.168.43.195.7771: UDP, length 120
23:14:12.097709 IP 192.168.43.124.8880 > 192.168.43.195.7771: UDP, length 120
23:14:12.147709 IP 192.168.43.124.8880 > 192.168.43.195.7771: UDP, length 120
23:14:12.302070 IP 192.168.43.124.8880 > 192.168.43.195.7771: UDP, length 120
23:14:12.302224 IP 192.168.43.124.8880 > 192.168.43.195.7771: UDP, length 120
23:14:12.302255 IP 192.168.43.124.8880 > 192.168.43.195.7771: UDP, length 120
23:14:12.347708 IP 192.168.43.124.8880 > 192.168.43.195.7771: UDP, length 120
23:14:12.397707 IP 192.168.43.124.8880 > 192.168.43.195.7771: UDP, length 120
23:14:12.447708 IP 192.168.43.124.8880 > 192.168.43.195.7771: UDP, length 120
23:14:12.498000 IP 192.168.43.124.8880 > 192.168.43.195.7771: UDP, length 120
23:14:12.650061 IP 192.168.43.124.8880 > 192.168.43.195.7771: UDP, length 120
23:14:12.650213 IP 192.168.43.124.8880 > 192.168.43.195.7771: UDP, length 120
23:14:12.650217 IP 192.168.43.124.8880 > 192.168.43.195.7771: UDP, length 120
23:14:12.697672 IP 192.168.43.124.8880 > 192.168.43.195.7771: UDP, length 120
23:14:12.747708 IP 192.168.43.124.8880 > 192.168.43.195.7771: UDP, length 120
23:14:12.797708 IP 192.168.43.124.8880 > 192.168.43.195.7771: UDP, length 120
23:14:12.998014 IP 192.168.43.124.8880 > 192.168.43.195.7771: UDP, length 120
23:14:12.998163 IP 192.168.43.124.8880 > 192.168.43.195.7771: UDP, length 120
23:14:12.998169 IP 192.168.43.124.8880 > 192.168.43.195.7771: UDP, length 120
23:14:12.998176 IP 192.168.43.124.8880 > 192.168.43.195.7771: UDP, length 120
23:14:13.047707 IP 192.168.43.124.8880 > 192.168.43.195.7771: UDP, length 120
23:14:13.098026 IP 192.168.43.124.8880 > 192.168.43.195.7771: UDP, length 120
23:14:13.147710 IP 192.168.43.124.8880 > 192.168.43.195.7771: UDP, length 120
23:14:13.346065 IP 192.168.43.124.8880 > 192.168.43.195.7771: UDP, length 120
23:14:13.346216 IP 192.168.43.124.8880 > 192.168.43.195.7771: UDP, length 120
23:14:13.346220 IP 192.168.43.124.8880 > 192.168.43.195.7771: UDP, length 120
23:14:13.347669 IP 192.168.43.124.8880 > 192.168.43.195.7771: UDP, length 120
23:14:13.397671 IP 192.168.43.124.8880 > 192.168.43.195.7771: UDP, length 120
23:14:13.447669 IP 192.168.43.124.8880 > 192.168.43.195.7771: UDP, length 120
23:14:13.498391 IP 192.168.43.124.8880 > 192.168.43.195.7771: UDP, length 120
23:14:13.694547 IP 192.168.43.124.8880 > 192.168.43.195.7771: UDP, length 120
23:14:13.694707 IP 192.168.43.124.8880 > 192.168.43.195.7771: UDP, length 120
23:14:13.694714 IP 192.168.43.124.8880 > 192.168.43.195.7771: UDP, length 120
23:14:13.697704 IP 192.168.43.124.8880 > 192.168.43.195.7771: UDP, length 120
23:14:13.747672 IP 192.168.43.124.8880 > 192.168.43.195.7771: UDP, length 120
23:14:13.797707 IP 192.168.43.124.8880 > 192.168.43.195.7771: UDP, length 120
23:14:13.847670 IP 192.168.43.124.8880 > 192.168.43.195.7771: UDP, length 120
23:14:14.043223 IP 192.168.43.124.8880 > 192.168.43.195.7771: UDP, length 120
23:14:14.043389 IP 192.168.43.124.8880 > 192.168.43.195.7771: UDP, length 120
23:14:14.043398 IP 192.168.43.124.8880 > 192.168.43.195.7771: UDP, length 120
23:14:14.047628 IP 192.168.43.124.8880 > 192.168.43.195.7771: UDP, length 120
23:14:14.097645 IP 192.168.43.124.8880 > 192.168.43.195.7771: UDP, length 120
23:14:14.147682 IP 192.168.43.124.8880 > 192.168.43.195.7771: UDP, length 120
23:14:14.197832 IP 192.168.43.124.8880 > 192.168.43.195.7771: UDP, length 120
23:14:14.247640 IP 192.168.43.124.8880 > 192.168.43.195.7771: UDP, length 120
23:14:14.297707 IP 192.168.43.124.8880 > 192.168.43.195.7771: UDP, length 120
23:14:14.347709 IP 192.168.43.124.8880 > 192.168.43.195.7771: UDP, length 120
23:14:14.397710 IP 192.168.43.124.8880 > 192.168.43.195.7771: UDP, length 120
23:14:14.447711 IP 192.168.43.124.8880 > 192.168.43.195.7771: UDP, length 120
23:14:14.497711 IP 192.168.43.124.8880 > 192.168.43.195.7771: UDP, length 120
23:14:14.547708 IP 192.168.43.124.8880 > 192.168.43.195.7771: UDP, length 120
23:14:14.597710 IP 192.168.43.124.8880 > 192.168.43.195.7771: UDP, length 120
23:14:14.647710 IP 192.168.43.124.8880 > 192.168.43.195.7771: UDP, length 120
23:14:14.697712 IP 192.168.43.124.8880 > 192.168.43.195.7771: UDP, length 120
23:14:14.747711 IP 192.168.43.124.8880 > 192.168.43.195.7771: UDP, length 120
23:14:14.797711 IP 192.168.43.124.8880 > 192.168.43.195.7771: UDP, length 120
23:14:14.847711 IP 192.168.43.124.8880 > 192.168.43.195.7771: UDP, length 120
23:14:14.897709 IP 192.168.43.124.8880 > 192.168.43.195.7771: UDP, length 120
23:14:14.947709 IP 192.168.43.124.8880 > 192.168.43.195.7771: UDP, length 120
23:14:14.997710 IP 192.168.43.124.8880 > 192.168.43.195.7771: UDP, length 120
23:14:15.047709 IP 192.168.43.124.8880 > 192.168.43.195.7771: UDP, length 120
23:14:15.097711 IP 192.168.43.124.8880 > 192.168.43.195.7771: UDP, length 120
23:14:15.147711 IP 192.168.43.124.8880 > 192.168.43.195.7771: UDP, length 120
23:14:15.197711 IP 192.168.43.124.8880 > 192.168.43.195.7771: UDP, length 120
23:14:15.247671 IP 192.168.43.124.8880 > 192.168.43.195.7771: UDP, length 120
23:14:15.297708 IP 192.168.43.124.8880 > 192.168.43.195.7771: UDP, length 120
23:14:15.347710 IP 192.168.43.124.8880 > 192.168.43.195.7771: UDP, length 120
23:14:15.397707 IP 192.168.43.124.8880 > 192.168.43.195.7771: UDP, length 120
23:14:15.447709 IP 192.168.43.124.8880 > 192.168.43.195.7771: UDP, length 120
23:14:15.497706 IP 192.168.43.124.8880 > 192.168.43.195.7771: UDP, length 120
23:14:15.547710 IP 192.168.43.124.8880 > 192.168.43.195.7771: UDP, length 120
23:14:15.597709 IP 192.168.43.124.8880 > 192.168.43.195.7771: UDP, length 120
23:14:15.647709 IP 192.168.43.124.8880 > 192.168.43.195.7771: UDP, length 120
23:14:15.697711 IP 192.168.43.124.8880 > 192.168.43.195.7771: UDP, length 120
23:14:15.747710 IP 192.168.43.124.8880 > 192.168.43.195.7771: UDP, length 120
23:14:15.797707 IP 192.168.43.124.8880 > 192.168.43.195.7771: UDP, length 120
23:14:15.847652 IP 192.168.43.124.8880 > 192.168.43.195.7771: UDP, length 120
23:14:15.897709 IP 192.168.43.124.8880 > 192.168.43.195.7771: UDP, length 120
23:14:15.947708 IP 192.168.43.124.8880 > 192.168.43.195.7771: UDP, length 120
23:14:15.997761 IP 192.168.43.124.8880 > 192.168.43.195.7771: UDP, length 120
23:14:16.047760 IP 192.168.43.124.8880 > 192.168.43.195.7771: UDP, length 120
23:14:16.097758 IP 192.168.43.124.8880 > 192.168.43.195.7771: UDP, length 120
23:14:16.147714 IP 192.168.43.124.8880 > 192.168.43.195.7771: UDP, length 120
23:14:16.197715 IP 192.168.43.124.8880 > 192.168.43.195.7771: UDP, length 120
23:14:16.247671 IP 192.168.43.124.8880 > 192.168.43.195.7771: UDP, length 120
23:14:16.297675 IP 192.168.43.124.8880 > 192.168.43.195.7771: UDP, length 120
23:14:16.347663 IP 192.168.43.124.8880 > 192.168.43.195.7771: UDP, length 120
23:14:16.397662 IP 192.168.43.124.8880 > 192.168.43.195.7771: UDP, length 120
23:14:16.447656 IP 192.168.43.124.8880 > 192.168.43.195.7771: UDP, length 120
23:14:16.497710 IP 192.168.43.124.8880 > 192.168.43.195.7771: UDP, length 120
23:14:16.547709 IP 192.168.43.124.8880 > 192.168.43.195.7771: UDP, length 120
23:14:16.597709 IP 192.168.43.124.8880 > 192.168.43.195.7771: UDP, length 120
23:14:16.647709 IP 192.168.43.124.8880 > 192.168.43.195.7771: UDP, length 120
23:14:16.697709 IP 192.168.43.124.8880 > 192.168.43.195.7771: UDP, length 120
23:14:16.747709 IP 192.168.43.124.8880 > 192.168.43.195.7771: UDP, length 120
23:14:16.797712 IP 192.168.43.124.8880 > 192.168.43.195.7771: UDP, length 120
23:14:16.847710 IP 192.168.43.124.8880 > 192.168.43.195.7771: UDP, length 120
23:14:16.897710 IP 192.168.43.124.8880 > 192.168.43.195.7771: UDP, length 120
23:14:16.947709 IP 192.168.43.124.8880 > 192.168.43.195.7771: UDP, length 120
23:14:16.997710 IP 192.168.43.124.8880 > 192.168.43.195.7771: UDP, length 120
23:14:17.047726 IP 192.168.43.124.8880 > 192.168.43.195.7771: UDP, length 120
23:14:17.097708 IP 192.168.43.124.8880 > 192.168.43.195.7771: UDP, length 120
23:14:17.147709 IP 192.168.43.124.8880 > 192.168.43.195.7771: UDP, length 120
23:14:17.197712 IP 192.168.43.124.8880 > 192.168.43.195.7771: UDP, length 120
23:14:17.247672 IP 192.168.43.124.8880 > 192.168.43.195.7771: UDP, length 120
23:14:17.297709 IP 192.168.43.124.8880 > 192.168.43.195.7771: UDP, length 120
23:14:17.347709 IP 192.168.43.124.8880 > 192.168.43.195.7771: UDP, length 120
23:14:17.397711 IP 192.168.43.124.8880 > 192.168.43.195.7771: UDP, length 120
23:14:17.447707 IP 192.168.43.124.8880 > 192.168.43.195.7771: UDP, length 120
23:14:17.497707 IP 192.168.43.124.8880 > 192.168.43.195.7771: UDP, length 120
23:14:17.547709 IP 192.168.43.124.8880 > 192.168.43.195.7771: UDP, length 120
23:14:17.597709 IP 192.168.43.124.8880 > 192.168.43.195.7771: UDP, length 120
23:14:17.647643 IP 192.168.43.124.8880 > 192.168.43.195.7771: UDP, length 120
23:14:17.697710 IP 192.168.43.124.8880 > 192.168.43.195.7771: UDP, length 120
23:14:17.747710 IP 192.168.43.124.8880 > 192.168.43.195.7771: UDP, length 120
23:14:17.797711 IP 192.168.43.124.8880 > 192.168.43.195.7771: UDP, length 120
23:14:17.847710 IP 192.168.43.124.8880 > 192.168.43.195.7771: UDP, length 120
23:14:17.897711 IP 192.168.43.124.8880 > 192.168.43.195.7771: UDP, length 120
23:14:17.947709 IP 192.168.43.124.8880 > 192.168.43.195.7771: UDP, length 120
23:14:17.997711 IP 192.168.43.124.8880 > 192.168.43.195.7771: UDP, length 120
23:14:18.047711 IP 192.168.43.124.8880 > 192.168.43.195.7771: UDP, length 120
23:14:18.097709 IP 192.168.43.124.8880 > 192.168.43.195.7771: UDP, length 120
23:14:18.147710 IP 192.168.43.124.8880 > 192.168.43.195.7771: UDP, length 120
23:14:18.197711 IP 192.168.43.124.8880 > 192.168.43.195.7771: UDP, length 120
23:14:18.247635 IP 192.168.43.124.8880 > 192.168.43.195.7771: UDP, length 120
23:14:18.297713 IP 192.168.43.124.8880 > 192.168.43.195.7771: UDP, length 120
23:14:18.347709 IP 192.168.43.124.8880 > 192.168.43.195.7771: UDP, length 120
23:14:18.397710 IP 192.168.43.124.8880 > 192.168.43.195.7771: UDP, length 120
23:14:18.447712 IP 192.168.43.124.8880 > 192.168.43.195.7771: UDP, length 120
23:14:18.497711 IP 192.168.43.124.8880 > 192.168.43.195.7771: UDP, length 120
23:14:18.548029 IP 192.168.43.124.8880 > 192.168.43.195.7771: UDP, length 120
23:14:18.597708 IP 192.168.43.124.8880 > 192.168.43.195.7771: UDP, length 120
23:14:18.647710 IP 192.168.43.124.8880 > 192.168.43.195.7771: UDP, length 120
23:14:18.697710 IP 192.168.43.124.8880 > 192.168.43.195.7771: UDP, length 120
23:14:18.747709 IP 192.168.43.124.8880 > 192.168.43.195.7771: UDP, length 120
23:14:18.797709 IP 192.168.43.124.8880 > 192.168.43.195.7771: UDP, length 120
23:14:18.847652 IP 192.168.43.124.8880 > 192.168.43.195.7771: UDP, length 120
23:14:18.897710 IP 192.168.43.124.8880 > 192.168.43.195.7771: UDP, length 120
23:14:18.947710 IP 192.168.43.124.8880 > 192.168.43.195.7771: UDP, length 120
23:14:18.997708 IP 192.168.43.124.8880 > 192.168.43.195.7771: UDP, length 120
23:14:19.047708 IP 192.168.43.124.8880 > 192.168.43.195.7771: UDP, length 120
23:14:19.097756 IP 192.168.43.124.8880 > 192.168.43.195.7771: UDP, length 120
23:14:19.147760 IP 192.168.43.124.8880 > 192.168.43.195.7771: UDP, length 120
23:14:19.197761 IP 192.168.43.124.8880 > 192.168.43.195.7771: UDP, length 120
23:14:19.247708 IP 192.168.43.124.8880 > 192.168.43.195.7771: UDP, length 120
23:14:19.297634 IP 192.168.43.124.8880 > 192.168.43.195.7771: UDP, length 120
23:14:19.347648 IP 192.168.43.124.8880 > 192.168.43.195.7771: UDP, length 120
23:14:19.397704 IP 192.168.43.124.8880 > 192.168.43.195.7771: UDP, length 120
23:14:19.447671 IP 192.168.43.124.8880 > 192.168.43.195.7771: UDP, length 120
23:14:19.497709 IP 192.168.43.124.8880 > 192.168.43.195.7771: UDP, length 120
23:14:19.547709 IP 192.168.43.124.8880 > 192.168.43.195.7771: UDP, length 120
23:14:19.597708 IP 192.168.43.124.8880 > 192.168.43.195.7771: UDP, length 120
23:14:19.647709 IP 192.168.43.124.8880 > 192.168.43.195.7771: UDP, length 120
23:14:19.697707 IP 192.168.43.124.8880 > 192.168.43.195.7771: UDP, length 120
23:14:19.747710 IP 192.168.43.124.8880 > 192.168.43.195.7771: UDP, length 120
23:14:19.797708 IP 192.168.43.124.8880 > 192.168.43.195.7771: UDP, length 120
23:14:19.847710 IP 192.168.43.124.8880 > 192.168.43.195.7771: UDP, length 120
23:14:19.897707 IP 192.168.43.124.8880 > 192.168.43.195.7771: UDP, length 120
23:14:19.947708 IP 192.168.43.124.8880 > 192.168.43.195.7771: UDP, length 120
23:14:19.997710 IP 192.168.43.124.8880 > 192.168.43.195.7771: UDP, length 120
23:14:20.047712 IP 192.168.43.124.8880 > 192.168.43.195.7771: UDP, length 120
23:14:20.097706 IP 192.168.43.124.8880 > 192.168.43.195.7771: UDP, length 120
23:14:20.147710 IP 192.168.43.124.8880 > 192.168.43.195.7771: UDP, length 120
23:14:20.197708 IP 192.168.43.124.8880 > 192.168.43.195.7771: UDP, length 120
23:14:20.247629 IP 192.168.43.124.8880 > 192.168.43.195.7771: UDP, length 120
23:14:20.297708 IP 192.168.43.124.8880 > 192.168.43.195.7771: UDP, length 120
23:14:20.347707 IP 192.168.43.124.8880 > 192.168.43.195.7771: UDP, length 120
23:14:20.397708 IP 192.168.43.124.8880 > 192.168.43.195.7771: UDP, length 120
23:14:20.447707 IP 192.168.43.124.8880 > 192.168.43.195.7771: UDP, length 120
23:14:20.497709 IP 192.168.43.124.8880 > 192.168.43.195.7771: UDP, length 120
23:14:20.547708 IP 192.168.43.124.8880 > 192.168.43.195.7771: UDP, length 120
23:14:20.597706 IP 192.168.43.124.8880 > 192.168.43.195.7771: UDP, length 120
23:14:20.647709 IP 192.168.43.124.8880 > 192.168.43.195.7771: UDP, length 120
23:14:20.697711 IP 192.168.43.124.8880 > 192.168.43.195.7771: UDP, length 120
23:14:20.747711 IP 192.168.43.124.8880 > 192.168.43.195.7771: UDP, length 120
23:14:20.797710 IP 192.168.43.124.8880 > 192.168.43.195.7771: UDP, length 120
23:14:20.847712 IP 192.168.43.124.8880 > 192.168.43.195.7771: UDP, length 120
23:14:20.897674 IP 192.168.43.124.8880 > 192.168.43.195.7771: UDP, length 120
23:14:20.947711 IP 192.168.43.124.8880 > 192.168.43.195.7771: UDP, length 120
23:14:20.997710 IP 192.168.43.124.8880 > 192.168.43.195.7771: UDP, length 120
23:14:21.047712 IP 192.168.43.124.8880 > 192.168.43.195.7771: UDP, length 120
23:14:21.097712 IP 192.168.43.124.8880 > 192.168.43.195.7771: UDP, length 120
23:14:21.147711 IP 192.168.43.124.8880 > 192.168.43.195.7771: UDP, length 120
23:14:21.197711 IP 192.168.43.124.8880 > 192.168.43.195.7771: UDP, length 120
23:14:21.247667 IP 192.168.43.124.8880 > 192.168.43.195.7771: UDP, length 120
23:14:21.297709 IP 192.168.43.124.8880 > 192.168.43.195.7771: UDP, length 120
23:14:21.347708 IP 192.168.43.124.8880 > 192.168.43.195.7771: UDP, length 120
23:14:21.397706 IP 192.168.43.124.8880 > 192.168.43.195.7771: UDP, length 120
23:14:21.447709 IP 192.168.43.124.8880 > 192.168.43.195.7771: UDP, length 120
23:14:21.497709 IP 192.168.43.124.8880 > 192.168.43.195.7771: UDP, length 120
23:14:21.547709 IP 192.168.43.124.8880 > 192.168.43.195.7771: UDP, length 120
23:14:21.597709 IP 192.168.43.124.8880 > 192.168.43.195.7771: UDP, length 120
23:14:21.647709 IP 192.168.43.124.8880 > 192.168.43.195.7771: UDP, length 120
23:14:21.697708 IP 192.168.43.124.8880 > 192.168.43.195.7771: UDP, length 120
23:14:21.747672 IP 192.168.43.124.8880 > 192.168.43.195.7771: UDP, length 120
23:14:21.797709 IP 192.168.43.124.8880 > 192.168.43.195.7771: UDP, length 120
23:14:21.847672 IP 192.168.43.124.8880 > 192.168.43.195.7771: UDP, length 120
23:14:21.897707 IP 192.168.43.124.8880 > 192.168.43.195.7771: UDP, length 120
23:14:21.947661 IP 192.168.43.124.8880 > 192.168.43.195.7771: UDP, length 120
23:14:21.997709 IP 192.168.43.124.8880 > 192.168.43.195.7771: UDP, length 120
23:14:22.047655 IP 192.168.43.124.8880 > 192.168.43.195.7771: UDP, length 120
23:14:22.097708 IP 192.168.43.124.8880 > 192.168.43.195.7771: UDP, length 120
23:14:22.147655 IP 192.168.43.124.8880 > 192.168.43.195.7771: UDP, length 120
23:14:22.197709 IP 192.168.43.124.8880 > 192.168.43.195.7771: UDP, length 120
23:14:22.247606 IP 192.168.43.124.8880 > 192.168.43.195.7771: UDP, length 120
23:14:22.297710 IP 192.168.43.124.8880 > 192.168.43.195.7771: UDP, length 120
23:14:22.347718 IP 192.168.43.124.8880 > 192.168.43.195.7771: UDP, length 120
23:14:22.397711 IP 192.168.43.124.8880 > 192.168.43.195.7771: UDP, length 120
23:14:22.447710 IP 192.168.43.124.8880 > 192.168.43.195.7771: UDP, length 120
23:14:22.497707 IP 192.168.43.124.8880 > 192.168.43.195.7771: UDP, length 120
23:14:22.547709 IP 192.168.43.124.8880 > 192.168.43.195.7771: UDP, length 120
23:14:22.597710 IP 192.168.43.124.8880 > 192.168.43.195.7771: UDP, length 120
23:14:22.647709 IP 192.168.43.124.8880 > 192.168.43.195.7771: UDP, length 120
23:14:22.697711 IP 192.168.43.124.8880 > 192.168.43.195.7771: UDP, length 120
23:14:22.747709 IP 192.168.43.124.8880 > 192.168.43.195.7771: UDP, length 120
23:14:22.797709 IP 192.168.43.124.8880 > 192.168.43.195.7771: UDP, length 120
23:14:22.847709 IP 192.168.43.124.8880 > 192.168.43.195.7771: UDP, length 120
23:14:22.897710 IP 192.168.43.124.8880 > 192.168.43.195.7771: UDP, length 120
23:14:22.947710 IP 192.168.43.124.8880 > 192.168.43.195.7771: UDP, length 120
23:14:22.997709 IP 192.168.43.124.8880 > 192.168.43.195.7771: UDP, length 120
23:14:23.047710 IP 192.168.43.124.8880 > 192.168.43.195.7771: UDP, length 120
23:14:23.097711 IP 192.168.43.124.8880 > 192.168.43.195.7771: UDP, length 120
23:14:23.147711 IP 192.168.43.124.8880 > 192.168.43.195.7771: UDP, length 120
23:14:23.197712 IP 192.168.43.124.8880 > 192.168.43.195.7771: UDP, length 120
23:14:23.247713 IP 192.168.43.124.8880 > 192.168.43.195.7771: UDP, length 120
23:14:23.297710 IP 192.168.43.124.8880 > 192.168.43.195.7771: UDP, length 120
23:14:23.347709 IP 192.168.43.124.8880 > 192.168.43.195.7771: UDP, length 120
23:14:23.397707 IP 192.168.43.124.8880 > 192.168.43.195.7771: UDP, length 120
23:14:23.447710 IP 192.168.43.124.8880 > 192.168.43.195.7771: UDP, length 120
23:14:23.497708 IP 192.168.43.124.8880 > 192.168.43.195.7771: UDP, length 120
23:14:23.547711 IP 192.168.43.124.8880 > 192.168.43.195.7771: UDP, length 120
23:14:23.597710 IP 192.168.43.124.8880 > 192.168.43.195.7771: UDP, length 120
23:14:23.647710 IP 192.168.43.124.8880 > 192.168.43.195.7771: UDP, length 120
23:14:23.697712 IP 192.168.43.124.8880 > 192.168.43.195.7771: UDP, length 120
23:14:23.747709 IP 192.168.43.124.8880 > 192.168.43.195.7771: UDP, length 120
23:14:23.797709 IP 192.168.43.124.8880 > 192.168.43.195.7771: UDP, length 120
23:14:23.847711 IP 192.168.43.124.8880 > 192.168.43.195.7771: UDP, length 120
23:14:23.897710 IP 192.168.43.124.8880 > 192.168.43.195.7771: UDP, length 120
23:14:23.947711 IP 192.168.43.124.8880 > 192.168.43.195.7771: UDP, length 120
23:14:23.997710 IP 192.168.43.124.8880 > 192.168.43.195.7771: UDP, length 120
23:14:24.047710 IP 192.168.43.124.8880 > 192.168.43.195.7771: UDP, length 120
23:14:24.097709 IP 192.168.43.124.8880 > 192.168.43.195.7771: UDP, length 120
23:14:24.147709 IP 192.168.43.124.8880 > 192.168.43.195.7771: UDP, length 120
23:14:24.197709 IP 192.168.43.124.8880 > 192.168.43.195.7771: UDP, length 120
23:14:24.247708 IP 192.168.43.124.8880 > 192.168.43.195.7771: UDP, length 120
23:14:24.297710 IP 192.168.43.124.8880 > 192.168.43.195.7771: UDP, length 120
23:14:24.347709 IP 192.168.43.124.8880 > 192.168.43.195.7771: UDP, length 120
23:14:24.397636 IP 192.168.43.124.8880 > 192.168.43.195.7771: UDP, length 120
23:14:24.447637 IP 192.168.43.124.8880 > 192.168.43.195.7771: UDP, length 120
23:14:24.497709 IP 192.168.43.124.8880 > 192.168.43.195.7771: UDP, length 120
23:14:24.547707 IP 192.168.43.124.8880 > 192.168.43.195.7771: UDP, length 120
23:14:24.597709 IP 192.168.43.124.8880 > 192.168.43.195.7771: UDP, length 120
23:14:24.647708 IP 192.168.43.124.8880 > 192.168.43.195.7771: UDP, length 120
23:14:24.697708 IP 192.168.43.124.8880 > 192.168.43.195.7771: UDP, length 120
23:14:24.747710 IP 192.168.43.124.8880 > 192.168.43.195.7771: UDP, length 120
23:14:24.797707 IP 192.168.43.124.8880 > 192.168.43.195.7771: UDP, length 120
23:14:24.847707 IP 192.168.43.124.8880 > 192.168.43.195.7771: UDP, length 120
23:14:24.897655 IP 192.168.43.124.8880 > 192.168.43.195.7771: UDP, length 120
23:14:24.947708 IP 192.168.43.124.8880 > 192.168.43.195.7771: UDP, length 120
23:14:24.997710 IP 192.168.43.124.8880 > 192.168.43.195.7771: UDP, length 120
23:14:25.047708 IP 192.168.43.124.8880 > 192.168.43.195.7771: UDP, length 120
23:14:25.097709 IP 192.168.43.124.8880 > 192.168.43.195.7771: UDP, length 120
23:14:25.147709 IP 192.168.43.124.8880 > 192.168.43.195.7771: UDP, length 120
23:14:25.197709 IP 192.168.43.124.8880 > 192.168.43.195.7771: UDP, length 120
23:14:25.247672 IP 192.168.43.124.8880 > 192.168.43.195.7771: UDP, length 120
23:14:25.297709 IP 192.168.43.124.8880 > 192.168.43.195.7771: UDP, length 120
23:14:25.347710 IP 192.168.43.124.8880 > 192.168.43.195.7771: UDP, length 120
23:14:25.397710 IP 192.168.43.124.8880 > 192.168.43.195.7771: UDP, length 120
23:14:25.447709 IP 192.168.43.124.8880 > 192.168.43.195.7771: UDP, length 120
23:14:25.497759 IP 192.168.43.124.8880 > 192.168.43.195.7771: UDP, length 120
23:14:25.547760 IP 192.168.43.124.8880 > 192.168.43.195.7771: UDP, length 120
23:14:25.597756 IP 192.168.43.124.8880 > 192.168.43.195.7771: UDP, length 120
