03:28:18.168967 IP 192.168.43.147.8880 > 192.168.43.124.7773: UDP, length 120
03:28:18.219047 IP 192.168.43.147.8880 > 192.168.43.124.7773: UDP, length 120
03:28:18.269000 IP 192.168.43.147.8880 > 192.168.43.124.7773: UDP, length 120
03:28:18.318987 IP 192.168.43.147.8880 > 192.168.43.124.7773: UDP, length 120
03:28:18.368987 IP 192.168.43.147.8880 > 192.168.43.124.7773: UDP, length 120
03:28:18.418986 IP 192.168.43.147.8880 > 192.168.43.124.7773: UDP, length 120
03:28:18.468983 IP 192.168.43.147.8880 > 192.168.43.124.7773: UDP, length 120
03:28:18.518986 IP 192.168.43.147.8880 > 192.168.43.124.7773: UDP, length 120
03:28:18.568984 IP 192.168.43.147.8880 > 192.168.43.124.7773: UDP, length 120
03:28:18.618983 IP 192.168.43.147.8880 > 192.168.43.124.7773: UDP, length 120
03:28:18.668982 IP 192.168.43.147.8880 > 192.168.43.124.7773: UDP, length 120
03:28:18.718985 IP 192.168.43.147.8880 > 192.168.43.124.7773: UDP, length 120
03:28:18.768983 IP 192.168.43.147.8880 > 192.168.43.124.7773: UDP, length 120
03:28:18.818983 IP 192.168.43.147.8880 > 192.168.43.124.7773: UDP, length 120
03:28:18.868984 IP 192.168.43.147.8880 > 192.168.43.124.7773: UDP, length 120
03:28:18.918986 IP 192.168.43.147.8880 > 192.168.43.124.7773: UDP, length 120
03:28:18.968985 IP 192.168.43.147.8880 > 192.168.43.124.7773: UDP, length 120
03:28:19.018985 IP 192.168.43.147.8880 > 192.168.43.124.7773: UDP, length 120
03:28:19.068983 IP 192.168.43.147.8880 > 192.168.43.124.7773: UDP, length 120
03:28:19.118985 IP 192.168.43.147.8880 > 192.168.43.124.7773: UDP, length 120
03:28:19.169000 IP 192.168.43.147.8880 > 192.168.43.124.7773: UDP, length 120
03:28:19.218988 IP 192.168.43.147.8880 > 192.168.43.124.7773: UDP, length 120
03:28:19.268984 IP 192.168.43.147.8880 > 192.168.43.124.7773: UDP, length 120
03:28:19.318986 IP 192.168.43.147.8880 > 192.168.43.124.7773: UDP, length 120
03:28:19.368984 IP 192.168.43.147.8880 > 192.168.43.124.7773: UDP, length 120
03:28:19.418984 IP 192.168.43.147.8880 > 192.168.43.124.7773: UDP, length 120
03:28:19.468983 IP 192.168.43.147.8880 > 192.168.43.124.7773: UDP, length 120
03:28:19.518984 IP 192.168.43.147.8880 > 192.168.43.124.7773: UDP, length 120
03:28:19.568984 IP 192.168.43.147.8880 > 192.168.43.124.7773: UDP, length 120
03:28:19.619066 IP 192.168.43.147.8880 > 192.168.43.124.7773: UDP, length 120
03:28:19.669122 IP 192.168.43.147.8880 > 192.168.43.124.7773: UDP, length 120
03:28:19.719033 IP 192.168.43.147.8880 > 192.168.43.124.7773: UDP, length 120
03:28:19.769045 IP 192.168.43.147.8880 > 192.168.43.124.7773: UDP, length 120
03:28:19.819041 IP 192.168.43.147.8880 > 192.168.43.124.7773: UDP, length 120
03:28:19.869030 IP 192.168.43.147.8880 > 192.168.43.124.7773: UDP, length 120
03:28:19.919059 IP 192.168.43.147.8880 > 192.168.43.124.7773: UDP, length 120
03:28:19.969025 IP 192.168.43.147.8880 > 192.168.43.124.7773: UDP, length 120
03:28:20.019046 IP 192.168.43.147.8880 > 192.168.43.124.7773: UDP, length 120
03:28:20.069020 IP 192.168.43.147.8880 > 192.168.43.124.7773: UDP, length 120
03:28:20.118965 IP 192.168.43.147.8880 > 192.168.43.124.7773: UDP, length 120
03:28:20.168964 IP 192.168.43.147.8880 > 192.168.43.124.7773: UDP, length 120
03:28:20.218968 IP 192.168.43.147.8880 > 192.168.43.124.7773: UDP, length 120
03:28:20.268961 IP 192.168.43.147.8880 > 192.168.43.124.7773: UDP, length 120
03:28:20.318959 IP 192.168.43.147.8880 > 192.168.43.124.7773: UDP, length 120
03:28:20.368959 IP 192.168.43.147.8880 > 192.168.43.124.7773: UDP, length 120
03:28:20.418990 IP 192.168.43.147.8880 > 192.168.43.124.7773: UDP, length 120
03:28:20.468960 IP 192.168.43.147.8880 > 192.168.43.124.7773: UDP, length 120
03:28:20.518959 IP 192.168.43.147.8880 > 192.168.43.124.7773: UDP, length 120
03:28:20.568958 IP 192.168.43.147.8880 > 192.168.43.124.7773: UDP, length 120
03:28:20.618959 IP 192.168.43.147.8880 > 192.168.43.124.7773: UDP, length 120
03:28:20.668963 IP 192.168.43.147.8880 > 192.168.43.124.7773: UDP, length 120
03:28:20.718959 IP 192.168.43.147.8880 > 192.168.43.124.7773: UDP, length 120
03:28:20.768959 IP 192.168.43.147.8880 > 192.168.43.124.7773: UDP, length 120
03:28:20.818960 IP 192.168.43.147.8880 > 192.168.43.124.7773: UDP, length 120
03:28:20.868961 IP 192.168.43.147.8880 > 192.168.43.124.7773: UDP, length 120
03:28:20.918960 IP 192.168.43.147.8880 > 192.168.43.124.7773: UDP, length 120
03:28:20.968963 IP 192.168.43.147.8880 > 192.168.43.124.7773: UDP, length 120
03:28:21.018960 IP 192.168.43.147.8880 > 192.168.43.124.7773: UDP, length 120
03:28:21.068959 IP 192.168.43.147.8880 > 192.168.43.124.7773: UDP, length 120
03:28:21.118959 IP 192.168.43.147.8880 > 192.168.43.124.7773: UDP, length 120
03:28:21.168960 IP 192.168.43.147.8880 > 192.168.43.124.7773: UDP, length 120
03:28:21.218997 IP 192.168.43.147.8880 > 192.168.43.124.7773: UDP, length 120
03:28:21.268978 IP 192.168.43.147.8880 > 192.168.43.124.7773: UDP, length 120
03:28:21.318960 IP 192.168.43.147.8880 > 192.168.43.124.7773: UDP, length 120
03:28:21.368960 IP 192.168.43.147.8880 > 192.168.43.124.7773: UDP, length 120
03:28:21.418960 IP 192.168.43.147.8880 > 192.168.43.124.7773: UDP, length 120
03:28:21.468959 IP 192.168.43.147.8880 > 192.168.43.124.7773: UDP, length 120
03:28:21.518958 IP 192.168.43.147.8880 > 192.168.43.124.7773: UDP, length 120
03:28:21.568957 IP 192.168.43.147.8880 > 192.168.43.124.7773: UDP, length 120
03:28:21.618960 IP 192.168.43.147.8880 > 192.168.43.124.7773: UDP, length 120
03:28:21.668960 IP 192.168.43.147.8880 > 192.168.43.124.7773: UDP, length 120
03:28:21.718959 IP 192.168.43.147.8880 > 192.168.43.124.7773: UDP, length 120
03:28:21.768958 IP 192.168.43.147.8880 > 192.168.43.124.7773: UDP, length 120
03:28:21.818957 IP 192.168.43.147.8880 > 192.168.43.124.7773: UDP, length 120
03:28:21.868959 IP 192.168.43.147.8880 > 192.168.43.124.7773: UDP, length 120
03:28:21.918987 IP 192.168.43.147.8880 > 192.168.43.124.7773: UDP, length 120
03:28:21.968984 IP 192.168.43.147.8880 > 192.168.43.124.7773: UDP, length 120
03:28:22.018986 IP 192.168.43.147.8880 > 192.168.43.124.7773: UDP, length 120
03:28:22.068988 IP 192.168.43.147.8880 > 192.168.43.124.7773: UDP, length 120
03:28:22.118985 IP 192.168.43.147.8880 > 192.168.43.124.7773: UDP, length 120
03:28:22.168987 IP 192.168.43.147.8880 > 192.168.43.124.7773: UDP, length 120
03:28:22.218984 IP 192.168.43.147.8880 > 192.168.43.124.7773: UDP, length 120
03:28:22.268989 IP 192.168.43.147.8880 > 192.168.43.124.7773: UDP, length 120
03:28:22.318989 IP 192.168.43.147.8880 > 192.168.43.124.7773: UDP, length 120
03:28:22.368980 IP 192.168.43.147.8880 > 192.168.43.124.7773: UDP, length 120
03:28:22.418980 IP 192.168.43.147.8880 > 192.168.43.124.7773: UDP, length 120
03:28:22.468984 IP 192.168.43.147.8880 > 192.168.43.124.7773: UDP, length 120
03:28:22.518991 IP 192.168.43.147.8880 > 192.168.43.124.7773: UDP, length 120
03:28:22.568984 IP 192.168.43.147.8880 > 192.168.43.124.7773: UDP, length 120
03:28:22.618987 IP 192.168.43.147.8880 > 192.168.43.124.7773: UDP, length 120
03:28:22.668987 IP 192.168.43.147.8880 > 192.168.43.124.7773: UDP, length 120
03:28:22.718992 IP 192.168.43.147.8880 > 192.168.43.124.7773: UDP, length 120
03:28:22.769029 IP 192.168.43.147.8880 > 192.168.43.124.7773: UDP, length 120
03:28:22.818989 IP 192.168.43.147.8880 > 192.168.43.124.7773: UDP, length 120
03:28:22.868986 IP 192.168.43.147.8880 > 192.168.43.124.7773: UDP, length 120
03:28:22.918987 IP 192.168.43.147.8880 > 192.168.43.124.7773: UDP, length 120
03:28:22.968986 IP 192.168.43.147.8880 > 192.168.43.124.7773: UDP, length 120
03:28:23.018986 IP 192.168.43.147.8880 > 192.168.43.124.7773: UDP, length 120
03:28:23.068986 IP 192.168.43.147.8880 > 192.168.43.124.7773: UDP, length 120
03:28:23.118987 IP 192.168.43.147.8880 > 192.168.43.124.7773: UDP, length 120
03:28:23.168990 IP 192.168.43.147.8880 > 192.168.43.124.7773: UDP, length 120
03:28:23.218985 IP 192.168.43.147.8880 > 192.168.43.124.7773: UDP, length 120
03:28:23.268983 IP 192.168.43.147.8880 > 192.168.43.124.7773: UDP, length 120
03:28:23.318984 IP 192.168.43.147.8880 > 192.168.43.124.7773: UDP, length 120
03:28:23.368986 IP 192.168.43.147.8880 > 192.168.43.124.7773: UDP, length 120
03:28:23.418986 IP 192.168.43.147.8880 > 192.168.43.124.7773: UDP, length 120
03:28:23.468984 IP 192.168.43.147.8880 > 192.168.43.124.7773: UDP, length 120
03:28:23.518984 IP 192.168.43.147.8880 > 192.168.43.124.7773: UDP, length 120
03:28:23.568985 IP 192.168.43.147.8880 > 192.168.43.124.7773: UDP, length 120
03:28:23.618984 IP 192.168.43.147.8880 > 192.168.43.124.7773: UDP, length 120
03:28:23.668984 IP 192.168.43.147.8880 > 192.168.43.124.7773: UDP, length 120
03:28:23.718985 IP 192.168.43.147.8880 > 192.168.43.124.7773: UDP, length 120
03:28:23.768981 IP 192.168.43.147.8880 > 192.168.43.124.7773: UDP, length 120
03:28:23.818989 IP 192.168.43.147.8880 > 192.168.43.124.7773: UDP, length 120
03:28:23.868987 IP 192.168.43.147.8880 > 192.168.43.124.7773: UDP, length 120
03:28:23.918987 IP 192.168.43.147.8880 > 192.168.43.124.7773: UDP, length 120
03:28:23.968985 IP 192.168.43.147.8880 > 192.168.43.124.7773: UDP, length 120
03:28:24.018985 IP 192.168.43.147.8880 > 192.168.43.124.7773: UDP, length 120
03:28:24.068985 IP 192.168.43.147.8880 > 192.168.43.124.7773: UDP, length 120
03:28:24.118985 IP 192.168.43.147.8880 > 192.168.43.124.7773: UDP, length 120
03:28:24.169007 IP 192.168.43.147.8880 > 192.168.43.124.7773: UDP, length 120
03:28:24.218989 IP 192.168.43.147.8880 > 192.168.43.124.7773: UDP, length 120
03:28:24.269026 IP 192.168.43.147.8880 > 192.168.43.124.7773: UDP, length 120
03:28:24.318988 IP 192.168.43.147.8880 > 192.168.43.124.7773: UDP, length 120
03:28:24.368984 IP 192.168.43.147.8880 > 192.168.43.124.7773: UDP, length 120
03:28:24.418986 IP 192.168.43.147.8880 > 192.168.43.124.7773: UDP, length 120
03:28:24.468983 IP 192.168.43.147.8880 > 192.168.43.124.7773: UDP, length 120
03:28:24.518982 IP 192.168.43.147.8880 > 192.168.43.124.7773: UDP, length 120
03:28:24.568983 IP 192.168.43.147.8880 > 192.168.43.124.7773: UDP, length 120
03:28:24.618986 IP 192.168.43.147.8880 > 192.168.43.124.7773: UDP, length 120
03:28:24.668984 IP 192.168.43.147.8880 > 192.168.43.124.7773: UDP, length 120
03:28:24.718984 IP 192.168.43.147.8880 > 192.168.43.124.7773: UDP, length 120
03:28:24.768983 IP 192.168.43.147.8880 > 192.168.43.124.7773: UDP, length 120
03:28:24.818984 IP 192.168.43.147.8880 > 192.168.43.124.7773: UDP, length 120
03:28:24.868996 IP 192.168.43.147.8880 > 192.168.43.124.7773: UDP, length 120
03:28:24.918992 IP 192.168.43.147.8880 > 192.168.43.124.7773: UDP, length 120
03:28:24.968984 IP 192.168.43.147.8880 > 192.168.43.124.7773: UDP, length 120
03:28:25.018985 IP 192.168.43.147.8880 > 192.168.43.124.7773: UDP, length 120
03:28:25.069060 IP 192.168.43.147.8880 > 192.168.43.124.7773: UDP, length 120
03:28:25.119060 IP 192.168.43.147.8880 > 192.168.43.124.7773: UDP, length 120
03:28:25.169104 IP 192.168.43.147.8880 > 192.168.43.124.7773: UDP, length 120
03:28:25.219020 IP 192.168.43.147.8880 > 192.168.43.124.7773: UDP, length 120
03:28:25.269048 IP 192.168.43.147.8880 > 192.168.43.124.7773: UDP, length 120
03:28:25.319037 IP 192.168.43.147.8880 > 192.168.43.124.7773: UDP, length 120
03:28:25.369039 IP 192.168.43.147.8880 > 192.168.43.124.7773: UDP, length 120
03:28:25.419034 IP 192.168.43.147.8880 > 192.168.43.124.7773: UDP, length 120
03:28:25.469047 IP 192.168.43.147.8880 > 192.168.43.124.7773: UDP, length 120
03:28:25.519063 IP 192.168.43.147.8880 > 192.168.43.124.7773: UDP, length 120
03:28:25.569004 IP 192.168.43.147.8880 > 192.168.43.124.7773: UDP, length 120
03:28:25.618968 IP 192.168.43.147.8880 > 192.168.43.124.7773: UDP, length 120
03:28:25.668966 IP 192.168.43.147.8880 > 192.168.43.124.7773: UDP, length 120
03:28:25.718960 IP 192.168.43.147.8880 > 192.168.43.124.7773: UDP, length 120
03:28:25.768998 IP 192.168.43.147.8880 > 192.168.43.124.7773: UDP, length 120
03:28:25.818961 IP 192.168.43.147.8880 > 192.168.43.124.7773: UDP, length 120
03:28:25.868963 IP 192.168.43.147.8880 > 192.168.43.124.7773: UDP, length 120
03:28:25.918960 IP 192.168.43.147.8880 > 192.168.43.124.7773: UDP, length 120
03:28:25.968960 IP 192.168.43.147.8880 > 192.168.43.124.7773: UDP, length 120
03:28:26.018960 IP 192.168.43.147.8880 > 192.168.43.124.7773: UDP, length 120
03:28:26.068960 IP 192.168.43.147.8880 > 192.168.43.124.7773: UDP, length 120
03:28:26.118959 IP 192.168.43.147.8880 > 192.168.43.124.7773: UDP, length 120
03:28:26.168963 IP 192.168.43.147.8880 > 192.168.43.124.7773: UDP, length 120
03:28:26.218962 IP 192.168.43.147.8880 > 192.168.43.124.7773: UDP, length 120
03:28:26.268964 IP 192.168.43.147.8880 > 192.168.43.124.7773: UDP, length 120
03:28:26.318960 IP 192.168.43.147.8880 > 192.168.43.124.7773: UDP, length 120
03:28:26.368961 IP 192.168.43.147.8880 > 192.168.43.124.7773: UDP, length 120
03:28:26.418958 IP 192.168.43.147.8880 > 192.168.43.124.7773: UDP, length 120
03:28:26.468958 IP 192.168.43.147.8880 > 192.168.43.124.7773: UDP, length 120
03:28:26.518959 IP 192.168.43.147.8880 > 192.168.43.124.7773: UDP, length 120
03:28:26.568960 IP 192.168.43.147.8880 > 192.168.43.124.7773: UDP, length 120
03:28:26.618959 IP 192.168.43.147.8880 > 192.168.43.124.7773: UDP, length 120
03:28:26.668960 IP 192.168.43.147.8880 > 192.168.43.124.7773: UDP, length 120
03:28:26.718958 IP 192.168.43.147.8880 > 192.168.43.124.7773: UDP, length 120
03:28:26.768962 IP 192.168.43.147.8880 > 192.168.43.124.7773: UDP, length 120
03:28:26.818957 IP 192.168.43.147.8880 > 192.168.43.124.7773: UDP, length 120
03:28:26.868960 IP 192.168.43.147.8880 > 192.168.43.124.7773: UDP, length 120
03:28:26.918984 IP 192.168.43.147.8880 > 192.168.43.124.7773: UDP, length 120
03:28:26.968985 IP 192.168.43.147.8880 > 192.168.43.124.7773: UDP, length 120
03:28:27.018985 IP 192.168.43.147.8880 > 192.168.43.124.7773: UDP, length 120
03:28:27.068985 IP 192.168.43.147.8880 > 192.168.43.124.7773: UDP, length 120
03:28:27.118985 IP 192.168.43.147.8880 > 192.168.43.124.7773: UDP, length 120
03:28:27.168987 IP 192.168.43.147.8880 > 192.168.43.124.7773: UDP, length 120
03:28:27.218984 IP 192.168.43.147.8880 > 192.168.43.124.7773: UDP, length 120
03:28:27.269030 IP 192.168.43.147.8880 > 192.168.43.124.7773: UDP, length 120
03:28:27.318995 IP 192.168.43.147.8880 > 192.168.43.124.7773: UDP, length 120
03:28:27.368991 IP 192.168.43.147.8880 > 192.168.43.124.7773: UDP, length 120
03:28:27.418988 IP 192.168.43.147.8880 > 192.168.43.124.7773: UDP, length 120
03:28:27.468984 IP 192.168.43.147.8880 > 192.168.43.124.7773: UDP, length 120
03:28:27.518983 IP 192.168.43.147.8880 > 192.168.43.124.7773: UDP, length 120
03:28:27.568983 IP 192.168.43.147.8880 > 192.168.43.124.7773: UDP, length 120
03:28:27.618986 IP 192.168.43.147.8880 > 192.168.43.124.7773: UDP, length 120
03:28:27.668985 IP 192.168.43.147.8880 > 192.168.43.124.7773: UDP, length 120
03:28:27.718983 IP 192.168.43.147.8880 > 192.168.43.124.7773: UDP, length 120
03:28:27.768984 IP 192.168.43.147.8880 > 192.168.43.124.7773: UDP, length 120
03:28:27.818982 IP 192.168.43.147.8880 > 192.168.43.124.7773: UDP, length 120
03:28:27.868985 IP 192.168.43.147.8880 > 192.168.43.124.7773: UDP, length 120
03:28:27.918985 IP 192.168.43.147.8880 > 192.168.43.124.7773: UDP, length 120
03:28:27.968984 IP 192.168.43.147.8880 > 192.168.43.124.7773: UDP, length 120
03:28:28.018983 IP 192.168.43.147.8880 > 192.168.43.124.7773: UDP, length 120
03:28:28.068983 IP 192.168.43.147.8880 > 192.168.43.124.7773: UDP, length 120
03:28:28.118982 IP 192.168.43.147.8880 > 192.168.43.124.7773: UDP, length 120
03:28:28.168986 IP 192.168.43.147.8880 > 192.168.43.124.7773: UDP, length 120
03:28:28.218984 IP 192.168.43.147.8880 > 192.168.43.124.7773: UDP, length 120
03:28:28.268984 IP 192.168.43.147.8880 > 192.168.43.124.7773: UDP, length 120
03:28:28.318984 IP 192.168.43.147.8880 > 192.168.43.124.7773: UDP, length 120
03:28:28.368987 IP 192.168.43.147.8880 > 192.168.43.124.7773: UDP, length 120
03:28:28.418986 IP 192.168.43.147.8880 > 192.168.43.124.7773: UDP, length 120
03:28:28.468986 IP 192.168.43.147.8880 > 192.168.43.124.7773: UDP, length 120
03:28:28.518984 IP 192.168.43.147.8880 > 192.168.43.124.7773: UDP, length 120
03:28:28.568980 IP 192.168.43.147.8880 > 192.168.43.124.7773: UDP, length 120
03:28:28.618985 IP 192.168.43.147.8880 > 192.168.43.124.7773: UDP, length 120
03:28:28.668984 IP 192.168.43.147.8880 > 192.168.43.124.7773: UDP, length 120
03:28:28.718989 IP 192.168.43.147.8880 > 192.168.43.124.7773: UDP, length 120
03:28:28.769038 IP 192.168.43.147.8880 > 192.168.43.124.7773: UDP, length 120
03:28:28.818986 IP 192.168.43.147.8880 > 192.168.43.124.7773: UDP, length 120
03:28:28.868986 IP 192.168.43.147.8880 > 192.168.43.124.7773: UDP, length 120
03:28:28.918983 IP 192.168.43.147.8880 > 192.168.43.124.7773: UDP, length 120
03:28:28.968990 IP 192.168.43.147.8880 > 192.168.43.124.7773: UDP, length 120
03:28:29.018989 IP 192.168.43.147.8880 > 192.168.43.124.7773: UDP, length 120
03:28:29.068987 IP 192.168.43.147.8880 > 192.168.43.124.7773: UDP, length 120
03:28:29.118985 IP 192.168.43.147.8880 > 192.168.43.124.7773: UDP, length 120
03:28:29.168992 IP 192.168.43.147.8880 > 192.168.43.124.7773: UDP, length 120
03:28:29.218984 IP 192.168.43.147.8880 > 192.168.43.124.7773: UDP, length 120
03:28:29.268986 IP 192.168.43.147.8880 > 192.168.43.124.7773: UDP, length 120
03:28:29.318983 IP 192.168.43.147.8880 > 192.168.43.124.7773: UDP, length 120
03:28:29.368985 IP 192.168.43.147.8880 > 192.168.43.124.7773: UDP, length 120
03:28:29.418982 IP 192.168.43.147.8880 > 192.168.43.124.7773: UDP, length 120
03:28:29.468991 IP 192.168.43.147.8880 > 192.168.43.124.7773: UDP, length 120
03:28:29.518985 IP 192.168.43.147.8880 > 192.168.43.124.7773: UDP, length 120
03:28:29.568984 IP 192.168.43.147.8880 > 192.168.43.124.7773: UDP, length 120
03:28:29.618986 IP 192.168.43.147.8880 > 192.168.43.124.7773: UDP, length 120
03:28:29.668983 IP 192.168.43.147.8880 > 192.168.43.124.7773: UDP, length 120
03:28:29.718985 IP 192.168.43.147.8880 > 192.168.43.124.7773: UDP, length 120
03:28:29.768984 IP 192.168.43.147.8880 > 192.168.43.124.7773: UDP, length 120
03:28:29.818981 IP 192.168.43.147.8880 > 192.168.43.124.7773: UDP, length 120
03:28:29.868985 IP 192.168.43.147.8880 > 192.168.43.124.7773: UDP, length 120
03:28:29.918983 IP 192.168.43.147.8880 > 192.168.43.124.7773: UDP, length 120
03:28:29.968989 IP 192.168.43.147.8880 > 192.168.43.124.7773: UDP, length 120
03:28:30.018987 IP 192.168.43.147.8880 > 192.168.43.124.7773: UDP, length 120
03:28:30.068997 IP 192.168.43.147.8880 > 192.168.43.124.7773: UDP, length 120
03:28:30.118987 IP 192.168.43.147.8880 > 192.168.43.124.7773: UDP, length 120
03:28:30.169007 IP 192.168.43.147.8880 > 192.168.43.124.7773: UDP, length 120
03:28:30.218991 IP 192.168.43.147.8880 > 192.168.43.124.7773: UDP, length 120
03:28:30.269030 IP 192.168.43.147.8880 > 192.168.43.124.7773: UDP, length 120
03:28:30.318989 IP 192.168.43.147.8880 > 192.168.43.124.7773: UDP, length 120
03:28:30.368986 IP 192.168.43.147.8880 > 192.168.43.124.7773: UDP, length 120
03:28:30.418987 IP 192.168.43.147.8880 > 192.168.43.124.7773: UDP, length 120
03:28:30.468986 IP 192.168.43.147.8880 > 192.168.43.124.7773: UDP, length 120
03:28:30.518987 IP 192.168.43.147.8880 > 192.168.43.124.7773: UDP, length 120
03:28:30.569101 IP 192.168.43.147.8880 > 192.168.43.124.7773: UDP, length 120
03:28:30.619061 IP 192.168.43.147.8880 > 192.168.43.124.7773: UDP, length 120
03:28:30.669062 IP 192.168.43.147.8880 > 192.168.43.124.7773: UDP, length 120
03:28:30.719007 IP 192.168.43.147.8880 > 192.168.43.124.7773: UDP, length 120
03:28:30.769059 IP 192.168.43.147.8880 > 192.168.43.124.7773: UDP, length 120
03:28:30.819040 IP 192.168.43.147.8880 > 192.168.43.124.7773: UDP, length 120
03:28:30.869073 IP 192.168.43.147.8880 > 192.168.43.124.7773: UDP, length 120
03:28:30.919026 IP 192.168.43.147.8880 > 192.168.43.124.7773: UDP, length 120
03:28:30.969038 IP 192.168.43.147.8880 > 192.168.43.124.7773: UDP, length 120
03:28:31.019011 IP 192.168.43.147.8880 > 192.168.43.124.7773: UDP, length 120
03:28:31.068968 IP 192.168.43.147.8880 > 192.168.43.124.7773: UDP, length 120
03:28:31.118961 IP 192.168.43.147.8880 > 192.168.43.124.7773: UDP, length 120
03:28:31.168961 IP 192.168.43.147.8880 > 192.168.43.124.7773: UDP, length 120
03:28:31.218959 IP 192.168.43.147.8880 > 192.168.43.124.7773: UDP, length 120
03:28:31.268964 IP 192.168.43.147.8880 > 192.168.43.124.7773: UDP, length 120
03:28:31.318962 IP 192.168.43.147.8880 > 192.168.43.124.7773: UDP, length 120
03:28:31.368960 IP 192.168.43.147.8880 > 192.168.43.124.7773: UDP, length 120
03:28:31.418959 IP 192.168.43.147.8880 > 192.168.43.124.7773: UDP, length 120
03:28:31.468959 IP 192.168.43.147.8880 > 192.168.43.124.7773: UDP, length 120
03:28:31.518959 IP 192.168.43.147.8880 > 192.168.43.124.7773: UDP, length 120
03:28:31.568961 IP 192.168.43.147.8880 > 192.168.43.124.7773: UDP, length 120
03:28:31.618964 IP 192.168.43.147.8880 > 192.168.43.124.7773: UDP, length 120
03:28:31.668960 IP 192.168.43.147.8880 > 192.168.43.124.7773: UDP, length 120
03:28:31.718959 IP 192.168.43.147.8880 > 192.168.43.124.7773: UDP, length 120
03:28:31.768994 IP 192.168.43.147.8880 > 192.168.43.124.7773: UDP, length 120
03:28:31.818961 IP 192.168.43.147.8880 > 192.168.43.124.7773: UDP, length 120
03:28:31.868959 IP 192.168.43.147.8880 > 192.168.43.124.7773: UDP, length 120
03:28:31.918983 IP 192.168.43.147.8880 > 192.168.43.124.7773: UDP, length 120
03:28:31.968984 IP 192.168.43.147.8880 > 192.168.43.124.7773: UDP, length 120
03:28:32.018985 IP 192.168.43.147.8880 > 192.168.43.124.7773: UDP, length 120
03:28:32.068988 IP 192.168.43.147.8880 > 192.168.43.124.7773: UDP, length 120
03:28:32.118988 IP 192.168.43.147.8880 > 192.168.43.124.7773: UDP, length 120
03:28:32.168989 IP 192.168.43.147.8880 > 192.168.43.124.7773: UDP, length 120
03:28:32.218984 IP 192.168.43.147.8880 > 192.168.43.124.7773: UDP, length 120
03:28:32.268984 IP 192.168.43.147.8880 > 192.168.43.124.7773: UDP, length 120
03:28:32.318989 IP 192.168.43.147.8880 > 192.168.43.124.7773: UDP, length 120
03:28:32.368991 IP 192.168.43.147.8880 > 192.168.43.124.7773: UDP, length 120
03:28:32.418983 IP 192.168.43.147.8880 > 192.168.43.124.7773: UDP, length 120
03:28:32.468985 IP 192.168.43.147.8880 > 192.168.43.124.7773: UDP, length 120
03:28:32.518985 IP 192.168.43.147.8880 > 192.168.43.124.7773: UDP, length 120
03:28:32.568989 IP 192.168.43.147.8880 > 192.168.43.124.7773: UDP, length 120
03:28:32.618996 IP 192.168.43.147.8880 > 192.168.43.124.7773: UDP, length 120
03:28:32.668988 IP 192.168.43.147.8880 > 192.168.43.124.7773: UDP, length 120
03:28:32.718984 IP 192.168.43.147.8880 > 192.168.43.124.7773: UDP, length 120
03:28:32.768990 IP 192.168.43.147.8880 > 192.168.43.124.7773: UDP, length 120
03:28:32.818979 IP 192.168.43.147.8880 > 192.168.43.124.7773: UDP, length 120
03:28:32.868984 IP 192.168.43.147.8880 > 192.168.43.124.7773: UDP, length 120
03:28:32.918985 IP 192.168.43.147.8880 > 192.168.43.124.7773: UDP, length 120
03:28:32.968985 IP 192.168.43.147.8880 > 192.168.43.124.7773: UDP, length 120
03:28:33.018984 IP 192.168.43.147.8880 > 192.168.43.124.7773: UDP, length 120
03:28:33.068983 IP 192.168.43.147.8880 > 192.168.43.124.7773: UDP, length 120
03:28:33.118982 IP 192.168.43.147.8880 > 192.168.43.124.7773: UDP, length 120
03:28:33.168987 IP 192.168.43.147.8880 > 192.168.43.124.7773: UDP, length 120
03:28:33.218986 IP 192.168.43.147.8880 > 192.168.43.124.7773: UDP, length 120
03:28:33.269030 IP 192.168.43.147.8880 > 192.168.43.124.7773: UDP, length 120
03:28:33.318988 IP 192.168.43.147.8880 > 192.168.43.124.7773: UDP, length 120
03:28:33.368984 IP 192.168.43.147.8880 > 192.168.43.124.7773: UDP, length 120
03:28:33.418985 IP 192.168.43.147.8880 > 192.168.43.124.7773: UDP, length 120
03:28:33.468984 IP 192.168.43.147.8880 > 192.168.43.124.7773: UDP, length 120
03:28:33.518984 IP 192.168.43.147.8880 > 192.168.43.124.7773: UDP, length 120
03:28:33.568984 IP 192.168.43.147.8880 > 192.168.43.124.7773: UDP, length 120
03:28:33.618988 IP 192.168.43.147.8880 > 192.168.43.124.7773: UDP, length 120
03:28:33.668988 IP 192.168.43.147.8880 > 192.168.43.124.7773: UDP, length 120
03:28:33.718985 IP 192.168.43.147.8880 > 192.168.43.124.7773: UDP, length 120
03:28:33.768985 IP 192.168.43.147.8880 > 192.168.43.124.7773: UDP, length 120
03:28:33.818984 IP 192.168.43.147.8880 > 192.168.43.124.7773: UDP, length 120
03:28:33.868984 IP 192.168.43.147.8880 > 192.168.43.124.7773: UDP, length 120
03:28:33.918985 IP 192.168.43.147.8880 > 192.168.43.124.7773: UDP, length 120
03:28:33.968986 IP 192.168.43.147.8880 > 192.168.43.124.7773: UDP, length 120
03:28:34.018983 IP 192.168.43.147.8880 > 192.168.43.124.7773: UDP, length 120
03:28:34.068983 IP 192.168.43.147.8880 > 192.168.43.124.7773: UDP, length 120
03:28:34.118983 IP 192.168.43.147.8880 > 192.168.43.124.7773: UDP, length 120
03:28:34.168989 IP 192.168.43.147.8880 > 192.168.43.124.7773: UDP, length 120
03:28:34.218984 IP 192.168.43.147.8880 > 192.168.43.124.7773: UDP, length 120
03:28:34.268983 IP 192.168.43.147.8880 > 192.168.43.124.7773: UDP, length 120
03:28:34.318982 IP 192.168.43.147.8880 > 192.168.43.124.7773: UDP, length 120
03:28:34.368984 IP 192.168.43.147.8880 > 192.168.43.124.7773: UDP, length 120
03:28:34.418984 IP 192.168.43.147.8880 > 192.168.43.124.7773: UDP, length 120
03:28:34.468983 IP 192.168.43.147.8880 > 192.168.43.124.7773: UDP, length 120
03:28:34.518983 IP 192.168.43.147.8880 > 192.168.43.124.7773: UDP, length 120
03:28:34.568983 IP 192.168.43.147.8880 > 192.168.43.124.7773: UDP, length 120
03:28:34.618986 IP 192.168.43.147.8880 > 192.168.43.124.7773: UDP, length 120
03:28:34.668985 IP 192.168.43.147.8880 > 192.168.43.124.7773: UDP, length 120
03:28:34.718985 IP 192.168.43.147.8880 > 192.168.43.124.7773: UDP, length 120
03:28:34.769028 IP 192.168.43.147.8880 > 192.168.43.124.7773: UDP, length 120
03:28:34.818994 IP 192.168.43.147.8880 > 192.168.43.124.7773: UDP, length 120
03:28:34.868987 IP 192.168.43.147.8880 > 192.168.43.124.7773: UDP, length 120
03:28:34.918985 IP 192.168.43.147.8880 > 192.168.43.124.7773: UDP, length 120
03:28:34.968985 IP 192.168.43.147.8880 > 192.168.43.124.7773: UDP, length 120
03:28:35.018984 IP 192.168.43.147.8880 > 192.168.43.124.7773: UDP, length 120
03:28:35.068989 IP 192.168.43.147.8880 > 192.168.43.124.7773: UDP, length 120
03:28:35.118989 IP 192.168.43.147.8880 > 192.168.43.124.7773: UDP, length 120
03:28:35.169001 IP 192.168.43.147.8880 > 192.168.43.124.7773: UDP, length 120
03:28:35.218986 IP 192.168.43.147.8880 > 192.168.43.124.7773: UDP, length 120
03:28:35.268984 IP 192.168.43.147.8880 > 192.168.43.124.7773: UDP, length 120
03:28:35.318988 IP 192.168.43.147.8880 > 192.168.43.124.7773: UDP, length 120
03:28:35.368990 IP 192.168.43.147.8880 > 192.168.43.124.7773: UDP, length 120
03:28:35.418982 IP 192.168.43.147.8880 > 192.168.43.124.7773: UDP, length 120
03:28:35.468984 IP 192.168.43.147.8880 > 192.168.43.124.7773: UDP, length 120
03:28:35.518984 IP 192.168.43.147.8880 > 192.168.43.124.7773: UDP, length 120
03:28:35.568987 IP 192.168.43.147.8880 > 192.168.43.124.7773: UDP, length 120
03:28:35.618991 IP 192.168.43.147.8880 > 192.168.43.124.7773: UDP, length 120
03:28:35.668979 IP 192.168.43.147.8880 > 192.168.43.124.7773: UDP, length 120
03:28:35.718983 IP 192.168.43.147.8880 > 192.168.43.124.7773: UDP, length 120
03:28:35.768991 IP 192.168.43.147.8880 > 192.168.43.124.7773: UDP, length 120
03:28:35.818995 IP 192.168.43.147.8880 > 192.168.43.124.7773: UDP, length 120
03:28:35.869002 IP 192.168.43.147.8880 > 192.168.43.124.7773: UDP, length 120
03:28:35.918989 IP 192.168.43.147.8880 > 192.168.43.124.7773: UDP, length 120
03:28:35.968989 IP 192.168.43.147.8880 > 192.168.43.124.7773: UDP, length 120
03:28:36.019046 IP 192.168.43.147.8880 > 192.168.43.124.7773: UDP, length 120
03:28:36.069083 IP 192.168.43.147.8880 > 192.168.43.124.7773: UDP, length 120
03:28:36.119141 IP 192.168.43.147.8880 > 192.168.43.124.7773: UDP, length 120
03:28:36.169071 IP 192.168.43.147.8880 > 192.168.43.124.7773: UDP, length 120
03:28:36.219048 IP 192.168.43.147.8880 > 192.168.43.124.7773: UDP, length 120
03:28:36.269045 IP 192.168.43.147.8880 > 192.168.43.124.7773: UDP, length 120
03:28:36.319032 IP 192.168.43.147.8880 > 192.168.43.124.7773: UDP, length 120
03:28:36.369061 IP 192.168.43.147.8880 > 192.168.43.124.7773: UDP, length 120
03:28:36.419055 IP 192.168.43.147.8880 > 192.168.43.124.7773: UDP, length 120
03:28:36.469031 IP 192.168.43.147.8880 > 192.168.43.124.7773: UDP, length 120
03:28:36.519014 IP 192.168.43.147.8880 > 192.168.43.124.7773: UDP, length 120
03:28:36.568968 IP 192.168.43.147.8880 > 192.168.43.124.7773: UDP, length 120
03:28:36.618962 IP 192.168.43.147.8880 > 192.168.43.124.7773: UDP, length 120
03:28:36.668961 IP 192.168.43.147.8880 > 192.168.43.124.7773: UDP, length 120
03:28:36.718959 IP 192.168.43.147.8880 > 192.168.43.124.7773: UDP, length 120
03:28:36.768960 IP 192.168.43.147.8880 > 192.168.43.124.7773: UDP, length 120
03:28:36.818958 IP 192.168.43.147.8880 > 192.168.43.124.7773: UDP, length 120
03:28:36.868966 IP 192.168.43.147.8880 > 192.168.43.124.7773: UDP, length 120
03:28:36.918989 IP 192.168.43.147.8880 > 192.168.43.124.7773: UDP, length 120
03:28:36.968984 IP 192.168.43.147.8880 > 192.168.43.124.7773: UDP, length 120
03:28:37.018984 IP 192.168.43.147.8880 > 192.168.43.124.7773: UDP, length 120
03:28:37.068984 IP 192.168.43.147.8880 > 192.168.43.124.7773: UDP, length 120
03:28:37.118983 IP 192.168.43.147.8880 > 192.168.43.124.7773: UDP, length 120
03:28:37.168988 IP 192.168.43.147.8880 > 192.168.43.124.7773: UDP, length 120
03:28:37.218985 IP 192.168.43.147.8880 > 192.168.43.124.7773: UDP, length 120
03:28:37.268983 IP 192.168.43.147.8880 > 192.168.43.124.7773: UDP, length 120
03:28:37.318982 IP 192.168.43.147.8880 > 192.168.43.124.7773: UDP, length 120
03:28:37.368984 IP 192.168.43.147.8880 > 192.168.43.124.7773: UDP, length 120
03:28:37.418986 IP 192.168.43.147.8880 > 192.168.43.124.7773: UDP, length 120
03:28:37.468984 IP 192.168.43.147.8880 > 192.168.43.124.7773: UDP, length 120
03:28:37.518985 IP 192.168.43.147.8880 > 192.168.43.124.7773: UDP, length 120
03:28:37.568984 IP 192.168.43.147.8880 > 192.168.43.124.7773: UDP, length 120
03:28:37.618987 IP 192.168.43.147.8880 > 192.168.43.124.7773: UDP, length 120
03:28:37.668986 IP 192.168.43.147.8880 > 192.168.43.124.7773: UDP, length 120
03:28:37.718985 IP 192.168.43.147.8880 > 192.168.43.124.7773: UDP, length 120
03:28:37.769027 IP 192.168.43.147.8880 > 192.168.43.124.7773: UDP, length 120
03:28:37.818988 IP 192.168.43.147.8880 > 192.168.43.124.7773: UDP, length 120
03:28:37.868989 IP 192.168.43.147.8880 > 192.168.43.124.7773: UDP, length 120
03:28:37.918988 IP 192.168.43.147.8880 > 192.168.43.124.7773: UDP, length 120
03:28:37.968984 IP 192.168.43.147.8880 > 192.168.43.124.7773: UDP, length 120
03:28:38.018987 IP 192.168.43.147.8880 > 192.168.43.124.7773: UDP, length 120
03:28:38.068987 IP 192.168.43.147.8880 > 192.168.43.124.7773: UDP, length 120
03:28:38.118984 IP 192.168.43.147.8880 > 192.168.43.124.7773: UDP, length 120
03:28:38.168988 IP 192.168.43.147.8880 > 192.168.43.124.7773: UDP, length 120
03:28:38.218986 IP 192.168.43.147.8880 > 192.168.43.124.7773: UDP, length 120
03:28:38.268987 IP 192.168.43.147.8880 > 192.168.43.124.7773: UDP, length 120
03:28:38.318984 IP 192.168.43.147.8880 > 192.168.43.124.7773: UDP, length 120
03:28:38.368985 IP 192.168.43.147.8880 > 192.168.43.124.7773: UDP, length 120
03:28:38.418987 IP 192.168.43.147.8880 > 192.168.43.124.7773: UDP, length 120
03:28:38.468984 IP 192.168.43.147.8880 > 192.168.43.124.7773: UDP, length 120
03:28:38.518985 IP 192.168.43.147.8880 > 192.168.43.124.7773: UDP, length 120
03:28:38.568984 IP 192.168.43.147.8880 > 192.168.43.124.7773: UDP, length 120
03:28:38.618988 IP 192.168.43.147.8880 > 192.168.43.124.7773: UDP, length 120
03:28:38.668983 IP 192.168.43.147.8880 > 192.168.43.124.7773: UDP, length 120
03:28:38.718983 IP 192.168.43.147.8880 > 192.168.43.124.7773: UDP, length 120
03:28:38.768984 IP 192.168.43.147.8880 > 192.168.43.124.7773: UDP, length 120
03:28:38.818985 IP 192.168.43.147.8880 > 192.168.43.124.7773: UDP, length 120
03:28:38.868985 IP 192.168.43.147.8880 > 192.168.43.124.7773: UDP, length 120
03:28:38.918986 IP 192.168.43.147.8880 > 192.168.43.124.7773: UDP, length 120
03:28:38.968982 IP 192.168.43.147.8880 > 192.168.43.124.7773: UDP, length 120
03:28:39.018993 IP 192.168.43.147.8880 > 192.168.43.124.7773: UDP, length 120
03:28:39.068984 IP 192.168.43.147.8880 > 192.168.43.124.7773: UDP, length 120
03:28:39.118985 IP 192.168.43.147.8880 > 192.168.43.124.7773: UDP, length 120
03:28:39.168990 IP 192.168.43.147.8880 > 192.168.43.124.7773: UDP, length 120
03:28:39.218988 IP 192.168.43.147.8880 > 192.168.43.124.7773: UDP, length 120
03:28:39.269027 IP 192.168.43.147.8880 > 192.168.43.124.7773: UDP, length 120
03:28:39.318988 IP 192.168.43.147.8880 > 192.168.43.124.7773: UDP, length 120
03:28:39.368987 IP 192.168.43.147.8880 > 192.168.43.124.7773: UDP, length 120
03:28:39.418986 IP 192.168.43.147.8880 > 192.168.43.124.7773: UDP, length 120
03:28:39.468985 IP 192.168.43.147.8880 > 192.168.43.124.7773: UDP, length 120
03:28:39.518985 IP 192.168.43.147.8880 > 192.168.43.124.7773: UDP, length 120
03:28:39.568984 IP 192.168.43.147.8880 > 192.168.43.124.7773: UDP, length 120
03:28:39.618986 IP 192.168.43.147.8880 > 192.168.43.124.7773: UDP, length 120
03:28:39.668984 IP 192.168.43.147.8880 > 192.168.43.124.7773: UDP, length 120
03:28:39.718983 IP 192.168.43.147.8880 > 192.168.43.124.7773: UDP, length 120
03:28:39.768983 IP 192.168.43.147.8880 > 192.168.43.124.7773: UDP, length 120
03:28:39.818982 IP 192.168.43.147.8880 > 192.168.43.124.7773: UDP, length 120
03:28:39.868983 IP 192.168.43.147.8880 > 192.168.43.124.7773: UDP, length 120
03:28:39.918984 IP 192.168.43.147.8880 > 192.168.43.124.7773: UDP, length 120
03:28:39.968984 IP 192.168.43.147.8880 > 192.168.43.124.7773: UDP, length 120
03:28:40.018984 IP 192.168.43.147.8880 > 192.168.43.124.7773: UDP, length 120
03:28:40.068985 IP 192.168.43.147.8880 > 192.168.43.124.7773: UDP, length 120
03:28:40.118981 IP 192.168.43.147.8880 > 192.168.43.124.7773: UDP, length 120
03:28:40.169001 IP 192.168.43.147.8880 > 192.168.43.124.7773: UDP, length 120
03:28:40.218983 IP 192.168.43.147.8880 > 192.168.43.124.7773: UDP, length 120
03:28:40.268983 IP 192.168.43.147.8880 > 192.168.43.124.7773: UDP, length 120
03:28:40.318981 IP 192.168.43.147.8880 > 192.168.43.124.7773: UDP, length 120
03:28:40.368982 IP 192.168.43.147.8880 > 192.168.43.124.7773: UDP, length 120
03:28:40.418982 IP 192.168.43.147.8880 > 192.168.43.124.7773: UDP, length 120
03:28:40.468985 IP 192.168.43.147.8880 > 192.168.43.124.7773: UDP, length 120
03:28:40.518982 IP 192.168.43.147.8880 > 192.168.43.124.7773: UDP, length 120
03:28:40.568982 IP 192.168.43.147.8880 > 192.168.43.124.7773: UDP, length 120
03:28:40.618983 IP 192.168.43.147.8880 > 192.168.43.124.7773: UDP, length 120
03:28:40.668983 IP 192.168.43.147.8880 > 192.168.43.124.7773: UDP, length 120
03:28:40.718982 IP 192.168.43.147.8880 > 192.168.43.124.7773: UDP, length 120
03:28:40.769026 IP 192.168.43.147.8880 > 192.168.43.124.7773: UDP, length 120
03:28:40.818986 IP 192.168.43.147.8880 > 192.168.43.124.7773: UDP, length 120
03:28:40.868989 IP 192.168.43.147.8880 > 192.168.43.124.7773: UDP, length 120
03:28:40.918983 IP 192.168.43.147.8880 > 192.168.43.124.7773: UDP, length 120
03:28:40.969009 IP 192.168.43.147.8880 > 192.168.43.124.7773: UDP, length 120
03:28:41.018982 IP 192.168.43.147.8880 > 192.168.43.124.7773: UDP, length 120
03:28:41.068984 IP 192.168.43.147.8880 > 192.168.43.124.7773: UDP, length 120
03:28:41.118981 IP 192.168.43.147.8880 > 192.168.43.124.7773: UDP, length 120
03:28:41.169012 IP 192.168.43.147.8880 > 192.168.43.124.7773: UDP, length 120
03:28:41.219001 IP 192.168.43.147.8880 > 192.168.43.124.7773: UDP, length 120
03:28:41.268984 IP 192.168.43.147.8880 > 192.168.43.124.7773: UDP, length 120
03:28:41.318983 IP 192.168.43.147.8880 > 192.168.43.124.7773: UDP, length 120
03:28:41.368982 IP 192.168.43.147.8880 > 192.168.43.124.7773: UDP, length 120
03:28:41.418983 IP 192.168.43.147.8880 > 192.168.43.124.7773: UDP, length 120
03:28:41.468982 IP 192.168.43.147.8880 > 192.168.43.124.7773: UDP, length 120
03:28:41.519053 IP 192.168.43.147.8880 > 192.168.43.124.7773: UDP, length 120
03:28:41.569081 IP 192.168.43.147.8880 > 192.168.43.124.7773: UDP, length 120
03:28:41.619039 IP 192.168.43.147.8880 > 192.168.43.124.7773: UDP, length 120
03:28:41.669010 IP 192.168.43.147.8880 > 192.168.43.124.7773: UDP, length 120
03:28:41.719037 IP 192.168.43.147.8880 > 192.168.43.124.7773: UDP, length 120
03:28:41.769048 IP 192.168.43.147.8880 > 192.168.43.124.7773: UDP, length 120
03:28:41.819032 IP 192.168.43.147.8880 > 192.168.43.124.7773: UDP, length 120
03:28:41.869019 IP 192.168.43.147.8880 > 192.168.43.124.7773: UDP, length 120
03:28:41.919055 IP 192.168.43.147.8880 > 192.168.43.124.7773: UDP, length 120
03:28:41.969011 IP 192.168.43.147.8880 > 192.168.43.124.7773: UDP, length 120
03:28:42.018966 IP 192.168.43.147.8880 > 192.168.43.124.7773: UDP, length 120
03:28:42.068964 IP 192.168.43.147.8880 > 192.168.43.124.7773: UDP, length 120
03:28:42.118957 IP 192.168.43.147.8880 > 192.168.43.124.7773: UDP, length 120
03:28:42.168969 IP 192.168.43.147.8880 > 192.168.43.124.7773: UDP, length 120
03:28:42.218963 IP 192.168.43.147.8880 > 192.168.43.124.7773: UDP, length 120
03:28:42.268998 IP 192.168.43.147.8880 > 192.168.43.124.7773: UDP, length 120
03:28:42.318962 IP 192.168.43.147.8880 > 192.168.43.124.7773: UDP, length 120
03:28:42.368959 IP 192.168.43.147.8880 > 192.168.43.124.7773: UDP, length 120
03:28:42.418959 IP 192.168.43.147.8880 > 192.168.43.124.7773: UDP, length 120
03:28:42.468959 IP 192.168.43.147.8880 > 192.168.43.124.7773: UDP, length 120
03:28:42.518959 IP 192.168.43.147.8880 > 192.168.43.124.7773: UDP, length 120
03:28:42.522212 IP 192.168.43.124.8880 > 192.168.43.147.7772: UDP, length 120
03:28:42.568959 IP 192.168.43.147.8880 > 192.168.43.124.7773: UDP, length 120
03:28:42.594108 IP 192.168.43.124.8880 > 192.168.43.147.7772: UDP, length 120
03:28:42.618962 IP 192.168.43.147.8880 > 192.168.43.124.7773: UDP, length 120
03:28:42.622215 IP 192.168.43.124.8880 > 192.168.43.147.7772: UDP, length 120
03:28:42.668960 IP 192.168.43.147.8880 > 192.168.43.124.7773: UDP, length 120
03:28:42.683012 IP 192.168.43.124.8880 > 192.168.43.147.7772: UDP, length 120
03:28:42.718960 IP 192.168.43.147.8880 > 192.168.43.124.7773: UDP, length 120
03:28:42.722216 IP 192.168.43.124.8880 > 192.168.43.147.7772: UDP, length 120
03:28:42.768960 IP 192.168.43.147.8880 > 192.168.43.124.7773: UDP, length 120
03:28:42.777871 IP 192.168.43.124.8880 > 192.168.43.147.7772: UDP, length 120
03:28:42.818958 IP 192.168.43.147.8880 > 192.168.43.124.7773: UDP, length 120
03:28:42.822201 IP 192.168.43.124.8880 > 192.168.43.147.7772: UDP, length 120
03:28:42.868963 IP 192.168.43.147.8880 > 192.168.43.124.7773: UDP, length 120
03:28:42.886748 IP 192.168.43.124.8880 > 192.168.43.147.7772: UDP, length 120
03:28:42.918964 IP 192.168.43.147.8880 > 192.168.43.124.7773: UDP, length 120
03:28:42.922573 IP 192.168.43.124.8880 > 192.168.43.147.7772: UDP, length 120
03:28:42.968959 IP 192.168.43.147.8880 > 192.168.43.124.7773: UDP, length 120
03:28:42.972208 IP 192.168.43.124.8880 > 192.168.43.147.7772: UDP, length 120
03:28:43.018960 IP 192.168.43.147.8880 > 192.168.43.124.7773: UDP, length 120
03:28:43.022206 IP 192.168.43.124.8880 > 192.168.43.147.7772: UDP, length 120
03:28:43.068963 IP 192.168.43.147.8880 > 192.168.43.124.7773: UDP, length 120
03:28:43.081617 IP 192.168.43.124.8880 > 192.168.43.147.7772: UDP, length 120
03:28:43.118961 IP 192.168.43.147.8880 > 192.168.43.124.7773: UDP, length 120
03:28:43.122213 IP 192.168.43.124.8880 > 192.168.43.147.7772: UDP, length 120
03:28:43.174877 IP 192.168.43.124.8880 > 192.168.43.147.7772: UDP, length 120
03:28:43.224302 IP 192.168.43.124.8880 > 192.168.43.147.7772: UDP, length 120
03:28:43.294695 IP 192.168.43.124.8880 > 192.168.43.147.7772: UDP, length 120
03:28:43.325112 IP 192.168.43.124.8880 > 192.168.43.147.7772: UDP, length 120
03:28:43.394498 IP 192.168.43.124.8880 > 192.168.43.147.7772: UDP, length 120
03:28:43.426269 IP 192.168.43.124.8880 > 192.168.43.147.7772: UDP, length 120
03:28:43.474874 IP 192.168.43.124.8880 > 192.168.43.147.7772: UDP, length 120
03:28:43.524796 IP 192.168.43.124.8880 > 192.168.43.147.7772: UDP, length 120
03:28:43.571847 IP 192.168.43.124.8880 > 192.168.43.147.7772: UDP, length 120
03:28:43.624516 IP 192.168.43.124.8880 > 192.168.43.147.7772: UDP, length 120
03:28:43.683838 IP 192.168.43.124.8880 > 192.168.43.147.7772: UDP, length 120
03:28:43.724747 IP 192.168.43.124.8880 > 192.168.43.147.7772: UDP, length 120
03:28:43.776529 IP 192.168.43.124.8880 > 192.168.43.147.7772: UDP, length 120
03:28:43.832161 IP 192.168.43.124.8880 > 192.168.43.147.7772: UDP, length 120
03:28:43.874769 IP 192.168.43.124.8880 > 192.168.43.147.7772: UDP, length 120
03:28:43.924581 IP 192.168.43.124.8880 > 192.168.43.147.7772: UDP, length 120
03:28:43.993579 IP 192.168.43.124.8880 > 192.168.43.147.7772: UDP, length 120
03:28:44.024874 IP 192.168.43.124.8880 > 192.168.43.147.7772: UDP, length 120
03:28:44.075046 IP 192.168.43.124.8880 > 192.168.43.147.7772: UDP, length 120
03:28:44.124744 IP 192.168.43.124.8880 > 192.168.43.147.7772: UDP, length 120
03:28:44.185508 IP 192.168.43.124.8880 > 192.168.43.147.7772: UDP, length 120
03:28:44.222642 IP 192.168.43.124.8880 > 192.168.43.147.7772: UDP, length 120
03:28:44.275803 IP 192.168.43.124.8880 > 192.168.43.147.7772: UDP, length 120
03:28:44.324793 IP 192.168.43.124.8880 > 192.168.43.147.7772: UDP, length 120
03:28:44.384794 IP 192.168.43.124.8880 > 192.168.43.147.7772: UDP, length 120
03:28:44.424978 IP 192.168.43.124.8880 > 192.168.43.147.7772: UDP, length 120
03:28:44.474898 IP 192.168.43.124.8880 > 192.168.43.147.7772: UDP, length 120
03:28:44.524736 IP 192.168.43.124.8880 > 192.168.43.147.7772: UDP, length 120
03:28:44.582723 IP 192.168.43.124.8880 > 192.168.43.147.7772: UDP, length 120
03:28:44.625092 IP 192.168.43.124.8880 > 192.168.43.147.7772: UDP, length 120
03:28:44.674791 IP 192.168.43.124.8880 > 192.168.43.147.7772: UDP, length 120
03:28:44.725051 IP 192.168.43.124.8880 > 192.168.43.147.7772: UDP, length 120
03:28:44.784822 IP 192.168.43.124.8880 > 192.168.43.147.7772: UDP, length 120
03:28:44.829069 IP 192.168.43.124.8880 > 192.168.43.147.7772: UDP, length 120
03:28:44.874753 IP 192.168.43.124.8880 > 192.168.43.147.7772: UDP, length 120
03:28:45.045070 IP 192.168.43.124.8880 > 192.168.43.147.7772: UDP, length 120
03:28:45.045263 IP 192.168.43.124.8880 > 192.168.43.147.7772: UDP, length 120
03:28:45.045388 IP 192.168.43.124.8880 > 192.168.43.147.7772: UDP, length 120
03:28:45.076008 IP 192.168.43.124.8880 > 192.168.43.147.7772: UDP, length 120
03:28:45.124294 IP 192.168.43.124.8880 > 192.168.43.147.7772: UDP, length 120
03:28:45.174887 IP 192.168.43.124.8880 > 192.168.43.147.7772: UDP, length 120
03:28:45.398647 IP 192.168.43.124.8880 > 192.168.43.147.7772: UDP, length 120
03:28:45.398787 IP 192.168.43.124.8880 > 192.168.43.147.7772: UDP, length 120
03:28:45.398859 IP 192.168.43.124.8880 > 192.168.43.147.7772: UDP, length 120
03:28:45.398928 IP 192.168.43.124.8880 > 192.168.43.147.7772: UDP, length 120
03:28:45.428696 IP 192.168.43.124.8880 > 192.168.43.147.7772: UDP, length 120
03:28:45.475761 IP 192.168.43.124.8880 > 192.168.43.147.7772: UDP, length 120
03:28:45.526168 IP 192.168.43.124.8880 > 192.168.43.147.7772: UDP, length 120
03:28:45.730329 IP 192.168.43.124.8880 > 192.168.43.147.7772: UDP, length 120
03:28:45.730505 IP 192.168.43.124.8880 > 192.168.43.147.7772: UDP, length 120
03:28:45.730622 IP 192.168.43.124.8880 > 192.168.43.147.7772: UDP, length 120
03:28:45.730745 IP 192.168.43.124.8880 > 192.168.43.147.7772: UDP, length 120
03:28:45.774863 IP 192.168.43.124.8880 > 192.168.43.147.7772: UDP, length 120
03:28:45.825068 IP 192.168.43.124.8880 > 192.168.43.147.7772: UDP, length 120
03:28:45.895553 IP 192.168.43.124.8880 > 192.168.43.147.7772: UDP, length 120
03:28:46.081395 IP 192.168.43.124.8880 > 192.168.43.147.7772: UDP, length 120
03:28:46.081564 IP 192.168.43.124.8880 > 192.168.43.147.7772: UDP, length 120
03:28:46.081688 IP 192.168.43.124.8880 > 192.168.43.147.7772: UDP, length 120
03:28:46.081803 IP 192.168.43.124.8880 > 192.168.43.147.7772: UDP, length 120
03:28:46.125158 IP 192.168.43.124.8880 > 192.168.43.147.7772: UDP, length 120
03:28:46.174988 IP 192.168.43.124.8880 > 192.168.43.147.7772: UDP, length 120
03:28:46.247698 IP 192.168.43.124.8880 > 192.168.43.147.7772: UDP, length 120
03:28:46.432257 IP 192.168.43.124.8880 > 192.168.43.147.7772: UDP, length 120
03:28:46.432402 IP 192.168.43.124.8880 > 192.168.43.147.7772: UDP, length 120
03:28:46.432473 IP 192.168.43.124.8880 > 192.168.43.147.7772: UDP, length 120
03:28:46.432544 IP 192.168.43.124.8880 > 192.168.43.147.7772: UDP, length 120
03:28:46.475315 IP 192.168.43.124.8880 > 192.168.43.147.7772: UDP, length 120
03:28:46.524524 IP 192.168.43.124.8880 > 192.168.43.147.7772: UDP, length 120
03:28:46.575256 IP 192.168.43.124.8880 > 192.168.43.147.7772: UDP, length 120
03:28:46.778924 IP 192.168.43.124.8880 > 192.168.43.147.7772: UDP, length 120
03:28:46.779067 IP 192.168.43.124.8880 > 192.168.43.147.7772: UDP, length 120
03:28:46.779137 IP 192.168.43.124.8880 > 192.168.43.147.7772: UDP, length 120
03:28:46.779210 IP 192.168.43.124.8880 > 192.168.43.147.7772: UDP, length 120
03:28:46.825353 IP 192.168.43.124.8880 > 192.168.43.147.7772: UDP, length 120
03:28:46.877909 IP 192.168.43.124.8880 > 192.168.43.147.7772: UDP, length 120
03:28:46.925295 IP 192.168.43.124.8880 > 192.168.43.147.7772: UDP, length 120
03:28:47.133214 IP 192.168.43.124.8880 > 192.168.43.147.7772: UDP, length 120
03:28:47.133353 IP 192.168.43.124.8880 > 192.168.43.147.7772: UDP, length 120
03:28:47.133441 IP 192.168.43.124.8880 > 192.168.43.147.7772: UDP, length 120
03:28:47.145278 IP 192.168.43.124.8880 > 192.168.43.147.7772: UDP, length 120
03:28:47.177301 IP 192.168.43.124.8880 > 192.168.43.147.7772: UDP, length 120
03:28:47.223432 IP 192.168.43.124.8880 > 192.168.43.147.7772: UDP, length 120
03:28:47.275400 IP 192.168.43.124.8880 > 192.168.43.147.7772: UDP, length 120
03:28:47.463931 IP 192.168.43.124.8880 > 192.168.43.147.7772: UDP, length 120
03:28:47.464071 IP 192.168.43.124.8880 > 192.168.43.147.7772: UDP, length 120
03:28:47.464203 IP 192.168.43.124.8880 > 192.168.43.147.7772: UDP, length 120
03:28:47.474372 IP 192.168.43.124.8880 > 192.168.43.147.7772: UDP, length 120
03:28:47.536791 IP 192.168.43.124.8880 > 192.168.43.147.7772: UDP, length 120
03:28:47.575465 IP 192.168.43.124.8880 > 192.168.43.147.7772: UDP, length 120
03:28:47.626012 IP 192.168.43.124.8880 > 192.168.43.147.7772: UDP, length 120
03:28:47.811813 IP 192.168.43.124.8880 > 192.168.43.147.7772: UDP, length 120
03:28:47.811955 IP 192.168.43.124.8880 > 192.168.43.147.7772: UDP, length 120
03:28:47.812027 IP 192.168.43.124.8880 > 192.168.43.147.7772: UDP, length 120
03:28:47.822403 IP 192.168.43.124.8880 > 192.168.43.147.7772: UDP, length 120
03:28:47.875278 IP 192.168.43.124.8880 > 192.168.43.147.7772: UDP, length 120
03:28:47.939882 IP 192.168.43.124.8880 > 192.168.43.147.7772: UDP, length 120
03:28:47.975611 IP 192.168.43.124.8880 > 192.168.43.147.7772: UDP, length 120
03:28:48.162728 IP 192.168.43.124.8880 > 192.168.43.147.7772: UDP, length 120
03:28:48.162922 IP 192.168.43.124.8880 > 192.168.43.147.7772: UDP, length 120
03:28:48.163044 IP 192.168.43.124.8880 > 192.168.43.147.7772: UDP, length 120
03:28:48.172330 IP 192.168.43.124.8880 > 192.168.43.147.7772: UDP, length 120
03:28:48.222472 IP 192.168.43.124.8880 > 192.168.43.147.7772: UDP, length 120
03:28:48.276229 IP 192.168.43.124.8880 > 192.168.43.147.7772: UDP, length 120
03:28:48.335029 IP 192.168.43.124.8880 > 192.168.43.147.7772: UDP, length 120
03:28:48.523376 IP 192.168.43.124.8880 > 192.168.43.147.7772: UDP, length 120
03:28:48.523563 IP 192.168.43.124.8880 > 192.168.43.147.7772: UDP, length 120
03:28:48.523684 IP 192.168.43.124.8880 > 192.168.43.147.7772: UDP, length 120
03:28:48.523805 IP 192.168.43.124.8880 > 192.168.43.147.7772: UDP, length 120
03:28:48.576809 IP 192.168.43.124.8880 > 192.168.43.147.7772: UDP, length 120
03:28:48.627480 IP 192.168.43.124.8880 > 192.168.43.147.7772: UDP, length 120
03:28:48.685438 IP 192.168.43.124.8880 > 192.168.43.147.7772: UDP, length 120
03:28:48.865682 IP 192.168.43.124.8880 > 192.168.43.147.7772: UDP, length 120
03:28:48.865850 IP 192.168.43.124.8880 > 192.168.43.147.7772: UDP, length 120
03:28:48.865978 IP 192.168.43.124.8880 > 192.168.43.147.7772: UDP, length 120
03:28:48.872393 IP 192.168.43.124.8880 > 192.168.43.147.7772: UDP, length 120
03:28:48.926079 IP 192.168.43.124.8880 > 192.168.43.147.7772: UDP, length 120
03:28:48.977372 IP 192.168.43.124.8880 > 192.168.43.147.7772: UDP, length 120
03:28:49.038224 IP 192.168.43.124.8880 > 192.168.43.147.7772: UDP, length 120
03:28:49.214651 IP 192.168.43.124.8880 > 192.168.43.147.7772: UDP, length 120
03:28:49.214844 IP 192.168.43.124.8880 > 192.168.43.147.7772: UDP, length 120
03:28:49.214961 IP 192.168.43.124.8880 > 192.168.43.147.7772: UDP, length 120
03:28:49.227684 IP 192.168.43.124.8880 > 192.168.43.147.7772: UDP, length 120
03:28:49.275574 IP 192.168.43.124.8880 > 192.168.43.147.7772: UDP, length 120
03:28:49.333577 IP 192.168.43.124.8880 > 192.168.43.147.7772: UDP, length 120
03:28:49.386836 IP 192.168.43.124.8880 > 192.168.43.147.7772: UDP, length 120
03:28:49.426088 IP 192.168.43.124.8880 > 192.168.43.147.7772: UDP, length 120
03:28:49.475781 IP 192.168.43.124.8880 > 192.168.43.147.7772: UDP, length 120
03:28:49.531944 IP 192.168.43.124.8880 > 192.168.43.147.7772: UDP, length 120
03:28:49.575805 IP 192.168.43.124.8880 > 192.168.43.147.7772: UDP, length 120
03:28:49.626303 IP 192.168.43.124.8880 > 192.168.43.147.7772: UDP, length 120
03:28:49.681276 IP 192.168.43.124.8880 > 192.168.43.147.7772: UDP, length 120
03:28:49.736763 IP 192.168.43.124.8880 > 192.168.43.147.7772: UDP, length 120
03:28:49.775760 IP 192.168.43.124.8880 > 192.168.43.147.7772: UDP, length 120
03:28:49.825830 IP 192.168.43.124.8880 > 192.168.43.147.7772: UDP, length 120
03:28:49.876525 IP 192.168.43.124.8880 > 192.168.43.147.7772: UDP, length 120
03:28:49.936882 IP 192.168.43.124.8880 > 192.168.43.147.7772: UDP, length 120
03:28:49.975949 IP 192.168.43.124.8880 > 192.168.43.147.7772: UDP, length 120
03:28:50.025667 IP 192.168.43.124.8880 > 192.168.43.147.7772: UDP, length 120
03:28:50.075673 IP 192.168.43.124.8880 > 192.168.43.147.7772: UDP, length 120
03:28:50.135734 IP 192.168.43.124.8880 > 192.168.43.147.7772: UDP, length 120
03:28:50.175801 IP 192.168.43.124.8880 > 192.168.43.147.7772: UDP, length 120
03:28:50.225071 IP 192.168.43.124.8880 > 192.168.43.147.7772: UDP, length 120
03:28:50.275758 IP 192.168.43.124.8880 > 192.168.43.147.7772: UDP, length 120
03:28:50.335359 IP 192.168.43.124.8880 > 192.168.43.147.7772: UDP, length 120
03:28:50.376044 IP 192.168.43.124.8880 > 192.168.43.147.7772: UDP, length 120
03:28:50.425917 IP 192.168.43.124.8880 > 192.168.43.147.7772: UDP, length 120
03:28:50.475755 IP 192.168.43.124.8880 > 192.168.43.147.7772: UDP, length 120
03:28:50.534597 IP 192.168.43.124.8880 > 192.168.43.147.7772: UDP, length 120
03:28:50.575968 IP 192.168.43.124.8880 > 192.168.43.147.7772: UDP, length 120
03:28:50.625948 IP 192.168.43.124.8880 > 192.168.43.147.7772: UDP, length 120
03:28:50.675794 IP 192.168.43.124.8880 > 192.168.43.147.7772: UDP, length 120
03:28:50.737116 IP 192.168.43.124.8880 > 192.168.43.147.7772: UDP, length 120
03:28:50.776031 IP 192.168.43.124.8880 > 192.168.43.147.7772: UDP, length 120
03:28:50.825817 IP 192.168.43.124.8880 > 192.168.43.147.7772: UDP, length 120
03:28:50.876087 IP 192.168.43.124.8880 > 192.168.43.147.7772: UDP, length 120
03:28:50.935865 IP 192.168.43.124.8880 > 192.168.43.147.7772: UDP, length 120
03:28:50.976100 IP 192.168.43.124.8880 > 192.168.43.147.7772: UDP, length 120
03:28:51.027809 IP 192.168.43.124.8880 > 192.168.43.147.7772: UDP, length 120
03:28:51.076396 IP 192.168.43.124.8880 > 192.168.43.147.7772: UDP, length 120
03:28:51.135792 IP 192.168.43.124.8880 > 192.168.43.147.7772: UDP, length 120
03:28:51.176635 IP 192.168.43.124.8880 > 192.168.43.147.7772: UDP, length 120
03:28:51.223187 IP 192.168.43.124.8880 > 192.168.43.147.7772: UDP, length 120
03:28:51.284547 IP 192.168.43.124.8880 > 192.168.43.147.7772: UDP, length 120
03:28:51.335563 IP 192.168.43.124.8880 > 192.168.43.147.7772: UDP, length 120
03:28:51.381216 IP 192.168.43.124.8880 > 192.168.43.147.7772: UDP, length 120
03:28:51.425775 IP 192.168.43.124.8880 > 192.168.43.147.7772: UDP, length 120
03:28:51.494492 IP 192.168.43.124.8880 > 192.168.43.147.7772: UDP, length 120
03:28:51.530395 IP 192.168.43.124.8880 > 192.168.43.147.7772: UDP, length 120
03:28:51.576053 IP 192.168.43.124.8880 > 192.168.43.147.7772: UDP, length 120
03:28:51.625991 IP 192.168.43.124.8880 > 192.168.43.147.7772: UDP, length 120
03:28:51.685634 IP 192.168.43.124.8880 > 192.168.43.147.7772: UDP, length 120
03:28:51.726006 IP 192.168.43.124.8880 > 192.168.43.147.7772: UDP, length 120
03:28:51.776183 IP 192.168.43.124.8880 > 192.168.43.147.7772: UDP, length 120
03:28:51.835670 IP 192.168.43.124.8880 > 192.168.43.147.7772: UDP, length 120
03:28:51.876094 IP 192.168.43.124.8880 > 192.168.43.147.7772: UDP, length 120
03:28:51.926020 IP 192.168.43.124.8880 > 192.168.43.147.7772: UDP, length 120
03:28:51.993837 IP 192.168.43.124.8880 > 192.168.43.147.7772: UDP, length 120
03:28:52.027172 IP 192.168.43.124.8880 > 192.168.43.147.7772: UDP, length 120
03:28:52.076370 IP 192.168.43.124.8880 > 192.168.43.147.7772: UDP, length 120
03:28:52.126730 IP 192.168.43.124.8880 > 192.168.43.147.7772: UDP, length 120
03:28:52.186078 IP 192.168.43.124.8880 > 192.168.43.147.7772: UDP, length 120
03:28:52.224476 IP 192.168.43.124.8880 > 192.168.43.147.7772: UDP, length 120
03:28:52.275312 IP 192.168.43.124.8880 > 192.168.43.147.7772: UDP, length 120
03:28:52.326212 IP 192.168.43.124.8880 > 192.168.43.147.7772: UDP, length 120
03:28:52.387417 IP 192.168.43.124.8880 > 192.168.43.147.7772: UDP, length 120
03:28:52.427306 IP 192.168.43.124.8880 > 192.168.43.147.7772: UDP, length 120
03:28:52.476416 IP 192.168.43.124.8880 > 192.168.43.147.7772: UDP, length 120
03:28:52.527061 IP 192.168.43.124.8880 > 192.168.43.147.7772: UDP, length 120
03:28:52.586700 IP 192.168.43.124.8880 > 192.168.43.147.7772: UDP, length 120
03:28:52.623272 IP 192.168.43.124.8880 > 192.168.43.147.7772: UDP, length 120
03:28:52.676757 IP 192.168.43.124.8880 > 192.168.43.147.7772: UDP, length 120
03:28:52.726274 IP 192.168.43.124.8880 > 192.168.43.147.7772: UDP, length 120
03:28:52.787411 IP 192.168.43.124.8880 > 192.168.43.147.7772: UDP, length 120
03:28:52.826520 IP 192.168.43.124.8880 > 192.168.43.147.7772: UDP, length 120
03:28:52.874527 IP 192.168.43.124.8880 > 192.168.43.147.7772: UDP, length 120
03:28:52.937308 IP 192.168.43.124.8880 > 192.168.43.147.7772: UDP, length 120
03:28:52.976300 IP 192.168.43.124.8880 > 192.168.43.147.7772: UDP, length 120
03:28:53.026880 IP 192.168.43.124.8880 > 192.168.43.147.7772: UDP, length 120
03:28:53.083193 IP 192.168.43.124.8880 > 192.168.43.147.7772: UDP, length 120
03:28:53.128644 IP 192.168.43.124.8880 > 192.168.43.147.7772: UDP, length 120
03:28:53.176155 IP 192.168.43.124.8880 > 192.168.43.147.7772: UDP, length 120
03:28:53.242532 IP 192.168.43.124.8880 > 192.168.43.147.7772: UDP, length 120
03:28:53.276507 IP 192.168.43.124.8880 > 192.168.43.147.7772: UDP, length 120
03:28:53.326609 IP 192.168.43.124.8880 > 192.168.43.147.7772: UDP, length 120
03:28:53.376556 IP 192.168.43.124.8880 > 192.168.43.147.7772: UDP, length 120
03:28:53.476519 IP 192.168.43.124.8880 > 192.168.43.147.7772: UDP, length 120
03:28:53.533922 IP 192.168.43.124.8880 > 192.168.43.147.7772: UDP, length 120
03:28:53.576282 IP 192.168.43.124.8880 > 192.168.43.147.7772: UDP, length 120
03:28:53.639718 IP 192.168.43.124.8880 > 192.168.43.147.7772: UDP, length 120
03:28:53.677106 IP 192.168.43.124.8880 > 192.168.43.147.7772: UDP, length 120
03:28:53.726514 IP 192.168.43.124.8880 > 192.168.43.147.7772: UDP, length 120
03:28:53.776188 IP 192.168.43.124.8880 > 192.168.43.147.7772: UDP, length 120
03:28:53.835517 IP 192.168.43.124.8880 > 192.168.43.147.7772: UDP, length 120
03:28:53.876576 IP 192.168.43.124.8880 > 192.168.43.147.7772: UDP, length 120
03:28:53.926649 IP 192.168.43.124.8880 > 192.168.43.147.7772: UDP, length 120
03:28:54.000035 IP 192.168.43.124.8880 > 192.168.43.147.7772: UDP, length 120
03:28:54.026325 IP 192.168.43.124.8880 > 192.168.43.147.7772: UDP, length 120
03:28:54.076464 IP 192.168.43.124.8880 > 192.168.43.147.7772: UDP, length 120
03:28:54.126467 IP 192.168.43.124.8880 > 192.168.43.147.7772: UDP, length 120
03:28:54.185108 IP 192.168.43.124.8880 > 192.168.43.147.7772: UDP, length 120
03:28:54.223445 IP 192.168.43.124.8880 > 192.168.43.147.7772: UDP, length 120
03:28:54.276277 IP 192.168.43.124.8880 > 192.168.43.147.7772: UDP, length 120
03:28:54.346981 IP 192.168.43.124.8880 > 192.168.43.147.7772: UDP, length 120
03:28:54.376399 IP 192.168.43.124.8880 > 192.168.43.147.7772: UDP, length 120
03:28:54.426780 IP 192.168.43.124.8880 > 192.168.43.147.7772: UDP, length 120
03:28:54.476775 IP 192.168.43.124.8880 > 192.168.43.147.7772: UDP, length 120
03:28:54.530979 IP 192.168.43.124.8880 > 192.168.43.147.7772: UDP, length 120
03:28:54.576580 IP 192.168.43.124.8880 > 192.168.43.147.7772: UDP, length 120
03:28:54.626473 IP 192.168.43.124.8880 > 192.168.43.147.7772: UDP, length 120
03:28:54.686392 IP 192.168.43.124.8880 > 192.168.43.147.7772: UDP, length 120
03:28:54.727186 IP 192.168.43.124.8880 > 192.168.43.147.7772: UDP, length 120
03:28:54.776661 IP 192.168.43.124.8880 > 192.168.43.147.7772: UDP, length 120
03:28:54.826494 IP 192.168.43.124.8880 > 192.168.43.147.7772: UDP, length 120
03:28:54.886556 IP 192.168.43.124.8880 > 192.168.43.147.7772: UDP, length 120
03:28:54.926810 IP 192.168.43.124.8880 > 192.168.43.147.7772: UDP, length 120
03:28:54.976716 IP 192.168.43.124.8880 > 192.168.43.147.7772: UDP, length 120
03:28:55.027878 IP 192.168.43.124.8880 > 192.168.43.147.7772: UDP, length 120
03:28:55.085807 IP 192.168.43.124.8880 > 192.168.43.147.7772: UDP, length 120
03:28:55.126675 IP 192.168.43.124.8880 > 192.168.43.147.7772: UDP, length 120
03:28:55.177291 IP 192.168.43.124.8880 > 192.168.43.147.7772: UDP, length 120
03:28:55.224297 IP 192.168.43.124.8880 > 192.168.43.147.7772: UDP, length 120
03:28:55.276576 IP 192.168.43.124.8880 > 192.168.43.147.7772: UDP, length 120
03:28:55.326579 IP 192.168.43.124.8880 > 192.168.43.147.7772: UDP, length 120
03:28:55.393877 IP 192.168.43.124.8880 > 192.168.43.147.7772: UDP, length 120
03:28:55.426582 IP 192.168.43.124.8880 > 192.168.43.147.7772: UDP, length 120
03:28:55.478465 IP 192.168.43.124.8880 > 192.168.43.147.7772: UDP, length 120
03:28:55.526628 IP 192.168.43.124.8880 > 192.168.43.147.7772: UDP, length 120
03:28:55.587029 IP 192.168.43.124.8880 > 192.168.43.147.7772: UDP, length 120
03:28:55.626761 IP 192.168.43.124.8880 > 192.168.43.147.7772: UDP, length 120
03:28:55.682615 IP 192.168.43.124.8880 > 192.168.43.147.7772: UDP, length 120
03:28:55.726584 IP 192.168.43.124.8880 > 192.168.43.147.7772: UDP, length 120
03:28:55.793433 IP 192.168.43.124.8880 > 192.168.43.147.7772: UDP, length 120
03:28:55.828280 IP 192.168.43.124.8880 > 192.168.43.147.7772: UDP, length 120
03:28:55.876777 IP 192.168.43.124.8880 > 192.168.43.147.7772: UDP, length 120
03:28:55.928985 IP 192.168.43.124.8880 > 192.168.43.147.7772: UDP, length 120
03:28:55.976794 IP 192.168.43.124.8880 > 192.168.43.147.7772: UDP, length 120
03:28:56.036821 IP 192.168.43.124.8880 > 192.168.43.147.7772: UDP, length 120
03:28:56.081005 IP 192.168.43.124.8880 > 192.168.43.147.7772: UDP, length 120
03:28:56.129000 IP 192.168.43.124.8880 > 192.168.43.147.7772: UDP, length 120
03:28:56.183721 IP 192.168.43.124.8880 > 192.168.43.147.7772: UDP, length 120
03:28:56.223812 IP 192.168.43.124.8880 > 192.168.43.147.7772: UDP, length 120
03:28:56.276566 IP 192.168.43.124.8880 > 192.168.43.147.7772: UDP, length 120
03:28:56.342560 IP 192.168.43.124.8880 > 192.168.43.147.7772: UDP, length 120
03:28:56.377013 IP 192.168.43.124.8880 > 192.168.43.147.7772: UDP, length 120
03:28:56.426951 IP 192.168.43.124.8880 > 192.168.43.147.7772: UDP, length 120
03:28:56.476756 IP 192.168.43.124.8880 > 192.168.43.147.7772: UDP, length 120
03:28:56.536785 IP 192.168.43.124.8880 > 192.168.43.147.7772: UDP, length 120
03:28:56.577048 IP 192.168.43.124.8880 > 192.168.43.147.7772: UDP, length 120
03:28:56.627014 IP 192.168.43.124.8880 > 192.168.43.147.7772: UDP, length 120
03:28:56.679332 IP 192.168.43.124.8880 > 192.168.43.147.7772: UDP, length 120
03:28:56.736984 IP 192.168.43.124.8880 > 192.168.43.147.7772: UDP, length 120
03:28:56.776983 IP 192.168.43.124.8880 > 192.168.43.147.7772: UDP, length 120
03:28:56.827010 IP 192.168.43.124.8880 > 192.168.43.147.7772: UDP, length 120
03:28:56.876833 IP 192.168.43.124.8880 > 192.168.43.147.7772: UDP, length 120
03:28:56.936994 IP 192.168.43.124.8880 > 192.168.43.147.7772: UDP, length 120
03:28:56.976959 IP 192.168.43.124.8880 > 192.168.43.147.7772: UDP, length 120
03:28:57.026890 IP 192.168.43.124.8880 > 192.168.43.147.7772: UDP, length 120
03:28:57.077050 IP 192.168.43.124.8880 > 192.168.43.147.7772: UDP, length 120
03:28:57.136976 IP 192.168.43.124.8880 > 192.168.43.147.7772: UDP, length 120
03:28:57.178728 IP 192.168.43.124.8880 > 192.168.43.147.7772: UDP, length 120
03:28:57.224061 IP 192.168.43.124.8880 > 192.168.43.147.7772: UDP, length 120
03:28:57.277087 IP 192.168.43.124.8880 > 192.168.43.147.7772: UDP, length 120
03:28:57.337096 IP 192.168.43.124.8880 > 192.168.43.147.7772: UDP, length 120
03:28:57.378363 IP 192.168.43.124.8880 > 192.168.43.147.7772: UDP, length 120
03:28:57.427078 IP 192.168.43.124.8880 > 192.168.43.147.7772: UDP, length 120
03:28:57.477049 IP 192.168.43.124.8880 > 192.168.43.147.7772: UDP, length 120
03:28:57.537403 IP 192.168.43.124.8880 > 192.168.43.147.7772: UDP, length 120
03:28:57.577352 IP 192.168.43.124.8880 > 192.168.43.147.7772: UDP, length 120
03:28:57.630015 IP 192.168.43.124.8880 > 192.168.43.147.7772: UDP, length 120
03:28:57.677126 IP 192.168.43.124.8880 > 192.168.43.147.7772: UDP, length 120
03:28:57.739930 IP 192.168.43.124.8880 > 192.168.43.147.7772: UDP, length 120
03:28:57.777096 IP 192.168.43.124.8880 > 192.168.43.147.7772: UDP, length 120
03:28:57.832496 IP 192.168.43.124.8880 > 192.168.43.147.7772: UDP, length 120
03:28:57.877185 IP 192.168.43.124.8880 > 192.168.43.147.7772: UDP, length 120
03:28:57.945168 IP 192.168.43.124.8880 > 192.168.43.147.7772: UDP, length 120
03:28:57.978990 IP 192.168.43.124.8880 > 192.168.43.147.7772: UDP, length 120
03:28:58.027196 IP 192.168.43.124.8880 > 192.168.43.147.7772: UDP, length 120
03:28:58.074365 IP 192.168.43.124.8880 > 192.168.43.147.7772: UDP, length 120
03:28:58.138738 IP 192.168.43.124.8880 > 192.168.43.147.7772: UDP, length 120
03:28:58.177392 IP 192.168.43.124.8880 > 192.168.43.147.7772: UDP, length 120
03:28:58.224801 IP 192.168.43.124.8880 > 192.168.43.147.7772: UDP, length 120
03:28:58.279666 IP 192.168.43.124.8880 > 192.168.43.147.7772: UDP, length 120
03:28:58.325168 IP 192.168.43.124.8880 > 192.168.43.147.7772: UDP, length 120
03:28:58.374105 IP 192.168.43.124.8880 > 192.168.43.147.7772: UDP, length 120
03:28:58.427307 IP 192.168.43.124.8880 > 192.168.43.147.7772: UDP, length 120
03:28:58.493033 IP 192.168.43.124.8880 > 192.168.43.147.7772: UDP, length 120
03:28:58.527400 IP 192.168.43.124.8880 > 192.168.43.147.7772: UDP, length 120
03:28:58.577309 IP 192.168.43.124.8880 > 192.168.43.147.7772: UDP, length 120
03:28:58.627047 IP 192.168.43.124.8880 > 192.168.43.147.7772: UDP, length 120
03:28:58.687106 IP 192.168.43.124.8880 > 192.168.43.147.7772: UDP, length 120
03:28:58.727087 IP 192.168.43.124.8880 > 192.168.43.147.7772: UDP, length 120
03:28:58.777352 IP 192.168.43.124.8880 > 192.168.43.147.7772: UDP, length 120
03:28:58.829568 IP 192.168.43.124.8880 > 192.168.43.147.7772: UDP, length 120
03:28:58.887313 IP 192.168.43.124.8880 > 192.168.43.147.7772: UDP, length 120
03:28:58.927350 IP 192.168.43.124.8880 > 192.168.43.147.7772: UDP, length 120
03:28:58.977178 IP 192.168.43.124.8880 > 192.168.43.147.7772: UDP, length 120
03:28:59.027264 IP 192.168.43.124.8880 > 192.168.43.147.7772: UDP, length 120
03:28:59.087189 IP 192.168.43.124.8880 > 192.168.43.147.7772: UDP, length 120
03:28:59.127419 IP 192.168.43.124.8880 > 192.168.43.147.7772: UDP, length 120
03:28:59.177395 IP 192.168.43.124.8880 > 192.168.43.147.7772: UDP, length 120
03:28:59.224895 IP 192.168.43.124.8880 > 192.168.43.147.7772: UDP, length 120
03:28:59.277392 IP 192.168.43.124.8880 > 192.168.43.147.7772: UDP, length 120
03:28:59.328592 IP 192.168.43.124.8880 > 192.168.43.147.7772: UDP, length 120
03:28:59.395594 IP 192.168.43.124.8880 > 192.168.43.147.7772: UDP, length 120
03:28:59.427306 IP 192.168.43.124.8880 > 192.168.43.147.7772: UDP, length 120
03:28:59.477846 IP 192.168.43.124.8880 > 192.168.43.147.7772: UDP, length 120
03:28:59.527341 IP 192.168.43.124.8880 > 192.168.43.147.7772: UDP, length 120
03:28:59.584235 IP 192.168.43.124.8880 > 192.168.43.147.7772: UDP, length 120
03:28:59.627419 IP 192.168.43.124.8880 > 192.168.43.147.7772: UDP, length 120
03:28:59.677765 IP 192.168.43.124.8880 > 192.168.43.147.7772: UDP, length 120
03:28:59.727296 IP 192.168.43.124.8880 > 192.168.43.147.7772: UDP, length 120
03:28:59.788437 IP 192.168.43.124.8880 > 192.168.43.147.7772: UDP, length 120
03:28:59.827319 IP 192.168.43.124.8880 > 192.168.43.147.7772: UDP, length 120
03:28:59.882739 IP 192.168.43.124.8880 > 192.168.43.147.7772: UDP, length 120
03:28:59.955070 IP 192.168.43.124.8880 > 192.168.43.147.7772: UDP, length 120
03:28:59.984701 IP 192.168.43.124.8880 > 192.168.43.147.7772: UDP, length 120
03:29:00.027741 IP 192.168.43.124.8880 > 192.168.43.147.7772: UDP, length 120
03:29:00.085890 IP 192.168.43.124.8880 > 192.168.43.147.7772: UDP, length 120
03:29:00.137313 IP 192.168.43.124.8880 > 192.168.43.147.7772: UDP, length 120
03:29:00.177802 IP 192.168.43.124.8880 > 192.168.43.147.7772: UDP, length 120
03:29:00.224208 IP 192.168.43.124.8880 > 192.168.43.147.7772: UDP, length 120
03:29:00.277419 IP 192.168.43.124.8880 > 192.168.43.147.7772: UDP, length 120
03:29:00.337048 IP 192.168.43.124.8880 > 192.168.43.147.7772: UDP, length 120
03:29:00.378703 IP 192.168.43.124.8880 > 192.168.43.147.7772: UDP, length 120
03:29:00.429684 IP 192.168.43.124.8880 > 192.168.43.147.7772: UDP, length 120
03:29:00.484223 IP 192.168.43.124.8880 > 192.168.43.147.7772: UDP, length 120
03:29:00.527414 IP 192.168.43.124.8880 > 192.168.43.147.7772: UDP, length 120
03:29:00.577910 IP 192.168.43.124.8880 > 192.168.43.147.7772: UDP, length 120
03:29:00.629669 IP 192.168.43.124.8880 > 192.168.43.147.7772: UDP, length 120
03:29:00.687499 IP 192.168.43.124.8880 > 192.168.43.147.7772: UDP, length 120
03:29:00.727310 IP 192.168.43.124.8880 > 192.168.43.147.7772: UDP, length 120
03:29:00.777757 IP 192.168.43.124.8880 > 192.168.43.147.7772: UDP, length 120
03:29:00.827575 IP 192.168.43.124.8880 > 192.168.43.147.7772: UDP, length 120
03:29:00.887334 IP 192.168.43.124.8880 > 192.168.43.147.7772: UDP, length 120
03:29:00.927609 IP 192.168.43.124.8880 > 192.168.43.147.7772: UDP, length 120
03:29:00.979176 IP 192.168.43.124.8880 > 192.168.43.147.7772: UDP, length 120
03:29:01.027564 IP 192.168.43.124.8880 > 192.168.43.147.7772: UDP, length 120
03:29:01.087312 IP 192.168.43.124.8880 > 192.168.43.147.7772: UDP, length 120
03:29:01.127708 IP 192.168.43.124.8880 > 192.168.43.147.7772: UDP, length 120
03:29:01.177311 IP 192.168.43.124.8880 > 192.168.43.147.7772: UDP, length 120
03:29:01.224552 IP 192.168.43.124.8880 > 192.168.43.147.7772: UDP, length 120
03:29:01.277459 IP 192.168.43.124.8880 > 192.168.43.147.7772: UDP, length 120
03:29:01.327480 IP 192.168.43.124.8880 > 192.168.43.147.7772: UDP, length 120
03:29:01.392643 IP 192.168.43.124.8880 > 192.168.43.147.7772: UDP, length 120
03:29:01.427862 IP 192.168.43.124.8880 > 192.168.43.147.7772: UDP, length 120
03:29:01.479295 IP 192.168.43.124.8880 > 192.168.43.147.7772: UDP, length 120
03:29:01.527610 IP 192.168.43.124.8880 > 192.168.43.147.7772: UDP, length 120
03:29:01.587673 IP 192.168.43.124.8880 > 192.168.43.147.7772: UDP, length 120
03:29:01.628191 IP 192.168.43.124.8880 > 192.168.43.147.7772: UDP, length 120
03:29:01.677575 IP 192.168.43.124.8880 > 192.168.43.147.7772: UDP, length 120
03:29:01.727673 IP 192.168.43.124.8880 > 192.168.43.147.7772: UDP, length 120
03:29:01.787696 IP 192.168.43.124.8880 > 192.168.43.147.7772: UDP, length 120
03:29:01.828642 IP 192.168.43.124.8880 > 192.168.43.147.7772: UDP, length 120
03:29:01.877627 IP 192.168.43.124.8880 > 192.168.43.147.7772: UDP, length 120
03:29:01.927402 IP 192.168.43.124.8880 > 192.168.43.147.7772: UDP, length 120
03:29:01.987775 IP 192.168.43.124.8880 > 192.168.43.147.7772: UDP, length 120
03:29:02.033884 IP 192.168.43.124.8880 > 192.168.43.147.7772: UDP, length 120
03:29:02.077689 IP 192.168.43.124.8880 > 192.168.43.147.7772: UDP, length 120
03:29:02.152370 IP 192.168.43.124.8880 > 192.168.43.147.7772: UDP, length 120
03:29:02.179000 IP 192.168.43.124.8880 > 192.168.43.147.7772: UDP, length 120
03:29:02.235468 IP 192.168.43.124.8880 > 192.168.43.147.7772: UDP, length 120
03:29:02.278131 IP 192.168.43.124.8880 > 192.168.43.147.7772: UDP, length 120
03:29:02.337736 IP 192.168.43.124.8880 > 192.168.43.147.7772: UDP, length 120
03:29:02.378092 IP 192.168.43.124.8880 > 192.168.43.147.7772: UDP, length 120
03:29:02.428163 IP 192.168.43.124.8880 > 192.168.43.147.7772: UDP, length 120
03:29:02.481252 IP 192.168.43.124.8880 > 192.168.43.147.7772: UDP, length 120
03:29:02.537978 IP 192.168.43.124.8880 > 192.168.43.147.7772: UDP, length 120
03:29:02.630969 IP 192.168.43.124.8880 > 192.168.43.147.7772: UDP, length 120
03:29:02.631273 IP 192.168.43.124.8880 > 192.168.43.147.7772: UDP, length 120
03:29:02.678373 IP 192.168.43.124.8880 > 192.168.43.147.7772: UDP, length 120
03:29:02.737919 IP 192.168.43.124.8880 > 192.168.43.147.7772: UDP, length 120
03:29:02.779503 IP 192.168.43.124.8880 > 192.168.43.147.7772: UDP, length 120
03:29:02.828203 IP 192.168.43.124.8880 > 192.168.43.147.7772: UDP, length 120
03:29:02.877941 IP 192.168.43.124.8880 > 192.168.43.147.7772: UDP, length 120
03:29:02.937980 IP 192.168.43.124.8880 > 192.168.43.147.7772: UDP, length 120
03:29:02.975150 IP 192.168.43.124.8880 > 192.168.43.147.7772: UDP, length 120
03:29:03.029674 IP 192.168.43.124.8880 > 192.168.43.147.7772: UDP, length 120
03:29:03.077374 IP 192.168.43.124.8880 > 192.168.43.147.7772: UDP, length 120
03:29:03.129636 IP 192.168.43.124.8880 > 192.168.43.147.7772: UDP, length 120
03:29:03.177953 IP 192.168.43.124.8880 > 192.168.43.147.7772: UDP, length 120
03:29:03.230045 IP 192.168.43.124.8880 > 192.168.43.147.7772: UDP, length 120
03:29:03.277988 IP 192.168.43.124.8880 > 192.168.43.147.7772: UDP, length 120
03:29:03.327394 IP 192.168.43.124.8880 > 192.168.43.147.7772: UDP, length 120
03:29:03.378131 IP 192.168.43.124.8880 > 192.168.43.147.7772: UDP, length 120
03:29:03.440622 IP 192.168.43.124.8880 > 192.168.43.147.7772: UDP, length 120
03:29:03.477563 IP 192.168.43.124.8880 > 192.168.43.147.7772: UDP, length 120
03:29:03.527435 IP 192.168.43.124.8880 > 192.168.43.147.7772: UDP, length 120
03:29:03.577524 IP 192.168.43.124.8880 > 192.168.43.147.7772: UDP, length 120
03:29:03.641556 IP 192.168.43.124.8880 > 192.168.43.147.7772: UDP, length 120
03:29:03.677409 IP 192.168.43.124.8880 > 192.168.43.147.7772: UDP, length 120
03:29:03.727402 IP 192.168.43.124.8880 > 192.168.43.147.7772: UDP, length 120
03:29:03.779046 IP 192.168.43.124.8880 > 192.168.43.147.7772: UDP, length 120
03:29:03.825670 IP 192.168.43.124.8880 > 192.168.43.147.7772: UDP, length 120
03:29:03.880197 IP 192.168.43.124.8880 > 192.168.43.147.7772: UDP, length 120
03:29:03.927317 IP 192.168.43.124.8880 > 192.168.43.147.7772: UDP, length 120
03:29:03.985881 IP 192.168.43.124.8880 > 192.168.43.147.7772: UDP, length 120
03:29:04.027310 IP 192.168.43.124.8880 > 192.168.43.147.7772: UDP, length 120
03:29:04.078969 IP 192.168.43.124.8880 > 192.168.43.147.7772: UDP, length 120
03:29:04.127891 IP 192.168.43.124.8880 > 192.168.43.147.7772: UDP, length 120
03:29:04.187949 IP 192.168.43.124.8880 > 192.168.43.147.7772: UDP, length 120
03:29:04.225166 IP 192.168.43.124.8880 > 192.168.43.147.7772: UDP, length 120
03:29:04.283370 IP 192.168.43.124.8880 > 192.168.43.147.7772: UDP, length 120
03:29:04.328762 IP 192.168.43.124.8880 > 192.168.43.147.7772: UDP, length 120
03:29:04.393085 IP 192.168.43.124.8880 > 192.168.43.147.7772: UDP, length 120
03:29:04.428199 IP 192.168.43.124.8880 > 192.168.43.147.7772: UDP, length 120
03:29:04.478252 IP 192.168.43.124.8880 > 192.168.43.147.7772: UDP, length 120
03:29:04.530331 IP 192.168.43.124.8880 > 192.168.43.147.7772: UDP, length 120
03:29:04.587673 IP 192.168.43.124.8880 > 192.168.43.147.7772: UDP, length 120
03:29:04.628203 IP 192.168.43.124.8880 > 192.168.43.147.7772: UDP, length 120
03:29:04.678916 IP 192.168.43.124.8880 > 192.168.43.147.7772: UDP, length 120
03:29:04.730892 IP 192.168.43.124.8880 > 192.168.43.147.7772: UDP, length 120
03:29:04.789600 IP 192.168.43.124.8880 > 192.168.43.147.7772: UDP, length 120
03:29:04.828639 IP 192.168.43.124.8880 > 192.168.43.147.7772: UDP, length 120
03:29:04.878334 IP 192.168.43.124.8880 > 192.168.43.147.7772: UDP, length 120
03:29:04.929435 IP 192.168.43.124.8880 > 192.168.43.147.7772: UDP, length 120
03:29:04.987702 IP 192.168.43.124.8880 > 192.168.43.147.7772: UDP, length 120
03:29:05.028265 IP 192.168.43.124.8880 > 192.168.43.147.7772: UDP, length 120
03:29:05.078458 IP 192.168.43.124.8880 > 192.168.43.147.7772: UDP, length 120
03:29:05.128135 IP 192.168.43.124.8880 > 192.168.43.147.7772: UDP, length 120
03:29:05.190003 IP 192.168.43.124.8880 > 192.168.43.147.7772: UDP, length 120
03:29:05.225787 IP 192.168.43.124.8880 > 192.168.43.147.7772: UDP, length 120
03:29:05.279867 IP 192.168.43.124.8880 > 192.168.43.147.7772: UDP, length 120
03:29:05.328465 IP 192.168.43.124.8880 > 192.168.43.147.7772: UDP, length 120
03:29:05.394352 IP 192.168.43.124.8880 > 192.168.43.147.7772: UDP, length 120
03:29:05.428204 IP 192.168.43.124.8880 > 192.168.43.147.7772: UDP, length 120
03:29:05.478492 IP 192.168.43.124.8880 > 192.168.43.147.7772: UDP, length 120
03:29:05.528239 IP 192.168.43.124.8880 > 192.168.43.147.7772: UDP, length 120
03:29:05.590399 IP 192.168.43.124.8880 > 192.168.43.147.7772: UDP, length 120
03:29:05.628405 IP 192.168.43.124.8880 > 192.168.43.147.7772: UDP, length 120
03:29:05.678499 IP 192.168.43.124.8880 > 192.168.43.147.7772: UDP, length 120
03:29:05.728317 IP 192.168.43.124.8880 > 192.168.43.147.7772: UDP, length 120
03:29:05.791880 IP 192.168.43.124.8880 > 192.168.43.147.7772: UDP, length 120
03:29:05.828562 IP 192.168.43.124.8880 > 192.168.43.147.7772: UDP, length 120
03:29:05.878482 IP 192.168.43.124.8880 > 192.168.43.147.7772: UDP, length 120
03:29:05.930996 IP 192.168.43.124.8880 > 192.168.43.147.7772: UDP, length 120
03:29:05.988711 IP 192.168.43.124.8880 > 192.168.43.147.7772: UDP, length 120
03:29:06.028320 IP 192.168.43.124.8880 > 192.168.43.147.7772: UDP, length 120
03:29:06.078229 IP 192.168.43.124.8880 > 192.168.43.147.7772: UDP, length 120
03:29:06.129026 IP 192.168.43.124.8880 > 192.168.43.147.7772: UDP, length 120
03:29:06.187874 IP 192.168.43.124.8880 > 192.168.43.147.7772: UDP, length 120
03:29:06.226437 IP 192.168.43.124.8880 > 192.168.43.147.7772: UDP, length 120
03:29:06.278249 IP 192.168.43.124.8880 > 192.168.43.147.7772: UDP, length 120
03:29:06.341451 IP 192.168.43.124.8880 > 192.168.43.147.7772: UDP, length 120
03:29:06.378500 IP 192.168.43.124.8880 > 192.168.43.147.7772: UDP, length 120
03:29:06.436276 IP 192.168.43.124.8880 > 192.168.43.147.7772: UDP, length 120
03:29:06.478388 IP 192.168.43.124.8880 > 192.168.43.147.7772: UDP, length 120
03:29:06.529596 IP 192.168.43.124.8880 > 192.168.43.147.7772: UDP, length 120
03:29:06.578402 IP 192.168.43.124.8880 > 192.168.43.147.7772: UDP, length 120
03:29:06.628428 IP 192.168.43.124.8880 > 192.168.43.147.7772: UDP, length 120
03:29:06.680061 IP 192.168.43.124.8880 > 192.168.43.147.7772: UDP, length 120
03:29:06.730309 IP 192.168.43.124.8880 > 192.168.43.147.7772: UDP, length 120
03:29:06.778623 IP 192.168.43.124.8880 > 192.168.43.147.7772: UDP, length 120
03:29:06.830422 IP 192.168.43.124.8880 > 192.168.43.147.7772: UDP, length 120
03:29:06.882860 IP 192.168.43.124.8880 > 192.168.43.147.7772: UDP, length 120
03:29:06.930557 IP 192.168.43.124.8880 > 192.168.43.147.7772: UDP, length 120
03:29:06.980216 IP 192.168.43.124.8880 > 192.168.43.147.7772: UDP, length 120
03:29:07.030532 IP 192.168.43.124.8880 > 192.168.43.147.7772: UDP, length 120
03:29:07.078747 IP 192.168.43.124.8880 > 192.168.43.147.7772: UDP, length 120
03:29:07.129240 IP 192.168.43.124.8880 > 192.168.43.147.7772: UDP, length 120
03:29:07.178679 IP 192.168.43.124.8880 > 192.168.43.147.7772: UDP, length 120
03:29:07.228666 IP 192.168.43.124.8880 > 192.168.43.147.7772: UDP, length 120
03:29:07.280653 IP 192.168.43.124.8880 > 192.168.43.147.7772: UDP, length 120
03:29:07.332216 IP 192.168.43.124.8880 > 192.168.43.147.7772: UDP, length 120
03:29:07.380545 IP 192.168.43.124.8880 > 192.168.43.147.7772: UDP, length 120
03:29:07.430576 IP 192.168.43.124.8880 > 192.168.43.147.7772: UDP, length 120
03:29:07.480549 IP 192.168.43.124.8880 > 192.168.43.147.7772: UDP, length 120
