01:20:42.469600 IP 192.168.43.124.8880 > 192.168.43.146.7771: UDP, length 120
01:20:42.520628 IP 192.168.43.124.8880 > 192.168.43.146.7771: UDP, length 120
01:20:42.569904 IP 192.168.43.124.8880 > 192.168.43.146.7771: UDP, length 120
01:20:42.617072 IP 192.168.43.124.8880 > 192.168.43.146.7771: UDP, length 120
01:20:42.667051 IP 192.168.43.124.8880 > 192.168.43.146.7771: UDP, length 120
01:20:42.717996 IP 192.168.43.124.8880 > 192.168.43.146.7771: UDP, length 120
01:20:42.767036 IP 192.168.43.124.8880 > 192.168.43.146.7771: UDP, length 120
01:20:42.817862 IP 192.168.43.124.8880 > 192.168.43.146.7771: UDP, length 120
01:20:42.866967 IP 192.168.43.124.8880 > 192.168.43.146.7771: UDP, length 120
01:20:42.916964 IP 192.168.43.124.8880 > 192.168.43.146.7771: UDP, length 120
01:20:42.966728 IP 192.168.43.124.8880 > 192.168.43.146.7771: UDP, length 120
01:20:43.014002 IP 192.168.43.124.8880 > 192.168.43.146.7771: UDP, length 120
01:20:43.067681 IP 192.168.43.124.8880 > 192.168.43.146.7771: UDP, length 120
01:20:43.086286 IP 192.168.43.146.8880 > 192.168.43.147.7772: UDP, length 120
01:20:43.117119 IP 192.168.43.124.8880 > 192.168.43.146.7771: UDP, length 120
01:20:43.136395 IP 192.168.43.146.8880 > 192.168.43.147.7772: UDP, length 120
01:20:43.167124 IP 192.168.43.124.8880 > 192.168.43.146.7771: UDP, length 120
01:20:43.186355 IP 192.168.43.146.8880 > 192.168.43.147.7772: UDP, length 120
01:20:43.218083 IP 192.168.43.124.8880 > 192.168.43.146.7771: UDP, length 120
01:20:43.236312 IP 192.168.43.146.8880 > 192.168.43.147.7772: UDP, length 120
01:20:43.267200 IP 192.168.43.124.8880 > 192.168.43.146.7771: UDP, length 120
01:20:43.286297 IP 192.168.43.146.8880 > 192.168.43.147.7772: UDP, length 120
01:20:43.319337 IP 192.168.43.124.8880 > 192.168.43.146.7771: UDP, length 120
01:20:43.336311 IP 192.168.43.146.8880 > 192.168.43.147.7772: UDP, length 120
01:20:43.367304 IP 192.168.43.124.8880 > 192.168.43.146.7771: UDP, length 120
01:20:43.386301 IP 192.168.43.146.8880 > 192.168.43.147.7772: UDP, length 120
01:20:43.417509 IP 192.168.43.124.8880 > 192.168.43.146.7771: UDP, length 120
01:20:43.436296 IP 192.168.43.146.8880 > 192.168.43.147.7772: UDP, length 120
01:20:43.466988 IP 192.168.43.124.8880 > 192.168.43.146.7771: UDP, length 120
01:20:43.486293 IP 192.168.43.146.8880 > 192.168.43.147.7772: UDP, length 120
01:20:43.525409 IP 192.168.43.124.8880 > 192.168.43.146.7771: UDP, length 120
01:20:43.536331 IP 192.168.43.146.8880 > 192.168.43.147.7772: UDP, length 120
01:20:43.568900 IP 192.168.43.124.8880 > 192.168.43.146.7771: UDP, length 120
01:20:43.586302 IP 192.168.43.146.8880 > 192.168.43.147.7772: UDP, length 120
01:20:43.629146 IP 192.168.43.124.8880 > 192.168.43.146.7771: UDP, length 120
01:20:43.636296 IP 192.168.43.146.8880 > 192.168.43.147.7772: UDP, length 120
01:20:43.665188 IP 192.168.43.124.8880 > 192.168.43.146.7771: UDP, length 120
01:20:43.686296 IP 192.168.43.146.8880 > 192.168.43.147.7772: UDP, length 120
01:20:43.715229 IP 192.168.43.124.8880 > 192.168.43.146.7771: UDP, length 120
01:20:43.736293 IP 192.168.43.146.8880 > 192.168.43.147.7772: UDP, length 120
01:20:43.766185 IP 192.168.43.124.8880 > 192.168.43.146.7771: UDP, length 120
01:20:43.786292 IP 192.168.43.146.8880 > 192.168.43.147.7772: UDP, length 120
01:20:43.815667 IP 192.168.43.124.8880 > 192.168.43.146.7771: UDP, length 120
01:20:43.836292 IP 192.168.43.146.8880 > 192.168.43.147.7772: UDP, length 120
01:20:43.868555 IP 192.168.43.124.8880 > 192.168.43.146.7771: UDP, length 120
01:20:43.886295 IP 192.168.43.146.8880 > 192.168.43.147.7772: UDP, length 120
01:20:43.915177 IP 192.168.43.124.8880 > 192.168.43.146.7771: UDP, length 120
01:20:43.936297 IP 192.168.43.146.8880 > 192.168.43.147.7772: UDP, length 120
01:20:43.965988 IP 192.168.43.124.8880 > 192.168.43.146.7771: UDP, length 120
01:20:43.986296 IP 192.168.43.146.8880 > 192.168.43.147.7772: UDP, length 120
01:20:44.016085 IP 192.168.43.124.8880 > 192.168.43.146.7771: UDP, length 120
01:20:44.036294 IP 192.168.43.146.8880 > 192.168.43.147.7772: UDP, length 120
01:20:44.070431 IP 192.168.43.124.8880 > 192.168.43.146.7771: UDP, length 120
01:20:44.086335 IP 192.168.43.146.8880 > 192.168.43.147.7772: UDP, length 120
01:20:44.129370 IP 192.168.43.124.8880 > 192.168.43.146.7771: UDP, length 120
01:20:44.136306 IP 192.168.43.146.8880 > 192.168.43.147.7772: UDP, length 120
01:20:44.183709 IP 192.168.43.124.8880 > 192.168.43.146.7771: UDP, length 120
01:20:44.186354 IP 192.168.43.146.8880 > 192.168.43.147.7772: UDP, length 120
01:20:44.215112 IP 192.168.43.124.8880 > 192.168.43.146.7771: UDP, length 120
01:20:44.236309 IP 192.168.43.146.8880 > 192.168.43.147.7772: UDP, length 120
01:20:44.265135 IP 192.168.43.124.8880 > 192.168.43.146.7771: UDP, length 120
01:20:44.286299 IP 192.168.43.146.8880 > 192.168.43.147.7772: UDP, length 120
01:20:44.316471 IP 192.168.43.124.8880 > 192.168.43.146.7771: UDP, length 120
01:20:44.336298 IP 192.168.43.146.8880 > 192.168.43.147.7772: UDP, length 120
01:20:44.364213 IP 192.168.43.124.8880 > 192.168.43.146.7771: UDP, length 120
01:20:44.386301 IP 192.168.43.146.8880 > 192.168.43.147.7772: UDP, length 120
01:20:44.424114 IP 192.168.43.124.8880 > 192.168.43.146.7771: UDP, length 120
01:20:44.436293 IP 192.168.43.146.8880 > 192.168.43.147.7772: UDP, length 120
01:20:44.477931 IP 192.168.43.124.8880 > 192.168.43.146.7771: UDP, length 120
01:20:44.486300 IP 192.168.43.146.8880 > 192.168.43.147.7772: UDP, length 120
01:20:44.532489 IP 192.168.43.124.8880 > 192.168.43.146.7771: UDP, length 120
01:20:44.536296 IP 192.168.43.146.8880 > 192.168.43.147.7772: UDP, length 120
01:20:44.565181 IP 192.168.43.124.8880 > 192.168.43.146.7771: UDP, length 120
01:20:44.586299 IP 192.168.43.146.8880 > 192.168.43.147.7772: UDP, length 120
01:20:44.618647 IP 192.168.43.124.8880 > 192.168.43.146.7771: UDP, length 120
01:20:44.636299 IP 192.168.43.146.8880 > 192.168.43.147.7772: UDP, length 120
01:20:44.665208 IP 192.168.43.124.8880 > 192.168.43.146.7771: UDP, length 120
01:20:44.686294 IP 192.168.43.146.8880 > 192.168.43.147.7772: UDP, length 120
01:20:44.723105 IP 192.168.43.124.8880 > 192.168.43.146.7771: UDP, length 120
01:20:44.736297 IP 192.168.43.146.8880 > 192.168.43.147.7772: UDP, length 120
01:20:44.777527 IP 192.168.43.124.8880 > 192.168.43.146.7771: UDP, length 120
01:20:44.786293 IP 192.168.43.146.8880 > 192.168.43.147.7772: UDP, length 120
01:20:44.836293 IP 192.168.43.146.8880 > 192.168.43.147.7772: UDP, length 120
01:20:44.837590 IP 192.168.43.124.8880 > 192.168.43.146.7771: UDP, length 120
01:20:44.865098 IP 192.168.43.124.8880 > 192.168.43.146.7771: UDP, length 120
01:20:44.886294 IP 192.168.43.146.8880 > 192.168.43.147.7772: UDP, length 120
01:20:44.915172 IP 192.168.43.124.8880 > 192.168.43.146.7771: UDP, length 120
01:20:44.936301 IP 192.168.43.146.8880 > 192.168.43.147.7772: UDP, length 120
01:20:44.986299 IP 192.168.43.146.8880 > 192.168.43.147.7772: UDP, length 120
01:20:45.036347 IP 192.168.43.146.8880 > 192.168.43.147.7772: UDP, length 120
01:20:45.039804 IP 192.168.43.124.8880 > 192.168.43.146.7771: UDP, length 120
01:20:45.039954 IP 192.168.43.124.8880 > 192.168.43.146.7771: UDP, length 120
01:20:45.065075 IP 192.168.43.124.8880 > 192.168.43.146.7771: UDP, length 120
01:20:45.086334 IP 192.168.43.146.8880 > 192.168.43.147.7772: UDP, length 120
01:20:45.117234 IP 192.168.43.124.8880 > 192.168.43.146.7771: UDP, length 120
01:20:45.136304 IP 192.168.43.146.8880 > 192.168.43.147.7772: UDP, length 120
01:20:45.173122 IP 192.168.43.124.8880 > 192.168.43.146.7771: UDP, length 120
01:20:45.186378 IP 192.168.43.146.8880 > 192.168.43.147.7772: UDP, length 120
01:20:45.227575 IP 192.168.43.124.8880 > 192.168.43.146.7771: UDP, length 120
01:20:45.236347 IP 192.168.43.146.8880 > 192.168.43.147.7772: UDP, length 120
01:20:45.286297 IP 192.168.43.146.8880 > 192.168.43.147.7772: UDP, length 120
01:20:45.336295 IP 192.168.43.146.8880 > 192.168.43.147.7772: UDP, length 120
01:20:45.386294 IP 192.168.43.146.8880 > 192.168.43.147.7772: UDP, length 120
01:20:45.406618 IP 192.168.43.124.8880 > 192.168.43.146.7771: UDP, length 120
01:20:45.406753 IP 192.168.43.124.8880 > 192.168.43.146.7771: UDP, length 120
01:20:45.406877 IP 192.168.43.124.8880 > 192.168.43.146.7771: UDP, length 120
01:20:45.411963 IP 192.168.43.124.8880 > 192.168.43.146.7771: UDP, length 120
01:20:45.436302 IP 192.168.43.146.8880 > 192.168.43.147.7772: UDP, length 120
01:20:45.466204 IP 192.168.43.124.8880 > 192.168.43.146.7771: UDP, length 120
01:20:45.486310 IP 192.168.43.146.8880 > 192.168.43.147.7772: UDP, length 120
01:20:45.518784 IP 192.168.43.124.8880 > 192.168.43.146.7771: UDP, length 120
01:20:45.536302 IP 192.168.43.146.8880 > 192.168.43.147.7772: UDP, length 120
01:20:45.575335 IP 192.168.43.124.8880 > 192.168.43.146.7771: UDP, length 120
01:20:45.586294 IP 192.168.43.146.8880 > 192.168.43.147.7772: UDP, length 120
01:20:45.636293 IP 192.168.43.146.8880 > 192.168.43.147.7772: UDP, length 120
01:20:45.686292 IP 192.168.43.146.8880 > 192.168.43.147.7772: UDP, length 120
01:20:45.736292 IP 192.168.43.146.8880 > 192.168.43.147.7772: UDP, length 120
01:20:45.739703 IP 192.168.43.124.8880 > 192.168.43.146.7771: UDP, length 120
01:20:45.739824 IP 192.168.43.124.8880 > 192.168.43.146.7771: UDP, length 120
01:20:45.739938 IP 192.168.43.124.8880 > 192.168.43.146.7771: UDP, length 120
01:20:45.772982 IP 192.168.43.124.8880 > 192.168.43.146.7771: UDP, length 120
01:20:45.786291 IP 192.168.43.146.8880 > 192.168.43.147.7772: UDP, length 120
01:20:45.826475 IP 192.168.43.124.8880 > 192.168.43.146.7771: UDP, length 120
01:20:45.836292 IP 192.168.43.146.8880 > 192.168.43.147.7772: UDP, length 120
01:20:45.883373 IP 192.168.43.124.8880 > 192.168.43.146.7771: UDP, length 120
01:20:45.886289 IP 192.168.43.146.8880 > 192.168.43.147.7772: UDP, length 120
01:20:45.915080 IP 192.168.43.124.8880 > 192.168.43.146.7771: UDP, length 120
01:20:45.936300 IP 192.168.43.146.8880 > 192.168.43.147.7772: UDP, length 120
01:20:45.986292 IP 192.168.43.146.8880 > 192.168.43.147.7772: UDP, length 120
01:20:46.036294 IP 192.168.43.146.8880 > 192.168.43.147.7772: UDP, length 120
01:20:46.086302 IP 192.168.43.146.8880 > 192.168.43.147.7772: UDP, length 120
01:20:46.088217 IP 192.168.43.124.8880 > 192.168.43.146.7771: UDP, length 120
01:20:46.088435 IP 192.168.43.124.8880 > 192.168.43.146.7771: UDP, length 120
01:20:46.088550 IP 192.168.43.124.8880 > 192.168.43.146.7771: UDP, length 120
01:20:46.115028 IP 192.168.43.124.8880 > 192.168.43.146.7771: UDP, length 120
01:20:46.136299 IP 192.168.43.146.8880 > 192.168.43.147.7772: UDP, length 120
01:20:46.168292 IP 192.168.43.124.8880 > 192.168.43.146.7771: UDP, length 120
01:20:46.186293 IP 192.168.43.146.8880 > 192.168.43.147.7772: UDP, length 120
01:20:46.223683 IP 192.168.43.124.8880 > 192.168.43.146.7771: UDP, length 120
01:20:46.236341 IP 192.168.43.146.8880 > 192.168.43.147.7772: UDP, length 120
01:20:46.281514 IP 192.168.43.124.8880 > 192.168.43.146.7771: UDP, length 120
01:20:46.286296 IP 192.168.43.146.8880 > 192.168.43.147.7772: UDP, length 120
01:20:46.336299 IP 192.168.43.146.8880 > 192.168.43.147.7772: UDP, length 120
01:20:46.386294 IP 192.168.43.146.8880 > 192.168.43.147.7772: UDP, length 120
01:20:46.436293 IP 192.168.43.146.8880 > 192.168.43.147.7772: UDP, length 120
01:20:46.437213 IP 192.168.43.124.8880 > 192.168.43.146.7771: UDP, length 120
01:20:46.437344 IP 192.168.43.124.8880 > 192.168.43.146.7771: UDP, length 120
01:20:46.437458 IP 192.168.43.124.8880 > 192.168.43.146.7771: UDP, length 120
01:20:46.464997 IP 192.168.43.124.8880 > 192.168.43.146.7771: UDP, length 120
01:20:46.486298 IP 192.168.43.146.8880 > 192.168.43.147.7772: UDP, length 120
01:20:46.514969 IP 192.168.43.124.8880 > 192.168.43.146.7771: UDP, length 120
01:20:46.536349 IP 192.168.43.146.8880 > 192.168.43.147.7772: UDP, length 120
01:20:46.566291 IP 192.168.43.124.8880 > 192.168.43.146.7771: UDP, length 120
01:20:46.586312 IP 192.168.43.146.8880 > 192.168.43.147.7772: UDP, length 120
01:20:46.626204 IP 192.168.43.124.8880 > 192.168.43.146.7771: UDP, length 120
01:20:46.636295 IP 192.168.43.146.8880 > 192.168.43.147.7772: UDP, length 120
01:20:46.686351 IP 192.168.43.146.8880 > 192.168.43.147.7772: UDP, length 120
01:20:46.736362 IP 192.168.43.146.8880 > 192.168.43.147.7772: UDP, length 120
01:20:46.783100 IP 192.168.43.124.8880 > 192.168.43.146.7771: UDP, length 120
01:20:46.783337 IP 192.168.43.124.8880 > 192.168.43.146.7771: UDP, length 120
01:20:46.783456 IP 192.168.43.124.8880 > 192.168.43.146.7771: UDP, length 120
01:20:46.786356 IP 192.168.43.146.8880 > 192.168.43.147.7772: UDP, length 120
01:20:46.815241 IP 192.168.43.124.8880 > 192.168.43.146.7771: UDP, length 120
01:20:46.836390 IP 192.168.43.146.8880 > 192.168.43.147.7772: UDP, length 120
01:20:46.881643 IP 192.168.43.124.8880 > 192.168.43.146.7771: UDP, length 120
01:20:46.886345 IP 192.168.43.146.8880 > 192.168.43.147.7772: UDP, length 120
01:20:46.915069 IP 192.168.43.124.8880 > 192.168.43.146.7771: UDP, length 120
01:20:46.936337 IP 192.168.43.146.8880 > 192.168.43.147.7772: UDP, length 120
01:20:46.966503 IP 192.168.43.124.8880 > 192.168.43.146.7771: UDP, length 120
01:20:46.986334 IP 192.168.43.146.8880 > 192.168.43.147.7772: UDP, length 120
01:20:47.036352 IP 192.168.43.146.8880 > 192.168.43.147.7772: UDP, length 120
01:20:47.086380 IP 192.168.43.146.8880 > 192.168.43.147.7772: UDP, length 120
01:20:47.136320 IP 192.168.43.146.8880 > 192.168.43.147.7772: UDP, length 120
01:20:47.186275 IP 192.168.43.146.8880 > 192.168.43.147.7772: UDP, length 120
01:20:47.236318 IP 192.168.43.146.8880 > 192.168.43.147.7772: UDP, length 120
01:20:47.255161 IP 192.168.43.124.8880 > 192.168.43.146.7771: UDP, length 120
01:20:47.255322 IP 192.168.43.124.8880 > 192.168.43.146.7771: UDP, length 120
01:20:47.286284 IP 192.168.43.146.8880 > 192.168.43.147.7772: UDP, length 120
01:20:47.336269 IP 192.168.43.146.8880 > 192.168.43.147.7772: UDP, length 120
01:20:47.368818 IP 192.168.43.124.8880 > 192.168.43.146.7771: UDP, length 120
01:20:47.368990 IP 192.168.43.124.8880 > 192.168.43.146.7771: UDP, length 120
01:20:47.386271 IP 192.168.43.146.8880 > 192.168.43.147.7772: UDP, length 120
01:20:47.436268 IP 192.168.43.146.8880 > 192.168.43.147.7772: UDP, length 120
01:20:47.486267 IP 192.168.43.146.8880 > 192.168.43.147.7772: UDP, length 120
01:20:47.536268 IP 192.168.43.146.8880 > 192.168.43.147.7772: UDP, length 120
01:20:47.586272 IP 192.168.43.146.8880 > 192.168.43.147.7772: UDP, length 120
01:20:47.587394 IP 192.168.43.124.8880 > 192.168.43.146.7771: UDP, length 120
01:20:47.587535 IP 192.168.43.124.8880 > 192.168.43.146.7771: UDP, length 120
01:20:47.587608 IP 192.168.43.124.8880 > 192.168.43.146.7771: UDP, length 120
01:20:47.587682 IP 192.168.43.124.8880 > 192.168.43.146.7771: UDP, length 120
01:20:47.587756 IP 192.168.43.124.8880 > 192.168.43.146.7771: UDP, length 120
01:20:47.636317 IP 192.168.43.146.8880 > 192.168.43.147.7772: UDP, length 120
01:20:47.686301 IP 192.168.43.146.8880 > 192.168.43.147.7772: UDP, length 120
01:20:47.736298 IP 192.168.43.146.8880 > 192.168.43.147.7772: UDP, length 120
01:20:47.736466 IP 192.168.43.124.8880 > 192.168.43.146.7771: UDP, length 120
01:20:47.736700 IP 192.168.43.124.8880 > 192.168.43.146.7771: UDP, length 120
01:20:47.786296 IP 192.168.43.146.8880 > 192.168.43.147.7772: UDP, length 120
01:20:47.836293 IP 192.168.43.146.8880 > 192.168.43.147.7772: UDP, length 120
01:20:47.886298 IP 192.168.43.146.8880 > 192.168.43.147.7772: UDP, length 120
01:20:47.936293 IP 192.168.43.146.8880 > 192.168.43.147.7772: UDP, length 120
01:20:47.938727 IP 192.168.43.124.8880 > 192.168.43.146.7771: UDP, length 120
01:20:47.938995 IP 192.168.43.124.8880 > 192.168.43.146.7771: UDP, length 120
01:20:47.939110 IP 192.168.43.124.8880 > 192.168.43.146.7771: UDP, length 120
01:20:47.939222 IP 192.168.43.124.8880 > 192.168.43.146.7771: UDP, length 120
01:20:47.939333 IP 192.168.43.124.8880 > 192.168.43.146.7771: UDP, length 120
01:20:47.986295 IP 192.168.43.146.8880 > 192.168.43.147.7772: UDP, length 120
01:20:48.036353 IP 192.168.43.146.8880 > 192.168.43.147.7772: UDP, length 120
01:20:48.086084 IP 192.168.43.124.8880 > 192.168.43.146.7771: UDP, length 120
01:20:48.086327 IP 192.168.43.146.8880 > 192.168.43.147.7772: UDP, length 120
01:20:48.086435 IP 192.168.43.124.8880 > 192.168.43.146.7771: UDP, length 120
01:20:48.136309 IP 192.168.43.146.8880 > 192.168.43.147.7772: UDP, length 120
01:20:48.186294 IP 192.168.43.146.8880 > 192.168.43.147.7772: UDP, length 120
01:20:48.236321 IP 192.168.43.146.8880 > 192.168.43.147.7772: UDP, length 120
01:20:48.284878 IP 192.168.43.124.8880 > 192.168.43.146.7771: UDP, length 120
01:20:48.285092 IP 192.168.43.124.8880 > 192.168.43.146.7771: UDP, length 120
01:20:48.285204 IP 192.168.43.124.8880 > 192.168.43.146.7771: UDP, length 120
01:20:48.285323 IP 192.168.43.124.8880 > 192.168.43.146.7771: UDP, length 120
01:20:48.285435 IP 192.168.43.124.8880 > 192.168.43.146.7771: UDP, length 120
01:20:48.286304 IP 192.168.43.146.8880 > 192.168.43.147.7772: UDP, length 120
01:20:48.336303 IP 192.168.43.146.8880 > 192.168.43.147.7772: UDP, length 120
01:20:48.386299 IP 192.168.43.146.8880 > 192.168.43.147.7772: UDP, length 120
01:20:48.436292 IP 192.168.43.146.8880 > 192.168.43.147.7772: UDP, length 120
01:20:48.443775 IP 192.168.43.124.8880 > 192.168.43.146.7771: UDP, length 120
01:20:48.444004 IP 192.168.43.124.8880 > 192.168.43.146.7771: UDP, length 120
01:20:48.486296 IP 192.168.43.146.8880 > 192.168.43.147.7772: UDP, length 120
01:20:48.536295 IP 192.168.43.146.8880 > 192.168.43.147.7772: UDP, length 120
01:20:48.586294 IP 192.168.43.146.8880 > 192.168.43.147.7772: UDP, length 120
01:20:48.627321 IP 192.168.43.124.8880 > 192.168.43.146.7771: UDP, length 120
01:20:48.627459 IP 192.168.43.124.8880 > 192.168.43.146.7771: UDP, length 120
01:20:48.627579 IP 192.168.43.124.8880 > 192.168.43.146.7771: UDP, length 120
01:20:48.627700 IP 192.168.43.124.8880 > 192.168.43.146.7771: UDP, length 120
01:20:48.627811 IP 192.168.43.124.8880 > 192.168.43.146.7771: UDP, length 120
01:20:48.636309 IP 192.168.43.146.8880 > 192.168.43.147.7772: UDP, length 120
01:20:48.686296 IP 192.168.43.146.8880 > 192.168.43.147.7772: UDP, length 120
01:20:48.736293 IP 192.168.43.146.8880 > 192.168.43.147.7772: UDP, length 120
01:20:48.767278 IP 192.168.43.124.8880 > 192.168.43.146.7771: UDP, length 120
01:20:48.767512 IP 192.168.43.124.8880 > 192.168.43.146.7771: UDP, length 120
01:20:48.786296 IP 192.168.43.146.8880 > 192.168.43.147.7772: UDP, length 120
01:20:48.836290 IP 192.168.43.146.8880 > 192.168.43.147.7772: UDP, length 120
01:20:48.886292 IP 192.168.43.146.8880 > 192.168.43.147.7772: UDP, length 120
01:20:48.936291 IP 192.168.43.146.8880 > 192.168.43.147.7772: UDP, length 120
01:20:48.970860 IP 192.168.43.124.8880 > 192.168.43.146.7771: UDP, length 120
01:20:48.971119 IP 192.168.43.124.8880 > 192.168.43.146.7771: UDP, length 120
01:20:48.971235 IP 192.168.43.124.8880 > 192.168.43.146.7771: UDP, length 120
01:20:48.971345 IP 192.168.43.124.8880 > 192.168.43.146.7771: UDP, length 120
01:20:48.971456 IP 192.168.43.124.8880 > 192.168.43.146.7771: UDP, length 120
01:20:48.986301 IP 192.168.43.146.8880 > 192.168.43.147.7772: UDP, length 120
01:20:49.036294 IP 192.168.43.146.8880 > 192.168.43.147.7772: UDP, length 120
01:20:49.086325 IP 192.168.43.146.8880 > 192.168.43.147.7772: UDP, length 120
01:20:49.123488 IP 192.168.43.124.8880 > 192.168.43.146.7771: UDP, length 120
01:20:49.123633 IP 192.168.43.124.8880 > 192.168.43.146.7771: UDP, length 120
01:20:49.136310 IP 192.168.43.146.8880 > 192.168.43.147.7772: UDP, length 120
01:20:49.186292 IP 192.168.43.146.8880 > 192.168.43.147.7772: UDP, length 120
01:20:49.236298 IP 192.168.43.146.8880 > 192.168.43.147.7772: UDP, length 120
01:20:49.286292 IP 192.168.43.146.8880 > 192.168.43.147.7772: UDP, length 120
01:20:49.328437 IP 192.168.43.124.8880 > 192.168.43.146.7771: UDP, length 120
01:20:49.328566 IP 192.168.43.124.8880 > 192.168.43.146.7771: UDP, length 120
01:20:49.328681 IP 192.168.43.124.8880 > 192.168.43.146.7771: UDP, length 120
01:20:49.328791 IP 192.168.43.124.8880 > 192.168.43.146.7771: UDP, length 120
01:20:49.328906 IP 192.168.43.124.8880 > 192.168.43.146.7771: UDP, length 120
01:20:49.336295 IP 192.168.43.146.8880 > 192.168.43.147.7772: UDP, length 120
01:20:49.386293 IP 192.168.43.146.8880 > 192.168.43.147.7772: UDP, length 120
01:20:49.436292 IP 192.168.43.146.8880 > 192.168.43.147.7772: UDP, length 120
01:20:49.469580 IP 192.168.43.124.8880 > 192.168.43.146.7771: UDP, length 120
01:20:49.469705 IP 192.168.43.124.8880 > 192.168.43.146.7771: UDP, length 120
01:20:49.486294 IP 192.168.43.146.8880 > 192.168.43.147.7772: UDP, length 120
01:20:49.536339 IP 192.168.43.146.8880 > 192.168.43.147.7772: UDP, length 120
01:20:49.586305 IP 192.168.43.146.8880 > 192.168.43.147.7772: UDP, length 120
01:20:49.636296 IP 192.168.43.146.8880 > 192.168.43.147.7772: UDP, length 120
01:20:49.686295 IP 192.168.43.146.8880 > 192.168.43.147.7772: UDP, length 120
01:20:49.722686 IP 192.168.43.124.8880 > 192.168.43.146.7771: UDP, length 120
01:20:49.722839 IP 192.168.43.124.8880 > 192.168.43.146.7771: UDP, length 120
01:20:49.722953 IP 192.168.43.124.8880 > 192.168.43.146.7771: UDP, length 120
01:20:49.723069 IP 192.168.43.124.8880 > 192.168.43.146.7771: UDP, length 120
01:20:49.723183 IP 192.168.43.124.8880 > 192.168.43.146.7771: UDP, length 120
01:20:49.723296 IP 192.168.43.124.8880 > 192.168.43.146.7771: UDP, length 120
01:20:49.736300 IP 192.168.43.146.8880 > 192.168.43.147.7772: UDP, length 120
01:20:49.786292 IP 192.168.43.146.8880 > 192.168.43.147.7772: UDP, length 120
01:20:49.836292 IP 192.168.43.146.8880 > 192.168.43.147.7772: UDP, length 120
01:20:49.875750 IP 192.168.43.124.8880 > 192.168.43.146.7771: UDP, length 120
01:20:49.875997 IP 192.168.43.124.8880 > 192.168.43.146.7771: UDP, length 120
01:20:49.886291 IP 192.168.43.146.8880 > 192.168.43.147.7772: UDP, length 120
01:20:49.936291 IP 192.168.43.146.8880 > 192.168.43.147.7772: UDP, length 120
01:20:49.986292 IP 192.168.43.146.8880 > 192.168.43.147.7772: UDP, length 120
01:20:50.036293 IP 192.168.43.146.8880 > 192.168.43.147.7772: UDP, length 120
01:20:50.086308 IP 192.168.43.146.8880 > 192.168.43.147.7772: UDP, length 120
01:20:50.136298 IP 192.168.43.146.8880 > 192.168.43.147.7772: UDP, length 120
01:20:50.186292 IP 192.168.43.146.8880 > 192.168.43.147.7772: UDP, length 120
01:20:50.215094 IP 192.168.43.124.8880 > 192.168.43.146.7771: UDP, length 120
01:20:50.215232 IP 192.168.43.124.8880 > 192.168.43.146.7771: UDP, length 120
01:20:50.215347 IP 192.168.43.124.8880 > 192.168.43.146.7771: UDP, length 120
01:20:50.215460 IP 192.168.43.124.8880 > 192.168.43.146.7771: UDP, length 120
01:20:50.215580 IP 192.168.43.124.8880 > 192.168.43.146.7771: UDP, length 120
01:20:50.215692 IP 192.168.43.124.8880 > 192.168.43.146.7771: UDP, length 120
01:20:50.215802 IP 192.168.43.124.8880 > 192.168.43.146.7771: UDP, length 120
01:20:50.215913 IP 192.168.43.124.8880 > 192.168.43.146.7771: UDP, length 120
01:20:50.236387 IP 192.168.43.146.8880 > 192.168.43.147.7772: UDP, length 120
01:20:50.264444 IP 192.168.43.124.8880 > 192.168.43.146.7771: UDP, length 120
01:20:50.286387 IP 192.168.43.146.8880 > 192.168.43.147.7772: UDP, length 120
01:20:50.315040 IP 192.168.43.124.8880 > 192.168.43.146.7771: UDP, length 120
01:20:50.336770 IP 192.168.43.146.8880 > 192.168.43.147.7772: UDP, length 120
01:20:50.364947 IP 192.168.43.124.8880 > 192.168.43.146.7771: UDP, length 120
01:20:50.386309 IP 192.168.43.146.8880 > 192.168.43.147.7772: UDP, length 120
01:20:50.414689 IP 192.168.43.124.8880 > 192.168.43.146.7771: UDP, length 120
01:20:50.436277 IP 192.168.43.146.8880 > 192.168.43.147.7772: UDP, length 120
01:20:50.465384 IP 192.168.43.124.8880 > 192.168.43.146.7771: UDP, length 120
01:20:50.486272 IP 192.168.43.146.8880 > 192.168.43.147.7772: UDP, length 120
01:20:50.517799 IP 192.168.43.124.8880 > 192.168.43.146.7771: UDP, length 120
01:20:50.536270 IP 192.168.43.146.8880 > 192.168.43.147.7772: UDP, length 120
01:20:50.565668 IP 192.168.43.124.8880 > 192.168.43.146.7771: UDP, length 120
01:20:50.586271 IP 192.168.43.146.8880 > 192.168.43.147.7772: UDP, length 120
01:20:50.614678 IP 192.168.43.124.8880 > 192.168.43.146.7771: UDP, length 120
01:20:50.636271 IP 192.168.43.146.8880 > 192.168.43.147.7772: UDP, length 120
01:20:50.664686 IP 192.168.43.124.8880 > 192.168.43.146.7771: UDP, length 120
01:20:50.686269 IP 192.168.43.146.8880 > 192.168.43.147.7772: UDP, length 120
01:20:50.715069 IP 192.168.43.124.8880 > 192.168.43.146.7771: UDP, length 120
01:20:50.736277 IP 192.168.43.146.8880 > 192.168.43.147.7772: UDP, length 120
01:20:50.765185 IP 192.168.43.124.8880 > 192.168.43.146.7771: UDP, length 120
01:20:50.786273 IP 192.168.43.146.8880 > 192.168.43.147.7772: UDP, length 120
01:20:50.814767 IP 192.168.43.124.8880 > 192.168.43.146.7771: UDP, length 120
01:20:50.836271 IP 192.168.43.146.8880 > 192.168.43.147.7772: UDP, length 120
01:20:50.864581 IP 192.168.43.124.8880 > 192.168.43.146.7771: UDP, length 120
01:20:50.886268 IP 192.168.43.146.8880 > 192.168.43.147.7772: UDP, length 120
01:20:50.922155 IP 192.168.43.124.8880 > 192.168.43.146.7771: UDP, length 120
01:20:50.936267 IP 192.168.43.146.8880 > 192.168.43.147.7772: UDP, length 120
01:20:50.981306 IP 192.168.43.124.8880 > 192.168.43.146.7771: UDP, length 120
01:20:50.986268 IP 192.168.43.146.8880 > 192.168.43.147.7772: UDP, length 120
01:20:51.024797 IP 192.168.43.124.8880 > 192.168.43.146.7771: UDP, length 120
01:20:51.036306 IP 192.168.43.146.8880 > 192.168.43.147.7772: UDP, length 120
01:20:51.075687 IP 192.168.43.124.8880 > 192.168.43.146.7771: UDP, length 120
01:20:51.086292 IP 192.168.43.146.8880 > 192.168.43.147.7772: UDP, length 120
01:20:51.126991 IP 192.168.43.124.8880 > 192.168.43.146.7771: UDP, length 120
01:20:51.136277 IP 192.168.43.146.8880 > 192.168.43.147.7772: UDP, length 120
01:20:51.177230 IP 192.168.43.124.8880 > 192.168.43.146.7771: UDP, length 120
01:20:51.186271 IP 192.168.43.146.8880 > 192.168.43.147.7772: UDP, length 120
01:20:51.228171 IP 192.168.43.124.8880 > 192.168.43.146.7771: UDP, length 120
01:20:51.236268 IP 192.168.43.146.8880 > 192.168.43.147.7772: UDP, length 120
01:20:51.279410 IP 192.168.43.124.8880 > 192.168.43.146.7771: UDP, length 120
01:20:51.286268 IP 192.168.43.146.8880 > 192.168.43.147.7772: UDP, length 120
01:20:51.314834 IP 192.168.43.124.8880 > 192.168.43.146.7771: UDP, length 120
01:20:51.336269 IP 192.168.43.146.8880 > 192.168.43.147.7772: UDP, length 120
01:20:51.364749 IP 192.168.43.124.8880 > 192.168.43.146.7771: UDP, length 120
01:20:51.386352 IP 192.168.43.146.8880 > 192.168.43.147.7772: UDP, length 120
01:20:51.414649 IP 192.168.43.124.8880 > 192.168.43.146.7771: UDP, length 120
01:20:51.436307 IP 192.168.43.146.8880 > 192.168.43.147.7772: UDP, length 120
01:20:51.464640 IP 192.168.43.124.8880 > 192.168.43.146.7771: UDP, length 120
01:20:51.486276 IP 192.168.43.146.8880 > 192.168.43.147.7772: UDP, length 120
01:20:51.520455 IP 192.168.43.124.8880 > 192.168.43.146.7771: UDP, length 120
01:20:51.536274 IP 192.168.43.146.8880 > 192.168.43.147.7772: UDP, length 120
01:20:51.569185 IP 192.168.43.124.8880 > 192.168.43.146.7771: UDP, length 120
01:20:51.586273 IP 192.168.43.146.8880 > 192.168.43.147.7772: UDP, length 120
01:20:51.621695 IP 192.168.43.124.8880 > 192.168.43.146.7771: UDP, length 120
01:20:51.636272 IP 192.168.43.146.8880 > 192.168.43.147.7772: UDP, length 120
01:20:51.673067 IP 192.168.43.124.8880 > 192.168.43.146.7771: UDP, length 120
01:20:51.686270 IP 192.168.43.146.8880 > 192.168.43.147.7772: UDP, length 120
01:20:51.724290 IP 192.168.43.124.8880 > 192.168.43.146.7771: UDP, length 120
01:20:51.736269 IP 192.168.43.146.8880 > 192.168.43.147.7772: UDP, length 120
01:20:51.775410 IP 192.168.43.124.8880 > 192.168.43.146.7771: UDP, length 120
01:20:51.786272 IP 192.168.43.146.8880 > 192.168.43.147.7772: UDP, length 120
01:20:51.825630 IP 192.168.43.124.8880 > 192.168.43.146.7771: UDP, length 120
01:20:51.836277 IP 192.168.43.146.8880 > 192.168.43.147.7772: UDP, length 120
01:20:51.876739 IP 192.168.43.124.8880 > 192.168.43.146.7771: UDP, length 120
01:20:51.886273 IP 192.168.43.146.8880 > 192.168.43.147.7772: UDP, length 120
01:20:51.927837 IP 192.168.43.124.8880 > 192.168.43.146.7771: UDP, length 120
01:20:51.936270 IP 192.168.43.146.8880 > 192.168.43.147.7772: UDP, length 120
01:20:51.979165 IP 192.168.43.124.8880 > 192.168.43.146.7771: UDP, length 120
01:20:51.986269 IP 192.168.43.146.8880 > 192.168.43.147.7772: UDP, length 120
01:20:52.032424 IP 192.168.43.124.8880 > 192.168.43.146.7771: UDP, length 120
01:20:52.036270 IP 192.168.43.146.8880 > 192.168.43.147.7772: UDP, length 120
01:20:52.066014 IP 192.168.43.124.8880 > 192.168.43.146.7771: UDP, length 120
01:20:52.086275 IP 192.168.43.146.8880 > 192.168.43.147.7772: UDP, length 120
01:20:52.128067 IP 192.168.43.124.8880 > 192.168.43.146.7771: UDP, length 120
01:20:52.136324 IP 192.168.43.146.8880 > 192.168.43.147.7772: UDP, length 120
01:20:52.164693 IP 192.168.43.124.8880 > 192.168.43.146.7771: UDP, length 120
01:20:52.186350 IP 192.168.43.146.8880 > 192.168.43.147.7772: UDP, length 120
01:20:52.214742 IP 192.168.43.124.8880 > 192.168.43.146.7771: UDP, length 120
01:20:52.236407 IP 192.168.43.146.8880 > 192.168.43.147.7772: UDP, length 120
01:20:52.275450 IP 192.168.43.124.8880 > 192.168.43.146.7771: UDP, length 120
01:20:52.286373 IP 192.168.43.146.8880 > 192.168.43.147.7772: UDP, length 120
01:20:52.321856 IP 192.168.43.124.8880 > 192.168.43.146.7771: UDP, length 120
01:20:52.336346 IP 192.168.43.146.8880 > 192.168.43.147.7772: UDP, length 120
01:20:52.372971 IP 192.168.43.124.8880 > 192.168.43.146.7771: UDP, length 120
01:20:52.386352 IP 192.168.43.146.8880 > 192.168.43.147.7772: UDP, length 120
01:20:52.423576 IP 192.168.43.124.8880 > 192.168.43.146.7771: UDP, length 120
01:20:52.436345 IP 192.168.43.146.8880 > 192.168.43.147.7772: UDP, length 120
01:20:52.465117 IP 192.168.43.124.8880 > 192.168.43.146.7771: UDP, length 120
01:20:52.486351 IP 192.168.43.146.8880 > 192.168.43.147.7772: UDP, length 120
01:20:52.512160 IP 192.168.43.124.8880 > 192.168.43.146.7771: UDP, length 120
01:20:52.536359 IP 192.168.43.146.8880 > 192.168.43.147.7772: UDP, length 120
01:20:52.565076 IP 192.168.43.124.8880 > 192.168.43.146.7771: UDP, length 120
01:20:52.586310 IP 192.168.43.146.8880 > 192.168.43.147.7772: UDP, length 120
01:20:52.616129 IP 192.168.43.124.8880 > 192.168.43.146.7771: UDP, length 120
01:20:52.636304 IP 192.168.43.146.8880 > 192.168.43.147.7772: UDP, length 120
01:20:52.667297 IP 192.168.43.124.8880 > 192.168.43.146.7771: UDP, length 120
01:20:52.686299 IP 192.168.43.146.8880 > 192.168.43.147.7772: UDP, length 120
01:20:52.714787 IP 192.168.43.124.8880 > 192.168.43.146.7771: UDP, length 120
01:20:52.736296 IP 192.168.43.146.8880 > 192.168.43.147.7772: UDP, length 120
01:20:52.774586 IP 192.168.43.124.8880 > 192.168.43.146.7771: UDP, length 120
01:20:52.786293 IP 192.168.43.146.8880 > 192.168.43.147.7772: UDP, length 120
01:20:52.827932 IP 192.168.43.124.8880 > 192.168.43.146.7771: UDP, length 120
01:20:52.836304 IP 192.168.43.146.8880 > 192.168.43.147.7772: UDP, length 120
01:20:52.885046 IP 192.168.43.124.8880 > 192.168.43.146.7771: UDP, length 120
01:20:52.886304 IP 192.168.43.146.8880 > 192.168.43.147.7772: UDP, length 120
01:20:52.914911 IP 192.168.43.124.8880 > 192.168.43.146.7771: UDP, length 120
01:20:52.936295 IP 192.168.43.146.8880 > 192.168.43.147.7772: UDP, length 120
01:20:52.964787 IP 192.168.43.124.8880 > 192.168.43.146.7771: UDP, length 120
01:20:52.986293 IP 192.168.43.146.8880 > 192.168.43.147.7772: UDP, length 120
01:20:53.014928 IP 192.168.43.124.8880 > 192.168.43.146.7771: UDP, length 120
01:20:53.036295 IP 192.168.43.146.8880 > 192.168.43.147.7772: UDP, length 120
01:20:53.064731 IP 192.168.43.124.8880 > 192.168.43.146.7771: UDP, length 120
01:20:53.086309 IP 192.168.43.146.8880 > 192.168.43.147.7772: UDP, length 120
01:20:53.118439 IP 192.168.43.124.8880 > 192.168.43.146.7771: UDP, length 120
01:20:53.136301 IP 192.168.43.146.8880 > 192.168.43.147.7772: UDP, length 120
01:20:53.172965 IP 192.168.43.124.8880 > 192.168.43.146.7771: UDP, length 120
01:20:53.186294 IP 192.168.43.146.8880 > 192.168.43.147.7772: UDP, length 120
01:20:53.227897 IP 192.168.43.124.8880 > 192.168.43.146.7771: UDP, length 120
01:20:53.236294 IP 192.168.43.146.8880 > 192.168.43.147.7772: UDP, length 120
01:20:53.266352 IP 192.168.43.124.8880 > 192.168.43.146.7771: UDP, length 120
01:20:53.286298 IP 192.168.43.146.8880 > 192.168.43.147.7772: UDP, length 120
01:20:53.314858 IP 192.168.43.124.8880 > 192.168.43.146.7771: UDP, length 120
01:20:53.336294 IP 192.168.43.146.8880 > 192.168.43.147.7772: UDP, length 120
01:20:53.365525 IP 192.168.43.124.8880 > 192.168.43.146.7771: UDP, length 120
01:20:53.386293 IP 192.168.43.146.8880 > 192.168.43.147.7772: UDP, length 120
01:20:53.424328 IP 192.168.43.124.8880 > 192.168.43.146.7771: UDP, length 120
01:20:53.436340 IP 192.168.43.146.8880 > 192.168.43.147.7772: UDP, length 120
01:20:53.465231 IP 192.168.43.124.8880 > 192.168.43.146.7771: UDP, length 120
01:20:53.486300 IP 192.168.43.146.8880 > 192.168.43.147.7772: UDP, length 120
01:20:53.514965 IP 192.168.43.124.8880 > 192.168.43.146.7771: UDP, length 120
01:20:53.536296 IP 192.168.43.146.8880 > 192.168.43.147.7772: UDP, length 120
01:20:53.586298 IP 192.168.43.146.8880 > 192.168.43.147.7772: UDP, length 120
01:20:53.590603 IP 192.168.43.124.8880 > 192.168.43.146.7771: UDP, length 120
01:20:53.615702 IP 192.168.43.124.8880 > 192.168.43.146.7771: UDP, length 120
01:20:53.636301 IP 192.168.43.146.8880 > 192.168.43.147.7772: UDP, length 120
01:20:53.672050 IP 192.168.43.124.8880 > 192.168.43.146.7771: UDP, length 120
01:20:53.686295 IP 192.168.43.146.8880 > 192.168.43.147.7772: UDP, length 120
01:20:53.717026 IP 192.168.43.124.8880 > 192.168.43.146.7771: UDP, length 120
01:20:53.736293 IP 192.168.43.146.8880 > 192.168.43.147.7772: UDP, length 120
01:20:53.765193 IP 192.168.43.124.8880 > 192.168.43.146.7771: UDP, length 120
01:20:53.786304 IP 192.168.43.146.8880 > 192.168.43.147.7772: UDP, length 120
01:20:53.827415 IP 192.168.43.124.8880 > 192.168.43.146.7771: UDP, length 120
01:20:53.836292 IP 192.168.43.146.8880 > 192.168.43.147.7772: UDP, length 120
01:20:53.867190 IP 192.168.43.124.8880 > 192.168.43.146.7771: UDP, length 120
01:20:53.886303 IP 192.168.43.146.8880 > 192.168.43.147.7772: UDP, length 120
01:20:53.915075 IP 192.168.43.124.8880 > 192.168.43.146.7771: UDP, length 120
01:20:53.936298 IP 192.168.43.146.8880 > 192.168.43.147.7772: UDP, length 120
01:20:53.986299 IP 192.168.43.146.8880 > 192.168.43.147.7772: UDP, length 120
01:20:53.987145 IP 192.168.43.124.8880 > 192.168.43.146.7771: UDP, length 120
01:20:54.015068 IP 192.168.43.124.8880 > 192.168.43.146.7771: UDP, length 120
01:20:54.036355 IP 192.168.43.146.8880 > 192.168.43.147.7772: UDP, length 120
01:20:54.073361 IP 192.168.43.124.8880 > 192.168.43.146.7771: UDP, length 120
01:20:54.086340 IP 192.168.43.146.8880 > 192.168.43.147.7772: UDP, length 120
01:20:54.136304 IP 192.168.43.146.8880 > 192.168.43.147.7772: UDP, length 120
01:20:54.158155 IP 192.168.43.124.8880 > 192.168.43.146.7771: UDP, length 120
01:20:54.175104 IP 192.168.43.124.8880 > 192.168.43.146.7771: UDP, length 120
01:20:54.186299 IP 192.168.43.146.8880 > 192.168.43.147.7772: UDP, length 120
01:20:54.235872 IP 192.168.43.124.8880 > 192.168.43.146.7771: UDP, length 120
01:20:54.236294 IP 192.168.43.146.8880 > 192.168.43.147.7772: UDP, length 120
01:20:54.266685 IP 192.168.43.124.8880 > 192.168.43.146.7771: UDP, length 120
01:20:54.286298 IP 192.168.43.146.8880 > 192.168.43.147.7772: UDP, length 120
01:20:54.315048 IP 192.168.43.124.8880 > 192.168.43.146.7771: UDP, length 120
01:20:54.336296 IP 192.168.43.146.8880 > 192.168.43.147.7772: UDP, length 120
01:20:54.386291 IP 192.168.43.146.8880 > 192.168.43.147.7772: UDP, length 120
01:20:54.389700 IP 192.168.43.124.8880 > 192.168.43.146.7771: UDP, length 120
01:20:54.415339 IP 192.168.43.124.8880 > 192.168.43.146.7771: UDP, length 120
01:20:54.436355 IP 192.168.43.146.8880 > 192.168.43.147.7772: UDP, length 120
01:20:54.467506 IP 192.168.43.124.8880 > 192.168.43.146.7771: UDP, length 120
01:20:54.486309 IP 192.168.43.146.8880 > 192.168.43.147.7772: UDP, length 120
01:20:54.536295 IP 192.168.43.146.8880 > 192.168.43.147.7772: UDP, length 120
01:20:54.541146 IP 192.168.43.124.8880 > 192.168.43.146.7771: UDP, length 120
01:20:54.565164 IP 192.168.43.124.8880 > 192.168.43.146.7771: UDP, length 120
01:20:54.586308 IP 192.168.43.146.8880 > 192.168.43.147.7772: UDP, length 120
01:20:54.627829 IP 192.168.43.124.8880 > 192.168.43.146.7771: UDP, length 120
01:20:54.636301 IP 192.168.43.146.8880 > 192.168.43.147.7772: UDP, length 120
01:20:54.665312 IP 192.168.43.124.8880 > 192.168.43.146.7771: UDP, length 120
01:20:54.686299 IP 192.168.43.146.8880 > 192.168.43.147.7772: UDP, length 120
01:20:54.715464 IP 192.168.43.124.8880 > 192.168.43.146.7771: UDP, length 120
01:20:54.736297 IP 192.168.43.146.8880 > 192.168.43.147.7772: UDP, length 120
01:20:54.783867 IP 192.168.43.124.8880 > 192.168.43.146.7771: UDP, length 120
01:20:54.786294 IP 192.168.43.146.8880 > 192.168.43.147.7772: UDP, length 120
01:20:54.836295 IP 192.168.43.146.8880 > 192.168.43.147.7772: UDP, length 120
01:20:54.861475 IP 192.168.43.124.8880 > 192.168.43.146.7771: UDP, length 120
01:20:54.861845 IP 192.168.43.124.8880 > 192.168.43.146.7771: UDP, length 120
01:20:54.886299 IP 192.168.43.146.8880 > 192.168.43.147.7772: UDP, length 120
01:20:54.936295 IP 192.168.43.146.8880 > 192.168.43.147.7772: UDP, length 120
01:20:54.939098 IP 192.168.43.124.8880 > 192.168.43.146.7771: UDP, length 120
01:20:54.965190 IP 192.168.43.124.8880 > 192.168.43.146.7771: UDP, length 120
01:20:54.986312 IP 192.168.43.146.8880 > 192.168.43.147.7772: UDP, length 120
01:20:55.018574 IP 192.168.43.124.8880 > 192.168.43.146.7771: UDP, length 120
01:20:55.036306 IP 192.168.43.146.8880 > 192.168.43.147.7772: UDP, length 120
01:20:55.086312 IP 192.168.43.146.8880 > 192.168.43.147.7772: UDP, length 120
01:20:55.100055 IP 192.168.43.124.8880 > 192.168.43.146.7771: UDP, length 120
01:20:55.115181 IP 192.168.43.124.8880 > 192.168.43.146.7771: UDP, length 120
01:20:55.136306 IP 192.168.43.146.8880 > 192.168.43.147.7772: UDP, length 120
01:20:55.181108 IP 192.168.43.124.8880 > 192.168.43.146.7771: UDP, length 120
01:20:55.186294 IP 192.168.43.146.8880 > 192.168.43.147.7772: UDP, length 120
01:20:55.215319 IP 192.168.43.124.8880 > 192.168.43.146.7771: UDP, length 120
01:20:55.236297 IP 192.168.43.146.8880 > 192.168.43.147.7772: UDP, length 120
01:20:55.267785 IP 192.168.43.124.8880 > 192.168.43.146.7771: UDP, length 120
01:20:55.286297 IP 192.168.43.146.8880 > 192.168.43.147.7772: UDP, length 120
01:20:55.336029 IP 192.168.43.124.8880 > 192.168.43.146.7771: UDP, length 120
01:20:55.336293 IP 192.168.43.146.8880 > 192.168.43.147.7772: UDP, length 120
01:20:55.365092 IP 192.168.43.124.8880 > 192.168.43.146.7771: UDP, length 120
01:20:55.386294 IP 192.168.43.146.8880 > 192.168.43.147.7772: UDP, length 120
01:20:55.415255 IP 192.168.43.124.8880 > 192.168.43.146.7771: UDP, length 120
01:20:55.436358 IP 192.168.43.146.8880 > 192.168.43.147.7772: UDP, length 120
01:20:55.486307 IP 192.168.43.146.8880 > 192.168.43.147.7772: UDP, length 120
01:20:55.490559 IP 192.168.43.124.8880 > 192.168.43.146.7771: UDP, length 120
01:20:55.517480 IP 192.168.43.124.8880 > 192.168.43.146.7771: UDP, length 120
01:20:55.536358 IP 192.168.43.146.8880 > 192.168.43.147.7772: UDP, length 120
01:20:55.574152 IP 192.168.43.124.8880 > 192.168.43.146.7771: UDP, length 120
01:20:55.586323 IP 192.168.43.146.8880 > 192.168.43.147.7772: UDP, length 120
01:20:55.614445 IP 192.168.43.124.8880 > 192.168.43.146.7771: UDP, length 120
