01:20:43.050098 IP 192.168.43.146.8880 > 192.168.43.147.7772: UDP, length 120
01:20:43.088778 IP 192.168.43.146.8880 > 192.168.43.147.7772: UDP, length 120
01:20:43.148590 IP 192.168.43.146.8880 > 192.168.43.147.7772: UDP, length 120
01:20:43.177177 IP 192.168.43.147.8880 > 192.168.43.124.7773: UDP, length 120
01:20:43.195859 IP 192.168.43.146.8880 > 192.168.43.147.7772: UDP, length 120
01:20:43.227274 IP 192.168.43.147.8880 > 192.168.43.124.7773: UDP, length 120
01:20:43.277223 IP 192.168.43.147.8880 > 192.168.43.124.7773: UDP, length 120
01:20:43.327221 IP 192.168.43.147.8880 > 192.168.43.124.7773: UDP, length 120
01:20:43.366143 IP 192.168.43.146.8880 > 192.168.43.147.7772: UDP, length 120
01:20:43.377225 IP 192.168.43.147.8880 > 192.168.43.124.7773: UDP, length 120
01:20:43.427201 IP 192.168.43.147.8880 > 192.168.43.124.7773: UDP, length 120
01:20:43.471590 IP 192.168.43.146.8880 > 192.168.43.147.7772: UDP, length 120
01:20:43.471901 IP 192.168.43.146.8880 > 192.168.43.147.7772: UDP, length 120
01:20:43.475564 IP 192.168.43.146.8880 > 192.168.43.147.7772: UDP, length 120
01:20:43.475844 IP 192.168.43.146.8880 > 192.168.43.147.7772: UDP, length 120
01:20:43.477263 IP 192.168.43.147.8880 > 192.168.43.124.7773: UDP, length 120
01:20:43.504364 IP 192.168.43.146.8880 > 192.168.43.147.7772: UDP, length 120
01:20:43.527257 IP 192.168.43.147.8880 > 192.168.43.124.7773: UDP, length 120
01:20:43.539378 IP 192.168.43.146.8880 > 192.168.43.147.7772: UDP, length 120
01:20:43.577249 IP 192.168.43.147.8880 > 192.168.43.124.7773: UDP, length 120
01:20:43.583605 IP 192.168.43.146.8880 > 192.168.43.147.7772: UDP, length 120
01:20:43.627225 IP 192.168.43.147.8880 > 192.168.43.124.7773: UDP, length 120
01:20:43.641558 IP 192.168.43.146.8880 > 192.168.43.147.7772: UDP, length 120
01:20:43.677267 IP 192.168.43.147.8880 > 192.168.43.124.7773: UDP, length 120
01:20:43.695245 IP 192.168.43.146.8880 > 192.168.43.147.7772: UDP, length 120
01:20:43.727267 IP 192.168.43.147.8880 > 192.168.43.124.7773: UDP, length 120
01:20:43.756962 IP 192.168.43.146.8880 > 192.168.43.147.7772: UDP, length 120
01:20:43.777257 IP 192.168.43.147.8880 > 192.168.43.124.7773: UDP, length 120
01:20:43.813082 IP 192.168.43.146.8880 > 192.168.43.147.7772: UDP, length 120
01:20:43.827265 IP 192.168.43.147.8880 > 192.168.43.124.7773: UDP, length 120
01:20:43.874461 IP 192.168.43.146.8880 > 192.168.43.147.7772: UDP, length 120
01:20:43.877200 IP 192.168.43.147.8880 > 192.168.43.124.7773: UDP, length 120
01:20:43.926544 IP 192.168.43.146.8880 > 192.168.43.147.7772: UDP, length 120
01:20:43.927198 IP 192.168.43.147.8880 > 192.168.43.124.7773: UDP, length 120
01:20:43.960838 IP 192.168.43.146.8880 > 192.168.43.147.7772: UDP, length 120
01:20:43.977200 IP 192.168.43.147.8880 > 192.168.43.124.7773: UDP, length 120
01:20:43.985440 IP 192.168.43.146.8880 > 192.168.43.147.7772: UDP, length 120
01:20:44.027258 IP 192.168.43.147.8880 > 192.168.43.124.7773: UDP, length 120
01:20:44.035759 IP 192.168.43.146.8880 > 192.168.43.147.7772: UDP, length 120
01:20:44.077257 IP 192.168.43.147.8880 > 192.168.43.124.7773: UDP, length 120
01:20:44.127201 IP 192.168.43.147.8880 > 192.168.43.124.7773: UDP, length 120
01:20:44.128396 IP 192.168.43.146.8880 > 192.168.43.147.7772: UDP, length 120
01:20:44.157035 IP 192.168.43.146.8880 > 192.168.43.147.7772: UDP, length 120
01:20:44.177340 IP 192.168.43.147.8880 > 192.168.43.124.7773: UDP, length 120
01:20:44.190800 IP 192.168.43.146.8880 > 192.168.43.147.7772: UDP, length 120
01:20:44.227267 IP 192.168.43.147.8880 > 192.168.43.124.7773: UDP, length 120
01:20:44.245612 IP 192.168.43.146.8880 > 192.168.43.147.7772: UDP, length 120
01:20:44.277260 IP 192.168.43.147.8880 > 192.168.43.124.7773: UDP, length 120
01:20:44.303607 IP 192.168.43.146.8880 > 192.168.43.147.7772: UDP, length 120
01:20:44.327257 IP 192.168.43.147.8880 > 192.168.43.124.7773: UDP, length 120
01:20:44.336356 IP 192.168.43.146.8880 > 192.168.43.147.7772: UDP, length 120
01:20:44.377307 IP 192.168.43.147.8880 > 192.168.43.124.7773: UDP, length 120
01:20:44.387118 IP 192.168.43.146.8880 > 192.168.43.147.7772: UDP, length 120
01:20:44.427316 IP 192.168.43.147.8880 > 192.168.43.124.7773: UDP, length 120
01:20:44.477349 IP 192.168.43.147.8880 > 192.168.43.124.7773: UDP, length 120
01:20:44.478551 IP 192.168.43.146.8880 > 192.168.43.147.7772: UDP, length 120
01:20:44.484139 IP 192.168.43.146.8880 > 192.168.43.147.7772: UDP, length 120
01:20:44.527375 IP 192.168.43.147.8880 > 192.168.43.124.7773: UDP, length 120
01:20:44.550976 IP 192.168.43.146.8880 > 192.168.43.147.7772: UDP, length 120
01:20:44.577309 IP 192.168.43.147.8880 > 192.168.43.124.7773: UDP, length 120
01:20:44.605599 IP 192.168.43.146.8880 > 192.168.43.147.7772: UDP, length 120
01:20:44.627306 IP 192.168.43.147.8880 > 192.168.43.124.7773: UDP, length 120
01:20:44.639876 IP 192.168.43.146.8880 > 192.168.43.147.7772: UDP, length 120
01:20:44.677313 IP 192.168.43.147.8880 > 192.168.43.124.7773: UDP, length 120
01:20:44.687010 IP 192.168.43.146.8880 > 192.168.43.147.7772: UDP, length 120
01:20:44.727332 IP 192.168.43.147.8880 > 192.168.43.124.7773: UDP, length 120
01:20:44.739728 IP 192.168.43.146.8880 > 192.168.43.147.7772: UDP, length 120
01:20:44.777306 IP 192.168.43.147.8880 > 192.168.43.124.7773: UDP, length 120
01:20:44.785774 IP 192.168.43.146.8880 > 192.168.43.147.7772: UDP, length 120
01:20:44.827357 IP 192.168.43.147.8880 > 192.168.43.124.7773: UDP, length 120
01:20:44.841241 IP 192.168.43.146.8880 > 192.168.43.147.7772: UDP, length 120
01:20:44.877259 IP 192.168.43.147.8880 > 192.168.43.124.7773: UDP, length 120
01:20:44.894700 IP 192.168.43.146.8880 > 192.168.43.147.7772: UDP, length 120
01:20:44.927192 IP 192.168.43.147.8880 > 192.168.43.124.7773: UDP, length 120
01:20:44.951487 IP 192.168.43.146.8880 > 192.168.43.147.7772: UDP, length 120
01:20:44.977188 IP 192.168.43.147.8880 > 192.168.43.124.7773: UDP, length 120
01:20:45.006617 IP 192.168.43.146.8880 > 192.168.43.147.7772: UDP, length 120
01:20:45.027178 IP 192.168.43.147.8880 > 192.168.43.124.7773: UDP, length 120
01:20:45.061782 IP 192.168.43.146.8880 > 192.168.43.147.7772: UDP, length 120
01:20:45.077177 IP 192.168.43.147.8880 > 192.168.43.124.7773: UDP, length 120
01:20:45.085459 IP 192.168.43.146.8880 > 192.168.43.147.7772: UDP, length 120
01:20:45.127177 IP 192.168.43.147.8880 > 192.168.43.124.7773: UDP, length 120
01:20:45.135916 IP 192.168.43.146.8880 > 192.168.43.147.7772: UDP, length 120
01:20:45.177180 IP 192.168.43.147.8880 > 192.168.43.124.7773: UDP, length 120
01:20:45.188289 IP 192.168.43.146.8880 > 192.168.43.147.7772: UDP, length 120
01:20:45.227177 IP 192.168.43.147.8880 > 192.168.43.124.7773: UDP, length 120
01:20:45.265858 IP 192.168.43.146.8880 > 192.168.43.147.7772: UDP, length 120
01:20:45.277175 IP 192.168.43.147.8880 > 192.168.43.124.7773: UDP, length 120
01:20:45.294826 IP 192.168.43.146.8880 > 192.168.43.147.7772: UDP, length 120
01:20:45.327177 IP 192.168.43.147.8880 > 192.168.43.124.7773: UDP, length 120
01:20:45.350973 IP 192.168.43.146.8880 > 192.168.43.147.7772: UDP, length 120
01:20:45.377176 IP 192.168.43.147.8880 > 192.168.43.124.7773: UDP, length 120
01:20:45.404999 IP 192.168.43.146.8880 > 192.168.43.147.7772: UDP, length 120
01:20:45.427181 IP 192.168.43.147.8880 > 192.168.43.124.7773: UDP, length 120
01:20:45.463430 IP 192.168.43.146.8880 > 192.168.43.147.7772: UDP, length 120
01:20:45.477181 IP 192.168.43.147.8880 > 192.168.43.124.7773: UDP, length 120
01:20:45.484848 IP 192.168.43.146.8880 > 192.168.43.147.7772: UDP, length 120
01:20:45.527179 IP 192.168.43.147.8880 > 192.168.43.124.7773: UDP, length 120
01:20:45.538596 IP 192.168.43.146.8880 > 192.168.43.147.7772: UDP, length 120
01:20:45.577177 IP 192.168.43.147.8880 > 192.168.43.124.7773: UDP, length 120
01:20:45.615005 IP 192.168.43.146.8880 > 192.168.43.147.7772: UDP, length 120
01:20:45.627177 IP 192.168.43.147.8880 > 192.168.43.124.7773: UDP, length 120
01:20:45.663521 IP 192.168.43.146.8880 > 192.168.43.147.7772: UDP, length 120
01:20:45.677174 IP 192.168.43.147.8880 > 192.168.43.124.7773: UDP, length 120
01:20:45.689118 IP 192.168.43.146.8880 > 192.168.43.147.7772: UDP, length 120
01:20:45.727177 IP 192.168.43.147.8880 > 192.168.43.124.7773: UDP, length 120
01:20:45.771150 IP 192.168.43.146.8880 > 192.168.43.147.7772: UDP, length 120
01:20:45.777174 IP 192.168.43.147.8880 > 192.168.43.124.7773: UDP, length 120
01:20:45.827175 IP 192.168.43.147.8880 > 192.168.43.124.7773: UDP, length 120
01:20:45.829448 IP 192.168.43.146.8880 > 192.168.43.147.7772: UDP, length 120
01:20:45.832371 IP 192.168.43.146.8880 > 192.168.43.147.7772: UDP, length 120
01:20:45.877219 IP 192.168.43.147.8880 > 192.168.43.124.7773: UDP, length 120
01:20:45.919865 IP 192.168.43.146.8880 > 192.168.43.147.7772: UDP, length 120
01:20:45.927178 IP 192.168.43.147.8880 > 192.168.43.124.7773: UDP, length 120
01:20:45.943750 IP 192.168.43.146.8880 > 192.168.43.147.7772: UDP, length 120
01:20:45.977176 IP 192.168.43.147.8880 > 192.168.43.124.7773: UDP, length 120
01:20:46.003787 IP 192.168.43.146.8880 > 192.168.43.147.7772: UDP, length 120
01:20:46.027176 IP 192.168.43.147.8880 > 192.168.43.124.7773: UDP, length 120
01:20:46.058560 IP 192.168.43.146.8880 > 192.168.43.147.7772: UDP, length 120
01:20:46.077180 IP 192.168.43.147.8880 > 192.168.43.124.7773: UDP, length 120
01:20:46.111178 IP 192.168.43.146.8880 > 192.168.43.147.7772: UDP, length 120
01:20:46.127181 IP 192.168.43.147.8880 > 192.168.43.124.7773: UDP, length 120
01:20:46.134938 IP 192.168.43.146.8880 > 192.168.43.147.7772: UDP, length 120
01:20:46.177181 IP 192.168.43.147.8880 > 192.168.43.124.7773: UDP, length 120
01:20:46.205202 IP 192.168.43.146.8880 > 192.168.43.147.7772: UDP, length 120
01:20:46.227176 IP 192.168.43.147.8880 > 192.168.43.124.7773: UDP, length 120
01:20:46.232032 IP 192.168.43.146.8880 > 192.168.43.147.7772: UDP, length 120
01:20:46.277176 IP 192.168.43.147.8880 > 192.168.43.124.7773: UDP, length 120
01:20:46.306591 IP 192.168.43.146.8880 > 192.168.43.147.7772: UDP, length 120
01:20:46.327176 IP 192.168.43.147.8880 > 192.168.43.124.7773: UDP, length 120
01:20:46.354189 IP 192.168.43.146.8880 > 192.168.43.147.7772: UDP, length 120
01:20:46.377176 IP 192.168.43.147.8880 > 192.168.43.124.7773: UDP, length 120
01:20:46.427175 IP 192.168.43.147.8880 > 192.168.43.124.7773: UDP, length 120
01:20:46.430416 IP 192.168.43.146.8880 > 192.168.43.147.7772: UDP, length 120
01:20:46.457391 IP 192.168.43.146.8880 > 192.168.43.147.7772: UDP, length 120
01:20:46.477179 IP 192.168.43.147.8880 > 192.168.43.124.7773: UDP, length 120
01:20:46.511792 IP 192.168.43.146.8880 > 192.168.43.147.7772: UDP, length 120
01:20:46.527177 IP 192.168.43.147.8880 > 192.168.43.124.7773: UDP, length 120
01:20:46.537791 IP 192.168.43.146.8880 > 192.168.43.147.7772: UDP, length 120
01:20:46.577187 IP 192.168.43.147.8880 > 192.168.43.124.7773: UDP, length 120
01:20:46.582723 IP 192.168.43.146.8880 > 192.168.43.147.7772: UDP, length 120
01:20:46.627184 IP 192.168.43.147.8880 > 192.168.43.124.7773: UDP, length 120
01:20:46.639832 IP 192.168.43.146.8880 > 192.168.43.147.7772: UDP, length 120
01:20:46.677183 IP 192.168.43.147.8880 > 192.168.43.124.7773: UDP, length 120
01:20:46.689186 IP 192.168.43.146.8880 > 192.168.43.147.7772: UDP, length 120
01:20:46.727182 IP 192.168.43.147.8880 > 192.168.43.124.7773: UDP, length 120
01:20:46.754982 IP 192.168.43.146.8880 > 192.168.43.147.7772: UDP, length 120
01:20:46.777178 IP 192.168.43.147.8880 > 192.168.43.124.7773: UDP, length 120
01:20:46.787523 IP 192.168.43.146.8880 > 192.168.43.147.7772: UDP, length 120
01:20:46.827177 IP 192.168.43.147.8880 > 192.168.43.124.7773: UDP, length 120
01:20:46.832602 IP 192.168.43.146.8880 > 192.168.43.147.7772: UDP, length 120
01:20:46.877176 IP 192.168.43.147.8880 > 192.168.43.124.7773: UDP, length 120
01:20:46.892657 IP 192.168.43.146.8880 > 192.168.43.147.7772: UDP, length 120
01:20:46.927261 IP 192.168.43.147.8880 > 192.168.43.124.7773: UDP, length 120
01:20:46.935050 IP 192.168.43.146.8880 > 192.168.43.147.7772: UDP, length 120
01:20:46.977261 IP 192.168.43.147.8880 > 192.168.43.124.7773: UDP, length 120
01:20:46.991890 IP 192.168.43.146.8880 > 192.168.43.147.7772: UDP, length 120
01:20:47.027261 IP 192.168.43.147.8880 > 192.168.43.124.7773: UDP, length 120
01:20:47.032289 IP 192.168.43.146.8880 > 192.168.43.147.7772: UDP, length 120
01:20:47.077222 IP 192.168.43.147.8880 > 192.168.43.124.7773: UDP, length 120
01:20:47.104009 IP 192.168.43.146.8880 > 192.168.43.147.7772: UDP, length 120
01:20:47.127276 IP 192.168.43.147.8880 > 192.168.43.124.7773: UDP, length 120
01:20:47.136544 IP 192.168.43.146.8880 > 192.168.43.147.7772: UDP, length 120
01:20:47.177271 IP 192.168.43.147.8880 > 192.168.43.124.7773: UDP, length 120
01:20:47.196998 IP 192.168.43.146.8880 > 192.168.43.147.7772: UDP, length 120
01:20:47.227259 IP 192.168.43.147.8880 > 192.168.43.124.7773: UDP, length 120
01:20:47.237120 IP 192.168.43.146.8880 > 192.168.43.147.7772: UDP, length 120
01:20:47.277255 IP 192.168.43.147.8880 > 192.168.43.124.7773: UDP, length 120
01:20:47.285367 IP 192.168.43.146.8880 > 192.168.43.147.7772: UDP, length 120
01:20:47.327258 IP 192.168.43.147.8880 > 192.168.43.124.7773: UDP, length 120
01:20:47.341609 IP 192.168.43.146.8880 > 192.168.43.147.7772: UDP, length 120
01:20:47.377300 IP 192.168.43.147.8880 > 192.168.43.124.7773: UDP, length 120
01:20:47.387907 IP 192.168.43.146.8880 > 192.168.43.147.7772: UDP, length 120
01:20:47.427224 IP 192.168.43.147.8880 > 192.168.43.124.7773: UDP, length 120
01:20:47.435282 IP 192.168.43.146.8880 > 192.168.43.147.7772: UDP, length 120
01:20:47.477200 IP 192.168.43.147.8880 > 192.168.43.124.7773: UDP, length 120
01:20:47.503758 IP 192.168.43.146.8880 > 192.168.43.147.7772: UDP, length 120
01:20:47.527266 IP 192.168.43.147.8880 > 192.168.43.124.7773: UDP, length 120
01:20:47.536764 IP 192.168.43.146.8880 > 192.168.43.147.7772: UDP, length 120
01:20:47.577263 IP 192.168.43.147.8880 > 192.168.43.124.7773: UDP, length 120
01:20:47.595497 IP 192.168.43.146.8880 > 192.168.43.147.7772: UDP, length 120
01:20:47.627252 IP 192.168.43.147.8880 > 192.168.43.124.7773: UDP, length 120
01:20:47.643668 IP 192.168.43.146.8880 > 192.168.43.147.7772: UDP, length 120
01:20:47.677197 IP 192.168.43.147.8880 > 192.168.43.124.7773: UDP, length 120
01:20:47.715932 IP 192.168.43.146.8880 > 192.168.43.147.7772: UDP, length 120
01:20:47.727199 IP 192.168.43.147.8880 > 192.168.43.124.7773: UDP, length 120
01:20:47.740522 IP 192.168.43.146.8880 > 192.168.43.147.7772: UDP, length 120
01:20:47.777257 IP 192.168.43.147.8880 > 192.168.43.124.7773: UDP, length 120
01:20:47.807064 IP 192.168.43.146.8880 > 192.168.43.147.7772: UDP, length 120
01:20:47.827221 IP 192.168.43.147.8880 > 192.168.43.124.7773: UDP, length 120
01:20:47.857270 IP 192.168.43.146.8880 > 192.168.43.147.7772: UDP, length 120
01:20:47.877198 IP 192.168.43.147.8880 > 192.168.43.124.7773: UDP, length 120
01:20:47.888152 IP 192.168.43.146.8880 > 192.168.43.147.7772: UDP, length 120
01:20:47.927201 IP 192.168.43.147.8880 > 192.168.43.124.7773: UDP, length 120
01:20:47.942627 IP 192.168.43.146.8880 > 192.168.43.147.7772: UDP, length 120
01:20:47.977201 IP 192.168.43.147.8880 > 192.168.43.124.7773: UDP, length 120
01:20:47.993695 IP 192.168.43.146.8880 > 192.168.43.147.7772: UDP, length 120
01:20:48.027251 IP 192.168.43.147.8880 > 192.168.43.124.7773: UDP, length 120
01:20:48.067505 IP 192.168.43.146.8880 > 192.168.43.147.7772: UDP, length 120
01:20:48.077197 IP 192.168.43.147.8880 > 192.168.43.124.7773: UDP, length 120
01:20:48.094977 IP 192.168.43.146.8880 > 192.168.43.147.7772: UDP, length 120
01:20:48.127202 IP 192.168.43.147.8880 > 192.168.43.124.7773: UDP, length 120
01:20:48.162547 IP 192.168.43.146.8880 > 192.168.43.147.7772: UDP, length 120
01:20:48.177223 IP 192.168.43.147.8880 > 192.168.43.124.7773: UDP, length 120
01:20:48.183435 IP 192.168.43.146.8880 > 192.168.43.147.7772: UDP, length 120
01:20:48.227223 IP 192.168.43.147.8880 > 192.168.43.124.7773: UDP, length 120
01:20:48.236415 IP 192.168.43.146.8880 > 192.168.43.147.7772: UDP, length 120
01:20:48.277220 IP 192.168.43.147.8880 > 192.168.43.124.7773: UDP, length 120
01:20:48.294320 IP 192.168.43.146.8880 > 192.168.43.147.7772: UDP, length 120
01:20:48.327202 IP 192.168.43.147.8880 > 192.168.43.124.7773: UDP, length 120
01:20:48.377255 IP 192.168.43.147.8880 > 192.168.43.124.7773: UDP, length 120
01:20:48.384704 IP 192.168.43.146.8880 > 192.168.43.147.7772: UDP, length 120
01:20:48.404716 IP 192.168.43.146.8880 > 192.168.43.147.7772: UDP, length 120
01:20:48.427223 IP 192.168.43.147.8880 > 192.168.43.124.7773: UDP, length 120
01:20:48.477199 IP 192.168.43.147.8880 > 192.168.43.124.7773: UDP, length 120
01:20:48.478010 IP 192.168.43.146.8880 > 192.168.43.147.7772: UDP, length 120
01:20:48.491442 IP 192.168.43.146.8880 > 192.168.43.147.7772: UDP, length 120
01:20:48.527260 IP 192.168.43.147.8880 > 192.168.43.124.7773: UDP, length 120
01:20:48.542350 IP 192.168.43.146.8880 > 192.168.43.147.7772: UDP, length 120
01:20:48.577222 IP 192.168.43.147.8880 > 192.168.43.124.7773: UDP, length 120
01:20:48.592225 IP 192.168.43.146.8880 > 192.168.43.147.7772: UDP, length 120
01:20:48.627265 IP 192.168.43.147.8880 > 192.168.43.124.7773: UDP, length 120
01:20:48.643706 IP 192.168.43.146.8880 > 192.168.43.147.7772: UDP, length 120
01:20:48.677250 IP 192.168.43.147.8880 > 192.168.43.124.7773: UDP, length 120
01:20:48.693867 IP 192.168.43.146.8880 > 192.168.43.147.7772: UDP, length 120
01:20:48.727201 IP 192.168.43.147.8880 > 192.168.43.124.7773: UDP, length 120
01:20:48.764537 IP 192.168.43.146.8880 > 192.168.43.147.7772: UDP, length 120
01:20:48.777223 IP 192.168.43.147.8880 > 192.168.43.124.7773: UDP, length 120
01:20:48.795004 IP 192.168.43.146.8880 > 192.168.43.147.7772: UDP, length 120
01:20:48.827253 IP 192.168.43.147.8880 > 192.168.43.124.7773: UDP, length 120
01:20:48.846051 IP 192.168.43.146.8880 > 192.168.43.147.7772: UDP, length 120
01:20:48.877289 IP 192.168.43.147.8880 > 192.168.43.124.7773: UDP, length 120
01:20:48.896823 IP 192.168.43.146.8880 > 192.168.43.147.7772: UDP, length 120
01:20:48.927219 IP 192.168.43.147.8880 > 192.168.43.124.7773: UDP, length 120
01:20:48.951455 IP 192.168.43.146.8880 > 192.168.43.147.7772: UDP, length 120
01:20:48.977220 IP 192.168.43.147.8880 > 192.168.43.124.7773: UDP, length 120
01:20:49.002403 IP 192.168.43.146.8880 > 192.168.43.147.7772: UDP, length 120
01:20:49.027201 IP 192.168.43.147.8880 > 192.168.43.124.7773: UDP, length 120
01:20:49.053568 IP 192.168.43.146.8880 > 192.168.43.147.7772: UDP, length 120
01:20:49.077201 IP 192.168.43.147.8880 > 192.168.43.124.7773: UDP, length 120
01:20:49.084630 IP 192.168.43.146.8880 > 192.168.43.147.7772: UDP, length 120
01:20:49.127200 IP 192.168.43.147.8880 > 192.168.43.124.7773: UDP, length 120
01:20:49.141068 IP 192.168.43.146.8880 > 192.168.43.147.7772: UDP, length 120
01:20:49.177279 IP 192.168.43.147.8880 > 192.168.43.124.7773: UDP, length 120
01:20:49.192916 IP 192.168.43.146.8880 > 192.168.43.147.7772: UDP, length 120
01:20:49.227246 IP 192.168.43.147.8880 > 192.168.43.124.7773: UDP, length 120
01:20:49.247159 IP 192.168.43.146.8880 > 192.168.43.147.7772: UDP, length 120
01:20:49.277220 IP 192.168.43.147.8880 > 192.168.43.124.7773: UDP, length 120
01:20:49.294407 IP 192.168.43.146.8880 > 192.168.43.147.7772: UDP, length 120
01:20:49.327202 IP 192.168.43.147.8880 > 192.168.43.124.7773: UDP, length 120
01:20:49.353043 IP 192.168.43.146.8880 > 192.168.43.147.7772: UDP, length 120
01:20:49.377201 IP 192.168.43.147.8880 > 192.168.43.124.7773: UDP, length 120
01:20:49.393409 IP 192.168.43.146.8880 > 192.168.43.147.7772: UDP, length 120
01:20:49.427202 IP 192.168.43.147.8880 > 192.168.43.124.7773: UDP, length 120
01:20:49.444300 IP 192.168.43.146.8880 > 192.168.43.147.7772: UDP, length 120
01:20:49.477201 IP 192.168.43.147.8880 > 192.168.43.124.7773: UDP, length 120
01:20:49.500405 IP 192.168.43.146.8880 > 192.168.43.147.7772: UDP, length 120
01:20:49.527201 IP 192.168.43.147.8880 > 192.168.43.124.7773: UDP, length 120
01:20:49.546255 IP 192.168.43.146.8880 > 192.168.43.147.7772: UDP, length 120
01:20:49.577201 IP 192.168.43.147.8880 > 192.168.43.124.7773: UDP, length 120
01:20:49.600700 IP 192.168.43.146.8880 > 192.168.43.147.7772: UDP, length 120
01:20:49.627223 IP 192.168.43.147.8880 > 192.168.43.124.7773: UDP, length 120
01:20:49.677201 IP 192.168.43.147.8880 > 192.168.43.124.7773: UDP, length 120
01:20:49.694443 IP 192.168.43.146.8880 > 192.168.43.147.7772: UDP, length 120
01:20:49.717794 IP 192.168.43.146.8880 > 192.168.43.147.7772: UDP, length 120
01:20:49.727260 IP 192.168.43.147.8880 > 192.168.43.124.7773: UDP, length 120
01:20:49.744244 IP 192.168.43.146.8880 > 192.168.43.147.7772: UDP, length 120
01:20:49.777255 IP 192.168.43.147.8880 > 192.168.43.124.7773: UDP, length 120
01:20:49.785361 IP 192.168.43.146.8880 > 192.168.43.147.7772: UDP, length 120
01:20:49.827223 IP 192.168.43.147.8880 > 192.168.43.124.7773: UDP, length 120
01:20:49.837696 IP 192.168.43.146.8880 > 192.168.43.147.7772: UDP, length 120
01:20:49.877328 IP 192.168.43.147.8880 > 192.168.43.124.7773: UDP, length 120
01:20:49.888845 IP 192.168.43.146.8880 > 192.168.43.147.7772: UDP, length 120
01:20:49.927363 IP 192.168.43.147.8880 > 192.168.43.124.7773: UDP, length 120
01:20:49.955225 IP 192.168.43.146.8880 > 192.168.43.147.7772: UDP, length 120
01:20:49.977400 IP 192.168.43.147.8880 > 192.168.43.124.7773: UDP, length 120
01:20:49.990636 IP 192.168.43.146.8880 > 192.168.43.147.7772: UDP, length 120
01:20:50.027423 IP 192.168.43.147.8880 > 192.168.43.124.7773: UDP, length 120
01:20:50.040879 IP 192.168.43.146.8880 > 192.168.43.147.7772: UDP, length 120
01:20:50.077338 IP 192.168.43.147.8880 > 192.168.43.124.7773: UDP, length 120
01:20:50.092896 IP 192.168.43.146.8880 > 192.168.43.147.7772: UDP, length 120
01:20:50.127313 IP 192.168.43.147.8880 > 192.168.43.124.7773: UDP, length 120
01:20:50.145730 IP 192.168.43.146.8880 > 192.168.43.147.7772: UDP, length 120
01:20:50.177361 IP 192.168.43.147.8880 > 192.168.43.124.7773: UDP, length 120
01:20:50.195253 IP 192.168.43.146.8880 > 192.168.43.147.7772: UDP, length 120
01:20:50.227314 IP 192.168.43.147.8880 > 192.168.43.124.7773: UDP, length 120
01:20:50.243281 IP 192.168.43.146.8880 > 192.168.43.147.7772: UDP, length 120
01:20:50.277380 IP 192.168.43.147.8880 > 192.168.43.124.7773: UDP, length 120
01:20:50.294319 IP 192.168.43.146.8880 > 192.168.43.147.7772: UDP, length 120
01:20:50.327329 IP 192.168.43.147.8880 > 192.168.43.124.7773: UDP, length 120
01:20:50.344772 IP 192.168.43.146.8880 > 192.168.43.147.7772: UDP, length 120
01:20:50.377250 IP 192.168.43.147.8880 > 192.168.43.124.7773: UDP, length 120
01:20:50.396230 IP 192.168.43.146.8880 > 192.168.43.147.7772: UDP, length 120
01:20:50.427181 IP 192.168.43.147.8880 > 192.168.43.124.7773: UDP, length 120
01:20:50.446078 IP 192.168.43.146.8880 > 192.168.43.147.7772: UDP, length 120
01:20:50.477176 IP 192.168.43.147.8880 > 192.168.43.124.7773: UDP, length 120
01:20:50.502312 IP 192.168.43.146.8880 > 192.168.43.147.7772: UDP, length 120
01:20:50.527176 IP 192.168.43.147.8880 > 192.168.43.124.7773: UDP, length 120
01:20:50.546855 IP 192.168.43.146.8880 > 192.168.43.147.7772: UDP, length 120
01:20:50.577175 IP 192.168.43.147.8880 > 192.168.43.124.7773: UDP, length 120
01:20:50.604083 IP 192.168.43.146.8880 > 192.168.43.147.7772: UDP, length 120
01:20:50.627178 IP 192.168.43.147.8880 > 192.168.43.124.7773: UDP, length 120
01:20:50.652307 IP 192.168.43.146.8880 > 192.168.43.147.7772: UDP, length 120
01:20:50.677174 IP 192.168.43.147.8880 > 192.168.43.124.7773: UDP, length 120
01:20:50.706482 IP 192.168.43.146.8880 > 192.168.43.147.7772: UDP, length 120
01:20:50.727178 IP 192.168.43.147.8880 > 192.168.43.124.7773: UDP, length 120
01:20:50.753493 IP 192.168.43.146.8880 > 192.168.43.147.7772: UDP, length 120
01:20:50.777190 IP 192.168.43.147.8880 > 192.168.43.124.7773: UDP, length 120
01:20:50.804643 IP 192.168.43.146.8880 > 192.168.43.147.7772: UDP, length 120
01:20:50.827189 IP 192.168.43.147.8880 > 192.168.43.124.7773: UDP, length 120
01:20:50.834906 IP 192.168.43.146.8880 > 192.168.43.147.7772: UDP, length 120
01:20:50.877197 IP 192.168.43.147.8880 > 192.168.43.124.7773: UDP, length 120
01:20:50.883066 IP 192.168.43.146.8880 > 192.168.43.147.7772: UDP, length 120
01:20:50.927182 IP 192.168.43.147.8880 > 192.168.43.124.7773: UDP, length 120
01:20:50.936940 IP 192.168.43.146.8880 > 192.168.43.147.7772: UDP, length 120
01:20:50.977177 IP 192.168.43.147.8880 > 192.168.43.124.7773: UDP, length 120
01:20:50.985461 IP 192.168.43.146.8880 > 192.168.43.147.7772: UDP, length 120
01:20:51.027177 IP 192.168.43.147.8880 > 192.168.43.124.7773: UDP, length 120
01:20:51.037263 IP 192.168.43.146.8880 > 192.168.43.147.7772: UDP, length 120
01:20:51.077180 IP 192.168.43.147.8880 > 192.168.43.124.7773: UDP, length 120
01:20:51.083007 IP 192.168.43.146.8880 > 192.168.43.147.7772: UDP, length 120
01:20:51.127175 IP 192.168.43.147.8880 > 192.168.43.124.7773: UDP, length 120
01:20:51.133011 IP 192.168.43.146.8880 > 192.168.43.147.7772: UDP, length 120
01:20:51.177178 IP 192.168.43.147.8880 > 192.168.43.124.7773: UDP, length 120
01:20:51.184407 IP 192.168.43.146.8880 > 192.168.43.147.7772: UDP, length 120
01:20:51.227179 IP 192.168.43.147.8880 > 192.168.43.124.7773: UDP, length 120
01:20:51.233181 IP 192.168.43.146.8880 > 192.168.43.147.7772: UDP, length 120
01:20:51.277175 IP 192.168.43.147.8880 > 192.168.43.124.7773: UDP, length 120
01:20:51.290715 IP 192.168.43.146.8880 > 192.168.43.147.7772: UDP, length 120
01:20:51.327174 IP 192.168.43.147.8880 > 192.168.43.124.7773: UDP, length 120
01:20:51.343429 IP 192.168.43.146.8880 > 192.168.43.147.7772: UDP, length 120
01:20:51.377173 IP 192.168.43.147.8880 > 192.168.43.124.7773: UDP, length 120
01:20:51.391167 IP 192.168.43.146.8880 > 192.168.43.147.7772: UDP, length 120
01:20:51.427174 IP 192.168.43.147.8880 > 192.168.43.124.7773: UDP, length 120
01:20:51.445022 IP 192.168.43.146.8880 > 192.168.43.147.7772: UDP, length 120
01:20:51.477174 IP 192.168.43.147.8880 > 192.168.43.124.7773: UDP, length 120
01:20:51.512735 IP 192.168.43.146.8880 > 192.168.43.147.7772: UDP, length 120
01:20:51.527173 IP 192.168.43.147.8880 > 192.168.43.124.7773: UDP, length 120
01:20:51.537274 IP 192.168.43.146.8880 > 192.168.43.147.7772: UDP, length 120
01:20:51.577175 IP 192.168.43.147.8880 > 192.168.43.124.7773: UDP, length 120
01:20:51.586259 IP 192.168.43.146.8880 > 192.168.43.147.7772: UDP, length 120
01:20:51.627175 IP 192.168.43.147.8880 > 192.168.43.124.7773: UDP, length 120
01:20:51.632750 IP 192.168.43.146.8880 > 192.168.43.147.7772: UDP, length 120
01:20:51.677176 IP 192.168.43.147.8880 > 192.168.43.124.7773: UDP, length 120
01:20:51.682922 IP 192.168.43.146.8880 > 192.168.43.147.7772: UDP, length 120
01:20:51.727175 IP 192.168.43.147.8880 > 192.168.43.124.7773: UDP, length 120
01:20:51.732585 IP 192.168.43.146.8880 > 192.168.43.147.7772: UDP, length 120
01:20:51.777176 IP 192.168.43.147.8880 > 192.168.43.124.7773: UDP, length 120
01:20:51.782253 IP 192.168.43.146.8880 > 192.168.43.147.7772: UDP, length 120
01:20:51.827187 IP 192.168.43.147.8880 > 192.168.43.124.7773: UDP, length 120
01:20:51.833980 IP 192.168.43.146.8880 > 192.168.43.147.7772: UDP, length 120
01:20:51.877240 IP 192.168.43.147.8880 > 192.168.43.124.7773: UDP, length 120
01:20:51.884148 IP 192.168.43.146.8880 > 192.168.43.147.7772: UDP, length 120
01:20:51.927247 IP 192.168.43.147.8880 > 192.168.43.124.7773: UDP, length 120
01:20:51.935944 IP 192.168.43.146.8880 > 192.168.43.147.7772: UDP, length 120
01:20:51.977219 IP 192.168.43.147.8880 > 192.168.43.124.7773: UDP, length 120
01:20:51.983112 IP 192.168.43.146.8880 > 192.168.43.147.7772: UDP, length 120
01:20:52.027221 IP 192.168.43.147.8880 > 192.168.43.124.7773: UDP, length 120
01:20:52.042557 IP 192.168.43.146.8880 > 192.168.43.147.7772: UDP, length 120
01:20:52.077217 IP 192.168.43.147.8880 > 192.168.43.124.7773: UDP, length 120
01:20:52.093397 IP 192.168.43.146.8880 > 192.168.43.147.7772: UDP, length 120
01:20:52.127201 IP 192.168.43.147.8880 > 192.168.43.124.7773: UDP, length 120
01:20:52.144443 IP 192.168.43.146.8880 > 192.168.43.147.7772: UDP, length 120
01:20:52.177221 IP 192.168.43.147.8880 > 192.168.43.124.7773: UDP, length 120
01:20:52.208819 IP 192.168.43.146.8880 > 192.168.43.147.7772: UDP, length 120
01:20:52.227199 IP 192.168.43.147.8880 > 192.168.43.124.7773: UDP, length 120
01:20:52.232563 IP 192.168.43.146.8880 > 192.168.43.147.7772: UDP, length 120
01:20:52.277216 IP 192.168.43.147.8880 > 192.168.43.124.7773: UDP, length 120
01:20:52.283018 IP 192.168.43.146.8880 > 192.168.43.147.7772: UDP, length 120
01:20:52.327222 IP 192.168.43.147.8880 > 192.168.43.124.7773: UDP, length 120
01:20:52.332595 IP 192.168.43.146.8880 > 192.168.43.147.7772: UDP, length 120
01:20:52.377217 IP 192.168.43.147.8880 > 192.168.43.124.7773: UDP, length 120
01:20:52.382445 IP 192.168.43.146.8880 > 192.168.43.147.7772: UDP, length 120
01:20:52.427217 IP 192.168.43.147.8880 > 192.168.43.124.7773: UDP, length 120
01:20:52.439804 IP 192.168.43.146.8880 > 192.168.43.147.7772: UDP, length 120
01:20:52.477201 IP 192.168.43.147.8880 > 192.168.43.124.7773: UDP, length 120
01:20:52.494586 IP 192.168.43.146.8880 > 192.168.43.147.7772: UDP, length 120
01:20:52.527221 IP 192.168.43.147.8880 > 192.168.43.124.7773: UDP, length 120
01:20:52.547569 IP 192.168.43.146.8880 > 192.168.43.147.7772: UDP, length 120
01:20:52.577202 IP 192.168.43.147.8880 > 192.168.43.124.7773: UDP, length 120
01:20:52.602676 IP 192.168.43.146.8880 > 192.168.43.147.7772: UDP, length 120
01:20:52.627220 IP 192.168.43.147.8880 > 192.168.43.124.7773: UDP, length 120
01:20:52.657032 IP 192.168.43.146.8880 > 192.168.43.147.7772: UDP, length 120
01:20:52.677197 IP 192.168.43.147.8880 > 192.168.43.124.7773: UDP, length 120
01:20:52.685814 IP 192.168.43.146.8880 > 192.168.43.147.7772: UDP, length 120
01:20:52.727249 IP 192.168.43.147.8880 > 192.168.43.124.7773: UDP, length 120
01:20:52.738568 IP 192.168.43.146.8880 > 192.168.43.147.7772: UDP, length 120
01:20:52.777250 IP 192.168.43.147.8880 > 192.168.43.124.7773: UDP, length 120
01:20:52.827221 IP 192.168.43.147.8880 > 192.168.43.124.7773: UDP, length 120
01:20:52.830203 IP 192.168.43.146.8880 > 192.168.43.147.7772: UDP, length 120
01:20:52.860140 IP 192.168.43.146.8880 > 192.168.43.147.7772: UDP, length 120
01:20:52.877266 IP 192.168.43.147.8880 > 192.168.43.124.7773: UDP, length 120
01:20:52.893964 IP 192.168.43.146.8880 > 192.168.43.147.7772: UDP, length 120
01:20:52.927255 IP 192.168.43.147.8880 > 192.168.43.124.7773: UDP, length 120
01:20:52.963299 IP 192.168.43.146.8880 > 192.168.43.147.7772: UDP, length 120
01:20:52.977219 IP 192.168.43.147.8880 > 192.168.43.124.7773: UDP, length 120
01:20:53.002654 IP 192.168.43.146.8880 > 192.168.43.147.7772: UDP, length 120
01:20:53.027223 IP 192.168.43.147.8880 > 192.168.43.124.7773: UDP, length 120
01:20:53.061642 IP 192.168.43.146.8880 > 192.168.43.147.7772: UDP, length 120
01:20:53.077256 IP 192.168.43.147.8880 > 192.168.43.124.7773: UDP, length 120
01:20:53.087953 IP 192.168.43.146.8880 > 192.168.43.147.7772: UDP, length 120
01:20:53.127259 IP 192.168.43.147.8880 > 192.168.43.124.7773: UDP, length 120
01:20:53.136899 IP 192.168.43.146.8880 > 192.168.43.147.7772: UDP, length 120
01:20:53.177273 IP 192.168.43.147.8880 > 192.168.43.124.7773: UDP, length 120
01:20:53.189697 IP 192.168.43.146.8880 > 192.168.43.147.7772: UDP, length 120
01:20:53.227269 IP 192.168.43.147.8880 > 192.168.43.124.7773: UDP, length 120
01:20:53.256004 IP 192.168.43.146.8880 > 192.168.43.147.7772: UDP, length 120
01:20:53.277262 IP 192.168.43.147.8880 > 192.168.43.124.7773: UDP, length 120
01:20:53.297000 IP 192.168.43.146.8880 > 192.168.43.147.7772: UDP, length 120
01:20:53.327259 IP 192.168.43.147.8880 > 192.168.43.124.7773: UDP, length 120
01:20:53.369344 IP 192.168.43.146.8880 > 192.168.43.147.7772: UDP, length 120
01:20:53.377302 IP 192.168.43.147.8880 > 192.168.43.124.7773: UDP, length 120
01:20:53.385464 IP 192.168.43.146.8880 > 192.168.43.147.7772: UDP, length 120
01:20:53.427265 IP 192.168.43.147.8880 > 192.168.43.124.7773: UDP, length 120
01:20:53.458391 IP 192.168.43.146.8880 > 192.168.43.147.7772: UDP, length 120
01:20:53.477219 IP 192.168.43.147.8880 > 192.168.43.124.7773: UDP, length 120
01:20:53.503878 IP 192.168.43.146.8880 > 192.168.43.147.7772: UDP, length 120
01:20:53.527265 IP 192.168.43.147.8880 > 192.168.43.124.7773: UDP, length 120
01:20:53.555312 IP 192.168.43.146.8880 > 192.168.43.147.7772: UDP, length 120
01:20:53.577233 IP 192.168.43.147.8880 > 192.168.43.124.7773: UDP, length 120
01:20:53.615750 IP 192.168.43.146.8880 > 192.168.43.147.7772: UDP, length 120
01:20:53.627263 IP 192.168.43.147.8880 > 192.168.43.124.7773: UDP, length 120
01:20:53.677260 IP 192.168.43.147.8880 > 192.168.43.124.7773: UDP, length 120
01:20:53.689974 IP 192.168.43.146.8880 > 192.168.43.147.7772: UDP, length 120
01:20:53.690739 IP 192.168.43.146.8880 > 192.168.43.147.7772: UDP, length 120
01:20:53.727250 IP 192.168.43.147.8880 > 192.168.43.124.7773: UDP, length 120
01:20:53.738872 IP 192.168.43.146.8880 > 192.168.43.147.7772: UDP, length 120
01:20:53.777274 IP 192.168.43.147.8880 > 192.168.43.124.7773: UDP, length 120
01:20:53.784229 IP 192.168.43.146.8880 > 192.168.43.147.7772: UDP, length 120
01:20:53.827275 IP 192.168.43.147.8880 > 192.168.43.124.7773: UDP, length 120
01:20:53.853934 IP 192.168.43.146.8880 > 192.168.43.147.7772: UDP, length 120
01:20:53.877257 IP 192.168.43.147.8880 > 192.168.43.124.7773: UDP, length 120
01:20:53.927261 IP 192.168.43.147.8880 > 192.168.43.124.7773: UDP, length 120
01:20:53.930969 IP 192.168.43.146.8880 > 192.168.43.147.7772: UDP, length 120
01:20:53.934210 IP 192.168.43.146.8880 > 192.168.43.147.7772: UDP, length 120
01:20:53.977263 IP 192.168.43.147.8880 > 192.168.43.124.7773: UDP, length 120
01:20:54.017452 IP 192.168.43.146.8880 > 192.168.43.147.7772: UDP, length 120
01:20:54.027225 IP 192.168.43.147.8880 > 192.168.43.124.7773: UDP, length 120
01:20:54.041928 IP 192.168.43.146.8880 > 192.168.43.147.7772: UDP, length 120
01:20:54.077224 IP 192.168.43.147.8880 > 192.168.43.124.7773: UDP, length 120
01:20:54.111615 IP 192.168.43.146.8880 > 192.168.43.147.7772: UDP, length 120
01:20:54.127252 IP 192.168.43.147.8880 > 192.168.43.124.7773: UDP, length 120
01:20:54.138069 IP 192.168.43.146.8880 > 192.168.43.147.7772: UDP, length 120
01:20:54.177289 IP 192.168.43.147.8880 > 192.168.43.124.7773: UDP, length 120
01:20:54.214701 IP 192.168.43.146.8880 > 192.168.43.147.7772: UDP, length 120
01:20:54.227257 IP 192.168.43.147.8880 > 192.168.43.124.7773: UDP, length 120
01:20:54.259141 IP 192.168.43.146.8880 > 192.168.43.147.7772: UDP, length 120
01:20:54.277217 IP 192.168.43.147.8880 > 192.168.43.124.7773: UDP, length 120
01:20:54.327220 IP 192.168.43.147.8880 > 192.168.43.124.7773: UDP, length 120
01:20:54.332306 IP 192.168.43.146.8880 > 192.168.43.147.7772: UDP, length 120
01:20:54.355154 IP 192.168.43.146.8880 > 192.168.43.147.7772: UDP, length 120
01:20:54.377222 IP 192.168.43.147.8880 > 192.168.43.124.7773: UDP, length 120
01:20:54.411192 IP 192.168.43.146.8880 > 192.168.43.147.7772: UDP, length 120
01:20:54.427219 IP 192.168.43.147.8880 > 192.168.43.124.7773: UDP, length 120
01:20:54.477268 IP 192.168.43.147.8880 > 192.168.43.124.7773: UDP, length 120
01:20:54.484812 IP 192.168.43.146.8880 > 192.168.43.147.7772: UDP, length 120
01:20:54.500995 IP 192.168.43.146.8880 > 192.168.43.147.7772: UDP, length 120
01:20:54.527223 IP 192.168.43.147.8880 > 192.168.43.124.7773: UDP, length 120
01:20:54.572839 IP 192.168.43.146.8880 > 192.168.43.147.7772: UDP, length 120
01:20:54.577226 IP 192.168.43.147.8880 > 192.168.43.124.7773: UDP, length 120
01:20:54.617353 IP 192.168.43.146.8880 > 192.168.43.147.7772: UDP, length 120
01:20:54.627287 IP 192.168.43.147.8880 > 192.168.43.124.7773: UDP, length 120
01:20:54.651175 IP 192.168.43.146.8880 > 192.168.43.147.7772: UDP, length 120
01:20:54.677222 IP 192.168.43.147.8880 > 192.168.43.124.7773: UDP, length 120
01:20:54.727258 IP 192.168.43.147.8880 > 192.168.43.124.7773: UDP, length 120
01:20:54.729108 IP 192.168.43.146.8880 > 192.168.43.147.7772: UDP, length 120
01:20:54.736890 IP 192.168.43.146.8880 > 192.168.43.147.7772: UDP, length 120
01:20:54.777223 IP 192.168.43.147.8880 > 192.168.43.124.7773: UDP, length 120
01:20:54.827218 IP 192.168.43.147.8880 > 192.168.43.124.7773: UDP, length 120
01:20:54.827409 IP 192.168.43.146.8880 > 192.168.43.147.7772: UDP, length 120
01:20:54.877324 IP 192.168.43.147.8880 > 192.168.43.124.7773: UDP, length 120
01:20:54.881332 IP 192.168.43.146.8880 > 192.168.43.147.7772: UDP, length 120
01:20:54.910958 IP 192.168.43.146.8880 > 192.168.43.147.7772: UDP, length 120
01:20:54.927261 IP 192.168.43.147.8880 > 192.168.43.124.7773: UDP, length 120
01:20:54.963743 IP 192.168.43.146.8880 > 192.168.43.147.7772: UDP, length 120
01:20:54.977275 IP 192.168.43.147.8880 > 192.168.43.124.7773: UDP, length 120
01:20:54.993778 IP 192.168.43.146.8880 > 192.168.43.147.7772: UDP, length 120
01:20:55.027254 IP 192.168.43.147.8880 > 192.168.43.124.7773: UDP, length 120
01:20:55.045096 IP 192.168.43.146.8880 > 192.168.43.147.7772: UDP, length 120
01:20:55.077223 IP 192.168.43.147.8880 > 192.168.43.124.7773: UDP, length 120
01:20:55.126582 IP 192.168.43.146.8880 > 192.168.43.147.7772: UDP, length 120
01:20:55.127201 IP 192.168.43.147.8880 > 192.168.43.124.7773: UDP, length 120
01:20:55.133336 IP 192.168.43.146.8880 > 192.168.43.147.7772: UDP, length 120
01:20:55.177271 IP 192.168.43.147.8880 > 192.168.43.124.7773: UDP, length 120
01:20:55.203555 IP 192.168.43.146.8880 > 192.168.43.147.7772: UDP, length 120
01:20:55.227222 IP 192.168.43.147.8880 > 192.168.43.124.7773: UDP, length 120
01:20:55.241624 IP 192.168.43.146.8880 > 192.168.43.147.7772: UDP, length 120
01:20:55.277217 IP 192.168.43.147.8880 > 192.168.43.124.7773: UDP, length 120
01:20:55.302431 IP 192.168.43.146.8880 > 192.168.43.147.7772: UDP, length 120
01:20:55.327201 IP 192.168.43.147.8880 > 192.168.43.124.7773: UDP, length 120
01:20:55.358836 IP 192.168.43.146.8880 > 192.168.43.147.7772: UDP, length 120
01:20:55.377560 IP 192.168.43.147.8880 > 192.168.43.124.7773: UDP, length 120
01:20:55.388684 IP 192.168.43.146.8880 > 192.168.43.147.7772: UDP, length 120
01:20:55.427428 IP 192.168.43.147.8880 > 192.168.43.124.7773: UDP, length 120
01:20:55.440900 IP 192.168.43.146.8880 > 192.168.43.147.7772: UDP, length 120
01:20:55.477384 IP 192.168.43.147.8880 > 192.168.43.124.7773: UDP, length 120
01:20:55.519708 IP 192.168.43.146.8880 > 192.168.43.147.7772: UDP, length 120
01:20:55.527296 IP 192.168.43.147.8880 > 192.168.43.124.7773: UDP, length 120
01:20:55.541385 IP 192.168.43.146.8880 > 192.168.43.147.7772: UDP, length 120
01:20:55.577325 IP 192.168.43.147.8880 > 192.168.43.124.7773: UDP, length 120
01:20:55.594996 IP 192.168.43.146.8880 > 192.168.43.147.7772: UDP, length 120
01:20:55.627381 IP 192.168.43.147.8880 > 192.168.43.124.7773: UDP, length 120
01:20:55.644413 IP 192.168.43.146.8880 > 192.168.43.147.7772: UDP, length 120
01:20:55.677309 IP 192.168.43.147.8880 > 192.168.43.124.7773: UDP, length 120
01:20:55.683984 IP 192.168.43.146.8880 > 192.168.43.147.7772: UDP, length 120
01:20:55.727407 IP 192.168.43.147.8880 > 192.168.43.124.7773: UDP, length 120
01:20:55.757476 IP 192.168.43.146.8880 > 192.168.43.147.7772: UDP, length 120
01:20:55.777311 IP 192.168.43.147.8880 > 192.168.43.124.7773: UDP, length 120
01:20:55.827269 IP 192.168.43.147.8880 > 192.168.43.124.7773: UDP, length 120
01:20:55.830556 IP 192.168.43.146.8880 > 192.168.43.147.7772: UDP, length 120
01:20:55.851443 IP 192.168.43.146.8880 > 192.168.43.147.7772: UDP, length 120
01:20:55.877194 IP 192.168.43.147.8880 > 192.168.43.124.7773: UDP, length 120
