00:42:16.719106 IP 192.168.43.124.8880 > 192.168.43.146.7771: UDP, length 120
00:42:16.760804 IP 192.168.43.124.8880 > 192.168.43.146.7771: UDP, length 120
00:42:16.811017 IP 192.168.43.124.8880 > 192.168.43.146.7771: UDP, length 120
00:42:16.860819 IP 192.168.43.124.8880 > 192.168.43.146.7771: UDP, length 120
00:42:16.907126 IP 192.168.43.124.8880 > 192.168.43.146.7771: UDP, length 120
00:42:16.960514 IP 192.168.43.124.8880 > 192.168.43.146.7771: UDP, length 120
00:42:17.010796 IP 192.168.43.124.8880 > 192.168.43.146.7771: UDP, length 120
00:42:17.061687 IP 192.168.43.124.8880 > 192.168.43.146.7771: UDP, length 120
00:42:17.107974 IP 192.168.43.124.8880 > 192.168.43.146.7771: UDP, length 120
00:42:17.160746 IP 192.168.43.124.8880 > 192.168.43.146.7771: UDP, length 120
00:42:17.210860 IP 192.168.43.124.8880 > 192.168.43.146.7771: UDP, length 120
00:42:17.263170 IP 192.168.43.124.8880 > 192.168.43.146.7771: UDP, length 120
00:42:17.310829 IP 192.168.43.124.8880 > 192.168.43.146.7771: UDP, length 120
00:42:17.361765 IP 192.168.43.124.8880 > 192.168.43.146.7771: UDP, length 120
00:42:17.411885 IP 192.168.43.124.8880 > 192.168.43.146.7771: UDP, length 120
00:42:17.461777 IP 192.168.43.124.8880 > 192.168.43.146.7771: UDP, length 120
00:42:17.509007 IP 192.168.43.124.8880 > 192.168.43.146.7771: UDP, length 120
00:42:17.531498 IP 192.168.43.146.8880 > 192.168.43.147.7772: UDP, length 120
00:42:17.559043 IP 192.168.43.124.8880 > 192.168.43.146.7771: UDP, length 120
00:42:17.581538 IP 192.168.43.146.8880 > 192.168.43.147.7772: UDP, length 120
00:42:17.608689 IP 192.168.43.124.8880 > 192.168.43.146.7771: UDP, length 120
00:42:17.631556 IP 192.168.43.146.8880 > 192.168.43.147.7772: UDP, length 120
00:42:17.662137 IP 192.168.43.124.8880 > 192.168.43.146.7771: UDP, length 120
00:42:17.681548 IP 192.168.43.146.8880 > 192.168.43.147.7772: UDP, length 120
00:42:17.712645 IP 192.168.43.124.8880 > 192.168.43.146.7771: UDP, length 120
00:42:17.731545 IP 192.168.43.146.8880 > 192.168.43.147.7772: UDP, length 120
00:42:17.761172 IP 192.168.43.124.8880 > 192.168.43.146.7771: UDP, length 120
00:42:17.781545 IP 192.168.43.146.8880 > 192.168.43.147.7772: UDP, length 120
00:42:17.812633 IP 192.168.43.124.8880 > 192.168.43.146.7771: UDP, length 120
00:42:17.831543 IP 192.168.43.146.8880 > 192.168.43.147.7772: UDP, length 120
00:42:17.862479 IP 192.168.43.124.8880 > 192.168.43.146.7771: UDP, length 120
00:42:17.881545 IP 192.168.43.146.8880 > 192.168.43.147.7772: UDP, length 120
00:42:17.911590 IP 192.168.43.124.8880 > 192.168.43.146.7771: UDP, length 120
00:42:17.931546 IP 192.168.43.146.8880 > 192.168.43.147.7772: UDP, length 120
00:42:17.963120 IP 192.168.43.124.8880 > 192.168.43.146.7771: UDP, length 120
00:42:17.981548 IP 192.168.43.146.8880 > 192.168.43.147.7772: UDP, length 120
00:42:18.011099 IP 192.168.43.124.8880 > 192.168.43.146.7771: UDP, length 120
00:42:18.031599 IP 192.168.43.146.8880 > 192.168.43.147.7772: UDP, length 120
00:42:18.061134 IP 192.168.43.124.8880 > 192.168.43.146.7771: UDP, length 120
00:42:18.081573 IP 192.168.43.146.8880 > 192.168.43.147.7772: UDP, length 120
00:42:18.112546 IP 192.168.43.124.8880 > 192.168.43.146.7771: UDP, length 120
00:42:18.131545 IP 192.168.43.146.8880 > 192.168.43.147.7772: UDP, length 120
00:42:18.161144 IP 192.168.43.124.8880 > 192.168.43.146.7771: UDP, length 120
00:42:18.181545 IP 192.168.43.146.8880 > 192.168.43.147.7772: UDP, length 120
00:42:18.212530 IP 192.168.43.124.8880 > 192.168.43.146.7771: UDP, length 120
00:42:18.231541 IP 192.168.43.146.8880 > 192.168.43.147.7772: UDP, length 120
00:42:18.262782 IP 192.168.43.124.8880 > 192.168.43.146.7771: UDP, length 120
00:42:18.281543 IP 192.168.43.146.8880 > 192.168.43.147.7772: UDP, length 120
00:42:18.312525 IP 192.168.43.124.8880 > 192.168.43.146.7771: UDP, length 120
00:42:18.331542 IP 192.168.43.146.8880 > 192.168.43.147.7772: UDP, length 120
00:42:18.362885 IP 192.168.43.124.8880 > 192.168.43.146.7771: UDP, length 120
00:42:18.381542 IP 192.168.43.146.8880 > 192.168.43.147.7772: UDP, length 120
00:42:18.411818 IP 192.168.43.124.8880 > 192.168.43.146.7771: UDP, length 120
00:42:18.431541 IP 192.168.43.146.8880 > 192.168.43.147.7772: UDP, length 120
00:42:18.461213 IP 192.168.43.124.8880 > 192.168.43.146.7771: UDP, length 120
00:42:18.481544 IP 192.168.43.146.8880 > 192.168.43.147.7772: UDP, length 120
00:42:18.514135 IP 192.168.43.124.8880 > 192.168.43.146.7771: UDP, length 120
00:42:18.531540 IP 192.168.43.146.8880 > 192.168.43.147.7772: UDP, length 120
00:42:18.562004 IP 192.168.43.124.8880 > 192.168.43.146.7771: UDP, length 120
00:42:18.581638 IP 192.168.43.146.8880 > 192.168.43.147.7772: UDP, length 120
00:42:18.612009 IP 192.168.43.124.8880 > 192.168.43.146.7771: UDP, length 120
00:42:18.631651 IP 192.168.43.146.8880 > 192.168.43.147.7772: UDP, length 120
00:42:18.661964 IP 192.168.43.124.8880 > 192.168.43.146.7771: UDP, length 120
00:42:18.681642 IP 192.168.43.146.8880 > 192.168.43.147.7772: UDP, length 120
00:42:18.710619 IP 192.168.43.124.8880 > 192.168.43.146.7771: UDP, length 120
00:42:18.731578 IP 192.168.43.146.8880 > 192.168.43.147.7772: UDP, length 120
00:42:18.764068 IP 192.168.43.124.8880 > 192.168.43.146.7771: UDP, length 120
00:42:18.781613 IP 192.168.43.146.8880 > 192.168.43.147.7772: UDP, length 120
00:42:18.811045 IP 192.168.43.124.8880 > 192.168.43.146.7771: UDP, length 120
00:42:18.831605 IP 192.168.43.146.8880 > 192.168.43.147.7772: UDP, length 120
00:42:18.861099 IP 192.168.43.124.8880 > 192.168.43.146.7771: UDP, length 120
00:42:18.881618 IP 192.168.43.146.8880 > 192.168.43.147.7772: UDP, length 120
00:42:18.910959 IP 192.168.43.124.8880 > 192.168.43.146.7771: UDP, length 120
00:42:18.931590 IP 192.168.43.146.8880 > 192.168.43.147.7772: UDP, length 120
00:42:18.961944 IP 192.168.43.124.8880 > 192.168.43.146.7771: UDP, length 120
00:42:18.981590 IP 192.168.43.146.8880 > 192.168.43.147.7772: UDP, length 120
00:42:19.013145 IP 192.168.43.124.8880 > 192.168.43.146.7771: UDP, length 120
00:42:19.031595 IP 192.168.43.146.8880 > 192.168.43.147.7772: UDP, length 120
00:42:19.060902 IP 192.168.43.124.8880 > 192.168.43.146.7771: UDP, length 120
00:42:19.081555 IP 192.168.43.146.8880 > 192.168.43.147.7772: UDP, length 120
00:42:19.110930 IP 192.168.43.124.8880 > 192.168.43.146.7771: UDP, length 120
00:42:19.131528 IP 192.168.43.146.8880 > 192.168.43.147.7772: UDP, length 120
00:42:19.161357 IP 192.168.43.124.8880 > 192.168.43.146.7771: UDP, length 120
00:42:19.181521 IP 192.168.43.146.8880 > 192.168.43.147.7772: UDP, length 120
00:42:19.210847 IP 192.168.43.124.8880 > 192.168.43.146.7771: UDP, length 120
00:42:19.231519 IP 192.168.43.146.8880 > 192.168.43.147.7772: UDP, length 120
00:42:19.275215 IP 192.168.43.124.8880 > 192.168.43.146.7771: UDP, length 120
00:42:19.281525 IP 192.168.43.146.8880 > 192.168.43.147.7772: UDP, length 120
00:42:19.311041 IP 192.168.43.124.8880 > 192.168.43.146.7771: UDP, length 120
00:42:19.331521 IP 192.168.43.146.8880 > 192.168.43.147.7772: UDP, length 120
00:42:19.357853 IP 192.168.43.124.8880 > 192.168.43.146.7771: UDP, length 120
00:42:19.381522 IP 192.168.43.146.8880 > 192.168.43.147.7772: UDP, length 120
00:42:19.413513 IP 192.168.43.124.8880 > 192.168.43.146.7771: UDP, length 120
00:42:19.431519 IP 192.168.43.146.8880 > 192.168.43.147.7772: UDP, length 120
00:42:19.461197 IP 192.168.43.124.8880 > 192.168.43.146.7771: UDP, length 120
00:42:19.481584 IP 192.168.43.146.8880 > 192.168.43.147.7772: UDP, length 120
00:42:19.514255 IP 192.168.43.124.8880 > 192.168.43.146.7771: UDP, length 120
00:42:19.531599 IP 192.168.43.146.8880 > 192.168.43.147.7772: UDP, length 120
00:42:19.559150 IP 192.168.43.124.8880 > 192.168.43.146.7771: UDP, length 120
00:42:19.581564 IP 192.168.43.146.8880 > 192.168.43.147.7772: UDP, length 120
00:42:19.612984 IP 192.168.43.124.8880 > 192.168.43.146.7771: UDP, length 120
00:42:19.631528 IP 192.168.43.146.8880 > 192.168.43.147.7772: UDP, length 120
00:42:19.659124 IP 192.168.43.124.8880 > 192.168.43.146.7771: UDP, length 120
00:42:19.681521 IP 192.168.43.146.8880 > 192.168.43.147.7772: UDP, length 120
00:42:19.709035 IP 192.168.43.124.8880 > 192.168.43.146.7771: UDP, length 120
00:42:19.731518 IP 192.168.43.146.8880 > 192.168.43.147.7772: UDP, length 120
00:42:19.761389 IP 192.168.43.124.8880 > 192.168.43.146.7771: UDP, length 120
00:42:19.781517 IP 192.168.43.146.8880 > 192.168.43.147.7772: UDP, length 120
00:42:19.811173 IP 192.168.43.124.8880 > 192.168.43.146.7771: UDP, length 120
00:42:19.831519 IP 192.168.43.146.8880 > 192.168.43.147.7772: UDP, length 120
00:42:19.862870 IP 192.168.43.124.8880 > 192.168.43.146.7771: UDP, length 120
00:42:19.881520 IP 192.168.43.146.8880 > 192.168.43.147.7772: UDP, length 120
00:42:19.912218 IP 192.168.43.124.8880 > 192.168.43.146.7771: UDP, length 120
00:42:19.931519 IP 192.168.43.146.8880 > 192.168.43.147.7772: UDP, length 120
00:42:19.960996 IP 192.168.43.124.8880 > 192.168.43.146.7771: UDP, length 120
00:42:19.981520 IP 192.168.43.146.8880 > 192.168.43.147.7772: UDP, length 120
00:42:20.012322 IP 192.168.43.124.8880 > 192.168.43.146.7771: UDP, length 120
00:42:20.031518 IP 192.168.43.146.8880 > 192.168.43.147.7772: UDP, length 120
00:42:20.060899 IP 192.168.43.124.8880 > 192.168.43.146.7771: UDP, length 120
00:42:20.081536 IP 192.168.43.146.8880 > 192.168.43.147.7772: UDP, length 120
00:42:20.112921 IP 192.168.43.124.8880 > 192.168.43.146.7771: UDP, length 120
00:42:20.131524 IP 192.168.43.146.8880 > 192.168.43.147.7772: UDP, length 120
00:42:20.160981 IP 192.168.43.124.8880 > 192.168.43.146.7771: UDP, length 120
00:42:20.181519 IP 192.168.43.146.8880 > 192.168.43.147.7772: UDP, length 120
00:42:20.210716 IP 192.168.43.124.8880 > 192.168.43.146.7771: UDP, length 120
00:42:20.231520 IP 192.168.43.146.8880 > 192.168.43.147.7772: UDP, length 120
00:42:20.265372 IP 192.168.43.124.8880 > 192.168.43.146.7771: UDP, length 120
00:42:20.281524 IP 192.168.43.146.8880 > 192.168.43.147.7772: UDP, length 120
00:42:20.311464 IP 192.168.43.124.8880 > 192.168.43.146.7771: UDP, length 120
00:42:20.331519 IP 192.168.43.146.8880 > 192.168.43.147.7772: UDP, length 120
00:42:20.361201 IP 192.168.43.124.8880 > 192.168.43.146.7771: UDP, length 120
00:42:20.381517 IP 192.168.43.146.8880 > 192.168.43.147.7772: UDP, length 120
00:42:20.413062 IP 192.168.43.124.8880 > 192.168.43.146.7771: UDP, length 120
00:42:20.431517 IP 192.168.43.146.8880 > 192.168.43.147.7772: UDP, length 120
00:42:20.460951 IP 192.168.43.124.8880 > 192.168.43.146.7771: UDP, length 120
00:42:20.481518 IP 192.168.43.146.8880 > 192.168.43.147.7772: UDP, length 120
00:42:20.513173 IP 192.168.43.124.8880 > 192.168.43.146.7771: UDP, length 120
00:42:20.531517 IP 192.168.43.146.8880 > 192.168.43.147.7772: UDP, length 120
00:42:20.565369 IP 192.168.43.124.8880 > 192.168.43.146.7771: UDP, length 120
00:42:20.581585 IP 192.168.43.146.8880 > 192.168.43.147.7772: UDP, length 120
00:42:20.611133 IP 192.168.43.124.8880 > 192.168.43.146.7771: UDP, length 120
00:42:20.631541 IP 192.168.43.146.8880 > 192.168.43.147.7772: UDP, length 120
00:42:20.663432 IP 192.168.43.124.8880 > 192.168.43.146.7771: UDP, length 120
00:42:20.681520 IP 192.168.43.146.8880 > 192.168.43.147.7772: UDP, length 120
00:42:20.711550 IP 192.168.43.124.8880 > 192.168.43.146.7771: UDP, length 120
00:42:20.731519 IP 192.168.43.146.8880 > 192.168.43.147.7772: UDP, length 120
00:42:20.761114 IP 192.168.43.124.8880 > 192.168.43.146.7771: UDP, length 120
00:42:20.781518 IP 192.168.43.146.8880 > 192.168.43.147.7772: UDP, length 120
00:42:20.815289 IP 192.168.43.124.8880 > 192.168.43.146.7771: UDP, length 120
00:42:20.831516 IP 192.168.43.146.8880 > 192.168.43.147.7772: UDP, length 120
00:42:20.861055 IP 192.168.43.124.8880 > 192.168.43.146.7771: UDP, length 120
00:42:20.881518 IP 192.168.43.146.8880 > 192.168.43.147.7772: UDP, length 120
00:42:20.907994 IP 192.168.43.124.8880 > 192.168.43.146.7771: UDP, length 120
00:42:20.931519 IP 192.168.43.146.8880 > 192.168.43.147.7772: UDP, length 120
00:42:20.961475 IP 192.168.43.124.8880 > 192.168.43.146.7771: UDP, length 120
00:42:20.981518 IP 192.168.43.146.8880 > 192.168.43.147.7772: UDP, length 120
00:42:21.010969 IP 192.168.43.124.8880 > 192.168.43.146.7771: UDP, length 120
00:42:21.031560 IP 192.168.43.146.8880 > 192.168.43.147.7772: UDP, length 120
00:42:21.061294 IP 192.168.43.124.8880 > 192.168.43.146.7771: UDP, length 120
00:42:21.081542 IP 192.168.43.146.8880 > 192.168.43.147.7772: UDP, length 120
00:42:21.111091 IP 192.168.43.124.8880 > 192.168.43.146.7771: UDP, length 120
00:42:21.131505 IP 192.168.43.146.8880 > 192.168.43.147.7772: UDP, length 120
00:42:21.161575 IP 192.168.43.124.8880 > 192.168.43.146.7771: UDP, length 120
00:42:21.181520 IP 192.168.43.146.8880 > 192.168.43.147.7772: UDP, length 120
00:42:21.210960 IP 192.168.43.124.8880 > 192.168.43.146.7771: UDP, length 120
00:42:21.231533 IP 192.168.43.146.8880 > 192.168.43.147.7772: UDP, length 120
00:42:21.261354 IP 192.168.43.124.8880 > 192.168.43.146.7771: UDP, length 120
00:42:21.281522 IP 192.168.43.146.8880 > 192.168.43.147.7772: UDP, length 120
00:42:21.310971 IP 192.168.43.124.8880 > 192.168.43.146.7771: UDP, length 120
00:42:21.331518 IP 192.168.43.146.8880 > 192.168.43.147.7772: UDP, length 120
00:42:21.361090 IP 192.168.43.124.8880 > 192.168.43.146.7771: UDP, length 120
00:42:21.381518 IP 192.168.43.146.8880 > 192.168.43.147.7772: UDP, length 120
00:42:21.412287 IP 192.168.43.124.8880 > 192.168.43.146.7771: UDP, length 120
00:42:21.431517 IP 192.168.43.146.8880 > 192.168.43.147.7772: UDP, length 120
00:42:21.461019 IP 192.168.43.124.8880 > 192.168.43.146.7771: UDP, length 120
00:42:21.481517 IP 192.168.43.146.8880 > 192.168.43.147.7772: UDP, length 120
00:42:21.512203 IP 192.168.43.124.8880 > 192.168.43.146.7771: UDP, length 120
00:42:21.531519 IP 192.168.43.146.8880 > 192.168.43.147.7772: UDP, length 120
00:42:21.561135 IP 192.168.43.124.8880 > 192.168.43.146.7771: UDP, length 120
00:42:21.581569 IP 192.168.43.146.8880 > 192.168.43.147.7772: UDP, length 120
00:42:21.611805 IP 192.168.43.124.8880 > 192.168.43.146.7771: UDP, length 120
00:42:21.631554 IP 192.168.43.146.8880 > 192.168.43.147.7772: UDP, length 120
00:42:21.663315 IP 192.168.43.124.8880 > 192.168.43.146.7771: UDP, length 120
00:42:21.681524 IP 192.168.43.146.8880 > 192.168.43.147.7772: UDP, length 120
00:42:21.711711 IP 192.168.43.124.8880 > 192.168.43.146.7771: UDP, length 120
00:42:21.731519 IP 192.168.43.146.8880 > 192.168.43.147.7772: UDP, length 120
00:42:21.760985 IP 192.168.43.124.8880 > 192.168.43.146.7771: UDP, length 120
00:42:21.781518 IP 192.168.43.146.8880 > 192.168.43.147.7772: UDP, length 120
00:42:21.810965 IP 192.168.43.124.8880 > 192.168.43.146.7771: UDP, length 120
00:42:21.831517 IP 192.168.43.146.8880 > 192.168.43.147.7772: UDP, length 120
00:42:21.861067 IP 192.168.43.124.8880 > 192.168.43.146.7771: UDP, length 120
00:42:21.881517 IP 192.168.43.146.8880 > 192.168.43.147.7772: UDP, length 120
00:42:21.911538 IP 192.168.43.124.8880 > 192.168.43.146.7771: UDP, length 120
00:42:21.931517 IP 192.168.43.146.8880 > 192.168.43.147.7772: UDP, length 120
00:42:21.961086 IP 192.168.43.124.8880 > 192.168.43.146.7771: UDP, length 120
00:42:21.981517 IP 192.168.43.146.8880 > 192.168.43.147.7772: UDP, length 120
00:42:22.011052 IP 192.168.43.124.8880 > 192.168.43.146.7771: UDP, length 120
00:42:22.031517 IP 192.168.43.146.8880 > 192.168.43.147.7772: UDP, length 120
00:42:22.062182 IP 192.168.43.124.8880 > 192.168.43.146.7771: UDP, length 120
00:42:22.081519 IP 192.168.43.146.8880 > 192.168.43.147.7772: UDP, length 120
00:42:22.111134 IP 192.168.43.124.8880 > 192.168.43.146.7771: UDP, length 120
00:42:22.131519 IP 192.168.43.146.8880 > 192.168.43.147.7772: UDP, length 120
00:42:22.161466 IP 192.168.43.124.8880 > 192.168.43.146.7771: UDP, length 120
00:42:22.181520 IP 192.168.43.146.8880 > 192.168.43.147.7772: UDP, length 120
00:42:22.211251 IP 192.168.43.124.8880 > 192.168.43.146.7771: UDP, length 120
00:42:22.231523 IP 192.168.43.146.8880 > 192.168.43.147.7772: UDP, length 120
00:42:22.262996 IP 192.168.43.124.8880 > 192.168.43.146.7771: UDP, length 120
00:42:22.281525 IP 192.168.43.146.8880 > 192.168.43.147.7772: UDP, length 120
00:42:22.310760 IP 192.168.43.124.8880 > 192.168.43.146.7771: UDP, length 120
00:42:22.331520 IP 192.168.43.146.8880 > 192.168.43.147.7772: UDP, length 120
00:42:22.363339 IP 192.168.43.124.8880 > 192.168.43.146.7771: UDP, length 120
00:42:22.381518 IP 192.168.43.146.8880 > 192.168.43.147.7772: UDP, length 120
00:42:22.410762 IP 192.168.43.124.8880 > 192.168.43.146.7771: UDP, length 120
00:42:22.431517 IP 192.168.43.146.8880 > 192.168.43.147.7772: UDP, length 120
00:42:22.461023 IP 192.168.43.124.8880 > 192.168.43.146.7771: UDP, length 120
00:42:22.481517 IP 192.168.43.146.8880 > 192.168.43.147.7772: UDP, length 120
00:42:22.510788 IP 192.168.43.124.8880 > 192.168.43.146.7771: UDP, length 120
00:42:22.531564 IP 192.168.43.146.8880 > 192.168.43.147.7772: UDP, length 120
00:42:22.558216 IP 192.168.43.124.8880 > 192.168.43.146.7771: UDP, length 120
00:42:22.581540 IP 192.168.43.146.8880 > 192.168.43.147.7772: UDP, length 120
00:42:22.609407 IP 192.168.43.124.8880 > 192.168.43.146.7771: UDP, length 120
00:42:22.631601 IP 192.168.43.146.8880 > 192.168.43.147.7772: UDP, length 120
00:42:22.665342 IP 192.168.43.124.8880 > 192.168.43.146.7771: UDP, length 120
00:42:22.681556 IP 192.168.43.146.8880 > 192.168.43.147.7772: UDP, length 120
00:42:22.711879 IP 192.168.43.124.8880 > 192.168.43.146.7771: UDP, length 120
00:42:22.731546 IP 192.168.43.146.8880 > 192.168.43.147.7772: UDP, length 120
00:42:22.761265 IP 192.168.43.124.8880 > 192.168.43.146.7771: UDP, length 120
00:42:22.781545 IP 192.168.43.146.8880 > 192.168.43.147.7772: UDP, length 120
00:42:22.813773 IP 192.168.43.124.8880 > 192.168.43.146.7771: UDP, length 120
00:42:22.831542 IP 192.168.43.146.8880 > 192.168.43.147.7772: UDP, length 120
00:42:22.861579 IP 192.168.43.124.8880 > 192.168.43.146.7771: UDP, length 120
00:42:22.881542 IP 192.168.43.146.8880 > 192.168.43.147.7772: UDP, length 120
00:42:22.911250 IP 192.168.43.124.8880 > 192.168.43.146.7771: UDP, length 120
00:42:22.931544 IP 192.168.43.146.8880 > 192.168.43.147.7772: UDP, length 120
00:42:22.961929 IP 192.168.43.124.8880 > 192.168.43.146.7771: UDP, length 120
00:42:22.981542 IP 192.168.43.146.8880 > 192.168.43.147.7772: UDP, length 120
00:42:23.011257 IP 192.168.43.124.8880 > 192.168.43.146.7771: UDP, length 120
00:42:23.031546 IP 192.168.43.146.8880 > 192.168.43.147.7772: UDP, length 120
00:42:23.061363 IP 192.168.43.124.8880 > 192.168.43.146.7771: UDP, length 120
00:42:23.081549 IP 192.168.43.146.8880 > 192.168.43.147.7772: UDP, length 120
00:42:23.120067 IP 192.168.43.124.8880 > 192.168.43.146.7771: UDP, length 120
00:42:23.131545 IP 192.168.43.146.8880 > 192.168.43.147.7772: UDP, length 120
00:42:23.161298 IP 192.168.43.124.8880 > 192.168.43.146.7771: UDP, length 120
00:42:23.181542 IP 192.168.43.146.8880 > 192.168.43.147.7772: UDP, length 120
00:42:23.211316 IP 192.168.43.124.8880 > 192.168.43.146.7771: UDP, length 120
00:42:23.231556 IP 192.168.43.146.8880 > 192.168.43.147.7772: UDP, length 120
00:42:23.261334 IP 192.168.43.124.8880 > 192.168.43.146.7771: UDP, length 120
00:42:23.281557 IP 192.168.43.146.8880 > 192.168.43.147.7772: UDP, length 120
00:42:23.311405 IP 192.168.43.124.8880 > 192.168.43.146.7771: UDP, length 120
00:42:23.331546 IP 192.168.43.146.8880 > 192.168.43.147.7772: UDP, length 120
00:42:23.361187 IP 192.168.43.124.8880 > 192.168.43.146.7771: UDP, length 120
00:42:23.381542 IP 192.168.43.146.8880 > 192.168.43.147.7772: UDP, length 120
00:42:23.411160 IP 192.168.43.124.8880 > 192.168.43.146.7771: UDP, length 120
00:42:23.431545 IP 192.168.43.146.8880 > 192.168.43.147.7772: UDP, length 120
00:42:23.461160 IP 192.168.43.124.8880 > 192.168.43.146.7771: UDP, length 120
00:42:23.481542 IP 192.168.43.146.8880 > 192.168.43.147.7772: UDP, length 120
00:42:23.511313 IP 192.168.43.124.8880 > 192.168.43.146.7771: UDP, length 120
00:42:23.531545 IP 192.168.43.146.8880 > 192.168.43.147.7772: UDP, length 120
00:42:23.561143 IP 192.168.43.124.8880 > 192.168.43.146.7771: UDP, length 120
00:42:23.581544 IP 192.168.43.146.8880 > 192.168.43.147.7772: UDP, length 120
00:42:23.609662 IP 192.168.43.124.8880 > 192.168.43.146.7771: UDP, length 120
00:42:23.631608 IP 192.168.43.146.8880 > 192.168.43.147.7772: UDP, length 120
00:42:23.661725 IP 192.168.43.124.8880 > 192.168.43.146.7771: UDP, length 120
00:42:23.681559 IP 192.168.43.146.8880 > 192.168.43.147.7772: UDP, length 120
00:42:23.716900 IP 192.168.43.124.8880 > 192.168.43.146.7771: UDP, length 120
00:42:23.731544 IP 192.168.43.146.8880 > 192.168.43.147.7772: UDP, length 120
00:42:23.762286 IP 192.168.43.124.8880 > 192.168.43.146.7771: UDP, length 120
00:42:23.781544 IP 192.168.43.146.8880 > 192.168.43.147.7772: UDP, length 120
00:42:23.812066 IP 192.168.43.124.8880 > 192.168.43.146.7771: UDP, length 120
00:42:23.831543 IP 192.168.43.146.8880 > 192.168.43.147.7772: UDP, length 120
00:42:23.862181 IP 192.168.43.124.8880 > 192.168.43.146.7771: UDP, length 120
00:42:23.881543 IP 192.168.43.146.8880 > 192.168.43.147.7772: UDP, length 120
00:42:23.911203 IP 192.168.43.124.8880 > 192.168.43.146.7771: UDP, length 120
00:42:23.931544 IP 192.168.43.146.8880 > 192.168.43.147.7772: UDP, length 120
00:42:23.961727 IP 192.168.43.124.8880 > 192.168.43.146.7771: UDP, length 120
00:42:23.981543 IP 192.168.43.146.8880 > 192.168.43.147.7772: UDP, length 120
00:42:24.011495 IP 192.168.43.124.8880 > 192.168.43.146.7771: UDP, length 120
00:42:24.031545 IP 192.168.43.146.8880 > 192.168.43.147.7772: UDP, length 120
00:42:24.061853 IP 192.168.43.124.8880 > 192.168.43.146.7771: UDP, length 120
00:42:24.081704 IP 192.168.43.146.8880 > 192.168.43.147.7772: UDP, length 120
00:42:24.108037 IP 192.168.43.124.8880 > 192.168.43.146.7771: UDP, length 120
00:42:24.131647 IP 192.168.43.146.8880 > 192.168.43.147.7772: UDP, length 120
00:42:24.161886 IP 192.168.43.124.8880 > 192.168.43.146.7771: UDP, length 120
00:42:24.181615 IP 192.168.43.146.8880 > 192.168.43.147.7772: UDP, length 120
00:42:24.212490 IP 192.168.43.124.8880 > 192.168.43.146.7771: UDP, length 120
00:42:24.231845 IP 192.168.43.146.8880 > 192.168.43.147.7772: UDP, length 120
00:42:24.257120 IP 192.168.43.124.8880 > 192.168.43.146.7771: UDP, length 120
00:42:24.281599 IP 192.168.43.146.8880 > 192.168.43.147.7772: UDP, length 120
00:42:24.312154 IP 192.168.43.124.8880 > 192.168.43.146.7771: UDP, length 120
00:42:24.331595 IP 192.168.43.146.8880 > 192.168.43.147.7772: UDP, length 120
00:42:24.358346 IP 192.168.43.124.8880 > 192.168.43.146.7771: UDP, length 120
00:42:24.381592 IP 192.168.43.146.8880 > 192.168.43.147.7772: UDP, length 120
00:42:24.410849 IP 192.168.43.124.8880 > 192.168.43.146.7771: UDP, length 120
00:42:24.431635 IP 192.168.43.146.8880 > 192.168.43.147.7772: UDP, length 120
00:42:24.458002 IP 192.168.43.124.8880 > 192.168.43.146.7771: UDP, length 120
00:42:24.481592 IP 192.168.43.146.8880 > 192.168.43.147.7772: UDP, length 120
00:42:24.508229 IP 192.168.43.124.8880 > 192.168.43.146.7771: UDP, length 120
00:42:24.531631 IP 192.168.43.146.8880 > 192.168.43.147.7772: UDP, length 120
00:42:24.561257 IP 192.168.43.124.8880 > 192.168.43.146.7771: UDP, length 120
00:42:24.581597 IP 192.168.43.146.8880 > 192.168.43.147.7772: UDP, length 120
00:42:24.611286 IP 192.168.43.124.8880 > 192.168.43.146.7771: UDP, length 120
00:42:24.631588 IP 192.168.43.146.8880 > 192.168.43.147.7772: UDP, length 120
00:42:24.661151 IP 192.168.43.124.8880 > 192.168.43.146.7771: UDP, length 120
00:42:24.681567 IP 192.168.43.146.8880 > 192.168.43.147.7772: UDP, length 120
00:42:24.711765 IP 192.168.43.124.8880 > 192.168.43.146.7771: UDP, length 120
00:42:24.731575 IP 192.168.43.146.8880 > 192.168.43.147.7772: UDP, length 120
00:42:24.761637 IP 192.168.43.124.8880 > 192.168.43.146.7771: UDP, length 120
00:42:24.781569 IP 192.168.43.146.8880 > 192.168.43.147.7772: UDP, length 120
00:42:24.813628 IP 192.168.43.124.8880 > 192.168.43.146.7771: UDP, length 120
00:42:24.831554 IP 192.168.43.146.8880 > 192.168.43.147.7772: UDP, length 120
00:42:24.862101 IP 192.168.43.124.8880 > 192.168.43.146.7771: UDP, length 120
00:42:24.881538 IP 192.168.43.146.8880 > 192.168.43.147.7772: UDP, length 120
00:42:24.911089 IP 192.168.43.124.8880 > 192.168.43.146.7771: UDP, length 120
00:42:24.931523 IP 192.168.43.146.8880 > 192.168.43.147.7772: UDP, length 120
00:42:24.961241 IP 192.168.43.124.8880 > 192.168.43.146.7771: UDP, length 120
00:42:24.981521 IP 192.168.43.146.8880 > 192.168.43.147.7772: UDP, length 120
00:42:25.013832 IP 192.168.43.124.8880 > 192.168.43.146.7771: UDP, length 120
00:42:25.031526 IP 192.168.43.146.8880 > 192.168.43.147.7772: UDP, length 120
00:42:25.061056 IP 192.168.43.124.8880 > 192.168.43.146.7771: UDP, length 120
00:42:25.081522 IP 192.168.43.146.8880 > 192.168.43.147.7772: UDP, length 120
00:42:25.112718 IP 192.168.43.124.8880 > 192.168.43.146.7771: UDP, length 120
00:42:25.131519 IP 192.168.43.146.8880 > 192.168.43.147.7772: UDP, length 120
00:42:25.161050 IP 192.168.43.124.8880 > 192.168.43.146.7771: UDP, length 120
00:42:25.181518 IP 192.168.43.146.8880 > 192.168.43.147.7772: UDP, length 120
00:42:25.207960 IP 192.168.43.124.8880 > 192.168.43.146.7771: UDP, length 120
00:42:25.231537 IP 192.168.43.146.8880 > 192.168.43.147.7772: UDP, length 120
00:42:25.262209 IP 192.168.43.124.8880 > 192.168.43.146.7771: UDP, length 120
00:42:25.281530 IP 192.168.43.146.8880 > 192.168.43.147.7772: UDP, length 120
00:42:25.311082 IP 192.168.43.124.8880 > 192.168.43.146.7771: UDP, length 120
00:42:25.331522 IP 192.168.43.146.8880 > 192.168.43.147.7772: UDP, length 120
00:42:25.361090 IP 192.168.43.124.8880 > 192.168.43.146.7771: UDP, length 120
00:42:25.381538 IP 192.168.43.146.8880 > 192.168.43.147.7772: UDP, length 120
00:42:25.411027 IP 192.168.43.124.8880 > 192.168.43.146.7771: UDP, length 120
00:42:25.431527 IP 192.168.43.146.8880 > 192.168.43.147.7772: UDP, length 120
00:42:25.462577 IP 192.168.43.124.8880 > 192.168.43.146.7771: UDP, length 120
00:42:25.481518 IP 192.168.43.146.8880 > 192.168.43.147.7772: UDP, length 120
00:42:25.511090 IP 192.168.43.124.8880 > 192.168.43.146.7771: UDP, length 120
00:42:25.531531 IP 192.168.43.146.8880 > 192.168.43.147.7772: UDP, length 120
00:42:25.561027 IP 192.168.43.124.8880 > 192.168.43.146.7771: UDP, length 120
00:42:25.581551 IP 192.168.43.146.8880 > 192.168.43.147.7772: UDP, length 120
00:42:25.611079 IP 192.168.43.124.8880 > 192.168.43.146.7771: UDP, length 120
00:42:25.631581 IP 192.168.43.146.8880 > 192.168.43.147.7772: UDP, length 120
00:42:25.681536 IP 192.168.43.146.8880 > 192.168.43.147.7772: UDP, length 120
00:42:25.731521 IP 192.168.43.146.8880 > 192.168.43.147.7772: UDP, length 120
00:42:25.778144 IP 192.168.43.124.8880 > 192.168.43.146.7771: UDP, length 120
00:42:25.778358 IP 192.168.43.124.8880 > 192.168.43.146.7771: UDP, length 120
00:42:25.781529 IP 192.168.43.146.8880 > 192.168.43.147.7772: UDP, length 120
00:42:25.831520 IP 192.168.43.146.8880 > 192.168.43.147.7772: UDP, length 120
00:42:25.877581 IP 192.168.43.124.8880 > 192.168.43.146.7771: UDP, length 120
00:42:25.877749 IP 192.168.43.124.8880 > 192.168.43.146.7771: UDP, length 120
00:42:25.881529 IP 192.168.43.146.8880 > 192.168.43.147.7772: UDP, length 120
00:42:25.931520 IP 192.168.43.146.8880 > 192.168.43.147.7772: UDP, length 120
00:42:25.981517 IP 192.168.43.146.8880 > 192.168.43.147.7772: UDP, length 120
00:42:25.984843 IP 192.168.43.124.8880 > 192.168.43.146.7771: UDP, length 120
00:42:25.985056 IP 192.168.43.124.8880 > 192.168.43.146.7771: UDP, length 120
00:42:26.031528 IP 192.168.43.146.8880 > 192.168.43.147.7772: UDP, length 120
00:42:26.081523 IP 192.168.43.146.8880 > 192.168.43.147.7772: UDP, length 120
00:42:26.084865 IP 192.168.43.124.8880 > 192.168.43.146.7771: UDP, length 120
00:42:26.085113 IP 192.168.43.124.8880 > 192.168.43.146.7771: UDP, length 120
00:42:26.131544 IP 192.168.43.146.8880 > 192.168.43.147.7772: UDP, length 120
00:42:26.181521 IP 192.168.43.146.8880 > 192.168.43.147.7772: UDP, length 120
00:42:26.194399 IP 192.168.43.124.8880 > 192.168.43.146.7771: UDP, length 120
00:42:26.194482 IP 192.168.43.124.8880 > 192.168.43.146.7771: UDP, length 120
00:42:26.231521 IP 192.168.43.146.8880 > 192.168.43.147.7772: UDP, length 120
00:42:26.281520 IP 192.168.43.146.8880 > 192.168.43.147.7772: UDP, length 120
00:42:26.295745 IP 192.168.43.124.8880 > 192.168.43.146.7771: UDP, length 120
00:42:26.296016 IP 192.168.43.124.8880 > 192.168.43.146.7771: UDP, length 120
00:42:26.331537 IP 192.168.43.146.8880 > 192.168.43.147.7772: UDP, length 120
00:42:26.381533 IP 192.168.43.146.8880 > 192.168.43.147.7772: UDP, length 120
00:42:26.407959 IP 192.168.43.124.8880 > 192.168.43.146.7771: UDP, length 120
00:42:26.408258 IP 192.168.43.124.8880 > 192.168.43.146.7771: UDP, length 120
00:42:26.431537 IP 192.168.43.146.8880 > 192.168.43.147.7772: UDP, length 120
00:42:26.481521 IP 192.168.43.146.8880 > 192.168.43.147.7772: UDP, length 120
00:42:26.506076 IP 192.168.43.124.8880 > 192.168.43.146.7771: UDP, length 120
00:42:26.506349 IP 192.168.43.124.8880 > 192.168.43.146.7771: UDP, length 120
00:42:26.531520 IP 192.168.43.146.8880 > 192.168.43.147.7772: UDP, length 120
00:42:26.581518 IP 192.168.43.146.8880 > 192.168.43.147.7772: UDP, length 120
00:42:26.607037 IP 192.168.43.124.8880 > 192.168.43.146.7771: UDP, length 120
00:42:26.607212 IP 192.168.43.124.8880 > 192.168.43.146.7771: UDP, length 120
00:42:26.631532 IP 192.168.43.146.8880 > 192.168.43.147.7772: UDP, length 120
00:42:26.681522 IP 192.168.43.146.8880 > 192.168.43.147.7772: UDP, length 120
00:42:26.708125 IP 192.168.43.124.8880 > 192.168.43.146.7771: UDP, length 120
00:42:26.708322 IP 192.168.43.124.8880 > 192.168.43.146.7771: UDP, length 120
00:42:26.731555 IP 192.168.43.146.8880 > 192.168.43.147.7772: UDP, length 120
00:42:26.781523 IP 192.168.43.146.8880 > 192.168.43.147.7772: UDP, length 120
00:42:26.807430 IP 192.168.43.124.8880 > 192.168.43.146.7771: UDP, length 120
00:42:26.808236 IP 192.168.43.124.8880 > 192.168.43.146.7771: UDP, length 120
00:42:26.831523 IP 192.168.43.146.8880 > 192.168.43.147.7772: UDP, length 120
00:42:26.881520 IP 192.168.43.146.8880 > 192.168.43.147.7772: UDP, length 120
00:42:26.907434 IP 192.168.43.124.8880 > 192.168.43.146.7771: UDP, length 120
00:42:26.907609 IP 192.168.43.124.8880 > 192.168.43.146.7771: UDP, length 120
00:42:26.931519 IP 192.168.43.146.8880 > 192.168.43.147.7772: UDP, length 120
00:42:26.981518 IP 192.168.43.146.8880 > 192.168.43.147.7772: UDP, length 120
00:42:27.007415 IP 192.168.43.124.8880 > 192.168.43.146.7771: UDP, length 120
00:42:27.007582 IP 192.168.43.124.8880 > 192.168.43.146.7771: UDP, length 120
00:42:27.031522 IP 192.168.43.146.8880 > 192.168.43.147.7772: UDP, length 120
00:42:27.081556 IP 192.168.43.146.8880 > 192.168.43.147.7772: UDP, length 120
00:42:27.107965 IP 192.168.43.124.8880 > 192.168.43.146.7771: UDP, length 120
00:42:27.108193 IP 192.168.43.124.8880 > 192.168.43.146.7771: UDP, length 120
00:42:27.131527 IP 192.168.43.146.8880 > 192.168.43.147.7772: UDP, length 120
00:42:27.181517 IP 192.168.43.146.8880 > 192.168.43.147.7772: UDP, length 120
00:42:27.207911 IP 192.168.43.124.8880 > 192.168.43.146.7771: UDP, length 120
00:42:27.208075 IP 192.168.43.124.8880 > 192.168.43.146.7771: UDP, length 120
00:42:27.231519 IP 192.168.43.146.8880 > 192.168.43.147.7772: UDP, length 120
00:42:27.281523 IP 192.168.43.146.8880 > 192.168.43.147.7772: UDP, length 120
00:42:27.305864 IP 192.168.43.124.8880 > 192.168.43.146.7771: UDP, length 120
00:42:27.306045 IP 192.168.43.124.8880 > 192.168.43.146.7771: UDP, length 120
00:42:27.331521 IP 192.168.43.146.8880 > 192.168.43.147.7772: UDP, length 120
00:42:27.381520 IP 192.168.43.146.8880 > 192.168.43.147.7772: UDP, length 120
00:42:27.407746 IP 192.168.43.124.8880 > 192.168.43.146.7771: UDP, length 120
00:42:27.407832 IP 192.168.43.124.8880 > 192.168.43.146.7771: UDP, length 120
00:42:27.431529 IP 192.168.43.146.8880 > 192.168.43.147.7772: UDP, length 120
00:42:27.481519 IP 192.168.43.146.8880 > 192.168.43.147.7772: UDP, length 120
00:42:27.505905 IP 192.168.43.124.8880 > 192.168.43.146.7771: UDP, length 120
00:42:27.506092 IP 192.168.43.124.8880 > 192.168.43.146.7771: UDP, length 120
00:42:27.531526 IP 192.168.43.146.8880 > 192.168.43.147.7772: UDP, length 120
00:42:27.561225 IP 192.168.43.124.8880 > 192.168.43.146.7771: UDP, length 120
00:42:27.561384 IP 192.168.43.124.8880 > 192.168.43.146.7771: UDP, length 120
00:42:27.581522 IP 192.168.43.146.8880 > 192.168.43.147.7772: UDP, length 120
00:42:27.611100 IP 192.168.43.124.8880 > 192.168.43.146.7771: UDP, length 120
00:42:27.631547 IP 192.168.43.146.8880 > 192.168.43.147.7772: UDP, length 120
00:42:27.662012 IP 192.168.43.124.8880 > 192.168.43.146.7771: UDP, length 120
00:42:27.681633 IP 192.168.43.146.8880 > 192.168.43.147.7772: UDP, length 120
00:42:27.711526 IP 192.168.43.124.8880 > 192.168.43.146.7771: UDP, length 120
00:42:27.731644 IP 192.168.43.146.8880 > 192.168.43.147.7772: UDP, length 120
00:42:27.758248 IP 192.168.43.124.8880 > 192.168.43.146.7771: UDP, length 120
00:42:27.781749 IP 192.168.43.146.8880 > 192.168.43.147.7772: UDP, length 120
00:42:27.810829 IP 192.168.43.124.8880 > 192.168.43.146.7771: UDP, length 120
00:42:27.831591 IP 192.168.43.146.8880 > 192.168.43.147.7772: UDP, length 120
00:42:27.861232 IP 192.168.43.124.8880 > 192.168.43.146.7771: UDP, length 120
00:42:27.881565 IP 192.168.43.146.8880 > 192.168.43.147.7772: UDP, length 120
00:42:27.910318 IP 192.168.43.124.8880 > 192.168.43.146.7771: UDP, length 120
00:42:27.931550 IP 192.168.43.146.8880 > 192.168.43.147.7772: UDP, length 120
00:42:27.962817 IP 192.168.43.124.8880 > 192.168.43.146.7771: UDP, length 120
00:42:27.981544 IP 192.168.43.146.8880 > 192.168.43.147.7772: UDP, length 120
00:42:28.014995 IP 192.168.43.124.8880 > 192.168.43.146.7771: UDP, length 120
00:42:28.031544 IP 192.168.43.146.8880 > 192.168.43.147.7772: UDP, length 120
00:42:28.062430 IP 192.168.43.124.8880 > 192.168.43.146.7771: UDP, length 120
00:42:28.081547 IP 192.168.43.146.8880 > 192.168.43.147.7772: UDP, length 120
00:42:28.113033 IP 192.168.43.124.8880 > 192.168.43.146.7771: UDP, length 120
00:42:28.131544 IP 192.168.43.146.8880 > 192.168.43.147.7772: UDP, length 120
00:42:28.161237 IP 192.168.43.124.8880 > 192.168.43.146.7771: UDP, length 120
00:42:28.181543 IP 192.168.43.146.8880 > 192.168.43.147.7772: UDP, length 120
00:42:28.208185 IP 192.168.43.124.8880 > 192.168.43.146.7771: UDP, length 120
00:42:28.231551 IP 192.168.43.146.8880 > 192.168.43.147.7772: UDP, length 120
00:42:28.261284 IP 192.168.43.124.8880 > 192.168.43.146.7771: UDP, length 120
00:42:28.281552 IP 192.168.43.146.8880 > 192.168.43.147.7772: UDP, length 120
00:42:28.311440 IP 192.168.43.124.8880 > 192.168.43.146.7771: UDP, length 120
00:42:28.331545 IP 192.168.43.146.8880 > 192.168.43.147.7772: UDP, length 120
00:42:28.362421 IP 192.168.43.124.8880 > 192.168.43.146.7771: UDP, length 120
00:42:28.381548 IP 192.168.43.146.8880 > 192.168.43.147.7772: UDP, length 120
00:42:28.416222 IP 192.168.43.124.8880 > 192.168.43.146.7771: UDP, length 120
00:42:28.431545 IP 192.168.43.146.8880 > 192.168.43.147.7772: UDP, length 120
00:42:28.462466 IP 192.168.43.124.8880 > 192.168.43.146.7771: UDP, length 120
00:42:28.481546 IP 192.168.43.146.8880 > 192.168.43.147.7772: UDP, length 120
00:42:28.511992 IP 192.168.43.124.8880 > 192.168.43.146.7771: UDP, length 120
00:42:28.531561 IP 192.168.43.146.8880 > 192.168.43.147.7772: UDP, length 120
00:42:28.561292 IP 192.168.43.124.8880 > 192.168.43.146.7771: UDP, length 120
00:42:28.581579 IP 192.168.43.146.8880 > 192.168.43.147.7772: UDP, length 120
00:42:28.611887 IP 192.168.43.124.8880 > 192.168.43.146.7771: UDP, length 120
00:42:28.631547 IP 192.168.43.146.8880 > 192.168.43.147.7772: UDP, length 120
00:42:28.661271 IP 192.168.43.124.8880 > 192.168.43.146.7771: UDP, length 120
00:42:28.681557 IP 192.168.43.146.8880 > 192.168.43.147.7772: UDP, length 120
00:42:28.708159 IP 192.168.43.124.8880 > 192.168.43.146.7771: UDP, length 120
00:42:28.731552 IP 192.168.43.146.8880 > 192.168.43.147.7772: UDP, length 120
00:42:28.761148 IP 192.168.43.124.8880 > 192.168.43.146.7771: UDP, length 120
00:42:28.781545 IP 192.168.43.146.8880 > 192.168.43.147.7772: UDP, length 120
00:42:28.806406 IP 192.168.43.124.8880 > 192.168.43.146.7771: UDP, length 120
00:42:28.831614 IP 192.168.43.146.8880 > 192.168.43.147.7772: UDP, length 120
00:42:28.861612 IP 192.168.43.124.8880 > 192.168.43.146.7771: UDP, length 120
00:42:28.881613 IP 192.168.43.146.8880 > 192.168.43.147.7772: UDP, length 120
00:42:28.911898 IP 192.168.43.124.8880 > 192.168.43.146.7771: UDP, length 120
00:42:28.931559 IP 192.168.43.146.8880 > 192.168.43.147.7772: UDP, length 120
00:42:28.961296 IP 192.168.43.124.8880 > 192.168.43.146.7771: UDP, length 120
00:42:28.981548 IP 192.168.43.146.8880 > 192.168.43.147.7772: UDP, length 120
00:42:29.012650 IP 192.168.43.124.8880 > 192.168.43.146.7771: UDP, length 120
00:42:29.031549 IP 192.168.43.146.8880 > 192.168.43.147.7772: UDP, length 120
00:42:29.063126 IP 192.168.43.124.8880 > 192.168.43.146.7771: UDP, length 120
00:42:29.081550 IP 192.168.43.146.8880 > 192.168.43.147.7772: UDP, length 120
00:42:29.111396 IP 192.168.43.124.8880 > 192.168.43.146.7771: UDP, length 120
00:42:29.131545 IP 192.168.43.146.8880 > 192.168.43.147.7772: UDP, length 120
00:42:29.161284 IP 192.168.43.124.8880 > 192.168.43.146.7771: UDP, length 120
00:42:29.181545 IP 192.168.43.146.8880 > 192.168.43.147.7772: UDP, length 120
00:42:29.212432 IP 192.168.43.124.8880 > 192.168.43.146.7771: UDP, length 120
00:42:29.231543 IP 192.168.43.146.8880 > 192.168.43.147.7772: UDP, length 120
00:42:29.261272 IP 192.168.43.124.8880 > 192.168.43.146.7771: UDP, length 120
00:42:29.281554 IP 192.168.43.146.8880 > 192.168.43.147.7772: UDP, length 120
00:42:29.315134 IP 192.168.43.124.8880 > 192.168.43.146.7771: UDP, length 120
00:42:29.331573 IP 192.168.43.146.8880 > 192.168.43.147.7772: UDP, length 120
00:42:29.361257 IP 192.168.43.124.8880 > 192.168.43.146.7771: UDP, length 120
00:42:29.381550 IP 192.168.43.146.8880 > 192.168.43.147.7772: UDP, length 120
00:42:29.412599 IP 192.168.43.124.8880 > 192.168.43.146.7771: UDP, length 120
00:42:29.431542 IP 192.168.43.146.8880 > 192.168.43.147.7772: UDP, length 120
00:42:29.461273 IP 192.168.43.124.8880 > 192.168.43.146.7771: UDP, length 120
00:42:29.481548 IP 192.168.43.146.8880 > 192.168.43.147.7772: UDP, length 120
00:42:29.518519 IP 192.168.43.124.8880 > 192.168.43.146.7771: UDP, length 120
00:42:29.531546 IP 192.168.43.146.8880 > 192.168.43.147.7772: UDP, length 120
00:42:29.561352 IP 192.168.43.124.8880 > 192.168.43.146.7771: UDP, length 120
00:42:29.581617 IP 192.168.43.146.8880 > 192.168.43.147.7772: UDP, length 120
00:42:29.611382 IP 192.168.43.124.8880 > 192.168.43.146.7771: UDP, length 120
00:42:29.631614 IP 192.168.43.146.8880 > 192.168.43.147.7772: UDP, length 120
00:42:29.661779 IP 192.168.43.124.8880 > 192.168.43.146.7771: UDP, length 120
00:42:29.681640 IP 192.168.43.146.8880 > 192.168.43.147.7772: UDP, length 120
00:42:29.711466 IP 192.168.43.124.8880 > 192.168.43.146.7771: UDP, length 120
00:42:29.731608 IP 192.168.43.146.8880 > 192.168.43.147.7772: UDP, length 120
00:42:29.761212 IP 192.168.43.124.8880 > 192.168.43.146.7771: UDP, length 120
00:42:29.781588 IP 192.168.43.146.8880 > 192.168.43.147.7772: UDP, length 120
00:42:29.811386 IP 192.168.43.124.8880 > 192.168.43.146.7771: UDP, length 120
00:42:29.831586 IP 192.168.43.146.8880 > 192.168.43.147.7772: UDP, length 120
00:42:29.861361 IP 192.168.43.124.8880 > 192.168.43.146.7771: UDP, length 120
00:42:29.881589 IP 192.168.43.146.8880 > 192.168.43.147.7772: UDP, length 120
00:42:29.911403 IP 192.168.43.124.8880 > 192.168.43.146.7771: UDP, length 120
