00:42:17.439264 IP 192.168.43.147.8880 > 192.168.43.124.7773: UDP, length 120
00:42:17.489305 IP 192.168.43.147.8880 > 192.168.43.124.7773: UDP, length 120
00:42:17.501247 IP 192.168.43.146.8880 > 192.168.43.147.7772: UDP, length 120
00:42:17.539288 IP 192.168.43.147.8880 > 192.168.43.124.7773: UDP, length 120
00:42:17.553109 IP 192.168.43.146.8880 > 192.168.43.147.7772: UDP, length 120
00:42:17.589285 IP 192.168.43.147.8880 > 192.168.43.124.7773: UDP, length 120
00:42:17.602965 IP 192.168.43.146.8880 > 192.168.43.147.7772: UDP, length 120
00:42:17.639286 IP 192.168.43.147.8880 > 192.168.43.124.7773: UDP, length 120
00:42:17.649526 IP 192.168.43.146.8880 > 192.168.43.147.7772: UDP, length 120
00:42:17.689283 IP 192.168.43.147.8880 > 192.168.43.124.7773: UDP, length 120
00:42:17.701171 IP 192.168.43.146.8880 > 192.168.43.147.7772: UDP, length 120
00:42:17.739284 IP 192.168.43.147.8880 > 192.168.43.124.7773: UDP, length 120
00:42:17.752708 IP 192.168.43.146.8880 > 192.168.43.147.7772: UDP, length 120
00:42:17.789283 IP 192.168.43.147.8880 > 192.168.43.124.7773: UDP, length 120
00:42:17.800468 IP 192.168.43.146.8880 > 192.168.43.147.7772: UDP, length 120
00:42:17.839284 IP 192.168.43.147.8880 > 192.168.43.124.7773: UDP, length 120
00:42:17.848075 IP 192.168.43.146.8880 > 192.168.43.147.7772: UDP, length 120
00:42:17.889306 IP 192.168.43.147.8880 > 192.168.43.124.7773: UDP, length 120
00:42:17.905237 IP 192.168.43.146.8880 > 192.168.43.147.7772: UDP, length 120
00:42:17.939293 IP 192.168.43.147.8880 > 192.168.43.124.7773: UDP, length 120
00:42:17.989283 IP 192.168.43.147.8880 > 192.168.43.124.7773: UDP, length 120
00:42:18.011798 IP 192.168.43.146.8880 > 192.168.43.147.7772: UDP, length 120
00:42:18.012050 IP 192.168.43.146.8880 > 192.168.43.147.7772: UDP, length 120
00:42:18.039284 IP 192.168.43.147.8880 > 192.168.43.124.7773: UDP, length 120
00:42:18.052478 IP 192.168.43.146.8880 > 192.168.43.147.7772: UDP, length 120
00:42:18.089282 IP 192.168.43.147.8880 > 192.168.43.124.7773: UDP, length 120
00:42:18.101382 IP 192.168.43.146.8880 > 192.168.43.147.7772: UDP, length 120
00:42:18.139282 IP 192.168.43.147.8880 > 192.168.43.124.7773: UDP, length 120
00:42:18.153520 IP 192.168.43.146.8880 > 192.168.43.147.7772: UDP, length 120
00:42:18.189284 IP 192.168.43.147.8880 > 192.168.43.124.7773: UDP, length 120
00:42:18.200987 IP 192.168.43.146.8880 > 192.168.43.147.7772: UDP, length 120
00:42:18.239284 IP 192.168.43.147.8880 > 192.168.43.124.7773: UDP, length 120
00:42:18.255800 IP 192.168.43.146.8880 > 192.168.43.147.7772: UDP, length 120
00:42:18.289281 IP 192.168.43.147.8880 > 192.168.43.124.7773: UDP, length 120
00:42:18.311943 IP 192.168.43.146.8880 > 192.168.43.147.7772: UDP, length 120
00:42:18.339302 IP 192.168.43.147.8880 > 192.168.43.124.7773: UDP, length 120
00:42:18.351450 IP 192.168.43.146.8880 > 192.168.43.147.7772: UDP, length 120
00:42:18.389290 IP 192.168.43.147.8880 > 192.168.43.124.7773: UDP, length 120
00:42:18.406374 IP 192.168.43.146.8880 > 192.168.43.147.7772: UDP, length 120
00:42:18.439283 IP 192.168.43.147.8880 > 192.168.43.124.7773: UDP, length 120
00:42:18.460723 IP 192.168.43.146.8880 > 192.168.43.147.7772: UDP, length 120
00:42:18.489283 IP 192.168.43.147.8880 > 192.168.43.124.7773: UDP, length 120
00:42:18.514340 IP 192.168.43.146.8880 > 192.168.43.147.7772: UDP, length 120
00:42:18.539282 IP 192.168.43.147.8880 > 192.168.43.124.7773: UDP, length 120
00:42:18.555365 IP 192.168.43.146.8880 > 192.168.43.147.7772: UDP, length 120
00:42:18.589282 IP 192.168.43.147.8880 > 192.168.43.124.7773: UDP, length 120
00:42:18.602250 IP 192.168.43.146.8880 > 192.168.43.147.7772: UDP, length 120
00:42:18.639291 IP 192.168.43.147.8880 > 192.168.43.124.7773: UDP, length 120
00:42:18.653299 IP 192.168.43.146.8880 > 192.168.43.147.7772: UDP, length 120
00:42:18.689283 IP 192.168.43.147.8880 > 192.168.43.124.7773: UDP, length 120
00:42:18.705452 IP 192.168.43.146.8880 > 192.168.43.147.7772: UDP, length 120
00:42:18.739284 IP 192.168.43.147.8880 > 192.168.43.124.7773: UDP, length 120
00:42:18.749596 IP 192.168.43.146.8880 > 192.168.43.147.7772: UDP, length 120
00:42:18.789377 IP 192.168.43.147.8880 > 192.168.43.124.7773: UDP, length 120
00:42:18.803552 IP 192.168.43.146.8880 > 192.168.43.147.7772: UDP, length 120
00:42:18.839395 IP 192.168.43.147.8880 > 192.168.43.124.7773: UDP, length 120
00:42:18.852692 IP 192.168.43.146.8880 > 192.168.43.147.7772: UDP, length 120
00:42:18.889328 IP 192.168.43.147.8880 > 192.168.43.124.7773: UDP, length 120
00:42:18.904317 IP 192.168.43.146.8880 > 192.168.43.147.7772: UDP, length 120
00:42:18.939318 IP 192.168.43.147.8880 > 192.168.43.124.7773: UDP, length 120
00:42:18.952850 IP 192.168.43.146.8880 > 192.168.43.147.7772: UDP, length 120
00:42:18.989339 IP 192.168.43.147.8880 > 192.168.43.124.7773: UDP, length 120
00:42:19.001198 IP 192.168.43.146.8880 > 192.168.43.147.7772: UDP, length 120
00:42:19.039329 IP 192.168.43.147.8880 > 192.168.43.124.7773: UDP, length 120
00:42:19.052295 IP 192.168.43.146.8880 > 192.168.43.147.7772: UDP, length 120
00:42:19.089336 IP 192.168.43.147.8880 > 192.168.43.124.7773: UDP, length 120
00:42:19.102769 IP 192.168.43.146.8880 > 192.168.43.147.7772: UDP, length 120
00:42:19.139389 IP 192.168.43.147.8880 > 192.168.43.124.7773: UDP, length 120
00:42:19.154737 IP 192.168.43.146.8880 > 192.168.43.147.7772: UDP, length 120
00:42:19.189328 IP 192.168.43.147.8880 > 192.168.43.124.7773: UDP, length 120
00:42:19.228836 IP 192.168.43.146.8880 > 192.168.43.147.7772: UDP, length 120
00:42:19.239299 IP 192.168.43.147.8880 > 192.168.43.124.7773: UDP, length 120
00:42:19.265510 IP 192.168.43.146.8880 > 192.168.43.147.7772: UDP, length 120
00:42:19.289263 IP 192.168.43.147.8880 > 192.168.43.124.7773: UDP, length 120
00:42:19.307036 IP 192.168.43.146.8880 > 192.168.43.147.7772: UDP, length 120
00:42:19.339263 IP 192.168.43.147.8880 > 192.168.43.124.7773: UDP, length 120
00:42:19.352503 IP 192.168.43.146.8880 > 192.168.43.147.7772: UDP, length 120
00:42:19.389259 IP 192.168.43.147.8880 > 192.168.43.124.7773: UDP, length 120
00:42:19.400521 IP 192.168.43.146.8880 > 192.168.43.147.7772: UDP, length 120
00:42:19.439258 IP 192.168.43.147.8880 > 192.168.43.124.7773: UDP, length 120
00:42:19.455267 IP 192.168.43.146.8880 > 192.168.43.147.7772: UDP, length 120
00:42:19.489257 IP 192.168.43.147.8880 > 192.168.43.124.7773: UDP, length 120
00:42:19.500246 IP 192.168.43.146.8880 > 192.168.43.147.7772: UDP, length 120
00:42:19.539256 IP 192.168.43.147.8880 > 192.168.43.124.7773: UDP, length 120
00:42:19.556354 IP 192.168.43.146.8880 > 192.168.43.147.7772: UDP, length 120
00:42:19.589256 IP 192.168.43.147.8880 > 192.168.43.124.7773: UDP, length 120
00:42:19.601480 IP 192.168.43.146.8880 > 192.168.43.147.7772: UDP, length 120
00:42:19.639257 IP 192.168.43.147.8880 > 192.168.43.124.7773: UDP, length 120
00:42:19.651024 IP 192.168.43.146.8880 > 192.168.43.147.7772: UDP, length 120
00:42:19.689257 IP 192.168.43.147.8880 > 192.168.43.124.7773: UDP, length 120
00:42:19.702862 IP 192.168.43.146.8880 > 192.168.43.147.7772: UDP, length 120
00:42:19.739256 IP 192.168.43.147.8880 > 192.168.43.124.7773: UDP, length 120
00:42:19.754463 IP 192.168.43.146.8880 > 192.168.43.147.7772: UDP, length 120
00:42:19.789256 IP 192.168.43.147.8880 > 192.168.43.124.7773: UDP, length 120
00:42:19.802646 IP 192.168.43.146.8880 > 192.168.43.147.7772: UDP, length 120
00:42:19.839256 IP 192.168.43.147.8880 > 192.168.43.124.7773: UDP, length 120
00:42:19.854865 IP 192.168.43.146.8880 > 192.168.43.147.7772: UDP, length 120
00:42:19.889257 IP 192.168.43.147.8880 > 192.168.43.124.7773: UDP, length 120
00:42:19.900616 IP 192.168.43.146.8880 > 192.168.43.147.7772: UDP, length 120
00:42:19.939258 IP 192.168.43.147.8880 > 192.168.43.124.7773: UDP, length 120
00:42:19.952452 IP 192.168.43.146.8880 > 192.168.43.147.7772: UDP, length 120
00:42:19.989262 IP 192.168.43.147.8880 > 192.168.43.124.7773: UDP, length 120
00:42:20.000935 IP 192.168.43.146.8880 > 192.168.43.147.7772: UDP, length 120
00:42:20.039262 IP 192.168.43.147.8880 > 192.168.43.124.7773: UDP, length 120
00:42:20.055744 IP 192.168.43.146.8880 > 192.168.43.147.7772: UDP, length 120
00:42:20.089259 IP 192.168.43.147.8880 > 192.168.43.124.7773: UDP, length 120
00:42:20.098039 IP 192.168.43.146.8880 > 192.168.43.147.7772: UDP, length 120
00:42:20.139258 IP 192.168.43.147.8880 > 192.168.43.124.7773: UDP, length 120
00:42:20.160865 IP 192.168.43.146.8880 > 192.168.43.147.7772: UDP, length 120
00:42:20.189257 IP 192.168.43.147.8880 > 192.168.43.124.7773: UDP, length 120
00:42:20.204460 IP 192.168.43.146.8880 > 192.168.43.147.7772: UDP, length 120
00:42:20.239257 IP 192.168.43.147.8880 > 192.168.43.124.7773: UDP, length 120
00:42:20.249855 IP 192.168.43.146.8880 > 192.168.43.147.7772: UDP, length 120
00:42:20.289256 IP 192.168.43.147.8880 > 192.168.43.124.7773: UDP, length 120
00:42:20.302950 IP 192.168.43.146.8880 > 192.168.43.147.7772: UDP, length 120
00:42:20.339259 IP 192.168.43.147.8880 > 192.168.43.124.7773: UDP, length 120
00:42:20.353391 IP 192.168.43.146.8880 > 192.168.43.147.7772: UDP, length 120
00:42:20.389291 IP 192.168.43.147.8880 > 192.168.43.124.7773: UDP, length 120
00:42:20.403984 IP 192.168.43.146.8880 > 192.168.43.147.7772: UDP, length 120
00:42:20.439264 IP 192.168.43.147.8880 > 192.168.43.124.7773: UDP, length 120
00:42:20.454333 IP 192.168.43.146.8880 > 192.168.43.147.7772: UDP, length 120
00:42:20.489258 IP 192.168.43.147.8880 > 192.168.43.124.7773: UDP, length 120
00:42:20.524850 IP 192.168.43.146.8880 > 192.168.43.147.7772: UDP, length 120
00:42:20.539256 IP 192.168.43.147.8880 > 192.168.43.124.7773: UDP, length 120
00:42:20.551970 IP 192.168.43.146.8880 > 192.168.43.147.7772: UDP, length 120
00:42:20.589256 IP 192.168.43.147.8880 > 192.168.43.124.7773: UDP, length 120
00:42:20.601971 IP 192.168.43.146.8880 > 192.168.43.147.7772: UDP, length 120
00:42:20.639259 IP 192.168.43.147.8880 > 192.168.43.124.7773: UDP, length 120
00:42:20.652244 IP 192.168.43.146.8880 > 192.168.43.147.7772: UDP, length 120
00:42:20.689257 IP 192.168.43.147.8880 > 192.168.43.124.7773: UDP, length 120
00:42:20.703938 IP 192.168.43.146.8880 > 192.168.43.147.7772: UDP, length 120
00:42:20.739257 IP 192.168.43.147.8880 > 192.168.43.124.7773: UDP, length 120
00:42:20.756308 IP 192.168.43.146.8880 > 192.168.43.147.7772: UDP, length 120
00:42:20.789257 IP 192.168.43.147.8880 > 192.168.43.124.7773: UDP, length 120
00:42:20.800330 IP 192.168.43.146.8880 > 192.168.43.147.7772: UDP, length 120
00:42:20.839258 IP 192.168.43.147.8880 > 192.168.43.124.7773: UDP, length 120
00:42:20.852499 IP 192.168.43.146.8880 > 192.168.43.147.7772: UDP, length 120
00:42:20.889258 IP 192.168.43.147.8880 > 192.168.43.124.7773: UDP, length 120
00:42:20.903319 IP 192.168.43.146.8880 > 192.168.43.147.7772: UDP, length 120
00:42:20.939257 IP 192.168.43.147.8880 > 192.168.43.124.7773: UDP, length 120
00:42:20.953953 IP 192.168.43.146.8880 > 192.168.43.147.7772: UDP, length 120
00:42:20.989257 IP 192.168.43.147.8880 > 192.168.43.124.7773: UDP, length 120
00:42:21.002542 IP 192.168.43.146.8880 > 192.168.43.147.7772: UDP, length 120
00:42:21.039259 IP 192.168.43.147.8880 > 192.168.43.124.7773: UDP, length 120
00:42:21.054175 IP 192.168.43.146.8880 > 192.168.43.147.7772: UDP, length 120
00:42:21.089262 IP 192.168.43.147.8880 > 192.168.43.124.7773: UDP, length 120
00:42:21.102668 IP 192.168.43.146.8880 > 192.168.43.147.7772: UDP, length 120
00:42:21.139260 IP 192.168.43.147.8880 > 192.168.43.124.7773: UDP, length 120
00:42:21.156641 IP 192.168.43.146.8880 > 192.168.43.147.7772: UDP, length 120
00:42:21.189257 IP 192.168.43.147.8880 > 192.168.43.124.7773: UDP, length 120
00:42:21.206192 IP 192.168.43.146.8880 > 192.168.43.147.7772: UDP, length 120
00:42:21.239257 IP 192.168.43.147.8880 > 192.168.43.124.7773: UDP, length 120
00:42:21.253338 IP 192.168.43.146.8880 > 192.168.43.147.7772: UDP, length 120
00:42:21.289257 IP 192.168.43.147.8880 > 192.168.43.124.7773: UDP, length 120
00:42:21.305289 IP 192.168.43.146.8880 > 192.168.43.147.7772: UDP, length 120
00:42:21.339259 IP 192.168.43.147.8880 > 192.168.43.124.7773: UDP, length 120
00:42:21.361674 IP 192.168.43.146.8880 > 192.168.43.147.7772: UDP, length 120
00:42:21.389258 IP 192.168.43.147.8880 > 192.168.43.124.7773: UDP, length 120
00:42:21.400067 IP 192.168.43.146.8880 > 192.168.43.147.7772: UDP, length 120
00:42:21.439256 IP 192.168.43.147.8880 > 192.168.43.124.7773: UDP, length 120
00:42:21.454116 IP 192.168.43.146.8880 > 192.168.43.147.7772: UDP, length 120
00:42:21.489256 IP 192.168.43.147.8880 > 192.168.43.124.7773: UDP, length 120
00:42:21.502168 IP 192.168.43.146.8880 > 192.168.43.147.7772: UDP, length 120
00:42:21.539255 IP 192.168.43.147.8880 > 192.168.43.124.7773: UDP, length 120
00:42:21.555769 IP 192.168.43.146.8880 > 192.168.43.147.7772: UDP, length 120
00:42:21.589255 IP 192.168.43.147.8880 > 192.168.43.124.7773: UDP, length 120
00:42:21.601357 IP 192.168.43.146.8880 > 192.168.43.147.7772: UDP, length 120
00:42:21.639257 IP 192.168.43.147.8880 > 192.168.43.124.7773: UDP, length 120
00:42:21.650520 IP 192.168.43.146.8880 > 192.168.43.147.7772: UDP, length 120
00:42:21.689256 IP 192.168.43.147.8880 > 192.168.43.124.7773: UDP, length 120
00:42:21.699888 IP 192.168.43.146.8880 > 192.168.43.147.7772: UDP, length 120
00:42:21.739257 IP 192.168.43.147.8880 > 192.168.43.124.7773: UDP, length 120
00:42:21.752998 IP 192.168.43.146.8880 > 192.168.43.147.7772: UDP, length 120
00:42:21.789257 IP 192.168.43.147.8880 > 192.168.43.124.7773: UDP, length 120
00:42:21.802241 IP 192.168.43.146.8880 > 192.168.43.147.7772: UDP, length 120
00:42:21.839256 IP 192.168.43.147.8880 > 192.168.43.124.7773: UDP, length 120
00:42:21.852928 IP 192.168.43.146.8880 > 192.168.43.147.7772: UDP, length 120
00:42:21.889321 IP 192.168.43.147.8880 > 192.168.43.124.7773: UDP, length 120
00:42:21.902972 IP 192.168.43.146.8880 > 192.168.43.147.7772: UDP, length 120
00:42:21.939288 IP 192.168.43.147.8880 > 192.168.43.124.7773: UDP, length 120
00:42:21.955355 IP 192.168.43.146.8880 > 192.168.43.147.7772: UDP, length 120
00:42:21.989281 IP 192.168.43.147.8880 > 192.168.43.124.7773: UDP, length 120
00:42:22.004016 IP 192.168.43.146.8880 > 192.168.43.147.7772: UDP, length 120
00:42:22.039283 IP 192.168.43.147.8880 > 192.168.43.124.7773: UDP, length 120
00:42:22.050828 IP 192.168.43.146.8880 > 192.168.43.147.7772: UDP, length 120
00:42:22.089285 IP 192.168.43.147.8880 > 192.168.43.124.7773: UDP, length 120
00:42:22.104585 IP 192.168.43.146.8880 > 192.168.43.147.7772: UDP, length 120
00:42:22.139288 IP 192.168.43.147.8880 > 192.168.43.124.7773: UDP, length 120
00:42:22.157297 IP 192.168.43.146.8880 > 192.168.43.147.7772: UDP, length 120
00:42:22.189284 IP 192.168.43.147.8880 > 192.168.43.124.7773: UDP, length 120
00:42:22.205058 IP 192.168.43.146.8880 > 192.168.43.147.7772: UDP, length 120
00:42:22.239281 IP 192.168.43.147.8880 > 192.168.43.124.7773: UDP, length 120
00:42:22.254807 IP 192.168.43.146.8880 > 192.168.43.147.7772: UDP, length 120
00:42:22.289281 IP 192.168.43.147.8880 > 192.168.43.124.7773: UDP, length 120
00:42:22.302984 IP 192.168.43.146.8880 > 192.168.43.147.7772: UDP, length 120
00:42:22.339296 IP 192.168.43.147.8880 > 192.168.43.124.7773: UDP, length 120
00:42:22.351779 IP 192.168.43.146.8880 > 192.168.43.147.7772: UDP, length 120
00:42:22.389293 IP 192.168.43.147.8880 > 192.168.43.124.7773: UDP, length 120
00:42:22.402605 IP 192.168.43.146.8880 > 192.168.43.147.7772: UDP, length 120
00:42:22.439284 IP 192.168.43.147.8880 > 192.168.43.124.7773: UDP, length 120
00:42:22.452065 IP 192.168.43.146.8880 > 192.168.43.147.7772: UDP, length 120
00:42:22.489282 IP 192.168.43.147.8880 > 192.168.43.124.7773: UDP, length 120
00:42:22.502562 IP 192.168.43.146.8880 > 192.168.43.147.7772: UDP, length 120
00:42:22.539281 IP 192.168.43.147.8880 > 192.168.43.124.7773: UDP, length 120
00:42:22.563165 IP 192.168.43.146.8880 > 192.168.43.147.7772: UDP, length 120
00:42:22.589280 IP 192.168.43.147.8880 > 192.168.43.124.7773: UDP, length 120
00:42:22.613530 IP 192.168.43.146.8880 > 192.168.43.147.7772: UDP, length 120
00:42:22.639284 IP 192.168.43.147.8880 > 192.168.43.124.7773: UDP, length 120
00:42:22.676950 IP 192.168.43.146.8880 > 192.168.43.147.7772: UDP, length 120
00:42:22.689282 IP 192.168.43.147.8880 > 192.168.43.124.7773: UDP, length 120
00:42:22.718026 IP 192.168.43.146.8880 > 192.168.43.147.7772: UDP, length 120
00:42:22.739280 IP 192.168.43.147.8880 > 192.168.43.124.7773: UDP, length 120
00:42:22.771567 IP 192.168.43.146.8880 > 192.168.43.147.7772: UDP, length 120
00:42:22.789280 IP 192.168.43.147.8880 > 192.168.43.124.7773: UDP, length 120
00:42:22.816437 IP 192.168.43.146.8880 > 192.168.43.147.7772: UDP, length 120
00:42:22.839284 IP 192.168.43.147.8880 > 192.168.43.124.7773: UDP, length 120
00:42:22.889281 IP 192.168.43.147.8880 > 192.168.43.124.7773: UDP, length 120
00:42:22.903118 IP 192.168.43.146.8880 > 192.168.43.147.7772: UDP, length 120
00:42:22.927392 IP 192.168.43.146.8880 > 192.168.43.147.7772: UDP, length 120
00:42:22.939281 IP 192.168.43.147.8880 > 192.168.43.124.7773: UDP, length 120
00:42:22.989281 IP 192.168.43.147.8880 > 192.168.43.124.7773: UDP, length 120
00:42:23.026332 IP 192.168.43.146.8880 > 192.168.43.147.7772: UDP, length 120
00:42:23.026447 IP 192.168.43.146.8880 > 192.168.43.147.7772: UDP, length 120
00:42:23.039281 IP 192.168.43.147.8880 > 192.168.43.124.7773: UDP, length 120
00:42:23.089280 IP 192.168.43.147.8880 > 192.168.43.124.7773: UDP, length 120
00:42:23.131871 IP 192.168.43.146.8880 > 192.168.43.147.7772: UDP, length 120
00:42:23.132157 IP 192.168.43.146.8880 > 192.168.43.147.7772: UDP, length 120
00:42:23.139286 IP 192.168.43.147.8880 > 192.168.43.124.7773: UDP, length 120
00:42:23.189280 IP 192.168.43.147.8880 > 192.168.43.124.7773: UDP, length 120
00:42:23.233615 IP 192.168.43.146.8880 > 192.168.43.147.7772: UDP, length 120
00:42:23.233881 IP 192.168.43.146.8880 > 192.168.43.147.7772: UDP, length 120
00:42:23.239286 IP 192.168.43.147.8880 > 192.168.43.124.7773: UDP, length 120
00:42:23.289281 IP 192.168.43.147.8880 > 192.168.43.124.7773: UDP, length 120
00:42:23.314913 IP 192.168.43.146.8880 > 192.168.43.147.7772: UDP, length 120
00:42:23.339287 IP 192.168.43.147.8880 > 192.168.43.124.7773: UDP, length 120
00:42:23.340885 IP 192.168.43.146.8880 > 192.168.43.147.7772: UDP, length 120
00:42:23.382011 IP 192.168.43.146.8880 > 192.168.43.147.7772: UDP, length 120
00:42:23.389318 IP 192.168.43.147.8880 > 192.168.43.124.7773: UDP, length 120
00:42:23.428973 IP 192.168.43.146.8880 > 192.168.43.147.7772: UDP, length 120
00:42:23.439286 IP 192.168.43.147.8880 > 192.168.43.124.7773: UDP, length 120
00:42:23.489280 IP 192.168.43.147.8880 > 192.168.43.124.7773: UDP, length 120
00:42:23.539281 IP 192.168.43.147.8880 > 192.168.43.124.7773: UDP, length 120
00:42:23.541068 IP 192.168.43.146.8880 > 192.168.43.147.7772: UDP, length 120
00:42:23.541342 IP 192.168.43.146.8880 > 192.168.43.147.7772: UDP, length 120
00:42:23.588498 IP 192.168.43.146.8880 > 192.168.43.147.7772: UDP, length 120
00:42:23.589283 IP 192.168.43.147.8880 > 192.168.43.124.7773: UDP, length 120
00:42:23.622928 IP 192.168.43.146.8880 > 192.168.43.147.7772: UDP, length 120
00:42:23.639285 IP 192.168.43.147.8880 > 192.168.43.124.7773: UDP, length 120
00:42:23.689283 IP 192.168.43.147.8880 > 192.168.43.124.7773: UDP, length 120
00:42:23.711521 IP 192.168.43.146.8880 > 192.168.43.147.7772: UDP, length 120
00:42:23.711782 IP 192.168.43.146.8880 > 192.168.43.147.7772: UDP, length 120
00:42:23.739288 IP 192.168.43.147.8880 > 192.168.43.124.7773: UDP, length 120
00:42:23.754147 IP 192.168.43.146.8880 > 192.168.43.147.7772: UDP, length 120
00:42:23.789283 IP 192.168.43.147.8880 > 192.168.43.124.7773: UDP, length 120
00:42:23.839281 IP 192.168.43.147.8880 > 192.168.43.124.7773: UDP, length 120
00:42:23.845702 IP 192.168.43.146.8880 > 192.168.43.147.7772: UDP, length 120
00:42:23.889280 IP 192.168.43.147.8880 > 192.168.43.124.7773: UDP, length 120
00:42:23.902714 IP 192.168.43.146.8880 > 192.168.43.147.7772: UDP, length 120
00:42:23.939283 IP 192.168.43.147.8880 > 192.168.43.124.7773: UDP, length 120
00:42:23.949874 IP 192.168.43.146.8880 > 192.168.43.147.7772: UDP, length 120
00:42:23.951405 IP 192.168.43.146.8880 > 192.168.43.147.7772: UDP, length 120
00:42:23.989283 IP 192.168.43.147.8880 > 192.168.43.124.7773: UDP, length 120
00:42:24.007000 IP 192.168.43.146.8880 > 192.168.43.147.7772: UDP, length 120
00:42:24.039281 IP 192.168.43.147.8880 > 192.168.43.124.7773: UDP, length 120
00:42:24.050004 IP 192.168.43.146.8880 > 192.168.43.147.7772: UDP, length 120
00:42:24.089281 IP 192.168.43.147.8880 > 192.168.43.124.7773: UDP, length 120
00:42:24.121253 IP 192.168.43.146.8880 > 192.168.43.147.7772: UDP, length 120
00:42:24.139283 IP 192.168.43.147.8880 > 192.168.43.124.7773: UDP, length 120
00:42:24.173505 IP 192.168.43.146.8880 > 192.168.43.147.7772: UDP, length 120
00:42:24.189282 IP 192.168.43.147.8880 > 192.168.43.124.7773: UDP, length 120
00:42:24.202950 IP 192.168.43.146.8880 > 192.168.43.147.7772: UDP, length 120
00:42:24.239360 IP 192.168.43.147.8880 > 192.168.43.124.7773: UDP, length 120
00:42:24.254577 IP 192.168.43.146.8880 > 192.168.43.147.7772: UDP, length 120
00:42:24.289380 IP 192.168.43.147.8880 > 192.168.43.124.7773: UDP, length 120
00:42:24.298110 IP 192.168.43.146.8880 > 192.168.43.147.7772: UDP, length 120
00:42:24.339377 IP 192.168.43.147.8880 > 192.168.43.124.7773: UDP, length 120
00:42:24.363892 IP 192.168.43.146.8880 > 192.168.43.147.7772: UDP, length 120
00:42:24.389326 IP 192.168.43.147.8880 > 192.168.43.124.7773: UDP, length 120
00:42:24.403558 IP 192.168.43.146.8880 > 192.168.43.147.7772: UDP, length 120
00:42:24.439338 IP 192.168.43.147.8880 > 192.168.43.124.7773: UDP, length 120
00:42:24.451802 IP 192.168.43.146.8880 > 192.168.43.147.7772: UDP, length 120
00:42:24.489345 IP 192.168.43.147.8880 > 192.168.43.124.7773: UDP, length 120
00:42:24.502694 IP 192.168.43.146.8880 > 192.168.43.147.7772: UDP, length 120
00:42:24.539344 IP 192.168.43.147.8880 > 192.168.43.124.7773: UDP, length 120
00:42:24.553458 IP 192.168.43.146.8880 > 192.168.43.147.7772: UDP, length 120
00:42:24.589337 IP 192.168.43.147.8880 > 192.168.43.124.7773: UDP, length 120
00:42:24.602613 IP 192.168.43.146.8880 > 192.168.43.147.7772: UDP, length 120
00:42:24.639343 IP 192.168.43.147.8880 > 192.168.43.124.7773: UDP, length 120
00:42:24.652802 IP 192.168.43.146.8880 > 192.168.43.147.7772: UDP, length 120
00:42:24.689339 IP 192.168.43.147.8880 > 192.168.43.124.7773: UDP, length 120
00:42:24.702925 IP 192.168.43.146.8880 > 192.168.43.147.7772: UDP, length 120
00:42:24.739306 IP 192.168.43.147.8880 > 192.168.43.124.7773: UDP, length 120
00:42:24.748671 IP 192.168.43.146.8880 > 192.168.43.147.7772: UDP, length 120
00:42:24.789261 IP 192.168.43.147.8880 > 192.168.43.124.7773: UDP, length 120
00:42:24.799927 IP 192.168.43.146.8880 > 192.168.43.147.7772: UDP, length 120
00:42:24.839260 IP 192.168.43.147.8880 > 192.168.43.124.7773: UDP, length 120
00:42:24.851765 IP 192.168.43.146.8880 > 192.168.43.147.7772: UDP, length 120
00:42:24.889289 IP 192.168.43.147.8880 > 192.168.43.124.7773: UDP, length 120
00:42:24.902301 IP 192.168.43.146.8880 > 192.168.43.147.7772: UDP, length 120
00:42:24.939264 IP 192.168.43.147.8880 > 192.168.43.124.7773: UDP, length 120
00:42:24.952676 IP 192.168.43.146.8880 > 192.168.43.147.7772: UDP, length 120
00:42:24.989259 IP 192.168.43.147.8880 > 192.168.43.124.7773: UDP, length 120
00:42:25.004867 IP 192.168.43.146.8880 > 192.168.43.147.7772: UDP, length 120
00:42:25.039258 IP 192.168.43.147.8880 > 192.168.43.124.7773: UDP, length 120
00:42:25.053521 IP 192.168.43.146.8880 > 192.168.43.147.7772: UDP, length 120
00:42:25.089257 IP 192.168.43.147.8880 > 192.168.43.124.7773: UDP, length 120
00:42:25.100600 IP 192.168.43.146.8880 > 192.168.43.147.7772: UDP, length 120
00:42:25.139257 IP 192.168.43.147.8880 > 192.168.43.124.7773: UDP, length 120
00:42:25.152634 IP 192.168.43.146.8880 > 192.168.43.147.7772: UDP, length 120
00:42:25.189257 IP 192.168.43.147.8880 > 192.168.43.124.7773: UDP, length 120
00:42:25.204019 IP 192.168.43.146.8880 > 192.168.43.147.7772: UDP, length 120
00:42:25.239258 IP 192.168.43.147.8880 > 192.168.43.124.7773: UDP, length 120
00:42:25.260564 IP 192.168.43.146.8880 > 192.168.43.147.7772: UDP, length 120
00:42:25.289264 IP 192.168.43.147.8880 > 192.168.43.124.7773: UDP, length 120
00:42:25.302857 IP 192.168.43.146.8880 > 192.168.43.147.7772: UDP, length 120
00:42:25.339265 IP 192.168.43.147.8880 > 192.168.43.124.7773: UDP, length 120
00:42:25.354475 IP 192.168.43.146.8880 > 192.168.43.147.7772: UDP, length 120
00:42:25.389260 IP 192.168.43.147.8880 > 192.168.43.124.7773: UDP, length 120
00:42:25.402256 IP 192.168.43.146.8880 > 192.168.43.147.7772: UDP, length 120
00:42:25.439257 IP 192.168.43.147.8880 > 192.168.43.124.7773: UDP, length 120
00:42:25.449821 IP 192.168.43.146.8880 > 192.168.43.147.7772: UDP, length 120
00:42:25.489256 IP 192.168.43.147.8880 > 192.168.43.124.7773: UDP, length 120
00:42:25.497982 IP 192.168.43.146.8880 > 192.168.43.147.7772: UDP, length 120
00:42:25.539256 IP 192.168.43.147.8880 > 192.168.43.124.7773: UDP, length 120
00:42:25.552364 IP 192.168.43.146.8880 > 192.168.43.147.7772: UDP, length 120
00:42:25.589256 IP 192.168.43.147.8880 > 192.168.43.124.7773: UDP, length 120
00:42:25.610751 IP 192.168.43.146.8880 > 192.168.43.147.7772: UDP, length 120
00:42:25.639257 IP 192.168.43.147.8880 > 192.168.43.124.7773: UDP, length 120
00:42:25.654344 IP 192.168.43.146.8880 > 192.168.43.147.7772: UDP, length 120
00:42:25.689256 IP 192.168.43.147.8880 > 192.168.43.124.7773: UDP, length 120
00:42:25.703024 IP 192.168.43.146.8880 > 192.168.43.147.7772: UDP, length 120
00:42:25.739255 IP 192.168.43.147.8880 > 192.168.43.124.7773: UDP, length 120
00:42:25.756150 IP 192.168.43.146.8880 > 192.168.43.147.7772: UDP, length 120
00:42:25.789255 IP 192.168.43.147.8880 > 192.168.43.124.7773: UDP, length 120
00:42:25.803018 IP 192.168.43.146.8880 > 192.168.43.147.7772: UDP, length 120
00:42:25.839256 IP 192.168.43.147.8880 > 192.168.43.124.7773: UDP, length 120
00:42:25.850464 IP 192.168.43.146.8880 > 192.168.43.147.7772: UDP, length 120
00:42:25.889257 IP 192.168.43.147.8880 > 192.168.43.124.7773: UDP, length 120
00:42:25.905192 IP 192.168.43.146.8880 > 192.168.43.147.7772: UDP, length 120
00:42:25.939256 IP 192.168.43.147.8880 > 192.168.43.124.7773: UDP, length 120
00:42:25.952002 IP 192.168.43.146.8880 > 192.168.43.147.7772: UDP, length 120
00:42:25.989255 IP 192.168.43.147.8880 > 192.168.43.124.7773: UDP, length 120
00:42:26.004570 IP 192.168.43.146.8880 > 192.168.43.147.7772: UDP, length 120
00:42:26.039273 IP 192.168.43.147.8880 > 192.168.43.124.7773: UDP, length 120
00:42:26.053835 IP 192.168.43.146.8880 > 192.168.43.147.7772: UDP, length 120
00:42:26.089262 IP 192.168.43.147.8880 > 192.168.43.124.7773: UDP, length 120
00:42:26.106970 IP 192.168.43.146.8880 > 192.168.43.147.7772: UDP, length 120
00:42:26.139257 IP 192.168.43.147.8880 > 192.168.43.124.7773: UDP, length 120
00:42:26.182150 IP 192.168.43.146.8880 > 192.168.43.147.7772: UDP, length 120
00:42:26.189263 IP 192.168.43.147.8880 > 192.168.43.124.7773: UDP, length 120
00:42:26.202297 IP 192.168.43.146.8880 > 192.168.43.147.7772: UDP, length 120
00:42:26.239265 IP 192.168.43.147.8880 > 192.168.43.124.7773: UDP, length 120
00:42:26.252421 IP 192.168.43.146.8880 > 192.168.43.147.7772: UDP, length 120
00:42:26.289263 IP 192.168.43.147.8880 > 192.168.43.124.7773: UDP, length 120
00:42:26.305275 IP 192.168.43.146.8880 > 192.168.43.147.7772: UDP, length 120
00:42:26.339266 IP 192.168.43.147.8880 > 192.168.43.124.7773: UDP, length 120
00:42:26.352736 IP 192.168.43.146.8880 > 192.168.43.147.7772: UDP, length 120
00:42:26.389290 IP 192.168.43.147.8880 > 192.168.43.124.7773: UDP, length 120
00:42:26.404456 IP 192.168.43.146.8880 > 192.168.43.147.7772: UDP, length 120
00:42:26.439264 IP 192.168.43.147.8880 > 192.168.43.124.7773: UDP, length 120
00:42:26.467394 IP 192.168.43.146.8880 > 192.168.43.147.7772: UDP, length 120
00:42:26.489258 IP 192.168.43.147.8880 > 192.168.43.124.7773: UDP, length 120
00:42:26.504826 IP 192.168.43.146.8880 > 192.168.43.147.7772: UDP, length 120
00:42:26.539256 IP 192.168.43.147.8880 > 192.168.43.124.7773: UDP, length 120
00:42:26.552563 IP 192.168.43.146.8880 > 192.168.43.147.7772: UDP, length 120
00:42:26.589256 IP 192.168.43.147.8880 > 192.168.43.124.7773: UDP, length 120
00:42:26.602594 IP 192.168.43.146.8880 > 192.168.43.147.7772: UDP, length 120
00:42:26.639257 IP 192.168.43.147.8880 > 192.168.43.124.7773: UDP, length 120
00:42:26.653511 IP 192.168.43.146.8880 > 192.168.43.147.7772: UDP, length 120
00:42:26.689258 IP 192.168.43.147.8880 > 192.168.43.124.7773: UDP, length 120
00:42:26.700670 IP 192.168.43.146.8880 > 192.168.43.147.7772: UDP, length 120
00:42:26.739257 IP 192.168.43.147.8880 > 192.168.43.124.7773: UDP, length 120
00:42:26.755096 IP 192.168.43.146.8880 > 192.168.43.147.7772: UDP, length 120
00:42:26.789256 IP 192.168.43.147.8880 > 192.168.43.124.7773: UDP, length 120
00:42:26.802456 IP 192.168.43.146.8880 > 192.168.43.147.7772: UDP, length 120
00:42:26.839256 IP 192.168.43.147.8880 > 192.168.43.124.7773: UDP, length 120
00:42:26.854768 IP 192.168.43.146.8880 > 192.168.43.147.7772: UDP, length 120
00:42:26.889282 IP 192.168.43.147.8880 > 192.168.43.124.7773: UDP, length 120
00:42:26.923734 IP 192.168.43.146.8880 > 192.168.43.147.7772: UDP, length 120
00:42:26.939284 IP 192.168.43.147.8880 > 192.168.43.124.7773: UDP, length 120
00:42:26.954830 IP 192.168.43.146.8880 > 192.168.43.147.7772: UDP, length 120
00:42:26.989283 IP 192.168.43.147.8880 > 192.168.43.124.7773: UDP, length 120
00:42:27.012026 IP 192.168.43.146.8880 > 192.168.43.147.7772: UDP, length 120
00:42:27.039284 IP 192.168.43.147.8880 > 192.168.43.124.7773: UDP, length 120
00:42:27.051623 IP 192.168.43.146.8880 > 192.168.43.147.7772: UDP, length 120
00:42:27.089282 IP 192.168.43.147.8880 > 192.168.43.124.7773: UDP, length 120
00:42:27.103963 IP 192.168.43.146.8880 > 192.168.43.147.7772: UDP, length 120
00:42:27.139283 IP 192.168.43.147.8880 > 192.168.43.124.7773: UDP, length 120
00:42:27.153202 IP 192.168.43.146.8880 > 192.168.43.147.7772: UDP, length 120
00:42:27.189283 IP 192.168.43.147.8880 > 192.168.43.124.7773: UDP, length 120
00:42:27.204227 IP 192.168.43.146.8880 > 192.168.43.147.7772: UDP, length 120
00:42:27.239283 IP 192.168.43.147.8880 > 192.168.43.124.7773: UDP, length 120
00:42:27.252417 IP 192.168.43.146.8880 > 192.168.43.147.7772: UDP, length 120
00:42:27.289282 IP 192.168.43.147.8880 > 192.168.43.124.7773: UDP, length 120
00:42:27.302846 IP 192.168.43.146.8880 > 192.168.43.147.7772: UDP, length 120
00:42:27.339291 IP 192.168.43.147.8880 > 192.168.43.124.7773: UDP, length 120
00:42:27.352968 IP 192.168.43.146.8880 > 192.168.43.147.7772: UDP, length 120
00:42:27.389292 IP 192.168.43.147.8880 > 192.168.43.124.7773: UDP, length 120
00:42:27.401484 IP 192.168.43.146.8880 > 192.168.43.147.7772: UDP, length 120
00:42:27.439289 IP 192.168.43.147.8880 > 192.168.43.124.7773: UDP, length 120
00:42:27.454107 IP 192.168.43.146.8880 > 192.168.43.147.7772: UDP, length 120
00:42:27.489282 IP 192.168.43.147.8880 > 192.168.43.124.7773: UDP, length 120
00:42:27.502526 IP 192.168.43.146.8880 > 192.168.43.147.7772: UDP, length 120
00:42:27.539283 IP 192.168.43.147.8880 > 192.168.43.124.7773: UDP, length 120
00:42:27.553444 IP 192.168.43.146.8880 > 192.168.43.147.7772: UDP, length 120
00:42:27.589281 IP 192.168.43.147.8880 > 192.168.43.124.7773: UDP, length 120
00:42:27.615749 IP 192.168.43.146.8880 > 192.168.43.147.7772: UDP, length 120
00:42:27.639284 IP 192.168.43.147.8880 > 192.168.43.124.7773: UDP, length 120
00:42:27.662112 IP 192.168.43.146.8880 > 192.168.43.147.7772: UDP, length 120
00:42:27.689283 IP 192.168.43.147.8880 > 192.168.43.124.7773: UDP, length 120
00:42:27.702486 IP 192.168.43.146.8880 > 192.168.43.147.7772: UDP, length 120
00:42:27.739282 IP 192.168.43.147.8880 > 192.168.43.124.7773: UDP, length 120
00:42:27.753457 IP 192.168.43.146.8880 > 192.168.43.147.7772: UDP, length 120
00:42:27.789282 IP 192.168.43.147.8880 > 192.168.43.124.7773: UDP, length 120
00:42:27.821522 IP 192.168.43.146.8880 > 192.168.43.147.7772: UDP, length 120
00:42:27.839281 IP 192.168.43.147.8880 > 192.168.43.124.7773: UDP, length 120
00:42:27.850982 IP 192.168.43.146.8880 > 192.168.43.147.7772: UDP, length 120
00:42:27.889323 IP 192.168.43.147.8880 > 192.168.43.124.7773: UDP, length 120
00:42:27.939295 IP 192.168.43.147.8880 > 192.168.43.124.7773: UDP, length 120
00:42:27.942716 IP 192.168.43.146.8880 > 192.168.43.147.7772: UDP, length 120
00:42:27.965697 IP 192.168.43.146.8880 > 192.168.43.147.7772: UDP, length 120
00:42:27.989288 IP 192.168.43.147.8880 > 192.168.43.124.7773: UDP, length 120
00:42:28.026536 IP 192.168.43.146.8880 > 192.168.43.147.7772: UDP, length 120
00:42:28.039283 IP 192.168.43.147.8880 > 192.168.43.124.7773: UDP, length 120
00:42:28.052682 IP 192.168.43.146.8880 > 192.168.43.147.7772: UDP, length 120
00:42:28.089282 IP 192.168.43.147.8880 > 192.168.43.124.7773: UDP, length 120
00:42:28.100964 IP 192.168.43.146.8880 > 192.168.43.147.7772: UDP, length 120
00:42:28.139283 IP 192.168.43.147.8880 > 192.168.43.124.7773: UDP, length 120
00:42:28.161988 IP 192.168.43.146.8880 > 192.168.43.147.7772: UDP, length 120
00:42:28.189283 IP 192.168.43.147.8880 > 192.168.43.124.7773: UDP, length 120
00:42:28.239281 IP 192.168.43.147.8880 > 192.168.43.124.7773: UDP, length 120
00:42:28.245575 IP 192.168.43.146.8880 > 192.168.43.147.7772: UDP, length 120
00:42:28.262637 IP 192.168.43.146.8880 > 192.168.43.147.7772: UDP, length 120
00:42:28.289282 IP 192.168.43.147.8880 > 192.168.43.124.7773: UDP, length 120
00:42:28.334225 IP 192.168.43.146.8880 > 192.168.43.147.7772: UDP, length 120
00:42:28.339293 IP 192.168.43.147.8880 > 192.168.43.124.7773: UDP, length 120
00:42:28.349565 IP 192.168.43.146.8880 > 192.168.43.147.7772: UDP, length 120
00:42:28.389301 IP 192.168.43.147.8880 > 192.168.43.124.7773: UDP, length 120
00:42:28.427454 IP 192.168.43.146.8880 > 192.168.43.147.7772: UDP, length 120
00:42:28.439293 IP 192.168.43.147.8880 > 192.168.43.124.7773: UDP, length 120
00:42:28.451080 IP 192.168.43.146.8880 > 192.168.43.147.7772: UDP, length 120
00:42:28.489290 IP 192.168.43.147.8880 > 192.168.43.124.7773: UDP, length 120
00:42:28.505863 IP 192.168.43.146.8880 > 192.168.43.147.7772: UDP, length 120
00:42:28.539284 IP 192.168.43.147.8880 > 192.168.43.124.7773: UDP, length 120
00:42:28.553176 IP 192.168.43.146.8880 > 192.168.43.147.7772: UDP, length 120
00:42:28.589282 IP 192.168.43.147.8880 > 192.168.43.124.7773: UDP, length 120
00:42:28.603950 IP 192.168.43.146.8880 > 192.168.43.147.7772: UDP, length 120
00:42:28.639283 IP 192.168.43.147.8880 > 192.168.43.124.7773: UDP, length 120
00:42:28.652922 IP 192.168.43.146.8880 > 192.168.43.147.7772: UDP, length 120
00:42:28.689282 IP 192.168.43.147.8880 > 192.168.43.124.7773: UDP, length 120
00:42:28.711019 IP 192.168.43.146.8880 > 192.168.43.147.7772: UDP, length 120
00:42:28.739281 IP 192.168.43.147.8880 > 192.168.43.124.7773: UDP, length 120
00:42:28.762373 IP 192.168.43.146.8880 > 192.168.43.147.7772: UDP, length 120
00:42:28.789281 IP 192.168.43.147.8880 > 192.168.43.124.7773: UDP, length 120
00:42:28.806845 IP 192.168.43.146.8880 > 192.168.43.147.7772: UDP, length 120
00:42:28.839280 IP 192.168.43.147.8880 > 192.168.43.124.7773: UDP, length 120
00:42:28.853326 IP 192.168.43.146.8880 > 192.168.43.147.7772: UDP, length 120
00:42:28.889286 IP 192.168.43.147.8880 > 192.168.43.124.7773: UDP, length 120
00:42:28.914315 IP 192.168.43.146.8880 > 192.168.43.147.7772: UDP, length 120
00:42:28.939283 IP 192.168.43.147.8880 > 192.168.43.124.7773: UDP, length 120
00:42:28.953422 IP 192.168.43.146.8880 > 192.168.43.147.7772: UDP, length 120
00:42:28.989282 IP 192.168.43.147.8880 > 192.168.43.124.7773: UDP, length 120
00:42:29.016621 IP 192.168.43.146.8880 > 192.168.43.147.7772: UDP, length 120
00:42:29.039282 IP 192.168.43.147.8880 > 192.168.43.124.7773: UDP, length 120
00:42:29.053879 IP 192.168.43.146.8880 > 192.168.43.147.7772: UDP, length 120
00:42:29.089281 IP 192.168.43.147.8880 > 192.168.43.124.7773: UDP, length 120
00:42:29.119367 IP 192.168.43.146.8880 > 192.168.43.147.7772: UDP, length 120
00:42:29.139282 IP 192.168.43.147.8880 > 192.168.43.124.7773: UDP, length 120
00:42:29.171671 IP 192.168.43.146.8880 > 192.168.43.147.7772: UDP, length 120
00:42:29.189281 IP 192.168.43.147.8880 > 192.168.43.124.7773: UDP, length 120
00:42:29.205080 IP 192.168.43.146.8880 > 192.168.43.147.7772: UDP, length 120
00:42:29.239281 IP 192.168.43.147.8880 > 192.168.43.124.7773: UDP, length 120
00:42:29.272022 IP 192.168.43.146.8880 > 192.168.43.147.7772: UDP, length 120
00:42:29.289281 IP 192.168.43.147.8880 > 192.168.43.124.7773: UDP, length 120
00:42:29.339283 IP 192.168.43.147.8880 > 192.168.43.124.7773: UDP, length 120
00:42:29.343426 IP 192.168.43.146.8880 > 192.168.43.147.7772: UDP, length 120
00:42:29.376659 IP 192.168.43.146.8880 > 192.168.43.147.7772: UDP, length 120
00:42:29.389322 IP 192.168.43.147.8880 > 192.168.43.124.7773: UDP, length 120
00:42:29.439286 IP 192.168.43.147.8880 > 192.168.43.124.7773: UDP, length 120
00:42:29.442711 IP 192.168.43.146.8880 > 192.168.43.147.7772: UDP, length 120
00:42:29.467687 IP 192.168.43.146.8880 > 192.168.43.147.7772: UDP, length 120
00:42:29.489288 IP 192.168.43.147.8880 > 192.168.43.124.7773: UDP, length 120
00:42:29.499266 IP 192.168.43.146.8880 > 192.168.43.147.7772: UDP, length 120
00:42:29.539283 IP 192.168.43.147.8880 > 192.168.43.124.7773: UDP, length 120
00:42:29.561832 IP 192.168.43.146.8880 > 192.168.43.147.7772: UDP, length 120
00:42:29.589286 IP 192.168.43.147.8880 > 192.168.43.124.7773: UDP, length 120
00:42:29.605596 IP 192.168.43.146.8880 > 192.168.43.147.7772: UDP, length 120
00:42:29.639284 IP 192.168.43.147.8880 > 192.168.43.124.7773: UDP, length 120
00:42:29.689282 IP 192.168.43.147.8880 > 192.168.43.124.7773: UDP, length 120
00:42:29.689960 IP 192.168.43.146.8880 > 192.168.43.147.7772: UDP, length 120
00:42:29.704544 IP 192.168.43.146.8880 > 192.168.43.147.7772: UDP, length 120
00:42:29.739376 IP 192.168.43.147.8880 > 192.168.43.124.7773: UDP, length 120
00:42:29.755502 IP 192.168.43.146.8880 > 192.168.43.147.7772: UDP, length 120
00:42:29.789332 IP 192.168.43.147.8880 > 192.168.43.124.7773: UDP, length 120
00:42:29.805355 IP 192.168.43.146.8880 > 192.168.43.147.7772: UDP, length 120
00:42:29.839325 IP 192.168.43.147.8880 > 192.168.43.124.7773: UDP, length 120
00:42:29.852232 IP 192.168.43.146.8880 > 192.168.43.147.7772: UDP, length 120
00:42:29.889346 IP 192.168.43.147.8880 > 192.168.43.124.7773: UDP, length 120
00:42:29.903593 IP 192.168.43.146.8880 > 192.168.43.147.7772: UDP, length 120
00:42:29.939327 IP 192.168.43.147.8880 > 192.168.43.124.7773: UDP, length 120
00:42:29.954469 IP 192.168.43.146.8880 > 192.168.43.147.7772: UDP, length 120
00:42:29.989314 IP 192.168.43.147.8880 > 192.168.43.124.7773: UDP, length 120
00:42:30.002478 IP 192.168.43.146.8880 > 192.168.43.147.7772: UDP, length 120
00:42:30.039364 IP 192.168.43.147.8880 > 192.168.43.124.7773: UDP, length 120
00:42:30.060720 IP 192.168.43.146.8880 > 192.168.43.147.7772: UDP, length 120
00:42:30.089343 IP 192.168.43.147.8880 > 192.168.43.124.7773: UDP, length 120
00:42:30.104151 IP 192.168.43.146.8880 > 192.168.43.147.7772: UDP, length 120
00:42:30.139332 IP 192.168.43.147.8880 > 192.168.43.124.7773: UDP, length 120
00:42:30.150579 IP 192.168.43.146.8880 > 192.168.43.147.7772: UDP, length 120
00:42:30.189314 IP 192.168.43.147.8880 > 192.168.43.124.7773: UDP, length 120
00:42:30.199364 IP 192.168.43.146.8880 > 192.168.43.147.7772: UDP, length 120
00:42:30.239267 IP 192.168.43.147.8880 > 192.168.43.124.7773: UDP, length 120
