23:32:41.380953 IP 192.168.43.124.8880 > 192.168.43.195.7771: UDP, length 120
23:32:41.431101 IP 192.168.43.124.8880 > 192.168.43.195.7771: UDP, length 120
23:32:41.481098 IP 192.168.43.124.8880 > 192.168.43.195.7771: UDP, length 120
23:32:41.531102 IP 192.168.43.124.8880 > 192.168.43.195.7771: UDP, length 120
23:32:41.581102 IP 192.168.43.124.8880 > 192.168.43.195.7771: UDP, length 120
23:32:41.631102 IP 192.168.43.124.8880 > 192.168.43.195.7771: UDP, length 120
23:32:41.681102 IP 192.168.43.124.8880 > 192.168.43.195.7771: UDP, length 120
23:32:41.731101 IP 192.168.43.124.8880 > 192.168.43.195.7771: UDP, length 120
23:32:41.781101 IP 192.168.43.124.8880 > 192.168.43.195.7771: UDP, length 120
23:32:41.831102 IP 192.168.43.124.8880 > 192.168.43.195.7771: UDP, length 120
23:32:41.881101 IP 192.168.43.124.8880 > 192.168.43.195.7771: UDP, length 120
23:32:41.931102 IP 192.168.43.124.8880 > 192.168.43.195.7771: UDP, length 120
23:32:41.981102 IP 192.168.43.124.8880 > 192.168.43.195.7771: UDP, length 120
23:32:42.031103 IP 192.168.43.124.8880 > 192.168.43.195.7771: UDP, length 120
23:32:42.081103 IP 192.168.43.124.8880 > 192.168.43.195.7771: UDP, length 120
23:32:42.131101 IP 192.168.43.124.8880 > 192.168.43.195.7771: UDP, length 120
23:32:42.181102 IP 192.168.43.124.8880 > 192.168.43.195.7771: UDP, length 120
23:32:42.231103 IP 192.168.43.124.8880 > 192.168.43.195.7771: UDP, length 120
23:32:42.281155 IP 192.168.43.124.8880 > 192.168.43.195.7771: UDP, length 120
23:32:42.331149 IP 192.168.43.124.8880 > 192.168.43.195.7771: UDP, length 120
23:32:42.381153 IP 192.168.43.124.8880 > 192.168.43.195.7771: UDP, length 120
23:32:42.431155 IP 192.168.43.124.8880 > 192.168.43.195.7771: UDP, length 120
23:32:42.474046 IP 192.168.43.195.8880 > 192.168.43.124.7772: UDP, length 120
23:32:42.481153 IP 192.168.43.124.8880 > 192.168.43.195.7771: UDP, length 120
23:32:42.523143 IP 192.168.43.195.8880 > 192.168.43.124.7772: UDP, length 120
23:32:42.531154 IP 192.168.43.124.8880 > 192.168.43.195.7771: UDP, length 120
23:32:42.576569 IP 192.168.43.195.8880 > 192.168.43.124.7772: UDP, length 120
23:32:42.581152 IP 192.168.43.124.8880 > 192.168.43.195.7771: UDP, length 120
23:32:42.623883 IP 192.168.43.195.8880 > 192.168.43.124.7772: UDP, length 120
23:32:42.631154 IP 192.168.43.124.8880 > 192.168.43.195.7771: UDP, length 120
23:32:42.680699 IP 192.168.43.195.8880 > 192.168.43.124.7772: UDP, length 120
23:32:42.681116 IP 192.168.43.124.8880 > 192.168.43.195.7771: UDP, length 120
23:32:42.723261 IP 192.168.43.195.8880 > 192.168.43.124.7772: UDP, length 120
23:32:42.731152 IP 192.168.43.124.8880 > 192.168.43.195.7771: UDP, length 120
23:32:42.781152 IP 192.168.43.124.8880 > 192.168.43.195.7771: UDP, length 120
23:32:42.790445 IP 192.168.43.195.8880 > 192.168.43.124.7772: UDP, length 120
23:32:42.828730 IP 192.168.43.195.8880 > 192.168.43.124.7772: UDP, length 120
23:32:42.831152 IP 192.168.43.124.8880 > 192.168.43.195.7771: UDP, length 120
23:32:42.881153 IP 192.168.43.124.8880 > 192.168.43.195.7771: UDP, length 120
23:32:42.884170 IP 192.168.43.195.8880 > 192.168.43.124.7772: UDP, length 120
23:32:42.922321 IP 192.168.43.195.8880 > 192.168.43.124.7772: UDP, length 120
23:32:42.931038 IP 192.168.43.124.8880 > 192.168.43.195.7771: UDP, length 120
23:32:42.972909 IP 192.168.43.195.8880 > 192.168.43.124.7772: UDP, length 120
23:32:42.981034 IP 192.168.43.124.8880 > 192.168.43.195.7771: UDP, length 120
23:32:43.023683 IP 192.168.43.195.8880 > 192.168.43.124.7772: UDP, length 120
23:32:43.031048 IP 192.168.43.124.8880 > 192.168.43.195.7771: UDP, length 120
23:32:43.072480 IP 192.168.43.195.8880 > 192.168.43.124.7772: UDP, length 120
23:32:43.081103 IP 192.168.43.124.8880 > 192.168.43.195.7771: UDP, length 120
23:32:43.126132 IP 192.168.43.195.8880 > 192.168.43.124.7772: UDP, length 120
23:32:43.131101 IP 192.168.43.124.8880 > 192.168.43.195.7771: UDP, length 120
23:32:43.174213 IP 192.168.43.195.8880 > 192.168.43.124.7772: UDP, length 120
23:32:43.181102 IP 192.168.43.124.8880 > 192.168.43.195.7771: UDP, length 120
23:32:43.228405 IP 192.168.43.195.8880 > 192.168.43.124.7772: UDP, length 120
23:32:43.231101 IP 192.168.43.124.8880 > 192.168.43.195.7771: UDP, length 120
23:32:43.278368 IP 192.168.43.195.8880 > 192.168.43.124.7772: UDP, length 120
23:32:43.281126 IP 192.168.43.124.8880 > 192.168.43.195.7771: UDP, length 120
23:32:43.331008 IP 192.168.43.195.8880 > 192.168.43.124.7772: UDP, length 120
23:32:43.331069 IP 192.168.43.124.8880 > 192.168.43.195.7771: UDP, length 120
23:32:43.376575 IP 192.168.43.195.8880 > 192.168.43.124.7772: UDP, length 120
23:32:43.381123 IP 192.168.43.124.8880 > 192.168.43.195.7771: UDP, length 120
23:32:43.431150 IP 192.168.43.124.8880 > 192.168.43.195.7771: UDP, length 120
23:32:43.432071 IP 192.168.43.195.8880 > 192.168.43.124.7772: UDP, length 120
23:32:43.472473 IP 192.168.43.195.8880 > 192.168.43.124.7772: UDP, length 120
23:32:43.481105 IP 192.168.43.124.8880 > 192.168.43.195.7771: UDP, length 120
23:32:43.531104 IP 192.168.43.124.8880 > 192.168.43.195.7771: UDP, length 120
23:32:43.536723 IP 192.168.43.195.8880 > 192.168.43.124.7772: UDP, length 120
23:32:43.573994 IP 192.168.43.195.8880 > 192.168.43.124.7772: UDP, length 120
23:32:43.581104 IP 192.168.43.124.8880 > 192.168.43.195.7771: UDP, length 120
23:32:43.622535 IP 192.168.43.195.8880 > 192.168.43.124.7772: UDP, length 120
23:32:43.631113 IP 192.168.43.124.8880 > 192.168.43.195.7771: UDP, length 120
23:32:43.673330 IP 192.168.43.195.8880 > 192.168.43.124.7772: UDP, length 120
23:32:43.681150 IP 192.168.43.124.8880 > 192.168.43.195.7771: UDP, length 120
23:32:43.721829 IP 192.168.43.195.8880 > 192.168.43.124.7772: UDP, length 120
23:32:43.731150 IP 192.168.43.124.8880 > 192.168.43.195.7771: UDP, length 120
23:32:43.779311 IP 192.168.43.195.8880 > 192.168.43.124.7772: UDP, length 120
23:32:43.781146 IP 192.168.43.124.8880 > 192.168.43.195.7771: UDP, length 120
23:32:43.821968 IP 192.168.43.195.8880 > 192.168.43.124.7772: UDP, length 120
23:32:43.831149 IP 192.168.43.124.8880 > 192.168.43.195.7771: UDP, length 120
23:32:43.869601 IP 192.168.43.195.8880 > 192.168.43.124.7772: UDP, length 120
23:32:43.881152 IP 192.168.43.124.8880 > 192.168.43.195.7771: UDP, length 120
23:32:43.931104 IP 192.168.43.124.8880 > 192.168.43.195.7771: UDP, length 120
23:32:43.941601 IP 192.168.43.195.8880 > 192.168.43.124.7772: UDP, length 120
23:32:43.970673 IP 192.168.43.195.8880 > 192.168.43.124.7772: UDP, length 120
23:32:43.981103 IP 192.168.43.124.8880 > 192.168.43.195.7771: UDP, length 120
23:32:44.024077 IP 192.168.43.195.8880 > 192.168.43.124.7772: UDP, length 120
23:32:44.031102 IP 192.168.43.124.8880 > 192.168.43.195.7771: UDP, length 120
23:32:44.070705 IP 192.168.43.195.8880 > 192.168.43.124.7772: UDP, length 120
23:32:44.081103 IP 192.168.43.124.8880 > 192.168.43.195.7771: UDP, length 120
23:32:44.131103 IP 192.168.43.124.8880 > 192.168.43.195.7771: UDP, length 120
23:32:44.133647 IP 192.168.43.195.8880 > 192.168.43.124.7772: UDP, length 120
23:32:44.171147 IP 192.168.43.195.8880 > 192.168.43.124.7772: UDP, length 120
23:32:44.181105 IP 192.168.43.124.8880 > 192.168.43.195.7771: UDP, length 120
23:32:44.229278 IP 192.168.43.195.8880 > 192.168.43.124.7772: UDP, length 120
23:32:44.231103 IP 192.168.43.124.8880 > 192.168.43.195.7771: UDP, length 120
23:32:44.281101 IP 192.168.43.124.8880 > 192.168.43.195.7771: UDP, length 120
23:32:44.283407 IP 192.168.43.195.8880 > 192.168.43.124.7772: UDP, length 120
23:32:44.330847 IP 192.168.43.195.8880 > 192.168.43.124.7772: UDP, length 120
23:32:44.331052 IP 192.168.43.124.8880 > 192.168.43.195.7771: UDP, length 120
23:32:44.373286 IP 192.168.43.195.8880 > 192.168.43.124.7772: UDP, length 120
23:32:44.381103 IP 192.168.43.124.8880 > 192.168.43.195.7771: UDP, length 120
23:32:44.431101 IP 192.168.43.124.8880 > 192.168.43.195.7771: UDP, length 120
23:32:44.440146 IP 192.168.43.195.8880 > 192.168.43.124.7772: UDP, length 120
23:32:44.471260 IP 192.168.43.195.8880 > 192.168.43.124.7772: UDP, length 120
23:32:44.481103 IP 192.168.43.124.8880 > 192.168.43.195.7771: UDP, length 120
23:32:44.521304 IP 192.168.43.195.8880 > 192.168.43.124.7772: UDP, length 120
23:32:44.531104 IP 192.168.43.124.8880 > 192.168.43.195.7771: UDP, length 120
23:32:44.581103 IP 192.168.43.124.8880 > 192.168.43.195.7771: UDP, length 120
23:32:44.581609 IP 192.168.43.195.8880 > 192.168.43.124.7772: UDP, length 120
23:32:44.621550 IP 192.168.43.195.8880 > 192.168.43.124.7772: UDP, length 120
23:32:44.631102 IP 192.168.43.124.8880 > 192.168.43.195.7771: UDP, length 120
23:32:44.671834 IP 192.168.43.195.8880 > 192.168.43.124.7772: UDP, length 120
23:32:44.681101 IP 192.168.43.124.8880 > 192.168.43.195.7771: UDP, length 120
23:32:44.731255 IP 192.168.43.124.8880 > 192.168.43.195.7771: UDP, length 120
23:32:44.731267 IP 192.168.43.195.8880 > 192.168.43.124.7772: UDP, length 120
23:32:44.770894 IP 192.168.43.195.8880 > 192.168.43.124.7772: UDP, length 120
23:32:44.781103 IP 192.168.43.124.8880 > 192.168.43.195.7771: UDP, length 120
23:32:44.821046 IP 192.168.43.195.8880 > 192.168.43.124.7772: UDP, length 120
23:32:44.831102 IP 192.168.43.124.8880 > 192.168.43.195.7771: UDP, length 120
23:32:44.878723 IP 192.168.43.195.8880 > 192.168.43.124.7772: UDP, length 120
23:32:44.881101 IP 192.168.43.124.8880 > 192.168.43.195.7771: UDP, length 120
23:32:44.924163 IP 192.168.43.195.8880 > 192.168.43.124.7772: UDP, length 120
23:32:44.931101 IP 192.168.43.124.8880 > 192.168.43.195.7771: UDP, length 120
23:32:44.970905 IP 192.168.43.195.8880 > 192.168.43.124.7772: UDP, length 120
23:32:44.981099 IP 192.168.43.124.8880 > 192.168.43.195.7771: UDP, length 120
23:32:45.028253 IP 192.168.43.195.8880 > 192.168.43.124.7772: UDP, length 120
23:32:45.031099 IP 192.168.43.124.8880 > 192.168.43.195.7771: UDP, length 120
23:32:45.072072 IP 192.168.43.195.8880 > 192.168.43.124.7772: UDP, length 120
23:32:45.081099 IP 192.168.43.124.8880 > 192.168.43.195.7771: UDP, length 120
23:32:45.120962 IP 192.168.43.195.8880 > 192.168.43.124.7772: UDP, length 120
23:32:45.131100 IP 192.168.43.124.8880 > 192.168.43.195.7771: UDP, length 120
23:32:45.179116 IP 192.168.43.195.8880 > 192.168.43.124.7772: UDP, length 120
23:32:45.181099 IP 192.168.43.124.8880 > 192.168.43.195.7771: UDP, length 120
23:32:45.221382 IP 192.168.43.195.8880 > 192.168.43.124.7772: UDP, length 120
23:32:45.231099 IP 192.168.43.124.8880 > 192.168.43.195.7771: UDP, length 120
23:32:45.275041 IP 192.168.43.195.8880 > 192.168.43.124.7772: UDP, length 120
23:32:45.281099 IP 192.168.43.124.8880 > 192.168.43.195.7771: UDP, length 120
23:32:45.330503 IP 192.168.43.195.8880 > 192.168.43.124.7772: UDP, length 120
23:32:45.331099 IP 192.168.43.124.8880 > 192.168.43.195.7771: UDP, length 120
23:32:45.376344 IP 192.168.43.195.8880 > 192.168.43.124.7772: UDP, length 120
23:32:45.381100 IP 192.168.43.124.8880 > 192.168.43.195.7771: UDP, length 120
23:32:45.425773 IP 192.168.43.195.8880 > 192.168.43.124.7772: UDP, length 120
23:32:45.431080 IP 192.168.43.124.8880 > 192.168.43.195.7771: UDP, length 120
23:32:45.481634 IP 192.168.43.124.8880 > 192.168.43.195.7771: UDP, length 120
23:32:45.485317 IP 192.168.43.195.8880 > 192.168.43.124.7772: UDP, length 120
23:32:45.522500 IP 192.168.43.195.8880 > 192.168.43.124.7772: UDP, length 120
23:32:45.531100 IP 192.168.43.124.8880 > 192.168.43.195.7771: UDP, length 120
23:32:45.579208 IP 192.168.43.195.8880 > 192.168.43.124.7772: UDP, length 120
23:32:45.581101 IP 192.168.43.124.8880 > 192.168.43.195.7771: UDP, length 120
23:32:45.620781 IP 192.168.43.195.8880 > 192.168.43.124.7772: UDP, length 120
23:32:45.631102 IP 192.168.43.124.8880 > 192.168.43.195.7771: UDP, length 120
23:32:45.679171 IP 192.168.43.195.8880 > 192.168.43.124.7772: UDP, length 120
23:32:45.681101 IP 192.168.43.124.8880 > 192.168.43.195.7771: UDP, length 120
23:32:45.721780 IP 192.168.43.195.8880 > 192.168.43.124.7772: UDP, length 120
23:32:45.731104 IP 192.168.43.124.8880 > 192.168.43.195.7771: UDP, length 120
23:32:45.776215 IP 192.168.43.195.8880 > 192.168.43.124.7772: UDP, length 120
23:32:45.781103 IP 192.168.43.124.8880 > 192.168.43.195.7771: UDP, length 120
23:32:45.828863 IP 192.168.43.195.8880 > 192.168.43.124.7772: UDP, length 120
23:32:45.831100 IP 192.168.43.124.8880 > 192.168.43.195.7771: UDP, length 120
23:32:45.871031 IP 192.168.43.195.8880 > 192.168.43.124.7772: UDP, length 120
23:32:45.881060 IP 192.168.43.124.8880 > 192.168.43.195.7771: UDP, length 120
23:32:45.922104 IP 192.168.43.195.8880 > 192.168.43.124.7772: UDP, length 120
23:32:45.931140 IP 192.168.43.124.8880 > 192.168.43.195.7771: UDP, length 120
23:32:45.978077 IP 192.168.43.195.8880 > 192.168.43.124.7772: UDP, length 120
23:32:45.981104 IP 192.168.43.124.8880 > 192.168.43.195.7771: UDP, length 120
23:32:46.021114 IP 192.168.43.195.8880 > 192.168.43.124.7772: UDP, length 120
23:32:46.031101 IP 192.168.43.124.8880 > 192.168.43.195.7771: UDP, length 120
23:32:46.070941 IP 192.168.43.195.8880 > 192.168.43.124.7772: UDP, length 120
23:32:46.081099 IP 192.168.43.124.8880 > 192.168.43.195.7771: UDP, length 120
23:32:46.129423 IP 192.168.43.195.8880 > 192.168.43.124.7772: UDP, length 120
23:32:46.131100 IP 192.168.43.124.8880 > 192.168.43.195.7771: UDP, length 120
23:32:46.171728 IP 192.168.43.195.8880 > 192.168.43.124.7772: UDP, length 120
23:32:46.181099 IP 192.168.43.124.8880 > 192.168.43.195.7771: UDP, length 120
23:32:46.220876 IP 192.168.43.195.8880 > 192.168.43.124.7772: UDP, length 120
23:32:46.231102 IP 192.168.43.124.8880 > 192.168.43.195.7771: UDP, length 120
23:32:46.279270 IP 192.168.43.195.8880 > 192.168.43.124.7772: UDP, length 120
23:32:46.281098 IP 192.168.43.124.8880 > 192.168.43.195.7771: UDP, length 120
23:32:46.321170 IP 192.168.43.195.8880 > 192.168.43.124.7772: UDP, length 120
23:32:46.331100 IP 192.168.43.124.8880 > 192.168.43.195.7771: UDP, length 120
23:32:46.374664 IP 192.168.43.195.8880 > 192.168.43.124.7772: UDP, length 120
23:32:46.381099 IP 192.168.43.124.8880 > 192.168.43.195.7771: UDP, length 120
23:32:46.429218 IP 192.168.43.195.8880 > 192.168.43.124.7772: UDP, length 120
23:32:46.431099 IP 192.168.43.124.8880 > 192.168.43.195.7771: UDP, length 120
23:32:46.481140 IP 192.168.43.195.8880 > 192.168.43.124.7772: UDP, length 120
23:32:46.481178 IP 192.168.43.124.8880 > 192.168.43.195.7771: UDP, length 120
23:32:46.522610 IP 192.168.43.195.8880 > 192.168.43.124.7772: UDP, length 120
23:32:46.531100 IP 192.168.43.124.8880 > 192.168.43.195.7771: UDP, length 120
23:32:46.581101 IP 192.168.43.124.8880 > 192.168.43.195.7771: UDP, length 120
23:32:46.588948 IP 192.168.43.195.8880 > 192.168.43.124.7772: UDP, length 120
23:32:46.620971 IP 192.168.43.195.8880 > 192.168.43.124.7772: UDP, length 120
23:32:46.631101 IP 192.168.43.124.8880 > 192.168.43.195.7771: UDP, length 120
23:32:46.670793 IP 192.168.43.195.8880 > 192.168.43.124.7772: UDP, length 120
23:32:46.681102 IP 192.168.43.124.8880 > 192.168.43.195.7771: UDP, length 120
23:32:46.721600 IP 192.168.43.195.8880 > 192.168.43.124.7772: UDP, length 120
23:32:46.731100 IP 192.168.43.124.8880 > 192.168.43.195.7771: UDP, length 120
23:32:46.772301 IP 192.168.43.195.8880 > 192.168.43.124.7772: UDP, length 120
23:32:46.781101 IP 192.168.43.124.8880 > 192.168.43.195.7771: UDP, length 120
23:32:46.820792 IP 192.168.43.195.8880 > 192.168.43.124.7772: UDP, length 120
23:32:46.831103 IP 192.168.43.124.8880 > 192.168.43.195.7771: UDP, length 120
23:32:46.870767 IP 192.168.43.195.8880 > 192.168.43.124.7772: UDP, length 120
23:32:46.881091 IP 192.168.43.124.8880 > 192.168.43.195.7771: UDP, length 120
23:32:46.917446 IP 192.168.43.195.8880 > 192.168.43.124.7772: UDP, length 120
23:32:46.931065 IP 192.168.43.124.8880 > 192.168.43.195.7771: UDP, length 120
23:32:46.970669 IP 192.168.43.195.8880 > 192.168.43.124.7772: UDP, length 120
23:32:46.981056 IP 192.168.43.124.8880 > 192.168.43.195.7771: UDP, length 120
23:32:47.023637 IP 192.168.43.195.8880 > 192.168.43.124.7772: UDP, length 120
23:32:47.031056 IP 192.168.43.124.8880 > 192.168.43.195.7771: UDP, length 120
23:32:47.081054 IP 192.168.43.124.8880 > 192.168.43.195.7771: UDP, length 120
23:32:47.082800 IP 192.168.43.195.8880 > 192.168.43.124.7772: UDP, length 120
23:32:47.120695 IP 192.168.43.195.8880 > 192.168.43.124.7772: UDP, length 120
23:32:47.131054 IP 192.168.43.124.8880 > 192.168.43.195.7771: UDP, length 120
23:32:47.171083 IP 192.168.43.195.8880 > 192.168.43.124.7772: UDP, length 120
23:32:47.181058 IP 192.168.43.124.8880 > 192.168.43.195.7771: UDP, length 120
23:32:47.231112 IP 192.168.43.124.8880 > 192.168.43.195.7771: UDP, length 120
23:32:47.233638 IP 192.168.43.195.8880 > 192.168.43.124.7772: UDP, length 120
23:32:47.271061 IP 192.168.43.195.8880 > 192.168.43.124.7772: UDP, length 120
23:32:47.281099 IP 192.168.43.124.8880 > 192.168.43.195.7771: UDP, length 120
23:32:47.323524 IP 192.168.43.195.8880 > 192.168.43.124.7772: UDP, length 120
23:32:47.331101 IP 192.168.43.124.8880 > 192.168.43.195.7771: UDP, length 120
23:32:47.381101 IP 192.168.43.124.8880 > 192.168.43.195.7771: UDP, length 120
23:32:47.384175 IP 192.168.43.195.8880 > 192.168.43.124.7772: UDP, length 120
23:32:47.423139 IP 192.168.43.195.8880 > 192.168.43.124.7772: UDP, length 120
23:32:47.431103 IP 192.168.43.124.8880 > 192.168.43.195.7771: UDP, length 120
23:32:47.481102 IP 192.168.43.124.8880 > 192.168.43.195.7771: UDP, length 120
23:32:47.485338 IP 192.168.43.195.8880 > 192.168.43.124.7772: UDP, length 120
23:32:47.526778 IP 192.168.43.195.8880 > 192.168.43.124.7772: UDP, length 120
23:32:47.531104 IP 192.168.43.124.8880 > 192.168.43.195.7771: UDP, length 120
23:32:47.571197 IP 192.168.43.195.8880 > 192.168.43.124.7772: UDP, length 120
23:32:47.581102 IP 192.168.43.124.8880 > 192.168.43.195.7771: UDP, length 120
23:32:47.625286 IP 192.168.43.195.8880 > 192.168.43.124.7772: UDP, length 120
23:32:47.631105 IP 192.168.43.124.8880 > 192.168.43.195.7771: UDP, length 120
23:32:47.670787 IP 192.168.43.195.8880 > 192.168.43.124.7772: UDP, length 120
23:32:47.681103 IP 192.168.43.124.8880 > 192.168.43.195.7771: UDP, length 120
23:32:47.731106 IP 192.168.43.124.8880 > 192.168.43.195.7771: UDP, length 120
23:32:47.733320 IP 192.168.43.195.8880 > 192.168.43.124.7772: UDP, length 120
23:32:47.771027 IP 192.168.43.195.8880 > 192.168.43.124.7772: UDP, length 120
23:32:47.781104 IP 192.168.43.124.8880 > 192.168.43.195.7771: UDP, length 120
23:32:47.824220 IP 192.168.43.195.8880 > 192.168.43.124.7772: UDP, length 120
23:32:47.831058 IP 192.168.43.124.8880 > 192.168.43.195.7771: UDP, length 120
23:32:47.873310 IP 192.168.43.195.8880 > 192.168.43.124.7772: UDP, length 120
23:32:47.881102 IP 192.168.43.124.8880 > 192.168.43.195.7771: UDP, length 120
23:32:47.920833 IP 192.168.43.195.8880 > 192.168.43.124.7772: UDP, length 120
23:32:47.931047 IP 192.168.43.124.8880 > 192.168.43.195.7771: UDP, length 120
23:32:47.971151 IP 192.168.43.195.8880 > 192.168.43.124.7772: UDP, length 120
23:32:47.981100 IP 192.168.43.124.8880 > 192.168.43.195.7771: UDP, length 120
23:32:48.021347 IP 192.168.43.195.8880 > 192.168.43.124.7772: UDP, length 120
23:32:48.031034 IP 192.168.43.124.8880 > 192.168.43.195.7771: UDP, length 120
23:32:48.081033 IP 192.168.43.124.8880 > 192.168.43.195.7771: UDP, length 120
23:32:48.099215 IP 192.168.43.195.8880 > 192.168.43.124.7772: UDP, length 120
23:32:48.121128 IP 192.168.43.195.8880 > 192.168.43.124.7772: UDP, length 120
23:32:48.131048 IP 192.168.43.124.8880 > 192.168.43.195.7771: UDP, length 120
23:32:48.171417 IP 192.168.43.195.8880 > 192.168.43.124.7772: UDP, length 120
23:32:48.181102 IP 192.168.43.124.8880 > 192.168.43.195.7771: UDP, length 120
23:32:48.221572 IP 192.168.43.195.8880 > 192.168.43.124.7772: UDP, length 120
23:32:48.231100 IP 192.168.43.124.8880 > 192.168.43.195.7771: UDP, length 120
23:32:48.271006 IP 192.168.43.195.8880 > 192.168.43.124.7772: UDP, length 120
23:32:48.281101 IP 192.168.43.124.8880 > 192.168.43.195.7771: UDP, length 120
23:32:48.324708 IP 192.168.43.195.8880 > 192.168.43.124.7772: UDP, length 120
23:32:48.331099 IP 192.168.43.124.8880 > 192.168.43.195.7771: UDP, length 120
23:32:48.381098 IP 192.168.43.124.8880 > 192.168.43.195.7771: UDP, length 120
23:32:48.384878 IP 192.168.43.195.8880 > 192.168.43.124.7772: UDP, length 120
23:32:48.422727 IP 192.168.43.195.8880 > 192.168.43.124.7772: UDP, length 120
23:32:48.431099 IP 192.168.43.124.8880 > 192.168.43.195.7771: UDP, length 120
23:32:48.471739 IP 192.168.43.195.8880 > 192.168.43.124.7772: UDP, length 120
23:32:48.481101 IP 192.168.43.124.8880 > 192.168.43.195.7771: UDP, length 120
23:32:48.525137 IP 192.168.43.195.8880 > 192.168.43.124.7772: UDP, length 120
23:32:48.531101 IP 192.168.43.124.8880 > 192.168.43.195.7771: UDP, length 120
23:32:48.567788 IP 192.168.43.195.8880 > 192.168.43.124.7772: UDP, length 120
23:32:48.581101 IP 192.168.43.124.8880 > 192.168.43.195.7771: UDP, length 120
23:32:48.627477 IP 192.168.43.195.8880 > 192.168.43.124.7772: UDP, length 120
23:32:48.631100 IP 192.168.43.124.8880 > 192.168.43.195.7771: UDP, length 120
23:32:48.671357 IP 192.168.43.195.8880 > 192.168.43.124.7772: UDP, length 120
23:32:48.681100 IP 192.168.43.124.8880 > 192.168.43.195.7771: UDP, length 120
23:32:48.730051 IP 192.168.43.195.8880 > 192.168.43.124.7772: UDP, length 120
23:32:48.731099 IP 192.168.43.124.8880 > 192.168.43.195.7771: UDP, length 120
23:32:48.771035 IP 192.168.43.195.8880 > 192.168.43.124.7772: UDP, length 120
23:32:48.781099 IP 192.168.43.124.8880 > 192.168.43.195.7771: UDP, length 120
23:32:48.821552 IP 192.168.43.195.8880 > 192.168.43.124.7772: UDP, length 120
23:32:48.831099 IP 192.168.43.124.8880 > 192.168.43.195.7771: UDP, length 120
23:32:48.878574 IP 192.168.43.195.8880 > 192.168.43.124.7772: UDP, length 120
23:32:48.881098 IP 192.168.43.124.8880 > 192.168.43.195.7771: UDP, length 120
23:32:48.921451 IP 192.168.43.195.8880 > 192.168.43.124.7772: UDP, length 120
23:32:48.931046 IP 192.168.43.124.8880 > 192.168.43.195.7771: UDP, length 120
23:32:48.971031 IP 192.168.43.195.8880 > 192.168.43.124.7772: UDP, length 120
23:32:48.981097 IP 192.168.43.124.8880 > 192.168.43.195.7771: UDP, length 120
23:32:49.031101 IP 192.168.43.124.8880 > 192.168.43.195.7771: UDP, length 120
23:32:49.040299 IP 192.168.43.195.8880 > 192.168.43.124.7772: UDP, length 120
23:32:49.073475 IP 192.168.43.195.8880 > 192.168.43.124.7772: UDP, length 120
23:32:49.081101 IP 192.168.43.124.8880 > 192.168.43.195.7771: UDP, length 120
23:32:49.121639 IP 192.168.43.195.8880 > 192.168.43.124.7772: UDP, length 120
23:32:49.131100 IP 192.168.43.124.8880 > 192.168.43.195.7771: UDP, length 120
23:32:49.170952 IP 192.168.43.195.8880 > 192.168.43.124.7772: UDP, length 120
23:32:49.181100 IP 192.168.43.124.8880 > 192.168.43.195.7771: UDP, length 120
23:32:49.231148 IP 192.168.43.124.8880 > 192.168.43.195.7771: UDP, length 120
23:32:49.233541 IP 192.168.43.195.8880 > 192.168.43.124.7772: UDP, length 120
23:32:49.271137 IP 192.168.43.195.8880 > 192.168.43.124.7772: UDP, length 120
23:32:49.281102 IP 192.168.43.124.8880 > 192.168.43.195.7771: UDP, length 120
23:32:49.321132 IP 192.168.43.195.8880 > 192.168.43.124.7772: UDP, length 120
23:32:49.331146 IP 192.168.43.124.8880 > 192.168.43.195.7771: UDP, length 120
23:32:49.372894 IP 192.168.43.195.8880 > 192.168.43.124.7772: UDP, length 120
23:32:49.381151 IP 192.168.43.124.8880 > 192.168.43.195.7771: UDP, length 120
23:32:49.431440 IP 192.168.43.195.8880 > 192.168.43.124.7772: UDP, length 120
23:32:49.431505 IP 192.168.43.124.8880 > 192.168.43.195.7771: UDP, length 120
23:32:49.474823 IP 192.168.43.195.8880 > 192.168.43.124.7772: UDP, length 120
23:32:49.481105 IP 192.168.43.124.8880 > 192.168.43.195.7771: UDP, length 120
23:32:49.521182 IP 192.168.43.195.8880 > 192.168.43.124.7772: UDP, length 120
23:32:49.531104 IP 192.168.43.124.8880 > 192.168.43.195.7771: UDP, length 120
23:32:49.577568 IP 192.168.43.195.8880 > 192.168.43.124.7772: UDP, length 120
23:32:49.581102 IP 192.168.43.124.8880 > 192.168.43.195.7771: UDP, length 120
23:32:49.630633 IP 192.168.43.195.8880 > 192.168.43.124.7772: UDP, length 120
23:32:49.631101 IP 192.168.43.124.8880 > 192.168.43.195.7771: UDP, length 120
23:32:49.679802 IP 192.168.43.195.8880 > 192.168.43.124.7772: UDP, length 120
23:32:49.681103 IP 192.168.43.124.8880 > 192.168.43.195.7771: UDP, length 120
23:32:49.721601 IP 192.168.43.195.8880 > 192.168.43.124.7772: UDP, length 120
23:32:49.731105 IP 192.168.43.124.8880 > 192.168.43.195.7771: UDP, length 120
23:32:49.771029 IP 192.168.43.195.8880 > 192.168.43.124.7772: UDP, length 120
23:32:49.781105 IP 192.168.43.124.8880 > 192.168.43.195.7771: UDP, length 120
23:32:49.820886 IP 192.168.43.195.8880 > 192.168.43.124.7772: UDP, length 120
23:32:49.831102 IP 192.168.43.124.8880 > 192.168.43.195.7771: UDP, length 120
23:32:49.873213 IP 192.168.43.195.8880 > 192.168.43.124.7772: UDP, length 120
23:32:49.881105 IP 192.168.43.124.8880 > 192.168.43.195.7771: UDP, length 120
23:32:49.920693 IP 192.168.43.195.8880 > 192.168.43.124.7772: UDP, length 120
23:32:49.931051 IP 192.168.43.124.8880 > 192.168.43.195.7771: UDP, length 120
23:32:49.971755 IP 192.168.43.195.8880 > 192.168.43.124.7772: UDP, length 120
23:32:49.981098 IP 192.168.43.124.8880 > 192.168.43.195.7771: UDP, length 120
23:32:50.020937 IP 192.168.43.195.8880 > 192.168.43.124.7772: UDP, length 120
23:32:50.031103 IP 192.168.43.124.8880 > 192.168.43.195.7771: UDP, length 120
23:32:50.070792 IP 192.168.43.195.8880 > 192.168.43.124.7772: UDP, length 120
23:32:50.081097 IP 192.168.43.124.8880 > 192.168.43.195.7771: UDP, length 120
23:32:50.131245 IP 192.168.43.124.8880 > 192.168.43.195.7771: UDP, length 120
23:32:50.131257 IP 192.168.43.195.8880 > 192.168.43.124.7772: UDP, length 120
23:32:50.171990 IP 192.168.43.195.8880 > 192.168.43.124.7772: UDP, length 120
23:32:50.181100 IP 192.168.43.124.8880 > 192.168.43.195.7771: UDP, length 120
23:32:50.221209 IP 192.168.43.195.8880 > 192.168.43.124.7772: UDP, length 120
23:32:50.231100 IP 192.168.43.124.8880 > 192.168.43.195.7771: UDP, length 120
23:32:50.274538 IP 192.168.43.195.8880 > 192.168.43.124.7772: UDP, length 120
23:32:50.281102 IP 192.168.43.124.8880 > 192.168.43.195.7771: UDP, length 120
23:32:50.323367 IP 192.168.43.195.8880 > 192.168.43.124.7772: UDP, length 120
23:32:50.331103 IP 192.168.43.124.8880 > 192.168.43.195.7771: UDP, length 120
23:32:50.373172 IP 192.168.43.195.8880 > 192.168.43.124.7772: UDP, length 120
23:32:50.381100 IP 192.168.43.124.8880 > 192.168.43.195.7771: UDP, length 120
23:32:50.421079 IP 192.168.43.195.8880 > 192.168.43.124.7772: UDP, length 120
23:32:50.431101 IP 192.168.43.124.8880 > 192.168.43.195.7771: UDP, length 120
23:32:50.481099 IP 192.168.43.124.8880 > 192.168.43.195.7771: UDP, length 120
23:32:50.486627 IP 192.168.43.195.8880 > 192.168.43.124.7772: UDP, length 120
23:32:50.523403 IP 192.168.43.195.8880 > 192.168.43.124.7772: UDP, length 120
23:32:50.531101 IP 192.168.43.124.8880 > 192.168.43.195.7771: UDP, length 120
23:32:50.577881 IP 192.168.43.195.8880 > 192.168.43.124.7772: UDP, length 120
23:32:50.581101 IP 192.168.43.124.8880 > 192.168.43.195.7771: UDP, length 120
23:32:50.631105 IP 192.168.43.124.8880 > 192.168.43.195.7771: UDP, length 120
23:32:50.681104 IP 192.168.43.124.8880 > 192.168.43.195.7771: UDP, length 120
23:32:50.701759 IP 192.168.43.195.8880 > 192.168.43.124.7772: UDP, length 120
23:32:50.701774 IP 192.168.43.195.8880 > 192.168.43.124.7772: UDP, length 120
23:32:50.721092 IP 192.168.43.195.8880 > 192.168.43.124.7772: UDP, length 120
23:32:50.731103 IP 192.168.43.124.8880 > 192.168.43.195.7771: UDP, length 120
23:32:50.780383 IP 192.168.43.195.8880 > 192.168.43.124.7772: UDP, length 120
23:32:50.781103 IP 192.168.43.124.8880 > 192.168.43.195.7771: UDP, length 120
23:32:50.831104 IP 192.168.43.124.8880 > 192.168.43.195.7771: UDP, length 120
23:32:50.836531 IP 192.168.43.195.8880 > 192.168.43.124.7772: UDP, length 120
23:32:50.875739 IP 192.168.43.195.8880 > 192.168.43.124.7772: UDP, length 120
23:32:50.881101 IP 192.168.43.124.8880 > 192.168.43.195.7771: UDP, length 120
23:32:50.930340 IP 192.168.43.195.8880 > 192.168.43.124.7772: UDP, length 120
23:32:50.931039 IP 192.168.43.124.8880 > 192.168.43.195.7771: UDP, length 120
23:32:50.971062 IP 192.168.43.195.8880 > 192.168.43.124.7772: UDP, length 120
23:32:50.981100 IP 192.168.43.124.8880 > 192.168.43.195.7771: UDP, length 120
23:32:51.031101 IP 192.168.43.124.8880 > 192.168.43.195.7771: UDP, length 120
23:32:51.031443 IP 192.168.43.195.8880 > 192.168.43.124.7772: UDP, length 120
23:32:51.071694 IP 192.168.43.195.8880 > 192.168.43.124.7772: UDP, length 120
23:32:51.081101 IP 192.168.43.124.8880 > 192.168.43.195.7771: UDP, length 120
23:32:51.121107 IP 192.168.43.195.8880 > 192.168.43.124.7772: UDP, length 120
23:32:51.131100 IP 192.168.43.124.8880 > 192.168.43.195.7771: UDP, length 120
23:32:51.172564 IP 192.168.43.195.8880 > 192.168.43.124.7772: UDP, length 120
23:32:51.181100 IP 192.168.43.124.8880 > 192.168.43.195.7771: UDP, length 120
23:32:51.218334 IP 192.168.43.195.8880 > 192.168.43.124.7772: UDP, length 120
23:32:51.231102 IP 192.168.43.124.8880 > 192.168.43.195.7771: UDP, length 120
23:32:51.272145 IP 192.168.43.195.8880 > 192.168.43.124.7772: UDP, length 120
23:32:51.281149 IP 192.168.43.124.8880 > 192.168.43.195.7771: UDP, length 120
23:32:51.321756 IP 192.168.43.195.8880 > 192.168.43.124.7772: UDP, length 120
23:32:51.331149 IP 192.168.43.124.8880 > 192.168.43.195.7771: UDP, length 120
23:32:51.381152 IP 192.168.43.124.8880 > 192.168.43.195.7771: UDP, length 120
23:32:51.383711 IP 192.168.43.195.8880 > 192.168.43.124.7772: UDP, length 120
23:32:51.420821 IP 192.168.43.195.8880 > 192.168.43.124.7772: UDP, length 120
23:32:51.431066 IP 192.168.43.124.8880 > 192.168.43.195.7771: UDP, length 120
23:32:51.476382 IP 192.168.43.195.8880 > 192.168.43.124.7772: UDP, length 120
23:32:51.481103 IP 192.168.43.124.8880 > 192.168.43.195.7771: UDP, length 120
23:32:51.521108 IP 192.168.43.195.8880 > 192.168.43.124.7772: UDP, length 120
23:32:51.531102 IP 192.168.43.124.8880 > 192.168.43.195.7771: UDP, length 120
23:32:51.569295 IP 192.168.43.195.8880 > 192.168.43.124.7772: UDP, length 120
23:32:51.581103 IP 192.168.43.124.8880 > 192.168.43.195.7771: UDP, length 120
23:32:51.624019 IP 192.168.43.195.8880 > 192.168.43.124.7772: UDP, length 120
23:32:51.631104 IP 192.168.43.124.8880 > 192.168.43.195.7771: UDP, length 120
23:32:51.672020 IP 192.168.43.195.8880 > 192.168.43.124.7772: UDP, length 120
23:32:51.681101 IP 192.168.43.124.8880 > 192.168.43.195.7771: UDP, length 120
23:32:51.731104 IP 192.168.43.124.8880 > 192.168.43.195.7771: UDP, length 120
23:32:51.734811 IP 192.168.43.195.8880 > 192.168.43.124.7772: UDP, length 120
23:32:51.771164 IP 192.168.43.195.8880 > 192.168.43.124.7772: UDP, length 120
23:32:51.781102 IP 192.168.43.124.8880 > 192.168.43.195.7771: UDP, length 120
23:32:51.830921 IP 192.168.43.195.8880 > 192.168.43.124.7772: UDP, length 120
23:32:51.831068 IP 192.168.43.124.8880 > 192.168.43.195.7771: UDP, length 120
23:32:51.873337 IP 192.168.43.195.8880 > 192.168.43.124.7772: UDP, length 120
23:32:51.881150 IP 192.168.43.124.8880 > 192.168.43.195.7771: UDP, length 120
23:32:51.921700 IP 192.168.43.195.8880 > 192.168.43.124.7772: UDP, length 120
23:32:51.931047 IP 192.168.43.124.8880 > 192.168.43.195.7771: UDP, length 120
23:32:51.971028 IP 192.168.43.195.8880 > 192.168.43.124.7772: UDP, length 120
23:32:51.981100 IP 192.168.43.124.8880 > 192.168.43.195.7771: UDP, length 120
23:32:52.031102 IP 192.168.43.124.8880 > 192.168.43.195.7771: UDP, length 120
23:32:52.032172 IP 192.168.43.195.8880 > 192.168.43.124.7772: UDP, length 120
23:32:52.080460 IP 192.168.43.195.8880 > 192.168.43.124.7772: UDP, length 120
23:32:52.081098 IP 192.168.43.124.8880 > 192.168.43.195.7771: UDP, length 120
23:32:52.125043 IP 192.168.43.195.8880 > 192.168.43.124.7772: UDP, length 120
23:32:52.131102 IP 192.168.43.124.8880 > 192.168.43.195.7771: UDP, length 120
23:32:52.171084 IP 192.168.43.195.8880 > 192.168.43.124.7772: UDP, length 120
23:32:52.181099 IP 192.168.43.124.8880 > 192.168.43.195.7771: UDP, length 120
23:32:52.221076 IP 192.168.43.195.8880 > 192.168.43.124.7772: UDP, length 120
23:32:52.231153 IP 192.168.43.124.8880 > 192.168.43.195.7771: UDP, length 120
23:32:52.276077 IP 192.168.43.195.8880 > 192.168.43.124.7772: UDP, length 120
23:32:52.281149 IP 192.168.43.124.8880 > 192.168.43.195.7771: UDP, length 120
23:32:52.321763 IP 192.168.43.195.8880 > 192.168.43.124.7772: UDP, length 120
23:32:52.331148 IP 192.168.43.124.8880 > 192.168.43.195.7771: UDP, length 120
23:32:52.372268 IP 192.168.43.195.8880 > 192.168.43.124.7772: UDP, length 120
23:32:52.381152 IP 192.168.43.124.8880 > 192.168.43.195.7771: UDP, length 120
23:32:52.431151 IP 192.168.43.124.8880 > 192.168.43.195.7771: UDP, length 120
23:32:52.432073 IP 192.168.43.195.8880 > 192.168.43.124.7772: UDP, length 120
23:32:52.471673 IP 192.168.43.195.8880 > 192.168.43.124.7772: UDP, length 120
23:32:52.481150 IP 192.168.43.124.8880 > 192.168.43.195.7771: UDP, length 120
23:32:52.522363 IP 192.168.43.195.8880 > 192.168.43.124.7772: UDP, length 120
23:32:52.531153 IP 192.168.43.124.8880 > 192.168.43.195.7771: UDP, length 120
23:32:52.571910 IP 192.168.43.195.8880 > 192.168.43.124.7772: UDP, length 120
23:32:52.581152 IP 192.168.43.124.8880 > 192.168.43.195.7771: UDP, length 120
23:32:52.631154 IP 192.168.43.124.8880 > 192.168.43.195.7771: UDP, length 120
23:32:52.637551 IP 192.168.43.195.8880 > 192.168.43.124.7772: UDP, length 120
23:32:52.671690 IP 192.168.43.195.8880 > 192.168.43.124.7772: UDP, length 120
23:32:52.681151 IP 192.168.43.124.8880 > 192.168.43.195.7771: UDP, length 120
23:32:52.727730 IP 192.168.43.195.8880 > 192.168.43.124.7772: UDP, length 120
23:32:52.731152 IP 192.168.43.124.8880 > 192.168.43.195.7771: UDP, length 120
23:32:52.772893 IP 192.168.43.195.8880 > 192.168.43.124.7772: UDP, length 120
23:32:52.781152 IP 192.168.43.124.8880 > 192.168.43.195.7771: UDP, length 120
23:32:52.824747 IP 192.168.43.195.8880 > 192.168.43.124.7772: UDP, length 120
23:32:52.831153 IP 192.168.43.124.8880 > 192.168.43.195.7771: UDP, length 120
23:32:52.873625 IP 192.168.43.195.8880 > 192.168.43.124.7772: UDP, length 120
23:32:52.881150 IP 192.168.43.124.8880 > 192.168.43.195.7771: UDP, length 120
23:32:52.931100 IP 192.168.43.124.8880 > 192.168.43.195.7771: UDP, length 120
23:32:52.932156 IP 192.168.43.195.8880 > 192.168.43.124.7772: UDP, length 120
23:32:52.981051 IP 192.168.43.195.8880 > 192.168.43.124.7772: UDP, length 120
23:32:52.981088 IP 192.168.43.124.8880 > 192.168.43.195.7771: UDP, length 120
23:32:53.031102 IP 192.168.43.124.8880 > 192.168.43.195.7771: UDP, length 120
23:32:53.040496 IP 192.168.43.195.8880 > 192.168.43.124.7772: UDP, length 120
23:32:53.070913 IP 192.168.43.195.8880 > 192.168.43.124.7772: UDP, length 120
23:32:53.081099 IP 192.168.43.124.8880 > 192.168.43.195.7771: UDP, length 120
23:32:53.130763 IP 192.168.43.195.8880 > 192.168.43.124.7772: UDP, length 120
23:32:53.131027 IP 192.168.43.124.8880 > 192.168.43.195.7771: UDP, length 120
23:32:53.171541 IP 192.168.43.195.8880 > 192.168.43.124.7772: UDP, length 120
23:32:53.181029 IP 192.168.43.124.8880 > 192.168.43.195.7771: UDP, length 120
23:32:53.220670 IP 192.168.43.195.8880 > 192.168.43.124.7772: UDP, length 120
23:32:53.231048 IP 192.168.43.124.8880 > 192.168.43.195.7771: UDP, length 120
23:32:53.281101 IP 192.168.43.124.8880 > 192.168.43.195.7771: UDP, length 120
23:32:53.292546 IP 192.168.43.195.8880 > 192.168.43.124.7772: UDP, length 120
23:32:53.321629 IP 192.168.43.195.8880 > 192.168.43.124.7772: UDP, length 120
23:32:53.331108 IP 192.168.43.124.8880 > 192.168.43.195.7771: UDP, length 120
23:32:53.367857 IP 192.168.43.195.8880 > 192.168.43.124.7772: UDP, length 120
23:32:53.381102 IP 192.168.43.124.8880 > 192.168.43.195.7771: UDP, length 120
23:32:53.426320 IP 192.168.43.195.8880 > 192.168.43.124.7772: UDP, length 120
23:32:53.431103 IP 192.168.43.124.8880 > 192.168.43.195.7771: UDP, length 120
23:32:53.471092 IP 192.168.43.195.8880 > 192.168.43.124.7772: UDP, length 120
23:32:53.481100 IP 192.168.43.124.8880 > 192.168.43.195.7771: UDP, length 120
23:32:53.524637 IP 192.168.43.195.8880 > 192.168.43.124.7772: UDP, length 120
23:32:53.531101 IP 192.168.43.124.8880 > 192.168.43.195.7771: UDP, length 120
23:32:53.571157 IP 192.168.43.195.8880 > 192.168.43.124.7772: UDP, length 120
23:32:53.581101 IP 192.168.43.124.8880 > 192.168.43.195.7771: UDP, length 120
23:32:53.626986 IP 192.168.43.195.8880 > 192.168.43.124.7772: UDP, length 120
23:32:53.631102 IP 192.168.43.124.8880 > 192.168.43.195.7771: UDP, length 120
23:32:53.673685 IP 192.168.43.195.8880 > 192.168.43.124.7772: UDP, length 120
23:32:53.681101 IP 192.168.43.124.8880 > 192.168.43.195.7771: UDP, length 120
23:32:53.720895 IP 192.168.43.195.8880 > 192.168.43.124.7772: UDP, length 120
23:32:53.731101 IP 192.168.43.124.8880 > 192.168.43.195.7771: UDP, length 120
23:32:53.777908 IP 192.168.43.195.8880 > 192.168.43.124.7772: UDP, length 120
23:32:53.781101 IP 192.168.43.124.8880 > 192.168.43.195.7771: UDP, length 120
23:32:53.822107 IP 192.168.43.195.8880 > 192.168.43.124.7772: UDP, length 120
23:32:53.831101 IP 192.168.43.124.8880 > 192.168.43.195.7771: UDP, length 120
23:32:53.877573 IP 192.168.43.195.8880 > 192.168.43.124.7772: UDP, length 120
23:32:53.881100 IP 192.168.43.124.8880 > 192.168.43.195.7771: UDP, length 120
23:32:53.920950 IP 192.168.43.195.8880 > 192.168.43.124.7772: UDP, length 120
23:32:53.931099 IP 192.168.43.124.8880 > 192.168.43.195.7771: UDP, length 120
23:32:53.980847 IP 192.168.43.195.8880 > 192.168.43.124.7772: UDP, length 120
23:32:53.981049 IP 192.168.43.124.8880 > 192.168.43.195.7771: UDP, length 120
23:32:54.027459 IP 192.168.43.195.8880 > 192.168.43.124.7772: UDP, length 120
23:32:54.031101 IP 192.168.43.124.8880 > 192.168.43.195.7771: UDP, length 120
23:32:54.071586 IP 192.168.43.195.8880 > 192.168.43.124.7772: UDP, length 120
23:32:54.081101 IP 192.168.43.124.8880 > 192.168.43.195.7771: UDP, length 120
23:32:54.120958 IP 192.168.43.195.8880 > 192.168.43.124.7772: UDP, length 120
23:32:54.131101 IP 192.168.43.124.8880 > 192.168.43.195.7771: UDP, length 120
23:32:54.181103 IP 192.168.43.124.8880 > 192.168.43.195.7771: UDP, length 120
23:32:54.185163 IP 192.168.43.195.8880 > 192.168.43.124.7772: UDP, length 120
23:32:54.219199 IP 192.168.43.195.8880 > 192.168.43.124.7772: UDP, length 120
23:32:54.231102 IP 192.168.43.124.8880 > 192.168.43.195.7771: UDP, length 120
23:32:54.281149 IP 192.168.43.124.8880 > 192.168.43.195.7771: UDP, length 120
23:32:54.288540 IP 192.168.43.195.8880 > 192.168.43.124.7772: UDP, length 120
23:32:54.323012 IP 192.168.43.195.8880 > 192.168.43.124.7772: UDP, length 120
23:32:54.331152 IP 192.168.43.124.8880 > 192.168.43.195.7771: UDP, length 120
23:32:54.379598 IP 192.168.43.195.8880 > 192.168.43.124.7772: UDP, length 120
23:32:54.381150 IP 192.168.43.124.8880 > 192.168.43.195.7771: UDP, length 120
23:32:54.421619 IP 192.168.43.195.8880 > 192.168.43.124.7772: UDP, length 120
23:32:54.431154 IP 192.168.43.124.8880 > 192.168.43.195.7771: UDP, length 120
23:32:54.481153 IP 192.168.43.124.8880 > 192.168.43.195.7771: UDP, length 120
23:32:54.496267 IP 192.168.43.195.8880 > 192.168.43.124.7772: UDP, length 120
23:32:54.521826 IP 192.168.43.195.8880 > 192.168.43.124.7772: UDP, length 120
23:32:54.531153 IP 192.168.43.124.8880 > 192.168.43.195.7771: UDP, length 120
23:32:54.571972 IP 192.168.43.195.8880 > 192.168.43.124.7772: UDP, length 120
23:32:54.581152 IP 192.168.43.124.8880 > 192.168.43.195.7771: UDP, length 120
23:32:54.620958 IP 192.168.43.195.8880 > 192.168.43.124.7772: UDP, length 120
23:32:54.631153 IP 192.168.43.124.8880 > 192.168.43.195.7771: UDP, length 120
23:32:54.681153 IP 192.168.43.124.8880 > 192.168.43.195.7771: UDP, length 120
23:32:54.685640 IP 192.168.43.195.8880 > 192.168.43.124.7772: UDP, length 120
23:32:54.720959 IP 192.168.43.195.8880 > 192.168.43.124.7772: UDP, length 120
23:32:54.731152 IP 192.168.43.124.8880 > 192.168.43.195.7771: UDP, length 120
23:32:54.771214 IP 192.168.43.195.8880 > 192.168.43.124.7772: UDP, length 120
23:32:54.781152 IP 192.168.43.124.8880 > 192.168.43.195.7771: UDP, length 120
23:32:54.821220 IP 192.168.43.195.8880 > 192.168.43.124.7772: UDP, length 120
23:32:54.831153 IP 192.168.43.124.8880 > 192.168.43.195.7771: UDP, length 120
23:32:54.881151 IP 192.168.43.124.8880 > 192.168.43.195.7771: UDP, length 120
23:32:54.890371 IP 192.168.43.195.8880 > 192.168.43.124.7772: UDP, length 120
23:32:54.924489 IP 192.168.43.195.8880 > 192.168.43.124.7772: UDP, length 120
23:32:54.931103 IP 192.168.43.124.8880 > 192.168.43.195.7771: UDP, length 120
23:32:54.980334 IP 192.168.43.195.8880 > 192.168.43.124.7772: UDP, length 120
23:32:54.981046 IP 192.168.43.124.8880 > 192.168.43.195.7771: UDP, length 120
23:32:55.021693 IP 192.168.43.195.8880 > 192.168.43.124.7772: UDP, length 120
23:32:55.031104 IP 192.168.43.124.8880 > 192.168.43.195.7771: UDP, length 120
23:32:55.081104 IP 192.168.43.124.8880 > 192.168.43.195.7771: UDP, length 120
23:32:55.094856 IP 192.168.43.195.8880 > 192.168.43.124.7772: UDP, length 120
23:32:55.120909 IP 192.168.43.195.8880 > 192.168.43.124.7772: UDP, length 120
23:32:55.131104 IP 192.168.43.124.8880 > 192.168.43.195.7771: UDP, length 120
23:32:55.170792 IP 192.168.43.195.8880 > 192.168.43.124.7772: UDP, length 120
23:32:55.181103 IP 192.168.43.124.8880 > 192.168.43.195.7771: UDP, length 120
23:32:55.222264 IP 192.168.43.195.8880 > 192.168.43.124.7772: UDP, length 120
23:32:55.231105 IP 192.168.43.124.8880 > 192.168.43.195.7771: UDP, length 120
23:32:55.281152 IP 192.168.43.124.8880 > 192.168.43.195.7771: UDP, length 120
23:32:55.283386 IP 192.168.43.195.8880 > 192.168.43.124.7772: UDP, length 120
23:32:55.319097 IP 192.168.43.195.8880 > 192.168.43.124.7772: UDP, length 120
23:32:55.331153 IP 192.168.43.124.8880 > 192.168.43.195.7771: UDP, length 120
23:32:55.375136 IP 192.168.43.195.8880 > 192.168.43.124.7772: UDP, length 120
23:32:55.381151 IP 192.168.43.124.8880 > 192.168.43.195.7771: UDP, length 120
23:32:55.421911 IP 192.168.43.195.8880 > 192.168.43.124.7772: UDP, length 120
23:32:55.431153 IP 192.168.43.124.8880 > 192.168.43.195.7771: UDP, length 120
23:32:55.474889 IP 192.168.43.195.8880 > 192.168.43.124.7772: UDP, length 120
23:32:55.481106 IP 192.168.43.124.8880 > 192.168.43.195.7771: UDP, length 120
23:32:55.521688 IP 192.168.43.195.8880 > 192.168.43.124.7772: UDP, length 120
23:32:55.531103 IP 192.168.43.124.8880 > 192.168.43.195.7771: UDP, length 120
23:32:55.572412 IP 192.168.43.195.8880 > 192.168.43.124.7772: UDP, length 120
23:32:55.581106 IP 192.168.43.124.8880 > 192.168.43.195.7771: UDP, length 120
23:32:55.631104 IP 192.168.43.124.8880 > 192.168.43.195.7771: UDP, length 120
23:32:55.632329 IP 192.168.43.195.8880 > 192.168.43.124.7772: UDP, length 120
23:32:55.670845 IP 192.168.43.195.8880 > 192.168.43.124.7772: UDP, length 120
23:32:55.681106 IP 192.168.43.124.8880 > 192.168.43.195.7771: UDP, length 120
23:32:55.721826 IP 192.168.43.195.8880 > 192.168.43.124.7772: UDP, length 120
23:32:55.731105 IP 192.168.43.124.8880 > 192.168.43.195.7771: UDP, length 120
23:32:55.773448 IP 192.168.43.195.8880 > 192.168.43.124.7772: UDP, length 120
23:32:55.781105 IP 192.168.43.124.8880 > 192.168.43.195.7771: UDP, length 120
23:32:55.823807 IP 192.168.43.195.8880 > 192.168.43.124.7772: UDP, length 120
23:32:55.831107 IP 192.168.43.124.8880 > 192.168.43.195.7771: UDP, length 120
23:32:55.870801 IP 192.168.43.195.8880 > 192.168.43.124.7772: UDP, length 120
23:32:55.881105 IP 192.168.43.124.8880 > 192.168.43.195.7771: UDP, length 120
23:32:55.925399 IP 192.168.43.195.8880 > 192.168.43.124.7772: UDP, length 120
23:32:55.931030 IP 192.168.43.124.8880 > 192.168.43.195.7771: UDP, length 120
23:32:55.979798 IP 192.168.43.195.8880 > 192.168.43.124.7772: UDP, length 120
23:32:55.981067 IP 192.168.43.124.8880 > 192.168.43.195.7771: UDP, length 120
23:32:56.031106 IP 192.168.43.124.8880 > 192.168.43.195.7771: UDP, length 120
23:32:56.058935 IP 192.168.43.195.8880 > 192.168.43.124.7772: UDP, length 120
23:32:56.067591 IP 192.168.43.195.8880 > 192.168.43.124.7772: UDP, length 120
23:32:56.081103 IP 192.168.43.124.8880 > 192.168.43.195.7771: UDP, length 120
23:32:56.131068 IP 192.168.43.124.8880 > 192.168.43.195.7771: UDP, length 120
23:32:56.135086 IP 192.168.43.195.8880 > 192.168.43.124.7772: UDP, length 120
23:32:56.177501 IP 192.168.43.195.8880 > 192.168.43.124.7772: UDP, length 120
23:32:56.181148 IP 192.168.43.124.8880 > 192.168.43.195.7771: UDP, length 120
23:32:56.231154 IP 192.168.43.124.8880 > 192.168.43.195.7771: UDP, length 120
23:32:56.233788 IP 192.168.43.195.8880 > 192.168.43.124.7772: UDP, length 120
23:32:56.271477 IP 192.168.43.195.8880 > 192.168.43.124.7772: UDP, length 120
23:32:56.281152 IP 192.168.43.124.8880 > 192.168.43.195.7771: UDP, length 120
23:32:56.324090 IP 192.168.43.195.8880 > 192.168.43.124.7772: UDP, length 120
23:32:56.331152 IP 192.168.43.124.8880 > 192.168.43.195.7771: UDP, length 120
23:32:56.371699 IP 192.168.43.195.8880 > 192.168.43.124.7772: UDP, length 120
23:32:56.381151 IP 192.168.43.124.8880 > 192.168.43.195.7771: UDP, length 120
23:32:56.421432 IP 192.168.43.195.8880 > 192.168.43.124.7772: UDP, length 120
23:32:56.431114 IP 192.168.43.124.8880 > 192.168.43.195.7771: UDP, length 120
23:32:56.481358 IP 192.168.43.195.8880 > 192.168.43.124.7772: UDP, length 120
23:32:56.481423 IP 192.168.43.124.8880 > 192.168.43.195.7771: UDP, length 120
23:32:56.521706 IP 192.168.43.195.8880 > 192.168.43.124.7772: UDP, length 120
23:32:56.531154 IP 192.168.43.124.8880 > 192.168.43.195.7771: UDP, length 120
23:32:56.571567 IP 192.168.43.195.8880 > 192.168.43.124.7772: UDP, length 120
23:32:56.581152 IP 192.168.43.124.8880 > 192.168.43.195.7771: UDP, length 120
23:32:56.622275 IP 192.168.43.195.8880 > 192.168.43.124.7772: UDP, length 120
23:32:56.631150 IP 192.168.43.124.8880 > 192.168.43.195.7771: UDP, length 120
23:32:56.671416 IP 192.168.43.195.8880 > 192.168.43.124.7772: UDP, length 120
23:32:56.681151 IP 192.168.43.124.8880 > 192.168.43.195.7771: UDP, length 120
23:32:56.724895 IP 192.168.43.195.8880 > 192.168.43.124.7772: UDP, length 120
23:32:56.731152 IP 192.168.43.124.8880 > 192.168.43.195.7771: UDP, length 120
23:32:56.771511 IP 192.168.43.195.8880 > 192.168.43.124.7772: UDP, length 120
23:32:56.781151 IP 192.168.43.124.8880 > 192.168.43.195.7771: UDP, length 120
23:32:56.831151 IP 192.168.43.124.8880 > 192.168.43.195.7771: UDP, length 120
23:32:56.836301 IP 192.168.43.195.8880 > 192.168.43.124.7772: UDP, length 120
23:32:56.871684 IP 192.168.43.195.8880 > 192.168.43.124.7772: UDP, length 120
23:32:56.881152 IP 192.168.43.124.8880 > 192.168.43.195.7771: UDP, length 120
23:32:56.921734 IP 192.168.43.195.8880 > 192.168.43.124.7772: UDP, length 120
23:32:56.931056 IP 192.168.43.124.8880 > 192.168.43.195.7771: UDP, length 120
23:32:56.972322 IP 192.168.43.195.8880 > 192.168.43.124.7772: UDP, length 120
23:32:56.981100 IP 192.168.43.124.8880 > 192.168.43.195.7771: UDP, length 120
23:32:57.031102 IP 192.168.43.124.8880 > 192.168.43.195.7771: UDP, length 120
23:32:57.052681 IP 192.168.43.195.8880 > 192.168.43.124.7772: UDP, length 120
23:32:57.072574 IP 192.168.43.195.8880 > 192.168.43.124.7772: UDP, length 120
23:32:57.081101 IP 192.168.43.124.8880 > 192.168.43.195.7771: UDP, length 120
23:32:57.129385 IP 192.168.43.195.8880 > 192.168.43.124.7772: UDP, length 120
23:32:57.131101 IP 192.168.43.124.8880 > 192.168.43.195.7771: UDP, length 120
23:32:57.181177 IP 192.168.43.195.8880 > 192.168.43.124.7772: UDP, length 120
23:32:57.181206 IP 192.168.43.124.8880 > 192.168.43.195.7771: UDP, length 120
23:32:57.231104 IP 192.168.43.124.8880 > 192.168.43.195.7771: UDP, length 120
23:32:57.235918 IP 192.168.43.195.8880 > 192.168.43.124.7772: UDP, length 120
23:32:57.272041 IP 192.168.43.195.8880 > 192.168.43.124.7772: UDP, length 120
23:32:57.281150 IP 192.168.43.124.8880 > 192.168.43.195.7771: UDP, length 120
23:32:57.331155 IP 192.168.43.124.8880 > 192.168.43.195.7771: UDP, length 120
23:32:57.348143 IP 192.168.43.195.8880 > 192.168.43.124.7772: UDP, length 120
23:32:57.372851 IP 192.168.43.195.8880 > 192.168.43.124.7772: UDP, length 120
23:32:57.381151 IP 192.168.43.124.8880 > 192.168.43.195.7771: UDP, length 120
23:32:57.421501 IP 192.168.43.195.8880 > 192.168.43.124.7772: UDP, length 120
23:32:57.431048 IP 192.168.43.124.8880 > 192.168.43.195.7771: UDP, length 120
23:32:57.471518 IP 192.168.43.195.8880 > 192.168.43.124.7772: UDP, length 120
23:32:57.481099 IP 192.168.43.124.8880 > 192.168.43.195.7771: UDP, length 120
23:32:57.531102 IP 192.168.43.124.8880 > 192.168.43.195.7771: UDP, length 120
23:32:57.538124 IP 192.168.43.195.8880 > 192.168.43.124.7772: UDP, length 120
23:32:57.571930 IP 192.168.43.195.8880 > 192.168.43.124.7772: UDP, length 120
23:32:57.581101 IP 192.168.43.124.8880 > 192.168.43.195.7771: UDP, length 120
23:32:57.621096 IP 192.168.43.195.8880 > 192.168.43.124.7772: UDP, length 120
23:32:57.631100 IP 192.168.43.124.8880 > 192.168.43.195.7771: UDP, length 120
23:32:57.681100 IP 192.168.43.124.8880 > 192.168.43.195.7771: UDP, length 120
23:32:57.681322 IP 192.168.43.195.8880 > 192.168.43.124.7772: UDP, length 120
23:32:57.723224 IP 192.168.43.195.8880 > 192.168.43.124.7772: UDP, length 120
23:32:57.731100 IP 192.168.43.124.8880 > 192.168.43.195.7771: UDP, length 120
23:32:57.771557 IP 192.168.43.195.8880 > 192.168.43.124.7772: UDP, length 120
23:32:57.781102 IP 192.168.43.124.8880 > 192.168.43.195.7771: UDP, length 120
23:32:57.820818 IP 192.168.43.195.8880 > 192.168.43.124.7772: UDP, length 120
23:32:57.831101 IP 192.168.43.124.8880 > 192.168.43.195.7771: UDP, length 120
23:32:57.871770 IP 192.168.43.195.8880 > 192.168.43.124.7772: UDP, length 120
23:32:57.881101 IP 192.168.43.124.8880 > 192.168.43.195.7771: UDP, length 120
23:32:57.922228 IP 192.168.43.195.8880 > 192.168.43.124.7772: UDP, length 120
23:32:57.931099 IP 192.168.43.124.8880 > 192.168.43.195.7771: UDP, length 120
23:32:57.973996 IP 192.168.43.195.8880 > 192.168.43.124.7772: UDP, length 120
23:32:57.981102 IP 192.168.43.124.8880 > 192.168.43.195.7771: UDP, length 120
23:32:58.031101 IP 192.168.43.124.8880 > 192.168.43.195.7771: UDP, length 120
23:32:58.032970 IP 192.168.43.195.8880 > 192.168.43.124.7772: UDP, length 120
23:32:58.077024 IP 192.168.43.195.8880 > 192.168.43.124.7772: UDP, length 120
23:32:58.081101 IP 192.168.43.124.8880 > 192.168.43.195.7771: UDP, length 120
23:32:58.122991 IP 192.168.43.195.8880 > 192.168.43.124.7772: UDP, length 120
23:32:58.131100 IP 192.168.43.124.8880 > 192.168.43.195.7771: UDP, length 120
23:32:58.175317 IP 192.168.43.195.8880 > 192.168.43.124.7772: UDP, length 120
23:32:58.181099 IP 192.168.43.124.8880 > 192.168.43.195.7771: UDP, length 120
23:32:58.220804 IP 192.168.43.195.8880 > 192.168.43.124.7772: UDP, length 120
23:32:58.231026 IP 192.168.43.124.8880 > 192.168.43.195.7771: UDP, length 120
23:32:58.274189 IP 192.168.43.195.8880 > 192.168.43.124.7772: UDP, length 120
23:32:58.281041 IP 192.168.43.124.8880 > 192.168.43.195.7771: UDP, length 120
23:32:58.322906 IP 192.168.43.195.8880 > 192.168.43.124.7772: UDP, length 120
23:32:58.331052 IP 192.168.43.124.8880 > 192.168.43.195.7771: UDP, length 120
23:32:58.381100 IP 192.168.43.124.8880 > 192.168.43.195.7771: UDP, length 120
23:32:58.382179 IP 192.168.43.195.8880 > 192.168.43.124.7772: UDP, length 120
23:32:58.421800 IP 192.168.43.195.8880 > 192.168.43.124.7772: UDP, length 120
23:32:58.431102 IP 192.168.43.124.8880 > 192.168.43.195.7771: UDP, length 120
23:32:58.473885 IP 192.168.43.195.8880 > 192.168.43.124.7772: UDP, length 120
23:32:58.481099 IP 192.168.43.124.8880 > 192.168.43.195.7771: UDP, length 120
23:32:58.531102 IP 192.168.43.124.8880 > 192.168.43.195.7771: UDP, length 120
23:32:58.564848 IP 192.168.43.195.8880 > 192.168.43.124.7772: UDP, length 120
23:32:58.571207 IP 192.168.43.195.8880 > 192.168.43.124.7772: UDP, length 120
23:32:58.581101 IP 192.168.43.124.8880 > 192.168.43.195.7771: UDP, length 120
23:32:58.621191 IP 192.168.43.195.8880 > 192.168.43.124.7772: UDP, length 120
23:32:58.631102 IP 192.168.43.124.8880 > 192.168.43.195.7771: UDP, length 120
23:32:58.675189 IP 192.168.43.195.8880 > 192.168.43.124.7772: UDP, length 120
23:32:58.681100 IP 192.168.43.124.8880 > 192.168.43.195.7771: UDP, length 120
23:32:58.731069 IP 192.168.43.195.8880 > 192.168.43.124.7772: UDP, length 120
23:32:58.731107 IP 192.168.43.124.8880 > 192.168.43.195.7771: UDP, length 120
23:32:58.773747 IP 192.168.43.195.8880 > 192.168.43.124.7772: UDP, length 120
23:32:58.781100 IP 192.168.43.124.8880 > 192.168.43.195.7771: UDP, length 120
23:32:58.821161 IP 192.168.43.195.8880 > 192.168.43.124.7772: UDP, length 120
23:32:58.831101 IP 192.168.43.124.8880 > 192.168.43.195.7771: UDP, length 120
23:32:58.871161 IP 192.168.43.195.8880 > 192.168.43.124.7772: UDP, length 120
23:32:58.881099 IP 192.168.43.124.8880 > 192.168.43.195.7771: UDP, length 120
23:32:58.921670 IP 192.168.43.195.8880 > 192.168.43.124.7772: UDP, length 120
23:32:58.931048 IP 192.168.43.124.8880 > 192.168.43.195.7771: UDP, length 120
23:32:58.971586 IP 192.168.43.195.8880 > 192.168.43.124.7772: UDP, length 120
23:32:58.981100 IP 192.168.43.124.8880 > 192.168.43.195.7771: UDP, length 120
23:32:59.021051 IP 192.168.43.195.8880 > 192.168.43.124.7772: UDP, length 120
23:32:59.031102 IP 192.168.43.124.8880 > 192.168.43.195.7771: UDP, length 120
23:32:59.081100 IP 192.168.43.124.8880 > 192.168.43.195.7771: UDP, length 120
23:32:59.084986 IP 192.168.43.195.8880 > 192.168.43.124.7772: UDP, length 120
23:32:59.122216 IP 192.168.43.195.8880 > 192.168.43.124.7772: UDP, length 120
23:32:59.131101 IP 192.168.43.124.8880 > 192.168.43.195.7771: UDP, length 120
23:32:59.174486 IP 192.168.43.195.8880 > 192.168.43.124.7772: UDP, length 120
23:32:59.181099 IP 192.168.43.124.8880 > 192.168.43.195.7771: UDP, length 120
23:32:59.222137 IP 192.168.43.195.8880 > 192.168.43.124.7772: UDP, length 120
23:32:59.231114 IP 192.168.43.124.8880 > 192.168.43.195.7771: UDP, length 120
23:32:59.281104 IP 192.168.43.124.8880 > 192.168.43.195.7771: UDP, length 120
23:32:59.286383 IP 192.168.43.195.8880 > 192.168.43.124.7772: UDP, length 120
23:32:59.322844 IP 192.168.43.195.8880 > 192.168.43.124.7772: UDP, length 120
23:32:59.331069 IP 192.168.43.124.8880 > 192.168.43.195.7771: UDP, length 120
23:32:59.371301 IP 192.168.43.195.8880 > 192.168.43.124.7772: UDP, length 120
23:32:59.381102 IP 192.168.43.124.8880 > 192.168.43.195.7771: UDP, length 120
23:32:59.421081 IP 192.168.43.195.8880 > 192.168.43.124.7772: UDP, length 120
23:32:59.431050 IP 192.168.43.124.8880 > 192.168.43.195.7771: UDP, length 120
23:32:59.471025 IP 192.168.43.195.8880 > 192.168.43.124.7772: UDP, length 120
23:32:59.481102 IP 192.168.43.124.8880 > 192.168.43.195.7771: UDP, length 120
23:32:59.523312 IP 192.168.43.195.8880 > 192.168.43.124.7772: UDP, length 120
23:32:59.531047 IP 192.168.43.124.8880 > 192.168.43.195.7771: UDP, length 120
23:32:59.581101 IP 192.168.43.124.8880 > 192.168.43.195.7771: UDP, length 120
23:32:59.605043 IP 192.168.43.195.8880 > 192.168.43.124.7772: UDP, length 120
23:32:59.617971 IP 192.168.43.195.8880 > 192.168.43.124.7772: UDP, length 120
23:32:59.631021 IP 192.168.43.124.8880 > 192.168.43.195.7771: UDP, length 120
23:32:59.674190 IP 192.168.43.195.8880 > 192.168.43.124.7772: UDP, length 120
23:32:59.681102 IP 192.168.43.124.8880 > 192.168.43.195.7771: UDP, length 120
23:32:59.721569 IP 192.168.43.195.8880 > 192.168.43.124.7772: UDP, length 120
23:32:59.731108 IP 192.168.43.124.8880 > 192.168.43.195.7771: UDP, length 120
23:32:59.770946 IP 192.168.43.195.8880 > 192.168.43.124.7772: UDP, length 120
23:32:59.781101 IP 192.168.43.124.8880 > 192.168.43.195.7771: UDP, length 120
23:32:59.824060 IP 192.168.43.195.8880 > 192.168.43.124.7772: UDP, length 120
23:32:59.831102 IP 192.168.43.124.8880 > 192.168.43.195.7771: UDP, length 120
23:32:59.881098 IP 192.168.43.124.8880 > 192.168.43.195.7771: UDP, length 120
23:32:59.881715 IP 192.168.43.195.8880 > 192.168.43.124.7772: UDP, length 120
23:32:59.921068 IP 192.168.43.195.8880 > 192.168.43.124.7772: UDP, length 120
23:32:59.931046 IP 192.168.43.124.8880 > 192.168.43.195.7771: UDP, length 120
23:32:59.971260 IP 192.168.43.195.8880 > 192.168.43.124.7772: UDP, length 120
23:32:59.981104 IP 192.168.43.124.8880 > 192.168.43.195.7771: UDP, length 120
23:33:00.031100 IP 192.168.43.124.8880 > 192.168.43.195.7771: UDP, length 120
23:33:00.044605 IP 192.168.43.195.8880 > 192.168.43.124.7772: UDP, length 120
23:33:00.081102 IP 192.168.43.124.8880 > 192.168.43.195.7771: UDP, length 120
23:33:00.124624 IP 192.168.43.195.8880 > 192.168.43.124.7772: UDP, length 120
23:33:00.124638 IP 192.168.43.195.8880 > 192.168.43.124.7772: UDP, length 120
23:33:00.131066 IP 192.168.43.124.8880 > 192.168.43.195.7771: UDP, length 120
23:33:00.171617 IP 192.168.43.195.8880 > 192.168.43.124.7772: UDP, length 120
23:33:00.181097 IP 192.168.43.124.8880 > 192.168.43.195.7771: UDP, length 120
23:33:00.231067 IP 192.168.43.124.8880 > 192.168.43.195.7771: UDP, length 120
23:33:00.247571 IP 192.168.43.195.8880 > 192.168.43.124.7772: UDP, length 120
23:33:00.273642 IP 192.168.43.195.8880 > 192.168.43.124.7772: UDP, length 120
23:33:00.281102 IP 192.168.43.124.8880 > 192.168.43.195.7771: UDP, length 120
23:33:00.329658 IP 192.168.43.195.8880 > 192.168.43.124.7772: UDP, length 120
23:33:00.331065 IP 192.168.43.124.8880 > 192.168.43.195.7771: UDP, length 120
23:33:00.372671 IP 192.168.43.195.8880 > 192.168.43.124.7772: UDP, length 120
23:33:00.381104 IP 192.168.43.124.8880 > 192.168.43.195.7771: UDP, length 120
23:33:00.431080 IP 192.168.43.124.8880 > 192.168.43.195.7771: UDP, length 120
23:33:00.432552 IP 192.168.43.195.8880 > 192.168.43.124.7772: UDP, length 120
23:33:00.471836 IP 192.168.43.195.8880 > 192.168.43.124.7772: UDP, length 120
23:33:00.481154 IP 192.168.43.124.8880 > 192.168.43.195.7771: UDP, length 120
23:33:00.523049 IP 192.168.43.195.8880 > 192.168.43.124.7772: UDP, length 120
23:33:00.531079 IP 192.168.43.124.8880 > 192.168.43.195.7771: UDP, length 120
23:33:00.572092 IP 192.168.43.195.8880 > 192.168.43.124.7772: UDP, length 120
23:33:00.581151 IP 192.168.43.124.8880 > 192.168.43.195.7771: UDP, length 120
23:33:00.624961 IP 192.168.43.195.8880 > 192.168.43.124.7772: UDP, length 120
23:33:00.631051 IP 192.168.43.124.8880 > 192.168.43.195.7771: UDP, length 120
23:33:00.671031 IP 192.168.43.195.8880 > 192.168.43.124.7772: UDP, length 120
23:33:00.681154 IP 192.168.43.124.8880 > 192.168.43.195.7771: UDP, length 120
23:33:00.723242 IP 192.168.43.195.8880 > 192.168.43.124.7772: UDP, length 120
23:33:00.731154 IP 192.168.43.124.8880 > 192.168.43.195.7771: UDP, length 120
23:33:00.774868 IP 192.168.43.195.8880 > 192.168.43.124.7772: UDP, length 120
23:33:00.781152 IP 192.168.43.124.8880 > 192.168.43.195.7771: UDP, length 120
23:33:00.824192 IP 192.168.43.195.8880 > 192.168.43.124.7772: UDP, length 120
23:33:00.831152 IP 192.168.43.124.8880 > 192.168.43.195.7771: UDP, length 120
23:33:00.881153 IP 192.168.43.124.8880 > 192.168.43.195.7771: UDP, length 120
23:33:00.892581 IP 192.168.43.195.8880 > 192.168.43.124.7772: UDP, length 120
23:33:00.925342 IP 192.168.43.195.8880 > 192.168.43.124.7772: UDP, length 120
23:33:00.931078 IP 192.168.43.124.8880 > 192.168.43.195.7771: UDP, length 120
23:33:00.971883 IP 192.168.43.195.8880 > 192.168.43.124.7772: UDP, length 120
23:33:00.981102 IP 192.168.43.124.8880 > 192.168.43.195.7771: UDP, length 120
23:33:01.027713 IP 192.168.43.195.8880 > 192.168.43.124.7772: UDP, length 120
23:33:01.031099 IP 192.168.43.124.8880 > 192.168.43.195.7771: UDP, length 120
23:33:01.072966 IP 192.168.43.195.8880 > 192.168.43.124.7772: UDP, length 120
23:33:01.081100 IP 192.168.43.124.8880 > 192.168.43.195.7771: UDP, length 120
23:33:01.130281 IP 192.168.43.195.8880 > 192.168.43.124.7772: UDP, length 120
23:33:01.131099 IP 192.168.43.124.8880 > 192.168.43.195.7771: UDP, length 120
23:33:01.172806 IP 192.168.43.195.8880 > 192.168.43.124.7772: UDP, length 120
23:33:01.181101 IP 192.168.43.124.8880 > 192.168.43.195.7771: UDP, length 120
23:33:01.228198 IP 192.168.43.195.8880 > 192.168.43.124.7772: UDP, length 120
23:33:01.231100 IP 192.168.43.124.8880 > 192.168.43.195.7771: UDP, length 120
23:33:01.272880 IP 192.168.43.195.8880 > 192.168.43.124.7772: UDP, length 120
23:33:01.281103 IP 192.168.43.124.8880 > 192.168.43.195.7771: UDP, length 120
23:33:01.326030 IP 192.168.43.195.8880 > 192.168.43.124.7772: UDP, length 120
23:33:01.331104 IP 192.168.43.124.8880 > 192.168.43.195.7771: UDP, length 120
23:33:01.374798 IP 192.168.43.195.8880 > 192.168.43.124.7772: UDP, length 120
23:33:01.381152 IP 192.168.43.124.8880 > 192.168.43.195.7771: UDP, length 120
23:33:01.425439 IP 192.168.43.195.8880 > 192.168.43.124.7772: UDP, length 120
23:33:01.431149 IP 192.168.43.124.8880 > 192.168.43.195.7771: UDP, length 120
23:33:01.473147 IP 192.168.43.195.8880 > 192.168.43.124.7772: UDP, length 120
23:33:01.481148 IP 192.168.43.124.8880 > 192.168.43.195.7771: UDP, length 120
23:33:01.522627 IP 192.168.43.195.8880 > 192.168.43.124.7772: UDP, length 120
23:33:01.531102 IP 192.168.43.124.8880 > 192.168.43.195.7771: UDP, length 120
23:33:01.572682 IP 192.168.43.195.8880 > 192.168.43.124.7772: UDP, length 120
23:33:01.581104 IP 192.168.43.124.8880 > 192.168.43.195.7771: UDP, length 120
23:33:01.631103 IP 192.168.43.124.8880 > 192.168.43.195.7771: UDP, length 120
23:33:01.637729 IP 192.168.43.195.8880 > 192.168.43.124.7772: UDP, length 120
23:33:01.673318 IP 192.168.43.195.8880 > 192.168.43.124.7772: UDP, length 120
23:33:01.681103 IP 192.168.43.124.8880 > 192.168.43.195.7771: UDP, length 120
23:33:01.722804 IP 192.168.43.195.8880 > 192.168.43.124.7772: UDP, length 120
23:33:01.731102 IP 192.168.43.124.8880 > 192.168.43.195.7771: UDP, length 120
23:33:01.772836 IP 192.168.43.195.8880 > 192.168.43.124.7772: UDP, length 120
23:33:01.781103 IP 192.168.43.124.8880 > 192.168.43.195.7771: UDP, length 120
23:33:01.826646 IP 192.168.43.195.8880 > 192.168.43.124.7772: UDP, length 120
23:33:01.831099 IP 192.168.43.124.8880 > 192.168.43.195.7771: UDP, length 120
23:33:01.873080 IP 192.168.43.195.8880 > 192.168.43.124.7772: UDP, length 120
23:33:01.881101 IP 192.168.43.124.8880 > 192.168.43.195.7771: UDP, length 120
23:33:01.923112 IP 192.168.43.195.8880 > 192.168.43.124.7772: UDP, length 120
23:33:01.931079 IP 192.168.43.124.8880 > 192.168.43.195.7771: UDP, length 120
23:33:01.972730 IP 192.168.43.195.8880 > 192.168.43.124.7772: UDP, length 120
23:33:01.981103 IP 192.168.43.124.8880 > 192.168.43.195.7771: UDP, length 120
23:33:02.025348 IP 192.168.43.195.8880 > 192.168.43.124.7772: UDP, length 120
23:33:02.031103 IP 192.168.43.124.8880 > 192.168.43.195.7771: UDP, length 120
23:33:02.072608 IP 192.168.43.195.8880 > 192.168.43.124.7772: UDP, length 120
23:33:02.081104 IP 192.168.43.124.8880 > 192.168.43.195.7771: UDP, length 120
23:33:02.122355 IP 192.168.43.195.8880 > 192.168.43.124.7772: UDP, length 120
23:33:02.131102 IP 192.168.43.124.8880 > 192.168.43.195.7771: UDP, length 120
23:33:02.174719 IP 192.168.43.195.8880 > 192.168.43.124.7772: UDP, length 120
23:33:02.181103 IP 192.168.43.124.8880 > 192.168.43.195.7771: UDP, length 120
23:33:02.230406 IP 192.168.43.195.8880 > 192.168.43.124.7772: UDP, length 120
23:33:02.231100 IP 192.168.43.124.8880 > 192.168.43.195.7771: UDP, length 120
23:33:02.275395 IP 192.168.43.195.8880 > 192.168.43.124.7772: UDP, length 120
23:33:02.281150 IP 192.168.43.124.8880 > 192.168.43.195.7771: UDP, length 120
23:33:02.323939 IP 192.168.43.195.8880 > 192.168.43.124.7772: UDP, length 120
23:33:02.331149 IP 192.168.43.124.8880 > 192.168.43.195.7771: UDP, length 120
23:33:02.377892 IP 192.168.43.195.8880 > 192.168.43.124.7772: UDP, length 120
23:33:02.381152 IP 192.168.43.124.8880 > 192.168.43.195.7771: UDP, length 120
23:33:02.426463 IP 192.168.43.195.8880 > 192.168.43.124.7772: UDP, length 120
23:33:02.431151 IP 192.168.43.124.8880 > 192.168.43.195.7771: UDP, length 120
23:33:02.480060 IP 192.168.43.195.8880 > 192.168.43.124.7772: UDP, length 120
23:33:02.481147 IP 192.168.43.124.8880 > 192.168.43.195.7771: UDP, length 120
23:33:02.526020 IP 192.168.43.195.8880 > 192.168.43.124.7772: UDP, length 120
23:33:02.531151 IP 192.168.43.124.8880 > 192.168.43.195.7771: UDP, length 120
23:33:02.575832 IP 192.168.43.195.8880 > 192.168.43.124.7772: UDP, length 120
23:33:02.581151 IP 192.168.43.124.8880 > 192.168.43.195.7771: UDP, length 120
23:33:02.625272 IP 192.168.43.195.8880 > 192.168.43.124.7772: UDP, length 120
23:33:02.631150 IP 192.168.43.124.8880 > 192.168.43.195.7771: UDP, length 120
23:33:02.681150 IP 192.168.43.124.8880 > 192.168.43.195.7771: UDP, length 120
23:33:02.685105 IP 192.168.43.195.8880 > 192.168.43.124.7772: UDP, length 120
23:33:02.725693 IP 192.168.43.195.8880 > 192.168.43.124.7772: UDP, length 120
23:33:02.731152 IP 192.168.43.124.8880 > 192.168.43.195.7771: UDP, length 120
23:33:02.775331 IP 192.168.43.195.8880 > 192.168.43.124.7772: UDP, length 120
23:33:02.781149 IP 192.168.43.124.8880 > 192.168.43.195.7771: UDP, length 120
23:33:02.823166 IP 192.168.43.195.8880 > 192.168.43.124.7772: UDP, length 120
23:33:02.831152 IP 192.168.43.124.8880 > 192.168.43.195.7771: UDP, length 120
23:33:02.873363 IP 192.168.43.195.8880 > 192.168.43.124.7772: UDP, length 120
23:33:02.881150 IP 192.168.43.124.8880 > 192.168.43.195.7771: UDP, length 120
23:33:02.923114 IP 192.168.43.195.8880 > 192.168.43.124.7772: UDP, length 120
23:33:02.931066 IP 192.168.43.124.8880 > 192.168.43.195.7771: UDP, length 120
23:33:02.971965 IP 192.168.43.195.8880 > 192.168.43.124.7772: UDP, length 120
23:33:02.981102 IP 192.168.43.124.8880 > 192.168.43.195.7771: UDP, length 120
23:33:03.027805 IP 192.168.43.195.8880 > 192.168.43.124.7772: UDP, length 120
23:33:03.031101 IP 192.168.43.124.8880 > 192.168.43.195.7771: UDP, length 120
23:33:03.071442 IP 192.168.43.195.8880 > 192.168.43.124.7772: UDP, length 120
23:33:03.081101 IP 192.168.43.124.8880 > 192.168.43.195.7771: UDP, length 120
23:33:03.122815 IP 192.168.43.195.8880 > 192.168.43.124.7772: UDP, length 120
23:33:03.131103 IP 192.168.43.124.8880 > 192.168.43.195.7771: UDP, length 120
23:33:03.173556 IP 192.168.43.195.8880 > 192.168.43.124.7772: UDP, length 120
23:33:03.181099 IP 192.168.43.124.8880 > 192.168.43.195.7771: UDP, length 120
23:33:03.223719 IP 192.168.43.195.8880 > 192.168.43.124.7772: UDP, length 120
23:33:03.231102 IP 192.168.43.124.8880 > 192.168.43.195.7771: UDP, length 120
23:33:03.276471 IP 192.168.43.195.8880 > 192.168.43.124.7772: UDP, length 120
23:33:03.281151 IP 192.168.43.124.8880 > 192.168.43.195.7771: UDP, length 120
23:33:03.323869 IP 192.168.43.195.8880 > 192.168.43.124.7772: UDP, length 120
23:33:03.331038 IP 192.168.43.124.8880 > 192.168.43.195.7771: UDP, length 120
23:33:03.376949 IP 192.168.43.195.8880 > 192.168.43.124.7772: UDP, length 120
23:33:03.381034 IP 192.168.43.124.8880 > 192.168.43.195.7771: UDP, length 120
23:33:03.431046 IP 192.168.43.124.8880 > 192.168.43.195.7771: UDP, length 120
23:33:03.449695 IP 192.168.43.195.8880 > 192.168.43.124.7772: UDP, length 120
23:33:03.479142 IP 192.168.43.195.8880 > 192.168.43.124.7772: UDP, length 120
23:33:03.481035 IP 192.168.43.124.8880 > 192.168.43.195.7771: UDP, length 120
23:33:03.524009 IP 192.168.43.195.8880 > 192.168.43.124.7772: UDP, length 120
23:33:03.531101 IP 192.168.43.124.8880 > 192.168.43.195.7771: UDP, length 120
23:33:03.578083 IP 192.168.43.195.8880 > 192.168.43.124.7772: UDP, length 120
23:33:03.581065 IP 192.168.43.124.8880 > 192.168.43.195.7771: UDP, length 120
23:33:03.626617 IP 192.168.43.195.8880 > 192.168.43.124.7772: UDP, length 120
23:33:03.631102 IP 192.168.43.124.8880 > 192.168.43.195.7771: UDP, length 120
23:33:03.672741 IP 192.168.43.195.8880 > 192.168.43.124.7772: UDP, length 120
23:33:03.681101 IP 192.168.43.124.8880 > 192.168.43.195.7771: UDP, length 120
23:33:03.723327 IP 192.168.43.195.8880 > 192.168.43.124.7772: UDP, length 120
23:33:03.731102 IP 192.168.43.124.8880 > 192.168.43.195.7771: UDP, length 120
23:33:03.772454 IP 192.168.43.195.8880 > 192.168.43.124.7772: UDP, length 120
23:33:03.781103 IP 192.168.43.124.8880 > 192.168.43.195.7771: UDP, length 120
23:33:03.823473 IP 192.168.43.195.8880 > 192.168.43.124.7772: UDP, length 120
23:33:03.831104 IP 192.168.43.124.8880 > 192.168.43.195.7771: UDP, length 120
23:33:03.873528 IP 192.168.43.195.8880 > 192.168.43.124.7772: UDP, length 120
23:33:03.881103 IP 192.168.43.124.8880 > 192.168.43.195.7771: UDP, length 120
23:33:03.920921 IP 192.168.43.195.8880 > 192.168.43.124.7772: UDP, length 120
23:33:03.931102 IP 192.168.43.124.8880 > 192.168.43.195.7771: UDP, length 120
23:33:03.972748 IP 192.168.43.195.8880 > 192.168.43.124.7772: UDP, length 120
23:33:03.981050 IP 192.168.43.124.8880 > 192.168.43.195.7771: UDP, length 120
23:33:04.023641 IP 192.168.43.195.8880 > 192.168.43.124.7772: UDP, length 120
23:33:04.031104 IP 192.168.43.124.8880 > 192.168.43.195.7771: UDP, length 120
23:33:04.072986 IP 192.168.43.195.8880 > 192.168.43.124.7772: UDP, length 120
23:33:04.081102 IP 192.168.43.124.8880 > 192.168.43.195.7771: UDP, length 120
23:33:04.121378 IP 192.168.43.195.8880 > 192.168.43.124.7772: UDP, length 120
23:33:04.131102 IP 192.168.43.124.8880 > 192.168.43.195.7771: UDP, length 120
23:33:04.175690 IP 192.168.43.195.8880 > 192.168.43.124.7772: UDP, length 120
23:33:04.181060 IP 192.168.43.124.8880 > 192.168.43.195.7771: UDP, length 120
23:33:04.228234 IP 192.168.43.195.8880 > 192.168.43.124.7772: UDP, length 120
23:33:04.231103 IP 192.168.43.124.8880 > 192.168.43.195.7771: UDP, length 120
23:33:04.278283 IP 192.168.43.195.8880 > 192.168.43.124.7772: UDP, length 120
23:33:04.281104 IP 192.168.43.124.8880 > 192.168.43.195.7771: UDP, length 120
23:33:04.322897 IP 192.168.43.195.8880 > 192.168.43.124.7772: UDP, length 120
23:33:04.331152 IP 192.168.43.124.8880 > 192.168.43.195.7771: UDP, length 120
23:33:04.372132 IP 192.168.43.195.8880 > 192.168.43.124.7772: UDP, length 120
23:33:04.381182 IP 192.168.43.124.8880 > 192.168.43.195.7771: UDP, length 120
23:33:04.423809 IP 192.168.43.195.8880 > 192.168.43.124.7772: UDP, length 120
23:33:04.431151 IP 192.168.43.124.8880 > 192.168.43.195.7771: UDP, length 120
23:33:04.471820 IP 192.168.43.195.8880 > 192.168.43.124.7772: UDP, length 120
23:33:04.481151 IP 192.168.43.124.8880 > 192.168.43.195.7771: UDP, length 120
23:33:04.530295 IP 192.168.43.195.8880 > 192.168.43.124.7772: UDP, length 120
23:33:04.531075 IP 192.168.43.124.8880 > 192.168.43.195.7771: UDP, length 120
23:33:04.575507 IP 192.168.43.195.8880 > 192.168.43.124.7772: UDP, length 120
23:33:04.581152 IP 192.168.43.124.8880 > 192.168.43.195.7771: UDP, length 120
23:33:04.629442 IP 192.168.43.195.8880 > 192.168.43.124.7772: UDP, length 120
23:33:04.631150 IP 192.168.43.124.8880 > 192.168.43.195.7771: UDP, length 120
23:33:04.673124 IP 192.168.43.195.8880 > 192.168.43.124.7772: UDP, length 120
23:33:04.681152 IP 192.168.43.124.8880 > 192.168.43.195.7771: UDP, length 120
23:33:04.731751 IP 192.168.43.124.8880 > 192.168.43.195.7771: UDP, length 120
23:33:04.731779 IP 192.168.43.195.8880 > 192.168.43.124.7772: UDP, length 120
23:33:04.771461 IP 192.168.43.195.8880 > 192.168.43.124.7772: UDP, length 120
23:33:04.781152 IP 192.168.43.124.8880 > 192.168.43.195.7771: UDP, length 120
23:33:04.828793 IP 192.168.43.195.8880 > 192.168.43.124.7772: UDP, length 120
23:33:04.831152 IP 192.168.43.124.8880 > 192.168.43.195.7771: UDP, length 120
23:33:04.873201 IP 192.168.43.195.8880 > 192.168.43.124.7772: UDP, length 120
23:33:04.881152 IP 192.168.43.124.8880 > 192.168.43.195.7771: UDP, length 120
23:33:04.925822 IP 192.168.43.195.8880 > 192.168.43.124.7772: UDP, length 120
23:33:04.931149 IP 192.168.43.124.8880 > 192.168.43.195.7771: UDP, length 120
23:33:04.975842 IP 192.168.43.195.8880 > 192.168.43.124.7772: UDP, length 120
23:33:04.981107 IP 192.168.43.124.8880 > 192.168.43.195.7771: UDP, length 120
23:33:05.022266 IP 192.168.43.195.8880 > 192.168.43.124.7772: UDP, length 120
23:33:05.031106 IP 192.168.43.124.8880 > 192.168.43.195.7771: UDP, length 120
23:33:05.071396 IP 192.168.43.195.8880 > 192.168.43.124.7772: UDP, length 120
23:33:05.081106 IP 192.168.43.124.8880 > 192.168.43.195.7771: UDP, length 120
23:33:05.131102 IP 192.168.43.124.8880 > 192.168.43.195.7771: UDP, length 120
23:33:05.138081 IP 192.168.43.195.8880 > 192.168.43.124.7772: UDP, length 120
23:33:05.171087 IP 192.168.43.195.8880 > 192.168.43.124.7772: UDP, length 120
23:33:05.181105 IP 192.168.43.124.8880 > 192.168.43.195.7771: UDP, length 120
23:33:05.221937 IP 192.168.43.195.8880 > 192.168.43.124.7772: UDP, length 120
23:33:05.231100 IP 192.168.43.124.8880 > 192.168.43.195.7771: UDP, length 120
23:33:05.272990 IP 192.168.43.195.8880 > 192.168.43.124.7772: UDP, length 120
23:33:05.281102 IP 192.168.43.124.8880 > 192.168.43.195.7771: UDP, length 120
23:33:05.322944 IP 192.168.43.195.8880 > 192.168.43.124.7772: UDP, length 120
23:33:05.331101 IP 192.168.43.124.8880 > 192.168.43.195.7771: UDP, length 120
23:33:05.371262 IP 192.168.43.195.8880 > 192.168.43.124.7772: UDP, length 120
23:33:05.381099 IP 192.168.43.124.8880 > 192.168.43.195.7771: UDP, length 120
23:33:05.426984 IP 192.168.43.195.8880 > 192.168.43.124.7772: UDP, length 120
23:33:05.431153 IP 192.168.43.124.8880 > 192.168.43.195.7771: UDP, length 120
23:33:05.473430 IP 192.168.43.195.8880 > 192.168.43.124.7772: UDP, length 120
23:33:05.481151 IP 192.168.43.124.8880 > 192.168.43.195.7771: UDP, length 120
23:33:05.527455 IP 192.168.43.195.8880 > 192.168.43.124.7772: UDP, length 120
23:33:05.531105 IP 192.168.43.124.8880 > 192.168.43.195.7771: UDP, length 120
23:33:05.578273 IP 192.168.43.195.8880 > 192.168.43.124.7772: UDP, length 120
23:33:05.581106 IP 192.168.43.124.8880 > 192.168.43.195.7771: UDP, length 120
23:33:05.629978 IP 192.168.43.195.8880 > 192.168.43.124.7772: UDP, length 120
23:33:05.631067 IP 192.168.43.124.8880 > 192.168.43.195.7771: UDP, length 120
23:33:05.674736 IP 192.168.43.195.8880 > 192.168.43.124.7772: UDP, length 120
23:33:05.681105 IP 192.168.43.124.8880 > 192.168.43.195.7771: UDP, length 120
23:33:05.723848 IP 192.168.43.195.8880 > 192.168.43.124.7772: UDP, length 120
23:33:05.731103 IP 192.168.43.124.8880 > 192.168.43.195.7771: UDP, length 120
23:33:05.769858 IP 192.168.43.195.8880 > 192.168.43.124.7772: UDP, length 120
23:33:05.781104 IP 192.168.43.124.8880 > 192.168.43.195.7771: UDP, length 120
23:33:05.822858 IP 192.168.43.195.8880 > 192.168.43.124.7772: UDP, length 120
23:33:05.831103 IP 192.168.43.124.8880 > 192.168.43.195.7771: UDP, length 120
23:33:05.872961 IP 192.168.43.195.8880 > 192.168.43.124.7772: UDP, length 120
23:33:05.881105 IP 192.168.43.124.8880 > 192.168.43.195.7771: UDP, length 120
23:33:05.923137 IP 192.168.43.195.8880 > 192.168.43.124.7772: UDP, length 120
23:33:05.931105 IP 192.168.43.124.8880 > 192.168.43.195.7771: UDP, length 120
23:33:05.974075 IP 192.168.43.195.8880 > 192.168.43.124.7772: UDP, length 120
23:33:05.981142 IP 192.168.43.124.8880 > 192.168.43.195.7771: UDP, length 120
23:33:06.021324 IP 192.168.43.195.8880 > 192.168.43.124.7772: UDP, length 120
23:33:06.031101 IP 192.168.43.124.8880 > 192.168.43.195.7771: UDP, length 120
23:33:06.072538 IP 192.168.43.195.8880 > 192.168.43.124.7772: UDP, length 120
23:33:06.081102 IP 192.168.43.124.8880 > 192.168.43.195.7771: UDP, length 120
23:33:06.122707 IP 192.168.43.195.8880 > 192.168.43.124.7772: UDP, length 120
23:33:06.131100 IP 192.168.43.124.8880 > 192.168.43.195.7771: UDP, length 120
23:33:06.172816 IP 192.168.43.195.8880 > 192.168.43.124.7772: UDP, length 120
23:33:06.181101 IP 192.168.43.124.8880 > 192.168.43.195.7771: UDP, length 120
23:33:06.224331 IP 192.168.43.195.8880 > 192.168.43.124.7772: UDP, length 120
23:33:06.231150 IP 192.168.43.124.8880 > 192.168.43.195.7771: UDP, length 120
23:33:06.273600 IP 192.168.43.195.8880 > 192.168.43.124.7772: UDP, length 120
23:33:06.281106 IP 192.168.43.124.8880 > 192.168.43.195.7771: UDP, length 120
23:33:06.322619 IP 192.168.43.195.8880 > 192.168.43.124.7772: UDP, length 120
23:33:06.331103 IP 192.168.43.124.8880 > 192.168.43.195.7771: UDP, length 120
23:33:06.372801 IP 192.168.43.195.8880 > 192.168.43.124.7772: UDP, length 120
23:33:06.426345 IP 192.168.43.195.8880 > 192.168.43.124.7772: UDP, length 120
23:33:06.473688 IP 192.168.43.195.8880 > 192.168.43.124.7772: UDP, length 120
23:33:06.522746 IP 192.168.43.195.8880 > 192.168.43.124.7772: UDP, length 120
23:33:06.573723 IP 192.168.43.195.8880 > 192.168.43.124.7772: UDP, length 120
23:33:06.623504 IP 192.168.43.195.8880 > 192.168.43.124.7772: UDP, length 120
23:33:06.699046 IP 192.168.43.195.8880 > 192.168.43.124.7772: UDP, length 120
23:33:06.727392 IP 192.168.43.195.8880 > 192.168.43.124.7772: UDP, length 120
23:33:06.779564 IP 192.168.43.195.8880 > 192.168.43.124.7772: UDP, length 120
23:33:06.826137 IP 192.168.43.195.8880 > 192.168.43.124.7772: UDP, length 120
23:33:06.875879 IP 192.168.43.195.8880 > 192.168.43.124.7772: UDP, length 120
23:33:06.922831 IP 192.168.43.195.8880 > 192.168.43.124.7772: UDP, length 120
23:33:06.979006 IP 192.168.43.195.8880 > 192.168.43.124.7772: UDP, length 120
23:33:07.023557 IP 192.168.43.195.8880 > 192.168.43.124.7772: UDP, length 120
23:33:07.072609 IP 192.168.43.195.8880 > 192.168.43.124.7772: UDP, length 120
23:33:07.122862 IP 192.168.43.195.8880 > 192.168.43.124.7772: UDP, length 120
23:33:07.184036 IP 192.168.43.195.8880 > 192.168.43.124.7772: UDP, length 120
23:33:07.221324 IP 192.168.43.195.8880 > 192.168.43.124.7772: UDP, length 120
23:33:07.292717 IP 192.168.43.195.8880 > 192.168.43.124.7772: UDP, length 120
23:33:07.340554 IP 192.168.43.195.8880 > 192.168.43.124.7772: UDP, length 120
23:33:07.372088 IP 192.168.43.195.8880 > 192.168.43.124.7772: UDP, length 120
23:33:07.421455 IP 192.168.43.195.8880 > 192.168.43.124.7772: UDP, length 120
