23:20:11.509010 IP 192.168.43.124.8880 > 192.168.43.195.7771: UDP, length 120
23:20:11.670054 IP 192.168.43.124.8880 > 192.168.43.195.7771: UDP, length 120
23:20:11.670059 IP 192.168.43.124.8880 > 192.168.43.195.7771: UDP, length 120
23:20:11.670060 IP 192.168.43.124.8880 > 192.168.43.195.7771: UDP, length 120
23:20:11.709145 IP 192.168.43.124.8880 > 192.168.43.195.7771: UDP, length 120
23:20:11.759145 IP 192.168.43.124.8880 > 192.168.43.195.7771: UDP, length 120
23:20:11.809135 IP 192.168.43.124.8880 > 192.168.43.195.7771: UDP, length 120
23:20:11.859080 IP 192.168.43.124.8880 > 192.168.43.195.7771: UDP, length 120
23:20:12.018200 IP 192.168.43.124.8880 > 192.168.43.195.7771: UDP, length 120
23:20:12.018204 IP 192.168.43.124.8880 > 192.168.43.195.7771: UDP, length 120
23:20:12.018206 IP 192.168.43.124.8880 > 192.168.43.195.7771: UDP, length 120
23:20:12.059143 IP 192.168.43.124.8880 > 192.168.43.195.7771: UDP, length 120
23:20:12.109138 IP 192.168.43.124.8880 > 192.168.43.195.7771: UDP, length 120
23:20:12.159146 IP 192.168.43.124.8880 > 192.168.43.195.7771: UDP, length 120
23:20:12.209118 IP 192.168.43.124.8880 > 192.168.43.195.7771: UDP, length 120
23:20:12.366046 IP 192.168.43.124.8880 > 192.168.43.195.7771: UDP, length 120
23:20:12.366051 IP 192.168.43.124.8880 > 192.168.43.195.7771: UDP, length 120
23:20:12.366052 IP 192.168.43.124.8880 > 192.168.43.195.7771: UDP, length 120
23:20:12.409114 IP 192.168.43.124.8880 > 192.168.43.195.7771: UDP, length 120
23:20:12.459147 IP 192.168.43.124.8880 > 192.168.43.195.7771: UDP, length 120
23:20:12.509141 IP 192.168.43.124.8880 > 192.168.43.195.7771: UDP, length 120
23:20:12.559145 IP 192.168.43.124.8880 > 192.168.43.195.7771: UDP, length 120
23:20:12.714049 IP 192.168.43.124.8880 > 192.168.43.195.7771: UDP, length 120
23:20:12.714054 IP 192.168.43.124.8880 > 192.168.43.195.7771: UDP, length 120
23:20:12.714055 IP 192.168.43.124.8880 > 192.168.43.195.7771: UDP, length 120
23:20:12.759151 IP 192.168.43.124.8880 > 192.168.43.195.7771: UDP, length 120
23:20:12.809114 IP 192.168.43.124.8880 > 192.168.43.195.7771: UDP, length 120
23:20:12.859137 IP 192.168.43.124.8880 > 192.168.43.195.7771: UDP, length 120
23:20:12.909166 IP 192.168.43.124.8880 > 192.168.43.195.7771: UDP, length 120
23:20:13.062048 IP 192.168.43.124.8880 > 192.168.43.195.7771: UDP, length 120
23:20:13.062053 IP 192.168.43.124.8880 > 192.168.43.195.7771: UDP, length 120
23:20:13.062054 IP 192.168.43.124.8880 > 192.168.43.195.7771: UDP, length 120
23:20:13.109134 IP 192.168.43.124.8880 > 192.168.43.195.7771: UDP, length 120
23:20:13.159099 IP 192.168.43.124.8880 > 192.168.43.195.7771: UDP, length 120
23:20:13.209120 IP 192.168.43.124.8880 > 192.168.43.195.7771: UDP, length 120
23:20:13.410046 IP 192.168.43.124.8880 > 192.168.43.195.7771: UDP, length 120
23:20:13.410051 IP 192.168.43.124.8880 > 192.168.43.195.7771: UDP, length 120
23:20:13.410052 IP 192.168.43.124.8880 > 192.168.43.195.7771: UDP, length 120
23:20:13.410053 IP 192.168.43.124.8880 > 192.168.43.195.7771: UDP, length 120
23:20:13.459141 IP 192.168.43.124.8880 > 192.168.43.195.7771: UDP, length 120
23:20:13.509125 IP 192.168.43.124.8880 > 192.168.43.195.7771: UDP, length 120
23:20:13.559120 IP 192.168.43.124.8880 > 192.168.43.195.7771: UDP, length 120
23:20:13.758877 IP 192.168.43.124.8880 > 192.168.43.195.7771: UDP, length 120
23:20:13.758885 IP 192.168.43.124.8880 > 192.168.43.195.7771: UDP, length 120
23:20:13.758888 IP 192.168.43.124.8880 > 192.168.43.195.7771: UDP, length 120
23:20:13.761376 IP 192.168.43.124.8880 > 192.168.43.195.7771: UDP, length 120
23:20:13.809138 IP 192.168.43.124.8880 > 192.168.43.195.7771: UDP, length 120
23:20:13.859092 IP 192.168.43.124.8880 > 192.168.43.195.7771: UDP, length 120
23:20:13.909125 IP 192.168.43.124.8880 > 192.168.43.195.7771: UDP, length 120
23:20:13.959117 IP 192.168.43.124.8880 > 192.168.43.195.7771: UDP, length 120
23:20:14.009127 IP 192.168.43.124.8880 > 192.168.43.195.7771: UDP, length 120
23:20:14.059150 IP 192.168.43.124.8880 > 192.168.43.195.7771: UDP, length 120
23:20:14.109128 IP 192.168.43.124.8880 > 192.168.43.195.7771: UDP, length 120
23:20:14.159117 IP 192.168.43.124.8880 > 192.168.43.195.7771: UDP, length 120
23:20:14.209131 IP 192.168.43.124.8880 > 192.168.43.195.7771: UDP, length 120
23:20:14.259126 IP 192.168.43.124.8880 > 192.168.43.195.7771: UDP, length 120
23:20:14.309191 IP 192.168.43.124.8880 > 192.168.43.195.7771: UDP, length 120
23:20:14.359167 IP 192.168.43.124.8880 > 192.168.43.195.7771: UDP, length 120
23:20:14.409185 IP 192.168.43.124.8880 > 192.168.43.195.7771: UDP, length 120
23:20:14.459228 IP 192.168.43.124.8880 > 192.168.43.195.7771: UDP, length 120
23:20:14.509233 IP 192.168.43.124.8880 > 192.168.43.195.7771: UDP, length 120
23:20:14.559171 IP 192.168.43.124.8880 > 192.168.43.195.7771: UDP, length 120
23:20:14.609237 IP 192.168.43.124.8880 > 192.168.43.195.7771: UDP, length 120
23:20:14.659369 IP 192.168.43.124.8880 > 192.168.43.195.7771: UDP, length 120
23:20:14.709391 IP 192.168.43.124.8880 > 192.168.43.195.7771: UDP, length 120
23:20:14.759369 IP 192.168.43.124.8880 > 192.168.43.195.7771: UDP, length 120
23:20:14.809194 IP 192.168.43.124.8880 > 192.168.43.195.7771: UDP, length 120
23:20:14.859172 IP 192.168.43.124.8880 > 192.168.43.195.7771: UDP, length 120
23:20:14.909195 IP 192.168.43.124.8880 > 192.168.43.195.7771: UDP, length 120
23:20:14.959886 IP 192.168.43.124.8880 > 192.168.43.195.7771: UDP, length 120
23:20:15.009123 IP 192.168.43.124.8880 > 192.168.43.195.7771: UDP, length 120
23:20:15.059153 IP 192.168.43.124.8880 > 192.168.43.195.7771: UDP, length 120
23:20:15.109122 IP 192.168.43.124.8880 > 192.168.43.195.7771: UDP, length 120
23:20:15.159121 IP 192.168.43.124.8880 > 192.168.43.195.7771: UDP, length 120
23:20:15.209121 IP 192.168.43.124.8880 > 192.168.43.195.7771: UDP, length 120
23:20:15.259128 IP 192.168.43.124.8880 > 192.168.43.195.7771: UDP, length 120
23:20:15.309119 IP 192.168.43.124.8880 > 192.168.43.195.7771: UDP, length 120
23:20:15.359118 IP 192.168.43.124.8880 > 192.168.43.195.7771: UDP, length 120
23:20:15.409153 IP 192.168.43.124.8880 > 192.168.43.195.7771: UDP, length 120
23:20:15.459181 IP 192.168.43.124.8880 > 192.168.43.195.7771: UDP, length 120
23:20:15.509112 IP 192.168.43.124.8880 > 192.168.43.195.7771: UDP, length 120
23:20:15.559347 IP 192.168.43.124.8880 > 192.168.43.195.7771: UDP, length 120
23:20:15.609118 IP 192.168.43.124.8880 > 192.168.43.195.7771: UDP, length 120
23:20:15.659117 IP 192.168.43.124.8880 > 192.168.43.195.7771: UDP, length 120
23:20:15.709118 IP 192.168.43.124.8880 > 192.168.43.195.7771: UDP, length 120
23:20:15.759118 IP 192.168.43.124.8880 > 192.168.43.195.7771: UDP, length 120
23:20:15.809137 IP 192.168.43.124.8880 > 192.168.43.195.7771: UDP, length 120
23:20:15.859121 IP 192.168.43.124.8880 > 192.168.43.195.7771: UDP, length 120
23:20:15.909118 IP 192.168.43.124.8880 > 192.168.43.195.7771: UDP, length 120
23:20:15.959122 IP 192.168.43.124.8880 > 192.168.43.195.7771: UDP, length 120
23:20:16.009119 IP 192.168.43.124.8880 > 192.168.43.195.7771: UDP, length 120
23:20:16.059099 IP 192.168.43.124.8880 > 192.168.43.195.7771: UDP, length 120
23:20:16.109147 IP 192.168.43.124.8880 > 192.168.43.195.7771: UDP, length 120
23:20:16.159101 IP 192.168.43.124.8880 > 192.168.43.195.7771: UDP, length 120
23:20:16.209118 IP 192.168.43.124.8880 > 192.168.43.195.7771: UDP, length 120
23:20:16.259178 IP 192.168.43.124.8880 > 192.168.43.195.7771: UDP, length 120
23:20:16.309225 IP 192.168.43.124.8880 > 192.168.43.195.7771: UDP, length 120
23:20:16.359379 IP 192.168.43.124.8880 > 192.168.43.195.7771: UDP, length 120
23:20:16.409168 IP 192.168.43.124.8880 > 192.168.43.195.7771: UDP, length 120
23:20:16.459182 IP 192.168.43.124.8880 > 192.168.43.195.7771: UDP, length 120
23:20:16.509885 IP 192.168.43.124.8880 > 192.168.43.195.7771: UDP, length 120
23:20:16.559405 IP 192.168.43.124.8880 > 192.168.43.195.7771: UDP, length 120
23:20:16.610155 IP 192.168.43.124.8880 > 192.168.43.195.7771: UDP, length 120
23:20:16.659169 IP 192.168.43.124.8880 > 192.168.43.195.7771: UDP, length 120
23:20:16.709211 IP 192.168.43.124.8880 > 192.168.43.195.7771: UDP, length 120
23:20:16.759242 IP 192.168.43.124.8880 > 192.168.43.195.7771: UDP, length 120
23:20:16.809163 IP 192.168.43.124.8880 > 192.168.43.195.7771: UDP, length 120
23:20:16.859245 IP 192.168.43.124.8880 > 192.168.43.195.7771: UDP, length 120
23:20:16.909318 IP 192.168.43.124.8880 > 192.168.43.195.7771: UDP, length 120
23:20:16.959135 IP 192.168.43.124.8880 > 192.168.43.195.7771: UDP, length 120
23:20:17.009086 IP 192.168.43.124.8880 > 192.168.43.195.7771: UDP, length 120
23:20:17.059100 IP 192.168.43.124.8880 > 192.168.43.195.7771: UDP, length 120
23:20:17.109122 IP 192.168.43.124.8880 > 192.168.43.195.7771: UDP, length 120
23:20:17.159102 IP 192.168.43.124.8880 > 192.168.43.195.7771: UDP, length 120
23:20:17.209116 IP 192.168.43.124.8880 > 192.168.43.195.7771: UDP, length 120
23:20:17.259144 IP 192.168.43.124.8880 > 192.168.43.195.7771: UDP, length 120
23:20:17.309118 IP 192.168.43.124.8880 > 192.168.43.195.7771: UDP, length 120
23:20:17.359147 IP 192.168.43.124.8880 > 192.168.43.195.7771: UDP, length 120
23:20:17.409117 IP 192.168.43.124.8880 > 192.168.43.195.7771: UDP, length 120
23:20:17.459149 IP 192.168.43.124.8880 > 192.168.43.195.7771: UDP, length 120
23:20:17.509119 IP 192.168.43.124.8880 > 192.168.43.195.7771: UDP, length 120
23:20:17.559151 IP 192.168.43.124.8880 > 192.168.43.195.7771: UDP, length 120
23:20:17.609115 IP 192.168.43.124.8880 > 192.168.43.195.7771: UDP, length 120
23:20:17.659151 IP 192.168.43.124.8880 > 192.168.43.195.7771: UDP, length 120
23:20:17.709116 IP 192.168.43.124.8880 > 192.168.43.195.7771: UDP, length 120
23:20:17.759321 IP 192.168.43.124.8880 > 192.168.43.195.7771: UDP, length 120
23:20:17.809128 IP 192.168.43.124.8880 > 192.168.43.195.7771: UDP, length 120
23:20:17.859145 IP 192.168.43.124.8880 > 192.168.43.195.7771: UDP, length 120
23:20:17.909698 IP 192.168.43.124.8880 > 192.168.43.195.7771: UDP, length 120
23:20:17.959117 IP 192.168.43.124.8880 > 192.168.43.195.7771: UDP, length 120
23:20:18.009117 IP 192.168.43.124.8880 > 192.168.43.195.7771: UDP, length 120
23:20:18.059116 IP 192.168.43.124.8880 > 192.168.43.195.7771: UDP, length 120
23:20:18.109117 IP 192.168.43.124.8880 > 192.168.43.195.7771: UDP, length 120
23:20:18.159086 IP 192.168.43.124.8880 > 192.168.43.195.7771: UDP, length 120
23:20:18.209139 IP 192.168.43.124.8880 > 192.168.43.195.7771: UDP, length 120
23:20:18.259153 IP 192.168.43.124.8880 > 192.168.43.195.7771: UDP, length 120
23:20:18.309117 IP 192.168.43.124.8880 > 192.168.43.195.7771: UDP, length 120
23:20:18.359116 IP 192.168.43.124.8880 > 192.168.43.195.7771: UDP, length 120
23:20:18.409118 IP 192.168.43.124.8880 > 192.168.43.195.7771: UDP, length 120
23:20:18.459190 IP 192.168.43.124.8880 > 192.168.43.195.7771: UDP, length 120
23:20:18.509168 IP 192.168.43.124.8880 > 192.168.43.195.7771: UDP, length 120
23:20:18.559170 IP 192.168.43.124.8880 > 192.168.43.195.7771: UDP, length 120
23:20:18.609181 IP 192.168.43.124.8880 > 192.168.43.195.7771: UDP, length 120
23:20:18.659167 IP 192.168.43.124.8880 > 192.168.43.195.7771: UDP, length 120
23:20:18.709167 IP 192.168.43.124.8880 > 192.168.43.195.7771: UDP, length 120
23:20:18.759165 IP 192.168.43.124.8880 > 192.168.43.195.7771: UDP, length 120
23:20:18.809183 IP 192.168.43.124.8880 > 192.168.43.195.7771: UDP, length 120
23:20:18.859165 IP 192.168.43.124.8880 > 192.168.43.195.7771: UDP, length 120
23:20:18.909166 IP 192.168.43.124.8880 > 192.168.43.195.7771: UDP, length 120
23:20:18.959165 IP 192.168.43.124.8880 > 192.168.43.195.7771: UDP, length 120
23:20:19.009186 IP 192.168.43.124.8880 > 192.168.43.195.7771: UDP, length 120
23:20:19.059104 IP 192.168.43.124.8880 > 192.168.43.195.7771: UDP, length 120
23:20:19.109140 IP 192.168.43.124.8880 > 192.168.43.195.7771: UDP, length 120
23:20:19.159065 IP 192.168.43.124.8880 > 192.168.43.195.7771: UDP, length 120
23:20:19.209136 IP 192.168.43.124.8880 > 192.168.43.195.7771: UDP, length 120
23:20:19.259145 IP 192.168.43.124.8880 > 192.168.43.195.7771: UDP, length 120
23:20:19.309149 IP 192.168.43.124.8880 > 192.168.43.195.7771: UDP, length 120
23:20:19.359136 IP 192.168.43.124.8880 > 192.168.43.195.7771: UDP, length 120
23:20:19.409121 IP 192.168.43.124.8880 > 192.168.43.195.7771: UDP, length 120
23:20:19.459148 IP 192.168.43.124.8880 > 192.168.43.195.7771: UDP, length 120
23:20:19.509148 IP 192.168.43.124.8880 > 192.168.43.195.7771: UDP, length 120
23:20:19.559168 IP 192.168.43.124.8880 > 192.168.43.195.7771: UDP, length 120
23:20:19.609166 IP 192.168.43.124.8880 > 192.168.43.195.7771: UDP, length 120
23:20:19.659198 IP 192.168.43.124.8880 > 192.168.43.195.7771: UDP, length 120
23:20:19.709168 IP 192.168.43.124.8880 > 192.168.43.195.7771: UDP, length 120
23:20:19.759168 IP 192.168.43.124.8880 > 192.168.43.195.7771: UDP, length 120
23:20:19.809204 IP 192.168.43.124.8880 > 192.168.43.195.7771: UDP, length 120
23:20:19.859198 IP 192.168.43.124.8880 > 192.168.43.195.7771: UDP, length 120
23:20:19.909169 IP 192.168.43.124.8880 > 192.168.43.195.7771: UDP, length 120
23:20:19.959168 IP 192.168.43.124.8880 > 192.168.43.195.7771: UDP, length 120
23:20:20.009169 IP 192.168.43.124.8880 > 192.168.43.195.7771: UDP, length 120
23:20:20.059105 IP 192.168.43.124.8880 > 192.168.43.195.7771: UDP, length 120
23:20:20.109121 IP 192.168.43.124.8880 > 192.168.43.195.7771: UDP, length 120
23:20:20.159120 IP 192.168.43.124.8880 > 192.168.43.195.7771: UDP, length 120
23:20:20.209121 IP 192.168.43.124.8880 > 192.168.43.195.7771: UDP, length 120
23:20:20.259097 IP 192.168.43.124.8880 > 192.168.43.195.7771: UDP, length 120
23:20:20.309120 IP 192.168.43.124.8880 > 192.168.43.195.7771: UDP, length 120
23:20:20.359120 IP 192.168.43.124.8880 > 192.168.43.195.7771: UDP, length 120
23:20:20.409124 IP 192.168.43.124.8880 > 192.168.43.195.7771: UDP, length 120
23:20:20.459131 IP 192.168.43.124.8880 > 192.168.43.195.7771: UDP, length 120
23:20:20.509124 IP 192.168.43.124.8880 > 192.168.43.195.7771: UDP, length 120
23:20:20.559129 IP 192.168.43.124.8880 > 192.168.43.195.7771: UDP, length 120
23:20:20.609120 IP 192.168.43.124.8880 > 192.168.43.195.7771: UDP, length 120
23:20:20.659131 IP 192.168.43.124.8880 > 192.168.43.195.7771: UDP, length 120
23:20:20.709120 IP 192.168.43.124.8880 > 192.168.43.195.7771: UDP, length 120
23:20:20.759132 IP 192.168.43.124.8880 > 192.168.43.195.7771: UDP, length 120
23:20:20.809119 IP 192.168.43.124.8880 > 192.168.43.195.7771: UDP, length 120
23:20:20.859149 IP 192.168.43.124.8880 > 192.168.43.195.7771: UDP, length 120
23:20:20.909121 IP 192.168.43.124.8880 > 192.168.43.195.7771: UDP, length 120
23:20:20.959077 IP 192.168.43.124.8880 > 192.168.43.195.7771: UDP, length 120
23:20:21.009122 IP 192.168.43.124.8880 > 192.168.43.195.7771: UDP, length 120
23:20:21.059101 IP 192.168.43.124.8880 > 192.168.43.195.7771: UDP, length 120
23:20:21.109147 IP 192.168.43.124.8880 > 192.168.43.195.7771: UDP, length 120
23:20:21.159117 IP 192.168.43.124.8880 > 192.168.43.195.7771: UDP, length 120
23:20:21.209118 IP 192.168.43.124.8880 > 192.168.43.195.7771: UDP, length 120
23:20:21.259142 IP 192.168.43.124.8880 > 192.168.43.195.7771: UDP, length 120
23:20:21.309151 IP 192.168.43.124.8880 > 192.168.43.195.7771: UDP, length 120
23:20:21.359150 IP 192.168.43.124.8880 > 192.168.43.195.7771: UDP, length 120
23:20:21.409153 IP 192.168.43.124.8880 > 192.168.43.195.7771: UDP, length 120
23:20:21.459243 IP 192.168.43.124.8880 > 192.168.43.195.7771: UDP, length 120
23:20:21.509117 IP 192.168.43.124.8880 > 192.168.43.195.7771: UDP, length 120
23:20:21.559118 IP 192.168.43.124.8880 > 192.168.43.195.7771: UDP, length 120
23:20:21.609125 IP 192.168.43.124.8880 > 192.168.43.195.7771: UDP, length 120
23:20:21.659039 IP 192.168.43.124.8880 > 192.168.43.195.7771: UDP, length 120
23:20:21.709026 IP 192.168.43.124.8880 > 192.168.43.195.7771: UDP, length 120
23:20:21.759116 IP 192.168.43.124.8880 > 192.168.43.195.7771: UDP, length 120
23:20:21.809118 IP 192.168.43.124.8880 > 192.168.43.195.7771: UDP, length 120
23:20:21.859149 IP 192.168.43.124.8880 > 192.168.43.195.7771: UDP, length 120
23:20:21.909141 IP 192.168.43.124.8880 > 192.168.43.195.7771: UDP, length 120
23:20:21.959117 IP 192.168.43.124.8880 > 192.168.43.195.7771: UDP, length 120
23:20:22.009118 IP 192.168.43.124.8880 > 192.168.43.195.7771: UDP, length 120
23:20:22.059088 IP 192.168.43.124.8880 > 192.168.43.195.7771: UDP, length 120
23:20:22.109086 IP 192.168.43.124.8880 > 192.168.43.195.7771: UDP, length 120
23:20:22.159250 IP 192.168.43.124.8880 > 192.168.43.195.7771: UDP, length 120
23:20:22.209158 IP 192.168.43.124.8880 > 192.168.43.195.7771: UDP, length 120
23:20:22.259204 IP 192.168.43.124.8880 > 192.168.43.195.7771: UDP, length 120
23:20:22.309185 IP 192.168.43.124.8880 > 192.168.43.195.7771: UDP, length 120
23:20:22.359182 IP 192.168.43.124.8880 > 192.168.43.195.7771: UDP, length 120
23:20:22.409187 IP 192.168.43.124.8880 > 192.168.43.195.7771: UDP, length 120
23:20:22.459110 IP 192.168.43.124.8880 > 192.168.43.195.7771: UDP, length 120
23:20:22.509182 IP 192.168.43.124.8880 > 192.168.43.195.7771: UDP, length 120
23:20:22.559179 IP 192.168.43.124.8880 > 192.168.43.195.7771: UDP, length 120
23:20:22.609178 IP 192.168.43.124.8880 > 192.168.43.195.7771: UDP, length 120
23:20:22.659137 IP 192.168.43.124.8880 > 192.168.43.195.7771: UDP, length 120
23:20:22.709182 IP 192.168.43.124.8880 > 192.168.43.195.7771: UDP, length 120
23:20:22.759183 IP 192.168.43.124.8880 > 192.168.43.195.7771: UDP, length 120
23:20:22.809182 IP 192.168.43.124.8880 > 192.168.43.195.7771: UDP, length 120
23:20:22.859179 IP 192.168.43.124.8880 > 192.168.43.195.7771: UDP, length 120
23:20:22.909179 IP 192.168.43.124.8880 > 192.168.43.195.7771: UDP, length 120
23:20:22.959185 IP 192.168.43.124.8880 > 192.168.43.195.7771: UDP, length 120
23:20:23.009204 IP 192.168.43.124.8880 > 192.168.43.195.7771: UDP, length 120
23:20:23.059159 IP 192.168.43.124.8880 > 192.168.43.195.7771: UDP, length 120
23:20:23.109128 IP 192.168.43.124.8880 > 192.168.43.195.7771: UDP, length 120
23:20:23.159130 IP 192.168.43.124.8880 > 192.168.43.195.7771: UDP, length 120
23:20:23.209131 IP 192.168.43.124.8880 > 192.168.43.195.7771: UDP, length 120
23:20:23.259105 IP 192.168.43.124.8880 > 192.168.43.195.7771: UDP, length 120
23:20:23.309157 IP 192.168.43.124.8880 > 192.168.43.195.7771: UDP, length 120
23:20:23.359061 IP 192.168.43.124.8880 > 192.168.43.195.7771: UDP, length 120
23:20:23.409143 IP 192.168.43.124.8880 > 192.168.43.195.7771: UDP, length 120
23:20:23.459124 IP 192.168.43.124.8880 > 192.168.43.195.7771: UDP, length 120
23:20:23.509146 IP 192.168.43.124.8880 > 192.168.43.195.7771: UDP, length 120
23:20:23.559127 IP 192.168.43.124.8880 > 192.168.43.195.7771: UDP, length 120
23:20:23.609147 IP 192.168.43.124.8880 > 192.168.43.195.7771: UDP, length 120
23:20:23.659123 IP 192.168.43.124.8880 > 192.168.43.195.7771: UDP, length 120
23:20:23.709147 IP 192.168.43.124.8880 > 192.168.43.195.7771: UDP, length 120
23:20:23.759122 IP 192.168.43.124.8880 > 192.168.43.195.7771: UDP, length 120
23:20:23.809152 IP 192.168.43.124.8880 > 192.168.43.195.7771: UDP, length 120
23:20:23.859092 IP 192.168.43.124.8880 > 192.168.43.195.7771: UDP, length 120
23:20:23.909179 IP 192.168.43.124.8880 > 192.168.43.195.7771: UDP, length 120
23:20:23.959182 IP 192.168.43.124.8880 > 192.168.43.195.7771: UDP, length 120
23:20:24.009182 IP 192.168.43.124.8880 > 192.168.43.195.7771: UDP, length 120
23:20:24.059105 IP 192.168.43.124.8880 > 192.168.43.195.7771: UDP, length 120
23:20:24.109135 IP 192.168.43.124.8880 > 192.168.43.195.7771: UDP, length 120
23:20:24.159131 IP 192.168.43.124.8880 > 192.168.43.195.7771: UDP, length 120
23:20:24.209128 IP 192.168.43.124.8880 > 192.168.43.195.7771: UDP, length 120
23:20:24.259125 IP 192.168.43.124.8880 > 192.168.43.195.7771: UDP, length 120
23:20:24.309125 IP 192.168.43.124.8880 > 192.168.43.195.7771: UDP, length 120
23:20:24.359103 IP 192.168.43.124.8880 > 192.168.43.195.7771: UDP, length 120
23:20:24.409123 IP 192.168.43.124.8880 > 192.168.43.195.7771: UDP, length 120
23:20:24.459138 IP 192.168.43.124.8880 > 192.168.43.195.7771: UDP, length 120
23:20:24.509138 IP 192.168.43.124.8880 > 192.168.43.195.7771: UDP, length 120
23:20:24.559135 IP 192.168.43.124.8880 > 192.168.43.195.7771: UDP, length 120
23:20:24.609127 IP 192.168.43.124.8880 > 192.168.43.195.7771: UDP, length 120
23:20:24.659130 IP 192.168.43.124.8880 > 192.168.43.195.7771: UDP, length 120
23:20:24.709127 IP 192.168.43.124.8880 > 192.168.43.195.7771: UDP, length 120
23:20:24.759130 IP 192.168.43.124.8880 > 192.168.43.195.7771: UDP, length 120
23:20:24.809126 IP 192.168.43.124.8880 > 192.168.43.195.7771: UDP, length 120
23:20:24.859130 IP 192.168.43.124.8880 > 192.168.43.195.7771: UDP, length 120
23:20:24.909126 IP 192.168.43.124.8880 > 192.168.43.195.7771: UDP, length 120
23:20:24.959126 IP 192.168.43.124.8880 > 192.168.43.195.7771: UDP, length 120
23:20:25.009131 IP 192.168.43.124.8880 > 192.168.43.195.7771: UDP, length 120
23:20:25.059145 IP 192.168.43.124.8880 > 192.168.43.195.7771: UDP, length 120
23:20:25.109128 IP 192.168.43.124.8880 > 192.168.43.195.7771: UDP, length 120
23:20:25.159125 IP 192.168.43.124.8880 > 192.168.43.195.7771: UDP, length 120
23:20:25.209128 IP 192.168.43.124.8880 > 192.168.43.195.7771: UDP, length 120
23:20:25.259185 IP 192.168.43.124.8880 > 192.168.43.195.7771: UDP, length 120
23:20:25.309179 IP 192.168.43.124.8880 > 192.168.43.195.7771: UDP, length 120
23:20:25.359146 IP 192.168.43.124.8880 > 192.168.43.195.7771: UDP, length 120
23:20:25.409183 IP 192.168.43.124.8880 > 192.168.43.195.7771: UDP, length 120
23:20:25.459179 IP 192.168.43.124.8880 > 192.168.43.195.7771: UDP, length 120
23:20:25.509190 IP 192.168.43.124.8880 > 192.168.43.195.7771: UDP, length 120
23:20:25.559180 IP 192.168.43.124.8880 > 192.168.43.195.7771: UDP, length 120
23:20:25.609179 IP 192.168.43.124.8880 > 192.168.43.195.7771: UDP, length 120
23:20:25.659160 IP 192.168.43.124.8880 > 192.168.43.195.7771: UDP, length 120
23:20:25.709191 IP 192.168.43.124.8880 > 192.168.43.195.7771: UDP, length 120
23:20:25.759206 IP 192.168.43.124.8880 > 192.168.43.195.7771: UDP, length 120
23:20:25.809908 IP 192.168.43.124.8880 > 192.168.43.195.7771: UDP, length 120
23:20:25.859420 IP 192.168.43.124.8880 > 192.168.43.195.7771: UDP, length 120
23:20:25.909184 IP 192.168.43.124.8880 > 192.168.43.195.7771: UDP, length 120
23:20:25.959919 IP 192.168.43.124.8880 > 192.168.43.195.7771: UDP, length 120
23:20:26.010225 IP 192.168.43.124.8880 > 192.168.43.195.7771: UDP, length 120
23:20:26.059146 IP 192.168.43.124.8880 > 192.168.43.195.7771: UDP, length 120
23:20:26.109200 IP 192.168.43.124.8880 > 192.168.43.195.7771: UDP, length 120
23:20:26.159151 IP 192.168.43.124.8880 > 192.168.43.195.7771: UDP, length 120
23:20:26.209153 IP 192.168.43.124.8880 > 192.168.43.195.7771: UDP, length 120
23:20:26.259154 IP 192.168.43.124.8880 > 192.168.43.195.7771: UDP, length 120
23:20:26.310237 IP 192.168.43.124.8880 > 192.168.43.195.7771: UDP, length 120
23:20:26.359150 IP 192.168.43.124.8880 > 192.168.43.195.7771: UDP, length 120
23:20:26.409214 IP 192.168.43.124.8880 > 192.168.43.195.7771: UDP, length 120
23:20:26.459404 IP 192.168.43.124.8880 > 192.168.43.195.7771: UDP, length 120
23:20:26.509174 IP 192.168.43.124.8880 > 192.168.43.195.7771: UDP, length 120
23:20:26.560196 IP 192.168.43.124.8880 > 192.168.43.195.7771: UDP, length 120
23:20:26.609193 IP 192.168.43.124.8880 > 192.168.43.195.7771: UDP, length 120
23:20:26.659176 IP 192.168.43.124.8880 > 192.168.43.195.7771: UDP, length 120
23:20:26.709174 IP 192.168.43.124.8880 > 192.168.43.195.7771: UDP, length 120
23:20:26.759893 IP 192.168.43.124.8880 > 192.168.43.195.7771: UDP, length 120
23:20:26.809707 IP 192.168.43.124.8880 > 192.168.43.195.7771: UDP, length 120
23:20:26.860229 IP 192.168.43.124.8880 > 192.168.43.195.7771: UDP, length 120
23:20:26.909379 IP 192.168.43.124.8880 > 192.168.43.195.7771: UDP, length 120
23:20:26.959201 IP 192.168.43.124.8880 > 192.168.43.195.7771: UDP, length 120
23:20:27.009233 IP 192.168.43.124.8880 > 192.168.43.195.7771: UDP, length 120
23:20:27.059177 IP 192.168.43.124.8880 > 192.168.43.195.7771: UDP, length 120
23:20:27.109188 IP 192.168.43.124.8880 > 192.168.43.195.7771: UDP, length 120
23:20:27.159089 IP 192.168.43.124.8880 > 192.168.43.195.7771: UDP, length 120
23:20:27.209084 IP 192.168.43.124.8880 > 192.168.43.195.7771: UDP, length 120
23:20:27.259101 IP 192.168.43.124.8880 > 192.168.43.195.7771: UDP, length 120
23:20:27.309139 IP 192.168.43.124.8880 > 192.168.43.195.7771: UDP, length 120
23:20:27.359038 IP 192.168.43.124.8880 > 192.168.43.195.7771: UDP, length 120
23:20:27.409144 IP 192.168.43.124.8880 > 192.168.43.195.7771: UDP, length 120
23:20:27.459101 IP 192.168.43.124.8880 > 192.168.43.195.7771: UDP, length 120
23:20:27.509135 IP 192.168.43.124.8880 > 192.168.43.195.7771: UDP, length 120
23:20:27.559123 IP 192.168.43.124.8880 > 192.168.43.195.7771: UDP, length 120
23:20:27.609135 IP 192.168.43.124.8880 > 192.168.43.195.7771: UDP, length 120
23:20:27.659130 IP 192.168.43.124.8880 > 192.168.43.195.7771: UDP, length 120
23:20:27.709138 IP 192.168.43.124.8880 > 192.168.43.195.7771: UDP, length 120
23:20:27.759122 IP 192.168.43.124.8880 > 192.168.43.195.7771: UDP, length 120
23:20:27.809144 IP 192.168.43.124.8880 > 192.168.43.195.7771: UDP, length 120
23:20:27.859148 IP 192.168.43.124.8880 > 192.168.43.195.7771: UDP, length 120
23:20:27.909141 IP 192.168.43.124.8880 > 192.168.43.195.7771: UDP, length 120
23:20:27.959122 IP 192.168.43.124.8880 > 192.168.43.195.7771: UDP, length 120
23:20:28.009143 IP 192.168.43.124.8880 > 192.168.43.195.7771: UDP, length 120
23:20:28.059138 IP 192.168.43.124.8880 > 192.168.43.195.7771: UDP, length 120
23:20:28.109682 IP 192.168.43.124.8880 > 192.168.43.195.7771: UDP, length 120
23:20:28.159124 IP 192.168.43.124.8880 > 192.168.43.195.7771: UDP, length 120
23:20:28.209150 IP 192.168.43.124.8880 > 192.168.43.195.7771: UDP, length 120
23:20:28.259178 IP 192.168.43.124.8880 > 192.168.43.195.7771: UDP, length 120
23:20:28.309411 IP 192.168.43.124.8880 > 192.168.43.195.7771: UDP, length 120
23:20:28.359216 IP 192.168.43.124.8880 > 192.168.43.195.7771: UDP, length 120
23:20:28.409201 IP 192.168.43.124.8880 > 192.168.43.195.7771: UDP, length 120
23:20:28.459317 IP 192.168.43.124.8880 > 192.168.43.195.7771: UDP, length 120
23:20:28.509202 IP 192.168.43.124.8880 > 192.168.43.195.7771: UDP, length 120
23:20:28.559699 IP 192.168.43.124.8880 > 192.168.43.195.7771: UDP, length 120
23:20:28.609202 IP 192.168.43.124.8880 > 192.168.43.195.7771: UDP, length 120
23:20:28.659385 IP 192.168.43.124.8880 > 192.168.43.195.7771: UDP, length 120
23:20:28.709379 IP 192.168.43.124.8880 > 192.168.43.195.7771: UDP, length 120
23:20:28.759179 IP 192.168.43.124.8880 > 192.168.43.195.7771: UDP, length 120
23:20:28.809371 IP 192.168.43.124.8880 > 192.168.43.195.7771: UDP, length 120
23:20:28.859175 IP 192.168.43.124.8880 > 192.168.43.195.7771: UDP, length 120
23:20:28.909172 IP 192.168.43.124.8880 > 192.168.43.195.7771: UDP, length 120
23:20:28.960484 IP 192.168.43.124.8880 > 192.168.43.195.7771: UDP, length 120
23:20:29.009195 IP 192.168.43.124.8880 > 192.168.43.195.7771: UDP, length 120
23:20:29.059117 IP 192.168.43.124.8880 > 192.168.43.195.7771: UDP, length 120
23:20:29.109145 IP 192.168.43.124.8880 > 192.168.43.195.7771: UDP, length 120
23:20:29.159123 IP 192.168.43.124.8880 > 192.168.43.195.7771: UDP, length 120
23:20:29.209139 IP 192.168.43.124.8880 > 192.168.43.195.7771: UDP, length 120
23:20:29.259189 IP 192.168.43.124.8880 > 192.168.43.195.7771: UDP, length 120
23:20:29.309195 IP 192.168.43.124.8880 > 192.168.43.195.7771: UDP, length 120
23:20:29.359170 IP 192.168.43.124.8880 > 192.168.43.195.7771: UDP, length 120
23:20:29.409187 IP 192.168.43.124.8880 > 192.168.43.195.7771: UDP, length 120
23:20:29.459179 IP 192.168.43.124.8880 > 192.168.43.195.7771: UDP, length 120
23:20:29.509139 IP 192.168.43.124.8880 > 192.168.43.195.7771: UDP, length 120
23:20:29.559121 IP 192.168.43.124.8880 > 192.168.43.195.7771: UDP, length 120
23:20:29.609139 IP 192.168.43.124.8880 > 192.168.43.195.7771: UDP, length 120
23:20:29.659121 IP 192.168.43.124.8880 > 192.168.43.195.7771: UDP, length 120
23:20:29.709138 IP 192.168.43.124.8880 > 192.168.43.195.7771: UDP, length 120
23:20:29.759121 IP 192.168.43.124.8880 > 192.168.43.195.7771: UDP, length 120
23:20:29.809149 IP 192.168.43.124.8880 > 192.168.43.195.7771: UDP, length 120
23:20:29.859122 IP 192.168.43.124.8880 > 192.168.43.195.7771: UDP, length 120
23:20:29.909186 IP 192.168.43.124.8880 > 192.168.43.195.7771: UDP, length 120
23:20:29.959169 IP 192.168.43.124.8880 > 192.168.43.195.7771: UDP, length 120
23:20:30.009188 IP 192.168.43.124.8880 > 192.168.43.195.7771: UDP, length 120
23:20:30.059169 IP 192.168.43.124.8880 > 192.168.43.195.7771: UDP, length 120
23:20:30.109136 IP 192.168.43.124.8880 > 192.168.43.195.7771: UDP, length 120
23:20:30.159118 IP 192.168.43.124.8880 > 192.168.43.195.7771: UDP, length 120
23:20:30.209138 IP 192.168.43.124.8880 > 192.168.43.195.7771: UDP, length 120
23:20:30.259136 IP 192.168.43.124.8880 > 192.168.43.195.7771: UDP, length 120
23:20:30.309146 IP 192.168.43.124.8880 > 192.168.43.195.7771: UDP, length 120
23:20:30.359119 IP 192.168.43.124.8880 > 192.168.43.195.7771: UDP, length 120
23:20:30.409137 IP 192.168.43.124.8880 > 192.168.43.195.7771: UDP, length 120
23:20:30.459128 IP 192.168.43.124.8880 > 192.168.43.195.7771: UDP, length 120
23:20:30.509146 IP 192.168.43.124.8880 > 192.168.43.195.7771: UDP, length 120
23:20:30.559089 IP 192.168.43.124.8880 > 192.168.43.195.7771: UDP, length 120
23:20:30.609136 IP 192.168.43.124.8880 > 192.168.43.195.7771: UDP, length 120
23:20:30.659141 IP 192.168.43.124.8880 > 192.168.43.195.7771: UDP, length 120
23:20:30.709189 IP 192.168.43.124.8880 > 192.168.43.195.7771: UDP, length 120
23:20:30.759166 IP 192.168.43.124.8880 > 192.168.43.195.7771: UDP, length 120
23:20:30.809188 IP 192.168.43.124.8880 > 192.168.43.195.7771: UDP, length 120
23:20:30.859167 IP 192.168.43.124.8880 > 192.168.43.195.7771: UDP, length 120
23:20:30.909190 IP 192.168.43.124.8880 > 192.168.43.195.7771: UDP, length 120
23:20:30.959325 IP 192.168.43.124.8880 > 192.168.43.195.7771: UDP, length 120
23:20:31.009191 IP 192.168.43.124.8880 > 192.168.43.195.7771: UDP, length 120
23:20:31.059168 IP 192.168.43.124.8880 > 192.168.43.195.7771: UDP, length 120
23:20:31.109093 IP 192.168.43.124.8880 > 192.168.43.195.7771: UDP, length 120
23:20:31.159125 IP 192.168.43.124.8880 > 192.168.43.195.7771: UDP, length 120
23:20:31.209138 IP 192.168.43.124.8880 > 192.168.43.195.7771: UDP, length 120
23:20:31.259187 IP 192.168.43.124.8880 > 192.168.43.195.7771: UDP, length 120
23:20:31.309198 IP 192.168.43.124.8880 > 192.168.43.195.7771: UDP, length 120
23:20:31.359170 IP 192.168.43.124.8880 > 192.168.43.195.7771: UDP, length 120
23:20:31.409188 IP 192.168.43.124.8880 > 192.168.43.195.7771: UDP, length 120
23:20:31.459171 IP 192.168.43.124.8880 > 192.168.43.195.7771: UDP, length 120
23:20:31.509188 IP 192.168.43.124.8880 > 192.168.43.195.7771: UDP, length 120
23:20:31.559103 IP 192.168.43.124.8880 > 192.168.43.195.7771: UDP, length 120
23:20:31.609191 IP 192.168.43.124.8880 > 192.168.43.195.7771: UDP, length 120
23:20:31.659186 IP 192.168.43.124.8880 > 192.168.43.195.7771: UDP, length 120
23:20:31.709198 IP 192.168.43.124.8880 > 192.168.43.195.7771: UDP, length 120
23:20:31.759171 IP 192.168.43.124.8880 > 192.168.43.195.7771: UDP, length 120
23:20:31.809187 IP 192.168.43.124.8880 > 192.168.43.195.7771: UDP, length 120
23:20:31.859170 IP 192.168.43.124.8880 > 192.168.43.195.7771: UDP, length 120
23:20:31.909162 IP 192.168.43.124.8880 > 192.168.43.195.7771: UDP, length 120
23:20:31.959129 IP 192.168.43.124.8880 > 192.168.43.195.7771: UDP, length 120
23:20:32.009123 IP 192.168.43.124.8880 > 192.168.43.195.7771: UDP, length 120
23:20:32.059131 IP 192.168.43.124.8880 > 192.168.43.195.7771: UDP, length 120
23:20:32.109142 IP 192.168.43.124.8880 > 192.168.43.195.7771: UDP, length 120
23:20:32.159122 IP 192.168.43.124.8880 > 192.168.43.195.7771: UDP, length 120
23:20:32.209143 IP 192.168.43.124.8880 > 192.168.43.195.7771: UDP, length 120
23:20:32.259090 IP 192.168.43.124.8880 > 192.168.43.195.7771: UDP, length 120
23:20:32.309081 IP 192.168.43.124.8880 > 192.168.43.195.7771: UDP, length 120
23:20:32.359100 IP 192.168.43.124.8880 > 192.168.43.195.7771: UDP, length 120
23:20:32.409135 IP 192.168.43.124.8880 > 192.168.43.195.7771: UDP, length 120
23:20:32.459130 IP 192.168.43.124.8880 > 192.168.43.195.7771: UDP, length 120
23:20:32.509148 IP 192.168.43.124.8880 > 192.168.43.195.7771: UDP, length 120
23:20:32.559100 IP 192.168.43.124.8880 > 192.168.43.195.7771: UDP, length 120
23:20:32.609145 IP 192.168.43.124.8880 > 192.168.43.195.7771: UDP, length 120
23:20:32.659120 IP 192.168.43.124.8880 > 192.168.43.195.7771: UDP, length 120
23:20:32.709129 IP 192.168.43.124.8880 > 192.168.43.195.7771: UDP, length 120
23:20:32.759172 IP 192.168.43.124.8880 > 192.168.43.195.7771: UDP, length 120
23:20:32.809188 IP 192.168.43.124.8880 > 192.168.43.195.7771: UDP, length 120
23:20:32.859170 IP 192.168.43.124.8880 > 192.168.43.195.7771: UDP, length 120
23:20:32.909186 IP 192.168.43.124.8880 > 192.168.43.195.7771: UDP, length 120
23:20:32.959168 IP 192.168.43.124.8880 > 192.168.43.195.7771: UDP, length 120
23:20:33.009189 IP 192.168.43.124.8880 > 192.168.43.195.7771: UDP, length 120
23:20:33.059172 IP 192.168.43.124.8880 > 192.168.43.195.7771: UDP, length 120
23:20:33.109139 IP 192.168.43.124.8880 > 192.168.43.195.7771: UDP, length 120
23:20:33.159124 IP 192.168.43.124.8880 > 192.168.43.195.7771: UDP, length 120
23:20:33.209140 IP 192.168.43.124.8880 > 192.168.43.195.7771: UDP, length 120
23:20:33.259149 IP 192.168.43.124.8880 > 192.168.43.195.7771: UDP, length 120
23:20:33.309148 IP 192.168.43.124.8880 > 192.168.43.195.7771: UDP, length 120
23:20:33.359122 IP 192.168.43.124.8880 > 192.168.43.195.7771: UDP, length 120
23:20:33.409152 IP 192.168.43.124.8880 > 192.168.43.195.7771: UDP, length 120
23:20:33.459120 IP 192.168.43.124.8880 > 192.168.43.195.7771: UDP, length 120
23:20:33.509201 IP 192.168.43.124.8880 > 192.168.43.195.7771: UDP, length 120
23:20:33.559137 IP 192.168.43.124.8880 > 192.168.43.195.7771: UDP, length 120
23:20:33.609187 IP 192.168.43.124.8880 > 192.168.43.195.7771: UDP, length 120
23:20:33.659195 IP 192.168.43.124.8880 > 192.168.43.195.7771: UDP, length 120
23:20:33.709188 IP 192.168.43.124.8880 > 192.168.43.195.7771: UDP, length 120
23:20:33.759489 IP 192.168.43.124.8880 > 192.168.43.195.7771: UDP, length 120
23:20:33.809126 IP 192.168.43.124.8880 > 192.168.43.195.7771: UDP, length 120
23:20:33.859137 IP 192.168.43.124.8880 > 192.168.43.195.7771: UDP, length 120
23:20:33.909127 IP 192.168.43.124.8880 > 192.168.43.195.7771: UDP, length 120
23:20:33.959136 IP 192.168.43.124.8880 > 192.168.43.195.7771: UDP, length 120
23:20:34.009127 IP 192.168.43.124.8880 > 192.168.43.195.7771: UDP, length 120
23:20:34.059138 IP 192.168.43.124.8880 > 192.168.43.195.7771: UDP, length 120
23:20:34.109146 IP 192.168.43.124.8880 > 192.168.43.195.7771: UDP, length 120
23:20:34.159136 IP 192.168.43.124.8880 > 192.168.43.195.7771: UDP, length 120
23:20:34.209127 IP 192.168.43.124.8880 > 192.168.43.195.7771: UDP, length 120
23:20:34.259136 IP 192.168.43.124.8880 > 192.168.43.195.7771: UDP, length 120
23:20:34.309121 IP 192.168.43.124.8880 > 192.168.43.195.7771: UDP, length 120
23:20:34.359190 IP 192.168.43.124.8880 > 192.168.43.195.7771: UDP, length 120
23:20:34.409893 IP 192.168.43.124.8880 > 192.168.43.195.7771: UDP, length 120
23:20:34.459192 IP 192.168.43.124.8880 > 192.168.43.195.7771: UDP, length 120
23:20:34.509370 IP 192.168.43.124.8880 > 192.168.43.195.7771: UDP, length 120
23:20:34.559393 IP 192.168.43.124.8880 > 192.168.43.195.7771: UDP, length 120
23:20:34.609709 IP 192.168.43.124.8880 > 192.168.43.195.7771: UDP, length 120
23:20:34.659241 IP 192.168.43.124.8880 > 192.168.43.195.7771: UDP, length 120
23:20:34.709371 IP 192.168.43.124.8880 > 192.168.43.195.7771: UDP, length 120
23:20:34.759990 IP 192.168.43.124.8880 > 192.168.43.195.7771: UDP, length 120
23:20:34.809373 IP 192.168.43.124.8880 > 192.168.43.195.7771: UDP, length 120
23:20:34.859198 IP 192.168.43.124.8880 > 192.168.43.195.7771: UDP, length 120
23:20:34.909176 IP 192.168.43.124.8880 > 192.168.43.195.7771: UDP, length 120
23:20:34.959202 IP 192.168.43.124.8880 > 192.168.43.195.7771: UDP, length 120
23:20:35.009394 IP 192.168.43.124.8880 > 192.168.43.195.7771: UDP, length 120
23:20:35.059173 IP 192.168.43.124.8880 > 192.168.43.195.7771: UDP, length 120
23:20:35.109190 IP 192.168.43.124.8880 > 192.168.43.195.7771: UDP, length 120
23:20:35.159127 IP 192.168.43.124.8880 > 192.168.43.195.7771: UDP, length 120
23:20:35.209126 IP 192.168.43.124.8880 > 192.168.43.195.7771: UDP, length 120
23:20:35.259201 IP 192.168.43.124.8880 > 192.168.43.195.7771: UDP, length 120
23:20:35.309163 IP 192.168.43.124.8880 > 192.168.43.195.7771: UDP, length 120
23:20:35.359291 IP 192.168.43.124.8880 > 192.168.43.195.7771: UDP, length 120
23:20:35.409122 IP 192.168.43.124.8880 > 192.168.43.195.7771: UDP, length 120
23:20:35.459125 IP 192.168.43.124.8880 > 192.168.43.195.7771: UDP, length 120
23:20:35.509127 IP 192.168.43.124.8880 > 192.168.43.195.7771: UDP, length 120
23:20:35.559129 IP 192.168.43.124.8880 > 192.168.43.195.7771: UDP, length 120
23:20:35.609130 IP 192.168.43.124.8880 > 192.168.43.195.7771: UDP, length 120
23:20:35.659171 IP 192.168.43.124.8880 > 192.168.43.195.7771: UDP, length 120
23:20:35.710217 IP 192.168.43.124.8880 > 192.168.43.195.7771: UDP, length 120
23:20:35.759197 IP 192.168.43.124.8880 > 192.168.43.195.7771: UDP, length 120
23:20:35.809190 IP 192.168.43.124.8880 > 192.168.43.195.7771: UDP, length 120
23:20:35.859893 IP 192.168.43.124.8880 > 192.168.43.195.7771: UDP, length 120
23:20:35.909377 IP 192.168.43.124.8880 > 192.168.43.195.7771: UDP, length 120
23:20:35.959370 IP 192.168.43.124.8880 > 192.168.43.195.7771: UDP, length 120
23:20:36.009716 IP 192.168.43.124.8880 > 192.168.43.195.7771: UDP, length 120
23:20:36.059191 IP 192.168.43.124.8880 > 192.168.43.195.7771: UDP, length 120
23:20:36.109835 IP 192.168.43.124.8880 > 192.168.43.195.7771: UDP, length 120
23:20:36.159121 IP 192.168.43.124.8880 > 192.168.43.195.7771: UDP, length 120
23:20:36.209139 IP 192.168.43.124.8880 > 192.168.43.195.7771: UDP, length 120
23:20:36.259130 IP 192.168.43.124.8880 > 192.168.43.195.7771: UDP, length 120
23:20:36.309141 IP 192.168.43.124.8880 > 192.168.43.195.7771: UDP, length 120
23:20:36.359122 IP 192.168.43.124.8880 > 192.168.43.195.7771: UDP, length 120
23:20:36.409140 IP 192.168.43.124.8880 > 192.168.43.195.7771: UDP, length 120
23:20:36.459123 IP 192.168.43.124.8880 > 192.168.43.195.7771: UDP, length 120
