02:31:27.277954 IP 192.168.43.124.8880 > 192.168.43.146.7771: UDP, length 120
02:31:27.317575 IP 192.168.43.124.8880 > 192.168.43.146.7771: UDP, length 120
02:31:27.377446 IP 192.168.43.124.8880 > 192.168.43.146.7771: UDP, length 120
02:31:27.417538 IP 192.168.43.124.8880 > 192.168.43.146.7771: UDP, length 120
02:31:27.479847 IP 192.168.43.124.8880 > 192.168.43.146.7771: UDP, length 120
02:31:27.517539 IP 192.168.43.124.8880 > 192.168.43.146.7771: UDP, length 120
02:31:27.577600 IP 192.168.43.124.8880 > 192.168.43.146.7771: UDP, length 120
02:31:27.617671 IP 192.168.43.124.8880 > 192.168.43.146.7771: UDP, length 120
02:31:27.676237 IP 192.168.43.124.8880 > 192.168.43.146.7771: UDP, length 120
02:31:27.717753 IP 192.168.43.124.8880 > 192.168.43.146.7771: UDP, length 120
02:31:27.768007 IP 192.168.43.146.8880 > 192.168.43.147.7772: UDP, length 120
02:31:27.774283 IP 192.168.43.124.8880 > 192.168.43.146.7771: UDP, length 120
02:31:27.817154 IP 192.168.43.124.8880 > 192.168.43.146.7771: UDP, length 120
02:31:27.818052 IP 192.168.43.146.8880 > 192.168.43.147.7772: UDP, length 120
02:31:27.867752 IP 192.168.43.124.8880 > 192.168.43.146.7771: UDP, length 120
02:31:27.868027 IP 192.168.43.146.8880 > 192.168.43.147.7772: UDP, length 120
02:31:27.918097 IP 192.168.43.146.8880 > 192.168.43.147.7772: UDP, length 120
02:31:27.924679 IP 192.168.43.124.8880 > 192.168.43.146.7771: UDP, length 120
02:31:27.967709 IP 192.168.43.124.8880 > 192.168.43.146.7771: UDP, length 120
02:31:27.968042 IP 192.168.43.146.8880 > 192.168.43.147.7772: UDP, length 120
02:31:28.018030 IP 192.168.43.146.8880 > 192.168.43.147.7772: UDP, length 120
02:31:28.019270 IP 192.168.43.124.8880 > 192.168.43.146.7771: UDP, length 120
02:31:28.068074 IP 192.168.43.146.8880 > 192.168.43.147.7772: UDP, length 120
02:31:28.080888 IP 192.168.43.124.8880 > 192.168.43.146.7771: UDP, length 120
02:31:28.118039 IP 192.168.43.146.8880 > 192.168.43.147.7772: UDP, length 120
02:31:28.119566 IP 192.168.43.124.8880 > 192.168.43.146.7771: UDP, length 120
02:31:28.167755 IP 192.168.43.124.8880 > 192.168.43.146.7771: UDP, length 120
02:31:28.168031 IP 192.168.43.146.8880 > 192.168.43.147.7772: UDP, length 120
02:31:28.218025 IP 192.168.43.146.8880 > 192.168.43.147.7772: UDP, length 120
02:31:28.228745 IP 192.168.43.124.8880 > 192.168.43.146.7771: UDP, length 120
02:31:28.267639 IP 192.168.43.124.8880 > 192.168.43.146.7771: UDP, length 120
02:31:28.268026 IP 192.168.43.146.8880 > 192.168.43.147.7772: UDP, length 120
02:31:28.318025 IP 192.168.43.146.8880 > 192.168.43.147.7772: UDP, length 120
02:31:28.321436 IP 192.168.43.124.8880 > 192.168.43.146.7771: UDP, length 120
02:31:28.368027 IP 192.168.43.146.8880 > 192.168.43.147.7772: UDP, length 120
02:31:28.374904 IP 192.168.43.124.8880 > 192.168.43.146.7771: UDP, length 120
02:31:28.417685 IP 192.168.43.124.8880 > 192.168.43.146.7771: UDP, length 120
02:31:28.418029 IP 192.168.43.146.8880 > 192.168.43.147.7772: UDP, length 120
02:31:28.467624 IP 192.168.43.124.8880 > 192.168.43.146.7771: UDP, length 120
02:31:28.468025 IP 192.168.43.146.8880 > 192.168.43.147.7772: UDP, length 120
02:31:28.518024 IP 192.168.43.146.8880 > 192.168.43.147.7772: UDP, length 120
02:31:28.524627 IP 192.168.43.124.8880 > 192.168.43.146.7771: UDP, length 120
02:31:28.567685 IP 192.168.43.124.8880 > 192.168.43.146.7771: UDP, length 120
02:31:28.568027 IP 192.168.43.146.8880 > 192.168.43.147.7772: UDP, length 120
02:31:28.617721 IP 192.168.43.124.8880 > 192.168.43.146.7771: UDP, length 120
02:31:28.618029 IP 192.168.43.146.8880 > 192.168.43.147.7772: UDP, length 120
02:31:28.668024 IP 192.168.43.146.8880 > 192.168.43.147.7772: UDP, length 120
02:31:28.674664 IP 192.168.43.124.8880 > 192.168.43.146.7771: UDP, length 120
02:31:28.718025 IP 192.168.43.146.8880 > 192.168.43.147.7772: UDP, length 120
02:31:28.718165 IP 192.168.43.124.8880 > 192.168.43.146.7771: UDP, length 120
02:31:28.768031 IP 192.168.43.146.8880 > 192.168.43.147.7772: UDP, length 120
02:31:28.769303 IP 192.168.43.124.8880 > 192.168.43.146.7771: UDP, length 120
02:31:28.818026 IP 192.168.43.146.8880 > 192.168.43.147.7772: UDP, length 120
02:31:28.820463 IP 192.168.43.124.8880 > 192.168.43.146.7771: UDP, length 120
02:31:28.867725 IP 192.168.43.124.8880 > 192.168.43.146.7771: UDP, length 120
02:31:28.868026 IP 192.168.43.146.8880 > 192.168.43.147.7772: UDP, length 120
02:31:28.918498 IP 192.168.43.124.8880 > 192.168.43.146.7771: UDP, length 120
02:31:28.920388 IP 192.168.43.146.8880 > 192.168.43.147.7772: UDP, length 120
02:31:28.967738 IP 192.168.43.124.8880 > 192.168.43.146.7771: UDP, length 120
02:31:28.968082 IP 192.168.43.146.8880 > 192.168.43.147.7772: UDP, length 120
02:31:29.018034 IP 192.168.43.146.8880 > 192.168.43.147.7772: UDP, length 120
02:31:29.026909 IP 192.168.43.124.8880 > 192.168.43.146.7771: UDP, length 120
02:31:29.068029 IP 192.168.43.146.8880 > 192.168.43.147.7772: UDP, length 120
02:31:29.118027 IP 192.168.43.146.8880 > 192.168.43.147.7772: UDP, length 120
02:31:29.168023 IP 192.168.43.146.8880 > 192.168.43.147.7772: UDP, length 120
02:31:29.218027 IP 192.168.43.146.8880 > 192.168.43.147.7772: UDP, length 120
02:31:29.221430 IP 192.168.43.124.8880 > 192.168.43.146.7771: UDP, length 120
02:31:29.221800 IP 192.168.43.124.8880 > 192.168.43.146.7771: UDP, length 120
02:31:29.222025 IP 192.168.43.124.8880 > 192.168.43.146.7771: UDP, length 120
02:31:29.268026 IP 192.168.43.146.8880 > 192.168.43.147.7772: UDP, length 120
02:31:29.318022 IP 192.168.43.146.8880 > 192.168.43.147.7772: UDP, length 120
02:31:29.368020 IP 192.168.43.146.8880 > 192.168.43.147.7772: UDP, length 120
02:31:29.371450 IP 192.168.43.124.8880 > 192.168.43.146.7771: UDP, length 120
02:31:29.371727 IP 192.168.43.124.8880 > 192.168.43.146.7771: UDP, length 120
02:31:29.371939 IP 192.168.43.124.8880 > 192.168.43.146.7771: UDP, length 120
02:31:29.418022 IP 192.168.43.146.8880 > 192.168.43.147.7772: UDP, length 120
02:31:29.468027 IP 192.168.43.146.8880 > 192.168.43.147.7772: UDP, length 120
02:31:29.518025 IP 192.168.43.146.8880 > 192.168.43.147.7772: UDP, length 120
02:31:29.527730 IP 192.168.43.124.8880 > 192.168.43.146.7771: UDP, length 120
02:31:29.527995 IP 192.168.43.124.8880 > 192.168.43.146.7771: UDP, length 120
02:31:29.528107 IP 192.168.43.124.8880 > 192.168.43.146.7771: UDP, length 120
02:31:29.568084 IP 192.168.43.146.8880 > 192.168.43.147.7772: UDP, length 120
02:31:29.618039 IP 192.168.43.146.8880 > 192.168.43.147.7772: UDP, length 120
02:31:29.668023 IP 192.168.43.146.8880 > 192.168.43.147.7772: UDP, length 120
02:31:29.671426 IP 192.168.43.124.8880 > 192.168.43.146.7771: UDP, length 120
02:31:29.671574 IP 192.168.43.124.8880 > 192.168.43.146.7771: UDP, length 120
02:31:29.671734 IP 192.168.43.124.8880 > 192.168.43.146.7771: UDP, length 120
02:31:29.718025 IP 192.168.43.146.8880 > 192.168.43.147.7772: UDP, length 120
02:31:29.768035 IP 192.168.43.146.8880 > 192.168.43.147.7772: UDP, length 120
02:31:29.818024 IP 192.168.43.146.8880 > 192.168.43.147.7772: UDP, length 120
02:31:29.821180 IP 192.168.43.124.8880 > 192.168.43.146.7771: UDP, length 120
02:31:29.821436 IP 192.168.43.124.8880 > 192.168.43.146.7771: UDP, length 120
02:31:29.821647 IP 192.168.43.124.8880 > 192.168.43.146.7771: UDP, length 120
02:31:29.868024 IP 192.168.43.146.8880 > 192.168.43.147.7772: UDP, length 120
02:31:29.918022 IP 192.168.43.146.8880 > 192.168.43.147.7772: UDP, length 120
02:31:29.968088 IP 192.168.43.146.8880 > 192.168.43.147.7772: UDP, length 120
02:31:29.971095 IP 192.168.43.124.8880 > 192.168.43.146.7771: UDP, length 120
02:31:29.971272 IP 192.168.43.124.8880 > 192.168.43.146.7771: UDP, length 120
02:31:29.971386 IP 192.168.43.124.8880 > 192.168.43.146.7771: UDP, length 120
02:31:30.018045 IP 192.168.43.146.8880 > 192.168.43.147.7772: UDP, length 120
02:31:30.068028 IP 192.168.43.146.8880 > 192.168.43.147.7772: UDP, length 120
02:31:30.118024 IP 192.168.43.146.8880 > 192.168.43.147.7772: UDP, length 120
02:31:30.120145 IP 192.168.43.124.8880 > 192.168.43.146.7771: UDP, length 120
02:31:30.120391 IP 192.168.43.124.8880 > 192.168.43.146.7771: UDP, length 120
02:31:30.120539 IP 192.168.43.124.8880 > 192.168.43.146.7771: UDP, length 120
02:31:30.168023 IP 192.168.43.146.8880 > 192.168.43.147.7772: UDP, length 120
02:31:30.218028 IP 192.168.43.146.8880 > 192.168.43.147.7772: UDP, length 120
02:31:30.268029 IP 192.168.43.146.8880 > 192.168.43.147.7772: UDP, length 120
02:31:30.268389 IP 192.168.43.124.8880 > 192.168.43.146.7771: UDP, length 120
02:31:30.268646 IP 192.168.43.124.8880 > 192.168.43.146.7771: UDP, length 120
02:31:30.268768 IP 192.168.43.124.8880 > 192.168.43.146.7771: UDP, length 120
02:31:30.318026 IP 192.168.43.146.8880 > 192.168.43.147.7772: UDP, length 120
02:31:30.368021 IP 192.168.43.146.8880 > 192.168.43.147.7772: UDP, length 120
02:31:30.418021 IP 192.168.43.146.8880 > 192.168.43.147.7772: UDP, length 120
02:31:30.421418 IP 192.168.43.124.8880 > 192.168.43.146.7771: UDP, length 120
02:31:30.421556 IP 192.168.43.124.8880 > 192.168.43.146.7771: UDP, length 120
02:31:30.421771 IP 192.168.43.124.8880 > 192.168.43.146.7771: UDP, length 120
02:31:30.468022 IP 192.168.43.146.8880 > 192.168.43.147.7772: UDP, length 120
02:31:30.518020 IP 192.168.43.146.8880 > 192.168.43.147.7772: UDP, length 120
02:31:30.565368 IP 192.168.43.124.8880 > 192.168.43.146.7771: UDP, length 120
02:31:30.565627 IP 192.168.43.124.8880 > 192.168.43.146.7771: UDP, length 120
02:31:30.568024 IP 192.168.43.146.8880 > 192.168.43.147.7772: UDP, length 120
02:31:30.618023 IP 192.168.43.146.8880 > 192.168.43.147.7772: UDP, length 120
02:31:30.668022 IP 192.168.43.146.8880 > 192.168.43.147.7772: UDP, length 120
02:31:30.681409 IP 192.168.43.124.8880 > 192.168.43.146.7771: UDP, length 120
02:31:30.681711 IP 192.168.43.124.8880 > 192.168.43.146.7771: UDP, length 120
02:31:30.681826 IP 192.168.43.124.8880 > 192.168.43.146.7771: UDP, length 120
02:31:30.718023 IP 192.168.43.146.8880 > 192.168.43.147.7772: UDP, length 120
02:31:30.768035 IP 192.168.43.146.8880 > 192.168.43.147.7772: UDP, length 120
02:31:30.818079 IP 192.168.43.146.8880 > 192.168.43.147.7772: UDP, length 120
02:31:30.828531 IP 192.168.43.124.8880 > 192.168.43.146.7771: UDP, length 120
02:31:30.828940 IP 192.168.43.124.8880 > 192.168.43.146.7771: UDP, length 120
02:31:30.829082 IP 192.168.43.124.8880 > 192.168.43.146.7771: UDP, length 120
02:31:30.868027 IP 192.168.43.146.8880 > 192.168.43.147.7772: UDP, length 120
02:31:30.918026 IP 192.168.43.146.8880 > 192.168.43.147.7772: UDP, length 120
02:31:30.968021 IP 192.168.43.146.8880 > 192.168.43.147.7772: UDP, length 120
02:31:30.977711 IP 192.168.43.124.8880 > 192.168.43.146.7771: UDP, length 120
02:31:30.977980 IP 192.168.43.124.8880 > 192.168.43.146.7771: UDP, length 120
02:31:30.978098 IP 192.168.43.124.8880 > 192.168.43.146.7771: UDP, length 120
02:31:31.018027 IP 192.168.43.146.8880 > 192.168.43.147.7772: UDP, length 120
02:31:31.068082 IP 192.168.43.146.8880 > 192.168.43.147.7772: UDP, length 120
02:31:31.118040 IP 192.168.43.146.8880 > 192.168.43.147.7772: UDP, length 120
02:31:31.125284 IP 192.168.43.124.8880 > 192.168.43.146.7771: UDP, length 120
02:31:31.125576 IP 192.168.43.124.8880 > 192.168.43.146.7771: UDP, length 120
02:31:31.125690 IP 192.168.43.124.8880 > 192.168.43.146.7771: UDP, length 120
02:31:31.168025 IP 192.168.43.146.8880 > 192.168.43.147.7772: UDP, length 120
02:31:31.218021 IP 192.168.43.146.8880 > 192.168.43.147.7772: UDP, length 120
02:31:31.268025 IP 192.168.43.146.8880 > 192.168.43.147.7772: UDP, length 120
02:31:31.286646 IP 192.168.43.124.8880 > 192.168.43.146.7771: UDP, length 120
02:31:31.287579 IP 192.168.43.124.8880 > 192.168.43.146.7771: UDP, length 120
02:31:31.287693 IP 192.168.43.124.8880 > 192.168.43.146.7771: UDP, length 120
02:31:31.318025 IP 192.168.43.146.8880 > 192.168.43.147.7772: UDP, length 120
02:31:31.368023 IP 192.168.43.146.8880 > 192.168.43.147.7772: UDP, length 120
02:31:31.418022 IP 192.168.43.146.8880 > 192.168.43.147.7772: UDP, length 120
02:31:31.421471 IP 192.168.43.124.8880 > 192.168.43.146.7771: UDP, length 120
02:31:31.421616 IP 192.168.43.124.8880 > 192.168.43.146.7771: UDP, length 120
02:31:31.421890 IP 192.168.43.124.8880 > 192.168.43.146.7771: UDP, length 120
02:31:31.468023 IP 192.168.43.146.8880 > 192.168.43.147.7772: UDP, length 120
02:31:31.518022 IP 192.168.43.146.8880 > 192.168.43.147.7772: UDP, length 120
02:31:31.568034 IP 192.168.43.146.8880 > 192.168.43.147.7772: UDP, length 120
02:31:31.578961 IP 192.168.43.124.8880 > 192.168.43.146.7771: UDP, length 120
02:31:31.579241 IP 192.168.43.124.8880 > 192.168.43.146.7771: UDP, length 120
02:31:31.579379 IP 192.168.43.124.8880 > 192.168.43.146.7771: UDP, length 120
02:31:31.618032 IP 192.168.43.146.8880 > 192.168.43.147.7772: UDP, length 120
02:31:31.668081 IP 192.168.43.146.8880 > 192.168.43.147.7772: UDP, length 120
02:31:31.718101 IP 192.168.43.146.8880 > 192.168.43.147.7772: UDP, length 120
02:31:31.737785 IP 192.168.43.124.8880 > 192.168.43.146.7771: UDP, length 120
02:31:31.738033 IP 192.168.43.124.8880 > 192.168.43.146.7771: UDP, length 120
02:31:31.738187 IP 192.168.43.124.8880 > 192.168.43.146.7771: UDP, length 120
02:31:31.768123 IP 192.168.43.146.8880 > 192.168.43.147.7772: UDP, length 120
02:31:31.818061 IP 192.168.43.146.8880 > 192.168.43.147.7772: UDP, length 120
02:31:31.868067 IP 192.168.43.146.8880 > 192.168.43.147.7772: UDP, length 120
02:31:31.876487 IP 192.168.43.124.8880 > 192.168.43.146.7771: UDP, length 120
02:31:31.876729 IP 192.168.43.124.8880 > 192.168.43.146.7771: UDP, length 120
02:31:31.876840 IP 192.168.43.124.8880 > 192.168.43.146.7771: UDP, length 120
02:31:31.918124 IP 192.168.43.146.8880 > 192.168.43.147.7772: UDP, length 120
02:31:31.968078 IP 192.168.43.146.8880 > 192.168.43.147.7772: UDP, length 120
02:31:32.018103 IP 192.168.43.146.8880 > 192.168.43.147.7772: UDP, length 120
02:31:32.025941 IP 192.168.43.124.8880 > 192.168.43.146.7771: UDP, length 120
02:31:32.026300 IP 192.168.43.124.8880 > 192.168.43.146.7771: UDP, length 120
02:31:32.026442 IP 192.168.43.124.8880 > 192.168.43.146.7771: UDP, length 120
02:31:32.068073 IP 192.168.43.146.8880 > 192.168.43.147.7772: UDP, length 120
02:31:32.118087 IP 192.168.43.146.8880 > 192.168.43.147.7772: UDP, length 120
02:31:32.166802 IP 192.168.43.124.8880 > 192.168.43.146.7771: UDP, length 120
02:31:32.166949 IP 192.168.43.124.8880 > 192.168.43.146.7771: UDP, length 120
02:31:32.168044 IP 192.168.43.146.8880 > 192.168.43.147.7772: UDP, length 120
02:31:32.218008 IP 192.168.43.146.8880 > 192.168.43.147.7772: UDP, length 120
02:31:32.267580 IP 192.168.43.124.8880 > 192.168.43.146.7771: UDP, length 120
02:31:32.267727 IP 192.168.43.124.8880 > 192.168.43.146.7771: UDP, length 120
02:31:32.267801 IP 192.168.43.124.8880 > 192.168.43.146.7771: UDP, length 120
02:31:32.268002 IP 192.168.43.146.8880 > 192.168.43.147.7772: UDP, length 120
02:31:32.318005 IP 192.168.43.146.8880 > 192.168.43.147.7772: UDP, length 120
02:31:32.338753 IP 192.168.43.124.8880 > 192.168.43.146.7771: UDP, length 120
02:31:32.367745 IP 192.168.43.124.8880 > 192.168.43.146.7771: UDP, length 120
02:31:32.368009 IP 192.168.43.146.8880 > 192.168.43.147.7772: UDP, length 120
02:31:32.418005 IP 192.168.43.146.8880 > 192.168.43.147.7772: UDP, length 120
02:31:32.421264 IP 192.168.43.124.8880 > 192.168.43.146.7771: UDP, length 120
02:31:32.468003 IP 192.168.43.146.8880 > 192.168.43.147.7772: UDP, length 120
02:31:32.476545 IP 192.168.43.124.8880 > 192.168.43.146.7771: UDP, length 120
02:31:32.517999 IP 192.168.43.146.8880 > 192.168.43.147.7772: UDP, length 120
02:31:32.519208 IP 192.168.43.124.8880 > 192.168.43.146.7771: UDP, length 120
02:31:32.568042 IP 192.168.43.146.8880 > 192.168.43.147.7772: UDP, length 120
02:31:32.569408 IP 192.168.43.124.8880 > 192.168.43.146.7771: UDP, length 120
02:31:32.618043 IP 192.168.43.146.8880 > 192.168.43.147.7772: UDP, length 120
02:31:32.621486 IP 192.168.43.124.8880 > 192.168.43.146.7771: UDP, length 120
02:31:32.667845 IP 192.168.43.124.8880 > 192.168.43.146.7771: UDP, length 120
02:31:32.668032 IP 192.168.43.146.8880 > 192.168.43.147.7772: UDP, length 120
02:31:32.717743 IP 192.168.43.124.8880 > 192.168.43.146.7771: UDP, length 120
02:31:32.718024 IP 192.168.43.146.8880 > 192.168.43.147.7772: UDP, length 120
02:31:32.767618 IP 192.168.43.124.8880 > 192.168.43.146.7771: UDP, length 120
02:31:32.768033 IP 192.168.43.146.8880 > 192.168.43.147.7772: UDP, length 120
02:31:32.818033 IP 192.168.43.146.8880 > 192.168.43.147.7772: UDP, length 120
02:31:32.819638 IP 192.168.43.124.8880 > 192.168.43.146.7771: UDP, length 120
02:31:32.867669 IP 192.168.43.124.8880 > 192.168.43.146.7771: UDP, length 120
02:31:32.868029 IP 192.168.43.146.8880 > 192.168.43.147.7772: UDP, length 120
02:31:32.918028 IP 192.168.43.146.8880 > 192.168.43.147.7772: UDP, length 120
02:31:32.918982 IP 192.168.43.124.8880 > 192.168.43.146.7771: UDP, length 120
02:31:32.968025 IP 192.168.43.146.8880 > 192.168.43.147.7772: UDP, length 120
02:31:32.969609 IP 192.168.43.124.8880 > 192.168.43.146.7771: UDP, length 120
02:31:33.018026 IP 192.168.43.146.8880 > 192.168.43.147.7772: UDP, length 120
02:31:33.039459 IP 192.168.43.124.8880 > 192.168.43.146.7771: UDP, length 120
02:31:33.068141 IP 192.168.43.146.8880 > 192.168.43.147.7772: UDP, length 120
02:31:33.070337 IP 192.168.43.124.8880 > 192.168.43.146.7771: UDP, length 120
02:31:33.118095 IP 192.168.43.146.8880 > 192.168.43.147.7772: UDP, length 120
02:31:33.118411 IP 192.168.43.124.8880 > 192.168.43.146.7771: UDP, length 120
02:31:33.168046 IP 192.168.43.146.8880 > 192.168.43.147.7772: UDP, length 120
02:31:33.176226 IP 192.168.43.124.8880 > 192.168.43.146.7771: UDP, length 120
02:31:33.216839 IP 192.168.43.124.8880 > 192.168.43.146.7771: UDP, length 120
02:31:33.218030 IP 192.168.43.146.8880 > 192.168.43.147.7772: UDP, length 120
02:31:33.267214 IP 192.168.43.124.8880 > 192.168.43.146.7771: UDP, length 120
02:31:33.268027 IP 192.168.43.146.8880 > 192.168.43.147.7772: UDP, length 120
02:31:33.318026 IP 192.168.43.146.8880 > 192.168.43.147.7772: UDP, length 120
02:31:33.326502 IP 192.168.43.124.8880 > 192.168.43.146.7771: UDP, length 120
02:31:33.368026 IP 192.168.43.146.8880 > 192.168.43.147.7772: UDP, length 120
02:31:33.369368 IP 192.168.43.124.8880 > 192.168.43.146.7771: UDP, length 120
02:31:33.417848 IP 192.168.43.124.8880 > 192.168.43.146.7771: UDP, length 120
02:31:33.418034 IP 192.168.43.146.8880 > 192.168.43.147.7772: UDP, length 120
02:31:33.468027 IP 192.168.43.146.8880 > 192.168.43.147.7772: UDP, length 120
02:31:33.476668 IP 192.168.43.124.8880 > 192.168.43.146.7771: UDP, length 120
02:31:33.517181 IP 192.168.43.124.8880 > 192.168.43.146.7771: UDP, length 120
02:31:33.518026 IP 192.168.43.146.8880 > 192.168.43.147.7772: UDP, length 120
02:31:33.568026 IP 192.168.43.146.8880 > 192.168.43.147.7772: UDP, length 120
02:31:33.569601 IP 192.168.43.124.8880 > 192.168.43.146.7771: UDP, length 120
02:31:33.618024 IP 192.168.43.146.8880 > 192.168.43.147.7772: UDP, length 120
02:31:33.625651 IP 192.168.43.124.8880 > 192.168.43.146.7771: UDP, length 120
02:31:33.667647 IP 192.168.43.124.8880 > 192.168.43.146.7771: UDP, length 120
02:31:33.668024 IP 192.168.43.146.8880 > 192.168.43.147.7772: UDP, length 120
02:31:33.717703 IP 192.168.43.124.8880 > 192.168.43.146.7771: UDP, length 120
02:31:33.718023 IP 192.168.43.146.8880 > 192.168.43.147.7772: UDP, length 120
02:31:33.768035 IP 192.168.43.146.8880 > 192.168.43.147.7772: UDP, length 120
02:31:33.775765 IP 192.168.43.124.8880 > 192.168.43.146.7771: UDP, length 120
02:31:33.818028 IP 192.168.43.146.8880 > 192.168.43.147.7772: UDP, length 120
02:31:33.818800 IP 192.168.43.124.8880 > 192.168.43.146.7771: UDP, length 120
02:31:33.867706 IP 192.168.43.124.8880 > 192.168.43.146.7771: UDP, length 120
02:31:33.868026 IP 192.168.43.146.8880 > 192.168.43.147.7772: UDP, length 120
02:31:33.918022 IP 192.168.43.146.8880 > 192.168.43.147.7772: UDP, length 120
02:31:33.924475 IP 192.168.43.124.8880 > 192.168.43.146.7771: UDP, length 120
02:31:33.968023 IP 192.168.43.146.8880 > 192.168.43.147.7772: UDP, length 120
02:31:33.969689 IP 192.168.43.124.8880 > 192.168.43.146.7771: UDP, length 120
02:31:34.018022 IP 192.168.43.146.8880 > 192.168.43.147.7772: UDP, length 120
02:31:34.019852 IP 192.168.43.124.8880 > 192.168.43.146.7771: UDP, length 120
02:31:34.068080 IP 192.168.43.146.8880 > 192.168.43.147.7772: UDP, length 120
02:31:34.074667 IP 192.168.43.124.8880 > 192.168.43.146.7771: UDP, length 120
02:31:34.118137 IP 192.168.43.146.8880 > 192.168.43.147.7772: UDP, length 120
02:31:34.118213 IP 192.168.43.124.8880 > 192.168.43.146.7771: UDP, length 120
02:31:34.167718 IP 192.168.43.124.8880 > 192.168.43.146.7771: UDP, length 120
02:31:34.168070 IP 192.168.43.146.8880 > 192.168.43.147.7772: UDP, length 120
02:31:34.217571 IP 192.168.43.124.8880 > 192.168.43.146.7771: UDP, length 120
02:31:34.218026 IP 192.168.43.146.8880 > 192.168.43.147.7772: UDP, length 120
02:31:34.268024 IP 192.168.43.146.8880 > 192.168.43.147.7772: UDP, length 120
02:31:34.286946 IP 192.168.43.124.8880 > 192.168.43.146.7771: UDP, length 120
02:31:34.317721 IP 192.168.43.124.8880 > 192.168.43.146.7771: UDP, length 120
02:31:34.318024 IP 192.168.43.146.8880 > 192.168.43.147.7772: UDP, length 120
02:31:34.368024 IP 192.168.43.146.8880 > 192.168.43.147.7772: UDP, length 120
02:31:34.368079 IP 192.168.43.124.8880 > 192.168.43.146.7771: UDP, length 120
02:31:34.418023 IP 192.168.43.146.8880 > 192.168.43.147.7772: UDP, length 120
02:31:34.424681 IP 192.168.43.124.8880 > 192.168.43.146.7771: UDP, length 120
02:31:34.467908 IP 192.168.43.124.8880 > 192.168.43.146.7771: UDP, length 120
02:31:34.468030 IP 192.168.43.146.8880 > 192.168.43.147.7772: UDP, length 120
02:31:34.518025 IP 192.168.43.146.8880 > 192.168.43.147.7772: UDP, length 120
02:31:34.519524 IP 192.168.43.124.8880 > 192.168.43.146.7771: UDP, length 120
02:31:34.568030 IP 192.168.43.146.8880 > 192.168.43.147.7772: UDP, length 120
02:31:34.581580 IP 192.168.43.124.8880 > 192.168.43.146.7771: UDP, length 120
02:31:34.617759 IP 192.168.43.124.8880 > 192.168.43.146.7771: UDP, length 120
02:31:34.618027 IP 192.168.43.146.8880 > 192.168.43.147.7772: UDP, length 120
02:31:34.668024 IP 192.168.43.146.8880 > 192.168.43.147.7772: UDP, length 120
02:31:34.673184 IP 192.168.43.124.8880 > 192.168.43.146.7771: UDP, length 120
02:31:34.718023 IP 192.168.43.146.8880 > 192.168.43.147.7772: UDP, length 120
02:31:34.724828 IP 192.168.43.124.8880 > 192.168.43.146.7771: UDP, length 120
02:31:34.767774 IP 192.168.43.124.8880 > 192.168.43.146.7771: UDP, length 120
02:31:34.768040 IP 192.168.43.146.8880 > 192.168.43.147.7772: UDP, length 120
02:31:34.817731 IP 192.168.43.124.8880 > 192.168.43.146.7771: UDP, length 120
02:31:34.818030 IP 192.168.43.146.8880 > 192.168.43.147.7772: UDP, length 120
02:31:34.868023 IP 192.168.43.146.8880 > 192.168.43.147.7772: UDP, length 120
02:31:34.876717 IP 192.168.43.124.8880 > 192.168.43.146.7771: UDP, length 120
02:31:34.917633 IP 192.168.43.124.8880 > 192.168.43.146.7771: UDP, length 120
02:31:34.918029 IP 192.168.43.146.8880 > 192.168.43.147.7772: UDP, length 120
02:31:34.967999 IP 192.168.43.124.8880 > 192.168.43.146.7771: UDP, length 120
02:31:34.968024 IP 192.168.43.146.8880 > 192.168.43.147.7772: UDP, length 120
02:31:35.018025 IP 192.168.43.146.8880 > 192.168.43.147.7772: UDP, length 120
02:31:35.024646 IP 192.168.43.124.8880 > 192.168.43.146.7771: UDP, length 120
02:31:35.067705 IP 192.168.43.124.8880 > 192.168.43.146.7771: UDP, length 120
02:31:35.068032 IP 192.168.43.146.8880 > 192.168.43.147.7772: UDP, length 120
02:31:35.118024 IP 192.168.43.146.8880 > 192.168.43.147.7772: UDP, length 120
02:31:35.119272 IP 192.168.43.124.8880 > 192.168.43.146.7771: UDP, length 120
02:31:35.167732 IP 192.168.43.124.8880 > 192.168.43.146.7771: UDP, length 120
02:31:35.168081 IP 192.168.43.146.8880 > 192.168.43.147.7772: UDP, length 120
02:31:35.218034 IP 192.168.43.146.8880 > 192.168.43.147.7772: UDP, length 120
02:31:35.221101 IP 192.168.43.124.8880 > 192.168.43.146.7771: UDP, length 120
02:31:35.268027 IP 192.168.43.146.8880 > 192.168.43.147.7772: UDP, length 120
02:31:35.270121 IP 192.168.43.124.8880 > 192.168.43.146.7771: UDP, length 120
02:31:35.318025 IP 192.168.43.146.8880 > 192.168.43.147.7772: UDP, length 120
02:31:35.327904 IP 192.168.43.124.8880 > 192.168.43.146.7771: UDP, length 120
02:31:35.368023 IP 192.168.43.146.8880 > 192.168.43.147.7772: UDP, length 120
02:31:35.368548 IP 192.168.43.124.8880 > 192.168.43.146.7771: UDP, length 120
02:31:35.417678 IP 192.168.43.124.8880 > 192.168.43.146.7771: UDP, length 120
02:31:35.418023 IP 192.168.43.146.8880 > 192.168.43.147.7772: UDP, length 120
02:31:35.468023 IP 192.168.43.146.8880 > 192.168.43.147.7772: UDP, length 120
02:31:35.476628 IP 192.168.43.124.8880 > 192.168.43.146.7771: UDP, length 120
02:31:35.518025 IP 192.168.43.146.8880 > 192.168.43.147.7772: UDP, length 120
02:31:35.520127 IP 192.168.43.124.8880 > 192.168.43.146.7771: UDP, length 120
02:31:35.567886 IP 192.168.43.124.8880 > 192.168.43.146.7771: UDP, length 120
02:31:35.568081 IP 192.168.43.146.8880 > 192.168.43.147.7772: UDP, length 120
02:31:35.618038 IP 192.168.43.146.8880 > 192.168.43.147.7772: UDP, length 120
02:31:35.627096 IP 192.168.43.124.8880 > 192.168.43.146.7771: UDP, length 120
02:31:35.667541 IP 192.168.43.124.8880 > 192.168.43.146.7771: UDP, length 120
02:31:35.668027 IP 192.168.43.146.8880 > 192.168.43.147.7772: UDP, length 120
02:31:35.717627 IP 192.168.43.124.8880 > 192.168.43.146.7771: UDP, length 120
02:31:35.718025 IP 192.168.43.146.8880 > 192.168.43.147.7772: UDP, length 120
02:31:35.768033 IP 192.168.43.146.8880 > 192.168.43.147.7772: UDP, length 120
02:31:35.774230 IP 192.168.43.124.8880 > 192.168.43.146.7771: UDP, length 120
02:31:35.817669 IP 192.168.43.124.8880 > 192.168.43.146.7771: UDP, length 120
02:31:35.818031 IP 192.168.43.146.8880 > 192.168.43.147.7772: UDP, length 120
02:31:35.867645 IP 192.168.43.124.8880 > 192.168.43.146.7771: UDP, length 120
02:31:35.868029 IP 192.168.43.146.8880 > 192.168.43.147.7772: UDP, length 120
02:31:35.918022 IP 192.168.43.146.8880 > 192.168.43.147.7772: UDP, length 120
02:31:35.925981 IP 192.168.43.124.8880 > 192.168.43.146.7771: UDP, length 120
02:31:35.968024 IP 192.168.43.146.8880 > 192.168.43.147.7772: UDP, length 120
02:31:35.969218 IP 192.168.43.124.8880 > 192.168.43.146.7771: UDP, length 120
02:31:36.018052 IP 192.168.43.146.8880 > 192.168.43.147.7772: UDP, length 120
02:31:36.018202 IP 192.168.43.124.8880 > 192.168.43.146.7771: UDP, length 120
02:31:36.068035 IP 192.168.43.146.8880 > 192.168.43.147.7772: UDP, length 120
02:31:36.074730 IP 192.168.43.124.8880 > 192.168.43.146.7771: UDP, length 120
02:31:36.117710 IP 192.168.43.124.8880 > 192.168.43.146.7771: UDP, length 120
02:31:36.118029 IP 192.168.43.146.8880 > 192.168.43.147.7772: UDP, length 120
02:31:36.168088 IP 192.168.43.146.8880 > 192.168.43.147.7772: UDP, length 120
02:31:36.168436 IP 192.168.43.124.8880 > 192.168.43.146.7771: UDP, length 120
02:31:36.218041 IP 192.168.43.146.8880 > 192.168.43.147.7772: UDP, length 120
02:31:36.224336 IP 192.168.43.124.8880 > 192.168.43.146.7771: UDP, length 120
02:31:36.267961 IP 192.168.43.124.8880 > 192.168.43.146.7771: UDP, length 120
02:31:36.268030 IP 192.168.43.146.8880 > 192.168.43.147.7772: UDP, length 120
02:31:36.318024 IP 192.168.43.146.8880 > 192.168.43.147.7772: UDP, length 120
02:31:36.319475 IP 192.168.43.124.8880 > 192.168.43.146.7771: UDP, length 120
02:31:36.368022 IP 192.168.43.146.8880 > 192.168.43.147.7772: UDP, length 120
02:31:36.375342 IP 192.168.43.124.8880 > 192.168.43.146.7771: UDP, length 120
02:31:36.417753 IP 192.168.43.124.8880 > 192.168.43.146.7771: UDP, length 120
02:31:36.418027 IP 192.168.43.146.8880 > 192.168.43.147.7772: UDP, length 120
02:31:36.467620 IP 192.168.43.124.8880 > 192.168.43.146.7771: UDP, length 120
02:31:36.468026 IP 192.168.43.146.8880 > 192.168.43.147.7772: UDP, length 120
02:31:36.518026 IP 192.168.43.146.8880 > 192.168.43.147.7772: UDP, length 120
02:31:36.527715 IP 192.168.43.124.8880 > 192.168.43.146.7771: UDP, length 120
02:31:36.567835 IP 192.168.43.124.8880 > 192.168.43.146.7771: UDP, length 120
02:31:36.568033 IP 192.168.43.146.8880 > 192.168.43.147.7772: UDP, length 120
02:31:36.618037 IP 192.168.43.146.8880 > 192.168.43.147.7772: UDP, length 120
02:31:36.618517 IP 192.168.43.124.8880 > 192.168.43.146.7771: UDP, length 120
02:31:36.668028 IP 192.168.43.146.8880 > 192.168.43.147.7772: UDP, length 120
02:31:36.675696 IP 192.168.43.124.8880 > 192.168.43.146.7771: UDP, length 120
02:31:36.718023 IP 192.168.43.146.8880 > 192.168.43.147.7772: UDP, length 120
02:31:36.720290 IP 192.168.43.124.8880 > 192.168.43.146.7771: UDP, length 120
02:31:36.768060 IP 192.168.43.146.8880 > 192.168.43.147.7772: UDP, length 120
02:31:36.771486 IP 192.168.43.124.8880 > 192.168.43.146.7771: UDP, length 120
02:31:36.818039 IP 192.168.43.146.8880 > 192.168.43.147.7772: UDP, length 120
02:31:36.823177 IP 192.168.43.124.8880 > 192.168.43.146.7771: UDP, length 120
02:31:36.867637 IP 192.168.43.124.8880 > 192.168.43.146.7771: UDP, length 120
02:31:36.868027 IP 192.168.43.146.8880 > 192.168.43.147.7772: UDP, length 120
02:31:36.917867 IP 192.168.43.124.8880 > 192.168.43.146.7771: UDP, length 120
02:31:36.918026 IP 192.168.43.146.8880 > 192.168.43.147.7772: UDP, length 120
02:31:36.967766 IP 192.168.43.124.8880 > 192.168.43.146.7771: UDP, length 120
02:31:36.968021 IP 192.168.43.146.8880 > 192.168.43.147.7772: UDP, length 120
02:31:37.018022 IP 192.168.43.146.8880 > 192.168.43.147.7772: UDP, length 120
02:31:37.027109 IP 192.168.43.124.8880 > 192.168.43.146.7771: UDP, length 120
02:31:37.068081 IP 192.168.43.146.8880 > 192.168.43.147.7772: UDP, length 120
02:31:37.068362 IP 192.168.43.124.8880 > 192.168.43.146.7771: UDP, length 120
02:31:37.117518 IP 192.168.43.124.8880 > 192.168.43.146.7771: UDP, length 120
02:31:37.118040 IP 192.168.43.146.8880 > 192.168.43.147.7772: UDP, length 120
02:31:37.168085 IP 192.168.43.146.8880 > 192.168.43.147.7772: UDP, length 120
02:31:37.175335 IP 192.168.43.124.8880 > 192.168.43.146.7771: UDP, length 120
02:31:37.217862 IP 192.168.43.124.8880 > 192.168.43.146.7771: UDP, length 120
02:31:37.218132 IP 192.168.43.146.8880 > 192.168.43.147.7772: UDP, length 120
02:31:37.268150 IP 192.168.43.146.8880 > 192.168.43.147.7772: UDP, length 120
02:31:37.270157 IP 192.168.43.124.8880 > 192.168.43.146.7771: UDP, length 120
02:31:37.318079 IP 192.168.43.146.8880 > 192.168.43.147.7772: UDP, length 120
02:31:37.324744 IP 192.168.43.124.8880 > 192.168.43.146.7771: UDP, length 120
02:31:37.368102 IP 192.168.43.146.8880 > 192.168.43.147.7772: UDP, length 120
02:31:37.370086 IP 192.168.43.124.8880 > 192.168.43.146.7771: UDP, length 120
02:31:37.418083 IP 192.168.43.146.8880 > 192.168.43.147.7772: UDP, length 120
02:31:37.420999 IP 192.168.43.124.8880 > 192.168.43.146.7771: UDP, length 120
02:31:37.468056 IP 192.168.43.146.8880 > 192.168.43.147.7772: UDP, length 120
02:31:37.474625 IP 192.168.43.124.8880 > 192.168.43.146.7771: UDP, length 120
02:31:37.518078 IP 192.168.43.146.8880 > 192.168.43.147.7772: UDP, length 120
02:31:37.518658 IP 192.168.43.124.8880 > 192.168.43.146.7771: UDP, length 120
02:31:37.567836 IP 192.168.43.124.8880 > 192.168.43.146.7771: UDP, length 120
02:31:37.568057 IP 192.168.43.146.8880 > 192.168.43.147.7772: UDP, length 120
02:31:37.618120 IP 192.168.43.146.8880 > 192.168.43.147.7772: UDP, length 120
02:31:37.624847 IP 192.168.43.124.8880 > 192.168.43.146.7771: UDP, length 120
02:31:37.667761 IP 192.168.43.124.8880 > 192.168.43.146.7771: UDP, length 120
02:31:37.668091 IP 192.168.43.146.8880 > 192.168.43.147.7772: UDP, length 120
02:31:37.717721 IP 192.168.43.124.8880 > 192.168.43.146.7771: UDP, length 120
02:31:37.718046 IP 192.168.43.146.8880 > 192.168.43.147.7772: UDP, length 120
02:31:37.768040 IP 192.168.43.146.8880 > 192.168.43.147.7772: UDP, length 120
02:31:37.777426 IP 192.168.43.124.8880 > 192.168.43.146.7771: UDP, length 120
02:31:37.817703 IP 192.168.43.124.8880 > 192.168.43.146.7771: UDP, length 120
02:31:37.818030 IP 192.168.43.146.8880 > 192.168.43.147.7772: UDP, length 120
02:31:37.868026 IP 192.168.43.146.8880 > 192.168.43.147.7772: UDP, length 120
02:31:37.868529 IP 192.168.43.124.8880 > 192.168.43.146.7771: UDP, length 120
02:31:37.918024 IP 192.168.43.146.8880 > 192.168.43.147.7772: UDP, length 120
02:31:37.924677 IP 192.168.43.124.8880 > 192.168.43.146.7771: UDP, length 120
02:31:37.968025 IP 192.168.43.146.8880 > 192.168.43.147.7772: UDP, length 120
02:31:37.969823 IP 192.168.43.124.8880 > 192.168.43.146.7771: UDP, length 120
02:31:38.017432 IP 192.168.43.124.8880 > 192.168.43.146.7771: UDP, length 120
02:31:38.018028 IP 192.168.43.146.8880 > 192.168.43.147.7772: UDP, length 120
02:31:38.067840 IP 192.168.43.124.8880 > 192.168.43.146.7771: UDP, length 120
02:31:38.068026 IP 192.168.43.146.8880 > 192.168.43.147.7772: UDP, length 120
02:31:38.118022 IP 192.168.43.146.8880 > 192.168.43.147.7772: UDP, length 120
02:31:38.131858 IP 192.168.43.124.8880 > 192.168.43.146.7771: UDP, length 120
02:31:38.167718 IP 192.168.43.124.8880 > 192.168.43.146.7771: UDP, length 120
02:31:38.168101 IP 192.168.43.146.8880 > 192.168.43.147.7772: UDP, length 120
02:31:38.217682 IP 192.168.43.124.8880 > 192.168.43.146.7771: UDP, length 120
02:31:38.218075 IP 192.168.43.146.8880 > 192.168.43.147.7772: UDP, length 120
02:31:38.268029 IP 192.168.43.146.8880 > 192.168.43.147.7772: UDP, length 120
02:31:38.271800 IP 192.168.43.124.8880 > 192.168.43.146.7771: UDP, length 120
02:31:38.317666 IP 192.168.43.124.8880 > 192.168.43.146.7771: UDP, length 120
02:31:38.318026 IP 192.168.43.146.8880 > 192.168.43.147.7772: UDP, length 120
02:31:38.367679 IP 192.168.43.124.8880 > 192.168.43.146.7771: UDP, length 120
02:31:38.368023 IP 192.168.43.146.8880 > 192.168.43.147.7772: UDP, length 120
02:31:38.418023 IP 192.168.43.146.8880 > 192.168.43.147.7772: UDP, length 120
02:31:38.444663 IP 192.168.43.124.8880 > 192.168.43.146.7771: UDP, length 120
02:31:38.467576 IP 192.168.43.124.8880 > 192.168.43.146.7771: UDP, length 120
02:31:38.468031 IP 192.168.43.146.8880 > 192.168.43.147.7772: UDP, length 120
02:31:38.517750 IP 192.168.43.124.8880 > 192.168.43.146.7771: UDP, length 120
02:31:38.518024 IP 192.168.43.146.8880 > 192.168.43.147.7772: UDP, length 120
02:31:38.567768 IP 192.168.43.124.8880 > 192.168.43.146.7771: UDP, length 120
02:31:38.568074 IP 192.168.43.146.8880 > 192.168.43.147.7772: UDP, length 120
02:31:38.618036 IP 192.168.43.146.8880 > 192.168.43.147.7772: UDP, length 120
02:31:38.621443 IP 192.168.43.124.8880 > 192.168.43.146.7771: UDP, length 120
02:31:38.668025 IP 192.168.43.146.8880 > 192.168.43.147.7772: UDP, length 120
02:31:38.690579 IP 192.168.43.124.8880 > 192.168.43.146.7771: UDP, length 120
02:31:38.717882 IP 192.168.43.124.8880 > 192.168.43.146.7771: UDP, length 120
02:31:38.718028 IP 192.168.43.146.8880 > 192.168.43.147.7772: UDP, length 120
02:31:38.768050 IP 192.168.43.146.8880 > 192.168.43.147.7772: UDP, length 120
02:31:38.771267 IP 192.168.43.124.8880 > 192.168.43.146.7771: UDP, length 120
02:31:38.818033 IP 192.168.43.146.8880 > 192.168.43.147.7772: UDP, length 120
02:31:38.827349 IP 192.168.43.124.8880 > 192.168.43.146.7771: UDP, length 120
02:31:38.868033 IP 192.168.43.146.8880 > 192.168.43.147.7772: UDP, length 120
02:31:38.871464 IP 192.168.43.124.8880 > 192.168.43.146.7771: UDP, length 120
02:31:38.917647 IP 192.168.43.124.8880 > 192.168.43.146.7771: UDP, length 120
02:31:38.918031 IP 192.168.43.146.8880 > 192.168.43.147.7772: UDP, length 120
02:31:38.968020 IP 192.168.43.146.8880 > 192.168.43.147.7772: UDP, length 120
02:31:38.970905 IP 192.168.43.124.8880 > 192.168.43.146.7771: UDP, length 120
02:31:39.017693 IP 192.168.43.124.8880 > 192.168.43.146.7771: UDP, length 120
02:31:39.018023 IP 192.168.43.146.8880 > 192.168.43.147.7772: UDP, length 120
02:31:39.067810 IP 192.168.43.124.8880 > 192.168.43.146.7771: UDP, length 120
02:31:39.068027 IP 192.168.43.146.8880 > 192.168.43.147.7772: UDP, length 120
02:31:39.116831 IP 192.168.43.124.8880 > 192.168.43.146.7771: UDP, length 120
02:31:39.118025 IP 192.168.43.146.8880 > 192.168.43.147.7772: UDP, length 120
02:31:39.168021 IP 192.168.43.146.8880 > 192.168.43.147.7772: UDP, length 120
02:31:39.177533 IP 192.168.43.124.8880 > 192.168.43.146.7771: UDP, length 120
02:31:39.217576 IP 192.168.43.124.8880 > 192.168.43.146.7771: UDP, length 120
02:31:39.218023 IP 192.168.43.146.8880 > 192.168.43.147.7772: UDP, length 120
02:31:39.267811 IP 192.168.43.124.8880 > 192.168.43.146.7771: UDP, length 120
02:31:39.268022 IP 192.168.43.146.8880 > 192.168.43.147.7772: UDP, length 120
02:31:39.318022 IP 192.168.43.146.8880 > 192.168.43.147.7772: UDP, length 120
02:31:39.327687 IP 192.168.43.124.8880 > 192.168.43.146.7771: UDP, length 120
02:31:39.367870 IP 192.168.43.124.8880 > 192.168.43.146.7771: UDP, length 120
02:31:39.368025 IP 192.168.43.146.8880 > 192.168.43.147.7772: UDP, length 120
02:31:39.418020 IP 192.168.43.146.8880 > 192.168.43.147.7772: UDP, length 120
02:31:39.418990 IP 192.168.43.124.8880 > 192.168.43.146.7771: UDP, length 120
02:31:39.468029 IP 192.168.43.146.8880 > 192.168.43.147.7772: UDP, length 120
02:31:39.474715 IP 192.168.43.124.8880 > 192.168.43.146.7771: UDP, length 120
02:31:39.517674 IP 192.168.43.124.8880 > 192.168.43.146.7771: UDP, length 120
02:31:39.518028 IP 192.168.43.146.8880 > 192.168.43.147.7772: UDP, length 120
02:31:39.567799 IP 192.168.43.124.8880 > 192.168.43.146.7771: UDP, length 120
02:31:39.568026 IP 192.168.43.146.8880 > 192.168.43.147.7772: UDP, length 120
02:31:39.618027 IP 192.168.43.146.8880 > 192.168.43.147.7772: UDP, length 120
02:31:39.624700 IP 192.168.43.124.8880 > 192.168.43.146.7771: UDP, length 120
02:31:39.667883 IP 192.168.43.124.8880 > 192.168.43.146.7771: UDP, length 120
02:31:39.668023 IP 192.168.43.146.8880 > 192.168.43.147.7772: UDP, length 120
02:31:39.718023 IP 192.168.43.146.8880 > 192.168.43.147.7772: UDP, length 120
02:31:39.718665 IP 192.168.43.124.8880 > 192.168.43.146.7771: UDP, length 120
02:31:39.767663 IP 192.168.43.124.8880 > 192.168.43.146.7771: UDP, length 120
02:31:39.768045 IP 192.168.43.146.8880 > 192.168.43.147.7772: UDP, length 120
02:31:39.818037 IP 192.168.43.146.8880 > 192.168.43.147.7772: UDP, length 120
02:31:39.818139 IP 192.168.43.124.8880 > 192.168.43.146.7771: UDP, length 120
02:31:39.866922 IP 192.168.43.124.8880 > 192.168.43.146.7771: UDP, length 120
02:31:39.868031 IP 192.168.43.146.8880 > 192.168.43.147.7772: UDP, length 120
02:31:39.918022 IP 192.168.43.146.8880 > 192.168.43.147.7772: UDP, length 120
02:31:39.936373 IP 192.168.43.124.8880 > 192.168.43.146.7771: UDP, length 120
02:31:39.967666 IP 192.168.43.124.8880 > 192.168.43.146.7771: UDP, length 120
02:31:39.968022 IP 192.168.43.146.8880 > 192.168.43.147.7772: UDP, length 120
02:31:40.017698 IP 192.168.43.124.8880 > 192.168.43.146.7771: UDP, length 120
02:31:40.018021 IP 192.168.43.146.8880 > 192.168.43.147.7772: UDP, length 120
02:31:40.068079 IP 192.168.43.146.8880 > 192.168.43.147.7772: UDP, length 120
02:31:40.075624 IP 192.168.43.124.8880 > 192.168.43.146.7771: UDP, length 120
02:31:40.118048 IP 192.168.43.146.8880 > 192.168.43.147.7772: UDP, length 120
02:31:40.118596 IP 192.168.43.124.8880 > 192.168.43.146.7771: UDP, length 120
02:31:40.167780 IP 192.168.43.124.8880 > 192.168.43.146.7771: UDP, length 120
02:31:40.168025 IP 192.168.43.146.8880 > 192.168.43.147.7772: UDP, length 120
02:31:40.218110 IP 192.168.43.146.8880 > 192.168.43.147.7772: UDP, length 120
02:31:40.218395 IP 192.168.43.124.8880 > 192.168.43.146.7771: UDP, length 120
02:31:40.268123 IP 192.168.43.146.8880 > 192.168.43.147.7772: UDP, length 120
02:31:40.285803 IP 192.168.43.124.8880 > 192.168.43.146.7771: UDP, length 120
02:31:40.317967 IP 192.168.43.124.8880 > 192.168.43.146.7771: UDP, length 120
