23:28:05.298279 IP 192.168.43.195.8880 > 192.168.43.124.7772: UDP, length 120
23:28:05.299380 IP 192.168.43.195.8880 > 192.168.43.124.7772: UDP, length 120
23:28:05.321484 IP 192.168.43.195.8880 > 192.168.43.124.7772: UDP, length 120
23:28:05.375736 IP 192.168.43.195.8880 > 192.168.43.124.7772: UDP, length 120
23:28:05.431977 IP 192.168.43.195.8880 > 192.168.43.124.7772: UDP, length 120
23:28:05.486458 IP 192.168.43.195.8880 > 192.168.43.124.7772: UDP, length 120
23:28:05.527531 IP 192.168.43.195.8880 > 192.168.43.124.7772: UDP, length 120
23:28:05.634040 IP 192.168.43.195.8880 > 192.168.43.124.7772: UDP, length 120
23:28:05.634055 IP 192.168.43.195.8880 > 192.168.43.124.7772: UDP, length 120
23:28:05.670592 IP 192.168.43.195.8880 > 192.168.43.124.7772: UDP, length 120
23:28:05.720511 IP 192.168.43.195.8880 > 192.168.43.124.7772: UDP, length 120
23:28:05.772230 IP 192.168.43.195.8880 > 192.168.43.124.7772: UDP, length 120
23:28:05.832105 IP 192.168.43.195.8880 > 192.168.43.124.7772: UDP, length 120
23:28:05.888220 IP 192.168.43.195.8880 > 192.168.43.124.7772: UDP, length 120
23:28:05.920228 IP 192.168.43.195.8880 > 192.168.43.124.7772: UDP, length 120
23:28:05.971466 IP 192.168.43.195.8880 > 192.168.43.124.7772: UDP, length 120
23:28:06.030198 IP 192.168.43.195.8880 > 192.168.43.124.7772: UDP, length 120
23:28:06.079790 IP 192.168.43.195.8880 > 192.168.43.124.7772: UDP, length 120
23:28:06.123578 IP 192.168.43.195.8880 > 192.168.43.124.7772: UDP, length 120
23:28:06.172677 IP 192.168.43.195.8880 > 192.168.43.124.7772: UDP, length 120
23:28:06.232326 IP 192.168.43.195.8880 > 192.168.43.124.7772: UDP, length 120
23:28:06.273731 IP 192.168.43.195.8880 > 192.168.43.124.7772: UDP, length 120
23:28:06.326531 IP 192.168.43.195.8880 > 192.168.43.124.7772: UDP, length 120
23:28:06.371486 IP 192.168.43.195.8880 > 192.168.43.124.7772: UDP, length 120
23:28:06.438942 IP 192.168.43.195.8880 > 192.168.43.124.7772: UDP, length 120
23:28:06.473596 IP 192.168.43.195.8880 > 192.168.43.124.7772: UDP, length 120
23:28:06.521350 IP 192.168.43.195.8880 > 192.168.43.124.7772: UDP, length 120
23:28:06.570507 IP 192.168.43.195.8880 > 192.168.43.124.7772: UDP, length 120
23:28:06.643455 IP 192.168.43.195.8880 > 192.168.43.124.7772: UDP, length 120
23:28:06.670682 IP 192.168.43.195.8880 > 192.168.43.124.7772: UDP, length 120
23:28:06.720326 IP 192.168.43.195.8880 > 192.168.43.124.7772: UDP, length 120
23:28:06.770161 IP 192.168.43.195.8880 > 192.168.43.124.7772: UDP, length 120
23:28:06.830915 IP 192.168.43.195.8880 > 192.168.43.124.7772: UDP, length 120
23:28:06.870622 IP 192.168.43.195.8880 > 192.168.43.124.7772: UDP, length 120
23:28:06.920376 IP 192.168.43.195.8880 > 192.168.43.124.7772: UDP, length 120
23:28:06.971509 IP 192.168.43.195.8880 > 192.168.43.124.7772: UDP, length 120
23:28:07.034347 IP 192.168.43.195.8880 > 192.168.43.124.7772: UDP, length 120
23:28:07.077485 IP 192.168.43.195.8880 > 192.168.43.124.7772: UDP, length 120
23:28:07.120618 IP 192.168.43.195.8880 > 192.168.43.124.7772: UDP, length 120
23:28:07.170346 IP 192.168.43.195.8880 > 192.168.43.124.7772: UDP, length 120
23:28:07.240786 IP 192.168.43.195.8880 > 192.168.43.124.7772: UDP, length 120
23:28:07.271102 IP 192.168.43.195.8880 > 192.168.43.124.7772: UDP, length 120
23:28:07.327415 IP 192.168.43.195.8880 > 192.168.43.124.7772: UDP, length 120
23:28:07.371425 IP 192.168.43.195.8880 > 192.168.43.124.7772: UDP, length 120
23:28:07.441868 IP 192.168.43.195.8880 > 192.168.43.124.7772: UDP, length 120
23:28:07.474494 IP 192.168.43.195.8880 > 192.168.43.124.7772: UDP, length 120
23:28:07.524925 IP 192.168.43.195.8880 > 192.168.43.124.7772: UDP, length 120
23:28:07.570233 IP 192.168.43.195.8880 > 192.168.43.124.7772: UDP, length 120
23:28:07.621904 IP 192.168.43.195.8880 > 192.168.43.124.7772: UDP, length 120
23:28:07.672063 IP 192.168.43.195.8880 > 192.168.43.124.7772: UDP, length 120
23:28:07.723484 IP 192.168.43.195.8880 > 192.168.43.124.7772: UDP, length 120
23:28:07.773532 IP 192.168.43.195.8880 > 192.168.43.124.7772: UDP, length 120
23:28:07.822439 IP 192.168.43.195.8880 > 192.168.43.124.7772: UDP, length 120
23:28:07.873496 IP 192.168.43.195.8880 > 192.168.43.124.7772: UDP, length 120
23:28:07.923218 IP 192.168.43.195.8880 > 192.168.43.124.7772: UDP, length 120
23:28:07.972559 IP 192.168.43.195.8880 > 192.168.43.124.7772: UDP, length 120
23:28:08.024167 IP 192.168.43.195.8880 > 192.168.43.124.7772: UDP, length 120
23:28:08.080752 IP 192.168.43.195.8880 > 192.168.43.124.7772: UDP, length 120
23:28:08.124344 IP 192.168.43.195.8880 > 192.168.43.124.7772: UDP, length 120
23:28:08.173437 IP 192.168.43.195.8880 > 192.168.43.124.7772: UDP, length 120
23:28:08.222459 IP 192.168.43.195.8880 > 192.168.43.124.7772: UDP, length 120
23:28:08.274731 IP 192.168.43.195.8880 > 192.168.43.124.7772: UDP, length 120
23:28:08.323797 IP 192.168.43.195.8880 > 192.168.43.124.7772: UDP, length 120
23:28:08.376272 IP 192.168.43.195.8880 > 192.168.43.124.7772: UDP, length 120
23:28:08.422149 IP 192.168.43.195.8880 > 192.168.43.124.7772: UDP, length 120
23:28:08.473054 IP 192.168.43.195.8880 > 192.168.43.124.7772: UDP, length 120
23:28:08.522731 IP 192.168.43.195.8880 > 192.168.43.124.7772: UDP, length 120
23:28:08.573887 IP 192.168.43.195.8880 > 192.168.43.124.7772: UDP, length 120
23:28:08.621770 IP 192.168.43.195.8880 > 192.168.43.124.7772: UDP, length 120
23:28:08.673739 IP 192.168.43.195.8880 > 192.168.43.124.7772: UDP, length 120
23:28:08.723481 IP 192.168.43.195.8880 > 192.168.43.124.7772: UDP, length 120
23:28:08.772431 IP 192.168.43.195.8880 > 192.168.43.124.7772: UDP, length 120
23:28:08.821627 IP 192.168.43.195.8880 > 192.168.43.124.7772: UDP, length 120
23:28:08.871659 IP 192.168.43.195.8880 > 192.168.43.124.7772: UDP, length 120
23:28:08.922592 IP 192.168.43.195.8880 > 192.168.43.124.7772: UDP, length 120
23:28:08.971850 IP 192.168.43.195.8880 > 192.168.43.124.7772: UDP, length 120
23:28:09.007480 IP 192.168.43.124.8880 > 192.168.43.195.7771: UDP, length 120
23:28:09.031384 IP 192.168.43.195.8880 > 192.168.43.124.7772: UDP, length 120
23:28:09.057633 IP 192.168.43.124.8880 > 192.168.43.195.7771: UDP, length 120
23:28:09.074407 IP 192.168.43.195.8880 > 192.168.43.124.7772: UDP, length 120
23:28:09.107632 IP 192.168.43.124.8880 > 192.168.43.195.7771: UDP, length 120
23:28:09.122000 IP 192.168.43.195.8880 > 192.168.43.124.7772: UDP, length 120
23:28:09.157633 IP 192.168.43.124.8880 > 192.168.43.195.7771: UDP, length 120
23:28:09.170391 IP 192.168.43.195.8880 > 192.168.43.124.7772: UDP, length 120
23:28:09.207629 IP 192.168.43.124.8880 > 192.168.43.195.7771: UDP, length 120
23:28:09.222550 IP 192.168.43.195.8880 > 192.168.43.124.7772: UDP, length 120
23:28:09.257632 IP 192.168.43.124.8880 > 192.168.43.195.7771: UDP, length 120
23:28:09.273890 IP 192.168.43.195.8880 > 192.168.43.124.7772: UDP, length 120
23:28:09.307631 IP 192.168.43.124.8880 > 192.168.43.195.7771: UDP, length 120
23:28:09.326914 IP 192.168.43.195.8880 > 192.168.43.124.7772: UDP, length 120
23:28:09.357588 IP 192.168.43.124.8880 > 192.168.43.195.7771: UDP, length 120
23:28:09.376120 IP 192.168.43.195.8880 > 192.168.43.124.7772: UDP, length 120
23:28:09.407632 IP 192.168.43.124.8880 > 192.168.43.195.7771: UDP, length 120
23:28:09.421932 IP 192.168.43.195.8880 > 192.168.43.124.7772: UDP, length 120
23:28:09.579398 IP 192.168.43.124.8880 > 192.168.43.195.7771: UDP, length 120
23:28:09.579551 IP 192.168.43.124.8880 > 192.168.43.195.7771: UDP, length 120
23:28:09.579555 IP 192.168.43.124.8880 > 192.168.43.195.7771: UDP, length 120
23:28:09.581297 IP 192.168.43.195.8880 > 192.168.43.124.7772: UDP, length 120
23:28:09.581311 IP 192.168.43.195.8880 > 192.168.43.124.7772: UDP, length 120
23:28:09.581314 IP 192.168.43.195.8880 > 192.168.43.124.7772: UDP, length 120
23:28:09.607634 IP 192.168.43.124.8880 > 192.168.43.195.7771: UDP, length 120
23:28:09.625870 IP 192.168.43.195.8880 > 192.168.43.124.7772: UDP, length 120
23:28:09.657633 IP 192.168.43.124.8880 > 192.168.43.195.7771: UDP, length 120
23:28:09.676025 IP 192.168.43.195.8880 > 192.168.43.124.7772: UDP, length 120
23:28:09.707628 IP 192.168.43.124.8880 > 192.168.43.195.7771: UDP, length 120
23:28:09.723182 IP 192.168.43.195.8880 > 192.168.43.124.7772: UDP, length 120
23:28:09.757633 IP 192.168.43.124.8880 > 192.168.43.195.7771: UDP, length 120
23:28:09.769818 IP 192.168.43.195.8880 > 192.168.43.124.7772: UDP, length 120
23:28:09.930058 IP 192.168.43.124.8880 > 192.168.43.195.7771: UDP, length 120
23:28:09.930210 IP 192.168.43.124.8880 > 192.168.43.195.7771: UDP, length 120
23:28:09.930214 IP 192.168.43.124.8880 > 192.168.43.195.7771: UDP, length 120
23:28:09.931992 IP 192.168.43.195.8880 > 192.168.43.124.7772: UDP, length 120
23:28:09.932006 IP 192.168.43.195.8880 > 192.168.43.124.7772: UDP, length 120
23:28:09.932008 IP 192.168.43.195.8880 > 192.168.43.124.7772: UDP, length 120
23:28:09.957633 IP 192.168.43.124.8880 > 192.168.43.195.7771: UDP, length 120
23:28:09.970229 IP 192.168.43.195.8880 > 192.168.43.124.7772: UDP, length 120
23:28:10.007593 IP 192.168.43.124.8880 > 192.168.43.195.7771: UDP, length 120
23:28:10.019637 IP 192.168.43.195.8880 > 192.168.43.124.7772: UDP, length 120
23:28:10.057633 IP 192.168.43.124.8880 > 192.168.43.195.7771: UDP, length 120
23:28:10.079173 IP 192.168.43.195.8880 > 192.168.43.124.7772: UDP, length 120
23:28:10.107559 IP 192.168.43.124.8880 > 192.168.43.195.7771: UDP, length 120
23:28:10.122545 IP 192.168.43.195.8880 > 192.168.43.124.7772: UDP, length 120
23:28:10.278062 IP 192.168.43.124.8880 > 192.168.43.195.7771: UDP, length 120
23:28:10.278214 IP 192.168.43.124.8880 > 192.168.43.195.7771: UDP, length 120
23:28:10.278218 IP 192.168.43.124.8880 > 192.168.43.195.7771: UDP, length 120
23:28:10.279987 IP 192.168.43.195.8880 > 192.168.43.124.7772: UDP, length 120
23:28:10.280001 IP 192.168.43.195.8880 > 192.168.43.124.7772: UDP, length 120
23:28:10.280003 IP 192.168.43.195.8880 > 192.168.43.124.7772: UDP, length 120
23:28:10.307631 IP 192.168.43.124.8880 > 192.168.43.195.7771: UDP, length 120
23:28:10.320431 IP 192.168.43.195.8880 > 192.168.43.124.7772: UDP, length 120
23:28:10.357634 IP 192.168.43.124.8880 > 192.168.43.195.7771: UDP, length 120
23:28:10.375444 IP 192.168.43.195.8880 > 192.168.43.124.7772: UDP, length 120
23:28:10.407645 IP 192.168.43.124.8880 > 192.168.43.195.7771: UDP, length 120
23:28:10.424564 IP 192.168.43.195.8880 > 192.168.43.124.7772: UDP, length 120
23:28:10.457631 IP 192.168.43.124.8880 > 192.168.43.195.7771: UDP, length 120
23:28:10.471222 IP 192.168.43.195.8880 > 192.168.43.124.7772: UDP, length 120
23:28:10.531194 IP 192.168.43.195.8880 > 192.168.43.124.7772: UDP, length 120
23:28:10.621282 IP 192.168.43.195.8880 > 192.168.43.124.7772: UDP, length 120
23:28:10.626059 IP 192.168.43.124.8880 > 192.168.43.195.7771: UDP, length 120
23:28:10.626212 IP 192.168.43.124.8880 > 192.168.43.195.7771: UDP, length 120
23:28:10.626217 IP 192.168.43.124.8880 > 192.168.43.195.7771: UDP, length 120
23:28:10.657630 IP 192.168.43.124.8880 > 192.168.43.195.7771: UDP, length 120
23:28:10.679878 IP 192.168.43.195.8880 > 192.168.43.124.7772: UDP, length 120
23:28:10.707632 IP 192.168.43.124.8880 > 192.168.43.195.7771: UDP, length 120
23:28:10.724120 IP 192.168.43.195.8880 > 192.168.43.124.7772: UDP, length 120
23:28:10.757635 IP 192.168.43.124.8880 > 192.168.43.195.7771: UDP, length 120
23:28:10.769876 IP 192.168.43.195.8880 > 192.168.43.124.7772: UDP, length 120
23:28:10.807630 IP 192.168.43.124.8880 > 192.168.43.195.7771: UDP, length 120
23:28:10.978060 IP 192.168.43.124.8880 > 192.168.43.195.7771: UDP, length 120
23:28:10.978209 IP 192.168.43.124.8880 > 192.168.43.195.7771: UDP, length 120
23:28:10.978214 IP 192.168.43.124.8880 > 192.168.43.195.7771: UDP, length 120
23:28:10.979991 IP 192.168.43.195.8880 > 192.168.43.124.7772: UDP, length 120
23:28:10.980005 IP 192.168.43.195.8880 > 192.168.43.124.7772: UDP, length 120
23:28:10.980007 IP 192.168.43.195.8880 > 192.168.43.124.7772: UDP, length 120
23:28:10.980010 IP 192.168.43.195.8880 > 192.168.43.124.7772: UDP, length 120
23:28:11.007628 IP 192.168.43.124.8880 > 192.168.43.195.7771: UDP, length 120
23:28:11.021789 IP 192.168.43.195.8880 > 192.168.43.124.7772: UDP, length 120
23:28:11.057627 IP 192.168.43.124.8880 > 192.168.43.195.7771: UDP, length 120
23:28:11.077911 IP 192.168.43.195.8880 > 192.168.43.124.7772: UDP, length 120
23:28:11.107581 IP 192.168.43.124.8880 > 192.168.43.195.7771: UDP, length 120
23:28:11.120238 IP 192.168.43.195.8880 > 192.168.43.124.7772: UDP, length 120
23:28:11.157655 IP 192.168.43.124.8880 > 192.168.43.195.7771: UDP, length 120
23:28:11.171324 IP 192.168.43.195.8880 > 192.168.43.124.7772: UDP, length 120
23:28:11.326730 IP 192.168.43.124.8880 > 192.168.43.195.7771: UDP, length 120
23:28:11.326751 IP 192.168.43.124.8880 > 192.168.43.195.7771: UDP, length 120
23:28:11.326757 IP 192.168.43.124.8880 > 192.168.43.195.7771: UDP, length 120
23:28:11.328497 IP 192.168.43.195.8880 > 192.168.43.124.7772: UDP, length 120
23:28:11.328511 IP 192.168.43.195.8880 > 192.168.43.124.7772: UDP, length 120
23:28:11.328514 IP 192.168.43.195.8880 > 192.168.43.124.7772: UDP, length 120
23:28:11.357633 IP 192.168.43.124.8880 > 192.168.43.195.7771: UDP, length 120
23:28:11.369832 IP 192.168.43.195.8880 > 192.168.43.124.7772: UDP, length 120
23:28:11.407633 IP 192.168.43.124.8880 > 192.168.43.195.7771: UDP, length 120
23:28:11.425163 IP 192.168.43.195.8880 > 192.168.43.124.7772: UDP, length 120
23:28:11.457631 IP 192.168.43.124.8880 > 192.168.43.195.7771: UDP, length 120
23:28:11.469200 IP 192.168.43.195.8880 > 192.168.43.124.7772: UDP, length 120
23:28:11.507632 IP 192.168.43.124.8880 > 192.168.43.195.7771: UDP, length 120
23:28:11.522498 IP 192.168.43.195.8880 > 192.168.43.124.7772: UDP, length 120
23:28:11.678337 IP 192.168.43.124.8880 > 192.168.43.195.7771: UDP, length 120
23:28:11.678487 IP 192.168.43.124.8880 > 192.168.43.195.7771: UDP, length 120
23:28:11.678491 IP 192.168.43.124.8880 > 192.168.43.195.7771: UDP, length 120
23:28:11.680272 IP 192.168.43.195.8880 > 192.168.43.124.7772: UDP, length 120
23:28:11.680287 IP 192.168.43.195.8880 > 192.168.43.124.7772: UDP, length 120
23:28:11.680289 IP 192.168.43.195.8880 > 192.168.43.124.7772: UDP, length 120
23:28:11.707632 IP 192.168.43.124.8880 > 192.168.43.195.7771: UDP, length 120
23:28:11.729571 IP 192.168.43.195.8880 > 192.168.43.124.7772: UDP, length 120
23:28:11.757634 IP 192.168.43.124.8880 > 192.168.43.195.7771: UDP, length 120
23:28:11.771080 IP 192.168.43.195.8880 > 192.168.43.124.7772: UDP, length 120
23:28:11.807629 IP 192.168.43.124.8880 > 192.168.43.195.7771: UDP, length 120
23:28:11.817978 IP 192.168.43.195.8880 > 192.168.43.124.7772: UDP, length 120
23:28:11.857632 IP 192.168.43.124.8880 > 192.168.43.195.7771: UDP, length 120
23:28:11.873503 IP 192.168.43.195.8880 > 192.168.43.124.7772: UDP, length 120
23:28:12.026061 IP 192.168.43.124.8880 > 192.168.43.195.7771: UDP, length 120
23:28:12.026212 IP 192.168.43.124.8880 > 192.168.43.195.7771: UDP, length 120
23:28:12.026216 IP 192.168.43.124.8880 > 192.168.43.195.7771: UDP, length 120
23:28:12.030919 IP 192.168.43.195.8880 > 192.168.43.124.7772: UDP, length 120
23:28:12.030933 IP 192.168.43.195.8880 > 192.168.43.124.7772: UDP, length 120
23:28:12.030935 IP 192.168.43.195.8880 > 192.168.43.124.7772: UDP, length 120
23:28:12.057617 IP 192.168.43.124.8880 > 192.168.43.195.7771: UDP, length 120
23:28:12.069373 IP 192.168.43.195.8880 > 192.168.43.124.7772: UDP, length 120
23:28:12.107552 IP 192.168.43.124.8880 > 192.168.43.195.7771: UDP, length 120
23:28:12.119559 IP 192.168.43.195.8880 > 192.168.43.124.7772: UDP, length 120
23:28:12.157548 IP 192.168.43.124.8880 > 192.168.43.195.7771: UDP, length 120
23:28:12.170246 IP 192.168.43.195.8880 > 192.168.43.124.7772: UDP, length 120
23:28:12.207633 IP 192.168.43.124.8880 > 192.168.43.195.7771: UDP, length 120
23:28:12.222077 IP 192.168.43.195.8880 > 192.168.43.124.7772: UDP, length 120
23:28:12.375144 IP 192.168.43.124.8880 > 192.168.43.195.7771: UDP, length 120
23:28:12.375291 IP 192.168.43.124.8880 > 192.168.43.195.7771: UDP, length 120
23:28:12.375295 IP 192.168.43.124.8880 > 192.168.43.195.7771: UDP, length 120
23:28:12.376603 IP 192.168.43.195.8880 > 192.168.43.124.7772: UDP, length 120
23:28:12.376616 IP 192.168.43.195.8880 > 192.168.43.124.7772: UDP, length 120
23:28:12.376619 IP 192.168.43.195.8880 > 192.168.43.124.7772: UDP, length 120
23:28:12.407635 IP 192.168.43.124.8880 > 192.168.43.195.7771: UDP, length 120
23:28:12.417206 IP 192.168.43.195.8880 > 192.168.43.124.7772: UDP, length 120
23:28:12.457628 IP 192.168.43.124.8880 > 192.168.43.195.7771: UDP, length 120
23:28:12.474252 IP 192.168.43.195.8880 > 192.168.43.124.7772: UDP, length 120
23:28:12.507637 IP 192.168.43.124.8880 > 192.168.43.195.7771: UDP, length 120
23:28:12.520251 IP 192.168.43.195.8880 > 192.168.43.124.7772: UDP, length 120
23:28:12.557575 IP 192.168.43.124.8880 > 192.168.43.195.7771: UDP, length 120
23:28:12.567492 IP 192.168.43.195.8880 > 192.168.43.124.7772: UDP, length 120
23:28:12.726071 IP 192.168.43.124.8880 > 192.168.43.195.7771: UDP, length 120
23:28:12.726222 IP 192.168.43.124.8880 > 192.168.43.195.7771: UDP, length 120
23:28:12.726226 IP 192.168.43.124.8880 > 192.168.43.195.7771: UDP, length 120
23:28:12.728003 IP 192.168.43.195.8880 > 192.168.43.124.7772: UDP, length 120
23:28:12.728017 IP 192.168.43.195.8880 > 192.168.43.124.7772: UDP, length 120
23:28:12.728019 IP 192.168.43.195.8880 > 192.168.43.124.7772: UDP, length 120
23:28:12.757628 IP 192.168.43.124.8880 > 192.168.43.195.7771: UDP, length 120
23:28:12.767338 IP 192.168.43.195.8880 > 192.168.43.124.7772: UDP, length 120
23:28:12.807595 IP 192.168.43.124.8880 > 192.168.43.195.7771: UDP, length 120
23:28:12.823196 IP 192.168.43.195.8880 > 192.168.43.124.7772: UDP, length 120
23:28:12.857628 IP 192.168.43.124.8880 > 192.168.43.195.7771: UDP, length 120
23:28:12.882302 IP 192.168.43.195.8880 > 192.168.43.124.7772: UDP, length 120
23:28:12.907597 IP 192.168.43.124.8880 > 192.168.43.195.7771: UDP, length 120
23:28:12.917157 IP 192.168.43.195.8880 > 192.168.43.124.7772: UDP, length 120
23:28:13.074152 IP 192.168.43.124.8880 > 192.168.43.195.7771: UDP, length 120
23:28:13.074184 IP 192.168.43.124.8880 > 192.168.43.195.7771: UDP, length 120
23:28:13.074218 IP 192.168.43.124.8880 > 192.168.43.195.7771: UDP, length 120
23:28:13.080703 IP 192.168.43.195.8880 > 192.168.43.124.7772: UDP, length 120
23:28:13.080717 IP 192.168.43.195.8880 > 192.168.43.124.7772: UDP, length 120
23:28:13.080719 IP 192.168.43.195.8880 > 192.168.43.124.7772: UDP, length 120
23:28:13.107577 IP 192.168.43.124.8880 > 192.168.43.195.7771: UDP, length 120
23:28:13.120932 IP 192.168.43.195.8880 > 192.168.43.124.7772: UDP, length 120
23:28:13.157631 IP 192.168.43.124.8880 > 192.168.43.195.7771: UDP, length 120
23:28:13.166429 IP 192.168.43.195.8880 > 192.168.43.124.7772: UDP, length 120
23:28:13.207631 IP 192.168.43.124.8880 > 192.168.43.195.7771: UDP, length 120
23:28:13.219984 IP 192.168.43.195.8880 > 192.168.43.124.7772: UDP, length 120
23:28:13.257690 IP 192.168.43.124.8880 > 192.168.43.195.7771: UDP, length 120
23:28:13.267194 IP 192.168.43.195.8880 > 192.168.43.124.7772: UDP, length 120
23:28:13.422065 IP 192.168.43.124.8880 > 192.168.43.195.7771: UDP, length 120
23:28:13.422220 IP 192.168.43.124.8880 > 192.168.43.195.7771: UDP, length 120
23:28:13.422224 IP 192.168.43.124.8880 > 192.168.43.195.7771: UDP, length 120
23:28:13.424021 IP 192.168.43.195.8880 > 192.168.43.124.7772: UDP, length 120
23:28:13.424038 IP 192.168.43.195.8880 > 192.168.43.124.7772: UDP, length 120
23:28:13.424040 IP 192.168.43.195.8880 > 192.168.43.124.7772: UDP, length 120
23:28:13.457633 IP 192.168.43.124.8880 > 192.168.43.195.7771: UDP, length 120
23:28:13.470518 IP 192.168.43.195.8880 > 192.168.43.124.7772: UDP, length 120
23:28:13.507629 IP 192.168.43.124.8880 > 192.168.43.195.7771: UDP, length 120
23:28:13.522905 IP 192.168.43.195.8880 > 192.168.43.124.7772: UDP, length 120
23:28:13.557633 IP 192.168.43.124.8880 > 192.168.43.195.7771: UDP, length 120
23:28:13.570963 IP 192.168.43.195.8880 > 192.168.43.124.7772: UDP, length 120
23:28:13.607684 IP 192.168.43.124.8880 > 192.168.43.195.7771: UDP, length 120
23:28:13.617320 IP 192.168.43.195.8880 > 192.168.43.124.7772: UDP, length 120
23:28:13.770383 IP 192.168.43.124.8880 > 192.168.43.195.7771: UDP, length 120
23:28:13.770408 IP 192.168.43.124.8880 > 192.168.43.195.7771: UDP, length 120
23:28:13.770413 IP 192.168.43.124.8880 > 192.168.43.195.7771: UDP, length 120
23:28:13.771897 IP 192.168.43.195.8880 > 192.168.43.124.7772: UDP, length 120
23:28:13.771910 IP 192.168.43.195.8880 > 192.168.43.124.7772: UDP, length 120
23:28:13.776582 IP 192.168.43.195.8880 > 192.168.43.124.7772: UDP, length 120
23:28:13.807559 IP 192.168.43.124.8880 > 192.168.43.195.7771: UDP, length 120
23:28:13.818499 IP 192.168.43.195.8880 > 192.168.43.124.7772: UDP, length 120
23:28:13.857575 IP 192.168.43.124.8880 > 192.168.43.195.7771: UDP, length 120
23:28:13.867662 IP 192.168.43.195.8880 > 192.168.43.124.7772: UDP, length 120
23:28:13.907628 IP 192.168.43.124.8880 > 192.168.43.195.7771: UDP, length 120
23:28:13.923397 IP 192.168.43.195.8880 > 192.168.43.124.7772: UDP, length 120
23:28:13.957573 IP 192.168.43.124.8880 > 192.168.43.195.7771: UDP, length 120
23:28:13.966584 IP 192.168.43.195.8880 > 192.168.43.124.7772: UDP, length 120
23:28:14.007629 IP 192.168.43.124.8880 > 192.168.43.195.7771: UDP, length 120
23:28:14.016662 IP 192.168.43.195.8880 > 192.168.43.124.7772: UDP, length 120
23:28:14.057598 IP 192.168.43.124.8880 > 192.168.43.195.7771: UDP, length 120
23:28:14.084441 IP 192.168.43.195.8880 > 192.168.43.124.7772: UDP, length 120
23:28:14.107686 IP 192.168.43.124.8880 > 192.168.43.195.7771: UDP, length 120
23:28:14.121858 IP 192.168.43.195.8880 > 192.168.43.124.7772: UDP, length 120
23:28:14.157650 IP 192.168.43.124.8880 > 192.168.43.195.7771: UDP, length 120
23:28:14.168084 IP 192.168.43.195.8880 > 192.168.43.124.7772: UDP, length 120
23:28:14.207687 IP 192.168.43.124.8880 > 192.168.43.195.7771: UDP, length 120
23:28:14.239675 IP 192.168.43.195.8880 > 192.168.43.124.7772: UDP, length 120
23:28:14.257614 IP 192.168.43.124.8880 > 192.168.43.195.7771: UDP, length 120
23:28:14.270453 IP 192.168.43.195.8880 > 192.168.43.124.7772: UDP, length 120
23:28:14.307718 IP 192.168.43.124.8880 > 192.168.43.195.7771: UDP, length 120
23:28:14.316591 IP 192.168.43.195.8880 > 192.168.43.124.7772: UDP, length 120
23:28:14.357579 IP 192.168.43.124.8880 > 192.168.43.195.7771: UDP, length 120
23:28:14.367942 IP 192.168.43.195.8880 > 192.168.43.124.7772: UDP, length 120
23:28:14.407688 IP 192.168.43.124.8880 > 192.168.43.195.7771: UDP, length 120
23:28:14.420383 IP 192.168.43.195.8880 > 192.168.43.124.7772: UDP, length 120
23:28:14.457615 IP 192.168.43.124.8880 > 192.168.43.195.7771: UDP, length 120
23:28:14.466505 IP 192.168.43.195.8880 > 192.168.43.124.7772: UDP, length 120
23:28:14.507683 IP 192.168.43.124.8880 > 192.168.43.195.7771: UDP, length 120
23:28:14.518600 IP 192.168.43.195.8880 > 192.168.43.124.7772: UDP, length 120
23:28:14.557615 IP 192.168.43.124.8880 > 192.168.43.195.7771: UDP, length 120
23:28:14.567123 IP 192.168.43.195.8880 > 192.168.43.124.7772: UDP, length 120
23:28:14.607639 IP 192.168.43.124.8880 > 192.168.43.195.7771: UDP, length 120
23:28:14.620124 IP 192.168.43.195.8880 > 192.168.43.124.7772: UDP, length 120
23:28:14.657555 IP 192.168.43.124.8880 > 192.168.43.195.7771: UDP, length 120
23:28:14.666675 IP 192.168.43.195.8880 > 192.168.43.124.7772: UDP, length 120
23:28:14.707633 IP 192.168.43.124.8880 > 192.168.43.195.7771: UDP, length 120
23:28:14.723707 IP 192.168.43.195.8880 > 192.168.43.124.7772: UDP, length 120
23:28:14.757626 IP 192.168.43.124.8880 > 192.168.43.195.7771: UDP, length 120
23:28:14.766465 IP 192.168.43.195.8880 > 192.168.43.124.7772: UDP, length 120
23:28:14.807633 IP 192.168.43.124.8880 > 192.168.43.195.7771: UDP, length 120
23:28:14.829003 IP 192.168.43.195.8880 > 192.168.43.124.7772: UDP, length 120
23:28:14.857642 IP 192.168.43.124.8880 > 192.168.43.195.7771: UDP, length 120
23:28:14.866679 IP 192.168.43.195.8880 > 192.168.43.124.7772: UDP, length 120
23:28:14.907577 IP 192.168.43.124.8880 > 192.168.43.195.7771: UDP, length 120
23:28:14.916209 IP 192.168.43.195.8880 > 192.168.43.124.7772: UDP, length 120
23:28:14.957677 IP 192.168.43.124.8880 > 192.168.43.195.7771: UDP, length 120
23:28:14.969947 IP 192.168.43.195.8880 > 192.168.43.124.7772: UDP, length 120
23:28:15.007633 IP 192.168.43.124.8880 > 192.168.43.195.7771: UDP, length 120
23:28:15.029757 IP 192.168.43.195.8880 > 192.168.43.124.7772: UDP, length 120
23:28:15.057642 IP 192.168.43.124.8880 > 192.168.43.195.7771: UDP, length 120
23:28:15.080642 IP 192.168.43.195.8880 > 192.168.43.124.7772: UDP, length 120
23:28:15.107635 IP 192.168.43.124.8880 > 192.168.43.195.7771: UDP, length 120
23:28:15.132226 IP 192.168.43.195.8880 > 192.168.43.124.7772: UDP, length 120
23:28:15.157635 IP 192.168.43.124.8880 > 192.168.43.195.7771: UDP, length 120
23:28:15.166928 IP 192.168.43.195.8880 > 192.168.43.124.7772: UDP, length 120
23:28:15.207632 IP 192.168.43.124.8880 > 192.168.43.195.7771: UDP, length 120
23:28:15.216402 IP 192.168.43.195.8880 > 192.168.43.124.7772: UDP, length 120
23:28:15.257634 IP 192.168.43.124.8880 > 192.168.43.195.7771: UDP, length 120
23:28:15.268371 IP 192.168.43.195.8880 > 192.168.43.124.7772: UDP, length 120
23:28:15.307634 IP 192.168.43.124.8880 > 192.168.43.195.7771: UDP, length 120
23:28:15.320040 IP 192.168.43.195.8880 > 192.168.43.124.7772: UDP, length 120
23:28:15.357633 IP 192.168.43.124.8880 > 192.168.43.195.7771: UDP, length 120
23:28:15.366947 IP 192.168.43.195.8880 > 192.168.43.124.7772: UDP, length 120
23:28:15.407687 IP 192.168.43.124.8880 > 192.168.43.195.7771: UDP, length 120
23:28:15.438477 IP 192.168.43.195.8880 > 192.168.43.124.7772: UDP, length 120
23:28:15.457889 IP 192.168.43.124.8880 > 192.168.43.195.7771: UDP, length 120
23:28:15.490082 IP 192.168.43.195.8880 > 192.168.43.124.7772: UDP, length 120
23:28:15.507752 IP 192.168.43.124.8880 > 192.168.43.195.7771: UDP, length 120
23:28:15.519974 IP 192.168.43.195.8880 > 192.168.43.124.7772: UDP, length 120
23:28:15.557679 IP 192.168.43.124.8880 > 192.168.43.195.7771: UDP, length 120
23:28:15.566653 IP 192.168.43.195.8880 > 192.168.43.124.7772: UDP, length 120
23:28:15.607631 IP 192.168.43.124.8880 > 192.168.43.195.7771: UDP, length 120
23:28:15.620549 IP 192.168.43.195.8880 > 192.168.43.124.7772: UDP, length 120
23:28:15.657633 IP 192.168.43.124.8880 > 192.168.43.195.7771: UDP, length 120
23:28:15.669962 IP 192.168.43.195.8880 > 192.168.43.124.7772: UDP, length 120
23:28:15.707630 IP 192.168.43.124.8880 > 192.168.43.195.7771: UDP, length 120
23:28:15.723578 IP 192.168.43.195.8880 > 192.168.43.124.7772: UDP, length 120
23:28:15.757634 IP 192.168.43.124.8880 > 192.168.43.195.7771: UDP, length 120
23:28:15.769547 IP 192.168.43.195.8880 > 192.168.43.124.7772: UDP, length 120
23:28:15.807639 IP 192.168.43.124.8880 > 192.168.43.195.7771: UDP, length 120
23:28:15.841090 IP 192.168.43.195.8880 > 192.168.43.124.7772: UDP, length 120
23:28:15.857674 IP 192.168.43.124.8880 > 192.168.43.195.7771: UDP, length 120
23:28:15.869344 IP 192.168.43.195.8880 > 192.168.43.124.7772: UDP, length 120
23:28:15.907631 IP 192.168.43.124.8880 > 192.168.43.195.7771: UDP, length 120
23:28:15.916458 IP 192.168.43.195.8880 > 192.168.43.124.7772: UDP, length 120
23:28:15.957639 IP 192.168.43.124.8880 > 192.168.43.195.7771: UDP, length 120
23:28:15.971580 IP 192.168.43.195.8880 > 192.168.43.124.7772: UDP, length 120
23:28:16.007634 IP 192.168.43.124.8880 > 192.168.43.195.7771: UDP, length 120
23:28:16.024475 IP 192.168.43.195.8880 > 192.168.43.124.7772: UDP, length 120
23:28:16.057635 IP 192.168.43.124.8880 > 192.168.43.195.7771: UDP, length 120
23:28:16.081424 IP 192.168.43.195.8880 > 192.168.43.124.7772: UDP, length 120
23:28:16.107634 IP 192.168.43.124.8880 > 192.168.43.195.7771: UDP, length 120
23:28:16.119533 IP 192.168.43.195.8880 > 192.168.43.124.7772: UDP, length 120
23:28:16.157635 IP 192.168.43.124.8880 > 192.168.43.195.7771: UDP, length 120
23:28:16.169716 IP 192.168.43.195.8880 > 192.168.43.124.7772: UDP, length 120
23:28:16.207687 IP 192.168.43.124.8880 > 192.168.43.195.7771: UDP, length 120
23:28:16.221515 IP 192.168.43.195.8880 > 192.168.43.124.7772: UDP, length 120
23:28:16.257737 IP 192.168.43.124.8880 > 192.168.43.195.7771: UDP, length 120
23:28:16.270055 IP 192.168.43.195.8880 > 192.168.43.124.7772: UDP, length 120
23:28:16.307695 IP 192.168.43.124.8880 > 192.168.43.195.7771: UDP, length 120
23:28:16.319016 IP 192.168.43.195.8880 > 192.168.43.124.7772: UDP, length 120
23:28:16.357684 IP 192.168.43.124.8880 > 192.168.43.195.7771: UDP, length 120
23:28:16.370237 IP 192.168.43.195.8880 > 192.168.43.124.7772: UDP, length 120
23:28:16.407888 IP 192.168.43.124.8880 > 192.168.43.195.7771: UDP, length 120
23:28:16.420677 IP 192.168.43.195.8880 > 192.168.43.124.7772: UDP, length 120
23:28:16.458332 IP 192.168.43.124.8880 > 192.168.43.195.7771: UDP, length 120
23:28:16.472624 IP 192.168.43.195.8880 > 192.168.43.124.7772: UDP, length 120
23:28:16.507685 IP 192.168.43.124.8880 > 192.168.43.195.7771: UDP, length 120
23:28:16.522754 IP 192.168.43.195.8880 > 192.168.43.124.7772: UDP, length 120
23:28:16.558304 IP 192.168.43.124.8880 > 192.168.43.195.7771: UDP, length 120
23:28:16.588442 IP 192.168.43.195.8880 > 192.168.43.124.7772: UDP, length 120
23:28:16.607637 IP 192.168.43.124.8880 > 192.168.43.195.7771: UDP, length 120
23:28:16.617304 IP 192.168.43.195.8880 > 192.168.43.124.7772: UDP, length 120
23:28:16.657629 IP 192.168.43.124.8880 > 192.168.43.195.7771: UDP, length 120
23:28:16.669466 IP 192.168.43.195.8880 > 192.168.43.124.7772: UDP, length 120
23:28:16.707633 IP 192.168.43.124.8880 > 192.168.43.195.7771: UDP, length 120
23:28:16.717579 IP 192.168.43.195.8880 > 192.168.43.124.7772: UDP, length 120
23:28:16.757631 IP 192.168.43.124.8880 > 192.168.43.195.7771: UDP, length 120
23:28:16.773061 IP 192.168.43.195.8880 > 192.168.43.124.7772: UDP, length 120
23:28:16.807630 IP 192.168.43.124.8880 > 192.168.43.195.7771: UDP, length 120
23:28:16.819540 IP 192.168.43.195.8880 > 192.168.43.124.7772: UDP, length 120
23:28:16.857632 IP 192.168.43.124.8880 > 192.168.43.195.7771: UDP, length 120
23:28:16.870074 IP 192.168.43.195.8880 > 192.168.43.124.7772: UDP, length 120
23:28:16.907572 IP 192.168.43.124.8880 > 192.168.43.195.7771: UDP, length 120
23:28:16.922810 IP 192.168.43.195.8880 > 192.168.43.124.7772: UDP, length 120
23:28:16.957635 IP 192.168.43.124.8880 > 192.168.43.195.7771: UDP, length 120
23:28:16.972879 IP 192.168.43.195.8880 > 192.168.43.124.7772: UDP, length 120
23:28:17.007633 IP 192.168.43.124.8880 > 192.168.43.195.7771: UDP, length 120
23:28:17.019168 IP 192.168.43.195.8880 > 192.168.43.124.7772: UDP, length 120
23:28:17.057628 IP 192.168.43.124.8880 > 192.168.43.195.7771: UDP, length 120
23:28:17.072235 IP 192.168.43.195.8880 > 192.168.43.124.7772: UDP, length 120
23:28:17.107598 IP 192.168.43.124.8880 > 192.168.43.195.7771: UDP, length 120
23:28:17.116504 IP 192.168.43.195.8880 > 192.168.43.124.7772: UDP, length 120
23:28:17.157602 IP 192.168.43.124.8880 > 192.168.43.195.7771: UDP, length 120
23:28:17.175107 IP 192.168.43.195.8880 > 192.168.43.124.7772: UDP, length 120
23:28:17.207551 IP 192.168.43.124.8880 > 192.168.43.195.7771: UDP, length 120
23:28:17.231240 IP 192.168.43.195.8880 > 192.168.43.124.7772: UDP, length 120
23:28:17.257564 IP 192.168.43.124.8880 > 192.168.43.195.7771: UDP, length 120
23:28:17.277019 IP 192.168.43.195.8880 > 192.168.43.124.7772: UDP, length 120
23:28:17.307643 IP 192.168.43.124.8880 > 192.168.43.195.7771: UDP, length 120
23:28:17.319677 IP 192.168.43.195.8880 > 192.168.43.124.7772: UDP, length 120
23:28:17.357631 IP 192.168.43.124.8880 > 192.168.43.195.7771: UDP, length 120
23:28:17.369741 IP 192.168.43.195.8880 > 192.168.43.124.7772: UDP, length 120
23:28:17.407631 IP 192.168.43.124.8880 > 192.168.43.195.7771: UDP, length 120
23:28:17.425462 IP 192.168.43.195.8880 > 192.168.43.124.7772: UDP, length 120
23:28:17.457628 IP 192.168.43.124.8880 > 192.168.43.195.7771: UDP, length 120
23:28:17.469783 IP 192.168.43.195.8880 > 192.168.43.124.7772: UDP, length 120
23:28:17.507631 IP 192.168.43.124.8880 > 192.168.43.195.7771: UDP, length 120
23:28:17.521310 IP 192.168.43.195.8880 > 192.168.43.124.7772: UDP, length 120
23:28:17.557630 IP 192.168.43.124.8880 > 192.168.43.195.7771: UDP, length 120
23:28:17.592626 IP 192.168.43.195.8880 > 192.168.43.124.7772: UDP, length 120
23:28:17.607634 IP 192.168.43.124.8880 > 192.168.43.195.7771: UDP, length 120
23:28:17.616110 IP 192.168.43.195.8880 > 192.168.43.124.7772: UDP, length 120
23:28:17.657630 IP 192.168.43.124.8880 > 192.168.43.195.7771: UDP, length 120
23:28:17.669763 IP 192.168.43.195.8880 > 192.168.43.124.7772: UDP, length 120
23:28:17.707635 IP 192.168.43.124.8880 > 192.168.43.195.7771: UDP, length 120
23:28:17.716643 IP 192.168.43.195.8880 > 192.168.43.124.7772: UDP, length 120
23:28:17.757631 IP 192.168.43.124.8880 > 192.168.43.195.7771: UDP, length 120
23:28:17.770807 IP 192.168.43.195.8880 > 192.168.43.124.7772: UDP, length 120
23:28:17.807634 IP 192.168.43.124.8880 > 192.168.43.195.7771: UDP, length 120
23:28:17.821473 IP 192.168.43.195.8880 > 192.168.43.124.7772: UDP, length 120
23:28:17.857627 IP 192.168.43.124.8880 > 192.168.43.195.7771: UDP, length 120
23:28:17.870860 IP 192.168.43.195.8880 > 192.168.43.124.7772: UDP, length 120
23:28:17.907633 IP 192.168.43.124.8880 > 192.168.43.195.7771: UDP, length 120
23:28:17.939981 IP 192.168.43.195.8880 > 192.168.43.124.7772: UDP, length 120
23:28:17.957631 IP 192.168.43.124.8880 > 192.168.43.195.7771: UDP, length 120
23:28:17.997648 IP 192.168.43.195.8880 > 192.168.43.124.7772: UDP, length 120
23:28:18.007635 IP 192.168.43.124.8880 > 192.168.43.195.7771: UDP, length 120
23:28:18.019249 IP 192.168.43.195.8880 > 192.168.43.124.7772: UDP, length 120
23:28:18.057629 IP 192.168.43.124.8880 > 192.168.43.195.7771: UDP, length 120
23:28:18.082465 IP 192.168.43.195.8880 > 192.168.43.124.7772: UDP, length 120
23:28:18.107631 IP 192.168.43.124.8880 > 192.168.43.195.7771: UDP, length 120
23:28:18.119862 IP 192.168.43.195.8880 > 192.168.43.124.7772: UDP, length 120
23:28:18.157627 IP 192.168.43.124.8880 > 192.168.43.195.7771: UDP, length 120
23:28:18.172042 IP 192.168.43.195.8880 > 192.168.43.124.7772: UDP, length 120
23:28:18.207684 IP 192.168.43.124.8880 > 192.168.43.195.7771: UDP, length 120
23:28:18.222544 IP 192.168.43.195.8880 > 192.168.43.124.7772: UDP, length 120
23:28:18.257684 IP 192.168.43.124.8880 > 192.168.43.195.7771: UDP, length 120
23:28:18.289922 IP 192.168.43.195.8880 > 192.168.43.124.7772: UDP, length 120
23:28:18.308426 IP 192.168.43.124.8880 > 192.168.43.195.7771: UDP, length 120
23:28:18.316714 IP 192.168.43.195.8880 > 192.168.43.124.7772: UDP, length 120
23:28:18.357683 IP 192.168.43.124.8880 > 192.168.43.195.7771: UDP, length 120
23:28:18.369694 IP 192.168.43.195.8880 > 192.168.43.124.7772: UDP, length 120
23:28:18.408737 IP 192.168.43.124.8880 > 192.168.43.195.7771: UDP, length 120
23:28:18.417667 IP 192.168.43.195.8880 > 192.168.43.124.7772: UDP, length 120
23:28:18.457649 IP 192.168.43.124.8880 > 192.168.43.195.7771: UDP, length 120
23:28:18.470321 IP 192.168.43.195.8880 > 192.168.43.124.7772: UDP, length 120
23:28:18.508364 IP 192.168.43.124.8880 > 192.168.43.195.7771: UDP, length 120
23:28:18.521887 IP 192.168.43.195.8880 > 192.168.43.124.7772: UDP, length 120
23:28:18.558398 IP 192.168.43.124.8880 > 192.168.43.195.7771: UDP, length 120
23:28:18.571006 IP 192.168.43.195.8880 > 192.168.43.124.7772: UDP, length 120
23:28:18.608695 IP 192.168.43.124.8880 > 192.168.43.195.7771: UDP, length 120
23:28:18.615869 IP 192.168.43.195.8880 > 192.168.43.124.7772: UDP, length 120
23:28:18.657631 IP 192.168.43.124.8880 > 192.168.43.195.7771: UDP, length 120
23:28:18.675745 IP 192.168.43.195.8880 > 192.168.43.124.7772: UDP, length 120
23:28:18.707632 IP 192.168.43.124.8880 > 192.168.43.195.7771: UDP, length 120
23:28:18.718677 IP 192.168.43.195.8880 > 192.168.43.124.7772: UDP, length 120
23:28:18.757629 IP 192.168.43.124.8880 > 192.168.43.195.7771: UDP, length 120
23:28:18.767149 IP 192.168.43.195.8880 > 192.168.43.124.7772: UDP, length 120
23:28:18.807631 IP 192.168.43.124.8880 > 192.168.43.195.7771: UDP, length 120
23:28:18.820837 IP 192.168.43.195.8880 > 192.168.43.124.7772: UDP, length 120
23:28:18.857632 IP 192.168.43.124.8880 > 192.168.43.195.7771: UDP, length 120
23:28:18.870849 IP 192.168.43.195.8880 > 192.168.43.124.7772: UDP, length 120
23:28:18.907630 IP 192.168.43.124.8880 > 192.168.43.195.7771: UDP, length 120
23:28:18.920374 IP 192.168.43.195.8880 > 192.168.43.124.7772: UDP, length 120
23:28:18.957630 IP 192.168.43.124.8880 > 192.168.43.195.7771: UDP, length 120
23:28:18.966361 IP 192.168.43.195.8880 > 192.168.43.124.7772: UDP, length 120
23:28:19.007628 IP 192.168.43.124.8880 > 192.168.43.195.7771: UDP, length 120
23:28:19.017622 IP 192.168.43.195.8880 > 192.168.43.124.7772: UDP, length 120
23:28:19.057627 IP 192.168.43.124.8880 > 192.168.43.195.7771: UDP, length 120
23:28:19.071997 IP 192.168.43.195.8880 > 192.168.43.124.7772: UDP, length 120
23:28:19.107630 IP 192.168.43.124.8880 > 192.168.43.195.7771: UDP, length 120
23:28:19.121095 IP 192.168.43.195.8880 > 192.168.43.124.7772: UDP, length 120
23:28:19.157630 IP 192.168.43.124.8880 > 192.168.43.195.7771: UDP, length 120
23:28:19.165891 IP 192.168.43.195.8880 > 192.168.43.124.7772: UDP, length 120
23:28:19.207631 IP 192.168.43.124.8880 > 192.168.43.195.7771: UDP, length 120
23:28:19.238372 IP 192.168.43.195.8880 > 192.168.43.124.7772: UDP, length 120
23:28:19.257689 IP 192.168.43.124.8880 > 192.168.43.195.7771: UDP, length 120
23:28:19.271917 IP 192.168.43.195.8880 > 192.168.43.124.7772: UDP, length 120
23:28:19.307685 IP 192.168.43.124.8880 > 192.168.43.195.7771: UDP, length 120
23:28:19.320453 IP 192.168.43.195.8880 > 192.168.43.124.7772: UDP, length 120
23:28:19.357686 IP 192.168.43.124.8880 > 192.168.43.195.7771: UDP, length 120
23:28:19.367090 IP 192.168.43.195.8880 > 192.168.43.124.7772: UDP, length 120
23:28:19.407642 IP 192.168.43.124.8880 > 192.168.43.195.7771: UDP, length 120
23:28:19.422138 IP 192.168.43.195.8880 > 192.168.43.124.7772: UDP, length 120
23:28:19.457638 IP 192.168.43.124.8880 > 192.168.43.195.7771: UDP, length 120
23:28:19.465880 IP 192.168.43.195.8880 > 192.168.43.124.7772: UDP, length 120
23:28:19.507639 IP 192.168.43.124.8880 > 192.168.43.195.7771: UDP, length 120
23:28:19.517050 IP 192.168.43.195.8880 > 192.168.43.124.7772: UDP, length 120
23:28:19.557639 IP 192.168.43.124.8880 > 192.168.43.195.7771: UDP, length 120
23:28:19.587889 IP 192.168.43.195.8880 > 192.168.43.124.7772: UDP, length 120
23:28:19.607597 IP 192.168.43.124.8880 > 192.168.43.195.7771: UDP, length 120
23:28:19.615901 IP 192.168.43.195.8880 > 192.168.43.124.7772: UDP, length 120
23:28:19.657599 IP 192.168.43.124.8880 > 192.168.43.195.7771: UDP, length 120
23:28:19.666680 IP 192.168.43.195.8880 > 192.168.43.124.7772: UDP, length 120
23:28:19.707629 IP 192.168.43.124.8880 > 192.168.43.195.7771: UDP, length 120
23:28:19.716447 IP 192.168.43.195.8880 > 192.168.43.124.7772: UDP, length 120
23:28:19.757629 IP 192.168.43.124.8880 > 192.168.43.195.7771: UDP, length 120
23:28:19.769725 IP 192.168.43.195.8880 > 192.168.43.124.7772: UDP, length 120
23:28:19.807631 IP 192.168.43.124.8880 > 192.168.43.195.7771: UDP, length 120
23:28:19.818507 IP 192.168.43.195.8880 > 192.168.43.124.7772: UDP, length 120
23:28:19.857627 IP 192.168.43.124.8880 > 192.168.43.195.7771: UDP, length 120
23:28:19.865809 IP 192.168.43.195.8880 > 192.168.43.124.7772: UDP, length 120
23:28:19.907597 IP 192.168.43.124.8880 > 192.168.43.195.7771: UDP, length 120
23:28:19.919818 IP 192.168.43.195.8880 > 192.168.43.124.7772: UDP, length 120
23:28:19.957631 IP 192.168.43.124.8880 > 192.168.43.195.7771: UDP, length 120
23:28:19.968246 IP 192.168.43.195.8880 > 192.168.43.124.7772: UDP, length 120
23:28:20.007631 IP 192.168.43.124.8880 > 192.168.43.195.7771: UDP, length 120
23:28:20.025427 IP 192.168.43.195.8880 > 192.168.43.124.7772: UDP, length 120
23:28:20.057630 IP 192.168.43.124.8880 > 192.168.43.195.7771: UDP, length 120
23:28:20.081994 IP 192.168.43.195.8880 > 192.168.43.124.7772: UDP, length 120
23:28:20.107689 IP 192.168.43.124.8880 > 192.168.43.195.7771: UDP, length 120
23:28:20.127143 IP 192.168.43.195.8880 > 192.168.43.124.7772: UDP, length 120
23:28:20.157687 IP 192.168.43.124.8880 > 192.168.43.195.7771: UDP, length 120
23:28:20.168548 IP 192.168.43.195.8880 > 192.168.43.124.7772: UDP, length 120
23:28:20.207683 IP 192.168.43.124.8880 > 192.168.43.195.7771: UDP, length 120
23:28:20.220370 IP 192.168.43.195.8880 > 192.168.43.124.7772: UDP, length 120
23:28:20.257685 IP 192.168.43.124.8880 > 192.168.43.195.7771: UDP, length 120
23:28:20.271554 IP 192.168.43.195.8880 > 192.168.43.124.7772: UDP, length 120
23:28:20.307685 IP 192.168.43.124.8880 > 192.168.43.195.7771: UDP, length 120
23:28:20.317399 IP 192.168.43.195.8880 > 192.168.43.124.7772: UDP, length 120
23:28:20.357686 IP 192.168.43.124.8880 > 192.168.43.195.7771: UDP, length 120
23:28:20.366888 IP 192.168.43.195.8880 > 192.168.43.124.7772: UDP, length 120
23:28:20.407686 IP 192.168.43.124.8880 > 192.168.43.195.7771: UDP, length 120
23:28:20.416958 IP 192.168.43.195.8880 > 192.168.43.124.7772: UDP, length 120
23:28:20.457685 IP 192.168.43.124.8880 > 192.168.43.195.7771: UDP, length 120
23:28:20.470517 IP 192.168.43.195.8880 > 192.168.43.124.7772: UDP, length 120
23:28:20.507686 IP 192.168.43.124.8880 > 192.168.43.195.7771: UDP, length 120
23:28:20.519502 IP 192.168.43.195.8880 > 192.168.43.124.7772: UDP, length 120
23:28:20.557683 IP 192.168.43.124.8880 > 192.168.43.195.7771: UDP, length 120
23:28:20.566524 IP 192.168.43.195.8880 > 192.168.43.124.7772: UDP, length 120
23:28:20.607632 IP 192.168.43.124.8880 > 192.168.43.195.7771: UDP, length 120
23:28:20.640915 IP 192.168.43.195.8880 > 192.168.43.124.7772: UDP, length 120
23:28:20.657630 IP 192.168.43.124.8880 > 192.168.43.195.7771: UDP, length 120
23:28:20.665866 IP 192.168.43.195.8880 > 192.168.43.124.7772: UDP, length 120
23:28:20.707628 IP 192.168.43.124.8880 > 192.168.43.195.7771: UDP, length 120
23:28:20.716058 IP 192.168.43.195.8880 > 192.168.43.124.7772: UDP, length 120
23:28:20.758239 IP 192.168.43.124.8880 > 192.168.43.195.7771: UDP, length 120
23:28:20.766560 IP 192.168.43.195.8880 > 192.168.43.124.7772: UDP, length 120
23:28:20.807634 IP 192.168.43.124.8880 > 192.168.43.195.7771: UDP, length 120
23:28:20.824514 IP 192.168.43.195.8880 > 192.168.43.124.7772: UDP, length 120
23:28:20.857631 IP 192.168.43.124.8880 > 192.168.43.195.7771: UDP, length 120
23:28:20.867369 IP 192.168.43.195.8880 > 192.168.43.124.7772: UDP, length 120
23:28:20.907632 IP 192.168.43.124.8880 > 192.168.43.195.7771: UDP, length 120
23:28:20.916414 IP 192.168.43.195.8880 > 192.168.43.124.7772: UDP, length 120
23:28:20.957633 IP 192.168.43.124.8880 > 192.168.43.195.7771: UDP, length 120
23:28:20.989006 IP 192.168.43.195.8880 > 192.168.43.124.7772: UDP, length 120
23:28:21.007637 IP 192.168.43.124.8880 > 192.168.43.195.7771: UDP, length 120
23:28:21.017359 IP 192.168.43.195.8880 > 192.168.43.124.7772: UDP, length 120
23:28:21.057637 IP 192.168.43.124.8880 > 192.168.43.195.7771: UDP, length 120
23:28:21.068934 IP 192.168.43.195.8880 > 192.168.43.124.7772: UDP, length 120
23:28:21.107634 IP 192.168.43.124.8880 > 192.168.43.195.7771: UDP, length 120
23:28:21.116940 IP 192.168.43.195.8880 > 192.168.43.124.7772: UDP, length 120
23:28:21.157633 IP 192.168.43.124.8880 > 192.168.43.195.7771: UDP, length 120
23:28:21.173125 IP 192.168.43.195.8880 > 192.168.43.124.7772: UDP, length 120
23:28:21.207632 IP 192.168.43.124.8880 > 192.168.43.195.7771: UDP, length 120
23:28:21.216681 IP 192.168.43.195.8880 > 192.168.43.124.7772: UDP, length 120
23:28:21.257685 IP 192.168.43.124.8880 > 192.168.43.195.7771: UDP, length 120
23:28:21.270338 IP 192.168.43.195.8880 > 192.168.43.124.7772: UDP, length 120
23:28:21.307685 IP 192.168.43.124.8880 > 192.168.43.195.7771: UDP, length 120
23:28:21.322955 IP 192.168.43.195.8880 > 192.168.43.124.7772: UDP, length 120
23:28:21.357684 IP 192.168.43.124.8880 > 192.168.43.195.7771: UDP, length 120
23:28:21.367647 IP 192.168.43.195.8880 > 192.168.43.124.7772: UDP, length 120
23:28:21.407688 IP 192.168.43.124.8880 > 192.168.43.195.7771: UDP, length 120
23:28:21.418799 IP 192.168.43.195.8880 > 192.168.43.124.7772: UDP, length 120
23:28:21.457689 IP 192.168.43.124.8880 > 192.168.43.195.7771: UDP, length 120
23:28:21.484947 IP 192.168.43.195.8880 > 192.168.43.124.7772: UDP, length 120
23:28:21.507685 IP 192.168.43.124.8880 > 192.168.43.195.7771: UDP, length 120
23:28:21.517085 IP 192.168.43.195.8880 > 192.168.43.124.7772: UDP, length 120
23:28:21.557630 IP 192.168.43.124.8880 > 192.168.43.195.7771: UDP, length 120
23:28:21.565871 IP 192.168.43.195.8880 > 192.168.43.124.7772: UDP, length 120
23:28:21.607599 IP 192.168.43.124.8880 > 192.168.43.195.7771: UDP, length 120
23:28:21.616019 IP 192.168.43.195.8880 > 192.168.43.124.7772: UDP, length 120
23:28:21.657628 IP 192.168.43.124.8880 > 192.168.43.195.7771: UDP, length 120
23:28:21.669818 IP 192.168.43.195.8880 > 192.168.43.124.7772: UDP, length 120
23:28:21.707628 IP 192.168.43.124.8880 > 192.168.43.195.7771: UDP, length 120
23:28:21.716577 IP 192.168.43.195.8880 > 192.168.43.124.7772: UDP, length 120
23:28:21.757631 IP 192.168.43.124.8880 > 192.168.43.195.7771: UDP, length 120
23:28:21.766292 IP 192.168.43.195.8880 > 192.168.43.124.7772: UDP, length 120
23:28:21.807633 IP 192.168.43.124.8880 > 192.168.43.195.7771: UDP, length 120
23:28:21.857628 IP 192.168.43.124.8880 > 192.168.43.195.7771: UDP, length 120
23:28:21.891185 IP 192.168.43.195.8880 > 192.168.43.124.7772: UDP, length 120
23:28:21.894722 IP 192.168.43.195.8880 > 192.168.43.124.7772: UDP, length 120
23:28:21.907631 IP 192.168.43.124.8880 > 192.168.43.195.7771: UDP, length 120
23:28:21.921375 IP 192.168.43.195.8880 > 192.168.43.124.7772: UDP, length 120
23:28:21.957629 IP 192.168.43.124.8880 > 192.168.43.195.7771: UDP, length 120
23:28:21.968817 IP 192.168.43.195.8880 > 192.168.43.124.7772: UDP, length 120
23:28:22.007629 IP 192.168.43.124.8880 > 192.168.43.195.7771: UDP, length 120
23:28:22.022479 IP 192.168.43.195.8880 > 192.168.43.124.7772: UDP, length 120
23:28:22.057630 IP 192.168.43.124.8880 > 192.168.43.195.7771: UDP, length 120
23:28:22.070845 IP 192.168.43.195.8880 > 192.168.43.124.7772: UDP, length 120
23:28:22.107599 IP 192.168.43.124.8880 > 192.168.43.195.7771: UDP, length 120
23:28:22.121055 IP 192.168.43.195.8880 > 192.168.43.124.7772: UDP, length 120
23:28:22.157629 IP 192.168.43.124.8880 > 192.168.43.195.7771: UDP, length 120
23:28:22.170145 IP 192.168.43.195.8880 > 192.168.43.124.7772: UDP, length 120
23:28:22.207630 IP 192.168.43.124.8880 > 192.168.43.195.7771: UDP, length 120
23:28:22.219839 IP 192.168.43.195.8880 > 192.168.43.124.7772: UDP, length 120
23:28:22.257631 IP 192.168.43.124.8880 > 192.168.43.195.7771: UDP, length 120
23:28:22.291629 IP 192.168.43.195.8880 > 192.168.43.124.7772: UDP, length 120
23:28:22.307566 IP 192.168.43.124.8880 > 192.168.43.195.7771: UDP, length 120
23:28:22.319543 IP 192.168.43.195.8880 > 192.168.43.124.7772: UDP, length 120
23:28:22.357577 IP 192.168.43.124.8880 > 192.168.43.195.7771: UDP, length 120
23:28:22.378378 IP 192.168.43.195.8880 > 192.168.43.124.7772: UDP, length 120
23:28:22.407631 IP 192.168.43.124.8880 > 192.168.43.195.7771: UDP, length 120
23:28:22.422172 IP 192.168.43.195.8880 > 192.168.43.124.7772: UDP, length 120
23:28:22.457629 IP 192.168.43.124.8880 > 192.168.43.195.7771: UDP, length 120
23:28:22.479699 IP 192.168.43.195.8880 > 192.168.43.124.7772: UDP, length 120
23:28:22.507629 IP 192.168.43.124.8880 > 192.168.43.195.7771: UDP, length 120
23:28:22.519061 IP 192.168.43.195.8880 > 192.168.43.124.7772: UDP, length 120
23:28:22.557625 IP 192.168.43.124.8880 > 192.168.43.195.7771: UDP, length 120
23:28:22.567968 IP 192.168.43.195.8880 > 192.168.43.124.7772: UDP, length 120
23:28:22.607584 IP 192.168.43.124.8880 > 192.168.43.195.7771: UDP, length 120
23:28:22.638371 IP 192.168.43.195.8880 > 192.168.43.124.7772: UDP, length 120
23:28:22.657630 IP 192.168.43.124.8880 > 192.168.43.195.7771: UDP, length 120
23:28:22.666044 IP 192.168.43.195.8880 > 192.168.43.124.7772: UDP, length 120
23:28:22.707633 IP 192.168.43.124.8880 > 192.168.43.195.7771: UDP, length 120
23:28:22.720197 IP 192.168.43.195.8880 > 192.168.43.124.7772: UDP, length 120
23:28:22.757628 IP 192.168.43.124.8880 > 192.168.43.195.7771: UDP, length 120
23:28:22.772414 IP 192.168.43.195.8880 > 192.168.43.124.7772: UDP, length 120
23:28:22.807633 IP 192.168.43.124.8880 > 192.168.43.195.7771: UDP, length 120
23:28:22.819875 IP 192.168.43.195.8880 > 192.168.43.124.7772: UDP, length 120
23:28:22.857627 IP 192.168.43.124.8880 > 192.168.43.195.7771: UDP, length 120
23:28:22.870922 IP 192.168.43.195.8880 > 192.168.43.124.7772: UDP, length 120
23:28:22.907629 IP 192.168.43.124.8880 > 192.168.43.195.7771: UDP, length 120
23:28:22.918959 IP 192.168.43.195.8880 > 192.168.43.124.7772: UDP, length 120
23:28:22.957627 IP 192.168.43.124.8880 > 192.168.43.195.7771: UDP, length 120
23:28:22.988155 IP 192.168.43.195.8880 > 192.168.43.124.7772: UDP, length 120
23:28:23.007628 IP 192.168.43.124.8880 > 192.168.43.195.7771: UDP, length 120
23:28:23.034719 IP 192.168.43.195.8880 > 192.168.43.124.7772: UDP, length 120
23:28:23.057631 IP 192.168.43.124.8880 > 192.168.43.195.7771: UDP, length 120
23:28:23.069131 IP 192.168.43.195.8880 > 192.168.43.124.7772: UDP, length 120
23:28:23.107633 IP 192.168.43.124.8880 > 192.168.43.195.7771: UDP, length 120
23:28:23.117420 IP 192.168.43.195.8880 > 192.168.43.124.7772: UDP, length 120
23:28:23.157632 IP 192.168.43.124.8880 > 192.168.43.195.7771: UDP, length 120
23:28:23.169872 IP 192.168.43.195.8880 > 192.168.43.124.7772: UDP, length 120
23:28:23.207683 IP 192.168.43.124.8880 > 192.168.43.195.7771: UDP, length 120
23:28:23.222483 IP 192.168.43.195.8880 > 192.168.43.124.7772: UDP, length 120
23:28:23.257636 IP 192.168.43.124.8880 > 192.168.43.195.7771: UDP, length 120
23:28:23.269834 IP 192.168.43.195.8880 > 192.168.43.124.7772: UDP, length 120
23:28:23.307630 IP 192.168.43.124.8880 > 192.168.43.195.7771: UDP, length 120
23:28:23.337535 IP 192.168.43.195.8880 > 192.168.43.124.7772: UDP, length 120
23:28:23.357630 IP 192.168.43.124.8880 > 192.168.43.195.7771: UDP, length 120
23:28:23.365608 IP 192.168.43.195.8880 > 192.168.43.124.7772: UDP, length 120
23:28:23.407629 IP 192.168.43.124.8880 > 192.168.43.195.7771: UDP, length 120
23:28:23.426132 IP 192.168.43.195.8880 > 192.168.43.124.7772: UDP, length 120
23:28:23.457630 IP 192.168.43.124.8880 > 192.168.43.195.7771: UDP, length 120
23:28:23.469598 IP 192.168.43.195.8880 > 192.168.43.124.7772: UDP, length 120
23:28:23.507632 IP 192.168.43.124.8880 > 192.168.43.195.7771: UDP, length 120
23:28:23.522876 IP 192.168.43.195.8880 > 192.168.43.124.7772: UDP, length 120
23:28:23.557634 IP 192.168.43.124.8880 > 192.168.43.195.7771: UDP, length 120
23:28:23.568895 IP 192.168.43.195.8880 > 192.168.43.124.7772: UDP, length 120
23:28:23.607596 IP 192.168.43.124.8880 > 192.168.43.195.7771: UDP, length 120
23:28:23.630501 IP 192.168.43.195.8880 > 192.168.43.124.7772: UDP, length 120
23:28:23.657629 IP 192.168.43.124.8880 > 192.168.43.195.7771: UDP, length 120
23:28:23.684413 IP 192.168.43.195.8880 > 192.168.43.124.7772: UDP, length 120
23:28:23.707626 IP 192.168.43.124.8880 > 192.168.43.195.7771: UDP, length 120
23:28:23.715661 IP 192.168.43.195.8880 > 192.168.43.124.7772: UDP, length 120
23:28:23.757579 IP 192.168.43.124.8880 > 192.168.43.195.7771: UDP, length 120
23:28:23.769229 IP 192.168.43.195.8880 > 192.168.43.124.7772: UDP, length 120
23:28:23.807633 IP 192.168.43.124.8880 > 192.168.43.195.7771: UDP, length 120
23:28:23.815904 IP 192.168.43.195.8880 > 192.168.43.124.7772: UDP, length 120
23:28:23.857627 IP 192.168.43.124.8880 > 192.168.43.195.7771: UDP, length 120
23:28:23.868864 IP 192.168.43.195.8880 > 192.168.43.124.7772: UDP, length 120
23:28:23.907633 IP 192.168.43.124.8880 > 192.168.43.195.7771: UDP, length 120
23:28:23.918938 IP 192.168.43.195.8880 > 192.168.43.124.7772: UDP, length 120
23:28:23.957627 IP 192.168.43.124.8880 > 192.168.43.195.7771: UDP, length 120
23:28:23.969541 IP 192.168.43.195.8880 > 192.168.43.124.7772: UDP, length 120
23:28:24.007632 IP 192.168.43.124.8880 > 192.168.43.195.7771: UDP, length 120
23:28:24.028778 IP 192.168.43.195.8880 > 192.168.43.124.7772: UDP, length 120
23:28:24.057630 IP 192.168.43.124.8880 > 192.168.43.195.7771: UDP, length 120
23:28:24.069550 IP 192.168.43.195.8880 > 192.168.43.124.7772: UDP, length 120
23:28:24.107629 IP 192.168.43.124.8880 > 192.168.43.195.7771: UDP, length 120
23:28:24.121521 IP 192.168.43.195.8880 > 192.168.43.124.7772: UDP, length 120
23:28:24.157628 IP 192.168.43.124.8880 > 192.168.43.195.7771: UDP, length 120
23:28:24.169154 IP 192.168.43.195.8880 > 192.168.43.124.7772: UDP, length 120
23:28:24.207684 IP 192.168.43.124.8880 > 192.168.43.195.7771: UDP, length 120
23:28:24.221940 IP 192.168.43.195.8880 > 192.168.43.124.7772: UDP, length 120
23:28:24.257691 IP 192.168.43.124.8880 > 192.168.43.195.7771: UDP, length 120
23:28:24.269396 IP 192.168.43.195.8880 > 192.168.43.124.7772: UDP, length 120
23:28:24.307690 IP 192.168.43.124.8880 > 192.168.43.195.7771: UDP, length 120
23:28:24.324136 IP 192.168.43.195.8880 > 192.168.43.124.7772: UDP, length 120
23:28:24.357691 IP 192.168.43.124.8880 > 192.168.43.195.7771: UDP, length 120
23:28:24.407645 IP 192.168.43.124.8880 > 192.168.43.195.7771: UDP, length 120
23:28:24.420825 IP 192.168.43.195.8880 > 192.168.43.124.7772: UDP, length 120
23:28:24.420850 IP 192.168.43.195.8880 > 192.168.43.124.7772: UDP, length 120
23:28:24.457691 IP 192.168.43.124.8880 > 192.168.43.195.7771: UDP, length 120
23:28:24.470142 IP 192.168.43.195.8880 > 192.168.43.124.7772: UDP, length 120
23:28:24.507685 IP 192.168.43.124.8880 > 192.168.43.195.7771: UDP, length 120
23:28:24.525676 IP 192.168.43.195.8880 > 192.168.43.124.7772: UDP, length 120
23:28:24.557689 IP 192.168.43.124.8880 > 192.168.43.195.7771: UDP, length 120
23:28:24.584325 IP 192.168.43.195.8880 > 192.168.43.124.7772: UDP, length 120
23:28:24.607635 IP 192.168.43.124.8880 > 192.168.43.195.7771: UDP, length 120
23:28:24.615850 IP 192.168.43.195.8880 > 192.168.43.124.7772: UDP, length 120
23:28:24.657637 IP 192.168.43.124.8880 > 192.168.43.195.7771: UDP, length 120
23:28:24.669772 IP 192.168.43.195.8880 > 192.168.43.124.7772: UDP, length 120
23:28:24.707635 IP 192.168.43.124.8880 > 192.168.43.195.7771: UDP, length 120
23:28:24.718034 IP 192.168.43.195.8880 > 192.168.43.124.7772: UDP, length 120
23:28:24.757637 IP 192.168.43.124.8880 > 192.168.43.195.7771: UDP, length 120
23:28:24.769583 IP 192.168.43.195.8880 > 192.168.43.124.7772: UDP, length 120
23:28:24.807646 IP 192.168.43.124.8880 > 192.168.43.195.7771: UDP, length 120
23:28:24.822627 IP 192.168.43.195.8880 > 192.168.43.124.7772: UDP, length 120
23:28:24.857638 IP 192.168.43.124.8880 > 192.168.43.195.7771: UDP, length 120
23:28:24.868569 IP 192.168.43.195.8880 > 192.168.43.124.7772: UDP, length 120
23:28:24.907634 IP 192.168.43.124.8880 > 192.168.43.195.7771: UDP, length 120
23:28:24.919540 IP 192.168.43.195.8880 > 192.168.43.124.7772: UDP, length 120
23:28:24.957587 IP 192.168.43.124.8880 > 192.168.43.195.7771: UDP, length 120
23:28:24.967825 IP 192.168.43.195.8880 > 192.168.43.124.7772: UDP, length 120
23:28:25.007634 IP 192.168.43.124.8880 > 192.168.43.195.7771: UDP, length 120
23:28:25.016337 IP 192.168.43.195.8880 > 192.168.43.124.7772: UDP, length 120
23:28:25.057632 IP 192.168.43.124.8880 > 192.168.43.195.7771: UDP, length 120
23:28:25.083069 IP 192.168.43.195.8880 > 192.168.43.124.7772: UDP, length 120
23:28:25.107694 IP 192.168.43.124.8880 > 192.168.43.195.7771: UDP, length 120
23:28:25.116154 IP 192.168.43.195.8880 > 192.168.43.124.7772: UDP, length 120
23:28:25.157687 IP 192.168.43.124.8880 > 192.168.43.195.7771: UDP, length 120
23:28:25.169942 IP 192.168.43.195.8880 > 192.168.43.124.7772: UDP, length 120
23:28:25.207732 IP 192.168.43.124.8880 > 192.168.43.195.7771: UDP, length 120
23:28:25.217807 IP 192.168.43.195.8880 > 192.168.43.124.7772: UDP, length 120
23:28:25.258353 IP 192.168.43.124.8880 > 192.168.43.195.7771: UDP, length 120
23:28:25.271749 IP 192.168.43.195.8880 > 192.168.43.124.7772: UDP, length 120
23:28:25.307638 IP 192.168.43.124.8880 > 192.168.43.195.7771: UDP, length 120
23:28:25.318463 IP 192.168.43.195.8880 > 192.168.43.124.7772: UDP, length 120
23:28:25.357692 IP 192.168.43.124.8880 > 192.168.43.195.7771: UDP, length 120
23:28:25.371058 IP 192.168.43.195.8880 > 192.168.43.124.7772: UDP, length 120
23:28:25.407692 IP 192.168.43.124.8880 > 192.168.43.195.7771: UDP, length 120
23:28:25.416196 IP 192.168.43.195.8880 > 192.168.43.124.7772: UDP, length 120
23:28:25.458399 IP 192.168.43.124.8880 > 192.168.43.195.7771: UDP, length 120
23:28:25.468436 IP 192.168.43.195.8880 > 192.168.43.124.7772: UDP, length 120
23:28:25.507688 IP 192.168.43.124.8880 > 192.168.43.195.7771: UDP, length 120
23:28:25.516134 IP 192.168.43.195.8880 > 192.168.43.124.7772: UDP, length 120
23:28:25.557732 IP 192.168.43.124.8880 > 192.168.43.195.7771: UDP, length 120
23:28:25.577620 IP 192.168.43.195.8880 > 192.168.43.124.7772: UDP, length 120
23:28:25.607860 IP 192.168.43.124.8880 > 192.168.43.195.7771: UDP, length 120
23:28:25.617991 IP 192.168.43.195.8880 > 192.168.43.124.7772: UDP, length 120
23:28:25.657631 IP 192.168.43.124.8880 > 192.168.43.195.7771: UDP, length 120
23:28:25.680339 IP 192.168.43.195.8880 > 192.168.43.124.7772: UDP, length 120
23:28:25.707635 IP 192.168.43.124.8880 > 192.168.43.195.7771: UDP, length 120
23:28:25.717895 IP 192.168.43.195.8880 > 192.168.43.124.7772: UDP, length 120
23:28:25.757633 IP 192.168.43.124.8880 > 192.168.43.195.7771: UDP, length 120
23:28:25.773019 IP 192.168.43.195.8880 > 192.168.43.124.7772: UDP, length 120
23:28:25.807687 IP 192.168.43.124.8880 > 192.168.43.195.7771: UDP, length 120
23:28:25.818899 IP 192.168.43.195.8880 > 192.168.43.124.7772: UDP, length 120
23:28:25.857687 IP 192.168.43.124.8880 > 192.168.43.195.7771: UDP, length 120
23:28:25.867973 IP 192.168.43.195.8880 > 192.168.43.124.7772: UDP, length 120
23:28:25.907690 IP 192.168.43.124.8880 > 192.168.43.195.7771: UDP, length 120
23:28:25.923923 IP 192.168.43.195.8880 > 192.168.43.124.7772: UDP, length 120
23:28:25.958403 IP 192.168.43.124.8880 > 192.168.43.195.7771: UDP, length 120
23:28:25.969403 IP 192.168.43.195.8880 > 192.168.43.124.7772: UDP, length 120
23:28:26.007688 IP 192.168.43.124.8880 > 192.168.43.195.7771: UDP, length 120
23:28:26.017634 IP 192.168.43.195.8880 > 192.168.43.124.7772: UDP, length 120
23:28:26.057886 IP 192.168.43.124.8880 > 192.168.43.195.7771: UDP, length 120
23:28:26.068129 IP 192.168.43.195.8880 > 192.168.43.124.7772: UDP, length 120
23:28:26.107643 IP 192.168.43.124.8880 > 192.168.43.195.7771: UDP, length 120
23:28:26.117793 IP 192.168.43.195.8880 > 192.168.43.124.7772: UDP, length 120
23:28:26.157637 IP 192.168.43.124.8880 > 192.168.43.195.7771: UDP, length 120
23:28:26.168769 IP 192.168.43.195.8880 > 192.168.43.124.7772: UDP, length 120
23:28:26.207639 IP 192.168.43.124.8880 > 192.168.43.195.7771: UDP, length 120
23:28:26.218189 IP 192.168.43.195.8880 > 192.168.43.124.7772: UDP, length 120
23:28:26.257686 IP 192.168.43.124.8880 > 192.168.43.195.7771: UDP, length 120
23:28:26.270798 IP 192.168.43.195.8880 > 192.168.43.124.7772: UDP, length 120
23:28:26.307888 IP 192.168.43.124.8880 > 192.168.43.195.7771: UDP, length 120
23:28:26.319120 IP 192.168.43.195.8880 > 192.168.43.124.7772: UDP, length 120
23:28:26.357732 IP 192.168.43.124.8880 > 192.168.43.195.7771: UDP, length 120
23:28:26.373367 IP 192.168.43.195.8880 > 192.168.43.124.7772: UDP, length 120
23:28:26.407689 IP 192.168.43.124.8880 > 192.168.43.195.7771: UDP, length 120
23:28:26.417596 IP 192.168.43.195.8880 > 192.168.43.124.7772: UDP, length 120
23:28:26.457693 IP 192.168.43.124.8880 > 192.168.43.195.7771: UDP, length 120
23:28:26.476277 IP 192.168.43.195.8880 > 192.168.43.124.7772: UDP, length 120
23:28:26.507891 IP 192.168.43.124.8880 > 192.168.43.195.7771: UDP, length 120
23:28:26.520720 IP 192.168.43.195.8880 > 192.168.43.124.7772: UDP, length 120
23:28:26.557690 IP 192.168.43.124.8880 > 192.168.43.195.7771: UDP, length 120
23:28:26.571250 IP 192.168.43.195.8880 > 192.168.43.124.7772: UDP, length 120
23:28:26.607636 IP 192.168.43.124.8880 > 192.168.43.195.7771: UDP, length 120
23:28:26.629628 IP 192.168.43.195.8880 > 192.168.43.124.7772: UDP, length 120
23:28:26.657639 IP 192.168.43.124.8880 > 192.168.43.195.7771: UDP, length 120
23:28:26.670490 IP 192.168.43.195.8880 > 192.168.43.124.7772: UDP, length 120
23:28:26.707637 IP 192.168.43.124.8880 > 192.168.43.195.7771: UDP, length 120
23:28:26.718280 IP 192.168.43.195.8880 > 192.168.43.124.7772: UDP, length 120
23:28:26.757634 IP 192.168.43.124.8880 > 192.168.43.195.7771: UDP, length 120
23:28:26.768390 IP 192.168.43.195.8880 > 192.168.43.124.7772: UDP, length 120
23:28:26.807641 IP 192.168.43.124.8880 > 192.168.43.195.7771: UDP, length 120
23:28:26.818562 IP 192.168.43.195.8880 > 192.168.43.124.7772: UDP, length 120
23:28:26.857636 IP 192.168.43.124.8880 > 192.168.43.195.7771: UDP, length 120
23:28:26.867213 IP 192.168.43.195.8880 > 192.168.43.124.7772: UDP, length 120
23:28:26.907640 IP 192.168.43.124.8880 > 192.168.43.195.7771: UDP, length 120
23:28:26.918907 IP 192.168.43.195.8880 > 192.168.43.124.7772: UDP, length 120
23:28:26.957638 IP 192.168.43.124.8880 > 192.168.43.195.7771: UDP, length 120
23:28:26.968391 IP 192.168.43.195.8880 > 192.168.43.124.7772: UDP, length 120
23:28:27.007637 IP 192.168.43.124.8880 > 192.168.43.195.7771: UDP, length 120
23:28:27.017339 IP 192.168.43.195.8880 > 192.168.43.124.7772: UDP, length 120
23:28:27.057635 IP 192.168.43.124.8880 > 192.168.43.195.7771: UDP, length 120
23:28:27.072367 IP 192.168.43.195.8880 > 192.168.43.124.7772: UDP, length 120
23:28:27.107603 IP 192.168.43.124.8880 > 192.168.43.195.7771: UDP, length 120
23:28:27.120342 IP 192.168.43.195.8880 > 192.168.43.124.7772: UDP, length 120
23:28:27.157637 IP 192.168.43.124.8880 > 192.168.43.195.7771: UDP, length 120
23:28:27.168526 IP 192.168.43.195.8880 > 192.168.43.124.7772: UDP, length 120
23:28:27.207634 IP 192.168.43.124.8880 > 192.168.43.195.7771: UDP, length 120
23:28:27.219196 IP 192.168.43.195.8880 > 192.168.43.124.7772: UDP, length 120
23:28:27.257689 IP 192.168.43.124.8880 > 192.168.43.195.7771: UDP, length 120
23:28:27.269691 IP 192.168.43.195.8880 > 192.168.43.124.7772: UDP, length 120
23:28:27.308735 IP 192.168.43.124.8880 > 192.168.43.195.7771: UDP, length 120
23:28:27.320243 IP 192.168.43.195.8880 > 192.168.43.124.7772: UDP, length 120
23:28:27.358097 IP 192.168.43.124.8880 > 192.168.43.195.7771: UDP, length 120
23:28:27.369152 IP 192.168.43.195.8880 > 192.168.43.124.7772: UDP, length 120
23:28:27.407572 IP 192.168.43.124.8880 > 192.168.43.195.7771: UDP, length 120
23:28:27.422071 IP 192.168.43.195.8880 > 192.168.43.124.7772: UDP, length 120
23:28:27.457553 IP 192.168.43.124.8880 > 192.168.43.195.7771: UDP, length 120
23:28:27.469476 IP 192.168.43.195.8880 > 192.168.43.124.7772: UDP, length 120
23:28:27.507587 IP 192.168.43.124.8880 > 192.168.43.195.7771: UDP, length 120
23:28:27.524332 IP 192.168.43.195.8880 > 192.168.43.124.7772: UDP, length 120
23:28:27.557633 IP 192.168.43.124.8880 > 192.168.43.195.7771: UDP, length 120
23:28:27.565952 IP 192.168.43.195.8880 > 192.168.43.124.7772: UDP, length 120
23:28:27.607636 IP 192.168.43.124.8880 > 192.168.43.195.7771: UDP, length 120
23:28:27.618397 IP 192.168.43.195.8880 > 192.168.43.124.7772: UDP, length 120
23:28:27.657630 IP 192.168.43.124.8880 > 192.168.43.195.7771: UDP, length 120
23:28:27.665217 IP 192.168.43.195.8880 > 192.168.43.124.7772: UDP, length 120
23:28:27.707631 IP 192.168.43.124.8880 > 192.168.43.195.7771: UDP, length 120
23:28:27.715309 IP 192.168.43.195.8880 > 192.168.43.124.7772: UDP, length 120
23:28:27.757633 IP 192.168.43.124.8880 > 192.168.43.195.7771: UDP, length 120
23:28:27.767281 IP 192.168.43.195.8880 > 192.168.43.124.7772: UDP, length 120
23:28:27.807632 IP 192.168.43.124.8880 > 192.168.43.195.7771: UDP, length 120
23:28:27.820829 IP 192.168.43.195.8880 > 192.168.43.124.7772: UDP, length 120
23:28:27.857630 IP 192.168.43.124.8880 > 192.168.43.195.7771: UDP, length 120
23:28:27.869876 IP 192.168.43.195.8880 > 192.168.43.124.7772: UDP, length 120
23:28:27.907593 IP 192.168.43.124.8880 > 192.168.43.195.7771: UDP, length 120
23:28:27.919553 IP 192.168.43.195.8880 > 192.168.43.124.7772: UDP, length 120
23:28:27.957631 IP 192.168.43.124.8880 > 192.168.43.195.7771: UDP, length 120
23:28:27.967234 IP 192.168.43.195.8880 > 192.168.43.124.7772: UDP, length 120
23:28:28.007632 IP 192.168.43.124.8880 > 192.168.43.195.7771: UDP, length 120
23:28:28.017724 IP 192.168.43.195.8880 > 192.168.43.124.7772: UDP, length 120
23:28:28.057633 IP 192.168.43.124.8880 > 192.168.43.195.7771: UDP, length 120
23:28:28.075449 IP 192.168.43.195.8880 > 192.168.43.124.7772: UDP, length 120
23:28:28.107631 IP 192.168.43.124.8880 > 192.168.43.195.7771: UDP, length 120
23:28:28.117263 IP 192.168.43.195.8880 > 192.168.43.124.7772: UDP, length 120
23:28:28.157632 IP 192.168.43.124.8880 > 192.168.43.195.7771: UDP, length 120
23:28:28.168342 IP 192.168.43.195.8880 > 192.168.43.124.7772: UDP, length 120
23:28:28.207635 IP 192.168.43.124.8880 > 192.168.43.195.7771: UDP, length 120
23:28:28.230392 IP 192.168.43.195.8880 > 192.168.43.124.7772: UDP, length 120
23:28:28.257633 IP 192.168.43.124.8880 > 192.168.43.195.7771: UDP, length 120
23:28:28.273434 IP 192.168.43.195.8880 > 192.168.43.124.7772: UDP, length 120
23:28:28.307689 IP 192.168.43.124.8880 > 192.168.43.195.7771: UDP, length 120
23:28:28.320973 IP 192.168.43.195.8880 > 192.168.43.124.7772: UDP, length 120
23:28:28.358401 IP 192.168.43.124.8880 > 192.168.43.195.7771: UDP, length 120
23:28:28.367468 IP 192.168.43.195.8880 > 192.168.43.124.7772: UDP, length 120
23:28:28.407691 IP 192.168.43.124.8880 > 192.168.43.195.7771: UDP, length 120
23:28:28.425804 IP 192.168.43.195.8880 > 192.168.43.124.7772: UDP, length 120
23:28:28.457737 IP 192.168.43.124.8880 > 192.168.43.195.7771: UDP, length 120
23:28:28.469521 IP 192.168.43.195.8880 > 192.168.43.124.7772: UDP, length 120
23:28:28.508217 IP 192.168.43.124.8880 > 192.168.43.195.7771: UDP, length 120
23:28:28.525620 IP 192.168.43.195.8880 > 192.168.43.124.7772: UDP, length 120
23:28:28.558278 IP 192.168.43.124.8880 > 192.168.43.195.7771: UDP, length 120
23:28:28.564936 IP 192.168.43.195.8880 > 192.168.43.124.7772: UDP, length 120
23:28:28.607628 IP 192.168.43.124.8880 > 192.168.43.195.7771: UDP, length 120
23:28:28.619087 IP 192.168.43.195.8880 > 192.168.43.124.7772: UDP, length 120
23:28:28.657629 IP 192.168.43.124.8880 > 192.168.43.195.7771: UDP, length 120
23:28:28.667235 IP 192.168.43.195.8880 > 192.168.43.124.7772: UDP, length 120
23:28:28.707569 IP 192.168.43.124.8880 > 192.168.43.195.7771: UDP, length 120
23:28:28.718831 IP 192.168.43.195.8880 > 192.168.43.124.7772: UDP, length 120
23:28:28.757543 IP 192.168.43.124.8880 > 192.168.43.195.7771: UDP, length 120
23:28:28.767440 IP 192.168.43.195.8880 > 192.168.43.124.7772: UDP, length 120
23:28:28.807540 IP 192.168.43.124.8880 > 192.168.43.195.7771: UDP, length 120
23:28:28.819593 IP 192.168.43.195.8880 > 192.168.43.124.7772: UDP, length 120
23:28:28.857628 IP 192.168.43.124.8880 > 192.168.43.195.7771: UDP, length 120
23:28:28.867989 IP 192.168.43.195.8880 > 192.168.43.124.7772: UDP, length 120
23:28:28.907638 IP 192.168.43.124.8880 > 192.168.43.195.7771: UDP, length 120
23:28:28.925380 IP 192.168.43.195.8880 > 192.168.43.124.7772: UDP, length 120
23:28:28.957636 IP 192.168.43.124.8880 > 192.168.43.195.7771: UDP, length 120
23:28:28.967065 IP 192.168.43.195.8880 > 192.168.43.124.7772: UDP, length 120
23:28:29.007594 IP 192.168.43.124.8880 > 192.168.43.195.7771: UDP, length 120
23:28:29.021397 IP 192.168.43.195.8880 > 192.168.43.124.7772: UDP, length 120
23:28:29.057642 IP 192.168.43.124.8880 > 192.168.43.195.7771: UDP, length 120
23:28:29.072700 IP 192.168.43.195.8880 > 192.168.43.124.7772: UDP, length 120
23:28:29.107635 IP 192.168.43.124.8880 > 192.168.43.195.7771: UDP, length 120
23:28:29.120541 IP 192.168.43.195.8880 > 192.168.43.124.7772: UDP, length 120
23:28:29.157636 IP 192.168.43.124.8880 > 192.168.43.195.7771: UDP, length 120
23:28:29.167116 IP 192.168.43.195.8880 > 192.168.43.124.7772: UDP, length 120
23:28:29.207636 IP 192.168.43.124.8880 > 192.168.43.195.7771: UDP, length 120
23:28:29.219162 IP 192.168.43.195.8880 > 192.168.43.124.7772: UDP, length 120
23:28:29.258161 IP 192.168.43.124.8880 > 192.168.43.195.7771: UDP, length 120
23:28:29.267150 IP 192.168.43.195.8880 > 192.168.43.124.7772: UDP, length 120
23:28:29.307642 IP 192.168.43.124.8880 > 192.168.43.195.7771: UDP, length 120
23:28:29.323102 IP 192.168.43.195.8880 > 192.168.43.124.7772: UDP, length 120
23:28:29.357634 IP 192.168.43.124.8880 > 192.168.43.195.7771: UDP, length 120
23:28:29.367376 IP 192.168.43.195.8880 > 192.168.43.124.7772: UDP, length 120
23:28:29.407638 IP 192.168.43.124.8880 > 192.168.43.195.7771: UDP, length 120
23:28:29.423247 IP 192.168.43.195.8880 > 192.168.43.124.7772: UDP, length 120
23:28:29.457636 IP 192.168.43.124.8880 > 192.168.43.195.7771: UDP, length 120
23:28:29.470009 IP 192.168.43.195.8880 > 192.168.43.124.7772: UDP, length 120
23:28:29.507635 IP 192.168.43.124.8880 > 192.168.43.195.7771: UDP, length 120
23:28:29.521947 IP 192.168.43.195.8880 > 192.168.43.124.7772: UDP, length 120
23:28:29.557638 IP 192.168.43.124.8880 > 192.168.43.195.7771: UDP, length 120
23:28:29.574059 IP 192.168.43.195.8880 > 192.168.43.124.7772: UDP, length 120
23:28:29.607644 IP 192.168.43.124.8880 > 192.168.43.195.7771: UDP, length 120
23:28:29.620674 IP 192.168.43.195.8880 > 192.168.43.124.7772: UDP, length 120
23:28:29.657642 IP 192.168.43.124.8880 > 192.168.43.195.7771: UDP, length 120
23:28:29.674701 IP 192.168.43.195.8880 > 192.168.43.124.7772: UDP, length 120
23:28:29.707639 IP 192.168.43.124.8880 > 192.168.43.195.7771: UDP, length 120
23:28:29.722674 IP 192.168.43.195.8880 > 192.168.43.124.7772: UDP, length 120
23:28:29.757640 IP 192.168.43.124.8880 > 192.168.43.195.7771: UDP, length 120
23:28:29.768781 IP 192.168.43.195.8880 > 192.168.43.124.7772: UDP, length 120
23:28:29.807639 IP 192.168.43.124.8880 > 192.168.43.195.7771: UDP, length 120
23:28:29.820450 IP 192.168.43.195.8880 > 192.168.43.124.7772: UDP, length 120
23:28:29.857639 IP 192.168.43.124.8880 > 192.168.43.195.7771: UDP, length 120
23:28:29.868839 IP 192.168.43.195.8880 > 192.168.43.124.7772: UDP, length 120
23:28:29.907688 IP 192.168.43.124.8880 > 192.168.43.195.7771: UDP, length 120
23:28:29.923586 IP 192.168.43.195.8880 > 192.168.43.124.7772: UDP, length 120
23:28:29.957696 IP 192.168.43.124.8880 > 192.168.43.195.7771: UDP, length 120
23:28:29.971765 IP 192.168.43.195.8880 > 192.168.43.124.7772: UDP, length 120
23:28:30.007694 IP 192.168.43.124.8880 > 192.168.43.195.7771: UDP, length 120
23:28:30.020743 IP 192.168.43.195.8880 > 192.168.43.124.7772: UDP, length 120
23:28:30.057697 IP 192.168.43.124.8880 > 192.168.43.195.7771: UDP, length 120
23:28:30.084683 IP 192.168.43.195.8880 > 192.168.43.124.7772: UDP, length 120
23:28:30.107694 IP 192.168.43.124.8880 > 192.168.43.195.7771: UDP, length 120
23:28:30.122632 IP 192.168.43.195.8880 > 192.168.43.124.7772: UDP, length 120
23:28:30.157695 IP 192.168.43.124.8880 > 192.168.43.195.7771: UDP, length 120
23:28:30.167462 IP 192.168.43.195.8880 > 192.168.43.124.7772: UDP, length 120
23:28:30.207695 IP 192.168.43.124.8880 > 192.168.43.195.7771: UDP, length 120
23:28:30.257633 IP 192.168.43.124.8880 > 192.168.43.195.7771: UDP, length 120
23:28:30.307633 IP 192.168.43.124.8880 > 192.168.43.195.7771: UDP, length 120
23:28:30.357639 IP 192.168.43.124.8880 > 192.168.43.195.7771: UDP, length 120
23:28:30.407634 IP 192.168.43.124.8880 > 192.168.43.195.7771: UDP, length 120
23:28:30.457638 IP 192.168.43.124.8880 > 192.168.43.195.7771: UDP, length 120
23:28:30.507635 IP 192.168.43.124.8880 > 192.168.43.195.7771: UDP, length 120
23:28:30.557641 IP 192.168.43.124.8880 > 192.168.43.195.7771: UDP, length 120
23:28:30.607593 IP 192.168.43.124.8880 > 192.168.43.195.7771: UDP, length 120
23:28:30.657638 IP 192.168.43.124.8880 > 192.168.43.195.7771: UDP, length 120
23:28:30.707636 IP 192.168.43.124.8880 > 192.168.43.195.7771: UDP, length 120
23:28:30.757640 IP 192.168.43.124.8880 > 192.168.43.195.7771: UDP, length 120
23:28:30.807549 IP 192.168.43.124.8880 > 192.168.43.195.7771: UDP, length 120
23:28:30.857638 IP 192.168.43.124.8880 > 192.168.43.195.7771: UDP, length 120
23:28:30.907596 IP 192.168.43.124.8880 > 192.168.43.195.7771: UDP, length 120
23:28:30.957635 IP 192.168.43.124.8880 > 192.168.43.195.7771: UDP, length 120
23:28:31.007636 IP 192.168.43.124.8880 > 192.168.43.195.7771: UDP, length 120
23:28:31.057638 IP 192.168.43.124.8880 > 192.168.43.195.7771: UDP, length 120
23:28:31.107639 IP 192.168.43.124.8880 > 192.168.43.195.7771: UDP, length 120
23:28:31.157638 IP 192.168.43.124.8880 > 192.168.43.195.7771: UDP, length 120
23:28:31.207692 IP 192.168.43.124.8880 > 192.168.43.195.7771: UDP, length 120
23:28:31.257635 IP 192.168.43.124.8880 > 192.168.43.195.7771: UDP, length 120
23:28:31.307639 IP 192.168.43.124.8880 > 192.168.43.195.7771: UDP, length 120
23:28:31.357638 IP 192.168.43.124.8880 > 192.168.43.195.7771: UDP, length 120
23:28:31.407602 IP 192.168.43.124.8880 > 192.168.43.195.7771: UDP, length 120
23:28:31.457636 IP 192.168.43.124.8880 > 192.168.43.195.7771: UDP, length 120
23:28:31.507639 IP 192.168.43.124.8880 > 192.168.43.195.7771: UDP, length 120
23:28:31.557632 IP 192.168.43.124.8880 > 192.168.43.195.7771: UDP, length 120
23:28:31.607596 IP 192.168.43.124.8880 > 192.168.43.195.7771: UDP, length 120
23:28:31.657638 IP 192.168.43.124.8880 > 192.168.43.195.7771: UDP, length 120
23:28:31.707639 IP 192.168.43.124.8880 > 192.168.43.195.7771: UDP, length 120
23:28:31.757636 IP 192.168.43.124.8880 > 192.168.43.195.7771: UDP, length 120
23:28:31.807640 IP 192.168.43.124.8880 > 192.168.43.195.7771: UDP, length 120
23:28:31.857639 IP 192.168.43.124.8880 > 192.168.43.195.7771: UDP, length 120
23:28:31.907637 IP 192.168.43.124.8880 > 192.168.43.195.7771: UDP, length 120
23:28:31.957637 IP 192.168.43.124.8880 > 192.168.43.195.7771: UDP, length 120
23:28:32.007639 IP 192.168.43.124.8880 > 192.168.43.195.7771: UDP, length 120
23:28:32.057640 IP 192.168.43.124.8880 > 192.168.43.195.7771: UDP, length 120
23:28:32.107598 IP 192.168.43.124.8880 > 192.168.43.195.7771: UDP, length 120
23:28:32.157639 IP 192.168.43.124.8880 > 192.168.43.195.7771: UDP, length 120
23:28:32.207642 IP 192.168.43.124.8880 > 192.168.43.195.7771: UDP, length 120
23:28:32.257689 IP 192.168.43.124.8880 > 192.168.43.195.7771: UDP, length 120
23:28:32.307692 IP 192.168.43.124.8880 > 192.168.43.195.7771: UDP, length 120
23:28:32.357692 IP 192.168.43.124.8880 > 192.168.43.195.7771: UDP, length 120
23:28:32.407695 IP 192.168.43.124.8880 > 192.168.43.195.7771: UDP, length 120
23:28:32.457693 IP 192.168.43.124.8880 > 192.168.43.195.7771: UDP, length 120
23:28:32.507572 IP 192.168.43.124.8880 > 192.168.43.195.7771: UDP, length 120
23:28:32.557567 IP 192.168.43.124.8880 > 192.168.43.195.7771: UDP, length 120
23:28:32.607580 IP 192.168.43.124.8880 > 192.168.43.195.7771: UDP, length 120
23:28:32.657634 IP 192.168.43.124.8880 > 192.168.43.195.7771: UDP, length 120
23:28:32.707635 IP 192.168.43.124.8880 > 192.168.43.195.7771: UDP, length 120
23:28:32.757636 IP 192.168.43.124.8880 > 192.168.43.195.7771: UDP, length 120
23:28:32.807638 IP 192.168.43.124.8880 > 192.168.43.195.7771: UDP, length 120
23:28:32.857636 IP 192.168.43.124.8880 > 192.168.43.195.7771: UDP, length 120
23:28:32.907637 IP 192.168.43.124.8880 > 192.168.43.195.7771: UDP, length 120
23:28:32.957636 IP 192.168.43.124.8880 > 192.168.43.195.7771: UDP, length 120
23:28:33.007638 IP 192.168.43.124.8880 > 192.168.43.195.7771: UDP, length 120
23:28:33.057634 IP 192.168.43.124.8880 > 192.168.43.195.7771: UDP, length 120
23:28:33.107638 IP 192.168.43.124.8880 > 192.168.43.195.7771: UDP, length 120
23:28:33.157637 IP 192.168.43.124.8880 > 192.168.43.195.7771: UDP, length 120
23:28:33.207691 IP 192.168.43.124.8880 > 192.168.43.195.7771: UDP, length 120
23:28:33.257640 IP 192.168.43.124.8880 > 192.168.43.195.7771: UDP, length 120
23:28:33.307638 IP 192.168.43.124.8880 > 192.168.43.195.7771: UDP, length 120
23:28:33.357642 IP 192.168.43.124.8880 > 192.168.43.195.7771: UDP, length 120
23:28:33.407643 IP 192.168.43.124.8880 > 192.168.43.195.7771: UDP, length 120
23:28:33.457643 IP 192.168.43.124.8880 > 192.168.43.195.7771: UDP, length 120
23:28:33.507642 IP 192.168.43.124.8880 > 192.168.43.195.7771: UDP, length 120
23:28:33.557691 IP 192.168.43.124.8880 > 192.168.43.195.7771: UDP, length 120
23:28:33.607600 IP 192.168.43.124.8880 > 192.168.43.195.7771: UDP, length 120
23:28:33.657601 IP 192.168.43.124.8880 > 192.168.43.195.7771: UDP, length 120
23:28:33.707636 IP 192.168.43.124.8880 > 192.168.43.195.7771: UDP, length 120
23:28:33.757565 IP 192.168.43.124.8880 > 192.168.43.195.7771: UDP, length 120
23:28:33.807539 IP 192.168.43.124.8880 > 192.168.43.195.7771: UDP, length 120
23:28:33.857637 IP 192.168.43.124.8880 > 192.168.43.195.7771: UDP, length 120
23:28:33.907637 IP 192.168.43.124.8880 > 192.168.43.195.7771: UDP, length 120
23:28:33.957640 IP 192.168.43.124.8880 > 192.168.43.195.7771: UDP, length 120
