03:28:05.271089 IP 192.168.43.195.8880 > 192.168.43.124.7772: UDP, length 120
03:28:05.321149 IP 192.168.43.195.8880 > 192.168.43.124.7772: UDP, length 120
03:28:05.371113 IP 192.168.43.195.8880 > 192.168.43.124.7772: UDP, length 120
03:28:05.421110 IP 192.168.43.195.8880 > 192.168.43.124.7772: UDP, length 120
03:28:05.471108 IP 192.168.43.195.8880 > 192.168.43.124.7772: UDP, length 120
03:28:05.521106 IP 192.168.43.195.8880 > 192.168.43.124.7772: UDP, length 120
03:28:05.571106 IP 192.168.43.195.8880 > 192.168.43.124.7772: UDP, length 120
03:28:05.621107 IP 192.168.43.195.8880 > 192.168.43.124.7772: UDP, length 120
03:28:05.671109 IP 192.168.43.195.8880 > 192.168.43.124.7772: UDP, length 120
03:28:05.721106 IP 192.168.43.195.8880 > 192.168.43.124.7772: UDP, length 120
03:28:05.771148 IP 192.168.43.195.8880 > 192.168.43.124.7772: UDP, length 120
03:28:05.821115 IP 192.168.43.195.8880 > 192.168.43.124.7772: UDP, length 120
03:28:05.871109 IP 192.168.43.195.8880 > 192.168.43.124.7772: UDP, length 120
03:28:05.921108 IP 192.168.43.195.8880 > 192.168.43.124.7772: UDP, length 120
03:28:05.971113 IP 192.168.43.195.8880 > 192.168.43.124.7772: UDP, length 120
03:28:06.021109 IP 192.168.43.195.8880 > 192.168.43.124.7772: UDP, length 120
03:28:06.071106 IP 192.168.43.195.8880 > 192.168.43.124.7772: UDP, length 120
03:28:06.121106 IP 192.168.43.195.8880 > 192.168.43.124.7772: UDP, length 120
03:28:06.171107 IP 192.168.43.195.8880 > 192.168.43.124.7772: UDP, length 120
03:28:06.221105 IP 192.168.43.195.8880 > 192.168.43.124.7772: UDP, length 120
03:28:06.271105 IP 192.168.43.195.8880 > 192.168.43.124.7772: UDP, length 120
03:28:06.321109 IP 192.168.43.195.8880 > 192.168.43.124.7772: UDP, length 120
03:28:06.371107 IP 192.168.43.195.8880 > 192.168.43.124.7772: UDP, length 120
03:28:06.421107 IP 192.168.43.195.8880 > 192.168.43.124.7772: UDP, length 120
03:28:06.471107 IP 192.168.43.195.8880 > 192.168.43.124.7772: UDP, length 120
03:28:06.521107 IP 192.168.43.195.8880 > 192.168.43.124.7772: UDP, length 120
03:28:06.571108 IP 192.168.43.195.8880 > 192.168.43.124.7772: UDP, length 120
03:28:06.621109 IP 192.168.43.195.8880 > 192.168.43.124.7772: UDP, length 120
03:28:06.671110 IP 192.168.43.195.8880 > 192.168.43.124.7772: UDP, length 120
03:28:06.721109 IP 192.168.43.195.8880 > 192.168.43.124.7772: UDP, length 120
03:28:06.771106 IP 192.168.43.195.8880 > 192.168.43.124.7772: UDP, length 120
03:28:06.821107 IP 192.168.43.195.8880 > 192.168.43.124.7772: UDP, length 120
03:28:06.871106 IP 192.168.43.195.8880 > 192.168.43.124.7772: UDP, length 120
03:28:06.921106 IP 192.168.43.195.8880 > 192.168.43.124.7772: UDP, length 120
03:28:06.971110 IP 192.168.43.195.8880 > 192.168.43.124.7772: UDP, length 120
03:28:07.021110 IP 192.168.43.195.8880 > 192.168.43.124.7772: UDP, length 120
03:28:07.071107 IP 192.168.43.195.8880 > 192.168.43.124.7772: UDP, length 120
03:28:07.121107 IP 192.168.43.195.8880 > 192.168.43.124.7772: UDP, length 120
03:28:07.171132 IP 192.168.43.195.8880 > 192.168.43.124.7772: UDP, length 120
03:28:07.221115 IP 192.168.43.195.8880 > 192.168.43.124.7772: UDP, length 120
03:28:07.271148 IP 192.168.43.195.8880 > 192.168.43.124.7772: UDP, length 120
03:28:07.321120 IP 192.168.43.195.8880 > 192.168.43.124.7772: UDP, length 120
03:28:07.371110 IP 192.168.43.195.8880 > 192.168.43.124.7772: UDP, length 120
03:28:07.421106 IP 192.168.43.195.8880 > 192.168.43.124.7772: UDP, length 120
03:28:07.471107 IP 192.168.43.195.8880 > 192.168.43.124.7772: UDP, length 120
03:28:07.521105 IP 192.168.43.195.8880 > 192.168.43.124.7772: UDP, length 120
03:28:07.571112 IP 192.168.43.195.8880 > 192.168.43.124.7772: UDP, length 120
03:28:07.621107 IP 192.168.43.195.8880 > 192.168.43.124.7772: UDP, length 120
03:28:07.671107 IP 192.168.43.195.8880 > 192.168.43.124.7772: UDP, length 120
03:28:07.721105 IP 192.168.43.195.8880 > 192.168.43.124.7772: UDP, length 120
03:28:07.771105 IP 192.168.43.195.8880 > 192.168.43.124.7772: UDP, length 120
03:28:07.821107 IP 192.168.43.195.8880 > 192.168.43.124.7772: UDP, length 120
03:28:07.871106 IP 192.168.43.195.8880 > 192.168.43.124.7772: UDP, length 120
03:28:07.921106 IP 192.168.43.195.8880 > 192.168.43.124.7772: UDP, length 120
03:28:07.971106 IP 192.168.43.195.8880 > 192.168.43.124.7772: UDP, length 120
03:28:08.021106 IP 192.168.43.195.8880 > 192.168.43.124.7772: UDP, length 120
03:28:08.071107 IP 192.168.43.195.8880 > 192.168.43.124.7772: UDP, length 120
03:28:08.121111 IP 192.168.43.195.8880 > 192.168.43.124.7772: UDP, length 120
03:28:08.171109 IP 192.168.43.195.8880 > 192.168.43.124.7772: UDP, length 120
03:28:08.221106 IP 192.168.43.195.8880 > 192.168.43.124.7772: UDP, length 120
03:28:08.271106 IP 192.168.43.195.8880 > 192.168.43.124.7772: UDP, length 120
03:28:08.321111 IP 192.168.43.195.8880 > 192.168.43.124.7772: UDP, length 120
03:28:08.371109 IP 192.168.43.195.8880 > 192.168.43.124.7772: UDP, length 120
03:28:08.421106 IP 192.168.43.195.8880 > 192.168.43.124.7772: UDP, length 120
03:28:08.471106 IP 192.168.43.195.8880 > 192.168.43.124.7772: UDP, length 120
03:28:08.521106 IP 192.168.43.195.8880 > 192.168.43.124.7772: UDP, length 120
03:28:08.571107 IP 192.168.43.195.8880 > 192.168.43.124.7772: UDP, length 120
03:28:08.621107 IP 192.168.43.195.8880 > 192.168.43.124.7772: UDP, length 120
03:28:08.671108 IP 192.168.43.195.8880 > 192.168.43.124.7772: UDP, length 120
03:28:08.721106 IP 192.168.43.195.8880 > 192.168.43.124.7772: UDP, length 120
03:28:08.771147 IP 192.168.43.195.8880 > 192.168.43.124.7772: UDP, length 120
03:28:08.821113 IP 192.168.43.195.8880 > 192.168.43.124.7772: UDP, length 120
03:28:08.871108 IP 192.168.43.195.8880 > 192.168.43.124.7772: UDP, length 120
03:28:08.921107 IP 192.168.43.195.8880 > 192.168.43.124.7772: UDP, length 120
03:28:08.971106 IP 192.168.43.195.8880 > 192.168.43.124.7772: UDP, length 120
03:28:09.021110 IP 192.168.43.195.8880 > 192.168.43.124.7772: UDP, length 120
03:28:09.071107 IP 192.168.43.195.8880 > 192.168.43.124.7772: UDP, length 120
03:28:09.121107 IP 192.168.43.195.8880 > 192.168.43.124.7772: UDP, length 120
03:28:09.171114 IP 192.168.43.195.8880 > 192.168.43.124.7772: UDP, length 120
03:28:09.221108 IP 192.168.43.195.8880 > 192.168.43.124.7772: UDP, length 120
03:28:09.222578 IP 192.168.43.124.8880 > 192.168.43.195.7771: UDP, length 120
03:28:09.222902 IP 192.168.43.124.8880 > 192.168.43.195.7771: UDP, length 120
03:28:09.271110 IP 192.168.43.195.8880 > 192.168.43.124.7772: UDP, length 120
03:28:09.321111 IP 192.168.43.195.8880 > 192.168.43.124.7772: UDP, length 120
03:28:09.324512 IP 192.168.43.124.8880 > 192.168.43.195.7771: UDP, length 120
03:28:09.324756 IP 192.168.43.124.8880 > 192.168.43.195.7771: UDP, length 120
03:28:09.371112 IP 192.168.43.195.8880 > 192.168.43.124.7772: UDP, length 120
03:28:09.420345 IP 192.168.43.124.8880 > 192.168.43.195.7771: UDP, length 120
03:28:09.420622 IP 192.168.43.124.8880 > 192.168.43.195.7771: UDP, length 120
03:28:09.421114 IP 192.168.43.195.8880 > 192.168.43.124.7772: UDP, length 120
03:28:09.471108 IP 192.168.43.195.8880 > 192.168.43.124.7772: UDP, length 120
03:28:09.521106 IP 192.168.43.195.8880 > 192.168.43.124.7772: UDP, length 120
03:28:09.522244 IP 192.168.43.124.8880 > 192.168.43.195.7771: UDP, length 120
03:28:09.522518 IP 192.168.43.124.8880 > 192.168.43.195.7771: UDP, length 120
03:28:09.571148 IP 192.168.43.195.8880 > 192.168.43.124.7772: UDP, length 120
03:28:09.621126 IP 192.168.43.195.8880 > 192.168.43.124.7772: UDP, length 120
03:28:09.671107 IP 192.168.43.195.8880 > 192.168.43.124.7772: UDP, length 120
03:28:09.721105 IP 192.168.43.195.8880 > 192.168.43.124.7772: UDP, length 120
03:28:09.741292 IP 192.168.43.124.8880 > 192.168.43.195.7771: UDP, length 120
03:28:09.741544 IP 192.168.43.124.8880 > 192.168.43.195.7771: UDP, length 120
03:28:09.741758 IP 192.168.43.124.8880 > 192.168.43.195.7771: UDP, length 120
03:28:09.741966 IP 192.168.43.124.8880 > 192.168.43.195.7771: UDP, length 120
03:28:09.742176 IP 192.168.43.124.8880 > 192.168.43.195.7771: UDP, length 120
03:28:09.771112 IP 192.168.43.195.8880 > 192.168.43.124.7772: UDP, length 120
03:28:09.821109 IP 192.168.43.195.8880 > 192.168.43.124.7772: UDP, length 120
03:28:09.871106 IP 192.168.43.195.8880 > 192.168.43.124.7772: UDP, length 120
03:28:09.881207 IP 192.168.43.124.8880 > 192.168.43.195.7771: UDP, length 120
03:28:09.881449 IP 192.168.43.124.8880 > 192.168.43.195.7771: UDP, length 120
03:28:09.921110 IP 192.168.43.195.8880 > 192.168.43.124.7772: UDP, length 120
03:28:09.971107 IP 192.168.43.195.8880 > 192.168.43.124.7772: UDP, length 120
03:28:10.021104 IP 192.168.43.195.8880 > 192.168.43.124.7772: UDP, length 120
03:28:10.071104 IP 192.168.43.195.8880 > 192.168.43.124.7772: UDP, length 120
03:28:10.085621 IP 192.168.43.124.8880 > 192.168.43.195.7771: UDP, length 120
03:28:10.085882 IP 192.168.43.124.8880 > 192.168.43.195.7771: UDP, length 120
03:28:10.086094 IP 192.168.43.124.8880 > 192.168.43.195.7771: UDP, length 120
03:28:10.086301 IP 192.168.43.124.8880 > 192.168.43.195.7771: UDP, length 120
03:28:10.086514 IP 192.168.43.124.8880 > 192.168.43.195.7771: UDP, length 120
03:28:10.121109 IP 192.168.43.195.8880 > 192.168.43.124.7772: UDP, length 120
03:28:10.171116 IP 192.168.43.195.8880 > 192.168.43.124.7772: UDP, length 120
03:28:10.220252 IP 192.168.43.124.8880 > 192.168.43.195.7771: UDP, length 120
03:28:10.220532 IP 192.168.43.124.8880 > 192.168.43.195.7771: UDP, length 120
03:28:10.221114 IP 192.168.43.195.8880 > 192.168.43.124.7772: UDP, length 120
03:28:10.271154 IP 192.168.43.195.8880 > 192.168.43.124.7772: UDP, length 120
03:28:10.321125 IP 192.168.43.195.8880 > 192.168.43.124.7772: UDP, length 120
03:28:10.371111 IP 192.168.43.195.8880 > 192.168.43.124.7772: UDP, length 120
03:28:10.421107 IP 192.168.43.195.8880 > 192.168.43.124.7772: UDP, length 120
03:28:10.430835 IP 192.168.43.124.8880 > 192.168.43.195.7771: UDP, length 120
03:28:10.431239 IP 192.168.43.124.8880 > 192.168.43.195.7771: UDP, length 120
03:28:10.431463 IP 192.168.43.124.8880 > 192.168.43.195.7771: UDP, length 120
03:28:10.431680 IP 192.168.43.124.8880 > 192.168.43.195.7771: UDP, length 120
03:28:10.471117 IP 192.168.43.195.8880 > 192.168.43.124.7772: UDP, length 120
03:28:10.521108 IP 192.168.43.195.8880 > 192.168.43.124.7772: UDP, length 120
03:28:10.530504 IP 192.168.43.124.8880 > 192.168.43.195.7771: UDP, length 120
03:28:10.530751 IP 192.168.43.124.8880 > 192.168.43.195.7771: UDP, length 120
03:28:10.530974 IP 192.168.43.124.8880 > 192.168.43.195.7771: UDP, length 120
03:28:10.571111 IP 192.168.43.195.8880 > 192.168.43.124.7772: UDP, length 120
03:28:10.621106 IP 192.168.43.195.8880 > 192.168.43.124.7772: UDP, length 120
03:28:10.671108 IP 192.168.43.195.8880 > 192.168.43.124.7772: UDP, length 120
03:28:10.721105 IP 192.168.43.195.8880 > 192.168.43.124.7772: UDP, length 120
03:28:10.771105 IP 192.168.43.195.8880 > 192.168.43.124.7772: UDP, length 120
03:28:10.787522 IP 192.168.43.124.8880 > 192.168.43.195.7771: UDP, length 120
03:28:10.787827 IP 192.168.43.124.8880 > 192.168.43.195.7771: UDP, length 120
03:28:10.788047 IP 192.168.43.124.8880 > 192.168.43.195.7771: UDP, length 120
03:28:10.788254 IP 192.168.43.124.8880 > 192.168.43.195.7771: UDP, length 120
03:28:10.788462 IP 192.168.43.124.8880 > 192.168.43.195.7771: UDP, length 120
03:28:10.821111 IP 192.168.43.195.8880 > 192.168.43.124.7772: UDP, length 120
03:28:10.871107 IP 192.168.43.195.8880 > 192.168.43.124.7772: UDP, length 120
03:28:10.913864 IP 192.168.43.124.8880 > 192.168.43.195.7771: UDP, length 120
03:28:10.914136 IP 192.168.43.124.8880 > 192.168.43.195.7771: UDP, length 120
03:28:10.921109 IP 192.168.43.195.8880 > 192.168.43.124.7772: UDP, length 120
03:28:10.971106 IP 192.168.43.195.8880 > 192.168.43.124.7772: UDP, length 120
03:28:11.021105 IP 192.168.43.195.8880 > 192.168.43.124.7772: UDP, length 120
03:28:11.071104 IP 192.168.43.195.8880 > 192.168.43.124.7772: UDP, length 120
03:28:11.121105 IP 192.168.43.195.8880 > 192.168.43.124.7772: UDP, length 120
03:28:11.126539 IP 192.168.43.124.8880 > 192.168.43.195.7771: UDP, length 120
03:28:11.126789 IP 192.168.43.124.8880 > 192.168.43.195.7771: UDP, length 120
03:28:11.126999 IP 192.168.43.124.8880 > 192.168.43.195.7771: UDP, length 120
03:28:11.127206 IP 192.168.43.124.8880 > 192.168.43.195.7771: UDP, length 120
03:28:11.127411 IP 192.168.43.124.8880 > 192.168.43.195.7771: UDP, length 120
03:28:11.171109 IP 192.168.43.195.8880 > 192.168.43.124.7772: UDP, length 120
03:28:11.221110 IP 192.168.43.195.8880 > 192.168.43.124.7772: UDP, length 120
03:28:11.271109 IP 192.168.43.195.8880 > 192.168.43.124.7772: UDP, length 120
03:28:11.272872 IP 192.168.43.124.8880 > 192.168.43.195.7771: UDP, length 120
03:28:11.273163 IP 192.168.43.124.8880 > 192.168.43.195.7771: UDP, length 120
03:28:11.321128 IP 192.168.43.195.8880 > 192.168.43.124.7772: UDP, length 120
03:28:11.371111 IP 192.168.43.195.8880 > 192.168.43.124.7772: UDP, length 120
03:28:11.421109 IP 192.168.43.195.8880 > 192.168.43.124.7772: UDP, length 120
03:28:11.471106 IP 192.168.43.195.8880 > 192.168.43.124.7772: UDP, length 120
03:28:11.479433 IP 192.168.43.124.8880 > 192.168.43.195.7771: UDP, length 120
03:28:11.479725 IP 192.168.43.124.8880 > 192.168.43.195.7771: UDP, length 120
03:28:11.479941 IP 192.168.43.124.8880 > 192.168.43.195.7771: UDP, length 120
03:28:11.480151 IP 192.168.43.124.8880 > 192.168.43.195.7771: UDP, length 120
03:28:11.480359 IP 192.168.43.124.8880 > 192.168.43.195.7771: UDP, length 120
03:28:11.521112 IP 192.168.43.195.8880 > 192.168.43.124.7772: UDP, length 120
03:28:11.571109 IP 192.168.43.195.8880 > 192.168.43.124.7772: UDP, length 120
03:28:11.621104 IP 192.168.43.195.8880 > 192.168.43.124.7772: UDP, length 120
03:28:11.665700 IP 192.168.43.124.8880 > 192.168.43.195.7771: UDP, length 120
03:28:11.665955 IP 192.168.43.124.8880 > 192.168.43.195.7771: UDP, length 120
03:28:11.671113 IP 192.168.43.195.8880 > 192.168.43.124.7772: UDP, length 120
03:28:11.721108 IP 192.168.43.195.8880 > 192.168.43.124.7772: UDP, length 120
03:28:11.771154 IP 192.168.43.195.8880 > 192.168.43.124.7772: UDP, length 120
03:28:11.821116 IP 192.168.43.195.8880 > 192.168.43.124.7772: UDP, length 120
03:28:11.856955 IP 192.168.43.124.8880 > 192.168.43.195.7771: UDP, length 120
03:28:11.857136 IP 192.168.43.124.8880 > 192.168.43.195.7771: UDP, length 120
03:28:11.857256 IP 192.168.43.124.8880 > 192.168.43.195.7771: UDP, length 120
03:28:11.857369 IP 192.168.43.124.8880 > 192.168.43.195.7771: UDP, length 120
03:28:11.857492 IP 192.168.43.124.8880 > 192.168.43.195.7771: UDP, length 120
03:28:11.871119 IP 192.168.43.195.8880 > 192.168.43.124.7772: UDP, length 120
03:28:11.921110 IP 192.168.43.195.8880 > 192.168.43.124.7772: UDP, length 120
03:28:11.971107 IP 192.168.43.195.8880 > 192.168.43.124.7772: UDP, length 120
03:28:11.986821 IP 192.168.43.124.8880 > 192.168.43.195.7771: UDP, length 120
03:28:11.987061 IP 192.168.43.124.8880 > 192.168.43.195.7771: UDP, length 120
03:28:12.021110 IP 192.168.43.195.8880 > 192.168.43.124.7772: UDP, length 120
03:28:12.071108 IP 192.168.43.195.8880 > 192.168.43.124.7772: UDP, length 120
03:28:12.121106 IP 192.168.43.195.8880 > 192.168.43.124.7772: UDP, length 120
03:28:12.171109 IP 192.168.43.195.8880 > 192.168.43.124.7772: UDP, length 120
03:28:12.180196 IP 192.168.43.124.8880 > 192.168.43.195.7771: UDP, length 120
03:28:12.180552 IP 192.168.43.124.8880 > 192.168.43.195.7771: UDP, length 120
03:28:12.180764 IP 192.168.43.124.8880 > 192.168.43.195.7771: UDP, length 120
03:28:12.180973 IP 192.168.43.124.8880 > 192.168.43.195.7771: UDP, length 120
03:28:12.181182 IP 192.168.43.124.8880 > 192.168.43.195.7771: UDP, length 120
03:28:12.221109 IP 192.168.43.195.8880 > 192.168.43.124.7772: UDP, length 120
03:28:12.271107 IP 192.168.43.195.8880 > 192.168.43.124.7772: UDP, length 120
03:28:12.274512 IP 192.168.43.124.8880 > 192.168.43.195.7771: UDP, length 120
03:28:12.274745 IP 192.168.43.124.8880 > 192.168.43.195.7771: UDP, length 120
03:28:12.321144 IP 192.168.43.195.8880 > 192.168.43.124.7772: UDP, length 120
03:28:12.371120 IP 192.168.43.195.8880 > 192.168.43.124.7772: UDP, length 120
03:28:12.421114 IP 192.168.43.195.8880 > 192.168.43.124.7772: UDP, length 120
03:28:12.433063 IP 192.168.43.124.8880 > 192.168.43.195.7771: UDP, length 120
03:28:12.433409 IP 192.168.43.124.8880 > 192.168.43.195.7771: UDP, length 120
03:28:12.433526 IP 192.168.43.124.8880 > 192.168.43.195.7771: UDP, length 120
03:28:12.468792 IP 192.168.43.124.8880 > 192.168.43.195.7771: UDP, length 120
03:28:12.471128 IP 192.168.43.195.8880 > 192.168.43.124.7772: UDP, length 120
03:28:12.521111 IP 192.168.43.195.8880 > 192.168.43.124.7772: UDP, length 120
03:28:12.521186 IP 192.168.43.124.8880 > 192.168.43.195.7771: UDP, length 120
03:28:12.571111 IP 192.168.43.195.8880 > 192.168.43.124.7772: UDP, length 120
03:28:12.574505 IP 192.168.43.124.8880 > 192.168.43.195.7771: UDP, length 120
03:28:12.620297 IP 192.168.43.124.8880 > 192.168.43.195.7771: UDP, length 120
03:28:12.621112 IP 192.168.43.195.8880 > 192.168.43.124.7772: UDP, length 120
03:28:12.671112 IP 192.168.43.195.8880 > 192.168.43.124.7772: UDP, length 120
03:28:12.721107 IP 192.168.43.195.8880 > 192.168.43.124.7772: UDP, length 120
03:28:12.771108 IP 192.168.43.195.8880 > 192.168.43.124.7772: UDP, length 120
03:28:12.784123 IP 192.168.43.124.8880 > 192.168.43.195.7771: UDP, length 120
03:28:12.784379 IP 192.168.43.124.8880 > 192.168.43.195.7771: UDP, length 120
03:28:12.784503 IP 192.168.43.124.8880 > 192.168.43.195.7771: UDP, length 120
03:28:12.820579 IP 192.168.43.124.8880 > 192.168.43.195.7771: UDP, length 120
03:28:12.821114 IP 192.168.43.195.8880 > 192.168.43.124.7772: UDP, length 120
03:28:12.871109 IP 192.168.43.195.8880 > 192.168.43.124.7772: UDP, length 120
03:28:12.878761 IP 192.168.43.124.8880 > 192.168.43.195.7771: UDP, length 120
03:28:12.918838 IP 192.168.43.124.8880 > 192.168.43.195.7771: UDP, length 120
03:28:12.921108 IP 192.168.43.195.8880 > 192.168.43.124.7772: UDP, length 120
03:28:12.968847 IP 192.168.43.124.8880 > 192.168.43.195.7771: UDP, length 120
03:28:12.971116 IP 192.168.43.195.8880 > 192.168.43.124.7772: UDP, length 120
03:28:13.021170 IP 192.168.43.195.8880 > 192.168.43.124.7772: UDP, length 120
03:28:13.071116 IP 192.168.43.195.8880 > 192.168.43.124.7772: UDP, length 120
03:28:13.121108 IP 192.168.43.195.8880 > 192.168.43.124.7772: UDP, length 120
03:28:13.137036 IP 192.168.43.124.8880 > 192.168.43.195.7771: UDP, length 120
03:28:13.137270 IP 192.168.43.124.8880 > 192.168.43.195.7771: UDP, length 120
03:28:13.137391 IP 192.168.43.124.8880 > 192.168.43.195.7771: UDP, length 120
03:28:13.168475 IP 192.168.43.124.8880 > 192.168.43.195.7771: UDP, length 120
03:28:13.171110 IP 192.168.43.195.8880 > 192.168.43.124.7772: UDP, length 120
03:28:13.218678 IP 192.168.43.124.8880 > 192.168.43.195.7771: UDP, length 120
03:28:13.221107 IP 192.168.43.195.8880 > 192.168.43.124.7772: UDP, length 120
03:28:13.271156 IP 192.168.43.195.8880 > 192.168.43.124.7772: UDP, length 120
03:28:13.275630 IP 192.168.43.124.8880 > 192.168.43.195.7771: UDP, length 120
03:28:13.319128 IP 192.168.43.124.8880 > 192.168.43.195.7771: UDP, length 120
03:28:13.321131 IP 192.168.43.195.8880 > 192.168.43.124.7772: UDP, length 120
03:28:13.371121 IP 192.168.43.195.8880 > 192.168.43.124.7772: UDP, length 120
03:28:13.421117 IP 192.168.43.195.8880 > 192.168.43.124.7772: UDP, length 120
03:28:13.471111 IP 192.168.43.195.8880 > 192.168.43.124.7772: UDP, length 120
03:28:13.480117 IP 192.168.43.124.8880 > 192.168.43.195.7771: UDP, length 120
03:28:13.480347 IP 192.168.43.124.8880 > 192.168.43.195.7771: UDP, length 120
03:28:13.480464 IP 192.168.43.124.8880 > 192.168.43.195.7771: UDP, length 120
03:28:13.521109 IP 192.168.43.195.8880 > 192.168.43.124.7772: UDP, length 120
03:28:13.523322 IP 192.168.43.124.8880 > 192.168.43.195.7771: UDP, length 120
03:28:13.571109 IP 192.168.43.195.8880 > 192.168.43.124.7772: UDP, length 120
03:28:13.572860 IP 192.168.43.124.8880 > 192.168.43.195.7771: UDP, length 120
03:28:13.621107 IP 192.168.43.195.8880 > 192.168.43.124.7772: UDP, length 120
03:28:13.624535 IP 192.168.43.124.8880 > 192.168.43.195.7771: UDP, length 120
03:28:13.668932 IP 192.168.43.124.8880 > 192.168.43.195.7771: UDP, length 120
03:28:13.671111 IP 192.168.43.195.8880 > 192.168.43.124.7772: UDP, length 120
03:28:13.721109 IP 192.168.43.195.8880 > 192.168.43.124.7772: UDP, length 120
03:28:13.771108 IP 192.168.43.195.8880 > 192.168.43.124.7772: UDP, length 120
03:28:13.821108 IP 192.168.43.195.8880 > 192.168.43.124.7772: UDP, length 120
03:28:13.828667 IP 192.168.43.124.8880 > 192.168.43.195.7771: UDP, length 120
03:28:13.829219 IP 192.168.43.124.8880 > 192.168.43.195.7771: UDP, length 120
03:28:13.829433 IP 192.168.43.124.8880 > 192.168.43.195.7771: UDP, length 120
03:28:13.868660 IP 192.168.43.124.8880 > 192.168.43.195.7771: UDP, length 120
03:28:13.871107 IP 192.168.43.195.8880 > 192.168.43.124.7772: UDP, length 120
03:28:13.918951 IP 192.168.43.124.8880 > 192.168.43.195.7771: UDP, length 120
03:28:13.921106 IP 192.168.43.195.8880 > 192.168.43.124.7772: UDP, length 120
03:28:13.971118 IP 192.168.43.195.8880 > 192.168.43.124.7772: UDP, length 120
03:28:13.976763 IP 192.168.43.124.8880 > 192.168.43.195.7771: UDP, length 120
03:28:14.018929 IP 192.168.43.124.8880 > 192.168.43.195.7771: UDP, length 120
03:28:14.021112 IP 192.168.43.195.8880 > 192.168.43.124.7772: UDP, length 120
03:28:14.068615 IP 192.168.43.124.8880 > 192.168.43.195.7771: UDP, length 120
03:28:14.071107 IP 192.168.43.195.8880 > 192.168.43.124.7772: UDP, length 120
03:28:14.121106 IP 192.168.43.195.8880 > 192.168.43.124.7772: UDP, length 120
03:28:14.129991 IP 192.168.43.124.8880 > 192.168.43.195.7771: UDP, length 120
03:28:14.168898 IP 192.168.43.124.8880 > 192.168.43.195.7771: UDP, length 120
03:28:14.171108 IP 192.168.43.195.8880 > 192.168.43.124.7772: UDP, length 120
03:28:14.218808 IP 192.168.43.124.8880 > 192.168.43.195.7771: UDP, length 120
03:28:14.221105 IP 192.168.43.195.8880 > 192.168.43.124.7772: UDP, length 120
03:28:14.268818 IP 192.168.43.124.8880 > 192.168.43.195.7771: UDP, length 120
03:28:14.271106 IP 192.168.43.195.8880 > 192.168.43.124.7772: UDP, length 120
03:28:14.318721 IP 192.168.43.124.8880 > 192.168.43.195.7771: UDP, length 120
03:28:14.321113 IP 192.168.43.195.8880 > 192.168.43.124.7772: UDP, length 120
03:28:14.368979 IP 192.168.43.124.8880 > 192.168.43.195.7771: UDP, length 120
03:28:14.371110 IP 192.168.43.195.8880 > 192.168.43.124.7772: UDP, length 120
03:28:14.418723 IP 192.168.43.124.8880 > 192.168.43.195.7771: UDP, length 120
03:28:14.421124 IP 192.168.43.195.8880 > 192.168.43.124.7772: UDP, length 120
03:28:14.471111 IP 192.168.43.195.8880 > 192.168.43.124.7772: UDP, length 120
03:28:14.476001 IP 192.168.43.124.8880 > 192.168.43.195.7771: UDP, length 120
03:28:14.518794 IP 192.168.43.124.8880 > 192.168.43.195.7771: UDP, length 120
03:28:14.521117 IP 192.168.43.195.8880 > 192.168.43.124.7772: UDP, length 120
03:28:14.571106 IP 192.168.43.195.8880 > 192.168.43.124.7772: UDP, length 120
03:28:14.572994 IP 192.168.43.124.8880 > 192.168.43.195.7771: UDP, length 120
03:28:14.618983 IP 192.168.43.124.8880 > 192.168.43.195.7771: UDP, length 120
03:28:14.621108 IP 192.168.43.195.8880 > 192.168.43.124.7772: UDP, length 120
03:28:14.671121 IP 192.168.43.195.8880 > 192.168.43.124.7772: UDP, length 120
03:28:14.675854 IP 192.168.43.124.8880 > 192.168.43.195.7771: UDP, length 120
03:28:14.719023 IP 192.168.43.124.8880 > 192.168.43.195.7771: UDP, length 120
03:28:14.721114 IP 192.168.43.195.8880 > 192.168.43.124.7772: UDP, length 120
03:28:14.770943 IP 192.168.43.124.8880 > 192.168.43.195.7771: UDP, length 120
03:28:14.771152 IP 192.168.43.195.8880 > 192.168.43.124.7772: UDP, length 120
03:28:14.818808 IP 192.168.43.124.8880 > 192.168.43.195.7771: UDP, length 120
03:28:14.821118 IP 192.168.43.195.8880 > 192.168.43.124.7772: UDP, length 120
03:28:14.871110 IP 192.168.43.195.8880 > 192.168.43.124.7772: UDP, length 120
03:28:14.876866 IP 192.168.43.124.8880 > 192.168.43.195.7771: UDP, length 120
03:28:14.919089 IP 192.168.43.124.8880 > 192.168.43.195.7771: UDP, length 120
03:28:14.921114 IP 192.168.43.195.8880 > 192.168.43.124.7772: UDP, length 120
03:28:14.968585 IP 192.168.43.124.8880 > 192.168.43.195.7771: UDP, length 120
03:28:14.971111 IP 192.168.43.195.8880 > 192.168.43.124.7772: UDP, length 120
03:28:15.021110 IP 192.168.43.195.8880 > 192.168.43.124.7772: UDP, length 120
03:28:15.025644 IP 192.168.43.124.8880 > 192.168.43.195.7771: UDP, length 120
03:28:15.068942 IP 192.168.43.124.8880 > 192.168.43.195.7771: UDP, length 120
03:28:15.071109 IP 192.168.43.195.8880 > 192.168.43.124.7772: UDP, length 120
03:28:15.118704 IP 192.168.43.124.8880 > 192.168.43.195.7771: UDP, length 120
03:28:15.121106 IP 192.168.43.195.8880 > 192.168.43.124.7772: UDP, length 120
03:28:15.168809 IP 192.168.43.124.8880 > 192.168.43.195.7771: UDP, length 120
03:28:15.171112 IP 192.168.43.195.8880 > 192.168.43.124.7772: UDP, length 120
03:28:15.219520 IP 192.168.43.124.8880 > 192.168.43.195.7771: UDP, length 120
03:28:15.221106 IP 192.168.43.195.8880 > 192.168.43.124.7772: UDP, length 120
03:28:15.268896 IP 192.168.43.124.8880 > 192.168.43.195.7771: UDP, length 120
03:28:15.271112 IP 192.168.43.195.8880 > 192.168.43.124.7772: UDP, length 120
03:28:15.318833 IP 192.168.43.124.8880 > 192.168.43.195.7771: UDP, length 120
03:28:15.321121 IP 192.168.43.195.8880 > 192.168.43.124.7772: UDP, length 120
03:28:15.371110 IP 192.168.43.195.8880 > 192.168.43.124.7772: UDP, length 120
03:28:15.375799 IP 192.168.43.124.8880 > 192.168.43.195.7771: UDP, length 120
03:28:15.419259 IP 192.168.43.124.8880 > 192.168.43.195.7771: UDP, length 120
03:28:15.421114 IP 192.168.43.195.8880 > 192.168.43.124.7772: UDP, length 120
03:28:15.471110 IP 192.168.43.195.8880 > 192.168.43.124.7772: UDP, length 120
03:28:15.521112 IP 192.168.43.195.8880 > 192.168.43.124.7772: UDP, length 120
03:28:15.571115 IP 192.168.43.195.8880 > 192.168.43.124.7772: UDP, length 120
03:28:15.615366 IP 192.168.43.124.8880 > 192.168.43.195.7771: UDP, length 120
03:28:15.615498 IP 192.168.43.124.8880 > 192.168.43.195.7771: UDP, length 120
03:28:15.621111 IP 192.168.43.195.8880 > 192.168.43.124.7772: UDP, length 120
03:28:15.671113 IP 192.168.43.195.8880 > 192.168.43.124.7772: UDP, length 120
03:28:15.721108 IP 192.168.43.195.8880 > 192.168.43.124.7772: UDP, length 120
03:28:15.733817 IP 192.168.43.124.8880 > 192.168.43.195.7771: UDP, length 120
03:28:15.733963 IP 192.168.43.124.8880 > 192.168.43.195.7771: UDP, length 120
03:28:15.734208 IP 192.168.43.124.8880 > 192.168.43.195.7771: UDP, length 120
03:28:15.771111 IP 192.168.43.195.8880 > 192.168.43.124.7772: UDP, length 120
03:28:15.821110 IP 192.168.43.195.8880 > 192.168.43.124.7772: UDP, length 120
03:28:15.866886 IP 192.168.43.124.8880 > 192.168.43.195.7771: UDP, length 120
03:28:15.867101 IP 192.168.43.124.8880 > 192.168.43.195.7771: UDP, length 120
03:28:15.871107 IP 192.168.43.195.8880 > 192.168.43.124.7772: UDP, length 120
03:28:15.921109 IP 192.168.43.195.8880 > 192.168.43.124.7772: UDP, length 120
03:28:15.970604 IP 192.168.43.124.8880 > 192.168.43.195.7771: UDP, length 120
03:28:15.970822 IP 192.168.43.124.8880 > 192.168.43.195.7771: UDP, length 120
03:28:15.970936 IP 192.168.43.124.8880 > 192.168.43.195.7771: UDP, length 120
03:28:15.971114 IP 192.168.43.195.8880 > 192.168.43.124.7772: UDP, length 120
03:28:16.021109 IP 192.168.43.195.8880 > 192.168.43.124.7772: UDP, length 120
03:28:16.071107 IP 192.168.43.195.8880 > 192.168.43.124.7772: UDP, length 120
03:28:16.121106 IP 192.168.43.195.8880 > 192.168.43.124.7772: UDP, length 120
03:28:16.124515 IP 192.168.43.124.8880 > 192.168.43.195.7771: UDP, length 120
03:28:16.124633 IP 192.168.43.124.8880 > 192.168.43.195.7771: UDP, length 120
03:28:16.124769 IP 192.168.43.124.8880 > 192.168.43.195.7771: UDP, length 120
03:28:16.171111 IP 192.168.43.195.8880 > 192.168.43.124.7772: UDP, length 120
03:28:16.221108 IP 192.168.43.195.8880 > 192.168.43.124.7772: UDP, length 120
03:28:16.271160 IP 192.168.43.195.8880 > 192.168.43.124.7772: UDP, length 120
03:28:16.275834 IP 192.168.43.124.8880 > 192.168.43.195.7771: UDP, length 120
03:28:16.276051 IP 192.168.43.124.8880 > 192.168.43.195.7771: UDP, length 120
03:28:16.321131 IP 192.168.43.195.8880 > 192.168.43.124.7772: UDP, length 120
03:28:16.370605 IP 192.168.43.124.8880 > 192.168.43.195.7771: UDP, length 120
03:28:16.370828 IP 192.168.43.124.8880 > 192.168.43.195.7771: UDP, length 120
03:28:16.370943 IP 192.168.43.124.8880 > 192.168.43.195.7771: UDP, length 120
03:28:16.371117 IP 192.168.43.195.8880 > 192.168.43.124.7772: UDP, length 120
03:28:16.421113 IP 192.168.43.195.8880 > 192.168.43.124.7772: UDP, length 120
03:28:16.471115 IP 192.168.43.195.8880 > 192.168.43.124.7772: UDP, length 120
03:28:16.521108 IP 192.168.43.195.8880 > 192.168.43.124.7772: UDP, length 120
03:28:16.543672 IP 192.168.43.124.8880 > 192.168.43.195.7771: UDP, length 120
03:28:16.543798 IP 192.168.43.124.8880 > 192.168.43.195.7771: UDP, length 120
03:28:16.543913 IP 192.168.43.124.8880 > 192.168.43.195.7771: UDP, length 120
03:28:16.571120 IP 192.168.43.195.8880 > 192.168.43.124.7772: UDP, length 120
03:28:16.621114 IP 192.168.43.195.8880 > 192.168.43.124.7772: UDP, length 120
03:28:16.667146 IP 192.168.43.124.8880 > 192.168.43.195.7771: UDP, length 120
03:28:16.667379 IP 192.168.43.124.8880 > 192.168.43.195.7771: UDP, length 120
03:28:16.671111 IP 192.168.43.195.8880 > 192.168.43.124.7772: UDP, length 120
03:28:16.721109 IP 192.168.43.195.8880 > 192.168.43.124.7772: UDP, length 120
03:28:16.769749 IP 192.168.43.124.8880 > 192.168.43.195.7771: UDP, length 120
03:28:16.769869 IP 192.168.43.124.8880 > 192.168.43.195.7771: UDP, length 120
03:28:16.771106 IP 192.168.43.195.8880 > 192.168.43.124.7772: UDP, length 120
03:28:16.821109 IP 192.168.43.195.8880 > 192.168.43.124.7772: UDP, length 120
03:28:16.871108 IP 192.168.43.195.8880 > 192.168.43.124.7772: UDP, length 120
03:28:16.882898 IP 192.168.43.124.8880 > 192.168.43.195.7771: UDP, length 120
03:28:16.883196 IP 192.168.43.124.8880 > 192.168.43.195.7771: UDP, length 120
03:28:16.883310 IP 192.168.43.124.8880 > 192.168.43.195.7771: UDP, length 120
03:28:16.921110 IP 192.168.43.195.8880 > 192.168.43.124.7772: UDP, length 120
03:28:16.971108 IP 192.168.43.195.8880 > 192.168.43.124.7772: UDP, length 120
03:28:17.019468 IP 192.168.43.124.8880 > 192.168.43.195.7771: UDP, length 120
03:28:17.019692 IP 192.168.43.124.8880 > 192.168.43.195.7771: UDP, length 120
03:28:17.019811 IP 192.168.43.124.8880 > 192.168.43.195.7771: UDP, length 120
03:28:17.021108 IP 192.168.43.195.8880 > 192.168.43.124.7772: UDP, length 120
03:28:17.071108 IP 192.168.43.195.8880 > 192.168.43.124.7772: UDP, length 120
03:28:17.121106 IP 192.168.43.195.8880 > 192.168.43.124.7772: UDP, length 120
03:28:17.164608 IP 192.168.43.124.8880 > 192.168.43.195.7771: UDP, length 120
03:28:17.164828 IP 192.168.43.124.8880 > 192.168.43.195.7771: UDP, length 120
03:28:17.171110 IP 192.168.43.195.8880 > 192.168.43.124.7772: UDP, length 120
03:28:17.221108 IP 192.168.43.195.8880 > 192.168.43.124.7772: UDP, length 120
03:28:17.264534 IP 192.168.43.124.8880 > 192.168.43.195.7771: UDP, length 120
03:28:17.264768 IP 192.168.43.124.8880 > 192.168.43.195.7771: UDP, length 120
03:28:17.271108 IP 192.168.43.195.8880 > 192.168.43.124.7772: UDP, length 120
03:28:17.321137 IP 192.168.43.195.8880 > 192.168.43.124.7772: UDP, length 120
03:28:17.371116 IP 192.168.43.195.8880 > 192.168.43.124.7772: UDP, length 120
03:28:17.385267 IP 192.168.43.124.8880 > 192.168.43.195.7771: UDP, length 120
03:28:17.385501 IP 192.168.43.124.8880 > 192.168.43.195.7771: UDP, length 120
03:28:17.385616 IP 192.168.43.124.8880 > 192.168.43.195.7771: UDP, length 120
03:28:17.421114 IP 192.168.43.195.8880 > 192.168.43.124.7772: UDP, length 120
03:28:17.471118 IP 192.168.43.195.8880 > 192.168.43.124.7772: UDP, length 120
03:28:17.521110 IP 192.168.43.195.8880 > 192.168.43.124.7772: UDP, length 120
03:28:17.542333 IP 192.168.43.124.8880 > 192.168.43.195.7771: UDP, length 120
03:28:17.542561 IP 192.168.43.124.8880 > 192.168.43.195.7771: UDP, length 120
03:28:17.542677 IP 192.168.43.124.8880 > 192.168.43.195.7771: UDP, length 120
03:28:17.571112 IP 192.168.43.195.8880 > 192.168.43.124.7772: UDP, length 120
03:28:17.621114 IP 192.168.43.195.8880 > 192.168.43.124.7772: UDP, length 120
03:28:17.666203 IP 192.168.43.124.8880 > 192.168.43.195.7771: UDP, length 120
03:28:17.666333 IP 192.168.43.124.8880 > 192.168.43.195.7771: UDP, length 120
03:28:17.671110 IP 192.168.43.195.8880 > 192.168.43.124.7772: UDP, length 120
03:28:17.721114 IP 192.168.43.195.8880 > 192.168.43.124.7772: UDP, length 120
03:28:17.766612 IP 192.168.43.124.8880 > 192.168.43.195.7771: UDP, length 120
03:28:17.766810 IP 192.168.43.124.8880 > 192.168.43.195.7771: UDP, length 120
03:28:17.771154 IP 192.168.43.195.8880 > 192.168.43.124.7772: UDP, length 120
03:28:17.821126 IP 192.168.43.195.8880 > 192.168.43.124.7772: UDP, length 120
03:28:17.871108 IP 192.168.43.195.8880 > 192.168.43.124.7772: UDP, length 120
03:28:17.880069 IP 192.168.43.124.8880 > 192.168.43.195.7771: UDP, length 120
03:28:17.880290 IP 192.168.43.124.8880 > 192.168.43.195.7771: UDP, length 120
03:28:17.880411 IP 192.168.43.124.8880 > 192.168.43.195.7771: UDP, length 120
03:28:17.921115 IP 192.168.43.195.8880 > 192.168.43.124.7772: UDP, length 120
03:28:17.971110 IP 192.168.43.195.8880 > 192.168.43.124.7772: UDP, length 120
03:28:18.016772 IP 192.168.43.124.8880 > 192.168.43.195.7771: UDP, length 120
03:28:18.016987 IP 192.168.43.124.8880 > 192.168.43.195.7771: UDP, length 120
03:28:18.021114 IP 192.168.43.195.8880 > 192.168.43.124.7772: UDP, length 120
03:28:18.071115 IP 192.168.43.195.8880 > 192.168.43.124.7772: UDP, length 120
03:28:18.117381 IP 192.168.43.124.8880 > 192.168.43.195.7771: UDP, length 120
03:28:18.117669 IP 192.168.43.124.8880 > 192.168.43.195.7771: UDP, length 120
03:28:18.121108 IP 192.168.43.195.8880 > 192.168.43.124.7772: UDP, length 120
03:28:18.171110 IP 192.168.43.195.8880 > 192.168.43.124.7772: UDP, length 120
03:28:18.221108 IP 192.168.43.195.8880 > 192.168.43.124.7772: UDP, length 120
03:28:18.230767 IP 192.168.43.124.8880 > 192.168.43.195.7771: UDP, length 120
03:28:18.231005 IP 192.168.43.124.8880 > 192.168.43.195.7771: UDP, length 120
03:28:18.231118 IP 192.168.43.124.8880 > 192.168.43.195.7771: UDP, length 120
03:28:18.271119 IP 192.168.43.195.8880 > 192.168.43.124.7772: UDP, length 120
03:28:18.321122 IP 192.168.43.195.8880 > 192.168.43.124.7772: UDP, length 120
03:28:18.366262 IP 192.168.43.124.8880 > 192.168.43.195.7771: UDP, length 120
03:28:18.366525 IP 192.168.43.124.8880 > 192.168.43.195.7771: UDP, length 120
03:28:18.371111 IP 192.168.43.195.8880 > 192.168.43.124.7772: UDP, length 120
03:28:18.421110 IP 192.168.43.195.8880 > 192.168.43.124.7772: UDP, length 120
03:28:18.466658 IP 192.168.43.124.8880 > 192.168.43.195.7771: UDP, length 120
03:28:18.466921 IP 192.168.43.124.8880 > 192.168.43.195.7771: UDP, length 120
03:28:18.471109 IP 192.168.43.195.8880 > 192.168.43.124.7772: UDP, length 120
03:28:18.521115 IP 192.168.43.195.8880 > 192.168.43.124.7772: UDP, length 120
03:28:18.571113 IP 192.168.43.195.8880 > 192.168.43.124.7772: UDP, length 120
03:28:18.579647 IP 192.168.43.124.8880 > 192.168.43.195.7771: UDP, length 120
03:28:18.579908 IP 192.168.43.124.8880 > 192.168.43.195.7771: UDP, length 120
03:28:18.580039 IP 192.168.43.124.8880 > 192.168.43.195.7771: UDP, length 120
03:28:18.621108 IP 192.168.43.195.8880 > 192.168.43.124.7772: UDP, length 120
03:28:18.670247 IP 192.168.43.124.8880 > 192.168.43.195.7771: UDP, length 120
03:28:18.670482 IP 192.168.43.124.8880 > 192.168.43.195.7771: UDP, length 120
03:28:18.671112 IP 192.168.43.195.8880 > 192.168.43.124.7772: UDP, length 120
03:28:18.721120 IP 192.168.43.195.8880 > 192.168.43.124.7772: UDP, length 120
03:28:18.725876 IP 192.168.43.124.8880 > 192.168.43.195.7771: UDP, length 120
03:28:18.771125 IP 192.168.43.195.8880 > 192.168.43.124.7772: UDP, length 120
03:28:18.771296 IP 192.168.43.124.8880 > 192.168.43.195.7771: UDP, length 120
03:28:18.819266 IP 192.168.43.124.8880 > 192.168.43.195.7771: UDP, length 120
03:28:18.821112 IP 192.168.43.195.8880 > 192.168.43.124.7772: UDP, length 120
03:28:18.871110 IP 192.168.43.195.8880 > 192.168.43.124.7772: UDP, length 120
03:28:18.872621 IP 192.168.43.124.8880 > 192.168.43.195.7771: UDP, length 120
03:28:18.921109 IP 192.168.43.195.8880 > 192.168.43.124.7772: UDP, length 120
03:28:18.926009 IP 192.168.43.124.8880 > 192.168.43.195.7771: UDP, length 120
03:28:18.969091 IP 192.168.43.124.8880 > 192.168.43.195.7771: UDP, length 120
03:28:18.971114 IP 192.168.43.195.8880 > 192.168.43.124.7772: UDP, length 120
03:28:19.019249 IP 192.168.43.124.8880 > 192.168.43.195.7771: UDP, length 120
03:28:19.021108 IP 192.168.43.195.8880 > 192.168.43.124.7772: UDP, length 120
03:28:19.071124 IP 192.168.43.195.8880 > 192.168.43.124.7772: UDP, length 120
03:28:19.071300 IP 192.168.43.124.8880 > 192.168.43.195.7771: UDP, length 120
03:28:19.121110 IP 192.168.43.195.8880 > 192.168.43.124.7772: UDP, length 120
03:28:19.126068 IP 192.168.43.124.8880 > 192.168.43.195.7771: UDP, length 120
03:28:19.169620 IP 192.168.43.124.8880 > 192.168.43.195.7771: UDP, length 120
03:28:19.171110 IP 192.168.43.195.8880 > 192.168.43.124.7772: UDP, length 120
03:28:19.219235 IP 192.168.43.124.8880 > 192.168.43.195.7771: UDP, length 120
03:28:19.221112 IP 192.168.43.195.8880 > 192.168.43.124.7772: UDP, length 120
03:28:19.269180 IP 192.168.43.124.8880 > 192.168.43.195.7771: UDP, length 120
03:28:19.271147 IP 192.168.43.195.8880 > 192.168.43.124.7772: UDP, length 120
03:28:19.321127 IP 192.168.43.195.8880 > 192.168.43.124.7772: UDP, length 120
03:28:19.332048 IP 192.168.43.124.8880 > 192.168.43.195.7771: UDP, length 120
03:28:19.369379 IP 192.168.43.124.8880 > 192.168.43.195.7771: UDP, length 120
03:28:19.371116 IP 192.168.43.195.8880 > 192.168.43.124.7772: UDP, length 120
03:28:19.420974 IP 192.168.43.124.8880 > 192.168.43.195.7771: UDP, length 120
03:28:19.421111 IP 192.168.43.195.8880 > 192.168.43.124.7772: UDP, length 120
03:28:19.471117 IP 192.168.43.195.8880 > 192.168.43.124.7772: UDP, length 120
03:28:19.477350 IP 192.168.43.124.8880 > 192.168.43.195.7771: UDP, length 120
03:28:19.519140 IP 192.168.43.124.8880 > 192.168.43.195.7771: UDP, length 120
03:28:19.521109 IP 192.168.43.195.8880 > 192.168.43.124.7772: UDP, length 120
03:28:19.569008 IP 192.168.43.124.8880 > 192.168.43.195.7771: UDP, length 120
03:28:19.571108 IP 192.168.43.195.8880 > 192.168.43.124.7772: UDP, length 120
03:28:19.619195 IP 192.168.43.124.8880 > 192.168.43.195.7771: UDP, length 120
03:28:19.621106 IP 192.168.43.195.8880 > 192.168.43.124.7772: UDP, length 120
03:28:19.669106 IP 192.168.43.124.8880 > 192.168.43.195.7771: UDP, length 120
03:28:19.671108 IP 192.168.43.195.8880 > 192.168.43.124.7772: UDP, length 120
03:28:19.719347 IP 192.168.43.124.8880 > 192.168.43.195.7771: UDP, length 120
03:28:19.721110 IP 192.168.43.195.8880 > 192.168.43.124.7772: UDP, length 120
03:28:19.769670 IP 192.168.43.124.8880 > 192.168.43.195.7771: UDP, length 120
03:28:19.771117 IP 192.168.43.195.8880 > 192.168.43.124.7772: UDP, length 120
03:28:19.821113 IP 192.168.43.195.8880 > 192.168.43.124.7772: UDP, length 120
03:28:19.825744 IP 192.168.43.124.8880 > 192.168.43.195.7771: UDP, length 120
03:28:19.871116 IP 192.168.43.195.8880 > 192.168.43.124.7772: UDP, length 120
03:28:19.871312 IP 192.168.43.124.8880 > 192.168.43.195.7771: UDP, length 120
03:28:19.919964 IP 192.168.43.124.8880 > 192.168.43.195.7771: UDP, length 120
03:28:19.921108 IP 192.168.43.195.8880 > 192.168.43.124.7772: UDP, length 120
03:28:19.971108 IP 192.168.43.195.8880 > 192.168.43.124.7772: UDP, length 120
03:28:19.974706 IP 192.168.43.124.8880 > 192.168.43.195.7771: UDP, length 120
03:28:20.019291 IP 192.168.43.124.8880 > 192.168.43.195.7771: UDP, length 120
03:28:20.021108 IP 192.168.43.195.8880 > 192.168.43.124.7772: UDP, length 120
03:28:20.069116 IP 192.168.43.124.8880 > 192.168.43.195.7771: UDP, length 120
03:28:20.071106 IP 192.168.43.195.8880 > 192.168.43.124.7772: UDP, length 120
03:28:20.119194 IP 192.168.43.124.8880 > 192.168.43.195.7771: UDP, length 120
03:28:20.121108 IP 192.168.43.195.8880 > 192.168.43.124.7772: UDP, length 120
03:28:20.169355 IP 192.168.43.124.8880 > 192.168.43.195.7771: UDP, length 120
03:28:20.171106 IP 192.168.43.195.8880 > 192.168.43.124.7772: UDP, length 120
03:28:20.219211 IP 192.168.43.124.8880 > 192.168.43.195.7771: UDP, length 120
03:28:20.221104 IP 192.168.43.195.8880 > 192.168.43.124.7772: UDP, length 120
03:28:20.269565 IP 192.168.43.124.8880 > 192.168.43.195.7771: UDP, length 120
03:28:20.271108 IP 192.168.43.195.8880 > 192.168.43.124.7772: UDP, length 120
03:28:20.321114 IP 192.168.43.195.8880 > 192.168.43.124.7772: UDP, length 120
03:28:20.325761 IP 192.168.43.124.8880 > 192.168.43.195.7771: UDP, length 120
03:28:20.369454 IP 192.168.43.124.8880 > 192.168.43.195.7771: UDP, length 120
03:28:20.371110 IP 192.168.43.195.8880 > 192.168.43.124.7772: UDP, length 120
03:28:20.416127 IP 192.168.43.124.8880 > 192.168.43.195.7771: UDP, length 120
03:28:20.421109 IP 192.168.43.195.8880 > 192.168.43.124.7772: UDP, length 120
03:28:20.469295 IP 192.168.43.124.8880 > 192.168.43.195.7771: UDP, length 120
03:28:20.471109 IP 192.168.43.195.8880 > 192.168.43.124.7772: UDP, length 120
03:28:20.521110 IP 192.168.43.195.8880 > 192.168.43.124.7772: UDP, length 120
03:28:20.526146 IP 192.168.43.124.8880 > 192.168.43.195.7771: UDP, length 120
03:28:20.569605 IP 192.168.43.124.8880 > 192.168.43.195.7771: UDP, length 120
03:28:20.571109 IP 192.168.43.195.8880 > 192.168.43.124.7772: UDP, length 120
03:28:20.619430 IP 192.168.43.124.8880 > 192.168.43.195.7771: UDP, length 120
03:28:20.621107 IP 192.168.43.195.8880 > 192.168.43.124.7772: UDP, length 120
03:28:20.669384 IP 192.168.43.124.8880 > 192.168.43.195.7771: UDP, length 120
03:28:20.671110 IP 192.168.43.195.8880 > 192.168.43.124.7772: UDP, length 120
03:28:20.719250 IP 192.168.43.124.8880 > 192.168.43.195.7771: UDP, length 120
03:28:20.721106 IP 192.168.43.195.8880 > 192.168.43.124.7772: UDP, length 120
03:28:20.769347 IP 192.168.43.124.8880 > 192.168.43.195.7771: UDP, length 120
03:28:20.771160 IP 192.168.43.195.8880 > 192.168.43.124.7772: UDP, length 120
03:28:20.821007 IP 192.168.43.124.8880 > 192.168.43.195.7771: UDP, length 120
03:28:20.821148 IP 192.168.43.195.8880 > 192.168.43.124.7772: UDP, length 120
03:28:20.871120 IP 192.168.43.195.8880 > 192.168.43.124.7772: UDP, length 120
03:28:20.875963 IP 192.168.43.124.8880 > 192.168.43.195.7771: UDP, length 120
03:28:20.921117 IP 192.168.43.195.8880 > 192.168.43.124.7772: UDP, length 120
03:28:20.922474 IP 192.168.43.124.8880 > 192.168.43.195.7771: UDP, length 120
03:28:20.969378 IP 192.168.43.124.8880 > 192.168.43.195.7771: UDP, length 120
03:28:20.971118 IP 192.168.43.195.8880 > 192.168.43.124.7772: UDP, length 120
03:28:21.021118 IP 192.168.43.195.8880 > 192.168.43.124.7772: UDP, length 120
03:28:21.021305 IP 192.168.43.124.8880 > 192.168.43.195.7771: UDP, length 120
03:28:21.069273 IP 192.168.43.124.8880 > 192.168.43.195.7771: UDP, length 120
03:28:21.071109 IP 192.168.43.195.8880 > 192.168.43.124.7772: UDP, length 120
03:28:21.119388 IP 192.168.43.124.8880 > 192.168.43.195.7771: UDP, length 120
03:28:21.121107 IP 192.168.43.195.8880 > 192.168.43.124.7772: UDP, length 120
03:28:21.169307 IP 192.168.43.124.8880 > 192.168.43.195.7771: UDP, length 120
03:28:21.171107 IP 192.168.43.195.8880 > 192.168.43.124.7772: UDP, length 120
03:28:21.221114 IP 192.168.43.195.8880 > 192.168.43.124.7772: UDP, length 120
03:28:21.228433 IP 192.168.43.124.8880 > 192.168.43.195.7771: UDP, length 120
03:28:21.269448 IP 192.168.43.124.8880 > 192.168.43.195.7771: UDP, length 120
03:28:21.271114 IP 192.168.43.195.8880 > 192.168.43.124.7772: UDP, length 120
03:28:21.319423 IP 192.168.43.124.8880 > 192.168.43.195.7771: UDP, length 120
03:28:21.321117 IP 192.168.43.195.8880 > 192.168.43.124.7772: UDP, length 120
03:28:21.371109 IP 192.168.43.195.8880 > 192.168.43.124.7772: UDP, length 120
03:28:21.378631 IP 192.168.43.124.8880 > 192.168.43.195.7771: UDP, length 120
03:28:21.419367 IP 192.168.43.124.8880 > 192.168.43.195.7771: UDP, length 120
03:28:21.421110 IP 192.168.43.195.8880 > 192.168.43.124.7772: UDP, length 120
03:28:21.469313 IP 192.168.43.124.8880 > 192.168.43.195.7771: UDP, length 120
03:28:21.471115 IP 192.168.43.195.8880 > 192.168.43.124.7772: UDP, length 120
03:28:21.519347 IP 192.168.43.124.8880 > 192.168.43.195.7771: UDP, length 120
03:28:21.521113 IP 192.168.43.195.8880 > 192.168.43.124.7772: UDP, length 120
03:28:21.569360 IP 192.168.43.124.8880 > 192.168.43.195.7771: UDP, length 120
03:28:21.571108 IP 192.168.43.195.8880 > 192.168.43.124.7772: UDP, length 120
03:28:21.619186 IP 192.168.43.124.8880 > 192.168.43.195.7771: UDP, length 120
03:28:21.621108 IP 192.168.43.195.8880 > 192.168.43.124.7772: UDP, length 120
03:28:21.670152 IP 192.168.43.124.8880 > 192.168.43.195.7771: UDP, length 120
03:28:21.671110 IP 192.168.43.195.8880 > 192.168.43.124.7772: UDP, length 120
03:28:21.721114 IP 192.168.43.195.8880 > 192.168.43.124.7772: UDP, length 120
03:28:21.726081 IP 192.168.43.124.8880 > 192.168.43.195.7771: UDP, length 120
03:28:21.769391 IP 192.168.43.124.8880 > 192.168.43.195.7771: UDP, length 120
03:28:21.771114 IP 192.168.43.195.8880 > 192.168.43.124.7772: UDP, length 120
03:28:21.819729 IP 192.168.43.124.8880 > 192.168.43.195.7771: UDP, length 120
03:28:21.821109 IP 192.168.43.195.8880 > 192.168.43.124.7772: UDP, length 120
03:28:21.871114 IP 192.168.43.195.8880 > 192.168.43.124.7772: UDP, length 120
03:28:21.921117 IP 192.168.43.195.8880 > 192.168.43.124.7772: UDP, length 120
03:28:21.971112 IP 192.168.43.195.8880 > 192.168.43.124.7772: UDP, length 120
03:28:22.021107 IP 192.168.43.195.8880 > 192.168.43.124.7772: UDP, length 120
03:28:22.023568 IP 192.168.43.124.8880 > 192.168.43.195.7771: UDP, length 120
03:28:22.023714 IP 192.168.43.124.8880 > 192.168.43.195.7771: UDP, length 120
03:28:22.023824 IP 192.168.43.124.8880 > 192.168.43.195.7771: UDP, length 120
03:28:22.071112 IP 192.168.43.195.8880 > 192.168.43.124.7772: UDP, length 120
03:28:22.121107 IP 192.168.43.195.8880 > 192.168.43.124.7772: UDP, length 120
03:28:22.171119 IP 192.168.43.195.8880 > 192.168.43.124.7772: UDP, length 120
03:28:22.184167 IP 192.168.43.124.8880 > 192.168.43.195.7771: UDP, length 120
03:28:22.184422 IP 192.168.43.124.8880 > 192.168.43.195.7771: UDP, length 120
03:28:22.184546 IP 192.168.43.124.8880 > 192.168.43.195.7771: UDP, length 120
03:28:22.221124 IP 192.168.43.195.8880 > 192.168.43.124.7772: UDP, length 120
03:28:22.271132 IP 192.168.43.195.8880 > 192.168.43.124.7772: UDP, length 120
03:28:22.317768 IP 192.168.43.124.8880 > 192.168.43.195.7771: UDP, length 120
03:28:22.317927 IP 192.168.43.124.8880 > 192.168.43.195.7771: UDP, length 120
03:28:22.321144 IP 192.168.43.195.8880 > 192.168.43.124.7772: UDP, length 120
03:28:22.371122 IP 192.168.43.195.8880 > 192.168.43.124.7772: UDP, length 120
03:28:22.421125 IP 192.168.43.195.8880 > 192.168.43.124.7772: UDP, length 120
03:28:22.421886 IP 192.168.43.124.8880 > 192.168.43.195.7771: UDP, length 120
03:28:22.422015 IP 192.168.43.124.8880 > 192.168.43.195.7771: UDP, length 120
03:28:22.422124 IP 192.168.43.124.8880 > 192.168.43.195.7771: UDP, length 120
03:28:22.471129 IP 192.168.43.195.8880 > 192.168.43.124.7772: UDP, length 120
03:28:22.521112 IP 192.168.43.195.8880 > 192.168.43.124.7772: UDP, length 120
03:28:22.571109 IP 192.168.43.195.8880 > 192.168.43.124.7772: UDP, length 120
03:28:22.574500 IP 192.168.43.124.8880 > 192.168.43.195.7771: UDP, length 120
03:28:22.574628 IP 192.168.43.124.8880 > 192.168.43.195.7771: UDP, length 120
03:28:22.574737 IP 192.168.43.124.8880 > 192.168.43.195.7771: UDP, length 120
03:28:22.621112 IP 192.168.43.195.8880 > 192.168.43.124.7772: UDP, length 120
03:28:22.671111 IP 192.168.43.195.8880 > 192.168.43.124.7772: UDP, length 120
03:28:22.718977 IP 192.168.43.124.8880 > 192.168.43.195.7771: UDP, length 120
03:28:22.719098 IP 192.168.43.124.8880 > 192.168.43.195.7771: UDP, length 120
03:28:22.721110 IP 192.168.43.195.8880 > 192.168.43.124.7772: UDP, length 120
03:28:22.771110 IP 192.168.43.195.8880 > 192.168.43.124.7772: UDP, length 120
03:28:22.819013 IP 192.168.43.124.8880 > 192.168.43.195.7771: UDP, length 120
03:28:22.819133 IP 192.168.43.124.8880 > 192.168.43.195.7771: UDP, length 120
03:28:22.821110 IP 192.168.43.195.8880 > 192.168.43.124.7772: UDP, length 120
03:28:22.871109 IP 192.168.43.195.8880 > 192.168.43.124.7772: UDP, length 120
03:28:22.921110 IP 192.168.43.195.8880 > 192.168.43.124.7772: UDP, length 120
03:28:22.929960 IP 192.168.43.124.8880 > 192.168.43.195.7771: UDP, length 120
03:28:22.930245 IP 192.168.43.124.8880 > 192.168.43.195.7771: UDP, length 120
03:28:22.930372 IP 192.168.43.124.8880 > 192.168.43.195.7771: UDP, length 120
03:28:22.971123 IP 192.168.43.195.8880 > 192.168.43.124.7772: UDP, length 120
03:28:23.021111 IP 192.168.43.195.8880 > 192.168.43.124.7772: UDP, length 120
03:28:23.070171 IP 192.168.43.124.8880 > 192.168.43.195.7771: UDP, length 120
03:28:23.070295 IP 192.168.43.124.8880 > 192.168.43.195.7771: UDP, length 120
03:28:23.071108 IP 192.168.43.195.8880 > 192.168.43.124.7772: UDP, length 120
03:28:23.121108 IP 192.168.43.195.8880 > 192.168.43.124.7772: UDP, length 120
03:28:23.171107 IP 192.168.43.195.8880 > 192.168.43.124.7772: UDP, length 120
03:28:23.172552 IP 192.168.43.124.8880 > 192.168.43.195.7771: UDP, length 120
03:28:23.172670 IP 192.168.43.124.8880 > 192.168.43.195.7771: UDP, length 120
03:28:23.221108 IP 192.168.43.195.8880 > 192.168.43.124.7772: UDP, length 120
03:28:23.271106 IP 192.168.43.195.8880 > 192.168.43.124.7772: UDP, length 120
03:28:23.280014 IP 192.168.43.124.8880 > 192.168.43.195.7771: UDP, length 120
03:28:23.280264 IP 192.168.43.124.8880 > 192.168.43.195.7771: UDP, length 120
03:28:23.280378 IP 192.168.43.124.8880 > 192.168.43.195.7771: UDP, length 120
03:28:23.321119 IP 192.168.43.195.8880 > 192.168.43.124.7772: UDP, length 120
03:28:23.371109 IP 192.168.43.195.8880 > 192.168.43.124.7772: UDP, length 120
03:28:23.416879 IP 192.168.43.124.8880 > 192.168.43.195.7771: UDP, length 120
03:28:23.417013 IP 192.168.43.124.8880 > 192.168.43.195.7771: UDP, length 120
03:28:23.421113 IP 192.168.43.195.8880 > 192.168.43.124.7772: UDP, length 120
03:28:23.471110 IP 192.168.43.195.8880 > 192.168.43.124.7772: UDP, length 120
03:28:23.517201 IP 192.168.43.124.8880 > 192.168.43.195.7771: UDP, length 120
03:28:23.517321 IP 192.168.43.124.8880 > 192.168.43.195.7771: UDP, length 120
03:28:23.521109 IP 192.168.43.195.8880 > 192.168.43.124.7772: UDP, length 120
03:28:23.571108 IP 192.168.43.195.8880 > 192.168.43.124.7772: UDP, length 120
03:28:23.621107 IP 192.168.43.195.8880 > 192.168.43.124.7772: UDP, length 120
03:28:23.650317 IP 192.168.43.124.8880 > 192.168.43.195.7771: UDP, length 120
03:28:23.650444 IP 192.168.43.124.8880 > 192.168.43.195.7771: UDP, length 120
03:28:23.650557 IP 192.168.43.124.8880 > 192.168.43.195.7771: UDP, length 120
03:28:23.671114 IP 192.168.43.195.8880 > 192.168.43.124.7772: UDP, length 120
03:28:23.721108 IP 192.168.43.195.8880 > 192.168.43.124.7772: UDP, length 120
03:28:23.764007 IP 192.168.43.124.8880 > 192.168.43.195.7771: UDP, length 120
03:28:23.764124 IP 192.168.43.124.8880 > 192.168.43.195.7771: UDP, length 120
03:28:23.771109 IP 192.168.43.195.8880 > 192.168.43.124.7772: UDP, length 120
03:28:23.821149 IP 192.168.43.195.8880 > 192.168.43.124.7772: UDP, length 120
03:28:23.865538 IP 192.168.43.124.8880 > 192.168.43.195.7771: UDP, length 120
03:28:23.865826 IP 192.168.43.124.8880 > 192.168.43.195.7771: UDP, length 120
03:28:23.871116 IP 192.168.43.195.8880 > 192.168.43.124.7772: UDP, length 120
03:28:23.921110 IP 192.168.43.195.8880 > 192.168.43.124.7772: UDP, length 120
03:28:23.971115 IP 192.168.43.195.8880 > 192.168.43.124.7772: UDP, length 120
03:28:24.000444 IP 192.168.43.124.8880 > 192.168.43.195.7771: UDP, length 120
03:28:24.000719 IP 192.168.43.124.8880 > 192.168.43.195.7771: UDP, length 120
03:28:24.000925 IP 192.168.43.124.8880 > 192.168.43.195.7771: UDP, length 120
03:28:24.021119 IP 192.168.43.195.8880 > 192.168.43.124.7772: UDP, length 120
03:28:24.071115 IP 192.168.43.195.8880 > 192.168.43.124.7772: UDP, length 120
03:28:24.121111 IP 192.168.43.195.8880 > 192.168.43.124.7772: UDP, length 120
03:28:24.124389 IP 192.168.43.124.8880 > 192.168.43.195.7771: UDP, length 120
03:28:24.124647 IP 192.168.43.124.8880 > 192.168.43.195.7771: UDP, length 120
03:28:24.124868 IP 192.168.43.124.8880 > 192.168.43.195.7771: UDP, length 120
03:28:24.171116 IP 192.168.43.195.8880 > 192.168.43.124.7772: UDP, length 120
03:28:24.221108 IP 192.168.43.195.8880 > 192.168.43.124.7772: UDP, length 120
03:28:24.271109 IP 192.168.43.195.8880 > 192.168.43.124.7772: UDP, length 120
03:28:24.301829 IP 192.168.43.124.8880 > 192.168.43.195.7771: UDP, length 120
03:28:24.302085 IP 192.168.43.124.8880 > 192.168.43.195.7771: UDP, length 120
03:28:24.302306 IP 192.168.43.124.8880 > 192.168.43.195.7771: UDP, length 120
03:28:24.321118 IP 192.168.43.195.8880 > 192.168.43.124.7772: UDP, length 120
03:28:24.371111 IP 192.168.43.195.8880 > 192.168.43.124.7772: UDP, length 120
03:28:24.411922 IP 192.168.43.124.8880 > 192.168.43.195.7771: UDP, length 120
03:28:24.412197 IP 192.168.43.124.8880 > 192.168.43.195.7771: UDP, length 120
03:28:24.421116 IP 192.168.43.195.8880 > 192.168.43.124.7772: UDP, length 120
03:28:24.471109 IP 192.168.43.195.8880 > 192.168.43.124.7772: UDP, length 120
03:28:24.521108 IP 192.168.43.195.8880 > 192.168.43.124.7772: UDP, length 120
03:28:24.544956 IP 192.168.43.124.8880 > 192.168.43.195.7771: UDP, length 120
03:28:24.545233 IP 192.168.43.124.8880 > 192.168.43.195.7771: UDP, length 120
03:28:24.545348 IP 192.168.43.124.8880 > 192.168.43.195.7771: UDP, length 120
03:28:24.571114 IP 192.168.43.195.8880 > 192.168.43.124.7772: UDP, length 120
03:28:24.621114 IP 192.168.43.195.8880 > 192.168.43.124.7772: UDP, length 120
03:28:24.668692 IP 192.168.43.124.8880 > 192.168.43.195.7771: UDP, length 120
03:28:24.668969 IP 192.168.43.124.8880 > 192.168.43.195.7771: UDP, length 120
03:28:24.671118 IP 192.168.43.195.8880 > 192.168.43.124.7772: UDP, length 120
03:28:24.721108 IP 192.168.43.195.8880 > 192.168.43.124.7772: UDP, length 120
03:28:24.769478 IP 192.168.43.124.8880 > 192.168.43.195.7771: UDP, length 120
03:28:24.769718 IP 192.168.43.124.8880 > 192.168.43.195.7771: UDP, length 120
03:28:24.771109 IP 192.168.43.195.8880 > 192.168.43.124.7772: UDP, length 120
03:28:24.821110 IP 192.168.43.195.8880 > 192.168.43.124.7772: UDP, length 120
03:28:24.871112 IP 192.168.43.195.8880 > 192.168.43.124.7772: UDP, length 120
03:28:24.886415 IP 192.168.43.124.8880 > 192.168.43.195.7771: UDP, length 120
03:28:24.886683 IP 192.168.43.124.8880 > 192.168.43.195.7771: UDP, length 120
03:28:24.886902 IP 192.168.43.124.8880 > 192.168.43.195.7771: UDP, length 120
03:28:24.921113 IP 192.168.43.195.8880 > 192.168.43.124.7772: UDP, length 120
03:28:24.971110 IP 192.168.43.195.8880 > 192.168.43.124.7772: UDP, length 120
03:28:25.021104 IP 192.168.43.195.8880 > 192.168.43.124.7772: UDP, length 120
03:28:25.022847 IP 192.168.43.124.8880 > 192.168.43.195.7771: UDP, length 120
03:28:25.023130 IP 192.168.43.124.8880 > 192.168.43.195.7771: UDP, length 120
03:28:25.069606 IP 192.168.43.124.8880 > 192.168.43.195.7771: UDP, length 120
03:28:25.069739 IP 192.168.43.124.8880 > 192.168.43.195.7771: UDP, length 120
03:28:25.071118 IP 192.168.43.195.8880 > 192.168.43.124.7772: UDP, length 120
03:28:25.119586 IP 192.168.43.124.8880 > 192.168.43.195.7771: UDP, length 120
03:28:25.121120 IP 192.168.43.195.8880 > 192.168.43.124.7772: UDP, length 120
03:28:25.170323 IP 192.168.43.124.8880 > 192.168.43.195.7771: UDP, length 120
03:28:25.171112 IP 192.168.43.195.8880 > 192.168.43.124.7772: UDP, length 120
03:28:25.221107 IP 192.168.43.195.8880 > 192.168.43.124.7772: UDP, length 120
03:28:25.222314 IP 192.168.43.124.8880 > 192.168.43.195.7771: UDP, length 120
03:28:25.269702 IP 192.168.43.124.8880 > 192.168.43.195.7771: UDP, length 120
03:28:25.271109 IP 192.168.43.195.8880 > 192.168.43.124.7772: UDP, length 120
03:28:25.321152 IP 192.168.43.195.8880 > 192.168.43.124.7772: UDP, length 120
03:28:25.328231 IP 192.168.43.124.8880 > 192.168.43.195.7771: UDP, length 120
03:28:25.366886 IP 192.168.43.124.8880 > 192.168.43.195.7771: UDP, length 120
03:28:25.371123 IP 192.168.43.195.8880 > 192.168.43.124.7772: UDP, length 120
03:28:25.419865 IP 192.168.43.124.8880 > 192.168.43.195.7771: UDP, length 120
03:28:25.421112 IP 192.168.43.195.8880 > 192.168.43.124.7772: UDP, length 120
03:28:25.469661 IP 192.168.43.124.8880 > 192.168.43.195.7771: UDP, length 120
03:28:25.471113 IP 192.168.43.195.8880 > 192.168.43.124.7772: UDP, length 120
03:28:25.521107 IP 192.168.43.195.8880 > 192.168.43.124.7772: UDP, length 120
03:28:25.522589 IP 192.168.43.124.8880 > 192.168.43.195.7771: UDP, length 120
03:28:25.569525 IP 192.168.43.124.8880 > 192.168.43.195.7771: UDP, length 120
03:28:25.571111 IP 192.168.43.195.8880 > 192.168.43.124.7772: UDP, length 120
03:28:25.621110 IP 192.168.43.195.8880 > 192.168.43.124.7772: UDP, length 120
03:28:25.624355 IP 192.168.43.124.8880 > 192.168.43.195.7771: UDP, length 120
03:28:25.671113 IP 192.168.43.195.8880 > 192.168.43.124.7772: UDP, length 120
03:28:25.671750 IP 192.168.43.124.8880 > 192.168.43.195.7771: UDP, length 120
03:28:25.721118 IP 192.168.43.195.8880 > 192.168.43.124.7772: UDP, length 120
03:28:25.750002 IP 192.168.43.124.8880 > 192.168.43.195.7771: UDP, length 120
03:28:25.771111 IP 192.168.43.195.8880 > 192.168.43.124.7772: UDP, length 120
03:28:25.771479 IP 192.168.43.124.8880 > 192.168.43.195.7771: UDP, length 120
03:28:25.821111 IP 192.168.43.195.8880 > 192.168.43.124.7772: UDP, length 120
03:28:25.821635 IP 192.168.43.124.8880 > 192.168.43.195.7771: UDP, length 120
03:28:25.870296 IP 192.168.43.124.8880 > 192.168.43.195.7771: UDP, length 120
03:28:25.871111 IP 192.168.43.195.8880 > 192.168.43.124.7772: UDP, length 120
03:28:25.921108 IP 192.168.43.195.8880 > 192.168.43.124.7772: UDP, length 120
03:28:25.921346 IP 192.168.43.124.8880 > 192.168.43.195.7771: UDP, length 120
03:28:25.971113 IP 192.168.43.195.8880 > 192.168.43.124.7772: UDP, length 120
03:28:25.971567 IP 192.168.43.124.8880 > 192.168.43.195.7771: UDP, length 120
03:28:26.021108 IP 192.168.43.195.8880 > 192.168.43.124.7772: UDP, length 120
03:28:26.022271 IP 192.168.43.124.8880 > 192.168.43.195.7771: UDP, length 120
03:28:26.069797 IP 192.168.43.124.8880 > 192.168.43.195.7771: UDP, length 120
03:28:26.071111 IP 192.168.43.195.8880 > 192.168.43.124.7772: UDP, length 120
03:28:26.120168 IP 192.168.43.124.8880 > 192.168.43.195.7771: UDP, length 120
03:28:26.121115 IP 192.168.43.195.8880 > 192.168.43.124.7772: UDP, length 120
03:28:26.171117 IP 192.168.43.195.8880 > 192.168.43.124.7772: UDP, length 120
03:28:26.171529 IP 192.168.43.124.8880 > 192.168.43.195.7771: UDP, length 120
03:28:26.220944 IP 192.168.43.124.8880 > 192.168.43.195.7771: UDP, length 120
03:28:26.221113 IP 192.168.43.195.8880 > 192.168.43.124.7772: UDP, length 120
03:28:26.271108 IP 192.168.43.195.8880 > 192.168.43.124.7772: UDP, length 120
03:28:26.271335 IP 192.168.43.124.8880 > 192.168.43.195.7771: UDP, length 120
03:28:26.321117 IP 192.168.43.195.8880 > 192.168.43.124.7772: UDP, length 120
03:28:26.323263 IP 192.168.43.124.8880 > 192.168.43.195.7771: UDP, length 120
03:28:26.371113 IP 192.168.43.195.8880 > 192.168.43.124.7772: UDP, length 120
03:28:26.372320 IP 192.168.43.124.8880 > 192.168.43.195.7771: UDP, length 120
03:28:26.421111 IP 192.168.43.195.8880 > 192.168.43.124.7772: UDP, length 120
03:28:26.423197 IP 192.168.43.124.8880 > 192.168.43.195.7771: UDP, length 120
03:28:26.470575 IP 192.168.43.124.8880 > 192.168.43.195.7771: UDP, length 120
03:28:26.471109 IP 192.168.43.195.8880 > 192.168.43.124.7772: UDP, length 120
03:28:26.521109 IP 192.168.43.195.8880 > 192.168.43.124.7772: UDP, length 120
03:28:26.521304 IP 192.168.43.124.8880 > 192.168.43.195.7771: UDP, length 120
03:28:26.571114 IP 192.168.43.195.8880 > 192.168.43.124.7772: UDP, length 120
03:28:26.571309 IP 192.168.43.124.8880 > 192.168.43.195.7771: UDP, length 120
03:28:26.621114 IP 192.168.43.195.8880 > 192.168.43.124.7772: UDP, length 120
03:28:26.621309 IP 192.168.43.124.8880 > 192.168.43.195.7771: UDP, length 120
03:28:26.671109 IP 192.168.43.195.8880 > 192.168.43.124.7772: UDP, length 120
03:28:26.671434 IP 192.168.43.124.8880 > 192.168.43.195.7771: UDP, length 120
03:28:26.721115 IP 192.168.43.195.8880 > 192.168.43.124.7772: UDP, length 120
03:28:26.721306 IP 192.168.43.124.8880 > 192.168.43.195.7771: UDP, length 120
03:28:26.771116 IP 192.168.43.195.8880 > 192.168.43.124.7772: UDP, length 120
03:28:26.771310 IP 192.168.43.124.8880 > 192.168.43.195.7771: UDP, length 120
03:28:26.821170 IP 192.168.43.195.8880 > 192.168.43.124.7772: UDP, length 120
03:28:26.821402 IP 192.168.43.124.8880 > 192.168.43.195.7771: UDP, length 120
03:28:26.870286 IP 192.168.43.124.8880 > 192.168.43.195.7771: UDP, length 120
03:28:26.871116 IP 192.168.43.195.8880 > 192.168.43.124.7772: UDP, length 120
03:28:26.921112 IP 192.168.43.195.8880 > 192.168.43.124.7772: UDP, length 120
03:28:26.921303 IP 192.168.43.124.8880 > 192.168.43.195.7771: UDP, length 120
03:28:26.971113 IP 192.168.43.195.8880 > 192.168.43.124.7772: UDP, length 120
03:28:26.971304 IP 192.168.43.124.8880 > 192.168.43.195.7771: UDP, length 120
03:28:27.021116 IP 192.168.43.195.8880 > 192.168.43.124.7772: UDP, length 120
03:28:27.021299 IP 192.168.43.124.8880 > 192.168.43.195.7771: UDP, length 120
03:28:27.071115 IP 192.168.43.195.8880 > 192.168.43.124.7772: UDP, length 120
03:28:27.071298 IP 192.168.43.124.8880 > 192.168.43.195.7771: UDP, length 120
03:28:27.119699 IP 192.168.43.124.8880 > 192.168.43.195.7771: UDP, length 120
03:28:27.121114 IP 192.168.43.195.8880 > 192.168.43.124.7772: UDP, length 120
03:28:27.171117 IP 192.168.43.195.8880 > 192.168.43.124.7772: UDP, length 120
03:28:27.174555 IP 192.168.43.124.8880 > 192.168.43.195.7771: UDP, length 120
03:28:27.221130 IP 192.168.43.195.8880 > 192.168.43.124.7772: UDP, length 120
03:28:27.221329 IP 192.168.43.124.8880 > 192.168.43.195.7771: UDP, length 120
03:28:27.271134 IP 192.168.43.195.8880 > 192.168.43.124.7772: UDP, length 120
03:28:27.271304 IP 192.168.43.124.8880 > 192.168.43.195.7771: UDP, length 120
03:28:27.319875 IP 192.168.43.124.8880 > 192.168.43.195.7771: UDP, length 120
03:28:27.321140 IP 192.168.43.195.8880 > 192.168.43.124.7772: UDP, length 120
03:28:27.371116 IP 192.168.43.195.8880 > 192.168.43.124.7772: UDP, length 120
03:28:27.371211 IP 192.168.43.124.8880 > 192.168.43.195.7771: UDP, length 120
03:28:27.421126 IP 192.168.43.195.8880 > 192.168.43.124.7772: UDP, length 120
03:28:27.422614 IP 192.168.43.124.8880 > 192.168.43.195.7771: UDP, length 120
03:28:27.471115 IP 192.168.43.195.8880 > 192.168.43.124.7772: UDP, length 120
03:28:27.473290 IP 192.168.43.124.8880 > 192.168.43.195.7771: UDP, length 120
03:28:27.521123 IP 192.168.43.195.8880 > 192.168.43.124.7772: UDP, length 120
03:28:27.521304 IP 192.168.43.124.8880 > 192.168.43.195.7771: UDP, length 120
03:28:27.570968 IP 192.168.43.124.8880 > 192.168.43.195.7771: UDP, length 120
03:28:27.571116 IP 192.168.43.195.8880 > 192.168.43.124.7772: UDP, length 120
03:28:27.619771 IP 192.168.43.124.8880 > 192.168.43.195.7771: UDP, length 120
03:28:27.621108 IP 192.168.43.195.8880 > 192.168.43.124.7772: UDP, length 120
03:28:27.671110 IP 192.168.43.195.8880 > 192.168.43.124.7772: UDP, length 120
03:28:27.672394 IP 192.168.43.124.8880 > 192.168.43.195.7771: UDP, length 120
03:28:27.719679 IP 192.168.43.124.8880 > 192.168.43.195.7771: UDP, length 120
03:28:27.721108 IP 192.168.43.195.8880 > 192.168.43.124.7772: UDP, length 120
03:28:27.769811 IP 192.168.43.124.8880 > 192.168.43.195.7771: UDP, length 120
03:28:27.771116 IP 192.168.43.195.8880 > 192.168.43.124.7772: UDP, length 120
03:28:27.821127 IP 192.168.43.195.8880 > 192.168.43.124.7772: UDP, length 120
03:28:27.821327 IP 192.168.43.124.8880 > 192.168.43.195.7771: UDP, length 120
03:28:27.871115 IP 192.168.43.195.8880 > 192.168.43.124.7772: UDP, length 120
03:28:27.871299 IP 192.168.43.124.8880 > 192.168.43.195.7771: UDP, length 120
03:28:27.921114 IP 192.168.43.195.8880 > 192.168.43.124.7772: UDP, length 120
03:28:27.921286 IP 192.168.43.124.8880 > 192.168.43.195.7771: UDP, length 120
03:28:27.971116 IP 192.168.43.195.8880 > 192.168.43.124.7772: UDP, length 120
03:28:27.971294 IP 192.168.43.124.8880 > 192.168.43.195.7771: UDP, length 120
03:28:28.021122 IP 192.168.43.195.8880 > 192.168.43.124.7772: UDP, length 120
03:28:28.021303 IP 192.168.43.124.8880 > 192.168.43.195.7771: UDP, length 120
03:28:28.071122 IP 192.168.43.195.8880 > 192.168.43.124.7772: UDP, length 120
03:28:28.071297 IP 192.168.43.124.8880 > 192.168.43.195.7771: UDP, length 120
03:28:28.121111 IP 192.168.43.195.8880 > 192.168.43.124.7772: UDP, length 120
03:28:28.121294 IP 192.168.43.124.8880 > 192.168.43.195.7771: UDP, length 120
03:28:28.171117 IP 192.168.43.195.8880 > 192.168.43.124.7772: UDP, length 120
03:28:28.171302 IP 192.168.43.124.8880 > 192.168.43.195.7771: UDP, length 120
03:28:28.221115 IP 192.168.43.195.8880 > 192.168.43.124.7772: UDP, length 120
03:28:28.221288 IP 192.168.43.124.8880 > 192.168.43.195.7771: UDP, length 120
03:28:28.271122 IP 192.168.43.195.8880 > 192.168.43.124.7772: UDP, length 120
03:28:28.321160 IP 192.168.43.195.8880 > 192.168.43.124.7772: UDP, length 120
03:28:28.371113 IP 192.168.43.195.8880 > 192.168.43.124.7772: UDP, length 120
03:28:28.418208 IP 192.168.43.124.8880 > 192.168.43.195.7771: UDP, length 120
03:28:28.418356 IP 192.168.43.124.8880 > 192.168.43.195.7771: UDP, length 120
03:28:28.421114 IP 192.168.43.195.8880 > 192.168.43.124.7772: UDP, length 120
03:28:28.471110 IP 192.168.43.195.8880 > 192.168.43.124.7772: UDP, length 120
03:28:28.521014 IP 192.168.43.124.8880 > 192.168.43.195.7771: UDP, length 120
03:28:28.521107 IP 192.168.43.195.8880 > 192.168.43.124.7772: UDP, length 120
03:28:28.521135 IP 192.168.43.124.8880 > 192.168.43.195.7771: UDP, length 120
03:28:28.571108 IP 192.168.43.195.8880 > 192.168.43.124.7772: UDP, length 120
03:28:28.620514 IP 192.168.43.124.8880 > 192.168.43.195.7771: UDP, length 120
03:28:28.620733 IP 192.168.43.124.8880 > 192.168.43.195.7771: UDP, length 120
03:28:28.621108 IP 192.168.43.195.8880 > 192.168.43.124.7772: UDP, length 120
03:28:28.671111 IP 192.168.43.195.8880 > 192.168.43.124.7772: UDP, length 120
03:28:28.720200 IP 192.168.43.124.8880 > 192.168.43.195.7771: UDP, length 120
03:28:28.720433 IP 192.168.43.124.8880 > 192.168.43.195.7771: UDP, length 120
03:28:28.721108 IP 192.168.43.195.8880 > 192.168.43.124.7772: UDP, length 120
03:28:28.771109 IP 192.168.43.195.8880 > 192.168.43.124.7772: UDP, length 120
03:28:28.820382 IP 192.168.43.124.8880 > 192.168.43.195.7771: UDP, length 120
03:28:28.820596 IP 192.168.43.124.8880 > 192.168.43.195.7771: UDP, length 120
03:28:28.821114 IP 192.168.43.195.8880 > 192.168.43.124.7772: UDP, length 120
03:28:28.871111 IP 192.168.43.195.8880 > 192.168.43.124.7772: UDP, length 120
03:28:28.920026 IP 192.168.43.124.8880 > 192.168.43.195.7771: UDP, length 120
03:28:28.920243 IP 192.168.43.124.8880 > 192.168.43.195.7771: UDP, length 120
03:28:28.921108 IP 192.168.43.195.8880 > 192.168.43.124.7772: UDP, length 120
03:28:28.971109 IP 192.168.43.195.8880 > 192.168.43.124.7772: UDP, length 120
03:28:29.020286 IP 192.168.43.124.8880 > 192.168.43.195.7771: UDP, length 120
03:28:29.020501 IP 192.168.43.124.8880 > 192.168.43.195.7771: UDP, length 120
03:28:29.021117 IP 192.168.43.195.8880 > 192.168.43.124.7772: UDP, length 120
03:28:29.071115 IP 192.168.43.195.8880 > 192.168.43.124.7772: UDP, length 120
03:28:29.119286 IP 192.168.43.124.8880 > 192.168.43.195.7771: UDP, length 120
03:28:29.119502 IP 192.168.43.124.8880 > 192.168.43.195.7771: UDP, length 120
03:28:29.121109 IP 192.168.43.195.8880 > 192.168.43.124.7772: UDP, length 120
03:28:29.171109 IP 192.168.43.195.8880 > 192.168.43.124.7772: UDP, length 120
03:28:29.220256 IP 192.168.43.124.8880 > 192.168.43.195.7771: UDP, length 120
03:28:29.220473 IP 192.168.43.124.8880 > 192.168.43.195.7771: UDP, length 120
03:28:29.221107 IP 192.168.43.195.8880 > 192.168.43.124.7772: UDP, length 120
03:28:29.271108 IP 192.168.43.195.8880 > 192.168.43.124.7772: UDP, length 120
03:28:29.320216 IP 192.168.43.124.8880 > 192.168.43.195.7771: UDP, length 120
03:28:29.320434 IP 192.168.43.124.8880 > 192.168.43.195.7771: UDP, length 120
03:28:29.321131 IP 192.168.43.195.8880 > 192.168.43.124.7772: UDP, length 120
03:28:29.371122 IP 192.168.43.195.8880 > 192.168.43.124.7772: UDP, length 120
03:28:29.420587 IP 192.168.43.124.8880 > 192.168.43.195.7771: UDP, length 120
03:28:29.420718 IP 192.168.43.124.8880 > 192.168.43.195.7771: UDP, length 120
03:28:29.421114 IP 192.168.43.195.8880 > 192.168.43.124.7772: UDP, length 120
03:28:29.471108 IP 192.168.43.195.8880 > 192.168.43.124.7772: UDP, length 120
03:28:29.519224 IP 192.168.43.124.8880 > 192.168.43.195.7771: UDP, length 120
03:28:29.519455 IP 192.168.43.124.8880 > 192.168.43.195.7771: UDP, length 120
03:28:29.521107 IP 192.168.43.195.8880 > 192.168.43.124.7772: UDP, length 120
03:28:29.571107 IP 192.168.43.195.8880 > 192.168.43.124.7772: UDP, length 120
03:28:29.621105 IP 192.168.43.195.8880 > 192.168.43.124.7772: UDP, length 120
03:28:29.623840 IP 192.168.43.124.8880 > 192.168.43.195.7771: UDP, length 120
03:28:29.623959 IP 192.168.43.124.8880 > 192.168.43.195.7771: UDP, length 120
03:28:29.671116 IP 192.168.43.195.8880 > 192.168.43.124.7772: UDP, length 120
03:28:29.720296 IP 192.168.43.124.8880 > 192.168.43.195.7771: UDP, length 120
03:28:29.720420 IP 192.168.43.124.8880 > 192.168.43.195.7771: UDP, length 120
03:28:29.721109 IP 192.168.43.195.8880 > 192.168.43.124.7772: UDP, length 120
03:28:29.771107 IP 192.168.43.195.8880 > 192.168.43.124.7772: UDP, length 120
03:28:29.819605 IP 192.168.43.124.8880 > 192.168.43.195.7771: UDP, length 120
03:28:29.819759 IP 192.168.43.124.8880 > 192.168.43.195.7771: UDP, length 120
03:28:29.821146 IP 192.168.43.195.8880 > 192.168.43.124.7772: UDP, length 120
03:28:29.871113 IP 192.168.43.195.8880 > 192.168.43.124.7772: UDP, length 120
03:28:29.919993 IP 192.168.43.124.8880 > 192.168.43.195.7771: UDP, length 120
03:28:29.920224 IP 192.168.43.124.8880 > 192.168.43.195.7771: UDP, length 120
03:28:29.921108 IP 192.168.43.195.8880 > 192.168.43.124.7772: UDP, length 120
03:28:29.971108 IP 192.168.43.195.8880 > 192.168.43.124.7772: UDP, length 120
03:28:30.019387 IP 192.168.43.124.8880 > 192.168.43.195.7771: UDP, length 120
03:28:30.019616 IP 192.168.43.124.8880 > 192.168.43.195.7771: UDP, length 120
03:28:30.021108 IP 192.168.43.195.8880 > 192.168.43.124.7772: UDP, length 120
03:28:30.071108 IP 192.168.43.195.8880 > 192.168.43.124.7772: UDP, length 120
03:28:30.120266 IP 192.168.43.124.8880 > 192.168.43.195.7771: UDP, length 120
03:28:30.120498 IP 192.168.43.124.8880 > 192.168.43.195.7771: UDP, length 120
03:28:30.121106 IP 192.168.43.195.8880 > 192.168.43.124.7772: UDP, length 120
03:28:30.171109 IP 192.168.43.195.8880 > 192.168.43.124.7772: UDP, length 120
03:28:30.220098 IP 192.168.43.124.8880 > 192.168.43.195.7771: UDP, length 120
03:28:30.220326 IP 192.168.43.124.8880 > 192.168.43.195.7771: UDP, length 120
03:28:30.221137 IP 192.168.43.195.8880 > 192.168.43.124.7772: UDP, length 120
03:28:30.319040 IP 192.168.43.124.8880 > 192.168.43.195.7771: UDP, length 120
03:28:30.319270 IP 192.168.43.124.8880 > 192.168.43.195.7771: UDP, length 120
03:28:30.420590 IP 192.168.43.124.8880 > 192.168.43.195.7771: UDP, length 120
03:28:30.420967 IP 192.168.43.124.8880 > 192.168.43.195.7771: UDP, length 120
03:28:30.521575 IP 192.168.43.124.8880 > 192.168.43.195.7771: UDP, length 120
03:28:30.521709 IP 192.168.43.124.8880 > 192.168.43.195.7771: UDP, length 120
03:28:30.637525 IP 192.168.43.124.8880 > 192.168.43.195.7771: UDP, length 120
03:28:30.637901 IP 192.168.43.124.8880 > 192.168.43.195.7771: UDP, length 120
03:28:30.638021 IP 192.168.43.124.8880 > 192.168.43.195.7771: UDP, length 120
03:28:30.778006 IP 192.168.43.124.8880 > 192.168.43.195.7771: UDP, length 120
03:28:30.778231 IP 192.168.43.124.8880 > 192.168.43.195.7771: UDP, length 120
03:28:30.778344 IP 192.168.43.124.8880 > 192.168.43.195.7771: UDP, length 120
03:28:30.931018 IP 192.168.43.124.8880 > 192.168.43.195.7771: UDP, length 120
03:28:30.931239 IP 192.168.43.124.8880 > 192.168.43.195.7771: UDP, length 120
03:28:30.931354 IP 192.168.43.124.8880 > 192.168.43.195.7771: UDP, length 120
03:28:31.077034 IP 192.168.43.124.8880 > 192.168.43.195.7771: UDP, length 120
03:28:31.077160 IP 192.168.43.124.8880 > 192.168.43.195.7771: UDP, length 120
03:28:31.177521 IP 192.168.43.124.8880 > 192.168.43.195.7771: UDP, length 120
03:28:31.177807 IP 192.168.43.124.8880 > 192.168.43.195.7771: UDP, length 120
03:28:31.177922 IP 192.168.43.124.8880 > 192.168.43.195.7771: UDP, length 120
03:28:31.227392 IP 192.168.43.124.8880 > 192.168.43.195.7771: UDP, length 120
03:28:31.272186 IP 192.168.43.124.8880 > 192.168.43.195.7771: UDP, length 120
03:28:31.321265 IP 192.168.43.124.8880 > 192.168.43.195.7771: UDP, length 120
03:28:31.379673 IP 192.168.43.124.8880 > 192.168.43.195.7771: UDP, length 120
03:28:31.419847 IP 192.168.43.124.8880 > 192.168.43.195.7771: UDP, length 120
03:28:31.472268 IP 192.168.43.124.8880 > 192.168.43.195.7771: UDP, length 120
03:28:31.527247 IP 192.168.43.124.8880 > 192.168.43.195.7771: UDP, length 120
03:28:31.569702 IP 192.168.43.124.8880 > 192.168.43.195.7771: UDP, length 120
03:28:31.619431 IP 192.168.43.124.8880 > 192.168.43.195.7771: UDP, length 120
03:28:31.673458 IP 192.168.43.124.8880 > 192.168.43.195.7771: UDP, length 120
03:28:31.721725 IP 192.168.43.124.8880 > 192.168.43.195.7771: UDP, length 120
03:28:31.771940 IP 192.168.43.124.8880 > 192.168.43.195.7771: UDP, length 120
03:28:31.821288 IP 192.168.43.124.8880 > 192.168.43.195.7771: UDP, length 120
03:28:31.874339 IP 192.168.43.124.8880 > 192.168.43.195.7771: UDP, length 120
03:28:31.921219 IP 192.168.43.124.8880 > 192.168.43.195.7771: UDP, length 120
03:28:31.973050 IP 192.168.43.124.8880 > 192.168.43.195.7771: UDP, length 120
03:28:32.021180 IP 192.168.43.124.8880 > 192.168.43.195.7771: UDP, length 120
03:28:32.071195 IP 192.168.43.124.8880 > 192.168.43.195.7771: UDP, length 120
03:28:32.270001 IP 192.168.43.124.8880 > 192.168.43.195.7771: UDP, length 120
03:28:32.270216 IP 192.168.43.124.8880 > 192.168.43.195.7771: UDP, length 120
03:28:32.370036 IP 192.168.43.124.8880 > 192.168.43.195.7771: UDP, length 120
03:28:32.370253 IP 192.168.43.124.8880 > 192.168.43.195.7771: UDP, length 120
03:28:32.470023 IP 192.168.43.124.8880 > 192.168.43.195.7771: UDP, length 120
03:28:32.470163 IP 192.168.43.124.8880 > 192.168.43.195.7771: UDP, length 120
03:28:32.570355 IP 192.168.43.124.8880 > 192.168.43.195.7771: UDP, length 120
03:28:32.570506 IP 192.168.43.124.8880 > 192.168.43.195.7771: UDP, length 120
03:28:32.671956 IP 192.168.43.124.8880 > 192.168.43.195.7771: UDP, length 120
03:28:32.672075 IP 192.168.43.124.8880 > 192.168.43.195.7771: UDP, length 120
03:28:32.771912 IP 192.168.43.124.8880 > 192.168.43.195.7771: UDP, length 120
03:28:32.772026 IP 192.168.43.124.8880 > 192.168.43.195.7771: UDP, length 120
03:28:32.870434 IP 192.168.43.124.8880 > 192.168.43.195.7771: UDP, length 120
03:28:32.870595 IP 192.168.43.124.8880 > 192.168.43.195.7771: UDP, length 120
03:28:32.970272 IP 192.168.43.124.8880 > 192.168.43.195.7771: UDP, length 120
03:28:32.970389 IP 192.168.43.124.8880 > 192.168.43.195.7771: UDP, length 120
03:28:33.068211 IP 192.168.43.124.8880 > 192.168.43.195.7771: UDP, length 120
03:28:33.068327 IP 192.168.43.124.8880 > 192.168.43.195.7771: UDP, length 120
03:28:33.170214 IP 192.168.43.124.8880 > 192.168.43.195.7771: UDP, length 120
03:28:33.170333 IP 192.168.43.124.8880 > 192.168.43.195.7771: UDP, length 120
03:28:33.270141 IP 192.168.43.124.8880 > 192.168.43.195.7771: UDP, length 120
03:28:33.270256 IP 192.168.43.124.8880 > 192.168.43.195.7771: UDP, length 120
03:28:33.369603 IP 192.168.43.124.8880 > 192.168.43.195.7771: UDP, length 120
03:28:33.369725 IP 192.168.43.124.8880 > 192.168.43.195.7771: UDP, length 120
03:28:33.470263 IP 192.168.43.124.8880 > 192.168.43.195.7771: UDP, length 120
03:28:33.470384 IP 192.168.43.124.8880 > 192.168.43.195.7771: UDP, length 120
03:28:33.570280 IP 192.168.43.124.8880 > 192.168.43.195.7771: UDP, length 120
03:28:33.570405 IP 192.168.43.124.8880 > 192.168.43.195.7771: UDP, length 120
03:28:33.667890 IP 192.168.43.124.8880 > 192.168.43.195.7771: UDP, length 120
03:28:33.668025 IP 192.168.43.124.8880 > 192.168.43.195.7771: UDP, length 120
03:28:33.807490 IP 192.168.43.124.8880 > 192.168.43.195.7771: UDP, length 120
03:28:33.807674 IP 192.168.43.124.8880 > 192.168.43.195.7771: UDP, length 120
03:28:33.807797 IP 192.168.43.124.8880 > 192.168.43.195.7771: UDP, length 120
03:28:33.920703 IP 192.168.43.124.8880 > 192.168.43.195.7771: UDP, length 120
03:28:33.920829 IP 192.168.43.124.8880 > 192.168.43.195.7771: UDP, length 120
03:28:33.920956 IP 192.168.43.124.8880 > 192.168.43.195.7771: UDP, length 120
03:28:34.064275 IP 192.168.43.124.8880 > 192.168.43.195.7771: UDP, length 120
03:28:34.064402 IP 192.168.43.124.8880 > 192.168.43.195.7771: UDP, length 120
