23:30:28.545531 IP 192.168.43.147.8880 > 192.168.43.124.7773: UDP, length 120
23:30:28.647721 IP 192.168.43.147.8880 > 192.168.43.124.7773: UDP, length 120
23:30:28.648859 IP 192.168.43.147.8880 > 192.168.43.124.7773: UDP, length 120
23:30:28.674187 IP 192.168.43.147.8880 > 192.168.43.124.7773: UDP, length 120
23:30:28.718847 IP 192.168.43.147.8880 > 192.168.43.124.7773: UDP, length 120
23:30:28.769898 IP 192.168.43.147.8880 > 192.168.43.124.7773: UDP, length 120
23:30:28.816508 IP 192.168.43.147.8880 > 192.168.43.124.7773: UDP, length 120
23:30:28.867673 IP 192.168.43.147.8880 > 192.168.43.124.7773: UDP, length 120
23:30:28.920766 IP 192.168.43.147.8880 > 192.168.43.124.7773: UDP, length 120
23:30:28.968874 IP 192.168.43.147.8880 > 192.168.43.124.7773: UDP, length 120
23:30:29.023078 IP 192.168.43.147.8880 > 192.168.43.124.7773: UDP, length 120
23:30:29.072112 IP 192.168.43.147.8880 > 192.168.43.124.7773: UDP, length 120
23:30:29.122130 IP 192.168.43.147.8880 > 192.168.43.124.7773: UDP, length 120
23:30:29.168670 IP 192.168.43.147.8880 > 192.168.43.124.7773: UDP, length 120
23:30:29.222944 IP 192.168.43.147.8880 > 192.168.43.124.7773: UDP, length 120
23:30:29.268336 IP 192.168.43.147.8880 > 192.168.43.124.7773: UDP, length 120
23:30:29.318407 IP 192.168.43.147.8880 > 192.168.43.124.7773: UDP, length 120
23:30:29.366045 IP 192.168.43.147.8880 > 192.168.43.124.7773: UDP, length 120
23:30:29.417949 IP 192.168.43.147.8880 > 192.168.43.124.7773: UDP, length 120
23:30:29.468597 IP 192.168.43.147.8880 > 192.168.43.124.7773: UDP, length 120
23:30:29.518719 IP 192.168.43.147.8880 > 192.168.43.124.7773: UDP, length 120
23:30:29.570624 IP 192.168.43.147.8880 > 192.168.43.124.7773: UDP, length 120
23:30:29.617927 IP 192.168.43.147.8880 > 192.168.43.124.7773: UDP, length 120
23:30:29.668672 IP 192.168.43.147.8880 > 192.168.43.124.7773: UDP, length 120
23:30:29.716076 IP 192.168.43.147.8880 > 192.168.43.124.7773: UDP, length 120
23:30:29.765754 IP 192.168.43.147.8880 > 192.168.43.124.7773: UDP, length 120
23:30:29.816030 IP 192.168.43.147.8880 > 192.168.43.124.7773: UDP, length 120
23:30:29.866310 IP 192.168.43.147.8880 > 192.168.43.124.7773: UDP, length 120
23:30:29.916524 IP 192.168.43.147.8880 > 192.168.43.124.7773: UDP, length 120
23:30:29.966394 IP 192.168.43.147.8880 > 192.168.43.124.7773: UDP, length 120
23:30:30.020413 IP 192.168.43.147.8880 > 192.168.43.124.7773: UDP, length 120
23:30:30.067105 IP 192.168.43.147.8880 > 192.168.43.124.7773: UDP, length 120
23:30:30.116251 IP 192.168.43.147.8880 > 192.168.43.124.7773: UDP, length 120
23:30:30.166182 IP 192.168.43.147.8880 > 192.168.43.124.7773: UDP, length 120
23:30:30.219426 IP 192.168.43.147.8880 > 192.168.43.124.7773: UDP, length 120
23:30:30.267864 IP 192.168.43.147.8880 > 192.168.43.124.7773: UDP, length 120
23:30:30.320363 IP 192.168.43.147.8880 > 192.168.43.124.7773: UDP, length 120
23:30:30.367547 IP 192.168.43.147.8880 > 192.168.43.124.7773: UDP, length 120
23:30:30.419446 IP 192.168.43.147.8880 > 192.168.43.124.7773: UDP, length 120
23:30:30.468323 IP 192.168.43.147.8880 > 192.168.43.124.7773: UDP, length 120
23:30:30.518503 IP 192.168.43.147.8880 > 192.168.43.124.7773: UDP, length 120
23:30:30.566454 IP 192.168.43.147.8880 > 192.168.43.124.7773: UDP, length 120
23:30:30.617607 IP 192.168.43.147.8880 > 192.168.43.124.7773: UDP, length 120
23:30:30.667627 IP 192.168.43.147.8880 > 192.168.43.124.7773: UDP, length 120
23:30:30.721434 IP 192.168.43.147.8880 > 192.168.43.124.7773: UDP, length 120
23:30:30.769134 IP 192.168.43.147.8880 > 192.168.43.124.7773: UDP, length 120
23:30:30.821751 IP 192.168.43.147.8880 > 192.168.43.124.7773: UDP, length 120
23:30:30.868850 IP 192.168.43.147.8880 > 192.168.43.124.7773: UDP, length 120
23:30:30.936141 IP 192.168.43.147.8880 > 192.168.43.124.7773: UDP, length 120
23:30:30.970038 IP 192.168.43.147.8880 > 192.168.43.124.7773: UDP, length 120
23:30:31.023310 IP 192.168.43.147.8880 > 192.168.43.124.7773: UDP, length 120
23:30:31.068799 IP 192.168.43.147.8880 > 192.168.43.124.7773: UDP, length 120
23:30:31.119051 IP 192.168.43.147.8880 > 192.168.43.124.7773: UDP, length 120
23:30:31.169516 IP 192.168.43.147.8880 > 192.168.43.124.7773: UDP, length 120
23:30:31.218319 IP 192.168.43.147.8880 > 192.168.43.124.7773: UDP, length 120
23:30:31.272311 IP 192.168.43.147.8880 > 192.168.43.124.7773: UDP, length 120
23:30:31.321361 IP 192.168.43.147.8880 > 192.168.43.124.7773: UDP, length 120
23:30:31.374427 IP 192.168.43.147.8880 > 192.168.43.124.7773: UDP, length 120
23:30:31.418699 IP 192.168.43.147.8880 > 192.168.43.124.7773: UDP, length 120
23:30:31.466952 IP 192.168.43.147.8880 > 192.168.43.124.7773: UDP, length 120
23:30:31.517218 IP 192.168.43.147.8880 > 192.168.43.124.7773: UDP, length 120
23:30:31.571994 IP 192.168.43.147.8880 > 192.168.43.124.7773: UDP, length 120
23:30:31.619875 IP 192.168.43.147.8880 > 192.168.43.124.7773: UDP, length 120
23:30:31.669744 IP 192.168.43.147.8880 > 192.168.43.124.7773: UDP, length 120
23:30:31.721176 IP 192.168.43.147.8880 > 192.168.43.124.7773: UDP, length 120
23:30:31.768688 IP 192.168.43.147.8880 > 192.168.43.124.7773: UDP, length 120
23:30:31.818835 IP 192.168.43.147.8880 > 192.168.43.124.7773: UDP, length 120
23:30:31.868664 IP 192.168.43.147.8880 > 192.168.43.124.7773: UDP, length 120
23:30:31.918566 IP 192.168.43.147.8880 > 192.168.43.124.7773: UDP, length 120
23:30:31.968839 IP 192.168.43.147.8880 > 192.168.43.124.7773: UDP, length 120
23:30:32.018794 IP 192.168.43.147.8880 > 192.168.43.124.7773: UDP, length 120
23:30:32.069334 IP 192.168.43.147.8880 > 192.168.43.124.7773: UDP, length 120
23:30:32.119189 IP 192.168.43.147.8880 > 192.168.43.124.7773: UDP, length 120
23:30:32.169337 IP 192.168.43.147.8880 > 192.168.43.124.7773: UDP, length 120
23:30:32.219470 IP 192.168.43.147.8880 > 192.168.43.124.7773: UDP, length 120
23:30:32.268728 IP 192.168.43.147.8880 > 192.168.43.124.7773: UDP, length 120
23:30:32.320908 IP 192.168.43.147.8880 > 192.168.43.124.7773: UDP, length 120
23:30:32.368581 IP 192.168.43.147.8880 > 192.168.43.124.7773: UDP, length 120
23:30:32.421830 IP 192.168.43.147.8880 > 192.168.43.124.7773: UDP, length 120
23:30:32.471635 IP 192.168.43.147.8880 > 192.168.43.124.7773: UDP, length 120
23:30:32.518719 IP 192.168.43.147.8880 > 192.168.43.124.7773: UDP, length 120
23:30:32.569973 IP 192.168.43.147.8880 > 192.168.43.124.7773: UDP, length 120
23:30:32.621106 IP 192.168.43.147.8880 > 192.168.43.124.7773: UDP, length 120
23:30:32.670032 IP 192.168.43.147.8880 > 192.168.43.124.7773: UDP, length 120
23:30:32.719555 IP 192.168.43.147.8880 > 192.168.43.124.7773: UDP, length 120
23:30:32.768481 IP 192.168.43.147.8880 > 192.168.43.124.7773: UDP, length 120
23:30:32.818635 IP 192.168.43.147.8880 > 192.168.43.124.7773: UDP, length 120
23:30:32.871573 IP 192.168.43.147.8880 > 192.168.43.124.7773: UDP, length 120
23:30:32.917976 IP 192.168.43.147.8880 > 192.168.43.124.7773: UDP, length 120
23:30:32.975015 IP 192.168.43.147.8880 > 192.168.43.124.7773: UDP, length 120
23:30:33.019738 IP 192.168.43.147.8880 > 192.168.43.124.7773: UDP, length 120
23:30:33.071365 IP 192.168.43.147.8880 > 192.168.43.124.7773: UDP, length 120
23:30:33.119836 IP 192.168.43.147.8880 > 192.168.43.124.7773: UDP, length 120
23:30:33.168315 IP 192.168.43.147.8880 > 192.168.43.124.7773: UDP, length 120
23:30:33.218451 IP 192.168.43.147.8880 > 192.168.43.124.7773: UDP, length 120
23:30:33.276499 IP 192.168.43.147.8880 > 192.168.43.124.7773: UDP, length 120
23:30:33.321171 IP 192.168.43.147.8880 > 192.168.43.124.7773: UDP, length 120
23:30:33.368498 IP 192.168.43.147.8880 > 192.168.43.124.7773: UDP, length 120
23:30:33.424227 IP 192.168.43.147.8880 > 192.168.43.124.7773: UDP, length 120
23:30:33.492707 IP 192.168.43.147.8880 > 192.168.43.124.7773: UDP, length 120
23:30:33.521719 IP 192.168.43.147.8880 > 192.168.43.124.7773: UDP, length 120
23:30:33.565699 IP 192.168.43.147.8880 > 192.168.43.124.7773: UDP, length 120
23:30:33.619088 IP 192.168.43.147.8880 > 192.168.43.124.7773: UDP, length 120
23:30:33.667832 IP 192.168.43.147.8880 > 192.168.43.124.7773: UDP, length 120
23:30:33.718565 IP 192.168.43.147.8880 > 192.168.43.124.7773: UDP, length 120
23:30:33.769741 IP 192.168.43.147.8880 > 192.168.43.124.7773: UDP, length 120
23:30:33.820216 IP 192.168.43.147.8880 > 192.168.43.124.7773: UDP, length 120
23:30:33.871170 IP 192.168.43.147.8880 > 192.168.43.124.7773: UDP, length 120
23:30:33.917513 IP 192.168.43.147.8880 > 192.168.43.124.7773: UDP, length 120
23:30:33.965110 IP 192.168.43.147.8880 > 192.168.43.124.7773: UDP, length 120
23:30:34.018258 IP 192.168.43.147.8880 > 192.168.43.124.7773: UDP, length 120
23:30:34.071210 IP 192.168.43.147.8880 > 192.168.43.124.7773: UDP, length 120
23:30:34.117681 IP 192.168.43.147.8880 > 192.168.43.124.7773: UDP, length 120
23:30:34.167739 IP 192.168.43.147.8880 > 192.168.43.124.7773: UDP, length 120
23:30:34.218065 IP 192.168.43.147.8880 > 192.168.43.124.7773: UDP, length 120
23:30:34.267452 IP 192.168.43.147.8880 > 192.168.43.124.7773: UDP, length 120
23:30:34.321151 IP 192.168.43.147.8880 > 192.168.43.124.7773: UDP, length 120
23:30:34.368488 IP 192.168.43.147.8880 > 192.168.43.124.7773: UDP, length 120
23:30:34.417881 IP 192.168.43.147.8880 > 192.168.43.124.7773: UDP, length 120
23:30:34.475559 IP 192.168.43.147.8880 > 192.168.43.124.7773: UDP, length 120
23:30:34.521056 IP 192.168.43.147.8880 > 192.168.43.124.7773: UDP, length 120
23:30:34.570870 IP 192.168.43.147.8880 > 192.168.43.124.7773: UDP, length 120
23:30:34.624184 IP 192.168.43.147.8880 > 192.168.43.124.7773: UDP, length 120
23:30:34.673668 IP 192.168.43.147.8880 > 192.168.43.124.7773: UDP, length 120
23:30:34.721992 IP 192.168.43.147.8880 > 192.168.43.124.7773: UDP, length 120
23:30:34.767747 IP 192.168.43.147.8880 > 192.168.43.124.7773: UDP, length 120
23:30:34.824500 IP 192.168.43.147.8880 > 192.168.43.124.7773: UDP, length 120
23:30:34.866778 IP 192.168.43.147.8880 > 192.168.43.124.7773: UDP, length 120
23:30:34.925200 IP 192.168.43.147.8880 > 192.168.43.124.7773: UDP, length 120
23:30:34.963267 IP 192.168.43.147.8880 > 192.168.43.124.7773: UDP, length 120
23:30:35.028622 IP 192.168.43.147.8880 > 192.168.43.124.7773: UDP, length 120
23:30:35.066061 IP 192.168.43.147.8880 > 192.168.43.124.7773: UDP, length 120
23:30:35.130396 IP 192.168.43.147.8880 > 192.168.43.124.7773: UDP, length 120
23:30:35.165867 IP 192.168.43.147.8880 > 192.168.43.124.7773: UDP, length 120
23:30:35.215736 IP 192.168.43.147.8880 > 192.168.43.124.7773: UDP, length 120
23:30:35.265769 IP 192.168.43.147.8880 > 192.168.43.124.7773: UDP, length 120
23:30:35.329307 IP 192.168.43.147.8880 > 192.168.43.124.7773: UDP, length 120
23:30:35.365532 IP 192.168.43.147.8880 > 192.168.43.124.7773: UDP, length 120
23:30:35.418301 IP 192.168.43.147.8880 > 192.168.43.124.7773: UDP, length 120
23:30:35.467430 IP 192.168.43.147.8880 > 192.168.43.124.7773: UDP, length 120
23:30:35.527042 IP 192.168.43.147.8880 > 192.168.43.124.7773: UDP, length 120
23:30:35.567018 IP 192.168.43.147.8880 > 192.168.43.124.7773: UDP, length 120
23:30:35.616465 IP 192.168.43.147.8880 > 192.168.43.124.7773: UDP, length 120
23:30:35.678521 IP 192.168.43.147.8880 > 192.168.43.124.7773: UDP, length 120
23:30:35.725303 IP 192.168.43.147.8880 > 192.168.43.124.7773: UDP, length 120
23:30:35.765346 IP 192.168.43.147.8880 > 192.168.43.124.7773: UDP, length 120
23:30:35.816394 IP 192.168.43.147.8880 > 192.168.43.124.7773: UDP, length 120
23:30:35.866999 IP 192.168.43.147.8880 > 192.168.43.124.7773: UDP, length 120
23:30:35.926962 IP 192.168.43.147.8880 > 192.168.43.124.7773: UDP, length 120
23:30:35.962896 IP 192.168.43.147.8880 > 192.168.43.124.7773: UDP, length 120
23:30:36.019689 IP 192.168.43.147.8880 > 192.168.43.124.7773: UDP, length 120
23:30:36.076415 IP 192.168.43.147.8880 > 192.168.43.124.7773: UDP, length 120
23:30:36.116256 IP 192.168.43.147.8880 > 192.168.43.124.7773: UDP, length 120
23:30:36.165718 IP 192.168.43.147.8880 > 192.168.43.124.7773: UDP, length 120
23:30:36.242390 IP 192.168.43.147.8880 > 192.168.43.124.7773: UDP, length 120
23:30:36.265947 IP 192.168.43.147.8880 > 192.168.43.124.7773: UDP, length 120
23:30:36.315954 IP 192.168.43.147.8880 > 192.168.43.124.7773: UDP, length 120
23:30:36.366351 IP 192.168.43.147.8880 > 192.168.43.124.7773: UDP, length 120
23:30:36.426160 IP 192.168.43.147.8880 > 192.168.43.124.7773: UDP, length 120
23:30:36.464086 IP 192.168.43.147.8880 > 192.168.43.124.7773: UDP, length 120
23:30:36.516586 IP 192.168.43.147.8880 > 192.168.43.124.7773: UDP, length 120
23:30:36.565171 IP 192.168.43.147.8880 > 192.168.43.124.7773: UDP, length 120
23:30:36.633664 IP 192.168.43.147.8880 > 192.168.43.124.7773: UDP, length 120
23:30:36.666817 IP 192.168.43.147.8880 > 192.168.43.124.7773: UDP, length 120
23:30:36.712001 IP 192.168.43.147.8880 > 192.168.43.124.7773: UDP, length 120
23:30:36.772463 IP 192.168.43.147.8880 > 192.168.43.124.7773: UDP, length 120
23:30:36.814881 IP 192.168.43.147.8880 > 192.168.43.124.7773: UDP, length 120
23:30:36.876690 IP 192.168.43.147.8880 > 192.168.43.124.7773: UDP, length 120
23:30:36.922526 IP 192.168.43.147.8880 > 192.168.43.124.7773: UDP, length 120
23:30:36.971085 IP 192.168.43.147.8880 > 192.168.43.124.7773: UDP, length 120
23:30:37.020042 IP 192.168.43.147.8880 > 192.168.43.124.7773: UDP, length 120
23:30:37.088189 IP 192.168.43.147.8880 > 192.168.43.124.7773: UDP, length 120
23:30:37.115374 IP 192.168.43.147.8880 > 192.168.43.124.7773: UDP, length 120
23:30:37.172845 IP 192.168.43.147.8880 > 192.168.43.124.7773: UDP, length 120
23:30:37.215394 IP 192.168.43.147.8880 > 192.168.43.124.7773: UDP, length 120
23:30:37.279289 IP 192.168.43.147.8880 > 192.168.43.124.7773: UDP, length 120
23:30:37.340544 IP 192.168.43.147.8880 > 192.168.43.124.7773: UDP, length 120
23:30:37.370270 IP 192.168.43.147.8880 > 192.168.43.124.7773: UDP, length 120
23:30:37.416414 IP 192.168.43.147.8880 > 192.168.43.124.7773: UDP, length 120
23:30:37.479353 IP 192.168.43.147.8880 > 192.168.43.124.7773: UDP, length 120
23:30:37.521098 IP 192.168.43.147.8880 > 192.168.43.124.7773: UDP, length 120
23:30:37.565890 IP 192.168.43.147.8880 > 192.168.43.124.7773: UDP, length 120
23:30:37.618118 IP 192.168.43.147.8880 > 192.168.43.124.7773: UDP, length 120
23:30:37.687925 IP 192.168.43.147.8880 > 192.168.43.124.7773: UDP, length 120
23:30:37.720143 IP 192.168.43.147.8880 > 192.168.43.124.7773: UDP, length 120
23:30:37.762007 IP 192.168.43.147.8880 > 192.168.43.124.7773: UDP, length 120
23:30:37.835813 IP 192.168.43.147.8880 > 192.168.43.124.7773: UDP, length 120
23:30:37.865439 IP 192.168.43.147.8880 > 192.168.43.124.7773: UDP, length 120
23:30:37.916125 IP 192.168.43.147.8880 > 192.168.43.124.7773: UDP, length 120
23:30:37.966864 IP 192.168.43.147.8880 > 192.168.43.124.7773: UDP, length 120
23:30:38.016919 IP 192.168.43.147.8880 > 192.168.43.124.7773: UDP, length 120
23:30:38.077343 IP 192.168.43.147.8880 > 192.168.43.124.7773: UDP, length 120
23:30:38.117737 IP 192.168.43.147.8880 > 192.168.43.124.7773: UDP, length 120
23:30:38.166675 IP 192.168.43.147.8880 > 192.168.43.124.7773: UDP, length 120
23:30:38.216953 IP 192.168.43.147.8880 > 192.168.43.124.7773: UDP, length 120
23:30:38.272206 IP 192.168.43.147.8880 > 192.168.43.124.7773: UDP, length 120
23:30:38.314638 IP 192.168.43.147.8880 > 192.168.43.124.7773: UDP, length 120
23:30:38.365878 IP 192.168.43.147.8880 > 192.168.43.124.7773: UDP, length 120
23:30:38.416745 IP 192.168.43.147.8880 > 192.168.43.124.7773: UDP, length 120
23:30:38.476779 IP 192.168.43.147.8880 > 192.168.43.124.7773: UDP, length 120
23:30:38.515276 IP 192.168.43.147.8880 > 192.168.43.124.7773: UDP, length 120
23:30:38.565488 IP 192.168.43.147.8880 > 192.168.43.124.7773: UDP, length 120
23:30:38.614831 IP 192.168.43.147.8880 > 192.168.43.124.7773: UDP, length 120
23:30:38.676303 IP 192.168.43.147.8880 > 192.168.43.124.7773: UDP, length 120
23:30:38.715141 IP 192.168.43.147.8880 > 192.168.43.124.7773: UDP, length 120
23:30:38.765400 IP 192.168.43.147.8880 > 192.168.43.124.7773: UDP, length 120
23:30:38.823368 IP 192.168.43.147.8880 > 192.168.43.124.7773: UDP, length 120
23:30:38.868019 IP 192.168.43.147.8880 > 192.168.43.124.7773: UDP, length 120
23:30:38.914532 IP 192.168.43.147.8880 > 192.168.43.124.7773: UDP, length 120
23:30:38.963110 IP 192.168.43.147.8880 > 192.168.43.124.7773: UDP, length 120
23:30:39.017098 IP 192.168.43.147.8880 > 192.168.43.124.7773: UDP, length 120
23:30:39.068005 IP 192.168.43.147.8880 > 192.168.43.124.7773: UDP, length 120
23:30:39.124758 IP 192.168.43.147.8880 > 192.168.43.124.7773: UDP, length 120
23:30:39.169661 IP 192.168.43.147.8880 > 192.168.43.124.7773: UDP, length 120
23:30:39.222392 IP 192.168.43.147.8880 > 192.168.43.124.7773: UDP, length 120
23:30:39.265639 IP 192.168.43.147.8880 > 192.168.43.124.7773: UDP, length 120
23:30:39.325739 IP 192.168.43.147.8880 > 192.168.43.124.7773: UDP, length 120
23:30:39.365785 IP 192.168.43.147.8880 > 192.168.43.124.7773: UDP, length 120
23:30:39.424011 IP 192.168.43.147.8880 > 192.168.43.124.7773: UDP, length 120
23:30:39.467341 IP 192.168.43.147.8880 > 192.168.43.124.7773: UDP, length 120
23:30:39.529053 IP 192.168.43.147.8880 > 192.168.43.124.7773: UDP, length 120
23:30:39.565461 IP 192.168.43.147.8880 > 192.168.43.124.7773: UDP, length 120
23:30:39.616178 IP 192.168.43.147.8880 > 192.168.43.124.7773: UDP, length 120
23:30:39.665229 IP 192.168.43.147.8880 > 192.168.43.124.7773: UDP, length 120
23:30:39.729654 IP 192.168.43.147.8880 > 192.168.43.124.7773: UDP, length 120
23:30:39.769115 IP 192.168.43.147.8880 > 192.168.43.124.7773: UDP, length 120
23:30:39.814629 IP 192.168.43.147.8880 > 192.168.43.124.7773: UDP, length 120
23:30:39.896253 IP 192.168.43.147.8880 > 192.168.43.124.7773: UDP, length 120
23:30:39.918027 IP 192.168.43.147.8880 > 192.168.43.124.7773: UDP, length 120
23:30:39.962196 IP 192.168.43.147.8880 > 192.168.43.124.7773: UDP, length 120
23:30:40.014544 IP 192.168.43.147.8880 > 192.168.43.124.7773: UDP, length 120
23:30:40.074797 IP 192.168.43.147.8880 > 192.168.43.124.7773: UDP, length 120
23:30:40.114663 IP 192.168.43.147.8880 > 192.168.43.124.7773: UDP, length 120
23:30:40.165490 IP 192.168.43.147.8880 > 192.168.43.124.7773: UDP, length 120
23:30:40.224202 IP 192.168.43.147.8880 > 192.168.43.124.7773: UDP, length 120
23:30:40.264786 IP 192.168.43.147.8880 > 192.168.43.124.7773: UDP, length 120
23:30:40.314360 IP 192.168.43.147.8880 > 192.168.43.124.7773: UDP, length 120
23:30:40.382521 IP 192.168.43.147.8880 > 192.168.43.124.7773: UDP, length 120
23:30:40.416869 IP 192.168.43.147.8880 > 192.168.43.124.7773: UDP, length 120
23:30:40.466356 IP 192.168.43.147.8880 > 192.168.43.124.7773: UDP, length 120
23:30:40.524167 IP 192.168.43.147.8880 > 192.168.43.124.7773: UDP, length 120
23:30:40.576285 IP 192.168.43.147.8880 > 192.168.43.124.7773: UDP, length 120
23:30:40.614863 IP 192.168.43.147.8880 > 192.168.43.124.7773: UDP, length 120
23:30:40.666549 IP 192.168.43.147.8880 > 192.168.43.124.7773: UDP, length 120
23:30:40.714590 IP 192.168.43.147.8880 > 192.168.43.124.7773: UDP, length 120
23:30:40.776380 IP 192.168.43.147.8880 > 192.168.43.124.7773: UDP, length 120
23:30:40.819705 IP 192.168.43.147.8880 > 192.168.43.124.7773: UDP, length 120
23:30:40.864471 IP 192.168.43.147.8880 > 192.168.43.124.7773: UDP, length 120
23:30:40.922402 IP 192.168.43.147.8880 > 192.168.43.124.7773: UDP, length 120
23:30:40.965429 IP 192.168.43.147.8880 > 192.168.43.124.7773: UDP, length 120
23:30:41.017804 IP 192.168.43.147.8880 > 192.168.43.124.7773: UDP, length 120
23:30:41.076628 IP 192.168.43.147.8880 > 192.168.43.124.7773: UDP, length 120
23:30:41.120640 IP 192.168.43.147.8880 > 192.168.43.124.7773: UDP, length 120
23:30:41.165063 IP 192.168.43.147.8880 > 192.168.43.124.7773: UDP, length 120
23:30:41.235136 IP 192.168.43.147.8880 > 192.168.43.124.7773: UDP, length 120
23:30:41.267176 IP 192.168.43.147.8880 > 192.168.43.124.7773: UDP, length 120
23:30:41.314374 IP 192.168.43.147.8880 > 192.168.43.124.7773: UDP, length 120
23:30:41.364530 IP 192.168.43.147.8880 > 192.168.43.124.7773: UDP, length 120
23:30:41.425113 IP 192.168.43.147.8880 > 192.168.43.124.7773: UDP, length 120
23:30:41.465712 IP 192.168.43.147.8880 > 192.168.43.124.7773: UDP, length 120
23:30:41.514356 IP 192.168.43.147.8880 > 192.168.43.124.7773: UDP, length 120
23:30:41.567467 IP 192.168.43.147.8880 > 192.168.43.124.7773: UDP, length 120
23:30:41.624004 IP 192.168.43.147.8880 > 192.168.43.124.7773: UDP, length 120
23:30:41.665891 IP 192.168.43.147.8880 > 192.168.43.124.7773: UDP, length 120
23:30:41.715561 IP 192.168.43.147.8880 > 192.168.43.124.7773: UDP, length 120
23:30:41.779516 IP 192.168.43.147.8880 > 192.168.43.124.7773: UDP, length 120
23:30:41.816863 IP 192.168.43.147.8880 > 192.168.43.124.7773: UDP, length 120
23:30:41.868473 IP 192.168.43.147.8880 > 192.168.43.124.7773: UDP, length 120
23:30:41.921583 IP 192.168.43.147.8880 > 192.168.43.124.7773: UDP, length 120
23:30:41.961287 IP 192.168.43.147.8880 > 192.168.43.124.7773: UDP, length 120
23:30:42.016921 IP 192.168.43.147.8880 > 192.168.43.124.7773: UDP, length 120
23:30:42.082208 IP 192.168.43.147.8880 > 192.168.43.124.7773: UDP, length 120
23:30:42.114315 IP 192.168.43.147.8880 > 192.168.43.124.7773: UDP, length 120
23:30:42.162135 IP 192.168.43.147.8880 > 192.168.43.124.7773: UDP, length 120
23:30:42.212937 IP 192.168.43.147.8880 > 192.168.43.124.7773: UDP, length 120
23:30:42.274824 IP 192.168.43.147.8880 > 192.168.43.124.7773: UDP, length 120
23:30:42.315408 IP 192.168.43.147.8880 > 192.168.43.124.7773: UDP, length 120
23:30:42.366874 IP 192.168.43.147.8880 > 192.168.43.124.7773: UDP, length 120
23:30:42.415286 IP 192.168.43.147.8880 > 192.168.43.124.7773: UDP, length 120
23:30:42.474864 IP 192.168.43.147.8880 > 192.168.43.124.7773: UDP, length 120
23:30:42.514814 IP 192.168.43.147.8880 > 192.168.43.124.7773: UDP, length 120
23:30:42.564396 IP 192.168.43.147.8880 > 192.168.43.124.7773: UDP, length 120
23:30:42.614691 IP 192.168.43.147.8880 > 192.168.43.124.7773: UDP, length 120
23:30:42.674130 IP 192.168.43.147.8880 > 192.168.43.124.7773: UDP, length 120
23:30:42.749542 IP 192.168.43.147.8880 > 192.168.43.124.7773: UDP, length 120
23:30:42.764820 IP 192.168.43.147.8880 > 192.168.43.124.7773: UDP, length 120
23:30:42.816318 IP 192.168.43.147.8880 > 192.168.43.124.7773: UDP, length 120
23:30:42.879522 IP 192.168.43.147.8880 > 192.168.43.124.7773: UDP, length 120
23:30:42.914160 IP 192.168.43.147.8880 > 192.168.43.124.7773: UDP, length 120
23:30:42.963700 IP 192.168.43.147.8880 > 192.168.43.124.7773: UDP, length 120
23:30:43.016201 IP 192.168.43.147.8880 > 192.168.43.124.7773: UDP, length 120
23:30:43.076333 IP 192.168.43.147.8880 > 192.168.43.124.7773: UDP, length 120
23:30:43.126713 IP 192.168.43.147.8880 > 192.168.43.124.7773: UDP, length 120
23:30:43.168687 IP 192.168.43.147.8880 > 192.168.43.124.7773: UDP, length 120
23:30:43.225153 IP 192.168.43.147.8880 > 192.168.43.124.7773: UDP, length 120
23:30:43.264283 IP 192.168.43.147.8880 > 192.168.43.124.7773: UDP, length 120
23:30:43.316903 IP 192.168.43.147.8880 > 192.168.43.124.7773: UDP, length 120
23:30:43.364938 IP 192.168.43.147.8880 > 192.168.43.124.7773: UDP, length 120
23:30:43.425118 IP 192.168.43.147.8880 > 192.168.43.124.7773: UDP, length 120
23:30:43.464695 IP 192.168.43.147.8880 > 192.168.43.124.7773: UDP, length 120
23:30:43.514301 IP 192.168.43.147.8880 > 192.168.43.124.7773: UDP, length 120
23:30:43.564224 IP 192.168.43.147.8880 > 192.168.43.124.7773: UDP, length 120
23:30:43.635017 IP 192.168.43.147.8880 > 192.168.43.124.7773: UDP, length 120
23:30:43.664743 IP 192.168.43.147.8880 > 192.168.43.124.7773: UDP, length 120
23:30:43.733181 IP 192.168.43.147.8880 > 192.168.43.124.7773: UDP, length 120
23:30:43.765873 IP 192.168.43.147.8880 > 192.168.43.124.7773: UDP, length 120
23:30:43.825567 IP 192.168.43.147.8880 > 192.168.43.124.7773: UDP, length 120
23:30:43.864210 IP 192.168.43.147.8880 > 192.168.43.124.7773: UDP, length 120
23:30:43.915534 IP 192.168.43.147.8880 > 192.168.43.124.7773: UDP, length 120
23:30:43.967295 IP 192.168.43.147.8880 > 192.168.43.124.7773: UDP, length 120
23:30:44.016012 IP 192.168.43.147.8880 > 192.168.43.124.7773: UDP, length 120
23:30:44.074992 IP 192.168.43.147.8880 > 192.168.43.124.7773: UDP, length 120
23:30:44.114529 IP 192.168.43.147.8880 > 192.168.43.124.7773: UDP, length 120
23:30:44.167307 IP 192.168.43.147.8880 > 192.168.43.124.7773: UDP, length 120
23:30:44.243581 IP 192.168.43.147.8880 > 192.168.43.124.7773: UDP, length 120
23:30:44.266682 IP 192.168.43.147.8880 > 192.168.43.124.7773: UDP, length 120
23:30:44.314065 IP 192.168.43.147.8880 > 192.168.43.124.7773: UDP, length 120
23:30:44.364123 IP 192.168.43.147.8880 > 192.168.43.124.7773: UDP, length 120
23:30:44.425191 IP 192.168.43.147.8880 > 192.168.43.124.7773: UDP, length 120
23:30:44.465190 IP 192.168.43.147.8880 > 192.168.43.124.7773: UDP, length 120
23:30:44.518791 IP 192.168.43.147.8880 > 192.168.43.124.7773: UDP, length 120
23:30:44.564129 IP 192.168.43.147.8880 > 192.168.43.124.7773: UDP, length 120
23:30:44.631506 IP 192.168.43.147.8880 > 192.168.43.124.7773: UDP, length 120
23:30:44.684290 IP 192.168.43.147.8880 > 192.168.43.124.7773: UDP, length 120
23:30:44.716252 IP 192.168.43.147.8880 > 192.168.43.124.7773: UDP, length 120
23:30:44.764427 IP 192.168.43.147.8880 > 192.168.43.124.7773: UDP, length 120
23:30:44.823748 IP 192.168.43.147.8880 > 192.168.43.124.7773: UDP, length 120
23:30:44.865365 IP 192.168.43.147.8880 > 192.168.43.124.7773: UDP, length 120
23:30:44.914313 IP 192.168.43.147.8880 > 192.168.43.124.7773: UDP, length 120
23:30:44.964442 IP 192.168.43.147.8880 > 192.168.43.124.7773: UDP, length 120
23:30:45.158353 IP 192.168.43.147.8880 > 192.168.43.124.7773: UDP, length 120
23:30:45.158367 IP 192.168.43.147.8880 > 192.168.43.124.7773: UDP, length 120
23:30:45.158368 IP 192.168.43.147.8880 > 192.168.43.124.7773: UDP, length 120
23:30:45.166405 IP 192.168.43.147.8880 > 192.168.43.124.7773: UDP, length 120
23:30:45.215759 IP 192.168.43.147.8880 > 192.168.43.124.7773: UDP, length 120
23:30:45.283673 IP 192.168.43.147.8880 > 192.168.43.124.7773: UDP, length 120
23:30:45.316199 IP 192.168.43.147.8880 > 192.168.43.124.7773: UDP, length 120
23:30:45.504729 IP 192.168.43.147.8880 > 192.168.43.124.7773: UDP, length 120
23:30:45.504744 IP 192.168.43.147.8880 > 192.168.43.124.7773: UDP, length 120
23:30:45.504746 IP 192.168.43.147.8880 > 192.168.43.124.7773: UDP, length 120
23:30:45.515607 IP 192.168.43.147.8880 > 192.168.43.124.7773: UDP, length 120
23:30:45.566185 IP 192.168.43.147.8880 > 192.168.43.124.7773: UDP, length 120
23:30:45.613723 IP 192.168.43.147.8880 > 192.168.43.124.7773: UDP, length 120
23:30:45.673293 IP 192.168.43.147.8880 > 192.168.43.124.7773: UDP, length 120
23:30:45.852339 IP 192.168.43.147.8880 > 192.168.43.124.7773: UDP, length 120
23:30:45.852352 IP 192.168.43.147.8880 > 192.168.43.124.7773: UDP, length 120
23:30:45.852353 IP 192.168.43.147.8880 > 192.168.43.124.7773: UDP, length 120
23:30:45.874382 IP 192.168.43.147.8880 > 192.168.43.124.7773: UDP, length 120
23:30:45.914160 IP 192.168.43.147.8880 > 192.168.43.124.7773: UDP, length 120
23:30:45.961823 IP 192.168.43.147.8880 > 192.168.43.124.7773: UDP, length 120
23:30:46.014682 IP 192.168.43.147.8880 > 192.168.43.124.7773: UDP, length 120
23:30:46.200300 IP 192.168.43.147.8880 > 192.168.43.124.7773: UDP, length 120
23:30:46.200313 IP 192.168.43.147.8880 > 192.168.43.124.7773: UDP, length 120
23:30:46.200315 IP 192.168.43.147.8880 > 192.168.43.124.7773: UDP, length 120
23:30:46.215137 IP 192.168.43.147.8880 > 192.168.43.124.7773: UDP, length 120
23:30:46.284632 IP 192.168.43.147.8880 > 192.168.43.124.7773: UDP, length 120
23:30:46.321792 IP 192.168.43.147.8880 > 192.168.43.124.7773: UDP, length 120
23:30:46.363530 IP 192.168.43.147.8880 > 192.168.43.124.7773: UDP, length 120
23:30:46.549849 IP 192.168.43.147.8880 > 192.168.43.124.7773: UDP, length 120
23:30:46.549861 IP 192.168.43.147.8880 > 192.168.43.124.7773: UDP, length 120
23:30:46.549863 IP 192.168.43.147.8880 > 192.168.43.124.7773: UDP, length 120
23:30:46.564930 IP 192.168.43.147.8880 > 192.168.43.124.7773: UDP, length 120
23:30:46.615774 IP 192.168.43.147.8880 > 192.168.43.124.7773: UDP, length 120
23:30:46.677655 IP 192.168.43.147.8880 > 192.168.43.124.7773: UDP, length 120
23:30:46.720320 IP 192.168.43.147.8880 > 192.168.43.124.7773: UDP, length 120
23:30:46.898895 IP 192.168.43.147.8880 > 192.168.43.124.7773: UDP, length 120
23:30:46.898907 IP 192.168.43.147.8880 > 192.168.43.124.7773: UDP, length 120
23:30:46.898909 IP 192.168.43.147.8880 > 192.168.43.124.7773: UDP, length 120
23:30:46.913975 IP 192.168.43.147.8880 > 192.168.43.124.7773: UDP, length 120
23:30:46.962544 IP 192.168.43.147.8880 > 192.168.43.124.7773: UDP, length 120
23:30:47.015116 IP 192.168.43.147.8880 > 192.168.43.124.7773: UDP, length 120
23:30:47.076787 IP 192.168.43.147.8880 > 192.168.43.124.7773: UDP, length 120
23:30:47.244257 IP 192.168.43.147.8880 > 192.168.43.124.7773: UDP, length 120
23:30:47.244270 IP 192.168.43.147.8880 > 192.168.43.124.7773: UDP, length 120
23:30:47.244272 IP 192.168.43.147.8880 > 192.168.43.124.7773: UDP, length 120
23:30:47.263612 IP 192.168.43.147.8880 > 192.168.43.124.7773: UDP, length 120
23:30:47.313594 IP 192.168.43.147.8880 > 192.168.43.124.7773: UDP, length 120
23:30:47.360528 IP 192.168.43.147.8880 > 192.168.43.124.7773: UDP, length 120
23:30:47.428405 IP 192.168.43.147.8880 > 192.168.43.124.7773: UDP, length 120
23:30:47.595783 IP 192.168.43.147.8880 > 192.168.43.124.7773: UDP, length 120
23:30:47.595795 IP 192.168.43.147.8880 > 192.168.43.124.7773: UDP, length 120
23:30:47.595797 IP 192.168.43.147.8880 > 192.168.43.124.7773: UDP, length 120
23:30:47.627956 IP 192.168.43.147.8880 > 192.168.43.124.7773: UDP, length 120
23:30:47.664841 IP 192.168.43.147.8880 > 192.168.43.124.7773: UDP, length 120
23:30:47.718299 IP 192.168.43.147.8880 > 192.168.43.124.7773: UDP, length 120
23:30:47.778109 IP 192.168.43.147.8880 > 192.168.43.124.7773: UDP, length 120
23:30:47.944314 IP 192.168.43.147.8880 > 192.168.43.124.7773: UDP, length 120
23:30:47.944326 IP 192.168.43.147.8880 > 192.168.43.124.7773: UDP, length 120
23:30:47.944328 IP 192.168.43.147.8880 > 192.168.43.124.7773: UDP, length 120
23:30:47.960610 IP 192.168.43.147.8880 > 192.168.43.124.7773: UDP, length 120
23:30:48.013563 IP 192.168.43.147.8880 > 192.168.43.124.7773: UDP, length 120
23:30:48.063162 IP 192.168.43.147.8880 > 192.168.43.124.7773: UDP, length 120
23:30:48.127787 IP 192.168.43.147.8880 > 192.168.43.124.7773: UDP, length 120
23:30:48.292076 IP 192.168.43.147.8880 > 192.168.43.124.7773: UDP, length 120
23:30:48.292088 IP 192.168.43.147.8880 > 192.168.43.124.7773: UDP, length 120
23:30:48.292090 IP 192.168.43.147.8880 > 192.168.43.124.7773: UDP, length 120
23:30:48.315693 IP 192.168.43.147.8880 > 192.168.43.124.7773: UDP, length 120
23:30:48.365212 IP 192.168.43.147.8880 > 192.168.43.124.7773: UDP, length 120
23:30:48.419470 IP 192.168.43.147.8880 > 192.168.43.124.7773: UDP, length 120
23:30:48.477456 IP 192.168.43.147.8880 > 192.168.43.124.7773: UDP, length 120
23:30:48.650818 IP 192.168.43.147.8880 > 192.168.43.124.7773: UDP, length 120
23:30:48.650831 IP 192.168.43.147.8880 > 192.168.43.124.7773: UDP, length 120
23:30:48.653968 IP 192.168.43.147.8880 > 192.168.43.124.7773: UDP, length 120
23:30:48.663224 IP 192.168.43.147.8880 > 192.168.43.124.7773: UDP, length 120
23:30:48.713947 IP 192.168.43.147.8880 > 192.168.43.124.7773: UDP, length 120
23:30:48.774275 IP 192.168.43.147.8880 > 192.168.43.124.7773: UDP, length 120
23:30:48.830596 IP 192.168.43.147.8880 > 192.168.43.124.7773: UDP, length 120
23:30:48.987846 IP 192.168.43.147.8880 > 192.168.43.124.7773: UDP, length 120
23:30:48.987856 IP 192.168.43.147.8880 > 192.168.43.124.7773: UDP, length 120
23:30:48.987857 IP 192.168.43.147.8880 > 192.168.43.124.7773: UDP, length 120
23:30:49.010182 IP 192.168.43.147.8880 > 192.168.43.124.7773: UDP, length 120
23:30:49.063424 IP 192.168.43.147.8880 > 192.168.43.124.7773: UDP, length 120
23:30:49.115377 IP 192.168.43.147.8880 > 192.168.43.124.7773: UDP, length 120
23:30:49.175887 IP 192.168.43.147.8880 > 192.168.43.124.7773: UDP, length 120
23:30:49.336696 IP 192.168.43.147.8880 > 192.168.43.124.7773: UDP, length 120
23:30:49.336711 IP 192.168.43.147.8880 > 192.168.43.124.7773: UDP, length 120
23:30:49.336713 IP 192.168.43.147.8880 > 192.168.43.124.7773: UDP, length 120
23:30:49.373743 IP 192.168.43.147.8880 > 192.168.43.124.7773: UDP, length 120
23:30:49.413484 IP 192.168.43.147.8880 > 192.168.43.124.7773: UDP, length 120
23:30:49.464738 IP 192.168.43.147.8880 > 192.168.43.124.7773: UDP, length 120
23:30:49.516092 IP 192.168.43.147.8880 > 192.168.43.124.7773: UDP, length 120
23:30:49.572852 IP 192.168.43.147.8880 > 192.168.43.124.7773: UDP, length 120
23:30:49.613024 IP 192.168.43.147.8880 > 192.168.43.124.7773: UDP, length 120
23:30:49.663418 IP 192.168.43.147.8880 > 192.168.43.124.7773: UDP, length 120
23:30:49.712978 IP 192.168.43.147.8880 > 192.168.43.124.7773: UDP, length 120
23:30:49.772848 IP 192.168.43.147.8880 > 192.168.43.124.7773: UDP, length 120
23:30:49.815563 IP 192.168.43.147.8880 > 192.168.43.124.7773: UDP, length 120
23:30:49.867970 IP 192.168.43.147.8880 > 192.168.43.124.7773: UDP, length 120
23:30:49.914464 IP 192.168.43.147.8880 > 192.168.43.124.7773: UDP, length 120
23:30:49.959749 IP 192.168.43.147.8880 > 192.168.43.124.7773: UDP, length 120
23:30:50.013760 IP 192.168.43.147.8880 > 192.168.43.124.7773: UDP, length 120
23:30:50.065476 IP 192.168.43.147.8880 > 192.168.43.124.7773: UDP, length 120
23:30:50.133251 IP 192.168.43.147.8880 > 192.168.43.124.7773: UDP, length 120
23:30:50.162789 IP 192.168.43.147.8880 > 192.168.43.124.7773: UDP, length 120
23:30:50.212390 IP 192.168.43.147.8880 > 192.168.43.124.7773: UDP, length 120
23:30:50.262535 IP 192.168.43.147.8880 > 192.168.43.124.7773: UDP, length 120
23:30:50.321114 IP 192.168.43.147.8880 > 192.168.43.124.7773: UDP, length 120
23:30:50.363758 IP 192.168.43.147.8880 > 192.168.43.124.7773: UDP, length 120
23:30:50.412794 IP 192.168.43.147.8880 > 192.168.43.124.7773: UDP, length 120
23:30:50.462977 IP 192.168.43.147.8880 > 192.168.43.124.7773: UDP, length 120
23:30:50.524840 IP 192.168.43.147.8880 > 192.168.43.124.7773: UDP, length 120
23:30:50.565072 IP 192.168.43.147.8880 > 192.168.43.124.7773: UDP, length 120
23:30:50.617704 IP 192.168.43.147.8880 > 192.168.43.124.7773: UDP, length 120
23:30:50.662788 IP 192.168.43.147.8880 > 192.168.43.124.7773: UDP, length 120
23:30:50.722637 IP 192.168.43.147.8880 > 192.168.43.124.7773: UDP, length 120
23:30:50.763119 IP 192.168.43.147.8880 > 192.168.43.124.7773: UDP, length 120
23:30:50.813801 IP 192.168.43.147.8880 > 192.168.43.124.7773: UDP, length 120
23:30:50.879564 IP 192.168.43.147.8880 > 192.168.43.124.7773: UDP, length 120
23:30:50.912735 IP 192.168.43.147.8880 > 192.168.43.124.7773: UDP, length 120
23:30:50.960084 IP 192.168.43.147.8880 > 192.168.43.124.7773: UDP, length 120
23:30:51.012959 IP 192.168.43.147.8880 > 192.168.43.124.7773: UDP, length 120
23:30:51.080276 IP 192.168.43.147.8880 > 192.168.43.124.7773: UDP, length 120
23:30:51.112868 IP 192.168.43.147.8880 > 192.168.43.124.7773: UDP, length 120
23:30:51.162580 IP 192.168.43.147.8880 > 192.168.43.124.7773: UDP, length 120
23:30:51.213781 IP 192.168.43.147.8880 > 192.168.43.124.7773: UDP, length 120
23:30:51.274137 IP 192.168.43.147.8880 > 192.168.43.124.7773: UDP, length 120
23:30:51.316348 IP 192.168.43.147.8880 > 192.168.43.124.7773: UDP, length 120
23:30:51.363032 IP 192.168.43.147.8880 > 192.168.43.124.7773: UDP, length 120
23:30:51.413355 IP 192.168.43.147.8880 > 192.168.43.124.7773: UDP, length 120
23:30:51.474178 IP 192.168.43.147.8880 > 192.168.43.124.7773: UDP, length 120
23:30:51.514921 IP 192.168.43.147.8880 > 192.168.43.124.7773: UDP, length 120
23:30:51.563981 IP 192.168.43.147.8880 > 192.168.43.124.7773: UDP, length 120
23:30:51.614493 IP 192.168.43.147.8880 > 192.168.43.124.7773: UDP, length 120
23:30:51.676024 IP 192.168.43.147.8880 > 192.168.43.124.7773: UDP, length 120
23:30:51.712716 IP 192.168.43.147.8880 > 192.168.43.124.7773: UDP, length 120
23:30:51.762871 IP 192.168.43.147.8880 > 192.168.43.124.7773: UDP, length 120
23:30:51.813423 IP 192.168.43.147.8880 > 192.168.43.124.7773: UDP, length 120
23:30:51.874659 IP 192.168.43.147.8880 > 192.168.43.124.7773: UDP, length 120
23:30:51.916036 IP 192.168.43.147.8880 > 192.168.43.124.7773: UDP, length 120
23:30:51.961113 IP 192.168.43.147.8880 > 192.168.43.124.7773: UDP, length 120
23:30:52.011268 IP 192.168.43.147.8880 > 192.168.43.124.7773: UDP, length 120
23:30:52.073329 IP 192.168.43.147.8880 > 192.168.43.124.7773: UDP, length 120
23:30:52.114237 IP 192.168.43.147.8880 > 192.168.43.124.7773: UDP, length 120
23:30:52.163188 IP 192.168.43.147.8880 > 192.168.43.124.7773: UDP, length 120
23:30:52.216150 IP 192.168.43.147.8880 > 192.168.43.124.7773: UDP, length 120
23:30:52.275790 IP 192.168.43.147.8880 > 192.168.43.124.7773: UDP, length 120
23:30:52.316505 IP 192.168.43.147.8880 > 192.168.43.124.7773: UDP, length 120
23:30:52.363112 IP 192.168.43.147.8880 > 192.168.43.124.7773: UDP, length 120
23:30:52.416196 IP 192.168.43.147.8880 > 192.168.43.124.7773: UDP, length 120
23:30:52.474422 IP 192.168.43.147.8880 > 192.168.43.124.7773: UDP, length 120
23:30:52.513796 IP 192.168.43.147.8880 > 192.168.43.124.7773: UDP, length 120
23:30:52.565582 IP 192.168.43.147.8880 > 192.168.43.124.7773: UDP, length 120
23:30:52.615669 IP 192.168.43.147.8880 > 192.168.43.124.7773: UDP, length 120
23:30:52.683068 IP 192.168.43.147.8880 > 192.168.43.124.7773: UDP, length 120
23:30:52.714618 IP 192.168.43.147.8880 > 192.168.43.124.7773: UDP, length 120
23:30:52.764626 IP 192.168.43.147.8880 > 192.168.43.124.7773: UDP, length 120
23:30:52.812489 IP 192.168.43.147.8880 > 192.168.43.124.7773: UDP, length 120
23:30:52.864564 IP 192.168.43.147.8880 > 192.168.43.124.7773: UDP, length 120
23:30:52.914601 IP 192.168.43.147.8880 > 192.168.43.124.7773: UDP, length 120
23:30:52.961432 IP 192.168.43.147.8880 > 192.168.43.124.7773: UDP, length 120
23:30:53.016265 IP 192.168.43.147.8880 > 192.168.43.124.7773: UDP, length 120
23:30:53.062534 IP 192.168.43.147.8880 > 192.168.43.124.7773: UDP, length 120
23:30:53.116417 IP 192.168.43.147.8880 > 192.168.43.124.7773: UDP, length 120
23:30:53.164954 IP 192.168.43.147.8880 > 192.168.43.124.7773: UDP, length 120
23:30:53.214493 IP 192.168.43.147.8880 > 192.168.43.124.7773: UDP, length 120
23:30:53.264724 IP 192.168.43.147.8880 > 192.168.43.124.7773: UDP, length 120
23:30:53.314295 IP 192.168.43.147.8880 > 192.168.43.124.7773: UDP, length 120
23:30:53.365506 IP 192.168.43.147.8880 > 192.168.43.124.7773: UDP, length 120
23:30:53.414611 IP 192.168.43.147.8880 > 192.168.43.124.7773: UDP, length 120
23:30:53.467999 IP 192.168.43.147.8880 > 192.168.43.124.7773: UDP, length 120
23:30:57.960292 IP 192.168.43.124.8880 > 192.168.43.147.7772: UDP, length 120
23:30:58.010381 IP 192.168.43.124.8880 > 192.168.43.147.7772: UDP, length 120
23:30:58.060433 IP 192.168.43.124.8880 > 192.168.43.147.7772: UDP, length 120
23:30:58.110365 IP 192.168.43.124.8880 > 192.168.43.147.7772: UDP, length 120
23:30:58.160436 IP 192.168.43.124.8880 > 192.168.43.147.7772: UDP, length 120
23:30:58.210433 IP 192.168.43.124.8880 > 192.168.43.147.7772: UDP, length 120
23:30:58.260440 IP 192.168.43.124.8880 > 192.168.43.147.7772: UDP, length 120
23:30:58.310414 IP 192.168.43.124.8880 > 192.168.43.147.7772: UDP, length 120
23:30:58.360368 IP 192.168.43.124.8880 > 192.168.43.147.7772: UDP, length 120
23:30:58.410438 IP 192.168.43.124.8880 > 192.168.43.147.7772: UDP, length 120
23:30:58.460435 IP 192.168.43.124.8880 > 192.168.43.147.7772: UDP, length 120
23:30:58.510434 IP 192.168.43.124.8880 > 192.168.43.147.7772: UDP, length 120
23:30:58.560437 IP 192.168.43.124.8880 > 192.168.43.147.7772: UDP, length 120
23:30:58.610436 IP 192.168.43.124.8880 > 192.168.43.147.7772: UDP, length 120
23:30:58.660430 IP 192.168.43.124.8880 > 192.168.43.147.7772: UDP, length 120
23:30:58.710380 IP 192.168.43.124.8880 > 192.168.43.147.7772: UDP, length 120
23:30:58.760431 IP 192.168.43.124.8880 > 192.168.43.147.7772: UDP, length 120
23:30:58.810488 IP 192.168.43.124.8880 > 192.168.43.147.7772: UDP, length 120
23:30:58.860438 IP 192.168.43.124.8880 > 192.168.43.147.7772: UDP, length 120
23:30:58.910435 IP 192.168.43.124.8880 > 192.168.43.147.7772: UDP, length 120
23:30:58.960430 IP 192.168.43.124.8880 > 192.168.43.147.7772: UDP, length 120
23:30:59.010437 IP 192.168.43.124.8880 > 192.168.43.147.7772: UDP, length 120
23:30:59.060431 IP 192.168.43.124.8880 > 192.168.43.147.7772: UDP, length 120
23:30:59.110430 IP 192.168.43.124.8880 > 192.168.43.147.7772: UDP, length 120
23:30:59.160432 IP 192.168.43.124.8880 > 192.168.43.147.7772: UDP, length 120
23:30:59.210432 IP 192.168.43.124.8880 > 192.168.43.147.7772: UDP, length 120
23:30:59.260429 IP 192.168.43.124.8880 > 192.168.43.147.7772: UDP, length 120
23:30:59.310388 IP 192.168.43.124.8880 > 192.168.43.147.7772: UDP, length 120
23:30:59.360646 IP 192.168.43.124.8880 > 192.168.43.147.7772: UDP, length 120
23:30:59.410487 IP 192.168.43.124.8880 > 192.168.43.147.7772: UDP, length 120
23:30:59.460482 IP 192.168.43.124.8880 > 192.168.43.147.7772: UDP, length 120
23:30:59.510483 IP 192.168.43.124.8880 > 192.168.43.147.7772: UDP, length 120
23:30:59.560436 IP 192.168.43.124.8880 > 192.168.43.147.7772: UDP, length 120
23:30:59.610437 IP 192.168.43.124.8880 > 192.168.43.147.7772: UDP, length 120
23:30:59.660429 IP 192.168.43.124.8880 > 192.168.43.147.7772: UDP, length 120
23:30:59.710433 IP 192.168.43.124.8880 > 192.168.43.147.7772: UDP, length 120
23:30:59.760431 IP 192.168.43.124.8880 > 192.168.43.147.7772: UDP, length 120
23:30:59.810439 IP 192.168.43.124.8880 > 192.168.43.147.7772: UDP, length 120
23:30:59.860433 IP 192.168.43.124.8880 > 192.168.43.147.7772: UDP, length 120
23:30:59.910385 IP 192.168.43.124.8880 > 192.168.43.147.7772: UDP, length 120
23:30:59.960439 IP 192.168.43.124.8880 > 192.168.43.147.7772: UDP, length 120
23:31:00.010438 IP 192.168.43.124.8880 > 192.168.43.147.7772: UDP, length 120
23:31:00.060439 IP 192.168.43.124.8880 > 192.168.43.147.7772: UDP, length 120
23:31:00.110435 IP 192.168.43.124.8880 > 192.168.43.147.7772: UDP, length 120
23:31:00.160437 IP 192.168.43.124.8880 > 192.168.43.147.7772: UDP, length 120
23:31:00.210441 IP 192.168.43.124.8880 > 192.168.43.147.7772: UDP, length 120
23:31:00.260441 IP 192.168.43.124.8880 > 192.168.43.147.7772: UDP, length 120
23:31:00.310433 IP 192.168.43.124.8880 > 192.168.43.147.7772: UDP, length 120
23:31:00.360488 IP 192.168.43.124.8880 > 192.168.43.147.7772: UDP, length 120
23:31:00.410482 IP 192.168.43.124.8880 > 192.168.43.147.7772: UDP, length 120
23:31:00.460489 IP 192.168.43.124.8880 > 192.168.43.147.7772: UDP, length 120
23:31:00.510479 IP 192.168.43.124.8880 > 192.168.43.147.7772: UDP, length 120
23:31:00.560442 IP 192.168.43.124.8880 > 192.168.43.147.7772: UDP, length 120
23:31:00.610439 IP 192.168.43.124.8880 > 192.168.43.147.7772: UDP, length 120
23:31:00.660439 IP 192.168.43.124.8880 > 192.168.43.147.7772: UDP, length 120
23:31:00.710432 IP 192.168.43.124.8880 > 192.168.43.147.7772: UDP, length 120
23:31:00.760441 IP 192.168.43.124.8880 > 192.168.43.147.7772: UDP, length 120
23:31:00.810436 IP 192.168.43.124.8880 > 192.168.43.147.7772: UDP, length 120
23:31:00.860437 IP 192.168.43.124.8880 > 192.168.43.147.7772: UDP, length 120
23:31:00.910437 IP 192.168.43.124.8880 > 192.168.43.147.7772: UDP, length 120
23:31:00.960437 IP 192.168.43.124.8880 > 192.168.43.147.7772: UDP, length 120
23:31:01.010489 IP 192.168.43.124.8880 > 192.168.43.147.7772: UDP, length 120
23:31:01.060491 IP 192.168.43.124.8880 > 192.168.43.147.7772: UDP, length 120
23:31:01.110483 IP 192.168.43.124.8880 > 192.168.43.147.7772: UDP, length 120
23:31:01.160489 IP 192.168.43.124.8880 > 192.168.43.147.7772: UDP, length 120
23:31:01.210481 IP 192.168.43.124.8880 > 192.168.43.147.7772: UDP, length 120
23:31:01.260489 IP 192.168.43.124.8880 > 192.168.43.147.7772: UDP, length 120
23:31:01.310482 IP 192.168.43.124.8880 > 192.168.43.147.7772: UDP, length 120
23:31:01.360402 IP 192.168.43.124.8880 > 192.168.43.147.7772: UDP, length 120
23:31:01.410429 IP 192.168.43.124.8880 > 192.168.43.147.7772: UDP, length 120
23:31:01.460424 IP 192.168.43.124.8880 > 192.168.43.147.7772: UDP, length 120
23:31:01.510438 IP 192.168.43.124.8880 > 192.168.43.147.7772: UDP, length 120
23:31:01.560442 IP 192.168.43.124.8880 > 192.168.43.147.7772: UDP, length 120
23:31:01.610435 IP 192.168.43.124.8880 > 192.168.43.147.7772: UDP, length 120
23:31:01.660440 IP 192.168.43.124.8880 > 192.168.43.147.7772: UDP, length 120
23:31:01.710435 IP 192.168.43.124.8880 > 192.168.43.147.7772: UDP, length 120
23:31:01.760440 IP 192.168.43.124.8880 > 192.168.43.147.7772: UDP, length 120
23:31:01.810436 IP 192.168.43.124.8880 > 192.168.43.147.7772: UDP, length 120
23:31:01.860487 IP 192.168.43.124.8880 > 192.168.43.147.7772: UDP, length 120
23:31:01.910480 IP 192.168.43.124.8880 > 192.168.43.147.7772: UDP, length 120
23:31:01.960490 IP 192.168.43.124.8880 > 192.168.43.147.7772: UDP, length 120
23:31:02.010427 IP 192.168.43.124.8880 > 192.168.43.147.7772: UDP, length 120
23:31:02.060482 IP 192.168.43.124.8880 > 192.168.43.147.7772: UDP, length 120
23:31:02.110486 IP 192.168.43.124.8880 > 192.168.43.147.7772: UDP, length 120
23:31:02.160481 IP 192.168.43.124.8880 > 192.168.43.147.7772: UDP, length 120
23:31:02.210486 IP 192.168.43.124.8880 > 192.168.43.147.7772: UDP, length 120
23:31:02.260482 IP 192.168.43.124.8880 > 192.168.43.147.7772: UDP, length 120
23:31:02.310488 IP 192.168.43.124.8880 > 192.168.43.147.7772: UDP, length 120
23:31:02.360439 IP 192.168.43.124.8880 > 192.168.43.147.7772: UDP, length 120
23:31:02.410439 IP 192.168.43.124.8880 > 192.168.43.147.7772: UDP, length 120
23:31:02.460434 IP 192.168.43.124.8880 > 192.168.43.147.7772: UDP, length 120
23:31:02.510440 IP 192.168.43.124.8880 > 192.168.43.147.7772: UDP, length 120
23:31:02.560436 IP 192.168.43.124.8880 > 192.168.43.147.7772: UDP, length 120
23:31:02.610437 IP 192.168.43.124.8880 > 192.168.43.147.7772: UDP, length 120
23:31:02.660431 IP 192.168.43.124.8880 > 192.168.43.147.7772: UDP, length 120
23:31:02.710437 IP 192.168.43.124.8880 > 192.168.43.147.7772: UDP, length 120
23:31:02.760431 IP 192.168.43.124.8880 > 192.168.43.147.7772: UDP, length 120
23:31:02.810489 IP 192.168.43.124.8880 > 192.168.43.147.7772: UDP, length 120
23:31:02.860440 IP 192.168.43.124.8880 > 192.168.43.147.7772: UDP, length 120
23:31:02.910438 IP 192.168.43.124.8880 > 192.168.43.147.7772: UDP, length 120
23:31:02.960435 IP 192.168.43.124.8880 > 192.168.43.147.7772: UDP, length 120
23:31:03.010483 IP 192.168.43.124.8880 > 192.168.43.147.7772: UDP, length 120
23:31:03.060481 IP 192.168.43.124.8880 > 192.168.43.147.7772: UDP, length 120
23:31:03.110487 IP 192.168.43.124.8880 > 192.168.43.147.7772: UDP, length 120
23:31:03.160482 IP 192.168.43.124.8880 > 192.168.43.147.7772: UDP, length 120
23:31:03.210488 IP 192.168.43.124.8880 > 192.168.43.147.7772: UDP, length 120
23:31:03.260480 IP 192.168.43.124.8880 > 192.168.43.147.7772: UDP, length 120
23:31:03.310486 IP 192.168.43.124.8880 > 192.168.43.147.7772: UDP, length 120
23:31:03.360482 IP 192.168.43.124.8880 > 192.168.43.147.7772: UDP, length 120
23:31:03.410409 IP 192.168.43.124.8880 > 192.168.43.147.7772: UDP, length 120
23:31:03.460365 IP 192.168.43.124.8880 > 192.168.43.147.7772: UDP, length 120
23:31:03.510403 IP 192.168.43.124.8880 > 192.168.43.147.7772: UDP, length 120
23:31:03.560440 IP 192.168.43.124.8880 > 192.168.43.147.7772: UDP, length 120
23:31:03.610431 IP 192.168.43.124.8880 > 192.168.43.147.7772: UDP, length 120
23:31:03.660375 IP 192.168.43.124.8880 > 192.168.43.147.7772: UDP, length 120
23:31:03.710430 IP 192.168.43.124.8880 > 192.168.43.147.7772: UDP, length 120
23:31:03.760435 IP 192.168.43.124.8880 > 192.168.43.147.7772: UDP, length 120
23:31:03.810433 IP 192.168.43.124.8880 > 192.168.43.147.7772: UDP, length 120
23:31:03.860434 IP 192.168.43.124.8880 > 192.168.43.147.7772: UDP, length 120
23:31:03.910430 IP 192.168.43.124.8880 > 192.168.43.147.7772: UDP, length 120
23:31:03.960480 IP 192.168.43.124.8880 > 192.168.43.147.7772: UDP, length 120
23:31:04.010420 IP 192.168.43.124.8880 > 192.168.43.147.7772: UDP, length 120
23:31:04.060440 IP 192.168.43.124.8880 > 192.168.43.147.7772: UDP, length 120
23:31:04.110436 IP 192.168.43.124.8880 > 192.168.43.147.7772: UDP, length 120
23:31:04.160453 IP 192.168.43.124.8880 > 192.168.43.147.7772: UDP, length 120
23:31:04.210485 IP 192.168.43.124.8880 > 192.168.43.147.7772: UDP, length 120
23:31:04.260451 IP 192.168.43.124.8880 > 192.168.43.147.7772: UDP, length 120
23:31:04.310489 IP 192.168.43.124.8880 > 192.168.43.147.7772: UDP, length 120
23:31:04.360440 IP 192.168.43.124.8880 > 192.168.43.147.7772: UDP, length 120
23:31:04.410486 IP 192.168.43.124.8880 > 192.168.43.147.7772: UDP, length 120
23:31:04.460416 IP 192.168.43.124.8880 > 192.168.43.147.7772: UDP, length 120
23:31:04.510444 IP 192.168.43.124.8880 > 192.168.43.147.7772: UDP, length 120
23:31:04.560386 IP 192.168.43.124.8880 > 192.168.43.147.7772: UDP, length 120
23:31:04.610440 IP 192.168.43.124.8880 > 192.168.43.147.7772: UDP, length 120
23:31:04.660360 IP 192.168.43.124.8880 > 192.168.43.147.7772: UDP, length 120
23:31:04.710439 IP 192.168.43.124.8880 > 192.168.43.147.7772: UDP, length 120
23:31:04.760432 IP 192.168.43.124.8880 > 192.168.43.147.7772: UDP, length 120
23:31:04.810489 IP 192.168.43.124.8880 > 192.168.43.147.7772: UDP, length 120
23:31:04.860437 IP 192.168.43.124.8880 > 192.168.43.147.7772: UDP, length 120
23:31:04.910486 IP 192.168.43.124.8880 > 192.168.43.147.7772: UDP, length 120
23:31:04.960438 IP 192.168.43.124.8880 > 192.168.43.147.7772: UDP, length 120
23:31:05.010487 IP 192.168.43.124.8880 > 192.168.43.147.7772: UDP, length 120
23:31:05.060480 IP 192.168.43.124.8880 > 192.168.43.147.7772: UDP, length 120
23:31:05.110487 IP 192.168.43.124.8880 > 192.168.43.147.7772: UDP, length 120
23:31:05.160482 IP 192.168.43.124.8880 > 192.168.43.147.7772: UDP, length 120
23:31:05.210437 IP 192.168.43.124.8880 > 192.168.43.147.7772: UDP, length 120
23:31:05.260431 IP 192.168.43.124.8880 > 192.168.43.147.7772: UDP, length 120
23:31:05.310437 IP 192.168.43.124.8880 > 192.168.43.147.7772: UDP, length 120
23:31:05.360485 IP 192.168.43.124.8880 > 192.168.43.147.7772: UDP, length 120
23:31:05.410489 IP 192.168.43.124.8880 > 192.168.43.147.7772: UDP, length 120
23:31:05.460482 IP 192.168.43.124.8880 > 192.168.43.147.7772: UDP, length 120
23:31:05.510437 IP 192.168.43.124.8880 > 192.168.43.147.7772: UDP, length 120
23:31:05.560440 IP 192.168.43.124.8880 > 192.168.43.147.7772: UDP, length 120
23:31:05.610443 IP 192.168.43.124.8880 > 192.168.43.147.7772: UDP, length 120
23:31:05.660436 IP 192.168.43.124.8880 > 192.168.43.147.7772: UDP, length 120
23:31:05.710434 IP 192.168.43.124.8880 > 192.168.43.147.7772: UDP, length 120
23:31:05.760436 IP 192.168.43.124.8880 > 192.168.43.147.7772: UDP, length 120
23:31:05.810910 IP 192.168.43.124.8880 > 192.168.43.147.7772: UDP, length 120
23:31:05.860432 IP 192.168.43.124.8880 > 192.168.43.147.7772: UDP, length 120
23:31:05.910431 IP 192.168.43.124.8880 > 192.168.43.147.7772: UDP, length 120
23:31:05.960486 IP 192.168.43.124.8880 > 192.168.43.147.7772: UDP, length 120
23:31:06.010434 IP 192.168.43.124.8880 > 192.168.43.147.7772: UDP, length 120
23:31:06.060433 IP 192.168.43.124.8880 > 192.168.43.147.7772: UDP, length 120
23:31:06.110433 IP 192.168.43.124.8880 > 192.168.43.147.7772: UDP, length 120
23:31:06.160436 IP 192.168.43.124.8880 > 192.168.43.147.7772: UDP, length 120
23:31:06.210434 IP 192.168.43.124.8880 > 192.168.43.147.7772: UDP, length 120
23:31:06.260441 IP 192.168.43.124.8880 > 192.168.43.147.7772: UDP, length 120
23:31:06.310433 IP 192.168.43.124.8880 > 192.168.43.147.7772: UDP, length 120
23:31:06.360438 IP 192.168.43.124.8880 > 192.168.43.147.7772: UDP, length 120
23:31:06.410433 IP 192.168.43.124.8880 > 192.168.43.147.7772: UDP, length 120
23:31:06.460437 IP 192.168.43.124.8880 > 192.168.43.147.7772: UDP, length 120
23:31:06.510433 IP 192.168.43.124.8880 > 192.168.43.147.7772: UDP, length 120
23:31:06.560436 IP 192.168.43.124.8880 > 192.168.43.147.7772: UDP, length 120
23:31:06.610430 IP 192.168.43.124.8880 > 192.168.43.147.7772: UDP, length 120
23:31:06.660430 IP 192.168.43.124.8880 > 192.168.43.147.7772: UDP, length 120
23:31:06.710437 IP 192.168.43.124.8880 > 192.168.43.147.7772: UDP, length 120
23:31:06.760430 IP 192.168.43.124.8880 > 192.168.43.147.7772: UDP, length 120
23:31:06.810486 IP 192.168.43.124.8880 > 192.168.43.147.7772: UDP, length 120
23:31:06.860435 IP 192.168.43.124.8880 > 192.168.43.147.7772: UDP, length 120
23:31:06.910386 IP 192.168.43.124.8880 > 192.168.43.147.7772: UDP, length 120
23:31:06.960484 IP 192.168.43.124.8880 > 192.168.43.147.7772: UDP, length 120
23:31:07.010484 IP 192.168.43.124.8880 > 192.168.43.147.7772: UDP, length 120
23:31:07.060487 IP 192.168.43.124.8880 > 192.168.43.147.7772: UDP, length 120
23:31:07.110481 IP 192.168.43.124.8880 > 192.168.43.147.7772: UDP, length 120
23:31:07.160440 IP 192.168.43.124.8880 > 192.168.43.147.7772: UDP, length 120
23:31:07.210433 IP 192.168.43.124.8880 > 192.168.43.147.7772: UDP, length 120
23:31:07.260440 IP 192.168.43.124.8880 > 192.168.43.147.7772: UDP, length 120
23:31:07.310436 IP 192.168.43.124.8880 > 192.168.43.147.7772: UDP, length 120
23:31:07.360441 IP 192.168.43.124.8880 > 192.168.43.147.7772: UDP, length 120
23:31:07.410434 IP 192.168.43.124.8880 > 192.168.43.147.7772: UDP, length 120
23:31:07.460441 IP 192.168.43.124.8880 > 192.168.43.147.7772: UDP, length 120
23:31:07.510433 IP 192.168.43.124.8880 > 192.168.43.147.7772: UDP, length 120
23:31:07.560440 IP 192.168.43.124.8880 > 192.168.43.147.7772: UDP, length 120
23:31:07.610433 IP 192.168.43.124.8880 > 192.168.43.147.7772: UDP, length 120
23:31:07.660432 IP 192.168.43.124.8880 > 192.168.43.147.7772: UDP, length 120
23:31:07.710432 IP 192.168.43.124.8880 > 192.168.43.147.7772: UDP, length 120
23:31:07.760487 IP 192.168.43.124.8880 > 192.168.43.147.7772: UDP, length 120
23:31:07.810439 IP 192.168.43.124.8880 > 192.168.43.147.7772: UDP, length 120
23:31:07.860438 IP 192.168.43.124.8880 > 192.168.43.147.7772: UDP, length 120
23:31:07.910431 IP 192.168.43.124.8880 > 192.168.43.147.7772: UDP, length 120
23:31:07.961012 IP 192.168.43.124.8880 > 192.168.43.147.7772: UDP, length 120
23:31:08.010387 IP 192.168.43.124.8880 > 192.168.43.147.7772: UDP, length 120
23:31:08.060430 IP 192.168.43.124.8880 > 192.168.43.147.7772: UDP, length 120
23:31:08.110436 IP 192.168.43.124.8880 > 192.168.43.147.7772: UDP, length 120
23:31:08.160430 IP 192.168.43.124.8880 > 192.168.43.147.7772: UDP, length 120
23:31:08.210431 IP 192.168.43.124.8880 > 192.168.43.147.7772: UDP, length 120
23:31:08.260371 IP 192.168.43.124.8880 > 192.168.43.147.7772: UDP, length 120
23:31:08.310490 IP 192.168.43.124.8880 > 192.168.43.147.7772: UDP, length 120
23:31:08.360438 IP 192.168.43.124.8880 > 192.168.43.147.7772: UDP, length 120
23:31:08.410436 IP 192.168.43.124.8880 > 192.168.43.147.7772: UDP, length 120
23:31:08.460434 IP 192.168.43.124.8880 > 192.168.43.147.7772: UDP, length 120
23:31:08.510419 IP 192.168.43.124.8880 > 192.168.43.147.7772: UDP, length 120
23:31:08.560371 IP 192.168.43.124.8880 > 192.168.43.147.7772: UDP, length 120
23:31:08.610387 IP 192.168.43.124.8880 > 192.168.43.147.7772: UDP, length 120
23:31:08.660438 IP 192.168.43.124.8880 > 192.168.43.147.7772: UDP, length 120
23:31:08.710430 IP 192.168.43.124.8880 > 192.168.43.147.7772: UDP, length 120
23:31:08.760430 IP 192.168.43.124.8880 > 192.168.43.147.7772: UDP, length 120
23:31:08.810489 IP 192.168.43.124.8880 > 192.168.43.147.7772: UDP, length 120
23:31:08.860434 IP 192.168.43.124.8880 > 192.168.43.147.7772: UDP, length 120
23:31:08.910430 IP 192.168.43.124.8880 > 192.168.43.147.7772: UDP, length 120
23:31:08.960484 IP 192.168.43.124.8880 > 192.168.43.147.7772: UDP, length 120
23:31:09.010437 IP 192.168.43.124.8880 > 192.168.43.147.7772: UDP, length 120
23:31:09.060436 IP 192.168.43.124.8880 > 192.168.43.147.7772: UDP, length 120
23:31:09.110433 IP 192.168.43.124.8880 > 192.168.43.147.7772: UDP, length 120
23:31:09.160435 IP 192.168.43.124.8880 > 192.168.43.147.7772: UDP, length 120
23:31:09.210483 IP 192.168.43.124.8880 > 192.168.43.147.7772: UDP, length 120
23:31:09.260438 IP 192.168.43.124.8880 > 192.168.43.147.7772: UDP, length 120
23:31:09.310436 IP 192.168.43.124.8880 > 192.168.43.147.7772: UDP, length 120
23:31:09.360431 IP 192.168.43.124.8880 > 192.168.43.147.7772: UDP, length 120
23:31:09.410797 IP 192.168.43.124.8880 > 192.168.43.147.7772: UDP, length 120
23:31:09.460439 IP 192.168.43.124.8880 > 192.168.43.147.7772: UDP, length 120
23:31:09.510436 IP 192.168.43.124.8880 > 192.168.43.147.7772: UDP, length 120
23:31:09.560435 IP 192.168.43.124.8880 > 192.168.43.147.7772: UDP, length 120
23:31:09.610437 IP 192.168.43.124.8880 > 192.168.43.147.7772: UDP, length 120
23:31:09.660431 IP 192.168.43.124.8880 > 192.168.43.147.7772: UDP, length 120
23:31:09.710438 IP 192.168.43.124.8880 > 192.168.43.147.7772: UDP, length 120
23:31:09.760430 IP 192.168.43.124.8880 > 192.168.43.147.7772: UDP, length 120
23:31:09.810412 IP 192.168.43.124.8880 > 192.168.43.147.7772: UDP, length 120
23:31:09.860436 IP 192.168.43.124.8880 > 192.168.43.147.7772: UDP, length 120
23:31:09.910490 IP 192.168.43.124.8880 > 192.168.43.147.7772: UDP, length 120
23:31:09.960483 IP 192.168.43.124.8880 > 192.168.43.147.7772: UDP, length 120
23:31:10.010481 IP 192.168.43.124.8880 > 192.168.43.147.7772: UDP, length 120
23:31:10.060482 IP 192.168.43.124.8880 > 192.168.43.147.7772: UDP, length 120
23:31:10.111107 IP 192.168.43.124.8880 > 192.168.43.147.7772: UDP, length 120
23:31:10.160482 IP 192.168.43.124.8880 > 192.168.43.147.7772: UDP, length 120
23:31:10.210484 IP 192.168.43.124.8880 > 192.168.43.147.7772: UDP, length 120
23:31:10.260484 IP 192.168.43.124.8880 > 192.168.43.147.7772: UDP, length 120
23:31:10.310483 IP 192.168.43.124.8880 > 192.168.43.147.7772: UDP, length 120
23:31:10.360489 IP 192.168.43.124.8880 > 192.168.43.147.7772: UDP, length 120
23:31:10.410481 IP 192.168.43.124.8880 > 192.168.43.147.7772: UDP, length 120
23:31:10.460483 IP 192.168.43.124.8880 > 192.168.43.147.7772: UDP, length 120
23:31:10.510481 IP 192.168.43.124.8880 > 192.168.43.147.7772: UDP, length 120
23:31:10.560438 IP 192.168.43.124.8880 > 192.168.43.147.7772: UDP, length 120
23:31:10.610435 IP 192.168.43.124.8880 > 192.168.43.147.7772: UDP, length 120
23:31:10.660434 IP 192.168.43.124.8880 > 192.168.43.147.7772: UDP, length 120
23:31:10.710434 IP 192.168.43.124.8880 > 192.168.43.147.7772: UDP, length 120
23:31:10.760436 IP 192.168.43.124.8880 > 192.168.43.147.7772: UDP, length 120
23:31:10.810483 IP 192.168.43.124.8880 > 192.168.43.147.7772: UDP, length 120
23:31:10.860438 IP 192.168.43.124.8880 > 192.168.43.147.7772: UDP, length 120
23:31:10.910433 IP 192.168.43.124.8880 > 192.168.43.147.7772: UDP, length 120
23:31:10.960439 IP 192.168.43.124.8880 > 192.168.43.147.7772: UDP, length 120
23:31:11.010487 IP 192.168.43.124.8880 > 192.168.43.147.7772: UDP, length 120
23:31:11.060484 IP 192.168.43.124.8880 > 192.168.43.147.7772: UDP, length 120
23:31:11.110481 IP 192.168.43.124.8880 > 192.168.43.147.7772: UDP, length 120
23:31:11.160483 IP 192.168.43.124.8880 > 192.168.43.147.7772: UDP, length 120
23:31:11.210481 IP 192.168.43.124.8880 > 192.168.43.147.7772: UDP, length 120
23:31:11.260483 IP 192.168.43.124.8880 > 192.168.43.147.7772: UDP, length 120
23:31:11.310481 IP 192.168.43.124.8880 > 192.168.43.147.7772: UDP, length 120
23:31:11.360483 IP 192.168.43.124.8880 > 192.168.43.147.7772: UDP, length 120
23:31:11.410480 IP 192.168.43.124.8880 > 192.168.43.147.7772: UDP, length 120
23:31:11.460482 IP 192.168.43.124.8880 > 192.168.43.147.7772: UDP, length 120
23:31:11.510481 IP 192.168.43.124.8880 > 192.168.43.147.7772: UDP, length 120
23:31:11.560439 IP 192.168.43.124.8880 > 192.168.43.147.7772: UDP, length 120
23:31:11.610434 IP 192.168.43.124.8880 > 192.168.43.147.7772: UDP, length 120
23:31:11.660439 IP 192.168.43.124.8880 > 192.168.43.147.7772: UDP, length 120
23:31:11.710431 IP 192.168.43.124.8880 > 192.168.43.147.7772: UDP, length 120
23:31:11.760434 IP 192.168.43.124.8880 > 192.168.43.147.7772: UDP, length 120
23:31:11.810413 IP 192.168.43.124.8880 > 192.168.43.147.7772: UDP, length 120
23:31:11.860487 IP 192.168.43.124.8880 > 192.168.43.147.7772: UDP, length 120
23:31:11.910481 IP 192.168.43.124.8880 > 192.168.43.147.7772: UDP, length 120
23:31:11.960482 IP 192.168.43.124.8880 > 192.168.43.147.7772: UDP, length 120
23:31:12.010480 IP 192.168.43.124.8880 > 192.168.43.147.7772: UDP, length 120
23:31:12.060484 IP 192.168.43.124.8880 > 192.168.43.147.7772: UDP, length 120
23:31:12.110452 IP 192.168.43.124.8880 > 192.168.43.147.7772: UDP, length 120
23:31:12.160483 IP 192.168.43.124.8880 > 192.168.43.147.7772: UDP, length 120
23:31:12.210484 IP 192.168.43.124.8880 > 192.168.43.147.7772: UDP, length 120
23:31:12.260492 IP 192.168.43.124.8880 > 192.168.43.147.7772: UDP, length 120
23:31:12.310484 IP 192.168.43.124.8880 > 192.168.43.147.7772: UDP, length 120
23:31:12.360484 IP 192.168.43.124.8880 > 192.168.43.147.7772: UDP, length 120
23:31:12.410480 IP 192.168.43.124.8880 > 192.168.43.147.7772: UDP, length 120
23:31:12.460481 IP 192.168.43.124.8880 > 192.168.43.147.7772: UDP, length 120
23:31:12.510481 IP 192.168.43.124.8880 > 192.168.43.147.7772: UDP, length 120
23:31:12.560536 IP 192.168.43.124.8880 > 192.168.43.147.7772: UDP, length 120
23:31:12.610430 IP 192.168.43.124.8880 > 192.168.43.147.7772: UDP, length 120
23:31:12.660430 IP 192.168.43.124.8880 > 192.168.43.147.7772: UDP, length 120
23:31:12.710430 IP 192.168.43.124.8880 > 192.168.43.147.7772: UDP, length 120
23:31:12.760430 IP 192.168.43.124.8880 > 192.168.43.147.7772: UDP, length 120
23:31:12.810487 IP 192.168.43.124.8880 > 192.168.43.147.7772: UDP, length 120
23:31:12.860434 IP 192.168.43.124.8880 > 192.168.43.147.7772: UDP, length 120
23:31:12.910431 IP 192.168.43.124.8880 > 192.168.43.147.7772: UDP, length 120
23:31:12.960431 IP 192.168.43.124.8880 > 192.168.43.147.7772: UDP, length 120
23:31:13.010434 IP 192.168.43.124.8880 > 192.168.43.147.7772: UDP, length 120
23:31:13.060429 IP 192.168.43.124.8880 > 192.168.43.147.7772: UDP, length 120
23:31:13.110428 IP 192.168.43.124.8880 > 192.168.43.147.7772: UDP, length 120
23:31:13.160459 IP 192.168.43.124.8880 > 192.168.43.147.7772: UDP, length 120
23:31:13.210458 IP 192.168.43.124.8880 > 192.168.43.147.7772: UDP, length 120
23:31:13.260482 IP 192.168.43.124.8880 > 192.168.43.147.7772: UDP, length 120
23:31:13.310484 IP 192.168.43.124.8880 > 192.168.43.147.7772: UDP, length 120
23:31:13.360482 IP 192.168.43.124.8880 > 192.168.43.147.7772: UDP, length 120
23:31:13.410486 IP 192.168.43.124.8880 > 192.168.43.147.7772: UDP, length 120
23:31:13.460482 IP 192.168.43.124.8880 > 192.168.43.147.7772: UDP, length 120
23:31:13.510486 IP 192.168.43.124.8880 > 192.168.43.147.7772: UDP, length 120
23:31:13.560441 IP 192.168.43.124.8880 > 192.168.43.147.7772: UDP, length 120
23:31:13.610380 IP 192.168.43.124.8880 > 192.168.43.147.7772: UDP, length 120
23:31:13.660366 IP 192.168.43.124.8880 > 192.168.43.147.7772: UDP, length 120
23:31:13.710369 IP 192.168.43.124.8880 > 192.168.43.147.7772: UDP, length 120
23:31:13.760437 IP 192.168.43.124.8880 > 192.168.43.147.7772: UDP, length 120
23:31:13.810436 IP 192.168.43.124.8880 > 192.168.43.147.7772: UDP, length 120
23:31:13.860433 IP 192.168.43.124.8880 > 192.168.43.147.7772: UDP, length 120
23:31:13.910437 IP 192.168.43.124.8880 > 192.168.43.147.7772: UDP, length 120
23:31:13.960482 IP 192.168.43.124.8880 > 192.168.43.147.7772: UDP, length 120
23:31:14.010385 IP 192.168.43.124.8880 > 192.168.43.147.7772: UDP, length 120
23:31:14.060484 IP 192.168.43.124.8880 > 192.168.43.147.7772: UDP, length 120
23:31:14.110484 IP 192.168.43.124.8880 > 192.168.43.147.7772: UDP, length 120
23:31:14.160481 IP 192.168.43.124.8880 > 192.168.43.147.7772: UDP, length 120
23:31:14.210483 IP 192.168.43.124.8880 > 192.168.43.147.7772: UDP, length 120
23:31:14.260484 IP 192.168.43.124.8880 > 192.168.43.147.7772: UDP, length 120
23:31:14.310483 IP 192.168.43.124.8880 > 192.168.43.147.7772: UDP, length 120
23:31:14.360384 IP 192.168.43.124.8880 > 192.168.43.147.7772: UDP, length 120
23:31:14.410376 IP 192.168.43.124.8880 > 192.168.43.147.7772: UDP, length 120
23:31:14.460351 IP 192.168.43.124.8880 > 192.168.43.147.7772: UDP, length 120
23:31:14.510355 IP 192.168.43.124.8880 > 192.168.43.147.7772: UDP, length 120
23:31:14.560434 IP 192.168.43.124.8880 > 192.168.43.147.7772: UDP, length 120
23:31:14.610435 IP 192.168.43.124.8880 > 192.168.43.147.7772: UDP, length 120
23:31:14.660378 IP 192.168.43.124.8880 > 192.168.43.147.7772: UDP, length 120
23:31:14.710434 IP 192.168.43.124.8880 > 192.168.43.147.7772: UDP, length 120
23:31:14.760431 IP 192.168.43.124.8880 > 192.168.43.147.7772: UDP, length 120
23:31:14.810489 IP 192.168.43.124.8880 > 192.168.43.147.7772: UDP, length 120
23:31:14.860436 IP 192.168.43.124.8880 > 192.168.43.147.7772: UDP, length 120
23:31:14.910489 IP 192.168.43.124.8880 > 192.168.43.147.7772: UDP, length 120
23:31:14.960456 IP 192.168.43.124.8880 > 192.168.43.147.7772: UDP, length 120
23:31:15.010434 IP 192.168.43.124.8880 > 192.168.43.147.7772: UDP, length 120
23:31:15.060430 IP 192.168.43.124.8880 > 192.168.43.147.7772: UDP, length 120
23:31:15.110434 IP 192.168.43.124.8880 > 192.168.43.147.7772: UDP, length 120
23:31:15.160430 IP 192.168.43.124.8880 > 192.168.43.147.7772: UDP, length 120
23:31:15.210436 IP 192.168.43.124.8880 > 192.168.43.147.7772: UDP, length 120
23:31:15.260431 IP 192.168.43.124.8880 > 192.168.43.147.7772: UDP, length 120
23:31:15.310433 IP 192.168.43.124.8880 > 192.168.43.147.7772: UDP, length 120
23:31:15.360430 IP 192.168.43.124.8880 > 192.168.43.147.7772: UDP, length 120
23:31:15.410432 IP 192.168.43.124.8880 > 192.168.43.147.7772: UDP, length 120
23:31:15.460430 IP 192.168.43.124.8880 > 192.168.43.147.7772: UDP, length 120
23:31:15.510434 IP 192.168.43.124.8880 > 192.168.43.147.7772: UDP, length 120
23:31:15.560401 IP 192.168.43.124.8880 > 192.168.43.147.7772: UDP, length 120
23:31:15.610434 IP 192.168.43.124.8880 > 192.168.43.147.7772: UDP, length 120
23:31:15.660433 IP 192.168.43.124.8880 > 192.168.43.147.7772: UDP, length 120
23:31:15.710436 IP 192.168.43.124.8880 > 192.168.43.147.7772: UDP, length 120
23:31:15.760431 IP 192.168.43.124.8880 > 192.168.43.147.7772: UDP, length 120
23:31:15.810437 IP 192.168.43.124.8880 > 192.168.43.147.7772: UDP, length 120
23:31:15.860483 IP 192.168.43.124.8880 > 192.168.43.147.7772: UDP, length 120
23:31:15.910486 IP 192.168.43.124.8880 > 192.168.43.147.7772: UDP, length 120
23:31:15.960436 IP 192.168.43.124.8880 > 192.168.43.147.7772: UDP, length 120
23:31:16.010437 IP 192.168.43.124.8880 > 192.168.43.147.7772: UDP, length 120
23:31:16.060441 IP 192.168.43.124.8880 > 192.168.43.147.7772: UDP, length 120
23:31:16.110442 IP 192.168.43.124.8880 > 192.168.43.147.7772: UDP, length 120
23:31:16.160436 IP 192.168.43.124.8880 > 192.168.43.147.7772: UDP, length 120
23:31:16.210435 IP 192.168.43.124.8880 > 192.168.43.147.7772: UDP, length 120
23:31:16.260437 IP 192.168.43.124.8880 > 192.168.43.147.7772: UDP, length 120
23:31:16.310434 IP 192.168.43.124.8880 > 192.168.43.147.7772: UDP, length 120
23:31:16.360405 IP 192.168.43.124.8880 > 192.168.43.147.7772: UDP, length 120
23:31:16.410484 IP 192.168.43.124.8880 > 192.168.43.147.7772: UDP, length 120
23:31:16.460482 IP 192.168.43.124.8880 > 192.168.43.147.7772: UDP, length 120
23:31:16.510485 IP 192.168.43.124.8880 > 192.168.43.147.7772: UDP, length 120
23:31:16.560444 IP 192.168.43.124.8880 > 192.168.43.147.7772: UDP, length 120
23:31:16.610436 IP 192.168.43.124.8880 > 192.168.43.147.7772: UDP, length 120
23:31:16.660435 IP 192.168.43.124.8880 > 192.168.43.147.7772: UDP, length 120
23:31:16.710438 IP 192.168.43.124.8880 > 192.168.43.147.7772: UDP, length 120
23:31:16.760439 IP 192.168.43.124.8880 > 192.168.43.147.7772: UDP, length 120
23:31:16.810437 IP 192.168.43.124.8880 > 192.168.43.147.7772: UDP, length 120
23:31:16.860434 IP 192.168.43.124.8880 > 192.168.43.147.7772: UDP, length 120
23:31:16.910435 IP 192.168.43.124.8880 > 192.168.43.147.7772: UDP, length 120
23:31:16.960432 IP 192.168.43.124.8880 > 192.168.43.147.7772: UDP, length 120
23:31:17.010434 IP 192.168.43.124.8880 > 192.168.43.147.7772: UDP, length 120
23:31:17.060434 IP 192.168.43.124.8880 > 192.168.43.147.7772: UDP, length 120
23:31:17.110433 IP 192.168.43.124.8880 > 192.168.43.147.7772: UDP, length 120
23:31:17.160430 IP 192.168.43.124.8880 > 192.168.43.147.7772: UDP, length 120
23:31:17.210435 IP 192.168.43.124.8880 > 192.168.43.147.7772: UDP, length 120
23:31:17.260431 IP 192.168.43.124.8880 > 192.168.43.147.7772: UDP, length 120
23:31:17.310434 IP 192.168.43.124.8880 > 192.168.43.147.7772: UDP, length 120
23:31:17.360437 IP 192.168.43.124.8880 > 192.168.43.147.7772: UDP, length 120
23:31:17.410434 IP 192.168.43.124.8880 > 192.168.43.147.7772: UDP, length 120
23:31:17.460430 IP 192.168.43.124.8880 > 192.168.43.147.7772: UDP, length 120
23:31:17.510435 IP 192.168.43.124.8880 > 192.168.43.147.7772: UDP, length 120
23:31:17.560405 IP 192.168.43.124.8880 > 192.168.43.147.7772: UDP, length 120
23:31:17.610437 IP 192.168.43.124.8880 > 192.168.43.147.7772: UDP, length 120
23:31:17.660430 IP 192.168.43.124.8880 > 192.168.43.147.7772: UDP, length 120
23:31:17.710434 IP 192.168.43.124.8880 > 192.168.43.147.7772: UDP, length 120
23:31:17.760431 IP 192.168.43.124.8880 > 192.168.43.147.7772: UDP, length 120
23:31:17.810439 IP 192.168.43.124.8880 > 192.168.43.147.7772: UDP, length 120
23:31:17.860436 IP 192.168.43.124.8880 > 192.168.43.147.7772: UDP, length 120
23:31:17.910435 IP 192.168.43.124.8880 > 192.168.43.147.7772: UDP, length 120
23:31:17.960489 IP 192.168.43.124.8880 > 192.168.43.147.7772: UDP, length 120
23:31:18.010485 IP 192.168.43.124.8880 > 192.168.43.147.7772: UDP, length 120
23:31:18.060483 IP 192.168.43.124.8880 > 192.168.43.147.7772: UDP, length 120
23:31:18.110488 IP 192.168.43.124.8880 > 192.168.43.147.7772: UDP, length 120
23:31:18.160482 IP 192.168.43.124.8880 > 192.168.43.147.7772: UDP, length 120
23:31:18.210488 IP 192.168.43.124.8880 > 192.168.43.147.7772: UDP, length 120
23:31:18.260480 IP 192.168.43.124.8880 > 192.168.43.147.7772: UDP, length 120
23:31:18.310450 IP 192.168.43.124.8880 > 192.168.43.147.7772: UDP, length 120
23:31:18.360486 IP 192.168.43.124.8880 > 192.168.43.147.7772: UDP, length 120
23:31:18.410491 IP 192.168.43.124.8880 > 192.168.43.147.7772: UDP, length 120
23:31:18.460483 IP 192.168.43.124.8880 > 192.168.43.147.7772: UDP, length 120
23:31:18.510489 IP 192.168.43.124.8880 > 192.168.43.147.7772: UDP, length 120
23:31:18.560406 IP 192.168.43.124.8880 > 192.168.43.147.7772: UDP, length 120
23:31:18.610396 IP 192.168.43.124.8880 > 192.168.43.147.7772: UDP, length 120
23:31:18.660431 IP 192.168.43.124.8880 > 192.168.43.147.7772: UDP, length 120
23:31:18.710435 IP 192.168.43.124.8880 > 192.168.43.147.7772: UDP, length 120
23:31:18.760365 IP 192.168.43.124.8880 > 192.168.43.147.7772: UDP, length 120
23:31:18.810374 IP 192.168.43.124.8880 > 192.168.43.147.7772: UDP, length 120
23:31:18.860436 IP 192.168.43.124.8880 > 192.168.43.147.7772: UDP, length 120
23:31:18.910435 IP 192.168.43.124.8880 > 192.168.43.147.7772: UDP, length 120
23:31:18.960431 IP 192.168.43.124.8880 > 192.168.43.147.7772: UDP, length 120
23:31:19.010436 IP 192.168.43.124.8880 > 192.168.43.147.7772: UDP, length 120
23:31:19.060435 IP 192.168.43.124.8880 > 192.168.43.147.7772: UDP, length 120
23:31:19.110434 IP 192.168.43.124.8880 > 192.168.43.147.7772: UDP, length 120
23:31:19.160433 IP 192.168.43.124.8880 > 192.168.43.147.7772: UDP, length 120
23:31:19.210489 IP 192.168.43.124.8880 > 192.168.43.147.7772: UDP, length 120
23:31:19.260485 IP 192.168.43.124.8880 > 192.168.43.147.7772: UDP, length 120
23:31:19.310488 IP 192.168.43.124.8880 > 192.168.43.147.7772: UDP, length 120
23:31:19.360487 IP 192.168.43.124.8880 > 192.168.43.147.7772: UDP, length 120
23:31:19.410406 IP 192.168.43.124.8880 > 192.168.43.147.7772: UDP, length 120
23:31:19.460486 IP 192.168.43.124.8880 > 192.168.43.147.7772: UDP, length 120
23:31:19.510488 IP 192.168.43.124.8880 > 192.168.43.147.7772: UDP, length 120
23:31:19.560440 IP 192.168.43.124.8880 > 192.168.43.147.7772: UDP, length 120
23:31:19.610438 IP 192.168.43.124.8880 > 192.168.43.147.7772: UDP, length 120
23:31:19.660438 IP 192.168.43.124.8880 > 192.168.43.147.7772: UDP, length 120
23:31:19.710439 IP 192.168.43.124.8880 > 192.168.43.147.7772: UDP, length 120
23:31:19.760488 IP 192.168.43.124.8880 > 192.168.43.147.7772: UDP, length 120
23:31:19.810491 IP 192.168.43.124.8880 > 192.168.43.147.7772: UDP, length 120
23:31:19.860484 IP 192.168.43.124.8880 > 192.168.43.147.7772: UDP, length 120
23:31:19.910487 IP 192.168.43.124.8880 > 192.168.43.147.7772: UDP, length 120
23:31:19.960435 IP 192.168.43.124.8880 > 192.168.43.147.7772: UDP, length 120
23:31:20.010382 IP 192.168.43.124.8880 > 192.168.43.147.7772: UDP, length 120
23:31:20.060434 IP 192.168.43.124.8880 > 192.168.43.147.7772: UDP, length 120
23:31:20.110439 IP 192.168.43.124.8880 > 192.168.43.147.7772: UDP, length 120
23:31:20.160439 IP 192.168.43.124.8880 > 192.168.43.147.7772: UDP, length 120
23:31:20.210436 IP 192.168.43.124.8880 > 192.168.43.147.7772: UDP, length 120
23:31:20.260430 IP 192.168.43.124.8880 > 192.168.43.147.7772: UDP, length 120
23:31:20.310433 IP 192.168.43.124.8880 > 192.168.43.147.7772: UDP, length 120
23:31:20.360437 IP 192.168.43.124.8880 > 192.168.43.147.7772: UDP, length 120
23:31:20.410412 IP 192.168.43.124.8880 > 192.168.43.147.7772: UDP, length 120
23:31:20.460488 IP 192.168.43.124.8880 > 192.168.43.147.7772: UDP, length 120
23:31:20.510435 IP 192.168.43.124.8880 > 192.168.43.147.7772: UDP, length 120
23:31:20.560399 IP 192.168.43.124.8880 > 192.168.43.147.7772: UDP, length 120
23:31:20.610435 IP 192.168.43.124.8880 > 192.168.43.147.7772: UDP, length 120
23:31:20.660436 IP 192.168.43.124.8880 > 192.168.43.147.7772: UDP, length 120
23:31:20.710436 IP 192.168.43.124.8880 > 192.168.43.147.7772: UDP, length 120
23:31:20.760393 IP 192.168.43.124.8880 > 192.168.43.147.7772: UDP, length 120
23:31:20.810494 IP 192.168.43.124.8880 > 192.168.43.147.7772: UDP, length 120
23:31:20.860435 IP 192.168.43.124.8880 > 192.168.43.147.7772: UDP, length 120
23:31:20.910435 IP 192.168.43.124.8880 > 192.168.43.147.7772: UDP, length 120
23:31:20.960447 IP 192.168.43.124.8880 > 192.168.43.147.7772: UDP, length 120
23:31:21.010488 IP 192.168.43.124.8880 > 192.168.43.147.7772: UDP, length 120
23:31:21.060481 IP 192.168.43.124.8880 > 192.168.43.147.7772: UDP, length 120
23:31:21.110487 IP 192.168.43.124.8880 > 192.168.43.147.7772: UDP, length 120
23:31:21.160481 IP 192.168.43.124.8880 > 192.168.43.147.7772: UDP, length 120
23:31:21.210485 IP 192.168.43.124.8880 > 192.168.43.147.7772: UDP, length 120
23:31:21.260481 IP 192.168.43.124.8880 > 192.168.43.147.7772: UDP, length 120
23:31:21.310487 IP 192.168.43.124.8880 > 192.168.43.147.7772: UDP, length 120
23:31:21.360482 IP 192.168.43.124.8880 > 192.168.43.147.7772: UDP, length 120
23:31:21.410487 IP 192.168.43.124.8880 > 192.168.43.147.7772: UDP, length 120
23:31:21.460487 IP 192.168.43.124.8880 > 192.168.43.147.7772: UDP, length 120
23:31:21.510489 IP 192.168.43.124.8880 > 192.168.43.147.7772: UDP, length 120
23:31:21.560404 IP 192.168.43.124.8880 > 192.168.43.147.7772: UDP, length 120
23:31:21.610439 IP 192.168.43.124.8880 > 192.168.43.147.7772: UDP, length 120
23:31:21.660435 IP 192.168.43.124.8880 > 192.168.43.147.7772: UDP, length 120
23:31:21.710439 IP 192.168.43.124.8880 > 192.168.43.147.7772: UDP, length 120
23:31:21.760435 IP 192.168.43.124.8880 > 192.168.43.147.7772: UDP, length 120
23:31:21.810487 IP 192.168.43.124.8880 > 192.168.43.147.7772: UDP, length 120
23:31:21.860438 IP 192.168.43.124.8880 > 192.168.43.147.7772: UDP, length 120
23:31:21.910437 IP 192.168.43.124.8880 > 192.168.43.147.7772: UDP, length 120
23:31:21.960433 IP 192.168.43.124.8880 > 192.168.43.147.7772: UDP, length 120
23:31:22.010486 IP 192.168.43.124.8880 > 192.168.43.147.7772: UDP, length 120
23:31:22.060481 IP 192.168.43.124.8880 > 192.168.43.147.7772: UDP, length 120
23:31:22.110489 IP 192.168.43.124.8880 > 192.168.43.147.7772: UDP, length 120
23:31:22.160408 IP 192.168.43.124.8880 > 192.168.43.147.7772: UDP, length 120
23:31:22.210489 IP 192.168.43.124.8880 > 192.168.43.147.7772: UDP, length 120
23:31:22.260483 IP 192.168.43.124.8880 > 192.168.43.147.7772: UDP, length 120
23:31:22.310490 IP 192.168.43.124.8880 > 192.168.43.147.7772: UDP, length 120
23:31:22.360487 IP 192.168.43.124.8880 > 192.168.43.147.7772: UDP, length 120
23:31:22.410489 IP 192.168.43.124.8880 > 192.168.43.147.7772: UDP, length 120
23:31:22.460482 IP 192.168.43.124.8880 > 192.168.43.147.7772: UDP, length 120
23:31:22.510489 IP 192.168.43.124.8880 > 192.168.43.147.7772: UDP, length 120
23:31:22.560383 IP 192.168.43.124.8880 > 192.168.43.147.7772: UDP, length 120
23:31:22.610438 IP 192.168.43.124.8880 > 192.168.43.147.7772: UDP, length 120
23:31:22.660430 IP 192.168.43.124.8880 > 192.168.43.147.7772: UDP, length 120
23:31:22.710437 IP 192.168.43.124.8880 > 192.168.43.147.7772: UDP, length 120
23:31:22.760431 IP 192.168.43.124.8880 > 192.168.43.147.7772: UDP, length 120
23:31:22.810438 IP 192.168.43.124.8880 > 192.168.43.147.7772: UDP, length 120
23:31:22.860435 IP 192.168.43.124.8880 > 192.168.43.147.7772: UDP, length 120
23:31:22.910436 IP 192.168.43.124.8880 > 192.168.43.147.7772: UDP, length 120
