01:48:01.612776 IP 192.168.43.195.8880 > 192.168.43.124.7772: UDP, length 120
01:48:01.662810 IP 192.168.43.195.8880 > 192.168.43.124.7772: UDP, length 120
01:48:01.712780 IP 192.168.43.195.8880 > 192.168.43.124.7772: UDP, length 120
01:48:01.762778 IP 192.168.43.195.8880 > 192.168.43.124.7772: UDP, length 120
01:48:01.812775 IP 192.168.43.195.8880 > 192.168.43.124.7772: UDP, length 120
01:48:01.862788 IP 192.168.43.195.8880 > 192.168.43.124.7772: UDP, length 120
01:48:01.912789 IP 192.168.43.195.8880 > 192.168.43.124.7772: UDP, length 120
01:48:01.962776 IP 192.168.43.195.8880 > 192.168.43.124.7772: UDP, length 120
01:48:02.012876 IP 192.168.43.195.8880 > 192.168.43.124.7772: UDP, length 120
01:48:02.062869 IP 192.168.43.195.8880 > 192.168.43.124.7772: UDP, length 120
01:48:02.112845 IP 192.168.43.195.8880 > 192.168.43.124.7772: UDP, length 120
01:48:02.162837 IP 192.168.43.195.8880 > 192.168.43.124.7772: UDP, length 120
01:48:02.212849 IP 192.168.43.195.8880 > 192.168.43.124.7772: UDP, length 120
01:48:02.262838 IP 192.168.43.195.8880 > 192.168.43.124.7772: UDP, length 120
01:48:02.312834 IP 192.168.43.195.8880 > 192.168.43.124.7772: UDP, length 120
01:48:02.362847 IP 192.168.43.195.8880 > 192.168.43.124.7772: UDP, length 120
01:48:02.412841 IP 192.168.43.195.8880 > 192.168.43.124.7772: UDP, length 120
01:48:02.462845 IP 192.168.43.195.8880 > 192.168.43.124.7772: UDP, length 120
01:48:02.512810 IP 192.168.43.195.8880 > 192.168.43.124.7772: UDP, length 120
01:48:02.562841 IP 192.168.43.195.8880 > 192.168.43.124.7772: UDP, length 120
01:48:02.612797 IP 192.168.43.195.8880 > 192.168.43.124.7772: UDP, length 120
01:48:02.662782 IP 192.168.43.195.8880 > 192.168.43.124.7772: UDP, length 120
01:48:02.712782 IP 192.168.43.195.8880 > 192.168.43.124.7772: UDP, length 120
01:48:02.762780 IP 192.168.43.195.8880 > 192.168.43.124.7772: UDP, length 120
01:48:02.812781 IP 192.168.43.195.8880 > 192.168.43.124.7772: UDP, length 120
01:48:02.862779 IP 192.168.43.195.8880 > 192.168.43.124.7772: UDP, length 120
01:48:02.912790 IP 192.168.43.195.8880 > 192.168.43.124.7772: UDP, length 120
01:48:02.962789 IP 192.168.43.195.8880 > 192.168.43.124.7772: UDP, length 120
01:48:03.012780 IP 192.168.43.195.8880 > 192.168.43.124.7772: UDP, length 120
01:48:03.062780 IP 192.168.43.195.8880 > 192.168.43.124.7772: UDP, length 120
01:48:03.112781 IP 192.168.43.195.8880 > 192.168.43.124.7772: UDP, length 120
01:48:03.162779 IP 192.168.43.195.8880 > 192.168.43.124.7772: UDP, length 120
01:48:03.212788 IP 192.168.43.195.8880 > 192.168.43.124.7772: UDP, length 120
01:48:03.262779 IP 192.168.43.195.8880 > 192.168.43.124.7772: UDP, length 120
01:48:03.312780 IP 192.168.43.195.8880 > 192.168.43.124.7772: UDP, length 120
01:48:03.362780 IP 192.168.43.195.8880 > 192.168.43.124.7772: UDP, length 120
01:48:03.412781 IP 192.168.43.195.8880 > 192.168.43.124.7772: UDP, length 120
01:48:03.462814 IP 192.168.43.195.8880 > 192.168.43.124.7772: UDP, length 120
01:48:03.512794 IP 192.168.43.195.8880 > 192.168.43.124.7772: UDP, length 120
01:48:03.562787 IP 192.168.43.195.8880 > 192.168.43.124.7772: UDP, length 120
01:48:03.612781 IP 192.168.43.195.8880 > 192.168.43.124.7772: UDP, length 120
01:48:03.662780 IP 192.168.43.195.8880 > 192.168.43.124.7772: UDP, length 120
01:48:03.712779 IP 192.168.43.195.8880 > 192.168.43.124.7772: UDP, length 120
01:48:03.762780 IP 192.168.43.195.8880 > 192.168.43.124.7772: UDP, length 120
01:48:03.812780 IP 192.168.43.195.8880 > 192.168.43.124.7772: UDP, length 120
01:48:03.862830 IP 192.168.43.195.8880 > 192.168.43.124.7772: UDP, length 120
01:48:03.912784 IP 192.168.43.195.8880 > 192.168.43.124.7772: UDP, length 120
01:48:03.962780 IP 192.168.43.195.8880 > 192.168.43.124.7772: UDP, length 120
01:48:04.012780 IP 192.168.43.195.8880 > 192.168.43.124.7772: UDP, length 120
01:48:04.062779 IP 192.168.43.195.8880 > 192.168.43.124.7772: UDP, length 120
01:48:04.112779 IP 192.168.43.195.8880 > 192.168.43.124.7772: UDP, length 120
01:48:04.162779 IP 192.168.43.195.8880 > 192.168.43.124.7772: UDP, length 120
01:48:04.212788 IP 192.168.43.195.8880 > 192.168.43.124.7772: UDP, length 120
01:48:04.262782 IP 192.168.43.195.8880 > 192.168.43.124.7772: UDP, length 120
01:48:04.312780 IP 192.168.43.195.8880 > 192.168.43.124.7772: UDP, length 120
01:48:04.362780 IP 192.168.43.195.8880 > 192.168.43.124.7772: UDP, length 120
01:48:04.412780 IP 192.168.43.195.8880 > 192.168.43.124.7772: UDP, length 120
01:48:04.462780 IP 192.168.43.195.8880 > 192.168.43.124.7772: UDP, length 120
01:48:04.512796 IP 192.168.43.195.8880 > 192.168.43.124.7772: UDP, length 120
01:48:04.562788 IP 192.168.43.195.8880 > 192.168.43.124.7772: UDP, length 120
01:48:04.612788 IP 192.168.43.195.8880 > 192.168.43.124.7772: UDP, length 120
01:48:04.662780 IP 192.168.43.195.8880 > 192.168.43.124.7772: UDP, length 120
01:48:04.712790 IP 192.168.43.195.8880 > 192.168.43.124.7772: UDP, length 120
01:48:04.762788 IP 192.168.43.195.8880 > 192.168.43.124.7772: UDP, length 120
01:48:04.812788 IP 192.168.43.195.8880 > 192.168.43.124.7772: UDP, length 120
01:48:04.862780 IP 192.168.43.195.8880 > 192.168.43.124.7772: UDP, length 120
01:48:04.882610 IP 192.168.43.124.8880 > 192.168.43.195.7771: UDP, length 120
01:48:04.912782 IP 192.168.43.195.8880 > 192.168.43.124.7772: UDP, length 120
01:48:04.934711 IP 192.168.43.124.8880 > 192.168.43.195.7771: UDP, length 120
01:48:04.962781 IP 192.168.43.195.8880 > 192.168.43.124.7772: UDP, length 120
01:48:05.002877 IP 192.168.43.124.8880 > 192.168.43.195.7771: UDP, length 120
01:48:05.012792 IP 192.168.43.195.8880 > 192.168.43.124.7772: UDP, length 120
01:48:05.032754 IP 192.168.43.124.8880 > 192.168.43.195.7771: UDP, length 120
01:48:05.062789 IP 192.168.43.195.8880 > 192.168.43.124.7772: UDP, length 120
01:48:05.089696 IP 192.168.43.124.8880 > 192.168.43.195.7771: UDP, length 120
01:48:05.112781 IP 192.168.43.195.8880 > 192.168.43.124.7772: UDP, length 120
01:48:05.132747 IP 192.168.43.124.8880 > 192.168.43.195.7771: UDP, length 120
01:48:05.162780 IP 192.168.43.195.8880 > 192.168.43.124.7772: UDP, length 120
01:48:05.183433 IP 192.168.43.124.8880 > 192.168.43.195.7771: UDP, length 120
01:48:05.212782 IP 192.168.43.195.8880 > 192.168.43.124.7772: UDP, length 120
01:48:05.232724 IP 192.168.43.124.8880 > 192.168.43.195.7771: UDP, length 120
01:48:05.262793 IP 192.168.43.195.8880 > 192.168.43.124.7772: UDP, length 120
01:48:05.288525 IP 192.168.43.124.8880 > 192.168.43.195.7771: UDP, length 120
01:48:05.312789 IP 192.168.43.195.8880 > 192.168.43.124.7772: UDP, length 120
01:48:05.333892 IP 192.168.43.124.8880 > 192.168.43.195.7771: UDP, length 120
01:48:05.362830 IP 192.168.43.195.8880 > 192.168.43.124.7772: UDP, length 120
01:48:05.391444 IP 192.168.43.124.8880 > 192.168.43.195.7771: UDP, length 120
01:48:05.412789 IP 192.168.43.195.8880 > 192.168.43.124.7772: UDP, length 120
01:48:05.434435 IP 192.168.43.124.8880 > 192.168.43.195.7771: UDP, length 120
01:48:05.462782 IP 192.168.43.195.8880 > 192.168.43.124.7772: UDP, length 120
01:48:05.482615 IP 192.168.43.124.8880 > 192.168.43.195.7771: UDP, length 120
01:48:05.512795 IP 192.168.43.195.8880 > 192.168.43.124.7772: UDP, length 120
01:48:05.552583 IP 192.168.43.124.8880 > 192.168.43.195.7771: UDP, length 120
01:48:05.562798 IP 192.168.43.195.8880 > 192.168.43.124.7772: UDP, length 120
01:48:05.582955 IP 192.168.43.124.8880 > 192.168.43.195.7771: UDP, length 120
01:48:05.612795 IP 192.168.43.195.8880 > 192.168.43.124.7772: UDP, length 120
01:48:05.632750 IP 192.168.43.124.8880 > 192.168.43.195.7771: UDP, length 120
01:48:05.662790 IP 192.168.43.195.8880 > 192.168.43.124.7772: UDP, length 120
01:48:05.703049 IP 192.168.43.124.8880 > 192.168.43.195.7771: UDP, length 120
01:48:05.712781 IP 192.168.43.195.8880 > 192.168.43.124.7772: UDP, length 120
01:48:05.732068 IP 192.168.43.124.8880 > 192.168.43.195.7771: UDP, length 120
01:48:05.762782 IP 192.168.43.195.8880 > 192.168.43.124.7772: UDP, length 120
01:48:05.782639 IP 192.168.43.124.8880 > 192.168.43.195.7771: UDP, length 120
01:48:05.812789 IP 192.168.43.195.8880 > 192.168.43.124.7772: UDP, length 120
01:48:05.862781 IP 192.168.43.195.8880 > 192.168.43.124.7772: UDP, length 120
01:48:05.912779 IP 192.168.43.195.8880 > 192.168.43.124.7772: UDP, length 120
01:48:05.962782 IP 192.168.43.195.8880 > 192.168.43.124.7772: UDP, length 120
01:48:06.008631 IP 192.168.43.124.8880 > 192.168.43.195.7771: UDP, length 120
01:48:06.008863 IP 192.168.43.124.8880 > 192.168.43.195.7771: UDP, length 120
01:48:06.009075 IP 192.168.43.124.8880 > 192.168.43.195.7771: UDP, length 120
01:48:06.012783 IP 192.168.43.195.8880 > 192.168.43.124.7772: UDP, length 120
01:48:06.062792 IP 192.168.43.195.8880 > 192.168.43.124.7772: UDP, length 120
01:48:06.112780 IP 192.168.43.195.8880 > 192.168.43.124.7772: UDP, length 120
01:48:06.157862 IP 192.168.43.124.8880 > 192.168.43.195.7771: UDP, length 120
01:48:06.158154 IP 192.168.43.124.8880 > 192.168.43.195.7771: UDP, length 120
01:48:06.158366 IP 192.168.43.124.8880 > 192.168.43.195.7771: UDP, length 120
01:48:06.162781 IP 192.168.43.195.8880 > 192.168.43.124.7772: UDP, length 120
01:48:06.212779 IP 192.168.43.195.8880 > 192.168.43.124.7772: UDP, length 120
01:48:06.262780 IP 192.168.43.195.8880 > 192.168.43.124.7772: UDP, length 120
01:48:06.312780 IP 192.168.43.195.8880 > 192.168.43.124.7772: UDP, length 120
01:48:06.337821 IP 192.168.43.124.8880 > 192.168.43.195.7771: UDP, length 120
01:48:06.338113 IP 192.168.43.124.8880 > 192.168.43.195.7771: UDP, length 120
01:48:06.338335 IP 192.168.43.124.8880 > 192.168.43.195.7771: UDP, length 120
01:48:06.338559 IP 192.168.43.124.8880 > 192.168.43.195.7771: UDP, length 120
01:48:06.362780 IP 192.168.43.195.8880 > 192.168.43.124.7772: UDP, length 120
01:48:06.412787 IP 192.168.43.195.8880 > 192.168.43.124.7772: UDP, length 120
01:48:06.462780 IP 192.168.43.195.8880 > 192.168.43.124.7772: UDP, length 120
01:48:06.511957 IP 192.168.43.124.8880 > 192.168.43.195.7771: UDP, length 120
01:48:06.512191 IP 192.168.43.124.8880 > 192.168.43.195.7771: UDP, length 120
01:48:06.512415 IP 192.168.43.124.8880 > 192.168.43.195.7771: UDP, length 120
01:48:06.512784 IP 192.168.43.195.8880 > 192.168.43.124.7772: UDP, length 120
01:48:06.562793 IP 192.168.43.195.8880 > 192.168.43.124.7772: UDP, length 120
01:48:06.612802 IP 192.168.43.195.8880 > 192.168.43.124.7772: UDP, length 120
01:48:06.662792 IP 192.168.43.195.8880 > 192.168.43.124.7772: UDP, length 120
01:48:06.664163 IP 192.168.43.124.8880 > 192.168.43.195.7771: UDP, length 120
01:48:06.664434 IP 192.168.43.124.8880 > 192.168.43.195.7771: UDP, length 120
01:48:06.664643 IP 192.168.43.124.8880 > 192.168.43.195.7771: UDP, length 120
01:48:06.712788 IP 192.168.43.195.8880 > 192.168.43.124.7772: UDP, length 120
01:48:06.762782 IP 192.168.43.195.8880 > 192.168.43.124.7772: UDP, length 120
01:48:06.803474 IP 192.168.43.124.8880 > 192.168.43.195.7771: UDP, length 120
01:48:06.803707 IP 192.168.43.124.8880 > 192.168.43.195.7771: UDP, length 120
01:48:06.812781 IP 192.168.43.195.8880 > 192.168.43.124.7772: UDP, length 120
01:48:06.862830 IP 192.168.43.195.8880 > 192.168.43.124.7772: UDP, length 120
01:48:06.909333 IP 192.168.43.124.8880 > 192.168.43.195.7771: UDP, length 120
01:48:06.909666 IP 192.168.43.124.8880 > 192.168.43.195.7771: UDP, length 120
01:48:06.909878 IP 192.168.43.124.8880 > 192.168.43.195.7771: UDP, length 120
01:48:06.912809 IP 192.168.43.195.8880 > 192.168.43.124.7772: UDP, length 120
01:48:06.962784 IP 192.168.43.195.8880 > 192.168.43.124.7772: UDP, length 120
01:48:07.012781 IP 192.168.43.195.8880 > 192.168.43.124.7772: UDP, length 120
01:48:07.047835 IP 192.168.43.124.8880 > 192.168.43.195.7771: UDP, length 120
01:48:07.048133 IP 192.168.43.124.8880 > 192.168.43.195.7771: UDP, length 120
01:48:07.048347 IP 192.168.43.124.8880 > 192.168.43.195.7771: UDP, length 120
01:48:07.062781 IP 192.168.43.195.8880 > 192.168.43.124.7772: UDP, length 120
01:48:07.112780 IP 192.168.43.195.8880 > 192.168.43.124.7772: UDP, length 120
01:48:07.162780 IP 192.168.43.195.8880 > 192.168.43.124.7772: UDP, length 120
01:48:07.207614 IP 192.168.43.124.8880 > 192.168.43.195.7771: UDP, length 120
01:48:07.207834 IP 192.168.43.124.8880 > 192.168.43.195.7771: UDP, length 120
01:48:07.208119 IP 192.168.43.124.8880 > 192.168.43.195.7771: UDP, length 120
01:48:07.212781 IP 192.168.43.195.8880 > 192.168.43.124.7772: UDP, length 120
01:48:07.262780 IP 192.168.43.195.8880 > 192.168.43.124.7772: UDP, length 120
01:48:07.312781 IP 192.168.43.195.8880 > 192.168.43.124.7772: UDP, length 120
01:48:07.361833 IP 192.168.43.124.8880 > 192.168.43.195.7771: UDP, length 120
01:48:07.362058 IP 192.168.43.124.8880 > 192.168.43.195.7771: UDP, length 120
01:48:07.362266 IP 192.168.43.124.8880 > 192.168.43.195.7771: UDP, length 120
01:48:07.362781 IP 192.168.43.195.8880 > 192.168.43.124.7772: UDP, length 120
01:48:07.412777 IP 192.168.43.195.8880 > 192.168.43.124.7772: UDP, length 120
01:48:07.462793 IP 192.168.43.195.8880 > 192.168.43.124.7772: UDP, length 120
01:48:07.512868 IP 192.168.43.195.8880 > 192.168.43.124.7772: UDP, length 120
01:48:07.541790 IP 192.168.43.124.8880 > 192.168.43.195.7771: UDP, length 120
01:48:07.542201 IP 192.168.43.124.8880 > 192.168.43.195.7771: UDP, length 120
01:48:07.542408 IP 192.168.43.124.8880 > 192.168.43.195.7771: UDP, length 120
01:48:07.562939 IP 192.168.43.195.8880 > 192.168.43.124.7772: UDP, length 120
01:48:07.612841 IP 192.168.43.195.8880 > 192.168.43.124.7772: UDP, length 120
01:48:07.653516 IP 192.168.43.124.8880 > 192.168.43.195.7771: UDP, length 120
01:48:07.653669 IP 192.168.43.124.8880 > 192.168.43.195.7771: UDP, length 120
01:48:07.653748 IP 192.168.43.124.8880 > 192.168.43.195.7771: UDP, length 120
01:48:07.662911 IP 192.168.43.195.8880 > 192.168.43.124.7772: UDP, length 120
01:48:07.712827 IP 192.168.43.195.8880 > 192.168.43.124.7772: UDP, length 120
01:48:07.762835 IP 192.168.43.195.8880 > 192.168.43.124.7772: UDP, length 120
01:48:07.812578 IP 192.168.43.124.8880 > 192.168.43.195.7771: UDP, length 120
01:48:07.812685 IP 192.168.43.124.8880 > 192.168.43.195.7771: UDP, length 120
01:48:07.812759 IP 192.168.43.124.8880 > 192.168.43.195.7771: UDP, length 120
01:48:07.812857 IP 192.168.43.195.8880 > 192.168.43.124.7772: UDP, length 120
01:48:07.862834 IP 192.168.43.195.8880 > 192.168.43.124.7772: UDP, length 120
01:48:07.912830 IP 192.168.43.195.8880 > 192.168.43.124.7772: UDP, length 120
01:48:07.955932 IP 192.168.43.124.8880 > 192.168.43.195.7771: UDP, length 120
01:48:07.956130 IP 192.168.43.124.8880 > 192.168.43.195.7771: UDP, length 120
01:48:07.956207 IP 192.168.43.124.8880 > 192.168.43.195.7771: UDP, length 120
01:48:07.962800 IP 192.168.43.195.8880 > 192.168.43.124.7772: UDP, length 120
01:48:08.012763 IP 192.168.43.195.8880 > 192.168.43.124.7772: UDP, length 120
01:48:08.062759 IP 192.168.43.195.8880 > 192.168.43.124.7772: UDP, length 120
01:48:08.109483 IP 192.168.43.124.8880 > 192.168.43.195.7771: UDP, length 120
01:48:08.109636 IP 192.168.43.124.8880 > 192.168.43.195.7771: UDP, length 120
01:48:08.109708 IP 192.168.43.124.8880 > 192.168.43.195.7771: UDP, length 120
01:48:08.112758 IP 192.168.43.195.8880 > 192.168.43.124.7772: UDP, length 120
01:48:08.162751 IP 192.168.43.195.8880 > 192.168.43.124.7772: UDP, length 120
01:48:08.212753 IP 192.168.43.195.8880 > 192.168.43.124.7772: UDP, length 120
01:48:08.261673 IP 192.168.43.124.8880 > 192.168.43.195.7771: UDP, length 120
01:48:08.261807 IP 192.168.43.124.8880 > 192.168.43.195.7771: UDP, length 120
01:48:08.261928 IP 192.168.43.124.8880 > 192.168.43.195.7771: UDP, length 120
01:48:08.262754 IP 192.168.43.195.8880 > 192.168.43.124.7772: UDP, length 120
01:48:08.312753 IP 192.168.43.195.8880 > 192.168.43.124.7772: UDP, length 120
01:48:08.362799 IP 192.168.43.195.8880 > 192.168.43.124.7772: UDP, length 120
01:48:08.411976 IP 192.168.43.124.8880 > 192.168.43.195.7771: UDP, length 120
01:48:08.412169 IP 192.168.43.124.8880 > 192.168.43.195.7771: UDP, length 120
01:48:08.412291 IP 192.168.43.124.8880 > 192.168.43.195.7771: UDP, length 120
01:48:08.412768 IP 192.168.43.195.8880 > 192.168.43.124.7772: UDP, length 120
01:48:08.462766 IP 192.168.43.195.8880 > 192.168.43.124.7772: UDP, length 120
01:48:08.512787 IP 192.168.43.195.8880 > 192.168.43.124.7772: UDP, length 120
01:48:08.561999 IP 192.168.43.124.8880 > 192.168.43.195.7771: UDP, length 120
01:48:08.562274 IP 192.168.43.124.8880 > 192.168.43.195.7771: UDP, length 120
01:48:08.562502 IP 192.168.43.124.8880 > 192.168.43.195.7771: UDP, length 120
01:48:08.562791 IP 192.168.43.195.8880 > 192.168.43.124.7772: UDP, length 120
01:48:08.612780 IP 192.168.43.195.8880 > 192.168.43.124.7772: UDP, length 120
01:48:08.662791 IP 192.168.43.195.8880 > 192.168.43.124.7772: UDP, length 120
01:48:08.703054 IP 192.168.43.124.8880 > 192.168.43.195.7771: UDP, length 120
01:48:08.703302 IP 192.168.43.124.8880 > 192.168.43.195.7771: UDP, length 120
01:48:08.712787 IP 192.168.43.195.8880 > 192.168.43.124.7772: UDP, length 120
01:48:08.762791 IP 192.168.43.195.8880 > 192.168.43.124.7772: UDP, length 120
01:48:08.808921 IP 192.168.43.124.8880 > 192.168.43.195.7771: UDP, length 120
01:48:08.809161 IP 192.168.43.124.8880 > 192.168.43.195.7771: UDP, length 120
01:48:08.809354 IP 192.168.43.124.8880 > 192.168.43.195.7771: UDP, length 120
01:48:08.812790 IP 192.168.43.195.8880 > 192.168.43.124.7772: UDP, length 120
01:48:08.862784 IP 192.168.43.195.8880 > 192.168.43.124.7772: UDP, length 120
01:48:08.883602 IP 192.168.43.124.8880 > 192.168.43.195.7771: UDP, length 120
01:48:08.883844 IP 192.168.43.124.8880 > 192.168.43.195.7771: UDP, length 120
01:48:08.912801 IP 192.168.43.195.8880 > 192.168.43.124.7772: UDP, length 120
01:48:08.934855 IP 192.168.43.124.8880 > 192.168.43.195.7771: UDP, length 120
01:48:08.962801 IP 192.168.43.195.8880 > 192.168.43.124.7772: UDP, length 120
01:48:09.003070 IP 192.168.43.124.8880 > 192.168.43.195.7771: UDP, length 120
01:48:09.012787 IP 192.168.43.195.8880 > 192.168.43.124.7772: UDP, length 120
01:48:09.032926 IP 192.168.43.124.8880 > 192.168.43.195.7771: UDP, length 120
01:48:09.062782 IP 192.168.43.195.8880 > 192.168.43.124.7772: UDP, length 120
01:48:09.083158 IP 192.168.43.124.8880 > 192.168.43.195.7771: UDP, length 120
01:48:09.112781 IP 192.168.43.195.8880 > 192.168.43.124.7772: UDP, length 120
01:48:09.154222 IP 192.168.43.124.8880 > 192.168.43.195.7771: UDP, length 120
01:48:09.162779 IP 192.168.43.195.8880 > 192.168.43.124.7772: UDP, length 120
01:48:09.183720 IP 192.168.43.124.8880 > 192.168.43.195.7771: UDP, length 120
01:48:09.212793 IP 192.168.43.195.8880 > 192.168.43.124.7772: UDP, length 120
01:48:09.232897 IP 192.168.43.124.8880 > 192.168.43.195.7771: UDP, length 120
01:48:09.262798 IP 192.168.43.195.8880 > 192.168.43.124.7772: UDP, length 120
01:48:09.303674 IP 192.168.43.124.8880 > 192.168.43.195.7771: UDP, length 120
01:48:09.312780 IP 192.168.43.195.8880 > 192.168.43.124.7772: UDP, length 120
01:48:09.333452 IP 192.168.43.124.8880 > 192.168.43.195.7771: UDP, length 120
01:48:09.362781 IP 192.168.43.195.8880 > 192.168.43.124.7772: UDP, length 120
01:48:09.382847 IP 192.168.43.124.8880 > 192.168.43.195.7771: UDP, length 120
01:48:09.412782 IP 192.168.43.195.8880 > 192.168.43.124.7772: UDP, length 120
01:48:09.432723 IP 192.168.43.124.8880 > 192.168.43.195.7771: UDP, length 120
01:48:09.462781 IP 192.168.43.195.8880 > 192.168.43.124.7772: UDP, length 120
01:48:09.512792 IP 192.168.43.195.8880 > 192.168.43.124.7772: UDP, length 120
01:48:09.562788 IP 192.168.43.195.8880 > 192.168.43.124.7772: UDP, length 120
01:48:09.569885 IP 192.168.43.124.8880 > 192.168.43.195.7771: UDP, length 120
01:48:09.570119 IP 192.168.43.124.8880 > 192.168.43.195.7771: UDP, length 120
01:48:09.579617 IP 192.168.43.124.8880 > 192.168.43.195.7771: UDP, length 120
01:48:09.612785 IP 192.168.43.195.8880 > 192.168.43.124.7772: UDP, length 120
01:48:09.645652 IP 192.168.43.124.8880 > 192.168.43.195.7771: UDP, length 120
01:48:09.662780 IP 192.168.43.195.8880 > 192.168.43.124.7772: UDP, length 120
01:48:09.712779 IP 192.168.43.195.8880 > 192.168.43.124.7772: UDP, length 120
01:48:09.716185 IP 192.168.43.124.8880 > 192.168.43.195.7771: UDP, length 120
01:48:09.732408 IP 192.168.43.124.8880 > 192.168.43.195.7771: UDP, length 120
01:48:09.762782 IP 192.168.43.195.8880 > 192.168.43.124.7772: UDP, length 120
01:48:09.812786 IP 192.168.43.195.8880 > 192.168.43.124.7772: UDP, length 120
01:48:09.862843 IP 192.168.43.195.8880 > 192.168.43.124.7772: UDP, length 120
01:48:09.912789 IP 192.168.43.195.8880 > 192.168.43.124.7772: UDP, length 120
01:48:09.916718 IP 192.168.43.124.8880 > 192.168.43.195.7771: UDP, length 120
01:48:09.917013 IP 192.168.43.124.8880 > 192.168.43.195.7771: UDP, length 120
01:48:09.917222 IP 192.168.43.124.8880 > 192.168.43.195.7771: UDP, length 120
01:48:09.933926 IP 192.168.43.124.8880 > 192.168.43.195.7771: UDP, length 120
01:48:09.962792 IP 192.168.43.195.8880 > 192.168.43.124.7772: UDP, length 120
01:48:09.984054 IP 192.168.43.124.8880 > 192.168.43.195.7771: UDP, length 120
01:48:10.012783 IP 192.168.43.195.8880 > 192.168.43.124.7772: UDP, length 120
01:48:10.033917 IP 192.168.43.124.8880 > 192.168.43.195.7771: UDP, length 120
01:48:10.062780 IP 192.168.43.195.8880 > 192.168.43.124.7772: UDP, length 120
01:48:10.104513 IP 192.168.43.124.8880 > 192.168.43.195.7771: UDP, length 120
01:48:10.112778 IP 192.168.43.195.8880 > 192.168.43.124.7772: UDP, length 120
01:48:10.162803 IP 192.168.43.195.8880 > 192.168.43.124.7772: UDP, length 120
01:48:10.212782 IP 192.168.43.195.8880 > 192.168.43.124.7772: UDP, length 120
01:48:10.262779 IP 192.168.43.195.8880 > 192.168.43.124.7772: UDP, length 120
01:48:10.272221 IP 192.168.43.124.8880 > 192.168.43.195.7771: UDP, length 120
01:48:10.272666 IP 192.168.43.124.8880 > 192.168.43.195.7771: UDP, length 120
01:48:10.272878 IP 192.168.43.124.8880 > 192.168.43.195.7771: UDP, length 120
01:48:10.279725 IP 192.168.43.124.8880 > 192.168.43.195.7771: UDP, length 120
01:48:10.312781 IP 192.168.43.195.8880 > 192.168.43.124.7772: UDP, length 120
01:48:10.348308 IP 192.168.43.124.8880 > 192.168.43.195.7771: UDP, length 120
01:48:10.362792 IP 192.168.43.195.8880 > 192.168.43.124.7772: UDP, length 120
01:48:10.382752 IP 192.168.43.124.8880 > 192.168.43.195.7771: UDP, length 120
01:48:10.412780 IP 192.168.43.195.8880 > 192.168.43.124.7772: UDP, length 120
01:48:10.433491 IP 192.168.43.124.8880 > 192.168.43.195.7771: UDP, length 120
01:48:10.462782 IP 192.168.43.195.8880 > 192.168.43.124.7772: UDP, length 120
01:48:10.512784 IP 192.168.43.195.8880 > 192.168.43.124.7772: UDP, length 120
01:48:10.562790 IP 192.168.43.195.8880 > 192.168.43.124.7772: UDP, length 120
01:48:10.612780 IP 192.168.43.195.8880 > 192.168.43.124.7772: UDP, length 120
01:48:10.618914 IP 192.168.43.124.8880 > 192.168.43.195.7771: UDP, length 120
01:48:10.619210 IP 192.168.43.124.8880 > 192.168.43.195.7771: UDP, length 120
01:48:10.619530 IP 192.168.43.124.8880 > 192.168.43.195.7771: UDP, length 120
01:48:10.629554 IP 192.168.43.124.8880 > 192.168.43.195.7771: UDP, length 120
01:48:10.662782 IP 192.168.43.195.8880 > 192.168.43.124.7772: UDP, length 120
01:48:10.696995 IP 192.168.43.124.8880 > 192.168.43.195.7771: UDP, length 120
01:48:10.712779 IP 192.168.43.195.8880 > 192.168.43.124.7772: UDP, length 120
01:48:10.732709 IP 192.168.43.124.8880 > 192.168.43.195.7771: UDP, length 120
01:48:10.762781 IP 192.168.43.195.8880 > 192.168.43.124.7772: UDP, length 120
01:48:10.792004 IP 192.168.43.124.8880 > 192.168.43.195.7771: UDP, length 120
01:48:10.812782 IP 192.168.43.195.8880 > 192.168.43.124.7772: UDP, length 120
01:48:10.862784 IP 192.168.43.195.8880 > 192.168.43.124.7772: UDP, length 120
01:48:10.912780 IP 192.168.43.195.8880 > 192.168.43.124.7772: UDP, length 120
01:48:10.960683 IP 192.168.43.124.8880 > 192.168.43.195.7771: UDP, length 120
01:48:10.960943 IP 192.168.43.124.8880 > 192.168.43.195.7771: UDP, length 120
01:48:10.961067 IP 192.168.43.124.8880 > 192.168.43.195.7771: UDP, length 120
01:48:10.962785 IP 192.168.43.195.8880 > 192.168.43.124.7772: UDP, length 120
01:48:11.004371 IP 192.168.43.124.8880 > 192.168.43.195.7771: UDP, length 120
01:48:11.012780 IP 192.168.43.195.8880 > 192.168.43.124.7772: UDP, length 120
01:48:11.035349 IP 192.168.43.124.8880 > 192.168.43.195.7771: UDP, length 120
01:48:11.062782 IP 192.168.43.195.8880 > 192.168.43.124.7772: UDP, length 120
01:48:11.087858 IP 192.168.43.124.8880 > 192.168.43.195.7771: UDP, length 120
01:48:11.112793 IP 192.168.43.195.8880 > 192.168.43.124.7772: UDP, length 120
01:48:11.152337 IP 192.168.43.124.8880 > 192.168.43.195.7771: UDP, length 120
01:48:11.162801 IP 192.168.43.195.8880 > 192.168.43.124.7772: UDP, length 120
01:48:11.212780 IP 192.168.43.195.8880 > 192.168.43.124.7772: UDP, length 120
01:48:11.262781 IP 192.168.43.195.8880 > 192.168.43.124.7772: UDP, length 120
01:48:11.312782 IP 192.168.43.195.8880 > 192.168.43.124.7772: UDP, length 120
01:48:11.316180 IP 192.168.43.124.8880 > 192.168.43.195.7771: UDP, length 120
01:48:11.316414 IP 192.168.43.124.8880 > 192.168.43.195.7771: UDP, length 120
01:48:11.316626 IP 192.168.43.124.8880 > 192.168.43.195.7771: UDP, length 120
01:48:11.334068 IP 192.168.43.124.8880 > 192.168.43.195.7771: UDP, length 120
01:48:11.362865 IP 192.168.43.195.8880 > 192.168.43.124.7772: UDP, length 120
01:48:11.390611 IP 192.168.43.124.8880 > 192.168.43.195.7771: UDP, length 120
01:48:11.412803 IP 192.168.43.195.8880 > 192.168.43.124.7772: UDP, length 120
01:48:11.432725 IP 192.168.43.124.8880 > 192.168.43.195.7771: UDP, length 120
01:48:11.462775 IP 192.168.43.195.8880 > 192.168.43.124.7772: UDP, length 120
01:48:11.484762 IP 192.168.43.124.8880 > 192.168.43.195.7771: UDP, length 120
01:48:11.512788 IP 192.168.43.195.8880 > 192.168.43.124.7772: UDP, length 120
01:48:11.562786 IP 192.168.43.195.8880 > 192.168.43.124.7772: UDP, length 120
01:48:11.612791 IP 192.168.43.195.8880 > 192.168.43.124.7772: UDP, length 120
01:48:11.662800 IP 192.168.43.195.8880 > 192.168.43.124.7772: UDP, length 120
01:48:11.665989 IP 192.168.43.124.8880 > 192.168.43.195.7771: UDP, length 120
01:48:11.666241 IP 192.168.43.124.8880 > 192.168.43.195.7771: UDP, length 120
01:48:11.666355 IP 192.168.43.124.8880 > 192.168.43.195.7771: UDP, length 120
01:48:11.682647 IP 192.168.43.124.8880 > 192.168.43.195.7771: UDP, length 120
01:48:11.712791 IP 192.168.43.195.8880 > 192.168.43.124.7772: UDP, length 120
01:48:11.738721 IP 192.168.43.124.8880 > 192.168.43.195.7771: UDP, length 120
01:48:11.762785 IP 192.168.43.195.8880 > 192.168.43.124.7772: UDP, length 120
01:48:11.782749 IP 192.168.43.124.8880 > 192.168.43.195.7771: UDP, length 120
01:48:11.812786 IP 192.168.43.195.8880 > 192.168.43.124.7772: UDP, length 120
01:48:11.833045 IP 192.168.43.124.8880 > 192.168.43.195.7771: UDP, length 120
01:48:11.862794 IP 192.168.43.195.8880 > 192.168.43.124.7772: UDP, length 120
01:48:11.912790 IP 192.168.43.195.8880 > 192.168.43.124.7772: UDP, length 120
01:48:11.962793 IP 192.168.43.195.8880 > 192.168.43.124.7772: UDP, length 120
01:48:12.012793 IP 192.168.43.195.8880 > 192.168.43.124.7772: UDP, length 120
01:48:12.016249 IP 192.168.43.124.8880 > 192.168.43.195.7771: UDP, length 120
01:48:12.016539 IP 192.168.43.124.8880 > 192.168.43.195.7771: UDP, length 120
01:48:12.016751 IP 192.168.43.124.8880 > 192.168.43.195.7771: UDP, length 120
01:48:12.034585 IP 192.168.43.124.8880 > 192.168.43.195.7771: UDP, length 120
01:48:12.062797 IP 192.168.43.195.8880 > 192.168.43.124.7772: UDP, length 120
01:48:12.090299 IP 192.168.43.124.8880 > 192.168.43.195.7771: UDP, length 120
01:48:12.112779 IP 192.168.43.195.8880 > 192.168.43.124.7772: UDP, length 120
01:48:12.134269 IP 192.168.43.124.8880 > 192.168.43.195.7771: UDP, length 120
01:48:12.162780 IP 192.168.43.195.8880 > 192.168.43.124.7772: UDP, length 120
01:48:12.184346 IP 192.168.43.124.8880 > 192.168.43.195.7771: UDP, length 120
01:48:12.212783 IP 192.168.43.195.8880 > 192.168.43.124.7772: UDP, length 120
01:48:12.262781 IP 192.168.43.195.8880 > 192.168.43.124.7772: UDP, length 120
01:48:12.312780 IP 192.168.43.195.8880 > 192.168.43.124.7772: UDP, length 120
01:48:12.362795 IP 192.168.43.195.8880 > 192.168.43.124.7772: UDP, length 120
01:48:12.366223 IP 192.168.43.124.8880 > 192.168.43.195.7771: UDP, length 120
01:48:12.366450 IP 192.168.43.124.8880 > 192.168.43.195.7771: UDP, length 120
01:48:12.366660 IP 192.168.43.124.8880 > 192.168.43.195.7771: UDP, length 120
01:48:12.384368 IP 192.168.43.124.8880 > 192.168.43.195.7771: UDP, length 120
01:48:12.412785 IP 192.168.43.195.8880 > 192.168.43.124.7772: UDP, length 120
01:48:12.441541 IP 192.168.43.124.8880 > 192.168.43.195.7771: UDP, length 120
01:48:12.462782 IP 192.168.43.195.8880 > 192.168.43.124.7772: UDP, length 120
01:48:12.482755 IP 192.168.43.124.8880 > 192.168.43.195.7771: UDP, length 120
01:48:12.512786 IP 192.168.43.195.8880 > 192.168.43.124.7772: UDP, length 120
01:48:12.533647 IP 192.168.43.124.8880 > 192.168.43.195.7771: UDP, length 120
01:48:12.562829 IP 192.168.43.195.8880 > 192.168.43.124.7772: UDP, length 120
01:48:12.612783 IP 192.168.43.195.8880 > 192.168.43.124.7772: UDP, length 120
01:48:12.662789 IP 192.168.43.195.8880 > 192.168.43.124.7772: UDP, length 120
01:48:12.712777 IP 192.168.43.195.8880 > 192.168.43.124.7772: UDP, length 120
01:48:12.714009 IP 192.168.43.124.8880 > 192.168.43.195.7771: UDP, length 120
01:48:12.714266 IP 192.168.43.124.8880 > 192.168.43.195.7771: UDP, length 120
01:48:12.714478 IP 192.168.43.124.8880 > 192.168.43.195.7771: UDP, length 120
01:48:12.735157 IP 192.168.43.124.8880 > 192.168.43.195.7771: UDP, length 120
01:48:12.762786 IP 192.168.43.195.8880 > 192.168.43.124.7772: UDP, length 120
01:48:12.787765 IP 192.168.43.124.8880 > 192.168.43.195.7771: UDP, length 120
01:48:12.812790 IP 192.168.43.195.8880 > 192.168.43.124.7772: UDP, length 120
01:48:12.834554 IP 192.168.43.124.8880 > 192.168.43.195.7771: UDP, length 120
01:48:12.862834 IP 192.168.43.195.8880 > 192.168.43.124.7772: UDP, length 120
01:48:12.901205 IP 192.168.43.124.8880 > 192.168.43.195.7771: UDP, length 120
01:48:12.912802 IP 192.168.43.195.8880 > 192.168.43.124.7772: UDP, length 120
01:48:12.962851 IP 192.168.43.195.8880 > 192.168.43.124.7772: UDP, length 120
01:48:13.012847 IP 192.168.43.195.8880 > 192.168.43.124.7772: UDP, length 120
01:48:13.062902 IP 192.168.43.195.8880 > 192.168.43.124.7772: UDP, length 120
01:48:13.066011 IP 192.168.43.124.8880 > 192.168.43.195.7771: UDP, length 120
01:48:13.066442 IP 192.168.43.124.8880 > 192.168.43.195.7771: UDP, length 120
01:48:13.066738 IP 192.168.43.124.8880 > 192.168.43.195.7771: UDP, length 120
01:48:13.087555 IP 192.168.43.124.8880 > 192.168.43.195.7771: UDP, length 120
01:48:13.112851 IP 192.168.43.195.8880 > 192.168.43.124.7772: UDP, length 120
01:48:13.138184 IP 192.168.43.124.8880 > 192.168.43.195.7771: UDP, length 120
01:48:13.162862 IP 192.168.43.195.8880 > 192.168.43.124.7772: UDP, length 120
01:48:13.182311 IP 192.168.43.124.8880 > 192.168.43.195.7771: UDP, length 120
01:48:13.212918 IP 192.168.43.195.8880 > 192.168.43.124.7772: UDP, length 120
01:48:13.252424 IP 192.168.43.124.8880 > 192.168.43.195.7771: UDP, length 120
01:48:13.262904 IP 192.168.43.195.8880 > 192.168.43.124.7772: UDP, length 120
01:48:13.312822 IP 192.168.43.195.8880 > 192.168.43.124.7772: UDP, length 120
01:48:13.362823 IP 192.168.43.195.8880 > 192.168.43.124.7772: UDP, length 120
01:48:13.409909 IP 192.168.43.124.8880 > 192.168.43.195.7771: UDP, length 120
01:48:13.410122 IP 192.168.43.124.8880 > 192.168.43.195.7771: UDP, length 120
01:48:13.410223 IP 192.168.43.124.8880 > 192.168.43.195.7771: UDP, length 120
01:48:13.412838 IP 192.168.43.195.8880 > 192.168.43.124.7772: UDP, length 120
01:48:13.434789 IP 192.168.43.124.8880 > 192.168.43.195.7771: UDP, length 120
01:48:13.462831 IP 192.168.43.195.8880 > 192.168.43.124.7772: UDP, length 120
01:48:13.484191 IP 192.168.43.124.8880 > 192.168.43.195.7771: UDP, length 120
01:48:13.512877 IP 192.168.43.195.8880 > 192.168.43.124.7772: UDP, length 120
01:48:13.537021 IP 192.168.43.124.8880 > 192.168.43.195.7771: UDP, length 120
01:48:13.562843 IP 192.168.43.195.8880 > 192.168.43.124.7772: UDP, length 120
01:48:13.582252 IP 192.168.43.124.8880 > 192.168.43.195.7771: UDP, length 120
01:48:13.612800 IP 192.168.43.195.8880 > 192.168.43.124.7772: UDP, length 120
01:48:13.662781 IP 192.168.43.195.8880 > 192.168.43.124.7772: UDP, length 120
01:48:13.712787 IP 192.168.43.195.8880 > 192.168.43.124.7772: UDP, length 120
01:48:13.750467 IP 192.168.43.124.8880 > 192.168.43.195.7771: UDP, length 120
01:48:13.750705 IP 192.168.43.124.8880 > 192.168.43.195.7771: UDP, length 120
01:48:13.750821 IP 192.168.43.124.8880 > 192.168.43.195.7771: UDP, length 120
01:48:13.762780 IP 192.168.43.195.8880 > 192.168.43.124.7772: UDP, length 120
01:48:13.782983 IP 192.168.43.124.8880 > 192.168.43.195.7771: UDP, length 120
01:48:13.812785 IP 192.168.43.195.8880 > 192.168.43.124.7772: UDP, length 120
01:48:13.834545 IP 192.168.43.124.8880 > 192.168.43.195.7771: UDP, length 120
01:48:13.862780 IP 192.168.43.195.8880 > 192.168.43.124.7772: UDP, length 120
01:48:13.898262 IP 192.168.43.124.8880 > 192.168.43.195.7771: UDP, length 120
01:48:13.912779 IP 192.168.43.195.8880 > 192.168.43.124.7772: UDP, length 120
01:48:13.932663 IP 192.168.43.124.8880 > 192.168.43.195.7771: UDP, length 120
01:48:13.962779 IP 192.168.43.195.8880 > 192.168.43.124.7772: UDP, length 120
01:48:14.012790 IP 192.168.43.195.8880 > 192.168.43.124.7772: UDP, length 120
01:48:14.062785 IP 192.168.43.195.8880 > 192.168.43.124.7772: UDP, length 120
01:48:14.098171 IP 192.168.43.124.8880 > 192.168.43.195.7771: UDP, length 120
01:48:14.098406 IP 192.168.43.124.8880 > 192.168.43.195.7771: UDP, length 120
01:48:14.098522 IP 192.168.43.124.8880 > 192.168.43.195.7771: UDP, length 120
01:48:14.112781 IP 192.168.43.195.8880 > 192.168.43.124.7772: UDP, length 120
01:48:14.142295 IP 192.168.43.124.8880 > 192.168.43.195.7771: UDP, length 120
01:48:14.162790 IP 192.168.43.195.8880 > 192.168.43.124.7772: UDP, length 120
01:48:14.182747 IP 192.168.43.124.8880 > 192.168.43.195.7771: UDP, length 120
01:48:14.212799 IP 192.168.43.195.8880 > 192.168.43.124.7772: UDP, length 120
01:48:14.232670 IP 192.168.43.124.8880 > 192.168.43.195.7771: UDP, length 120
01:48:14.262783 IP 192.168.43.195.8880 > 192.168.43.124.7772: UDP, length 120
01:48:14.303845 IP 192.168.43.124.8880 > 192.168.43.195.7771: UDP, length 120
01:48:14.312780 IP 192.168.43.195.8880 > 192.168.43.124.7772: UDP, length 120
01:48:14.335314 IP 192.168.43.124.8880 > 192.168.43.195.7771: UDP, length 120
01:48:14.362842 IP 192.168.43.195.8880 > 192.168.43.124.7772: UDP, length 120
01:48:14.383511 IP 192.168.43.124.8880 > 192.168.43.195.7771: UDP, length 120
01:48:14.412800 IP 192.168.43.195.8880 > 192.168.43.124.7772: UDP, length 120
01:48:14.452449 IP 192.168.43.124.8880 > 192.168.43.195.7771: UDP, length 120
01:48:14.462788 IP 192.168.43.195.8880 > 192.168.43.124.7772: UDP, length 120
01:48:14.485776 IP 192.168.43.124.8880 > 192.168.43.195.7771: UDP, length 120
01:48:14.512782 IP 192.168.43.195.8880 > 192.168.43.124.7772: UDP, length 120
01:48:14.532680 IP 192.168.43.124.8880 > 192.168.43.195.7771: UDP, length 120
01:48:14.562798 IP 192.168.43.195.8880 > 192.168.43.124.7772: UDP, length 120
01:48:14.603337 IP 192.168.43.124.8880 > 192.168.43.195.7771: UDP, length 120
01:48:14.612780 IP 192.168.43.195.8880 > 192.168.43.124.7772: UDP, length 120
01:48:14.632865 IP 192.168.43.124.8880 > 192.168.43.195.7771: UDP, length 120
01:48:14.662792 IP 192.168.43.195.8880 > 192.168.43.124.7772: UDP, length 120
01:48:14.682581 IP 192.168.43.124.8880 > 192.168.43.195.7771: UDP, length 120
01:48:14.712790 IP 192.168.43.195.8880 > 192.168.43.124.7772: UDP, length 120
01:48:14.754496 IP 192.168.43.124.8880 > 192.168.43.195.7771: UDP, length 120
01:48:14.762781 IP 192.168.43.195.8880 > 192.168.43.124.7772: UDP, length 120
01:48:14.783031 IP 192.168.43.124.8880 > 192.168.43.195.7771: UDP, length 120
01:48:14.812779 IP 192.168.43.195.8880 > 192.168.43.124.7772: UDP, length 120
01:48:14.829592 IP 192.168.43.124.8880 > 192.168.43.195.7771: UDP, length 120
01:48:14.862786 IP 192.168.43.195.8880 > 192.168.43.124.7772: UDP, length 120
01:48:14.882946 IP 192.168.43.124.8880 > 192.168.43.195.7771: UDP, length 120
01:48:14.912790 IP 192.168.43.195.8880 > 192.168.43.124.7772: UDP, length 120
01:48:14.933345 IP 192.168.43.124.8880 > 192.168.43.195.7771: UDP, length 120
01:48:14.962792 IP 192.168.43.195.8880 > 192.168.43.124.7772: UDP, length 120
01:48:14.982731 IP 192.168.43.124.8880 > 192.168.43.195.7771: UDP, length 120
01:48:15.012783 IP 192.168.43.195.8880 > 192.168.43.124.7772: UDP, length 120
01:48:15.032703 IP 192.168.43.124.8880 > 192.168.43.195.7771: UDP, length 120
01:48:15.062780 IP 192.168.43.195.8880 > 192.168.43.124.7772: UDP, length 120
01:48:15.100444 IP 192.168.43.124.8880 > 192.168.43.195.7771: UDP, length 120
01:48:15.112777 IP 192.168.43.195.8880 > 192.168.43.124.7772: UDP, length 120
01:48:15.133138 IP 192.168.43.124.8880 > 192.168.43.195.7771: UDP, length 120
01:48:15.162801 IP 192.168.43.195.8880 > 192.168.43.124.7772: UDP, length 120
01:48:15.182420 IP 192.168.43.124.8880 > 192.168.43.195.7771: UDP, length 120
01:48:15.212799 IP 192.168.43.195.8880 > 192.168.43.124.7772: UDP, length 120
01:48:15.253140 IP 192.168.43.124.8880 > 192.168.43.195.7771: UDP, length 120
01:48:15.262777 IP 192.168.43.195.8880 > 192.168.43.124.7772: UDP, length 120
01:48:15.283124 IP 192.168.43.124.8880 > 192.168.43.195.7771: UDP, length 120
01:48:15.312773 IP 192.168.43.195.8880 > 192.168.43.124.7772: UDP, length 120
01:48:15.332692 IP 192.168.43.124.8880 > 192.168.43.195.7771: UDP, length 120
01:48:15.362780 IP 192.168.43.195.8880 > 192.168.43.124.7772: UDP, length 120
01:48:15.407371 IP 192.168.43.124.8880 > 192.168.43.195.7771: UDP, length 120
01:48:15.412777 IP 192.168.43.195.8880 > 192.168.43.124.7772: UDP, length 120
01:48:15.434647 IP 192.168.43.124.8880 > 192.168.43.195.7771: UDP, length 120
01:48:15.462781 IP 192.168.43.195.8880 > 192.168.43.124.7772: UDP, length 120
01:48:15.502114 IP 192.168.43.124.8880 > 192.168.43.195.7771: UDP, length 120
01:48:15.512780 IP 192.168.43.195.8880 > 192.168.43.124.7772: UDP, length 120
01:48:15.532799 IP 192.168.43.124.8880 > 192.168.43.195.7771: UDP, length 120
01:48:15.562805 IP 192.168.43.195.8880 > 192.168.43.124.7772: UDP, length 120
01:48:15.585191 IP 192.168.43.124.8880 > 192.168.43.195.7771: UDP, length 120
01:48:15.612783 IP 192.168.43.195.8880 > 192.168.43.124.7772: UDP, length 120
01:48:15.652500 IP 192.168.43.124.8880 > 192.168.43.195.7771: UDP, length 120
01:48:15.662778 IP 192.168.43.195.8880 > 192.168.43.124.7772: UDP, length 120
01:48:15.683290 IP 192.168.43.124.8880 > 192.168.43.195.7771: UDP, length 120
01:48:15.712780 IP 192.168.43.195.8880 > 192.168.43.124.7772: UDP, length 120
01:48:15.731995 IP 192.168.43.124.8880 > 192.168.43.195.7771: UDP, length 120
01:48:15.762780 IP 192.168.43.195.8880 > 192.168.43.124.7772: UDP, length 120
01:48:15.803848 IP 192.168.43.124.8880 > 192.168.43.195.7771: UDP, length 120
01:48:15.812796 IP 192.168.43.195.8880 > 192.168.43.124.7772: UDP, length 120
01:48:15.834514 IP 192.168.43.124.8880 > 192.168.43.195.7771: UDP, length 120
01:48:15.862842 IP 192.168.43.195.8880 > 192.168.43.124.7772: UDP, length 120
01:48:15.903390 IP 192.168.43.124.8880 > 192.168.43.195.7771: UDP, length 120
01:48:15.912790 IP 192.168.43.195.8880 > 192.168.43.124.7772: UDP, length 120
01:48:15.933032 IP 192.168.43.124.8880 > 192.168.43.195.7771: UDP, length 120
01:48:15.962780 IP 192.168.43.195.8880 > 192.168.43.124.7772: UDP, length 120
01:48:15.983566 IP 192.168.43.124.8880 > 192.168.43.195.7771: UDP, length 120
01:48:16.012781 IP 192.168.43.195.8880 > 192.168.43.124.7772: UDP, length 120
01:48:16.053523 IP 192.168.43.124.8880 > 192.168.43.195.7771: UDP, length 120
01:48:16.062777 IP 192.168.43.195.8880 > 192.168.43.124.7772: UDP, length 120
01:48:16.098411 IP 192.168.43.124.8880 > 192.168.43.195.7771: UDP, length 120
01:48:16.112776 IP 192.168.43.195.8880 > 192.168.43.124.7772: UDP, length 120
01:48:16.132680 IP 192.168.43.124.8880 > 192.168.43.195.7771: UDP, length 120
01:48:16.162779 IP 192.168.43.195.8880 > 192.168.43.124.7772: UDP, length 120
01:48:16.199338 IP 192.168.43.124.8880 > 192.168.43.195.7771: UDP, length 120
01:48:16.212784 IP 192.168.43.195.8880 > 192.168.43.124.7772: UDP, length 120
01:48:16.233016 IP 192.168.43.124.8880 > 192.168.43.195.7771: UDP, length 120
01:48:16.262785 IP 192.168.43.195.8880 > 192.168.43.124.7772: UDP, length 120
01:48:16.282769 IP 192.168.43.124.8880 > 192.168.43.195.7771: UDP, length 120
01:48:16.312782 IP 192.168.43.195.8880 > 192.168.43.124.7772: UDP, length 120
01:48:16.345206 IP 192.168.43.124.8880 > 192.168.43.195.7771: UDP, length 120
01:48:16.362780 IP 192.168.43.195.8880 > 192.168.43.124.7772: UDP, length 120
01:48:16.382883 IP 192.168.43.124.8880 > 192.168.43.195.7771: UDP, length 120
01:48:16.412780 IP 192.168.43.195.8880 > 192.168.43.124.7772: UDP, length 120
01:48:16.432499 IP 192.168.43.124.8880 > 192.168.43.195.7771: UDP, length 120
01:48:16.462780 IP 192.168.43.195.8880 > 192.168.43.124.7772: UDP, length 120
01:48:16.502809 IP 192.168.43.124.8880 > 192.168.43.195.7771: UDP, length 120
01:48:16.512779 IP 192.168.43.195.8880 > 192.168.43.124.7772: UDP, length 120
01:48:16.533797 IP 192.168.43.124.8880 > 192.168.43.195.7771: UDP, length 120
01:48:16.562790 IP 192.168.43.195.8880 > 192.168.43.124.7772: UDP, length 120
01:48:16.583496 IP 192.168.43.124.8880 > 192.168.43.195.7771: UDP, length 120
01:48:16.612780 IP 192.168.43.195.8880 > 192.168.43.124.7772: UDP, length 120
01:48:16.632977 IP 192.168.43.124.8880 > 192.168.43.195.7771: UDP, length 120
01:48:16.662780 IP 192.168.43.195.8880 > 192.168.43.124.7772: UDP, length 120
01:48:16.682807 IP 192.168.43.124.8880 > 192.168.43.195.7771: UDP, length 120
01:48:16.712780 IP 192.168.43.195.8880 > 192.168.43.124.7772: UDP, length 120
01:48:16.732913 IP 192.168.43.124.8880 > 192.168.43.195.7771: UDP, length 120
01:48:16.762779 IP 192.168.43.195.8880 > 192.168.43.124.7772: UDP, length 120
01:48:16.782815 IP 192.168.43.124.8880 > 192.168.43.195.7771: UDP, length 120
01:48:16.812785 IP 192.168.43.195.8880 > 192.168.43.124.7772: UDP, length 120
01:48:16.834586 IP 192.168.43.124.8880 > 192.168.43.195.7771: UDP, length 120
01:48:16.862780 IP 192.168.43.195.8880 > 192.168.43.124.7772: UDP, length 120
01:48:16.900493 IP 192.168.43.124.8880 > 192.168.43.195.7771: UDP, length 120
01:48:16.912776 IP 192.168.43.195.8880 > 192.168.43.124.7772: UDP, length 120
01:48:16.932811 IP 192.168.43.124.8880 > 192.168.43.195.7771: UDP, length 120
01:48:16.962780 IP 192.168.43.195.8880 > 192.168.43.124.7772: UDP, length 120
01:48:16.981464 IP 192.168.43.124.8880 > 192.168.43.195.7771: UDP, length 120
01:48:17.012792 IP 192.168.43.195.8880 > 192.168.43.124.7772: UDP, length 120
01:48:17.053294 IP 192.168.43.124.8880 > 192.168.43.195.7771: UDP, length 120
01:48:17.062781 IP 192.168.43.195.8880 > 192.168.43.124.7772: UDP, length 120
01:48:17.083537 IP 192.168.43.124.8880 > 192.168.43.195.7771: UDP, length 120
01:48:17.112778 IP 192.168.43.195.8880 > 192.168.43.124.7772: UDP, length 120
01:48:17.132510 IP 192.168.43.124.8880 > 192.168.43.195.7771: UDP, length 120
01:48:17.162778 IP 192.168.43.195.8880 > 192.168.43.124.7772: UDP, length 120
01:48:17.204140 IP 192.168.43.124.8880 > 192.168.43.195.7771: UDP, length 120
01:48:17.212778 IP 192.168.43.195.8880 > 192.168.43.124.7772: UDP, length 120
01:48:17.232810 IP 192.168.43.124.8880 > 192.168.43.195.7771: UDP, length 120
01:48:17.262786 IP 192.168.43.195.8880 > 192.168.43.124.7772: UDP, length 120
01:48:17.283323 IP 192.168.43.124.8880 > 192.168.43.195.7771: UDP, length 120
01:48:17.312781 IP 192.168.43.195.8880 > 192.168.43.124.7772: UDP, length 120
01:48:17.359624 IP 192.168.43.124.8880 > 192.168.43.195.7771: UDP, length 120
01:48:17.362833 IP 192.168.43.195.8880 > 192.168.43.124.7772: UDP, length 120
01:48:17.383030 IP 192.168.43.124.8880 > 192.168.43.195.7771: UDP, length 120
01:48:17.412794 IP 192.168.43.195.8880 > 192.168.43.124.7772: UDP, length 120
01:48:17.432893 IP 192.168.43.124.8880 > 192.168.43.195.7771: UDP, length 120
01:48:17.462781 IP 192.168.43.195.8880 > 192.168.43.124.7772: UDP, length 120
01:48:17.503300 IP 192.168.43.124.8880 > 192.168.43.195.7771: UDP, length 120
01:48:17.512782 IP 192.168.43.195.8880 > 192.168.43.124.7772: UDP, length 120
01:48:17.534778 IP 192.168.43.124.8880 > 192.168.43.195.7771: UDP, length 120
01:48:17.562800 IP 192.168.43.195.8880 > 192.168.43.124.7772: UDP, length 120
01:48:17.582565 IP 192.168.43.124.8880 > 192.168.43.195.7771: UDP, length 120
01:48:17.612792 IP 192.168.43.195.8880 > 192.168.43.124.7772: UDP, length 120
01:48:17.650398 IP 192.168.43.124.8880 > 192.168.43.195.7771: UDP, length 120
01:48:17.662789 IP 192.168.43.195.8880 > 192.168.43.124.7772: UDP, length 120
01:48:17.682917 IP 192.168.43.124.8880 > 192.168.43.195.7771: UDP, length 120
01:48:17.712779 IP 192.168.43.195.8880 > 192.168.43.124.7772: UDP, length 120
01:48:17.735356 IP 192.168.43.124.8880 > 192.168.43.195.7771: UDP, length 120
01:48:17.762780 IP 192.168.43.195.8880 > 192.168.43.124.7772: UDP, length 120
01:48:17.803550 IP 192.168.43.124.8880 > 192.168.43.195.7771: UDP, length 120
01:48:17.812788 IP 192.168.43.195.8880 > 192.168.43.124.7772: UDP, length 120
01:48:17.850338 IP 192.168.43.124.8880 > 192.168.43.195.7771: UDP, length 120
01:48:17.862790 IP 192.168.43.195.8880 > 192.168.43.124.7772: UDP, length 120
01:48:17.879713 IP 192.168.43.124.8880 > 192.168.43.195.7771: UDP, length 120
01:48:17.912789 IP 192.168.43.195.8880 > 192.168.43.124.7772: UDP, length 120
01:48:17.934513 IP 192.168.43.124.8880 > 192.168.43.195.7771: UDP, length 120
01:48:17.962781 IP 192.168.43.195.8880 > 192.168.43.124.7772: UDP, length 120
01:48:17.982731 IP 192.168.43.124.8880 > 192.168.43.195.7771: UDP, length 120
01:48:18.012782 IP 192.168.43.195.8880 > 192.168.43.124.7772: UDP, length 120
01:48:18.032584 IP 192.168.43.124.8880 > 192.168.43.195.7771: UDP, length 120
01:48:18.062781 IP 192.168.43.195.8880 > 192.168.43.124.7772: UDP, length 120
01:48:18.104012 IP 192.168.43.124.8880 > 192.168.43.195.7771: UDP, length 120
01:48:18.112789 IP 192.168.43.195.8880 > 192.168.43.124.7772: UDP, length 120
01:48:18.132802 IP 192.168.43.124.8880 > 192.168.43.195.7771: UDP, length 120
01:48:18.162787 IP 192.168.43.195.8880 > 192.168.43.124.7772: UDP, length 120
01:48:18.191416 IP 192.168.43.124.8880 > 192.168.43.195.7771: UDP, length 120
01:48:18.212778 IP 192.168.43.195.8880 > 192.168.43.124.7772: UDP, length 120
01:48:18.232996 IP 192.168.43.124.8880 > 192.168.43.195.7771: UDP, length 120
01:48:18.262779 IP 192.168.43.195.8880 > 192.168.43.124.7772: UDP, length 120
01:48:18.283172 IP 192.168.43.124.8880 > 192.168.43.195.7771: UDP, length 120
01:48:18.312778 IP 192.168.43.195.8880 > 192.168.43.124.7772: UDP, length 120
01:48:18.352230 IP 192.168.43.124.8880 > 192.168.43.195.7771: UDP, length 120
01:48:18.362792 IP 192.168.43.195.8880 > 192.168.43.124.7772: UDP, length 120
01:48:18.383323 IP 192.168.43.124.8880 > 192.168.43.195.7771: UDP, length 120
01:48:18.412783 IP 192.168.43.195.8880 > 192.168.43.124.7772: UDP, length 120
01:48:18.432716 IP 192.168.43.124.8880 > 192.168.43.195.7771: UDP, length 120
01:48:18.462779 IP 192.168.43.195.8880 > 192.168.43.124.7772: UDP, length 120
01:48:18.501985 IP 192.168.43.124.8880 > 192.168.43.195.7771: UDP, length 120
01:48:18.512800 IP 192.168.43.195.8880 > 192.168.43.124.7772: UDP, length 120
01:48:18.534989 IP 192.168.43.124.8880 > 192.168.43.195.7771: UDP, length 120
01:48:18.562863 IP 192.168.43.195.8880 > 192.168.43.124.7772: UDP, length 120
01:48:18.587270 IP 192.168.43.124.8880 > 192.168.43.195.7771: UDP, length 120
01:48:18.612863 IP 192.168.43.195.8880 > 192.168.43.124.7772: UDP, length 120
01:48:18.662943 IP 192.168.43.195.8880 > 192.168.43.124.7772: UDP, length 120
01:48:18.712833 IP 192.168.43.195.8880 > 192.168.43.124.7772: UDP, length 120
01:48:18.762842 IP 192.168.43.195.8880 > 192.168.43.124.7772: UDP, length 120
01:48:18.775199 IP 192.168.43.124.8880 > 192.168.43.195.7771: UDP, length 120
01:48:18.775404 IP 192.168.43.124.8880 > 192.168.43.195.7771: UDP, length 120
01:48:18.812839 IP 192.168.43.195.8880 > 192.168.43.124.7772: UDP, length 120
01:48:18.862867 IP 192.168.43.195.8880 > 192.168.43.124.7772: UDP, length 120
01:48:18.876141 IP 192.168.43.124.8880 > 192.168.43.195.7771: UDP, length 120
01:48:18.876248 IP 192.168.43.124.8880 > 192.168.43.195.7771: UDP, length 120
01:48:18.912829 IP 192.168.43.195.8880 > 192.168.43.124.7772: UDP, length 120
01:48:18.962828 IP 192.168.43.195.8880 > 192.168.43.124.7772: UDP, length 120
01:48:18.975340 IP 192.168.43.124.8880 > 192.168.43.195.7771: UDP, length 120
01:48:18.975966 IP 192.168.43.124.8880 > 192.168.43.195.7771: UDP, length 120
01:48:19.012836 IP 192.168.43.195.8880 > 192.168.43.124.7772: UDP, length 120
01:48:19.062806 IP 192.168.43.195.8880 > 192.168.43.124.7772: UDP, length 120
01:48:19.083954 IP 192.168.43.124.8880 > 192.168.43.195.7771: UDP, length 120
01:48:19.084061 IP 192.168.43.124.8880 > 192.168.43.195.7771: UDP, length 120
01:48:19.112764 IP 192.168.43.195.8880 > 192.168.43.124.7772: UDP, length 120
01:48:19.162758 IP 192.168.43.195.8880 > 192.168.43.124.7772: UDP, length 120
01:48:19.174773 IP 192.168.43.124.8880 > 192.168.43.195.7771: UDP, length 120
01:48:19.175042 IP 192.168.43.124.8880 > 192.168.43.195.7771: UDP, length 120
01:48:19.212762 IP 192.168.43.195.8880 > 192.168.43.124.7772: UDP, length 120
01:48:19.262754 IP 192.168.43.195.8880 > 192.168.43.124.7772: UDP, length 120
01:48:19.274384 IP 192.168.43.124.8880 > 192.168.43.195.7771: UDP, length 120
01:48:19.274458 IP 192.168.43.124.8880 > 192.168.43.195.7771: UDP, length 120
01:48:19.312759 IP 192.168.43.195.8880 > 192.168.43.124.7772: UDP, length 120
01:48:19.362753 IP 192.168.43.195.8880 > 192.168.43.124.7772: UDP, length 120
01:48:19.378160 IP 192.168.43.124.8880 > 192.168.43.195.7771: UDP, length 120
01:48:19.378240 IP 192.168.43.124.8880 > 192.168.43.195.7771: UDP, length 120
01:48:19.412763 IP 192.168.43.195.8880 > 192.168.43.124.7772: UDP, length 120
01:48:19.462753 IP 192.168.43.195.8880 > 192.168.43.124.7772: UDP, length 120
01:48:19.482479 IP 192.168.43.124.8880 > 192.168.43.195.7771: UDP, length 120
01:48:19.482557 IP 192.168.43.124.8880 > 192.168.43.195.7771: UDP, length 120
01:48:19.512758 IP 192.168.43.195.8880 > 192.168.43.124.7772: UDP, length 120
01:48:19.562761 IP 192.168.43.195.8880 > 192.168.43.124.7772: UDP, length 120
01:48:19.575393 IP 192.168.43.124.8880 > 192.168.43.195.7771: UDP, length 120
01:48:19.575474 IP 192.168.43.124.8880 > 192.168.43.195.7771: UDP, length 120
01:48:19.612755 IP 192.168.43.195.8880 > 192.168.43.124.7772: UDP, length 120
01:48:19.662752 IP 192.168.43.195.8880 > 192.168.43.124.7772: UDP, length 120
01:48:19.681149 IP 192.168.43.124.8880 > 192.168.43.195.7771: UDP, length 120
01:48:19.681224 IP 192.168.43.124.8880 > 192.168.43.195.7771: UDP, length 120
01:48:19.712754 IP 192.168.43.195.8880 > 192.168.43.124.7772: UDP, length 120
01:48:19.762753 IP 192.168.43.195.8880 > 192.168.43.124.7772: UDP, length 120
01:48:19.775037 IP 192.168.43.124.8880 > 192.168.43.195.7771: UDP, length 120
01:48:19.775309 IP 192.168.43.124.8880 > 192.168.43.195.7771: UDP, length 120
01:48:19.812754 IP 192.168.43.195.8880 > 192.168.43.124.7772: UDP, length 120
01:48:19.862753 IP 192.168.43.195.8880 > 192.168.43.124.7772: UDP, length 120
01:48:19.875013 IP 192.168.43.124.8880 > 192.168.43.195.7771: UDP, length 120
01:48:19.876132 IP 192.168.43.124.8880 > 192.168.43.195.7771: UDP, length 120
01:48:19.912756 IP 192.168.43.195.8880 > 192.168.43.124.7772: UDP, length 120
01:48:19.962753 IP 192.168.43.195.8880 > 192.168.43.124.7772: UDP, length 120
01:48:19.975012 IP 192.168.43.124.8880 > 192.168.43.195.7771: UDP, length 120
01:48:19.975235 IP 192.168.43.124.8880 > 192.168.43.195.7771: UDP, length 120
01:48:20.012754 IP 192.168.43.195.8880 > 192.168.43.124.7772: UDP, length 120
01:48:20.062754 IP 192.168.43.195.8880 > 192.168.43.124.7772: UDP, length 120
01:48:20.074157 IP 192.168.43.124.8880 > 192.168.43.195.7771: UDP, length 120
01:48:20.074234 IP 192.168.43.124.8880 > 192.168.43.195.7771: UDP, length 120
01:48:20.112754 IP 192.168.43.195.8880 > 192.168.43.124.7772: UDP, length 120
01:48:20.162752 IP 192.168.43.195.8880 > 192.168.43.124.7772: UDP, length 120
01:48:20.187004 IP 192.168.43.124.8880 > 192.168.43.195.7771: UDP, length 120
01:48:20.187145 IP 192.168.43.124.8880 > 192.168.43.195.7771: UDP, length 120
01:48:20.187218 IP 192.168.43.124.8880 > 192.168.43.195.7771: UDP, length 120
01:48:20.212753 IP 192.168.43.195.8880 > 192.168.43.124.7772: UDP, length 120
01:48:20.262753 IP 192.168.43.195.8880 > 192.168.43.124.7772: UDP, length 120
01:48:20.312753 IP 192.168.43.195.8880 > 192.168.43.124.7772: UDP, length 120
01:48:20.324175 IP 192.168.43.124.8880 > 192.168.43.195.7771: UDP, length 120
01:48:20.324564 IP 192.168.43.124.8880 > 192.168.43.195.7771: UDP, length 120
01:48:20.362792 IP 192.168.43.195.8880 > 192.168.43.124.7772: UDP, length 120
01:48:20.412762 IP 192.168.43.195.8880 > 192.168.43.124.7772: UDP, length 120
01:48:20.425053 IP 192.168.43.124.8880 > 192.168.43.195.7771: UDP, length 120
01:48:20.425306 IP 192.168.43.124.8880 > 192.168.43.195.7771: UDP, length 120
01:48:20.462757 IP 192.168.43.195.8880 > 192.168.43.124.7772: UDP, length 120
01:48:20.512762 IP 192.168.43.195.8880 > 192.168.43.124.7772: UDP, length 120
01:48:20.524763 IP 192.168.43.124.8880 > 192.168.43.195.7771: UDP, length 120
01:48:20.524862 IP 192.168.43.124.8880 > 192.168.43.195.7771: UDP, length 120
01:48:20.562773 IP 192.168.43.195.8880 > 192.168.43.124.7772: UDP, length 120
01:48:20.612758 IP 192.168.43.195.8880 > 192.168.43.124.7772: UDP, length 120
01:48:20.625014 IP 192.168.43.124.8880 > 192.168.43.195.7771: UDP, length 120
01:48:20.625181 IP 192.168.43.124.8880 > 192.168.43.195.7771: UDP, length 120
01:48:20.662758 IP 192.168.43.195.8880 > 192.168.43.124.7772: UDP, length 120
01:48:20.712753 IP 192.168.43.195.8880 > 192.168.43.124.7772: UDP, length 120
01:48:20.725026 IP 192.168.43.124.8880 > 192.168.43.195.7771: UDP, length 120
01:48:20.725251 IP 192.168.43.124.8880 > 192.168.43.195.7771: UDP, length 120
01:48:20.762753 IP 192.168.43.195.8880 > 192.168.43.124.7772: UDP, length 120
01:48:20.812753 IP 192.168.43.195.8880 > 192.168.43.124.7772: UDP, length 120
01:48:20.844951 IP 192.168.43.124.8880 > 192.168.43.195.7771: UDP, length 120
01:48:20.845027 IP 192.168.43.124.8880 > 192.168.43.195.7771: UDP, length 120
01:48:20.845099 IP 192.168.43.124.8880 > 192.168.43.195.7771: UDP, length 120
01:48:20.862758 IP 192.168.43.195.8880 > 192.168.43.124.7772: UDP, length 120
01:48:20.912754 IP 192.168.43.195.8880 > 192.168.43.124.7772: UDP, length 120
01:48:20.962719 IP 192.168.43.195.8880 > 192.168.43.124.7772: UDP, length 120
01:48:20.993039 IP 192.168.43.124.8880 > 192.168.43.195.7771: UDP, length 120
01:48:20.993181 IP 192.168.43.124.8880 > 192.168.43.195.7771: UDP, length 120
01:48:21.012759 IP 192.168.43.195.8880 > 192.168.43.124.7772: UDP, length 120
01:48:21.062757 IP 192.168.43.195.8880 > 192.168.43.124.7772: UDP, length 120
01:48:21.112757 IP 192.168.43.195.8880 > 192.168.43.124.7772: UDP, length 120
01:48:21.134127 IP 192.168.43.124.8880 > 192.168.43.195.7771: UDP, length 120
01:48:21.134272 IP 192.168.43.124.8880 > 192.168.43.195.7771: UDP, length 120
01:48:21.134349 IP 192.168.43.124.8880 > 192.168.43.195.7771: UDP, length 120
01:48:21.162752 IP 192.168.43.195.8880 > 192.168.43.124.7772: UDP, length 120
01:48:21.212752 IP 192.168.43.195.8880 > 192.168.43.124.7772: UDP, length 120
01:48:21.224652 IP 192.168.43.124.8880 > 192.168.43.195.7771: UDP, length 120
01:48:21.224728 IP 192.168.43.124.8880 > 192.168.43.195.7771: UDP, length 120
01:48:21.262754 IP 192.168.43.195.8880 > 192.168.43.124.7772: UDP, length 120
01:48:21.312790 IP 192.168.43.195.8880 > 192.168.43.124.7772: UDP, length 120
01:48:21.362756 IP 192.168.43.195.8880 > 192.168.43.124.7772: UDP, length 120
01:48:21.382606 IP 192.168.43.124.8880 > 192.168.43.195.7771: UDP, length 120
01:48:21.382774 IP 192.168.43.124.8880 > 192.168.43.195.7771: UDP, length 120
01:48:21.382859 IP 192.168.43.124.8880 > 192.168.43.195.7771: UDP, length 120
01:48:21.412756 IP 192.168.43.195.8880 > 192.168.43.124.7772: UDP, length 120
01:48:21.462760 IP 192.168.43.195.8880 > 192.168.43.124.7772: UDP, length 120
01:48:21.495582 IP 192.168.43.124.8880 > 192.168.43.195.7771: UDP, length 120
01:48:21.495728 IP 192.168.43.124.8880 > 192.168.43.195.7771: UDP, length 120
01:48:21.512771 IP 192.168.43.195.8880 > 192.168.43.124.7772: UDP, length 120
01:48:21.562769 IP 192.168.43.195.8880 > 192.168.43.124.7772: UDP, length 120
01:48:21.612753 IP 192.168.43.195.8880 > 192.168.43.124.7772: UDP, length 120
01:48:21.634488 IP 192.168.43.124.8880 > 192.168.43.195.7771: UDP, length 120
01:48:21.634647 IP 192.168.43.124.8880 > 192.168.43.195.7771: UDP, length 120
01:48:21.634723 IP 192.168.43.124.8880 > 192.168.43.195.7771: UDP, length 120
01:48:21.662755 IP 192.168.43.195.8880 > 192.168.43.124.7772: UDP, length 120
01:48:21.691200 IP 192.168.43.124.8880 > 192.168.43.195.7771: UDP, length 120
01:48:21.691342 IP 192.168.43.124.8880 > 192.168.43.195.7771: UDP, length 120
01:48:21.712754 IP 192.168.43.195.8880 > 192.168.43.124.7772: UDP, length 120
01:48:21.747821 IP 192.168.43.124.8880 > 192.168.43.195.7771: UDP, length 120
01:48:21.762754 IP 192.168.43.195.8880 > 192.168.43.124.7772: UDP, length 120
01:48:21.782604 IP 192.168.43.124.8880 > 192.168.43.195.7771: UDP, length 120
01:48:21.812757 IP 192.168.43.195.8880 > 192.168.43.124.7772: UDP, length 120
01:48:21.834408 IP 192.168.43.124.8880 > 192.168.43.195.7771: UDP, length 120
01:48:21.862794 IP 192.168.43.195.8880 > 192.168.43.124.7772: UDP, length 120
01:48:21.897506 IP 192.168.43.124.8880 > 192.168.43.195.7771: UDP, length 120
01:48:21.912763 IP 192.168.43.195.8880 > 192.168.43.124.7772: UDP, length 120
01:48:21.933994 IP 192.168.43.124.8880 > 192.168.43.195.7771: UDP, length 120
01:48:21.962755 IP 192.168.43.195.8880 > 192.168.43.124.7772: UDP, length 120
01:48:21.983119 IP 192.168.43.124.8880 > 192.168.43.195.7771: UDP, length 120
01:48:22.012754 IP 192.168.43.195.8880 > 192.168.43.124.7772: UDP, length 120
01:48:22.036283 IP 192.168.43.124.8880 > 192.168.43.195.7771: UDP, length 120
01:48:22.062761 IP 192.168.43.195.8880 > 192.168.43.124.7772: UDP, length 120
01:48:22.092972 IP 192.168.43.124.8880 > 192.168.43.195.7771: UDP, length 120
01:48:22.112754 IP 192.168.43.195.8880 > 192.168.43.124.7772: UDP, length 120
01:48:22.149177 IP 192.168.43.124.8880 > 192.168.43.195.7771: UDP, length 120
01:48:22.162752 IP 192.168.43.195.8880 > 192.168.43.124.7772: UDP, length 120
01:48:22.183694 IP 192.168.43.124.8880 > 192.168.43.195.7771: UDP, length 120
01:48:22.212753 IP 192.168.43.195.8880 > 192.168.43.124.7772: UDP, length 120
01:48:22.232454 IP 192.168.43.124.8880 > 192.168.43.195.7771: UDP, length 120
01:48:22.262754 IP 192.168.43.195.8880 > 192.168.43.124.7772: UDP, length 120
01:48:22.290526 IP 192.168.43.124.8880 > 192.168.43.195.7771: UDP, length 120
01:48:22.312753 IP 192.168.43.195.8880 > 192.168.43.124.7772: UDP, length 120
01:48:22.348855 IP 192.168.43.124.8880 > 192.168.43.195.7771: UDP, length 120
01:48:22.362751 IP 192.168.43.195.8880 > 192.168.43.124.7772: UDP, length 120
01:48:22.381802 IP 192.168.43.124.8880 > 192.168.43.195.7771: UDP, length 120
01:48:22.412755 IP 192.168.43.195.8880 > 192.168.43.124.7772: UDP, length 120
01:48:22.432112 IP 192.168.43.124.8880 > 192.168.43.195.7771: UDP, length 120
01:48:22.462754 IP 192.168.43.195.8880 > 192.168.43.124.7772: UDP, length 120
01:48:22.505705 IP 192.168.43.124.8880 > 192.168.43.195.7771: UDP, length 120
01:48:22.512755 IP 192.168.43.195.8880 > 192.168.43.124.7772: UDP, length 120
01:48:22.532774 IP 192.168.43.124.8880 > 192.168.43.195.7771: UDP, length 120
01:48:22.562771 IP 192.168.43.195.8880 > 192.168.43.124.7772: UDP, length 120
01:48:22.582749 IP 192.168.43.124.8880 > 192.168.43.195.7771: UDP, length 120
01:48:22.612761 IP 192.168.43.195.8880 > 192.168.43.124.7772: UDP, length 120
01:48:22.634595 IP 192.168.43.124.8880 > 192.168.43.195.7771: UDP, length 120
01:48:22.662754 IP 192.168.43.195.8880 > 192.168.43.124.7772: UDP, length 120
01:48:22.690739 IP 192.168.43.124.8880 > 192.168.43.195.7771: UDP, length 120
01:48:22.712753 IP 192.168.43.195.8880 > 192.168.43.124.7772: UDP, length 120
01:48:22.747638 IP 192.168.43.124.8880 > 192.168.43.195.7771: UDP, length 120
01:48:22.762753 IP 192.168.43.195.8880 > 192.168.43.124.7772: UDP, length 120
01:48:22.784115 IP 192.168.43.124.8880 > 192.168.43.195.7771: UDP, length 120
01:48:22.812756 IP 192.168.43.195.8880 > 192.168.43.124.7772: UDP, length 120
01:48:22.834654 IP 192.168.43.124.8880 > 192.168.43.195.7771: UDP, length 120
01:48:22.862753 IP 192.168.43.195.8880 > 192.168.43.124.7772: UDP, length 120
01:48:22.893597 IP 192.168.43.124.8880 > 192.168.43.195.7771: UDP, length 120
01:48:22.912753 IP 192.168.43.195.8880 > 192.168.43.124.7772: UDP, length 120
01:48:22.932646 IP 192.168.43.124.8880 > 192.168.43.195.7771: UDP, length 120
01:48:22.962754 IP 192.168.43.195.8880 > 192.168.43.124.7772: UDP, length 120
01:48:22.982584 IP 192.168.43.124.8880 > 192.168.43.195.7771: UDP, length 120
01:48:23.012754 IP 192.168.43.195.8880 > 192.168.43.124.7772: UDP, length 120
01:48:23.034007 IP 192.168.43.124.8880 > 192.168.43.195.7771: UDP, length 120
01:48:23.062752 IP 192.168.43.195.8880 > 192.168.43.124.7772: UDP, length 120
01:48:23.096292 IP 192.168.43.124.8880 > 192.168.43.195.7771: UDP, length 120
01:48:23.112754 IP 192.168.43.195.8880 > 192.168.43.124.7772: UDP, length 120
01:48:23.132811 IP 192.168.43.124.8880 > 192.168.43.195.7771: UDP, length 120
01:48:23.162754 IP 192.168.43.195.8880 > 192.168.43.124.7772: UDP, length 120
01:48:23.183283 IP 192.168.43.124.8880 > 192.168.43.195.7771: UDP, length 120
01:48:23.212753 IP 192.168.43.195.8880 > 192.168.43.124.7772: UDP, length 120
01:48:23.237162 IP 192.168.43.124.8880 > 192.168.43.195.7771: UDP, length 120
01:48:23.262753 IP 192.168.43.195.8880 > 192.168.43.124.7772: UDP, length 120
01:48:23.295305 IP 192.168.43.124.8880 > 192.168.43.195.7771: UDP, length 120
01:48:23.312753 IP 192.168.43.195.8880 > 192.168.43.124.7772: UDP, length 120
01:48:23.332734 IP 192.168.43.124.8880 > 192.168.43.195.7771: UDP, length 120
01:48:23.362794 IP 192.168.43.195.8880 > 192.168.43.124.7772: UDP, length 120
01:48:23.385452 IP 192.168.43.124.8880 > 192.168.43.195.7771: UDP, length 120
01:48:23.412766 IP 192.168.43.195.8880 > 192.168.43.124.7772: UDP, length 120
01:48:23.441974 IP 192.168.43.124.8880 > 192.168.43.195.7771: UDP, length 120
01:48:23.462754 IP 192.168.43.195.8880 > 192.168.43.124.7772: UDP, length 120
01:48:23.497783 IP 192.168.43.124.8880 > 192.168.43.195.7771: UDP, length 120
01:48:23.512784 IP 192.168.43.195.8880 > 192.168.43.124.7772: UDP, length 120
01:48:23.534546 IP 192.168.43.124.8880 > 192.168.43.195.7771: UDP, length 120
01:48:23.562810 IP 192.168.43.195.8880 > 192.168.43.124.7772: UDP, length 120
01:48:23.582673 IP 192.168.43.124.8880 > 192.168.43.195.7771: UDP, length 120
01:48:23.612813 IP 192.168.43.195.8880 > 192.168.43.124.7772: UDP, length 120
01:48:23.632530 IP 192.168.43.124.8880 > 192.168.43.195.7771: UDP, length 120
01:48:23.662784 IP 192.168.43.195.8880 > 192.168.43.124.7772: UDP, length 120
01:48:23.686413 IP 192.168.43.124.8880 > 192.168.43.195.7771: UDP, length 120
01:48:23.712797 IP 192.168.43.195.8880 > 192.168.43.124.7772: UDP, length 120
01:48:23.742930 IP 192.168.43.124.8880 > 192.168.43.195.7771: UDP, length 120
01:48:23.762790 IP 192.168.43.195.8880 > 192.168.43.124.7772: UDP, length 120
01:48:23.799576 IP 192.168.43.124.8880 > 192.168.43.195.7771: UDP, length 120
01:48:23.812790 IP 192.168.43.195.8880 > 192.168.43.124.7772: UDP, length 120
01:48:23.837211 IP 192.168.43.124.8880 > 192.168.43.195.7771: UDP, length 120
01:48:23.862780 IP 192.168.43.195.8880 > 192.168.43.124.7772: UDP, length 120
01:48:23.894282 IP 192.168.43.124.8880 > 192.168.43.195.7771: UDP, length 120
01:48:23.912788 IP 192.168.43.195.8880 > 192.168.43.124.7772: UDP, length 120
01:48:23.933749 IP 192.168.43.124.8880 > 192.168.43.195.7771: UDP, length 120
01:48:23.962778 IP 192.168.43.195.8880 > 192.168.43.124.7772: UDP, length 120
01:48:23.982639 IP 192.168.43.124.8880 > 192.168.43.195.7771: UDP, length 120
01:48:24.012792 IP 192.168.43.195.8880 > 192.168.43.124.7772: UDP, length 120
01:48:24.050797 IP 192.168.43.124.8880 > 192.168.43.195.7771: UDP, length 120
01:48:24.062873 IP 192.168.43.195.8880 > 192.168.43.124.7772: UDP, length 120
01:48:24.085213 IP 192.168.43.124.8880 > 192.168.43.195.7771: UDP, length 120
01:48:24.112888 IP 192.168.43.195.8880 > 192.168.43.124.7772: UDP, length 120
01:48:24.134537 IP 192.168.43.124.8880 > 192.168.43.195.7771: UDP, length 120
01:48:24.162834 IP 192.168.43.195.8880 > 192.168.43.124.7772: UDP, length 120
01:48:24.186570 IP 192.168.43.124.8880 > 192.168.43.195.7771: UDP, length 120
01:48:24.212827 IP 192.168.43.195.8880 > 192.168.43.124.7772: UDP, length 120
01:48:24.241459 IP 192.168.43.124.8880 > 192.168.43.195.7771: UDP, length 120
01:48:24.262830 IP 192.168.43.195.8880 > 192.168.43.124.7772: UDP, length 120
01:48:24.282678 IP 192.168.43.124.8880 > 192.168.43.195.7771: UDP, length 120
01:48:24.312849 IP 192.168.43.195.8880 > 192.168.43.124.7772: UDP, length 120
01:48:24.332526 IP 192.168.43.124.8880 > 192.168.43.195.7771: UDP, length 120
01:48:24.362835 IP 192.168.43.195.8880 > 192.168.43.124.7772: UDP, length 120
01:48:24.402044 IP 192.168.43.124.8880 > 192.168.43.195.7771: UDP, length 120
01:48:24.412899 IP 192.168.43.195.8880 > 192.168.43.124.7772: UDP, length 120
01:48:24.433636 IP 192.168.43.124.8880 > 192.168.43.195.7771: UDP, length 120
01:48:24.462841 IP 192.168.43.195.8880 > 192.168.43.124.7772: UDP, length 120
01:48:24.482958 IP 192.168.43.124.8880 > 192.168.43.195.7771: UDP, length 120
01:48:24.512801 IP 192.168.43.195.8880 > 192.168.43.124.7772: UDP, length 120
01:48:24.532555 IP 192.168.43.124.8880 > 192.168.43.195.7771: UDP, length 120
01:48:24.562777 IP 192.168.43.195.8880 > 192.168.43.124.7772: UDP, length 120
01:48:24.582136 IP 192.168.43.124.8880 > 192.168.43.195.7771: UDP, length 120
01:48:24.612760 IP 192.168.43.195.8880 > 192.168.43.124.7772: UDP, length 120
01:48:24.654063 IP 192.168.43.124.8880 > 192.168.43.195.7771: UDP, length 120
01:48:24.662748 IP 192.168.43.195.8880 > 192.168.43.124.7772: UDP, length 120
01:48:24.683145 IP 192.168.43.124.8880 > 192.168.43.195.7771: UDP, length 120
01:48:24.712763 IP 192.168.43.195.8880 > 192.168.43.124.7772: UDP, length 120
01:48:24.732531 IP 192.168.43.124.8880 > 192.168.43.195.7771: UDP, length 120
01:48:24.762791 IP 192.168.43.195.8880 > 192.168.43.124.7772: UDP, length 120
01:48:24.805467 IP 192.168.43.124.8880 > 192.168.43.195.7771: UDP, length 120
01:48:24.812760 IP 192.168.43.195.8880 > 192.168.43.124.7772: UDP, length 120
01:48:24.834856 IP 192.168.43.124.8880 > 192.168.43.195.7771: UDP, length 120
01:48:24.862795 IP 192.168.43.195.8880 > 192.168.43.124.7772: UDP, length 120
01:48:24.882674 IP 192.168.43.124.8880 > 192.168.43.195.7771: UDP, length 120
01:48:24.912772 IP 192.168.43.195.8880 > 192.168.43.124.7772: UDP, length 120
01:48:24.934287 IP 192.168.43.124.8880 > 192.168.43.195.7771: UDP, length 120
01:48:24.962756 IP 192.168.43.195.8880 > 192.168.43.124.7772: UDP, length 120
01:48:25.001832 IP 192.168.43.124.8880 > 192.168.43.195.7771: UDP, length 120
01:48:25.012756 IP 192.168.43.195.8880 > 192.168.43.124.7772: UDP, length 120
01:48:25.062756 IP 192.168.43.195.8880 > 192.168.43.124.7772: UDP, length 120
01:48:25.112753 IP 192.168.43.195.8880 > 192.168.43.124.7772: UDP, length 120
01:48:25.162753 IP 192.168.43.195.8880 > 192.168.43.124.7772: UDP, length 120
01:48:25.183453 IP 192.168.43.124.8880 > 192.168.43.195.7771: UDP, length 120
01:48:25.183581 IP 192.168.43.124.8880 > 192.168.43.195.7771: UDP, length 120
01:48:25.212760 IP 192.168.43.195.8880 > 192.168.43.124.7772: UDP, length 120
01:48:25.262754 IP 192.168.43.195.8880 > 192.168.43.124.7772: UDP, length 120
01:48:25.298108 IP 192.168.43.124.8880 > 192.168.43.195.7771: UDP, length 120
01:48:25.298235 IP 192.168.43.124.8880 > 192.168.43.195.7771: UDP, length 120
01:48:25.298363 IP 192.168.43.124.8880 > 192.168.43.195.7771: UDP, length 120
01:48:25.312755 IP 192.168.43.195.8880 > 192.168.43.124.7772: UDP, length 120
01:48:25.362757 IP 192.168.43.195.8880 > 192.168.43.124.7772: UDP, length 120
01:48:25.412753 IP 192.168.43.195.8880 > 192.168.43.124.7772: UDP, length 120
01:48:25.462753 IP 192.168.43.195.8880 > 192.168.43.124.7772: UDP, length 120
01:48:25.476591 IP 192.168.43.124.8880 > 192.168.43.195.7771: UDP, length 120
01:48:25.477007 IP 192.168.43.124.8880 > 192.168.43.195.7771: UDP, length 120
01:48:25.477129 IP 192.168.43.124.8880 > 192.168.43.195.7771: UDP, length 120
01:48:25.512762 IP 192.168.43.195.8880 > 192.168.43.124.7772: UDP, length 120
01:48:25.562757 IP 192.168.43.195.8880 > 192.168.43.124.7772: UDP, length 120
01:48:25.607114 IP 192.168.43.124.8880 > 192.168.43.195.7771: UDP, length 120
01:48:25.607256 IP 192.168.43.124.8880 > 192.168.43.195.7771: UDP, length 120
01:48:25.607382 IP 192.168.43.124.8880 > 192.168.43.195.7771: UDP, length 120
01:48:25.612757 IP 192.168.43.195.8880 > 192.168.43.124.7772: UDP, length 120
01:48:25.662753 IP 192.168.43.195.8880 > 192.168.43.124.7772: UDP, length 120
01:48:25.712753 IP 192.168.43.195.8880 > 192.168.43.124.7772: UDP, length 120
01:48:25.757052 IP 192.168.43.124.8880 > 192.168.43.195.7771: UDP, length 120
01:48:25.757582 IP 192.168.43.124.8880 > 192.168.43.195.7771: UDP, length 120
01:48:25.757691 IP 192.168.43.124.8880 > 192.168.43.195.7771: UDP, length 120
01:48:25.762765 IP 192.168.43.195.8880 > 192.168.43.124.7772: UDP, length 120
01:48:25.812762 IP 192.168.43.195.8880 > 192.168.43.124.7772: UDP, length 120
01:48:25.862753 IP 192.168.43.195.8880 > 192.168.43.124.7772: UDP, length 120
01:48:25.906655 IP 192.168.43.124.8880 > 192.168.43.195.7771: UDP, length 120
01:48:25.906795 IP 192.168.43.124.8880 > 192.168.43.195.7771: UDP, length 120
01:48:25.906915 IP 192.168.43.124.8880 > 192.168.43.195.7771: UDP, length 120
01:48:25.912759 IP 192.168.43.195.8880 > 192.168.43.124.7772: UDP, length 120
01:48:25.962754 IP 192.168.43.195.8880 > 192.168.43.124.7772: UDP, length 120
01:48:26.012753 IP 192.168.43.195.8880 > 192.168.43.124.7772: UDP, length 120
01:48:26.060229 IP 192.168.43.124.8880 > 192.168.43.195.7771: UDP, length 120
01:48:26.060356 IP 192.168.43.124.8880 > 192.168.43.195.7771: UDP, length 120
01:48:26.060475 IP 192.168.43.124.8880 > 192.168.43.195.7771: UDP, length 120
01:48:26.062753 IP 192.168.43.195.8880 > 192.168.43.124.7772: UDP, length 120
01:48:26.112753 IP 192.168.43.195.8880 > 192.168.43.124.7772: UDP, length 120
01:48:26.162753 IP 192.168.43.195.8880 > 192.168.43.124.7772: UDP, length 120
01:48:26.212754 IP 192.168.43.195.8880 > 192.168.43.124.7772: UDP, length 120
01:48:26.213009 IP 192.168.43.124.8880 > 192.168.43.195.7771: UDP, length 120
01:48:26.213133 IP 192.168.43.124.8880 > 192.168.43.195.7771: UDP, length 120
01:48:26.213251 IP 192.168.43.124.8880 > 192.168.43.195.7771: UDP, length 120
01:48:26.262753 IP 192.168.43.195.8880 > 192.168.43.124.7772: UDP, length 120
01:48:26.312753 IP 192.168.43.195.8880 > 192.168.43.124.7772: UDP, length 120
01:48:26.352136 IP 192.168.43.124.8880 > 192.168.43.195.7771: UDP, length 120
01:48:26.352267 IP 192.168.43.124.8880 > 192.168.43.195.7771: UDP, length 120
01:48:26.362813 IP 192.168.43.195.8880 > 192.168.43.124.7772: UDP, length 120
01:48:26.412777 IP 192.168.43.195.8880 > 192.168.43.124.7772: UDP, length 120
01:48:26.454601 IP 192.168.43.124.8880 > 192.168.43.195.7771: UDP, length 120
01:48:26.454785 IP 192.168.43.124.8880 > 192.168.43.195.7771: UDP, length 120
01:48:26.454906 IP 192.168.43.124.8880 > 192.168.43.195.7771: UDP, length 120
01:48:26.462758 IP 192.168.43.195.8880 > 192.168.43.124.7772: UDP, length 120
01:48:26.512754 IP 192.168.43.195.8880 > 192.168.43.124.7772: UDP, length 120
01:48:26.562756 IP 192.168.43.195.8880 > 192.168.43.124.7772: UDP, length 120
01:48:26.620643 IP 192.168.43.124.8880 > 192.168.43.195.7771: UDP, length 120
01:48:26.620852 IP 192.168.43.124.8880 > 192.168.43.195.7771: UDP, length 120
01:48:26.620973 IP 192.168.43.124.8880 > 192.168.43.195.7771: UDP, length 120
01:48:26.757544 IP 192.168.43.124.8880 > 192.168.43.195.7771: UDP, length 120
01:48:26.757789 IP 192.168.43.124.8880 > 192.168.43.195.7771: UDP, length 120
01:48:26.870883 IP 192.168.43.124.8880 > 192.168.43.195.7771: UDP, length 120
01:48:26.871085 IP 192.168.43.124.8880 > 192.168.43.195.7771: UDP, length 120
01:48:26.871162 IP 192.168.43.124.8880 > 192.168.43.195.7771: UDP, length 120
01:48:26.979728 IP 192.168.43.124.8880 > 192.168.43.195.7771: UDP, length 120
01:48:26.979876 IP 192.168.43.124.8880 > 192.168.43.195.7771: UDP, length 120
01:48:27.121991 IP 192.168.43.124.8880 > 192.168.43.195.7771: UDP, length 120
01:48:27.122145 IP 192.168.43.124.8880 > 192.168.43.195.7771: UDP, length 120
01:48:27.122217 IP 192.168.43.124.8880 > 192.168.43.195.7771: UDP, length 120
01:48:27.292616 IP 192.168.43.124.8880 > 192.168.43.195.7771: UDP, length 120
01:48:27.292757 IP 192.168.43.124.8880 > 192.168.43.195.7771: UDP, length 120
01:48:27.292829 IP 192.168.43.124.8880 > 192.168.43.195.7771: UDP, length 120
01:48:27.414939 IP 192.168.43.124.8880 > 192.168.43.195.7771: UDP, length 120
01:48:27.415075 IP 192.168.43.124.8880 > 192.168.43.195.7771: UDP, length 120
01:48:27.415149 IP 192.168.43.124.8880 > 192.168.43.195.7771: UDP, length 120
01:48:27.599580 IP 192.168.43.124.8880 > 192.168.43.195.7771: UDP, length 120
01:48:27.599727 IP 192.168.43.124.8880 > 192.168.43.195.7771: UDP, length 120
01:48:27.599850 IP 192.168.43.124.8880 > 192.168.43.195.7771: UDP, length 120
01:48:27.719700 IP 192.168.43.124.8880 > 192.168.43.195.7771: UDP, length 120
01:48:27.719825 IP 192.168.43.124.8880 > 192.168.43.195.7771: UDP, length 120
01:48:27.719951 IP 192.168.43.124.8880 > 192.168.43.195.7771: UDP, length 120
01:48:27.833659 IP 192.168.43.124.8880 > 192.168.43.195.7771: UDP, length 120
01:48:27.833786 IP 192.168.43.124.8880 > 192.168.43.195.7771: UDP, length 120
01:48:27.833906 IP 192.168.43.124.8880 > 192.168.43.195.7771: UDP, length 120
01:48:27.882719 IP 192.168.43.124.8880 > 192.168.43.195.7771: UDP, length 120
01:48:27.942654 IP 192.168.43.124.8880 > 192.168.43.195.7771: UDP, length 120
01:48:27.983239 IP 192.168.43.124.8880 > 192.168.43.195.7771: UDP, length 120
01:48:28.042523 IP 192.168.43.124.8880 > 192.168.43.195.7771: UDP, length 120
01:48:28.083347 IP 192.168.43.124.8880 > 192.168.43.195.7771: UDP, length 120
01:48:28.142796 IP 192.168.43.124.8880 > 192.168.43.195.7771: UDP, length 120
01:48:28.185446 IP 192.168.43.124.8880 > 192.168.43.195.7771: UDP, length 120
01:48:28.244260 IP 192.168.43.124.8880 > 192.168.43.195.7771: UDP, length 120
01:48:28.283170 IP 192.168.43.124.8880 > 192.168.43.195.7771: UDP, length 120
01:48:28.332714 IP 192.168.43.124.8880 > 192.168.43.195.7771: UDP, length 120
01:48:28.385347 IP 192.168.43.124.8880 > 192.168.43.195.7771: UDP, length 120
01:48:28.434387 IP 192.168.43.124.8880 > 192.168.43.195.7771: UDP, length 120
01:48:28.492830 IP 192.168.43.124.8880 > 192.168.43.195.7771: UDP, length 120
01:48:28.532760 IP 192.168.43.124.8880 > 192.168.43.195.7771: UDP, length 120
01:48:28.592557 IP 192.168.43.124.8880 > 192.168.43.195.7771: UDP, length 120
01:48:28.633171 IP 192.168.43.124.8880 > 192.168.43.195.7771: UDP, length 120
01:48:28.692870 IP 192.168.43.124.8880 > 192.168.43.195.7771: UDP, length 120
01:48:28.733146 IP 192.168.43.124.8880 > 192.168.43.195.7771: UDP, length 120
01:48:28.796205 IP 192.168.43.124.8880 > 192.168.43.195.7771: UDP, length 120
01:48:28.834365 IP 192.168.43.124.8880 > 192.168.43.195.7771: UDP, length 120
01:48:28.902967 IP 192.168.43.124.8880 > 192.168.43.195.7771: UDP, length 120
01:48:28.933776 IP 192.168.43.124.8880 > 192.168.43.195.7771: UDP, length 120
01:48:28.992811 IP 192.168.43.124.8880 > 192.168.43.195.7771: UDP, length 120
01:48:29.032772 IP 192.168.43.124.8880 > 192.168.43.195.7771: UDP, length 120
01:48:29.094473 IP 192.168.43.124.8880 > 192.168.43.195.7771: UDP, length 120
01:48:29.132752 IP 192.168.43.124.8880 > 192.168.43.195.7771: UDP, length 120
01:48:29.193227 IP 192.168.43.124.8880 > 192.168.43.195.7771: UDP, length 120
01:48:29.235487 IP 192.168.43.124.8880 > 192.168.43.195.7771: UDP, length 120
01:48:29.292800 IP 192.168.43.124.8880 > 192.168.43.195.7771: UDP, length 120
01:48:29.333890 IP 192.168.43.124.8880 > 192.168.43.195.7771: UDP, length 120
01:48:29.391728 IP 192.168.43.124.8880 > 192.168.43.195.7771: UDP, length 120
01:48:29.432012 IP 192.168.43.124.8880 > 192.168.43.195.7771: UDP, length 120
01:48:29.492551 IP 192.168.43.124.8880 > 192.168.43.195.7771: UDP, length 120
01:48:29.532976 IP 192.168.43.124.8880 > 192.168.43.195.7771: UDP, length 120
01:48:29.593008 IP 192.168.43.124.8880 > 192.168.43.195.7771: UDP, length 120
01:48:29.632772 IP 192.168.43.124.8880 > 192.168.43.195.7771: UDP, length 120
01:48:29.694717 IP 192.168.43.124.8880 > 192.168.43.195.7771: UDP, length 120
01:48:29.733478 IP 192.168.43.124.8880 > 192.168.43.195.7771: UDP, length 120
01:48:29.793497 IP 192.168.43.124.8880 > 192.168.43.195.7771: UDP, length 120
01:48:29.834205 IP 192.168.43.124.8880 > 192.168.43.195.7771: UDP, length 120
