02:29:13.748609 IP 192.168.43.147.8880 > 192.168.43.124.7773: UDP, length 120
02:29:13.798651 IP 192.168.43.147.8880 > 192.168.43.124.7773: UDP, length 120
02:29:13.827400 IP 192.168.43.146.8880 > 192.168.43.147.7772: UDP, length 120
02:29:13.848675 IP 192.168.43.147.8880 > 192.168.43.124.7773: UDP, length 120
02:29:13.888594 IP 192.168.43.146.8880 > 192.168.43.147.7772: UDP, length 120
02:29:13.898641 IP 192.168.43.147.8880 > 192.168.43.124.7773: UDP, length 120
02:29:13.924302 IP 192.168.43.146.8880 > 192.168.43.147.7772: UDP, length 120
02:29:13.948632 IP 192.168.43.147.8880 > 192.168.43.124.7773: UDP, length 120
02:29:13.971418 IP 192.168.43.146.8880 > 192.168.43.147.7772: UDP, length 120
02:29:13.998633 IP 192.168.43.147.8880 > 192.168.43.124.7773: UDP, length 120
02:29:14.028926 IP 192.168.43.146.8880 > 192.168.43.147.7772: UDP, length 120
02:29:14.048630 IP 192.168.43.147.8880 > 192.168.43.124.7773: UDP, length 120
02:29:14.065324 IP 192.168.43.146.8880 > 192.168.43.147.7772: UDP, length 120
02:29:14.098628 IP 192.168.43.147.8880 > 192.168.43.124.7773: UDP, length 120
02:29:14.131201 IP 192.168.43.146.8880 > 192.168.43.147.7772: UDP, length 120
02:29:14.148628 IP 192.168.43.147.8880 > 192.168.43.124.7773: UDP, length 120
02:29:14.167050 IP 192.168.43.146.8880 > 192.168.43.147.7772: UDP, length 120
02:29:14.198629 IP 192.168.43.147.8880 > 192.168.43.124.7773: UDP, length 120
02:29:14.221283 IP 192.168.43.146.8880 > 192.168.43.147.7772: UDP, length 120
02:29:14.248628 IP 192.168.43.147.8880 > 192.168.43.124.7773: UDP, length 120
02:29:14.290054 IP 192.168.43.146.8880 > 192.168.43.147.7772: UDP, length 120
02:29:14.298631 IP 192.168.43.147.8880 > 192.168.43.124.7773: UDP, length 120
02:29:14.340095 IP 192.168.43.146.8880 > 192.168.43.147.7772: UDP, length 120
02:29:14.348630 IP 192.168.43.147.8880 > 192.168.43.124.7773: UDP, length 120
02:29:14.371218 IP 192.168.43.146.8880 > 192.168.43.147.7772: UDP, length 120
02:29:14.398628 IP 192.168.43.147.8880 > 192.168.43.124.7773: UDP, length 120
02:29:14.416925 IP 192.168.43.146.8880 > 192.168.43.147.7772: UDP, length 120
02:29:14.448628 IP 192.168.43.147.8880 > 192.168.43.124.7773: UDP, length 120
02:29:14.467552 IP 192.168.43.146.8880 > 192.168.43.147.7772: UDP, length 120
02:29:14.498629 IP 192.168.43.147.8880 > 192.168.43.124.7773: UDP, length 120
02:29:14.511882 IP 192.168.43.146.8880 > 192.168.43.147.7772: UDP, length 120
02:29:14.548629 IP 192.168.43.147.8880 > 192.168.43.124.7773: UDP, length 120
02:29:14.576550 IP 192.168.43.146.8880 > 192.168.43.147.7772: UDP, length 120
02:29:14.598633 IP 192.168.43.147.8880 > 192.168.43.124.7773: UDP, length 120
02:29:14.648628 IP 192.168.43.147.8880 > 192.168.43.124.7773: UDP, length 120
02:29:14.654869 IP 192.168.43.146.8880 > 192.168.43.147.7772: UDP, length 120
02:29:14.675820 IP 192.168.43.146.8880 > 192.168.43.147.7772: UDP, length 120
02:29:14.698632 IP 192.168.43.147.8880 > 192.168.43.124.7773: UDP, length 120
02:29:14.743795 IP 192.168.43.146.8880 > 192.168.43.147.7772: UDP, length 120
02:29:14.748630 IP 192.168.43.147.8880 > 192.168.43.124.7773: UDP, length 120
02:29:14.770683 IP 192.168.43.146.8880 > 192.168.43.147.7772: UDP, length 120
02:29:14.798629 IP 192.168.43.147.8880 > 192.168.43.124.7773: UDP, length 120
02:29:14.847935 IP 192.168.43.146.8880 > 192.168.43.147.7772: UDP, length 120
02:29:14.848639 IP 192.168.43.147.8880 > 192.168.43.124.7773: UDP, length 120
02:29:14.890347 IP 192.168.43.146.8880 > 192.168.43.147.7772: UDP, length 120
02:29:14.898648 IP 192.168.43.147.8880 > 192.168.43.124.7773: UDP, length 120
02:29:14.932675 IP 192.168.43.146.8880 > 192.168.43.147.7772: UDP, length 120
02:29:14.948652 IP 192.168.43.147.8880 > 192.168.43.124.7773: UDP, length 120
02:29:14.966177 IP 192.168.43.146.8880 > 192.168.43.147.7772: UDP, length 120
02:29:14.998633 IP 192.168.43.147.8880 > 192.168.43.124.7773: UDP, length 120
02:29:15.011730 IP 192.168.43.146.8880 > 192.168.43.147.7772: UDP, length 120
02:29:15.048633 IP 192.168.43.147.8880 > 192.168.43.124.7773: UDP, length 120
02:29:15.064134 IP 192.168.43.146.8880 > 192.168.43.147.7772: UDP, length 120
02:29:15.098631 IP 192.168.43.147.8880 > 192.168.43.124.7773: UDP, length 120
02:29:15.135875 IP 192.168.43.146.8880 > 192.168.43.147.7772: UDP, length 120
02:29:15.148667 IP 192.168.43.147.8880 > 192.168.43.124.7773: UDP, length 120
02:29:15.161900 IP 192.168.43.146.8880 > 192.168.43.147.7772: UDP, length 120
02:29:15.198730 IP 192.168.43.147.8880 > 192.168.43.124.7773: UDP, length 120
02:29:15.215767 IP 192.168.43.146.8880 > 192.168.43.147.7772: UDP, length 120
02:29:15.248732 IP 192.168.43.147.8880 > 192.168.43.124.7773: UDP, length 120
02:29:15.287523 IP 192.168.43.146.8880 > 192.168.43.147.7772: UDP, length 120
02:29:15.298683 IP 192.168.43.147.8880 > 192.168.43.124.7773: UDP, length 120
02:29:15.311693 IP 192.168.43.146.8880 > 192.168.43.147.7772: UDP, length 120
02:29:15.348682 IP 192.168.43.147.8880 > 192.168.43.124.7773: UDP, length 120
02:29:15.373183 IP 192.168.43.146.8880 > 192.168.43.147.7772: UDP, length 120
02:29:15.398684 IP 192.168.43.147.8880 > 192.168.43.124.7773: UDP, length 120
02:29:15.416034 IP 192.168.43.146.8880 > 192.168.43.147.7772: UDP, length 120
02:29:15.448688 IP 192.168.43.147.8880 > 192.168.43.124.7773: UDP, length 120
02:29:15.473432 IP 192.168.43.146.8880 > 192.168.43.147.7772: UDP, length 120
02:29:15.498672 IP 192.168.43.147.8880 > 192.168.43.124.7773: UDP, length 120
02:29:15.510852 IP 192.168.43.146.8880 > 192.168.43.147.7772: UDP, length 120
02:29:15.548685 IP 192.168.43.147.8880 > 192.168.43.124.7773: UDP, length 120
02:29:15.566185 IP 192.168.43.146.8880 > 192.168.43.147.7772: UDP, length 120
02:29:15.598663 IP 192.168.43.147.8880 > 192.168.43.124.7773: UDP, length 120
02:29:15.611177 IP 192.168.43.146.8880 > 192.168.43.147.7772: UDP, length 120
02:29:15.648648 IP 192.168.43.147.8880 > 192.168.43.124.7773: UDP, length 120
02:29:15.661480 IP 192.168.43.146.8880 > 192.168.43.147.7772: UDP, length 120
02:29:15.698612 IP 192.168.43.147.8880 > 192.168.43.124.7773: UDP, length 120
02:29:15.713912 IP 192.168.43.146.8880 > 192.168.43.147.7772: UDP, length 120
02:29:15.748607 IP 192.168.43.147.8880 > 192.168.43.124.7773: UDP, length 120
02:29:15.785593 IP 192.168.43.146.8880 > 192.168.43.147.7772: UDP, length 120
02:29:15.798607 IP 192.168.43.147.8880 > 192.168.43.124.7773: UDP, length 120
02:29:15.812609 IP 192.168.43.146.8880 > 192.168.43.147.7772: UDP, length 120
02:29:15.848611 IP 192.168.43.147.8880 > 192.168.43.124.7773: UDP, length 120
02:29:15.870599 IP 192.168.43.146.8880 > 192.168.43.147.7772: UDP, length 120
02:29:15.898607 IP 192.168.43.147.8880 > 192.168.43.124.7773: UDP, length 120
02:29:15.948602 IP 192.168.43.147.8880 > 192.168.43.124.7773: UDP, length 120
02:29:15.970557 IP 192.168.43.146.8880 > 192.168.43.147.7772: UDP, length 120
02:29:15.970644 IP 192.168.43.146.8880 > 192.168.43.147.7772: UDP, length 120
02:29:15.998614 IP 192.168.43.147.8880 > 192.168.43.124.7773: UDP, length 120
02:29:16.013369 IP 192.168.43.146.8880 > 192.168.43.147.7772: UDP, length 120
02:29:16.048607 IP 192.168.43.147.8880 > 192.168.43.124.7773: UDP, length 120
02:29:16.063973 IP 192.168.43.146.8880 > 192.168.43.147.7772: UDP, length 120
02:29:16.098604 IP 192.168.43.147.8880 > 192.168.43.124.7773: UDP, length 120
02:29:16.135023 IP 192.168.43.146.8880 > 192.168.43.147.7772: UDP, length 120
02:29:16.148603 IP 192.168.43.147.8880 > 192.168.43.124.7773: UDP, length 120
02:29:16.162264 IP 192.168.43.146.8880 > 192.168.43.147.7772: UDP, length 120
02:29:16.198603 IP 192.168.43.147.8880 > 192.168.43.124.7773: UDP, length 120
02:29:16.215940 IP 192.168.43.146.8880 > 192.168.43.147.7772: UDP, length 120
02:29:16.248603 IP 192.168.43.147.8880 > 192.168.43.124.7773: UDP, length 120
02:29:16.286875 IP 192.168.43.146.8880 > 192.168.43.147.7772: UDP, length 120
02:29:16.298604 IP 192.168.43.147.8880 > 192.168.43.124.7773: UDP, length 120
02:29:16.348600 IP 192.168.43.147.8880 > 192.168.43.124.7773: UDP, length 120
02:29:16.353425 IP 192.168.43.146.8880 > 192.168.43.147.7772: UDP, length 120
02:29:16.363382 IP 192.168.43.146.8880 > 192.168.43.147.7772: UDP, length 120
02:29:16.398611 IP 192.168.43.147.8880 > 192.168.43.124.7773: UDP, length 120
02:29:16.428435 IP 192.168.43.146.8880 > 192.168.43.147.7772: UDP, length 120
02:29:16.448605 IP 192.168.43.147.8880 > 192.168.43.124.7773: UDP, length 120
02:29:16.466149 IP 192.168.43.146.8880 > 192.168.43.147.7772: UDP, length 120
02:29:16.498601 IP 192.168.43.147.8880 > 192.168.43.124.7773: UDP, length 120
02:29:16.514095 IP 192.168.43.146.8880 > 192.168.43.147.7772: UDP, length 120
02:29:16.548603 IP 192.168.43.147.8880 > 192.168.43.124.7773: UDP, length 120
02:29:16.585891 IP 192.168.43.146.8880 > 192.168.43.147.7772: UDP, length 120
02:29:16.598603 IP 192.168.43.147.8880 > 192.168.43.124.7773: UDP, length 120
02:29:16.612022 IP 192.168.43.146.8880 > 192.168.43.147.7772: UDP, length 120
02:29:16.648640 IP 192.168.43.147.8880 > 192.168.43.124.7773: UDP, length 120
02:29:16.665066 IP 192.168.43.146.8880 > 192.168.43.147.7772: UDP, length 120
02:29:16.698607 IP 192.168.43.147.8880 > 192.168.43.124.7773: UDP, length 120
02:29:16.711783 IP 192.168.43.146.8880 > 192.168.43.147.7772: UDP, length 120
02:29:16.748604 IP 192.168.43.147.8880 > 192.168.43.124.7773: UDP, length 120
02:29:16.763562 IP 192.168.43.146.8880 > 192.168.43.147.7772: UDP, length 120
02:29:16.798601 IP 192.168.43.147.8880 > 192.168.43.124.7773: UDP, length 120
02:29:16.835547 IP 192.168.43.146.8880 > 192.168.43.147.7772: UDP, length 120
02:29:16.848609 IP 192.168.43.147.8880 > 192.168.43.124.7773: UDP, length 120
02:29:16.865480 IP 192.168.43.146.8880 > 192.168.43.147.7772: UDP, length 120
02:29:16.898632 IP 192.168.43.147.8880 > 192.168.43.124.7773: UDP, length 120
02:29:16.914394 IP 192.168.43.146.8880 > 192.168.43.147.7772: UDP, length 120
02:29:16.948631 IP 192.168.43.147.8880 > 192.168.43.124.7773: UDP, length 120
02:29:16.985750 IP 192.168.43.146.8880 > 192.168.43.147.7772: UDP, length 120
02:29:16.998636 IP 192.168.43.147.8880 > 192.168.43.124.7773: UDP, length 120
02:29:17.012905 IP 192.168.43.146.8880 > 192.168.43.147.7772: UDP, length 120
02:29:17.048648 IP 192.168.43.147.8880 > 192.168.43.124.7773: UDP, length 120
02:29:17.064924 IP 192.168.43.146.8880 > 192.168.43.147.7772: UDP, length 120
02:29:17.098633 IP 192.168.43.147.8880 > 192.168.43.124.7773: UDP, length 120
02:29:17.137051 IP 192.168.43.146.8880 > 192.168.43.147.7772: UDP, length 120
02:29:17.148630 IP 192.168.43.147.8880 > 192.168.43.124.7773: UDP, length 120
02:29:17.167132 IP 192.168.43.146.8880 > 192.168.43.147.7772: UDP, length 120
02:29:17.198630 IP 192.168.43.147.8880 > 192.168.43.124.7773: UDP, length 120
02:29:17.214047 IP 192.168.43.146.8880 > 192.168.43.147.7772: UDP, length 120
02:29:17.248631 IP 192.168.43.147.8880 > 192.168.43.124.7773: UDP, length 120
02:29:17.285391 IP 192.168.43.146.8880 > 192.168.43.147.7772: UDP, length 120
02:29:17.298629 IP 192.168.43.147.8880 > 192.168.43.124.7773: UDP, length 120
02:29:17.312928 IP 192.168.43.146.8880 > 192.168.43.147.7772: UDP, length 120
02:29:17.348630 IP 192.168.43.147.8880 > 192.168.43.124.7773: UDP, length 120
02:29:17.364883 IP 192.168.43.146.8880 > 192.168.43.147.7772: UDP, length 120
02:29:17.398628 IP 192.168.43.147.8880 > 192.168.43.124.7773: UDP, length 120
02:29:17.436513 IP 192.168.43.146.8880 > 192.168.43.147.7772: UDP, length 120
02:29:17.448629 IP 192.168.43.147.8880 > 192.168.43.124.7773: UDP, length 120
02:29:17.462116 IP 192.168.43.146.8880 > 192.168.43.147.7772: UDP, length 120
02:29:17.498626 IP 192.168.43.147.8880 > 192.168.43.124.7773: UDP, length 120
02:29:17.514315 IP 192.168.43.146.8880 > 192.168.43.147.7772: UDP, length 120
02:29:17.548630 IP 192.168.43.147.8880 > 192.168.43.124.7773: UDP, length 120
02:29:17.561858 IP 192.168.43.146.8880 > 192.168.43.147.7772: UDP, length 120
02:29:17.598681 IP 192.168.43.147.8880 > 192.168.43.124.7773: UDP, length 120
02:29:17.614268 IP 192.168.43.146.8880 > 192.168.43.147.7772: UDP, length 120
02:29:17.648634 IP 192.168.43.147.8880 > 192.168.43.124.7773: UDP, length 120
02:29:17.681649 IP 192.168.43.146.8880 > 192.168.43.147.7772: UDP, length 120
02:29:17.698628 IP 192.168.43.147.8880 > 192.168.43.124.7773: UDP, length 120
02:29:17.712860 IP 192.168.43.146.8880 > 192.168.43.147.7772: UDP, length 120
02:29:17.748636 IP 192.168.43.147.8880 > 192.168.43.124.7773: UDP, length 120
02:29:17.772423 IP 192.168.43.146.8880 > 192.168.43.147.7772: UDP, length 120
02:29:17.798628 IP 192.168.43.147.8880 > 192.168.43.124.7773: UDP, length 120
02:29:17.812233 IP 192.168.43.146.8880 > 192.168.43.147.7772: UDP, length 120
02:29:17.848639 IP 192.168.43.147.8880 > 192.168.43.124.7773: UDP, length 120
02:29:17.876262 IP 192.168.43.146.8880 > 192.168.43.147.7772: UDP, length 120
02:29:17.898632 IP 192.168.43.147.8880 > 192.168.43.124.7773: UDP, length 120
02:29:17.923545 IP 192.168.43.146.8880 > 192.168.43.147.7772: UDP, length 120
02:29:17.948630 IP 192.168.43.147.8880 > 192.168.43.124.7773: UDP, length 120
02:29:17.963732 IP 192.168.43.146.8880 > 192.168.43.147.7772: UDP, length 120
02:29:17.998628 IP 192.168.43.147.8880 > 192.168.43.124.7773: UDP, length 120
02:29:18.021884 IP 192.168.43.146.8880 > 192.168.43.147.7772: UDP, length 120
02:29:18.048637 IP 192.168.43.147.8880 > 192.168.43.124.7773: UDP, length 120
02:29:18.065606 IP 192.168.43.146.8880 > 192.168.43.147.7772: UDP, length 120
02:29:18.098632 IP 192.168.43.147.8880 > 192.168.43.124.7773: UDP, length 120
02:29:18.124140 IP 192.168.43.146.8880 > 192.168.43.147.7772: UDP, length 120
02:29:18.148674 IP 192.168.43.147.8880 > 192.168.43.124.7773: UDP, length 120
02:29:18.165864 IP 192.168.43.146.8880 > 192.168.43.147.7772: UDP, length 120
02:29:18.198633 IP 192.168.43.147.8880 > 192.168.43.124.7773: UDP, length 120
02:29:18.225437 IP 192.168.43.146.8880 > 192.168.43.147.7772: UDP, length 120
02:29:18.248633 IP 192.168.43.147.8880 > 192.168.43.124.7773: UDP, length 120
02:29:18.271477 IP 192.168.43.146.8880 > 192.168.43.147.7772: UDP, length 120
02:29:18.298632 IP 192.168.43.147.8880 > 192.168.43.124.7773: UDP, length 120
02:29:18.325115 IP 192.168.43.146.8880 > 192.168.43.147.7772: UDP, length 120
02:29:18.348634 IP 192.168.43.147.8880 > 192.168.43.124.7773: UDP, length 120
02:29:18.376041 IP 192.168.43.146.8880 > 192.168.43.147.7772: UDP, length 120
02:29:18.398631 IP 192.168.43.147.8880 > 192.168.43.124.7773: UDP, length 120
02:29:18.435420 IP 192.168.43.146.8880 > 192.168.43.147.7772: UDP, length 120
02:29:18.448631 IP 192.168.43.147.8880 > 192.168.43.124.7773: UDP, length 120
02:29:18.498627 IP 192.168.43.147.8880 > 192.168.43.124.7773: UDP, length 120
02:29:18.511692 IP 192.168.43.146.8880 > 192.168.43.147.7772: UDP, length 120
02:29:18.517365 IP 192.168.43.146.8880 > 192.168.43.147.7772: UDP, length 120
02:29:18.548633 IP 192.168.43.147.8880 > 192.168.43.124.7773: UDP, length 120
02:29:18.579365 IP 192.168.43.146.8880 > 192.168.43.147.7772: UDP, length 120
02:29:18.598631 IP 192.168.43.147.8880 > 192.168.43.124.7773: UDP, length 120
02:29:18.622162 IP 192.168.43.146.8880 > 192.168.43.147.7772: UDP, length 120
02:29:18.648634 IP 192.168.43.147.8880 > 192.168.43.124.7773: UDP, length 120
02:29:18.673412 IP 192.168.43.146.8880 > 192.168.43.147.7772: UDP, length 120
02:29:18.698629 IP 192.168.43.147.8880 > 192.168.43.124.7773: UDP, length 120
02:29:18.722447 IP 192.168.43.146.8880 > 192.168.43.147.7772: UDP, length 120
02:29:18.748631 IP 192.168.43.147.8880 > 192.168.43.124.7773: UDP, length 120
02:29:18.774136 IP 192.168.43.146.8880 > 192.168.43.147.7772: UDP, length 120
02:29:18.798629 IP 192.168.43.147.8880 > 192.168.43.124.7773: UDP, length 120
02:29:18.824505 IP 192.168.43.146.8880 > 192.168.43.147.7772: UDP, length 120
02:29:18.848639 IP 192.168.43.147.8880 > 192.168.43.124.7773: UDP, length 120
02:29:18.876214 IP 192.168.43.146.8880 > 192.168.43.147.7772: UDP, length 120
02:29:18.898634 IP 192.168.43.147.8880 > 192.168.43.124.7773: UDP, length 120
02:29:18.926423 IP 192.168.43.146.8880 > 192.168.43.147.7772: UDP, length 120
02:29:18.948632 IP 192.168.43.147.8880 > 192.168.43.124.7773: UDP, length 120
02:29:18.978216 IP 192.168.43.146.8880 > 192.168.43.147.7772: UDP, length 120
02:29:18.998630 IP 192.168.43.147.8880 > 192.168.43.124.7773: UDP, length 120
02:29:19.029976 IP 192.168.43.146.8880 > 192.168.43.147.7772: UDP, length 120
02:29:19.048632 IP 192.168.43.147.8880 > 192.168.43.124.7773: UDP, length 120
02:29:19.080771 IP 192.168.43.146.8880 > 192.168.43.147.7772: UDP, length 120
02:29:19.098630 IP 192.168.43.147.8880 > 192.168.43.124.7773: UDP, length 120
02:29:19.125140 IP 192.168.43.146.8880 > 192.168.43.147.7772: UDP, length 120
02:29:19.148643 IP 192.168.43.147.8880 > 192.168.43.124.7773: UDP, length 120
02:29:19.177366 IP 192.168.43.146.8880 > 192.168.43.147.7772: UDP, length 120
02:29:19.198635 IP 192.168.43.147.8880 > 192.168.43.124.7773: UDP, length 120
02:29:19.234154 IP 192.168.43.146.8880 > 192.168.43.147.7772: UDP, length 120
02:29:19.248633 IP 192.168.43.147.8880 > 192.168.43.124.7773: UDP, length 120
02:29:19.284952 IP 192.168.43.146.8880 > 192.168.43.147.7772: UDP, length 120
02:29:19.298631 IP 192.168.43.147.8880 > 192.168.43.124.7773: UDP, length 120
02:29:19.336231 IP 192.168.43.146.8880 > 192.168.43.147.7772: UDP, length 120
02:29:19.348632 IP 192.168.43.147.8880 > 192.168.43.124.7773: UDP, length 120
02:29:19.390014 IP 192.168.43.146.8880 > 192.168.43.147.7772: UDP, length 120
02:29:19.398630 IP 192.168.43.147.8880 > 192.168.43.124.7773: UDP, length 120
02:29:19.415924 IP 192.168.43.146.8880 > 192.168.43.147.7772: UDP, length 120
02:29:19.448631 IP 192.168.43.147.8880 > 192.168.43.124.7773: UDP, length 120
02:29:19.466105 IP 192.168.43.146.8880 > 192.168.43.147.7772: UDP, length 120
02:29:19.498646 IP 192.168.43.147.8880 > 192.168.43.124.7773: UDP, length 120
02:29:19.541320 IP 192.168.43.146.8880 > 192.168.43.147.7772: UDP, length 120
02:29:19.548632 IP 192.168.43.147.8880 > 192.168.43.124.7773: UDP, length 120
02:29:19.571545 IP 192.168.43.146.8880 > 192.168.43.147.7772: UDP, length 120
02:29:19.598629 IP 192.168.43.147.8880 > 192.168.43.124.7773: UDP, length 120
02:29:19.638532 IP 192.168.43.146.8880 > 192.168.43.147.7772: UDP, length 120
02:29:19.648670 IP 192.168.43.147.8880 > 192.168.43.124.7773: UDP, length 120
02:29:19.698627 IP 192.168.43.147.8880 > 192.168.43.124.7773: UDP, length 120
02:29:19.748627 IP 192.168.43.147.8880 > 192.168.43.124.7773: UDP, length 120
02:29:19.798625 IP 192.168.43.147.8880 > 192.168.43.124.7773: UDP, length 120
02:29:19.848631 IP 192.168.43.147.8880 > 192.168.43.124.7773: UDP, length 120
02:29:19.863382 IP 192.168.43.146.8880 > 192.168.43.147.7772: UDP, length 120
02:29:19.866646 IP 192.168.43.146.8880 > 192.168.43.147.7772: UDP, length 120
02:29:19.866895 IP 192.168.43.146.8880 > 192.168.43.147.7772: UDP, length 120
02:29:19.867005 IP 192.168.43.146.8880 > 192.168.43.147.7772: UDP, length 120
02:29:19.867114 IP 192.168.43.146.8880 > 192.168.43.147.7772: UDP, length 120
02:29:19.898637 IP 192.168.43.147.8880 > 192.168.43.124.7773: UDP, length 120
02:29:19.925393 IP 192.168.43.146.8880 > 192.168.43.147.7772: UDP, length 120
02:29:19.948634 IP 192.168.43.147.8880 > 192.168.43.124.7773: UDP, length 120
02:29:19.971262 IP 192.168.43.146.8880 > 192.168.43.147.7772: UDP, length 120
02:29:19.998632 IP 192.168.43.147.8880 > 192.168.43.124.7773: UDP, length 120
02:29:20.011896 IP 192.168.43.146.8880 > 192.168.43.147.7772: UDP, length 120
02:29:20.048635 IP 192.168.43.147.8880 > 192.168.43.124.7773: UDP, length 120
02:29:20.067291 IP 192.168.43.146.8880 > 192.168.43.147.7772: UDP, length 120
02:29:20.098630 IP 192.168.43.147.8880 > 192.168.43.124.7773: UDP, length 120
02:29:20.129085 IP 192.168.43.146.8880 > 192.168.43.147.7772: UDP, length 120
02:29:20.148630 IP 192.168.43.147.8880 > 192.168.43.124.7773: UDP, length 120
02:29:20.176101 IP 192.168.43.146.8880 > 192.168.43.147.7772: UDP, length 120
02:29:20.198636 IP 192.168.43.147.8880 > 192.168.43.124.7773: UDP, length 120
02:29:20.215638 IP 192.168.43.146.8880 > 192.168.43.147.7772: UDP, length 120
02:29:20.248637 IP 192.168.43.147.8880 > 192.168.43.124.7773: UDP, length 120
02:29:20.274286 IP 192.168.43.146.8880 > 192.168.43.147.7772: UDP, length 120
02:29:20.298630 IP 192.168.43.147.8880 > 192.168.43.124.7773: UDP, length 120
02:29:20.317485 IP 192.168.43.146.8880 > 192.168.43.147.7772: UDP, length 120
02:29:20.348631 IP 192.168.43.147.8880 > 192.168.43.124.7773: UDP, length 120
02:29:20.367437 IP 192.168.43.146.8880 > 192.168.43.147.7772: UDP, length 120
02:29:20.398628 IP 192.168.43.147.8880 > 192.168.43.124.7773: UDP, length 120
02:29:20.414928 IP 192.168.43.146.8880 > 192.168.43.147.7772: UDP, length 120
02:29:20.448629 IP 192.168.43.147.8880 > 192.168.43.124.7773: UDP, length 120
02:29:20.462063 IP 192.168.43.146.8880 > 192.168.43.147.7772: UDP, length 120
02:29:20.498633 IP 192.168.43.147.8880 > 192.168.43.124.7773: UDP, length 120
02:29:20.514589 IP 192.168.43.146.8880 > 192.168.43.147.7772: UDP, length 120
02:29:20.548628 IP 192.168.43.147.8880 > 192.168.43.124.7773: UDP, length 120
02:29:20.563068 IP 192.168.43.146.8880 > 192.168.43.147.7772: UDP, length 120
02:29:20.598626 IP 192.168.43.147.8880 > 192.168.43.124.7773: UDP, length 120
02:29:20.634672 IP 192.168.43.146.8880 > 192.168.43.147.7772: UDP, length 120
02:29:20.648706 IP 192.168.43.147.8880 > 192.168.43.124.7773: UDP, length 120
02:29:20.663022 IP 192.168.43.146.8880 > 192.168.43.147.7772: UDP, length 120
02:29:20.698717 IP 192.168.43.147.8880 > 192.168.43.124.7773: UDP, length 120
02:29:20.712909 IP 192.168.43.146.8880 > 192.168.43.147.7772: UDP, length 120
02:29:20.748721 IP 192.168.43.147.8880 > 192.168.43.124.7773: UDP, length 120
02:29:20.765560 IP 192.168.43.146.8880 > 192.168.43.147.7772: UDP, length 120
02:29:20.798677 IP 192.168.43.147.8880 > 192.168.43.124.7773: UDP, length 120
02:29:20.834603 IP 192.168.43.146.8880 > 192.168.43.147.7772: UDP, length 120
02:29:20.848702 IP 192.168.43.147.8880 > 192.168.43.124.7773: UDP, length 120
02:29:20.867302 IP 192.168.43.146.8880 > 192.168.43.147.7772: UDP, length 120
02:29:20.898712 IP 192.168.43.147.8880 > 192.168.43.124.7773: UDP, length 120
02:29:20.915868 IP 192.168.43.146.8880 > 192.168.43.147.7772: UDP, length 120
02:29:20.948665 IP 192.168.43.147.8880 > 192.168.43.124.7773: UDP, length 120
02:29:20.985890 IP 192.168.43.146.8880 > 192.168.43.147.7772: UDP, length 120
02:29:20.998697 IP 192.168.43.147.8880 > 192.168.43.124.7773: UDP, length 120
02:29:21.012753 IP 192.168.43.146.8880 > 192.168.43.147.7772: UDP, length 120
02:29:21.048716 IP 192.168.43.147.8880 > 192.168.43.124.7773: UDP, length 120
02:29:21.070792 IP 192.168.43.146.8880 > 192.168.43.147.7772: UDP, length 120
02:29:21.098695 IP 192.168.43.147.8880 > 192.168.43.124.7773: UDP, length 120
02:29:21.111184 IP 192.168.43.146.8880 > 192.168.43.147.7772: UDP, length 120
02:29:21.148647 IP 192.168.43.147.8880 > 192.168.43.124.7773: UDP, length 120
02:29:21.166149 IP 192.168.43.146.8880 > 192.168.43.147.7772: UDP, length 120
02:29:21.198609 IP 192.168.43.147.8880 > 192.168.43.124.7773: UDP, length 120
02:29:21.235973 IP 192.168.43.146.8880 > 192.168.43.147.7772: UDP, length 120
02:29:21.248612 IP 192.168.43.147.8880 > 192.168.43.124.7773: UDP, length 120
02:29:21.263121 IP 192.168.43.146.8880 > 192.168.43.147.7772: UDP, length 120
02:29:21.298620 IP 192.168.43.147.8880 > 192.168.43.124.7773: UDP, length 120
02:29:21.315635 IP 192.168.43.146.8880 > 192.168.43.147.7772: UDP, length 120
02:29:21.348610 IP 192.168.43.147.8880 > 192.168.43.124.7773: UDP, length 120
02:29:21.386952 IP 192.168.43.146.8880 > 192.168.43.147.7772: UDP, length 120
02:29:21.398605 IP 192.168.43.147.8880 > 192.168.43.124.7773: UDP, length 120
02:29:21.411641 IP 192.168.43.146.8880 > 192.168.43.147.7772: UDP, length 120
02:29:21.448622 IP 192.168.43.147.8880 > 192.168.43.124.7773: UDP, length 120
02:29:21.467159 IP 192.168.43.146.8880 > 192.168.43.147.7772: UDP, length 120
02:29:21.498607 IP 192.168.43.147.8880 > 192.168.43.124.7773: UDP, length 120
02:29:21.535795 IP 192.168.43.146.8880 > 192.168.43.147.7772: UDP, length 120
02:29:21.548605 IP 192.168.43.147.8880 > 192.168.43.124.7773: UDP, length 120
02:29:21.563304 IP 192.168.43.146.8880 > 192.168.43.147.7772: UDP, length 120
02:29:21.598601 IP 192.168.43.147.8880 > 192.168.43.124.7773: UDP, length 120
02:29:21.614595 IP 192.168.43.146.8880 > 192.168.43.147.7772: UDP, length 120
02:29:21.648605 IP 192.168.43.147.8880 > 192.168.43.124.7773: UDP, length 120
02:29:21.686413 IP 192.168.43.146.8880 > 192.168.43.147.7772: UDP, length 120
02:29:21.698603 IP 192.168.43.147.8880 > 192.168.43.124.7773: UDP, length 120
02:29:21.713429 IP 192.168.43.146.8880 > 192.168.43.147.7772: UDP, length 120
02:29:21.748604 IP 192.168.43.147.8880 > 192.168.43.124.7773: UDP, length 120
02:29:21.763628 IP 192.168.43.146.8880 > 192.168.43.147.7772: UDP, length 120
02:29:21.798602 IP 192.168.43.147.8880 > 192.168.43.124.7773: UDP, length 120
02:29:21.835904 IP 192.168.43.146.8880 > 192.168.43.147.7772: UDP, length 120
02:29:21.848613 IP 192.168.43.147.8880 > 192.168.43.124.7773: UDP, length 120
02:29:21.865736 IP 192.168.43.146.8880 > 192.168.43.147.7772: UDP, length 120
02:29:21.898633 IP 192.168.43.147.8880 > 192.168.43.124.7773: UDP, length 120
02:29:21.915053 IP 192.168.43.146.8880 > 192.168.43.147.7772: UDP, length 120
02:29:21.948642 IP 192.168.43.147.8880 > 192.168.43.124.7773: UDP, length 120
02:29:21.961149 IP 192.168.43.146.8880 > 192.168.43.147.7772: UDP, length 120
02:29:21.998633 IP 192.168.43.147.8880 > 192.168.43.124.7773: UDP, length 120
02:29:22.019087 IP 192.168.43.146.8880 > 192.168.43.147.7772: UDP, length 120
02:29:22.048635 IP 192.168.43.147.8880 > 192.168.43.124.7773: UDP, length 120
02:29:22.060763 IP 192.168.43.146.8880 > 192.168.43.147.7772: UDP, length 120
02:29:22.098629 IP 192.168.43.147.8880 > 192.168.43.124.7773: UDP, length 120
02:29:22.122347 IP 192.168.43.146.8880 > 192.168.43.147.7772: UDP, length 120
02:29:22.148631 IP 192.168.43.147.8880 > 192.168.43.124.7773: UDP, length 120
02:29:22.160457 IP 192.168.43.146.8880 > 192.168.43.147.7772: UDP, length 120
02:29:22.198630 IP 192.168.43.147.8880 > 192.168.43.124.7773: UDP, length 120
02:29:22.216596 IP 192.168.43.146.8880 > 192.168.43.147.7772: UDP, length 120
02:29:22.248631 IP 192.168.43.147.8880 > 192.168.43.124.7773: UDP, length 120
02:29:22.289335 IP 192.168.43.146.8880 > 192.168.43.147.7772: UDP, length 120
02:29:22.298632 IP 192.168.43.147.8880 > 192.168.43.124.7773: UDP, length 120
02:29:22.331740 IP 192.168.43.146.8880 > 192.168.43.147.7772: UDP, length 120
02:29:22.348647 IP 192.168.43.147.8880 > 192.168.43.124.7773: UDP, length 120
02:29:22.363417 IP 192.168.43.146.8880 > 192.168.43.147.7772: UDP, length 120
02:29:22.398631 IP 192.168.43.147.8880 > 192.168.43.124.7773: UDP, length 120
02:29:22.433868 IP 192.168.43.146.8880 > 192.168.43.147.7772: UDP, length 120
02:29:22.448631 IP 192.168.43.147.8880 > 192.168.43.124.7773: UDP, length 120
02:29:22.465158 IP 192.168.43.146.8880 > 192.168.43.147.7772: UDP, length 120
02:29:22.498629 IP 192.168.43.147.8880 > 192.168.43.124.7773: UDP, length 120
02:29:22.521168 IP 192.168.43.146.8880 > 192.168.43.147.7772: UDP, length 120
02:29:22.548629 IP 192.168.43.147.8880 > 192.168.43.124.7773: UDP, length 120
02:29:22.598624 IP 192.168.43.147.8880 > 192.168.43.124.7773: UDP, length 120
02:29:22.631146 IP 192.168.43.146.8880 > 192.168.43.147.7772: UDP, length 120
02:29:22.631307 IP 192.168.43.146.8880 > 192.168.43.147.7772: UDP, length 120
02:29:22.648666 IP 192.168.43.147.8880 > 192.168.43.124.7773: UDP, length 120
02:29:22.688898 IP 192.168.43.146.8880 > 192.168.43.147.7772: UDP, length 120
02:29:22.698633 IP 192.168.43.147.8880 > 192.168.43.124.7773: UDP, length 120
02:29:22.723636 IP 192.168.43.146.8880 > 192.168.43.147.7772: UDP, length 120
02:29:22.748632 IP 192.168.43.147.8880 > 192.168.43.124.7773: UDP, length 120
02:29:22.772666 IP 192.168.43.146.8880 > 192.168.43.147.7772: UDP, length 120
02:29:22.798629 IP 192.168.43.147.8880 > 192.168.43.124.7773: UDP, length 120
02:29:22.815403 IP 192.168.43.146.8880 > 192.168.43.147.7772: UDP, length 120
02:29:22.848641 IP 192.168.43.147.8880 > 192.168.43.124.7773: UDP, length 120
02:29:22.865391 IP 192.168.43.146.8880 > 192.168.43.147.7772: UDP, length 120
02:29:22.898634 IP 192.168.43.147.8880 > 192.168.43.124.7773: UDP, length 120
02:29:22.944472 IP 192.168.43.146.8880 > 192.168.43.147.7772: UDP, length 120
02:29:22.948631 IP 192.168.43.147.8880 > 192.168.43.124.7773: UDP, length 120
02:29:22.980123 IP 192.168.43.146.8880 > 192.168.43.147.7772: UDP, length 120
02:29:22.998629 IP 192.168.43.147.8880 > 192.168.43.124.7773: UDP, length 120
02:29:23.037392 IP 192.168.43.146.8880 > 192.168.43.147.7772: UDP, length 120
02:29:23.048630 IP 192.168.43.147.8880 > 192.168.43.124.7773: UDP, length 120
02:29:23.074985 IP 192.168.43.146.8880 > 192.168.43.147.7772: UDP, length 120
02:29:23.098629 IP 192.168.43.147.8880 > 192.168.43.124.7773: UDP, length 120
02:29:23.126090 IP 192.168.43.146.8880 > 192.168.43.147.7772: UDP, length 120
02:29:23.148631 IP 192.168.43.147.8880 > 192.168.43.124.7773: UDP, length 120
02:29:23.184595 IP 192.168.43.146.8880 > 192.168.43.147.7772: UDP, length 120
02:29:23.198629 IP 192.168.43.147.8880 > 192.168.43.124.7773: UDP, length 120
02:29:23.216281 IP 192.168.43.146.8880 > 192.168.43.147.7772: UDP, length 120
02:29:23.248629 IP 192.168.43.147.8880 > 192.168.43.124.7773: UDP, length 120
02:29:23.276305 IP 192.168.43.146.8880 > 192.168.43.147.7772: UDP, length 120
02:29:23.298630 IP 192.168.43.147.8880 > 192.168.43.124.7773: UDP, length 120
02:29:23.348629 IP 192.168.43.147.8880 > 192.168.43.124.7773: UDP, length 120
02:29:23.352027 IP 192.168.43.146.8880 > 192.168.43.147.7772: UDP, length 120
02:29:23.391176 IP 192.168.43.146.8880 > 192.168.43.147.7772: UDP, length 120
02:29:23.398643 IP 192.168.43.147.8880 > 192.168.43.124.7773: UDP, length 120
02:29:23.425234 IP 192.168.43.146.8880 > 192.168.43.147.7772: UDP, length 120
02:29:23.448634 IP 192.168.43.147.8880 > 192.168.43.124.7773: UDP, length 120
02:29:23.497193 IP 192.168.43.146.8880 > 192.168.43.147.7772: UDP, length 120
02:29:23.498627 IP 192.168.43.147.8880 > 192.168.43.124.7773: UDP, length 120
02:29:23.526444 IP 192.168.43.146.8880 > 192.168.43.147.7772: UDP, length 120
02:29:23.548630 IP 192.168.43.147.8880 > 192.168.43.124.7773: UDP, length 120
02:29:23.598625 IP 192.168.43.147.8880 > 192.168.43.124.7773: UDP, length 120
02:29:23.648628 IP 192.168.43.147.8880 > 192.168.43.124.7773: UDP, length 120
02:29:23.658437 IP 192.168.43.146.8880 > 192.168.43.147.7772: UDP, length 120
02:29:23.659416 IP 192.168.43.146.8880 > 192.168.43.147.7772: UDP, length 120
02:29:23.698629 IP 192.168.43.147.8880 > 192.168.43.124.7773: UDP, length 120
02:29:23.730574 IP 192.168.43.146.8880 > 192.168.43.147.7772: UDP, length 120
02:29:23.748632 IP 192.168.43.147.8880 > 192.168.43.124.7773: UDP, length 120
02:29:23.758697 IP 192.168.43.146.8880 > 192.168.43.147.7772: UDP, length 120
02:29:23.765965 IP 192.168.43.146.8880 > 192.168.43.147.7772: UDP, length 120
02:29:23.798630 IP 192.168.43.147.8880 > 192.168.43.124.7773: UDP, length 120
02:29:23.848642 IP 192.168.43.147.8880 > 192.168.43.124.7773: UDP, length 120
02:29:23.860829 IP 192.168.43.146.8880 > 192.168.43.147.7772: UDP, length 120
02:29:23.887468 IP 192.168.43.146.8880 > 192.168.43.147.7772: UDP, length 120
02:29:23.898630 IP 192.168.43.147.8880 > 192.168.43.124.7773: UDP, length 120
02:29:23.913537 IP 192.168.43.146.8880 > 192.168.43.147.7772: UDP, length 120
02:29:23.948630 IP 192.168.43.147.8880 > 192.168.43.124.7773: UDP, length 120
02:29:23.964015 IP 192.168.43.146.8880 > 192.168.43.147.7772: UDP, length 120
02:29:23.998628 IP 192.168.43.147.8880 > 192.168.43.124.7773: UDP, length 120
02:29:24.035849 IP 192.168.43.146.8880 > 192.168.43.147.7772: UDP, length 120
02:29:24.048629 IP 192.168.43.147.8880 > 192.168.43.124.7773: UDP, length 120
02:29:24.064770 IP 192.168.43.146.8880 > 192.168.43.147.7772: UDP, length 120
02:29:24.098628 IP 192.168.43.147.8880 > 192.168.43.124.7773: UDP, length 120
02:29:24.121836 IP 192.168.43.146.8880 > 192.168.43.147.7772: UDP, length 120
02:29:24.148692 IP 192.168.43.147.8880 > 192.168.43.124.7773: UDP, length 120
02:29:24.186294 IP 192.168.43.146.8880 > 192.168.43.147.7772: UDP, length 120
02:29:24.198636 IP 192.168.43.147.8880 > 192.168.43.124.7773: UDP, length 120
02:29:24.248627 IP 192.168.43.147.8880 > 192.168.43.124.7773: UDP, length 120
02:29:24.252062 IP 192.168.43.146.8880 > 192.168.43.147.7772: UDP, length 120
02:29:24.265254 IP 192.168.43.146.8880 > 192.168.43.147.7772: UDP, length 120
02:29:24.298629 IP 192.168.43.147.8880 > 192.168.43.124.7773: UDP, length 120
02:29:24.326732 IP 192.168.43.146.8880 > 192.168.43.147.7772: UDP, length 120
02:29:24.348631 IP 192.168.43.147.8880 > 192.168.43.124.7773: UDP, length 120
02:29:24.364227 IP 192.168.43.146.8880 > 192.168.43.147.7772: UDP, length 120
02:29:24.398629 IP 192.168.43.147.8880 > 192.168.43.124.7773: UDP, length 120
02:29:24.431647 IP 192.168.43.146.8880 > 192.168.43.147.7772: UDP, length 120
02:29:24.448633 IP 192.168.43.147.8880 > 192.168.43.124.7773: UDP, length 120
02:29:24.485236 IP 192.168.43.146.8880 > 192.168.43.147.7772: UDP, length 120
02:29:24.498634 IP 192.168.43.147.8880 > 192.168.43.124.7773: UDP, length 120
02:29:24.512891 IP 192.168.43.146.8880 > 192.168.43.147.7772: UDP, length 120
02:29:24.548631 IP 192.168.43.147.8880 > 192.168.43.124.7773: UDP, length 120
02:29:24.573010 IP 192.168.43.146.8880 > 192.168.43.147.7772: UDP, length 120
02:29:24.598634 IP 192.168.43.147.8880 > 192.168.43.124.7773: UDP, length 120
02:29:24.638945 IP 192.168.43.146.8880 > 192.168.43.147.7772: UDP, length 120
02:29:24.648632 IP 192.168.43.147.8880 > 192.168.43.124.7773: UDP, length 120
02:29:24.675670 IP 192.168.43.146.8880 > 192.168.43.147.7772: UDP, length 120
02:29:24.698631 IP 192.168.43.147.8880 > 192.168.43.124.7773: UDP, length 120
02:29:24.748626 IP 192.168.43.147.8880 > 192.168.43.124.7773: UDP, length 120
02:29:24.786884 IP 192.168.43.146.8880 > 192.168.43.147.7772: UDP, length 120
02:29:24.787106 IP 192.168.43.146.8880 > 192.168.43.147.7772: UDP, length 120
02:29:24.798627 IP 192.168.43.147.8880 > 192.168.43.124.7773: UDP, length 120
02:29:24.848640 IP 192.168.43.147.8880 > 192.168.43.124.7773: UDP, length 120
02:29:24.853464 IP 192.168.43.146.8880 > 192.168.43.147.7772: UDP, length 120
02:29:24.887063 IP 192.168.43.146.8880 > 192.168.43.147.7772: UDP, length 120
02:29:24.898635 IP 192.168.43.147.8880 > 192.168.43.124.7773: UDP, length 120
02:29:24.948629 IP 192.168.43.147.8880 > 192.168.43.124.7773: UDP, length 120
02:29:24.966141 IP 192.168.43.146.8880 > 192.168.43.147.7772: UDP, length 120
02:29:24.995863 IP 192.168.43.146.8880 > 192.168.43.147.7772: UDP, length 120
02:29:24.998631 IP 192.168.43.147.8880 > 192.168.43.124.7773: UDP, length 120
02:29:25.016706 IP 192.168.43.146.8880 > 192.168.43.147.7772: UDP, length 120
02:29:25.048632 IP 192.168.43.147.8880 > 192.168.43.124.7773: UDP, length 120
02:29:25.071723 IP 192.168.43.146.8880 > 192.168.43.147.7772: UDP, length 120
02:29:25.098637 IP 192.168.43.147.8880 > 192.168.43.124.7773: UDP, length 120
02:29:25.134972 IP 192.168.43.146.8880 > 192.168.43.147.7772: UDP, length 120
02:29:25.148636 IP 192.168.43.147.8880 > 192.168.43.124.7773: UDP, length 120
02:29:25.198621 IP 192.168.43.147.8880 > 192.168.43.124.7773: UDP, length 120
02:29:25.202040 IP 192.168.43.146.8880 > 192.168.43.147.7772: UDP, length 120
02:29:25.224004 IP 192.168.43.146.8880 > 192.168.43.147.7772: UDP, length 120
02:29:25.248633 IP 192.168.43.147.8880 > 192.168.43.124.7773: UDP, length 120
02:29:25.276975 IP 192.168.43.146.8880 > 192.168.43.147.7772: UDP, length 120
02:29:25.298634 IP 192.168.43.147.8880 > 192.168.43.124.7773: UDP, length 120
02:29:25.348635 IP 192.168.43.147.8880 > 192.168.43.124.7773: UDP, length 120
02:29:25.393587 IP 192.168.43.146.8880 > 192.168.43.147.7772: UDP, length 120
02:29:25.393815 IP 192.168.43.146.8880 > 192.168.43.147.7772: UDP, length 120
02:29:25.398631 IP 192.168.43.147.8880 > 192.168.43.124.7773: UDP, length 120
02:29:25.448628 IP 192.168.43.147.8880 > 192.168.43.124.7773: UDP, length 120
02:29:25.460552 IP 192.168.43.146.8880 > 192.168.43.147.7772: UDP, length 120
02:29:25.481120 IP 192.168.43.146.8880 > 192.168.43.147.7772: UDP, length 120
02:29:25.498633 IP 192.168.43.147.8880 > 192.168.43.124.7773: UDP, length 120
02:29:25.539858 IP 192.168.43.146.8880 > 192.168.43.147.7772: UDP, length 120
02:29:25.548638 IP 192.168.43.147.8880 > 192.168.43.124.7773: UDP, length 120
02:29:25.598626 IP 192.168.43.147.8880 > 192.168.43.124.7773: UDP, length 120
02:29:25.606580 IP 192.168.43.146.8880 > 192.168.43.147.7772: UDP, length 120
02:29:25.634282 IP 192.168.43.146.8880 > 192.168.43.147.7772: UDP, length 120
02:29:25.648674 IP 192.168.43.147.8880 > 192.168.43.124.7773: UDP, length 120
02:29:25.698625 IP 192.168.43.147.8880 > 192.168.43.124.7773: UDP, length 120
02:29:25.701059 IP 192.168.43.146.8880 > 192.168.43.147.7772: UDP, length 120
02:29:25.748637 IP 192.168.43.147.8880 > 192.168.43.124.7773: UDP, length 120
02:29:25.748829 IP 192.168.43.146.8880 > 192.168.43.147.7772: UDP, length 120
02:29:25.798628 IP 192.168.43.147.8880 > 192.168.43.124.7773: UDP, length 120
02:29:25.802055 IP 192.168.43.146.8880 > 192.168.43.147.7772: UDP, length 120
02:29:25.825682 IP 192.168.43.146.8880 > 192.168.43.147.7772: UDP, length 120
02:29:25.848656 IP 192.168.43.147.8880 > 192.168.43.124.7773: UDP, length 120
02:29:25.865731 IP 192.168.43.146.8880 > 192.168.43.147.7772: UDP, length 120
02:29:25.898649 IP 192.168.43.147.8880 > 192.168.43.124.7773: UDP, length 120
02:29:25.921472 IP 192.168.43.146.8880 > 192.168.43.147.7772: UDP, length 120
02:29:25.948638 IP 192.168.43.147.8880 > 192.168.43.124.7773: UDP, length 120
02:29:25.961774 IP 192.168.43.146.8880 > 192.168.43.147.7772: UDP, length 120
02:29:25.998629 IP 192.168.43.147.8880 > 192.168.43.124.7773: UDP, length 120
02:29:26.015603 IP 192.168.43.146.8880 > 192.168.43.147.7772: UDP, length 120
02:29:26.048663 IP 192.168.43.147.8880 > 192.168.43.124.7773: UDP, length 120
02:29:26.062955 IP 192.168.43.146.8880 > 192.168.43.147.7772: UDP, length 120
02:29:26.098640 IP 192.168.43.147.8880 > 192.168.43.124.7773: UDP, length 120
02:29:26.113927 IP 192.168.43.146.8880 > 192.168.43.147.7772: UDP, length 120
02:29:26.148726 IP 192.168.43.147.8880 > 192.168.43.124.7773: UDP, length 120
02:29:26.186980 IP 192.168.43.146.8880 > 192.168.43.147.7772: UDP, length 120
02:29:26.198670 IP 192.168.43.147.8880 > 192.168.43.124.7773: UDP, length 120
02:29:26.215078 IP 192.168.43.146.8880 > 192.168.43.147.7772: UDP, length 120
02:29:26.248682 IP 192.168.43.147.8880 > 192.168.43.124.7773: UDP, length 120
02:29:26.264226 IP 192.168.43.146.8880 > 192.168.43.147.7772: UDP, length 120
02:29:26.298688 IP 192.168.43.147.8880 > 192.168.43.124.7773: UDP, length 120
02:29:26.311310 IP 192.168.43.146.8880 > 192.168.43.147.7772: UDP, length 120
02:29:26.348672 IP 192.168.43.147.8880 > 192.168.43.124.7773: UDP, length 120
02:29:26.364413 IP 192.168.43.146.8880 > 192.168.43.147.7772: UDP, length 120
02:29:26.398685 IP 192.168.43.147.8880 > 192.168.43.124.7773: UDP, length 120
02:29:26.435835 IP 192.168.43.146.8880 > 192.168.43.147.7772: UDP, length 120
02:29:26.448661 IP 192.168.43.147.8880 > 192.168.43.124.7773: UDP, length 120
02:29:26.464487 IP 192.168.43.146.8880 > 192.168.43.147.7772: UDP, length 120
02:29:26.498677 IP 192.168.43.147.8880 > 192.168.43.124.7773: UDP, length 120
02:29:26.526063 IP 192.168.43.146.8880 > 192.168.43.147.7772: UDP, length 120
02:29:26.548672 IP 192.168.43.147.8880 > 192.168.43.124.7773: UDP, length 120
