00:48:35.437197 IP 192.168.43.124.8880 > 192.168.43.146.7771: UDP, length 120
00:48:35.487689 IP 192.168.43.124.8880 > 192.168.43.146.7771: UDP, length 120
00:48:35.531282 IP 192.168.43.124.8880 > 192.168.43.146.7771: UDP, length 120
00:48:35.609607 IP 192.168.43.124.8880 > 192.168.43.146.7771: UDP, length 120
00:48:35.631389 IP 192.168.43.124.8880 > 192.168.43.146.7771: UDP, length 120
00:48:35.679183 IP 192.168.43.124.8880 > 192.168.43.146.7771: UDP, length 120
00:48:35.731765 IP 192.168.43.124.8880 > 192.168.43.146.7771: UDP, length 120
00:48:35.781554 IP 192.168.43.124.8880 > 192.168.43.146.7771: UDP, length 120
00:48:35.906436 IP 192.168.43.146.8880 > 192.168.43.147.7772: UDP, length 120
00:48:35.914665 IP 192.168.43.124.8880 > 192.168.43.146.7771: UDP, length 120
00:48:35.917134 IP 192.168.43.124.8880 > 192.168.43.146.7771: UDP, length 120
00:48:35.931895 IP 192.168.43.124.8880 > 192.168.43.146.7771: UDP, length 120
00:48:35.956483 IP 192.168.43.146.8880 > 192.168.43.147.7772: UDP, length 120
00:48:36.006481 IP 192.168.43.146.8880 > 192.168.43.147.7772: UDP, length 120
00:48:36.055330 IP 192.168.43.124.8880 > 192.168.43.146.7771: UDP, length 120
00:48:36.055506 IP 192.168.43.124.8880 > 192.168.43.146.7771: UDP, length 120
00:48:36.056467 IP 192.168.43.146.8880 > 192.168.43.147.7772: UDP, length 120
00:48:36.081120 IP 192.168.43.124.8880 > 192.168.43.146.7771: UDP, length 120
00:48:36.106458 IP 192.168.43.146.8880 > 192.168.43.147.7772: UDP, length 120
00:48:36.156455 IP 192.168.43.146.8880 > 192.168.43.147.7772: UDP, length 120
00:48:36.206455 IP 192.168.43.146.8880 > 192.168.43.147.7772: UDP, length 120
00:48:36.234306 IP 192.168.43.124.8880 > 192.168.43.146.7771: UDP, length 120
00:48:36.256458 IP 192.168.43.146.8880 > 192.168.43.147.7772: UDP, length 120
00:48:36.306456 IP 192.168.43.146.8880 > 192.168.43.147.7772: UDP, length 120
00:48:36.333898 IP 192.168.43.124.8880 > 192.168.43.146.7771: UDP, length 120
00:48:36.333983 IP 192.168.43.124.8880 > 192.168.43.146.7771: UDP, length 120
00:48:36.356465 IP 192.168.43.146.8880 > 192.168.43.147.7772: UDP, length 120
00:48:36.406463 IP 192.168.43.146.8880 > 192.168.43.147.7772: UDP, length 120
00:48:36.456454 IP 192.168.43.146.8880 > 192.168.43.147.7772: UDP, length 120
00:48:36.464783 IP 192.168.43.124.8880 > 192.168.43.146.7771: UDP, length 120
00:48:36.467078 IP 192.168.43.124.8880 > 192.168.43.146.7771: UDP, length 120
00:48:36.489169 IP 192.168.43.124.8880 > 192.168.43.146.7771: UDP, length 120
00:48:36.506458 IP 192.168.43.146.8880 > 192.168.43.147.7772: UDP, length 120
00:48:36.530356 IP 192.168.43.124.8880 > 192.168.43.146.7771: UDP, length 120
00:48:36.556491 IP 192.168.43.146.8880 > 192.168.43.147.7772: UDP, length 120
00:48:36.580961 IP 192.168.43.124.8880 > 192.168.43.146.7771: UDP, length 120
00:48:36.606466 IP 192.168.43.146.8880 > 192.168.43.147.7772: UDP, length 120
00:48:36.632213 IP 192.168.43.124.8880 > 192.168.43.146.7771: UDP, length 120
00:48:36.656462 IP 192.168.43.146.8880 > 192.168.43.147.7772: UDP, length 120
00:48:36.680252 IP 192.168.43.124.8880 > 192.168.43.146.7771: UDP, length 120
00:48:36.706457 IP 192.168.43.146.8880 > 192.168.43.147.7772: UDP, length 120
00:48:36.730663 IP 192.168.43.124.8880 > 192.168.43.146.7771: UDP, length 120
00:48:36.756457 IP 192.168.43.146.8880 > 192.168.43.147.7772: UDP, length 120
00:48:36.780055 IP 192.168.43.124.8880 > 192.168.43.146.7771: UDP, length 120
00:48:36.806456 IP 192.168.43.146.8880 > 192.168.43.147.7772: UDP, length 120
00:48:36.830491 IP 192.168.43.124.8880 > 192.168.43.146.7771: UDP, length 120
00:48:36.856457 IP 192.168.43.146.8880 > 192.168.43.147.7772: UDP, length 120
00:48:36.891719 IP 192.168.43.124.8880 > 192.168.43.146.7771: UDP, length 120
00:48:36.906458 IP 192.168.43.146.8880 > 192.168.43.147.7772: UDP, length 120
00:48:36.928651 IP 192.168.43.124.8880 > 192.168.43.146.7771: UDP, length 120
00:48:36.956457 IP 192.168.43.146.8880 > 192.168.43.147.7772: UDP, length 120
00:48:36.980249 IP 192.168.43.124.8880 > 192.168.43.146.7771: UDP, length 120
00:48:37.006465 IP 192.168.43.146.8880 > 192.168.43.147.7772: UDP, length 120
00:48:37.030978 IP 192.168.43.124.8880 > 192.168.43.146.7771: UDP, length 120
00:48:37.056461 IP 192.168.43.146.8880 > 192.168.43.147.7772: UDP, length 120
00:48:37.079609 IP 192.168.43.124.8880 > 192.168.43.146.7771: UDP, length 120
00:48:37.106460 IP 192.168.43.146.8880 > 192.168.43.147.7772: UDP, length 120
00:48:37.129926 IP 192.168.43.124.8880 > 192.168.43.146.7771: UDP, length 120
00:48:37.156458 IP 192.168.43.146.8880 > 192.168.43.147.7772: UDP, length 120
00:48:37.183258 IP 192.168.43.124.8880 > 192.168.43.146.7771: UDP, length 120
00:48:37.206458 IP 192.168.43.146.8880 > 192.168.43.147.7772: UDP, length 120
00:48:37.228158 IP 192.168.43.124.8880 > 192.168.43.146.7771: UDP, length 120
00:48:37.256458 IP 192.168.43.146.8880 > 192.168.43.147.7772: UDP, length 120
00:48:37.306457 IP 192.168.43.146.8880 > 192.168.43.147.7772: UDP, length 120
00:48:37.349868 IP 192.168.43.124.8880 > 192.168.43.146.7771: UDP, length 120
00:48:37.349949 IP 192.168.43.124.8880 > 192.168.43.146.7771: UDP, length 120
00:48:37.356458 IP 192.168.43.146.8880 > 192.168.43.147.7772: UDP, length 120
00:48:37.381951 IP 192.168.43.124.8880 > 192.168.43.146.7771: UDP, length 120
00:48:37.406469 IP 192.168.43.146.8880 > 192.168.43.147.7772: UDP, length 120
00:48:37.456457 IP 192.168.43.146.8880 > 192.168.43.147.7772: UDP, length 120
00:48:37.492599 IP 192.168.43.124.8880 > 192.168.43.146.7771: UDP, length 120
00:48:37.492753 IP 192.168.43.124.8880 > 192.168.43.146.7771: UDP, length 120
00:48:37.506457 IP 192.168.43.146.8880 > 192.168.43.147.7772: UDP, length 120
00:48:37.556523 IP 192.168.43.146.8880 > 192.168.43.147.7772: UDP, length 120
00:48:37.606515 IP 192.168.43.146.8880 > 192.168.43.147.7772: UDP, length 120
00:48:37.630180 IP 192.168.43.124.8880 > 192.168.43.146.7771: UDP, length 120
00:48:37.630340 IP 192.168.43.124.8880 > 192.168.43.146.7771: UDP, length 120
00:48:37.630451 IP 192.168.43.124.8880 > 192.168.43.146.7771: UDP, length 120
00:48:37.656512 IP 192.168.43.146.8880 > 192.168.43.147.7772: UDP, length 120
00:48:37.706486 IP 192.168.43.146.8880 > 192.168.43.147.7772: UDP, length 120
00:48:37.756501 IP 192.168.43.146.8880 > 192.168.43.147.7772: UDP, length 120
00:48:37.757060 IP 192.168.43.124.8880 > 192.168.43.146.7771: UDP, length 120
00:48:37.757202 IP 192.168.43.124.8880 > 192.168.43.146.7771: UDP, length 120
00:48:37.780224 IP 192.168.43.124.8880 > 192.168.43.146.7771: UDP, length 120
00:48:37.806499 IP 192.168.43.146.8880 > 192.168.43.147.7772: UDP, length 120
00:48:37.856485 IP 192.168.43.146.8880 > 192.168.43.147.7772: UDP, length 120
00:48:37.903611 IP 192.168.43.124.8880 > 192.168.43.146.7771: UDP, length 120
00:48:37.904814 IP 192.168.43.124.8880 > 192.168.43.146.7771: UDP, length 120
00:48:37.906486 IP 192.168.43.146.8880 > 192.168.43.147.7772: UDP, length 120
00:48:37.930487 IP 192.168.43.124.8880 > 192.168.43.146.7771: UDP, length 120
00:48:37.956485 IP 192.168.43.146.8880 > 192.168.43.147.7772: UDP, length 120
00:48:37.982355 IP 192.168.43.124.8880 > 192.168.43.146.7771: UDP, length 120
00:48:38.006493 IP 192.168.43.146.8880 > 192.168.43.147.7772: UDP, length 120
00:48:38.031860 IP 192.168.43.124.8880 > 192.168.43.146.7771: UDP, length 120
00:48:38.056520 IP 192.168.43.146.8880 > 192.168.43.147.7772: UDP, length 120
00:48:38.079871 IP 192.168.43.124.8880 > 192.168.43.146.7771: UDP, length 120
00:48:38.106489 IP 192.168.43.146.8880 > 192.168.43.147.7772: UDP, length 120
00:48:38.130426 IP 192.168.43.124.8880 > 192.168.43.146.7771: UDP, length 120
00:48:38.156485 IP 192.168.43.146.8880 > 192.168.43.147.7772: UDP, length 120
00:48:38.180435 IP 192.168.43.124.8880 > 192.168.43.146.7771: UDP, length 120
00:48:38.206487 IP 192.168.43.146.8880 > 192.168.43.147.7772: UDP, length 120
00:48:38.231394 IP 192.168.43.124.8880 > 192.168.43.146.7771: UDP, length 120
00:48:38.256483 IP 192.168.43.146.8880 > 192.168.43.147.7772: UDP, length 120
00:48:38.281830 IP 192.168.43.124.8880 > 192.168.43.146.7771: UDP, length 120
00:48:38.306484 IP 192.168.43.146.8880 > 192.168.43.147.7772: UDP, length 120
00:48:38.331491 IP 192.168.43.124.8880 > 192.168.43.146.7771: UDP, length 120
00:48:38.356485 IP 192.168.43.146.8880 > 192.168.43.147.7772: UDP, length 120
00:48:38.383721 IP 192.168.43.124.8880 > 192.168.43.146.7771: UDP, length 120
00:48:38.406488 IP 192.168.43.146.8880 > 192.168.43.147.7772: UDP, length 120
00:48:38.436366 IP 192.168.43.124.8880 > 192.168.43.146.7771: UDP, length 120
00:48:38.456506 IP 192.168.43.146.8880 > 192.168.43.147.7772: UDP, length 120
00:48:38.487886 IP 192.168.43.124.8880 > 192.168.43.146.7771: UDP, length 120
00:48:38.506487 IP 192.168.43.146.8880 > 192.168.43.147.7772: UDP, length 120
00:48:38.528611 IP 192.168.43.124.8880 > 192.168.43.146.7771: UDP, length 120
00:48:38.556484 IP 192.168.43.146.8880 > 192.168.43.147.7772: UDP, length 120
00:48:38.582825 IP 192.168.43.124.8880 > 192.168.43.146.7771: UDP, length 120
00:48:38.606971 IP 192.168.43.146.8880 > 192.168.43.147.7772: UDP, length 120
00:48:38.628857 IP 192.168.43.124.8880 > 192.168.43.146.7771: UDP, length 120
00:48:38.656581 IP 192.168.43.146.8880 > 192.168.43.147.7772: UDP, length 120
00:48:38.680419 IP 192.168.43.124.8880 > 192.168.43.146.7771: UDP, length 120
00:48:38.706535 IP 192.168.43.146.8880 > 192.168.43.147.7772: UDP, length 120
00:48:38.730834 IP 192.168.43.124.8880 > 192.168.43.146.7771: UDP, length 120
00:48:38.756489 IP 192.168.43.146.8880 > 192.168.43.147.7772: UDP, length 120
00:48:38.782514 IP 192.168.43.124.8880 > 192.168.43.146.7771: UDP, length 120
00:48:38.806486 IP 192.168.43.146.8880 > 192.168.43.147.7772: UDP, length 120
00:48:38.830325 IP 192.168.43.124.8880 > 192.168.43.146.7771: UDP, length 120
00:48:38.856483 IP 192.168.43.146.8880 > 192.168.43.147.7772: UDP, length 120
00:48:38.880744 IP 192.168.43.124.8880 > 192.168.43.146.7771: UDP, length 120
00:48:38.906485 IP 192.168.43.146.8880 > 192.168.43.147.7772: UDP, length 120
00:48:38.928494 IP 192.168.43.124.8880 > 192.168.43.146.7771: UDP, length 120
00:48:38.956483 IP 192.168.43.146.8880 > 192.168.43.147.7772: UDP, length 120
00:48:38.981240 IP 192.168.43.124.8880 > 192.168.43.146.7771: UDP, length 120
00:48:39.006495 IP 192.168.43.146.8880 > 192.168.43.147.7772: UDP, length 120
00:48:39.028972 IP 192.168.43.124.8880 > 192.168.43.146.7771: UDP, length 120
00:48:39.056488 IP 192.168.43.146.8880 > 192.168.43.147.7772: UDP, length 120
00:48:39.078429 IP 192.168.43.124.8880 > 192.168.43.146.7771: UDP, length 120
00:48:39.106485 IP 192.168.43.146.8880 > 192.168.43.147.7772: UDP, length 120
00:48:39.128755 IP 192.168.43.124.8880 > 192.168.43.146.7771: UDP, length 120
00:48:39.156485 IP 192.168.43.146.8880 > 192.168.43.147.7772: UDP, length 120
00:48:39.178684 IP 192.168.43.124.8880 > 192.168.43.146.7771: UDP, length 120
00:48:39.206485 IP 192.168.43.146.8880 > 192.168.43.147.7772: UDP, length 120
00:48:39.232145 IP 192.168.43.124.8880 > 192.168.43.146.7771: UDP, length 120
00:48:39.256483 IP 192.168.43.146.8880 > 192.168.43.147.7772: UDP, length 120
00:48:39.281161 IP 192.168.43.124.8880 > 192.168.43.146.7771: UDP, length 120
00:48:39.306485 IP 192.168.43.146.8880 > 192.168.43.147.7772: UDP, length 120
00:48:39.330181 IP 192.168.43.124.8880 > 192.168.43.146.7771: UDP, length 120
00:48:39.356483 IP 192.168.43.146.8880 > 192.168.43.147.7772: UDP, length 120
00:48:39.381268 IP 192.168.43.124.8880 > 192.168.43.146.7771: UDP, length 120
00:48:39.406485 IP 192.168.43.146.8880 > 192.168.43.147.7772: UDP, length 120
00:48:39.450401 IP 192.168.43.124.8880 > 192.168.43.146.7771: UDP, length 120
00:48:39.456485 IP 192.168.43.146.8880 > 192.168.43.147.7772: UDP, length 120
00:48:39.489691 IP 192.168.43.124.8880 > 192.168.43.146.7771: UDP, length 120
00:48:39.506488 IP 192.168.43.146.8880 > 192.168.43.147.7772: UDP, length 120
00:48:39.528462 IP 192.168.43.124.8880 > 192.168.43.146.7771: UDP, length 120
00:48:39.556522 IP 192.168.43.146.8880 > 192.168.43.147.7772: UDP, length 120
00:48:39.578724 IP 192.168.43.124.8880 > 192.168.43.146.7771: UDP, length 120
00:48:39.606492 IP 192.168.43.146.8880 > 192.168.43.147.7772: UDP, length 120
00:48:39.628610 IP 192.168.43.124.8880 > 192.168.43.146.7771: UDP, length 120
00:48:39.656491 IP 192.168.43.146.8880 > 192.168.43.147.7772: UDP, length 120
00:48:39.679001 IP 192.168.43.124.8880 > 192.168.43.146.7771: UDP, length 120
00:48:39.706539 IP 192.168.43.146.8880 > 192.168.43.147.7772: UDP, length 120
00:48:39.728697 IP 192.168.43.124.8880 > 192.168.43.146.7771: UDP, length 120
00:48:39.756499 IP 192.168.43.146.8880 > 192.168.43.147.7772: UDP, length 120
00:48:39.780179 IP 192.168.43.124.8880 > 192.168.43.146.7771: UDP, length 120
00:48:39.806487 IP 192.168.43.146.8880 > 192.168.43.147.7772: UDP, length 120
00:48:39.856483 IP 192.168.43.146.8880 > 192.168.43.147.7772: UDP, length 120
00:48:39.906483 IP 192.168.43.146.8880 > 192.168.43.147.7772: UDP, length 120
00:48:39.930887 IP 192.168.43.124.8880 > 192.168.43.146.7771: UDP, length 120
00:48:39.956483 IP 192.168.43.146.8880 > 192.168.43.147.7772: UDP, length 120
00:48:40.006554 IP 192.168.43.146.8880 > 192.168.43.147.7772: UDP, length 120
00:48:40.056485 IP 192.168.43.146.8880 > 192.168.43.147.7772: UDP, length 120
00:48:40.058522 IP 192.168.43.124.8880 > 192.168.43.146.7771: UDP, length 120
00:48:40.058785 IP 192.168.43.124.8880 > 192.168.43.146.7771: UDP, length 120
00:48:40.080663 IP 192.168.43.124.8880 > 192.168.43.146.7771: UDP, length 120
00:48:40.106494 IP 192.168.43.146.8880 > 192.168.43.147.7772: UDP, length 120
00:48:40.156483 IP 192.168.43.146.8880 > 192.168.43.147.7772: UDP, length 120
00:48:40.200862 IP 192.168.43.124.8880 > 192.168.43.146.7771: UDP, length 120
00:48:40.202233 IP 192.168.43.124.8880 > 192.168.43.146.7771: UDP, length 120
00:48:40.206483 IP 192.168.43.146.8880 > 192.168.43.147.7772: UDP, length 120
00:48:40.229660 IP 192.168.43.124.8880 > 192.168.43.146.7771: UDP, length 120
00:48:40.256486 IP 192.168.43.146.8880 > 192.168.43.147.7772: UDP, length 120
00:48:40.306482 IP 192.168.43.146.8880 > 192.168.43.147.7772: UDP, length 120
00:48:40.340898 IP 192.168.43.124.8880 > 192.168.43.146.7771: UDP, length 120
00:48:40.341023 IP 192.168.43.124.8880 > 192.168.43.146.7771: UDP, length 120
00:48:40.356487 IP 192.168.43.146.8880 > 192.168.43.147.7772: UDP, length 120
00:48:40.381297 IP 192.168.43.124.8880 > 192.168.43.146.7771: UDP, length 120
00:48:40.406485 IP 192.168.43.146.8880 > 192.168.43.147.7772: UDP, length 120
00:48:40.456486 IP 192.168.43.146.8880 > 192.168.43.147.7772: UDP, length 120
00:48:40.477003 IP 192.168.43.124.8880 > 192.168.43.146.7771: UDP, length 120
00:48:40.488387 IP 192.168.43.124.8880 > 192.168.43.146.7771: UDP, length 120
00:48:40.506488 IP 192.168.43.146.8880 > 192.168.43.147.7772: UDP, length 120
00:48:40.531844 IP 192.168.43.124.8880 > 192.168.43.146.7771: UDP, length 120
00:48:40.556491 IP 192.168.43.146.8880 > 192.168.43.147.7772: UDP, length 120
00:48:40.584884 IP 192.168.43.124.8880 > 192.168.43.146.7771: UDP, length 120
00:48:40.606500 IP 192.168.43.146.8880 > 192.168.43.147.7772: UDP, length 120
00:48:40.629709 IP 192.168.43.124.8880 > 192.168.43.146.7771: UDP, length 120
00:48:40.656491 IP 192.168.43.146.8880 > 192.168.43.147.7772: UDP, length 120
00:48:40.681319 IP 192.168.43.124.8880 > 192.168.43.146.7771: UDP, length 120
00:48:40.706558 IP 192.168.43.146.8880 > 192.168.43.147.7772: UDP, length 120
00:48:40.731917 IP 192.168.43.124.8880 > 192.168.43.146.7771: UDP, length 120
00:48:40.756555 IP 192.168.43.146.8880 > 192.168.43.147.7772: UDP, length 120
00:48:40.781744 IP 192.168.43.124.8880 > 192.168.43.146.7771: UDP, length 120
00:48:40.806622 IP 192.168.43.146.8880 > 192.168.43.147.7772: UDP, length 120
00:48:40.834737 IP 192.168.43.124.8880 > 192.168.43.146.7771: UDP, length 120
00:48:40.856542 IP 192.168.43.146.8880 > 192.168.43.147.7772: UDP, length 120
00:48:40.878875 IP 192.168.43.124.8880 > 192.168.43.146.7771: UDP, length 120
00:48:40.906532 IP 192.168.43.146.8880 > 192.168.43.147.7772: UDP, length 120
00:48:40.930255 IP 192.168.43.124.8880 > 192.168.43.146.7771: UDP, length 120
00:48:40.956512 IP 192.168.43.146.8880 > 192.168.43.147.7772: UDP, length 120
00:48:40.980930 IP 192.168.43.124.8880 > 192.168.43.146.7771: UDP, length 120
00:48:41.006510 IP 192.168.43.146.8880 > 192.168.43.147.7772: UDP, length 120
00:48:41.031384 IP 192.168.43.124.8880 > 192.168.43.146.7771: UDP, length 120
00:48:41.056535 IP 192.168.43.146.8880 > 192.168.43.147.7772: UDP, length 120
00:48:41.081344 IP 192.168.43.124.8880 > 192.168.43.146.7771: UDP, length 120
00:48:41.106532 IP 192.168.43.146.8880 > 192.168.43.147.7772: UDP, length 120
00:48:41.126427 IP 192.168.43.124.8880 > 192.168.43.146.7771: UDP, length 120
00:48:41.156535 IP 192.168.43.146.8880 > 192.168.43.147.7772: UDP, length 120
00:48:41.206471 IP 192.168.43.146.8880 > 192.168.43.147.7772: UDP, length 120
00:48:41.245116 IP 192.168.43.124.8880 > 192.168.43.146.7771: UDP, length 120
00:48:41.247229 IP 192.168.43.124.8880 > 192.168.43.146.7771: UDP, length 120
00:48:41.256463 IP 192.168.43.146.8880 > 192.168.43.147.7772: UDP, length 120
00:48:41.280444 IP 192.168.43.124.8880 > 192.168.43.146.7771: UDP, length 120
00:48:41.306460 IP 192.168.43.146.8880 > 192.168.43.147.7772: UDP, length 120
00:48:41.356454 IP 192.168.43.146.8880 > 192.168.43.147.7772: UDP, length 120
00:48:41.379466 IP 192.168.43.124.8880 > 192.168.43.146.7771: UDP, length 120
00:48:41.379626 IP 192.168.43.124.8880 > 192.168.43.146.7771: UDP, length 120
00:48:41.406455 IP 192.168.43.146.8880 > 192.168.43.147.7772: UDP, length 120
00:48:41.456457 IP 192.168.43.146.8880 > 192.168.43.147.7772: UDP, length 120
00:48:41.506454 IP 192.168.43.146.8880 > 192.168.43.147.7772: UDP, length 120
00:48:41.512453 IP 192.168.43.124.8880 > 192.168.43.146.7771: UDP, length 120
00:48:41.515435 IP 192.168.43.124.8880 > 192.168.43.146.7771: UDP, length 120
00:48:41.528113 IP 192.168.43.124.8880 > 192.168.43.146.7771: UDP, length 120
00:48:41.556460 IP 192.168.43.146.8880 > 192.168.43.147.7772: UDP, length 120
00:48:41.606457 IP 192.168.43.146.8880 > 192.168.43.147.7772: UDP, length 120
00:48:41.656462 IP 192.168.43.146.8880 > 192.168.43.147.7772: UDP, length 120
00:48:41.658063 IP 192.168.43.124.8880 > 192.168.43.146.7771: UDP, length 120
00:48:41.658656 IP 192.168.43.124.8880 > 192.168.43.146.7771: UDP, length 120
00:48:41.686603 IP 192.168.43.124.8880 > 192.168.43.146.7771: UDP, length 120
00:48:41.706517 IP 192.168.43.146.8880 > 192.168.43.147.7772: UDP, length 120
00:48:41.756472 IP 192.168.43.146.8880 > 192.168.43.147.7772: UDP, length 120
00:48:41.787932 IP 192.168.43.124.8880 > 192.168.43.146.7771: UDP, length 120
00:48:41.792226 IP 192.168.43.124.8880 > 192.168.43.146.7771: UDP, length 120
00:48:41.806460 IP 192.168.43.146.8880 > 192.168.43.147.7772: UDP, length 120
00:48:41.839651 IP 192.168.43.124.8880 > 192.168.43.146.7771: UDP, length 120
00:48:41.856457 IP 192.168.43.146.8880 > 192.168.43.147.7772: UDP, length 120
00:48:41.881172 IP 192.168.43.124.8880 > 192.168.43.146.7771: UDP, length 120
00:48:41.906456 IP 192.168.43.146.8880 > 192.168.43.147.7772: UDP, length 120
00:48:41.931358 IP 192.168.43.124.8880 > 192.168.43.146.7771: UDP, length 120
00:48:41.956454 IP 192.168.43.146.8880 > 192.168.43.147.7772: UDP, length 120
00:48:41.980368 IP 192.168.43.124.8880 > 192.168.43.146.7771: UDP, length 120
00:48:42.006485 IP 192.168.43.146.8880 > 192.168.43.147.7772: UDP, length 120
00:48:42.033036 IP 192.168.43.124.8880 > 192.168.43.146.7771: UDP, length 120
00:48:42.056461 IP 192.168.43.146.8880 > 192.168.43.147.7772: UDP, length 120
00:48:42.079475 IP 192.168.43.124.8880 > 192.168.43.146.7771: UDP, length 120
00:48:42.106454 IP 192.168.43.146.8880 > 192.168.43.147.7772: UDP, length 120
00:48:42.130336 IP 192.168.43.124.8880 > 192.168.43.146.7771: UDP, length 120
00:48:42.156456 IP 192.168.43.146.8880 > 192.168.43.147.7772: UDP, length 120
00:48:42.182607 IP 192.168.43.124.8880 > 192.168.43.146.7771: UDP, length 120
00:48:42.206456 IP 192.168.43.146.8880 > 192.168.43.147.7772: UDP, length 120
00:48:42.231745 IP 192.168.43.124.8880 > 192.168.43.146.7771: UDP, length 120
00:48:42.256454 IP 192.168.43.146.8880 > 192.168.43.147.7772: UDP, length 120
00:48:42.280279 IP 192.168.43.124.8880 > 192.168.43.146.7771: UDP, length 120
00:48:42.306454 IP 192.168.43.146.8880 > 192.168.43.147.7772: UDP, length 120
00:48:42.332665 IP 192.168.43.124.8880 > 192.168.43.146.7771: UDP, length 120
00:48:42.356454 IP 192.168.43.146.8880 > 192.168.43.147.7772: UDP, length 120
00:48:42.380127 IP 192.168.43.124.8880 > 192.168.43.146.7771: UDP, length 120
00:48:42.406455 IP 192.168.43.146.8880 > 192.168.43.147.7772: UDP, length 120
00:48:42.430278 IP 192.168.43.124.8880 > 192.168.43.146.7771: UDP, length 120
00:48:42.456458 IP 192.168.43.146.8880 > 192.168.43.147.7772: UDP, length 120
00:48:42.489030 IP 192.168.43.124.8880 > 192.168.43.146.7771: UDP, length 120
00:48:42.506455 IP 192.168.43.146.8880 > 192.168.43.147.7772: UDP, length 120
00:48:42.529486 IP 192.168.43.124.8880 > 192.168.43.146.7771: UDP, length 120
00:48:42.556486 IP 192.168.43.146.8880 > 192.168.43.147.7772: UDP, length 120
00:48:42.583946 IP 192.168.43.124.8880 > 192.168.43.146.7771: UDP, length 120
00:48:42.606457 IP 192.168.43.146.8880 > 192.168.43.147.7772: UDP, length 120
00:48:42.642007 IP 192.168.43.124.8880 > 192.168.43.146.7771: UDP, length 120
00:48:42.656486 IP 192.168.43.146.8880 > 192.168.43.147.7772: UDP, length 120
00:48:42.682058 IP 192.168.43.124.8880 > 192.168.43.146.7771: UDP, length 120
00:48:42.707633 IP 192.168.43.146.8880 > 192.168.43.147.7772: UDP, length 120
00:48:42.735551 IP 192.168.43.124.8880 > 192.168.43.146.7771: UDP, length 120
00:48:42.756565 IP 192.168.43.146.8880 > 192.168.43.147.7772: UDP, length 120
00:48:42.780423 IP 192.168.43.124.8880 > 192.168.43.146.7771: UDP, length 120
00:48:42.806507 IP 192.168.43.146.8880 > 192.168.43.147.7772: UDP, length 120
00:48:42.828856 IP 192.168.43.124.8880 > 192.168.43.146.7771: UDP, length 120
00:48:42.856497 IP 192.168.43.146.8880 > 192.168.43.147.7772: UDP, length 120
00:48:42.881065 IP 192.168.43.124.8880 > 192.168.43.146.7771: UDP, length 120
00:48:42.906480 IP 192.168.43.146.8880 > 192.168.43.147.7772: UDP, length 120
00:48:42.929620 IP 192.168.43.124.8880 > 192.168.43.146.7771: UDP, length 120
00:48:42.956486 IP 192.168.43.146.8880 > 192.168.43.147.7772: UDP, length 120
00:48:42.982206 IP 192.168.43.124.8880 > 192.168.43.146.7771: UDP, length 120
00:48:43.006493 IP 192.168.43.146.8880 > 192.168.43.147.7772: UDP, length 120
00:48:43.056497 IP 192.168.43.146.8880 > 192.168.43.147.7772: UDP, length 120
00:48:43.085742 IP 192.168.43.124.8880 > 192.168.43.146.7771: UDP, length 120
00:48:43.085998 IP 192.168.43.124.8880 > 192.168.43.146.7771: UDP, length 120
00:48:43.106493 IP 192.168.43.146.8880 > 192.168.43.147.7772: UDP, length 120
00:48:43.156481 IP 192.168.43.146.8880 > 192.168.43.147.7772: UDP, length 120
00:48:43.206481 IP 192.168.43.146.8880 > 192.168.43.147.7772: UDP, length 120
00:48:43.226935 IP 192.168.43.124.8880 > 192.168.43.146.7771: UDP, length 120
00:48:43.227177 IP 192.168.43.124.8880 > 192.168.43.146.7771: UDP, length 120
00:48:43.229019 IP 192.168.43.124.8880 > 192.168.43.146.7771: UDP, length 120
00:48:43.256486 IP 192.168.43.146.8880 > 192.168.43.147.7772: UDP, length 120
00:48:43.306480 IP 192.168.43.146.8880 > 192.168.43.147.7772: UDP, length 120
00:48:43.356490 IP 192.168.43.146.8880 > 192.168.43.147.7772: UDP, length 120
00:48:43.385629 IP 192.168.43.124.8880 > 192.168.43.146.7771: UDP, length 120
00:48:43.406494 IP 192.168.43.146.8880 > 192.168.43.147.7772: UDP, length 120
00:48:43.456481 IP 192.168.43.146.8880 > 192.168.43.147.7772: UDP, length 120
00:48:43.506479 IP 192.168.43.146.8880 > 192.168.43.147.7772: UDP, length 120
00:48:43.532987 IP 192.168.43.124.8880 > 192.168.43.146.7771: UDP, length 120
00:48:43.556481 IP 192.168.43.146.8880 > 192.168.43.147.7772: UDP, length 120
00:48:43.599028 IP 192.168.43.124.8880 > 192.168.43.146.7771: UDP, length 120
00:48:43.606489 IP 192.168.43.146.8880 > 192.168.43.147.7772: UDP, length 120
00:48:43.640951 IP 192.168.43.124.8880 > 192.168.43.146.7771: UDP, length 120
00:48:43.656494 IP 192.168.43.146.8880 > 192.168.43.147.7772: UDP, length 120
00:48:43.682592 IP 192.168.43.124.8880 > 192.168.43.146.7771: UDP, length 120
00:48:43.706483 IP 192.168.43.146.8880 > 192.168.43.147.7772: UDP, length 120
00:48:43.735607 IP 192.168.43.124.8880 > 192.168.43.146.7771: UDP, length 120
00:48:43.756544 IP 192.168.43.146.8880 > 192.168.43.147.7772: UDP, length 120
00:48:43.785058 IP 192.168.43.124.8880 > 192.168.43.146.7771: UDP, length 120
00:48:43.806505 IP 192.168.43.146.8880 > 192.168.43.147.7772: UDP, length 120
00:48:43.836272 IP 192.168.43.124.8880 > 192.168.43.146.7771: UDP, length 120
00:48:43.856492 IP 192.168.43.146.8880 > 192.168.43.147.7772: UDP, length 120
00:48:43.881892 IP 192.168.43.124.8880 > 192.168.43.146.7771: UDP, length 120
00:48:43.906495 IP 192.168.43.146.8880 > 192.168.43.147.7772: UDP, length 120
00:48:43.942840 IP 192.168.43.124.8880 > 192.168.43.146.7771: UDP, length 120
00:48:43.956479 IP 192.168.43.146.8880 > 192.168.43.147.7772: UDP, length 120
00:48:43.980446 IP 192.168.43.124.8880 > 192.168.43.146.7771: UDP, length 120
00:48:44.006487 IP 192.168.43.146.8880 > 192.168.43.147.7772: UDP, length 120
00:48:44.030484 IP 192.168.43.124.8880 > 192.168.43.146.7771: UDP, length 120
00:48:44.056523 IP 192.168.43.146.8880 > 192.168.43.147.7772: UDP, length 120
00:48:44.080489 IP 192.168.43.124.8880 > 192.168.43.146.7771: UDP, length 120
00:48:44.106486 IP 192.168.43.146.8880 > 192.168.43.147.7772: UDP, length 120
00:48:44.131858 IP 192.168.43.124.8880 > 192.168.43.146.7771: UDP, length 120
00:48:44.156497 IP 192.168.43.146.8880 > 192.168.43.147.7772: UDP, length 120
00:48:44.184702 IP 192.168.43.124.8880 > 192.168.43.146.7771: UDP, length 120
00:48:44.206482 IP 192.168.43.146.8880 > 192.168.43.147.7772: UDP, length 120
00:48:44.232807 IP 192.168.43.124.8880 > 192.168.43.146.7771: UDP, length 120
00:48:44.256483 IP 192.168.43.146.8880 > 192.168.43.147.7772: UDP, length 120
00:48:44.280402 IP 192.168.43.124.8880 > 192.168.43.146.7771: UDP, length 120
00:48:44.306480 IP 192.168.43.146.8880 > 192.168.43.147.7772: UDP, length 120
00:48:44.356480 IP 192.168.43.146.8880 > 192.168.43.147.7772: UDP, length 120
00:48:44.406479 IP 192.168.43.146.8880 > 192.168.43.147.7772: UDP, length 120
00:48:44.435951 IP 192.168.43.124.8880 > 192.168.43.146.7771: UDP, length 120
00:48:44.456485 IP 192.168.43.146.8880 > 192.168.43.147.7772: UDP, length 120
00:48:44.506491 IP 192.168.43.146.8880 > 192.168.43.147.7772: UDP, length 120
00:48:44.556480 IP 192.168.43.146.8880 > 192.168.43.147.7772: UDP, length 120
00:48:44.585630 IP 192.168.43.124.8880 > 192.168.43.146.7771: UDP, length 120
00:48:44.606478 IP 192.168.43.146.8880 > 192.168.43.147.7772: UDP, length 120
00:48:44.632526 IP 192.168.43.124.8880 > 192.168.43.146.7771: UDP, length 120
00:48:44.656482 IP 192.168.43.146.8880 > 192.168.43.147.7772: UDP, length 120
00:48:44.681634 IP 192.168.43.124.8880 > 192.168.43.146.7771: UDP, length 120
00:48:44.706481 IP 192.168.43.146.8880 > 192.168.43.147.7772: UDP, length 120
00:48:44.732470 IP 192.168.43.124.8880 > 192.168.43.146.7771: UDP, length 120
00:48:44.756496 IP 192.168.43.146.8880 > 192.168.43.147.7772: UDP, length 120
00:48:44.783401 IP 192.168.43.124.8880 > 192.168.43.146.7771: UDP, length 120
00:48:44.806488 IP 192.168.43.146.8880 > 192.168.43.147.7772: UDP, length 120
00:48:44.832534 IP 192.168.43.124.8880 > 192.168.43.146.7771: UDP, length 120
00:48:44.856490 IP 192.168.43.146.8880 > 192.168.43.147.7772: UDP, length 120
00:48:44.886002 IP 192.168.43.124.8880 > 192.168.43.146.7771: UDP, length 120
00:48:44.906486 IP 192.168.43.146.8880 > 192.168.43.147.7772: UDP, length 120
00:48:44.929442 IP 192.168.43.124.8880 > 192.168.43.146.7771: UDP, length 120
00:48:44.956482 IP 192.168.43.146.8880 > 192.168.43.147.7772: UDP, length 120
00:48:45.006482 IP 192.168.43.146.8880 > 192.168.43.147.7772: UDP, length 120
00:48:45.056480 IP 192.168.43.146.8880 > 192.168.43.147.7772: UDP, length 120
00:48:45.061968 IP 192.168.43.124.8880 > 192.168.43.146.7771: UDP, length 120
00:48:45.063148 IP 192.168.43.124.8880 > 192.168.43.146.7771: UDP, length 120
00:48:45.075806 IP 192.168.43.124.8880 > 192.168.43.146.7771: UDP, length 120
00:48:45.106495 IP 192.168.43.146.8880 > 192.168.43.147.7772: UDP, length 120
00:48:45.130551 IP 192.168.43.124.8880 > 192.168.43.146.7771: UDP, length 120
00:48:45.156481 IP 192.168.43.146.8880 > 192.168.43.147.7772: UDP, length 120
00:48:45.184033 IP 192.168.43.124.8880 > 192.168.43.146.7771: UDP, length 120
00:48:45.206481 IP 192.168.43.146.8880 > 192.168.43.147.7772: UDP, length 120
00:48:45.230432 IP 192.168.43.124.8880 > 192.168.43.146.7771: UDP, length 120
00:48:45.256483 IP 192.168.43.146.8880 > 192.168.43.147.7772: UDP, length 120
00:48:45.306482 IP 192.168.43.146.8880 > 192.168.43.147.7772: UDP, length 120
00:48:45.356478 IP 192.168.43.146.8880 > 192.168.43.147.7772: UDP, length 120
00:48:45.406480 IP 192.168.43.146.8880 > 192.168.43.147.7772: UDP, length 120
00:48:45.409937 IP 192.168.43.124.8880 > 192.168.43.146.7771: UDP, length 120
00:48:45.411160 IP 192.168.43.124.8880 > 192.168.43.146.7771: UDP, length 120
00:48:45.412287 IP 192.168.43.124.8880 > 192.168.43.146.7771: UDP, length 120
00:48:45.427391 IP 192.168.43.124.8880 > 192.168.43.146.7771: UDP, length 120
00:48:45.456484 IP 192.168.43.146.8880 > 192.168.43.147.7772: UDP, length 120
00:48:45.487055 IP 192.168.43.124.8880 > 192.168.43.146.7771: UDP, length 120
00:48:45.506481 IP 192.168.43.146.8880 > 192.168.43.147.7772: UDP, length 120
00:48:45.531869 IP 192.168.43.124.8880 > 192.168.43.146.7771: UDP, length 120
00:48:45.556521 IP 192.168.43.146.8880 > 192.168.43.147.7772: UDP, length 120
00:48:45.580883 IP 192.168.43.124.8880 > 192.168.43.146.7771: UDP, length 120
00:48:45.606485 IP 192.168.43.146.8880 > 192.168.43.147.7772: UDP, length 120
00:48:45.656482 IP 192.168.43.146.8880 > 192.168.43.147.7772: UDP, length 120
00:48:45.706480 IP 192.168.43.146.8880 > 192.168.43.147.7772: UDP, length 120
00:48:45.756555 IP 192.168.43.146.8880 > 192.168.43.147.7772: UDP, length 120
00:48:45.759203 IP 192.168.43.124.8880 > 192.168.43.146.7771: UDP, length 120
00:48:45.759452 IP 192.168.43.124.8880 > 192.168.43.146.7771: UDP, length 120
00:48:45.759608 IP 192.168.43.124.8880 > 192.168.43.146.7771: UDP, length 120
00:48:45.781388 IP 192.168.43.124.8880 > 192.168.43.146.7771: UDP, length 120
00:48:45.806560 IP 192.168.43.146.8880 > 192.168.43.147.7772: UDP, length 120
00:48:45.851982 IP 192.168.43.124.8880 > 192.168.43.146.7771: UDP, length 120
00:48:45.856568 IP 192.168.43.146.8880 > 192.168.43.147.7772: UDP, length 120
00:48:45.884384 IP 192.168.43.124.8880 > 192.168.43.146.7771: UDP, length 120
00:48:45.906535 IP 192.168.43.146.8880 > 192.168.43.147.7772: UDP, length 120
00:48:45.934986 IP 192.168.43.124.8880 > 192.168.43.146.7771: UDP, length 120
00:48:45.956518 IP 192.168.43.146.8880 > 192.168.43.147.7772: UDP, length 120
00:48:46.006503 IP 192.168.43.146.8880 > 192.168.43.147.7772: UDP, length 120
00:48:46.056495 IP 192.168.43.146.8880 > 192.168.43.147.7772: UDP, length 120
00:48:46.106125 IP 192.168.43.124.8880 > 192.168.43.146.7771: UDP, length 120
00:48:46.106513 IP 192.168.43.146.8880 > 192.168.43.147.7772: UDP, length 120
00:48:46.106559 IP 192.168.43.124.8880 > 192.168.43.146.7771: UDP, length 120
00:48:46.106713 IP 192.168.43.124.8880 > 192.168.43.146.7771: UDP, length 120
00:48:46.130581 IP 192.168.43.124.8880 > 192.168.43.146.7771: UDP, length 120
00:48:46.156526 IP 192.168.43.146.8880 > 192.168.43.147.7772: UDP, length 120
00:48:46.179822 IP 192.168.43.124.8880 > 192.168.43.146.7771: UDP, length 120
00:48:46.206578 IP 192.168.43.146.8880 > 192.168.43.147.7772: UDP, length 120
00:48:46.234913 IP 192.168.43.124.8880 > 192.168.43.146.7771: UDP, length 120
00:48:46.256649 IP 192.168.43.146.8880 > 192.168.43.147.7772: UDP, length 120
00:48:46.281980 IP 192.168.43.124.8880 > 192.168.43.146.7771: UDP, length 120
00:48:46.306614 IP 192.168.43.146.8880 > 192.168.43.147.7772: UDP, length 120
00:48:46.356508 IP 192.168.43.146.8880 > 192.168.43.147.7772: UDP, length 120
00:48:46.406555 IP 192.168.43.146.8880 > 192.168.43.147.7772: UDP, length 120
00:48:46.456546 IP 192.168.43.146.8880 > 192.168.43.147.7772: UDP, length 120
00:48:46.463908 IP 192.168.43.124.8880 > 192.168.43.146.7771: UDP, length 120
00:48:46.465127 IP 192.168.43.124.8880 > 192.168.43.146.7771: UDP, length 120
00:48:46.468665 IP 192.168.43.124.8880 > 192.168.43.146.7771: UDP, length 120
00:48:46.475938 IP 192.168.43.124.8880 > 192.168.43.146.7771: UDP, length 120
00:48:46.506526 IP 192.168.43.146.8880 > 192.168.43.147.7772: UDP, length 120
00:48:46.533368 IP 192.168.43.124.8880 > 192.168.43.146.7771: UDP, length 120
00:48:46.556559 IP 192.168.43.146.8880 > 192.168.43.147.7772: UDP, length 120
00:48:46.581503 IP 192.168.43.124.8880 > 192.168.43.146.7771: UDP, length 120
00:48:46.606569 IP 192.168.43.146.8880 > 192.168.43.147.7772: UDP, length 120
00:48:46.630324 IP 192.168.43.124.8880 > 192.168.43.146.7771: UDP, length 120
00:48:46.656512 IP 192.168.43.146.8880 > 192.168.43.147.7772: UDP, length 120
00:48:46.706462 IP 192.168.43.146.8880 > 192.168.43.147.7772: UDP, length 120
00:48:46.756456 IP 192.168.43.146.8880 > 192.168.43.147.7772: UDP, length 120
00:48:46.806454 IP 192.168.43.146.8880 > 192.168.43.147.7772: UDP, length 120
00:48:46.806992 IP 192.168.43.124.8880 > 192.168.43.146.7771: UDP, length 120
00:48:46.807188 IP 192.168.43.124.8880 > 192.168.43.146.7771: UDP, length 120
00:48:46.808373 IP 192.168.43.124.8880 > 192.168.43.146.7771: UDP, length 120
00:48:46.831440 IP 192.168.43.124.8880 > 192.168.43.146.7771: UDP, length 120
00:48:46.856461 IP 192.168.43.146.8880 > 192.168.43.147.7772: UDP, length 120
00:48:46.882883 IP 192.168.43.124.8880 > 192.168.43.146.7771: UDP, length 120
00:48:46.906535 IP 192.168.43.146.8880 > 192.168.43.147.7772: UDP, length 120
00:48:46.933396 IP 192.168.43.124.8880 > 192.168.43.146.7771: UDP, length 120
00:48:46.956504 IP 192.168.43.146.8880 > 192.168.43.147.7772: UDP, length 120
00:48:46.983957 IP 192.168.43.124.8880 > 192.168.43.146.7771: UDP, length 120
00:48:47.006494 IP 192.168.43.146.8880 > 192.168.43.147.7772: UDP, length 120
00:48:47.056494 IP 192.168.43.146.8880 > 192.168.43.147.7772: UDP, length 120
00:48:47.106460 IP 192.168.43.146.8880 > 192.168.43.147.7772: UDP, length 120
00:48:47.154147 IP 192.168.43.124.8880 > 192.168.43.146.7771: UDP, length 120
00:48:47.154333 IP 192.168.43.124.8880 > 192.168.43.146.7771: UDP, length 120
00:48:47.154407 IP 192.168.43.124.8880 > 192.168.43.146.7771: UDP, length 120
00:48:47.156458 IP 192.168.43.146.8880 > 192.168.43.147.7772: UDP, length 120
00:48:47.181406 IP 192.168.43.124.8880 > 192.168.43.146.7771: UDP, length 120
00:48:47.206456 IP 192.168.43.146.8880 > 192.168.43.147.7772: UDP, length 120
00:48:47.230514 IP 192.168.43.124.8880 > 192.168.43.146.7771: UDP, length 120
00:48:47.256454 IP 192.168.43.146.8880 > 192.168.43.147.7772: UDP, length 120
00:48:47.282828 IP 192.168.43.124.8880 > 192.168.43.146.7771: UDP, length 120
00:48:47.306455 IP 192.168.43.146.8880 > 192.168.43.147.7772: UDP, length 120
00:48:47.342922 IP 192.168.43.124.8880 > 192.168.43.146.7771: UDP, length 120
00:48:47.356456 IP 192.168.43.146.8880 > 192.168.43.147.7772: UDP, length 120
00:48:47.406455 IP 192.168.43.146.8880 > 192.168.43.147.7772: UDP, length 120
00:48:47.456451 IP 192.168.43.146.8880 > 192.168.43.147.7772: UDP, length 120
00:48:47.502376 IP 192.168.43.124.8880 > 192.168.43.146.7771: UDP, length 120
00:48:47.504262 IP 192.168.43.124.8880 > 192.168.43.146.7771: UDP, length 120
00:48:47.505410 IP 192.168.43.124.8880 > 192.168.43.146.7771: UDP, length 120
00:48:47.506453 IP 192.168.43.146.8880 > 192.168.43.147.7772: UDP, length 120
00:48:47.530562 IP 192.168.43.124.8880 > 192.168.43.146.7771: UDP, length 120
00:48:47.556457 IP 192.168.43.146.8880 > 192.168.43.147.7772: UDP, length 120
00:48:47.580447 IP 192.168.43.124.8880 > 192.168.43.146.7771: UDP, length 120
00:48:47.606454 IP 192.168.43.146.8880 > 192.168.43.147.7772: UDP, length 120
00:48:47.628816 IP 192.168.43.124.8880 > 192.168.43.146.7771: UDP, length 120
00:48:47.656484 IP 192.168.43.146.8880 > 192.168.43.147.7772: UDP, length 120
00:48:47.679547 IP 192.168.43.124.8880 > 192.168.43.146.7771: UDP, length 120
00:48:47.706492 IP 192.168.43.146.8880 > 192.168.43.147.7772: UDP, length 120
00:48:47.756489 IP 192.168.43.146.8880 > 192.168.43.147.7772: UDP, length 120
00:48:47.806481 IP 192.168.43.146.8880 > 192.168.43.147.7772: UDP, length 120
00:48:47.852088 IP 192.168.43.124.8880 > 192.168.43.146.7771: UDP, length 120
00:48:47.855265 IP 192.168.43.124.8880 > 192.168.43.146.7771: UDP, length 120
00:48:47.856480 IP 192.168.43.146.8880 > 192.168.43.147.7772: UDP, length 120
00:48:47.857853 IP 192.168.43.124.8880 > 192.168.43.146.7771: UDP, length 120
00:48:47.880398 IP 192.168.43.124.8880 > 192.168.43.146.7771: UDP, length 120
00:48:47.906481 IP 192.168.43.146.8880 > 192.168.43.147.7772: UDP, length 120
00:48:47.932666 IP 192.168.43.124.8880 > 192.168.43.146.7771: UDP, length 120
00:48:47.956543 IP 192.168.43.146.8880 > 192.168.43.147.7772: UDP, length 120
00:48:47.981888 IP 192.168.43.124.8880 > 192.168.43.146.7771: UDP, length 120
00:48:48.006516 IP 192.168.43.146.8880 > 192.168.43.147.7772: UDP, length 120
00:48:48.032041 IP 192.168.43.124.8880 > 192.168.43.146.7771: UDP, length 120
00:48:48.056500 IP 192.168.43.146.8880 > 192.168.43.147.7772: UDP, length 120
00:48:48.106483 IP 192.168.43.146.8880 > 192.168.43.147.7772: UDP, length 120
00:48:48.156485 IP 192.168.43.146.8880 > 192.168.43.147.7772: UDP, length 120
00:48:48.197912 IP 192.168.43.124.8880 > 192.168.43.146.7771: UDP, length 120
00:48:48.198374 IP 192.168.43.124.8880 > 192.168.43.146.7771: UDP, length 120
00:48:48.202020 IP 192.168.43.124.8880 > 192.168.43.146.7771: UDP, length 120
00:48:48.206479 IP 192.168.43.146.8880 > 192.168.43.147.7772: UDP, length 120
00:48:48.230652 IP 192.168.43.124.8880 > 192.168.43.146.7771: UDP, length 120
00:48:48.256480 IP 192.168.43.146.8880 > 192.168.43.147.7772: UDP, length 120
00:48:48.283704 IP 192.168.43.124.8880 > 192.168.43.146.7771: UDP, length 120
00:48:48.306479 IP 192.168.43.146.8880 > 192.168.43.147.7772: UDP, length 120
00:48:48.356480 IP 192.168.43.146.8880 > 192.168.43.147.7772: UDP, length 120
00:48:48.406481 IP 192.168.43.146.8880 > 192.168.43.147.7772: UDP, length 120
00:48:48.409922 IP 192.168.43.124.8880 > 192.168.43.146.7771: UDP, length 120
00:48:48.414202 IP 192.168.43.124.8880 > 192.168.43.146.7771: UDP, length 120
00:48:48.456484 IP 192.168.43.146.8880 > 192.168.43.147.7772: UDP, length 120
00:48:48.506480 IP 192.168.43.146.8880 > 192.168.43.147.7772: UDP, length 120
00:48:48.556287 IP 192.168.43.124.8880 > 192.168.43.146.7771: UDP, length 120
00:48:48.556563 IP 192.168.43.146.8880 > 192.168.43.147.7772: UDP, length 120
00:48:48.556720 IP 192.168.43.124.8880 > 192.168.43.146.7771: UDP, length 120
00:48:48.558871 IP 192.168.43.124.8880 > 192.168.43.146.7771: UDP, length 120
00:48:48.582184 IP 192.168.43.124.8880 > 192.168.43.146.7771: UDP, length 120
00:48:48.606488 IP 192.168.43.146.8880 > 192.168.43.147.7772: UDP, length 120
00:48:48.656482 IP 192.168.43.146.8880 > 192.168.43.147.7772: UDP, length 120
00:48:48.706480 IP 192.168.43.146.8880 > 192.168.43.147.7772: UDP, length 120
00:48:48.737451 IP 192.168.43.124.8880 > 192.168.43.146.7771: UDP, length 120
00:48:48.756481 IP 192.168.43.146.8880 > 192.168.43.147.7772: UDP, length 120
00:48:48.806481 IP 192.168.43.146.8880 > 192.168.43.147.7772: UDP, length 120
