03:21:45.877710 IP 192.168.43.147.8880 > 192.168.43.124.7773: UDP, length 120
03:21:45.927749 IP 192.168.43.147.8880 > 192.168.43.124.7773: UDP, length 120
03:21:45.977735 IP 192.168.43.147.8880 > 192.168.43.124.7773: UDP, length 120
03:21:46.027733 IP 192.168.43.147.8880 > 192.168.43.124.7773: UDP, length 120
03:21:46.077735 IP 192.168.43.147.8880 > 192.168.43.124.7773: UDP, length 120
03:21:46.127732 IP 192.168.43.147.8880 > 192.168.43.124.7773: UDP, length 120
03:21:46.177733 IP 192.168.43.147.8880 > 192.168.43.124.7773: UDP, length 120
03:21:46.227780 IP 192.168.43.147.8880 > 192.168.43.124.7773: UDP, length 120
03:21:46.277739 IP 192.168.43.147.8880 > 192.168.43.124.7773: UDP, length 120
03:21:46.327734 IP 192.168.43.147.8880 > 192.168.43.124.7773: UDP, length 120
03:21:46.377733 IP 192.168.43.147.8880 > 192.168.43.124.7773: UDP, length 120
03:21:46.427734 IP 192.168.43.147.8880 > 192.168.43.124.7773: UDP, length 120
03:21:46.477752 IP 192.168.43.147.8880 > 192.168.43.124.7773: UDP, length 120
03:21:46.527735 IP 192.168.43.147.8880 > 192.168.43.124.7773: UDP, length 120
03:21:46.577733 IP 192.168.43.147.8880 > 192.168.43.124.7773: UDP, length 120
03:21:46.627734 IP 192.168.43.147.8880 > 192.168.43.124.7773: UDP, length 120
03:21:46.677734 IP 192.168.43.147.8880 > 192.168.43.124.7773: UDP, length 120
03:21:46.727732 IP 192.168.43.147.8880 > 192.168.43.124.7773: UDP, length 120
03:21:46.777742 IP 192.168.43.147.8880 > 192.168.43.124.7773: UDP, length 120
03:21:46.827735 IP 192.168.43.147.8880 > 192.168.43.124.7773: UDP, length 120
03:21:46.877732 IP 192.168.43.147.8880 > 192.168.43.124.7773: UDP, length 120
03:21:46.927758 IP 192.168.43.147.8880 > 192.168.43.124.7773: UDP, length 120
03:21:46.977761 IP 192.168.43.147.8880 > 192.168.43.124.7773: UDP, length 120
03:21:47.027759 IP 192.168.43.147.8880 > 192.168.43.124.7773: UDP, length 120
03:21:47.077759 IP 192.168.43.147.8880 > 192.168.43.124.7773: UDP, length 120
03:21:47.127757 IP 192.168.43.147.8880 > 192.168.43.124.7773: UDP, length 120
03:21:47.177756 IP 192.168.43.147.8880 > 192.168.43.124.7773: UDP, length 120
03:21:47.227758 IP 192.168.43.147.8880 > 192.168.43.124.7773: UDP, length 120
03:21:47.277758 IP 192.168.43.147.8880 > 192.168.43.124.7773: UDP, length 120
03:21:47.327757 IP 192.168.43.147.8880 > 192.168.43.124.7773: UDP, length 120
03:21:47.377756 IP 192.168.43.147.8880 > 192.168.43.124.7773: UDP, length 120
03:21:47.427755 IP 192.168.43.147.8880 > 192.168.43.124.7773: UDP, length 120
03:21:47.477759 IP 192.168.43.147.8880 > 192.168.43.124.7773: UDP, length 120
03:21:47.527765 IP 192.168.43.147.8880 > 192.168.43.124.7773: UDP, length 120
03:21:47.577757 IP 192.168.43.147.8880 > 192.168.43.124.7773: UDP, length 120
03:21:47.627756 IP 192.168.43.147.8880 > 192.168.43.124.7773: UDP, length 120
03:21:47.677764 IP 192.168.43.147.8880 > 192.168.43.124.7773: UDP, length 120
03:21:47.727820 IP 192.168.43.147.8880 > 192.168.43.124.7773: UDP, length 120
03:21:47.777776 IP 192.168.43.147.8880 > 192.168.43.124.7773: UDP, length 120
03:21:47.827765 IP 192.168.43.147.8880 > 192.168.43.124.7773: UDP, length 120
03:21:47.877759 IP 192.168.43.147.8880 > 192.168.43.124.7773: UDP, length 120
03:21:47.927759 IP 192.168.43.147.8880 > 192.168.43.124.7773: UDP, length 120
03:21:47.977764 IP 192.168.43.147.8880 > 192.168.43.124.7773: UDP, length 120
03:21:48.027757 IP 192.168.43.147.8880 > 192.168.43.124.7773: UDP, length 120
03:21:48.077765 IP 192.168.43.147.8880 > 192.168.43.124.7773: UDP, length 120
03:21:48.127764 IP 192.168.43.147.8880 > 192.168.43.124.7773: UDP, length 120
03:21:48.177757 IP 192.168.43.147.8880 > 192.168.43.124.7773: UDP, length 120
03:21:48.227756 IP 192.168.43.147.8880 > 192.168.43.124.7773: UDP, length 120
03:21:48.277763 IP 192.168.43.147.8880 > 192.168.43.124.7773: UDP, length 120
03:21:48.327765 IP 192.168.43.147.8880 > 192.168.43.124.7773: UDP, length 120
03:21:48.377763 IP 192.168.43.147.8880 > 192.168.43.124.7773: UDP, length 120
03:21:48.427762 IP 192.168.43.147.8880 > 192.168.43.124.7773: UDP, length 120
03:21:48.477758 IP 192.168.43.147.8880 > 192.168.43.124.7773: UDP, length 120
03:21:48.527758 IP 192.168.43.147.8880 > 192.168.43.124.7773: UDP, length 120
03:21:48.577763 IP 192.168.43.147.8880 > 192.168.43.124.7773: UDP, length 120
03:21:48.627760 IP 192.168.43.147.8880 > 192.168.43.124.7773: UDP, length 120
03:21:48.677758 IP 192.168.43.147.8880 > 192.168.43.124.7773: UDP, length 120
03:21:48.727760 IP 192.168.43.147.8880 > 192.168.43.124.7773: UDP, length 120
03:21:48.777760 IP 192.168.43.147.8880 > 192.168.43.124.7773: UDP, length 120
03:21:48.827768 IP 192.168.43.147.8880 > 192.168.43.124.7773: UDP, length 120
03:21:48.877758 IP 192.168.43.147.8880 > 192.168.43.124.7773: UDP, length 120
03:21:48.927757 IP 192.168.43.147.8880 > 192.168.43.124.7773: UDP, length 120
03:21:48.977757 IP 192.168.43.147.8880 > 192.168.43.124.7773: UDP, length 120
03:21:49.027759 IP 192.168.43.147.8880 > 192.168.43.124.7773: UDP, length 120
03:21:49.077764 IP 192.168.43.147.8880 > 192.168.43.124.7773: UDP, length 120
03:21:49.127762 IP 192.168.43.147.8880 > 192.168.43.124.7773: UDP, length 120
03:21:49.177758 IP 192.168.43.147.8880 > 192.168.43.124.7773: UDP, length 120
03:21:49.227823 IP 192.168.43.147.8880 > 192.168.43.124.7773: UDP, length 120
03:21:49.277771 IP 192.168.43.147.8880 > 192.168.43.124.7773: UDP, length 120
03:21:49.327760 IP 192.168.43.147.8880 > 192.168.43.124.7773: UDP, length 120
03:21:49.377758 IP 192.168.43.147.8880 > 192.168.43.124.7773: UDP, length 120
03:21:49.427758 IP 192.168.43.147.8880 > 192.168.43.124.7773: UDP, length 120
03:21:49.477758 IP 192.168.43.147.8880 > 192.168.43.124.7773: UDP, length 120
03:21:49.527759 IP 192.168.43.147.8880 > 192.168.43.124.7773: UDP, length 120
03:21:49.577768 IP 192.168.43.147.8880 > 192.168.43.124.7773: UDP, length 120
03:21:49.627764 IP 192.168.43.147.8880 > 192.168.43.124.7773: UDP, length 120
03:21:49.677767 IP 192.168.43.147.8880 > 192.168.43.124.7773: UDP, length 120
03:21:49.727759 IP 192.168.43.147.8880 > 192.168.43.124.7773: UDP, length 120
03:21:49.777777 IP 192.168.43.147.8880 > 192.168.43.124.7773: UDP, length 120
03:21:49.827761 IP 192.168.43.147.8880 > 192.168.43.124.7773: UDP, length 120
03:21:49.877761 IP 192.168.43.147.8880 > 192.168.43.124.7773: UDP, length 120
03:21:49.927761 IP 192.168.43.147.8880 > 192.168.43.124.7773: UDP, length 120
03:21:49.977760 IP 192.168.43.147.8880 > 192.168.43.124.7773: UDP, length 120
03:21:50.027758 IP 192.168.43.147.8880 > 192.168.43.124.7773: UDP, length 120
03:21:50.077760 IP 192.168.43.147.8880 > 192.168.43.124.7773: UDP, length 120
03:21:50.127761 IP 192.168.43.147.8880 > 192.168.43.124.7773: UDP, length 120
03:21:50.177757 IP 192.168.43.147.8880 > 192.168.43.124.7773: UDP, length 120
03:21:50.227757 IP 192.168.43.147.8880 > 192.168.43.124.7773: UDP, length 120
03:21:50.277757 IP 192.168.43.147.8880 > 192.168.43.124.7773: UDP, length 120
03:21:50.327757 IP 192.168.43.147.8880 > 192.168.43.124.7773: UDP, length 120
03:21:50.377756 IP 192.168.43.147.8880 > 192.168.43.124.7773: UDP, length 120
03:21:50.427757 IP 192.168.43.147.8880 > 192.168.43.124.7773: UDP, length 120
03:21:50.477759 IP 192.168.43.147.8880 > 192.168.43.124.7773: UDP, length 120
03:21:50.527758 IP 192.168.43.147.8880 > 192.168.43.124.7773: UDP, length 120
03:21:50.577756 IP 192.168.43.147.8880 > 192.168.43.124.7773: UDP, length 120
03:21:50.627758 IP 192.168.43.147.8880 > 192.168.43.124.7773: UDP, length 120
03:21:50.677761 IP 192.168.43.147.8880 > 192.168.43.124.7773: UDP, length 120
03:21:50.727815 IP 192.168.43.147.8880 > 192.168.43.124.7773: UDP, length 120
03:21:50.777779 IP 192.168.43.147.8880 > 192.168.43.124.7773: UDP, length 120
03:21:50.827764 IP 192.168.43.147.8880 > 192.168.43.124.7773: UDP, length 120
03:21:50.877844 IP 192.168.43.147.8880 > 192.168.43.124.7773: UDP, length 120
03:21:50.927905 IP 192.168.43.147.8880 > 192.168.43.124.7773: UDP, length 120
03:21:50.977878 IP 192.168.43.147.8880 > 192.168.43.124.7773: UDP, length 120
03:21:51.027780 IP 192.168.43.147.8880 > 192.168.43.124.7773: UDP, length 120
03:21:51.077817 IP 192.168.43.147.8880 > 192.168.43.124.7773: UDP, length 120
03:21:51.127867 IP 192.168.43.147.8880 > 192.168.43.124.7773: UDP, length 120
03:21:51.177796 IP 192.168.43.147.8880 > 192.168.43.124.7773: UDP, length 120
03:21:51.227799 IP 192.168.43.147.8880 > 192.168.43.124.7773: UDP, length 120
03:21:51.277806 IP 192.168.43.147.8880 > 192.168.43.124.7773: UDP, length 120
03:21:51.327784 IP 192.168.43.147.8880 > 192.168.43.124.7773: UDP, length 120
03:21:51.377736 IP 192.168.43.147.8880 > 192.168.43.124.7773: UDP, length 120
03:21:51.427734 IP 192.168.43.147.8880 > 192.168.43.124.7773: UDP, length 120
03:21:51.477736 IP 192.168.43.147.8880 > 192.168.43.124.7773: UDP, length 120
03:21:51.527739 IP 192.168.43.147.8880 > 192.168.43.124.7773: UDP, length 120
03:21:51.577736 IP 192.168.43.147.8880 > 192.168.43.124.7773: UDP, length 120
03:21:51.627735 IP 192.168.43.147.8880 > 192.168.43.124.7773: UDP, length 120
03:21:51.677733 IP 192.168.43.147.8880 > 192.168.43.124.7773: UDP, length 120
03:21:51.727734 IP 192.168.43.147.8880 > 192.168.43.124.7773: UDP, length 120
03:21:51.777739 IP 192.168.43.147.8880 > 192.168.43.124.7773: UDP, length 120
03:21:51.827736 IP 192.168.43.147.8880 > 192.168.43.124.7773: UDP, length 120
03:21:51.877733 IP 192.168.43.147.8880 > 192.168.43.124.7773: UDP, length 120
03:21:51.927763 IP 192.168.43.147.8880 > 192.168.43.124.7773: UDP, length 120
03:21:51.977758 IP 192.168.43.147.8880 > 192.168.43.124.7773: UDP, length 120
03:21:52.027759 IP 192.168.43.147.8880 > 192.168.43.124.7773: UDP, length 120
03:21:52.077759 IP 192.168.43.147.8880 > 192.168.43.124.7773: UDP, length 120
03:21:52.127762 IP 192.168.43.147.8880 > 192.168.43.124.7773: UDP, length 120
03:21:52.177762 IP 192.168.43.147.8880 > 192.168.43.124.7773: UDP, length 120
03:21:52.227816 IP 192.168.43.147.8880 > 192.168.43.124.7773: UDP, length 120
03:21:52.277770 IP 192.168.43.147.8880 > 192.168.43.124.7773: UDP, length 120
03:21:52.327761 IP 192.168.43.147.8880 > 192.168.43.124.7773: UDP, length 120
03:21:52.377764 IP 192.168.43.147.8880 > 192.168.43.124.7773: UDP, length 120
03:21:52.427764 IP 192.168.43.147.8880 > 192.168.43.124.7773: UDP, length 120
03:21:52.477761 IP 192.168.43.147.8880 > 192.168.43.124.7773: UDP, length 120
03:21:52.527760 IP 192.168.43.147.8880 > 192.168.43.124.7773: UDP, length 120
03:21:52.577759 IP 192.168.43.147.8880 > 192.168.43.124.7773: UDP, length 120
03:21:52.627758 IP 192.168.43.147.8880 > 192.168.43.124.7773: UDP, length 120
03:21:52.677762 IP 192.168.43.147.8880 > 192.168.43.124.7773: UDP, length 120
03:21:52.727759 IP 192.168.43.147.8880 > 192.168.43.124.7773: UDP, length 120
03:21:52.777763 IP 192.168.43.147.8880 > 192.168.43.124.7773: UDP, length 120
03:21:52.827776 IP 192.168.43.147.8880 > 192.168.43.124.7773: UDP, length 120
03:21:52.877759 IP 192.168.43.147.8880 > 192.168.43.124.7773: UDP, length 120
03:21:52.927759 IP 192.168.43.147.8880 > 192.168.43.124.7773: UDP, length 120
03:21:52.977759 IP 192.168.43.147.8880 > 192.168.43.124.7773: UDP, length 120
03:21:53.027759 IP 192.168.43.147.8880 > 192.168.43.124.7773: UDP, length 120
03:21:53.077754 IP 192.168.43.147.8880 > 192.168.43.124.7773: UDP, length 120
03:21:53.127758 IP 192.168.43.147.8880 > 192.168.43.124.7773: UDP, length 120
03:21:53.177758 IP 192.168.43.147.8880 > 192.168.43.124.7773: UDP, length 120
03:21:53.227762 IP 192.168.43.147.8880 > 192.168.43.124.7773: UDP, length 120
03:21:53.277757 IP 192.168.43.147.8880 > 192.168.43.124.7773: UDP, length 120
03:21:53.327757 IP 192.168.43.147.8880 > 192.168.43.124.7773: UDP, length 120
03:21:53.377757 IP 192.168.43.147.8880 > 192.168.43.124.7773: UDP, length 120
03:21:53.427758 IP 192.168.43.147.8880 > 192.168.43.124.7773: UDP, length 120
03:21:53.477760 IP 192.168.43.147.8880 > 192.168.43.124.7773: UDP, length 120
03:21:53.527760 IP 192.168.43.147.8880 > 192.168.43.124.7773: UDP, length 120
03:21:53.577757 IP 192.168.43.147.8880 > 192.168.43.124.7773: UDP, length 120
03:21:53.627757 IP 192.168.43.147.8880 > 192.168.43.124.7773: UDP, length 120
03:21:53.677758 IP 192.168.43.147.8880 > 192.168.43.124.7773: UDP, length 120
03:21:53.727818 IP 192.168.43.147.8880 > 192.168.43.124.7773: UDP, length 120
03:21:53.777779 IP 192.168.43.147.8880 > 192.168.43.124.7773: UDP, length 120
03:21:53.827767 IP 192.168.43.147.8880 > 192.168.43.124.7773: UDP, length 120
03:21:53.877765 IP 192.168.43.147.8880 > 192.168.43.124.7773: UDP, length 120
03:21:53.927765 IP 192.168.43.147.8880 > 192.168.43.124.7773: UDP, length 120
03:21:53.977758 IP 192.168.43.147.8880 > 192.168.43.124.7773: UDP, length 120
03:21:54.027759 IP 192.168.43.147.8880 > 192.168.43.124.7773: UDP, length 120
03:21:54.077759 IP 192.168.43.147.8880 > 192.168.43.124.7773: UDP, length 120
03:21:54.127756 IP 192.168.43.147.8880 > 192.168.43.124.7773: UDP, length 120
03:21:54.177756 IP 192.168.43.147.8880 > 192.168.43.124.7773: UDP, length 120
03:21:54.227760 IP 192.168.43.147.8880 > 192.168.43.124.7773: UDP, length 120
03:21:54.277763 IP 192.168.43.147.8880 > 192.168.43.124.7773: UDP, length 120
03:21:54.327761 IP 192.168.43.147.8880 > 192.168.43.124.7773: UDP, length 120
03:21:54.377757 IP 192.168.43.147.8880 > 192.168.43.124.7773: UDP, length 120
03:21:54.427755 IP 192.168.43.147.8880 > 192.168.43.124.7773: UDP, length 120
03:21:54.477776 IP 192.168.43.147.8880 > 192.168.43.124.7773: UDP, length 120
03:21:54.527762 IP 192.168.43.147.8880 > 192.168.43.124.7773: UDP, length 120
03:21:54.577757 IP 192.168.43.147.8880 > 192.168.43.124.7773: UDP, length 120
03:21:54.627761 IP 192.168.43.147.8880 > 192.168.43.124.7773: UDP, length 120
03:21:54.677760 IP 192.168.43.147.8880 > 192.168.43.124.7773: UDP, length 120
03:21:54.727758 IP 192.168.43.147.8880 > 192.168.43.124.7773: UDP, length 120
03:21:54.777758 IP 192.168.43.147.8880 > 192.168.43.124.7773: UDP, length 120
03:21:54.827759 IP 192.168.43.147.8880 > 192.168.43.124.7773: UDP, length 120
03:21:54.877765 IP 192.168.43.147.8880 > 192.168.43.124.7773: UDP, length 120
03:21:54.927763 IP 192.168.43.147.8880 > 192.168.43.124.7773: UDP, length 120
03:21:54.977756 IP 192.168.43.147.8880 > 192.168.43.124.7773: UDP, length 120
03:21:55.027762 IP 192.168.43.147.8880 > 192.168.43.124.7773: UDP, length 120
03:21:55.077760 IP 192.168.43.147.8880 > 192.168.43.124.7773: UDP, length 120
03:21:55.127758 IP 192.168.43.147.8880 > 192.168.43.124.7773: UDP, length 120
03:21:55.177759 IP 192.168.43.147.8880 > 192.168.43.124.7773: UDP, length 120
03:21:55.227822 IP 192.168.43.147.8880 > 192.168.43.124.7773: UDP, length 120
03:21:55.277770 IP 192.168.43.147.8880 > 192.168.43.124.7773: UDP, length 120
03:21:55.327763 IP 192.168.43.147.8880 > 192.168.43.124.7773: UDP, length 120
03:21:55.377755 IP 192.168.43.147.8880 > 192.168.43.124.7773: UDP, length 120
03:21:55.427759 IP 192.168.43.147.8880 > 192.168.43.124.7773: UDP, length 120
03:21:55.477758 IP 192.168.43.147.8880 > 192.168.43.124.7773: UDP, length 120
03:21:55.527760 IP 192.168.43.147.8880 > 192.168.43.124.7773: UDP, length 120
03:21:55.577758 IP 192.168.43.147.8880 > 192.168.43.124.7773: UDP, length 120
03:21:55.627760 IP 192.168.43.147.8880 > 192.168.43.124.7773: UDP, length 120
03:21:55.677757 IP 192.168.43.147.8880 > 192.168.43.124.7773: UDP, length 120
03:21:55.727758 IP 192.168.43.147.8880 > 192.168.43.124.7773: UDP, length 120
03:21:55.777778 IP 192.168.43.147.8880 > 192.168.43.124.7773: UDP, length 120
03:21:55.827764 IP 192.168.43.147.8880 > 192.168.43.124.7773: UDP, length 120
03:21:55.877758 IP 192.168.43.147.8880 > 192.168.43.124.7773: UDP, length 120
03:21:55.927760 IP 192.168.43.147.8880 > 192.168.43.124.7773: UDP, length 120
03:21:55.977760 IP 192.168.43.147.8880 > 192.168.43.124.7773: UDP, length 120
03:21:56.027765 IP 192.168.43.147.8880 > 192.168.43.124.7773: UDP, length 120
03:21:56.077761 IP 192.168.43.147.8880 > 192.168.43.124.7773: UDP, length 120
03:21:56.127758 IP 192.168.43.147.8880 > 192.168.43.124.7773: UDP, length 120
03:21:56.177757 IP 192.168.43.147.8880 > 192.168.43.124.7773: UDP, length 120
03:21:56.227756 IP 192.168.43.147.8880 > 192.168.43.124.7773: UDP, length 120
03:21:56.277759 IP 192.168.43.147.8880 > 192.168.43.124.7773: UDP, length 120
03:21:56.327827 IP 192.168.43.147.8880 > 192.168.43.124.7773: UDP, length 120
03:21:56.377834 IP 192.168.43.147.8880 > 192.168.43.124.7773: UDP, length 120
03:21:56.427837 IP 192.168.43.147.8880 > 192.168.43.124.7773: UDP, length 120
03:21:56.477808 IP 192.168.43.147.8880 > 192.168.43.124.7773: UDP, length 120
03:21:56.527794 IP 192.168.43.147.8880 > 192.168.43.124.7773: UDP, length 120
03:21:56.577792 IP 192.168.43.147.8880 > 192.168.43.124.7773: UDP, length 120
03:21:56.627815 IP 192.168.43.147.8880 > 192.168.43.124.7773: UDP, length 120
03:21:56.677813 IP 192.168.43.147.8880 > 192.168.43.124.7773: UDP, length 120
03:21:56.727796 IP 192.168.43.147.8880 > 192.168.43.124.7773: UDP, length 120
03:21:56.777782 IP 192.168.43.147.8880 > 192.168.43.124.7773: UDP, length 120
03:21:56.827738 IP 192.168.43.147.8880 > 192.168.43.124.7773: UDP, length 120
03:21:56.877735 IP 192.168.43.147.8880 > 192.168.43.124.7773: UDP, length 120
03:21:56.927763 IP 192.168.43.147.8880 > 192.168.43.124.7773: UDP, length 120
03:21:56.977761 IP 192.168.43.147.8880 > 192.168.43.124.7773: UDP, length 120
03:21:57.027762 IP 192.168.43.147.8880 > 192.168.43.124.7773: UDP, length 120
03:21:57.077757 IP 192.168.43.147.8880 > 192.168.43.124.7773: UDP, length 120
03:21:57.127762 IP 192.168.43.147.8880 > 192.168.43.124.7773: UDP, length 120
03:21:57.177758 IP 192.168.43.147.8880 > 192.168.43.124.7773: UDP, length 120
03:21:57.227758 IP 192.168.43.147.8880 > 192.168.43.124.7773: UDP, length 120
03:21:57.277759 IP 192.168.43.147.8880 > 192.168.43.124.7773: UDP, length 120
03:21:57.327758 IP 192.168.43.147.8880 > 192.168.43.124.7773: UDP, length 120
03:21:57.377757 IP 192.168.43.147.8880 > 192.168.43.124.7773: UDP, length 120
03:21:57.427757 IP 192.168.43.147.8880 > 192.168.43.124.7773: UDP, length 120
03:21:57.477763 IP 192.168.43.147.8880 > 192.168.43.124.7773: UDP, length 120
03:21:57.527757 IP 192.168.43.147.8880 > 192.168.43.124.7773: UDP, length 120
03:21:57.577757 IP 192.168.43.147.8880 > 192.168.43.124.7773: UDP, length 120
03:21:57.627763 IP 192.168.43.147.8880 > 192.168.43.124.7773: UDP, length 120
03:21:57.677760 IP 192.168.43.147.8880 > 192.168.43.124.7773: UDP, length 120
03:21:57.727764 IP 192.168.43.147.8880 > 192.168.43.124.7773: UDP, length 120
03:21:57.777757 IP 192.168.43.147.8880 > 192.168.43.124.7773: UDP, length 120
03:21:57.827761 IP 192.168.43.147.8880 > 192.168.43.124.7773: UDP, length 120
03:21:57.877759 IP 192.168.43.147.8880 > 192.168.43.124.7773: UDP, length 120
03:21:57.927763 IP 192.168.43.147.8880 > 192.168.43.124.7773: UDP, length 120
03:21:57.977756 IP 192.168.43.147.8880 > 192.168.43.124.7773: UDP, length 120
03:21:58.027760 IP 192.168.43.147.8880 > 192.168.43.124.7773: UDP, length 120
03:21:58.077762 IP 192.168.43.147.8880 > 192.168.43.124.7773: UDP, length 120
03:21:58.127757 IP 192.168.43.147.8880 > 192.168.43.124.7773: UDP, length 120
03:21:58.177754 IP 192.168.43.147.8880 > 192.168.43.124.7773: UDP, length 120
03:21:58.227817 IP 192.168.43.147.8880 > 192.168.43.124.7773: UDP, length 120
03:21:58.277771 IP 192.168.43.147.8880 > 192.168.43.124.7773: UDP, length 120
03:21:58.327760 IP 192.168.43.147.8880 > 192.168.43.124.7773: UDP, length 120
03:21:58.377759 IP 192.168.43.147.8880 > 192.168.43.124.7773: UDP, length 120
03:21:58.427760 IP 192.168.43.147.8880 > 192.168.43.124.7773: UDP, length 120
03:21:58.477760 IP 192.168.43.147.8880 > 192.168.43.124.7773: UDP, length 120
03:21:58.527759 IP 192.168.43.147.8880 > 192.168.43.124.7773: UDP, length 120
03:21:58.577759 IP 192.168.43.147.8880 > 192.168.43.124.7773: UDP, length 120
03:21:58.627760 IP 192.168.43.147.8880 > 192.168.43.124.7773: UDP, length 120
03:21:58.677760 IP 192.168.43.147.8880 > 192.168.43.124.7773: UDP, length 120
03:21:58.727759 IP 192.168.43.147.8880 > 192.168.43.124.7773: UDP, length 120
03:21:58.777761 IP 192.168.43.147.8880 > 192.168.43.124.7773: UDP, length 120
03:21:58.827760 IP 192.168.43.147.8880 > 192.168.43.124.7773: UDP, length 120
03:21:58.877758 IP 192.168.43.147.8880 > 192.168.43.124.7773: UDP, length 120
03:21:58.927760 IP 192.168.43.147.8880 > 192.168.43.124.7773: UDP, length 120
03:21:58.977757 IP 192.168.43.147.8880 > 192.168.43.124.7773: UDP, length 120
03:21:59.027758 IP 192.168.43.147.8880 > 192.168.43.124.7773: UDP, length 120
03:21:59.077759 IP 192.168.43.147.8880 > 192.168.43.124.7773: UDP, length 120
03:21:59.127758 IP 192.168.43.147.8880 > 192.168.43.124.7773: UDP, length 120
03:21:59.177760 IP 192.168.43.147.8880 > 192.168.43.124.7773: UDP, length 120
03:21:59.227762 IP 192.168.43.147.8880 > 192.168.43.124.7773: UDP, length 120
03:21:59.277760 IP 192.168.43.147.8880 > 192.168.43.124.7773: UDP, length 120
03:21:59.327761 IP 192.168.43.147.8880 > 192.168.43.124.7773: UDP, length 120
03:21:59.377758 IP 192.168.43.147.8880 > 192.168.43.124.7773: UDP, length 120
03:21:59.427757 IP 192.168.43.147.8880 > 192.168.43.124.7773: UDP, length 120
03:21:59.477759 IP 192.168.43.147.8880 > 192.168.43.124.7773: UDP, length 120
03:21:59.527771 IP 192.168.43.147.8880 > 192.168.43.124.7773: UDP, length 120
03:21:59.577760 IP 192.168.43.147.8880 > 192.168.43.124.7773: UDP, length 120
03:21:59.627760 IP 192.168.43.147.8880 > 192.168.43.124.7773: UDP, length 120
03:21:59.677759 IP 192.168.43.147.8880 > 192.168.43.124.7773: UDP, length 120
03:21:59.727815 IP 192.168.43.147.8880 > 192.168.43.124.7773: UDP, length 120
03:21:59.777781 IP 192.168.43.147.8880 > 192.168.43.124.7773: UDP, length 120
03:21:59.827761 IP 192.168.43.147.8880 > 192.168.43.124.7773: UDP, length 120
03:21:59.877761 IP 192.168.43.147.8880 > 192.168.43.124.7773: UDP, length 120
03:21:59.927759 IP 192.168.43.147.8880 > 192.168.43.124.7773: UDP, length 120
03:21:59.977759 IP 192.168.43.147.8880 > 192.168.43.124.7773: UDP, length 120
03:22:00.027757 IP 192.168.43.147.8880 > 192.168.43.124.7773: UDP, length 120
03:22:00.077757 IP 192.168.43.147.8880 > 192.168.43.124.7773: UDP, length 120
03:22:00.127758 IP 192.168.43.147.8880 > 192.168.43.124.7773: UDP, length 120
03:22:00.177758 IP 192.168.43.147.8880 > 192.168.43.124.7773: UDP, length 120
03:22:00.227766 IP 192.168.43.147.8880 > 192.168.43.124.7773: UDP, length 120
03:22:00.277759 IP 192.168.43.147.8880 > 192.168.43.124.7773: UDP, length 120
03:22:00.327764 IP 192.168.43.147.8880 > 192.168.43.124.7773: UDP, length 120
03:22:00.377759 IP 192.168.43.147.8880 > 192.168.43.124.7773: UDP, length 120
03:22:00.427759 IP 192.168.43.147.8880 > 192.168.43.124.7773: UDP, length 120
03:22:00.477760 IP 192.168.43.147.8880 > 192.168.43.124.7773: UDP, length 120
03:22:00.527764 IP 192.168.43.147.8880 > 192.168.43.124.7773: UDP, length 120
03:22:00.577758 IP 192.168.43.147.8880 > 192.168.43.124.7773: UDP, length 120
03:22:00.627764 IP 192.168.43.147.8880 > 192.168.43.124.7773: UDP, length 120
03:22:00.677763 IP 192.168.43.147.8880 > 192.168.43.124.7773: UDP, length 120
03:22:00.727766 IP 192.168.43.147.8880 > 192.168.43.124.7773: UDP, length 120
03:22:00.777760 IP 192.168.43.147.8880 > 192.168.43.124.7773: UDP, length 120
03:22:00.827764 IP 192.168.43.147.8880 > 192.168.43.124.7773: UDP, length 120
03:22:00.877758 IP 192.168.43.147.8880 > 192.168.43.124.7773: UDP, length 120
03:22:00.927762 IP 192.168.43.147.8880 > 192.168.43.124.7773: UDP, length 120
03:22:00.977763 IP 192.168.43.147.8880 > 192.168.43.124.7773: UDP, length 120
03:22:01.027828 IP 192.168.43.147.8880 > 192.168.43.124.7773: UDP, length 120
03:22:01.077768 IP 192.168.43.147.8880 > 192.168.43.124.7773: UDP, length 120
03:22:01.127757 IP 192.168.43.147.8880 > 192.168.43.124.7773: UDP, length 120
03:22:01.177758 IP 192.168.43.147.8880 > 192.168.43.124.7773: UDP, length 120
03:22:01.227814 IP 192.168.43.147.8880 > 192.168.43.124.7773: UDP, length 120
03:22:01.277788 IP 192.168.43.147.8880 > 192.168.43.124.7773: UDP, length 120
03:22:01.327761 IP 192.168.43.147.8880 > 192.168.43.124.7773: UDP, length 120
03:22:01.377760 IP 192.168.43.147.8880 > 192.168.43.124.7773: UDP, length 120
03:22:01.427757 IP 192.168.43.147.8880 > 192.168.43.124.7773: UDP, length 120
03:22:01.477758 IP 192.168.43.147.8880 > 192.168.43.124.7773: UDP, length 120
03:22:01.527757 IP 192.168.43.147.8880 > 192.168.43.124.7773: UDP, length 120
03:22:01.577762 IP 192.168.43.147.8880 > 192.168.43.124.7773: UDP, length 120
03:22:01.627769 IP 192.168.43.147.8880 > 192.168.43.124.7773: UDP, length 120
03:22:01.677762 IP 192.168.43.147.8880 > 192.168.43.124.7773: UDP, length 120
03:22:01.727759 IP 192.168.43.147.8880 > 192.168.43.124.7773: UDP, length 120
03:22:01.777824 IP 192.168.43.147.8880 > 192.168.43.124.7773: UDP, length 120
03:22:01.827869 IP 192.168.43.147.8880 > 192.168.43.124.7773: UDP, length 120
03:22:01.877847 IP 192.168.43.147.8880 > 192.168.43.124.7773: UDP, length 120
03:22:01.927817 IP 192.168.43.147.8880 > 192.168.43.124.7773: UDP, length 120
03:22:01.977819 IP 192.168.43.147.8880 > 192.168.43.124.7773: UDP, length 120
03:22:02.027797 IP 192.168.43.147.8880 > 192.168.43.124.7773: UDP, length 120
03:22:02.077808 IP 192.168.43.147.8880 > 192.168.43.124.7773: UDP, length 120
03:22:02.127827 IP 192.168.43.147.8880 > 192.168.43.124.7773: UDP, length 120
03:22:02.177834 IP 192.168.43.147.8880 > 192.168.43.124.7773: UDP, length 120
03:22:02.227841 IP 192.168.43.147.8880 > 192.168.43.124.7773: UDP, length 120
03:22:02.277781 IP 192.168.43.147.8880 > 192.168.43.124.7773: UDP, length 120
03:22:02.327738 IP 192.168.43.147.8880 > 192.168.43.124.7773: UDP, length 120
03:22:02.377736 IP 192.168.43.147.8880 > 192.168.43.124.7773: UDP, length 120
03:22:02.427735 IP 192.168.43.147.8880 > 192.168.43.124.7773: UDP, length 120
03:22:02.477733 IP 192.168.43.147.8880 > 192.168.43.124.7773: UDP, length 120
03:22:02.527734 IP 192.168.43.147.8880 > 192.168.43.124.7773: UDP, length 120
03:22:02.577733 IP 192.168.43.147.8880 > 192.168.43.124.7773: UDP, length 120
03:22:02.627732 IP 192.168.43.147.8880 > 192.168.43.124.7773: UDP, length 120
03:22:02.677731 IP 192.168.43.147.8880 > 192.168.43.124.7773: UDP, length 120
03:22:02.727776 IP 192.168.43.147.8880 > 192.168.43.124.7773: UDP, length 120
03:22:02.777749 IP 192.168.43.147.8880 > 192.168.43.124.7773: UDP, length 120
03:22:02.827734 IP 192.168.43.147.8880 > 192.168.43.124.7773: UDP, length 120
03:22:02.877735 IP 192.168.43.147.8880 > 192.168.43.124.7773: UDP, length 120
03:22:02.927734 IP 192.168.43.147.8880 > 192.168.43.124.7773: UDP, length 120
03:22:02.977732 IP 192.168.43.147.8880 > 192.168.43.124.7773: UDP, length 120
03:22:03.027734 IP 192.168.43.147.8880 > 192.168.43.124.7773: UDP, length 120
03:22:03.077734 IP 192.168.43.147.8880 > 192.168.43.124.7773: UDP, length 120
03:22:03.127734 IP 192.168.43.147.8880 > 192.168.43.124.7773: UDP, length 120
03:22:03.177733 IP 192.168.43.147.8880 > 192.168.43.124.7773: UDP, length 120
03:22:03.227732 IP 192.168.43.147.8880 > 192.168.43.124.7773: UDP, length 120
03:22:03.277733 IP 192.168.43.147.8880 > 192.168.43.124.7773: UDP, length 120
03:22:03.327733 IP 192.168.43.147.8880 > 192.168.43.124.7773: UDP, length 120
03:22:03.377732 IP 192.168.43.147.8880 > 192.168.43.124.7773: UDP, length 120
03:22:03.427734 IP 192.168.43.147.8880 > 192.168.43.124.7773: UDP, length 120
03:22:03.477737 IP 192.168.43.147.8880 > 192.168.43.124.7773: UDP, length 120
03:22:03.527735 IP 192.168.43.147.8880 > 192.168.43.124.7773: UDP, length 120
03:22:03.577735 IP 192.168.43.147.8880 > 192.168.43.124.7773: UDP, length 120
03:22:03.627735 IP 192.168.43.147.8880 > 192.168.43.124.7773: UDP, length 120
03:22:03.677733 IP 192.168.43.147.8880 > 192.168.43.124.7773: UDP, length 120
03:22:03.727733 IP 192.168.43.147.8880 > 192.168.43.124.7773: UDP, length 120
03:22:03.777734 IP 192.168.43.147.8880 > 192.168.43.124.7773: UDP, length 120
03:22:03.827734 IP 192.168.43.147.8880 > 192.168.43.124.7773: UDP, length 120
03:22:03.877735 IP 192.168.43.147.8880 > 192.168.43.124.7773: UDP, length 120
03:22:03.927735 IP 192.168.43.147.8880 > 192.168.43.124.7773: UDP, length 120
03:22:03.977735 IP 192.168.43.147.8880 > 192.168.43.124.7773: UDP, length 120
03:22:04.027732 IP 192.168.43.147.8880 > 192.168.43.124.7773: UDP, length 120
03:22:04.077732 IP 192.168.43.147.8880 > 192.168.43.124.7773: UDP, length 120
03:22:04.127731 IP 192.168.43.147.8880 > 192.168.43.124.7773: UDP, length 120
03:22:04.177731 IP 192.168.43.147.8880 > 192.168.43.124.7773: UDP, length 120
03:22:04.227777 IP 192.168.43.147.8880 > 192.168.43.124.7773: UDP, length 120
03:22:04.277745 IP 192.168.43.147.8880 > 192.168.43.124.7773: UDP, length 120
03:22:04.327737 IP 192.168.43.147.8880 > 192.168.43.124.7773: UDP, length 120
03:22:04.377740 IP 192.168.43.147.8880 > 192.168.43.124.7773: UDP, length 120
03:22:04.427733 IP 192.168.43.147.8880 > 192.168.43.124.7773: UDP, length 120
03:22:04.477736 IP 192.168.43.147.8880 > 192.168.43.124.7773: UDP, length 120
03:22:04.527733 IP 192.168.43.147.8880 > 192.168.43.124.7773: UDP, length 120
03:22:04.577741 IP 192.168.43.147.8880 > 192.168.43.124.7773: UDP, length 120
03:22:04.627734 IP 192.168.43.147.8880 > 192.168.43.124.7773: UDP, length 120
03:22:04.677734 IP 192.168.43.147.8880 > 192.168.43.124.7773: UDP, length 120
03:22:04.727733 IP 192.168.43.147.8880 > 192.168.43.124.7773: UDP, length 120
03:22:04.777734 IP 192.168.43.147.8880 > 192.168.43.124.7773: UDP, length 120
03:22:04.827734 IP 192.168.43.147.8880 > 192.168.43.124.7773: UDP, length 120
03:22:04.877734 IP 192.168.43.147.8880 > 192.168.43.124.7773: UDP, length 120
03:22:04.927735 IP 192.168.43.147.8880 > 192.168.43.124.7773: UDP, length 120
03:22:04.977733 IP 192.168.43.147.8880 > 192.168.43.124.7773: UDP, length 120
03:22:05.027733 IP 192.168.43.147.8880 > 192.168.43.124.7773: UDP, length 120
03:22:05.077733 IP 192.168.43.147.8880 > 192.168.43.124.7773: UDP, length 120
03:22:05.127733 IP 192.168.43.147.8880 > 192.168.43.124.7773: UDP, length 120
03:22:05.177733 IP 192.168.43.147.8880 > 192.168.43.124.7773: UDP, length 120
03:22:05.227732 IP 192.168.43.147.8880 > 192.168.43.124.7773: UDP, length 120
03:22:05.277732 IP 192.168.43.147.8880 > 192.168.43.124.7773: UDP, length 120
03:22:05.327732 IP 192.168.43.147.8880 > 192.168.43.124.7773: UDP, length 120
03:22:05.377731 IP 192.168.43.147.8880 > 192.168.43.124.7773: UDP, length 120
03:22:05.427730 IP 192.168.43.147.8880 > 192.168.43.124.7773: UDP, length 120
03:22:05.477733 IP 192.168.43.147.8880 > 192.168.43.124.7773: UDP, length 120
03:22:05.527735 IP 192.168.43.147.8880 > 192.168.43.124.7773: UDP, length 120
03:22:05.577735 IP 192.168.43.147.8880 > 192.168.43.124.7773: UDP, length 120
03:22:05.627733 IP 192.168.43.147.8880 > 192.168.43.124.7773: UDP, length 120
03:22:05.677733 IP 192.168.43.147.8880 > 192.168.43.124.7773: UDP, length 120
03:22:05.727779 IP 192.168.43.147.8880 > 192.168.43.124.7773: UDP, length 120
03:22:05.777747 IP 192.168.43.147.8880 > 192.168.43.124.7773: UDP, length 120
03:22:05.827733 IP 192.168.43.147.8880 > 192.168.43.124.7773: UDP, length 120
03:22:05.877734 IP 192.168.43.147.8880 > 192.168.43.124.7773: UDP, length 120
03:22:05.927733 IP 192.168.43.147.8880 > 192.168.43.124.7773: UDP, length 120
03:22:05.977731 IP 192.168.43.147.8880 > 192.168.43.124.7773: UDP, length 120
03:22:06.027752 IP 192.168.43.147.8880 > 192.168.43.124.7773: UDP, length 120
03:22:06.077741 IP 192.168.43.147.8880 > 192.168.43.124.7773: UDP, length 120
03:22:06.127733 IP 192.168.43.147.8880 > 192.168.43.124.7773: UDP, length 120
03:22:06.177733 IP 192.168.43.147.8880 > 192.168.43.124.7773: UDP, length 120
03:22:06.227732 IP 192.168.43.147.8880 > 192.168.43.124.7773: UDP, length 120
03:22:06.277732 IP 192.168.43.147.8880 > 192.168.43.124.7773: UDP, length 120
03:22:06.327731 IP 192.168.43.147.8880 > 192.168.43.124.7773: UDP, length 120
03:22:06.377731 IP 192.168.43.147.8880 > 192.168.43.124.7773: UDP, length 120
03:22:06.427733 IP 192.168.43.147.8880 > 192.168.43.124.7773: UDP, length 120
03:22:06.477732 IP 192.168.43.147.8880 > 192.168.43.124.7773: UDP, length 120
03:22:06.527732 IP 192.168.43.147.8880 > 192.168.43.124.7773: UDP, length 120
03:22:06.577734 IP 192.168.43.147.8880 > 192.168.43.124.7773: UDP, length 120
03:22:06.627743 IP 192.168.43.147.8880 > 192.168.43.124.7773: UDP, length 120
03:22:06.677736 IP 192.168.43.147.8880 > 192.168.43.124.7773: UDP, length 120
03:22:06.727736 IP 192.168.43.147.8880 > 192.168.43.124.7773: UDP, length 120
03:22:06.777744 IP 192.168.43.147.8880 > 192.168.43.124.7773: UDP, length 120
03:22:06.827735 IP 192.168.43.147.8880 > 192.168.43.124.7773: UDP, length 120
03:22:06.877732 IP 192.168.43.147.8880 > 192.168.43.124.7773: UDP, length 120
03:22:06.927758 IP 192.168.43.147.8880 > 192.168.43.124.7773: UDP, length 120
03:22:06.977763 IP 192.168.43.147.8880 > 192.168.43.124.7773: UDP, length 120
03:22:07.027757 IP 192.168.43.147.8880 > 192.168.43.124.7773: UDP, length 120
03:22:07.077763 IP 192.168.43.147.8880 > 192.168.43.124.7773: UDP, length 120
03:22:07.127765 IP 192.168.43.147.8880 > 192.168.43.124.7773: UDP, length 120
03:22:07.177757 IP 192.168.43.147.8880 > 192.168.43.124.7773: UDP, length 120
03:22:07.230155 IP 192.168.43.147.8880 > 192.168.43.124.7773: UDP, length 120
03:22:07.277850 IP 192.168.43.147.8880 > 192.168.43.124.7773: UDP, length 120
03:22:07.327841 IP 192.168.43.147.8880 > 192.168.43.124.7773: UDP, length 120
03:22:07.377880 IP 192.168.43.147.8880 > 192.168.43.124.7773: UDP, length 120
03:22:07.427785 IP 192.168.43.147.8880 > 192.168.43.124.7773: UDP, length 120
03:22:07.477808 IP 192.168.43.147.8880 > 192.168.43.124.7773: UDP, length 120
03:22:07.527817 IP 192.168.43.147.8880 > 192.168.43.124.7773: UDP, length 120
03:22:07.577832 IP 192.168.43.147.8880 > 192.168.43.124.7773: UDP, length 120
03:22:07.627800 IP 192.168.43.147.8880 > 192.168.43.124.7773: UDP, length 120
03:22:07.677815 IP 192.168.43.147.8880 > 192.168.43.124.7773: UDP, length 120
03:22:07.727786 IP 192.168.43.147.8880 > 192.168.43.124.7773: UDP, length 120
03:22:07.777748 IP 192.168.43.147.8880 > 192.168.43.124.7773: UDP, length 120
03:22:07.827736 IP 192.168.43.147.8880 > 192.168.43.124.7773: UDP, length 120
03:22:07.877735 IP 192.168.43.147.8880 > 192.168.43.124.7773: UDP, length 120
03:22:07.927734 IP 192.168.43.147.8880 > 192.168.43.124.7773: UDP, length 120
03:22:07.977733 IP 192.168.43.147.8880 > 192.168.43.124.7773: UDP, length 120
03:22:08.027733 IP 192.168.43.147.8880 > 192.168.43.124.7773: UDP, length 120
03:22:08.077734 IP 192.168.43.147.8880 > 192.168.43.124.7773: UDP, length 120
03:22:08.127734 IP 192.168.43.147.8880 > 192.168.43.124.7773: UDP, length 120
03:22:08.177732 IP 192.168.43.147.8880 > 192.168.43.124.7773: UDP, length 120
03:22:08.227731 IP 192.168.43.147.8880 > 192.168.43.124.7773: UDP, length 120
03:22:08.277732 IP 192.168.43.147.8880 > 192.168.43.124.7773: UDP, length 120
03:22:08.327733 IP 192.168.43.147.8880 > 192.168.43.124.7773: UDP, length 120
03:22:08.377732 IP 192.168.43.147.8880 > 192.168.43.124.7773: UDP, length 120
03:22:08.427731 IP 192.168.43.147.8880 > 192.168.43.124.7773: UDP, length 120
03:22:08.477732 IP 192.168.43.147.8880 > 192.168.43.124.7773: UDP, length 120
03:22:08.527732 IP 192.168.43.147.8880 > 192.168.43.124.7773: UDP, length 120
03:22:08.577732 IP 192.168.43.147.8880 > 192.168.43.124.7773: UDP, length 120
03:22:08.627732 IP 192.168.43.147.8880 > 192.168.43.124.7773: UDP, length 120
03:22:08.677736 IP 192.168.43.147.8880 > 192.168.43.124.7773: UDP, length 120
03:22:08.727733 IP 192.168.43.147.8880 > 192.168.43.124.7773: UDP, length 120
03:22:08.777782 IP 192.168.43.147.8880 > 192.168.43.124.7773: UDP, length 120
03:22:08.827739 IP 192.168.43.147.8880 > 192.168.43.124.7773: UDP, length 120
03:22:08.877734 IP 192.168.43.147.8880 > 192.168.43.124.7773: UDP, length 120
03:22:08.927733 IP 192.168.43.147.8880 > 192.168.43.124.7773: UDP, length 120
03:22:08.977732 IP 192.168.43.147.8880 > 192.168.43.124.7773: UDP, length 120
03:22:09.027732 IP 192.168.43.147.8880 > 192.168.43.124.7773: UDP, length 120
03:22:09.067547 IP 192.168.43.124.8880 > 192.168.43.147.7772: UDP, length 120
03:22:09.077737 IP 192.168.43.147.8880 > 192.168.43.124.7773: UDP, length 120
03:22:09.111272 IP 192.168.43.124.8880 > 192.168.43.147.7772: UDP, length 120
03:22:09.127735 IP 192.168.43.147.8880 > 192.168.43.124.7773: UDP, length 120
03:22:09.160889 IP 192.168.43.124.8880 > 192.168.43.147.7772: UDP, length 120
03:22:09.177736 IP 192.168.43.147.8880 > 192.168.43.124.7773: UDP, length 120
03:22:09.210801 IP 192.168.43.124.8880 > 192.168.43.147.7772: UDP, length 120
03:22:09.227736 IP 192.168.43.147.8880 > 192.168.43.124.7773: UDP, length 120
03:22:09.262251 IP 192.168.43.124.8880 > 192.168.43.147.7772: UDP, length 120
03:22:09.277736 IP 192.168.43.147.8880 > 192.168.43.124.7773: UDP, length 120
03:22:09.311379 IP 192.168.43.124.8880 > 192.168.43.147.7772: UDP, length 120
03:22:09.327735 IP 192.168.43.147.8880 > 192.168.43.124.7773: UDP, length 120
03:22:09.361615 IP 192.168.43.124.8880 > 192.168.43.147.7772: UDP, length 120
03:22:09.377745 IP 192.168.43.147.8880 > 192.168.43.124.7773: UDP, length 120
03:22:09.420890 IP 192.168.43.124.8880 > 192.168.43.147.7772: UDP, length 120
03:22:09.427740 IP 192.168.43.147.8880 > 192.168.43.124.7773: UDP, length 120
03:22:09.461444 IP 192.168.43.124.8880 > 192.168.43.147.7772: UDP, length 120
03:22:09.477737 IP 192.168.43.147.8880 > 192.168.43.124.7773: UDP, length 120
03:22:09.519664 IP 192.168.43.124.8880 > 192.168.43.147.7772: UDP, length 120
03:22:09.527744 IP 192.168.43.147.8880 > 192.168.43.124.7773: UDP, length 120
03:22:09.561520 IP 192.168.43.124.8880 > 192.168.43.147.7772: UDP, length 120
03:22:09.577737 IP 192.168.43.147.8880 > 192.168.43.124.7773: UDP, length 120
03:22:09.611052 IP 192.168.43.124.8880 > 192.168.43.147.7772: UDP, length 120
03:22:09.627736 IP 192.168.43.147.8880 > 192.168.43.124.7773: UDP, length 120
03:22:09.667148 IP 192.168.43.124.8880 > 192.168.43.147.7772: UDP, length 120
03:22:09.677736 IP 192.168.43.147.8880 > 192.168.43.124.7773: UDP, length 120
03:22:09.711209 IP 192.168.43.124.8880 > 192.168.43.147.7772: UDP, length 120
03:22:09.727741 IP 192.168.43.147.8880 > 192.168.43.124.7773: UDP, length 120
03:22:09.773432 IP 192.168.43.124.8880 > 192.168.43.147.7772: UDP, length 120
03:22:09.777745 IP 192.168.43.147.8880 > 192.168.43.124.7773: UDP, length 120
03:22:09.811350 IP 192.168.43.124.8880 > 192.168.43.147.7772: UDP, length 120
03:22:09.827736 IP 192.168.43.147.8880 > 192.168.43.124.7773: UDP, length 120
03:22:09.862355 IP 192.168.43.124.8880 > 192.168.43.147.7772: UDP, length 120
03:22:09.877735 IP 192.168.43.147.8880 > 192.168.43.124.7773: UDP, length 120
03:22:09.911051 IP 192.168.43.124.8880 > 192.168.43.147.7772: UDP, length 120
03:22:09.927736 IP 192.168.43.147.8880 > 192.168.43.124.7773: UDP, length 120
03:22:09.961078 IP 192.168.43.124.8880 > 192.168.43.147.7772: UDP, length 120
03:22:09.977735 IP 192.168.43.147.8880 > 192.168.43.124.7773: UDP, length 120
03:22:10.011303 IP 192.168.43.124.8880 > 192.168.43.147.7772: UDP, length 120
03:22:10.027735 IP 192.168.43.147.8880 > 192.168.43.124.7773: UDP, length 120
03:22:10.061058 IP 192.168.43.124.8880 > 192.168.43.147.7772: UDP, length 120
03:22:10.077735 IP 192.168.43.147.8880 > 192.168.43.124.7773: UDP, length 120
03:22:10.110965 IP 192.168.43.124.8880 > 192.168.43.147.7772: UDP, length 120
03:22:10.127735 IP 192.168.43.147.8880 > 192.168.43.124.7773: UDP, length 120
03:22:10.160962 IP 192.168.43.124.8880 > 192.168.43.147.7772: UDP, length 120
03:22:10.177735 IP 192.168.43.147.8880 > 192.168.43.124.7773: UDP, length 120
03:22:10.211132 IP 192.168.43.124.8880 > 192.168.43.147.7772: UDP, length 120
03:22:10.227735 IP 192.168.43.147.8880 > 192.168.43.124.7773: UDP, length 120
03:22:10.261457 IP 192.168.43.124.8880 > 192.168.43.147.7772: UDP, length 120
03:22:10.277775 IP 192.168.43.147.8880 > 192.168.43.124.7773: UDP, length 120
03:22:10.327736 IP 192.168.43.147.8880 > 192.168.43.124.7773: UDP, length 120
03:22:10.377732 IP 192.168.43.147.8880 > 192.168.43.124.7773: UDP, length 120
03:22:10.427731 IP 192.168.43.147.8880 > 192.168.43.124.7773: UDP, length 120
03:22:10.460966 IP 192.168.43.124.8880 > 192.168.43.147.7772: UDP, length 120
03:22:10.461043 IP 192.168.43.124.8880 > 192.168.43.147.7772: UDP, length 120
03:22:10.477735 IP 192.168.43.147.8880 > 192.168.43.124.7773: UDP, length 120
03:22:10.527736 IP 192.168.43.147.8880 > 192.168.43.124.7773: UDP, length 120
03:22:10.577736 IP 192.168.43.147.8880 > 192.168.43.124.7773: UDP, length 120
03:22:10.578604 IP 192.168.43.124.8880 > 192.168.43.147.7772: UDP, length 120
03:22:10.578750 IP 192.168.43.124.8880 > 192.168.43.147.7772: UDP, length 120
03:22:10.578820 IP 192.168.43.124.8880 > 192.168.43.147.7772: UDP, length 120
03:22:10.627737 IP 192.168.43.147.8880 > 192.168.43.124.7773: UDP, length 120
03:22:10.677735 IP 192.168.43.147.8880 > 192.168.43.124.7773: UDP, length 120
03:22:10.712083 IP 192.168.43.124.8880 > 192.168.43.147.7772: UDP, length 120
03:22:10.712233 IP 192.168.43.124.8880 > 192.168.43.147.7772: UDP, length 120
03:22:10.712303 IP 192.168.43.124.8880 > 192.168.43.147.7772: UDP, length 120
03:22:10.727737 IP 192.168.43.147.8880 > 192.168.43.124.7773: UDP, length 120
03:22:10.777741 IP 192.168.43.147.8880 > 192.168.43.124.7773: UDP, length 120
03:22:10.827734 IP 192.168.43.147.8880 > 192.168.43.124.7773: UDP, length 120
03:22:10.865433 IP 192.168.43.124.8880 > 192.168.43.147.7772: UDP, length 120
03:22:10.865599 IP 192.168.43.124.8880 > 192.168.43.147.7772: UDP, length 120
03:22:10.865683 IP 192.168.43.124.8880 > 192.168.43.147.7772: UDP, length 120
03:22:11.005848 IP 192.168.43.124.8880 > 192.168.43.147.7772: UDP, length 120
03:22:11.006011 IP 192.168.43.124.8880 > 192.168.43.147.7772: UDP, length 120
03:22:11.131166 IP 192.168.43.124.8880 > 192.168.43.147.7772: UDP, length 120
03:22:11.131325 IP 192.168.43.124.8880 > 192.168.43.147.7772: UDP, length 120
03:22:11.131408 IP 192.168.43.124.8880 > 192.168.43.147.7772: UDP, length 120
03:22:11.251292 IP 192.168.43.124.8880 > 192.168.43.147.7772: UDP, length 120
03:22:11.251451 IP 192.168.43.124.8880 > 192.168.43.147.7772: UDP, length 120
03:22:11.392799 IP 192.168.43.124.8880 > 192.168.43.147.7772: UDP, length 120
03:22:11.392947 IP 192.168.43.124.8880 > 192.168.43.147.7772: UDP, length 120
03:22:11.393022 IP 192.168.43.124.8880 > 192.168.43.147.7772: UDP, length 120
03:22:11.538474 IP 192.168.43.124.8880 > 192.168.43.147.7772: UDP, length 120
03:22:11.538621 IP 192.168.43.124.8880 > 192.168.43.147.7772: UDP, length 120
03:22:11.538697 IP 192.168.43.124.8880 > 192.168.43.147.7772: UDP, length 120
03:22:11.657635 IP 192.168.43.124.8880 > 192.168.43.147.7772: UDP, length 120
03:22:11.657782 IP 192.168.43.124.8880 > 192.168.43.147.7772: UDP, length 120
03:22:11.800915 IP 192.168.43.124.8880 > 192.168.43.147.7772: UDP, length 120
03:22:11.801107 IP 192.168.43.124.8880 > 192.168.43.147.7772: UDP, length 120
03:22:11.801195 IP 192.168.43.124.8880 > 192.168.43.147.7772: UDP, length 120
03:22:11.945125 IP 192.168.43.124.8880 > 192.168.43.147.7772: UDP, length 120
03:22:11.945382 IP 192.168.43.124.8880 > 192.168.43.147.7772: UDP, length 120
03:22:11.945535 IP 192.168.43.124.8880 > 192.168.43.147.7772: UDP, length 120
03:22:12.068347 IP 192.168.43.124.8880 > 192.168.43.147.7772: UDP, length 120
03:22:12.068588 IP 192.168.43.124.8880 > 192.168.43.147.7772: UDP, length 120
03:22:12.159656 IP 192.168.43.124.8880 > 192.168.43.147.7772: UDP, length 120
03:22:12.159933 IP 192.168.43.124.8880 > 192.168.43.147.7772: UDP, length 120
03:22:12.270741 IP 192.168.43.124.8880 > 192.168.43.147.7772: UDP, length 120
03:22:12.270996 IP 192.168.43.124.8880 > 192.168.43.147.7772: UDP, length 120
03:22:12.271106 IP 192.168.43.124.8880 > 192.168.43.147.7772: UDP, length 120
03:22:12.414547 IP 192.168.43.124.8880 > 192.168.43.147.7772: UDP, length 120
03:22:12.414777 IP 192.168.43.124.8880 > 192.168.43.147.7772: UDP, length 120
03:22:12.414887 IP 192.168.43.124.8880 > 192.168.43.147.7772: UDP, length 120
03:22:12.597071 IP 192.168.43.124.8880 > 192.168.43.147.7772: UDP, length 120
03:22:12.597375 IP 192.168.43.124.8880 > 192.168.43.147.7772: UDP, length 120
03:22:12.597487 IP 192.168.43.124.8880 > 192.168.43.147.7772: UDP, length 120
03:22:12.719337 IP 192.168.43.124.8880 > 192.168.43.147.7772: UDP, length 120
03:22:12.719529 IP 192.168.43.124.8880 > 192.168.43.147.7772: UDP, length 120
03:22:12.810883 IP 192.168.43.124.8880 > 192.168.43.147.7772: UDP, length 120
03:22:12.811021 IP 192.168.43.124.8880 > 192.168.43.147.7772: UDP, length 120
03:22:12.916206 IP 192.168.43.124.8880 > 192.168.43.147.7772: UDP, length 120
03:22:12.916434 IP 192.168.43.124.8880 > 192.168.43.147.7772: UDP, length 120
03:22:12.916671 IP 192.168.43.124.8880 > 192.168.43.147.7772: UDP, length 120
03:22:13.085249 IP 192.168.43.124.8880 > 192.168.43.147.7772: UDP, length 120
03:22:13.085445 IP 192.168.43.124.8880 > 192.168.43.147.7772: UDP, length 120
03:22:13.085521 IP 192.168.43.124.8880 > 192.168.43.147.7772: UDP, length 120
03:22:13.195341 IP 192.168.43.124.8880 > 192.168.43.147.7772: UDP, length 120
03:22:13.195563 IP 192.168.43.124.8880 > 192.168.43.147.7772: UDP, length 120
03:22:13.212318 IP 192.168.43.124.8880 > 192.168.43.147.7772: UDP, length 120
03:22:13.267333 IP 192.168.43.124.8880 > 192.168.43.147.7772: UDP, length 120
03:22:13.311046 IP 192.168.43.124.8880 > 192.168.43.147.7772: UDP, length 120
03:22:13.360852 IP 192.168.43.124.8880 > 192.168.43.147.7772: UDP, length 120
03:22:13.411021 IP 192.168.43.124.8880 > 192.168.43.147.7772: UDP, length 120
03:22:13.468035 IP 192.168.43.124.8880 > 192.168.43.147.7772: UDP, length 120
03:22:13.510657 IP 192.168.43.124.8880 > 192.168.43.147.7772: UDP, length 120
03:22:13.563107 IP 192.168.43.124.8880 > 192.168.43.147.7772: UDP, length 120
03:22:13.612392 IP 192.168.43.124.8880 > 192.168.43.147.7772: UDP, length 120
03:22:13.671118 IP 192.168.43.124.8880 > 192.168.43.147.7772: UDP, length 120
03:22:13.711032 IP 192.168.43.124.8880 > 192.168.43.147.7772: UDP, length 120
03:22:13.763358 IP 192.168.43.124.8880 > 192.168.43.147.7772: UDP, length 120
03:22:13.810858 IP 192.168.43.124.8880 > 192.168.43.147.7772: UDP, length 120
03:22:13.872438 IP 192.168.43.124.8880 > 192.168.43.147.7772: UDP, length 120
03:22:13.911126 IP 192.168.43.124.8880 > 192.168.43.147.7772: UDP, length 120
03:22:13.961075 IP 192.168.43.124.8880 > 192.168.43.147.7772: UDP, length 120
03:22:14.011000 IP 192.168.43.124.8880 > 192.168.43.147.7772: UDP, length 120
03:22:14.070902 IP 192.168.43.124.8880 > 192.168.43.147.7772: UDP, length 120
03:22:14.110961 IP 192.168.43.124.8880 > 192.168.43.147.7772: UDP, length 120
03:22:14.162878 IP 192.168.43.124.8880 > 192.168.43.147.7772: UDP, length 120
03:22:14.210891 IP 192.168.43.124.8880 > 192.168.43.147.7772: UDP, length 120
03:22:14.268436 IP 192.168.43.124.8880 > 192.168.43.147.7772: UDP, length 120
03:22:14.312020 IP 192.168.43.124.8880 > 192.168.43.147.7772: UDP, length 120
03:22:14.360903 IP 192.168.43.124.8880 > 192.168.43.147.7772: UDP, length 120
03:22:14.432606 IP 192.168.43.124.8880 > 192.168.43.147.7772: UDP, length 120
03:22:14.460949 IP 192.168.43.124.8880 > 192.168.43.147.7772: UDP, length 120
03:22:14.510987 IP 192.168.43.124.8880 > 192.168.43.147.7772: UDP, length 120
03:22:14.562967 IP 192.168.43.124.8880 > 192.168.43.147.7772: UDP, length 120
03:22:14.621071 IP 192.168.43.124.8880 > 192.168.43.147.7772: UDP, length 120
03:22:14.661175 IP 192.168.43.124.8880 > 192.168.43.147.7772: UDP, length 120
03:22:14.712917 IP 192.168.43.124.8880 > 192.168.43.147.7772: UDP, length 120
03:22:14.760544 IP 192.168.43.124.8880 > 192.168.43.147.7772: UDP, length 120
03:22:14.820442 IP 192.168.43.124.8880 > 192.168.43.147.7772: UDP, length 120
03:22:14.862225 IP 192.168.43.124.8880 > 192.168.43.147.7772: UDP, length 120
03:22:14.910753 IP 192.168.43.124.8880 > 192.168.43.147.7772: UDP, length 120
03:22:14.964299 IP 192.168.43.124.8880 > 192.168.43.147.7772: UDP, length 120
03:22:15.010873 IP 192.168.43.124.8880 > 192.168.43.147.7772: UDP, length 120
03:22:15.074524 IP 192.168.43.124.8880 > 192.168.43.147.7772: UDP, length 120
03:22:15.111147 IP 192.168.43.124.8880 > 192.168.43.147.7772: UDP, length 120
03:22:15.161018 IP 192.168.43.124.8880 > 192.168.43.147.7772: UDP, length 120
03:22:15.210820 IP 192.168.43.124.8880 > 192.168.43.147.7772: UDP, length 120
03:22:15.268180 IP 192.168.43.124.8880 > 192.168.43.147.7772: UDP, length 120
03:22:15.311149 IP 192.168.43.124.8880 > 192.168.43.147.7772: UDP, length 120
03:22:15.362038 IP 192.168.43.124.8880 > 192.168.43.147.7772: UDP, length 120
03:22:15.410994 IP 192.168.43.124.8880 > 192.168.43.147.7772: UDP, length 120
03:22:15.470907 IP 192.168.43.124.8880 > 192.168.43.147.7772: UDP, length 120
03:22:15.511001 IP 192.168.43.124.8880 > 192.168.43.147.7772: UDP, length 120
03:22:15.560836 IP 192.168.43.124.8880 > 192.168.43.147.7772: UDP, length 120
03:22:15.618051 IP 192.168.43.124.8880 > 192.168.43.147.7772: UDP, length 120
03:22:15.661008 IP 192.168.43.124.8880 > 192.168.43.147.7772: UDP, length 120
03:22:15.712896 IP 192.168.43.124.8880 > 192.168.43.147.7772: UDP, length 120
03:22:15.778397 IP 192.168.43.124.8880 > 192.168.43.147.7772: UDP, length 120
03:22:15.810953 IP 192.168.43.124.8880 > 192.168.43.147.7772: UDP, length 120
03:22:15.861223 IP 192.168.43.124.8880 > 192.168.43.147.7772: UDP, length 120
03:22:15.913911 IP 192.168.43.124.8880 > 192.168.43.147.7772: UDP, length 120
03:22:15.960842 IP 192.168.43.124.8880 > 192.168.43.147.7772: UDP, length 120
03:22:16.016386 IP 192.168.43.124.8880 > 192.168.43.147.7772: UDP, length 120
03:22:16.060843 IP 192.168.43.124.8880 > 192.168.43.147.7772: UDP, length 120
03:22:16.128396 IP 192.168.43.124.8880 > 192.168.43.147.7772: UDP, length 120
03:22:16.160846 IP 192.168.43.124.8880 > 192.168.43.147.7772: UDP, length 120
03:22:16.211137 IP 192.168.43.124.8880 > 192.168.43.147.7772: UDP, length 120
03:22:16.260916 IP 192.168.43.124.8880 > 192.168.43.147.7772: UDP, length 120
03:22:16.323531 IP 192.168.43.124.8880 > 192.168.43.147.7772: UDP, length 120
03:22:16.360894 IP 192.168.43.124.8880 > 192.168.43.147.7772: UDP, length 120
03:22:16.410961 IP 192.168.43.124.8880 > 192.168.43.147.7772: UDP, length 120
03:22:16.471913 IP 192.168.43.124.8880 > 192.168.43.147.7772: UDP, length 120
03:22:16.531616 IP 192.168.43.124.8880 > 192.168.43.147.7772: UDP, length 120
03:22:16.560018 IP 192.168.43.124.8880 > 192.168.43.147.7772: UDP, length 120
03:22:16.620236 IP 192.168.43.124.8880 > 192.168.43.147.7772: UDP, length 120
03:22:16.660649 IP 192.168.43.124.8880 > 192.168.43.147.7772: UDP, length 120
03:22:16.722684 IP 192.168.43.124.8880 > 192.168.43.147.7772: UDP, length 120
03:22:16.777057 IP 192.168.43.124.8880 > 192.168.43.147.7772: UDP, length 120
03:22:16.811139 IP 192.168.43.124.8880 > 192.168.43.147.7772: UDP, length 120
03:22:16.860879 IP 192.168.43.124.8880 > 192.168.43.147.7772: UDP, length 120
03:22:16.910991 IP 192.168.43.124.8880 > 192.168.43.147.7772: UDP, length 120
03:22:16.961040 IP 192.168.43.124.8880 > 192.168.43.147.7772: UDP, length 120
03:22:17.012977 IP 192.168.43.124.8880 > 192.168.43.147.7772: UDP, length 120
03:22:17.060986 IP 192.168.43.124.8880 > 192.168.43.147.7772: UDP, length 120
03:22:17.132373 IP 192.168.43.124.8880 > 192.168.43.147.7772: UDP, length 120
03:22:17.161011 IP 192.168.43.124.8880 > 192.168.43.147.7772: UDP, length 120
03:22:17.211215 IP 192.168.43.124.8880 > 192.168.43.147.7772: UDP, length 120
03:22:17.261098 IP 192.168.43.124.8880 > 192.168.43.147.7772: UDP, length 120
03:22:17.321115 IP 192.168.43.124.8880 > 192.168.43.147.7772: UDP, length 120
03:22:17.361177 IP 192.168.43.124.8880 > 192.168.43.147.7772: UDP, length 120
03:22:17.410949 IP 192.168.43.124.8880 > 192.168.43.147.7772: UDP, length 120
03:22:17.460894 IP 192.168.43.124.8880 > 192.168.43.147.7772: UDP, length 120
03:22:17.521016 IP 192.168.43.124.8880 > 192.168.43.147.7772: UDP, length 120
03:22:17.560886 IP 192.168.43.124.8880 > 192.168.43.147.7772: UDP, length 120
03:22:17.610913 IP 192.168.43.124.8880 > 192.168.43.147.7772: UDP, length 120
03:22:17.660888 IP 192.168.43.124.8880 > 192.168.43.147.7772: UDP, length 120
03:22:17.718245 IP 192.168.43.124.8880 > 192.168.43.147.7772: UDP, length 120
03:22:17.761512 IP 192.168.43.124.8880 > 192.168.43.147.7772: UDP, length 120
03:22:17.810945 IP 192.168.43.124.8880 > 192.168.43.147.7772: UDP, length 120
03:22:17.876070 IP 192.168.43.124.8880 > 192.168.43.147.7772: UDP, length 120
03:22:17.912728 IP 192.168.43.124.8880 > 192.168.43.147.7772: UDP, length 120
03:22:17.961570 IP 192.168.43.124.8880 > 192.168.43.147.7772: UDP, length 120
03:22:18.026257 IP 192.168.43.124.8880 > 192.168.43.147.7772: UDP, length 120
03:22:18.062285 IP 192.168.43.124.8880 > 192.168.43.147.7772: UDP, length 120
03:22:18.110875 IP 192.168.43.124.8880 > 192.168.43.147.7772: UDP, length 120
03:22:18.166269 IP 192.168.43.124.8880 > 192.168.43.147.7772: UDP, length 120
03:22:18.219945 IP 192.168.43.124.8880 > 192.168.43.147.7772: UDP, length 120
03:22:18.261357 IP 192.168.43.124.8880 > 192.168.43.147.7772: UDP, length 120
03:22:18.310838 IP 192.168.43.124.8880 > 192.168.43.147.7772: UDP, length 120
03:22:18.361744 IP 192.168.43.124.8880 > 192.168.43.147.7772: UDP, length 120
03:22:18.420843 IP 192.168.43.124.8880 > 192.168.43.147.7772: UDP, length 120
03:22:18.463553 IP 192.168.43.124.8880 > 192.168.43.147.7772: UDP, length 120
03:22:18.512333 IP 192.168.43.124.8880 > 192.168.43.147.7772: UDP, length 120
03:22:18.561462 IP 192.168.43.124.8880 > 192.168.43.147.7772: UDP, length 120
03:22:18.607682 IP 192.168.43.124.8880 > 192.168.43.147.7772: UDP, length 120
03:22:18.660691 IP 192.168.43.124.8880 > 192.168.43.147.7772: UDP, length 120
03:22:18.710858 IP 192.168.43.124.8880 > 192.168.43.147.7772: UDP, length 120
03:22:18.770646 IP 192.168.43.124.8880 > 192.168.43.147.7772: UDP, length 120
03:22:18.810849 IP 192.168.43.124.8880 > 192.168.43.147.7772: UDP, length 120
03:22:18.860740 IP 192.168.43.124.8880 > 192.168.43.147.7772: UDP, length 120
03:22:18.918867 IP 192.168.43.124.8880 > 192.168.43.147.7772: UDP, length 120
03:22:18.960889 IP 192.168.43.124.8880 > 192.168.43.147.7772: UDP, length 120
03:22:19.010771 IP 192.168.43.124.8880 > 192.168.43.147.7772: UDP, length 120
03:22:19.077844 IP 192.168.43.124.8880 > 192.168.43.147.7772: UDP, length 120
03:22:19.111147 IP 192.168.43.124.8880 > 192.168.43.147.7772: UDP, length 120
03:22:19.162658 IP 192.168.43.124.8880 > 192.168.43.147.7772: UDP, length 120
03:22:19.210888 IP 192.168.43.124.8880 > 192.168.43.147.7772: UDP, length 120
03:22:19.282700 IP 192.168.43.124.8880 > 192.168.43.147.7772: UDP, length 120
03:22:19.310872 IP 192.168.43.124.8880 > 192.168.43.147.7772: UDP, length 120
03:22:19.361068 IP 192.168.43.124.8880 > 192.168.43.147.7772: UDP, length 120
03:22:19.410855 IP 192.168.43.124.8880 > 192.168.43.147.7772: UDP, length 120
03:22:19.470456 IP 192.168.43.124.8880 > 192.168.43.147.7772: UDP, length 120
03:22:19.513340 IP 192.168.43.124.8880 > 192.168.43.147.7772: UDP, length 120
03:22:19.560934 IP 192.168.43.124.8880 > 192.168.43.147.7772: UDP, length 120
03:22:19.610858 IP 192.168.43.124.8880 > 192.168.43.147.7772: UDP, length 120
03:22:19.674676 IP 192.168.43.124.8880 > 192.168.43.147.7772: UDP, length 120
03:22:19.710952 IP 192.168.43.124.8880 > 192.168.43.147.7772: UDP, length 120
03:22:19.761003 IP 192.168.43.124.8880 > 192.168.43.147.7772: UDP, length 120
03:22:19.810779 IP 192.168.43.124.8880 > 192.168.43.147.7772: UDP, length 120
03:22:19.870905 IP 192.168.43.124.8880 > 192.168.43.147.7772: UDP, length 120
03:22:19.911575 IP 192.168.43.124.8880 > 192.168.43.147.7772: UDP, length 120
03:22:19.960773 IP 192.168.43.124.8880 > 192.168.43.147.7772: UDP, length 120
03:22:20.013184 IP 192.168.43.124.8880 > 192.168.43.147.7772: UDP, length 120
03:22:20.070781 IP 192.168.43.124.8880 > 192.168.43.147.7772: UDP, length 120
03:22:20.111998 IP 192.168.43.124.8880 > 192.168.43.147.7772: UDP, length 120
03:22:20.158004 IP 192.168.43.124.8880 > 192.168.43.147.7772: UDP, length 120
03:22:20.214227 IP 192.168.43.124.8880 > 192.168.43.147.7772: UDP, length 120
03:22:20.270942 IP 192.168.43.124.8880 > 192.168.43.147.7772: UDP, length 120
03:22:20.316028 IP 192.168.43.124.8880 > 192.168.43.147.7772: UDP, length 120
03:22:20.360763 IP 192.168.43.124.8880 > 192.168.43.147.7772: UDP, length 120
03:22:20.410851 IP 192.168.43.124.8880 > 192.168.43.147.7772: UDP, length 120
03:22:20.469497 IP 192.168.43.124.8880 > 192.168.43.147.7772: UDP, length 120
03:22:20.511984 IP 192.168.43.124.8880 > 192.168.43.147.7772: UDP, length 120
03:22:20.577132 IP 192.168.43.124.8880 > 192.168.43.147.7772: UDP, length 120
03:22:20.610839 IP 192.168.43.124.8880 > 192.168.43.147.7772: UDP, length 120
03:22:20.671645 IP 192.168.43.124.8880 > 192.168.43.147.7772: UDP, length 120
03:22:20.713263 IP 192.168.43.124.8880 > 192.168.43.147.7772: UDP, length 120
03:22:20.760951 IP 192.168.43.124.8880 > 192.168.43.147.7772: UDP, length 120
03:22:20.810758 IP 192.168.43.124.8880 > 192.168.43.147.7772: UDP, length 120
03:22:20.870012 IP 192.168.43.124.8880 > 192.168.43.147.7772: UDP, length 120
03:22:20.910758 IP 192.168.43.124.8880 > 192.168.43.147.7772: UDP, length 120
03:22:20.961023 IP 192.168.43.124.8880 > 192.168.43.147.7772: UDP, length 120
03:22:21.010771 IP 192.168.43.124.8880 > 192.168.43.147.7772: UDP, length 120
03:22:21.071993 IP 192.168.43.124.8880 > 192.168.43.147.7772: UDP, length 120
03:22:21.110325 IP 192.168.43.124.8880 > 192.168.43.147.7772: UDP, length 120
03:22:21.160763 IP 192.168.43.124.8880 > 192.168.43.147.7772: UDP, length 120
03:22:21.210979 IP 192.168.43.124.8880 > 192.168.43.147.7772: UDP, length 120
03:22:21.270628 IP 192.168.43.124.8880 > 192.168.43.147.7772: UDP, length 120
03:22:21.310824 IP 192.168.43.124.8880 > 192.168.43.147.7772: UDP, length 120
03:22:21.360994 IP 192.168.43.124.8880 > 192.168.43.147.7772: UDP, length 120
03:22:21.411958 IP 192.168.43.124.8880 > 192.168.43.147.7772: UDP, length 120
03:22:21.471290 IP 192.168.43.124.8880 > 192.168.43.147.7772: UDP, length 120
03:22:21.515611 IP 192.168.43.124.8880 > 192.168.43.147.7772: UDP, length 120
03:22:21.560652 IP 192.168.43.124.8880 > 192.168.43.147.7772: UDP, length 120
03:22:21.610761 IP 192.168.43.124.8880 > 192.168.43.147.7772: UDP, length 120
03:22:21.670774 IP 192.168.43.124.8880 > 192.168.43.147.7772: UDP, length 120
03:22:21.711043 IP 192.168.43.124.8880 > 192.168.43.147.7772: UDP, length 120
03:22:21.760951 IP 192.168.43.124.8880 > 192.168.43.147.7772: UDP, length 120
03:22:21.810792 IP 192.168.43.124.8880 > 192.168.43.147.7772: UDP, length 120
03:22:21.867835 IP 192.168.43.124.8880 > 192.168.43.147.7772: UDP, length 120
03:22:21.911037 IP 192.168.43.124.8880 > 192.168.43.147.7772: UDP, length 120
03:22:21.961049 IP 192.168.43.124.8880 > 192.168.43.147.7772: UDP, length 120
03:22:22.010844 IP 192.168.43.124.8880 > 192.168.43.147.7772: UDP, length 120
03:22:22.071152 IP 192.168.43.124.8880 > 192.168.43.147.7772: UDP, length 120
03:22:22.111779 IP 192.168.43.124.8880 > 192.168.43.147.7772: UDP, length 120
03:22:22.161515 IP 192.168.43.124.8880 > 192.168.43.147.7772: UDP, length 120
03:22:22.210916 IP 192.168.43.124.8880 > 192.168.43.147.7772: UDP, length 120
03:22:22.272546 IP 192.168.43.124.8880 > 192.168.43.147.7772: UDP, length 120
03:22:22.310953 IP 192.168.43.124.8880 > 192.168.43.147.7772: UDP, length 120
03:22:22.362565 IP 192.168.43.124.8880 > 192.168.43.147.7772: UDP, length 120
03:22:22.410947 IP 192.168.43.124.8880 > 192.168.43.147.7772: UDP, length 120
03:22:22.471188 IP 192.168.43.124.8880 > 192.168.43.147.7772: UDP, length 120
03:22:22.515707 IP 192.168.43.124.8880 > 192.168.43.147.7772: UDP, length 120
03:22:22.561036 IP 192.168.43.124.8880 > 192.168.43.147.7772: UDP, length 120
03:22:22.610789 IP 192.168.43.124.8880 > 192.168.43.147.7772: UDP, length 120
03:22:22.672363 IP 192.168.43.124.8880 > 192.168.43.147.7772: UDP, length 120
03:22:22.711077 IP 192.168.43.124.8880 > 192.168.43.147.7772: UDP, length 120
03:22:22.764755 IP 192.168.43.124.8880 > 192.168.43.147.7772: UDP, length 120
03:22:22.811625 IP 192.168.43.124.8880 > 192.168.43.147.7772: UDP, length 120
03:22:22.870743 IP 192.168.43.124.8880 > 192.168.43.147.7772: UDP, length 120
03:22:22.911241 IP 192.168.43.124.8880 > 192.168.43.147.7772: UDP, length 120
03:22:22.960911 IP 192.168.43.124.8880 > 192.168.43.147.7772: UDP, length 120
03:22:23.020667 IP 192.168.43.124.8880 > 192.168.43.147.7772: UDP, length 120
03:22:23.061516 IP 192.168.43.124.8880 > 192.168.43.147.7772: UDP, length 120
03:22:23.121705 IP 192.168.43.124.8880 > 192.168.43.147.7772: UDP, length 120
03:22:23.174038 IP 192.168.43.124.8880 > 192.168.43.147.7772: UDP, length 120
03:22:23.212491 IP 192.168.43.124.8880 > 192.168.43.147.7772: UDP, length 120
03:22:23.259900 IP 192.168.43.124.8880 > 192.168.43.147.7772: UDP, length 120
03:22:23.310831 IP 192.168.43.124.8880 > 192.168.43.147.7772: UDP, length 120
03:22:23.371402 IP 192.168.43.124.8880 > 192.168.43.147.7772: UDP, length 120
03:22:23.411103 IP 192.168.43.124.8880 > 192.168.43.147.7772: UDP, length 120
03:22:23.460165 IP 192.168.43.124.8880 > 192.168.43.147.7772: UDP, length 120
03:22:23.513835 IP 192.168.43.124.8880 > 192.168.43.147.7772: UDP, length 120
03:22:23.572481 IP 192.168.43.124.8880 > 192.168.43.147.7772: UDP, length 120
03:22:23.611140 IP 192.168.43.124.8880 > 192.168.43.147.7772: UDP, length 120
03:22:23.660568 IP 192.168.43.124.8880 > 192.168.43.147.7772: UDP, length 120
03:22:23.711072 IP 192.168.43.124.8880 > 192.168.43.147.7772: UDP, length 120
03:22:23.770990 IP 192.168.43.124.8880 > 192.168.43.147.7772: UDP, length 120
03:22:23.810909 IP 192.168.43.124.8880 > 192.168.43.147.7772: UDP, length 120
03:22:23.860829 IP 192.168.43.124.8880 > 192.168.43.147.7772: UDP, length 120
03:22:23.910814 IP 192.168.43.124.8880 > 192.168.43.147.7772: UDP, length 120
03:22:23.960784 IP 192.168.43.124.8880 > 192.168.43.147.7772: UDP, length 120
03:22:24.010803 IP 192.168.43.124.8880 > 192.168.43.147.7772: UDP, length 120
03:22:24.061074 IP 192.168.43.124.8880 > 192.168.43.147.7772: UDP, length 120
03:22:24.112786 IP 192.168.43.124.8880 > 192.168.43.147.7772: UDP, length 120
03:22:24.160743 IP 192.168.43.124.8880 > 192.168.43.147.7772: UDP, length 120
03:22:24.211170 IP 192.168.43.124.8880 > 192.168.43.147.7772: UDP, length 120
03:22:24.262215 IP 192.168.43.124.8880 > 192.168.43.147.7772: UDP, length 120
03:22:24.320525 IP 192.168.43.124.8880 > 192.168.43.147.7772: UDP, length 120
03:22:24.360798 IP 192.168.43.124.8880 > 192.168.43.147.7772: UDP, length 120
03:22:24.415735 IP 192.168.43.124.8880 > 192.168.43.147.7772: UDP, length 120
03:22:24.461066 IP 192.168.43.124.8880 > 192.168.43.147.7772: UDP, length 120
03:22:24.529251 IP 192.168.43.124.8880 > 192.168.43.147.7772: UDP, length 120
03:22:24.560616 IP 192.168.43.124.8880 > 192.168.43.147.7772: UDP, length 120
03:22:24.610787 IP 192.168.43.124.8880 > 192.168.43.147.7772: UDP, length 120
03:22:24.661140 IP 192.168.43.124.8880 > 192.168.43.147.7772: UDP, length 120
03:22:24.724301 IP 192.168.43.124.8880 > 192.168.43.147.7772: UDP, length 120
03:22:24.757850 IP 192.168.43.124.8880 > 192.168.43.147.7772: UDP, length 120
03:22:24.812656 IP 192.168.43.124.8880 > 192.168.43.147.7772: UDP, length 120
03:22:24.860628 IP 192.168.43.124.8880 > 192.168.43.147.7772: UDP, length 120
03:22:24.920690 IP 192.168.43.124.8880 > 192.168.43.147.7772: UDP, length 120
03:22:24.960952 IP 192.168.43.124.8880 > 192.168.43.147.7772: UDP, length 120
03:22:25.010593 IP 192.168.43.124.8880 > 192.168.43.147.7772: UDP, length 120
03:22:25.060603 IP 192.168.43.124.8880 > 192.168.43.147.7772: UDP, length 120
03:22:25.120699 IP 192.168.43.124.8880 > 192.168.43.147.7772: UDP, length 120
03:22:25.160712 IP 192.168.43.124.8880 > 192.168.43.147.7772: UDP, length 120
03:22:25.210579 IP 192.168.43.124.8880 > 192.168.43.147.7772: UDP, length 120
03:22:25.260605 IP 192.168.43.124.8880 > 192.168.43.147.7772: UDP, length 120
03:22:25.320771 IP 192.168.43.124.8880 > 192.168.43.147.7772: UDP, length 120
03:22:25.362552 IP 192.168.43.124.8880 > 192.168.43.147.7772: UDP, length 120
03:22:25.410320 IP 192.168.43.124.8880 > 192.168.43.147.7772: UDP, length 120
03:22:25.460723 IP 192.168.43.124.8880 > 192.168.43.147.7772: UDP, length 120
03:22:25.531519 IP 192.168.43.124.8880 > 192.168.43.147.7772: UDP, length 120
03:22:25.560695 IP 192.168.43.124.8880 > 192.168.43.147.7772: UDP, length 120
03:22:25.610718 IP 192.168.43.124.8880 > 192.168.43.147.7772: UDP, length 120
03:22:25.660663 IP 192.168.43.124.8880 > 192.168.43.147.7772: UDP, length 120
03:22:25.722083 IP 192.168.43.124.8880 > 192.168.43.147.7772: UDP, length 120
03:22:25.760933 IP 192.168.43.124.8880 > 192.168.43.147.7772: UDP, length 120
03:22:25.810818 IP 192.168.43.124.8880 > 192.168.43.147.7772: UDP, length 120
03:22:25.860653 IP 192.168.43.124.8880 > 192.168.43.147.7772: UDP, length 120
03:22:25.921022 IP 192.168.43.124.8880 > 192.168.43.147.7772: UDP, length 120
03:22:25.960763 IP 192.168.43.124.8880 > 192.168.43.147.7772: UDP, length 120
03:22:26.010854 IP 192.168.43.124.8880 > 192.168.43.147.7772: UDP, length 120
03:22:26.060653 IP 192.168.43.124.8880 > 192.168.43.147.7772: UDP, length 120
03:22:26.116991 IP 192.168.43.124.8880 > 192.168.43.147.7772: UDP, length 120
03:22:26.161304 IP 192.168.43.124.8880 > 192.168.43.147.7772: UDP, length 120
03:22:26.210565 IP 192.168.43.124.8880 > 192.168.43.147.7772: UDP, length 120
03:22:26.260597 IP 192.168.43.124.8880 > 192.168.43.147.7772: UDP, length 120
03:22:26.317936 IP 192.168.43.124.8880 > 192.168.43.147.7772: UDP, length 120
03:22:26.362532 IP 192.168.43.124.8880 > 192.168.43.147.7772: UDP, length 120
03:22:26.412063 IP 192.168.43.124.8880 > 192.168.43.147.7772: UDP, length 120
03:22:26.460630 IP 192.168.43.124.8880 > 192.168.43.147.7772: UDP, length 120
03:22:26.520136 IP 192.168.43.124.8880 > 192.168.43.147.7772: UDP, length 120
03:22:26.561898 IP 192.168.43.124.8880 > 192.168.43.147.7772: UDP, length 120
03:22:26.610510 IP 192.168.43.124.8880 > 192.168.43.147.7772: UDP, length 120
03:22:26.671843 IP 192.168.43.124.8880 > 192.168.43.147.7772: UDP, length 120
03:22:26.710778 IP 192.168.43.124.8880 > 192.168.43.147.7772: UDP, length 120
03:22:26.760597 IP 192.168.43.124.8880 > 192.168.43.147.7772: UDP, length 120
03:22:26.831889 IP 192.168.43.124.8880 > 192.168.43.147.7772: UDP, length 120
03:22:26.862517 IP 192.168.43.124.8880 > 192.168.43.147.7772: UDP, length 120
03:22:26.911319 IP 192.168.43.124.8880 > 192.168.43.147.7772: UDP, length 120
03:22:26.974195 IP 192.168.43.124.8880 > 192.168.43.147.7772: UDP, length 120
03:22:27.010814 IP 192.168.43.124.8880 > 192.168.43.147.7772: UDP, length 120
03:22:27.071140 IP 192.168.43.124.8880 > 192.168.43.147.7772: UDP, length 120
03:22:27.111606 IP 192.168.43.124.8880 > 192.168.43.147.7772: UDP, length 120
03:22:27.160653 IP 192.168.43.124.8880 > 192.168.43.147.7772: UDP, length 120
03:22:27.211080 IP 192.168.43.124.8880 > 192.168.43.147.7772: UDP, length 120
03:22:27.269747 IP 192.168.43.124.8880 > 192.168.43.147.7772: UDP, length 120
03:22:27.310054 IP 192.168.43.124.8880 > 192.168.43.147.7772: UDP, length 120
03:22:27.360439 IP 192.168.43.124.8880 > 192.168.43.147.7772: UDP, length 120
03:22:27.410820 IP 192.168.43.124.8880 > 192.168.43.147.7772: UDP, length 120
03:22:27.470736 IP 192.168.43.124.8880 > 192.168.43.147.7772: UDP, length 120
03:22:27.511349 IP 192.168.43.124.8880 > 192.168.43.147.7772: UDP, length 120
03:22:27.560771 IP 192.168.43.124.8880 > 192.168.43.147.7772: UDP, length 120
03:22:27.610807 IP 192.168.43.124.8880 > 192.168.43.147.7772: UDP, length 120
03:22:27.672685 IP 192.168.43.124.8880 > 192.168.43.147.7772: UDP, length 120
03:22:27.710904 IP 192.168.43.124.8880 > 192.168.43.147.7772: UDP, length 120
03:22:27.761438 IP 192.168.43.124.8880 > 192.168.43.147.7772: UDP, length 120
03:22:27.810736 IP 192.168.43.124.8880 > 192.168.43.147.7772: UDP, length 120
03:22:27.870724 IP 192.168.43.124.8880 > 192.168.43.147.7772: UDP, length 120
03:22:27.911019 IP 192.168.43.124.8880 > 192.168.43.147.7772: UDP, length 120
03:22:27.960895 IP 192.168.43.124.8880 > 192.168.43.147.7772: UDP, length 120
03:22:28.010721 IP 192.168.43.124.8880 > 192.168.43.147.7772: UDP, length 120
03:22:28.071562 IP 192.168.43.124.8880 > 192.168.43.147.7772: UDP, length 120
03:22:28.110860 IP 192.168.43.124.8880 > 192.168.43.147.7772: UDP, length 120
03:22:28.160625 IP 192.168.43.124.8880 > 192.168.43.147.7772: UDP, length 120
03:22:28.210803 IP 192.168.43.124.8880 > 192.168.43.147.7772: UDP, length 120
03:22:28.267448 IP 192.168.43.124.8880 > 192.168.43.147.7772: UDP, length 120
03:22:28.310511 IP 192.168.43.124.8880 > 192.168.43.147.7772: UDP, length 120
03:22:28.360630 IP 192.168.43.124.8880 > 192.168.43.147.7772: UDP, length 120
03:22:28.434634 IP 192.168.43.124.8880 > 192.168.43.147.7772: UDP, length 120
03:22:28.461753 IP 192.168.43.124.8880 > 192.168.43.147.7772: UDP, length 120
03:22:28.518141 IP 192.168.43.124.8880 > 192.168.43.147.7772: UDP, length 120
03:22:28.562412 IP 192.168.43.124.8880 > 192.168.43.147.7772: UDP, length 120
03:22:28.618952 IP 192.168.43.124.8880 > 192.168.43.147.7772: UDP, length 120
03:22:28.660828 IP 192.168.43.124.8880 > 192.168.43.147.7772: UDP, length 120
03:22:28.713280 IP 192.168.43.124.8880 > 192.168.43.147.7772: UDP, length 120
03:22:28.767432 IP 192.168.43.124.8880 > 192.168.43.147.7772: UDP, length 120
03:22:28.815154 IP 192.168.43.124.8880 > 192.168.43.147.7772: UDP, length 120
03:22:28.860651 IP 192.168.43.124.8880 > 192.168.43.147.7772: UDP, length 120
03:22:28.922430 IP 192.168.43.124.8880 > 192.168.43.147.7772: UDP, length 120
03:22:28.960959 IP 192.168.43.124.8880 > 192.168.43.147.7772: UDP, length 120
03:22:29.011299 IP 192.168.43.124.8880 > 192.168.43.147.7772: UDP, length 120
03:22:29.072304 IP 192.168.43.124.8880 > 192.168.43.147.7772: UDP, length 120
03:22:29.113255 IP 192.168.43.124.8880 > 192.168.43.147.7772: UDP, length 120
03:22:29.161331 IP 192.168.43.124.8880 > 192.168.43.147.7772: UDP, length 120
03:22:29.210761 IP 192.168.43.124.8880 > 192.168.43.147.7772: UDP, length 120
03:22:29.267467 IP 192.168.43.124.8880 > 192.168.43.147.7772: UDP, length 120
03:22:29.310936 IP 192.168.43.124.8880 > 192.168.43.147.7772: UDP, length 120
03:22:29.360657 IP 192.168.43.124.8880 > 192.168.43.147.7772: UDP, length 120
03:22:29.410687 IP 192.168.43.124.8880 > 192.168.43.147.7772: UDP, length 120
03:22:29.470087 IP 192.168.43.124.8880 > 192.168.43.147.7772: UDP, length 120
03:22:29.540992 IP 192.168.43.124.8880 > 192.168.43.147.7772: UDP, length 120
03:22:29.558572 IP 192.168.43.124.8880 > 192.168.43.147.7772: UDP, length 120
03:22:29.618430 IP 192.168.43.124.8880 > 192.168.43.147.7772: UDP, length 120
03:22:29.660650 IP 192.168.43.124.8880 > 192.168.43.147.7772: UDP, length 120
03:22:29.710484 IP 192.168.43.124.8880 > 192.168.43.147.7772: UDP, length 120
03:22:29.776845 IP 192.168.43.124.8880 > 192.168.43.147.7772: UDP, length 120
03:22:29.812242 IP 192.168.43.124.8880 > 192.168.43.147.7772: UDP, length 120
03:22:29.860656 IP 192.168.43.124.8880 > 192.168.43.147.7772: UDP, length 120
03:22:29.923075 IP 192.168.43.124.8880 > 192.168.43.147.7772: UDP, length 120
03:22:29.960655 IP 192.168.43.124.8880 > 192.168.43.147.7772: UDP, length 120
03:22:30.010485 IP 192.168.43.124.8880 > 192.168.43.147.7772: UDP, length 120
03:22:30.083332 IP 192.168.43.124.8880 > 192.168.43.147.7772: UDP, length 120
03:22:30.110731 IP 192.168.43.124.8880 > 192.168.43.147.7772: UDP, length 120
03:22:30.160841 IP 192.168.43.124.8880 > 192.168.43.147.7772: UDP, length 120
03:22:30.210627 IP 192.168.43.124.8880 > 192.168.43.147.7772: UDP, length 120
03:22:30.270676 IP 192.168.43.124.8880 > 192.168.43.147.7772: UDP, length 120
03:22:30.310625 IP 192.168.43.124.8880 > 192.168.43.147.7772: UDP, length 120
03:22:30.360851 IP 192.168.43.124.8880 > 192.168.43.147.7772: UDP, length 120
03:22:30.410605 IP 192.168.43.124.8880 > 192.168.43.147.7772: UDP, length 120
03:22:30.470570 IP 192.168.43.124.8880 > 192.168.43.147.7772: UDP, length 120
03:22:30.510873 IP 192.168.43.124.8880 > 192.168.43.147.7772: UDP, length 120
03:22:30.560813 IP 192.168.43.124.8880 > 192.168.43.147.7772: UDP, length 120
03:22:30.610607 IP 192.168.43.124.8880 > 192.168.43.147.7772: UDP, length 120
03:22:30.670572 IP 192.168.43.124.8880 > 192.168.43.147.7772: UDP, length 120
03:22:30.710783 IP 192.168.43.124.8880 > 192.168.43.147.7772: UDP, length 120
03:22:30.761327 IP 192.168.43.124.8880 > 192.168.43.147.7772: UDP, length 120
03:22:30.836219 IP 192.168.43.124.8880 > 192.168.43.147.7772: UDP, length 120
03:22:30.863811 IP 192.168.43.124.8880 > 192.168.43.147.7772: UDP, length 120
03:22:30.910779 IP 192.168.43.124.8880 > 192.168.43.147.7772: UDP, length 120
03:22:30.968043 IP 192.168.43.124.8880 > 192.168.43.147.7772: UDP, length 120
03:22:31.010513 IP 192.168.43.124.8880 > 192.168.43.147.7772: UDP, length 120
03:22:31.069737 IP 192.168.43.124.8880 > 192.168.43.147.7772: UDP, length 120
03:22:31.110708 IP 192.168.43.124.8880 > 192.168.43.147.7772: UDP, length 120
03:22:31.161324 IP 192.168.43.124.8880 > 192.168.43.147.7772: UDP, length 120
03:22:31.210423 IP 192.168.43.124.8880 > 192.168.43.147.7772: UDP, length 120
03:22:31.267847 IP 192.168.43.124.8880 > 192.168.43.147.7772: UDP, length 120
03:22:31.312060 IP 192.168.43.124.8880 > 192.168.43.147.7772: UDP, length 120
03:22:31.360641 IP 192.168.43.124.8880 > 192.168.43.147.7772: UDP, length 120
03:22:31.410930 IP 192.168.43.124.8880 > 192.168.43.147.7772: UDP, length 120
03:22:31.470220 IP 192.168.43.124.8880 > 192.168.43.147.7772: UDP, length 120
03:22:31.518081 IP 192.168.43.124.8880 > 192.168.43.147.7772: UDP, length 120
03:22:31.560828 IP 192.168.43.124.8880 > 192.168.43.147.7772: UDP, length 120
03:22:31.611023 IP 192.168.43.124.8880 > 192.168.43.147.7772: UDP, length 120
03:22:31.673069 IP 192.168.43.124.8880 > 192.168.43.147.7772: UDP, length 120
03:22:31.711816 IP 192.168.43.124.8880 > 192.168.43.147.7772: UDP, length 120
03:22:31.760924 IP 192.168.43.124.8880 > 192.168.43.147.7772: UDP, length 120
03:22:31.810513 IP 192.168.43.124.8880 > 192.168.43.147.7772: UDP, length 120
03:22:31.870540 IP 192.168.43.124.8880 > 192.168.43.147.7772: UDP, length 120
03:22:31.910871 IP 192.168.43.124.8880 > 192.168.43.147.7772: UDP, length 120
03:22:31.960808 IP 192.168.43.124.8880 > 192.168.43.147.7772: UDP, length 120
03:22:32.010678 IP 192.168.43.124.8880 > 192.168.43.147.7772: UDP, length 120
03:22:32.082863 IP 192.168.43.124.8880 > 192.168.43.147.7772: UDP, length 120
03:22:32.110876 IP 192.168.43.124.8880 > 192.168.43.147.7772: UDP, length 120
03:22:32.160510 IP 192.168.43.124.8880 > 192.168.43.147.7772: UDP, length 120
03:22:32.210546 IP 192.168.43.124.8880 > 192.168.43.147.7772: UDP, length 120
03:22:32.268010 IP 192.168.43.124.8880 > 192.168.43.147.7772: UDP, length 120
03:22:32.310748 IP 192.168.43.124.8880 > 192.168.43.147.7772: UDP, length 120
03:22:32.360578 IP 192.168.43.124.8880 > 192.168.43.147.7772: UDP, length 120
03:22:32.410635 IP 192.168.43.124.8880 > 192.168.43.147.7772: UDP, length 120
03:22:32.471609 IP 192.168.43.124.8880 > 192.168.43.147.7772: UDP, length 120
03:22:32.511038 IP 192.168.43.124.8880 > 192.168.43.147.7772: UDP, length 120
03:22:32.560850 IP 192.168.43.124.8880 > 192.168.43.147.7772: UDP, length 120
03:22:32.610698 IP 192.168.43.124.8880 > 192.168.43.147.7772: UDP, length 120
03:22:32.670537 IP 192.168.43.124.8880 > 192.168.43.147.7772: UDP, length 120
03:22:32.711101 IP 192.168.43.124.8880 > 192.168.43.147.7772: UDP, length 120
03:22:32.772168 IP 192.168.43.124.8880 > 192.168.43.147.7772: UDP, length 120
03:22:32.810628 IP 192.168.43.124.8880 > 192.168.43.147.7772: UDP, length 120
03:22:32.856995 IP 192.168.43.124.8880 > 192.168.43.147.7772: UDP, length 120
03:22:32.912076 IP 192.168.43.124.8880 > 192.168.43.147.7772: UDP, length 120
03:22:32.960486 IP 192.168.43.124.8880 > 192.168.43.147.7772: UDP, length 120
03:22:33.033402 IP 192.168.43.124.8880 > 192.168.43.147.7772: UDP, length 120
03:22:33.060597 IP 192.168.43.124.8880 > 192.168.43.147.7772: UDP, length 120
03:22:33.116814 IP 192.168.43.124.8880 > 192.168.43.147.7772: UDP, length 120
03:22:33.162146 IP 192.168.43.124.8880 > 192.168.43.147.7772: UDP, length 120
03:22:33.212357 IP 192.168.43.124.8880 > 192.168.43.147.7772: UDP, length 120
03:22:33.260642 IP 192.168.43.124.8880 > 192.168.43.147.7772: UDP, length 120
03:22:33.313407 IP 192.168.43.124.8880 > 192.168.43.147.7772: UDP, length 120
03:22:33.513449 IP 192.168.43.124.8880 > 192.168.43.147.7772: UDP, length 120
03:22:33.513685 IP 192.168.43.124.8880 > 192.168.43.147.7772: UDP, length 120
03:22:33.609381 IP 192.168.43.124.8880 > 192.168.43.147.7772: UDP, length 120
03:22:33.609690 IP 192.168.43.124.8880 > 192.168.43.147.7772: UDP, length 120
03:22:33.713432 IP 192.168.43.124.8880 > 192.168.43.147.7772: UDP, length 120
03:22:33.713669 IP 192.168.43.124.8880 > 192.168.43.147.7772: UDP, length 120
03:22:33.812435 IP 192.168.43.124.8880 > 192.168.43.147.7772: UDP, length 120
03:22:33.812676 IP 192.168.43.124.8880 > 192.168.43.147.7772: UDP, length 120
03:22:33.913055 IP 192.168.43.124.8880 > 192.168.43.147.7772: UDP, length 120
03:22:33.913289 IP 192.168.43.124.8880 > 192.168.43.147.7772: UDP, length 120
03:22:34.013027 IP 192.168.43.124.8880 > 192.168.43.147.7772: UDP, length 120
03:22:34.013254 IP 192.168.43.124.8880 > 192.168.43.147.7772: UDP, length 120
03:22:34.113160 IP 192.168.43.124.8880 > 192.168.43.147.7772: UDP, length 120
