21:42:25.268116 IP 192.168.43.124.8880 > 192.168.43.146.7771: UDP, length 120
21:42:25.318267 IP 192.168.43.124.8880 > 192.168.43.146.7771: UDP, length 120
21:42:25.368222 IP 192.168.43.124.8880 > 192.168.43.146.7771: UDP, length 120
21:42:25.418267 IP 192.168.43.124.8880 > 192.168.43.146.7771: UDP, length 120
21:42:25.468267 IP 192.168.43.124.8880 > 192.168.43.146.7771: UDP, length 120
21:42:25.518268 IP 192.168.43.124.8880 > 192.168.43.146.7771: UDP, length 120
21:42:25.568271 IP 192.168.43.124.8880 > 192.168.43.146.7771: UDP, length 120
21:42:25.618270 IP 192.168.43.124.8880 > 192.168.43.146.7771: UDP, length 120
21:42:25.668267 IP 192.168.43.124.8880 > 192.168.43.146.7771: UDP, length 120
21:42:25.718267 IP 192.168.43.124.8880 > 192.168.43.146.7771: UDP, length 120
21:42:25.768322 IP 192.168.43.124.8880 > 192.168.43.146.7771: UDP, length 120
21:42:25.818312 IP 192.168.43.124.8880 > 192.168.43.146.7771: UDP, length 120
21:42:25.868268 IP 192.168.43.124.8880 > 192.168.43.146.7771: UDP, length 120
21:42:25.874042 IP 192.168.43.147.8880 > 192.168.43.124.7773: UDP, length 120
21:42:25.918267 IP 192.168.43.124.8880 > 192.168.43.146.7771: UDP, length 120
21:42:25.928323 IP 192.168.43.147.8880 > 192.168.43.124.7773: UDP, length 120
21:42:25.968268 IP 192.168.43.124.8880 > 192.168.43.146.7771: UDP, length 120
21:42:25.974668 IP 192.168.43.147.8880 > 192.168.43.124.7773: UDP, length 120
21:42:26.018323 IP 192.168.43.124.8880 > 192.168.43.146.7771: UDP, length 120
21:42:26.022494 IP 192.168.43.147.8880 > 192.168.43.124.7773: UDP, length 120
21:42:26.068324 IP 192.168.43.124.8880 > 192.168.43.146.7771: UDP, length 120
21:42:26.072367 IP 192.168.43.147.8880 > 192.168.43.124.7773: UDP, length 120
21:42:26.118213 IP 192.168.43.124.8880 > 192.168.43.146.7771: UDP, length 120
21:42:26.122455 IP 192.168.43.147.8880 > 192.168.43.124.7773: UDP, length 120
21:42:26.168267 IP 192.168.43.124.8880 > 192.168.43.146.7771: UDP, length 120
21:42:26.173099 IP 192.168.43.147.8880 > 192.168.43.124.7773: UDP, length 120
21:42:26.218266 IP 192.168.43.124.8880 > 192.168.43.146.7771: UDP, length 120
21:42:26.225826 IP 192.168.43.147.8880 > 192.168.43.124.7773: UDP, length 120
21:42:26.268268 IP 192.168.43.124.8880 > 192.168.43.146.7771: UDP, length 120
21:42:26.278877 IP 192.168.43.147.8880 > 192.168.43.124.7773: UDP, length 120
21:42:26.318269 IP 192.168.43.124.8880 > 192.168.43.146.7771: UDP, length 120
21:42:26.327496 IP 192.168.43.147.8880 > 192.168.43.124.7773: UDP, length 120
21:42:26.368269 IP 192.168.43.124.8880 > 192.168.43.146.7771: UDP, length 120
21:42:26.404970 IP 192.168.43.147.8880 > 192.168.43.124.7773: UDP, length 120
21:42:26.418271 IP 192.168.43.124.8880 > 192.168.43.146.7771: UDP, length 120
21:42:26.427387 IP 192.168.43.147.8880 > 192.168.43.124.7773: UDP, length 120
21:42:26.468272 IP 192.168.43.124.8880 > 192.168.43.146.7771: UDP, length 120
21:42:26.475129 IP 192.168.43.147.8880 > 192.168.43.124.7773: UDP, length 120
21:42:26.518267 IP 192.168.43.124.8880 > 192.168.43.146.7771: UDP, length 120
21:42:26.523975 IP 192.168.43.147.8880 > 192.168.43.124.7773: UDP, length 120
21:42:26.568210 IP 192.168.43.124.8880 > 192.168.43.146.7771: UDP, length 120
21:42:26.572164 IP 192.168.43.147.8880 > 192.168.43.124.7773: UDP, length 120
21:42:26.618267 IP 192.168.43.124.8880 > 192.168.43.146.7771: UDP, length 120
21:42:26.622264 IP 192.168.43.147.8880 > 192.168.43.124.7773: UDP, length 120
21:42:26.668267 IP 192.168.43.124.8880 > 192.168.43.146.7771: UDP, length 120
21:42:26.672196 IP 192.168.43.147.8880 > 192.168.43.124.7773: UDP, length 120
21:42:26.718268 IP 192.168.43.124.8880 > 192.168.43.146.7771: UDP, length 120
21:42:26.722211 IP 192.168.43.147.8880 > 192.168.43.124.7773: UDP, length 120
21:42:26.768221 IP 192.168.43.124.8880 > 192.168.43.146.7771: UDP, length 120
21:42:26.774601 IP 192.168.43.147.8880 > 192.168.43.124.7773: UDP, length 120
21:42:26.818267 IP 192.168.43.124.8880 > 192.168.43.146.7771: UDP, length 120
21:42:26.824690 IP 192.168.43.147.8880 > 192.168.43.124.7773: UDP, length 120
21:42:26.868267 IP 192.168.43.124.8880 > 192.168.43.146.7771: UDP, length 120
21:42:26.872038 IP 192.168.43.147.8880 > 192.168.43.124.7773: UDP, length 120
21:42:26.918268 IP 192.168.43.124.8880 > 192.168.43.146.7771: UDP, length 120
21:42:26.925177 IP 192.168.43.147.8880 > 192.168.43.124.7773: UDP, length 120
21:42:26.968269 IP 192.168.43.124.8880 > 192.168.43.146.7771: UDP, length 120
21:42:26.977053 IP 192.168.43.147.8880 > 192.168.43.124.7773: UDP, length 120
21:42:27.018268 IP 192.168.43.124.8880 > 192.168.43.146.7771: UDP, length 120
21:42:27.022202 IP 192.168.43.147.8880 > 192.168.43.124.7773: UDP, length 120
21:42:27.068268 IP 192.168.43.124.8880 > 192.168.43.146.7771: UDP, length 120
21:42:27.072189 IP 192.168.43.147.8880 > 192.168.43.124.7773: UDP, length 120
21:42:27.118267 IP 192.168.43.124.8880 > 192.168.43.146.7771: UDP, length 120
21:42:27.124950 IP 192.168.43.147.8880 > 192.168.43.124.7773: UDP, length 120
21:42:27.168268 IP 192.168.43.124.8880 > 192.168.43.146.7771: UDP, length 120
21:42:27.172530 IP 192.168.43.147.8880 > 192.168.43.124.7773: UDP, length 120
21:42:27.218268 IP 192.168.43.124.8880 > 192.168.43.146.7771: UDP, length 120
21:42:27.222204 IP 192.168.43.147.8880 > 192.168.43.124.7773: UDP, length 120
21:42:27.268270 IP 192.168.43.124.8880 > 192.168.43.146.7771: UDP, length 120
21:42:27.274768 IP 192.168.43.147.8880 > 192.168.43.124.7773: UDP, length 120
21:42:27.318273 IP 192.168.43.124.8880 > 192.168.43.146.7771: UDP, length 120
21:42:27.326961 IP 192.168.43.147.8880 > 192.168.43.124.7773: UDP, length 120
21:42:27.368270 IP 192.168.43.124.8880 > 192.168.43.146.7771: UDP, length 120
21:42:27.377469 IP 192.168.43.147.8880 > 192.168.43.124.7773: UDP, length 120
21:42:27.418267 IP 192.168.43.124.8880 > 192.168.43.146.7771: UDP, length 120
21:42:27.425814 IP 192.168.43.147.8880 > 192.168.43.124.7773: UDP, length 120
21:42:27.468269 IP 192.168.43.124.8880 > 192.168.43.146.7771: UDP, length 120
21:42:27.479609 IP 192.168.43.147.8880 > 192.168.43.124.7773: UDP, length 120
21:42:27.518272 IP 192.168.43.124.8880 > 192.168.43.146.7771: UDP, length 120
21:42:27.527535 IP 192.168.43.147.8880 > 192.168.43.124.7773: UDP, length 120
21:42:27.568270 IP 192.168.43.124.8880 > 192.168.43.146.7771: UDP, length 120
21:42:27.572379 IP 192.168.43.147.8880 > 192.168.43.124.7773: UDP, length 120
21:42:27.618270 IP 192.168.43.124.8880 > 192.168.43.146.7771: UDP, length 120
21:42:27.629304 IP 192.168.43.147.8880 > 192.168.43.124.7773: UDP, length 120
21:42:27.668272 IP 192.168.43.124.8880 > 192.168.43.146.7771: UDP, length 120
21:42:27.683321 IP 192.168.43.147.8880 > 192.168.43.124.7773: UDP, length 120
21:42:27.718272 IP 192.168.43.124.8880 > 192.168.43.146.7771: UDP, length 120
21:42:27.735446 IP 192.168.43.147.8880 > 192.168.43.124.7773: UDP, length 120
21:42:27.768272 IP 192.168.43.124.8880 > 192.168.43.146.7771: UDP, length 120
21:42:27.816446 IP 192.168.43.147.8880 > 192.168.43.124.7773: UDP, length 120
21:42:27.818272 IP 192.168.43.124.8880 > 192.168.43.146.7771: UDP, length 120
21:42:27.828408 IP 192.168.43.147.8880 > 192.168.43.124.7773: UDP, length 120
21:42:27.868267 IP 192.168.43.124.8880 > 192.168.43.146.7771: UDP, length 120
21:42:27.876005 IP 192.168.43.147.8880 > 192.168.43.124.7773: UDP, length 120
21:42:27.918243 IP 192.168.43.124.8880 > 192.168.43.146.7771: UDP, length 120
21:42:27.926181 IP 192.168.43.147.8880 > 192.168.43.124.7773: UDP, length 120
21:42:27.968264 IP 192.168.43.124.8880 > 192.168.43.146.7771: UDP, length 120
21:42:27.991945 IP 192.168.43.147.8880 > 192.168.43.124.7773: UDP, length 120
21:42:28.018325 IP 192.168.43.124.8880 > 192.168.43.146.7771: UDP, length 120
21:42:28.068271 IP 192.168.43.124.8880 > 192.168.43.146.7771: UDP, length 120
21:42:28.078200 IP 192.168.43.147.8880 > 192.168.43.124.7773: UDP, length 120
21:42:28.118273 IP 192.168.43.124.8880 > 192.168.43.146.7771: UDP, length 120
21:42:28.122456 IP 192.168.43.147.8880 > 192.168.43.124.7773: UDP, length 120
21:42:28.168275 IP 192.168.43.124.8880 > 192.168.43.146.7771: UDP, length 120
21:42:28.180982 IP 192.168.43.147.8880 > 192.168.43.124.7773: UDP, length 120
21:42:28.218275 IP 192.168.43.124.8880 > 192.168.43.146.7771: UDP, length 120
21:42:28.222494 IP 192.168.43.147.8880 > 192.168.43.124.7773: UDP, length 120
21:42:28.268269 IP 192.168.43.124.8880 > 192.168.43.146.7771: UDP, length 120
21:42:28.274196 IP 192.168.43.147.8880 > 192.168.43.124.7773: UDP, length 120
21:42:28.318321 IP 192.168.43.124.8880 > 192.168.43.146.7771: UDP, length 120
21:42:28.322927 IP 192.168.43.147.8880 > 192.168.43.124.7773: UDP, length 120
21:42:28.368813 IP 192.168.43.124.8880 > 192.168.43.146.7771: UDP, length 120
21:42:28.376234 IP 192.168.43.147.8880 > 192.168.43.124.7773: UDP, length 120
21:42:28.418272 IP 192.168.43.124.8880 > 192.168.43.146.7771: UDP, length 120
21:42:28.427681 IP 192.168.43.147.8880 > 192.168.43.124.7773: UDP, length 120
21:42:28.468270 IP 192.168.43.124.8880 > 192.168.43.146.7771: UDP, length 120
21:42:28.475036 IP 192.168.43.147.8880 > 192.168.43.124.7773: UDP, length 120
21:42:28.518271 IP 192.168.43.124.8880 > 192.168.43.146.7771: UDP, length 120
21:42:28.527679 IP 192.168.43.147.8880 > 192.168.43.124.7773: UDP, length 120
21:42:28.568274 IP 192.168.43.124.8880 > 192.168.43.146.7771: UDP, length 120
21:42:28.572309 IP 192.168.43.147.8880 > 192.168.43.124.7773: UDP, length 120
21:42:28.618271 IP 192.168.43.124.8880 > 192.168.43.146.7771: UDP, length 120
21:42:28.622453 IP 192.168.43.147.8880 > 192.168.43.124.7773: UDP, length 120
21:42:28.668273 IP 192.168.43.124.8880 > 192.168.43.146.7771: UDP, length 120
21:42:28.672409 IP 192.168.43.147.8880 > 192.168.43.124.7773: UDP, length 120
21:42:28.718211 IP 192.168.43.124.8880 > 192.168.43.146.7771: UDP, length 120
21:42:28.724694 IP 192.168.43.147.8880 > 192.168.43.124.7773: UDP, length 120
21:42:28.768265 IP 192.168.43.124.8880 > 192.168.43.146.7771: UDP, length 120
21:42:28.774654 IP 192.168.43.147.8880 > 192.168.43.124.7773: UDP, length 120
21:42:28.818267 IP 192.168.43.124.8880 > 192.168.43.146.7771: UDP, length 120
21:42:28.823220 IP 192.168.43.147.8880 > 192.168.43.124.7773: UDP, length 120
21:42:28.868267 IP 192.168.43.124.8880 > 192.168.43.146.7771: UDP, length 120
21:42:28.872454 IP 192.168.43.147.8880 > 192.168.43.124.7773: UDP, length 120
21:42:28.918215 IP 192.168.43.124.8880 > 192.168.43.146.7771: UDP, length 120
21:42:28.925158 IP 192.168.43.147.8880 > 192.168.43.124.7773: UDP, length 120
21:42:28.968270 IP 192.168.43.124.8880 > 192.168.43.146.7771: UDP, length 120
21:42:28.972588 IP 192.168.43.147.8880 > 192.168.43.124.7773: UDP, length 120
21:42:29.018220 IP 192.168.43.124.8880 > 192.168.43.146.7771: UDP, length 120
21:42:29.025590 IP 192.168.43.147.8880 > 192.168.43.124.7773: UDP, length 120
21:42:29.068268 IP 192.168.43.124.8880 > 192.168.43.146.7771: UDP, length 120
21:42:29.072397 IP 192.168.43.147.8880 > 192.168.43.124.7773: UDP, length 120
21:42:29.118267 IP 192.168.43.124.8880 > 192.168.43.146.7771: UDP, length 120
21:42:29.127912 IP 192.168.43.147.8880 > 192.168.43.124.7773: UDP, length 120
21:42:29.168266 IP 192.168.43.124.8880 > 192.168.43.146.7771: UDP, length 120
21:42:29.172369 IP 192.168.43.147.8880 > 192.168.43.124.7773: UDP, length 120
21:42:29.218198 IP 192.168.43.124.8880 > 192.168.43.146.7771: UDP, length 120
21:42:29.222316 IP 192.168.43.147.8880 > 192.168.43.124.7773: UDP, length 120
21:42:29.268196 IP 192.168.43.124.8880 > 192.168.43.146.7771: UDP, length 120
21:42:29.276944 IP 192.168.43.147.8880 > 192.168.43.124.7773: UDP, length 120
21:42:29.318260 IP 192.168.43.124.8880 > 192.168.43.146.7771: UDP, length 120
21:42:29.322407 IP 192.168.43.147.8880 > 192.168.43.124.7773: UDP, length 120
21:42:29.368209 IP 192.168.43.124.8880 > 192.168.43.146.7771: UDP, length 120
21:42:29.372224 IP 192.168.43.147.8880 > 192.168.43.124.7773: UDP, length 120
21:42:29.418268 IP 192.168.43.124.8880 > 192.168.43.146.7771: UDP, length 120
21:42:29.426014 IP 192.168.43.147.8880 > 192.168.43.124.7773: UDP, length 120
21:42:29.468269 IP 192.168.43.124.8880 > 192.168.43.146.7771: UDP, length 120
21:42:29.476972 IP 192.168.43.147.8880 > 192.168.43.124.7773: UDP, length 120
21:42:29.518271 IP 192.168.43.124.8880 > 192.168.43.146.7771: UDP, length 120
21:42:29.527343 IP 192.168.43.147.8880 > 192.168.43.124.7773: UDP, length 120
21:42:29.568266 IP 192.168.43.124.8880 > 192.168.43.146.7771: UDP, length 120
21:42:29.577690 IP 192.168.43.147.8880 > 192.168.43.124.7773: UDP, length 120
21:42:29.618269 IP 192.168.43.124.8880 > 192.168.43.146.7771: UDP, length 120
21:42:29.628699 IP 192.168.43.147.8880 > 192.168.43.124.7773: UDP, length 120
21:42:29.668267 IP 192.168.43.124.8880 > 192.168.43.146.7771: UDP, length 120
21:42:29.677977 IP 192.168.43.147.8880 > 192.168.43.124.7773: UDP, length 120
21:42:29.718268 IP 192.168.43.124.8880 > 192.168.43.146.7771: UDP, length 120
21:42:29.722179 IP 192.168.43.147.8880 > 192.168.43.124.7773: UDP, length 120
21:42:29.768257 IP 192.168.43.124.8880 > 192.168.43.146.7771: UDP, length 120
21:42:29.779110 IP 192.168.43.147.8880 > 192.168.43.124.7773: UDP, length 120
21:42:29.818221 IP 192.168.43.124.8880 > 192.168.43.146.7771: UDP, length 120
21:42:29.822409 IP 192.168.43.147.8880 > 192.168.43.124.7773: UDP, length 120
21:42:29.868270 IP 192.168.43.124.8880 > 192.168.43.146.7771: UDP, length 120
21:42:29.876749 IP 192.168.43.147.8880 > 192.168.43.124.7773: UDP, length 120
21:42:29.918318 IP 192.168.43.124.8880 > 192.168.43.146.7771: UDP, length 120
21:42:29.925893 IP 192.168.43.147.8880 > 192.168.43.124.7773: UDP, length 120
21:42:29.968320 IP 192.168.43.124.8880 > 192.168.43.146.7771: UDP, length 120
21:42:29.982028 IP 192.168.43.147.8880 > 192.168.43.124.7773: UDP, length 120
21:42:30.018322 IP 192.168.43.124.8880 > 192.168.43.146.7771: UDP, length 120
21:42:30.026007 IP 192.168.43.147.8880 > 192.168.43.124.7773: UDP, length 120
21:42:30.068371 IP 192.168.43.124.8880 > 192.168.43.146.7771: UDP, length 120
21:42:30.076337 IP 192.168.43.147.8880 > 192.168.43.124.7773: UDP, length 120
21:42:30.118370 IP 192.168.43.124.8880 > 192.168.43.146.7771: UDP, length 120
21:42:30.125516 IP 192.168.43.147.8880 > 192.168.43.124.7773: UDP, length 120
21:42:30.168325 IP 192.168.43.124.8880 > 192.168.43.146.7771: UDP, length 120
21:42:30.173030 IP 192.168.43.147.8880 > 192.168.43.124.7773: UDP, length 120
21:42:30.218328 IP 192.168.43.124.8880 > 192.168.43.146.7771: UDP, length 120
21:42:30.234882 IP 192.168.43.147.8880 > 192.168.43.124.7773: UDP, length 120
21:42:30.268326 IP 192.168.43.124.8880 > 192.168.43.146.7771: UDP, length 120
21:42:30.275258 IP 192.168.43.147.8880 > 192.168.43.124.7773: UDP, length 120
21:42:30.318317 IP 192.168.43.124.8880 > 192.168.43.146.7771: UDP, length 120
21:42:30.322530 IP 192.168.43.147.8880 > 192.168.43.124.7773: UDP, length 120
21:42:30.368236 IP 192.168.43.124.8880 > 192.168.43.146.7771: UDP, length 120
21:42:30.372368 IP 192.168.43.147.8880 > 192.168.43.124.7773: UDP, length 120
21:42:30.418270 IP 192.168.43.124.8880 > 192.168.43.146.7771: UDP, length 120
21:42:30.424697 IP 192.168.43.147.8880 > 192.168.43.124.7773: UDP, length 120
21:42:30.468276 IP 192.168.43.124.8880 > 192.168.43.146.7771: UDP, length 120
21:42:30.472551 IP 192.168.43.147.8880 > 192.168.43.124.7773: UDP, length 120
21:42:30.518272 IP 192.168.43.124.8880 > 192.168.43.146.7771: UDP, length 120
21:42:30.525441 IP 192.168.43.147.8880 > 192.168.43.124.7773: UDP, length 120
21:42:30.568272 IP 192.168.43.124.8880 > 192.168.43.146.7771: UDP, length 120
21:42:30.576815 IP 192.168.43.147.8880 > 192.168.43.124.7773: UDP, length 120
21:42:30.618272 IP 192.168.43.124.8880 > 192.168.43.146.7771: UDP, length 120
21:42:30.622187 IP 192.168.43.147.8880 > 192.168.43.124.7773: UDP, length 120
21:42:30.668273 IP 192.168.43.124.8880 > 192.168.43.146.7771: UDP, length 120
21:42:30.673845 IP 192.168.43.147.8880 > 192.168.43.124.7773: UDP, length 120
21:42:30.718276 IP 192.168.43.124.8880 > 192.168.43.146.7771: UDP, length 120
21:42:30.724006 IP 192.168.43.147.8880 > 192.168.43.124.7773: UDP, length 120
21:42:30.768258 IP 192.168.43.124.8880 > 192.168.43.146.7771: UDP, length 120
21:42:30.775673 IP 192.168.43.147.8880 > 192.168.43.124.7773: UDP, length 120
21:42:30.818267 IP 192.168.43.124.8880 > 192.168.43.146.7771: UDP, length 120
21:42:30.822285 IP 192.168.43.147.8880 > 192.168.43.124.7773: UDP, length 120
21:42:30.868344 IP 192.168.43.124.8880 > 192.168.43.146.7771: UDP, length 120
21:42:30.875393 IP 192.168.43.147.8880 > 192.168.43.124.7773: UDP, length 120
21:42:30.918266 IP 192.168.43.124.8880 > 192.168.43.146.7771: UDP, length 120
21:42:30.924531 IP 192.168.43.147.8880 > 192.168.43.124.7773: UDP, length 120
21:42:30.968266 IP 192.168.43.124.8880 > 192.168.43.146.7771: UDP, length 120
21:42:30.972748 IP 192.168.43.147.8880 > 192.168.43.124.7773: UDP, length 120
21:42:31.018269 IP 192.168.43.124.8880 > 192.168.43.146.7771: UDP, length 120
21:42:31.022243 IP 192.168.43.147.8880 > 192.168.43.124.7773: UDP, length 120
21:42:31.068267 IP 192.168.43.124.8880 > 192.168.43.146.7771: UDP, length 120
21:42:31.075267 IP 192.168.43.147.8880 > 192.168.43.124.7773: UDP, length 120
21:42:31.118308 IP 192.168.43.124.8880 > 192.168.43.146.7771: UDP, length 120
21:42:31.124744 IP 192.168.43.147.8880 > 192.168.43.124.7773: UDP, length 120
21:42:31.168304 IP 192.168.43.124.8880 > 192.168.43.146.7771: UDP, length 120
21:42:31.175933 IP 192.168.43.147.8880 > 192.168.43.124.7773: UDP, length 120
21:42:31.218305 IP 192.168.43.124.8880 > 192.168.43.146.7771: UDP, length 120
21:42:31.224065 IP 192.168.43.147.8880 > 192.168.43.124.7773: UDP, length 120
21:42:31.268306 IP 192.168.43.124.8880 > 192.168.43.146.7771: UDP, length 120
21:42:31.272374 IP 192.168.43.147.8880 > 192.168.43.124.7773: UDP, length 120
21:42:31.318271 IP 192.168.43.124.8880 > 192.168.43.146.7771: UDP, length 120
21:42:31.324945 IP 192.168.43.147.8880 > 192.168.43.124.7773: UDP, length 120
21:42:31.368238 IP 192.168.43.124.8880 > 192.168.43.146.7771: UDP, length 120
21:42:31.372305 IP 192.168.43.147.8880 > 192.168.43.124.7773: UDP, length 120
21:42:31.418270 IP 192.168.43.124.8880 > 192.168.43.146.7771: UDP, length 120
21:42:31.422391 IP 192.168.43.147.8880 > 192.168.43.124.7773: UDP, length 120
21:42:31.468272 IP 192.168.43.124.8880 > 192.168.43.146.7771: UDP, length 120
21:42:31.474422 IP 192.168.43.147.8880 > 192.168.43.124.7773: UDP, length 120
21:42:31.518273 IP 192.168.43.124.8880 > 192.168.43.146.7771: UDP, length 120
21:42:31.522363 IP 192.168.43.147.8880 > 192.168.43.124.7773: UDP, length 120
21:42:31.568274 IP 192.168.43.124.8880 > 192.168.43.146.7771: UDP, length 120
21:42:31.576078 IP 192.168.43.147.8880 > 192.168.43.124.7773: UDP, length 120
21:42:31.618273 IP 192.168.43.124.8880 > 192.168.43.146.7771: UDP, length 120
21:42:31.627173 IP 192.168.43.147.8880 > 192.168.43.124.7773: UDP, length 120
21:42:31.668269 IP 192.168.43.124.8880 > 192.168.43.146.7771: UDP, length 120
21:42:31.678110 IP 192.168.43.147.8880 > 192.168.43.124.7773: UDP, length 120
21:42:31.718270 IP 192.168.43.124.8880 > 192.168.43.146.7771: UDP, length 120
21:42:31.725909 IP 192.168.43.147.8880 > 192.168.43.124.7773: UDP, length 120
21:42:31.768271 IP 192.168.43.124.8880 > 192.168.43.146.7771: UDP, length 120
21:42:31.779323 IP 192.168.43.147.8880 > 192.168.43.124.7773: UDP, length 120
21:42:31.818265 IP 192.168.43.124.8880 > 192.168.43.146.7771: UDP, length 120
21:42:31.824860 IP 192.168.43.147.8880 > 192.168.43.124.7773: UDP, length 120
21:42:31.868268 IP 192.168.43.124.8880 > 192.168.43.146.7771: UDP, length 120
21:42:31.874183 IP 192.168.43.147.8880 > 192.168.43.124.7773: UDP, length 120
21:42:31.918268 IP 192.168.43.124.8880 > 192.168.43.146.7771: UDP, length 120
21:42:31.931117 IP 192.168.43.147.8880 > 192.168.43.124.7773: UDP, length 120
21:42:31.968269 IP 192.168.43.124.8880 > 192.168.43.146.7771: UDP, length 120
21:42:31.976290 IP 192.168.43.147.8880 > 192.168.43.124.7773: UDP, length 120
21:42:32.018269 IP 192.168.43.124.8880 > 192.168.43.146.7771: UDP, length 120
21:42:32.027061 IP 192.168.43.147.8880 > 192.168.43.124.7773: UDP, length 120
21:42:32.068265 IP 192.168.43.124.8880 > 192.168.43.146.7771: UDP, length 120
21:42:32.075966 IP 192.168.43.147.8880 > 192.168.43.124.7773: UDP, length 120
21:42:32.118214 IP 192.168.43.124.8880 > 192.168.43.146.7771: UDP, length 120
21:42:32.168266 IP 192.168.43.124.8880 > 192.168.43.146.7771: UDP, length 120
21:42:32.173101 IP 192.168.43.147.8880 > 192.168.43.124.7773: UDP, length 120
21:42:32.218266 IP 192.168.43.124.8880 > 192.168.43.146.7771: UDP, length 120
21:42:32.222612 IP 192.168.43.147.8880 > 192.168.43.124.7773: UDP, length 120
21:42:32.268269 IP 192.168.43.124.8880 > 192.168.43.146.7771: UDP, length 120
21:42:32.275894 IP 192.168.43.147.8880 > 192.168.43.124.7773: UDP, length 120
21:42:32.318272 IP 192.168.43.124.8880 > 192.168.43.146.7771: UDP, length 120
21:42:32.322507 IP 192.168.43.147.8880 > 192.168.43.124.7773: UDP, length 120
21:42:32.368273 IP 192.168.43.124.8880 > 192.168.43.146.7771: UDP, length 120
21:42:32.377916 IP 192.168.43.147.8880 > 192.168.43.124.7773: UDP, length 120
21:42:32.418274 IP 192.168.43.124.8880 > 192.168.43.146.7771: UDP, length 120
21:42:32.425036 IP 192.168.43.147.8880 > 192.168.43.124.7773: UDP, length 120
21:42:32.468273 IP 192.168.43.124.8880 > 192.168.43.146.7771: UDP, length 120
21:42:32.481743 IP 192.168.43.147.8880 > 192.168.43.124.7773: UDP, length 120
21:42:32.518270 IP 192.168.43.124.8880 > 192.168.43.146.7771: UDP, length 120
21:42:32.525037 IP 192.168.43.147.8880 > 192.168.43.124.7773: UDP, length 120
21:42:32.568271 IP 192.168.43.124.8880 > 192.168.43.146.7771: UDP, length 120
21:42:32.582778 IP 192.168.43.147.8880 > 192.168.43.124.7773: UDP, length 120
21:42:32.618272 IP 192.168.43.124.8880 > 192.168.43.146.7771: UDP, length 120
21:42:32.626089 IP 192.168.43.147.8880 > 192.168.43.124.7773: UDP, length 120
21:42:32.668268 IP 192.168.43.124.8880 > 192.168.43.146.7771: UDP, length 120
21:42:32.678103 IP 192.168.43.147.8880 > 192.168.43.124.7773: UDP, length 120
21:42:32.718271 IP 192.168.43.124.8880 > 192.168.43.146.7771: UDP, length 120
21:42:32.728457 IP 192.168.43.147.8880 > 192.168.43.124.7773: UDP, length 120
21:42:32.768272 IP 192.168.43.124.8880 > 192.168.43.146.7771: UDP, length 120
21:42:32.818270 IP 192.168.43.124.8880 > 192.168.43.146.7771: UDP, length 120
21:42:32.849194 IP 192.168.43.147.8880 > 192.168.43.124.7773: UDP, length 120
21:42:32.849208 IP 192.168.43.147.8880 > 192.168.43.124.7773: UDP, length 120
21:42:32.868267 IP 192.168.43.124.8880 > 192.168.43.146.7771: UDP, length 120
21:42:32.874949 IP 192.168.43.147.8880 > 192.168.43.124.7773: UDP, length 120
21:42:32.918320 IP 192.168.43.124.8880 > 192.168.43.146.7771: UDP, length 120
21:42:32.939046 IP 192.168.43.147.8880 > 192.168.43.124.7773: UDP, length 120
21:42:32.968324 IP 192.168.43.124.8880 > 192.168.43.146.7771: UDP, length 120
21:42:32.978721 IP 192.168.43.147.8880 > 192.168.43.124.7773: UDP, length 120
21:42:33.018586 IP 192.168.43.124.8880 > 192.168.43.146.7771: UDP, length 120
21:42:33.032065 IP 192.168.43.147.8880 > 192.168.43.124.7773: UDP, length 120
21:42:33.068327 IP 192.168.43.124.8880 > 192.168.43.146.7771: UDP, length 120
21:42:33.075775 IP 192.168.43.147.8880 > 192.168.43.124.7773: UDP, length 120
21:42:33.119359 IP 192.168.43.124.8880 > 192.168.43.146.7771: UDP, length 120
21:42:33.124289 IP 192.168.43.147.8880 > 192.168.43.124.7773: UDP, length 120
21:42:33.168196 IP 192.168.43.124.8880 > 192.168.43.146.7771: UDP, length 120
21:42:33.180465 IP 192.168.43.147.8880 > 192.168.43.124.7773: UDP, length 120
21:42:33.218185 IP 192.168.43.124.8880 > 192.168.43.146.7771: UDP, length 120
21:42:33.224878 IP 192.168.43.147.8880 > 192.168.43.124.7773: UDP, length 120
21:42:33.268271 IP 192.168.43.124.8880 > 192.168.43.146.7771: UDP, length 120
21:42:33.273701 IP 192.168.43.147.8880 > 192.168.43.124.7773: UDP, length 120
21:42:33.318266 IP 192.168.43.124.8880 > 192.168.43.146.7771: UDP, length 120
21:42:33.325811 IP 192.168.43.147.8880 > 192.168.43.124.7773: UDP, length 120
21:42:33.368282 IP 192.168.43.124.8880 > 192.168.43.146.7771: UDP, length 120
21:42:33.372392 IP 192.168.43.147.8880 > 192.168.43.124.7773: UDP, length 120
21:42:33.418195 IP 192.168.43.124.8880 > 192.168.43.146.7771: UDP, length 120
21:42:33.423792 IP 192.168.43.147.8880 > 192.168.43.124.7773: UDP, length 120
21:42:33.468193 IP 192.168.43.124.8880 > 192.168.43.146.7771: UDP, length 120
21:42:33.474833 IP 192.168.43.147.8880 > 192.168.43.124.7773: UDP, length 120
21:42:33.518265 IP 192.168.43.124.8880 > 192.168.43.146.7771: UDP, length 120
21:42:33.524821 IP 192.168.43.147.8880 > 192.168.43.124.7773: UDP, length 120
21:42:33.568267 IP 192.168.43.124.8880 > 192.168.43.146.7771: UDP, length 120
21:42:33.572356 IP 192.168.43.147.8880 > 192.168.43.124.7773: UDP, length 120
21:42:33.618267 IP 192.168.43.124.8880 > 192.168.43.146.7771: UDP, length 120
21:42:33.624892 IP 192.168.43.147.8880 > 192.168.43.124.7773: UDP, length 120
21:42:33.668268 IP 192.168.43.124.8880 > 192.168.43.146.7771: UDP, length 120
21:42:33.672319 IP 192.168.43.147.8880 > 192.168.43.124.7773: UDP, length 120
21:42:33.718266 IP 192.168.43.124.8880 > 192.168.43.146.7771: UDP, length 120
21:42:33.726779 IP 192.168.43.147.8880 > 192.168.43.124.7773: UDP, length 120
21:42:33.768264 IP 192.168.43.124.8880 > 192.168.43.146.7771: UDP, length 120
21:42:33.773792 IP 192.168.43.147.8880 > 192.168.43.124.7773: UDP, length 120
21:42:33.818268 IP 192.168.43.124.8880 > 192.168.43.146.7771: UDP, length 120
21:42:33.830454 IP 192.168.43.147.8880 > 192.168.43.124.7773: UDP, length 120
21:42:33.868266 IP 192.168.43.124.8880 > 192.168.43.146.7771: UDP, length 120
21:42:33.876928 IP 192.168.43.147.8880 > 192.168.43.124.7773: UDP, length 120
21:42:33.918266 IP 192.168.43.124.8880 > 192.168.43.146.7771: UDP, length 120
21:42:33.932036 IP 192.168.43.147.8880 > 192.168.43.124.7773: UDP, length 120
21:42:33.968269 IP 192.168.43.124.8880 > 192.168.43.146.7771: UDP, length 120
21:42:33.978732 IP 192.168.43.147.8880 > 192.168.43.124.7773: UDP, length 120
21:42:34.018264 IP 192.168.43.124.8880 > 192.168.43.146.7771: UDP, length 120
21:42:34.030517 IP 192.168.43.147.8880 > 192.168.43.124.7773: UDP, length 120
21:42:34.068269 IP 192.168.43.124.8880 > 192.168.43.146.7771: UDP, length 120
21:42:34.080843 IP 192.168.43.147.8880 > 192.168.43.124.7773: UDP, length 120
21:42:34.118317 IP 192.168.43.124.8880 > 192.168.43.146.7771: UDP, length 120
21:42:34.128254 IP 192.168.43.147.8880 > 192.168.43.124.7773: UDP, length 120
21:42:34.168208 IP 192.168.43.124.8880 > 192.168.43.146.7771: UDP, length 120
21:42:34.183223 IP 192.168.43.147.8880 > 192.168.43.124.7773: UDP, length 120
21:42:34.218277 IP 192.168.43.124.8880 > 192.168.43.146.7771: UDP, length 120
21:42:34.225525 IP 192.168.43.147.8880 > 192.168.43.124.7773: UDP, length 120
21:42:34.268271 IP 192.168.43.124.8880 > 192.168.43.146.7771: UDP, length 120
21:42:34.283926 IP 192.168.43.147.8880 > 192.168.43.124.7773: UDP, length 120
21:42:34.318191 IP 192.168.43.124.8880 > 192.168.43.146.7771: UDP, length 120
21:42:34.323254 IP 192.168.43.147.8880 > 192.168.43.124.7773: UDP, length 120
21:42:34.368187 IP 192.168.43.124.8880 > 192.168.43.146.7771: UDP, length 120
21:42:34.381803 IP 192.168.43.147.8880 > 192.168.43.124.7773: UDP, length 120
21:42:34.418188 IP 192.168.43.124.8880 > 192.168.43.146.7771: UDP, length 120
21:42:34.426959 IP 192.168.43.147.8880 > 192.168.43.124.7773: UDP, length 120
21:42:34.468267 IP 192.168.43.124.8880 > 192.168.43.146.7771: UDP, length 120
21:42:34.474622 IP 192.168.43.147.8880 > 192.168.43.124.7773: UDP, length 120
21:42:34.518232 IP 192.168.43.124.8880 > 192.168.43.146.7771: UDP, length 120
21:42:34.522419 IP 192.168.43.147.8880 > 192.168.43.124.7773: UDP, length 120
21:42:34.568270 IP 192.168.43.124.8880 > 192.168.43.146.7771: UDP, length 120
21:42:34.576978 IP 192.168.43.147.8880 > 192.168.43.124.7773: UDP, length 120
21:42:34.618234 IP 192.168.43.124.8880 > 192.168.43.146.7771: UDP, length 120
21:42:34.622165 IP 192.168.43.147.8880 > 192.168.43.124.7773: UDP, length 120
21:42:34.668267 IP 192.168.43.124.8880 > 192.168.43.146.7771: UDP, length 120
21:42:34.672236 IP 192.168.43.147.8880 > 192.168.43.124.7773: UDP, length 120
21:42:34.718222 IP 192.168.43.124.8880 > 192.168.43.146.7771: UDP, length 120
21:42:34.725524 IP 192.168.43.147.8880 > 192.168.43.124.7773: UDP, length 120
21:42:34.768268 IP 192.168.43.124.8880 > 192.168.43.146.7771: UDP, length 120
21:42:34.776604 IP 192.168.43.147.8880 > 192.168.43.124.7773: UDP, length 120
21:42:34.818197 IP 192.168.43.124.8880 > 192.168.43.146.7771: UDP, length 120
21:42:34.828124 IP 192.168.43.147.8880 > 192.168.43.124.7773: UDP, length 120
21:42:34.868269 IP 192.168.43.124.8880 > 192.168.43.146.7771: UDP, length 120
21:42:34.879100 IP 192.168.43.147.8880 > 192.168.43.124.7773: UDP, length 120
21:42:34.918212 IP 192.168.43.124.8880 > 192.168.43.146.7771: UDP, length 120
21:42:34.922841 IP 192.168.43.147.8880 > 192.168.43.124.7773: UDP, length 120
21:42:34.968271 IP 192.168.43.124.8880 > 192.168.43.146.7771: UDP, length 120
21:42:34.974307 IP 192.168.43.147.8880 > 192.168.43.124.7773: UDP, length 120
21:42:35.018214 IP 192.168.43.124.8880 > 192.168.43.146.7771: UDP, length 120
21:42:35.022070 IP 192.168.43.147.8880 > 192.168.43.124.7773: UDP, length 120
21:42:35.068268 IP 192.168.43.124.8880 > 192.168.43.146.7771: UDP, length 120
21:42:35.072076 IP 192.168.43.147.8880 > 192.168.43.124.7773: UDP, length 120
21:42:35.118233 IP 192.168.43.124.8880 > 192.168.43.146.7771: UDP, length 120
21:42:35.123365 IP 192.168.43.147.8880 > 192.168.43.124.7773: UDP, length 120
21:42:35.168266 IP 192.168.43.124.8880 > 192.168.43.146.7771: UDP, length 120
21:42:35.175102 IP 192.168.43.147.8880 > 192.168.43.124.7773: UDP, length 120
21:42:35.218266 IP 192.168.43.124.8880 > 192.168.43.146.7771: UDP, length 120
21:42:35.226729 IP 192.168.43.147.8880 > 192.168.43.124.7773: UDP, length 120
21:42:35.268212 IP 192.168.43.124.8880 > 192.168.43.146.7771: UDP, length 120
21:42:35.273928 IP 192.168.43.147.8880 > 192.168.43.124.7773: UDP, length 120
21:42:35.318267 IP 192.168.43.124.8880 > 192.168.43.146.7771: UDP, length 120
21:42:35.321879 IP 192.168.43.147.8880 > 192.168.43.124.7773: UDP, length 120
21:42:35.368208 IP 192.168.43.124.8880 > 192.168.43.146.7771: UDP, length 120
21:42:35.374286 IP 192.168.43.147.8880 > 192.168.43.124.7773: UDP, length 120
21:42:35.418265 IP 192.168.43.124.8880 > 192.168.43.146.7771: UDP, length 120
21:42:35.424661 IP 192.168.43.147.8880 > 192.168.43.124.7773: UDP, length 120
21:42:35.468266 IP 192.168.43.124.8880 > 192.168.43.146.7771: UDP, length 120
21:42:35.472247 IP 192.168.43.147.8880 > 192.168.43.124.7773: UDP, length 120
21:42:35.518265 IP 192.168.43.124.8880 > 192.168.43.146.7771: UDP, length 120
21:42:35.522065 IP 192.168.43.147.8880 > 192.168.43.124.7773: UDP, length 120
21:42:35.568266 IP 192.168.43.124.8880 > 192.168.43.146.7771: UDP, length 120
21:42:35.575219 IP 192.168.43.147.8880 > 192.168.43.124.7773: UDP, length 120
21:42:35.618267 IP 192.168.43.124.8880 > 192.168.43.146.7771: UDP, length 120
21:42:35.622215 IP 192.168.43.147.8880 > 192.168.43.124.7773: UDP, length 120
21:42:35.668264 IP 192.168.43.124.8880 > 192.168.43.146.7771: UDP, length 120
21:42:35.678949 IP 192.168.43.147.8880 > 192.168.43.124.7773: UDP, length 120
21:42:35.718269 IP 192.168.43.124.8880 > 192.168.43.146.7771: UDP, length 120
21:42:35.723931 IP 192.168.43.147.8880 > 192.168.43.124.7773: UDP, length 120
21:42:35.768270 IP 192.168.43.124.8880 > 192.168.43.146.7771: UDP, length 120
21:42:35.772439 IP 192.168.43.147.8880 > 192.168.43.124.7773: UDP, length 120
21:42:35.818266 IP 192.168.43.124.8880 > 192.168.43.146.7771: UDP, length 120
21:42:35.825677 IP 192.168.43.147.8880 > 192.168.43.124.7773: UDP, length 120
21:42:35.868206 IP 192.168.43.124.8880 > 192.168.43.146.7771: UDP, length 120
21:42:35.874054 IP 192.168.43.147.8880 > 192.168.43.124.7773: UDP, length 120
21:42:35.918267 IP 192.168.43.124.8880 > 192.168.43.146.7771: UDP, length 120
21:42:35.927537 IP 192.168.43.147.8880 > 192.168.43.124.7773: UDP, length 120
21:42:35.968325 IP 192.168.43.124.8880 > 192.168.43.146.7771: UDP, length 120
21:42:35.978313 IP 192.168.43.147.8880 > 192.168.43.124.7773: UDP, length 120
21:42:36.018329 IP 192.168.43.124.8880 > 192.168.43.146.7771: UDP, length 120
21:42:36.027346 IP 192.168.43.147.8880 > 192.168.43.124.7773: UDP, length 120
21:42:36.068323 IP 192.168.43.124.8880 > 192.168.43.146.7771: UDP, length 120
21:42:36.081000 IP 192.168.43.147.8880 > 192.168.43.124.7773: UDP, length 120
21:42:36.118326 IP 192.168.43.124.8880 > 192.168.43.146.7771: UDP, length 120
21:42:36.128663 IP 192.168.43.147.8880 > 192.168.43.124.7773: UDP, length 120
21:42:36.168323 IP 192.168.43.124.8880 > 192.168.43.146.7771: UDP, length 120
21:42:36.174007 IP 192.168.43.147.8880 > 192.168.43.124.7773: UDP, length 120
21:42:36.218325 IP 192.168.43.124.8880 > 192.168.43.146.7771: UDP, length 120
21:42:36.230768 IP 192.168.43.147.8880 > 192.168.43.124.7773: UDP, length 120
21:42:36.268324 IP 192.168.43.124.8880 > 192.168.43.146.7771: UDP, length 120
21:42:36.272826 IP 192.168.43.147.8880 > 192.168.43.124.7773: UDP, length 120
21:42:36.318324 IP 192.168.43.124.8880 > 192.168.43.146.7771: UDP, length 120
21:42:36.328168 IP 192.168.43.147.8880 > 192.168.43.124.7773: UDP, length 120
21:42:36.368326 IP 192.168.43.124.8880 > 192.168.43.146.7771: UDP, length 120
21:42:36.374388 IP 192.168.43.147.8880 > 192.168.43.124.7773: UDP, length 120
21:42:36.418327 IP 192.168.43.124.8880 > 192.168.43.146.7771: UDP, length 120
21:42:36.425298 IP 192.168.43.147.8880 > 192.168.43.124.7773: UDP, length 120
21:42:36.468322 IP 192.168.43.124.8880 > 192.168.43.146.7771: UDP, length 120
21:42:36.474168 IP 192.168.43.147.8880 > 192.168.43.124.7773: UDP, length 120
21:42:36.518323 IP 192.168.43.124.8880 > 192.168.43.146.7771: UDP, length 120
21:42:36.523065 IP 192.168.43.147.8880 > 192.168.43.124.7773: UDP, length 120
21:42:36.568324 IP 192.168.43.124.8880 > 192.168.43.146.7771: UDP, length 120
21:42:36.577406 IP 192.168.43.147.8880 > 192.168.43.124.7773: UDP, length 120
21:42:36.618325 IP 192.168.43.124.8880 > 192.168.43.146.7771: UDP, length 120
21:42:36.641289 IP 192.168.43.147.8880 > 192.168.43.124.7773: UDP, length 120
21:42:36.668326 IP 192.168.43.124.8880 > 192.168.43.146.7771: UDP, length 120
21:42:36.676812 IP 192.168.43.147.8880 > 192.168.43.124.7773: UDP, length 120
21:42:36.718324 IP 192.168.43.124.8880 > 192.168.43.146.7771: UDP, length 120
21:42:36.728628 IP 192.168.43.147.8880 > 192.168.43.124.7773: UDP, length 120
21:42:36.768322 IP 192.168.43.124.8880 > 192.168.43.146.7771: UDP, length 120
21:42:36.773062 IP 192.168.43.147.8880 > 192.168.43.124.7773: UDP, length 120
21:42:36.818271 IP 192.168.43.124.8880 > 192.168.43.146.7771: UDP, length 120
21:42:36.824635 IP 192.168.43.147.8880 > 192.168.43.124.7773: UDP, length 120
21:42:36.868268 IP 192.168.43.124.8880 > 192.168.43.146.7771: UDP, length 120
21:42:36.874481 IP 192.168.43.147.8880 > 192.168.43.124.7773: UDP, length 120
21:42:36.918268 IP 192.168.43.124.8880 > 192.168.43.146.7771: UDP, length 120
21:42:36.927084 IP 192.168.43.147.8880 > 192.168.43.124.7773: UDP, length 120
21:42:36.968270 IP 192.168.43.124.8880 > 192.168.43.146.7771: UDP, length 120
21:42:36.978459 IP 192.168.43.147.8880 > 192.168.43.124.7773: UDP, length 120
21:42:37.018273 IP 192.168.43.124.8880 > 192.168.43.146.7771: UDP, length 120
21:42:37.024834 IP 192.168.43.147.8880 > 192.168.43.124.7773: UDP, length 120
21:42:37.068273 IP 192.168.43.124.8880 > 192.168.43.146.7771: UDP, length 120
21:42:37.074396 IP 192.168.43.147.8880 > 192.168.43.124.7773: UDP, length 120
21:42:37.118324 IP 192.168.43.124.8880 > 192.168.43.146.7771: UDP, length 120
21:42:37.122874 IP 192.168.43.147.8880 > 192.168.43.124.7773: UDP, length 120
21:42:37.168325 IP 192.168.43.124.8880 > 192.168.43.146.7771: UDP, length 120
21:42:37.172545 IP 192.168.43.147.8880 > 192.168.43.124.7773: UDP, length 120
21:42:37.218323 IP 192.168.43.124.8880 > 192.168.43.146.7771: UDP, length 120
21:42:37.222825 IP 192.168.43.147.8880 > 192.168.43.124.7773: UDP, length 120
21:42:37.268327 IP 192.168.43.124.8880 > 192.168.43.146.7771: UDP, length 120
21:42:37.273993 IP 192.168.43.147.8880 > 192.168.43.124.7773: UDP, length 120
21:42:37.318328 IP 192.168.43.124.8880 > 192.168.43.146.7771: UDP, length 120
21:42:37.326889 IP 192.168.43.147.8880 > 192.168.43.124.7773: UDP, length 120
21:42:37.368309 IP 192.168.43.124.8880 > 192.168.43.146.7771: UDP, length 120
21:42:37.373890 IP 192.168.43.147.8880 > 192.168.43.124.7773: UDP, length 120
21:42:37.418331 IP 192.168.43.124.8880 > 192.168.43.146.7771: UDP, length 120
21:42:37.424780 IP 192.168.43.147.8880 > 192.168.43.124.7773: UDP, length 120
21:42:37.468323 IP 192.168.43.124.8880 > 192.168.43.146.7771: UDP, length 120
21:42:37.473148 IP 192.168.43.147.8880 > 192.168.43.124.7773: UDP, length 120
21:42:37.518328 IP 192.168.43.124.8880 > 192.168.43.146.7771: UDP, length 120
21:42:37.522354 IP 192.168.43.147.8880 > 192.168.43.124.7773: UDP, length 120
21:42:37.568322 IP 192.168.43.124.8880 > 192.168.43.146.7771: UDP, length 120
21:42:37.575267 IP 192.168.43.147.8880 > 192.168.43.124.7773: UDP, length 120
21:42:37.618320 IP 192.168.43.124.8880 > 192.168.43.146.7771: UDP, length 120
21:42:37.627122 IP 192.168.43.147.8880 > 192.168.43.124.7773: UDP, length 120
21:42:37.668324 IP 192.168.43.124.8880 > 192.168.43.146.7771: UDP, length 120
21:42:37.673156 IP 192.168.43.147.8880 > 192.168.43.124.7773: UDP, length 120
21:42:37.718325 IP 192.168.43.124.8880 > 192.168.43.146.7771: UDP, length 120
21:42:37.732904 IP 192.168.43.147.8880 > 192.168.43.124.7773: UDP, length 120
21:42:37.768324 IP 192.168.43.124.8880 > 192.168.43.146.7771: UDP, length 120
21:42:37.776689 IP 192.168.43.147.8880 > 192.168.43.124.7773: UDP, length 120
21:42:37.818270 IP 192.168.43.124.8880 > 192.168.43.146.7771: UDP, length 120
21:42:37.824562 IP 192.168.43.147.8880 > 192.168.43.124.7773: UDP, length 120
21:42:37.868273 IP 192.168.43.124.8880 > 192.168.43.146.7771: UDP, length 120
21:42:37.873974 IP 192.168.43.147.8880 > 192.168.43.124.7773: UDP, length 120
21:42:37.918275 IP 192.168.43.124.8880 > 192.168.43.146.7771: UDP, length 120
21:42:37.928545 IP 192.168.43.147.8880 > 192.168.43.124.7773: UDP, length 120
21:42:37.968277 IP 192.168.43.124.8880 > 192.168.43.146.7771: UDP, length 120
21:42:37.977026 IP 192.168.43.147.8880 > 192.168.43.124.7773: UDP, length 120
21:42:38.018252 IP 192.168.43.124.8880 > 192.168.43.146.7771: UDP, length 120
21:42:38.026834 IP 192.168.43.147.8880 > 192.168.43.124.7773: UDP, length 120
21:42:38.068279 IP 192.168.43.124.8880 > 192.168.43.146.7771: UDP, length 120
21:42:38.077125 IP 192.168.43.147.8880 > 192.168.43.124.7773: UDP, length 120
21:42:38.118234 IP 192.168.43.124.8880 > 192.168.43.146.7771: UDP, length 120
21:42:38.129965 IP 192.168.43.147.8880 > 192.168.43.124.7773: UDP, length 120
21:42:38.168278 IP 192.168.43.124.8880 > 192.168.43.146.7771: UDP, length 120
21:42:38.176548 IP 192.168.43.147.8880 > 192.168.43.124.7773: UDP, length 120
21:42:38.218281 IP 192.168.43.124.8880 > 192.168.43.146.7771: UDP, length 120
21:42:38.222447 IP 192.168.43.147.8880 > 192.168.43.124.7773: UDP, length 120
21:42:38.268283 IP 192.168.43.124.8880 > 192.168.43.146.7771: UDP, length 120
21:42:38.278746 IP 192.168.43.147.8880 > 192.168.43.124.7773: UDP, length 120
21:42:38.318283 IP 192.168.43.124.8880 > 192.168.43.146.7771: UDP, length 120
21:42:38.325315 IP 192.168.43.147.8880 > 192.168.43.124.7773: UDP, length 120
21:42:38.368286 IP 192.168.43.124.8880 > 192.168.43.146.7771: UDP, length 120
21:42:38.378533 IP 192.168.43.147.8880 > 192.168.43.124.7773: UDP, length 120
