01:00:53.509957 IP 192.168.43.124.8880 > 192.168.43.146.7771: UDP, length 120
01:00:53.568146 IP 192.168.43.124.8880 > 192.168.43.146.7771: UDP, length 120
01:00:53.608511 IP 192.168.43.124.8880 > 192.168.43.146.7771: UDP, length 120
01:00:53.669468 IP 192.168.43.124.8880 > 192.168.43.146.7771: UDP, length 120
01:00:53.707478 IP 192.168.43.124.8880 > 192.168.43.146.7771: UDP, length 120
01:00:53.759050 IP 192.168.43.124.8880 > 192.168.43.146.7771: UDP, length 120
01:00:53.806674 IP 192.168.43.124.8880 > 192.168.43.146.7771: UDP, length 120
01:00:53.854717 IP 192.168.43.124.8880 > 192.168.43.146.7771: UDP, length 120
01:00:53.906451 IP 192.168.43.124.8880 > 192.168.43.146.7771: UDP, length 120
01:00:53.964969 IP 192.168.43.124.8880 > 192.168.43.146.7771: UDP, length 120
01:00:54.007033 IP 192.168.43.124.8880 > 192.168.43.146.7771: UDP, length 120
01:00:54.047896 IP 192.168.43.146.8880 > 192.168.43.147.7772: UDP, length 120
01:00:54.067461 IP 192.168.43.124.8880 > 192.168.43.146.7771: UDP, length 120
01:00:54.097986 IP 192.168.43.146.8880 > 192.168.43.147.7772: UDP, length 120
01:00:54.105455 IP 192.168.43.124.8880 > 192.168.43.146.7771: UDP, length 120
01:00:54.147950 IP 192.168.43.146.8880 > 192.168.43.147.7772: UDP, length 120
01:00:54.155294 IP 192.168.43.124.8880 > 192.168.43.146.7771: UDP, length 120
01:00:54.197925 IP 192.168.43.146.8880 > 192.168.43.147.7772: UDP, length 120
01:00:54.205778 IP 192.168.43.124.8880 > 192.168.43.146.7771: UDP, length 120
01:00:54.247921 IP 192.168.43.146.8880 > 192.168.43.147.7772: UDP, length 120
01:00:54.254446 IP 192.168.43.124.8880 > 192.168.43.146.7771: UDP, length 120
01:00:54.297933 IP 192.168.43.146.8880 > 192.168.43.147.7772: UDP, length 120
01:00:54.306055 IP 192.168.43.124.8880 > 192.168.43.146.7771: UDP, length 120
01:00:54.347922 IP 192.168.43.146.8880 > 192.168.43.147.7772: UDP, length 120
01:00:54.355173 IP 192.168.43.124.8880 > 192.168.43.146.7771: UDP, length 120
01:00:54.397920 IP 192.168.43.146.8880 > 192.168.43.147.7772: UDP, length 120
01:00:54.408453 IP 192.168.43.124.8880 > 192.168.43.146.7771: UDP, length 120
01:00:54.447925 IP 192.168.43.146.8880 > 192.168.43.147.7772: UDP, length 120
01:00:54.456072 IP 192.168.43.124.8880 > 192.168.43.146.7771: UDP, length 120
01:00:54.497921 IP 192.168.43.146.8880 > 192.168.43.147.7772: UDP, length 120
01:00:54.505151 IP 192.168.43.124.8880 > 192.168.43.146.7771: UDP, length 120
01:00:54.547922 IP 192.168.43.146.8880 > 192.168.43.147.7772: UDP, length 120
01:00:54.556335 IP 192.168.43.124.8880 > 192.168.43.146.7771: UDP, length 120
01:00:54.597927 IP 192.168.43.146.8880 > 192.168.43.147.7772: UDP, length 120
01:00:54.605191 IP 192.168.43.124.8880 > 192.168.43.146.7771: UDP, length 120
01:00:54.647924 IP 192.168.43.146.8880 > 192.168.43.147.7772: UDP, length 120
01:00:54.655608 IP 192.168.43.124.8880 > 192.168.43.146.7771: UDP, length 120
01:00:54.697921 IP 192.168.43.146.8880 > 192.168.43.147.7772: UDP, length 120
01:00:54.707152 IP 192.168.43.124.8880 > 192.168.43.146.7771: UDP, length 120
01:00:54.747925 IP 192.168.43.146.8880 > 192.168.43.147.7772: UDP, length 120
01:00:54.757771 IP 192.168.43.124.8880 > 192.168.43.146.7771: UDP, length 120
01:00:54.797922 IP 192.168.43.146.8880 > 192.168.43.147.7772: UDP, length 120
01:00:54.805217 IP 192.168.43.124.8880 > 192.168.43.146.7771: UDP, length 120
01:00:54.847922 IP 192.168.43.146.8880 > 192.168.43.147.7772: UDP, length 120
01:00:54.858531 IP 192.168.43.124.8880 > 192.168.43.146.7771: UDP, length 120
01:00:54.897927 IP 192.168.43.146.8880 > 192.168.43.147.7772: UDP, length 120
01:00:54.905027 IP 192.168.43.124.8880 > 192.168.43.146.7771: UDP, length 120
01:00:54.947923 IP 192.168.43.146.8880 > 192.168.43.147.7772: UDP, length 120
01:00:54.956518 IP 192.168.43.124.8880 > 192.168.43.146.7771: UDP, length 120
01:00:54.997921 IP 192.168.43.146.8880 > 192.168.43.147.7772: UDP, length 120
01:00:55.005183 IP 192.168.43.124.8880 > 192.168.43.146.7771: UDP, length 120
01:00:55.047924 IP 192.168.43.146.8880 > 192.168.43.147.7772: UDP, length 120
01:00:55.055394 IP 192.168.43.124.8880 > 192.168.43.146.7771: UDP, length 120
01:00:55.097978 IP 192.168.43.146.8880 > 192.168.43.147.7772: UDP, length 120
01:00:55.105173 IP 192.168.43.124.8880 > 192.168.43.146.7771: UDP, length 120
01:00:55.147953 IP 192.168.43.146.8880 > 192.168.43.147.7772: UDP, length 120
01:00:55.155117 IP 192.168.43.124.8880 > 192.168.43.146.7771: UDP, length 120
01:00:55.197934 IP 192.168.43.146.8880 > 192.168.43.147.7772: UDP, length 120
01:00:55.205153 IP 192.168.43.124.8880 > 192.168.43.146.7771: UDP, length 120
01:00:55.247930 IP 192.168.43.146.8880 > 192.168.43.147.7772: UDP, length 120
01:00:55.255130 IP 192.168.43.124.8880 > 192.168.43.146.7771: UDP, length 120
01:00:55.297925 IP 192.168.43.146.8880 > 192.168.43.147.7772: UDP, length 120
01:00:55.306952 IP 192.168.43.124.8880 > 192.168.43.146.7771: UDP, length 120
01:00:55.347928 IP 192.168.43.146.8880 > 192.168.43.147.7772: UDP, length 120
01:00:55.355319 IP 192.168.43.124.8880 > 192.168.43.146.7771: UDP, length 120
01:00:55.397922 IP 192.168.43.146.8880 > 192.168.43.147.7772: UDP, length 120
01:00:55.407187 IP 192.168.43.124.8880 > 192.168.43.146.7771: UDP, length 120
01:00:55.447928 IP 192.168.43.146.8880 > 192.168.43.147.7772: UDP, length 120
01:00:55.474012 IP 192.168.43.124.8880 > 192.168.43.146.7771: UDP, length 120
01:00:55.497994 IP 192.168.43.146.8880 > 192.168.43.147.7772: UDP, length 120
01:00:55.503548 IP 192.168.43.124.8880 > 192.168.43.146.7771: UDP, length 120
01:00:55.548006 IP 192.168.43.146.8880 > 192.168.43.147.7772: UDP, length 120
01:00:55.555229 IP 192.168.43.124.8880 > 192.168.43.146.7771: UDP, length 120
01:00:55.598051 IP 192.168.43.146.8880 > 192.168.43.147.7772: UDP, length 120
01:00:55.604471 IP 192.168.43.124.8880 > 192.168.43.146.7771: UDP, length 120
01:00:55.647968 IP 192.168.43.146.8880 > 192.168.43.147.7772: UDP, length 120
01:00:55.653607 IP 192.168.43.124.8880 > 192.168.43.146.7771: UDP, length 120
01:00:55.697965 IP 192.168.43.146.8880 > 192.168.43.147.7772: UDP, length 120
01:00:55.704051 IP 192.168.43.124.8880 > 192.168.43.146.7771: UDP, length 120
01:00:55.747966 IP 192.168.43.146.8880 > 192.168.43.147.7772: UDP, length 120
01:00:55.754998 IP 192.168.43.124.8880 > 192.168.43.146.7771: UDP, length 120
01:00:55.797965 IP 192.168.43.146.8880 > 192.168.43.147.7772: UDP, length 120
01:00:55.806475 IP 192.168.43.124.8880 > 192.168.43.146.7771: UDP, length 120
01:00:55.847975 IP 192.168.43.146.8880 > 192.168.43.147.7772: UDP, length 120
01:00:55.857210 IP 192.168.43.124.8880 > 192.168.43.146.7771: UDP, length 120
01:00:55.897987 IP 192.168.43.146.8880 > 192.168.43.147.7772: UDP, length 120
01:00:55.906706 IP 192.168.43.124.8880 > 192.168.43.146.7771: UDP, length 120
01:00:55.948020 IP 192.168.43.146.8880 > 192.168.43.147.7772: UDP, length 120
01:00:55.957072 IP 192.168.43.124.8880 > 192.168.43.146.7771: UDP, length 120
01:00:55.997948 IP 192.168.43.146.8880 > 192.168.43.147.7772: UDP, length 120
01:00:56.008334 IP 192.168.43.124.8880 > 192.168.43.146.7771: UDP, length 120
01:00:56.047901 IP 192.168.43.146.8880 > 192.168.43.147.7772: UDP, length 120
01:00:56.055978 IP 192.168.43.124.8880 > 192.168.43.146.7771: UDP, length 120
01:00:56.097940 IP 192.168.43.146.8880 > 192.168.43.147.7772: UDP, length 120
01:00:56.105137 IP 192.168.43.124.8880 > 192.168.43.146.7771: UDP, length 120
01:00:56.147907 IP 192.168.43.146.8880 > 192.168.43.147.7772: UDP, length 120
01:00:56.154467 IP 192.168.43.124.8880 > 192.168.43.146.7771: UDP, length 120
01:00:56.197898 IP 192.168.43.146.8880 > 192.168.43.147.7772: UDP, length 120
01:00:56.204698 IP 192.168.43.124.8880 > 192.168.43.146.7771: UDP, length 120
01:00:56.247901 IP 192.168.43.146.8880 > 192.168.43.147.7772: UDP, length 120
01:00:56.254134 IP 192.168.43.124.8880 > 192.168.43.146.7771: UDP, length 120
01:00:56.297899 IP 192.168.43.146.8880 > 192.168.43.147.7772: UDP, length 120
01:00:56.304126 IP 192.168.43.124.8880 > 192.168.43.146.7771: UDP, length 120
01:00:56.347898 IP 192.168.43.146.8880 > 192.168.43.147.7772: UDP, length 120
01:00:56.356102 IP 192.168.43.124.8880 > 192.168.43.146.7771: UDP, length 120
01:00:56.397897 IP 192.168.43.146.8880 > 192.168.43.147.7772: UDP, length 120
01:00:56.405143 IP 192.168.43.124.8880 > 192.168.43.146.7771: UDP, length 120
01:00:56.447894 IP 192.168.43.146.8880 > 192.168.43.147.7772: UDP, length 120
01:00:56.453956 IP 192.168.43.124.8880 > 192.168.43.146.7771: UDP, length 120
01:00:56.497894 IP 192.168.43.146.8880 > 192.168.43.147.7772: UDP, length 120
01:00:56.511297 IP 192.168.43.124.8880 > 192.168.43.146.7771: UDP, length 120
01:00:56.547896 IP 192.168.43.146.8880 > 192.168.43.147.7772: UDP, length 120
01:00:56.569456 IP 192.168.43.124.8880 > 192.168.43.146.7771: UDP, length 120
01:00:56.597894 IP 192.168.43.146.8880 > 192.168.43.147.7772: UDP, length 120
01:00:56.626429 IP 192.168.43.124.8880 > 192.168.43.146.7771: UDP, length 120
01:00:56.647897 IP 192.168.43.146.8880 > 192.168.43.147.7772: UDP, length 120
01:00:56.653195 IP 192.168.43.124.8880 > 192.168.43.146.7771: UDP, length 120
01:00:56.697893 IP 192.168.43.146.8880 > 192.168.43.147.7772: UDP, length 120
01:00:56.709944 IP 192.168.43.124.8880 > 192.168.43.146.7771: UDP, length 120
01:00:56.747894 IP 192.168.43.146.8880 > 192.168.43.147.7772: UDP, length 120
01:00:56.770353 IP 192.168.43.124.8880 > 192.168.43.146.7771: UDP, length 120
01:00:56.797895 IP 192.168.43.146.8880 > 192.168.43.147.7772: UDP, length 120
01:00:56.824324 IP 192.168.43.124.8880 > 192.168.43.146.7771: UDP, length 120
01:00:56.847896 IP 192.168.43.146.8880 > 192.168.43.147.7772: UDP, length 120
01:00:56.881902 IP 192.168.43.124.8880 > 192.168.43.146.7771: UDP, length 120
01:00:56.897895 IP 192.168.43.146.8880 > 192.168.43.147.7772: UDP, length 120
01:00:56.938826 IP 192.168.43.124.8880 > 192.168.43.146.7771: UDP, length 120
01:00:56.947896 IP 192.168.43.146.8880 > 192.168.43.147.7772: UDP, length 120
01:00:56.953380 IP 192.168.43.124.8880 > 192.168.43.146.7771: UDP, length 120
01:00:56.997930 IP 192.168.43.146.8880 > 192.168.43.147.7772: UDP, length 120
01:00:57.008915 IP 192.168.43.124.8880 > 192.168.43.146.7771: UDP, length 120
01:00:57.047905 IP 192.168.43.146.8880 > 192.168.43.147.7772: UDP, length 120
01:00:57.060163 IP 192.168.43.124.8880 > 192.168.43.146.7771: UDP, length 120
01:00:57.097950 IP 192.168.43.146.8880 > 192.168.43.147.7772: UDP, length 120
01:00:57.119282 IP 192.168.43.124.8880 > 192.168.43.146.7771: UDP, length 120
01:00:57.147911 IP 192.168.43.146.8880 > 192.168.43.147.7772: UDP, length 120
01:00:57.173962 IP 192.168.43.124.8880 > 192.168.43.146.7771: UDP, length 120
01:00:57.197899 IP 192.168.43.146.8880 > 192.168.43.147.7772: UDP, length 120
01:00:57.203239 IP 192.168.43.124.8880 > 192.168.43.146.7771: UDP, length 120
01:00:57.247899 IP 192.168.43.146.8880 > 192.168.43.147.7772: UDP, length 120
01:00:57.253252 IP 192.168.43.124.8880 > 192.168.43.146.7771: UDP, length 120
01:00:57.297905 IP 192.168.43.146.8880 > 192.168.43.147.7772: UDP, length 120
01:00:57.303666 IP 192.168.43.124.8880 > 192.168.43.146.7771: UDP, length 120
01:00:57.347901 IP 192.168.43.146.8880 > 192.168.43.147.7772: UDP, length 120
01:00:57.361111 IP 192.168.43.124.8880 > 192.168.43.146.7771: UDP, length 120
01:00:57.397895 IP 192.168.43.146.8880 > 192.168.43.147.7772: UDP, length 120
01:00:57.418081 IP 192.168.43.124.8880 > 192.168.43.146.7771: UDP, length 120
01:00:57.447897 IP 192.168.43.146.8880 > 192.168.43.147.7772: UDP, length 120
01:00:57.471593 IP 192.168.43.124.8880 > 192.168.43.146.7771: UDP, length 120
01:00:57.497895 IP 192.168.43.146.8880 > 192.168.43.147.7772: UDP, length 120
01:00:57.503252 IP 192.168.43.124.8880 > 192.168.43.146.7771: UDP, length 120
01:00:57.547895 IP 192.168.43.146.8880 > 192.168.43.147.7772: UDP, length 120
01:00:57.553241 IP 192.168.43.124.8880 > 192.168.43.146.7771: UDP, length 120
01:00:57.597894 IP 192.168.43.146.8880 > 192.168.43.147.7772: UDP, length 120
01:00:57.603213 IP 192.168.43.124.8880 > 192.168.43.146.7771: UDP, length 120
01:00:57.647925 IP 192.168.43.146.8880 > 192.168.43.147.7772: UDP, length 120
01:00:57.653338 IP 192.168.43.124.8880 > 192.168.43.146.7771: UDP, length 120
01:00:57.697921 IP 192.168.43.146.8880 > 192.168.43.147.7772: UDP, length 120
01:00:57.710951 IP 192.168.43.124.8880 > 192.168.43.146.7771: UDP, length 120
01:00:57.747921 IP 192.168.43.146.8880 > 192.168.43.147.7772: UDP, length 120
01:00:57.768373 IP 192.168.43.124.8880 > 192.168.43.146.7771: UDP, length 120
01:00:57.797919 IP 192.168.43.146.8880 > 192.168.43.147.7772: UDP, length 120
01:00:57.822397 IP 192.168.43.124.8880 > 192.168.43.146.7771: UDP, length 120
01:00:57.847920 IP 192.168.43.146.8880 > 192.168.43.147.7772: UDP, length 120
01:00:57.853310 IP 192.168.43.124.8880 > 192.168.43.146.7771: UDP, length 120
01:00:57.897921 IP 192.168.43.146.8880 > 192.168.43.147.7772: UDP, length 120
01:00:57.903258 IP 192.168.43.124.8880 > 192.168.43.146.7771: UDP, length 120
01:00:57.947921 IP 192.168.43.146.8880 > 192.168.43.147.7772: UDP, length 120
01:00:57.970300 IP 192.168.43.124.8880 > 192.168.43.146.7771: UDP, length 120
01:00:57.997920 IP 192.168.43.146.8880 > 192.168.43.147.7772: UDP, length 120
01:00:58.005391 IP 192.168.43.124.8880 > 192.168.43.146.7771: UDP, length 120
01:00:58.047921 IP 192.168.43.146.8880 > 192.168.43.147.7772: UDP, length 120
01:00:58.053264 IP 192.168.43.124.8880 > 192.168.43.146.7771: UDP, length 120
01:00:58.097947 IP 192.168.43.146.8880 > 192.168.43.147.7772: UDP, length 120
01:00:58.104732 IP 192.168.43.124.8880 > 192.168.43.146.7771: UDP, length 120
01:00:58.147933 IP 192.168.43.146.8880 > 192.168.43.147.7772: UDP, length 120
01:00:58.153387 IP 192.168.43.124.8880 > 192.168.43.146.7771: UDP, length 120
01:00:58.197923 IP 192.168.43.146.8880 > 192.168.43.147.7772: UDP, length 120
01:00:58.211123 IP 192.168.43.124.8880 > 192.168.43.146.7771: UDP, length 120
01:00:58.247921 IP 192.168.43.146.8880 > 192.168.43.147.7772: UDP, length 120
01:00:58.269696 IP 192.168.43.124.8880 > 192.168.43.146.7771: UDP, length 120
01:00:58.297921 IP 192.168.43.146.8880 > 192.168.43.147.7772: UDP, length 120
01:00:58.303213 IP 192.168.43.124.8880 > 192.168.43.146.7771: UDP, length 120
01:00:58.347924 IP 192.168.43.146.8880 > 192.168.43.147.7772: UDP, length 120
01:00:58.353215 IP 192.168.43.124.8880 > 192.168.43.146.7771: UDP, length 120
01:00:58.397928 IP 192.168.43.146.8880 > 192.168.43.147.7772: UDP, length 120
01:00:58.403363 IP 192.168.43.124.8880 > 192.168.43.146.7771: UDP, length 120
01:00:58.447923 IP 192.168.43.146.8880 > 192.168.43.147.7772: UDP, length 120
01:00:58.453194 IP 192.168.43.124.8880 > 192.168.43.146.7771: UDP, length 120
01:00:58.497974 IP 192.168.43.146.8880 > 192.168.43.147.7772: UDP, length 120
01:00:58.505136 IP 192.168.43.124.8880 > 192.168.43.146.7771: UDP, length 120
01:00:58.547939 IP 192.168.43.146.8880 > 192.168.43.147.7772: UDP, length 120
01:00:58.555023 IP 192.168.43.124.8880 > 192.168.43.146.7771: UDP, length 120
01:00:58.597923 IP 192.168.43.146.8880 > 192.168.43.147.7772: UDP, length 120
01:00:58.606874 IP 192.168.43.124.8880 > 192.168.43.146.7771: UDP, length 120
01:00:58.647923 IP 192.168.43.146.8880 > 192.168.43.147.7772: UDP, length 120
01:00:58.655191 IP 192.168.43.124.8880 > 192.168.43.146.7771: UDP, length 120
01:00:58.697920 IP 192.168.43.146.8880 > 192.168.43.147.7772: UDP, length 120
01:00:58.706899 IP 192.168.43.124.8880 > 192.168.43.146.7771: UDP, length 120
01:00:58.747921 IP 192.168.43.146.8880 > 192.168.43.147.7772: UDP, length 120
01:00:58.756881 IP 192.168.43.124.8880 > 192.168.43.146.7771: UDP, length 120
01:00:58.797918 IP 192.168.43.146.8880 > 192.168.43.147.7772: UDP, length 120
01:00:58.805556 IP 192.168.43.124.8880 > 192.168.43.146.7771: UDP, length 120
01:00:58.847921 IP 192.168.43.146.8880 > 192.168.43.147.7772: UDP, length 120
01:00:58.853865 IP 192.168.43.124.8880 > 192.168.43.146.7771: UDP, length 120
01:00:58.897920 IP 192.168.43.146.8880 > 192.168.43.147.7772: UDP, length 120
01:00:58.905180 IP 192.168.43.124.8880 > 192.168.43.146.7771: UDP, length 120
01:00:58.947922 IP 192.168.43.146.8880 > 192.168.43.147.7772: UDP, length 120
01:00:58.954237 IP 192.168.43.124.8880 > 192.168.43.146.7771: UDP, length 120
01:00:58.997957 IP 192.168.43.146.8880 > 192.168.43.147.7772: UDP, length 120
01:00:59.005221 IP 192.168.43.124.8880 > 192.168.43.146.7771: UDP, length 120
01:00:59.047924 IP 192.168.43.146.8880 > 192.168.43.147.7772: UDP, length 120
01:00:59.065133 IP 192.168.43.124.8880 > 192.168.43.146.7771: UDP, length 120
01:00:59.098905 IP 192.168.43.146.8880 > 192.168.43.147.7772: UDP, length 120
01:00:59.105134 IP 192.168.43.124.8880 > 192.168.43.146.7771: UDP, length 120
01:00:59.148012 IP 192.168.43.146.8880 > 192.168.43.147.7772: UDP, length 120
01:00:59.156533 IP 192.168.43.124.8880 > 192.168.43.146.7771: UDP, length 120
01:00:59.198021 IP 192.168.43.146.8880 > 192.168.43.147.7772: UDP, length 120
01:00:59.204849 IP 192.168.43.124.8880 > 192.168.43.146.7771: UDP, length 120
01:00:59.247966 IP 192.168.43.146.8880 > 192.168.43.147.7772: UDP, length 120
01:00:59.254084 IP 192.168.43.124.8880 > 192.168.43.146.7771: UDP, length 120
01:00:59.297922 IP 192.168.43.146.8880 > 192.168.43.147.7772: UDP, length 120
01:00:59.321058 IP 192.168.43.124.8880 > 192.168.43.146.7771: UDP, length 120
01:00:59.347915 IP 192.168.43.146.8880 > 192.168.43.147.7772: UDP, length 120
01:00:59.355962 IP 192.168.43.124.8880 > 192.168.43.146.7771: UDP, length 120
01:00:59.397904 IP 192.168.43.146.8880 > 192.168.43.147.7772: UDP, length 120
01:00:59.403708 IP 192.168.43.124.8880 > 192.168.43.146.7771: UDP, length 120
01:00:59.447910 IP 192.168.43.146.8880 > 192.168.43.147.7772: UDP, length 120
01:00:59.454097 IP 192.168.43.124.8880 > 192.168.43.146.7771: UDP, length 120
01:00:59.497899 IP 192.168.43.146.8880 > 192.168.43.147.7772: UDP, length 120
01:00:59.516043 IP 192.168.43.124.8880 > 192.168.43.146.7771: UDP, length 120
01:00:59.547899 IP 192.168.43.146.8880 > 192.168.43.147.7772: UDP, length 120
01:00:59.556069 IP 192.168.43.124.8880 > 192.168.43.146.7771: UDP, length 120
01:00:59.597895 IP 192.168.43.146.8880 > 192.168.43.147.7772: UDP, length 120
01:00:59.608059 IP 192.168.43.124.8880 > 192.168.43.146.7771: UDP, length 120
01:00:59.647897 IP 192.168.43.146.8880 > 192.168.43.147.7772: UDP, length 120
01:00:59.654143 IP 192.168.43.124.8880 > 192.168.43.146.7771: UDP, length 120
01:00:59.697894 IP 192.168.43.146.8880 > 192.168.43.147.7772: UDP, length 120
01:00:59.705086 IP 192.168.43.124.8880 > 192.168.43.146.7771: UDP, length 120
01:00:59.747896 IP 192.168.43.146.8880 > 192.168.43.147.7772: UDP, length 120
01:00:59.755758 IP 192.168.43.124.8880 > 192.168.43.146.7771: UDP, length 120
01:00:59.797896 IP 192.168.43.146.8880 > 192.168.43.147.7772: UDP, length 120
01:00:59.803995 IP 192.168.43.124.8880 > 192.168.43.146.7771: UDP, length 120
01:00:59.847895 IP 192.168.43.146.8880 > 192.168.43.147.7772: UDP, length 120
01:00:59.854116 IP 192.168.43.124.8880 > 192.168.43.146.7771: UDP, length 120
01:00:59.897895 IP 192.168.43.146.8880 > 192.168.43.147.7772: UDP, length 120
01:00:59.903743 IP 192.168.43.124.8880 > 192.168.43.146.7771: UDP, length 120
01:00:59.947895 IP 192.168.43.146.8880 > 192.168.43.147.7772: UDP, length 120
01:00:59.954928 IP 192.168.43.124.8880 > 192.168.43.146.7771: UDP, length 120
01:00:59.997927 IP 192.168.43.146.8880 > 192.168.43.147.7772: UDP, length 120
01:01:00.005167 IP 192.168.43.124.8880 > 192.168.43.146.7771: UDP, length 120
01:01:00.047907 IP 192.168.43.146.8880 > 192.168.43.147.7772: UDP, length 120
01:01:00.054938 IP 192.168.43.124.8880 > 192.168.43.146.7771: UDP, length 120
01:01:00.097906 IP 192.168.43.146.8880 > 192.168.43.147.7772: UDP, length 120
01:01:00.106709 IP 192.168.43.124.8880 > 192.168.43.146.7771: UDP, length 120
01:01:00.147900 IP 192.168.43.146.8880 > 192.168.43.147.7772: UDP, length 120
01:01:00.155411 IP 192.168.43.124.8880 > 192.168.43.146.7771: UDP, length 120
01:01:00.197898 IP 192.168.43.146.8880 > 192.168.43.147.7772: UDP, length 120
01:01:00.206744 IP 192.168.43.124.8880 > 192.168.43.146.7771: UDP, length 120
01:01:00.247971 IP 192.168.43.146.8880 > 192.168.43.147.7772: UDP, length 120
01:01:00.258188 IP 192.168.43.124.8880 > 192.168.43.146.7771: UDP, length 120
01:01:00.297954 IP 192.168.43.146.8880 > 192.168.43.147.7772: UDP, length 120
01:01:00.303852 IP 192.168.43.124.8880 > 192.168.43.146.7771: UDP, length 120
01:01:00.347907 IP 192.168.43.146.8880 > 192.168.43.147.7772: UDP, length 120
01:01:00.354692 IP 192.168.43.124.8880 > 192.168.43.146.7771: UDP, length 120
01:01:00.397898 IP 192.168.43.146.8880 > 192.168.43.147.7772: UDP, length 120
01:01:00.404957 IP 192.168.43.124.8880 > 192.168.43.146.7771: UDP, length 120
01:01:00.447898 IP 192.168.43.146.8880 > 192.168.43.147.7772: UDP, length 120
01:01:00.453273 IP 192.168.43.124.8880 > 192.168.43.146.7771: UDP, length 120
01:01:00.497900 IP 192.168.43.146.8880 > 192.168.43.147.7772: UDP, length 120
01:01:00.517001 IP 192.168.43.124.8880 > 192.168.43.146.7771: UDP, length 120
01:01:00.547900 IP 192.168.43.146.8880 > 192.168.43.147.7772: UDP, length 120
01:01:00.581780 IP 192.168.43.124.8880 > 192.168.43.146.7771: UDP, length 120
01:01:00.597904 IP 192.168.43.146.8880 > 192.168.43.147.7772: UDP, length 120
01:01:00.603101 IP 192.168.43.124.8880 > 192.168.43.146.7771: UDP, length 120
01:01:00.647899 IP 192.168.43.146.8880 > 192.168.43.147.7772: UDP, length 120
01:01:00.655121 IP 192.168.43.124.8880 > 192.168.43.146.7771: UDP, length 120
01:01:00.697895 IP 192.168.43.146.8880 > 192.168.43.147.7772: UDP, length 120
01:01:00.703093 IP 192.168.43.124.8880 > 192.168.43.146.7771: UDP, length 120
01:01:00.747895 IP 192.168.43.146.8880 > 192.168.43.147.7772: UDP, length 120
01:01:00.760964 IP 192.168.43.124.8880 > 192.168.43.146.7771: UDP, length 120
01:01:00.797894 IP 192.168.43.146.8880 > 192.168.43.147.7772: UDP, length 120
01:01:00.818788 IP 192.168.43.124.8880 > 192.168.43.146.7771: UDP, length 120
01:01:00.847895 IP 192.168.43.146.8880 > 192.168.43.147.7772: UDP, length 120
01:01:00.853039 IP 192.168.43.124.8880 > 192.168.43.146.7771: UDP, length 120
01:01:00.897894 IP 192.168.43.146.8880 > 192.168.43.147.7772: UDP, length 120
01:01:00.905363 IP 192.168.43.124.8880 > 192.168.43.146.7771: UDP, length 120
01:01:00.947927 IP 192.168.43.146.8880 > 192.168.43.147.7772: UDP, length 120
01:01:00.953018 IP 192.168.43.124.8880 > 192.168.43.146.7771: UDP, length 120
01:01:00.997964 IP 192.168.43.146.8880 > 192.168.43.147.7772: UDP, length 120
01:01:01.009888 IP 192.168.43.124.8880 > 192.168.43.146.7771: UDP, length 120
01:01:01.047965 IP 192.168.43.146.8880 > 192.168.43.147.7772: UDP, length 120
01:01:01.067752 IP 192.168.43.124.8880 > 192.168.43.146.7771: UDP, length 120
01:01:01.097944 IP 192.168.43.146.8880 > 192.168.43.147.7772: UDP, length 120
01:01:01.121902 IP 192.168.43.124.8880 > 192.168.43.146.7771: UDP, length 120
01:01:01.147985 IP 192.168.43.146.8880 > 192.168.43.147.7772: UDP, length 120
01:01:01.153062 IP 192.168.43.124.8880 > 192.168.43.146.7771: UDP, length 120
01:01:01.197983 IP 192.168.43.146.8880 > 192.168.43.147.7772: UDP, length 120
01:01:01.207149 IP 192.168.43.124.8880 > 192.168.43.146.7771: UDP, length 120
01:01:01.247948 IP 192.168.43.146.8880 > 192.168.43.147.7772: UDP, length 120
01:01:01.253255 IP 192.168.43.124.8880 > 192.168.43.146.7771: UDP, length 120
01:01:01.297991 IP 192.168.43.146.8880 > 192.168.43.147.7772: UDP, length 120
01:01:01.307275 IP 192.168.43.124.8880 > 192.168.43.146.7771: UDP, length 120
01:01:01.347984 IP 192.168.43.146.8880 > 192.168.43.147.7772: UDP, length 120
01:01:01.360338 IP 192.168.43.124.8880 > 192.168.43.146.7771: UDP, length 120
01:01:01.397963 IP 192.168.43.146.8880 > 192.168.43.147.7772: UDP, length 120
01:01:01.417827 IP 192.168.43.124.8880 > 192.168.43.146.7771: UDP, length 120
01:01:01.447939 IP 192.168.43.146.8880 > 192.168.43.147.7772: UDP, length 120
01:01:01.453059 IP 192.168.43.124.8880 > 192.168.43.146.7771: UDP, length 120
01:01:01.497936 IP 192.168.43.146.8880 > 192.168.43.147.7772: UDP, length 120
01:01:01.531168 IP 192.168.43.124.8880 > 192.168.43.146.7771: UDP, length 120
01:01:01.547917 IP 192.168.43.146.8880 > 192.168.43.147.7772: UDP, length 120
01:01:01.553878 IP 192.168.43.124.8880 > 192.168.43.146.7771: UDP, length 120
01:01:01.597902 IP 192.168.43.146.8880 > 192.168.43.147.7772: UDP, length 120
01:01:01.610200 IP 192.168.43.124.8880 > 192.168.43.146.7771: UDP, length 120
01:01:01.647898 IP 192.168.43.146.8880 > 192.168.43.147.7772: UDP, length 120
01:01:01.668429 IP 192.168.43.124.8880 > 192.168.43.146.7771: UDP, length 120
01:01:01.697896 IP 192.168.43.146.8880 > 192.168.43.147.7772: UDP, length 120
01:01:01.722725 IP 192.168.43.124.8880 > 192.168.43.146.7771: UDP, length 120
01:01:01.747894 IP 192.168.43.146.8880 > 192.168.43.147.7772: UDP, length 120
01:01:01.753285 IP 192.168.43.124.8880 > 192.168.43.146.7771: UDP, length 120
01:01:01.797896 IP 192.168.43.146.8880 > 192.168.43.147.7772: UDP, length 120
01:01:01.806664 IP 192.168.43.124.8880 > 192.168.43.146.7771: UDP, length 120
01:01:01.847895 IP 192.168.43.146.8880 > 192.168.43.147.7772: UDP, length 120
01:01:01.859564 IP 192.168.43.124.8880 > 192.168.43.146.7771: UDP, length 120
01:01:01.897895 IP 192.168.43.146.8880 > 192.168.43.147.7772: UDP, length 120
01:01:01.902994 IP 192.168.43.124.8880 > 192.168.43.146.7771: UDP, length 120
01:01:01.947895 IP 192.168.43.146.8880 > 192.168.43.147.7772: UDP, length 120
01:01:01.960763 IP 192.168.43.124.8880 > 192.168.43.146.7771: UDP, length 120
01:01:01.997897 IP 192.168.43.146.8880 > 192.168.43.147.7772: UDP, length 120
01:01:02.018384 IP 192.168.43.124.8880 > 192.168.43.146.7771: UDP, length 120
01:01:02.047895 IP 192.168.43.146.8880 > 192.168.43.147.7772: UDP, length 120
01:01:02.072367 IP 192.168.43.124.8880 > 192.168.43.146.7771: UDP, length 120
01:01:02.097905 IP 192.168.43.146.8880 > 192.168.43.147.7772: UDP, length 120
01:01:02.103205 IP 192.168.43.124.8880 > 192.168.43.146.7771: UDP, length 120
01:01:02.147901 IP 192.168.43.146.8880 > 192.168.43.147.7772: UDP, length 120
01:01:02.153225 IP 192.168.43.124.8880 > 192.168.43.146.7771: UDP, length 120
01:01:02.197896 IP 192.168.43.146.8880 > 192.168.43.147.7772: UDP, length 120
01:01:02.203432 IP 192.168.43.124.8880 > 192.168.43.146.7771: UDP, length 120
01:01:02.247896 IP 192.168.43.146.8880 > 192.168.43.147.7772: UDP, length 120
01:01:02.255783 IP 192.168.43.124.8880 > 192.168.43.146.7771: UDP, length 120
01:01:02.297965 IP 192.168.43.146.8880 > 192.168.43.147.7772: UDP, length 120
01:01:02.311333 IP 192.168.43.124.8880 > 192.168.43.146.7771: UDP, length 120
01:01:02.347917 IP 192.168.43.146.8880 > 192.168.43.147.7772: UDP, length 120
01:01:02.370256 IP 192.168.43.124.8880 > 192.168.43.146.7771: UDP, length 120
01:01:02.397900 IP 192.168.43.146.8880 > 192.168.43.147.7772: UDP, length 120
01:01:02.404811 IP 192.168.43.124.8880 > 192.168.43.146.7771: UDP, length 120
01:01:02.447898 IP 192.168.43.146.8880 > 192.168.43.147.7772: UDP, length 120
01:01:02.454146 IP 192.168.43.124.8880 > 192.168.43.146.7771: UDP, length 120
01:01:02.497896 IP 192.168.43.146.8880 > 192.168.43.147.7772: UDP, length 120
01:01:02.521246 IP 192.168.43.124.8880 > 192.168.43.146.7771: UDP, length 120
01:01:02.547897 IP 192.168.43.146.8880 > 192.168.43.147.7772: UDP, length 120
01:01:02.553073 IP 192.168.43.124.8880 > 192.168.43.146.7771: UDP, length 120
01:01:02.597900 IP 192.168.43.146.8880 > 192.168.43.147.7772: UDP, length 120
01:01:02.603860 IP 192.168.43.124.8880 > 192.168.43.146.7771: UDP, length 120
01:01:02.647932 IP 192.168.43.146.8880 > 192.168.43.147.7772: UDP, length 120
01:01:02.653202 IP 192.168.43.124.8880 > 192.168.43.146.7771: UDP, length 120
01:01:02.697922 IP 192.168.43.146.8880 > 192.168.43.147.7772: UDP, length 120
01:01:02.718089 IP 192.168.43.124.8880 > 192.168.43.146.7771: UDP, length 120
01:01:02.747923 IP 192.168.43.146.8880 > 192.168.43.147.7772: UDP, length 120
01:01:02.773221 IP 192.168.43.124.8880 > 192.168.43.146.7771: UDP, length 120
01:01:02.797920 IP 192.168.43.146.8880 > 192.168.43.147.7772: UDP, length 120
01:01:02.803109 IP 192.168.43.124.8880 > 192.168.43.146.7771: UDP, length 120
01:01:02.847922 IP 192.168.43.146.8880 > 192.168.43.147.7772: UDP, length 120
01:01:02.853135 IP 192.168.43.124.8880 > 192.168.43.146.7771: UDP, length 120
01:01:02.897920 IP 192.168.43.146.8880 > 192.168.43.147.7772: UDP, length 120
01:01:02.906212 IP 192.168.43.124.8880 > 192.168.43.146.7771: UDP, length 120
01:01:02.947925 IP 192.168.43.146.8880 > 192.168.43.147.7772: UDP, length 120
01:01:02.953832 IP 192.168.43.124.8880 > 192.168.43.146.7771: UDP, length 120
01:01:02.997972 IP 192.168.43.146.8880 > 192.168.43.147.7772: UDP, length 120
01:01:03.011996 IP 192.168.43.124.8880 > 192.168.43.146.7771: UDP, length 120
01:01:03.047940 IP 192.168.43.146.8880 > 192.168.43.147.7772: UDP, length 120
01:01:03.069478 IP 192.168.43.124.8880 > 192.168.43.146.7771: UDP, length 120
01:01:03.097957 IP 192.168.43.146.8880 > 192.168.43.147.7772: UDP, length 120
01:01:03.103352 IP 192.168.43.124.8880 > 192.168.43.146.7771: UDP, length 120
01:01:03.147937 IP 192.168.43.146.8880 > 192.168.43.147.7772: UDP, length 120
01:01:03.153143 IP 192.168.43.124.8880 > 192.168.43.146.7771: UDP, length 120
01:01:03.197922 IP 192.168.43.146.8880 > 192.168.43.147.7772: UDP, length 120
01:01:03.203178 IP 192.168.43.124.8880 > 192.168.43.146.7771: UDP, length 120
01:01:03.247922 IP 192.168.43.146.8880 > 192.168.43.147.7772: UDP, length 120
01:01:03.254328 IP 192.168.43.124.8880 > 192.168.43.146.7771: UDP, length 120
01:01:03.298012 IP 192.168.43.146.8880 > 192.168.43.147.7772: UDP, length 120
01:01:03.310516 IP 192.168.43.124.8880 > 192.168.43.146.7771: UDP, length 120
01:01:03.347975 IP 192.168.43.146.8880 > 192.168.43.147.7772: UDP, length 120
01:01:03.367434 IP 192.168.43.124.8880 > 192.168.43.146.7771: UDP, length 120
01:01:03.397929 IP 192.168.43.146.8880 > 192.168.43.147.7772: UDP, length 120
01:01:03.421942 IP 192.168.43.124.8880 > 192.168.43.146.7771: UDP, length 120
01:01:03.447927 IP 192.168.43.146.8880 > 192.168.43.147.7772: UDP, length 120
01:01:03.453290 IP 192.168.43.124.8880 > 192.168.43.146.7771: UDP, length 120
01:01:03.497925 IP 192.168.43.146.8880 > 192.168.43.147.7772: UDP, length 120
01:01:03.503079 IP 192.168.43.124.8880 > 192.168.43.146.7771: UDP, length 120
01:01:03.547924 IP 192.168.43.146.8880 > 192.168.43.147.7772: UDP, length 120
01:01:03.553170 IP 192.168.43.124.8880 > 192.168.43.146.7771: UDP, length 120
01:01:03.597924 IP 192.168.43.146.8880 > 192.168.43.147.7772: UDP, length 120
01:01:03.603126 IP 192.168.43.124.8880 > 192.168.43.146.7771: UDP, length 120
01:01:03.647934 IP 192.168.43.146.8880 > 192.168.43.147.7772: UDP, length 120
01:01:03.653221 IP 192.168.43.124.8880 > 192.168.43.146.7771: UDP, length 120
01:01:03.697929 IP 192.168.43.146.8880 > 192.168.43.147.7772: UDP, length 120
01:01:03.703635 IP 192.168.43.124.8880 > 192.168.43.146.7771: UDP, length 120
01:01:03.747923 IP 192.168.43.146.8880 > 192.168.43.147.7772: UDP, length 120
01:01:03.766617 IP 192.168.43.124.8880 > 192.168.43.146.7771: UDP, length 120
01:01:03.797922 IP 192.168.43.146.8880 > 192.168.43.147.7772: UDP, length 120
01:01:03.804430 IP 192.168.43.124.8880 > 192.168.43.146.7771: UDP, length 120
01:01:03.847920 IP 192.168.43.146.8880 > 192.168.43.147.7772: UDP, length 120
01:01:03.854954 IP 192.168.43.124.8880 > 192.168.43.146.7771: UDP, length 120
01:01:03.897919 IP 192.168.43.146.8880 > 192.168.43.147.7772: UDP, length 120
01:01:03.916275 IP 192.168.43.124.8880 > 192.168.43.146.7771: UDP, length 120
01:01:03.947921 IP 192.168.43.146.8880 > 192.168.43.147.7772: UDP, length 120
01:01:03.953071 IP 192.168.43.124.8880 > 192.168.43.146.7771: UDP, length 120
01:01:03.997920 IP 192.168.43.146.8880 > 192.168.43.147.7772: UDP, length 120
01:01:04.003506 IP 192.168.43.124.8880 > 192.168.43.146.7771: UDP, length 120
01:01:04.047922 IP 192.168.43.146.8880 > 192.168.43.147.7772: UDP, length 120
01:01:04.066307 IP 192.168.43.124.8880 > 192.168.43.146.7771: UDP, length 120
01:01:04.097928 IP 192.168.43.146.8880 > 192.168.43.147.7772: UDP, length 120
01:01:04.103026 IP 192.168.43.124.8880 > 192.168.43.146.7771: UDP, length 120
01:01:04.147926 IP 192.168.43.146.8880 > 192.168.43.147.7772: UDP, length 120
01:01:04.153093 IP 192.168.43.124.8880 > 192.168.43.146.7771: UDP, length 120
01:01:04.197920 IP 192.168.43.146.8880 > 192.168.43.147.7772: UDP, length 120
01:01:04.216959 IP 192.168.43.124.8880 > 192.168.43.146.7771: UDP, length 120
01:01:04.247921 IP 192.168.43.146.8880 > 192.168.43.147.7772: UDP, length 120
01:01:04.253121 IP 192.168.43.124.8880 > 192.168.43.146.7771: UDP, length 120
01:01:04.297920 IP 192.168.43.146.8880 > 192.168.43.147.7772: UDP, length 120
01:01:04.303336 IP 192.168.43.124.8880 > 192.168.43.146.7771: UDP, length 120
01:01:04.347986 IP 192.168.43.146.8880 > 192.168.43.147.7772: UDP, length 120
01:01:04.369645 IP 192.168.43.124.8880 > 192.168.43.146.7771: UDP, length 120
01:01:04.397934 IP 192.168.43.146.8880 > 192.168.43.147.7772: UDP, length 120
01:01:04.405717 IP 192.168.43.124.8880 > 192.168.43.146.7771: UDP, length 120
01:01:04.447927 IP 192.168.43.146.8880 > 192.168.43.147.7772: UDP, length 120
01:01:04.453209 IP 192.168.43.124.8880 > 192.168.43.146.7771: UDP, length 120
01:01:04.497972 IP 192.168.43.146.8880 > 192.168.43.147.7772: UDP, length 120
01:01:04.516561 IP 192.168.43.124.8880 > 192.168.43.146.7771: UDP, length 120
01:01:04.547941 IP 192.168.43.146.8880 > 192.168.43.147.7772: UDP, length 120
01:01:04.553179 IP 192.168.43.124.8880 > 192.168.43.146.7771: UDP, length 120
01:01:04.597925 IP 192.168.43.146.8880 > 192.168.43.147.7772: UDP, length 120
01:01:04.603556 IP 192.168.43.124.8880 > 192.168.43.146.7771: UDP, length 120
01:01:04.647922 IP 192.168.43.146.8880 > 192.168.43.147.7772: UDP, length 120
01:01:04.666259 IP 192.168.43.124.8880 > 192.168.43.146.7771: UDP, length 120
01:01:04.697926 IP 192.168.43.146.8880 > 192.168.43.147.7772: UDP, length 120
01:01:04.703143 IP 192.168.43.124.8880 > 192.168.43.146.7771: UDP, length 120
01:01:04.747922 IP 192.168.43.146.8880 > 192.168.43.147.7772: UDP, length 120
01:01:04.754151 IP 192.168.43.124.8880 > 192.168.43.146.7771: UDP, length 120
01:01:04.797928 IP 192.168.43.146.8880 > 192.168.43.147.7772: UDP, length 120
01:01:04.804639 IP 192.168.43.124.8880 > 192.168.43.146.7771: UDP, length 120
01:01:04.847924 IP 192.168.43.146.8880 > 192.168.43.147.7772: UDP, length 120
01:01:04.878316 IP 192.168.43.124.8880 > 192.168.43.146.7771: UDP, length 120
01:01:04.897924 IP 192.168.43.146.8880 > 192.168.43.147.7772: UDP, length 120
01:01:04.903064 IP 192.168.43.124.8880 > 192.168.43.146.7771: UDP, length 120
01:01:04.947925 IP 192.168.43.146.8880 > 192.168.43.147.7772: UDP, length 120
01:01:04.968589 IP 192.168.43.124.8880 > 192.168.43.146.7771: UDP, length 120
01:01:04.997922 IP 192.168.43.146.8880 > 192.168.43.147.7772: UDP, length 120
01:01:05.003095 IP 192.168.43.124.8880 > 192.168.43.146.7771: UDP, length 120
01:01:05.047923 IP 192.168.43.146.8880 > 192.168.43.147.7772: UDP, length 120
01:01:05.053811 IP 192.168.43.124.8880 > 192.168.43.146.7771: UDP, length 120
01:01:05.097932 IP 192.168.43.146.8880 > 192.168.43.147.7772: UDP, length 120
01:01:05.117129 IP 192.168.43.124.8880 > 192.168.43.146.7771: UDP, length 120
01:01:05.147929 IP 192.168.43.146.8880 > 192.168.43.147.7772: UDP, length 120
01:01:05.153165 IP 192.168.43.124.8880 > 192.168.43.146.7771: UDP, length 120
01:01:05.197924 IP 192.168.43.146.8880 > 192.168.43.147.7772: UDP, length 120
01:01:05.205901 IP 192.168.43.124.8880 > 192.168.43.146.7771: UDP, length 120
01:01:05.247924 IP 192.168.43.146.8880 > 192.168.43.147.7772: UDP, length 120
01:01:05.266201 IP 192.168.43.124.8880 > 192.168.43.146.7771: UDP, length 120
01:01:05.297921 IP 192.168.43.146.8880 > 192.168.43.147.7772: UDP, length 120
01:01:05.303219 IP 192.168.43.124.8880 > 192.168.43.146.7771: UDP, length 120
01:01:05.347982 IP 192.168.43.146.8880 > 192.168.43.147.7772: UDP, length 120
01:01:05.353879 IP 192.168.43.124.8880 > 192.168.43.146.7771: UDP, length 120
01:01:05.397932 IP 192.168.43.146.8880 > 192.168.43.147.7772: UDP, length 120
01:01:05.415254 IP 192.168.43.124.8880 > 192.168.43.146.7771: UDP, length 120
01:01:05.447936 IP 192.168.43.146.8880 > 192.168.43.147.7772: UDP, length 120
01:01:05.453090 IP 192.168.43.124.8880 > 192.168.43.146.7771: UDP, length 120
01:01:05.497926 IP 192.168.43.146.8880 > 192.168.43.147.7772: UDP, length 120
01:01:05.505746 IP 192.168.43.124.8880 > 192.168.43.146.7771: UDP, length 120
01:01:05.547926 IP 192.168.43.146.8880 > 192.168.43.147.7772: UDP, length 120
01:01:05.565990 IP 192.168.43.124.8880 > 192.168.43.146.7771: UDP, length 120
01:01:05.597923 IP 192.168.43.146.8880 > 192.168.43.147.7772: UDP, length 120
01:01:05.603130 IP 192.168.43.124.8880 > 192.168.43.146.7771: UDP, length 120
01:01:05.647942 IP 192.168.43.146.8880 > 192.168.43.147.7772: UDP, length 120
01:01:05.653354 IP 192.168.43.124.8880 > 192.168.43.146.7771: UDP, length 120
01:01:05.697925 IP 192.168.43.146.8880 > 192.168.43.147.7772: UDP, length 120
01:01:05.725237 IP 192.168.43.124.8880 > 192.168.43.146.7771: UDP, length 120
01:01:05.747924 IP 192.168.43.146.8880 > 192.168.43.147.7772: UDP, length 120
01:01:05.753131 IP 192.168.43.124.8880 > 192.168.43.146.7771: UDP, length 120
01:01:05.797934 IP 192.168.43.146.8880 > 192.168.43.147.7772: UDP, length 120
01:01:05.816497 IP 192.168.43.124.8880 > 192.168.43.146.7771: UDP, length 120
01:01:05.847931 IP 192.168.43.146.8880 > 192.168.43.147.7772: UDP, length 120
01:01:05.853122 IP 192.168.43.124.8880 > 192.168.43.146.7771: UDP, length 120
01:01:05.897923 IP 192.168.43.146.8880 > 192.168.43.147.7772: UDP, length 120
01:01:05.903264 IP 192.168.43.124.8880 > 192.168.43.146.7771: UDP, length 120
01:01:05.947924 IP 192.168.43.146.8880 > 192.168.43.147.7772: UDP, length 120
01:01:05.966106 IP 192.168.43.124.8880 > 192.168.43.146.7771: UDP, length 120
01:01:05.997944 IP 192.168.43.146.8880 > 192.168.43.147.7772: UDP, length 120
01:01:06.003111 IP 192.168.43.124.8880 > 192.168.43.146.7771: UDP, length 120
01:01:06.047957 IP 192.168.43.146.8880 > 192.168.43.147.7772: UDP, length 120
01:01:06.053792 IP 192.168.43.124.8880 > 192.168.43.146.7771: UDP, length 120
01:01:06.097936 IP 192.168.43.146.8880 > 192.168.43.147.7772: UDP, length 120
01:01:06.116359 IP 192.168.43.124.8880 > 192.168.43.146.7771: UDP, length 120
01:01:06.147930 IP 192.168.43.146.8880 > 192.168.43.147.7772: UDP, length 120
01:01:06.153155 IP 192.168.43.124.8880 > 192.168.43.146.7771: UDP, length 120
01:01:06.197920 IP 192.168.43.146.8880 > 192.168.43.147.7772: UDP, length 120
01:01:06.203976 IP 192.168.43.124.8880 > 192.168.43.146.7771: UDP, length 120
01:01:06.247922 IP 192.168.43.146.8880 > 192.168.43.147.7772: UDP, length 120
01:01:06.266652 IP 192.168.43.124.8880 > 192.168.43.146.7771: UDP, length 120
01:01:06.297919 IP 192.168.43.146.8880 > 192.168.43.147.7772: UDP, length 120
01:01:06.303054 IP 192.168.43.124.8880 > 192.168.43.146.7771: UDP, length 120
01:01:06.347937 IP 192.168.43.146.8880 > 192.168.43.147.7772: UDP, length 120
01:01:06.353097 IP 192.168.43.124.8880 > 192.168.43.146.7771: UDP, length 120
01:01:06.397924 IP 192.168.43.146.8880 > 192.168.43.147.7772: UDP, length 120
01:01:06.406331 IP 192.168.43.124.8880 > 192.168.43.146.7771: UDP, length 120
01:01:06.448057 IP 192.168.43.146.8880 > 192.168.43.147.7772: UDP, length 120
01:01:06.460209 IP 192.168.43.124.8880 > 192.168.43.146.7771: UDP, length 120
01:01:06.498025 IP 192.168.43.146.8880 > 192.168.43.147.7772: UDP, length 120
01:01:06.503695 IP 192.168.43.124.8880 > 192.168.43.146.7771: UDP, length 120
01:01:06.547981 IP 192.168.43.146.8880 > 192.168.43.147.7772: UDP, length 120
