21:00:12.502072 IP 192.168.43.147.8880 > 192.168.43.124.7773: UDP, length 120
21:00:12.556630 IP 192.168.43.147.8880 > 192.168.43.124.7773: UDP, length 120
21:00:12.607257 IP 192.168.43.147.8880 > 192.168.43.124.7773: UDP, length 120
21:00:12.651230 IP 192.168.43.147.8880 > 192.168.43.124.7773: UDP, length 120
21:00:12.707447 IP 192.168.43.147.8880 > 192.168.43.124.7773: UDP, length 120
21:00:12.753767 IP 192.168.43.147.8880 > 192.168.43.124.7773: UDP, length 120
21:00:12.804860 IP 192.168.43.147.8880 > 192.168.43.124.7773: UDP, length 120
21:00:12.851364 IP 192.168.43.147.8880 > 192.168.43.124.7773: UDP, length 120
21:00:12.902526 IP 192.168.43.147.8880 > 192.168.43.124.7773: UDP, length 120
21:00:12.951295 IP 192.168.43.147.8880 > 192.168.43.124.7773: UDP, length 120
21:00:13.004231 IP 192.168.43.147.8880 > 192.168.43.124.7773: UDP, length 120
21:00:13.052277 IP 192.168.43.147.8880 > 192.168.43.124.7773: UDP, length 120
21:00:13.103330 IP 192.168.43.147.8880 > 192.168.43.124.7773: UDP, length 120
21:00:13.152169 IP 192.168.43.147.8880 > 192.168.43.124.7773: UDP, length 120
21:00:13.201749 IP 192.168.43.147.8880 > 192.168.43.124.7773: UDP, length 120
21:00:13.264058 IP 192.168.43.147.8880 > 192.168.43.124.7773: UDP, length 120
21:00:13.303881 IP 192.168.43.147.8880 > 192.168.43.124.7773: UDP, length 120
21:00:13.356836 IP 192.168.43.147.8880 > 192.168.43.124.7773: UDP, length 120
21:00:13.401826 IP 192.168.43.147.8880 > 192.168.43.124.7773: UDP, length 120
21:00:13.457570 IP 192.168.43.147.8880 > 192.168.43.124.7773: UDP, length 120
21:00:13.501364 IP 192.168.43.147.8880 > 192.168.43.124.7773: UDP, length 120
21:00:13.554659 IP 192.168.43.147.8880 > 192.168.43.124.7773: UDP, length 120
21:00:13.603923 IP 192.168.43.147.8880 > 192.168.43.124.7773: UDP, length 120
21:00:13.655650 IP 192.168.43.147.8880 > 192.168.43.124.7773: UDP, length 120
21:00:13.705886 IP 192.168.43.147.8880 > 192.168.43.124.7773: UDP, length 120
21:00:13.751469 IP 192.168.43.147.8880 > 192.168.43.124.7773: UDP, length 120
21:00:13.801719 IP 192.168.43.147.8880 > 192.168.43.124.7773: UDP, length 120
21:00:13.850994 IP 192.168.43.147.8880 > 192.168.43.124.7773: UDP, length 120
21:00:13.901159 IP 192.168.43.147.8880 > 192.168.43.124.7773: UDP, length 120
21:00:13.952011 IP 192.168.43.147.8880 > 192.168.43.124.7773: UDP, length 120
21:00:14.002718 IP 192.168.43.147.8880 > 192.168.43.124.7773: UDP, length 120
21:00:14.054193 IP 192.168.43.147.8880 > 192.168.43.124.7773: UDP, length 120
21:00:14.100052 IP 192.168.43.147.8880 > 192.168.43.124.7773: UDP, length 120
21:00:14.154278 IP 192.168.43.147.8880 > 192.168.43.124.7773: UDP, length 120
21:00:14.202550 IP 192.168.43.147.8880 > 192.168.43.124.7773: UDP, length 120
21:00:14.252077 IP 192.168.43.147.8880 > 192.168.43.124.7773: UDP, length 120
21:00:14.298216 IP 192.168.43.147.8880 > 192.168.43.124.7773: UDP, length 120
21:00:14.348023 IP 192.168.43.147.8880 > 192.168.43.124.7773: UDP, length 120
21:00:14.399419 IP 192.168.43.147.8880 > 192.168.43.124.7773: UDP, length 120
21:00:14.449808 IP 192.168.43.147.8880 > 192.168.43.124.7773: UDP, length 120
21:00:14.500703 IP 192.168.43.147.8880 > 192.168.43.124.7773: UDP, length 120
21:00:14.549776 IP 192.168.43.147.8880 > 192.168.43.124.7773: UDP, length 120
21:00:14.615641 IP 192.168.43.147.8880 > 192.168.43.124.7773: UDP, length 120
21:00:14.649227 IP 192.168.43.147.8880 > 192.168.43.124.7773: UDP, length 120
21:00:14.708921 IP 192.168.43.147.8880 > 192.168.43.124.7773: UDP, length 120
21:00:14.750541 IP 192.168.43.147.8880 > 192.168.43.124.7773: UDP, length 120
21:00:14.809307 IP 192.168.43.147.8880 > 192.168.43.124.7773: UDP, length 120
21:00:14.849055 IP 192.168.43.147.8880 > 192.168.43.124.7773: UDP, length 120
21:00:14.909723 IP 192.168.43.147.8880 > 192.168.43.124.7773: UDP, length 120
21:00:14.949954 IP 192.168.43.147.8880 > 192.168.43.124.7773: UDP, length 120
21:00:15.009075 IP 192.168.43.147.8880 > 192.168.43.124.7773: UDP, length 120
21:00:15.048233 IP 192.168.43.147.8880 > 192.168.43.124.7773: UDP, length 120
21:00:15.110376 IP 192.168.43.147.8880 > 192.168.43.124.7773: UDP, length 120
21:00:15.151169 IP 192.168.43.147.8880 > 192.168.43.124.7773: UDP, length 120
21:00:15.209842 IP 192.168.43.147.8880 > 192.168.43.124.7773: UDP, length 120
21:00:15.248232 IP 192.168.43.147.8880 > 192.168.43.124.7773: UDP, length 120
21:00:15.310974 IP 192.168.43.147.8880 > 192.168.43.124.7773: UDP, length 120
21:00:15.349632 IP 192.168.43.147.8880 > 192.168.43.124.7773: UDP, length 120
21:00:15.411888 IP 192.168.43.147.8880 > 192.168.43.124.7773: UDP, length 120
21:00:15.447460 IP 192.168.43.147.8880 > 192.168.43.124.7773: UDP, length 120
21:00:15.506057 IP 192.168.43.147.8880 > 192.168.43.124.7773: UDP, length 120
21:00:15.549761 IP 192.168.43.147.8880 > 192.168.43.124.7773: UDP, length 120
21:00:15.606604 IP 192.168.43.147.8880 > 192.168.43.124.7773: UDP, length 120
21:00:15.658890 IP 192.168.43.147.8880 > 192.168.43.124.7773: UDP, length 120
21:00:15.729065 IP 192.168.43.147.8880 > 192.168.43.124.7773: UDP, length 120
21:00:15.757637 IP 192.168.43.147.8880 > 192.168.43.124.7773: UDP, length 120
21:00:15.831450 IP 192.168.43.147.8880 > 192.168.43.124.7773: UDP, length 120
21:00:15.850167 IP 192.168.43.147.8880 > 192.168.43.124.7773: UDP, length 120
21:00:15.909538 IP 192.168.43.147.8880 > 192.168.43.124.7773: UDP, length 120
21:00:15.949447 IP 192.168.43.147.8880 > 192.168.43.124.7773: UDP, length 120
21:00:16.001287 IP 192.168.43.147.8880 > 192.168.43.124.7773: UDP, length 120
21:00:16.061360 IP 192.168.43.147.8880 > 192.168.43.124.7773: UDP, length 120
21:00:16.100857 IP 192.168.43.147.8880 > 192.168.43.124.7773: UDP, length 120
21:00:16.161289 IP 192.168.43.147.8880 > 192.168.43.124.7773: UDP, length 120
21:00:16.204505 IP 192.168.43.147.8880 > 192.168.43.124.7773: UDP, length 120
21:00:16.260459 IP 192.168.43.147.8880 > 192.168.43.124.7773: UDP, length 120
21:00:16.299941 IP 192.168.43.147.8880 > 192.168.43.124.7773: UDP, length 120
21:00:16.359585 IP 192.168.43.147.8880 > 192.168.43.124.7773: UDP, length 120
21:00:16.399593 IP 192.168.43.147.8880 > 192.168.43.124.7773: UDP, length 120
21:00:16.451570 IP 192.168.43.147.8880 > 192.168.43.124.7773: UDP, length 120
21:00:16.504803 IP 192.168.43.147.8880 > 192.168.43.124.7773: UDP, length 120
21:00:16.549733 IP 192.168.43.147.8880 > 192.168.43.124.7773: UDP, length 120
21:00:16.596326 IP 192.168.43.147.8880 > 192.168.43.124.7773: UDP, length 120
21:00:16.660806 IP 192.168.43.147.8880 > 192.168.43.124.7773: UDP, length 120
21:00:16.699787 IP 192.168.43.147.8880 > 192.168.43.124.7773: UDP, length 120
21:00:16.763929 IP 192.168.43.147.8880 > 192.168.43.124.7773: UDP, length 120
21:00:16.801330 IP 192.168.43.147.8880 > 192.168.43.124.7773: UDP, length 120
21:00:16.855333 IP 192.168.43.147.8880 > 192.168.43.124.7773: UDP, length 120
21:00:16.879798 IP 192.168.43.124.8880 > 192.168.43.146.7771: UDP, length 120
21:00:16.902035 IP 192.168.43.147.8880 > 192.168.43.124.7773: UDP, length 120
21:00:16.929890 IP 192.168.43.124.8880 > 192.168.43.146.7771: UDP, length 120
21:00:16.962560 IP 192.168.43.147.8880 > 192.168.43.124.7773: UDP, length 120
21:00:16.979987 IP 192.168.43.124.8880 > 192.168.43.146.7771: UDP, length 120
21:00:16.998185 IP 192.168.43.147.8880 > 192.168.43.124.7773: UDP, length 120
21:00:17.029936 IP 192.168.43.124.8880 > 192.168.43.146.7771: UDP, length 120
21:00:17.051485 IP 192.168.43.147.8880 > 192.168.43.124.7773: UDP, length 120
21:00:17.079884 IP 192.168.43.124.8880 > 192.168.43.146.7771: UDP, length 120
21:00:17.113301 IP 192.168.43.147.8880 > 192.168.43.124.7773: UDP, length 120
21:00:17.129889 IP 192.168.43.124.8880 > 192.168.43.146.7771: UDP, length 120
21:00:17.150509 IP 192.168.43.147.8880 > 192.168.43.124.7773: UDP, length 120
21:00:17.179892 IP 192.168.43.124.8880 > 192.168.43.146.7771: UDP, length 120
21:00:17.202434 IP 192.168.43.147.8880 > 192.168.43.124.7773: UDP, length 120
21:00:17.229937 IP 192.168.43.124.8880 > 192.168.43.146.7771: UDP, length 120
21:00:17.264763 IP 192.168.43.147.8880 > 192.168.43.124.7773: UDP, length 120
21:00:17.279867 IP 192.168.43.124.8880 > 192.168.43.146.7771: UDP, length 120
21:00:17.304892 IP 192.168.43.147.8880 > 192.168.43.124.7773: UDP, length 120
21:00:17.329941 IP 192.168.43.124.8880 > 192.168.43.146.7771: UDP, length 120
21:00:17.355910 IP 192.168.43.147.8880 > 192.168.43.124.7773: UDP, length 120
21:00:17.379938 IP 192.168.43.124.8880 > 192.168.43.146.7771: UDP, length 120
21:00:17.400038 IP 192.168.43.147.8880 > 192.168.43.124.7773: UDP, length 120
21:00:17.429990 IP 192.168.43.124.8880 > 192.168.43.146.7771: UDP, length 120
21:00:17.449780 IP 192.168.43.147.8880 > 192.168.43.124.7773: UDP, length 120
21:00:17.479932 IP 192.168.43.124.8880 > 192.168.43.146.7771: UDP, length 120
21:00:17.511767 IP 192.168.43.147.8880 > 192.168.43.124.7773: UDP, length 120
21:00:17.529916 IP 192.168.43.124.8880 > 192.168.43.146.7771: UDP, length 120
21:00:17.550549 IP 192.168.43.147.8880 > 192.168.43.124.7773: UDP, length 120
21:00:17.579940 IP 192.168.43.124.8880 > 192.168.43.146.7771: UDP, length 120
21:00:17.599659 IP 192.168.43.147.8880 > 192.168.43.124.7773: UDP, length 120
21:00:17.629939 IP 192.168.43.124.8880 > 192.168.43.146.7771: UDP, length 120
21:00:17.655492 IP 192.168.43.147.8880 > 192.168.43.124.7773: UDP, length 120
21:00:17.679939 IP 192.168.43.124.8880 > 192.168.43.146.7771: UDP, length 120
21:00:17.714882 IP 192.168.43.147.8880 > 192.168.43.124.7773: UDP, length 120
21:00:17.729939 IP 192.168.43.124.8880 > 192.168.43.146.7771: UDP, length 120
21:00:17.760458 IP 192.168.43.147.8880 > 192.168.43.124.7773: UDP, length 120
21:00:17.779887 IP 192.168.43.124.8880 > 192.168.43.146.7771: UDP, length 120
21:00:17.813480 IP 192.168.43.147.8880 > 192.168.43.124.7773: UDP, length 120
21:00:17.829979 IP 192.168.43.124.8880 > 192.168.43.146.7771: UDP, length 120
21:00:17.871216 IP 192.168.43.147.8880 > 192.168.43.124.7773: UDP, length 120
21:00:17.879939 IP 192.168.43.124.8880 > 192.168.43.146.7771: UDP, length 120
21:00:17.897497 IP 192.168.43.147.8880 > 192.168.43.124.7773: UDP, length 120
21:00:17.929890 IP 192.168.43.124.8880 > 192.168.43.146.7771: UDP, length 120
21:00:17.952642 IP 192.168.43.147.8880 > 192.168.43.124.7773: UDP, length 120
21:00:17.979891 IP 192.168.43.124.8880 > 192.168.43.146.7771: UDP, length 120
21:00:17.998855 IP 192.168.43.147.8880 > 192.168.43.124.7773: UDP, length 120
21:00:18.029936 IP 192.168.43.124.8880 > 192.168.43.146.7771: UDP, length 120
21:00:18.049737 IP 192.168.43.147.8880 > 192.168.43.124.7773: UDP, length 120
21:00:18.079990 IP 192.168.43.124.8880 > 192.168.43.146.7771: UDP, length 120
21:00:18.099298 IP 192.168.43.147.8880 > 192.168.43.124.7773: UDP, length 120
21:00:18.129924 IP 192.168.43.124.8880 > 192.168.43.146.7771: UDP, length 120
21:00:18.149964 IP 192.168.43.147.8880 > 192.168.43.124.7773: UDP, length 120
21:00:18.179938 IP 192.168.43.124.8880 > 192.168.43.146.7771: UDP, length 120
21:00:18.200568 IP 192.168.43.147.8880 > 192.168.43.124.7773: UDP, length 120
21:00:18.229888 IP 192.168.43.124.8880 > 192.168.43.146.7771: UDP, length 120
21:00:18.251740 IP 192.168.43.147.8880 > 192.168.43.124.7773: UDP, length 120
21:00:18.279939 IP 192.168.43.124.8880 > 192.168.43.146.7771: UDP, length 120
21:00:18.302924 IP 192.168.43.147.8880 > 192.168.43.124.7773: UDP, length 120
21:00:18.329939 IP 192.168.43.124.8880 > 192.168.43.146.7771: UDP, length 120
21:00:18.354294 IP 192.168.43.147.8880 > 192.168.43.124.7773: UDP, length 120
21:00:18.379938 IP 192.168.43.124.8880 > 192.168.43.146.7771: UDP, length 120
21:00:18.405458 IP 192.168.43.147.8880 > 192.168.43.124.7773: UDP, length 120
21:00:18.429948 IP 192.168.43.124.8880 > 192.168.43.146.7771: UDP, length 120
21:00:18.456666 IP 192.168.43.147.8880 > 192.168.43.124.7773: UDP, length 120
21:00:18.479907 IP 192.168.43.124.8880 > 192.168.43.146.7771: UDP, length 120
21:00:18.508669 IP 192.168.43.147.8880 > 192.168.43.124.7773: UDP, length 120
21:00:18.529908 IP 192.168.43.124.8880 > 192.168.43.146.7771: UDP, length 120
21:00:18.559966 IP 192.168.43.147.8880 > 192.168.43.124.7773: UDP, length 120
21:00:18.579885 IP 192.168.43.124.8880 > 192.168.43.146.7771: UDP, length 120
21:00:18.610667 IP 192.168.43.147.8880 > 192.168.43.124.7773: UDP, length 120
21:00:18.629864 IP 192.168.43.124.8880 > 192.168.43.146.7771: UDP, length 120
21:00:18.646772 IP 192.168.43.147.8880 > 192.168.43.124.7773: UDP, length 120
21:00:18.679862 IP 192.168.43.124.8880 > 192.168.43.146.7771: UDP, length 120
21:00:18.699790 IP 192.168.43.147.8880 > 192.168.43.124.7773: UDP, length 120
21:00:18.729905 IP 192.168.43.124.8880 > 192.168.43.146.7771: UDP, length 120
21:00:18.749558 IP 192.168.43.147.8880 > 192.168.43.124.7773: UDP, length 120
21:00:18.779884 IP 192.168.43.124.8880 > 192.168.43.146.7771: UDP, length 120
21:00:18.801610 IP 192.168.43.147.8880 > 192.168.43.124.7773: UDP, length 120
21:00:18.829938 IP 192.168.43.124.8880 > 192.168.43.146.7771: UDP, length 120
21:00:18.862153 IP 192.168.43.147.8880 > 192.168.43.124.7773: UDP, length 120
21:00:18.879900 IP 192.168.43.124.8880 > 192.168.43.146.7771: UDP, length 120
21:00:18.896509 IP 192.168.43.147.8880 > 192.168.43.124.7773: UDP, length 120
21:00:18.929890 IP 192.168.43.124.8880 > 192.168.43.146.7771: UDP, length 120
21:00:18.950246 IP 192.168.43.147.8880 > 192.168.43.124.7773: UDP, length 120
21:00:18.979938 IP 192.168.43.124.8880 > 192.168.43.146.7771: UDP, length 120
21:00:19.006308 IP 192.168.43.147.8880 > 192.168.43.124.7773: UDP, length 120
21:00:19.029977 IP 192.168.43.124.8880 > 192.168.43.146.7771: UDP, length 120
21:00:19.057725 IP 192.168.43.147.8880 > 192.168.43.124.7773: UDP, length 120
21:00:19.079938 IP 192.168.43.124.8880 > 192.168.43.146.7771: UDP, length 120
21:00:19.113831 IP 192.168.43.147.8880 > 192.168.43.124.7773: UDP, length 120
21:00:19.129939 IP 192.168.43.124.8880 > 192.168.43.146.7771: UDP, length 120
21:00:19.148088 IP 192.168.43.147.8880 > 192.168.43.124.7773: UDP, length 120
21:00:19.179940 IP 192.168.43.124.8880 > 192.168.43.146.7771: UDP, length 120
21:00:19.197738 IP 192.168.43.147.8880 > 192.168.43.124.7773: UDP, length 120
21:00:19.229937 IP 192.168.43.124.8880 > 192.168.43.146.7771: UDP, length 120
21:00:19.252621 IP 192.168.43.147.8880 > 192.168.43.124.7773: UDP, length 120
21:00:19.279938 IP 192.168.43.124.8880 > 192.168.43.146.7771: UDP, length 120
21:00:19.309824 IP 192.168.43.147.8880 > 192.168.43.124.7773: UDP, length 120
21:00:19.329945 IP 192.168.43.124.8880 > 192.168.43.146.7771: UDP, length 120
21:00:19.346839 IP 192.168.43.147.8880 > 192.168.43.124.7773: UDP, length 120
21:00:19.379939 IP 192.168.43.124.8880 > 192.168.43.146.7771: UDP, length 120
21:00:19.399455 IP 192.168.43.147.8880 > 192.168.43.124.7773: UDP, length 120
21:00:19.429899 IP 192.168.43.124.8880 > 192.168.43.146.7771: UDP, length 120
21:00:19.454934 IP 192.168.43.147.8880 > 192.168.43.124.7773: UDP, length 120
21:00:19.479938 IP 192.168.43.124.8880 > 192.168.43.146.7771: UDP, length 120
21:00:19.507671 IP 192.168.43.147.8880 > 192.168.43.124.7773: UDP, length 120
21:00:19.529990 IP 192.168.43.124.8880 > 192.168.43.146.7771: UDP, length 120
21:00:19.564869 IP 192.168.43.147.8880 > 192.168.43.124.7773: UDP, length 120
21:00:19.580035 IP 192.168.43.124.8880 > 192.168.43.146.7771: UDP, length 120
21:00:19.600553 IP 192.168.43.147.8880 > 192.168.43.124.7773: UDP, length 120
21:00:19.630125 IP 192.168.43.124.8880 > 192.168.43.146.7771: UDP, length 120
21:00:19.679991 IP 192.168.43.124.8880 > 192.168.43.146.7771: UDP, length 120
21:00:19.680875 IP 192.168.43.147.8880 > 192.168.43.124.7773: UDP, length 120
21:00:19.702534 IP 192.168.43.147.8880 > 192.168.43.124.7773: UDP, length 120
21:00:19.729992 IP 192.168.43.124.8880 > 192.168.43.146.7771: UDP, length 120
21:00:19.750535 IP 192.168.43.147.8880 > 192.168.43.124.7773: UDP, length 120
21:00:19.779867 IP 192.168.43.124.8880 > 192.168.43.146.7771: UDP, length 120
21:00:19.806412 IP 192.168.43.147.8880 > 192.168.43.124.7773: UDP, length 120
21:00:19.829998 IP 192.168.43.124.8880 > 192.168.43.146.7771: UDP, length 120
21:00:19.865718 IP 192.168.43.147.8880 > 192.168.43.124.7773: UDP, length 120
21:00:19.880035 IP 192.168.43.124.8880 > 192.168.43.146.7771: UDP, length 120
21:00:19.917176 IP 192.168.43.147.8880 > 192.168.43.124.7773: UDP, length 120
21:00:19.929992 IP 192.168.43.124.8880 > 192.168.43.146.7771: UDP, length 120
21:00:19.947825 IP 192.168.43.147.8880 > 192.168.43.124.7773: UDP, length 120
21:00:19.980035 IP 192.168.43.124.8880 > 192.168.43.146.7771: UDP, length 120
21:00:20.004967 IP 192.168.43.147.8880 > 192.168.43.124.7773: UDP, length 120
21:00:20.030051 IP 192.168.43.124.8880 > 192.168.43.146.7771: UDP, length 120
21:00:20.050365 IP 192.168.43.147.8880 > 192.168.43.124.7773: UDP, length 120
21:00:20.079991 IP 192.168.43.124.8880 > 192.168.43.146.7771: UDP, length 120
21:00:20.107546 IP 192.168.43.147.8880 > 192.168.43.124.7773: UDP, length 120
21:00:20.129993 IP 192.168.43.124.8880 > 192.168.43.146.7771: UDP, length 120
21:00:20.164202 IP 192.168.43.147.8880 > 192.168.43.124.7773: UDP, length 120
21:00:20.180515 IP 192.168.43.124.8880 > 192.168.43.146.7771: UDP, length 120
21:00:20.197438 IP 192.168.43.147.8880 > 192.168.43.124.7773: UDP, length 120
21:00:20.229992 IP 192.168.43.124.8880 > 192.168.43.146.7771: UDP, length 120
21:00:20.250236 IP 192.168.43.147.8880 > 192.168.43.124.7773: UDP, length 120
21:00:20.280033 IP 192.168.43.124.8880 > 192.168.43.146.7771: UDP, length 120
21:00:20.301478 IP 192.168.43.147.8880 > 192.168.43.124.7773: UDP, length 120
21:00:20.329991 IP 192.168.43.124.8880 > 192.168.43.146.7771: UDP, length 120
21:00:20.359376 IP 192.168.43.147.8880 > 192.168.43.124.7773: UDP, length 120
21:00:20.380028 IP 192.168.43.124.8880 > 192.168.43.146.7771: UDP, length 120
21:00:20.416877 IP 192.168.43.147.8880 > 192.168.43.124.7773: UDP, length 120
21:00:20.429986 IP 192.168.43.124.8880 > 192.168.43.146.7771: UDP, length 120
21:00:20.446486 IP 192.168.43.147.8880 > 192.168.43.124.7773: UDP, length 120
21:00:20.479940 IP 192.168.43.124.8880 > 192.168.43.146.7771: UDP, length 120
21:00:20.500283 IP 192.168.43.147.8880 > 192.168.43.124.7773: UDP, length 120
21:00:20.529937 IP 192.168.43.124.8880 > 192.168.43.146.7771: UDP, length 120
21:00:20.557199 IP 192.168.43.147.8880 > 192.168.43.124.7773: UDP, length 120
21:00:20.579939 IP 192.168.43.124.8880 > 192.168.43.146.7771: UDP, length 120
21:00:20.608556 IP 192.168.43.147.8880 > 192.168.43.124.7773: UDP, length 120
21:00:20.629939 IP 192.168.43.124.8880 > 192.168.43.146.7771: UDP, length 120
21:00:20.667332 IP 192.168.43.147.8880 > 192.168.43.124.7773: UDP, length 120
21:00:20.679939 IP 192.168.43.124.8880 > 192.168.43.146.7771: UDP, length 120
21:00:20.696945 IP 192.168.43.147.8880 > 192.168.43.124.7773: UDP, length 120
21:00:20.729937 IP 192.168.43.124.8880 > 192.168.43.146.7771: UDP, length 120
21:00:20.749638 IP 192.168.43.147.8880 > 192.168.43.124.7773: UDP, length 120
21:00:20.779855 IP 192.168.43.124.8880 > 192.168.43.146.7771: UDP, length 120
21:00:20.802640 IP 192.168.43.147.8880 > 192.168.43.124.7773: UDP, length 120
21:00:20.829938 IP 192.168.43.124.8880 > 192.168.43.146.7771: UDP, length 120
21:00:20.858688 IP 192.168.43.147.8880 > 192.168.43.124.7773: UDP, length 120
21:00:20.879940 IP 192.168.43.124.8880 > 192.168.43.146.7771: UDP, length 120
21:00:20.914920 IP 192.168.43.147.8880 > 192.168.43.124.7773: UDP, length 120
21:00:20.929939 IP 192.168.43.124.8880 > 192.168.43.146.7771: UDP, length 120
21:00:20.951523 IP 192.168.43.147.8880 > 192.168.43.124.7773: UDP, length 120
21:00:20.979901 IP 192.168.43.124.8880 > 192.168.43.146.7771: UDP, length 120
21:00:20.998241 IP 192.168.43.147.8880 > 192.168.43.124.7773: UDP, length 120
21:00:21.029939 IP 192.168.43.124.8880 > 192.168.43.146.7771: UDP, length 120
21:00:21.053964 IP 192.168.43.147.8880 > 192.168.43.124.7773: UDP, length 120
21:00:21.079940 IP 192.168.43.124.8880 > 192.168.43.146.7771: UDP, length 120
21:00:21.106796 IP 192.168.43.147.8880 > 192.168.43.124.7773: UDP, length 120
21:00:21.129991 IP 192.168.43.124.8880 > 192.168.43.146.7771: UDP, length 120
21:00:21.163668 IP 192.168.43.147.8880 > 192.168.43.124.7773: UDP, length 120
21:00:21.179991 IP 192.168.43.124.8880 > 192.168.43.146.7771: UDP, length 120
21:00:21.197892 IP 192.168.43.147.8880 > 192.168.43.124.7773: UDP, length 120
21:00:21.230034 IP 192.168.43.124.8880 > 192.168.43.146.7771: UDP, length 120
21:00:21.248361 IP 192.168.43.147.8880 > 192.168.43.124.7773: UDP, length 120
21:00:21.280033 IP 192.168.43.124.8880 > 192.168.43.146.7771: UDP, length 120
21:00:21.301455 IP 192.168.43.147.8880 > 192.168.43.124.7773: UDP, length 120
21:00:21.329992 IP 192.168.43.124.8880 > 192.168.43.146.7771: UDP, length 120
21:00:21.361567 IP 192.168.43.147.8880 > 192.168.43.124.7773: UDP, length 120
21:00:21.379944 IP 192.168.43.124.8880 > 192.168.43.146.7771: UDP, length 120
21:00:21.418991 IP 192.168.43.147.8880 > 192.168.43.124.7773: UDP, length 120
21:00:21.429945 IP 192.168.43.124.8880 > 192.168.43.146.7771: UDP, length 120
21:00:21.446775 IP 192.168.43.147.8880 > 192.168.43.124.7773: UDP, length 120
21:00:21.479947 IP 192.168.43.124.8880 > 192.168.43.146.7771: UDP, length 120
21:00:21.503584 IP 192.168.43.147.8880 > 192.168.43.124.7773: UDP, length 120
21:00:21.529946 IP 192.168.43.124.8880 > 192.168.43.146.7771: UDP, length 120
21:00:21.551520 IP 192.168.43.147.8880 > 192.168.43.124.7773: UDP, length 120
21:00:21.579947 IP 192.168.43.124.8880 > 192.168.43.146.7771: UDP, length 120
21:00:21.608328 IP 192.168.43.147.8880 > 192.168.43.124.7773: UDP, length 120
21:00:21.629945 IP 192.168.43.124.8880 > 192.168.43.146.7771: UDP, length 120
21:00:21.668124 IP 192.168.43.147.8880 > 192.168.43.124.7773: UDP, length 120
21:00:21.679943 IP 192.168.43.124.8880 > 192.168.43.146.7771: UDP, length 120
21:00:21.698942 IP 192.168.43.147.8880 > 192.168.43.124.7773: UDP, length 120
21:00:21.729945 IP 192.168.43.124.8880 > 192.168.43.146.7771: UDP, length 120
21:00:21.750536 IP 192.168.43.147.8880 > 192.168.43.124.7773: UDP, length 120
21:00:21.779888 IP 192.168.43.124.8880 > 192.168.43.146.7771: UDP, length 120
21:00:21.803183 IP 192.168.43.147.8880 > 192.168.43.124.7773: UDP, length 120
21:00:21.829937 IP 192.168.43.124.8880 > 192.168.43.146.7771: UDP, length 120
21:00:21.859570 IP 192.168.43.147.8880 > 192.168.43.124.7773: UDP, length 120
21:00:21.879940 IP 192.168.43.124.8880 > 192.168.43.146.7771: UDP, length 120
21:00:21.898259 IP 192.168.43.147.8880 > 192.168.43.124.7773: UDP, length 120
21:00:21.929989 IP 192.168.43.124.8880 > 192.168.43.146.7771: UDP, length 120
21:00:21.950124 IP 192.168.43.147.8880 > 192.168.43.124.7773: UDP, length 120
21:00:21.979991 IP 192.168.43.124.8880 > 192.168.43.146.7771: UDP, length 120
21:00:21.999206 IP 192.168.43.147.8880 > 192.168.43.124.7773: UDP, length 120
21:00:22.029942 IP 192.168.43.124.8880 > 192.168.43.146.7771: UDP, length 120
21:00:22.059037 IP 192.168.43.147.8880 > 192.168.43.124.7773: UDP, length 120
21:00:22.079939 IP 192.168.43.124.8880 > 192.168.43.146.7771: UDP, length 120
21:00:22.104346 IP 192.168.43.147.8880 > 192.168.43.124.7773: UDP, length 120
21:00:22.129937 IP 192.168.43.124.8880 > 192.168.43.146.7771: UDP, length 120
21:00:22.162350 IP 192.168.43.147.8880 > 192.168.43.124.7773: UDP, length 120
21:00:22.179888 IP 192.168.43.124.8880 > 192.168.43.146.7771: UDP, length 120
21:00:22.229939 IP 192.168.43.124.8880 > 192.168.43.146.7771: UDP, length 120
21:00:22.237470 IP 192.168.43.147.8880 > 192.168.43.124.7773: UDP, length 120
21:00:22.257640 IP 192.168.43.147.8880 > 192.168.43.124.7773: UDP, length 120
21:00:22.279940 IP 192.168.43.124.8880 > 192.168.43.146.7771: UDP, length 120
21:00:22.300497 IP 192.168.43.147.8880 > 192.168.43.124.7773: UDP, length 120
21:00:22.329991 IP 192.168.43.124.8880 > 192.168.43.146.7771: UDP, length 120
21:00:22.353878 IP 192.168.43.147.8880 > 192.168.43.124.7773: UDP, length 120
21:00:22.379992 IP 192.168.43.124.8880 > 192.168.43.146.7771: UDP, length 120
21:00:22.412683 IP 192.168.43.147.8880 > 192.168.43.124.7773: UDP, length 120
21:00:22.430035 IP 192.168.43.124.8880 > 192.168.43.146.7771: UDP, length 120
21:00:22.477410 IP 192.168.43.147.8880 > 192.168.43.124.7773: UDP, length 120
21:00:22.479992 IP 192.168.43.124.8880 > 192.168.43.146.7771: UDP, length 120
21:00:22.500409 IP 192.168.43.147.8880 > 192.168.43.124.7773: UDP, length 120
21:00:22.529867 IP 192.168.43.124.8880 > 192.168.43.146.7771: UDP, length 120
21:00:22.551238 IP 192.168.43.147.8880 > 192.168.43.124.7773: UDP, length 120
21:00:22.579870 IP 192.168.43.124.8880 > 192.168.43.146.7771: UDP, length 120
21:00:22.602330 IP 192.168.43.147.8880 > 192.168.43.124.7773: UDP, length 120
21:00:22.629880 IP 192.168.43.124.8880 > 192.168.43.146.7771: UDP, length 120
21:00:22.648528 IP 192.168.43.147.8880 > 192.168.43.124.7773: UDP, length 120
21:00:22.679875 IP 192.168.43.124.8880 > 192.168.43.146.7771: UDP, length 120
21:00:22.708606 IP 192.168.43.147.8880 > 192.168.43.124.7773: UDP, length 120
21:00:22.729873 IP 192.168.43.124.8880 > 192.168.43.146.7771: UDP, length 120
21:00:22.751137 IP 192.168.43.147.8880 > 192.168.43.124.7773: UDP, length 120
21:00:22.779885 IP 192.168.43.124.8880 > 192.168.43.146.7771: UDP, length 120
21:00:22.800524 IP 192.168.43.147.8880 > 192.168.43.124.7773: UDP, length 120
21:00:22.829939 IP 192.168.43.124.8880 > 192.168.43.146.7771: UDP, length 120
21:00:22.872690 IP 192.168.43.147.8880 > 192.168.43.124.7773: UDP, length 120
21:00:22.879939 IP 192.168.43.124.8880 > 192.168.43.146.7771: UDP, length 120
21:00:22.899996 IP 192.168.43.147.8880 > 192.168.43.124.7773: UDP, length 120
21:00:22.929939 IP 192.168.43.124.8880 > 192.168.43.146.7771: UDP, length 120
21:00:22.950953 IP 192.168.43.147.8880 > 192.168.43.124.7773: UDP, length 120
21:00:22.979941 IP 192.168.43.124.8880 > 192.168.43.146.7771: UDP, length 120
21:00:23.028129 IP 192.168.43.147.8880 > 192.168.43.124.7773: UDP, length 120
21:00:23.029937 IP 192.168.43.124.8880 > 192.168.43.146.7771: UDP, length 120
21:00:23.047013 IP 192.168.43.147.8880 > 192.168.43.124.7773: UDP, length 120
21:00:23.079939 IP 192.168.43.124.8880 > 192.168.43.146.7771: UDP, length 120
21:00:23.108272 IP 192.168.43.147.8880 > 192.168.43.124.7773: UDP, length 120
21:00:23.129939 IP 192.168.43.124.8880 > 192.168.43.146.7771: UDP, length 120
21:00:23.147638 IP 192.168.43.147.8880 > 192.168.43.124.7773: UDP, length 120
21:00:23.179937 IP 192.168.43.124.8880 > 192.168.43.146.7771: UDP, length 120
21:00:23.204251 IP 192.168.43.147.8880 > 192.168.43.124.7773: UDP, length 120
21:00:23.229938 IP 192.168.43.124.8880 > 192.168.43.146.7771: UDP, length 120
21:00:23.274364 IP 192.168.43.147.8880 > 192.168.43.124.7773: UDP, length 120
21:00:23.279937 IP 192.168.43.124.8880 > 192.168.43.146.7771: UDP, length 120
21:00:23.297276 IP 192.168.43.147.8880 > 192.168.43.124.7773: UDP, length 120
21:00:23.329886 IP 192.168.43.124.8880 > 192.168.43.146.7771: UDP, length 120
21:00:23.353064 IP 192.168.43.147.8880 > 192.168.43.124.7773: UDP, length 120
21:00:23.379887 IP 192.168.43.124.8880 > 192.168.43.146.7771: UDP, length 120
21:00:23.396884 IP 192.168.43.147.8880 > 192.168.43.124.7773: UDP, length 120
21:00:23.429890 IP 192.168.43.124.8880 > 192.168.43.146.7771: UDP, length 120
21:00:23.449749 IP 192.168.43.147.8880 > 192.168.43.124.7773: UDP, length 120
21:00:23.479901 IP 192.168.43.124.8880 > 192.168.43.146.7771: UDP, length 120
21:00:23.524035 IP 192.168.43.147.8880 > 192.168.43.124.7773: UDP, length 120
21:00:23.529937 IP 192.168.43.124.8880 > 192.168.43.146.7771: UDP, length 120
21:00:23.552531 IP 192.168.43.147.8880 > 192.168.43.124.7773: UDP, length 120
21:00:23.579878 IP 192.168.43.124.8880 > 192.168.43.146.7771: UDP, length 120
21:00:23.602481 IP 192.168.43.147.8880 > 192.168.43.124.7773: UDP, length 120
21:00:23.629887 IP 192.168.43.124.8880 > 192.168.43.146.7771: UDP, length 120
21:00:23.646861 IP 192.168.43.147.8880 > 192.168.43.124.7773: UDP, length 120
21:00:23.679869 IP 192.168.43.124.8880 > 192.168.43.146.7771: UDP, length 120
21:00:23.700039 IP 192.168.43.147.8880 > 192.168.43.124.7773: UDP, length 120
21:00:23.729870 IP 192.168.43.124.8880 > 192.168.43.146.7771: UDP, length 120
21:00:23.774120 IP 192.168.43.147.8880 > 192.168.43.124.7773: UDP, length 120
21:00:23.779867 IP 192.168.43.124.8880 > 192.168.43.146.7771: UDP, length 120
21:00:23.799013 IP 192.168.43.147.8880 > 192.168.43.124.7773: UDP, length 120
21:00:23.829887 IP 192.168.43.124.8880 > 192.168.43.146.7771: UDP, length 120
21:00:23.853038 IP 192.168.43.147.8880 > 192.168.43.124.7773: UDP, length 120
21:00:23.879879 IP 192.168.43.124.8880 > 192.168.43.146.7771: UDP, length 120
21:00:23.929980 IP 192.168.43.124.8880 > 192.168.43.146.7771: UDP, length 120
21:00:23.943781 IP 192.168.43.147.8880 > 192.168.43.124.7773: UDP, length 120
21:00:23.949742 IP 192.168.43.147.8880 > 192.168.43.124.7773: UDP, length 120
21:00:23.979895 IP 192.168.43.124.8880 > 192.168.43.146.7771: UDP, length 120
21:00:24.024756 IP 192.168.43.147.8880 > 192.168.43.124.7773: UDP, length 120
21:00:24.029939 IP 192.168.43.124.8880 > 192.168.43.146.7771: UDP, length 120
21:00:24.049944 IP 192.168.43.147.8880 > 192.168.43.124.7773: UDP, length 120
21:00:24.079903 IP 192.168.43.124.8880 > 192.168.43.146.7771: UDP, length 120
21:00:24.104736 IP 192.168.43.147.8880 > 192.168.43.124.7773: UDP, length 120
21:00:24.129901 IP 192.168.43.124.8880 > 192.168.43.146.7771: UDP, length 120
21:00:24.148884 IP 192.168.43.147.8880 > 192.168.43.124.7773: UDP, length 120
21:00:24.179938 IP 192.168.43.124.8880 > 192.168.43.146.7771: UDP, length 120
21:00:24.203100 IP 192.168.43.147.8880 > 192.168.43.124.7773: UDP, length 120
21:00:24.229937 IP 192.168.43.124.8880 > 192.168.43.146.7771: UDP, length 120
21:00:24.264938 IP 192.168.43.147.8880 > 192.168.43.124.7773: UDP, length 120
21:00:24.279932 IP 192.168.43.124.8880 > 192.168.43.146.7771: UDP, length 120
21:00:24.297447 IP 192.168.43.147.8880 > 192.168.43.124.7773: UDP, length 120
21:00:24.329875 IP 192.168.43.124.8880 > 192.168.43.146.7771: UDP, length 120
21:00:24.348286 IP 192.168.43.147.8880 > 192.168.43.124.7773: UDP, length 120
21:00:24.379863 IP 192.168.43.124.8880 > 192.168.43.146.7771: UDP, length 120
21:00:24.417195 IP 192.168.43.147.8880 > 192.168.43.124.7773: UDP, length 120
21:00:24.429875 IP 192.168.43.124.8880 > 192.168.43.146.7771: UDP, length 120
21:00:24.446993 IP 192.168.43.147.8880 > 192.168.43.124.7773: UDP, length 120
21:00:24.479873 IP 192.168.43.124.8880 > 192.168.43.146.7771: UDP, length 120
21:00:24.500540 IP 192.168.43.147.8880 > 192.168.43.124.7773: UDP, length 120
21:00:24.529869 IP 192.168.43.124.8880 > 192.168.43.146.7771: UDP, length 120
21:00:24.575751 IP 192.168.43.147.8880 > 192.168.43.124.7773: UDP, length 120
21:00:24.579856 IP 192.168.43.124.8880 > 192.168.43.146.7771: UDP, length 120
21:00:24.596688 IP 192.168.43.147.8880 > 192.168.43.124.7773: UDP, length 120
21:00:24.629940 IP 192.168.43.124.8880 > 192.168.43.146.7771: UDP, length 120
21:00:24.653243 IP 192.168.43.147.8880 > 192.168.43.124.7773: UDP, length 120
21:00:24.679940 IP 192.168.43.124.8880 > 192.168.43.146.7771: UDP, length 120
21:00:24.698694 IP 192.168.43.147.8880 > 192.168.43.124.7773: UDP, length 120
21:00:24.729883 IP 192.168.43.124.8880 > 192.168.43.146.7771: UDP, length 120
21:00:24.747146 IP 192.168.43.147.8880 > 192.168.43.124.7773: UDP, length 120
21:00:24.779938 IP 192.168.43.124.8880 > 192.168.43.146.7771: UDP, length 120
21:00:24.812549 IP 192.168.43.147.8880 > 192.168.43.124.7773: UDP, length 120
21:00:24.829939 IP 192.168.43.124.8880 > 192.168.43.146.7771: UDP, length 120
21:00:24.868495 IP 192.168.43.147.8880 > 192.168.43.124.7773: UDP, length 120
21:00:24.879938 IP 192.168.43.124.8880 > 192.168.43.146.7771: UDP, length 120
21:00:24.896994 IP 192.168.43.147.8880 > 192.168.43.124.7773: UDP, length 120
21:00:24.929940 IP 192.168.43.124.8880 > 192.168.43.146.7771: UDP, length 120
21:00:24.946383 IP 192.168.43.147.8880 > 192.168.43.124.7773: UDP, length 120
21:00:24.979864 IP 192.168.43.124.8880 > 192.168.43.146.7771: UDP, length 120
21:00:25.017542 IP 192.168.43.147.8880 > 192.168.43.124.7773: UDP, length 120
21:00:25.029867 IP 192.168.43.124.8880 > 192.168.43.146.7771: UDP, length 120
21:00:25.049931 IP 192.168.43.147.8880 > 192.168.43.124.7773: UDP, length 120
21:00:25.079859 IP 192.168.43.124.8880 > 192.168.43.146.7771: UDP, length 120
21:00:25.102602 IP 192.168.43.147.8880 > 192.168.43.124.7773: UDP, length 120
21:00:25.129874 IP 192.168.43.124.8880 > 192.168.43.146.7771: UDP, length 120
21:00:25.150653 IP 192.168.43.147.8880 > 192.168.43.124.7773: UDP, length 120
21:00:25.179869 IP 192.168.43.124.8880 > 192.168.43.146.7771: UDP, length 120
21:00:25.199766 IP 192.168.43.147.8880 > 192.168.43.124.7773: UDP, length 120
21:00:25.229864 IP 192.168.43.124.8880 > 192.168.43.146.7771: UDP, length 120
21:00:25.274970 IP 192.168.43.147.8880 > 192.168.43.124.7773: UDP, length 120
21:00:25.279888 IP 192.168.43.124.8880 > 192.168.43.146.7771: UDP, length 120
21:00:25.299592 IP 192.168.43.147.8880 > 192.168.43.124.7773: UDP, length 120
21:00:25.329901 IP 192.168.43.124.8880 > 192.168.43.146.7771: UDP, length 120
21:00:25.355877 IP 192.168.43.147.8880 > 192.168.43.124.7773: UDP, length 120
21:00:25.379884 IP 192.168.43.124.8880 > 192.168.43.146.7771: UDP, length 120
21:00:25.396746 IP 192.168.43.147.8880 > 192.168.43.124.7773: UDP, length 120
21:00:25.429938 IP 192.168.43.124.8880 > 192.168.43.146.7771: UDP, length 120
21:00:25.449084 IP 192.168.43.147.8880 > 192.168.43.124.7773: UDP, length 120
21:00:25.479863 IP 192.168.43.124.8880 > 192.168.43.146.7771: UDP, length 120
21:00:25.523905 IP 192.168.43.147.8880 > 192.168.43.124.7773: UDP, length 120
21:00:25.529874 IP 192.168.43.124.8880 > 192.168.43.146.7771: UDP, length 120
21:00:25.549833 IP 192.168.43.147.8880 > 192.168.43.124.7773: UDP, length 120
21:00:25.579881 IP 192.168.43.124.8880 > 192.168.43.146.7771: UDP, length 120
21:00:25.601437 IP 192.168.43.147.8880 > 192.168.43.124.7773: UDP, length 120
21:00:25.629939 IP 192.168.43.124.8880 > 192.168.43.146.7771: UDP, length 120
21:00:25.647414 IP 192.168.43.147.8880 > 192.168.43.124.7773: UDP, length 120
21:00:25.679938 IP 192.168.43.124.8880 > 192.168.43.146.7771: UDP, length 120
21:00:25.700115 IP 192.168.43.147.8880 > 192.168.43.124.7773: UDP, length 120
21:00:25.729937 IP 192.168.43.124.8880 > 192.168.43.146.7771: UDP, length 120
21:00:25.773857 IP 192.168.43.147.8880 > 192.168.43.124.7773: UDP, length 120
21:00:25.779937 IP 192.168.43.124.8880 > 192.168.43.146.7771: UDP, length 120
21:00:25.796921 IP 192.168.43.147.8880 > 192.168.43.124.7773: UDP, length 120
21:00:25.829938 IP 192.168.43.124.8880 > 192.168.43.146.7771: UDP, length 120
21:00:25.855668 IP 192.168.43.147.8880 > 192.168.43.124.7773: UDP, length 120
21:00:25.879988 IP 192.168.43.124.8880 > 192.168.43.146.7771: UDP, length 120
21:00:25.898158 IP 192.168.43.147.8880 > 192.168.43.124.7773: UDP, length 120
21:00:25.929989 IP 192.168.43.124.8880 > 192.168.43.146.7771: UDP, length 120
21:00:25.950791 IP 192.168.43.147.8880 > 192.168.43.124.7773: UDP, length 120
21:00:25.979990 IP 192.168.43.124.8880 > 192.168.43.146.7771: UDP, length 120
21:00:26.022149 IP 192.168.43.147.8880 > 192.168.43.124.7773: UDP, length 120
21:00:26.029987 IP 192.168.43.124.8880 > 192.168.43.146.7771: UDP, length 120
21:00:26.063787 IP 192.168.43.147.8880 > 192.168.43.124.7773: UDP, length 120
21:00:26.079990 IP 192.168.43.124.8880 > 192.168.43.146.7771: UDP, length 120
21:00:26.102076 IP 192.168.43.147.8880 > 192.168.43.124.7773: UDP, length 120
21:00:26.129990 IP 192.168.43.124.8880 > 192.168.43.146.7771: UDP, length 120
21:00:26.179990 IP 192.168.43.124.8880 > 192.168.43.146.7771: UDP, length 120
21:00:26.183713 IP 192.168.43.147.8880 > 192.168.43.124.7773: UDP, length 120
21:00:26.200811 IP 192.168.43.147.8880 > 192.168.43.124.7773: UDP, length 120
21:00:26.229988 IP 192.168.43.124.8880 > 192.168.43.146.7771: UDP, length 120
21:00:26.260574 IP 192.168.43.147.8880 > 192.168.43.124.7773: UDP, length 120
21:00:26.279990 IP 192.168.43.124.8880 > 192.168.43.146.7771: UDP, length 120
21:00:26.302960 IP 192.168.43.147.8880 > 192.168.43.124.7773: UDP, length 120
21:00:26.329989 IP 192.168.43.124.8880 > 192.168.43.146.7771: UDP, length 120
21:00:26.353991 IP 192.168.43.147.8880 > 192.168.43.124.7773: UDP, length 120
21:00:26.379986 IP 192.168.43.124.8880 > 192.168.43.146.7771: UDP, length 120
21:00:26.420086 IP 192.168.43.147.8880 > 192.168.43.124.7773: UDP, length 120
21:00:26.429988 IP 192.168.43.124.8880 > 192.168.43.146.7771: UDP, length 120
21:00:26.455831 IP 192.168.43.147.8880 > 192.168.43.124.7773: UDP, length 120
21:00:26.479990 IP 192.168.43.124.8880 > 192.168.43.146.7771: UDP, length 120
21:00:26.501223 IP 192.168.43.147.8880 > 192.168.43.124.7773: UDP, length 120
21:00:26.529987 IP 192.168.43.124.8880 > 192.168.43.146.7771: UDP, length 120
21:00:26.550448 IP 192.168.43.147.8880 > 192.168.43.124.7773: UDP, length 120
21:00:26.579989 IP 192.168.43.124.8880 > 192.168.43.146.7771: UDP, length 120
21:00:26.600719 IP 192.168.43.147.8880 > 192.168.43.124.7773: UDP, length 120
21:00:26.629877 IP 192.168.43.124.8880 > 192.168.43.146.7771: UDP, length 120
21:00:26.675054 IP 192.168.43.147.8880 > 192.168.43.124.7773: UDP, length 120
21:00:26.679963 IP 192.168.43.124.8880 > 192.168.43.146.7771: UDP, length 120
21:00:26.698794 IP 192.168.43.147.8880 > 192.168.43.124.7773: UDP, length 120
21:00:26.729862 IP 192.168.43.124.8880 > 192.168.43.146.7771: UDP, length 120
21:00:26.754204 IP 192.168.43.147.8880 > 192.168.43.124.7773: UDP, length 120
21:00:26.779863 IP 192.168.43.124.8880 > 192.168.43.146.7771: UDP, length 120
21:00:26.801826 IP 192.168.43.147.8880 > 192.168.43.124.7773: UDP, length 120
21:00:26.829870 IP 192.168.43.124.8880 > 192.168.43.146.7771: UDP, length 120
21:00:26.846897 IP 192.168.43.147.8880 > 192.168.43.124.7773: UDP, length 120
21:00:26.879865 IP 192.168.43.124.8880 > 192.168.43.146.7771: UDP, length 120
21:00:26.911161 IP 192.168.43.147.8880 > 192.168.43.124.7773: UDP, length 120
21:00:26.929877 IP 192.168.43.124.8880 > 192.168.43.146.7771: UDP, length 120
21:00:26.950530 IP 192.168.43.147.8880 > 192.168.43.124.7773: UDP, length 120
21:00:26.979904 IP 192.168.43.124.8880 > 192.168.43.146.7771: UDP, length 120
21:00:26.999634 IP 192.168.43.147.8880 > 192.168.43.124.7773: UDP, length 120
21:00:27.029867 IP 192.168.43.124.8880 > 192.168.43.146.7771: UDP, length 120
21:00:27.072495 IP 192.168.43.147.8880 > 192.168.43.124.7773: UDP, length 120
21:00:27.080849 IP 192.168.43.124.8880 > 192.168.43.146.7771: UDP, length 120
21:00:27.102726 IP 192.168.43.147.8880 > 192.168.43.124.7773: UDP, length 120
21:00:27.129882 IP 192.168.43.124.8880 > 192.168.43.146.7771: UDP, length 120
21:00:27.150052 IP 192.168.43.147.8880 > 192.168.43.124.7773: UDP, length 120
21:00:27.179884 IP 192.168.43.124.8880 > 192.168.43.146.7771: UDP, length 120
21:00:27.210665 IP 192.168.43.147.8880 > 192.168.43.124.7773: UDP, length 120
21:00:27.229859 IP 192.168.43.124.8880 > 192.168.43.146.7771: UDP, length 120
21:00:27.248952 IP 192.168.43.147.8880 > 192.168.43.124.7773: UDP, length 120
21:00:27.279866 IP 192.168.43.124.8880 > 192.168.43.146.7771: UDP, length 120
21:00:27.301271 IP 192.168.43.147.8880 > 192.168.43.124.7773: UDP, length 120
21:00:27.329939 IP 192.168.43.124.8880 > 192.168.43.146.7771: UDP, length 120
21:00:27.367693 IP 192.168.43.147.8880 > 192.168.43.124.7773: UDP, length 120
21:00:27.379939 IP 192.168.43.124.8880 > 192.168.43.146.7771: UDP, length 120
21:00:27.406178 IP 192.168.43.147.8880 > 192.168.43.124.7773: UDP, length 120
21:00:27.429986 IP 192.168.43.124.8880 > 192.168.43.146.7771: UDP, length 120
21:00:27.449771 IP 192.168.43.147.8880 > 192.168.43.124.7773: UDP, length 120
21:00:27.479886 IP 192.168.43.124.8880 > 192.168.43.146.7771: UDP, length 120
21:00:27.519061 IP 192.168.43.147.8880 > 192.168.43.124.7773: UDP, length 120
21:00:27.529939 IP 192.168.43.124.8880 > 192.168.43.146.7771: UDP, length 120
21:00:27.547834 IP 192.168.43.147.8880 > 192.168.43.124.7773: UDP, length 120
21:00:27.579938 IP 192.168.43.124.8880 > 192.168.43.146.7771: UDP, length 120
21:00:27.599279 IP 192.168.43.147.8880 > 192.168.43.124.7773: UDP, length 120
21:00:27.629937 IP 192.168.43.124.8880 > 192.168.43.146.7771: UDP, length 120
21:00:27.672778 IP 192.168.43.147.8880 > 192.168.43.124.7773: UDP, length 120
21:00:27.679881 IP 192.168.43.124.8880 > 192.168.43.146.7771: UDP, length 120
21:00:27.696852 IP 192.168.43.147.8880 > 192.168.43.124.7773: UDP, length 120
21:00:27.729944 IP 192.168.43.124.8880 > 192.168.43.146.7771: UDP, length 120
21:00:27.757117 IP 192.168.43.147.8880 > 192.168.43.124.7773: UDP, length 120
21:00:27.779937 IP 192.168.43.124.8880 > 192.168.43.146.7771: UDP, length 120
21:00:27.824746 IP 192.168.43.147.8880 > 192.168.43.124.7773: UDP, length 120
21:00:27.829938 IP 192.168.43.124.8880 > 192.168.43.146.7771: UDP, length 120
21:00:27.852724 IP 192.168.43.147.8880 > 192.168.43.124.7773: UDP, length 120
21:00:27.879938 IP 192.168.43.124.8880 > 192.168.43.146.7771: UDP, length 120
21:00:27.904542 IP 192.168.43.147.8880 > 192.168.43.124.7773: UDP, length 120
21:00:27.929938 IP 192.168.43.124.8880 > 192.168.43.146.7771: UDP, length 120
21:00:27.974852 IP 192.168.43.147.8880 > 192.168.43.124.7773: UDP, length 120
21:00:27.979936 IP 192.168.43.124.8880 > 192.168.43.146.7771: UDP, length 120
21:00:28.000076 IP 192.168.43.147.8880 > 192.168.43.124.7773: UDP, length 120
21:00:28.029941 IP 192.168.43.124.8880 > 192.168.43.146.7771: UDP, length 120
21:00:28.056734 IP 192.168.43.147.8880 > 192.168.43.124.7773: UDP, length 120
21:00:28.079937 IP 192.168.43.124.8880 > 192.168.43.146.7771: UDP, length 120
21:00:28.119556 IP 192.168.43.147.8880 > 192.168.43.124.7773: UDP, length 120
21:00:28.129865 IP 192.168.43.124.8880 > 192.168.43.146.7771: UDP, length 120
21:00:28.150052 IP 192.168.43.147.8880 > 192.168.43.124.7773: UDP, length 120
21:00:28.179873 IP 192.168.43.124.8880 > 192.168.43.146.7771: UDP, length 120
21:00:28.201529 IP 192.168.43.147.8880 > 192.168.43.124.7773: UDP, length 120
21:00:28.229862 IP 192.168.43.124.8880 > 192.168.43.146.7771: UDP, length 120
21:00:28.272130 IP 192.168.43.147.8880 > 192.168.43.124.7773: UDP, length 120
21:00:28.279939 IP 192.168.43.124.8880 > 192.168.43.146.7771: UDP, length 120
21:00:28.299237 IP 192.168.43.147.8880 > 192.168.43.124.7773: UDP, length 120
21:00:28.329936 IP 192.168.43.124.8880 > 192.168.43.146.7771: UDP, length 120
21:00:28.349818 IP 192.168.43.147.8880 > 192.168.43.124.7773: UDP, length 120
21:00:28.379937 IP 192.168.43.124.8880 > 192.168.43.146.7771: UDP, length 120
21:00:28.401970 IP 192.168.43.147.8880 > 192.168.43.124.7773: UDP, length 120
21:00:28.429937 IP 192.168.43.124.8880 > 192.168.43.146.7771: UDP, length 120
21:00:28.454907 IP 192.168.43.147.8880 > 192.168.43.124.7773: UDP, length 120
21:00:28.479988 IP 192.168.43.124.8880 > 192.168.43.146.7771: UDP, length 120
21:00:28.523539 IP 192.168.43.147.8880 > 192.168.43.124.7773: UDP, length 120
21:00:28.529988 IP 192.168.43.124.8880 > 192.168.43.146.7771: UDP, length 120
21:00:28.547135 IP 192.168.43.147.8880 > 192.168.43.124.7773: UDP, length 120
21:00:28.579990 IP 192.168.43.124.8880 > 192.168.43.146.7771: UDP, length 120
21:00:28.624975 IP 192.168.43.147.8880 > 192.168.43.124.7773: UDP, length 120
21:00:28.629989 IP 192.168.43.124.8880 > 192.168.43.146.7771: UDP, length 120
21:00:28.673037 IP 192.168.43.147.8880 > 192.168.43.124.7773: UDP, length 120
21:00:28.679991 IP 192.168.43.124.8880 > 192.168.43.146.7771: UDP, length 120
21:00:28.700680 IP 192.168.43.147.8880 > 192.168.43.124.7773: UDP, length 120
21:00:28.729997 IP 192.168.43.124.8880 > 192.168.43.146.7771: UDP, length 120
21:00:28.750618 IP 192.168.43.147.8880 > 192.168.43.124.7773: UDP, length 120
21:00:28.779941 IP 192.168.43.124.8880 > 192.168.43.146.7771: UDP, length 120
21:00:28.822241 IP 192.168.43.147.8880 > 192.168.43.124.7773: UDP, length 120
21:00:28.829937 IP 192.168.43.124.8880 > 192.168.43.146.7771: UDP, length 120
21:00:28.850615 IP 192.168.43.147.8880 > 192.168.43.124.7773: UDP, length 120
21:00:28.879865 IP 192.168.43.124.8880 > 192.168.43.146.7771: UDP, length 120
