23:03:53.100375 IP 192.168.43.124.8880 > 192.168.43.195.7771: UDP, length 120
23:03:53.150521 IP 192.168.43.124.8880 > 192.168.43.195.7771: UDP, length 120
23:03:53.200524 IP 192.168.43.124.8880 > 192.168.43.195.7771: UDP, length 120
23:03:53.250574 IP 192.168.43.124.8880 > 192.168.43.195.7771: UDP, length 120
23:03:53.300532 IP 192.168.43.124.8880 > 192.168.43.195.7771: UDP, length 120
23:03:53.350528 IP 192.168.43.124.8880 > 192.168.43.195.7771: UDP, length 120
23:03:53.400528 IP 192.168.43.124.8880 > 192.168.43.195.7771: UDP, length 120
23:03:53.450528 IP 192.168.43.124.8880 > 192.168.43.195.7771: UDP, length 120
23:03:53.500531 IP 192.168.43.124.8880 > 192.168.43.195.7771: UDP, length 120
23:03:53.550528 IP 192.168.43.124.8880 > 192.168.43.195.7771: UDP, length 120
23:03:53.600528 IP 192.168.43.124.8880 > 192.168.43.195.7771: UDP, length 120
23:03:53.650522 IP 192.168.43.124.8880 > 192.168.43.195.7771: UDP, length 120
23:03:53.700525 IP 192.168.43.124.8880 > 192.168.43.195.7771: UDP, length 120
23:03:53.750525 IP 192.168.43.124.8880 > 192.168.43.195.7771: UDP, length 120
23:03:53.800526 IP 192.168.43.124.8880 > 192.168.43.195.7771: UDP, length 120
23:03:53.850523 IP 192.168.43.124.8880 > 192.168.43.195.7771: UDP, length 120
23:03:53.900576 IP 192.168.43.124.8880 > 192.168.43.195.7771: UDP, length 120
23:03:53.950576 IP 192.168.43.124.8880 > 192.168.43.195.7771: UDP, length 120
23:03:54.000572 IP 192.168.43.124.8880 > 192.168.43.195.7771: UDP, length 120
23:03:54.050574 IP 192.168.43.124.8880 > 192.168.43.195.7771: UDP, length 120
23:03:54.100574 IP 192.168.43.124.8880 > 192.168.43.195.7771: UDP, length 120
23:03:54.150575 IP 192.168.43.124.8880 > 192.168.43.195.7771: UDP, length 120
23:03:54.200573 IP 192.168.43.124.8880 > 192.168.43.195.7771: UDP, length 120
23:03:54.250528 IP 192.168.43.124.8880 > 192.168.43.195.7771: UDP, length 120
23:03:54.300904 IP 192.168.43.124.8880 > 192.168.43.195.7771: UDP, length 120
23:03:54.350524 IP 192.168.43.124.8880 > 192.168.43.195.7771: UDP, length 120
23:03:54.400526 IP 192.168.43.124.8880 > 192.168.43.195.7771: UDP, length 120
23:03:54.450523 IP 192.168.43.124.8880 > 192.168.43.195.7771: UDP, length 120
23:03:54.500524 IP 192.168.43.124.8880 > 192.168.43.195.7771: UDP, length 120
23:03:54.550525 IP 192.168.43.124.8880 > 192.168.43.195.7771: UDP, length 120
23:03:54.600526 IP 192.168.43.124.8880 > 192.168.43.195.7771: UDP, length 120
23:03:54.650572 IP 192.168.43.124.8880 > 192.168.43.195.7771: UDP, length 120
23:03:54.700487 IP 192.168.43.124.8880 > 192.168.43.195.7771: UDP, length 120
23:03:54.750524 IP 192.168.43.124.8880 > 192.168.43.195.7771: UDP, length 120
23:03:54.800524 IP 192.168.43.124.8880 > 192.168.43.195.7771: UDP, length 120
23:03:54.850523 IP 192.168.43.124.8880 > 192.168.43.195.7771: UDP, length 120
23:03:54.900523 IP 192.168.43.124.8880 > 192.168.43.195.7771: UDP, length 120
23:03:54.950524 IP 192.168.43.124.8880 > 192.168.43.195.7771: UDP, length 120
23:03:55.000526 IP 192.168.43.124.8880 > 192.168.43.195.7771: UDP, length 120
23:03:55.050525 IP 192.168.43.124.8880 > 192.168.43.195.7771: UDP, length 120
23:03:55.100523 IP 192.168.43.124.8880 > 192.168.43.195.7771: UDP, length 120
23:03:55.150523 IP 192.168.43.124.8880 > 192.168.43.195.7771: UDP, length 120
23:03:55.200573 IP 192.168.43.124.8880 > 192.168.43.195.7771: UDP, length 120
23:03:55.250574 IP 192.168.43.124.8880 > 192.168.43.195.7771: UDP, length 120
23:03:55.300576 IP 192.168.43.124.8880 > 192.168.43.195.7771: UDP, length 120
23:03:55.350573 IP 192.168.43.124.8880 > 192.168.43.195.7771: UDP, length 120
23:03:55.400573 IP 192.168.43.124.8880 > 192.168.43.195.7771: UDP, length 120
23:03:55.450576 IP 192.168.43.124.8880 > 192.168.43.195.7771: UDP, length 120
23:03:55.500573 IP 192.168.43.124.8880 > 192.168.43.195.7771: UDP, length 120
23:03:55.550574 IP 192.168.43.124.8880 > 192.168.43.195.7771: UDP, length 120
23:03:55.600574 IP 192.168.43.124.8880 > 192.168.43.195.7771: UDP, length 120
23:03:55.650570 IP 192.168.43.124.8880 > 192.168.43.195.7771: UDP, length 120
23:03:55.700528 IP 192.168.43.124.8880 > 192.168.43.195.7771: UDP, length 120
23:03:55.750526 IP 192.168.43.124.8880 > 192.168.43.195.7771: UDP, length 120
23:03:55.800529 IP 192.168.43.124.8880 > 192.168.43.195.7771: UDP, length 120
23:03:55.850527 IP 192.168.43.124.8880 > 192.168.43.195.7771: UDP, length 120
23:03:55.900528 IP 192.168.43.124.8880 > 192.168.43.195.7771: UDP, length 120
23:03:55.950528 IP 192.168.43.124.8880 > 192.168.43.195.7771: UDP, length 120
23:03:56.000528 IP 192.168.43.124.8880 > 192.168.43.195.7771: UDP, length 120
23:03:56.050527 IP 192.168.43.124.8880 > 192.168.43.195.7771: UDP, length 120
23:03:56.100529 IP 192.168.43.124.8880 > 192.168.43.195.7771: UDP, length 120
23:03:56.150527 IP 192.168.43.124.8880 > 192.168.43.195.7771: UDP, length 120
23:03:56.200573 IP 192.168.43.124.8880 > 192.168.43.195.7771: UDP, length 120
23:03:56.250447 IP 192.168.43.124.8880 > 192.168.43.195.7771: UDP, length 120
23:03:56.300444 IP 192.168.43.124.8880 > 192.168.43.195.7771: UDP, length 120
23:03:56.350523 IP 192.168.43.124.8880 > 192.168.43.195.7771: UDP, length 120
23:03:56.400524 IP 192.168.43.124.8880 > 192.168.43.195.7771: UDP, length 120
23:03:56.450526 IP 192.168.43.124.8880 > 192.168.43.195.7771: UDP, length 120
23:03:56.500526 IP 192.168.43.124.8880 > 192.168.43.195.7771: UDP, length 120
23:03:56.550524 IP 192.168.43.124.8880 > 192.168.43.195.7771: UDP, length 120
23:03:56.600527 IP 192.168.43.124.8880 > 192.168.43.195.7771: UDP, length 120
23:03:56.650481 IP 192.168.43.124.8880 > 192.168.43.195.7771: UDP, length 120
23:03:56.700524 IP 192.168.43.124.8880 > 192.168.43.195.7771: UDP, length 120
23:03:56.750524 IP 192.168.43.124.8880 > 192.168.43.195.7771: UDP, length 120
23:03:56.800525 IP 192.168.43.124.8880 > 192.168.43.195.7771: UDP, length 120
23:03:56.850524 IP 192.168.43.124.8880 > 192.168.43.195.7771: UDP, length 120
23:03:56.900524 IP 192.168.43.124.8880 > 192.168.43.195.7771: UDP, length 120
23:03:56.950525 IP 192.168.43.124.8880 > 192.168.43.195.7771: UDP, length 120
23:03:57.000525 IP 192.168.43.124.8880 > 192.168.43.195.7771: UDP, length 120
23:03:57.050524 IP 192.168.43.124.8880 > 192.168.43.195.7771: UDP, length 120
23:03:57.100526 IP 192.168.43.124.8880 > 192.168.43.195.7771: UDP, length 120
23:03:57.150523 IP 192.168.43.124.8880 > 192.168.43.195.7771: UDP, length 120
23:03:57.200488 IP 192.168.43.124.8880 > 192.168.43.195.7771: UDP, length 120
23:03:57.250524 IP 192.168.43.124.8880 > 192.168.43.195.7771: UDP, length 120
23:03:57.300526 IP 192.168.43.124.8880 > 192.168.43.195.7771: UDP, length 120
23:03:57.350526 IP 192.168.43.124.8880 > 192.168.43.195.7771: UDP, length 120
23:03:57.400525 IP 192.168.43.124.8880 > 192.168.43.195.7771: UDP, length 120
23:03:57.450523 IP 192.168.43.124.8880 > 192.168.43.195.7771: UDP, length 120
23:03:57.500524 IP 192.168.43.124.8880 > 192.168.43.195.7771: UDP, length 120
23:03:57.550522 IP 192.168.43.124.8880 > 192.168.43.195.7771: UDP, length 120
23:03:57.600526 IP 192.168.43.124.8880 > 192.168.43.195.7771: UDP, length 120
23:03:57.650522 IP 192.168.43.124.8880 > 192.168.43.195.7771: UDP, length 120
23:03:57.700524 IP 192.168.43.124.8880 > 192.168.43.195.7771: UDP, length 120
23:03:57.750523 IP 192.168.43.124.8880 > 192.168.43.195.7771: UDP, length 120
23:03:57.800524 IP 192.168.43.124.8880 > 192.168.43.195.7771: UDP, length 120
23:03:57.850523 IP 192.168.43.124.8880 > 192.168.43.195.7771: UDP, length 120
23:03:57.900527 IP 192.168.43.124.8880 > 192.168.43.195.7771: UDP, length 120
23:03:57.950524 IP 192.168.43.124.8880 > 192.168.43.195.7771: UDP, length 120
23:03:58.000575 IP 192.168.43.124.8880 > 192.168.43.195.7771: UDP, length 120
23:03:58.050577 IP 192.168.43.124.8880 > 192.168.43.195.7771: UDP, length 120
23:03:58.100527 IP 192.168.43.124.8880 > 192.168.43.195.7771: UDP, length 120
23:03:58.150527 IP 192.168.43.124.8880 > 192.168.43.195.7771: UDP, length 120
23:03:58.200575 IP 192.168.43.124.8880 > 192.168.43.195.7771: UDP, length 120
23:03:58.250575 IP 192.168.43.124.8880 > 192.168.43.195.7771: UDP, length 120
23:03:58.300575 IP 192.168.43.124.8880 > 192.168.43.195.7771: UDP, length 120
23:03:58.350574 IP 192.168.43.124.8880 > 192.168.43.195.7771: UDP, length 120
23:03:58.400576 IP 192.168.43.124.8880 > 192.168.43.195.7771: UDP, length 120
23:03:58.450575 IP 192.168.43.124.8880 > 192.168.43.195.7771: UDP, length 120
23:03:58.500570 IP 192.168.43.124.8880 > 192.168.43.195.7771: UDP, length 120
23:03:58.550573 IP 192.168.43.124.8880 > 192.168.43.195.7771: UDP, length 120
23:03:58.600576 IP 192.168.43.124.8880 > 192.168.43.195.7771: UDP, length 120
23:03:58.650502 IP 192.168.43.124.8880 > 192.168.43.195.7771: UDP, length 120
23:03:58.700528 IP 192.168.43.124.8880 > 192.168.43.195.7771: UDP, length 120
23:03:58.750527 IP 192.168.43.124.8880 > 192.168.43.195.7771: UDP, length 120
23:03:58.800530 IP 192.168.43.124.8880 > 192.168.43.195.7771: UDP, length 120
23:03:58.850527 IP 192.168.43.124.8880 > 192.168.43.195.7771: UDP, length 120
23:03:58.900526 IP 192.168.43.124.8880 > 192.168.43.195.7771: UDP, length 120
23:03:58.950525 IP 192.168.43.124.8880 > 192.168.43.195.7771: UDP, length 120
23:03:59.000470 IP 192.168.43.124.8880 > 192.168.43.195.7771: UDP, length 120
23:03:59.050528 IP 192.168.43.124.8880 > 192.168.43.195.7771: UDP, length 120
23:03:59.100528 IP 192.168.43.124.8880 > 192.168.43.195.7771: UDP, length 120
23:03:59.150527 IP 192.168.43.124.8880 > 192.168.43.195.7771: UDP, length 120
23:03:59.200576 IP 192.168.43.124.8880 > 192.168.43.195.7771: UDP, length 120
23:03:59.250574 IP 192.168.43.124.8880 > 192.168.43.195.7771: UDP, length 120
23:03:59.300532 IP 192.168.43.124.8880 > 192.168.43.195.7771: UDP, length 120
23:03:59.350574 IP 192.168.43.124.8880 > 192.168.43.195.7771: UDP, length 120
23:03:59.400574 IP 192.168.43.124.8880 > 192.168.43.195.7771: UDP, length 120
23:03:59.450574 IP 192.168.43.124.8880 > 192.168.43.195.7771: UDP, length 120
23:03:59.500576 IP 192.168.43.124.8880 > 192.168.43.195.7771: UDP, length 120
23:03:59.550571 IP 192.168.43.124.8880 > 192.168.43.195.7771: UDP, length 120
23:03:59.600573 IP 192.168.43.124.8880 > 192.168.43.195.7771: UDP, length 120
23:03:59.650574 IP 192.168.43.124.8880 > 192.168.43.195.7771: UDP, length 120
23:03:59.700529 IP 192.168.43.124.8880 > 192.168.43.195.7771: UDP, length 120
23:03:59.750527 IP 192.168.43.124.8880 > 192.168.43.195.7771: UDP, length 120
23:03:59.800530 IP 192.168.43.124.8880 > 192.168.43.195.7771: UDP, length 120
23:03:59.850525 IP 192.168.43.124.8880 > 192.168.43.195.7771: UDP, length 120
23:03:59.900523 IP 192.168.43.124.8880 > 192.168.43.195.7771: UDP, length 120
23:03:59.950525 IP 192.168.43.124.8880 > 192.168.43.195.7771: UDP, length 120
23:04:00.000461 IP 192.168.43.124.8880 > 192.168.43.195.7771: UDP, length 120
23:04:00.050527 IP 192.168.43.124.8880 > 192.168.43.195.7771: UDP, length 120
23:04:00.100526 IP 192.168.43.124.8880 > 192.168.43.195.7771: UDP, length 120
23:04:00.150523 IP 192.168.43.124.8880 > 192.168.43.195.7771: UDP, length 120
23:04:00.200522 IP 192.168.43.124.8880 > 192.168.43.195.7771: UDP, length 120
23:04:00.250527 IP 192.168.43.124.8880 > 192.168.43.195.7771: UDP, length 120
23:04:00.300527 IP 192.168.43.124.8880 > 192.168.43.195.7771: UDP, length 120
23:04:00.350525 IP 192.168.43.124.8880 > 192.168.43.195.7771: UDP, length 120
23:04:00.400527 IP 192.168.43.124.8880 > 192.168.43.195.7771: UDP, length 120
23:04:00.450528 IP 192.168.43.124.8880 > 192.168.43.195.7771: UDP, length 120
23:04:00.500527 IP 192.168.43.124.8880 > 192.168.43.195.7771: UDP, length 120
23:04:00.550527 IP 192.168.43.124.8880 > 192.168.43.195.7771: UDP, length 120
23:04:00.600528 IP 192.168.43.124.8880 > 192.168.43.195.7771: UDP, length 120
23:04:00.650525 IP 192.168.43.124.8880 > 192.168.43.195.7771: UDP, length 120
23:04:00.700525 IP 192.168.43.124.8880 > 192.168.43.195.7771: UDP, length 120
23:04:00.750524 IP 192.168.43.124.8880 > 192.168.43.195.7771: UDP, length 120
23:04:00.800522 IP 192.168.43.124.8880 > 192.168.43.195.7771: UDP, length 120
23:04:00.850523 IP 192.168.43.124.8880 > 192.168.43.195.7771: UDP, length 120
23:04:00.900524 IP 192.168.43.124.8880 > 192.168.43.195.7771: UDP, length 120
23:04:00.950524 IP 192.168.43.124.8880 > 192.168.43.195.7771: UDP, length 120
23:04:01.000524 IP 192.168.43.124.8880 > 192.168.43.195.7771: UDP, length 120
23:04:01.050524 IP 192.168.43.124.8880 > 192.168.43.195.7771: UDP, length 120
23:04:01.100526 IP 192.168.43.124.8880 > 192.168.43.195.7771: UDP, length 120
23:04:01.150524 IP 192.168.43.124.8880 > 192.168.43.195.7771: UDP, length 120
23:04:01.200479 IP 192.168.43.124.8880 > 192.168.43.195.7771: UDP, length 120
23:04:01.250573 IP 192.168.43.124.8880 > 192.168.43.195.7771: UDP, length 120
23:04:01.300522 IP 192.168.43.124.8880 > 192.168.43.195.7771: UDP, length 120
23:04:01.350458 IP 192.168.43.124.8880 > 192.168.43.195.7771: UDP, length 120
23:04:01.400448 IP 192.168.43.124.8880 > 192.168.43.195.7771: UDP, length 120
23:04:01.450524 IP 192.168.43.124.8880 > 192.168.43.195.7771: UDP, length 120
23:04:01.500526 IP 192.168.43.124.8880 > 192.168.43.195.7771: UDP, length 120
23:04:01.550522 IP 192.168.43.124.8880 > 192.168.43.195.7771: UDP, length 120
23:04:01.600526 IP 192.168.43.124.8880 > 192.168.43.195.7771: UDP, length 120
23:04:01.650524 IP 192.168.43.124.8880 > 192.168.43.195.7771: UDP, length 120
23:04:01.700525 IP 192.168.43.124.8880 > 192.168.43.195.7771: UDP, length 120
23:04:01.750523 IP 192.168.43.124.8880 > 192.168.43.195.7771: UDP, length 120
23:04:01.800526 IP 192.168.43.124.8880 > 192.168.43.195.7771: UDP, length 120
23:04:01.850524 IP 192.168.43.124.8880 > 192.168.43.195.7771: UDP, length 120
23:04:01.900526 IP 192.168.43.124.8880 > 192.168.43.195.7771: UDP, length 120
23:04:01.950525 IP 192.168.43.124.8880 > 192.168.43.195.7771: UDP, length 120
23:04:02.000574 IP 192.168.43.124.8880 > 192.168.43.195.7771: UDP, length 120
23:04:02.050571 IP 192.168.43.124.8880 > 192.168.43.195.7771: UDP, length 120
23:04:02.100577 IP 192.168.43.124.8880 > 192.168.43.195.7771: UDP, length 120
23:04:02.150576 IP 192.168.43.124.8880 > 192.168.43.195.7771: UDP, length 120
23:04:02.200572 IP 192.168.43.124.8880 > 192.168.43.195.7771: UDP, length 120
23:04:02.250573 IP 192.168.43.124.8880 > 192.168.43.195.7771: UDP, length 120
23:04:02.300576 IP 192.168.43.124.8880 > 192.168.43.195.7771: UDP, length 120
23:04:02.350575 IP 192.168.43.124.8880 > 192.168.43.195.7771: UDP, length 120
23:04:02.400575 IP 192.168.43.124.8880 > 192.168.43.195.7771: UDP, length 120
23:04:02.450577 IP 192.168.43.124.8880 > 192.168.43.195.7771: UDP, length 120
23:04:02.500529 IP 192.168.43.124.8880 > 192.168.43.195.7771: UDP, length 120
23:04:02.550527 IP 192.168.43.124.8880 > 192.168.43.195.7771: UDP, length 120
23:04:02.600529 IP 192.168.43.124.8880 > 192.168.43.195.7771: UDP, length 120
23:04:02.650528 IP 192.168.43.124.8880 > 192.168.43.195.7771: UDP, length 120
23:04:02.700565 IP 192.168.43.124.8880 > 192.168.43.195.7771: UDP, length 120
23:04:02.750530 IP 192.168.43.124.8880 > 192.168.43.195.7771: UDP, length 120
23:04:02.800444 IP 192.168.43.124.8880 > 192.168.43.195.7771: UDP, length 120
23:04:02.850524 IP 192.168.43.124.8880 > 192.168.43.195.7771: UDP, length 120
23:04:02.900527 IP 192.168.43.124.8880 > 192.168.43.195.7771: UDP, length 120
23:04:02.950526 IP 192.168.43.124.8880 > 192.168.43.195.7771: UDP, length 120
23:04:03.000526 IP 192.168.43.124.8880 > 192.168.43.195.7771: UDP, length 120
23:04:03.050527 IP 192.168.43.124.8880 > 192.168.43.195.7771: UDP, length 120
23:04:03.100526 IP 192.168.43.124.8880 > 192.168.43.195.7771: UDP, length 120
23:04:03.150525 IP 192.168.43.124.8880 > 192.168.43.195.7771: UDP, length 120
23:04:03.200573 IP 192.168.43.124.8880 > 192.168.43.195.7771: UDP, length 120
23:04:03.250575 IP 192.168.43.124.8880 > 192.168.43.195.7771: UDP, length 120
23:04:03.300530 IP 192.168.43.124.8880 > 192.168.43.195.7771: UDP, length 120
23:04:03.350573 IP 192.168.43.124.8880 > 192.168.43.195.7771: UDP, length 120
23:04:03.400576 IP 192.168.43.124.8880 > 192.168.43.195.7771: UDP, length 120
23:04:03.450574 IP 192.168.43.124.8880 > 192.168.43.195.7771: UDP, length 120
23:04:03.500574 IP 192.168.43.124.8880 > 192.168.43.195.7771: UDP, length 120
23:04:03.550575 IP 192.168.43.124.8880 > 192.168.43.195.7771: UDP, length 120
23:04:03.600576 IP 192.168.43.124.8880 > 192.168.43.195.7771: UDP, length 120
23:04:03.650575 IP 192.168.43.124.8880 > 192.168.43.195.7771: UDP, length 120
23:04:03.700525 IP 192.168.43.124.8880 > 192.168.43.195.7771: UDP, length 120
23:04:03.750524 IP 192.168.43.124.8880 > 192.168.43.195.7771: UDP, length 120
23:04:03.800525 IP 192.168.43.124.8880 > 192.168.43.195.7771: UDP, length 120
23:04:03.850522 IP 192.168.43.124.8880 > 192.168.43.195.7771: UDP, length 120
23:04:03.900524 IP 192.168.43.124.8880 > 192.168.43.195.7771: UDP, length 120
23:04:03.950524 IP 192.168.43.124.8880 > 192.168.43.195.7771: UDP, length 120
23:04:04.000524 IP 192.168.43.124.8880 > 192.168.43.195.7771: UDP, length 120
23:04:04.050521 IP 192.168.43.124.8880 > 192.168.43.195.7771: UDP, length 120
23:04:04.100526 IP 192.168.43.124.8880 > 192.168.43.195.7771: UDP, length 120
23:04:04.150525 IP 192.168.43.124.8880 > 192.168.43.195.7771: UDP, length 120
23:04:04.200573 IP 192.168.43.124.8880 > 192.168.43.195.7771: UDP, length 120
23:04:04.250574 IP 192.168.43.124.8880 > 192.168.43.195.7771: UDP, length 120
23:04:04.300529 IP 192.168.43.124.8880 > 192.168.43.195.7771: UDP, length 120
23:04:04.350528 IP 192.168.43.124.8880 > 192.168.43.195.7771: UDP, length 120
23:04:04.400573 IP 192.168.43.124.8880 > 192.168.43.195.7771: UDP, length 120
23:04:04.450578 IP 192.168.43.124.8880 > 192.168.43.195.7771: UDP, length 120
23:04:04.500575 IP 192.168.43.124.8880 > 192.168.43.195.7771: UDP, length 120
23:04:04.550575 IP 192.168.43.124.8880 > 192.168.43.195.7771: UDP, length 120
23:04:04.600577 IP 192.168.43.124.8880 > 192.168.43.195.7771: UDP, length 120
23:04:04.650576 IP 192.168.43.124.8880 > 192.168.43.195.7771: UDP, length 120
23:04:04.700528 IP 192.168.43.124.8880 > 192.168.43.195.7771: UDP, length 120
23:04:04.750528 IP 192.168.43.124.8880 > 192.168.43.195.7771: UDP, length 120
23:04:04.800523 IP 192.168.43.124.8880 > 192.168.43.195.7771: UDP, length 120
23:04:04.850522 IP 192.168.43.124.8880 > 192.168.43.195.7771: UDP, length 120
23:04:04.900528 IP 192.168.43.124.8880 > 192.168.43.195.7771: UDP, length 120
23:04:04.950528 IP 192.168.43.124.8880 > 192.168.43.195.7771: UDP, length 120
23:04:05.000529 IP 192.168.43.124.8880 > 192.168.43.195.7771: UDP, length 120
23:04:05.050530 IP 192.168.43.124.8880 > 192.168.43.195.7771: UDP, length 120
23:04:05.100527 IP 192.168.43.124.8880 > 192.168.43.195.7771: UDP, length 120
23:04:05.150526 IP 192.168.43.124.8880 > 192.168.43.195.7771: UDP, length 120
23:04:05.200524 IP 192.168.43.124.8880 > 192.168.43.195.7771: UDP, length 120
23:04:05.250573 IP 192.168.43.124.8880 > 192.168.43.195.7771: UDP, length 120
23:04:05.300580 IP 192.168.43.124.8880 > 192.168.43.195.7771: UDP, length 120
23:04:05.350576 IP 192.168.43.124.8880 > 192.168.43.195.7771: UDP, length 120
23:04:05.400575 IP 192.168.43.124.8880 > 192.168.43.195.7771: UDP, length 120
23:04:05.450575 IP 192.168.43.124.8880 > 192.168.43.195.7771: UDP, length 120
23:04:05.500577 IP 192.168.43.124.8880 > 192.168.43.195.7771: UDP, length 120
23:04:05.550575 IP 192.168.43.124.8880 > 192.168.43.195.7771: UDP, length 120
23:04:05.600574 IP 192.168.43.124.8880 > 192.168.43.195.7771: UDP, length 120
23:04:05.650575 IP 192.168.43.124.8880 > 192.168.43.195.7771: UDP, length 120
23:04:05.700525 IP 192.168.43.124.8880 > 192.168.43.195.7771: UDP, length 120
23:04:05.750523 IP 192.168.43.124.8880 > 192.168.43.195.7771: UDP, length 120
23:04:05.800525 IP 192.168.43.124.8880 > 192.168.43.195.7771: UDP, length 120
23:04:05.850523 IP 192.168.43.124.8880 > 192.168.43.195.7771: UDP, length 120
23:04:05.900524 IP 192.168.43.124.8880 > 192.168.43.195.7771: UDP, length 120
23:04:05.950524 IP 192.168.43.124.8880 > 192.168.43.195.7771: UDP, length 120
23:04:06.000524 IP 192.168.43.124.8880 > 192.168.43.195.7771: UDP, length 120
23:04:06.050524 IP 192.168.43.124.8880 > 192.168.43.195.7771: UDP, length 120
23:04:06.100524 IP 192.168.43.124.8880 > 192.168.43.195.7771: UDP, length 120
23:04:06.150523 IP 192.168.43.124.8880 > 192.168.43.195.7771: UDP, length 120
23:04:06.200580 IP 192.168.43.124.8880 > 192.168.43.195.7771: UDP, length 120
23:04:06.250578 IP 192.168.43.124.8880 > 192.168.43.195.7771: UDP, length 120
23:04:06.300493 IP 192.168.43.124.8880 > 192.168.43.195.7771: UDP, length 120
23:04:06.350532 IP 192.168.43.124.8880 > 192.168.43.195.7771: UDP, length 120
23:04:06.400494 IP 192.168.43.124.8880 > 192.168.43.195.7771: UDP, length 120
23:04:06.450457 IP 192.168.43.124.8880 > 192.168.43.195.7771: UDP, length 120
23:04:06.500451 IP 192.168.43.124.8880 > 192.168.43.195.7771: UDP, length 120
23:04:06.550520 IP 192.168.43.124.8880 > 192.168.43.195.7771: UDP, length 120
23:04:06.600523 IP 192.168.43.124.8880 > 192.168.43.195.7771: UDP, length 120
23:04:06.650525 IP 192.168.43.124.8880 > 192.168.43.195.7771: UDP, length 120
23:04:06.700525 IP 192.168.43.124.8880 > 192.168.43.195.7771: UDP, length 120
23:04:06.750525 IP 192.168.43.124.8880 > 192.168.43.195.7771: UDP, length 120
23:04:06.800525 IP 192.168.43.124.8880 > 192.168.43.195.7771: UDP, length 120
23:04:06.850524 IP 192.168.43.124.8880 > 192.168.43.195.7771: UDP, length 120
23:04:06.900526 IP 192.168.43.124.8880 > 192.168.43.195.7771: UDP, length 120
23:04:06.950525 IP 192.168.43.124.8880 > 192.168.43.195.7771: UDP, length 120
23:04:07.000525 IP 192.168.43.124.8880 > 192.168.43.195.7771: UDP, length 120
23:04:07.050525 IP 192.168.43.124.8880 > 192.168.43.195.7771: UDP, length 120
23:04:07.101170 IP 192.168.43.124.8880 > 192.168.43.195.7771: UDP, length 120
23:04:07.150576 IP 192.168.43.124.8880 > 192.168.43.195.7771: UDP, length 120
23:04:07.200497 IP 192.168.43.124.8880 > 192.168.43.195.7771: UDP, length 120
23:04:07.250576 IP 192.168.43.124.8880 > 192.168.43.195.7771: UDP, length 120
23:04:07.300544 IP 192.168.43.124.8880 > 192.168.43.195.7771: UDP, length 120
23:04:07.350575 IP 192.168.43.124.8880 > 192.168.43.195.7771: UDP, length 120
23:04:07.400578 IP 192.168.43.124.8880 > 192.168.43.195.7771: UDP, length 120
23:04:07.450576 IP 192.168.43.124.8880 > 192.168.43.195.7771: UDP, length 120
23:04:07.501051 IP 192.168.43.124.8880 > 192.168.43.195.7771: UDP, length 120
23:04:07.550576 IP 192.168.43.124.8880 > 192.168.43.195.7771: UDP, length 120
23:04:07.600579 IP 192.168.43.124.8880 > 192.168.43.195.7771: UDP, length 120
23:04:07.650575 IP 192.168.43.124.8880 > 192.168.43.195.7771: UDP, length 120
23:04:07.700462 IP 192.168.43.124.8880 > 192.168.43.195.7771: UDP, length 120
23:04:07.750523 IP 192.168.43.124.8880 > 192.168.43.195.7771: UDP, length 120
23:04:07.800525 IP 192.168.43.124.8880 > 192.168.43.195.7771: UDP, length 120
23:04:07.850524 IP 192.168.43.124.8880 > 192.168.43.195.7771: UDP, length 120
23:04:07.900523 IP 192.168.43.124.8880 > 192.168.43.195.7771: UDP, length 120
23:04:07.950524 IP 192.168.43.124.8880 > 192.168.43.195.7771: UDP, length 120
23:04:08.000577 IP 192.168.43.124.8880 > 192.168.43.195.7771: UDP, length 120
23:04:08.050577 IP 192.168.43.124.8880 > 192.168.43.195.7771: UDP, length 120
23:04:08.100577 IP 192.168.43.124.8880 > 192.168.43.195.7771: UDP, length 120
23:04:08.150576 IP 192.168.43.124.8880 > 192.168.43.195.7771: UDP, length 120
23:04:08.200573 IP 192.168.43.124.8880 > 192.168.43.195.7771: UDP, length 120
23:04:08.250575 IP 192.168.43.124.8880 > 192.168.43.195.7771: UDP, length 120
23:04:08.300578 IP 192.168.43.124.8880 > 192.168.43.195.7771: UDP, length 120
23:04:08.350577 IP 192.168.43.124.8880 > 192.168.43.195.7771: UDP, length 120
23:04:08.400581 IP 192.168.43.124.8880 > 192.168.43.195.7771: UDP, length 120
23:04:08.450574 IP 192.168.43.124.8880 > 192.168.43.195.7771: UDP, length 120
23:04:08.500578 IP 192.168.43.124.8880 > 192.168.43.195.7771: UDP, length 120
23:04:08.550577 IP 192.168.43.124.8880 > 192.168.43.195.7771: UDP, length 120
23:04:08.600574 IP 192.168.43.124.8880 > 192.168.43.195.7771: UDP, length 120
23:04:08.650576 IP 192.168.43.124.8880 > 192.168.43.195.7771: UDP, length 120
23:04:08.700526 IP 192.168.43.124.8880 > 192.168.43.195.7771: UDP, length 120
23:04:08.750524 IP 192.168.43.124.8880 > 192.168.43.195.7771: UDP, length 120
23:04:08.800523 IP 192.168.43.124.8880 > 192.168.43.195.7771: UDP, length 120
23:04:08.850525 IP 192.168.43.124.8880 > 192.168.43.195.7771: UDP, length 120
23:04:08.900525 IP 192.168.43.124.8880 > 192.168.43.195.7771: UDP, length 120
23:04:08.950526 IP 192.168.43.124.8880 > 192.168.43.195.7771: UDP, length 120
23:04:09.000459 IP 192.168.43.124.8880 > 192.168.43.195.7771: UDP, length 120
23:04:09.050523 IP 192.168.43.124.8880 > 192.168.43.195.7771: UDP, length 120
23:04:09.100525 IP 192.168.43.124.8880 > 192.168.43.195.7771: UDP, length 120
23:04:09.150525 IP 192.168.43.124.8880 > 192.168.43.195.7771: UDP, length 120
23:04:09.200521 IP 192.168.43.124.8880 > 192.168.43.195.7771: UDP, length 120
23:04:09.250522 IP 192.168.43.124.8880 > 192.168.43.195.7771: UDP, length 120
23:04:09.300522 IP 192.168.43.124.8880 > 192.168.43.195.7771: UDP, length 120
23:04:09.350525 IP 192.168.43.124.8880 > 192.168.43.195.7771: UDP, length 120
23:04:09.400524 IP 192.168.43.124.8880 > 192.168.43.195.7771: UDP, length 120
23:04:09.516363 IP 192.168.43.124.8880 > 192.168.43.195.7771: UDP, length 120
23:04:09.516511 IP 192.168.43.124.8880 > 192.168.43.195.7771: UDP, length 120
23:04:09.550523 IP 192.168.43.124.8880 > 192.168.43.195.7771: UDP, length 120
23:04:09.600527 IP 192.168.43.124.8880 > 192.168.43.195.7771: UDP, length 120
23:04:09.650523 IP 192.168.43.124.8880 > 192.168.43.195.7771: UDP, length 120
23:04:09.700524 IP 192.168.43.124.8880 > 192.168.43.195.7771: UDP, length 120
23:04:09.866074 IP 192.168.43.124.8880 > 192.168.43.195.7771: UDP, length 120
23:04:09.866226 IP 192.168.43.124.8880 > 192.168.43.195.7771: UDP, length 120
23:04:09.866230 IP 192.168.43.124.8880 > 192.168.43.195.7771: UDP, length 120
23:04:09.900525 IP 192.168.43.124.8880 > 192.168.43.195.7771: UDP, length 120
23:04:09.950523 IP 192.168.43.124.8880 > 192.168.43.195.7771: UDP, length 120
23:04:10.000528 IP 192.168.43.124.8880 > 192.168.43.195.7771: UDP, length 120
23:04:10.050525 IP 192.168.43.124.8880 > 192.168.43.195.7771: UDP, length 120
23:04:10.214079 IP 192.168.43.124.8880 > 192.168.43.195.7771: UDP, length 120
23:04:10.214230 IP 192.168.43.124.8880 > 192.168.43.195.7771: UDP, length 120
23:04:10.214234 IP 192.168.43.124.8880 > 192.168.43.195.7771: UDP, length 120
23:04:10.250523 IP 192.168.43.124.8880 > 192.168.43.195.7771: UDP, length 120
23:04:10.300525 IP 192.168.43.124.8880 > 192.168.43.195.7771: UDP, length 120
23:04:10.350523 IP 192.168.43.124.8880 > 192.168.43.195.7771: UDP, length 120
23:04:10.400527 IP 192.168.43.124.8880 > 192.168.43.195.7771: UDP, length 120
23:04:10.562017 IP 192.168.43.124.8880 > 192.168.43.195.7771: UDP, length 120
23:04:10.562168 IP 192.168.43.124.8880 > 192.168.43.195.7771: UDP, length 120
23:04:10.562172 IP 192.168.43.124.8880 > 192.168.43.195.7771: UDP, length 120
23:04:10.600525 IP 192.168.43.124.8880 > 192.168.43.195.7771: UDP, length 120
23:04:10.650523 IP 192.168.43.124.8880 > 192.168.43.195.7771: UDP, length 120
23:04:10.700525 IP 192.168.43.124.8880 > 192.168.43.195.7771: UDP, length 120
23:04:10.750481 IP 192.168.43.124.8880 > 192.168.43.195.7771: UDP, length 120
23:04:10.910260 IP 192.168.43.124.8880 > 192.168.43.195.7771: UDP, length 120
23:04:10.910412 IP 192.168.43.124.8880 > 192.168.43.195.7771: UDP, length 120
23:04:10.910416 IP 192.168.43.124.8880 > 192.168.43.195.7771: UDP, length 120
23:04:10.950525 IP 192.168.43.124.8880 > 192.168.43.195.7771: UDP, length 120
23:04:11.000526 IP 192.168.43.124.8880 > 192.168.43.195.7771: UDP, length 120
23:04:11.050524 IP 192.168.43.124.8880 > 192.168.43.195.7771: UDP, length 120
23:04:11.100522 IP 192.168.43.124.8880 > 192.168.43.195.7771: UDP, length 120
23:04:11.258064 IP 192.168.43.124.8880 > 192.168.43.195.7771: UDP, length 120
23:04:11.258216 IP 192.168.43.124.8880 > 192.168.43.195.7771: UDP, length 120
23:04:11.258220 IP 192.168.43.124.8880 > 192.168.43.195.7771: UDP, length 120
23:04:11.300524 IP 192.168.43.124.8880 > 192.168.43.195.7771: UDP, length 120
23:04:11.350523 IP 192.168.43.124.8880 > 192.168.43.195.7771: UDP, length 120
23:04:11.400519 IP 192.168.43.124.8880 > 192.168.43.195.7771: UDP, length 120
23:04:11.450523 IP 192.168.43.124.8880 > 192.168.43.195.7771: UDP, length 120
23:04:11.606039 IP 192.168.43.124.8880 > 192.168.43.195.7771: UDP, length 120
23:04:11.606061 IP 192.168.43.124.8880 > 192.168.43.195.7771: UDP, length 120
23:04:11.606071 IP 192.168.43.124.8880 > 192.168.43.195.7771: UDP, length 120
23:04:11.650522 IP 192.168.43.124.8880 > 192.168.43.195.7771: UDP, length 120
23:04:11.700522 IP 192.168.43.124.8880 > 192.168.43.195.7771: UDP, length 120
23:04:11.750523 IP 192.168.43.124.8880 > 192.168.43.195.7771: UDP, length 120
23:04:11.800523 IP 192.168.43.124.8880 > 192.168.43.195.7771: UDP, length 120
23:04:11.954068 IP 192.168.43.124.8880 > 192.168.43.195.7771: UDP, length 120
23:04:11.954219 IP 192.168.43.124.8880 > 192.168.43.195.7771: UDP, length 120
23:04:11.954223 IP 192.168.43.124.8880 > 192.168.43.195.7771: UDP, length 120
23:04:12.001066 IP 192.168.43.124.8880 > 192.168.43.195.7771: UDP, length 120
23:04:12.050465 IP 192.168.43.124.8880 > 192.168.43.195.7771: UDP, length 120
23:04:12.100521 IP 192.168.43.124.8880 > 192.168.43.195.7771: UDP, length 120
23:04:12.150525 IP 192.168.43.124.8880 > 192.168.43.195.7771: UDP, length 120
23:04:12.302063 IP 192.168.43.124.8880 > 192.168.43.195.7771: UDP, length 120
23:04:12.302216 IP 192.168.43.124.8880 > 192.168.43.195.7771: UDP, length 120
23:04:12.302221 IP 192.168.43.124.8880 > 192.168.43.195.7771: UDP, length 120
23:04:12.350522 IP 192.168.43.124.8880 > 192.168.43.195.7771: UDP, length 120
23:04:12.400522 IP 192.168.43.124.8880 > 192.168.43.195.7771: UDP, length 120
23:04:12.450522 IP 192.168.43.124.8880 > 192.168.43.195.7771: UDP, length 120
23:04:12.650010 IP 192.168.43.124.8880 > 192.168.43.195.7771: UDP, length 120
23:04:12.650161 IP 192.168.43.124.8880 > 192.168.43.195.7771: UDP, length 120
23:04:12.650166 IP 192.168.43.124.8880 > 192.168.43.195.7771: UDP, length 120
23:04:12.650457 IP 192.168.43.124.8880 > 192.168.43.195.7771: UDP, length 120
23:04:12.700520 IP 192.168.43.124.8880 > 192.168.43.195.7771: UDP, length 120
23:04:12.750520 IP 192.168.43.124.8880 > 192.168.43.195.7771: UDP, length 120
23:04:12.800531 IP 192.168.43.124.8880 > 192.168.43.195.7771: UDP, length 120
23:04:12.999883 IP 192.168.43.124.8880 > 192.168.43.195.7771: UDP, length 120
23:04:12.999909 IP 192.168.43.124.8880 > 192.168.43.195.7771: UDP, length 120
23:04:12.999915 IP 192.168.43.124.8880 > 192.168.43.195.7771: UDP, length 120
23:04:13.000522 IP 192.168.43.124.8880 > 192.168.43.195.7771: UDP, length 120
23:04:13.050520 IP 192.168.43.124.8880 > 192.168.43.195.7771: UDP, length 120
23:04:13.100525 IP 192.168.43.124.8880 > 192.168.43.195.7771: UDP, length 120
23:04:13.150522 IP 192.168.43.124.8880 > 192.168.43.195.7771: UDP, length 120
23:04:13.350071 IP 192.168.43.124.8880 > 192.168.43.195.7771: UDP, length 120
23:04:13.350223 IP 192.168.43.124.8880 > 192.168.43.195.7771: UDP, length 120
23:04:13.350228 IP 192.168.43.124.8880 > 192.168.43.195.7771: UDP, length 120
23:04:13.350468 IP 192.168.43.124.8880 > 192.168.43.195.7771: UDP, length 120
23:04:13.400523 IP 192.168.43.124.8880 > 192.168.43.195.7771: UDP, length 120
23:04:13.450478 IP 192.168.43.124.8880 > 192.168.43.195.7771: UDP, length 120
23:04:13.500523 IP 192.168.43.124.8880 > 192.168.43.195.7771: UDP, length 120
23:04:13.698084 IP 192.168.43.124.8880 > 192.168.43.195.7771: UDP, length 120
23:04:13.698235 IP 192.168.43.124.8880 > 192.168.43.195.7771: UDP, length 120
23:04:13.698240 IP 192.168.43.124.8880 > 192.168.43.195.7771: UDP, length 120
23:04:13.700526 IP 192.168.43.124.8880 > 192.168.43.195.7771: UDP, length 120
23:04:13.750519 IP 192.168.43.124.8880 > 192.168.43.195.7771: UDP, length 120
23:04:13.800522 IP 192.168.43.124.8880 > 192.168.43.195.7771: UDP, length 120
23:04:13.850518 IP 192.168.43.124.8880 > 192.168.43.195.7771: UDP, length 120
23:04:14.046889 IP 192.168.43.124.8880 > 192.168.43.195.7771: UDP, length 120
23:04:14.047067 IP 192.168.43.124.8880 > 192.168.43.195.7771: UDP, length 120
23:04:14.047072 IP 192.168.43.124.8880 > 192.168.43.195.7771: UDP, length 120
23:04:14.050440 IP 192.168.43.124.8880 > 192.168.43.195.7771: UDP, length 120
23:04:14.100444 IP 192.168.43.124.8880 > 192.168.43.195.7771: UDP, length 120
23:04:14.150528 IP 192.168.43.124.8880 > 192.168.43.195.7771: UDP, length 120
23:04:14.200525 IP 192.168.43.124.8880 > 192.168.43.195.7771: UDP, length 120
23:04:14.250574 IP 192.168.43.124.8880 > 192.168.43.195.7771: UDP, length 120
23:04:14.300540 IP 192.168.43.124.8880 > 192.168.43.195.7771: UDP, length 120
23:04:14.350573 IP 192.168.43.124.8880 > 192.168.43.195.7771: UDP, length 120
23:04:14.400528 IP 192.168.43.124.8880 > 192.168.43.195.7771: UDP, length 120
23:04:14.450529 IP 192.168.43.124.8880 > 192.168.43.195.7771: UDP, length 120
23:04:14.500505 IP 192.168.43.124.8880 > 192.168.43.195.7771: UDP, length 120
23:04:14.550573 IP 192.168.43.124.8880 > 192.168.43.195.7771: UDP, length 120
23:04:14.600528 IP 192.168.43.124.8880 > 192.168.43.195.7771: UDP, length 120
23:04:14.650526 IP 192.168.43.124.8880 > 192.168.43.195.7771: UDP, length 120
23:04:14.700528 IP 192.168.43.124.8880 > 192.168.43.195.7771: UDP, length 120
23:04:14.750527 IP 192.168.43.124.8880 > 192.168.43.195.7771: UDP, length 120
23:04:14.800530 IP 192.168.43.124.8880 > 192.168.43.195.7771: UDP, length 120
23:04:14.850529 IP 192.168.43.124.8880 > 192.168.43.195.7771: UDP, length 120
23:04:14.900528 IP 192.168.43.124.8880 > 192.168.43.195.7771: UDP, length 120
23:04:14.950529 IP 192.168.43.124.8880 > 192.168.43.195.7771: UDP, length 120
23:04:15.004414 IP 192.168.43.124.8880 > 192.168.43.195.7771: UDP, length 120
23:04:15.050526 IP 192.168.43.124.8880 > 192.168.43.195.7771: UDP, length 120
23:04:15.100631 IP 192.168.43.124.8880 > 192.168.43.195.7771: UDP, length 120
23:04:15.150573 IP 192.168.43.124.8880 > 192.168.43.195.7771: UDP, length 120
23:04:15.200526 IP 192.168.43.124.8880 > 192.168.43.195.7771: UDP, length 120
23:04:15.250573 IP 192.168.43.124.8880 > 192.168.43.195.7771: UDP, length 120
23:04:15.300528 IP 192.168.43.124.8880 > 192.168.43.195.7771: UDP, length 120
23:04:15.350527 IP 192.168.43.124.8880 > 192.168.43.195.7771: UDP, length 120
23:04:15.400573 IP 192.168.43.124.8880 > 192.168.43.195.7771: UDP, length 120
23:04:15.450572 IP 192.168.43.124.8880 > 192.168.43.195.7771: UDP, length 120
23:04:15.500528 IP 192.168.43.124.8880 > 192.168.43.195.7771: UDP, length 120
23:04:15.550525 IP 192.168.43.124.8880 > 192.168.43.195.7771: UDP, length 120
23:04:15.600684 IP 192.168.43.124.8880 > 192.168.43.195.7771: UDP, length 120
23:04:15.650526 IP 192.168.43.124.8880 > 192.168.43.195.7771: UDP, length 120
23:04:15.700462 IP 192.168.43.124.8880 > 192.168.43.195.7771: UDP, length 120
23:04:15.750526 IP 192.168.43.124.8880 > 192.168.43.195.7771: UDP, length 120
23:04:15.800524 IP 192.168.43.124.8880 > 192.168.43.195.7771: UDP, length 120
23:04:15.850575 IP 192.168.43.124.8880 > 192.168.43.195.7771: UDP, length 120
23:04:15.900576 IP 192.168.43.124.8880 > 192.168.43.195.7771: UDP, length 120
23:04:15.951299 IP 192.168.43.124.8880 > 192.168.43.195.7771: UDP, length 120
23:04:16.001299 IP 192.168.43.124.8880 > 192.168.43.195.7771: UDP, length 120
23:04:16.051315 IP 192.168.43.124.8880 > 192.168.43.195.7771: UDP, length 120
23:04:16.100622 IP 192.168.43.124.8880 > 192.168.43.195.7771: UDP, length 120
23:04:16.150575 IP 192.168.43.124.8880 > 192.168.43.195.7771: UDP, length 120
23:04:16.200536 IP 192.168.43.124.8880 > 192.168.43.195.7771: UDP, length 120
23:04:16.250528 IP 192.168.43.124.8880 > 192.168.43.195.7771: UDP, length 120
23:04:16.300463 IP 192.168.43.124.8880 > 192.168.43.195.7771: UDP, length 120
23:04:16.350574 IP 192.168.43.124.8880 > 192.168.43.195.7771: UDP, length 120
23:04:16.400527 IP 192.168.43.124.8880 > 192.168.43.195.7771: UDP, length 120
23:04:16.450529 IP 192.168.43.124.8880 > 192.168.43.195.7771: UDP, length 120
23:04:16.500575 IP 192.168.43.124.8880 > 192.168.43.195.7771: UDP, length 120
23:04:16.550574 IP 192.168.43.124.8880 > 192.168.43.195.7771: UDP, length 120
23:04:16.600575 IP 192.168.43.124.8880 > 192.168.43.195.7771: UDP, length 120
23:04:16.651194 IP 192.168.43.124.8880 > 192.168.43.195.7771: UDP, length 120
23:04:16.700457 IP 192.168.43.124.8880 > 192.168.43.195.7771: UDP, length 120
23:04:16.750517 IP 192.168.43.124.8880 > 192.168.43.195.7771: UDP, length 120
23:04:16.800524 IP 192.168.43.124.8880 > 192.168.43.195.7771: UDP, length 120
23:04:16.850524 IP 192.168.43.124.8880 > 192.168.43.195.7771: UDP, length 120
23:04:16.900453 IP 192.168.43.124.8880 > 192.168.43.195.7771: UDP, length 120
23:04:16.950524 IP 192.168.43.124.8880 > 192.168.43.195.7771: UDP, length 120
23:04:17.000523 IP 192.168.43.124.8880 > 192.168.43.195.7771: UDP, length 120
23:04:17.050522 IP 192.168.43.124.8880 > 192.168.43.195.7771: UDP, length 120
23:04:17.100524 IP 192.168.43.124.8880 > 192.168.43.195.7771: UDP, length 120
23:04:17.150525 IP 192.168.43.124.8880 > 192.168.43.195.7771: UDP, length 120
23:04:17.200571 IP 192.168.43.124.8880 > 192.168.43.195.7771: UDP, length 120
23:04:17.250524 IP 192.168.43.124.8880 > 192.168.43.195.7771: UDP, length 120
23:04:17.300524 IP 192.168.43.124.8880 > 192.168.43.195.7771: UDP, length 120
23:04:17.350526 IP 192.168.43.124.8880 > 192.168.43.195.7771: UDP, length 120
23:04:17.400577 IP 192.168.43.124.8880 > 192.168.43.195.7771: UDP, length 120
23:04:17.450575 IP 192.168.43.124.8880 > 192.168.43.195.7771: UDP, length 120
23:04:17.500470 IP 192.168.43.124.8880 > 192.168.43.195.7771: UDP, length 120
23:04:17.550522 IP 192.168.43.124.8880 > 192.168.43.195.7771: UDP, length 120
23:04:17.600524 IP 192.168.43.124.8880 > 192.168.43.195.7771: UDP, length 120
23:04:17.650522 IP 192.168.43.124.8880 > 192.168.43.195.7771: UDP, length 120
23:04:17.700511 IP 192.168.43.124.8880 > 192.168.43.195.7771: UDP, length 120
23:04:17.751156 IP 192.168.43.124.8880 > 192.168.43.195.7771: UDP, length 120
23:04:17.800524 IP 192.168.43.124.8880 > 192.168.43.195.7771: UDP, length 120
23:04:17.850521 IP 192.168.43.124.8880 > 192.168.43.195.7771: UDP, length 120
23:04:17.900552 IP 192.168.43.124.8880 > 192.168.43.195.7771: UDP, length 120
23:04:17.950551 IP 192.168.43.124.8880 > 192.168.43.195.7771: UDP, length 120
23:04:18.000552 IP 192.168.43.124.8880 > 192.168.43.195.7771: UDP, length 120
23:04:18.050553 IP 192.168.43.124.8880 > 192.168.43.195.7771: UDP, length 120
