02:58:44.032415 IP 192.168.43.124.8880 > 192.168.43.146.7771: UDP, length 120
02:58:44.084595 IP 192.168.43.124.8880 > 192.168.43.146.7771: UDP, length 120
02:58:44.132464 IP 192.168.43.124.8880 > 192.168.43.146.7771: UDP, length 120
02:58:44.184964 IP 192.168.43.124.8880 > 192.168.43.146.7771: UDP, length 120
02:58:44.232337 IP 192.168.43.124.8880 > 192.168.43.146.7771: UDP, length 120
02:58:44.282715 IP 192.168.43.124.8880 > 192.168.43.146.7771: UDP, length 120
02:58:44.332753 IP 192.168.43.124.8880 > 192.168.43.146.7771: UDP, length 120
02:58:44.386407 IP 192.168.43.124.8880 > 192.168.43.146.7771: UDP, length 120
02:58:44.434891 IP 192.168.43.124.8880 > 192.168.43.146.7771: UDP, length 120
02:58:44.479429 IP 192.168.43.124.8880 > 192.168.43.146.7771: UDP, length 120
02:58:44.531945 IP 192.168.43.124.8880 > 192.168.43.146.7771: UDP, length 120
02:58:44.544193 IP 192.168.43.146.8880 > 192.168.43.147.7772: UDP, length 120
02:58:44.581844 IP 192.168.43.124.8880 > 192.168.43.146.7771: UDP, length 120
02:58:44.594231 IP 192.168.43.146.8880 > 192.168.43.147.7772: UDP, length 120
02:58:44.632344 IP 192.168.43.124.8880 > 192.168.43.146.7771: UDP, length 120
02:58:44.644217 IP 192.168.43.146.8880 > 192.168.43.147.7772: UDP, length 120
02:58:44.684062 IP 192.168.43.124.8880 > 192.168.43.146.7771: UDP, length 120
02:58:44.694208 IP 192.168.43.146.8880 > 192.168.43.147.7772: UDP, length 120
02:58:44.730720 IP 192.168.43.124.8880 > 192.168.43.146.7771: UDP, length 120
02:58:44.744209 IP 192.168.43.146.8880 > 192.168.43.147.7772: UDP, length 120
02:58:44.784532 IP 192.168.43.124.8880 > 192.168.43.146.7771: UDP, length 120
02:58:44.794211 IP 192.168.43.146.8880 > 192.168.43.147.7772: UDP, length 120
02:58:44.832074 IP 192.168.43.124.8880 > 192.168.43.146.7771: UDP, length 120
02:58:44.844217 IP 192.168.43.146.8880 > 192.168.43.147.7772: UDP, length 120
02:58:44.883500 IP 192.168.43.124.8880 > 192.168.43.146.7771: UDP, length 120
02:58:44.894212 IP 192.168.43.146.8880 > 192.168.43.147.7772: UDP, length 120
02:58:44.944206 IP 192.168.43.146.8880 > 192.168.43.147.7772: UDP, length 120
02:58:44.947392 IP 192.168.43.124.8880 > 192.168.43.146.7771: UDP, length 120
02:58:44.994209 IP 192.168.43.146.8880 > 192.168.43.147.7772: UDP, length 120
02:58:45.044207 IP 192.168.43.146.8880 > 192.168.43.147.7772: UDP, length 120
02:58:45.095372 IP 192.168.43.146.8880 > 192.168.43.147.7772: UDP, length 120
02:58:45.100598 IP 192.168.43.124.8880 > 192.168.43.146.7771: UDP, length 120
02:58:45.100774 IP 192.168.43.124.8880 > 192.168.43.146.7771: UDP, length 120
02:58:45.100881 IP 192.168.43.124.8880 > 192.168.43.146.7771: UDP, length 120
02:58:45.133779 IP 192.168.43.124.8880 > 192.168.43.146.7771: UDP, length 120
02:58:45.144255 IP 192.168.43.146.8880 > 192.168.43.147.7772: UDP, length 120
02:58:45.180722 IP 192.168.43.124.8880 > 192.168.43.146.7771: UDP, length 120
02:58:45.194265 IP 192.168.43.146.8880 > 192.168.43.147.7772: UDP, length 120
02:58:45.230708 IP 192.168.43.124.8880 > 192.168.43.146.7771: UDP, length 120
02:58:45.244224 IP 192.168.43.146.8880 > 192.168.43.147.7772: UDP, length 120
02:58:45.281147 IP 192.168.43.124.8880 > 192.168.43.146.7771: UDP, length 120
02:58:45.294211 IP 192.168.43.146.8880 > 192.168.43.147.7772: UDP, length 120
02:58:45.344208 IP 192.168.43.146.8880 > 192.168.43.147.7772: UDP, length 120
02:58:45.394207 IP 192.168.43.146.8880 > 192.168.43.147.7772: UDP, length 120
02:58:45.444206 IP 192.168.43.146.8880 > 192.168.43.147.7772: UDP, length 120
02:58:45.447616 IP 192.168.43.124.8880 > 192.168.43.146.7771: UDP, length 120
02:58:45.447748 IP 192.168.43.124.8880 > 192.168.43.146.7771: UDP, length 120
02:58:45.447867 IP 192.168.43.124.8880 > 192.168.43.146.7771: UDP, length 120
02:58:45.480034 IP 192.168.43.124.8880 > 192.168.43.146.7771: UDP, length 120
02:58:45.494226 IP 192.168.43.146.8880 > 192.168.43.147.7772: UDP, length 120
02:58:45.530760 IP 192.168.43.124.8880 > 192.168.43.146.7771: UDP, length 120
02:58:45.544210 IP 192.168.43.146.8880 > 192.168.43.147.7772: UDP, length 120
02:58:45.581633 IP 192.168.43.124.8880 > 192.168.43.146.7771: UDP, length 120
02:58:45.594214 IP 192.168.43.146.8880 > 192.168.43.147.7772: UDP, length 120
02:58:45.630667 IP 192.168.43.124.8880 > 192.168.43.146.7771: UDP, length 120
02:58:45.644214 IP 192.168.43.146.8880 > 192.168.43.147.7772: UDP, length 120
02:58:45.694208 IP 192.168.43.146.8880 > 192.168.43.147.7772: UDP, length 120
02:58:45.744205 IP 192.168.43.146.8880 > 192.168.43.147.7772: UDP, length 120
02:58:45.794209 IP 192.168.43.146.8880 > 192.168.43.147.7772: UDP, length 120
02:58:45.796032 IP 192.168.43.124.8880 > 192.168.43.146.7771: UDP, length 120
02:58:45.796164 IP 192.168.43.124.8880 > 192.168.43.146.7771: UDP, length 120
02:58:45.796273 IP 192.168.43.124.8880 > 192.168.43.146.7771: UDP, length 120
02:58:45.830833 IP 192.168.43.124.8880 > 192.168.43.146.7771: UDP, length 120
02:58:45.844221 IP 192.168.43.146.8880 > 192.168.43.147.7772: UDP, length 120
02:58:45.880922 IP 192.168.43.124.8880 > 192.168.43.146.7771: UDP, length 120
02:58:45.894223 IP 192.168.43.146.8880 > 192.168.43.147.7772: UDP, length 120
02:58:45.937827 IP 192.168.43.124.8880 > 192.168.43.146.7771: UDP, length 120
02:58:45.944212 IP 192.168.43.146.8880 > 192.168.43.147.7772: UDP, length 120
02:58:45.987653 IP 192.168.43.124.8880 > 192.168.43.146.7771: UDP, length 120
02:58:45.994208 IP 192.168.43.146.8880 > 192.168.43.147.7772: UDP, length 120
02:58:46.044209 IP 192.168.43.146.8880 > 192.168.43.147.7772: UDP, length 120
02:58:46.094206 IP 192.168.43.146.8880 > 192.168.43.147.7772: UDP, length 120
02:58:46.144205 IP 192.168.43.146.8880 > 192.168.43.147.7772: UDP, length 120
02:58:46.154854 IP 192.168.43.124.8880 > 192.168.43.146.7771: UDP, length 120
02:58:46.155654 IP 192.168.43.124.8880 > 192.168.43.146.7771: UDP, length 120
02:58:46.155769 IP 192.168.43.124.8880 > 192.168.43.146.7771: UDP, length 120
02:58:46.181916 IP 192.168.43.124.8880 > 192.168.43.146.7771: UDP, length 120
02:58:46.194288 IP 192.168.43.146.8880 > 192.168.43.147.7772: UDP, length 120
02:58:46.234658 IP 192.168.43.124.8880 > 192.168.43.146.7771: UDP, length 120
02:58:46.244308 IP 192.168.43.146.8880 > 192.168.43.147.7772: UDP, length 120
02:58:46.280795 IP 192.168.43.124.8880 > 192.168.43.146.7771: UDP, length 120
02:58:46.294337 IP 192.168.43.146.8880 > 192.168.43.147.7772: UDP, length 120
02:58:46.331121 IP 192.168.43.124.8880 > 192.168.43.146.7771: UDP, length 120
02:58:46.344270 IP 192.168.43.146.8880 > 192.168.43.147.7772: UDP, length 120
02:58:46.394320 IP 192.168.43.146.8880 > 192.168.43.147.7772: UDP, length 120
02:58:46.444254 IP 192.168.43.146.8880 > 192.168.43.147.7772: UDP, length 120
02:58:46.494266 IP 192.168.43.146.8880 > 192.168.43.147.7772: UDP, length 120
02:58:46.507749 IP 192.168.43.124.8880 > 192.168.43.146.7771: UDP, length 120
02:58:46.508088 IP 192.168.43.124.8880 > 192.168.43.146.7771: UDP, length 120
02:58:46.508223 IP 192.168.43.124.8880 > 192.168.43.146.7771: UDP, length 120
02:58:46.530567 IP 192.168.43.124.8880 > 192.168.43.146.7771: UDP, length 120
02:58:46.544251 IP 192.168.43.146.8880 > 192.168.43.147.7772: UDP, length 120
02:58:46.581878 IP 192.168.43.124.8880 > 192.168.43.146.7771: UDP, length 120
02:58:46.594274 IP 192.168.43.146.8880 > 192.168.43.147.7772: UDP, length 120
02:58:46.630626 IP 192.168.43.124.8880 > 192.168.43.146.7771: UDP, length 120
02:58:46.644262 IP 192.168.43.146.8880 > 192.168.43.147.7772: UDP, length 120
02:58:46.680705 IP 192.168.43.124.8880 > 192.168.43.146.7771: UDP, length 120
02:58:46.694224 IP 192.168.43.146.8880 > 192.168.43.147.7772: UDP, length 120
02:58:46.744187 IP 192.168.43.146.8880 > 192.168.43.147.7772: UDP, length 120
02:58:46.794180 IP 192.168.43.146.8880 > 192.168.43.147.7772: UDP, length 120
02:58:46.838761 IP 192.168.43.124.8880 > 192.168.43.146.7771: UDP, length 120
02:58:46.838936 IP 192.168.43.124.8880 > 192.168.43.146.7771: UDP, length 120
02:58:46.839008 IP 192.168.43.124.8880 > 192.168.43.146.7771: UDP, length 120
02:58:46.844185 IP 192.168.43.146.8880 > 192.168.43.147.7772: UDP, length 120
02:58:46.880590 IP 192.168.43.124.8880 > 192.168.43.146.7771: UDP, length 120
02:58:46.894188 IP 192.168.43.146.8880 > 192.168.43.147.7772: UDP, length 120
02:58:46.936113 IP 192.168.43.124.8880 > 192.168.43.146.7771: UDP, length 120
02:58:46.944186 IP 192.168.43.146.8880 > 192.168.43.147.7772: UDP, length 120
02:58:46.980531 IP 192.168.43.124.8880 > 192.168.43.146.7771: UDP, length 120
02:58:46.994181 IP 192.168.43.146.8880 > 192.168.43.147.7772: UDP, length 120
02:58:47.033507 IP 192.168.43.124.8880 > 192.168.43.146.7771: UDP, length 120
02:58:47.044182 IP 192.168.43.146.8880 > 192.168.43.147.7772: UDP, length 120
02:58:47.094179 IP 192.168.43.146.8880 > 192.168.43.147.7772: UDP, length 120
02:58:47.144256 IP 192.168.43.146.8880 > 192.168.43.147.7772: UDP, length 120
02:58:47.194236 IP 192.168.43.146.8880 > 192.168.43.147.7772: UDP, length 120
02:58:47.197716 IP 192.168.43.124.8880 > 192.168.43.146.7771: UDP, length 120
02:58:47.197813 IP 192.168.43.124.8880 > 192.168.43.146.7771: UDP, length 120
02:58:47.197956 IP 192.168.43.124.8880 > 192.168.43.146.7771: UDP, length 120
02:58:47.231761 IP 192.168.43.124.8880 > 192.168.43.146.7771: UDP, length 120
02:58:47.244207 IP 192.168.43.146.8880 > 192.168.43.147.7772: UDP, length 120
02:58:47.284120 IP 192.168.43.124.8880 > 192.168.43.146.7771: UDP, length 120
02:58:47.294188 IP 192.168.43.146.8880 > 192.168.43.147.7772: UDP, length 120
02:58:47.332457 IP 192.168.43.124.8880 > 192.168.43.146.7771: UDP, length 120
02:58:47.344182 IP 192.168.43.146.8880 > 192.168.43.147.7772: UDP, length 120
02:58:47.380622 IP 192.168.43.124.8880 > 192.168.43.146.7771: UDP, length 120
02:58:47.394182 IP 192.168.43.146.8880 > 192.168.43.147.7772: UDP, length 120
02:58:47.444179 IP 192.168.43.146.8880 > 192.168.43.147.7772: UDP, length 120
02:58:47.494185 IP 192.168.43.146.8880 > 192.168.43.147.7772: UDP, length 120
02:58:47.534674 IP 192.168.43.124.8880 > 192.168.43.146.7771: UDP, length 120
02:58:47.534833 IP 192.168.43.124.8880 > 192.168.43.146.7771: UDP, length 120
02:58:47.534905 IP 192.168.43.124.8880 > 192.168.43.146.7771: UDP, length 120
02:58:47.544186 IP 192.168.43.146.8880 > 192.168.43.147.7772: UDP, length 120
02:58:47.580326 IP 192.168.43.124.8880 > 192.168.43.146.7771: UDP, length 120
02:58:47.594184 IP 192.168.43.146.8880 > 192.168.43.147.7772: UDP, length 120
02:58:47.630365 IP 192.168.43.124.8880 > 192.168.43.146.7771: UDP, length 120
02:58:47.644212 IP 192.168.43.146.8880 > 192.168.43.147.7772: UDP, length 120
02:58:47.680680 IP 192.168.43.124.8880 > 192.168.43.146.7771: UDP, length 120
02:58:47.694207 IP 192.168.43.146.8880 > 192.168.43.147.7772: UDP, length 120
02:58:47.732270 IP 192.168.43.124.8880 > 192.168.43.146.7771: UDP, length 120
02:58:47.744207 IP 192.168.43.146.8880 > 192.168.43.147.7772: UDP, length 120
02:58:47.794207 IP 192.168.43.146.8880 > 192.168.43.147.7772: UDP, length 120
02:58:47.844205 IP 192.168.43.146.8880 > 192.168.43.147.7772: UDP, length 120
02:58:47.882737 IP 192.168.43.124.8880 > 192.168.43.146.7771: UDP, length 120
02:58:47.883025 IP 192.168.43.124.8880 > 192.168.43.146.7771: UDP, length 120
02:58:47.883138 IP 192.168.43.124.8880 > 192.168.43.146.7771: UDP, length 120
02:58:47.894209 IP 192.168.43.146.8880 > 192.168.43.147.7772: UDP, length 120
02:58:47.937624 IP 192.168.43.124.8880 > 192.168.43.146.7771: UDP, length 120
02:58:47.944217 IP 192.168.43.146.8880 > 192.168.43.147.7772: UDP, length 120
02:58:47.987685 IP 192.168.43.124.8880 > 192.168.43.146.7771: UDP, length 120
02:58:47.994208 IP 192.168.43.146.8880 > 192.168.43.147.7772: UDP, length 120
02:58:48.039149 IP 192.168.43.124.8880 > 192.168.43.146.7771: UDP, length 120
02:58:48.044219 IP 192.168.43.146.8880 > 192.168.43.147.7772: UDP, length 120
02:58:48.094210 IP 192.168.43.146.8880 > 192.168.43.147.7772: UDP, length 120
02:58:48.144209 IP 192.168.43.146.8880 > 192.168.43.147.7772: UDP, length 120
02:58:48.197798 IP 192.168.43.146.8880 > 192.168.43.147.7772: UDP, length 120
02:58:48.231962 IP 192.168.43.124.8880 > 192.168.43.146.7771: UDP, length 120
02:58:48.232344 IP 192.168.43.124.8880 > 192.168.43.146.7771: UDP, length 120
02:58:48.232485 IP 192.168.43.124.8880 > 192.168.43.146.7771: UDP, length 120
02:58:48.232740 IP 192.168.43.124.8880 > 192.168.43.146.7771: UDP, length 120
02:58:48.244309 IP 192.168.43.146.8880 > 192.168.43.147.7772: UDP, length 120
02:58:48.290026 IP 192.168.43.124.8880 > 192.168.43.146.7771: UDP, length 120
02:58:48.294268 IP 192.168.43.146.8880 > 192.168.43.147.7772: UDP, length 120
02:58:48.338531 IP 192.168.43.124.8880 > 192.168.43.146.7771: UDP, length 120
02:58:48.344216 IP 192.168.43.146.8880 > 192.168.43.147.7772: UDP, length 120
02:58:48.387106 IP 192.168.43.124.8880 > 192.168.43.146.7771: UDP, length 120
02:58:48.394213 IP 192.168.43.146.8880 > 192.168.43.147.7772: UDP, length 120
02:58:48.444259 IP 192.168.43.146.8880 > 192.168.43.147.7772: UDP, length 120
02:58:48.494220 IP 192.168.43.146.8880 > 192.168.43.147.7772: UDP, length 120
02:58:48.544210 IP 192.168.43.146.8880 > 192.168.43.147.7772: UDP, length 120
02:58:48.591414 IP 192.168.43.124.8880 > 192.168.43.146.7771: UDP, length 120
02:58:48.591753 IP 192.168.43.124.8880 > 192.168.43.146.7771: UDP, length 120
02:58:48.591890 IP 192.168.43.124.8880 > 192.168.43.146.7771: UDP, length 120
02:58:48.592023 IP 192.168.43.124.8880 > 192.168.43.146.7771: UDP, length 120
02:58:48.594216 IP 192.168.43.146.8880 > 192.168.43.147.7772: UDP, length 120
02:58:48.640461 IP 192.168.43.124.8880 > 192.168.43.146.7771: UDP, length 120
02:58:48.644213 IP 192.168.43.146.8880 > 192.168.43.147.7772: UDP, length 120
02:58:48.690407 IP 192.168.43.124.8880 > 192.168.43.146.7771: UDP, length 120
02:58:48.694209 IP 192.168.43.146.8880 > 192.168.43.147.7772: UDP, length 120
02:58:48.739043 IP 192.168.43.124.8880 > 192.168.43.146.7771: UDP, length 120
02:58:48.744212 IP 192.168.43.146.8880 > 192.168.43.147.7772: UDP, length 120
02:58:48.794208 IP 192.168.43.146.8880 > 192.168.43.147.7772: UDP, length 120
02:58:48.844207 IP 192.168.43.146.8880 > 192.168.43.147.7772: UDP, length 120
02:58:48.894207 IP 192.168.43.146.8880 > 192.168.43.147.7772: UDP, length 120
02:58:48.929027 IP 192.168.43.124.8880 > 192.168.43.146.7771: UDP, length 120
02:58:48.929298 IP 192.168.43.124.8880 > 192.168.43.146.7771: UDP, length 120
02:58:48.929428 IP 192.168.43.124.8880 > 192.168.43.146.7771: UDP, length 120
02:58:48.929558 IP 192.168.43.124.8880 > 192.168.43.146.7771: UDP, length 120
02:58:48.944212 IP 192.168.43.146.8880 > 192.168.43.147.7772: UDP, length 120
02:58:48.983161 IP 192.168.43.124.8880 > 192.168.43.146.7771: UDP, length 120
02:58:48.994209 IP 192.168.43.146.8880 > 192.168.43.147.7772: UDP, length 120
02:58:49.030085 IP 192.168.43.124.8880 > 192.168.43.146.7771: UDP, length 120
02:58:49.044226 IP 192.168.43.146.8880 > 192.168.43.147.7772: UDP, length 120
02:58:49.085593 IP 192.168.43.124.8880 > 192.168.43.146.7771: UDP, length 120
02:58:49.094222 IP 192.168.43.146.8880 > 192.168.43.147.7772: UDP, length 120
02:58:49.144208 IP 192.168.43.146.8880 > 192.168.43.147.7772: UDP, length 120
02:58:49.194205 IP 192.168.43.146.8880 > 192.168.43.147.7772: UDP, length 120
02:58:49.244206 IP 192.168.43.146.8880 > 192.168.43.147.7772: UDP, length 120
02:58:49.278195 IP 192.168.43.124.8880 > 192.168.43.146.7771: UDP, length 120
02:58:49.278369 IP 192.168.43.124.8880 > 192.168.43.146.7771: UDP, length 120
02:58:49.278482 IP 192.168.43.124.8880 > 192.168.43.146.7771: UDP, length 120
02:58:49.278902 IP 192.168.43.124.8880 > 192.168.43.146.7771: UDP, length 120
02:58:49.294259 IP 192.168.43.146.8880 > 192.168.43.147.7772: UDP, length 120
02:58:49.331835 IP 192.168.43.124.8880 > 192.168.43.146.7771: UDP, length 120
02:58:49.344220 IP 192.168.43.146.8880 > 192.168.43.147.7772: UDP, length 120
02:58:49.382372 IP 192.168.43.124.8880 > 192.168.43.146.7771: UDP, length 120
02:58:49.394212 IP 192.168.43.146.8880 > 192.168.43.147.7772: UDP, length 120
02:58:49.430403 IP 192.168.43.124.8880 > 192.168.43.146.7771: UDP, length 120
02:58:49.444209 IP 192.168.43.146.8880 > 192.168.43.147.7772: UDP, length 120
02:58:49.483570 IP 192.168.43.124.8880 > 192.168.43.146.7771: UDP, length 120
02:58:49.494219 IP 192.168.43.146.8880 > 192.168.43.147.7772: UDP, length 120
02:58:49.530863 IP 192.168.43.124.8880 > 192.168.43.146.7771: UDP, length 120
02:58:49.544213 IP 192.168.43.146.8880 > 192.168.43.147.7772: UDP, length 120
02:58:49.583433 IP 192.168.43.124.8880 > 192.168.43.146.7771: UDP, length 120
02:58:49.594216 IP 192.168.43.146.8880 > 192.168.43.147.7772: UDP, length 120
02:58:49.639057 IP 192.168.43.124.8880 > 192.168.43.146.7771: UDP, length 120
02:58:49.644216 IP 192.168.43.146.8880 > 192.168.43.147.7772: UDP, length 120
02:58:49.689808 IP 192.168.43.124.8880 > 192.168.43.146.7771: UDP, length 120
02:58:49.694252 IP 192.168.43.146.8880 > 192.168.43.147.7772: UDP, length 120
02:58:49.740261 IP 192.168.43.124.8880 > 192.168.43.146.7771: UDP, length 120
02:58:49.744219 IP 192.168.43.146.8880 > 192.168.43.147.7772: UDP, length 120
02:58:49.788221 IP 192.168.43.124.8880 > 192.168.43.146.7771: UDP, length 120
02:58:49.794215 IP 192.168.43.146.8880 > 192.168.43.147.7772: UDP, length 120
02:58:49.836268 IP 192.168.43.124.8880 > 192.168.43.146.7771: UDP, length 120
02:58:49.844211 IP 192.168.43.146.8880 > 192.168.43.147.7772: UDP, length 120
02:58:49.890020 IP 192.168.43.124.8880 > 192.168.43.146.7771: UDP, length 120
02:58:49.894209 IP 192.168.43.146.8880 > 192.168.43.147.7772: UDP, length 120
02:58:49.938760 IP 192.168.43.124.8880 > 192.168.43.146.7771: UDP, length 120
02:58:49.944210 IP 192.168.43.146.8880 > 192.168.43.147.7772: UDP, length 120
02:58:49.994205 IP 192.168.43.146.8880 > 192.168.43.147.7772: UDP, length 120
02:58:50.010510 IP 192.168.43.124.8880 > 192.168.43.146.7771: UDP, length 120
02:58:50.030550 IP 192.168.43.124.8880 > 192.168.43.146.7771: UDP, length 120
02:58:50.044212 IP 192.168.43.146.8880 > 192.168.43.147.7772: UDP, length 120
02:58:50.080161 IP 192.168.43.124.8880 > 192.168.43.146.7771: UDP, length 120
02:58:50.094224 IP 192.168.43.146.8880 > 192.168.43.147.7772: UDP, length 120
02:58:50.130349 IP 192.168.43.124.8880 > 192.168.43.146.7771: UDP, length 120
02:58:50.144221 IP 192.168.43.146.8880 > 192.168.43.147.7772: UDP, length 120
02:58:50.190676 IP 192.168.43.124.8880 > 192.168.43.146.7771: UDP, length 120
02:58:50.194208 IP 192.168.43.146.8880 > 192.168.43.147.7772: UDP, length 120
02:58:50.244206 IP 192.168.43.146.8880 > 192.168.43.147.7772: UDP, length 120
02:58:50.246024 IP 192.168.43.124.8880 > 192.168.43.146.7771: UDP, length 120
02:58:50.294272 IP 192.168.43.146.8880 > 192.168.43.147.7772: UDP, length 120
02:58:50.297771 IP 192.168.43.124.8880 > 192.168.43.146.7771: UDP, length 120
02:58:50.344229 IP 192.168.43.146.8880 > 192.168.43.147.7772: UDP, length 120
02:58:50.348455 IP 192.168.43.124.8880 > 192.168.43.146.7771: UDP, length 120
02:58:50.380510 IP 192.168.43.124.8880 > 192.168.43.146.7771: UDP, length 120
02:58:50.394214 IP 192.168.43.146.8880 > 192.168.43.147.7772: UDP, length 120
02:58:50.430495 IP 192.168.43.124.8880 > 192.168.43.146.7771: UDP, length 120
02:58:50.444209 IP 192.168.43.146.8880 > 192.168.43.147.7772: UDP, length 120
02:58:50.480351 IP 192.168.43.124.8880 > 192.168.43.146.7771: UDP, length 120
02:58:50.494218 IP 192.168.43.146.8880 > 192.168.43.147.7772: UDP, length 120
02:58:50.530489 IP 192.168.43.124.8880 > 192.168.43.146.7771: UDP, length 120
02:58:50.544208 IP 192.168.43.146.8880 > 192.168.43.147.7772: UDP, length 120
02:58:50.580459 IP 192.168.43.124.8880 > 192.168.43.146.7771: UDP, length 120
02:58:50.594210 IP 192.168.43.146.8880 > 192.168.43.147.7772: UDP, length 120
02:58:50.630465 IP 192.168.43.124.8880 > 192.168.43.146.7771: UDP, length 120
02:58:50.644209 IP 192.168.43.146.8880 > 192.168.43.147.7772: UDP, length 120
02:58:50.684030 IP 192.168.43.124.8880 > 192.168.43.146.7771: UDP, length 120
02:58:50.694201 IP 192.168.43.146.8880 > 192.168.43.147.7772: UDP, length 120
02:58:50.737842 IP 192.168.43.124.8880 > 192.168.43.146.7771: UDP, length 120
02:58:50.744204 IP 192.168.43.146.8880 > 192.168.43.147.7772: UDP, length 120
02:58:50.794203 IP 192.168.43.146.8880 > 192.168.43.147.7772: UDP, length 120
02:58:50.795645 IP 192.168.43.124.8880 > 192.168.43.146.7771: UDP, length 120
02:58:50.843146 IP 192.168.43.124.8880 > 192.168.43.146.7771: UDP, length 120
02:58:50.844205 IP 192.168.43.146.8880 > 192.168.43.147.7772: UDP, length 120
02:58:50.890859 IP 192.168.43.124.8880 > 192.168.43.146.7771: UDP, length 120
02:58:50.894202 IP 192.168.43.146.8880 > 192.168.43.147.7772: UDP, length 120
02:58:50.939452 IP 192.168.43.124.8880 > 192.168.43.146.7771: UDP, length 120
02:58:50.944203 IP 192.168.43.146.8880 > 192.168.43.147.7772: UDP, length 120
02:58:50.993211 IP 192.168.43.124.8880 > 192.168.43.146.7771: UDP, length 120
02:58:50.994203 IP 192.168.43.146.8880 > 192.168.43.147.7772: UDP, length 120
02:58:51.042565 IP 192.168.43.124.8880 > 192.168.43.146.7771: UDP, length 120
02:58:51.044205 IP 192.168.43.146.8880 > 192.168.43.147.7772: UDP, length 120
02:58:51.091016 IP 192.168.43.124.8880 > 192.168.43.146.7771: UDP, length 120
02:58:51.094207 IP 192.168.43.146.8880 > 192.168.43.147.7772: UDP, length 120
02:58:51.139863 IP 192.168.43.124.8880 > 192.168.43.146.7771: UDP, length 120
02:58:51.144220 IP 192.168.43.146.8880 > 192.168.43.147.7772: UDP, length 120
02:58:51.186758 IP 192.168.43.124.8880 > 192.168.43.146.7771: UDP, length 120
02:58:51.194264 IP 192.168.43.146.8880 > 192.168.43.147.7772: UDP, length 120
02:58:51.240163 IP 192.168.43.124.8880 > 192.168.43.146.7771: UDP, length 120
02:58:51.244233 IP 192.168.43.146.8880 > 192.168.43.147.7772: UDP, length 120
02:58:51.280108 IP 192.168.43.124.8880 > 192.168.43.146.7771: UDP, length 120
02:58:51.294295 IP 192.168.43.146.8880 > 192.168.43.147.7772: UDP, length 120
02:58:51.338539 IP 192.168.43.124.8880 > 192.168.43.146.7771: UDP, length 120
02:58:51.344261 IP 192.168.43.146.8880 > 192.168.43.147.7772: UDP, length 120
02:58:51.380329 IP 192.168.43.124.8880 > 192.168.43.146.7771: UDP, length 120
02:58:51.394217 IP 192.168.43.146.8880 > 192.168.43.147.7772: UDP, length 120
02:58:51.432344 IP 192.168.43.124.8880 > 192.168.43.146.7771: UDP, length 120
02:58:51.444213 IP 192.168.43.146.8880 > 192.168.43.147.7772: UDP, length 120
02:58:51.480539 IP 192.168.43.124.8880 > 192.168.43.146.7771: UDP, length 120
02:58:51.494220 IP 192.168.43.146.8880 > 192.168.43.147.7772: UDP, length 120
02:58:51.529664 IP 192.168.43.124.8880 > 192.168.43.146.7771: UDP, length 120
02:58:51.544218 IP 192.168.43.146.8880 > 192.168.43.147.7772: UDP, length 120
02:58:51.580065 IP 192.168.43.124.8880 > 192.168.43.146.7771: UDP, length 120
02:58:51.594212 IP 192.168.43.146.8880 > 192.168.43.147.7772: UDP, length 120
02:58:51.630417 IP 192.168.43.124.8880 > 192.168.43.146.7771: UDP, length 120
02:58:51.644214 IP 192.168.43.146.8880 > 192.168.43.147.7772: UDP, length 120
02:58:51.680277 IP 192.168.43.124.8880 > 192.168.43.146.7771: UDP, length 120
02:58:51.694315 IP 192.168.43.146.8880 > 192.168.43.147.7772: UDP, length 120
02:58:51.731875 IP 192.168.43.124.8880 > 192.168.43.146.7771: UDP, length 120
02:58:51.744316 IP 192.168.43.146.8880 > 192.168.43.147.7772: UDP, length 120
02:58:51.780456 IP 192.168.43.124.8880 > 192.168.43.146.7771: UDP, length 120
02:58:51.794292 IP 192.168.43.146.8880 > 192.168.43.147.7772: UDP, length 120
02:58:51.830258 IP 192.168.43.124.8880 > 192.168.43.146.7771: UDP, length 120
02:58:51.844265 IP 192.168.43.146.8880 > 192.168.43.147.7772: UDP, length 120
02:58:51.880273 IP 192.168.43.124.8880 > 192.168.43.146.7771: UDP, length 120
02:58:51.894290 IP 192.168.43.146.8880 > 192.168.43.147.7772: UDP, length 120
02:58:51.930520 IP 192.168.43.124.8880 > 192.168.43.146.7771: UDP, length 120
02:58:51.944242 IP 192.168.43.146.8880 > 192.168.43.147.7772: UDP, length 120
02:58:51.980298 IP 192.168.43.124.8880 > 192.168.43.146.7771: UDP, length 120
02:58:51.994287 IP 192.168.43.146.8880 > 192.168.43.147.7772: UDP, length 120
02:58:52.033013 IP 192.168.43.124.8880 > 192.168.43.146.7771: UDP, length 120
02:58:52.044248 IP 192.168.43.146.8880 > 192.168.43.147.7772: UDP, length 120
02:58:52.080425 IP 192.168.43.124.8880 > 192.168.43.146.7771: UDP, length 120
02:58:52.094278 IP 192.168.43.146.8880 > 192.168.43.147.7772: UDP, length 120
02:58:52.130264 IP 192.168.43.124.8880 > 192.168.43.146.7771: UDP, length 120
02:58:52.144237 IP 192.168.43.146.8880 > 192.168.43.147.7772: UDP, length 120
02:58:52.180212 IP 192.168.43.124.8880 > 192.168.43.146.7771: UDP, length 120
02:58:52.194193 IP 192.168.43.146.8880 > 192.168.43.147.7772: UDP, length 120
02:58:52.230287 IP 192.168.43.124.8880 > 192.168.43.146.7771: UDP, length 120
02:58:52.244194 IP 192.168.43.146.8880 > 192.168.43.147.7772: UDP, length 120
02:58:52.280178 IP 192.168.43.124.8880 > 192.168.43.146.7771: UDP, length 120
02:58:52.294190 IP 192.168.43.146.8880 > 192.168.43.147.7772: UDP, length 120
02:58:52.331886 IP 192.168.43.124.8880 > 192.168.43.146.7771: UDP, length 120
02:58:52.344219 IP 192.168.43.146.8880 > 192.168.43.147.7772: UDP, length 120
02:58:52.380139 IP 192.168.43.124.8880 > 192.168.43.146.7771: UDP, length 120
02:58:52.394184 IP 192.168.43.146.8880 > 192.168.43.147.7772: UDP, length 120
02:58:52.430076 IP 192.168.43.124.8880 > 192.168.43.146.7771: UDP, length 120
02:58:52.444184 IP 192.168.43.146.8880 > 192.168.43.147.7772: UDP, length 120
02:58:52.482737 IP 192.168.43.124.8880 > 192.168.43.146.7771: UDP, length 120
02:58:52.494190 IP 192.168.43.146.8880 > 192.168.43.147.7772: UDP, length 120
02:58:52.530108 IP 192.168.43.124.8880 > 192.168.43.146.7771: UDP, length 120
02:58:52.544183 IP 192.168.43.146.8880 > 192.168.43.147.7772: UDP, length 120
02:58:52.580077 IP 192.168.43.124.8880 > 192.168.43.146.7771: UDP, length 120
02:58:52.594183 IP 192.168.43.146.8880 > 192.168.43.147.7772: UDP, length 120
02:58:52.631350 IP 192.168.43.124.8880 > 192.168.43.146.7771: UDP, length 120
02:58:52.644210 IP 192.168.43.146.8880 > 192.168.43.147.7772: UDP, length 120
02:58:52.682542 IP 192.168.43.124.8880 > 192.168.43.146.7771: UDP, length 120
02:58:52.694262 IP 192.168.43.146.8880 > 192.168.43.147.7772: UDP, length 120
02:58:52.737811 IP 192.168.43.124.8880 > 192.168.43.146.7771: UDP, length 120
02:58:52.744239 IP 192.168.43.146.8880 > 192.168.43.147.7772: UDP, length 120
02:58:52.787304 IP 192.168.43.124.8880 > 192.168.43.146.7771: UDP, length 120
02:58:52.794211 IP 192.168.43.146.8880 > 192.168.43.147.7772: UDP, length 120
02:58:52.837641 IP 192.168.43.124.8880 > 192.168.43.146.7771: UDP, length 120
02:58:52.844210 IP 192.168.43.146.8880 > 192.168.43.147.7772: UDP, length 120
02:58:52.887059 IP 192.168.43.124.8880 > 192.168.43.146.7771: UDP, length 120
02:58:52.894209 IP 192.168.43.146.8880 > 192.168.43.147.7772: UDP, length 120
02:58:52.937627 IP 192.168.43.124.8880 > 192.168.43.146.7771: UDP, length 120
02:58:52.944210 IP 192.168.43.146.8880 > 192.168.43.147.7772: UDP, length 120
02:58:52.986792 IP 192.168.43.124.8880 > 192.168.43.146.7771: UDP, length 120
02:58:52.994208 IP 192.168.43.146.8880 > 192.168.43.147.7772: UDP, length 120
02:58:53.037726 IP 192.168.43.124.8880 > 192.168.43.146.7771: UDP, length 120
02:58:53.044212 IP 192.168.43.146.8880 > 192.168.43.147.7772: UDP, length 120
02:58:53.088524 IP 192.168.43.124.8880 > 192.168.43.146.7771: UDP, length 120
02:58:53.094210 IP 192.168.43.146.8880 > 192.168.43.147.7772: UDP, length 120
02:58:53.139136 IP 192.168.43.124.8880 > 192.168.43.146.7771: UDP, length 120
02:58:53.144211 IP 192.168.43.146.8880 > 192.168.43.147.7772: UDP, length 120
02:58:53.188319 IP 192.168.43.124.8880 > 192.168.43.146.7771: UDP, length 120
02:58:53.194209 IP 192.168.43.146.8880 > 192.168.43.147.7772: UDP, length 120
02:58:53.236762 IP 192.168.43.124.8880 > 192.168.43.146.7771: UDP, length 120
02:58:53.244213 IP 192.168.43.146.8880 > 192.168.43.147.7772: UDP, length 120
02:58:53.285357 IP 192.168.43.124.8880 > 192.168.43.146.7771: UDP, length 120
02:58:53.294217 IP 192.168.43.146.8880 > 192.168.43.147.7772: UDP, length 120
02:58:53.337393 IP 192.168.43.124.8880 > 192.168.43.146.7771: UDP, length 120
02:58:53.344254 IP 192.168.43.146.8880 > 192.168.43.147.7772: UDP, length 120
02:58:53.389355 IP 192.168.43.124.8880 > 192.168.43.146.7771: UDP, length 120
02:58:53.394213 IP 192.168.43.146.8880 > 192.168.43.147.7772: UDP, length 120
02:58:53.437701 IP 192.168.43.124.8880 > 192.168.43.146.7771: UDP, length 120
02:58:53.444215 IP 192.168.43.146.8880 > 192.168.43.147.7772: UDP, length 120
02:58:53.487677 IP 192.168.43.124.8880 > 192.168.43.146.7771: UDP, length 120
02:58:53.494219 IP 192.168.43.146.8880 > 192.168.43.147.7772: UDP, length 120
02:58:53.540248 IP 192.168.43.124.8880 > 192.168.43.146.7771: UDP, length 120
02:58:53.544211 IP 192.168.43.146.8880 > 192.168.43.147.7772: UDP, length 120
02:58:53.590487 IP 192.168.43.124.8880 > 192.168.43.146.7771: UDP, length 120
02:58:53.594212 IP 192.168.43.146.8880 > 192.168.43.147.7772: UDP, length 120
02:58:53.640068 IP 192.168.43.124.8880 > 192.168.43.146.7771: UDP, length 120
02:58:53.644211 IP 192.168.43.146.8880 > 192.168.43.147.7772: UDP, length 120
02:58:53.689796 IP 192.168.43.124.8880 > 192.168.43.146.7771: UDP, length 120
02:58:53.694209 IP 192.168.43.146.8880 > 192.168.43.147.7772: UDP, length 120
02:58:53.738825 IP 192.168.43.124.8880 > 192.168.43.146.7771: UDP, length 120
02:58:53.744209 IP 192.168.43.146.8880 > 192.168.43.147.7772: UDP, length 120
02:58:53.790478 IP 192.168.43.124.8880 > 192.168.43.146.7771: UDP, length 120
02:58:53.794207 IP 192.168.43.146.8880 > 192.168.43.147.7772: UDP, length 120
02:58:53.838179 IP 192.168.43.124.8880 > 192.168.43.146.7771: UDP, length 120
02:58:53.844211 IP 192.168.43.146.8880 > 192.168.43.147.7772: UDP, length 120
02:58:53.894207 IP 192.168.43.146.8880 > 192.168.43.147.7772: UDP, length 120
02:58:53.907557 IP 192.168.43.124.8880 > 192.168.43.146.7771: UDP, length 120
02:58:53.933013 IP 192.168.43.124.8880 > 192.168.43.146.7771: UDP, length 120
02:58:53.944208 IP 192.168.43.146.8880 > 192.168.43.147.7772: UDP, length 120
02:58:53.979388 IP 192.168.43.124.8880 > 192.168.43.146.7771: UDP, length 120
02:58:53.994207 IP 192.168.43.146.8880 > 192.168.43.147.7772: UDP, length 120
02:58:54.029749 IP 192.168.43.124.8880 > 192.168.43.146.7771: UDP, length 120
02:58:54.044209 IP 192.168.43.146.8880 > 192.168.43.147.7772: UDP, length 120
02:58:54.080128 IP 192.168.43.124.8880 > 192.168.43.146.7771: UDP, length 120
02:58:54.094208 IP 192.168.43.146.8880 > 192.168.43.147.7772: UDP, length 120
02:58:54.130505 IP 192.168.43.124.8880 > 192.168.43.146.7771: UDP, length 120
02:58:54.144209 IP 192.168.43.146.8880 > 192.168.43.147.7772: UDP, length 120
02:58:54.180091 IP 192.168.43.124.8880 > 192.168.43.146.7771: UDP, length 120
02:58:54.194208 IP 192.168.43.146.8880 > 192.168.43.147.7772: UDP, length 120
02:58:54.230222 IP 192.168.43.124.8880 > 192.168.43.146.7771: UDP, length 120
02:58:54.244242 IP 192.168.43.146.8880 > 192.168.43.147.7772: UDP, length 120
02:58:54.280200 IP 192.168.43.124.8880 > 192.168.43.146.7771: UDP, length 120
02:58:54.294215 IP 192.168.43.146.8880 > 192.168.43.147.7772: UDP, length 120
02:58:54.330210 IP 192.168.43.124.8880 > 192.168.43.146.7771: UDP, length 120
02:58:54.344215 IP 192.168.43.146.8880 > 192.168.43.147.7772: UDP, length 120
02:58:54.380214 IP 192.168.43.124.8880 > 192.168.43.146.7771: UDP, length 120
02:58:54.394214 IP 192.168.43.146.8880 > 192.168.43.147.7772: UDP, length 120
02:58:54.430358 IP 192.168.43.124.8880 > 192.168.43.146.7771: UDP, length 120
02:58:54.444213 IP 192.168.43.146.8880 > 192.168.43.147.7772: UDP, length 120
02:58:54.482086 IP 192.168.43.124.8880 > 192.168.43.146.7771: UDP, length 120
02:58:54.494221 IP 192.168.43.146.8880 > 192.168.43.147.7772: UDP, length 120
02:58:54.530249 IP 192.168.43.124.8880 > 192.168.43.146.7771: UDP, length 120
02:58:54.544213 IP 192.168.43.146.8880 > 192.168.43.147.7772: UDP, length 120
02:58:54.580123 IP 192.168.43.124.8880 > 192.168.43.146.7771: UDP, length 120
02:58:54.594208 IP 192.168.43.146.8880 > 192.168.43.147.7772: UDP, length 120
02:58:54.631650 IP 192.168.43.124.8880 > 192.168.43.146.7771: UDP, length 120
02:58:54.644211 IP 192.168.43.146.8880 > 192.168.43.147.7772: UDP, length 120
02:58:54.680095 IP 192.168.43.124.8880 > 192.168.43.146.7771: UDP, length 120
02:58:54.694208 IP 192.168.43.146.8880 > 192.168.43.147.7772: UDP, length 120
02:58:54.730016 IP 192.168.43.124.8880 > 192.168.43.146.7771: UDP, length 120
02:58:54.744210 IP 192.168.43.146.8880 > 192.168.43.147.7772: UDP, length 120
02:58:54.780580 IP 192.168.43.124.8880 > 192.168.43.146.7771: UDP, length 120
02:58:54.794210 IP 192.168.43.146.8880 > 192.168.43.147.7772: UDP, length 120
02:58:54.830010 IP 192.168.43.124.8880 > 192.168.43.146.7771: UDP, length 120
02:58:54.844211 IP 192.168.43.146.8880 > 192.168.43.147.7772: UDP, length 120
02:58:54.880084 IP 192.168.43.124.8880 > 192.168.43.146.7771: UDP, length 120
02:58:54.894209 IP 192.168.43.146.8880 > 192.168.43.147.7772: UDP, length 120
02:58:54.930095 IP 192.168.43.124.8880 > 192.168.43.146.7771: UDP, length 120
02:58:54.944211 IP 192.168.43.146.8880 > 192.168.43.147.7772: UDP, length 120
02:58:54.982172 IP 192.168.43.124.8880 > 192.168.43.146.7771: UDP, length 120
02:58:54.994209 IP 192.168.43.146.8880 > 192.168.43.147.7772: UDP, length 120
02:58:55.030107 IP 192.168.43.124.8880 > 192.168.43.146.7771: UDP, length 120
02:58:55.044210 IP 192.168.43.146.8880 > 192.168.43.147.7772: UDP, length 120
02:58:55.080158 IP 192.168.43.124.8880 > 192.168.43.146.7771: UDP, length 120
02:58:55.094213 IP 192.168.43.146.8880 > 192.168.43.147.7772: UDP, length 120
02:58:55.130092 IP 192.168.43.124.8880 > 192.168.43.146.7771: UDP, length 120
02:58:55.144209 IP 192.168.43.146.8880 > 192.168.43.147.7772: UDP, length 120
02:58:55.180143 IP 192.168.43.124.8880 > 192.168.43.146.7771: UDP, length 120
02:58:55.194208 IP 192.168.43.146.8880 > 192.168.43.147.7772: UDP, length 120
02:58:55.231495 IP 192.168.43.124.8880 > 192.168.43.146.7771: UDP, length 120
02:58:55.244210 IP 192.168.43.146.8880 > 192.168.43.147.7772: UDP, length 120
02:58:55.281147 IP 192.168.43.124.8880 > 192.168.43.146.7771: UDP, length 120
02:58:55.294207 IP 192.168.43.146.8880 > 192.168.43.147.7772: UDP, length 120
02:58:55.333467 IP 192.168.43.124.8880 > 192.168.43.146.7771: UDP, length 120
02:58:55.344294 IP 192.168.43.146.8880 > 192.168.43.147.7772: UDP, length 120
02:58:55.388105 IP 192.168.43.124.8880 > 192.168.43.146.7771: UDP, length 120
02:58:55.394306 IP 192.168.43.146.8880 > 192.168.43.147.7772: UDP, length 120
02:58:55.439624 IP 192.168.43.124.8880 > 192.168.43.146.7771: UDP, length 120
02:58:55.444253 IP 192.168.43.146.8880 > 192.168.43.147.7772: UDP, length 120
02:58:55.488869 IP 192.168.43.124.8880 > 192.168.43.146.7771: UDP, length 120
02:58:55.494223 IP 192.168.43.146.8880 > 192.168.43.147.7772: UDP, length 120
02:58:55.540992 IP 192.168.43.124.8880 > 192.168.43.146.7771: UDP, length 120
02:58:55.544188 IP 192.168.43.146.8880 > 192.168.43.147.7772: UDP, length 120
02:58:55.591203 IP 192.168.43.124.8880 > 192.168.43.146.7771: UDP, length 120
02:58:55.594182 IP 192.168.43.146.8880 > 192.168.43.147.7772: UDP, length 120
02:58:55.639644 IP 192.168.43.124.8880 > 192.168.43.146.7771: UDP, length 120
02:58:55.644180 IP 192.168.43.146.8880 > 192.168.43.147.7772: UDP, length 120
02:58:55.689883 IP 192.168.43.124.8880 > 192.168.43.146.7771: UDP, length 120
02:58:55.694180 IP 192.168.43.146.8880 > 192.168.43.147.7772: UDP, length 120
02:58:55.738220 IP 192.168.43.124.8880 > 192.168.43.146.7771: UDP, length 120
02:58:55.744208 IP 192.168.43.146.8880 > 192.168.43.147.7772: UDP, length 120
02:58:55.789247 IP 192.168.43.124.8880 > 192.168.43.146.7771: UDP, length 120
02:58:55.794185 IP 192.168.43.146.8880 > 192.168.43.147.7772: UDP, length 120
02:58:55.838801 IP 192.168.43.124.8880 > 192.168.43.146.7771: UDP, length 120
02:58:55.844181 IP 192.168.43.146.8880 > 192.168.43.147.7772: UDP, length 120
02:58:55.888478 IP 192.168.43.124.8880 > 192.168.43.146.7771: UDP, length 120
02:58:55.894179 IP 192.168.43.146.8880 > 192.168.43.147.7772: UDP, length 120
02:58:55.937510 IP 192.168.43.124.8880 > 192.168.43.146.7771: UDP, length 120
02:58:55.944179 IP 192.168.43.146.8880 > 192.168.43.147.7772: UDP, length 120
02:58:55.986858 IP 192.168.43.124.8880 > 192.168.43.146.7771: UDP, length 120
02:58:55.994182 IP 192.168.43.146.8880 > 192.168.43.147.7772: UDP, length 120
02:58:56.038127 IP 192.168.43.124.8880 > 192.168.43.146.7771: UDP, length 120
02:58:56.044180 IP 192.168.43.146.8880 > 192.168.43.147.7772: UDP, length 120
02:58:56.088399 IP 192.168.43.124.8880 > 192.168.43.146.7771: UDP, length 120
02:58:56.094182 IP 192.168.43.146.8880 > 192.168.43.147.7772: UDP, length 120
02:58:56.138114 IP 192.168.43.124.8880 > 192.168.43.146.7771: UDP, length 120
02:58:56.144180 IP 192.168.43.146.8880 > 192.168.43.147.7772: UDP, length 120
02:58:56.187354 IP 192.168.43.124.8880 > 192.168.43.146.7771: UDP, length 120
02:58:56.194179 IP 192.168.43.146.8880 > 192.168.43.147.7772: UDP, length 120
02:58:56.238504 IP 192.168.43.124.8880 > 192.168.43.146.7771: UDP, length 120
02:58:56.244179 IP 192.168.43.146.8880 > 192.168.43.147.7772: UDP, length 120
02:58:56.287963 IP 192.168.43.124.8880 > 192.168.43.146.7771: UDP, length 120
02:58:56.294179 IP 192.168.43.146.8880 > 192.168.43.147.7772: UDP, length 120
02:58:56.338280 IP 192.168.43.124.8880 > 192.168.43.146.7771: UDP, length 120
02:58:56.344180 IP 192.168.43.146.8880 > 192.168.43.147.7772: UDP, length 120
02:58:56.387281 IP 192.168.43.124.8880 > 192.168.43.146.7771: UDP, length 120
02:58:56.394181 IP 192.168.43.146.8880 > 192.168.43.147.7772: UDP, length 120
02:58:56.444125 IP 192.168.43.124.8880 > 192.168.43.146.7771: UDP, length 120
02:58:56.444182 IP 192.168.43.146.8880 > 192.168.43.147.7772: UDP, length 120
02:58:56.485665 IP 192.168.43.124.8880 > 192.168.43.146.7771: UDP, length 120
02:58:56.494240 IP 192.168.43.146.8880 > 192.168.43.147.7772: UDP, length 120
02:58:56.530312 IP 192.168.43.124.8880 > 192.168.43.146.7771: UDP, length 120
02:58:56.544202 IP 192.168.43.146.8880 > 192.168.43.147.7772: UDP, length 120
02:58:56.579994 IP 192.168.43.124.8880 > 192.168.43.146.7771: UDP, length 120
02:58:56.594185 IP 192.168.43.146.8880 > 192.168.43.147.7772: UDP, length 120
02:58:56.629893 IP 192.168.43.124.8880 > 192.168.43.146.7771: UDP, length 120
02:58:56.644181 IP 192.168.43.146.8880 > 192.168.43.147.7772: UDP, length 120
02:58:56.680273 IP 192.168.43.124.8880 > 192.168.43.146.7771: UDP, length 120
02:58:56.694179 IP 192.168.43.146.8880 > 192.168.43.147.7772: UDP, length 120
02:58:56.729893 IP 192.168.43.124.8880 > 192.168.43.146.7771: UDP, length 120
02:58:56.744178 IP 192.168.43.146.8880 > 192.168.43.147.7772: UDP, length 120
02:58:56.781741 IP 192.168.43.124.8880 > 192.168.43.146.7771: UDP, length 120
02:58:56.794179 IP 192.168.43.146.8880 > 192.168.43.147.7772: UDP, length 120
02:58:56.829792 IP 192.168.43.124.8880 > 192.168.43.146.7771: UDP, length 120
02:58:56.844179 IP 192.168.43.146.8880 > 192.168.43.147.7772: UDP, length 120
02:58:56.880037 IP 192.168.43.124.8880 > 192.168.43.146.7771: UDP, length 120
02:58:56.894180 IP 192.168.43.146.8880 > 192.168.43.147.7772: UDP, length 120
02:58:56.929996 IP 192.168.43.124.8880 > 192.168.43.146.7771: UDP, length 120
02:58:56.944179 IP 192.168.43.146.8880 > 192.168.43.147.7772: UDP, length 120
02:58:56.979983 IP 192.168.43.124.8880 > 192.168.43.146.7771: UDP, length 120
02:58:56.994180 IP 192.168.43.146.8880 > 192.168.43.147.7772: UDP, length 120
02:58:57.030306 IP 192.168.43.124.8880 > 192.168.43.146.7771: UDP, length 120
02:58:57.044180 IP 192.168.43.146.8880 > 192.168.43.147.7772: UDP, length 120
