01:27:24.842536 IP 192.168.43.147.8880 > 192.168.43.124.7773: UDP, length 120
01:27:24.892571 IP 192.168.43.147.8880 > 192.168.43.124.7773: UDP, length 120
01:27:24.942556 IP 192.168.43.147.8880 > 192.168.43.124.7773: UDP, length 120
01:27:24.992556 IP 192.168.43.147.8880 > 192.168.43.124.7773: UDP, length 120
01:27:24.998861 IP 192.168.43.146.8880 > 192.168.43.147.7772: UDP, length 120
01:27:25.042557 IP 192.168.43.147.8880 > 192.168.43.124.7773: UDP, length 120
01:27:25.064103 IP 192.168.43.146.8880 > 192.168.43.147.7772: UDP, length 120
01:27:25.092556 IP 192.168.43.147.8880 > 192.168.43.124.7773: UDP, length 120
01:27:25.123126 IP 192.168.43.146.8880 > 192.168.43.147.7772: UDP, length 120
01:27:25.142556 IP 192.168.43.147.8880 > 192.168.43.124.7773: UDP, length 120
01:27:25.192556 IP 192.168.43.147.8880 > 192.168.43.124.7773: UDP, length 120
01:27:25.242555 IP 192.168.43.147.8880 > 192.168.43.124.7773: UDP, length 120
01:27:25.291945 IP 192.168.43.146.8880 > 192.168.43.147.7772: UDP, length 120
01:27:25.292087 IP 192.168.43.146.8880 > 192.168.43.147.7772: UDP, length 120
01:27:25.292162 IP 192.168.43.146.8880 > 192.168.43.147.7772: UDP, length 120
01:27:25.292555 IP 192.168.43.147.8880 > 192.168.43.124.7773: UDP, length 120
01:27:25.298984 IP 192.168.43.146.8880 > 192.168.43.147.7772: UDP, length 120
01:27:25.342556 IP 192.168.43.147.8880 > 192.168.43.124.7773: UDP, length 120
01:27:25.374710 IP 192.168.43.146.8880 > 192.168.43.147.7772: UDP, length 120
01:27:25.392585 IP 192.168.43.147.8880 > 192.168.43.124.7773: UDP, length 120
01:27:25.442564 IP 192.168.43.147.8880 > 192.168.43.124.7773: UDP, length 120
01:27:25.468670 IP 192.168.43.146.8880 > 192.168.43.147.7772: UDP, length 120
01:27:25.485333 IP 192.168.43.146.8880 > 192.168.43.147.7772: UDP, length 120
01:27:25.492560 IP 192.168.43.147.8880 > 192.168.43.124.7773: UDP, length 120
01:27:25.542557 IP 192.168.43.147.8880 > 192.168.43.124.7773: UDP, length 120
01:27:25.547374 IP 192.168.43.146.8880 > 192.168.43.147.7772: UDP, length 120
01:27:25.592555 IP 192.168.43.147.8880 > 192.168.43.124.7773: UDP, length 120
01:27:25.598805 IP 192.168.43.146.8880 > 192.168.43.147.7772: UDP, length 120
01:27:25.601985 IP 192.168.43.146.8880 > 192.168.43.147.7772: UDP, length 120
01:27:25.642559 IP 192.168.43.147.8880 > 192.168.43.124.7773: UDP, length 120
01:27:25.692555 IP 192.168.43.147.8880 > 192.168.43.124.7773: UDP, length 120
01:27:25.725798 IP 192.168.43.146.8880 > 192.168.43.147.7772: UDP, length 120
01:27:25.734431 IP 192.168.43.146.8880 > 192.168.43.147.7772: UDP, length 120
01:27:25.742555 IP 192.168.43.147.8880 > 192.168.43.124.7773: UDP, length 120
01:27:25.792555 IP 192.168.43.147.8880 > 192.168.43.124.7773: UDP, length 120
01:27:25.795575 IP 192.168.43.146.8880 > 192.168.43.147.7772: UDP, length 120
01:27:25.824290 IP 192.168.43.146.8880 > 192.168.43.147.7772: UDP, length 120
01:27:25.842572 IP 192.168.43.147.8880 > 192.168.43.124.7773: UDP, length 120
01:27:25.892559 IP 192.168.43.147.8880 > 192.168.43.124.7773: UDP, length 120
01:27:25.910524 IP 192.168.43.146.8880 > 192.168.43.147.7772: UDP, length 120
01:27:25.910689 IP 192.168.43.146.8880 > 192.168.43.147.7772: UDP, length 120
01:27:25.942563 IP 192.168.43.147.8880 > 192.168.43.124.7773: UDP, length 120
01:27:25.969886 IP 192.168.43.146.8880 > 192.168.43.147.7772: UDP, length 120
01:27:25.992557 IP 192.168.43.147.8880 > 192.168.43.124.7773: UDP, length 120
01:27:26.002318 IP 192.168.43.146.8880 > 192.168.43.147.7772: UDP, length 120
01:27:26.042557 IP 192.168.43.147.8880 > 192.168.43.124.7773: UDP, length 120
01:27:26.055139 IP 192.168.43.146.8880 > 192.168.43.147.7772: UDP, length 120
01:27:26.092556 IP 192.168.43.147.8880 > 192.168.43.124.7773: UDP, length 120
01:27:26.107295 IP 192.168.43.146.8880 > 192.168.43.147.7772: UDP, length 120
01:27:26.142557 IP 192.168.43.147.8880 > 192.168.43.124.7773: UDP, length 120
01:27:26.156430 IP 192.168.43.146.8880 > 192.168.43.147.7772: UDP, length 120
01:27:26.192557 IP 192.168.43.147.8880 > 192.168.43.124.7773: UDP, length 120
01:27:26.219384 IP 192.168.43.146.8880 > 192.168.43.147.7772: UDP, length 120
01:27:26.242556 IP 192.168.43.147.8880 > 192.168.43.124.7773: UDP, length 120
01:27:26.248327 IP 192.168.43.146.8880 > 192.168.43.147.7772: UDP, length 120
01:27:26.292556 IP 192.168.43.147.8880 > 192.168.43.124.7773: UDP, length 120
01:27:26.300835 IP 192.168.43.146.8880 > 192.168.43.147.7772: UDP, length 120
01:27:26.342556 IP 192.168.43.147.8880 > 192.168.43.124.7773: UDP, length 120
01:27:26.351259 IP 192.168.43.146.8880 > 192.168.43.147.7772: UDP, length 120
01:27:26.392556 IP 192.168.43.147.8880 > 192.168.43.124.7773: UDP, length 120
01:27:26.412481 IP 192.168.43.146.8880 > 192.168.43.147.7772: UDP, length 120
01:27:26.442557 IP 192.168.43.147.8880 > 192.168.43.124.7773: UDP, length 120
01:27:26.469251 IP 192.168.43.146.8880 > 192.168.43.147.7772: UDP, length 120
01:27:26.492563 IP 192.168.43.147.8880 > 192.168.43.124.7773: UDP, length 120
01:27:26.499097 IP 192.168.43.146.8880 > 192.168.43.147.7772: UDP, length 120
01:27:26.542560 IP 192.168.43.147.8880 > 192.168.43.124.7773: UDP, length 120
01:27:26.552018 IP 192.168.43.146.8880 > 192.168.43.147.7772: UDP, length 120
01:27:26.592558 IP 192.168.43.147.8880 > 192.168.43.124.7773: UDP, length 120
01:27:26.601298 IP 192.168.43.146.8880 > 192.168.43.147.7772: UDP, length 120
01:27:26.642559 IP 192.168.43.147.8880 > 192.168.43.124.7773: UDP, length 120
01:27:26.660638 IP 192.168.43.146.8880 > 192.168.43.147.7772: UDP, length 120
01:27:26.692558 IP 192.168.43.147.8880 > 192.168.43.124.7773: UDP, length 120
01:27:26.718446 IP 192.168.43.146.8880 > 192.168.43.147.7772: UDP, length 120
01:27:26.742568 IP 192.168.43.147.8880 > 192.168.43.124.7773: UDP, length 120
01:27:26.749094 IP 192.168.43.146.8880 > 192.168.43.147.7772: UDP, length 120
01:27:26.792562 IP 192.168.43.147.8880 > 192.168.43.124.7773: UDP, length 120
01:27:26.801612 IP 192.168.43.146.8880 > 192.168.43.147.7772: UDP, length 120
01:27:26.842569 IP 192.168.43.147.8880 > 192.168.43.124.7773: UDP, length 120
01:27:26.851989 IP 192.168.43.146.8880 > 192.168.43.147.7772: UDP, length 120
01:27:26.892634 IP 192.168.43.147.8880 > 192.168.43.124.7773: UDP, length 120
01:27:26.899931 IP 192.168.43.146.8880 > 192.168.43.147.7772: UDP, length 120
01:27:26.942597 IP 192.168.43.147.8880 > 192.168.43.124.7773: UDP, length 120
01:27:26.948743 IP 192.168.43.146.8880 > 192.168.43.147.7772: UDP, length 120
01:27:26.992583 IP 192.168.43.147.8880 > 192.168.43.124.7773: UDP, length 120
01:27:27.001901 IP 192.168.43.146.8880 > 192.168.43.147.7772: UDP, length 120
01:27:27.042582 IP 192.168.43.147.8880 > 192.168.43.124.7773: UDP, length 120
01:27:27.049801 IP 192.168.43.146.8880 > 192.168.43.147.7772: UDP, length 120
01:27:27.092595 IP 192.168.43.147.8880 > 192.168.43.124.7773: UDP, length 120
01:27:27.107124 IP 192.168.43.146.8880 > 192.168.43.147.7772: UDP, length 120
01:27:27.142606 IP 192.168.43.147.8880 > 192.168.43.124.7773: UDP, length 120
01:27:27.148770 IP 192.168.43.146.8880 > 192.168.43.147.7772: UDP, length 120
01:27:27.192587 IP 192.168.43.147.8880 > 192.168.43.124.7773: UDP, length 120
01:27:27.201921 IP 192.168.43.146.8880 > 192.168.43.147.7772: UDP, length 120
01:27:27.242582 IP 192.168.43.147.8880 > 192.168.43.124.7773: UDP, length 120
01:27:27.250195 IP 192.168.43.146.8880 > 192.168.43.147.7772: UDP, length 120
01:27:27.292582 IP 192.168.43.147.8880 > 192.168.43.124.7773: UDP, length 120
01:27:27.298902 IP 192.168.43.146.8880 > 192.168.43.147.7772: UDP, length 120
01:27:27.342581 IP 192.168.43.147.8880 > 192.168.43.124.7773: UDP, length 120
01:27:27.361457 IP 192.168.43.146.8880 > 192.168.43.147.7772: UDP, length 120
01:27:27.392595 IP 192.168.43.147.8880 > 192.168.43.124.7773: UDP, length 120
01:27:27.400290 IP 192.168.43.146.8880 > 192.168.43.147.7772: UDP, length 120
01:27:27.442592 IP 192.168.43.147.8880 > 192.168.43.124.7773: UDP, length 120
01:27:27.456316 IP 192.168.43.146.8880 > 192.168.43.147.7772: UDP, length 120
01:27:27.492585 IP 192.168.43.147.8880 > 192.168.43.124.7773: UDP, length 120
01:27:27.500593 IP 192.168.43.146.8880 > 192.168.43.147.7772: UDP, length 120
01:27:27.542588 IP 192.168.43.147.8880 > 192.168.43.124.7773: UDP, length 120
01:27:27.549671 IP 192.168.43.146.8880 > 192.168.43.147.7772: UDP, length 120
01:27:27.592597 IP 192.168.43.147.8880 > 192.168.43.124.7773: UDP, length 120
01:27:27.626086 IP 192.168.43.146.8880 > 192.168.43.147.7772: UDP, length 120
01:27:27.642614 IP 192.168.43.147.8880 > 192.168.43.124.7773: UDP, length 120
01:27:27.655773 IP 192.168.43.146.8880 > 192.168.43.147.7772: UDP, length 120
01:27:27.692595 IP 192.168.43.147.8880 > 192.168.43.124.7773: UDP, length 120
01:27:27.711241 IP 192.168.43.146.8880 > 192.168.43.147.7772: UDP, length 120
01:27:27.742582 IP 192.168.43.147.8880 > 192.168.43.124.7773: UDP, length 120
01:27:27.786102 IP 192.168.43.146.8880 > 192.168.43.147.7772: UDP, length 120
01:27:27.792582 IP 192.168.43.147.8880 > 192.168.43.124.7773: UDP, length 120
01:27:27.842605 IP 192.168.43.147.8880 > 192.168.43.124.7773: UDP, length 120
01:27:27.846049 IP 192.168.43.146.8880 > 192.168.43.147.7772: UDP, length 120
01:27:27.862376 IP 192.168.43.146.8880 > 192.168.43.147.7772: UDP, length 120
01:27:27.892594 IP 192.168.43.147.8880 > 192.168.43.124.7773: UDP, length 120
01:27:27.901499 IP 192.168.43.146.8880 > 192.168.43.147.7772: UDP, length 120
01:27:27.942596 IP 192.168.43.147.8880 > 192.168.43.124.7773: UDP, length 120
01:27:27.951083 IP 192.168.43.146.8880 > 192.168.43.147.7772: UDP, length 120
01:27:27.992585 IP 192.168.43.147.8880 > 192.168.43.124.7773: UDP, length 120
01:27:28.003855 IP 192.168.43.146.8880 > 192.168.43.147.7772: UDP, length 120
01:27:28.042586 IP 192.168.43.147.8880 > 192.168.43.124.7773: UDP, length 120
01:27:28.054471 IP 192.168.43.146.8880 > 192.168.43.147.7772: UDP, length 120
01:27:28.092585 IP 192.168.43.147.8880 > 192.168.43.124.7773: UDP, length 120
01:27:28.103286 IP 192.168.43.146.8880 > 192.168.43.147.7772: UDP, length 120
01:27:28.142583 IP 192.168.43.147.8880 > 192.168.43.124.7773: UDP, length 120
01:27:28.150760 IP 192.168.43.146.8880 > 192.168.43.147.7772: UDP, length 120
01:27:28.192585 IP 192.168.43.147.8880 > 192.168.43.124.7773: UDP, length 120
01:27:28.205900 IP 192.168.43.146.8880 > 192.168.43.147.7772: UDP, length 120
01:27:28.242618 IP 192.168.43.147.8880 > 192.168.43.124.7773: UDP, length 120
01:27:28.249690 IP 192.168.43.146.8880 > 192.168.43.147.7772: UDP, length 120
01:27:28.292597 IP 192.168.43.147.8880 > 192.168.43.124.7773: UDP, length 120
01:27:28.314109 IP 192.168.43.146.8880 > 192.168.43.147.7772: UDP, length 120
01:27:28.342583 IP 192.168.43.147.8880 > 192.168.43.124.7773: UDP, length 120
01:27:28.355456 IP 192.168.43.146.8880 > 192.168.43.147.7772: UDP, length 120
01:27:28.392620 IP 192.168.43.147.8880 > 192.168.43.124.7773: UDP, length 120
01:27:28.414197 IP 192.168.43.146.8880 > 192.168.43.147.7772: UDP, length 120
01:27:28.442585 IP 192.168.43.147.8880 > 192.168.43.124.7773: UDP, length 120
01:27:28.466727 IP 192.168.43.146.8880 > 192.168.43.147.7772: UDP, length 120
01:27:28.492584 IP 192.168.43.147.8880 > 192.168.43.124.7773: UDP, length 120
01:27:28.519269 IP 192.168.43.146.8880 > 192.168.43.147.7772: UDP, length 120
01:27:28.542595 IP 192.168.43.147.8880 > 192.168.43.124.7773: UDP, length 120
01:27:28.561357 IP 192.168.43.146.8880 > 192.168.43.147.7772: UDP, length 120
01:27:28.592594 IP 192.168.43.147.8880 > 192.168.43.124.7773: UDP, length 120
01:27:28.621723 IP 192.168.43.146.8880 > 192.168.43.147.7772: UDP, length 120
01:27:28.642593 IP 192.168.43.147.8880 > 192.168.43.124.7773: UDP, length 120
01:27:28.666033 IP 192.168.43.146.8880 > 192.168.43.147.7772: UDP, length 120
01:27:28.692586 IP 192.168.43.147.8880 > 192.168.43.124.7773: UDP, length 120
01:27:28.719661 IP 192.168.43.146.8880 > 192.168.43.147.7772: UDP, length 120
01:27:28.742582 IP 192.168.43.147.8880 > 192.168.43.124.7773: UDP, length 120
01:27:28.768070 IP 192.168.43.146.8880 > 192.168.43.147.7772: UDP, length 120
01:27:28.792582 IP 192.168.43.147.8880 > 192.168.43.124.7773: UDP, length 120
01:27:28.810721 IP 192.168.43.146.8880 > 192.168.43.147.7772: UDP, length 120
01:27:28.842608 IP 192.168.43.147.8880 > 192.168.43.124.7773: UDP, length 120
01:27:28.868591 IP 192.168.43.146.8880 > 192.168.43.147.7772: UDP, length 120
01:27:28.892609 IP 192.168.43.147.8880 > 192.168.43.124.7773: UDP, length 120
01:27:28.917249 IP 192.168.43.146.8880 > 192.168.43.147.7772: UDP, length 120
01:27:28.942672 IP 192.168.43.147.8880 > 192.168.43.124.7773: UDP, length 120
01:27:28.973338 IP 192.168.43.146.8880 > 192.168.43.147.7772: UDP, length 120
01:27:28.992673 IP 192.168.43.147.8880 > 192.168.43.124.7773: UDP, length 120
01:27:29.042670 IP 192.168.43.147.8880 > 192.168.43.124.7773: UDP, length 120
01:27:29.077451 IP 192.168.43.146.8880 > 192.168.43.147.7772: UDP, length 120
01:27:29.077627 IP 192.168.43.146.8880 > 192.168.43.147.7772: UDP, length 120
01:27:29.092666 IP 192.168.43.147.8880 > 192.168.43.124.7773: UDP, length 120
01:27:29.131718 IP 192.168.43.146.8880 > 192.168.43.147.7772: UDP, length 120
01:27:29.142626 IP 192.168.43.147.8880 > 192.168.43.124.7773: UDP, length 120
01:27:29.174819 IP 192.168.43.146.8880 > 192.168.43.147.7772: UDP, length 120
01:27:29.192633 IP 192.168.43.147.8880 > 192.168.43.124.7773: UDP, length 120
01:27:29.222083 IP 192.168.43.146.8880 > 192.168.43.147.7772: UDP, length 120
01:27:29.242617 IP 192.168.43.147.8880 > 192.168.43.124.7773: UDP, length 120
01:27:29.276553 IP 192.168.43.146.8880 > 192.168.43.147.7772: UDP, length 120
01:27:29.292655 IP 192.168.43.147.8880 > 192.168.43.124.7773: UDP, length 120
01:27:29.327475 IP 192.168.43.146.8880 > 192.168.43.147.7772: UDP, length 120
01:27:29.342650 IP 192.168.43.147.8880 > 192.168.43.124.7773: UDP, length 120
01:27:29.392626 IP 192.168.43.147.8880 > 192.168.43.124.7773: UDP, length 120
01:27:29.395370 IP 192.168.43.146.8880 > 192.168.43.147.7772: UDP, length 120
01:27:29.399468 IP 192.168.43.146.8880 > 192.168.43.147.7772: UDP, length 120
01:27:29.442612 IP 192.168.43.147.8880 > 192.168.43.124.7773: UDP, length 120
01:27:29.481294 IP 192.168.43.146.8880 > 192.168.43.147.7772: UDP, length 120
01:27:29.492565 IP 192.168.43.147.8880 > 192.168.43.124.7773: UDP, length 120
01:27:29.525845 IP 192.168.43.146.8880 > 192.168.43.147.7772: UDP, length 120
01:27:29.542557 IP 192.168.43.147.8880 > 192.168.43.124.7773: UDP, length 120
01:27:29.592557 IP 192.168.43.147.8880 > 192.168.43.124.7773: UDP, length 120
01:27:29.592727 IP 192.168.43.146.8880 > 192.168.43.147.7772: UDP, length 120
01:27:29.642582 IP 192.168.43.147.8880 > 192.168.43.124.7773: UDP, length 120
01:27:29.645691 IP 192.168.43.146.8880 > 192.168.43.147.7772: UDP, length 120
01:27:29.667654 IP 192.168.43.146.8880 > 192.168.43.147.7772: UDP, length 120
01:27:29.692561 IP 192.168.43.147.8880 > 192.168.43.124.7773: UDP, length 120
01:27:29.722949 IP 192.168.43.146.8880 > 192.168.43.147.7772: UDP, length 120
01:27:29.742559 IP 192.168.43.147.8880 > 192.168.43.124.7773: UDP, length 120
01:27:29.767525 IP 192.168.43.146.8880 > 192.168.43.147.7772: UDP, length 120
01:27:29.792558 IP 192.168.43.147.8880 > 192.168.43.124.7773: UDP, length 120
01:27:29.814238 IP 192.168.43.146.8880 > 192.168.43.147.7772: UDP, length 120
01:27:29.842565 IP 192.168.43.147.8880 > 192.168.43.124.7773: UDP, length 120
01:27:29.892600 IP 192.168.43.147.8880 > 192.168.43.124.7773: UDP, length 120
01:27:29.894881 IP 192.168.43.146.8880 > 192.168.43.147.7772: UDP, length 120
01:27:29.907324 IP 192.168.43.146.8880 > 192.168.43.147.7772: UDP, length 120
01:27:29.942570 IP 192.168.43.147.8880 > 192.168.43.124.7773: UDP, length 120
01:27:29.992564 IP 192.168.43.147.8880 > 192.168.43.124.7773: UDP, length 120
01:27:30.002228 IP 192.168.43.146.8880 > 192.168.43.147.7772: UDP, length 120
01:27:30.015770 IP 192.168.43.146.8880 > 192.168.43.147.7772: UDP, length 120
01:27:30.042564 IP 192.168.43.147.8880 > 192.168.43.124.7773: UDP, length 120
01:27:30.092563 IP 192.168.43.147.8880 > 192.168.43.124.7773: UDP, length 120
01:27:30.098164 IP 192.168.43.146.8880 > 192.168.43.147.7772: UDP, length 120
01:27:30.112945 IP 192.168.43.146.8880 > 192.168.43.147.7772: UDP, length 120
01:27:30.142556 IP 192.168.43.147.8880 > 192.168.43.124.7773: UDP, length 120
01:27:30.192556 IP 192.168.43.147.8880 > 192.168.43.124.7773: UDP, length 120
01:27:30.198792 IP 192.168.43.146.8880 > 192.168.43.147.7772: UDP, length 120
01:27:30.198945 IP 192.168.43.146.8880 > 192.168.43.147.7772: UDP, length 120
01:27:30.242557 IP 192.168.43.147.8880 > 192.168.43.124.7773: UDP, length 120
01:27:30.253713 IP 192.168.43.146.8880 > 192.168.43.147.7772: UDP, length 120
01:27:30.292559 IP 192.168.43.147.8880 > 192.168.43.124.7773: UDP, length 120
01:27:30.342556 IP 192.168.43.147.8880 > 192.168.43.124.7773: UDP, length 120
01:27:30.392556 IP 192.168.43.147.8880 > 192.168.43.124.7773: UDP, length 120
01:27:30.412463 IP 192.168.43.146.8880 > 192.168.43.147.7772: UDP, length 120
01:27:30.412605 IP 192.168.43.146.8880 > 192.168.43.147.7772: UDP, length 120
01:27:30.412680 IP 192.168.43.146.8880 > 192.168.43.147.7772: UDP, length 120
01:27:30.442557 IP 192.168.43.147.8880 > 192.168.43.124.7773: UDP, length 120
01:27:30.468235 IP 192.168.43.146.8880 > 192.168.43.147.7772: UDP, length 120
01:27:30.492561 IP 192.168.43.147.8880 > 192.168.43.124.7773: UDP, length 120
01:27:30.542561 IP 192.168.43.147.8880 > 192.168.43.124.7773: UDP, length 120
01:27:30.542787 IP 192.168.43.146.8880 > 192.168.43.147.7772: UDP, length 120
01:27:30.551948 IP 192.168.43.146.8880 > 192.168.43.147.7772: UDP, length 120
01:27:30.592562 IP 192.168.43.147.8880 > 192.168.43.124.7773: UDP, length 120
01:27:30.603980 IP 192.168.43.146.8880 > 192.168.43.147.7772: UDP, length 120
01:27:30.642558 IP 192.168.43.147.8880 > 192.168.43.124.7773: UDP, length 120
01:27:30.678245 IP 192.168.43.146.8880 > 192.168.43.147.7772: UDP, length 120
01:27:30.692559 IP 192.168.43.147.8880 > 192.168.43.124.7773: UDP, length 120
01:27:30.710653 IP 192.168.43.146.8880 > 192.168.43.147.7772: UDP, length 120
01:27:30.742567 IP 192.168.43.147.8880 > 192.168.43.124.7773: UDP, length 120
01:27:30.792560 IP 192.168.43.147.8880 > 192.168.43.124.7773: UDP, length 120
01:27:30.814534 IP 192.168.43.146.8880 > 192.168.43.147.7772: UDP, length 120
01:27:30.814678 IP 192.168.43.146.8880 > 192.168.43.147.7772: UDP, length 120
01:27:30.842565 IP 192.168.43.147.8880 > 192.168.43.124.7773: UDP, length 120
01:27:30.874350 IP 192.168.43.146.8880 > 192.168.43.147.7772: UDP, length 120
01:27:30.892561 IP 192.168.43.147.8880 > 192.168.43.124.7773: UDP, length 120
01:27:30.929267 IP 192.168.43.146.8880 > 192.168.43.147.7772: UDP, length 120
01:27:30.942557 IP 192.168.43.147.8880 > 192.168.43.124.7773: UDP, length 120
01:27:30.984166 IP 192.168.43.146.8880 > 192.168.43.147.7772: UDP, length 120
01:27:30.992556 IP 192.168.43.147.8880 > 192.168.43.124.7773: UDP, length 120
01:27:30.999505 IP 192.168.43.146.8880 > 192.168.43.147.7772: UDP, length 120
01:27:31.042557 IP 192.168.43.147.8880 > 192.168.43.124.7773: UDP, length 120
01:27:31.061982 IP 192.168.43.146.8880 > 192.168.43.147.7772: UDP, length 120
01:27:31.092558 IP 192.168.43.147.8880 > 192.168.43.124.7773: UDP, length 120
01:27:31.119717 IP 192.168.43.146.8880 > 192.168.43.147.7772: UDP, length 120
01:27:31.142555 IP 192.168.43.147.8880 > 192.168.43.124.7773: UDP, length 120
01:27:31.163679 IP 192.168.43.146.8880 > 192.168.43.147.7772: UDP, length 120
01:27:31.192556 IP 192.168.43.147.8880 > 192.168.43.124.7773: UDP, length 120
01:27:31.222092 IP 192.168.43.146.8880 > 192.168.43.147.7772: UDP, length 120
01:27:31.242557 IP 192.168.43.147.8880 > 192.168.43.124.7773: UDP, length 120
01:27:31.279870 IP 192.168.43.146.8880 > 192.168.43.147.7772: UDP, length 120
01:27:31.292556 IP 192.168.43.147.8880 > 192.168.43.124.7773: UDP, length 120
01:27:31.330213 IP 192.168.43.146.8880 > 192.168.43.147.7772: UDP, length 120
01:27:31.342555 IP 192.168.43.147.8880 > 192.168.43.124.7773: UDP, length 120
01:27:31.381629 IP 192.168.43.146.8880 > 192.168.43.147.7772: UDP, length 120
01:27:31.392594 IP 192.168.43.147.8880 > 192.168.43.124.7773: UDP, length 120
01:27:31.436351 IP 192.168.43.146.8880 > 192.168.43.147.7772: UDP, length 120
01:27:31.442556 IP 192.168.43.147.8880 > 192.168.43.124.7773: UDP, length 120
01:27:31.452597 IP 192.168.43.146.8880 > 192.168.43.147.7772: UDP, length 120
01:27:31.492558 IP 192.168.43.147.8880 > 192.168.43.124.7773: UDP, length 120
01:27:31.498312 IP 192.168.43.146.8880 > 192.168.43.147.7772: UDP, length 120
01:27:31.542556 IP 192.168.43.147.8880 > 192.168.43.124.7773: UDP, length 120
01:27:31.551190 IP 192.168.43.146.8880 > 192.168.43.147.7772: UDP, length 120
01:27:31.592558 IP 192.168.43.147.8880 > 192.168.43.124.7773: UDP, length 120
01:27:31.606832 IP 192.168.43.146.8880 > 192.168.43.147.7772: UDP, length 120
01:27:31.642559 IP 192.168.43.147.8880 > 192.168.43.124.7773: UDP, length 120
01:27:31.663227 IP 192.168.43.146.8880 > 192.168.43.147.7772: UDP, length 120
01:27:31.692556 IP 192.168.43.147.8880 > 192.168.43.124.7773: UDP, length 120
01:27:31.717460 IP 192.168.43.146.8880 > 192.168.43.147.7772: UDP, length 120
01:27:31.742556 IP 192.168.43.147.8880 > 192.168.43.124.7773: UDP, length 120
01:27:31.751194 IP 192.168.43.146.8880 > 192.168.43.147.7772: UDP, length 120
01:27:31.792563 IP 192.168.43.147.8880 > 192.168.43.124.7773: UDP, length 120
01:27:31.801752 IP 192.168.43.146.8880 > 192.168.43.147.7772: UDP, length 120
01:27:31.842562 IP 192.168.43.147.8880 > 192.168.43.124.7773: UDP, length 120
01:27:31.848714 IP 192.168.43.146.8880 > 192.168.43.147.7772: UDP, length 120
01:27:31.892586 IP 192.168.43.147.8880 > 192.168.43.124.7773: UDP, length 120
01:27:31.910622 IP 192.168.43.146.8880 > 192.168.43.147.7772: UDP, length 120
01:27:31.942583 IP 192.168.43.147.8880 > 192.168.43.124.7773: UDP, length 120
01:27:31.965084 IP 192.168.43.146.8880 > 192.168.43.147.7772: UDP, length 120
01:27:31.992583 IP 192.168.43.147.8880 > 192.168.43.124.7773: UDP, length 120
01:27:31.998240 IP 192.168.43.146.8880 > 192.168.43.147.7772: UDP, length 120
01:27:32.042582 IP 192.168.43.147.8880 > 192.168.43.124.7773: UDP, length 120
01:27:32.052404 IP 192.168.43.146.8880 > 192.168.43.147.7772: UDP, length 120
01:27:32.092584 IP 192.168.43.147.8880 > 192.168.43.124.7773: UDP, length 120
01:27:32.103982 IP 192.168.43.146.8880 > 192.168.43.147.7772: UDP, length 120
01:27:32.142583 IP 192.168.43.147.8880 > 192.168.43.124.7773: UDP, length 120
01:27:32.151386 IP 192.168.43.146.8880 > 192.168.43.147.7772: UDP, length 120
01:27:32.192582 IP 192.168.43.147.8880 > 192.168.43.124.7773: UDP, length 120
01:27:32.211745 IP 192.168.43.146.8880 > 192.168.43.147.7772: UDP, length 120
01:27:32.242582 IP 192.168.43.147.8880 > 192.168.43.124.7773: UDP, length 120
01:27:32.252263 IP 192.168.43.146.8880 > 192.168.43.147.7772: UDP, length 120
01:27:32.292581 IP 192.168.43.147.8880 > 192.168.43.124.7773: UDP, length 120
01:27:32.303000 IP 192.168.43.146.8880 > 192.168.43.147.7772: UDP, length 120
01:27:32.342581 IP 192.168.43.147.8880 > 192.168.43.124.7773: UDP, length 120
01:27:32.364708 IP 192.168.43.146.8880 > 192.168.43.147.7772: UDP, length 120
01:27:32.392582 IP 192.168.43.147.8880 > 192.168.43.124.7773: UDP, length 120
01:27:32.401621 IP 192.168.43.146.8880 > 192.168.43.147.7772: UDP, length 120
01:27:32.442583 IP 192.168.43.147.8880 > 192.168.43.124.7773: UDP, length 120
01:27:32.456947 IP 192.168.43.146.8880 > 192.168.43.147.7772: UDP, length 120
01:27:32.492583 IP 192.168.43.147.8880 > 192.168.43.124.7773: UDP, length 120
01:27:32.514226 IP 192.168.43.146.8880 > 192.168.43.147.7772: UDP, length 120
01:27:32.542582 IP 192.168.43.147.8880 > 192.168.43.124.7773: UDP, length 120
01:27:32.551840 IP 192.168.43.146.8880 > 192.168.43.147.7772: UDP, length 120
01:27:32.592580 IP 192.168.43.147.8880 > 192.168.43.124.7773: UDP, length 120
01:27:32.601479 IP 192.168.43.146.8880 > 192.168.43.147.7772: UDP, length 120
01:27:32.642581 IP 192.168.43.147.8880 > 192.168.43.124.7773: UDP, length 120
01:27:32.653697 IP 192.168.43.146.8880 > 192.168.43.147.7772: UDP, length 120
01:27:32.692584 IP 192.168.43.147.8880 > 192.168.43.124.7773: UDP, length 120
01:27:32.725898 IP 192.168.43.146.8880 > 192.168.43.147.7772: UDP, length 120
01:27:32.742582 IP 192.168.43.147.8880 > 192.168.43.124.7773: UDP, length 120
01:27:32.755811 IP 192.168.43.146.8880 > 192.168.43.147.7772: UDP, length 120
01:27:32.792581 IP 192.168.43.147.8880 > 192.168.43.124.7773: UDP, length 120
01:27:32.805776 IP 192.168.43.146.8880 > 192.168.43.147.7772: UDP, length 120
01:27:32.842598 IP 192.168.43.147.8880 > 192.168.43.124.7773: UDP, length 120
01:27:32.877876 IP 192.168.43.146.8880 > 192.168.43.147.7772: UDP, length 120
01:27:32.892626 IP 192.168.43.147.8880 > 192.168.43.124.7773: UDP, length 120
01:27:32.915559 IP 192.168.43.146.8880 > 192.168.43.147.7772: UDP, length 120
01:27:32.942592 IP 192.168.43.147.8880 > 192.168.43.124.7773: UDP, length 120
01:27:32.964053 IP 192.168.43.146.8880 > 192.168.43.147.7772: UDP, length 120
01:27:32.992585 IP 192.168.43.147.8880 > 192.168.43.124.7773: UDP, length 120
01:27:33.012807 IP 192.168.43.146.8880 > 192.168.43.147.7772: UDP, length 120
01:27:33.042584 IP 192.168.43.147.8880 > 192.168.43.124.7773: UDP, length 120
01:27:33.079698 IP 192.168.43.146.8880 > 192.168.43.147.7772: UDP, length 120
01:27:33.092602 IP 192.168.43.147.8880 > 192.168.43.124.7773: UDP, length 120
01:27:33.113769 IP 192.168.43.146.8880 > 192.168.43.147.7772: UDP, length 120
01:27:33.142594 IP 192.168.43.147.8880 > 192.168.43.124.7773: UDP, length 120
01:27:33.172739 IP 192.168.43.146.8880 > 192.168.43.147.7772: UDP, length 120
01:27:33.192591 IP 192.168.43.147.8880 > 192.168.43.124.7773: UDP, length 120
01:27:33.218558 IP 192.168.43.146.8880 > 192.168.43.147.7772: UDP, length 120
01:27:33.242596 IP 192.168.43.147.8880 > 192.168.43.124.7773: UDP, length 120
01:27:33.288216 IP 192.168.43.146.8880 > 192.168.43.147.7772: UDP, length 120
01:27:33.292582 IP 192.168.43.147.8880 > 192.168.43.124.7773: UDP, length 120
01:27:33.324653 IP 192.168.43.146.8880 > 192.168.43.147.7772: UDP, length 120
01:27:33.342583 IP 192.168.43.147.8880 > 192.168.43.124.7773: UDP, length 120
01:27:33.365214 IP 192.168.43.146.8880 > 192.168.43.147.7772: UDP, length 120
01:27:33.392596 IP 192.168.43.147.8880 > 192.168.43.124.7773: UDP, length 120
01:27:33.442608 IP 192.168.43.147.8880 > 192.168.43.124.7773: UDP, length 120
01:27:33.442703 IP 192.168.43.146.8880 > 192.168.43.147.7772: UDP, length 120
01:27:33.484171 IP 192.168.43.146.8880 > 192.168.43.147.7772: UDP, length 120
01:27:33.492582 IP 192.168.43.147.8880 > 192.168.43.124.7773: UDP, length 120
01:27:33.518125 IP 192.168.43.146.8880 > 192.168.43.147.7772: UDP, length 120
01:27:33.542583 IP 192.168.43.147.8880 > 192.168.43.124.7773: UDP, length 120
01:27:33.587930 IP 192.168.43.146.8880 > 192.168.43.147.7772: UDP, length 120
01:27:33.592580 IP 192.168.43.147.8880 > 192.168.43.124.7773: UDP, length 120
01:27:33.604846 IP 192.168.43.146.8880 > 192.168.43.147.7772: UDP, length 120
01:27:33.642598 IP 192.168.43.147.8880 > 192.168.43.124.7773: UDP, length 120
01:27:33.680970 IP 192.168.43.146.8880 > 192.168.43.147.7772: UDP, length 120
01:27:33.692590 IP 192.168.43.147.8880 > 192.168.43.124.7773: UDP, length 120
01:27:33.732106 IP 192.168.43.146.8880 > 192.168.43.147.7772: UDP, length 120
01:27:33.742579 IP 192.168.43.147.8880 > 192.168.43.124.7773: UDP, length 120
01:27:33.792582 IP 192.168.43.147.8880 > 192.168.43.124.7773: UDP, length 120
01:27:33.800109 IP 192.168.43.146.8880 > 192.168.43.147.7772: UDP, length 120
01:27:33.827040 IP 192.168.43.146.8880 > 192.168.43.147.7772: UDP, length 120
01:27:33.842605 IP 192.168.43.147.8880 > 192.168.43.124.7773: UDP, length 120
01:27:33.886324 IP 192.168.43.146.8880 > 192.168.43.147.7772: UDP, length 120
01:27:33.892617 IP 192.168.43.147.8880 > 192.168.43.124.7773: UDP, length 120
01:27:33.905688 IP 192.168.43.146.8880 > 192.168.43.147.7772: UDP, length 120
01:27:33.942609 IP 192.168.43.147.8880 > 192.168.43.124.7773: UDP, length 120
01:27:33.953908 IP 192.168.43.146.8880 > 192.168.43.147.7772: UDP, length 120
01:27:33.992585 IP 192.168.43.147.8880 > 192.168.43.124.7773: UDP, length 120
01:27:34.024318 IP 192.168.43.146.8880 > 192.168.43.147.7772: UDP, length 120
01:27:34.042584 IP 192.168.43.147.8880 > 192.168.43.124.7773: UDP, length 120
01:27:34.091766 IP 192.168.43.146.8880 > 192.168.43.147.7772: UDP, length 120
01:27:34.092581 IP 192.168.43.147.8880 > 192.168.43.124.7773: UDP, length 120
01:27:34.110883 IP 192.168.43.146.8880 > 192.168.43.147.7772: UDP, length 120
01:27:34.142581 IP 192.168.43.147.8880 > 192.168.43.124.7773: UDP, length 120
01:27:34.161470 IP 192.168.43.146.8880 > 192.168.43.147.7772: UDP, length 120
01:27:34.192582 IP 192.168.43.147.8880 > 192.168.43.124.7773: UDP, length 120
01:27:34.219986 IP 192.168.43.146.8880 > 192.168.43.147.7772: UDP, length 120
01:27:34.242583 IP 192.168.43.147.8880 > 192.168.43.124.7773: UDP, length 120
01:27:34.292584 IP 192.168.43.147.8880 > 192.168.43.124.7773: UDP, length 120
01:27:34.300117 IP 192.168.43.146.8880 > 192.168.43.147.7772: UDP, length 120
01:27:34.304344 IP 192.168.43.146.8880 > 192.168.43.147.7772: UDP, length 120
01:27:34.342582 IP 192.168.43.147.8880 > 192.168.43.124.7773: UDP, length 120
01:27:34.353663 IP 192.168.43.146.8880 > 192.168.43.147.7772: UDP, length 120
01:27:34.392634 IP 192.168.43.147.8880 > 192.168.43.124.7773: UDP, length 120
01:27:34.412197 IP 192.168.43.146.8880 > 192.168.43.147.7772: UDP, length 120
01:27:34.442708 IP 192.168.43.147.8880 > 192.168.43.124.7773: UDP, length 120
01:27:34.457467 IP 192.168.43.146.8880 > 192.168.43.147.7772: UDP, length 120
01:27:34.492636 IP 192.168.43.147.8880 > 192.168.43.124.7773: UDP, length 120
01:27:34.504768 IP 192.168.43.146.8880 > 192.168.43.147.7772: UDP, length 120
01:27:34.542639 IP 192.168.43.147.8880 > 192.168.43.124.7773: UDP, length 120
01:27:34.557682 IP 192.168.43.146.8880 > 192.168.43.147.7772: UDP, length 120
01:27:34.592648 IP 192.168.43.147.8880 > 192.168.43.124.7773: UDP, length 120
01:27:34.599644 IP 192.168.43.146.8880 > 192.168.43.147.7772: UDP, length 120
01:27:34.642643 IP 192.168.43.147.8880 > 192.168.43.124.7773: UDP, length 120
01:27:34.656307 IP 192.168.43.146.8880 > 192.168.43.147.7772: UDP, length 120
01:27:34.692644 IP 192.168.43.147.8880 > 192.168.43.124.7773: UDP, length 120
01:27:34.702716 IP 192.168.43.146.8880 > 192.168.43.147.7772: UDP, length 120
01:27:34.742651 IP 192.168.43.147.8880 > 192.168.43.124.7773: UDP, length 120
01:27:34.761102 IP 192.168.43.146.8880 > 192.168.43.147.7772: UDP, length 120
01:27:34.792632 IP 192.168.43.147.8880 > 192.168.43.124.7773: UDP, length 120
01:27:34.827443 IP 192.168.43.146.8880 > 192.168.43.147.7772: UDP, length 120
01:27:34.842631 IP 192.168.43.147.8880 > 192.168.43.124.7773: UDP, length 120
01:27:34.851347 IP 192.168.43.146.8880 > 192.168.43.147.7772: UDP, length 120
01:27:34.892610 IP 192.168.43.147.8880 > 192.168.43.124.7773: UDP, length 120
01:27:34.907332 IP 192.168.43.146.8880 > 192.168.43.147.7772: UDP, length 120
01:27:34.942584 IP 192.168.43.147.8880 > 192.168.43.124.7773: UDP, length 120
01:27:34.952823 IP 192.168.43.146.8880 > 192.168.43.147.7772: UDP, length 120
01:27:34.992570 IP 192.168.43.147.8880 > 192.168.43.124.7773: UDP, length 120
01:27:35.012618 IP 192.168.43.146.8880 > 192.168.43.147.7772: UDP, length 120
01:27:35.042560 IP 192.168.43.147.8880 > 192.168.43.124.7773: UDP, length 120
01:27:35.052716 IP 192.168.43.146.8880 > 192.168.43.147.7772: UDP, length 120
01:27:35.092559 IP 192.168.43.147.8880 > 192.168.43.124.7773: UDP, length 120
01:27:35.115327 IP 192.168.43.146.8880 > 192.168.43.147.7772: UDP, length 120
01:27:35.142556 IP 192.168.43.147.8880 > 192.168.43.124.7773: UDP, length 120
01:27:35.176869 IP 192.168.43.146.8880 > 192.168.43.147.7772: UDP, length 120
01:27:35.192557 IP 192.168.43.147.8880 > 192.168.43.124.7773: UDP, length 120
01:27:35.217587 IP 192.168.43.146.8880 > 192.168.43.147.7772: UDP, length 120
01:27:35.242557 IP 192.168.43.147.8880 > 192.168.43.124.7773: UDP, length 120
01:27:35.279605 IP 192.168.43.146.8880 > 192.168.43.147.7772: UDP, length 120
01:27:35.292558 IP 192.168.43.147.8880 > 192.168.43.124.7773: UDP, length 120
01:27:35.321819 IP 192.168.43.146.8880 > 192.168.43.147.7772: UDP, length 120
01:27:35.342558 IP 192.168.43.147.8880 > 192.168.43.124.7773: UDP, length 120
01:27:35.353353 IP 192.168.43.146.8880 > 192.168.43.147.7772: UDP, length 120
01:27:35.392558 IP 192.168.43.147.8880 > 192.168.43.124.7773: UDP, length 120
01:27:35.428902 IP 192.168.43.146.8880 > 192.168.43.147.7772: UDP, length 120
01:27:35.442557 IP 192.168.43.147.8880 > 192.168.43.124.7773: UDP, length 120
01:27:35.462313 IP 192.168.43.146.8880 > 192.168.43.147.7772: UDP, length 120
01:27:35.492556 IP 192.168.43.147.8880 > 192.168.43.124.7773: UDP, length 120
01:27:35.503485 IP 192.168.43.146.8880 > 192.168.43.147.7772: UDP, length 120
01:27:35.542556 IP 192.168.43.147.8880 > 192.168.43.124.7773: UDP, length 120
01:27:35.592556 IP 192.168.43.147.8880 > 192.168.43.124.7773: UDP, length 120
01:27:35.594452 IP 192.168.43.146.8880 > 192.168.43.147.7772: UDP, length 120
01:27:35.605958 IP 192.168.43.146.8880 > 192.168.43.147.7772: UDP, length 120
01:27:35.642559 IP 192.168.43.147.8880 > 192.168.43.124.7773: UDP, length 120
01:27:35.683467 IP 192.168.43.146.8880 > 192.168.43.147.7772: UDP, length 120
01:27:35.692558 IP 192.168.43.147.8880 > 192.168.43.124.7773: UDP, length 120
01:27:35.729871 IP 192.168.43.146.8880 > 192.168.43.147.7772: UDP, length 120
01:27:35.742557 IP 192.168.43.147.8880 > 192.168.43.124.7773: UDP, length 120
01:27:35.766456 IP 192.168.43.146.8880 > 192.168.43.147.7772: UDP, length 120
01:27:35.792557 IP 192.168.43.147.8880 > 192.168.43.124.7773: UDP, length 120
01:27:35.813047 IP 192.168.43.146.8880 > 192.168.43.147.7772: UDP, length 120
01:27:35.842561 IP 192.168.43.147.8880 > 192.168.43.124.7773: UDP, length 120
01:27:35.892593 IP 192.168.43.147.8880 > 192.168.43.124.7773: UDP, length 120
01:27:35.932037 IP 192.168.43.146.8880 > 192.168.43.147.7772: UDP, length 120
01:27:35.932183 IP 192.168.43.146.8880 > 192.168.43.147.7772: UDP, length 120
01:27:35.942565 IP 192.168.43.147.8880 > 192.168.43.124.7773: UDP, length 120
01:27:35.981345 IP 192.168.43.146.8880 > 192.168.43.147.7772: UDP, length 120
01:27:35.992564 IP 192.168.43.147.8880 > 192.168.43.124.7773: UDP, length 120
01:27:36.019106 IP 192.168.43.146.8880 > 192.168.43.147.7772: UDP, length 120
01:27:36.042560 IP 192.168.43.147.8880 > 192.168.43.124.7773: UDP, length 120
01:27:36.050862 IP 192.168.43.146.8880 > 192.168.43.147.7772: UDP, length 120
01:27:36.092563 IP 192.168.43.147.8880 > 192.168.43.124.7773: UDP, length 120
01:27:36.101884 IP 192.168.43.146.8880 > 192.168.43.147.7772: UDP, length 120
01:27:36.142559 IP 192.168.43.147.8880 > 192.168.43.124.7773: UDP, length 120
01:27:36.164164 IP 192.168.43.146.8880 > 192.168.43.147.7772: UDP, length 120
01:27:36.192556 IP 192.168.43.147.8880 > 192.168.43.124.7773: UDP, length 120
01:27:36.239910 IP 192.168.43.146.8880 > 192.168.43.147.7772: UDP, length 120
01:27:36.242557 IP 192.168.43.147.8880 > 192.168.43.124.7773: UDP, length 120
01:27:36.257077 IP 192.168.43.146.8880 > 192.168.43.147.7772: UDP, length 120
01:27:36.292558 IP 192.168.43.147.8880 > 192.168.43.124.7773: UDP, length 120
01:27:36.312943 IP 192.168.43.146.8880 > 192.168.43.147.7772: UDP, length 120
01:27:36.342557 IP 192.168.43.147.8880 > 192.168.43.124.7773: UDP, length 120
01:27:36.357227 IP 192.168.43.146.8880 > 192.168.43.147.7772: UDP, length 120
01:27:36.392561 IP 192.168.43.147.8880 > 192.168.43.124.7773: UDP, length 120
01:27:36.400789 IP 192.168.43.146.8880 > 192.168.43.147.7772: UDP, length 120
01:27:36.442562 IP 192.168.43.147.8880 > 192.168.43.124.7773: UDP, length 120
01:27:36.451116 IP 192.168.43.146.8880 > 192.168.43.147.7772: UDP, length 120
01:27:36.492563 IP 192.168.43.147.8880 > 192.168.43.124.7773: UDP, length 120
01:27:36.516580 IP 192.168.43.146.8880 > 192.168.43.147.7772: UDP, length 120
01:27:36.542558 IP 192.168.43.147.8880 > 192.168.43.124.7773: UDP, length 120
01:27:36.553544 IP 192.168.43.146.8880 > 192.168.43.147.7772: UDP, length 120
01:27:36.592559 IP 192.168.43.147.8880 > 192.168.43.124.7773: UDP, length 120
01:27:36.642556 IP 192.168.43.147.8880 > 192.168.43.124.7773: UDP, length 120
01:27:36.650668 IP 192.168.43.146.8880 > 192.168.43.147.7772: UDP, length 120
01:27:36.655803 IP 192.168.43.146.8880 > 192.168.43.147.7772: UDP, length 120
01:27:36.692557 IP 192.168.43.147.8880 > 192.168.43.124.7773: UDP, length 120
01:27:36.720683 IP 192.168.43.146.8880 > 192.168.43.147.7772: UDP, length 120
01:27:36.742558 IP 192.168.43.147.8880 > 192.168.43.124.7773: UDP, length 120
01:27:36.761889 IP 192.168.43.146.8880 > 192.168.43.147.7772: UDP, length 120
01:27:36.792558 IP 192.168.43.147.8880 > 192.168.43.124.7773: UDP, length 120
01:27:36.836749 IP 192.168.43.146.8880 > 192.168.43.147.7772: UDP, length 120
01:27:36.842566 IP 192.168.43.147.8880 > 192.168.43.124.7773: UDP, length 120
01:27:36.852799 IP 192.168.43.146.8880 > 192.168.43.147.7772: UDP, length 120
01:27:36.892594 IP 192.168.43.147.8880 > 192.168.43.124.7773: UDP, length 120
01:27:36.906597 IP 192.168.43.146.8880 > 192.168.43.147.7772: UDP, length 120
01:27:36.942592 IP 192.168.43.147.8880 > 192.168.43.124.7773: UDP, length 120
01:27:36.952092 IP 192.168.43.146.8880 > 192.168.43.147.7772: UDP, length 120
01:27:36.992589 IP 192.168.43.147.8880 > 192.168.43.124.7773: UDP, length 120
01:27:37.001638 IP 192.168.43.146.8880 > 192.168.43.147.7772: UDP, length 120
01:27:37.042588 IP 192.168.43.147.8880 > 192.168.43.124.7773: UDP, length 120
01:27:37.052178 IP 192.168.43.146.8880 > 192.168.43.147.7772: UDP, length 120
01:27:37.092599 IP 192.168.43.147.8880 > 192.168.43.124.7773: UDP, length 120
01:27:37.104082 IP 192.168.43.146.8880 > 192.168.43.147.7772: UDP, length 120
01:27:37.142588 IP 192.168.43.147.8880 > 192.168.43.124.7773: UDP, length 120
01:27:37.150597 IP 192.168.43.146.8880 > 192.168.43.147.7772: UDP, length 120
01:27:37.192594 IP 192.168.43.147.8880 > 192.168.43.124.7773: UDP, length 120
01:27:37.217031 IP 192.168.43.146.8880 > 192.168.43.147.7772: UDP, length 120
01:27:37.242586 IP 192.168.43.147.8880 > 192.168.43.124.7773: UDP, length 120
01:27:37.251270 IP 192.168.43.146.8880 > 192.168.43.147.7772: UDP, length 120
01:27:37.292584 IP 192.168.43.147.8880 > 192.168.43.124.7773: UDP, length 120
01:27:37.304885 IP 192.168.43.146.8880 > 192.168.43.147.7772: UDP, length 120
01:27:37.342584 IP 192.168.43.147.8880 > 192.168.43.124.7773: UDP, length 120
01:27:37.350255 IP 192.168.43.146.8880 > 192.168.43.147.7772: UDP, length 120
01:27:37.392633 IP 192.168.43.147.8880 > 192.168.43.124.7773: UDP, length 120
01:27:37.410653 IP 192.168.43.146.8880 > 192.168.43.147.7772: UDP, length 120
01:27:37.442604 IP 192.168.43.147.8880 > 192.168.43.124.7773: UDP, length 120
01:27:37.451244 IP 192.168.43.146.8880 > 192.168.43.147.7772: UDP, length 120
01:27:37.492585 IP 192.168.43.147.8880 > 192.168.43.124.7773: UDP, length 120
01:27:37.503610 IP 192.168.43.146.8880 > 192.168.43.147.7772: UDP, length 120
01:27:37.542582 IP 192.168.43.147.8880 > 192.168.43.124.7773: UDP, length 120
01:27:37.553774 IP 192.168.43.146.8880 > 192.168.43.147.7772: UDP, length 120
01:27:37.592584 IP 192.168.43.147.8880 > 192.168.43.124.7773: UDP, length 120
01:27:37.605252 IP 192.168.43.146.8880 > 192.168.43.147.7772: UDP, length 120
01:27:37.642588 IP 192.168.43.147.8880 > 192.168.43.124.7773: UDP, length 120
01:27:37.673971 IP 192.168.43.146.8880 > 192.168.43.147.7772: UDP, length 120
01:27:37.692584 IP 192.168.43.147.8880 > 192.168.43.124.7773: UDP, length 120
