00:36:28.474305 IP 192.168.43.147.8880 > 192.168.43.124.7773: UDP, length 120
00:36:28.524366 IP 192.168.43.147.8880 > 192.168.43.124.7773: UDP, length 120
00:36:28.574328 IP 192.168.43.147.8880 > 192.168.43.124.7773: UDP, length 120
00:36:28.587153 IP 192.168.43.146.8880 > 192.168.43.147.7772: UDP, length 120
00:36:28.624335 IP 192.168.43.147.8880 > 192.168.43.124.7773: UDP, length 120
00:36:28.639497 IP 192.168.43.146.8880 > 192.168.43.147.7772: UDP, length 120
00:36:28.674333 IP 192.168.43.147.8880 > 192.168.43.124.7773: UDP, length 120
00:36:28.694219 IP 192.168.43.146.8880 > 192.168.43.147.7772: UDP, length 120
00:36:28.724326 IP 192.168.43.147.8880 > 192.168.43.124.7773: UDP, length 120
00:36:28.774323 IP 192.168.43.147.8880 > 192.168.43.124.7773: UDP, length 120
00:36:28.824326 IP 192.168.43.147.8880 > 192.168.43.124.7773: UDP, length 120
00:36:28.845188 IP 192.168.43.146.8880 > 192.168.43.147.7772: UDP, length 120
00:36:28.856650 IP 192.168.43.146.8880 > 192.168.43.147.7772: UDP, length 120
00:36:28.858517 IP 192.168.43.146.8880 > 192.168.43.147.7772: UDP, length 120
00:36:28.874327 IP 192.168.43.147.8880 > 192.168.43.124.7773: UDP, length 120
00:36:28.894565 IP 192.168.43.146.8880 > 192.168.43.147.7772: UDP, length 120
00:36:28.924333 IP 192.168.43.147.8880 > 192.168.43.124.7773: UDP, length 120
00:36:28.945416 IP 192.168.43.146.8880 > 192.168.43.147.7772: UDP, length 120
00:36:28.974364 IP 192.168.43.147.8880 > 192.168.43.124.7773: UDP, length 120
00:36:28.992280 IP 192.168.43.146.8880 > 192.168.43.147.7772: UDP, length 120
00:36:29.024325 IP 192.168.43.147.8880 > 192.168.43.124.7773: UDP, length 120
00:36:29.044006 IP 192.168.43.146.8880 > 192.168.43.147.7772: UDP, length 120
00:36:29.074324 IP 192.168.43.147.8880 > 192.168.43.124.7773: UDP, length 120
00:36:29.091941 IP 192.168.43.146.8880 > 192.168.43.147.7772: UDP, length 120
00:36:29.124323 IP 192.168.43.147.8880 > 192.168.43.124.7773: UDP, length 120
00:36:29.137716 IP 192.168.43.146.8880 > 192.168.43.147.7772: UDP, length 120
00:36:29.174324 IP 192.168.43.147.8880 > 192.168.43.124.7773: UDP, length 120
00:36:29.203665 IP 192.168.43.146.8880 > 192.168.43.147.7772: UDP, length 120
00:36:29.224337 IP 192.168.43.147.8880 > 192.168.43.124.7773: UDP, length 120
00:36:29.236834 IP 192.168.43.146.8880 > 192.168.43.147.7772: UDP, length 120
00:36:29.274322 IP 192.168.43.147.8880 > 192.168.43.124.7773: UDP, length 120
00:36:29.288524 IP 192.168.43.146.8880 > 192.168.43.147.7772: UDP, length 120
00:36:29.324325 IP 192.168.43.147.8880 > 192.168.43.124.7773: UDP, length 120
00:36:29.337060 IP 192.168.43.146.8880 > 192.168.43.147.7772: UDP, length 120
00:36:29.374325 IP 192.168.43.147.8880 > 192.168.43.124.7773: UDP, length 120
00:36:29.384869 IP 192.168.43.146.8880 > 192.168.43.147.7772: UDP, length 120
00:36:29.424324 IP 192.168.43.147.8880 > 192.168.43.124.7773: UDP, length 120
00:36:29.441012 IP 192.168.43.146.8880 > 192.168.43.147.7772: UDP, length 120
00:36:29.474324 IP 192.168.43.147.8880 > 192.168.43.124.7773: UDP, length 120
00:36:29.487167 IP 192.168.43.146.8880 > 192.168.43.147.7772: UDP, length 120
00:36:29.524335 IP 192.168.43.147.8880 > 192.168.43.124.7773: UDP, length 120
00:36:29.538609 IP 192.168.43.146.8880 > 192.168.43.147.7772: UDP, length 120
00:36:29.574324 IP 192.168.43.147.8880 > 192.168.43.124.7773: UDP, length 120
00:36:29.586654 IP 192.168.43.146.8880 > 192.168.43.147.7772: UDP, length 120
00:36:29.624325 IP 192.168.43.147.8880 > 192.168.43.124.7773: UDP, length 120
00:36:29.636599 IP 192.168.43.146.8880 > 192.168.43.147.7772: UDP, length 120
00:36:29.674325 IP 192.168.43.147.8880 > 192.168.43.124.7773: UDP, length 120
00:36:29.686521 IP 192.168.43.146.8880 > 192.168.43.147.7772: UDP, length 120
00:36:29.724324 IP 192.168.43.147.8880 > 192.168.43.124.7773: UDP, length 120
00:36:29.734966 IP 192.168.43.146.8880 > 192.168.43.147.7772: UDP, length 120
00:36:29.774323 IP 192.168.43.147.8880 > 192.168.43.124.7773: UDP, length 120
00:36:29.803617 IP 192.168.43.146.8880 > 192.168.43.147.7772: UDP, length 120
00:36:29.824330 IP 192.168.43.147.8880 > 192.168.43.124.7773: UDP, length 120
00:36:29.837507 IP 192.168.43.146.8880 > 192.168.43.147.7772: UDP, length 120
00:36:29.874329 IP 192.168.43.147.8880 > 192.168.43.124.7773: UDP, length 120
00:36:29.893917 IP 192.168.43.146.8880 > 192.168.43.147.7772: UDP, length 120
00:36:29.924324 IP 192.168.43.147.8880 > 192.168.43.124.7773: UDP, length 120
00:36:29.938074 IP 192.168.43.146.8880 > 192.168.43.147.7772: UDP, length 120
00:36:29.974331 IP 192.168.43.147.8880 > 192.168.43.124.7773: UDP, length 120
00:36:29.990615 IP 192.168.43.146.8880 > 192.168.43.147.7772: UDP, length 120
00:36:30.024327 IP 192.168.43.147.8880 > 192.168.43.124.7773: UDP, length 120
00:36:30.038426 IP 192.168.43.146.8880 > 192.168.43.147.7772: UDP, length 120
00:36:30.074329 IP 192.168.43.147.8880 > 192.168.43.124.7773: UDP, length 120
00:36:30.090676 IP 192.168.43.146.8880 > 192.168.43.147.7772: UDP, length 120
00:36:30.124328 IP 192.168.43.147.8880 > 192.168.43.124.7773: UDP, length 120
00:36:30.137163 IP 192.168.43.146.8880 > 192.168.43.147.7772: UDP, length 120
00:36:30.174327 IP 192.168.43.147.8880 > 192.168.43.124.7773: UDP, length 120
00:36:30.197912 IP 192.168.43.146.8880 > 192.168.43.147.7772: UDP, length 120
00:36:30.224328 IP 192.168.43.147.8880 > 192.168.43.124.7773: UDP, length 120
00:36:30.241090 IP 192.168.43.146.8880 > 192.168.43.147.7772: UDP, length 120
00:36:30.274324 IP 192.168.43.147.8880 > 192.168.43.124.7773: UDP, length 120
00:36:30.301008 IP 192.168.43.146.8880 > 192.168.43.147.7772: UDP, length 120
00:36:30.324326 IP 192.168.43.147.8880 > 192.168.43.124.7773: UDP, length 120
00:36:30.337935 IP 192.168.43.146.8880 > 192.168.43.147.7772: UDP, length 120
00:36:30.374324 IP 192.168.43.147.8880 > 192.168.43.124.7773: UDP, length 120
00:36:30.395153 IP 192.168.43.146.8880 > 192.168.43.147.7772: UDP, length 120
00:36:30.424329 IP 192.168.43.147.8880 > 192.168.43.124.7773: UDP, length 120
00:36:30.438426 IP 192.168.43.146.8880 > 192.168.43.147.7772: UDP, length 120
00:36:30.474367 IP 192.168.43.147.8880 > 192.168.43.124.7773: UDP, length 120
00:36:30.485526 IP 192.168.43.146.8880 > 192.168.43.147.7772: UDP, length 120
00:36:30.524344 IP 192.168.43.147.8880 > 192.168.43.124.7773: UDP, length 120
00:36:30.537380 IP 192.168.43.146.8880 > 192.168.43.147.7772: UDP, length 120
00:36:30.574328 IP 192.168.43.147.8880 > 192.168.43.124.7773: UDP, length 120
00:36:30.586793 IP 192.168.43.146.8880 > 192.168.43.147.7772: UDP, length 120
00:36:30.624327 IP 192.168.43.147.8880 > 192.168.43.124.7773: UDP, length 120
00:36:30.636409 IP 192.168.43.146.8880 > 192.168.43.147.7772: UDP, length 120
00:36:30.674330 IP 192.168.43.147.8880 > 192.168.43.124.7773: UDP, length 120
00:36:30.685789 IP 192.168.43.146.8880 > 192.168.43.147.7772: UDP, length 120
00:36:30.724326 IP 192.168.43.147.8880 > 192.168.43.124.7773: UDP, length 120
00:36:30.740805 IP 192.168.43.146.8880 > 192.168.43.147.7772: UDP, length 120
00:36:30.774323 IP 192.168.43.147.8880 > 192.168.43.124.7773: UDP, length 120
00:36:30.786884 IP 192.168.43.146.8880 > 192.168.43.147.7772: UDP, length 120
00:36:30.824325 IP 192.168.43.147.8880 > 192.168.43.124.7773: UDP, length 120
00:36:30.837398 IP 192.168.43.146.8880 > 192.168.43.147.7772: UDP, length 120
00:36:30.874325 IP 192.168.43.147.8880 > 192.168.43.124.7773: UDP, length 120
00:36:30.890118 IP 192.168.43.146.8880 > 192.168.43.147.7772: UDP, length 120
00:36:30.924327 IP 192.168.43.147.8880 > 192.168.43.124.7773: UDP, length 120
00:36:30.937415 IP 192.168.43.146.8880 > 192.168.43.147.7772: UDP, length 120
00:36:30.974337 IP 192.168.43.147.8880 > 192.168.43.124.7773: UDP, length 120
00:36:30.992392 IP 192.168.43.146.8880 > 192.168.43.147.7772: UDP, length 120
00:36:31.024330 IP 192.168.43.147.8880 > 192.168.43.124.7773: UDP, length 120
00:36:31.039645 IP 192.168.43.146.8880 > 192.168.43.147.7772: UDP, length 120
00:36:31.074327 IP 192.168.43.147.8880 > 192.168.43.124.7773: UDP, length 120
00:36:31.088275 IP 192.168.43.146.8880 > 192.168.43.147.7772: UDP, length 120
00:36:31.124327 IP 192.168.43.147.8880 > 192.168.43.124.7773: UDP, length 120
00:36:31.136808 IP 192.168.43.146.8880 > 192.168.43.147.7772: UDP, length 120
00:36:31.174325 IP 192.168.43.147.8880 > 192.168.43.124.7773: UDP, length 120
00:36:31.186563 IP 192.168.43.146.8880 > 192.168.43.147.7772: UDP, length 120
00:36:31.224327 IP 192.168.43.147.8880 > 192.168.43.124.7773: UDP, length 120
00:36:31.274322 IP 192.168.43.147.8880 > 192.168.43.124.7773: UDP, length 120
00:36:31.283578 IP 192.168.43.146.8880 > 192.168.43.147.7772: UDP, length 120
00:36:31.288450 IP 192.168.43.146.8880 > 192.168.43.147.7772: UDP, length 120
00:36:31.324328 IP 192.168.43.147.8880 > 192.168.43.124.7773: UDP, length 120
00:36:31.339503 IP 192.168.43.146.8880 > 192.168.43.147.7772: UDP, length 120
00:36:31.374327 IP 192.168.43.147.8880 > 192.168.43.124.7773: UDP, length 120
00:36:31.386864 IP 192.168.43.146.8880 > 192.168.43.147.7772: UDP, length 120
00:36:31.424327 IP 192.168.43.147.8880 > 192.168.43.124.7773: UDP, length 120
00:36:31.453252 IP 192.168.43.146.8880 > 192.168.43.147.7772: UDP, length 120
00:36:31.474325 IP 192.168.43.147.8880 > 192.168.43.124.7773: UDP, length 120
00:36:31.490688 IP 192.168.43.146.8880 > 192.168.43.147.7772: UDP, length 120
00:36:31.524336 IP 192.168.43.147.8880 > 192.168.43.124.7773: UDP, length 120
00:36:31.536844 IP 192.168.43.146.8880 > 192.168.43.147.7772: UDP, length 120
00:36:31.574329 IP 192.168.43.147.8880 > 192.168.43.124.7773: UDP, length 120
00:36:31.586827 IP 192.168.43.146.8880 > 192.168.43.147.7772: UDP, length 120
00:36:31.624329 IP 192.168.43.147.8880 > 192.168.43.124.7773: UDP, length 120
00:36:31.636434 IP 192.168.43.146.8880 > 192.168.43.147.7772: UDP, length 120
00:36:31.674328 IP 192.168.43.147.8880 > 192.168.43.124.7773: UDP, length 120
00:36:31.688374 IP 192.168.43.146.8880 > 192.168.43.147.7772: UDP, length 120
00:36:31.724326 IP 192.168.43.147.8880 > 192.168.43.124.7773: UDP, length 120
00:36:31.736340 IP 192.168.43.146.8880 > 192.168.43.147.7772: UDP, length 120
00:36:31.774325 IP 192.168.43.147.8880 > 192.168.43.124.7773: UDP, length 120
00:36:31.785707 IP 192.168.43.146.8880 > 192.168.43.147.7772: UDP, length 120
00:36:31.824327 IP 192.168.43.147.8880 > 192.168.43.124.7773: UDP, length 120
00:36:31.838415 IP 192.168.43.146.8880 > 192.168.43.147.7772: UDP, length 120
00:36:31.874325 IP 192.168.43.147.8880 > 192.168.43.124.7773: UDP, length 120
00:36:31.886597 IP 192.168.43.146.8880 > 192.168.43.147.7772: UDP, length 120
00:36:31.924326 IP 192.168.43.147.8880 > 192.168.43.124.7773: UDP, length 120
00:36:31.937186 IP 192.168.43.146.8880 > 192.168.43.147.7772: UDP, length 120
00:36:31.974358 IP 192.168.43.147.8880 > 192.168.43.124.7773: UDP, length 120
00:36:31.987034 IP 192.168.43.146.8880 > 192.168.43.147.7772: UDP, length 120
00:36:32.024343 IP 192.168.43.147.8880 > 192.168.43.124.7773: UDP, length 120
00:36:32.038183 IP 192.168.43.146.8880 > 192.168.43.147.7772: UDP, length 120
00:36:32.074330 IP 192.168.43.147.8880 > 192.168.43.124.7773: UDP, length 120
00:36:32.089285 IP 192.168.43.146.8880 > 192.168.43.147.7772: UDP, length 120
00:36:32.124326 IP 192.168.43.147.8880 > 192.168.43.124.7773: UDP, length 120
00:36:32.141865 IP 192.168.43.146.8880 > 192.168.43.147.7772: UDP, length 120
00:36:32.174324 IP 192.168.43.147.8880 > 192.168.43.124.7773: UDP, length 120
00:36:32.186120 IP 192.168.43.146.8880 > 192.168.43.147.7772: UDP, length 120
00:36:32.224323 IP 192.168.43.147.8880 > 192.168.43.124.7773: UDP, length 120
00:36:32.244329 IP 192.168.43.146.8880 > 192.168.43.147.7772: UDP, length 120
00:36:32.274323 IP 192.168.43.147.8880 > 192.168.43.124.7773: UDP, length 120
00:36:32.287139 IP 192.168.43.146.8880 > 192.168.43.147.7772: UDP, length 120
00:36:32.324326 IP 192.168.43.147.8880 > 192.168.43.124.7773: UDP, length 120
00:36:32.361669 IP 192.168.43.146.8880 > 192.168.43.147.7772: UDP, length 120
00:36:32.374325 IP 192.168.43.147.8880 > 192.168.43.124.7773: UDP, length 120
00:36:32.392257 IP 192.168.43.146.8880 > 192.168.43.147.7772: UDP, length 120
00:36:32.424325 IP 192.168.43.147.8880 > 192.168.43.124.7773: UDP, length 120
00:36:32.437133 IP 192.168.43.146.8880 > 192.168.43.147.7772: UDP, length 120
00:36:32.474323 IP 192.168.43.147.8880 > 192.168.43.124.7773: UDP, length 120
00:36:32.490763 IP 192.168.43.146.8880 > 192.168.43.147.7772: UDP, length 120
00:36:32.524332 IP 192.168.43.147.8880 > 192.168.43.124.7773: UDP, length 120
00:36:32.537946 IP 192.168.43.146.8880 > 192.168.43.147.7772: UDP, length 120
00:36:32.574332 IP 192.168.43.147.8880 > 192.168.43.124.7773: UDP, length 120
00:36:32.587445 IP 192.168.43.146.8880 > 192.168.43.147.7772: UDP, length 120
00:36:32.624328 IP 192.168.43.147.8880 > 192.168.43.124.7773: UDP, length 120
00:36:32.637951 IP 192.168.43.146.8880 > 192.168.43.147.7772: UDP, length 120
00:36:32.674327 IP 192.168.43.147.8880 > 192.168.43.124.7773: UDP, length 120
00:36:32.690192 IP 192.168.43.146.8880 > 192.168.43.147.7772: UDP, length 120
00:36:32.724324 IP 192.168.43.147.8880 > 192.168.43.124.7773: UDP, length 120
00:36:32.774321 IP 192.168.43.147.8880 > 192.168.43.124.7773: UDP, length 120
00:36:32.812823 IP 192.168.43.146.8880 > 192.168.43.147.7772: UDP, length 120
00:36:32.818015 IP 192.168.43.146.8880 > 192.168.43.147.7772: UDP, length 120
00:36:32.824326 IP 192.168.43.147.8880 > 192.168.43.124.7773: UDP, length 120
00:36:32.854204 IP 192.168.43.146.8880 > 192.168.43.147.7772: UDP, length 120
00:36:32.874374 IP 192.168.43.147.8880 > 192.168.43.124.7773: UDP, length 120
00:36:32.923967 IP 192.168.43.146.8880 > 192.168.43.147.7772: UDP, length 120
00:36:32.924324 IP 192.168.43.147.8880 > 192.168.43.124.7773: UDP, length 120
00:36:32.941052 IP 192.168.43.146.8880 > 192.168.43.147.7772: UDP, length 120
00:36:32.974325 IP 192.168.43.147.8880 > 192.168.43.124.7773: UDP, length 120
00:36:33.017762 IP 192.168.43.146.8880 > 192.168.43.147.7772: UDP, length 120
00:36:33.024326 IP 192.168.43.147.8880 > 192.168.43.124.7773: UDP, length 120
00:36:33.046926 IP 192.168.43.146.8880 > 192.168.43.147.7772: UDP, length 120
00:36:33.074327 IP 192.168.43.147.8880 > 192.168.43.124.7773: UDP, length 120
00:36:33.124328 IP 192.168.43.147.8880 > 192.168.43.124.7773: UDP, length 120
00:36:33.126453 IP 192.168.43.146.8880 > 192.168.43.147.7772: UDP, length 120
00:36:33.145709 IP 192.168.43.146.8880 > 192.168.43.147.7772: UDP, length 120
00:36:33.174330 IP 192.168.43.147.8880 > 192.168.43.124.7773: UDP, length 120
00:36:33.224324 IP 192.168.43.147.8880 > 192.168.43.124.7773: UDP, length 120
00:36:33.229213 IP 192.168.43.146.8880 > 192.168.43.147.7772: UDP, length 120
00:36:33.274325 IP 192.168.43.147.8880 > 192.168.43.124.7773: UDP, length 120
00:36:33.307260 IP 192.168.43.146.8880 > 192.168.43.147.7772: UDP, length 120
00:36:33.324325 IP 192.168.43.147.8880 > 192.168.43.124.7773: UDP, length 120
00:36:33.328753 IP 192.168.43.146.8880 > 192.168.43.147.7772: UDP, length 120
00:36:33.336626 IP 192.168.43.146.8880 > 192.168.43.147.7772: UDP, length 120
00:36:33.374333 IP 192.168.43.147.8880 > 192.168.43.124.7773: UDP, length 120
00:36:33.414033 IP 192.168.43.146.8880 > 192.168.43.147.7772: UDP, length 120
00:36:33.424327 IP 192.168.43.147.8880 > 192.168.43.124.7773: UDP, length 120
00:36:33.440776 IP 192.168.43.146.8880 > 192.168.43.147.7772: UDP, length 120
00:36:33.474369 IP 192.168.43.147.8880 > 192.168.43.124.7773: UDP, length 120
00:36:33.507404 IP 192.168.43.146.8880 > 192.168.43.147.7772: UDP, length 120
00:36:33.524364 IP 192.168.43.147.8880 > 192.168.43.124.7773: UDP, length 120
00:36:33.542531 IP 192.168.43.146.8880 > 192.168.43.147.7772: UDP, length 120
00:36:33.574332 IP 192.168.43.147.8880 > 192.168.43.124.7773: UDP, length 120
00:36:33.593855 IP 192.168.43.146.8880 > 192.168.43.147.7772: UDP, length 120
00:36:33.624330 IP 192.168.43.147.8880 > 192.168.43.124.7773: UDP, length 120
00:36:33.642970 IP 192.168.43.146.8880 > 192.168.43.147.7772: UDP, length 120
00:36:33.674324 IP 192.168.43.147.8880 > 192.168.43.124.7773: UDP, length 120
00:36:33.692026 IP 192.168.43.146.8880 > 192.168.43.147.7772: UDP, length 120
00:36:33.724330 IP 192.168.43.147.8880 > 192.168.43.124.7773: UDP, length 120
00:36:33.740078 IP 192.168.43.146.8880 > 192.168.43.147.7772: UDP, length 120
00:36:33.774320 IP 192.168.43.147.8880 > 192.168.43.124.7773: UDP, length 120
00:36:33.820535 IP 192.168.43.146.8880 > 192.168.43.147.7772: UDP, length 120
00:36:33.824327 IP 192.168.43.147.8880 > 192.168.43.124.7773: UDP, length 120
00:36:33.843926 IP 192.168.43.146.8880 > 192.168.43.147.7772: UDP, length 120
00:36:33.874325 IP 192.168.43.147.8880 > 192.168.43.124.7773: UDP, length 120
00:36:33.907411 IP 192.168.43.146.8880 > 192.168.43.147.7772: UDP, length 120
00:36:33.924326 IP 192.168.43.147.8880 > 192.168.43.124.7773: UDP, length 120
00:36:33.946738 IP 192.168.43.146.8880 > 192.168.43.147.7772: UDP, length 120
00:36:33.974325 IP 192.168.43.147.8880 > 192.168.43.124.7773: UDP, length 120
00:36:34.002192 IP 192.168.43.146.8880 > 192.168.43.147.7772: UDP, length 120
00:36:34.024325 IP 192.168.43.147.8880 > 192.168.43.124.7773: UDP, length 120
00:36:34.045662 IP 192.168.43.146.8880 > 192.168.43.147.7772: UDP, length 120
00:36:34.074327 IP 192.168.43.147.8880 > 192.168.43.124.7773: UDP, length 120
00:36:34.106786 IP 192.168.43.146.8880 > 192.168.43.147.7772: UDP, length 120
00:36:34.124326 IP 192.168.43.147.8880 > 192.168.43.124.7773: UDP, length 120
00:36:34.148827 IP 192.168.43.146.8880 > 192.168.43.147.7772: UDP, length 120
00:36:34.174330 IP 192.168.43.147.8880 > 192.168.43.124.7773: UDP, length 120
00:36:34.201244 IP 192.168.43.146.8880 > 192.168.43.147.7772: UDP, length 120
00:36:34.224330 IP 192.168.43.147.8880 > 192.168.43.124.7773: UDP, length 120
00:36:34.239716 IP 192.168.43.146.8880 > 192.168.43.147.7772: UDP, length 120
00:36:34.274325 IP 192.168.43.147.8880 > 192.168.43.124.7773: UDP, length 120
00:36:34.291915 IP 192.168.43.146.8880 > 192.168.43.147.7772: UDP, length 120
00:36:34.324327 IP 192.168.43.147.8880 > 192.168.43.124.7773: UDP, length 120
00:36:34.345652 IP 192.168.43.146.8880 > 192.168.43.147.7772: UDP, length 120
00:36:34.374325 IP 192.168.43.147.8880 > 192.168.43.124.7773: UDP, length 120
00:36:34.403499 IP 192.168.43.146.8880 > 192.168.43.147.7772: UDP, length 120
00:36:34.424322 IP 192.168.43.147.8880 > 192.168.43.124.7773: UDP, length 120
00:36:34.462828 IP 192.168.43.146.8880 > 192.168.43.147.7772: UDP, length 120
00:36:34.474322 IP 192.168.43.147.8880 > 192.168.43.124.7773: UDP, length 120
00:36:34.490842 IP 192.168.43.146.8880 > 192.168.43.147.7772: UDP, length 120
00:36:34.524340 IP 192.168.43.147.8880 > 192.168.43.124.7773: UDP, length 120
00:36:34.541629 IP 192.168.43.146.8880 > 192.168.43.147.7772: UDP, length 120
00:36:34.574327 IP 192.168.43.147.8880 > 192.168.43.124.7773: UDP, length 120
00:36:34.617304 IP 192.168.43.146.8880 > 192.168.43.147.7772: UDP, length 120
00:36:34.624329 IP 192.168.43.147.8880 > 192.168.43.124.7773: UDP, length 120
00:36:34.656374 IP 192.168.43.146.8880 > 192.168.43.147.7772: UDP, length 120
00:36:34.674327 IP 192.168.43.147.8880 > 192.168.43.124.7773: UDP, length 120
00:36:34.685634 IP 192.168.43.146.8880 > 192.168.43.147.7772: UDP, length 120
00:36:34.724325 IP 192.168.43.147.8880 > 192.168.43.124.7773: UDP, length 120
00:36:34.737747 IP 192.168.43.146.8880 > 192.168.43.147.7772: UDP, length 120
00:36:34.774323 IP 192.168.43.147.8880 > 192.168.43.124.7773: UDP, length 120
00:36:34.785743 IP 192.168.43.146.8880 > 192.168.43.147.7772: UDP, length 120
00:36:34.824325 IP 192.168.43.147.8880 > 192.168.43.124.7773: UDP, length 120
00:36:34.838112 IP 192.168.43.146.8880 > 192.168.43.147.7772: UDP, length 120
00:36:34.874323 IP 192.168.43.147.8880 > 192.168.43.124.7773: UDP, length 120
00:36:34.886509 IP 192.168.43.146.8880 > 192.168.43.147.7772: UDP, length 120
00:36:34.924325 IP 192.168.43.147.8880 > 192.168.43.124.7773: UDP, length 120
00:36:34.936988 IP 192.168.43.146.8880 > 192.168.43.147.7772: UDP, length 120
00:36:34.974363 IP 192.168.43.147.8880 > 192.168.43.124.7773: UDP, length 120
00:36:34.987561 IP 192.168.43.146.8880 > 192.168.43.147.7772: UDP, length 120
00:36:35.024333 IP 192.168.43.147.8880 > 192.168.43.124.7773: UDP, length 120
00:36:35.035087 IP 192.168.43.146.8880 > 192.168.43.147.7772: UDP, length 120
00:36:35.074328 IP 192.168.43.147.8880 > 192.168.43.124.7773: UDP, length 120
00:36:35.088970 IP 192.168.43.146.8880 > 192.168.43.147.7772: UDP, length 120
00:36:35.124326 IP 192.168.43.147.8880 > 192.168.43.124.7773: UDP, length 120
00:36:35.138558 IP 192.168.43.146.8880 > 192.168.43.147.7772: UDP, length 120
00:36:35.174327 IP 192.168.43.147.8880 > 192.168.43.124.7773: UDP, length 120
00:36:35.187763 IP 192.168.43.146.8880 > 192.168.43.147.7772: UDP, length 120
00:36:35.224329 IP 192.168.43.147.8880 > 192.168.43.124.7773: UDP, length 120
00:36:35.238476 IP 192.168.43.146.8880 > 192.168.43.147.7772: UDP, length 120
00:36:35.274327 IP 192.168.43.147.8880 > 192.168.43.124.7773: UDP, length 120
00:36:35.286991 IP 192.168.43.146.8880 > 192.168.43.147.7772: UDP, length 120
00:36:35.324328 IP 192.168.43.147.8880 > 192.168.43.124.7773: UDP, length 120
00:36:35.342454 IP 192.168.43.146.8880 > 192.168.43.147.7772: UDP, length 120
00:36:35.374324 IP 192.168.43.147.8880 > 192.168.43.124.7773: UDP, length 120
00:36:35.388927 IP 192.168.43.146.8880 > 192.168.43.147.7772: UDP, length 120
00:36:35.424325 IP 192.168.43.147.8880 > 192.168.43.124.7773: UDP, length 120
00:36:35.449729 IP 192.168.43.146.8880 > 192.168.43.147.7772: UDP, length 120
00:36:35.474321 IP 192.168.43.147.8880 > 192.168.43.124.7773: UDP, length 120
00:36:35.486546 IP 192.168.43.146.8880 > 192.168.43.147.7772: UDP, length 120
00:36:35.524335 IP 192.168.43.147.8880 > 192.168.43.124.7773: UDP, length 120
00:36:35.537637 IP 192.168.43.146.8880 > 192.168.43.147.7772: UDP, length 120
00:36:35.574327 IP 192.168.43.147.8880 > 192.168.43.124.7773: UDP, length 120
00:36:35.588242 IP 192.168.43.146.8880 > 192.168.43.147.7772: UDP, length 120
00:36:35.624324 IP 192.168.43.147.8880 > 192.168.43.124.7773: UDP, length 120
00:36:35.638027 IP 192.168.43.146.8880 > 192.168.43.147.7772: UDP, length 120
00:36:35.674323 IP 192.168.43.147.8880 > 192.168.43.124.7773: UDP, length 120
00:36:35.686603 IP 192.168.43.146.8880 > 192.168.43.147.7772: UDP, length 120
00:36:35.724322 IP 192.168.43.147.8880 > 192.168.43.124.7773: UDP, length 120
00:36:35.736968 IP 192.168.43.146.8880 > 192.168.43.147.7772: UDP, length 120
00:36:35.774324 IP 192.168.43.147.8880 > 192.168.43.124.7773: UDP, length 120
00:36:35.789962 IP 192.168.43.146.8880 > 192.168.43.147.7772: UDP, length 120
00:36:35.824323 IP 192.168.43.147.8880 > 192.168.43.124.7773: UDP, length 120
00:36:35.836698 IP 192.168.43.146.8880 > 192.168.43.147.7772: UDP, length 120
00:36:35.874322 IP 192.168.43.147.8880 > 192.168.43.124.7773: UDP, length 120
00:36:35.889908 IP 192.168.43.146.8880 > 192.168.43.147.7772: UDP, length 120
00:36:35.924323 IP 192.168.43.147.8880 > 192.168.43.124.7773: UDP, length 120
00:36:35.938309 IP 192.168.43.146.8880 > 192.168.43.147.7772: UDP, length 120
00:36:35.974322 IP 192.168.43.147.8880 > 192.168.43.124.7773: UDP, length 120
00:36:35.986996 IP 192.168.43.146.8880 > 192.168.43.147.7772: UDP, length 120
00:36:36.024322 IP 192.168.43.147.8880 > 192.168.43.124.7773: UDP, length 120
00:36:36.043004 IP 192.168.43.146.8880 > 192.168.43.147.7772: UDP, length 120
00:36:36.074321 IP 192.168.43.147.8880 > 192.168.43.124.7773: UDP, length 120
00:36:36.087086 IP 192.168.43.146.8880 > 192.168.43.147.7772: UDP, length 120
00:36:36.124322 IP 192.168.43.147.8880 > 192.168.43.124.7773: UDP, length 120
00:36:36.136842 IP 192.168.43.146.8880 > 192.168.43.147.7772: UDP, length 120
00:36:36.174324 IP 192.168.43.147.8880 > 192.168.43.124.7773: UDP, length 120
00:36:36.201379 IP 192.168.43.146.8880 > 192.168.43.147.7772: UDP, length 120
00:36:36.224325 IP 192.168.43.147.8880 > 192.168.43.124.7773: UDP, length 120
00:36:36.239499 IP 192.168.43.146.8880 > 192.168.43.147.7772: UDP, length 120
00:36:36.274326 IP 192.168.43.147.8880 > 192.168.43.124.7773: UDP, length 120
00:36:36.289183 IP 192.168.43.146.8880 > 192.168.43.147.7772: UDP, length 120
00:36:36.324328 IP 192.168.43.147.8880 > 192.168.43.124.7773: UDP, length 120
00:36:36.341063 IP 192.168.43.146.8880 > 192.168.43.147.7772: UDP, length 120
00:36:36.374327 IP 192.168.43.147.8880 > 192.168.43.124.7773: UDP, length 120
00:36:36.390088 IP 192.168.43.146.8880 > 192.168.43.147.7772: UDP, length 120
00:36:36.424326 IP 192.168.43.147.8880 > 192.168.43.124.7773: UDP, length 120
00:36:36.446980 IP 192.168.43.146.8880 > 192.168.43.147.7772: UDP, length 120
00:36:36.474359 IP 192.168.43.147.8880 > 192.168.43.124.7773: UDP, length 120
00:36:36.487882 IP 192.168.43.146.8880 > 192.168.43.147.7772: UDP, length 120
00:36:36.524343 IP 192.168.43.147.8880 > 192.168.43.124.7773: UDP, length 120
00:36:36.537939 IP 192.168.43.146.8880 > 192.168.43.147.7772: UDP, length 120
00:36:36.574330 IP 192.168.43.147.8880 > 192.168.43.124.7773: UDP, length 120
00:36:36.589158 IP 192.168.43.146.8880 > 192.168.43.147.7772: UDP, length 120
00:36:36.624326 IP 192.168.43.147.8880 > 192.168.43.124.7773: UDP, length 120
00:36:36.638400 IP 192.168.43.146.8880 > 192.168.43.147.7772: UDP, length 120
00:36:36.674327 IP 192.168.43.147.8880 > 192.168.43.124.7773: UDP, length 120
00:36:36.686653 IP 192.168.43.146.8880 > 192.168.43.147.7772: UDP, length 120
00:36:36.724326 IP 192.168.43.147.8880 > 192.168.43.124.7773: UDP, length 120
00:36:36.745872 IP 192.168.43.146.8880 > 192.168.43.147.7772: UDP, length 120
00:36:36.774324 IP 192.168.43.147.8880 > 192.168.43.124.7773: UDP, length 120
00:36:36.786743 IP 192.168.43.146.8880 > 192.168.43.147.7772: UDP, length 120
00:36:36.824326 IP 192.168.43.147.8880 > 192.168.43.124.7773: UDP, length 120
00:36:36.837331 IP 192.168.43.146.8880 > 192.168.43.147.7772: UDP, length 120
00:36:36.874324 IP 192.168.43.147.8880 > 192.168.43.124.7773: UDP, length 120
00:36:36.891399 IP 192.168.43.146.8880 > 192.168.43.147.7772: UDP, length 120
00:36:36.924324 IP 192.168.43.147.8880 > 192.168.43.124.7773: UDP, length 120
00:36:36.936640 IP 192.168.43.146.8880 > 192.168.43.147.7772: UDP, length 120
00:36:36.974324 IP 192.168.43.147.8880 > 192.168.43.124.7773: UDP, length 120
00:36:36.988491 IP 192.168.43.146.8880 > 192.168.43.147.7772: UDP, length 120
00:36:37.024324 IP 192.168.43.147.8880 > 192.168.43.124.7773: UDP, length 120
00:36:37.036812 IP 192.168.43.146.8880 > 192.168.43.147.7772: UDP, length 120
00:36:37.074332 IP 192.168.43.147.8880 > 192.168.43.124.7773: UDP, length 120
00:36:37.087346 IP 192.168.43.146.8880 > 192.168.43.147.7772: UDP, length 120
00:36:37.124324 IP 192.168.43.147.8880 > 192.168.43.124.7773: UDP, length 120
00:36:37.138383 IP 192.168.43.146.8880 > 192.168.43.147.7772: UDP, length 120
00:36:37.174325 IP 192.168.43.147.8880 > 192.168.43.124.7773: UDP, length 120
00:36:37.187918 IP 192.168.43.146.8880 > 192.168.43.147.7772: UDP, length 120
00:36:37.224330 IP 192.168.43.147.8880 > 192.168.43.124.7773: UDP, length 120
00:36:37.238196 IP 192.168.43.146.8880 > 192.168.43.147.7772: UDP, length 120
00:36:37.274327 IP 192.168.43.147.8880 > 192.168.43.124.7773: UDP, length 120
00:36:37.286785 IP 192.168.43.146.8880 > 192.168.43.147.7772: UDP, length 120
00:36:37.324329 IP 192.168.43.147.8880 > 192.168.43.124.7773: UDP, length 120
00:36:37.338159 IP 192.168.43.146.8880 > 192.168.43.147.7772: UDP, length 120
00:36:37.374330 IP 192.168.43.147.8880 > 192.168.43.124.7773: UDP, length 120
00:36:37.389159 IP 192.168.43.146.8880 > 192.168.43.147.7772: UDP, length 120
00:36:37.424327 IP 192.168.43.147.8880 > 192.168.43.124.7773: UDP, length 120
00:36:37.445371 IP 192.168.43.146.8880 > 192.168.43.147.7772: UDP, length 120
00:36:37.474324 IP 192.168.43.147.8880 > 192.168.43.124.7773: UDP, length 120
00:36:37.493598 IP 192.168.43.146.8880 > 192.168.43.147.7772: UDP, length 120
00:36:37.524332 IP 192.168.43.147.8880 > 192.168.43.124.7773: UDP, length 120
00:36:37.535265 IP 192.168.43.146.8880 > 192.168.43.147.7772: UDP, length 120
00:36:37.574324 IP 192.168.43.147.8880 > 192.168.43.124.7773: UDP, length 120
00:36:37.609563 IP 192.168.43.146.8880 > 192.168.43.147.7772: UDP, length 120
00:36:37.624321 IP 192.168.43.147.8880 > 192.168.43.124.7773: UDP, length 120
00:36:37.636693 IP 192.168.43.146.8880 > 192.168.43.147.7772: UDP, length 120
00:36:37.674325 IP 192.168.43.147.8880 > 192.168.43.124.7773: UDP, length 120
00:36:37.711128 IP 192.168.43.146.8880 > 192.168.43.147.7772: UDP, length 120
00:36:37.724323 IP 192.168.43.147.8880 > 192.168.43.124.7773: UDP, length 120
00:36:37.736389 IP 192.168.43.146.8880 > 192.168.43.147.7772: UDP, length 120
00:36:37.774332 IP 192.168.43.147.8880 > 192.168.43.124.7773: UDP, length 120
00:36:37.802307 IP 192.168.43.146.8880 > 192.168.43.147.7772: UDP, length 120
00:36:37.824323 IP 192.168.43.147.8880 > 192.168.43.124.7773: UDP, length 120
00:36:37.837390 IP 192.168.43.146.8880 > 192.168.43.147.7772: UDP, length 120
00:36:37.874322 IP 192.168.43.147.8880 > 192.168.43.124.7773: UDP, length 120
00:36:37.893044 IP 192.168.43.146.8880 > 192.168.43.147.7772: UDP, length 120
00:36:37.924324 IP 192.168.43.147.8880 > 192.168.43.124.7773: UDP, length 120
00:36:37.938071 IP 192.168.43.146.8880 > 192.168.43.147.7772: UDP, length 120
00:36:37.974375 IP 192.168.43.147.8880 > 192.168.43.124.7773: UDP, length 120
00:36:38.020956 IP 192.168.43.146.8880 > 192.168.43.147.7772: UDP, length 120
00:36:38.024329 IP 192.168.43.147.8880 > 192.168.43.124.7773: UDP, length 120
00:36:38.043688 IP 192.168.43.146.8880 > 192.168.43.147.7772: UDP, length 120
00:36:38.074332 IP 192.168.43.147.8880 > 192.168.43.124.7773: UDP, length 120
00:36:38.089076 IP 192.168.43.146.8880 > 192.168.43.147.7772: UDP, length 120
00:36:38.124327 IP 192.168.43.147.8880 > 192.168.43.124.7773: UDP, length 120
00:36:38.142700 IP 192.168.43.146.8880 > 192.168.43.147.7772: UDP, length 120
00:36:38.174324 IP 192.168.43.147.8880 > 192.168.43.124.7773: UDP, length 120
00:36:38.224321 IP 192.168.43.147.8880 > 192.168.43.124.7773: UDP, length 120
00:36:38.236585 IP 192.168.43.146.8880 > 192.168.43.147.7772: UDP, length 120
00:36:38.245448 IP 192.168.43.146.8880 > 192.168.43.147.7772: UDP, length 120
00:36:38.274323 IP 192.168.43.147.8880 > 192.168.43.124.7773: UDP, length 120
00:36:38.324333 IP 192.168.43.147.8880 > 192.168.43.124.7773: UDP, length 120
00:36:38.354812 IP 192.168.43.146.8880 > 192.168.43.147.7772: UDP, length 120
00:36:38.355081 IP 192.168.43.146.8880 > 192.168.43.147.7772: UDP, length 120
00:36:38.374334 IP 192.168.43.147.8880 > 192.168.43.124.7773: UDP, length 120
00:36:38.402157 IP 192.168.43.146.8880 > 192.168.43.147.7772: UDP, length 120
00:36:38.424347 IP 192.168.43.147.8880 > 192.168.43.124.7773: UDP, length 120
00:36:38.441524 IP 192.168.43.146.8880 > 192.168.43.147.7772: UDP, length 120
00:36:38.474325 IP 192.168.43.147.8880 > 192.168.43.124.7773: UDP, length 120
00:36:38.524333 IP 192.168.43.147.8880 > 192.168.43.124.7773: UDP, length 120
00:36:38.532761 IP 192.168.43.146.8880 > 192.168.43.147.7772: UDP, length 120
00:36:38.553713 IP 192.168.43.146.8880 > 192.168.43.147.7772: UDP, length 120
00:36:38.574331 IP 192.168.43.147.8880 > 192.168.43.124.7773: UDP, length 120
00:36:38.601266 IP 192.168.43.146.8880 > 192.168.43.147.7772: UDP, length 120
00:36:38.624327 IP 192.168.43.147.8880 > 192.168.43.124.7773: UDP, length 120
00:36:38.657184 IP 192.168.43.146.8880 > 192.168.43.147.7772: UDP, length 120
00:36:38.674321 IP 192.168.43.147.8880 > 192.168.43.124.7773: UDP, length 120
00:36:38.692332 IP 192.168.43.146.8880 > 192.168.43.147.7772: UDP, length 120
00:36:38.724323 IP 192.168.43.147.8880 > 192.168.43.124.7773: UDP, length 120
00:36:38.765575 IP 192.168.43.146.8880 > 192.168.43.147.7772: UDP, length 120
00:36:38.774319 IP 192.168.43.147.8880 > 192.168.43.124.7773: UDP, length 120
00:36:38.808835 IP 192.168.43.146.8880 > 192.168.43.147.7772: UDP, length 120
00:36:38.824320 IP 192.168.43.147.8880 > 192.168.43.124.7773: UDP, length 120
00:36:38.863050 IP 192.168.43.146.8880 > 192.168.43.147.7772: UDP, length 120
00:36:38.874319 IP 192.168.43.147.8880 > 192.168.43.124.7773: UDP, length 120
00:36:38.897290 IP 192.168.43.146.8880 > 192.168.43.147.7772: UDP, length 120
00:36:38.924326 IP 192.168.43.147.8880 > 192.168.43.124.7773: UDP, length 120
00:36:38.965837 IP 192.168.43.146.8880 > 192.168.43.147.7772: UDP, length 120
00:36:38.974319 IP 192.168.43.147.8880 > 192.168.43.124.7773: UDP, length 120
00:36:38.994401 IP 192.168.43.146.8880 > 192.168.43.147.7772: UDP, length 120
00:36:39.024322 IP 192.168.43.147.8880 > 192.168.43.124.7773: UDP, length 120
00:36:39.068265 IP 192.168.43.146.8880 > 192.168.43.147.7772: UDP, length 120
00:36:39.074319 IP 192.168.43.147.8880 > 192.168.43.124.7773: UDP, length 120
00:36:39.099226 IP 192.168.43.146.8880 > 192.168.43.147.7772: UDP, length 120
00:36:39.124322 IP 192.168.43.147.8880 > 192.168.43.124.7773: UDP, length 120
00:36:39.168596 IP 192.168.43.146.8880 > 192.168.43.147.7772: UDP, length 120
00:36:39.174319 IP 192.168.43.147.8880 > 192.168.43.124.7773: UDP, length 120
00:36:39.198693 IP 192.168.43.146.8880 > 192.168.43.147.7772: UDP, length 120
00:36:39.224324 IP 192.168.43.147.8880 > 192.168.43.124.7773: UDP, length 120
00:36:39.246954 IP 192.168.43.146.8880 > 192.168.43.147.7772: UDP, length 120
00:36:39.274322 IP 192.168.43.147.8880 > 192.168.43.124.7773: UDP, length 120
00:36:39.324321 IP 192.168.43.147.8880 > 192.168.43.124.7773: UDP, length 120
00:36:39.374319 IP 192.168.43.147.8880 > 192.168.43.124.7773: UDP, length 120
00:36:39.375435 IP 192.168.43.146.8880 > 192.168.43.147.7772: UDP, length 120
00:36:39.375691 IP 192.168.43.146.8880 > 192.168.43.147.7772: UDP, length 120
00:36:39.424337 IP 192.168.43.147.8880 > 192.168.43.124.7773: UDP, length 120
00:36:39.424513 IP 192.168.43.146.8880 > 192.168.43.147.7772: UDP, length 120
00:36:39.446651 IP 192.168.43.146.8880 > 192.168.43.147.7772: UDP, length 120
00:36:39.474369 IP 192.168.43.147.8880 > 192.168.43.124.7773: UDP, length 120
00:36:39.489640 IP 192.168.43.146.8880 > 192.168.43.147.7772: UDP, length 120
00:36:39.524369 IP 192.168.43.147.8880 > 192.168.43.124.7773: UDP, length 120
00:36:39.568932 IP 192.168.43.146.8880 > 192.168.43.147.7772: UDP, length 120
00:36:39.574337 IP 192.168.43.147.8880 > 192.168.43.124.7773: UDP, length 120
00:36:39.587575 IP 192.168.43.146.8880 > 192.168.43.147.7772: UDP, length 120
00:36:39.624331 IP 192.168.43.147.8880 > 192.168.43.124.7773: UDP, length 120
00:36:39.674326 IP 192.168.43.147.8880 > 192.168.43.124.7773: UDP, length 120
00:36:39.675313 IP 192.168.43.146.8880 > 192.168.43.147.7772: UDP, length 120
00:36:39.696409 IP 192.168.43.146.8880 > 192.168.43.147.7772: UDP, length 120
00:36:39.724329 IP 192.168.43.147.8880 > 192.168.43.124.7773: UDP, length 120
00:36:39.751922 IP 192.168.43.146.8880 > 192.168.43.147.7772: UDP, length 120
00:36:39.774326 IP 192.168.43.147.8880 > 192.168.43.124.7773: UDP, length 120
00:36:39.786738 IP 192.168.43.146.8880 > 192.168.43.147.7772: UDP, length 120
00:36:39.824326 IP 192.168.43.147.8880 > 192.168.43.124.7773: UDP, length 120
00:36:39.874323 IP 192.168.43.147.8880 > 192.168.43.124.7773: UDP, length 120
00:36:39.883588 IP 192.168.43.146.8880 > 192.168.43.147.7772: UDP, length 120
00:36:39.886890 IP 192.168.43.146.8880 > 192.168.43.147.7772: UDP, length 120
00:36:39.924329 IP 192.168.43.147.8880 > 192.168.43.124.7773: UDP, length 120
00:36:39.966419 IP 192.168.43.146.8880 > 192.168.43.147.7772: UDP, length 120
00:36:39.974323 IP 192.168.43.147.8880 > 192.168.43.124.7773: UDP, length 120
00:36:39.986678 IP 192.168.43.146.8880 > 192.168.43.147.7772: UDP, length 120
00:36:40.024326 IP 192.168.43.147.8880 > 192.168.43.124.7773: UDP, length 120
00:36:40.069007 IP 192.168.43.146.8880 > 192.168.43.147.7772: UDP, length 120
00:36:40.074325 IP 192.168.43.147.8880 > 192.168.43.124.7773: UDP, length 120
00:36:40.090999 IP 192.168.43.146.8880 > 192.168.43.147.7772: UDP, length 120
00:36:40.124324 IP 192.168.43.147.8880 > 192.168.43.124.7773: UDP, length 120
00:36:40.136843 IP 192.168.43.146.8880 > 192.168.43.147.7772: UDP, length 120
00:36:40.174324 IP 192.168.43.147.8880 > 192.168.43.124.7773: UDP, length 120
00:36:40.186969 IP 192.168.43.146.8880 > 192.168.43.147.7772: UDP, length 120
00:36:40.224324 IP 192.168.43.147.8880 > 192.168.43.124.7773: UDP, length 120
00:36:40.236910 IP 192.168.43.146.8880 > 192.168.43.147.7772: UDP, length 120
00:36:40.274324 IP 192.168.43.147.8880 > 192.168.43.124.7773: UDP, length 120
00:36:40.286871 IP 192.168.43.146.8880 > 192.168.43.147.7772: UDP, length 120
00:36:40.324375 IP 192.168.43.147.8880 > 192.168.43.124.7773: UDP, length 120
00:36:40.337333 IP 192.168.43.146.8880 > 192.168.43.147.7772: UDP, length 120
00:36:40.374325 IP 192.168.43.147.8880 > 192.168.43.124.7773: UDP, length 120
00:36:40.386711 IP 192.168.43.146.8880 > 192.168.43.147.7772: UDP, length 120
00:36:40.424325 IP 192.168.43.147.8880 > 192.168.43.124.7773: UDP, length 120
00:36:40.442457 IP 192.168.43.146.8880 > 192.168.43.147.7772: UDP, length 120
00:36:40.474329 IP 192.168.43.147.8880 > 192.168.43.124.7773: UDP, length 120
00:36:40.486730 IP 192.168.43.146.8880 > 192.168.43.147.7772: UDP, length 120
00:36:40.524349 IP 192.168.43.147.8880 > 192.168.43.124.7773: UDP, length 120
00:36:40.536948 IP 192.168.43.146.8880 > 192.168.43.147.7772: UDP, length 120
00:36:40.574331 IP 192.168.43.147.8880 > 192.168.43.124.7773: UDP, length 120
00:36:40.588341 IP 192.168.43.146.8880 > 192.168.43.147.7772: UDP, length 120
00:36:40.624328 IP 192.168.43.147.8880 > 192.168.43.124.7773: UDP, length 120
00:36:40.662536 IP 192.168.43.146.8880 > 192.168.43.147.7772: UDP, length 120
00:36:40.674319 IP 192.168.43.147.8880 > 192.168.43.124.7773: UDP, length 120
00:36:40.686777 IP 192.168.43.146.8880 > 192.168.43.147.7772: UDP, length 120
00:36:40.724324 IP 192.168.43.147.8880 > 192.168.43.124.7773: UDP, length 120
00:36:40.744854 IP 192.168.43.146.8880 > 192.168.43.147.7772: UDP, length 120
00:36:40.774323 IP 192.168.43.147.8880 > 192.168.43.124.7773: UDP, length 120
00:36:40.787878 IP 192.168.43.146.8880 > 192.168.43.147.7772: UDP, length 120
00:36:40.824331 IP 192.168.43.147.8880 > 192.168.43.124.7773: UDP, length 120
00:36:40.838397 IP 192.168.43.146.8880 > 192.168.43.147.7772: UDP, length 120
00:36:40.874325 IP 192.168.43.147.8880 > 192.168.43.124.7773: UDP, length 120
00:36:40.887562 IP 192.168.43.146.8880 > 192.168.43.147.7772: UDP, length 120
00:36:40.924324 IP 192.168.43.147.8880 > 192.168.43.124.7773: UDP, length 120
00:36:40.940022 IP 192.168.43.146.8880 > 192.168.43.147.7772: UDP, length 120
00:36:40.974381 IP 192.168.43.147.8880 > 192.168.43.124.7773: UDP, length 120
00:36:40.987402 IP 192.168.43.146.8880 > 192.168.43.147.7772: UDP, length 120
00:36:41.024335 IP 192.168.43.147.8880 > 192.168.43.124.7773: UDP, length 120
00:36:41.040483 IP 192.168.43.146.8880 > 192.168.43.147.7772: UDP, length 120
00:36:41.074332 IP 192.168.43.147.8880 > 192.168.43.124.7773: UDP, length 120
00:36:41.086819 IP 192.168.43.146.8880 > 192.168.43.147.7772: UDP, length 120
00:36:41.124327 IP 192.168.43.147.8880 > 192.168.43.124.7773: UDP, length 120
00:36:41.138857 IP 192.168.43.146.8880 > 192.168.43.147.7772: UDP, length 120
00:36:41.174320 IP 192.168.43.147.8880 > 192.168.43.124.7773: UDP, length 120
00:36:41.187104 IP 192.168.43.146.8880 > 192.168.43.147.7772: UDP, length 120
00:36:41.224327 IP 192.168.43.147.8880 > 192.168.43.124.7773: UDP, length 120
00:36:41.237546 IP 192.168.43.146.8880 > 192.168.43.147.7772: UDP, length 120
00:36:41.274323 IP 192.168.43.147.8880 > 192.168.43.124.7773: UDP, length 120
00:36:41.287198 IP 192.168.43.146.8880 > 192.168.43.147.7772: UDP, length 120
