01:07:24.620474 IP 192.168.43.146.8880 > 192.168.43.147.7772: UDP, length 120
01:07:24.652399 IP 192.168.43.146.8880 > 192.168.43.147.7772: UDP, length 120
01:07:24.709489 IP 192.168.43.146.8880 > 192.168.43.147.7772: UDP, length 120
01:07:24.758571 IP 192.168.43.146.8880 > 192.168.43.147.7772: UDP, length 120
01:07:24.815593 IP 192.168.43.146.8880 > 192.168.43.147.7772: UDP, length 120
01:07:24.852050 IP 192.168.43.146.8880 > 192.168.43.147.7772: UDP, length 120
01:07:24.853240 IP 192.168.43.147.8880 > 192.168.43.124.7773: UDP, length 120
01:07:24.902585 IP 192.168.43.146.8880 > 192.168.43.147.7772: UDP, length 120
01:07:24.903302 IP 192.168.43.147.8880 > 192.168.43.124.7773: UDP, length 120
01:07:24.952475 IP 192.168.43.146.8880 > 192.168.43.147.7772: UDP, length 120
01:07:24.953265 IP 192.168.43.147.8880 > 192.168.43.124.7773: UDP, length 120
01:07:25.003270 IP 192.168.43.147.8880 > 192.168.43.124.7773: UDP, length 120
01:07:25.006682 IP 192.168.43.146.8880 > 192.168.43.147.7772: UDP, length 120
01:07:25.053266 IP 192.168.43.147.8880 > 192.168.43.124.7773: UDP, length 120
01:07:25.059071 IP 192.168.43.146.8880 > 192.168.43.147.7772: UDP, length 120
01:07:25.103267 IP 192.168.43.147.8880 > 192.168.43.124.7773: UDP, length 120
01:07:25.106698 IP 192.168.43.146.8880 > 192.168.43.147.7772: UDP, length 120
01:07:25.153264 IP 192.168.43.147.8880 > 192.168.43.124.7773: UDP, length 120
01:07:25.156659 IP 192.168.43.146.8880 > 192.168.43.147.7772: UDP, length 120
01:07:25.203262 IP 192.168.43.147.8880 > 192.168.43.124.7773: UDP, length 120
01:07:25.224147 IP 192.168.43.146.8880 > 192.168.43.147.7772: UDP, length 120
01:07:25.251914 IP 192.168.43.146.8880 > 192.168.43.147.7772: UDP, length 120
01:07:25.253263 IP 192.168.43.147.8880 > 192.168.43.124.7773: UDP, length 120
01:07:25.303316 IP 192.168.43.147.8880 > 192.168.43.124.7773: UDP, length 120
01:07:25.304958 IP 192.168.43.146.8880 > 192.168.43.147.7772: UDP, length 120
01:07:25.353279 IP 192.168.43.147.8880 > 192.168.43.124.7773: UDP, length 120
01:07:25.353300 IP 192.168.43.146.8880 > 192.168.43.147.7772: UDP, length 120
01:07:25.403266 IP 192.168.43.147.8880 > 192.168.43.124.7773: UDP, length 120
01:07:25.406656 IP 192.168.43.146.8880 > 192.168.43.147.7772: UDP, length 120
01:07:25.453372 IP 192.168.43.147.8880 > 192.168.43.124.7773: UDP, length 120
01:07:25.461009 IP 192.168.43.146.8880 > 192.168.43.147.7772: UDP, length 120
01:07:25.503381 IP 192.168.43.147.8880 > 192.168.43.124.7773: UDP, length 120
01:07:25.516030 IP 192.168.43.146.8880 > 192.168.43.147.7772: UDP, length 120
01:07:25.553367 IP 192.168.43.147.8880 > 192.168.43.124.7773: UDP, length 120
01:07:25.574731 IP 192.168.43.146.8880 > 192.168.43.147.7772: UDP, length 120
01:07:25.602285 IP 192.168.43.146.8880 > 192.168.43.147.7772: UDP, length 120
01:07:25.603338 IP 192.168.43.147.8880 > 192.168.43.124.7773: UDP, length 120
01:07:25.653342 IP 192.168.43.147.8880 > 192.168.43.124.7773: UDP, length 120
01:07:25.657118 IP 192.168.43.146.8880 > 192.168.43.147.7772: UDP, length 120
01:07:25.702108 IP 192.168.43.146.8880 > 192.168.43.147.7772: UDP, length 120
01:07:25.703283 IP 192.168.43.147.8880 > 192.168.43.124.7773: UDP, length 120
01:07:25.753312 IP 192.168.43.147.8880 > 192.168.43.124.7773: UDP, length 120
01:07:25.756671 IP 192.168.43.146.8880 > 192.168.43.147.7772: UDP, length 120
01:07:25.803295 IP 192.168.43.147.8880 > 192.168.43.124.7773: UDP, length 120
01:07:25.825867 IP 192.168.43.146.8880 > 192.168.43.147.7772: UDP, length 120
01:07:25.852061 IP 192.168.43.146.8880 > 192.168.43.147.7772: UDP, length 120
01:07:25.853353 IP 192.168.43.147.8880 > 192.168.43.124.7773: UDP, length 120
01:07:25.903312 IP 192.168.43.147.8880 > 192.168.43.124.7773: UDP, length 120
01:07:25.929886 IP 192.168.43.146.8880 > 192.168.43.147.7772: UDP, length 120
01:07:25.953328 IP 192.168.43.147.8880 > 192.168.43.124.7773: UDP, length 120
01:07:25.953511 IP 192.168.43.146.8880 > 192.168.43.147.7772: UDP, length 120
01:07:26.003290 IP 192.168.43.147.8880 > 192.168.43.124.7773: UDP, length 120
01:07:26.006595 IP 192.168.43.146.8880 > 192.168.43.147.7772: UDP, length 120
01:07:26.053255 IP 192.168.43.147.8880 > 192.168.43.124.7773: UDP, length 120
01:07:26.058071 IP 192.168.43.146.8880 > 192.168.43.147.7772: UDP, length 120
01:07:26.103246 IP 192.168.43.147.8880 > 192.168.43.124.7773: UDP, length 120
01:07:26.113766 IP 192.168.43.146.8880 > 192.168.43.147.7772: UDP, length 120
01:07:26.152220 IP 192.168.43.146.8880 > 192.168.43.147.7772: UDP, length 120
01:07:26.153237 IP 192.168.43.147.8880 > 192.168.43.124.7773: UDP, length 120
01:07:26.202058 IP 192.168.43.146.8880 > 192.168.43.147.7772: UDP, length 120
01:07:26.203235 IP 192.168.43.147.8880 > 192.168.43.124.7773: UDP, length 120
01:07:26.253235 IP 192.168.43.147.8880 > 192.168.43.124.7773: UDP, length 120
01:07:26.254816 IP 192.168.43.146.8880 > 192.168.43.147.7772: UDP, length 120
01:07:26.303238 IP 192.168.43.147.8880 > 192.168.43.124.7773: UDP, length 120
01:07:26.306496 IP 192.168.43.146.8880 > 192.168.43.147.7772: UDP, length 120
01:07:26.353237 IP 192.168.43.147.8880 > 192.168.43.124.7773: UDP, length 120
01:07:26.358756 IP 192.168.43.146.8880 > 192.168.43.147.7772: UDP, length 120
01:07:26.403236 IP 192.168.43.147.8880 > 192.168.43.124.7773: UDP, length 120
01:07:26.413624 IP 192.168.43.146.8880 > 192.168.43.147.7772: UDP, length 120
01:07:26.452673 IP 192.168.43.146.8880 > 192.168.43.147.7772: UDP, length 120
01:07:26.453234 IP 192.168.43.147.8880 > 192.168.43.124.7773: UDP, length 120
01:07:26.503236 IP 192.168.43.147.8880 > 192.168.43.124.7773: UDP, length 120
01:07:26.505399 IP 192.168.43.146.8880 > 192.168.43.147.7772: UDP, length 120
01:07:26.552870 IP 192.168.43.146.8880 > 192.168.43.147.7772: UDP, length 120
01:07:26.553235 IP 192.168.43.147.8880 > 192.168.43.124.7773: UDP, length 120
01:07:26.603235 IP 192.168.43.147.8880 > 192.168.43.124.7773: UDP, length 120
01:07:26.606488 IP 192.168.43.146.8880 > 192.168.43.147.7772: UDP, length 120
01:07:26.653236 IP 192.168.43.147.8880 > 192.168.43.124.7773: UDP, length 120
01:07:26.703236 IP 192.168.43.147.8880 > 192.168.43.124.7773: UDP, length 120
01:07:26.720799 IP 192.168.43.146.8880 > 192.168.43.147.7772: UDP, length 120
01:07:26.722597 IP 192.168.43.146.8880 > 192.168.43.147.7772: UDP, length 120
01:07:26.751910 IP 192.168.43.146.8880 > 192.168.43.147.7772: UDP, length 120
01:07:26.753240 IP 192.168.43.147.8880 > 192.168.43.124.7773: UDP, length 120
01:07:26.803250 IP 192.168.43.147.8880 > 192.168.43.124.7773: UDP, length 120
01:07:26.803400 IP 192.168.43.146.8880 > 192.168.43.147.7772: UDP, length 120
01:07:26.853251 IP 192.168.43.147.8880 > 192.168.43.124.7773: UDP, length 120
01:07:26.855996 IP 192.168.43.146.8880 > 192.168.43.147.7772: UDP, length 120
01:07:26.903280 IP 192.168.43.147.8880 > 192.168.43.124.7773: UDP, length 120
01:07:26.912338 IP 192.168.43.146.8880 > 192.168.43.147.7772: UDP, length 120
01:07:26.953266 IP 192.168.43.147.8880 > 192.168.43.124.7773: UDP, length 120
01:07:26.956482 IP 192.168.43.146.8880 > 192.168.43.147.7772: UDP, length 120
01:07:27.003263 IP 192.168.43.147.8880 > 192.168.43.124.7773: UDP, length 120
01:07:27.006707 IP 192.168.43.146.8880 > 192.168.43.147.7772: UDP, length 120
01:07:27.053262 IP 192.168.43.147.8880 > 192.168.43.124.7773: UDP, length 120
01:07:27.056736 IP 192.168.43.146.8880 > 192.168.43.147.7772: UDP, length 120
01:07:27.102079 IP 192.168.43.146.8880 > 192.168.43.147.7772: UDP, length 120
01:07:27.103263 IP 192.168.43.147.8880 > 192.168.43.124.7773: UDP, length 120
01:07:27.152706 IP 192.168.43.146.8880 > 192.168.43.147.7772: UDP, length 120
01:07:27.153260 IP 192.168.43.147.8880 > 192.168.43.124.7773: UDP, length 120
01:07:27.203269 IP 192.168.43.147.8880 > 192.168.43.124.7773: UDP, length 120
01:07:27.206711 IP 192.168.43.146.8880 > 192.168.43.147.7772: UDP, length 120
01:07:27.253268 IP 192.168.43.147.8880 > 192.168.43.124.7773: UDP, length 120
01:07:27.253432 IP 192.168.43.146.8880 > 192.168.43.147.7772: UDP, length 120
01:07:27.301964 IP 192.168.43.146.8880 > 192.168.43.147.7772: UDP, length 120
01:07:27.303260 IP 192.168.43.147.8880 > 192.168.43.124.7773: UDP, length 120
01:07:27.353263 IP 192.168.43.147.8880 > 192.168.43.124.7773: UDP, length 120
01:07:27.356655 IP 192.168.43.146.8880 > 192.168.43.147.7772: UDP, length 120
01:07:27.403261 IP 192.168.43.147.8880 > 192.168.43.124.7773: UDP, length 120
01:07:27.403708 IP 192.168.43.146.8880 > 192.168.43.147.7772: UDP, length 120
01:07:27.452125 IP 192.168.43.146.8880 > 192.168.43.147.7772: UDP, length 120
01:07:27.453267 IP 192.168.43.147.8880 > 192.168.43.124.7773: UDP, length 120
01:07:27.503264 IP 192.168.43.147.8880 > 192.168.43.124.7773: UDP, length 120
01:07:27.506691 IP 192.168.43.146.8880 > 192.168.43.147.7772: UDP, length 120
01:07:27.553259 IP 192.168.43.147.8880 > 192.168.43.124.7773: UDP, length 120
01:07:27.584142 IP 192.168.43.146.8880 > 192.168.43.147.7772: UDP, length 120
01:07:27.602229 IP 192.168.43.146.8880 > 192.168.43.147.7772: UDP, length 120
01:07:27.603261 IP 192.168.43.147.8880 > 192.168.43.124.7773: UDP, length 120
01:07:27.653261 IP 192.168.43.147.8880 > 192.168.43.124.7773: UDP, length 120
01:07:27.659405 IP 192.168.43.146.8880 > 192.168.43.147.7772: UDP, length 120
01:07:27.702754 IP 192.168.43.146.8880 > 192.168.43.147.7772: UDP, length 120
01:07:27.703263 IP 192.168.43.147.8880 > 192.168.43.124.7773: UDP, length 120
01:07:27.753262 IP 192.168.43.147.8880 > 192.168.43.124.7773: UDP, length 120
01:07:27.756656 IP 192.168.43.146.8880 > 192.168.43.147.7772: UDP, length 120
01:07:27.803262 IP 192.168.43.147.8880 > 192.168.43.124.7773: UDP, length 120
01:07:27.807666 IP 192.168.43.146.8880 > 192.168.43.147.7772: UDP, length 120
01:07:27.853269 IP 192.168.43.147.8880 > 192.168.43.124.7773: UDP, length 120
01:07:27.883866 IP 192.168.43.146.8880 > 192.168.43.147.7772: UDP, length 120
01:07:27.903279 IP 192.168.43.147.8880 > 192.168.43.124.7773: UDP, length 120
01:07:27.904569 IP 192.168.43.146.8880 > 192.168.43.147.7772: UDP, length 120
01:07:27.953264 IP 192.168.43.147.8880 > 192.168.43.124.7773: UDP, length 120
01:07:27.956884 IP 192.168.43.146.8880 > 192.168.43.147.7772: UDP, length 120
01:07:28.003262 IP 192.168.43.147.8880 > 192.168.43.124.7773: UDP, length 120
01:07:28.005605 IP 192.168.43.146.8880 > 192.168.43.147.7772: UDP, length 120
01:07:28.053251 IP 192.168.43.147.8880 > 192.168.43.124.7773: UDP, length 120
01:07:28.053419 IP 192.168.43.146.8880 > 192.168.43.147.7772: UDP, length 120
01:07:28.103263 IP 192.168.43.147.8880 > 192.168.43.124.7773: UDP, length 120
01:07:28.106689 IP 192.168.43.146.8880 > 192.168.43.147.7772: UDP, length 120
01:07:28.153262 IP 192.168.43.147.8880 > 192.168.43.124.7773: UDP, length 120
01:07:28.188947 IP 192.168.43.146.8880 > 192.168.43.147.7772: UDP, length 120
01:07:28.203276 IP 192.168.43.147.8880 > 192.168.43.124.7773: UDP, length 120
01:07:28.203910 IP 192.168.43.146.8880 > 192.168.43.147.7772: UDP, length 120
01:07:28.253269 IP 192.168.43.147.8880 > 192.168.43.124.7773: UDP, length 120
01:07:28.291094 IP 192.168.43.146.8880 > 192.168.43.147.7772: UDP, length 120
01:07:28.303264 IP 192.168.43.147.8880 > 192.168.43.124.7773: UDP, length 120
01:07:28.328349 IP 192.168.43.146.8880 > 192.168.43.147.7772: UDP, length 120
01:07:28.353296 IP 192.168.43.147.8880 > 192.168.43.124.7773: UDP, length 120
01:07:28.403263 IP 192.168.43.147.8880 > 192.168.43.124.7773: UDP, length 120
01:07:28.403682 IP 192.168.43.146.8880 > 192.168.43.147.7772: UDP, length 120
01:07:28.403803 IP 192.168.43.146.8880 > 192.168.43.147.7772: UDP, length 120
01:07:28.453264 IP 192.168.43.147.8880 > 192.168.43.124.7773: UDP, length 120
01:07:28.472946 IP 192.168.43.146.8880 > 192.168.43.147.7772: UDP, length 120
01:07:28.500282 IP 192.168.43.146.8880 > 192.168.43.147.7772: UDP, length 120
01:07:28.503263 IP 192.168.43.147.8880 > 192.168.43.124.7773: UDP, length 120
01:07:28.553261 IP 192.168.43.147.8880 > 192.168.43.124.7773: UDP, length 120
01:07:28.559581 IP 192.168.43.146.8880 > 192.168.43.147.7772: UDP, length 120
01:07:28.603263 IP 192.168.43.147.8880 > 192.168.43.124.7773: UDP, length 120
01:07:28.606700 IP 192.168.43.146.8880 > 192.168.43.147.7772: UDP, length 120
01:07:28.652195 IP 192.168.43.146.8880 > 192.168.43.147.7772: UDP, length 120
01:07:28.653265 IP 192.168.43.147.8880 > 192.168.43.124.7773: UDP, length 120
01:07:28.703263 IP 192.168.43.147.8880 > 192.168.43.124.7773: UDP, length 120
01:07:28.716828 IP 192.168.43.146.8880 > 192.168.43.147.7772: UDP, length 120
01:07:28.749145 IP 192.168.43.146.8880 > 192.168.43.147.7772: UDP, length 120
01:07:28.753264 IP 192.168.43.147.8880 > 192.168.43.124.7773: UDP, length 120
01:07:28.799514 IP 192.168.43.146.8880 > 192.168.43.147.7772: UDP, length 120
01:07:28.803265 IP 192.168.43.147.8880 > 192.168.43.124.7773: UDP, length 120
01:07:28.853263 IP 192.168.43.147.8880 > 192.168.43.124.7773: UDP, length 120
01:07:28.856885 IP 192.168.43.146.8880 > 192.168.43.147.7772: UDP, length 120
01:07:28.902259 IP 192.168.43.146.8880 > 192.168.43.147.7772: UDP, length 120
01:07:28.903278 IP 192.168.43.147.8880 > 192.168.43.124.7773: UDP, length 120
01:07:28.952953 IP 192.168.43.146.8880 > 192.168.43.147.7772: UDP, length 120
01:07:28.953264 IP 192.168.43.147.8880 > 192.168.43.124.7773: UDP, length 120
01:07:29.003262 IP 192.168.43.147.8880 > 192.168.43.124.7773: UDP, length 120
01:07:29.007192 IP 192.168.43.146.8880 > 192.168.43.147.7772: UDP, length 120
01:07:29.053263 IP 192.168.43.147.8880 > 192.168.43.124.7773: UDP, length 120
01:07:29.078626 IP 192.168.43.146.8880 > 192.168.43.147.7772: UDP, length 120
01:07:29.102821 IP 192.168.43.146.8880 > 192.168.43.147.7772: UDP, length 120
01:07:29.103264 IP 192.168.43.147.8880 > 192.168.43.124.7773: UDP, length 120
01:07:29.153262 IP 192.168.43.147.8880 > 192.168.43.124.7773: UDP, length 120
01:07:29.156684 IP 192.168.43.146.8880 > 192.168.43.147.7772: UDP, length 120
01:07:29.203264 IP 192.168.43.147.8880 > 192.168.43.124.7773: UDP, length 120
01:07:29.228067 IP 192.168.43.146.8880 > 192.168.43.147.7772: UDP, length 120
01:07:29.253272 IP 192.168.43.147.8880 > 192.168.43.124.7773: UDP, length 120
01:07:29.254611 IP 192.168.43.146.8880 > 192.168.43.147.7772: UDP, length 120
01:07:29.303268 IP 192.168.43.147.8880 > 192.168.43.124.7773: UDP, length 120
01:07:29.306698 IP 192.168.43.146.8880 > 192.168.43.147.7772: UDP, length 120
01:07:29.353274 IP 192.168.43.147.8880 > 192.168.43.124.7773: UDP, length 120
01:07:29.355015 IP 192.168.43.146.8880 > 192.168.43.147.7772: UDP, length 120
01:07:29.402072 IP 192.168.43.146.8880 > 192.168.43.147.7772: UDP, length 120
01:07:29.403267 IP 192.168.43.147.8880 > 192.168.43.124.7773: UDP, length 120
01:07:29.453262 IP 192.168.43.147.8880 > 192.168.43.124.7773: UDP, length 120
01:07:29.456695 IP 192.168.43.146.8880 > 192.168.43.147.7772: UDP, length 120
01:07:29.503263 IP 192.168.43.147.8880 > 192.168.43.124.7773: UDP, length 120
01:07:29.504101 IP 192.168.43.146.8880 > 192.168.43.147.7772: UDP, length 120
01:07:29.552116 IP 192.168.43.146.8880 > 192.168.43.147.7772: UDP, length 120
01:07:29.553263 IP 192.168.43.147.8880 > 192.168.43.124.7773: UDP, length 120
01:07:29.603262 IP 192.168.43.147.8880 > 192.168.43.124.7773: UDP, length 120
01:07:29.606919 IP 192.168.43.146.8880 > 192.168.43.147.7772: UDP, length 120
01:07:29.653266 IP 192.168.43.147.8880 > 192.168.43.124.7773: UDP, length 120
01:07:29.654513 IP 192.168.43.146.8880 > 192.168.43.147.7772: UDP, length 120
01:07:29.703262 IP 192.168.43.147.8880 > 192.168.43.124.7773: UDP, length 120
01:07:29.704586 IP 192.168.43.146.8880 > 192.168.43.147.7772: UDP, length 120
01:07:29.753264 IP 192.168.43.147.8880 > 192.168.43.124.7773: UDP, length 120
01:07:29.756716 IP 192.168.43.146.8880 > 192.168.43.147.7772: UDP, length 120
01:07:29.802748 IP 192.168.43.146.8880 > 192.168.43.147.7772: UDP, length 120
01:07:29.803262 IP 192.168.43.147.8880 > 192.168.43.124.7773: UDP, length 120
01:07:29.853316 IP 192.168.43.147.8880 > 192.168.43.124.7773: UDP, length 120
01:07:29.854508 IP 192.168.43.146.8880 > 192.168.43.147.7772: UDP, length 120
01:07:29.903287 IP 192.168.43.147.8880 > 192.168.43.124.7773: UDP, length 120
01:07:29.906691 IP 192.168.43.146.8880 > 192.168.43.147.7772: UDP, length 120
01:07:29.953269 IP 192.168.43.147.8880 > 192.168.43.124.7773: UDP, length 120
01:07:29.954074 IP 192.168.43.146.8880 > 192.168.43.147.7772: UDP, length 120
01:07:30.003265 IP 192.168.43.147.8880 > 192.168.43.124.7773: UDP, length 120
01:07:30.003584 IP 192.168.43.146.8880 > 192.168.43.147.7772: UDP, length 120
01:07:30.053263 IP 192.168.43.147.8880 > 192.168.43.124.7773: UDP, length 120
01:07:30.056705 IP 192.168.43.146.8880 > 192.168.43.147.7772: UDP, length 120
01:07:30.102447 IP 192.168.43.146.8880 > 192.168.43.147.7772: UDP, length 120
01:07:30.103265 IP 192.168.43.147.8880 > 192.168.43.124.7773: UDP, length 120
01:07:30.151235 IP 192.168.43.146.8880 > 192.168.43.147.7772: UDP, length 120
01:07:30.153264 IP 192.168.43.147.8880 > 192.168.43.124.7773: UDP, length 120
01:07:30.203260 IP 192.168.43.147.8880 > 192.168.43.124.7773: UDP, length 120
01:07:30.206647 IP 192.168.43.146.8880 > 192.168.43.147.7772: UDP, length 120
01:07:30.253264 IP 192.168.43.147.8880 > 192.168.43.124.7773: UDP, length 120
01:07:30.278743 IP 192.168.43.146.8880 > 192.168.43.147.7772: UDP, length 120
01:07:30.303267 IP 192.168.43.147.8880 > 192.168.43.124.7773: UDP, length 120
01:07:30.304086 IP 192.168.43.146.8880 > 192.168.43.147.7772: UDP, length 120
01:07:30.353267 IP 192.168.43.147.8880 > 192.168.43.124.7773: UDP, length 120
01:07:30.356691 IP 192.168.43.146.8880 > 192.168.43.147.7772: UDP, length 120
01:07:30.403266 IP 192.168.43.147.8880 > 192.168.43.124.7773: UDP, length 120
01:07:30.432334 IP 192.168.43.146.8880 > 192.168.43.147.7772: UDP, length 120
01:07:30.452100 IP 192.168.43.146.8880 > 192.168.43.147.7772: UDP, length 120
01:07:30.453266 IP 192.168.43.147.8880 > 192.168.43.124.7773: UDP, length 120
01:07:30.503261 IP 192.168.43.147.8880 > 192.168.43.124.7773: UDP, length 120
01:07:30.512647 IP 192.168.43.146.8880 > 192.168.43.147.7772: UDP, length 120
01:07:30.553265 IP 192.168.43.147.8880 > 192.168.43.124.7773: UDP, length 120
01:07:30.553446 IP 192.168.43.146.8880 > 192.168.43.147.7772: UDP, length 120
01:07:30.603263 IP 192.168.43.147.8880 > 192.168.43.124.7773: UDP, length 120
01:07:30.612220 IP 192.168.43.146.8880 > 192.168.43.147.7772: UDP, length 120
01:07:30.653266 IP 192.168.43.147.8880 > 192.168.43.124.7773: UDP, length 120
01:07:30.655267 IP 192.168.43.146.8880 > 192.168.43.147.7772: UDP, length 120
01:07:30.703263 IP 192.168.43.147.8880 > 192.168.43.124.7773: UDP, length 120
01:07:30.706712 IP 192.168.43.146.8880 > 192.168.43.147.7772: UDP, length 120
01:07:30.752860 IP 192.168.43.146.8880 > 192.168.43.147.7772: UDP, length 120
01:07:30.753262 IP 192.168.43.147.8880 > 192.168.43.124.7773: UDP, length 120
01:07:30.803261 IP 192.168.43.147.8880 > 192.168.43.124.7773: UDP, length 120
01:07:30.803431 IP 192.168.43.146.8880 > 192.168.43.147.7772: UDP, length 120
01:07:30.853277 IP 192.168.43.147.8880 > 192.168.43.124.7773: UDP, length 120
01:07:30.856735 IP 192.168.43.146.8880 > 192.168.43.147.7772: UDP, length 120
01:07:30.903283 IP 192.168.43.147.8880 > 192.168.43.124.7773: UDP, length 120
01:07:30.953264 IP 192.168.43.147.8880 > 192.168.43.124.7773: UDP, length 120
01:07:30.976351 IP 192.168.43.146.8880 > 192.168.43.147.7772: UDP, length 120
01:07:30.978225 IP 192.168.43.146.8880 > 192.168.43.147.7772: UDP, length 120
01:07:31.001903 IP 192.168.43.146.8880 > 192.168.43.147.7772: UDP, length 120
01:07:31.003315 IP 192.168.43.147.8880 > 192.168.43.124.7773: UDP, length 120
01:07:31.053395 IP 192.168.43.147.8880 > 192.168.43.124.7773: UDP, length 120
01:07:31.057764 IP 192.168.43.146.8880 > 192.168.43.147.7772: UDP, length 120
01:07:31.103319 IP 192.168.43.147.8880 > 192.168.43.124.7773: UDP, length 120
01:07:31.103496 IP 192.168.43.146.8880 > 192.168.43.147.7772: UDP, length 120
01:07:31.153291 IP 192.168.43.147.8880 > 192.168.43.124.7773: UDP, length 120
01:07:31.155405 IP 192.168.43.146.8880 > 192.168.43.147.7772: UDP, length 120
01:07:31.203351 IP 192.168.43.147.8880 > 192.168.43.124.7773: UDP, length 120
01:07:31.208537 IP 192.168.43.146.8880 > 192.168.43.147.7772: UDP, length 120
01:07:31.252770 IP 192.168.43.146.8880 > 192.168.43.147.7772: UDP, length 120
01:07:31.253353 IP 192.168.43.147.8880 > 192.168.43.124.7773: UDP, length 120
01:07:31.302038 IP 192.168.43.146.8880 > 192.168.43.147.7772: UDP, length 120
01:07:31.303313 IP 192.168.43.147.8880 > 192.168.43.124.7773: UDP, length 120
01:07:31.353296 IP 192.168.43.147.8880 > 192.168.43.124.7773: UDP, length 120
01:07:31.356665 IP 192.168.43.146.8880 > 192.168.43.147.7772: UDP, length 120
01:07:31.402995 IP 192.168.43.146.8880 > 192.168.43.147.7772: UDP, length 120
01:07:31.403306 IP 192.168.43.147.8880 > 192.168.43.124.7773: UDP, length 120
01:07:31.452145 IP 192.168.43.146.8880 > 192.168.43.147.7772: UDP, length 120
01:07:31.453276 IP 192.168.43.147.8880 > 192.168.43.124.7773: UDP, length 120
01:07:31.503243 IP 192.168.43.147.8880 > 192.168.43.124.7773: UDP, length 120
01:07:31.506514 IP 192.168.43.146.8880 > 192.168.43.147.7772: UDP, length 120
01:07:31.551834 IP 192.168.43.146.8880 > 192.168.43.147.7772: UDP, length 120
01:07:31.553236 IP 192.168.43.147.8880 > 192.168.43.124.7773: UDP, length 120
01:07:31.603236 IP 192.168.43.147.8880 > 192.168.43.124.7773: UDP, length 120
01:07:31.605139 IP 192.168.43.146.8880 > 192.168.43.147.7772: UDP, length 120
01:07:31.653236 IP 192.168.43.147.8880 > 192.168.43.124.7773: UDP, length 120
01:07:31.657008 IP 192.168.43.146.8880 > 192.168.43.147.7772: UDP, length 120
01:07:31.702347 IP 192.168.43.146.8880 > 192.168.43.147.7772: UDP, length 120
01:07:31.703237 IP 192.168.43.147.8880 > 192.168.43.124.7773: UDP, length 120
01:07:31.753201 IP 192.168.43.147.8880 > 192.168.43.124.7773: UDP, length 120
01:07:31.753310 IP 192.168.43.146.8880 > 192.168.43.147.7772: UDP, length 120
01:07:31.803236 IP 192.168.43.147.8880 > 192.168.43.124.7773: UDP, length 120
01:07:31.807198 IP 192.168.43.146.8880 > 192.168.43.147.7772: UDP, length 120
01:07:31.853239 IP 192.168.43.147.8880 > 192.168.43.124.7773: UDP, length 120
01:07:31.853338 IP 192.168.43.146.8880 > 192.168.43.147.7772: UDP, length 120
01:07:31.901877 IP 192.168.43.146.8880 > 192.168.43.147.7772: UDP, length 120
01:07:31.903273 IP 192.168.43.147.8880 > 192.168.43.124.7773: UDP, length 120
01:07:31.953262 IP 192.168.43.147.8880 > 192.168.43.124.7773: UDP, length 120
01:07:31.956678 IP 192.168.43.146.8880 > 192.168.43.147.7772: UDP, length 120
01:07:32.003268 IP 192.168.43.147.8880 > 192.168.43.124.7773: UDP, length 120
01:07:32.003454 IP 192.168.43.146.8880 > 192.168.43.147.7772: UDP, length 120
01:07:32.053265 IP 192.168.43.147.8880 > 192.168.43.124.7773: UDP, length 120
01:07:32.054182 IP 192.168.43.146.8880 > 192.168.43.147.7772: UDP, length 120
01:07:32.103264 IP 192.168.43.147.8880 > 192.168.43.124.7773: UDP, length 120
01:07:32.108614 IP 192.168.43.146.8880 > 192.168.43.147.7772: UDP, length 120
01:07:32.152748 IP 192.168.43.146.8880 > 192.168.43.147.7772: UDP, length 120
01:07:32.153263 IP 192.168.43.147.8880 > 192.168.43.124.7773: UDP, length 120
01:07:32.203260 IP 192.168.43.147.8880 > 192.168.43.124.7773: UDP, length 120
01:07:32.253260 IP 192.168.43.147.8880 > 192.168.43.124.7773: UDP, length 120
01:07:32.256654 IP 192.168.43.146.8880 > 192.168.43.147.7772: UDP, length 120
01:07:32.256768 IP 192.168.43.146.8880 > 192.168.43.147.7772: UDP, length 120
01:07:32.303262 IP 192.168.43.147.8880 > 192.168.43.124.7773: UDP, length 120
01:07:32.328009 IP 192.168.43.146.8880 > 192.168.43.147.7772: UDP, length 120
01:07:32.353266 IP 192.168.43.147.8880 > 192.168.43.124.7773: UDP, length 120
01:07:32.353577 IP 192.168.43.146.8880 > 192.168.43.147.7772: UDP, length 120
01:07:32.403265 IP 192.168.43.147.8880 > 192.168.43.124.7773: UDP, length 120
01:07:32.406821 IP 192.168.43.146.8880 > 192.168.43.147.7772: UDP, length 120
01:07:32.453270 IP 192.168.43.147.8880 > 192.168.43.124.7773: UDP, length 120
01:07:32.479184 IP 192.168.43.146.8880 > 192.168.43.147.7772: UDP, length 120
01:07:32.502083 IP 192.168.43.146.8880 > 192.168.43.147.7772: UDP, length 120
01:07:32.503265 IP 192.168.43.147.8880 > 192.168.43.124.7773: UDP, length 120
01:07:32.553262 IP 192.168.43.147.8880 > 192.168.43.124.7773: UDP, length 120
01:07:32.556660 IP 192.168.43.146.8880 > 192.168.43.147.7772: UDP, length 120
01:07:32.603262 IP 192.168.43.147.8880 > 192.168.43.124.7773: UDP, length 120
01:07:32.628301 IP 192.168.43.146.8880 > 192.168.43.147.7772: UDP, length 120
01:07:32.653264 IP 192.168.43.147.8880 > 192.168.43.124.7773: UDP, length 120
01:07:32.700543 IP 192.168.43.146.8880 > 192.168.43.147.7772: UDP, length 120
01:07:32.700808 IP 192.168.43.146.8880 > 192.168.43.147.7772: UDP, length 120
01:07:32.703263 IP 192.168.43.147.8880 > 192.168.43.124.7773: UDP, length 120
01:07:32.753262 IP 192.168.43.147.8880 > 192.168.43.124.7773: UDP, length 120
01:07:32.771235 IP 192.168.43.146.8880 > 192.168.43.147.7772: UDP, length 120
01:07:32.803262 IP 192.168.43.147.8880 > 192.168.43.124.7773: UDP, length 120
01:07:32.814991 IP 192.168.43.146.8880 > 192.168.43.147.7772: UDP, length 120
01:07:32.853313 IP 192.168.43.147.8880 > 192.168.43.124.7773: UDP, length 120
01:07:32.857158 IP 192.168.43.146.8880 > 192.168.43.147.7772: UDP, length 120
01:07:32.903287 IP 192.168.43.147.8880 > 192.168.43.124.7773: UDP, length 120
01:07:32.930584 IP 192.168.43.146.8880 > 192.168.43.147.7772: UDP, length 120
01:07:32.953271 IP 192.168.43.147.8880 > 192.168.43.124.7773: UDP, length 120
01:07:33.003264 IP 192.168.43.147.8880 > 192.168.43.124.7773: UDP, length 120
01:07:33.014678 IP 192.168.43.146.8880 > 192.168.43.147.7772: UDP, length 120
01:07:33.016857 IP 192.168.43.146.8880 > 192.168.43.147.7772: UDP, length 120
01:07:33.053267 IP 192.168.43.147.8880 > 192.168.43.124.7773: UDP, length 120
01:07:33.089834 IP 192.168.43.146.8880 > 192.168.43.147.7772: UDP, length 120
01:07:33.103262 IP 192.168.43.147.8880 > 192.168.43.124.7773: UDP, length 120
01:07:33.104525 IP 192.168.43.146.8880 > 192.168.43.147.7772: UDP, length 120
01:07:33.153265 IP 192.168.43.147.8880 > 192.168.43.124.7773: UDP, length 120
01:07:33.171048 IP 192.168.43.146.8880 > 192.168.43.147.7772: UDP, length 120
01:07:33.203260 IP 192.168.43.147.8880 > 192.168.43.124.7773: UDP, length 120
01:07:33.206679 IP 192.168.43.146.8880 > 192.168.43.147.7772: UDP, length 120
01:07:33.252255 IP 192.168.43.146.8880 > 192.168.43.147.7772: UDP, length 120
01:07:33.253263 IP 192.168.43.147.8880 > 192.168.43.124.7773: UDP, length 120
01:07:33.303258 IP 192.168.43.147.8880 > 192.168.43.124.7773: UDP, length 120
01:07:33.306658 IP 192.168.43.146.8880 > 192.168.43.147.7772: UDP, length 120
01:07:33.353263 IP 192.168.43.147.8880 > 192.168.43.124.7773: UDP, length 120
01:07:33.356234 IP 192.168.43.146.8880 > 192.168.43.147.7772: UDP, length 120
01:07:33.403261 IP 192.168.43.147.8880 > 192.168.43.124.7773: UDP, length 120
01:07:33.406651 IP 192.168.43.146.8880 > 192.168.43.147.7772: UDP, length 120
01:07:33.453265 IP 192.168.43.147.8880 > 192.168.43.124.7773: UDP, length 120
01:07:33.456696 IP 192.168.43.146.8880 > 192.168.43.147.7772: UDP, length 120
01:07:33.503262 IP 192.168.43.147.8880 > 192.168.43.124.7773: UDP, length 120
01:07:33.529374 IP 192.168.43.146.8880 > 192.168.43.147.7772: UDP, length 120
01:07:33.553270 IP 192.168.43.147.8880 > 192.168.43.124.7773: UDP, length 120
01:07:33.553362 IP 192.168.43.146.8880 > 192.168.43.147.7772: UDP, length 120
01:07:33.603263 IP 192.168.43.147.8880 > 192.168.43.124.7773: UDP, length 120
01:07:33.606726 IP 192.168.43.146.8880 > 192.168.43.147.7772: UDP, length 120
01:07:33.651988 IP 192.168.43.146.8880 > 192.168.43.147.7772: UDP, length 120
01:07:33.653265 IP 192.168.43.147.8880 > 192.168.43.124.7773: UDP, length 120
01:07:33.702573 IP 192.168.43.146.8880 > 192.168.43.147.7772: UDP, length 120
01:07:33.703263 IP 192.168.43.147.8880 > 192.168.43.124.7773: UDP, length 120
01:07:33.753263 IP 192.168.43.147.8880 > 192.168.43.124.7773: UDP, length 120
01:07:33.757763 IP 192.168.43.146.8880 > 192.168.43.147.7772: UDP, length 120
01:07:33.798979 IP 192.168.43.146.8880 > 192.168.43.147.7772: UDP, length 120
01:07:33.803267 IP 192.168.43.147.8880 > 192.168.43.124.7773: UDP, length 120
01:07:33.853262 IP 192.168.43.147.8880 > 192.168.43.124.7773: UDP, length 120
01:07:33.858204 IP 192.168.43.146.8880 > 192.168.43.147.7772: UDP, length 120
01:07:33.902231 IP 192.168.43.146.8880 > 192.168.43.147.7772: UDP, length 120
01:07:33.903276 IP 192.168.43.147.8880 > 192.168.43.124.7773: UDP, length 120
01:07:33.950276 IP 192.168.43.146.8880 > 192.168.43.147.7772: UDP, length 120
01:07:33.953266 IP 192.168.43.147.8880 > 192.168.43.124.7773: UDP, length 120
01:07:34.003261 IP 192.168.43.147.8880 > 192.168.43.124.7773: UDP, length 120
01:07:34.009862 IP 192.168.43.146.8880 > 192.168.43.147.7772: UDP, length 120
01:07:34.052295 IP 192.168.43.146.8880 > 192.168.43.147.7772: UDP, length 120
01:07:34.053264 IP 192.168.43.147.8880 > 192.168.43.124.7773: UDP, length 120
01:07:34.102271 IP 192.168.43.146.8880 > 192.168.43.147.7772: UDP, length 120
01:07:34.103263 IP 192.168.43.147.8880 > 192.168.43.124.7773: UDP, length 120
01:07:34.153262 IP 192.168.43.147.8880 > 192.168.43.124.7773: UDP, length 120
01:07:34.156978 IP 192.168.43.146.8880 > 192.168.43.147.7772: UDP, length 120
01:07:34.200694 IP 192.168.43.146.8880 > 192.168.43.147.7772: UDP, length 120
01:07:34.203264 IP 192.168.43.147.8880 > 192.168.43.124.7773: UDP, length 120
01:07:34.252858 IP 192.168.43.146.8880 > 192.168.43.147.7772: UDP, length 120
01:07:34.253263 IP 192.168.43.147.8880 > 192.168.43.124.7773: UDP, length 120
01:07:34.303264 IP 192.168.43.147.8880 > 192.168.43.124.7773: UDP, length 120
01:07:34.306726 IP 192.168.43.146.8880 > 192.168.43.147.7772: UDP, length 120
01:07:34.352707 IP 192.168.43.146.8880 > 192.168.43.147.7772: UDP, length 120
01:07:34.353314 IP 192.168.43.147.8880 > 192.168.43.124.7773: UDP, length 120
01:07:34.403265 IP 192.168.43.147.8880 > 192.168.43.124.7773: UDP, length 120
01:07:34.404680 IP 192.168.43.146.8880 > 192.168.43.147.7772: UDP, length 120
01:07:34.453267 IP 192.168.43.147.8880 > 192.168.43.124.7773: UDP, length 120
01:07:34.463644 IP 192.168.43.146.8880 > 192.168.43.147.7772: UDP, length 120
01:07:34.502688 IP 192.168.43.146.8880 > 192.168.43.147.7772: UDP, length 120
01:07:34.503266 IP 192.168.43.147.8880 > 192.168.43.124.7773: UDP, length 120
01:07:34.553264 IP 192.168.43.147.8880 > 192.168.43.124.7773: UDP, length 120
01:07:34.556663 IP 192.168.43.146.8880 > 192.168.43.147.7772: UDP, length 120
01:07:34.603272 IP 192.168.43.147.8880 > 192.168.43.124.7773: UDP, length 120
01:07:34.605330 IP 192.168.43.146.8880 > 192.168.43.147.7772: UDP, length 120
01:07:34.653268 IP 192.168.43.147.8880 > 192.168.43.124.7773: UDP, length 120
01:07:34.656661 IP 192.168.43.146.8880 > 192.168.43.147.7772: UDP, length 120
01:07:34.703262 IP 192.168.43.147.8880 > 192.168.43.124.7773: UDP, length 120
01:07:34.706723 IP 192.168.43.146.8880 > 192.168.43.147.7772: UDP, length 120
01:07:34.753266 IP 192.168.43.147.8880 > 192.168.43.124.7773: UDP, length 120
01:07:34.803261 IP 192.168.43.147.8880 > 192.168.43.124.7773: UDP, length 120
01:07:34.853262 IP 192.168.43.147.8880 > 192.168.43.124.7773: UDP, length 120
01:07:34.871232 IP 192.168.43.146.8880 > 192.168.43.147.7772: UDP, length 120
01:07:34.873111 IP 192.168.43.146.8880 > 192.168.43.147.7772: UDP, length 120
01:07:34.873221 IP 192.168.43.146.8880 > 192.168.43.147.7772: UDP, length 120
01:07:34.902365 IP 192.168.43.146.8880 > 192.168.43.147.7772: UDP, length 120
01:07:34.903278 IP 192.168.43.147.8880 > 192.168.43.124.7773: UDP, length 120
01:07:34.953264 IP 192.168.43.147.8880 > 192.168.43.124.7773: UDP, length 120
01:07:34.956648 IP 192.168.43.146.8880 > 192.168.43.147.7772: UDP, length 120
01:07:35.001614 IP 192.168.43.146.8880 > 192.168.43.147.7772: UDP, length 120
01:07:35.003264 IP 192.168.43.147.8880 > 192.168.43.124.7773: UDP, length 120
01:07:35.053262 IP 192.168.43.147.8880 > 192.168.43.124.7773: UDP, length 120
01:07:35.053927 IP 192.168.43.146.8880 > 192.168.43.147.7772: UDP, length 120
01:07:35.103261 IP 192.168.43.147.8880 > 192.168.43.124.7773: UDP, length 120
01:07:35.106822 IP 192.168.43.146.8880 > 192.168.43.147.7772: UDP, length 120
01:07:35.152204 IP 192.168.43.146.8880 > 192.168.43.147.7772: UDP, length 120
01:07:35.153264 IP 192.168.43.147.8880 > 192.168.43.124.7773: UDP, length 120
01:07:35.203257 IP 192.168.43.147.8880 > 192.168.43.124.7773: UDP, length 120
01:07:35.204839 IP 192.168.43.146.8880 > 192.168.43.147.7772: UDP, length 120
01:07:35.253263 IP 192.168.43.147.8880 > 192.168.43.124.7773: UDP, length 120
01:07:35.257355 IP 192.168.43.146.8880 > 192.168.43.147.7772: UDP, length 120
01:07:35.302177 IP 192.168.43.146.8880 > 192.168.43.147.7772: UDP, length 120
01:07:35.303264 IP 192.168.43.147.8880 > 192.168.43.124.7773: UDP, length 120
01:07:35.353262 IP 192.168.43.147.8880 > 192.168.43.124.7773: UDP, length 120
01:07:35.354488 IP 192.168.43.146.8880 > 192.168.43.147.7772: UDP, length 120
01:07:35.403261 IP 192.168.43.147.8880 > 192.168.43.124.7773: UDP, length 120
01:07:35.406675 IP 192.168.43.146.8880 > 192.168.43.147.7772: UDP, length 120
01:07:35.453264 IP 192.168.43.147.8880 > 192.168.43.124.7773: UDP, length 120
01:07:35.480976 IP 192.168.43.146.8880 > 192.168.43.147.7772: UDP, length 120
01:07:35.503261 IP 192.168.43.147.8880 > 192.168.43.124.7773: UDP, length 120
01:07:35.504160 IP 192.168.43.146.8880 > 192.168.43.147.7772: UDP, length 120
01:07:35.553264 IP 192.168.43.147.8880 > 192.168.43.124.7773: UDP, length 120
01:07:35.556654 IP 192.168.43.146.8880 > 192.168.43.147.7772: UDP, length 120
01:07:35.602075 IP 192.168.43.146.8880 > 192.168.43.147.7772: UDP, length 120
01:07:35.603271 IP 192.168.43.147.8880 > 192.168.43.124.7773: UDP, length 120
01:07:35.652174 IP 192.168.43.146.8880 > 192.168.43.147.7772: UDP, length 120
01:07:35.653273 IP 192.168.43.147.8880 > 192.168.43.124.7773: UDP, length 120
01:07:35.703260 IP 192.168.43.147.8880 > 192.168.43.124.7773: UDP, length 120
01:07:35.706704 IP 192.168.43.146.8880 > 192.168.43.147.7772: UDP, length 120
01:07:35.752738 IP 192.168.43.146.8880 > 192.168.43.147.7772: UDP, length 120
01:07:35.753263 IP 192.168.43.147.8880 > 192.168.43.124.7773: UDP, length 120
01:07:35.802616 IP 192.168.43.146.8880 > 192.168.43.147.7772: UDP, length 120
01:07:35.803263 IP 192.168.43.147.8880 > 192.168.43.124.7773: UDP, length 120
01:07:35.853324 IP 192.168.43.147.8880 > 192.168.43.124.7773: UDP, length 120
01:07:35.856760 IP 192.168.43.146.8880 > 192.168.43.147.7772: UDP, length 120
01:07:35.902229 IP 192.168.43.146.8880 > 192.168.43.147.7772: UDP, length 120
01:07:35.903308 IP 192.168.43.147.8880 > 192.168.43.124.7773: UDP, length 120
01:07:35.953265 IP 192.168.43.147.8880 > 192.168.43.124.7773: UDP, length 120
01:07:35.955641 IP 192.168.43.146.8880 > 192.168.43.147.7772: UDP, length 120
01:07:36.003262 IP 192.168.43.147.8880 > 192.168.43.124.7773: UDP, length 120
01:07:36.006702 IP 192.168.43.146.8880 > 192.168.43.147.7772: UDP, length 120
01:07:36.052951 IP 192.168.43.146.8880 > 192.168.43.147.7772: UDP, length 120
01:07:36.053263 IP 192.168.43.147.8880 > 192.168.43.124.7773: UDP, length 120
01:07:36.103259 IP 192.168.43.147.8880 > 192.168.43.124.7773: UDP, length 120
01:07:36.105000 IP 192.168.43.146.8880 > 192.168.43.147.7772: UDP, length 120
01:07:36.153264 IP 192.168.43.147.8880 > 192.168.43.124.7773: UDP, length 120
01:07:36.156654 IP 192.168.43.146.8880 > 192.168.43.147.7772: UDP, length 120
01:07:36.203260 IP 192.168.43.147.8880 > 192.168.43.124.7773: UDP, length 120
01:07:36.228846 IP 192.168.43.146.8880 > 192.168.43.147.7772: UDP, length 120
01:07:36.253264 IP 192.168.43.147.8880 > 192.168.43.124.7773: UDP, length 120
01:07:36.253574 IP 192.168.43.146.8880 > 192.168.43.147.7772: UDP, length 120
01:07:36.303260 IP 192.168.43.147.8880 > 192.168.43.124.7773: UDP, length 120
01:07:36.306739 IP 192.168.43.146.8880 > 192.168.43.147.7772: UDP, length 120
01:07:36.353267 IP 192.168.43.147.8880 > 192.168.43.124.7773: UDP, length 120
01:07:36.353274 IP 192.168.43.146.8880 > 192.168.43.147.7772: UDP, length 120
01:07:36.403264 IP 192.168.43.147.8880 > 192.168.43.124.7773: UDP, length 120
01:07:36.403620 IP 192.168.43.146.8880 > 192.168.43.147.7772: UDP, length 120
01:07:36.454138 IP 192.168.43.147.8880 > 192.168.43.124.7773: UDP, length 120
01:07:36.457643 IP 192.168.43.146.8880 > 192.168.43.147.7772: UDP, length 120
01:07:36.503337 IP 192.168.43.147.8880 > 192.168.43.124.7773: UDP, length 120
01:07:36.504588 IP 192.168.43.146.8880 > 192.168.43.147.7772: UDP, length 120
01:07:36.553466 IP 192.168.43.147.8880 > 192.168.43.124.7773: UDP, length 120
01:07:36.556889 IP 192.168.43.146.8880 > 192.168.43.147.7772: UDP, length 120
01:07:36.603298 IP 192.168.43.147.8880 > 192.168.43.124.7773: UDP, length 120
01:07:36.606711 IP 192.168.43.146.8880 > 192.168.43.147.7772: UDP, length 120
01:07:36.653244 IP 192.168.43.147.8880 > 192.168.43.124.7773: UDP, length 120
01:07:36.653410 IP 192.168.43.146.8880 > 192.168.43.147.7772: UDP, length 120
01:07:36.703362 IP 192.168.43.147.8880 > 192.168.43.124.7773: UDP, length 120
01:07:36.703580 IP 192.168.43.146.8880 > 192.168.43.147.7772: UDP, length 120
01:07:36.753297 IP 192.168.43.147.8880 > 192.168.43.124.7773: UDP, length 120
01:07:36.756760 IP 192.168.43.146.8880 > 192.168.43.147.7772: UDP, length 120
01:07:36.802469 IP 192.168.43.146.8880 > 192.168.43.147.7772: UDP, length 120
01:07:36.803339 IP 192.168.43.147.8880 > 192.168.43.124.7773: UDP, length 120
01:07:36.853335 IP 192.168.43.147.8880 > 192.168.43.124.7773: UDP, length 120
01:07:36.856897 IP 192.168.43.146.8880 > 192.168.43.147.7772: UDP, length 120
01:07:36.902889 IP 192.168.43.146.8880 > 192.168.43.147.7772: UDP, length 120
01:07:36.903345 IP 192.168.43.147.8880 > 192.168.43.124.7773: UDP, length 120
01:07:36.953340 IP 192.168.43.147.8880 > 192.168.43.124.7773: UDP, length 120
01:07:36.956845 IP 192.168.43.146.8880 > 192.168.43.147.7772: UDP, length 120
01:07:37.001365 IP 192.168.43.146.8880 > 192.168.43.147.7772: UDP, length 120
01:07:37.003293 IP 192.168.43.147.8880 > 192.168.43.124.7773: UDP, length 120
01:07:37.053265 IP 192.168.43.147.8880 > 192.168.43.124.7773: UDP, length 120
01:07:37.056182 IP 192.168.43.146.8880 > 192.168.43.147.7772: UDP, length 120
01:07:37.103266 IP 192.168.43.147.8880 > 192.168.43.124.7773: UDP, length 120
01:07:37.106673 IP 192.168.43.146.8880 > 192.168.43.147.7772: UDP, length 120
01:07:37.153300 IP 192.168.43.147.8880 > 192.168.43.124.7773: UDP, length 120
01:07:37.154343 IP 192.168.43.146.8880 > 192.168.43.147.7772: UDP, length 120
01:07:37.203277 IP 192.168.43.147.8880 > 192.168.43.124.7773: UDP, length 120
01:07:37.205169 IP 192.168.43.146.8880 > 192.168.43.147.7772: UDP, length 120
01:07:37.253274 IP 192.168.43.147.8880 > 192.168.43.124.7773: UDP, length 120
01:07:37.256684 IP 192.168.43.146.8880 > 192.168.43.147.7772: UDP, length 120
01:07:37.302462 IP 192.168.43.146.8880 > 192.168.43.147.7772: UDP, length 120
01:07:37.303265 IP 192.168.43.147.8880 > 192.168.43.124.7773: UDP, length 120
01:07:37.350522 IP 192.168.43.146.8880 > 192.168.43.147.7772: UDP, length 120
01:07:37.353317 IP 192.168.43.147.8880 > 192.168.43.124.7773: UDP, length 120
01:07:37.403265 IP 192.168.43.147.8880 > 192.168.43.124.7773: UDP, length 120
01:07:37.406718 IP 192.168.43.146.8880 > 192.168.43.147.7772: UDP, length 120
01:07:37.453287 IP 192.168.43.147.8880 > 192.168.43.124.7773: UDP, length 120
01:07:37.478912 IP 192.168.43.146.8880 > 192.168.43.147.7772: UDP, length 120
01:07:37.503275 IP 192.168.43.147.8880 > 192.168.43.124.7773: UDP, length 120
