22:45:22.633386 IP 192.168.43.124.8880 > 192.168.43.195.7771: UDP, length 120
22:45:22.683532 IP 192.168.43.124.8880 > 192.168.43.195.7771: UDP, length 120
22:45:22.733531 IP 192.168.43.124.8880 > 192.168.43.195.7771: UDP, length 120
22:45:22.783534 IP 192.168.43.124.8880 > 192.168.43.195.7771: UDP, length 120
22:45:22.833532 IP 192.168.43.124.8880 > 192.168.43.195.7771: UDP, length 120
22:45:22.883471 IP 192.168.43.124.8880 > 192.168.43.195.7771: UDP, length 120
22:45:22.933468 IP 192.168.43.124.8880 > 192.168.43.195.7771: UDP, length 120
22:45:22.983482 IP 192.168.43.124.8880 > 192.168.43.195.7771: UDP, length 120
22:45:23.033528 IP 192.168.43.124.8880 > 192.168.43.195.7771: UDP, length 120
22:45:23.083534 IP 192.168.43.124.8880 > 192.168.43.195.7771: UDP, length 120
22:45:23.133532 IP 192.168.43.124.8880 > 192.168.43.195.7771: UDP, length 120
22:45:23.183531 IP 192.168.43.124.8880 > 192.168.43.195.7771: UDP, length 120
22:45:23.233528 IP 192.168.43.124.8880 > 192.168.43.195.7771: UDP, length 120
22:45:23.283574 IP 192.168.43.124.8880 > 192.168.43.195.7771: UDP, length 120
22:45:23.333579 IP 192.168.43.124.8880 > 192.168.43.195.7771: UDP, length 120
22:45:23.383579 IP 192.168.43.124.8880 > 192.168.43.195.7771: UDP, length 120
22:45:23.434154 IP 192.168.43.124.8880 > 192.168.43.195.7771: UDP, length 120
22:45:23.484060 IP 192.168.43.124.8880 > 192.168.43.195.7771: UDP, length 120
22:45:23.533545 IP 192.168.43.124.8880 > 192.168.43.195.7771: UDP, length 120
22:45:23.583584 IP 192.168.43.124.8880 > 192.168.43.195.7771: UDP, length 120
22:45:23.633545 IP 192.168.43.124.8880 > 192.168.43.195.7771: UDP, length 120
22:45:23.683583 IP 192.168.43.124.8880 > 192.168.43.195.7771: UDP, length 120
22:45:23.733512 IP 192.168.43.124.8880 > 192.168.43.195.7771: UDP, length 120
22:45:23.783591 IP 192.168.43.124.8880 > 192.168.43.195.7771: UDP, length 120
22:45:23.833513 IP 192.168.43.124.8880 > 192.168.43.195.7771: UDP, length 120
22:45:23.883583 IP 192.168.43.124.8880 > 192.168.43.195.7771: UDP, length 120
22:45:23.933485 IP 192.168.43.124.8880 > 192.168.43.195.7771: UDP, length 120
22:45:23.983580 IP 192.168.43.124.8880 > 192.168.43.195.7771: UDP, length 120
22:45:24.033594 IP 192.168.43.124.8880 > 192.168.43.195.7771: UDP, length 120
22:45:24.083535 IP 192.168.43.124.8880 > 192.168.43.195.7771: UDP, length 120
22:45:24.133533 IP 192.168.43.124.8880 > 192.168.43.195.7771: UDP, length 120
22:45:24.183533 IP 192.168.43.124.8880 > 192.168.43.195.7771: UDP, length 120
22:45:24.233532 IP 192.168.43.124.8880 > 192.168.43.195.7771: UDP, length 120
22:45:24.283532 IP 192.168.43.124.8880 > 192.168.43.195.7771: UDP, length 120
22:45:24.333532 IP 192.168.43.124.8880 > 192.168.43.195.7771: UDP, length 120
22:45:24.383532 IP 192.168.43.124.8880 > 192.168.43.195.7771: UDP, length 120
22:45:24.433532 IP 192.168.43.124.8880 > 192.168.43.195.7771: UDP, length 120
22:45:24.483533 IP 192.168.43.124.8880 > 192.168.43.195.7771: UDP, length 120
22:45:24.533532 IP 192.168.43.124.8880 > 192.168.43.195.7771: UDP, length 120
22:45:24.583584 IP 192.168.43.124.8880 > 192.168.43.195.7771: UDP, length 120
22:45:24.633585 IP 192.168.43.124.8880 > 192.168.43.195.7771: UDP, length 120
22:45:24.683580 IP 192.168.43.124.8880 > 192.168.43.195.7771: UDP, length 120
22:45:24.733582 IP 192.168.43.124.8880 > 192.168.43.195.7771: UDP, length 120
22:45:24.783583 IP 192.168.43.124.8880 > 192.168.43.195.7771: UDP, length 120
22:45:24.833583 IP 192.168.43.124.8880 > 192.168.43.195.7771: UDP, length 120
22:45:24.883585 IP 192.168.43.124.8880 > 192.168.43.195.7771: UDP, length 120
22:45:24.933586 IP 192.168.43.124.8880 > 192.168.43.195.7771: UDP, length 120
22:45:24.983581 IP 192.168.43.124.8880 > 192.168.43.195.7771: UDP, length 120
22:45:25.033578 IP 192.168.43.124.8880 > 192.168.43.195.7771: UDP, length 120
22:45:25.083548 IP 192.168.43.124.8880 > 192.168.43.195.7771: UDP, length 120
22:45:25.133537 IP 192.168.43.124.8880 > 192.168.43.195.7771: UDP, length 120
22:45:25.183497 IP 192.168.43.124.8880 > 192.168.43.195.7771: UDP, length 120
22:45:25.233531 IP 192.168.43.124.8880 > 192.168.43.195.7771: UDP, length 120
22:45:25.283533 IP 192.168.43.124.8880 > 192.168.43.195.7771: UDP, length 120
22:45:25.333583 IP 192.168.43.124.8880 > 192.168.43.195.7771: UDP, length 120
22:45:25.383584 IP 192.168.43.124.8880 > 192.168.43.195.7771: UDP, length 120
22:45:25.433584 IP 192.168.43.124.8880 > 192.168.43.195.7771: UDP, length 120
22:45:25.483582 IP 192.168.43.124.8880 > 192.168.43.195.7771: UDP, length 120
22:45:25.533586 IP 192.168.43.124.8880 > 192.168.43.195.7771: UDP, length 120
22:45:25.583585 IP 192.168.43.124.8880 > 192.168.43.195.7771: UDP, length 120
22:45:25.633585 IP 192.168.43.124.8880 > 192.168.43.195.7771: UDP, length 120
22:45:25.683584 IP 192.168.43.124.8880 > 192.168.43.195.7771: UDP, length 120
22:45:25.733584 IP 192.168.43.124.8880 > 192.168.43.195.7771: UDP, length 120
22:45:25.783626 IP 192.168.43.124.8880 > 192.168.43.195.7771: UDP, length 120
22:45:25.833586 IP 192.168.43.124.8880 > 192.168.43.195.7771: UDP, length 120
22:45:25.883586 IP 192.168.43.124.8880 > 192.168.43.195.7771: UDP, length 120
22:45:25.933582 IP 192.168.43.124.8880 > 192.168.43.195.7771: UDP, length 120
22:45:25.983585 IP 192.168.43.124.8880 > 192.168.43.195.7771: UDP, length 120
22:45:26.033527 IP 192.168.43.124.8880 > 192.168.43.195.7771: UDP, length 120
22:45:26.083534 IP 192.168.43.124.8880 > 192.168.43.195.7771: UDP, length 120
22:45:26.133538 IP 192.168.43.124.8880 > 192.168.43.195.7771: UDP, length 120
22:45:26.183536 IP 192.168.43.124.8880 > 192.168.43.195.7771: UDP, length 120
22:45:26.233586 IP 192.168.43.124.8880 > 192.168.43.195.7771: UDP, length 120
22:45:26.283585 IP 192.168.43.124.8880 > 192.168.43.195.7771: UDP, length 120
22:45:26.333585 IP 192.168.43.124.8880 > 192.168.43.195.7771: UDP, length 120
22:45:26.383522 IP 192.168.43.124.8880 > 192.168.43.195.7771: UDP, length 120
22:45:26.433587 IP 192.168.43.124.8880 > 192.168.43.195.7771: UDP, length 120
22:45:26.483585 IP 192.168.43.124.8880 > 192.168.43.195.7771: UDP, length 120
22:45:26.533588 IP 192.168.43.124.8880 > 192.168.43.195.7771: UDP, length 120
22:45:26.583590 IP 192.168.43.124.8880 > 192.168.43.195.7771: UDP, length 120
22:45:26.633586 IP 192.168.43.124.8880 > 192.168.43.195.7771: UDP, length 120
22:45:26.683587 IP 192.168.43.124.8880 > 192.168.43.195.7771: UDP, length 120
22:45:26.733535 IP 192.168.43.124.8880 > 192.168.43.195.7771: UDP, length 120
22:45:26.783588 IP 192.168.43.124.8880 > 192.168.43.195.7771: UDP, length 120
22:45:26.833588 IP 192.168.43.124.8880 > 192.168.43.195.7771: UDP, length 120
22:45:26.883588 IP 192.168.43.124.8880 > 192.168.43.195.7771: UDP, length 120
22:45:26.933592 IP 192.168.43.124.8880 > 192.168.43.195.7771: UDP, length 120
22:45:26.983519 IP 192.168.43.124.8880 > 192.168.43.195.7771: UDP, length 120
22:45:27.033588 IP 192.168.43.124.8880 > 192.168.43.195.7771: UDP, length 120
22:45:27.083544 IP 192.168.43.124.8880 > 192.168.43.195.7771: UDP, length 120
22:45:27.133538 IP 192.168.43.124.8880 > 192.168.43.195.7771: UDP, length 120
22:45:27.183498 IP 192.168.43.124.8880 > 192.168.43.195.7771: UDP, length 120
22:45:27.233540 IP 192.168.43.124.8880 > 192.168.43.195.7771: UDP, length 120
22:45:27.283540 IP 192.168.43.124.8880 > 192.168.43.195.7771: UDP, length 120
22:45:27.333538 IP 192.168.43.124.8880 > 192.168.43.195.7771: UDP, length 120
22:45:27.383594 IP 192.168.43.124.8880 > 192.168.43.195.7771: UDP, length 120
22:45:27.433591 IP 192.168.43.124.8880 > 192.168.43.195.7771: UDP, length 120
22:45:27.483593 IP 192.168.43.124.8880 > 192.168.43.195.7771: UDP, length 120
22:45:27.533592 IP 192.168.43.124.8880 > 192.168.43.195.7771: UDP, length 120
22:45:27.583515 IP 192.168.43.124.8880 > 192.168.43.195.7771: UDP, length 120
22:45:27.633542 IP 192.168.43.124.8880 > 192.168.43.195.7771: UDP, length 120
22:45:27.683596 IP 192.168.43.124.8880 > 192.168.43.195.7771: UDP, length 120
22:45:27.733596 IP 192.168.43.124.8880 > 192.168.43.195.7771: UDP, length 120
22:45:27.783597 IP 192.168.43.124.8880 > 192.168.43.195.7771: UDP, length 120
22:45:27.833597 IP 192.168.43.124.8880 > 192.168.43.195.7771: UDP, length 120
22:45:27.883596 IP 192.168.43.124.8880 > 192.168.43.195.7771: UDP, length 120
22:45:27.933596 IP 192.168.43.124.8880 > 192.168.43.195.7771: UDP, length 120
22:45:27.983472 IP 192.168.43.124.8880 > 192.168.43.195.7771: UDP, length 120
22:45:28.033479 IP 192.168.43.124.8880 > 192.168.43.195.7771: UDP, length 120
22:45:28.083480 IP 192.168.43.124.8880 > 192.168.43.195.7771: UDP, length 120
22:45:28.133540 IP 192.168.43.124.8880 > 192.168.43.195.7771: UDP, length 120
22:45:28.183687 IP 192.168.43.124.8880 > 192.168.43.195.7771: UDP, length 120
22:45:28.233542 IP 192.168.43.124.8880 > 192.168.43.195.7771: UDP, length 120
22:45:28.283543 IP 192.168.43.124.8880 > 192.168.43.195.7771: UDP, length 120
22:45:28.333542 IP 192.168.43.124.8880 > 192.168.43.195.7771: UDP, length 120
22:45:28.383538 IP 192.168.43.124.8880 > 192.168.43.195.7771: UDP, length 120
22:45:28.433538 IP 192.168.43.124.8880 > 192.168.43.195.7771: UDP, length 120
22:45:28.483540 IP 192.168.43.124.8880 > 192.168.43.195.7771: UDP, length 120
22:45:28.533539 IP 192.168.43.124.8880 > 192.168.43.195.7771: UDP, length 120
22:45:28.583540 IP 192.168.43.124.8880 > 192.168.43.195.7771: UDP, length 120
22:45:28.633542 IP 192.168.43.124.8880 > 192.168.43.195.7771: UDP, length 120
22:45:28.683542 IP 192.168.43.124.8880 > 192.168.43.195.7771: UDP, length 120
22:45:28.733541 IP 192.168.43.124.8880 > 192.168.43.195.7771: UDP, length 120
22:45:28.783534 IP 192.168.43.124.8880 > 192.168.43.195.7771: UDP, length 120
22:45:28.833592 IP 192.168.43.124.8880 > 192.168.43.195.7771: UDP, length 120
22:45:28.883593 IP 192.168.43.124.8880 > 192.168.43.195.7771: UDP, length 120
22:45:28.933597 IP 192.168.43.124.8880 > 192.168.43.195.7771: UDP, length 120
22:45:28.983596 IP 192.168.43.124.8880 > 192.168.43.195.7771: UDP, length 120
22:45:29.033497 IP 192.168.43.124.8880 > 192.168.43.195.7771: UDP, length 120
22:45:29.083544 IP 192.168.43.124.8880 > 192.168.43.195.7771: UDP, length 120
22:45:29.133542 IP 192.168.43.124.8880 > 192.168.43.195.7771: UDP, length 120
22:45:29.183492 IP 192.168.43.124.8880 > 192.168.43.195.7771: UDP, length 120
22:45:29.233539 IP 192.168.43.124.8880 > 192.168.43.195.7771: UDP, length 120
22:45:29.283540 IP 192.168.43.124.8880 > 192.168.43.195.7771: UDP, length 120
22:45:29.333537 IP 192.168.43.124.8880 > 192.168.43.195.7771: UDP, length 120
22:45:29.383532 IP 192.168.43.124.8880 > 192.168.43.195.7771: UDP, length 120
22:45:29.433597 IP 192.168.43.124.8880 > 192.168.43.195.7771: UDP, length 120
22:45:29.483595 IP 192.168.43.124.8880 > 192.168.43.195.7771: UDP, length 120
22:45:29.533595 IP 192.168.43.124.8880 > 192.168.43.195.7771: UDP, length 120
22:45:29.583598 IP 192.168.43.124.8880 > 192.168.43.195.7771: UDP, length 120
22:45:29.633593 IP 192.168.43.124.8880 > 192.168.43.195.7771: UDP, length 120
22:45:29.683595 IP 192.168.43.124.8880 > 192.168.43.195.7771: UDP, length 120
22:45:29.733596 IP 192.168.43.124.8880 > 192.168.43.195.7771: UDP, length 120
22:45:29.783524 IP 192.168.43.124.8880 > 192.168.43.195.7771: UDP, length 120
22:45:29.833595 IP 192.168.43.124.8880 > 192.168.43.195.7771: UDP, length 120
22:45:29.883594 IP 192.168.43.124.8880 > 192.168.43.195.7771: UDP, length 120
22:45:29.933597 IP 192.168.43.124.8880 > 192.168.43.195.7771: UDP, length 120
22:45:29.983557 IP 192.168.43.124.8880 > 192.168.43.195.7771: UDP, length 120
22:45:30.033595 IP 192.168.43.124.8880 > 192.168.43.195.7771: UDP, length 120
22:45:30.083544 IP 192.168.43.124.8880 > 192.168.43.195.7771: UDP, length 120
22:45:30.133546 IP 192.168.43.124.8880 > 192.168.43.195.7771: UDP, length 120
22:45:30.183490 IP 192.168.43.124.8880 > 192.168.43.195.7771: UDP, length 120
22:45:30.233540 IP 192.168.43.124.8880 > 192.168.43.195.7771: UDP, length 120
22:45:30.283541 IP 192.168.43.124.8880 > 192.168.43.195.7771: UDP, length 120
22:45:30.333544 IP 192.168.43.124.8880 > 192.168.43.195.7771: UDP, length 120
22:45:30.383598 IP 192.168.43.124.8880 > 192.168.43.195.7771: UDP, length 120
22:45:30.433594 IP 192.168.43.124.8880 > 192.168.43.195.7771: UDP, length 120
22:45:30.483592 IP 192.168.43.124.8880 > 192.168.43.195.7771: UDP, length 120
22:45:30.533596 IP 192.168.43.124.8880 > 192.168.43.195.7771: UDP, length 120
22:45:30.583535 IP 192.168.43.124.8880 > 192.168.43.195.7771: UDP, length 120
22:45:30.633544 IP 192.168.43.124.8880 > 192.168.43.195.7771: UDP, length 120
22:45:30.683546 IP 192.168.43.124.8880 > 192.168.43.195.7771: UDP, length 120
22:45:30.733545 IP 192.168.43.124.8880 > 192.168.43.195.7771: UDP, length 120
22:45:30.783545 IP 192.168.43.124.8880 > 192.168.43.195.7771: UDP, length 120
22:45:30.833542 IP 192.168.43.124.8880 > 192.168.43.195.7771: UDP, length 120
22:45:30.883542 IP 192.168.43.124.8880 > 192.168.43.195.7771: UDP, length 120
22:45:30.933543 IP 192.168.43.124.8880 > 192.168.43.195.7771: UDP, length 120
22:45:30.983543 IP 192.168.43.124.8880 > 192.168.43.195.7771: UDP, length 120
22:45:31.033599 IP 192.168.43.124.8880 > 192.168.43.195.7771: UDP, length 120
22:45:31.083545 IP 192.168.43.124.8880 > 192.168.43.195.7771: UDP, length 120
22:45:31.133546 IP 192.168.43.124.8880 > 192.168.43.195.7771: UDP, length 120
22:45:31.183492 IP 192.168.43.124.8880 > 192.168.43.195.7771: UDP, length 120
22:45:31.233539 IP 192.168.43.124.8880 > 192.168.43.195.7771: UDP, length 120
22:45:31.283541 IP 192.168.43.124.8880 > 192.168.43.195.7771: UDP, length 120
22:45:31.333537 IP 192.168.43.124.8880 > 192.168.43.195.7771: UDP, length 120
22:45:31.383539 IP 192.168.43.124.8880 > 192.168.43.195.7771: UDP, length 120
22:45:31.433540 IP 192.168.43.124.8880 > 192.168.43.195.7771: UDP, length 120
22:45:31.483543 IP 192.168.43.124.8880 > 192.168.43.195.7771: UDP, length 120
22:45:31.533541 IP 192.168.43.124.8880 > 192.168.43.195.7771: UDP, length 120
22:45:31.583538 IP 192.168.43.124.8880 > 192.168.43.195.7771: UDP, length 120
22:45:31.633538 IP 192.168.43.124.8880 > 192.168.43.195.7771: UDP, length 120
22:45:31.683539 IP 192.168.43.124.8880 > 192.168.43.195.7771: UDP, length 120
22:45:31.733537 IP 192.168.43.124.8880 > 192.168.43.195.7771: UDP, length 120
22:45:31.783539 IP 192.168.43.124.8880 > 192.168.43.195.7771: UDP, length 120
22:45:31.833539 IP 192.168.43.124.8880 > 192.168.43.195.7771: UDP, length 120
22:45:31.883540 IP 192.168.43.124.8880 > 192.168.43.195.7771: UDP, length 120
22:45:31.933541 IP 192.168.43.124.8880 > 192.168.43.195.7771: UDP, length 120
22:45:31.983537 IP 192.168.43.124.8880 > 192.168.43.195.7771: UDP, length 120
22:45:32.033540 IP 192.168.43.124.8880 > 192.168.43.195.7771: UDP, length 120
22:45:32.083542 IP 192.168.43.124.8880 > 192.168.43.195.7771: UDP, length 120
22:45:32.133544 IP 192.168.43.124.8880 > 192.168.43.195.7771: UDP, length 120
22:45:32.183499 IP 192.168.43.124.8880 > 192.168.43.195.7771: UDP, length 120
22:45:32.233540 IP 192.168.43.124.8880 > 192.168.43.195.7771: UDP, length 120
22:45:32.283542 IP 192.168.43.124.8880 > 192.168.43.195.7771: UDP, length 120
22:45:32.333541 IP 192.168.43.124.8880 > 192.168.43.195.7771: UDP, length 120
22:45:32.383538 IP 192.168.43.124.8880 > 192.168.43.195.7771: UDP, length 120
22:45:32.433538 IP 192.168.43.124.8880 > 192.168.43.195.7771: UDP, length 120
22:45:32.483538 IP 192.168.43.124.8880 > 192.168.43.195.7771: UDP, length 120
22:45:32.533539 IP 192.168.43.124.8880 > 192.168.43.195.7771: UDP, length 120
22:45:32.583539 IP 192.168.43.124.8880 > 192.168.43.195.7771: UDP, length 120
22:45:32.633539 IP 192.168.43.124.8880 > 192.168.43.195.7771: UDP, length 120
22:45:32.683593 IP 192.168.43.124.8880 > 192.168.43.195.7771: UDP, length 120
22:45:32.733594 IP 192.168.43.124.8880 > 192.168.43.195.7771: UDP, length 120
22:45:32.783596 IP 192.168.43.124.8880 > 192.168.43.195.7771: UDP, length 120
22:45:32.833595 IP 192.168.43.124.8880 > 192.168.43.195.7771: UDP, length 120
22:45:32.883594 IP 192.168.43.124.8880 > 192.168.43.195.7771: UDP, length 120
22:45:32.933594 IP 192.168.43.124.8880 > 192.168.43.195.7771: UDP, length 120
22:45:32.983596 IP 192.168.43.124.8880 > 192.168.43.195.7771: UDP, length 120
22:45:33.033595 IP 192.168.43.124.8880 > 192.168.43.195.7771: UDP, length 120
22:45:33.083485 IP 192.168.43.124.8880 > 192.168.43.195.7771: UDP, length 120
22:45:33.133471 IP 192.168.43.124.8880 > 192.168.43.195.7771: UDP, length 120
22:45:33.183485 IP 192.168.43.124.8880 > 192.168.43.195.7771: UDP, length 120
22:45:33.233539 IP 192.168.43.124.8880 > 192.168.43.195.7771: UDP, length 120
22:45:33.283540 IP 192.168.43.124.8880 > 192.168.43.195.7771: UDP, length 120
22:45:33.333542 IP 192.168.43.124.8880 > 192.168.43.195.7771: UDP, length 120
22:45:33.383540 IP 192.168.43.124.8880 > 192.168.43.195.7771: UDP, length 120
22:45:33.433541 IP 192.168.43.124.8880 > 192.168.43.195.7771: UDP, length 120
22:45:33.483542 IP 192.168.43.124.8880 > 192.168.43.195.7771: UDP, length 120
22:45:33.533544 IP 192.168.43.124.8880 > 192.168.43.195.7771: UDP, length 120
22:45:33.583543 IP 192.168.43.124.8880 > 192.168.43.195.7771: UDP, length 120
22:45:33.633541 IP 192.168.43.124.8880 > 192.168.43.195.7771: UDP, length 120
22:45:33.683594 IP 192.168.43.124.8880 > 192.168.43.195.7771: UDP, length 120
22:45:33.733595 IP 192.168.43.124.8880 > 192.168.43.195.7771: UDP, length 120
22:45:33.783549 IP 192.168.43.124.8880 > 192.168.43.195.7771: UDP, length 120
22:45:33.833986 IP 192.168.43.124.8880 > 192.168.43.195.7771: UDP, length 120
22:45:33.883462 IP 192.168.43.124.8880 > 192.168.43.195.7771: UDP, length 120
22:45:33.933596 IP 192.168.43.124.8880 > 192.168.43.195.7771: UDP, length 120
22:45:33.983801 IP 192.168.43.124.8880 > 192.168.43.195.7771: UDP, length 120
22:45:34.033599 IP 192.168.43.124.8880 > 192.168.43.195.7771: UDP, length 120
22:45:34.084057 IP 192.168.43.124.8880 > 192.168.43.195.7771: UDP, length 120
22:45:34.133543 IP 192.168.43.124.8880 > 192.168.43.195.7771: UDP, length 120
22:45:34.183541 IP 192.168.43.124.8880 > 192.168.43.195.7771: UDP, length 120
22:45:34.233541 IP 192.168.43.124.8880 > 192.168.43.195.7771: UDP, length 120
22:45:34.283542 IP 192.168.43.124.8880 > 192.168.43.195.7771: UDP, length 120
22:45:34.333542 IP 192.168.43.124.8880 > 192.168.43.195.7771: UDP, length 120
22:45:34.383539 IP 192.168.43.124.8880 > 192.168.43.195.7771: UDP, length 120
22:45:34.433539 IP 192.168.43.124.8880 > 192.168.43.195.7771: UDP, length 120
22:45:34.483540 IP 192.168.43.124.8880 > 192.168.43.195.7771: UDP, length 120
22:45:34.533542 IP 192.168.43.124.8880 > 192.168.43.195.7771: UDP, length 120
22:45:34.583540 IP 192.168.43.124.8880 > 192.168.43.195.7771: UDP, length 120
22:45:34.633540 IP 192.168.43.124.8880 > 192.168.43.195.7771: UDP, length 120
22:45:34.683543 IP 192.168.43.124.8880 > 192.168.43.195.7771: UDP, length 120
22:45:34.733544 IP 192.168.43.124.8880 > 192.168.43.195.7771: UDP, length 120
22:45:34.783597 IP 192.168.43.124.8880 > 192.168.43.195.7771: UDP, length 120
22:45:34.833599 IP 192.168.43.124.8880 > 192.168.43.195.7771: UDP, length 120
22:45:34.883596 IP 192.168.43.124.8880 > 192.168.43.195.7771: UDP, length 120
22:45:34.933597 IP 192.168.43.124.8880 > 192.168.43.195.7771: UDP, length 120
22:45:34.983596 IP 192.168.43.124.8880 > 192.168.43.195.7771: UDP, length 120
22:45:35.033598 IP 192.168.43.124.8880 > 192.168.43.195.7771: UDP, length 120
22:45:35.083542 IP 192.168.43.124.8880 > 192.168.43.195.7771: UDP, length 120
22:45:35.133544 IP 192.168.43.124.8880 > 192.168.43.195.7771: UDP, length 120
22:45:35.183539 IP 192.168.43.124.8880 > 192.168.43.195.7771: UDP, length 120
22:45:35.233540 IP 192.168.43.124.8880 > 192.168.43.195.7771: UDP, length 120
22:45:35.283541 IP 192.168.43.124.8880 > 192.168.43.195.7771: UDP, length 120
22:45:35.333541 IP 192.168.43.124.8880 > 192.168.43.195.7771: UDP, length 120
22:45:35.383539 IP 192.168.43.124.8880 > 192.168.43.195.7771: UDP, length 120
22:45:35.433541 IP 192.168.43.124.8880 > 192.168.43.195.7771: UDP, length 120
22:45:35.483542 IP 192.168.43.124.8880 > 192.168.43.195.7771: UDP, length 120
22:45:35.533543 IP 192.168.43.124.8880 > 192.168.43.195.7771: UDP, length 120
22:45:35.583539 IP 192.168.43.124.8880 > 192.168.43.195.7771: UDP, length 120
22:45:35.633539 IP 192.168.43.124.8880 > 192.168.43.195.7771: UDP, length 120
22:45:35.683541 IP 192.168.43.124.8880 > 192.168.43.195.7771: UDP, length 120
22:45:35.733538 IP 192.168.43.124.8880 > 192.168.43.195.7771: UDP, length 120
22:45:35.783539 IP 192.168.43.124.8880 > 192.168.43.195.7771: UDP, length 120
22:45:35.833538 IP 192.168.43.124.8880 > 192.168.43.195.7771: UDP, length 120
22:45:35.883541 IP 192.168.43.124.8880 > 192.168.43.195.7771: UDP, length 120
22:45:35.933541 IP 192.168.43.124.8880 > 192.168.43.195.7771: UDP, length 120
22:45:35.983542 IP 192.168.43.124.8880 > 192.168.43.195.7771: UDP, length 120
22:45:36.033539 IP 192.168.43.124.8880 > 192.168.43.195.7771: UDP, length 120
22:45:36.083503 IP 192.168.43.124.8880 > 192.168.43.195.7771: UDP, length 120
22:45:36.133538 IP 192.168.43.124.8880 > 192.168.43.195.7771: UDP, length 120
22:45:36.183540 IP 192.168.43.124.8880 > 192.168.43.195.7771: UDP, length 120
22:45:36.233538 IP 192.168.43.124.8880 > 192.168.43.195.7771: UDP, length 120
22:45:36.283542 IP 192.168.43.124.8880 > 192.168.43.195.7771: UDP, length 120
22:45:36.333544 IP 192.168.43.124.8880 > 192.168.43.195.7771: UDP, length 120
22:45:36.383539 IP 192.168.43.124.8880 > 192.168.43.195.7771: UDP, length 120
22:45:36.433539 IP 192.168.43.124.8880 > 192.168.43.195.7771: UDP, length 120
22:45:36.483540 IP 192.168.43.124.8880 > 192.168.43.195.7771: UDP, length 120
22:45:36.533540 IP 192.168.43.124.8880 > 192.168.43.195.7771: UDP, length 120
22:45:36.583540 IP 192.168.43.124.8880 > 192.168.43.195.7771: UDP, length 120
22:45:36.633539 IP 192.168.43.124.8880 > 192.168.43.195.7771: UDP, length 120
22:45:36.683539 IP 192.168.43.124.8880 > 192.168.43.195.7771: UDP, length 120
22:45:36.733543 IP 192.168.43.124.8880 > 192.168.43.195.7771: UDP, length 120
22:45:36.783598 IP 192.168.43.124.8880 > 192.168.43.195.7771: UDP, length 120
22:45:36.833600 IP 192.168.43.124.8880 > 192.168.43.195.7771: UDP, length 120
22:45:36.883596 IP 192.168.43.124.8880 > 192.168.43.195.7771: UDP, length 120
22:45:36.933594 IP 192.168.43.124.8880 > 192.168.43.195.7771: UDP, length 120
22:45:36.983597 IP 192.168.43.124.8880 > 192.168.43.195.7771: UDP, length 120
22:45:37.033598 IP 192.168.43.124.8880 > 192.168.43.195.7771: UDP, length 120
22:45:37.083544 IP 192.168.43.124.8880 > 192.168.43.195.7771: UDP, length 120
22:45:37.133543 IP 192.168.43.124.8880 > 192.168.43.195.7771: UDP, length 120
22:45:37.183595 IP 192.168.43.124.8880 > 192.168.43.195.7771: UDP, length 120
22:45:37.233540 IP 192.168.43.124.8880 > 192.168.43.195.7771: UDP, length 120
22:45:37.283540 IP 192.168.43.124.8880 > 192.168.43.195.7771: UDP, length 120
22:45:37.333542 IP 192.168.43.124.8880 > 192.168.43.195.7771: UDP, length 120
22:45:37.383538 IP 192.168.43.124.8880 > 192.168.43.195.7771: UDP, length 120
22:45:37.433540 IP 192.168.43.124.8880 > 192.168.43.195.7771: UDP, length 120
22:45:37.483543 IP 192.168.43.124.8880 > 192.168.43.195.7771: UDP, length 120
22:45:37.533544 IP 192.168.43.124.8880 > 192.168.43.195.7771: UDP, length 120
22:45:37.583543 IP 192.168.43.124.8880 > 192.168.43.195.7771: UDP, length 120
22:45:37.633538 IP 192.168.43.124.8880 > 192.168.43.195.7771: UDP, length 120
22:45:37.683540 IP 192.168.43.124.8880 > 192.168.43.195.7771: UDP, length 120
22:45:37.733542 IP 192.168.43.124.8880 > 192.168.43.195.7771: UDP, length 120
22:45:37.783540 IP 192.168.43.124.8880 > 192.168.43.195.7771: UDP, length 120
22:45:37.833542 IP 192.168.43.124.8880 > 192.168.43.195.7771: UDP, length 120
22:45:37.883542 IP 192.168.43.124.8880 > 192.168.43.195.7771: UDP, length 120
22:45:37.933544 IP 192.168.43.124.8880 > 192.168.43.195.7771: UDP, length 120
22:45:37.983543 IP 192.168.43.124.8880 > 192.168.43.195.7771: UDP, length 120
22:45:38.033542 IP 192.168.43.124.8880 > 192.168.43.195.7771: UDP, length 120
22:45:38.083506 IP 192.168.43.124.8880 > 192.168.43.195.7771: UDP, length 120
22:45:38.133541 IP 192.168.43.124.8880 > 192.168.43.195.7771: UDP, length 120
22:45:38.183481 IP 192.168.43.124.8880 > 192.168.43.195.7771: UDP, length 120
22:45:38.233464 IP 192.168.43.124.8880 > 192.168.43.195.7771: UDP, length 120
22:45:38.283483 IP 192.168.43.124.8880 > 192.168.43.195.7771: UDP, length 120
22:45:38.333543 IP 192.168.43.124.8880 > 192.168.43.195.7771: UDP, length 120
22:45:38.383537 IP 192.168.43.124.8880 > 192.168.43.195.7771: UDP, length 120
22:45:38.433538 IP 192.168.43.124.8880 > 192.168.43.195.7771: UDP, length 120
22:45:38.483540 IP 192.168.43.124.8880 > 192.168.43.195.7771: UDP, length 120
22:45:38.533540 IP 192.168.43.124.8880 > 192.168.43.195.7771: UDP, length 120
22:45:38.583540 IP 192.168.43.124.8880 > 192.168.43.195.7771: UDP, length 120
22:45:38.633542 IP 192.168.43.124.8880 > 192.168.43.195.7771: UDP, length 120
22:45:38.683542 IP 192.168.43.124.8880 > 192.168.43.195.7771: UDP, length 120
22:45:38.733542 IP 192.168.43.124.8880 > 192.168.43.195.7771: UDP, length 120
22:45:38.783596 IP 192.168.43.124.8880 > 192.168.43.195.7771: UDP, length 120
22:45:38.833600 IP 192.168.43.124.8880 > 192.168.43.195.7771: UDP, length 120
22:45:38.883596 IP 192.168.43.124.8880 > 192.168.43.195.7771: UDP, length 120
22:45:38.933595 IP 192.168.43.124.8880 > 192.168.43.195.7771: UDP, length 120
22:45:38.983597 IP 192.168.43.124.8880 > 192.168.43.195.7771: UDP, length 120
22:45:39.033596 IP 192.168.43.124.8880 > 192.168.43.195.7771: UDP, length 120
22:45:39.083495 IP 192.168.43.124.8880 > 192.168.43.195.7771: UDP, length 120
22:45:39.133543 IP 192.168.43.124.8880 > 192.168.43.195.7771: UDP, length 120
22:45:39.183541 IP 192.168.43.124.8880 > 192.168.43.195.7771: UDP, length 120
22:45:39.233539 IP 192.168.43.124.8880 > 192.168.43.195.7771: UDP, length 120
22:45:39.283541 IP 192.168.43.124.8880 > 192.168.43.195.7771: UDP, length 120
22:45:39.333540 IP 192.168.43.124.8880 > 192.168.43.195.7771: UDP, length 120
22:45:39.383540 IP 192.168.43.124.8880 > 192.168.43.195.7771: UDP, length 120
22:45:39.433538 IP 192.168.43.124.8880 > 192.168.43.195.7771: UDP, length 120
22:45:39.483540 IP 192.168.43.124.8880 > 192.168.43.195.7771: UDP, length 120
22:45:39.533541 IP 192.168.43.124.8880 > 192.168.43.195.7771: UDP, length 120
22:45:39.583543 IP 192.168.43.124.8880 > 192.168.43.195.7771: UDP, length 120
22:45:39.633597 IP 192.168.43.124.8880 > 192.168.43.195.7771: UDP, length 120
22:45:39.683600 IP 192.168.43.124.8880 > 192.168.43.195.7771: UDP, length 120
22:45:39.733594 IP 192.168.43.124.8880 > 192.168.43.195.7771: UDP, length 120
22:45:39.783597 IP 192.168.43.124.8880 > 192.168.43.195.7771: UDP, length 120
22:45:39.833600 IP 192.168.43.124.8880 > 192.168.43.195.7771: UDP, length 120
22:45:39.883596 IP 192.168.43.124.8880 > 192.168.43.195.7771: UDP, length 120
22:45:39.933596 IP 192.168.43.124.8880 > 192.168.43.195.7771: UDP, length 120
22:45:39.983597 IP 192.168.43.124.8880 > 192.168.43.195.7771: UDP, length 120
22:45:40.033599 IP 192.168.43.124.8880 > 192.168.43.195.7771: UDP, length 120
22:45:40.083539 IP 192.168.43.124.8880 > 192.168.43.195.7771: UDP, length 120
22:45:40.133542 IP 192.168.43.124.8880 > 192.168.43.195.7771: UDP, length 120
22:45:40.183595 IP 192.168.43.124.8880 > 192.168.43.195.7771: UDP, length 120
22:45:40.233541 IP 192.168.43.124.8880 > 192.168.43.195.7771: UDP, length 120
22:45:40.283542 IP 192.168.43.124.8880 > 192.168.43.195.7771: UDP, length 120
22:45:40.333543 IP 192.168.43.124.8880 > 192.168.43.195.7771: UDP, length 120
22:45:40.383543 IP 192.168.43.124.8880 > 192.168.43.195.7771: UDP, length 120
22:45:40.433538 IP 192.168.43.124.8880 > 192.168.43.195.7771: UDP, length 120
22:45:40.483540 IP 192.168.43.124.8880 > 192.168.43.195.7771: UDP, length 120
22:45:40.533543 IP 192.168.43.124.8880 > 192.168.43.195.7771: UDP, length 120
22:45:40.583538 IP 192.168.43.124.8880 > 192.168.43.195.7771: UDP, length 120
22:45:40.633543 IP 192.168.43.124.8880 > 192.168.43.195.7771: UDP, length 120
22:45:40.683541 IP 192.168.43.124.8880 > 192.168.43.195.7771: UDP, length 120
22:45:40.733542 IP 192.168.43.124.8880 > 192.168.43.195.7771: UDP, length 120
22:45:40.783544 IP 192.168.43.124.8880 > 192.168.43.195.7771: UDP, length 120
22:45:40.833593 IP 192.168.43.124.8880 > 192.168.43.195.7771: UDP, length 120
22:45:40.883594 IP 192.168.43.124.8880 > 192.168.43.195.7771: UDP, length 120
22:45:40.933595 IP 192.168.43.124.8880 > 192.168.43.195.7771: UDP, length 120
22:45:40.983595 IP 192.168.43.124.8880 > 192.168.43.195.7771: UDP, length 120
22:45:41.033599 IP 192.168.43.124.8880 > 192.168.43.195.7771: UDP, length 120
22:45:41.083494 IP 192.168.43.124.8880 > 192.168.43.195.7771: UDP, length 120
22:45:41.133542 IP 192.168.43.124.8880 > 192.168.43.195.7771: UDP, length 120
22:45:41.183533 IP 192.168.43.124.8880 > 192.168.43.195.7771: UDP, length 120
22:45:41.233539 IP 192.168.43.124.8880 > 192.168.43.195.7771: UDP, length 120
22:45:41.283539 IP 192.168.43.124.8880 > 192.168.43.195.7771: UDP, length 120
22:45:41.333539 IP 192.168.43.124.8880 > 192.168.43.195.7771: UDP, length 120
22:45:41.383543 IP 192.168.43.124.8880 > 192.168.43.195.7771: UDP, length 120
22:45:41.433539 IP 192.168.43.124.8880 > 192.168.43.195.7771: UDP, length 120
22:45:41.483541 IP 192.168.43.124.8880 > 192.168.43.195.7771: UDP, length 120
22:45:41.533543 IP 192.168.43.124.8880 > 192.168.43.195.7771: UDP, length 120
22:45:41.583545 IP 192.168.43.124.8880 > 192.168.43.195.7771: UDP, length 120
22:45:41.633543 IP 192.168.43.124.8880 > 192.168.43.195.7771: UDP, length 120
22:45:41.683541 IP 192.168.43.124.8880 > 192.168.43.195.7771: UDP, length 120
22:45:41.733540 IP 192.168.43.124.8880 > 192.168.43.195.7771: UDP, length 120
22:45:41.783542 IP 192.168.43.124.8880 > 192.168.43.195.7771: UDP, length 120
22:45:41.833541 IP 192.168.43.124.8880 > 192.168.43.195.7771: UDP, length 120
22:45:41.883539 IP 192.168.43.124.8880 > 192.168.43.195.7771: UDP, length 120
22:45:41.933543 IP 192.168.43.124.8880 > 192.168.43.195.7771: UDP, length 120
22:45:41.983544 IP 192.168.43.124.8880 > 192.168.43.195.7771: UDP, length 120
22:45:42.033539 IP 192.168.43.124.8880 > 192.168.43.195.7771: UDP, length 120
22:45:42.083545 IP 192.168.43.124.8880 > 192.168.43.195.7771: UDP, length 120
22:45:42.133544 IP 192.168.43.124.8880 > 192.168.43.195.7771: UDP, length 120
22:45:42.183467 IP 192.168.43.124.8880 > 192.168.43.195.7771: UDP, length 120
22:45:42.233733 IP 192.168.43.124.8880 > 192.168.43.195.7771: UDP, length 120
22:45:42.283542 IP 192.168.43.124.8880 > 192.168.43.195.7771: UDP, length 120
22:45:42.333543 IP 192.168.43.124.8880 > 192.168.43.195.7771: UDP, length 120
22:45:42.383538 IP 192.168.43.124.8880 > 192.168.43.195.7771: UDP, length 120
22:45:42.433538 IP 192.168.43.124.8880 > 192.168.43.195.7771: UDP, length 120
22:45:42.483539 IP 192.168.43.124.8880 > 192.168.43.195.7771: UDP, length 120
22:45:42.533541 IP 192.168.43.124.8880 > 192.168.43.195.7771: UDP, length 120
22:45:42.583528 IP 192.168.43.124.8880 > 192.168.43.195.7771: UDP, length 120
22:45:42.633537 IP 192.168.43.124.8880 > 192.168.43.195.7771: UDP, length 120
22:45:42.683538 IP 192.168.43.124.8880 > 192.168.43.195.7771: UDP, length 120
22:45:42.733592 IP 192.168.43.124.8880 > 192.168.43.195.7771: UDP, length 120
22:45:42.783594 IP 192.168.43.124.8880 > 192.168.43.195.7771: UDP, length 120
22:45:42.833596 IP 192.168.43.124.8880 > 192.168.43.195.7771: UDP, length 120
22:45:42.883594 IP 192.168.43.124.8880 > 192.168.43.195.7771: UDP, length 120
22:45:42.933595 IP 192.168.43.124.8880 > 192.168.43.195.7771: UDP, length 120
22:45:42.983594 IP 192.168.43.124.8880 > 192.168.43.195.7771: UDP, length 120
22:45:43.033595 IP 192.168.43.124.8880 > 192.168.43.195.7771: UDP, length 120
22:45:43.083485 IP 192.168.43.124.8880 > 192.168.43.195.7771: UDP, length 120
22:45:43.133540 IP 192.168.43.124.8880 > 192.168.43.195.7771: UDP, length 120
22:45:43.183543 IP 192.168.43.124.8880 > 192.168.43.195.7771: UDP, length 120
22:45:43.233539 IP 192.168.43.124.8880 > 192.168.43.195.7771: UDP, length 120
22:45:43.283477 IP 192.168.43.124.8880 > 192.168.43.195.7771: UDP, length 120
22:45:43.333463 IP 192.168.43.124.8880 > 192.168.43.195.7771: UDP, length 120
22:45:43.383482 IP 192.168.43.124.8880 > 192.168.43.195.7771: UDP, length 120
22:45:43.433538 IP 192.168.43.124.8880 > 192.168.43.195.7771: UDP, length 120
22:45:43.483538 IP 192.168.43.124.8880 > 192.168.43.195.7771: UDP, length 120
22:45:43.533539 IP 192.168.43.124.8880 > 192.168.43.195.7771: UDP, length 120
22:45:43.583541 IP 192.168.43.124.8880 > 192.168.43.195.7771: UDP, length 120
22:45:43.633538 IP 192.168.43.124.8880 > 192.168.43.195.7771: UDP, length 120
22:45:43.683537 IP 192.168.43.124.8880 > 192.168.43.195.7771: UDP, length 120
22:45:43.733587 IP 192.168.43.124.8880 > 192.168.43.195.7771: UDP, length 120
22:45:43.783586 IP 192.168.43.124.8880 > 192.168.43.195.7771: UDP, length 120
22:45:43.833595 IP 192.168.43.124.8880 > 192.168.43.195.7771: UDP, length 120
22:45:43.883593 IP 192.168.43.124.8880 > 192.168.43.195.7771: UDP, length 120
22:45:43.933596 IP 192.168.43.124.8880 > 192.168.43.195.7771: UDP, length 120
22:45:43.983595 IP 192.168.43.124.8880 > 192.168.43.195.7771: UDP, length 120
22:45:44.033591 IP 192.168.43.124.8880 > 192.168.43.195.7771: UDP, length 120
22:45:44.083492 IP 192.168.43.124.8880 > 192.168.43.195.7771: UDP, length 120
22:45:44.133538 IP 192.168.43.124.8880 > 192.168.43.195.7771: UDP, length 120
22:45:44.183540 IP 192.168.43.124.8880 > 192.168.43.195.7771: UDP, length 120
22:45:44.233539 IP 192.168.43.124.8880 > 192.168.43.195.7771: UDP, length 120
22:45:44.283540 IP 192.168.43.124.8880 > 192.168.43.195.7771: UDP, length 120
22:45:44.333539 IP 192.168.43.124.8880 > 192.168.43.195.7771: UDP, length 120
22:45:44.383542 IP 192.168.43.124.8880 > 192.168.43.195.7771: UDP, length 120
22:45:44.433537 IP 192.168.43.124.8880 > 192.168.43.195.7771: UDP, length 120
22:45:44.483538 IP 192.168.43.124.8880 > 192.168.43.195.7771: UDP, length 120
22:45:44.533541 IP 192.168.43.124.8880 > 192.168.43.195.7771: UDP, length 120
22:45:44.583542 IP 192.168.43.124.8880 > 192.168.43.195.7771: UDP, length 120
22:45:44.633537 IP 192.168.43.124.8880 > 192.168.43.195.7771: UDP, length 120
22:45:44.683540 IP 192.168.43.124.8880 > 192.168.43.195.7771: UDP, length 120
22:45:44.734052 IP 192.168.43.124.8880 > 192.168.43.195.7771: UDP, length 120
22:45:44.783593 IP 192.168.43.124.8880 > 192.168.43.195.7771: UDP, length 120
22:45:44.833598 IP 192.168.43.124.8880 > 192.168.43.195.7771: UDP, length 120
22:45:44.883596 IP 192.168.43.124.8880 > 192.168.43.195.7771: UDP, length 120
22:45:44.933592 IP 192.168.43.124.8880 > 192.168.43.195.7771: UDP, length 120
22:45:44.983594 IP 192.168.43.124.8880 > 192.168.43.195.7771: UDP, length 120
22:45:45.033596 IP 192.168.43.124.8880 > 192.168.43.195.7771: UDP, length 120
22:45:45.083541 IP 192.168.43.124.8880 > 192.168.43.195.7771: UDP, length 120
22:45:45.133540 IP 192.168.43.124.8880 > 192.168.43.195.7771: UDP, length 120
22:45:45.183540 IP 192.168.43.124.8880 > 192.168.43.195.7771: UDP, length 120
22:45:45.233543 IP 192.168.43.124.8880 > 192.168.43.195.7771: UDP, length 120
22:45:45.283541 IP 192.168.43.124.8880 > 192.168.43.195.7771: UDP, length 120
22:45:45.333541 IP 192.168.43.124.8880 > 192.168.43.195.7771: UDP, length 120
22:45:45.383543 IP 192.168.43.124.8880 > 192.168.43.195.7771: UDP, length 120
22:45:45.433541 IP 192.168.43.124.8880 > 192.168.43.195.7771: UDP, length 120
22:45:45.483540 IP 192.168.43.124.8880 > 192.168.43.195.7771: UDP, length 120
22:45:45.533544 IP 192.168.43.124.8880 > 192.168.43.195.7771: UDP, length 120
22:45:45.583544 IP 192.168.43.124.8880 > 192.168.43.195.7771: UDP, length 120
22:45:45.633540 IP 192.168.43.124.8880 > 192.168.43.195.7771: UDP, length 120
22:45:45.683539 IP 192.168.43.124.8880 > 192.168.43.195.7771: UDP, length 120
22:45:45.733542 IP 192.168.43.124.8880 > 192.168.43.195.7771: UDP, length 120
22:45:45.783539 IP 192.168.43.124.8880 > 192.168.43.195.7771: UDP, length 120
22:45:45.833540 IP 192.168.43.124.8880 > 192.168.43.195.7771: UDP, length 120
22:45:45.883541 IP 192.168.43.124.8880 > 192.168.43.195.7771: UDP, length 120
22:45:45.933542 IP 192.168.43.124.8880 > 192.168.43.195.7771: UDP, length 120
22:45:45.983542 IP 192.168.43.124.8880 > 192.168.43.195.7771: UDP, length 120
22:45:46.033544 IP 192.168.43.124.8880 > 192.168.43.195.7771: UDP, length 120
22:45:46.083499 IP 192.168.43.124.8880 > 192.168.43.195.7771: UDP, length 120
22:45:46.133540 IP 192.168.43.124.8880 > 192.168.43.195.7771: UDP, length 120
22:45:46.183539 IP 192.168.43.124.8880 > 192.168.43.195.7771: UDP, length 120
22:45:46.233543 IP 192.168.43.124.8880 > 192.168.43.195.7771: UDP, length 120
22:45:46.283537 IP 192.168.43.124.8880 > 192.168.43.195.7771: UDP, length 120
22:45:46.333537 IP 192.168.43.124.8880 > 192.168.43.195.7771: UDP, length 120
22:45:46.383539 IP 192.168.43.124.8880 > 192.168.43.195.7771: UDP, length 120
22:45:46.433538 IP 192.168.43.124.8880 > 192.168.43.195.7771: UDP, length 120
22:45:46.483540 IP 192.168.43.124.8880 > 192.168.43.195.7771: UDP, length 120
22:45:46.533542 IP 192.168.43.124.8880 > 192.168.43.195.7771: UDP, length 120
22:45:46.583545 IP 192.168.43.124.8880 > 192.168.43.195.7771: UDP, length 120
22:45:46.633539 IP 192.168.43.124.8880 > 192.168.43.195.7771: UDP, length 120
22:45:46.683488 IP 192.168.43.124.8880 > 192.168.43.195.7771: UDP, length 120
22:45:46.733533 IP 192.168.43.124.8880 > 192.168.43.195.7771: UDP, length 120
22:45:46.783539 IP 192.168.43.124.8880 > 192.168.43.195.7771: UDP, length 120
22:45:46.833591 IP 192.168.43.124.8880 > 192.168.43.195.7771: UDP, length 120
22:45:46.883594 IP 192.168.43.124.8880 > 192.168.43.195.7771: UDP, length 120
22:45:46.933594 IP 192.168.43.124.8880 > 192.168.43.195.7771: UDP, length 120
22:45:46.983596 IP 192.168.43.124.8880 > 192.168.43.195.7771: UDP, length 120
22:45:47.033597 IP 192.168.43.124.8880 > 192.168.43.195.7771: UDP, length 120
22:45:47.083553 IP 192.168.43.124.8880 > 192.168.43.195.7771: UDP, length 120
22:45:47.133542 IP 192.168.43.124.8880 > 192.168.43.195.7771: UDP, length 120
22:45:47.183538 IP 192.168.43.124.8880 > 192.168.43.195.7771: UDP, length 120
22:45:47.233622 IP 192.168.43.124.8880 > 192.168.43.195.7771: UDP, length 120
22:45:47.283538 IP 192.168.43.124.8880 > 192.168.43.195.7771: UDP, length 120
22:45:47.333538 IP 192.168.43.124.8880 > 192.168.43.195.7771: UDP, length 120
22:45:47.383490 IP 192.168.43.124.8880 > 192.168.43.195.7771: UDP, length 120
22:45:47.433539 IP 192.168.43.124.8880 > 192.168.43.195.7771: UDP, length 120
22:45:47.483547 IP 192.168.43.124.8880 > 192.168.43.195.7771: UDP, length 120
22:45:47.533541 IP 192.168.43.124.8880 > 192.168.43.195.7771: UDP, length 120
22:45:47.583543 IP 192.168.43.124.8880 > 192.168.43.195.7771: UDP, length 120
