22:08:34.868079 IP 192.168.43.124.8880 > 192.168.43.195.7771: UDP, length 120
22:08:34.918222 IP 192.168.43.124.8880 > 192.168.43.195.7771: UDP, length 120
22:08:34.968224 IP 192.168.43.124.8880 > 192.168.43.195.7771: UDP, length 120
22:08:35.018226 IP 192.168.43.124.8880 > 192.168.43.195.7771: UDP, length 120
22:08:35.068224 IP 192.168.43.124.8880 > 192.168.43.195.7771: UDP, length 120
22:08:35.118224 IP 192.168.43.124.8880 > 192.168.43.195.7771: UDP, length 120
22:08:35.168227 IP 192.168.43.124.8880 > 192.168.43.195.7771: UDP, length 120
22:08:35.218222 IP 192.168.43.124.8880 > 192.168.43.195.7771: UDP, length 120
22:08:35.268222 IP 192.168.43.124.8880 > 192.168.43.195.7771: UDP, length 120
22:08:35.318224 IP 192.168.43.124.8880 > 192.168.43.195.7771: UDP, length 120
22:08:35.368225 IP 192.168.43.124.8880 > 192.168.43.195.7771: UDP, length 120
22:08:35.418224 IP 192.168.43.124.8880 > 192.168.43.195.7771: UDP, length 120
22:08:35.468226 IP 192.168.43.124.8880 > 192.168.43.195.7771: UDP, length 120
22:08:35.518226 IP 192.168.43.124.8880 > 192.168.43.195.7771: UDP, length 120
22:08:35.568225 IP 192.168.43.124.8880 > 192.168.43.195.7771: UDP, length 120
22:08:35.618224 IP 192.168.43.124.8880 > 192.168.43.195.7771: UDP, length 120
22:08:35.668224 IP 192.168.43.124.8880 > 192.168.43.195.7771: UDP, length 120
22:08:35.718224 IP 192.168.43.124.8880 > 192.168.43.195.7771: UDP, length 120
22:08:35.768225 IP 192.168.43.124.8880 > 192.168.43.195.7771: UDP, length 120
22:08:35.818273 IP 192.168.43.124.8880 > 192.168.43.195.7771: UDP, length 120
22:08:35.868227 IP 192.168.43.124.8880 > 192.168.43.195.7771: UDP, length 120
22:08:35.918224 IP 192.168.43.124.8880 > 192.168.43.195.7771: UDP, length 120
22:08:35.968224 IP 192.168.43.124.8880 > 192.168.43.195.7771: UDP, length 120
22:08:36.018224 IP 192.168.43.124.8880 > 192.168.43.195.7771: UDP, length 120
22:08:36.068225 IP 192.168.43.124.8880 > 192.168.43.195.7771: UDP, length 120
22:08:36.118225 IP 192.168.43.124.8880 > 192.168.43.195.7771: UDP, length 120
22:08:36.168236 IP 192.168.43.124.8880 > 192.168.43.195.7771: UDP, length 120
22:08:36.218275 IP 192.168.43.124.8880 > 192.168.43.195.7771: UDP, length 120
22:08:36.268278 IP 192.168.43.124.8880 > 192.168.43.195.7771: UDP, length 120
22:08:36.318275 IP 192.168.43.124.8880 > 192.168.43.195.7771: UDP, length 120
22:08:36.368275 IP 192.168.43.124.8880 > 192.168.43.195.7771: UDP, length 120
22:08:36.418308 IP 192.168.43.124.8880 > 192.168.43.195.7771: UDP, length 120
22:08:36.468226 IP 192.168.43.124.8880 > 192.168.43.195.7771: UDP, length 120
22:08:36.518144 IP 192.168.43.124.8880 > 192.168.43.195.7771: UDP, length 120
22:08:36.568222 IP 192.168.43.124.8880 > 192.168.43.195.7771: UDP, length 120
22:08:36.618194 IP 192.168.43.124.8880 > 192.168.43.195.7771: UDP, length 120
22:08:36.668146 IP 192.168.43.124.8880 > 192.168.43.195.7771: UDP, length 120
22:08:36.718177 IP 192.168.43.124.8880 > 192.168.43.195.7771: UDP, length 120
22:08:36.768227 IP 192.168.43.124.8880 > 192.168.43.195.7771: UDP, length 120
22:08:36.818225 IP 192.168.43.124.8880 > 192.168.43.195.7771: UDP, length 120
22:08:36.868225 IP 192.168.43.124.8880 > 192.168.43.195.7771: UDP, length 120
22:08:36.918223 IP 192.168.43.124.8880 > 192.168.43.195.7771: UDP, length 120
22:08:36.968225 IP 192.168.43.124.8880 > 192.168.43.195.7771: UDP, length 120
22:08:37.018224 IP 192.168.43.124.8880 > 192.168.43.195.7771: UDP, length 120
22:08:37.068224 IP 192.168.43.124.8880 > 192.168.43.195.7771: UDP, length 120
22:08:37.118225 IP 192.168.43.124.8880 > 192.168.43.195.7771: UDP, length 120
22:08:37.168226 IP 192.168.43.124.8880 > 192.168.43.195.7771: UDP, length 120
22:08:37.218276 IP 192.168.43.124.8880 > 192.168.43.195.7771: UDP, length 120
22:08:37.268231 IP 192.168.43.124.8880 > 192.168.43.195.7771: UDP, length 120
22:08:37.318230 IP 192.168.43.124.8880 > 192.168.43.195.7771: UDP, length 120
22:08:37.368228 IP 192.168.43.124.8880 > 192.168.43.195.7771: UDP, length 120
22:08:37.418228 IP 192.168.43.124.8880 > 192.168.43.195.7771: UDP, length 120
22:08:37.468224 IP 192.168.43.124.8880 > 192.168.43.195.7771: UDP, length 120
22:08:37.518226 IP 192.168.43.124.8880 > 192.168.43.195.7771: UDP, length 120
22:08:37.568228 IP 192.168.43.124.8880 > 192.168.43.195.7771: UDP, length 120
22:08:37.618229 IP 192.168.43.124.8880 > 192.168.43.195.7771: UDP, length 120
22:08:37.668227 IP 192.168.43.124.8880 > 192.168.43.195.7771: UDP, length 120
22:08:37.718226 IP 192.168.43.124.8880 > 192.168.43.195.7771: UDP, length 120
22:08:37.768227 IP 192.168.43.124.8880 > 192.168.43.195.7771: UDP, length 120
22:08:37.818224 IP 192.168.43.124.8880 > 192.168.43.195.7771: UDP, length 120
22:08:37.868275 IP 192.168.43.124.8880 > 192.168.43.195.7771: UDP, length 120
22:08:37.918469 IP 192.168.43.124.8880 > 192.168.43.195.7771: UDP, length 120
22:08:37.968275 IP 192.168.43.124.8880 > 192.168.43.195.7771: UDP, length 120
22:08:38.018274 IP 192.168.43.124.8880 > 192.168.43.195.7771: UDP, length 120
22:08:38.068279 IP 192.168.43.124.8880 > 192.168.43.195.7771: UDP, length 120
22:08:38.118995 IP 192.168.43.124.8880 > 192.168.43.195.7771: UDP, length 120
22:08:38.168485 IP 192.168.43.124.8880 > 192.168.43.195.7771: UDP, length 120
22:08:38.218276 IP 192.168.43.124.8880 > 192.168.43.195.7771: UDP, length 120
22:08:38.268231 IP 192.168.43.124.8880 > 192.168.43.195.7771: UDP, length 120
22:08:38.318228 IP 192.168.43.124.8880 > 192.168.43.195.7771: UDP, length 120
22:08:38.368229 IP 192.168.43.124.8880 > 192.168.43.195.7771: UDP, length 120
22:08:38.418229 IP 192.168.43.124.8880 > 192.168.43.195.7771: UDP, length 120
22:08:38.468220 IP 192.168.43.124.8880 > 192.168.43.195.7771: UDP, length 120
22:08:38.518225 IP 192.168.43.124.8880 > 192.168.43.195.7771: UDP, length 120
22:08:38.568225 IP 192.168.43.124.8880 > 192.168.43.195.7771: UDP, length 120
22:08:38.618225 IP 192.168.43.124.8880 > 192.168.43.195.7771: UDP, length 120
22:08:38.668344 IP 192.168.43.124.8880 > 192.168.43.195.7771: UDP, length 120
22:08:38.718225 IP 192.168.43.124.8880 > 192.168.43.195.7771: UDP, length 120
22:08:38.768223 IP 192.168.43.124.8880 > 192.168.43.195.7771: UDP, length 120
22:08:38.818224 IP 192.168.43.124.8880 > 192.168.43.195.7771: UDP, length 120
22:08:38.868225 IP 192.168.43.124.8880 > 192.168.43.195.7771: UDP, length 120
22:08:38.918225 IP 192.168.43.124.8880 > 192.168.43.195.7771: UDP, length 120
22:08:38.968225 IP 192.168.43.124.8880 > 192.168.43.195.7771: UDP, length 120
22:08:39.018276 IP 192.168.43.124.8880 > 192.168.43.195.7771: UDP, length 120
22:08:39.068275 IP 192.168.43.124.8880 > 192.168.43.195.7771: UDP, length 120
22:08:39.118277 IP 192.168.43.124.8880 > 192.168.43.195.7771: UDP, length 120
22:08:39.168276 IP 192.168.43.124.8880 > 192.168.43.195.7771: UDP, length 120
22:08:39.218277 IP 192.168.43.124.8880 > 192.168.43.195.7771: UDP, length 120
22:08:39.268230 IP 192.168.43.124.8880 > 192.168.43.195.7771: UDP, length 120
22:08:39.318228 IP 192.168.43.124.8880 > 192.168.43.195.7771: UDP, length 120
22:08:39.368279 IP 192.168.43.124.8880 > 192.168.43.195.7771: UDP, length 120
22:08:39.419344 IP 192.168.43.124.8880 > 192.168.43.195.7771: UDP, length 120
22:08:39.468363 IP 192.168.43.124.8880 > 192.168.43.195.7771: UDP, length 120
22:08:39.518225 IP 192.168.43.124.8880 > 192.168.43.195.7771: UDP, length 120
22:08:39.568224 IP 192.168.43.124.8880 > 192.168.43.195.7771: UDP, length 120
22:08:39.618225 IP 192.168.43.124.8880 > 192.168.43.195.7771: UDP, length 120
22:08:39.668225 IP 192.168.43.124.8880 > 192.168.43.195.7771: UDP, length 120
22:08:39.718226 IP 192.168.43.124.8880 > 192.168.43.195.7771: UDP, length 120
22:08:39.768224 IP 192.168.43.124.8880 > 192.168.43.195.7771: UDP, length 120
22:08:39.818223 IP 192.168.43.124.8880 > 192.168.43.195.7771: UDP, length 120
22:08:39.868224 IP 192.168.43.124.8880 > 192.168.43.195.7771: UDP, length 120
22:08:39.918172 IP 192.168.43.124.8880 > 192.168.43.195.7771: UDP, length 120
22:08:39.968225 IP 192.168.43.124.8880 > 192.168.43.195.7771: UDP, length 120
22:08:40.018226 IP 192.168.43.124.8880 > 192.168.43.195.7771: UDP, length 120
22:08:40.068222 IP 192.168.43.124.8880 > 192.168.43.195.7771: UDP, length 120
22:08:40.118223 IP 192.168.43.124.8880 > 192.168.43.195.7771: UDP, length 120
22:08:40.168189 IP 192.168.43.124.8880 > 192.168.43.195.7771: UDP, length 120
22:08:40.218274 IP 192.168.43.124.8880 > 192.168.43.195.7771: UDP, length 120
22:08:40.268192 IP 192.168.43.124.8880 > 192.168.43.195.7771: UDP, length 120
22:08:40.318228 IP 192.168.43.124.8880 > 192.168.43.195.7771: UDP, length 120
22:08:40.368183 IP 192.168.43.124.8880 > 192.168.43.195.7771: UDP, length 120
22:08:40.418230 IP 192.168.43.124.8880 > 192.168.43.195.7771: UDP, length 120
22:08:40.468169 IP 192.168.43.124.8880 > 192.168.43.195.7771: UDP, length 120
22:08:40.518223 IP 192.168.43.124.8880 > 192.168.43.195.7771: UDP, length 120
22:08:40.568172 IP 192.168.43.124.8880 > 192.168.43.195.7771: UDP, length 120
22:08:40.618225 IP 192.168.43.124.8880 > 192.168.43.195.7771: UDP, length 120
22:08:40.668172 IP 192.168.43.124.8880 > 192.168.43.195.7771: UDP, length 120
22:08:40.718224 IP 192.168.43.124.8880 > 192.168.43.195.7771: UDP, length 120
22:08:40.768191 IP 192.168.43.124.8880 > 192.168.43.195.7771: UDP, length 120
22:08:40.818854 IP 192.168.43.124.8880 > 192.168.43.195.7771: UDP, length 120
22:08:40.868224 IP 192.168.43.124.8880 > 192.168.43.195.7771: UDP, length 120
22:08:40.918223 IP 192.168.43.124.8880 > 192.168.43.195.7771: UDP, length 120
22:08:40.968225 IP 192.168.43.124.8880 > 192.168.43.195.7771: UDP, length 120
22:08:41.018223 IP 192.168.43.124.8880 > 192.168.43.195.7771: UDP, length 120
22:08:41.068224 IP 192.168.43.124.8880 > 192.168.43.195.7771: UDP, length 120
22:08:41.118224 IP 192.168.43.124.8880 > 192.168.43.195.7771: UDP, length 120
22:08:41.168225 IP 192.168.43.124.8880 > 192.168.43.195.7771: UDP, length 120
22:08:41.218274 IP 192.168.43.124.8880 > 192.168.43.195.7771: UDP, length 120
22:08:41.268228 IP 192.168.43.124.8880 > 192.168.43.195.7771: UDP, length 120
22:08:41.318226 IP 192.168.43.124.8880 > 192.168.43.195.7771: UDP, length 120
22:08:41.368224 IP 192.168.43.124.8880 > 192.168.43.195.7771: UDP, length 120
22:08:41.418223 IP 192.168.43.124.8880 > 192.168.43.195.7771: UDP, length 120
22:08:41.468219 IP 192.168.43.124.8880 > 192.168.43.195.7771: UDP, length 120
22:08:41.518225 IP 192.168.43.124.8880 > 192.168.43.195.7771: UDP, length 120
22:08:41.568221 IP 192.168.43.124.8880 > 192.168.43.195.7771: UDP, length 120
22:08:41.618223 IP 192.168.43.124.8880 > 192.168.43.195.7771: UDP, length 120
22:08:41.668188 IP 192.168.43.124.8880 > 192.168.43.195.7771: UDP, length 120
22:08:41.718150 IP 192.168.43.124.8880 > 192.168.43.195.7771: UDP, length 120
22:08:41.768160 IP 192.168.43.124.8880 > 192.168.43.195.7771: UDP, length 120
22:08:41.818148 IP 192.168.43.124.8880 > 192.168.43.195.7771: UDP, length 120
22:08:41.868225 IP 192.168.43.124.8880 > 192.168.43.195.7771: UDP, length 120
22:08:41.918224 IP 192.168.43.124.8880 > 192.168.43.195.7771: UDP, length 120
22:08:41.968224 IP 192.168.43.124.8880 > 192.168.43.195.7771: UDP, length 120
22:08:42.018224 IP 192.168.43.124.8880 > 192.168.43.195.7771: UDP, length 120
22:08:42.068223 IP 192.168.43.124.8880 > 192.168.43.195.7771: UDP, length 120
22:08:42.118224 IP 192.168.43.124.8880 > 192.168.43.195.7771: UDP, length 120
22:08:42.168223 IP 192.168.43.124.8880 > 192.168.43.195.7771: UDP, length 120
22:08:42.218275 IP 192.168.43.124.8880 > 192.168.43.195.7771: UDP, length 120
22:08:42.268278 IP 192.168.43.124.8880 > 192.168.43.195.7771: UDP, length 120
22:08:42.319323 IP 192.168.43.124.8880 > 192.168.43.195.7771: UDP, length 120
22:08:42.368275 IP 192.168.43.124.8880 > 192.168.43.195.7771: UDP, length 120
22:08:42.418312 IP 192.168.43.124.8880 > 192.168.43.195.7771: UDP, length 120
22:08:42.468220 IP 192.168.43.124.8880 > 192.168.43.195.7771: UDP, length 120
22:08:42.518224 IP 192.168.43.124.8880 > 192.168.43.195.7771: UDP, length 120
22:08:42.568225 IP 192.168.43.124.8880 > 192.168.43.195.7771: UDP, length 120
22:08:42.618225 IP 192.168.43.124.8880 > 192.168.43.195.7771: UDP, length 120
22:08:42.668224 IP 192.168.43.124.8880 > 192.168.43.195.7771: UDP, length 120
22:08:42.718224 IP 192.168.43.124.8880 > 192.168.43.195.7771: UDP, length 120
22:08:42.768224 IP 192.168.43.124.8880 > 192.168.43.195.7771: UDP, length 120
22:08:42.818224 IP 192.168.43.124.8880 > 192.168.43.195.7771: UDP, length 120
22:08:42.868223 IP 192.168.43.124.8880 > 192.168.43.195.7771: UDP, length 120
22:08:42.918224 IP 192.168.43.124.8880 > 192.168.43.195.7771: UDP, length 120
22:08:42.968224 IP 192.168.43.124.8880 > 192.168.43.195.7771: UDP, length 120
22:08:43.018225 IP 192.168.43.124.8880 > 192.168.43.195.7771: UDP, length 120
22:08:43.068223 IP 192.168.43.124.8880 > 192.168.43.195.7771: UDP, length 120
22:08:43.118224 IP 192.168.43.124.8880 > 192.168.43.195.7771: UDP, length 120
22:08:43.168224 IP 192.168.43.124.8880 > 192.168.43.195.7771: UDP, length 120
22:08:43.218276 IP 192.168.43.124.8880 > 192.168.43.195.7771: UDP, length 120
22:08:43.268278 IP 192.168.43.124.8880 > 192.168.43.195.7771: UDP, length 120
22:08:43.318486 IP 192.168.43.124.8880 > 192.168.43.195.7771: UDP, length 120
22:08:43.368275 IP 192.168.43.124.8880 > 192.168.43.195.7771: UDP, length 120
22:08:43.418478 IP 192.168.43.124.8880 > 192.168.43.195.7771: UDP, length 120
22:08:43.468220 IP 192.168.43.124.8880 > 192.168.43.195.7771: UDP, length 120
22:08:43.518223 IP 192.168.43.124.8880 > 192.168.43.195.7771: UDP, length 120
22:08:43.568224 IP 192.168.43.124.8880 > 192.168.43.195.7771: UDP, length 120
22:08:43.618223 IP 192.168.43.124.8880 > 192.168.43.195.7771: UDP, length 120
22:08:43.668223 IP 192.168.43.124.8880 > 192.168.43.195.7771: UDP, length 120
22:08:43.718222 IP 192.168.43.124.8880 > 192.168.43.195.7771: UDP, length 120
22:08:43.768223 IP 192.168.43.124.8880 > 192.168.43.195.7771: UDP, length 120
22:08:43.818225 IP 192.168.43.124.8880 > 192.168.43.195.7771: UDP, length 120
22:08:43.868225 IP 192.168.43.124.8880 > 192.168.43.195.7771: UDP, length 120
22:08:43.918232 IP 192.168.43.124.8880 > 192.168.43.195.7771: UDP, length 120
22:08:43.968276 IP 192.168.43.124.8880 > 192.168.43.195.7771: UDP, length 120
22:08:44.018275 IP 192.168.43.124.8880 > 192.168.43.195.7771: UDP, length 120
22:08:44.068275 IP 192.168.43.124.8880 > 192.168.43.195.7771: UDP, length 120
22:08:44.118488 IP 192.168.43.124.8880 > 192.168.43.195.7771: UDP, length 120
22:08:44.168276 IP 192.168.43.124.8880 > 192.168.43.195.7771: UDP, length 120
22:08:44.218180 IP 192.168.43.124.8880 > 192.168.43.195.7771: UDP, length 120
22:08:44.268224 IP 192.168.43.124.8880 > 192.168.43.195.7771: UDP, length 120
22:08:44.318224 IP 192.168.43.124.8880 > 192.168.43.195.7771: UDP, length 120
22:08:44.368222 IP 192.168.43.124.8880 > 192.168.43.195.7771: UDP, length 120
22:08:44.418224 IP 192.168.43.124.8880 > 192.168.43.195.7771: UDP, length 120
22:08:44.468220 IP 192.168.43.124.8880 > 192.168.43.195.7771: UDP, length 120
22:08:44.518223 IP 192.168.43.124.8880 > 192.168.43.195.7771: UDP, length 120
22:08:44.568226 IP 192.168.43.124.8880 > 192.168.43.195.7771: UDP, length 120
22:08:44.618225 IP 192.168.43.124.8880 > 192.168.43.195.7771: UDP, length 120
22:08:44.668225 IP 192.168.43.124.8880 > 192.168.43.195.7771: UDP, length 120
22:08:44.718225 IP 192.168.43.124.8880 > 192.168.43.195.7771: UDP, length 120
22:08:44.768224 IP 192.168.43.124.8880 > 192.168.43.195.7771: UDP, length 120
22:08:44.818223 IP 192.168.43.124.8880 > 192.168.43.195.7771: UDP, length 120
22:08:44.868224 IP 192.168.43.124.8880 > 192.168.43.195.7771: UDP, length 120
22:08:44.918223 IP 192.168.43.124.8880 > 192.168.43.195.7771: UDP, length 120
22:08:44.968224 IP 192.168.43.124.8880 > 192.168.43.195.7771: UDP, length 120
22:08:45.018188 IP 192.168.43.124.8880 > 192.168.43.195.7771: UDP, length 120
22:08:45.068224 IP 192.168.43.124.8880 > 192.168.43.195.7771: UDP, length 120
22:08:45.118223 IP 192.168.43.124.8880 > 192.168.43.195.7771: UDP, length 120
22:08:45.168223 IP 192.168.43.124.8880 > 192.168.43.195.7771: UDP, length 120
22:08:45.218275 IP 192.168.43.124.8880 > 192.168.43.195.7771: UDP, length 120
22:08:45.268273 IP 192.168.43.124.8880 > 192.168.43.195.7771: UDP, length 120
22:08:45.319010 IP 192.168.43.124.8880 > 192.168.43.195.7771: UDP, length 120
22:08:45.368487 IP 192.168.43.124.8880 > 192.168.43.195.7771: UDP, length 120
22:08:45.418276 IP 192.168.43.124.8880 > 192.168.43.195.7771: UDP, length 120
22:08:45.468222 IP 192.168.43.124.8880 > 192.168.43.195.7771: UDP, length 120
22:08:45.518225 IP 192.168.43.124.8880 > 192.168.43.195.7771: UDP, length 120
22:08:45.568223 IP 192.168.43.124.8880 > 192.168.43.195.7771: UDP, length 120
22:08:45.618224 IP 192.168.43.124.8880 > 192.168.43.195.7771: UDP, length 120
22:08:45.668202 IP 192.168.43.124.8880 > 192.168.43.195.7771: UDP, length 120
22:08:45.718276 IP 192.168.43.124.8880 > 192.168.43.195.7771: UDP, length 120
22:08:45.768276 IP 192.168.43.124.8880 > 192.168.43.195.7771: UDP, length 120
22:08:45.818274 IP 192.168.43.124.8880 > 192.168.43.195.7771: UDP, length 120
22:08:45.868276 IP 192.168.43.124.8880 > 192.168.43.195.7771: UDP, length 120
22:08:45.918470 IP 192.168.43.124.8880 > 192.168.43.195.7771: UDP, length 120
22:08:45.968277 IP 192.168.43.124.8880 > 192.168.43.195.7771: UDP, length 120
22:08:46.018802 IP 192.168.43.124.8880 > 192.168.43.195.7771: UDP, length 120
22:08:46.068447 IP 192.168.43.124.8880 > 192.168.43.195.7771: UDP, length 120
22:08:46.118275 IP 192.168.43.124.8880 > 192.168.43.195.7771: UDP, length 120
22:08:46.168277 IP 192.168.43.124.8880 > 192.168.43.195.7771: UDP, length 120
22:08:46.218279 IP 192.168.43.124.8880 > 192.168.43.195.7771: UDP, length 120
22:08:46.268207 IP 192.168.43.124.8880 > 192.168.43.195.7771: UDP, length 120
22:08:46.318278 IP 192.168.43.124.8880 > 192.168.43.195.7771: UDP, length 120
22:08:46.368228 IP 192.168.43.124.8880 > 192.168.43.195.7771: UDP, length 120
22:08:46.418228 IP 192.168.43.124.8880 > 192.168.43.195.7771: UDP, length 120
22:08:46.468226 IP 192.168.43.124.8880 > 192.168.43.195.7771: UDP, length 120
22:08:46.518227 IP 192.168.43.124.8880 > 192.168.43.195.7771: UDP, length 120
22:08:46.568226 IP 192.168.43.124.8880 > 192.168.43.195.7771: UDP, length 120
22:08:46.618227 IP 192.168.43.124.8880 > 192.168.43.195.7771: UDP, length 120
22:08:46.668228 IP 192.168.43.124.8880 > 192.168.43.195.7771: UDP, length 120
22:08:46.718226 IP 192.168.43.124.8880 > 192.168.43.195.7771: UDP, length 120
22:08:46.768190 IP 192.168.43.124.8880 > 192.168.43.195.7771: UDP, length 120
22:08:46.818179 IP 192.168.43.124.8880 > 192.168.43.195.7771: UDP, length 120
22:08:46.868158 IP 192.168.43.124.8880 > 192.168.43.195.7771: UDP, length 120
22:08:46.918156 IP 192.168.43.124.8880 > 192.168.43.195.7771: UDP, length 120
22:08:46.968223 IP 192.168.43.124.8880 > 192.168.43.195.7771: UDP, length 120
22:08:47.018225 IP 192.168.43.124.8880 > 192.168.43.195.7771: UDP, length 120
22:08:47.068223 IP 192.168.43.124.8880 > 192.168.43.195.7771: UDP, length 120
22:08:47.118224 IP 192.168.43.124.8880 > 192.168.43.195.7771: UDP, length 120
22:08:47.168170 IP 192.168.43.124.8880 > 192.168.43.195.7771: UDP, length 120
22:08:47.218225 IP 192.168.43.124.8880 > 192.168.43.195.7771: UDP, length 120
22:08:47.268225 IP 192.168.43.124.8880 > 192.168.43.195.7771: UDP, length 120
22:08:47.318224 IP 192.168.43.124.8880 > 192.168.43.195.7771: UDP, length 120
22:08:47.368224 IP 192.168.43.124.8880 > 192.168.43.195.7771: UDP, length 120
22:08:47.418226 IP 192.168.43.124.8880 > 192.168.43.195.7771: UDP, length 120
22:08:47.468171 IP 192.168.43.124.8880 > 192.168.43.195.7771: UDP, length 120
22:08:47.518223 IP 192.168.43.124.8880 > 192.168.43.195.7771: UDP, length 120
22:08:47.568227 IP 192.168.43.124.8880 > 192.168.43.195.7771: UDP, length 120
22:08:47.618223 IP 192.168.43.124.8880 > 192.168.43.195.7771: UDP, length 120
22:08:47.668226 IP 192.168.43.124.8880 > 192.168.43.195.7771: UDP, length 120
22:08:47.718223 IP 192.168.43.124.8880 > 192.168.43.195.7771: UDP, length 120
22:08:47.768226 IP 192.168.43.124.8880 > 192.168.43.195.7771: UDP, length 120
22:08:47.818223 IP 192.168.43.124.8880 > 192.168.43.195.7771: UDP, length 120
22:08:47.868227 IP 192.168.43.124.8880 > 192.168.43.195.7771: UDP, length 120
22:08:47.918273 IP 192.168.43.124.8880 > 192.168.43.195.7771: UDP, length 120
22:08:47.968229 IP 192.168.43.124.8880 > 192.168.43.195.7771: UDP, length 120
22:08:48.018225 IP 192.168.43.124.8880 > 192.168.43.195.7771: UDP, length 120
22:08:48.068214 IP 192.168.43.124.8880 > 192.168.43.195.7771: UDP, length 120
22:08:48.118275 IP 192.168.43.124.8880 > 192.168.43.195.7771: UDP, length 120
22:08:48.168275 IP 192.168.43.124.8880 > 192.168.43.195.7771: UDP, length 120
22:08:48.218274 IP 192.168.43.124.8880 > 192.168.43.195.7771: UDP, length 120
22:08:48.268225 IP 192.168.43.124.8880 > 192.168.43.195.7771: UDP, length 120
22:08:48.318224 IP 192.168.43.124.8880 > 192.168.43.195.7771: UDP, length 120
22:08:48.368226 IP 192.168.43.124.8880 > 192.168.43.195.7771: UDP, length 120
22:08:48.418224 IP 192.168.43.124.8880 > 192.168.43.195.7771: UDP, length 120
22:08:48.468224 IP 192.168.43.124.8880 > 192.168.43.195.7771: UDP, length 120
22:08:48.518221 IP 192.168.43.124.8880 > 192.168.43.195.7771: UDP, length 120
22:08:48.568226 IP 192.168.43.124.8880 > 192.168.43.195.7771: UDP, length 120
22:08:48.618223 IP 192.168.43.124.8880 > 192.168.43.195.7771: UDP, length 120
22:08:48.668166 IP 192.168.43.124.8880 > 192.168.43.195.7771: UDP, length 120
22:08:48.718223 IP 192.168.43.124.8880 > 192.168.43.195.7771: UDP, length 120
22:08:48.768225 IP 192.168.43.124.8880 > 192.168.43.195.7771: UDP, length 120
22:08:48.818224 IP 192.168.43.124.8880 > 192.168.43.195.7771: UDP, length 120
22:08:48.868272 IP 192.168.43.124.8880 > 192.168.43.195.7771: UDP, length 120
22:08:48.918276 IP 192.168.43.124.8880 > 192.168.43.195.7771: UDP, length 120
22:08:48.968272 IP 192.168.43.124.8880 > 192.168.43.195.7771: UDP, length 120
22:08:49.018275 IP 192.168.43.124.8880 > 192.168.43.195.7771: UDP, length 120
22:08:49.068236 IP 192.168.43.124.8880 > 192.168.43.195.7771: UDP, length 120
22:08:49.118274 IP 192.168.43.124.8880 > 192.168.43.195.7771: UDP, length 120
22:08:49.168224 IP 192.168.43.124.8880 > 192.168.43.195.7771: UDP, length 120
22:08:49.218269 IP 192.168.43.124.8880 > 192.168.43.195.7771: UDP, length 120
22:08:49.268165 IP 192.168.43.124.8880 > 192.168.43.195.7771: UDP, length 120
22:08:49.318218 IP 192.168.43.124.8880 > 192.168.43.195.7771: UDP, length 120
22:08:49.368171 IP 192.168.43.124.8880 > 192.168.43.195.7771: UDP, length 120
22:08:49.418223 IP 192.168.43.124.8880 > 192.168.43.195.7771: UDP, length 120
22:08:49.468182 IP 192.168.43.124.8880 > 192.168.43.195.7771: UDP, length 120
22:08:49.518223 IP 192.168.43.124.8880 > 192.168.43.195.7771: UDP, length 120
22:08:49.568173 IP 192.168.43.124.8880 > 192.168.43.195.7771: UDP, length 120
22:08:49.618222 IP 192.168.43.124.8880 > 192.168.43.195.7771: UDP, length 120
22:08:49.668145 IP 192.168.43.124.8880 > 192.168.43.195.7771: UDP, length 120
22:08:49.718224 IP 192.168.43.124.8880 > 192.168.43.195.7771: UDP, length 120
22:08:49.768231 IP 192.168.43.124.8880 > 192.168.43.195.7771: UDP, length 120
22:08:49.818223 IP 192.168.43.124.8880 > 192.168.43.195.7771: UDP, length 120
22:08:49.868176 IP 192.168.43.124.8880 > 192.168.43.195.7771: UDP, length 120
22:08:49.918226 IP 192.168.43.124.8880 > 192.168.43.195.7771: UDP, length 120
22:08:49.968227 IP 192.168.43.124.8880 > 192.168.43.195.7771: UDP, length 120
22:08:50.018230 IP 192.168.43.124.8880 > 192.168.43.195.7771: UDP, length 120
22:08:50.068223 IP 192.168.43.124.8880 > 192.168.43.195.7771: UDP, length 120
22:08:50.118226 IP 192.168.43.124.8880 > 192.168.43.195.7771: UDP, length 120
22:08:50.168223 IP 192.168.43.124.8880 > 192.168.43.195.7771: UDP, length 120
22:08:50.218226 IP 192.168.43.124.8880 > 192.168.43.195.7771: UDP, length 120
22:08:50.268223 IP 192.168.43.124.8880 > 192.168.43.195.7771: UDP, length 120
22:08:50.318222 IP 192.168.43.124.8880 > 192.168.43.195.7771: UDP, length 120
22:08:50.368223 IP 192.168.43.124.8880 > 192.168.43.195.7771: UDP, length 120
22:08:50.418225 IP 192.168.43.124.8880 > 192.168.43.195.7771: UDP, length 120
22:08:50.468269 IP 192.168.43.124.8880 > 192.168.43.195.7771: UDP, length 120
22:08:50.518225 IP 192.168.43.124.8880 > 192.168.43.195.7771: UDP, length 120
22:08:50.568228 IP 192.168.43.124.8880 > 192.168.43.195.7771: UDP, length 120
22:08:50.618228 IP 192.168.43.124.8880 > 192.168.43.195.7771: UDP, length 120
22:08:50.668228 IP 192.168.43.124.8880 > 192.168.43.195.7771: UDP, length 120
22:08:50.718226 IP 192.168.43.124.8880 > 192.168.43.195.7771: UDP, length 120
22:08:50.768228 IP 192.168.43.124.8880 > 192.168.43.195.7771: UDP, length 120
22:08:50.818226 IP 192.168.43.124.8880 > 192.168.43.195.7771: UDP, length 120
22:08:50.868273 IP 192.168.43.124.8880 > 192.168.43.195.7771: UDP, length 120
22:08:50.918274 IP 192.168.43.124.8880 > 192.168.43.195.7771: UDP, length 120
22:08:50.968275 IP 192.168.43.124.8880 > 192.168.43.195.7771: UDP, length 120
22:08:51.018275 IP 192.168.43.124.8880 > 192.168.43.195.7771: UDP, length 120
22:08:51.068277 IP 192.168.43.124.8880 > 192.168.43.195.7771: UDP, length 120
22:08:51.118273 IP 192.168.43.124.8880 > 192.168.43.195.7771: UDP, length 120
22:08:51.168274 IP 192.168.43.124.8880 > 192.168.43.195.7771: UDP, length 120
22:08:51.218276 IP 192.168.43.124.8880 > 192.168.43.195.7771: UDP, length 120
22:08:51.268225 IP 192.168.43.124.8880 > 192.168.43.195.7771: UDP, length 120
22:08:51.318224 IP 192.168.43.124.8880 > 192.168.43.195.7771: UDP, length 120
22:08:51.368223 IP 192.168.43.124.8880 > 192.168.43.195.7771: UDP, length 120
22:08:51.418177 IP 192.168.43.124.8880 > 192.168.43.195.7771: UDP, length 120
22:08:51.468616 IP 192.168.43.124.8880 > 192.168.43.195.7771: UDP, length 120
22:08:51.518226 IP 192.168.43.124.8880 > 192.168.43.195.7771: UDP, length 120
22:08:51.568222 IP 192.168.43.124.8880 > 192.168.43.195.7771: UDP, length 120
22:08:51.618225 IP 192.168.43.124.8880 > 192.168.43.195.7771: UDP, length 120
22:08:51.668226 IP 192.168.43.124.8880 > 192.168.43.195.7771: UDP, length 120
22:08:51.718274 IP 192.168.43.124.8880 > 192.168.43.195.7771: UDP, length 120
22:08:51.768181 IP 192.168.43.124.8880 > 192.168.43.195.7771: UDP, length 120
22:08:51.818182 IP 192.168.43.124.8880 > 192.168.43.195.7771: UDP, length 120
22:08:51.868232 IP 192.168.43.124.8880 > 192.168.43.195.7771: UDP, length 120
22:08:51.918230 IP 192.168.43.124.8880 > 192.168.43.195.7771: UDP, length 120
22:08:51.968157 IP 192.168.43.124.8880 > 192.168.43.195.7771: UDP, length 120
22:08:52.018152 IP 192.168.43.124.8880 > 192.168.43.195.7771: UDP, length 120
22:08:52.068227 IP 192.168.43.124.8880 > 192.168.43.195.7771: UDP, length 120
22:08:52.118223 IP 192.168.43.124.8880 > 192.168.43.195.7771: UDP, length 120
22:08:52.168225 IP 192.168.43.124.8880 > 192.168.43.195.7771: UDP, length 120
22:08:52.218223 IP 192.168.43.124.8880 > 192.168.43.195.7771: UDP, length 120
22:08:52.268225 IP 192.168.43.124.8880 > 192.168.43.195.7771: UDP, length 120
22:08:52.318274 IP 192.168.43.124.8880 > 192.168.43.195.7771: UDP, length 120
22:08:52.368228 IP 192.168.43.124.8880 > 192.168.43.195.7771: UDP, length 120
22:08:52.418226 IP 192.168.43.124.8880 > 192.168.43.195.7771: UDP, length 120
22:08:52.468227 IP 192.168.43.124.8880 > 192.168.43.195.7771: UDP, length 120
22:08:52.518221 IP 192.168.43.124.8880 > 192.168.43.195.7771: UDP, length 120
22:08:52.568222 IP 192.168.43.124.8880 > 192.168.43.195.7771: UDP, length 120
22:08:52.618223 IP 192.168.43.124.8880 > 192.168.43.195.7771: UDP, length 120
22:08:52.668230 IP 192.168.43.124.8880 > 192.168.43.195.7771: UDP, length 120
22:08:52.718228 IP 192.168.43.124.8880 > 192.168.43.195.7771: UDP, length 120
22:08:52.768229 IP 192.168.43.124.8880 > 192.168.43.195.7771: UDP, length 120
22:08:52.818229 IP 192.168.43.124.8880 > 192.168.43.195.7771: UDP, length 120
22:08:52.868230 IP 192.168.43.124.8880 > 192.168.43.195.7771: UDP, length 120
22:08:52.918274 IP 192.168.43.124.8880 > 192.168.43.195.7771: UDP, length 120
22:08:52.968278 IP 192.168.43.124.8880 > 192.168.43.195.7771: UDP, length 120
22:08:53.018276 IP 192.168.43.124.8880 > 192.168.43.195.7771: UDP, length 120
22:08:53.068237 IP 192.168.43.124.8880 > 192.168.43.195.7771: UDP, length 120
22:08:53.118275 IP 192.168.43.124.8880 > 192.168.43.195.7771: UDP, length 120
22:08:53.168277 IP 192.168.43.124.8880 > 192.168.43.195.7771: UDP, length 120
22:08:53.218275 IP 192.168.43.124.8880 > 192.168.43.195.7771: UDP, length 120
22:08:53.268228 IP 192.168.43.124.8880 > 192.168.43.195.7771: UDP, length 120
22:08:53.318226 IP 192.168.43.124.8880 > 192.168.43.195.7771: UDP, length 120
22:08:53.368276 IP 192.168.43.124.8880 > 192.168.43.195.7771: UDP, length 120
22:08:53.418274 IP 192.168.43.124.8880 > 192.168.43.195.7771: UDP, length 120
22:08:53.468274 IP 192.168.43.124.8880 > 192.168.43.195.7771: UDP, length 120
22:08:53.518222 IP 192.168.43.124.8880 > 192.168.43.195.7771: UDP, length 120
22:08:53.568225 IP 192.168.43.124.8880 > 192.168.43.195.7771: UDP, length 120
22:08:53.618224 IP 192.168.43.124.8880 > 192.168.43.195.7771: UDP, length 120
22:08:53.668225 IP 192.168.43.124.8880 > 192.168.43.195.7771: UDP, length 120
22:08:53.718224 IP 192.168.43.124.8880 > 192.168.43.195.7771: UDP, length 120
22:08:53.768227 IP 192.168.43.124.8880 > 192.168.43.195.7771: UDP, length 120
22:08:53.818223 IP 192.168.43.124.8880 > 192.168.43.195.7771: UDP, length 120
22:08:53.868226 IP 192.168.43.124.8880 > 192.168.43.195.7771: UDP, length 120
22:08:53.918227 IP 192.168.43.124.8880 > 192.168.43.195.7771: UDP, length 120
22:08:53.968275 IP 192.168.43.124.8880 > 192.168.43.195.7771: UDP, length 120
22:08:54.018275 IP 192.168.43.124.8880 > 192.168.43.195.7771: UDP, length 120
22:08:54.068275 IP 192.168.43.124.8880 > 192.168.43.195.7771: UDP, length 120
22:08:54.118276 IP 192.168.43.124.8880 > 192.168.43.195.7771: UDP, length 120
22:08:54.168277 IP 192.168.43.124.8880 > 192.168.43.195.7771: UDP, length 120
22:08:54.218270 IP 192.168.43.124.8880 > 192.168.43.195.7771: UDP, length 120
22:08:54.268226 IP 192.168.43.124.8880 > 192.168.43.195.7771: UDP, length 120
22:08:54.318197 IP 192.168.43.124.8880 > 192.168.43.195.7771: UDP, length 120
22:08:54.368226 IP 192.168.43.124.8880 > 192.168.43.195.7771: UDP, length 120
22:08:54.418224 IP 192.168.43.124.8880 > 192.168.43.195.7771: UDP, length 120
22:08:54.468235 IP 192.168.43.124.8880 > 192.168.43.195.7771: UDP, length 120
22:08:54.518223 IP 192.168.43.124.8880 > 192.168.43.195.7771: UDP, length 120
22:08:54.568224 IP 192.168.43.124.8880 > 192.168.43.195.7771: UDP, length 120
22:08:54.618225 IP 192.168.43.124.8880 > 192.168.43.195.7771: UDP, length 120
22:08:54.668226 IP 192.168.43.124.8880 > 192.168.43.195.7771: UDP, length 120
22:08:54.718223 IP 192.168.43.124.8880 > 192.168.43.195.7771: UDP, length 120
22:08:54.768225 IP 192.168.43.124.8880 > 192.168.43.195.7771: UDP, length 120
22:08:54.818224 IP 192.168.43.124.8880 > 192.168.43.195.7771: UDP, length 120
22:08:54.868225 IP 192.168.43.124.8880 > 192.168.43.195.7771: UDP, length 120
22:08:54.918222 IP 192.168.43.124.8880 > 192.168.43.195.7771: UDP, length 120
22:08:54.968225 IP 192.168.43.124.8880 > 192.168.43.195.7771: UDP, length 120
22:08:55.018225 IP 192.168.43.124.8880 > 192.168.43.195.7771: UDP, length 120
22:08:55.068224 IP 192.168.43.124.8880 > 192.168.43.195.7771: UDP, length 120
22:08:55.118223 IP 192.168.43.124.8880 > 192.168.43.195.7771: UDP, length 120
22:08:55.168226 IP 192.168.43.124.8880 > 192.168.43.195.7771: UDP, length 120
22:08:55.218223 IP 192.168.43.124.8880 > 192.168.43.195.7771: UDP, length 120
22:08:55.268276 IP 192.168.43.124.8880 > 192.168.43.195.7771: UDP, length 120
22:08:55.318277 IP 192.168.43.124.8880 > 192.168.43.195.7771: UDP, length 120
22:08:55.368273 IP 192.168.43.124.8880 > 192.168.43.195.7771: UDP, length 120
22:08:55.418274 IP 192.168.43.124.8880 > 192.168.43.195.7771: UDP, length 120
22:08:55.468269 IP 192.168.43.124.8880 > 192.168.43.195.7771: UDP, length 120
22:08:55.518228 IP 192.168.43.124.8880 > 192.168.43.195.7771: UDP, length 120
22:08:55.568228 IP 192.168.43.124.8880 > 192.168.43.195.7771: UDP, length 120
22:08:55.618228 IP 192.168.43.124.8880 > 192.168.43.195.7771: UDP, length 120
22:08:55.668191 IP 192.168.43.124.8880 > 192.168.43.195.7771: UDP, length 120
22:08:55.718227 IP 192.168.43.124.8880 > 192.168.43.195.7771: UDP, length 120
22:08:55.768230 IP 192.168.43.124.8880 > 192.168.43.195.7771: UDP, length 120
22:08:55.818228 IP 192.168.43.124.8880 > 192.168.43.195.7771: UDP, length 120
22:08:55.868228 IP 192.168.43.124.8880 > 192.168.43.195.7771: UDP, length 120
22:08:55.918226 IP 192.168.43.124.8880 > 192.168.43.195.7771: UDP, length 120
22:08:55.968225 IP 192.168.43.124.8880 > 192.168.43.195.7771: UDP, length 120
22:08:56.018225 IP 192.168.43.124.8880 > 192.168.43.195.7771: UDP, length 120
22:08:56.068226 IP 192.168.43.124.8880 > 192.168.43.195.7771: UDP, length 120
22:08:56.118223 IP 192.168.43.124.8880 > 192.168.43.195.7771: UDP, length 120
22:08:56.168225 IP 192.168.43.124.8880 > 192.168.43.195.7771: UDP, length 120
22:08:56.218224 IP 192.168.43.124.8880 > 192.168.43.195.7771: UDP, length 120
22:08:56.268275 IP 192.168.43.124.8880 > 192.168.43.195.7771: UDP, length 120
22:08:56.318355 IP 192.168.43.124.8880 > 192.168.43.195.7771: UDP, length 120
22:08:56.368275 IP 192.168.43.124.8880 > 192.168.43.195.7771: UDP, length 120
22:08:56.418226 IP 192.168.43.124.8880 > 192.168.43.195.7771: UDP, length 120
22:08:56.468194 IP 192.168.43.124.8880 > 192.168.43.195.7771: UDP, length 120
22:08:56.518225 IP 192.168.43.124.8880 > 192.168.43.195.7771: UDP, length 120
22:08:56.568227 IP 192.168.43.124.8880 > 192.168.43.195.7771: UDP, length 120
22:08:56.618228 IP 192.168.43.124.8880 > 192.168.43.195.7771: UDP, length 120
22:08:56.668218 IP 192.168.43.124.8880 > 192.168.43.195.7771: UDP, length 120
22:08:56.718228 IP 192.168.43.124.8880 > 192.168.43.195.7771: UDP, length 120
22:08:56.768229 IP 192.168.43.124.8880 > 192.168.43.195.7771: UDP, length 120
22:08:56.818227 IP 192.168.43.124.8880 > 192.168.43.195.7771: UDP, length 120
22:08:56.868230 IP 192.168.43.124.8880 > 192.168.43.195.7771: UDP, length 120
22:08:56.918225 IP 192.168.43.124.8880 > 192.168.43.195.7771: UDP, length 120
22:08:56.968228 IP 192.168.43.124.8880 > 192.168.43.195.7771: UDP, length 120
22:08:57.018226 IP 192.168.43.124.8880 > 192.168.43.195.7771: UDP, length 120
22:08:57.068156 IP 192.168.43.124.8880 > 192.168.43.195.7771: UDP, length 120
22:08:57.118156 IP 192.168.43.124.8880 > 192.168.43.195.7771: UDP, length 120
22:08:57.168223 IP 192.168.43.124.8880 > 192.168.43.195.7771: UDP, length 120
22:08:57.218223 IP 192.168.43.124.8880 > 192.168.43.195.7771: UDP, length 120
22:08:57.268223 IP 192.168.43.124.8880 > 192.168.43.195.7771: UDP, length 120
22:08:57.318222 IP 192.168.43.124.8880 > 192.168.43.195.7771: UDP, length 120
22:08:57.368189 IP 192.168.43.124.8880 > 192.168.43.195.7771: UDP, length 120
22:08:57.418224 IP 192.168.43.124.8880 > 192.168.43.195.7771: UDP, length 120
22:08:57.468225 IP 192.168.43.124.8880 > 192.168.43.195.7771: UDP, length 120
22:08:57.518227 IP 192.168.43.124.8880 > 192.168.43.195.7771: UDP, length 120
22:08:57.568224 IP 192.168.43.124.8880 > 192.168.43.195.7771: UDP, length 120
22:08:57.618226 IP 192.168.43.124.8880 > 192.168.43.195.7771: UDP, length 120
22:08:57.668228 IP 192.168.43.124.8880 > 192.168.43.195.7771: UDP, length 120
22:08:57.718223 IP 192.168.43.124.8880 > 192.168.43.195.7771: UDP, length 120
22:08:57.768225 IP 192.168.43.124.8880 > 192.168.43.195.7771: UDP, length 120
22:08:57.818225 IP 192.168.43.124.8880 > 192.168.43.195.7771: UDP, length 120
22:08:57.868191 IP 192.168.43.124.8880 > 192.168.43.195.7771: UDP, length 120
22:08:57.918227 IP 192.168.43.124.8880 > 192.168.43.195.7771: UDP, length 120
22:08:57.968226 IP 192.168.43.124.8880 > 192.168.43.195.7771: UDP, length 120
22:08:58.018226 IP 192.168.43.124.8880 > 192.168.43.195.7771: UDP, length 120
22:08:58.068223 IP 192.168.43.124.8880 > 192.168.43.195.7771: UDP, length 120
22:08:58.118224 IP 192.168.43.124.8880 > 192.168.43.195.7771: UDP, length 120
22:08:58.168277 IP 192.168.43.124.8880 > 192.168.43.195.7771: UDP, length 120
22:08:58.218273 IP 192.168.43.124.8880 > 192.168.43.195.7771: UDP, length 120
22:08:58.268203 IP 192.168.43.124.8880 > 192.168.43.195.7771: UDP, length 120
22:08:58.318276 IP 192.168.43.124.8880 > 192.168.43.195.7771: UDP, length 120
22:08:58.368276 IP 192.168.43.124.8880 > 192.168.43.195.7771: UDP, length 120
22:08:58.418274 IP 192.168.43.124.8880 > 192.168.43.195.7771: UDP, length 120
22:08:58.468276 IP 192.168.43.124.8880 > 192.168.43.195.7771: UDP, length 120
22:08:58.518228 IP 192.168.43.124.8880 > 192.168.43.195.7771: UDP, length 120
22:08:58.568228 IP 192.168.43.124.8880 > 192.168.43.195.7771: UDP, length 120
22:08:58.618225 IP 192.168.43.124.8880 > 192.168.43.195.7771: UDP, length 120
22:08:58.668164 IP 192.168.43.124.8880 > 192.168.43.195.7771: UDP, length 120
22:08:58.718229 IP 192.168.43.124.8880 > 192.168.43.195.7771: UDP, length 120
22:08:58.768227 IP 192.168.43.124.8880 > 192.168.43.195.7771: UDP, length 120
22:08:58.818231 IP 192.168.43.124.8880 > 192.168.43.195.7771: UDP, length 120
22:08:58.868228 IP 192.168.43.124.8880 > 192.168.43.195.7771: UDP, length 120
22:08:58.918229 IP 192.168.43.124.8880 > 192.168.43.195.7771: UDP, length 120
22:08:58.968227 IP 192.168.43.124.8880 > 192.168.43.195.7771: UDP, length 120
22:08:59.018230 IP 192.168.43.124.8880 > 192.168.43.195.7771: UDP, length 120
22:08:59.068230 IP 192.168.43.124.8880 > 192.168.43.195.7771: UDP, length 120
22:08:59.118229 IP 192.168.43.124.8880 > 192.168.43.195.7771: UDP, length 120
22:08:59.168230 IP 192.168.43.124.8880 > 192.168.43.195.7771: UDP, length 120
22:08:59.218279 IP 192.168.43.124.8880 > 192.168.43.195.7771: UDP, length 120
22:08:59.268231 IP 192.168.43.124.8880 > 192.168.43.195.7771: UDP, length 120
22:08:59.318231 IP 192.168.43.124.8880 > 192.168.43.195.7771: UDP, length 120
22:08:59.368229 IP 192.168.43.124.8880 > 192.168.43.195.7771: UDP, length 120
22:08:59.418229 IP 192.168.43.124.8880 > 192.168.43.195.7771: UDP, length 120
22:08:59.468229 IP 192.168.43.124.8880 > 192.168.43.195.7771: UDP, length 120
22:08:59.518172 IP 192.168.43.124.8880 > 192.168.43.195.7771: UDP, length 120
22:08:59.568224 IP 192.168.43.124.8880 > 192.168.43.195.7771: UDP, length 120
22:08:59.618225 IP 192.168.43.124.8880 > 192.168.43.195.7771: UDP, length 120
22:08:59.668224 IP 192.168.43.124.8880 > 192.168.43.195.7771: UDP, length 120
22:08:59.718224 IP 192.168.43.124.8880 > 192.168.43.195.7771: UDP, length 120
22:08:59.768224 IP 192.168.43.124.8880 > 192.168.43.195.7771: UDP, length 120
22:08:59.818224 IP 192.168.43.124.8880 > 192.168.43.195.7771: UDP, length 120
