01:58:15.524007 IP 192.168.43.124.8880 > 192.168.43.146.7771: UDP, length 120
01:58:15.557651 IP 192.168.43.124.8880 > 192.168.43.146.7771: UDP, length 120
01:58:15.619844 IP 192.168.43.124.8880 > 192.168.43.146.7771: UDP, length 120
01:58:15.655461 IP 192.168.43.124.8880 > 192.168.43.146.7771: UDP, length 120
01:58:15.721295 IP 192.168.43.124.8880 > 192.168.43.146.7771: UDP, length 120
01:58:15.755395 IP 192.168.43.124.8880 > 192.168.43.146.7771: UDP, length 120
01:58:15.808652 IP 192.168.43.124.8880 > 192.168.43.146.7771: UDP, length 120
01:58:15.855423 IP 192.168.43.124.8880 > 192.168.43.146.7771: UDP, length 120
01:58:15.917888 IP 192.168.43.124.8880 > 192.168.43.146.7771: UDP, length 120
01:58:15.957122 IP 192.168.43.124.8880 > 192.168.43.146.7771: UDP, length 120
01:58:16.029367 IP 192.168.43.124.8880 > 192.168.43.146.7771: UDP, length 120
01:58:16.052415 IP 192.168.43.124.8880 > 192.168.43.146.7771: UDP, length 120
01:58:16.118282 IP 192.168.43.124.8880 > 192.168.43.146.7771: UDP, length 120
01:58:16.142903 IP 192.168.43.146.8880 > 192.168.43.147.7772: UDP, length 120
01:58:16.152325 IP 192.168.43.124.8880 > 192.168.43.146.7771: UDP, length 120
01:58:16.192943 IP 192.168.43.146.8880 > 192.168.43.147.7772: UDP, length 120
01:58:16.217324 IP 192.168.43.124.8880 > 192.168.43.146.7771: UDP, length 120
01:58:16.242932 IP 192.168.43.146.8880 > 192.168.43.147.7772: UDP, length 120
01:58:16.252290 IP 192.168.43.124.8880 > 192.168.43.146.7771: UDP, length 120
01:58:16.292937 IP 192.168.43.146.8880 > 192.168.43.147.7772: UDP, length 120
01:58:16.318123 IP 192.168.43.124.8880 > 192.168.43.146.7771: UDP, length 120
01:58:16.342928 IP 192.168.43.146.8880 > 192.168.43.147.7772: UDP, length 120
01:58:16.353187 IP 192.168.43.124.8880 > 192.168.43.146.7771: UDP, length 120
01:58:16.392926 IP 192.168.43.146.8880 > 192.168.43.147.7772: UDP, length 120
01:58:16.402328 IP 192.168.43.124.8880 > 192.168.43.146.7771: UDP, length 120
01:58:16.442926 IP 192.168.43.146.8880 > 192.168.43.147.7772: UDP, length 120
01:58:16.473089 IP 192.168.43.124.8880 > 192.168.43.146.7771: UDP, length 120
01:58:16.493022 IP 192.168.43.146.8880 > 192.168.43.147.7772: UDP, length 120
01:58:16.503395 IP 192.168.43.124.8880 > 192.168.43.146.7771: UDP, length 120
01:58:16.543013 IP 192.168.43.146.8880 > 192.168.43.147.7772: UDP, length 120
01:58:16.567877 IP 192.168.43.124.8880 > 192.168.43.146.7771: UDP, length 120
01:58:16.593011 IP 192.168.43.146.8880 > 192.168.43.147.7772: UDP, length 120
01:58:16.603282 IP 192.168.43.124.8880 > 192.168.43.146.7771: UDP, length 120
01:58:16.642976 IP 192.168.43.146.8880 > 192.168.43.147.7772: UDP, length 120
01:58:16.659513 IP 192.168.43.124.8880 > 192.168.43.146.7771: UDP, length 120
01:58:16.692958 IP 192.168.43.146.8880 > 192.168.43.147.7772: UDP, length 120
01:58:16.716109 IP 192.168.43.124.8880 > 192.168.43.146.7771: UDP, length 120
01:58:16.742985 IP 192.168.43.146.8880 > 192.168.43.147.7772: UDP, length 120
01:58:16.752293 IP 192.168.43.124.8880 > 192.168.43.146.7771: UDP, length 120
01:58:16.792995 IP 192.168.43.146.8880 > 192.168.43.147.7772: UDP, length 120
01:58:16.819869 IP 192.168.43.124.8880 > 192.168.43.146.7771: UDP, length 120
01:58:16.842970 IP 192.168.43.146.8880 > 192.168.43.147.7772: UDP, length 120
01:58:16.852359 IP 192.168.43.124.8880 > 192.168.43.146.7771: UDP, length 120
01:58:16.892966 IP 192.168.43.146.8880 > 192.168.43.147.7772: UDP, length 120
01:58:16.909863 IP 192.168.43.124.8880 > 192.168.43.146.7771: UDP, length 120
01:58:16.942972 IP 192.168.43.146.8880 > 192.168.43.147.7772: UDP, length 120
01:58:16.952219 IP 192.168.43.124.8880 > 192.168.43.146.7771: UDP, length 120
01:58:16.992951 IP 192.168.43.146.8880 > 192.168.43.147.7772: UDP, length 120
01:58:17.009933 IP 192.168.43.124.8880 > 192.168.43.146.7771: UDP, length 120
01:58:17.042907 IP 192.168.43.146.8880 > 192.168.43.147.7772: UDP, length 120
01:58:17.052196 IP 192.168.43.124.8880 > 192.168.43.146.7771: UDP, length 120
01:58:17.092950 IP 192.168.43.146.8880 > 192.168.43.147.7772: UDP, length 120
01:58:17.110788 IP 192.168.43.124.8880 > 192.168.43.146.7771: UDP, length 120
01:58:17.142914 IP 192.168.43.146.8880 > 192.168.43.147.7772: UDP, length 120
01:58:17.152715 IP 192.168.43.124.8880 > 192.168.43.146.7771: UDP, length 120
01:58:17.192902 IP 192.168.43.146.8880 > 192.168.43.147.7772: UDP, length 120
01:58:17.203983 IP 192.168.43.124.8880 > 192.168.43.146.7771: UDP, length 120
01:58:17.242899 IP 192.168.43.146.8880 > 192.168.43.147.7772: UDP, length 120
01:58:17.269824 IP 192.168.43.124.8880 > 192.168.43.146.7771: UDP, length 120
01:58:17.292897 IP 192.168.43.146.8880 > 192.168.43.147.7772: UDP, length 120
01:58:17.302217 IP 192.168.43.124.8880 > 192.168.43.146.7771: UDP, length 120
01:58:17.342903 IP 192.168.43.146.8880 > 192.168.43.147.7772: UDP, length 120
01:58:17.359845 IP 192.168.43.124.8880 > 192.168.43.146.7771: UDP, length 120
01:58:17.392910 IP 192.168.43.146.8880 > 192.168.43.147.7772: UDP, length 120
01:58:17.402133 IP 192.168.43.124.8880 > 192.168.43.146.7771: UDP, length 120
01:58:17.442900 IP 192.168.43.146.8880 > 192.168.43.147.7772: UDP, length 120
01:58:17.452204 IP 192.168.43.124.8880 > 192.168.43.146.7771: UDP, length 120
01:58:17.492899 IP 192.168.43.146.8880 > 192.168.43.147.7772: UDP, length 120
01:58:17.528729 IP 192.168.43.124.8880 > 192.168.43.146.7771: UDP, length 120
01:58:17.542898 IP 192.168.43.146.8880 > 192.168.43.147.7772: UDP, length 120
01:58:17.552214 IP 192.168.43.124.8880 > 192.168.43.146.7771: UDP, length 120
01:58:17.592899 IP 192.168.43.146.8880 > 192.168.43.147.7772: UDP, length 120
01:58:17.602340 IP 192.168.43.124.8880 > 192.168.43.146.7771: UDP, length 120
01:58:17.642925 IP 192.168.43.146.8880 > 192.168.43.147.7772: UDP, length 120
01:58:17.652208 IP 192.168.43.124.8880 > 192.168.43.146.7771: UDP, length 120
01:58:17.692925 IP 192.168.43.146.8880 > 192.168.43.147.7772: UDP, length 120
01:58:17.704454 IP 192.168.43.124.8880 > 192.168.43.146.7771: UDP, length 120
01:58:17.742925 IP 192.168.43.146.8880 > 192.168.43.147.7772: UDP, length 120
01:58:17.755411 IP 192.168.43.124.8880 > 192.168.43.146.7771: UDP, length 120
01:58:17.792925 IP 192.168.43.146.8880 > 192.168.43.147.7772: UDP, length 120
01:58:17.816323 IP 192.168.43.124.8880 > 192.168.43.146.7771: UDP, length 120
01:58:17.842923 IP 192.168.43.146.8880 > 192.168.43.147.7772: UDP, length 120
01:58:17.854864 IP 192.168.43.124.8880 > 192.168.43.146.7771: UDP, length 120
01:58:17.892923 IP 192.168.43.146.8880 > 192.168.43.147.7772: UDP, length 120
01:58:17.916100 IP 192.168.43.124.8880 > 192.168.43.146.7771: UDP, length 120
01:58:17.942925 IP 192.168.43.146.8880 > 192.168.43.147.7772: UDP, length 120
01:58:17.952089 IP 192.168.43.124.8880 > 192.168.43.146.7771: UDP, length 120
01:58:17.992965 IP 192.168.43.146.8880 > 192.168.43.147.7772: UDP, length 120
01:58:18.016634 IP 192.168.43.124.8880 > 192.168.43.146.7771: UDP, length 120
01:58:18.042934 IP 192.168.43.146.8880 > 192.168.43.147.7772: UDP, length 120
01:58:18.052457 IP 192.168.43.124.8880 > 192.168.43.146.7771: UDP, length 120
01:58:18.092987 IP 192.168.43.146.8880 > 192.168.43.147.7772: UDP, length 120
01:58:18.116647 IP 192.168.43.124.8880 > 192.168.43.146.7771: UDP, length 120
01:58:18.142946 IP 192.168.43.146.8880 > 192.168.43.147.7772: UDP, length 120
01:58:18.152542 IP 192.168.43.124.8880 > 192.168.43.146.7771: UDP, length 120
01:58:18.192928 IP 192.168.43.146.8880 > 192.168.43.147.7772: UDP, length 120
01:58:18.211324 IP 192.168.43.124.8880 > 192.168.43.146.7771: UDP, length 120
01:58:18.242924 IP 192.168.43.146.8880 > 192.168.43.147.7772: UDP, length 120
01:58:18.253165 IP 192.168.43.124.8880 > 192.168.43.146.7771: UDP, length 120
01:58:18.292923 IP 192.168.43.146.8880 > 192.168.43.147.7772: UDP, length 120
01:58:18.316882 IP 192.168.43.124.8880 > 192.168.43.146.7771: UDP, length 120
01:58:18.342924 IP 192.168.43.146.8880 > 192.168.43.147.7772: UDP, length 120
01:58:18.352422 IP 192.168.43.124.8880 > 192.168.43.146.7771: UDP, length 120
01:58:18.392931 IP 192.168.43.146.8880 > 192.168.43.147.7772: UDP, length 120
01:58:18.402110 IP 192.168.43.124.8880 > 192.168.43.146.7771: UDP, length 120
01:58:18.442935 IP 192.168.43.146.8880 > 192.168.43.147.7772: UDP, length 120
01:58:18.465954 IP 192.168.43.124.8880 > 192.168.43.146.7771: UDP, length 120
01:58:18.492925 IP 192.168.43.146.8880 > 192.168.43.147.7772: UDP, length 120
01:58:18.502478 IP 192.168.43.124.8880 > 192.168.43.146.7771: UDP, length 120
01:58:18.542931 IP 192.168.43.146.8880 > 192.168.43.147.7772: UDP, length 120
01:58:18.552171 IP 192.168.43.124.8880 > 192.168.43.146.7771: UDP, length 120
01:58:18.592924 IP 192.168.43.146.8880 > 192.168.43.147.7772: UDP, length 120
01:58:18.618377 IP 192.168.43.124.8880 > 192.168.43.146.7771: UDP, length 120
01:58:18.642922 IP 192.168.43.146.8880 > 192.168.43.147.7772: UDP, length 120
01:58:18.692919 IP 192.168.43.146.8880 > 192.168.43.147.7772: UDP, length 120
01:58:18.742919 IP 192.168.43.146.8880 > 192.168.43.147.7772: UDP, length 120
01:58:18.792920 IP 192.168.43.146.8880 > 192.168.43.147.7772: UDP, length 120
01:58:18.798011 IP 192.168.43.124.8880 > 192.168.43.146.7771: UDP, length 120
01:58:18.798307 IP 192.168.43.124.8880 > 192.168.43.146.7771: UDP, length 120
01:58:18.842930 IP 192.168.43.146.8880 > 192.168.43.147.7772: UDP, length 120
01:58:18.892921 IP 192.168.43.146.8880 > 192.168.43.147.7772: UDP, length 120
01:58:18.942921 IP 192.168.43.146.8880 > 192.168.43.147.7772: UDP, length 120
01:58:18.966684 IP 192.168.43.124.8880 > 192.168.43.146.7771: UDP, length 120
01:58:18.967005 IP 192.168.43.124.8880 > 192.168.43.146.7771: UDP, length 120
01:58:18.967230 IP 192.168.43.124.8880 > 192.168.43.146.7771: UDP, length 120
01:58:18.992926 IP 192.168.43.146.8880 > 192.168.43.147.7772: UDP, length 120
01:58:19.042922 IP 192.168.43.146.8880 > 192.168.43.147.7772: UDP, length 120
01:58:19.092993 IP 192.168.43.146.8880 > 192.168.43.147.7772: UDP, length 120
01:58:19.096486 IP 192.168.43.124.8880 > 192.168.43.146.7771: UDP, length 120
01:58:19.096837 IP 192.168.43.124.8880 > 192.168.43.146.7771: UDP, length 120
01:58:19.097047 IP 192.168.43.124.8880 > 192.168.43.146.7771: UDP, length 120
01:58:19.142949 IP 192.168.43.146.8880 > 192.168.43.147.7772: UDP, length 120
01:58:19.192924 IP 192.168.43.146.8880 > 192.168.43.147.7772: UDP, length 120
01:58:19.242920 IP 192.168.43.146.8880 > 192.168.43.147.7772: UDP, length 120
01:58:19.260390 IP 192.168.43.124.8880 > 192.168.43.146.7771: UDP, length 120
01:58:19.261909 IP 192.168.43.124.8880 > 192.168.43.146.7771: UDP, length 120
01:58:19.262125 IP 192.168.43.124.8880 > 192.168.43.146.7771: UDP, length 120
01:58:19.292922 IP 192.168.43.146.8880 > 192.168.43.147.7772: UDP, length 120
01:58:19.342923 IP 192.168.43.146.8880 > 192.168.43.147.7772: UDP, length 120
01:58:19.392923 IP 192.168.43.146.8880 > 192.168.43.147.7772: UDP, length 120
01:58:19.395764 IP 192.168.43.124.8880 > 192.168.43.146.7771: UDP, length 120
01:58:19.396104 IP 192.168.43.124.8880 > 192.168.43.146.7771: UDP, length 120
01:58:19.396339 IP 192.168.43.124.8880 > 192.168.43.146.7771: UDP, length 120
01:58:19.442934 IP 192.168.43.146.8880 > 192.168.43.147.7772: UDP, length 120
01:58:19.492964 IP 192.168.43.146.8880 > 192.168.43.147.7772: UDP, length 120
01:58:19.542936 IP 192.168.43.146.8880 > 192.168.43.147.7772: UDP, length 120
01:58:19.566349 IP 192.168.43.124.8880 > 192.168.43.146.7771: UDP, length 120
01:58:19.566504 IP 192.168.43.124.8880 > 192.168.43.146.7771: UDP, length 120
01:58:19.566624 IP 192.168.43.124.8880 > 192.168.43.146.7771: UDP, length 120
01:58:19.592933 IP 192.168.43.146.8880 > 192.168.43.147.7772: UDP, length 120
01:58:19.642925 IP 192.168.43.146.8880 > 192.168.43.147.7772: UDP, length 120
01:58:19.692922 IP 192.168.43.146.8880 > 192.168.43.147.7772: UDP, length 120
01:58:19.693821 IP 192.168.43.124.8880 > 192.168.43.146.7771: UDP, length 120
01:58:19.694132 IP 192.168.43.124.8880 > 192.168.43.146.7771: UDP, length 120
01:58:19.694360 IP 192.168.43.124.8880 > 192.168.43.146.7771: UDP, length 120
01:58:19.742928 IP 192.168.43.146.8880 > 192.168.43.147.7772: UDP, length 120
01:58:19.792923 IP 192.168.43.146.8880 > 192.168.43.147.7772: UDP, length 120
01:58:19.842922 IP 192.168.43.146.8880 > 192.168.43.147.7772: UDP, length 120
01:58:19.859293 IP 192.168.43.124.8880 > 192.168.43.146.7771: UDP, length 120
01:58:19.859601 IP 192.168.43.124.8880 > 192.168.43.146.7771: UDP, length 120
01:58:19.859828 IP 192.168.43.124.8880 > 192.168.43.146.7771: UDP, length 120
01:58:19.892925 IP 192.168.43.146.8880 > 192.168.43.147.7772: UDP, length 120
01:58:19.942923 IP 192.168.43.146.8880 > 192.168.43.147.7772: UDP, length 120
01:58:19.992059 IP 192.168.43.124.8880 > 192.168.43.146.7771: UDP, length 120
01:58:19.992372 IP 192.168.43.124.8880 > 192.168.43.146.7771: UDP, length 120
01:58:19.992611 IP 192.168.43.124.8880 > 192.168.43.146.7771: UDP, length 120
01:58:19.992921 IP 192.168.43.146.8880 > 192.168.43.147.7772: UDP, length 120
01:58:20.042925 IP 192.168.43.146.8880 > 192.168.43.147.7772: UDP, length 120
01:58:20.092997 IP 192.168.43.146.8880 > 192.168.43.147.7772: UDP, length 120
01:58:20.142962 IP 192.168.43.146.8880 > 192.168.43.147.7772: UDP, length 120
01:58:20.166477 IP 192.168.43.124.8880 > 192.168.43.146.7771: UDP, length 120
01:58:20.166868 IP 192.168.43.124.8880 > 192.168.43.146.7771: UDP, length 120
01:58:20.167090 IP 192.168.43.124.8880 > 192.168.43.146.7771: UDP, length 120
01:58:20.192940 IP 192.168.43.146.8880 > 192.168.43.147.7772: UDP, length 120
01:58:20.242927 IP 192.168.43.146.8880 > 192.168.43.147.7772: UDP, length 120
01:58:20.265731 IP 192.168.43.124.8880 > 192.168.43.146.7771: UDP, length 120
01:58:20.266044 IP 192.168.43.124.8880 > 192.168.43.146.7771: UDP, length 120
01:58:20.266262 IP 192.168.43.124.8880 > 192.168.43.146.7771: UDP, length 120
01:58:20.292927 IP 192.168.43.146.8880 > 192.168.43.147.7772: UDP, length 120
01:58:20.342921 IP 192.168.43.146.8880 > 192.168.43.147.7772: UDP, length 120
01:58:20.392923 IP 192.168.43.146.8880 > 192.168.43.147.7772: UDP, length 120
01:58:20.442922 IP 192.168.43.146.8880 > 192.168.43.147.7772: UDP, length 120
01:58:20.445712 IP 192.168.43.124.8880 > 192.168.43.146.7771: UDP, length 120
01:58:20.446025 IP 192.168.43.124.8880 > 192.168.43.146.7771: UDP, length 120
01:58:20.446254 IP 192.168.43.124.8880 > 192.168.43.146.7771: UDP, length 120
01:58:20.492925 IP 192.168.43.146.8880 > 192.168.43.147.7772: UDP, length 120
01:58:20.542930 IP 192.168.43.146.8880 > 192.168.43.147.7772: UDP, length 120
01:58:20.560406 IP 192.168.43.124.8880 > 192.168.43.146.7771: UDP, length 120
01:58:20.560740 IP 192.168.43.124.8880 > 192.168.43.146.7771: UDP, length 120
01:58:20.560982 IP 192.168.43.124.8880 > 192.168.43.146.7771: UDP, length 120
01:58:20.592936 IP 192.168.43.146.8880 > 192.168.43.147.7772: UDP, length 120
01:58:20.642924 IP 192.168.43.146.8880 > 192.168.43.147.7772: UDP, length 120
01:58:20.692921 IP 192.168.43.146.8880 > 192.168.43.147.7772: UDP, length 120
01:58:20.702566 IP 192.168.43.124.8880 > 192.168.43.146.7771: UDP, length 120
01:58:20.702878 IP 192.168.43.124.8880 > 192.168.43.146.7771: UDP, length 120
01:58:20.703086 IP 192.168.43.124.8880 > 192.168.43.146.7771: UDP, length 120
01:58:20.742924 IP 192.168.43.146.8880 > 192.168.43.147.7772: UDP, length 120
01:58:20.792921 IP 192.168.43.146.8880 > 192.168.43.147.7772: UDP, length 120
01:58:20.842466 IP 192.168.43.124.8880 > 192.168.43.146.7771: UDP, length 120
01:58:20.842694 IP 192.168.43.124.8880 > 192.168.43.146.7771: UDP, length 120
01:58:20.842923 IP 192.168.43.146.8880 > 192.168.43.147.7772: UDP, length 120
01:58:20.892925 IP 192.168.43.146.8880 > 192.168.43.147.7772: UDP, length 120
01:58:20.942921 IP 192.168.43.146.8880 > 192.168.43.147.7772: UDP, length 120
01:58:20.954042 IP 192.168.43.124.8880 > 192.168.43.146.7771: UDP, length 120
01:58:20.954328 IP 192.168.43.124.8880 > 192.168.43.146.7771: UDP, length 120
01:58:20.954548 IP 192.168.43.124.8880 > 192.168.43.146.7771: UDP, length 120
01:58:20.992966 IP 192.168.43.146.8880 > 192.168.43.147.7772: UDP, length 120
01:58:21.042929 IP 192.168.43.146.8880 > 192.168.43.147.7772: UDP, length 120
01:58:21.092927 IP 192.168.43.146.8880 > 192.168.43.147.7772: UDP, length 120
01:58:21.102972 IP 192.168.43.124.8880 > 192.168.43.146.7771: UDP, length 120
01:58:21.103296 IP 192.168.43.124.8880 > 192.168.43.146.7771: UDP, length 120
01:58:21.142952 IP 192.168.43.146.8880 > 192.168.43.147.7772: UDP, length 120
01:58:21.192931 IP 192.168.43.146.8880 > 192.168.43.147.7772: UDP, length 120
01:58:21.242921 IP 192.168.43.146.8880 > 192.168.43.147.7772: UDP, length 120
01:58:21.266457 IP 192.168.43.124.8880 > 192.168.43.146.7771: UDP, length 120
01:58:21.266792 IP 192.168.43.124.8880 > 192.168.43.146.7771: UDP, length 120
01:58:21.267011 IP 192.168.43.124.8880 > 192.168.43.146.7771: UDP, length 120
01:58:21.292924 IP 192.168.43.146.8880 > 192.168.43.147.7772: UDP, length 120
01:58:21.342920 IP 192.168.43.146.8880 > 192.168.43.147.7772: UDP, length 120
01:58:21.390644 IP 192.168.43.124.8880 > 192.168.43.146.7771: UDP, length 120
01:58:21.390931 IP 192.168.43.124.8880 > 192.168.43.146.7771: UDP, length 120
01:58:21.391151 IP 192.168.43.124.8880 > 192.168.43.146.7771: UDP, length 120
01:58:21.392925 IP 192.168.43.146.8880 > 192.168.43.147.7772: UDP, length 120
01:58:21.442922 IP 192.168.43.146.8880 > 192.168.43.147.7772: UDP, length 120
01:58:21.492921 IP 192.168.43.146.8880 > 192.168.43.147.7772: UDP, length 120
01:58:21.542921 IP 192.168.43.146.8880 > 192.168.43.147.7772: UDP, length 120
01:58:21.569879 IP 192.168.43.124.8880 > 192.168.43.146.7771: UDP, length 120
01:58:21.570026 IP 192.168.43.124.8880 > 192.168.43.146.7771: UDP, length 120
01:58:21.570142 IP 192.168.43.124.8880 > 192.168.43.146.7771: UDP, length 120
01:58:21.592938 IP 192.168.43.146.8880 > 192.168.43.147.7772: UDP, length 120
01:58:21.642931 IP 192.168.43.146.8880 > 192.168.43.147.7772: UDP, length 120
01:58:21.676686 IP 192.168.43.124.8880 > 192.168.43.146.7771: UDP, length 120
01:58:21.677061 IP 192.168.43.124.8880 > 192.168.43.146.7771: UDP, length 120
01:58:21.677297 IP 192.168.43.124.8880 > 192.168.43.146.7771: UDP, length 120
01:58:21.692926 IP 192.168.43.146.8880 > 192.168.43.147.7772: UDP, length 120
01:58:21.742924 IP 192.168.43.146.8880 > 192.168.43.147.7772: UDP, length 120
01:58:21.792920 IP 192.168.43.146.8880 > 192.168.43.147.7772: UDP, length 120
01:58:21.836131 IP 192.168.43.124.8880 > 192.168.43.146.7771: UDP, length 120
01:58:21.836471 IP 192.168.43.124.8880 > 192.168.43.146.7771: UDP, length 120
01:58:21.836696 IP 192.168.43.124.8880 > 192.168.43.146.7771: UDP, length 120
01:58:21.842923 IP 192.168.43.146.8880 > 192.168.43.147.7772: UDP, length 120
01:58:21.852188 IP 192.168.43.124.8880 > 192.168.43.146.7771: UDP, length 120
01:58:21.892923 IP 192.168.43.146.8880 > 192.168.43.147.7772: UDP, length 120
01:58:21.909258 IP 192.168.43.124.8880 > 192.168.43.146.7771: UDP, length 120
01:58:21.942923 IP 192.168.43.146.8880 > 192.168.43.147.7772: UDP, length 120
01:58:21.953198 IP 192.168.43.124.8880 > 192.168.43.146.7771: UDP, length 120
01:58:21.992989 IP 192.168.43.146.8880 > 192.168.43.147.7772: UDP, length 120
01:58:22.015344 IP 192.168.43.124.8880 > 192.168.43.146.7771: UDP, length 120
01:58:22.043037 IP 192.168.43.146.8880 > 192.168.43.147.7772: UDP, length 120
01:58:22.052251 IP 192.168.43.124.8880 > 192.168.43.146.7771: UDP, length 120
01:58:22.093010 IP 192.168.43.146.8880 > 192.168.43.147.7772: UDP, length 120
01:58:22.112096 IP 192.168.43.124.8880 > 192.168.43.146.7771: UDP, length 120
01:58:22.142991 IP 192.168.43.146.8880 > 192.168.43.147.7772: UDP, length 120
01:58:22.158963 IP 192.168.43.124.8880 > 192.168.43.146.7771: UDP, length 120
01:58:22.192987 IP 192.168.43.146.8880 > 192.168.43.147.7772: UDP, length 120
01:58:22.202307 IP 192.168.43.124.8880 > 192.168.43.146.7771: UDP, length 120
01:58:22.242980 IP 192.168.43.146.8880 > 192.168.43.147.7772: UDP, length 120
01:58:22.252044 IP 192.168.43.124.8880 > 192.168.43.146.7771: UDP, length 120
01:58:22.292969 IP 192.168.43.146.8880 > 192.168.43.147.7772: UDP, length 120
01:58:22.317532 IP 192.168.43.124.8880 > 192.168.43.146.7771: UDP, length 120
01:58:22.342964 IP 192.168.43.146.8880 > 192.168.43.147.7772: UDP, length 120
01:58:22.352097 IP 192.168.43.124.8880 > 192.168.43.146.7771: UDP, length 120
01:58:22.393036 IP 192.168.43.146.8880 > 192.168.43.147.7772: UDP, length 120
01:58:22.408450 IP 192.168.43.124.8880 > 192.168.43.146.7771: UDP, length 120
01:58:22.442981 IP 192.168.43.146.8880 > 192.168.43.147.7772: UDP, length 120
01:58:22.452088 IP 192.168.43.124.8880 > 192.168.43.146.7771: UDP, length 120
01:58:22.492940 IP 192.168.43.146.8880 > 192.168.43.147.7772: UDP, length 120
01:58:22.502458 IP 192.168.43.124.8880 > 192.168.43.146.7771: UDP, length 120
01:58:22.542908 IP 192.168.43.146.8880 > 192.168.43.147.7772: UDP, length 120
01:58:22.557850 IP 192.168.43.124.8880 > 192.168.43.146.7771: UDP, length 120
01:58:22.592898 IP 192.168.43.146.8880 > 192.168.43.147.7772: UDP, length 120
01:58:22.602079 IP 192.168.43.124.8880 > 192.168.43.146.7771: UDP, length 120
01:58:22.642933 IP 192.168.43.146.8880 > 192.168.43.147.7772: UDP, length 120
01:58:22.652367 IP 192.168.43.124.8880 > 192.168.43.146.7771: UDP, length 120
01:58:22.692931 IP 192.168.43.146.8880 > 192.168.43.147.7772: UDP, length 120
01:58:22.716318 IP 192.168.43.124.8880 > 192.168.43.146.7771: UDP, length 120
01:58:22.742928 IP 192.168.43.146.8880 > 192.168.43.147.7772: UDP, length 120
01:58:22.752729 IP 192.168.43.124.8880 > 192.168.43.146.7771: UDP, length 120
01:58:22.792923 IP 192.168.43.146.8880 > 192.168.43.147.7772: UDP, length 120
01:58:22.802729 IP 192.168.43.124.8880 > 192.168.43.146.7771: UDP, length 120
01:58:22.842919 IP 192.168.43.146.8880 > 192.168.43.147.7772: UDP, length 120
01:58:22.866573 IP 192.168.43.124.8880 > 192.168.43.146.7771: UDP, length 120
01:58:22.892923 IP 192.168.43.146.8880 > 192.168.43.147.7772: UDP, length 120
01:58:22.902421 IP 192.168.43.124.8880 > 192.168.43.146.7771: UDP, length 120
01:58:22.942925 IP 192.168.43.146.8880 > 192.168.43.147.7772: UDP, length 120
01:58:22.952184 IP 192.168.43.124.8880 > 192.168.43.146.7771: UDP, length 120
01:58:22.992929 IP 192.168.43.146.8880 > 192.168.43.147.7772: UDP, length 120
01:58:23.017953 IP 192.168.43.124.8880 > 192.168.43.146.7771: UDP, length 120
01:58:23.042928 IP 192.168.43.146.8880 > 192.168.43.147.7772: UDP, length 120
01:58:23.052109 IP 192.168.43.124.8880 > 192.168.43.146.7771: UDP, length 120
01:58:23.092936 IP 192.168.43.146.8880 > 192.168.43.147.7772: UDP, length 120
01:58:23.111177 IP 192.168.43.124.8880 > 192.168.43.146.7771: UDP, length 120
01:58:23.142936 IP 192.168.43.146.8880 > 192.168.43.147.7772: UDP, length 120
01:58:23.152728 IP 192.168.43.124.8880 > 192.168.43.146.7771: UDP, length 120
01:58:23.192925 IP 192.168.43.146.8880 > 192.168.43.147.7772: UDP, length 120
01:58:23.202121 IP 192.168.43.124.8880 > 192.168.43.146.7771: UDP, length 120
01:58:23.243008 IP 192.168.43.146.8880 > 192.168.43.147.7772: UDP, length 120
01:58:23.260623 IP 192.168.43.124.8880 > 192.168.43.146.7771: UDP, length 120
01:58:23.292984 IP 192.168.43.146.8880 > 192.168.43.147.7772: UDP, length 120
01:58:23.302560 IP 192.168.43.124.8880 > 192.168.43.146.7771: UDP, length 120
01:58:23.342941 IP 192.168.43.146.8880 > 192.168.43.147.7772: UDP, length 120
01:58:23.365796 IP 192.168.43.124.8880 > 192.168.43.146.7771: UDP, length 120
01:58:23.392926 IP 192.168.43.146.8880 > 192.168.43.147.7772: UDP, length 120
01:58:23.402119 IP 192.168.43.124.8880 > 192.168.43.146.7771: UDP, length 120
01:58:23.442922 IP 192.168.43.146.8880 > 192.168.43.147.7772: UDP, length 120
01:58:23.466274 IP 192.168.43.124.8880 > 192.168.43.146.7771: UDP, length 120
01:58:23.492920 IP 192.168.43.146.8880 > 192.168.43.147.7772: UDP, length 120
01:58:23.502411 IP 192.168.43.124.8880 > 192.168.43.146.7771: UDP, length 120
01:58:23.542922 IP 192.168.43.146.8880 > 192.168.43.147.7772: UDP, length 120
01:58:23.560646 IP 192.168.43.124.8880 > 192.168.43.146.7771: UDP, length 120
01:58:23.592922 IP 192.168.43.146.8880 > 192.168.43.147.7772: UDP, length 120
01:58:23.603632 IP 192.168.43.124.8880 > 192.168.43.146.7771: UDP, length 120
01:58:23.642924 IP 192.168.43.146.8880 > 192.168.43.147.7772: UDP, length 120
01:58:23.652494 IP 192.168.43.124.8880 > 192.168.43.146.7771: UDP, length 120
01:58:23.692922 IP 192.168.43.146.8880 > 192.168.43.147.7772: UDP, length 120
01:58:23.720044 IP 192.168.43.124.8880 > 192.168.43.146.7771: UDP, length 120
01:58:23.742930 IP 192.168.43.146.8880 > 192.168.43.147.7772: UDP, length 120
01:58:23.752210 IP 192.168.43.124.8880 > 192.168.43.146.7771: UDP, length 120
01:58:23.792930 IP 192.168.43.146.8880 > 192.168.43.147.7772: UDP, length 120
01:58:23.808018 IP 192.168.43.124.8880 > 192.168.43.146.7771: UDP, length 120
01:58:23.842924 IP 192.168.43.146.8880 > 192.168.43.147.7772: UDP, length 120
01:58:23.852296 IP 192.168.43.124.8880 > 192.168.43.146.7771: UDP, length 120
01:58:23.892921 IP 192.168.43.146.8880 > 192.168.43.147.7772: UDP, length 120
01:58:23.902096 IP 192.168.43.124.8880 > 192.168.43.146.7771: UDP, length 120
01:58:23.942925 IP 192.168.43.146.8880 > 192.168.43.147.7772: UDP, length 120
01:58:23.967518 IP 192.168.43.124.8880 > 192.168.43.146.7771: UDP, length 120
01:58:23.992961 IP 192.168.43.146.8880 > 192.168.43.147.7772: UDP, length 120
01:58:24.002930 IP 192.168.43.124.8880 > 192.168.43.146.7771: UDP, length 120
01:58:24.042929 IP 192.168.43.146.8880 > 192.168.43.147.7772: UDP, length 120
01:58:24.058528 IP 192.168.43.124.8880 > 192.168.43.146.7771: UDP, length 120
01:58:24.092933 IP 192.168.43.146.8880 > 192.168.43.147.7772: UDP, length 120
01:58:24.103604 IP 192.168.43.124.8880 > 192.168.43.146.7771: UDP, length 120
01:58:24.142931 IP 192.168.43.146.8880 > 192.168.43.147.7772: UDP, length 120
01:58:24.166277 IP 192.168.43.124.8880 > 192.168.43.146.7771: UDP, length 120
01:58:24.192923 IP 192.168.43.146.8880 > 192.168.43.147.7772: UDP, length 120
01:58:24.202271 IP 192.168.43.124.8880 > 192.168.43.146.7771: UDP, length 120
01:58:24.242917 IP 192.168.43.146.8880 > 192.168.43.147.7772: UDP, length 120
01:58:24.261020 IP 192.168.43.124.8880 > 192.168.43.146.7771: UDP, length 120
01:58:24.292943 IP 192.168.43.146.8880 > 192.168.43.147.7772: UDP, length 120
01:58:24.309584 IP 192.168.43.124.8880 > 192.168.43.146.7771: UDP, length 120
01:58:24.342943 IP 192.168.43.146.8880 > 192.168.43.147.7772: UDP, length 120
01:58:24.367204 IP 192.168.43.124.8880 > 192.168.43.146.7771: UDP, length 120
01:58:24.392930 IP 192.168.43.146.8880 > 192.168.43.147.7772: UDP, length 120
01:58:24.402470 IP 192.168.43.124.8880 > 192.168.43.146.7771: UDP, length 120
01:58:24.442924 IP 192.168.43.146.8880 > 192.168.43.147.7772: UDP, length 120
01:58:24.466066 IP 192.168.43.124.8880 > 192.168.43.146.7771: UDP, length 120
01:58:24.492921 IP 192.168.43.146.8880 > 192.168.43.147.7772: UDP, length 120
01:58:24.502217 IP 192.168.43.124.8880 > 192.168.43.146.7771: UDP, length 120
01:58:24.542921 IP 192.168.43.146.8880 > 192.168.43.147.7772: UDP, length 120
01:58:24.568660 IP 192.168.43.124.8880 > 192.168.43.146.7771: UDP, length 120
01:58:24.592921 IP 192.168.43.146.8880 > 192.168.43.147.7772: UDP, length 120
01:58:24.602182 IP 192.168.43.124.8880 > 192.168.43.146.7771: UDP, length 120
01:58:24.642928 IP 192.168.43.146.8880 > 192.168.43.147.7772: UDP, length 120
01:58:24.665981 IP 192.168.43.124.8880 > 192.168.43.146.7771: UDP, length 120
01:58:24.692921 IP 192.168.43.146.8880 > 192.168.43.147.7772: UDP, length 120
01:58:24.704388 IP 192.168.43.124.8880 > 192.168.43.146.7771: UDP, length 120
01:58:24.742920 IP 192.168.43.146.8880 > 192.168.43.147.7772: UDP, length 120
01:58:24.766708 IP 192.168.43.124.8880 > 192.168.43.146.7771: UDP, length 120
01:58:24.792932 IP 192.168.43.146.8880 > 192.168.43.147.7772: UDP, length 120
01:58:24.802131 IP 192.168.43.124.8880 > 192.168.43.146.7771: UDP, length 120
01:58:24.842930 IP 192.168.43.146.8880 > 192.168.43.147.7772: UDP, length 120
01:58:24.860657 IP 192.168.43.124.8880 > 192.168.43.146.7771: UDP, length 120
01:58:24.892927 IP 192.168.43.146.8880 > 192.168.43.147.7772: UDP, length 120
01:58:24.902161 IP 192.168.43.124.8880 > 192.168.43.146.7771: UDP, length 120
01:58:24.942931 IP 192.168.43.146.8880 > 192.168.43.147.7772: UDP, length 120
01:58:24.966124 IP 192.168.43.124.8880 > 192.168.43.146.7771: UDP, length 120
01:58:24.992921 IP 192.168.43.146.8880 > 192.168.43.147.7772: UDP, length 120
01:58:25.002834 IP 192.168.43.124.8880 > 192.168.43.146.7771: UDP, length 120
01:58:25.042922 IP 192.168.43.146.8880 > 192.168.43.147.7772: UDP, length 120
01:58:25.092929 IP 192.168.43.146.8880 > 192.168.43.147.7772: UDP, length 120
01:58:25.142939 IP 192.168.43.146.8880 > 192.168.43.147.7772: UDP, length 120
01:58:25.192922 IP 192.168.43.146.8880 > 192.168.43.147.7772: UDP, length 120
01:58:25.199332 IP 192.168.43.124.8880 > 192.168.43.146.7771: UDP, length 120
01:58:25.199561 IP 192.168.43.124.8880 > 192.168.43.146.7771: UDP, length 120
01:58:25.242931 IP 192.168.43.146.8880 > 192.168.43.147.7772: UDP, length 120
01:58:25.292986 IP 192.168.43.146.8880 > 192.168.43.147.7772: UDP, length 120
01:58:25.328035 IP 192.168.43.124.8880 > 192.168.43.146.7771: UDP, length 120
01:58:25.328487 IP 192.168.43.124.8880 > 192.168.43.146.7771: UDP, length 120
01:58:25.328716 IP 192.168.43.124.8880 > 192.168.43.146.7771: UDP, length 120
01:58:25.342970 IP 192.168.43.146.8880 > 192.168.43.147.7772: UDP, length 120
01:58:25.392924 IP 192.168.43.146.8880 > 192.168.43.147.7772: UDP, length 120
01:58:25.442921 IP 192.168.43.146.8880 > 192.168.43.147.7772: UDP, length 120
01:58:25.492962 IP 192.168.43.146.8880 > 192.168.43.147.7772: UDP, length 120
01:58:25.509939 IP 192.168.43.124.8880 > 192.168.43.146.7771: UDP, length 120
01:58:25.510342 IP 192.168.43.124.8880 > 192.168.43.146.7771: UDP, length 120
01:58:25.510570 IP 192.168.43.124.8880 > 192.168.43.146.7771: UDP, length 120
01:58:25.542933 IP 192.168.43.146.8880 > 192.168.43.147.7772: UDP, length 120
01:58:25.592918 IP 192.168.43.146.8880 > 192.168.43.147.7772: UDP, length 120
01:58:25.637387 IP 192.168.43.124.8880 > 192.168.43.146.7771: UDP, length 120
01:58:25.637737 IP 192.168.43.124.8880 > 192.168.43.146.7771: UDP, length 120
01:58:25.637962 IP 192.168.43.124.8880 > 192.168.43.146.7771: UDP, length 120
01:58:25.642927 IP 192.168.43.146.8880 > 192.168.43.147.7772: UDP, length 120
01:58:25.692921 IP 192.168.43.146.8880 > 192.168.43.147.7772: UDP, length 120
01:58:25.742921 IP 192.168.43.146.8880 > 192.168.43.147.7772: UDP, length 120
01:58:25.760333 IP 192.168.43.124.8880 > 192.168.43.146.7771: UDP, length 120
01:58:25.760676 IP 192.168.43.124.8880 > 192.168.43.146.7771: UDP, length 120
01:58:25.760900 IP 192.168.43.124.8880 > 192.168.43.146.7771: UDP, length 120
01:58:25.792922 IP 192.168.43.146.8880 > 192.168.43.147.7772: UDP, length 120
01:58:25.842927 IP 192.168.43.146.8880 > 192.168.43.147.7772: UDP, length 120
01:58:25.892921 IP 192.168.43.146.8880 > 192.168.43.147.7772: UDP, length 120
01:58:25.917741 IP 192.168.43.124.8880 > 192.168.43.146.7771: UDP, length 120
01:58:25.917904 IP 192.168.43.124.8880 > 192.168.43.146.7771: UDP, length 120
01:58:25.918032 IP 192.168.43.124.8880 > 192.168.43.146.7771: UDP, length 120
01:58:25.942932 IP 192.168.43.146.8880 > 192.168.43.147.7772: UDP, length 120
01:58:25.992920 IP 192.168.43.146.8880 > 192.168.43.147.7772: UDP, length 120
01:58:26.042921 IP 192.168.43.146.8880 > 192.168.43.147.7772: UDP, length 120
01:58:26.092924 IP 192.168.43.146.8880 > 192.168.43.147.7772: UDP, length 120
01:58:26.116460 IP 192.168.43.124.8880 > 192.168.43.146.7771: UDP, length 120
01:58:26.116597 IP 192.168.43.124.8880 > 192.168.43.146.7771: UDP, length 120
01:58:26.116715 IP 192.168.43.124.8880 > 192.168.43.146.7771: UDP, length 120
01:58:26.142929 IP 192.168.43.146.8880 > 192.168.43.147.7772: UDP, length 120
01:58:26.192920 IP 192.168.43.146.8880 > 192.168.43.147.7772: UDP, length 120
01:58:26.239702 IP 192.168.43.124.8880 > 192.168.43.146.7771: UDP, length 120
01:58:26.240013 IP 192.168.43.124.8880 > 192.168.43.146.7771: UDP, length 120
01:58:26.240241 IP 192.168.43.124.8880 > 192.168.43.146.7771: UDP, length 120
01:58:26.242923 IP 192.168.43.146.8880 > 192.168.43.147.7772: UDP, length 120
01:58:26.292921 IP 192.168.43.146.8880 > 192.168.43.147.7772: UDP, length 120
01:58:26.342986 IP 192.168.43.146.8880 > 192.168.43.147.7772: UDP, length 120
01:58:26.392929 IP 192.168.43.146.8880 > 192.168.43.147.7772: UDP, length 120
01:58:26.418361 IP 192.168.43.124.8880 > 192.168.43.146.7771: UDP, length 120
01:58:26.418516 IP 192.168.43.124.8880 > 192.168.43.146.7771: UDP, length 120
01:58:26.418631 IP 192.168.43.124.8880 > 192.168.43.146.7771: UDP, length 120
01:58:26.442928 IP 192.168.43.146.8880 > 192.168.43.147.7772: UDP, length 120
01:58:26.492921 IP 192.168.43.146.8880 > 192.168.43.147.7772: UDP, length 120
01:58:26.510606 IP 192.168.43.124.8880 > 192.168.43.146.7771: UDP, length 120
01:58:26.510918 IP 192.168.43.124.8880 > 192.168.43.146.7771: UDP, length 120
01:58:26.511146 IP 192.168.43.124.8880 > 192.168.43.146.7771: UDP, length 120
01:58:26.542924 IP 192.168.43.146.8880 > 192.168.43.147.7772: UDP, length 120
01:58:26.592921 IP 192.168.43.146.8880 > 192.168.43.147.7772: UDP, length 120
01:58:26.642922 IP 192.168.43.146.8880 > 192.168.43.147.7772: UDP, length 120
01:58:26.692920 IP 192.168.43.146.8880 > 192.168.43.147.7772: UDP, length 120
01:58:26.694666 IP 192.168.43.124.8880 > 192.168.43.146.7771: UDP, length 120
01:58:26.694984 IP 192.168.43.124.8880 > 192.168.43.146.7771: UDP, length 120
01:58:26.695207 IP 192.168.43.124.8880 > 192.168.43.146.7771: UDP, length 120
01:58:26.742924 IP 192.168.43.146.8880 > 192.168.43.147.7772: UDP, length 120
01:58:26.792919 IP 192.168.43.146.8880 > 192.168.43.147.7772: UDP, length 120
01:58:26.816355 IP 192.168.43.124.8880 > 192.168.43.146.7771: UDP, length 120
01:58:26.816659 IP 192.168.43.124.8880 > 192.168.43.146.7771: UDP, length 120
01:58:26.842921 IP 192.168.43.146.8880 > 192.168.43.147.7772: UDP, length 120
01:58:26.892920 IP 192.168.43.146.8880 > 192.168.43.147.7772: UDP, length 120
01:58:26.936356 IP 192.168.43.124.8880 > 192.168.43.146.7771: UDP, length 120
01:58:26.936501 IP 192.168.43.124.8880 > 192.168.43.146.7771: UDP, length 120
01:58:26.936614 IP 192.168.43.124.8880 > 192.168.43.146.7771: UDP, length 120
01:58:26.942946 IP 192.168.43.146.8880 > 192.168.43.147.7772: UDP, length 120
01:58:26.992969 IP 192.168.43.146.8880 > 192.168.43.147.7772: UDP, length 120
01:58:27.042933 IP 192.168.43.146.8880 > 192.168.43.147.7772: UDP, length 120
01:58:27.066391 IP 192.168.43.124.8880 > 192.168.43.146.7771: UDP, length 120
01:58:27.066539 IP 192.168.43.124.8880 > 192.168.43.146.7771: UDP, length 120
01:58:27.092938 IP 192.168.43.146.8880 > 192.168.43.147.7772: UDP, length 120
01:58:27.142955 IP 192.168.43.146.8880 > 192.168.43.147.7772: UDP, length 120
01:58:27.183773 IP 192.168.43.124.8880 > 192.168.43.146.7771: UDP, length 120
01:58:27.184002 IP 192.168.43.124.8880 > 192.168.43.146.7771: UDP, length 120
01:58:27.184124 IP 192.168.43.124.8880 > 192.168.43.146.7771: UDP, length 120
01:58:27.192932 IP 192.168.43.146.8880 > 192.168.43.147.7772: UDP, length 120
01:58:27.242924 IP 192.168.43.146.8880 > 192.168.43.147.7772: UDP, length 120
01:58:27.292921 IP 192.168.43.146.8880 > 192.168.43.147.7772: UDP, length 120
01:58:27.342980 IP 192.168.43.146.8880 > 192.168.43.147.7772: UDP, length 120
01:58:27.361874 IP 192.168.43.124.8880 > 192.168.43.146.7771: UDP, length 120
01:58:27.362189 IP 192.168.43.124.8880 > 192.168.43.146.7771: UDP, length 120
01:58:27.362301 IP 192.168.43.124.8880 > 192.168.43.146.7771: UDP, length 120
01:58:27.392937 IP 192.168.43.146.8880 > 192.168.43.147.7772: UDP, length 120
01:58:27.442925 IP 192.168.43.146.8880 > 192.168.43.147.7772: UDP, length 120
01:58:27.493002 IP 192.168.43.146.8880 > 192.168.43.147.7772: UDP, length 120
01:58:27.496600 IP 192.168.43.124.8880 > 192.168.43.146.7771: UDP, length 120
01:58:27.496782 IP 192.168.43.124.8880 > 192.168.43.146.7771: UDP, length 120
01:58:27.496917 IP 192.168.43.124.8880 > 192.168.43.146.7771: UDP, length 120
01:58:27.543001 IP 192.168.43.146.8880 > 192.168.43.147.7772: UDP, length 120
01:58:27.593017 IP 192.168.43.146.8880 > 192.168.43.147.7772: UDP, length 120
01:58:27.642956 IP 192.168.43.146.8880 > 192.168.43.147.7772: UDP, length 120
01:58:27.666504 IP 192.168.43.124.8880 > 192.168.43.146.7771: UDP, length 120
01:58:27.666655 IP 192.168.43.124.8880 > 192.168.43.146.7771: UDP, length 120
01:58:27.666735 IP 192.168.43.124.8880 > 192.168.43.146.7771: UDP, length 120
01:58:27.692985 IP 192.168.43.146.8880 > 192.168.43.147.7772: UDP, length 120
01:58:27.742957 IP 192.168.43.146.8880 > 192.168.43.147.7772: UDP, length 120
01:58:27.765132 IP 192.168.43.124.8880 > 192.168.43.146.7771: UDP, length 120
01:58:27.765276 IP 192.168.43.124.8880 > 192.168.43.146.7771: UDP, length 120
01:58:27.765351 IP 192.168.43.124.8880 > 192.168.43.146.7771: UDP, length 120
01:58:27.793023 IP 192.168.43.146.8880 > 192.168.43.147.7772: UDP, length 120
01:58:27.842962 IP 192.168.43.146.8880 > 192.168.43.147.7772: UDP, length 120
01:58:27.892963 IP 192.168.43.146.8880 > 192.168.43.147.7772: UDP, length 120
01:58:27.909427 IP 192.168.43.124.8880 > 192.168.43.146.7771: UDP, length 120
01:58:27.909740 IP 192.168.43.124.8880 > 192.168.43.146.7771: UDP, length 120
01:58:27.909940 IP 192.168.43.124.8880 > 192.168.43.146.7771: UDP, length 120
01:58:27.942949 IP 192.168.43.146.8880 > 192.168.43.147.7772: UDP, length 120
01:58:27.992918 IP 192.168.43.146.8880 > 192.168.43.147.7772: UDP, length 120
01:58:28.042897 IP 192.168.43.146.8880 > 192.168.43.147.7772: UDP, length 120
01:58:28.079220 IP 192.168.43.124.8880 > 192.168.43.146.7771: UDP, length 120
01:58:28.079470 IP 192.168.43.124.8880 > 192.168.43.146.7771: UDP, length 120
01:58:28.079584 IP 192.168.43.124.8880 > 192.168.43.146.7771: UDP, length 120
01:58:28.092908 IP 192.168.43.146.8880 > 192.168.43.147.7772: UDP, length 120
01:58:28.142897 IP 192.168.43.146.8880 > 192.168.43.147.7772: UDP, length 120
01:58:28.192895 IP 192.168.43.146.8880 > 192.168.43.147.7772: UDP, length 120
01:58:28.211624 IP 192.168.43.124.8880 > 192.168.43.146.7771: UDP, length 120
01:58:28.211832 IP 192.168.43.124.8880 > 192.168.43.146.7771: UDP, length 120
01:58:28.242898 IP 192.168.43.146.8880 > 192.168.43.147.7772: UDP, length 120
01:58:28.252113 IP 192.168.43.124.8880 > 192.168.43.146.7771: UDP, length 120
01:58:28.252382 IP 192.168.43.124.8880 > 192.168.43.146.7771: UDP, length 120
01:58:28.292897 IP 192.168.43.146.8880 > 192.168.43.147.7772: UDP, length 120
01:58:28.308668 IP 192.168.43.124.8880 > 192.168.43.146.7771: UDP, length 120
01:58:28.342936 IP 192.168.43.146.8880 > 192.168.43.147.7772: UDP, length 120
01:58:28.354438 IP 192.168.43.124.8880 > 192.168.43.146.7771: UDP, length 120
01:58:28.392907 IP 192.168.43.146.8880 > 192.168.43.147.7772: UDP, length 120
01:58:28.417891 IP 192.168.43.124.8880 > 192.168.43.146.7771: UDP, length 120
01:58:28.442899 IP 192.168.43.146.8880 > 192.168.43.147.7772: UDP, length 120
01:58:28.461514 IP 192.168.43.124.8880 > 192.168.43.146.7771: UDP, length 120
01:58:28.492932 IP 192.168.43.146.8880 > 192.168.43.147.7772: UDP, length 120
01:58:28.502261 IP 192.168.43.124.8880 > 192.168.43.146.7771: UDP, length 120
01:58:28.542906 IP 192.168.43.146.8880 > 192.168.43.147.7772: UDP, length 120
01:58:28.559468 IP 192.168.43.124.8880 > 192.168.43.146.7771: UDP, length 120
01:58:28.592897 IP 192.168.43.146.8880 > 192.168.43.147.7772: UDP, length 120
01:58:28.602398 IP 192.168.43.124.8880 > 192.168.43.146.7771: UDP, length 120
01:58:28.642897 IP 192.168.43.146.8880 > 192.168.43.147.7772: UDP, length 120
