01:51:44.382058 IP 192.168.43.124.8880 > 192.168.43.146.7771: UDP, length 120
01:51:44.433647 IP 192.168.43.124.8880 > 192.168.43.146.7771: UDP, length 120
01:51:44.482193 IP 192.168.43.124.8880 > 192.168.43.146.7771: UDP, length 120
01:51:44.537284 IP 192.168.43.124.8880 > 192.168.43.146.7771: UDP, length 120
01:51:44.583268 IP 192.168.43.124.8880 > 192.168.43.146.7771: UDP, length 120
01:51:44.638836 IP 192.168.43.124.8880 > 192.168.43.146.7771: UDP, length 120
01:51:44.683429 IP 192.168.43.124.8880 > 192.168.43.146.7771: UDP, length 120
01:51:44.739315 IP 192.168.43.124.8880 > 192.168.43.146.7771: UDP, length 120
01:51:44.782213 IP 192.168.43.124.8880 > 192.168.43.146.7771: UDP, length 120
01:51:44.832110 IP 192.168.43.124.8880 > 192.168.43.146.7771: UDP, length 120
01:51:44.881769 IP 192.168.43.124.8880 > 192.168.43.146.7771: UDP, length 120
01:51:44.932222 IP 192.168.43.124.8880 > 192.168.43.146.7771: UDP, length 120
01:51:44.982149 IP 192.168.43.124.8880 > 192.168.43.146.7771: UDP, length 120
01:51:45.032169 IP 192.168.43.124.8880 > 192.168.43.146.7771: UDP, length 120
01:51:45.082507 IP 192.168.43.124.8880 > 192.168.43.146.7771: UDP, length 120
01:51:45.134221 IP 192.168.43.124.8880 > 192.168.43.146.7771: UDP, length 120
01:51:45.180262 IP 192.168.43.124.8880 > 192.168.43.146.7771: UDP, length 120
01:51:45.233733 IP 192.168.43.124.8880 > 192.168.43.146.7771: UDP, length 120
01:51:45.282153 IP 192.168.43.124.8880 > 192.168.43.146.7771: UDP, length 120
01:51:45.331774 IP 192.168.43.124.8880 > 192.168.43.146.7771: UDP, length 120
01:51:45.381918 IP 192.168.43.124.8880 > 192.168.43.146.7771: UDP, length 120
01:51:45.432399 IP 192.168.43.124.8880 > 192.168.43.146.7771: UDP, length 120
01:51:45.482161 IP 192.168.43.124.8880 > 192.168.43.146.7771: UDP, length 120
01:51:45.532146 IP 192.168.43.124.8880 > 192.168.43.146.7771: UDP, length 120
01:51:45.582583 IP 192.168.43.124.8880 > 192.168.43.146.7771: UDP, length 120
01:51:45.632318 IP 192.168.43.124.8880 > 192.168.43.146.7771: UDP, length 120
01:51:45.682221 IP 192.168.43.124.8880 > 192.168.43.146.7771: UDP, length 120
01:51:45.732265 IP 192.168.43.124.8880 > 192.168.43.146.7771: UDP, length 120
01:51:45.800401 IP 192.168.43.124.8880 > 192.168.43.146.7771: UDP, length 120
01:51:45.832048 IP 192.168.43.124.8880 > 192.168.43.146.7771: UDP, length 120
01:51:45.884555 IP 192.168.43.124.8880 > 192.168.43.146.7771: UDP, length 120
01:51:45.932067 IP 192.168.43.124.8880 > 192.168.43.146.7771: UDP, length 120
01:51:45.982484 IP 192.168.43.124.8880 > 192.168.43.146.7771: UDP, length 120
01:51:46.032382 IP 192.168.43.124.8880 > 192.168.43.146.7771: UDP, length 120
01:51:46.082048 IP 192.168.43.124.8880 > 192.168.43.146.7771: UDP, length 120
01:51:46.133292 IP 192.168.43.124.8880 > 192.168.43.146.7771: UDP, length 120
01:51:46.186038 IP 192.168.43.124.8880 > 192.168.43.146.7771: UDP, length 120
01:51:46.233386 IP 192.168.43.124.8880 > 192.168.43.146.7771: UDP, length 120
01:51:46.284225 IP 192.168.43.124.8880 > 192.168.43.146.7771: UDP, length 120
01:51:46.338746 IP 192.168.43.124.8880 > 192.168.43.146.7771: UDP, length 120
01:51:46.389280 IP 192.168.43.124.8880 > 192.168.43.146.7771: UDP, length 120
01:51:46.430376 IP 192.168.43.124.8880 > 192.168.43.146.7771: UDP, length 120
01:51:46.482059 IP 192.168.43.124.8880 > 192.168.43.146.7771: UDP, length 120
01:51:46.532077 IP 192.168.43.124.8880 > 192.168.43.146.7771: UDP, length 120
01:51:46.584347 IP 192.168.43.124.8880 > 192.168.43.146.7771: UDP, length 120
01:51:46.631990 IP 192.168.43.124.8880 > 192.168.43.146.7771: UDP, length 120
01:51:46.701101 IP 192.168.43.124.8880 > 192.168.43.146.7771: UDP, length 120
01:51:46.733677 IP 192.168.43.124.8880 > 192.168.43.146.7771: UDP, length 120
01:51:46.787104 IP 192.168.43.124.8880 > 192.168.43.146.7771: UDP, length 120
01:51:46.833939 IP 192.168.43.124.8880 > 192.168.43.146.7771: UDP, length 120
01:51:46.884918 IP 192.168.43.124.8880 > 192.168.43.146.7771: UDP, length 120
01:51:46.932107 IP 192.168.43.124.8880 > 192.168.43.146.7771: UDP, length 120
01:51:46.995637 IP 192.168.43.124.8880 > 192.168.43.146.7771: UDP, length 120
01:51:47.032371 IP 192.168.43.124.8880 > 192.168.43.146.7771: UDP, length 120
01:51:47.082111 IP 192.168.43.124.8880 > 192.168.43.146.7771: UDP, length 120
01:51:47.130706 IP 192.168.43.124.8880 > 192.168.43.146.7771: UDP, length 120
01:51:47.181771 IP 192.168.43.124.8880 > 192.168.43.146.7771: UDP, length 120
01:51:47.234315 IP 192.168.43.124.8880 > 192.168.43.146.7771: UDP, length 120
01:51:47.282454 IP 192.168.43.124.8880 > 192.168.43.146.7771: UDP, length 120
01:51:47.332134 IP 192.168.43.124.8880 > 192.168.43.146.7771: UDP, length 120
01:51:47.384238 IP 192.168.43.124.8880 > 192.168.43.146.7771: UDP, length 120
01:51:47.432160 IP 192.168.43.124.8880 > 192.168.43.146.7771: UDP, length 120
01:51:47.482488 IP 192.168.43.124.8880 > 192.168.43.146.7771: UDP, length 120
01:51:47.532113 IP 192.168.43.124.8880 > 192.168.43.146.7771: UDP, length 120
01:51:47.583387 IP 192.168.43.124.8880 > 192.168.43.146.7771: UDP, length 120
01:51:47.633989 IP 192.168.43.124.8880 > 192.168.43.146.7771: UDP, length 120
01:51:47.682257 IP 192.168.43.124.8880 > 192.168.43.146.7771: UDP, length 120
01:51:47.737923 IP 192.168.43.124.8880 > 192.168.43.146.7771: UDP, length 120
01:51:47.782261 IP 192.168.43.124.8880 > 192.168.43.146.7771: UDP, length 120
01:51:47.832355 IP 192.168.43.124.8880 > 192.168.43.146.7771: UDP, length 120
01:51:47.880561 IP 192.168.43.124.8880 > 192.168.43.146.7771: UDP, length 120
01:51:47.931971 IP 192.168.43.124.8880 > 192.168.43.146.7771: UDP, length 120
01:51:47.982037 IP 192.168.43.124.8880 > 192.168.43.146.7771: UDP, length 120
01:51:48.029255 IP 192.168.43.124.8880 > 192.168.43.146.7771: UDP, length 120
01:51:48.043271 IP 192.168.43.146.8880 > 192.168.43.147.7772: UDP, length 120
01:51:48.081771 IP 192.168.43.124.8880 > 192.168.43.146.7771: UDP, length 120
01:51:48.093322 IP 192.168.43.146.8880 > 192.168.43.147.7772: UDP, length 120
01:51:48.132413 IP 192.168.43.124.8880 > 192.168.43.146.7771: UDP, length 120
01:51:48.143296 IP 192.168.43.146.8880 > 192.168.43.147.7772: UDP, length 120
01:51:48.182142 IP 192.168.43.124.8880 > 192.168.43.146.7771: UDP, length 120
01:51:48.193293 IP 192.168.43.146.8880 > 192.168.43.147.7772: UDP, length 120
01:51:48.232164 IP 192.168.43.124.8880 > 192.168.43.146.7771: UDP, length 120
01:51:48.243296 IP 192.168.43.146.8880 > 192.168.43.147.7772: UDP, length 120
01:51:48.283652 IP 192.168.43.124.8880 > 192.168.43.146.7771: UDP, length 120
01:51:48.293299 IP 192.168.43.146.8880 > 192.168.43.147.7772: UDP, length 120
01:51:48.332391 IP 192.168.43.124.8880 > 192.168.43.146.7771: UDP, length 120
01:51:48.343293 IP 192.168.43.146.8880 > 192.168.43.147.7772: UDP, length 120
01:51:48.384799 IP 192.168.43.124.8880 > 192.168.43.146.7771: UDP, length 120
01:51:48.393301 IP 192.168.43.146.8880 > 192.168.43.147.7772: UDP, length 120
01:51:48.434998 IP 192.168.43.124.8880 > 192.168.43.146.7771: UDP, length 120
01:51:48.443293 IP 192.168.43.146.8880 > 192.168.43.147.7772: UDP, length 120
01:51:48.485547 IP 192.168.43.124.8880 > 192.168.43.146.7771: UDP, length 120
01:51:48.493291 IP 192.168.43.146.8880 > 192.168.43.147.7772: UDP, length 120
01:51:48.533567 IP 192.168.43.124.8880 > 192.168.43.146.7771: UDP, length 120
01:51:48.543289 IP 192.168.43.146.8880 > 192.168.43.147.7772: UDP, length 120
01:51:48.581776 IP 192.168.43.124.8880 > 192.168.43.146.7771: UDP, length 120
01:51:48.593292 IP 192.168.43.146.8880 > 192.168.43.147.7772: UDP, length 120
01:51:48.632301 IP 192.168.43.124.8880 > 192.168.43.146.7771: UDP, length 120
01:51:48.643293 IP 192.168.43.146.8880 > 192.168.43.147.7772: UDP, length 120
01:51:48.682365 IP 192.168.43.124.8880 > 192.168.43.146.7771: UDP, length 120
01:51:48.693292 IP 192.168.43.146.8880 > 192.168.43.147.7772: UDP, length 120
01:51:48.734672 IP 192.168.43.124.8880 > 192.168.43.146.7771: UDP, length 120
01:51:48.743292 IP 192.168.43.146.8880 > 192.168.43.147.7772: UDP, length 120
01:51:48.780047 IP 192.168.43.124.8880 > 192.168.43.146.7771: UDP, length 120
01:51:48.793292 IP 192.168.43.146.8880 > 192.168.43.147.7772: UDP, length 120
01:51:48.832773 IP 192.168.43.124.8880 > 192.168.43.146.7771: UDP, length 120
01:51:48.843292 IP 192.168.43.146.8880 > 192.168.43.147.7772: UDP, length 120
01:51:48.884261 IP 192.168.43.124.8880 > 192.168.43.146.7771: UDP, length 120
01:51:48.894272 IP 192.168.43.146.8880 > 192.168.43.147.7772: UDP, length 120
01:51:48.940778 IP 192.168.43.124.8880 > 192.168.43.146.7771: UDP, length 120
01:51:48.943365 IP 192.168.43.146.8880 > 192.168.43.147.7772: UDP, length 120
01:51:48.984556 IP 192.168.43.124.8880 > 192.168.43.146.7771: UDP, length 120
01:51:48.993396 IP 192.168.43.146.8880 > 192.168.43.147.7772: UDP, length 120
01:51:49.031913 IP 192.168.43.124.8880 > 192.168.43.146.7771: UDP, length 120
01:51:49.043415 IP 192.168.43.146.8880 > 192.168.43.147.7772: UDP, length 120
01:51:49.081934 IP 192.168.43.124.8880 > 192.168.43.146.7771: UDP, length 120
01:51:49.093362 IP 192.168.43.146.8880 > 192.168.43.147.7772: UDP, length 120
01:51:49.131896 IP 192.168.43.124.8880 > 192.168.43.146.7771: UDP, length 120
01:51:49.143367 IP 192.168.43.146.8880 > 192.168.43.147.7772: UDP, length 120
01:51:49.181959 IP 192.168.43.124.8880 > 192.168.43.146.7771: UDP, length 120
01:51:49.193415 IP 192.168.43.146.8880 > 192.168.43.147.7772: UDP, length 120
01:51:49.231880 IP 192.168.43.124.8880 > 192.168.43.146.7771: UDP, length 120
01:51:49.243416 IP 192.168.43.146.8880 > 192.168.43.147.7772: UDP, length 120
01:51:49.281860 IP 192.168.43.124.8880 > 192.168.43.146.7771: UDP, length 120
01:51:49.293337 IP 192.168.43.146.8880 > 192.168.43.147.7772: UDP, length 120
01:51:49.332560 IP 192.168.43.124.8880 > 192.168.43.146.7771: UDP, length 120
01:51:49.343308 IP 192.168.43.146.8880 > 192.168.43.147.7772: UDP, length 120
01:51:49.385189 IP 192.168.43.124.8880 > 192.168.43.146.7771: UDP, length 120
01:51:49.393308 IP 192.168.43.146.8880 > 192.168.43.147.7772: UDP, length 120
01:51:49.432360 IP 192.168.43.124.8880 > 192.168.43.146.7771: UDP, length 120
01:51:49.443297 IP 192.168.43.146.8880 > 192.168.43.147.7772: UDP, length 120
01:51:49.482604 IP 192.168.43.124.8880 > 192.168.43.146.7771: UDP, length 120
01:51:49.493295 IP 192.168.43.146.8880 > 192.168.43.147.7772: UDP, length 120
01:51:49.543291 IP 192.168.43.146.8880 > 192.168.43.147.7772: UDP, length 120
01:51:49.549503 IP 192.168.43.124.8880 > 192.168.43.146.7771: UDP, length 120
01:51:49.585409 IP 192.168.43.124.8880 > 192.168.43.146.7771: UDP, length 120
01:51:49.593297 IP 192.168.43.146.8880 > 192.168.43.147.7772: UDP, length 120
01:51:49.632313 IP 192.168.43.124.8880 > 192.168.43.146.7771: UDP, length 120
01:51:49.643295 IP 192.168.43.146.8880 > 192.168.43.147.7772: UDP, length 120
01:51:49.684163 IP 192.168.43.124.8880 > 192.168.43.146.7771: UDP, length 120
01:51:49.693295 IP 192.168.43.146.8880 > 192.168.43.147.7772: UDP, length 120
01:51:49.732191 IP 192.168.43.124.8880 > 192.168.43.146.7771: UDP, length 120
01:51:49.743293 IP 192.168.43.146.8880 > 192.168.43.147.7772: UDP, length 120
01:51:49.784495 IP 192.168.43.124.8880 > 192.168.43.146.7771: UDP, length 120
01:51:49.793295 IP 192.168.43.146.8880 > 192.168.43.147.7772: UDP, length 120
01:51:49.832221 IP 192.168.43.124.8880 > 192.168.43.146.7771: UDP, length 120
01:51:49.843293 IP 192.168.43.146.8880 > 192.168.43.147.7772: UDP, length 120
01:51:49.883002 IP 192.168.43.124.8880 > 192.168.43.146.7771: UDP, length 120
01:51:49.893295 IP 192.168.43.146.8880 > 192.168.43.147.7772: UDP, length 120
01:51:49.932623 IP 192.168.43.124.8880 > 192.168.43.146.7771: UDP, length 120
01:51:49.943293 IP 192.168.43.146.8880 > 192.168.43.147.7772: UDP, length 120
01:51:49.982565 IP 192.168.43.124.8880 > 192.168.43.146.7771: UDP, length 120
01:51:49.993294 IP 192.168.43.146.8880 > 192.168.43.147.7772: UDP, length 120
01:51:50.033290 IP 192.168.43.124.8880 > 192.168.43.146.7771: UDP, length 120
01:51:50.043294 IP 192.168.43.146.8880 > 192.168.43.147.7772: UDP, length 120
01:51:50.081812 IP 192.168.43.124.8880 > 192.168.43.146.7771: UDP, length 120
01:51:50.093335 IP 192.168.43.146.8880 > 192.168.43.147.7772: UDP, length 120
01:51:50.131776 IP 192.168.43.124.8880 > 192.168.43.146.7771: UDP, length 120
01:51:50.143299 IP 192.168.43.146.8880 > 192.168.43.147.7772: UDP, length 120
01:51:50.182465 IP 192.168.43.124.8880 > 192.168.43.146.7771: UDP, length 120
01:51:50.193296 IP 192.168.43.146.8880 > 192.168.43.147.7772: UDP, length 120
01:51:50.232066 IP 192.168.43.124.8880 > 192.168.43.146.7771: UDP, length 120
01:51:50.243296 IP 192.168.43.146.8880 > 192.168.43.147.7772: UDP, length 120
01:51:50.282146 IP 192.168.43.124.8880 > 192.168.43.146.7771: UDP, length 120
01:51:50.293293 IP 192.168.43.146.8880 > 192.168.43.147.7772: UDP, length 120
01:51:50.331780 IP 192.168.43.124.8880 > 192.168.43.146.7771: UDP, length 120
01:51:50.343300 IP 192.168.43.146.8880 > 192.168.43.147.7772: UDP, length 120
01:51:50.383294 IP 192.168.43.124.8880 > 192.168.43.146.7771: UDP, length 120
01:51:50.393310 IP 192.168.43.146.8880 > 192.168.43.147.7772: UDP, length 120
01:51:50.434223 IP 192.168.43.124.8880 > 192.168.43.146.7771: UDP, length 120
01:51:50.443329 IP 192.168.43.146.8880 > 192.168.43.147.7772: UDP, length 120
01:51:50.482778 IP 192.168.43.124.8880 > 192.168.43.146.7771: UDP, length 120
01:51:50.493321 IP 192.168.43.146.8880 > 192.168.43.147.7772: UDP, length 120
01:51:50.534524 IP 192.168.43.124.8880 > 192.168.43.146.7771: UDP, length 120
01:51:50.543298 IP 192.168.43.146.8880 > 192.168.43.147.7772: UDP, length 120
01:51:50.583967 IP 192.168.43.124.8880 > 192.168.43.146.7771: UDP, length 120
01:51:50.593295 IP 192.168.43.146.8880 > 192.168.43.147.7772: UDP, length 120
01:51:50.639452 IP 192.168.43.124.8880 > 192.168.43.146.7771: UDP, length 120
01:51:50.643294 IP 192.168.43.146.8880 > 192.168.43.147.7772: UDP, length 120
01:51:50.682213 IP 192.168.43.124.8880 > 192.168.43.146.7771: UDP, length 120
01:51:50.693294 IP 192.168.43.146.8880 > 192.168.43.147.7772: UDP, length 120
01:51:50.732665 IP 192.168.43.124.8880 > 192.168.43.146.7771: UDP, length 120
01:51:50.743294 IP 192.168.43.146.8880 > 192.168.43.147.7772: UDP, length 120
01:51:50.782859 IP 192.168.43.124.8880 > 192.168.43.146.7771: UDP, length 120
01:51:50.793293 IP 192.168.43.146.8880 > 192.168.43.147.7772: UDP, length 120
01:51:50.832172 IP 192.168.43.124.8880 > 192.168.43.146.7771: UDP, length 120
01:51:50.843293 IP 192.168.43.146.8880 > 192.168.43.147.7772: UDP, length 120
01:51:50.885148 IP 192.168.43.124.8880 > 192.168.43.146.7771: UDP, length 120
01:51:50.893295 IP 192.168.43.146.8880 > 192.168.43.147.7772: UDP, length 120
01:51:50.935316 IP 192.168.43.124.8880 > 192.168.43.146.7771: UDP, length 120
01:51:50.943293 IP 192.168.43.146.8880 > 192.168.43.147.7772: UDP, length 120
01:51:50.983244 IP 192.168.43.124.8880 > 192.168.43.146.7771: UDP, length 120
01:51:50.993293 IP 192.168.43.146.8880 > 192.168.43.147.7772: UDP, length 120
01:51:51.034543 IP 192.168.43.124.8880 > 192.168.43.146.7771: UDP, length 120
01:51:51.043293 IP 192.168.43.146.8880 > 192.168.43.147.7772: UDP, length 120
01:51:51.081819 IP 192.168.43.124.8880 > 192.168.43.146.7771: UDP, length 120
01:51:51.093331 IP 192.168.43.146.8880 > 192.168.43.147.7772: UDP, length 120
01:51:51.134879 IP 192.168.43.124.8880 > 192.168.43.146.7771: UDP, length 120
01:51:51.143301 IP 192.168.43.146.8880 > 192.168.43.147.7772: UDP, length 120
01:51:51.182156 IP 192.168.43.124.8880 > 192.168.43.146.7771: UDP, length 120
01:51:51.193297 IP 192.168.43.146.8880 > 192.168.43.147.7772: UDP, length 120
01:51:51.232265 IP 192.168.43.124.8880 > 192.168.43.146.7771: UDP, length 120
01:51:51.243294 IP 192.168.43.146.8880 > 192.168.43.147.7772: UDP, length 120
01:51:51.282720 IP 192.168.43.124.8880 > 192.168.43.146.7771: UDP, length 120
01:51:51.293292 IP 192.168.43.146.8880 > 192.168.43.147.7772: UDP, length 120
01:51:51.333409 IP 192.168.43.124.8880 > 192.168.43.146.7771: UDP, length 120
01:51:51.343294 IP 192.168.43.146.8880 > 192.168.43.147.7772: UDP, length 120
01:51:51.382041 IP 192.168.43.124.8880 > 192.168.43.146.7771: UDP, length 120
01:51:51.393305 IP 192.168.43.146.8880 > 192.168.43.147.7772: UDP, length 120
01:51:51.431937 IP 192.168.43.124.8880 > 192.168.43.146.7771: UDP, length 120
01:51:51.443306 IP 192.168.43.146.8880 > 192.168.43.147.7772: UDP, length 120
01:51:51.482260 IP 192.168.43.124.8880 > 192.168.43.146.7771: UDP, length 120
01:51:51.493297 IP 192.168.43.146.8880 > 192.168.43.147.7772: UDP, length 120
01:51:51.539284 IP 192.168.43.124.8880 > 192.168.43.146.7771: UDP, length 120
01:51:51.543295 IP 192.168.43.146.8880 > 192.168.43.147.7772: UDP, length 120
01:51:51.582893 IP 192.168.43.124.8880 > 192.168.43.146.7771: UDP, length 120
01:51:51.593293 IP 192.168.43.146.8880 > 192.168.43.147.7772: UDP, length 120
01:51:51.634412 IP 192.168.43.124.8880 > 192.168.43.146.7771: UDP, length 120
01:51:51.643293 IP 192.168.43.146.8880 > 192.168.43.147.7772: UDP, length 120
01:51:51.685831 IP 192.168.43.124.8880 > 192.168.43.146.7771: UDP, length 120
01:51:51.693293 IP 192.168.43.146.8880 > 192.168.43.147.7772: UDP, length 120
01:51:51.732101 IP 192.168.43.124.8880 > 192.168.43.146.7771: UDP, length 120
01:51:51.743294 IP 192.168.43.146.8880 > 192.168.43.147.7772: UDP, length 120
01:51:51.782112 IP 192.168.43.124.8880 > 192.168.43.146.7771: UDP, length 120
01:51:51.793293 IP 192.168.43.146.8880 > 192.168.43.147.7772: UDP, length 120
01:51:51.832169 IP 192.168.43.124.8880 > 192.168.43.146.7771: UDP, length 120
01:51:51.843293 IP 192.168.43.146.8880 > 192.168.43.147.7772: UDP, length 120
01:51:51.882119 IP 192.168.43.124.8880 > 192.168.43.146.7771: UDP, length 120
01:51:51.893293 IP 192.168.43.146.8880 > 192.168.43.147.7772: UDP, length 120
01:51:51.932132 IP 192.168.43.124.8880 > 192.168.43.146.7771: UDP, length 120
01:51:51.943294 IP 192.168.43.146.8880 > 192.168.43.147.7772: UDP, length 120
01:51:51.980327 IP 192.168.43.124.8880 > 192.168.43.146.7771: UDP, length 120
01:51:51.993322 IP 192.168.43.146.8880 > 192.168.43.147.7772: UDP, length 120
01:51:52.032322 IP 192.168.43.124.8880 > 192.168.43.146.7771: UDP, length 120
01:51:52.043294 IP 192.168.43.146.8880 > 192.168.43.147.7772: UDP, length 120
01:51:52.082991 IP 192.168.43.124.8880 > 192.168.43.146.7771: UDP, length 120
01:51:52.093348 IP 192.168.43.146.8880 > 192.168.43.147.7772: UDP, length 120
01:51:52.130401 IP 192.168.43.124.8880 > 192.168.43.146.7771: UDP, length 120
01:51:52.143309 IP 192.168.43.146.8880 > 192.168.43.147.7772: UDP, length 120
01:51:52.183424 IP 192.168.43.124.8880 > 192.168.43.146.7771: UDP, length 120
01:51:52.193298 IP 192.168.43.146.8880 > 192.168.43.147.7772: UDP, length 120
01:51:52.232175 IP 192.168.43.124.8880 > 192.168.43.146.7771: UDP, length 120
01:51:52.243293 IP 192.168.43.146.8880 > 192.168.43.147.7772: UDP, length 120
01:51:52.282185 IP 192.168.43.124.8880 > 192.168.43.146.7771: UDP, length 120
01:51:52.293292 IP 192.168.43.146.8880 > 192.168.43.147.7772: UDP, length 120
01:51:52.332164 IP 192.168.43.124.8880 > 192.168.43.146.7771: UDP, length 120
01:51:52.343294 IP 192.168.43.146.8880 > 192.168.43.147.7772: UDP, length 120
01:51:52.382267 IP 192.168.43.124.8880 > 192.168.43.146.7771: UDP, length 120
01:51:52.393301 IP 192.168.43.146.8880 > 192.168.43.147.7772: UDP, length 120
01:51:52.432260 IP 192.168.43.124.8880 > 192.168.43.146.7771: UDP, length 120
01:51:52.443298 IP 192.168.43.146.8880 > 192.168.43.147.7772: UDP, length 120
01:51:52.482688 IP 192.168.43.124.8880 > 192.168.43.146.7771: UDP, length 120
01:51:52.493300 IP 192.168.43.146.8880 > 192.168.43.147.7772: UDP, length 120
01:51:52.532244 IP 192.168.43.124.8880 > 192.168.43.146.7771: UDP, length 120
01:51:52.543296 IP 192.168.43.146.8880 > 192.168.43.147.7772: UDP, length 120
01:51:52.583339 IP 192.168.43.124.8880 > 192.168.43.146.7771: UDP, length 120
01:51:52.593296 IP 192.168.43.146.8880 > 192.168.43.147.7772: UDP, length 120
01:51:52.643318 IP 192.168.43.146.8880 > 192.168.43.147.7772: UDP, length 120
01:51:52.647618 IP 192.168.43.124.8880 > 192.168.43.146.7771: UDP, length 120
01:51:52.684942 IP 192.168.43.124.8880 > 192.168.43.146.7771: UDP, length 120
01:51:52.693323 IP 192.168.43.146.8880 > 192.168.43.147.7772: UDP, length 120
01:51:52.735719 IP 192.168.43.124.8880 > 192.168.43.146.7771: UDP, length 120
01:51:52.743321 IP 192.168.43.146.8880 > 192.168.43.147.7772: UDP, length 120
01:51:52.780676 IP 192.168.43.124.8880 > 192.168.43.146.7771: UDP, length 120
01:51:52.793321 IP 192.168.43.146.8880 > 192.168.43.147.7772: UDP, length 120
01:51:52.832751 IP 192.168.43.124.8880 > 192.168.43.146.7771: UDP, length 120
01:51:52.843322 IP 192.168.43.146.8880 > 192.168.43.147.7772: UDP, length 120
01:51:52.882349 IP 192.168.43.124.8880 > 192.168.43.146.7771: UDP, length 120
01:51:52.893322 IP 192.168.43.146.8880 > 192.168.43.147.7772: UDP, length 120
01:51:52.933364 IP 192.168.43.124.8880 > 192.168.43.146.7771: UDP, length 120
01:51:52.943320 IP 192.168.43.146.8880 > 192.168.43.147.7772: UDP, length 120
01:51:52.983144 IP 192.168.43.124.8880 > 192.168.43.146.7771: UDP, length 120
01:51:52.993319 IP 192.168.43.146.8880 > 192.168.43.147.7772: UDP, length 120
01:51:53.033668 IP 192.168.43.124.8880 > 192.168.43.146.7771: UDP, length 120
01:51:53.043320 IP 192.168.43.146.8880 > 192.168.43.147.7772: UDP, length 120
01:51:53.082786 IP 192.168.43.124.8880 > 192.168.43.146.7771: UDP, length 120
01:51:53.093385 IP 192.168.43.146.8880 > 192.168.43.147.7772: UDP, length 120
01:51:53.138828 IP 192.168.43.124.8880 > 192.168.43.146.7771: UDP, length 120
01:51:53.143371 IP 192.168.43.146.8880 > 192.168.43.147.7772: UDP, length 120
01:51:53.183137 IP 192.168.43.124.8880 > 192.168.43.146.7771: UDP, length 120
01:51:53.193333 IP 192.168.43.146.8880 > 192.168.43.147.7772: UDP, length 120
01:51:53.233631 IP 192.168.43.124.8880 > 192.168.43.146.7771: UDP, length 120
01:51:53.243325 IP 192.168.43.146.8880 > 192.168.43.147.7772: UDP, length 120
01:51:53.282343 IP 192.168.43.124.8880 > 192.168.43.146.7771: UDP, length 120
01:51:53.293319 IP 192.168.43.146.8880 > 192.168.43.147.7772: UDP, length 120
01:51:53.331648 IP 192.168.43.124.8880 > 192.168.43.146.7771: UDP, length 120
01:51:53.343324 IP 192.168.43.146.8880 > 192.168.43.147.7772: UDP, length 120
01:51:53.393329 IP 192.168.43.146.8880 > 192.168.43.147.7772: UDP, length 120
01:51:53.393996 IP 192.168.43.124.8880 > 192.168.43.146.7771: UDP, length 120
01:51:53.432368 IP 192.168.43.124.8880 > 192.168.43.146.7771: UDP, length 120
01:51:53.443325 IP 192.168.43.146.8880 > 192.168.43.147.7772: UDP, length 120
01:51:53.482390 IP 192.168.43.124.8880 > 192.168.43.146.7771: UDP, length 120
01:51:53.493356 IP 192.168.43.146.8880 > 192.168.43.147.7772: UDP, length 120
01:51:53.532539 IP 192.168.43.124.8880 > 192.168.43.146.7771: UDP, length 120
01:51:53.543339 IP 192.168.43.146.8880 > 192.168.43.147.7772: UDP, length 120
01:51:53.581866 IP 192.168.43.124.8880 > 192.168.43.146.7771: UDP, length 120
01:51:53.593325 IP 192.168.43.146.8880 > 192.168.43.147.7772: UDP, length 120
01:51:53.633612 IP 192.168.43.124.8880 > 192.168.43.146.7771: UDP, length 120
01:51:53.643322 IP 192.168.43.146.8880 > 192.168.43.147.7772: UDP, length 120
01:51:53.684090 IP 192.168.43.124.8880 > 192.168.43.146.7771: UDP, length 120
01:51:53.693318 IP 192.168.43.146.8880 > 192.168.43.147.7772: UDP, length 120
01:51:53.733890 IP 192.168.43.124.8880 > 192.168.43.146.7771: UDP, length 120
01:51:53.743321 IP 192.168.43.146.8880 > 192.168.43.147.7772: UDP, length 120
01:51:53.789082 IP 192.168.43.124.8880 > 192.168.43.146.7771: UDP, length 120
01:51:53.793318 IP 192.168.43.146.8880 > 192.168.43.147.7772: UDP, length 120
01:51:53.836974 IP 192.168.43.124.8880 > 192.168.43.146.7771: UDP, length 120
01:51:53.843320 IP 192.168.43.146.8880 > 192.168.43.147.7772: UDP, length 120
01:51:53.882403 IP 192.168.43.124.8880 > 192.168.43.146.7771: UDP, length 120
01:51:53.893317 IP 192.168.43.146.8880 > 192.168.43.147.7772: UDP, length 120
01:51:53.932399 IP 192.168.43.124.8880 > 192.168.43.146.7771: UDP, length 120
01:51:53.943320 IP 192.168.43.146.8880 > 192.168.43.147.7772: UDP, length 120
01:51:53.982343 IP 192.168.43.124.8880 > 192.168.43.146.7771: UDP, length 120
01:51:53.993317 IP 192.168.43.146.8880 > 192.168.43.147.7772: UDP, length 120
01:51:54.032334 IP 192.168.43.124.8880 > 192.168.43.146.7771: UDP, length 120
01:51:54.043319 IP 192.168.43.146.8880 > 192.168.43.147.7772: UDP, length 120
01:51:54.082349 IP 192.168.43.124.8880 > 192.168.43.146.7771: UDP, length 120
01:51:54.093318 IP 192.168.43.146.8880 > 192.168.43.147.7772: UDP, length 120
01:51:54.131856 IP 192.168.43.124.8880 > 192.168.43.146.7771: UDP, length 120
01:51:54.143369 IP 192.168.43.146.8880 > 192.168.43.147.7772: UDP, length 120
01:51:54.185404 IP 192.168.43.124.8880 > 192.168.43.146.7771: UDP, length 120
01:51:54.193351 IP 192.168.43.146.8880 > 192.168.43.147.7772: UDP, length 120
01:51:54.233500 IP 192.168.43.124.8880 > 192.168.43.146.7771: UDP, length 120
01:51:54.243323 IP 192.168.43.146.8880 > 192.168.43.147.7772: UDP, length 120
01:51:54.282428 IP 192.168.43.124.8880 > 192.168.43.146.7771: UDP, length 120
01:51:54.293372 IP 192.168.43.146.8880 > 192.168.43.147.7772: UDP, length 120
01:51:54.334239 IP 192.168.43.124.8880 > 192.168.43.146.7771: UDP, length 120
01:51:54.343416 IP 192.168.43.146.8880 > 192.168.43.147.7772: UDP, length 120
01:51:54.384155 IP 192.168.43.124.8880 > 192.168.43.146.7771: UDP, length 120
01:51:54.393437 IP 192.168.43.146.8880 > 192.168.43.147.7772: UDP, length 120
01:51:54.431814 IP 192.168.43.124.8880 > 192.168.43.146.7771: UDP, length 120
01:51:54.443397 IP 192.168.43.146.8880 > 192.168.43.147.7772: UDP, length 120
01:51:54.481928 IP 192.168.43.124.8880 > 192.168.43.146.7771: UDP, length 120
01:51:54.493418 IP 192.168.43.146.8880 > 192.168.43.147.7772: UDP, length 120
01:51:54.534097 IP 192.168.43.124.8880 > 192.168.43.146.7771: UDP, length 120
01:51:54.543357 IP 192.168.43.146.8880 > 192.168.43.147.7772: UDP, length 120
01:51:54.581906 IP 192.168.43.124.8880 > 192.168.43.146.7771: UDP, length 120
01:51:54.593367 IP 192.168.43.146.8880 > 192.168.43.147.7772: UDP, length 120
01:51:54.632855 IP 192.168.43.124.8880 > 192.168.43.146.7771: UDP, length 120
01:51:54.643369 IP 192.168.43.146.8880 > 192.168.43.147.7772: UDP, length 120
01:51:54.691006 IP 192.168.43.124.8880 > 192.168.43.146.7771: UDP, length 120
01:51:54.693361 IP 192.168.43.146.8880 > 192.168.43.147.7772: UDP, length 120
01:51:54.733055 IP 192.168.43.124.8880 > 192.168.43.146.7771: UDP, length 120
01:51:54.743353 IP 192.168.43.146.8880 > 192.168.43.147.7772: UDP, length 120
01:51:54.786030 IP 192.168.43.124.8880 > 192.168.43.146.7771: UDP, length 120
01:51:54.793311 IP 192.168.43.146.8880 > 192.168.43.147.7772: UDP, length 120
01:51:54.833321 IP 192.168.43.124.8880 > 192.168.43.146.7771: UDP, length 120
01:51:54.843294 IP 192.168.43.146.8880 > 192.168.43.147.7772: UDP, length 120
01:51:54.885885 IP 192.168.43.124.8880 > 192.168.43.146.7771: UDP, length 120
01:51:54.893292 IP 192.168.43.146.8880 > 192.168.43.147.7772: UDP, length 120
01:51:54.932733 IP 192.168.43.124.8880 > 192.168.43.146.7771: UDP, length 120
01:51:54.943293 IP 192.168.43.146.8880 > 192.168.43.147.7772: UDP, length 120
01:51:54.982262 IP 192.168.43.124.8880 > 192.168.43.146.7771: UDP, length 120
01:51:54.993323 IP 192.168.43.146.8880 > 192.168.43.147.7772: UDP, length 120
01:51:55.032154 IP 192.168.43.124.8880 > 192.168.43.146.7771: UDP, length 120
01:51:55.043293 IP 192.168.43.146.8880 > 192.168.43.147.7772: UDP, length 120
01:51:55.083796 IP 192.168.43.124.8880 > 192.168.43.146.7771: UDP, length 120
01:51:55.093291 IP 192.168.43.146.8880 > 192.168.43.147.7772: UDP, length 120
01:51:55.132174 IP 192.168.43.124.8880 > 192.168.43.146.7771: UDP, length 120
01:51:55.143291 IP 192.168.43.146.8880 > 192.168.43.147.7772: UDP, length 120
01:51:55.185973 IP 192.168.43.124.8880 > 192.168.43.146.7771: UDP, length 120
01:51:55.193294 IP 192.168.43.146.8880 > 192.168.43.147.7772: UDP, length 120
01:51:55.233026 IP 192.168.43.124.8880 > 192.168.43.146.7771: UDP, length 120
01:51:55.243291 IP 192.168.43.146.8880 > 192.168.43.147.7772: UDP, length 120
01:51:55.287043 IP 192.168.43.124.8880 > 192.168.43.146.7771: UDP, length 120
01:51:55.293292 IP 192.168.43.146.8880 > 192.168.43.147.7772: UDP, length 120
01:51:55.333318 IP 192.168.43.124.8880 > 192.168.43.146.7771: UDP, length 120
01:51:55.343293 IP 192.168.43.146.8880 > 192.168.43.147.7772: UDP, length 120
01:51:55.382641 IP 192.168.43.124.8880 > 192.168.43.146.7771: UDP, length 120
01:51:55.393299 IP 192.168.43.146.8880 > 192.168.43.147.7772: UDP, length 120
01:51:55.432186 IP 192.168.43.124.8880 > 192.168.43.146.7771: UDP, length 120
01:51:55.443292 IP 192.168.43.146.8880 > 192.168.43.147.7772: UDP, length 120
01:51:55.481682 IP 192.168.43.124.8880 > 192.168.43.146.7771: UDP, length 120
01:51:55.493294 IP 192.168.43.146.8880 > 192.168.43.147.7772: UDP, length 120
01:51:55.532550 IP 192.168.43.124.8880 > 192.168.43.146.7771: UDP, length 120
01:51:55.543291 IP 192.168.43.146.8880 > 192.168.43.147.7772: UDP, length 120
01:51:55.581799 IP 192.168.43.124.8880 > 192.168.43.146.7771: UDP, length 120
01:51:55.593298 IP 192.168.43.146.8880 > 192.168.43.147.7772: UDP, length 120
01:51:55.632199 IP 192.168.43.124.8880 > 192.168.43.146.7771: UDP, length 120
01:51:55.643296 IP 192.168.43.146.8880 > 192.168.43.147.7772: UDP, length 120
01:51:55.681922 IP 192.168.43.124.8880 > 192.168.43.146.7771: UDP, length 120
01:51:55.693302 IP 192.168.43.146.8880 > 192.168.43.147.7772: UDP, length 120
01:51:55.735607 IP 192.168.43.124.8880 > 192.168.43.146.7771: UDP, length 120
01:51:55.743295 IP 192.168.43.146.8880 > 192.168.43.147.7772: UDP, length 120
01:51:55.793295 IP 192.168.43.146.8880 > 192.168.43.147.7772: UDP, length 120
01:51:55.805848 IP 192.168.43.124.8880 > 192.168.43.146.7771: UDP, length 120
01:51:55.832221 IP 192.168.43.124.8880 > 192.168.43.146.7771: UDP, length 120
01:51:55.843294 IP 192.168.43.146.8880 > 192.168.43.147.7772: UDP, length 120
01:51:55.884608 IP 192.168.43.124.8880 > 192.168.43.146.7771: UDP, length 120
01:51:55.893294 IP 192.168.43.146.8880 > 192.168.43.147.7772: UDP, length 120
01:51:55.943293 IP 192.168.43.146.8880 > 192.168.43.147.7772: UDP, length 120
01:51:55.946934 IP 192.168.43.124.8880 > 192.168.43.146.7771: UDP, length 120
01:51:55.987105 IP 192.168.43.124.8880 > 192.168.43.146.7771: UDP, length 120
01:51:55.993293 IP 192.168.43.146.8880 > 192.168.43.147.7772: UDP, length 120
01:51:56.032689 IP 192.168.43.124.8880 > 192.168.43.146.7771: UDP, length 120
01:51:56.043293 IP 192.168.43.146.8880 > 192.168.43.147.7772: UDP, length 120
01:51:56.082374 IP 192.168.43.124.8880 > 192.168.43.146.7771: UDP, length 120
01:51:56.093296 IP 192.168.43.146.8880 > 192.168.43.147.7772: UDP, length 120
01:51:56.131849 IP 192.168.43.124.8880 > 192.168.43.146.7771: UDP, length 120
01:51:56.143383 IP 192.168.43.146.8880 > 192.168.43.147.7772: UDP, length 120
01:51:56.181865 IP 192.168.43.124.8880 > 192.168.43.146.7771: UDP, length 120
01:51:56.193363 IP 192.168.43.146.8880 > 192.168.43.147.7772: UDP, length 120
01:51:56.232799 IP 192.168.43.124.8880 > 192.168.43.146.7771: UDP, length 120
01:51:56.243334 IP 192.168.43.146.8880 > 192.168.43.147.7772: UDP, length 120
01:51:56.282240 IP 192.168.43.124.8880 > 192.168.43.146.7771: UDP, length 120
01:51:56.293300 IP 192.168.43.146.8880 > 192.168.43.147.7772: UDP, length 120
01:51:56.331778 IP 192.168.43.124.8880 > 192.168.43.146.7771: UDP, length 120
01:51:56.343299 IP 192.168.43.146.8880 > 192.168.43.147.7772: UDP, length 120
01:51:56.383953 IP 192.168.43.124.8880 > 192.168.43.146.7771: UDP, length 120
01:51:56.393299 IP 192.168.43.146.8880 > 192.168.43.147.7772: UDP, length 120
01:51:56.432410 IP 192.168.43.124.8880 > 192.168.43.146.7771: UDP, length 120
01:51:56.443297 IP 192.168.43.146.8880 > 192.168.43.147.7772: UDP, length 120
01:51:56.484097 IP 192.168.43.124.8880 > 192.168.43.146.7771: UDP, length 120
01:51:56.493326 IP 192.168.43.146.8880 > 192.168.43.147.7772: UDP, length 120
01:51:56.532442 IP 192.168.43.124.8880 > 192.168.43.146.7771: UDP, length 120
01:51:56.543298 IP 192.168.43.146.8880 > 192.168.43.147.7772: UDP, length 120
01:51:56.582793 IP 192.168.43.124.8880 > 192.168.43.146.7771: UDP, length 120
01:51:56.593295 IP 192.168.43.146.8880 > 192.168.43.147.7772: UDP, length 120
01:51:56.632586 IP 192.168.43.124.8880 > 192.168.43.146.7771: UDP, length 120
01:51:56.643293 IP 192.168.43.146.8880 > 192.168.43.147.7772: UDP, length 120
01:51:56.682785 IP 192.168.43.124.8880 > 192.168.43.146.7771: UDP, length 120
01:51:56.693311 IP 192.168.43.146.8880 > 192.168.43.147.7772: UDP, length 120
01:51:56.743295 IP 192.168.43.146.8880 > 192.168.43.147.7772: UDP, length 120
01:51:56.746550 IP 192.168.43.124.8880 > 192.168.43.146.7771: UDP, length 120
01:51:56.783120 IP 192.168.43.124.8880 > 192.168.43.146.7771: UDP, length 120
01:51:56.793293 IP 192.168.43.146.8880 > 192.168.43.147.7772: UDP, length 120
01:51:56.833641 IP 192.168.43.124.8880 > 192.168.43.146.7771: UDP, length 120
01:51:56.843293 IP 192.168.43.146.8880 > 192.168.43.147.7772: UDP, length 120
01:51:56.883291 IP 192.168.43.124.8880 > 192.168.43.146.7771: UDP, length 120
01:51:56.893293 IP 192.168.43.146.8880 > 192.168.43.147.7772: UDP, length 120
01:51:56.935948 IP 192.168.43.124.8880 > 192.168.43.146.7771: UDP, length 120
01:51:56.943291 IP 192.168.43.146.8880 > 192.168.43.147.7772: UDP, length 120
01:51:56.982360 IP 192.168.43.124.8880 > 192.168.43.146.7771: UDP, length 120
01:51:56.993293 IP 192.168.43.146.8880 > 192.168.43.147.7772: UDP, length 120
01:51:57.032355 IP 192.168.43.124.8880 > 192.168.43.146.7771: UDP, length 120
01:51:57.043292 IP 192.168.43.146.8880 > 192.168.43.147.7772: UDP, length 120
01:51:57.082370 IP 192.168.43.124.8880 > 192.168.43.146.7771: UDP, length 120
01:51:57.093292 IP 192.168.43.146.8880 > 192.168.43.147.7772: UDP, length 120
01:51:57.133138 IP 192.168.43.124.8880 > 192.168.43.146.7771: UDP, length 120
01:51:57.143293 IP 192.168.43.146.8880 > 192.168.43.147.7772: UDP, length 120
01:51:57.180530 IP 192.168.43.124.8880 > 192.168.43.146.7771: UDP, length 120
01:51:57.193297 IP 192.168.43.146.8880 > 192.168.43.147.7772: UDP, length 120
01:51:57.234179 IP 192.168.43.124.8880 > 192.168.43.146.7771: UDP, length 120
01:51:57.243351 IP 192.168.43.146.8880 > 192.168.43.147.7772: UDP, length 120
01:51:57.281776 IP 192.168.43.124.8880 > 192.168.43.146.7771: UDP, length 120
01:51:57.293308 IP 192.168.43.146.8880 > 192.168.43.147.7772: UDP, length 120
01:51:57.338136 IP 192.168.43.124.8880 > 192.168.43.146.7771: UDP, length 120
01:51:57.343300 IP 192.168.43.146.8880 > 192.168.43.147.7772: UDP, length 120
01:51:57.383643 IP 192.168.43.124.8880 > 192.168.43.146.7771: UDP, length 120
01:51:57.393297 IP 192.168.43.146.8880 > 192.168.43.147.7772: UDP, length 120
01:51:57.439038 IP 192.168.43.124.8880 > 192.168.43.146.7771: UDP, length 120
01:51:57.443295 IP 192.168.43.146.8880 > 192.168.43.147.7772: UDP, length 120
01:51:57.483780 IP 192.168.43.124.8880 > 192.168.43.146.7771: UDP, length 120
01:51:57.493292 IP 192.168.43.146.8880 > 192.168.43.147.7772: UDP, length 120
01:51:57.532342 IP 192.168.43.124.8880 > 192.168.43.146.7771: UDP, length 120
01:51:57.543292 IP 192.168.43.146.8880 > 192.168.43.147.7772: UDP, length 120
01:51:57.582788 IP 192.168.43.124.8880 > 192.168.43.146.7771: UDP, length 120
01:51:57.593293 IP 192.168.43.146.8880 > 192.168.43.147.7772: UDP, length 120
01:51:57.632603 IP 192.168.43.124.8880 > 192.168.43.146.7771: UDP, length 120
01:51:57.643318 IP 192.168.43.146.8880 > 192.168.43.147.7772: UDP, length 120
01:51:57.682474 IP 192.168.43.124.8880 > 192.168.43.146.7771: UDP, length 120
01:51:57.693321 IP 192.168.43.146.8880 > 192.168.43.147.7772: UDP, length 120
01:51:57.732464 IP 192.168.43.124.8880 > 192.168.43.146.7771: UDP, length 120
01:51:57.743330 IP 192.168.43.146.8880 > 192.168.43.147.7772: UDP, length 120
01:51:57.783435 IP 192.168.43.124.8880 > 192.168.43.146.7771: UDP, length 120
01:51:57.793320 IP 192.168.43.146.8880 > 192.168.43.147.7772: UDP, length 120
01:51:57.832446 IP 192.168.43.124.8880 > 192.168.43.146.7771: UDP, length 120
01:51:57.843318 IP 192.168.43.146.8880 > 192.168.43.147.7772: UDP, length 120
01:51:57.882423 IP 192.168.43.124.8880 > 192.168.43.146.7771: UDP, length 120
01:51:57.893315 IP 192.168.43.146.8880 > 192.168.43.147.7772: UDP, length 120
01:51:57.932202 IP 192.168.43.124.8880 > 192.168.43.146.7771: UDP, length 120
01:51:57.943317 IP 192.168.43.146.8880 > 192.168.43.147.7772: UDP, length 120
01:51:57.981876 IP 192.168.43.124.8880 > 192.168.43.146.7771: UDP, length 120
01:51:57.993363 IP 192.168.43.146.8880 > 192.168.43.147.7772: UDP, length 120
01:51:58.034190 IP 192.168.43.124.8880 > 192.168.43.146.7771: UDP, length 120
01:51:58.043322 IP 192.168.43.146.8880 > 192.168.43.147.7772: UDP, length 120
01:51:58.084705 IP 192.168.43.124.8880 > 192.168.43.146.7771: UDP, length 120
01:51:58.093318 IP 192.168.43.146.8880 > 192.168.43.147.7772: UDP, length 120
01:51:58.138476 IP 192.168.43.124.8880 > 192.168.43.146.7771: UDP, length 120
01:51:58.143318 IP 192.168.43.146.8880 > 192.168.43.147.7772: UDP, length 120
01:51:58.182546 IP 192.168.43.124.8880 > 192.168.43.146.7771: UDP, length 120
01:51:58.193316 IP 192.168.43.146.8880 > 192.168.43.147.7772: UDP, length 120
01:51:58.232902 IP 192.168.43.124.8880 > 192.168.43.146.7771: UDP, length 120
01:51:58.243406 IP 192.168.43.146.8880 > 192.168.43.147.7772: UDP, length 120
01:51:58.281869 IP 192.168.43.124.8880 > 192.168.43.146.7771: UDP, length 120
01:51:58.293365 IP 192.168.43.146.8880 > 192.168.43.147.7772: UDP, length 120
01:51:58.332600 IP 192.168.43.124.8880 > 192.168.43.146.7771: UDP, length 120
01:51:58.343324 IP 192.168.43.146.8880 > 192.168.43.147.7772: UDP, length 120
01:51:58.382574 IP 192.168.43.124.8880 > 192.168.43.146.7771: UDP, length 120
01:51:58.393347 IP 192.168.43.146.8880 > 192.168.43.147.7772: UDP, length 120
01:51:58.432716 IP 192.168.43.124.8880 > 192.168.43.146.7771: UDP, length 120
01:51:58.443332 IP 192.168.43.146.8880 > 192.168.43.147.7772: UDP, length 120
01:51:58.482598 IP 192.168.43.124.8880 > 192.168.43.146.7771: UDP, length 120
01:51:58.493316 IP 192.168.43.146.8880 > 192.168.43.147.7772: UDP, length 120
01:51:58.532594 IP 192.168.43.124.8880 > 192.168.43.146.7771: UDP, length 120
01:51:58.543317 IP 192.168.43.146.8880 > 192.168.43.147.7772: UDP, length 120
01:51:58.582980 IP 192.168.43.124.8880 > 192.168.43.146.7771: UDP, length 120
01:51:58.593315 IP 192.168.43.146.8880 > 192.168.43.147.7772: UDP, length 120
01:51:58.632557 IP 192.168.43.124.8880 > 192.168.43.146.7771: UDP, length 120
01:51:58.643319 IP 192.168.43.146.8880 > 192.168.43.147.7772: UDP, length 120
01:51:58.682795 IP 192.168.43.124.8880 > 192.168.43.146.7771: UDP, length 120
01:51:58.693318 IP 192.168.43.146.8880 > 192.168.43.147.7772: UDP, length 120
01:51:58.732546 IP 192.168.43.124.8880 > 192.168.43.146.7771: UDP, length 120
01:51:58.743321 IP 192.168.43.146.8880 > 192.168.43.147.7772: UDP, length 120
01:51:58.782567 IP 192.168.43.124.8880 > 192.168.43.146.7771: UDP, length 120
01:51:58.793324 IP 192.168.43.146.8880 > 192.168.43.147.7772: UDP, length 120
01:51:58.833078 IP 192.168.43.124.8880 > 192.168.43.146.7771: UDP, length 120
01:51:58.843328 IP 192.168.43.146.8880 > 192.168.43.147.7772: UDP, length 120
01:51:58.881843 IP 192.168.43.124.8880 > 192.168.43.146.7771: UDP, length 120
01:51:58.893330 IP 192.168.43.146.8880 > 192.168.43.147.7772: UDP, length 120
01:51:58.933670 IP 192.168.43.124.8880 > 192.168.43.146.7771: UDP, length 120
01:51:58.943322 IP 192.168.43.146.8880 > 192.168.43.147.7772: UDP, length 120
01:51:58.989832 IP 192.168.43.124.8880 > 192.168.43.146.7771: UDP, length 120
