02:11:51.996462 IP 192.168.43.146.8880 > 192.168.43.147.7772: UDP, length 120
02:11:52.033400 IP 192.168.43.146.8880 > 192.168.43.147.7772: UDP, length 120
02:11:52.085220 IP 192.168.43.146.8880 > 192.168.43.147.7772: UDP, length 120
02:11:52.144993 IP 192.168.43.146.8880 > 192.168.43.147.7772: UDP, length 120
02:11:52.184983 IP 192.168.43.146.8880 > 192.168.43.147.7772: UDP, length 120
02:11:52.256987 IP 192.168.43.146.8880 > 192.168.43.147.7772: UDP, length 120
02:11:52.294065 IP 192.168.43.146.8880 > 192.168.43.147.7772: UDP, length 120
02:11:52.334697 IP 192.168.43.146.8880 > 192.168.43.147.7772: UDP, length 120
02:11:52.380667 IP 192.168.43.146.8880 > 192.168.43.147.7772: UDP, length 120
02:11:52.444430 IP 192.168.43.146.8880 > 192.168.43.147.7772: UDP, length 120
02:11:52.512863 IP 192.168.43.146.8880 > 192.168.43.147.7772: UDP, length 120
02:11:52.533897 IP 192.168.43.146.8880 > 192.168.43.147.7772: UDP, length 120
02:11:52.597427 IP 192.168.43.146.8880 > 192.168.43.147.7772: UDP, length 120
02:11:52.638184 IP 192.168.43.146.8880 > 192.168.43.147.7772: UDP, length 120
02:11:52.701700 IP 192.168.43.146.8880 > 192.168.43.147.7772: UDP, length 120
02:11:52.754527 IP 192.168.43.146.8880 > 192.168.43.147.7772: UDP, length 120
02:11:52.793514 IP 192.168.43.146.8880 > 192.168.43.147.7772: UDP, length 120
02:11:52.853355 IP 192.168.43.146.8880 > 192.168.43.147.7772: UDP, length 120
02:11:52.883890 IP 192.168.43.146.8880 > 192.168.43.147.7772: UDP, length 120
02:11:52.945108 IP 192.168.43.146.8880 > 192.168.43.147.7772: UDP, length 120
02:11:53.022544 IP 192.168.43.146.8880 > 192.168.43.147.7772: UDP, length 120
02:11:53.126290 IP 192.168.43.146.8880 > 192.168.43.147.7772: UDP, length 120
02:11:53.126526 IP 192.168.43.146.8880 > 192.168.43.147.7772: UDP, length 120
02:11:53.130728 IP 192.168.43.146.8880 > 192.168.43.147.7772: UDP, length 120
02:11:53.202128 IP 192.168.43.146.8880 > 192.168.43.147.7772: UDP, length 120
02:11:53.231473 IP 192.168.43.146.8880 > 192.168.43.147.7772: UDP, length 120
02:11:53.331030 IP 192.168.43.146.8880 > 192.168.43.147.7772: UDP, length 120
02:11:53.332948 IP 192.168.43.146.8880 > 192.168.43.147.7772: UDP, length 120
02:11:53.412271 IP 192.168.43.146.8880 > 192.168.43.147.7772: UDP, length 120
02:11:53.433425 IP 192.168.43.146.8880 > 192.168.43.147.7772: UDP, length 120
02:11:53.507617 IP 192.168.43.146.8880 > 192.168.43.147.7772: UDP, length 120
02:11:53.534990 IP 192.168.43.146.8880 > 192.168.43.147.7772: UDP, length 120
02:11:53.583041 IP 192.168.43.146.8880 > 192.168.43.147.7772: UDP, length 120
02:11:53.594474 IP 192.168.43.147.8880 > 192.168.43.124.7773: UDP, length 120
02:11:53.644526 IP 192.168.43.147.8880 > 192.168.43.124.7773: UDP, length 120
02:11:53.645806 IP 192.168.43.146.8880 > 192.168.43.147.7772: UDP, length 120
02:11:53.684471 IP 192.168.43.146.8880 > 192.168.43.147.7772: UDP, length 120
02:11:53.694506 IP 192.168.43.147.8880 > 192.168.43.124.7773: UDP, length 120
02:11:53.733084 IP 192.168.43.146.8880 > 192.168.43.147.7772: UDP, length 120
02:11:53.744501 IP 192.168.43.147.8880 > 192.168.43.124.7773: UDP, length 120
02:11:53.794499 IP 192.168.43.147.8880 > 192.168.43.124.7773: UDP, length 120
02:11:53.796872 IP 192.168.43.146.8880 > 192.168.43.147.7772: UDP, length 120
02:11:53.837521 IP 192.168.43.146.8880 > 192.168.43.147.7772: UDP, length 120
02:11:53.844500 IP 192.168.43.147.8880 > 192.168.43.124.7773: UDP, length 120
02:11:53.881187 IP 192.168.43.146.8880 > 192.168.43.147.7772: UDP, length 120
02:11:53.894499 IP 192.168.43.147.8880 > 192.168.43.124.7773: UDP, length 120
02:11:53.944501 IP 192.168.43.147.8880 > 192.168.43.124.7773: UDP, length 120
02:11:53.945069 IP 192.168.43.146.8880 > 192.168.43.147.7772: UDP, length 120
02:11:53.994492 IP 192.168.43.146.8880 > 192.168.43.147.7772: UDP, length 120
02:11:53.994500 IP 192.168.43.147.8880 > 192.168.43.124.7773: UDP, length 120
02:11:54.039486 IP 192.168.43.146.8880 > 192.168.43.147.7772: UDP, length 120
02:11:54.044501 IP 192.168.43.147.8880 > 192.168.43.124.7773: UDP, length 120
02:11:54.084262 IP 192.168.43.146.8880 > 192.168.43.147.7772: UDP, length 120
02:11:54.094500 IP 192.168.43.147.8880 > 192.168.43.124.7773: UDP, length 120
02:11:54.134003 IP 192.168.43.146.8880 > 192.168.43.147.7772: UDP, length 120
02:11:54.144501 IP 192.168.43.147.8880 > 192.168.43.124.7773: UDP, length 120
02:11:54.194500 IP 192.168.43.147.8880 > 192.168.43.124.7773: UDP, length 120
02:11:54.195328 IP 192.168.43.146.8880 > 192.168.43.147.7772: UDP, length 120
02:11:54.236235 IP 192.168.43.146.8880 > 192.168.43.147.7772: UDP, length 120
02:11:54.244502 IP 192.168.43.147.8880 > 192.168.43.124.7773: UDP, length 120
02:11:54.280425 IP 192.168.43.146.8880 > 192.168.43.147.7772: UDP, length 120
02:11:54.294527 IP 192.168.43.147.8880 > 192.168.43.124.7773: UDP, length 120
02:11:54.343485 IP 192.168.43.146.8880 > 192.168.43.147.7772: UDP, length 120
02:11:54.344505 IP 192.168.43.147.8880 > 192.168.43.124.7773: UDP, length 120
02:11:54.383703 IP 192.168.43.146.8880 > 192.168.43.147.7772: UDP, length 120
02:11:54.394501 IP 192.168.43.147.8880 > 192.168.43.124.7773: UDP, length 120
02:11:54.433516 IP 192.168.43.146.8880 > 192.168.43.147.7772: UDP, length 120
02:11:54.444500 IP 192.168.43.147.8880 > 192.168.43.124.7773: UDP, length 120
02:11:54.492886 IP 192.168.43.146.8880 > 192.168.43.147.7772: UDP, length 120
02:11:54.494500 IP 192.168.43.147.8880 > 192.168.43.124.7773: UDP, length 120
02:11:54.533200 IP 192.168.43.146.8880 > 192.168.43.147.7772: UDP, length 120
02:11:54.544501 IP 192.168.43.147.8880 > 192.168.43.124.7773: UDP, length 120
02:11:54.583815 IP 192.168.43.146.8880 > 192.168.43.147.7772: UDP, length 120
02:11:54.594500 IP 192.168.43.147.8880 > 192.168.43.124.7773: UDP, length 120
02:11:54.644525 IP 192.168.43.147.8880 > 192.168.43.124.7773: UDP, length 120
02:11:54.645417 IP 192.168.43.146.8880 > 192.168.43.147.7772: UDP, length 120
02:11:54.684601 IP 192.168.43.146.8880 > 192.168.43.147.7772: UDP, length 120
02:11:54.694511 IP 192.168.43.147.8880 > 192.168.43.124.7773: UDP, length 120
02:11:54.734887 IP 192.168.43.146.8880 > 192.168.43.147.7772: UDP, length 120
02:11:54.744503 IP 192.168.43.147.8880 > 192.168.43.124.7773: UDP, length 120
02:11:54.794499 IP 192.168.43.147.8880 > 192.168.43.124.7773: UDP, length 120
02:11:54.796557 IP 192.168.43.146.8880 > 192.168.43.147.7772: UDP, length 120
02:11:54.837293 IP 192.168.43.146.8880 > 192.168.43.147.7772: UDP, length 120
02:11:54.844502 IP 192.168.43.147.8880 > 192.168.43.124.7773: UDP, length 120
02:11:54.887329 IP 192.168.43.146.8880 > 192.168.43.147.7772: UDP, length 120
02:11:54.894501 IP 192.168.43.147.8880 > 192.168.43.124.7773: UDP, length 120
02:11:54.942713 IP 192.168.43.146.8880 > 192.168.43.147.7772: UDP, length 120
02:11:54.944504 IP 192.168.43.147.8880 > 192.168.43.124.7773: UDP, length 120
02:11:54.984667 IP 192.168.43.146.8880 > 192.168.43.147.7772: UDP, length 120
02:11:54.994499 IP 192.168.43.147.8880 > 192.168.43.124.7773: UDP, length 120
02:11:55.035722 IP 192.168.43.146.8880 > 192.168.43.147.7772: UDP, length 120
02:11:55.046164 IP 192.168.43.147.8880 > 192.168.43.124.7773: UDP, length 120
02:11:55.093299 IP 192.168.43.146.8880 > 192.168.43.147.7772: UDP, length 120
02:11:55.094591 IP 192.168.43.147.8880 > 192.168.43.124.7773: UDP, length 120
02:11:55.134921 IP 192.168.43.146.8880 > 192.168.43.147.7772: UDP, length 120
02:11:55.144549 IP 192.168.43.147.8880 > 192.168.43.124.7773: UDP, length 120
02:11:55.193008 IP 192.168.43.146.8880 > 192.168.43.147.7772: UDP, length 120
02:11:55.194607 IP 192.168.43.147.8880 > 192.168.43.124.7773: UDP, length 120
02:11:55.244571 IP 192.168.43.147.8880 > 192.168.43.124.7773: UDP, length 120
02:11:55.245254 IP 192.168.43.146.8880 > 192.168.43.147.7772: UDP, length 120
02:11:55.283533 IP 192.168.43.146.8880 > 192.168.43.147.7772: UDP, length 120
02:11:55.294617 IP 192.168.43.147.8880 > 192.168.43.124.7773: UDP, length 120
02:11:55.333069 IP 192.168.43.146.8880 > 192.168.43.147.7772: UDP, length 120
02:11:55.344588 IP 192.168.43.147.8880 > 192.168.43.124.7773: UDP, length 120
02:11:55.380944 IP 192.168.43.146.8880 > 192.168.43.147.7772: UDP, length 120
02:11:55.394588 IP 192.168.43.147.8880 > 192.168.43.124.7773: UDP, length 120
02:11:55.444542 IP 192.168.43.147.8880 > 192.168.43.124.7773: UDP, length 120
02:11:55.484657 IP 192.168.43.146.8880 > 192.168.43.147.7772: UDP, length 120
02:11:55.484893 IP 192.168.43.146.8880 > 192.168.43.147.7772: UDP, length 120
02:11:55.494509 IP 192.168.43.147.8880 > 192.168.43.124.7773: UDP, length 120
02:11:55.532162 IP 192.168.43.146.8880 > 192.168.43.147.7772: UDP, length 120
02:11:55.544500 IP 192.168.43.147.8880 > 192.168.43.124.7773: UDP, length 120
02:11:55.593166 IP 192.168.43.146.8880 > 192.168.43.147.7772: UDP, length 120
02:11:55.594502 IP 192.168.43.147.8880 > 192.168.43.124.7773: UDP, length 120
02:11:55.634093 IP 192.168.43.146.8880 > 192.168.43.147.7772: UDP, length 120
02:11:55.644512 IP 192.168.43.147.8880 > 192.168.43.124.7773: UDP, length 120
02:11:55.684513 IP 192.168.43.146.8880 > 192.168.43.147.7772: UDP, length 120
02:11:55.694504 IP 192.168.43.147.8880 > 192.168.43.124.7773: UDP, length 120
02:11:55.743476 IP 192.168.43.146.8880 > 192.168.43.147.7772: UDP, length 120
02:11:55.744504 IP 192.168.43.147.8880 > 192.168.43.124.7773: UDP, length 120
02:11:55.787460 IP 192.168.43.146.8880 > 192.168.43.147.7772: UDP, length 120
02:11:55.794529 IP 192.168.43.147.8880 > 192.168.43.124.7773: UDP, length 120
02:11:55.834930 IP 192.168.43.146.8880 > 192.168.43.147.7772: UDP, length 120
02:11:55.844503 IP 192.168.43.147.8880 > 192.168.43.124.7773: UDP, length 120
02:11:55.894499 IP 192.168.43.147.8880 > 192.168.43.124.7773: UDP, length 120
02:11:55.897740 IP 192.168.43.146.8880 > 192.168.43.147.7772: UDP, length 120
02:11:55.933499 IP 192.168.43.146.8880 > 192.168.43.147.7772: UDP, length 120
02:11:55.944501 IP 192.168.43.147.8880 > 192.168.43.124.7773: UDP, length 120
02:11:55.985128 IP 192.168.43.146.8880 > 192.168.43.147.7772: UDP, length 120
02:11:55.994500 IP 192.168.43.147.8880 > 192.168.43.124.7773: UDP, length 120
02:11:56.043539 IP 192.168.43.146.8880 > 192.168.43.147.7772: UDP, length 120
02:11:56.044500 IP 192.168.43.147.8880 > 192.168.43.124.7773: UDP, length 120
02:11:56.085527 IP 192.168.43.146.8880 > 192.168.43.147.7772: UDP, length 120
02:11:56.094500 IP 192.168.43.147.8880 > 192.168.43.124.7773: UDP, length 120
02:11:56.130223 IP 192.168.43.146.8880 > 192.168.43.147.7772: UDP, length 120
02:11:56.144499 IP 192.168.43.147.8880 > 192.168.43.124.7773: UDP, length 120
02:11:56.194499 IP 192.168.43.147.8880 > 192.168.43.124.7773: UDP, length 120
02:11:56.195871 IP 192.168.43.146.8880 > 192.168.43.147.7772: UDP, length 120
02:11:56.233646 IP 192.168.43.146.8880 > 192.168.43.147.7772: UDP, length 120
02:11:56.244506 IP 192.168.43.147.8880 > 192.168.43.124.7773: UDP, length 120
02:11:56.282613 IP 192.168.43.146.8880 > 192.168.43.147.7772: UDP, length 120
02:11:56.294505 IP 192.168.43.147.8880 > 192.168.43.124.7773: UDP, length 120
02:11:56.344185 IP 192.168.43.146.8880 > 192.168.43.147.7772: UDP, length 120
02:11:56.344501 IP 192.168.43.147.8880 > 192.168.43.124.7773: UDP, length 120
02:11:56.384837 IP 192.168.43.146.8880 > 192.168.43.147.7772: UDP, length 120
02:11:56.394503 IP 192.168.43.147.8880 > 192.168.43.124.7773: UDP, length 120
02:11:56.434113 IP 192.168.43.146.8880 > 192.168.43.147.7772: UDP, length 120
02:11:56.444499 IP 192.168.43.147.8880 > 192.168.43.124.7773: UDP, length 120
02:11:56.494504 IP 192.168.43.147.8880 > 192.168.43.124.7773: UDP, length 120
02:11:56.507628 IP 192.168.43.146.8880 > 192.168.43.147.7772: UDP, length 120
02:11:56.544502 IP 192.168.43.147.8880 > 192.168.43.124.7773: UDP, length 120
02:11:56.552923 IP 192.168.43.146.8880 > 192.168.43.147.7772: UDP, length 120
02:11:56.582461 IP 192.168.43.146.8880 > 192.168.43.147.7772: UDP, length 120
02:11:56.594499 IP 192.168.43.147.8880 > 192.168.43.124.7773: UDP, length 120
02:11:56.644508 IP 192.168.43.147.8880 > 192.168.43.124.7773: UDP, length 120
02:11:56.647766 IP 192.168.43.146.8880 > 192.168.43.147.7772: UDP, length 120
02:11:56.683952 IP 192.168.43.146.8880 > 192.168.43.147.7772: UDP, length 120
02:11:56.694501 IP 192.168.43.147.8880 > 192.168.43.124.7773: UDP, length 120
02:11:56.730336 IP 192.168.43.146.8880 > 192.168.43.147.7772: UDP, length 120
02:11:56.744500 IP 192.168.43.147.8880 > 192.168.43.124.7773: UDP, length 120
02:11:56.793651 IP 192.168.43.146.8880 > 192.168.43.147.7772: UDP, length 120
02:11:56.794499 IP 192.168.43.147.8880 > 192.168.43.124.7773: UDP, length 120
02:11:56.834737 IP 192.168.43.146.8880 > 192.168.43.147.7772: UDP, length 120
02:11:56.844500 IP 192.168.43.147.8880 > 192.168.43.124.7773: UDP, length 120
02:11:56.884346 IP 192.168.43.146.8880 > 192.168.43.147.7772: UDP, length 120
02:11:56.894526 IP 192.168.43.147.8880 > 192.168.43.124.7773: UDP, length 120
02:11:56.944525 IP 192.168.43.147.8880 > 192.168.43.124.7773: UDP, length 120
02:11:56.945737 IP 192.168.43.146.8880 > 192.168.43.147.7772: UDP, length 120
02:11:56.988719 IP 192.168.43.146.8880 > 192.168.43.147.7772: UDP, length 120
02:11:56.994526 IP 192.168.43.147.8880 > 192.168.43.124.7773: UDP, length 120
02:11:57.030549 IP 192.168.43.146.8880 > 192.168.43.147.7772: UDP, length 120
02:11:57.044526 IP 192.168.43.147.8880 > 192.168.43.124.7773: UDP, length 120
02:11:57.094527 IP 192.168.43.147.8880 > 192.168.43.124.7773: UDP, length 120
02:11:57.097945 IP 192.168.43.146.8880 > 192.168.43.147.7772: UDP, length 120
02:11:57.133293 IP 192.168.43.146.8880 > 192.168.43.147.7772: UDP, length 120
02:11:57.144526 IP 192.168.43.147.8880 > 192.168.43.124.7773: UDP, length 120
02:11:57.180480 IP 192.168.43.146.8880 > 192.168.43.147.7772: UDP, length 120
02:11:57.194525 IP 192.168.43.147.8880 > 192.168.43.124.7773: UDP, length 120
02:11:57.244530 IP 192.168.43.147.8880 > 192.168.43.124.7773: UDP, length 120
02:11:57.246533 IP 192.168.43.146.8880 > 192.168.43.147.7772: UDP, length 120
02:11:57.286640 IP 192.168.43.146.8880 > 192.168.43.147.7772: UDP, length 120
02:11:57.294561 IP 192.168.43.147.8880 > 192.168.43.124.7773: UDP, length 120
02:11:57.330246 IP 192.168.43.146.8880 > 192.168.43.147.7772: UDP, length 120
02:11:57.344528 IP 192.168.43.147.8880 > 192.168.43.124.7773: UDP, length 120
02:11:57.394527 IP 192.168.43.147.8880 > 192.168.43.124.7773: UDP, length 120
02:11:57.395611 IP 192.168.43.146.8880 > 192.168.43.147.7772: UDP, length 120
02:11:57.434123 IP 192.168.43.146.8880 > 192.168.43.147.7772: UDP, length 120
02:11:57.444529 IP 192.168.43.147.8880 > 192.168.43.124.7773: UDP, length 120
02:11:57.494528 IP 192.168.43.147.8880 > 192.168.43.124.7773: UDP, length 120
02:11:57.497938 IP 192.168.43.146.8880 > 192.168.43.147.7772: UDP, length 120
02:11:57.543429 IP 192.168.43.146.8880 > 192.168.43.147.7772: UDP, length 120
02:11:57.544537 IP 192.168.43.147.8880 > 192.168.43.124.7773: UDP, length 120
02:11:57.594525 IP 192.168.43.147.8880 > 192.168.43.124.7773: UDP, length 120
02:11:57.630877 IP 192.168.43.146.8880 > 192.168.43.147.7772: UDP, length 120
02:11:57.632791 IP 192.168.43.146.8880 > 192.168.43.147.7772: UDP, length 120
02:11:57.644540 IP 192.168.43.147.8880 > 192.168.43.124.7773: UDP, length 120
02:11:57.691455 IP 192.168.43.146.8880 > 192.168.43.147.7772: UDP, length 120
02:11:57.694526 IP 192.168.43.147.8880 > 192.168.43.124.7773: UDP, length 120
02:11:57.744534 IP 192.168.43.147.8880 > 192.168.43.124.7773: UDP, length 120
02:11:57.751183 IP 192.168.43.146.8880 > 192.168.43.147.7772: UDP, length 120
02:11:57.794534 IP 192.168.43.147.8880 > 192.168.43.124.7773: UDP, length 120
02:11:57.834206 IP 192.168.43.146.8880 > 192.168.43.147.7772: UDP, length 120
02:11:57.834434 IP 192.168.43.146.8880 > 192.168.43.147.7772: UDP, length 120
02:11:57.844530 IP 192.168.43.147.8880 > 192.168.43.124.7773: UDP, length 120
02:11:57.894525 IP 192.168.43.147.8880 > 192.168.43.124.7773: UDP, length 120
02:11:57.897348 IP 192.168.43.146.8880 > 192.168.43.147.7772: UDP, length 120
02:11:57.937316 IP 192.168.43.146.8880 > 192.168.43.147.7772: UDP, length 120
02:11:57.944525 IP 192.168.43.147.8880 > 192.168.43.124.7773: UDP, length 120
02:11:57.994526 IP 192.168.43.147.8880 > 192.168.43.124.7773: UDP, length 120
02:11:58.011464 IP 192.168.43.146.8880 > 192.168.43.147.7772: UDP, length 120
02:11:58.044533 IP 192.168.43.147.8880 > 192.168.43.124.7773: UDP, length 120
02:11:58.047967 IP 192.168.43.146.8880 > 192.168.43.147.7772: UDP, length 120
02:11:58.094529 IP 192.168.43.147.8880 > 192.168.43.124.7773: UDP, length 120
02:11:58.112428 IP 192.168.43.146.8880 > 192.168.43.147.7772: UDP, length 120
02:11:58.142822 IP 192.168.43.146.8880 > 192.168.43.147.7772: UDP, length 120
02:11:58.144528 IP 192.168.43.147.8880 > 192.168.43.124.7773: UDP, length 120
02:11:58.194526 IP 192.168.43.147.8880 > 192.168.43.124.7773: UDP, length 120
02:11:58.200701 IP 192.168.43.146.8880 > 192.168.43.147.7772: UDP, length 120
02:11:58.244526 IP 192.168.43.147.8880 > 192.168.43.124.7773: UDP, length 120
02:11:58.245397 IP 192.168.43.146.8880 > 192.168.43.147.7772: UDP, length 120
02:11:58.294530 IP 192.168.43.147.8880 > 192.168.43.124.7773: UDP, length 120
02:11:58.297120 IP 192.168.43.146.8880 > 192.168.43.147.7772: UDP, length 120
02:11:58.344532 IP 192.168.43.147.8880 > 192.168.43.124.7773: UDP, length 120
02:11:58.345176 IP 192.168.43.146.8880 > 192.168.43.147.7772: UDP, length 120
02:11:58.389156 IP 192.168.43.146.8880 > 192.168.43.147.7772: UDP, length 120
02:11:58.394540 IP 192.168.43.147.8880 > 192.168.43.124.7773: UDP, length 120
02:11:58.444530 IP 192.168.43.147.8880 > 192.168.43.124.7773: UDP, length 120
02:11:58.451882 IP 192.168.43.146.8880 > 192.168.43.147.7772: UDP, length 120
02:11:58.494529 IP 192.168.43.147.8880 > 192.168.43.124.7773: UDP, length 120
02:11:58.544526 IP 192.168.43.147.8880 > 192.168.43.124.7773: UDP, length 120
02:11:58.559997 IP 192.168.43.146.8880 > 192.168.43.147.7772: UDP, length 120
02:11:58.560112 IP 192.168.43.146.8880 > 192.168.43.147.7772: UDP, length 120
02:11:58.582996 IP 192.168.43.146.8880 > 192.168.43.147.7772: UDP, length 120
02:11:58.594527 IP 192.168.43.147.8880 > 192.168.43.124.7773: UDP, length 120
02:11:58.644538 IP 192.168.43.147.8880 > 192.168.43.124.7773: UDP, length 120
02:11:58.655754 IP 192.168.43.146.8880 > 192.168.43.147.7772: UDP, length 120
02:11:58.683972 IP 192.168.43.146.8880 > 192.168.43.147.7772: UDP, length 120
02:11:58.694528 IP 192.168.43.147.8880 > 192.168.43.124.7773: UDP, length 120
02:11:58.744528 IP 192.168.43.147.8880 > 192.168.43.124.7773: UDP, length 120
02:11:58.757492 IP 192.168.43.146.8880 > 192.168.43.147.7772: UDP, length 120
02:11:58.794567 IP 192.168.43.147.8880 > 192.168.43.124.7773: UDP, length 120
02:11:58.798062 IP 192.168.43.146.8880 > 192.168.43.147.7772: UDP, length 120
02:11:58.844025 IP 192.168.43.146.8880 > 192.168.43.147.7772: UDP, length 120
02:11:58.844541 IP 192.168.43.147.8880 > 192.168.43.124.7773: UDP, length 120
02:11:58.884411 IP 192.168.43.146.8880 > 192.168.43.147.7772: UDP, length 120
02:11:58.894527 IP 192.168.43.147.8880 > 192.168.43.124.7773: UDP, length 120
02:11:58.935915 IP 192.168.43.146.8880 > 192.168.43.147.7772: UDP, length 120
02:11:58.944527 IP 192.168.43.147.8880 > 192.168.43.124.7773: UDP, length 120
02:11:58.994520 IP 192.168.43.147.8880 > 192.168.43.124.7773: UDP, length 120
02:11:58.994778 IP 192.168.43.146.8880 > 192.168.43.147.7772: UDP, length 120
02:11:59.037765 IP 192.168.43.146.8880 > 192.168.43.147.7772: UDP, length 120
02:11:59.044527 IP 192.168.43.147.8880 > 192.168.43.124.7773: UDP, length 120
02:11:59.084854 IP 192.168.43.146.8880 > 192.168.43.147.7772: UDP, length 120
02:11:59.094524 IP 192.168.43.147.8880 > 192.168.43.124.7773: UDP, length 120
02:11:59.144525 IP 192.168.43.147.8880 > 192.168.43.124.7773: UDP, length 120
02:11:59.147026 IP 192.168.43.146.8880 > 192.168.43.147.7772: UDP, length 120
02:11:59.187866 IP 192.168.43.146.8880 > 192.168.43.147.7772: UDP, length 120
02:11:59.194525 IP 192.168.43.147.8880 > 192.168.43.124.7773: UDP, length 120
02:11:59.232371 IP 192.168.43.146.8880 > 192.168.43.147.7772: UDP, length 120
02:11:59.244532 IP 192.168.43.147.8880 > 192.168.43.124.7773: UDP, length 120
02:11:59.294529 IP 192.168.43.147.8880 > 192.168.43.124.7773: UDP, length 120
02:11:59.294727 IP 192.168.43.146.8880 > 192.168.43.147.7772: UDP, length 120
02:11:59.342224 IP 192.168.43.146.8880 > 192.168.43.147.7772: UDP, length 120
02:11:59.344525 IP 192.168.43.147.8880 > 192.168.43.124.7773: UDP, length 120
02:11:59.380787 IP 192.168.43.146.8880 > 192.168.43.147.7772: UDP, length 120
02:11:59.394525 IP 192.168.43.147.8880 > 192.168.43.124.7773: UDP, length 120
02:11:59.444532 IP 192.168.43.147.8880 > 192.168.43.124.7773: UDP, length 120
02:11:59.445915 IP 192.168.43.146.8880 > 192.168.43.147.7772: UDP, length 120
02:11:59.494527 IP 192.168.43.147.8880 > 192.168.43.124.7773: UDP, length 120
02:11:59.512518 IP 192.168.43.146.8880 > 192.168.43.147.7772: UDP, length 120
02:11:59.536740 IP 192.168.43.146.8880 > 192.168.43.147.7772: UDP, length 120
02:11:59.544525 IP 192.168.43.147.8880 > 192.168.43.124.7773: UDP, length 120
02:11:59.594524 IP 192.168.43.147.8880 > 192.168.43.124.7773: UDP, length 120
02:11:59.597301 IP 192.168.43.146.8880 > 192.168.43.147.7772: UDP, length 120
02:11:59.637692 IP 192.168.43.146.8880 > 192.168.43.147.7772: UDP, length 120
02:11:59.644556 IP 192.168.43.147.8880 > 192.168.43.124.7773: UDP, length 120
02:11:59.680966 IP 192.168.43.146.8880 > 192.168.43.147.7772: UDP, length 120
02:11:59.694527 IP 192.168.43.147.8880 > 192.168.43.124.7773: UDP, length 120
02:11:59.743518 IP 192.168.43.146.8880 > 192.168.43.147.7772: UDP, length 120
02:11:59.744525 IP 192.168.43.147.8880 > 192.168.43.124.7773: UDP, length 120
02:11:59.783387 IP 192.168.43.146.8880 > 192.168.43.147.7772: UDP, length 120
02:11:59.794521 IP 192.168.43.147.8880 > 192.168.43.124.7773: UDP, length 120
02:11:59.834064 IP 192.168.43.146.8880 > 192.168.43.147.7772: UDP, length 120
02:11:59.844524 IP 192.168.43.147.8880 > 192.168.43.124.7773: UDP, length 120
02:11:59.894523 IP 192.168.43.147.8880 > 192.168.43.124.7773: UDP, length 120
02:11:59.898686 IP 192.168.43.146.8880 > 192.168.43.147.7772: UDP, length 120
02:11:59.936870 IP 192.168.43.146.8880 > 192.168.43.147.7772: UDP, length 120
02:11:59.944525 IP 192.168.43.147.8880 > 192.168.43.124.7773: UDP, length 120
02:11:59.994523 IP 192.168.43.147.8880 > 192.168.43.124.7773: UDP, length 120
02:11:59.996090 IP 192.168.43.146.8880 > 192.168.43.147.7772: UDP, length 120
02:12:00.034967 IP 192.168.43.146.8880 > 192.168.43.147.7772: UDP, length 120
02:12:00.044524 IP 192.168.43.147.8880 > 192.168.43.124.7773: UDP, length 120
02:12:00.085222 IP 192.168.43.146.8880 > 192.168.43.147.7772: UDP, length 120
02:12:00.094522 IP 192.168.43.147.8880 > 192.168.43.124.7773: UDP, length 120
02:12:00.144524 IP 192.168.43.147.8880 > 192.168.43.124.7773: UDP, length 120
02:12:00.146796 IP 192.168.43.146.8880 > 192.168.43.147.7772: UDP, length 120
02:12:00.190476 IP 192.168.43.146.8880 > 192.168.43.147.7772: UDP, length 120
02:12:00.194523 IP 192.168.43.147.8880 > 192.168.43.124.7773: UDP, length 120
02:12:00.231788 IP 192.168.43.146.8880 > 192.168.43.147.7772: UDP, length 120
02:12:00.244524 IP 192.168.43.147.8880 > 192.168.43.124.7773: UDP, length 120
02:12:00.294004 IP 192.168.43.146.8880 > 192.168.43.147.7772: UDP, length 120
02:12:00.294564 IP 192.168.43.147.8880 > 192.168.43.124.7773: UDP, length 120
02:12:00.333688 IP 192.168.43.146.8880 > 192.168.43.147.7772: UDP, length 120
02:12:00.344527 IP 192.168.43.147.8880 > 192.168.43.124.7773: UDP, length 120
02:12:00.394525 IP 192.168.43.147.8880 > 192.168.43.124.7773: UDP, length 120
02:12:00.396202 IP 192.168.43.146.8880 > 192.168.43.147.7772: UDP, length 120
02:12:00.444603 IP 192.168.43.147.8880 > 192.168.43.124.7773: UDP, length 120
02:12:00.444839 IP 192.168.43.146.8880 > 192.168.43.147.7772: UDP, length 120
02:12:00.494642 IP 192.168.43.147.8880 > 192.168.43.124.7773: UDP, length 120
02:12:00.519470 IP 192.168.43.146.8880 > 192.168.43.147.7772: UDP, length 120
02:12:00.530395 IP 192.168.43.146.8880 > 192.168.43.147.7772: UDP, length 120
02:12:00.544618 IP 192.168.43.147.8880 > 192.168.43.124.7773: UDP, length 120
02:12:00.594615 IP 192.168.43.147.8880 > 192.168.43.124.7773: UDP, length 120
02:12:00.597574 IP 192.168.43.146.8880 > 192.168.43.147.7772: UDP, length 120
02:12:00.632192 IP 192.168.43.146.8880 > 192.168.43.147.7772: UDP, length 120
02:12:00.644583 IP 192.168.43.147.8880 > 192.168.43.124.7773: UDP, length 120
02:12:00.682422 IP 192.168.43.146.8880 > 192.168.43.147.7772: UDP, length 120
02:12:00.694600 IP 192.168.43.147.8880 > 192.168.43.124.7773: UDP, length 120
02:12:00.744005 IP 192.168.43.146.8880 > 192.168.43.147.7772: UDP, length 120
02:12:00.744550 IP 192.168.43.147.8880 > 192.168.43.124.7773: UDP, length 120
02:12:00.785307 IP 192.168.43.146.8880 > 192.168.43.147.7772: UDP, length 120
02:12:00.794565 IP 192.168.43.147.8880 > 192.168.43.124.7773: UDP, length 120
02:12:00.830580 IP 192.168.43.146.8880 > 192.168.43.147.7772: UDP, length 120
02:12:00.844623 IP 192.168.43.147.8880 > 192.168.43.124.7773: UDP, length 120
02:12:00.884791 IP 192.168.43.146.8880 > 192.168.43.147.7772: UDP, length 120
02:12:00.894596 IP 192.168.43.147.8880 > 192.168.43.124.7773: UDP, length 120
02:12:00.944550 IP 192.168.43.147.8880 > 192.168.43.124.7773: UDP, length 120
02:12:00.961646 IP 192.168.43.146.8880 > 192.168.43.147.7772: UDP, length 120
02:12:00.985920 IP 192.168.43.146.8880 > 192.168.43.147.7772: UDP, length 120
02:12:00.994539 IP 192.168.43.147.8880 > 192.168.43.124.7773: UDP, length 120
02:12:01.043387 IP 192.168.43.146.8880 > 192.168.43.147.7772: UDP, length 120
02:12:01.044569 IP 192.168.43.147.8880 > 192.168.43.124.7773: UDP, length 120
02:12:01.084123 IP 192.168.43.146.8880 > 192.168.43.147.7772: UDP, length 120
02:12:01.094528 IP 192.168.43.147.8880 > 192.168.43.124.7773: UDP, length 120
02:12:01.135401 IP 192.168.43.146.8880 > 192.168.43.147.7772: UDP, length 120
02:12:01.144526 IP 192.168.43.147.8880 > 192.168.43.124.7773: UDP, length 120
02:12:01.194526 IP 192.168.43.147.8880 > 192.168.43.124.7773: UDP, length 120
02:12:01.196015 IP 192.168.43.146.8880 > 192.168.43.147.7772: UDP, length 120
02:12:01.237400 IP 192.168.43.146.8880 > 192.168.43.147.7772: UDP, length 120
02:12:01.244528 IP 192.168.43.147.8880 > 192.168.43.124.7773: UDP, length 120
02:12:01.288814 IP 192.168.43.146.8880 > 192.168.43.147.7772: UDP, length 120
02:12:01.294526 IP 192.168.43.147.8880 > 192.168.43.124.7773: UDP, length 120
02:12:01.344526 IP 192.168.43.147.8880 > 192.168.43.124.7773: UDP, length 120
02:12:01.347931 IP 192.168.43.146.8880 > 192.168.43.147.7772: UDP, length 120
02:12:01.384147 IP 192.168.43.146.8880 > 192.168.43.147.7772: UDP, length 120
02:12:01.394528 IP 192.168.43.147.8880 > 192.168.43.124.7773: UDP, length 120
02:12:01.440842 IP 192.168.43.146.8880 > 192.168.43.147.7772: UDP, length 120
02:12:01.444527 IP 192.168.43.147.8880 > 192.168.43.124.7773: UDP, length 120
02:12:01.494535 IP 192.168.43.147.8880 > 192.168.43.124.7773: UDP, length 120
02:12:01.502131 IP 192.168.43.146.8880 > 192.168.43.147.7772: UDP, length 120
02:12:01.534699 IP 192.168.43.146.8880 > 192.168.43.147.7772: UDP, length 120
02:12:01.544533 IP 192.168.43.147.8880 > 192.168.43.124.7773: UDP, length 120
02:12:01.594113 IP 192.168.43.146.8880 > 192.168.43.147.7772: UDP, length 120
02:12:01.594532 IP 192.168.43.147.8880 > 192.168.43.124.7773: UDP, length 120
02:12:01.634470 IP 192.168.43.146.8880 > 192.168.43.147.7772: UDP, length 120
02:12:01.644545 IP 192.168.43.147.8880 > 192.168.43.124.7773: UDP, length 120
02:12:01.685798 IP 192.168.43.146.8880 > 192.168.43.147.7772: UDP, length 120
02:12:01.694525 IP 192.168.43.147.8880 > 192.168.43.124.7773: UDP, length 120
02:12:01.744526 IP 192.168.43.147.8880 > 192.168.43.124.7773: UDP, length 120
02:12:01.747538 IP 192.168.43.146.8880 > 192.168.43.147.7772: UDP, length 120
02:12:01.788147 IP 192.168.43.146.8880 > 192.168.43.147.7772: UDP, length 120
02:12:01.794559 IP 192.168.43.147.8880 > 192.168.43.124.7773: UDP, length 120
02:12:01.844538 IP 192.168.43.147.8880 > 192.168.43.124.7773: UDP, length 120
02:12:01.852380 IP 192.168.43.146.8880 > 192.168.43.147.7772: UDP, length 120
02:12:01.886772 IP 192.168.43.146.8880 > 192.168.43.147.7772: UDP, length 120
02:12:01.894531 IP 192.168.43.147.8880 > 192.168.43.124.7773: UDP, length 120
02:12:01.933731 IP 192.168.43.146.8880 > 192.168.43.147.7772: UDP, length 120
02:12:01.944525 IP 192.168.43.147.8880 > 192.168.43.124.7773: UDP, length 120
02:12:01.985116 IP 192.168.43.146.8880 > 192.168.43.147.7772: UDP, length 120
02:12:01.994526 IP 192.168.43.147.8880 > 192.168.43.124.7773: UDP, length 120
02:12:02.044028 IP 192.168.43.146.8880 > 192.168.43.147.7772: UDP, length 120
02:12:02.044529 IP 192.168.43.147.8880 > 192.168.43.124.7773: UDP, length 120
02:12:02.084628 IP 192.168.43.146.8880 > 192.168.43.147.7772: UDP, length 120
02:12:02.094525 IP 192.168.43.147.8880 > 192.168.43.124.7773: UDP, length 120
02:12:02.135625 IP 192.168.43.146.8880 > 192.168.43.147.7772: UDP, length 120
02:12:02.144525 IP 192.168.43.147.8880 > 192.168.43.124.7773: UDP, length 120
02:12:02.194527 IP 192.168.43.147.8880 > 192.168.43.124.7773: UDP, length 120
02:12:02.196806 IP 192.168.43.146.8880 > 192.168.43.147.7772: UDP, length 120
02:12:02.237656 IP 192.168.43.146.8880 > 192.168.43.147.7772: UDP, length 120
02:12:02.244527 IP 192.168.43.147.8880 > 192.168.43.124.7773: UDP, length 120
02:12:02.283648 IP 192.168.43.146.8880 > 192.168.43.147.7772: UDP, length 120
02:12:02.294523 IP 192.168.43.147.8880 > 192.168.43.124.7773: UDP, length 120
02:12:02.344526 IP 192.168.43.147.8880 > 192.168.43.124.7773: UDP, length 120
02:12:02.346129 IP 192.168.43.146.8880 > 192.168.43.147.7772: UDP, length 120
02:12:02.384882 IP 192.168.43.146.8880 > 192.168.43.147.7772: UDP, length 120
02:12:02.394525 IP 192.168.43.147.8880 > 192.168.43.124.7773: UDP, length 120
02:12:02.430794 IP 192.168.43.146.8880 > 192.168.43.147.7772: UDP, length 120
02:12:02.444524 IP 192.168.43.147.8880 > 192.168.43.124.7773: UDP, length 120
02:12:02.487284 IP 192.168.43.146.8880 > 192.168.43.147.7772: UDP, length 120
02:12:02.494530 IP 192.168.43.147.8880 > 192.168.43.124.7773: UDP, length 120
02:12:02.534832 IP 192.168.43.146.8880 > 192.168.43.147.7772: UDP, length 120
02:12:02.544531 IP 192.168.43.147.8880 > 192.168.43.124.7773: UDP, length 120
02:12:02.594527 IP 192.168.43.147.8880 > 192.168.43.124.7773: UDP, length 120
02:12:02.597945 IP 192.168.43.146.8880 > 192.168.43.147.7772: UDP, length 120
02:12:02.639081 IP 192.168.43.146.8880 > 192.168.43.147.7772: UDP, length 120
02:12:02.644554 IP 192.168.43.147.8880 > 192.168.43.124.7773: UDP, length 120
02:12:02.687126 IP 192.168.43.146.8880 > 192.168.43.147.7772: UDP, length 120
02:12:02.694528 IP 192.168.43.147.8880 > 192.168.43.124.7773: UDP, length 120
02:12:02.744527 IP 192.168.43.147.8880 > 192.168.43.124.7773: UDP, length 120
02:12:02.752051 IP 192.168.43.146.8880 > 192.168.43.147.7772: UDP, length 120
02:12:02.794528 IP 192.168.43.147.8880 > 192.168.43.124.7773: UDP, length 120
02:12:02.798206 IP 192.168.43.146.8880 > 192.168.43.147.7772: UDP, length 120
02:12:02.843897 IP 192.168.43.146.8880 > 192.168.43.147.7772: UDP, length 120
02:12:02.844525 IP 192.168.43.147.8880 > 192.168.43.124.7773: UDP, length 120
02:12:02.894525 IP 192.168.43.147.8880 > 192.168.43.124.7773: UDP, length 120
02:12:02.944530 IP 192.168.43.147.8880 > 192.168.43.124.7773: UDP, length 120
02:12:02.952519 IP 192.168.43.146.8880 > 192.168.43.147.7772: UDP, length 120
02:12:02.953082 IP 192.168.43.146.8880 > 192.168.43.147.7772: UDP, length 120
02:12:02.994528 IP 192.168.43.147.8880 > 192.168.43.124.7773: UDP, length 120
02:12:03.003200 IP 192.168.43.146.8880 > 192.168.43.147.7772: UDP, length 120
02:12:03.044527 IP 192.168.43.147.8880 > 192.168.43.124.7773: UDP, length 120
02:12:03.055104 IP 192.168.43.146.8880 > 192.168.43.147.7772: UDP, length 120
02:12:03.094528 IP 192.168.43.147.8880 > 192.168.43.124.7773: UDP, length 120
02:12:03.097961 IP 192.168.43.146.8880 > 192.168.43.147.7772: UDP, length 120
02:12:03.144528 IP 192.168.43.147.8880 > 192.168.43.124.7773: UDP, length 120
02:12:03.158283 IP 192.168.43.146.8880 > 192.168.43.147.7772: UDP, length 120
02:12:03.185799 IP 192.168.43.146.8880 > 192.168.43.147.7772: UDP, length 120
02:12:03.194525 IP 192.168.43.147.8880 > 192.168.43.124.7773: UDP, length 120
02:12:03.244531 IP 192.168.43.147.8880 > 192.168.43.124.7773: UDP, length 120
02:12:03.256439 IP 192.168.43.146.8880 > 192.168.43.147.7772: UDP, length 120
02:12:03.288709 IP 192.168.43.146.8880 > 192.168.43.147.7772: UDP, length 120
02:12:03.294571 IP 192.168.43.147.8880 > 192.168.43.124.7773: UDP, length 120
02:12:03.340178 IP 192.168.43.146.8880 > 192.168.43.147.7772: UDP, length 120
02:12:03.344542 IP 192.168.43.147.8880 > 192.168.43.124.7773: UDP, length 120
02:12:03.391322 IP 192.168.43.146.8880 > 192.168.43.147.7772: UDP, length 120
02:12:03.394525 IP 192.168.43.147.8880 > 192.168.43.124.7773: UDP, length 120
02:12:03.440293 IP 192.168.43.146.8880 > 192.168.43.147.7772: UDP, length 120
02:12:03.444522 IP 192.168.43.147.8880 > 192.168.43.124.7773: UDP, length 120
02:12:03.494525 IP 192.168.43.147.8880 > 192.168.43.124.7773: UDP, length 120
02:12:03.496042 IP 192.168.43.146.8880 > 192.168.43.147.7772: UDP, length 120
02:12:03.544532 IP 192.168.43.147.8880 > 192.168.43.124.7773: UDP, length 120
02:12:03.547981 IP 192.168.43.146.8880 > 192.168.43.147.7772: UDP, length 120
02:12:03.594526 IP 192.168.43.147.8880 > 192.168.43.124.7773: UDP, length 120
02:12:03.597963 IP 192.168.43.146.8880 > 192.168.43.147.7772: UDP, length 120
02:12:03.644547 IP 192.168.43.147.8880 > 192.168.43.124.7773: UDP, length 120
02:12:03.648017 IP 192.168.43.146.8880 > 192.168.43.147.7772: UDP, length 120
02:12:03.694535 IP 192.168.43.147.8880 > 192.168.43.124.7773: UDP, length 120
02:12:03.697978 IP 192.168.43.146.8880 > 192.168.43.147.7772: UDP, length 120
02:12:03.744529 IP 192.168.43.147.8880 > 192.168.43.124.7773: UDP, length 120
02:12:03.773992 IP 192.168.43.146.8880 > 192.168.43.147.7772: UDP, length 120
02:12:03.794529 IP 192.168.43.147.8880 > 192.168.43.124.7773: UDP, length 120
02:12:03.799121 IP 192.168.43.146.8880 > 192.168.43.147.7772: UDP, length 120
02:12:03.844528 IP 192.168.43.147.8880 > 192.168.43.124.7773: UDP, length 120
02:12:03.876966 IP 192.168.43.146.8880 > 192.168.43.147.7772: UDP, length 120
02:12:03.881747 IP 192.168.43.146.8880 > 192.168.43.147.7772: UDP, length 120
02:12:03.894531 IP 192.168.43.147.8880 > 192.168.43.124.7773: UDP, length 120
02:12:03.944530 IP 192.168.43.147.8880 > 192.168.43.124.7773: UDP, length 120
02:12:03.951133 IP 192.168.43.146.8880 > 192.168.43.147.7772: UDP, length 120
02:12:03.987342 IP 192.168.43.146.8880 > 192.168.43.147.7772: UDP, length 120
02:12:03.994526 IP 192.168.43.147.8880 > 192.168.43.124.7773: UDP, length 120
02:12:04.044528 IP 192.168.43.147.8880 > 192.168.43.124.7773: UDP, length 120
02:12:04.081806 IP 192.168.43.146.8880 > 192.168.43.147.7772: UDP, length 120
02:12:04.082033 IP 192.168.43.146.8880 > 192.168.43.147.7772: UDP, length 120
02:12:04.094526 IP 192.168.43.147.8880 > 192.168.43.124.7773: UDP, length 120
02:12:04.144532 IP 192.168.43.147.8880 > 192.168.43.124.7773: UDP, length 120
02:12:04.155097 IP 192.168.43.146.8880 > 192.168.43.147.7772: UDP, length 120
02:12:04.184336 IP 192.168.43.146.8880 > 192.168.43.147.7772: UDP, length 120
02:12:04.194531 IP 192.168.43.147.8880 > 192.168.43.124.7773: UDP, length 120
02:12:04.235982 IP 192.168.43.146.8880 > 192.168.43.147.7772: UDP, length 120
02:12:04.244534 IP 192.168.43.147.8880 > 192.168.43.124.7773: UDP, length 120
02:12:04.286015 IP 192.168.43.146.8880 > 192.168.43.147.7772: UDP, length 120
02:12:04.294525 IP 192.168.43.147.8880 > 192.168.43.124.7773: UDP, length 120
02:12:04.339516 IP 192.168.43.146.8880 > 192.168.43.147.7772: UDP, length 120
02:12:04.344525 IP 192.168.43.147.8880 > 192.168.43.124.7773: UDP, length 120
02:12:04.391090 IP 192.168.43.146.8880 > 192.168.43.147.7772: UDP, length 120
02:12:04.394523 IP 192.168.43.147.8880 > 192.168.43.124.7773: UDP, length 120
02:12:04.441949 IP 192.168.43.146.8880 > 192.168.43.147.7772: UDP, length 120
02:12:04.444529 IP 192.168.43.147.8880 > 192.168.43.124.7773: UDP, length 120
02:12:04.491120 IP 192.168.43.146.8880 > 192.168.43.147.7772: UDP, length 120
02:12:04.494528 IP 192.168.43.147.8880 > 192.168.43.124.7773: UDP, length 120
02:12:04.533477 IP 192.168.43.146.8880 > 192.168.43.147.7772: UDP, length 120
02:12:04.544523 IP 192.168.43.147.8880 > 192.168.43.124.7773: UDP, length 120
02:12:04.589598 IP 192.168.43.146.8880 > 192.168.43.147.7772: UDP, length 120
02:12:04.594524 IP 192.168.43.147.8880 > 192.168.43.124.7773: UDP, length 120
02:12:04.633690 IP 192.168.43.146.8880 > 192.168.43.147.7772: UDP, length 120
02:12:04.644539 IP 192.168.43.147.8880 > 192.168.43.124.7773: UDP, length 120
02:12:04.685306 IP 192.168.43.146.8880 > 192.168.43.147.7772: UDP, length 120
02:12:04.694531 IP 192.168.43.147.8880 > 192.168.43.124.7773: UDP, length 120
02:12:04.734883 IP 192.168.43.146.8880 > 192.168.43.147.7772: UDP, length 120
02:12:04.744532 IP 192.168.43.147.8880 > 192.168.43.124.7773: UDP, length 120
02:12:04.794576 IP 192.168.43.147.8880 > 192.168.43.124.7773: UDP, length 120
02:12:04.798482 IP 192.168.43.146.8880 > 192.168.43.147.7772: UDP, length 120
02:12:04.833886 IP 192.168.43.146.8880 > 192.168.43.147.7772: UDP, length 120
02:12:04.844549 IP 192.168.43.147.8880 > 192.168.43.124.7773: UDP, length 120
02:12:04.884019 IP 192.168.43.146.8880 > 192.168.43.147.7772: UDP, length 120
02:12:04.894530 IP 192.168.43.147.8880 > 192.168.43.124.7773: UDP, length 120
02:12:04.937890 IP 192.168.43.146.8880 > 192.168.43.147.7772: UDP, length 120
02:12:04.944531 IP 192.168.43.147.8880 > 192.168.43.124.7773: UDP, length 120
02:12:04.985289 IP 192.168.43.146.8880 > 192.168.43.147.7772: UDP, length 120
02:12:04.994530 IP 192.168.43.147.8880 > 192.168.43.124.7773: UDP, length 120
02:12:05.035356 IP 192.168.43.146.8880 > 192.168.43.147.7772: UDP, length 120
02:12:05.044529 IP 192.168.43.147.8880 > 192.168.43.124.7773: UDP, length 120
02:12:05.085349 IP 192.168.43.146.8880 > 192.168.43.147.7772: UDP, length 120
02:12:05.094528 IP 192.168.43.147.8880 > 192.168.43.124.7773: UDP, length 120
02:12:05.138947 IP 192.168.43.146.8880 > 192.168.43.147.7772: UDP, length 120
02:12:05.144529 IP 192.168.43.147.8880 > 192.168.43.124.7773: UDP, length 120
02:12:05.185133 IP 192.168.43.146.8880 > 192.168.43.147.7772: UDP, length 120
02:12:05.194527 IP 192.168.43.147.8880 > 192.168.43.124.7773: UDP, length 120
02:12:05.235149 IP 192.168.43.146.8880 > 192.168.43.147.7772: UDP, length 120
02:12:05.244529 IP 192.168.43.147.8880 > 192.168.43.124.7773: UDP, length 120
02:12:05.285404 IP 192.168.43.146.8880 > 192.168.43.147.7772: UDP, length 120
02:12:05.294526 IP 192.168.43.147.8880 > 192.168.43.124.7773: UDP, length 120
02:12:05.335571 IP 192.168.43.146.8880 > 192.168.43.147.7772: UDP, length 120
02:12:05.344526 IP 192.168.43.147.8880 > 192.168.43.124.7773: UDP, length 120
02:12:05.385857 IP 192.168.43.146.8880 > 192.168.43.147.7772: UDP, length 120
02:12:05.394525 IP 192.168.43.147.8880 > 192.168.43.124.7773: UDP, length 120
02:12:05.436783 IP 192.168.43.146.8880 > 192.168.43.147.7772: UDP, length 120
02:12:05.444528 IP 192.168.43.147.8880 > 192.168.43.124.7773: UDP, length 120
02:12:05.494528 IP 192.168.43.147.8880 > 192.168.43.124.7773: UDP, length 120
02:12:05.516198 IP 192.168.43.146.8880 > 192.168.43.147.7772: UDP, length 120
02:12:05.536125 IP 192.168.43.146.8880 > 192.168.43.147.7772: UDP, length 120
02:12:05.544528 IP 192.168.43.147.8880 > 192.168.43.124.7773: UDP, length 120
