03:12:02.802220 IP 192.168.43.147.8880 > 192.168.43.124.7773: UDP, length 120
03:12:02.852274 IP 192.168.43.147.8880 > 192.168.43.124.7773: UDP, length 120
03:12:02.874097 IP 192.168.43.146.8880 > 192.168.43.147.7772: UDP, length 120
03:12:02.902253 IP 192.168.43.147.8880 > 192.168.43.124.7773: UDP, length 120
03:12:02.925932 IP 192.168.43.146.8880 > 192.168.43.147.7772: UDP, length 120
03:12:02.952247 IP 192.168.43.147.8880 > 192.168.43.124.7773: UDP, length 120
03:12:02.981310 IP 192.168.43.146.8880 > 192.168.43.147.7772: UDP, length 120
03:12:03.002243 IP 192.168.43.147.8880 > 192.168.43.124.7773: UDP, length 120
03:12:03.027714 IP 192.168.43.146.8880 > 192.168.43.147.7772: UDP, length 120
03:12:03.052243 IP 192.168.43.147.8880 > 192.168.43.124.7773: UDP, length 120
03:12:03.074413 IP 192.168.43.146.8880 > 192.168.43.147.7772: UDP, length 120
03:12:03.102242 IP 192.168.43.147.8880 > 192.168.43.124.7773: UDP, length 120
03:12:03.134386 IP 192.168.43.146.8880 > 192.168.43.147.7772: UDP, length 120
03:12:03.152243 IP 192.168.43.147.8880 > 192.168.43.124.7773: UDP, length 120
03:12:03.171886 IP 192.168.43.146.8880 > 192.168.43.147.7772: UDP, length 120
03:12:03.202242 IP 192.168.43.147.8880 > 192.168.43.124.7773: UDP, length 120
03:12:03.221320 IP 192.168.43.146.8880 > 192.168.43.147.7772: UDP, length 120
03:12:03.252242 IP 192.168.43.147.8880 > 192.168.43.124.7773: UDP, length 120
03:12:03.279099 IP 192.168.43.146.8880 > 192.168.43.147.7772: UDP, length 120
03:12:03.302242 IP 192.168.43.147.8880 > 192.168.43.124.7773: UDP, length 120
03:12:03.324730 IP 192.168.43.146.8880 > 192.168.43.147.7772: UDP, length 120
03:12:03.352242 IP 192.168.43.147.8880 > 192.168.43.124.7773: UDP, length 120
03:12:03.374540 IP 192.168.43.146.8880 > 192.168.43.147.7772: UDP, length 120
03:12:03.402242 IP 192.168.43.147.8880 > 192.168.43.124.7773: UDP, length 120
03:12:03.428732 IP 192.168.43.146.8880 > 192.168.43.147.7772: UDP, length 120
03:12:03.452279 IP 192.168.43.147.8880 > 192.168.43.124.7773: UDP, length 120
03:12:03.497963 IP 192.168.43.146.8880 > 192.168.43.147.7772: UDP, length 120
03:12:03.502251 IP 192.168.43.147.8880 > 192.168.43.124.7773: UDP, length 120
03:12:03.532071 IP 192.168.43.146.8880 > 192.168.43.147.7772: UDP, length 120
03:12:03.552244 IP 192.168.43.147.8880 > 192.168.43.124.7773: UDP, length 120
03:12:03.574139 IP 192.168.43.146.8880 > 192.168.43.147.7772: UDP, length 120
03:12:03.602242 IP 192.168.43.147.8880 > 192.168.43.124.7773: UDP, length 120
03:12:03.640169 IP 192.168.43.146.8880 > 192.168.43.147.7772: UDP, length 120
03:12:03.652246 IP 192.168.43.147.8880 > 192.168.43.124.7773: UDP, length 120
03:12:03.674486 IP 192.168.43.146.8880 > 192.168.43.147.7772: UDP, length 120
03:12:03.702248 IP 192.168.43.147.8880 > 192.168.43.124.7773: UDP, length 120
03:12:03.721173 IP 192.168.43.146.8880 > 192.168.43.147.7772: UDP, length 120
03:12:03.752245 IP 192.168.43.147.8880 > 192.168.43.124.7773: UDP, length 120
03:12:03.780088 IP 192.168.43.146.8880 > 192.168.43.147.7772: UDP, length 120
03:12:03.802241 IP 192.168.43.147.8880 > 192.168.43.124.7773: UDP, length 120
03:12:03.823994 IP 192.168.43.146.8880 > 192.168.43.147.7772: UDP, length 120
03:12:03.852248 IP 192.168.43.147.8880 > 192.168.43.124.7773: UDP, length 120
03:12:03.875344 IP 192.168.43.146.8880 > 192.168.43.147.7772: UDP, length 120
03:12:03.902243 IP 192.168.43.147.8880 > 192.168.43.124.7773: UDP, length 120
03:12:03.929017 IP 192.168.43.146.8880 > 192.168.43.147.7772: UDP, length 120
03:12:03.952246 IP 192.168.43.147.8880 > 192.168.43.124.7773: UDP, length 120
03:12:03.976651 IP 192.168.43.146.8880 > 192.168.43.147.7772: UDP, length 120
03:12:04.002243 IP 192.168.43.147.8880 > 192.168.43.124.7773: UDP, length 120
03:12:04.021441 IP 192.168.43.146.8880 > 192.168.43.147.7772: UDP, length 120
03:12:04.052243 IP 192.168.43.147.8880 > 192.168.43.124.7773: UDP, length 120
03:12:04.080491 IP 192.168.43.146.8880 > 192.168.43.147.7772: UDP, length 120
03:12:04.102242 IP 192.168.43.147.8880 > 192.168.43.124.7773: UDP, length 120
03:12:04.125870 IP 192.168.43.146.8880 > 192.168.43.147.7772: UDP, length 120
03:12:04.152243 IP 192.168.43.147.8880 > 192.168.43.124.7773: UDP, length 120
03:12:04.173172 IP 192.168.43.146.8880 > 192.168.43.147.7772: UDP, length 120
03:12:04.202242 IP 192.168.43.147.8880 > 192.168.43.124.7773: UDP, length 120
03:12:04.244974 IP 192.168.43.146.8880 > 192.168.43.147.7772: UDP, length 120
03:12:04.252242 IP 192.168.43.147.8880 > 192.168.43.124.7773: UDP, length 120
03:12:04.275099 IP 192.168.43.146.8880 > 192.168.43.147.7772: UDP, length 120
03:12:04.302241 IP 192.168.43.147.8880 > 192.168.43.124.7773: UDP, length 120
03:12:04.323555 IP 192.168.43.146.8880 > 192.168.43.147.7772: UDP, length 120
03:12:04.352242 IP 192.168.43.147.8880 > 192.168.43.124.7773: UDP, length 120
03:12:04.384723 IP 192.168.43.146.8880 > 192.168.43.147.7772: UDP, length 120
03:12:04.402243 IP 192.168.43.147.8880 > 192.168.43.124.7773: UDP, length 120
03:12:04.425697 IP 192.168.43.146.8880 > 192.168.43.147.7772: UDP, length 120
03:12:04.452242 IP 192.168.43.147.8880 > 192.168.43.124.7773: UDP, length 120
03:12:04.475577 IP 192.168.43.146.8880 > 192.168.43.147.7772: UDP, length 120
03:12:04.502241 IP 192.168.43.147.8880 > 192.168.43.124.7773: UDP, length 120
03:12:04.531967 IP 192.168.43.146.8880 > 192.168.43.147.7772: UDP, length 120
03:12:04.552243 IP 192.168.43.147.8880 > 192.168.43.124.7773: UDP, length 120
03:12:04.575705 IP 192.168.43.146.8880 > 192.168.43.147.7772: UDP, length 120
03:12:04.602241 IP 192.168.43.147.8880 > 192.168.43.124.7773: UDP, length 120
03:12:04.628166 IP 192.168.43.146.8880 > 192.168.43.147.7772: UDP, length 120
03:12:04.652243 IP 192.168.43.147.8880 > 192.168.43.124.7773: UDP, length 120
03:12:04.679275 IP 192.168.43.146.8880 > 192.168.43.147.7772: UDP, length 120
03:12:04.702242 IP 192.168.43.147.8880 > 192.168.43.124.7773: UDP, length 120
03:12:04.725829 IP 192.168.43.146.8880 > 192.168.43.147.7772: UDP, length 120
03:12:04.752245 IP 192.168.43.147.8880 > 192.168.43.124.7773: UDP, length 120
03:12:04.771287 IP 192.168.43.146.8880 > 192.168.43.147.7772: UDP, length 120
03:12:04.802254 IP 192.168.43.147.8880 > 192.168.43.124.7773: UDP, length 120
03:12:04.827324 IP 192.168.43.146.8880 > 192.168.43.147.7772: UDP, length 120
03:12:04.852272 IP 192.168.43.147.8880 > 192.168.43.124.7773: UDP, length 120
03:12:04.885528 IP 192.168.43.146.8880 > 192.168.43.147.7772: UDP, length 120
03:12:04.902255 IP 192.168.43.147.8880 > 192.168.43.124.7773: UDP, length 120
03:12:04.925299 IP 192.168.43.146.8880 > 192.168.43.147.7772: UDP, length 120
03:12:04.952351 IP 192.168.43.147.8880 > 192.168.43.124.7773: UDP, length 120
03:12:04.979727 IP 192.168.43.146.8880 > 192.168.43.147.7772: UDP, length 120
03:12:05.002304 IP 192.168.43.147.8880 > 192.168.43.124.7773: UDP, length 120
03:12:05.025806 IP 192.168.43.146.8880 > 192.168.43.147.7772: UDP, length 120
03:12:05.052320 IP 192.168.43.147.8880 > 192.168.43.124.7773: UDP, length 120
03:12:05.076564 IP 192.168.43.146.8880 > 192.168.43.147.7772: UDP, length 120
03:12:05.102313 IP 192.168.43.147.8880 > 192.168.43.124.7773: UDP, length 120
03:12:05.129977 IP 192.168.43.146.8880 > 192.168.43.147.7772: UDP, length 120
03:12:05.152331 IP 192.168.43.147.8880 > 192.168.43.124.7773: UDP, length 120
03:12:05.190571 IP 192.168.43.146.8880 > 192.168.43.147.7772: UDP, length 120
03:12:05.202320 IP 192.168.43.147.8880 > 192.168.43.124.7773: UDP, length 120
03:12:05.221676 IP 192.168.43.146.8880 > 192.168.43.147.7772: UDP, length 120
03:12:05.252340 IP 192.168.43.147.8880 > 192.168.43.124.7773: UDP, length 120
03:12:05.272132 IP 192.168.43.146.8880 > 192.168.43.147.7772: UDP, length 120
03:12:05.302328 IP 192.168.43.147.8880 > 192.168.43.124.7773: UDP, length 120
03:12:05.330728 IP 192.168.43.146.8880 > 192.168.43.147.7772: UDP, length 120
03:12:05.352281 IP 192.168.43.147.8880 > 192.168.43.124.7773: UDP, length 120
03:12:05.374151 IP 192.168.43.146.8880 > 192.168.43.147.7772: UDP, length 120
03:12:05.402249 IP 192.168.43.147.8880 > 192.168.43.124.7773: UDP, length 120
03:12:05.424057 IP 192.168.43.146.8880 > 192.168.43.147.7772: UDP, length 120
03:12:05.452245 IP 192.168.43.147.8880 > 192.168.43.124.7773: UDP, length 120
03:12:05.478097 IP 192.168.43.146.8880 > 192.168.43.147.7772: UDP, length 120
03:12:05.502241 IP 192.168.43.147.8880 > 192.168.43.124.7773: UDP, length 120
03:12:05.524325 IP 192.168.43.146.8880 > 192.168.43.147.7772: UDP, length 120
03:12:05.552242 IP 192.168.43.147.8880 > 192.168.43.124.7773: UDP, length 120
03:12:05.576436 IP 192.168.43.146.8880 > 192.168.43.147.7772: UDP, length 120
03:12:05.602241 IP 192.168.43.147.8880 > 192.168.43.124.7773: UDP, length 120
03:12:05.628551 IP 192.168.43.146.8880 > 192.168.43.147.7772: UDP, length 120
03:12:05.652244 IP 192.168.43.147.8880 > 192.168.43.124.7773: UDP, length 120
03:12:05.698260 IP 192.168.43.146.8880 > 192.168.43.147.7772: UDP, length 120
03:12:05.702241 IP 192.168.43.147.8880 > 192.168.43.124.7773: UDP, length 120
03:12:05.724638 IP 192.168.43.146.8880 > 192.168.43.147.7772: UDP, length 120
03:12:05.752242 IP 192.168.43.147.8880 > 192.168.43.124.7773: UDP, length 120
03:12:05.774194 IP 192.168.43.146.8880 > 192.168.43.147.7772: UDP, length 120
03:12:05.802253 IP 192.168.43.147.8880 > 192.168.43.124.7773: UDP, length 120
03:12:05.841870 IP 192.168.43.146.8880 > 192.168.43.147.7772: UDP, length 120
03:12:05.852255 IP 192.168.43.147.8880 > 192.168.43.124.7773: UDP, length 120
03:12:05.874400 IP 192.168.43.146.8880 > 192.168.43.147.7772: UDP, length 120
03:12:05.902242 IP 192.168.43.147.8880 > 192.168.43.124.7773: UDP, length 120
03:12:05.923402 IP 192.168.43.146.8880 > 192.168.43.147.7772: UDP, length 120
03:12:05.952243 IP 192.168.43.147.8880 > 192.168.43.124.7773: UDP, length 120
03:12:05.980640 IP 192.168.43.146.8880 > 192.168.43.147.7772: UDP, length 120
03:12:06.002242 IP 192.168.43.147.8880 > 192.168.43.124.7773: UDP, length 120
03:12:06.025231 IP 192.168.43.146.8880 > 192.168.43.147.7772: UDP, length 120
03:12:06.052242 IP 192.168.43.147.8880 > 192.168.43.124.7773: UDP, length 120
03:12:06.074682 IP 192.168.43.146.8880 > 192.168.43.147.7772: UDP, length 120
03:12:06.102242 IP 192.168.43.147.8880 > 192.168.43.124.7773: UDP, length 120
03:12:06.129122 IP 192.168.43.146.8880 > 192.168.43.147.7772: UDP, length 120
03:12:06.152242 IP 192.168.43.147.8880 > 192.168.43.124.7773: UDP, length 120
03:12:06.198058 IP 192.168.43.146.8880 > 192.168.43.147.7772: UDP, length 120
03:12:06.202245 IP 192.168.43.147.8880 > 192.168.43.124.7773: UDP, length 120
03:12:06.230346 IP 192.168.43.146.8880 > 192.168.43.147.7772: UDP, length 120
03:12:06.252242 IP 192.168.43.147.8880 > 192.168.43.124.7773: UDP, length 120
03:12:06.274866 IP 192.168.43.146.8880 > 192.168.43.147.7772: UDP, length 120
03:12:06.302241 IP 192.168.43.147.8880 > 192.168.43.124.7773: UDP, length 120
03:12:06.342381 IP 192.168.43.146.8880 > 192.168.43.147.7772: UDP, length 120
03:12:06.352241 IP 192.168.43.147.8880 > 192.168.43.124.7773: UDP, length 120
03:12:06.384645 IP 192.168.43.146.8880 > 192.168.43.147.7772: UDP, length 120
03:12:06.402241 IP 192.168.43.147.8880 > 192.168.43.124.7773: UDP, length 120
03:12:06.422330 IP 192.168.43.146.8880 > 192.168.43.147.7772: UDP, length 120
03:12:06.452280 IP 192.168.43.147.8880 > 192.168.43.124.7773: UDP, length 120
03:12:06.484977 IP 192.168.43.146.8880 > 192.168.43.147.7772: UDP, length 120
03:12:06.502253 IP 192.168.43.147.8880 > 192.168.43.124.7773: UDP, length 120
03:12:06.525313 IP 192.168.43.146.8880 > 192.168.43.147.7772: UDP, length 120
03:12:06.552243 IP 192.168.43.147.8880 > 192.168.43.124.7773: UDP, length 120
03:12:06.575043 IP 192.168.43.146.8880 > 192.168.43.147.7772: UDP, length 120
03:12:06.602241 IP 192.168.43.147.8880 > 192.168.43.124.7773: UDP, length 120
03:12:06.628512 IP 192.168.43.146.8880 > 192.168.43.147.7772: UDP, length 120
03:12:06.652243 IP 192.168.43.147.8880 > 192.168.43.124.7773: UDP, length 120
03:12:06.675445 IP 192.168.43.146.8880 > 192.168.43.147.7772: UDP, length 120
03:12:06.702241 IP 192.168.43.147.8880 > 192.168.43.124.7773: UDP, length 120
03:12:06.725564 IP 192.168.43.146.8880 > 192.168.43.147.7772: UDP, length 120
03:12:06.752244 IP 192.168.43.147.8880 > 192.168.43.124.7773: UDP, length 120
03:12:06.780461 IP 192.168.43.146.8880 > 192.168.43.147.7772: UDP, length 120
03:12:06.802243 IP 192.168.43.147.8880 > 192.168.43.124.7773: UDP, length 120
03:12:06.824409 IP 192.168.43.146.8880 > 192.168.43.147.7772: UDP, length 120
03:12:06.852264 IP 192.168.43.147.8880 > 192.168.43.124.7773: UDP, length 120
03:12:06.871670 IP 192.168.43.146.8880 > 192.168.43.147.7772: UDP, length 120
03:12:06.902277 IP 192.168.43.147.8880 > 192.168.43.124.7773: UDP, length 120
03:12:06.930441 IP 192.168.43.146.8880 > 192.168.43.147.7772: UDP, length 120
03:12:06.952272 IP 192.168.43.147.8880 > 192.168.43.124.7773: UDP, length 120
03:12:06.968810 IP 192.168.43.146.8880 > 192.168.43.147.7772: UDP, length 120
03:12:07.002270 IP 192.168.43.147.8880 > 192.168.43.124.7773: UDP, length 120
03:12:07.024825 IP 192.168.43.146.8880 > 192.168.43.147.7772: UDP, length 120
03:12:07.052268 IP 192.168.43.147.8880 > 192.168.43.124.7773: UDP, length 120
03:12:07.075094 IP 192.168.43.146.8880 > 192.168.43.147.7772: UDP, length 120
03:12:07.102267 IP 192.168.43.147.8880 > 192.168.43.124.7773: UDP, length 120
03:12:07.131066 IP 192.168.43.146.8880 > 192.168.43.147.7772: UDP, length 120
03:12:07.152268 IP 192.168.43.147.8880 > 192.168.43.124.7773: UDP, length 120
03:12:07.176487 IP 192.168.43.146.8880 > 192.168.43.147.7772: UDP, length 120
03:12:07.202267 IP 192.168.43.147.8880 > 192.168.43.124.7773: UDP, length 120
03:12:07.229469 IP 192.168.43.146.8880 > 192.168.43.147.7772: UDP, length 120
03:12:07.252268 IP 192.168.43.147.8880 > 192.168.43.124.7773: UDP, length 120
03:12:07.278021 IP 192.168.43.146.8880 > 192.168.43.147.7772: UDP, length 120
03:12:07.302268 IP 192.168.43.147.8880 > 192.168.43.124.7773: UDP, length 120
03:12:07.326659 IP 192.168.43.146.8880 > 192.168.43.147.7772: UDP, length 120
03:12:07.352268 IP 192.168.43.147.8880 > 192.168.43.124.7773: UDP, length 120
03:12:07.375020 IP 192.168.43.146.8880 > 192.168.43.147.7772: UDP, length 120
03:12:07.402267 IP 192.168.43.147.8880 > 192.168.43.124.7773: UDP, length 120
03:12:07.429259 IP 192.168.43.146.8880 > 192.168.43.147.7772: UDP, length 120
03:12:07.452268 IP 192.168.43.147.8880 > 192.168.43.124.7773: UDP, length 120
03:12:07.471569 IP 192.168.43.146.8880 > 192.168.43.147.7772: UDP, length 120
03:12:07.502266 IP 192.168.43.147.8880 > 192.168.43.124.7773: UDP, length 120
03:12:07.526335 IP 192.168.43.146.8880 > 192.168.43.147.7772: UDP, length 120
03:12:07.552268 IP 192.168.43.147.8880 > 192.168.43.124.7773: UDP, length 120
03:12:07.589281 IP 192.168.43.146.8880 > 192.168.43.147.7772: UDP, length 120
03:12:07.602266 IP 192.168.43.147.8880 > 192.168.43.124.7773: UDP, length 120
03:12:07.652267 IP 192.168.43.147.8880 > 192.168.43.124.7773: UDP, length 120
03:12:07.658892 IP 192.168.43.146.8880 > 192.168.43.147.7772: UDP, length 120
03:12:07.702266 IP 192.168.43.147.8880 > 192.168.43.124.7773: UDP, length 120
03:12:07.705660 IP 192.168.43.146.8880 > 192.168.43.147.7772: UDP, length 120
03:12:07.752268 IP 192.168.43.147.8880 > 192.168.43.124.7773: UDP, length 120
03:12:07.764537 IP 192.168.43.146.8880 > 192.168.43.147.7772: UDP, length 120
03:12:07.800281 IP 192.168.43.146.8880 > 192.168.43.147.7772: UDP, length 120
03:12:07.802267 IP 192.168.43.147.8880 > 192.168.43.124.7773: UDP, length 120
03:12:07.852276 IP 192.168.43.147.8880 > 192.168.43.124.7773: UDP, length 120
03:12:07.876145 IP 192.168.43.146.8880 > 192.168.43.147.7772: UDP, length 120
03:12:07.902280 IP 192.168.43.147.8880 > 192.168.43.124.7773: UDP, length 120
03:12:07.952295 IP 192.168.43.147.8880 > 192.168.43.124.7773: UDP, length 120
03:12:07.985675 IP 192.168.43.146.8880 > 192.168.43.147.7772: UDP, length 120
03:12:07.985813 IP 192.168.43.146.8880 > 192.168.43.147.7772: UDP, length 120
03:12:08.002301 IP 192.168.43.147.8880 > 192.168.43.124.7773: UDP, length 120
03:12:08.052267 IP 192.168.43.147.8880 > 192.168.43.124.7773: UDP, length 120
03:12:08.055672 IP 192.168.43.146.8880 > 192.168.43.147.7772: UDP, length 120
03:12:08.074067 IP 192.168.43.146.8880 > 192.168.43.147.7772: UDP, length 120
03:12:08.102274 IP 192.168.43.147.8880 > 192.168.43.124.7773: UDP, length 120
03:12:08.152270 IP 192.168.43.147.8880 > 192.168.43.124.7773: UDP, length 120
03:12:08.172179 IP 192.168.43.146.8880 > 192.168.43.147.7772: UDP, length 120
03:12:08.202267 IP 192.168.43.147.8880 > 192.168.43.124.7773: UDP, length 120
03:12:08.252267 IP 192.168.43.147.8880 > 192.168.43.124.7773: UDP, length 120
03:12:08.294322 IP 192.168.43.146.8880 > 192.168.43.147.7772: UDP, length 120
03:12:08.294453 IP 192.168.43.146.8880 > 192.168.43.147.7772: UDP, length 120
03:12:08.302265 IP 192.168.43.147.8880 > 192.168.43.124.7773: UDP, length 120
03:12:08.352273 IP 192.168.43.147.8880 > 192.168.43.124.7773: UDP, length 120
03:12:08.361444 IP 192.168.43.146.8880 > 192.168.43.147.7772: UDP, length 120
03:12:08.380708 IP 192.168.43.146.8880 > 192.168.43.147.7772: UDP, length 120
03:12:08.402272 IP 192.168.43.147.8880 > 192.168.43.124.7773: UDP, length 120
03:12:08.433358 IP 192.168.43.146.8880 > 192.168.43.147.7772: UDP, length 120
03:12:08.452265 IP 192.168.43.147.8880 > 192.168.43.124.7773: UDP, length 120
03:12:08.502264 IP 192.168.43.147.8880 > 192.168.43.124.7773: UDP, length 120
03:12:08.504534 IP 192.168.43.146.8880 > 192.168.43.147.7772: UDP, length 120
03:12:08.552267 IP 192.168.43.147.8880 > 192.168.43.124.7773: UDP, length 120
03:12:08.586319 IP 192.168.43.146.8880 > 192.168.43.147.7772: UDP, length 120
03:12:08.586451 IP 192.168.43.146.8880 > 192.168.43.147.7772: UDP, length 120
03:12:08.602273 IP 192.168.43.147.8880 > 192.168.43.124.7773: UDP, length 120
03:12:08.652276 IP 192.168.43.147.8880 > 192.168.43.124.7773: UDP, length 120
03:12:08.698309 IP 192.168.43.146.8880 > 192.168.43.147.7772: UDP, length 120
03:12:08.698447 IP 192.168.43.146.8880 > 192.168.43.147.7772: UDP, length 120
03:12:08.702265 IP 192.168.43.147.8880 > 192.168.43.124.7773: UDP, length 120
03:12:08.752268 IP 192.168.43.147.8880 > 192.168.43.124.7773: UDP, length 120
03:12:08.790265 IP 192.168.43.146.8880 > 192.168.43.147.7772: UDP, length 120
03:12:08.790395 IP 192.168.43.146.8880 > 192.168.43.147.7772: UDP, length 120
03:12:08.802264 IP 192.168.43.147.8880 > 192.168.43.124.7773: UDP, length 120
03:12:08.844149 IP 192.168.43.146.8880 > 192.168.43.147.7772: UDP, length 120
03:12:08.852280 IP 192.168.43.147.8880 > 192.168.43.124.7773: UDP, length 120
03:12:08.878146 IP 192.168.43.146.8880 > 192.168.43.147.7772: UDP, length 120
03:12:08.902277 IP 192.168.43.147.8880 > 192.168.43.124.7773: UDP, length 120
03:12:08.952267 IP 192.168.43.147.8880 > 192.168.43.124.7773: UDP, length 120
03:12:08.957642 IP 192.168.43.146.8880 > 192.168.43.147.7772: UDP, length 120
03:12:09.002277 IP 192.168.43.147.8880 > 192.168.43.124.7773: UDP, length 120
03:12:09.004837 IP 192.168.43.146.8880 > 192.168.43.147.7772: UDP, length 120
03:12:09.021696 IP 192.168.43.146.8880 > 192.168.43.147.7772: UDP, length 120
03:12:09.052272 IP 192.168.43.147.8880 > 192.168.43.124.7773: UDP, length 120
03:12:09.097287 IP 192.168.43.146.8880 > 192.168.43.147.7772: UDP, length 120
03:12:09.102270 IP 192.168.43.147.8880 > 192.168.43.124.7773: UDP, length 120
03:12:09.146185 IP 192.168.43.146.8880 > 192.168.43.147.7772: UDP, length 120
03:12:09.152265 IP 192.168.43.147.8880 > 192.168.43.124.7773: UDP, length 120
03:12:09.202267 IP 192.168.43.147.8880 > 192.168.43.124.7773: UDP, length 120
03:12:09.213142 IP 192.168.43.146.8880 > 192.168.43.147.7772: UDP, length 120
03:12:09.223768 IP 192.168.43.146.8880 > 192.168.43.147.7772: UDP, length 120
03:12:09.252270 IP 192.168.43.147.8880 > 192.168.43.124.7773: UDP, length 120
03:12:09.302267 IP 192.168.43.147.8880 > 192.168.43.124.7773: UDP, length 120
03:12:09.312251 IP 192.168.43.146.8880 > 192.168.43.147.7772: UDP, length 120
03:12:09.318627 IP 192.168.43.146.8880 > 192.168.43.147.7772: UDP, length 120
03:12:09.352273 IP 192.168.43.147.8880 > 192.168.43.124.7773: UDP, length 120
03:12:09.402269 IP 192.168.43.147.8880 > 192.168.43.124.7773: UDP, length 120
03:12:09.403852 IP 192.168.43.146.8880 > 192.168.43.147.7772: UDP, length 120
03:12:09.449102 IP 192.168.43.146.8880 > 192.168.43.147.7772: UDP, length 120
03:12:09.452268 IP 192.168.43.147.8880 > 192.168.43.124.7773: UDP, length 120
03:12:09.502312 IP 192.168.43.147.8880 > 192.168.43.124.7773: UDP, length 120
03:12:09.512832 IP 192.168.43.146.8880 > 192.168.43.147.7772: UDP, length 120
03:12:09.523564 IP 192.168.43.146.8880 > 192.168.43.147.7772: UDP, length 120
03:12:09.552278 IP 192.168.43.147.8880 > 192.168.43.124.7773: UDP, length 120
03:12:09.585904 IP 192.168.43.146.8880 > 192.168.43.147.7772: UDP, length 120
03:12:09.602268 IP 192.168.43.147.8880 > 192.168.43.124.7773: UDP, length 120
03:12:09.626794 IP 192.168.43.146.8880 > 192.168.43.147.7772: UDP, length 120
03:12:09.652270 IP 192.168.43.147.8880 > 192.168.43.124.7773: UDP, length 120
03:12:09.702264 IP 192.168.43.147.8880 > 192.168.43.124.7773: UDP, length 120
03:12:09.728771 IP 192.168.43.146.8880 > 192.168.43.147.7772: UDP, length 120
03:12:09.728893 IP 192.168.43.146.8880 > 192.168.43.147.7772: UDP, length 120
03:12:09.752276 IP 192.168.43.147.8880 > 192.168.43.124.7773: UDP, length 120
03:12:09.802268 IP 192.168.43.147.8880 > 192.168.43.124.7773: UDP, length 120
03:12:09.811247 IP 192.168.43.146.8880 > 192.168.43.147.7772: UDP, length 120
03:12:09.831507 IP 192.168.43.146.8880 > 192.168.43.147.7772: UDP, length 120
03:12:09.852299 IP 192.168.43.147.8880 > 192.168.43.124.7773: UDP, length 120
03:12:09.902272 IP 192.168.43.147.8880 > 192.168.43.124.7773: UDP, length 120
03:12:09.925272 IP 192.168.43.146.8880 > 192.168.43.147.7772: UDP, length 120
03:12:09.952275 IP 192.168.43.147.8880 > 192.168.43.124.7773: UDP, length 120
03:12:10.002266 IP 192.168.43.147.8880 > 192.168.43.124.7773: UDP, length 120
03:12:10.029803 IP 192.168.43.146.8880 > 192.168.43.147.7772: UDP, length 120
03:12:10.029930 IP 192.168.43.146.8880 > 192.168.43.147.7772: UDP, length 120
03:12:10.052282 IP 192.168.43.147.8880 > 192.168.43.124.7773: UDP, length 120
03:12:10.102268 IP 192.168.43.147.8880 > 192.168.43.124.7773: UDP, length 120
03:12:10.122114 IP 192.168.43.146.8880 > 192.168.43.147.7772: UDP, length 120
03:12:10.122234 IP 192.168.43.146.8880 > 192.168.43.147.7772: UDP, length 120
03:12:10.152268 IP 192.168.43.147.8880 > 192.168.43.124.7773: UDP, length 120
03:12:10.202267 IP 192.168.43.147.8880 > 192.168.43.124.7773: UDP, length 120
03:12:10.205976 IP 192.168.43.146.8880 > 192.168.43.147.7772: UDP, length 120
03:12:10.224356 IP 192.168.43.146.8880 > 192.168.43.147.7772: UDP, length 120
03:12:10.252268 IP 192.168.43.147.8880 > 192.168.43.124.7773: UDP, length 120
03:12:10.302268 IP 192.168.43.147.8880 > 192.168.43.124.7773: UDP, length 120
03:12:10.308862 IP 192.168.43.146.8880 > 192.168.43.147.7772: UDP, length 120
03:12:10.322866 IP 192.168.43.146.8880 > 192.168.43.147.7772: UDP, length 120
03:12:10.352324 IP 192.168.43.147.8880 > 192.168.43.124.7773: UDP, length 120
03:12:10.395017 IP 192.168.43.146.8880 > 192.168.43.147.7772: UDP, length 120
03:12:10.402431 IP 192.168.43.147.8880 > 192.168.43.124.7773: UDP, length 120
03:12:10.450113 IP 192.168.43.146.8880 > 192.168.43.147.7772: UDP, length 120
03:12:10.452334 IP 192.168.43.147.8880 > 192.168.43.124.7773: UDP, length 120
03:12:10.486577 IP 192.168.43.146.8880 > 192.168.43.147.7772: UDP, length 120
03:12:10.502312 IP 192.168.43.147.8880 > 192.168.43.124.7773: UDP, length 120
03:12:10.552314 IP 192.168.43.147.8880 > 192.168.43.124.7773: UDP, length 120
03:12:10.602330 IP 192.168.43.147.8880 > 192.168.43.124.7773: UDP, length 120
03:12:10.634276 IP 192.168.43.146.8880 > 192.168.43.147.7772: UDP, length 120
03:12:10.634519 IP 192.168.43.146.8880 > 192.168.43.147.7772: UDP, length 120
03:12:10.634629 IP 192.168.43.146.8880 > 192.168.43.147.7772: UDP, length 120
03:12:10.652325 IP 192.168.43.147.8880 > 192.168.43.124.7773: UDP, length 120
03:12:10.680150 IP 192.168.43.146.8880 > 192.168.43.147.7772: UDP, length 120
03:12:10.702353 IP 192.168.43.147.8880 > 192.168.43.124.7773: UDP, length 120
03:12:10.726850 IP 192.168.43.146.8880 > 192.168.43.147.7772: UDP, length 120
03:12:10.752306 IP 192.168.43.147.8880 > 192.168.43.124.7773: UDP, length 120
03:12:10.801621 IP 192.168.43.146.8880 > 192.168.43.147.7772: UDP, length 120
03:12:10.802298 IP 192.168.43.147.8880 > 192.168.43.124.7773: UDP, length 120
03:12:10.835886 IP 192.168.43.146.8880 > 192.168.43.147.7772: UDP, length 120
03:12:10.852281 IP 192.168.43.147.8880 > 192.168.43.124.7773: UDP, length 120
03:12:10.900598 IP 192.168.43.146.8880 > 192.168.43.147.7772: UDP, length 120
03:12:10.902246 IP 192.168.43.147.8880 > 192.168.43.124.7773: UDP, length 120
03:12:10.938762 IP 192.168.43.146.8880 > 192.168.43.147.7772: UDP, length 120
03:12:10.952245 IP 192.168.43.147.8880 > 192.168.43.124.7773: UDP, length 120
03:12:10.975940 IP 192.168.43.146.8880 > 192.168.43.147.7772: UDP, length 120
03:12:11.002271 IP 192.168.43.147.8880 > 192.168.43.124.7773: UDP, length 120
03:12:11.039717 IP 192.168.43.146.8880 > 192.168.43.147.7772: UDP, length 120
03:12:11.052246 IP 192.168.43.147.8880 > 192.168.43.124.7773: UDP, length 120
03:12:11.074447 IP 192.168.43.146.8880 > 192.168.43.147.7772: UDP, length 120
03:12:11.102253 IP 192.168.43.147.8880 > 192.168.43.124.7773: UDP, length 120
03:12:11.121414 IP 192.168.43.146.8880 > 192.168.43.147.7772: UDP, length 120
03:12:11.152250 IP 192.168.43.147.8880 > 192.168.43.124.7773: UDP, length 120
03:12:11.181591 IP 192.168.43.146.8880 > 192.168.43.147.7772: UDP, length 120
03:12:11.202245 IP 192.168.43.147.8880 > 192.168.43.124.7773: UDP, length 120
03:12:11.224339 IP 192.168.43.146.8880 > 192.168.43.147.7772: UDP, length 120
03:12:11.252246 IP 192.168.43.147.8880 > 192.168.43.124.7773: UDP, length 120
03:12:11.274266 IP 192.168.43.146.8880 > 192.168.43.147.7772: UDP, length 120
03:12:11.302244 IP 192.168.43.147.8880 > 192.168.43.124.7773: UDP, length 120
03:12:11.328198 IP 192.168.43.146.8880 > 192.168.43.147.7772: UDP, length 120
03:12:11.352241 IP 192.168.43.147.8880 > 192.168.43.124.7773: UDP, length 120
03:12:11.375792 IP 192.168.43.146.8880 > 192.168.43.147.7772: UDP, length 120
03:12:11.402242 IP 192.168.43.147.8880 > 192.168.43.124.7773: UDP, length 120
03:12:11.426779 IP 192.168.43.146.8880 > 192.168.43.147.7772: UDP, length 120
03:12:11.452243 IP 192.168.43.147.8880 > 192.168.43.124.7773: UDP, length 120
03:12:11.480586 IP 192.168.43.146.8880 > 192.168.43.147.7772: UDP, length 120
03:12:11.502242 IP 192.168.43.147.8880 > 192.168.43.124.7773: UDP, length 120
03:12:11.551350 IP 192.168.43.146.8880 > 192.168.43.147.7772: UDP, length 120
03:12:11.552243 IP 192.168.43.147.8880 > 192.168.43.124.7773: UDP, length 120
03:12:11.574179 IP 192.168.43.146.8880 > 192.168.43.147.7772: UDP, length 120
03:12:11.602243 IP 192.168.43.147.8880 > 192.168.43.124.7773: UDP, length 120
03:12:11.624311 IP 192.168.43.146.8880 > 192.168.43.147.7772: UDP, length 120
03:12:11.652249 IP 192.168.43.147.8880 > 192.168.43.124.7773: UDP, length 120
03:12:11.690888 IP 192.168.43.146.8880 > 192.168.43.147.7772: UDP, length 120
03:12:11.702243 IP 192.168.43.147.8880 > 192.168.43.124.7773: UDP, length 120
03:12:11.724812 IP 192.168.43.146.8880 > 192.168.43.147.7772: UDP, length 120
03:12:11.752244 IP 192.168.43.147.8880 > 192.168.43.124.7773: UDP, length 120
03:12:11.771305 IP 192.168.43.146.8880 > 192.168.43.147.7772: UDP, length 120
03:12:11.802243 IP 192.168.43.147.8880 > 192.168.43.124.7773: UDP, length 120
03:12:11.832098 IP 192.168.43.146.8880 > 192.168.43.147.7772: UDP, length 120
03:12:11.852249 IP 192.168.43.147.8880 > 192.168.43.124.7773: UDP, length 120
03:12:11.868563 IP 192.168.43.146.8880 > 192.168.43.147.7772: UDP, length 120
03:12:11.902277 IP 192.168.43.147.8880 > 192.168.43.124.7773: UDP, length 120
03:12:11.925319 IP 192.168.43.146.8880 > 192.168.43.147.7772: UDP, length 120
03:12:11.952273 IP 192.168.43.147.8880 > 192.168.43.124.7773: UDP, length 120
03:12:11.974299 IP 192.168.43.146.8880 > 192.168.43.147.7772: UDP, length 120
03:12:12.002269 IP 192.168.43.147.8880 > 192.168.43.124.7773: UDP, length 120
03:12:12.037765 IP 192.168.43.146.8880 > 192.168.43.147.7772: UDP, length 120
03:12:12.052267 IP 192.168.43.147.8880 > 192.168.43.124.7773: UDP, length 120
03:12:12.074511 IP 192.168.43.146.8880 > 192.168.43.147.7772: UDP, length 120
03:12:12.102267 IP 192.168.43.147.8880 > 192.168.43.124.7773: UDP, length 120
03:12:12.121462 IP 192.168.43.146.8880 > 192.168.43.147.7772: UDP, length 120
03:12:12.152281 IP 192.168.43.147.8880 > 192.168.43.124.7773: UDP, length 120
03:12:12.178926 IP 192.168.43.146.8880 > 192.168.43.147.7772: UDP, length 120
03:12:12.202274 IP 192.168.43.147.8880 > 192.168.43.124.7773: UDP, length 120
03:12:12.224714 IP 192.168.43.146.8880 > 192.168.43.147.7772: UDP, length 120
03:12:12.252266 IP 192.168.43.147.8880 > 192.168.43.124.7773: UDP, length 120
03:12:12.274423 IP 192.168.43.146.8880 > 192.168.43.147.7772: UDP, length 120
03:12:12.302267 IP 192.168.43.147.8880 > 192.168.43.124.7773: UDP, length 120
03:12:12.329053 IP 192.168.43.146.8880 > 192.168.43.147.7772: UDP, length 120
03:12:12.352267 IP 192.168.43.147.8880 > 192.168.43.124.7773: UDP, length 120
03:12:12.374457 IP 192.168.43.146.8880 > 192.168.43.147.7772: UDP, length 120
03:12:12.402267 IP 192.168.43.147.8880 > 192.168.43.124.7773: UDP, length 120
03:12:12.427581 IP 192.168.43.146.8880 > 192.168.43.147.7772: UDP, length 120
03:12:12.452267 IP 192.168.43.147.8880 > 192.168.43.124.7773: UDP, length 120
03:12:12.478284 IP 192.168.43.146.8880 > 192.168.43.147.7772: UDP, length 120
03:12:12.502313 IP 192.168.43.147.8880 > 192.168.43.124.7773: UDP, length 120
03:12:12.550035 IP 192.168.43.146.8880 > 192.168.43.147.7772: UDP, length 120
03:12:12.552266 IP 192.168.43.147.8880 > 192.168.43.124.7773: UDP, length 120
03:12:12.579319 IP 192.168.43.146.8880 > 192.168.43.147.7772: UDP, length 120
03:12:12.602267 IP 192.168.43.147.8880 > 192.168.43.124.7773: UDP, length 120
03:12:12.649329 IP 192.168.43.146.8880 > 192.168.43.147.7772: UDP, length 120
03:12:12.652265 IP 192.168.43.147.8880 > 192.168.43.124.7773: UDP, length 120
03:12:12.688280 IP 192.168.43.146.8880 > 192.168.43.147.7772: UDP, length 120
03:12:12.702266 IP 192.168.43.147.8880 > 192.168.43.124.7773: UDP, length 120
03:12:12.752272 IP 192.168.43.147.8880 > 192.168.43.124.7773: UDP, length 120
03:12:12.755932 IP 192.168.43.146.8880 > 192.168.43.147.7772: UDP, length 120
03:12:12.781842 IP 192.168.43.146.8880 > 192.168.43.147.7772: UDP, length 120
03:12:12.802269 IP 192.168.43.147.8880 > 192.168.43.124.7773: UDP, length 120
03:12:12.852274 IP 192.168.43.147.8880 > 192.168.43.124.7773: UDP, length 120
03:12:12.899330 IP 192.168.43.146.8880 > 192.168.43.147.7772: UDP, length 120
03:12:12.899454 IP 192.168.43.146.8880 > 192.168.43.147.7772: UDP, length 120
03:12:12.902269 IP 192.168.43.147.8880 > 192.168.43.124.7773: UDP, length 120
03:12:12.929538 IP 192.168.43.146.8880 > 192.168.43.147.7772: UDP, length 120
03:12:12.952269 IP 192.168.43.147.8880 > 192.168.43.124.7773: UDP, length 120
03:12:12.979753 IP 192.168.43.146.8880 > 192.168.43.147.7772: UDP, length 120
03:12:13.002269 IP 192.168.43.147.8880 > 192.168.43.124.7773: UDP, length 120
03:12:13.039911 IP 192.168.43.146.8880 > 192.168.43.147.7772: UDP, length 120
03:12:13.052268 IP 192.168.43.147.8880 > 192.168.43.124.7773: UDP, length 120
03:12:13.074881 IP 192.168.43.146.8880 > 192.168.43.147.7772: UDP, length 120
03:12:13.102269 IP 192.168.43.147.8880 > 192.168.43.124.7773: UDP, length 120
03:12:13.121493 IP 192.168.43.146.8880 > 192.168.43.147.7772: UDP, length 120
03:12:13.152269 IP 192.168.43.147.8880 > 192.168.43.124.7773: UDP, length 120
03:12:13.181017 IP 192.168.43.146.8880 > 192.168.43.147.7772: UDP, length 120
03:12:13.202277 IP 192.168.43.147.8880 > 192.168.43.124.7773: UDP, length 120
03:12:13.224534 IP 192.168.43.146.8880 > 192.168.43.147.7772: UDP, length 120
03:12:13.252269 IP 192.168.43.147.8880 > 192.168.43.124.7773: UDP, length 120
03:12:13.271377 IP 192.168.43.146.8880 > 192.168.43.147.7772: UDP, length 120
03:12:13.302268 IP 192.168.43.147.8880 > 192.168.43.124.7773: UDP, length 120
03:12:13.329041 IP 192.168.43.146.8880 > 192.168.43.147.7772: UDP, length 120
03:12:13.352268 IP 192.168.43.147.8880 > 192.168.43.124.7773: UDP, length 120
03:12:13.374275 IP 192.168.43.146.8880 > 192.168.43.147.7772: UDP, length 120
03:12:13.402268 IP 192.168.43.147.8880 > 192.168.43.124.7773: UDP, length 120
03:12:13.424260 IP 192.168.43.146.8880 > 192.168.43.147.7772: UDP, length 120
03:12:13.452269 IP 192.168.43.147.8880 > 192.168.43.124.7773: UDP, length 120
03:12:13.478347 IP 192.168.43.146.8880 > 192.168.43.147.7772: UDP, length 120
03:12:13.502268 IP 192.168.43.147.8880 > 192.168.43.124.7773: UDP, length 120
03:12:13.525181 IP 192.168.43.146.8880 > 192.168.43.147.7772: UDP, length 120
03:12:13.552267 IP 192.168.43.147.8880 > 192.168.43.124.7773: UDP, length 120
03:12:13.579461 IP 192.168.43.146.8880 > 192.168.43.147.7772: UDP, length 120
03:12:13.602267 IP 192.168.43.147.8880 > 192.168.43.124.7773: UDP, length 120
03:12:13.628362 IP 192.168.43.146.8880 > 192.168.43.147.7772: UDP, length 120
03:12:13.652269 IP 192.168.43.147.8880 > 192.168.43.124.7773: UDP, length 120
03:12:13.702271 IP 192.168.43.147.8880 > 192.168.43.124.7773: UDP, length 120
03:12:13.702789 IP 192.168.43.146.8880 > 192.168.43.147.7772: UDP, length 120
03:12:13.724998 IP 192.168.43.146.8880 > 192.168.43.147.7772: UDP, length 120
03:12:13.752269 IP 192.168.43.147.8880 > 192.168.43.124.7773: UDP, length 120
03:12:13.774279 IP 192.168.43.146.8880 > 192.168.43.147.7772: UDP, length 120
03:12:13.802269 IP 192.168.43.147.8880 > 192.168.43.124.7773: UDP, length 120
03:12:13.845562 IP 192.168.43.146.8880 > 192.168.43.147.7772: UDP, length 120
03:12:13.852274 IP 192.168.43.147.8880 > 192.168.43.124.7773: UDP, length 120
03:12:13.871188 IP 192.168.43.146.8880 > 192.168.43.147.7772: UDP, length 120
03:12:13.902270 IP 192.168.43.147.8880 > 192.168.43.124.7773: UDP, length 120
03:12:13.924723 IP 192.168.43.146.8880 > 192.168.43.147.7772: UDP, length 120
03:12:13.952269 IP 192.168.43.147.8880 > 192.168.43.124.7773: UDP, length 120
03:12:13.975094 IP 192.168.43.146.8880 > 192.168.43.147.7772: UDP, length 120
03:12:14.002307 IP 192.168.43.147.8880 > 192.168.43.124.7773: UDP, length 120
03:12:14.028233 IP 192.168.43.146.8880 > 192.168.43.147.7772: UDP, length 120
03:12:14.052270 IP 192.168.43.147.8880 > 192.168.43.124.7773: UDP, length 120
03:12:14.098743 IP 192.168.43.146.8880 > 192.168.43.147.7772: UDP, length 120
03:12:14.102268 IP 192.168.43.147.8880 > 192.168.43.124.7773: UDP, length 120
03:12:14.126528 IP 192.168.43.146.8880 > 192.168.43.147.7772: UDP, length 120
03:12:14.152269 IP 192.168.43.147.8880 > 192.168.43.124.7773: UDP, length 120
03:12:14.190302 IP 192.168.43.146.8880 > 192.168.43.147.7772: UDP, length 120
03:12:14.202268 IP 192.168.43.147.8880 > 192.168.43.124.7773: UDP, length 120
03:12:14.224248 IP 192.168.43.146.8880 > 192.168.43.147.7772: UDP, length 120
03:12:14.252272 IP 192.168.43.147.8880 > 192.168.43.124.7773: UDP, length 120
03:12:14.272472 IP 192.168.43.146.8880 > 192.168.43.147.7772: UDP, length 120
03:12:14.302272 IP 192.168.43.147.8880 > 192.168.43.124.7773: UDP, length 120
03:12:14.333463 IP 192.168.43.146.8880 > 192.168.43.147.7772: UDP, length 120
03:12:14.352272 IP 192.168.43.147.8880 > 192.168.43.124.7773: UDP, length 120
03:12:14.377018 IP 192.168.43.146.8880 > 192.168.43.147.7772: UDP, length 120
03:12:14.402270 IP 192.168.43.147.8880 > 192.168.43.124.7773: UDP, length 120
03:12:14.424605 IP 192.168.43.146.8880 > 192.168.43.147.7772: UDP, length 120
03:12:14.452268 IP 192.168.43.147.8880 > 192.168.43.124.7773: UDP, length 120
03:12:14.479097 IP 192.168.43.146.8880 > 192.168.43.147.7772: UDP, length 120
03:12:14.502268 IP 192.168.43.147.8880 > 192.168.43.124.7773: UDP, length 120
03:12:14.526304 IP 192.168.43.146.8880 > 192.168.43.147.7772: UDP, length 120
03:12:14.552276 IP 192.168.43.147.8880 > 192.168.43.124.7773: UDP, length 120
03:12:14.574465 IP 192.168.43.146.8880 > 192.168.43.147.7772: UDP, length 120
03:12:14.602276 IP 192.168.43.147.8880 > 192.168.43.124.7773: UDP, length 120
03:12:14.626196 IP 192.168.43.146.8880 > 192.168.43.147.7772: UDP, length 120
03:12:14.652266 IP 192.168.43.147.8880 > 192.168.43.124.7773: UDP, length 120
03:12:14.691216 IP 192.168.43.146.8880 > 192.168.43.147.7772: UDP, length 120
03:12:14.702266 IP 192.168.43.147.8880 > 192.168.43.124.7773: UDP, length 120
03:12:14.729197 IP 192.168.43.146.8880 > 192.168.43.147.7772: UDP, length 120
03:12:14.752267 IP 192.168.43.147.8880 > 192.168.43.124.7773: UDP, length 120
03:12:14.773938 IP 192.168.43.146.8880 > 192.168.43.147.7772: UDP, length 120
03:12:14.802274 IP 192.168.43.147.8880 > 192.168.43.124.7773: UDP, length 120
03:12:14.831188 IP 192.168.43.146.8880 > 192.168.43.147.7772: UDP, length 120
03:12:14.852314 IP 192.168.43.147.8880 > 192.168.43.124.7773: UDP, length 120
03:12:14.874464 IP 192.168.43.146.8880 > 192.168.43.147.7772: UDP, length 120
03:12:14.902277 IP 192.168.43.147.8880 > 192.168.43.124.7773: UDP, length 120
03:12:14.921139 IP 192.168.43.146.8880 > 192.168.43.147.7772: UDP, length 120
03:12:14.952270 IP 192.168.43.147.8880 > 192.168.43.124.7773: UDP, length 120
03:12:14.978283 IP 192.168.43.146.8880 > 192.168.43.147.7772: UDP, length 120
03:12:15.002270 IP 192.168.43.147.8880 > 192.168.43.124.7773: UDP, length 120
03:12:15.048099 IP 192.168.43.146.8880 > 192.168.43.147.7772: UDP, length 120
03:12:15.052271 IP 192.168.43.147.8880 > 192.168.43.124.7773: UDP, length 120
03:12:15.075414 IP 192.168.43.146.8880 > 192.168.43.147.7772: UDP, length 120
03:12:15.102273 IP 192.168.43.147.8880 > 192.168.43.124.7773: UDP, length 120
03:12:15.138484 IP 192.168.43.146.8880 > 192.168.43.147.7772: UDP, length 120
03:12:15.152264 IP 192.168.43.147.8880 > 192.168.43.124.7773: UDP, length 120
03:12:15.188543 IP 192.168.43.146.8880 > 192.168.43.147.7772: UDP, length 120
03:12:15.202264 IP 192.168.43.147.8880 > 192.168.43.124.7773: UDP, length 120
03:12:15.221585 IP 192.168.43.146.8880 > 192.168.43.147.7772: UDP, length 120
03:12:15.252267 IP 192.168.43.147.8880 > 192.168.43.124.7773: UDP, length 120
03:12:15.277359 IP 192.168.43.146.8880 > 192.168.43.147.7772: UDP, length 120
03:12:15.302275 IP 192.168.43.147.8880 > 192.168.43.124.7773: UDP, length 120
03:12:15.328993 IP 192.168.43.146.8880 > 192.168.43.147.7772: UDP, length 120
03:12:15.352280 IP 192.168.43.147.8880 > 192.168.43.124.7773: UDP, length 120
03:12:15.399193 IP 192.168.43.146.8880 > 192.168.43.147.7772: UDP, length 120
03:12:15.402273 IP 192.168.43.147.8880 > 192.168.43.124.7773: UDP, length 120
03:12:15.425267 IP 192.168.43.146.8880 > 192.168.43.147.7772: UDP, length 120
03:12:15.452268 IP 192.168.43.147.8880 > 192.168.43.124.7773: UDP, length 120
03:12:15.474788 IP 192.168.43.146.8880 > 192.168.43.147.7772: UDP, length 120
03:12:15.502307 IP 192.168.43.147.8880 > 192.168.43.124.7773: UDP, length 120
03:12:15.538776 IP 192.168.43.146.8880 > 192.168.43.147.7772: UDP, length 120
03:12:15.552268 IP 192.168.43.147.8880 > 192.168.43.124.7773: UDP, length 120
03:12:15.574580 IP 192.168.43.146.8880 > 192.168.43.147.7772: UDP, length 120
03:12:15.602268 IP 192.168.43.147.8880 > 192.168.43.124.7773: UDP, length 120
03:12:15.622727 IP 192.168.43.146.8880 > 192.168.43.147.7772: UDP, length 120
03:12:15.652269 IP 192.168.43.147.8880 > 192.168.43.124.7773: UDP, length 120
03:12:15.675338 IP 192.168.43.146.8880 > 192.168.43.147.7772: UDP, length 120
