03:12:02.256703 IP 192.168.43.124.8880 > 192.168.43.146.7771: UDP, length 120
03:12:02.297185 IP 192.168.43.124.8880 > 192.168.43.146.7771: UDP, length 120
03:12:02.357753 IP 192.168.43.124.8880 > 192.168.43.146.7771: UDP, length 120
03:12:02.397210 IP 192.168.43.124.8880 > 192.168.43.146.7771: UDP, length 120
03:12:02.466209 IP 192.168.43.124.8880 > 192.168.43.146.7771: UDP, length 120
03:12:02.500585 IP 192.168.43.124.8880 > 192.168.43.146.7771: UDP, length 120
03:12:02.557094 IP 192.168.43.124.8880 > 192.168.43.146.7771: UDP, length 120
03:12:02.597179 IP 192.168.43.124.8880 > 192.168.43.146.7771: UDP, length 120
03:12:02.657424 IP 192.168.43.124.8880 > 192.168.43.146.7771: UDP, length 120
03:12:02.697372 IP 192.168.43.124.8880 > 192.168.43.146.7771: UDP, length 120
03:12:02.757372 IP 192.168.43.124.8880 > 192.168.43.146.7771: UDP, length 120
03:12:02.798922 IP 192.168.43.124.8880 > 192.168.43.146.7771: UDP, length 120
03:12:02.847028 IP 192.168.43.124.8880 > 192.168.43.146.7771: UDP, length 120
03:12:02.915583 IP 192.168.43.146.8880 > 192.168.43.147.7772: UDP, length 120
03:12:02.917211 IP 192.168.43.124.8880 > 192.168.43.146.7771: UDP, length 120
03:12:02.948900 IP 192.168.43.124.8880 > 192.168.43.146.7771: UDP, length 120
03:12:02.965628 IP 192.168.43.146.8880 > 192.168.43.147.7772: UDP, length 120
03:12:03.001762 IP 192.168.43.124.8880 > 192.168.43.146.7771: UDP, length 120
03:12:03.015608 IP 192.168.43.146.8880 > 192.168.43.147.7772: UDP, length 120
03:12:03.048644 IP 192.168.43.124.8880 > 192.168.43.146.7771: UDP, length 120
03:12:03.065603 IP 192.168.43.146.8880 > 192.168.43.147.7772: UDP, length 120
03:12:03.111037 IP 192.168.43.124.8880 > 192.168.43.146.7771: UDP, length 120
03:12:03.115604 IP 192.168.43.146.8880 > 192.168.43.147.7772: UDP, length 120
03:12:03.147752 IP 192.168.43.124.8880 > 192.168.43.146.7771: UDP, length 120
03:12:03.165602 IP 192.168.43.146.8880 > 192.168.43.147.7772: UDP, length 120
03:12:03.202695 IP 192.168.43.124.8880 > 192.168.43.146.7771: UDP, length 120
03:12:03.215601 IP 192.168.43.146.8880 > 192.168.43.147.7772: UDP, length 120
03:12:03.258474 IP 192.168.43.124.8880 > 192.168.43.146.7771: UDP, length 120
03:12:03.265602 IP 192.168.43.146.8880 > 192.168.43.147.7772: UDP, length 120
03:12:03.297255 IP 192.168.43.124.8880 > 192.168.43.146.7771: UDP, length 120
03:12:03.315604 IP 192.168.43.146.8880 > 192.168.43.147.7772: UDP, length 120
03:12:03.347832 IP 192.168.43.124.8880 > 192.168.43.146.7771: UDP, length 120
03:12:03.365602 IP 192.168.43.146.8880 > 192.168.43.147.7772: UDP, length 120
03:12:03.407697 IP 192.168.43.124.8880 > 192.168.43.146.7771: UDP, length 120
03:12:03.415603 IP 192.168.43.146.8880 > 192.168.43.147.7772: UDP, length 120
03:12:03.447224 IP 192.168.43.124.8880 > 192.168.43.146.7771: UDP, length 120
03:12:03.465604 IP 192.168.43.146.8880 > 192.168.43.147.7772: UDP, length 120
03:12:03.497623 IP 192.168.43.124.8880 > 192.168.43.146.7771: UDP, length 120
03:12:03.515603 IP 192.168.43.146.8880 > 192.168.43.147.7772: UDP, length 120
03:12:03.549683 IP 192.168.43.124.8880 > 192.168.43.146.7771: UDP, length 120
03:12:03.565604 IP 192.168.43.146.8880 > 192.168.43.147.7772: UDP, length 120
03:12:03.615601 IP 192.168.43.146.8880 > 192.168.43.147.7772: UDP, length 120
03:12:03.617753 IP 192.168.43.124.8880 > 192.168.43.146.7771: UDP, length 120
03:12:03.654776 IP 192.168.43.124.8880 > 192.168.43.146.7771: UDP, length 120
03:12:03.665604 IP 192.168.43.146.8880 > 192.168.43.147.7772: UDP, length 120
03:12:03.697415 IP 192.168.43.124.8880 > 192.168.43.146.7771: UDP, length 120
03:12:03.715603 IP 192.168.43.146.8880 > 192.168.43.147.7772: UDP, length 120
03:12:03.760242 IP 192.168.43.124.8880 > 192.168.43.146.7771: UDP, length 120
03:12:03.765601 IP 192.168.43.146.8880 > 192.168.43.147.7772: UDP, length 120
03:12:03.797151 IP 192.168.43.124.8880 > 192.168.43.146.7771: UDP, length 120
03:12:03.815601 IP 192.168.43.146.8880 > 192.168.43.147.7772: UDP, length 120
03:12:03.847192 IP 192.168.43.124.8880 > 192.168.43.146.7771: UDP, length 120
03:12:03.865602 IP 192.168.43.146.8880 > 192.168.43.147.7772: UDP, length 120
03:12:03.907082 IP 192.168.43.124.8880 > 192.168.43.146.7771: UDP, length 120
03:12:03.915617 IP 192.168.43.146.8880 > 192.168.43.147.7772: UDP, length 120
03:12:03.947172 IP 192.168.43.124.8880 > 192.168.43.146.7771: UDP, length 120
03:12:03.965611 IP 192.168.43.146.8880 > 192.168.43.147.7772: UDP, length 120
03:12:03.996913 IP 192.168.43.124.8880 > 192.168.43.146.7771: UDP, length 120
03:12:04.015605 IP 192.168.43.146.8880 > 192.168.43.147.7772: UDP, length 120
03:12:04.057630 IP 192.168.43.124.8880 > 192.168.43.146.7771: UDP, length 120
03:12:04.065602 IP 192.168.43.146.8880 > 192.168.43.147.7772: UDP, length 120
03:12:04.098538 IP 192.168.43.124.8880 > 192.168.43.146.7771: UDP, length 120
03:12:04.115604 IP 192.168.43.146.8880 > 192.168.43.147.7772: UDP, length 120
03:12:04.147218 IP 192.168.43.124.8880 > 192.168.43.146.7771: UDP, length 120
03:12:04.165604 IP 192.168.43.146.8880 > 192.168.43.147.7772: UDP, length 120
03:12:04.215619 IP 192.168.43.146.8880 > 192.168.43.147.7772: UDP, length 120
03:12:04.217529 IP 192.168.43.124.8880 > 192.168.43.146.7771: UDP, length 120
03:12:04.248417 IP 192.168.43.124.8880 > 192.168.43.146.7771: UDP, length 120
03:12:04.265642 IP 192.168.43.146.8880 > 192.168.43.147.7772: UDP, length 120
03:12:04.297090 IP 192.168.43.124.8880 > 192.168.43.146.7771: UDP, length 120
03:12:04.315607 IP 192.168.43.146.8880 > 192.168.43.147.7772: UDP, length 120
03:12:04.363525 IP 192.168.43.124.8880 > 192.168.43.146.7771: UDP, length 120
03:12:04.365602 IP 192.168.43.146.8880 > 192.168.43.147.7772: UDP, length 120
03:12:04.397333 IP 192.168.43.124.8880 > 192.168.43.146.7771: UDP, length 120
03:12:04.415604 IP 192.168.43.146.8880 > 192.168.43.147.7772: UDP, length 120
03:12:04.448753 IP 192.168.43.124.8880 > 192.168.43.146.7771: UDP, length 120
03:12:04.465609 IP 192.168.43.146.8880 > 192.168.43.147.7772: UDP, length 120
03:12:04.508962 IP 192.168.43.124.8880 > 192.168.43.146.7771: UDP, length 120
03:12:04.515601 IP 192.168.43.146.8880 > 192.168.43.147.7772: UDP, length 120
03:12:04.547217 IP 192.168.43.124.8880 > 192.168.43.146.7771: UDP, length 120
03:12:04.565604 IP 192.168.43.146.8880 > 192.168.43.147.7772: UDP, length 120
03:12:04.600907 IP 192.168.43.124.8880 > 192.168.43.146.7771: UDP, length 120
03:12:04.615603 IP 192.168.43.146.8880 > 192.168.43.147.7772: UDP, length 120
03:12:04.657262 IP 192.168.43.124.8880 > 192.168.43.146.7771: UDP, length 120
03:12:04.665603 IP 192.168.43.146.8880 > 192.168.43.147.7772: UDP, length 120
03:12:04.697270 IP 192.168.43.124.8880 > 192.168.43.146.7771: UDP, length 120
03:12:04.715604 IP 192.168.43.146.8880 > 192.168.43.147.7772: UDP, length 120
03:12:04.747177 IP 192.168.43.124.8880 > 192.168.43.146.7771: UDP, length 120
03:12:04.765602 IP 192.168.43.146.8880 > 192.168.43.147.7772: UDP, length 120
03:12:04.806847 IP 192.168.43.124.8880 > 192.168.43.146.7771: UDP, length 120
03:12:04.815677 IP 192.168.43.146.8880 > 192.168.43.147.7772: UDP, length 120
03:12:04.847198 IP 192.168.43.124.8880 > 192.168.43.146.7771: UDP, length 120
03:12:04.865677 IP 192.168.43.146.8880 > 192.168.43.147.7772: UDP, length 120
03:12:04.897181 IP 192.168.43.124.8880 > 192.168.43.146.7771: UDP, length 120
03:12:04.915645 IP 192.168.43.146.8880 > 192.168.43.147.7772: UDP, length 120
03:12:04.957862 IP 192.168.43.124.8880 > 192.168.43.146.7771: UDP, length 120
03:12:04.965626 IP 192.168.43.146.8880 > 192.168.43.147.7772: UDP, length 120
03:12:04.997172 IP 192.168.43.124.8880 > 192.168.43.146.7771: UDP, length 120
03:12:05.015619 IP 192.168.43.146.8880 > 192.168.43.147.7772: UDP, length 120
03:12:05.047483 IP 192.168.43.124.8880 > 192.168.43.146.7771: UDP, length 120
03:12:05.065605 IP 192.168.43.146.8880 > 192.168.43.147.7772: UDP, length 120
03:12:05.098566 IP 192.168.43.124.8880 > 192.168.43.146.7771: UDP, length 120
03:12:05.115603 IP 192.168.43.146.8880 > 192.168.43.147.7772: UDP, length 120
03:12:05.165601 IP 192.168.43.146.8880 > 192.168.43.147.7772: UDP, length 120
03:12:05.168838 IP 192.168.43.124.8880 > 192.168.43.146.7771: UDP, length 120
03:12:05.199131 IP 192.168.43.124.8880 > 192.168.43.146.7771: UDP, length 120
03:12:05.215602 IP 192.168.43.146.8880 > 192.168.43.147.7772: UDP, length 120
03:12:05.255692 IP 192.168.43.124.8880 > 192.168.43.146.7771: UDP, length 120
03:12:05.265602 IP 192.168.43.146.8880 > 192.168.43.147.7772: UDP, length 120
03:12:05.309817 IP 192.168.43.124.8880 > 192.168.43.146.7771: UDP, length 120
03:12:05.315608 IP 192.168.43.146.8880 > 192.168.43.147.7772: UDP, length 120
03:12:05.347016 IP 192.168.43.124.8880 > 192.168.43.146.7771: UDP, length 120
03:12:05.365603 IP 192.168.43.146.8880 > 192.168.43.147.7772: UDP, length 120
03:12:05.397402 IP 192.168.43.124.8880 > 192.168.43.146.7771: UDP, length 120
03:12:05.415604 IP 192.168.43.146.8880 > 192.168.43.147.7772: UDP, length 120
03:12:05.459971 IP 192.168.43.124.8880 > 192.168.43.146.7771: UDP, length 120
03:12:05.465600 IP 192.168.43.146.8880 > 192.168.43.147.7772: UDP, length 120
03:12:05.497239 IP 192.168.43.124.8880 > 192.168.43.146.7771: UDP, length 120
03:12:05.515683 IP 192.168.43.146.8880 > 192.168.43.147.7772: UDP, length 120
03:12:05.547503 IP 192.168.43.124.8880 > 192.168.43.146.7771: UDP, length 120
03:12:05.565701 IP 192.168.43.146.8880 > 192.168.43.147.7772: UDP, length 120
03:12:05.608415 IP 192.168.43.124.8880 > 192.168.43.146.7771: UDP, length 120
03:12:05.615666 IP 192.168.43.146.8880 > 192.168.43.147.7772: UDP, length 120
03:12:05.648067 IP 192.168.43.124.8880 > 192.168.43.146.7771: UDP, length 120
03:12:05.665704 IP 192.168.43.146.8880 > 192.168.43.147.7772: UDP, length 120
03:12:05.697468 IP 192.168.43.124.8880 > 192.168.43.146.7771: UDP, length 120
03:12:05.715689 IP 192.168.43.146.8880 > 192.168.43.147.7772: UDP, length 120
03:12:05.750272 IP 192.168.43.124.8880 > 192.168.43.146.7771: UDP, length 120
03:12:05.765699 IP 192.168.43.146.8880 > 192.168.43.147.7772: UDP, length 120
03:12:05.815682 IP 192.168.43.146.8880 > 192.168.43.147.7772: UDP, length 120
03:12:05.817801 IP 192.168.43.124.8880 > 192.168.43.146.7771: UDP, length 120
03:12:05.847571 IP 192.168.43.124.8880 > 192.168.43.146.7771: UDP, length 120
03:12:05.865683 IP 192.168.43.146.8880 > 192.168.43.147.7772: UDP, length 120
03:12:05.897429 IP 192.168.43.124.8880 > 192.168.43.146.7771: UDP, length 120
03:12:05.915684 IP 192.168.43.146.8880 > 192.168.43.147.7772: UDP, length 120
03:12:05.959986 IP 192.168.43.124.8880 > 192.168.43.146.7771: UDP, length 120
03:12:05.965651 IP 192.168.43.146.8880 > 192.168.43.147.7772: UDP, length 120
03:12:05.997286 IP 192.168.43.124.8880 > 192.168.43.146.7771: UDP, length 120
03:12:06.015624 IP 192.168.43.146.8880 > 192.168.43.147.7772: UDP, length 120
03:12:06.047295 IP 192.168.43.124.8880 > 192.168.43.146.7771: UDP, length 120
03:12:06.065611 IP 192.168.43.146.8880 > 192.168.43.147.7772: UDP, length 120
03:12:06.107237 IP 192.168.43.124.8880 > 192.168.43.146.7771: UDP, length 120
03:12:06.115604 IP 192.168.43.146.8880 > 192.168.43.147.7772: UDP, length 120
03:12:06.147133 IP 192.168.43.124.8880 > 192.168.43.146.7771: UDP, length 120
03:12:06.165603 IP 192.168.43.146.8880 > 192.168.43.147.7772: UDP, length 120
03:12:06.197973 IP 192.168.43.124.8880 > 192.168.43.146.7771: UDP, length 120
03:12:06.215602 IP 192.168.43.146.8880 > 192.168.43.147.7772: UDP, length 120
03:12:06.248954 IP 192.168.43.124.8880 > 192.168.43.146.7771: UDP, length 120
03:12:06.265602 IP 192.168.43.146.8880 > 192.168.43.147.7772: UDP, length 120
03:12:06.315602 IP 192.168.43.146.8880 > 192.168.43.147.7772: UDP, length 120
03:12:06.317553 IP 192.168.43.124.8880 > 192.168.43.146.7771: UDP, length 120
03:12:06.347360 IP 192.168.43.124.8880 > 192.168.43.146.7771: UDP, length 120
03:12:06.365602 IP 192.168.43.146.8880 > 192.168.43.147.7772: UDP, length 120
03:12:06.397126 IP 192.168.43.124.8880 > 192.168.43.146.7771: UDP, length 120
03:12:06.415603 IP 192.168.43.146.8880 > 192.168.43.147.7772: UDP, length 120
03:12:06.462208 IP 192.168.43.124.8880 > 192.168.43.146.7771: UDP, length 120
03:12:06.465602 IP 192.168.43.146.8880 > 192.168.43.147.7772: UDP, length 120
03:12:06.497213 IP 192.168.43.124.8880 > 192.168.43.146.7771: UDP, length 120
03:12:06.515604 IP 192.168.43.146.8880 > 192.168.43.147.7772: UDP, length 120
03:12:06.549080 IP 192.168.43.124.8880 > 192.168.43.146.7771: UDP, length 120
03:12:06.565605 IP 192.168.43.146.8880 > 192.168.43.147.7772: UDP, length 120
03:12:06.607044 IP 192.168.43.124.8880 > 192.168.43.146.7771: UDP, length 120
03:12:06.615603 IP 192.168.43.146.8880 > 192.168.43.147.7772: UDP, length 120
03:12:06.648718 IP 192.168.43.124.8880 > 192.168.43.146.7771: UDP, length 120
03:12:06.665602 IP 192.168.43.146.8880 > 192.168.43.147.7772: UDP, length 120
03:12:06.697241 IP 192.168.43.124.8880 > 192.168.43.146.7771: UDP, length 120
03:12:06.715601 IP 192.168.43.146.8880 > 192.168.43.147.7772: UDP, length 120
03:12:06.760804 IP 192.168.43.124.8880 > 192.168.43.146.7771: UDP, length 120
03:12:06.765602 IP 192.168.43.146.8880 > 192.168.43.147.7772: UDP, length 120
03:12:06.797698 IP 192.168.43.124.8880 > 192.168.43.146.7771: UDP, length 120
03:12:06.815602 IP 192.168.43.146.8880 > 192.168.43.147.7772: UDP, length 120
03:12:06.847187 IP 192.168.43.124.8880 > 192.168.43.146.7771: UDP, length 120
03:12:06.865604 IP 192.168.43.146.8880 > 192.168.43.147.7772: UDP, length 120
03:12:06.907258 IP 192.168.43.124.8880 > 192.168.43.146.7771: UDP, length 120
03:12:06.915618 IP 192.168.43.146.8880 > 192.168.43.147.7772: UDP, length 120
03:12:06.947160 IP 192.168.43.124.8880 > 192.168.43.146.7771: UDP, length 120
03:12:06.965651 IP 192.168.43.146.8880 > 192.168.43.147.7772: UDP, length 120
03:12:06.997153 IP 192.168.43.124.8880 > 192.168.43.146.7771: UDP, length 120
03:12:07.015607 IP 192.168.43.146.8880 > 192.168.43.147.7772: UDP, length 120
03:12:07.049139 IP 192.168.43.124.8880 > 192.168.43.146.7771: UDP, length 120
03:12:07.065609 IP 192.168.43.146.8880 > 192.168.43.147.7772: UDP, length 120
03:12:07.109772 IP 192.168.43.124.8880 > 192.168.43.146.7771: UDP, length 120
03:12:07.115610 IP 192.168.43.146.8880 > 192.168.43.147.7772: UDP, length 120
03:12:07.147252 IP 192.168.43.124.8880 > 192.168.43.146.7771: UDP, length 120
03:12:07.165613 IP 192.168.43.146.8880 > 192.168.43.147.7772: UDP, length 120
03:12:07.197935 IP 192.168.43.124.8880 > 192.168.43.146.7771: UDP, length 120
03:12:07.215604 IP 192.168.43.146.8880 > 192.168.43.147.7772: UDP, length 120
03:12:07.257178 IP 192.168.43.124.8880 > 192.168.43.146.7771: UDP, length 120
03:12:07.265643 IP 192.168.43.146.8880 > 192.168.43.147.7772: UDP, length 120
03:12:07.303173 IP 192.168.43.124.8880 > 192.168.43.146.7771: UDP, length 120
03:12:07.315610 IP 192.168.43.146.8880 > 192.168.43.147.7772: UDP, length 120
03:12:07.349559 IP 192.168.43.124.8880 > 192.168.43.146.7771: UDP, length 120
03:12:07.365606 IP 192.168.43.146.8880 > 192.168.43.147.7772: UDP, length 120
03:12:07.407283 IP 192.168.43.124.8880 > 192.168.43.146.7771: UDP, length 120
03:12:07.415605 IP 192.168.43.146.8880 > 192.168.43.147.7772: UDP, length 120
03:12:07.447227 IP 192.168.43.124.8880 > 192.168.43.146.7771: UDP, length 120
03:12:07.465602 IP 192.168.43.146.8880 > 192.168.43.147.7772: UDP, length 120
03:12:07.509407 IP 192.168.43.124.8880 > 192.168.43.146.7771: UDP, length 120
03:12:07.515606 IP 192.168.43.146.8880 > 192.168.43.147.7772: UDP, length 120
03:12:07.557006 IP 192.168.43.124.8880 > 192.168.43.146.7771: UDP, length 120
03:12:07.565604 IP 192.168.43.146.8880 > 192.168.43.147.7772: UDP, length 120
03:12:07.597371 IP 192.168.43.124.8880 > 192.168.43.146.7771: UDP, length 120
03:12:07.615634 IP 192.168.43.146.8880 > 192.168.43.147.7772: UDP, length 120
03:12:07.647722 IP 192.168.43.124.8880 > 192.168.43.146.7771: UDP, length 120
03:12:07.665629 IP 192.168.43.146.8880 > 192.168.43.147.7772: UDP, length 120
03:12:07.711125 IP 192.168.43.124.8880 > 192.168.43.146.7771: UDP, length 120
03:12:07.715626 IP 192.168.43.146.8880 > 192.168.43.147.7772: UDP, length 120
03:12:07.747877 IP 192.168.43.124.8880 > 192.168.43.146.7771: UDP, length 120
03:12:07.765628 IP 192.168.43.146.8880 > 192.168.43.147.7772: UDP, length 120
03:12:07.798494 IP 192.168.43.124.8880 > 192.168.43.146.7771: UDP, length 120
03:12:07.815630 IP 192.168.43.146.8880 > 192.168.43.147.7772: UDP, length 120
03:12:07.849979 IP 192.168.43.124.8880 > 192.168.43.146.7771: UDP, length 120
03:12:07.865628 IP 192.168.43.146.8880 > 192.168.43.147.7772: UDP, length 120
03:12:07.915640 IP 192.168.43.146.8880 > 192.168.43.147.7772: UDP, length 120
03:12:07.918147 IP 192.168.43.124.8880 > 192.168.43.146.7771: UDP, length 120
03:12:07.948922 IP 192.168.43.124.8880 > 192.168.43.146.7771: UDP, length 120
03:12:07.965691 IP 192.168.43.146.8880 > 192.168.43.147.7772: UDP, length 120
03:12:07.997451 IP 192.168.43.124.8880 > 192.168.43.146.7771: UDP, length 120
03:12:08.015643 IP 192.168.43.146.8880 > 192.168.43.147.7772: UDP, length 120
03:12:08.044412 IP 192.168.43.124.8880 > 192.168.43.146.7771: UDP, length 120
03:12:08.065636 IP 192.168.43.146.8880 > 192.168.43.147.7772: UDP, length 120
03:12:08.105556 IP 192.168.43.124.8880 > 192.168.43.146.7771: UDP, length 120
03:12:08.115639 IP 192.168.43.146.8880 > 192.168.43.147.7772: UDP, length 120
03:12:08.147305 IP 192.168.43.124.8880 > 192.168.43.146.7771: UDP, length 120
03:12:08.165640 IP 192.168.43.146.8880 > 192.168.43.147.7772: UDP, length 120
03:12:08.197529 IP 192.168.43.124.8880 > 192.168.43.146.7771: UDP, length 120
03:12:08.215631 IP 192.168.43.146.8880 > 192.168.43.147.7772: UDP, length 120
03:12:08.249172 IP 192.168.43.124.8880 > 192.168.43.146.7771: UDP, length 120
03:12:08.265628 IP 192.168.43.146.8880 > 192.168.43.147.7772: UDP, length 120
03:12:08.298137 IP 192.168.43.124.8880 > 192.168.43.146.7771: UDP, length 120
03:12:08.315628 IP 192.168.43.146.8880 > 192.168.43.147.7772: UDP, length 120
03:12:08.350597 IP 192.168.43.124.8880 > 192.168.43.146.7771: UDP, length 120
03:12:08.365627 IP 192.168.43.146.8880 > 192.168.43.147.7772: UDP, length 120
03:12:08.412856 IP 192.168.43.124.8880 > 192.168.43.146.7771: UDP, length 120
03:12:08.415627 IP 192.168.43.146.8880 > 192.168.43.147.7772: UDP, length 120
03:12:08.447275 IP 192.168.43.124.8880 > 192.168.43.146.7771: UDP, length 120
03:12:08.465628 IP 192.168.43.146.8880 > 192.168.43.147.7772: UDP, length 120
03:12:08.497728 IP 192.168.43.124.8880 > 192.168.43.146.7771: UDP, length 120
03:12:08.515633 IP 192.168.43.146.8880 > 192.168.43.147.7772: UDP, length 120
03:12:08.552879 IP 192.168.43.124.8880 > 192.168.43.146.7771: UDP, length 120
03:12:08.565631 IP 192.168.43.146.8880 > 192.168.43.147.7772: UDP, length 120
03:12:08.597262 IP 192.168.43.124.8880 > 192.168.43.146.7771: UDP, length 120
03:12:08.615628 IP 192.168.43.146.8880 > 192.168.43.147.7772: UDP, length 120
03:12:08.647269 IP 192.168.43.124.8880 > 192.168.43.146.7771: UDP, length 120
03:12:08.665636 IP 192.168.43.146.8880 > 192.168.43.147.7772: UDP, length 120
03:12:08.697262 IP 192.168.43.124.8880 > 192.168.43.146.7771: UDP, length 120
03:12:08.715628 IP 192.168.43.146.8880 > 192.168.43.147.7772: UDP, length 120
03:12:08.748160 IP 192.168.43.124.8880 > 192.168.43.146.7771: UDP, length 120
03:12:08.765680 IP 192.168.43.146.8880 > 192.168.43.147.7772: UDP, length 120
03:12:08.815626 IP 192.168.43.146.8880 > 192.168.43.147.7772: UDP, length 120
03:12:08.816579 IP 192.168.43.124.8880 > 192.168.43.146.7771: UDP, length 120
03:12:08.847204 IP 192.168.43.124.8880 > 192.168.43.146.7771: UDP, length 120
03:12:08.865630 IP 192.168.43.146.8880 > 192.168.43.147.7772: UDP, length 120
03:12:08.901826 IP 192.168.43.124.8880 > 192.168.43.146.7771: UDP, length 120
03:12:08.915634 IP 192.168.43.146.8880 > 192.168.43.147.7772: UDP, length 120
03:12:08.962905 IP 192.168.43.124.8880 > 192.168.43.146.7771: UDP, length 120
03:12:08.965686 IP 192.168.43.146.8880 > 192.168.43.147.7772: UDP, length 120
03:12:08.997285 IP 192.168.43.124.8880 > 192.168.43.146.7771: UDP, length 120
03:12:09.015639 IP 192.168.43.146.8880 > 192.168.43.147.7772: UDP, length 120
03:12:09.053210 IP 192.168.43.124.8880 > 192.168.43.146.7771: UDP, length 120
03:12:09.065629 IP 192.168.43.146.8880 > 192.168.43.147.7772: UDP, length 120
03:12:09.097246 IP 192.168.43.124.8880 > 192.168.43.146.7771: UDP, length 120
03:12:09.115630 IP 192.168.43.146.8880 > 192.168.43.147.7772: UDP, length 120
03:12:09.147248 IP 192.168.43.124.8880 > 192.168.43.146.7771: UDP, length 120
03:12:09.165635 IP 192.168.43.146.8880 > 192.168.43.147.7772: UDP, length 120
03:12:09.197281 IP 192.168.43.124.8880 > 192.168.43.146.7771: UDP, length 120
03:12:09.215635 IP 192.168.43.146.8880 > 192.168.43.147.7772: UDP, length 120
03:12:09.264487 IP 192.168.43.124.8880 > 192.168.43.146.7771: UDP, length 120
03:12:09.265624 IP 192.168.43.146.8880 > 192.168.43.147.7772: UDP, length 120
03:12:09.301029 IP 192.168.43.124.8880 > 192.168.43.146.7771: UDP, length 120
03:12:09.315630 IP 192.168.43.146.8880 > 192.168.43.147.7772: UDP, length 120
03:12:09.363447 IP 192.168.43.124.8880 > 192.168.43.146.7771: UDP, length 120
03:12:09.365624 IP 192.168.43.146.8880 > 192.168.43.147.7772: UDP, length 120
03:12:09.399716 IP 192.168.43.124.8880 > 192.168.43.146.7771: UDP, length 120
03:12:09.415627 IP 192.168.43.146.8880 > 192.168.43.147.7772: UDP, length 120
03:12:09.451113 IP 192.168.43.124.8880 > 192.168.43.146.7771: UDP, length 120
03:12:09.465627 IP 192.168.43.146.8880 > 192.168.43.147.7772: UDP, length 120
03:12:09.497354 IP 192.168.43.124.8880 > 192.168.43.146.7771: UDP, length 120
03:12:09.515633 IP 192.168.43.146.8880 > 192.168.43.147.7772: UDP, length 120
03:12:09.563786 IP 192.168.43.124.8880 > 192.168.43.146.7771: UDP, length 120
03:12:09.565630 IP 192.168.43.146.8880 > 192.168.43.147.7772: UDP, length 120
03:12:09.597244 IP 192.168.43.124.8880 > 192.168.43.146.7771: UDP, length 120
03:12:09.615629 IP 192.168.43.146.8880 > 192.168.43.147.7772: UDP, length 120
03:12:09.647249 IP 192.168.43.124.8880 > 192.168.43.146.7771: UDP, length 120
03:12:09.665629 IP 192.168.43.146.8880 > 192.168.43.147.7772: UDP, length 120
03:12:09.707372 IP 192.168.43.124.8880 > 192.168.43.146.7771: UDP, length 120
03:12:09.715626 IP 192.168.43.146.8880 > 192.168.43.147.7772: UDP, length 120
03:12:09.747290 IP 192.168.43.124.8880 > 192.168.43.146.7771: UDP, length 120
03:12:09.765627 IP 192.168.43.146.8880 > 192.168.43.147.7772: UDP, length 120
03:12:09.798760 IP 192.168.43.124.8880 > 192.168.43.146.7771: UDP, length 120
03:12:09.815626 IP 192.168.43.146.8880 > 192.168.43.147.7772: UDP, length 120
03:12:09.858963 IP 192.168.43.124.8880 > 192.168.43.146.7771: UDP, length 120
03:12:09.865627 IP 192.168.43.146.8880 > 192.168.43.147.7772: UDP, length 120
03:12:09.898447 IP 192.168.43.124.8880 > 192.168.43.146.7771: UDP, length 120
03:12:09.915635 IP 192.168.43.146.8880 > 192.168.43.147.7772: UDP, length 120
03:12:09.948959 IP 192.168.43.124.8880 > 192.168.43.146.7771: UDP, length 120
03:12:09.965713 IP 192.168.43.146.8880 > 192.168.43.147.7772: UDP, length 120
03:12:10.011880 IP 192.168.43.124.8880 > 192.168.43.146.7771: UDP, length 120
03:12:10.015683 IP 192.168.43.146.8880 > 192.168.43.147.7772: UDP, length 120
03:12:10.065630 IP 192.168.43.146.8880 > 192.168.43.147.7772: UDP, length 120
03:12:10.075037 IP 192.168.43.124.8880 > 192.168.43.146.7771: UDP, length 120
03:12:10.097290 IP 192.168.43.124.8880 > 192.168.43.146.7771: UDP, length 120
03:12:10.115633 IP 192.168.43.146.8880 > 192.168.43.147.7772: UDP, length 120
03:12:10.157138 IP 192.168.43.124.8880 > 192.168.43.146.7771: UDP, length 120
03:12:10.165624 IP 192.168.43.146.8880 > 192.168.43.147.7772: UDP, length 120
03:12:10.197254 IP 192.168.43.124.8880 > 192.168.43.146.7771: UDP, length 120
03:12:10.215635 IP 192.168.43.146.8880 > 192.168.43.147.7772: UDP, length 120
03:12:10.247436 IP 192.168.43.124.8880 > 192.168.43.146.7771: UDP, length 120
03:12:10.265674 IP 192.168.43.146.8880 > 192.168.43.147.7772: UDP, length 120
03:12:10.307390 IP 192.168.43.124.8880 > 192.168.43.146.7771: UDP, length 120
03:12:10.315646 IP 192.168.43.146.8880 > 192.168.43.147.7772: UDP, length 120
03:12:10.349266 IP 192.168.43.124.8880 > 192.168.43.146.7771: UDP, length 120
03:12:10.365629 IP 192.168.43.146.8880 > 192.168.43.147.7772: UDP, length 120
03:12:10.398964 IP 192.168.43.124.8880 > 192.168.43.146.7771: UDP, length 120
03:12:10.415632 IP 192.168.43.146.8880 > 192.168.43.147.7772: UDP, length 120
03:12:10.447785 IP 192.168.43.124.8880 > 192.168.43.146.7771: UDP, length 120
03:12:10.465632 IP 192.168.43.146.8880 > 192.168.43.147.7772: UDP, length 120
03:12:10.498981 IP 192.168.43.124.8880 > 192.168.43.146.7771: UDP, length 120
03:12:10.515626 IP 192.168.43.146.8880 > 192.168.43.147.7772: UDP, length 120
03:12:10.565627 IP 192.168.43.146.8880 > 192.168.43.147.7772: UDP, length 120
03:12:10.580281 IP 192.168.43.124.8880 > 192.168.43.146.7771: UDP, length 120
03:12:10.597313 IP 192.168.43.124.8880 > 192.168.43.146.7771: UDP, length 120
03:12:10.615630 IP 192.168.43.146.8880 > 192.168.43.147.7772: UDP, length 120
03:12:10.657350 IP 192.168.43.124.8880 > 192.168.43.146.7771: UDP, length 120
03:12:10.665632 IP 192.168.43.146.8880 > 192.168.43.147.7772: UDP, length 120
03:12:10.697192 IP 192.168.43.124.8880 > 192.168.43.146.7771: UDP, length 120
03:12:10.715629 IP 192.168.43.146.8880 > 192.168.43.147.7772: UDP, length 120
03:12:10.747448 IP 192.168.43.124.8880 > 192.168.43.146.7771: UDP, length 120
03:12:10.765631 IP 192.168.43.146.8880 > 192.168.43.147.7772: UDP, length 120
03:12:10.807519 IP 192.168.43.124.8880 > 192.168.43.146.7771: UDP, length 120
03:12:10.815628 IP 192.168.43.146.8880 > 192.168.43.147.7772: UDP, length 120
03:12:10.847462 IP 192.168.43.124.8880 > 192.168.43.146.7771: UDP, length 120
03:12:10.865631 IP 192.168.43.146.8880 > 192.168.43.147.7772: UDP, length 120
03:12:10.897883 IP 192.168.43.124.8880 > 192.168.43.146.7771: UDP, length 120
03:12:10.915694 IP 192.168.43.146.8880 > 192.168.43.147.7772: UDP, length 120
03:12:10.949616 IP 192.168.43.124.8880 > 192.168.43.146.7771: UDP, length 120
03:12:10.965720 IP 192.168.43.146.8880 > 192.168.43.147.7772: UDP, length 120
03:12:10.997362 IP 192.168.43.124.8880 > 192.168.43.146.7771: UDP, length 120
03:12:11.015693 IP 192.168.43.146.8880 > 192.168.43.147.7772: UDP, length 120
03:12:11.047495 IP 192.168.43.124.8880 > 192.168.43.146.7771: UDP, length 120
03:12:11.065697 IP 192.168.43.146.8880 > 192.168.43.147.7772: UDP, length 120
03:12:11.097574 IP 192.168.43.124.8880 > 192.168.43.146.7771: UDP, length 120
03:12:11.115714 IP 192.168.43.146.8880 > 192.168.43.147.7772: UDP, length 120
03:12:11.159666 IP 192.168.43.124.8880 > 192.168.43.146.7771: UDP, length 120
03:12:11.165678 IP 192.168.43.146.8880 > 192.168.43.147.7772: UDP, length 120
03:12:11.197449 IP 192.168.43.124.8880 > 192.168.43.146.7771: UDP, length 120
03:12:11.215667 IP 192.168.43.146.8880 > 192.168.43.147.7772: UDP, length 120
03:12:11.247288 IP 192.168.43.124.8880 > 192.168.43.146.7771: UDP, length 120
03:12:11.265660 IP 192.168.43.146.8880 > 192.168.43.147.7772: UDP, length 120
03:12:11.307206 IP 192.168.43.124.8880 > 192.168.43.146.7771: UDP, length 120
03:12:11.315666 IP 192.168.43.146.8880 > 192.168.43.147.7772: UDP, length 120
03:12:11.347370 IP 192.168.43.124.8880 > 192.168.43.146.7771: UDP, length 120
03:12:11.365687 IP 192.168.43.146.8880 > 192.168.43.147.7772: UDP, length 120
03:12:11.398989 IP 192.168.43.124.8880 > 192.168.43.146.7771: UDP, length 120
03:12:11.415647 IP 192.168.43.146.8880 > 192.168.43.147.7772: UDP, length 120
03:12:11.461279 IP 192.168.43.124.8880 > 192.168.43.146.7771: UDP, length 120
03:12:11.465608 IP 192.168.43.146.8880 > 192.168.43.147.7772: UDP, length 120
03:12:11.499165 IP 192.168.43.124.8880 > 192.168.43.146.7771: UDP, length 120
03:12:11.515604 IP 192.168.43.146.8880 > 192.168.43.147.7772: UDP, length 120
03:12:11.548205 IP 192.168.43.124.8880 > 192.168.43.146.7771: UDP, length 120
03:12:11.565604 IP 192.168.43.146.8880 > 192.168.43.147.7772: UDP, length 120
03:12:11.600574 IP 192.168.43.124.8880 > 192.168.43.146.7771: UDP, length 120
03:12:11.615602 IP 192.168.43.146.8880 > 192.168.43.147.7772: UDP, length 120
03:12:11.665601 IP 192.168.43.146.8880 > 192.168.43.147.7772: UDP, length 120
03:12:11.668843 IP 192.168.43.124.8880 > 192.168.43.146.7771: UDP, length 120
03:12:11.702010 IP 192.168.43.124.8880 > 192.168.43.146.7771: UDP, length 120
03:12:11.715602 IP 192.168.43.146.8880 > 192.168.43.147.7772: UDP, length 120
03:12:11.747212 IP 192.168.43.124.8880 > 192.168.43.146.7771: UDP, length 120
03:12:11.765640 IP 192.168.43.146.8880 > 192.168.43.147.7772: UDP, length 120
03:12:11.810553 IP 192.168.43.124.8880 > 192.168.43.146.7771: UDP, length 120
03:12:11.815605 IP 192.168.43.146.8880 > 192.168.43.147.7772: UDP, length 120
03:12:11.847230 IP 192.168.43.124.8880 > 192.168.43.146.7771: UDP, length 120
03:12:11.865602 IP 192.168.43.146.8880 > 192.168.43.147.7772: UDP, length 120
03:12:11.897116 IP 192.168.43.124.8880 > 192.168.43.146.7771: UDP, length 120
03:12:11.915627 IP 192.168.43.146.8880 > 192.168.43.147.7772: UDP, length 120
03:12:11.950867 IP 192.168.43.124.8880 > 192.168.43.146.7771: UDP, length 120
03:12:11.965615 IP 192.168.43.146.8880 > 192.168.43.147.7772: UDP, length 120
03:12:12.014196 IP 192.168.43.124.8880 > 192.168.43.146.7771: UDP, length 120
03:12:12.015603 IP 192.168.43.146.8880 > 192.168.43.147.7772: UDP, length 120
03:12:12.048474 IP 192.168.43.124.8880 > 192.168.43.146.7771: UDP, length 120
03:12:12.065602 IP 192.168.43.146.8880 > 192.168.43.147.7772: UDP, length 120
03:12:12.099246 IP 192.168.43.124.8880 > 192.168.43.146.7771: UDP, length 120
03:12:12.115602 IP 192.168.43.146.8880 > 192.168.43.147.7772: UDP, length 120
03:12:12.157012 IP 192.168.43.124.8880 > 192.168.43.146.7771: UDP, length 120
03:12:12.165603 IP 192.168.43.146.8880 > 192.168.43.147.7772: UDP, length 120
03:12:12.197046 IP 192.168.43.124.8880 > 192.168.43.146.7771: UDP, length 120
03:12:12.215601 IP 192.168.43.146.8880 > 192.168.43.147.7772: UDP, length 120
03:12:12.247825 IP 192.168.43.124.8880 > 192.168.43.146.7771: UDP, length 120
03:12:12.265602 IP 192.168.43.146.8880 > 192.168.43.147.7772: UDP, length 120
03:12:12.307082 IP 192.168.43.124.8880 > 192.168.43.146.7771: UDP, length 120
03:12:12.315601 IP 192.168.43.146.8880 > 192.168.43.147.7772: UDP, length 120
03:12:12.347156 IP 192.168.43.124.8880 > 192.168.43.146.7771: UDP, length 120
03:12:12.365613 IP 192.168.43.146.8880 > 192.168.43.147.7772: UDP, length 120
03:12:12.397250 IP 192.168.43.124.8880 > 192.168.43.146.7771: UDP, length 120
03:12:12.415608 IP 192.168.43.146.8880 > 192.168.43.147.7772: UDP, length 120
03:12:12.457616 IP 192.168.43.124.8880 > 192.168.43.146.7771: UDP, length 120
03:12:12.465603 IP 192.168.43.146.8880 > 192.168.43.147.7772: UDP, length 120
03:12:12.496729 IP 192.168.43.124.8880 > 192.168.43.146.7771: UDP, length 120
03:12:12.515599 IP 192.168.43.146.8880 > 192.168.43.147.7772: UDP, length 120
03:12:12.548015 IP 192.168.43.124.8880 > 192.168.43.146.7771: UDP, length 120
03:12:12.565604 IP 192.168.43.146.8880 > 192.168.43.147.7772: UDP, length 120
03:12:12.599324 IP 192.168.43.124.8880 > 192.168.43.146.7771: UDP, length 120
03:12:12.615627 IP 192.168.43.146.8880 > 192.168.43.147.7772: UDP, length 120
03:12:12.665628 IP 192.168.43.146.8880 > 192.168.43.147.7772: UDP, length 120
03:12:12.667979 IP 192.168.43.124.8880 > 192.168.43.146.7771: UDP, length 120
03:12:12.697755 IP 192.168.43.124.8880 > 192.168.43.146.7771: UDP, length 120
03:12:12.715636 IP 192.168.43.146.8880 > 192.168.43.147.7772: UDP, length 120
03:12:12.747180 IP 192.168.43.124.8880 > 192.168.43.146.7771: UDP, length 120
03:12:12.765628 IP 192.168.43.146.8880 > 192.168.43.147.7772: UDP, length 120
03:12:12.807324 IP 192.168.43.124.8880 > 192.168.43.146.7771: UDP, length 120
03:12:12.815624 IP 192.168.43.146.8880 > 192.168.43.147.7772: UDP, length 120
03:12:12.847222 IP 192.168.43.124.8880 > 192.168.43.146.7771: UDP, length 120
03:12:12.865629 IP 192.168.43.146.8880 > 192.168.43.147.7772: UDP, length 120
03:12:12.897223 IP 192.168.43.124.8880 > 192.168.43.146.7771: UDP, length 120
03:12:12.915638 IP 192.168.43.146.8880 > 192.168.43.147.7772: UDP, length 120
03:12:12.947757 IP 192.168.43.124.8880 > 192.168.43.146.7771: UDP, length 120
03:12:12.965631 IP 192.168.43.146.8880 > 192.168.43.147.7772: UDP, length 120
03:12:13.015714 IP 192.168.43.146.8880 > 192.168.43.147.7772: UDP, length 120
03:12:13.019364 IP 192.168.43.124.8880 > 192.168.43.146.7771: UDP, length 120
03:12:13.047619 IP 192.168.43.124.8880 > 192.168.43.146.7771: UDP, length 120
03:12:13.065727 IP 192.168.43.146.8880 > 192.168.43.147.7772: UDP, length 120
03:12:13.100301 IP 192.168.43.124.8880 > 192.168.43.146.7771: UDP, length 120
03:12:13.115678 IP 192.168.43.146.8880 > 192.168.43.147.7772: UDP, length 120
03:12:13.157728 IP 192.168.43.124.8880 > 192.168.43.146.7771: UDP, length 120
03:12:13.165645 IP 192.168.43.146.8880 > 192.168.43.147.7772: UDP, length 120
03:12:13.199296 IP 192.168.43.124.8880 > 192.168.43.146.7771: UDP, length 120
03:12:13.215610 IP 192.168.43.146.8880 > 192.168.43.147.7772: UDP, length 120
03:12:13.247325 IP 192.168.43.124.8880 > 192.168.43.146.7771: UDP, length 120
03:12:13.265638 IP 192.168.43.146.8880 > 192.168.43.147.7772: UDP, length 120
03:12:13.307012 IP 192.168.43.124.8880 > 192.168.43.146.7771: UDP, length 120
03:12:13.315605 IP 192.168.43.146.8880 > 192.168.43.147.7772: UDP, length 120
03:12:13.347088 IP 192.168.43.124.8880 > 192.168.43.146.7771: UDP, length 120
03:12:13.365604 IP 192.168.43.146.8880 > 192.168.43.147.7772: UDP, length 120
03:12:13.397161 IP 192.168.43.124.8880 > 192.168.43.146.7771: UDP, length 120
03:12:13.415609 IP 192.168.43.146.8880 > 192.168.43.147.7772: UDP, length 120
03:12:13.457003 IP 192.168.43.124.8880 > 192.168.43.146.7771: UDP, length 120
03:12:13.465611 IP 192.168.43.146.8880 > 192.168.43.147.7772: UDP, length 120
03:12:13.498864 IP 192.168.43.124.8880 > 192.168.43.146.7771: UDP, length 120
03:12:13.515606 IP 192.168.43.146.8880 > 192.168.43.147.7772: UDP, length 120
03:12:13.547857 IP 192.168.43.124.8880 > 192.168.43.146.7771: UDP, length 120
03:12:13.565606 IP 192.168.43.146.8880 > 192.168.43.147.7772: UDP, length 120
03:12:13.607136 IP 192.168.43.124.8880 > 192.168.43.146.7771: UDP, length 120
03:12:13.615603 IP 192.168.43.146.8880 > 192.168.43.147.7772: UDP, length 120
03:12:13.650294 IP 192.168.43.124.8880 > 192.168.43.146.7771: UDP, length 120
03:12:13.665603 IP 192.168.43.146.8880 > 192.168.43.147.7772: UDP, length 120
03:12:13.698516 IP 192.168.43.124.8880 > 192.168.43.146.7771: UDP, length 120
03:12:13.715601 IP 192.168.43.146.8880 > 192.168.43.147.7772: UDP, length 120
03:12:13.754308 IP 192.168.43.124.8880 > 192.168.43.146.7771: UDP, length 120
03:12:13.765601 IP 192.168.43.146.8880 > 192.168.43.147.7772: UDP, length 120
03:12:13.815601 IP 192.168.43.146.8880 > 192.168.43.147.7772: UDP, length 120
03:12:13.817368 IP 192.168.43.124.8880 > 192.168.43.146.7771: UDP, length 120
03:12:13.847301 IP 192.168.43.124.8880 > 192.168.43.146.7771: UDP, length 120
03:12:13.865605 IP 192.168.43.146.8880 > 192.168.43.147.7772: UDP, length 120
03:12:13.913120 IP 192.168.43.124.8880 > 192.168.43.146.7771: UDP, length 120
03:12:13.915610 IP 192.168.43.146.8880 > 192.168.43.147.7772: UDP, length 120
03:12:13.957226 IP 192.168.43.124.8880 > 192.168.43.146.7771: UDP, length 120
03:12:13.965605 IP 192.168.43.146.8880 > 192.168.43.147.7772: UDP, length 120
03:12:13.999184 IP 192.168.43.124.8880 > 192.168.43.146.7771: UDP, length 120
03:12:14.015608 IP 192.168.43.146.8880 > 192.168.43.147.7772: UDP, length 120
03:12:14.047068 IP 192.168.43.124.8880 > 192.168.43.146.7771: UDP, length 120
03:12:14.065604 IP 192.168.43.146.8880 > 192.168.43.147.7772: UDP, length 120
03:12:14.097083 IP 192.168.43.124.8880 > 192.168.43.146.7771: UDP, length 120
03:12:14.115603 IP 192.168.43.146.8880 > 192.168.43.147.7772: UDP, length 120
03:12:14.149249 IP 192.168.43.124.8880 > 192.168.43.146.7771: UDP, length 120
03:12:14.165657 IP 192.168.43.146.8880 > 192.168.43.147.7772: UDP, length 120
03:12:14.197397 IP 192.168.43.124.8880 > 192.168.43.146.7771: UDP, length 120
03:12:14.215636 IP 192.168.43.146.8880 > 192.168.43.147.7772: UDP, length 120
03:12:14.249653 IP 192.168.43.124.8880 > 192.168.43.146.7771: UDP, length 120
03:12:14.265611 IP 192.168.43.146.8880 > 192.168.43.147.7772: UDP, length 120
03:12:14.313626 IP 192.168.43.124.8880 > 192.168.43.146.7771: UDP, length 120
03:12:14.315603 IP 192.168.43.146.8880 > 192.168.43.147.7772: UDP, length 120
03:12:14.347141 IP 192.168.43.124.8880 > 192.168.43.146.7771: UDP, length 120
03:12:14.365603 IP 192.168.43.146.8880 > 192.168.43.147.7772: UDP, length 120
03:12:14.397857 IP 192.168.43.124.8880 > 192.168.43.146.7771: UDP, length 120
03:12:14.415604 IP 192.168.43.146.8880 > 192.168.43.147.7772: UDP, length 120
03:12:14.457086 IP 192.168.43.124.8880 > 192.168.43.146.7771: UDP, length 120
03:12:14.465612 IP 192.168.43.146.8880 > 192.168.43.147.7772: UDP, length 120
03:12:14.497109 IP 192.168.43.124.8880 > 192.168.43.146.7771: UDP, length 120
03:12:14.515607 IP 192.168.43.146.8880 > 192.168.43.147.7772: UDP, length 120
03:12:14.547171 IP 192.168.43.124.8880 > 192.168.43.146.7771: UDP, length 120
03:12:14.565606 IP 192.168.43.146.8880 > 192.168.43.147.7772: UDP, length 120
03:12:14.598250 IP 192.168.43.124.8880 > 192.168.43.146.7771: UDP, length 120
03:12:14.615602 IP 192.168.43.146.8880 > 192.168.43.147.7772: UDP, length 120
03:12:14.665602 IP 192.168.43.146.8880 > 192.168.43.147.7772: UDP, length 120
03:12:14.668363 IP 192.168.43.124.8880 > 192.168.43.146.7771: UDP, length 120
03:12:14.697897 IP 192.168.43.124.8880 > 192.168.43.146.7771: UDP, length 120
03:12:14.715602 IP 192.168.43.146.8880 > 192.168.43.147.7772: UDP, length 120
03:12:14.765649 IP 192.168.43.146.8880 > 192.168.43.147.7772: UDP, length 120
03:12:14.766445 IP 192.168.43.124.8880 > 192.168.43.146.7771: UDP, length 120
03:12:14.810849 IP 192.168.43.124.8880 > 192.168.43.146.7771: UDP, length 120
03:12:14.815609 IP 192.168.43.146.8880 > 192.168.43.147.7772: UDP, length 120
03:12:14.847232 IP 192.168.43.124.8880 > 192.168.43.146.7771: UDP, length 120
03:12:14.865607 IP 192.168.43.146.8880 > 192.168.43.147.7772: UDP, length 120
03:12:14.897247 IP 192.168.43.124.8880 > 192.168.43.146.7771: UDP, length 120
03:12:14.915610 IP 192.168.43.146.8880 > 192.168.43.147.7772: UDP, length 120
03:12:14.957156 IP 192.168.43.124.8880 > 192.168.43.146.7771: UDP, length 120
03:12:14.965604 IP 192.168.43.146.8880 > 192.168.43.147.7772: UDP, length 120
03:12:14.997060 IP 192.168.43.124.8880 > 192.168.43.146.7771: UDP, length 120
03:12:15.015604 IP 192.168.43.146.8880 > 192.168.43.147.7772: UDP, length 120
03:12:15.047647 IP 192.168.43.124.8880 > 192.168.43.146.7771: UDP, length 120
03:12:15.065604 IP 192.168.43.146.8880 > 192.168.43.147.7772: UDP, length 120
03:12:15.099401 IP 192.168.43.124.8880 > 192.168.43.146.7771: UDP, length 120
03:12:15.115604 IP 192.168.43.146.8880 > 192.168.43.147.7772: UDP, length 120
03:12:15.165603 IP 192.168.43.146.8880 > 192.168.43.147.7772: UDP, length 120
03:12:15.171869 IP 192.168.43.124.8880 > 192.168.43.146.7771: UDP, length 120
03:12:15.197552 IP 192.168.43.124.8880 > 192.168.43.146.7771: UDP, length 120
03:12:15.215643 IP 192.168.43.146.8880 > 192.168.43.147.7772: UDP, length 120
03:12:15.252904 IP 192.168.43.124.8880 > 192.168.43.146.7771: UDP, length 120
03:12:15.265614 IP 192.168.43.146.8880 > 192.168.43.147.7772: UDP, length 120
03:12:15.307078 IP 192.168.43.124.8880 > 192.168.43.146.7771: UDP, length 120
03:12:15.315604 IP 192.168.43.146.8880 > 192.168.43.147.7772: UDP, length 120
03:12:15.347062 IP 192.168.43.124.8880 > 192.168.43.146.7771: UDP, length 120
