01:05:17.994449 IP 192.168.43.124.8880 > 192.168.43.146.7771: UDP, length 120
01:05:18.043751 IP 192.168.43.124.8880 > 192.168.43.146.7771: UDP, length 120
01:05:18.094943 IP 192.168.43.124.8880 > 192.168.43.146.7771: UDP, length 120
01:05:18.143756 IP 192.168.43.124.8880 > 192.168.43.146.7771: UDP, length 120
01:05:18.194828 IP 192.168.43.124.8880 > 192.168.43.146.7771: UDP, length 120
01:05:18.243749 IP 192.168.43.124.8880 > 192.168.43.146.7771: UDP, length 120
01:05:18.297094 IP 192.168.43.124.8880 > 192.168.43.146.7771: UDP, length 120
01:05:18.344736 IP 192.168.43.124.8880 > 192.168.43.146.7771: UDP, length 120
01:05:18.393755 IP 192.168.43.124.8880 > 192.168.43.146.7771: UDP, length 120
01:05:18.444969 IP 192.168.43.124.8880 > 192.168.43.146.7771: UDP, length 120
01:05:18.490929 IP 192.168.43.124.8880 > 192.168.43.146.7771: UDP, length 120
01:05:18.517727 IP 192.168.43.146.8880 > 192.168.43.147.7772: UDP, length 120
01:05:18.544256 IP 192.168.43.124.8880 > 192.168.43.146.7771: UDP, length 120
01:05:18.567773 IP 192.168.43.146.8880 > 192.168.43.147.7772: UDP, length 120
01:05:18.593729 IP 192.168.43.124.8880 > 192.168.43.146.7771: UDP, length 120
01:05:18.617772 IP 192.168.43.146.8880 > 192.168.43.147.7772: UDP, length 120
01:05:18.645751 IP 192.168.43.124.8880 > 192.168.43.146.7771: UDP, length 120
01:05:18.667755 IP 192.168.43.146.8880 > 192.168.43.147.7772: UDP, length 120
01:05:18.693768 IP 192.168.43.124.8880 > 192.168.43.146.7771: UDP, length 120
01:05:18.717746 IP 192.168.43.146.8880 > 192.168.43.147.7772: UDP, length 120
01:05:18.744694 IP 192.168.43.124.8880 > 192.168.43.146.7771: UDP, length 120
01:05:18.767747 IP 192.168.43.146.8880 > 192.168.43.147.7772: UDP, length 120
01:05:18.793773 IP 192.168.43.124.8880 > 192.168.43.146.7771: UDP, length 120
01:05:18.819130 IP 192.168.43.146.8880 > 192.168.43.147.7772: UDP, length 120
01:05:18.841605 IP 192.168.43.124.8880 > 192.168.43.146.7771: UDP, length 120
01:05:18.867772 IP 192.168.43.146.8880 > 192.168.43.147.7772: UDP, length 120
01:05:18.893304 IP 192.168.43.124.8880 > 192.168.43.146.7771: UDP, length 120
01:05:18.917749 IP 192.168.43.146.8880 > 192.168.43.147.7772: UDP, length 120
01:05:18.943624 IP 192.168.43.124.8880 > 192.168.43.146.7771: UDP, length 120
01:05:18.967748 IP 192.168.43.146.8880 > 192.168.43.147.7772: UDP, length 120
01:05:18.993938 IP 192.168.43.124.8880 > 192.168.43.146.7771: UDP, length 120
01:05:19.017747 IP 192.168.43.146.8880 > 192.168.43.147.7772: UDP, length 120
01:05:19.043707 IP 192.168.43.124.8880 > 192.168.43.146.7771: UDP, length 120
01:05:19.067752 IP 192.168.43.146.8880 > 192.168.43.147.7772: UDP, length 120
01:05:19.094566 IP 192.168.43.124.8880 > 192.168.43.146.7771: UDP, length 120
01:05:19.117747 IP 192.168.43.146.8880 > 192.168.43.147.7772: UDP, length 120
01:05:19.165995 IP 192.168.43.124.8880 > 192.168.43.146.7771: UDP, length 120
01:05:19.167747 IP 192.168.43.146.8880 > 192.168.43.147.7772: UDP, length 120
01:05:19.195881 IP 192.168.43.124.8880 > 192.168.43.146.7771: UDP, length 120
01:05:19.217747 IP 192.168.43.146.8880 > 192.168.43.147.7772: UDP, length 120
01:05:19.243642 IP 192.168.43.124.8880 > 192.168.43.146.7771: UDP, length 120
01:05:19.267751 IP 192.168.43.146.8880 > 192.168.43.147.7772: UDP, length 120
01:05:19.294752 IP 192.168.43.124.8880 > 192.168.43.146.7771: UDP, length 120
01:05:19.317743 IP 192.168.43.146.8880 > 192.168.43.147.7772: UDP, length 120
01:05:19.344671 IP 192.168.43.124.8880 > 192.168.43.146.7771: UDP, length 120
01:05:19.367749 IP 192.168.43.146.8880 > 192.168.43.147.7772: UDP, length 120
01:05:19.392042 IP 192.168.43.124.8880 > 192.168.43.146.7771: UDP, length 120
01:05:19.417746 IP 192.168.43.146.8880 > 192.168.43.147.7772: UDP, length 120
01:05:19.441777 IP 192.168.43.124.8880 > 192.168.43.146.7771: UDP, length 120
01:05:19.467757 IP 192.168.43.146.8880 > 192.168.43.147.7772: UDP, length 120
01:05:19.499882 IP 192.168.43.124.8880 > 192.168.43.146.7771: UDP, length 120
01:05:19.517756 IP 192.168.43.146.8880 > 192.168.43.147.7772: UDP, length 120
01:05:19.538806 IP 192.168.43.124.8880 > 192.168.43.146.7771: UDP, length 120
01:05:19.567747 IP 192.168.43.146.8880 > 192.168.43.147.7772: UDP, length 120
01:05:19.594277 IP 192.168.43.124.8880 > 192.168.43.146.7771: UDP, length 120
01:05:19.617757 IP 192.168.43.146.8880 > 192.168.43.147.7772: UDP, length 120
01:05:19.643679 IP 192.168.43.124.8880 > 192.168.43.146.7771: UDP, length 120
01:05:19.667749 IP 192.168.43.146.8880 > 192.168.43.147.7772: UDP, length 120
01:05:19.698670 IP 192.168.43.124.8880 > 192.168.43.146.7771: UDP, length 120
01:05:19.717744 IP 192.168.43.146.8880 > 192.168.43.147.7772: UDP, length 120
01:05:19.745711 IP 192.168.43.124.8880 > 192.168.43.146.7771: UDP, length 120
01:05:19.767745 IP 192.168.43.146.8880 > 192.168.43.147.7772: UDP, length 120
01:05:19.800837 IP 192.168.43.124.8880 > 192.168.43.146.7771: UDP, length 120
01:05:19.817747 IP 192.168.43.146.8880 > 192.168.43.147.7772: UDP, length 120
01:05:19.856072 IP 192.168.43.124.8880 > 192.168.43.146.7771: UDP, length 120
01:05:19.867786 IP 192.168.43.146.8880 > 192.168.43.147.7772: UDP, length 120
01:05:19.891765 IP 192.168.43.124.8880 > 192.168.43.146.7771: UDP, length 120
01:05:19.917749 IP 192.168.43.146.8880 > 192.168.43.147.7772: UDP, length 120
01:05:19.941909 IP 192.168.43.124.8880 > 192.168.43.146.7771: UDP, length 120
01:05:19.967745 IP 192.168.43.146.8880 > 192.168.43.147.7772: UDP, length 120
01:05:19.992703 IP 192.168.43.124.8880 > 192.168.43.146.7771: UDP, length 120
01:05:20.017744 IP 192.168.43.146.8880 > 192.168.43.147.7772: UDP, length 120
01:05:20.047957 IP 192.168.43.124.8880 > 192.168.43.146.7771: UDP, length 120
01:05:20.067749 IP 192.168.43.146.8880 > 192.168.43.147.7772: UDP, length 120
01:05:20.092340 IP 192.168.43.124.8880 > 192.168.43.146.7771: UDP, length 120
01:05:20.117745 IP 192.168.43.146.8880 > 192.168.43.147.7772: UDP, length 120
01:05:20.143711 IP 192.168.43.124.8880 > 192.168.43.146.7771: UDP, length 120
01:05:20.167746 IP 192.168.43.146.8880 > 192.168.43.147.7772: UDP, length 120
01:05:20.195791 IP 192.168.43.124.8880 > 192.168.43.146.7771: UDP, length 120
01:05:20.217743 IP 192.168.43.146.8880 > 192.168.43.147.7772: UDP, length 120
01:05:20.254445 IP 192.168.43.124.8880 > 192.168.43.146.7771: UDP, length 120
01:05:20.267748 IP 192.168.43.146.8880 > 192.168.43.147.7772: UDP, length 120
01:05:20.311435 IP 192.168.43.124.8880 > 192.168.43.146.7771: UDP, length 120
01:05:20.317743 IP 192.168.43.146.8880 > 192.168.43.147.7772: UDP, length 120
01:05:20.341996 IP 192.168.43.124.8880 > 192.168.43.146.7771: UDP, length 120
01:05:20.367746 IP 192.168.43.146.8880 > 192.168.43.147.7772: UDP, length 120
01:05:20.391974 IP 192.168.43.124.8880 > 192.168.43.146.7771: UDP, length 120
01:05:20.417743 IP 192.168.43.146.8880 > 192.168.43.147.7772: UDP, length 120
01:05:20.449956 IP 192.168.43.124.8880 > 192.168.43.146.7771: UDP, length 120
01:05:20.467746 IP 192.168.43.146.8880 > 192.168.43.147.7772: UDP, length 120
01:05:20.493499 IP 192.168.43.124.8880 > 192.168.43.146.7771: UDP, length 120
01:05:20.517751 IP 192.168.43.146.8880 > 192.168.43.147.7772: UDP, length 120
01:05:20.542133 IP 192.168.43.124.8880 > 192.168.43.146.7771: UDP, length 120
01:05:20.567754 IP 192.168.43.146.8880 > 192.168.43.147.7772: UDP, length 120
01:05:20.592025 IP 192.168.43.124.8880 > 192.168.43.146.7771: UDP, length 120
01:05:20.617753 IP 192.168.43.146.8880 > 192.168.43.147.7772: UDP, length 120
01:05:20.641837 IP 192.168.43.124.8880 > 192.168.43.146.7771: UDP, length 120
01:05:20.667748 IP 192.168.43.146.8880 > 192.168.43.147.7772: UDP, length 120
01:05:20.699410 IP 192.168.43.124.8880 > 192.168.43.146.7771: UDP, length 120
01:05:20.717745 IP 192.168.43.146.8880 > 192.168.43.147.7772: UDP, length 120
01:05:20.757297 IP 192.168.43.124.8880 > 192.168.43.146.7771: UDP, length 120
01:05:20.767743 IP 192.168.43.146.8880 > 192.168.43.147.7772: UDP, length 120
01:05:20.810430 IP 192.168.43.124.8880 > 192.168.43.146.7771: UDP, length 120
01:05:20.817742 IP 192.168.43.146.8880 > 192.168.43.147.7772: UDP, length 120
01:05:20.841832 IP 192.168.43.124.8880 > 192.168.43.146.7771: UDP, length 120
01:05:20.867745 IP 192.168.43.146.8880 > 192.168.43.147.7772: UDP, length 120
01:05:20.897333 IP 192.168.43.124.8880 > 192.168.43.146.7771: UDP, length 120
01:05:20.917744 IP 192.168.43.146.8880 > 192.168.43.147.7772: UDP, length 120
01:05:20.942085 IP 192.168.43.124.8880 > 192.168.43.146.7771: UDP, length 120
01:05:20.967744 IP 192.168.43.146.8880 > 192.168.43.147.7772: UDP, length 120
01:05:20.991961 IP 192.168.43.124.8880 > 192.168.43.146.7771: UDP, length 120
01:05:21.017745 IP 192.168.43.146.8880 > 192.168.43.147.7772: UDP, length 120
01:05:21.042445 IP 192.168.43.124.8880 > 192.168.43.146.7771: UDP, length 120
01:05:21.067748 IP 192.168.43.146.8880 > 192.168.43.147.7772: UDP, length 120
01:05:21.100615 IP 192.168.43.124.8880 > 192.168.43.146.7771: UDP, length 120
01:05:21.117744 IP 192.168.43.146.8880 > 192.168.43.147.7772: UDP, length 120
01:05:21.155866 IP 192.168.43.124.8880 > 192.168.43.146.7771: UDP, length 120
01:05:21.167761 IP 192.168.43.146.8880 > 192.168.43.147.7772: UDP, length 120
01:05:21.194179 IP 192.168.43.124.8880 > 192.168.43.146.7771: UDP, length 120
01:05:21.217752 IP 192.168.43.146.8880 > 192.168.43.147.7772: UDP, length 120
01:05:21.252548 IP 192.168.43.124.8880 > 192.168.43.146.7771: UDP, length 120
01:05:21.267744 IP 192.168.43.146.8880 > 192.168.43.147.7772: UDP, length 120
01:05:21.307082 IP 192.168.43.124.8880 > 192.168.43.146.7771: UDP, length 120
01:05:21.317759 IP 192.168.43.146.8880 > 192.168.43.147.7772: UDP, length 120
01:05:21.343400 IP 192.168.43.124.8880 > 192.168.43.146.7771: UDP, length 120
01:05:21.367778 IP 192.168.43.146.8880 > 192.168.43.147.7772: UDP, length 120
01:05:21.394068 IP 192.168.43.124.8880 > 192.168.43.146.7771: UDP, length 120
01:05:21.417746 IP 192.168.43.146.8880 > 192.168.43.147.7772: UDP, length 120
01:05:21.445463 IP 192.168.43.124.8880 > 192.168.43.146.7771: UDP, length 120
01:05:21.467744 IP 192.168.43.146.8880 > 192.168.43.147.7772: UDP, length 120
01:05:21.493986 IP 192.168.43.124.8880 > 192.168.43.146.7771: UDP, length 120
01:05:21.517744 IP 192.168.43.146.8880 > 192.168.43.147.7772: UDP, length 120
01:05:21.544824 IP 192.168.43.124.8880 > 192.168.43.146.7771: UDP, length 120
01:05:21.567754 IP 192.168.43.146.8880 > 192.168.43.147.7772: UDP, length 120
01:05:21.601876 IP 192.168.43.124.8880 > 192.168.43.146.7771: UDP, length 120
01:05:21.617763 IP 192.168.43.146.8880 > 192.168.43.147.7772: UDP, length 120
01:05:21.655490 IP 192.168.43.124.8880 > 192.168.43.146.7771: UDP, length 120
01:05:21.667753 IP 192.168.43.146.8880 > 192.168.43.147.7772: UDP, length 120
01:05:21.717747 IP 192.168.43.146.8880 > 192.168.43.147.7772: UDP, length 120
01:05:21.767746 IP 192.168.43.146.8880 > 192.168.43.147.7772: UDP, length 120
01:05:21.817745 IP 192.168.43.146.8880 > 192.168.43.147.7772: UDP, length 120
01:05:21.862108 IP 192.168.43.124.8880 > 192.168.43.146.7771: UDP, length 120
01:05:21.862275 IP 192.168.43.124.8880 > 192.168.43.146.7771: UDP, length 120
01:05:21.862349 IP 192.168.43.124.8880 > 192.168.43.146.7771: UDP, length 120
01:05:21.867816 IP 192.168.43.146.8880 > 192.168.43.147.7772: UDP, length 120
01:05:21.917824 IP 192.168.43.146.8880 > 192.168.43.147.7772: UDP, length 120
01:05:21.967775 IP 192.168.43.146.8880 > 192.168.43.147.7772: UDP, length 120
01:05:22.015007 IP 192.168.43.124.8880 > 192.168.43.146.7771: UDP, length 120
01:05:22.015164 IP 192.168.43.124.8880 > 192.168.43.146.7771: UDP, length 120
01:05:22.015235 IP 192.168.43.124.8880 > 192.168.43.146.7771: UDP, length 120
01:05:22.017750 IP 192.168.43.146.8880 > 192.168.43.147.7772: UDP, length 120
01:05:22.067753 IP 192.168.43.146.8880 > 192.168.43.147.7772: UDP, length 120
01:05:22.117743 IP 192.168.43.146.8880 > 192.168.43.147.7772: UDP, length 120
01:05:22.148078 IP 192.168.43.124.8880 > 192.168.43.146.7771: UDP, length 120
01:05:22.148225 IP 192.168.43.124.8880 > 192.168.43.146.7771: UDP, length 120
01:05:22.148297 IP 192.168.43.124.8880 > 192.168.43.146.7771: UDP, length 120
01:05:22.167746 IP 192.168.43.146.8880 > 192.168.43.147.7772: UDP, length 120
01:05:22.217742 IP 192.168.43.146.8880 > 192.168.43.147.7772: UDP, length 120
01:05:22.267743 IP 192.168.43.146.8880 > 192.168.43.147.7772: UDP, length 120
01:05:22.305981 IP 192.168.43.124.8880 > 192.168.43.146.7771: UDP, length 120
01:05:22.306120 IP 192.168.43.124.8880 > 192.168.43.146.7771: UDP, length 120
01:05:22.317744 IP 192.168.43.146.8880 > 192.168.43.147.7772: UDP, length 120
01:05:22.367745 IP 192.168.43.146.8880 > 192.168.43.147.7772: UDP, length 120
01:05:22.414232 IP 192.168.43.124.8880 > 192.168.43.146.7771: UDP, length 120
01:05:22.414367 IP 192.168.43.124.8880 > 192.168.43.146.7771: UDP, length 120
01:05:22.414488 IP 192.168.43.124.8880 > 192.168.43.146.7771: UDP, length 120
01:05:22.417744 IP 192.168.43.146.8880 > 192.168.43.147.7772: UDP, length 120
01:05:22.467746 IP 192.168.43.146.8880 > 192.168.43.147.7772: UDP, length 120
01:05:22.517743 IP 192.168.43.146.8880 > 192.168.43.147.7772: UDP, length 120
01:05:22.543630 IP 192.168.43.124.8880 > 192.168.43.146.7771: UDP, length 120
01:05:22.543767 IP 192.168.43.124.8880 > 192.168.43.146.7771: UDP, length 120
01:05:22.543887 IP 192.168.43.124.8880 > 192.168.43.146.7771: UDP, length 120
01:05:22.567748 IP 192.168.43.146.8880 > 192.168.43.147.7772: UDP, length 120
01:05:22.617786 IP 192.168.43.146.8880 > 192.168.43.147.7772: UDP, length 120
01:05:22.667781 IP 192.168.43.146.8880 > 192.168.43.147.7772: UDP, length 120
01:05:22.693375 IP 192.168.43.124.8880 > 192.168.43.146.7771: UDP, length 120
01:05:22.693667 IP 192.168.43.124.8880 > 192.168.43.146.7771: UDP, length 120
01:05:22.693877 IP 192.168.43.124.8880 > 192.168.43.146.7771: UDP, length 120
01:05:22.717774 IP 192.168.43.146.8880 > 192.168.43.147.7772: UDP, length 120
01:05:22.767772 IP 192.168.43.146.8880 > 192.168.43.147.7772: UDP, length 120
01:05:22.817768 IP 192.168.43.146.8880 > 192.168.43.147.7772: UDP, length 120
01:05:22.841453 IP 192.168.43.124.8880 > 192.168.43.146.7771: UDP, length 120
01:05:22.841854 IP 192.168.43.124.8880 > 192.168.43.146.7771: UDP, length 120
01:05:22.867812 IP 192.168.43.146.8880 > 192.168.43.147.7772: UDP, length 120
01:05:22.919878 IP 192.168.43.146.8880 > 192.168.43.147.7772: UDP, length 120
01:05:22.942143 IP 192.168.43.124.8880 > 192.168.43.146.7771: UDP, length 120
01:05:22.942602 IP 192.168.43.124.8880 > 192.168.43.146.7771: UDP, length 120
01:05:22.942886 IP 192.168.43.124.8880 > 192.168.43.146.7771: UDP, length 120
01:05:22.967905 IP 192.168.43.146.8880 > 192.168.43.147.7772: UDP, length 120
01:05:23.017836 IP 192.168.43.146.8880 > 192.168.43.147.7772: UDP, length 120
01:05:23.067826 IP 192.168.43.146.8880 > 192.168.43.147.7772: UDP, length 120
01:05:23.109475 IP 192.168.43.124.8880 > 192.168.43.146.7771: UDP, length 120
01:05:23.109589 IP 192.168.43.124.8880 > 192.168.43.146.7771: UDP, length 120
01:05:23.109671 IP 192.168.43.124.8880 > 192.168.43.146.7771: UDP, length 120
01:05:23.117836 IP 192.168.43.146.8880 > 192.168.43.147.7772: UDP, length 120
01:05:23.167814 IP 192.168.43.146.8880 > 192.168.43.147.7772: UDP, length 120
01:05:23.217823 IP 192.168.43.146.8880 > 192.168.43.147.7772: UDP, length 120
01:05:23.221389 IP 192.168.43.124.8880 > 192.168.43.146.7771: UDP, length 120
01:05:23.221492 IP 192.168.43.124.8880 > 192.168.43.146.7771: UDP, length 120
01:05:23.267831 IP 192.168.43.146.8880 > 192.168.43.147.7772: UDP, length 120
01:05:23.317822 IP 192.168.43.146.8880 > 192.168.43.147.7772: UDP, length 120
01:05:23.348805 IP 192.168.43.124.8880 > 192.168.43.146.7771: UDP, length 120
01:05:23.349084 IP 192.168.43.124.8880 > 192.168.43.146.7771: UDP, length 120
01:05:23.349285 IP 192.168.43.124.8880 > 192.168.43.146.7771: UDP, length 120
01:05:23.367859 IP 192.168.43.146.8880 > 192.168.43.147.7772: UDP, length 120
01:05:23.417799 IP 192.168.43.146.8880 > 192.168.43.147.7772: UDP, length 120
01:05:23.450008 IP 192.168.43.124.8880 > 192.168.43.146.7771: UDP, length 120
01:05:23.450503 IP 192.168.43.124.8880 > 192.168.43.146.7771: UDP, length 120
01:05:23.467760 IP 192.168.43.146.8880 > 192.168.43.147.7772: UDP, length 120
01:05:23.517747 IP 192.168.43.146.8880 > 192.168.43.147.7772: UDP, length 120
01:05:23.567228 IP 192.168.43.124.8880 > 192.168.43.146.7771: UDP, length 120
01:05:23.567377 IP 192.168.43.124.8880 > 192.168.43.146.7771: UDP, length 120
01:05:23.567750 IP 192.168.43.146.8880 > 192.168.43.147.7772: UDP, length 120
01:05:23.617752 IP 192.168.43.146.8880 > 192.168.43.147.7772: UDP, length 120
01:05:23.667747 IP 192.168.43.146.8880 > 192.168.43.147.7772: UDP, length 120
01:05:23.717235 IP 192.168.43.124.8880 > 192.168.43.146.7771: UDP, length 120
01:05:23.717399 IP 192.168.43.124.8880 > 192.168.43.146.7771: UDP, length 120
01:05:23.717472 IP 192.168.43.124.8880 > 192.168.43.146.7771: UDP, length 120
01:05:23.717750 IP 192.168.43.146.8880 > 192.168.43.147.7772: UDP, length 120
01:05:23.767745 IP 192.168.43.146.8880 > 192.168.43.147.7772: UDP, length 120
01:05:23.817742 IP 192.168.43.146.8880 > 192.168.43.147.7772: UDP, length 120
01:05:23.857946 IP 192.168.43.124.8880 > 192.168.43.146.7771: UDP, length 120
01:05:23.858021 IP 192.168.43.124.8880 > 192.168.43.146.7771: UDP, length 120
01:05:23.867743 IP 192.168.43.146.8880 > 192.168.43.147.7772: UDP, length 120
01:05:23.917742 IP 192.168.43.146.8880 > 192.168.43.147.7772: UDP, length 120
01:05:23.965280 IP 192.168.43.124.8880 > 192.168.43.146.7771: UDP, length 120
01:05:23.965432 IP 192.168.43.124.8880 > 192.168.43.146.7771: UDP, length 120
01:05:23.965508 IP 192.168.43.124.8880 > 192.168.43.146.7771: UDP, length 120
01:05:23.967743 IP 192.168.43.146.8880 > 192.168.43.147.7772: UDP, length 120
01:05:24.017795 IP 192.168.43.146.8880 > 192.168.43.147.7772: UDP, length 120
01:05:24.067759 IP 192.168.43.146.8880 > 192.168.43.147.7772: UDP, length 120
01:05:24.111772 IP 192.168.43.124.8880 > 192.168.43.146.7771: UDP, length 120
01:05:24.111924 IP 192.168.43.124.8880 > 192.168.43.146.7771: UDP, length 120
01:05:24.111997 IP 192.168.43.124.8880 > 192.168.43.146.7771: UDP, length 120
01:05:24.117748 IP 192.168.43.146.8880 > 192.168.43.147.7772: UDP, length 120
01:05:24.167744 IP 192.168.43.146.8880 > 192.168.43.147.7772: UDP, length 120
01:05:24.217742 IP 192.168.43.146.8880 > 192.168.43.147.7772: UDP, length 120
01:05:24.267744 IP 192.168.43.146.8880 > 192.168.43.147.7772: UDP, length 120
01:05:24.272804 IP 192.168.43.124.8880 > 192.168.43.146.7771: UDP, length 120
01:05:24.272949 IP 192.168.43.124.8880 > 192.168.43.146.7771: UDP, length 120
01:05:24.273021 IP 192.168.43.124.8880 > 192.168.43.146.7771: UDP, length 120
01:05:24.317744 IP 192.168.43.146.8880 > 192.168.43.147.7772: UDP, length 120
01:05:24.367784 IP 192.168.43.146.8880 > 192.168.43.147.7772: UDP, length 120
01:05:24.399926 IP 192.168.43.124.8880 > 192.168.43.146.7771: UDP, length 120
01:05:24.400072 IP 192.168.43.124.8880 > 192.168.43.146.7771: UDP, length 120
01:05:24.400145 IP 192.168.43.124.8880 > 192.168.43.146.7771: UDP, length 120
01:05:24.417753 IP 192.168.43.146.8880 > 192.168.43.147.7772: UDP, length 120
01:05:24.467745 IP 192.168.43.146.8880 > 192.168.43.147.7772: UDP, length 120
01:05:24.517712 IP 192.168.43.124.8880 > 192.168.43.146.7771: UDP, length 120
01:05:24.517751 IP 192.168.43.146.8880 > 192.168.43.147.7772: UDP, length 120
01:05:24.519142 IP 192.168.43.124.8880 > 192.168.43.146.7771: UDP, length 120
01:05:24.542143 IP 192.168.43.124.8880 > 192.168.43.146.7771: UDP, length 120
01:05:24.567747 IP 192.168.43.146.8880 > 192.168.43.147.7772: UDP, length 120
01:05:24.591837 IP 192.168.43.124.8880 > 192.168.43.146.7771: UDP, length 120
01:05:24.617749 IP 192.168.43.146.8880 > 192.168.43.147.7772: UDP, length 120
01:05:24.657426 IP 192.168.43.124.8880 > 192.168.43.146.7771: UDP, length 120
01:05:24.667745 IP 192.168.43.146.8880 > 192.168.43.147.7772: UDP, length 120
01:05:24.691916 IP 192.168.43.124.8880 > 192.168.43.146.7771: UDP, length 120
01:05:24.717744 IP 192.168.43.146.8880 > 192.168.43.147.7772: UDP, length 120
01:05:24.742002 IP 192.168.43.124.8880 > 192.168.43.146.7771: UDP, length 120
01:05:24.767749 IP 192.168.43.146.8880 > 192.168.43.147.7772: UDP, length 120
01:05:24.809270 IP 192.168.43.124.8880 > 192.168.43.146.7771: UDP, length 120
01:05:24.817748 IP 192.168.43.146.8880 > 192.168.43.147.7772: UDP, length 120
01:05:24.841929 IP 192.168.43.124.8880 > 192.168.43.146.7771: UDP, length 120
01:05:24.867746 IP 192.168.43.146.8880 > 192.168.43.147.7772: UDP, length 120
01:05:24.891766 IP 192.168.43.124.8880 > 192.168.43.146.7771: UDP, length 120
01:05:24.917744 IP 192.168.43.146.8880 > 192.168.43.147.7772: UDP, length 120
01:05:24.957263 IP 192.168.43.124.8880 > 192.168.43.146.7771: UDP, length 120
01:05:24.967747 IP 192.168.43.146.8880 > 192.168.43.147.7772: UDP, length 120
01:05:24.993757 IP 192.168.43.124.8880 > 192.168.43.146.7771: UDP, length 120
01:05:25.017797 IP 192.168.43.146.8880 > 192.168.43.147.7772: UDP, length 120
01:05:25.041822 IP 192.168.43.124.8880 > 192.168.43.146.7771: UDP, length 120
01:05:25.067763 IP 192.168.43.146.8880 > 192.168.43.147.7772: UDP, length 120
01:05:25.109946 IP 192.168.43.124.8880 > 192.168.43.146.7771: UDP, length 120
01:05:25.117747 IP 192.168.43.146.8880 > 192.168.43.147.7772: UDP, length 120
01:05:25.141908 IP 192.168.43.124.8880 > 192.168.43.146.7771: UDP, length 120
01:05:25.167746 IP 192.168.43.146.8880 > 192.168.43.147.7772: UDP, length 120
01:05:25.191835 IP 192.168.43.124.8880 > 192.168.43.146.7771: UDP, length 120
01:05:25.217745 IP 192.168.43.146.8880 > 192.168.43.147.7772: UDP, length 120
01:05:25.257176 IP 192.168.43.124.8880 > 192.168.43.146.7771: UDP, length 120
01:05:25.267747 IP 192.168.43.146.8880 > 192.168.43.147.7772: UDP, length 120
01:05:25.291903 IP 192.168.43.124.8880 > 192.168.43.146.7771: UDP, length 120
01:05:25.317743 IP 192.168.43.146.8880 > 192.168.43.147.7772: UDP, length 120
01:05:25.341820 IP 192.168.43.124.8880 > 192.168.43.146.7771: UDP, length 120
01:05:25.367746 IP 192.168.43.146.8880 > 192.168.43.147.7772: UDP, length 120
01:05:25.410963 IP 192.168.43.124.8880 > 192.168.43.146.7771: UDP, length 120
01:05:25.417741 IP 192.168.43.146.8880 > 192.168.43.147.7772: UDP, length 120
01:05:25.442759 IP 192.168.43.124.8880 > 192.168.43.146.7771: UDP, length 120
01:05:25.467747 IP 192.168.43.146.8880 > 192.168.43.147.7772: UDP, length 120
01:05:25.493486 IP 192.168.43.124.8880 > 192.168.43.146.7771: UDP, length 120
01:05:25.517745 IP 192.168.43.146.8880 > 192.168.43.147.7772: UDP, length 120
01:05:25.567209 IP 192.168.43.124.8880 > 192.168.43.146.7771: UDP, length 120
01:05:25.567746 IP 192.168.43.146.8880 > 192.168.43.147.7772: UDP, length 120
01:05:25.592558 IP 192.168.43.124.8880 > 192.168.43.146.7771: UDP, length 120
01:05:25.617755 IP 192.168.43.146.8880 > 192.168.43.147.7772: UDP, length 120
01:05:25.642247 IP 192.168.43.124.8880 > 192.168.43.146.7771: UDP, length 120
01:05:25.667747 IP 192.168.43.146.8880 > 192.168.43.147.7772: UDP, length 120
01:05:25.710571 IP 192.168.43.124.8880 > 192.168.43.146.7771: UDP, length 120
01:05:25.717742 IP 192.168.43.146.8880 > 192.168.43.147.7772: UDP, length 120
01:05:25.741911 IP 192.168.43.124.8880 > 192.168.43.146.7771: UDP, length 120
01:05:25.767743 IP 192.168.43.146.8880 > 192.168.43.147.7772: UDP, length 120
01:05:25.791069 IP 192.168.43.124.8880 > 192.168.43.146.7771: UDP, length 120
01:05:25.817751 IP 192.168.43.146.8880 > 192.168.43.147.7772: UDP, length 120
01:05:25.855416 IP 192.168.43.124.8880 > 192.168.43.146.7771: UDP, length 120
01:05:25.867759 IP 192.168.43.146.8880 > 192.168.43.147.7772: UDP, length 120
01:05:25.894020 IP 192.168.43.124.8880 > 192.168.43.146.7771: UDP, length 120
01:05:25.917746 IP 192.168.43.146.8880 > 192.168.43.147.7772: UDP, length 120
01:05:25.957320 IP 192.168.43.124.8880 > 192.168.43.146.7771: UDP, length 120
01:05:25.967743 IP 192.168.43.146.8880 > 192.168.43.147.7772: UDP, length 120
01:05:25.991973 IP 192.168.43.124.8880 > 192.168.43.146.7771: UDP, length 120
01:05:26.017798 IP 192.168.43.146.8880 > 192.168.43.147.7772: UDP, length 120
01:05:26.043813 IP 192.168.43.124.8880 > 192.168.43.146.7771: UDP, length 120
01:05:26.067763 IP 192.168.43.146.8880 > 192.168.43.147.7772: UDP, length 120
01:05:26.107946 IP 192.168.43.124.8880 > 192.168.43.146.7771: UDP, length 120
01:05:26.117745 IP 192.168.43.146.8880 > 192.168.43.147.7772: UDP, length 120
01:05:26.142074 IP 192.168.43.124.8880 > 192.168.43.146.7771: UDP, length 120
01:05:26.167756 IP 192.168.43.146.8880 > 192.168.43.147.7772: UDP, length 120
01:05:26.192164 IP 192.168.43.124.8880 > 192.168.43.146.7771: UDP, length 120
01:05:26.217749 IP 192.168.43.146.8880 > 192.168.43.147.7772: UDP, length 120
01:05:26.244171 IP 192.168.43.124.8880 > 192.168.43.146.7771: UDP, length 120
01:05:26.267748 IP 192.168.43.146.8880 > 192.168.43.147.7772: UDP, length 120
01:05:26.291934 IP 192.168.43.124.8880 > 192.168.43.146.7771: UDP, length 120
01:05:26.317744 IP 192.168.43.146.8880 > 192.168.43.147.7772: UDP, length 120
01:05:26.342375 IP 192.168.43.124.8880 > 192.168.43.146.7771: UDP, length 120
01:05:26.367747 IP 192.168.43.146.8880 > 192.168.43.147.7772: UDP, length 120
01:05:26.391829 IP 192.168.43.124.8880 > 192.168.43.146.7771: UDP, length 120
01:05:26.417744 IP 192.168.43.146.8880 > 192.168.43.147.7772: UDP, length 120
01:05:26.457151 IP 192.168.43.124.8880 > 192.168.43.146.7771: UDP, length 120
01:05:26.467746 IP 192.168.43.146.8880 > 192.168.43.147.7772: UDP, length 120
01:05:26.492157 IP 192.168.43.124.8880 > 192.168.43.146.7771: UDP, length 120
01:05:26.517744 IP 192.168.43.146.8880 > 192.168.43.147.7772: UDP, length 120
01:05:26.541884 IP 192.168.43.124.8880 > 192.168.43.146.7771: UDP, length 120
01:05:26.567746 IP 192.168.43.146.8880 > 192.168.43.147.7772: UDP, length 120
01:05:26.606418 IP 192.168.43.124.8880 > 192.168.43.146.7771: UDP, length 120
01:05:26.617766 IP 192.168.43.146.8880 > 192.168.43.147.7772: UDP, length 120
01:05:26.641896 IP 192.168.43.124.8880 > 192.168.43.146.7771: UDP, length 120
01:05:26.667750 IP 192.168.43.146.8880 > 192.168.43.147.7772: UDP, length 120
01:05:26.693135 IP 192.168.43.124.8880 > 192.168.43.146.7771: UDP, length 120
01:05:26.717744 IP 192.168.43.146.8880 > 192.168.43.147.7772: UDP, length 120
01:05:26.761506 IP 192.168.43.124.8880 > 192.168.43.146.7771: UDP, length 120
01:05:26.767746 IP 192.168.43.146.8880 > 192.168.43.147.7772: UDP, length 120
01:05:26.791917 IP 192.168.43.124.8880 > 192.168.43.146.7771: UDP, length 120
01:05:26.817744 IP 192.168.43.146.8880 > 192.168.43.147.7772: UDP, length 120
01:05:26.846868 IP 192.168.43.124.8880 > 192.168.43.146.7771: UDP, length 120
01:05:26.867750 IP 192.168.43.146.8880 > 192.168.43.147.7772: UDP, length 120
01:05:26.891876 IP 192.168.43.124.8880 > 192.168.43.146.7771: UDP, length 120
01:05:26.917749 IP 192.168.43.146.8880 > 192.168.43.147.7772: UDP, length 120
01:05:26.945302 IP 192.168.43.124.8880 > 192.168.43.146.7771: UDP, length 120
01:05:26.967746 IP 192.168.43.146.8880 > 192.168.43.147.7772: UDP, length 120
01:05:26.991754 IP 192.168.43.124.8880 > 192.168.43.146.7771: UDP, length 120
01:05:27.017812 IP 192.168.43.146.8880 > 192.168.43.147.7772: UDP, length 120
01:05:27.046647 IP 192.168.43.124.8880 > 192.168.43.146.7771: UDP, length 120
01:05:27.067774 IP 192.168.43.146.8880 > 192.168.43.147.7772: UDP, length 120
01:05:27.093498 IP 192.168.43.124.8880 > 192.168.43.146.7771: UDP, length 120
01:05:27.117748 IP 192.168.43.146.8880 > 192.168.43.147.7772: UDP, length 120
01:05:27.149042 IP 192.168.43.124.8880 > 192.168.43.146.7771: UDP, length 120
01:05:27.167747 IP 192.168.43.146.8880 > 192.168.43.147.7772: UDP, length 120
01:05:27.193600 IP 192.168.43.124.8880 > 192.168.43.146.7771: UDP, length 120
01:05:27.217744 IP 192.168.43.146.8880 > 192.168.43.147.7772: UDP, length 120
01:05:27.243862 IP 192.168.43.124.8880 > 192.168.43.146.7771: UDP, length 120
01:05:27.267746 IP 192.168.43.146.8880 > 192.168.43.147.7772: UDP, length 120
01:05:27.293642 IP 192.168.43.124.8880 > 192.168.43.146.7771: UDP, length 120
01:05:27.317742 IP 192.168.43.146.8880 > 192.168.43.147.7772: UDP, length 120
01:05:27.344729 IP 192.168.43.124.8880 > 192.168.43.146.7771: UDP, length 120
01:05:27.367778 IP 192.168.43.146.8880 > 192.168.43.147.7772: UDP, length 120
01:05:27.394197 IP 192.168.43.124.8880 > 192.168.43.146.7771: UDP, length 120
01:05:27.417744 IP 192.168.43.146.8880 > 192.168.43.147.7772: UDP, length 120
01:05:27.443640 IP 192.168.43.124.8880 > 192.168.43.146.7771: UDP, length 120
01:05:27.467747 IP 192.168.43.146.8880 > 192.168.43.147.7772: UDP, length 120
01:05:27.493633 IP 192.168.43.124.8880 > 192.168.43.146.7771: UDP, length 120
01:05:27.517746 IP 192.168.43.146.8880 > 192.168.43.147.7772: UDP, length 120
01:05:27.543623 IP 192.168.43.124.8880 > 192.168.43.146.7771: UDP, length 120
01:05:27.567746 IP 192.168.43.146.8880 > 192.168.43.147.7772: UDP, length 120
01:05:27.597023 IP 192.168.43.124.8880 > 192.168.43.146.7771: UDP, length 120
01:05:27.617780 IP 192.168.43.146.8880 > 192.168.43.147.7772: UDP, length 120
01:05:27.645610 IP 192.168.43.124.8880 > 192.168.43.146.7771: UDP, length 120
01:05:27.667775 IP 192.168.43.146.8880 > 192.168.43.147.7772: UDP, length 120
01:05:27.699319 IP 192.168.43.124.8880 > 192.168.43.146.7771: UDP, length 120
01:05:27.717768 IP 192.168.43.146.8880 > 192.168.43.147.7772: UDP, length 120
01:05:27.742475 IP 192.168.43.124.8880 > 192.168.43.146.7771: UDP, length 120
01:05:27.767770 IP 192.168.43.146.8880 > 192.168.43.147.7772: UDP, length 120
01:05:27.799330 IP 192.168.43.124.8880 > 192.168.43.146.7771: UDP, length 120
01:05:27.817768 IP 192.168.43.146.8880 > 192.168.43.147.7772: UDP, length 120
01:05:27.844234 IP 192.168.43.124.8880 > 192.168.43.146.7771: UDP, length 120
01:05:27.867771 IP 192.168.43.146.8880 > 192.168.43.147.7772: UDP, length 120
01:05:27.917770 IP 192.168.43.146.8880 > 192.168.43.147.7772: UDP, length 120
01:05:27.945001 IP 192.168.43.124.8880 > 192.168.43.146.7771: UDP, length 120
01:05:27.967772 IP 192.168.43.146.8880 > 192.168.43.147.7772: UDP, length 120
01:05:27.993826 IP 192.168.43.124.8880 > 192.168.43.146.7771: UDP, length 120
01:05:28.017774 IP 192.168.43.146.8880 > 192.168.43.147.7772: UDP, length 120
01:05:28.044272 IP 192.168.43.124.8880 > 192.168.43.146.7771: UDP, length 120
01:05:28.067822 IP 192.168.43.146.8880 > 192.168.43.147.7772: UDP, length 120
01:05:28.115252 IP 192.168.43.124.8880 > 192.168.43.146.7771: UDP, length 120
01:05:28.117778 IP 192.168.43.146.8880 > 192.168.43.147.7772: UDP, length 120
01:05:28.143822 IP 192.168.43.124.8880 > 192.168.43.146.7771: UDP, length 120
01:05:28.167776 IP 192.168.43.146.8880 > 192.168.43.147.7772: UDP, length 120
01:05:28.196135 IP 192.168.43.124.8880 > 192.168.43.146.7771: UDP, length 120
01:05:28.217771 IP 192.168.43.146.8880 > 192.168.43.147.7772: UDP, length 120
01:05:28.244944 IP 192.168.43.124.8880 > 192.168.43.146.7771: UDP, length 120
01:05:28.267773 IP 192.168.43.146.8880 > 192.168.43.147.7772: UDP, length 120
01:05:28.296267 IP 192.168.43.124.8880 > 192.168.43.146.7771: UDP, length 120
01:05:28.317771 IP 192.168.43.146.8880 > 192.168.43.147.7772: UDP, length 120
01:05:28.344293 IP 192.168.43.124.8880 > 192.168.43.146.7771: UDP, length 120
01:05:28.367773 IP 192.168.43.146.8880 > 192.168.43.147.7772: UDP, length 120
01:05:28.390808 IP 192.168.43.124.8880 > 192.168.43.146.7771: UDP, length 120
01:05:28.417900 IP 192.168.43.146.8880 > 192.168.43.147.7772: UDP, length 120
01:05:28.441583 IP 192.168.43.124.8880 > 192.168.43.146.7771: UDP, length 120
01:05:28.467907 IP 192.168.43.146.8880 > 192.168.43.147.7772: UDP, length 120
01:05:28.494075 IP 192.168.43.124.8880 > 192.168.43.146.7771: UDP, length 120
01:05:28.517821 IP 192.168.43.146.8880 > 192.168.43.147.7772: UDP, length 120
01:05:28.543700 IP 192.168.43.124.8880 > 192.168.43.146.7771: UDP, length 120
01:05:28.567788 IP 192.168.43.146.8880 > 192.168.43.147.7772: UDP, length 120
01:05:28.588836 IP 192.168.43.124.8880 > 192.168.43.146.7771: UDP, length 120
01:05:28.617851 IP 192.168.43.146.8880 > 192.168.43.147.7772: UDP, length 120
01:05:28.644401 IP 192.168.43.124.8880 > 192.168.43.146.7771: UDP, length 120
01:05:28.667822 IP 192.168.43.146.8880 > 192.168.43.147.7772: UDP, length 120
01:05:28.693723 IP 192.168.43.124.8880 > 192.168.43.146.7771: UDP, length 120
01:05:28.717843 IP 192.168.43.146.8880 > 192.168.43.147.7772: UDP, length 120
01:05:28.744634 IP 192.168.43.124.8880 > 192.168.43.146.7771: UDP, length 120
01:05:28.767820 IP 192.168.43.146.8880 > 192.168.43.147.7772: UDP, length 120
01:05:28.793738 IP 192.168.43.124.8880 > 192.168.43.146.7771: UDP, length 120
01:05:28.817840 IP 192.168.43.146.8880 > 192.168.43.147.7772: UDP, length 120
01:05:28.840822 IP 192.168.43.124.8880 > 192.168.43.146.7771: UDP, length 120
01:05:28.867799 IP 192.168.43.146.8880 > 192.168.43.147.7772: UDP, length 120
01:05:28.893652 IP 192.168.43.124.8880 > 192.168.43.146.7771: UDP, length 120
01:05:28.917752 IP 192.168.43.146.8880 > 192.168.43.147.7772: UDP, length 120
01:05:28.943626 IP 192.168.43.124.8880 > 192.168.43.146.7771: UDP, length 120
01:05:28.967749 IP 192.168.43.146.8880 > 192.168.43.147.7772: UDP, length 120
01:05:28.994528 IP 192.168.43.124.8880 > 192.168.43.146.7771: UDP, length 120
01:05:29.017753 IP 192.168.43.146.8880 > 192.168.43.147.7772: UDP, length 120
01:05:29.041795 IP 192.168.43.124.8880 > 192.168.43.146.7771: UDP, length 120
01:05:29.067753 IP 192.168.43.146.8880 > 192.168.43.147.7772: UDP, length 120
01:05:29.094670 IP 192.168.43.124.8880 > 192.168.43.146.7771: UDP, length 120
01:05:29.117746 IP 192.168.43.146.8880 > 192.168.43.147.7772: UDP, length 120
01:05:29.143620 IP 192.168.43.124.8880 > 192.168.43.146.7771: UDP, length 120
01:05:29.167745 IP 192.168.43.146.8880 > 192.168.43.147.7772: UDP, length 120
01:05:29.193863 IP 192.168.43.124.8880 > 192.168.43.146.7771: UDP, length 120
01:05:29.217744 IP 192.168.43.146.8880 > 192.168.43.147.7772: UDP, length 120
01:05:29.244205 IP 192.168.43.124.8880 > 192.168.43.146.7771: UDP, length 120
01:05:29.267746 IP 192.168.43.146.8880 > 192.168.43.147.7772: UDP, length 120
01:05:29.296215 IP 192.168.43.124.8880 > 192.168.43.146.7771: UDP, length 120
01:05:29.317744 IP 192.168.43.146.8880 > 192.168.43.147.7772: UDP, length 120
01:05:29.343617 IP 192.168.43.124.8880 > 192.168.43.146.7771: UDP, length 120
01:05:29.367748 IP 192.168.43.146.8880 > 192.168.43.147.7772: UDP, length 120
01:05:29.401874 IP 192.168.43.124.8880 > 192.168.43.146.7771: UDP, length 120
01:05:29.417743 IP 192.168.43.146.8880 > 192.168.43.147.7772: UDP, length 120
01:05:29.443562 IP 192.168.43.124.8880 > 192.168.43.146.7771: UDP, length 120
01:05:29.467747 IP 192.168.43.146.8880 > 192.168.43.147.7772: UDP, length 120
01:05:29.493885 IP 192.168.43.124.8880 > 192.168.43.146.7771: UDP, length 120
01:05:29.517742 IP 192.168.43.146.8880 > 192.168.43.147.7772: UDP, length 120
01:05:29.543624 IP 192.168.43.124.8880 > 192.168.43.146.7771: UDP, length 120
01:05:29.567745 IP 192.168.43.146.8880 > 192.168.43.147.7772: UDP, length 120
01:05:29.593628 IP 192.168.43.124.8880 > 192.168.43.146.7771: UDP, length 120
01:05:29.617751 IP 192.168.43.146.8880 > 192.168.43.147.7772: UDP, length 120
01:05:29.643840 IP 192.168.43.124.8880 > 192.168.43.146.7771: UDP, length 120
01:05:29.667745 IP 192.168.43.146.8880 > 192.168.43.147.7772: UDP, length 120
01:05:29.693617 IP 192.168.43.124.8880 > 192.168.43.146.7771: UDP, length 120
01:05:29.717742 IP 192.168.43.146.8880 > 192.168.43.147.7772: UDP, length 120
01:05:29.746345 IP 192.168.43.124.8880 > 192.168.43.146.7771: UDP, length 120
01:05:29.767743 IP 192.168.43.146.8880 > 192.168.43.147.7772: UDP, length 120
01:05:29.793982 IP 192.168.43.124.8880 > 192.168.43.146.7771: UDP, length 120
01:05:29.817746 IP 192.168.43.146.8880 > 192.168.43.147.7772: UDP, length 120
01:05:29.847093 IP 192.168.43.124.8880 > 192.168.43.146.7771: UDP, length 120
01:05:29.867745 IP 192.168.43.146.8880 > 192.168.43.147.7772: UDP, length 120
01:05:29.893647 IP 192.168.43.124.8880 > 192.168.43.146.7771: UDP, length 120
01:05:29.917743 IP 192.168.43.146.8880 > 192.168.43.147.7772: UDP, length 120
01:05:29.944085 IP 192.168.43.124.8880 > 192.168.43.146.7771: UDP, length 120
01:05:29.967743 IP 192.168.43.146.8880 > 192.168.43.147.7772: UDP, length 120
01:05:29.994682 IP 192.168.43.124.8880 > 192.168.43.146.7771: UDP, length 120
01:05:30.017744 IP 192.168.43.146.8880 > 192.168.43.147.7772: UDP, length 120
01:05:30.047347 IP 192.168.43.124.8880 > 192.168.43.146.7771: UDP, length 120
01:05:30.067824 IP 192.168.43.146.8880 > 192.168.43.147.7772: UDP, length 120
01:05:30.093862 IP 192.168.43.124.8880 > 192.168.43.146.7771: UDP, length 120
01:05:30.117822 IP 192.168.43.146.8880 > 192.168.43.147.7772: UDP, length 120
01:05:30.143673 IP 192.168.43.124.8880 > 192.168.43.146.7771: UDP, length 120
01:05:30.167770 IP 192.168.43.146.8880 > 192.168.43.147.7772: UDP, length 120
01:05:30.193658 IP 192.168.43.124.8880 > 192.168.43.146.7771: UDP, length 120
01:05:30.217750 IP 192.168.43.146.8880 > 192.168.43.147.7772: UDP, length 120
01:05:30.244207 IP 192.168.43.124.8880 > 192.168.43.146.7771: UDP, length 120
01:05:30.267747 IP 192.168.43.146.8880 > 192.168.43.147.7772: UDP, length 120
01:05:30.293666 IP 192.168.43.124.8880 > 192.168.43.146.7771: UDP, length 120
01:05:30.317743 IP 192.168.43.146.8880 > 192.168.43.147.7772: UDP, length 120
01:05:30.344851 IP 192.168.43.124.8880 > 192.168.43.146.7771: UDP, length 120
01:05:30.367771 IP 192.168.43.146.8880 > 192.168.43.147.7772: UDP, length 120
01:05:30.395231 IP 192.168.43.124.8880 > 192.168.43.146.7771: UDP, length 120
01:05:30.417745 IP 192.168.43.146.8880 > 192.168.43.147.7772: UDP, length 120
01:05:30.443287 IP 192.168.43.124.8880 > 192.168.43.146.7771: UDP, length 120
01:05:30.467744 IP 192.168.43.146.8880 > 192.168.43.147.7772: UDP, length 120
01:05:30.493613 IP 192.168.43.124.8880 > 192.168.43.146.7771: UDP, length 120
01:05:30.517743 IP 192.168.43.146.8880 > 192.168.43.147.7772: UDP, length 120
01:05:30.543756 IP 192.168.43.124.8880 > 192.168.43.146.7771: UDP, length 120
01:05:30.567745 IP 192.168.43.146.8880 > 192.168.43.147.7772: UDP, length 120
01:05:30.594259 IP 192.168.43.124.8880 > 192.168.43.146.7771: UDP, length 120
01:05:30.617752 IP 192.168.43.146.8880 > 192.168.43.147.7772: UDP, length 120
01:05:30.643644 IP 192.168.43.124.8880 > 192.168.43.146.7771: UDP, length 120
01:05:30.667746 IP 192.168.43.146.8880 > 192.168.43.147.7772: UDP, length 120
01:05:30.693596 IP 192.168.43.124.8880 > 192.168.43.146.7771: UDP, length 120
01:05:30.717742 IP 192.168.43.146.8880 > 192.168.43.147.7772: UDP, length 120
01:05:30.743601 IP 192.168.43.124.8880 > 192.168.43.146.7771: UDP, length 120
01:05:30.767743 IP 192.168.43.146.8880 > 192.168.43.147.7772: UDP, length 120
01:05:30.794676 IP 192.168.43.124.8880 > 192.168.43.146.7771: UDP, length 120
01:05:30.817743 IP 192.168.43.146.8880 > 192.168.43.147.7772: UDP, length 120
01:05:30.843596 IP 192.168.43.124.8880 > 192.168.43.146.7771: UDP, length 120
01:05:30.867744 IP 192.168.43.146.8880 > 192.168.43.147.7772: UDP, length 120
01:05:30.894957 IP 192.168.43.124.8880 > 192.168.43.146.7771: UDP, length 120
01:05:30.917743 IP 192.168.43.146.8880 > 192.168.43.147.7772: UDP, length 120
01:05:30.943595 IP 192.168.43.124.8880 > 192.168.43.146.7771: UDP, length 120
01:05:30.967743 IP 192.168.43.146.8880 > 192.168.43.147.7772: UDP, length 120
01:05:30.994176 IP 192.168.43.124.8880 > 192.168.43.146.7771: UDP, length 120
01:05:31.017742 IP 192.168.43.146.8880 > 192.168.43.147.7772: UDP, length 120
01:05:31.045446 IP 192.168.43.124.8880 > 192.168.43.146.7771: UDP, length 120
01:05:31.067749 IP 192.168.43.146.8880 > 192.168.43.147.7772: UDP, length 120
