01:05:18.467640 IP 192.168.43.146.8880 > 192.168.43.147.7772: UDP, length 120
01:05:18.524061 IP 192.168.43.146.8880 > 192.168.43.147.7772: UDP, length 120
01:05:18.560888 IP 192.168.43.146.8880 > 192.168.43.147.7772: UDP, length 120
01:05:18.604888 IP 192.168.43.146.8880 > 192.168.43.147.7772: UDP, length 120
01:05:18.661828 IP 192.168.43.146.8880 > 192.168.43.147.7772: UDP, length 120
01:05:18.675316 IP 192.168.43.147.8880 > 192.168.43.124.7773: UDP, length 120
01:05:18.707979 IP 192.168.43.146.8880 > 192.168.43.147.7772: UDP, length 120
01:05:18.725327 IP 192.168.43.147.8880 > 192.168.43.124.7773: UDP, length 120
01:05:18.760273 IP 192.168.43.146.8880 > 192.168.43.147.7772: UDP, length 120
01:05:18.775333 IP 192.168.43.147.8880 > 192.168.43.124.7773: UDP, length 120
01:05:18.810972 IP 192.168.43.146.8880 > 192.168.43.147.7772: UDP, length 120
01:05:18.825312 IP 192.168.43.147.8880 > 192.168.43.124.7773: UDP, length 120
01:05:18.860197 IP 192.168.43.146.8880 > 192.168.43.147.7772: UDP, length 120
01:05:18.875309 IP 192.168.43.147.8880 > 192.168.43.124.7773: UDP, length 120
01:05:18.910730 IP 192.168.43.146.8880 > 192.168.43.147.7772: UDP, length 120
01:05:18.925311 IP 192.168.43.147.8880 > 192.168.43.124.7773: UDP, length 120
01:05:18.965522 IP 192.168.43.146.8880 > 192.168.43.147.7772: UDP, length 120
01:05:18.975307 IP 192.168.43.147.8880 > 192.168.43.124.7773: UDP, length 120
01:05:19.012828 IP 192.168.43.146.8880 > 192.168.43.147.7772: UDP, length 120
01:05:19.025308 IP 192.168.43.147.8880 > 192.168.43.124.7773: UDP, length 120
01:05:19.059339 IP 192.168.43.146.8880 > 192.168.43.147.7772: UDP, length 120
01:05:19.075308 IP 192.168.43.147.8880 > 192.168.43.124.7773: UDP, length 120
01:05:19.104999 IP 192.168.43.146.8880 > 192.168.43.147.7772: UDP, length 120
01:05:19.125310 IP 192.168.43.147.8880 > 192.168.43.124.7773: UDP, length 120
01:05:19.159203 IP 192.168.43.146.8880 > 192.168.43.147.7772: UDP, length 120
01:05:19.175336 IP 192.168.43.147.8880 > 192.168.43.124.7773: UDP, length 120
01:05:19.207768 IP 192.168.43.146.8880 > 192.168.43.147.7772: UDP, length 120
01:05:19.225312 IP 192.168.43.147.8880 > 192.168.43.124.7773: UDP, length 120
01:05:19.257627 IP 192.168.43.146.8880 > 192.168.43.147.7772: UDP, length 120
01:05:19.275308 IP 192.168.43.147.8880 > 192.168.43.124.7773: UDP, length 120
01:05:19.308558 IP 192.168.43.146.8880 > 192.168.43.147.7772: UDP, length 120
01:05:19.325308 IP 192.168.43.147.8880 > 192.168.43.124.7773: UDP, length 120
01:05:19.365976 IP 192.168.43.146.8880 > 192.168.43.147.7772: UDP, length 120
01:05:19.375307 IP 192.168.43.147.8880 > 192.168.43.124.7773: UDP, length 120
01:05:19.402622 IP 192.168.43.146.8880 > 192.168.43.147.7772: UDP, length 120
01:05:19.425308 IP 192.168.43.147.8880 > 192.168.43.124.7773: UDP, length 120
01:05:19.457163 IP 192.168.43.146.8880 > 192.168.43.147.7772: UDP, length 120
01:05:19.475389 IP 192.168.43.147.8880 > 192.168.43.124.7773: UDP, length 120
01:05:19.505068 IP 192.168.43.146.8880 > 192.168.43.147.7772: UDP, length 120
01:05:19.525381 IP 192.168.43.147.8880 > 192.168.43.124.7773: UDP, length 120
01:05:19.563318 IP 192.168.43.146.8880 > 192.168.43.147.7772: UDP, length 120
01:05:19.575387 IP 192.168.43.147.8880 > 192.168.43.124.7773: UDP, length 120
01:05:19.617402 IP 192.168.43.146.8880 > 192.168.43.147.7772: UDP, length 120
01:05:19.625370 IP 192.168.43.147.8880 > 192.168.43.124.7773: UDP, length 120
01:05:19.675383 IP 192.168.43.147.8880 > 192.168.43.124.7773: UDP, length 120
01:05:19.676914 IP 192.168.43.146.8880 > 192.168.43.147.7772: UDP, length 120
01:05:19.707428 IP 192.168.43.146.8880 > 192.168.43.147.7772: UDP, length 120
01:05:19.725379 IP 192.168.43.147.8880 > 192.168.43.124.7773: UDP, length 120
01:05:19.755900 IP 192.168.43.146.8880 > 192.168.43.147.7772: UDP, length 120
01:05:19.775394 IP 192.168.43.147.8880 > 192.168.43.124.7773: UDP, length 120
01:05:19.805438 IP 192.168.43.146.8880 > 192.168.43.147.7772: UDP, length 120
01:05:19.825421 IP 192.168.43.147.8880 > 192.168.43.124.7773: UDP, length 120
01:05:19.864848 IP 192.168.43.146.8880 > 192.168.43.147.7772: UDP, length 120
01:05:19.875396 IP 192.168.43.147.8880 > 192.168.43.124.7773: UDP, length 120
01:05:19.906082 IP 192.168.43.146.8880 > 192.168.43.147.7772: UDP, length 120
01:05:19.925351 IP 192.168.43.147.8880 > 192.168.43.124.7773: UDP, length 120
01:05:19.962167 IP 192.168.43.146.8880 > 192.168.43.147.7772: UDP, length 120
01:05:19.975313 IP 192.168.43.147.8880 > 192.168.43.124.7773: UDP, length 120
01:05:20.025309 IP 192.168.43.147.8880 > 192.168.43.124.7773: UDP, length 120
01:05:20.073883 IP 192.168.43.146.8880 > 192.168.43.147.7772: UDP, length 120
01:05:20.075309 IP 192.168.43.147.8880 > 192.168.43.124.7773: UDP, length 120
01:05:20.125307 IP 192.168.43.147.8880 > 192.168.43.124.7773: UDP, length 120
01:05:20.157096 IP 192.168.43.146.8880 > 192.168.43.147.7772: UDP, length 120
01:05:20.175316 IP 192.168.43.147.8880 > 192.168.43.124.7773: UDP, length 120
01:05:20.215360 IP 192.168.43.146.8880 > 192.168.43.147.7772: UDP, length 120
01:05:20.225313 IP 192.168.43.147.8880 > 192.168.43.124.7773: UDP, length 120
01:05:20.254692 IP 192.168.43.146.8880 > 192.168.43.147.7772: UDP, length 120
01:05:20.275311 IP 192.168.43.147.8880 > 192.168.43.124.7773: UDP, length 120
01:05:20.306194 IP 192.168.43.146.8880 > 192.168.43.147.7772: UDP, length 120
01:05:20.325308 IP 192.168.43.147.8880 > 192.168.43.124.7773: UDP, length 120
01:05:20.375308 IP 192.168.43.147.8880 > 192.168.43.124.7773: UDP, length 120
01:05:20.418683 IP 192.168.43.146.8880 > 192.168.43.147.7772: UDP, length 120
01:05:20.418828 IP 192.168.43.146.8880 > 192.168.43.147.7772: UDP, length 120
01:05:20.425310 IP 192.168.43.147.8880 > 192.168.43.124.7773: UDP, length 120
01:05:20.459256 IP 192.168.43.146.8880 > 192.168.43.147.7772: UDP, length 120
01:05:20.475309 IP 192.168.43.147.8880 > 192.168.43.124.7773: UDP, length 120
01:05:20.506125 IP 192.168.43.146.8880 > 192.168.43.147.7772: UDP, length 120
01:05:20.525310 IP 192.168.43.147.8880 > 192.168.43.124.7773: UDP, length 120
01:05:20.568854 IP 192.168.43.146.8880 > 192.168.43.147.7772: UDP, length 120
01:05:20.575310 IP 192.168.43.147.8880 > 192.168.43.124.7773: UDP, length 120
01:05:20.625308 IP 192.168.43.147.8880 > 192.168.43.124.7773: UDP, length 120
01:05:20.655873 IP 192.168.43.146.8880 > 192.168.43.147.7772: UDP, length 120
01:05:20.675341 IP 192.168.43.147.8880 > 192.168.43.124.7773: UDP, length 120
01:05:20.702833 IP 192.168.43.146.8880 > 192.168.43.147.7772: UDP, length 120
01:05:20.725312 IP 192.168.43.147.8880 > 192.168.43.124.7773: UDP, length 120
01:05:20.755277 IP 192.168.43.146.8880 > 192.168.43.147.7772: UDP, length 120
01:05:20.775317 IP 192.168.43.147.8880 > 192.168.43.124.7773: UDP, length 120
01:05:20.805867 IP 192.168.43.146.8880 > 192.168.43.147.7772: UDP, length 120
01:05:20.825309 IP 192.168.43.147.8880 > 192.168.43.124.7773: UDP, length 120
01:05:20.868191 IP 192.168.43.146.8880 > 192.168.43.147.7772: UDP, length 120
01:05:20.875311 IP 192.168.43.147.8880 > 192.168.43.124.7773: UDP, length 120
01:05:20.919320 IP 192.168.43.146.8880 > 192.168.43.147.7772: UDP, length 120
01:05:20.925310 IP 192.168.43.147.8880 > 192.168.43.124.7773: UDP, length 120
01:05:20.973268 IP 192.168.43.146.8880 > 192.168.43.147.7772: UDP, length 120
01:05:20.975310 IP 192.168.43.147.8880 > 192.168.43.124.7773: UDP, length 120
01:05:21.008348 IP 192.168.43.146.8880 > 192.168.43.147.7772: UDP, length 120
01:05:21.025308 IP 192.168.43.147.8880 > 192.168.43.124.7773: UDP, length 120
01:05:21.065771 IP 192.168.43.146.8880 > 192.168.43.147.7772: UDP, length 120
01:05:21.075309 IP 192.168.43.147.8880 > 192.168.43.124.7773: UDP, length 120
01:05:21.104089 IP 192.168.43.146.8880 > 192.168.43.147.7772: UDP, length 120
01:05:21.125307 IP 192.168.43.147.8880 > 192.168.43.124.7773: UDP, length 120
01:05:21.155779 IP 192.168.43.146.8880 > 192.168.43.147.7772: UDP, length 120
01:05:21.175310 IP 192.168.43.147.8880 > 192.168.43.124.7773: UDP, length 120
01:05:21.207232 IP 192.168.43.146.8880 > 192.168.43.147.7772: UDP, length 120
01:05:21.225310 IP 192.168.43.147.8880 > 192.168.43.124.7773: UDP, length 120
01:05:21.253086 IP 192.168.43.146.8880 > 192.168.43.147.7772: UDP, length 120
01:05:21.275317 IP 192.168.43.147.8880 > 192.168.43.124.7773: UDP, length 120
01:05:21.312194 IP 192.168.43.146.8880 > 192.168.43.147.7772: UDP, length 120
01:05:21.325310 IP 192.168.43.147.8880 > 192.168.43.124.7773: UDP, length 120
01:05:21.366540 IP 192.168.43.146.8880 > 192.168.43.147.7772: UDP, length 120
01:05:21.375311 IP 192.168.43.147.8880 > 192.168.43.124.7773: UDP, length 120
01:05:21.420438 IP 192.168.43.146.8880 > 192.168.43.147.7772: UDP, length 120
01:05:21.425309 IP 192.168.43.147.8880 > 192.168.43.124.7773: UDP, length 120
01:05:21.475308 IP 192.168.43.147.8880 > 192.168.43.124.7773: UDP, length 120
01:05:21.475885 IP 192.168.43.146.8880 > 192.168.43.147.7772: UDP, length 120
01:05:21.507875 IP 192.168.43.146.8880 > 192.168.43.147.7772: UDP, length 120
01:05:21.525309 IP 192.168.43.147.8880 > 192.168.43.124.7773: UDP, length 120
01:05:21.552723 IP 192.168.43.146.8880 > 192.168.43.147.7772: UDP, length 120
01:05:21.575309 IP 192.168.43.147.8880 > 192.168.43.124.7773: UDP, length 120
01:05:21.605831 IP 192.168.43.146.8880 > 192.168.43.147.7772: UDP, length 120
01:05:21.625308 IP 192.168.43.147.8880 > 192.168.43.124.7773: UDP, length 120
01:05:21.656236 IP 192.168.43.146.8880 > 192.168.43.147.7772: UDP, length 120
01:05:21.675309 IP 192.168.43.147.8880 > 192.168.43.124.7773: UDP, length 120
01:05:21.724211 IP 192.168.43.146.8880 > 192.168.43.147.7772: UDP, length 120
01:05:21.725309 IP 192.168.43.147.8880 > 192.168.43.124.7773: UDP, length 120
01:05:21.755788 IP 192.168.43.146.8880 > 192.168.43.147.7772: UDP, length 120
01:05:21.775318 IP 192.168.43.147.8880 > 192.168.43.124.7773: UDP, length 120
01:05:21.802848 IP 192.168.43.146.8880 > 192.168.43.147.7772: UDP, length 120
01:05:21.825306 IP 192.168.43.147.8880 > 192.168.43.124.7773: UDP, length 120
01:05:21.858250 IP 192.168.43.146.8880 > 192.168.43.147.7772: UDP, length 120
01:05:21.875310 IP 192.168.43.147.8880 > 192.168.43.124.7773: UDP, length 120
01:05:21.905917 IP 192.168.43.146.8880 > 192.168.43.147.7772: UDP, length 120
01:05:21.925332 IP 192.168.43.147.8880 > 192.168.43.124.7773: UDP, length 120
01:05:21.953633 IP 192.168.43.146.8880 > 192.168.43.147.7772: UDP, length 120
01:05:21.975335 IP 192.168.43.147.8880 > 192.168.43.124.7773: UDP, length 120
01:05:22.005776 IP 192.168.43.146.8880 > 192.168.43.147.7772: UDP, length 120
01:05:22.025332 IP 192.168.43.147.8880 > 192.168.43.124.7773: UDP, length 120
01:05:22.065681 IP 192.168.43.146.8880 > 192.168.43.147.7772: UDP, length 120
01:05:22.075334 IP 192.168.43.147.8880 > 192.168.43.124.7773: UDP, length 120
01:05:22.122204 IP 192.168.43.146.8880 > 192.168.43.147.7772: UDP, length 120
01:05:22.125337 IP 192.168.43.147.8880 > 192.168.43.124.7773: UDP, length 120
01:05:22.159053 IP 192.168.43.146.8880 > 192.168.43.147.7772: UDP, length 120
01:05:22.175374 IP 192.168.43.147.8880 > 192.168.43.124.7773: UDP, length 120
01:05:22.206534 IP 192.168.43.146.8880 > 192.168.43.147.7772: UDP, length 120
01:05:22.225335 IP 192.168.43.147.8880 > 192.168.43.124.7773: UDP, length 120
01:05:22.255332 IP 192.168.43.146.8880 > 192.168.43.147.7772: UDP, length 120
01:05:22.275337 IP 192.168.43.147.8880 > 192.168.43.124.7773: UDP, length 120
01:05:22.306045 IP 192.168.43.146.8880 > 192.168.43.147.7772: UDP, length 120
01:05:22.325341 IP 192.168.43.147.8880 > 192.168.43.124.7773: UDP, length 120
01:05:22.353752 IP 192.168.43.146.8880 > 192.168.43.147.7772: UDP, length 120
01:05:22.375337 IP 192.168.43.147.8880 > 192.168.43.124.7773: UDP, length 120
01:05:22.407250 IP 192.168.43.146.8880 > 192.168.43.147.7772: UDP, length 120
01:05:22.425334 IP 192.168.43.147.8880 > 192.168.43.124.7773: UDP, length 120
01:05:22.460408 IP 192.168.43.146.8880 > 192.168.43.147.7772: UDP, length 120
01:05:22.475336 IP 192.168.43.147.8880 > 192.168.43.124.7773: UDP, length 120
01:05:22.516817 IP 192.168.43.146.8880 > 192.168.43.147.7772: UDP, length 120
01:05:22.525333 IP 192.168.43.147.8880 > 192.168.43.124.7773: UDP, length 120
01:05:22.557707 IP 192.168.43.146.8880 > 192.168.43.147.7772: UDP, length 120
01:05:22.575335 IP 192.168.43.147.8880 > 192.168.43.124.7773: UDP, length 120
01:05:22.609624 IP 192.168.43.146.8880 > 192.168.43.147.7772: UDP, length 120
01:05:22.625334 IP 192.168.43.147.8880 > 192.168.43.124.7773: UDP, length 120
01:05:22.675334 IP 192.168.43.147.8880 > 192.168.43.124.7773: UDP, length 120
01:05:22.677683 IP 192.168.43.146.8880 > 192.168.43.147.7772: UDP, length 120
01:05:22.724617 IP 192.168.43.146.8880 > 192.168.43.147.7772: UDP, length 120
01:05:22.725337 IP 192.168.43.147.8880 > 192.168.43.124.7773: UDP, length 120
01:05:22.763514 IP 192.168.43.146.8880 > 192.168.43.147.7772: UDP, length 120
01:05:22.775345 IP 192.168.43.147.8880 > 192.168.43.124.7773: UDP, length 120
01:05:22.825329 IP 192.168.43.147.8880 > 192.168.43.124.7773: UDP, length 120
01:05:22.843440 IP 192.168.43.146.8880 > 192.168.43.147.7772: UDP, length 120
01:05:22.866169 IP 192.168.43.146.8880 > 192.168.43.147.7772: UDP, length 120
01:05:22.875339 IP 192.168.43.147.8880 > 192.168.43.124.7773: UDP, length 120
01:05:22.925333 IP 192.168.43.147.8880 > 192.168.43.124.7773: UDP, length 120
01:05:22.945660 IP 192.168.43.146.8880 > 192.168.43.147.7772: UDP, length 120
01:05:22.953342 IP 192.168.43.146.8880 > 192.168.43.147.7772: UDP, length 120
01:05:22.975345 IP 192.168.43.147.8880 > 192.168.43.124.7773: UDP, length 120
01:05:23.019573 IP 192.168.43.146.8880 > 192.168.43.147.7772: UDP, length 120
01:05:23.025334 IP 192.168.43.147.8880 > 192.168.43.124.7773: UDP, length 120
01:05:23.052925 IP 192.168.43.146.8880 > 192.168.43.147.7772: UDP, length 120
01:05:23.075335 IP 192.168.43.147.8880 > 192.168.43.124.7773: UDP, length 120
01:05:23.120485 IP 192.168.43.146.8880 > 192.168.43.147.7772: UDP, length 120
01:05:23.125333 IP 192.168.43.147.8880 > 192.168.43.124.7773: UDP, length 120
01:05:23.158614 IP 192.168.43.146.8880 > 192.168.43.147.7772: UDP, length 120
01:05:23.175336 IP 192.168.43.147.8880 > 192.168.43.124.7773: UDP, length 120
01:05:23.205918 IP 192.168.43.146.8880 > 192.168.43.147.7772: UDP, length 120
01:05:23.225334 IP 192.168.43.147.8880 > 192.168.43.124.7773: UDP, length 120
01:05:23.266748 IP 192.168.43.146.8880 > 192.168.43.147.7772: UDP, length 120
01:05:23.275336 IP 192.168.43.147.8880 > 192.168.43.124.7773: UDP, length 120
01:05:23.303622 IP 192.168.43.146.8880 > 192.168.43.147.7772: UDP, length 120
01:05:23.325334 IP 192.168.43.147.8880 > 192.168.43.124.7773: UDP, length 120
01:05:23.358574 IP 192.168.43.146.8880 > 192.168.43.147.7772: UDP, length 120
01:05:23.375339 IP 192.168.43.147.8880 > 192.168.43.124.7773: UDP, length 120
01:05:23.419849 IP 192.168.43.146.8880 > 192.168.43.147.7772: UDP, length 120
01:05:23.425342 IP 192.168.43.147.8880 > 192.168.43.124.7773: UDP, length 120
01:05:23.461227 IP 192.168.43.146.8880 > 192.168.43.147.7772: UDP, length 120
01:05:23.475337 IP 192.168.43.147.8880 > 192.168.43.124.7773: UDP, length 120
01:05:23.502851 IP 192.168.43.146.8880 > 192.168.43.147.7772: UDP, length 120
01:05:23.525337 IP 192.168.43.147.8880 > 192.168.43.124.7773: UDP, length 120
01:05:23.574962 IP 192.168.43.146.8880 > 192.168.43.147.7772: UDP, length 120
01:05:23.575335 IP 192.168.43.147.8880 > 192.168.43.124.7773: UDP, length 120
01:05:23.606475 IP 192.168.43.146.8880 > 192.168.43.147.7772: UDP, length 120
01:05:23.625335 IP 192.168.43.147.8880 > 192.168.43.124.7773: UDP, length 120
01:05:23.655411 IP 192.168.43.146.8880 > 192.168.43.147.7772: UDP, length 120
01:05:23.675376 IP 192.168.43.147.8880 > 192.168.43.124.7773: UDP, length 120
01:05:23.717790 IP 192.168.43.146.8880 > 192.168.43.147.7772: UDP, length 120
01:05:23.725338 IP 192.168.43.147.8880 > 192.168.43.124.7773: UDP, length 120
01:05:23.757548 IP 192.168.43.146.8880 > 192.168.43.147.7772: UDP, length 120
01:05:23.775346 IP 192.168.43.147.8880 > 192.168.43.124.7773: UDP, length 120
01:05:23.806750 IP 192.168.43.146.8880 > 192.168.43.147.7772: UDP, length 120
01:05:23.825334 IP 192.168.43.147.8880 > 192.168.43.124.7773: UDP, length 120
01:05:23.867098 IP 192.168.43.146.8880 > 192.168.43.147.7772: UDP, length 120
01:05:23.875337 IP 192.168.43.147.8880 > 192.168.43.124.7773: UDP, length 120
01:05:23.905896 IP 192.168.43.146.8880 > 192.168.43.147.7772: UDP, length 120
01:05:23.925335 IP 192.168.43.147.8880 > 192.168.43.124.7773: UDP, length 120
01:05:23.957101 IP 192.168.43.146.8880 > 192.168.43.147.7772: UDP, length 120
01:05:23.975337 IP 192.168.43.147.8880 > 192.168.43.124.7773: UDP, length 120
01:05:24.019015 IP 192.168.43.146.8880 > 192.168.43.147.7772: UDP, length 120
01:05:24.025335 IP 192.168.43.147.8880 > 192.168.43.124.7773: UDP, length 120
01:05:24.053136 IP 192.168.43.146.8880 > 192.168.43.147.7772: UDP, length 120
01:05:24.075335 IP 192.168.43.147.8880 > 192.168.43.124.7773: UDP, length 120
01:05:24.105644 IP 192.168.43.146.8880 > 192.168.43.147.7772: UDP, length 120
01:05:24.125329 IP 192.168.43.147.8880 > 192.168.43.124.7773: UDP, length 120
01:05:24.160309 IP 192.168.43.146.8880 > 192.168.43.147.7772: UDP, length 120
01:05:24.175337 IP 192.168.43.147.8880 > 192.168.43.124.7773: UDP, length 120
01:05:24.207839 IP 192.168.43.146.8880 > 192.168.43.147.7772: UDP, length 120
01:05:24.225334 IP 192.168.43.147.8880 > 192.168.43.124.7773: UDP, length 120
01:05:24.255968 IP 192.168.43.146.8880 > 192.168.43.147.7772: UDP, length 120
01:05:24.275337 IP 192.168.43.147.8880 > 192.168.43.124.7773: UDP, length 120
01:05:24.306446 IP 192.168.43.146.8880 > 192.168.43.147.7772: UDP, length 120
01:05:24.325332 IP 192.168.43.147.8880 > 192.168.43.124.7773: UDP, length 120
01:05:24.374594 IP 192.168.43.146.8880 > 192.168.43.147.7772: UDP, length 120
01:05:24.375336 IP 192.168.43.147.8880 > 192.168.43.124.7773: UDP, length 120
01:05:24.406031 IP 192.168.43.146.8880 > 192.168.43.147.7772: UDP, length 120
01:05:24.425337 IP 192.168.43.147.8880 > 192.168.43.124.7773: UDP, length 120
01:05:24.453985 IP 192.168.43.146.8880 > 192.168.43.147.7772: UDP, length 120
01:05:24.475352 IP 192.168.43.147.8880 > 192.168.43.124.7773: UDP, length 120
01:05:24.519944 IP 192.168.43.146.8880 > 192.168.43.147.7772: UDP, length 120
01:05:24.525339 IP 192.168.43.147.8880 > 192.168.43.124.7773: UDP, length 120
01:05:24.556503 IP 192.168.43.146.8880 > 192.168.43.147.7772: UDP, length 120
01:05:24.575337 IP 192.168.43.147.8880 > 192.168.43.124.7773: UDP, length 120
01:05:24.604610 IP 192.168.43.146.8880 > 192.168.43.147.7772: UDP, length 120
01:05:24.625335 IP 192.168.43.147.8880 > 192.168.43.124.7773: UDP, length 120
01:05:24.669193 IP 192.168.43.146.8880 > 192.168.43.147.7772: UDP, length 120
01:05:24.675335 IP 192.168.43.147.8880 > 192.168.43.124.7773: UDP, length 120
01:05:24.707674 IP 192.168.43.146.8880 > 192.168.43.147.7772: UDP, length 120
01:05:24.725334 IP 192.168.43.147.8880 > 192.168.43.124.7773: UDP, length 120
01:05:24.755862 IP 192.168.43.146.8880 > 192.168.43.147.7772: UDP, length 120
01:05:24.775388 IP 192.168.43.147.8880 > 192.168.43.124.7773: UDP, length 120
01:05:24.818164 IP 192.168.43.146.8880 > 192.168.43.147.7772: UDP, length 120
01:05:24.825351 IP 192.168.43.147.8880 > 192.168.43.124.7773: UDP, length 120
01:05:24.858112 IP 192.168.43.146.8880 > 192.168.43.147.7772: UDP, length 120
01:05:24.875338 IP 192.168.43.147.8880 > 192.168.43.124.7773: UDP, length 120
01:05:24.902934 IP 192.168.43.146.8880 > 192.168.43.147.7772: UDP, length 120
01:05:24.925440 IP 192.168.43.147.8880 > 192.168.43.124.7773: UDP, length 120
01:05:24.970369 IP 192.168.43.146.8880 > 192.168.43.147.7772: UDP, length 120
01:05:24.975460 IP 192.168.43.147.8880 > 192.168.43.124.7773: UDP, length 120
01:05:25.007384 IP 192.168.43.146.8880 > 192.168.43.147.7772: UDP, length 120
01:05:25.025387 IP 192.168.43.147.8880 > 192.168.43.124.7773: UDP, length 120
01:05:25.056019 IP 192.168.43.146.8880 > 192.168.43.147.7772: UDP, length 120
01:05:25.075383 IP 192.168.43.147.8880 > 192.168.43.124.7773: UDP, length 120
01:05:25.116693 IP 192.168.43.146.8880 > 192.168.43.147.7772: UDP, length 120
01:05:25.125378 IP 192.168.43.147.8880 > 192.168.43.124.7773: UDP, length 120
01:05:25.156074 IP 192.168.43.146.8880 > 192.168.43.147.7772: UDP, length 120
01:05:25.175364 IP 192.168.43.147.8880 > 192.168.43.124.7773: UDP, length 120
01:05:25.203074 IP 192.168.43.146.8880 > 192.168.43.147.7772: UDP, length 120
01:05:25.225393 IP 192.168.43.147.8880 > 192.168.43.124.7773: UDP, length 120
01:05:25.270923 IP 192.168.43.146.8880 > 192.168.43.147.7772: UDP, length 120
01:05:25.275389 IP 192.168.43.147.8880 > 192.168.43.124.7773: UDP, length 120
01:05:25.309204 IP 192.168.43.146.8880 > 192.168.43.147.7772: UDP, length 120
01:05:25.325391 IP 192.168.43.147.8880 > 192.168.43.124.7773: UDP, length 120
01:05:25.356855 IP 192.168.43.146.8880 > 192.168.43.147.7772: UDP, length 120
01:05:25.375352 IP 192.168.43.147.8880 > 192.168.43.124.7773: UDP, length 120
01:05:25.416643 IP 192.168.43.146.8880 > 192.168.43.147.7772: UDP, length 120
01:05:25.425315 IP 192.168.43.147.8880 > 192.168.43.124.7773: UDP, length 120
01:05:25.457363 IP 192.168.43.146.8880 > 192.168.43.147.7772: UDP, length 120
01:05:25.475316 IP 192.168.43.147.8880 > 192.168.43.124.7773: UDP, length 120
01:05:25.502980 IP 192.168.43.146.8880 > 192.168.43.147.7772: UDP, length 120
01:05:25.525290 IP 192.168.43.147.8880 > 192.168.43.124.7773: UDP, length 120
01:05:25.568302 IP 192.168.43.146.8880 > 192.168.43.147.7772: UDP, length 120
01:05:25.575310 IP 192.168.43.147.8880 > 192.168.43.124.7773: UDP, length 120
01:05:25.605374 IP 192.168.43.146.8880 > 192.168.43.147.7772: UDP, length 120
01:05:25.625328 IP 192.168.43.147.8880 > 192.168.43.124.7773: UDP, length 120
01:05:25.664067 IP 192.168.43.146.8880 > 192.168.43.147.7772: UDP, length 120
01:05:25.675310 IP 192.168.43.147.8880 > 192.168.43.124.7773: UDP, length 120
01:05:25.718183 IP 192.168.43.146.8880 > 192.168.43.147.7772: UDP, length 120
01:05:25.725309 IP 192.168.43.147.8880 > 192.168.43.124.7773: UDP, length 120
01:05:25.756121 IP 192.168.43.146.8880 > 192.168.43.147.7772: UDP, length 120
01:05:25.775317 IP 192.168.43.147.8880 > 192.168.43.124.7773: UDP, length 120
01:05:25.803676 IP 192.168.43.146.8880 > 192.168.43.147.7772: UDP, length 120
01:05:25.825311 IP 192.168.43.147.8880 > 192.168.43.124.7773: UDP, length 120
01:05:25.856086 IP 192.168.43.146.8880 > 192.168.43.147.7772: UDP, length 120
01:05:25.875312 IP 192.168.43.147.8880 > 192.168.43.124.7773: UDP, length 120
01:05:25.903024 IP 192.168.43.146.8880 > 192.168.43.147.7772: UDP, length 120
01:05:25.925310 IP 192.168.43.147.8880 > 192.168.43.124.7773: UDP, length 120
01:05:25.966239 IP 192.168.43.146.8880 > 192.168.43.147.7772: UDP, length 120
01:05:25.975309 IP 192.168.43.147.8880 > 192.168.43.124.7773: UDP, length 120
01:05:26.006804 IP 192.168.43.146.8880 > 192.168.43.147.7772: UDP, length 120
01:05:26.025309 IP 192.168.43.147.8880 > 192.168.43.124.7773: UDP, length 120
01:05:26.052530 IP 192.168.43.146.8880 > 192.168.43.147.7772: UDP, length 120
01:05:26.075310 IP 192.168.43.147.8880 > 192.168.43.124.7773: UDP, length 120
01:05:26.106448 IP 192.168.43.146.8880 > 192.168.43.147.7772: UDP, length 120
01:05:26.125309 IP 192.168.43.147.8880 > 192.168.43.124.7773: UDP, length 120
01:05:26.175151 IP 192.168.43.146.8880 > 192.168.43.147.7772: UDP, length 120
01:05:26.175308 IP 192.168.43.147.8880 > 192.168.43.124.7773: UDP, length 120
01:05:26.206914 IP 192.168.43.146.8880 > 192.168.43.147.7772: UDP, length 120
01:05:26.225310 IP 192.168.43.147.8880 > 192.168.43.124.7773: UDP, length 120
01:05:26.256363 IP 192.168.43.146.8880 > 192.168.43.147.7772: UDP, length 120
01:05:26.275311 IP 192.168.43.147.8880 > 192.168.43.124.7773: UDP, length 120
01:05:26.316725 IP 192.168.43.146.8880 > 192.168.43.147.7772: UDP, length 120
01:05:26.325308 IP 192.168.43.147.8880 > 192.168.43.124.7773: UDP, length 120
01:05:26.356169 IP 192.168.43.146.8880 > 192.168.43.147.7772: UDP, length 120
01:05:26.375309 IP 192.168.43.147.8880 > 192.168.43.124.7773: UDP, length 120
01:05:26.405215 IP 192.168.43.146.8880 > 192.168.43.147.7772: UDP, length 120
01:05:26.425310 IP 192.168.43.147.8880 > 192.168.43.124.7773: UDP, length 120
01:05:26.466182 IP 192.168.43.146.8880 > 192.168.43.147.7772: UDP, length 120
01:05:26.475309 IP 192.168.43.147.8880 > 192.168.43.124.7773: UDP, length 120
01:05:26.505961 IP 192.168.43.146.8880 > 192.168.43.147.7772: UDP, length 120
01:05:26.525315 IP 192.168.43.147.8880 > 192.168.43.124.7773: UDP, length 120
01:05:26.553041 IP 192.168.43.146.8880 > 192.168.43.147.7772: UDP, length 120
01:05:26.575313 IP 192.168.43.147.8880 > 192.168.43.124.7773: UDP, length 120
01:05:26.620751 IP 192.168.43.146.8880 > 192.168.43.147.7772: UDP, length 120
01:05:26.625310 IP 192.168.43.147.8880 > 192.168.43.124.7773: UDP, length 120
01:05:26.657349 IP 192.168.43.146.8880 > 192.168.43.147.7772: UDP, length 120
01:05:26.675343 IP 192.168.43.147.8880 > 192.168.43.124.7773: UDP, length 120
01:05:26.707190 IP 192.168.43.146.8880 > 192.168.43.147.7772: UDP, length 120
01:05:26.725311 IP 192.168.43.147.8880 > 192.168.43.124.7773: UDP, length 120
01:05:26.775315 IP 192.168.43.147.8880 > 192.168.43.124.7773: UDP, length 120
01:05:26.777931 IP 192.168.43.146.8880 > 192.168.43.147.7772: UDP, length 120
01:05:26.808577 IP 192.168.43.146.8880 > 192.168.43.147.7772: UDP, length 120
01:05:26.825310 IP 192.168.43.147.8880 > 192.168.43.124.7773: UDP, length 120
01:05:26.858657 IP 192.168.43.146.8880 > 192.168.43.147.7772: UDP, length 120
01:05:26.875312 IP 192.168.43.147.8880 > 192.168.43.124.7773: UDP, length 120
01:05:26.918962 IP 192.168.43.146.8880 > 192.168.43.147.7772: UDP, length 120
01:05:26.925337 IP 192.168.43.147.8880 > 192.168.43.124.7773: UDP, length 120
01:05:26.959849 IP 192.168.43.146.8880 > 192.168.43.147.7772: UDP, length 120
01:05:26.975338 IP 192.168.43.147.8880 > 192.168.43.124.7773: UDP, length 120
01:05:27.013888 IP 192.168.43.146.8880 > 192.168.43.147.7772: UDP, length 120
01:05:27.025336 IP 192.168.43.147.8880 > 192.168.43.124.7773: UDP, length 120
01:05:27.059070 IP 192.168.43.146.8880 > 192.168.43.147.7772: UDP, length 120
01:05:27.075336 IP 192.168.43.147.8880 > 192.168.43.124.7773: UDP, length 120
01:05:27.107599 IP 192.168.43.146.8880 > 192.168.43.147.7772: UDP, length 120
01:05:27.125335 IP 192.168.43.147.8880 > 192.168.43.124.7773: UDP, length 120
01:05:27.159431 IP 192.168.43.146.8880 > 192.168.43.147.7772: UDP, length 120
01:05:27.175337 IP 192.168.43.147.8880 > 192.168.43.124.7773: UDP, length 120
01:05:27.208491 IP 192.168.43.146.8880 > 192.168.43.147.7772: UDP, length 120
01:05:27.225335 IP 192.168.43.147.8880 > 192.168.43.124.7773: UDP, length 120
01:05:27.257709 IP 192.168.43.146.8880 > 192.168.43.147.7772: UDP, length 120
01:05:27.275336 IP 192.168.43.147.8880 > 192.168.43.124.7773: UDP, length 120
01:05:27.306199 IP 192.168.43.146.8880 > 192.168.43.147.7772: UDP, length 120
01:05:27.325335 IP 192.168.43.147.8880 > 192.168.43.124.7773: UDP, length 120
01:05:27.360746 IP 192.168.43.146.8880 > 192.168.43.147.7772: UDP, length 120
01:05:27.375337 IP 192.168.43.147.8880 > 192.168.43.124.7773: UDP, length 120
01:05:27.412639 IP 192.168.43.146.8880 > 192.168.43.147.7772: UDP, length 120
01:05:27.425335 IP 192.168.43.147.8880 > 192.168.43.124.7773: UDP, length 120
01:05:27.475332 IP 192.168.43.147.8880 > 192.168.43.124.7773: UDP, length 120
01:05:27.510213 IP 192.168.43.146.8880 > 192.168.43.147.7772: UDP, length 120
01:05:27.525339 IP 192.168.43.147.8880 > 192.168.43.124.7773: UDP, length 120
01:05:27.568885 IP 192.168.43.146.8880 > 192.168.43.147.7772: UDP, length 120
01:05:27.575338 IP 192.168.43.147.8880 > 192.168.43.124.7773: UDP, length 120
01:05:27.607777 IP 192.168.43.146.8880 > 192.168.43.147.7772: UDP, length 120
01:05:27.625349 IP 192.168.43.147.8880 > 192.168.43.124.7773: UDP, length 120
01:05:27.672771 IP 192.168.43.146.8880 > 192.168.43.147.7772: UDP, length 120
01:05:27.675339 IP 192.168.43.147.8880 > 192.168.43.124.7773: UDP, length 120
01:05:27.722194 IP 192.168.43.146.8880 > 192.168.43.147.7772: UDP, length 120
01:05:27.725335 IP 192.168.43.147.8880 > 192.168.43.124.7773: UDP, length 120
01:05:27.775342 IP 192.168.43.147.8880 > 192.168.43.124.7773: UDP, length 120
01:05:27.815234 IP 192.168.43.146.8880 > 192.168.43.147.7772: UDP, length 120
01:05:27.825338 IP 192.168.43.147.8880 > 192.168.43.124.7773: UDP, length 120
01:05:27.875335 IP 192.168.43.147.8880 > 192.168.43.124.7773: UDP, length 120
01:05:27.878738 IP 192.168.43.146.8880 > 192.168.43.147.7772: UDP, length 120
01:05:27.908180 IP 192.168.43.146.8880 > 192.168.43.147.7772: UDP, length 120
01:05:27.925348 IP 192.168.43.147.8880 > 192.168.43.124.7773: UDP, length 120
01:05:27.958611 IP 192.168.43.146.8880 > 192.168.43.147.7772: UDP, length 120
01:05:27.975338 IP 192.168.43.147.8880 > 192.168.43.124.7773: UDP, length 120
01:05:28.025334 IP 192.168.43.147.8880 > 192.168.43.124.7773: UDP, length 120
01:05:28.075338 IP 192.168.43.147.8880 > 192.168.43.124.7773: UDP, length 120
01:05:28.084585 IP 192.168.43.146.8880 > 192.168.43.147.7772: UDP, length 120
01:05:28.103971 IP 192.168.43.146.8880 > 192.168.43.147.7772: UDP, length 120
01:05:28.104592 IP 192.168.43.146.8880 > 192.168.43.147.7772: UDP, length 120
01:05:28.125339 IP 192.168.43.147.8880 > 192.168.43.124.7773: UDP, length 120
01:05:28.163467 IP 192.168.43.146.8880 > 192.168.43.147.7772: UDP, length 120
01:05:28.175379 IP 192.168.43.147.8880 > 192.168.43.124.7773: UDP, length 120
01:05:28.209582 IP 192.168.43.146.8880 > 192.168.43.147.7772: UDP, length 120
01:05:28.225338 IP 192.168.43.147.8880 > 192.168.43.124.7773: UDP, length 120
01:05:28.275333 IP 192.168.43.147.8880 > 192.168.43.124.7773: UDP, length 120
01:05:28.278724 IP 192.168.43.146.8880 > 192.168.43.147.7772: UDP, length 120
01:05:28.311336 IP 192.168.43.146.8880 > 192.168.43.147.7772: UDP, length 120
01:05:28.325337 IP 192.168.43.147.8880 > 192.168.43.124.7773: UDP, length 120
01:05:28.363301 IP 192.168.43.146.8880 > 192.168.43.147.7772: UDP, length 120
01:05:28.375343 IP 192.168.43.147.8880 > 192.168.43.124.7773: UDP, length 120
01:05:28.408091 IP 192.168.43.146.8880 > 192.168.43.147.7772: UDP, length 120
01:05:28.425337 IP 192.168.43.147.8880 > 192.168.43.124.7773: UDP, length 120
01:05:28.459035 IP 192.168.43.146.8880 > 192.168.43.147.7772: UDP, length 120
01:05:28.475336 IP 192.168.43.147.8880 > 192.168.43.124.7773: UDP, length 120
01:05:28.510444 IP 192.168.43.146.8880 > 192.168.43.147.7772: UDP, length 120
01:05:28.525335 IP 192.168.43.147.8880 > 192.168.43.124.7773: UDP, length 120
01:05:28.557742 IP 192.168.43.146.8880 > 192.168.43.147.7772: UDP, length 120
01:05:28.575337 IP 192.168.43.147.8880 > 192.168.43.124.7773: UDP, length 120
01:05:28.608843 IP 192.168.43.146.8880 > 192.168.43.147.7772: UDP, length 120
01:05:28.625339 IP 192.168.43.147.8880 > 192.168.43.124.7773: UDP, length 120
01:05:28.657700 IP 192.168.43.146.8880 > 192.168.43.147.7772: UDP, length 120
01:05:28.675368 IP 192.168.43.147.8880 > 192.168.43.124.7773: UDP, length 120
01:05:28.707715 IP 192.168.43.146.8880 > 192.168.43.147.7772: UDP, length 120
01:05:28.725348 IP 192.168.43.147.8880 > 192.168.43.124.7773: UDP, length 120
01:05:28.756277 IP 192.168.43.146.8880 > 192.168.43.147.7772: UDP, length 120
01:05:28.775358 IP 192.168.43.147.8880 > 192.168.43.124.7773: UDP, length 120
01:05:28.808112 IP 192.168.43.146.8880 > 192.168.43.147.7772: UDP, length 120
01:05:28.825338 IP 192.168.43.147.8880 > 192.168.43.124.7773: UDP, length 120
01:05:28.858212 IP 192.168.43.146.8880 > 192.168.43.147.7772: UDP, length 120
01:05:28.875338 IP 192.168.43.147.8880 > 192.168.43.124.7773: UDP, length 120
01:05:28.907611 IP 192.168.43.146.8880 > 192.168.43.147.7772: UDP, length 120
01:05:28.925338 IP 192.168.43.147.8880 > 192.168.43.124.7773: UDP, length 120
01:05:28.960981 IP 192.168.43.146.8880 > 192.168.43.147.7772: UDP, length 120
01:05:28.975337 IP 192.168.43.147.8880 > 192.168.43.124.7773: UDP, length 120
01:05:29.008457 IP 192.168.43.146.8880 > 192.168.43.147.7772: UDP, length 120
01:05:29.025335 IP 192.168.43.147.8880 > 192.168.43.124.7773: UDP, length 120
01:05:29.063482 IP 192.168.43.146.8880 > 192.168.43.147.7772: UDP, length 120
01:05:29.075336 IP 192.168.43.147.8880 > 192.168.43.124.7773: UDP, length 120
01:05:29.110655 IP 192.168.43.146.8880 > 192.168.43.147.7772: UDP, length 120
01:05:29.125334 IP 192.168.43.147.8880 > 192.168.43.124.7773: UDP, length 120
01:05:29.157557 IP 192.168.43.146.8880 > 192.168.43.147.7772: UDP, length 120
01:05:29.175337 IP 192.168.43.147.8880 > 192.168.43.124.7773: UDP, length 120
01:05:29.207830 IP 192.168.43.146.8880 > 192.168.43.147.7772: UDP, length 120
01:05:29.225335 IP 192.168.43.147.8880 > 192.168.43.124.7773: UDP, length 120
01:05:29.258725 IP 192.168.43.146.8880 > 192.168.43.147.7772: UDP, length 120
01:05:29.275335 IP 192.168.43.147.8880 > 192.168.43.124.7773: UDP, length 120
01:05:29.325334 IP 192.168.43.147.8880 > 192.168.43.124.7773: UDP, length 120
01:05:29.375334 IP 192.168.43.147.8880 > 192.168.43.124.7773: UDP, length 120
01:05:29.425338 IP 192.168.43.147.8880 > 192.168.43.124.7773: UDP, length 120
01:05:29.475334 IP 192.168.43.147.8880 > 192.168.43.124.7773: UDP, length 120
01:05:29.520235 IP 192.168.43.146.8880 > 192.168.43.147.7772: UDP, length 120
01:05:29.525337 IP 192.168.43.147.8880 > 192.168.43.124.7773: UDP, length 120
01:05:29.525507 IP 192.168.43.146.8880 > 192.168.43.147.7772: UDP, length 120
01:05:29.525725 IP 192.168.43.146.8880 > 192.168.43.147.7772: UDP, length 120
01:05:29.525836 IP 192.168.43.146.8880 > 192.168.43.147.7772: UDP, length 120
01:05:29.525946 IP 192.168.43.146.8880 > 192.168.43.147.7772: UDP, length 120
01:05:29.563171 IP 192.168.43.146.8880 > 192.168.43.147.7772: UDP, length 120
01:05:29.575338 IP 192.168.43.147.8880 > 192.168.43.124.7773: UDP, length 120
01:05:29.614320 IP 192.168.43.146.8880 > 192.168.43.147.7772: UDP, length 120
01:05:29.625338 IP 192.168.43.147.8880 > 192.168.43.124.7773: UDP, length 120
01:05:29.660685 IP 192.168.43.146.8880 > 192.168.43.147.7772: UDP, length 120
01:05:29.675378 IP 192.168.43.147.8880 > 192.168.43.124.7773: UDP, length 120
01:05:29.709350 IP 192.168.43.146.8880 > 192.168.43.147.7772: UDP, length 120
01:05:29.725346 IP 192.168.43.147.8880 > 192.168.43.124.7773: UDP, length 120
01:05:29.763086 IP 192.168.43.146.8880 > 192.168.43.147.7772: UDP, length 120
01:05:29.775377 IP 192.168.43.147.8880 > 192.168.43.124.7773: UDP, length 120
01:05:29.814299 IP 192.168.43.146.8880 > 192.168.43.147.7772: UDP, length 120
01:05:29.825346 IP 192.168.43.147.8880 > 192.168.43.124.7773: UDP, length 120
01:05:29.857520 IP 192.168.43.146.8880 > 192.168.43.147.7772: UDP, length 120
01:05:29.875345 IP 192.168.43.147.8880 > 192.168.43.124.7773: UDP, length 120
01:05:29.916585 IP 192.168.43.146.8880 > 192.168.43.147.7772: UDP, length 120
01:05:29.925339 IP 192.168.43.147.8880 > 192.168.43.124.7773: UDP, length 120
01:05:29.958037 IP 192.168.43.146.8880 > 192.168.43.147.7772: UDP, length 120
01:05:29.975337 IP 192.168.43.147.8880 > 192.168.43.124.7773: UDP, length 120
01:05:30.008854 IP 192.168.43.146.8880 > 192.168.43.147.7772: UDP, length 120
01:05:30.025337 IP 192.168.43.147.8880 > 192.168.43.124.7773: UDP, length 120
01:05:30.057704 IP 192.168.43.146.8880 > 192.168.43.147.7772: UDP, length 120
01:05:30.075336 IP 192.168.43.147.8880 > 192.168.43.124.7773: UDP, length 120
01:05:30.109087 IP 192.168.43.146.8880 > 192.168.43.147.7772: UDP, length 120
01:05:30.125335 IP 192.168.43.147.8880 > 192.168.43.124.7773: UDP, length 120
01:05:30.158202 IP 192.168.43.146.8880 > 192.168.43.147.7772: UDP, length 120
01:05:30.175337 IP 192.168.43.147.8880 > 192.168.43.124.7773: UDP, length 120
01:05:30.208123 IP 192.168.43.146.8880 > 192.168.43.147.7772: UDP, length 120
01:05:30.225337 IP 192.168.43.147.8880 > 192.168.43.124.7773: UDP, length 120
01:05:30.259276 IP 192.168.43.146.8880 > 192.168.43.147.7772: UDP, length 120
01:05:30.275337 IP 192.168.43.147.8880 > 192.168.43.124.7773: UDP, length 120
01:05:30.310349 IP 192.168.43.146.8880 > 192.168.43.147.7772: UDP, length 120
01:05:30.325337 IP 192.168.43.147.8880 > 192.168.43.124.7773: UDP, length 120
01:05:30.360310 IP 192.168.43.146.8880 > 192.168.43.147.7772: UDP, length 120
01:05:30.376102 IP 192.168.43.147.8880 > 192.168.43.124.7773: UDP, length 120
01:05:30.407476 IP 192.168.43.146.8880 > 192.168.43.147.7772: UDP, length 120
01:05:30.425466 IP 192.168.43.147.8880 > 192.168.43.124.7773: UDP, length 120
01:05:30.459421 IP 192.168.43.146.8880 > 192.168.43.147.7772: UDP, length 120
01:05:30.475426 IP 192.168.43.147.8880 > 192.168.43.124.7773: UDP, length 120
01:05:30.507354 IP 192.168.43.146.8880 > 192.168.43.147.7772: UDP, length 120
01:05:30.525393 IP 192.168.43.147.8880 > 192.168.43.124.7773: UDP, length 120
01:05:30.557405 IP 192.168.43.146.8880 > 192.168.43.147.7772: UDP, length 120
01:05:30.575410 IP 192.168.43.147.8880 > 192.168.43.124.7773: UDP, length 120
01:05:30.612657 IP 192.168.43.146.8880 > 192.168.43.147.7772: UDP, length 120
01:05:30.625379 IP 192.168.43.147.8880 > 192.168.43.124.7773: UDP, length 120
01:05:30.658756 IP 192.168.43.146.8880 > 192.168.43.147.7772: UDP, length 120
01:05:30.675369 IP 192.168.43.147.8880 > 192.168.43.124.7773: UDP, length 120
01:05:30.707462 IP 192.168.43.146.8880 > 192.168.43.147.7772: UDP, length 120
01:05:30.725394 IP 192.168.43.147.8880 > 192.168.43.124.7773: UDP, length 120
01:05:30.759302 IP 192.168.43.146.8880 > 192.168.43.147.7772: UDP, length 120
01:05:30.775385 IP 192.168.43.147.8880 > 192.168.43.124.7773: UDP, length 120
01:05:30.807434 IP 192.168.43.146.8880 > 192.168.43.147.7772: UDP, length 120
01:05:30.825378 IP 192.168.43.147.8880 > 192.168.43.124.7773: UDP, length 120
01:05:30.857318 IP 192.168.43.146.8880 > 192.168.43.147.7772: UDP, length 120
01:05:30.875340 IP 192.168.43.147.8880 > 192.168.43.124.7773: UDP, length 120
01:05:30.911853 IP 192.168.43.146.8880 > 192.168.43.147.7772: UDP, length 120
01:05:30.925315 IP 192.168.43.147.8880 > 192.168.43.124.7773: UDP, length 120
01:05:30.957923 IP 192.168.43.146.8880 > 192.168.43.147.7772: UDP, length 120
01:05:30.975311 IP 192.168.43.147.8880 > 192.168.43.124.7773: UDP, length 120
01:05:31.010363 IP 192.168.43.146.8880 > 192.168.43.147.7772: UDP, length 120
01:05:31.025310 IP 192.168.43.147.8880 > 192.168.43.124.7773: UDP, length 120
01:05:31.056366 IP 192.168.43.146.8880 > 192.168.43.147.7772: UDP, length 120
01:05:31.075311 IP 192.168.43.147.8880 > 192.168.43.124.7773: UDP, length 120
01:05:31.110153 IP 192.168.43.146.8880 > 192.168.43.147.7772: UDP, length 120
01:05:31.125309 IP 192.168.43.147.8880 > 192.168.43.124.7773: UDP, length 120
01:05:31.155962 IP 192.168.43.146.8880 > 192.168.43.147.7772: UDP, length 120
01:05:31.175344 IP 192.168.43.147.8880 > 192.168.43.124.7773: UDP, length 120
01:05:31.206882 IP 192.168.43.146.8880 > 192.168.43.147.7772: UDP, length 120
01:05:31.225312 IP 192.168.43.147.8880 > 192.168.43.124.7773: UDP, length 120
01:05:31.264506 IP 192.168.43.146.8880 > 192.168.43.147.7772: UDP, length 120
01:05:31.275310 IP 192.168.43.147.8880 > 192.168.43.124.7773: UDP, length 120
01:05:31.318180 IP 192.168.43.146.8880 > 192.168.43.147.7772: UDP, length 120
01:05:31.325310 IP 192.168.43.147.8880 > 192.168.43.124.7773: UDP, length 120
01:05:31.372760 IP 192.168.43.146.8880 > 192.168.43.147.7772: UDP, length 120
01:05:31.375308 IP 192.168.43.147.8880 > 192.168.43.124.7773: UDP, length 120
01:05:31.425309 IP 192.168.43.147.8880 > 192.168.43.124.7773: UDP, length 120
01:05:31.428497 IP 192.168.43.146.8880 > 192.168.43.147.7772: UDP, length 120
01:05:31.455788 IP 192.168.43.146.8880 > 192.168.43.147.7772: UDP, length 120
