19:50:39.632390 IP 192.168.43.124.8880 > 192.168.43.146.7771: UDP, length 120
19:50:39.682462 IP 192.168.43.124.8880 > 192.168.43.146.7771: UDP, length 120
19:50:39.732535 IP 192.168.43.124.8880 > 192.168.43.146.7771: UDP, length 120
19:50:39.782540 IP 192.168.43.124.8880 > 192.168.43.146.7771: UDP, length 120
19:50:39.832534 IP 192.168.43.124.8880 > 192.168.43.146.7771: UDP, length 120
19:50:39.882534 IP 192.168.43.124.8880 > 192.168.43.146.7771: UDP, length 120
19:50:39.932534 IP 192.168.43.124.8880 > 192.168.43.146.7771: UDP, length 120
19:50:39.982490 IP 192.168.43.124.8880 > 192.168.43.146.7771: UDP, length 120
19:50:40.032570 IP 192.168.43.124.8880 > 192.168.43.146.7771: UDP, length 120
19:50:40.082544 IP 192.168.43.124.8880 > 192.168.43.146.7771: UDP, length 120
19:50:40.132498 IP 192.168.43.124.8880 > 192.168.43.146.7771: UDP, length 120
19:50:40.182535 IP 192.168.43.124.8880 > 192.168.43.146.7771: UDP, length 120
19:50:40.232536 IP 192.168.43.124.8880 > 192.168.43.146.7771: UDP, length 120
19:50:40.282535 IP 192.168.43.124.8880 > 192.168.43.146.7771: UDP, length 120
19:50:40.332534 IP 192.168.43.124.8880 > 192.168.43.146.7771: UDP, length 120
19:50:40.382535 IP 192.168.43.124.8880 > 192.168.43.146.7771: UDP, length 120
19:50:40.432535 IP 192.168.43.124.8880 > 192.168.43.146.7771: UDP, length 120
19:50:40.482536 IP 192.168.43.124.8880 > 192.168.43.146.7771: UDP, length 120
19:50:40.532478 IP 192.168.43.124.8880 > 192.168.43.146.7771: UDP, length 120
19:50:40.542166 IP 192.168.43.147.8880 > 192.168.43.124.7773: UDP, length 120
19:50:40.582539 IP 192.168.43.124.8880 > 192.168.43.146.7771: UDP, length 120
19:50:40.587031 IP 192.168.43.147.8880 > 192.168.43.124.7773: UDP, length 120
19:50:40.632536 IP 192.168.43.124.8880 > 192.168.43.146.7771: UDP, length 120
19:50:40.641122 IP 192.168.43.147.8880 > 192.168.43.124.7773: UDP, length 120
19:50:40.682480 IP 192.168.43.124.8880 > 192.168.43.146.7771: UDP, length 120
19:50:40.695607 IP 192.168.43.147.8880 > 192.168.43.124.7773: UDP, length 120
19:50:40.732537 IP 192.168.43.124.8880 > 192.168.43.146.7771: UDP, length 120
19:50:40.747025 IP 192.168.43.147.8880 > 192.168.43.124.7773: UDP, length 120
19:50:40.782535 IP 192.168.43.124.8880 > 192.168.43.146.7771: UDP, length 120
19:50:40.792143 IP 192.168.43.147.8880 > 192.168.43.124.7773: UDP, length 120
19:50:40.832494 IP 192.168.43.124.8880 > 192.168.43.146.7771: UDP, length 120
19:50:40.849869 IP 192.168.43.147.8880 > 192.168.43.124.7773: UDP, length 120
19:50:40.882483 IP 192.168.43.124.8880 > 192.168.43.146.7771: UDP, length 120
19:50:40.887332 IP 192.168.43.147.8880 > 192.168.43.124.7773: UDP, length 120
19:50:40.932537 IP 192.168.43.124.8880 > 192.168.43.146.7771: UDP, length 120
19:50:40.982536 IP 192.168.43.124.8880 > 192.168.43.146.7771: UDP, length 120
19:50:41.012321 IP 192.168.43.147.8880 > 192.168.43.124.7773: UDP, length 120
19:50:41.012336 IP 192.168.43.147.8880 > 192.168.43.124.7773: UDP, length 120
19:50:41.032465 IP 192.168.43.124.8880 > 192.168.43.146.7771: UDP, length 120
19:50:41.039161 IP 192.168.43.147.8880 > 192.168.43.124.7773: UDP, length 120
19:50:41.082459 IP 192.168.43.124.8880 > 192.168.43.146.7771: UDP, length 120
19:50:41.089965 IP 192.168.43.147.8880 > 192.168.43.124.7773: UDP, length 120
19:50:41.132467 IP 192.168.43.124.8880 > 192.168.43.146.7771: UDP, length 120
19:50:41.155229 IP 192.168.43.147.8880 > 192.168.43.124.7773: UDP, length 120
19:50:41.182483 IP 192.168.43.124.8880 > 192.168.43.146.7771: UDP, length 120
19:50:41.189024 IP 192.168.43.147.8880 > 192.168.43.124.7773: UDP, length 120
19:50:41.232537 IP 192.168.43.124.8880 > 192.168.43.146.7771: UDP, length 120
19:50:41.236827 IP 192.168.43.147.8880 > 192.168.43.124.7773: UDP, length 120
19:50:41.282536 IP 192.168.43.124.8880 > 192.168.43.146.7771: UDP, length 120
19:50:41.286777 IP 192.168.43.147.8880 > 192.168.43.124.7773: UDP, length 120
19:50:41.332505 IP 192.168.43.124.8880 > 192.168.43.146.7771: UDP, length 120
19:50:41.345844 IP 192.168.43.147.8880 > 192.168.43.124.7773: UDP, length 120
19:50:41.382536 IP 192.168.43.124.8880 > 192.168.43.146.7771: UDP, length 120
19:50:41.389418 IP 192.168.43.147.8880 > 192.168.43.124.7773: UDP, length 120
19:50:41.432538 IP 192.168.43.124.8880 > 192.168.43.146.7771: UDP, length 120
19:50:41.442399 IP 192.168.43.147.8880 > 192.168.43.124.7773: UDP, length 120
19:50:41.482535 IP 192.168.43.124.8880 > 192.168.43.146.7771: UDP, length 120
19:50:41.491048 IP 192.168.43.147.8880 > 192.168.43.124.7773: UDP, length 120
19:50:41.532536 IP 192.168.43.124.8880 > 192.168.43.146.7771: UDP, length 120
19:50:41.541654 IP 192.168.43.147.8880 > 192.168.43.124.7773: UDP, length 120
19:50:41.582537 IP 192.168.43.124.8880 > 192.168.43.146.7771: UDP, length 120
19:50:41.597282 IP 192.168.43.147.8880 > 192.168.43.124.7773: UDP, length 120
19:50:41.632536 IP 192.168.43.124.8880 > 192.168.43.146.7771: UDP, length 120
19:50:41.655436 IP 192.168.43.147.8880 > 192.168.43.124.7773: UDP, length 120
19:50:41.682478 IP 192.168.43.124.8880 > 192.168.43.146.7771: UDP, length 120
19:50:41.689206 IP 192.168.43.147.8880 > 192.168.43.124.7773: UDP, length 120
19:50:41.732537 IP 192.168.43.124.8880 > 192.168.43.146.7771: UDP, length 120
19:50:41.739380 IP 192.168.43.147.8880 > 192.168.43.124.7773: UDP, length 120
19:50:41.782535 IP 192.168.43.124.8880 > 192.168.43.146.7771: UDP, length 120
19:50:41.791217 IP 192.168.43.147.8880 > 192.168.43.124.7773: UDP, length 120
19:50:41.832500 IP 192.168.43.124.8880 > 192.168.43.146.7771: UDP, length 120
19:50:41.836850 IP 192.168.43.147.8880 > 192.168.43.124.7773: UDP, length 120
19:50:41.882537 IP 192.168.43.124.8880 > 192.168.43.146.7771: UDP, length 120
19:50:41.899412 IP 192.168.43.147.8880 > 192.168.43.124.7773: UDP, length 120
19:50:41.932536 IP 192.168.43.124.8880 > 192.168.43.146.7771: UDP, length 120
19:50:41.939258 IP 192.168.43.147.8880 > 192.168.43.124.7773: UDP, length 120
19:50:41.982535 IP 192.168.43.124.8880 > 192.168.43.146.7771: UDP, length 120
19:50:41.989446 IP 192.168.43.147.8880 > 192.168.43.124.7773: UDP, length 120
19:50:42.032535 IP 192.168.43.124.8880 > 192.168.43.146.7771: UDP, length 120
19:50:42.036708 IP 192.168.43.147.8880 > 192.168.43.124.7773: UDP, length 120
19:50:42.082535 IP 192.168.43.124.8880 > 192.168.43.146.7771: UDP, length 120
19:50:42.086708 IP 192.168.43.147.8880 > 192.168.43.124.7773: UDP, length 120
19:50:42.132534 IP 192.168.43.124.8880 > 192.168.43.146.7771: UDP, length 120
19:50:42.139672 IP 192.168.43.147.8880 > 192.168.43.124.7773: UDP, length 120
19:50:42.182535 IP 192.168.43.124.8880 > 192.168.43.146.7771: UDP, length 120
19:50:42.186811 IP 192.168.43.147.8880 > 192.168.43.124.7773: UDP, length 120
19:50:42.232536 IP 192.168.43.124.8880 > 192.168.43.146.7771: UDP, length 120
19:50:42.237869 IP 192.168.43.147.8880 > 192.168.43.124.7773: UDP, length 120
19:50:42.282534 IP 192.168.43.124.8880 > 192.168.43.146.7771: UDP, length 120
19:50:42.286679 IP 192.168.43.147.8880 > 192.168.43.124.7773: UDP, length 120
19:50:42.332500 IP 192.168.43.124.8880 > 192.168.43.146.7771: UDP, length 120
19:50:42.338251 IP 192.168.43.147.8880 > 192.168.43.124.7773: UDP, length 120
19:50:42.382538 IP 192.168.43.124.8880 > 192.168.43.146.7771: UDP, length 120
19:50:42.386479 IP 192.168.43.147.8880 > 192.168.43.124.7773: UDP, length 120
19:50:42.432536 IP 192.168.43.124.8880 > 192.168.43.146.7771: UDP, length 120
19:50:42.448449 IP 192.168.43.147.8880 > 192.168.43.124.7773: UDP, length 120
19:50:42.482537 IP 192.168.43.124.8880 > 192.168.43.146.7771: UDP, length 120
19:50:42.489349 IP 192.168.43.147.8880 > 192.168.43.124.7773: UDP, length 120
19:50:42.532536 IP 192.168.43.124.8880 > 192.168.43.146.7771: UDP, length 120
19:50:42.536512 IP 192.168.43.147.8880 > 192.168.43.124.7773: UDP, length 120
19:50:42.582536 IP 192.168.43.124.8880 > 192.168.43.146.7771: UDP, length 120
19:50:42.589599 IP 192.168.43.147.8880 > 192.168.43.124.7773: UDP, length 120
19:50:42.632535 IP 192.168.43.124.8880 > 192.168.43.146.7771: UDP, length 120
19:50:42.636331 IP 192.168.43.147.8880 > 192.168.43.124.7773: UDP, length 120
19:50:42.682644 IP 192.168.43.124.8880 > 192.168.43.146.7771: UDP, length 120
19:50:42.691467 IP 192.168.43.147.8880 > 192.168.43.124.7773: UDP, length 120
19:50:42.732544 IP 192.168.43.124.8880 > 192.168.43.146.7771: UDP, length 120
19:50:42.738783 IP 192.168.43.147.8880 > 192.168.43.124.7773: UDP, length 120
19:50:42.782535 IP 192.168.43.124.8880 > 192.168.43.146.7771: UDP, length 120
19:50:42.784795 IP 192.168.43.147.8880 > 192.168.43.124.7773: UDP, length 120
19:50:42.832501 IP 192.168.43.124.8880 > 192.168.43.146.7771: UDP, length 120
19:50:42.844991 IP 192.168.43.147.8880 > 192.168.43.124.7773: UDP, length 120
19:50:42.882586 IP 192.168.43.124.8880 > 192.168.43.146.7771: UDP, length 120
19:50:42.898595 IP 192.168.43.147.8880 > 192.168.43.124.7773: UDP, length 120
19:50:42.932587 IP 192.168.43.124.8880 > 192.168.43.146.7771: UDP, length 120
19:50:42.957464 IP 192.168.43.147.8880 > 192.168.43.124.7773: UDP, length 120
19:50:42.982584 IP 192.168.43.124.8880 > 192.168.43.146.7771: UDP, length 120
19:50:42.987170 IP 192.168.43.147.8880 > 192.168.43.124.7773: UDP, length 120
19:50:43.032540 IP 192.168.43.124.8880 > 192.168.43.146.7771: UDP, length 120
19:50:43.036562 IP 192.168.43.147.8880 > 192.168.43.124.7773: UDP, length 120
19:50:43.082601 IP 192.168.43.124.8880 > 192.168.43.146.7771: UDP, length 120
19:50:43.087524 IP 192.168.43.147.8880 > 192.168.43.124.7773: UDP, length 120
19:50:43.132541 IP 192.168.43.124.8880 > 192.168.43.146.7771: UDP, length 120
19:50:43.138226 IP 192.168.43.147.8880 > 192.168.43.124.7773: UDP, length 120
19:50:43.182946 IP 192.168.43.124.8880 > 192.168.43.146.7771: UDP, length 120
19:50:43.190981 IP 192.168.43.147.8880 > 192.168.43.124.7773: UDP, length 120
19:50:43.232535 IP 192.168.43.124.8880 > 192.168.43.146.7771: UDP, length 120
19:50:43.236710 IP 192.168.43.147.8880 > 192.168.43.124.7773: UDP, length 120
19:50:43.282537 IP 192.168.43.124.8880 > 192.168.43.146.7771: UDP, length 120
19:50:43.332535 IP 192.168.43.124.8880 > 192.168.43.146.7771: UDP, length 120
19:50:43.336512 IP 192.168.43.147.8880 > 192.168.43.124.7773: UDP, length 120
19:50:43.382542 IP 192.168.43.124.8880 > 192.168.43.146.7771: UDP, length 120
19:50:43.386491 IP 192.168.43.147.8880 > 192.168.43.124.7773: UDP, length 120
19:50:43.432474 IP 192.168.43.124.8880 > 192.168.43.146.7771: UDP, length 120
19:50:43.436959 IP 192.168.43.147.8880 > 192.168.43.124.7773: UDP, length 120
19:50:43.482537 IP 192.168.43.124.8880 > 192.168.43.146.7771: UDP, length 120
19:50:43.487564 IP 192.168.43.147.8880 > 192.168.43.124.7773: UDP, length 120
19:50:43.532537 IP 192.168.43.124.8880 > 192.168.43.146.7771: UDP, length 120
19:50:43.536331 IP 192.168.43.147.8880 > 192.168.43.124.7773: UDP, length 120
19:50:43.582536 IP 192.168.43.124.8880 > 192.168.43.146.7771: UDP, length 120
19:50:43.590568 IP 192.168.43.147.8880 > 192.168.43.124.7773: UDP, length 120
19:50:43.632537 IP 192.168.43.124.8880 > 192.168.43.146.7771: UDP, length 120
19:50:43.640543 IP 192.168.43.147.8880 > 192.168.43.124.7773: UDP, length 120
19:50:43.682524 IP 192.168.43.124.8880 > 192.168.43.146.7771: UDP, length 120
19:50:43.690186 IP 192.168.43.147.8880 > 192.168.43.124.7773: UDP, length 120
19:50:43.732456 IP 192.168.43.124.8880 > 192.168.43.146.7771: UDP, length 120
19:50:43.741383 IP 192.168.43.147.8880 > 192.168.43.124.7773: UDP, length 120
19:50:43.782534 IP 192.168.43.124.8880 > 192.168.43.146.7771: UDP, length 120
19:50:43.789085 IP 192.168.43.147.8880 > 192.168.43.124.7773: UDP, length 120
19:50:43.832519 IP 192.168.43.124.8880 > 192.168.43.146.7771: UDP, length 120
19:50:43.839627 IP 192.168.43.147.8880 > 192.168.43.124.7773: UDP, length 120
19:50:43.882536 IP 192.168.43.124.8880 > 192.168.43.146.7771: UDP, length 120
19:50:43.889548 IP 192.168.43.147.8880 > 192.168.43.124.7773: UDP, length 120
19:50:43.932537 IP 192.168.43.124.8880 > 192.168.43.146.7771: UDP, length 120
19:50:43.942015 IP 192.168.43.147.8880 > 192.168.43.124.7773: UDP, length 120
19:50:43.982536 IP 192.168.43.124.8880 > 192.168.43.146.7771: UDP, length 120
19:50:43.992929 IP 192.168.43.147.8880 > 192.168.43.124.7773: UDP, length 120
19:50:44.032536 IP 192.168.43.124.8880 > 192.168.43.146.7771: UDP, length 120
19:50:44.036711 IP 192.168.43.147.8880 > 192.168.43.124.7773: UDP, length 120
19:50:44.082535 IP 192.168.43.124.8880 > 192.168.43.146.7771: UDP, length 120
19:50:44.086569 IP 192.168.43.147.8880 > 192.168.43.124.7773: UDP, length 120
19:50:44.132539 IP 192.168.43.124.8880 > 192.168.43.146.7771: UDP, length 120
19:50:44.138586 IP 192.168.43.147.8880 > 192.168.43.124.7773: UDP, length 120
19:50:44.182491 IP 192.168.43.124.8880 > 192.168.43.146.7771: UDP, length 120
19:50:44.197690 IP 192.168.43.147.8880 > 192.168.43.124.7773: UDP, length 120
19:50:44.232538 IP 192.168.43.124.8880 > 192.168.43.146.7771: UDP, length 120
19:50:44.244610 IP 192.168.43.147.8880 > 192.168.43.124.7773: UDP, length 120
19:50:44.282535 IP 192.168.43.124.8880 > 192.168.43.146.7771: UDP, length 120
19:50:44.286379 IP 192.168.43.147.8880 > 192.168.43.124.7773: UDP, length 120
19:50:44.332489 IP 192.168.43.124.8880 > 192.168.43.146.7771: UDP, length 120
19:50:44.336690 IP 192.168.43.147.8880 > 192.168.43.124.7773: UDP, length 120
19:50:44.382535 IP 192.168.43.124.8880 > 192.168.43.146.7771: UDP, length 120
19:50:44.389737 IP 192.168.43.147.8880 > 192.168.43.124.7773: UDP, length 120
19:50:44.432561 IP 192.168.43.124.8880 > 192.168.43.146.7771: UDP, length 120
19:50:44.439627 IP 192.168.43.147.8880 > 192.168.43.124.7773: UDP, length 120
19:50:44.482562 IP 192.168.43.124.8880 > 192.168.43.146.7771: UDP, length 120
19:50:44.488714 IP 192.168.43.147.8880 > 192.168.43.124.7773: UDP, length 120
19:50:44.532565 IP 192.168.43.124.8880 > 192.168.43.146.7771: UDP, length 120
19:50:44.536749 IP 192.168.43.147.8880 > 192.168.43.124.7773: UDP, length 120
19:50:44.582563 IP 192.168.43.124.8880 > 192.168.43.146.7771: UDP, length 120
19:50:44.586831 IP 192.168.43.147.8880 > 192.168.43.124.7773: UDP, length 120
19:50:44.632563 IP 192.168.43.124.8880 > 192.168.43.146.7771: UDP, length 120
19:50:44.636909 IP 192.168.43.147.8880 > 192.168.43.124.7773: UDP, length 120
19:50:44.682530 IP 192.168.43.124.8880 > 192.168.43.146.7771: UDP, length 120
19:50:44.689120 IP 192.168.43.147.8880 > 192.168.43.124.7773: UDP, length 120
19:50:44.732544 IP 192.168.43.124.8880 > 192.168.43.146.7771: UDP, length 120
19:50:44.738552 IP 192.168.43.147.8880 > 192.168.43.124.7773: UDP, length 120
19:50:44.782536 IP 192.168.43.124.8880 > 192.168.43.146.7771: UDP, length 120
19:50:44.789875 IP 192.168.43.147.8880 > 192.168.43.124.7773: UDP, length 120
19:50:44.832536 IP 192.168.43.124.8880 > 192.168.43.146.7771: UDP, length 120
19:50:44.835931 IP 192.168.43.147.8880 > 192.168.43.124.7773: UDP, length 120
19:50:44.882534 IP 192.168.43.124.8880 > 192.168.43.146.7771: UDP, length 120
19:50:44.886484 IP 192.168.43.147.8880 > 192.168.43.124.7773: UDP, length 120
19:50:44.932536 IP 192.168.43.124.8880 > 192.168.43.146.7771: UDP, length 120
19:50:44.936691 IP 192.168.43.147.8880 > 192.168.43.124.7773: UDP, length 120
19:50:44.982581 IP 192.168.43.124.8880 > 192.168.43.146.7771: UDP, length 120
19:50:44.996856 IP 192.168.43.147.8880 > 192.168.43.124.7773: UDP, length 120
19:50:45.154776 IP 192.168.43.124.8880 > 192.168.43.146.7771: UDP, length 120
19:50:45.154929 IP 192.168.43.124.8880 > 192.168.43.146.7771: UDP, length 120
19:50:45.154934 IP 192.168.43.124.8880 > 192.168.43.146.7771: UDP, length 120
19:50:45.157137 IP 192.168.43.147.8880 > 192.168.43.124.7773: UDP, length 120
19:50:45.157360 IP 192.168.43.147.8880 > 192.168.43.124.7773: UDP, length 120
19:50:45.157364 IP 192.168.43.147.8880 > 192.168.43.124.7773: UDP, length 120
19:50:45.182462 IP 192.168.43.124.8880 > 192.168.43.146.7771: UDP, length 120
19:50:45.186668 IP 192.168.43.147.8880 > 192.168.43.124.7773: UDP, length 120
19:50:45.232537 IP 192.168.43.124.8880 > 192.168.43.146.7771: UDP, length 120
19:50:45.249825 IP 192.168.43.147.8880 > 192.168.43.124.7773: UDP, length 120
19:50:45.282466 IP 192.168.43.124.8880 > 192.168.43.146.7771: UDP, length 120
19:50:45.288886 IP 192.168.43.147.8880 > 192.168.43.124.7773: UDP, length 120
19:50:45.332500 IP 192.168.43.124.8880 > 192.168.43.146.7771: UDP, length 120
19:50:45.339966 IP 192.168.43.147.8880 > 192.168.43.124.7773: UDP, length 120
19:50:45.502803 IP 192.168.43.124.8880 > 192.168.43.146.7771: UDP, length 120
19:50:45.502957 IP 192.168.43.124.8880 > 192.168.43.146.7771: UDP, length 120
19:50:45.502961 IP 192.168.43.124.8880 > 192.168.43.146.7771: UDP, length 120
19:50:45.504247 IP 192.168.43.147.8880 > 192.168.43.124.7773: UDP, length 120
19:50:45.504259 IP 192.168.43.147.8880 > 192.168.43.124.7773: UDP, length 120
19:50:45.513789 IP 192.168.43.147.8880 > 192.168.43.124.7773: UDP, length 120
19:50:45.532641 IP 192.168.43.124.8880 > 192.168.43.146.7771: UDP, length 120
19:50:45.537029 IP 192.168.43.147.8880 > 192.168.43.124.7773: UDP, length 120
19:50:45.582534 IP 192.168.43.124.8880 > 192.168.43.146.7771: UDP, length 120
19:50:45.588924 IP 192.168.43.147.8880 > 192.168.43.124.7773: UDP, length 120
19:50:45.632537 IP 192.168.43.124.8880 > 192.168.43.146.7771: UDP, length 120
19:50:45.638221 IP 192.168.43.147.8880 > 192.168.43.124.7773: UDP, length 120
19:50:45.682479 IP 192.168.43.124.8880 > 192.168.43.146.7771: UDP, length 120
19:50:45.686667 IP 192.168.43.147.8880 > 192.168.43.124.7773: UDP, length 120
19:50:45.850784 IP 192.168.43.124.8880 > 192.168.43.146.7771: UDP, length 120
19:50:45.850934 IP 192.168.43.124.8880 > 192.168.43.146.7771: UDP, length 120
19:50:45.850938 IP 192.168.43.124.8880 > 192.168.43.146.7771: UDP, length 120
19:50:45.852228 IP 192.168.43.147.8880 > 192.168.43.124.7773: UDP, length 120
19:50:45.852241 IP 192.168.43.147.8880 > 192.168.43.124.7773: UDP, length 120
19:50:45.852243 IP 192.168.43.147.8880 > 192.168.43.124.7773: UDP, length 120
19:50:45.882480 IP 192.168.43.124.8880 > 192.168.43.146.7771: UDP, length 120
19:50:45.901429 IP 192.168.43.147.8880 > 192.168.43.124.7773: UDP, length 120
19:50:45.932536 IP 192.168.43.124.8880 > 192.168.43.146.7771: UDP, length 120
19:50:45.938975 IP 192.168.43.147.8880 > 192.168.43.124.7773: UDP, length 120
19:50:45.982534 IP 192.168.43.124.8880 > 192.168.43.146.7771: UDP, length 120
19:50:45.993065 IP 192.168.43.147.8880 > 192.168.43.124.7773: UDP, length 120
19:50:46.032501 IP 192.168.43.124.8880 > 192.168.43.146.7771: UDP, length 120
19:50:46.048272 IP 192.168.43.147.8880 > 192.168.43.124.7773: UDP, length 120
19:50:46.198723 IP 192.168.43.124.8880 > 192.168.43.146.7771: UDP, length 120
19:50:46.198872 IP 192.168.43.124.8880 > 192.168.43.146.7771: UDP, length 120
19:50:46.198876 IP 192.168.43.124.8880 > 192.168.43.146.7771: UDP, length 120
19:50:46.201138 IP 192.168.43.147.8880 > 192.168.43.124.7773: UDP, length 120
19:50:46.201332 IP 192.168.43.147.8880 > 192.168.43.124.7773: UDP, length 120
19:50:46.201334 IP 192.168.43.147.8880 > 192.168.43.124.7773: UDP, length 120
19:50:46.232476 IP 192.168.43.124.8880 > 192.168.43.146.7771: UDP, length 120
19:50:46.235048 IP 192.168.43.147.8880 > 192.168.43.124.7773: UDP, length 120
19:50:46.282536 IP 192.168.43.124.8880 > 192.168.43.146.7771: UDP, length 120
19:50:46.314935 IP 192.168.43.147.8880 > 192.168.43.124.7773: UDP, length 120
19:50:46.332483 IP 192.168.43.124.8880 > 192.168.43.146.7771: UDP, length 120
19:50:46.338717 IP 192.168.43.147.8880 > 192.168.43.124.7773: UDP, length 120
19:50:46.382484 IP 192.168.43.124.8880 > 192.168.43.146.7771: UDP, length 120
19:50:46.384611 IP 192.168.43.147.8880 > 192.168.43.124.7773: UDP, length 120
19:50:46.546777 IP 192.168.43.124.8880 > 192.168.43.146.7771: UDP, length 120
19:50:46.546930 IP 192.168.43.124.8880 > 192.168.43.146.7771: UDP, length 120
19:50:46.546935 IP 192.168.43.124.8880 > 192.168.43.146.7771: UDP, length 120
19:50:46.548213 IP 192.168.43.147.8880 > 192.168.43.124.7773: UDP, length 120
19:50:46.548226 IP 192.168.43.147.8880 > 192.168.43.124.7773: UDP, length 120
19:50:46.548228 IP 192.168.43.147.8880 > 192.168.43.124.7773: UDP, length 120
19:50:46.582535 IP 192.168.43.124.8880 > 192.168.43.146.7771: UDP, length 120
19:50:46.590139 IP 192.168.43.147.8880 > 192.168.43.124.7773: UDP, length 120
19:50:46.632535 IP 192.168.43.124.8880 > 192.168.43.146.7771: UDP, length 120
19:50:46.645064 IP 192.168.43.147.8880 > 192.168.43.124.7773: UDP, length 120
19:50:46.682475 IP 192.168.43.124.8880 > 192.168.43.146.7771: UDP, length 120
19:50:46.689258 IP 192.168.43.147.8880 > 192.168.43.124.7773: UDP, length 120
19:50:46.732536 IP 192.168.43.124.8880 > 192.168.43.146.7771: UDP, length 120
19:50:46.741040 IP 192.168.43.147.8880 > 192.168.43.124.7773: UDP, length 120
19:50:46.894786 IP 192.168.43.124.8880 > 192.168.43.146.7771: UDP, length 120
19:50:46.894936 IP 192.168.43.124.8880 > 192.168.43.146.7771: UDP, length 120
19:50:46.894942 IP 192.168.43.124.8880 > 192.168.43.146.7771: UDP, length 120
19:50:46.896215 IP 192.168.43.147.8880 > 192.168.43.124.7773: UDP, length 120
19:50:46.896228 IP 192.168.43.147.8880 > 192.168.43.124.7773: UDP, length 120
19:50:46.896231 IP 192.168.43.147.8880 > 192.168.43.124.7773: UDP, length 120
19:50:46.932534 IP 192.168.43.124.8880 > 192.168.43.146.7771: UDP, length 120
19:50:46.940764 IP 192.168.43.147.8880 > 192.168.43.124.7773: UDP, length 120
19:50:46.982535 IP 192.168.43.124.8880 > 192.168.43.146.7771: UDP, length 120
19:50:46.991300 IP 192.168.43.147.8880 > 192.168.43.124.7773: UDP, length 120
19:50:47.032536 IP 192.168.43.124.8880 > 192.168.43.146.7771: UDP, length 120
19:50:47.038925 IP 192.168.43.147.8880 > 192.168.43.124.7773: UDP, length 120
19:50:47.082535 IP 192.168.43.124.8880 > 192.168.43.146.7771: UDP, length 120
19:50:47.092564 IP 192.168.43.147.8880 > 192.168.43.124.7773: UDP, length 120
19:50:47.242774 IP 192.168.43.124.8880 > 192.168.43.146.7771: UDP, length 120
19:50:47.242928 IP 192.168.43.124.8880 > 192.168.43.146.7771: UDP, length 120
19:50:47.242932 IP 192.168.43.124.8880 > 192.168.43.146.7771: UDP, length 120
19:50:47.244355 IP 192.168.43.147.8880 > 192.168.43.124.7773: UDP, length 120
19:50:47.244371 IP 192.168.43.147.8880 > 192.168.43.124.7773: UDP, length 120
19:50:47.244373 IP 192.168.43.147.8880 > 192.168.43.124.7773: UDP, length 120
19:50:47.282485 IP 192.168.43.124.8880 > 192.168.43.146.7771: UDP, length 120
19:50:47.290223 IP 192.168.43.147.8880 > 192.168.43.124.7773: UDP, length 120
19:50:47.332535 IP 192.168.43.124.8880 > 192.168.43.146.7771: UDP, length 120
19:50:47.336526 IP 192.168.43.147.8880 > 192.168.43.124.7773: UDP, length 120
19:50:47.382534 IP 192.168.43.124.8880 > 192.168.43.146.7771: UDP, length 120
19:50:47.389171 IP 192.168.43.147.8880 > 192.168.43.124.7773: UDP, length 120
19:50:47.432536 IP 192.168.43.124.8880 > 192.168.43.146.7771: UDP, length 120
19:50:47.590639 IP 192.168.43.124.8880 > 192.168.43.146.7771: UDP, length 120
19:50:47.590792 IP 192.168.43.124.8880 > 192.168.43.146.7771: UDP, length 120
19:50:47.590796 IP 192.168.43.124.8880 > 192.168.43.146.7771: UDP, length 120
19:50:47.592695 IP 192.168.43.147.8880 > 192.168.43.124.7773: UDP, length 120
19:50:47.592708 IP 192.168.43.147.8880 > 192.168.43.124.7773: UDP, length 120
19:50:47.592710 IP 192.168.43.147.8880 > 192.168.43.124.7773: UDP, length 120
19:50:47.632534 IP 192.168.43.124.8880 > 192.168.43.146.7771: UDP, length 120
19:50:47.636745 IP 192.168.43.147.8880 > 192.168.43.124.7773: UDP, length 120
19:50:47.682478 IP 192.168.43.124.8880 > 192.168.43.146.7771: UDP, length 120
19:50:47.687136 IP 192.168.43.147.8880 > 192.168.43.124.7773: UDP, length 120
19:50:47.732535 IP 192.168.43.124.8880 > 192.168.43.146.7771: UDP, length 120
19:50:47.738359 IP 192.168.43.147.8880 > 192.168.43.124.7773: UDP, length 120
19:50:47.782535 IP 192.168.43.124.8880 > 192.168.43.146.7771: UDP, length 120
19:50:47.788881 IP 192.168.43.147.8880 > 192.168.43.124.7773: UDP, length 120
19:50:47.938734 IP 192.168.43.124.8880 > 192.168.43.146.7771: UDP, length 120
19:50:47.938893 IP 192.168.43.124.8880 > 192.168.43.146.7771: UDP, length 120
19:50:47.938921 IP 192.168.43.124.8880 > 192.168.43.146.7771: UDP, length 120
19:50:47.940004 IP 192.168.43.147.8880 > 192.168.43.124.7773: UDP, length 120
19:50:47.940019 IP 192.168.43.147.8880 > 192.168.43.124.7773: UDP, length 120
19:50:47.940914 IP 192.168.43.147.8880 > 192.168.43.124.7773: UDP, length 120
19:50:47.982535 IP 192.168.43.124.8880 > 192.168.43.146.7771: UDP, length 120
19:50:47.991507 IP 192.168.43.147.8880 > 192.168.43.124.7773: UDP, length 120
19:50:48.032480 IP 192.168.43.124.8880 > 192.168.43.146.7771: UDP, length 120
19:50:48.054639 IP 192.168.43.147.8880 > 192.168.43.124.7773: UDP, length 120
19:50:48.082534 IP 192.168.43.124.8880 > 192.168.43.146.7771: UDP, length 120
19:50:48.086444 IP 192.168.43.147.8880 > 192.168.43.124.7773: UDP, length 120
19:50:48.132479 IP 192.168.43.124.8880 > 192.168.43.146.7771: UDP, length 120
19:50:48.286737 IP 192.168.43.124.8880 > 192.168.43.146.7771: UDP, length 120
19:50:48.286891 IP 192.168.43.124.8880 > 192.168.43.146.7771: UDP, length 120
19:50:48.286895 IP 192.168.43.124.8880 > 192.168.43.146.7771: UDP, length 120
19:50:48.288681 IP 192.168.43.147.8880 > 192.168.43.124.7773: UDP, length 120
19:50:48.288694 IP 192.168.43.147.8880 > 192.168.43.124.7773: UDP, length 120
19:50:48.288696 IP 192.168.43.147.8880 > 192.168.43.124.7773: UDP, length 120
19:50:48.289388 IP 192.168.43.147.8880 > 192.168.43.124.7773: UDP, length 120
19:50:48.332500 IP 192.168.43.124.8880 > 192.168.43.146.7771: UDP, length 120
19:50:48.336520 IP 192.168.43.147.8880 > 192.168.43.124.7773: UDP, length 120
19:50:48.382535 IP 192.168.43.124.8880 > 192.168.43.146.7771: UDP, length 120
19:50:48.387735 IP 192.168.43.147.8880 > 192.168.43.124.7773: UDP, length 120
19:50:48.432535 IP 192.168.43.124.8880 > 192.168.43.146.7771: UDP, length 120
19:50:48.442548 IP 192.168.43.147.8880 > 192.168.43.124.7773: UDP, length 120
19:50:48.482536 IP 192.168.43.124.8880 > 192.168.43.146.7771: UDP, length 120
19:50:48.488710 IP 192.168.43.147.8880 > 192.168.43.124.7773: UDP, length 120
19:50:48.541894 IP 192.168.43.147.8880 > 192.168.43.124.7773: UDP, length 120
19:50:48.588946 IP 192.168.43.147.8880 > 192.168.43.124.7773: UDP, length 120
19:50:48.634903 IP 192.168.43.124.8880 > 192.168.43.146.7771: UDP, length 120
19:50:48.634911 IP 192.168.43.124.8880 > 192.168.43.146.7771: UDP, length 120
19:50:48.635099 IP 192.168.43.124.8880 > 192.168.43.146.7771: UDP, length 120
19:50:48.638495 IP 192.168.43.147.8880 > 192.168.43.124.7773: UDP, length 120
19:50:48.682469 IP 192.168.43.124.8880 > 192.168.43.146.7771: UDP, length 120
19:50:48.688972 IP 192.168.43.147.8880 > 192.168.43.124.7773: UDP, length 120
19:50:48.732539 IP 192.168.43.124.8880 > 192.168.43.146.7771: UDP, length 120
19:50:48.739232 IP 192.168.43.147.8880 > 192.168.43.124.7773: UDP, length 120
19:50:48.782536 IP 192.168.43.124.8880 > 192.168.43.146.7771: UDP, length 120
19:50:48.786419 IP 192.168.43.147.8880 > 192.168.43.124.7773: UDP, length 120
19:50:48.982779 IP 192.168.43.124.8880 > 192.168.43.146.7771: UDP, length 120
19:50:48.982941 IP 192.168.43.124.8880 > 192.168.43.146.7771: UDP, length 120
19:50:48.982944 IP 192.168.43.124.8880 > 192.168.43.146.7771: UDP, length 120
19:50:48.982949 IP 192.168.43.124.8880 > 192.168.43.146.7771: UDP, length 120
19:50:48.984740 IP 192.168.43.147.8880 > 192.168.43.124.7773: UDP, length 120
19:50:48.984753 IP 192.168.43.147.8880 > 192.168.43.124.7773: UDP, length 120
19:50:48.984755 IP 192.168.43.147.8880 > 192.168.43.124.7773: UDP, length 120
19:50:48.998129 IP 192.168.43.147.8880 > 192.168.43.124.7773: UDP, length 120
19:50:49.032501 IP 192.168.43.124.8880 > 192.168.43.146.7771: UDP, length 120
19:50:49.039064 IP 192.168.43.147.8880 > 192.168.43.124.7773: UDP, length 120
19:50:49.082481 IP 192.168.43.124.8880 > 192.168.43.146.7771: UDP, length 120
19:50:49.092034 IP 192.168.43.147.8880 > 192.168.43.124.7773: UDP, length 120
19:50:49.132501 IP 192.168.43.124.8880 > 192.168.43.146.7771: UDP, length 120
19:50:49.141283 IP 192.168.43.147.8880 > 192.168.43.124.7773: UDP, length 120
19:50:49.331637 IP 192.168.43.124.8880 > 192.168.43.146.7771: UDP, length 120
19:50:49.331644 IP 192.168.43.124.8880 > 192.168.43.146.7771: UDP, length 120
19:50:49.331801 IP 192.168.43.124.8880 > 192.168.43.146.7771: UDP, length 120
19:50:49.332457 IP 192.168.43.124.8880 > 192.168.43.146.7771: UDP, length 120
19:50:49.332776 IP 192.168.43.147.8880 > 192.168.43.124.7773: UDP, length 120
19:50:49.332824 IP 192.168.43.147.8880 > 192.168.43.124.7773: UDP, length 120
19:50:49.332827 IP 192.168.43.147.8880 > 192.168.43.124.7773: UDP, length 120
19:50:49.345247 IP 192.168.43.147.8880 > 192.168.43.124.7773: UDP, length 120
19:50:49.382537 IP 192.168.43.124.8880 > 192.168.43.146.7771: UDP, length 120
19:50:49.386754 IP 192.168.43.147.8880 > 192.168.43.124.7773: UDP, length 120
19:50:49.432536 IP 192.168.43.124.8880 > 192.168.43.146.7771: UDP, length 120
19:50:49.449816 IP 192.168.43.147.8880 > 192.168.43.124.7773: UDP, length 120
19:50:49.482536 IP 192.168.43.124.8880 > 192.168.43.146.7771: UDP, length 120
19:50:49.489082 IP 192.168.43.147.8880 > 192.168.43.124.7773: UDP, length 120
19:50:49.532537 IP 192.168.43.124.8880 > 192.168.43.146.7771: UDP, length 120
19:50:49.536560 IP 192.168.43.147.8880 > 192.168.43.124.7773: UDP, length 120
19:50:49.582534 IP 192.168.43.124.8880 > 192.168.43.146.7771: UDP, length 120
19:50:49.589769 IP 192.168.43.147.8880 > 192.168.43.124.7773: UDP, length 120
19:50:49.632536 IP 192.168.43.124.8880 > 192.168.43.146.7771: UDP, length 120
19:50:49.638754 IP 192.168.43.147.8880 > 192.168.43.124.7773: UDP, length 120
19:50:49.682466 IP 192.168.43.124.8880 > 192.168.43.146.7771: UDP, length 120
19:50:49.686978 IP 192.168.43.147.8880 > 192.168.43.124.7773: UDP, length 120
19:50:49.732500 IP 192.168.43.124.8880 > 192.168.43.146.7771: UDP, length 120
19:50:49.744154 IP 192.168.43.147.8880 > 192.168.43.124.7773: UDP, length 120
19:50:49.782534 IP 192.168.43.124.8880 > 192.168.43.146.7771: UDP, length 120
19:50:49.786797 IP 192.168.43.147.8880 > 192.168.43.124.7773: UDP, length 120
19:50:49.832476 IP 192.168.43.124.8880 > 192.168.43.146.7771: UDP, length 120
19:50:49.837331 IP 192.168.43.147.8880 > 192.168.43.124.7773: UDP, length 120
19:50:49.882483 IP 192.168.43.124.8880 > 192.168.43.146.7771: UDP, length 120
19:50:49.889835 IP 192.168.43.147.8880 > 192.168.43.124.7773: UDP, length 120
19:50:49.932535 IP 192.168.43.124.8880 > 192.168.43.146.7771: UDP, length 120
19:50:49.941284 IP 192.168.43.147.8880 > 192.168.43.124.7773: UDP, length 120
19:50:49.982535 IP 192.168.43.124.8880 > 192.168.43.146.7771: UDP, length 120
19:50:49.989288 IP 192.168.43.147.8880 > 192.168.43.124.7773: UDP, length 120
19:50:50.032536 IP 192.168.43.124.8880 > 192.168.43.146.7771: UDP, length 120
19:50:50.042820 IP 192.168.43.147.8880 > 192.168.43.124.7773: UDP, length 120
19:50:50.082575 IP 192.168.43.124.8880 > 192.168.43.146.7771: UDP, length 120
19:50:50.091629 IP 192.168.43.147.8880 > 192.168.43.124.7773: UDP, length 120
19:50:50.132536 IP 192.168.43.124.8880 > 192.168.43.146.7771: UDP, length 120
19:50:50.136094 IP 192.168.43.147.8880 > 192.168.43.124.7773: UDP, length 120
19:50:50.182477 IP 192.168.43.124.8880 > 192.168.43.146.7771: UDP, length 120
19:50:50.189025 IP 192.168.43.147.8880 > 192.168.43.124.7773: UDP, length 120
19:50:50.232536 IP 192.168.43.124.8880 > 192.168.43.146.7771: UDP, length 120
19:50:50.239794 IP 192.168.43.147.8880 > 192.168.43.124.7773: UDP, length 120
19:50:50.282536 IP 192.168.43.124.8880 > 192.168.43.146.7771: UDP, length 120
19:50:50.290599 IP 192.168.43.147.8880 > 192.168.43.124.7773: UDP, length 120
19:50:50.332499 IP 192.168.43.124.8880 > 192.168.43.146.7771: UDP, length 120
19:50:50.336855 IP 192.168.43.147.8880 > 192.168.43.124.7773: UDP, length 120
19:50:50.382536 IP 192.168.43.124.8880 > 192.168.43.146.7771: UDP, length 120
19:50:50.393133 IP 192.168.43.147.8880 > 192.168.43.124.7773: UDP, length 120
19:50:50.432536 IP 192.168.43.124.8880 > 192.168.43.146.7771: UDP, length 120
19:50:50.443958 IP 192.168.43.147.8880 > 192.168.43.124.7773: UDP, length 120
19:50:50.482536 IP 192.168.43.124.8880 > 192.168.43.146.7771: UDP, length 120
19:50:50.487026 IP 192.168.43.147.8880 > 192.168.43.124.7773: UDP, length 120
19:50:50.532535 IP 192.168.43.124.8880 > 192.168.43.146.7771: UDP, length 120
19:50:50.539810 IP 192.168.43.147.8880 > 192.168.43.124.7773: UDP, length 120
19:50:50.582533 IP 192.168.43.124.8880 > 192.168.43.146.7771: UDP, length 120
19:50:50.624580 IP 192.168.43.147.8880 > 192.168.43.124.7773: UDP, length 120
19:50:50.632479 IP 192.168.43.124.8880 > 192.168.43.146.7771: UDP, length 120
19:50:50.639188 IP 192.168.43.147.8880 > 192.168.43.124.7773: UDP, length 120
19:50:50.682525 IP 192.168.43.124.8880 > 192.168.43.146.7771: UDP, length 120
19:50:50.689579 IP 192.168.43.147.8880 > 192.168.43.124.7773: UDP, length 120
19:50:50.732536 IP 192.168.43.124.8880 > 192.168.43.146.7771: UDP, length 120
19:50:50.736599 IP 192.168.43.147.8880 > 192.168.43.124.7773: UDP, length 120
19:50:50.782536 IP 192.168.43.124.8880 > 192.168.43.146.7771: UDP, length 120
19:50:50.793888 IP 192.168.43.147.8880 > 192.168.43.124.7773: UDP, length 120
19:50:50.832504 IP 192.168.43.124.8880 > 192.168.43.146.7771: UDP, length 120
19:50:50.841797 IP 192.168.43.147.8880 > 192.168.43.124.7773: UDP, length 120
19:50:50.882539 IP 192.168.43.124.8880 > 192.168.43.146.7771: UDP, length 120
19:50:50.886761 IP 192.168.43.147.8880 > 192.168.43.124.7773: UDP, length 120
19:50:50.932539 IP 192.168.43.124.8880 > 192.168.43.146.7771: UDP, length 120
19:50:50.936801 IP 192.168.43.147.8880 > 192.168.43.124.7773: UDP, length 120
19:50:50.982485 IP 192.168.43.124.8880 > 192.168.43.146.7771: UDP, length 120
19:50:50.986861 IP 192.168.43.147.8880 > 192.168.43.124.7773: UDP, length 120
19:50:51.032536 IP 192.168.43.124.8880 > 192.168.43.146.7771: UDP, length 120
19:50:51.039062 IP 192.168.43.147.8880 > 192.168.43.124.7773: UDP, length 120
19:50:51.082535 IP 192.168.43.124.8880 > 192.168.43.146.7771: UDP, length 120
19:50:51.088246 IP 192.168.43.147.8880 > 192.168.43.124.7773: UDP, length 120
19:50:51.132537 IP 192.168.43.124.8880 > 192.168.43.146.7771: UDP, length 120
19:50:51.139277 IP 192.168.43.147.8880 > 192.168.43.124.7773: UDP, length 120
19:50:51.182536 IP 192.168.43.124.8880 > 192.168.43.146.7771: UDP, length 120
19:50:51.191173 IP 192.168.43.147.8880 > 192.168.43.124.7773: UDP, length 120
19:50:51.232465 IP 192.168.43.124.8880 > 192.168.43.146.7771: UDP, length 120
19:50:51.241588 IP 192.168.43.147.8880 > 192.168.43.124.7773: UDP, length 120
19:50:51.282465 IP 192.168.43.124.8880 > 192.168.43.146.7771: UDP, length 120
19:50:51.300919 IP 192.168.43.147.8880 > 192.168.43.124.7773: UDP, length 120
19:50:51.332484 IP 192.168.43.124.8880 > 192.168.43.146.7771: UDP, length 120
19:50:51.339915 IP 192.168.43.147.8880 > 192.168.43.124.7773: UDP, length 120
19:50:51.382535 IP 192.168.43.124.8880 > 192.168.43.146.7771: UDP, length 120
19:50:51.396683 IP 192.168.43.147.8880 > 192.168.43.124.7773: UDP, length 120
19:50:51.432535 IP 192.168.43.124.8880 > 192.168.43.146.7771: UDP, length 120
19:50:51.444612 IP 192.168.43.147.8880 > 192.168.43.124.7773: UDP, length 120
19:50:51.482538 IP 192.168.43.124.8880 > 192.168.43.146.7771: UDP, length 120
19:50:51.491425 IP 192.168.43.147.8880 > 192.168.43.124.7773: UDP, length 120
19:50:51.532537 IP 192.168.43.124.8880 > 192.168.43.146.7771: UDP, length 120
19:50:51.536979 IP 192.168.43.147.8880 > 192.168.43.124.7773: UDP, length 120
19:50:51.582536 IP 192.168.43.124.8880 > 192.168.43.146.7771: UDP, length 120
19:50:51.591306 IP 192.168.43.147.8880 > 192.168.43.124.7773: UDP, length 120
19:50:51.632535 IP 192.168.43.124.8880 > 192.168.43.146.7771: UDP, length 120
19:50:51.636959 IP 192.168.43.147.8880 > 192.168.43.124.7773: UDP, length 120
19:50:51.682514 IP 192.168.43.124.8880 > 192.168.43.146.7771: UDP, length 120
19:50:51.690474 IP 192.168.43.147.8880 > 192.168.43.124.7773: UDP, length 120
19:50:51.732538 IP 192.168.43.124.8880 > 192.168.43.146.7771: UDP, length 120
19:50:51.743406 IP 192.168.43.147.8880 > 192.168.43.124.7773: UDP, length 120
19:50:51.782537 IP 192.168.43.124.8880 > 192.168.43.146.7771: UDP, length 120
19:50:51.832536 IP 192.168.43.124.8880 > 192.168.43.146.7771: UDP, length 120
19:50:51.836813 IP 192.168.43.147.8880 > 192.168.43.124.7773: UDP, length 120
19:50:51.882537 IP 192.168.43.124.8880 > 192.168.43.146.7771: UDP, length 120
19:50:51.915105 IP 192.168.43.147.8880 > 192.168.43.124.7773: UDP, length 120
19:50:51.932536 IP 192.168.43.124.8880 > 192.168.43.146.7771: UDP, length 120
19:50:51.936832 IP 192.168.43.147.8880 > 192.168.43.124.7773: UDP, length 120
19:50:51.982537 IP 192.168.43.124.8880 > 192.168.43.146.7771: UDP, length 120
19:50:51.989447 IP 192.168.43.147.8880 > 192.168.43.124.7773: UDP, length 120
19:50:52.032483 IP 192.168.43.124.8880 > 192.168.43.146.7771: UDP, length 120
19:50:52.040535 IP 192.168.43.147.8880 > 192.168.43.124.7773: UDP, length 120
19:50:52.082485 IP 192.168.43.124.8880 > 192.168.43.146.7771: UDP, length 120
19:50:52.090551 IP 192.168.43.147.8880 > 192.168.43.124.7773: UDP, length 120
19:50:52.132534 IP 192.168.43.124.8880 > 192.168.43.146.7771: UDP, length 120
19:50:52.139348 IP 192.168.43.147.8880 > 192.168.43.124.7773: UDP, length 120
19:50:52.182474 IP 192.168.43.124.8880 > 192.168.43.146.7771: UDP, length 120
19:50:52.183161 IP 192.168.43.147.8880 > 192.168.43.124.7773: UDP, length 120
19:50:52.232537 IP 192.168.43.124.8880 > 192.168.43.146.7771: UDP, length 120
19:50:52.236324 IP 192.168.43.147.8880 > 192.168.43.124.7773: UDP, length 120
19:50:52.282537 IP 192.168.43.124.8880 > 192.168.43.146.7771: UDP, length 120
19:50:52.295114 IP 192.168.43.147.8880 > 192.168.43.124.7773: UDP, length 120
19:50:52.332549 IP 192.168.43.124.8880 > 192.168.43.146.7771: UDP, length 120
19:50:52.337389 IP 192.168.43.147.8880 > 192.168.43.124.7773: UDP, length 120
19:50:52.382588 IP 192.168.43.124.8880 > 192.168.43.146.7771: UDP, length 120
19:50:52.389826 IP 192.168.43.147.8880 > 192.168.43.124.7773: UDP, length 120
19:50:52.432587 IP 192.168.43.124.8880 > 192.168.43.146.7771: UDP, length 120
19:50:52.446126 IP 192.168.43.147.8880 > 192.168.43.124.7773: UDP, length 120
19:50:52.482591 IP 192.168.43.124.8880 > 192.168.43.146.7771: UDP, length 120
19:50:52.487463 IP 192.168.43.147.8880 > 192.168.43.124.7773: UDP, length 120
19:50:52.532589 IP 192.168.43.124.8880 > 192.168.43.146.7771: UDP, length 120
19:50:52.539010 IP 192.168.43.147.8880 > 192.168.43.124.7773: UDP, length 120
19:50:52.582587 IP 192.168.43.124.8880 > 192.168.43.146.7771: UDP, length 120
19:50:52.590794 IP 192.168.43.147.8880 > 192.168.43.124.7773: UDP, length 120
19:50:52.632585 IP 192.168.43.124.8880 > 192.168.43.146.7771: UDP, length 120
19:50:52.641727 IP 192.168.43.147.8880 > 192.168.43.124.7773: UDP, length 120
19:50:52.682477 IP 192.168.43.124.8880 > 192.168.43.146.7771: UDP, length 120
19:50:52.686790 IP 192.168.43.147.8880 > 192.168.43.124.7773: UDP, length 120
19:50:52.732587 IP 192.168.43.124.8880 > 192.168.43.146.7771: UDP, length 120
19:50:52.741056 IP 192.168.43.147.8880 > 192.168.43.124.7773: UDP, length 120
19:50:52.783183 IP 192.168.43.124.8880 > 192.168.43.146.7771: UDP, length 120
19:50:52.789655 IP 192.168.43.147.8880 > 192.168.43.124.7773: UDP, length 120
19:50:52.832501 IP 192.168.43.124.8880 > 192.168.43.146.7771: UDP, length 120
19:50:52.836840 IP 192.168.43.147.8880 > 192.168.43.124.7773: UDP, length 120
19:50:52.882535 IP 192.168.43.124.8880 > 192.168.43.146.7771: UDP, length 120
19:50:52.887653 IP 192.168.43.147.8880 > 192.168.43.124.7773: UDP, length 120
19:50:52.932536 IP 192.168.43.124.8880 > 192.168.43.146.7771: UDP, length 120
