23:50:39.619374 IP 192.168.43.124.8880 > 192.168.43.146.7771: UDP, length 120
23:50:39.763032 IP 192.168.43.124.8880 > 192.168.43.146.7771: UDP, length 120
23:50:39.763290 IP 192.168.43.124.8880 > 192.168.43.146.7771: UDP, length 120
23:50:39.764709 IP 192.168.43.124.8880 > 192.168.43.146.7771: UDP, length 120
23:50:39.817718 IP 192.168.43.124.8880 > 192.168.43.146.7771: UDP, length 120
23:50:39.867809 IP 192.168.43.124.8880 > 192.168.43.146.7771: UDP, length 120
23:50:39.917844 IP 192.168.43.124.8880 > 192.168.43.146.7771: UDP, length 120
23:50:39.968871 IP 192.168.43.124.8880 > 192.168.43.146.7771: UDP, length 120
23:50:40.016311 IP 192.168.43.124.8880 > 192.168.43.146.7771: UDP, length 120
23:50:40.062318 IP 192.168.43.146.8880 > 192.168.43.147.7772: UDP, length 120
23:50:40.065494 IP 192.168.43.124.8880 > 192.168.43.146.7771: UDP, length 120
23:50:40.112443 IP 192.168.43.146.8880 > 192.168.43.147.7772: UDP, length 120
23:50:40.115850 IP 192.168.43.124.8880 > 192.168.43.146.7771: UDP, length 120
23:50:40.162436 IP 192.168.43.146.8880 > 192.168.43.147.7772: UDP, length 120
23:50:40.165821 IP 192.168.43.124.8880 > 192.168.43.146.7771: UDP, length 120
23:50:40.212452 IP 192.168.43.146.8880 > 192.168.43.147.7772: UDP, length 120
23:50:40.215941 IP 192.168.43.124.8880 > 192.168.43.146.7771: UDP, length 120
23:50:40.262416 IP 192.168.43.146.8880 > 192.168.43.147.7772: UDP, length 120
23:50:40.266010 IP 192.168.43.124.8880 > 192.168.43.146.7771: UDP, length 120
23:50:40.312441 IP 192.168.43.146.8880 > 192.168.43.147.7772: UDP, length 120
23:50:40.315839 IP 192.168.43.124.8880 > 192.168.43.146.7771: UDP, length 120
23:50:40.362398 IP 192.168.43.146.8880 > 192.168.43.147.7772: UDP, length 120
23:50:40.365698 IP 192.168.43.124.8880 > 192.168.43.146.7771: UDP, length 120
23:50:40.412362 IP 192.168.43.146.8880 > 192.168.43.147.7772: UDP, length 120
23:50:40.416324 IP 192.168.43.124.8880 > 192.168.43.146.7771: UDP, length 120
23:50:40.462350 IP 192.168.43.146.8880 > 192.168.43.147.7772: UDP, length 120
23:50:40.465595 IP 192.168.43.124.8880 > 192.168.43.146.7771: UDP, length 120
23:50:40.512414 IP 192.168.43.146.8880 > 192.168.43.147.7772: UDP, length 120
23:50:40.515784 IP 192.168.43.124.8880 > 192.168.43.146.7771: UDP, length 120
23:50:40.562410 IP 192.168.43.146.8880 > 192.168.43.147.7772: UDP, length 120
23:50:40.565775 IP 192.168.43.124.8880 > 192.168.43.146.7771: UDP, length 120
23:50:40.612404 IP 192.168.43.146.8880 > 192.168.43.147.7772: UDP, length 120
23:50:40.615709 IP 192.168.43.124.8880 > 192.168.43.146.7771: UDP, length 120
23:50:40.662359 IP 192.168.43.146.8880 > 192.168.43.147.7772: UDP, length 120
23:50:40.665612 IP 192.168.43.124.8880 > 192.168.43.146.7771: UDP, length 120
23:50:40.712351 IP 192.168.43.146.8880 > 192.168.43.147.7772: UDP, length 120
23:50:40.717023 IP 192.168.43.124.8880 > 192.168.43.146.7771: UDP, length 120
23:50:40.762349 IP 192.168.43.146.8880 > 192.168.43.147.7772: UDP, length 120
23:50:40.768158 IP 192.168.43.124.8880 > 192.168.43.146.7771: UDP, length 120
23:50:40.812346 IP 192.168.43.146.8880 > 192.168.43.147.7772: UDP, length 120
23:50:40.815591 IP 192.168.43.124.8880 > 192.168.43.146.7771: UDP, length 120
23:50:40.862357 IP 192.168.43.146.8880 > 192.168.43.147.7772: UDP, length 120
23:50:40.865616 IP 192.168.43.124.8880 > 192.168.43.146.7771: UDP, length 120
23:50:40.912349 IP 192.168.43.146.8880 > 192.168.43.147.7772: UDP, length 120
23:50:40.920030 IP 192.168.43.124.8880 > 192.168.43.146.7771: UDP, length 120
23:50:40.962345 IP 192.168.43.146.8880 > 192.168.43.147.7772: UDP, length 120
23:50:40.965593 IP 192.168.43.124.8880 > 192.168.43.146.7771: UDP, length 120
23:50:41.012365 IP 192.168.43.146.8880 > 192.168.43.147.7772: UDP, length 120
23:50:41.015632 IP 192.168.43.124.8880 > 192.168.43.146.7771: UDP, length 120
23:50:41.062392 IP 192.168.43.146.8880 > 192.168.43.147.7772: UDP, length 120
23:50:41.065669 IP 192.168.43.124.8880 > 192.168.43.146.7771: UDP, length 120
23:50:41.112360 IP 192.168.43.146.8880 > 192.168.43.147.7772: UDP, length 120
23:50:41.124638 IP 192.168.43.124.8880 > 192.168.43.146.7771: UDP, length 120
23:50:41.162347 IP 192.168.43.146.8880 > 192.168.43.147.7772: UDP, length 120
23:50:41.165586 IP 192.168.43.124.8880 > 192.168.43.146.7771: UDP, length 120
23:50:41.212345 IP 192.168.43.146.8880 > 192.168.43.147.7772: UDP, length 120
23:50:41.215588 IP 192.168.43.124.8880 > 192.168.43.146.7771: UDP, length 120
23:50:41.262345 IP 192.168.43.146.8880 > 192.168.43.147.7772: UDP, length 120
23:50:41.265587 IP 192.168.43.124.8880 > 192.168.43.146.7771: UDP, length 120
23:50:41.312350 IP 192.168.43.146.8880 > 192.168.43.147.7772: UDP, length 120
23:50:41.316696 IP 192.168.43.124.8880 > 192.168.43.146.7771: UDP, length 120
23:50:41.362352 IP 192.168.43.146.8880 > 192.168.43.147.7772: UDP, length 120
23:50:41.365600 IP 192.168.43.124.8880 > 192.168.43.146.7771: UDP, length 120
23:50:41.412346 IP 192.168.43.146.8880 > 192.168.43.147.7772: UDP, length 120
23:50:41.418142 IP 192.168.43.124.8880 > 192.168.43.146.7771: UDP, length 120
23:50:41.462345 IP 192.168.43.146.8880 > 192.168.43.147.7772: UDP, length 120
23:50:41.465582 IP 192.168.43.124.8880 > 192.168.43.146.7771: UDP, length 120
23:50:41.512344 IP 192.168.43.146.8880 > 192.168.43.147.7772: UDP, length 120
23:50:41.515585 IP 192.168.43.124.8880 > 192.168.43.146.7771: UDP, length 120
23:50:41.562345 IP 192.168.43.146.8880 > 192.168.43.147.7772: UDP, length 120
23:50:41.565582 IP 192.168.43.124.8880 > 192.168.43.146.7771: UDP, length 120
23:50:41.612453 IP 192.168.43.146.8880 > 192.168.43.147.7772: UDP, length 120
23:50:41.651465 IP 192.168.43.124.8880 > 192.168.43.146.7771: UDP, length 120
23:50:41.662387 IP 192.168.43.146.8880 > 192.168.43.147.7772: UDP, length 120
23:50:41.665630 IP 192.168.43.124.8880 > 192.168.43.146.7771: UDP, length 120
23:50:41.712350 IP 192.168.43.146.8880 > 192.168.43.147.7772: UDP, length 120
23:50:41.715599 IP 192.168.43.124.8880 > 192.168.43.146.7771: UDP, length 120
23:50:41.762346 IP 192.168.43.146.8880 > 192.168.43.147.7772: UDP, length 120
23:50:41.766358 IP 192.168.43.124.8880 > 192.168.43.146.7771: UDP, length 120
23:50:41.812346 IP 192.168.43.146.8880 > 192.168.43.147.7772: UDP, length 120
23:50:41.815587 IP 192.168.43.124.8880 > 192.168.43.146.7771: UDP, length 120
23:50:41.862347 IP 192.168.43.146.8880 > 192.168.43.147.7772: UDP, length 120
23:50:41.867633 IP 192.168.43.124.8880 > 192.168.43.146.7771: UDP, length 120
23:50:41.912345 IP 192.168.43.146.8880 > 192.168.43.147.7772: UDP, length 120
23:50:41.915590 IP 192.168.43.124.8880 > 192.168.43.146.7771: UDP, length 120
23:50:41.962345 IP 192.168.43.146.8880 > 192.168.43.147.7772: UDP, length 120
23:50:41.965585 IP 192.168.43.124.8880 > 192.168.43.146.7771: UDP, length 120
23:50:42.012362 IP 192.168.43.146.8880 > 192.168.43.147.7772: UDP, length 120
23:50:42.015623 IP 192.168.43.124.8880 > 192.168.43.146.7771: UDP, length 120
23:50:42.062356 IP 192.168.43.146.8880 > 192.168.43.147.7772: UDP, length 120
23:50:42.065600 IP 192.168.43.124.8880 > 192.168.43.146.7771: UDP, length 120
23:50:42.112350 IP 192.168.43.146.8880 > 192.168.43.147.7772: UDP, length 120
23:50:42.115591 IP 192.168.43.124.8880 > 192.168.43.146.7771: UDP, length 120
23:50:42.162360 IP 192.168.43.146.8880 > 192.168.43.147.7772: UDP, length 120
23:50:42.165600 IP 192.168.43.124.8880 > 192.168.43.146.7771: UDP, length 120
23:50:42.212351 IP 192.168.43.146.8880 > 192.168.43.147.7772: UDP, length 120
23:50:42.215592 IP 192.168.43.124.8880 > 192.168.43.146.7771: UDP, length 120
23:50:42.262345 IP 192.168.43.146.8880 > 192.168.43.147.7772: UDP, length 120
23:50:42.265586 IP 192.168.43.124.8880 > 192.168.43.146.7771: UDP, length 120
23:50:42.312345 IP 192.168.43.146.8880 > 192.168.43.147.7772: UDP, length 120
23:50:42.315750 IP 192.168.43.124.8880 > 192.168.43.146.7771: UDP, length 120
23:50:42.362350 IP 192.168.43.146.8880 > 192.168.43.147.7772: UDP, length 120
23:50:42.365602 IP 192.168.43.124.8880 > 192.168.43.146.7771: UDP, length 120
23:50:42.412351 IP 192.168.43.146.8880 > 192.168.43.147.7772: UDP, length 120
23:50:42.419708 IP 192.168.43.124.8880 > 192.168.43.146.7771: UDP, length 120
23:50:42.462346 IP 192.168.43.146.8880 > 192.168.43.147.7772: UDP, length 120
23:50:42.465594 IP 192.168.43.124.8880 > 192.168.43.146.7771: UDP, length 120
23:50:42.512345 IP 192.168.43.146.8880 > 192.168.43.147.7772: UDP, length 120
23:50:42.515592 IP 192.168.43.124.8880 > 192.168.43.146.7771: UDP, length 120
23:50:42.562390 IP 192.168.43.146.8880 > 192.168.43.147.7772: UDP, length 120
23:50:42.565694 IP 192.168.43.124.8880 > 192.168.43.146.7771: UDP, length 120
23:50:42.612384 IP 192.168.43.146.8880 > 192.168.43.147.7772: UDP, length 120
23:50:42.615811 IP 192.168.43.124.8880 > 192.168.43.146.7771: UDP, length 120
23:50:42.662432 IP 192.168.43.146.8880 > 192.168.43.147.7772: UDP, length 120
23:50:42.666779 IP 192.168.43.124.8880 > 192.168.43.146.7771: UDP, length 120
23:50:42.712385 IP 192.168.43.146.8880 > 192.168.43.147.7772: UDP, length 120
23:50:42.715807 IP 192.168.43.124.8880 > 192.168.43.146.7771: UDP, length 120
23:50:42.762371 IP 192.168.43.146.8880 > 192.168.43.147.7772: UDP, length 120
23:50:42.765783 IP 192.168.43.124.8880 > 192.168.43.146.7771: UDP, length 120
23:50:42.812376 IP 192.168.43.146.8880 > 192.168.43.147.7772: UDP, length 120
23:50:42.816622 IP 192.168.43.124.8880 > 192.168.43.146.7771: UDP, length 120
23:50:42.862373 IP 192.168.43.146.8880 > 192.168.43.147.7772: UDP, length 120
23:50:42.865782 IP 192.168.43.124.8880 > 192.168.43.146.7771: UDP, length 120
23:50:42.912371 IP 192.168.43.146.8880 > 192.168.43.147.7772: UDP, length 120
23:50:42.915786 IP 192.168.43.124.8880 > 192.168.43.146.7771: UDP, length 120
23:50:42.962370 IP 192.168.43.146.8880 > 192.168.43.147.7772: UDP, length 120
23:50:42.965780 IP 192.168.43.124.8880 > 192.168.43.146.7771: UDP, length 120
23:50:43.012794 IP 192.168.43.146.8880 > 192.168.43.147.7772: UDP, length 120
23:50:43.015797 IP 192.168.43.124.8880 > 192.168.43.146.7771: UDP, length 120
23:50:43.062383 IP 192.168.43.146.8880 > 192.168.43.147.7772: UDP, length 120
23:50:43.067077 IP 192.168.43.124.8880 > 192.168.43.146.7771: UDP, length 120
23:50:43.112381 IP 192.168.43.146.8880 > 192.168.43.147.7772: UDP, length 120
23:50:43.115811 IP 192.168.43.124.8880 > 192.168.43.146.7771: UDP, length 120
23:50:43.162376 IP 192.168.43.146.8880 > 192.168.43.147.7772: UDP, length 120
23:50:43.166341 IP 192.168.43.124.8880 > 192.168.43.146.7771: UDP, length 120
23:50:43.212375 IP 192.168.43.146.8880 > 192.168.43.147.7772: UDP, length 120
23:50:43.215815 IP 192.168.43.124.8880 > 192.168.43.146.7771: UDP, length 120
23:50:43.262367 IP 192.168.43.146.8880 > 192.168.43.147.7772: UDP, length 120
23:50:43.265795 IP 192.168.43.124.8880 > 192.168.43.146.7771: UDP, length 120
23:50:43.312369 IP 192.168.43.146.8880 > 192.168.43.147.7772: UDP, length 120
23:50:43.315792 IP 192.168.43.124.8880 > 192.168.43.146.7771: UDP, length 120
23:50:43.362370 IP 192.168.43.146.8880 > 192.168.43.147.7772: UDP, length 120
23:50:43.365795 IP 192.168.43.124.8880 > 192.168.43.146.7771: UDP, length 120
23:50:43.412392 IP 192.168.43.146.8880 > 192.168.43.147.7772: UDP, length 120
23:50:43.415824 IP 192.168.43.124.8880 > 192.168.43.146.7771: UDP, length 120
23:50:43.462381 IP 192.168.43.146.8880 > 192.168.43.147.7772: UDP, length 120
23:50:43.466073 IP 192.168.43.124.8880 > 192.168.43.146.7771: UDP, length 120
23:50:43.512375 IP 192.168.43.146.8880 > 192.168.43.147.7772: UDP, length 120
23:50:43.515782 IP 192.168.43.124.8880 > 192.168.43.146.7771: UDP, length 120
23:50:43.562374 IP 192.168.43.146.8880 > 192.168.43.147.7772: UDP, length 120
23:50:43.565639 IP 192.168.43.124.8880 > 192.168.43.146.7771: UDP, length 120
23:50:43.612373 IP 192.168.43.146.8880 > 192.168.43.147.7772: UDP, length 120
23:50:43.615779 IP 192.168.43.124.8880 > 192.168.43.146.7771: UDP, length 120
23:50:43.662439 IP 192.168.43.146.8880 > 192.168.43.147.7772: UDP, length 120
23:50:43.665927 IP 192.168.43.124.8880 > 192.168.43.146.7771: UDP, length 120
23:50:43.712387 IP 192.168.43.146.8880 > 192.168.43.147.7772: UDP, length 120
23:50:43.715792 IP 192.168.43.124.8880 > 192.168.43.146.7771: UDP, length 120
23:50:43.762373 IP 192.168.43.146.8880 > 192.168.43.147.7772: UDP, length 120
23:50:43.765782 IP 192.168.43.124.8880 > 192.168.43.146.7771: UDP, length 120
23:50:43.812371 IP 192.168.43.146.8880 > 192.168.43.147.7772: UDP, length 120
23:50:43.815793 IP 192.168.43.124.8880 > 192.168.43.146.7771: UDP, length 120
23:50:43.862373 IP 192.168.43.146.8880 > 192.168.43.147.7772: UDP, length 120
23:50:43.865779 IP 192.168.43.124.8880 > 192.168.43.146.7771: UDP, length 120
23:50:43.912371 IP 192.168.43.146.8880 > 192.168.43.147.7772: UDP, length 120
23:50:43.917975 IP 192.168.43.124.8880 > 192.168.43.146.7771: UDP, length 120
23:50:43.962370 IP 192.168.43.146.8880 > 192.168.43.147.7772: UDP, length 120
23:50:43.965774 IP 192.168.43.124.8880 > 192.168.43.146.7771: UDP, length 120
23:50:44.012788 IP 192.168.43.146.8880 > 192.168.43.147.7772: UDP, length 120
23:50:44.016277 IP 192.168.43.124.8880 > 192.168.43.146.7771: UDP, length 120
23:50:44.062429 IP 192.168.43.146.8880 > 192.168.43.147.7772: UDP, length 120
23:50:44.064380 IP 192.168.43.124.8880 > 192.168.43.146.7771: UDP, length 120
23:50:44.112391 IP 192.168.43.146.8880 > 192.168.43.147.7772: UDP, length 120
23:50:44.115803 IP 192.168.43.124.8880 > 192.168.43.146.7771: UDP, length 120
23:50:44.162372 IP 192.168.43.146.8880 > 192.168.43.147.7772: UDP, length 120
23:50:44.165777 IP 192.168.43.124.8880 > 192.168.43.146.7771: UDP, length 120
23:50:44.212371 IP 192.168.43.146.8880 > 192.168.43.147.7772: UDP, length 120
23:50:44.216791 IP 192.168.43.124.8880 > 192.168.43.146.7771: UDP, length 120
23:50:44.262370 IP 192.168.43.146.8880 > 192.168.43.147.7772: UDP, length 120
23:50:44.265770 IP 192.168.43.124.8880 > 192.168.43.146.7771: UDP, length 120
23:50:44.312371 IP 192.168.43.146.8880 > 192.168.43.147.7772: UDP, length 120
23:50:44.315782 IP 192.168.43.124.8880 > 192.168.43.146.7771: UDP, length 120
23:50:44.362371 IP 192.168.43.146.8880 > 192.168.43.147.7772: UDP, length 120
23:50:44.367283 IP 192.168.43.124.8880 > 192.168.43.146.7771: UDP, length 120
23:50:44.412372 IP 192.168.43.146.8880 > 192.168.43.147.7772: UDP, length 120
23:50:44.415777 IP 192.168.43.124.8880 > 192.168.43.146.7771: UDP, length 120
23:50:44.462370 IP 192.168.43.146.8880 > 192.168.43.147.7772: UDP, length 120
23:50:44.466170 IP 192.168.43.124.8880 > 192.168.43.146.7771: UDP, length 120
23:50:44.512374 IP 192.168.43.146.8880 > 192.168.43.147.7772: UDP, length 120
23:50:44.515776 IP 192.168.43.124.8880 > 192.168.43.146.7771: UDP, length 120
23:50:44.562378 IP 192.168.43.146.8880 > 192.168.43.147.7772: UDP, length 120
23:50:44.565816 IP 192.168.43.124.8880 > 192.168.43.146.7771: UDP, length 120
23:50:44.612378 IP 192.168.43.146.8880 > 192.168.43.147.7772: UDP, length 120
23:50:44.615793 IP 192.168.43.124.8880 > 192.168.43.146.7771: UDP, length 120
23:50:44.662433 IP 192.168.43.146.8880 > 192.168.43.147.7772: UDP, length 120
23:50:44.664202 IP 192.168.43.124.8880 > 192.168.43.146.7771: UDP, length 120
23:50:44.712387 IP 192.168.43.146.8880 > 192.168.43.147.7772: UDP, length 120
23:50:44.715790 IP 192.168.43.124.8880 > 192.168.43.146.7771: UDP, length 120
23:50:44.762340 IP 192.168.43.146.8880 > 192.168.43.147.7772: UDP, length 120
23:50:44.765755 IP 192.168.43.124.8880 > 192.168.43.146.7771: UDP, length 120
23:50:44.812376 IP 192.168.43.146.8880 > 192.168.43.147.7772: UDP, length 120
23:50:44.815790 IP 192.168.43.124.8880 > 192.168.43.146.7771: UDP, length 120
23:50:44.862375 IP 192.168.43.146.8880 > 192.168.43.147.7772: UDP, length 120
23:50:44.865765 IP 192.168.43.124.8880 > 192.168.43.146.7771: UDP, length 120
23:50:44.912372 IP 192.168.43.146.8880 > 192.168.43.147.7772: UDP, length 120
23:50:44.915780 IP 192.168.43.124.8880 > 192.168.43.146.7771: UDP, length 120
23:50:44.962369 IP 192.168.43.146.8880 > 192.168.43.147.7772: UDP, length 120
23:50:44.966347 IP 192.168.43.124.8880 > 192.168.43.146.7771: UDP, length 120
23:50:45.012796 IP 192.168.43.146.8880 > 192.168.43.147.7772: UDP, length 120
23:50:45.062395 IP 192.168.43.146.8880 > 192.168.43.147.7772: UDP, length 120
23:50:45.112382 IP 192.168.43.146.8880 > 192.168.43.147.7772: UDP, length 120
23:50:45.158339 IP 192.168.43.124.8880 > 192.168.43.146.7771: UDP, length 120
23:50:45.158487 IP 192.168.43.124.8880 > 192.168.43.146.7771: UDP, length 120
23:50:45.158596 IP 192.168.43.124.8880 > 192.168.43.146.7771: UDP, length 120
23:50:45.162377 IP 192.168.43.146.8880 > 192.168.43.147.7772: UDP, length 120
23:50:45.167123 IP 192.168.43.124.8880 > 192.168.43.146.7771: UDP, length 120
23:50:45.212370 IP 192.168.43.146.8880 > 192.168.43.147.7772: UDP, length 120
23:50:45.217374 IP 192.168.43.124.8880 > 192.168.43.146.7771: UDP, length 120
23:50:45.262372 IP 192.168.43.146.8880 > 192.168.43.147.7772: UDP, length 120
23:50:45.265791 IP 192.168.43.124.8880 > 192.168.43.146.7771: UDP, length 120
23:50:45.312370 IP 192.168.43.146.8880 > 192.168.43.147.7772: UDP, length 120
23:50:45.315789 IP 192.168.43.124.8880 > 192.168.43.146.7771: UDP, length 120
23:50:45.362435 IP 192.168.43.146.8880 > 192.168.43.147.7772: UDP, length 120
23:50:45.412455 IP 192.168.43.146.8880 > 192.168.43.147.7772: UDP, length 120
23:50:45.462421 IP 192.168.43.146.8880 > 192.168.43.147.7772: UDP, length 120
23:50:45.487191 IP 192.168.43.124.8880 > 192.168.43.146.7771: UDP, length 120
23:50:45.487441 IP 192.168.43.124.8880 > 192.168.43.146.7771: UDP, length 120
23:50:45.487528 IP 192.168.43.124.8880 > 192.168.43.146.7771: UDP, length 120
23:50:45.512415 IP 192.168.43.146.8880 > 192.168.43.147.7772: UDP, length 120
23:50:45.515911 IP 192.168.43.124.8880 > 192.168.43.146.7771: UDP, length 120
23:50:45.562423 IP 192.168.43.146.8880 > 192.168.43.147.7772: UDP, length 120
23:50:45.565805 IP 192.168.43.124.8880 > 192.168.43.146.7771: UDP, length 120
23:50:45.612405 IP 192.168.43.146.8880 > 192.168.43.147.7772: UDP, length 120
23:50:45.615786 IP 192.168.43.124.8880 > 192.168.43.146.7771: UDP, length 120
23:50:45.663113 IP 192.168.43.146.8880 > 192.168.43.147.7772: UDP, length 120
23:50:45.666707 IP 192.168.43.124.8880 > 192.168.43.146.7771: UDP, length 120
23:50:45.712429 IP 192.168.43.146.8880 > 192.168.43.147.7772: UDP, length 120
23:50:45.762421 IP 192.168.43.146.8880 > 192.168.43.147.7772: UDP, length 120
23:50:45.812396 IP 192.168.43.146.8880 > 192.168.43.147.7772: UDP, length 120
23:50:45.837749 IP 192.168.43.124.8880 > 192.168.43.146.7771: UDP, length 120
23:50:45.837956 IP 192.168.43.124.8880 > 192.168.43.146.7771: UDP, length 120
23:50:45.838063 IP 192.168.43.124.8880 > 192.168.43.146.7771: UDP, length 120
23:50:45.862364 IP 192.168.43.146.8880 > 192.168.43.147.7772: UDP, length 120
23:50:45.865606 IP 192.168.43.124.8880 > 192.168.43.146.7771: UDP, length 120
23:50:45.912357 IP 192.168.43.146.8880 > 192.168.43.147.7772: UDP, length 120
23:50:45.915596 IP 192.168.43.124.8880 > 192.168.43.146.7771: UDP, length 120
23:50:45.962344 IP 192.168.43.146.8880 > 192.168.43.147.7772: UDP, length 120
23:50:45.965582 IP 192.168.43.124.8880 > 192.168.43.146.7771: UDP, length 120
23:50:46.012362 IP 192.168.43.146.8880 > 192.168.43.147.7772: UDP, length 120
23:50:46.015608 IP 192.168.43.124.8880 > 192.168.43.146.7771: UDP, length 120
23:50:46.062355 IP 192.168.43.146.8880 > 192.168.43.147.7772: UDP, length 120
23:50:46.112350 IP 192.168.43.146.8880 > 192.168.43.147.7772: UDP, length 120
23:50:46.162347 IP 192.168.43.146.8880 > 192.168.43.147.7772: UDP, length 120
23:50:46.194968 IP 192.168.43.124.8880 > 192.168.43.146.7771: UDP, length 120
23:50:46.195108 IP 192.168.43.124.8880 > 192.168.43.146.7771: UDP, length 120
23:50:46.195215 IP 192.168.43.124.8880 > 192.168.43.146.7771: UDP, length 120
23:50:46.212347 IP 192.168.43.146.8880 > 192.168.43.147.7772: UDP, length 120
23:50:46.213442 IP 192.168.43.124.8880 > 192.168.43.146.7771: UDP, length 120
23:50:46.262348 IP 192.168.43.146.8880 > 192.168.43.147.7772: UDP, length 120
23:50:46.265605 IP 192.168.43.124.8880 > 192.168.43.146.7771: UDP, length 120
23:50:46.312350 IP 192.168.43.146.8880 > 192.168.43.147.7772: UDP, length 120
23:50:46.315610 IP 192.168.43.124.8880 > 192.168.43.146.7771: UDP, length 120
23:50:46.362346 IP 192.168.43.146.8880 > 192.168.43.147.7772: UDP, length 120
23:50:46.365600 IP 192.168.43.124.8880 > 192.168.43.146.7771: UDP, length 120
23:50:46.412346 IP 192.168.43.146.8880 > 192.168.43.147.7772: UDP, length 120
23:50:46.462348 IP 192.168.43.146.8880 > 192.168.43.147.7772: UDP, length 120
23:50:46.512347 IP 192.168.43.146.8880 > 192.168.43.147.7772: UDP, length 120
23:50:46.528176 IP 192.168.43.124.8880 > 192.168.43.146.7771: UDP, length 120
23:50:46.528371 IP 192.168.43.124.8880 > 192.168.43.146.7771: UDP, length 120
23:50:46.528547 IP 192.168.43.124.8880 > 192.168.43.146.7771: UDP, length 120
23:50:46.562352 IP 192.168.43.146.8880 > 192.168.43.147.7772: UDP, length 120
23:50:46.565608 IP 192.168.43.124.8880 > 192.168.43.146.7771: UDP, length 120
23:50:46.612356 IP 192.168.43.146.8880 > 192.168.43.147.7772: UDP, length 120
23:50:46.615622 IP 192.168.43.124.8880 > 192.168.43.146.7771: UDP, length 120
23:50:46.662351 IP 192.168.43.146.8880 > 192.168.43.147.7772: UDP, length 120
23:50:46.665608 IP 192.168.43.124.8880 > 192.168.43.146.7771: UDP, length 120
23:50:46.712397 IP 192.168.43.146.8880 > 192.168.43.147.7772: UDP, length 120
23:50:46.715698 IP 192.168.43.124.8880 > 192.168.43.146.7771: UDP, length 120
23:50:46.762354 IP 192.168.43.146.8880 > 192.168.43.147.7772: UDP, length 120
23:50:46.812346 IP 192.168.43.146.8880 > 192.168.43.147.7772: UDP, length 120
23:50:46.862348 IP 192.168.43.146.8880 > 192.168.43.147.7772: UDP, length 120
23:50:46.876199 IP 192.168.43.124.8880 > 192.168.43.146.7771: UDP, length 120
23:50:46.879007 IP 192.168.43.124.8880 > 192.168.43.146.7771: UDP, length 120
23:50:46.879147 IP 192.168.43.124.8880 > 192.168.43.146.7771: UDP, length 120
23:50:46.912346 IP 192.168.43.146.8880 > 192.168.43.147.7772: UDP, length 120
23:50:46.915585 IP 192.168.43.124.8880 > 192.168.43.146.7771: UDP, length 120
23:50:46.962343 IP 192.168.43.146.8880 > 192.168.43.147.7772: UDP, length 120
23:50:46.965594 IP 192.168.43.124.8880 > 192.168.43.146.7771: UDP, length 120
23:50:47.012364 IP 192.168.43.146.8880 > 192.168.43.147.7772: UDP, length 120
23:50:47.015600 IP 192.168.43.124.8880 > 192.168.43.146.7771: UDP, length 120
23:50:47.062391 IP 192.168.43.146.8880 > 192.168.43.147.7772: UDP, length 120
23:50:47.065717 IP 192.168.43.124.8880 > 192.168.43.146.7771: UDP, length 120
23:50:47.112360 IP 192.168.43.146.8880 > 192.168.43.147.7772: UDP, length 120
23:50:47.162344 IP 192.168.43.146.8880 > 192.168.43.147.7772: UDP, length 120
23:50:47.212348 IP 192.168.43.146.8880 > 192.168.43.147.7772: UDP, length 120
23:50:47.231252 IP 192.168.43.124.8880 > 192.168.43.146.7771: UDP, length 120
23:50:47.232199 IP 192.168.43.124.8880 > 192.168.43.146.7771: UDP, length 120
23:50:47.232369 IP 192.168.43.124.8880 > 192.168.43.146.7771: UDP, length 120
23:50:47.262358 IP 192.168.43.146.8880 > 192.168.43.147.7772: UDP, length 120
23:50:47.268456 IP 192.168.43.124.8880 > 192.168.43.146.7771: UDP, length 120
23:50:47.312353 IP 192.168.43.146.8880 > 192.168.43.147.7772: UDP, length 120
23:50:47.315597 IP 192.168.43.124.8880 > 192.168.43.146.7771: UDP, length 120
23:50:47.362347 IP 192.168.43.146.8880 > 192.168.43.147.7772: UDP, length 120
23:50:47.367407 IP 192.168.43.124.8880 > 192.168.43.146.7771: UDP, length 120
23:50:47.412347 IP 192.168.43.146.8880 > 192.168.43.147.7772: UDP, length 120
23:50:47.415876 IP 192.168.43.124.8880 > 192.168.43.146.7771: UDP, length 120
23:50:47.462345 IP 192.168.43.146.8880 > 192.168.43.147.7772: UDP, length 120
23:50:47.512346 IP 192.168.43.146.8880 > 192.168.43.147.7772: UDP, length 120
23:50:47.562345 IP 192.168.43.146.8880 > 192.168.43.147.7772: UDP, length 120
23:50:47.573359 IP 192.168.43.124.8880 > 192.168.43.146.7771: UDP, length 120
23:50:47.573498 IP 192.168.43.124.8880 > 192.168.43.146.7771: UDP, length 120
23:50:47.577181 IP 192.168.43.124.8880 > 192.168.43.146.7771: UDP, length 120
23:50:47.612377 IP 192.168.43.146.8880 > 192.168.43.147.7772: UDP, length 120
23:50:47.615788 IP 192.168.43.124.8880 > 192.168.43.146.7771: UDP, length 120
23:50:47.662382 IP 192.168.43.146.8880 > 192.168.43.147.7772: UDP, length 120
23:50:47.665796 IP 192.168.43.124.8880 > 192.168.43.146.7771: UDP, length 120
23:50:47.712386 IP 192.168.43.146.8880 > 192.168.43.147.7772: UDP, length 120
23:50:47.715778 IP 192.168.43.124.8880 > 192.168.43.146.7771: UDP, length 120
23:50:47.762373 IP 192.168.43.146.8880 > 192.168.43.147.7772: UDP, length 120
23:50:47.766267 IP 192.168.43.124.8880 > 192.168.43.146.7771: UDP, length 120
23:50:47.812372 IP 192.168.43.146.8880 > 192.168.43.147.7772: UDP, length 120
23:50:47.862371 IP 192.168.43.146.8880 > 192.168.43.147.7772: UDP, length 120
23:50:47.912370 IP 192.168.43.146.8880 > 192.168.43.147.7772: UDP, length 120
23:50:47.920057 IP 192.168.43.124.8880 > 192.168.43.146.7771: UDP, length 120
23:50:47.920373 IP 192.168.43.124.8880 > 192.168.43.146.7771: UDP, length 120
23:50:47.920593 IP 192.168.43.124.8880 > 192.168.43.146.7771: UDP, length 120
23:50:47.962373 IP 192.168.43.146.8880 > 192.168.43.147.7772: UDP, length 120
23:50:47.965757 IP 192.168.43.124.8880 > 192.168.43.146.7771: UDP, length 120
23:50:48.012787 IP 192.168.43.146.8880 > 192.168.43.147.7772: UDP, length 120
23:50:48.062377 IP 192.168.43.146.8880 > 192.168.43.147.7772: UDP, length 120
23:50:48.112375 IP 192.168.43.146.8880 > 192.168.43.147.7772: UDP, length 120
23:50:48.162369 IP 192.168.43.146.8880 > 192.168.43.147.7772: UDP, length 120
23:50:48.164508 IP 192.168.43.124.8880 > 192.168.43.146.7771: UDP, length 120
23:50:48.165355 IP 192.168.43.124.8880 > 192.168.43.146.7771: UDP, length 120
23:50:48.212375 IP 192.168.43.146.8880 > 192.168.43.147.7772: UDP, length 120
23:50:48.262378 IP 192.168.43.146.8880 > 192.168.43.147.7772: UDP, length 120
23:50:48.312373 IP 192.168.43.146.8880 > 192.168.43.147.7772: UDP, length 120
23:50:48.362370 IP 192.168.43.146.8880 > 192.168.43.147.7772: UDP, length 120
23:50:48.365422 IP 192.168.43.124.8880 > 192.168.43.146.7771: UDP, length 120
23:50:48.365734 IP 192.168.43.124.8880 > 192.168.43.146.7771: UDP, length 120
23:50:48.365940 IP 192.168.43.124.8880 > 192.168.43.146.7771: UDP, length 120
23:50:48.366151 IP 192.168.43.124.8880 > 192.168.43.146.7771: UDP, length 120
23:50:48.412374 IP 192.168.43.146.8880 > 192.168.43.147.7772: UDP, length 120
23:50:48.462367 IP 192.168.43.146.8880 > 192.168.43.147.7772: UDP, length 120
23:50:48.465779 IP 192.168.43.124.8880 > 192.168.43.146.7771: UDP, length 120
23:50:48.465996 IP 192.168.43.124.8880 > 192.168.43.146.7771: UDP, length 120
23:50:48.512380 IP 192.168.43.146.8880 > 192.168.43.147.7772: UDP, length 120
23:50:48.562428 IP 192.168.43.146.8880 > 192.168.43.147.7772: UDP, length 120
23:50:48.565885 IP 192.168.43.124.8880 > 192.168.43.146.7771: UDP, length 120
23:50:48.612390 IP 192.168.43.146.8880 > 192.168.43.147.7772: UDP, length 120
23:50:48.662371 IP 192.168.43.146.8880 > 192.168.43.147.7772: UDP, length 120
23:50:48.712460 IP 192.168.43.146.8880 > 192.168.43.147.7772: UDP, length 120
23:50:48.716446 IP 192.168.43.124.8880 > 192.168.43.146.7771: UDP, length 120
23:50:48.717004 IP 192.168.43.124.8880 > 192.168.43.146.7771: UDP, length 120
23:50:48.717251 IP 192.168.43.124.8880 > 192.168.43.146.7771: UDP, length 120
23:50:48.717480 IP 192.168.43.124.8880 > 192.168.43.146.7771: UDP, length 120
23:50:48.762458 IP 192.168.43.146.8880 > 192.168.43.147.7772: UDP, length 120
23:50:48.812462 IP 192.168.43.146.8880 > 192.168.43.147.7772: UDP, length 120
23:50:48.816106 IP 192.168.43.124.8880 > 192.168.43.146.7771: UDP, length 120
23:50:48.816294 IP 192.168.43.124.8880 > 192.168.43.146.7771: UDP, length 120
23:50:48.862440 IP 192.168.43.146.8880 > 192.168.43.147.7772: UDP, length 120
23:50:48.912387 IP 192.168.43.146.8880 > 192.168.43.147.7772: UDP, length 120
23:50:48.962374 IP 192.168.43.146.8880 > 192.168.43.147.7772: UDP, length 120
23:50:49.012714 IP 192.168.43.146.8880 > 192.168.43.147.7772: UDP, length 120
23:50:49.062373 IP 192.168.43.146.8880 > 192.168.43.147.7772: UDP, length 120
23:50:49.064941 IP 192.168.43.124.8880 > 192.168.43.146.7771: UDP, length 120
23:50:49.065345 IP 192.168.43.124.8880 > 192.168.43.146.7771: UDP, length 120
23:50:49.065570 IP 192.168.43.124.8880 > 192.168.43.146.7771: UDP, length 120
23:50:49.065777 IP 192.168.43.124.8880 > 192.168.43.146.7771: UDP, length 120
23:50:49.065980 IP 192.168.43.124.8880 > 192.168.43.146.7771: UDP, length 120
23:50:49.112381 IP 192.168.43.146.8880 > 192.168.43.147.7772: UDP, length 120
23:50:49.162370 IP 192.168.43.146.8880 > 192.168.43.147.7772: UDP, length 120
23:50:49.165351 IP 192.168.43.124.8880 > 192.168.43.146.7771: UDP, length 120
23:50:49.165900 IP 192.168.43.124.8880 > 192.168.43.146.7771: UDP, length 120
23:50:49.212378 IP 192.168.43.146.8880 > 192.168.43.147.7772: UDP, length 120
23:50:49.262375 IP 192.168.43.146.8880 > 192.168.43.147.7772: UDP, length 120
23:50:49.312378 IP 192.168.43.146.8880 > 192.168.43.147.7772: UDP, length 120
23:50:49.362369 IP 192.168.43.146.8880 > 192.168.43.147.7772: UDP, length 120
23:50:49.412370 IP 192.168.43.146.8880 > 192.168.43.147.7772: UDP, length 120
23:50:49.420589 IP 192.168.43.124.8880 > 192.168.43.146.7771: UDP, length 120
23:50:49.420877 IP 192.168.43.124.8880 > 192.168.43.146.7771: UDP, length 120
23:50:49.421109 IP 192.168.43.124.8880 > 192.168.43.146.7771: UDP, length 120
23:50:49.421313 IP 192.168.43.124.8880 > 192.168.43.146.7771: UDP, length 120
23:50:49.421515 IP 192.168.43.124.8880 > 192.168.43.146.7771: UDP, length 120
23:50:49.462372 IP 192.168.43.146.8880 > 192.168.43.147.7772: UDP, length 120
23:50:49.512376 IP 192.168.43.146.8880 > 192.168.43.147.7772: UDP, length 120
23:50:49.515769 IP 192.168.43.124.8880 > 192.168.43.146.7771: UDP, length 120
23:50:49.516014 IP 192.168.43.124.8880 > 192.168.43.146.7771: UDP, length 120
23:50:49.562376 IP 192.168.43.146.8880 > 192.168.43.147.7772: UDP, length 120
23:50:49.612369 IP 192.168.43.146.8880 > 192.168.43.147.7772: UDP, length 120
23:50:49.615770 IP 192.168.43.124.8880 > 192.168.43.146.7771: UDP, length 120
23:50:49.616012 IP 192.168.43.124.8880 > 192.168.43.146.7771: UDP, length 120
23:50:49.662368 IP 192.168.43.146.8880 > 192.168.43.147.7772: UDP, length 120
23:50:49.712368 IP 192.168.43.146.8880 > 192.168.43.147.7772: UDP, length 120
23:50:49.721270 IP 192.168.43.124.8880 > 192.168.43.146.7771: UDP, length 120
23:50:49.721543 IP 192.168.43.124.8880 > 192.168.43.146.7771: UDP, length 120
23:50:49.762390 IP 192.168.43.146.8880 > 192.168.43.147.7772: UDP, length 120
23:50:49.812383 IP 192.168.43.146.8880 > 192.168.43.147.7772: UDP, length 120
23:50:49.827010 IP 192.168.43.124.8880 > 192.168.43.146.7771: UDP, length 120
23:50:49.827494 IP 192.168.43.124.8880 > 192.168.43.146.7771: UDP, length 120
23:50:49.827721 IP 192.168.43.124.8880 > 192.168.43.146.7771: UDP, length 120
23:50:49.862462 IP 192.168.43.146.8880 > 192.168.43.147.7772: UDP, length 120
23:50:49.866334 IP 192.168.43.124.8880 > 192.168.43.146.7771: UDP, length 120
23:50:49.912442 IP 192.168.43.146.8880 > 192.168.43.147.7772: UDP, length 120
23:50:49.915908 IP 192.168.43.124.8880 > 192.168.43.146.7771: UDP, length 120
23:50:49.962389 IP 192.168.43.146.8880 > 192.168.43.147.7772: UDP, length 120
23:50:49.965811 IP 192.168.43.124.8880 > 192.168.43.146.7771: UDP, length 120
23:50:50.012882 IP 192.168.43.146.8880 > 192.168.43.147.7772: UDP, length 120
23:50:50.017171 IP 192.168.43.124.8880 > 192.168.43.146.7771: UDP, length 120
23:50:50.062433 IP 192.168.43.146.8880 > 192.168.43.147.7772: UDP, length 120
23:50:50.065899 IP 192.168.43.124.8880 > 192.168.43.146.7771: UDP, length 120
23:50:50.112393 IP 192.168.43.146.8880 > 192.168.43.147.7772: UDP, length 120
23:50:50.115807 IP 192.168.43.124.8880 > 192.168.43.146.7771: UDP, length 120
23:50:50.162374 IP 192.168.43.146.8880 > 192.168.43.147.7772: UDP, length 120
23:50:50.165764 IP 192.168.43.124.8880 > 192.168.43.146.7771: UDP, length 120
23:50:50.212370 IP 192.168.43.146.8880 > 192.168.43.147.7772: UDP, length 120
23:50:50.215777 IP 192.168.43.124.8880 > 192.168.43.146.7771: UDP, length 120
23:50:50.262371 IP 192.168.43.146.8880 > 192.168.43.147.7772: UDP, length 120
23:50:50.265788 IP 192.168.43.124.8880 > 192.168.43.146.7771: UDP, length 120
23:50:50.312372 IP 192.168.43.146.8880 > 192.168.43.147.7772: UDP, length 120
23:50:50.315792 IP 192.168.43.124.8880 > 192.168.43.146.7771: UDP, length 120
23:50:50.362373 IP 192.168.43.146.8880 > 192.168.43.147.7772: UDP, length 120
23:50:50.366014 IP 192.168.43.124.8880 > 192.168.43.146.7771: UDP, length 120
23:50:50.412371 IP 192.168.43.146.8880 > 192.168.43.147.7772: UDP, length 120
23:50:50.415773 IP 192.168.43.124.8880 > 192.168.43.146.7771: UDP, length 120
23:50:50.462371 IP 192.168.43.146.8880 > 192.168.43.147.7772: UDP, length 120
23:50:50.465796 IP 192.168.43.124.8880 > 192.168.43.146.7771: UDP, length 120
23:50:50.512371 IP 192.168.43.146.8880 > 192.168.43.147.7772: UDP, length 120
23:50:50.515804 IP 192.168.43.124.8880 > 192.168.43.146.7771: UDP, length 120
23:50:50.562373 IP 192.168.43.146.8880 > 192.168.43.147.7772: UDP, length 120
23:50:50.575338 IP 192.168.43.124.8880 > 192.168.43.146.7771: UDP, length 120
23:50:50.612372 IP 192.168.43.146.8880 > 192.168.43.147.7772: UDP, length 120
23:50:50.615780 IP 192.168.43.124.8880 > 192.168.43.146.7771: UDP, length 120
23:50:50.662382 IP 192.168.43.146.8880 > 192.168.43.147.7772: UDP, length 120
23:50:50.665795 IP 192.168.43.124.8880 > 192.168.43.146.7771: UDP, length 120
23:50:50.712377 IP 192.168.43.146.8880 > 192.168.43.147.7772: UDP, length 120
23:50:50.715801 IP 192.168.43.124.8880 > 192.168.43.146.7771: UDP, length 120
23:50:50.762370 IP 192.168.43.146.8880 > 192.168.43.147.7772: UDP, length 120
23:50:50.765778 IP 192.168.43.124.8880 > 192.168.43.146.7771: UDP, length 120
23:50:50.812482 IP 192.168.43.146.8880 > 192.168.43.147.7772: UDP, length 120
23:50:50.816123 IP 192.168.43.124.8880 > 192.168.43.146.7771: UDP, length 120
23:50:50.862449 IP 192.168.43.146.8880 > 192.168.43.147.7772: UDP, length 120
23:50:50.865950 IP 192.168.43.124.8880 > 192.168.43.146.7771: UDP, length 120
23:50:50.912477 IP 192.168.43.146.8880 > 192.168.43.147.7772: UDP, length 120
23:50:50.917604 IP 192.168.43.124.8880 > 192.168.43.146.7771: UDP, length 120
23:50:50.962412 IP 192.168.43.146.8880 > 192.168.43.147.7772: UDP, length 120
23:50:50.965744 IP 192.168.43.124.8880 > 192.168.43.146.7771: UDP, length 120
23:50:51.012407 IP 192.168.43.146.8880 > 192.168.43.147.7772: UDP, length 120
23:50:51.015490 IP 192.168.43.124.8880 > 192.168.43.146.7771: UDP, length 120
23:50:51.062411 IP 192.168.43.146.8880 > 192.168.43.147.7772: UDP, length 120
23:50:51.065745 IP 192.168.43.124.8880 > 192.168.43.146.7771: UDP, length 120
23:50:51.112504 IP 192.168.43.146.8880 > 192.168.43.147.7772: UDP, length 120
23:50:51.115940 IP 192.168.43.124.8880 > 192.168.43.146.7771: UDP, length 120
23:50:51.162411 IP 192.168.43.146.8880 > 192.168.43.147.7772: UDP, length 120
23:50:51.165797 IP 192.168.43.124.8880 > 192.168.43.146.7771: UDP, length 120
23:50:51.212418 IP 192.168.43.146.8880 > 192.168.43.147.7772: UDP, length 120
23:50:51.215923 IP 192.168.43.124.8880 > 192.168.43.146.7771: UDP, length 120
23:50:51.262404 IP 192.168.43.146.8880 > 192.168.43.147.7772: UDP, length 120
23:50:51.265715 IP 192.168.43.124.8880 > 192.168.43.146.7771: UDP, length 120
23:50:51.312364 IP 192.168.43.146.8880 > 192.168.43.147.7772: UDP, length 120
23:50:51.315610 IP 192.168.43.124.8880 > 192.168.43.146.7771: UDP, length 120
23:50:51.362349 IP 192.168.43.146.8880 > 192.168.43.147.7772: UDP, length 120
23:50:51.365601 IP 192.168.43.124.8880 > 192.168.43.146.7771: UDP, length 120
23:50:51.412347 IP 192.168.43.146.8880 > 192.168.43.147.7772: UDP, length 120
23:50:51.417927 IP 192.168.43.124.8880 > 192.168.43.146.7771: UDP, length 120
23:50:51.462345 IP 192.168.43.146.8880 > 192.168.43.147.7772: UDP, length 120
23:50:51.466953 IP 192.168.43.124.8880 > 192.168.43.146.7771: UDP, length 120
23:50:51.512348 IP 192.168.43.146.8880 > 192.168.43.147.7772: UDP, length 120
23:50:51.515587 IP 192.168.43.124.8880 > 192.168.43.146.7771: UDP, length 120
23:50:51.562390 IP 192.168.43.146.8880 > 192.168.43.147.7772: UDP, length 120
23:50:51.566878 IP 192.168.43.124.8880 > 192.168.43.146.7771: UDP, length 120
23:50:51.612358 IP 192.168.43.146.8880 > 192.168.43.147.7772: UDP, length 120
23:50:51.615601 IP 192.168.43.124.8880 > 192.168.43.146.7771: UDP, length 120
23:50:51.662344 IP 192.168.43.146.8880 > 192.168.43.147.7772: UDP, length 120
23:50:51.672291 IP 192.168.43.124.8880 > 192.168.43.146.7771: UDP, length 120
23:50:51.712346 IP 192.168.43.146.8880 > 192.168.43.147.7772: UDP, length 120
23:50:51.715585 IP 192.168.43.124.8880 > 192.168.43.146.7771: UDP, length 120
23:50:51.762345 IP 192.168.43.146.8880 > 192.168.43.147.7772: UDP, length 120
23:50:51.765585 IP 192.168.43.124.8880 > 192.168.43.146.7771: UDP, length 120
23:50:51.812346 IP 192.168.43.146.8880 > 192.168.43.147.7772: UDP, length 120
23:50:51.815586 IP 192.168.43.124.8880 > 192.168.43.146.7771: UDP, length 120
23:50:51.862347 IP 192.168.43.146.8880 > 192.168.43.147.7772: UDP, length 120
23:50:51.887969 IP 192.168.43.124.8880 > 192.168.43.146.7771: UDP, length 120
23:50:51.912351 IP 192.168.43.146.8880 > 192.168.43.147.7772: UDP, length 120
23:50:51.915027 IP 192.168.43.124.8880 > 192.168.43.146.7771: UDP, length 120
23:50:51.962397 IP 192.168.43.146.8880 > 192.168.43.147.7772: UDP, length 120
23:50:51.967085 IP 192.168.43.124.8880 > 192.168.43.146.7771: UDP, length 120
23:50:52.012372 IP 192.168.43.146.8880 > 192.168.43.147.7772: UDP, length 120
23:50:52.015582 IP 192.168.43.124.8880 > 192.168.43.146.7771: UDP, length 120
23:50:52.062359 IP 192.168.43.146.8880 > 192.168.43.147.7772: UDP, length 120
23:50:52.065596 IP 192.168.43.124.8880 > 192.168.43.146.7771: UDP, length 120
23:50:52.112352 IP 192.168.43.146.8880 > 192.168.43.147.7772: UDP, length 120
23:50:52.115590 IP 192.168.43.124.8880 > 192.168.43.146.7771: UDP, length 120
23:50:52.162344 IP 192.168.43.146.8880 > 192.168.43.147.7772: UDP, length 120
23:50:52.165579 IP 192.168.43.124.8880 > 192.168.43.146.7771: UDP, length 120
23:50:52.212360 IP 192.168.43.146.8880 > 192.168.43.147.7772: UDP, length 120
23:50:52.215629 IP 192.168.43.124.8880 > 192.168.43.146.7771: UDP, length 120
23:50:52.262349 IP 192.168.43.146.8880 > 192.168.43.147.7772: UDP, length 120
23:50:52.265606 IP 192.168.43.124.8880 > 192.168.43.146.7771: UDP, length 120
23:50:52.312345 IP 192.168.43.146.8880 > 192.168.43.147.7772: UDP, length 120
23:50:52.315605 IP 192.168.43.124.8880 > 192.168.43.146.7771: UDP, length 120
23:50:52.362346 IP 192.168.43.146.8880 > 192.168.43.147.7772: UDP, length 120
23:50:52.365600 IP 192.168.43.124.8880 > 192.168.43.146.7771: UDP, length 120
23:50:52.412348 IP 192.168.43.146.8880 > 192.168.43.147.7772: UDP, length 120
23:50:52.416392 IP 192.168.43.124.8880 > 192.168.43.146.7771: UDP, length 120
23:50:52.462345 IP 192.168.43.146.8880 > 192.168.43.147.7772: UDP, length 120
23:50:52.465601 IP 192.168.43.124.8880 > 192.168.43.146.7771: UDP, length 120
23:50:52.512349 IP 192.168.43.146.8880 > 192.168.43.147.7772: UDP, length 120
23:50:52.516043 IP 192.168.43.124.8880 > 192.168.43.146.7771: UDP, length 120
23:50:52.562347 IP 192.168.43.146.8880 > 192.168.43.147.7772: UDP, length 120
23:50:52.565401 IP 192.168.43.124.8880 > 192.168.43.146.7771: UDP, length 120
23:50:52.612373 IP 192.168.43.146.8880 > 192.168.43.147.7772: UDP, length 120
23:50:52.615771 IP 192.168.43.124.8880 > 192.168.43.146.7771: UDP, length 120
