21:59:24.244768 IP 192.168.43.124.8880 > 192.168.43.195.7771: UDP, length 120
21:59:24.294917 IP 192.168.43.124.8880 > 192.168.43.195.7771: UDP, length 120
21:59:24.344915 IP 192.168.43.124.8880 > 192.168.43.195.7771: UDP, length 120
21:59:24.394916 IP 192.168.43.124.8880 > 192.168.43.195.7771: UDP, length 120
21:59:24.444917 IP 192.168.43.124.8880 > 192.168.43.195.7771: UDP, length 120
21:59:24.494919 IP 192.168.43.124.8880 > 192.168.43.195.7771: UDP, length 120
21:59:24.544916 IP 192.168.43.124.8880 > 192.168.43.195.7771: UDP, length 120
21:59:24.594858 IP 192.168.43.124.8880 > 192.168.43.195.7771: UDP, length 120
21:59:24.644942 IP 192.168.43.124.8880 > 192.168.43.195.7771: UDP, length 120
21:59:24.694943 IP 192.168.43.124.8880 > 192.168.43.195.7771: UDP, length 120
21:59:24.744944 IP 192.168.43.124.8880 > 192.168.43.195.7771: UDP, length 120
21:59:24.794850 IP 192.168.43.124.8880 > 192.168.43.195.7771: UDP, length 120
21:59:24.844916 IP 192.168.43.124.8880 > 192.168.43.195.7771: UDP, length 120
21:59:24.894916 IP 192.168.43.124.8880 > 192.168.43.195.7771: UDP, length 120
21:59:24.944917 IP 192.168.43.124.8880 > 192.168.43.195.7771: UDP, length 120
21:59:24.994843 IP 192.168.43.124.8880 > 192.168.43.195.7771: UDP, length 120
21:59:25.044853 IP 192.168.43.124.8880 > 192.168.43.195.7771: UDP, length 120
21:59:25.094839 IP 192.168.43.124.8880 > 192.168.43.195.7771: UDP, length 120
21:59:25.144916 IP 192.168.43.124.8880 > 192.168.43.195.7771: UDP, length 120
21:59:25.194965 IP 192.168.43.124.8880 > 192.168.43.195.7771: UDP, length 120
21:59:25.244841 IP 192.168.43.124.8880 > 192.168.43.195.7771: UDP, length 120
21:59:25.294915 IP 192.168.43.124.8880 > 192.168.43.195.7771: UDP, length 120
21:59:25.344917 IP 192.168.43.124.8880 > 192.168.43.195.7771: UDP, length 120
21:59:25.394880 IP 192.168.43.124.8880 > 192.168.43.195.7771: UDP, length 120
21:59:25.444916 IP 192.168.43.124.8880 > 192.168.43.195.7771: UDP, length 120
21:59:25.494866 IP 192.168.43.124.8880 > 192.168.43.195.7771: UDP, length 120
21:59:25.544915 IP 192.168.43.124.8880 > 192.168.43.195.7771: UDP, length 120
21:59:25.594992 IP 192.168.43.124.8880 > 192.168.43.195.7771: UDP, length 120
21:59:25.644916 IP 192.168.43.124.8880 > 192.168.43.195.7771: UDP, length 120
21:59:25.694913 IP 192.168.43.124.8880 > 192.168.43.195.7771: UDP, length 120
21:59:25.744915 IP 192.168.43.124.8880 > 192.168.43.195.7771: UDP, length 120
21:59:25.794839 IP 192.168.43.124.8880 > 192.168.43.195.7771: UDP, length 120
21:59:25.844916 IP 192.168.43.124.8880 > 192.168.43.195.7771: UDP, length 120
21:59:25.894915 IP 192.168.43.124.8880 > 192.168.43.195.7771: UDP, length 120
21:59:25.944963 IP 192.168.43.124.8880 > 192.168.43.195.7771: UDP, length 120
21:59:25.994965 IP 192.168.43.124.8880 > 192.168.43.195.7771: UDP, length 120
21:59:26.044965 IP 192.168.43.124.8880 > 192.168.43.195.7771: UDP, length 120
21:59:26.094874 IP 192.168.43.124.8880 > 192.168.43.195.7771: UDP, length 120
21:59:26.144920 IP 192.168.43.124.8880 > 192.168.43.195.7771: UDP, length 120
21:59:26.194919 IP 192.168.43.124.8880 > 192.168.43.195.7771: UDP, length 120
21:59:26.244964 IP 192.168.43.124.8880 > 192.168.43.195.7771: UDP, length 120
21:59:26.294921 IP 192.168.43.124.8880 > 192.168.43.195.7771: UDP, length 120
21:59:26.344922 IP 192.168.43.124.8880 > 192.168.43.195.7771: UDP, length 120
21:59:26.394923 IP 192.168.43.124.8880 > 192.168.43.195.7771: UDP, length 120
21:59:26.444919 IP 192.168.43.124.8880 > 192.168.43.195.7771: UDP, length 120
21:59:26.494920 IP 192.168.43.124.8880 > 192.168.43.195.7771: UDP, length 120
21:59:26.544962 IP 192.168.43.124.8880 > 192.168.43.195.7771: UDP, length 120
21:59:26.594920 IP 192.168.43.124.8880 > 192.168.43.195.7771: UDP, length 120
21:59:26.644920 IP 192.168.43.124.8880 > 192.168.43.195.7771: UDP, length 120
21:59:26.694918 IP 192.168.43.124.8880 > 192.168.43.195.7771: UDP, length 120
21:59:26.744920 IP 192.168.43.124.8880 > 192.168.43.195.7771: UDP, length 120
21:59:26.794876 IP 192.168.43.124.8880 > 192.168.43.195.7771: UDP, length 120
21:59:26.844915 IP 192.168.43.124.8880 > 192.168.43.195.7771: UDP, length 120
21:59:26.894915 IP 192.168.43.124.8880 > 192.168.43.195.7771: UDP, length 120
21:59:26.944865 IP 192.168.43.124.8880 > 192.168.43.195.7771: UDP, length 120
21:59:26.994966 IP 192.168.43.124.8880 > 192.168.43.195.7771: UDP, length 120
21:59:27.044966 IP 192.168.43.124.8880 > 192.168.43.195.7771: UDP, length 120
21:59:27.094930 IP 192.168.43.124.8880 > 192.168.43.195.7771: UDP, length 120
21:59:27.144921 IP 192.168.43.124.8880 > 192.168.43.195.7771: UDP, length 120
21:59:27.194916 IP 192.168.43.124.8880 > 192.168.43.195.7771: UDP, length 120
21:59:27.244964 IP 192.168.43.124.8880 > 192.168.43.195.7771: UDP, length 120
21:59:27.294968 IP 192.168.43.124.8880 > 192.168.43.195.7771: UDP, length 120
21:59:27.344891 IP 192.168.43.124.8880 > 192.168.43.195.7771: UDP, length 120
21:59:27.394917 IP 192.168.43.124.8880 > 192.168.43.195.7771: UDP, length 120
21:59:27.444918 IP 192.168.43.124.8880 > 192.168.43.195.7771: UDP, length 120
21:59:27.494919 IP 192.168.43.124.8880 > 192.168.43.195.7771: UDP, length 120
21:59:27.545409 IP 192.168.43.124.8880 > 192.168.43.195.7771: UDP, length 120
21:59:27.594963 IP 192.168.43.124.8880 > 192.168.43.195.7771: UDP, length 120
21:59:27.644963 IP 192.168.43.124.8880 > 192.168.43.195.7771: UDP, length 120
21:59:27.694919 IP 192.168.43.124.8880 > 192.168.43.195.7771: UDP, length 120
21:59:27.744961 IP 192.168.43.124.8880 > 192.168.43.195.7771: UDP, length 120
21:59:27.794863 IP 192.168.43.124.8880 > 192.168.43.195.7771: UDP, length 120
21:59:27.844917 IP 192.168.43.124.8880 > 192.168.43.195.7771: UDP, length 120
21:59:27.894916 IP 192.168.43.124.8880 > 192.168.43.195.7771: UDP, length 120
21:59:27.944879 IP 192.168.43.124.8880 > 192.168.43.195.7771: UDP, length 120
21:59:27.994917 IP 192.168.43.124.8880 > 192.168.43.195.7771: UDP, length 120
21:59:28.044916 IP 192.168.43.124.8880 > 192.168.43.195.7771: UDP, length 120
21:59:28.094916 IP 192.168.43.124.8880 > 192.168.43.195.7771: UDP, length 120
21:59:28.144915 IP 192.168.43.124.8880 > 192.168.43.195.7771: UDP, length 120
21:59:28.194917 IP 192.168.43.124.8880 > 192.168.43.195.7771: UDP, length 120
21:59:28.244880 IP 192.168.43.124.8880 > 192.168.43.195.7771: UDP, length 120
21:59:28.294918 IP 192.168.43.124.8880 > 192.168.43.195.7771: UDP, length 120
21:59:28.344917 IP 192.168.43.124.8880 > 192.168.43.195.7771: UDP, length 120
21:59:28.394919 IP 192.168.43.124.8880 > 192.168.43.195.7771: UDP, length 120
21:59:28.444917 IP 192.168.43.124.8880 > 192.168.43.195.7771: UDP, length 120
21:59:28.494919 IP 192.168.43.124.8880 > 192.168.43.195.7771: UDP, length 120
21:59:28.544917 IP 192.168.43.124.8880 > 192.168.43.195.7771: UDP, length 120
21:59:28.594919 IP 192.168.43.124.8880 > 192.168.43.195.7771: UDP, length 120
21:59:28.644918 IP 192.168.43.124.8880 > 192.168.43.195.7771: UDP, length 120
21:59:28.694919 IP 192.168.43.124.8880 > 192.168.43.195.7771: UDP, length 120
21:59:28.744917 IP 192.168.43.124.8880 > 192.168.43.195.7771: UDP, length 120
21:59:28.794925 IP 192.168.43.124.8880 > 192.168.43.195.7771: UDP, length 120
21:59:28.844880 IP 192.168.43.124.8880 > 192.168.43.195.7771: UDP, length 120
21:59:28.894915 IP 192.168.43.124.8880 > 192.168.43.195.7771: UDP, length 120
21:59:28.944878 IP 192.168.43.124.8880 > 192.168.43.195.7771: UDP, length 120
21:59:28.994917 IP 192.168.43.124.8880 > 192.168.43.195.7771: UDP, length 120
21:59:29.044917 IP 192.168.43.124.8880 > 192.168.43.195.7771: UDP, length 120
21:59:29.094921 IP 192.168.43.124.8880 > 192.168.43.195.7771: UDP, length 120
21:59:29.144962 IP 192.168.43.124.8880 > 192.168.43.195.7771: UDP, length 120
21:59:29.194922 IP 192.168.43.124.8880 > 192.168.43.195.7771: UDP, length 120
21:59:29.244915 IP 192.168.43.124.8880 > 192.168.43.195.7771: UDP, length 120
21:59:29.294916 IP 192.168.43.124.8880 > 192.168.43.195.7771: UDP, length 120
21:59:29.344915 IP 192.168.43.124.8880 > 192.168.43.195.7771: UDP, length 120
21:59:29.394918 IP 192.168.43.124.8880 > 192.168.43.195.7771: UDP, length 120
21:59:29.444918 IP 192.168.43.124.8880 > 192.168.43.195.7771: UDP, length 120
21:59:29.494916 IP 192.168.43.124.8880 > 192.168.43.195.7771: UDP, length 120
21:59:29.544916 IP 192.168.43.124.8880 > 192.168.43.195.7771: UDP, length 120
21:59:29.594916 IP 192.168.43.124.8880 > 192.168.43.195.7771: UDP, length 120
21:59:29.644917 IP 192.168.43.124.8880 > 192.168.43.195.7771: UDP, length 120
21:59:29.694967 IP 192.168.43.124.8880 > 192.168.43.195.7771: UDP, length 120
21:59:29.744963 IP 192.168.43.124.8880 > 192.168.43.195.7771: UDP, length 120
21:59:29.794894 IP 192.168.43.124.8880 > 192.168.43.195.7771: UDP, length 120
21:59:29.844917 IP 192.168.43.124.8880 > 192.168.43.195.7771: UDP, length 120
21:59:29.894916 IP 192.168.43.124.8880 > 192.168.43.195.7771: UDP, length 120
21:59:29.944861 IP 192.168.43.124.8880 > 192.168.43.195.7771: UDP, length 120
21:59:29.994913 IP 192.168.43.124.8880 > 192.168.43.195.7771: UDP, length 120
21:59:30.044913 IP 192.168.43.124.8880 > 192.168.43.195.7771: UDP, length 120
21:59:30.094833 IP 192.168.43.124.8880 > 192.168.43.195.7771: UDP, length 120
21:59:30.144839 IP 192.168.43.124.8880 > 192.168.43.195.7771: UDP, length 120
21:59:30.194838 IP 192.168.43.124.8880 > 192.168.43.195.7771: UDP, length 120
21:59:30.244914 IP 192.168.43.124.8880 > 192.168.43.195.7771: UDP, length 120
21:59:30.294917 IP 192.168.43.124.8880 > 192.168.43.195.7771: UDP, length 120
21:59:30.344917 IP 192.168.43.124.8880 > 192.168.43.195.7771: UDP, length 120
21:59:30.394916 IP 192.168.43.124.8880 > 192.168.43.195.7771: UDP, length 120
21:59:30.444963 IP 192.168.43.124.8880 > 192.168.43.195.7771: UDP, length 120
21:59:30.494965 IP 192.168.43.124.8880 > 192.168.43.195.7771: UDP, length 120
21:59:30.544881 IP 192.168.43.124.8880 > 192.168.43.195.7771: UDP, length 120
21:59:30.594965 IP 192.168.43.124.8880 > 192.168.43.195.7771: UDP, length 120
21:59:30.645008 IP 192.168.43.124.8880 > 192.168.43.195.7771: UDP, length 120
21:59:30.695685 IP 192.168.43.124.8880 > 192.168.43.195.7771: UDP, length 120
21:59:30.745011 IP 192.168.43.124.8880 > 192.168.43.195.7771: UDP, length 120
21:59:30.794922 IP 192.168.43.124.8880 > 192.168.43.195.7771: UDP, length 120
21:59:30.844916 IP 192.168.43.124.8880 > 192.168.43.195.7771: UDP, length 120
21:59:30.894917 IP 192.168.43.124.8880 > 192.168.43.195.7771: UDP, length 120
21:59:30.944916 IP 192.168.43.124.8880 > 192.168.43.195.7771: UDP, length 120
21:59:30.994916 IP 192.168.43.124.8880 > 192.168.43.195.7771: UDP, length 120
21:59:31.044915 IP 192.168.43.124.8880 > 192.168.43.195.7771: UDP, length 120
21:59:31.094916 IP 192.168.43.124.8880 > 192.168.43.195.7771: UDP, length 120
21:59:31.144918 IP 192.168.43.124.8880 > 192.168.43.195.7771: UDP, length 120
21:59:31.194916 IP 192.168.43.124.8880 > 192.168.43.195.7771: UDP, length 120
21:59:31.244916 IP 192.168.43.124.8880 > 192.168.43.195.7771: UDP, length 120
21:59:31.294878 IP 192.168.43.124.8880 > 192.168.43.195.7771: UDP, length 120
21:59:31.344950 IP 192.168.43.124.8880 > 192.168.43.195.7771: UDP, length 120
21:59:31.394917 IP 192.168.43.124.8880 > 192.168.43.195.7771: UDP, length 120
21:59:31.444915 IP 192.168.43.124.8880 > 192.168.43.195.7771: UDP, length 120
21:59:31.494917 IP 192.168.43.124.8880 > 192.168.43.195.7771: UDP, length 120
21:59:31.544917 IP 192.168.43.124.8880 > 192.168.43.195.7771: UDP, length 120
21:59:31.594916 IP 192.168.43.124.8880 > 192.168.43.195.7771: UDP, length 120
21:59:31.644916 IP 192.168.43.124.8880 > 192.168.43.195.7771: UDP, length 120
21:59:31.694852 IP 192.168.43.124.8880 > 192.168.43.195.7771: UDP, length 120
21:59:31.744897 IP 192.168.43.124.8880 > 192.168.43.195.7771: UDP, length 120
21:59:31.794961 IP 192.168.43.124.8880 > 192.168.43.195.7771: UDP, length 120
21:59:31.844920 IP 192.168.43.124.8880 > 192.168.43.195.7771: UDP, length 120
21:59:31.894852 IP 192.168.43.124.8880 > 192.168.43.195.7771: UDP, length 120
21:59:31.944915 IP 192.168.43.124.8880 > 192.168.43.195.7771: UDP, length 120
21:59:31.994840 IP 192.168.43.124.8880 > 192.168.43.195.7771: UDP, length 120
21:59:32.044915 IP 192.168.43.124.8880 > 192.168.43.195.7771: UDP, length 120
21:59:32.094915 IP 192.168.43.124.8880 > 192.168.43.195.7771: UDP, length 120
21:59:32.144916 IP 192.168.43.124.8880 > 192.168.43.195.7771: UDP, length 120
21:59:32.194916 IP 192.168.43.124.8880 > 192.168.43.195.7771: UDP, length 120
21:59:32.244915 IP 192.168.43.124.8880 > 192.168.43.195.7771: UDP, length 120
21:59:32.294914 IP 192.168.43.124.8880 > 192.168.43.195.7771: UDP, length 120
21:59:32.344915 IP 192.168.43.124.8880 > 192.168.43.195.7771: UDP, length 120
21:59:32.394914 IP 192.168.43.124.8880 > 192.168.43.195.7771: UDP, length 120
21:59:32.444914 IP 192.168.43.124.8880 > 192.168.43.195.7771: UDP, length 120
21:59:32.494915 IP 192.168.43.124.8880 > 192.168.43.195.7771: UDP, length 120
21:59:32.544915 IP 192.168.43.124.8880 > 192.168.43.195.7771: UDP, length 120
21:59:32.594916 IP 192.168.43.124.8880 > 192.168.43.195.7771: UDP, length 120
21:59:32.644883 IP 192.168.43.124.8880 > 192.168.43.195.7771: UDP, length 120
21:59:32.694857 IP 192.168.43.124.8880 > 192.168.43.195.7771: UDP, length 120
21:59:32.744920 IP 192.168.43.124.8880 > 192.168.43.195.7771: UDP, length 120
21:59:32.794915 IP 192.168.43.124.8880 > 192.168.43.195.7771: UDP, length 120
21:59:32.844916 IP 192.168.43.124.8880 > 192.168.43.195.7771: UDP, length 120
21:59:32.894916 IP 192.168.43.124.8880 > 192.168.43.195.7771: UDP, length 120
21:59:32.944916 IP 192.168.43.124.8880 > 192.168.43.195.7771: UDP, length 120
21:59:32.994916 IP 192.168.43.124.8880 > 192.168.43.195.7771: UDP, length 120
21:59:33.044915 IP 192.168.43.124.8880 > 192.168.43.195.7771: UDP, length 120
21:59:33.094915 IP 192.168.43.124.8880 > 192.168.43.195.7771: UDP, length 120
21:59:33.144915 IP 192.168.43.124.8880 > 192.168.43.195.7771: UDP, length 120
21:59:33.194916 IP 192.168.43.124.8880 > 192.168.43.195.7771: UDP, length 120
21:59:33.244866 IP 192.168.43.124.8880 > 192.168.43.195.7771: UDP, length 120
21:59:33.294870 IP 192.168.43.124.8880 > 192.168.43.195.7771: UDP, length 120
21:59:33.344914 IP 192.168.43.124.8880 > 192.168.43.195.7771: UDP, length 120
21:59:33.394915 IP 192.168.43.124.8880 > 192.168.43.195.7771: UDP, length 120
21:59:33.444885 IP 192.168.43.124.8880 > 192.168.43.195.7771: UDP, length 120
21:59:33.494913 IP 192.168.43.124.8880 > 192.168.43.195.7771: UDP, length 120
21:59:33.544915 IP 192.168.43.124.8880 > 192.168.43.195.7771: UDP, length 120
21:59:33.594916 IP 192.168.43.124.8880 > 192.168.43.195.7771: UDP, length 120
21:59:33.644915 IP 192.168.43.124.8880 > 192.168.43.195.7771: UDP, length 120
21:59:33.694915 IP 192.168.43.124.8880 > 192.168.43.195.7771: UDP, length 120
21:59:33.744911 IP 192.168.43.124.8880 > 192.168.43.195.7771: UDP, length 120
21:59:33.794916 IP 192.168.43.124.8880 > 192.168.43.195.7771: UDP, length 120
21:59:33.844979 IP 192.168.43.124.8880 > 192.168.43.195.7771: UDP, length 120
21:59:33.894915 IP 192.168.43.124.8880 > 192.168.43.195.7771: UDP, length 120
21:59:33.944917 IP 192.168.43.124.8880 > 192.168.43.195.7771: UDP, length 120
21:59:33.994918 IP 192.168.43.124.8880 > 192.168.43.195.7771: UDP, length 120
21:59:34.044917 IP 192.168.43.124.8880 > 192.168.43.195.7771: UDP, length 120
21:59:34.094917 IP 192.168.43.124.8880 > 192.168.43.195.7771: UDP, length 120
21:59:34.144915 IP 192.168.43.124.8880 > 192.168.43.195.7771: UDP, length 120
21:59:34.194916 IP 192.168.43.124.8880 > 192.168.43.195.7771: UDP, length 120
21:59:34.244961 IP 192.168.43.124.8880 > 192.168.43.195.7771: UDP, length 120
21:59:34.294965 IP 192.168.43.124.8880 > 192.168.43.195.7771: UDP, length 120
21:59:34.344923 IP 192.168.43.124.8880 > 192.168.43.195.7771: UDP, length 120
21:59:34.394921 IP 192.168.43.124.8880 > 192.168.43.195.7771: UDP, length 120
21:59:34.444921 IP 192.168.43.124.8880 > 192.168.43.195.7771: UDP, length 120
21:59:34.494922 IP 192.168.43.124.8880 > 192.168.43.195.7771: UDP, length 120
21:59:34.544918 IP 192.168.43.124.8880 > 192.168.43.195.7771: UDP, length 120
21:59:34.594921 IP 192.168.43.124.8880 > 192.168.43.195.7771: UDP, length 120
21:59:34.644963 IP 192.168.43.124.8880 > 192.168.43.195.7771: UDP, length 120
21:59:34.694964 IP 192.168.43.124.8880 > 192.168.43.195.7771: UDP, length 120
21:59:34.744963 IP 192.168.43.124.8880 > 192.168.43.195.7771: UDP, length 120
21:59:34.794964 IP 192.168.43.124.8880 > 192.168.43.195.7771: UDP, length 120
21:59:34.844916 IP 192.168.43.124.8880 > 192.168.43.195.7771: UDP, length 120
21:59:34.894913 IP 192.168.43.124.8880 > 192.168.43.195.7771: UDP, length 120
21:59:34.944917 IP 192.168.43.124.8880 > 192.168.43.195.7771: UDP, length 120
21:59:34.994914 IP 192.168.43.124.8880 > 192.168.43.195.7771: UDP, length 120
21:59:35.044916 IP 192.168.43.124.8880 > 192.168.43.195.7771: UDP, length 120
21:59:35.094914 IP 192.168.43.124.8880 > 192.168.43.195.7771: UDP, length 120
21:59:35.144914 IP 192.168.43.124.8880 > 192.168.43.195.7771: UDP, length 120
21:59:35.194840 IP 192.168.43.124.8880 > 192.168.43.195.7771: UDP, length 120
21:59:35.244841 IP 192.168.43.124.8880 > 192.168.43.195.7771: UDP, length 120
21:59:35.294837 IP 192.168.43.124.8880 > 192.168.43.195.7771: UDP, length 120
21:59:35.344916 IP 192.168.43.124.8880 > 192.168.43.195.7771: UDP, length 120
21:59:35.394918 IP 192.168.43.124.8880 > 192.168.43.195.7771: UDP, length 120
21:59:35.444916 IP 192.168.43.124.8880 > 192.168.43.195.7771: UDP, length 120
21:59:35.494917 IP 192.168.43.124.8880 > 192.168.43.195.7771: UDP, length 120
21:59:35.544918 IP 192.168.43.124.8880 > 192.168.43.195.7771: UDP, length 120
21:59:35.594915 IP 192.168.43.124.8880 > 192.168.43.195.7771: UDP, length 120
21:59:35.644916 IP 192.168.43.124.8880 > 192.168.43.195.7771: UDP, length 120
21:59:35.694915 IP 192.168.43.124.8880 > 192.168.43.195.7771: UDP, length 120
21:59:35.744914 IP 192.168.43.124.8880 > 192.168.43.195.7771: UDP, length 120
21:59:35.794917 IP 192.168.43.124.8880 > 192.168.43.195.7771: UDP, length 120
21:59:35.844919 IP 192.168.43.124.8880 > 192.168.43.195.7771: UDP, length 120
21:59:35.894872 IP 192.168.43.124.8880 > 192.168.43.195.7771: UDP, length 120
21:59:35.944915 IP 192.168.43.124.8880 > 192.168.43.195.7771: UDP, length 120
21:59:35.994916 IP 192.168.43.124.8880 > 192.168.43.195.7771: UDP, length 120
21:59:36.044874 IP 192.168.43.124.8880 > 192.168.43.195.7771: UDP, length 120
21:59:36.094917 IP 192.168.43.124.8880 > 192.168.43.195.7771: UDP, length 120
21:59:36.144917 IP 192.168.43.124.8880 > 192.168.43.195.7771: UDP, length 120
21:59:36.194917 IP 192.168.43.124.8880 > 192.168.43.195.7771: UDP, length 120
21:59:36.244918 IP 192.168.43.124.8880 > 192.168.43.195.7771: UDP, length 120
21:59:36.294915 IP 192.168.43.124.8880 > 192.168.43.195.7771: UDP, length 120
21:59:36.344917 IP 192.168.43.124.8880 > 192.168.43.195.7771: UDP, length 120
21:59:36.394916 IP 192.168.43.124.8880 > 192.168.43.195.7771: UDP, length 120
21:59:36.444915 IP 192.168.43.124.8880 > 192.168.43.195.7771: UDP, length 120
21:59:36.494917 IP 192.168.43.124.8880 > 192.168.43.195.7771: UDP, length 120
21:59:36.544916 IP 192.168.43.124.8880 > 192.168.43.195.7771: UDP, length 120
21:59:36.594916 IP 192.168.43.124.8880 > 192.168.43.195.7771: UDP, length 120
21:59:36.644881 IP 192.168.43.124.8880 > 192.168.43.195.7771: UDP, length 120
21:59:36.694921 IP 192.168.43.124.8880 > 192.168.43.195.7771: UDP, length 120
21:59:36.744915 IP 192.168.43.124.8880 > 192.168.43.195.7771: UDP, length 120
21:59:36.794915 IP 192.168.43.124.8880 > 192.168.43.195.7771: UDP, length 120
21:59:36.844918 IP 192.168.43.124.8880 > 192.168.43.195.7771: UDP, length 120
21:59:36.894917 IP 192.168.43.124.8880 > 192.168.43.195.7771: UDP, length 120
21:59:36.944917 IP 192.168.43.124.8880 > 192.168.43.195.7771: UDP, length 120
21:59:36.994915 IP 192.168.43.124.8880 > 192.168.43.195.7771: UDP, length 120
21:59:37.044916 IP 192.168.43.124.8880 > 192.168.43.195.7771: UDP, length 120
21:59:37.094917 IP 192.168.43.124.8880 > 192.168.43.195.7771: UDP, length 120
21:59:37.144916 IP 192.168.43.124.8880 > 192.168.43.195.7771: UDP, length 120
21:59:37.194916 IP 192.168.43.124.8880 > 192.168.43.195.7771: UDP, length 120
21:59:37.244850 IP 192.168.43.124.8880 > 192.168.43.195.7771: UDP, length 120
21:59:37.294916 IP 192.168.43.124.8880 > 192.168.43.195.7771: UDP, length 120
21:59:37.344915 IP 192.168.43.124.8880 > 192.168.43.195.7771: UDP, length 120
21:59:37.394882 IP 192.168.43.124.8880 > 192.168.43.195.7771: UDP, length 120
21:59:37.444915 IP 192.168.43.124.8880 > 192.168.43.195.7771: UDP, length 120
21:59:37.494835 IP 192.168.43.124.8880 > 192.168.43.195.7771: UDP, length 120
21:59:37.544831 IP 192.168.43.124.8880 > 192.168.43.195.7771: UDP, length 120
21:59:37.594830 IP 192.168.43.124.8880 > 192.168.43.195.7771: UDP, length 120
21:59:37.644918 IP 192.168.43.124.8880 > 192.168.43.195.7771: UDP, length 120
21:59:37.694916 IP 192.168.43.124.8880 > 192.168.43.195.7771: UDP, length 120
21:59:37.744917 IP 192.168.43.124.8880 > 192.168.43.195.7771: UDP, length 120
21:59:37.794917 IP 192.168.43.124.8880 > 192.168.43.195.7771: UDP, length 120
21:59:37.844919 IP 192.168.43.124.8880 > 192.168.43.195.7771: UDP, length 120
21:59:37.894917 IP 192.168.43.124.8880 > 192.168.43.195.7771: UDP, length 120
21:59:37.944918 IP 192.168.43.124.8880 > 192.168.43.195.7771: UDP, length 120
21:59:37.994917 IP 192.168.43.124.8880 > 192.168.43.195.7771: UDP, length 120
21:59:38.044918 IP 192.168.43.124.8880 > 192.168.43.195.7771: UDP, length 120
21:59:38.094918 IP 192.168.43.124.8880 > 192.168.43.195.7771: UDP, length 120
21:59:38.144916 IP 192.168.43.124.8880 > 192.168.43.195.7771: UDP, length 120
21:59:38.195128 IP 192.168.43.124.8880 > 192.168.43.195.7771: UDP, length 120
21:59:38.244921 IP 192.168.43.124.8880 > 192.168.43.195.7771: UDP, length 120
21:59:38.294920 IP 192.168.43.124.8880 > 192.168.43.195.7771: UDP, length 120
21:59:38.344920 IP 192.168.43.124.8880 > 192.168.43.195.7771: UDP, length 120
21:59:38.394920 IP 192.168.43.124.8880 > 192.168.43.195.7771: UDP, length 120
21:59:38.444963 IP 192.168.43.124.8880 > 192.168.43.195.7771: UDP, length 120
21:59:38.494966 IP 192.168.43.124.8880 > 192.168.43.195.7771: UDP, length 120
21:59:38.544963 IP 192.168.43.124.8880 > 192.168.43.195.7771: UDP, length 120
21:59:38.594965 IP 192.168.43.124.8880 > 192.168.43.195.7771: UDP, length 120
21:59:38.644963 IP 192.168.43.124.8880 > 192.168.43.195.7771: UDP, length 120
21:59:38.694922 IP 192.168.43.124.8880 > 192.168.43.195.7771: UDP, length 120
21:59:38.744846 IP 192.168.43.124.8880 > 192.168.43.195.7771: UDP, length 120
21:59:38.794863 IP 192.168.43.124.8880 > 192.168.43.195.7771: UDP, length 120
21:59:38.844921 IP 192.168.43.124.8880 > 192.168.43.195.7771: UDP, length 120
21:59:38.894833 IP 192.168.43.124.8880 > 192.168.43.195.7771: UDP, length 120
21:59:38.944917 IP 192.168.43.124.8880 > 192.168.43.195.7771: UDP, length 120
21:59:38.994859 IP 192.168.43.124.8880 > 192.168.43.195.7771: UDP, length 120
21:59:39.044838 IP 192.168.43.124.8880 > 192.168.43.195.7771: UDP, length 120
21:59:39.094917 IP 192.168.43.124.8880 > 192.168.43.195.7771: UDP, length 120
21:59:39.144859 IP 192.168.43.124.8880 > 192.168.43.195.7771: UDP, length 120
21:59:39.194879 IP 192.168.43.124.8880 > 192.168.43.195.7771: UDP, length 120
21:59:39.244913 IP 192.168.43.124.8880 > 192.168.43.195.7771: UDP, length 120
21:59:39.294917 IP 192.168.43.124.8880 > 192.168.43.195.7771: UDP, length 120
21:59:39.344965 IP 192.168.43.124.8880 > 192.168.43.195.7771: UDP, length 120
21:59:39.394920 IP 192.168.43.124.8880 > 192.168.43.195.7771: UDP, length 120
21:59:39.444919 IP 192.168.43.124.8880 > 192.168.43.195.7771: UDP, length 120
21:59:39.494920 IP 192.168.43.124.8880 > 192.168.43.195.7771: UDP, length 120
21:59:39.544918 IP 192.168.43.124.8880 > 192.168.43.195.7771: UDP, length 120
21:59:39.594919 IP 192.168.43.124.8880 > 192.168.43.195.7771: UDP, length 120
21:59:39.644921 IP 192.168.43.124.8880 > 192.168.43.195.7771: UDP, length 120
21:59:39.694964 IP 192.168.43.124.8880 > 192.168.43.195.7771: UDP, length 120
21:59:39.744965 IP 192.168.43.124.8880 > 192.168.43.195.7771: UDP, length 120
21:59:39.794967 IP 192.168.43.124.8880 > 192.168.43.195.7771: UDP, length 120
21:59:39.844917 IP 192.168.43.124.8880 > 192.168.43.195.7771: UDP, length 120
21:59:39.895025 IP 192.168.43.124.8880 > 192.168.43.195.7771: UDP, length 120
21:59:39.944913 IP 192.168.43.124.8880 > 192.168.43.195.7771: UDP, length 120
21:59:39.994881 IP 192.168.43.124.8880 > 192.168.43.195.7771: UDP, length 120
21:59:40.044855 IP 192.168.43.124.8880 > 192.168.43.195.7771: UDP, length 120
21:59:40.094930 IP 192.168.43.124.8880 > 192.168.43.195.7771: UDP, length 120
21:59:40.144920 IP 192.168.43.124.8880 > 192.168.43.195.7771: UDP, length 120
21:59:40.194856 IP 192.168.43.124.8880 > 192.168.43.195.7771: UDP, length 120
21:59:40.244862 IP 192.168.43.124.8880 > 192.168.43.195.7771: UDP, length 120
21:59:40.294849 IP 192.168.43.124.8880 > 192.168.43.195.7771: UDP, length 120
21:59:40.345454 IP 192.168.43.124.8880 > 192.168.43.195.7771: UDP, length 120
21:59:40.394836 IP 192.168.43.124.8880 > 192.168.43.195.7771: UDP, length 120
21:59:40.444912 IP 192.168.43.124.8880 > 192.168.43.195.7771: UDP, length 120
21:59:40.494914 IP 192.168.43.124.8880 > 192.168.43.195.7771: UDP, length 120
21:59:40.544928 IP 192.168.43.124.8880 > 192.168.43.195.7771: UDP, length 120
21:59:40.594858 IP 192.168.43.124.8880 > 192.168.43.195.7771: UDP, length 120
21:59:40.644880 IP 192.168.43.124.8880 > 192.168.43.195.7771: UDP, length 120
21:59:40.694956 IP 192.168.43.124.8880 > 192.168.43.195.7771: UDP, length 120
21:59:40.745015 IP 192.168.43.124.8880 > 192.168.43.195.7771: UDP, length 120
21:59:40.794932 IP 192.168.43.124.8880 > 192.168.43.195.7771: UDP, length 120
21:59:40.844942 IP 192.168.43.124.8880 > 192.168.43.195.7771: UDP, length 120
21:59:40.894838 IP 192.168.43.124.8880 > 192.168.43.195.7771: UDP, length 120
21:59:40.944963 IP 192.168.43.124.8880 > 192.168.43.195.7771: UDP, length 120
21:59:40.994870 IP 192.168.43.124.8880 > 192.168.43.195.7771: UDP, length 120
21:59:41.044880 IP 192.168.43.124.8880 > 192.168.43.195.7771: UDP, length 120
21:59:41.094906 IP 192.168.43.124.8880 > 192.168.43.195.7771: UDP, length 120
21:59:41.144916 IP 192.168.43.124.8880 > 192.168.43.195.7771: UDP, length 120
21:59:41.194914 IP 192.168.43.124.8880 > 192.168.43.195.7771: UDP, length 120
21:59:41.244915 IP 192.168.43.124.8880 > 192.168.43.195.7771: UDP, length 120
21:59:41.294882 IP 192.168.43.124.8880 > 192.168.43.195.7771: UDP, length 120
21:59:41.344913 IP 192.168.43.124.8880 > 192.168.43.195.7771: UDP, length 120
21:59:41.394916 IP 192.168.43.124.8880 > 192.168.43.195.7771: UDP, length 120
21:59:41.444892 IP 192.168.43.124.8880 > 192.168.43.195.7771: UDP, length 120
21:59:41.494885 IP 192.168.43.124.8880 > 192.168.43.195.7771: UDP, length 120
21:59:41.544884 IP 192.168.43.124.8880 > 192.168.43.195.7771: UDP, length 120
21:59:41.594847 IP 192.168.43.124.8880 > 192.168.43.195.7771: UDP, length 120
21:59:41.644833 IP 192.168.43.124.8880 > 192.168.43.195.7771: UDP, length 120
21:59:41.694915 IP 192.168.43.124.8880 > 192.168.43.195.7771: UDP, length 120
21:59:41.744915 IP 192.168.43.124.8880 > 192.168.43.195.7771: UDP, length 120
21:59:41.794915 IP 192.168.43.124.8880 > 192.168.43.195.7771: UDP, length 120
21:59:41.844914 IP 192.168.43.124.8880 > 192.168.43.195.7771: UDP, length 120
21:59:41.894916 IP 192.168.43.124.8880 > 192.168.43.195.7771: UDP, length 120
21:59:41.944917 IP 192.168.43.124.8880 > 192.168.43.195.7771: UDP, length 120
21:59:41.994916 IP 192.168.43.124.8880 > 192.168.43.195.7771: UDP, length 120
21:59:42.044963 IP 192.168.43.124.8880 > 192.168.43.195.7771: UDP, length 120
21:59:42.094917 IP 192.168.43.124.8880 > 192.168.43.195.7771: UDP, length 120
21:59:42.144916 IP 192.168.43.124.8880 > 192.168.43.195.7771: UDP, length 120
21:59:42.194915 IP 192.168.43.124.8880 > 192.168.43.195.7771: UDP, length 120
21:59:42.244915 IP 192.168.43.124.8880 > 192.168.43.195.7771: UDP, length 120
21:59:42.294915 IP 192.168.43.124.8880 > 192.168.43.195.7771: UDP, length 120
21:59:42.344915 IP 192.168.43.124.8880 > 192.168.43.195.7771: UDP, length 120
21:59:42.394915 IP 192.168.43.124.8880 > 192.168.43.195.7771: UDP, length 120
21:59:42.444834 IP 192.168.43.124.8880 > 192.168.43.195.7771: UDP, length 120
21:59:42.494865 IP 192.168.43.124.8880 > 192.168.43.195.7771: UDP, length 120
21:59:42.544863 IP 192.168.43.124.8880 > 192.168.43.195.7771: UDP, length 120
21:59:42.594956 IP 192.168.43.124.8880 > 192.168.43.195.7771: UDP, length 120
21:59:42.644881 IP 192.168.43.124.8880 > 192.168.43.195.7771: UDP, length 120
21:59:42.694915 IP 192.168.43.124.8880 > 192.168.43.195.7771: UDP, length 120
21:59:42.744919 IP 192.168.43.124.8880 > 192.168.43.195.7771: UDP, length 120
21:59:42.794914 IP 192.168.43.124.8880 > 192.168.43.195.7771: UDP, length 120
21:59:42.844917 IP 192.168.43.124.8880 > 192.168.43.195.7771: UDP, length 120
21:59:42.894915 IP 192.168.43.124.8880 > 192.168.43.195.7771: UDP, length 120
21:59:42.944917 IP 192.168.43.124.8880 > 192.168.43.195.7771: UDP, length 120
21:59:42.995303 IP 192.168.43.124.8880 > 192.168.43.195.7771: UDP, length 120
21:59:43.044870 IP 192.168.43.124.8880 > 192.168.43.195.7771: UDP, length 120
21:59:43.094922 IP 192.168.43.124.8880 > 192.168.43.195.7771: UDP, length 120
21:59:43.144922 IP 192.168.43.124.8880 > 192.168.43.195.7771: UDP, length 120
21:59:43.196440 IP 192.168.43.124.8880 > 192.168.43.195.7771: UDP, length 120
21:59:43.244915 IP 192.168.43.124.8880 > 192.168.43.195.7771: UDP, length 120
21:59:43.294916 IP 192.168.43.124.8880 > 192.168.43.195.7771: UDP, length 120
21:59:43.344913 IP 192.168.43.124.8880 > 192.168.43.195.7771: UDP, length 120
21:59:43.394914 IP 192.168.43.124.8880 > 192.168.43.195.7771: UDP, length 120
21:59:43.444916 IP 192.168.43.124.8880 > 192.168.43.195.7771: UDP, length 120
21:59:43.494841 IP 192.168.43.124.8880 > 192.168.43.195.7771: UDP, length 120
21:59:43.544964 IP 192.168.43.124.8880 > 192.168.43.195.7771: UDP, length 120
21:59:43.594933 IP 192.168.43.124.8880 > 192.168.43.195.7771: UDP, length 120
21:59:43.644918 IP 192.168.43.124.8880 > 192.168.43.195.7771: UDP, length 120
21:59:43.694916 IP 192.168.43.124.8880 > 192.168.43.195.7771: UDP, length 120
21:59:43.744916 IP 192.168.43.124.8880 > 192.168.43.195.7771: UDP, length 120
21:59:43.794917 IP 192.168.43.124.8880 > 192.168.43.195.7771: UDP, length 120
21:59:43.844929 IP 192.168.43.124.8880 > 192.168.43.195.7771: UDP, length 120
21:59:43.894915 IP 192.168.43.124.8880 > 192.168.43.195.7771: UDP, length 120
21:59:43.944916 IP 192.168.43.124.8880 > 192.168.43.195.7771: UDP, length 120
21:59:43.994916 IP 192.168.43.124.8880 > 192.168.43.195.7771: UDP, length 120
21:59:44.044846 IP 192.168.43.124.8880 > 192.168.43.195.7771: UDP, length 120
21:59:44.094908 IP 192.168.43.124.8880 > 192.168.43.195.7771: UDP, length 120
21:59:44.144914 IP 192.168.43.124.8880 > 192.168.43.195.7771: UDP, length 120
21:59:44.194914 IP 192.168.43.124.8880 > 192.168.43.195.7771: UDP, length 120
21:59:44.244914 IP 192.168.43.124.8880 > 192.168.43.195.7771: UDP, length 120
21:59:44.294916 IP 192.168.43.124.8880 > 192.168.43.195.7771: UDP, length 120
21:59:44.344915 IP 192.168.43.124.8880 > 192.168.43.195.7771: UDP, length 120
21:59:44.394962 IP 192.168.43.124.8880 > 192.168.43.195.7771: UDP, length 120
21:59:44.444918 IP 192.168.43.124.8880 > 192.168.43.195.7771: UDP, length 120
21:59:44.494918 IP 192.168.43.124.8880 > 192.168.43.195.7771: UDP, length 120
21:59:44.544916 IP 192.168.43.124.8880 > 192.168.43.195.7771: UDP, length 120
21:59:44.594857 IP 192.168.43.124.8880 > 192.168.43.195.7771: UDP, length 120
21:59:44.644984 IP 192.168.43.124.8880 > 192.168.43.195.7771: UDP, length 120
21:59:44.694920 IP 192.168.43.124.8880 > 192.168.43.195.7771: UDP, length 120
21:59:44.744942 IP 192.168.43.124.8880 > 192.168.43.195.7771: UDP, length 120
21:59:44.794920 IP 192.168.43.124.8880 > 192.168.43.195.7771: UDP, length 120
21:59:44.844913 IP 192.168.43.124.8880 > 192.168.43.195.7771: UDP, length 120
21:59:44.894864 IP 192.168.43.124.8880 > 192.168.43.195.7771: UDP, length 120
21:59:44.944915 IP 192.168.43.124.8880 > 192.168.43.195.7771: UDP, length 120
21:59:44.995008 IP 192.168.43.124.8880 > 192.168.43.195.7771: UDP, length 120
21:59:45.044876 IP 192.168.43.124.8880 > 192.168.43.195.7771: UDP, length 120
21:59:45.094869 IP 192.168.43.124.8880 > 192.168.43.195.7771: UDP, length 120
21:59:45.145353 IP 192.168.43.124.8880 > 192.168.43.195.7771: UDP, length 120
21:59:45.195385 IP 192.168.43.124.8880 > 192.168.43.195.7771: UDP, length 120
21:59:45.244870 IP 192.168.43.124.8880 > 192.168.43.195.7771: UDP, length 120
21:59:45.294869 IP 192.168.43.124.8880 > 192.168.43.195.7771: UDP, length 120
21:59:45.344862 IP 192.168.43.124.8880 > 192.168.43.195.7771: UDP, length 120
21:59:45.394841 IP 192.168.43.124.8880 > 192.168.43.195.7771: UDP, length 120
21:59:45.444840 IP 192.168.43.124.8880 > 192.168.43.195.7771: UDP, length 120
21:59:45.494835 IP 192.168.43.124.8880 > 192.168.43.195.7771: UDP, length 120
21:59:45.544915 IP 192.168.43.124.8880 > 192.168.43.195.7771: UDP, length 120
21:59:45.594915 IP 192.168.43.124.8880 > 192.168.43.195.7771: UDP, length 120
21:59:45.644915 IP 192.168.43.124.8880 > 192.168.43.195.7771: UDP, length 120
21:59:45.694859 IP 192.168.43.124.8880 > 192.168.43.195.7771: UDP, length 120
21:59:45.744916 IP 192.168.43.124.8880 > 192.168.43.195.7771: UDP, length 120
21:59:45.794916 IP 192.168.43.124.8880 > 192.168.43.195.7771: UDP, length 120
21:59:45.844914 IP 192.168.43.124.8880 > 192.168.43.195.7771: UDP, length 120
21:59:45.894918 IP 192.168.43.124.8880 > 192.168.43.195.7771: UDP, length 120
21:59:45.944866 IP 192.168.43.124.8880 > 192.168.43.195.7771: UDP, length 120
21:59:45.994915 IP 192.168.43.124.8880 > 192.168.43.195.7771: UDP, length 120
21:59:46.044917 IP 192.168.43.124.8880 > 192.168.43.195.7771: UDP, length 120
21:59:46.094915 IP 192.168.43.124.8880 > 192.168.43.195.7771: UDP, length 120
21:59:46.144913 IP 192.168.43.124.8880 > 192.168.43.195.7771: UDP, length 120
21:59:46.194917 IP 192.168.43.124.8880 > 192.168.43.195.7771: UDP, length 120
21:59:46.244964 IP 192.168.43.124.8880 > 192.168.43.195.7771: UDP, length 120
21:59:46.294920 IP 192.168.43.124.8880 > 192.168.43.195.7771: UDP, length 120
21:59:46.344919 IP 192.168.43.124.8880 > 192.168.43.195.7771: UDP, length 120
21:59:46.394921 IP 192.168.43.124.8880 > 192.168.43.195.7771: UDP, length 120
21:59:46.444963 IP 192.168.43.124.8880 > 192.168.43.195.7771: UDP, length 120
21:59:46.495163 IP 192.168.43.124.8880 > 192.168.43.195.7771: UDP, length 120
21:59:46.545119 IP 192.168.43.124.8880 > 192.168.43.195.7771: UDP, length 120
21:59:46.594920 IP 192.168.43.124.8880 > 192.168.43.195.7771: UDP, length 120
21:59:46.644921 IP 192.168.43.124.8880 > 192.168.43.195.7771: UDP, length 120
21:59:46.694865 IP 192.168.43.124.8880 > 192.168.43.195.7771: UDP, length 120
21:59:46.744921 IP 192.168.43.124.8880 > 192.168.43.195.7771: UDP, length 120
21:59:46.794920 IP 192.168.43.124.8880 > 192.168.43.195.7771: UDP, length 120
21:59:46.844912 IP 192.168.43.124.8880 > 192.168.43.195.7771: UDP, length 120
21:59:46.894917 IP 192.168.43.124.8880 > 192.168.43.195.7771: UDP, length 120
21:59:46.944918 IP 192.168.43.124.8880 > 192.168.43.195.7771: UDP, length 120
21:59:46.994898 IP 192.168.43.124.8880 > 192.168.43.195.7771: UDP, length 120
21:59:47.044925 IP 192.168.43.124.8880 > 192.168.43.195.7771: UDP, length 120
21:59:47.094916 IP 192.168.43.124.8880 > 192.168.43.195.7771: UDP, length 120
21:59:47.144966 IP 192.168.43.124.8880 > 192.168.43.195.7771: UDP, length 120
21:59:47.195163 IP 192.168.43.124.8880 > 192.168.43.195.7771: UDP, length 120
21:59:47.245119 IP 192.168.43.124.8880 > 192.168.43.195.7771: UDP, length 120
21:59:47.294920 IP 192.168.43.124.8880 > 192.168.43.195.7771: UDP, length 120
21:59:47.344922 IP 192.168.43.124.8880 > 192.168.43.195.7771: UDP, length 120
21:59:47.394922 IP 192.168.43.124.8880 > 192.168.43.195.7771: UDP, length 120
21:59:47.444917 IP 192.168.43.124.8880 > 192.168.43.195.7771: UDP, length 120
21:59:47.494916 IP 192.168.43.124.8880 > 192.168.43.195.7771: UDP, length 120
21:59:47.544916 IP 192.168.43.124.8880 > 192.168.43.195.7771: UDP, length 120
21:59:47.594917 IP 192.168.43.124.8880 > 192.168.43.195.7771: UDP, length 120
21:59:47.644918 IP 192.168.43.124.8880 > 192.168.43.195.7771: UDP, length 120
21:59:47.694964 IP 192.168.43.124.8880 > 192.168.43.195.7771: UDP, length 120
21:59:47.745687 IP 192.168.43.124.8880 > 192.168.43.195.7771: UDP, length 120
21:59:47.795010 IP 192.168.43.124.8880 > 192.168.43.195.7771: UDP, length 120
21:59:47.845639 IP 192.168.43.124.8880 > 192.168.43.195.7771: UDP, length 120
21:59:47.894920 IP 192.168.43.124.8880 > 192.168.43.195.7771: UDP, length 120
21:59:47.944920 IP 192.168.43.124.8880 > 192.168.43.195.7771: UDP, length 120
21:59:47.994856 IP 192.168.43.124.8880 > 192.168.43.195.7771: UDP, length 120
21:59:48.044869 IP 192.168.43.124.8880 > 192.168.43.195.7771: UDP, length 120
21:59:48.094897 IP 192.168.43.124.8880 > 192.168.43.195.7771: UDP, length 120
21:59:48.144920 IP 192.168.43.124.8880 > 192.168.43.195.7771: UDP, length 120
21:59:48.194916 IP 192.168.43.124.8880 > 192.168.43.195.7771: UDP, length 120
21:59:48.244960 IP 192.168.43.124.8880 > 192.168.43.195.7771: UDP, length 120
21:59:48.295643 IP 192.168.43.124.8880 > 192.168.43.195.7771: UDP, length 120
21:59:48.344966 IP 192.168.43.124.8880 > 192.168.43.195.7771: UDP, length 120
21:59:48.395162 IP 192.168.43.124.8880 > 192.168.43.195.7771: UDP, length 120
21:59:48.444967 IP 192.168.43.124.8880 > 192.168.43.195.7771: UDP, length 120
21:59:48.495487 IP 192.168.43.124.8880 > 192.168.43.195.7771: UDP, length 120
21:59:48.546015 IP 192.168.43.124.8880 > 192.168.43.195.7771: UDP, length 120
21:59:48.594968 IP 192.168.43.124.8880 > 192.168.43.195.7771: UDP, length 120
21:59:48.644968 IP 192.168.43.124.8880 > 192.168.43.195.7771: UDP, length 120
21:59:48.695688 IP 192.168.43.124.8880 > 192.168.43.195.7771: UDP, length 120
21:59:48.745491 IP 192.168.43.124.8880 > 192.168.43.195.7771: UDP, length 120
21:59:48.795704 IP 192.168.43.124.8880 > 192.168.43.195.7771: UDP, length 120
21:59:48.845931 IP 192.168.43.124.8880 > 192.168.43.195.7771: UDP, length 120
21:59:48.894916 IP 192.168.43.124.8880 > 192.168.43.195.7771: UDP, length 120
21:59:48.944916 IP 192.168.43.124.8880 > 192.168.43.195.7771: UDP, length 120
21:59:48.994917 IP 192.168.43.124.8880 > 192.168.43.195.7771: UDP, length 120
21:59:49.044915 IP 192.168.43.124.8880 > 192.168.43.195.7771: UDP, length 120
21:59:49.094917 IP 192.168.43.124.8880 > 192.168.43.195.7771: UDP, length 120
21:59:49.144916 IP 192.168.43.124.8880 > 192.168.43.195.7771: UDP, length 120
21:59:49.194918 IP 192.168.43.124.8880 > 192.168.43.195.7771: UDP, length 120
