01:11:51.479933 IP 192.168.43.124.8880 > 192.168.43.146.7771: UDP, length 120
01:11:51.524966 IP 192.168.43.124.8880 > 192.168.43.146.7771: UDP, length 120
01:11:51.583916 IP 192.168.43.124.8880 > 192.168.43.146.7771: UDP, length 120
01:11:51.623779 IP 192.168.43.124.8880 > 192.168.43.146.7771: UDP, length 120
01:11:51.683976 IP 192.168.43.124.8880 > 192.168.43.146.7771: UDP, length 120
01:11:51.725675 IP 192.168.43.124.8880 > 192.168.43.146.7771: UDP, length 120
01:11:51.775517 IP 192.168.43.124.8880 > 192.168.43.146.7771: UDP, length 120
01:11:51.825572 IP 192.168.43.124.8880 > 192.168.43.146.7771: UDP, length 120
01:11:51.874275 IP 192.168.43.124.8880 > 192.168.43.146.7771: UDP, length 120
01:11:51.925507 IP 192.168.43.124.8880 > 192.168.43.146.7771: UDP, length 120
01:11:51.975665 IP 192.168.43.124.8880 > 192.168.43.146.7771: UDP, length 120
01:11:51.986950 IP 192.168.43.146.8880 > 192.168.43.147.7772: UDP, length 120
01:11:52.027984 IP 192.168.43.124.8880 > 192.168.43.146.7771: UDP, length 120
01:11:52.036989 IP 192.168.43.146.8880 > 192.168.43.147.7772: UDP, length 120
01:11:52.077938 IP 192.168.43.124.8880 > 192.168.43.146.7771: UDP, length 120
01:11:52.086999 IP 192.168.43.146.8880 > 192.168.43.147.7772: UDP, length 120
01:11:52.125646 IP 192.168.43.124.8880 > 192.168.43.146.7771: UDP, length 120
01:11:52.136967 IP 192.168.43.146.8880 > 192.168.43.147.7772: UDP, length 120
01:11:52.178188 IP 192.168.43.124.8880 > 192.168.43.146.7771: UDP, length 120
01:11:52.186974 IP 192.168.43.146.8880 > 192.168.43.147.7772: UDP, length 120
01:11:52.226084 IP 192.168.43.124.8880 > 192.168.43.146.7771: UDP, length 120
01:11:52.236969 IP 192.168.43.146.8880 > 192.168.43.147.7772: UDP, length 120
01:11:52.277077 IP 192.168.43.124.8880 > 192.168.43.146.7771: UDP, length 120
01:11:52.286974 IP 192.168.43.146.8880 > 192.168.43.147.7772: UDP, length 120
01:11:52.325501 IP 192.168.43.124.8880 > 192.168.43.146.7771: UDP, length 120
01:11:52.336966 IP 192.168.43.146.8880 > 192.168.43.147.7772: UDP, length 120
01:11:52.377954 IP 192.168.43.124.8880 > 192.168.43.146.7771: UDP, length 120
01:11:52.387029 IP 192.168.43.146.8880 > 192.168.43.147.7772: UDP, length 120
01:11:52.425501 IP 192.168.43.124.8880 > 192.168.43.146.7771: UDP, length 120
01:11:52.436981 IP 192.168.43.146.8880 > 192.168.43.147.7772: UDP, length 120
01:11:52.475792 IP 192.168.43.124.8880 > 192.168.43.146.7771: UDP, length 120
01:11:52.486971 IP 192.168.43.146.8880 > 192.168.43.147.7772: UDP, length 120
01:11:52.525488 IP 192.168.43.124.8880 > 192.168.43.146.7771: UDP, length 120
01:11:52.536974 IP 192.168.43.146.8880 > 192.168.43.147.7772: UDP, length 120
01:11:52.575808 IP 192.168.43.124.8880 > 192.168.43.146.7771: UDP, length 120
01:11:52.586973 IP 192.168.43.146.8880 > 192.168.43.147.7772: UDP, length 120
01:11:52.627858 IP 192.168.43.124.8880 > 192.168.43.146.7771: UDP, length 120
01:11:52.637002 IP 192.168.43.146.8880 > 192.168.43.147.7772: UDP, length 120
01:11:52.676554 IP 192.168.43.124.8880 > 192.168.43.146.7771: UDP, length 120
01:11:52.687019 IP 192.168.43.146.8880 > 192.168.43.147.7772: UDP, length 120
01:11:52.728332 IP 192.168.43.124.8880 > 192.168.43.146.7771: UDP, length 120
01:11:52.736991 IP 192.168.43.146.8880 > 192.168.43.147.7772: UDP, length 120
01:11:52.775650 IP 192.168.43.124.8880 > 192.168.43.146.7771: UDP, length 120
01:11:52.786993 IP 192.168.43.146.8880 > 192.168.43.147.7772: UDP, length 120
01:11:52.825780 IP 192.168.43.124.8880 > 192.168.43.146.7771: UDP, length 120
01:11:52.836988 IP 192.168.43.146.8880 > 192.168.43.147.7772: UDP, length 120
01:11:52.876547 IP 192.168.43.124.8880 > 192.168.43.146.7771: UDP, length 120
01:11:52.887001 IP 192.168.43.146.8880 > 192.168.43.147.7772: UDP, length 120
01:11:52.925600 IP 192.168.43.124.8880 > 192.168.43.146.7771: UDP, length 120
01:11:52.936988 IP 192.168.43.146.8880 > 192.168.43.147.7772: UDP, length 120
01:11:52.975675 IP 192.168.43.124.8880 > 192.168.43.146.7771: UDP, length 120
01:11:52.986988 IP 192.168.43.146.8880 > 192.168.43.147.7772: UDP, length 120
01:11:53.027084 IP 192.168.43.124.8880 > 192.168.43.146.7771: UDP, length 120
01:11:53.036990 IP 192.168.43.146.8880 > 192.168.43.147.7772: UDP, length 120
01:11:53.077649 IP 192.168.43.124.8880 > 192.168.43.146.7771: UDP, length 120
01:11:53.087002 IP 192.168.43.146.8880 > 192.168.43.147.7772: UDP, length 120
01:11:53.127268 IP 192.168.43.124.8880 > 192.168.43.146.7771: UDP, length 120
01:11:53.137004 IP 192.168.43.146.8880 > 192.168.43.147.7772: UDP, length 120
01:11:53.176899 IP 192.168.43.124.8880 > 192.168.43.146.7771: UDP, length 120
01:11:53.186990 IP 192.168.43.146.8880 > 192.168.43.147.7772: UDP, length 120
01:11:53.227517 IP 192.168.43.124.8880 > 192.168.43.146.7771: UDP, length 120
01:11:53.236989 IP 192.168.43.146.8880 > 192.168.43.147.7772: UDP, length 120
01:11:53.276067 IP 192.168.43.124.8880 > 192.168.43.146.7771: UDP, length 120
01:11:53.286991 IP 192.168.43.146.8880 > 192.168.43.147.7772: UDP, length 120
01:11:53.325691 IP 192.168.43.124.8880 > 192.168.43.146.7771: UDP, length 120
01:11:53.337050 IP 192.168.43.146.8880 > 192.168.43.147.7772: UDP, length 120
01:11:53.376102 IP 192.168.43.124.8880 > 192.168.43.146.7771: UDP, length 120
01:11:53.389277 IP 192.168.43.146.8880 > 192.168.43.147.7772: UDP, length 120
01:11:53.425674 IP 192.168.43.124.8880 > 192.168.43.146.7771: UDP, length 120
01:11:53.437038 IP 192.168.43.146.8880 > 192.168.43.147.7772: UDP, length 120
01:11:53.476582 IP 192.168.43.124.8880 > 192.168.43.146.7771: UDP, length 120
01:11:53.487005 IP 192.168.43.146.8880 > 192.168.43.147.7772: UDP, length 120
01:11:53.526483 IP 192.168.43.124.8880 > 192.168.43.146.7771: UDP, length 120
01:11:53.536994 IP 192.168.43.146.8880 > 192.168.43.147.7772: UDP, length 120
01:11:53.576747 IP 192.168.43.124.8880 > 192.168.43.146.7771: UDP, length 120
01:11:53.586990 IP 192.168.43.146.8880 > 192.168.43.147.7772: UDP, length 120
01:11:53.625681 IP 192.168.43.124.8880 > 192.168.43.146.7771: UDP, length 120
01:11:53.636992 IP 192.168.43.146.8880 > 192.168.43.147.7772: UDP, length 120
01:11:53.677091 IP 192.168.43.124.8880 > 192.168.43.146.7771: UDP, length 120
01:11:53.687000 IP 192.168.43.146.8880 > 192.168.43.147.7772: UDP, length 120
01:11:53.725678 IP 192.168.43.124.8880 > 192.168.43.146.7771: UDP, length 120
01:11:53.736997 IP 192.168.43.146.8880 > 192.168.43.147.7772: UDP, length 120
01:11:53.773719 IP 192.168.43.124.8880 > 192.168.43.146.7771: UDP, length 120
01:11:53.786993 IP 192.168.43.146.8880 > 192.168.43.147.7772: UDP, length 120
01:11:53.825562 IP 192.168.43.124.8880 > 192.168.43.146.7771: UDP, length 120
01:11:53.836989 IP 192.168.43.146.8880 > 192.168.43.147.7772: UDP, length 120
01:11:53.875507 IP 192.168.43.124.8880 > 192.168.43.146.7771: UDP, length 120
01:11:53.886989 IP 192.168.43.146.8880 > 192.168.43.147.7772: UDP, length 120
01:11:53.923911 IP 192.168.43.124.8880 > 192.168.43.146.7771: UDP, length 120
01:11:53.936989 IP 192.168.43.146.8880 > 192.168.43.147.7772: UDP, length 120
01:11:53.973916 IP 192.168.43.124.8880 > 192.168.43.146.7771: UDP, length 120
01:11:53.986989 IP 192.168.43.146.8880 > 192.168.43.147.7772: UDP, length 120
01:11:54.023692 IP 192.168.43.124.8880 > 192.168.43.146.7771: UDP, length 120
01:11:54.036988 IP 192.168.43.146.8880 > 192.168.43.147.7772: UDP, length 120
01:11:54.076390 IP 192.168.43.124.8880 > 192.168.43.146.7771: UDP, length 120
01:11:54.087001 IP 192.168.43.146.8880 > 192.168.43.147.7772: UDP, length 120
01:11:54.124161 IP 192.168.43.124.8880 > 192.168.43.146.7771: UDP, length 120
01:11:54.136989 IP 192.168.43.146.8880 > 192.168.43.147.7772: UDP, length 120
01:11:54.173781 IP 192.168.43.124.8880 > 192.168.43.146.7771: UDP, length 120
01:11:54.186988 IP 192.168.43.146.8880 > 192.168.43.147.7772: UDP, length 120
01:11:54.226571 IP 192.168.43.124.8880 > 192.168.43.146.7771: UDP, length 120
01:11:54.236989 IP 192.168.43.146.8880 > 192.168.43.147.7772: UDP, length 120
01:11:54.276744 IP 192.168.43.124.8880 > 192.168.43.146.7771: UDP, length 120
01:11:54.286987 IP 192.168.43.146.8880 > 192.168.43.147.7772: UDP, length 120
01:11:54.332417 IP 192.168.43.124.8880 > 192.168.43.146.7771: UDP, length 120
01:11:54.336989 IP 192.168.43.146.8880 > 192.168.43.147.7772: UDP, length 120
01:11:54.386995 IP 192.168.43.146.8880 > 192.168.43.147.7772: UDP, length 120
01:11:54.387180 IP 192.168.43.124.8880 > 192.168.43.146.7771: UDP, length 120
01:11:54.437070 IP 192.168.43.146.8880 > 192.168.43.147.7772: UDP, length 120
01:11:54.440569 IP 192.168.43.124.8880 > 192.168.43.146.7771: UDP, length 120
01:11:54.474098 IP 192.168.43.124.8880 > 192.168.43.146.7771: UDP, length 120
01:11:54.487014 IP 192.168.43.146.8880 > 192.168.43.147.7772: UDP, length 120
01:11:54.530173 IP 192.168.43.124.8880 > 192.168.43.146.7771: UDP, length 120
01:11:54.536998 IP 192.168.43.146.8880 > 192.168.43.147.7772: UDP, length 120
01:11:54.574555 IP 192.168.43.124.8880 > 192.168.43.146.7771: UDP, length 120
01:11:54.586996 IP 192.168.43.146.8880 > 192.168.43.147.7772: UDP, length 120
01:11:54.624789 IP 192.168.43.124.8880 > 192.168.43.146.7771: UDP, length 120
01:11:54.636996 IP 192.168.43.146.8880 > 192.168.43.147.7772: UDP, length 120
01:11:54.686992 IP 192.168.43.146.8880 > 192.168.43.147.7772: UDP, length 120
01:11:54.690413 IP 192.168.43.124.8880 > 192.168.43.146.7771: UDP, length 120
01:11:54.726585 IP 192.168.43.124.8880 > 192.168.43.146.7771: UDP, length 120
01:11:54.737006 IP 192.168.43.146.8880 > 192.168.43.147.7772: UDP, length 120
01:11:54.776193 IP 192.168.43.124.8880 > 192.168.43.146.7771: UDP, length 120
01:11:54.786996 IP 192.168.43.146.8880 > 192.168.43.147.7772: UDP, length 120
01:11:54.825513 IP 192.168.43.124.8880 > 192.168.43.146.7771: UDP, length 120
01:11:54.837029 IP 192.168.43.146.8880 > 192.168.43.147.7772: UDP, length 120
01:11:54.878479 IP 192.168.43.124.8880 > 192.168.43.146.7771: UDP, length 120
01:11:54.887040 IP 192.168.43.146.8880 > 192.168.43.147.7772: UDP, length 120
01:11:54.925478 IP 192.168.43.124.8880 > 192.168.43.146.7771: UDP, length 120
01:11:54.936995 IP 192.168.43.146.8880 > 192.168.43.147.7772: UDP, length 120
01:11:54.977307 IP 192.168.43.124.8880 > 192.168.43.146.7771: UDP, length 120
01:11:54.986993 IP 192.168.43.146.8880 > 192.168.43.147.7772: UDP, length 120
01:11:55.024882 IP 192.168.43.124.8880 > 192.168.43.146.7771: UDP, length 120
01:11:55.037005 IP 192.168.43.146.8880 > 192.168.43.147.7772: UDP, length 120
01:11:55.075623 IP 192.168.43.124.8880 > 192.168.43.146.7771: UDP, length 120
01:11:55.087017 IP 192.168.43.146.8880 > 192.168.43.147.7772: UDP, length 120
01:11:55.125896 IP 192.168.43.124.8880 > 192.168.43.146.7771: UDP, length 120
01:11:55.136999 IP 192.168.43.146.8880 > 192.168.43.147.7772: UDP, length 120
01:11:55.177118 IP 192.168.43.124.8880 > 192.168.43.146.7771: UDP, length 120
01:11:55.186994 IP 192.168.43.146.8880 > 192.168.43.147.7772: UDP, length 120
01:11:55.227983 IP 192.168.43.124.8880 > 192.168.43.146.7771: UDP, length 120
01:11:55.236992 IP 192.168.43.146.8880 > 192.168.43.147.7772: UDP, length 120
01:11:55.279537 IP 192.168.43.124.8880 > 192.168.43.146.7771: UDP, length 120
01:11:55.287002 IP 192.168.43.146.8880 > 192.168.43.147.7772: UDP, length 120
01:11:55.327227 IP 192.168.43.124.8880 > 192.168.43.146.7771: UDP, length 120
01:11:55.337005 IP 192.168.43.146.8880 > 192.168.43.147.7772: UDP, length 120
01:11:55.376561 IP 192.168.43.124.8880 > 192.168.43.146.7771: UDP, length 120
01:11:55.386995 IP 192.168.43.146.8880 > 192.168.43.147.7772: UDP, length 120
01:11:55.425464 IP 192.168.43.124.8880 > 192.168.43.146.7771: UDP, length 120
01:11:55.436994 IP 192.168.43.146.8880 > 192.168.43.147.7772: UDP, length 120
01:11:55.475481 IP 192.168.43.124.8880 > 192.168.43.146.7771: UDP, length 120
01:11:55.486998 IP 192.168.43.146.8880 > 192.168.43.147.7772: UDP, length 120
01:11:55.525368 IP 192.168.43.124.8880 > 192.168.43.146.7771: UDP, length 120
01:11:55.537005 IP 192.168.43.146.8880 > 192.168.43.147.7772: UDP, length 120
01:11:55.579314 IP 192.168.43.124.8880 > 192.168.43.146.7771: UDP, length 120
01:11:55.587003 IP 192.168.43.146.8880 > 192.168.43.147.7772: UDP, length 120
01:11:55.626775 IP 192.168.43.124.8880 > 192.168.43.146.7771: UDP, length 120
01:11:55.636995 IP 192.168.43.146.8880 > 192.168.43.147.7772: UDP, length 120
01:11:55.675562 IP 192.168.43.124.8880 > 192.168.43.146.7771: UDP, length 120
01:11:55.686994 IP 192.168.43.146.8880 > 192.168.43.147.7772: UDP, length 120
01:11:55.727088 IP 192.168.43.124.8880 > 192.168.43.146.7771: UDP, length 120
01:11:55.736992 IP 192.168.43.146.8880 > 192.168.43.147.7772: UDP, length 120
01:11:55.775443 IP 192.168.43.124.8880 > 192.168.43.146.7771: UDP, length 120
01:11:55.787003 IP 192.168.43.146.8880 > 192.168.43.147.7772: UDP, length 120
01:11:55.827090 IP 192.168.43.124.8880 > 192.168.43.146.7771: UDP, length 120
01:11:55.837016 IP 192.168.43.146.8880 > 192.168.43.147.7772: UDP, length 120
01:11:55.875665 IP 192.168.43.124.8880 > 192.168.43.146.7771: UDP, length 120
01:11:55.887010 IP 192.168.43.146.8880 > 192.168.43.147.7772: UDP, length 120
01:11:55.927701 IP 192.168.43.124.8880 > 192.168.43.146.7771: UDP, length 120
01:11:55.936996 IP 192.168.43.146.8880 > 192.168.43.147.7772: UDP, length 120
01:11:55.973684 IP 192.168.43.124.8880 > 192.168.43.146.7771: UDP, length 120
01:11:55.986994 IP 192.168.43.146.8880 > 192.168.43.147.7772: UDP, length 120
01:11:56.025431 IP 192.168.43.124.8880 > 192.168.43.146.7771: UDP, length 120
01:11:56.036992 IP 192.168.43.146.8880 > 192.168.43.147.7772: UDP, length 120
01:11:56.075430 IP 192.168.43.124.8880 > 192.168.43.146.7771: UDP, length 120
01:11:56.087007 IP 192.168.43.146.8880 > 192.168.43.147.7772: UDP, length 120
01:11:56.125429 IP 192.168.43.124.8880 > 192.168.43.146.7771: UDP, length 120
01:11:56.137003 IP 192.168.43.146.8880 > 192.168.43.147.7772: UDP, length 120
01:11:56.175512 IP 192.168.43.124.8880 > 192.168.43.146.7771: UDP, length 120
01:11:56.187072 IP 192.168.43.146.8880 > 192.168.43.147.7772: UDP, length 120
01:11:56.226610 IP 192.168.43.124.8880 > 192.168.43.146.7771: UDP, length 120
01:11:56.237078 IP 192.168.43.146.8880 > 192.168.43.147.7772: UDP, length 120
01:11:56.276642 IP 192.168.43.124.8880 > 192.168.43.146.7771: UDP, length 120
01:11:56.287130 IP 192.168.43.146.8880 > 192.168.43.147.7772: UDP, length 120
01:11:56.325189 IP 192.168.43.124.8880 > 192.168.43.146.7771: UDP, length 120
01:11:56.337051 IP 192.168.43.146.8880 > 192.168.43.147.7772: UDP, length 120
01:11:56.375696 IP 192.168.43.124.8880 > 192.168.43.146.7771: UDP, length 120
01:11:56.387028 IP 192.168.43.146.8880 > 192.168.43.147.7772: UDP, length 120
01:11:56.425453 IP 192.168.43.124.8880 > 192.168.43.146.7771: UDP, length 120
01:11:56.437060 IP 192.168.43.146.8880 > 192.168.43.147.7772: UDP, length 120
01:11:56.476733 IP 192.168.43.124.8880 > 192.168.43.146.7771: UDP, length 120
01:11:56.487031 IP 192.168.43.146.8880 > 192.168.43.147.7772: UDP, length 120
01:11:56.525463 IP 192.168.43.124.8880 > 192.168.43.146.7771: UDP, length 120
01:11:56.537059 IP 192.168.43.146.8880 > 192.168.43.147.7772: UDP, length 120
01:11:56.576664 IP 192.168.43.124.8880 > 192.168.43.146.7771: UDP, length 120
01:11:56.587072 IP 192.168.43.146.8880 > 192.168.43.147.7772: UDP, length 120
01:11:56.620043 IP 192.168.43.124.8880 > 192.168.43.146.7771: UDP, length 120
01:11:56.637073 IP 192.168.43.146.8880 > 192.168.43.147.7772: UDP, length 120
01:11:56.671900 IP 192.168.43.124.8880 > 192.168.43.146.7771: UDP, length 120
01:11:56.687016 IP 192.168.43.146.8880 > 192.168.43.147.7772: UDP, length 120
01:11:56.730849 IP 192.168.43.124.8880 > 192.168.43.146.7771: UDP, length 120
01:11:56.736972 IP 192.168.43.146.8880 > 192.168.43.147.7772: UDP, length 120
01:11:56.786044 IP 192.168.43.124.8880 > 192.168.43.146.7771: UDP, length 120
01:11:56.786969 IP 192.168.43.146.8880 > 192.168.43.147.7772: UDP, length 120
01:11:56.836963 IP 192.168.43.146.8880 > 192.168.43.147.7772: UDP, length 120
01:11:56.839670 IP 192.168.43.124.8880 > 192.168.43.146.7771: UDP, length 120
01:11:56.874714 IP 192.168.43.124.8880 > 192.168.43.146.7771: UDP, length 120
01:11:56.886986 IP 192.168.43.146.8880 > 192.168.43.147.7772: UDP, length 120
01:11:56.927825 IP 192.168.43.124.8880 > 192.168.43.146.7771: UDP, length 120
01:11:56.936972 IP 192.168.43.146.8880 > 192.168.43.147.7772: UDP, length 120
01:11:56.973487 IP 192.168.43.124.8880 > 192.168.43.146.7771: UDP, length 120
01:11:56.986969 IP 192.168.43.146.8880 > 192.168.43.147.7772: UDP, length 120
01:11:57.020533 IP 192.168.43.124.8880 > 192.168.43.146.7771: UDP, length 120
01:11:57.036971 IP 192.168.43.146.8880 > 192.168.43.147.7772: UDP, length 120
01:11:57.073677 IP 192.168.43.124.8880 > 192.168.43.146.7771: UDP, length 120
01:11:57.086978 IP 192.168.43.146.8880 > 192.168.43.147.7772: UDP, length 120
01:11:57.131409 IP 192.168.43.124.8880 > 192.168.43.146.7771: UDP, length 120
01:11:57.136973 IP 192.168.43.146.8880 > 192.168.43.147.7772: UDP, length 120
01:11:57.186915 IP 192.168.43.124.8880 > 192.168.43.146.7771: UDP, length 120
01:11:57.186986 IP 192.168.43.146.8880 > 192.168.43.147.7772: UDP, length 120
01:11:57.236978 IP 192.168.43.146.8880 > 192.168.43.147.7772: UDP, length 120
01:11:57.249491 IP 192.168.43.124.8880 > 192.168.43.146.7771: UDP, length 120
01:11:57.273411 IP 192.168.43.124.8880 > 192.168.43.146.7771: UDP, length 120
01:11:57.286977 IP 192.168.43.146.8880 > 192.168.43.147.7772: UDP, length 120
01:11:57.323477 IP 192.168.43.124.8880 > 192.168.43.146.7771: UDP, length 120
01:11:57.336970 IP 192.168.43.146.8880 > 192.168.43.147.7772: UDP, length 120
01:11:57.375284 IP 192.168.43.124.8880 > 192.168.43.146.7771: UDP, length 120
01:11:57.386970 IP 192.168.43.146.8880 > 192.168.43.147.7772: UDP, length 120
01:11:57.425953 IP 192.168.43.124.8880 > 192.168.43.146.7771: UDP, length 120
01:11:57.436967 IP 192.168.43.146.8880 > 192.168.43.147.7772: UDP, length 120
01:11:57.477352 IP 192.168.43.124.8880 > 192.168.43.146.7771: UDP, length 120
01:11:57.486969 IP 192.168.43.146.8880 > 192.168.43.147.7772: UDP, length 120
01:11:57.532198 IP 192.168.43.124.8880 > 192.168.43.146.7771: UDP, length 120
01:11:57.537044 IP 192.168.43.146.8880 > 192.168.43.147.7772: UDP, length 120
01:11:57.586864 IP 192.168.43.124.8880 > 192.168.43.146.7771: UDP, length 120
01:11:57.587021 IP 192.168.43.146.8880 > 192.168.43.147.7772: UDP, length 120
01:11:57.623570 IP 192.168.43.124.8880 > 192.168.43.146.7771: UDP, length 120
01:11:57.637004 IP 192.168.43.146.8880 > 192.168.43.147.7772: UDP, length 120
01:11:57.673603 IP 192.168.43.124.8880 > 192.168.43.146.7771: UDP, length 120
01:11:57.686996 IP 192.168.43.146.8880 > 192.168.43.147.7772: UDP, length 120
01:11:57.723968 IP 192.168.43.124.8880 > 192.168.43.146.7771: UDP, length 120
01:11:57.736992 IP 192.168.43.146.8880 > 192.168.43.147.7772: UDP, length 120
01:11:57.775343 IP 192.168.43.124.8880 > 192.168.43.146.7771: UDP, length 120
01:11:57.786990 IP 192.168.43.146.8880 > 192.168.43.147.7772: UDP, length 120
01:11:57.823535 IP 192.168.43.124.8880 > 192.168.43.146.7771: UDP, length 120
01:11:57.836991 IP 192.168.43.146.8880 > 192.168.43.147.7772: UDP, length 120
01:11:57.881542 IP 192.168.43.124.8880 > 192.168.43.146.7771: UDP, length 120
01:11:57.887029 IP 192.168.43.146.8880 > 192.168.43.147.7772: UDP, length 120
01:11:57.937000 IP 192.168.43.146.8880 > 192.168.43.147.7772: UDP, length 120
01:11:57.937824 IP 192.168.43.124.8880 > 192.168.43.146.7771: UDP, length 120
01:11:57.973550 IP 192.168.43.124.8880 > 192.168.43.146.7771: UDP, length 120
01:11:57.987003 IP 192.168.43.146.8880 > 192.168.43.147.7772: UDP, length 120
01:11:58.023533 IP 192.168.43.124.8880 > 192.168.43.146.7771: UDP, length 120
01:11:58.036999 IP 192.168.43.146.8880 > 192.168.43.147.7772: UDP, length 120
01:11:58.073581 IP 192.168.43.124.8880 > 192.168.43.146.7771: UDP, length 120
01:11:58.087014 IP 192.168.43.146.8880 > 192.168.43.147.7772: UDP, length 120
01:11:58.123533 IP 192.168.43.124.8880 > 192.168.43.146.7771: UDP, length 120
01:11:58.137005 IP 192.168.43.146.8880 > 192.168.43.147.7772: UDP, length 120
01:11:58.173504 IP 192.168.43.124.8880 > 192.168.43.146.7771: UDP, length 120
01:11:58.187003 IP 192.168.43.146.8880 > 192.168.43.147.7772: UDP, length 120
01:11:58.231501 IP 192.168.43.124.8880 > 192.168.43.146.7771: UDP, length 120
01:11:58.236990 IP 192.168.43.146.8880 > 192.168.43.147.7772: UDP, length 120
01:11:58.274601 IP 192.168.43.124.8880 > 192.168.43.146.7771: UDP, length 120
01:11:58.286999 IP 192.168.43.146.8880 > 192.168.43.147.7772: UDP, length 120
01:11:58.323517 IP 192.168.43.124.8880 > 192.168.43.146.7771: UDP, length 120
01:11:58.337010 IP 192.168.43.146.8880 > 192.168.43.147.7772: UDP, length 120
01:11:58.373485 IP 192.168.43.124.8880 > 192.168.43.146.7771: UDP, length 120
01:11:58.387009 IP 192.168.43.146.8880 > 192.168.43.147.7772: UDP, length 120
01:11:58.424877 IP 192.168.43.124.8880 > 192.168.43.146.7771: UDP, length 120
01:11:58.437005 IP 192.168.43.146.8880 > 192.168.43.147.7772: UDP, length 120
01:11:58.481588 IP 192.168.43.124.8880 > 192.168.43.146.7771: UDP, length 120
01:11:58.486994 IP 192.168.43.146.8880 > 192.168.43.147.7772: UDP, length 120
01:11:58.537007 IP 192.168.43.146.8880 > 192.168.43.147.7772: UDP, length 120
01:11:58.537104 IP 192.168.43.124.8880 > 192.168.43.146.7771: UDP, length 120
01:11:58.572984 IP 192.168.43.124.8880 > 192.168.43.146.7771: UDP, length 120
01:11:58.587072 IP 192.168.43.146.8880 > 192.168.43.147.7772: UDP, length 120
01:11:58.623372 IP 192.168.43.124.8880 > 192.168.43.146.7771: UDP, length 120
01:11:58.637037 IP 192.168.43.146.8880 > 192.168.43.147.7772: UDP, length 120
01:11:58.673560 IP 192.168.43.124.8880 > 192.168.43.146.7771: UDP, length 120
01:11:58.687008 IP 192.168.43.146.8880 > 192.168.43.147.7772: UDP, length 120
01:11:58.731759 IP 192.168.43.124.8880 > 192.168.43.146.7771: UDP, length 120
01:11:58.736996 IP 192.168.43.146.8880 > 192.168.43.147.7772: UDP, length 120
01:11:58.786430 IP 192.168.43.124.8880 > 192.168.43.146.7771: UDP, length 120
01:11:58.786995 IP 192.168.43.146.8880 > 192.168.43.147.7772: UDP, length 120
01:11:58.837001 IP 192.168.43.146.8880 > 192.168.43.147.7772: UDP, length 120
01:11:58.839771 IP 192.168.43.124.8880 > 192.168.43.146.7771: UDP, length 120
01:11:58.874409 IP 192.168.43.124.8880 > 192.168.43.146.7771: UDP, length 120
01:11:58.887001 IP 192.168.43.146.8880 > 192.168.43.147.7772: UDP, length 120
01:11:58.923381 IP 192.168.43.124.8880 > 192.168.43.146.7771: UDP, length 120
01:11:58.936995 IP 192.168.43.146.8880 > 192.168.43.147.7772: UDP, length 120
01:11:58.976344 IP 192.168.43.124.8880 > 192.168.43.146.7771: UDP, length 120
01:11:58.987000 IP 192.168.43.146.8880 > 192.168.43.147.7772: UDP, length 120
01:11:59.026770 IP 192.168.43.124.8880 > 192.168.43.146.7771: UDP, length 120
01:11:59.037007 IP 192.168.43.146.8880 > 192.168.43.147.7772: UDP, length 120
01:11:59.081863 IP 192.168.43.124.8880 > 192.168.43.146.7771: UDP, length 120
01:11:59.087014 IP 192.168.43.146.8880 > 192.168.43.147.7772: UDP, length 120
01:11:59.136738 IP 192.168.43.124.8880 > 192.168.43.146.7771: UDP, length 120
01:11:59.137004 IP 192.168.43.146.8880 > 192.168.43.147.7772: UDP, length 120
01:11:59.173574 IP 192.168.43.124.8880 > 192.168.43.146.7771: UDP, length 120
01:11:59.186994 IP 192.168.43.146.8880 > 192.168.43.147.7772: UDP, length 120
01:11:59.229658 IP 192.168.43.124.8880 > 192.168.43.146.7771: UDP, length 120
01:11:59.236991 IP 192.168.43.146.8880 > 192.168.43.147.7772: UDP, length 120
01:11:59.281566 IP 192.168.43.124.8880 > 192.168.43.146.7771: UDP, length 120
01:11:59.286992 IP 192.168.43.146.8880 > 192.168.43.147.7772: UDP, length 120
01:11:59.336575 IP 192.168.43.124.8880 > 192.168.43.146.7771: UDP, length 120
01:11:59.336991 IP 192.168.43.146.8880 > 192.168.43.147.7772: UDP, length 120
01:11:59.375512 IP 192.168.43.124.8880 > 192.168.43.146.7771: UDP, length 120
01:11:59.387041 IP 192.168.43.146.8880 > 192.168.43.147.7772: UDP, length 120
01:11:59.426555 IP 192.168.43.124.8880 > 192.168.43.146.7771: UDP, length 120
01:11:59.436994 IP 192.168.43.146.8880 > 192.168.43.147.7772: UDP, length 120
01:11:59.474954 IP 192.168.43.124.8880 > 192.168.43.146.7771: UDP, length 120
01:11:59.486996 IP 192.168.43.146.8880 > 192.168.43.147.7772: UDP, length 120
01:11:59.524502 IP 192.168.43.124.8880 > 192.168.43.146.7771: UDP, length 120
01:11:59.536993 IP 192.168.43.146.8880 > 192.168.43.147.7772: UDP, length 120
01:11:59.580539 IP 192.168.43.124.8880 > 192.168.43.146.7771: UDP, length 120
01:11:59.587088 IP 192.168.43.146.8880 > 192.168.43.147.7772: UDP, length 120
01:11:59.637068 IP 192.168.43.146.8880 > 192.168.43.147.7772: UDP, length 120
01:11:59.637698 IP 192.168.43.124.8880 > 192.168.43.146.7771: UDP, length 120
01:11:59.673496 IP 192.168.43.124.8880 > 192.168.43.146.7771: UDP, length 120
01:11:59.687010 IP 192.168.43.146.8880 > 192.168.43.147.7772: UDP, length 120
01:11:59.723771 IP 192.168.43.124.8880 > 192.168.43.146.7771: UDP, length 120
01:11:59.736994 IP 192.168.43.146.8880 > 192.168.43.147.7772: UDP, length 120
01:11:59.773401 IP 192.168.43.124.8880 > 192.168.43.146.7771: UDP, length 120
01:11:59.786996 IP 192.168.43.146.8880 > 192.168.43.147.7772: UDP, length 120
01:11:59.824205 IP 192.168.43.124.8880 > 192.168.43.146.7771: UDP, length 120
01:11:59.836992 IP 192.168.43.146.8880 > 192.168.43.147.7772: UDP, length 120
01:11:59.873605 IP 192.168.43.124.8880 > 192.168.43.146.7771: UDP, length 120
01:11:59.886993 IP 192.168.43.146.8880 > 192.168.43.147.7772: UDP, length 120
01:11:59.933387 IP 192.168.43.124.8880 > 192.168.43.146.7771: UDP, length 120
01:11:59.936990 IP 192.168.43.146.8880 > 192.168.43.147.7772: UDP, length 120
01:11:59.973490 IP 192.168.43.124.8880 > 192.168.43.146.7771: UDP, length 120
01:11:59.987000 IP 192.168.43.146.8880 > 192.168.43.147.7772: UDP, length 120
01:12:00.024080 IP 192.168.43.124.8880 > 192.168.43.146.7771: UDP, length 120
01:12:00.036995 IP 192.168.43.146.8880 > 192.168.43.147.7772: UDP, length 120
01:12:00.083564 IP 192.168.43.124.8880 > 192.168.43.146.7771: UDP, length 120
01:12:00.087020 IP 192.168.43.146.8880 > 192.168.43.147.7772: UDP, length 120
01:12:00.125997 IP 192.168.43.124.8880 > 192.168.43.146.7771: UDP, length 120
01:12:00.136997 IP 192.168.43.146.8880 > 192.168.43.147.7772: UDP, length 120
01:12:00.175606 IP 192.168.43.124.8880 > 192.168.43.146.7771: UDP, length 120
01:12:00.186994 IP 192.168.43.146.8880 > 192.168.43.147.7772: UDP, length 120
01:12:00.225697 IP 192.168.43.124.8880 > 192.168.43.146.7771: UDP, length 120
01:12:00.236989 IP 192.168.43.146.8880 > 192.168.43.147.7772: UDP, length 120
01:12:00.275204 IP 192.168.43.124.8880 > 192.168.43.146.7771: UDP, length 120
01:12:00.286992 IP 192.168.43.146.8880 > 192.168.43.147.7772: UDP, length 120
01:12:00.325240 IP 192.168.43.124.8880 > 192.168.43.146.7771: UDP, length 120
01:12:00.336992 IP 192.168.43.146.8880 > 192.168.43.147.7772: UDP, length 120
01:12:00.374966 IP 192.168.43.124.8880 > 192.168.43.146.7771: UDP, length 120
01:12:00.386995 IP 192.168.43.146.8880 > 192.168.43.147.7772: UDP, length 120
01:12:00.424816 IP 192.168.43.124.8880 > 192.168.43.146.7771: UDP, length 120
01:12:00.436990 IP 192.168.43.146.8880 > 192.168.43.147.7772: UDP, length 120
01:12:00.474620 IP 192.168.43.124.8880 > 192.168.43.146.7771: UDP, length 120
01:12:00.486994 IP 192.168.43.146.8880 > 192.168.43.147.7772: UDP, length 120
01:12:00.528086 IP 192.168.43.124.8880 > 192.168.43.146.7771: UDP, length 120
01:12:00.536991 IP 192.168.43.146.8880 > 192.168.43.147.7772: UDP, length 120
01:12:00.576683 IP 192.168.43.124.8880 > 192.168.43.146.7771: UDP, length 120
01:12:00.586992 IP 192.168.43.146.8880 > 192.168.43.147.7772: UDP, length 120
01:12:00.623449 IP 192.168.43.124.8880 > 192.168.43.146.7771: UDP, length 120
01:12:00.637041 IP 192.168.43.146.8880 > 192.168.43.147.7772: UDP, length 120
01:12:00.677248 IP 192.168.43.124.8880 > 192.168.43.146.7771: UDP, length 120
01:12:00.687010 IP 192.168.43.146.8880 > 192.168.43.147.7772: UDP, length 120
01:12:00.725336 IP 192.168.43.124.8880 > 192.168.43.146.7771: UDP, length 120
01:12:00.736995 IP 192.168.43.146.8880 > 192.168.43.147.7772: UDP, length 120
01:12:00.779655 IP 192.168.43.124.8880 > 192.168.43.146.7771: UDP, length 120
01:12:00.786993 IP 192.168.43.146.8880 > 192.168.43.147.7772: UDP, length 120
01:12:00.825236 IP 192.168.43.124.8880 > 192.168.43.146.7771: UDP, length 120
01:12:00.836990 IP 192.168.43.146.8880 > 192.168.43.147.7772: UDP, length 120
01:12:00.877721 IP 192.168.43.124.8880 > 192.168.43.146.7771: UDP, length 120
01:12:00.887027 IP 192.168.43.146.8880 > 192.168.43.147.7772: UDP, length 120
01:12:00.925063 IP 192.168.43.124.8880 > 192.168.43.146.7771: UDP, length 120
01:12:00.936993 IP 192.168.43.146.8880 > 192.168.43.147.7772: UDP, length 120
01:12:00.975238 IP 192.168.43.124.8880 > 192.168.43.146.7771: UDP, length 120
01:12:00.987003 IP 192.168.43.146.8880 > 192.168.43.147.7772: UDP, length 120
01:12:01.027203 IP 192.168.43.124.8880 > 192.168.43.146.7771: UDP, length 120
01:12:01.037030 IP 192.168.43.146.8880 > 192.168.43.147.7772: UDP, length 120
01:12:01.086868 IP 192.168.43.124.8880 > 192.168.43.146.7771: UDP, length 120
01:12:01.087031 IP 192.168.43.146.8880 > 192.168.43.147.7772: UDP, length 120
01:12:01.127000 IP 192.168.43.124.8880 > 192.168.43.146.7771: UDP, length 120
01:12:01.137002 IP 192.168.43.146.8880 > 192.168.43.147.7772: UDP, length 120
01:12:01.175379 IP 192.168.43.124.8880 > 192.168.43.146.7771: UDP, length 120
01:12:01.187015 IP 192.168.43.146.8880 > 192.168.43.147.7772: UDP, length 120
01:12:01.227137 IP 192.168.43.124.8880 > 192.168.43.146.7771: UDP, length 120
01:12:01.237009 IP 192.168.43.146.8880 > 192.168.43.147.7772: UDP, length 120
01:12:01.275202 IP 192.168.43.124.8880 > 192.168.43.146.7771: UDP, length 120
01:12:01.287003 IP 192.168.43.146.8880 > 192.168.43.147.7772: UDP, length 120
01:12:01.325203 IP 192.168.43.124.8880 > 192.168.43.146.7771: UDP, length 120
01:12:01.336992 IP 192.168.43.146.8880 > 192.168.43.147.7772: UDP, length 120
01:12:01.372423 IP 192.168.43.124.8880 > 192.168.43.146.7771: UDP, length 120
01:12:01.386994 IP 192.168.43.146.8880 > 192.168.43.147.7772: UDP, length 120
01:12:01.425158 IP 192.168.43.124.8880 > 192.168.43.146.7771: UDP, length 120
01:12:01.437004 IP 192.168.43.146.8880 > 192.168.43.147.7772: UDP, length 120
01:12:01.475306 IP 192.168.43.124.8880 > 192.168.43.146.7771: UDP, length 120
01:12:01.487007 IP 192.168.43.146.8880 > 192.168.43.147.7772: UDP, length 120
01:12:01.525765 IP 192.168.43.124.8880 > 192.168.43.146.7771: UDP, length 120
01:12:01.537001 IP 192.168.43.146.8880 > 192.168.43.147.7772: UDP, length 120
01:12:01.575656 IP 192.168.43.124.8880 > 192.168.43.146.7771: UDP, length 120
01:12:01.586997 IP 192.168.43.146.8880 > 192.168.43.147.7772: UDP, length 120
01:12:01.626290 IP 192.168.43.124.8880 > 192.168.43.146.7771: UDP, length 120
01:12:01.637061 IP 192.168.43.146.8880 > 192.168.43.147.7772: UDP, length 120
01:12:01.676174 IP 192.168.43.124.8880 > 192.168.43.146.7771: UDP, length 120
01:12:01.687071 IP 192.168.43.146.8880 > 192.168.43.147.7772: UDP, length 120
01:12:01.726694 IP 192.168.43.124.8880 > 192.168.43.146.7771: UDP, length 120
01:12:01.737070 IP 192.168.43.146.8880 > 192.168.43.147.7772: UDP, length 120
01:12:01.775443 IP 192.168.43.124.8880 > 192.168.43.146.7771: UDP, length 120
01:12:01.787117 IP 192.168.43.146.8880 > 192.168.43.147.7772: UDP, length 120
01:12:01.825147 IP 192.168.43.124.8880 > 192.168.43.146.7771: UDP, length 120
01:12:01.837061 IP 192.168.43.146.8880 > 192.168.43.147.7772: UDP, length 120
01:12:01.871561 IP 192.168.43.124.8880 > 192.168.43.146.7771: UDP, length 120
01:12:01.887058 IP 192.168.43.146.8880 > 192.168.43.147.7772: UDP, length 120
01:12:01.925190 IP 192.168.43.124.8880 > 192.168.43.146.7771: UDP, length 120
01:12:01.937062 IP 192.168.43.146.8880 > 192.168.43.147.7772: UDP, length 120
01:12:01.975598 IP 192.168.43.124.8880 > 192.168.43.146.7771: UDP, length 120
01:12:01.987039 IP 192.168.43.146.8880 > 192.168.43.147.7772: UDP, length 120
01:12:02.025241 IP 192.168.43.124.8880 > 192.168.43.146.7771: UDP, length 120
01:12:02.037071 IP 192.168.43.146.8880 > 192.168.43.147.7772: UDP, length 120
01:12:02.075714 IP 192.168.43.124.8880 > 192.168.43.146.7771: UDP, length 120
01:12:02.087054 IP 192.168.43.146.8880 > 192.168.43.147.7772: UDP, length 120
01:12:02.122569 IP 192.168.43.124.8880 > 192.168.43.146.7771: UDP, length 120
01:12:02.137062 IP 192.168.43.146.8880 > 192.168.43.147.7772: UDP, length 120
01:12:02.174947 IP 192.168.43.124.8880 > 192.168.43.146.7771: UDP, length 120
01:12:02.187018 IP 192.168.43.146.8880 > 192.168.43.147.7772: UDP, length 120
01:12:02.224955 IP 192.168.43.124.8880 > 192.168.43.146.7771: UDP, length 120
01:12:02.236992 IP 192.168.43.146.8880 > 192.168.43.147.7772: UDP, length 120
01:12:02.276488 IP 192.168.43.124.8880 > 192.168.43.146.7771: UDP, length 120
01:12:02.286973 IP 192.168.43.146.8880 > 192.168.43.147.7772: UDP, length 120
01:12:02.324945 IP 192.168.43.124.8880 > 192.168.43.146.7771: UDP, length 120
01:12:02.336972 IP 192.168.43.146.8880 > 192.168.43.147.7772: UDP, length 120
01:12:02.374939 IP 192.168.43.124.8880 > 192.168.43.146.7771: UDP, length 120
01:12:02.386994 IP 192.168.43.146.8880 > 192.168.43.147.7772: UDP, length 120
01:12:02.424984 IP 192.168.43.124.8880 > 192.168.43.146.7771: UDP, length 120
01:12:02.436968 IP 192.168.43.146.8880 > 192.168.43.147.7772: UDP, length 120
01:12:02.474986 IP 192.168.43.124.8880 > 192.168.43.146.7771: UDP, length 120
01:12:02.486966 IP 192.168.43.146.8880 > 192.168.43.147.7772: UDP, length 120
01:12:02.529830 IP 192.168.43.124.8880 > 192.168.43.146.7771: UDP, length 120
01:12:02.536970 IP 192.168.43.146.8880 > 192.168.43.147.7772: UDP, length 120
01:12:02.574881 IP 192.168.43.124.8880 > 192.168.43.146.7771: UDP, length 120
01:12:02.586968 IP 192.168.43.146.8880 > 192.168.43.147.7772: UDP, length 120
01:12:02.625238 IP 192.168.43.124.8880 > 192.168.43.146.7771: UDP, length 120
01:12:02.637056 IP 192.168.43.146.8880 > 192.168.43.147.7772: UDP, length 120
01:12:02.677440 IP 192.168.43.124.8880 > 192.168.43.146.7771: UDP, length 120
01:12:02.687010 IP 192.168.43.146.8880 > 192.168.43.147.7772: UDP, length 120
01:12:02.727319 IP 192.168.43.124.8880 > 192.168.43.146.7771: UDP, length 120
01:12:02.737018 IP 192.168.43.146.8880 > 192.168.43.147.7772: UDP, length 120
01:12:02.775186 IP 192.168.43.124.8880 > 192.168.43.146.7771: UDP, length 120
01:12:02.786996 IP 192.168.43.146.8880 > 192.168.43.147.7772: UDP, length 120
01:12:02.827597 IP 192.168.43.124.8880 > 192.168.43.146.7771: UDP, length 120
01:12:02.837003 IP 192.168.43.146.8880 > 192.168.43.147.7772: UDP, length 120
01:12:02.875326 IP 192.168.43.124.8880 > 192.168.43.146.7771: UDP, length 120
01:12:02.886994 IP 192.168.43.146.8880 > 192.168.43.147.7772: UDP, length 120
01:12:02.925341 IP 192.168.43.124.8880 > 192.168.43.146.7771: UDP, length 120
01:12:02.936992 IP 192.168.43.146.8880 > 192.168.43.147.7772: UDP, length 120
01:12:02.976196 IP 192.168.43.124.8880 > 192.168.43.146.7771: UDP, length 120
01:12:02.986994 IP 192.168.43.146.8880 > 192.168.43.147.7772: UDP, length 120
01:12:03.029053 IP 192.168.43.124.8880 > 192.168.43.146.7771: UDP, length 120
01:12:03.036993 IP 192.168.43.146.8880 > 192.168.43.147.7772: UDP, length 120
01:12:03.075967 IP 192.168.43.124.8880 > 192.168.43.146.7771: UDP, length 120
01:12:03.087014 IP 192.168.43.146.8880 > 192.168.43.147.7772: UDP, length 120
01:12:03.126319 IP 192.168.43.124.8880 > 192.168.43.146.7771: UDP, length 120
01:12:03.136996 IP 192.168.43.146.8880 > 192.168.43.147.7772: UDP, length 120
01:12:03.173730 IP 192.168.43.124.8880 > 192.168.43.146.7771: UDP, length 120
01:12:03.186994 IP 192.168.43.146.8880 > 192.168.43.147.7772: UDP, length 120
01:12:03.223702 IP 192.168.43.124.8880 > 192.168.43.146.7771: UDP, length 120
01:12:03.237003 IP 192.168.43.146.8880 > 192.168.43.147.7772: UDP, length 120
01:12:03.275461 IP 192.168.43.124.8880 > 192.168.43.146.7771: UDP, length 120
01:12:03.287000 IP 192.168.43.146.8880 > 192.168.43.147.7772: UDP, length 120
01:12:03.323477 IP 192.168.43.124.8880 > 192.168.43.146.7771: UDP, length 120
01:12:03.336997 IP 192.168.43.146.8880 > 192.168.43.147.7772: UDP, length 120
01:12:03.373353 IP 192.168.43.124.8880 > 192.168.43.146.7771: UDP, length 120
01:12:03.386994 IP 192.168.43.146.8880 > 192.168.43.147.7772: UDP, length 120
01:12:03.423963 IP 192.168.43.124.8880 > 192.168.43.146.7771: UDP, length 120
01:12:03.436992 IP 192.168.43.146.8880 > 192.168.43.147.7772: UDP, length 120
01:12:03.475122 IP 192.168.43.124.8880 > 192.168.43.146.7771: UDP, length 120
01:12:03.486997 IP 192.168.43.146.8880 > 192.168.43.147.7772: UDP, length 120
01:12:03.530403 IP 192.168.43.124.8880 > 192.168.43.146.7771: UDP, length 120
01:12:03.536992 IP 192.168.43.146.8880 > 192.168.43.147.7772: UDP, length 120
01:12:03.574934 IP 192.168.43.124.8880 > 192.168.43.146.7771: UDP, length 120
01:12:03.586995 IP 192.168.43.146.8880 > 192.168.43.147.7772: UDP, length 120
01:12:03.636993 IP 192.168.43.146.8880 > 192.168.43.147.7772: UDP, length 120
01:12:03.640420 IP 192.168.43.124.8880 > 192.168.43.146.7771: UDP, length 120
01:12:03.676302 IP 192.168.43.124.8880 > 192.168.43.146.7771: UDP, length 120
01:12:03.686996 IP 192.168.43.146.8880 > 192.168.43.147.7772: UDP, length 120
01:12:03.726908 IP 192.168.43.124.8880 > 192.168.43.146.7771: UDP, length 120
01:12:03.737004 IP 192.168.43.146.8880 > 192.168.43.147.7772: UDP, length 120
01:12:03.778503 IP 192.168.43.124.8880 > 192.168.43.146.7771: UDP, length 120
01:12:03.786992 IP 192.168.43.146.8880 > 192.168.43.147.7772: UDP, length 120
01:12:03.825131 IP 192.168.43.124.8880 > 192.168.43.146.7771: UDP, length 120
01:12:03.836991 IP 192.168.43.146.8880 > 192.168.43.147.7772: UDP, length 120
01:12:03.876870 IP 192.168.43.124.8880 > 192.168.43.146.7771: UDP, length 120
01:12:03.887029 IP 192.168.43.146.8880 > 192.168.43.147.7772: UDP, length 120
01:12:03.925493 IP 192.168.43.124.8880 > 192.168.43.146.7771: UDP, length 120
01:12:03.937007 IP 192.168.43.146.8880 > 192.168.43.147.7772: UDP, length 120
01:12:03.975105 IP 192.168.43.124.8880 > 192.168.43.146.7771: UDP, length 120
01:12:03.986992 IP 192.168.43.146.8880 > 192.168.43.147.7772: UDP, length 120
01:12:04.024566 IP 192.168.43.124.8880 > 192.168.43.146.7771: UDP, length 120
01:12:04.036993 IP 192.168.43.146.8880 > 192.168.43.147.7772: UDP, length 120
01:12:04.075122 IP 192.168.43.124.8880 > 192.168.43.146.7771: UDP, length 120
01:12:04.087021 IP 192.168.43.146.8880 > 192.168.43.147.7772: UDP, length 120
01:12:04.125789 IP 192.168.43.124.8880 > 192.168.43.146.7771: UDP, length 120
01:12:04.137008 IP 192.168.43.146.8880 > 192.168.43.147.7772: UDP, length 120
01:12:04.175071 IP 192.168.43.124.8880 > 192.168.43.146.7771: UDP, length 120
01:12:04.186994 IP 192.168.43.146.8880 > 192.168.43.147.7772: UDP, length 120
01:12:04.226061 IP 192.168.43.124.8880 > 192.168.43.146.7771: UDP, length 120
01:12:04.236993 IP 192.168.43.146.8880 > 192.168.43.147.7772: UDP, length 120
01:12:04.274515 IP 192.168.43.124.8880 > 192.168.43.146.7771: UDP, length 120
01:12:04.287001 IP 192.168.43.146.8880 > 192.168.43.147.7772: UDP, length 120
01:12:04.326437 IP 192.168.43.124.8880 > 192.168.43.146.7771: UDP, length 120
01:12:04.337010 IP 192.168.43.146.8880 > 192.168.43.147.7772: UDP, length 120
01:12:04.373312 IP 192.168.43.124.8880 > 192.168.43.146.7771: UDP, length 120
01:12:04.387001 IP 192.168.43.146.8880 > 192.168.43.147.7772: UDP, length 120
01:12:04.426834 IP 192.168.43.124.8880 > 192.168.43.146.7771: UDP, length 120
01:12:04.437007 IP 192.168.43.146.8880 > 192.168.43.147.7772: UDP, length 120
01:12:04.475133 IP 192.168.43.124.8880 > 192.168.43.146.7771: UDP, length 120
01:12:04.487006 IP 192.168.43.146.8880 > 192.168.43.147.7772: UDP, length 120
