03:32:42.190243 IP 192.168.43.147.8880 > 192.168.43.124.7773: UDP, length 120
03:32:42.240321 IP 192.168.43.147.8880 > 192.168.43.124.7773: UDP, length 120
03:32:42.290333 IP 192.168.43.147.8880 > 192.168.43.124.7773: UDP, length 120
03:32:42.340317 IP 192.168.43.147.8880 > 192.168.43.124.7773: UDP, length 120
03:32:42.390269 IP 192.168.43.147.8880 > 192.168.43.124.7773: UDP, length 120
03:32:42.440262 IP 192.168.43.147.8880 > 192.168.43.124.7773: UDP, length 120
03:32:42.490258 IP 192.168.43.147.8880 > 192.168.43.124.7773: UDP, length 120
03:32:42.540258 IP 192.168.43.147.8880 > 192.168.43.124.7773: UDP, length 120
03:32:42.590293 IP 192.168.43.147.8880 > 192.168.43.124.7773: UDP, length 120
03:32:42.640264 IP 192.168.43.147.8880 > 192.168.43.124.7773: UDP, length 120
03:32:42.690260 IP 192.168.43.147.8880 > 192.168.43.124.7773: UDP, length 120
03:32:42.740258 IP 192.168.43.147.8880 > 192.168.43.124.7773: UDP, length 120
03:32:42.790259 IP 192.168.43.147.8880 > 192.168.43.124.7773: UDP, length 120
03:32:42.840266 IP 192.168.43.147.8880 > 192.168.43.124.7773: UDP, length 120
03:32:42.890261 IP 192.168.43.147.8880 > 192.168.43.124.7773: UDP, length 120
03:32:42.940259 IP 192.168.43.147.8880 > 192.168.43.124.7773: UDP, length 120
03:32:42.990258 IP 192.168.43.147.8880 > 192.168.43.124.7773: UDP, length 120
03:32:43.040258 IP 192.168.43.147.8880 > 192.168.43.124.7773: UDP, length 120
03:32:43.090259 IP 192.168.43.147.8880 > 192.168.43.124.7773: UDP, length 120
03:32:43.140258 IP 192.168.43.147.8880 > 192.168.43.124.7773: UDP, length 120
03:32:43.190259 IP 192.168.43.147.8880 > 192.168.43.124.7773: UDP, length 120
03:32:43.240259 IP 192.168.43.147.8880 > 192.168.43.124.7773: UDP, length 120
03:32:43.290259 IP 192.168.43.147.8880 > 192.168.43.124.7773: UDP, length 120
03:32:43.340260 IP 192.168.43.147.8880 > 192.168.43.124.7773: UDP, length 120
03:32:43.390258 IP 192.168.43.147.8880 > 192.168.43.124.7773: UDP, length 120
03:32:43.440257 IP 192.168.43.147.8880 > 192.168.43.124.7773: UDP, length 120
03:32:43.490257 IP 192.168.43.147.8880 > 192.168.43.124.7773: UDP, length 120
03:32:43.540258 IP 192.168.43.147.8880 > 192.168.43.124.7773: UDP, length 120
03:32:43.590257 IP 192.168.43.147.8880 > 192.168.43.124.7773: UDP, length 120
03:32:43.640256 IP 192.168.43.147.8880 > 192.168.43.124.7773: UDP, length 120
03:32:43.690257 IP 192.168.43.147.8880 > 192.168.43.124.7773: UDP, length 120
03:32:43.740257 IP 192.168.43.147.8880 > 192.168.43.124.7773: UDP, length 120
03:32:43.790257 IP 192.168.43.147.8880 > 192.168.43.124.7773: UDP, length 120
03:32:43.840258 IP 192.168.43.147.8880 > 192.168.43.124.7773: UDP, length 120
03:32:43.890259 IP 192.168.43.147.8880 > 192.168.43.124.7773: UDP, length 120
03:32:43.940258 IP 192.168.43.147.8880 > 192.168.43.124.7773: UDP, length 120
03:32:43.990260 IP 192.168.43.147.8880 > 192.168.43.124.7773: UDP, length 120
03:32:44.040258 IP 192.168.43.147.8880 > 192.168.43.124.7773: UDP, length 120
03:32:44.090289 IP 192.168.43.147.8880 > 192.168.43.124.7773: UDP, length 120
03:32:44.140259 IP 192.168.43.147.8880 > 192.168.43.124.7773: UDP, length 120
03:32:44.190258 IP 192.168.43.147.8880 > 192.168.43.124.7773: UDP, length 120
03:32:44.240258 IP 192.168.43.147.8880 > 192.168.43.124.7773: UDP, length 120
03:32:44.290260 IP 192.168.43.147.8880 > 192.168.43.124.7773: UDP, length 120
03:32:44.340258 IP 192.168.43.147.8880 > 192.168.43.124.7773: UDP, length 120
03:32:44.390262 IP 192.168.43.147.8880 > 192.168.43.124.7773: UDP, length 120
03:32:44.440257 IP 192.168.43.147.8880 > 192.168.43.124.7773: UDP, length 120
03:32:44.490257 IP 192.168.43.147.8880 > 192.168.43.124.7773: UDP, length 120
03:32:44.540256 IP 192.168.43.147.8880 > 192.168.43.124.7773: UDP, length 120
03:32:44.590257 IP 192.168.43.147.8880 > 192.168.43.124.7773: UDP, length 120
03:32:44.640256 IP 192.168.43.147.8880 > 192.168.43.124.7773: UDP, length 120
03:32:44.690255 IP 192.168.43.147.8880 > 192.168.43.124.7773: UDP, length 120
03:32:44.740257 IP 192.168.43.147.8880 > 192.168.43.124.7773: UDP, length 120
03:32:44.790256 IP 192.168.43.147.8880 > 192.168.43.124.7773: UDP, length 120
03:32:44.840258 IP 192.168.43.147.8880 > 192.168.43.124.7773: UDP, length 120
03:32:44.890258 IP 192.168.43.147.8880 > 192.168.43.124.7773: UDP, length 120
03:32:44.940257 IP 192.168.43.147.8880 > 192.168.43.124.7773: UDP, length 120
03:32:44.990257 IP 192.168.43.147.8880 > 192.168.43.124.7773: UDP, length 120
03:32:45.040258 IP 192.168.43.147.8880 > 192.168.43.124.7773: UDP, length 120
03:32:45.090256 IP 192.168.43.147.8880 > 192.168.43.124.7773: UDP, length 120
03:32:45.140256 IP 192.168.43.147.8880 > 192.168.43.124.7773: UDP, length 120
03:32:45.190256 IP 192.168.43.147.8880 > 192.168.43.124.7773: UDP, length 120
03:32:45.240256 IP 192.168.43.147.8880 > 192.168.43.124.7773: UDP, length 120
03:32:45.290256 IP 192.168.43.147.8880 > 192.168.43.124.7773: UDP, length 120
03:32:45.340257 IP 192.168.43.147.8880 > 192.168.43.124.7773: UDP, length 120
03:32:45.390256 IP 192.168.43.147.8880 > 192.168.43.124.7773: UDP, length 120
03:32:45.440257 IP 192.168.43.147.8880 > 192.168.43.124.7773: UDP, length 120
03:32:45.490258 IP 192.168.43.147.8880 > 192.168.43.124.7773: UDP, length 120
03:32:45.540257 IP 192.168.43.147.8880 > 192.168.43.124.7773: UDP, length 120
03:32:45.590291 IP 192.168.43.147.8880 > 192.168.43.124.7773: UDP, length 120
03:32:45.640262 IP 192.168.43.147.8880 > 192.168.43.124.7773: UDP, length 120
03:32:45.690260 IP 192.168.43.147.8880 > 192.168.43.124.7773: UDP, length 120
03:32:45.740257 IP 192.168.43.147.8880 > 192.168.43.124.7773: UDP, length 120
03:32:45.790257 IP 192.168.43.147.8880 > 192.168.43.124.7773: UDP, length 120
03:32:45.840256 IP 192.168.43.147.8880 > 192.168.43.124.7773: UDP, length 120
03:32:45.890257 IP 192.168.43.147.8880 > 192.168.43.124.7773: UDP, length 120
03:32:45.940258 IP 192.168.43.147.8880 > 192.168.43.124.7773: UDP, length 120
03:32:45.990259 IP 192.168.43.147.8880 > 192.168.43.124.7773: UDP, length 120
03:32:46.040258 IP 192.168.43.147.8880 > 192.168.43.124.7773: UDP, length 120
03:32:46.090258 IP 192.168.43.147.8880 > 192.168.43.124.7773: UDP, length 120
03:32:46.140257 IP 192.168.43.147.8880 > 192.168.43.124.7773: UDP, length 120
03:32:46.190257 IP 192.168.43.147.8880 > 192.168.43.124.7773: UDP, length 120
03:32:46.240239 IP 192.168.43.147.8880 > 192.168.43.124.7773: UDP, length 120
03:32:46.290259 IP 192.168.43.147.8880 > 192.168.43.124.7773: UDP, length 120
03:32:46.340258 IP 192.168.43.147.8880 > 192.168.43.124.7773: UDP, length 120
03:32:46.390258 IP 192.168.43.147.8880 > 192.168.43.124.7773: UDP, length 120
03:32:46.440256 IP 192.168.43.147.8880 > 192.168.43.124.7773: UDP, length 120
03:32:46.490260 IP 192.168.43.147.8880 > 192.168.43.124.7773: UDP, length 120
03:32:46.540260 IP 192.168.43.147.8880 > 192.168.43.124.7773: UDP, length 120
03:32:46.590258 IP 192.168.43.147.8880 > 192.168.43.124.7773: UDP, length 120
03:32:46.640257 IP 192.168.43.147.8880 > 192.168.43.124.7773: UDP, length 120
03:32:46.690257 IP 192.168.43.147.8880 > 192.168.43.124.7773: UDP, length 120
03:32:46.740257 IP 192.168.43.147.8880 > 192.168.43.124.7773: UDP, length 120
03:32:46.790256 IP 192.168.43.147.8880 > 192.168.43.124.7773: UDP, length 120
03:32:46.840269 IP 192.168.43.147.8880 > 192.168.43.124.7773: UDP, length 120
03:32:46.890285 IP 192.168.43.147.8880 > 192.168.43.124.7773: UDP, length 120
03:32:46.940284 IP 192.168.43.147.8880 > 192.168.43.124.7773: UDP, length 120
03:32:46.990283 IP 192.168.43.147.8880 > 192.168.43.124.7773: UDP, length 120
03:32:47.040283 IP 192.168.43.147.8880 > 192.168.43.124.7773: UDP, length 120
03:32:47.090323 IP 192.168.43.147.8880 > 192.168.43.124.7773: UDP, length 120
03:32:47.140287 IP 192.168.43.147.8880 > 192.168.43.124.7773: UDP, length 120
03:32:47.190283 IP 192.168.43.147.8880 > 192.168.43.124.7773: UDP, length 120
03:32:47.240282 IP 192.168.43.147.8880 > 192.168.43.124.7773: UDP, length 120
03:32:47.290285 IP 192.168.43.147.8880 > 192.168.43.124.7773: UDP, length 120
03:32:47.340359 IP 192.168.43.147.8880 > 192.168.43.124.7773: UDP, length 120
03:32:47.390400 IP 192.168.43.147.8880 > 192.168.43.124.7773: UDP, length 120
03:32:47.440380 IP 192.168.43.147.8880 > 192.168.43.124.7773: UDP, length 120
03:32:47.490364 IP 192.168.43.147.8880 > 192.168.43.124.7773: UDP, length 120
03:32:47.540322 IP 192.168.43.147.8880 > 192.168.43.124.7773: UDP, length 120
03:32:47.590315 IP 192.168.43.147.8880 > 192.168.43.124.7773: UDP, length 120
03:32:47.640316 IP 192.168.43.147.8880 > 192.168.43.124.7773: UDP, length 120
03:32:47.690328 IP 192.168.43.147.8880 > 192.168.43.124.7773: UDP, length 120
03:32:47.740380 IP 192.168.43.147.8880 > 192.168.43.124.7773: UDP, length 120
03:32:47.790346 IP 192.168.43.147.8880 > 192.168.43.124.7773: UDP, length 120
03:32:47.840311 IP 192.168.43.147.8880 > 192.168.43.124.7773: UDP, length 120
03:32:47.890306 IP 192.168.43.147.8880 > 192.168.43.124.7773: UDP, length 120
03:32:47.940262 IP 192.168.43.147.8880 > 192.168.43.124.7773: UDP, length 120
03:32:47.990258 IP 192.168.43.147.8880 > 192.168.43.124.7773: UDP, length 120
03:32:48.040258 IP 192.168.43.147.8880 > 192.168.43.124.7773: UDP, length 120
03:32:48.090258 IP 192.168.43.147.8880 > 192.168.43.124.7773: UDP, length 120
03:32:48.140258 IP 192.168.43.147.8880 > 192.168.43.124.7773: UDP, length 120
03:32:48.190258 IP 192.168.43.147.8880 > 192.168.43.124.7773: UDP, length 120
03:32:48.240258 IP 192.168.43.147.8880 > 192.168.43.124.7773: UDP, length 120
03:32:48.290258 IP 192.168.43.147.8880 > 192.168.43.124.7773: UDP, length 120
03:32:48.340258 IP 192.168.43.147.8880 > 192.168.43.124.7773: UDP, length 120
03:32:48.390258 IP 192.168.43.147.8880 > 192.168.43.124.7773: UDP, length 120
03:32:48.440258 IP 192.168.43.147.8880 > 192.168.43.124.7773: UDP, length 120
03:32:48.490261 IP 192.168.43.147.8880 > 192.168.43.124.7773: UDP, length 120
03:32:48.540257 IP 192.168.43.147.8880 > 192.168.43.124.7773: UDP, length 120
03:32:48.590302 IP 192.168.43.147.8880 > 192.168.43.124.7773: UDP, length 120
03:32:48.640271 IP 192.168.43.147.8880 > 192.168.43.124.7773: UDP, length 120
03:32:48.690258 IP 192.168.43.147.8880 > 192.168.43.124.7773: UDP, length 120
03:32:48.740259 IP 192.168.43.147.8880 > 192.168.43.124.7773: UDP, length 120
03:32:48.790258 IP 192.168.43.147.8880 > 192.168.43.124.7773: UDP, length 120
03:32:48.840258 IP 192.168.43.147.8880 > 192.168.43.124.7773: UDP, length 120
03:32:48.890266 IP 192.168.43.147.8880 > 192.168.43.124.7773: UDP, length 120
03:32:48.940261 IP 192.168.43.147.8880 > 192.168.43.124.7773: UDP, length 120
03:32:48.990259 IP 192.168.43.147.8880 > 192.168.43.124.7773: UDP, length 120
03:32:49.040257 IP 192.168.43.147.8880 > 192.168.43.124.7773: UDP, length 120
03:32:49.090257 IP 192.168.43.147.8880 > 192.168.43.124.7773: UDP, length 120
03:32:49.140256 IP 192.168.43.147.8880 > 192.168.43.124.7773: UDP, length 120
03:32:49.190257 IP 192.168.43.147.8880 > 192.168.43.124.7773: UDP, length 120
03:32:49.240256 IP 192.168.43.147.8880 > 192.168.43.124.7773: UDP, length 120
03:32:49.290256 IP 192.168.43.147.8880 > 192.168.43.124.7773: UDP, length 120
03:32:49.340257 IP 192.168.43.147.8880 > 192.168.43.124.7773: UDP, length 120
03:32:49.390257 IP 192.168.43.147.8880 > 192.168.43.124.7773: UDP, length 120
03:32:49.440258 IP 192.168.43.147.8880 > 192.168.43.124.7773: UDP, length 120
03:32:49.490258 IP 192.168.43.147.8880 > 192.168.43.124.7773: UDP, length 120
03:32:49.540257 IP 192.168.43.147.8880 > 192.168.43.124.7773: UDP, length 120
03:32:49.590257 IP 192.168.43.147.8880 > 192.168.43.124.7773: UDP, length 120
03:32:49.640260 IP 192.168.43.147.8880 > 192.168.43.124.7773: UDP, length 120
03:32:49.690261 IP 192.168.43.147.8880 > 192.168.43.124.7773: UDP, length 120
03:32:49.740258 IP 192.168.43.147.8880 > 192.168.43.124.7773: UDP, length 120
03:32:49.790257 IP 192.168.43.147.8880 > 192.168.43.124.7773: UDP, length 120
03:32:49.840258 IP 192.168.43.147.8880 > 192.168.43.124.7773: UDP, length 120
03:32:49.890258 IP 192.168.43.147.8880 > 192.168.43.124.7773: UDP, length 120
03:32:49.940258 IP 192.168.43.147.8880 > 192.168.43.124.7773: UDP, length 120
03:32:49.990257 IP 192.168.43.147.8880 > 192.168.43.124.7773: UDP, length 120
03:32:50.040257 IP 192.168.43.147.8880 > 192.168.43.124.7773: UDP, length 120
03:32:50.090293 IP 192.168.43.147.8880 > 192.168.43.124.7773: UDP, length 120
03:32:50.140261 IP 192.168.43.147.8880 > 192.168.43.124.7773: UDP, length 120
03:32:50.190258 IP 192.168.43.147.8880 > 192.168.43.124.7773: UDP, length 120
03:32:50.240258 IP 192.168.43.147.8880 > 192.168.43.124.7773: UDP, length 120
03:32:50.290258 IP 192.168.43.147.8880 > 192.168.43.124.7773: UDP, length 120
03:32:50.340258 IP 192.168.43.147.8880 > 192.168.43.124.7773: UDP, length 120
03:32:50.390258 IP 192.168.43.147.8880 > 192.168.43.124.7773: UDP, length 120
03:32:50.440260 IP 192.168.43.147.8880 > 192.168.43.124.7773: UDP, length 120
03:32:50.490258 IP 192.168.43.147.8880 > 192.168.43.124.7773: UDP, length 120
03:32:50.540257 IP 192.168.43.147.8880 > 192.168.43.124.7773: UDP, length 120
03:32:50.590257 IP 192.168.43.147.8880 > 192.168.43.124.7773: UDP, length 120
03:32:50.640256 IP 192.168.43.147.8880 > 192.168.43.124.7773: UDP, length 120
03:32:50.690257 IP 192.168.43.147.8880 > 192.168.43.124.7773: UDP, length 120
03:32:50.740262 IP 192.168.43.147.8880 > 192.168.43.124.7773: UDP, length 120
03:32:50.790258 IP 192.168.43.147.8880 > 192.168.43.124.7773: UDP, length 120
03:32:50.840260 IP 192.168.43.147.8880 > 192.168.43.124.7773: UDP, length 120
03:32:50.890257 IP 192.168.43.147.8880 > 192.168.43.124.7773: UDP, length 120
03:32:50.940256 IP 192.168.43.147.8880 > 192.168.43.124.7773: UDP, length 120
03:32:50.990256 IP 192.168.43.147.8880 > 192.168.43.124.7773: UDP, length 120
03:32:51.040256 IP 192.168.43.147.8880 > 192.168.43.124.7773: UDP, length 120
03:32:51.090257 IP 192.168.43.147.8880 > 192.168.43.124.7773: UDP, length 120
03:32:51.140256 IP 192.168.43.147.8880 > 192.168.43.124.7773: UDP, length 120
03:32:51.190257 IP 192.168.43.147.8880 > 192.168.43.124.7773: UDP, length 120
03:32:51.240257 IP 192.168.43.147.8880 > 192.168.43.124.7773: UDP, length 120
03:32:51.290257 IP 192.168.43.147.8880 > 192.168.43.124.7773: UDP, length 120
03:32:51.340256 IP 192.168.43.147.8880 > 192.168.43.124.7773: UDP, length 120
03:32:51.390257 IP 192.168.43.147.8880 > 192.168.43.124.7773: UDP, length 120
03:32:51.440256 IP 192.168.43.147.8880 > 192.168.43.124.7773: UDP, length 120
03:32:51.490257 IP 192.168.43.147.8880 > 192.168.43.124.7773: UDP, length 120
03:32:51.540257 IP 192.168.43.147.8880 > 192.168.43.124.7773: UDP, length 120
03:32:51.590295 IP 192.168.43.147.8880 > 192.168.43.124.7773: UDP, length 120
03:32:51.640263 IP 192.168.43.147.8880 > 192.168.43.124.7773: UDP, length 120
03:32:51.690257 IP 192.168.43.147.8880 > 192.168.43.124.7773: UDP, length 120
03:32:51.740257 IP 192.168.43.147.8880 > 192.168.43.124.7773: UDP, length 120
03:32:51.790259 IP 192.168.43.147.8880 > 192.168.43.124.7773: UDP, length 120
03:32:51.840274 IP 192.168.43.147.8880 > 192.168.43.124.7773: UDP, length 120
03:32:51.890286 IP 192.168.43.147.8880 > 192.168.43.124.7773: UDP, length 120
03:32:51.940284 IP 192.168.43.147.8880 > 192.168.43.124.7773: UDP, length 120
03:32:51.990283 IP 192.168.43.147.8880 > 192.168.43.124.7773: UDP, length 120
03:32:52.040282 IP 192.168.43.147.8880 > 192.168.43.124.7773: UDP, length 120
03:32:52.090282 IP 192.168.43.147.8880 > 192.168.43.124.7773: UDP, length 120
03:32:52.140280 IP 192.168.43.147.8880 > 192.168.43.124.7773: UDP, length 120
03:32:52.190281 IP 192.168.43.147.8880 > 192.168.43.124.7773: UDP, length 120
03:32:52.240287 IP 192.168.43.147.8880 > 192.168.43.124.7773: UDP, length 120
03:32:52.290282 IP 192.168.43.147.8880 > 192.168.43.124.7773: UDP, length 120
03:32:52.340283 IP 192.168.43.147.8880 > 192.168.43.124.7773: UDP, length 120
03:32:52.390282 IP 192.168.43.147.8880 > 192.168.43.124.7773: UDP, length 120
03:32:52.440281 IP 192.168.43.147.8880 > 192.168.43.124.7773: UDP, length 120
03:32:52.490282 IP 192.168.43.147.8880 > 192.168.43.124.7773: UDP, length 120
03:32:52.540282 IP 192.168.43.147.8880 > 192.168.43.124.7773: UDP, length 120
03:32:52.590282 IP 192.168.43.147.8880 > 192.168.43.124.7773: UDP, length 120
03:32:52.640295 IP 192.168.43.147.8880 > 192.168.43.124.7773: UDP, length 120
03:32:52.690287 IP 192.168.43.147.8880 > 192.168.43.124.7773: UDP, length 120
03:32:52.740282 IP 192.168.43.147.8880 > 192.168.43.124.7773: UDP, length 120
03:32:52.790283 IP 192.168.43.147.8880 > 192.168.43.124.7773: UDP, length 120
03:32:52.840349 IP 192.168.43.147.8880 > 192.168.43.124.7773: UDP, length 120
03:32:52.890350 IP 192.168.43.147.8880 > 192.168.43.124.7773: UDP, length 120
03:32:52.940343 IP 192.168.43.147.8880 > 192.168.43.124.7773: UDP, length 120
03:32:52.990317 IP 192.168.43.147.8880 > 192.168.43.124.7773: UDP, length 120
03:32:53.040335 IP 192.168.43.147.8880 > 192.168.43.124.7773: UDP, length 120
03:32:53.090333 IP 192.168.43.147.8880 > 192.168.43.124.7773: UDP, length 120
03:32:53.140332 IP 192.168.43.147.8880 > 192.168.43.124.7773: UDP, length 120
03:32:53.190358 IP 192.168.43.147.8880 > 192.168.43.124.7773: UDP, length 120
03:32:53.240352 IP 192.168.43.147.8880 > 192.168.43.124.7773: UDP, length 120
03:32:53.290309 IP 192.168.43.147.8880 > 192.168.43.124.7773: UDP, length 120
03:32:53.340263 IP 192.168.43.147.8880 > 192.168.43.124.7773: UDP, length 120
03:32:53.390257 IP 192.168.43.147.8880 > 192.168.43.124.7773: UDP, length 120
03:32:53.440256 IP 192.168.43.147.8880 > 192.168.43.124.7773: UDP, length 120
03:32:53.490257 IP 192.168.43.147.8880 > 192.168.43.124.7773: UDP, length 120
03:32:53.540257 IP 192.168.43.147.8880 > 192.168.43.124.7773: UDP, length 120
03:32:53.590255 IP 192.168.43.147.8880 > 192.168.43.124.7773: UDP, length 120
03:32:53.640256 IP 192.168.43.147.8880 > 192.168.43.124.7773: UDP, length 120
03:32:53.690257 IP 192.168.43.147.8880 > 192.168.43.124.7773: UDP, length 120
03:32:53.740257 IP 192.168.43.147.8880 > 192.168.43.124.7773: UDP, length 120
03:32:53.790257 IP 192.168.43.147.8880 > 192.168.43.124.7773: UDP, length 120
03:32:53.840266 IP 192.168.43.147.8880 > 192.168.43.124.7773: UDP, length 120
03:32:53.890269 IP 192.168.43.147.8880 > 192.168.43.124.7773: UDP, length 120
03:32:53.940260 IP 192.168.43.147.8880 > 192.168.43.124.7773: UDP, length 120
03:32:53.990257 IP 192.168.43.147.8880 > 192.168.43.124.7773: UDP, length 120
03:32:54.040258 IP 192.168.43.147.8880 > 192.168.43.124.7773: UDP, length 120
03:32:54.090258 IP 192.168.43.147.8880 > 192.168.43.124.7773: UDP, length 120
03:32:54.140258 IP 192.168.43.147.8880 > 192.168.43.124.7773: UDP, length 120
03:32:54.190258 IP 192.168.43.147.8880 > 192.168.43.124.7773: UDP, length 120
03:32:54.240257 IP 192.168.43.147.8880 > 192.168.43.124.7773: UDP, length 120
03:32:54.290256 IP 192.168.43.147.8880 > 192.168.43.124.7773: UDP, length 120
03:32:54.340256 IP 192.168.43.147.8880 > 192.168.43.124.7773: UDP, length 120
03:32:54.390257 IP 192.168.43.147.8880 > 192.168.43.124.7773: UDP, length 120
03:32:54.440257 IP 192.168.43.147.8880 > 192.168.43.124.7773: UDP, length 120
03:32:54.490257 IP 192.168.43.147.8880 > 192.168.43.124.7773: UDP, length 120
03:32:54.540256 IP 192.168.43.147.8880 > 192.168.43.124.7773: UDP, length 120
03:32:54.590294 IP 192.168.43.147.8880 > 192.168.43.124.7773: UDP, length 120
03:32:54.640262 IP 192.168.43.147.8880 > 192.168.43.124.7773: UDP, length 120
03:32:54.690258 IP 192.168.43.147.8880 > 192.168.43.124.7773: UDP, length 120
03:32:54.740258 IP 192.168.43.147.8880 > 192.168.43.124.7773: UDP, length 120
03:32:54.790256 IP 192.168.43.147.8880 > 192.168.43.124.7773: UDP, length 120
03:32:54.840257 IP 192.168.43.147.8880 > 192.168.43.124.7773: UDP, length 120
03:32:54.890257 IP 192.168.43.147.8880 > 192.168.43.124.7773: UDP, length 120
03:32:54.940258 IP 192.168.43.147.8880 > 192.168.43.124.7773: UDP, length 120
03:32:54.990259 IP 192.168.43.147.8880 > 192.168.43.124.7773: UDP, length 120
03:32:55.040258 IP 192.168.43.147.8880 > 192.168.43.124.7773: UDP, length 120
03:32:55.090257 IP 192.168.43.147.8880 > 192.168.43.124.7773: UDP, length 120
03:32:55.140257 IP 192.168.43.147.8880 > 192.168.43.124.7773: UDP, length 120
03:32:55.190256 IP 192.168.43.147.8880 > 192.168.43.124.7773: UDP, length 120
03:32:55.240256 IP 192.168.43.147.8880 > 192.168.43.124.7773: UDP, length 120
03:32:55.290256 IP 192.168.43.147.8880 > 192.168.43.124.7773: UDP, length 120
03:32:55.340256 IP 192.168.43.147.8880 > 192.168.43.124.7773: UDP, length 120
03:32:55.390256 IP 192.168.43.147.8880 > 192.168.43.124.7773: UDP, length 120
03:32:55.440258 IP 192.168.43.147.8880 > 192.168.43.124.7773: UDP, length 120
03:32:55.490258 IP 192.168.43.147.8880 > 192.168.43.124.7773: UDP, length 120
03:32:55.540258 IP 192.168.43.147.8880 > 192.168.43.124.7773: UDP, length 120
03:32:55.590258 IP 192.168.43.147.8880 > 192.168.43.124.7773: UDP, length 120
03:32:55.640258 IP 192.168.43.147.8880 > 192.168.43.124.7773: UDP, length 120
03:32:55.690257 IP 192.168.43.147.8880 > 192.168.43.124.7773: UDP, length 120
03:32:55.740257 IP 192.168.43.147.8880 > 192.168.43.124.7773: UDP, length 120
03:32:55.790258 IP 192.168.43.147.8880 > 192.168.43.124.7773: UDP, length 120
03:32:55.840261 IP 192.168.43.147.8880 > 192.168.43.124.7773: UDP, length 120
03:32:55.890258 IP 192.168.43.147.8880 > 192.168.43.124.7773: UDP, length 120
03:32:55.940257 IP 192.168.43.147.8880 > 192.168.43.124.7773: UDP, length 120
03:32:55.990257 IP 192.168.43.147.8880 > 192.168.43.124.7773: UDP, length 120
03:32:56.040262 IP 192.168.43.147.8880 > 192.168.43.124.7773: UDP, length 120
03:32:56.090293 IP 192.168.43.147.8880 > 192.168.43.124.7773: UDP, length 120
03:32:56.140263 IP 192.168.43.147.8880 > 192.168.43.124.7773: UDP, length 120
03:32:56.190259 IP 192.168.43.147.8880 > 192.168.43.124.7773: UDP, length 120
03:32:56.240258 IP 192.168.43.147.8880 > 192.168.43.124.7773: UDP, length 120
03:32:56.290256 IP 192.168.43.147.8880 > 192.168.43.124.7773: UDP, length 120
03:32:56.340256 IP 192.168.43.147.8880 > 192.168.43.124.7773: UDP, length 120
03:32:56.390256 IP 192.168.43.147.8880 > 192.168.43.124.7773: UDP, length 120
03:32:56.440256 IP 192.168.43.147.8880 > 192.168.43.124.7773: UDP, length 120
03:32:56.490256 IP 192.168.43.147.8880 > 192.168.43.124.7773: UDP, length 120
03:32:56.540257 IP 192.168.43.147.8880 > 192.168.43.124.7773: UDP, length 120
03:32:56.590257 IP 192.168.43.147.8880 > 192.168.43.124.7773: UDP, length 120
03:32:56.640257 IP 192.168.43.147.8880 > 192.168.43.124.7773: UDP, length 120
03:32:56.690256 IP 192.168.43.147.8880 > 192.168.43.124.7773: UDP, length 120
03:32:56.740256 IP 192.168.43.147.8880 > 192.168.43.124.7773: UDP, length 120
03:32:56.790256 IP 192.168.43.147.8880 > 192.168.43.124.7773: UDP, length 120
03:32:56.840256 IP 192.168.43.147.8880 > 192.168.43.124.7773: UDP, length 120
03:32:56.890280 IP 192.168.43.147.8880 > 192.168.43.124.7773: UDP, length 120
03:32:56.940283 IP 192.168.43.147.8880 > 192.168.43.124.7773: UDP, length 120
03:32:56.990281 IP 192.168.43.147.8880 > 192.168.43.124.7773: UDP, length 120
03:32:57.040284 IP 192.168.43.147.8880 > 192.168.43.124.7773: UDP, length 120
03:32:57.090282 IP 192.168.43.147.8880 > 192.168.43.124.7773: UDP, length 120
03:32:57.140282 IP 192.168.43.147.8880 > 192.168.43.124.7773: UDP, length 120
03:32:57.190280 IP 192.168.43.147.8880 > 192.168.43.124.7773: UDP, length 120
03:32:57.240283 IP 192.168.43.147.8880 > 192.168.43.124.7773: UDP, length 120
03:32:57.290280 IP 192.168.43.147.8880 > 192.168.43.124.7773: UDP, length 120
03:32:57.340281 IP 192.168.43.147.8880 > 192.168.43.124.7773: UDP, length 120
03:32:57.390280 IP 192.168.43.147.8880 > 192.168.43.124.7773: UDP, length 120
03:32:57.440282 IP 192.168.43.147.8880 > 192.168.43.124.7773: UDP, length 120
03:32:57.490281 IP 192.168.43.147.8880 > 192.168.43.124.7773: UDP, length 120
03:32:57.540281 IP 192.168.43.147.8880 > 192.168.43.124.7773: UDP, length 120
03:32:57.590331 IP 192.168.43.147.8880 > 192.168.43.124.7773: UDP, length 120
03:32:57.640314 IP 192.168.43.147.8880 > 192.168.43.124.7773: UDP, length 120
03:32:57.690286 IP 192.168.43.147.8880 > 192.168.43.124.7773: UDP, length 120
03:32:57.740283 IP 192.168.43.147.8880 > 192.168.43.124.7773: UDP, length 120
03:32:57.790282 IP 192.168.43.147.8880 > 192.168.43.124.7773: UDP, length 120
03:32:57.840292 IP 192.168.43.147.8880 > 192.168.43.124.7773: UDP, length 120
03:32:57.890287 IP 192.168.43.147.8880 > 192.168.43.124.7773: UDP, length 120
03:32:57.940284 IP 192.168.43.147.8880 > 192.168.43.124.7773: UDP, length 120
03:32:57.990281 IP 192.168.43.147.8880 > 192.168.43.124.7773: UDP, length 120
03:32:58.040281 IP 192.168.43.147.8880 > 192.168.43.124.7773: UDP, length 120
03:32:58.090281 IP 192.168.43.147.8880 > 192.168.43.124.7773: UDP, length 120
03:32:58.140281 IP 192.168.43.147.8880 > 192.168.43.124.7773: UDP, length 120
03:32:58.190283 IP 192.168.43.147.8880 > 192.168.43.124.7773: UDP, length 120
03:32:58.240284 IP 192.168.43.147.8880 > 192.168.43.124.7773: UDP, length 120
03:32:58.290371 IP 192.168.43.147.8880 > 192.168.43.124.7773: UDP, length 120
03:32:58.340430 IP 192.168.43.147.8880 > 192.168.43.124.7773: UDP, length 120
03:32:58.390339 IP 192.168.43.147.8880 > 192.168.43.124.7773: UDP, length 120
03:32:58.440335 IP 192.168.43.147.8880 > 192.168.43.124.7773: UDP, length 120
03:32:58.490402 IP 192.168.43.147.8880 > 192.168.43.124.7773: UDP, length 120
03:32:58.540343 IP 192.168.43.147.8880 > 192.168.43.124.7773: UDP, length 120
03:32:58.590321 IP 192.168.43.147.8880 > 192.168.43.124.7773: UDP, length 120
03:32:58.640368 IP 192.168.43.147.8880 > 192.168.43.124.7773: UDP, length 120
03:32:58.690338 IP 192.168.43.147.8880 > 192.168.43.124.7773: UDP, length 120
03:32:58.740343 IP 192.168.43.147.8880 > 192.168.43.124.7773: UDP, length 120
03:32:58.790295 IP 192.168.43.147.8880 > 192.168.43.124.7773: UDP, length 120
03:32:58.840274 IP 192.168.43.147.8880 > 192.168.43.124.7773: UDP, length 120
03:32:58.890260 IP 192.168.43.147.8880 > 192.168.43.124.7773: UDP, length 120
03:32:58.940258 IP 192.168.43.147.8880 > 192.168.43.124.7773: UDP, length 120
03:32:58.990258 IP 192.168.43.147.8880 > 192.168.43.124.7773: UDP, length 120
03:32:59.040258 IP 192.168.43.147.8880 > 192.168.43.124.7773: UDP, length 120
03:32:59.090294 IP 192.168.43.147.8880 > 192.168.43.124.7773: UDP, length 120
03:32:59.140266 IP 192.168.43.147.8880 > 192.168.43.124.7773: UDP, length 120
03:32:59.190263 IP 192.168.43.147.8880 > 192.168.43.124.7773: UDP, length 120
03:32:59.240215 IP 192.168.43.147.8880 > 192.168.43.124.7773: UDP, length 120
03:32:59.290256 IP 192.168.43.147.8880 > 192.168.43.124.7773: UDP, length 120
03:32:59.340256 IP 192.168.43.147.8880 > 192.168.43.124.7773: UDP, length 120
03:32:59.390258 IP 192.168.43.147.8880 > 192.168.43.124.7773: UDP, length 120
03:32:59.440257 IP 192.168.43.147.8880 > 192.168.43.124.7773: UDP, length 120
03:32:59.490257 IP 192.168.43.147.8880 > 192.168.43.124.7773: UDP, length 120
03:32:59.540256 IP 192.168.43.147.8880 > 192.168.43.124.7773: UDP, length 120
03:32:59.590256 IP 192.168.43.147.8880 > 192.168.43.124.7773: UDP, length 120
03:32:59.640257 IP 192.168.43.147.8880 > 192.168.43.124.7773: UDP, length 120
03:32:59.690257 IP 192.168.43.147.8880 > 192.168.43.124.7773: UDP, length 120
03:32:59.740257 IP 192.168.43.147.8880 > 192.168.43.124.7773: UDP, length 120
03:32:59.790256 IP 192.168.43.147.8880 > 192.168.43.124.7773: UDP, length 120
03:32:59.840259 IP 192.168.43.147.8880 > 192.168.43.124.7773: UDP, length 120
03:32:59.890257 IP 192.168.43.147.8880 > 192.168.43.124.7773: UDP, length 120
03:32:59.940258 IP 192.168.43.147.8880 > 192.168.43.124.7773: UDP, length 120
03:32:59.990257 IP 192.168.43.147.8880 > 192.168.43.124.7773: UDP, length 120
03:33:00.040257 IP 192.168.43.147.8880 > 192.168.43.124.7773: UDP, length 120
03:33:00.090256 IP 192.168.43.147.8880 > 192.168.43.124.7773: UDP, length 120
03:33:00.140259 IP 192.168.43.147.8880 > 192.168.43.124.7773: UDP, length 120
03:33:00.190257 IP 192.168.43.147.8880 > 192.168.43.124.7773: UDP, length 120
03:33:00.240257 IP 192.168.43.147.8880 > 192.168.43.124.7773: UDP, length 120
03:33:00.290258 IP 192.168.43.147.8880 > 192.168.43.124.7773: UDP, length 120
03:33:00.340258 IP 192.168.43.147.8880 > 192.168.43.124.7773: UDP, length 120
03:33:00.390257 IP 192.168.43.147.8880 > 192.168.43.124.7773: UDP, length 120
03:33:00.440254 IP 192.168.43.147.8880 > 192.168.43.124.7773: UDP, length 120
03:33:00.490258 IP 192.168.43.147.8880 > 192.168.43.124.7773: UDP, length 120
03:33:00.540257 IP 192.168.43.147.8880 > 192.168.43.124.7773: UDP, length 120
03:33:00.590290 IP 192.168.43.147.8880 > 192.168.43.124.7773: UDP, length 120
03:33:00.640270 IP 192.168.43.147.8880 > 192.168.43.124.7773: UDP, length 120
03:33:00.690258 IP 192.168.43.147.8880 > 192.168.43.124.7773: UDP, length 120
03:33:00.740258 IP 192.168.43.147.8880 > 192.168.43.124.7773: UDP, length 120
03:33:00.790257 IP 192.168.43.147.8880 > 192.168.43.124.7773: UDP, length 120
03:33:00.840263 IP 192.168.43.147.8880 > 192.168.43.124.7773: UDP, length 120
03:33:00.890259 IP 192.168.43.147.8880 > 192.168.43.124.7773: UDP, length 120
03:33:00.940258 IP 192.168.43.147.8880 > 192.168.43.124.7773: UDP, length 120
03:33:00.990257 IP 192.168.43.147.8880 > 192.168.43.124.7773: UDP, length 120
03:33:01.040296 IP 192.168.43.147.8880 > 192.168.43.124.7773: UDP, length 120
03:33:01.090259 IP 192.168.43.147.8880 > 192.168.43.124.7773: UDP, length 120
03:33:01.140258 IP 192.168.43.147.8880 > 192.168.43.124.7773: UDP, length 120
03:33:01.190262 IP 192.168.43.147.8880 > 192.168.43.124.7773: UDP, length 120
03:33:01.240258 IP 192.168.43.147.8880 > 192.168.43.124.7773: UDP, length 120
03:33:01.290257 IP 192.168.43.147.8880 > 192.168.43.124.7773: UDP, length 120
03:33:01.340258 IP 192.168.43.147.8880 > 192.168.43.124.7773: UDP, length 120
03:33:01.390258 IP 192.168.43.147.8880 > 192.168.43.124.7773: UDP, length 120
03:33:01.440257 IP 192.168.43.147.8880 > 192.168.43.124.7773: UDP, length 120
03:33:01.490256 IP 192.168.43.147.8880 > 192.168.43.124.7773: UDP, length 120
03:33:01.540256 IP 192.168.43.147.8880 > 192.168.43.124.7773: UDP, length 120
03:33:01.590256 IP 192.168.43.147.8880 > 192.168.43.124.7773: UDP, length 120
03:33:01.640258 IP 192.168.43.147.8880 > 192.168.43.124.7773: UDP, length 120
03:33:01.690258 IP 192.168.43.147.8880 > 192.168.43.124.7773: UDP, length 120
03:33:01.740258 IP 192.168.43.147.8880 > 192.168.43.124.7773: UDP, length 120
03:33:01.790257 IP 192.168.43.147.8880 > 192.168.43.124.7773: UDP, length 120
03:33:01.840257 IP 192.168.43.147.8880 > 192.168.43.124.7773: UDP, length 120
03:33:01.890281 IP 192.168.43.147.8880 > 192.168.43.124.7773: UDP, length 120
03:33:01.940283 IP 192.168.43.147.8880 > 192.168.43.124.7773: UDP, length 120
03:33:01.990284 IP 192.168.43.147.8880 > 192.168.43.124.7773: UDP, length 120
03:33:02.040283 IP 192.168.43.147.8880 > 192.168.43.124.7773: UDP, length 120
03:33:02.090331 IP 192.168.43.147.8880 > 192.168.43.124.7773: UDP, length 120
03:33:02.140293 IP 192.168.43.147.8880 > 192.168.43.124.7773: UDP, length 120
03:33:02.190282 IP 192.168.43.147.8880 > 192.168.43.124.7773: UDP, length 120
03:33:02.240282 IP 192.168.43.147.8880 > 192.168.43.124.7773: UDP, length 120
03:33:02.290281 IP 192.168.43.147.8880 > 192.168.43.124.7773: UDP, length 120
03:33:02.340247 IP 192.168.43.147.8880 > 192.168.43.124.7773: UDP, length 120
03:33:02.390287 IP 192.168.43.147.8880 > 192.168.43.124.7773: UDP, length 120
03:33:02.440281 IP 192.168.43.147.8880 > 192.168.43.124.7773: UDP, length 120
03:33:02.490280 IP 192.168.43.147.8880 > 192.168.43.124.7773: UDP, length 120
03:33:02.540281 IP 192.168.43.147.8880 > 192.168.43.124.7773: UDP, length 120
03:33:02.590281 IP 192.168.43.147.8880 > 192.168.43.124.7773: UDP, length 120
03:33:02.640284 IP 192.168.43.147.8880 > 192.168.43.124.7773: UDP, length 120
03:33:02.690282 IP 192.168.43.147.8880 > 192.168.43.124.7773: UDP, length 120
03:33:02.740281 IP 192.168.43.147.8880 > 192.168.43.124.7773: UDP, length 120
03:33:02.790281 IP 192.168.43.147.8880 > 192.168.43.124.7773: UDP, length 120
03:33:02.840287 IP 192.168.43.147.8880 > 192.168.43.124.7773: UDP, length 120
03:33:02.890284 IP 192.168.43.147.8880 > 192.168.43.124.7773: UDP, length 120
03:33:02.940284 IP 192.168.43.147.8880 > 192.168.43.124.7773: UDP, length 120
03:33:02.990283 IP 192.168.43.147.8880 > 192.168.43.124.7773: UDP, length 120
03:33:03.040282 IP 192.168.43.147.8880 > 192.168.43.124.7773: UDP, length 120
03:33:03.090282 IP 192.168.43.147.8880 > 192.168.43.124.7773: UDP, length 120
03:33:03.140283 IP 192.168.43.147.8880 > 192.168.43.124.7773: UDP, length 120
03:33:03.190282 IP 192.168.43.147.8880 > 192.168.43.124.7773: UDP, length 120
03:33:03.240281 IP 192.168.43.147.8880 > 192.168.43.124.7773: UDP, length 120
03:33:03.290281 IP 192.168.43.147.8880 > 192.168.43.124.7773: UDP, length 120
03:33:03.340282 IP 192.168.43.147.8880 > 192.168.43.124.7773: UDP, length 120
03:33:03.390287 IP 192.168.43.147.8880 > 192.168.43.124.7773: UDP, length 120
03:33:03.440283 IP 192.168.43.147.8880 > 192.168.43.124.7773: UDP, length 120
03:33:03.490282 IP 192.168.43.147.8880 > 192.168.43.124.7773: UDP, length 120
03:33:03.540281 IP 192.168.43.147.8880 > 192.168.43.124.7773: UDP, length 120
03:33:03.590325 IP 192.168.43.147.8880 > 192.168.43.124.7773: UDP, length 120
03:33:03.640293 IP 192.168.43.147.8880 > 192.168.43.124.7773: UDP, length 120
03:33:03.690283 IP 192.168.43.147.8880 > 192.168.43.124.7773: UDP, length 120
03:33:03.740286 IP 192.168.43.147.8880 > 192.168.43.124.7773: UDP, length 120
03:33:03.790381 IP 192.168.43.147.8880 > 192.168.43.124.7773: UDP, length 120
03:33:03.840404 IP 192.168.43.147.8880 > 192.168.43.124.7773: UDP, length 120
03:33:03.890345 IP 192.168.43.147.8880 > 192.168.43.124.7773: UDP, length 120
03:33:03.940329 IP 192.168.43.147.8880 > 192.168.43.124.7773: UDP, length 120
03:33:03.990341 IP 192.168.43.147.8880 > 192.168.43.124.7773: UDP, length 120
03:33:04.040322 IP 192.168.43.147.8880 > 192.168.43.124.7773: UDP, length 120
03:33:04.090342 IP 192.168.43.147.8880 > 192.168.43.124.7773: UDP, length 120
03:33:04.140371 IP 192.168.43.147.8880 > 192.168.43.124.7773: UDP, length 120
03:33:04.190350 IP 192.168.43.147.8880 > 192.168.43.124.7773: UDP, length 120
03:33:04.240311 IP 192.168.43.147.8880 > 192.168.43.124.7773: UDP, length 120
03:33:04.290260 IP 192.168.43.147.8880 > 192.168.43.124.7773: UDP, length 120
03:33:04.340258 IP 192.168.43.147.8880 > 192.168.43.124.7773: UDP, length 120
03:33:04.390257 IP 192.168.43.147.8880 > 192.168.43.124.7773: UDP, length 120
03:33:04.440260 IP 192.168.43.147.8880 > 192.168.43.124.7773: UDP, length 120
03:33:04.490259 IP 192.168.43.147.8880 > 192.168.43.124.7773: UDP, length 120
03:33:04.540258 IP 192.168.43.147.8880 > 192.168.43.124.7773: UDP, length 120
03:33:04.590258 IP 192.168.43.147.8880 > 192.168.43.124.7773: UDP, length 120
03:33:04.640258 IP 192.168.43.147.8880 > 192.168.43.124.7773: UDP, length 120
03:33:04.690257 IP 192.168.43.147.8880 > 192.168.43.124.7773: UDP, length 120
03:33:04.740257 IP 192.168.43.147.8880 > 192.168.43.124.7773: UDP, length 120
03:33:04.790256 IP 192.168.43.147.8880 > 192.168.43.124.7773: UDP, length 120
03:33:04.840258 IP 192.168.43.147.8880 > 192.168.43.124.7773: UDP, length 120
03:33:04.890261 IP 192.168.43.147.8880 > 192.168.43.124.7773: UDP, length 120
03:33:04.940258 IP 192.168.43.147.8880 > 192.168.43.124.7773: UDP, length 120
03:33:04.990258 IP 192.168.43.147.8880 > 192.168.43.124.7773: UDP, length 120
03:33:05.040258 IP 192.168.43.147.8880 > 192.168.43.124.7773: UDP, length 120
03:33:05.090296 IP 192.168.43.147.8880 > 192.168.43.124.7773: UDP, length 120
03:33:05.140271 IP 192.168.43.147.8880 > 192.168.43.124.7773: UDP, length 120
03:33:05.190262 IP 192.168.43.147.8880 > 192.168.43.124.7773: UDP, length 120
03:33:05.240258 IP 192.168.43.147.8880 > 192.168.43.124.7773: UDP, length 120
03:33:05.290260 IP 192.168.43.147.8880 > 192.168.43.124.7773: UDP, length 120
03:33:05.340261 IP 192.168.43.147.8880 > 192.168.43.124.7773: UDP, length 120
03:33:05.390258 IP 192.168.43.147.8880 > 192.168.43.124.7773: UDP, length 120
03:33:05.440257 IP 192.168.43.147.8880 > 192.168.43.124.7773: UDP, length 120
03:33:05.490259 IP 192.168.43.147.8880 > 192.168.43.124.7773: UDP, length 120
03:33:05.540259 IP 192.168.43.147.8880 > 192.168.43.124.7773: UDP, length 120
03:33:05.590259 IP 192.168.43.147.8880 > 192.168.43.124.7773: UDP, length 120
03:33:05.640258 IP 192.168.43.147.8880 > 192.168.43.124.7773: UDP, length 120
03:33:05.690259 IP 192.168.43.147.8880 > 192.168.43.124.7773: UDP, length 120
03:33:05.740258 IP 192.168.43.147.8880 > 192.168.43.124.7773: UDP, length 120
03:33:05.790258 IP 192.168.43.147.8880 > 192.168.43.124.7773: UDP, length 120
03:33:05.840259 IP 192.168.43.147.8880 > 192.168.43.124.7773: UDP, length 120
03:33:05.890264 IP 192.168.43.147.8880 > 192.168.43.124.7773: UDP, length 120
03:33:05.940258 IP 192.168.43.147.8880 > 192.168.43.124.7773: UDP, length 120
03:33:05.990257 IP 192.168.43.147.8880 > 192.168.43.124.7773: UDP, length 120
03:33:06.040265 IP 192.168.43.147.8880 > 192.168.43.124.7773: UDP, length 120
03:33:06.090260 IP 192.168.43.147.8880 > 192.168.43.124.7773: UDP, length 120
03:33:06.140259 IP 192.168.43.147.8880 > 192.168.43.124.7773: UDP, length 120
03:33:06.190257 IP 192.168.43.147.8880 > 192.168.43.124.7773: UDP, length 120
03:33:06.200097 IP 192.168.43.124.8880 > 192.168.43.147.7772: UDP, length 120
03:33:06.240258 IP 192.168.43.147.8880 > 192.168.43.124.7773: UDP, length 120
03:33:06.252200 IP 192.168.43.124.8880 > 192.168.43.147.7772: UDP, length 120
03:33:06.290258 IP 192.168.43.147.8880 > 192.168.43.124.7773: UDP, length 120
03:33:06.306304 IP 192.168.43.124.8880 > 192.168.43.147.7772: UDP, length 120
03:33:06.340259 IP 192.168.43.147.8880 > 192.168.43.124.7773: UDP, length 120
03:33:06.353480 IP 192.168.43.124.8880 > 192.168.43.147.7772: UDP, length 120
03:33:06.390257 IP 192.168.43.147.8880 > 192.168.43.124.7773: UDP, length 120
03:33:06.399922 IP 192.168.43.124.8880 > 192.168.43.147.7772: UDP, length 120
03:33:06.440257 IP 192.168.43.147.8880 > 192.168.43.124.7773: UDP, length 120
03:33:06.451708 IP 192.168.43.124.8880 > 192.168.43.147.7772: UDP, length 120
03:33:06.490257 IP 192.168.43.147.8880 > 192.168.43.124.7773: UDP, length 120
03:33:06.500203 IP 192.168.43.124.8880 > 192.168.43.147.7772: UDP, length 120
03:33:06.540262 IP 192.168.43.147.8880 > 192.168.43.124.7773: UDP, length 120
03:33:06.556856 IP 192.168.43.124.8880 > 192.168.43.147.7772: UDP, length 120
03:33:06.590302 IP 192.168.43.147.8880 > 192.168.43.124.7773: UDP, length 120
03:33:06.602194 IP 192.168.43.124.8880 > 192.168.43.147.7772: UDP, length 120
03:33:06.640274 IP 192.168.43.147.8880 > 192.168.43.124.7773: UDP, length 120
03:33:06.651779 IP 192.168.43.124.8880 > 192.168.43.147.7772: UDP, length 120
03:33:06.690259 IP 192.168.43.147.8880 > 192.168.43.124.7773: UDP, length 120
03:33:06.701969 IP 192.168.43.124.8880 > 192.168.43.147.7772: UDP, length 120
03:33:06.740258 IP 192.168.43.147.8880 > 192.168.43.124.7773: UDP, length 120
03:33:06.751734 IP 192.168.43.124.8880 > 192.168.43.147.7772: UDP, length 120
03:33:06.790258 IP 192.168.43.147.8880 > 192.168.43.124.7773: UDP, length 120
03:33:06.803321 IP 192.168.43.124.8880 > 192.168.43.147.7772: UDP, length 120
03:33:06.840262 IP 192.168.43.147.8880 > 192.168.43.124.7773: UDP, length 120
03:33:06.853217 IP 192.168.43.124.8880 > 192.168.43.147.7772: UDP, length 120
03:33:06.890285 IP 192.168.43.147.8880 > 192.168.43.124.7773: UDP, length 120
03:33:06.902043 IP 192.168.43.124.8880 > 192.168.43.147.7772: UDP, length 120
03:33:06.940285 IP 192.168.43.147.8880 > 192.168.43.124.7773: UDP, length 120
03:33:06.981273 IP 192.168.43.124.8880 > 192.168.43.147.7772: UDP, length 120
03:33:06.990285 IP 192.168.43.147.8880 > 192.168.43.124.7773: UDP, length 120
03:33:07.003654 IP 192.168.43.124.8880 > 192.168.43.147.7772: UDP, length 120
03:33:07.040283 IP 192.168.43.147.8880 > 192.168.43.124.7773: UDP, length 120
03:33:07.052233 IP 192.168.43.124.8880 > 192.168.43.147.7772: UDP, length 120
03:33:07.090284 IP 192.168.43.147.8880 > 192.168.43.124.7773: UDP, length 120
03:33:07.103525 IP 192.168.43.124.8880 > 192.168.43.147.7772: UDP, length 120
03:33:07.140284 IP 192.168.43.147.8880 > 192.168.43.124.7773: UDP, length 120
03:33:07.152895 IP 192.168.43.124.8880 > 192.168.43.147.7772: UDP, length 120
03:33:07.204973 IP 192.168.43.124.8880 > 192.168.43.147.7772: UDP, length 120
03:33:07.256323 IP 192.168.43.124.8880 > 192.168.43.147.7772: UDP, length 120
03:33:07.304932 IP 192.168.43.124.8880 > 192.168.43.147.7772: UDP, length 120
03:33:07.355356 IP 192.168.43.124.8880 > 192.168.43.147.7772: UDP, length 120
03:33:07.405142 IP 192.168.43.124.8880 > 192.168.43.147.7772: UDP, length 120
03:33:07.455583 IP 192.168.43.124.8880 > 192.168.43.147.7772: UDP, length 120
03:33:07.505173 IP 192.168.43.124.8880 > 192.168.43.147.7772: UDP, length 120
03:33:07.553272 IP 192.168.43.124.8880 > 192.168.43.147.7772: UDP, length 120
03:33:07.605172 IP 192.168.43.124.8880 > 192.168.43.147.7772: UDP, length 120
03:33:07.655164 IP 192.168.43.124.8880 > 192.168.43.147.7772: UDP, length 120
03:33:07.705334 IP 192.168.43.124.8880 > 192.168.43.147.7772: UDP, length 120
03:33:07.755181 IP 192.168.43.124.8880 > 192.168.43.147.7772: UDP, length 120
03:33:07.805192 IP 192.168.43.124.8880 > 192.168.43.147.7772: UDP, length 120
03:33:07.855243 IP 192.168.43.124.8880 > 192.168.43.147.7772: UDP, length 120
03:33:07.905264 IP 192.168.43.124.8880 > 192.168.43.147.7772: UDP, length 120
03:33:07.957744 IP 192.168.43.124.8880 > 192.168.43.147.7772: UDP, length 120
03:33:08.005722 IP 192.168.43.124.8880 > 192.168.43.147.7772: UDP, length 120
03:33:08.059529 IP 192.168.43.124.8880 > 192.168.43.147.7772: UDP, length 120
03:33:08.107342 IP 192.168.43.124.8880 > 192.168.43.147.7772: UDP, length 120
03:33:08.155749 IP 192.168.43.124.8880 > 192.168.43.147.7772: UDP, length 120
03:33:08.207641 IP 192.168.43.124.8880 > 192.168.43.147.7772: UDP, length 120
03:33:08.255233 IP 192.168.43.124.8880 > 192.168.43.147.7772: UDP, length 120
03:33:08.306479 IP 192.168.43.124.8880 > 192.168.43.147.7772: UDP, length 120
03:33:08.355238 IP 192.168.43.124.8880 > 192.168.43.147.7772: UDP, length 120
03:33:08.406623 IP 192.168.43.124.8880 > 192.168.43.147.7772: UDP, length 120
03:33:08.453684 IP 192.168.43.124.8880 > 192.168.43.147.7772: UDP, length 120
03:33:08.515734 IP 192.168.43.124.8880 > 192.168.43.147.7772: UDP, length 120
03:33:08.553355 IP 192.168.43.124.8880 > 192.168.43.147.7772: UDP, length 120
03:33:08.604732 IP 192.168.43.124.8880 > 192.168.43.147.7772: UDP, length 120
03:33:08.653813 IP 192.168.43.124.8880 > 192.168.43.147.7772: UDP, length 120
03:33:08.713556 IP 192.168.43.124.8880 > 192.168.43.147.7772: UDP, length 120
03:33:08.753456 IP 192.168.43.124.8880 > 192.168.43.147.7772: UDP, length 120
03:33:08.803743 IP 192.168.43.124.8880 > 192.168.43.147.7772: UDP, length 120
03:33:08.853465 IP 192.168.43.124.8880 > 192.168.43.147.7772: UDP, length 120
03:33:08.913444 IP 192.168.43.124.8880 > 192.168.43.147.7772: UDP, length 120
03:33:08.955224 IP 192.168.43.124.8880 > 192.168.43.147.7772: UDP, length 120
03:33:09.004641 IP 192.168.43.124.8880 > 192.168.43.147.7772: UDP, length 120
03:33:09.053382 IP 192.168.43.124.8880 > 192.168.43.147.7772: UDP, length 120
03:33:09.110419 IP 192.168.43.124.8880 > 192.168.43.147.7772: UDP, length 120
03:33:09.154779 IP 192.168.43.124.8880 > 192.168.43.147.7772: UDP, length 120
03:33:09.203428 IP 192.168.43.124.8880 > 192.168.43.147.7772: UDP, length 120
03:33:09.296919 IP 192.168.43.124.8880 > 192.168.43.147.7772: UDP, length 120
03:33:09.300538 IP 192.168.43.124.8880 > 192.168.43.147.7772: UDP, length 120
03:33:09.353675 IP 192.168.43.124.8880 > 192.168.43.147.7772: UDP, length 120
03:33:09.404739 IP 192.168.43.124.8880 > 192.168.43.147.7772: UDP, length 120
03:33:09.464879 IP 192.168.43.124.8880 > 192.168.43.147.7772: UDP, length 120
03:33:09.504289 IP 192.168.43.124.8880 > 192.168.43.147.7772: UDP, length 120
03:33:09.553610 IP 192.168.43.124.8880 > 192.168.43.147.7772: UDP, length 120
03:33:09.600566 IP 192.168.43.124.8880 > 192.168.43.147.7772: UDP, length 120
03:33:09.650421 IP 192.168.43.124.8880 > 192.168.43.147.7772: UDP, length 120
03:33:09.703790 IP 192.168.43.124.8880 > 192.168.43.147.7772: UDP, length 120
03:33:09.753514 IP 192.168.43.124.8880 > 192.168.43.147.7772: UDP, length 120
03:33:09.813595 IP 192.168.43.124.8880 > 192.168.43.147.7772: UDP, length 120
03:33:09.853670 IP 192.168.43.124.8880 > 192.168.43.147.7772: UDP, length 120
03:33:09.903451 IP 192.168.43.124.8880 > 192.168.43.147.7772: UDP, length 120
03:33:09.953562 IP 192.168.43.124.8880 > 192.168.43.147.7772: UDP, length 120
03:33:10.015563 IP 192.168.43.124.8880 > 192.168.43.147.7772: UDP, length 120
03:33:10.053832 IP 192.168.43.124.8880 > 192.168.43.147.7772: UDP, length 120
03:33:10.107630 IP 192.168.43.124.8880 > 192.168.43.147.7772: UDP, length 120
03:33:10.155654 IP 192.168.43.124.8880 > 192.168.43.147.7772: UDP, length 120
03:33:10.210620 IP 192.168.43.124.8880 > 192.168.43.147.7772: UDP, length 120
03:33:10.253729 IP 192.168.43.124.8880 > 192.168.43.147.7772: UDP, length 120
03:33:10.303501 IP 192.168.43.124.8880 > 192.168.43.147.7772: UDP, length 120
03:33:10.353968 IP 192.168.43.124.8880 > 192.168.43.147.7772: UDP, length 120
03:33:10.413281 IP 192.168.43.124.8880 > 192.168.43.147.7772: UDP, length 120
03:33:10.453939 IP 192.168.43.124.8880 > 192.168.43.147.7772: UDP, length 120
03:33:10.503839 IP 192.168.43.124.8880 > 192.168.43.147.7772: UDP, length 120
03:33:10.555240 IP 192.168.43.124.8880 > 192.168.43.147.7772: UDP, length 120
03:33:10.613732 IP 192.168.43.124.8880 > 192.168.43.147.7772: UDP, length 120
03:33:10.660113 IP 192.168.43.124.8880 > 192.168.43.147.7772: UDP, length 120
03:33:10.703784 IP 192.168.43.124.8880 > 192.168.43.147.7772: UDP, length 120
03:33:10.778523 IP 192.168.43.124.8880 > 192.168.43.147.7772: UDP, length 120
03:33:10.813398 IP 192.168.43.124.8880 > 192.168.43.147.7772: UDP, length 120
03:33:10.853759 IP 192.168.43.124.8880 > 192.168.43.147.7772: UDP, length 120
03:33:10.903737 IP 192.168.43.124.8880 > 192.168.43.147.7772: UDP, length 120
03:33:10.960915 IP 192.168.43.124.8880 > 192.168.43.147.7772: UDP, length 120
03:33:11.003758 IP 192.168.43.124.8880 > 192.168.43.147.7772: UDP, length 120
03:33:11.053544 IP 192.168.43.124.8880 > 192.168.43.147.7772: UDP, length 120
03:33:11.114967 IP 192.168.43.124.8880 > 192.168.43.147.7772: UDP, length 120
03:33:11.153821 IP 192.168.43.124.8880 > 192.168.43.147.7772: UDP, length 120
03:33:11.203720 IP 192.168.43.124.8880 > 192.168.43.147.7772: UDP, length 120
03:33:11.253768 IP 192.168.43.124.8880 > 192.168.43.147.7772: UDP, length 120
03:33:11.306259 IP 192.168.43.124.8880 > 192.168.43.147.7772: UDP, length 120
03:33:11.353746 IP 192.168.43.124.8880 > 192.168.43.147.7772: UDP, length 120
03:33:11.403684 IP 192.168.43.124.8880 > 192.168.43.147.7772: UDP, length 120
03:33:11.463658 IP 192.168.43.124.8880 > 192.168.43.147.7772: UDP, length 120
03:33:11.504032 IP 192.168.43.124.8880 > 192.168.43.147.7772: UDP, length 120
03:33:11.554985 IP 192.168.43.124.8880 > 192.168.43.147.7772: UDP, length 120
03:33:11.603817 IP 192.168.43.124.8880 > 192.168.43.147.7772: UDP, length 120
03:33:11.664308 IP 192.168.43.124.8880 > 192.168.43.147.7772: UDP, length 120
03:33:11.704130 IP 192.168.43.124.8880 > 192.168.43.147.7772: UDP, length 120
03:33:11.753970 IP 192.168.43.124.8880 > 192.168.43.147.7772: UDP, length 120
03:33:11.803785 IP 192.168.43.124.8880 > 192.168.43.147.7772: UDP, length 120
03:33:11.863784 IP 192.168.43.124.8880 > 192.168.43.147.7772: UDP, length 120
03:33:11.904016 IP 192.168.43.124.8880 > 192.168.43.147.7772: UDP, length 120
03:33:11.953734 IP 192.168.43.124.8880 > 192.168.43.147.7772: UDP, length 120
03:33:12.011001 IP 192.168.43.124.8880 > 192.168.43.147.7772: UDP, length 120
03:33:12.054061 IP 192.168.43.124.8880 > 192.168.43.147.7772: UDP, length 120
03:33:12.104164 IP 192.168.43.124.8880 > 192.168.43.147.7772: UDP, length 120
03:33:12.156195 IP 192.168.43.124.8880 > 192.168.43.147.7772: UDP, length 120
03:33:12.213129 IP 192.168.43.124.8880 > 192.168.43.147.7772: UDP, length 120
03:33:12.253956 IP 192.168.43.124.8880 > 192.168.43.147.7772: UDP, length 120
03:33:12.304749 IP 192.168.43.124.8880 > 192.168.43.147.7772: UDP, length 120
03:33:12.354915 IP 192.168.43.124.8880 > 192.168.43.147.7772: UDP, length 120
03:33:12.413283 IP 192.168.43.124.8880 > 192.168.43.147.7772: UDP, length 120
03:33:12.454114 IP 192.168.43.124.8880 > 192.168.43.147.7772: UDP, length 120
03:33:12.503930 IP 192.168.43.124.8880 > 192.168.43.147.7772: UDP, length 120
03:33:12.553995 IP 192.168.43.124.8880 > 192.168.43.147.7772: UDP, length 120
03:33:12.614897 IP 192.168.43.124.8880 > 192.168.43.147.7772: UDP, length 120
03:33:12.654301 IP 192.168.43.124.8880 > 192.168.43.147.7772: UDP, length 120
03:33:12.705787 IP 192.168.43.124.8880 > 192.168.43.147.7772: UDP, length 120
03:33:12.754011 IP 192.168.43.124.8880 > 192.168.43.147.7772: UDP, length 120
03:33:12.813807 IP 192.168.43.124.8880 > 192.168.43.147.7772: UDP, length 120
03:33:12.854194 IP 192.168.43.124.8880 > 192.168.43.147.7772: UDP, length 120
03:33:12.905984 IP 192.168.43.124.8880 > 192.168.43.147.7772: UDP, length 120
03:33:12.954949 IP 192.168.43.124.8880 > 192.168.43.147.7772: UDP, length 120
03:33:13.014121 IP 192.168.43.124.8880 > 192.168.43.147.7772: UDP, length 120
03:33:13.054057 IP 192.168.43.124.8880 > 192.168.43.147.7772: UDP, length 120
03:33:13.104685 IP 192.168.43.124.8880 > 192.168.43.147.7772: UDP, length 120
03:33:13.154134 IP 192.168.43.124.8880 > 192.168.43.147.7772: UDP, length 120
03:33:13.221116 IP 192.168.43.124.8880 > 192.168.43.147.7772: UDP, length 120
03:33:13.255955 IP 192.168.43.124.8880 > 192.168.43.147.7772: UDP, length 120
03:33:13.305706 IP 192.168.43.124.8880 > 192.168.43.147.7772: UDP, length 120
03:33:13.395291 IP 192.168.43.124.8880 > 192.168.43.147.7772: UDP, length 120
03:33:13.401411 IP 192.168.43.124.8880 > 192.168.43.147.7772: UDP, length 120
03:33:13.456057 IP 192.168.43.124.8880 > 192.168.43.147.7772: UDP, length 120
03:33:13.507282 IP 192.168.43.124.8880 > 192.168.43.147.7772: UDP, length 120
03:33:13.563604 IP 192.168.43.124.8880 > 192.168.43.147.7772: UDP, length 120
03:33:13.604245 IP 192.168.43.124.8880 > 192.168.43.147.7772: UDP, length 120
03:33:13.654418 IP 192.168.43.124.8880 > 192.168.43.147.7772: UDP, length 120
03:33:13.705657 IP 192.168.43.124.8880 > 192.168.43.147.7772: UDP, length 120
03:33:13.764145 IP 192.168.43.124.8880 > 192.168.43.147.7772: UDP, length 120
03:33:13.804964 IP 192.168.43.124.8880 > 192.168.43.147.7772: UDP, length 120
03:33:13.853979 IP 192.168.43.124.8880 > 192.168.43.147.7772: UDP, length 120
03:33:13.915103 IP 192.168.43.124.8880 > 192.168.43.147.7772: UDP, length 120
03:33:13.954051 IP 192.168.43.124.8880 > 192.168.43.147.7772: UDP, length 120
03:33:14.003944 IP 192.168.43.124.8880 > 192.168.43.147.7772: UDP, length 120
03:33:14.072996 IP 192.168.43.124.8880 > 192.168.43.147.7772: UDP, length 120
03:33:14.104329 IP 192.168.43.124.8880 > 192.168.43.147.7772: UDP, length 120
03:33:14.154396 IP 192.168.43.124.8880 > 192.168.43.147.7772: UDP, length 120
03:33:14.206042 IP 192.168.43.124.8880 > 192.168.43.147.7772: UDP, length 120
03:33:14.261096 IP 192.168.43.124.8880 > 192.168.43.147.7772: UDP, length 120
03:33:14.304508 IP 192.168.43.124.8880 > 192.168.43.147.7772: UDP, length 120
03:33:14.354045 IP 192.168.43.124.8880 > 192.168.43.147.7772: UDP, length 120
03:33:14.424799 IP 192.168.43.124.8880 > 192.168.43.147.7772: UDP, length 120
03:33:14.455786 IP 192.168.43.124.8880 > 192.168.43.147.7772: UDP, length 120
03:33:14.505666 IP 192.168.43.124.8880 > 192.168.43.147.7772: UDP, length 120
03:33:14.554118 IP 192.168.43.124.8880 > 192.168.43.147.7772: UDP, length 120
03:33:14.611468 IP 192.168.43.124.8880 > 192.168.43.147.7772: UDP, length 120
03:33:14.654499 IP 192.168.43.124.8880 > 192.168.43.147.7772: UDP, length 120
03:33:14.704154 IP 192.168.43.124.8880 > 192.168.43.147.7772: UDP, length 120
03:33:14.763159 IP 192.168.43.124.8880 > 192.168.43.147.7772: UDP, length 120
03:33:14.801225 IP 192.168.43.124.8880 > 192.168.43.147.7772: UDP, length 120
03:33:14.856014 IP 192.168.43.124.8880 > 192.168.43.147.7772: UDP, length 120
03:33:14.924221 IP 192.168.43.124.8880 > 192.168.43.147.7772: UDP, length 120
03:33:14.954233 IP 192.168.43.124.8880 > 192.168.43.147.7772: UDP, length 120
03:33:15.004419 IP 192.168.43.124.8880 > 192.168.43.147.7772: UDP, length 120
03:33:15.053199 IP 192.168.43.124.8880 > 192.168.43.147.7772: UDP, length 120
03:33:15.104853 IP 192.168.43.124.8880 > 192.168.43.147.7772: UDP, length 120
03:33:15.154223 IP 192.168.43.124.8880 > 192.168.43.147.7772: UDP, length 120
03:33:15.204001 IP 192.168.43.124.8880 > 192.168.43.147.7772: UDP, length 120
03:33:15.260769 IP 192.168.43.124.8880 > 192.168.43.147.7772: UDP, length 120
03:33:15.301194 IP 192.168.43.124.8880 > 192.168.43.147.7772: UDP, length 120
03:33:15.354087 IP 192.168.43.124.8880 > 192.168.43.147.7772: UDP, length 120
03:33:15.415676 IP 192.168.43.124.8880 > 192.168.43.147.7772: UDP, length 120
03:33:15.456189 IP 192.168.43.124.8880 > 192.168.43.147.7772: UDP, length 120
03:33:15.504467 IP 192.168.43.124.8880 > 192.168.43.147.7772: UDP, length 120
03:33:15.554162 IP 192.168.43.124.8880 > 192.168.43.147.7772: UDP, length 120
03:33:15.616460 IP 192.168.43.124.8880 > 192.168.43.147.7772: UDP, length 120
03:33:15.654300 IP 192.168.43.124.8880 > 192.168.43.147.7772: UDP, length 120
03:33:15.704567 IP 192.168.43.124.8880 > 192.168.43.147.7772: UDP, length 120
03:33:15.754158 IP 192.168.43.124.8880 > 192.168.43.147.7772: UDP, length 120
03:33:15.814140 IP 192.168.43.124.8880 > 192.168.43.147.7772: UDP, length 120
03:33:15.855975 IP 192.168.43.124.8880 > 192.168.43.147.7772: UDP, length 120
03:33:15.904494 IP 192.168.43.124.8880 > 192.168.43.147.7772: UDP, length 120
03:33:15.955090 IP 192.168.43.124.8880 > 192.168.43.147.7772: UDP, length 120
03:33:16.015336 IP 192.168.43.124.8880 > 192.168.43.147.7772: UDP, length 120
03:33:16.054292 IP 192.168.43.124.8880 > 192.168.43.147.7772: UDP, length 120
03:33:16.104097 IP 192.168.43.124.8880 > 192.168.43.147.7772: UDP, length 120
03:33:16.154677 IP 192.168.43.124.8880 > 192.168.43.147.7772: UDP, length 120
03:33:16.214301 IP 192.168.43.124.8880 > 192.168.43.147.7772: UDP, length 120
03:33:16.255806 IP 192.168.43.124.8880 > 192.168.43.147.7772: UDP, length 120
03:33:16.304428 IP 192.168.43.124.8880 > 192.168.43.147.7772: UDP, length 120
03:33:16.354279 IP 192.168.43.124.8880 > 192.168.43.147.7772: UDP, length 120
03:33:16.414290 IP 192.168.43.124.8880 > 192.168.43.147.7772: UDP, length 120
03:33:16.454771 IP 192.168.43.124.8880 > 192.168.43.147.7772: UDP, length 120
03:33:16.504650 IP 192.168.43.124.8880 > 192.168.43.147.7772: UDP, length 120
03:33:16.554274 IP 192.168.43.124.8880 > 192.168.43.147.7772: UDP, length 120
03:33:16.615595 IP 192.168.43.124.8880 > 192.168.43.147.7772: UDP, length 120
03:33:16.655511 IP 192.168.43.124.8880 > 192.168.43.147.7772: UDP, length 120
03:33:16.706988 IP 192.168.43.124.8880 > 192.168.43.147.7772: UDP, length 120
03:33:16.754237 IP 192.168.43.124.8880 > 192.168.43.147.7772: UDP, length 120
03:33:16.814345 IP 192.168.43.124.8880 > 192.168.43.147.7772: UDP, length 120
03:33:16.854788 IP 192.168.43.124.8880 > 192.168.43.147.7772: UDP, length 120
03:33:16.904806 IP 192.168.43.124.8880 > 192.168.43.147.7772: UDP, length 120
03:33:16.954442 IP 192.168.43.124.8880 > 192.168.43.147.7772: UDP, length 120
03:33:17.014502 IP 192.168.43.124.8880 > 192.168.43.147.7772: UDP, length 120
03:33:17.054806 IP 192.168.43.124.8880 > 192.168.43.147.7772: UDP, length 120
03:33:17.105131 IP 192.168.43.124.8880 > 192.168.43.147.7772: UDP, length 120
03:33:17.154455 IP 192.168.43.124.8880 > 192.168.43.147.7772: UDP, length 120
03:33:17.221110 IP 192.168.43.124.8880 > 192.168.43.147.7772: UDP, length 120
03:33:17.254566 IP 192.168.43.124.8880 > 192.168.43.147.7772: UDP, length 120
03:33:17.304755 IP 192.168.43.124.8880 > 192.168.43.147.7772: UDP, length 120
03:33:17.354501 IP 192.168.43.124.8880 > 192.168.43.147.7772: UDP, length 120
03:33:17.414788 IP 192.168.43.124.8880 > 192.168.43.147.7772: UDP, length 120
03:33:17.454733 IP 192.168.43.124.8880 > 192.168.43.147.7772: UDP, length 120
03:33:17.505417 IP 192.168.43.124.8880 > 192.168.43.147.7772: UDP, length 120
03:33:17.556459 IP 192.168.43.124.8880 > 192.168.43.147.7772: UDP, length 120
03:33:17.604915 IP 192.168.43.124.8880 > 192.168.43.147.7772: UDP, length 120
03:33:17.664263 IP 192.168.43.124.8880 > 192.168.43.147.7772: UDP, length 120
03:33:17.704532 IP 192.168.43.124.8880 > 192.168.43.147.7772: UDP, length 120
03:33:17.757706 IP 192.168.43.124.8880 > 192.168.43.147.7772: UDP, length 120
03:33:17.811952 IP 192.168.43.124.8880 > 192.168.43.147.7772: UDP, length 120
03:33:17.854610 IP 192.168.43.124.8880 > 192.168.43.147.7772: UDP, length 120
03:33:17.904596 IP 192.168.43.124.8880 > 192.168.43.147.7772: UDP, length 120
03:33:17.968840 IP 192.168.43.124.8880 > 192.168.43.147.7772: UDP, length 120
03:33:18.004347 IP 192.168.43.124.8880 > 192.168.43.147.7772: UDP, length 120
03:33:18.055323 IP 192.168.43.124.8880 > 192.168.43.147.7772: UDP, length 120
03:33:18.105908 IP 192.168.43.124.8880 > 192.168.43.147.7772: UDP, length 120
03:33:18.166028 IP 192.168.43.124.8880 > 192.168.43.147.7772: UDP, length 120
03:33:18.204963 IP 192.168.43.124.8880 > 192.168.43.147.7772: UDP, length 120
03:33:18.254839 IP 192.168.43.124.8880 > 192.168.43.147.7772: UDP, length 120
03:33:18.310095 IP 192.168.43.124.8880 > 192.168.43.147.7772: UDP, length 120
03:33:18.354746 IP 192.168.43.124.8880 > 192.168.43.147.7772: UDP, length 120
03:33:18.414231 IP 192.168.43.124.8880 > 192.168.43.147.7772: UDP, length 120
03:33:18.455241 IP 192.168.43.124.8880 > 192.168.43.147.7772: UDP, length 120
03:33:18.504715 IP 192.168.43.124.8880 > 192.168.43.147.7772: UDP, length 120
03:33:18.578233 IP 192.168.43.124.8880 > 192.168.43.147.7772: UDP, length 120
03:33:18.605410 IP 192.168.43.124.8880 > 192.168.43.147.7772: UDP, length 120
03:33:18.654916 IP 192.168.43.124.8880 > 192.168.43.147.7772: UDP, length 120
03:33:18.704884 IP 192.168.43.124.8880 > 192.168.43.147.7772: UDP, length 120
03:33:18.766019 IP 192.168.43.124.8880 > 192.168.43.147.7772: UDP, length 120
03:33:18.806333 IP 192.168.43.124.8880 > 192.168.43.147.7772: UDP, length 120
03:33:18.854710 IP 192.168.43.124.8880 > 192.168.43.147.7772: UDP, length 120
03:33:18.965549 IP 192.168.43.124.8880 > 192.168.43.147.7772: UDP, length 120
03:33:18.965667 IP 192.168.43.124.8880 > 192.168.43.147.7772: UDP, length 120
03:33:19.005148 IP 192.168.43.124.8880 > 192.168.43.147.7772: UDP, length 120
03:33:19.054976 IP 192.168.43.124.8880 > 192.168.43.147.7772: UDP, length 120
03:33:19.104820 IP 192.168.43.124.8880 > 192.168.43.147.7772: UDP, length 120
03:33:19.168412 IP 192.168.43.124.8880 > 192.168.43.147.7772: UDP, length 120
03:33:19.205274 IP 192.168.43.124.8880 > 192.168.43.147.7772: UDP, length 120
03:33:19.254957 IP 192.168.43.124.8880 > 192.168.43.147.7772: UDP, length 120
03:33:19.304692 IP 192.168.43.124.8880 > 192.168.43.147.7772: UDP, length 120
03:33:19.357341 IP 192.168.43.124.8880 > 192.168.43.147.7772: UDP, length 120
03:33:19.405937 IP 192.168.43.124.8880 > 192.168.43.147.7772: UDP, length 120
03:33:19.465774 IP 192.168.43.124.8880 > 192.168.43.147.7772: UDP, length 120
03:33:19.505015 IP 192.168.43.124.8880 > 192.168.43.147.7772: UDP, length 120
03:33:19.555389 IP 192.168.43.124.8880 > 192.168.43.147.7772: UDP, length 120
03:33:19.604235 IP 192.168.43.124.8880 > 192.168.43.147.7772: UDP, length 120
03:33:19.665735 IP 192.168.43.124.8880 > 192.168.43.147.7772: UDP, length 120
03:33:19.707814 IP 192.168.43.124.8880 > 192.168.43.147.7772: UDP, length 120
03:33:19.760997 IP 192.168.43.124.8880 > 192.168.43.147.7772: UDP, length 120
03:33:19.804975 IP 192.168.43.124.8880 > 192.168.43.147.7772: UDP, length 120
03:33:19.868539 IP 192.168.43.124.8880 > 192.168.43.147.7772: UDP, length 120
03:33:19.906483 IP 192.168.43.124.8880 > 192.168.43.147.7772: UDP, length 120
03:33:19.955058 IP 192.168.43.124.8880 > 192.168.43.147.7772: UDP, length 120
03:33:20.004899 IP 192.168.43.124.8880 > 192.168.43.147.7772: UDP, length 120
03:33:20.066953 IP 192.168.43.124.8880 > 192.168.43.147.7772: UDP, length 120
03:33:20.105661 IP 192.168.43.124.8880 > 192.168.43.147.7772: UDP, length 120
03:33:20.154721 IP 192.168.43.124.8880 > 192.168.43.147.7772: UDP, length 120
03:33:20.204997 IP 192.168.43.124.8880 > 192.168.43.147.7772: UDP, length 120
03:33:20.263234 IP 192.168.43.124.8880 > 192.168.43.147.7772: UDP, length 120
03:33:20.305002 IP 192.168.43.124.8880 > 192.168.43.147.7772: UDP, length 120
03:33:20.357386 IP 192.168.43.124.8880 > 192.168.43.147.7772: UDP, length 120
03:33:20.405077 IP 192.168.43.124.8880 > 192.168.43.147.7772: UDP, length 120
03:33:20.465579 IP 192.168.43.124.8880 > 192.168.43.147.7772: UDP, length 120
03:33:20.502033 IP 192.168.43.124.8880 > 192.168.43.147.7772: UDP, length 120
03:33:20.551673 IP 192.168.43.124.8880 > 192.168.43.147.7772: UDP, length 120
03:33:20.665631 IP 192.168.43.124.8880 > 192.168.43.147.7772: UDP, length 120
03:33:20.665797 IP 192.168.43.124.8880 > 192.168.43.147.7772: UDP, length 120
03:33:20.705126 IP 192.168.43.124.8880 > 192.168.43.147.7772: UDP, length 120
03:33:20.755546 IP 192.168.43.124.8880 > 192.168.43.147.7772: UDP, length 120
03:33:20.866004 IP 192.168.43.124.8880 > 192.168.43.147.7772: UDP, length 120
03:33:20.866085 IP 192.168.43.124.8880 > 192.168.43.147.7772: UDP, length 120
03:33:20.906717 IP 192.168.43.124.8880 > 192.168.43.147.7772: UDP, length 120
03:33:20.956293 IP 192.168.43.124.8880 > 192.168.43.147.7772: UDP, length 120
03:33:21.004922 IP 192.168.43.124.8880 > 192.168.43.147.7772: UDP, length 120
03:33:21.065878 IP 192.168.43.124.8880 > 192.168.43.147.7772: UDP, length 120
03:33:21.105174 IP 192.168.43.124.8880 > 192.168.43.147.7772: UDP, length 120
03:33:21.154760 IP 192.168.43.124.8880 > 192.168.43.147.7772: UDP, length 120
03:33:21.231524 IP 192.168.43.124.8880 > 192.168.43.147.7772: UDP, length 120
03:33:21.254936 IP 192.168.43.124.8880 > 192.168.43.147.7772: UDP, length 120
03:33:21.306210 IP 192.168.43.124.8880 > 192.168.43.147.7772: UDP, length 120
03:33:21.355003 IP 192.168.43.124.8880 > 192.168.43.147.7772: UDP, length 120
03:33:21.417331 IP 192.168.43.124.8880 > 192.168.43.147.7772: UDP, length 120
03:33:21.455108 IP 192.168.43.124.8880 > 192.168.43.147.7772: UDP, length 120
03:33:21.507347 IP 192.168.43.124.8880 > 192.168.43.147.7772: UDP, length 120
03:33:21.581893 IP 192.168.43.124.8880 > 192.168.43.147.7772: UDP, length 120
03:33:21.604983 IP 192.168.43.124.8880 > 192.168.43.147.7772: UDP, length 120
03:33:21.655204 IP 192.168.43.124.8880 > 192.168.43.147.7772: UDP, length 120
03:33:21.705235 IP 192.168.43.124.8880 > 192.168.43.147.7772: UDP, length 120
03:33:21.765824 IP 192.168.43.124.8880 > 192.168.43.147.7772: UDP, length 120
03:33:21.805096 IP 192.168.43.124.8880 > 192.168.43.147.7772: UDP, length 120
03:33:21.857086 IP 192.168.43.124.8880 > 192.168.43.147.7772: UDP, length 120
03:33:21.905398 IP 192.168.43.124.8880 > 192.168.43.147.7772: UDP, length 120
03:33:21.966543 IP 192.168.43.124.8880 > 192.168.43.147.7772: UDP, length 120
03:33:22.005489 IP 192.168.43.124.8880 > 192.168.43.147.7772: UDP, length 120
03:33:22.057104 IP 192.168.43.124.8880 > 192.168.43.147.7772: UDP, length 120
03:33:22.105313 IP 192.168.43.124.8880 > 192.168.43.147.7772: UDP, length 120
03:33:22.165798 IP 192.168.43.124.8880 > 192.168.43.147.7772: UDP, length 120
03:33:22.206540 IP 192.168.43.124.8880 > 192.168.43.147.7772: UDP, length 120
03:33:22.255098 IP 192.168.43.124.8880 > 192.168.43.147.7772: UDP, length 120
03:33:22.305968 IP 192.168.43.124.8880 > 192.168.43.147.7772: UDP, length 120
03:33:22.355380 IP 192.168.43.124.8880 > 192.168.43.147.7772: UDP, length 120
03:33:22.411016 IP 192.168.43.124.8880 > 192.168.43.147.7772: UDP, length 120
03:33:22.466707 IP 192.168.43.124.8880 > 192.168.43.147.7772: UDP, length 120
03:33:22.505454 IP 192.168.43.124.8880 > 192.168.43.147.7772: UDP, length 120
03:33:22.555140 IP 192.168.43.124.8880 > 192.168.43.147.7772: UDP, length 120
03:33:22.668937 IP 192.168.43.124.8880 > 192.168.43.147.7772: UDP, length 120
03:33:22.669189 IP 192.168.43.124.8880 > 192.168.43.147.7772: UDP, length 120
03:33:22.705487 IP 192.168.43.124.8880 > 192.168.43.147.7772: UDP, length 120
03:33:22.755249 IP 192.168.43.124.8880 > 192.168.43.147.7772: UDP, length 120
03:33:22.805274 IP 192.168.43.124.8880 > 192.168.43.147.7772: UDP, length 120
03:33:22.866456 IP 192.168.43.124.8880 > 192.168.43.147.7772: UDP, length 120
03:33:22.906723 IP 192.168.43.124.8880 > 192.168.43.147.7772: UDP, length 120
03:33:22.955313 IP 192.168.43.124.8880 > 192.168.43.147.7772: UDP, length 120
03:33:23.005338 IP 192.168.43.124.8880 > 192.168.43.147.7772: UDP, length 120
03:33:23.068263 IP 192.168.43.124.8880 > 192.168.43.147.7772: UDP, length 120
03:33:23.107343 IP 192.168.43.124.8880 > 192.168.43.147.7772: UDP, length 120
03:33:23.155265 IP 192.168.43.124.8880 > 192.168.43.147.7772: UDP, length 120
03:33:23.205266 IP 192.168.43.124.8880 > 192.168.43.147.7772: UDP, length 120
03:33:23.266291 IP 192.168.43.124.8880 > 192.168.43.147.7772: UDP, length 120
03:33:23.305549 IP 192.168.43.124.8880 > 192.168.43.147.7772: UDP, length 120
03:33:23.356412 IP 192.168.43.124.8880 > 192.168.43.147.7772: UDP, length 120
03:33:23.405403 IP 192.168.43.124.8880 > 192.168.43.147.7772: UDP, length 120
03:33:23.467099 IP 192.168.43.124.8880 > 192.168.43.147.7772: UDP, length 120
03:33:23.505619 IP 192.168.43.124.8880 > 192.168.43.147.7772: UDP, length 120
03:33:23.555480 IP 192.168.43.124.8880 > 192.168.43.147.7772: UDP, length 120
03:33:23.636928 IP 192.168.43.124.8880 > 192.168.43.147.7772: UDP, length 120
03:33:23.654921 IP 192.168.43.124.8880 > 192.168.43.147.7772: UDP, length 120
03:33:23.705787 IP 192.168.43.124.8880 > 192.168.43.147.7772: UDP, length 120
03:33:23.755224 IP 192.168.43.124.8880 > 192.168.43.147.7772: UDP, length 120
03:33:23.816311 IP 192.168.43.124.8880 > 192.168.43.147.7772: UDP, length 120
03:33:23.855298 IP 192.168.43.124.8880 > 192.168.43.147.7772: UDP, length 120
03:33:23.905987 IP 192.168.43.124.8880 > 192.168.43.147.7772: UDP, length 120
03:33:23.955467 IP 192.168.43.124.8880 > 192.168.43.147.7772: UDP, length 120
03:33:24.018090 IP 192.168.43.124.8880 > 192.168.43.147.7772: UDP, length 120
03:33:24.055470 IP 192.168.43.124.8880 > 192.168.43.147.7772: UDP, length 120
03:33:24.105571 IP 192.168.43.124.8880 > 192.168.43.147.7772: UDP, length 120
03:33:24.155418 IP 192.168.43.124.8880 > 192.168.43.147.7772: UDP, length 120
03:33:24.216378 IP 192.168.43.124.8880 > 192.168.43.147.7772: UDP, length 120
03:33:24.255499 IP 192.168.43.124.8880 > 192.168.43.147.7772: UDP, length 120
03:33:24.305487 IP 192.168.43.124.8880 > 192.168.43.147.7772: UDP, length 120
03:33:24.374198 IP 192.168.43.124.8880 > 192.168.43.147.7772: UDP, length 120
03:33:24.405582 IP 192.168.43.124.8880 > 192.168.43.147.7772: UDP, length 120
03:33:24.459101 IP 192.168.43.124.8880 > 192.168.43.147.7772: UDP, length 120
03:33:24.505676 IP 192.168.43.124.8880 > 192.168.43.147.7772: UDP, length 120
03:33:24.567396 IP 192.168.43.124.8880 > 192.168.43.147.7772: UDP, length 120
03:33:24.605822 IP 192.168.43.124.8880 > 192.168.43.147.7772: UDP, length 120
03:33:24.655773 IP 192.168.43.124.8880 > 192.168.43.147.7772: UDP, length 120
03:33:24.705502 IP 192.168.43.124.8880 > 192.168.43.147.7772: UDP, length 120
03:33:24.766575 IP 192.168.43.124.8880 > 192.168.43.147.7772: UDP, length 120
03:33:24.805619 IP 192.168.43.124.8880 > 192.168.43.147.7772: UDP, length 120
03:33:24.855378 IP 192.168.43.124.8880 > 192.168.43.147.7772: UDP, length 120
03:33:24.905508 IP 192.168.43.124.8880 > 192.168.43.147.7772: UDP, length 120
03:33:24.966399 IP 192.168.43.124.8880 > 192.168.43.147.7772: UDP, length 120
03:33:25.005728 IP 192.168.43.124.8880 > 192.168.43.147.7772: UDP, length 120
03:33:25.056457 IP 192.168.43.124.8880 > 192.168.43.147.7772: UDP, length 120
03:33:25.105510 IP 192.168.43.124.8880 > 192.168.43.147.7772: UDP, length 120
03:33:25.166389 IP 192.168.43.124.8880 > 192.168.43.147.7772: UDP, length 120
03:33:25.207842 IP 192.168.43.124.8880 > 192.168.43.147.7772: UDP, length 120
03:33:25.257497 IP 192.168.43.124.8880 > 192.168.43.147.7772: UDP, length 120
03:33:25.306115 IP 192.168.43.124.8880 > 192.168.43.147.7772: UDP, length 120
03:33:25.355405 IP 192.168.43.124.8880 > 192.168.43.147.7772: UDP, length 120
03:33:25.415367 IP 192.168.43.124.8880 > 192.168.43.147.7772: UDP, length 120
03:33:25.455362 IP 192.168.43.124.8880 > 192.168.43.147.7772: UDP, length 120
03:33:25.505747 IP 192.168.43.124.8880 > 192.168.43.147.7772: UDP, length 120
03:33:25.555570 IP 192.168.43.124.8880 > 192.168.43.147.7772: UDP, length 120
03:33:25.619886 IP 192.168.43.124.8880 > 192.168.43.147.7772: UDP, length 120
03:33:25.656086 IP 192.168.43.124.8880 > 192.168.43.147.7772: UDP, length 120
03:33:25.706080 IP 192.168.43.124.8880 > 192.168.43.147.7772: UDP, length 120
03:33:25.752290 IP 192.168.43.124.8880 > 192.168.43.147.7772: UDP, length 120
03:33:25.818354 IP 192.168.43.124.8880 > 192.168.43.147.7772: UDP, length 120
03:33:25.855661 IP 192.168.43.124.8880 > 192.168.43.147.7772: UDP, length 120
03:33:25.905403 IP 192.168.43.124.8880 > 192.168.43.147.7772: UDP, length 120
03:33:25.955463 IP 192.168.43.124.8880 > 192.168.43.147.7772: UDP, length 120
03:33:26.005473 IP 192.168.43.124.8880 > 192.168.43.147.7772: UDP, length 120
03:33:26.056500 IP 192.168.43.124.8880 > 192.168.43.147.7772: UDP, length 120
03:33:26.106186 IP 192.168.43.124.8880 > 192.168.43.147.7772: UDP, length 120
03:33:26.172635 IP 192.168.43.124.8880 > 192.168.43.147.7772: UDP, length 120
03:33:26.205595 IP 192.168.43.124.8880 > 192.168.43.147.7772: UDP, length 120
03:33:26.255883 IP 192.168.43.124.8880 > 192.168.43.147.7772: UDP, length 120
03:33:26.307496 IP 192.168.43.124.8880 > 192.168.43.147.7772: UDP, length 120
03:33:26.355530 IP 192.168.43.124.8880 > 192.168.43.147.7772: UDP, length 120
03:33:26.415393 IP 192.168.43.124.8880 > 192.168.43.147.7772: UDP, length 120
03:33:26.452634 IP 192.168.43.124.8880 > 192.168.43.147.7772: UDP, length 120
03:33:26.505857 IP 192.168.43.124.8880 > 192.168.43.147.7772: UDP, length 120
03:33:26.562601 IP 192.168.43.124.8880 > 192.168.43.147.7772: UDP, length 120
03:33:26.605447 IP 192.168.43.124.8880 > 192.168.43.147.7772: UDP, length 120
03:33:26.656629 IP 192.168.43.124.8880 > 192.168.43.147.7772: UDP, length 120
03:33:26.714375 IP 192.168.43.124.8880 > 192.168.43.147.7772: UDP, length 120
03:33:26.755453 IP 192.168.43.124.8880 > 192.168.43.147.7772: UDP, length 120
03:33:26.805307 IP 192.168.43.124.8880 > 192.168.43.147.7772: UDP, length 120
03:33:26.871598 IP 192.168.43.124.8880 > 192.168.43.147.7772: UDP, length 120
03:33:26.905665 IP 192.168.43.124.8880 > 192.168.43.147.7772: UDP, length 120
03:33:26.955726 IP 192.168.43.124.8880 > 192.168.43.147.7772: UDP, length 120
03:33:27.005534 IP 192.168.43.124.8880 > 192.168.43.147.7772: UDP, length 120
03:33:27.065507 IP 192.168.43.124.8880 > 192.168.43.147.7772: UDP, length 120
03:33:27.105800 IP 192.168.43.124.8880 > 192.168.43.147.7772: UDP, length 120
03:33:27.155727 IP 192.168.43.124.8880 > 192.168.43.147.7772: UDP, length 120
03:33:27.206863 IP 192.168.43.124.8880 > 192.168.43.147.7772: UDP, length 120
03:33:27.265951 IP 192.168.43.124.8880 > 192.168.43.147.7772: UDP, length 120
03:33:27.305510 IP 192.168.43.124.8880 > 192.168.43.147.7772: UDP, length 120
03:33:27.357993 IP 192.168.43.124.8880 > 192.168.43.147.7772: UDP, length 120
03:33:27.407347 IP 192.168.43.124.8880 > 192.168.43.147.7772: UDP, length 120
03:33:27.465577 IP 192.168.43.124.8880 > 192.168.43.147.7772: UDP, length 120
03:33:27.505754 IP 192.168.43.124.8880 > 192.168.43.147.7772: UDP, length 120
03:33:27.555867 IP 192.168.43.124.8880 > 192.168.43.147.7772: UDP, length 120
03:33:27.612506 IP 192.168.43.124.8880 > 192.168.43.147.7772: UDP, length 120
03:33:27.656372 IP 192.168.43.124.8880 > 192.168.43.147.7772: UDP, length 120
03:33:27.705609 IP 192.168.43.124.8880 > 192.168.43.147.7772: UDP, length 120
03:33:27.763718 IP 192.168.43.124.8880 > 192.168.43.147.7772: UDP, length 120
03:33:27.805691 IP 192.168.43.124.8880 > 192.168.43.147.7772: UDP, length 120
03:33:27.856283 IP 192.168.43.124.8880 > 192.168.43.147.7772: UDP, length 120
03:33:27.923396 IP 192.168.43.124.8880 > 192.168.43.147.7772: UDP, length 120
03:33:27.958532 IP 192.168.43.124.8880 > 192.168.43.147.7772: UDP, length 120
03:33:28.006225 IP 192.168.43.124.8880 > 192.168.43.147.7772: UDP, length 120
03:33:28.061098 IP 192.168.43.124.8880 > 192.168.43.147.7772: UDP, length 120
03:33:28.115596 IP 192.168.43.124.8880 > 192.168.43.147.7772: UDP, length 120
03:33:28.155664 IP 192.168.43.124.8880 > 192.168.43.147.7772: UDP, length 120
03:33:28.206282 IP 192.168.43.124.8880 > 192.168.43.147.7772: UDP, length 120
03:33:28.255974 IP 192.168.43.124.8880 > 192.168.43.147.7772: UDP, length 120
03:33:28.310109 IP 192.168.43.124.8880 > 192.168.43.147.7772: UDP, length 120
03:33:28.355789 IP 192.168.43.124.8880 > 192.168.43.147.7772: UDP, length 120
03:33:28.406255 IP 192.168.43.124.8880 > 192.168.43.147.7772: UDP, length 120
03:33:28.465247 IP 192.168.43.124.8880 > 192.168.43.147.7772: UDP, length 120
03:33:28.508357 IP 192.168.43.124.8880 > 192.168.43.147.7772: UDP, length 120
03:33:28.556902 IP 192.168.43.124.8880 > 192.168.43.147.7772: UDP, length 120
03:33:28.613489 IP 192.168.43.124.8880 > 192.168.43.147.7772: UDP, length 120
03:33:28.656319 IP 192.168.43.124.8880 > 192.168.43.147.7772: UDP, length 120
03:33:28.705524 IP 192.168.43.124.8880 > 192.168.43.147.7772: UDP, length 120
03:33:28.770119 IP 192.168.43.124.8880 > 192.168.43.147.7772: UDP, length 120
03:33:28.805788 IP 192.168.43.124.8880 > 192.168.43.147.7772: UDP, length 120
03:33:28.857437 IP 192.168.43.124.8880 > 192.168.43.147.7772: UDP, length 120
03:33:28.905715 IP 192.168.43.124.8880 > 192.168.43.147.7772: UDP, length 120
03:33:28.966716 IP 192.168.43.124.8880 > 192.168.43.147.7772: UDP, length 120
03:33:29.006084 IP 192.168.43.124.8880 > 192.168.43.147.7772: UDP, length 120
03:33:29.055889 IP 192.168.43.124.8880 > 192.168.43.147.7772: UDP, length 120
03:33:29.105782 IP 192.168.43.124.8880 > 192.168.43.147.7772: UDP, length 120
03:33:29.165401 IP 192.168.43.124.8880 > 192.168.43.147.7772: UDP, length 120
03:33:29.205977 IP 192.168.43.124.8880 > 192.168.43.147.7772: UDP, length 120
03:33:29.256035 IP 192.168.43.124.8880 > 192.168.43.147.7772: UDP, length 120
03:33:29.304903 IP 192.168.43.124.8880 > 192.168.43.147.7772: UDP, length 120
03:33:29.357727 IP 192.168.43.124.8880 > 192.168.43.147.7772: UDP, length 120
03:33:29.415548 IP 192.168.43.124.8880 > 192.168.43.147.7772: UDP, length 120
03:33:29.456584 IP 192.168.43.124.8880 > 192.168.43.147.7772: UDP, length 120
03:33:29.505741 IP 192.168.43.124.8880 > 192.168.43.147.7772: UDP, length 120
03:33:29.557642 IP 192.168.43.124.8880 > 192.168.43.147.7772: UDP, length 120
03:33:29.615747 IP 192.168.43.124.8880 > 192.168.43.147.7772: UDP, length 120
03:33:29.655962 IP 192.168.43.124.8880 > 192.168.43.147.7772: UDP, length 120
03:33:29.706484 IP 192.168.43.124.8880 > 192.168.43.147.7772: UDP, length 120
03:33:29.755772 IP 192.168.43.124.8880 > 192.168.43.147.7772: UDP, length 120
03:33:29.817118 IP 192.168.43.124.8880 > 192.168.43.147.7772: UDP, length 120
03:33:29.856122 IP 192.168.43.124.8880 > 192.168.43.147.7772: UDP, length 120
03:33:29.908639 IP 192.168.43.124.8880 > 192.168.43.147.7772: UDP, length 120
03:33:29.956549 IP 192.168.43.124.8880 > 192.168.43.147.7772: UDP, length 120
03:33:30.023887 IP 192.168.43.124.8880 > 192.168.43.147.7772: UDP, length 120
03:33:30.055882 IP 192.168.43.124.8880 > 192.168.43.147.7772: UDP, length 120
03:33:30.109670 IP 192.168.43.124.8880 > 192.168.43.147.7772: UDP, length 120
03:33:30.155960 IP 192.168.43.124.8880 > 192.168.43.147.7772: UDP, length 120
03:33:30.218054 IP 192.168.43.124.8880 > 192.168.43.147.7772: UDP, length 120
03:33:30.256126 IP 192.168.43.124.8880 > 192.168.43.147.7772: UDP, length 120
03:33:30.306212 IP 192.168.43.124.8880 > 192.168.43.147.7772: UDP, length 120
03:33:30.356748 IP 192.168.43.124.8880 > 192.168.43.147.7772: UDP, length 120
03:33:30.418508 IP 192.168.43.124.8880 > 192.168.43.147.7772: UDP, length 120
03:33:30.459153 IP 192.168.43.124.8880 > 192.168.43.147.7772: UDP, length 120
03:33:30.506048 IP 192.168.43.124.8880 > 192.168.43.147.7772: UDP, length 120
03:33:30.556782 IP 192.168.43.124.8880 > 192.168.43.147.7772: UDP, length 120
03:33:30.617268 IP 192.168.43.124.8880 > 192.168.43.147.7772: UDP, length 120
03:33:30.656219 IP 192.168.43.124.8880 > 192.168.43.147.7772: UDP, length 120
03:33:30.706092 IP 192.168.43.124.8880 > 192.168.43.147.7772: UDP, length 120
03:33:30.755926 IP 192.168.43.124.8880 > 192.168.43.147.7772: UDP, length 120
03:33:30.816610 IP 192.168.43.124.8880 > 192.168.43.147.7772: UDP, length 120
03:33:30.856087 IP 192.168.43.124.8880 > 192.168.43.147.7772: UDP, length 120
03:33:30.906235 IP 192.168.43.124.8880 > 192.168.43.147.7772: UDP, length 120
03:33:30.955916 IP 192.168.43.124.8880 > 192.168.43.147.7772: UDP, length 120
03:33:31.016871 IP 192.168.43.124.8880 > 192.168.43.147.7772: UDP, length 120
03:33:31.056442 IP 192.168.43.124.8880 > 192.168.43.147.7772: UDP, length 120
03:33:31.106168 IP 192.168.43.124.8880 > 192.168.43.147.7772: UDP, length 120
03:33:31.155915 IP 192.168.43.124.8880 > 192.168.43.147.7772: UDP, length 120
