23:57:56.373390 IP 192.168.43.124.8880 > 192.168.43.146.7771: UDP, length 120
23:57:56.422893 IP 192.168.43.124.8880 > 192.168.43.146.7771: UDP, length 120
23:57:56.470676 IP 192.168.43.124.8880 > 192.168.43.146.7771: UDP, length 120
23:57:56.524462 IP 192.168.43.124.8880 > 192.168.43.146.7771: UDP, length 120
23:57:56.574355 IP 192.168.43.124.8880 > 192.168.43.146.7771: UDP, length 120
23:57:56.623477 IP 192.168.43.124.8880 > 192.168.43.146.7771: UDP, length 120
23:57:56.671962 IP 192.168.43.124.8880 > 192.168.43.146.7771: UDP, length 120
23:57:56.715955 IP 192.168.43.146.8880 > 192.168.43.147.7772: UDP, length 120
23:57:56.725057 IP 192.168.43.124.8880 > 192.168.43.146.7771: UDP, length 120
23:57:56.766074 IP 192.168.43.146.8880 > 192.168.43.147.7772: UDP, length 120
23:57:56.785820 IP 192.168.43.124.8880 > 192.168.43.146.7771: UDP, length 120
23:57:56.816017 IP 192.168.43.146.8880 > 192.168.43.147.7772: UDP, length 120
23:57:56.865990 IP 192.168.43.146.8880 > 192.168.43.147.7772: UDP, length 120
23:57:56.915989 IP 192.168.43.146.8880 > 192.168.43.147.7772: UDP, length 120
23:57:56.965986 IP 192.168.43.146.8880 > 192.168.43.147.7772: UDP, length 120
23:57:56.969034 IP 192.168.43.124.8880 > 192.168.43.146.7771: UDP, length 120
23:57:56.969128 IP 192.168.43.124.8880 > 192.168.43.146.7771: UDP, length 120
23:57:57.015998 IP 192.168.43.146.8880 > 192.168.43.147.7772: UDP, length 120
23:57:57.065984 IP 192.168.43.146.8880 > 192.168.43.147.7772: UDP, length 120
23:57:57.069240 IP 192.168.43.124.8880 > 192.168.43.146.7771: UDP, length 120
23:57:57.069474 IP 192.168.43.124.8880 > 192.168.43.146.7771: UDP, length 120
23:57:57.115989 IP 192.168.43.146.8880 > 192.168.43.147.7772: UDP, length 120
23:57:57.165759 IP 192.168.43.124.8880 > 192.168.43.146.7771: UDP, length 120
23:57:57.165833 IP 192.168.43.124.8880 > 192.168.43.146.7771: UDP, length 120
23:57:57.165985 IP 192.168.43.146.8880 > 192.168.43.147.7772: UDP, length 120
23:57:57.215984 IP 192.168.43.146.8880 > 192.168.43.147.7772: UDP, length 120
23:57:57.265983 IP 192.168.43.146.8880 > 192.168.43.147.7772: UDP, length 120
23:57:57.268845 IP 192.168.43.124.8880 > 192.168.43.146.7771: UDP, length 120
23:57:57.268987 IP 192.168.43.124.8880 > 192.168.43.146.7771: UDP, length 120
23:57:57.316002 IP 192.168.43.146.8880 > 192.168.43.147.7772: UDP, length 120
23:57:57.365986 IP 192.168.43.146.8880 > 192.168.43.147.7772: UDP, length 120
23:57:57.369225 IP 192.168.43.124.8880 > 192.168.43.146.7771: UDP, length 120
23:57:57.369513 IP 192.168.43.124.8880 > 192.168.43.146.7771: UDP, length 120
23:57:57.416002 IP 192.168.43.146.8880 > 192.168.43.147.7772: UDP, length 120
23:57:57.465985 IP 192.168.43.146.8880 > 192.168.43.147.7772: UDP, length 120
23:57:57.467637 IP 192.168.43.124.8880 > 192.168.43.146.7771: UDP, length 120
23:57:57.468389 IP 192.168.43.124.8880 > 192.168.43.146.7771: UDP, length 120
23:57:57.516000 IP 192.168.43.146.8880 > 192.168.43.147.7772: UDP, length 120
23:57:57.565825 IP 192.168.43.124.8880 > 192.168.43.146.7771: UDP, length 120
23:57:57.566035 IP 192.168.43.146.8880 > 192.168.43.147.7772: UDP, length 120
23:57:57.566199 IP 192.168.43.124.8880 > 192.168.43.146.7771: UDP, length 120
23:57:57.616044 IP 192.168.43.146.8880 > 192.168.43.147.7772: UDP, length 120
23:57:57.666013 IP 192.168.43.146.8880 > 192.168.43.147.7772: UDP, length 120
23:57:57.666141 IP 192.168.43.124.8880 > 192.168.43.146.7771: UDP, length 120
23:57:57.666888 IP 192.168.43.124.8880 > 192.168.43.146.7771: UDP, length 120
23:57:57.716048 IP 192.168.43.146.8880 > 192.168.43.147.7772: UDP, length 120
23:57:57.765119 IP 192.168.43.124.8880 > 192.168.43.146.7771: UDP, length 120
23:57:57.765741 IP 192.168.43.124.8880 > 192.168.43.146.7771: UDP, length 120
23:57:57.766070 IP 192.168.43.146.8880 > 192.168.43.147.7772: UDP, length 120
23:57:57.816030 IP 192.168.43.146.8880 > 192.168.43.147.7772: UDP, length 120
23:57:57.866016 IP 192.168.43.146.8880 > 192.168.43.147.7772: UDP, length 120
23:57:57.866724 IP 192.168.43.124.8880 > 192.168.43.146.7771: UDP, length 120
23:57:57.867621 IP 192.168.43.124.8880 > 192.168.43.146.7771: UDP, length 120
23:57:57.869533 IP 192.168.43.124.8880 > 192.168.43.146.7771: UDP, length 120
23:57:57.916043 IP 192.168.43.146.8880 > 192.168.43.147.7772: UDP, length 120
23:57:57.920800 IP 192.168.43.124.8880 > 192.168.43.146.7771: UDP, length 120
23:57:57.966038 IP 192.168.43.146.8880 > 192.168.43.147.7772: UDP, length 120
23:57:57.969463 IP 192.168.43.124.8880 > 192.168.43.146.7771: UDP, length 120
23:57:58.016040 IP 192.168.43.146.8880 > 192.168.43.147.7772: UDP, length 120
23:57:58.022205 IP 192.168.43.124.8880 > 192.168.43.146.7771: UDP, length 120
23:57:58.066038 IP 192.168.43.146.8880 > 192.168.43.147.7772: UDP, length 120
23:57:58.071458 IP 192.168.43.124.8880 > 192.168.43.146.7771: UDP, length 120
23:57:58.116066 IP 192.168.43.146.8880 > 192.168.43.147.7772: UDP, length 120
23:57:58.123506 IP 192.168.43.124.8880 > 192.168.43.146.7771: UDP, length 120
23:57:58.166037 IP 192.168.43.146.8880 > 192.168.43.147.7772: UDP, length 120
23:57:58.169103 IP 192.168.43.124.8880 > 192.168.43.146.7771: UDP, length 120
23:57:58.216028 IP 192.168.43.146.8880 > 192.168.43.147.7772: UDP, length 120
23:57:58.220689 IP 192.168.43.124.8880 > 192.168.43.146.7771: UDP, length 120
23:57:58.266019 IP 192.168.43.146.8880 > 192.168.43.147.7772: UDP, length 120
23:57:58.269446 IP 192.168.43.124.8880 > 192.168.43.146.7771: UDP, length 120
23:57:58.316016 IP 192.168.43.146.8880 > 192.168.43.147.7772: UDP, length 120
23:57:58.320678 IP 192.168.43.124.8880 > 192.168.43.146.7771: UDP, length 120
23:57:58.366013 IP 192.168.43.146.8880 > 192.168.43.147.7772: UDP, length 120
23:57:58.370390 IP 192.168.43.124.8880 > 192.168.43.146.7771: UDP, length 120
23:57:58.416015 IP 192.168.43.146.8880 > 192.168.43.147.7772: UDP, length 120
23:57:58.420408 IP 192.168.43.124.8880 > 192.168.43.146.7771: UDP, length 120
23:57:58.466014 IP 192.168.43.146.8880 > 192.168.43.147.7772: UDP, length 120
23:57:58.472444 IP 192.168.43.124.8880 > 192.168.43.146.7771: UDP, length 120
23:57:58.516008 IP 192.168.43.146.8880 > 192.168.43.147.7772: UDP, length 120
23:57:58.520712 IP 192.168.43.124.8880 > 192.168.43.146.7771: UDP, length 120
23:57:58.566079 IP 192.168.43.146.8880 > 192.168.43.147.7772: UDP, length 120
23:57:58.570748 IP 192.168.43.124.8880 > 192.168.43.146.7771: UDP, length 120
23:57:58.616079 IP 192.168.43.146.8880 > 192.168.43.147.7772: UDP, length 120
23:57:58.620723 IP 192.168.43.124.8880 > 192.168.43.146.7771: UDP, length 120
23:57:58.666032 IP 192.168.43.146.8880 > 192.168.43.147.7772: UDP, length 120
23:57:58.670792 IP 192.168.43.124.8880 > 192.168.43.146.7771: UDP, length 120
23:57:58.716028 IP 192.168.43.146.8880 > 192.168.43.147.7772: UDP, length 120
23:57:58.720703 IP 192.168.43.124.8880 > 192.168.43.146.7771: UDP, length 120
23:57:58.766044 IP 192.168.43.146.8880 > 192.168.43.147.7772: UDP, length 120
23:57:58.770942 IP 192.168.43.124.8880 > 192.168.43.146.7771: UDP, length 120
23:57:58.816014 IP 192.168.43.146.8880 > 192.168.43.147.7772: UDP, length 120
23:57:58.822390 IP 192.168.43.124.8880 > 192.168.43.146.7771: UDP, length 120
23:57:58.866011 IP 192.168.43.146.8880 > 192.168.43.147.7772: UDP, length 120
23:57:58.871182 IP 192.168.43.124.8880 > 192.168.43.146.7771: UDP, length 120
23:57:58.916020 IP 192.168.43.146.8880 > 192.168.43.147.7772: UDP, length 120
23:57:58.925684 IP 192.168.43.124.8880 > 192.168.43.146.7771: UDP, length 120
23:57:58.966031 IP 192.168.43.146.8880 > 192.168.43.147.7772: UDP, length 120
23:57:58.970847 IP 192.168.43.124.8880 > 192.168.43.146.7771: UDP, length 120
23:57:59.016028 IP 192.168.43.146.8880 > 192.168.43.147.7772: UDP, length 120
23:57:59.021066 IP 192.168.43.124.8880 > 192.168.43.146.7771: UDP, length 120
23:57:59.066019 IP 192.168.43.146.8880 > 192.168.43.147.7772: UDP, length 120
23:57:59.070719 IP 192.168.43.124.8880 > 192.168.43.146.7771: UDP, length 120
23:57:59.116038 IP 192.168.43.146.8880 > 192.168.43.147.7772: UDP, length 120
23:57:59.120797 IP 192.168.43.124.8880 > 192.168.43.146.7771: UDP, length 120
23:57:59.166014 IP 192.168.43.146.8880 > 192.168.43.147.7772: UDP, length 120
23:57:59.170830 IP 192.168.43.124.8880 > 192.168.43.146.7771: UDP, length 120
23:57:59.216009 IP 192.168.43.146.8880 > 192.168.43.147.7772: UDP, length 120
23:57:59.220811 IP 192.168.43.124.8880 > 192.168.43.146.7771: UDP, length 120
23:57:59.266008 IP 192.168.43.146.8880 > 192.168.43.147.7772: UDP, length 120
23:57:59.271149 IP 192.168.43.124.8880 > 192.168.43.146.7771: UDP, length 120
23:57:59.316025 IP 192.168.43.146.8880 > 192.168.43.147.7772: UDP, length 120
23:57:59.321350 IP 192.168.43.124.8880 > 192.168.43.146.7771: UDP, length 120
23:57:59.366018 IP 192.168.43.146.8880 > 192.168.43.147.7772: UDP, length 120
23:57:59.371770 IP 192.168.43.124.8880 > 192.168.43.146.7771: UDP, length 120
23:57:59.416022 IP 192.168.43.146.8880 > 192.168.43.147.7772: UDP, length 120
23:57:59.419399 IP 192.168.43.124.8880 > 192.168.43.146.7771: UDP, length 120
23:57:59.466023 IP 192.168.43.146.8880 > 192.168.43.147.7772: UDP, length 120
23:57:59.472043 IP 192.168.43.124.8880 > 192.168.43.146.7771: UDP, length 120
23:57:59.516015 IP 192.168.43.146.8880 > 192.168.43.147.7772: UDP, length 120
23:57:59.520882 IP 192.168.43.124.8880 > 192.168.43.146.7771: UDP, length 120
23:57:59.566008 IP 192.168.43.146.8880 > 192.168.43.147.7772: UDP, length 120
23:57:59.570885 IP 192.168.43.124.8880 > 192.168.43.146.7771: UDP, length 120
23:57:59.616082 IP 192.168.43.146.8880 > 192.168.43.147.7772: UDP, length 120
23:57:59.621615 IP 192.168.43.124.8880 > 192.168.43.146.7771: UDP, length 120
23:57:59.666040 IP 192.168.43.146.8880 > 192.168.43.147.7772: UDP, length 120
23:57:59.670596 IP 192.168.43.124.8880 > 192.168.43.146.7771: UDP, length 120
23:57:59.716023 IP 192.168.43.146.8880 > 192.168.43.147.7772: UDP, length 120
23:57:59.720931 IP 192.168.43.124.8880 > 192.168.43.146.7771: UDP, length 120
23:57:59.766037 IP 192.168.43.146.8880 > 192.168.43.147.7772: UDP, length 120
23:57:59.771083 IP 192.168.43.124.8880 > 192.168.43.146.7771: UDP, length 120
23:57:59.816015 IP 192.168.43.146.8880 > 192.168.43.147.7772: UDP, length 120
23:57:59.822320 IP 192.168.43.124.8880 > 192.168.43.146.7771: UDP, length 120
23:57:59.866034 IP 192.168.43.146.8880 > 192.168.43.147.7772: UDP, length 120
23:57:59.871338 IP 192.168.43.124.8880 > 192.168.43.146.7771: UDP, length 120
23:57:59.916022 IP 192.168.43.146.8880 > 192.168.43.147.7772: UDP, length 120
23:57:59.924968 IP 192.168.43.124.8880 > 192.168.43.146.7771: UDP, length 120
23:57:59.966013 IP 192.168.43.146.8880 > 192.168.43.147.7772: UDP, length 120
23:57:59.969437 IP 192.168.43.124.8880 > 192.168.43.146.7771: UDP, length 120
23:58:00.016016 IP 192.168.43.146.8880 > 192.168.43.147.7772: UDP, length 120
23:58:00.020907 IP 192.168.43.124.8880 > 192.168.43.146.7771: UDP, length 120
23:58:00.066021 IP 192.168.43.146.8880 > 192.168.43.147.7772: UDP, length 120
23:58:00.070946 IP 192.168.43.124.8880 > 192.168.43.146.7771: UDP, length 120
23:58:00.116039 IP 192.168.43.146.8880 > 192.168.43.147.7772: UDP, length 120
23:58:00.119719 IP 192.168.43.124.8880 > 192.168.43.146.7771: UDP, length 120
23:58:00.166017 IP 192.168.43.146.8880 > 192.168.43.147.7772: UDP, length 120
23:58:00.170934 IP 192.168.43.124.8880 > 192.168.43.146.7771: UDP, length 120
23:58:00.216023 IP 192.168.43.146.8880 > 192.168.43.147.7772: UDP, length 120
23:58:00.239931 IP 192.168.43.124.8880 > 192.168.43.146.7771: UDP, length 120
23:58:00.266015 IP 192.168.43.146.8880 > 192.168.43.147.7772: UDP, length 120
23:58:00.271021 IP 192.168.43.124.8880 > 192.168.43.146.7771: UDP, length 120
23:58:00.316021 IP 192.168.43.146.8880 > 192.168.43.147.7772: UDP, length 120
23:58:00.325634 IP 192.168.43.124.8880 > 192.168.43.146.7771: UDP, length 120
23:58:00.366018 IP 192.168.43.146.8880 > 192.168.43.147.7772: UDP, length 120
23:58:00.371010 IP 192.168.43.124.8880 > 192.168.43.146.7771: UDP, length 120
23:58:00.416011 IP 192.168.43.146.8880 > 192.168.43.147.7772: UDP, length 120
23:58:00.430129 IP 192.168.43.124.8880 > 192.168.43.146.7771: UDP, length 120
23:58:00.466010 IP 192.168.43.146.8880 > 192.168.43.147.7772: UDP, length 120
23:58:00.471040 IP 192.168.43.124.8880 > 192.168.43.146.7771: UDP, length 120
23:58:00.516013 IP 192.168.43.146.8880 > 192.168.43.147.7772: UDP, length 120
23:58:00.521879 IP 192.168.43.124.8880 > 192.168.43.146.7771: UDP, length 120
23:58:00.566023 IP 192.168.43.146.8880 > 192.168.43.147.7772: UDP, length 120
23:58:00.571078 IP 192.168.43.124.8880 > 192.168.43.146.7771: UDP, length 120
23:58:00.616070 IP 192.168.43.146.8880 > 192.168.43.147.7772: UDP, length 120
23:58:00.622981 IP 192.168.43.124.8880 > 192.168.43.146.7771: UDP, length 120
23:58:00.666025 IP 192.168.43.146.8880 > 192.168.43.147.7772: UDP, length 120
23:58:00.686789 IP 192.168.43.124.8880 > 192.168.43.146.7771: UDP, length 120
23:58:00.716012 IP 192.168.43.146.8880 > 192.168.43.147.7772: UDP, length 120
23:58:00.721090 IP 192.168.43.124.8880 > 192.168.43.146.7771: UDP, length 120
23:58:00.766042 IP 192.168.43.146.8880 > 192.168.43.147.7772: UDP, length 120
23:58:00.771213 IP 192.168.43.124.8880 > 192.168.43.146.7771: UDP, length 120
23:58:00.816015 IP 192.168.43.146.8880 > 192.168.43.147.7772: UDP, length 120
23:58:00.821104 IP 192.168.43.124.8880 > 192.168.43.146.7771: UDP, length 120
23:58:00.866010 IP 192.168.43.146.8880 > 192.168.43.147.7772: UDP, length 120
23:58:00.873204 IP 192.168.43.124.8880 > 192.168.43.146.7771: UDP, length 120
23:58:00.916010 IP 192.168.43.146.8880 > 192.168.43.147.7772: UDP, length 120
23:58:00.921146 IP 192.168.43.124.8880 > 192.168.43.146.7771: UDP, length 120
23:58:00.966010 IP 192.168.43.146.8880 > 192.168.43.147.7772: UDP, length 120
23:58:00.974111 IP 192.168.43.124.8880 > 192.168.43.146.7771: UDP, length 120
23:58:01.016045 IP 192.168.43.146.8880 > 192.168.43.147.7772: UDP, length 120
23:58:01.021248 IP 192.168.43.124.8880 > 192.168.43.146.7771: UDP, length 120
23:58:01.066030 IP 192.168.43.146.8880 > 192.168.43.147.7772: UDP, length 120
23:58:01.076056 IP 192.168.43.124.8880 > 192.168.43.146.7771: UDP, length 120
23:58:01.116069 IP 192.168.43.146.8880 > 192.168.43.147.7772: UDP, length 120
23:58:01.121433 IP 192.168.43.124.8880 > 192.168.43.146.7771: UDP, length 120
23:58:01.166051 IP 192.168.43.146.8880 > 192.168.43.147.7772: UDP, length 120
23:58:01.178306 IP 192.168.43.124.8880 > 192.168.43.146.7771: UDP, length 120
23:58:01.216044 IP 192.168.43.146.8880 > 192.168.43.147.7772: UDP, length 120
23:58:01.220503 IP 192.168.43.124.8880 > 192.168.43.146.7771: UDP, length 120
23:58:01.266037 IP 192.168.43.146.8880 > 192.168.43.147.7772: UDP, length 120
23:58:01.271394 IP 192.168.43.124.8880 > 192.168.43.146.7771: UDP, length 120
23:58:01.316038 IP 192.168.43.146.8880 > 192.168.43.147.7772: UDP, length 120
23:58:01.321499 IP 192.168.43.124.8880 > 192.168.43.146.7771: UDP, length 120
23:58:01.366032 IP 192.168.43.146.8880 > 192.168.43.147.7772: UDP, length 120
23:58:01.370742 IP 192.168.43.124.8880 > 192.168.43.146.7771: UDP, length 120
23:58:01.416033 IP 192.168.43.146.8880 > 192.168.43.147.7772: UDP, length 120
23:58:01.421455 IP 192.168.43.124.8880 > 192.168.43.146.7771: UDP, length 120
23:58:01.466044 IP 192.168.43.146.8880 > 192.168.43.147.7772: UDP, length 120
23:58:01.471161 IP 192.168.43.124.8880 > 192.168.43.146.7771: UDP, length 120
23:58:01.516034 IP 192.168.43.146.8880 > 192.168.43.147.7772: UDP, length 120
23:58:01.522433 IP 192.168.43.124.8880 > 192.168.43.146.7771: UDP, length 120
23:58:01.566036 IP 192.168.43.146.8880 > 192.168.43.147.7772: UDP, length 120
23:58:01.569936 IP 192.168.43.124.8880 > 192.168.43.146.7771: UDP, length 120
23:58:01.616085 IP 192.168.43.146.8880 > 192.168.43.147.7772: UDP, length 120
23:58:01.620628 IP 192.168.43.124.8880 > 192.168.43.146.7771: UDP, length 120
23:58:01.666048 IP 192.168.43.146.8880 > 192.168.43.147.7772: UDP, length 120
23:58:01.671949 IP 192.168.43.124.8880 > 192.168.43.146.7771: UDP, length 120
23:58:01.716024 IP 192.168.43.146.8880 > 192.168.43.147.7772: UDP, length 120
23:58:01.721557 IP 192.168.43.124.8880 > 192.168.43.146.7771: UDP, length 120
23:58:01.766042 IP 192.168.43.146.8880 > 192.168.43.147.7772: UDP, length 120
23:58:01.783933 IP 192.168.43.124.8880 > 192.168.43.146.7771: UDP, length 120
23:58:01.816090 IP 192.168.43.146.8880 > 192.168.43.147.7772: UDP, length 120
23:58:01.822657 IP 192.168.43.124.8880 > 192.168.43.146.7771: UDP, length 120
23:58:01.866121 IP 192.168.43.146.8880 > 192.168.43.147.7772: UDP, length 120
23:58:01.871983 IP 192.168.43.124.8880 > 192.168.43.146.7771: UDP, length 120
23:58:01.916073 IP 192.168.43.146.8880 > 192.168.43.147.7772: UDP, length 120
23:58:01.922904 IP 192.168.43.124.8880 > 192.168.43.146.7771: UDP, length 120
23:58:01.966043 IP 192.168.43.146.8880 > 192.168.43.147.7772: UDP, length 120
23:58:02.016076 IP 192.168.43.146.8880 > 192.168.43.147.7772: UDP, length 120
23:58:02.066096 IP 192.168.43.146.8880 > 192.168.43.147.7772: UDP, length 120
23:58:02.067588 IP 192.168.43.124.8880 > 192.168.43.146.7771: UDP, length 120
23:58:02.068219 IP 192.168.43.124.8880 > 192.168.43.146.7771: UDP, length 120
23:58:02.116062 IP 192.168.43.146.8880 > 192.168.43.147.7772: UDP, length 120
23:58:02.166074 IP 192.168.43.146.8880 > 192.168.43.147.7772: UDP, length 120
23:58:02.167495 IP 192.168.43.124.8880 > 192.168.43.146.7771: UDP, length 120
23:58:02.167635 IP 192.168.43.124.8880 > 192.168.43.146.7771: UDP, length 120
23:58:02.216063 IP 192.168.43.146.8880 > 192.168.43.147.7772: UDP, length 120
23:58:02.266046 IP 192.168.43.146.8880 > 192.168.43.147.7772: UDP, length 120
23:58:02.267478 IP 192.168.43.124.8880 > 192.168.43.146.7771: UDP, length 120
23:58:02.267575 IP 192.168.43.124.8880 > 192.168.43.146.7771: UDP, length 120
23:58:02.315994 IP 192.168.43.146.8880 > 192.168.43.147.7772: UDP, length 120
23:58:02.365986 IP 192.168.43.146.8880 > 192.168.43.147.7772: UDP, length 120
23:58:02.367609 IP 192.168.43.124.8880 > 192.168.43.146.7771: UDP, length 120
23:58:02.367782 IP 192.168.43.124.8880 > 192.168.43.146.7771: UDP, length 120
23:58:02.415999 IP 192.168.43.146.8880 > 192.168.43.147.7772: UDP, length 120
23:58:02.465987 IP 192.168.43.146.8880 > 192.168.43.147.7772: UDP, length 120
23:58:02.469231 IP 192.168.43.124.8880 > 192.168.43.146.7771: UDP, length 120
23:58:02.469311 IP 192.168.43.124.8880 > 192.168.43.146.7771: UDP, length 120
23:58:02.515985 IP 192.168.43.146.8880 > 192.168.43.147.7772: UDP, length 120
23:58:02.565986 IP 192.168.43.146.8880 > 192.168.43.147.7772: UDP, length 120
23:58:02.567334 IP 192.168.43.124.8880 > 192.168.43.146.7771: UDP, length 120
23:58:02.567421 IP 192.168.43.124.8880 > 192.168.43.146.7771: UDP, length 120
23:58:02.616056 IP 192.168.43.146.8880 > 192.168.43.147.7772: UDP, length 120
23:58:02.666018 IP 192.168.43.146.8880 > 192.168.43.147.7772: UDP, length 120
23:58:02.667102 IP 192.168.43.124.8880 > 192.168.43.146.7771: UDP, length 120
23:58:02.667245 IP 192.168.43.124.8880 > 192.168.43.146.7771: UDP, length 120
23:58:02.716015 IP 192.168.43.146.8880 > 192.168.43.147.7772: UDP, length 120
23:58:02.766043 IP 192.168.43.146.8880 > 192.168.43.147.7772: UDP, length 120
23:58:02.773544 IP 192.168.43.124.8880 > 192.168.43.146.7771: UDP, length 120
23:58:02.773840 IP 192.168.43.124.8880 > 192.168.43.146.7771: UDP, length 120
23:58:02.774407 IP 192.168.43.124.8880 > 192.168.43.146.7771: UDP, length 120
23:58:02.816048 IP 192.168.43.146.8880 > 192.168.43.147.7772: UDP, length 120
23:58:02.866014 IP 192.168.43.146.8880 > 192.168.43.147.7772: UDP, length 120
23:58:02.873622 IP 192.168.43.124.8880 > 192.168.43.146.7771: UDP, length 120
23:58:02.873874 IP 192.168.43.124.8880 > 192.168.43.146.7771: UDP, length 120
23:58:02.916014 IP 192.168.43.146.8880 > 192.168.43.147.7772: UDP, length 120
23:58:02.966009 IP 192.168.43.146.8880 > 192.168.43.147.7772: UDP, length 120
23:58:03.016011 IP 192.168.43.146.8880 > 192.168.43.147.7772: UDP, length 120
23:58:03.016966 IP 192.168.43.124.8880 > 192.168.43.146.7771: UDP, length 120
23:58:03.022170 IP 192.168.43.124.8880 > 192.168.43.146.7771: UDP, length 120
23:58:03.066010 IP 192.168.43.146.8880 > 192.168.43.147.7772: UDP, length 120
23:58:03.116092 IP 192.168.43.146.8880 > 192.168.43.147.7772: UDP, length 120
23:58:03.123443 IP 192.168.43.124.8880 > 192.168.43.146.7771: UDP, length 120
23:58:03.123742 IP 192.168.43.124.8880 > 192.168.43.146.7771: UDP, length 120
23:58:03.123946 IP 192.168.43.124.8880 > 192.168.43.146.7771: UDP, length 120
23:58:03.166013 IP 192.168.43.146.8880 > 192.168.43.147.7772: UDP, length 120
23:58:03.216009 IP 192.168.43.146.8880 > 192.168.43.147.7772: UDP, length 120
23:58:03.266012 IP 192.168.43.146.8880 > 192.168.43.147.7772: UDP, length 120
23:58:03.316012 IP 192.168.43.146.8880 > 192.168.43.147.7772: UDP, length 120
23:58:03.321724 IP 192.168.43.124.8880 > 192.168.43.146.7771: UDP, length 120
23:58:03.322198 IP 192.168.43.124.8880 > 192.168.43.146.7771: UDP, length 120
23:58:03.322417 IP 192.168.43.124.8880 > 192.168.43.146.7771: UDP, length 120
23:58:03.322621 IP 192.168.43.124.8880 > 192.168.43.146.7771: UDP, length 120
23:58:03.366027 IP 192.168.43.146.8880 > 192.168.43.147.7772: UDP, length 120
23:58:03.371647 IP 192.168.43.124.8880 > 192.168.43.146.7771: UDP, length 120
23:58:03.416014 IP 192.168.43.146.8880 > 192.168.43.147.7772: UDP, length 120
23:58:03.435465 IP 192.168.43.124.8880 > 192.168.43.146.7771: UDP, length 120
23:58:03.466010 IP 192.168.43.146.8880 > 192.168.43.147.7772: UDP, length 120
23:58:03.471704 IP 192.168.43.124.8880 > 192.168.43.146.7771: UDP, length 120
23:58:03.516009 IP 192.168.43.146.8880 > 192.168.43.147.7772: UDP, length 120
23:58:03.521618 IP 192.168.43.124.8880 > 192.168.43.146.7771: UDP, length 120
23:58:03.566016 IP 192.168.43.146.8880 > 192.168.43.147.7772: UDP, length 120
23:58:03.571186 IP 192.168.43.124.8880 > 192.168.43.146.7771: UDP, length 120
23:58:03.616038 IP 192.168.43.146.8880 > 192.168.43.147.7772: UDP, length 120
23:58:03.621941 IP 192.168.43.124.8880 > 192.168.43.146.7771: UDP, length 120
23:58:03.666095 IP 192.168.43.146.8880 > 192.168.43.147.7772: UDP, length 120
23:58:03.672966 IP 192.168.43.124.8880 > 192.168.43.146.7771: UDP, length 120
23:58:03.716067 IP 192.168.43.146.8880 > 192.168.43.147.7772: UDP, length 120
23:58:03.721944 IP 192.168.43.124.8880 > 192.168.43.146.7771: UDP, length 120
23:58:03.766042 IP 192.168.43.146.8880 > 192.168.43.147.7772: UDP, length 120
23:58:03.770084 IP 192.168.43.124.8880 > 192.168.43.146.7771: UDP, length 120
23:58:03.816004 IP 192.168.43.146.8880 > 192.168.43.147.7772: UDP, length 120
23:58:03.821690 IP 192.168.43.124.8880 > 192.168.43.146.7771: UDP, length 120
23:58:03.865992 IP 192.168.43.146.8880 > 192.168.43.147.7772: UDP, length 120
23:58:03.871727 IP 192.168.43.124.8880 > 192.168.43.146.7771: UDP, length 120
23:58:03.915987 IP 192.168.43.146.8880 > 192.168.43.147.7772: UDP, length 120
23:58:03.921694 IP 192.168.43.124.8880 > 192.168.43.146.7771: UDP, length 120
23:58:03.965998 IP 192.168.43.146.8880 > 192.168.43.147.7772: UDP, length 120
23:58:03.972098 IP 192.168.43.124.8880 > 192.168.43.146.7771: UDP, length 120
23:58:04.015988 IP 192.168.43.146.8880 > 192.168.43.147.7772: UDP, length 120
23:58:04.021692 IP 192.168.43.124.8880 > 192.168.43.146.7771: UDP, length 120
23:58:04.065985 IP 192.168.43.146.8880 > 192.168.43.147.7772: UDP, length 120
23:58:04.072244 IP 192.168.43.124.8880 > 192.168.43.146.7771: UDP, length 120
23:58:04.116032 IP 192.168.43.146.8880 > 192.168.43.147.7772: UDP, length 120
23:58:04.123273 IP 192.168.43.124.8880 > 192.168.43.146.7771: UDP, length 120
23:58:04.165997 IP 192.168.43.146.8880 > 192.168.43.147.7772: UDP, length 120
23:58:04.172309 IP 192.168.43.124.8880 > 192.168.43.146.7771: UDP, length 120
23:58:04.215985 IP 192.168.43.146.8880 > 192.168.43.147.7772: UDP, length 120
23:58:04.220209 IP 192.168.43.124.8880 > 192.168.43.146.7771: UDP, length 120
23:58:04.265985 IP 192.168.43.146.8880 > 192.168.43.147.7772: UDP, length 120
23:58:04.270014 IP 192.168.43.124.8880 > 192.168.43.146.7771: UDP, length 120
23:58:04.315989 IP 192.168.43.146.8880 > 192.168.43.147.7772: UDP, length 120
23:58:04.321754 IP 192.168.43.124.8880 > 192.168.43.146.7771: UDP, length 120
23:58:04.365991 IP 192.168.43.146.8880 > 192.168.43.147.7772: UDP, length 120
23:58:04.371743 IP 192.168.43.124.8880 > 192.168.43.146.7771: UDP, length 120
23:58:04.415986 IP 192.168.43.146.8880 > 192.168.43.147.7772: UDP, length 120
23:58:04.422030 IP 192.168.43.124.8880 > 192.168.43.146.7771: UDP, length 120
23:58:04.465992 IP 192.168.43.146.8880 > 192.168.43.147.7772: UDP, length 120
23:58:04.471742 IP 192.168.43.124.8880 > 192.168.43.146.7771: UDP, length 120
23:58:04.515993 IP 192.168.43.146.8880 > 192.168.43.147.7772: UDP, length 120
23:58:04.521802 IP 192.168.43.124.8880 > 192.168.43.146.7771: UDP, length 120
23:58:04.565988 IP 192.168.43.146.8880 > 192.168.43.147.7772: UDP, length 120
23:58:04.571506 IP 192.168.43.124.8880 > 192.168.43.146.7771: UDP, length 120
23:58:04.615987 IP 192.168.43.146.8880 > 192.168.43.147.7772: UDP, length 120
23:58:04.625617 IP 192.168.43.124.8880 > 192.168.43.146.7771: UDP, length 120
23:58:04.665985 IP 192.168.43.146.8880 > 192.168.43.147.7772: UDP, length 120
23:58:04.671824 IP 192.168.43.124.8880 > 192.168.43.146.7771: UDP, length 120
23:58:04.715985 IP 192.168.43.146.8880 > 192.168.43.147.7772: UDP, length 120
23:58:04.721885 IP 192.168.43.124.8880 > 192.168.43.146.7771: UDP, length 120
23:58:04.766073 IP 192.168.43.146.8880 > 192.168.43.147.7772: UDP, length 120
23:58:04.772295 IP 192.168.43.124.8880 > 192.168.43.146.7771: UDP, length 120
23:58:04.816048 IP 192.168.43.146.8880 > 192.168.43.147.7772: UDP, length 120
23:58:04.826830 IP 192.168.43.124.8880 > 192.168.43.146.7771: UDP, length 120
23:58:04.865995 IP 192.168.43.146.8880 > 192.168.43.147.7772: UDP, length 120
23:58:04.871847 IP 192.168.43.124.8880 > 192.168.43.146.7771: UDP, length 120
23:58:04.915987 IP 192.168.43.146.8880 > 192.168.43.147.7772: UDP, length 120
23:58:04.924591 IP 192.168.43.124.8880 > 192.168.43.146.7771: UDP, length 120
23:58:04.965985 IP 192.168.43.146.8880 > 192.168.43.147.7772: UDP, length 120
23:58:04.971998 IP 192.168.43.124.8880 > 192.168.43.146.7771: UDP, length 120
23:58:05.015984 IP 192.168.43.146.8880 > 192.168.43.147.7772: UDP, length 120
23:58:05.021401 IP 192.168.43.124.8880 > 192.168.43.146.7771: UDP, length 120
23:58:05.065989 IP 192.168.43.146.8880 > 192.168.43.147.7772: UDP, length 120
23:58:05.070563 IP 192.168.43.124.8880 > 192.168.43.146.7771: UDP, length 120
23:58:05.115988 IP 192.168.43.146.8880 > 192.168.43.147.7772: UDP, length 120
23:58:05.121873 IP 192.168.43.124.8880 > 192.168.43.146.7771: UDP, length 120
23:58:05.165990 IP 192.168.43.146.8880 > 192.168.43.147.7772: UDP, length 120
23:58:05.171893 IP 192.168.43.124.8880 > 192.168.43.146.7771: UDP, length 120
23:58:05.215996 IP 192.168.43.146.8880 > 192.168.43.147.7772: UDP, length 120
23:58:05.220736 IP 192.168.43.124.8880 > 192.168.43.146.7771: UDP, length 120
23:58:05.265986 IP 192.168.43.146.8880 > 192.168.43.147.7772: UDP, length 120
23:58:05.273904 IP 192.168.43.124.8880 > 192.168.43.146.7771: UDP, length 120
23:58:05.315983 IP 192.168.43.146.8880 > 192.168.43.147.7772: UDP, length 120
23:58:05.321921 IP 192.168.43.124.8880 > 192.168.43.146.7771: UDP, length 120
23:58:05.366007 IP 192.168.43.146.8880 > 192.168.43.147.7772: UDP, length 120
23:58:05.371909 IP 192.168.43.124.8880 > 192.168.43.146.7771: UDP, length 120
23:58:05.416000 IP 192.168.43.146.8880 > 192.168.43.147.7772: UDP, length 120
23:58:05.424065 IP 192.168.43.124.8880 > 192.168.43.146.7771: UDP, length 120
23:58:05.465988 IP 192.168.43.146.8880 > 192.168.43.147.7772: UDP, length 120
23:58:05.471886 IP 192.168.43.124.8880 > 192.168.43.146.7771: UDP, length 120
23:58:05.515991 IP 192.168.43.146.8880 > 192.168.43.147.7772: UDP, length 120
23:58:05.520441 IP 192.168.43.124.8880 > 192.168.43.146.7771: UDP, length 120
23:58:05.565994 IP 192.168.43.146.8880 > 192.168.43.147.7772: UDP, length 120
23:58:05.571971 IP 192.168.43.124.8880 > 192.168.43.146.7771: UDP, length 120
23:58:05.616003 IP 192.168.43.146.8880 > 192.168.43.147.7772: UDP, length 120
23:58:05.621945 IP 192.168.43.124.8880 > 192.168.43.146.7771: UDP, length 120
23:58:05.666013 IP 192.168.43.146.8880 > 192.168.43.147.7772: UDP, length 120
23:58:05.671951 IP 192.168.43.124.8880 > 192.168.43.146.7771: UDP, length 120
23:58:05.715985 IP 192.168.43.146.8880 > 192.168.43.147.7772: UDP, length 120
23:58:05.721655 IP 192.168.43.124.8880 > 192.168.43.146.7771: UDP, length 120
23:58:05.765998 IP 192.168.43.146.8880 > 192.168.43.147.7772: UDP, length 120
23:58:05.771768 IP 192.168.43.124.8880 > 192.168.43.146.7771: UDP, length 120
23:58:05.816041 IP 192.168.43.146.8880 > 192.168.43.147.7772: UDP, length 120
23:58:05.823324 IP 192.168.43.124.8880 > 192.168.43.146.7771: UDP, length 120
23:58:05.865997 IP 192.168.43.146.8880 > 192.168.43.147.7772: UDP, length 120
23:58:05.872633 IP 192.168.43.124.8880 > 192.168.43.146.7771: UDP, length 120
23:58:05.915986 IP 192.168.43.146.8880 > 192.168.43.147.7772: UDP, length 120
23:58:05.924164 IP 192.168.43.124.8880 > 192.168.43.146.7771: UDP, length 120
23:58:05.965983 IP 192.168.43.146.8880 > 192.168.43.147.7772: UDP, length 120
23:58:05.972840 IP 192.168.43.124.8880 > 192.168.43.146.7771: UDP, length 120
23:58:06.015983 IP 192.168.43.146.8880 > 192.168.43.147.7772: UDP, length 120
23:58:06.022263 IP 192.168.43.124.8880 > 192.168.43.146.7771: UDP, length 120
23:58:06.065989 IP 192.168.43.146.8880 > 192.168.43.147.7772: UDP, length 120
23:58:06.070962 IP 192.168.43.124.8880 > 192.168.43.146.7771: UDP, length 120
23:58:06.116001 IP 192.168.43.146.8880 > 192.168.43.147.7772: UDP, length 120
23:58:06.120554 IP 192.168.43.124.8880 > 192.168.43.146.7771: UDP, length 120
23:58:06.165997 IP 192.168.43.146.8880 > 192.168.43.147.7772: UDP, length 120
23:58:06.175003 IP 192.168.43.124.8880 > 192.168.43.146.7771: UDP, length 120
23:58:06.215988 IP 192.168.43.146.8880 > 192.168.43.147.7772: UDP, length 120
23:58:06.222495 IP 192.168.43.124.8880 > 192.168.43.146.7771: UDP, length 120
23:58:06.265984 IP 192.168.43.146.8880 > 192.168.43.147.7772: UDP, length 120
23:58:06.273871 IP 192.168.43.124.8880 > 192.168.43.146.7771: UDP, length 120
23:58:06.315985 IP 192.168.43.146.8880 > 192.168.43.147.7772: UDP, length 120
23:58:06.323163 IP 192.168.43.124.8880 > 192.168.43.146.7771: UDP, length 120
23:58:06.365982 IP 192.168.43.146.8880 > 192.168.43.147.7772: UDP, length 120
23:58:06.371930 IP 192.168.43.124.8880 > 192.168.43.146.7771: UDP, length 120
23:58:06.415989 IP 192.168.43.146.8880 > 192.168.43.147.7772: UDP, length 120
23:58:06.423033 IP 192.168.43.124.8880 > 192.168.43.146.7771: UDP, length 120
23:58:06.466001 IP 192.168.43.146.8880 > 192.168.43.147.7772: UDP, length 120
23:58:06.479825 IP 192.168.43.124.8880 > 192.168.43.146.7771: UDP, length 120
23:58:06.515985 IP 192.168.43.146.8880 > 192.168.43.147.7772: UDP, length 120
23:58:06.522206 IP 192.168.43.124.8880 > 192.168.43.146.7771: UDP, length 120
23:58:06.565984 IP 192.168.43.146.8880 > 192.168.43.147.7772: UDP, length 120
23:58:06.574330 IP 192.168.43.124.8880 > 192.168.43.146.7771: UDP, length 120
23:58:06.615983 IP 192.168.43.146.8880 > 192.168.43.147.7772: UDP, length 120
23:58:06.622558 IP 192.168.43.124.8880 > 192.168.43.146.7771: UDP, length 120
23:58:06.665981 IP 192.168.43.146.8880 > 192.168.43.147.7772: UDP, length 120
23:58:06.675162 IP 192.168.43.124.8880 > 192.168.43.146.7771: UDP, length 120
23:58:06.715982 IP 192.168.43.146.8880 > 192.168.43.147.7772: UDP, length 120
23:58:06.722152 IP 192.168.43.124.8880 > 192.168.43.146.7771: UDP, length 120
23:58:06.766007 IP 192.168.43.146.8880 > 192.168.43.147.7772: UDP, length 120
23:58:06.771876 IP 192.168.43.124.8880 > 192.168.43.146.7771: UDP, length 120
23:58:06.816039 IP 192.168.43.146.8880 > 192.168.43.147.7772: UDP, length 120
23:58:06.822617 IP 192.168.43.124.8880 > 192.168.43.146.7771: UDP, length 120
23:58:06.865998 IP 192.168.43.146.8880 > 192.168.43.147.7772: UDP, length 120
23:58:06.872236 IP 192.168.43.124.8880 > 192.168.43.146.7771: UDP, length 120
23:58:06.915985 IP 192.168.43.146.8880 > 192.168.43.147.7772: UDP, length 120
23:58:06.922699 IP 192.168.43.124.8880 > 192.168.43.146.7771: UDP, length 120
23:58:06.965980 IP 192.168.43.146.8880 > 192.168.43.147.7772: UDP, length 120
23:58:06.974471 IP 192.168.43.124.8880 > 192.168.43.146.7771: UDP, length 120
23:58:07.015984 IP 192.168.43.146.8880 > 192.168.43.147.7772: UDP, length 120
23:58:07.022234 IP 192.168.43.124.8880 > 192.168.43.146.7771: UDP, length 120
23:58:07.065981 IP 192.168.43.146.8880 > 192.168.43.147.7772: UDP, length 120
23:58:07.087389 IP 192.168.43.124.8880 > 192.168.43.146.7771: UDP, length 120
23:58:07.115997 IP 192.168.43.146.8880 > 192.168.43.147.7772: UDP, length 120
23:58:07.122830 IP 192.168.43.124.8880 > 192.168.43.146.7771: UDP, length 120
23:58:07.166013 IP 192.168.43.146.8880 > 192.168.43.147.7772: UDP, length 120
23:58:07.171966 IP 192.168.43.124.8880 > 192.168.43.146.7771: UDP, length 120
23:58:07.215986 IP 192.168.43.146.8880 > 192.168.43.147.7772: UDP, length 120
23:58:07.222870 IP 192.168.43.124.8880 > 192.168.43.146.7771: UDP, length 120
23:58:07.266042 IP 192.168.43.146.8880 > 192.168.43.147.7772: UDP, length 120
23:58:07.274060 IP 192.168.43.124.8880 > 192.168.43.146.7771: UDP, length 120
23:58:07.316065 IP 192.168.43.146.8880 > 192.168.43.147.7772: UDP, length 120
23:58:07.324935 IP 192.168.43.124.8880 > 192.168.43.146.7771: UDP, length 120
23:58:07.366057 IP 192.168.43.146.8880 > 192.168.43.147.7772: UDP, length 120
23:58:07.372404 IP 192.168.43.124.8880 > 192.168.43.146.7771: UDP, length 120
23:58:07.416090 IP 192.168.43.146.8880 > 192.168.43.147.7772: UDP, length 120
23:58:07.425507 IP 192.168.43.124.8880 > 192.168.43.146.7771: UDP, length 120
23:58:07.466059 IP 192.168.43.146.8880 > 192.168.43.147.7772: UDP, length 120
23:58:07.473494 IP 192.168.43.124.8880 > 192.168.43.146.7771: UDP, length 120
23:58:07.516077 IP 192.168.43.146.8880 > 192.168.43.147.7772: UDP, length 120
23:58:07.526939 IP 192.168.43.124.8880 > 192.168.43.146.7771: UDP, length 120
23:58:07.566044 IP 192.168.43.146.8880 > 192.168.43.147.7772: UDP, length 120
23:58:07.571411 IP 192.168.43.124.8880 > 192.168.43.146.7771: UDP, length 120
23:58:07.616138 IP 192.168.43.146.8880 > 192.168.43.147.7772: UDP, length 120
23:58:07.622747 IP 192.168.43.124.8880 > 192.168.43.146.7771: UDP, length 120
23:58:07.666133 IP 192.168.43.146.8880 > 192.168.43.147.7772: UDP, length 120
23:58:07.672599 IP 192.168.43.124.8880 > 192.168.43.146.7771: UDP, length 120
23:58:07.716080 IP 192.168.43.146.8880 > 192.168.43.147.7772: UDP, length 120
23:58:07.722962 IP 192.168.43.124.8880 > 192.168.43.146.7771: UDP, length 120
23:58:07.766042 IP 192.168.43.146.8880 > 192.168.43.147.7772: UDP, length 120
23:58:07.772485 IP 192.168.43.124.8880 > 192.168.43.146.7771: UDP, length 120
23:58:07.816077 IP 192.168.43.146.8880 > 192.168.43.147.7772: UDP, length 120
23:58:07.822875 IP 192.168.43.124.8880 > 192.168.43.146.7771: UDP, length 120
23:58:07.866021 IP 192.168.43.146.8880 > 192.168.43.147.7772: UDP, length 120
23:58:07.872227 IP 192.168.43.124.8880 > 192.168.43.146.7771: UDP, length 120
23:58:07.916016 IP 192.168.43.146.8880 > 192.168.43.147.7772: UDP, length 120
23:58:07.922801 IP 192.168.43.124.8880 > 192.168.43.146.7771: UDP, length 120
23:58:07.966012 IP 192.168.43.146.8880 > 192.168.43.147.7772: UDP, length 120
23:58:07.973931 IP 192.168.43.124.8880 > 192.168.43.146.7771: UDP, length 120
23:58:08.016035 IP 192.168.43.146.8880 > 192.168.43.147.7772: UDP, length 120
23:58:08.021570 IP 192.168.43.124.8880 > 192.168.43.146.7771: UDP, length 120
23:58:08.066016 IP 192.168.43.146.8880 > 192.168.43.147.7772: UDP, length 120
23:58:08.074245 IP 192.168.43.124.8880 > 192.168.43.146.7771: UDP, length 120
23:58:08.116018 IP 192.168.43.146.8880 > 192.168.43.147.7772: UDP, length 120
23:58:08.122878 IP 192.168.43.124.8880 > 192.168.43.146.7771: UDP, length 120
23:58:08.166012 IP 192.168.43.146.8880 > 192.168.43.147.7772: UDP, length 120
23:58:08.172825 IP 192.168.43.124.8880 > 192.168.43.146.7771: UDP, length 120
23:58:08.216008 IP 192.168.43.146.8880 > 192.168.43.147.7772: UDP, length 120
23:58:08.224058 IP 192.168.43.124.8880 > 192.168.43.146.7771: UDP, length 120
23:58:08.266012 IP 192.168.43.146.8880 > 192.168.43.147.7772: UDP, length 120
23:58:08.272585 IP 192.168.43.124.8880 > 192.168.43.146.7771: UDP, length 120
23:58:08.316012 IP 192.168.43.146.8880 > 192.168.43.147.7772: UDP, length 120
23:58:08.322959 IP 192.168.43.124.8880 > 192.168.43.146.7771: UDP, length 120
23:58:08.366012 IP 192.168.43.146.8880 > 192.168.43.147.7772: UDP, length 120
23:58:08.372922 IP 192.168.43.124.8880 > 192.168.43.146.7771: UDP, length 120
23:58:08.416013 IP 192.168.43.146.8880 > 192.168.43.147.7772: UDP, length 120
23:58:08.424455 IP 192.168.43.124.8880 > 192.168.43.146.7771: UDP, length 120
23:58:08.466012 IP 192.168.43.146.8880 > 192.168.43.147.7772: UDP, length 120
23:58:08.472971 IP 192.168.43.124.8880 > 192.168.43.146.7771: UDP, length 120
23:58:08.516036 IP 192.168.43.146.8880 > 192.168.43.147.7772: UDP, length 120
23:58:08.523190 IP 192.168.43.124.8880 > 192.168.43.146.7771: UDP, length 120
23:58:08.566055 IP 192.168.43.146.8880 > 192.168.43.147.7772: UDP, length 120
23:58:08.574300 IP 192.168.43.124.8880 > 192.168.43.146.7771: UDP, length 120
23:58:08.616022 IP 192.168.43.146.8880 > 192.168.43.147.7772: UDP, length 120
23:58:08.622464 IP 192.168.43.124.8880 > 192.168.43.146.7771: UDP, length 120
23:58:08.666046 IP 192.168.43.146.8880 > 192.168.43.147.7772: UDP, length 120
23:58:08.673019 IP 192.168.43.124.8880 > 192.168.43.146.7771: UDP, length 120
23:58:08.716014 IP 192.168.43.146.8880 > 192.168.43.147.7772: UDP, length 120
23:58:08.723302 IP 192.168.43.124.8880 > 192.168.43.146.7771: UDP, length 120
23:58:08.766042 IP 192.168.43.146.8880 > 192.168.43.147.7772: UDP, length 120
23:58:08.772854 IP 192.168.43.124.8880 > 192.168.43.146.7771: UDP, length 120
23:58:08.816115 IP 192.168.43.146.8880 > 192.168.43.147.7772: UDP, length 120
23:58:08.823381 IP 192.168.43.124.8880 > 192.168.43.146.7771: UDP, length 120
23:58:08.866054 IP 192.168.43.146.8880 > 192.168.43.147.7772: UDP, length 120
23:58:08.872598 IP 192.168.43.124.8880 > 192.168.43.146.7771: UDP, length 120
23:58:08.916024 IP 192.168.43.146.8880 > 192.168.43.147.7772: UDP, length 120
23:58:08.922199 IP 192.168.43.124.8880 > 192.168.43.146.7771: UDP, length 120
23:58:08.966021 IP 192.168.43.146.8880 > 192.168.43.147.7772: UDP, length 120
23:58:08.974129 IP 192.168.43.124.8880 > 192.168.43.146.7771: UDP, length 120
23:58:09.016006 IP 192.168.43.146.8880 > 192.168.43.147.7772: UDP, length 120
23:58:09.024941 IP 192.168.43.124.8880 > 192.168.43.146.7771: UDP, length 120
23:58:09.066007 IP 192.168.43.146.8880 > 192.168.43.147.7772: UDP, length 120
23:58:09.075001 IP 192.168.43.124.8880 > 192.168.43.146.7771: UDP, length 120
23:58:09.116013 IP 192.168.43.146.8880 > 192.168.43.147.7772: UDP, length 120
23:58:09.126451 IP 192.168.43.124.8880 > 192.168.43.146.7771: UDP, length 120
23:58:09.166009 IP 192.168.43.146.8880 > 192.168.43.147.7772: UDP, length 120
23:58:09.173589 IP 192.168.43.124.8880 > 192.168.43.146.7771: UDP, length 120
23:58:09.216008 IP 192.168.43.146.8880 > 192.168.43.147.7772: UDP, length 120
23:58:09.225154 IP 192.168.43.124.8880 > 192.168.43.146.7771: UDP, length 120
23:58:09.266013 IP 192.168.43.146.8880 > 192.168.43.147.7772: UDP, length 120
23:58:09.271345 IP 192.168.43.124.8880 > 192.168.43.146.7771: UDP, length 120
23:58:09.316010 IP 192.168.43.146.8880 > 192.168.43.147.7772: UDP, length 120
23:58:09.322710 IP 192.168.43.124.8880 > 192.168.43.146.7771: UDP, length 120
