19:57:56.274675 IP 192.168.43.124.8880 > 192.168.43.146.7771: UDP, length 120
19:57:56.324816 IP 192.168.43.124.8880 > 192.168.43.146.7771: UDP, length 120
19:57:56.374816 IP 192.168.43.124.8880 > 192.168.43.146.7771: UDP, length 120
19:57:56.424817 IP 192.168.43.124.8880 > 192.168.43.146.7771: UDP, length 120
19:57:56.474817 IP 192.168.43.124.8880 > 192.168.43.146.7771: UDP, length 120
19:57:56.524817 IP 192.168.43.124.8880 > 192.168.43.146.7771: UDP, length 120
19:57:56.574819 IP 192.168.43.124.8880 > 192.168.43.146.7771: UDP, length 120
19:57:56.624819 IP 192.168.43.124.8880 > 192.168.43.146.7771: UDP, length 120
19:57:56.674784 IP 192.168.43.124.8880 > 192.168.43.146.7771: UDP, length 120
19:57:56.724815 IP 192.168.43.124.8880 > 192.168.43.146.7771: UDP, length 120
19:57:56.774808 IP 192.168.43.124.8880 > 192.168.43.146.7771: UDP, length 120
19:57:56.824817 IP 192.168.43.124.8880 > 192.168.43.146.7771: UDP, length 120
19:57:56.874815 IP 192.168.43.124.8880 > 192.168.43.146.7771: UDP, length 120
19:57:56.902146 IP 192.168.43.147.8880 > 192.168.43.124.7773: UDP, length 120
19:57:56.924831 IP 192.168.43.124.8880 > 192.168.43.146.7771: UDP, length 120
19:57:56.955231 IP 192.168.43.147.8880 > 192.168.43.124.7773: UDP, length 120
19:57:56.974820 IP 192.168.43.124.8880 > 192.168.43.146.7771: UDP, length 120
19:57:57.001706 IP 192.168.43.147.8880 > 192.168.43.124.7773: UDP, length 120
19:57:57.025323 IP 192.168.43.124.8880 > 192.168.43.146.7771: UDP, length 120
19:57:57.060223 IP 192.168.43.147.8880 > 192.168.43.124.7773: UDP, length 120
19:57:57.074816 IP 192.168.43.124.8880 > 192.168.43.146.7771: UDP, length 120
19:57:57.102572 IP 192.168.43.147.8880 > 192.168.43.124.7773: UDP, length 120
19:57:57.124817 IP 192.168.43.124.8880 > 192.168.43.146.7771: UDP, length 120
19:57:57.159757 IP 192.168.43.147.8880 > 192.168.43.124.7773: UDP, length 120
19:57:57.174815 IP 192.168.43.124.8880 > 192.168.43.146.7771: UDP, length 120
19:57:57.206145 IP 192.168.43.147.8880 > 192.168.43.124.7773: UDP, length 120
19:57:57.224783 IP 192.168.43.124.8880 > 192.168.43.146.7771: UDP, length 120
19:57:57.256354 IP 192.168.43.147.8880 > 192.168.43.124.7773: UDP, length 120
19:57:57.274816 IP 192.168.43.124.8880 > 192.168.43.146.7771: UDP, length 120
19:57:57.313442 IP 192.168.43.147.8880 > 192.168.43.124.7773: UDP, length 120
19:57:57.324762 IP 192.168.43.124.8880 > 192.168.43.146.7771: UDP, length 120
19:57:57.350297 IP 192.168.43.147.8880 > 192.168.43.124.7773: UDP, length 120
19:57:57.375084 IP 192.168.43.124.8880 > 192.168.43.146.7771: UDP, length 120
19:57:57.409030 IP 192.168.43.147.8880 > 192.168.43.124.7773: UDP, length 120
19:57:57.424820 IP 192.168.43.124.8880 > 192.168.43.146.7771: UDP, length 120
19:57:57.463125 IP 192.168.43.147.8880 > 192.168.43.124.7773: UDP, length 120
19:57:57.474746 IP 192.168.43.124.8880 > 192.168.43.146.7771: UDP, length 120
19:57:57.505463 IP 192.168.43.147.8880 > 192.168.43.124.7773: UDP, length 120
19:57:57.524750 IP 192.168.43.124.8880 > 192.168.43.146.7771: UDP, length 120
19:57:57.552924 IP 192.168.43.147.8880 > 192.168.43.124.7773: UDP, length 120
19:57:57.574821 IP 192.168.43.124.8880 > 192.168.43.146.7771: UDP, length 120
19:57:57.606820 IP 192.168.43.147.8880 > 192.168.43.124.7773: UDP, length 120
19:57:57.624830 IP 192.168.43.124.8880 > 192.168.43.146.7771: UDP, length 120
19:57:57.657028 IP 192.168.43.147.8880 > 192.168.43.124.7773: UDP, length 120
19:57:57.674754 IP 192.168.43.124.8880 > 192.168.43.146.7771: UDP, length 120
19:57:57.701570 IP 192.168.43.147.8880 > 192.168.43.124.7773: UDP, length 120
19:57:57.724784 IP 192.168.43.124.8880 > 192.168.43.146.7771: UDP, length 120
19:57:57.754315 IP 192.168.43.147.8880 > 192.168.43.124.7773: UDP, length 120
19:57:57.774781 IP 192.168.43.124.8880 > 192.168.43.146.7771: UDP, length 120
19:57:57.800402 IP 192.168.43.147.8880 > 192.168.43.124.7773: UDP, length 120
19:57:57.824758 IP 192.168.43.124.8880 > 192.168.43.146.7771: UDP, length 120
19:57:57.859568 IP 192.168.43.147.8880 > 192.168.43.124.7773: UDP, length 120
19:57:57.874840 IP 192.168.43.124.8880 > 192.168.43.146.7771: UDP, length 120
19:57:57.903019 IP 192.168.43.147.8880 > 192.168.43.124.7773: UDP, length 120
19:57:57.924759 IP 192.168.43.124.8880 > 192.168.43.146.7771: UDP, length 120
19:57:57.954524 IP 192.168.43.147.8880 > 192.168.43.124.7773: UDP, length 120
19:57:57.974734 IP 192.168.43.124.8880 > 192.168.43.146.7771: UDP, length 120
19:57:58.001330 IP 192.168.43.147.8880 > 192.168.43.124.7773: UDP, length 120
19:57:58.024782 IP 192.168.43.124.8880 > 192.168.43.146.7771: UDP, length 120
19:57:58.056613 IP 192.168.43.147.8880 > 192.168.43.124.7773: UDP, length 120
19:57:58.074736 IP 192.168.43.124.8880 > 192.168.43.146.7771: UDP, length 120
19:57:58.106077 IP 192.168.43.147.8880 > 192.168.43.124.7773: UDP, length 120
19:57:58.124846 IP 192.168.43.124.8880 > 192.168.43.146.7771: UDP, length 120
19:57:58.151045 IP 192.168.43.147.8880 > 192.168.43.124.7773: UDP, length 120
19:57:58.174780 IP 192.168.43.124.8880 > 192.168.43.146.7771: UDP, length 120
19:57:58.202337 IP 192.168.43.147.8880 > 192.168.43.124.7773: UDP, length 120
19:57:58.224821 IP 192.168.43.124.8880 > 192.168.43.146.7771: UDP, length 120
19:57:58.256921 IP 192.168.43.147.8880 > 192.168.43.124.7773: UDP, length 120
19:57:58.274820 IP 192.168.43.124.8880 > 192.168.43.146.7771: UDP, length 120
19:57:58.302644 IP 192.168.43.147.8880 > 192.168.43.124.7773: UDP, length 120
19:57:58.324816 IP 192.168.43.124.8880 > 192.168.43.146.7771: UDP, length 120
19:57:58.356334 IP 192.168.43.147.8880 > 192.168.43.124.7773: UDP, length 120
19:57:58.374817 IP 192.168.43.124.8880 > 192.168.43.146.7771: UDP, length 120
19:57:58.401591 IP 192.168.43.147.8880 > 192.168.43.124.7773: UDP, length 120
19:57:58.424816 IP 192.168.43.124.8880 > 192.168.43.146.7771: UDP, length 120
19:57:58.451292 IP 192.168.43.147.8880 > 192.168.43.124.7773: UDP, length 120
19:57:58.474816 IP 192.168.43.124.8880 > 192.168.43.146.7771: UDP, length 120
19:57:58.504992 IP 192.168.43.147.8880 > 192.168.43.124.7773: UDP, length 120
19:57:58.524811 IP 192.168.43.124.8880 > 192.168.43.146.7771: UDP, length 120
19:57:58.552726 IP 192.168.43.147.8880 > 192.168.43.124.7773: UDP, length 120
19:57:58.574816 IP 192.168.43.124.8880 > 192.168.43.146.7771: UDP, length 120
19:57:58.606068 IP 192.168.43.147.8880 > 192.168.43.124.7773: UDP, length 120
19:57:58.624818 IP 192.168.43.124.8880 > 192.168.43.146.7771: UDP, length 120
19:57:58.656389 IP 192.168.43.147.8880 > 192.168.43.124.7773: UDP, length 120
19:57:58.674785 IP 192.168.43.124.8880 > 192.168.43.146.7771: UDP, length 120
19:57:58.711830 IP 192.168.43.147.8880 > 192.168.43.124.7773: UDP, length 120
19:57:58.724816 IP 192.168.43.124.8880 > 192.168.43.146.7771: UDP, length 120
19:57:58.751265 IP 192.168.43.147.8880 > 192.168.43.124.7773: UDP, length 120
19:57:58.774818 IP 192.168.43.124.8880 > 192.168.43.146.7771: UDP, length 120
19:57:58.801100 IP 192.168.43.147.8880 > 192.168.43.124.7773: UDP, length 120
19:57:58.824817 IP 192.168.43.124.8880 > 192.168.43.146.7771: UDP, length 120
19:57:58.849733 IP 192.168.43.147.8880 > 192.168.43.124.7773: UDP, length 120
19:57:58.874832 IP 192.168.43.124.8880 > 192.168.43.146.7771: UDP, length 120
19:57:58.916782 IP 192.168.43.147.8880 > 192.168.43.124.7773: UDP, length 120
19:57:58.924817 IP 192.168.43.124.8880 > 192.168.43.146.7771: UDP, length 120
19:57:58.952040 IP 192.168.43.147.8880 > 192.168.43.124.7773: UDP, length 120
19:57:58.974748 IP 192.168.43.124.8880 > 192.168.43.146.7771: UDP, length 120
19:57:59.004325 IP 192.168.43.147.8880 > 192.168.43.124.7773: UDP, length 120
19:57:59.024816 IP 192.168.43.124.8880 > 192.168.43.146.7771: UDP, length 120
19:57:59.052540 IP 192.168.43.147.8880 > 192.168.43.124.7773: UDP, length 120
19:57:59.074816 IP 192.168.43.124.8880 > 192.168.43.146.7771: UDP, length 120
19:57:59.104606 IP 192.168.43.147.8880 > 192.168.43.124.7773: UDP, length 120
19:57:59.124817 IP 192.168.43.124.8880 > 192.168.43.146.7771: UDP, length 120
19:57:59.154021 IP 192.168.43.147.8880 > 192.168.43.124.7773: UDP, length 120
19:57:59.174800 IP 192.168.43.124.8880 > 192.168.43.146.7771: UDP, length 120
19:57:59.207001 IP 192.168.43.147.8880 > 192.168.43.124.7773: UDP, length 120
19:57:59.224841 IP 192.168.43.124.8880 > 192.168.43.146.7771: UDP, length 120
19:57:59.254931 IP 192.168.43.147.8880 > 192.168.43.124.7773: UDP, length 120
19:57:59.274814 IP 192.168.43.124.8880 > 192.168.43.146.7771: UDP, length 120
19:57:59.309985 IP 192.168.43.147.8880 > 192.168.43.124.7773: UDP, length 120
19:57:59.324766 IP 192.168.43.124.8880 > 192.168.43.146.7771: UDP, length 120
19:57:59.353913 IP 192.168.43.147.8880 > 192.168.43.124.7773: UDP, length 120
19:57:59.374756 IP 192.168.43.124.8880 > 192.168.43.146.7771: UDP, length 120
19:57:59.409015 IP 192.168.43.147.8880 > 192.168.43.124.7773: UDP, length 120
19:57:59.424819 IP 192.168.43.124.8880 > 192.168.43.146.7771: UDP, length 120
19:57:59.454351 IP 192.168.43.147.8880 > 192.168.43.124.7773: UDP, length 120
19:57:59.474810 IP 192.168.43.124.8880 > 192.168.43.146.7771: UDP, length 120
19:57:59.511112 IP 192.168.43.147.8880 > 192.168.43.124.7773: UDP, length 120
19:57:59.524751 IP 192.168.43.124.8880 > 192.168.43.146.7771: UDP, length 120
19:57:59.551858 IP 192.168.43.147.8880 > 192.168.43.124.7773: UDP, length 120
19:57:59.574820 IP 192.168.43.124.8880 > 192.168.43.146.7771: UDP, length 120
19:57:59.613225 IP 192.168.43.147.8880 > 192.168.43.124.7773: UDP, length 120
19:57:59.624814 IP 192.168.43.124.8880 > 192.168.43.146.7771: UDP, length 120
19:57:59.654490 IP 192.168.43.147.8880 > 192.168.43.124.7773: UDP, length 120
19:57:59.674812 IP 192.168.43.124.8880 > 192.168.43.146.7771: UDP, length 120
19:57:59.703283 IP 192.168.43.147.8880 > 192.168.43.124.7773: UDP, length 120
19:57:59.724797 IP 192.168.43.124.8880 > 192.168.43.146.7771: UDP, length 120
19:57:59.756818 IP 192.168.43.147.8880 > 192.168.43.124.7773: UDP, length 120
19:57:59.774820 IP 192.168.43.124.8880 > 192.168.43.146.7771: UDP, length 120
19:57:59.800813 IP 192.168.43.147.8880 > 192.168.43.124.7773: UDP, length 120
19:57:59.824816 IP 192.168.43.124.8880 > 192.168.43.146.7771: UDP, length 120
19:57:59.860414 IP 192.168.43.147.8880 > 192.168.43.124.7773: UDP, length 120
19:57:59.874726 IP 192.168.43.124.8880 > 192.168.43.146.7771: UDP, length 120
19:57:59.903704 IP 192.168.43.147.8880 > 192.168.43.124.7773: UDP, length 120
19:57:59.924771 IP 192.168.43.124.8880 > 192.168.43.146.7771: UDP, length 120
19:57:59.961493 IP 192.168.43.147.8880 > 192.168.43.124.7773: UDP, length 120
19:57:59.974746 IP 192.168.43.124.8880 > 192.168.43.146.7771: UDP, length 120
19:58:00.001709 IP 192.168.43.147.8880 > 192.168.43.124.7773: UDP, length 120
19:58:00.024785 IP 192.168.43.124.8880 > 192.168.43.146.7771: UDP, length 120
19:58:00.051284 IP 192.168.43.147.8880 > 192.168.43.124.7773: UDP, length 120
19:58:00.074729 IP 192.168.43.124.8880 > 192.168.43.146.7771: UDP, length 120
19:58:00.100074 IP 192.168.43.147.8880 > 192.168.43.124.7773: UDP, length 120
19:58:00.124816 IP 192.168.43.124.8880 > 192.168.43.146.7771: UDP, length 120
19:58:00.153743 IP 192.168.43.147.8880 > 192.168.43.124.7773: UDP, length 120
19:58:00.174816 IP 192.168.43.124.8880 > 192.168.43.146.7771: UDP, length 120
19:58:00.206832 IP 192.168.43.147.8880 > 192.168.43.124.7773: UDP, length 120
19:58:00.224816 IP 192.168.43.124.8880 > 192.168.43.146.7771: UDP, length 120
19:58:00.250731 IP 192.168.43.147.8880 > 192.168.43.124.7773: UDP, length 120
19:58:00.274816 IP 192.168.43.124.8880 > 192.168.43.146.7771: UDP, length 120
19:58:00.304030 IP 192.168.43.147.8880 > 192.168.43.124.7773: UDP, length 120
19:58:00.324816 IP 192.168.43.124.8880 > 192.168.43.146.7771: UDP, length 120
19:58:00.352754 IP 192.168.43.147.8880 > 192.168.43.124.7773: UDP, length 120
19:58:00.374817 IP 192.168.43.124.8880 > 192.168.43.146.7771: UDP, length 120
19:58:00.409030 IP 192.168.43.147.8880 > 192.168.43.124.7773: UDP, length 120
19:58:00.424761 IP 192.168.43.124.8880 > 192.168.43.146.7771: UDP, length 120
19:58:00.454815 IP 192.168.43.147.8880 > 192.168.43.124.7773: UDP, length 120
19:58:00.474814 IP 192.168.43.124.8880 > 192.168.43.146.7771: UDP, length 120
19:58:00.500742 IP 192.168.43.147.8880 > 192.168.43.124.7773: UDP, length 120
19:58:00.524818 IP 192.168.43.124.8880 > 192.168.43.146.7771: UDP, length 120
19:58:00.553145 IP 192.168.43.147.8880 > 192.168.43.124.7773: UDP, length 120
19:58:00.574813 IP 192.168.43.124.8880 > 192.168.43.146.7771: UDP, length 120
19:58:00.606445 IP 192.168.43.147.8880 > 192.168.43.124.7773: UDP, length 120
19:58:00.624813 IP 192.168.43.124.8880 > 192.168.43.146.7771: UDP, length 120
19:58:00.654616 IP 192.168.43.147.8880 > 192.168.43.124.7773: UDP, length 120
19:58:00.674889 IP 192.168.43.124.8880 > 192.168.43.146.7771: UDP, length 120
19:58:00.703090 IP 192.168.43.147.8880 > 192.168.43.124.7773: UDP, length 120
19:58:00.724762 IP 192.168.43.124.8880 > 192.168.43.146.7771: UDP, length 120
19:58:00.770067 IP 192.168.43.147.8880 > 192.168.43.124.7773: UDP, length 120
19:58:00.774760 IP 192.168.43.124.8880 > 192.168.43.146.7771: UDP, length 120
19:58:00.803111 IP 192.168.43.147.8880 > 192.168.43.124.7773: UDP, length 120
19:58:00.824818 IP 192.168.43.124.8880 > 192.168.43.146.7771: UDP, length 120
19:58:00.850604 IP 192.168.43.147.8880 > 192.168.43.124.7773: UDP, length 120
19:58:00.874817 IP 192.168.43.124.8880 > 192.168.43.146.7771: UDP, length 120
19:58:00.924771 IP 192.168.43.124.8880 > 192.168.43.146.7771: UDP, length 120
19:58:00.950999 IP 192.168.43.147.8880 > 192.168.43.124.7773: UDP, length 120
19:58:00.955337 IP 192.168.43.147.8880 > 192.168.43.124.7773: UDP, length 120
19:58:00.974782 IP 192.168.43.124.8880 > 192.168.43.146.7771: UDP, length 120
19:58:01.000658 IP 192.168.43.147.8880 > 192.168.43.124.7773: UDP, length 120
19:58:01.024816 IP 192.168.43.124.8880 > 192.168.43.146.7771: UDP, length 120
19:58:01.052733 IP 192.168.43.147.8880 > 192.168.43.124.7773: UDP, length 120
19:58:01.074817 IP 192.168.43.124.8880 > 192.168.43.146.7771: UDP, length 120
19:58:01.100940 IP 192.168.43.147.8880 > 192.168.43.124.7773: UDP, length 120
19:58:01.124922 IP 192.168.43.124.8880 > 192.168.43.146.7771: UDP, length 120
19:58:01.151486 IP 192.168.43.147.8880 > 192.168.43.124.7773: UDP, length 120
19:58:01.174765 IP 192.168.43.124.8880 > 192.168.43.146.7771: UDP, length 120
19:58:01.202224 IP 192.168.43.147.8880 > 192.168.43.124.7773: UDP, length 120
19:58:01.224774 IP 192.168.43.124.8880 > 192.168.43.146.7771: UDP, length 120
19:58:01.253503 IP 192.168.43.147.8880 > 192.168.43.124.7773: UDP, length 120
19:58:01.274819 IP 192.168.43.124.8880 > 192.168.43.146.7771: UDP, length 120
19:58:01.299247 IP 192.168.43.147.8880 > 192.168.43.124.7773: UDP, length 120
19:58:01.324805 IP 192.168.43.124.8880 > 192.168.43.146.7771: UDP, length 120
19:58:01.374762 IP 192.168.43.124.8880 > 192.168.43.146.7771: UDP, length 120
19:58:01.385154 IP 192.168.43.147.8880 > 192.168.43.124.7773: UDP, length 120
19:58:01.405001 IP 192.168.43.147.8880 > 192.168.43.124.7773: UDP, length 120
19:58:01.424818 IP 192.168.43.124.8880 > 192.168.43.146.7771: UDP, length 120
19:58:01.456457 IP 192.168.43.147.8880 > 192.168.43.124.7773: UDP, length 120
19:58:01.474859 IP 192.168.43.124.8880 > 192.168.43.146.7771: UDP, length 120
19:58:01.524754 IP 192.168.43.124.8880 > 192.168.43.146.7771: UDP, length 120
19:58:01.564110 IP 192.168.43.147.8880 > 192.168.43.124.7773: UDP, length 120
19:58:01.564122 IP 192.168.43.147.8880 > 192.168.43.124.7773: UDP, length 120
19:58:01.574817 IP 192.168.43.124.8880 > 192.168.43.146.7771: UDP, length 120
19:58:01.600669 IP 192.168.43.147.8880 > 192.168.43.124.7773: UDP, length 120
19:58:01.624819 IP 192.168.43.124.8880 > 192.168.43.146.7771: UDP, length 120
19:58:01.650605 IP 192.168.43.147.8880 > 192.168.43.124.7773: UDP, length 120
19:58:01.674752 IP 192.168.43.124.8880 > 192.168.43.146.7771: UDP, length 120
19:58:01.701074 IP 192.168.43.147.8880 > 192.168.43.124.7773: UDP, length 120
19:58:01.724817 IP 192.168.43.124.8880 > 192.168.43.146.7771: UDP, length 120
19:58:01.748465 IP 192.168.43.147.8880 > 192.168.43.124.7773: UDP, length 120
19:58:01.774740 IP 192.168.43.124.8880 > 192.168.43.146.7771: UDP, length 120
19:58:01.804468 IP 192.168.43.147.8880 > 192.168.43.124.7773: UDP, length 120
19:58:01.824818 IP 192.168.43.124.8880 > 192.168.43.146.7771: UDP, length 120
19:58:01.872617 IP 192.168.43.147.8880 > 192.168.43.124.7773: UDP, length 120
19:58:01.874819 IP 192.168.43.124.8880 > 192.168.43.146.7771: UDP, length 120
19:58:01.900731 IP 192.168.43.147.8880 > 192.168.43.124.7773: UDP, length 120
19:58:01.924786 IP 192.168.43.124.8880 > 192.168.43.146.7771: UDP, length 120
19:58:01.952519 IP 192.168.43.147.8880 > 192.168.43.124.7773: UDP, length 120
19:58:01.974759 IP 192.168.43.124.8880 > 192.168.43.146.7771: UDP, length 120
19:58:02.001503 IP 192.168.43.147.8880 > 192.168.43.124.7773: UDP, length 120
19:58:02.024869 IP 192.168.43.124.8880 > 192.168.43.146.7771: UDP, length 120
19:58:02.054664 IP 192.168.43.147.8880 > 192.168.43.124.7773: UDP, length 120
19:58:02.074866 IP 192.168.43.124.8880 > 192.168.43.146.7771: UDP, length 120
19:58:02.104078 IP 192.168.43.147.8880 > 192.168.43.124.7773: UDP, length 120
19:58:02.124876 IP 192.168.43.124.8880 > 192.168.43.146.7771: UDP, length 120
19:58:02.151146 IP 192.168.43.147.8880 > 192.168.43.124.7773: UDP, length 120
19:58:02.174820 IP 192.168.43.124.8880 > 192.168.43.146.7771: UDP, length 120
19:58:02.200561 IP 192.168.43.147.8880 > 192.168.43.124.7773: UDP, length 120
19:58:02.224815 IP 192.168.43.124.8880 > 192.168.43.146.7771: UDP, length 120
19:58:02.257357 IP 192.168.43.147.8880 > 192.168.43.124.7773: UDP, length 120
19:58:02.274816 IP 192.168.43.124.8880 > 192.168.43.146.7771: UDP, length 120
19:58:02.300610 IP 192.168.43.147.8880 > 192.168.43.124.7773: UDP, length 120
19:58:02.324739 IP 192.168.43.124.8880 > 192.168.43.146.7771: UDP, length 120
19:58:02.351454 IP 192.168.43.147.8880 > 192.168.43.124.7773: UDP, length 120
19:58:02.374816 IP 192.168.43.124.8880 > 192.168.43.146.7771: UDP, length 120
19:58:02.403333 IP 192.168.43.147.8880 > 192.168.43.124.7773: UDP, length 120
19:58:02.424819 IP 192.168.43.124.8880 > 192.168.43.146.7771: UDP, length 120
19:58:02.453841 IP 192.168.43.147.8880 > 192.168.43.124.7773: UDP, length 120
19:58:02.474815 IP 192.168.43.124.8880 > 192.168.43.146.7771: UDP, length 120
19:58:02.502518 IP 192.168.43.147.8880 > 192.168.43.124.7773: UDP, length 120
19:58:02.524814 IP 192.168.43.124.8880 > 192.168.43.146.7771: UDP, length 120
19:58:02.556615 IP 192.168.43.147.8880 > 192.168.43.124.7773: UDP, length 120
19:58:02.574817 IP 192.168.43.124.8880 > 192.168.43.146.7771: UDP, length 120
19:58:02.605095 IP 192.168.43.147.8880 > 192.168.43.124.7773: UDP, length 120
19:58:02.624812 IP 192.168.43.124.8880 > 192.168.43.146.7771: UDP, length 120
19:58:02.650146 IP 192.168.43.147.8880 > 192.168.43.124.7773: UDP, length 120
19:58:02.674820 IP 192.168.43.124.8880 > 192.168.43.146.7771: UDP, length 120
19:58:02.704142 IP 192.168.43.147.8880 > 192.168.43.124.7773: UDP, length 120
19:58:02.724816 IP 192.168.43.124.8880 > 192.168.43.146.7771: UDP, length 120
19:58:02.751008 IP 192.168.43.147.8880 > 192.168.43.124.7773: UDP, length 120
19:58:02.774816 IP 192.168.43.124.8880 > 192.168.43.146.7771: UDP, length 120
19:58:02.801991 IP 192.168.43.147.8880 > 192.168.43.124.7773: UDP, length 120
19:58:02.824817 IP 192.168.43.124.8880 > 192.168.43.146.7771: UDP, length 120
19:58:02.850391 IP 192.168.43.147.8880 > 192.168.43.124.7773: UDP, length 120
19:58:02.874744 IP 192.168.43.124.8880 > 192.168.43.146.7771: UDP, length 120
19:58:02.908404 IP 192.168.43.147.8880 > 192.168.43.124.7773: UDP, length 120
19:58:02.924817 IP 192.168.43.124.8880 > 192.168.43.146.7771: UDP, length 120
19:58:02.950087 IP 192.168.43.147.8880 > 192.168.43.124.7773: UDP, length 120
19:58:02.974837 IP 192.168.43.124.8880 > 192.168.43.146.7771: UDP, length 120
19:58:03.002691 IP 192.168.43.147.8880 > 192.168.43.124.7773: UDP, length 120
19:58:03.024816 IP 192.168.43.124.8880 > 192.168.43.146.7771: UDP, length 120
19:58:03.050189 IP 192.168.43.147.8880 > 192.168.43.124.7773: UDP, length 120
19:58:03.074815 IP 192.168.43.124.8880 > 192.168.43.146.7771: UDP, length 120
19:58:03.100130 IP 192.168.43.147.8880 > 192.168.43.124.7773: UDP, length 120
19:58:03.124812 IP 192.168.43.124.8880 > 192.168.43.146.7771: UDP, length 120
19:58:03.154213 IP 192.168.43.147.8880 > 192.168.43.124.7773: UDP, length 120
19:58:03.174817 IP 192.168.43.124.8880 > 192.168.43.146.7771: UDP, length 120
19:58:03.201953 IP 192.168.43.147.8880 > 192.168.43.124.7773: UDP, length 120
19:58:03.224814 IP 192.168.43.124.8880 > 192.168.43.146.7771: UDP, length 120
19:58:03.252528 IP 192.168.43.147.8880 > 192.168.43.124.7773: UDP, length 120
19:58:03.274817 IP 192.168.43.124.8880 > 192.168.43.146.7771: UDP, length 120
19:58:03.301135 IP 192.168.43.147.8880 > 192.168.43.124.7773: UDP, length 120
19:58:03.324815 IP 192.168.43.124.8880 > 192.168.43.146.7771: UDP, length 120
19:58:03.353455 IP 192.168.43.147.8880 > 192.168.43.124.7773: UDP, length 120
19:58:03.374815 IP 192.168.43.124.8880 > 192.168.43.146.7771: UDP, length 120
19:58:03.401420 IP 192.168.43.147.8880 > 192.168.43.124.7773: UDP, length 120
19:58:03.424737 IP 192.168.43.124.8880 > 192.168.43.146.7771: UDP, length 120
19:58:03.453181 IP 192.168.43.147.8880 > 192.168.43.124.7773: UDP, length 120
19:58:03.474817 IP 192.168.43.124.8880 > 192.168.43.146.7771: UDP, length 120
19:58:03.502506 IP 192.168.43.147.8880 > 192.168.43.124.7773: UDP, length 120
19:58:03.524810 IP 192.168.43.124.8880 > 192.168.43.146.7771: UDP, length 120
19:58:03.552721 IP 192.168.43.147.8880 > 192.168.43.124.7773: UDP, length 120
19:58:03.574840 IP 192.168.43.124.8880 > 192.168.43.146.7771: UDP, length 120
19:58:03.605595 IP 192.168.43.147.8880 > 192.168.43.124.7773: UDP, length 120
19:58:03.624862 IP 192.168.43.124.8880 > 192.168.43.146.7771: UDP, length 120
19:58:03.654609 IP 192.168.43.147.8880 > 192.168.43.124.7773: UDP, length 120
19:58:03.674764 IP 192.168.43.124.8880 > 192.168.43.146.7771: UDP, length 120
19:58:03.700531 IP 192.168.43.147.8880 > 192.168.43.124.7773: UDP, length 120
19:58:03.724812 IP 192.168.43.124.8880 > 192.168.43.146.7771: UDP, length 120
19:58:03.749883 IP 192.168.43.147.8880 > 192.168.43.124.7773: UDP, length 120
19:58:03.774817 IP 192.168.43.124.8880 > 192.168.43.146.7771: UDP, length 120
19:58:03.800746 IP 192.168.43.147.8880 > 192.168.43.124.7773: UDP, length 120
19:58:03.824782 IP 192.168.43.124.8880 > 192.168.43.146.7771: UDP, length 120
19:58:03.860742 IP 192.168.43.147.8880 > 192.168.43.124.7773: UDP, length 120
19:58:03.874951 IP 192.168.43.124.8880 > 192.168.43.146.7771: UDP, length 120
19:58:03.901340 IP 192.168.43.147.8880 > 192.168.43.124.7773: UDP, length 120
19:58:03.924764 IP 192.168.43.124.8880 > 192.168.43.146.7771: UDP, length 120
19:58:03.954792 IP 192.168.43.147.8880 > 192.168.43.124.7773: UDP, length 120
19:58:03.974816 IP 192.168.43.124.8880 > 192.168.43.146.7771: UDP, length 120
19:58:03.999858 IP 192.168.43.147.8880 > 192.168.43.124.7773: UDP, length 120
19:58:04.024813 IP 192.168.43.124.8880 > 192.168.43.146.7771: UDP, length 120
19:58:04.056168 IP 192.168.43.147.8880 > 192.168.43.124.7773: UDP, length 120
19:58:04.074811 IP 192.168.43.124.8880 > 192.168.43.146.7771: UDP, length 120
19:58:04.099964 IP 192.168.43.147.8880 > 192.168.43.124.7773: UDP, length 120
19:58:04.124867 IP 192.168.43.124.8880 > 192.168.43.146.7771: UDP, length 120
19:58:04.151615 IP 192.168.43.147.8880 > 192.168.43.124.7773: UDP, length 120
19:58:04.174821 IP 192.168.43.124.8880 > 192.168.43.146.7771: UDP, length 120
19:58:04.200454 IP 192.168.43.147.8880 > 192.168.43.124.7773: UDP, length 120
19:58:04.224812 IP 192.168.43.124.8880 > 192.168.43.146.7771: UDP, length 120
19:58:04.251062 IP 192.168.43.147.8880 > 192.168.43.124.7773: UDP, length 120
19:58:04.274774 IP 192.168.43.124.8880 > 192.168.43.146.7771: UDP, length 120
19:58:04.301518 IP 192.168.43.147.8880 > 192.168.43.124.7773: UDP, length 120
19:58:04.324862 IP 192.168.43.124.8880 > 192.168.43.146.7771: UDP, length 120
19:58:04.350616 IP 192.168.43.147.8880 > 192.168.43.124.7773: UDP, length 120
19:58:04.374764 IP 192.168.43.124.8880 > 192.168.43.146.7771: UDP, length 120
19:58:04.400273 IP 192.168.43.147.8880 > 192.168.43.124.7773: UDP, length 120
19:58:04.424814 IP 192.168.43.124.8880 > 192.168.43.146.7771: UDP, length 120
19:58:04.449656 IP 192.168.43.147.8880 > 192.168.43.124.7773: UDP, length 120
19:58:04.474749 IP 192.168.43.124.8880 > 192.168.43.146.7771: UDP, length 120
19:58:04.500990 IP 192.168.43.147.8880 > 192.168.43.124.7773: UDP, length 120
19:58:04.524815 IP 192.168.43.124.8880 > 192.168.43.146.7771: UDP, length 120
19:58:04.554723 IP 192.168.43.147.8880 > 192.168.43.124.7773: UDP, length 120
19:58:04.574812 IP 192.168.43.124.8880 > 192.168.43.146.7771: UDP, length 120
19:58:04.601549 IP 192.168.43.147.8880 > 192.168.43.124.7773: UDP, length 120
19:58:04.624814 IP 192.168.43.124.8880 > 192.168.43.146.7771: UDP, length 120
19:58:04.674813 IP 192.168.43.124.8880 > 192.168.43.146.7771: UDP, length 120
19:58:04.724811 IP 192.168.43.124.8880 > 192.168.43.146.7771: UDP, length 120
19:58:04.736929 IP 192.168.43.147.8880 > 192.168.43.124.7773: UDP, length 120
19:58:04.736944 IP 192.168.43.147.8880 > 192.168.43.124.7773: UDP, length 120
19:58:04.756467 IP 192.168.43.147.8880 > 192.168.43.124.7773: UDP, length 120
19:58:04.774811 IP 192.168.43.124.8880 > 192.168.43.146.7771: UDP, length 120
19:58:04.806810 IP 192.168.43.147.8880 > 192.168.43.124.7773: UDP, length 120
19:58:04.824814 IP 192.168.43.124.8880 > 192.168.43.146.7771: UDP, length 120
19:58:04.874874 IP 192.168.43.124.8880 > 192.168.43.146.7771: UDP, length 120
19:58:04.887436 IP 192.168.43.147.8880 > 192.168.43.124.7773: UDP, length 120
19:58:04.900604 IP 192.168.43.147.8880 > 192.168.43.124.7773: UDP, length 120
19:58:04.924747 IP 192.168.43.124.8880 > 192.168.43.146.7771: UDP, length 120
19:58:04.954942 IP 192.168.43.147.8880 > 192.168.43.124.7773: UDP, length 120
19:58:04.974811 IP 192.168.43.124.8880 > 192.168.43.146.7771: UDP, length 120
19:58:05.004025 IP 192.168.43.147.8880 > 192.168.43.124.7773: UDP, length 120
19:58:05.024752 IP 192.168.43.124.8880 > 192.168.43.146.7771: UDP, length 120
19:58:05.054214 IP 192.168.43.147.8880 > 192.168.43.124.7773: UDP, length 120
19:58:05.074746 IP 192.168.43.124.8880 > 192.168.43.146.7771: UDP, length 120
19:58:05.105851 IP 192.168.43.147.8880 > 192.168.43.124.7773: UDP, length 120
19:58:05.124785 IP 192.168.43.124.8880 > 192.168.43.146.7771: UDP, length 120
19:58:05.150388 IP 192.168.43.147.8880 > 192.168.43.124.7773: UDP, length 120
19:58:05.174817 IP 192.168.43.124.8880 > 192.168.43.146.7771: UDP, length 120
19:58:05.199417 IP 192.168.43.147.8880 > 192.168.43.124.7773: UDP, length 120
19:58:05.224817 IP 192.168.43.124.8880 > 192.168.43.146.7771: UDP, length 120
19:58:05.248254 IP 192.168.43.147.8880 > 192.168.43.124.7773: UDP, length 120
19:58:05.274818 IP 192.168.43.124.8880 > 192.168.43.146.7771: UDP, length 120
19:58:05.300044 IP 192.168.43.147.8880 > 192.168.43.124.7773: UDP, length 120
19:58:05.324818 IP 192.168.43.124.8880 > 192.168.43.146.7771: UDP, length 120
19:58:05.350141 IP 192.168.43.147.8880 > 192.168.43.124.7773: UDP, length 120
19:58:05.374766 IP 192.168.43.124.8880 > 192.168.43.146.7771: UDP, length 120
19:58:05.401308 IP 192.168.43.147.8880 > 192.168.43.124.7773: UDP, length 120
19:58:05.424748 IP 192.168.43.124.8880 > 192.168.43.146.7771: UDP, length 120
19:58:05.450815 IP 192.168.43.147.8880 > 192.168.43.124.7773: UDP, length 120
19:58:05.474817 IP 192.168.43.124.8880 > 192.168.43.146.7771: UDP, length 120
19:58:05.499437 IP 192.168.43.147.8880 > 192.168.43.124.7773: UDP, length 120
19:58:05.524778 IP 192.168.43.124.8880 > 192.168.43.146.7771: UDP, length 120
19:58:05.553175 IP 192.168.43.147.8880 > 192.168.43.124.7773: UDP, length 120
19:58:05.574817 IP 192.168.43.124.8880 > 192.168.43.146.7771: UDP, length 120
19:58:05.600461 IP 192.168.43.147.8880 > 192.168.43.124.7773: UDP, length 120
19:58:05.624814 IP 192.168.43.124.8880 > 192.168.43.146.7771: UDP, length 120
19:58:05.657764 IP 192.168.43.147.8880 > 192.168.43.124.7773: UDP, length 120
19:58:05.674781 IP 192.168.43.124.8880 > 192.168.43.146.7771: UDP, length 120
19:58:05.709872 IP 192.168.43.147.8880 > 192.168.43.124.7773: UDP, length 120
19:58:05.724818 IP 192.168.43.124.8880 > 192.168.43.146.7771: UDP, length 120
19:58:05.752332 IP 192.168.43.147.8880 > 192.168.43.124.7773: UDP, length 120
19:58:05.774781 IP 192.168.43.124.8880 > 192.168.43.146.7771: UDP, length 120
19:58:05.797348 IP 192.168.43.147.8880 > 192.168.43.124.7773: UDP, length 120
19:58:05.824817 IP 192.168.43.124.8880 > 192.168.43.146.7771: UDP, length 120
19:58:05.847694 IP 192.168.43.147.8880 > 192.168.43.124.7773: UDP, length 120
19:58:05.874895 IP 192.168.43.124.8880 > 192.168.43.146.7771: UDP, length 120
19:58:05.899615 IP 192.168.43.147.8880 > 192.168.43.124.7773: UDP, length 120
19:58:05.924821 IP 192.168.43.124.8880 > 192.168.43.146.7771: UDP, length 120
19:58:05.949396 IP 192.168.43.147.8880 > 192.168.43.124.7773: UDP, length 120
19:58:05.974745 IP 192.168.43.124.8880 > 192.168.43.146.7771: UDP, length 120
19:58:06.002303 IP 192.168.43.147.8880 > 192.168.43.124.7773: UDP, length 120
19:58:06.024734 IP 192.168.43.124.8880 > 192.168.43.146.7771: UDP, length 120
19:58:06.050632 IP 192.168.43.147.8880 > 192.168.43.124.7773: UDP, length 120
19:58:06.074745 IP 192.168.43.124.8880 > 192.168.43.146.7771: UDP, length 120
19:58:06.104025 IP 192.168.43.147.8880 > 192.168.43.124.7773: UDP, length 120
19:58:06.124866 IP 192.168.43.124.8880 > 192.168.43.146.7771: UDP, length 120
19:58:06.149971 IP 192.168.43.147.8880 > 192.168.43.124.7773: UDP, length 120
19:58:06.174818 IP 192.168.43.124.8880 > 192.168.43.146.7771: UDP, length 120
19:58:06.206335 IP 192.168.43.147.8880 > 192.168.43.124.7773: UDP, length 120
19:58:06.224866 IP 192.168.43.124.8880 > 192.168.43.146.7771: UDP, length 120
19:58:06.249279 IP 192.168.43.147.8880 > 192.168.43.124.7773: UDP, length 120
19:58:06.274797 IP 192.168.43.124.8880 > 192.168.43.146.7771: UDP, length 120
19:58:06.300281 IP 192.168.43.147.8880 > 192.168.43.124.7773: UDP, length 120
19:58:06.324866 IP 192.168.43.124.8880 > 192.168.43.146.7771: UDP, length 120
19:58:06.355197 IP 192.168.43.147.8880 > 192.168.43.124.7773: UDP, length 120
19:58:06.374759 IP 192.168.43.124.8880 > 192.168.43.146.7771: UDP, length 120
19:58:06.400920 IP 192.168.43.147.8880 > 192.168.43.124.7773: UDP, length 120
19:58:06.424818 IP 192.168.43.124.8880 > 192.168.43.146.7771: UDP, length 120
19:58:06.449400 IP 192.168.43.147.8880 > 192.168.43.124.7773: UDP, length 120
19:58:06.474730 IP 192.168.43.124.8880 > 192.168.43.146.7771: UDP, length 120
19:58:06.499676 IP 192.168.43.147.8880 > 192.168.43.124.7773: UDP, length 120
19:58:06.524816 IP 192.168.43.124.8880 > 192.168.43.146.7771: UDP, length 120
19:58:06.553222 IP 192.168.43.147.8880 > 192.168.43.124.7773: UDP, length 120
19:58:06.574823 IP 192.168.43.124.8880 > 192.168.43.146.7771: UDP, length 120
19:58:06.599279 IP 192.168.43.147.8880 > 192.168.43.124.7773: UDP, length 120
19:58:06.624815 IP 192.168.43.124.8880 > 192.168.43.146.7771: UDP, length 120
19:58:06.649111 IP 192.168.43.147.8880 > 192.168.43.124.7773: UDP, length 120
19:58:06.674802 IP 192.168.43.124.8880 > 192.168.43.146.7771: UDP, length 120
19:58:06.700901 IP 192.168.43.147.8880 > 192.168.43.124.7773: UDP, length 120
19:58:06.724750 IP 192.168.43.124.8880 > 192.168.43.146.7771: UDP, length 120
19:58:06.753441 IP 192.168.43.147.8880 > 192.168.43.124.7773: UDP, length 120
19:58:06.774818 IP 192.168.43.124.8880 > 192.168.43.146.7771: UDP, length 120
19:58:06.802867 IP 192.168.43.147.8880 > 192.168.43.124.7773: UDP, length 120
19:58:06.824817 IP 192.168.43.124.8880 > 192.168.43.146.7771: UDP, length 120
19:58:06.848936 IP 192.168.43.147.8880 > 192.168.43.124.7773: UDP, length 120
19:58:06.874770 IP 192.168.43.124.8880 > 192.168.43.146.7771: UDP, length 120
19:58:06.899801 IP 192.168.43.147.8880 > 192.168.43.124.7773: UDP, length 120
19:58:06.924782 IP 192.168.43.124.8880 > 192.168.43.146.7771: UDP, length 120
19:58:06.948993 IP 192.168.43.147.8880 > 192.168.43.124.7773: UDP, length 120
19:58:06.974758 IP 192.168.43.124.8880 > 192.168.43.146.7771: UDP, length 120
19:58:07.002211 IP 192.168.43.147.8880 > 192.168.43.124.7773: UDP, length 120
19:58:07.024817 IP 192.168.43.124.8880 > 192.168.43.146.7771: UDP, length 120
19:58:07.055077 IP 192.168.43.147.8880 > 192.168.43.124.7773: UDP, length 120
19:58:07.074814 IP 192.168.43.124.8880 > 192.168.43.146.7771: UDP, length 120
19:58:07.104301 IP 192.168.43.147.8880 > 192.168.43.124.7773: UDP, length 120
19:58:07.124864 IP 192.168.43.124.8880 > 192.168.43.146.7771: UDP, length 120
19:58:07.153621 IP 192.168.43.147.8880 > 192.168.43.124.7773: UDP, length 120
19:58:07.174863 IP 192.168.43.124.8880 > 192.168.43.146.7771: UDP, length 120
19:58:07.200164 IP 192.168.43.147.8880 > 192.168.43.124.7773: UDP, length 120
19:58:07.224865 IP 192.168.43.124.8880 > 192.168.43.146.7771: UDP, length 120
19:58:07.249615 IP 192.168.43.147.8880 > 192.168.43.124.7773: UDP, length 120
19:58:07.274863 IP 192.168.43.124.8880 > 192.168.43.146.7771: UDP, length 120
19:58:07.299818 IP 192.168.43.147.8880 > 192.168.43.124.7773: UDP, length 120
19:58:07.324865 IP 192.168.43.124.8880 > 192.168.43.146.7771: UDP, length 120
19:58:07.351879 IP 192.168.43.147.8880 > 192.168.43.124.7773: UDP, length 120
19:58:07.374875 IP 192.168.43.124.8880 > 192.168.43.146.7771: UDP, length 120
19:58:07.399147 IP 192.168.43.147.8880 > 192.168.43.124.7773: UDP, length 120
19:58:07.424817 IP 192.168.43.124.8880 > 192.168.43.146.7771: UDP, length 120
19:58:07.448756 IP 192.168.43.147.8880 > 192.168.43.124.7773: UDP, length 120
19:58:07.474749 IP 192.168.43.124.8880 > 192.168.43.146.7771: UDP, length 120
19:58:07.500465 IP 192.168.43.147.8880 > 192.168.43.124.7773: UDP, length 120
19:58:07.524821 IP 192.168.43.124.8880 > 192.168.43.146.7771: UDP, length 120
19:58:07.549047 IP 192.168.43.147.8880 > 192.168.43.124.7773: UDP, length 120
19:58:07.574820 IP 192.168.43.124.8880 > 192.168.43.146.7771: UDP, length 120
19:58:07.602911 IP 192.168.43.147.8880 > 192.168.43.124.7773: UDP, length 120
19:58:07.624866 IP 192.168.43.124.8880 > 192.168.43.146.7771: UDP, length 120
19:58:07.648027 IP 192.168.43.147.8880 > 192.168.43.124.7773: UDP, length 120
19:58:07.674784 IP 192.168.43.124.8880 > 192.168.43.146.7771: UDP, length 120
19:58:07.704027 IP 192.168.43.147.8880 > 192.168.43.124.7773: UDP, length 120
19:58:07.724856 IP 192.168.43.124.8880 > 192.168.43.146.7771: UDP, length 120
19:58:07.755717 IP 192.168.43.147.8880 > 192.168.43.124.7773: UDP, length 120
19:58:07.774769 IP 192.168.43.124.8880 > 192.168.43.146.7771: UDP, length 120
19:58:07.804978 IP 192.168.43.147.8880 > 192.168.43.124.7773: UDP, length 120
19:58:07.824817 IP 192.168.43.124.8880 > 192.168.43.146.7771: UDP, length 120
19:58:07.852881 IP 192.168.43.147.8880 > 192.168.43.124.7773: UDP, length 120
19:58:07.874804 IP 192.168.43.124.8880 > 192.168.43.146.7771: UDP, length 120
19:58:07.902591 IP 192.168.43.147.8880 > 192.168.43.124.7773: UDP, length 120
19:58:07.924740 IP 192.168.43.124.8880 > 192.168.43.146.7771: UDP, length 120
19:58:07.954824 IP 192.168.43.147.8880 > 192.168.43.124.7773: UDP, length 120
19:58:07.974816 IP 192.168.43.124.8880 > 192.168.43.146.7771: UDP, length 120
19:58:07.999678 IP 192.168.43.147.8880 > 192.168.43.124.7773: UDP, length 120
19:58:08.024816 IP 192.168.43.124.8880 > 192.168.43.146.7771: UDP, length 120
19:58:08.050108 IP 192.168.43.147.8880 > 192.168.43.124.7773: UDP, length 120
19:58:08.074810 IP 192.168.43.124.8880 > 192.168.43.146.7771: UDP, length 120
19:58:08.102262 IP 192.168.43.147.8880 > 192.168.43.124.7773: UDP, length 120
19:58:08.124839 IP 192.168.43.124.8880 > 192.168.43.146.7771: UDP, length 120
19:58:08.174834 IP 192.168.43.124.8880 > 192.168.43.146.7771: UDP, length 120
19:58:08.187651 IP 192.168.43.147.8880 > 192.168.43.124.7773: UDP, length 120
19:58:08.201247 IP 192.168.43.147.8880 > 192.168.43.124.7773: UDP, length 120
19:58:08.224836 IP 192.168.43.124.8880 > 192.168.43.146.7771: UDP, length 120
19:58:08.265542 IP 192.168.43.147.8880 > 192.168.43.124.7773: UDP, length 120
19:58:08.274839 IP 192.168.43.124.8880 > 192.168.43.146.7771: UDP, length 120
19:58:08.298841 IP 192.168.43.147.8880 > 192.168.43.124.7773: UDP, length 120
19:58:08.324811 IP 192.168.43.124.8880 > 192.168.43.146.7771: UDP, length 120
19:58:08.362827 IP 192.168.43.147.8880 > 192.168.43.124.7773: UDP, length 120
19:58:08.374813 IP 192.168.43.124.8880 > 192.168.43.146.7771: UDP, length 120
19:58:08.398805 IP 192.168.43.147.8880 > 192.168.43.124.7773: UDP, length 120
19:58:08.424817 IP 192.168.43.124.8880 > 192.168.43.146.7771: UDP, length 120
19:58:08.448792 IP 192.168.43.147.8880 > 192.168.43.124.7773: UDP, length 120
19:58:08.474739 IP 192.168.43.124.8880 > 192.168.43.146.7771: UDP, length 120
19:58:08.499124 IP 192.168.43.147.8880 > 192.168.43.124.7773: UDP, length 120
19:58:08.524742 IP 192.168.43.124.8880 > 192.168.43.146.7771: UDP, length 120
19:58:08.550189 IP 192.168.43.147.8880 > 192.168.43.124.7773: UDP, length 120
19:58:08.574813 IP 192.168.43.124.8880 > 192.168.43.146.7771: UDP, length 120
19:58:08.601619 IP 192.168.43.147.8880 > 192.168.43.124.7773: UDP, length 120
19:58:08.624814 IP 192.168.43.124.8880 > 192.168.43.146.7771: UDP, length 120
19:58:08.648557 IP 192.168.43.147.8880 > 192.168.43.124.7773: UDP, length 120
19:58:08.674890 IP 192.168.43.124.8880 > 192.168.43.146.7771: UDP, length 120
19:58:08.706725 IP 192.168.43.147.8880 > 192.168.43.124.7773: UDP, length 120
19:58:08.724816 IP 192.168.43.124.8880 > 192.168.43.146.7771: UDP, length 120
19:58:08.750123 IP 192.168.43.147.8880 > 192.168.43.124.7773: UDP, length 120
19:58:08.774813 IP 192.168.43.124.8880 > 192.168.43.146.7771: UDP, length 120
19:58:08.824817 IP 192.168.43.124.8880 > 192.168.43.146.7771: UDP, length 120
19:58:08.831963 IP 192.168.43.147.8880 > 192.168.43.124.7773: UDP, length 120
19:58:08.874829 IP 192.168.43.124.8880 > 192.168.43.146.7771: UDP, length 120
19:58:08.919213 IP 192.168.43.147.8880 > 192.168.43.124.7773: UDP, length 120
19:58:08.919227 IP 192.168.43.147.8880 > 192.168.43.124.7773: UDP, length 120
19:58:08.924782 IP 192.168.43.124.8880 > 192.168.43.146.7771: UDP, length 120
19:58:08.974886 IP 192.168.43.124.8880 > 192.168.43.146.7771: UDP, length 120
19:58:09.024826 IP 192.168.43.124.8880 > 192.168.43.146.7771: UDP, length 120
19:58:09.074818 IP 192.168.43.124.8880 > 192.168.43.146.7771: UDP, length 120
19:58:09.124866 IP 192.168.43.124.8880 > 192.168.43.146.7771: UDP, length 120
19:58:09.136711 IP 192.168.43.147.8880 > 192.168.43.124.7773: UDP, length 120
19:58:09.136735 IP 192.168.43.147.8880 > 192.168.43.124.7773: UDP, length 120
19:58:09.136739 IP 192.168.43.147.8880 > 192.168.43.124.7773: UDP, length 120
19:58:09.136742 IP 192.168.43.147.8880 > 192.168.43.124.7773: UDP, length 120
19:58:09.174885 IP 192.168.43.124.8880 > 192.168.43.146.7771: UDP, length 120
19:58:09.177218 IP 192.168.43.147.8880 > 192.168.43.124.7773: UDP, length 120
19:58:09.201032 IP 192.168.43.147.8880 > 192.168.43.124.7773: UDP, length 120
19:58:09.224818 IP 192.168.43.124.8880 > 192.168.43.146.7771: UDP, length 120
19:58:09.253161 IP 192.168.43.147.8880 > 192.168.43.124.7773: UDP, length 120
19:58:09.274816 IP 192.168.43.124.8880 > 192.168.43.146.7771: UDP, length 120
19:58:09.311411 IP 192.168.43.147.8880 > 192.168.43.124.7773: UDP, length 120
19:58:09.324816 IP 192.168.43.124.8880 > 192.168.43.146.7771: UDP, length 120
19:58:09.347237 IP 192.168.43.147.8880 > 192.168.43.124.7773: UDP, length 120
