23:57:56.709067 IP 192.168.43.146.8880 > 192.168.43.147.7772: UDP, length 120
23:57:56.765701 IP 192.168.43.146.8880 > 192.168.43.147.7772: UDP, length 120
23:57:56.827771 IP 192.168.43.146.8880 > 192.168.43.147.7772: UDP, length 120
23:57:56.870305 IP 192.168.43.146.8880 > 192.168.43.147.7772: UDP, length 120
23:57:56.915798 IP 192.168.43.146.8880 > 192.168.43.147.7772: UDP, length 120
23:57:56.957562 IP 192.168.43.146.8880 > 192.168.43.147.7772: UDP, length 120
23:57:56.976525 IP 192.168.43.147.8880 > 192.168.43.124.7773: UDP, length 120
23:57:57.005263 IP 192.168.43.146.8880 > 192.168.43.147.7772: UDP, length 120
23:57:57.026451 IP 192.168.43.147.8880 > 192.168.43.124.7773: UDP, length 120
23:57:57.066531 IP 192.168.43.146.8880 > 192.168.43.147.7772: UDP, length 120
23:57:57.076441 IP 192.168.43.147.8880 > 192.168.43.124.7773: UDP, length 120
23:57:57.117251 IP 192.168.43.146.8880 > 192.168.43.147.7772: UDP, length 120
23:57:57.126435 IP 192.168.43.147.8880 > 192.168.43.124.7773: UDP, length 120
23:57:57.159810 IP 192.168.43.146.8880 > 192.168.43.147.7772: UDP, length 120
23:57:57.176433 IP 192.168.43.147.8880 > 192.168.43.124.7773: UDP, length 120
23:57:57.210836 IP 192.168.43.146.8880 > 192.168.43.147.7772: UDP, length 120
23:57:57.226442 IP 192.168.43.147.8880 > 192.168.43.124.7773: UDP, length 120
23:57:57.264183 IP 192.168.43.146.8880 > 192.168.43.147.7772: UDP, length 120
23:57:57.276448 IP 192.168.43.147.8880 > 192.168.43.124.7773: UDP, length 120
23:57:57.313137 IP 192.168.43.146.8880 > 192.168.43.147.7772: UDP, length 120
23:57:57.326439 IP 192.168.43.147.8880 > 192.168.43.124.7773: UDP, length 120
23:57:57.363895 IP 192.168.43.146.8880 > 192.168.43.147.7772: UDP, length 120
23:57:57.376447 IP 192.168.43.147.8880 > 192.168.43.124.7773: UDP, length 120
23:57:57.409553 IP 192.168.43.146.8880 > 192.168.43.147.7772: UDP, length 120
23:57:57.426438 IP 192.168.43.147.8880 > 192.168.43.124.7773: UDP, length 120
23:57:57.465983 IP 192.168.43.146.8880 > 192.168.43.147.7772: UDP, length 120
23:57:57.476493 IP 192.168.43.147.8880 > 192.168.43.124.7773: UDP, length 120
23:57:57.512243 IP 192.168.43.146.8880 > 192.168.43.147.7772: UDP, length 120
23:57:57.526459 IP 192.168.43.147.8880 > 192.168.43.124.7773: UDP, length 120
23:57:57.561696 IP 192.168.43.146.8880 > 192.168.43.147.7772: UDP, length 120
23:57:57.576457 IP 192.168.43.147.8880 > 192.168.43.124.7773: UDP, length 120
23:57:57.615043 IP 192.168.43.146.8880 > 192.168.43.147.7772: UDP, length 120
23:57:57.626448 IP 192.168.43.147.8880 > 192.168.43.124.7773: UDP, length 120
23:57:57.676443 IP 192.168.43.147.8880 > 192.168.43.124.7773: UDP, length 120
23:57:57.696325 IP 192.168.43.146.8880 > 192.168.43.147.7772: UDP, length 120
23:57:57.726453 IP 192.168.43.147.8880 > 192.168.43.124.7773: UDP, length 120
23:57:57.764838 IP 192.168.43.146.8880 > 192.168.43.147.7772: UDP, length 120
23:57:57.775357 IP 192.168.43.146.8880 > 192.168.43.147.7772: UDP, length 120
23:57:57.776456 IP 192.168.43.147.8880 > 192.168.43.124.7773: UDP, length 120
23:57:57.826443 IP 192.168.43.147.8880 > 192.168.43.124.7773: UDP, length 120
23:57:57.850892 IP 192.168.43.146.8880 > 192.168.43.147.7772: UDP, length 120
23:57:57.876449 IP 192.168.43.147.8880 > 192.168.43.124.7773: UDP, length 120
23:57:57.926471 IP 192.168.43.147.8880 > 192.168.43.124.7773: UDP, length 120
23:57:57.936282 IP 192.168.43.146.8880 > 192.168.43.147.7772: UDP, length 120
23:57:57.953377 IP 192.168.43.146.8880 > 192.168.43.147.7772: UDP, length 120
23:57:57.959767 IP 192.168.43.146.8880 > 192.168.43.147.7772: UDP, length 120
23:57:57.976466 IP 192.168.43.147.8880 > 192.168.43.124.7773: UDP, length 120
23:57:58.026447 IP 192.168.43.147.8880 > 192.168.43.124.7773: UDP, length 120
23:57:58.055965 IP 192.168.43.146.8880 > 192.168.43.147.7772: UDP, length 120
23:57:58.056420 IP 192.168.43.146.8880 > 192.168.43.147.7772: UDP, length 120
23:57:58.076454 IP 192.168.43.147.8880 > 192.168.43.124.7773: UDP, length 120
23:57:58.126442 IP 192.168.43.147.8880 > 192.168.43.124.7773: UDP, length 120
23:57:58.137309 IP 192.168.43.146.8880 > 192.168.43.147.7772: UDP, length 120
23:57:58.155640 IP 192.168.43.146.8880 > 192.168.43.147.7772: UDP, length 120
23:57:58.176453 IP 192.168.43.147.8880 > 192.168.43.124.7773: UDP, length 120
23:57:58.220023 IP 192.168.43.146.8880 > 192.168.43.147.7772: UDP, length 120
23:57:58.226446 IP 192.168.43.147.8880 > 192.168.43.124.7773: UDP, length 120
23:57:58.261241 IP 192.168.43.146.8880 > 192.168.43.147.7772: UDP, length 120
23:57:58.276440 IP 192.168.43.147.8880 > 192.168.43.124.7773: UDP, length 120
23:57:58.316179 IP 192.168.43.146.8880 > 192.168.43.147.7772: UDP, length 120
23:57:58.326436 IP 192.168.43.147.8880 > 192.168.43.124.7773: UDP, length 120
23:57:58.364095 IP 192.168.43.146.8880 > 192.168.43.147.7772: UDP, length 120
23:57:58.376433 IP 192.168.43.147.8880 > 192.168.43.124.7773: UDP, length 120
23:57:58.426456 IP 192.168.43.147.8880 > 192.168.43.124.7773: UDP, length 120
23:57:58.429634 IP 192.168.43.146.8880 > 192.168.43.147.7772: UDP, length 120
23:57:58.469950 IP 192.168.43.146.8880 > 192.168.43.147.7772: UDP, length 120
23:57:58.476436 IP 192.168.43.147.8880 > 192.168.43.124.7773: UDP, length 120
23:57:58.521903 IP 192.168.43.146.8880 > 192.168.43.147.7772: UDP, length 120
23:57:58.526437 IP 192.168.43.147.8880 > 192.168.43.124.7773: UDP, length 120
23:57:58.564247 IP 192.168.43.146.8880 > 192.168.43.147.7772: UDP, length 120
23:57:58.576435 IP 192.168.43.147.8880 > 192.168.43.124.7773: UDP, length 120
23:57:58.612199 IP 192.168.43.146.8880 > 192.168.43.147.7772: UDP, length 120
23:57:58.626441 IP 192.168.43.147.8880 > 192.168.43.124.7773: UDP, length 120
23:57:58.663581 IP 192.168.43.146.8880 > 192.168.43.147.7772: UDP, length 120
23:57:58.676460 IP 192.168.43.147.8880 > 192.168.43.124.7773: UDP, length 120
23:57:58.716620 IP 192.168.43.146.8880 > 192.168.43.147.7772: UDP, length 120
23:57:58.726438 IP 192.168.43.147.8880 > 192.168.43.124.7773: UDP, length 120
23:57:58.772984 IP 192.168.43.146.8880 > 192.168.43.147.7772: UDP, length 120
23:57:58.776438 IP 192.168.43.147.8880 > 192.168.43.124.7773: UDP, length 120
23:57:58.819899 IP 192.168.43.146.8880 > 192.168.43.147.7772: UDP, length 120
23:57:58.826435 IP 192.168.43.147.8880 > 192.168.43.124.7773: UDP, length 120
23:57:58.873237 IP 192.168.43.146.8880 > 192.168.43.147.7772: UDP, length 120
23:57:58.876439 IP 192.168.43.147.8880 > 192.168.43.124.7773: UDP, length 120
23:57:58.926469 IP 192.168.43.147.8880 > 192.168.43.124.7773: UDP, length 120
23:57:58.974576 IP 192.168.43.146.8880 > 192.168.43.147.7772: UDP, length 120
23:57:58.974770 IP 192.168.43.146.8880 > 192.168.43.147.7772: UDP, length 120
23:57:58.976486 IP 192.168.43.147.8880 > 192.168.43.124.7773: UDP, length 120
23:57:59.019901 IP 192.168.43.146.8880 > 192.168.43.147.7772: UDP, length 120
23:57:59.026444 IP 192.168.43.147.8880 > 192.168.43.124.7773: UDP, length 120
23:57:59.076574 IP 192.168.43.147.8880 > 192.168.43.124.7773: UDP, length 120
23:57:59.080454 IP 192.168.43.146.8880 > 192.168.43.147.7772: UDP, length 120
23:57:59.126444 IP 192.168.43.147.8880 > 192.168.43.124.7773: UDP, length 120
23:57:59.127118 IP 192.168.43.146.8880 > 192.168.43.147.7772: UDP, length 120
23:57:59.167871 IP 192.168.43.146.8880 > 192.168.43.147.7772: UDP, length 120
23:57:59.176438 IP 192.168.43.147.8880 > 192.168.43.124.7773: UDP, length 120
23:57:59.225385 IP 192.168.43.146.8880 > 192.168.43.147.7772: UDP, length 120
23:57:59.226447 IP 192.168.43.147.8880 > 192.168.43.124.7773: UDP, length 120
23:57:59.276438 IP 192.168.43.147.8880 > 192.168.43.124.7773: UDP, length 120
23:57:59.282108 IP 192.168.43.146.8880 > 192.168.43.147.7772: UDP, length 120
23:57:59.326455 IP 192.168.43.147.8880 > 192.168.43.124.7773: UDP, length 120
23:57:59.329866 IP 192.168.43.146.8880 > 192.168.43.147.7772: UDP, length 120
23:57:59.376441 IP 192.168.43.147.8880 > 192.168.43.124.7773: UDP, length 120
23:57:59.387676 IP 192.168.43.146.8880 > 192.168.43.147.7772: UDP, length 120
23:57:59.406140 IP 192.168.43.146.8880 > 192.168.43.147.7772: UDP, length 120
23:57:59.426452 IP 192.168.43.147.8880 > 192.168.43.124.7773: UDP, length 120
23:57:59.476441 IP 192.168.43.147.8880 > 192.168.43.124.7773: UDP, length 120
23:57:59.485305 IP 192.168.43.146.8880 > 192.168.43.147.7772: UDP, length 120
23:57:59.526437 IP 192.168.43.147.8880 > 192.168.43.124.7773: UDP, length 120
23:57:59.529836 IP 192.168.43.146.8880 > 192.168.43.147.7772: UDP, length 120
23:57:59.567272 IP 192.168.43.146.8880 > 192.168.43.147.7772: UDP, length 120
23:57:59.576434 IP 192.168.43.147.8880 > 192.168.43.124.7773: UDP, length 120
23:57:59.610687 IP 192.168.43.146.8880 > 192.168.43.147.7772: UDP, length 120
23:57:59.626445 IP 192.168.43.147.8880 > 192.168.43.124.7773: UDP, length 120
23:57:59.676460 IP 192.168.43.147.8880 > 192.168.43.124.7773: UDP, length 120
23:57:59.691468 IP 192.168.43.146.8880 > 192.168.43.147.7772: UDP, length 120
23:57:59.710714 IP 192.168.43.146.8880 > 192.168.43.147.7772: UDP, length 120
23:57:59.726454 IP 192.168.43.147.8880 > 192.168.43.124.7773: UDP, length 120
23:57:59.776434 IP 192.168.43.147.8880 > 192.168.43.124.7773: UDP, length 120
23:57:59.798587 IP 192.168.43.146.8880 > 192.168.43.147.7772: UDP, length 120
23:57:59.814505 IP 192.168.43.146.8880 > 192.168.43.147.7772: UDP, length 120
23:57:59.826451 IP 192.168.43.147.8880 > 192.168.43.124.7773: UDP, length 120
23:57:59.867918 IP 192.168.43.146.8880 > 192.168.43.147.7772: UDP, length 120
23:57:59.876442 IP 192.168.43.147.8880 > 192.168.43.124.7773: UDP, length 120
23:57:59.915833 IP 192.168.43.146.8880 > 192.168.43.147.7772: UDP, length 120
23:57:59.926453 IP 192.168.43.147.8880 > 192.168.43.124.7773: UDP, length 120
23:57:59.976438 IP 192.168.43.147.8880 > 192.168.43.124.7773: UDP, length 120
23:58:00.002883 IP 192.168.43.146.8880 > 192.168.43.147.7772: UDP, length 120
23:58:00.015810 IP 192.168.43.146.8880 > 192.168.43.147.7772: UDP, length 120
23:58:00.026435 IP 192.168.43.147.8880 > 192.168.43.124.7773: UDP, length 120
23:58:00.072540 IP 192.168.43.146.8880 > 192.168.43.147.7772: UDP, length 120
23:58:00.076438 IP 192.168.43.147.8880 > 192.168.43.124.7773: UDP, length 120
23:58:00.108610 IP 192.168.43.146.8880 > 192.168.43.147.7772: UDP, length 120
23:58:00.126447 IP 192.168.43.147.8880 > 192.168.43.124.7773: UDP, length 120
23:58:00.175071 IP 192.168.43.146.8880 > 192.168.43.147.7772: UDP, length 120
23:58:00.176439 IP 192.168.43.147.8880 > 192.168.43.124.7773: UDP, length 120
23:58:00.226437 IP 192.168.43.147.8880 > 192.168.43.124.7773: UDP, length 120
23:58:00.276435 IP 192.168.43.147.8880 > 192.168.43.124.7773: UDP, length 120
23:58:00.309317 IP 192.168.43.146.8880 > 192.168.43.147.7772: UDP, length 120
23:58:00.309559 IP 192.168.43.146.8880 > 192.168.43.147.7772: UDP, length 120
23:58:00.309682 IP 192.168.43.146.8880 > 192.168.43.147.7772: UDP, length 120
23:58:00.326443 IP 192.168.43.147.8880 > 192.168.43.124.7773: UDP, length 120
23:58:00.363335 IP 192.168.43.146.8880 > 192.168.43.147.7772: UDP, length 120
23:58:00.376435 IP 192.168.43.147.8880 > 192.168.43.124.7773: UDP, length 120
23:58:00.410911 IP 192.168.43.146.8880 > 192.168.43.147.7772: UDP, length 120
23:58:00.426438 IP 192.168.43.147.8880 > 192.168.43.124.7773: UDP, length 120
23:58:00.469426 IP 192.168.43.146.8880 > 192.168.43.147.7772: UDP, length 120
23:58:00.476497 IP 192.168.43.147.8880 > 192.168.43.124.7773: UDP, length 120
23:58:00.513855 IP 192.168.43.146.8880 > 192.168.43.147.7772: UDP, length 120
23:58:00.526469 IP 192.168.43.147.8880 > 192.168.43.124.7773: UDP, length 120
23:58:00.570899 IP 192.168.43.146.8880 > 192.168.43.147.7772: UDP, length 120
23:58:00.576443 IP 192.168.43.147.8880 > 192.168.43.124.7773: UDP, length 120
23:58:00.616271 IP 192.168.43.146.8880 > 192.168.43.147.7772: UDP, length 120
23:58:00.626434 IP 192.168.43.147.8880 > 192.168.43.124.7773: UDP, length 120
23:58:00.676436 IP 192.168.43.147.8880 > 192.168.43.124.7773: UDP, length 120
23:58:00.684918 IP 192.168.43.146.8880 > 192.168.43.147.7772: UDP, length 120
23:58:00.715028 IP 192.168.43.146.8880 > 192.168.43.147.7772: UDP, length 120
23:58:00.726435 IP 192.168.43.147.8880 > 192.168.43.124.7773: UDP, length 120
23:58:00.765377 IP 192.168.43.146.8880 > 192.168.43.147.7772: UDP, length 120
23:58:00.776437 IP 192.168.43.147.8880 > 192.168.43.124.7773: UDP, length 120
23:58:00.811103 IP 192.168.43.146.8880 > 192.168.43.147.7772: UDP, length 120
23:58:00.826439 IP 192.168.43.147.8880 > 192.168.43.124.7773: UDP, length 120
23:58:00.865431 IP 192.168.43.146.8880 > 192.168.43.147.7772: UDP, length 120
23:58:00.876435 IP 192.168.43.147.8880 > 192.168.43.124.7773: UDP, length 120
23:58:00.920461 IP 192.168.43.146.8880 > 192.168.43.147.7772: UDP, length 120
23:58:00.926449 IP 192.168.43.147.8880 > 192.168.43.124.7773: UDP, length 120
23:58:00.976442 IP 192.168.43.147.8880 > 192.168.43.124.7773: UDP, length 120
23:58:01.023688 IP 192.168.43.146.8880 > 192.168.43.147.7772: UDP, length 120
23:58:01.024014 IP 192.168.43.146.8880 > 192.168.43.147.7772: UDP, length 120
23:58:01.026487 IP 192.168.43.147.8880 > 192.168.43.124.7773: UDP, length 120
23:58:01.072729 IP 192.168.43.146.8880 > 192.168.43.147.7772: UDP, length 120
23:58:01.076465 IP 192.168.43.147.8880 > 192.168.43.124.7773: UDP, length 120
23:58:01.125451 IP 192.168.43.146.8880 > 192.168.43.147.7772: UDP, length 120
23:58:01.126465 IP 192.168.43.147.8880 > 192.168.43.124.7773: UDP, length 120
23:58:01.171073 IP 192.168.43.146.8880 > 192.168.43.147.7772: UDP, length 120
23:58:01.176460 IP 192.168.43.147.8880 > 192.168.43.124.7773: UDP, length 120
23:58:01.226458 IP 192.168.43.147.8880 > 192.168.43.124.7773: UDP, length 120
23:58:01.229959 IP 192.168.43.146.8880 > 192.168.43.147.7772: UDP, length 120
23:58:01.274174 IP 192.168.43.146.8880 > 192.168.43.147.7772: UDP, length 120
23:58:01.276461 IP 192.168.43.147.8880 > 192.168.43.124.7773: UDP, length 120
23:58:01.315320 IP 192.168.43.146.8880 > 192.168.43.147.7772: UDP, length 120
23:58:01.326463 IP 192.168.43.147.8880 > 192.168.43.124.7773: UDP, length 120
23:58:01.354030 IP 192.168.43.146.8880 > 192.168.43.147.7772: UDP, length 120
23:58:01.376466 IP 192.168.43.147.8880 > 192.168.43.124.7773: UDP, length 120
23:58:01.426454 IP 192.168.43.147.8880 > 192.168.43.124.7773: UDP, length 120
23:58:01.433640 IP 192.168.43.146.8880 > 192.168.43.147.7772: UDP, length 120
23:58:01.472902 IP 192.168.43.146.8880 > 192.168.43.147.7772: UDP, length 120
23:58:01.476465 IP 192.168.43.147.8880 > 192.168.43.124.7773: UDP, length 120
23:58:01.526458 IP 192.168.43.147.8880 > 192.168.43.124.7773: UDP, length 120
23:58:01.535702 IP 192.168.43.146.8880 > 192.168.43.147.7772: UDP, length 120
23:58:01.556680 IP 192.168.43.146.8880 > 192.168.43.147.7772: UDP, length 120
23:58:01.576460 IP 192.168.43.147.8880 > 192.168.43.124.7773: UDP, length 120
23:58:01.609664 IP 192.168.43.146.8880 > 192.168.43.147.7772: UDP, length 120
23:58:01.626466 IP 192.168.43.147.8880 > 192.168.43.124.7773: UDP, length 120
23:58:01.660983 IP 192.168.43.146.8880 > 192.168.43.147.7772: UDP, length 120
23:58:01.676460 IP 192.168.43.147.8880 > 192.168.43.124.7773: UDP, length 120
23:58:01.711493 IP 192.168.43.146.8880 > 192.168.43.147.7772: UDP, length 120
23:58:01.726458 IP 192.168.43.147.8880 > 192.168.43.124.7773: UDP, length 120
23:58:01.776436 IP 192.168.43.147.8880 > 192.168.43.124.7773: UDP, length 120
23:58:01.777497 IP 192.168.43.146.8880 > 192.168.43.147.7772: UDP, length 120
23:58:01.812537 IP 192.168.43.146.8880 > 192.168.43.147.7772: UDP, length 120
23:58:01.826439 IP 192.168.43.147.8880 > 192.168.43.124.7773: UDP, length 120
23:58:01.861274 IP 192.168.43.146.8880 > 192.168.43.147.7772: UDP, length 120
23:58:01.876448 IP 192.168.43.147.8880 > 192.168.43.124.7773: UDP, length 120
23:58:01.912857 IP 192.168.43.146.8880 > 192.168.43.147.7772: UDP, length 120
23:58:01.926469 IP 192.168.43.147.8880 > 192.168.43.124.7773: UDP, length 120
23:58:01.965231 IP 192.168.43.146.8880 > 192.168.43.147.7772: UDP, length 120
23:58:01.976501 IP 192.168.43.147.8880 > 192.168.43.124.7773: UDP, length 120
23:58:02.014277 IP 192.168.43.146.8880 > 192.168.43.147.7772: UDP, length 120
23:58:02.026449 IP 192.168.43.147.8880 > 192.168.43.124.7773: UDP, length 120
23:58:02.057782 IP 192.168.43.146.8880 > 192.168.43.147.7772: UDP, length 120
23:58:02.076438 IP 192.168.43.147.8880 > 192.168.43.124.7773: UDP, length 120
23:58:02.112947 IP 192.168.43.146.8880 > 192.168.43.147.7772: UDP, length 120
23:58:02.126434 IP 192.168.43.147.8880 > 192.168.43.124.7773: UDP, length 120
23:58:02.157100 IP 192.168.43.146.8880 > 192.168.43.147.7772: UDP, length 120
23:58:02.176435 IP 192.168.43.147.8880 > 192.168.43.124.7773: UDP, length 120
23:58:02.211291 IP 192.168.43.146.8880 > 192.168.43.147.7772: UDP, length 120
23:58:02.226439 IP 192.168.43.147.8880 > 192.168.43.124.7773: UDP, length 120
23:58:02.260418 IP 192.168.43.146.8880 > 192.168.43.147.7772: UDP, length 120
23:58:02.276435 IP 192.168.43.147.8880 > 192.168.43.124.7773: UDP, length 120
23:58:02.311278 IP 192.168.43.146.8880 > 192.168.43.147.7772: UDP, length 120
23:58:02.326432 IP 192.168.43.147.8880 > 192.168.43.124.7773: UDP, length 120
23:58:02.360485 IP 192.168.43.146.8880 > 192.168.43.147.7772: UDP, length 120
23:58:02.376459 IP 192.168.43.147.8880 > 192.168.43.124.7773: UDP, length 120
23:58:02.422985 IP 192.168.43.146.8880 > 192.168.43.147.7772: UDP, length 120
23:58:02.426441 IP 192.168.43.147.8880 > 192.168.43.124.7773: UDP, length 120
23:58:02.461466 IP 192.168.43.146.8880 > 192.168.43.147.7772: UDP, length 120
23:58:02.476436 IP 192.168.43.147.8880 > 192.168.43.124.7773: UDP, length 120
23:58:02.513768 IP 192.168.43.146.8880 > 192.168.43.147.7772: UDP, length 120
23:58:02.526432 IP 192.168.43.147.8880 > 192.168.43.124.7773: UDP, length 120
23:58:02.560848 IP 192.168.43.146.8880 > 192.168.43.147.7772: UDP, length 120
23:58:02.576434 IP 192.168.43.147.8880 > 192.168.43.124.7773: UDP, length 120
23:58:02.619670 IP 192.168.43.146.8880 > 192.168.43.147.7772: UDP, length 120
23:58:02.626435 IP 192.168.43.147.8880 > 192.168.43.124.7773: UDP, length 120
23:58:02.663150 IP 192.168.43.146.8880 > 192.168.43.147.7772: UDP, length 120
23:58:02.676435 IP 192.168.43.147.8880 > 192.168.43.124.7773: UDP, length 120
23:58:02.719025 IP 192.168.43.146.8880 > 192.168.43.147.7772: UDP, length 120
23:58:02.726435 IP 192.168.43.147.8880 > 192.168.43.124.7773: UDP, length 120
23:58:02.766771 IP 192.168.43.146.8880 > 192.168.43.147.7772: UDP, length 120
23:58:02.776452 IP 192.168.43.147.8880 > 192.168.43.124.7773: UDP, length 120
23:58:02.814003 IP 192.168.43.146.8880 > 192.168.43.147.7772: UDP, length 120
23:58:02.826436 IP 192.168.43.147.8880 > 192.168.43.124.7773: UDP, length 120
23:58:02.865767 IP 192.168.43.146.8880 > 192.168.43.147.7772: UDP, length 120
23:58:02.876452 IP 192.168.43.147.8880 > 192.168.43.124.7773: UDP, length 120
23:58:02.916361 IP 192.168.43.146.8880 > 192.168.43.147.7772: UDP, length 120
23:58:02.926466 IP 192.168.43.147.8880 > 192.168.43.124.7773: UDP, length 120
23:58:02.968717 IP 192.168.43.146.8880 > 192.168.43.147.7772: UDP, length 120
23:58:02.976456 IP 192.168.43.147.8880 > 192.168.43.124.7773: UDP, length 120
23:58:03.024136 IP 192.168.43.146.8880 > 192.168.43.147.7772: UDP, length 120
23:58:03.026440 IP 192.168.43.147.8880 > 192.168.43.124.7773: UDP, length 120
23:58:03.075346 IP 192.168.43.146.8880 > 192.168.43.147.7772: UDP, length 120
23:58:03.076434 IP 192.168.43.147.8880 > 192.168.43.124.7773: UDP, length 120
23:58:03.113826 IP 192.168.43.146.8880 > 192.168.43.147.7772: UDP, length 120
23:58:03.126433 IP 192.168.43.147.8880 > 192.168.43.124.7773: UDP, length 120
23:58:03.168138 IP 192.168.43.146.8880 > 192.168.43.147.7772: UDP, length 120
23:58:03.176432 IP 192.168.43.147.8880 > 192.168.43.124.7773: UDP, length 120
23:58:03.226431 IP 192.168.43.147.8880 > 192.168.43.124.7773: UDP, length 120
23:58:03.276431 IP 192.168.43.147.8880 > 192.168.43.124.7773: UDP, length 120
23:58:03.277807 IP 192.168.43.146.8880 > 192.168.43.147.7772: UDP, length 120
23:58:03.278025 IP 192.168.43.146.8880 > 192.168.43.147.7772: UDP, length 120
23:58:03.326433 IP 192.168.43.147.8880 > 192.168.43.124.7773: UDP, length 120
23:58:03.331840 IP 192.168.43.146.8880 > 192.168.43.147.7772: UDP, length 120
23:58:03.376451 IP 192.168.43.147.8880 > 192.168.43.124.7773: UDP, length 120
23:58:03.377786 IP 192.168.43.146.8880 > 192.168.43.147.7772: UDP, length 120
23:58:03.426431 IP 192.168.43.147.8880 > 192.168.43.124.7773: UDP, length 120
23:58:03.438881 IP 192.168.43.146.8880 > 192.168.43.147.7772: UDP, length 120
23:58:03.466555 IP 192.168.43.146.8880 > 192.168.43.147.7772: UDP, length 120
23:58:03.477533 IP 192.168.43.147.8880 > 192.168.43.124.7773: UDP, length 120
23:58:03.526450 IP 192.168.43.147.8880 > 192.168.43.124.7773: UDP, length 120
23:58:03.529900 IP 192.168.43.146.8880 > 192.168.43.147.7772: UDP, length 120
23:58:03.567341 IP 192.168.43.146.8880 > 192.168.43.147.7772: UDP, length 120
23:58:03.576446 IP 192.168.43.147.8880 > 192.168.43.124.7773: UDP, length 120
23:58:03.616741 IP 192.168.43.146.8880 > 192.168.43.147.7772: UDP, length 120
23:58:03.626432 IP 192.168.43.147.8880 > 192.168.43.124.7773: UDP, length 120
23:58:03.662995 IP 192.168.43.146.8880 > 192.168.43.147.7772: UDP, length 120
23:58:03.676430 IP 192.168.43.147.8880 > 192.168.43.124.7773: UDP, length 120
23:58:03.711983 IP 192.168.43.146.8880 > 192.168.43.147.7772: UDP, length 120
23:58:03.726441 IP 192.168.43.147.8880 > 192.168.43.124.7773: UDP, length 120
23:58:03.763346 IP 192.168.43.146.8880 > 192.168.43.147.7772: UDP, length 120
23:58:03.776438 IP 192.168.43.147.8880 > 192.168.43.124.7773: UDP, length 120
23:58:03.808870 IP 192.168.43.146.8880 > 192.168.43.147.7772: UDP, length 120
23:58:03.826431 IP 192.168.43.147.8880 > 192.168.43.124.7773: UDP, length 120
23:58:03.861985 IP 192.168.43.146.8880 > 192.168.43.147.7772: UDP, length 120
23:58:03.876430 IP 192.168.43.147.8880 > 192.168.43.124.7773: UDP, length 120
23:58:03.911951 IP 192.168.43.146.8880 > 192.168.43.147.7772: UDP, length 120
23:58:03.926464 IP 192.168.43.147.8880 > 192.168.43.124.7773: UDP, length 120
23:58:03.959835 IP 192.168.43.146.8880 > 192.168.43.147.7772: UDP, length 120
23:58:03.976450 IP 192.168.43.147.8880 > 192.168.43.124.7773: UDP, length 120
23:58:04.008745 IP 192.168.43.146.8880 > 192.168.43.147.7772: UDP, length 120
23:58:04.026458 IP 192.168.43.147.8880 > 192.168.43.124.7773: UDP, length 120
23:58:04.062475 IP 192.168.43.146.8880 > 192.168.43.147.7772: UDP, length 120
23:58:04.076452 IP 192.168.43.147.8880 > 192.168.43.124.7773: UDP, length 120
23:58:04.114400 IP 192.168.43.146.8880 > 192.168.43.147.7772: UDP, length 120
23:58:04.126450 IP 192.168.43.147.8880 > 192.168.43.124.7773: UDP, length 120
23:58:04.165383 IP 192.168.43.146.8880 > 192.168.43.147.7772: UDP, length 120
23:58:04.176440 IP 192.168.43.147.8880 > 192.168.43.124.7773: UDP, length 120
23:58:04.217380 IP 192.168.43.146.8880 > 192.168.43.147.7772: UDP, length 120
23:58:04.226450 IP 192.168.43.147.8880 > 192.168.43.124.7773: UDP, length 120
23:58:04.265051 IP 192.168.43.146.8880 > 192.168.43.147.7772: UDP, length 120
23:58:04.276443 IP 192.168.43.147.8880 > 192.168.43.124.7773: UDP, length 120
23:58:04.314479 IP 192.168.43.146.8880 > 192.168.43.147.7772: UDP, length 120
23:58:04.326442 IP 192.168.43.147.8880 > 192.168.43.124.7773: UDP, length 120
23:58:04.361948 IP 192.168.43.146.8880 > 192.168.43.147.7772: UDP, length 120
23:58:04.376450 IP 192.168.43.147.8880 > 192.168.43.124.7773: UDP, length 120
23:58:04.412245 IP 192.168.43.146.8880 > 192.168.43.147.7772: UDP, length 120
23:58:04.426449 IP 192.168.43.147.8880 > 192.168.43.124.7773: UDP, length 120
23:58:04.456037 IP 192.168.43.146.8880 > 192.168.43.147.7772: UDP, length 120
23:58:04.476459 IP 192.168.43.147.8880 > 192.168.43.124.7773: UDP, length 120
23:58:04.512126 IP 192.168.43.146.8880 > 192.168.43.147.7772: UDP, length 120
23:58:04.526440 IP 192.168.43.147.8880 > 192.168.43.124.7773: UDP, length 120
23:58:04.561132 IP 192.168.43.146.8880 > 192.168.43.147.7772: UDP, length 120
23:58:04.576442 IP 192.168.43.147.8880 > 192.168.43.124.7773: UDP, length 120
23:58:04.611517 IP 192.168.43.146.8880 > 192.168.43.147.7772: UDP, length 120
23:58:04.626441 IP 192.168.43.147.8880 > 192.168.43.124.7773: UDP, length 120
23:58:04.661904 IP 192.168.43.146.8880 > 192.168.43.147.7772: UDP, length 120
23:58:04.676440 IP 192.168.43.147.8880 > 192.168.43.124.7773: UDP, length 120
23:58:04.712099 IP 192.168.43.146.8880 > 192.168.43.147.7772: UDP, length 120
23:58:04.726451 IP 192.168.43.147.8880 > 192.168.43.124.7773: UDP, length 120
23:58:04.761659 IP 192.168.43.146.8880 > 192.168.43.147.7772: UDP, length 120
23:58:04.776449 IP 192.168.43.147.8880 > 192.168.43.124.7773: UDP, length 120
23:58:04.814339 IP 192.168.43.146.8880 > 192.168.43.147.7772: UDP, length 120
23:58:04.826448 IP 192.168.43.147.8880 > 192.168.43.124.7773: UDP, length 120
23:58:04.862173 IP 192.168.43.146.8880 > 192.168.43.147.7772: UDP, length 120
23:58:04.876445 IP 192.168.43.147.8880 > 192.168.43.124.7773: UDP, length 120
23:58:04.914899 IP 192.168.43.146.8880 > 192.168.43.147.7772: UDP, length 120
23:58:04.926463 IP 192.168.43.147.8880 > 192.168.43.124.7773: UDP, length 120
23:58:04.959174 IP 192.168.43.146.8880 > 192.168.43.147.7772: UDP, length 120
23:58:04.976450 IP 192.168.43.147.8880 > 192.168.43.124.7773: UDP, length 120
23:58:05.013371 IP 192.168.43.146.8880 > 192.168.43.147.7772: UDP, length 120
23:58:05.026491 IP 192.168.43.147.8880 > 192.168.43.124.7773: UDP, length 120
23:58:05.057732 IP 192.168.43.146.8880 > 192.168.43.147.7772: UDP, length 120
23:58:05.076451 IP 192.168.43.147.8880 > 192.168.43.124.7773: UDP, length 120
23:58:05.112164 IP 192.168.43.146.8880 > 192.168.43.147.7772: UDP, length 120
23:58:05.126444 IP 192.168.43.147.8880 > 192.168.43.124.7773: UDP, length 120
23:58:05.161825 IP 192.168.43.146.8880 > 192.168.43.147.7772: UDP, length 120
23:58:05.176456 IP 192.168.43.147.8880 > 192.168.43.124.7773: UDP, length 120
23:58:05.213572 IP 192.168.43.146.8880 > 192.168.43.147.7772: UDP, length 120
23:58:05.226441 IP 192.168.43.147.8880 > 192.168.43.124.7773: UDP, length 120
23:58:05.266758 IP 192.168.43.146.8880 > 192.168.43.147.7772: UDP, length 120
23:58:05.276440 IP 192.168.43.147.8880 > 192.168.43.124.7773: UDP, length 120
23:58:05.312222 IP 192.168.43.146.8880 > 192.168.43.147.7772: UDP, length 120
23:58:05.326452 IP 192.168.43.147.8880 > 192.168.43.124.7773: UDP, length 120
23:58:05.367403 IP 192.168.43.146.8880 > 192.168.43.147.7772: UDP, length 120
23:58:05.376446 IP 192.168.43.147.8880 > 192.168.43.124.7773: UDP, length 120
23:58:05.419280 IP 192.168.43.146.8880 > 192.168.43.147.7772: UDP, length 120
23:58:05.426443 IP 192.168.43.147.8880 > 192.168.43.124.7773: UDP, length 120
23:58:05.471986 IP 192.168.43.146.8880 > 192.168.43.147.7772: UDP, length 120
23:58:05.476451 IP 192.168.43.147.8880 > 192.168.43.124.7773: UDP, length 120
23:58:05.506872 IP 192.168.43.146.8880 > 192.168.43.147.7772: UDP, length 120
23:58:05.526471 IP 192.168.43.147.8880 > 192.168.43.124.7773: UDP, length 120
23:58:05.562352 IP 192.168.43.146.8880 > 192.168.43.147.7772: UDP, length 120
23:58:05.576442 IP 192.168.43.147.8880 > 192.168.43.124.7773: UDP, length 120
23:58:05.612352 IP 192.168.43.146.8880 > 192.168.43.147.7772: UDP, length 120
23:58:05.626441 IP 192.168.43.147.8880 > 192.168.43.124.7773: UDP, length 120
23:58:05.662600 IP 192.168.43.146.8880 > 192.168.43.147.7772: UDP, length 120
23:58:05.676440 IP 192.168.43.147.8880 > 192.168.43.124.7773: UDP, length 120
23:58:05.711979 IP 192.168.43.146.8880 > 192.168.43.147.7772: UDP, length 120
23:58:05.726441 IP 192.168.43.147.8880 > 192.168.43.124.7773: UDP, length 120
23:58:05.759199 IP 192.168.43.146.8880 > 192.168.43.147.7772: UDP, length 120
23:58:05.776439 IP 192.168.43.147.8880 > 192.168.43.124.7773: UDP, length 120
23:58:05.813733 IP 192.168.43.146.8880 > 192.168.43.147.7772: UDP, length 120
23:58:05.826439 IP 192.168.43.147.8880 > 192.168.43.124.7773: UDP, length 120
23:58:05.862151 IP 192.168.43.146.8880 > 192.168.43.147.7772: UDP, length 120
23:58:05.876449 IP 192.168.43.147.8880 > 192.168.43.124.7773: UDP, length 120
23:58:05.913704 IP 192.168.43.146.8880 > 192.168.43.147.7772: UDP, length 120
23:58:05.926459 IP 192.168.43.147.8880 > 192.168.43.124.7773: UDP, length 120
23:58:05.963173 IP 192.168.43.146.8880 > 192.168.43.147.7772: UDP, length 120
23:58:05.976445 IP 192.168.43.147.8880 > 192.168.43.124.7773: UDP, length 120
23:58:06.016109 IP 192.168.43.146.8880 > 192.168.43.147.7772: UDP, length 120
23:58:06.026469 IP 192.168.43.147.8880 > 192.168.43.124.7773: UDP, length 120
23:58:06.063177 IP 192.168.43.146.8880 > 192.168.43.147.7772: UDP, length 120
23:58:06.076466 IP 192.168.43.147.8880 > 192.168.43.124.7773: UDP, length 120
23:58:06.107863 IP 192.168.43.146.8880 > 192.168.43.147.7772: UDP, length 120
23:58:06.126454 IP 192.168.43.147.8880 > 192.168.43.124.7773: UDP, length 120
23:58:06.167024 IP 192.168.43.146.8880 > 192.168.43.147.7772: UDP, length 120
23:58:06.176436 IP 192.168.43.147.8880 > 192.168.43.124.7773: UDP, length 120
23:58:06.212871 IP 192.168.43.146.8880 > 192.168.43.147.7772: UDP, length 120
23:58:06.226435 IP 192.168.43.147.8880 > 192.168.43.124.7773: UDP, length 120
23:58:06.268064 IP 192.168.43.146.8880 > 192.168.43.147.7772: UDP, length 120
23:58:06.276432 IP 192.168.43.147.8880 > 192.168.43.124.7773: UDP, length 120
23:58:06.313564 IP 192.168.43.146.8880 > 192.168.43.147.7772: UDP, length 120
23:58:06.326431 IP 192.168.43.147.8880 > 192.168.43.124.7773: UDP, length 120
23:58:06.362307 IP 192.168.43.146.8880 > 192.168.43.147.7772: UDP, length 120
23:58:06.376432 IP 192.168.43.147.8880 > 192.168.43.124.7773: UDP, length 120
23:58:06.426447 IP 192.168.43.147.8880 > 192.168.43.124.7773: UDP, length 120
23:58:06.429886 IP 192.168.43.146.8880 > 192.168.43.147.7772: UDP, length 120
23:58:06.473907 IP 192.168.43.146.8880 > 192.168.43.147.7772: UDP, length 120
23:58:06.476431 IP 192.168.43.147.8880 > 192.168.43.124.7773: UDP, length 120
23:58:06.512733 IP 192.168.43.146.8880 > 192.168.43.147.7772: UDP, length 120
23:58:06.526472 IP 192.168.43.147.8880 > 192.168.43.124.7773: UDP, length 120
23:58:06.564782 IP 192.168.43.146.8880 > 192.168.43.147.7772: UDP, length 120
23:58:06.576432 IP 192.168.43.147.8880 > 192.168.43.124.7773: UDP, length 120
23:58:06.613000 IP 192.168.43.146.8880 > 192.168.43.147.7772: UDP, length 120
23:58:06.626433 IP 192.168.43.147.8880 > 192.168.43.124.7773: UDP, length 120
23:58:06.662186 IP 192.168.43.146.8880 > 192.168.43.147.7772: UDP, length 120
23:58:06.676431 IP 192.168.43.147.8880 > 192.168.43.124.7773: UDP, length 120
23:58:06.715202 IP 192.168.43.146.8880 > 192.168.43.147.7772: UDP, length 120
23:58:06.726443 IP 192.168.43.147.8880 > 192.168.43.124.7773: UDP, length 120
23:58:06.758405 IP 192.168.43.146.8880 > 192.168.43.147.7772: UDP, length 120
23:58:06.776451 IP 192.168.43.147.8880 > 192.168.43.124.7773: UDP, length 120
23:58:06.813142 IP 192.168.43.146.8880 > 192.168.43.147.7772: UDP, length 120
23:58:06.826434 IP 192.168.43.147.8880 > 192.168.43.124.7773: UDP, length 120
23:58:06.862643 IP 192.168.43.146.8880 > 192.168.43.147.7772: UDP, length 120
23:58:06.876432 IP 192.168.43.147.8880 > 192.168.43.124.7773: UDP, length 120
23:58:06.924208 IP 192.168.43.146.8880 > 192.168.43.147.7772: UDP, length 120
23:58:06.926463 IP 192.168.43.147.8880 > 192.168.43.124.7773: UDP, length 120
23:58:06.964897 IP 192.168.43.146.8880 > 192.168.43.147.7772: UDP, length 120
23:58:06.976454 IP 192.168.43.147.8880 > 192.168.43.124.7773: UDP, length 120
23:58:07.012696 IP 192.168.43.146.8880 > 192.168.43.147.7772: UDP, length 120
23:58:07.026434 IP 192.168.43.147.8880 > 192.168.43.124.7773: UDP, length 120
23:58:07.071860 IP 192.168.43.146.8880 > 192.168.43.147.7772: UDP, length 120
23:58:07.076431 IP 192.168.43.147.8880 > 192.168.43.124.7773: UDP, length 120
23:58:07.106881 IP 192.168.43.146.8880 > 192.168.43.147.7772: UDP, length 120
23:58:07.126461 IP 192.168.43.147.8880 > 192.168.43.124.7773: UDP, length 120
23:58:07.162434 IP 192.168.43.146.8880 > 192.168.43.147.7772: UDP, length 120
23:58:07.176436 IP 192.168.43.147.8880 > 192.168.43.124.7773: UDP, length 120
23:58:07.213417 IP 192.168.43.146.8880 > 192.168.43.147.7772: UDP, length 120
23:58:07.226460 IP 192.168.43.147.8880 > 192.168.43.124.7773: UDP, length 120
23:58:07.262638 IP 192.168.43.146.8880 > 192.168.43.147.7772: UDP, length 120
23:58:07.276446 IP 192.168.43.147.8880 > 192.168.43.124.7773: UDP, length 120
23:58:07.315395 IP 192.168.43.146.8880 > 192.168.43.147.7772: UDP, length 120
23:58:07.326444 IP 192.168.43.147.8880 > 192.168.43.124.7773: UDP, length 120
23:58:07.362921 IP 192.168.43.146.8880 > 192.168.43.147.7772: UDP, length 120
23:58:07.376438 IP 192.168.43.147.8880 > 192.168.43.124.7773: UDP, length 120
23:58:07.415929 IP 192.168.43.146.8880 > 192.168.43.147.7772: UDP, length 120
23:58:07.426431 IP 192.168.43.147.8880 > 192.168.43.124.7773: UDP, length 120
23:58:07.463058 IP 192.168.43.146.8880 > 192.168.43.147.7772: UDP, length 120
23:58:07.476435 IP 192.168.43.147.8880 > 192.168.43.124.7773: UDP, length 120
23:58:07.518697 IP 192.168.43.146.8880 > 192.168.43.147.7772: UDP, length 120
23:58:07.526437 IP 192.168.43.147.8880 > 192.168.43.124.7773: UDP, length 120
23:58:07.558760 IP 192.168.43.146.8880 > 192.168.43.147.7772: UDP, length 120
23:58:07.576478 IP 192.168.43.147.8880 > 192.168.43.124.7773: UDP, length 120
23:58:07.622412 IP 192.168.43.146.8880 > 192.168.43.147.7772: UDP, length 120
23:58:07.626449 IP 192.168.43.147.8880 > 192.168.43.124.7773: UDP, length 120
23:58:07.665698 IP 192.168.43.146.8880 > 192.168.43.147.7772: UDP, length 120
23:58:07.676444 IP 192.168.43.147.8880 > 192.168.43.124.7773: UDP, length 120
23:58:07.713411 IP 192.168.43.146.8880 > 192.168.43.147.7772: UDP, length 120
23:58:07.726443 IP 192.168.43.147.8880 > 192.168.43.124.7773: UDP, length 120
23:58:07.762060 IP 192.168.43.146.8880 > 192.168.43.147.7772: UDP, length 120
23:58:07.776432 IP 192.168.43.147.8880 > 192.168.43.124.7773: UDP, length 120
23:58:07.826433 IP 192.168.43.147.8880 > 192.168.43.124.7773: UDP, length 120
23:58:07.836195 IP 192.168.43.146.8880 > 192.168.43.147.7772: UDP, length 120
23:58:07.870448 IP 192.168.43.146.8880 > 192.168.43.147.7772: UDP, length 120
23:58:07.876431 IP 192.168.43.147.8880 > 192.168.43.124.7773: UDP, length 120
23:58:07.913323 IP 192.168.43.146.8880 > 192.168.43.147.7772: UDP, length 120
23:58:07.926480 IP 192.168.43.147.8880 > 192.168.43.124.7773: UDP, length 120
23:58:07.976466 IP 192.168.43.147.8880 > 192.168.43.124.7773: UDP, length 120
23:58:07.986057 IP 192.168.43.146.8880 > 192.168.43.147.7772: UDP, length 120
23:58:08.007793 IP 192.168.43.146.8880 > 192.168.43.147.7772: UDP, length 120
23:58:08.026479 IP 192.168.43.147.8880 > 192.168.43.124.7773: UDP, length 120
23:58:08.062395 IP 192.168.43.146.8880 > 192.168.43.147.7772: UDP, length 120
23:58:08.076451 IP 192.168.43.147.8880 > 192.168.43.124.7773: UDP, length 120
23:58:08.113361 IP 192.168.43.146.8880 > 192.168.43.147.7772: UDP, length 120
23:58:08.126441 IP 192.168.43.147.8880 > 192.168.43.124.7773: UDP, length 120
23:58:08.176438 IP 192.168.43.147.8880 > 192.168.43.124.7773: UDP, length 120
23:58:08.188271 IP 192.168.43.146.8880 > 192.168.43.147.7772: UDP, length 120
23:58:08.226449 IP 192.168.43.147.8880 > 192.168.43.124.7773: UDP, length 120
23:58:08.276452 IP 192.168.43.147.8880 > 192.168.43.124.7773: UDP, length 120
23:58:08.294338 IP 192.168.43.146.8880 > 192.168.43.147.7772: UDP, length 120
23:58:08.294620 IP 192.168.43.146.8880 > 192.168.43.147.7772: UDP, length 120
23:58:08.313514 IP 192.168.43.146.8880 > 192.168.43.147.7772: UDP, length 120
23:58:08.326439 IP 192.168.43.147.8880 > 192.168.43.124.7773: UDP, length 120
23:58:08.363406 IP 192.168.43.146.8880 > 192.168.43.147.7772: UDP, length 120
23:58:08.376437 IP 192.168.43.147.8880 > 192.168.43.124.7773: UDP, length 120
23:58:08.418464 IP 192.168.43.146.8880 > 192.168.43.147.7772: UDP, length 120
23:58:08.426442 IP 192.168.43.147.8880 > 192.168.43.124.7773: UDP, length 120
23:58:08.463476 IP 192.168.43.146.8880 > 192.168.43.147.7772: UDP, length 120
23:58:08.476436 IP 192.168.43.147.8880 > 192.168.43.124.7773: UDP, length 120
23:58:08.506380 IP 192.168.43.146.8880 > 192.168.43.147.7772: UDP, length 120
23:58:08.526481 IP 192.168.43.147.8880 > 192.168.43.124.7773: UDP, length 120
23:58:08.563982 IP 192.168.43.146.8880 > 192.168.43.147.7772: UDP, length 120
23:58:08.576445 IP 192.168.43.147.8880 > 192.168.43.124.7773: UDP, length 120
23:58:08.612602 IP 192.168.43.146.8880 > 192.168.43.147.7772: UDP, length 120
23:58:08.626451 IP 192.168.43.147.8880 > 192.168.43.124.7773: UDP, length 120
23:58:08.676439 IP 192.168.43.147.8880 > 192.168.43.124.7773: UDP, length 120
23:58:08.693278 IP 192.168.43.146.8880 > 192.168.43.147.7772: UDP, length 120
23:58:08.712770 IP 192.168.43.146.8880 > 192.168.43.147.7772: UDP, length 120
23:58:08.726437 IP 192.168.43.147.8880 > 192.168.43.124.7773: UDP, length 120
23:58:08.763424 IP 192.168.43.146.8880 > 192.168.43.147.7772: UDP, length 120
23:58:08.776436 IP 192.168.43.147.8880 > 192.168.43.124.7773: UDP, length 120
23:58:08.809646 IP 192.168.43.146.8880 > 192.168.43.147.7772: UDP, length 120
23:58:08.826436 IP 192.168.43.147.8880 > 192.168.43.124.7773: UDP, length 120
23:58:08.865693 IP 192.168.43.146.8880 > 192.168.43.147.7772: UDP, length 120
23:58:08.876436 IP 192.168.43.147.8880 > 192.168.43.124.7773: UDP, length 120
23:58:08.913124 IP 192.168.43.146.8880 > 192.168.43.147.7772: UDP, length 120
23:58:08.926466 IP 192.168.43.147.8880 > 192.168.43.124.7773: UDP, length 120
23:58:08.964066 IP 192.168.43.146.8880 > 192.168.43.147.7772: UDP, length 120
23:58:08.976460 IP 192.168.43.147.8880 > 192.168.43.124.7773: UDP, length 120
23:58:09.015641 IP 192.168.43.146.8880 > 192.168.43.147.7772: UDP, length 120
23:58:09.026438 IP 192.168.43.147.8880 > 192.168.43.124.7773: UDP, length 120
23:58:09.062441 IP 192.168.43.146.8880 > 192.168.43.147.7772: UDP, length 120
23:58:09.076437 IP 192.168.43.147.8880 > 192.168.43.124.7773: UDP, length 120
23:58:09.120005 IP 192.168.43.146.8880 > 192.168.43.147.7772: UDP, length 120
23:58:09.126444 IP 192.168.43.147.8880 > 192.168.43.124.7773: UDP, length 120
23:58:09.163331 IP 192.168.43.146.8880 > 192.168.43.147.7772: UDP, length 120
23:58:09.176436 IP 192.168.43.147.8880 > 192.168.43.124.7773: UDP, length 120
23:58:09.215785 IP 192.168.43.146.8880 > 192.168.43.147.7772: UDP, length 120
23:58:09.226444 IP 192.168.43.147.8880 > 192.168.43.124.7773: UDP, length 120
23:58:09.265151 IP 192.168.43.146.8880 > 192.168.43.147.7772: UDP, length 120
23:58:09.276445 IP 192.168.43.147.8880 > 192.168.43.124.7773: UDP, length 120
23:58:09.320606 IP 192.168.43.146.8880 > 192.168.43.147.7772: UDP, length 120
23:58:09.326449 IP 192.168.43.147.8880 > 192.168.43.124.7773: UDP, length 120
23:58:09.376437 IP 192.168.43.147.8880 > 192.168.43.124.7773: UDP, length 120
23:58:09.419968 IP 192.168.43.146.8880 > 192.168.43.147.7772: UDP, length 120
23:58:09.420601 IP 192.168.43.146.8880 > 192.168.43.147.7772: UDP, length 120
23:58:09.426450 IP 192.168.43.147.8880 > 192.168.43.124.7773: UDP, length 120
23:58:09.476445 IP 192.168.43.147.8880 > 192.168.43.124.7773: UDP, length 120
23:58:09.477110 IP 192.168.43.146.8880 > 192.168.43.147.7772: UDP, length 120
23:58:09.526491 IP 192.168.43.147.8880 > 192.168.43.124.7773: UDP, length 120
23:58:09.526693 IP 192.168.43.146.8880 > 192.168.43.147.7772: UDP, length 120
23:58:09.574999 IP 192.168.43.146.8880 > 192.168.43.147.7772: UDP, length 120
23:58:09.576450 IP 192.168.43.147.8880 > 192.168.43.124.7773: UDP, length 120
23:58:09.626441 IP 192.168.43.147.8880 > 192.168.43.124.7773: UDP, length 120
