22:02:44.052318 IP 192.168.43.124.8880 > 192.168.43.146.7771: UDP, length 120
22:02:44.102463 IP 192.168.43.124.8880 > 192.168.43.146.7771: UDP, length 120
22:02:44.152463 IP 192.168.43.124.8880 > 192.168.43.146.7771: UDP, length 120
22:02:44.202464 IP 192.168.43.124.8880 > 192.168.43.146.7771: UDP, length 120
22:02:44.252463 IP 192.168.43.124.8880 > 192.168.43.146.7771: UDP, length 120
22:02:44.302464 IP 192.168.43.124.8880 > 192.168.43.146.7771: UDP, length 120
22:02:44.352463 IP 192.168.43.124.8880 > 192.168.43.146.7771: UDP, length 120
22:02:44.402464 IP 192.168.43.124.8880 > 192.168.43.146.7771: UDP, length 120
22:02:44.452464 IP 192.168.43.124.8880 > 192.168.43.146.7771: UDP, length 120
22:02:44.502509 IP 192.168.43.124.8880 > 192.168.43.146.7771: UDP, length 120
22:02:44.552514 IP 192.168.43.124.8880 > 192.168.43.146.7771: UDP, length 120
22:02:44.602428 IP 192.168.43.124.8880 > 192.168.43.146.7771: UDP, length 120
22:02:44.652464 IP 192.168.43.124.8880 > 192.168.43.146.7771: UDP, length 120
22:02:44.702461 IP 192.168.43.124.8880 > 192.168.43.146.7771: UDP, length 120
22:02:44.750079 IP 192.168.43.147.8880 > 192.168.43.124.7773: UDP, length 120
22:02:44.752466 IP 192.168.43.124.8880 > 192.168.43.146.7771: UDP, length 120
22:02:44.802395 IP 192.168.43.124.8880 > 192.168.43.146.7771: UDP, length 120
22:02:44.803255 IP 192.168.43.147.8880 > 192.168.43.124.7773: UDP, length 120
22:02:44.845344 IP 192.168.43.147.8880 > 192.168.43.124.7773: UDP, length 120
22:02:44.852400 IP 192.168.43.124.8880 > 192.168.43.146.7771: UDP, length 120
22:02:44.901390 IP 192.168.43.147.8880 > 192.168.43.124.7773: UDP, length 120
22:02:44.902430 IP 192.168.43.124.8880 > 192.168.43.146.7771: UDP, length 120
22:02:44.952463 IP 192.168.43.124.8880 > 192.168.43.146.7771: UDP, length 120
22:02:44.964438 IP 192.168.43.147.8880 > 192.168.43.124.7773: UDP, length 120
22:02:44.995316 IP 192.168.43.147.8880 > 192.168.43.124.7773: UDP, length 120
22:02:45.002465 IP 192.168.43.124.8880 > 192.168.43.146.7771: UDP, length 120
22:02:45.155392 IP 192.168.43.124.8880 > 192.168.43.146.7771: UDP, length 120
22:02:45.155577 IP 192.168.43.124.8880 > 192.168.43.146.7771: UDP, length 120
22:02:45.155583 IP 192.168.43.124.8880 > 192.168.43.146.7771: UDP, length 120
22:02:45.160161 IP 192.168.43.147.8880 > 192.168.43.124.7773: UDP, length 120
22:02:45.160174 IP 192.168.43.147.8880 > 192.168.43.124.7773: UDP, length 120
22:02:45.160175 IP 192.168.43.147.8880 > 192.168.43.124.7773: UDP, length 120
22:02:45.196931 IP 192.168.43.147.8880 > 192.168.43.124.7773: UDP, length 120
22:02:45.202465 IP 192.168.43.124.8880 > 192.168.43.146.7771: UDP, length 120
22:02:45.246915 IP 192.168.43.147.8880 > 192.168.43.124.7773: UDP, length 120
22:02:45.252427 IP 192.168.43.124.8880 > 192.168.43.146.7771: UDP, length 120
22:02:45.296846 IP 192.168.43.147.8880 > 192.168.43.124.7773: UDP, length 120
22:02:45.302465 IP 192.168.43.124.8880 > 192.168.43.146.7771: UDP, length 120
22:02:45.352466 IP 192.168.43.124.8880 > 192.168.43.146.7771: UDP, length 120
22:02:45.506773 IP 192.168.43.124.8880 > 192.168.43.146.7771: UDP, length 120
22:02:45.506927 IP 192.168.43.124.8880 > 192.168.43.146.7771: UDP, length 120
22:02:45.506931 IP 192.168.43.124.8880 > 192.168.43.146.7771: UDP, length 120
22:02:45.508880 IP 192.168.43.147.8880 > 192.168.43.124.7773: UDP, length 120
22:02:45.508893 IP 192.168.43.147.8880 > 192.168.43.124.7773: UDP, length 120
22:02:45.508895 IP 192.168.43.147.8880 > 192.168.43.124.7773: UDP, length 120
22:02:45.509490 IP 192.168.43.147.8880 > 192.168.43.124.7773: UDP, length 120
22:02:45.545869 IP 192.168.43.147.8880 > 192.168.43.124.7773: UDP, length 120
22:02:45.552428 IP 192.168.43.124.8880 > 192.168.43.146.7771: UDP, length 120
22:02:45.592285 IP 192.168.43.147.8880 > 192.168.43.124.7773: UDP, length 120
22:02:45.602462 IP 192.168.43.124.8880 > 192.168.43.146.7771: UDP, length 120
22:02:45.645470 IP 192.168.43.147.8880 > 192.168.43.124.7773: UDP, length 120
22:02:45.652430 IP 192.168.43.124.8880 > 192.168.43.146.7771: UDP, length 120
22:02:45.697598 IP 192.168.43.147.8880 > 192.168.43.124.7773: UDP, length 120
22:02:45.702464 IP 192.168.43.124.8880 > 192.168.43.146.7771: UDP, length 120
22:02:45.854779 IP 192.168.43.124.8880 > 192.168.43.146.7771: UDP, length 120
22:02:45.854933 IP 192.168.43.124.8880 > 192.168.43.146.7771: UDP, length 120
22:02:45.854937 IP 192.168.43.124.8880 > 192.168.43.146.7771: UDP, length 120
22:02:45.857512 IP 192.168.43.147.8880 > 192.168.43.124.7773: UDP, length 120
22:02:45.857521 IP 192.168.43.147.8880 > 192.168.43.124.7773: UDP, length 120
22:02:45.857522 IP 192.168.43.147.8880 > 192.168.43.124.7773: UDP, length 120
22:02:45.897749 IP 192.168.43.147.8880 > 192.168.43.124.7773: UDP, length 120
22:02:45.902463 IP 192.168.43.124.8880 > 192.168.43.146.7771: UDP, length 120
22:02:45.948528 IP 192.168.43.147.8880 > 192.168.43.124.7773: UDP, length 120
22:02:45.952428 IP 192.168.43.124.8880 > 192.168.43.146.7771: UDP, length 120
22:02:45.999821 IP 192.168.43.147.8880 > 192.168.43.124.7773: UDP, length 120
22:02:46.002424 IP 192.168.43.124.8880 > 192.168.43.146.7771: UDP, length 120
22:02:46.048199 IP 192.168.43.147.8880 > 192.168.43.124.7773: UDP, length 120
22:02:46.052426 IP 192.168.43.124.8880 > 192.168.43.146.7771: UDP, length 120
22:02:46.206779 IP 192.168.43.124.8880 > 192.168.43.146.7771: UDP, length 120
22:02:46.206933 IP 192.168.43.124.8880 > 192.168.43.146.7771: UDP, length 120
22:02:46.206937 IP 192.168.43.124.8880 > 192.168.43.146.7771: UDP, length 120
22:02:46.208679 IP 192.168.43.147.8880 > 192.168.43.124.7773: UDP, length 120
22:02:46.208742 IP 192.168.43.147.8880 > 192.168.43.124.7773: UDP, length 120
22:02:46.208743 IP 192.168.43.147.8880 > 192.168.43.124.7773: UDP, length 120
22:02:46.246900 IP 192.168.43.147.8880 > 192.168.43.124.7773: UDP, length 120
22:02:46.252383 IP 192.168.43.124.8880 > 192.168.43.146.7771: UDP, length 120
22:02:46.296044 IP 192.168.43.147.8880 > 192.168.43.124.7773: UDP, length 120
22:02:46.302409 IP 192.168.43.124.8880 > 192.168.43.146.7771: UDP, length 120
22:02:46.342724 IP 192.168.43.147.8880 > 192.168.43.124.7773: UDP, length 120
22:02:46.352452 IP 192.168.43.124.8880 > 192.168.43.146.7771: UDP, length 120
22:02:46.395227 IP 192.168.43.147.8880 > 192.168.43.124.7773: UDP, length 120
22:02:46.402410 IP 192.168.43.124.8880 > 192.168.43.146.7771: UDP, length 120
22:02:46.554772 IP 192.168.43.124.8880 > 192.168.43.146.7771: UDP, length 120
22:02:46.554925 IP 192.168.43.124.8880 > 192.168.43.146.7771: UDP, length 120
22:02:46.554929 IP 192.168.43.124.8880 > 192.168.43.146.7771: UDP, length 120
22:02:46.566011 IP 192.168.43.147.8880 > 192.168.43.124.7773: UDP, length 120
22:02:46.566026 IP 192.168.43.147.8880 > 192.168.43.124.7773: UDP, length 120
22:02:46.566028 IP 192.168.43.147.8880 > 192.168.43.124.7773: UDP, length 120
22:02:46.597786 IP 192.168.43.147.8880 > 192.168.43.124.7773: UDP, length 120
22:02:46.602464 IP 192.168.43.124.8880 > 192.168.43.146.7771: UDP, length 120
22:02:46.646484 IP 192.168.43.147.8880 > 192.168.43.124.7773: UDP, length 120
22:02:46.652464 IP 192.168.43.124.8880 > 192.168.43.146.7771: UDP, length 120
22:02:46.696003 IP 192.168.43.147.8880 > 192.168.43.124.7773: UDP, length 120
22:02:46.702465 IP 192.168.43.124.8880 > 192.168.43.146.7771: UDP, length 120
22:02:46.749463 IP 192.168.43.147.8880 > 192.168.43.124.7773: UDP, length 120
22:02:46.902775 IP 192.168.43.124.8880 > 192.168.43.146.7771: UDP, length 120
22:02:46.902928 IP 192.168.43.124.8880 > 192.168.43.146.7771: UDP, length 120
22:02:46.902932 IP 192.168.43.124.8880 > 192.168.43.146.7771: UDP, length 120
22:02:46.902935 IP 192.168.43.124.8880 > 192.168.43.146.7771: UDP, length 120
22:02:46.904220 IP 192.168.43.147.8880 > 192.168.43.124.7773: UDP, length 120
22:02:46.904232 IP 192.168.43.147.8880 > 192.168.43.124.7773: UDP, length 120
22:02:46.904234 IP 192.168.43.147.8880 > 192.168.43.124.7773: UDP, length 120
22:02:46.947025 IP 192.168.43.147.8880 > 192.168.43.124.7773: UDP, length 120
22:02:46.952464 IP 192.168.43.124.8880 > 192.168.43.146.7771: UDP, length 120
22:02:47.002461 IP 192.168.43.124.8880 > 192.168.43.146.7771: UDP, length 120
22:02:47.003258 IP 192.168.43.147.8880 > 192.168.43.124.7773: UDP, length 120
22:02:47.045826 IP 192.168.43.147.8880 > 192.168.43.124.7773: UDP, length 120
22:02:47.052465 IP 192.168.43.124.8880 > 192.168.43.146.7771: UDP, length 120
22:02:47.096879 IP 192.168.43.147.8880 > 192.168.43.124.7773: UDP, length 120
22:02:47.250780 IP 192.168.43.124.8880 > 192.168.43.146.7771: UDP, length 120
22:02:47.250931 IP 192.168.43.124.8880 > 192.168.43.146.7771: UDP, length 120
22:02:47.250935 IP 192.168.43.124.8880 > 192.168.43.146.7771: UDP, length 120
22:02:47.252217 IP 192.168.43.147.8880 > 192.168.43.124.7773: UDP, length 120
22:02:47.252230 IP 192.168.43.147.8880 > 192.168.43.124.7773: UDP, length 120
22:02:47.252412 IP 192.168.43.124.8880 > 192.168.43.146.7771: UDP, length 120
22:02:47.258034 IP 192.168.43.147.8880 > 192.168.43.124.7773: UDP, length 120
22:02:47.295935 IP 192.168.43.147.8880 > 192.168.43.124.7773: UDP, length 120
22:02:47.302476 IP 192.168.43.124.8880 > 192.168.43.146.7771: UDP, length 120
22:02:47.347140 IP 192.168.43.147.8880 > 192.168.43.124.7773: UDP, length 120
22:02:47.352472 IP 192.168.43.124.8880 > 192.168.43.146.7771: UDP, length 120
22:02:47.396990 IP 192.168.43.147.8880 > 192.168.43.124.7773: UDP, length 120
22:02:47.402467 IP 192.168.43.124.8880 > 192.168.43.146.7771: UDP, length 120
22:02:47.446520 IP 192.168.43.147.8880 > 192.168.43.124.7773: UDP, length 120
22:02:47.599408 IP 192.168.43.124.8880 > 192.168.43.146.7771: UDP, length 120
22:02:47.599574 IP 192.168.43.124.8880 > 192.168.43.146.7771: UDP, length 120
22:02:47.599581 IP 192.168.43.124.8880 > 192.168.43.146.7771: UDP, length 120
22:02:47.602410 IP 192.168.43.124.8880 > 192.168.43.146.7771: UDP, length 120
22:02:47.617220 IP 192.168.43.147.8880 > 192.168.43.124.7773: UDP, length 120
22:02:47.617233 IP 192.168.43.147.8880 > 192.168.43.124.7773: UDP, length 120
22:02:47.617234 IP 192.168.43.147.8880 > 192.168.43.124.7773: UDP, length 120
22:02:47.646678 IP 192.168.43.147.8880 > 192.168.43.124.7773: UDP, length 120
22:02:47.652463 IP 192.168.43.124.8880 > 192.168.43.146.7771: UDP, length 120
22:02:47.695388 IP 192.168.43.147.8880 > 192.168.43.124.7773: UDP, length 120
22:02:47.702462 IP 192.168.43.124.8880 > 192.168.43.146.7771: UDP, length 120
22:02:47.746783 IP 192.168.43.147.8880 > 192.168.43.124.7773: UDP, length 120
22:02:47.752426 IP 192.168.43.124.8880 > 192.168.43.146.7771: UDP, length 120
22:02:47.795598 IP 192.168.43.147.8880 > 192.168.43.124.7773: UDP, length 120
22:02:47.950271 IP 192.168.43.124.8880 > 192.168.43.146.7771: UDP, length 120
22:02:47.950425 IP 192.168.43.124.8880 > 192.168.43.146.7771: UDP, length 120
22:02:47.950429 IP 192.168.43.124.8880 > 192.168.43.146.7771: UDP, length 120
22:02:47.951696 IP 192.168.43.147.8880 > 192.168.43.124.7773: UDP, length 120
22:02:47.951709 IP 192.168.43.147.8880 > 192.168.43.124.7773: UDP, length 120
22:02:47.951710 IP 192.168.43.147.8880 > 192.168.43.124.7773: UDP, length 120
22:02:47.952463 IP 192.168.43.124.8880 > 192.168.43.146.7771: UDP, length 120
22:02:48.001580 IP 192.168.43.147.8880 > 192.168.43.124.7773: UDP, length 120
22:02:48.002435 IP 192.168.43.124.8880 > 192.168.43.146.7771: UDP, length 120
22:02:48.052462 IP 192.168.43.124.8880 > 192.168.43.146.7771: UDP, length 120
22:02:48.056041 IP 192.168.43.147.8880 > 192.168.43.124.7773: UDP, length 120
22:02:48.092768 IP 192.168.43.147.8880 > 192.168.43.124.7773: UDP, length 120
22:02:48.102462 IP 192.168.43.124.8880 > 192.168.43.146.7771: UDP, length 120
22:02:48.148795 IP 192.168.43.147.8880 > 192.168.43.124.7773: UDP, length 120
22:02:48.298784 IP 192.168.43.124.8880 > 192.168.43.146.7771: UDP, length 120
22:02:48.298936 IP 192.168.43.124.8880 > 192.168.43.146.7771: UDP, length 120
22:02:48.298940 IP 192.168.43.124.8880 > 192.168.43.146.7771: UDP, length 120
22:02:48.300299 IP 192.168.43.147.8880 > 192.168.43.124.7773: UDP, length 120
22:02:48.300311 IP 192.168.43.147.8880 > 192.168.43.124.7773: UDP, length 120
22:02:48.302462 IP 192.168.43.124.8880 > 192.168.43.146.7771: UDP, length 120
22:02:48.304411 IP 192.168.43.147.8880 > 192.168.43.124.7773: UDP, length 120
22:02:48.352425 IP 192.168.43.124.8880 > 192.168.43.146.7771: UDP, length 120
22:02:48.356767 IP 192.168.43.147.8880 > 192.168.43.124.7773: UDP, length 120
22:02:48.396136 IP 192.168.43.147.8880 > 192.168.43.124.7773: UDP, length 120
22:02:48.402509 IP 192.168.43.124.8880 > 192.168.43.146.7771: UDP, length 120
22:02:48.452395 IP 192.168.43.124.8880 > 192.168.43.146.7771: UDP, length 120
22:02:48.452959 IP 192.168.43.147.8880 > 192.168.43.124.7773: UDP, length 120
22:02:48.646780 IP 192.168.43.124.8880 > 192.168.43.146.7771: UDP, length 120
22:02:48.646930 IP 192.168.43.124.8880 > 192.168.43.146.7771: UDP, length 120
22:02:48.646934 IP 192.168.43.124.8880 > 192.168.43.146.7771: UDP, length 120
22:02:48.648748 IP 192.168.43.147.8880 > 192.168.43.124.7773: UDP, length 120
22:02:48.648761 IP 192.168.43.147.8880 > 192.168.43.124.7773: UDP, length 120
22:02:48.648762 IP 192.168.43.147.8880 > 192.168.43.124.7773: UDP, length 120
22:02:48.648765 IP 192.168.43.147.8880 > 192.168.43.124.7773: UDP, length 120
22:02:48.652463 IP 192.168.43.124.8880 > 192.168.43.146.7771: UDP, length 120
22:02:48.694589 IP 192.168.43.147.8880 > 192.168.43.124.7773: UDP, length 120
22:02:48.702463 IP 192.168.43.124.8880 > 192.168.43.146.7771: UDP, length 120
22:02:48.743916 IP 192.168.43.147.8880 > 192.168.43.124.7773: UDP, length 120
22:02:48.752463 IP 192.168.43.124.8880 > 192.168.43.146.7771: UDP, length 120
22:02:48.802464 IP 192.168.43.124.8880 > 192.168.43.146.7771: UDP, length 120
22:02:48.826919 IP 192.168.43.147.8880 > 192.168.43.124.7773: UDP, length 120
22:02:48.994790 IP 192.168.43.124.8880 > 192.168.43.146.7771: UDP, length 120
22:02:48.994943 IP 192.168.43.124.8880 > 192.168.43.146.7771: UDP, length 120
22:02:48.994947 IP 192.168.43.124.8880 > 192.168.43.146.7771: UDP, length 120
22:02:48.996234 IP 192.168.43.147.8880 > 192.168.43.124.7773: UDP, length 120
22:02:48.996247 IP 192.168.43.147.8880 > 192.168.43.124.7773: UDP, length 120
22:02:48.996249 IP 192.168.43.147.8880 > 192.168.43.124.7773: UDP, length 120
22:02:49.002464 IP 192.168.43.124.8880 > 192.168.43.146.7771: UDP, length 120
22:02:49.015319 IP 192.168.43.147.8880 > 192.168.43.124.7773: UDP, length 120
22:02:49.040088 IP 192.168.43.147.8880 > 192.168.43.124.7773: UDP, length 120
22:02:49.052463 IP 192.168.43.124.8880 > 192.168.43.146.7771: UDP, length 120
22:02:49.095699 IP 192.168.43.147.8880 > 192.168.43.124.7773: UDP, length 120
22:02:49.102464 IP 192.168.43.124.8880 > 192.168.43.146.7771: UDP, length 120
22:02:49.142440 IP 192.168.43.147.8880 > 192.168.43.124.7773: UDP, length 120
22:02:49.152462 IP 192.168.43.124.8880 > 192.168.43.146.7771: UDP, length 120
22:02:49.343608 IP 192.168.43.124.8880 > 192.168.43.146.7771: UDP, length 120
22:02:49.343624 IP 192.168.43.124.8880 > 192.168.43.146.7771: UDP, length 120
22:02:49.343629 IP 192.168.43.124.8880 > 192.168.43.146.7771: UDP, length 120
22:02:49.346981 IP 192.168.43.147.8880 > 192.168.43.124.7773: UDP, length 120
22:02:49.346995 IP 192.168.43.147.8880 > 192.168.43.124.7773: UDP, length 120
22:02:49.346997 IP 192.168.43.147.8880 > 192.168.43.124.7773: UDP, length 120
22:02:49.346999 IP 192.168.43.147.8880 > 192.168.43.124.7773: UDP, length 120
22:02:49.352386 IP 192.168.43.124.8880 > 192.168.43.146.7771: UDP, length 120
22:02:49.402174 IP 192.168.43.147.8880 > 192.168.43.124.7773: UDP, length 120
22:02:49.402397 IP 192.168.43.124.8880 > 192.168.43.146.7771: UDP, length 120
22:02:49.452429 IP 192.168.43.124.8880 > 192.168.43.146.7771: UDP, length 120
22:02:49.461320 IP 192.168.43.147.8880 > 192.168.43.124.7773: UDP, length 120
22:02:49.497217 IP 192.168.43.147.8880 > 192.168.43.124.7773: UDP, length 120
22:02:49.502546 IP 192.168.43.124.8880 > 192.168.43.146.7771: UDP, length 120
22:02:49.552222 IP 192.168.43.147.8880 > 192.168.43.124.7773: UDP, length 120
22:02:49.552413 IP 192.168.43.124.8880 > 192.168.43.146.7771: UDP, length 120
22:02:49.590614 IP 192.168.43.147.8880 > 192.168.43.124.7773: UDP, length 120
22:02:49.602473 IP 192.168.43.124.8880 > 192.168.43.146.7771: UDP, length 120
22:02:49.652465 IP 192.168.43.124.8880 > 192.168.43.146.7771: UDP, length 120
22:02:49.654143 IP 192.168.43.147.8880 > 192.168.43.124.7773: UDP, length 120
22:02:49.701125 IP 192.168.43.147.8880 > 192.168.43.124.7773: UDP, length 120
22:02:49.702462 IP 192.168.43.124.8880 > 192.168.43.146.7771: UDP, length 120
22:02:49.752464 IP 192.168.43.124.8880 > 192.168.43.146.7771: UDP, length 120
22:02:49.756922 IP 192.168.43.147.8880 > 192.168.43.124.7773: UDP, length 120
22:02:49.802427 IP 192.168.43.124.8880 > 192.168.43.146.7771: UDP, length 120
22:02:49.815203 IP 192.168.43.147.8880 > 192.168.43.124.7773: UDP, length 120
22:02:49.844131 IP 192.168.43.147.8880 > 192.168.43.124.7773: UDP, length 120
22:02:49.852470 IP 192.168.43.124.8880 > 192.168.43.146.7771: UDP, length 120
22:02:49.894947 IP 192.168.43.147.8880 > 192.168.43.124.7773: UDP, length 120
22:02:49.902401 IP 192.168.43.124.8880 > 192.168.43.146.7771: UDP, length 120
22:02:49.942547 IP 192.168.43.147.8880 > 192.168.43.124.7773: UDP, length 120
22:02:49.952428 IP 192.168.43.124.8880 > 192.168.43.146.7771: UDP, length 120
22:02:50.002462 IP 192.168.43.124.8880 > 192.168.43.146.7771: UDP, length 120
22:02:50.008145 IP 192.168.43.147.8880 > 192.168.43.124.7773: UDP, length 120
22:02:50.044561 IP 192.168.43.147.8880 > 192.168.43.124.7773: UDP, length 120
22:02:50.052463 IP 192.168.43.124.8880 > 192.168.43.146.7771: UDP, length 120
22:02:50.095964 IP 192.168.43.147.8880 > 192.168.43.124.7773: UDP, length 120
22:02:50.102464 IP 192.168.43.124.8880 > 192.168.43.146.7771: UDP, length 120
22:02:50.151887 IP 192.168.43.147.8880 > 192.168.43.124.7773: UDP, length 120
22:02:50.152464 IP 192.168.43.124.8880 > 192.168.43.146.7771: UDP, length 120
22:02:50.202465 IP 192.168.43.124.8880 > 192.168.43.146.7771: UDP, length 120
22:02:50.206943 IP 192.168.43.147.8880 > 192.168.43.124.7773: UDP, length 120
22:02:50.252466 IP 192.168.43.124.8880 > 192.168.43.146.7771: UDP, length 120
22:02:50.262527 IP 192.168.43.147.8880 > 192.168.43.124.7773: UDP, length 120
22:02:50.302464 IP 192.168.43.124.8880 > 192.168.43.146.7771: UDP, length 120
22:02:50.316133 IP 192.168.43.147.8880 > 192.168.43.124.7773: UDP, length 120
22:02:50.348882 IP 192.168.43.147.8880 > 192.168.43.124.7773: UDP, length 120
22:02:50.352384 IP 192.168.43.124.8880 > 192.168.43.146.7771: UDP, length 120
22:02:50.391132 IP 192.168.43.147.8880 > 192.168.43.124.7773: UDP, length 120
22:02:50.402429 IP 192.168.43.124.8880 > 192.168.43.146.7771: UDP, length 120
22:02:50.452465 IP 192.168.43.124.8880 > 192.168.43.146.7771: UDP, length 120
22:02:50.463576 IP 192.168.43.147.8880 > 192.168.43.124.7773: UDP, length 120
22:02:50.494041 IP 192.168.43.147.8880 > 192.168.43.124.7773: UDP, length 120
22:02:50.502428 IP 192.168.43.124.8880 > 192.168.43.146.7771: UDP, length 120
22:02:50.552463 IP 192.168.43.124.8880 > 192.168.43.146.7771: UDP, length 120
22:02:50.554308 IP 192.168.43.147.8880 > 192.168.43.124.7773: UDP, length 120
22:02:50.591630 IP 192.168.43.147.8880 > 192.168.43.124.7773: UDP, length 120
22:02:50.602426 IP 192.168.43.124.8880 > 192.168.43.146.7771: UDP, length 120
22:02:50.652463 IP 192.168.43.124.8880 > 192.168.43.146.7771: UDP, length 120
22:02:50.654309 IP 192.168.43.147.8880 > 192.168.43.124.7773: UDP, length 120
22:02:50.702417 IP 192.168.43.124.8880 > 192.168.43.146.7771: UDP, length 120
22:02:50.709607 IP 192.168.43.147.8880 > 192.168.43.124.7773: UDP, length 120
22:02:50.743722 IP 192.168.43.147.8880 > 192.168.43.124.7773: UDP, length 120
22:02:50.752464 IP 192.168.43.124.8880 > 192.168.43.146.7771: UDP, length 120
22:02:50.794371 IP 192.168.43.147.8880 > 192.168.43.124.7773: UDP, length 120
22:02:50.802411 IP 192.168.43.124.8880 > 192.168.43.146.7771: UDP, length 120
22:02:50.845889 IP 192.168.43.147.8880 > 192.168.43.124.7773: UDP, length 120
22:02:50.852465 IP 192.168.43.124.8880 > 192.168.43.146.7771: UDP, length 120
22:02:50.902040 IP 192.168.43.147.8880 > 192.168.43.124.7773: UDP, length 120
22:02:50.902401 IP 192.168.43.124.8880 > 192.168.43.146.7771: UDP, length 120
22:02:50.952464 IP 192.168.43.124.8880 > 192.168.43.146.7771: UDP, length 120
22:02:50.957208 IP 192.168.43.147.8880 > 192.168.43.124.7773: UDP, length 120
22:02:50.996327 IP 192.168.43.147.8880 > 192.168.43.124.7773: UDP, length 120
22:02:51.002377 IP 192.168.43.124.8880 > 192.168.43.146.7771: UDP, length 120
22:02:51.044026 IP 192.168.43.147.8880 > 192.168.43.124.7773: UDP, length 120
22:02:51.052419 IP 192.168.43.124.8880 > 192.168.43.146.7771: UDP, length 120
22:02:51.099264 IP 192.168.43.147.8880 > 192.168.43.124.7773: UDP, length 120
22:02:51.102409 IP 192.168.43.124.8880 > 192.168.43.146.7771: UDP, length 120
22:02:51.152398 IP 192.168.43.124.8880 > 192.168.43.146.7771: UDP, length 120
22:02:51.153307 IP 192.168.43.147.8880 > 192.168.43.124.7773: UDP, length 120
22:02:51.194440 IP 192.168.43.147.8880 > 192.168.43.124.7773: UDP, length 120
22:02:51.202513 IP 192.168.43.124.8880 > 192.168.43.146.7771: UDP, length 120
22:02:51.241567 IP 192.168.43.147.8880 > 192.168.43.124.7773: UDP, length 120
22:02:51.252516 IP 192.168.43.124.8880 > 192.168.43.146.7771: UDP, length 120
22:02:51.302512 IP 192.168.43.124.8880 > 192.168.43.146.7771: UDP, length 120
22:02:51.303788 IP 192.168.43.147.8880 > 192.168.43.124.7773: UDP, length 120
22:02:51.352404 IP 192.168.43.124.8880 > 192.168.43.146.7771: UDP, length 120
22:02:51.376228 IP 192.168.43.147.8880 > 192.168.43.124.7773: UDP, length 120
22:02:51.390871 IP 192.168.43.147.8880 > 192.168.43.124.7773: UDP, length 120
22:02:51.402465 IP 192.168.43.124.8880 > 192.168.43.146.7771: UDP, length 120
22:02:51.452465 IP 192.168.43.124.8880 > 192.168.43.146.7771: UDP, length 120
22:02:51.454011 IP 192.168.43.147.8880 > 192.168.43.124.7773: UDP, length 120
22:02:51.493531 IP 192.168.43.147.8880 > 192.168.43.124.7773: UDP, length 120
22:02:51.502464 IP 192.168.43.124.8880 > 192.168.43.146.7771: UDP, length 120
22:02:51.543501 IP 192.168.43.147.8880 > 192.168.43.124.7773: UDP, length 120
22:02:51.552376 IP 192.168.43.124.8880 > 192.168.43.146.7771: UDP, length 120
22:02:51.594460 IP 192.168.43.147.8880 > 192.168.43.124.7773: UDP, length 120
22:02:51.602427 IP 192.168.43.124.8880 > 192.168.43.146.7771: UDP, length 120
22:02:51.652465 IP 192.168.43.124.8880 > 192.168.43.146.7771: UDP, length 120
22:02:51.665461 IP 192.168.43.147.8880 > 192.168.43.124.7773: UDP, length 120
22:02:51.694202 IP 192.168.43.147.8880 > 192.168.43.124.7773: UDP, length 120
22:02:51.702468 IP 192.168.43.124.8880 > 192.168.43.146.7771: UDP, length 120
22:02:51.752464 IP 192.168.43.124.8880 > 192.168.43.146.7771: UDP, length 120
22:02:51.754013 IP 192.168.43.147.8880 > 192.168.43.124.7773: UDP, length 120
22:02:51.793624 IP 192.168.43.147.8880 > 192.168.43.124.7773: UDP, length 120
22:02:51.802465 IP 192.168.43.124.8880 > 192.168.43.146.7771: UDP, length 120
22:02:51.840403 IP 192.168.43.147.8880 > 192.168.43.124.7773: UDP, length 120
22:02:51.852420 IP 192.168.43.124.8880 > 192.168.43.146.7771: UDP, length 120
22:02:51.902465 IP 192.168.43.124.8880 > 192.168.43.146.7771: UDP, length 120
22:02:51.903864 IP 192.168.43.147.8880 > 192.168.43.124.7773: UDP, length 120
22:02:51.943976 IP 192.168.43.147.8880 > 192.168.43.124.7773: UDP, length 120
22:02:51.952513 IP 192.168.43.124.8880 > 192.168.43.146.7771: UDP, length 120
22:02:51.990708 IP 192.168.43.147.8880 > 192.168.43.124.7773: UDP, length 120
22:02:52.002511 IP 192.168.43.124.8880 > 192.168.43.146.7771: UDP, length 120
22:02:52.052514 IP 192.168.43.124.8880 > 192.168.43.146.7771: UDP, length 120
22:02:52.055055 IP 192.168.43.147.8880 > 192.168.43.124.7773: UDP, length 120
22:02:52.093106 IP 192.168.43.147.8880 > 192.168.43.124.7773: UDP, length 120
22:02:52.102514 IP 192.168.43.124.8880 > 192.168.43.146.7771: UDP, length 120
22:02:52.141252 IP 192.168.43.147.8880 > 192.168.43.124.7773: UDP, length 120
22:02:52.152515 IP 192.168.43.124.8880 > 192.168.43.146.7771: UDP, length 120
22:02:52.202530 IP 192.168.43.124.8880 > 192.168.43.146.7771: UDP, length 120
22:02:52.208453 IP 192.168.43.147.8880 > 192.168.43.124.7773: UDP, length 120
22:02:52.246298 IP 192.168.43.147.8880 > 192.168.43.124.7773: UDP, length 120
22:02:52.252516 IP 192.168.43.124.8880 > 192.168.43.146.7771: UDP, length 120
22:02:52.300908 IP 192.168.43.147.8880 > 192.168.43.124.7773: UDP, length 120
22:02:52.302512 IP 192.168.43.124.8880 > 192.168.43.146.7771: UDP, length 120
22:02:52.352515 IP 192.168.43.124.8880 > 192.168.43.146.7771: UDP, length 120
22:02:52.355368 IP 192.168.43.147.8880 > 192.168.43.124.7773: UDP, length 120
22:02:52.396995 IP 192.168.43.147.8880 > 192.168.43.124.7773: UDP, length 120
22:02:52.402469 IP 192.168.43.124.8880 > 192.168.43.146.7771: UDP, length 120
22:02:52.448129 IP 192.168.43.147.8880 > 192.168.43.124.7773: UDP, length 120
22:02:52.452469 IP 192.168.43.124.8880 > 192.168.43.146.7771: UDP, length 120
22:02:52.502413 IP 192.168.43.124.8880 > 192.168.43.146.7771: UDP, length 120
22:02:52.508087 IP 192.168.43.147.8880 > 192.168.43.124.7773: UDP, length 120
22:02:52.546622 IP 192.168.43.147.8880 > 192.168.43.124.7773: UDP, length 120
22:02:52.552468 IP 192.168.43.124.8880 > 192.168.43.146.7771: UDP, length 120
22:02:52.593994 IP 192.168.43.147.8880 > 192.168.43.124.7773: UDP, length 120
22:02:52.602471 IP 192.168.43.124.8880 > 192.168.43.146.7771: UDP, length 120
22:02:52.652465 IP 192.168.43.124.8880 > 192.168.43.146.7771: UDP, length 120
22:02:52.653654 IP 192.168.43.147.8880 > 192.168.43.124.7773: UDP, length 120
22:02:52.694938 IP 192.168.43.147.8880 > 192.168.43.124.7773: UDP, length 120
22:02:52.702466 IP 192.168.43.124.8880 > 192.168.43.146.7771: UDP, length 120
22:02:52.740504 IP 192.168.43.147.8880 > 192.168.43.124.7773: UDP, length 120
22:02:52.752465 IP 192.168.43.124.8880 > 192.168.43.146.7771: UDP, length 120
22:02:52.802513 IP 192.168.43.124.8880 > 192.168.43.146.7771: UDP, length 120
22:02:52.804889 IP 192.168.43.147.8880 > 192.168.43.124.7773: UDP, length 120
22:02:52.846917 IP 192.168.43.147.8880 > 192.168.43.124.7773: UDP, length 120
22:02:52.852467 IP 192.168.43.124.8880 > 192.168.43.146.7771: UDP, length 120
22:02:52.893189 IP 192.168.43.147.8880 > 192.168.43.124.7773: UDP, length 120
22:02:52.902465 IP 192.168.43.124.8880 > 192.168.43.146.7771: UDP, length 120
22:02:52.949108 IP 192.168.43.147.8880 > 192.168.43.124.7773: UDP, length 120
22:02:52.952467 IP 192.168.43.124.8880 > 192.168.43.146.7771: UDP, length 120
22:02:52.996224 IP 192.168.43.147.8880 > 192.168.43.124.7773: UDP, length 120
22:02:53.002467 IP 192.168.43.124.8880 > 192.168.43.146.7771: UDP, length 120
22:02:53.045122 IP 192.168.43.147.8880 > 192.168.43.124.7773: UDP, length 120
22:02:53.052468 IP 192.168.43.124.8880 > 192.168.43.146.7771: UDP, length 120
22:02:53.099317 IP 192.168.43.147.8880 > 192.168.43.124.7773: UDP, length 120
22:02:53.102466 IP 192.168.43.124.8880 > 192.168.43.146.7771: UDP, length 120
22:02:53.146889 IP 192.168.43.147.8880 > 192.168.43.124.7773: UDP, length 120
22:02:53.152469 IP 192.168.43.124.8880 > 192.168.43.146.7771: UDP, length 120
22:02:53.202469 IP 192.168.43.124.8880 > 192.168.43.146.7771: UDP, length 120
22:02:53.203549 IP 192.168.43.147.8880 > 192.168.43.124.7773: UDP, length 120
22:02:53.252516 IP 192.168.43.124.8880 > 192.168.43.146.7771: UDP, length 120
22:02:53.290945 IP 192.168.43.147.8880 > 192.168.43.124.7773: UDP, length 120
22:02:53.302514 IP 192.168.43.124.8880 > 192.168.43.146.7771: UDP, length 120
22:02:53.352516 IP 192.168.43.124.8880 > 192.168.43.146.7771: UDP, length 120
22:02:53.354908 IP 192.168.43.147.8880 > 192.168.43.124.7773: UDP, length 120
22:02:53.393503 IP 192.168.43.147.8880 > 192.168.43.124.7773: UDP, length 120
22:02:53.402470 IP 192.168.43.124.8880 > 192.168.43.146.7771: UDP, length 120
22:02:53.441201 IP 192.168.43.147.8880 > 192.168.43.124.7773: UDP, length 120
22:02:53.452465 IP 192.168.43.124.8880 > 192.168.43.146.7771: UDP, length 120
22:02:53.502467 IP 192.168.43.124.8880 > 192.168.43.146.7771: UDP, length 120
22:02:53.503547 IP 192.168.43.147.8880 > 192.168.43.124.7773: UDP, length 120
22:02:53.546214 IP 192.168.43.147.8880 > 192.168.43.124.7773: UDP, length 120
22:02:53.552384 IP 192.168.43.124.8880 > 192.168.43.146.7771: UDP, length 120
22:02:53.591108 IP 192.168.43.147.8880 > 192.168.43.124.7773: UDP, length 120
22:02:53.602372 IP 192.168.43.124.8880 > 192.168.43.146.7771: UDP, length 120
22:02:53.652465 IP 192.168.43.124.8880 > 192.168.43.146.7771: UDP, length 120
22:02:53.659265 IP 192.168.43.147.8880 > 192.168.43.124.7773: UDP, length 120
22:02:53.693658 IP 192.168.43.147.8880 > 192.168.43.124.7773: UDP, length 120
22:02:53.702464 IP 192.168.43.124.8880 > 192.168.43.146.7771: UDP, length 120
22:02:53.741204 IP 192.168.43.147.8880 > 192.168.43.124.7773: UDP, length 120
22:02:53.752464 IP 192.168.43.124.8880 > 192.168.43.146.7771: UDP, length 120
22:02:53.802515 IP 192.168.43.124.8880 > 192.168.43.146.7771: UDP, length 120
22:02:53.806354 IP 192.168.43.147.8880 > 192.168.43.124.7773: UDP, length 120
22:02:53.846886 IP 192.168.43.147.8880 > 192.168.43.124.7773: UDP, length 120
22:02:53.852467 IP 192.168.43.124.8880 > 192.168.43.146.7771: UDP, length 120
22:02:53.902466 IP 192.168.43.124.8880 > 192.168.43.146.7771: UDP, length 120
22:02:53.952466 IP 192.168.43.124.8880 > 192.168.43.146.7771: UDP, length 120
22:02:53.955376 IP 192.168.43.147.8880 > 192.168.43.124.7773: UDP, length 120
22:02:53.958713 IP 192.168.43.147.8880 > 192.168.43.124.7773: UDP, length 120
22:02:53.993792 IP 192.168.43.147.8880 > 192.168.43.124.7773: UDP, length 120
22:02:54.002467 IP 192.168.43.124.8880 > 192.168.43.146.7771: UDP, length 120
22:02:54.045870 IP 192.168.43.147.8880 > 192.168.43.124.7773: UDP, length 120
22:02:54.052469 IP 192.168.43.124.8880 > 192.168.43.146.7771: UDP, length 120
22:02:54.102468 IP 192.168.43.124.8880 > 192.168.43.146.7771: UDP, length 120
22:02:54.104486 IP 192.168.43.147.8880 > 192.168.43.124.7773: UDP, length 120
22:02:54.144623 IP 192.168.43.147.8880 > 192.168.43.124.7773: UDP, length 120
22:02:54.152513 IP 192.168.43.124.8880 > 192.168.43.146.7771: UDP, length 120
22:02:54.195719 IP 192.168.43.147.8880 > 192.168.43.124.7773: UDP, length 120
22:02:54.202516 IP 192.168.43.124.8880 > 192.168.43.146.7771: UDP, length 120
22:02:54.252513 IP 192.168.43.124.8880 > 192.168.43.146.7771: UDP, length 120
22:02:54.253421 IP 192.168.43.147.8880 > 192.168.43.124.7773: UDP, length 120
22:02:54.297532 IP 192.168.43.147.8880 > 192.168.43.124.7773: UDP, length 120
22:02:54.302514 IP 192.168.43.124.8880 > 192.168.43.146.7771: UDP, length 120
22:02:54.352517 IP 192.168.43.124.8880 > 192.168.43.146.7771: UDP, length 120
22:02:54.353430 IP 192.168.43.147.8880 > 192.168.43.124.7773: UDP, length 120
22:02:54.394245 IP 192.168.43.147.8880 > 192.168.43.124.7773: UDP, length 120
22:02:54.402513 IP 192.168.43.124.8880 > 192.168.43.146.7771: UDP, length 120
22:02:54.445096 IP 192.168.43.147.8880 > 192.168.43.124.7773: UDP, length 120
22:02:54.452516 IP 192.168.43.124.8880 > 192.168.43.146.7771: UDP, length 120
22:02:54.502514 IP 192.168.43.124.8880 > 192.168.43.146.7771: UDP, length 120
22:02:54.518971 IP 192.168.43.147.8880 > 192.168.43.124.7773: UDP, length 120
22:02:54.547223 IP 192.168.43.147.8880 > 192.168.43.124.7773: UDP, length 120
22:02:54.552514 IP 192.168.43.124.8880 > 192.168.43.146.7771: UDP, length 120
22:02:54.602509 IP 192.168.43.124.8880 > 192.168.43.146.7771: UDP, length 120
22:02:54.610654 IP 192.168.43.147.8880 > 192.168.43.124.7773: UDP, length 120
22:02:54.649515 IP 192.168.43.147.8880 > 192.168.43.124.7773: UDP, length 120
22:02:54.652424 IP 192.168.43.124.8880 > 192.168.43.146.7771: UDP, length 120
22:02:54.702464 IP 192.168.43.124.8880 > 192.168.43.146.7771: UDP, length 120
22:02:54.703857 IP 192.168.43.147.8880 > 192.168.43.124.7773: UDP, length 120
22:02:54.744195 IP 192.168.43.147.8880 > 192.168.43.124.7773: UDP, length 120
22:02:54.752464 IP 192.168.43.124.8880 > 192.168.43.146.7771: UDP, length 120
22:02:54.791359 IP 192.168.43.147.8880 > 192.168.43.124.7773: UDP, length 120
22:02:54.802463 IP 192.168.43.124.8880 > 192.168.43.146.7771: UDP, length 120
22:02:54.852463 IP 192.168.43.124.8880 > 192.168.43.146.7771: UDP, length 120
22:02:54.855466 IP 192.168.43.147.8880 > 192.168.43.124.7773: UDP, length 120
22:02:54.893727 IP 192.168.43.147.8880 > 192.168.43.124.7773: UDP, length 120
22:02:54.902463 IP 192.168.43.124.8880 > 192.168.43.146.7771: UDP, length 120
22:02:54.945533 IP 192.168.43.147.8880 > 192.168.43.124.7773: UDP, length 120
22:02:54.952447 IP 192.168.43.124.8880 > 192.168.43.146.7771: UDP, length 120
22:02:55.002389 IP 192.168.43.124.8880 > 192.168.43.146.7771: UDP, length 120
22:02:55.005768 IP 192.168.43.147.8880 > 192.168.43.124.7773: UDP, length 120
22:02:55.044010 IP 192.168.43.147.8880 > 192.168.43.124.7773: UDP, length 120
22:02:55.052389 IP 192.168.43.124.8880 > 192.168.43.146.7771: UDP, length 120
22:02:55.092575 IP 192.168.43.147.8880 > 192.168.43.124.7773: UDP, length 120
22:02:55.102464 IP 192.168.43.124.8880 > 192.168.43.146.7771: UDP, length 120
22:02:55.152464 IP 192.168.43.124.8880 > 192.168.43.146.7771: UDP, length 120
22:02:55.153167 IP 192.168.43.147.8880 > 192.168.43.124.7773: UDP, length 120
22:02:55.195388 IP 192.168.43.147.8880 > 192.168.43.124.7773: UDP, length 120
22:02:55.202464 IP 192.168.43.124.8880 > 192.168.43.146.7771: UDP, length 120
22:02:55.240612 IP 192.168.43.147.8880 > 192.168.43.124.7773: UDP, length 120
22:02:55.252466 IP 192.168.43.124.8880 > 192.168.43.146.7771: UDP, length 120
22:02:55.302463 IP 192.168.43.124.8880 > 192.168.43.146.7771: UDP, length 120
22:02:55.307029 IP 192.168.43.147.8880 > 192.168.43.124.7773: UDP, length 120
22:02:55.343944 IP 192.168.43.147.8880 > 192.168.43.124.7773: UDP, length 120
22:02:55.352465 IP 192.168.43.124.8880 > 192.168.43.146.7771: UDP, length 120
22:02:55.392591 IP 192.168.43.147.8880 > 192.168.43.124.7773: UDP, length 120
22:02:55.402464 IP 192.168.43.124.8880 > 192.168.43.146.7771: UDP, length 120
22:02:55.452464 IP 192.168.43.124.8880 > 192.168.43.146.7771: UDP, length 120
22:02:55.452951 IP 192.168.43.147.8880 > 192.168.43.124.7773: UDP, length 120
22:02:55.494804 IP 192.168.43.147.8880 > 192.168.43.124.7773: UDP, length 120
22:02:55.502465 IP 192.168.43.124.8880 > 192.168.43.146.7771: UDP, length 120
22:02:55.540560 IP 192.168.43.147.8880 > 192.168.43.124.7773: UDP, length 120
22:02:55.552464 IP 192.168.43.124.8880 > 192.168.43.146.7771: UDP, length 120
22:02:55.602461 IP 192.168.43.124.8880 > 192.168.43.146.7771: UDP, length 120
22:02:55.604630 IP 192.168.43.147.8880 > 192.168.43.124.7773: UDP, length 120
22:02:55.644045 IP 192.168.43.147.8880 > 192.168.43.124.7773: UDP, length 120
22:02:55.652465 IP 192.168.43.124.8880 > 192.168.43.146.7771: UDP, length 120
22:02:55.690959 IP 192.168.43.147.8880 > 192.168.43.124.7773: UDP, length 120
22:02:55.702464 IP 192.168.43.124.8880 > 192.168.43.146.7771: UDP, length 120
22:02:55.752465 IP 192.168.43.124.8880 > 192.168.43.146.7771: UDP, length 120
22:02:55.754528 IP 192.168.43.147.8880 > 192.168.43.124.7773: UDP, length 120
22:02:55.795537 IP 192.168.43.147.8880 > 192.168.43.124.7773: UDP, length 120
22:02:55.802463 IP 192.168.43.124.8880 > 192.168.43.146.7771: UDP, length 120
22:02:55.848938 IP 192.168.43.147.8880 > 192.168.43.124.7773: UDP, length 120
22:02:55.852465 IP 192.168.43.124.8880 > 192.168.43.146.7771: UDP, length 120
22:02:55.902467 IP 192.168.43.124.8880 > 192.168.43.146.7771: UDP, length 120
22:02:55.911627 IP 192.168.43.147.8880 > 192.168.43.124.7773: UDP, length 120
22:02:55.943452 IP 192.168.43.147.8880 > 192.168.43.124.7773: UDP, length 120
22:02:55.952466 IP 192.168.43.124.8880 > 192.168.43.146.7771: UDP, length 120
22:02:55.993006 IP 192.168.43.147.8880 > 192.168.43.124.7773: UDP, length 120
22:02:56.002468 IP 192.168.43.124.8880 > 192.168.43.146.7771: UDP, length 120
22:02:56.052469 IP 192.168.43.124.8880 > 192.168.43.146.7771: UDP, length 120
22:02:56.053860 IP 192.168.43.147.8880 > 192.168.43.124.7773: UDP, length 120
22:02:56.095508 IP 192.168.43.147.8880 > 192.168.43.124.7773: UDP, length 120
22:02:56.102466 IP 192.168.43.124.8880 > 192.168.43.146.7771: UDP, length 120
22:02:56.141910 IP 192.168.43.147.8880 > 192.168.43.124.7773: UDP, length 120
22:02:56.152512 IP 192.168.43.124.8880 > 192.168.43.146.7771: UDP, length 120
22:02:56.202514 IP 192.168.43.124.8880 > 192.168.43.146.7771: UDP, length 120
22:02:56.203768 IP 192.168.43.147.8880 > 192.168.43.124.7773: UDP, length 120
22:02:56.244078 IP 192.168.43.147.8880 > 192.168.43.124.7773: UDP, length 120
22:02:56.252514 IP 192.168.43.124.8880 > 192.168.43.146.7771: UDP, length 120
22:02:56.291991 IP 192.168.43.147.8880 > 192.168.43.124.7773: UDP, length 120
22:02:56.302516 IP 192.168.43.124.8880 > 192.168.43.146.7771: UDP, length 120
22:02:56.352515 IP 192.168.43.124.8880 > 192.168.43.146.7771: UDP, length 120
22:02:56.356923 IP 192.168.43.147.8880 > 192.168.43.124.7773: UDP, length 120
22:02:56.402514 IP 192.168.43.124.8880 > 192.168.43.146.7771: UDP, length 120
22:02:56.427310 IP 192.168.43.147.8880 > 192.168.43.124.7773: UDP, length 120
22:02:56.443022 IP 192.168.43.147.8880 > 192.168.43.124.7773: UDP, length 120
22:02:56.452516 IP 192.168.43.124.8880 > 192.168.43.146.7771: UDP, length 120
22:02:56.496160 IP 192.168.43.147.8880 > 192.168.43.124.7773: UDP, length 120
22:02:56.502516 IP 192.168.43.124.8880 > 192.168.43.146.7771: UDP, length 120
22:02:56.552513 IP 192.168.43.124.8880 > 192.168.43.146.7771: UDP, length 120
22:02:56.566485 IP 192.168.43.147.8880 > 192.168.43.124.7773: UDP, length 120
22:02:56.594608 IP 192.168.43.147.8880 > 192.168.43.124.7773: UDP, length 120
22:02:56.602433 IP 192.168.43.124.8880 > 192.168.43.146.7771: UDP, length 120
22:02:56.652465 IP 192.168.43.124.8880 > 192.168.43.146.7771: UDP, length 120
22:02:56.656398 IP 192.168.43.147.8880 > 192.168.43.124.7773: UDP, length 120
22:02:56.697785 IP 192.168.43.147.8880 > 192.168.43.124.7773: UDP, length 120
22:02:56.702462 IP 192.168.43.124.8880 > 192.168.43.146.7771: UDP, length 120
22:02:56.742140 IP 192.168.43.147.8880 > 192.168.43.124.7773: UDP, length 120
22:02:56.752463 IP 192.168.43.124.8880 > 192.168.43.146.7771: UDP, length 120
22:02:56.802464 IP 192.168.43.124.8880 > 192.168.43.146.7771: UDP, length 120
22:02:56.810320 IP 192.168.43.147.8880 > 192.168.43.124.7773: UDP, length 120
22:02:56.840969 IP 192.168.43.147.8880 > 192.168.43.124.7773: UDP, length 120
22:02:56.852427 IP 192.168.43.124.8880 > 192.168.43.146.7771: UDP, length 120
22:02:56.902464 IP 192.168.43.124.8880 > 192.168.43.146.7771: UDP, length 120
22:02:56.903170 IP 192.168.43.147.8880 > 192.168.43.124.7773: UDP, length 120
22:02:56.943582 IP 192.168.43.147.8880 > 192.168.43.124.7773: UDP, length 120
22:02:56.952465 IP 192.168.43.124.8880 > 192.168.43.146.7771: UDP, length 120
22:02:56.990533 IP 192.168.43.147.8880 > 192.168.43.124.7773: UDP, length 120
22:02:57.002461 IP 192.168.43.124.8880 > 192.168.43.146.7771: UDP, length 120
22:02:57.052462 IP 192.168.43.124.8880 > 192.168.43.146.7771: UDP, length 120
22:02:57.054761 IP 192.168.43.147.8880 > 192.168.43.124.7773: UDP, length 120
22:02:57.093677 IP 192.168.43.147.8880 > 192.168.43.124.7773: UDP, length 120
22:02:57.102465 IP 192.168.43.124.8880 > 192.168.43.146.7771: UDP, length 120
22:02:57.143014 IP 192.168.43.147.8880 > 192.168.43.124.7773: UDP, length 120
22:02:57.152464 IP 192.168.43.124.8880 > 192.168.43.146.7771: UDP, length 120
22:02:57.202462 IP 192.168.43.124.8880 > 192.168.43.146.7771: UDP, length 120
