02:33:34.236904 IP 192.168.43.146.8880 > 192.168.43.147.7772: UDP, length 120
02:33:34.240658 IP 192.168.43.147.8880 > 192.168.43.124.7773: UDP, length 120
02:33:34.278903 IP 192.168.43.146.8880 > 192.168.43.147.7772: UDP, length 120
02:33:34.290703 IP 192.168.43.147.8880 > 192.168.43.124.7773: UDP, length 120
02:33:34.332886 IP 192.168.43.146.8880 > 192.168.43.147.7772: UDP, length 120
02:33:34.340699 IP 192.168.43.147.8880 > 192.168.43.124.7773: UDP, length 120
02:33:34.390684 IP 192.168.43.147.8880 > 192.168.43.124.7773: UDP, length 120
02:33:34.398073 IP 192.168.43.146.8880 > 192.168.43.147.7772: UDP, length 120
02:33:34.432664 IP 192.168.43.146.8880 > 192.168.43.147.7772: UDP, length 120
02:33:34.440685 IP 192.168.43.147.8880 > 192.168.43.124.7773: UDP, length 120
02:33:34.486012 IP 192.168.43.146.8880 > 192.168.43.147.7772: UDP, length 120
02:33:34.490683 IP 192.168.43.147.8880 > 192.168.43.124.7773: UDP, length 120
02:33:34.534620 IP 192.168.43.146.8880 > 192.168.43.147.7772: UDP, length 120
02:33:34.540683 IP 192.168.43.147.8880 > 192.168.43.124.7773: UDP, length 120
02:33:34.590684 IP 192.168.43.147.8880 > 192.168.43.124.7773: UDP, length 120
02:33:34.598326 IP 192.168.43.146.8880 > 192.168.43.147.7772: UDP, length 120
02:33:34.634376 IP 192.168.43.146.8880 > 192.168.43.147.7772: UDP, length 120
02:33:34.640684 IP 192.168.43.147.8880 > 192.168.43.124.7773: UDP, length 120
02:33:34.682135 IP 192.168.43.146.8880 > 192.168.43.147.7772: UDP, length 120
02:33:34.690683 IP 192.168.43.147.8880 > 192.168.43.124.7773: UDP, length 120
02:33:34.739599 IP 192.168.43.146.8880 > 192.168.43.147.7772: UDP, length 120
02:33:34.740683 IP 192.168.43.147.8880 > 192.168.43.124.7773: UDP, length 120
02:33:34.790684 IP 192.168.43.147.8880 > 192.168.43.124.7773: UDP, length 120
02:33:34.795738 IP 192.168.43.146.8880 > 192.168.43.147.7772: UDP, length 120
02:33:34.840442 IP 192.168.43.146.8880 > 192.168.43.147.7772: UDP, length 120
02:33:34.840682 IP 192.168.43.147.8880 > 192.168.43.124.7773: UDP, length 120
02:33:34.890686 IP 192.168.43.147.8880 > 192.168.43.124.7773: UDP, length 120
02:33:34.893172 IP 192.168.43.146.8880 > 192.168.43.147.7772: UDP, length 120
02:33:34.940684 IP 192.168.43.147.8880 > 192.168.43.124.7773: UDP, length 120
02:33:34.944309 IP 192.168.43.146.8880 > 192.168.43.147.7772: UDP, length 120
02:33:34.990720 IP 192.168.43.147.8880 > 192.168.43.124.7773: UDP, length 120
02:33:35.040689 IP 192.168.43.147.8880 > 192.168.43.124.7773: UDP, length 120
02:33:35.055323 IP 192.168.43.146.8880 > 192.168.43.147.7772: UDP, length 120
02:33:35.056691 IP 192.168.43.146.8880 > 192.168.43.147.7772: UDP, length 120
02:33:35.089436 IP 192.168.43.146.8880 > 192.168.43.147.7772: UDP, length 120
02:33:35.090689 IP 192.168.43.147.8880 > 192.168.43.124.7773: UDP, length 120
02:33:35.138072 IP 192.168.43.146.8880 > 192.168.43.147.7772: UDP, length 120
02:33:35.140685 IP 192.168.43.147.8880 > 192.168.43.124.7773: UDP, length 120
02:33:35.190684 IP 192.168.43.147.8880 > 192.168.43.124.7773: UDP, length 120
02:33:35.193938 IP 192.168.43.146.8880 > 192.168.43.147.7772: UDP, length 120
02:33:35.234788 IP 192.168.43.146.8880 > 192.168.43.147.7772: UDP, length 120
02:33:35.240685 IP 192.168.43.147.8880 > 192.168.43.124.7773: UDP, length 120
02:33:35.283004 IP 192.168.43.146.8880 > 192.168.43.147.7772: UDP, length 120
02:33:35.290684 IP 192.168.43.147.8880 > 192.168.43.124.7773: UDP, length 120
02:33:35.340688 IP 192.168.43.147.8880 > 192.168.43.124.7773: UDP, length 120
02:33:35.343961 IP 192.168.43.146.8880 > 192.168.43.147.7772: UDP, length 120
02:33:35.378715 IP 192.168.43.146.8880 > 192.168.43.147.7772: UDP, length 120
02:33:35.390686 IP 192.168.43.147.8880 > 192.168.43.124.7773: UDP, length 120
02:33:35.429547 IP 192.168.43.146.8880 > 192.168.43.147.7772: UDP, length 120
02:33:35.440685 IP 192.168.43.147.8880 > 192.168.43.124.7773: UDP, length 120
02:33:35.481282 IP 192.168.43.146.8880 > 192.168.43.147.7772: UDP, length 120
02:33:35.490684 IP 192.168.43.147.8880 > 192.168.43.124.7773: UDP, length 120
02:33:35.532451 IP 192.168.43.146.8880 > 192.168.43.147.7772: UDP, length 120
02:33:35.540685 IP 192.168.43.147.8880 > 192.168.43.124.7773: UDP, length 120
02:33:35.585236 IP 192.168.43.146.8880 > 192.168.43.147.7772: UDP, length 120
02:33:35.590683 IP 192.168.43.147.8880 > 192.168.43.124.7773: UDP, length 120
02:33:35.640685 IP 192.168.43.147.8880 > 192.168.43.124.7773: UDP, length 120
02:33:35.642406 IP 192.168.43.146.8880 > 192.168.43.147.7772: UDP, length 120
02:33:35.678922 IP 192.168.43.146.8880 > 192.168.43.147.7772: UDP, length 120
02:33:35.690685 IP 192.168.43.147.8880 > 192.168.43.124.7773: UDP, length 120
02:33:35.732024 IP 192.168.43.146.8880 > 192.168.43.147.7772: UDP, length 120
02:33:35.740684 IP 192.168.43.147.8880 > 192.168.43.124.7773: UDP, length 120
02:33:35.780523 IP 192.168.43.146.8880 > 192.168.43.147.7772: UDP, length 120
02:33:35.790684 IP 192.168.43.147.8880 > 192.168.43.124.7773: UDP, length 120
02:33:35.829170 IP 192.168.43.146.8880 > 192.168.43.147.7772: UDP, length 120
02:33:35.840685 IP 192.168.43.147.8880 > 192.168.43.124.7773: UDP, length 120
02:33:35.881940 IP 192.168.43.146.8880 > 192.168.43.147.7772: UDP, length 120
02:33:35.890685 IP 192.168.43.147.8880 > 192.168.43.124.7773: UDP, length 120
02:33:35.928868 IP 192.168.43.146.8880 > 192.168.43.147.7772: UDP, length 120
02:33:35.940685 IP 192.168.43.147.8880 > 192.168.43.124.7773: UDP, length 120
02:33:35.981588 IP 192.168.43.146.8880 > 192.168.43.147.7772: UDP, length 120
02:33:35.990684 IP 192.168.43.147.8880 > 192.168.43.124.7773: UDP, length 120
02:33:36.035815 IP 192.168.43.146.8880 > 192.168.43.147.7772: UDP, length 120
02:33:36.040683 IP 192.168.43.147.8880 > 192.168.43.124.7773: UDP, length 120
02:33:36.090691 IP 192.168.43.147.8880 > 192.168.43.124.7773: UDP, length 120
02:33:36.091805 IP 192.168.43.146.8880 > 192.168.43.147.7772: UDP, length 120
02:33:36.133405 IP 192.168.43.146.8880 > 192.168.43.147.7772: UDP, length 120
02:33:36.140688 IP 192.168.43.147.8880 > 192.168.43.124.7773: UDP, length 120
02:33:36.178822 IP 192.168.43.146.8880 > 192.168.43.147.7772: UDP, length 120
02:33:36.190687 IP 192.168.43.147.8880 > 192.168.43.124.7773: UDP, length 120
02:33:36.228056 IP 192.168.43.146.8880 > 192.168.43.147.7772: UDP, length 120
02:33:36.240683 IP 192.168.43.147.8880 > 192.168.43.124.7773: UDP, length 120
02:33:36.281749 IP 192.168.43.146.8880 > 192.168.43.147.7772: UDP, length 120
02:33:36.290685 IP 192.168.43.147.8880 > 192.168.43.124.7773: UDP, length 120
02:33:36.329044 IP 192.168.43.146.8880 > 192.168.43.147.7772: UDP, length 120
02:33:36.340686 IP 192.168.43.147.8880 > 192.168.43.124.7773: UDP, length 120
02:33:36.378963 IP 192.168.43.146.8880 > 192.168.43.147.7772: UDP, length 120
02:33:36.390685 IP 192.168.43.147.8880 > 192.168.43.124.7773: UDP, length 120
02:33:36.428618 IP 192.168.43.146.8880 > 192.168.43.147.7772: UDP, length 120
02:33:36.440684 IP 192.168.43.147.8880 > 192.168.43.124.7773: UDP, length 120
02:33:36.482154 IP 192.168.43.146.8880 > 192.168.43.147.7772: UDP, length 120
02:33:36.490711 IP 192.168.43.147.8880 > 192.168.43.124.7773: UDP, length 120
02:33:36.534334 IP 192.168.43.146.8880 > 192.168.43.147.7772: UDP, length 120
02:33:36.540686 IP 192.168.43.147.8880 > 192.168.43.124.7773: UDP, length 120
02:33:36.589476 IP 192.168.43.146.8880 > 192.168.43.147.7772: UDP, length 120
02:33:36.590684 IP 192.168.43.147.8880 > 192.168.43.124.7773: UDP, length 120
02:33:36.640683 IP 192.168.43.147.8880 > 192.168.43.124.7773: UDP, length 120
02:33:36.644563 IP 192.168.43.146.8880 > 192.168.43.147.7772: UDP, length 120
02:33:36.684459 IP 192.168.43.146.8880 > 192.168.43.147.7772: UDP, length 120
02:33:36.690685 IP 192.168.43.147.8880 > 192.168.43.124.7773: UDP, length 120
02:33:36.728869 IP 192.168.43.146.8880 > 192.168.43.147.7772: UDP, length 120
02:33:36.740684 IP 192.168.43.147.8880 > 192.168.43.124.7773: UDP, length 120
02:33:36.779262 IP 192.168.43.146.8880 > 192.168.43.147.7772: UDP, length 120
02:33:36.790683 IP 192.168.43.147.8880 > 192.168.43.124.7773: UDP, length 120
02:33:36.831257 IP 192.168.43.146.8880 > 192.168.43.147.7772: UDP, length 120
02:33:36.840684 IP 192.168.43.147.8880 > 192.168.43.124.7773: UDP, length 120
02:33:36.880412 IP 192.168.43.146.8880 > 192.168.43.147.7772: UDP, length 120
02:33:36.890710 IP 192.168.43.147.8880 > 192.168.43.124.7773: UDP, length 120
02:33:36.940709 IP 192.168.43.147.8880 > 192.168.43.124.7773: UDP, length 120
02:33:36.949617 IP 192.168.43.146.8880 > 192.168.43.147.7772: UDP, length 120
02:33:36.985621 IP 192.168.43.146.8880 > 192.168.43.147.7772: UDP, length 120
02:33:36.990710 IP 192.168.43.147.8880 > 192.168.43.124.7773: UDP, length 120
02:33:37.040708 IP 192.168.43.147.8880 > 192.168.43.124.7773: UDP, length 120
02:33:37.044119 IP 192.168.43.146.8880 > 192.168.43.147.7772: UDP, length 120
02:33:37.090710 IP 192.168.43.147.8880 > 192.168.43.124.7773: UDP, length 120
02:33:37.094103 IP 192.168.43.146.8880 > 192.168.43.147.7772: UDP, length 120
02:33:37.134356 IP 192.168.43.146.8880 > 192.168.43.147.7772: UDP, length 120
02:33:37.140718 IP 192.168.43.147.8880 > 192.168.43.124.7773: UDP, length 120
02:33:37.183642 IP 192.168.43.146.8880 > 192.168.43.147.7772: UDP, length 120
02:33:37.190717 IP 192.168.43.147.8880 > 192.168.43.124.7773: UDP, length 120
02:33:37.240694 IP 192.168.43.146.8880 > 192.168.43.147.7772: UDP, length 120
02:33:37.240709 IP 192.168.43.147.8880 > 192.168.43.124.7773: UDP, length 120
02:33:37.285421 IP 192.168.43.146.8880 > 192.168.43.147.7772: UDP, length 120
02:33:37.290711 IP 192.168.43.147.8880 > 192.168.43.124.7773: UDP, length 120
02:33:37.332807 IP 192.168.43.146.8880 > 192.168.43.147.7772: UDP, length 120
02:33:37.340714 IP 192.168.43.147.8880 > 192.168.43.124.7773: UDP, length 120
02:33:37.385795 IP 192.168.43.146.8880 > 192.168.43.147.7772: UDP, length 120
02:33:37.390711 IP 192.168.43.147.8880 > 192.168.43.124.7773: UDP, length 120
02:33:37.429316 IP 192.168.43.146.8880 > 192.168.43.147.7772: UDP, length 120
02:33:37.440709 IP 192.168.43.147.8880 > 192.168.43.124.7773: UDP, length 120
02:33:37.479161 IP 192.168.43.146.8880 > 192.168.43.147.7772: UDP, length 120
02:33:37.490708 IP 192.168.43.147.8880 > 192.168.43.124.7773: UDP, length 120
02:33:37.531894 IP 192.168.43.146.8880 > 192.168.43.147.7772: UDP, length 120
02:33:37.540709 IP 192.168.43.147.8880 > 192.168.43.124.7773: UDP, length 120
02:33:37.590708 IP 192.168.43.147.8880 > 192.168.43.124.7773: UDP, length 120
02:33:37.597290 IP 192.168.43.146.8880 > 192.168.43.147.7772: UDP, length 120
02:33:37.630134 IP 192.168.43.146.8880 > 192.168.43.147.7772: UDP, length 120
02:33:37.640708 IP 192.168.43.147.8880 > 192.168.43.124.7773: UDP, length 120
02:33:37.690779 IP 192.168.43.147.8880 > 192.168.43.124.7773: UDP, length 120
02:33:37.712441 IP 192.168.43.146.8880 > 192.168.43.147.7772: UDP, length 120
02:33:37.740798 IP 192.168.43.147.8880 > 192.168.43.124.7773: UDP, length 120
02:33:37.751817 IP 192.168.43.146.8880 > 192.168.43.147.7772: UDP, length 120
02:33:37.789181 IP 192.168.43.146.8880 > 192.168.43.147.7772: UDP, length 120
02:33:37.790791 IP 192.168.43.147.8880 > 192.168.43.124.7773: UDP, length 120
02:33:37.840749 IP 192.168.43.147.8880 > 192.168.43.124.7773: UDP, length 120
02:33:37.848675 IP 192.168.43.146.8880 > 192.168.43.147.7772: UDP, length 120
02:33:37.890799 IP 192.168.43.147.8880 > 192.168.43.124.7773: UDP, length 120
02:33:37.903999 IP 192.168.43.146.8880 > 192.168.43.147.7772: UDP, length 120
02:33:37.934222 IP 192.168.43.146.8880 > 192.168.43.147.7772: UDP, length 120
02:33:37.940757 IP 192.168.43.147.8880 > 192.168.43.124.7773: UDP, length 120
02:33:37.990766 IP 192.168.43.147.8880 > 192.168.43.124.7773: UDP, length 120
02:33:37.998947 IP 192.168.43.146.8880 > 192.168.43.147.7772: UDP, length 120
02:33:38.039719 IP 192.168.43.146.8880 > 192.168.43.147.7772: UDP, length 120
02:33:38.040755 IP 192.168.43.147.8880 > 192.168.43.124.7773: UDP, length 120
02:33:38.090760 IP 192.168.43.147.8880 > 192.168.43.124.7773: UDP, length 120
02:33:38.112105 IP 192.168.43.146.8880 > 192.168.43.147.7772: UDP, length 120
02:33:38.131710 IP 192.168.43.146.8880 > 192.168.43.147.7772: UDP, length 120
02:33:38.140738 IP 192.168.43.147.8880 > 192.168.43.124.7773: UDP, length 120
02:33:38.190704 IP 192.168.43.147.8880 > 192.168.43.124.7773: UDP, length 120
02:33:38.205545 IP 192.168.43.146.8880 > 192.168.43.147.7772: UDP, length 120
02:33:38.240696 IP 192.168.43.147.8880 > 192.168.43.124.7773: UDP, length 120
02:33:38.243942 IP 192.168.43.146.8880 > 192.168.43.147.7772: UDP, length 120
02:33:38.290690 IP 192.168.43.147.8880 > 192.168.43.124.7773: UDP, length 120
02:33:38.324522 IP 192.168.43.146.8880 > 192.168.43.147.7772: UDP, length 120
02:33:38.329371 IP 192.168.43.146.8880 > 192.168.43.147.7772: UDP, length 120
02:33:38.340692 IP 192.168.43.147.8880 > 192.168.43.124.7773: UDP, length 120
02:33:38.385843 IP 192.168.43.146.8880 > 192.168.43.147.7772: UDP, length 120
02:33:38.390724 IP 192.168.43.147.8880 > 192.168.43.124.7773: UDP, length 120
02:33:38.437026 IP 192.168.43.146.8880 > 192.168.43.147.7772: UDP, length 120
02:33:38.440686 IP 192.168.43.147.8880 > 192.168.43.124.7773: UDP, length 120
02:33:38.490684 IP 192.168.43.147.8880 > 192.168.43.124.7773: UDP, length 120
02:33:38.525095 IP 192.168.43.146.8880 > 192.168.43.147.7772: UDP, length 120
02:33:38.531153 IP 192.168.43.146.8880 > 192.168.43.147.7772: UDP, length 120
02:33:38.540685 IP 192.168.43.147.8880 > 192.168.43.124.7773: UDP, length 120
02:33:38.590684 IP 192.168.43.147.8880 > 192.168.43.124.7773: UDP, length 120
02:33:38.593861 IP 192.168.43.146.8880 > 192.168.43.147.7772: UDP, length 120
02:33:38.632985 IP 192.168.43.146.8880 > 192.168.43.147.7772: UDP, length 120
02:33:38.640687 IP 192.168.43.147.8880 > 192.168.43.124.7773: UDP, length 120
02:33:38.681194 IP 192.168.43.146.8880 > 192.168.43.147.7772: UDP, length 120
02:33:38.690684 IP 192.168.43.147.8880 > 192.168.43.124.7773: UDP, length 120
02:33:38.739466 IP 192.168.43.146.8880 > 192.168.43.147.7772: UDP, length 120
02:33:38.740684 IP 192.168.43.147.8880 > 192.168.43.124.7773: UDP, length 120
02:33:38.790684 IP 192.168.43.147.8880 > 192.168.43.124.7773: UDP, length 120
02:33:38.805039 IP 192.168.43.146.8880 > 192.168.43.147.7772: UDP, length 120
02:33:38.834557 IP 192.168.43.146.8880 > 192.168.43.147.7772: UDP, length 120
02:33:38.840686 IP 192.168.43.147.8880 > 192.168.43.124.7773: UDP, length 120
02:33:38.890686 IP 192.168.43.147.8880 > 192.168.43.124.7773: UDP, length 120
02:33:38.899969 IP 192.168.43.146.8880 > 192.168.43.147.7772: UDP, length 120
02:33:38.934609 IP 192.168.43.146.8880 > 192.168.43.147.7772: UDP, length 120
02:33:38.940685 IP 192.168.43.147.8880 > 192.168.43.124.7773: UDP, length 120
02:33:38.990684 IP 192.168.43.147.8880 > 192.168.43.124.7773: UDP, length 120
02:33:38.993586 IP 192.168.43.146.8880 > 192.168.43.147.7772: UDP, length 120
02:33:39.037938 IP 192.168.43.146.8880 > 192.168.43.147.7772: UDP, length 120
02:33:39.040684 IP 192.168.43.147.8880 > 192.168.43.124.7773: UDP, length 120
02:33:39.086807 IP 192.168.43.146.8880 > 192.168.43.147.7772: UDP, length 120
02:33:39.090686 IP 192.168.43.147.8880 > 192.168.43.124.7773: UDP, length 120
02:33:39.139044 IP 192.168.43.146.8880 > 192.168.43.147.7772: UDP, length 120
02:33:39.140683 IP 192.168.43.147.8880 > 192.168.43.124.7773: UDP, length 120
02:33:39.182096 IP 192.168.43.146.8880 > 192.168.43.147.7772: UDP, length 120
02:33:39.190685 IP 192.168.43.147.8880 > 192.168.43.124.7773: UDP, length 120
02:33:39.240687 IP 192.168.43.147.8880 > 192.168.43.124.7773: UDP, length 120
02:33:39.252769 IP 192.168.43.146.8880 > 192.168.43.147.7772: UDP, length 120
02:33:39.287089 IP 192.168.43.146.8880 > 192.168.43.147.7772: UDP, length 120
02:33:39.290688 IP 192.168.43.147.8880 > 192.168.43.124.7773: UDP, length 120
02:33:39.340685 IP 192.168.43.147.8880 > 192.168.43.124.7773: UDP, length 120
02:33:39.345651 IP 192.168.43.146.8880 > 192.168.43.147.7772: UDP, length 120
02:33:39.390687 IP 192.168.43.147.8880 > 192.168.43.124.7773: UDP, length 120
02:33:39.398355 IP 192.168.43.146.8880 > 192.168.43.147.7772: UDP, length 120
02:33:39.438936 IP 192.168.43.146.8880 > 192.168.43.147.7772: UDP, length 120
02:33:39.440682 IP 192.168.43.147.8880 > 192.168.43.124.7773: UDP, length 120
02:33:39.490714 IP 192.168.43.147.8880 > 192.168.43.124.7773: UDP, length 120
02:33:39.540247 IP 192.168.43.146.8880 > 192.168.43.147.7772: UDP, length 120
02:33:39.540689 IP 192.168.43.147.8880 > 192.168.43.124.7773: UDP, length 120
02:33:39.547877 IP 192.168.43.146.8880 > 192.168.43.147.7772: UDP, length 120
02:33:39.590685 IP 192.168.43.147.8880 > 192.168.43.124.7773: UDP, length 120
02:33:39.640684 IP 192.168.43.147.8880 > 192.168.43.124.7773: UDP, length 120
02:33:39.650963 IP 192.168.43.146.8880 > 192.168.43.147.7772: UDP, length 120
02:33:39.654135 IP 192.168.43.146.8880 > 192.168.43.147.7772: UDP, length 120
02:33:39.690683 IP 192.168.43.147.8880 > 192.168.43.124.7773: UDP, length 120
02:33:39.714727 IP 192.168.43.146.8880 > 192.168.43.147.7772: UDP, length 120
02:33:39.740683 IP 192.168.43.147.8880 > 192.168.43.124.7773: UDP, length 120
02:33:39.749405 IP 192.168.43.146.8880 > 192.168.43.147.7772: UDP, length 120
02:33:39.790684 IP 192.168.43.147.8880 > 192.168.43.124.7773: UDP, length 120
02:33:39.827320 IP 192.168.43.146.8880 > 192.168.43.147.7772: UDP, length 120
02:33:39.840754 IP 192.168.43.147.8880 > 192.168.43.124.7773: UDP, length 120
02:33:39.854663 IP 192.168.43.146.8880 > 192.168.43.147.7772: UDP, length 120
02:33:39.890721 IP 192.168.43.147.8880 > 192.168.43.124.7773: UDP, length 120
02:33:39.895560 IP 192.168.43.146.8880 > 192.168.43.147.7772: UDP, length 120
02:33:39.940708 IP 192.168.43.147.8880 > 192.168.43.124.7773: UDP, length 120
02:33:39.968798 IP 192.168.43.146.8880 > 192.168.43.147.7772: UDP, length 120
02:33:39.984020 IP 192.168.43.146.8880 > 192.168.43.147.7772: UDP, length 120
02:33:39.990736 IP 192.168.43.147.8880 > 192.168.43.124.7773: UDP, length 120
02:33:40.040740 IP 192.168.43.147.8880 > 192.168.43.124.7773: UDP, length 120
02:33:40.057390 IP 192.168.43.146.8880 > 192.168.43.147.7772: UDP, length 120
02:33:40.085659 IP 192.168.43.146.8880 > 192.168.43.147.7772: UDP, length 120
02:33:40.090741 IP 192.168.43.147.8880 > 192.168.43.124.7773: UDP, length 120
02:33:40.140746 IP 192.168.43.147.8880 > 192.168.43.124.7773: UDP, length 120
02:33:40.160089 IP 192.168.43.146.8880 > 192.168.43.147.7772: UDP, length 120
02:33:40.192530 IP 192.168.43.147.8880 > 192.168.43.124.7773: UDP, length 120
02:33:40.198599 IP 192.168.43.146.8880 > 192.168.43.147.7772: UDP, length 120
02:33:40.240703 IP 192.168.43.147.8880 > 192.168.43.124.7773: UDP, length 120
02:33:40.241830 IP 192.168.43.146.8880 > 192.168.43.147.7772: UDP, length 120
02:33:40.290722 IP 192.168.43.147.8880 > 192.168.43.124.7773: UDP, length 120
02:33:40.309239 IP 192.168.43.146.8880 > 192.168.43.147.7772: UDP, length 120
02:33:40.340740 IP 192.168.43.147.8880 > 192.168.43.124.7773: UDP, length 120
02:33:40.348601 IP 192.168.43.146.8880 > 192.168.43.147.7772: UDP, length 120
02:33:40.390743 IP 192.168.43.147.8880 > 192.168.43.124.7773: UDP, length 120
02:33:40.432602 IP 192.168.43.146.8880 > 192.168.43.147.7772: UDP, length 120
02:33:40.439053 IP 192.168.43.146.8880 > 192.168.43.147.7772: UDP, length 120
02:33:40.440732 IP 192.168.43.147.8880 > 192.168.43.124.7773: UDP, length 120
02:33:40.479340 IP 192.168.43.146.8880 > 192.168.43.147.7772: UDP, length 120
02:33:40.490715 IP 192.168.43.147.8880 > 192.168.43.124.7773: UDP, length 120
02:33:40.533591 IP 192.168.43.146.8880 > 192.168.43.147.7772: UDP, length 120
02:33:40.540707 IP 192.168.43.147.8880 > 192.168.43.124.7773: UDP, length 120
02:33:40.581808 IP 192.168.43.146.8880 > 192.168.43.147.7772: UDP, length 120
02:33:40.590707 IP 192.168.43.147.8880 > 192.168.43.124.7773: UDP, length 120
02:33:40.640709 IP 192.168.43.147.8880 > 192.168.43.124.7773: UDP, length 120
02:33:40.650738 IP 192.168.43.146.8880 > 192.168.43.147.7772: UDP, length 120
02:33:40.683123 IP 192.168.43.146.8880 > 192.168.43.147.7772: UDP, length 120
02:33:40.690714 IP 192.168.43.147.8880 > 192.168.43.124.7773: UDP, length 120
02:33:40.736156 IP 192.168.43.146.8880 > 192.168.43.147.7772: UDP, length 120
02:33:40.740706 IP 192.168.43.147.8880 > 192.168.43.124.7773: UDP, length 120
02:33:40.790706 IP 192.168.43.147.8880 > 192.168.43.124.7773: UDP, length 120
02:33:40.797733 IP 192.168.43.146.8880 > 192.168.43.147.7772: UDP, length 120
02:33:40.838472 IP 192.168.43.146.8880 > 192.168.43.147.7772: UDP, length 120
02:33:40.840708 IP 192.168.43.147.8880 > 192.168.43.124.7773: UDP, length 120
02:33:40.885533 IP 192.168.43.146.8880 > 192.168.43.147.7772: UDP, length 120
02:33:40.890707 IP 192.168.43.147.8880 > 192.168.43.124.7773: UDP, length 120
02:33:40.940703 IP 192.168.43.147.8880 > 192.168.43.124.7773: UDP, length 120
02:33:40.946251 IP 192.168.43.146.8880 > 192.168.43.147.7772: UDP, length 120
02:33:40.990719 IP 192.168.43.147.8880 > 192.168.43.124.7773: UDP, length 120
02:33:41.021679 IP 192.168.43.146.8880 > 192.168.43.147.7772: UDP, length 120
02:33:41.040711 IP 192.168.43.147.8880 > 192.168.43.124.7773: UDP, length 120
02:33:41.090706 IP 192.168.43.147.8880 > 192.168.43.124.7773: UDP, length 120
02:33:41.093936 IP 192.168.43.146.8880 > 192.168.43.147.7772: UDP, length 120
02:33:41.094032 IP 192.168.43.146.8880 > 192.168.43.147.7772: UDP, length 120
02:33:41.140709 IP 192.168.43.147.8880 > 192.168.43.124.7773: UDP, length 120
02:33:41.171966 IP 192.168.43.146.8880 > 192.168.43.147.7772: UDP, length 120
02:33:41.188958 IP 192.168.43.146.8880 > 192.168.43.147.7772: UDP, length 120
02:33:41.190710 IP 192.168.43.147.8880 > 192.168.43.124.7773: UDP, length 120
02:33:41.240708 IP 192.168.43.147.8880 > 192.168.43.124.7773: UDP, length 120
02:33:41.247025 IP 192.168.43.146.8880 > 192.168.43.147.7772: UDP, length 120
02:33:41.290081 IP 192.168.43.146.8880 > 192.168.43.147.7772: UDP, length 120
02:33:41.290710 IP 192.168.43.147.8880 > 192.168.43.124.7773: UDP, length 120
02:33:41.340710 IP 192.168.43.147.8880 > 192.168.43.124.7773: UDP, length 120
02:33:41.344586 IP 192.168.43.146.8880 > 192.168.43.147.7772: UDP, length 120
02:33:41.390713 IP 192.168.43.147.8880 > 192.168.43.124.7773: UDP, length 120
02:33:41.392179 IP 192.168.43.146.8880 > 192.168.43.147.7772: UDP, length 120
02:33:41.437334 IP 192.168.43.146.8880 > 192.168.43.147.7772: UDP, length 120
02:33:41.440714 IP 192.168.43.147.8880 > 192.168.43.124.7773: UDP, length 120
02:33:41.490704 IP 192.168.43.147.8880 > 192.168.43.124.7773: UDP, length 120
02:33:41.501120 IP 192.168.43.146.8880 > 192.168.43.147.7772: UDP, length 120
02:33:41.539554 IP 192.168.43.146.8880 > 192.168.43.147.7772: UDP, length 120
02:33:41.540713 IP 192.168.43.147.8880 > 192.168.43.124.7773: UDP, length 120
02:33:41.590710 IP 192.168.43.147.8880 > 192.168.43.124.7773: UDP, length 120
02:33:41.606341 IP 192.168.43.146.8880 > 192.168.43.147.7772: UDP, length 120
02:33:41.640712 IP 192.168.43.147.8880 > 192.168.43.124.7773: UDP, length 120
02:33:41.683554 IP 192.168.43.146.8880 > 192.168.43.147.7772: UDP, length 120
02:33:41.690711 IP 192.168.43.147.8880 > 192.168.43.124.7773: UDP, length 120
02:33:41.722229 IP 192.168.43.146.8880 > 192.168.43.147.7772: UDP, length 120
02:33:41.740709 IP 192.168.43.147.8880 > 192.168.43.124.7773: UDP, length 120
02:33:41.790707 IP 192.168.43.147.8880 > 192.168.43.124.7773: UDP, length 120
02:33:41.794386 IP 192.168.43.146.8880 > 192.168.43.147.7772: UDP, length 120
02:33:41.800185 IP 192.168.43.146.8880 > 192.168.43.147.7772: UDP, length 120
02:33:41.840711 IP 192.168.43.147.8880 > 192.168.43.124.7773: UDP, length 120
02:33:41.844238 IP 192.168.43.146.8880 > 192.168.43.147.7772: UDP, length 120
02:33:41.890744 IP 192.168.43.147.8880 > 192.168.43.124.7773: UDP, length 120
02:33:41.903281 IP 192.168.43.146.8880 > 192.168.43.147.7772: UDP, length 120
02:33:41.940739 IP 192.168.43.147.8880 > 192.168.43.124.7773: UDP, length 120
02:33:41.947816 IP 192.168.43.146.8880 > 192.168.43.147.7772: UDP, length 120
02:33:41.983582 IP 192.168.43.146.8880 > 192.168.43.147.7772: UDP, length 120
02:33:41.990739 IP 192.168.43.147.8880 > 192.168.43.124.7773: UDP, length 120
02:33:42.032746 IP 192.168.43.146.8880 > 192.168.43.147.7772: UDP, length 120
02:33:42.040737 IP 192.168.43.147.8880 > 192.168.43.124.7773: UDP, length 120
02:33:42.087654 IP 192.168.43.146.8880 > 192.168.43.147.7772: UDP, length 120
02:33:42.090779 IP 192.168.43.147.8880 > 192.168.43.124.7773: UDP, length 120
02:33:42.128913 IP 192.168.43.146.8880 > 192.168.43.147.7772: UDP, length 120
02:33:42.140765 IP 192.168.43.147.8880 > 192.168.43.124.7773: UDP, length 120
02:33:42.179622 IP 192.168.43.146.8880 > 192.168.43.147.7772: UDP, length 120
02:33:42.190731 IP 192.168.43.147.8880 > 192.168.43.124.7773: UDP, length 120
02:33:42.235324 IP 192.168.43.146.8880 > 192.168.43.147.7772: UDP, length 120
02:33:42.240727 IP 192.168.43.147.8880 > 192.168.43.124.7773: UDP, length 120
02:33:42.282078 IP 192.168.43.146.8880 > 192.168.43.147.7772: UDP, length 120
02:33:42.290726 IP 192.168.43.147.8880 > 192.168.43.124.7773: UDP, length 120
02:33:42.331995 IP 192.168.43.146.8880 > 192.168.43.147.7772: UDP, length 120
02:33:42.340727 IP 192.168.43.147.8880 > 192.168.43.124.7773: UDP, length 120
02:33:42.390721 IP 192.168.43.147.8880 > 192.168.43.124.7773: UDP, length 120
02:33:42.391984 IP 192.168.43.146.8880 > 192.168.43.147.7772: UDP, length 120
02:33:42.432421 IP 192.168.43.146.8880 > 192.168.43.147.7772: UDP, length 120
02:33:42.440723 IP 192.168.43.147.8880 > 192.168.43.124.7773: UDP, length 120
02:33:42.484109 IP 192.168.43.146.8880 > 192.168.43.147.7772: UDP, length 120
02:33:42.490757 IP 192.168.43.147.8880 > 192.168.43.124.7773: UDP, length 120
02:33:42.540710 IP 192.168.43.147.8880 > 192.168.43.124.7773: UDP, length 120
02:33:42.544114 IP 192.168.43.146.8880 > 192.168.43.147.7772: UDP, length 120
02:33:42.582342 IP 192.168.43.146.8880 > 192.168.43.147.7772: UDP, length 120
02:33:42.590766 IP 192.168.43.147.8880 > 192.168.43.124.7773: UDP, length 120
02:33:42.629499 IP 192.168.43.146.8880 > 192.168.43.147.7772: UDP, length 120
02:33:42.640744 IP 192.168.43.147.8880 > 192.168.43.124.7773: UDP, length 120
02:33:42.690709 IP 192.168.43.147.8880 > 192.168.43.124.7773: UDP, length 120
02:33:42.704077 IP 192.168.43.146.8880 > 192.168.43.147.7772: UDP, length 120
02:33:42.725988 IP 192.168.43.146.8880 > 192.168.43.147.7772: UDP, length 120
02:33:42.740708 IP 192.168.43.147.8880 > 192.168.43.124.7773: UDP, length 120
02:33:42.780665 IP 192.168.43.146.8880 > 192.168.43.147.7772: UDP, length 120
02:33:42.790748 IP 192.168.43.147.8880 > 192.168.43.124.7773: UDP, length 120
02:33:42.840725 IP 192.168.43.147.8880 > 192.168.43.124.7773: UDP, length 120
02:33:42.849235 IP 192.168.43.146.8880 > 192.168.43.147.7772: UDP, length 120
02:33:42.876028 IP 192.168.43.146.8880 > 192.168.43.147.7772: UDP, length 120
02:33:42.890754 IP 192.168.43.147.8880 > 192.168.43.124.7773: UDP, length 120
02:33:42.930268 IP 192.168.43.146.8880 > 192.168.43.147.7772: UDP, length 120
02:33:42.940727 IP 192.168.43.147.8880 > 192.168.43.124.7773: UDP, length 120
02:33:42.990689 IP 192.168.43.147.8880 > 192.168.43.124.7773: UDP, length 120
02:33:42.992201 IP 192.168.43.146.8880 > 192.168.43.147.7772: UDP, length 120
02:33:43.033110 IP 192.168.43.146.8880 > 192.168.43.147.7772: UDP, length 120
02:33:43.040689 IP 192.168.43.147.8880 > 192.168.43.124.7773: UDP, length 120
02:33:43.079185 IP 192.168.43.146.8880 > 192.168.43.147.7772: UDP, length 120
02:33:43.090686 IP 192.168.43.147.8880 > 192.168.43.124.7773: UDP, length 120
02:33:43.141008 IP 192.168.43.147.8880 > 192.168.43.124.7773: UDP, length 120
02:33:43.147443 IP 192.168.43.146.8880 > 192.168.43.147.7772: UDP, length 120
02:33:43.183814 IP 192.168.43.146.8880 > 192.168.43.147.7772: UDP, length 120
02:33:43.190795 IP 192.168.43.147.8880 > 192.168.43.124.7773: UDP, length 120
02:33:43.229015 IP 192.168.43.146.8880 > 192.168.43.147.7772: UDP, length 120
02:33:43.240754 IP 192.168.43.147.8880 > 192.168.43.124.7773: UDP, length 120
02:33:43.290710 IP 192.168.43.147.8880 > 192.168.43.124.7773: UDP, length 120
02:33:43.292568 IP 192.168.43.146.8880 > 192.168.43.147.7772: UDP, length 120
02:33:43.333126 IP 192.168.43.146.8880 > 192.168.43.147.7772: UDP, length 120
02:33:43.340695 IP 192.168.43.147.8880 > 192.168.43.124.7773: UDP, length 120
02:33:43.385455 IP 192.168.43.146.8880 > 192.168.43.147.7772: UDP, length 120
02:33:43.390689 IP 192.168.43.147.8880 > 192.168.43.124.7773: UDP, length 120
02:33:43.440686 IP 192.168.43.147.8880 > 192.168.43.124.7773: UDP, length 120
02:33:43.443933 IP 192.168.43.146.8880 > 192.168.43.147.7772: UDP, length 120
02:33:43.483128 IP 192.168.43.146.8880 > 192.168.43.147.7772: UDP, length 120
02:33:43.490692 IP 192.168.43.147.8880 > 192.168.43.124.7773: UDP, length 120
02:33:43.529421 IP 192.168.43.146.8880 > 192.168.43.147.7772: UDP, length 120
02:33:43.540685 IP 192.168.43.147.8880 > 192.168.43.124.7773: UDP, length 120
02:33:43.590683 IP 192.168.43.147.8880 > 192.168.43.124.7773: UDP, length 120
02:33:43.593924 IP 192.168.43.146.8880 > 192.168.43.147.7772: UDP, length 120
02:33:43.634401 IP 192.168.43.146.8880 > 192.168.43.147.7772: UDP, length 120
02:33:43.640684 IP 192.168.43.147.8880 > 192.168.43.124.7773: UDP, length 120
02:33:43.687645 IP 192.168.43.146.8880 > 192.168.43.147.7772: UDP, length 120
02:33:43.690685 IP 192.168.43.147.8880 > 192.168.43.124.7773: UDP, length 120
02:33:43.740684 IP 192.168.43.147.8880 > 192.168.43.124.7773: UDP, length 120
02:33:43.743923 IP 192.168.43.146.8880 > 192.168.43.147.7772: UDP, length 120
02:33:43.789933 IP 192.168.43.146.8880 > 192.168.43.147.7772: UDP, length 120
02:33:43.790683 IP 192.168.43.147.8880 > 192.168.43.124.7773: UDP, length 120
02:33:43.839072 IP 192.168.43.146.8880 > 192.168.43.147.7772: UDP, length 120
02:33:43.840685 IP 192.168.43.147.8880 > 192.168.43.124.7773: UDP, length 120
02:33:43.890684 IP 192.168.43.147.8880 > 192.168.43.124.7773: UDP, length 120
02:33:43.891420 IP 192.168.43.146.8880 > 192.168.43.147.7772: UDP, length 120
02:33:43.933233 IP 192.168.43.146.8880 > 192.168.43.147.7772: UDP, length 120
02:33:43.940683 IP 192.168.43.147.8880 > 192.168.43.124.7773: UDP, length 120
02:33:43.980886 IP 192.168.43.146.8880 > 192.168.43.147.7772: UDP, length 120
02:33:43.990712 IP 192.168.43.147.8880 > 192.168.43.124.7773: UDP, length 120
02:33:44.040684 IP 192.168.43.147.8880 > 192.168.43.124.7773: UDP, length 120
02:33:44.043167 IP 192.168.43.146.8880 > 192.168.43.147.7772: UDP, length 120
02:33:44.082953 IP 192.168.43.146.8880 > 192.168.43.147.7772: UDP, length 120
02:33:44.090683 IP 192.168.43.147.8880 > 192.168.43.124.7773: UDP, length 120
02:33:44.129496 IP 192.168.43.146.8880 > 192.168.43.147.7772: UDP, length 120
02:33:44.140691 IP 192.168.43.147.8880 > 192.168.43.124.7773: UDP, length 120
02:33:44.190728 IP 192.168.43.147.8880 > 192.168.43.124.7773: UDP, length 120
02:33:44.190917 IP 192.168.43.146.8880 > 192.168.43.147.7772: UDP, length 120
02:33:44.232132 IP 192.168.43.146.8880 > 192.168.43.147.7772: UDP, length 120
02:33:44.240773 IP 192.168.43.147.8880 > 192.168.43.124.7773: UDP, length 120
02:33:44.279089 IP 192.168.43.146.8880 > 192.168.43.147.7772: UDP, length 120
02:33:44.290799 IP 192.168.43.147.8880 > 192.168.43.124.7773: UDP, length 120
02:33:44.340815 IP 192.168.43.147.8880 > 192.168.43.124.7773: UDP, length 120
02:33:44.344341 IP 192.168.43.146.8880 > 192.168.43.147.7772: UDP, length 120
02:33:44.382688 IP 192.168.43.146.8880 > 192.168.43.147.7772: UDP, length 120
02:33:44.390795 IP 192.168.43.147.8880 > 192.168.43.124.7773: UDP, length 120
02:33:44.427403 IP 192.168.43.146.8880 > 192.168.43.147.7772: UDP, length 120
02:33:44.440782 IP 192.168.43.147.8880 > 192.168.43.124.7773: UDP, length 120
02:33:44.482780 IP 192.168.43.146.8880 > 192.168.43.147.7772: UDP, length 120
02:33:44.490725 IP 192.168.43.147.8880 > 192.168.43.124.7773: UDP, length 120
02:33:44.531975 IP 192.168.43.146.8880 > 192.168.43.147.7772: UDP, length 120
02:33:44.540699 IP 192.168.43.147.8880 > 192.168.43.124.7773: UDP, length 120
02:33:44.578628 IP 192.168.43.146.8880 > 192.168.43.147.7772: UDP, length 120
02:33:44.590689 IP 192.168.43.147.8880 > 192.168.43.124.7773: UDP, length 120
02:33:44.640684 IP 192.168.43.147.8880 > 192.168.43.124.7773: UDP, length 120
02:33:44.643948 IP 192.168.43.146.8880 > 192.168.43.147.7772: UDP, length 120
02:33:44.682343 IP 192.168.43.146.8880 > 192.168.43.147.7772: UDP, length 120
02:33:44.690688 IP 192.168.43.147.8880 > 192.168.43.124.7773: UDP, length 120
02:33:44.738942 IP 192.168.43.146.8880 > 192.168.43.147.7772: UDP, length 120
02:33:44.740684 IP 192.168.43.147.8880 > 192.168.43.124.7773: UDP, length 120
02:33:44.780882 IP 192.168.43.146.8880 > 192.168.43.147.7772: UDP, length 120
02:33:44.790684 IP 192.168.43.147.8880 > 192.168.43.124.7773: UDP, length 120
02:33:44.825814 IP 192.168.43.146.8880 > 192.168.43.147.7772: UDP, length 120
02:33:44.840734 IP 192.168.43.147.8880 > 192.168.43.124.7773: UDP, length 120
02:33:44.890048 IP 192.168.43.146.8880 > 192.168.43.147.7772: UDP, length 120
02:33:44.890719 IP 192.168.43.147.8880 > 192.168.43.124.7773: UDP, length 120
02:33:44.927582 IP 192.168.43.146.8880 > 192.168.43.147.7772: UDP, length 120
02:33:44.940713 IP 192.168.43.147.8880 > 192.168.43.124.7773: UDP, length 120
02:33:44.978399 IP 192.168.43.146.8880 > 192.168.43.147.7772: UDP, length 120
02:33:44.990738 IP 192.168.43.147.8880 > 192.168.43.124.7773: UDP, length 120
02:33:45.031056 IP 192.168.43.146.8880 > 192.168.43.147.7772: UDP, length 120
02:33:45.040738 IP 192.168.43.147.8880 > 192.168.43.124.7773: UDP, length 120
02:33:45.082869 IP 192.168.43.146.8880 > 192.168.43.147.7772: UDP, length 120
02:33:45.090730 IP 192.168.43.147.8880 > 192.168.43.124.7773: UDP, length 120
02:33:45.130316 IP 192.168.43.146.8880 > 192.168.43.147.7772: UDP, length 120
02:33:45.140767 IP 192.168.43.147.8880 > 192.168.43.124.7773: UDP, length 120
02:33:45.179010 IP 192.168.43.146.8880 > 192.168.43.147.7772: UDP, length 120
02:33:45.190762 IP 192.168.43.147.8880 > 192.168.43.124.7773: UDP, length 120
02:33:45.240741 IP 192.168.43.147.8880 > 192.168.43.124.7773: UDP, length 120
02:33:45.242622 IP 192.168.43.146.8880 > 192.168.43.147.7772: UDP, length 120
02:33:45.279534 IP 192.168.43.146.8880 > 192.168.43.147.7772: UDP, length 120
02:33:45.290776 IP 192.168.43.147.8880 > 192.168.43.124.7773: UDP, length 120
02:33:45.330535 IP 192.168.43.146.8880 > 192.168.43.147.7772: UDP, length 120
02:33:45.340768 IP 192.168.43.147.8880 > 192.168.43.124.7773: UDP, length 120
02:33:45.390737 IP 192.168.43.147.8880 > 192.168.43.124.7773: UDP, length 120
02:33:45.392000 IP 192.168.43.146.8880 > 192.168.43.147.7772: UDP, length 120
02:33:45.431908 IP 192.168.43.146.8880 > 192.168.43.147.7772: UDP, length 120
02:33:45.440699 IP 192.168.43.147.8880 > 192.168.43.124.7773: UDP, length 120
02:33:45.478760 IP 192.168.43.146.8880 > 192.168.43.147.7772: UDP, length 120
02:33:45.490718 IP 192.168.43.147.8880 > 192.168.43.124.7773: UDP, length 120
02:33:45.540690 IP 192.168.43.147.8880 > 192.168.43.124.7773: UDP, length 120
02:33:45.543578 IP 192.168.43.146.8880 > 192.168.43.147.7772: UDP, length 120
02:33:45.590695 IP 192.168.43.147.8880 > 192.168.43.124.7773: UDP, length 120
02:33:45.640685 IP 192.168.43.147.8880 > 192.168.43.124.7773: UDP, length 120
02:33:45.690684 IP 192.168.43.147.8880 > 192.168.43.124.7773: UDP, length 120
02:33:45.740684 IP 192.168.43.147.8880 > 192.168.43.124.7773: UDP, length 120
02:33:45.790681 IP 192.168.43.147.8880 > 192.168.43.124.7773: UDP, length 120
02:33:45.840682 IP 192.168.43.147.8880 > 192.168.43.124.7773: UDP, length 120
02:33:45.890683 IP 192.168.43.147.8880 > 192.168.43.124.7773: UDP, length 120
02:33:45.940684 IP 192.168.43.147.8880 > 192.168.43.124.7773: UDP, length 120
02:33:45.990682 IP 192.168.43.147.8880 > 192.168.43.124.7773: UDP, length 120
02:33:46.040683 IP 192.168.43.147.8880 > 192.168.43.124.7773: UDP, length 120
02:33:46.090729 IP 192.168.43.147.8880 > 192.168.43.124.7773: UDP, length 120
02:33:46.140726 IP 192.168.43.147.8880 > 192.168.43.124.7773: UDP, length 120
02:33:46.190717 IP 192.168.43.147.8880 > 192.168.43.124.7773: UDP, length 120
02:33:46.240692 IP 192.168.43.147.8880 > 192.168.43.124.7773: UDP, length 120
02:33:46.290721 IP 192.168.43.147.8880 > 192.168.43.124.7773: UDP, length 120
