23:35:47.503745 IP 192.168.43.124.8880 > 192.168.43.195.7771: UDP, length 120
23:35:47.553893 IP 192.168.43.124.8880 > 192.168.43.195.7771: UDP, length 120
23:35:47.603890 IP 192.168.43.124.8880 > 192.168.43.195.7771: UDP, length 120
23:35:47.653891 IP 192.168.43.124.8880 > 192.168.43.195.7771: UDP, length 120
23:35:47.703890 IP 192.168.43.124.8880 > 192.168.43.195.7771: UDP, length 120
23:35:47.753891 IP 192.168.43.124.8880 > 192.168.43.195.7771: UDP, length 120
23:35:47.803892 IP 192.168.43.124.8880 > 192.168.43.195.7771: UDP, length 120
23:35:47.853893 IP 192.168.43.124.8880 > 192.168.43.195.7771: UDP, length 120
23:35:47.903891 IP 192.168.43.124.8880 > 192.168.43.195.7771: UDP, length 120
23:35:47.953892 IP 192.168.43.124.8880 > 192.168.43.195.7771: UDP, length 120
23:35:48.003894 IP 192.168.43.124.8880 > 192.168.43.195.7771: UDP, length 120
23:35:48.053894 IP 192.168.43.124.8880 > 192.168.43.195.7771: UDP, length 120
23:35:48.065784 IP 192.168.43.195.8880 > 192.168.43.124.7772: UDP, length 120
23:35:48.103894 IP 192.168.43.124.8880 > 192.168.43.195.7771: UDP, length 120
23:35:48.105733 IP 192.168.43.195.8880 > 192.168.43.124.7772: UDP, length 120
23:35:48.153891 IP 192.168.43.124.8880 > 192.168.43.195.7771: UDP, length 120
23:35:48.154745 IP 192.168.43.195.8880 > 192.168.43.124.7772: UDP, length 120
23:35:48.199400 IP 192.168.43.195.8880 > 192.168.43.124.7772: UDP, length 120
23:35:48.203891 IP 192.168.43.124.8880 > 192.168.43.195.7771: UDP, length 120
23:35:48.254170 IP 192.168.43.124.8880 > 192.168.43.195.7771: UDP, length 120
23:35:48.259604 IP 192.168.43.195.8880 > 192.168.43.124.7772: UDP, length 120
23:35:48.299351 IP 192.168.43.195.8880 > 192.168.43.124.7772: UDP, length 120
23:35:48.303944 IP 192.168.43.124.8880 > 192.168.43.195.7771: UDP, length 120
23:35:48.353939 IP 192.168.43.124.8880 > 192.168.43.195.7771: UDP, length 120
23:35:48.359457 IP 192.168.43.195.8880 > 192.168.43.124.7772: UDP, length 120
23:35:48.399967 IP 192.168.43.195.8880 > 192.168.43.124.7772: UDP, length 120
23:35:48.403896 IP 192.168.43.124.8880 > 192.168.43.195.7771: UDP, length 120
23:35:48.453895 IP 192.168.43.124.8880 > 192.168.43.195.7771: UDP, length 120
23:35:48.461143 IP 192.168.43.195.8880 > 192.168.43.124.7772: UDP, length 120
23:35:48.498928 IP 192.168.43.195.8880 > 192.168.43.124.7772: UDP, length 120
23:35:48.503895 IP 192.168.43.124.8880 > 192.168.43.195.7771: UDP, length 120
23:35:48.553941 IP 192.168.43.124.8880 > 192.168.43.195.7771: UDP, length 120
23:35:48.566474 IP 192.168.43.195.8880 > 192.168.43.124.7772: UDP, length 120
23:35:48.599323 IP 192.168.43.195.8880 > 192.168.43.124.7772: UDP, length 120
23:35:48.603943 IP 192.168.43.124.8880 > 192.168.43.195.7771: UDP, length 120
23:35:48.650072 IP 192.168.43.195.8880 > 192.168.43.124.7772: UDP, length 120
23:35:48.653942 IP 192.168.43.124.8880 > 192.168.43.195.7771: UDP, length 120
23:35:48.699394 IP 192.168.43.195.8880 > 192.168.43.124.7772: UDP, length 120
23:35:48.703944 IP 192.168.43.124.8880 > 192.168.43.195.7771: UDP, length 120
23:35:48.749558 IP 192.168.43.195.8880 > 192.168.43.124.7772: UDP, length 120
23:35:48.753942 IP 192.168.43.124.8880 > 192.168.43.195.7771: UDP, length 120
23:35:48.803942 IP 192.168.43.124.8880 > 192.168.43.195.7771: UDP, length 120
23:35:48.810778 IP 192.168.43.195.8880 > 192.168.43.124.7772: UDP, length 120
23:35:48.853864 IP 192.168.43.195.8880 > 192.168.43.124.7772: UDP, length 120
23:35:48.853924 IP 192.168.43.124.8880 > 192.168.43.195.7771: UDP, length 120
23:35:48.899646 IP 192.168.43.195.8880 > 192.168.43.124.7772: UDP, length 120
23:35:48.903944 IP 192.168.43.124.8880 > 192.168.43.195.7771: UDP, length 120
23:35:48.953940 IP 192.168.43.124.8880 > 192.168.43.195.7771: UDP, length 120
23:35:48.957796 IP 192.168.43.195.8880 > 192.168.43.124.7772: UDP, length 120
23:35:49.003941 IP 192.168.43.124.8880 > 192.168.43.195.7771: UDP, length 120
23:35:49.012832 IP 192.168.43.195.8880 > 192.168.43.124.7772: UDP, length 120
23:35:49.053895 IP 192.168.43.124.8880 > 192.168.43.195.7771: UDP, length 120
23:35:49.057865 IP 192.168.43.195.8880 > 192.168.43.124.7772: UDP, length 120
23:35:49.100424 IP 192.168.43.195.8880 > 192.168.43.124.7772: UDP, length 120
23:35:49.103891 IP 192.168.43.124.8880 > 192.168.43.195.7771: UDP, length 120
23:35:49.153891 IP 192.168.43.124.8880 > 192.168.43.195.7771: UDP, length 120
23:35:49.163370 IP 192.168.43.195.8880 > 192.168.43.124.7772: UDP, length 120
23:35:49.203896 IP 192.168.43.124.8880 > 192.168.43.195.7771: UDP, length 120
23:35:49.204742 IP 192.168.43.195.8880 > 192.168.43.124.7772: UDP, length 120
23:35:49.249136 IP 192.168.43.195.8880 > 192.168.43.124.7772: UDP, length 120
23:35:49.253889 IP 192.168.43.124.8880 > 192.168.43.195.7771: UDP, length 120
23:35:49.299077 IP 192.168.43.195.8880 > 192.168.43.124.7772: UDP, length 120
23:35:49.303894 IP 192.168.43.124.8880 > 192.168.43.195.7771: UDP, length 120
23:35:49.348520 IP 192.168.43.195.8880 > 192.168.43.124.7772: UDP, length 120
23:35:49.353890 IP 192.168.43.124.8880 > 192.168.43.195.7771: UDP, length 120
23:35:49.399230 IP 192.168.43.195.8880 > 192.168.43.124.7772: UDP, length 120
23:35:49.403891 IP 192.168.43.124.8880 > 192.168.43.195.7771: UDP, length 120
23:35:49.449636 IP 192.168.43.195.8880 > 192.168.43.124.7772: UDP, length 120
23:35:49.453893 IP 192.168.43.124.8880 > 192.168.43.195.7771: UDP, length 120
23:35:49.503892 IP 192.168.43.124.8880 > 192.168.43.195.7771: UDP, length 120
23:35:49.509023 IP 192.168.43.195.8880 > 192.168.43.124.7772: UDP, length 120
23:35:49.551234 IP 192.168.43.195.8880 > 192.168.43.124.7772: UDP, length 120
23:35:49.553892 IP 192.168.43.124.8880 > 192.168.43.195.7771: UDP, length 120
23:35:49.599064 IP 192.168.43.195.8880 > 192.168.43.124.7772: UDP, length 120
23:35:49.603892 IP 192.168.43.124.8880 > 192.168.43.195.7771: UDP, length 120
23:35:49.648884 IP 192.168.43.195.8880 > 192.168.43.124.7772: UDP, length 120
23:35:49.653891 IP 192.168.43.124.8880 > 192.168.43.195.7771: UDP, length 120
23:35:49.703892 IP 192.168.43.124.8880 > 192.168.43.195.7771: UDP, length 120
23:35:49.708669 IP 192.168.43.195.8880 > 192.168.43.124.7772: UDP, length 120
23:35:49.751675 IP 192.168.43.195.8880 > 192.168.43.124.7772: UDP, length 120
23:35:49.753890 IP 192.168.43.124.8880 > 192.168.43.195.7771: UDP, length 120
23:35:49.798590 IP 192.168.43.195.8880 > 192.168.43.124.7772: UDP, length 120
23:35:49.803891 IP 192.168.43.124.8880 > 192.168.43.195.7771: UDP, length 120
23:35:49.849945 IP 192.168.43.195.8880 > 192.168.43.124.7772: UDP, length 120
23:35:49.853890 IP 192.168.43.124.8880 > 192.168.43.195.7771: UDP, length 120
23:35:49.901080 IP 192.168.43.195.8880 > 192.168.43.124.7772: UDP, length 120
23:35:49.903890 IP 192.168.43.124.8880 > 192.168.43.195.7771: UDP, length 120
23:35:49.949014 IP 192.168.43.195.8880 > 192.168.43.124.7772: UDP, length 120
23:35:49.953892 IP 192.168.43.124.8880 > 192.168.43.195.7771: UDP, length 120
23:35:50.003437 IP 192.168.43.195.8880 > 192.168.43.124.7772: UDP, length 120
23:35:50.003890 IP 192.168.43.124.8880 > 192.168.43.195.7771: UDP, length 120
23:35:50.053897 IP 192.168.43.124.8880 > 192.168.43.195.7771: UDP, length 120
23:35:50.059555 IP 192.168.43.195.8880 > 192.168.43.124.7772: UDP, length 120
23:35:50.102896 IP 192.168.43.195.8880 > 192.168.43.124.7772: UDP, length 120
23:35:50.103892 IP 192.168.43.124.8880 > 192.168.43.195.7771: UDP, length 120
23:35:50.148906 IP 192.168.43.195.8880 > 192.168.43.124.7772: UDP, length 120
23:35:50.153893 IP 192.168.43.124.8880 > 192.168.43.195.7771: UDP, length 120
23:35:50.203893 IP 192.168.43.124.8880 > 192.168.43.195.7771: UDP, length 120
23:35:50.205108 IP 192.168.43.195.8880 > 192.168.43.124.7772: UDP, length 120
23:35:50.248961 IP 192.168.43.195.8880 > 192.168.43.124.7772: UDP, length 120
23:35:50.253889 IP 192.168.43.124.8880 > 192.168.43.195.7771: UDP, length 120
23:35:50.303852 IP 192.168.43.195.8880 > 192.168.43.124.7772: UDP, length 120
23:35:50.303886 IP 192.168.43.124.8880 > 192.168.43.195.7771: UDP, length 120
23:35:50.353891 IP 192.168.43.124.8880 > 192.168.43.195.7771: UDP, length 120
23:35:50.359169 IP 192.168.43.195.8880 > 192.168.43.124.7772: UDP, length 120
23:35:50.401800 IP 192.168.43.195.8880 > 192.168.43.124.7772: UDP, length 120
23:35:50.404458 IP 192.168.43.124.8880 > 192.168.43.195.7771: UDP, length 120
23:35:50.448806 IP 192.168.43.195.8880 > 192.168.43.124.7772: UDP, length 120
23:35:50.453891 IP 192.168.43.124.8880 > 192.168.43.195.7771: UDP, length 120
23:35:50.501224 IP 192.168.43.195.8880 > 192.168.43.124.7772: UDP, length 120
23:35:50.503890 IP 192.168.43.124.8880 > 192.168.43.195.7771: UDP, length 120
23:35:50.549132 IP 192.168.43.195.8880 > 192.168.43.124.7772: UDP, length 120
23:35:50.553891 IP 192.168.43.124.8880 > 192.168.43.195.7771: UDP, length 120
23:35:50.599502 IP 192.168.43.195.8880 > 192.168.43.124.7772: UDP, length 120
23:35:50.603890 IP 192.168.43.124.8880 > 192.168.43.195.7771: UDP, length 120
23:35:50.649209 IP 192.168.43.195.8880 > 192.168.43.124.7772: UDP, length 120
23:35:50.653891 IP 192.168.43.124.8880 > 192.168.43.195.7771: UDP, length 120
23:35:50.699621 IP 192.168.43.195.8880 > 192.168.43.124.7772: UDP, length 120
23:35:50.703892 IP 192.168.43.124.8880 > 192.168.43.195.7771: UDP, length 120
23:35:50.753891 IP 192.168.43.124.8880 > 192.168.43.195.7771: UDP, length 120
23:35:50.758702 IP 192.168.43.195.8880 > 192.168.43.124.7772: UDP, length 120
23:35:50.799523 IP 192.168.43.195.8880 > 192.168.43.124.7772: UDP, length 120
23:35:50.803890 IP 192.168.43.124.8880 > 192.168.43.195.7771: UDP, length 120
23:35:50.848783 IP 192.168.43.195.8880 > 192.168.43.124.7772: UDP, length 120
23:35:50.853891 IP 192.168.43.124.8880 > 192.168.43.195.7771: UDP, length 120
23:35:50.901329 IP 192.168.43.195.8880 > 192.168.43.124.7772: UDP, length 120
23:35:50.903891 IP 192.168.43.124.8880 > 192.168.43.195.7771: UDP, length 120
23:35:50.953892 IP 192.168.43.124.8880 > 192.168.43.195.7771: UDP, length 120
23:35:50.958513 IP 192.168.43.195.8880 > 192.168.43.124.7772: UDP, length 120
23:35:51.004362 IP 192.168.43.195.8880 > 192.168.43.124.7772: UDP, length 120
23:35:51.004366 IP 192.168.43.124.8880 > 192.168.43.195.7771: UDP, length 120
23:35:51.049008 IP 192.168.43.195.8880 > 192.168.43.124.7772: UDP, length 120
23:35:51.053895 IP 192.168.43.124.8880 > 192.168.43.195.7771: UDP, length 120
23:35:51.103895 IP 192.168.43.124.8880 > 192.168.43.195.7771: UDP, length 120
23:35:51.118686 IP 192.168.43.195.8880 > 192.168.43.124.7772: UDP, length 120
23:35:51.152016 IP 192.168.43.195.8880 > 192.168.43.124.7772: UDP, length 120
23:35:51.153891 IP 192.168.43.124.8880 > 192.168.43.195.7771: UDP, length 120
23:35:51.203943 IP 192.168.43.124.8880 > 192.168.43.195.7771: UDP, length 120
23:35:51.206525 IP 192.168.43.195.8880 > 192.168.43.124.7772: UDP, length 120
23:35:51.253893 IP 192.168.43.124.8880 > 192.168.43.195.7771: UDP, length 120
23:35:51.260237 IP 192.168.43.195.8880 > 192.168.43.124.7772: UDP, length 120
23:35:51.298761 IP 192.168.43.195.8880 > 192.168.43.124.7772: UDP, length 120
23:35:51.303893 IP 192.168.43.124.8880 > 192.168.43.195.7771: UDP, length 120
23:35:51.350068 IP 192.168.43.195.8880 > 192.168.43.124.7772: UDP, length 120
23:35:51.353894 IP 192.168.43.124.8880 > 192.168.43.195.7771: UDP, length 120
23:35:51.398837 IP 192.168.43.195.8880 > 192.168.43.124.7772: UDP, length 120
23:35:51.403894 IP 192.168.43.124.8880 > 192.168.43.195.7771: UDP, length 120
23:35:51.449052 IP 192.168.43.195.8880 > 192.168.43.124.7772: UDP, length 120
23:35:51.453894 IP 192.168.43.124.8880 > 192.168.43.195.7771: UDP, length 120
23:35:51.499213 IP 192.168.43.195.8880 > 192.168.43.124.7772: UDP, length 120
23:35:51.503895 IP 192.168.43.124.8880 > 192.168.43.195.7771: UDP, length 120
23:35:51.551274 IP 192.168.43.195.8880 > 192.168.43.124.7772: UDP, length 120
23:35:51.553891 IP 192.168.43.124.8880 > 192.168.43.195.7771: UDP, length 120
23:35:51.603891 IP 192.168.43.124.8880 > 192.168.43.195.7771: UDP, length 120
23:35:51.612240 IP 192.168.43.195.8880 > 192.168.43.124.7772: UDP, length 120
23:35:51.649209 IP 192.168.43.195.8880 > 192.168.43.124.7772: UDP, length 120
23:35:51.653894 IP 192.168.43.124.8880 > 192.168.43.195.7771: UDP, length 120
23:35:51.700357 IP 192.168.43.195.8880 > 192.168.43.124.7772: UDP, length 120
23:35:51.703893 IP 192.168.43.124.8880 > 192.168.43.195.7771: UDP, length 120
23:35:51.753892 IP 192.168.43.124.8880 > 192.168.43.195.7771: UDP, length 120
23:35:51.770534 IP 192.168.43.195.8880 > 192.168.43.124.7772: UDP, length 120
23:35:51.800338 IP 192.168.43.195.8880 > 192.168.43.124.7772: UDP, length 120
23:35:51.803893 IP 192.168.43.124.8880 > 192.168.43.195.7771: UDP, length 120
23:35:51.849235 IP 192.168.43.195.8880 > 192.168.43.124.7772: UDP, length 120
23:35:51.853893 IP 192.168.43.124.8880 > 192.168.43.195.7771: UDP, length 120
23:35:51.899114 IP 192.168.43.195.8880 > 192.168.43.124.7772: UDP, length 120
23:35:51.903868 IP 192.168.43.124.8880 > 192.168.43.195.7771: UDP, length 120
23:35:51.953830 IP 192.168.43.124.8880 > 192.168.43.195.7771: UDP, length 120
23:35:51.957976 IP 192.168.43.195.8880 > 192.168.43.124.7772: UDP, length 120
23:35:52.003821 IP 192.168.43.124.8880 > 192.168.43.195.7771: UDP, length 120
23:35:52.004680 IP 192.168.43.195.8880 > 192.168.43.124.7772: UDP, length 120
23:35:52.051242 IP 192.168.43.195.8880 > 192.168.43.124.7772: UDP, length 120
23:35:52.053890 IP 192.168.43.124.8880 > 192.168.43.195.7771: UDP, length 120
23:35:52.098578 IP 192.168.43.195.8880 > 192.168.43.124.7772: UDP, length 120
23:35:52.103893 IP 192.168.43.124.8880 > 192.168.43.195.7771: UDP, length 120
23:35:52.151373 IP 192.168.43.195.8880 > 192.168.43.124.7772: UDP, length 120
23:35:52.153893 IP 192.168.43.124.8880 > 192.168.43.195.7771: UDP, length 120
23:35:52.201179 IP 192.168.43.195.8880 > 192.168.43.124.7772: UDP, length 120
23:35:52.203892 IP 192.168.43.124.8880 > 192.168.43.195.7771: UDP, length 120
23:35:52.253082 IP 192.168.43.195.8880 > 192.168.43.124.7772: UDP, length 120
23:35:52.253863 IP 192.168.43.124.8880 > 192.168.43.195.7771: UDP, length 120
23:35:52.303941 IP 192.168.43.124.8880 > 192.168.43.195.7771: UDP, length 120
23:35:52.314351 IP 192.168.43.195.8880 > 192.168.43.124.7772: UDP, length 120
23:35:52.353278 IP 192.168.43.195.8880 > 192.168.43.124.7772: UDP, length 120
23:35:52.353864 IP 192.168.43.124.8880 > 192.168.43.195.7771: UDP, length 120
23:35:52.399488 IP 192.168.43.195.8880 > 192.168.43.124.7772: UDP, length 120
23:35:52.403940 IP 192.168.43.124.8880 > 192.168.43.195.7771: UDP, length 120
23:35:52.453940 IP 192.168.43.124.8880 > 192.168.43.195.7771: UDP, length 120
23:35:52.463607 IP 192.168.43.195.8880 > 192.168.43.124.7772: UDP, length 120
23:35:52.500961 IP 192.168.43.195.8880 > 192.168.43.124.7772: UDP, length 120
23:35:52.503944 IP 192.168.43.124.8880 > 192.168.43.195.7771: UDP, length 120
23:35:52.548365 IP 192.168.43.195.8880 > 192.168.43.124.7772: UDP, length 120
23:35:52.553942 IP 192.168.43.124.8880 > 192.168.43.195.7771: UDP, length 120
23:35:52.603940 IP 192.168.43.124.8880 > 192.168.43.195.7771: UDP, length 120
23:35:52.606305 IP 192.168.43.195.8880 > 192.168.43.124.7772: UDP, length 120
23:35:52.647912 IP 192.168.43.195.8880 > 192.168.43.124.7772: UDP, length 120
23:35:52.653942 IP 192.168.43.124.8880 > 192.168.43.195.7771: UDP, length 120
23:35:52.699294 IP 192.168.43.195.8880 > 192.168.43.124.7772: UDP, length 120
23:35:52.703943 IP 192.168.43.124.8880 > 192.168.43.195.7771: UDP, length 120
23:35:52.753940 IP 192.168.43.124.8880 > 192.168.43.195.7771: UDP, length 120
23:35:52.767933 IP 192.168.43.195.8880 > 192.168.43.124.7772: UDP, length 120
23:35:52.799334 IP 192.168.43.195.8880 > 192.168.43.124.7772: UDP, length 120
23:35:52.803944 IP 192.168.43.124.8880 > 192.168.43.195.7771: UDP, length 120
23:35:52.849713 IP 192.168.43.195.8880 > 192.168.43.124.7772: UDP, length 120
23:35:52.853944 IP 192.168.43.124.8880 > 192.168.43.195.7771: UDP, length 120
23:35:52.899335 IP 192.168.43.195.8880 > 192.168.43.124.7772: UDP, length 120
23:35:52.903942 IP 192.168.43.124.8880 > 192.168.43.195.7771: UDP, length 120
23:35:52.953946 IP 192.168.43.124.8880 > 192.168.43.195.7771: UDP, length 120
23:35:52.962253 IP 192.168.43.195.8880 > 192.168.43.124.7772: UDP, length 120
23:35:52.999462 IP 192.168.43.195.8880 > 192.168.43.124.7772: UDP, length 120
23:35:53.003945 IP 192.168.43.124.8880 > 192.168.43.195.7771: UDP, length 120
23:35:53.054319 IP 192.168.43.195.8880 > 192.168.43.124.7772: UDP, length 120
23:35:53.054330 IP 192.168.43.124.8880 > 192.168.43.195.7771: UDP, length 120
23:35:53.098894 IP 192.168.43.195.8880 > 192.168.43.124.7772: UDP, length 120
23:35:53.103891 IP 192.168.43.124.8880 > 192.168.43.195.7771: UDP, length 120
23:35:53.153890 IP 192.168.43.124.8880 > 192.168.43.195.7771: UDP, length 120
23:35:53.160524 IP 192.168.43.195.8880 > 192.168.43.124.7772: UDP, length 120
23:35:53.198877 IP 192.168.43.195.8880 > 192.168.43.124.7772: UDP, length 120
23:35:53.203891 IP 192.168.43.124.8880 > 192.168.43.195.7771: UDP, length 120
23:35:53.254048 IP 192.168.43.124.8880 > 192.168.43.195.7771: UDP, length 120
23:35:53.254060 IP 192.168.43.195.8880 > 192.168.43.124.7772: UDP, length 120
23:35:53.303891 IP 192.168.43.124.8880 > 192.168.43.195.7771: UDP, length 120
23:35:53.316284 IP 192.168.43.195.8880 > 192.168.43.124.7772: UDP, length 120
23:35:53.353940 IP 192.168.43.124.8880 > 192.168.43.195.7771: UDP, length 120
23:35:53.360243 IP 192.168.43.195.8880 > 192.168.43.124.7772: UDP, length 120
23:35:53.402996 IP 192.168.43.195.8880 > 192.168.43.124.7772: UDP, length 120
23:35:53.403941 IP 192.168.43.124.8880 > 192.168.43.195.7771: UDP, length 120
23:35:53.449376 IP 192.168.43.195.8880 > 192.168.43.124.7772: UDP, length 120
23:35:53.453942 IP 192.168.43.124.8880 > 192.168.43.195.7771: UDP, length 120
23:35:53.503946 IP 192.168.43.124.8880 > 192.168.43.195.7771: UDP, length 120
23:35:53.509232 IP 192.168.43.195.8880 > 192.168.43.124.7772: UDP, length 120
23:35:53.549128 IP 192.168.43.195.8880 > 192.168.43.124.7772: UDP, length 120
23:35:53.553941 IP 192.168.43.124.8880 > 192.168.43.195.7771: UDP, length 120
23:35:53.603942 IP 192.168.43.124.8880 > 192.168.43.195.7771: UDP, length 120
23:35:53.608270 IP 192.168.43.195.8880 > 192.168.43.124.7772: UDP, length 120
23:35:53.651606 IP 192.168.43.195.8880 > 192.168.43.124.7772: UDP, length 120
23:35:53.653937 IP 192.168.43.124.8880 > 192.168.43.195.7771: UDP, length 120
23:35:53.698939 IP 192.168.43.195.8880 > 192.168.43.124.7772: UDP, length 120
23:35:53.703944 IP 192.168.43.124.8880 > 192.168.43.195.7771: UDP, length 120
23:35:53.750144 IP 192.168.43.195.8880 > 192.168.43.124.7772: UDP, length 120
23:35:53.753941 IP 192.168.43.124.8880 > 192.168.43.195.7771: UDP, length 120
23:35:53.801036 IP 192.168.43.195.8880 > 192.168.43.124.7772: UDP, length 120
23:35:53.803942 IP 192.168.43.124.8880 > 192.168.43.195.7771: UDP, length 120
23:35:53.853941 IP 192.168.43.124.8880 > 192.168.43.195.7771: UDP, length 120
23:35:53.857032 IP 192.168.43.195.8880 > 192.168.43.124.7772: UDP, length 120
23:35:53.903944 IP 192.168.43.124.8880 > 192.168.43.195.7771: UDP, length 120
23:35:53.908577 IP 192.168.43.195.8880 > 192.168.43.124.7772: UDP, length 120
23:35:53.950097 IP 192.168.43.195.8880 > 192.168.43.124.7772: UDP, length 120
23:35:53.953942 IP 192.168.43.124.8880 > 192.168.43.195.7771: UDP, length 120
23:35:53.998954 IP 192.168.43.195.8880 > 192.168.43.124.7772: UDP, length 120
23:35:54.003944 IP 192.168.43.124.8880 > 192.168.43.195.7771: UDP, length 120
23:35:54.049215 IP 192.168.43.195.8880 > 192.168.43.124.7772: UDP, length 120
23:35:54.053892 IP 192.168.43.124.8880 > 192.168.43.195.7771: UDP, length 120
23:35:54.099406 IP 192.168.43.195.8880 > 192.168.43.124.7772: UDP, length 120
23:35:54.103895 IP 192.168.43.124.8880 > 192.168.43.195.7771: UDP, length 120
23:35:54.147818 IP 192.168.43.195.8880 > 192.168.43.124.7772: UDP, length 120
23:35:54.153893 IP 192.168.43.124.8880 > 192.168.43.195.7771: UDP, length 120
23:35:54.203896 IP 192.168.43.124.8880 > 192.168.43.195.7771: UDP, length 120
23:35:54.208451 IP 192.168.43.195.8880 > 192.168.43.124.7772: UDP, length 120
23:35:54.248981 IP 192.168.43.195.8880 > 192.168.43.124.7772: UDP, length 120
23:35:54.253893 IP 192.168.43.124.8880 > 192.168.43.195.7771: UDP, length 120
23:35:54.301751 IP 192.168.43.195.8880 > 192.168.43.124.7772: UDP, length 120
23:35:54.303893 IP 192.168.43.124.8880 > 192.168.43.195.7771: UDP, length 120
23:35:54.350978 IP 192.168.43.195.8880 > 192.168.43.124.7772: UDP, length 120
23:35:54.353940 IP 192.168.43.124.8880 > 192.168.43.195.7771: UDP, length 120
23:35:54.403942 IP 192.168.43.124.8880 > 192.168.43.195.7771: UDP, length 120
23:35:54.406550 IP 192.168.43.195.8880 > 192.168.43.124.7772: UDP, length 120
23:35:54.453226 IP 192.168.43.195.8880 > 192.168.43.124.7772: UDP, length 120
23:35:54.453938 IP 192.168.43.124.8880 > 192.168.43.195.7771: UDP, length 120
23:35:54.503860 IP 192.168.43.124.8880 > 192.168.43.195.7771: UDP, length 120
23:35:54.508823 IP 192.168.43.195.8880 > 192.168.43.124.7772: UDP, length 120
23:35:54.553940 IP 192.168.43.124.8880 > 192.168.43.195.7771: UDP, length 120
23:35:54.559188 IP 192.168.43.195.8880 > 192.168.43.124.7772: UDP, length 120
23:35:54.602831 IP 192.168.43.195.8880 > 192.168.43.124.7772: UDP, length 120
23:35:54.603941 IP 192.168.43.124.8880 > 192.168.43.195.7771: UDP, length 120
23:35:54.651642 IP 192.168.43.195.8880 > 192.168.43.124.7772: UDP, length 120
23:35:54.653939 IP 192.168.43.124.8880 > 192.168.43.195.7771: UDP, length 120
23:35:54.699526 IP 192.168.43.195.8880 > 192.168.43.124.7772: UDP, length 120
23:35:54.703945 IP 192.168.43.124.8880 > 192.168.43.195.7771: UDP, length 120
23:35:54.753941 IP 192.168.43.124.8880 > 192.168.43.195.7771: UDP, length 120
23:35:54.759462 IP 192.168.43.195.8880 > 192.168.43.124.7772: UDP, length 120
23:35:54.799596 IP 192.168.43.195.8880 > 192.168.43.124.7772: UDP, length 120
23:35:54.803944 IP 192.168.43.124.8880 > 192.168.43.195.7771: UDP, length 120
23:35:54.849328 IP 192.168.43.195.8880 > 192.168.43.124.7772: UDP, length 120
23:35:54.853946 IP 192.168.43.124.8880 > 192.168.43.195.7771: UDP, length 120
23:35:54.903942 IP 192.168.43.124.8880 > 192.168.43.195.7771: UDP, length 120
23:35:54.916431 IP 192.168.43.195.8880 > 192.168.43.124.7772: UDP, length 120
23:35:54.953941 IP 192.168.43.124.8880 > 192.168.43.195.7771: UDP, length 120
23:35:54.962204 IP 192.168.43.195.8880 > 192.168.43.124.7772: UDP, length 120
23:35:54.999021 IP 192.168.43.195.8880 > 192.168.43.124.7772: UDP, length 120
23:35:55.003945 IP 192.168.43.124.8880 > 192.168.43.195.7771: UDP, length 120
23:35:55.053895 IP 192.168.43.124.8880 > 192.168.43.195.7771: UDP, length 120
23:35:55.055292 IP 192.168.43.195.8880 > 192.168.43.124.7772: UDP, length 120
23:35:55.100638 IP 192.168.43.195.8880 > 192.168.43.124.7772: UDP, length 120
23:35:55.103896 IP 192.168.43.124.8880 > 192.168.43.195.7771: UDP, length 120
23:35:55.148558 IP 192.168.43.195.8880 > 192.168.43.124.7772: UDP, length 120
23:35:55.153897 IP 192.168.43.124.8880 > 192.168.43.195.7771: UDP, length 120
23:35:55.203893 IP 192.168.43.124.8880 > 192.168.43.195.7771: UDP, length 120
23:35:55.219041 IP 192.168.43.195.8880 > 192.168.43.124.7772: UDP, length 120
23:35:55.250118 IP 192.168.43.195.8880 > 192.168.43.124.7772: UDP, length 120
23:35:55.253893 IP 192.168.43.124.8880 > 192.168.43.195.7771: UDP, length 120
23:35:55.299094 IP 192.168.43.195.8880 > 192.168.43.124.7772: UDP, length 120
23:35:55.303892 IP 192.168.43.124.8880 > 192.168.43.195.7771: UDP, length 120
23:35:55.348699 IP 192.168.43.195.8880 > 192.168.43.124.7772: UDP, length 120
23:35:55.353892 IP 192.168.43.124.8880 > 192.168.43.195.7771: UDP, length 120
23:35:55.403892 IP 192.168.43.124.8880 > 192.168.43.195.7771: UDP, length 120
23:35:55.404601 IP 192.168.43.195.8880 > 192.168.43.124.7772: UDP, length 120
23:35:55.448983 IP 192.168.43.195.8880 > 192.168.43.124.7772: UDP, length 120
23:35:55.453894 IP 192.168.43.124.8880 > 192.168.43.195.7771: UDP, length 120
23:35:55.503889 IP 192.168.43.124.8880 > 192.168.43.195.7771: UDP, length 120
23:35:55.506775 IP 192.168.43.195.8880 > 192.168.43.124.7772: UDP, length 120
23:35:55.553890 IP 192.168.43.124.8880 > 192.168.43.195.7771: UDP, length 120
23:35:55.559168 IP 192.168.43.195.8880 > 192.168.43.124.7772: UDP, length 120
23:35:55.598599 IP 192.168.43.195.8880 > 192.168.43.124.7772: UDP, length 120
23:35:55.603892 IP 192.168.43.124.8880 > 192.168.43.195.7771: UDP, length 120
23:35:55.648544 IP 192.168.43.195.8880 > 192.168.43.124.7772: UDP, length 120
23:35:55.653894 IP 192.168.43.124.8880 > 192.168.43.195.7771: UDP, length 120
23:35:55.698478 IP 192.168.43.195.8880 > 192.168.43.124.7772: UDP, length 120
23:35:55.703894 IP 192.168.43.124.8880 > 192.168.43.195.7771: UDP, length 120
23:35:55.753891 IP 192.168.43.124.8880 > 192.168.43.195.7771: UDP, length 120
23:35:55.758508 IP 192.168.43.195.8880 > 192.168.43.124.7772: UDP, length 120
23:35:55.799427 IP 192.168.43.195.8880 > 192.168.43.124.7772: UDP, length 120
23:35:55.803894 IP 192.168.43.124.8880 > 192.168.43.195.7771: UDP, length 120
23:35:55.849582 IP 192.168.43.195.8880 > 192.168.43.124.7772: UDP, length 120
23:35:55.853942 IP 192.168.43.124.8880 > 192.168.43.195.7771: UDP, length 120
23:35:55.899104 IP 192.168.43.195.8880 > 192.168.43.124.7772: UDP, length 120
23:35:55.903946 IP 192.168.43.124.8880 > 192.168.43.195.7771: UDP, length 120
23:35:55.953940 IP 192.168.43.124.8880 > 192.168.43.195.7771: UDP, length 120
23:35:55.960679 IP 192.168.43.195.8880 > 192.168.43.124.7772: UDP, length 120
23:35:56.002821 IP 192.168.43.195.8880 > 192.168.43.124.7772: UDP, length 120
23:35:56.003905 IP 192.168.43.124.8880 > 192.168.43.195.7771: UDP, length 120
23:35:56.049134 IP 192.168.43.195.8880 > 192.168.43.124.7772: UDP, length 120
23:35:56.053940 IP 192.168.43.124.8880 > 192.168.43.195.7771: UDP, length 120
23:35:56.099895 IP 192.168.43.195.8880 > 192.168.43.124.7772: UDP, length 120
23:35:56.103896 IP 192.168.43.124.8880 > 192.168.43.195.7771: UDP, length 120
23:35:56.150211 IP 192.168.43.195.8880 > 192.168.43.124.7772: UDP, length 120
23:35:56.153894 IP 192.168.43.124.8880 > 192.168.43.195.7771: UDP, length 120
23:35:56.198733 IP 192.168.43.195.8880 > 192.168.43.124.7772: UDP, length 120
23:35:56.203893 IP 192.168.43.124.8880 > 192.168.43.195.7771: UDP, length 120
23:35:56.249391 IP 192.168.43.195.8880 > 192.168.43.124.7772: UDP, length 120
23:35:56.253893 IP 192.168.43.124.8880 > 192.168.43.195.7771: UDP, length 120
23:35:56.303892 IP 192.168.43.124.8880 > 192.168.43.195.7771: UDP, length 120
23:35:56.309494 IP 192.168.43.195.8880 > 192.168.43.124.7772: UDP, length 120
23:35:56.348794 IP 192.168.43.195.8880 > 192.168.43.124.7772: UDP, length 120
23:35:56.353892 IP 192.168.43.124.8880 > 192.168.43.195.7771: UDP, length 120
23:35:56.398583 IP 192.168.43.195.8880 > 192.168.43.124.7772: UDP, length 120
23:35:56.403893 IP 192.168.43.124.8880 > 192.168.43.195.7771: UDP, length 120
23:35:56.453892 IP 192.168.43.124.8880 > 192.168.43.195.7771: UDP, length 120
23:35:56.459774 IP 192.168.43.195.8880 > 192.168.43.124.7772: UDP, length 120
23:35:56.500758 IP 192.168.43.195.8880 > 192.168.43.124.7772: UDP, length 120
23:35:56.503895 IP 192.168.43.124.8880 > 192.168.43.195.7771: UDP, length 120
23:35:56.550878 IP 192.168.43.195.8880 > 192.168.43.124.7772: UDP, length 120
23:35:56.553890 IP 192.168.43.124.8880 > 192.168.43.195.7771: UDP, length 120
23:35:56.603890 IP 192.168.43.124.8880 > 192.168.43.195.7771: UDP, length 120
23:35:56.610363 IP 192.168.43.195.8880 > 192.168.43.124.7772: UDP, length 120
23:35:56.653889 IP 192.168.43.124.8880 > 192.168.43.195.7771: UDP, length 120
23:35:56.655833 IP 192.168.43.195.8880 > 192.168.43.124.7772: UDP, length 120
23:35:56.699167 IP 192.168.43.195.8880 > 192.168.43.124.7772: UDP, length 120
23:35:56.703890 IP 192.168.43.124.8880 > 192.168.43.195.7771: UDP, length 120
23:35:56.753888 IP 192.168.43.124.8880 > 192.168.43.195.7771: UDP, length 120
23:35:56.771865 IP 192.168.43.195.8880 > 192.168.43.124.7772: UDP, length 120
23:35:56.798667 IP 192.168.43.195.8880 > 192.168.43.124.7772: UDP, length 120
23:35:56.803894 IP 192.168.43.124.8880 > 192.168.43.195.7771: UDP, length 120
23:35:56.848504 IP 192.168.43.195.8880 > 192.168.43.124.7772: UDP, length 120
23:35:56.853893 IP 192.168.43.124.8880 > 192.168.43.195.7771: UDP, length 120
23:35:56.899246 IP 192.168.43.195.8880 > 192.168.43.124.7772: UDP, length 120
23:35:56.903895 IP 192.168.43.124.8880 > 192.168.43.195.7771: UDP, length 120
23:35:56.948727 IP 192.168.43.195.8880 > 192.168.43.124.7772: UDP, length 120
23:35:56.953892 IP 192.168.43.124.8880 > 192.168.43.195.7771: UDP, length 120
23:35:56.998600 IP 192.168.43.195.8880 > 192.168.43.124.7772: UDP, length 120
23:35:57.003944 IP 192.168.43.124.8880 > 192.168.43.195.7771: UDP, length 120
23:35:57.053836 IP 192.168.43.124.8880 > 192.168.43.195.7771: UDP, length 120
23:35:57.068443 IP 192.168.43.195.8880 > 192.168.43.124.7772: UDP, length 120
23:35:57.098547 IP 192.168.43.195.8880 > 192.168.43.124.7772: UDP, length 120
23:35:57.103823 IP 192.168.43.124.8880 > 192.168.43.195.7771: UDP, length 120
23:35:57.148763 IP 192.168.43.195.8880 > 192.168.43.124.7772: UDP, length 120
23:35:57.153891 IP 192.168.43.124.8880 > 192.168.43.195.7771: UDP, length 120
23:35:57.198312 IP 192.168.43.195.8880 > 192.168.43.124.7772: UDP, length 120
23:35:57.203892 IP 192.168.43.124.8880 > 192.168.43.195.7771: UDP, length 120
23:35:57.253892 IP 192.168.43.124.8880 > 192.168.43.195.7771: UDP, length 120
23:35:57.262441 IP 192.168.43.195.8880 > 192.168.43.124.7772: UDP, length 120
23:35:57.298550 IP 192.168.43.195.8880 > 192.168.43.124.7772: UDP, length 120
23:35:57.303892 IP 192.168.43.124.8880 > 192.168.43.195.7771: UDP, length 120
23:35:57.352359 IP 192.168.43.195.8880 > 192.168.43.124.7772: UDP, length 120
23:35:57.353854 IP 192.168.43.124.8880 > 192.168.43.195.7771: UDP, length 120
23:35:57.398735 IP 192.168.43.195.8880 > 192.168.43.124.7772: UDP, length 120
23:35:57.403893 IP 192.168.43.124.8880 > 192.168.43.195.7771: UDP, length 120
23:35:57.453892 IP 192.168.43.124.8880 > 192.168.43.195.7771: UDP, length 120
23:35:57.462988 IP 192.168.43.195.8880 > 192.168.43.124.7772: UDP, length 120
23:35:57.503893 IP 192.168.43.124.8880 > 192.168.43.195.7771: UDP, length 120
23:35:57.536758 IP 192.168.43.195.8880 > 192.168.43.124.7772: UDP, length 120
23:35:57.552643 IP 192.168.43.195.8880 > 192.168.43.124.7772: UDP, length 120
23:35:57.553855 IP 192.168.43.124.8880 > 192.168.43.195.7771: UDP, length 120
23:35:57.601492 IP 192.168.43.195.8880 > 192.168.43.124.7772: UDP, length 120
23:35:57.603893 IP 192.168.43.124.8880 > 192.168.43.195.7771: UDP, length 120
23:35:57.653890 IP 192.168.43.124.8880 > 192.168.43.195.7771: UDP, length 120
23:35:57.662377 IP 192.168.43.195.8880 > 192.168.43.124.7772: UDP, length 120
23:35:57.701648 IP 192.168.43.195.8880 > 192.168.43.124.7772: UDP, length 120
23:35:57.703894 IP 192.168.43.124.8880 > 192.168.43.195.7771: UDP, length 120
23:35:57.748713 IP 192.168.43.195.8880 > 192.168.43.124.7772: UDP, length 120
23:35:57.753893 IP 192.168.43.124.8880 > 192.168.43.195.7771: UDP, length 120
23:35:57.798395 IP 192.168.43.195.8880 > 192.168.43.124.7772: UDP, length 120
23:35:57.803891 IP 192.168.43.124.8880 > 192.168.43.195.7771: UDP, length 120
23:35:57.853891 IP 192.168.43.124.8880 > 192.168.43.195.7771: UDP, length 120
23:35:57.860170 IP 192.168.43.195.8880 > 192.168.43.124.7772: UDP, length 120
23:35:57.900681 IP 192.168.43.195.8880 > 192.168.43.124.7772: UDP, length 120
23:35:57.903892 IP 192.168.43.124.8880 > 192.168.43.195.7771: UDP, length 120
23:35:57.949098 IP 192.168.43.195.8880 > 192.168.43.124.7772: UDP, length 120
23:35:57.953900 IP 192.168.43.124.8880 > 192.168.43.195.7771: UDP, length 120
23:35:57.998868 IP 192.168.43.195.8880 > 192.168.43.124.7772: UDP, length 120
23:35:58.003892 IP 192.168.43.124.8880 > 192.168.43.195.7771: UDP, length 120
23:35:58.053891 IP 192.168.43.124.8880 > 192.168.43.195.7771: UDP, length 120
23:35:58.060732 IP 192.168.43.195.8880 > 192.168.43.124.7772: UDP, length 120
23:35:58.099574 IP 192.168.43.195.8880 > 192.168.43.124.7772: UDP, length 120
23:35:58.103893 IP 192.168.43.124.8880 > 192.168.43.195.7771: UDP, length 120
23:35:58.148661 IP 192.168.43.195.8880 > 192.168.43.124.7772: UDP, length 120
23:35:58.153892 IP 192.168.43.124.8880 > 192.168.43.195.7771: UDP, length 120
23:35:58.198317 IP 192.168.43.195.8880 > 192.168.43.124.7772: UDP, length 120
23:35:58.203896 IP 192.168.43.124.8880 > 192.168.43.195.7771: UDP, length 120
23:35:58.253892 IP 192.168.43.124.8880 > 192.168.43.195.7771: UDP, length 120
23:35:58.260846 IP 192.168.43.195.8880 > 192.168.43.124.7772: UDP, length 120
23:35:58.298576 IP 192.168.43.195.8880 > 192.168.43.124.7772: UDP, length 120
23:35:58.303893 IP 192.168.43.124.8880 > 192.168.43.195.7771: UDP, length 120
23:35:58.352781 IP 192.168.43.195.8880 > 192.168.43.124.7772: UDP, length 120
23:35:58.353832 IP 192.168.43.124.8880 > 192.168.43.195.7771: UDP, length 120
23:35:58.399651 IP 192.168.43.195.8880 > 192.168.43.124.7772: UDP, length 120
23:35:58.403890 IP 192.168.43.124.8880 > 192.168.43.195.7771: UDP, length 120
23:35:58.453891 IP 192.168.43.124.8880 > 192.168.43.195.7771: UDP, length 120
23:35:58.471351 IP 192.168.43.195.8880 > 192.168.43.124.7772: UDP, length 120
23:35:58.501193 IP 192.168.43.195.8880 > 192.168.43.124.7772: UDP, length 120
23:35:58.503892 IP 192.168.43.124.8880 > 192.168.43.195.7771: UDP, length 120
23:35:58.548765 IP 192.168.43.195.8880 > 192.168.43.124.7772: UDP, length 120
23:35:58.553895 IP 192.168.43.124.8880 > 192.168.43.195.7771: UDP, length 120
23:35:58.603893 IP 192.168.43.124.8880 > 192.168.43.195.7771: UDP, length 120
23:35:58.610797 IP 192.168.43.195.8880 > 192.168.43.124.7772: UDP, length 120
23:35:58.653891 IP 192.168.43.124.8880 > 192.168.43.195.7771: UDP, length 120
23:35:58.660621 IP 192.168.43.195.8880 > 192.168.43.124.7772: UDP, length 120
23:35:58.701618 IP 192.168.43.195.8880 > 192.168.43.124.7772: UDP, length 120
23:35:58.703892 IP 192.168.43.124.8880 > 192.168.43.195.7771: UDP, length 120
23:35:58.750837 IP 192.168.43.195.8880 > 192.168.43.124.7772: UDP, length 120
23:35:58.753889 IP 192.168.43.124.8880 > 192.168.43.195.7771: UDP, length 120
23:35:58.803892 IP 192.168.43.124.8880 > 192.168.43.195.7771: UDP, length 120
23:35:58.805265 IP 192.168.43.195.8880 > 192.168.43.124.7772: UDP, length 120
23:35:58.853889 IP 192.168.43.124.8880 > 192.168.43.195.7771: UDP, length 120
23:35:58.858430 IP 192.168.43.195.8880 > 192.168.43.124.7772: UDP, length 120
23:35:58.900813 IP 192.168.43.195.8880 > 192.168.43.124.7772: UDP, length 120
23:35:58.903891 IP 192.168.43.124.8880 > 192.168.43.195.7771: UDP, length 120
23:35:58.948558 IP 192.168.43.195.8880 > 192.168.43.124.7772: UDP, length 120
23:35:58.953892 IP 192.168.43.124.8880 > 192.168.43.195.7771: UDP, length 120
23:35:59.003888 IP 192.168.43.124.8880 > 192.168.43.195.7771: UDP, length 120
23:35:59.022023 IP 192.168.43.195.8880 > 192.168.43.124.7772: UDP, length 120
23:35:59.049562 IP 192.168.43.195.8880 > 192.168.43.124.7772: UDP, length 120
23:35:59.053938 IP 192.168.43.124.8880 > 192.168.43.195.7771: UDP, length 120
23:35:59.098476 IP 192.168.43.195.8880 > 192.168.43.124.7772: UDP, length 120
23:35:59.103894 IP 192.168.43.124.8880 > 192.168.43.195.7771: UDP, length 120
23:35:59.148688 IP 192.168.43.195.8880 > 192.168.43.124.7772: UDP, length 120
23:35:59.153892 IP 192.168.43.124.8880 > 192.168.43.195.7771: UDP, length 120
23:35:59.203893 IP 192.168.43.124.8880 > 192.168.43.195.7771: UDP, length 120
23:35:59.214562 IP 192.168.43.195.8880 > 192.168.43.124.7772: UDP, length 120
23:35:59.248304 IP 192.168.43.195.8880 > 192.168.43.124.7772: UDP, length 120
23:35:59.253892 IP 192.168.43.124.8880 > 192.168.43.195.7771: UDP, length 120
23:35:59.298986 IP 192.168.43.195.8880 > 192.168.43.124.7772: UDP, length 120
23:35:59.303893 IP 192.168.43.124.8880 > 192.168.43.195.7771: UDP, length 120
23:35:59.348240 IP 192.168.43.195.8880 > 192.168.43.124.7772: UDP, length 120
23:35:59.353894 IP 192.168.43.124.8880 > 192.168.43.195.7771: UDP, length 120
23:35:59.400896 IP 192.168.43.195.8880 > 192.168.43.124.7772: UDP, length 120
23:35:59.403890 IP 192.168.43.124.8880 > 192.168.43.195.7771: UDP, length 120
23:35:59.450733 IP 192.168.43.195.8880 > 192.168.43.124.7772: UDP, length 120
23:35:59.453888 IP 192.168.43.124.8880 > 192.168.43.195.7771: UDP, length 120
23:35:59.503293 IP 192.168.43.195.8880 > 192.168.43.124.7772: UDP, length 120
23:35:59.503833 IP 192.168.43.124.8880 > 192.168.43.195.7771: UDP, length 120
23:35:59.548829 IP 192.168.43.195.8880 > 192.168.43.124.7772: UDP, length 120
23:35:59.553894 IP 192.168.43.124.8880 > 192.168.43.195.7771: UDP, length 120
23:35:59.603894 IP 192.168.43.124.8880 > 192.168.43.195.7771: UDP, length 120
23:35:59.612995 IP 192.168.43.195.8880 > 192.168.43.124.7772: UDP, length 120
23:35:59.649543 IP 192.168.43.195.8880 > 192.168.43.124.7772: UDP, length 120
23:35:59.653893 IP 192.168.43.124.8880 > 192.168.43.195.7771: UDP, length 120
23:35:59.703893 IP 192.168.43.124.8880 > 192.168.43.195.7771: UDP, length 120
23:35:59.712016 IP 192.168.43.195.8880 > 192.168.43.124.7772: UDP, length 120
23:35:59.753727 IP 192.168.43.195.8880 > 192.168.43.124.7772: UDP, length 120
23:35:59.753825 IP 192.168.43.124.8880 > 192.168.43.195.7771: UDP, length 120
23:35:59.798401 IP 192.168.43.195.8880 > 192.168.43.124.7772: UDP, length 120
23:35:59.803894 IP 192.168.43.124.8880 > 192.168.43.195.7771: UDP, length 120
23:35:59.849151 IP 192.168.43.195.8880 > 192.168.43.124.7772: UDP, length 120
23:35:59.853893 IP 192.168.43.124.8880 > 192.168.43.195.7771: UDP, length 120
23:35:59.903891 IP 192.168.43.124.8880 > 192.168.43.195.7771: UDP, length 120
23:35:59.908677 IP 192.168.43.195.8880 > 192.168.43.124.7772: UDP, length 120
23:35:59.948558 IP 192.168.43.195.8880 > 192.168.43.124.7772: UDP, length 120
23:35:59.953894 IP 192.168.43.124.8880 > 192.168.43.195.7771: UDP, length 120
23:35:59.998573 IP 192.168.43.195.8880 > 192.168.43.124.7772: UDP, length 120
23:36:00.003893 IP 192.168.43.124.8880 > 192.168.43.195.7771: UDP, length 120
23:36:00.048784 IP 192.168.43.195.8880 > 192.168.43.124.7772: UDP, length 120
23:36:00.053936 IP 192.168.43.124.8880 > 192.168.43.195.7771: UDP, length 120
23:36:00.103853 IP 192.168.43.124.8880 > 192.168.43.195.7771: UDP, length 120
23:36:00.108951 IP 192.168.43.195.8880 > 192.168.43.124.7772: UDP, length 120
23:36:00.148736 IP 192.168.43.195.8880 > 192.168.43.124.7772: UDP, length 120
23:36:00.153895 IP 192.168.43.124.8880 > 192.168.43.195.7771: UDP, length 120
23:36:00.199944 IP 192.168.43.195.8880 > 192.168.43.124.7772: UDP, length 120
23:36:00.203893 IP 192.168.43.124.8880 > 192.168.43.195.7771: UDP, length 120
23:36:00.249301 IP 192.168.43.195.8880 > 192.168.43.124.7772: UDP, length 120
23:36:00.253944 IP 192.168.43.124.8880 > 192.168.43.195.7771: UDP, length 120
23:36:00.298433 IP 192.168.43.195.8880 > 192.168.43.124.7772: UDP, length 120
23:36:00.303896 IP 192.168.43.124.8880 > 192.168.43.195.7771: UDP, length 120
23:36:00.352453 IP 192.168.43.195.8880 > 192.168.43.124.7772: UDP, length 120
23:36:00.353893 IP 192.168.43.124.8880 > 192.168.43.195.7771: UDP, length 120
23:36:00.400867 IP 192.168.43.195.8880 > 192.168.43.124.7772: UDP, length 120
23:36:00.403897 IP 192.168.43.124.8880 > 192.168.43.195.7771: UDP, length 120
23:36:00.453894 IP 192.168.43.124.8880 > 192.168.43.195.7771: UDP, length 120
23:36:00.455127 IP 192.168.43.195.8880 > 192.168.43.124.7772: UDP, length 120
23:36:00.498377 IP 192.168.43.195.8880 > 192.168.43.124.7772: UDP, length 120
23:36:00.503898 IP 192.168.43.124.8880 > 192.168.43.195.7771: UDP, length 120
23:36:00.545020 IP 192.168.43.195.8880 > 192.168.43.124.7772: UDP, length 120
23:36:00.553896 IP 192.168.43.124.8880 > 192.168.43.195.7771: UDP, length 120
23:36:00.599526 IP 192.168.43.195.8880 > 192.168.43.124.7772: UDP, length 120
23:36:00.603896 IP 192.168.43.124.8880 > 192.168.43.195.7771: UDP, length 120
23:36:00.648647 IP 192.168.43.195.8880 > 192.168.43.124.7772: UDP, length 120
23:36:00.653897 IP 192.168.43.124.8880 > 192.168.43.195.7771: UDP, length 120
23:36:00.701090 IP 192.168.43.195.8880 > 192.168.43.124.7772: UDP, length 120
23:36:00.703896 IP 192.168.43.124.8880 > 192.168.43.195.7771: UDP, length 120
23:36:00.753068 IP 192.168.43.195.8880 > 192.168.43.124.7772: UDP, length 120
23:36:00.753832 IP 192.168.43.124.8880 > 192.168.43.195.7771: UDP, length 120
23:36:00.802817 IP 192.168.43.195.8880 > 192.168.43.124.7772: UDP, length 120
23:36:00.803859 IP 192.168.43.124.8880 > 192.168.43.195.7771: UDP, length 120
23:36:00.853643 IP 192.168.43.195.8880 > 192.168.43.124.7772: UDP, length 120
23:36:00.853805 IP 192.168.43.124.8880 > 192.168.43.195.7771: UDP, length 120
23:36:00.902759 IP 192.168.43.195.8880 > 192.168.43.124.7772: UDP, length 120
23:36:00.903860 IP 192.168.43.124.8880 > 192.168.43.195.7771: UDP, length 120
23:36:00.953892 IP 192.168.43.124.8880 > 192.168.43.195.7771: UDP, length 120
23:36:00.956348 IP 192.168.43.195.8880 > 192.168.43.124.7772: UDP, length 120
23:36:01.002109 IP 192.168.43.195.8880 > 192.168.43.124.7772: UDP, length 120
23:36:01.003896 IP 192.168.43.124.8880 > 192.168.43.195.7771: UDP, length 120
23:36:01.053890 IP 192.168.43.124.8880 > 192.168.43.195.7771: UDP, length 120
23:36:01.061296 IP 192.168.43.195.8880 > 192.168.43.124.7772: UDP, length 120
23:36:01.100425 IP 192.168.43.195.8880 > 192.168.43.124.7772: UDP, length 120
23:36:01.103895 IP 192.168.43.124.8880 > 192.168.43.195.7771: UDP, length 120
23:36:01.153851 IP 192.168.43.195.8880 > 192.168.43.124.7772: UDP, length 120
23:36:01.153892 IP 192.168.43.124.8880 > 192.168.43.195.7771: UDP, length 120
23:36:01.200262 IP 192.168.43.195.8880 > 192.168.43.124.7772: UDP, length 120
23:36:01.203897 IP 192.168.43.124.8880 > 192.168.43.195.7771: UDP, length 120
23:36:01.253892 IP 192.168.43.124.8880 > 192.168.43.195.7771: UDP, length 120
23:36:01.255946 IP 192.168.43.195.8880 > 192.168.43.124.7772: UDP, length 120
23:36:01.300200 IP 192.168.43.195.8880 > 192.168.43.124.7772: UDP, length 120
23:36:01.303893 IP 192.168.43.124.8880 > 192.168.43.195.7771: UDP, length 120
23:36:01.353888 IP 192.168.43.124.8880 > 192.168.43.195.7771: UDP, length 120
23:36:01.366507 IP 192.168.43.195.8880 > 192.168.43.124.7772: UDP, length 120
23:36:01.401560 IP 192.168.43.195.8880 > 192.168.43.124.7772: UDP, length 120
23:36:01.403896 IP 192.168.43.124.8880 > 192.168.43.195.7771: UDP, length 120
23:36:01.450540 IP 192.168.43.195.8880 > 192.168.43.124.7772: UDP, length 120
23:36:01.453940 IP 192.168.43.124.8880 > 192.168.43.195.7771: UDP, length 120
23:36:01.500459 IP 192.168.43.195.8880 > 192.168.43.124.7772: UDP, length 120
23:36:01.503944 IP 192.168.43.124.8880 > 192.168.43.195.7771: UDP, length 120
23:36:01.553795 IP 192.168.43.195.8880 > 192.168.43.124.7772: UDP, length 120
23:36:01.553888 IP 192.168.43.124.8880 > 192.168.43.195.7771: UDP, length 120
23:36:01.597605 IP 192.168.43.195.8880 > 192.168.43.124.7772: UDP, length 120
23:36:01.603944 IP 192.168.43.124.8880 > 192.168.43.195.7771: UDP, length 120
23:36:01.652097 IP 192.168.43.195.8880 > 192.168.43.124.7772: UDP, length 120
23:36:01.653941 IP 192.168.43.124.8880 > 192.168.43.195.7771: UDP, length 120
23:36:01.702370 IP 192.168.43.195.8880 > 192.168.43.124.7772: UDP, length 120
23:36:01.703943 IP 192.168.43.124.8880 > 192.168.43.195.7771: UDP, length 120
23:36:01.753942 IP 192.168.43.124.8880 > 192.168.43.195.7771: UDP, length 120
23:36:01.755703 IP 192.168.43.195.8880 > 192.168.43.124.7772: UDP, length 120
23:36:01.802290 IP 192.168.43.195.8880 > 192.168.43.124.7772: UDP, length 120
23:36:01.803944 IP 192.168.43.124.8880 > 192.168.43.195.7771: UDP, length 120
23:36:01.853940 IP 192.168.43.124.8880 > 192.168.43.195.7771: UDP, length 120
23:36:01.860584 IP 192.168.43.195.8880 > 192.168.43.124.7772: UDP, length 120
23:36:01.903949 IP 192.168.43.124.8880 > 192.168.43.195.7771: UDP, length 120
23:36:01.904685 IP 192.168.43.195.8880 > 192.168.43.124.7772: UDP, length 120
23:36:01.953940 IP 192.168.43.124.8880 > 192.168.43.195.7771: UDP, length 120
23:36:01.957128 IP 192.168.43.195.8880 > 192.168.43.124.7772: UDP, length 120
23:36:02.002290 IP 192.168.43.195.8880 > 192.168.43.124.7772: UDP, length 120
23:36:02.004422 IP 192.168.43.124.8880 > 192.168.43.195.7771: UDP, length 120
23:36:02.050680 IP 192.168.43.195.8880 > 192.168.43.124.7772: UDP, length 120
23:36:02.053936 IP 192.168.43.124.8880 > 192.168.43.195.7771: UDP, length 120
23:36:02.101371 IP 192.168.43.195.8880 > 192.168.43.124.7772: UDP, length 120
23:36:02.103895 IP 192.168.43.124.8880 > 192.168.43.195.7771: UDP, length 120
23:36:02.151697 IP 192.168.43.195.8880 > 192.168.43.124.7772: UDP, length 120
23:36:02.153819 IP 192.168.43.124.8880 > 192.168.43.195.7771: UDP, length 120
23:36:02.201635 IP 192.168.43.195.8880 > 192.168.43.124.7772: UDP, length 120
23:36:02.203822 IP 192.168.43.124.8880 > 192.168.43.195.7771: UDP, length 120
23:36:02.252149 IP 192.168.43.195.8880 > 192.168.43.124.7772: UDP, length 120
23:36:02.253889 IP 192.168.43.124.8880 > 192.168.43.195.7771: UDP, length 120
23:36:02.303612 IP 192.168.43.195.8880 > 192.168.43.124.7772: UDP, length 120
23:36:02.303844 IP 192.168.43.124.8880 > 192.168.43.195.7771: UDP, length 120
23:36:02.350213 IP 192.168.43.195.8880 > 192.168.43.124.7772: UDP, length 120
23:36:02.353890 IP 192.168.43.124.8880 > 192.168.43.195.7771: UDP, length 120
23:36:02.401047 IP 192.168.43.195.8880 > 192.168.43.124.7772: UDP, length 120
23:36:02.403892 IP 192.168.43.124.8880 > 192.168.43.195.7771: UDP, length 120
23:36:02.450786 IP 192.168.43.195.8880 > 192.168.43.124.7772: UDP, length 120
23:36:02.453889 IP 192.168.43.124.8880 > 192.168.43.195.7771: UDP, length 120
23:36:02.501162 IP 192.168.43.195.8880 > 192.168.43.124.7772: UDP, length 120
23:36:02.503891 IP 192.168.43.124.8880 > 192.168.43.195.7771: UDP, length 120
23:36:02.552890 IP 192.168.43.195.8880 > 192.168.43.124.7772: UDP, length 120
23:36:02.553888 IP 192.168.43.124.8880 > 192.168.43.195.7771: UDP, length 120
23:36:02.600754 IP 192.168.43.195.8880 > 192.168.43.124.7772: UDP, length 120
23:36:02.603893 IP 192.168.43.124.8880 > 192.168.43.195.7771: UDP, length 120
23:36:02.652958 IP 192.168.43.195.8880 > 192.168.43.124.7772: UDP, length 120
23:36:02.653888 IP 192.168.43.124.8880 > 192.168.43.195.7771: UDP, length 120
23:36:02.701673 IP 192.168.43.195.8880 > 192.168.43.124.7772: UDP, length 120
23:36:02.703893 IP 192.168.43.124.8880 > 192.168.43.195.7771: UDP, length 120
23:36:02.749984 IP 192.168.43.195.8880 > 192.168.43.124.7772: UDP, length 120
23:36:02.753890 IP 192.168.43.124.8880 > 192.168.43.195.7771: UDP, length 120
23:36:02.803892 IP 192.168.43.124.8880 > 192.168.43.195.7771: UDP, length 120
23:36:02.808391 IP 192.168.43.195.8880 > 192.168.43.124.7772: UDP, length 120
23:36:02.849637 IP 192.168.43.195.8880 > 192.168.43.124.7772: UDP, length 120
23:36:02.853890 IP 192.168.43.124.8880 > 192.168.43.195.7771: UDP, length 120
23:36:02.899788 IP 192.168.43.195.8880 > 192.168.43.124.7772: UDP, length 120
23:36:02.903892 IP 192.168.43.124.8880 > 192.168.43.195.7771: UDP, length 120
23:36:02.948230 IP 192.168.43.195.8880 > 192.168.43.124.7772: UDP, length 120
23:36:02.953891 IP 192.168.43.124.8880 > 192.168.43.195.7771: UDP, length 120
23:36:03.003893 IP 192.168.43.124.8880 > 192.168.43.195.7771: UDP, length 120
23:36:03.012096 IP 192.168.43.195.8880 > 192.168.43.124.7772: UDP, length 120
23:36:03.049534 IP 192.168.43.195.8880 > 192.168.43.124.7772: UDP, length 120
23:36:03.053858 IP 192.168.43.124.8880 > 192.168.43.195.7771: UDP, length 120
23:36:03.095715 IP 192.168.43.195.8880 > 192.168.43.124.7772: UDP, length 120
23:36:03.103897 IP 192.168.43.124.8880 > 192.168.43.195.7771: UDP, length 120
23:36:03.153894 IP 192.168.43.124.8880 > 192.168.43.195.7771: UDP, length 120
23:36:03.160816 IP 192.168.43.195.8880 > 192.168.43.124.7772: UDP, length 120
23:36:03.198494 IP 192.168.43.195.8880 > 192.168.43.124.7772: UDP, length 120
23:36:03.204072 IP 192.168.43.124.8880 > 192.168.43.195.7771: UDP, length 120
23:36:03.247989 IP 192.168.43.195.8880 > 192.168.43.124.7772: UDP, length 120
23:36:03.253894 IP 192.168.43.124.8880 > 192.168.43.195.7771: UDP, length 120
23:36:03.303891 IP 192.168.43.124.8880 > 192.168.43.195.7771: UDP, length 120
23:36:03.306431 IP 192.168.43.195.8880 > 192.168.43.124.7772: UDP, length 120
23:36:03.348570 IP 192.168.43.195.8880 > 192.168.43.124.7772: UDP, length 120
23:36:03.353891 IP 192.168.43.124.8880 > 192.168.43.195.7771: UDP, length 120
23:36:03.398603 IP 192.168.43.195.8880 > 192.168.43.124.7772: UDP, length 120
23:36:03.403894 IP 192.168.43.124.8880 > 192.168.43.195.7771: UDP, length 120
23:36:03.449766 IP 192.168.43.195.8880 > 192.168.43.124.7772: UDP, length 120
23:36:03.453944 IP 192.168.43.124.8880 > 192.168.43.195.7771: UDP, length 120
23:36:03.500826 IP 192.168.43.195.8880 > 192.168.43.124.7772: UDP, length 120
23:36:03.503897 IP 192.168.43.124.8880 > 192.168.43.195.7771: UDP, length 120
23:36:03.548461 IP 192.168.43.195.8880 > 192.168.43.124.7772: UDP, length 120
23:36:03.553894 IP 192.168.43.124.8880 > 192.168.43.195.7771: UDP, length 120
23:36:03.598550 IP 192.168.43.195.8880 > 192.168.43.124.7772: UDP, length 120
23:36:03.603891 IP 192.168.43.124.8880 > 192.168.43.195.7771: UDP, length 120
23:36:03.653709 IP 192.168.43.195.8880 > 192.168.43.124.7772: UDP, length 120
23:36:03.653811 IP 192.168.43.124.8880 > 192.168.43.195.7771: UDP, length 120
23:36:03.700410 IP 192.168.43.195.8880 > 192.168.43.124.7772: UDP, length 120
23:36:03.703894 IP 192.168.43.124.8880 > 192.168.43.195.7771: UDP, length 120
23:36:03.748874 IP 192.168.43.195.8880 > 192.168.43.124.7772: UDP, length 120
23:36:03.753894 IP 192.168.43.124.8880 > 192.168.43.195.7771: UDP, length 120
23:36:03.803893 IP 192.168.43.124.8880 > 192.168.43.195.7771: UDP, length 120
23:36:03.816090 IP 192.168.43.195.8880 > 192.168.43.124.7772: UDP, length 120
23:36:03.848535 IP 192.168.43.195.8880 > 192.168.43.124.7772: UDP, length 120
23:36:03.853891 IP 192.168.43.124.8880 > 192.168.43.195.7771: UDP, length 120
23:36:03.903894 IP 192.168.43.124.8880 > 192.168.43.195.7771: UDP, length 120
23:36:03.953892 IP 192.168.43.124.8880 > 192.168.43.195.7771: UDP, length 120
23:36:03.955662 IP 192.168.43.195.8880 > 192.168.43.124.7772: UDP, length 120
23:36:03.957473 IP 192.168.43.195.8880 > 192.168.43.124.7772: UDP, length 120
23:36:04.003894 IP 192.168.43.124.8880 > 192.168.43.195.7771: UDP, length 120
23:36:04.016528 IP 192.168.43.195.8880 > 192.168.43.124.7772: UDP, length 120
23:36:04.049923 IP 192.168.43.195.8880 > 192.168.43.124.7772: UDP, length 120
23:36:04.053893 IP 192.168.43.124.8880 > 192.168.43.195.7771: UDP, length 120
23:36:04.098367 IP 192.168.43.195.8880 > 192.168.43.124.7772: UDP, length 120
23:36:04.103892 IP 192.168.43.124.8880 > 192.168.43.195.7771: UDP, length 120
23:36:04.148238 IP 192.168.43.195.8880 > 192.168.43.124.7772: UDP, length 120
23:36:04.153890 IP 192.168.43.124.8880 > 192.168.43.195.7771: UDP, length 120
23:36:04.203837 IP 192.168.43.124.8880 > 192.168.43.195.7771: UDP, length 120
23:36:04.211758 IP 192.168.43.195.8880 > 192.168.43.124.7772: UDP, length 120
23:36:04.250344 IP 192.168.43.195.8880 > 192.168.43.124.7772: UDP, length 120
23:36:04.253894 IP 192.168.43.124.8880 > 192.168.43.195.7771: UDP, length 120
23:36:04.298983 IP 192.168.43.195.8880 > 192.168.43.124.7772: UDP, length 120
23:36:04.303857 IP 192.168.43.124.8880 > 192.168.43.195.7771: UDP, length 120
23:36:04.349330 IP 192.168.43.195.8880 > 192.168.43.124.7772: UDP, length 120
23:36:04.353892 IP 192.168.43.124.8880 > 192.168.43.195.7771: UDP, length 120
23:36:04.398263 IP 192.168.43.195.8880 > 192.168.43.124.7772: UDP, length 120
23:36:04.403846 IP 192.168.43.124.8880 > 192.168.43.195.7771: UDP, length 120
23:36:04.448660 IP 192.168.43.195.8880 > 192.168.43.124.7772: UDP, length 120
23:36:04.453890 IP 192.168.43.124.8880 > 192.168.43.195.7771: UDP, length 120
23:36:04.499394 IP 192.168.43.195.8880 > 192.168.43.124.7772: UDP, length 120
23:36:04.503839 IP 192.168.43.124.8880 > 192.168.43.195.7771: UDP, length 120
23:36:04.553892 IP 192.168.43.124.8880 > 192.168.43.195.7771: UDP, length 120
23:36:04.561539 IP 192.168.43.195.8880 > 192.168.43.124.7772: UDP, length 120
23:36:04.600055 IP 192.168.43.195.8880 > 192.168.43.124.7772: UDP, length 120
23:36:04.603840 IP 192.168.43.124.8880 > 192.168.43.195.7771: UDP, length 120
23:36:04.650319 IP 192.168.43.195.8880 > 192.168.43.124.7772: UDP, length 120
23:36:04.653890 IP 192.168.43.124.8880 > 192.168.43.195.7771: UDP, length 120
23:36:04.703812 IP 192.168.43.124.8880 > 192.168.43.195.7771: UDP, length 120
23:36:04.704688 IP 192.168.43.195.8880 > 192.168.43.124.7772: UDP, length 120
23:36:04.753890 IP 192.168.43.124.8880 > 192.168.43.195.7771: UDP, length 120
23:36:04.758901 IP 192.168.43.195.8880 > 192.168.43.124.7772: UDP, length 120
23:36:04.798383 IP 192.168.43.195.8880 > 192.168.43.124.7772: UDP, length 120
23:36:04.803896 IP 192.168.43.124.8880 > 192.168.43.195.7771: UDP, length 120
23:36:04.850600 IP 192.168.43.195.8880 > 192.168.43.124.7772: UDP, length 120
23:36:04.853889 IP 192.168.43.124.8880 > 192.168.43.195.7771: UDP, length 120
23:36:04.898716 IP 192.168.43.195.8880 > 192.168.43.124.7772: UDP, length 120
23:36:04.903892 IP 192.168.43.124.8880 > 192.168.43.195.7771: UDP, length 120
23:36:04.953892 IP 192.168.43.124.8880 > 192.168.43.195.7771: UDP, length 120
23:36:04.958123 IP 192.168.43.195.8880 > 192.168.43.124.7772: UDP, length 120
23:36:05.001757 IP 192.168.43.195.8880 > 192.168.43.124.7772: UDP, length 120
23:36:05.003891 IP 192.168.43.124.8880 > 192.168.43.195.7771: UDP, length 120
23:36:05.053931 IP 192.168.43.195.8880 > 192.168.43.124.7772: UDP, length 120
23:36:05.053968 IP 192.168.43.124.8880 > 192.168.43.195.7771: UDP, length 120
23:36:05.103893 IP 192.168.43.124.8880 > 192.168.43.195.7771: UDP, length 120
23:36:05.109780 IP 192.168.43.195.8880 > 192.168.43.124.7772: UDP, length 120
23:36:05.153001 IP 192.168.43.195.8880 > 192.168.43.124.7772: UDP, length 120
23:36:05.153888 IP 192.168.43.124.8880 > 192.168.43.195.7771: UDP, length 120
23:36:05.198410 IP 192.168.43.195.8880 > 192.168.43.124.7772: UDP, length 120
23:36:05.203889 IP 192.168.43.124.8880 > 192.168.43.195.7771: UDP, length 120
23:36:05.253941 IP 192.168.43.124.8880 > 192.168.43.195.7771: UDP, length 120
23:36:05.262640 IP 192.168.43.195.8880 > 192.168.43.124.7772: UDP, length 120
23:36:05.298997 IP 192.168.43.195.8880 > 192.168.43.124.7772: UDP, length 120
23:36:05.303894 IP 192.168.43.124.8880 > 192.168.43.195.7771: UDP, length 120
23:36:05.347965 IP 192.168.43.195.8880 > 192.168.43.124.7772: UDP, length 120
23:36:05.354394 IP 192.168.43.124.8880 > 192.168.43.195.7771: UDP, length 120
23:36:05.403890 IP 192.168.43.124.8880 > 192.168.43.195.7771: UDP, length 120
23:36:05.418711 IP 192.168.43.195.8880 > 192.168.43.124.7772: UDP, length 120
23:36:05.448606 IP 192.168.43.195.8880 > 192.168.43.124.7772: UDP, length 120
23:36:05.453891 IP 192.168.43.124.8880 > 192.168.43.195.7771: UDP, length 120
23:36:05.498135 IP 192.168.43.195.8880 > 192.168.43.124.7772: UDP, length 120
23:36:05.503891 IP 192.168.43.124.8880 > 192.168.43.195.7771: UDP, length 120
23:36:05.548268 IP 192.168.43.195.8880 > 192.168.43.124.7772: UDP, length 120
23:36:05.553891 IP 192.168.43.124.8880 > 192.168.43.195.7771: UDP, length 120
23:36:05.603889 IP 192.168.43.124.8880 > 192.168.43.195.7771: UDP, length 120
23:36:05.610302 IP 192.168.43.195.8880 > 192.168.43.124.7772: UDP, length 120
23:36:05.648358 IP 192.168.43.195.8880 > 192.168.43.124.7772: UDP, length 120
23:36:05.653888 IP 192.168.43.124.8880 > 192.168.43.195.7771: UDP, length 120
23:36:05.698706 IP 192.168.43.195.8880 > 192.168.43.124.7772: UDP, length 120
23:36:05.703891 IP 192.168.43.124.8880 > 192.168.43.195.7771: UDP, length 120
23:36:05.749739 IP 192.168.43.195.8880 > 192.168.43.124.7772: UDP, length 120
23:36:05.753888 IP 192.168.43.124.8880 > 192.168.43.195.7771: UDP, length 120
23:36:05.803889 IP 192.168.43.124.8880 > 192.168.43.195.7771: UDP, length 120
23:36:05.808389 IP 192.168.43.195.8880 > 192.168.43.124.7772: UDP, length 120
23:36:05.853887 IP 192.168.43.124.8880 > 192.168.43.195.7771: UDP, length 120
23:36:05.858874 IP 192.168.43.195.8880 > 192.168.43.124.7772: UDP, length 120
23:36:05.898213 IP 192.168.43.195.8880 > 192.168.43.124.7772: UDP, length 120
23:36:05.903892 IP 192.168.43.124.8880 > 192.168.43.195.7771: UDP, length 120
23:36:05.953892 IP 192.168.43.124.8880 > 192.168.43.195.7771: UDP, length 120
23:36:05.961189 IP 192.168.43.195.8880 > 192.168.43.124.7772: UDP, length 120
23:36:05.998636 IP 192.168.43.195.8880 > 192.168.43.124.7772: UDP, length 120
23:36:06.003892 IP 192.168.43.124.8880 > 192.168.43.195.7771: UDP, length 120
23:36:06.053891 IP 192.168.43.124.8880 > 192.168.43.195.7771: UDP, length 120
23:36:06.057431 IP 192.168.43.195.8880 > 192.168.43.124.7772: UDP, length 120
23:36:06.100409 IP 192.168.43.195.8880 > 192.168.43.124.7772: UDP, length 120
23:36:06.103891 IP 192.168.43.124.8880 > 192.168.43.195.7771: UDP, length 120
23:36:06.153889 IP 192.168.43.124.8880 > 192.168.43.195.7771: UDP, length 120
23:36:06.158484 IP 192.168.43.195.8880 > 192.168.43.124.7772: UDP, length 120
23:36:06.199904 IP 192.168.43.195.8880 > 192.168.43.124.7772: UDP, length 120
23:36:06.203893 IP 192.168.43.124.8880 > 192.168.43.195.7771: UDP, length 120
23:36:06.248191 IP 192.168.43.195.8880 > 192.168.43.124.7772: UDP, length 120
23:36:06.253892 IP 192.168.43.124.8880 > 192.168.43.195.7771: UDP, length 120
23:36:06.303893 IP 192.168.43.124.8880 > 192.168.43.195.7771: UDP, length 120
23:36:06.308462 IP 192.168.43.195.8880 > 192.168.43.124.7772: UDP, length 120
23:36:06.348442 IP 192.168.43.195.8880 > 192.168.43.124.7772: UDP, length 120
23:36:06.353890 IP 192.168.43.124.8880 > 192.168.43.195.7771: UDP, length 120
23:36:06.397927 IP 192.168.43.195.8880 > 192.168.43.124.7772: UDP, length 120
23:36:06.403890 IP 192.168.43.124.8880 > 192.168.43.195.7771: UDP, length 120
23:36:06.453891 IP 192.168.43.124.8880 > 192.168.43.195.7771: UDP, length 120
23:36:06.465039 IP 192.168.43.195.8880 > 192.168.43.124.7772: UDP, length 120
23:36:06.498167 IP 192.168.43.195.8880 > 192.168.43.124.7772: UDP, length 120
23:36:06.503891 IP 192.168.43.124.8880 > 192.168.43.195.7771: UDP, length 120
23:36:06.548164 IP 192.168.43.195.8880 > 192.168.43.124.7772: UDP, length 120
23:36:06.553891 IP 192.168.43.124.8880 > 192.168.43.195.7771: UDP, length 120
23:36:06.603919 IP 192.168.43.124.8880 > 192.168.43.195.7771: UDP, length 120
23:36:06.619536 IP 192.168.43.195.8880 > 192.168.43.124.7772: UDP, length 120
23:36:06.649397 IP 192.168.43.195.8880 > 192.168.43.124.7772: UDP, length 120
23:36:06.653921 IP 192.168.43.124.8880 > 192.168.43.195.7771: UDP, length 120
23:36:06.703949 IP 192.168.43.124.8880 > 192.168.43.195.7771: UDP, length 120
23:36:06.721992 IP 192.168.43.195.8880 > 192.168.43.124.7772: UDP, length 120
23:36:06.749856 IP 192.168.43.195.8880 > 192.168.43.124.7772: UDP, length 120
23:36:06.753943 IP 192.168.43.124.8880 > 192.168.43.195.7771: UDP, length 120
23:36:06.803943 IP 192.168.43.124.8880 > 192.168.43.195.7771: UDP, length 120
23:36:06.808558 IP 192.168.43.195.8880 > 192.168.43.124.7772: UDP, length 120
23:36:06.851865 IP 192.168.43.195.8880 > 192.168.43.124.7772: UDP, length 120
23:36:06.853939 IP 192.168.43.124.8880 > 192.168.43.195.7771: UDP, length 120
23:36:06.899631 IP 192.168.43.195.8880 > 192.168.43.124.7772: UDP, length 120
23:36:06.903942 IP 192.168.43.124.8880 > 192.168.43.195.7771: UDP, length 120
23:36:06.948548 IP 192.168.43.195.8880 > 192.168.43.124.7772: UDP, length 120
23:36:06.953943 IP 192.168.43.124.8880 > 192.168.43.195.7771: UDP, length 120
23:36:06.998519 IP 192.168.43.195.8880 > 192.168.43.124.7772: UDP, length 120
23:36:07.003944 IP 192.168.43.124.8880 > 192.168.43.195.7771: UDP, length 120
23:36:07.049141 IP 192.168.43.195.8880 > 192.168.43.124.7772: UDP, length 120
23:36:07.053941 IP 192.168.43.124.8880 > 192.168.43.195.7771: UDP, length 120
23:36:07.099434 IP 192.168.43.195.8880 > 192.168.43.124.7772: UDP, length 120
23:36:07.104013 IP 192.168.43.124.8880 > 192.168.43.195.7771: UDP, length 120
23:36:07.153894 IP 192.168.43.124.8880 > 192.168.43.195.7771: UDP, length 120
23:36:07.159906 IP 192.168.43.195.8880 > 192.168.43.124.7772: UDP, length 120
23:36:07.201674 IP 192.168.43.195.8880 > 192.168.43.124.7772: UDP, length 120
23:36:07.203894 IP 192.168.43.124.8880 > 192.168.43.195.7771: UDP, length 120
23:36:07.252111 IP 192.168.43.195.8880 > 192.168.43.124.7772: UDP, length 120
23:36:07.253825 IP 192.168.43.124.8880 > 192.168.43.195.7771: UDP, length 120
23:36:07.303833 IP 192.168.43.124.8880 > 192.168.43.195.7771: UDP, length 120
23:36:07.304688 IP 192.168.43.195.8880 > 192.168.43.124.7772: UDP, length 120
23:36:07.353893 IP 192.168.43.124.8880 > 192.168.43.195.7771: UDP, length 120
23:36:07.359642 IP 192.168.43.195.8880 > 192.168.43.124.7772: UDP, length 120
23:36:07.403891 IP 192.168.43.124.8880 > 192.168.43.195.7771: UDP, length 120
23:36:07.410123 IP 192.168.43.195.8880 > 192.168.43.124.7772: UDP, length 120
23:36:07.448201 IP 192.168.43.195.8880 > 192.168.43.124.7772: UDP, length 120
23:36:07.453894 IP 192.168.43.124.8880 > 192.168.43.195.7771: UDP, length 120
23:36:07.498194 IP 192.168.43.195.8880 > 192.168.43.124.7772: UDP, length 120
23:36:07.503894 IP 192.168.43.124.8880 > 192.168.43.195.7771: UDP, length 120
23:36:07.548726 IP 192.168.43.195.8880 > 192.168.43.124.7772: UDP, length 120
23:36:07.553894 IP 192.168.43.124.8880 > 192.168.43.195.7771: UDP, length 120
23:36:07.598349 IP 192.168.43.195.8880 > 192.168.43.124.7772: UDP, length 120
23:36:07.603893 IP 192.168.43.124.8880 > 192.168.43.195.7771: UDP, length 120
23:36:07.648781 IP 192.168.43.195.8880 > 192.168.43.124.7772: UDP, length 120
23:36:07.653894 IP 192.168.43.124.8880 > 192.168.43.195.7771: UDP, length 120
23:36:07.703893 IP 192.168.43.124.8880 > 192.168.43.195.7771: UDP, length 120
23:36:07.713944 IP 192.168.43.195.8880 > 192.168.43.124.7772: UDP, length 120
23:36:07.753892 IP 192.168.43.124.8880 > 192.168.43.195.7771: UDP, length 120
23:36:07.767617 IP 192.168.43.195.8880 > 192.168.43.124.7772: UDP, length 120
23:36:07.798562 IP 192.168.43.195.8880 > 192.168.43.124.7772: UDP, length 120
23:36:07.803895 IP 192.168.43.124.8880 > 192.168.43.195.7771: UDP, length 120
23:36:07.848650 IP 192.168.43.195.8880 > 192.168.43.124.7772: UDP, length 120
23:36:07.853833 IP 192.168.43.124.8880 > 192.168.43.195.7771: UDP, length 120
23:36:07.901426 IP 192.168.43.195.8880 > 192.168.43.124.7772: UDP, length 120
23:36:07.903892 IP 192.168.43.124.8880 > 192.168.43.195.7771: UDP, length 120
23:36:07.951369 IP 192.168.43.195.8880 > 192.168.43.124.7772: UDP, length 120
23:36:07.953890 IP 192.168.43.124.8880 > 192.168.43.195.7771: UDP, length 120
23:36:08.001812 IP 192.168.43.195.8880 > 192.168.43.124.7772: UDP, length 120
23:36:08.003893 IP 192.168.43.124.8880 > 192.168.43.195.7771: UDP, length 120
23:36:08.053892 IP 192.168.43.124.8880 > 192.168.43.195.7771: UDP, length 120
23:36:08.055712 IP 192.168.43.195.8880 > 192.168.43.124.7772: UDP, length 120
23:36:08.103892 IP 192.168.43.124.8880 > 192.168.43.195.7771: UDP, length 120
23:36:08.104743 IP 192.168.43.195.8880 > 192.168.43.124.7772: UDP, length 120
23:36:08.148122 IP 192.168.43.195.8880 > 192.168.43.124.7772: UDP, length 120
23:36:08.153893 IP 192.168.43.124.8880 > 192.168.43.195.7771: UDP, length 120
23:36:08.203892 IP 192.168.43.124.8880 > 192.168.43.195.7771: UDP, length 120
23:36:08.209335 IP 192.168.43.195.8880 > 192.168.43.124.7772: UDP, length 120
23:36:08.248359 IP 192.168.43.195.8880 > 192.168.43.124.7772: UDP, length 120
23:36:08.253899 IP 192.168.43.124.8880 > 192.168.43.195.7771: UDP, length 120
23:36:08.303897 IP 192.168.43.124.8880 > 192.168.43.195.7771: UDP, length 120
23:36:08.309030 IP 192.168.43.195.8880 > 192.168.43.124.7772: UDP, length 120
23:36:08.348395 IP 192.168.43.195.8880 > 192.168.43.124.7772: UDP, length 120
23:36:08.353898 IP 192.168.43.124.8880 > 192.168.43.195.7771: UDP, length 120
23:36:08.398130 IP 192.168.43.195.8880 > 192.168.43.124.7772: UDP, length 120
23:36:08.403894 IP 192.168.43.124.8880 > 192.168.43.195.7771: UDP, length 120
23:36:08.449440 IP 192.168.43.195.8880 > 192.168.43.124.7772: UDP, length 120
23:36:08.453895 IP 192.168.43.124.8880 > 192.168.43.195.7771: UDP, length 120
23:36:08.498051 IP 192.168.43.195.8880 > 192.168.43.124.7772: UDP, length 120
23:36:08.503898 IP 192.168.43.124.8880 > 192.168.43.195.7771: UDP, length 120
23:36:08.553898 IP 192.168.43.124.8880 > 192.168.43.195.7771: UDP, length 120
23:36:08.557775 IP 192.168.43.195.8880 > 192.168.43.124.7772: UDP, length 120
23:36:08.602780 IP 192.168.43.195.8880 > 192.168.43.124.7772: UDP, length 120
23:36:08.603854 IP 192.168.43.124.8880 > 192.168.43.195.7771: UDP, length 120
23:36:08.648300 IP 192.168.43.195.8880 > 192.168.43.124.7772: UDP, length 120
23:36:08.653893 IP 192.168.43.124.8880 > 192.168.43.195.7771: UDP, length 120
23:36:08.699664 IP 192.168.43.195.8880 > 192.168.43.124.7772: UDP, length 120
23:36:08.703943 IP 192.168.43.124.8880 > 192.168.43.195.7771: UDP, length 120
23:36:08.749167 IP 192.168.43.195.8880 > 192.168.43.124.7772: UDP, length 120
23:36:08.754664 IP 192.168.43.124.8880 > 192.168.43.195.7771: UDP, length 120
23:36:08.802043 IP 192.168.43.195.8880 > 192.168.43.124.7772: UDP, length 120
23:36:08.803945 IP 192.168.43.124.8880 > 192.168.43.195.7771: UDP, length 120
23:36:08.849490 IP 192.168.43.195.8880 > 192.168.43.124.7772: UDP, length 120
23:36:08.853997 IP 192.168.43.124.8880 > 192.168.43.195.7771: UDP, length 120
23:36:08.903940 IP 192.168.43.124.8880 > 192.168.43.195.7771: UDP, length 120
23:36:08.910147 IP 192.168.43.195.8880 > 192.168.43.124.7772: UDP, length 120
23:36:08.948655 IP 192.168.43.195.8880 > 192.168.43.124.7772: UDP, length 120
23:36:08.954663 IP 192.168.43.124.8880 > 192.168.43.195.7771: UDP, length 120
23:36:09.001881 IP 192.168.43.195.8880 > 192.168.43.124.7772: UDP, length 120
23:36:09.004660 IP 192.168.43.124.8880 > 192.168.43.195.7771: UDP, length 120
23:36:09.048066 IP 192.168.43.195.8880 > 192.168.43.124.7772: UDP, length 120
23:36:09.054109 IP 192.168.43.124.8880 > 192.168.43.195.7771: UDP, length 120
23:36:09.103895 IP 192.168.43.124.8880 > 192.168.43.195.7771: UDP, length 120
23:36:09.107694 IP 192.168.43.195.8880 > 192.168.43.124.7772: UDP, length 120
23:36:09.148736 IP 192.168.43.195.8880 > 192.168.43.124.7772: UDP, length 120
23:36:09.153893 IP 192.168.43.124.8880 > 192.168.43.195.7771: UDP, length 120
23:36:09.198285 IP 192.168.43.195.8880 > 192.168.43.124.7772: UDP, length 120
23:36:09.203893 IP 192.168.43.124.8880 > 192.168.43.195.7771: UDP, length 120
23:36:09.249817 IP 192.168.43.195.8880 > 192.168.43.124.7772: UDP, length 120
23:36:09.253919 IP 192.168.43.124.8880 > 192.168.43.195.7771: UDP, length 120
23:36:09.300569 IP 192.168.43.195.8880 > 192.168.43.124.7772: UDP, length 120
23:36:09.303923 IP 192.168.43.124.8880 > 192.168.43.195.7771: UDP, length 120
23:36:09.351297 IP 192.168.43.195.8880 > 192.168.43.124.7772: UDP, length 120
23:36:09.353919 IP 192.168.43.124.8880 > 192.168.43.195.7771: UDP, length 120
23:36:09.402695 IP 192.168.43.195.8880 > 192.168.43.124.7772: UDP, length 120
23:36:09.403881 IP 192.168.43.124.8880 > 192.168.43.195.7771: UDP, length 120
23:36:09.516290 IP 192.168.43.124.8880 > 192.168.43.195.7771: UDP, length 120
23:36:09.516438 IP 192.168.43.124.8880 > 192.168.43.195.7771: UDP, length 120
23:36:09.517645 IP 192.168.43.195.8880 > 192.168.43.124.7772: UDP, length 120
23:36:09.517657 IP 192.168.43.195.8880 > 192.168.43.124.7772: UDP, length 120
23:36:09.553854 IP 192.168.43.124.8880 > 192.168.43.195.7771: UDP, length 120
23:36:09.555516 IP 192.168.43.195.8880 > 192.168.43.124.7772: UDP, length 120
23:36:09.602027 IP 192.168.43.195.8880 > 192.168.43.124.7772: UDP, length 120
23:36:09.603893 IP 192.168.43.124.8880 > 192.168.43.195.7771: UDP, length 120
23:36:09.653856 IP 192.168.43.124.8880 > 192.168.43.195.7771: UDP, length 120
23:36:09.661386 IP 192.168.43.195.8880 > 192.168.43.124.7772: UDP, length 120
23:36:09.698235 IP 192.168.43.195.8880 > 192.168.43.124.7772: UDP, length 120
23:36:09.703893 IP 192.168.43.124.8880 > 192.168.43.195.7771: UDP, length 120
23:36:09.867572 IP 192.168.43.124.8880 > 192.168.43.195.7771: UDP, length 120
23:36:09.867723 IP 192.168.43.124.8880 > 192.168.43.195.7771: UDP, length 120
23:36:09.867727 IP 192.168.43.124.8880 > 192.168.43.195.7771: UDP, length 120
23:36:09.869009 IP 192.168.43.195.8880 > 192.168.43.124.7772: UDP, length 120
23:36:09.869023 IP 192.168.43.195.8880 > 192.168.43.124.7772: UDP, length 120
23:36:09.869025 IP 192.168.43.195.8880 > 192.168.43.124.7772: UDP, length 120
23:36:09.899967 IP 192.168.43.195.8880 > 192.168.43.124.7772: UDP, length 120
23:36:09.903890 IP 192.168.43.124.8880 > 192.168.43.195.7771: UDP, length 120
23:36:09.948953 IP 192.168.43.195.8880 > 192.168.43.124.7772: UDP, length 120
23:36:09.953888 IP 192.168.43.124.8880 > 192.168.43.195.7771: UDP, length 120
23:36:09.999399 IP 192.168.43.195.8880 > 192.168.43.124.7772: UDP, length 120
23:36:10.003894 IP 192.168.43.124.8880 > 192.168.43.195.7771: UDP, length 120
23:36:10.053889 IP 192.168.43.124.8880 > 192.168.43.195.7771: UDP, length 120
23:36:10.070646 IP 192.168.43.195.8880 > 192.168.43.124.7772: UDP, length 120
23:36:10.218068 IP 192.168.43.124.8880 > 192.168.43.195.7771: UDP, length 120
23:36:10.218218 IP 192.168.43.124.8880 > 192.168.43.195.7771: UDP, length 120
23:36:10.218222 IP 192.168.43.124.8880 > 192.168.43.195.7771: UDP, length 120
23:36:10.221066 IP 192.168.43.195.8880 > 192.168.43.124.7772: UDP, length 120
23:36:10.221080 IP 192.168.43.195.8880 > 192.168.43.124.7772: UDP, length 120
23:36:10.221081 IP 192.168.43.195.8880 > 192.168.43.124.7772: UDP, length 120
23:36:10.253887 IP 192.168.43.124.8880 > 192.168.43.195.7771: UDP, length 120
23:36:10.257898 IP 192.168.43.195.8880 > 192.168.43.124.7772: UDP, length 120
23:36:10.303854 IP 192.168.43.124.8880 > 192.168.43.195.7771: UDP, length 120
23:36:10.353888 IP 192.168.43.124.8880 > 192.168.43.195.7771: UDP, length 120
23:36:10.376047 IP 192.168.43.195.8880 > 192.168.43.124.7772: UDP, length 120
23:36:10.376061 IP 192.168.43.195.8880 > 192.168.43.124.7772: UDP, length 120
23:36:10.398957 IP 192.168.43.195.8880 > 192.168.43.124.7772: UDP, length 120
23:36:10.403854 IP 192.168.43.124.8880 > 192.168.43.195.7771: UDP, length 120
23:36:10.566030 IP 192.168.43.124.8880 > 192.168.43.195.7771: UDP, length 120
23:36:10.566182 IP 192.168.43.124.8880 > 192.168.43.195.7771: UDP, length 120
23:36:10.566186 IP 192.168.43.124.8880 > 192.168.43.195.7771: UDP, length 120
23:36:10.567488 IP 192.168.43.195.8880 > 192.168.43.124.7772: UDP, length 120
23:36:10.567502 IP 192.168.43.195.8880 > 192.168.43.124.7772: UDP, length 120
23:36:10.567504 IP 192.168.43.195.8880 > 192.168.43.124.7772: UDP, length 120
23:36:10.603376 IP 192.168.43.195.8880 > 192.168.43.124.7772: UDP, length 120
23:36:10.603829 IP 192.168.43.124.8880 > 192.168.43.195.7771: UDP, length 120
23:36:10.649312 IP 192.168.43.195.8880 > 192.168.43.124.7772: UDP, length 120
23:36:10.653890 IP 192.168.43.124.8880 > 192.168.43.195.7771: UDP, length 120
23:36:10.698430 IP 192.168.43.195.8880 > 192.168.43.124.7772: UDP, length 120
23:36:10.703893 IP 192.168.43.124.8880 > 192.168.43.195.7771: UDP, length 120
23:36:10.750029 IP 192.168.43.195.8880 > 192.168.43.124.7772: UDP, length 120
23:36:10.753893 IP 192.168.43.124.8880 > 192.168.43.195.7771: UDP, length 120
23:36:10.914064 IP 192.168.43.124.8880 > 192.168.43.195.7771: UDP, length 120
23:36:10.914213 IP 192.168.43.124.8880 > 192.168.43.195.7771: UDP, length 120
23:36:10.914220 IP 192.168.43.124.8880 > 192.168.43.195.7771: UDP, length 120
23:36:10.915511 IP 192.168.43.195.8880 > 192.168.43.124.7772: UDP, length 120
23:36:10.915528 IP 192.168.43.195.8880 > 192.168.43.124.7772: UDP, length 120
23:36:10.915530 IP 192.168.43.195.8880 > 192.168.43.124.7772: UDP, length 120
23:36:10.948094 IP 192.168.43.195.8880 > 192.168.43.124.7772: UDP, length 120
23:36:10.953895 IP 192.168.43.124.8880 > 192.168.43.195.7771: UDP, length 120
23:36:10.998379 IP 192.168.43.195.8880 > 192.168.43.124.7772: UDP, length 120
23:36:11.003894 IP 192.168.43.124.8880 > 192.168.43.195.7771: UDP, length 120
23:36:11.049617 IP 192.168.43.195.8880 > 192.168.43.124.7772: UDP, length 120
23:36:11.053888 IP 192.168.43.124.8880 > 192.168.43.195.7771: UDP, length 120
23:36:11.103855 IP 192.168.43.124.8880 > 192.168.43.195.7771: UDP, length 120
23:36:11.108128 IP 192.168.43.195.8880 > 192.168.43.124.7772: UDP, length 120
23:36:11.262072 IP 192.168.43.124.8880 > 192.168.43.195.7771: UDP, length 120
23:36:11.262223 IP 192.168.43.124.8880 > 192.168.43.195.7771: UDP, length 120
23:36:11.262227 IP 192.168.43.124.8880 > 192.168.43.195.7771: UDP, length 120
23:36:11.263520 IP 192.168.43.195.8880 > 192.168.43.124.7772: UDP, length 120
23:36:11.263536 IP 192.168.43.195.8880 > 192.168.43.124.7772: UDP, length 120
23:36:11.263538 IP 192.168.43.195.8880 > 192.168.43.124.7772: UDP, length 120
23:36:11.301939 IP 192.168.43.195.8880 > 192.168.43.124.7772: UDP, length 120
23:36:11.303892 IP 192.168.43.124.8880 > 192.168.43.195.7771: UDP, length 120
23:36:11.348096 IP 192.168.43.195.8880 > 192.168.43.124.7772: UDP, length 120
23:36:11.353892 IP 192.168.43.124.8880 > 192.168.43.195.7771: UDP, length 120
23:36:11.403892 IP 192.168.43.124.8880 > 192.168.43.195.7771: UDP, length 120
23:36:11.418869 IP 192.168.43.195.8880 > 192.168.43.124.7772: UDP, length 120
23:36:11.453158 IP 192.168.43.195.8880 > 192.168.43.124.7772: UDP, length 120
23:36:11.453858 IP 192.168.43.124.8880 > 192.168.43.195.7771: UDP, length 120
23:36:11.610074 IP 192.168.43.124.8880 > 192.168.43.195.7771: UDP, length 120
23:36:11.610225 IP 192.168.43.124.8880 > 192.168.43.195.7771: UDP, length 120
23:36:11.610229 IP 192.168.43.124.8880 > 192.168.43.195.7771: UDP, length 120
23:36:11.611515 IP 192.168.43.195.8880 > 192.168.43.124.7772: UDP, length 120
23:36:11.611529 IP 192.168.43.195.8880 > 192.168.43.124.7772: UDP, length 120
23:36:11.611531 IP 192.168.43.195.8880 > 192.168.43.124.7772: UDP, length 120
23:36:11.653891 IP 192.168.43.124.8880 > 192.168.43.195.7771: UDP, length 120
23:36:11.655344 IP 192.168.43.195.8880 > 192.168.43.124.7772: UDP, length 120
23:36:11.700897 IP 192.168.43.195.8880 > 192.168.43.124.7772: UDP, length 120
23:36:11.703853 IP 192.168.43.124.8880 > 192.168.43.195.7771: UDP, length 120
23:36:11.747974 IP 192.168.43.195.8880 > 192.168.43.124.7772: UDP, length 120
23:36:11.753893 IP 192.168.43.124.8880 > 192.168.43.195.7771: UDP, length 120
23:36:11.803854 IP 192.168.43.124.8880 > 192.168.43.195.7771: UDP, length 120
23:36:11.809406 IP 192.168.43.195.8880 > 192.168.43.124.7772: UDP, length 120
23:36:11.848333 IP 192.168.43.195.8880 > 192.168.43.124.7772: UDP, length 120
23:36:11.948366 IP 192.168.43.195.8880 > 192.168.43.124.7772: UDP, length 120
23:36:11.958066 IP 192.168.43.124.8880 > 192.168.43.195.7771: UDP, length 120
23:36:11.958219 IP 192.168.43.124.8880 > 192.168.43.195.7771: UDP, length 120
23:36:11.958224 IP 192.168.43.124.8880 > 192.168.43.195.7771: UDP, length 120
23:36:11.999107 IP 192.168.43.195.8880 > 192.168.43.124.7772: UDP, length 120
23:36:12.003852 IP 192.168.43.124.8880 > 192.168.43.195.7771: UDP, length 120
23:36:12.047825 IP 192.168.43.195.8880 > 192.168.43.124.7772: UDP, length 120
23:36:12.053893 IP 192.168.43.124.8880 > 192.168.43.195.7771: UDP, length 120
23:36:12.103951 IP 192.168.43.124.8880 > 192.168.43.195.7771: UDP, length 120
23:36:12.119494 IP 192.168.43.195.8880 > 192.168.43.124.7772: UDP, length 120
23:36:12.148236 IP 192.168.43.195.8880 > 192.168.43.124.7772: UDP, length 120
23:36:12.153890 IP 192.168.43.124.8880 > 192.168.43.195.7771: UDP, length 120
23:36:12.306036 IP 192.168.43.124.8880 > 192.168.43.195.7771: UDP, length 120
23:36:12.306060 IP 192.168.43.124.8880 > 192.168.43.195.7771: UDP, length 120
23:36:12.306067 IP 192.168.43.124.8880 > 192.168.43.195.7771: UDP, length 120
23:36:12.307320 IP 192.168.43.195.8880 > 192.168.43.124.7772: UDP, length 120
23:36:12.307333 IP 192.168.43.195.8880 > 192.168.43.124.7772: UDP, length 120
23:36:12.315269 IP 192.168.43.195.8880 > 192.168.43.124.7772: UDP, length 120
23:36:12.348237 IP 192.168.43.195.8880 > 192.168.43.124.7772: UDP, length 120
23:36:12.353822 IP 192.168.43.124.8880 > 192.168.43.195.7771: UDP, length 120
23:36:12.399290 IP 192.168.43.195.8880 > 192.168.43.124.7772: UDP, length 120
23:36:12.403827 IP 192.168.43.124.8880 > 192.168.43.195.7771: UDP, length 120
23:36:12.449633 IP 192.168.43.195.8880 > 192.168.43.124.7772: UDP, length 120
23:36:12.453893 IP 192.168.43.124.8880 > 192.168.43.195.7771: UDP, length 120
23:36:12.655097 IP 192.168.43.195.8880 > 192.168.43.124.7772: UDP, length 120
23:36:12.655111 IP 192.168.43.195.8880 > 192.168.43.124.7772: UDP, length 120
23:36:12.655112 IP 192.168.43.195.8880 > 192.168.43.124.7772: UDP, length 120
23:36:12.655114 IP 192.168.43.195.8880 > 192.168.43.124.7772: UDP, length 120
23:36:12.708854 IP 192.168.43.195.8880 > 192.168.43.124.7772: UDP, length 120
23:36:12.747125 IP 192.168.43.195.8880 > 192.168.43.124.7772: UDP, length 120
23:36:12.797922 IP 192.168.43.195.8880 > 192.168.43.124.7772: UDP, length 120
23:36:13.003527 IP 192.168.43.195.8880 > 192.168.43.124.7772: UDP, length 120
23:36:13.003540 IP 192.168.43.195.8880 > 192.168.43.124.7772: UDP, length 120
23:36:13.003542 IP 192.168.43.195.8880 > 192.168.43.124.7772: UDP, length 120
23:36:13.003544 IP 192.168.43.195.8880 > 192.168.43.124.7772: UDP, length 120
