04:03:36.050495 IP 192.168.43.124.8880 > 192.168.43.195.7771: UDP, length 120
04:03:36.092890 IP 192.168.43.124.8880 > 192.168.43.195.7771: UDP, length 120
04:03:36.148663 IP 192.168.43.124.8880 > 192.168.43.195.7771: UDP, length 120
04:03:36.202164 IP 192.168.43.124.8880 > 192.168.43.195.7771: UDP, length 120
04:03:36.242834 IP 192.168.43.124.8880 > 192.168.43.195.7771: UDP, length 120
04:03:36.294583 IP 192.168.43.124.8880 > 192.168.43.195.7771: UDP, length 120
04:03:36.354460 IP 192.168.43.124.8880 > 192.168.43.195.7771: UDP, length 120
04:03:36.395865 IP 192.168.43.124.8880 > 192.168.43.195.7771: UDP, length 120
04:03:36.455718 IP 192.168.43.124.8880 > 192.168.43.195.7771: UDP, length 120
04:03:36.501848 IP 192.168.43.124.8880 > 192.168.43.195.7771: UDP, length 120
04:03:36.542738 IP 192.168.43.124.8880 > 192.168.43.195.7771: UDP, length 120
04:03:36.592473 IP 192.168.43.124.8880 > 192.168.43.195.7771: UDP, length 120
04:03:36.651086 IP 192.168.43.124.8880 > 192.168.43.195.7771: UDP, length 120
04:03:36.692792 IP 192.168.43.124.8880 > 192.168.43.195.7771: UDP, length 120
04:03:36.742420 IP 192.168.43.124.8880 > 192.168.43.195.7771: UDP, length 120
04:03:36.801046 IP 192.168.43.124.8880 > 192.168.43.195.7771: UDP, length 120
04:03:36.842775 IP 192.168.43.124.8880 > 192.168.43.195.7771: UDP, length 120
04:03:36.892482 IP 192.168.43.124.8880 > 192.168.43.195.7771: UDP, length 120
04:03:36.950399 IP 192.168.43.124.8880 > 192.168.43.195.7771: UDP, length 120
04:03:36.992653 IP 192.168.43.124.8880 > 192.168.43.195.7771: UDP, length 120
04:03:37.045009 IP 192.168.43.124.8880 > 192.168.43.195.7771: UDP, length 120
04:03:37.100511 IP 192.168.43.124.8880 > 192.168.43.195.7771: UDP, length 120
04:03:37.150257 IP 192.168.43.124.8880 > 192.168.43.195.7771: UDP, length 120
04:03:37.192658 IP 192.168.43.124.8880 > 192.168.43.195.7771: UDP, length 120
04:03:37.250285 IP 192.168.43.124.8880 > 192.168.43.195.7771: UDP, length 120
04:03:37.292746 IP 192.168.43.124.8880 > 192.168.43.195.7771: UDP, length 120
04:03:37.342496 IP 192.168.43.124.8880 > 192.168.43.195.7771: UDP, length 120
04:03:37.400406 IP 192.168.43.124.8880 > 192.168.43.195.7771: UDP, length 120
04:03:37.444957 IP 192.168.43.124.8880 > 192.168.43.195.7771: UDP, length 120
04:03:37.492454 IP 192.168.43.124.8880 > 192.168.43.195.7771: UDP, length 120
04:03:37.552149 IP 192.168.43.124.8880 > 192.168.43.195.7771: UDP, length 120
04:03:37.593363 IP 192.168.43.124.8880 > 192.168.43.195.7771: UDP, length 120
04:03:37.642791 IP 192.168.43.124.8880 > 192.168.43.195.7771: UDP, length 120
04:03:37.697677 IP 192.168.43.124.8880 > 192.168.43.195.7771: UDP, length 120
04:03:37.748657 IP 192.168.43.124.8880 > 192.168.43.195.7771: UDP, length 120
04:03:37.794393 IP 192.168.43.124.8880 > 192.168.43.195.7771: UDP, length 120
04:03:37.846498 IP 192.168.43.124.8880 > 192.168.43.195.7771: UDP, length 120
04:03:37.896496 IP 192.168.43.124.8880 > 192.168.43.195.7771: UDP, length 120
04:03:37.957332 IP 192.168.43.124.8880 > 192.168.43.195.7771: UDP, length 120
04:03:37.991493 IP 192.168.43.124.8880 > 192.168.43.195.7771: UDP, length 120
04:03:38.047687 IP 192.168.43.124.8880 > 192.168.43.195.7771: UDP, length 120
04:03:38.094331 IP 192.168.43.124.8880 > 192.168.43.195.7771: UDP, length 120
04:03:38.154727 IP 192.168.43.124.8880 > 192.168.43.195.7771: UDP, length 120
04:03:38.194391 IP 192.168.43.124.8880 > 192.168.43.195.7771: UDP, length 120
04:03:38.244307 IP 192.168.43.124.8880 > 192.168.43.195.7771: UDP, length 120
04:03:38.294418 IP 192.168.43.124.8880 > 192.168.43.195.7771: UDP, length 120
04:03:38.344289 IP 192.168.43.124.8880 > 192.168.43.195.7771: UDP, length 120
04:03:38.395035 IP 192.168.43.124.8880 > 192.168.43.195.7771: UDP, length 120
04:03:38.439298 IP 192.168.43.195.8880 > 192.168.43.124.7772: UDP, length 120
04:03:38.442765 IP 192.168.43.124.8880 > 192.168.43.195.7771: UDP, length 120
04:03:38.489376 IP 192.168.43.195.8880 > 192.168.43.124.7772: UDP, length 120
04:03:38.493346 IP 192.168.43.124.8880 > 192.168.43.195.7771: UDP, length 120
04:03:38.539333 IP 192.168.43.195.8880 > 192.168.43.124.7772: UDP, length 120
04:03:38.542802 IP 192.168.43.124.8880 > 192.168.43.195.7771: UDP, length 120
04:03:38.589334 IP 192.168.43.195.8880 > 192.168.43.124.7772: UDP, length 120
04:03:38.593637 IP 192.168.43.124.8880 > 192.168.43.195.7771: UDP, length 120
04:03:38.639332 IP 192.168.43.195.8880 > 192.168.43.124.7772: UDP, length 120
04:03:38.644945 IP 192.168.43.124.8880 > 192.168.43.195.7771: UDP, length 120
04:03:38.689331 IP 192.168.43.195.8880 > 192.168.43.124.7772: UDP, length 120
04:03:38.692166 IP 192.168.43.124.8880 > 192.168.43.195.7771: UDP, length 120
04:03:38.739322 IP 192.168.43.195.8880 > 192.168.43.124.7772: UDP, length 120
04:03:38.742634 IP 192.168.43.124.8880 > 192.168.43.195.7771: UDP, length 120
04:03:38.789320 IP 192.168.43.195.8880 > 192.168.43.124.7772: UDP, length 120
04:03:38.792736 IP 192.168.43.124.8880 > 192.168.43.195.7771: UDP, length 120
04:03:38.839321 IP 192.168.43.195.8880 > 192.168.43.124.7772: UDP, length 120
04:03:38.842731 IP 192.168.43.124.8880 > 192.168.43.195.7771: UDP, length 120
04:03:38.889323 IP 192.168.43.195.8880 > 192.168.43.124.7772: UDP, length 120
04:03:38.892717 IP 192.168.43.124.8880 > 192.168.43.195.7771: UDP, length 120
04:03:38.939318 IP 192.168.43.195.8880 > 192.168.43.124.7772: UDP, length 120
04:03:38.942747 IP 192.168.43.124.8880 > 192.168.43.195.7771: UDP, length 120
04:03:38.989321 IP 192.168.43.195.8880 > 192.168.43.124.7772: UDP, length 120
04:03:39.039317 IP 192.168.43.195.8880 > 192.168.43.124.7772: UDP, length 120
04:03:39.089317 IP 192.168.43.195.8880 > 192.168.43.124.7772: UDP, length 120
04:03:39.139325 IP 192.168.43.195.8880 > 192.168.43.124.7772: UDP, length 120
04:03:39.140972 IP 192.168.43.124.8880 > 192.168.43.195.7771: UDP, length 120
04:03:39.141246 IP 192.168.43.124.8880 > 192.168.43.195.7771: UDP, length 120
04:03:39.189325 IP 192.168.43.195.8880 > 192.168.43.124.7772: UDP, length 120
04:03:39.239315 IP 192.168.43.195.8880 > 192.168.43.124.7772: UDP, length 120
04:03:39.245495 IP 192.168.43.124.8880 > 192.168.43.195.7771: UDP, length 120
04:03:39.245742 IP 192.168.43.124.8880 > 192.168.43.195.7771: UDP, length 120
04:03:39.245962 IP 192.168.43.124.8880 > 192.168.43.195.7771: UDP, length 120
04:03:39.289322 IP 192.168.43.195.8880 > 192.168.43.124.7772: UDP, length 120
04:03:39.339317 IP 192.168.43.195.8880 > 192.168.43.124.7772: UDP, length 120
04:03:39.389315 IP 192.168.43.195.8880 > 192.168.43.124.7772: UDP, length 120
04:03:39.391069 IP 192.168.43.124.8880 > 192.168.43.195.7771: UDP, length 120
04:03:39.391344 IP 192.168.43.124.8880 > 192.168.43.195.7771: UDP, length 120
04:03:39.439320 IP 192.168.43.195.8880 > 192.168.43.124.7772: UDP, length 120
04:03:39.489317 IP 192.168.43.195.8880 > 192.168.43.124.7772: UDP, length 120
04:03:39.492745 IP 192.168.43.124.8880 > 192.168.43.195.7771: UDP, length 120
04:03:39.493012 IP 192.168.43.124.8880 > 192.168.43.195.7771: UDP, length 120
04:03:39.539319 IP 192.168.43.195.8880 > 192.168.43.124.7772: UDP, length 120
04:03:39.589320 IP 192.168.43.195.8880 > 192.168.43.124.7772: UDP, length 120
04:03:39.591880 IP 192.168.43.124.8880 > 192.168.43.195.7771: UDP, length 120
04:03:39.592132 IP 192.168.43.124.8880 > 192.168.43.195.7771: UDP, length 120
04:03:39.639321 IP 192.168.43.195.8880 > 192.168.43.124.7772: UDP, length 120
04:03:39.689325 IP 192.168.43.195.8880 > 192.168.43.124.7772: UDP, length 120
04:03:39.701101 IP 192.168.43.124.8880 > 192.168.43.195.7771: UDP, length 120
04:03:39.701358 IP 192.168.43.124.8880 > 192.168.43.195.7771: UDP, length 120
04:03:39.701472 IP 192.168.43.124.8880 > 192.168.43.195.7771: UDP, length 120
04:03:39.739329 IP 192.168.43.195.8880 > 192.168.43.124.7772: UDP, length 120
04:03:39.789318 IP 192.168.43.195.8880 > 192.168.43.124.7772: UDP, length 120
04:03:39.839323 IP 192.168.43.195.8880 > 192.168.43.124.7772: UDP, length 120
04:03:39.851169 IP 192.168.43.124.8880 > 192.168.43.195.7771: UDP, length 120
04:03:39.851590 IP 192.168.43.124.8880 > 192.168.43.195.7771: UDP, length 120
04:03:39.851812 IP 192.168.43.124.8880 > 192.168.43.195.7771: UDP, length 120
04:03:39.889322 IP 192.168.43.195.8880 > 192.168.43.124.7772: UDP, length 120
04:03:39.939313 IP 192.168.43.195.8880 > 192.168.43.124.7772: UDP, length 120
04:03:39.989376 IP 192.168.43.195.8880 > 192.168.43.124.7772: UDP, length 120
04:03:40.011168 IP 192.168.43.124.8880 > 192.168.43.195.7771: UDP, length 120
04:03:40.011500 IP 192.168.43.124.8880 > 192.168.43.195.7771: UDP, length 120
04:03:40.011712 IP 192.168.43.124.8880 > 192.168.43.195.7771: UDP, length 120
04:03:40.039334 IP 192.168.43.195.8880 > 192.168.43.124.7772: UDP, length 120
04:03:40.089319 IP 192.168.43.195.8880 > 192.168.43.124.7772: UDP, length 120
04:03:40.139324 IP 192.168.43.195.8880 > 192.168.43.124.7772: UDP, length 120
04:03:40.147149 IP 192.168.43.124.8880 > 192.168.43.195.7771: UDP, length 120
04:03:40.147606 IP 192.168.43.124.8880 > 192.168.43.195.7771: UDP, length 120
04:03:40.189324 IP 192.168.43.195.8880 > 192.168.43.124.7772: UDP, length 120
04:03:40.239316 IP 192.168.43.195.8880 > 192.168.43.124.7772: UDP, length 120
04:03:40.247338 IP 192.168.43.124.8880 > 192.168.43.195.7771: UDP, length 120
04:03:40.247643 IP 192.168.43.124.8880 > 192.168.43.195.7771: UDP, length 120
04:03:40.247759 IP 192.168.43.124.8880 > 192.168.43.195.7771: UDP, length 120
04:03:40.289323 IP 192.168.43.195.8880 > 192.168.43.124.7772: UDP, length 120
04:03:40.339316 IP 192.168.43.195.8880 > 192.168.43.124.7772: UDP, length 120
04:03:40.389316 IP 192.168.43.195.8880 > 192.168.43.124.7772: UDP, length 120
04:03:40.412038 IP 192.168.43.124.8880 > 192.168.43.195.7771: UDP, length 120
04:03:40.412272 IP 192.168.43.124.8880 > 192.168.43.195.7771: UDP, length 120
04:03:40.412494 IP 192.168.43.124.8880 > 192.168.43.195.7771: UDP, length 120
04:03:40.439321 IP 192.168.43.195.8880 > 192.168.43.124.7772: UDP, length 120
04:03:40.489318 IP 192.168.43.195.8880 > 192.168.43.124.7772: UDP, length 120
04:03:40.539317 IP 192.168.43.195.8880 > 192.168.43.124.7772: UDP, length 120
04:03:40.542735 IP 192.168.43.124.8880 > 192.168.43.195.7771: UDP, length 120
04:03:40.542985 IP 192.168.43.124.8880 > 192.168.43.195.7771: UDP, length 120
04:03:40.543205 IP 192.168.43.124.8880 > 192.168.43.195.7771: UDP, length 120
04:03:40.589324 IP 192.168.43.195.8880 > 192.168.43.124.7772: UDP, length 120
04:03:40.639313 IP 192.168.43.195.8880 > 192.168.43.124.7772: UDP, length 120
04:03:40.689315 IP 192.168.43.195.8880 > 192.168.43.124.7772: UDP, length 120
04:03:40.693777 IP 192.168.43.124.8880 > 192.168.43.195.7771: UDP, length 120
04:03:40.694639 IP 192.168.43.124.8880 > 192.168.43.195.7771: UDP, length 120
04:03:40.694861 IP 192.168.43.124.8880 > 192.168.43.195.7771: UDP, length 120
04:03:40.739326 IP 192.168.43.195.8880 > 192.168.43.124.7772: UDP, length 120
04:03:40.789322 IP 192.168.43.195.8880 > 192.168.43.124.7772: UDP, length 120
04:03:40.839318 IP 192.168.43.195.8880 > 192.168.43.124.7772: UDP, length 120
04:03:40.847872 IP 192.168.43.124.8880 > 192.168.43.195.7771: UDP, length 120
04:03:40.848157 IP 192.168.43.124.8880 > 192.168.43.195.7771: UDP, length 120
04:03:40.848386 IP 192.168.43.124.8880 > 192.168.43.195.7771: UDP, length 120
04:03:40.889320 IP 192.168.43.195.8880 > 192.168.43.124.7772: UDP, length 120
04:03:40.939315 IP 192.168.43.195.8880 > 192.168.43.124.7772: UDP, length 120
04:03:40.989314 IP 192.168.43.195.8880 > 192.168.43.124.7772: UDP, length 120
04:03:40.997083 IP 192.168.43.124.8880 > 192.168.43.195.7771: UDP, length 120
04:03:40.997895 IP 192.168.43.124.8880 > 192.168.43.195.7771: UDP, length 120
04:03:40.998108 IP 192.168.43.124.8880 > 192.168.43.195.7771: UDP, length 120
04:03:41.039319 IP 192.168.43.195.8880 > 192.168.43.124.7772: UDP, length 120
04:03:41.089314 IP 192.168.43.195.8880 > 192.168.43.124.7772: UDP, length 120
04:03:41.139330 IP 192.168.43.195.8880 > 192.168.43.124.7772: UDP, length 120
04:03:41.142761 IP 192.168.43.124.8880 > 192.168.43.195.7771: UDP, length 120
04:03:41.142896 IP 192.168.43.124.8880 > 192.168.43.195.7771: UDP, length 120
04:03:41.189332 IP 192.168.43.195.8880 > 192.168.43.124.7772: UDP, length 120
04:03:41.239317 IP 192.168.43.195.8880 > 192.168.43.124.7772: UDP, length 120
04:03:41.256120 IP 192.168.43.124.8880 > 192.168.43.195.7771: UDP, length 120
04:03:41.256357 IP 192.168.43.124.8880 > 192.168.43.195.7771: UDP, length 120
04:03:41.256470 IP 192.168.43.124.8880 > 192.168.43.195.7771: UDP, length 120
04:03:41.289318 IP 192.168.43.195.8880 > 192.168.43.124.7772: UDP, length 120
04:03:41.339314 IP 192.168.43.195.8880 > 192.168.43.124.7772: UDP, length 120
04:03:41.389313 IP 192.168.43.195.8880 > 192.168.43.124.7772: UDP, length 120
04:03:41.399035 IP 192.168.43.124.8880 > 192.168.43.195.7771: UDP, length 120
04:03:41.399173 IP 192.168.43.124.8880 > 192.168.43.195.7771: UDP, length 120
04:03:41.399408 IP 192.168.43.124.8880 > 192.168.43.195.7771: UDP, length 120
04:03:41.439316 IP 192.168.43.195.8880 > 192.168.43.124.7772: UDP, length 120
04:03:41.489374 IP 192.168.43.195.8880 > 192.168.43.124.7772: UDP, length 120
04:03:41.539325 IP 192.168.43.195.8880 > 192.168.43.124.7772: UDP, length 120
04:03:41.562864 IP 192.168.43.124.8880 > 192.168.43.195.7771: UDP, length 120
04:03:41.563100 IP 192.168.43.124.8880 > 192.168.43.195.7771: UDP, length 120
04:03:41.563216 IP 192.168.43.124.8880 > 192.168.43.195.7771: UDP, length 120
04:03:41.589324 IP 192.168.43.195.8880 > 192.168.43.124.7772: UDP, length 120
04:03:41.639318 IP 192.168.43.195.8880 > 192.168.43.124.7772: UDP, length 120
04:03:41.689316 IP 192.168.43.195.8880 > 192.168.43.124.7772: UDP, length 120
04:03:41.694408 IP 192.168.43.124.8880 > 192.168.43.195.7771: UDP, length 120
04:03:41.694654 IP 192.168.43.124.8880 > 192.168.43.195.7771: UDP, length 120
04:03:41.694770 IP 192.168.43.124.8880 > 192.168.43.195.7771: UDP, length 120
04:03:41.739317 IP 192.168.43.195.8880 > 192.168.43.124.7772: UDP, length 120
04:03:41.789322 IP 192.168.43.195.8880 > 192.168.43.124.7772: UDP, length 120
04:03:41.839317 IP 192.168.43.195.8880 > 192.168.43.124.7772: UDP, length 120
04:03:41.842741 IP 192.168.43.124.8880 > 192.168.43.195.7771: UDP, length 120
04:03:41.842873 IP 192.168.43.124.8880 > 192.168.43.195.7771: UDP, length 120
04:03:41.889331 IP 192.168.43.195.8880 > 192.168.43.124.7772: UDP, length 120
04:03:41.939315 IP 192.168.43.195.8880 > 192.168.43.124.7772: UDP, length 120
04:03:41.952214 IP 192.168.43.124.8880 > 192.168.43.195.7771: UDP, length 120
04:03:41.952453 IP 192.168.43.124.8880 > 192.168.43.195.7771: UDP, length 120
04:03:41.952570 IP 192.168.43.124.8880 > 192.168.43.195.7771: UDP, length 120
04:03:41.989319 IP 192.168.43.195.8880 > 192.168.43.124.7772: UDP, length 120
04:03:42.039316 IP 192.168.43.195.8880 > 192.168.43.124.7772: UDP, length 120
04:03:42.089315 IP 192.168.43.195.8880 > 192.168.43.124.7772: UDP, length 120
04:03:42.097965 IP 192.168.43.124.8880 > 192.168.43.195.7771: UDP, length 120
04:03:42.098348 IP 192.168.43.124.8880 > 192.168.43.195.7771: UDP, length 120
04:03:42.139329 IP 192.168.43.195.8880 > 192.168.43.124.7772: UDP, length 120
04:03:42.189322 IP 192.168.43.195.8880 > 192.168.43.124.7772: UDP, length 120
04:03:42.192766 IP 192.168.43.124.8880 > 192.168.43.195.7771: UDP, length 120
04:03:42.193034 IP 192.168.43.124.8880 > 192.168.43.195.7771: UDP, length 120
04:03:42.193254 IP 192.168.43.124.8880 > 192.168.43.195.7771: UDP, length 120
04:03:42.239323 IP 192.168.43.195.8880 > 192.168.43.124.7772: UDP, length 120
04:03:42.251263 IP 192.168.43.124.8880 > 192.168.43.195.7771: UDP, length 120
04:03:42.289321 IP 192.168.43.195.8880 > 192.168.43.124.7772: UDP, length 120
04:03:42.292745 IP 192.168.43.124.8880 > 192.168.43.195.7771: UDP, length 120
04:03:42.339319 IP 192.168.43.195.8880 > 192.168.43.124.7772: UDP, length 120
04:03:42.354802 IP 192.168.43.124.8880 > 192.168.43.195.7771: UDP, length 120
04:03:42.389327 IP 192.168.43.195.8880 > 192.168.43.124.7772: UDP, length 120
04:03:42.398163 IP 192.168.43.124.8880 > 192.168.43.195.7771: UDP, length 120
04:03:42.439320 IP 192.168.43.195.8880 > 192.168.43.124.7772: UDP, length 120
04:03:42.442719 IP 192.168.43.124.8880 > 192.168.43.195.7771: UDP, length 120
04:03:42.489318 IP 192.168.43.195.8880 > 192.168.43.124.7772: UDP, length 120
04:03:42.492725 IP 192.168.43.124.8880 > 192.168.43.195.7771: UDP, length 120
04:03:42.539322 IP 192.168.43.195.8880 > 192.168.43.124.7772: UDP, length 120
04:03:42.542742 IP 192.168.43.124.8880 > 192.168.43.195.7771: UDP, length 120
04:03:42.589323 IP 192.168.43.195.8880 > 192.168.43.124.7772: UDP, length 120
04:03:42.639316 IP 192.168.43.195.8880 > 192.168.43.124.7772: UDP, length 120
04:03:42.649800 IP 192.168.43.124.8880 > 192.168.43.195.7771: UDP, length 120
04:03:42.689327 IP 192.168.43.195.8880 > 192.168.43.124.7772: UDP, length 120
04:03:42.699028 IP 192.168.43.124.8880 > 192.168.43.195.7771: UDP, length 120
04:03:42.734793 IP 192.168.43.124.8880 > 192.168.43.195.7771: UDP, length 120
04:03:42.739322 IP 192.168.43.195.8880 > 192.168.43.124.7772: UDP, length 120
04:03:42.789319 IP 192.168.43.195.8880 > 192.168.43.124.7772: UDP, length 120
04:03:42.839314 IP 192.168.43.195.8880 > 192.168.43.124.7772: UDP, length 120
04:03:42.850432 IP 192.168.43.124.8880 > 192.168.43.195.7771: UDP, length 120
04:03:42.885845 IP 192.168.43.124.8880 > 192.168.43.195.7771: UDP, length 120
04:03:42.889333 IP 192.168.43.195.8880 > 192.168.43.124.7772: UDP, length 120
04:03:42.939320 IP 192.168.43.195.8880 > 192.168.43.124.7772: UDP, length 120
04:03:42.989378 IP 192.168.43.195.8880 > 192.168.43.124.7772: UDP, length 120
04:03:43.017731 IP 192.168.43.124.8880 > 192.168.43.195.7771: UDP, length 120
04:03:43.018038 IP 192.168.43.124.8880 > 192.168.43.195.7771: UDP, length 120
04:03:43.018249 IP 192.168.43.124.8880 > 192.168.43.195.7771: UDP, length 120
04:03:43.018467 IP 192.168.43.124.8880 > 192.168.43.195.7771: UDP, length 120
04:03:43.039340 IP 192.168.43.195.8880 > 192.168.43.124.7772: UDP, length 120
04:03:43.089318 IP 192.168.43.195.8880 > 192.168.43.124.7772: UDP, length 120
04:03:43.139321 IP 192.168.43.195.8880 > 192.168.43.124.7772: UDP, length 120
04:03:43.189320 IP 192.168.43.195.8880 > 192.168.43.124.7772: UDP, length 120
04:03:43.189406 IP 192.168.43.124.8880 > 192.168.43.195.7771: UDP, length 120
04:03:43.189540 IP 192.168.43.124.8880 > 192.168.43.195.7771: UDP, length 120
04:03:43.223865 IP 192.168.43.124.8880 > 192.168.43.195.7771: UDP, length 120
04:03:43.239320 IP 192.168.43.195.8880 > 192.168.43.124.7772: UDP, length 120
04:03:43.286342 IP 192.168.43.124.8880 > 192.168.43.195.7771: UDP, length 120
04:03:43.289318 IP 192.168.43.195.8880 > 192.168.43.124.7772: UDP, length 120
04:03:43.296484 IP 192.168.43.124.8880 > 192.168.43.195.7771: UDP, length 120
04:03:43.339316 IP 192.168.43.195.8880 > 192.168.43.124.7772: UDP, length 120
04:03:43.389317 IP 192.168.43.195.8880 > 192.168.43.124.7772: UDP, length 120
04:03:43.439314 IP 192.168.43.195.8880 > 192.168.43.124.7772: UDP, length 120
04:03:43.489315 IP 192.168.43.195.8880 > 192.168.43.124.7772: UDP, length 120
04:03:43.514435 IP 192.168.43.124.8880 > 192.168.43.195.7771: UDP, length 120
04:03:43.514665 IP 192.168.43.124.8880 > 192.168.43.195.7771: UDP, length 120
04:03:43.514777 IP 192.168.43.124.8880 > 192.168.43.195.7771: UDP, length 120
04:03:43.539319 IP 192.168.43.195.8880 > 192.168.43.124.7772: UDP, length 120
04:03:43.548867 IP 192.168.43.124.8880 > 192.168.43.195.7771: UDP, length 120
04:03:43.548998 IP 192.168.43.124.8880 > 192.168.43.195.7771: UDP, length 120
04:03:43.589327 IP 192.168.43.195.8880 > 192.168.43.124.7772: UDP, length 120
04:03:43.639318 IP 192.168.43.195.8880 > 192.168.43.124.7772: UDP, length 120
04:03:43.685376 IP 192.168.43.124.8880 > 192.168.43.195.7771: UDP, length 120
04:03:43.689318 IP 192.168.43.195.8880 > 192.168.43.124.7772: UDP, length 120
04:03:43.739315 IP 192.168.43.195.8880 > 192.168.43.124.7772: UDP, length 120
04:03:43.768382 IP 192.168.43.124.8880 > 192.168.43.195.7771: UDP, length 120
04:03:43.768633 IP 192.168.43.124.8880 > 192.168.43.195.7771: UDP, length 120
04:03:43.789320 IP 192.168.43.195.8880 > 192.168.43.124.7772: UDP, length 120
04:03:43.839317 IP 192.168.43.195.8880 > 192.168.43.124.7772: UDP, length 120
04:03:43.889315 IP 192.168.43.195.8880 > 192.168.43.124.7772: UDP, length 120
04:03:43.939322 IP 192.168.43.195.8880 > 192.168.43.124.7772: UDP, length 120
04:03:43.989319 IP 192.168.43.195.8880 > 192.168.43.124.7772: UDP, length 120
04:03:44.016247 IP 192.168.43.124.8880 > 192.168.43.195.7771: UDP, length 120
04:03:44.039326 IP 192.168.43.195.8880 > 192.168.43.124.7772: UDP, length 120
04:03:44.089317 IP 192.168.43.195.8880 > 192.168.43.124.7772: UDP, length 120
04:03:44.095419 IP 192.168.43.124.8880 > 192.168.43.195.7771: UDP, length 120
04:03:44.095674 IP 192.168.43.124.8880 > 192.168.43.195.7771: UDP, length 120
04:03:44.139329 IP 192.168.43.195.8880 > 192.168.43.124.7772: UDP, length 120
04:03:44.189322 IP 192.168.43.195.8880 > 192.168.43.124.7772: UDP, length 120
04:03:44.239316 IP 192.168.43.195.8880 > 192.168.43.124.7772: UDP, length 120
04:03:44.242750 IP 192.168.43.124.8880 > 192.168.43.195.7771: UDP, length 120
04:03:44.243027 IP 192.168.43.124.8880 > 192.168.43.195.7771: UDP, length 120
04:03:44.249691 IP 192.168.43.124.8880 > 192.168.43.195.7771: UDP, length 120
04:03:44.249904 IP 192.168.43.124.8880 > 192.168.43.195.7771: UDP, length 120
04:03:44.250111 IP 192.168.43.124.8880 > 192.168.43.195.7771: UDP, length 120
04:03:44.250317 IP 192.168.43.124.8880 > 192.168.43.195.7771: UDP, length 120
04:03:44.289325 IP 192.168.43.195.8880 > 192.168.43.124.7772: UDP, length 120
04:03:44.311985 IP 192.168.43.124.8880 > 192.168.43.195.7771: UDP, length 120
04:03:44.316236 IP 192.168.43.124.8880 > 192.168.43.195.7771: UDP, length 120
04:03:44.339321 IP 192.168.43.195.8880 > 192.168.43.124.7772: UDP, length 120
04:03:44.389315 IP 192.168.43.195.8880 > 192.168.43.124.7772: UDP, length 120
04:03:44.439314 IP 192.168.43.195.8880 > 192.168.43.124.7772: UDP, length 120
04:03:44.454096 IP 192.168.43.124.8880 > 192.168.43.195.7771: UDP, length 120
04:03:44.454344 IP 192.168.43.124.8880 > 192.168.43.195.7771: UDP, length 120
04:03:44.455304 IP 192.168.43.124.8880 > 192.168.43.195.7771: UDP, length 120
04:03:44.489375 IP 192.168.43.195.8880 > 192.168.43.124.7772: UDP, length 120
04:03:44.539324 IP 192.168.43.195.8880 > 192.168.43.124.7772: UDP, length 120
04:03:44.561860 IP 192.168.43.124.8880 > 192.168.43.195.7771: UDP, length 120
04:03:44.572936 IP 192.168.43.124.8880 > 192.168.43.195.7771: UDP, length 120
04:03:44.589324 IP 192.168.43.195.8880 > 192.168.43.124.7772: UDP, length 120
04:03:44.639318 IP 192.168.43.195.8880 > 192.168.43.124.7772: UDP, length 120
04:03:44.665972 IP 192.168.43.124.8880 > 192.168.43.195.7771: UDP, length 120
04:03:44.689317 IP 192.168.43.195.8880 > 192.168.43.124.7772: UDP, length 120
04:03:44.739314 IP 192.168.43.195.8880 > 192.168.43.124.7772: UDP, length 120
04:03:44.789314 IP 192.168.43.195.8880 > 192.168.43.124.7772: UDP, length 120
04:03:44.802608 IP 192.168.43.124.8880 > 192.168.43.195.7771: UDP, length 120
04:03:44.802993 IP 192.168.43.124.8880 > 192.168.43.195.7771: UDP, length 120
04:03:44.803204 IP 192.168.43.124.8880 > 192.168.43.195.7771: UDP, length 120
04:03:44.823965 IP 192.168.43.124.8880 > 192.168.43.195.7771: UDP, length 120
04:03:44.839322 IP 192.168.43.195.8880 > 192.168.43.124.7772: UDP, length 120
04:03:44.884620 IP 192.168.43.124.8880 > 192.168.43.195.7771: UDP, length 120
04:03:44.889318 IP 192.168.43.195.8880 > 192.168.43.124.7772: UDP, length 120
04:03:44.939326 IP 192.168.43.195.8880 > 192.168.43.124.7772: UDP, length 120
04:03:44.989318 IP 192.168.43.195.8880 > 192.168.43.124.7772: UDP, length 120
04:03:45.039320 IP 192.168.43.195.8880 > 192.168.43.124.7772: UDP, length 120
04:03:45.049107 IP 192.168.43.124.8880 > 192.168.43.195.7771: UDP, length 120
04:03:45.049412 IP 192.168.43.124.8880 > 192.168.43.195.7771: UDP, length 120
04:03:45.086900 IP 192.168.43.124.8880 > 192.168.43.195.7771: UDP, length 120
04:03:45.089327 IP 192.168.43.195.8880 > 192.168.43.124.7772: UDP, length 120
04:03:45.139327 IP 192.168.43.195.8880 > 192.168.43.124.7772: UDP, length 120
04:03:45.167249 IP 192.168.43.124.8880 > 192.168.43.195.7771: UDP, length 120
04:03:45.189324 IP 192.168.43.195.8880 > 192.168.43.124.7772: UDP, length 120
04:03:45.204753 IP 192.168.43.124.8880 > 192.168.43.195.7771: UDP, length 120
04:03:45.239319 IP 192.168.43.195.8880 > 192.168.43.124.7772: UDP, length 120
04:03:45.249740 IP 192.168.43.124.8880 > 192.168.43.195.7771: UDP, length 120
04:03:45.289320 IP 192.168.43.195.8880 > 192.168.43.124.7772: UDP, length 120
04:03:45.339316 IP 192.168.43.195.8880 > 192.168.43.124.7772: UDP, length 120
04:03:45.389315 IP 192.168.43.195.8880 > 192.168.43.124.7772: UDP, length 120
04:03:45.403757 IP 192.168.43.124.8880 > 192.168.43.195.7771: UDP, length 120
04:03:45.404026 IP 192.168.43.124.8880 > 192.168.43.195.7771: UDP, length 120
04:03:45.435102 IP 192.168.43.124.8880 > 192.168.43.195.7771: UDP, length 120
04:03:45.439320 IP 192.168.43.195.8880 > 192.168.43.124.7772: UDP, length 120
04:03:45.439960 IP 192.168.43.124.8880 > 192.168.43.195.7771: UDP, length 120
04:03:45.489319 IP 192.168.43.195.8880 > 192.168.43.124.7772: UDP, length 120
04:03:45.492730 IP 192.168.43.124.8880 > 192.168.43.195.7771: UDP, length 120
04:03:45.539320 IP 192.168.43.195.8880 > 192.168.43.124.7772: UDP, length 120
04:03:45.542728 IP 192.168.43.124.8880 > 192.168.43.195.7771: UDP, length 120
04:03:45.589323 IP 192.168.43.195.8880 > 192.168.43.124.7772: UDP, length 120
04:03:45.592738 IP 192.168.43.124.8880 > 192.168.43.195.7771: UDP, length 120
04:03:45.639321 IP 192.168.43.195.8880 > 192.168.43.124.7772: UDP, length 120
04:03:45.642725 IP 192.168.43.124.8880 > 192.168.43.195.7771: UDP, length 120
04:03:45.689321 IP 192.168.43.195.8880 > 192.168.43.124.7772: UDP, length 120
04:03:45.692719 IP 192.168.43.124.8880 > 192.168.43.195.7771: UDP, length 120
04:03:45.739320 IP 192.168.43.195.8880 > 192.168.43.124.7772: UDP, length 120
04:03:45.742701 IP 192.168.43.124.8880 > 192.168.43.195.7771: UDP, length 120
04:03:45.789322 IP 192.168.43.195.8880 > 192.168.43.124.7772: UDP, length 120
04:03:45.792742 IP 192.168.43.124.8880 > 192.168.43.195.7771: UDP, length 120
04:03:45.839323 IP 192.168.43.195.8880 > 192.168.43.124.7772: UDP, length 120
04:03:45.842722 IP 192.168.43.124.8880 > 192.168.43.195.7771: UDP, length 120
04:03:45.889321 IP 192.168.43.195.8880 > 192.168.43.124.7772: UDP, length 120
04:03:45.892729 IP 192.168.43.124.8880 > 192.168.43.195.7771: UDP, length 120
04:03:45.939319 IP 192.168.43.195.8880 > 192.168.43.124.7772: UDP, length 120
04:03:45.942886 IP 192.168.43.124.8880 > 192.168.43.195.7771: UDP, length 120
04:03:45.989379 IP 192.168.43.195.8880 > 192.168.43.124.7772: UDP, length 120
04:03:45.993174 IP 192.168.43.124.8880 > 192.168.43.195.7771: UDP, length 120
04:03:46.039338 IP 192.168.43.195.8880 > 192.168.43.124.7772: UDP, length 120
04:03:46.043191 IP 192.168.43.124.8880 > 192.168.43.195.7771: UDP, length 120
04:03:46.089337 IP 192.168.43.195.8880 > 192.168.43.124.7772: UDP, length 120
04:03:46.092874 IP 192.168.43.124.8880 > 192.168.43.195.7771: UDP, length 120
04:03:46.139343 IP 192.168.43.195.8880 > 192.168.43.124.7772: UDP, length 120
04:03:46.142949 IP 192.168.43.124.8880 > 192.168.43.195.7771: UDP, length 120
04:03:46.189328 IP 192.168.43.195.8880 > 192.168.43.124.7772: UDP, length 120
04:03:46.193530 IP 192.168.43.124.8880 > 192.168.43.195.7771: UDP, length 120
04:03:46.239319 IP 192.168.43.195.8880 > 192.168.43.124.7772: UDP, length 120
04:03:46.245733 IP 192.168.43.124.8880 > 192.168.43.195.7771: UDP, length 120
04:03:46.289320 IP 192.168.43.195.8880 > 192.168.43.124.7772: UDP, length 120
04:03:46.292735 IP 192.168.43.124.8880 > 192.168.43.195.7771: UDP, length 120
04:03:46.339320 IP 192.168.43.195.8880 > 192.168.43.124.7772: UDP, length 120
04:03:46.347376 IP 192.168.43.124.8880 > 192.168.43.195.7771: UDP, length 120
04:03:46.389319 IP 192.168.43.195.8880 > 192.168.43.124.7772: UDP, length 120
04:03:46.392782 IP 192.168.43.124.8880 > 192.168.43.195.7771: UDP, length 120
04:03:46.439316 IP 192.168.43.195.8880 > 192.168.43.124.7772: UDP, length 120
04:03:46.443058 IP 192.168.43.124.8880 > 192.168.43.195.7771: UDP, length 120
04:03:46.489318 IP 192.168.43.195.8880 > 192.168.43.124.7772: UDP, length 120
04:03:46.492706 IP 192.168.43.124.8880 > 192.168.43.195.7771: UDP, length 120
04:03:46.539317 IP 192.168.43.195.8880 > 192.168.43.124.7772: UDP, length 120
04:03:46.544368 IP 192.168.43.124.8880 > 192.168.43.195.7771: UDP, length 120
04:03:46.589320 IP 192.168.43.195.8880 > 192.168.43.124.7772: UDP, length 120
04:03:46.592708 IP 192.168.43.124.8880 > 192.168.43.195.7771: UDP, length 120
04:03:46.639320 IP 192.168.43.195.8880 > 192.168.43.124.7772: UDP, length 120
04:03:46.641951 IP 192.168.43.124.8880 > 192.168.43.195.7771: UDP, length 120
04:03:46.689319 IP 192.168.43.195.8880 > 192.168.43.124.7772: UDP, length 120
04:03:46.695595 IP 192.168.43.124.8880 > 192.168.43.195.7771: UDP, length 120
04:03:46.739318 IP 192.168.43.195.8880 > 192.168.43.124.7772: UDP, length 120
04:03:46.742702 IP 192.168.43.124.8880 > 192.168.43.195.7771: UDP, length 120
04:03:46.789317 IP 192.168.43.195.8880 > 192.168.43.124.7772: UDP, length 120
04:03:46.797791 IP 192.168.43.124.8880 > 192.168.43.195.7771: UDP, length 120
04:03:46.839320 IP 192.168.43.195.8880 > 192.168.43.124.7772: UDP, length 120
04:03:46.842748 IP 192.168.43.124.8880 > 192.168.43.195.7771: UDP, length 120
04:03:46.889320 IP 192.168.43.195.8880 > 192.168.43.124.7772: UDP, length 120
04:03:46.892763 IP 192.168.43.124.8880 > 192.168.43.195.7771: UDP, length 120
04:03:46.939323 IP 192.168.43.195.8880 > 192.168.43.124.7772: UDP, length 120
04:03:46.977314 IP 192.168.43.124.8880 > 192.168.43.195.7771: UDP, length 120
04:03:46.989320 IP 192.168.43.195.8880 > 192.168.43.124.7772: UDP, length 120
04:03:46.992715 IP 192.168.43.124.8880 > 192.168.43.195.7771: UDP, length 120
04:03:47.039318 IP 192.168.43.195.8880 > 192.168.43.124.7772: UDP, length 120
04:03:47.042708 IP 192.168.43.124.8880 > 192.168.43.195.7771: UDP, length 120
04:03:47.089319 IP 192.168.43.195.8880 > 192.168.43.124.7772: UDP, length 120
04:03:47.092736 IP 192.168.43.124.8880 > 192.168.43.195.7771: UDP, length 120
04:03:47.139336 IP 192.168.43.195.8880 > 192.168.43.124.7772: UDP, length 120
04:03:47.149948 IP 192.168.43.124.8880 > 192.168.43.195.7771: UDP, length 120
04:03:47.189327 IP 192.168.43.195.8880 > 192.168.43.124.7772: UDP, length 120
04:03:47.192723 IP 192.168.43.124.8880 > 192.168.43.195.7771: UDP, length 120
04:03:47.239319 IP 192.168.43.195.8880 > 192.168.43.124.7772: UDP, length 120
04:03:47.242708 IP 192.168.43.124.8880 > 192.168.43.195.7771: UDP, length 120
04:03:47.289319 IP 192.168.43.195.8880 > 192.168.43.124.7772: UDP, length 120
04:03:47.297854 IP 192.168.43.124.8880 > 192.168.43.195.7771: UDP, length 120
04:03:47.339316 IP 192.168.43.195.8880 > 192.168.43.124.7772: UDP, length 120
04:03:47.342707 IP 192.168.43.124.8880 > 192.168.43.195.7771: UDP, length 120
04:03:47.389317 IP 192.168.43.195.8880 > 192.168.43.124.7772: UDP, length 120
04:03:47.392714 IP 192.168.43.124.8880 > 192.168.43.195.7771: UDP, length 120
04:03:47.439317 IP 192.168.43.195.8880 > 192.168.43.124.7772: UDP, length 120
04:03:47.452844 IP 192.168.43.124.8880 > 192.168.43.195.7771: UDP, length 120
04:03:47.489378 IP 192.168.43.195.8880 > 192.168.43.124.7772: UDP, length 120
04:03:47.492834 IP 192.168.43.124.8880 > 192.168.43.195.7771: UDP, length 120
04:03:47.539332 IP 192.168.43.195.8880 > 192.168.43.124.7772: UDP, length 120
04:03:47.542725 IP 192.168.43.124.8880 > 192.168.43.195.7771: UDP, length 120
04:03:47.589323 IP 192.168.43.195.8880 > 192.168.43.124.7772: UDP, length 120
04:03:47.597818 IP 192.168.43.124.8880 > 192.168.43.195.7771: UDP, length 120
04:03:47.639320 IP 192.168.43.195.8880 > 192.168.43.124.7772: UDP, length 120
04:03:47.642709 IP 192.168.43.124.8880 > 192.168.43.195.7771: UDP, length 120
04:03:47.689318 IP 192.168.43.195.8880 > 192.168.43.124.7772: UDP, length 120
04:03:47.692742 IP 192.168.43.124.8880 > 192.168.43.195.7771: UDP, length 120
04:03:47.739324 IP 192.168.43.195.8880 > 192.168.43.124.7772: UDP, length 120
04:03:47.748261 IP 192.168.43.124.8880 > 192.168.43.195.7771: UDP, length 120
04:03:47.789319 IP 192.168.43.195.8880 > 192.168.43.124.7772: UDP, length 120
04:03:47.792705 IP 192.168.43.124.8880 > 192.168.43.195.7771: UDP, length 120
04:03:47.839317 IP 192.168.43.195.8880 > 192.168.43.124.7772: UDP, length 120
04:03:47.842709 IP 192.168.43.124.8880 > 192.168.43.195.7771: UDP, length 120
04:03:47.889318 IP 192.168.43.195.8880 > 192.168.43.124.7772: UDP, length 120
04:03:47.897301 IP 192.168.43.124.8880 > 192.168.43.195.7771: UDP, length 120
04:03:47.939316 IP 192.168.43.195.8880 > 192.168.43.124.7772: UDP, length 120
04:03:47.942704 IP 192.168.43.124.8880 > 192.168.43.195.7771: UDP, length 120
04:03:47.989316 IP 192.168.43.195.8880 > 192.168.43.124.7772: UDP, length 120
04:03:47.992705 IP 192.168.43.124.8880 > 192.168.43.195.7771: UDP, length 120
04:03:48.039316 IP 192.168.43.195.8880 > 192.168.43.124.7772: UDP, length 120
04:03:48.047304 IP 192.168.43.124.8880 > 192.168.43.195.7771: UDP, length 120
04:03:48.089317 IP 192.168.43.195.8880 > 192.168.43.124.7772: UDP, length 120
04:03:48.092703 IP 192.168.43.124.8880 > 192.168.43.195.7771: UDP, length 120
04:03:48.139326 IP 192.168.43.195.8880 > 192.168.43.124.7772: UDP, length 120
04:03:48.142731 IP 192.168.43.124.8880 > 192.168.43.195.7771: UDP, length 120
04:03:48.189327 IP 192.168.43.195.8880 > 192.168.43.124.7772: UDP, length 120
04:03:48.196193 IP 192.168.43.124.8880 > 192.168.43.195.7771: UDP, length 120
04:03:48.239324 IP 192.168.43.195.8880 > 192.168.43.124.7772: UDP, length 120
04:03:48.242728 IP 192.168.43.124.8880 > 192.168.43.195.7771: UDP, length 120
04:03:48.289320 IP 192.168.43.195.8880 > 192.168.43.124.7772: UDP, length 120
04:03:48.293162 IP 192.168.43.124.8880 > 192.168.43.195.7771: UDP, length 120
04:03:48.339316 IP 192.168.43.195.8880 > 192.168.43.124.7772: UDP, length 120
04:03:48.343989 IP 192.168.43.124.8880 > 192.168.43.195.7771: UDP, length 120
04:03:48.389318 IP 192.168.43.195.8880 > 192.168.43.124.7772: UDP, length 120
04:03:48.392722 IP 192.168.43.124.8880 > 192.168.43.195.7771: UDP, length 120
04:03:48.439317 IP 192.168.43.195.8880 > 192.168.43.124.7772: UDP, length 120
04:03:48.442702 IP 192.168.43.124.8880 > 192.168.43.195.7771: UDP, length 120
04:03:48.489320 IP 192.168.43.195.8880 > 192.168.43.124.7772: UDP, length 120
04:03:48.492728 IP 192.168.43.124.8880 > 192.168.43.195.7771: UDP, length 120
04:03:48.539320 IP 192.168.43.195.8880 > 192.168.43.124.7772: UDP, length 120
04:03:48.542750 IP 192.168.43.124.8880 > 192.168.43.195.7771: UDP, length 120
04:03:48.589331 IP 192.168.43.195.8880 > 192.168.43.124.7772: UDP, length 120
04:03:48.601241 IP 192.168.43.124.8880 > 192.168.43.195.7771: UDP, length 120
04:03:48.639325 IP 192.168.43.195.8880 > 192.168.43.124.7772: UDP, length 120
04:03:48.642753 IP 192.168.43.124.8880 > 192.168.43.195.7771: UDP, length 120
04:03:48.689321 IP 192.168.43.195.8880 > 192.168.43.124.7772: UDP, length 120
04:03:48.702634 IP 192.168.43.124.8880 > 192.168.43.195.7771: UDP, length 120
04:03:48.739319 IP 192.168.43.195.8880 > 192.168.43.124.7772: UDP, length 120
04:03:48.741930 IP 192.168.43.124.8880 > 192.168.43.195.7771: UDP, length 120
04:03:48.789316 IP 192.168.43.195.8880 > 192.168.43.124.7772: UDP, length 120
04:03:48.794802 IP 192.168.43.124.8880 > 192.168.43.195.7771: UDP, length 120
04:03:48.839319 IP 192.168.43.195.8880 > 192.168.43.124.7772: UDP, length 120
04:03:48.842145 IP 192.168.43.124.8880 > 192.168.43.195.7771: UDP, length 120
04:03:48.889317 IP 192.168.43.195.8880 > 192.168.43.124.7772: UDP, length 120
04:03:48.892241 IP 192.168.43.124.8880 > 192.168.43.195.7771: UDP, length 120
04:03:48.939317 IP 192.168.43.195.8880 > 192.168.43.124.7772: UDP, length 120
04:03:48.942332 IP 192.168.43.124.8880 > 192.168.43.195.7771: UDP, length 120
04:03:48.989374 IP 192.168.43.195.8880 > 192.168.43.124.7772: UDP, length 120
04:03:48.992522 IP 192.168.43.124.8880 > 192.168.43.195.7771: UDP, length 120
04:03:49.039354 IP 192.168.43.195.8880 > 192.168.43.124.7772: UDP, length 120
04:03:49.042615 IP 192.168.43.124.8880 > 192.168.43.195.7771: UDP, length 120
04:03:49.089327 IP 192.168.43.195.8880 > 192.168.43.124.7772: UDP, length 120
04:03:49.092729 IP 192.168.43.124.8880 > 192.168.43.195.7771: UDP, length 120
04:03:49.139327 IP 192.168.43.195.8880 > 192.168.43.124.7772: UDP, length 120
04:03:49.143635 IP 192.168.43.124.8880 > 192.168.43.195.7771: UDP, length 120
04:03:49.189323 IP 192.168.43.195.8880 > 192.168.43.124.7772: UDP, length 120
04:03:49.192825 IP 192.168.43.124.8880 > 192.168.43.195.7771: UDP, length 120
04:03:49.239321 IP 192.168.43.195.8880 > 192.168.43.124.7772: UDP, length 120
04:03:49.242800 IP 192.168.43.124.8880 > 192.168.43.195.7771: UDP, length 120
04:03:49.289330 IP 192.168.43.195.8880 > 192.168.43.124.7772: UDP, length 120
04:03:49.292834 IP 192.168.43.124.8880 > 192.168.43.195.7771: UDP, length 120
04:03:49.339328 IP 192.168.43.195.8880 > 192.168.43.124.7772: UDP, length 120
04:03:49.342736 IP 192.168.43.124.8880 > 192.168.43.195.7771: UDP, length 120
04:03:49.389322 IP 192.168.43.195.8880 > 192.168.43.124.7772: UDP, length 120
04:03:49.392737 IP 192.168.43.124.8880 > 192.168.43.195.7771: UDP, length 120
04:03:49.439322 IP 192.168.43.195.8880 > 192.168.43.124.7772: UDP, length 120
04:03:49.442718 IP 192.168.43.124.8880 > 192.168.43.195.7771: UDP, length 120
04:03:49.489321 IP 192.168.43.195.8880 > 192.168.43.124.7772: UDP, length 120
04:03:49.492745 IP 192.168.43.124.8880 > 192.168.43.195.7771: UDP, length 120
04:03:49.539321 IP 192.168.43.195.8880 > 192.168.43.124.7772: UDP, length 120
04:03:49.542735 IP 192.168.43.124.8880 > 192.168.43.195.7771: UDP, length 120
04:03:49.589318 IP 192.168.43.195.8880 > 192.168.43.124.7772: UDP, length 120
04:03:49.592717 IP 192.168.43.124.8880 > 192.168.43.195.7771: UDP, length 120
04:03:49.639318 IP 192.168.43.195.8880 > 192.168.43.124.7772: UDP, length 120
04:03:49.642727 IP 192.168.43.124.8880 > 192.168.43.195.7771: UDP, length 120
04:03:49.689320 IP 192.168.43.195.8880 > 192.168.43.124.7772: UDP, length 120
04:03:49.692746 IP 192.168.43.124.8880 > 192.168.43.195.7771: UDP, length 120
04:03:49.739318 IP 192.168.43.195.8880 > 192.168.43.124.7772: UDP, length 120
04:03:49.742719 IP 192.168.43.124.8880 > 192.168.43.195.7771: UDP, length 120
04:03:49.789317 IP 192.168.43.195.8880 > 192.168.43.124.7772: UDP, length 120
04:03:49.792729 IP 192.168.43.124.8880 > 192.168.43.195.7771: UDP, length 120
04:03:49.839319 IP 192.168.43.195.8880 > 192.168.43.124.7772: UDP, length 120
04:03:49.842743 IP 192.168.43.124.8880 > 192.168.43.195.7771: UDP, length 120
04:03:49.889321 IP 192.168.43.195.8880 > 192.168.43.124.7772: UDP, length 120
04:03:49.892746 IP 192.168.43.124.8880 > 192.168.43.195.7771: UDP, length 120
04:03:49.939335 IP 192.168.43.195.8880 > 192.168.43.124.7772: UDP, length 120
04:03:49.942753 IP 192.168.43.124.8880 > 192.168.43.195.7771: UDP, length 120
04:03:49.989325 IP 192.168.43.195.8880 > 192.168.43.124.7772: UDP, length 120
04:03:49.992733 IP 192.168.43.124.8880 > 192.168.43.195.7771: UDP, length 120
04:03:50.039318 IP 192.168.43.195.8880 > 192.168.43.124.7772: UDP, length 120
04:03:50.042726 IP 192.168.43.124.8880 > 192.168.43.195.7771: UDP, length 120
04:03:50.089316 IP 192.168.43.195.8880 > 192.168.43.124.7772: UDP, length 120
04:03:50.092755 IP 192.168.43.124.8880 > 192.168.43.195.7771: UDP, length 120
04:03:50.139325 IP 192.168.43.195.8880 > 192.168.43.124.7772: UDP, length 120
04:03:50.142733 IP 192.168.43.124.8880 > 192.168.43.195.7771: UDP, length 120
04:03:50.189359 IP 192.168.43.195.8880 > 192.168.43.124.7772: UDP, length 120
04:03:50.192799 IP 192.168.43.124.8880 > 192.168.43.195.7771: UDP, length 120
04:03:50.239332 IP 192.168.43.195.8880 > 192.168.43.124.7772: UDP, length 120
04:03:50.245761 IP 192.168.43.124.8880 > 192.168.43.195.7771: UDP, length 120
04:03:50.289329 IP 192.168.43.195.8880 > 192.168.43.124.7772: UDP, length 120
04:03:50.292774 IP 192.168.43.124.8880 > 192.168.43.195.7771: UDP, length 120
04:03:50.339327 IP 192.168.43.195.8880 > 192.168.43.124.7772: UDP, length 120
04:03:50.344060 IP 192.168.43.124.8880 > 192.168.43.195.7771: UDP, length 120
04:03:50.389321 IP 192.168.43.195.8880 > 192.168.43.124.7772: UDP, length 120
04:03:50.392746 IP 192.168.43.124.8880 > 192.168.43.195.7771: UDP, length 120
04:03:50.439318 IP 192.168.43.195.8880 > 192.168.43.124.7772: UDP, length 120
04:03:50.448949 IP 192.168.43.124.8880 > 192.168.43.195.7771: UDP, length 120
04:03:50.489382 IP 192.168.43.195.8880 > 192.168.43.124.7772: UDP, length 120
04:03:50.492941 IP 192.168.43.124.8880 > 192.168.43.195.7771: UDP, length 120
04:03:50.539339 IP 192.168.43.195.8880 > 192.168.43.124.7772: UDP, length 120
04:03:50.545843 IP 192.168.43.124.8880 > 192.168.43.195.7771: UDP, length 120
04:03:50.589324 IP 192.168.43.195.8880 > 192.168.43.124.7772: UDP, length 120
04:03:50.604696 IP 192.168.43.124.8880 > 192.168.43.195.7771: UDP, length 120
04:03:50.639321 IP 192.168.43.195.8880 > 192.168.43.124.7772: UDP, length 120
04:03:50.642736 IP 192.168.43.124.8880 > 192.168.43.195.7771: UDP, length 120
04:03:50.689319 IP 192.168.43.195.8880 > 192.168.43.124.7772: UDP, length 120
04:03:50.692748 IP 192.168.43.124.8880 > 192.168.43.195.7771: UDP, length 120
04:03:50.739317 IP 192.168.43.195.8880 > 192.168.43.124.7772: UDP, length 120
04:03:50.751552 IP 192.168.43.124.8880 > 192.168.43.195.7771: UDP, length 120
04:03:50.789317 IP 192.168.43.195.8880 > 192.168.43.124.7772: UDP, length 120
04:03:50.798484 IP 192.168.43.124.8880 > 192.168.43.195.7771: UDP, length 120
04:03:50.839317 IP 192.168.43.195.8880 > 192.168.43.124.7772: UDP, length 120
04:03:50.842733 IP 192.168.43.124.8880 > 192.168.43.195.7771: UDP, length 120
04:03:50.889319 IP 192.168.43.195.8880 > 192.168.43.124.7772: UDP, length 120
04:03:50.892738 IP 192.168.43.124.8880 > 192.168.43.195.7771: UDP, length 120
04:03:50.939320 IP 192.168.43.195.8880 > 192.168.43.124.7772: UDP, length 120
04:03:50.947751 IP 192.168.43.124.8880 > 192.168.43.195.7771: UDP, length 120
04:03:50.989318 IP 192.168.43.195.8880 > 192.168.43.124.7772: UDP, length 120
04:03:50.992704 IP 192.168.43.124.8880 > 192.168.43.195.7771: UDP, length 120
04:03:51.039317 IP 192.168.43.195.8880 > 192.168.43.124.7772: UDP, length 120
04:03:51.042703 IP 192.168.43.124.8880 > 192.168.43.195.7771: UDP, length 120
04:03:51.089318 IP 192.168.43.195.8880 > 192.168.43.124.7772: UDP, length 120
04:03:51.097398 IP 192.168.43.124.8880 > 192.168.43.195.7771: UDP, length 120
04:03:51.139337 IP 192.168.43.195.8880 > 192.168.43.124.7772: UDP, length 120
04:03:51.156780 IP 192.168.43.124.8880 > 192.168.43.195.7771: UDP, length 120
04:03:51.189330 IP 192.168.43.195.8880 > 192.168.43.124.7772: UDP, length 120
04:03:51.192723 IP 192.168.43.124.8880 > 192.168.43.195.7771: UDP, length 120
04:03:51.239318 IP 192.168.43.195.8880 > 192.168.43.124.7772: UDP, length 120
04:03:51.248862 IP 192.168.43.124.8880 > 192.168.43.195.7771: UDP, length 120
04:03:51.289317 IP 192.168.43.195.8880 > 192.168.43.124.7772: UDP, length 120
04:03:51.292707 IP 192.168.43.124.8880 > 192.168.43.195.7771: UDP, length 120
04:03:51.339322 IP 192.168.43.195.8880 > 192.168.43.124.7772: UDP, length 120
04:03:51.342729 IP 192.168.43.124.8880 > 192.168.43.195.7771: UDP, length 120
04:03:51.389319 IP 192.168.43.195.8880 > 192.168.43.124.7772: UDP, length 120
04:03:51.397765 IP 192.168.43.124.8880 > 192.168.43.195.7771: UDP, length 120
04:03:51.439322 IP 192.168.43.195.8880 > 192.168.43.124.7772: UDP, length 120
04:03:51.442710 IP 192.168.43.124.8880 > 192.168.43.195.7771: UDP, length 120
04:03:51.489324 IP 192.168.43.195.8880 > 192.168.43.124.7772: UDP, length 120
04:03:51.492751 IP 192.168.43.124.8880 > 192.168.43.195.7771: UDP, length 120
04:03:51.539321 IP 192.168.43.195.8880 > 192.168.43.124.7772: UDP, length 120
04:03:51.554055 IP 192.168.43.124.8880 > 192.168.43.195.7771: UDP, length 120
04:03:51.589323 IP 192.168.43.195.8880 > 192.168.43.124.7772: UDP, length 120
04:03:51.592734 IP 192.168.43.124.8880 > 192.168.43.195.7771: UDP, length 120
04:03:51.639323 IP 192.168.43.195.8880 > 192.168.43.124.7772: UDP, length 120
04:03:51.642719 IP 192.168.43.124.8880 > 192.168.43.195.7771: UDP, length 120
04:03:51.689320 IP 192.168.43.195.8880 > 192.168.43.124.7772: UDP, length 120
04:03:51.704348 IP 192.168.43.124.8880 > 192.168.43.195.7771: UDP, length 120
04:03:51.739319 IP 192.168.43.195.8880 > 192.168.43.124.7772: UDP, length 120
04:03:51.742745 IP 192.168.43.124.8880 > 192.168.43.195.7771: UDP, length 120
04:03:51.789317 IP 192.168.43.195.8880 > 192.168.43.124.7772: UDP, length 120
04:03:51.801340 IP 192.168.43.124.8880 > 192.168.43.195.7771: UDP, length 120
04:03:51.839318 IP 192.168.43.195.8880 > 192.168.43.124.7772: UDP, length 120
04:03:51.847205 IP 192.168.43.124.8880 > 192.168.43.195.7771: UDP, length 120
04:03:51.889319 IP 192.168.43.195.8880 > 192.168.43.124.7772: UDP, length 120
04:03:51.892776 IP 192.168.43.124.8880 > 192.168.43.195.7771: UDP, length 120
04:03:51.939320 IP 192.168.43.195.8880 > 192.168.43.124.7772: UDP, length 120
04:03:51.942744 IP 192.168.43.124.8880 > 192.168.43.195.7771: UDP, length 120
04:03:51.989963 IP 192.168.43.195.8880 > 192.168.43.124.7772: UDP, length 120
04:03:51.997869 IP 192.168.43.124.8880 > 192.168.43.195.7771: UDP, length 120
04:03:52.039342 IP 192.168.43.195.8880 > 192.168.43.124.7772: UDP, length 120
04:03:52.042788 IP 192.168.43.124.8880 > 192.168.43.195.7771: UDP, length 120
04:03:52.089323 IP 192.168.43.195.8880 > 192.168.43.124.7772: UDP, length 120
04:03:52.092740 IP 192.168.43.124.8880 > 192.168.43.195.7771: UDP, length 120
04:03:52.139331 IP 192.168.43.195.8880 > 192.168.43.124.7772: UDP, length 120
04:03:52.154880 IP 192.168.43.124.8880 > 192.168.43.195.7771: UDP, length 120
04:03:52.189324 IP 192.168.43.195.8880 > 192.168.43.124.7772: UDP, length 120
04:03:52.192749 IP 192.168.43.124.8880 > 192.168.43.195.7771: UDP, length 120
04:03:52.239319 IP 192.168.43.195.8880 > 192.168.43.124.7772: UDP, length 120
04:03:52.242728 IP 192.168.43.124.8880 > 192.168.43.195.7771: UDP, length 120
04:03:52.289318 IP 192.168.43.195.8880 > 192.168.43.124.7772: UDP, length 120
04:03:52.298001 IP 192.168.43.124.8880 > 192.168.43.195.7771: UDP, length 120
04:03:52.339316 IP 192.168.43.195.8880 > 192.168.43.124.7772: UDP, length 120
04:03:52.342768 IP 192.168.43.124.8880 > 192.168.43.195.7771: UDP, length 120
04:03:52.389318 IP 192.168.43.195.8880 > 192.168.43.124.7772: UDP, length 120
04:03:52.392718 IP 192.168.43.124.8880 > 192.168.43.195.7771: UDP, length 120
04:03:52.439328 IP 192.168.43.195.8880 > 192.168.43.124.7772: UDP, length 120
04:03:52.447876 IP 192.168.43.124.8880 > 192.168.43.195.7771: UDP, length 120
04:03:52.489327 IP 192.168.43.195.8880 > 192.168.43.124.7772: UDP, length 120
04:03:52.492731 IP 192.168.43.124.8880 > 192.168.43.195.7771: UDP, length 120
04:03:52.539323 IP 192.168.43.195.8880 > 192.168.43.124.7772: UDP, length 120
04:03:52.542734 IP 192.168.43.124.8880 > 192.168.43.195.7771: UDP, length 120
04:03:52.589317 IP 192.168.43.195.8880 > 192.168.43.124.7772: UDP, length 120
04:03:52.598023 IP 192.168.43.124.8880 > 192.168.43.195.7771: UDP, length 120
04:03:52.639318 IP 192.168.43.195.8880 > 192.168.43.124.7772: UDP, length 120
04:03:52.642728 IP 192.168.43.124.8880 > 192.168.43.195.7771: UDP, length 120
04:03:52.689317 IP 192.168.43.195.8880 > 192.168.43.124.7772: UDP, length 120
04:03:52.692734 IP 192.168.43.124.8880 > 192.168.43.195.7771: UDP, length 120
04:03:52.739317 IP 192.168.43.195.8880 > 192.168.43.124.7772: UDP, length 120
04:03:52.747860 IP 192.168.43.124.8880 > 192.168.43.195.7771: UDP, length 120
04:03:52.789319 IP 192.168.43.195.8880 > 192.168.43.124.7772: UDP, length 120
04:03:52.792749 IP 192.168.43.124.8880 > 192.168.43.195.7771: UDP, length 120
04:03:52.839319 IP 192.168.43.195.8880 > 192.168.43.124.7772: UDP, length 120
04:03:52.846815 IP 192.168.43.124.8880 > 192.168.43.195.7771: UDP, length 120
04:03:52.889318 IP 192.168.43.195.8880 > 192.168.43.124.7772: UDP, length 120
04:03:52.904129 IP 192.168.43.124.8880 > 192.168.43.195.7771: UDP, length 120
04:03:52.939318 IP 192.168.43.195.8880 > 192.168.43.124.7772: UDP, length 120
04:03:52.942729 IP 192.168.43.124.8880 > 192.168.43.195.7771: UDP, length 120
04:03:52.989316 IP 192.168.43.195.8880 > 192.168.43.124.7772: UDP, length 120
04:03:52.993473 IP 192.168.43.124.8880 > 192.168.43.195.7771: UDP, length 120
04:03:53.039317 IP 192.168.43.195.8880 > 192.168.43.124.7772: UDP, length 120
04:03:53.047775 IP 192.168.43.124.8880 > 192.168.43.195.7771: UDP, length 120
04:03:53.089318 IP 192.168.43.195.8880 > 192.168.43.124.7772: UDP, length 120
04:03:53.113847 IP 192.168.43.124.8880 > 192.168.43.195.7771: UDP, length 120
04:03:53.139326 IP 192.168.43.195.8880 > 192.168.43.124.7772: UDP, length 120
04:03:53.143785 IP 192.168.43.124.8880 > 192.168.43.195.7771: UDP, length 120
04:03:53.189323 IP 192.168.43.195.8880 > 192.168.43.124.7772: UDP, length 120
04:03:53.198415 IP 192.168.43.124.8880 > 192.168.43.195.7771: UDP, length 120
04:03:53.239319 IP 192.168.43.195.8880 > 192.168.43.124.7772: UDP, length 120
04:03:53.242707 IP 192.168.43.124.8880 > 192.168.43.195.7771: UDP, length 120
04:03:53.289317 IP 192.168.43.195.8880 > 192.168.43.124.7772: UDP, length 120
04:03:53.292727 IP 192.168.43.124.8880 > 192.168.43.195.7771: UDP, length 120
04:03:53.339317 IP 192.168.43.195.8880 > 192.168.43.124.7772: UDP, length 120
04:03:53.347927 IP 192.168.43.124.8880 > 192.168.43.195.7771: UDP, length 120
04:03:53.389317 IP 192.168.43.195.8880 > 192.168.43.124.7772: UDP, length 120
04:03:53.392719 IP 192.168.43.124.8880 > 192.168.43.195.7771: UDP, length 120
04:03:53.439319 IP 192.168.43.195.8880 > 192.168.43.124.7772: UDP, length 120
04:03:53.442717 IP 192.168.43.124.8880 > 192.168.43.195.7771: UDP, length 120
04:03:53.491821 IP 192.168.43.195.8880 > 192.168.43.124.7772: UDP, length 120
04:03:53.506699 IP 192.168.43.124.8880 > 192.168.43.195.7771: UDP, length 120
04:03:53.539350 IP 192.168.43.195.8880 > 192.168.43.124.7772: UDP, length 120
04:03:53.542812 IP 192.168.43.124.8880 > 192.168.43.195.7771: UDP, length 120
04:03:53.589337 IP 192.168.43.195.8880 > 192.168.43.124.7772: UDP, length 120
04:03:53.592783 IP 192.168.43.124.8880 > 192.168.43.195.7771: UDP, length 120
04:03:53.639326 IP 192.168.43.195.8880 > 192.168.43.124.7772: UDP, length 120
04:03:53.642745 IP 192.168.43.124.8880 > 192.168.43.195.7771: UDP, length 120
04:03:53.689320 IP 192.168.43.195.8880 > 192.168.43.124.7772: UDP, length 120
04:03:53.699919 IP 192.168.43.124.8880 > 192.168.43.195.7771: UDP, length 120
04:03:53.739318 IP 192.168.43.195.8880 > 192.168.43.124.7772: UDP, length 120
04:03:53.742734 IP 192.168.43.124.8880 > 192.168.43.195.7771: UDP, length 120
04:03:53.789316 IP 192.168.43.195.8880 > 192.168.43.124.7772: UDP, length 120
04:03:53.792742 IP 192.168.43.124.8880 > 192.168.43.195.7771: UDP, length 120
04:03:53.839319 IP 192.168.43.195.8880 > 192.168.43.124.7772: UDP, length 120
04:03:53.842759 IP 192.168.43.124.8880 > 192.168.43.195.7771: UDP, length 120
04:03:53.889317 IP 192.168.43.195.8880 > 192.168.43.124.7772: UDP, length 120
04:03:53.903171 IP 192.168.43.124.8880 > 192.168.43.195.7771: UDP, length 120
04:03:53.939320 IP 192.168.43.195.8880 > 192.168.43.124.7772: UDP, length 120
04:03:53.942740 IP 192.168.43.124.8880 > 192.168.43.195.7771: UDP, length 120
04:03:53.989318 IP 192.168.43.195.8880 > 192.168.43.124.7772: UDP, length 120
04:03:53.992740 IP 192.168.43.124.8880 > 192.168.43.195.7771: UDP, length 120
04:03:54.039317 IP 192.168.43.195.8880 > 192.168.43.124.7772: UDP, length 120
04:03:54.049658 IP 192.168.43.124.8880 > 192.168.43.195.7771: UDP, length 120
04:03:54.089327 IP 192.168.43.195.8880 > 192.168.43.124.7772: UDP, length 120
04:03:54.092754 IP 192.168.43.124.8880 > 192.168.43.195.7771: UDP, length 120
04:03:54.139328 IP 192.168.43.195.8880 > 192.168.43.124.7772: UDP, length 120
04:03:54.142766 IP 192.168.43.124.8880 > 192.168.43.195.7771: UDP, length 120
04:03:54.189323 IP 192.168.43.195.8880 > 192.168.43.124.7772: UDP, length 120
04:03:54.214127 IP 192.168.43.124.8880 > 192.168.43.195.7771: UDP, length 120
04:03:54.239317 IP 192.168.43.195.8880 > 192.168.43.124.7772: UDP, length 120
04:03:54.242728 IP 192.168.43.124.8880 > 192.168.43.195.7771: UDP, length 120
04:03:54.289318 IP 192.168.43.195.8880 > 192.168.43.124.7772: UDP, length 120
04:03:54.292730 IP 192.168.43.124.8880 > 192.168.43.195.7771: UDP, length 120
04:03:54.339317 IP 192.168.43.195.8880 > 192.168.43.124.7772: UDP, length 120
04:03:54.342727 IP 192.168.43.124.8880 > 192.168.43.195.7771: UDP, length 120
04:03:54.389317 IP 192.168.43.195.8880 > 192.168.43.124.7772: UDP, length 120
04:03:54.400094 IP 192.168.43.124.8880 > 192.168.43.195.7771: UDP, length 120
04:03:54.439318 IP 192.168.43.195.8880 > 192.168.43.124.7772: UDP, length 120
04:03:54.442727 IP 192.168.43.124.8880 > 192.168.43.195.7771: UDP, length 120
04:03:54.489318 IP 192.168.43.195.8880 > 192.168.43.124.7772: UDP, length 120
04:03:54.492732 IP 192.168.43.124.8880 > 192.168.43.195.7771: UDP, length 120
04:03:54.539323 IP 192.168.43.195.8880 > 192.168.43.124.7772: UDP, length 120
04:03:54.542748 IP 192.168.43.124.8880 > 192.168.43.195.7771: UDP, length 120
04:03:54.589324 IP 192.168.43.195.8880 > 192.168.43.124.7772: UDP, length 120
04:03:54.599989 IP 192.168.43.124.8880 > 192.168.43.195.7771: UDP, length 120
04:03:54.639326 IP 192.168.43.195.8880 > 192.168.43.124.7772: UDP, length 120
04:03:54.642790 IP 192.168.43.124.8880 > 192.168.43.195.7771: UDP, length 120
04:03:54.689325 IP 192.168.43.195.8880 > 192.168.43.124.7772: UDP, length 120
04:03:54.692724 IP 192.168.43.124.8880 > 192.168.43.195.7771: UDP, length 120
04:03:54.739319 IP 192.168.43.195.8880 > 192.168.43.124.7772: UDP, length 120
04:03:54.742715 IP 192.168.43.124.8880 > 192.168.43.195.7771: UDP, length 120
04:03:54.789320 IP 192.168.43.195.8880 > 192.168.43.124.7772: UDP, length 120
04:03:54.800065 IP 192.168.43.124.8880 > 192.168.43.195.7771: UDP, length 120
04:03:54.839318 IP 192.168.43.195.8880 > 192.168.43.124.7772: UDP, length 120
04:03:54.842732 IP 192.168.43.124.8880 > 192.168.43.195.7771: UDP, length 120
04:03:54.889328 IP 192.168.43.195.8880 > 192.168.43.124.7772: UDP, length 120
04:03:54.892757 IP 192.168.43.124.8880 > 192.168.43.195.7771: UDP, length 120
04:03:54.939323 IP 192.168.43.195.8880 > 192.168.43.124.7772: UDP, length 120
04:03:54.943004 IP 192.168.43.124.8880 > 192.168.43.195.7771: UDP, length 120
04:03:54.989323 IP 192.168.43.195.8880 > 192.168.43.124.7772: UDP, length 120
04:03:55.000160 IP 192.168.43.124.8880 > 192.168.43.195.7771: UDP, length 120
04:03:55.039373 IP 192.168.43.195.8880 > 192.168.43.124.7772: UDP, length 120
04:03:55.042813 IP 192.168.43.124.8880 > 192.168.43.195.7771: UDP, length 120
04:03:55.089324 IP 192.168.43.195.8880 > 192.168.43.124.7772: UDP, length 120
04:03:55.092751 IP 192.168.43.124.8880 > 192.168.43.195.7771: UDP, length 120
04:03:55.139329 IP 192.168.43.195.8880 > 192.168.43.124.7772: UDP, length 120
04:03:55.170104 IP 192.168.43.124.8880 > 192.168.43.195.7771: UDP, length 120
04:03:55.189326 IP 192.168.43.195.8880 > 192.168.43.124.7772: UDP, length 120
04:03:55.192738 IP 192.168.43.124.8880 > 192.168.43.195.7771: UDP, length 120
04:03:55.239320 IP 192.168.43.195.8880 > 192.168.43.124.7772: UDP, length 120
04:03:55.246440 IP 192.168.43.124.8880 > 192.168.43.195.7771: UDP, length 120
04:03:55.289318 IP 192.168.43.195.8880 > 192.168.43.124.7772: UDP, length 120
04:03:55.292718 IP 192.168.43.124.8880 > 192.168.43.195.7771: UDP, length 120
04:03:55.339318 IP 192.168.43.195.8880 > 192.168.43.124.7772: UDP, length 120
04:03:55.350051 IP 192.168.43.124.8880 > 192.168.43.195.7771: UDP, length 120
04:03:55.389319 IP 192.168.43.195.8880 > 192.168.43.124.7772: UDP, length 120
04:03:55.392737 IP 192.168.43.124.8880 > 192.168.43.195.7771: UDP, length 120
04:03:55.439318 IP 192.168.43.195.8880 > 192.168.43.124.7772: UDP, length 120
04:03:55.442715 IP 192.168.43.124.8880 > 192.168.43.195.7771: UDP, length 120
04:03:55.489318 IP 192.168.43.195.8880 > 192.168.43.124.7772: UDP, length 120
04:03:55.492719 IP 192.168.43.124.8880 > 192.168.43.195.7771: UDP, length 120
04:03:55.539316 IP 192.168.43.195.8880 > 192.168.43.124.7772: UDP, length 120
04:03:55.553098 IP 192.168.43.124.8880 > 192.168.43.195.7771: UDP, length 120
04:03:55.589319 IP 192.168.43.195.8880 > 192.168.43.124.7772: UDP, length 120
04:03:55.592699 IP 192.168.43.124.8880 > 192.168.43.195.7771: UDP, length 120
04:03:55.639327 IP 192.168.43.195.8880 > 192.168.43.124.7772: UDP, length 120
04:03:55.642745 IP 192.168.43.124.8880 > 192.168.43.195.7771: UDP, length 120
04:03:55.689327 IP 192.168.43.195.8880 > 192.168.43.124.7772: UDP, length 120
04:03:55.701055 IP 192.168.43.124.8880 > 192.168.43.195.7771: UDP, length 120
04:03:55.739319 IP 192.168.43.195.8880 > 192.168.43.124.7772: UDP, length 120
04:03:55.742737 IP 192.168.43.124.8880 > 192.168.43.195.7771: UDP, length 120
04:03:55.789318 IP 192.168.43.195.8880 > 192.168.43.124.7772: UDP, length 120
04:03:55.792715 IP 192.168.43.124.8880 > 192.168.43.195.7771: UDP, length 120
04:03:55.839317 IP 192.168.43.195.8880 > 192.168.43.124.7772: UDP, length 120
04:03:55.856215 IP 192.168.43.124.8880 > 192.168.43.195.7771: UDP, length 120
04:03:55.889317 IP 192.168.43.195.8880 > 192.168.43.124.7772: UDP, length 120
04:03:55.892702 IP 192.168.43.124.8880 > 192.168.43.195.7771: UDP, length 120
04:03:55.939318 IP 192.168.43.195.8880 > 192.168.43.124.7772: UDP, length 120
04:03:55.942711 IP 192.168.43.124.8880 > 192.168.43.195.7771: UDP, length 120
04:03:55.989317 IP 192.168.43.195.8880 > 192.168.43.124.7772: UDP, length 120
04:03:55.999833 IP 192.168.43.124.8880 > 192.168.43.195.7771: UDP, length 120
04:03:56.039317 IP 192.168.43.195.8880 > 192.168.43.124.7772: UDP, length 120
04:03:56.042736 IP 192.168.43.124.8880 > 192.168.43.195.7771: UDP, length 120
04:03:56.089317 IP 192.168.43.195.8880 > 192.168.43.124.7772: UDP, length 120
04:03:56.136223 IP 192.168.43.124.8880 > 192.168.43.195.7771: UDP, length 120
04:03:56.139326 IP 192.168.43.195.8880 > 192.168.43.124.7772: UDP, length 120
04:03:56.164742 IP 192.168.43.124.8880 > 192.168.43.195.7771: UDP, length 120
04:03:56.189325 IP 192.168.43.195.8880 > 192.168.43.124.7772: UDP, length 120
04:03:56.196920 IP 192.168.43.124.8880 > 192.168.43.195.7771: UDP, length 120
04:03:56.239318 IP 192.168.43.195.8880 > 192.168.43.124.7772: UDP, length 120
04:03:56.242725 IP 192.168.43.124.8880 > 192.168.43.195.7771: UDP, length 120
04:03:56.289316 IP 192.168.43.195.8880 > 192.168.43.124.7772: UDP, length 120
04:03:56.305610 IP 192.168.43.124.8880 > 192.168.43.195.7771: UDP, length 120
04:03:56.339320 IP 192.168.43.195.8880 > 192.168.43.124.7772: UDP, length 120
04:03:56.342717 IP 192.168.43.124.8880 > 192.168.43.195.7771: UDP, length 120
04:03:56.389318 IP 192.168.43.195.8880 > 192.168.43.124.7772: UDP, length 120
04:03:56.424690 IP 192.168.43.124.8880 > 192.168.43.195.7771: UDP, length 120
04:03:56.439317 IP 192.168.43.195.8880 > 192.168.43.124.7772: UDP, length 120
04:03:56.489315 IP 192.168.43.195.8880 > 192.168.43.124.7772: UDP, length 120
04:03:56.504466 IP 192.168.43.124.8880 > 192.168.43.195.7771: UDP, length 120
04:03:56.511923 IP 192.168.43.124.8880 > 192.168.43.195.7771: UDP, length 120
04:03:56.539374 IP 192.168.43.195.8880 > 192.168.43.124.7772: UDP, length 120
04:03:56.542809 IP 192.168.43.124.8880 > 192.168.43.195.7771: UDP, length 120
04:03:56.589327 IP 192.168.43.195.8880 > 192.168.43.124.7772: UDP, length 120
04:03:56.592721 IP 192.168.43.124.8880 > 192.168.43.195.7771: UDP, length 120
04:03:56.639323 IP 192.168.43.195.8880 > 192.168.43.124.7772: UDP, length 120
04:03:56.689323 IP 192.168.43.195.8880 > 192.168.43.124.7772: UDP, length 120
04:03:56.729560 IP 192.168.43.124.8880 > 192.168.43.195.7771: UDP, length 120
04:03:56.729694 IP 192.168.43.124.8880 > 192.168.43.195.7771: UDP, length 120
04:03:56.739324 IP 192.168.43.195.8880 > 192.168.43.124.7772: UDP, length 120
04:03:56.789316 IP 192.168.43.195.8880 > 192.168.43.124.7772: UDP, length 120
04:03:56.839316 IP 192.168.43.195.8880 > 192.168.43.124.7772: UDP, length 120
04:03:56.889315 IP 192.168.43.195.8880 > 192.168.43.124.7772: UDP, length 120
04:03:56.897820 IP 192.168.43.124.8880 > 192.168.43.195.7771: UDP, length 120
04:03:56.901219 IP 192.168.43.124.8880 > 192.168.43.195.7771: UDP, length 120
04:03:56.939321 IP 192.168.43.195.8880 > 192.168.43.124.7772: UDP, length 120
04:03:56.989316 IP 192.168.43.195.8880 > 192.168.43.124.7772: UDP, length 120
04:03:57.039314 IP 192.168.43.195.8880 > 192.168.43.124.7772: UDP, length 120
04:03:57.089313 IP 192.168.43.195.8880 > 192.168.43.124.7772: UDP, length 120
04:03:57.139327 IP 192.168.43.195.8880 > 192.168.43.124.7772: UDP, length 120
04:03:57.189323 IP 192.168.43.195.8880 > 192.168.43.124.7772: UDP, length 120
04:03:57.239315 IP 192.168.43.195.8880 > 192.168.43.124.7772: UDP, length 120
04:03:57.271273 IP 192.168.43.124.8880 > 192.168.43.195.7771: UDP, length 120
04:03:57.289319 IP 192.168.43.195.8880 > 192.168.43.124.7772: UDP, length 120
04:03:57.339315 IP 192.168.43.195.8880 > 192.168.43.124.7772: UDP, length 120
04:03:57.389315 IP 192.168.43.195.8880 > 192.168.43.124.7772: UDP, length 120
04:03:57.439315 IP 192.168.43.195.8880 > 192.168.43.124.7772: UDP, length 120
04:03:57.489314 IP 192.168.43.195.8880 > 192.168.43.124.7772: UDP, length 120
04:03:57.539315 IP 192.168.43.195.8880 > 192.168.43.124.7772: UDP, length 120
04:03:57.545136 IP 192.168.43.124.8880 > 192.168.43.195.7771: UDP, length 120
04:03:57.545398 IP 192.168.43.124.8880 > 192.168.43.195.7771: UDP, length 120
04:03:57.545608 IP 192.168.43.124.8880 > 192.168.43.195.7771: UDP, length 120
04:03:57.589323 IP 192.168.43.195.8880 > 192.168.43.124.7772: UDP, length 120
04:03:57.618226 IP 192.168.43.124.8880 > 192.168.43.195.7771: UDP, length 120
04:03:57.639320 IP 192.168.43.195.8880 > 192.168.43.124.7772: UDP, length 120
04:03:57.679648 IP 192.168.43.124.8880 > 192.168.43.195.7771: UDP, length 120
04:03:57.689318 IP 192.168.43.195.8880 > 192.168.43.124.7772: UDP, length 120
04:03:57.739321 IP 192.168.43.195.8880 > 192.168.43.124.7772: UDP, length 120
04:03:57.789315 IP 192.168.43.195.8880 > 192.168.43.124.7772: UDP, length 120
04:03:57.839319 IP 192.168.43.195.8880 > 192.168.43.124.7772: UDP, length 120
04:03:57.889315 IP 192.168.43.195.8880 > 192.168.43.124.7772: UDP, length 120
04:03:57.927434 IP 192.168.43.124.8880 > 192.168.43.195.7771: UDP, length 120
04:03:57.939319 IP 192.168.43.195.8880 > 192.168.43.124.7772: UDP, length 120
04:03:57.989316 IP 192.168.43.195.8880 > 192.168.43.124.7772: UDP, length 120
04:03:58.032048 IP 192.168.43.124.8880 > 192.168.43.195.7771: UDP, length 120
04:03:58.032389 IP 192.168.43.124.8880 > 192.168.43.195.7771: UDP, length 120
04:03:58.032605 IP 192.168.43.124.8880 > 192.168.43.195.7771: UDP, length 120
04:03:58.032818 IP 192.168.43.124.8880 > 192.168.43.195.7771: UDP, length 120
04:03:58.033024 IP 192.168.43.124.8880 > 192.168.43.195.7771: UDP, length 120
04:03:58.039372 IP 192.168.43.195.8880 > 192.168.43.124.7772: UDP, length 120
04:03:58.040116 IP 192.168.43.124.8880 > 192.168.43.195.7771: UDP, length 120
04:03:58.089326 IP 192.168.43.195.8880 > 192.168.43.124.7772: UDP, length 120
04:03:58.139325 IP 192.168.43.195.8880 > 192.168.43.124.7772: UDP, length 120
04:03:58.189320 IP 192.168.43.195.8880 > 192.168.43.124.7772: UDP, length 120
04:03:58.239368 IP 192.168.43.195.8880 > 192.168.43.124.7772: UDP, length 120
04:03:58.289314 IP 192.168.43.195.8880 > 192.168.43.124.7772: UDP, length 120
04:03:58.330836 IP 192.168.43.124.8880 > 192.168.43.195.7771: UDP, length 120
04:03:58.332424 IP 192.168.43.124.8880 > 192.168.43.195.7771: UDP, length 120
04:03:58.332639 IP 192.168.43.124.8880 > 192.168.43.195.7771: UDP, length 120
04:03:58.339321 IP 192.168.43.195.8880 > 192.168.43.124.7772: UDP, length 120
04:03:58.343650 IP 192.168.43.124.8880 > 192.168.43.195.7771: UDP, length 120
04:03:58.389320 IP 192.168.43.195.8880 > 192.168.43.124.7772: UDP, length 120
04:03:58.439317 IP 192.168.43.195.8880 > 192.168.43.124.7772: UDP, length 120
04:03:58.489315 IP 192.168.43.195.8880 > 192.168.43.124.7772: UDP, length 120
04:03:58.539316 IP 192.168.43.195.8880 > 192.168.43.124.7772: UDP, length 120
04:03:58.589314 IP 192.168.43.195.8880 > 192.168.43.124.7772: UDP, length 120
04:03:58.603213 IP 192.168.43.124.8880 > 192.168.43.195.7771: UDP, length 120
04:03:58.603336 IP 192.168.43.124.8880 > 192.168.43.195.7771: UDP, length 120
04:03:58.604976 IP 192.168.43.124.8880 > 192.168.43.195.7771: UDP, length 120
04:03:58.605191 IP 192.168.43.124.8880 > 192.168.43.195.7771: UDP, length 120
04:03:58.639328 IP 192.168.43.195.8880 > 192.168.43.124.7772: UDP, length 120
04:03:58.689319 IP 192.168.43.195.8880 > 192.168.43.124.7772: UDP, length 120
04:03:58.707197 IP 192.168.43.124.8880 > 192.168.43.195.7771: UDP, length 120
04:03:58.728188 IP 192.168.43.124.8880 > 192.168.43.195.7771: UDP, length 120
04:03:58.739320 IP 192.168.43.195.8880 > 192.168.43.124.7772: UDP, length 120
04:03:58.780655 IP 192.168.43.124.8880 > 192.168.43.195.7771: UDP, length 120
04:03:58.789319 IP 192.168.43.195.8880 > 192.168.43.124.7772: UDP, length 120
04:03:58.797773 IP 192.168.43.124.8880 > 192.168.43.195.7771: UDP, length 120
04:03:58.839333 IP 192.168.43.195.8880 > 192.168.43.124.7772: UDP, length 120
04:03:58.889319 IP 192.168.43.195.8880 > 192.168.43.124.7772: UDP, length 120
04:03:58.939314 IP 192.168.43.195.8880 > 192.168.43.124.7772: UDP, length 120
04:03:58.989314 IP 192.168.43.195.8880 > 192.168.43.124.7772: UDP, length 120
04:03:58.989843 IP 192.168.43.124.8880 > 192.168.43.195.7771: UDP, length 120
04:03:58.989990 IP 192.168.43.124.8880 > 192.168.43.195.7771: UDP, length 120
04:03:58.992050 IP 192.168.43.124.8880 > 192.168.43.195.7771: UDP, length 120
04:03:59.039318 IP 192.168.43.195.8880 > 192.168.43.124.7772: UDP, length 120
04:03:59.089314 IP 192.168.43.195.8880 > 192.168.43.124.7772: UDP, length 120
04:03:59.139319 IP 192.168.43.195.8880 > 192.168.43.124.7772: UDP, length 120
04:03:59.139518 IP 192.168.43.124.8880 > 192.168.43.195.7771: UDP, length 120
04:03:59.142620 IP 192.168.43.124.8880 > 192.168.43.195.7771: UDP, length 120
04:03:59.169506 IP 192.168.43.124.8880 > 192.168.43.195.7771: UDP, length 120
04:03:59.189324 IP 192.168.43.195.8880 > 192.168.43.124.7772: UDP, length 120
04:03:59.192891 IP 192.168.43.124.8880 > 192.168.43.195.7771: UDP, length 120
04:03:59.239320 IP 192.168.43.195.8880 > 192.168.43.124.7772: UDP, length 120
04:03:59.245013 IP 192.168.43.124.8880 > 192.168.43.195.7771: UDP, length 120
04:03:59.289316 IP 192.168.43.195.8880 > 192.168.43.124.7772: UDP, length 120
04:03:59.292736 IP 192.168.43.124.8880 > 192.168.43.195.7771: UDP, length 120
04:03:59.339317 IP 192.168.43.195.8880 > 192.168.43.124.7772: UDP, length 120
04:03:59.352624 IP 192.168.43.124.8880 > 192.168.43.195.7771: UDP, length 120
04:03:59.389316 IP 192.168.43.195.8880 > 192.168.43.124.7772: UDP, length 120
04:03:59.392725 IP 192.168.43.124.8880 > 192.168.43.195.7771: UDP, length 120
04:03:59.439317 IP 192.168.43.195.8880 > 192.168.43.124.7772: UDP, length 120
04:03:59.442726 IP 192.168.43.124.8880 > 192.168.43.195.7771: UDP, length 120
04:03:59.489318 IP 192.168.43.195.8880 > 192.168.43.124.7772: UDP, length 120
04:03:59.493904 IP 192.168.43.124.8880 > 192.168.43.195.7771: UDP, length 120
04:03:59.539378 IP 192.168.43.195.8880 > 192.168.43.124.7772: UDP, length 120
04:03:59.542857 IP 192.168.43.124.8880 > 192.168.43.195.7771: UDP, length 120
04:03:59.589331 IP 192.168.43.195.8880 > 192.168.43.124.7772: UDP, length 120
04:03:59.592758 IP 192.168.43.124.8880 > 192.168.43.195.7771: UDP, length 120
04:03:59.639322 IP 192.168.43.195.8880 > 192.168.43.124.7772: UDP, length 120
04:03:59.642736 IP 192.168.43.124.8880 > 192.168.43.195.7771: UDP, length 120
04:03:59.689318 IP 192.168.43.195.8880 > 192.168.43.124.7772: UDP, length 120
04:03:59.692735 IP 192.168.43.124.8880 > 192.168.43.195.7771: UDP, length 120
04:03:59.739317 IP 192.168.43.195.8880 > 192.168.43.124.7772: UDP, length 120
04:03:59.743414 IP 192.168.43.124.8880 > 192.168.43.195.7771: UDP, length 120
04:03:59.789318 IP 192.168.43.195.8880 > 192.168.43.124.7772: UDP, length 120
04:03:59.792925 IP 192.168.43.124.8880 > 192.168.43.195.7771: UDP, length 120
04:03:59.839320 IP 192.168.43.195.8880 > 192.168.43.124.7772: UDP, length 120
04:03:59.844354 IP 192.168.43.124.8880 > 192.168.43.195.7771: UDP, length 120
04:03:59.889327 IP 192.168.43.195.8880 > 192.168.43.124.7772: UDP, length 120
04:03:59.897382 IP 192.168.43.124.8880 > 192.168.43.195.7771: UDP, length 120
04:03:59.939331 IP 192.168.43.195.8880 > 192.168.43.124.7772: UDP, length 120
04:03:59.942755 IP 192.168.43.124.8880 > 192.168.43.195.7771: UDP, length 120
04:03:59.989320 IP 192.168.43.195.8880 > 192.168.43.124.7772: UDP, length 120
04:03:59.992735 IP 192.168.43.124.8880 > 192.168.43.195.7771: UDP, length 120
04:04:00.039316 IP 192.168.43.195.8880 > 192.168.43.124.7772: UDP, length 120
04:04:00.042736 IP 192.168.43.124.8880 > 192.168.43.195.7771: UDP, length 120
04:04:00.089315 IP 192.168.43.195.8880 > 192.168.43.124.7772: UDP, length 120
04:04:00.092710 IP 192.168.43.124.8880 > 192.168.43.195.7771: UDP, length 120
04:04:00.139325 IP 192.168.43.195.8880 > 192.168.43.124.7772: UDP, length 120
04:04:00.143659 IP 192.168.43.124.8880 > 192.168.43.195.7771: UDP, length 120
04:04:00.189321 IP 192.168.43.195.8880 > 192.168.43.124.7772: UDP, length 120
04:04:00.192741 IP 192.168.43.124.8880 > 192.168.43.195.7771: UDP, length 120
04:04:00.239319 IP 192.168.43.195.8880 > 192.168.43.124.7772: UDP, length 120
04:04:00.242388 IP 192.168.43.124.8880 > 192.168.43.195.7771: UDP, length 120
04:04:00.289315 IP 192.168.43.195.8880 > 192.168.43.124.7772: UDP, length 120
04:04:00.292730 IP 192.168.43.124.8880 > 192.168.43.195.7771: UDP, length 120
04:04:00.339317 IP 192.168.43.195.8880 > 192.168.43.124.7772: UDP, length 120
04:04:00.342729 IP 192.168.43.124.8880 > 192.168.43.195.7771: UDP, length 120
04:04:00.389317 IP 192.168.43.195.8880 > 192.168.43.124.7772: UDP, length 120
04:04:00.393968 IP 192.168.43.124.8880 > 192.168.43.195.7771: UDP, length 120
04:04:00.439318 IP 192.168.43.195.8880 > 192.168.43.124.7772: UDP, length 120
04:04:00.442728 IP 192.168.43.124.8880 > 192.168.43.195.7771: UDP, length 120
04:04:00.489318 IP 192.168.43.195.8880 > 192.168.43.124.7772: UDP, length 120
04:04:00.494108 IP 192.168.43.124.8880 > 192.168.43.195.7771: UDP, length 120
04:04:00.539318 IP 192.168.43.195.8880 > 192.168.43.124.7772: UDP, length 120
04:04:00.542733 IP 192.168.43.124.8880 > 192.168.43.195.7771: UDP, length 120
04:04:00.589318 IP 192.168.43.195.8880 > 192.168.43.124.7772: UDP, length 120
04:04:00.592735 IP 192.168.43.124.8880 > 192.168.43.195.7771: UDP, length 120
04:04:00.639319 IP 192.168.43.195.8880 > 192.168.43.124.7772: UDP, length 120
04:04:00.642825 IP 192.168.43.124.8880 > 192.168.43.195.7771: UDP, length 120
04:04:00.689318 IP 192.168.43.195.8880 > 192.168.43.124.7772: UDP, length 120
04:04:00.697461 IP 192.168.43.124.8880 > 192.168.43.195.7771: UDP, length 120
04:04:00.739316 IP 192.168.43.195.8880 > 192.168.43.124.7772: UDP, length 120
04:04:00.742729 IP 192.168.43.124.8880 > 192.168.43.195.7771: UDP, length 120
04:04:00.789317 IP 192.168.43.195.8880 > 192.168.43.124.7772: UDP, length 120
04:04:00.792736 IP 192.168.43.124.8880 > 192.168.43.195.7771: UDP, length 120
04:04:00.839318 IP 192.168.43.195.8880 > 192.168.43.124.7772: UDP, length 120
04:04:00.842731 IP 192.168.43.124.8880 > 192.168.43.195.7771: UDP, length 120
04:04:00.889319 IP 192.168.43.195.8880 > 192.168.43.124.7772: UDP, length 120
04:04:00.894833 IP 192.168.43.124.8880 > 192.168.43.195.7771: UDP, length 120
04:04:00.939323 IP 192.168.43.195.8880 > 192.168.43.124.7772: UDP, length 120
04:04:00.942747 IP 192.168.43.124.8880 > 192.168.43.195.7771: UDP, length 120
04:04:00.989321 IP 192.168.43.195.8880 > 192.168.43.124.7772: UDP, length 120
04:04:00.993927 IP 192.168.43.124.8880 > 192.168.43.195.7771: UDP, length 120
04:04:01.039379 IP 192.168.43.195.8880 > 192.168.43.124.7772: UDP, length 120
04:04:01.089327 IP 192.168.43.195.8880 > 192.168.43.124.7772: UDP, length 120
04:04:01.139336 IP 192.168.43.195.8880 > 192.168.43.124.7772: UDP, length 120
04:04:01.189321 IP 192.168.43.195.8880 > 192.168.43.124.7772: UDP, length 120
04:04:01.239314 IP 192.168.43.195.8880 > 192.168.43.124.7772: UDP, length 120
04:04:01.289315 IP 192.168.43.195.8880 > 192.168.43.124.7772: UDP, length 120
04:04:01.339318 IP 192.168.43.195.8880 > 192.168.43.124.7772: UDP, length 120
04:04:01.389315 IP 192.168.43.195.8880 > 192.168.43.124.7772: UDP, length 120
04:04:01.439318 IP 192.168.43.195.8880 > 192.168.43.124.7772: UDP, length 120
04:04:01.489316 IP 192.168.43.195.8880 > 192.168.43.124.7772: UDP, length 120
04:04:01.539316 IP 192.168.43.195.8880 > 192.168.43.124.7772: UDP, length 120
04:04:01.589315 IP 192.168.43.195.8880 > 192.168.43.124.7772: UDP, length 120
04:04:01.639318 IP 192.168.43.195.8880 > 192.168.43.124.7772: UDP, length 120
04:04:01.689318 IP 192.168.43.195.8880 > 192.168.43.124.7772: UDP, length 120
04:04:01.739311 IP 192.168.43.195.8880 > 192.168.43.124.7772: UDP, length 120
04:04:01.789314 IP 192.168.43.195.8880 > 192.168.43.124.7772: UDP, length 120
04:04:01.839316 IP 192.168.43.195.8880 > 192.168.43.124.7772: UDP, length 120
04:04:01.889319 IP 192.168.43.195.8880 > 192.168.43.124.7772: UDP, length 120
04:04:01.939321 IP 192.168.43.195.8880 > 192.168.43.124.7772: UDP, length 120
04:04:01.989317 IP 192.168.43.195.8880 > 192.168.43.124.7772: UDP, length 120
04:04:02.039322 IP 192.168.43.195.8880 > 192.168.43.124.7772: UDP, length 120
04:04:02.089319 IP 192.168.43.195.8880 > 192.168.43.124.7772: UDP, length 120
04:04:02.139321 IP 192.168.43.195.8880 > 192.168.43.124.7772: UDP, length 120
04:04:02.189318 IP 192.168.43.195.8880 > 192.168.43.124.7772: UDP, length 120
04:04:02.239314 IP 192.168.43.195.8880 > 192.168.43.124.7772: UDP, length 120
04:04:02.289314 IP 192.168.43.195.8880 > 192.168.43.124.7772: UDP, length 120
04:04:02.339312 IP 192.168.43.195.8880 > 192.168.43.124.7772: UDP, length 120
04:04:02.389312 IP 192.168.43.195.8880 > 192.168.43.124.7772: UDP, length 120
04:04:02.439315 IP 192.168.43.195.8880 > 192.168.43.124.7772: UDP, length 120
04:04:02.489315 IP 192.168.43.195.8880 > 192.168.43.124.7772: UDP, length 120
04:04:02.539378 IP 192.168.43.195.8880 > 192.168.43.124.7772: UDP, length 120
04:04:02.589321 IP 192.168.43.195.8880 > 192.168.43.124.7772: UDP, length 120
04:04:02.639321 IP 192.168.43.195.8880 > 192.168.43.124.7772: UDP, length 120
04:04:02.689315 IP 192.168.43.195.8880 > 192.168.43.124.7772: UDP, length 120
04:04:02.739314 IP 192.168.43.195.8880 > 192.168.43.124.7772: UDP, length 120
04:04:02.789314 IP 192.168.43.195.8880 > 192.168.43.124.7772: UDP, length 120
04:04:02.839316 IP 192.168.43.195.8880 > 192.168.43.124.7772: UDP, length 120
04:04:02.889320 IP 192.168.43.195.8880 > 192.168.43.124.7772: UDP, length 120
04:04:02.939314 IP 192.168.43.195.8880 > 192.168.43.124.7772: UDP, length 120
04:04:02.989314 IP 192.168.43.195.8880 > 192.168.43.124.7772: UDP, length 120
04:04:03.039316 IP 192.168.43.195.8880 > 192.168.43.124.7772: UDP, length 120
04:04:03.089321 IP 192.168.43.195.8880 > 192.168.43.124.7772: UDP, length 120
04:04:03.139336 IP 192.168.43.195.8880 > 192.168.43.124.7772: UDP, length 120
04:04:03.189380 IP 192.168.43.195.8880 > 192.168.43.124.7772: UDP, length 120
04:04:03.239314 IP 192.168.43.195.8880 > 192.168.43.124.7772: UDP, length 120
04:04:03.289315 IP 192.168.43.195.8880 > 192.168.43.124.7772: UDP, length 120
04:04:03.339313 IP 192.168.43.195.8880 > 192.168.43.124.7772: UDP, length 120
04:04:03.389315 IP 192.168.43.195.8880 > 192.168.43.124.7772: UDP, length 120
