20:44:23.618393 IP 192.168.43.124.8880 > 192.168.43.146.7771: UDP, length 120
20:44:23.668535 IP 192.168.43.124.8880 > 192.168.43.146.7771: UDP, length 120
20:44:23.718536 IP 192.168.43.124.8880 > 192.168.43.146.7771: UDP, length 120
20:44:23.768535 IP 192.168.43.124.8880 > 192.168.43.146.7771: UDP, length 120
20:44:23.818535 IP 192.168.43.124.8880 > 192.168.43.146.7771: UDP, length 120
20:44:23.868536 IP 192.168.43.124.8880 > 192.168.43.146.7771: UDP, length 120
20:44:23.918538 IP 192.168.43.124.8880 > 192.168.43.146.7771: UDP, length 120
20:44:23.968459 IP 192.168.43.124.8880 > 192.168.43.146.7771: UDP, length 120
20:44:24.018536 IP 192.168.43.124.8880 > 192.168.43.146.7771: UDP, length 120
20:44:24.068533 IP 192.168.43.124.8880 > 192.168.43.146.7771: UDP, length 120
20:44:24.118535 IP 192.168.43.124.8880 > 192.168.43.146.7771: UDP, length 120
20:44:24.168534 IP 192.168.43.124.8880 > 192.168.43.146.7771: UDP, length 120
20:44:24.218488 IP 192.168.43.124.8880 > 192.168.43.146.7771: UDP, length 120
20:44:24.268536 IP 192.168.43.124.8880 > 192.168.43.146.7771: UDP, length 120
20:44:24.318536 IP 192.168.43.124.8880 > 192.168.43.146.7771: UDP, length 120
20:44:24.368538 IP 192.168.43.124.8880 > 192.168.43.146.7771: UDP, length 120
20:44:24.418535 IP 192.168.43.124.8880 > 192.168.43.146.7771: UDP, length 120
20:44:24.468536 IP 192.168.43.124.8880 > 192.168.43.146.7771: UDP, length 120
20:44:24.518537 IP 192.168.43.124.8880 > 192.168.43.146.7771: UDP, length 120
20:44:24.568482 IP 192.168.43.124.8880 > 192.168.43.146.7771: UDP, length 120
20:44:24.618468 IP 192.168.43.124.8880 > 192.168.43.146.7771: UDP, length 120
20:44:24.668461 IP 192.168.43.124.8880 > 192.168.43.146.7771: UDP, length 120
20:44:24.718534 IP 192.168.43.124.8880 > 192.168.43.146.7771: UDP, length 120
20:44:24.768536 IP 192.168.43.124.8880 > 192.168.43.146.7771: UDP, length 120
20:44:24.818538 IP 192.168.43.124.8880 > 192.168.43.146.7771: UDP, length 120
20:44:24.834165 IP 192.168.43.147.8880 > 192.168.43.124.7773: UDP, length 120
20:44:24.868502 IP 192.168.43.124.8880 > 192.168.43.146.7771: UDP, length 120
20:44:24.882286 IP 192.168.43.147.8880 > 192.168.43.124.7773: UDP, length 120
20:44:24.918535 IP 192.168.43.124.8880 > 192.168.43.146.7771: UDP, length 120
20:44:24.930756 IP 192.168.43.147.8880 > 192.168.43.124.7773: UDP, length 120
20:44:24.968537 IP 192.168.43.124.8880 > 192.168.43.146.7771: UDP, length 120
20:44:24.984012 IP 192.168.43.147.8880 > 192.168.43.124.7773: UDP, length 120
20:44:25.018536 IP 192.168.43.124.8880 > 192.168.43.146.7771: UDP, length 120
20:44:25.032120 IP 192.168.43.147.8880 > 192.168.43.124.7773: UDP, length 120
20:44:25.068535 IP 192.168.43.124.8880 > 192.168.43.146.7771: UDP, length 120
20:44:25.084228 IP 192.168.43.147.8880 > 192.168.43.124.7773: UDP, length 120
20:44:25.118534 IP 192.168.43.124.8880 > 192.168.43.146.7771: UDP, length 120
20:44:25.133355 IP 192.168.43.147.8880 > 192.168.43.124.7773: UDP, length 120
20:44:25.168536 IP 192.168.43.124.8880 > 192.168.43.146.7771: UDP, length 120
20:44:25.182259 IP 192.168.43.147.8880 > 192.168.43.124.7773: UDP, length 120
20:44:25.218534 IP 192.168.43.124.8880 > 192.168.43.146.7771: UDP, length 120
20:44:25.235768 IP 192.168.43.147.8880 > 192.168.43.124.7773: UDP, length 120
20:44:25.268535 IP 192.168.43.124.8880 > 192.168.43.146.7771: UDP, length 120
20:44:25.283380 IP 192.168.43.147.8880 > 192.168.43.124.7773: UDP, length 120
20:44:25.318536 IP 192.168.43.124.8880 > 192.168.43.146.7771: UDP, length 120
20:44:25.335920 IP 192.168.43.147.8880 > 192.168.43.124.7773: UDP, length 120
20:44:25.368534 IP 192.168.43.124.8880 > 192.168.43.146.7771: UDP, length 120
20:44:25.383895 IP 192.168.43.147.8880 > 192.168.43.124.7773: UDP, length 120
20:44:25.418536 IP 192.168.43.124.8880 > 192.168.43.146.7771: UDP, length 120
20:44:25.433749 IP 192.168.43.147.8880 > 192.168.43.124.7773: UDP, length 120
20:44:25.468537 IP 192.168.43.124.8880 > 192.168.43.146.7771: UDP, length 120
20:44:25.484094 IP 192.168.43.147.8880 > 192.168.43.124.7773: UDP, length 120
20:44:25.518536 IP 192.168.43.124.8880 > 192.168.43.146.7771: UDP, length 120
20:44:25.534411 IP 192.168.43.147.8880 > 192.168.43.124.7773: UDP, length 120
20:44:25.568535 IP 192.168.43.124.8880 > 192.168.43.146.7771: UDP, length 120
20:44:25.586505 IP 192.168.43.147.8880 > 192.168.43.124.7773: UDP, length 120
20:44:25.618537 IP 192.168.43.124.8880 > 192.168.43.146.7771: UDP, length 120
20:44:25.634685 IP 192.168.43.147.8880 > 192.168.43.124.7773: UDP, length 120
20:44:25.668536 IP 192.168.43.124.8880 > 192.168.43.146.7771: UDP, length 120
20:44:25.682503 IP 192.168.43.147.8880 > 192.168.43.124.7773: UDP, length 120
20:44:25.718535 IP 192.168.43.124.8880 > 192.168.43.146.7771: UDP, length 120
20:44:25.730649 IP 192.168.43.147.8880 > 192.168.43.124.7773: UDP, length 120
20:44:25.768536 IP 192.168.43.124.8880 > 192.168.43.146.7771: UDP, length 120
20:44:25.784306 IP 192.168.43.147.8880 > 192.168.43.124.7773: UDP, length 120
20:44:25.818547 IP 192.168.43.124.8880 > 192.168.43.146.7771: UDP, length 120
20:44:25.832829 IP 192.168.43.147.8880 > 192.168.43.124.7773: UDP, length 120
20:44:25.868588 IP 192.168.43.124.8880 > 192.168.43.146.7771: UDP, length 120
20:44:25.883657 IP 192.168.43.147.8880 > 192.168.43.124.7773: UDP, length 120
20:44:25.918552 IP 192.168.43.124.8880 > 192.168.43.146.7771: UDP, length 120
20:44:25.931290 IP 192.168.43.147.8880 > 192.168.43.124.7773: UDP, length 120
20:44:25.968587 IP 192.168.43.124.8880 > 192.168.43.146.7771: UDP, length 120
20:44:25.985727 IP 192.168.43.147.8880 > 192.168.43.124.7773: UDP, length 120
20:44:26.018546 IP 192.168.43.124.8880 > 192.168.43.146.7771: UDP, length 120
20:44:26.057298 IP 192.168.43.147.8880 > 192.168.43.124.7773: UDP, length 120
20:44:26.068587 IP 192.168.43.124.8880 > 192.168.43.146.7771: UDP, length 120
20:44:26.089399 IP 192.168.43.147.8880 > 192.168.43.124.7773: UDP, length 120
20:44:26.118485 IP 192.168.43.124.8880 > 192.168.43.146.7771: UDP, length 120
20:44:26.133649 IP 192.168.43.147.8880 > 192.168.43.124.7773: UDP, length 120
20:44:26.168534 IP 192.168.43.124.8880 > 192.168.43.146.7771: UDP, length 120
20:44:26.183186 IP 192.168.43.147.8880 > 192.168.43.124.7773: UDP, length 120
20:44:26.218482 IP 192.168.43.124.8880 > 192.168.43.146.7771: UDP, length 120
20:44:26.232364 IP 192.168.43.147.8880 > 192.168.43.124.7773: UDP, length 120
20:44:26.268535 IP 192.168.43.124.8880 > 192.168.43.146.7771: UDP, length 120
20:44:26.282553 IP 192.168.43.147.8880 > 192.168.43.124.7773: UDP, length 120
20:44:26.318482 IP 192.168.43.124.8880 > 192.168.43.146.7771: UDP, length 120
20:44:26.333399 IP 192.168.43.147.8880 > 192.168.43.124.7773: UDP, length 120
20:44:26.368455 IP 192.168.43.124.8880 > 192.168.43.146.7771: UDP, length 120
20:44:26.382465 IP 192.168.43.147.8880 > 192.168.43.124.7773: UDP, length 120
20:44:26.418513 IP 192.168.43.124.8880 > 192.168.43.146.7771: UDP, length 120
20:44:26.435728 IP 192.168.43.147.8880 > 192.168.43.124.7773: UDP, length 120
20:44:26.468537 IP 192.168.43.124.8880 > 192.168.43.146.7771: UDP, length 120
20:44:26.486565 IP 192.168.43.147.8880 > 192.168.43.124.7773: UDP, length 120
20:44:26.518535 IP 192.168.43.124.8880 > 192.168.43.146.7771: UDP, length 120
20:44:26.537075 IP 192.168.43.147.8880 > 192.168.43.124.7773: UDP, length 120
20:44:26.568536 IP 192.168.43.124.8880 > 192.168.43.146.7771: UDP, length 120
20:44:26.583969 IP 192.168.43.147.8880 > 192.168.43.124.7773: UDP, length 120
20:44:26.618538 IP 192.168.43.124.8880 > 192.168.43.146.7771: UDP, length 120
20:44:26.634158 IP 192.168.43.147.8880 > 192.168.43.124.7773: UDP, length 120
20:44:26.668536 IP 192.168.43.124.8880 > 192.168.43.146.7771: UDP, length 120
20:44:26.683906 IP 192.168.43.147.8880 > 192.168.43.124.7773: UDP, length 120
20:44:26.718535 IP 192.168.43.124.8880 > 192.168.43.146.7771: UDP, length 120
20:44:26.732234 IP 192.168.43.147.8880 > 192.168.43.124.7773: UDP, length 120
20:44:26.768537 IP 192.168.43.124.8880 > 192.168.43.146.7771: UDP, length 120
20:44:26.782531 IP 192.168.43.147.8880 > 192.168.43.124.7773: UDP, length 120
20:44:26.818535 IP 192.168.43.124.8880 > 192.168.43.146.7771: UDP, length 120
20:44:26.833618 IP 192.168.43.147.8880 > 192.168.43.124.7773: UDP, length 120
20:44:26.868535 IP 192.168.43.124.8880 > 192.168.43.146.7771: UDP, length 120
20:44:26.882386 IP 192.168.43.147.8880 > 192.168.43.124.7773: UDP, length 120
20:44:26.918537 IP 192.168.43.124.8880 > 192.168.43.146.7771: UDP, length 120
20:44:26.933975 IP 192.168.43.147.8880 > 192.168.43.124.7773: UDP, length 120
20:44:26.968535 IP 192.168.43.124.8880 > 192.168.43.146.7771: UDP, length 120
20:44:26.984556 IP 192.168.43.147.8880 > 192.168.43.124.7773: UDP, length 120
20:44:27.018535 IP 192.168.43.124.8880 > 192.168.43.146.7771: UDP, length 120
20:44:27.032903 IP 192.168.43.147.8880 > 192.168.43.124.7773: UDP, length 120
20:44:27.068585 IP 192.168.43.124.8880 > 192.168.43.146.7771: UDP, length 120
20:44:27.083037 IP 192.168.43.147.8880 > 192.168.43.124.7773: UDP, length 120
20:44:27.118540 IP 192.168.43.124.8880 > 192.168.43.146.7771: UDP, length 120
20:44:27.135122 IP 192.168.43.147.8880 > 192.168.43.124.7773: UDP, length 120
20:44:27.168535 IP 192.168.43.124.8880 > 192.168.43.146.7771: UDP, length 120
20:44:27.183051 IP 192.168.43.147.8880 > 192.168.43.124.7773: UDP, length 120
20:44:27.218534 IP 192.168.43.124.8880 > 192.168.43.146.7771: UDP, length 120
20:44:27.234673 IP 192.168.43.147.8880 > 192.168.43.124.7773: UDP, length 120
20:44:27.268536 IP 192.168.43.124.8880 > 192.168.43.146.7771: UDP, length 120
20:44:27.284125 IP 192.168.43.147.8880 > 192.168.43.124.7773: UDP, length 120
20:44:27.318534 IP 192.168.43.124.8880 > 192.168.43.146.7771: UDP, length 120
20:44:27.338276 IP 192.168.43.147.8880 > 192.168.43.124.7773: UDP, length 120
20:44:27.368456 IP 192.168.43.124.8880 > 192.168.43.146.7771: UDP, length 120
20:44:27.385977 IP 192.168.43.147.8880 > 192.168.43.124.7773: UDP, length 120
20:44:27.418586 IP 192.168.43.124.8880 > 192.168.43.146.7771: UDP, length 120
20:44:27.468390 IP 192.168.43.147.8880 > 192.168.43.124.7773: UDP, length 120
20:44:27.468497 IP 192.168.43.124.8880 > 192.168.43.146.7771: UDP, length 120
20:44:27.491177 IP 192.168.43.147.8880 > 192.168.43.124.7773: UDP, length 120
20:44:27.518586 IP 192.168.43.124.8880 > 192.168.43.146.7771: UDP, length 120
20:44:27.535071 IP 192.168.43.147.8880 > 192.168.43.124.7773: UDP, length 120
20:44:27.568586 IP 192.168.43.124.8880 > 192.168.43.146.7771: UDP, length 120
20:44:27.594495 IP 192.168.43.147.8880 > 192.168.43.124.7773: UDP, length 120
20:44:27.618587 IP 192.168.43.124.8880 > 192.168.43.146.7771: UDP, length 120
20:44:27.631148 IP 192.168.43.147.8880 > 192.168.43.124.7773: UDP, length 120
20:44:27.668586 IP 192.168.43.124.8880 > 192.168.43.146.7771: UDP, length 120
20:44:27.685693 IP 192.168.43.147.8880 > 192.168.43.124.7773: UDP, length 120
20:44:27.718588 IP 192.168.43.124.8880 > 192.168.43.146.7771: UDP, length 120
20:44:27.733245 IP 192.168.43.147.8880 > 192.168.43.124.7773: UDP, length 120
20:44:27.768589 IP 192.168.43.124.8880 > 192.168.43.146.7771: UDP, length 120
20:44:27.786563 IP 192.168.43.147.8880 > 192.168.43.124.7773: UDP, length 120
20:44:27.818487 IP 192.168.43.124.8880 > 192.168.43.146.7771: UDP, length 120
20:44:27.839302 IP 192.168.43.147.8880 > 192.168.43.124.7773: UDP, length 120
20:44:27.868541 IP 192.168.43.124.8880 > 192.168.43.146.7771: UDP, length 120
20:44:27.888477 IP 192.168.43.147.8880 > 192.168.43.124.7773: UDP, length 120
20:44:27.918540 IP 192.168.43.124.8880 > 192.168.43.146.7771: UDP, length 120
20:44:27.934763 IP 192.168.43.147.8880 > 192.168.43.124.7773: UDP, length 120
20:44:27.968535 IP 192.168.43.124.8880 > 192.168.43.146.7771: UDP, length 120
20:44:27.981554 IP 192.168.43.147.8880 > 192.168.43.124.7773: UDP, length 120
20:44:28.018537 IP 192.168.43.124.8880 > 192.168.43.146.7771: UDP, length 120
20:44:28.032854 IP 192.168.43.147.8880 > 192.168.43.124.7773: UDP, length 120
20:44:28.068536 IP 192.168.43.124.8880 > 192.168.43.146.7771: UDP, length 120
20:44:28.082133 IP 192.168.43.147.8880 > 192.168.43.124.7773: UDP, length 120
20:44:28.118534 IP 192.168.43.124.8880 > 192.168.43.146.7771: UDP, length 120
20:44:28.134477 IP 192.168.43.147.8880 > 192.168.43.124.7773: UDP, length 120
20:44:28.168535 IP 192.168.43.124.8880 > 192.168.43.146.7771: UDP, length 120
20:44:28.182093 IP 192.168.43.147.8880 > 192.168.43.124.7773: UDP, length 120
20:44:28.218535 IP 192.168.43.124.8880 > 192.168.43.146.7771: UDP, length 120
20:44:28.232344 IP 192.168.43.147.8880 > 192.168.43.124.7773: UDP, length 120
20:44:28.268535 IP 192.168.43.124.8880 > 192.168.43.146.7771: UDP, length 120
20:44:28.285651 IP 192.168.43.147.8880 > 192.168.43.124.7773: UDP, length 120
20:44:28.318535 IP 192.168.43.124.8880 > 192.168.43.146.7771: UDP, length 120
20:44:28.332438 IP 192.168.43.147.8880 > 192.168.43.124.7773: UDP, length 120
20:44:28.368537 IP 192.168.43.124.8880 > 192.168.43.146.7771: UDP, length 120
20:44:28.387945 IP 192.168.43.147.8880 > 192.168.43.124.7773: UDP, length 120
20:44:28.418534 IP 192.168.43.124.8880 > 192.168.43.146.7771: UDP, length 120
20:44:28.435506 IP 192.168.43.147.8880 > 192.168.43.124.7773: UDP, length 120
20:44:28.468537 IP 192.168.43.124.8880 > 192.168.43.146.7771: UDP, length 120
20:44:28.484842 IP 192.168.43.147.8880 > 192.168.43.124.7773: UDP, length 120
20:44:28.518495 IP 192.168.43.124.8880 > 192.168.43.146.7771: UDP, length 120
20:44:28.537261 IP 192.168.43.147.8880 > 192.168.43.124.7773: UDP, length 120
20:44:28.568586 IP 192.168.43.124.8880 > 192.168.43.146.7771: UDP, length 120
20:44:28.618586 IP 192.168.43.124.8880 > 192.168.43.146.7771: UDP, length 120
20:44:28.643380 IP 192.168.43.147.8880 > 192.168.43.124.7773: UDP, length 120
20:44:28.643408 IP 192.168.43.147.8880 > 192.168.43.124.7773: UDP, length 120
20:44:28.668589 IP 192.168.43.124.8880 > 192.168.43.146.7771: UDP, length 120
20:44:28.699792 IP 192.168.43.147.8880 > 192.168.43.124.7773: UDP, length 120
20:44:28.718586 IP 192.168.43.124.8880 > 192.168.43.146.7771: UDP, length 120
20:44:28.736290 IP 192.168.43.147.8880 > 192.168.43.124.7773: UDP, length 120
20:44:28.768587 IP 192.168.43.124.8880 > 192.168.43.146.7771: UDP, length 120
20:44:28.790726 IP 192.168.43.147.8880 > 192.168.43.124.7773: UDP, length 120
20:44:28.818586 IP 192.168.43.124.8880 > 192.168.43.146.7771: UDP, length 120
20:44:28.840335 IP 192.168.43.147.8880 > 192.168.43.124.7773: UDP, length 120
20:44:28.868541 IP 192.168.43.124.8880 > 192.168.43.146.7771: UDP, length 120
20:44:28.890147 IP 192.168.43.147.8880 > 192.168.43.124.7773: UDP, length 120
20:44:28.918541 IP 192.168.43.124.8880 > 192.168.43.146.7771: UDP, length 120
20:44:28.939250 IP 192.168.43.147.8880 > 192.168.43.124.7773: UDP, length 120
20:44:28.968537 IP 192.168.43.124.8880 > 192.168.43.146.7771: UDP, length 120
20:44:28.989027 IP 192.168.43.147.8880 > 192.168.43.124.7773: UDP, length 120
20:44:29.018483 IP 192.168.43.124.8880 > 192.168.43.146.7771: UDP, length 120
20:44:29.039146 IP 192.168.43.147.8880 > 192.168.43.124.7773: UDP, length 120
20:44:29.068537 IP 192.168.43.124.8880 > 192.168.43.146.7771: UDP, length 120
20:44:29.086372 IP 192.168.43.147.8880 > 192.168.43.124.7773: UDP, length 120
20:44:29.118534 IP 192.168.43.124.8880 > 192.168.43.146.7771: UDP, length 120
20:44:29.135930 IP 192.168.43.147.8880 > 192.168.43.124.7773: UDP, length 120
20:44:29.168535 IP 192.168.43.124.8880 > 192.168.43.146.7771: UDP, length 120
20:44:29.193649 IP 192.168.43.147.8880 > 192.168.43.124.7773: UDP, length 120
20:44:29.218535 IP 192.168.43.124.8880 > 192.168.43.146.7771: UDP, length 120
20:44:29.237263 IP 192.168.43.147.8880 > 192.168.43.124.7773: UDP, length 120
20:44:29.268535 IP 192.168.43.124.8880 > 192.168.43.146.7771: UDP, length 120
20:44:29.287620 IP 192.168.43.147.8880 > 192.168.43.124.7773: UDP, length 120
20:44:29.318535 IP 192.168.43.124.8880 > 192.168.43.146.7771: UDP, length 120
20:44:29.332748 IP 192.168.43.147.8880 > 192.168.43.124.7773: UDP, length 120
20:44:29.368536 IP 192.168.43.124.8880 > 192.168.43.146.7771: UDP, length 120
20:44:29.387720 IP 192.168.43.147.8880 > 192.168.43.124.7773: UDP, length 120
20:44:29.418534 IP 192.168.43.124.8880 > 192.168.43.146.7771: UDP, length 120
20:44:29.435457 IP 192.168.43.147.8880 > 192.168.43.124.7773: UDP, length 120
20:44:29.468536 IP 192.168.43.124.8880 > 192.168.43.146.7771: UDP, length 120
20:44:29.482585 IP 192.168.43.147.8880 > 192.168.43.124.7773: UDP, length 120
20:44:29.518536 IP 192.168.43.124.8880 > 192.168.43.146.7771: UDP, length 120
20:44:29.532560 IP 192.168.43.147.8880 > 192.168.43.124.7773: UDP, length 120
20:44:29.568538 IP 192.168.43.124.8880 > 192.168.43.146.7771: UDP, length 120
20:44:29.582372 IP 192.168.43.147.8880 > 192.168.43.124.7773: UDP, length 120
20:44:29.618483 IP 192.168.43.124.8880 > 192.168.43.146.7771: UDP, length 120
20:44:29.635930 IP 192.168.43.147.8880 > 192.168.43.124.7773: UDP, length 120
20:44:29.668536 IP 192.168.43.124.8880 > 192.168.43.146.7771: UDP, length 120
20:44:29.686338 IP 192.168.43.147.8880 > 192.168.43.124.7773: UDP, length 120
20:44:29.718469 IP 192.168.43.124.8880 > 192.168.43.146.7771: UDP, length 120
20:44:29.739849 IP 192.168.43.147.8880 > 192.168.43.124.7773: UDP, length 120
20:44:29.768472 IP 192.168.43.124.8880 > 192.168.43.146.7771: UDP, length 120
20:44:29.784878 IP 192.168.43.147.8880 > 192.168.43.124.7773: UDP, length 120
20:44:29.818533 IP 192.168.43.124.8880 > 192.168.43.146.7771: UDP, length 120
20:44:29.834155 IP 192.168.43.147.8880 > 192.168.43.124.7773: UDP, length 120
20:44:29.868537 IP 192.168.43.124.8880 > 192.168.43.146.7771: UDP, length 120
20:44:29.887606 IP 192.168.43.147.8880 > 192.168.43.124.7773: UDP, length 120
20:44:29.918537 IP 192.168.43.124.8880 > 192.168.43.146.7771: UDP, length 120
20:44:29.932556 IP 192.168.43.147.8880 > 192.168.43.124.7773: UDP, length 120
20:44:29.968536 IP 192.168.43.124.8880 > 192.168.43.146.7771: UDP, length 120
20:44:29.982325 IP 192.168.43.147.8880 > 192.168.43.124.7773: UDP, length 120
20:44:30.018537 IP 192.168.43.124.8880 > 192.168.43.146.7771: UDP, length 120
20:44:30.039096 IP 192.168.43.147.8880 > 192.168.43.124.7773: UDP, length 120
20:44:30.068536 IP 192.168.43.124.8880 > 192.168.43.146.7771: UDP, length 120
20:44:30.084643 IP 192.168.43.147.8880 > 192.168.43.124.7773: UDP, length 120
20:44:30.118580 IP 192.168.43.124.8880 > 192.168.43.146.7771: UDP, length 120
20:44:30.132693 IP 192.168.43.147.8880 > 192.168.43.124.7773: UDP, length 120
20:44:30.168540 IP 192.168.43.124.8880 > 192.168.43.146.7771: UDP, length 120
20:44:30.184166 IP 192.168.43.147.8880 > 192.168.43.124.7773: UDP, length 120
20:44:30.218490 IP 192.168.43.124.8880 > 192.168.43.146.7771: UDP, length 120
20:44:30.232215 IP 192.168.43.147.8880 > 192.168.43.124.7773: UDP, length 120
20:44:30.268477 IP 192.168.43.124.8880 > 192.168.43.146.7771: UDP, length 120
20:44:30.282419 IP 192.168.43.147.8880 > 192.168.43.124.7773: UDP, length 120
20:44:30.318479 IP 192.168.43.124.8880 > 192.168.43.146.7771: UDP, length 120
20:44:30.332431 IP 192.168.43.147.8880 > 192.168.43.124.7773: UDP, length 120
20:44:30.368518 IP 192.168.43.124.8880 > 192.168.43.146.7771: UDP, length 120
20:44:30.382303 IP 192.168.43.147.8880 > 192.168.43.124.7773: UDP, length 120
20:44:30.418533 IP 192.168.43.124.8880 > 192.168.43.146.7771: UDP, length 120
20:44:30.432516 IP 192.168.43.147.8880 > 192.168.43.124.7773: UDP, length 120
20:44:30.468534 IP 192.168.43.124.8880 > 192.168.43.146.7771: UDP, length 120
20:44:30.485596 IP 192.168.43.147.8880 > 192.168.43.124.7773: UDP, length 120
20:44:30.518535 IP 192.168.43.124.8880 > 192.168.43.146.7771: UDP, length 120
20:44:30.535322 IP 192.168.43.147.8880 > 192.168.43.124.7773: UDP, length 120
20:44:30.568534 IP 192.168.43.124.8880 > 192.168.43.146.7771: UDP, length 120
20:44:30.582433 IP 192.168.43.147.8880 > 192.168.43.124.7773: UDP, length 120
20:44:30.618534 IP 192.168.43.124.8880 > 192.168.43.146.7771: UDP, length 120
20:44:30.637207 IP 192.168.43.147.8880 > 192.168.43.124.7773: UDP, length 120
20:44:30.668535 IP 192.168.43.124.8880 > 192.168.43.146.7771: UDP, length 120
20:44:30.686121 IP 192.168.43.147.8880 > 192.168.43.124.7773: UDP, length 120
20:44:30.718535 IP 192.168.43.124.8880 > 192.168.43.146.7771: UDP, length 120
20:44:30.737729 IP 192.168.43.147.8880 > 192.168.43.124.7773: UDP, length 120
20:44:30.768537 IP 192.168.43.124.8880 > 192.168.43.146.7771: UDP, length 120
20:44:30.787412 IP 192.168.43.147.8880 > 192.168.43.124.7773: UDP, length 120
20:44:30.818535 IP 192.168.43.124.8880 > 192.168.43.146.7771: UDP, length 120
20:44:30.840808 IP 192.168.43.147.8880 > 192.168.43.124.7773: UDP, length 120
20:44:30.868538 IP 192.168.43.124.8880 > 192.168.43.146.7771: UDP, length 120
20:44:30.886316 IP 192.168.43.147.8880 > 192.168.43.124.7773: UDP, length 120
20:44:30.918534 IP 192.168.43.124.8880 > 192.168.43.146.7771: UDP, length 120
20:44:30.937169 IP 192.168.43.147.8880 > 192.168.43.124.7773: UDP, length 120
20:44:30.968535 IP 192.168.43.124.8880 > 192.168.43.146.7771: UDP, length 120
20:44:30.988413 IP 192.168.43.147.8880 > 192.168.43.124.7773: UDP, length 120
20:44:31.018587 IP 192.168.43.124.8880 > 192.168.43.146.7771: UDP, length 120
20:44:31.041455 IP 192.168.43.147.8880 > 192.168.43.124.7773: UDP, length 120
20:44:31.068589 IP 192.168.43.124.8880 > 192.168.43.146.7771: UDP, length 120
20:44:31.087283 IP 192.168.43.147.8880 > 192.168.43.124.7773: UDP, length 120
20:44:31.118581 IP 192.168.43.124.8880 > 192.168.43.146.7771: UDP, length 120
20:44:31.168536 IP 192.168.43.124.8880 > 192.168.43.146.7771: UDP, length 120
20:44:31.218535 IP 192.168.43.124.8880 > 192.168.43.146.7771: UDP, length 120
20:44:31.219392 IP 192.168.43.147.8880 > 192.168.43.124.7773: UDP, length 120
20:44:31.219402 IP 192.168.43.147.8880 > 192.168.43.124.7773: UDP, length 120
20:44:31.232466 IP 192.168.43.147.8880 > 192.168.43.124.7773: UDP, length 120
20:44:31.268537 IP 192.168.43.124.8880 > 192.168.43.146.7771: UDP, length 120
20:44:31.282808 IP 192.168.43.147.8880 > 192.168.43.124.7773: UDP, length 120
20:44:31.318537 IP 192.168.43.124.8880 > 192.168.43.146.7771: UDP, length 120
20:44:31.332731 IP 192.168.43.147.8880 > 192.168.43.124.7773: UDP, length 120
20:44:31.368464 IP 192.168.43.124.8880 > 192.168.43.146.7771: UDP, length 120
20:44:31.382360 IP 192.168.43.147.8880 > 192.168.43.124.7773: UDP, length 120
20:44:31.418535 IP 192.168.43.124.8880 > 192.168.43.146.7771: UDP, length 120
20:44:31.436472 IP 192.168.43.147.8880 > 192.168.43.124.7773: UDP, length 120
20:44:31.468584 IP 192.168.43.124.8880 > 192.168.43.146.7771: UDP, length 120
20:44:31.482334 IP 192.168.43.147.8880 > 192.168.43.124.7773: UDP, length 120
20:44:31.518541 IP 192.168.43.124.8880 > 192.168.43.146.7771: UDP, length 120
20:44:31.535527 IP 192.168.43.147.8880 > 192.168.43.124.7773: UDP, length 120
20:44:31.568537 IP 192.168.43.124.8880 > 192.168.43.146.7771: UDP, length 120
20:44:31.583287 IP 192.168.43.147.8880 > 192.168.43.124.7773: UDP, length 120
20:44:31.618539 IP 192.168.43.124.8880 > 192.168.43.146.7771: UDP, length 120
20:44:31.632299 IP 192.168.43.147.8880 > 192.168.43.124.7773: UDP, length 120
20:44:31.668539 IP 192.168.43.124.8880 > 192.168.43.146.7771: UDP, length 120
20:44:31.684501 IP 192.168.43.147.8880 > 192.168.43.124.7773: UDP, length 120
20:44:31.718538 IP 192.168.43.124.8880 > 192.168.43.146.7771: UDP, length 120
20:44:31.733869 IP 192.168.43.147.8880 > 192.168.43.124.7773: UDP, length 120
20:44:31.768539 IP 192.168.43.124.8880 > 192.168.43.146.7771: UDP, length 120
20:44:31.783096 IP 192.168.43.147.8880 > 192.168.43.124.7773: UDP, length 120
20:44:31.818539 IP 192.168.43.124.8880 > 192.168.43.146.7771: UDP, length 120
20:44:31.835442 IP 192.168.43.147.8880 > 192.168.43.124.7773: UDP, length 120
20:44:31.868541 IP 192.168.43.124.8880 > 192.168.43.146.7771: UDP, length 120
20:44:31.884966 IP 192.168.43.147.8880 > 192.168.43.124.7773: UDP, length 120
20:44:31.918541 IP 192.168.43.124.8880 > 192.168.43.146.7771: UDP, length 120
20:44:31.935373 IP 192.168.43.147.8880 > 192.168.43.124.7773: UDP, length 120
20:44:31.968542 IP 192.168.43.124.8880 > 192.168.43.146.7771: UDP, length 120
20:44:31.987638 IP 192.168.43.147.8880 > 192.168.43.124.7773: UDP, length 120
20:44:32.018585 IP 192.168.43.124.8880 > 192.168.43.146.7771: UDP, length 120
20:44:32.032971 IP 192.168.43.147.8880 > 192.168.43.124.7773: UDP, length 120
20:44:32.068591 IP 192.168.43.124.8880 > 192.168.43.146.7771: UDP, length 120
20:44:32.082486 IP 192.168.43.147.8880 > 192.168.43.124.7773: UDP, length 120
20:44:32.118527 IP 192.168.43.124.8880 > 192.168.43.146.7771: UDP, length 120
20:44:32.133138 IP 192.168.43.147.8880 > 192.168.43.124.7773: UDP, length 120
20:44:32.168537 IP 192.168.43.124.8880 > 192.168.43.146.7771: UDP, length 120
20:44:32.185692 IP 192.168.43.147.8880 > 192.168.43.124.7773: UDP, length 120
20:44:32.218536 IP 192.168.43.124.8880 > 192.168.43.146.7771: UDP, length 120
20:44:32.232209 IP 192.168.43.147.8880 > 192.168.43.124.7773: UDP, length 120
20:44:32.268537 IP 192.168.43.124.8880 > 192.168.43.146.7771: UDP, length 120
20:44:32.282427 IP 192.168.43.147.8880 > 192.168.43.124.7773: UDP, length 120
20:44:32.318540 IP 192.168.43.124.8880 > 192.168.43.146.7771: UDP, length 120
20:44:32.334178 IP 192.168.43.147.8880 > 192.168.43.124.7773: UDP, length 120
20:44:32.368587 IP 192.168.43.124.8880 > 192.168.43.146.7771: UDP, length 120
20:44:32.382761 IP 192.168.43.147.8880 > 192.168.43.124.7773: UDP, length 120
20:44:32.418587 IP 192.168.43.124.8880 > 192.168.43.146.7771: UDP, length 120
20:44:32.468587 IP 192.168.43.124.8880 > 192.168.43.146.7771: UDP, length 120
20:44:32.504810 IP 192.168.43.147.8880 > 192.168.43.124.7773: UDP, length 120
20:44:32.518585 IP 192.168.43.124.8880 > 192.168.43.146.7771: UDP, length 120
20:44:32.526833 IP 192.168.43.147.8880 > 192.168.43.124.7773: UDP, length 120
20:44:32.533297 IP 192.168.43.147.8880 > 192.168.43.124.7773: UDP, length 120
20:44:32.568587 IP 192.168.43.124.8880 > 192.168.43.146.7771: UDP, length 120
20:44:32.585250 IP 192.168.43.147.8880 > 192.168.43.124.7773: UDP, length 120
20:44:32.618587 IP 192.168.43.124.8880 > 192.168.43.146.7771: UDP, length 120
20:44:32.632817 IP 192.168.43.147.8880 > 192.168.43.124.7773: UDP, length 120
20:44:32.668584 IP 192.168.43.124.8880 > 192.168.43.146.7771: UDP, length 120
20:44:32.682976 IP 192.168.43.147.8880 > 192.168.43.124.7773: UDP, length 120
20:44:32.718583 IP 192.168.43.124.8880 > 192.168.43.146.7771: UDP, length 120
20:44:32.736185 IP 192.168.43.147.8880 > 192.168.43.124.7773: UDP, length 120
20:44:32.768587 IP 192.168.43.124.8880 > 192.168.43.146.7771: UDP, length 120
20:44:32.784762 IP 192.168.43.147.8880 > 192.168.43.124.7773: UDP, length 120
20:44:32.818537 IP 192.168.43.124.8880 > 192.168.43.146.7771: UDP, length 120
20:44:32.835342 IP 192.168.43.147.8880 > 192.168.43.124.7773: UDP, length 120
20:44:32.868539 IP 192.168.43.124.8880 > 192.168.43.146.7771: UDP, length 120
20:44:32.886936 IP 192.168.43.147.8880 > 192.168.43.124.7773: UDP, length 120
20:44:32.918539 IP 192.168.43.124.8880 > 192.168.43.146.7771: UDP, length 120
20:44:32.934780 IP 192.168.43.147.8880 > 192.168.43.124.7773: UDP, length 120
20:44:32.968540 IP 192.168.43.124.8880 > 192.168.43.146.7771: UDP, length 120
20:44:32.989198 IP 192.168.43.147.8880 > 192.168.43.124.7773: UDP, length 120
20:44:33.018540 IP 192.168.43.124.8880 > 192.168.43.146.7771: UDP, length 120
20:44:33.036556 IP 192.168.43.147.8880 > 192.168.43.124.7773: UDP, length 120
20:44:33.068539 IP 192.168.43.124.8880 > 192.168.43.146.7771: UDP, length 120
20:44:33.091304 IP 192.168.43.147.8880 > 192.168.43.124.7773: UDP, length 120
20:44:33.118539 IP 192.168.43.124.8880 > 192.168.43.146.7771: UDP, length 120
20:44:33.135456 IP 192.168.43.147.8880 > 192.168.43.124.7773: UDP, length 120
20:44:33.168536 IP 192.168.43.124.8880 > 192.168.43.146.7771: UDP, length 120
20:44:33.187088 IP 192.168.43.147.8880 > 192.168.43.124.7773: UDP, length 120
20:44:33.218536 IP 192.168.43.124.8880 > 192.168.43.146.7771: UDP, length 120
20:44:33.238278 IP 192.168.43.147.8880 > 192.168.43.124.7773: UDP, length 120
20:44:33.268537 IP 192.168.43.124.8880 > 192.168.43.146.7771: UDP, length 120
20:44:33.282521 IP 192.168.43.147.8880 > 192.168.43.124.7773: UDP, length 120
20:44:33.318534 IP 192.168.43.124.8880 > 192.168.43.146.7771: UDP, length 120
20:44:33.336286 IP 192.168.43.147.8880 > 192.168.43.124.7773: UDP, length 120
20:44:33.368583 IP 192.168.43.124.8880 > 192.168.43.146.7771: UDP, length 120
20:44:33.396901 IP 192.168.43.147.8880 > 192.168.43.124.7773: UDP, length 120
20:44:33.418588 IP 192.168.43.124.8880 > 192.168.43.146.7771: UDP, length 120
20:44:33.433750 IP 192.168.43.147.8880 > 192.168.43.124.7773: UDP, length 120
20:44:33.468586 IP 192.168.43.124.8880 > 192.168.43.146.7771: UDP, length 120
20:44:33.484224 IP 192.168.43.147.8880 > 192.168.43.124.7773: UDP, length 120
20:44:33.518584 IP 192.168.43.124.8880 > 192.168.43.146.7771: UDP, length 120
20:44:33.531253 IP 192.168.43.147.8880 > 192.168.43.124.7773: UDP, length 120
20:44:33.568585 IP 192.168.43.124.8880 > 192.168.43.146.7771: UDP, length 120
20:44:33.584134 IP 192.168.43.147.8880 > 192.168.43.124.7773: UDP, length 120
20:44:33.618587 IP 192.168.43.124.8880 > 192.168.43.146.7771: UDP, length 120
20:44:33.635294 IP 192.168.43.147.8880 > 192.168.43.124.7773: UDP, length 120
20:44:33.668587 IP 192.168.43.124.8880 > 192.168.43.146.7771: UDP, length 120
20:44:33.686538 IP 192.168.43.147.8880 > 192.168.43.124.7773: UDP, length 120
20:44:33.718585 IP 192.168.43.124.8880 > 192.168.43.146.7771: UDP, length 120
20:44:33.737351 IP 192.168.43.147.8880 > 192.168.43.124.7773: UDP, length 120
20:44:33.768588 IP 192.168.43.124.8880 > 192.168.43.146.7771: UDP, length 120
20:44:33.783568 IP 192.168.43.147.8880 > 192.168.43.124.7773: UDP, length 120
20:44:33.818586 IP 192.168.43.124.8880 > 192.168.43.146.7771: UDP, length 120
20:44:33.846331 IP 192.168.43.147.8880 > 192.168.43.124.7773: UDP, length 120
20:44:33.868585 IP 192.168.43.124.8880 > 192.168.43.146.7771: UDP, length 120
20:44:33.884525 IP 192.168.43.147.8880 > 192.168.43.124.7773: UDP, length 120
20:44:33.918587 IP 192.168.43.124.8880 > 192.168.43.146.7771: UDP, length 120
20:44:33.938048 IP 192.168.43.147.8880 > 192.168.43.124.7773: UDP, length 120
20:44:33.968589 IP 192.168.43.124.8880 > 192.168.43.146.7771: UDP, length 120
20:44:33.986206 IP 192.168.43.147.8880 > 192.168.43.124.7773: UDP, length 120
20:44:34.018539 IP 192.168.43.124.8880 > 192.168.43.146.7771: UDP, length 120
20:44:34.035332 IP 192.168.43.147.8880 > 192.168.43.124.7773: UDP, length 120
20:44:34.068541 IP 192.168.43.124.8880 > 192.168.43.146.7771: UDP, length 120
20:44:34.089603 IP 192.168.43.147.8880 > 192.168.43.124.7773: UDP, length 120
20:44:34.118538 IP 192.168.43.124.8880 > 192.168.43.146.7771: UDP, length 120
20:44:34.137934 IP 192.168.43.147.8880 > 192.168.43.124.7773: UDP, length 120
20:44:34.168536 IP 192.168.43.124.8880 > 192.168.43.146.7771: UDP, length 120
20:44:34.188513 IP 192.168.43.147.8880 > 192.168.43.124.7773: UDP, length 120
20:44:34.218534 IP 192.168.43.124.8880 > 192.168.43.146.7771: UDP, length 120
20:44:34.239183 IP 192.168.43.147.8880 > 192.168.43.124.7773: UDP, length 120
20:44:34.268535 IP 192.168.43.124.8880 > 192.168.43.146.7771: UDP, length 120
20:44:34.285813 IP 192.168.43.147.8880 > 192.168.43.124.7773: UDP, length 120
20:44:34.318535 IP 192.168.43.124.8880 > 192.168.43.146.7771: UDP, length 120
20:44:34.336310 IP 192.168.43.147.8880 > 192.168.43.124.7773: UDP, length 120
20:44:34.368499 IP 192.168.43.124.8880 > 192.168.43.146.7771: UDP, length 120
20:44:34.384262 IP 192.168.43.147.8880 > 192.168.43.124.7773: UDP, length 120
20:44:34.418536 IP 192.168.43.124.8880 > 192.168.43.146.7771: UDP, length 120
20:44:34.468538 IP 192.168.43.124.8880 > 192.168.43.146.7771: UDP, length 120
20:44:34.470095 IP 192.168.43.147.8880 > 192.168.43.124.7773: UDP, length 120
20:44:34.485158 IP 192.168.43.147.8880 > 192.168.43.124.7773: UDP, length 120
20:44:34.518585 IP 192.168.43.124.8880 > 192.168.43.146.7771: UDP, length 120
20:44:34.532891 IP 192.168.43.147.8880 > 192.168.43.124.7773: UDP, length 120
20:44:34.568586 IP 192.168.43.124.8880 > 192.168.43.146.7771: UDP, length 120
20:44:34.587685 IP 192.168.43.147.8880 > 192.168.43.124.7773: UDP, length 120
20:44:34.618585 IP 192.168.43.124.8880 > 192.168.43.146.7771: UDP, length 120
20:44:34.637110 IP 192.168.43.147.8880 > 192.168.43.124.7773: UDP, length 120
20:44:34.668586 IP 192.168.43.124.8880 > 192.168.43.146.7771: UDP, length 120
20:44:34.692239 IP 192.168.43.147.8880 > 192.168.43.124.7773: UDP, length 120
20:44:34.718587 IP 192.168.43.124.8880 > 192.168.43.146.7771: UDP, length 120
20:44:34.736102 IP 192.168.43.147.8880 > 192.168.43.124.7773: UDP, length 120
20:44:34.768589 IP 192.168.43.124.8880 > 192.168.43.146.7771: UDP, length 120
20:44:34.783007 IP 192.168.43.147.8880 > 192.168.43.124.7773: UDP, length 120
20:44:34.818464 IP 192.168.43.124.8880 > 192.168.43.146.7771: UDP, length 120
20:44:34.843371 IP 192.168.43.147.8880 > 192.168.43.124.7773: UDP, length 120
20:44:34.868467 IP 192.168.43.124.8880 > 192.168.43.146.7771: UDP, length 120
20:44:34.885470 IP 192.168.43.147.8880 > 192.168.43.124.7773: UDP, length 120
20:44:34.918533 IP 192.168.43.124.8880 > 192.168.43.146.7771: UDP, length 120
20:44:34.935707 IP 192.168.43.147.8880 > 192.168.43.124.7773: UDP, length 120
20:44:34.968535 IP 192.168.43.124.8880 > 192.168.43.146.7771: UDP, length 120
20:44:35.010293 IP 192.168.43.147.8880 > 192.168.43.124.7773: UDP, length 120
20:44:35.018536 IP 192.168.43.124.8880 > 192.168.43.146.7771: UDP, length 120
20:44:35.038231 IP 192.168.43.147.8880 > 192.168.43.124.7773: UDP, length 120
20:44:35.068537 IP 192.168.43.124.8880 > 192.168.43.146.7771: UDP, length 120
20:44:35.086824 IP 192.168.43.147.8880 > 192.168.43.124.7773: UDP, length 120
20:44:35.118537 IP 192.168.43.124.8880 > 192.168.43.146.7771: UDP, length 120
20:44:35.139599 IP 192.168.43.147.8880 > 192.168.43.124.7773: UDP, length 120
20:44:35.168537 IP 192.168.43.124.8880 > 192.168.43.146.7771: UDP, length 120
20:44:35.187867 IP 192.168.43.147.8880 > 192.168.43.124.7773: UDP, length 120
20:44:35.218535 IP 192.168.43.124.8880 > 192.168.43.146.7771: UDP, length 120
20:44:35.245665 IP 192.168.43.147.8880 > 192.168.43.124.7773: UDP, length 120
20:44:35.268536 IP 192.168.43.124.8880 > 192.168.43.146.7771: UDP, length 120
20:44:35.292151 IP 192.168.43.147.8880 > 192.168.43.124.7773: UDP, length 120
20:44:35.318537 IP 192.168.43.124.8880 > 192.168.43.146.7771: UDP, length 120
20:44:35.343722 IP 192.168.43.147.8880 > 192.168.43.124.7773: UDP, length 120
20:44:35.368541 IP 192.168.43.124.8880 > 192.168.43.146.7771: UDP, length 120
20:44:35.384392 IP 192.168.43.147.8880 > 192.168.43.124.7773: UDP, length 120
20:44:35.418535 IP 192.168.43.124.8880 > 192.168.43.146.7771: UDP, length 120
20:44:35.432551 IP 192.168.43.147.8880 > 192.168.43.124.7773: UDP, length 120
20:44:35.468535 IP 192.168.43.124.8880 > 192.168.43.146.7771: UDP, length 120
20:44:35.484854 IP 192.168.43.147.8880 > 192.168.43.124.7773: UDP, length 120
20:44:35.518584 IP 192.168.43.124.8880 > 192.168.43.146.7771: UDP, length 120
20:44:35.532973 IP 192.168.43.147.8880 > 192.168.43.124.7773: UDP, length 120
20:44:35.568538 IP 192.168.43.124.8880 > 192.168.43.146.7771: UDP, length 120
20:44:35.583594 IP 192.168.43.147.8880 > 192.168.43.124.7773: UDP, length 120
20:44:35.618536 IP 192.168.43.124.8880 > 192.168.43.146.7771: UDP, length 120
20:44:35.633394 IP 192.168.43.147.8880 > 192.168.43.124.7773: UDP, length 120
20:44:35.668536 IP 192.168.43.124.8880 > 192.168.43.146.7771: UDP, length 120
20:44:35.682915 IP 192.168.43.147.8880 > 192.168.43.124.7773: UDP, length 120
20:44:35.718536 IP 192.168.43.124.8880 > 192.168.43.146.7771: UDP, length 120
20:44:35.733974 IP 192.168.43.147.8880 > 192.168.43.124.7773: UDP, length 120
20:44:35.768478 IP 192.168.43.124.8880 > 192.168.43.146.7771: UDP, length 120
20:44:35.785380 IP 192.168.43.147.8880 > 192.168.43.124.7773: UDP, length 120
20:44:35.818535 IP 192.168.43.124.8880 > 192.168.43.146.7771: UDP, length 120
20:44:35.832681 IP 192.168.43.147.8880 > 192.168.43.124.7773: UDP, length 120
20:44:35.868537 IP 192.168.43.124.8880 > 192.168.43.146.7771: UDP, length 120
20:44:35.885503 IP 192.168.43.147.8880 > 192.168.43.124.7773: UDP, length 120
20:44:35.918536 IP 192.168.43.124.8880 > 192.168.43.146.7771: UDP, length 120
20:44:35.933250 IP 192.168.43.147.8880 > 192.168.43.124.7773: UDP, length 120
20:44:35.968536 IP 192.168.43.124.8880 > 192.168.43.146.7771: UDP, length 120
20:44:35.986119 IP 192.168.43.147.8880 > 192.168.43.124.7773: UDP, length 120
20:44:36.018536 IP 192.168.43.124.8880 > 192.168.43.146.7771: UDP, length 120
20:44:36.033853 IP 192.168.43.147.8880 > 192.168.43.124.7773: UDP, length 120
20:44:36.068536 IP 192.168.43.124.8880 > 192.168.43.146.7771: UDP, length 120
20:44:36.083595 IP 192.168.43.147.8880 > 192.168.43.124.7773: UDP, length 120
20:44:36.118535 IP 192.168.43.124.8880 > 192.168.43.146.7771: UDP, length 120
20:44:36.133838 IP 192.168.43.147.8880 > 192.168.43.124.7773: UDP, length 120
20:44:36.168534 IP 192.168.43.124.8880 > 192.168.43.146.7771: UDP, length 120
20:44:36.185564 IP 192.168.43.147.8880 > 192.168.43.124.7773: UDP, length 120
20:44:36.218536 IP 192.168.43.124.8880 > 192.168.43.146.7771: UDP, length 120
20:44:36.236238 IP 192.168.43.147.8880 > 192.168.43.124.7773: UDP, length 120
20:44:36.268537 IP 192.168.43.124.8880 > 192.168.43.146.7771: UDP, length 120
20:44:36.288359 IP 192.168.43.147.8880 > 192.168.43.124.7773: UDP, length 120
20:44:36.318463 IP 192.168.43.124.8880 > 192.168.43.146.7771: UDP, length 120
20:44:36.332441 IP 192.168.43.147.8880 > 192.168.43.124.7773: UDP, length 120
20:44:36.368535 IP 192.168.43.124.8880 > 192.168.43.146.7771: UDP, length 120
20:44:36.382675 IP 192.168.43.147.8880 > 192.168.43.124.7773: UDP, length 120
20:44:36.418536 IP 192.168.43.124.8880 > 192.168.43.146.7771: UDP, length 120
20:44:36.432803 IP 192.168.43.147.8880 > 192.168.43.124.7773: UDP, length 120
20:44:36.468535 IP 192.168.43.124.8880 > 192.168.43.146.7771: UDP, length 120
20:44:36.482449 IP 192.168.43.147.8880 > 192.168.43.124.7773: UDP, length 120
20:44:36.518535 IP 192.168.43.124.8880 > 192.168.43.146.7771: UDP, length 120
20:44:36.532560 IP 192.168.43.147.8880 > 192.168.43.124.7773: UDP, length 120
20:44:36.568537 IP 192.168.43.124.8880 > 192.168.43.146.7771: UDP, length 120
20:44:36.582591 IP 192.168.43.147.8880 > 192.168.43.124.7773: UDP, length 120
20:44:36.618536 IP 192.168.43.124.8880 > 192.168.43.146.7771: UDP, length 120
20:44:36.633478 IP 192.168.43.147.8880 > 192.168.43.124.7773: UDP, length 120
20:44:36.668536 IP 192.168.43.124.8880 > 192.168.43.146.7771: UDP, length 120
20:44:36.682784 IP 192.168.43.147.8880 > 192.168.43.124.7773: UDP, length 120
20:44:36.718535 IP 192.168.43.124.8880 > 192.168.43.146.7771: UDP, length 120
20:44:36.732475 IP 192.168.43.147.8880 > 192.168.43.124.7773: UDP, length 120
20:44:36.768537 IP 192.168.43.124.8880 > 192.168.43.146.7771: UDP, length 120
20:44:36.780549 IP 192.168.43.147.8880 > 192.168.43.124.7773: UDP, length 120
20:44:36.818582 IP 192.168.43.124.8880 > 192.168.43.146.7771: UDP, length 120
20:44:36.834074 IP 192.168.43.147.8880 > 192.168.43.124.7773: UDP, length 120
20:44:36.868538 IP 192.168.43.124.8880 > 192.168.43.146.7771: UDP, length 120
20:44:36.884929 IP 192.168.43.147.8880 > 192.168.43.124.7773: UDP, length 120
20:44:36.918535 IP 192.168.43.124.8880 > 192.168.43.146.7771: UDP, length 120
20:44:36.932978 IP 192.168.43.147.8880 > 192.168.43.124.7773: UDP, length 120
20:44:36.968534 IP 192.168.43.124.8880 > 192.168.43.146.7771: UDP, length 120
20:44:36.986498 IP 192.168.43.147.8880 > 192.168.43.124.7773: UDP, length 120
