00:44:24.338416 IP 192.168.43.146.8880 > 192.168.43.147.7772: UDP, length 120
00:44:24.395455 IP 192.168.43.146.8880 > 192.168.43.147.7772: UDP, length 120
00:44:24.448028 IP 192.168.43.146.8880 > 192.168.43.147.7772: UDP, length 120
00:44:24.486289 IP 192.168.43.146.8880 > 192.168.43.147.7772: UDP, length 120
00:44:24.541991 IP 192.168.43.146.8880 > 192.168.43.147.7772: UDP, length 120
00:44:24.591324 IP 192.168.43.146.8880 > 192.168.43.147.7772: UDP, length 120
00:44:24.650127 IP 192.168.43.146.8880 > 192.168.43.147.7772: UDP, length 120
00:44:24.688975 IP 192.168.43.146.8880 > 192.168.43.147.7772: UDP, length 120
00:44:24.739820 IP 192.168.43.146.8880 > 192.168.43.147.7772: UDP, length 120
00:44:24.746919 IP 192.168.43.147.8880 > 192.168.43.124.7773: UDP, length 120
00:44:24.796659 IP 192.168.43.146.8880 > 192.168.43.147.7772: UDP, length 120
00:44:24.796992 IP 192.168.43.147.8880 > 192.168.43.124.7773: UDP, length 120
00:44:24.840820 IP 192.168.43.146.8880 > 192.168.43.147.7772: UDP, length 120
00:44:24.846999 IP 192.168.43.147.8880 > 192.168.43.124.7773: UDP, length 120
00:44:24.889336 IP 192.168.43.146.8880 > 192.168.43.147.7772: UDP, length 120
00:44:24.897002 IP 192.168.43.147.8880 > 192.168.43.124.7773: UDP, length 120
00:44:24.941107 IP 192.168.43.146.8880 > 192.168.43.147.7772: UDP, length 120
00:44:24.947012 IP 192.168.43.147.8880 > 192.168.43.124.7773: UDP, length 120
00:44:24.987492 IP 192.168.43.146.8880 > 192.168.43.147.7772: UDP, length 120
00:44:24.997083 IP 192.168.43.147.8880 > 192.168.43.124.7773: UDP, length 120
00:44:25.042749 IP 192.168.43.146.8880 > 192.168.43.147.7772: UDP, length 120
00:44:25.047008 IP 192.168.43.147.8880 > 192.168.43.124.7773: UDP, length 120
00:44:25.093138 IP 192.168.43.146.8880 > 192.168.43.147.7772: UDP, length 120
00:44:25.096975 IP 192.168.43.147.8880 > 192.168.43.124.7773: UDP, length 120
00:44:25.138790 IP 192.168.43.146.8880 > 192.168.43.147.7772: UDP, length 120
00:44:25.146938 IP 192.168.43.147.8880 > 192.168.43.124.7773: UDP, length 120
00:44:25.189955 IP 192.168.43.146.8880 > 192.168.43.147.7772: UDP, length 120
00:44:25.196932 IP 192.168.43.147.8880 > 192.168.43.124.7773: UDP, length 120
00:44:25.238428 IP 192.168.43.146.8880 > 192.168.43.147.7772: UDP, length 120
00:44:25.246930 IP 192.168.43.147.8880 > 192.168.43.124.7773: UDP, length 120
00:44:25.292878 IP 192.168.43.146.8880 > 192.168.43.147.7772: UDP, length 120
00:44:25.296930 IP 192.168.43.147.8880 > 192.168.43.124.7773: UDP, length 120
00:44:25.338464 IP 192.168.43.146.8880 > 192.168.43.147.7772: UDP, length 120
00:44:25.346930 IP 192.168.43.147.8880 > 192.168.43.124.7773: UDP, length 120
00:44:25.388318 IP 192.168.43.146.8880 > 192.168.43.147.7772: UDP, length 120
00:44:25.396929 IP 192.168.43.147.8880 > 192.168.43.124.7773: UDP, length 120
00:44:25.446929 IP 192.168.43.147.8880 > 192.168.43.124.7773: UDP, length 120
00:44:25.449024 IP 192.168.43.146.8880 > 192.168.43.147.7772: UDP, length 120
00:44:25.488943 IP 192.168.43.146.8880 > 192.168.43.147.7772: UDP, length 120
00:44:25.496935 IP 192.168.43.147.8880 > 192.168.43.124.7773: UDP, length 120
00:44:25.538477 IP 192.168.43.146.8880 > 192.168.43.147.7772: UDP, length 120
00:44:25.546930 IP 192.168.43.147.8880 > 192.168.43.124.7773: UDP, length 120
00:44:25.590463 IP 192.168.43.146.8880 > 192.168.43.147.7772: UDP, length 120
00:44:25.596930 IP 192.168.43.147.8880 > 192.168.43.124.7773: UDP, length 120
00:44:25.644634 IP 192.168.43.146.8880 > 192.168.43.147.7772: UDP, length 120
00:44:25.646933 IP 192.168.43.147.8880 > 192.168.43.124.7773: UDP, length 120
00:44:25.689334 IP 192.168.43.146.8880 > 192.168.43.147.7772: UDP, length 120
00:44:25.696931 IP 192.168.43.147.8880 > 192.168.43.124.7773: UDP, length 120
00:44:25.738215 IP 192.168.43.146.8880 > 192.168.43.147.7772: UDP, length 120
00:44:25.746929 IP 192.168.43.147.8880 > 192.168.43.124.7773: UDP, length 120
00:44:25.787448 IP 192.168.43.146.8880 > 192.168.43.147.7772: UDP, length 120
00:44:25.796931 IP 192.168.43.147.8880 > 192.168.43.124.7773: UDP, length 120
00:44:25.840159 IP 192.168.43.146.8880 > 192.168.43.147.7772: UDP, length 120
00:44:25.846939 IP 192.168.43.147.8880 > 192.168.43.124.7773: UDP, length 120
00:44:25.896315 IP 192.168.43.146.8880 > 192.168.43.147.7772: UDP, length 120
00:44:25.896935 IP 192.168.43.147.8880 > 192.168.43.124.7773: UDP, length 120
00:44:25.946931 IP 192.168.43.147.8880 > 192.168.43.124.7773: UDP, length 120
00:44:25.996929 IP 192.168.43.147.8880 > 192.168.43.124.7773: UDP, length 120
00:44:26.000171 IP 192.168.43.146.8880 > 192.168.43.147.7772: UDP, length 120
00:44:26.000245 IP 192.168.43.146.8880 > 192.168.43.147.7772: UDP, length 120
00:44:26.038900 IP 192.168.43.146.8880 > 192.168.43.147.7772: UDP, length 120
00:44:26.046931 IP 192.168.43.147.8880 > 192.168.43.124.7773: UDP, length 120
00:44:26.089100 IP 192.168.43.146.8880 > 192.168.43.147.7772: UDP, length 120
00:44:26.096930 IP 192.168.43.147.8880 > 192.168.43.124.7773: UDP, length 120
00:44:26.138166 IP 192.168.43.146.8880 > 192.168.43.147.7772: UDP, length 120
00:44:26.146930 IP 192.168.43.147.8880 > 192.168.43.124.7773: UDP, length 120
00:44:26.188343 IP 192.168.43.146.8880 > 192.168.43.147.7772: UDP, length 120
00:44:26.196928 IP 192.168.43.147.8880 > 192.168.43.124.7773: UDP, length 120
00:44:26.238451 IP 192.168.43.146.8880 > 192.168.43.147.7772: UDP, length 120
00:44:26.246928 IP 192.168.43.147.8880 > 192.168.43.124.7773: UDP, length 120
00:44:26.293148 IP 192.168.43.146.8880 > 192.168.43.147.7772: UDP, length 120
00:44:26.296929 IP 192.168.43.147.8880 > 192.168.43.124.7773: UDP, length 120
00:44:26.338482 IP 192.168.43.146.8880 > 192.168.43.147.7772: UDP, length 120
00:44:26.346929 IP 192.168.43.147.8880 > 192.168.43.124.7773: UDP, length 120
00:44:26.388202 IP 192.168.43.146.8880 > 192.168.43.147.7772: UDP, length 120
00:44:26.396929 IP 192.168.43.147.8880 > 192.168.43.124.7773: UDP, length 120
00:44:26.440807 IP 192.168.43.146.8880 > 192.168.43.147.7772: UDP, length 120
00:44:26.446931 IP 192.168.43.147.8880 > 192.168.43.124.7773: UDP, length 120
00:44:26.488562 IP 192.168.43.146.8880 > 192.168.43.147.7772: UDP, length 120
00:44:26.496933 IP 192.168.43.147.8880 > 192.168.43.124.7773: UDP, length 120
00:44:26.540904 IP 192.168.43.146.8880 > 192.168.43.147.7772: UDP, length 120
00:44:26.546961 IP 192.168.43.147.8880 > 192.168.43.124.7773: UDP, length 120
00:44:26.590354 IP 192.168.43.146.8880 > 192.168.43.147.7772: UDP, length 120
00:44:26.596931 IP 192.168.43.147.8880 > 192.168.43.124.7773: UDP, length 120
00:44:26.637726 IP 192.168.43.146.8880 > 192.168.43.147.7772: UDP, length 120
00:44:26.646932 IP 192.168.43.147.8880 > 192.168.43.124.7773: UDP, length 120
00:44:26.693095 IP 192.168.43.146.8880 > 192.168.43.147.7772: UDP, length 120
00:44:26.696929 IP 192.168.43.147.8880 > 192.168.43.124.7773: UDP, length 120
00:44:26.738524 IP 192.168.43.146.8880 > 192.168.43.147.7772: UDP, length 120
00:44:26.746930 IP 192.168.43.147.8880 > 192.168.43.124.7773: UDP, length 120
00:44:26.792686 IP 192.168.43.146.8880 > 192.168.43.147.7772: UDP, length 120
00:44:26.796930 IP 192.168.43.147.8880 > 192.168.43.124.7773: UDP, length 120
00:44:26.841090 IP 192.168.43.146.8880 > 192.168.43.147.7772: UDP, length 120
00:44:26.846930 IP 192.168.43.147.8880 > 192.168.43.124.7773: UDP, length 120
00:44:26.888687 IP 192.168.43.146.8880 > 192.168.43.147.7772: UDP, length 120
00:44:26.896964 IP 192.168.43.147.8880 > 192.168.43.124.7773: UDP, length 120
00:44:26.938971 IP 192.168.43.146.8880 > 192.168.43.147.7772: UDP, length 120
00:44:26.946958 IP 192.168.43.147.8880 > 192.168.43.124.7773: UDP, length 120
00:44:26.991394 IP 192.168.43.146.8880 > 192.168.43.147.7772: UDP, length 120
00:44:26.996962 IP 192.168.43.147.8880 > 192.168.43.124.7773: UDP, length 120
00:44:27.038240 IP 192.168.43.146.8880 > 192.168.43.147.7772: UDP, length 120
00:44:27.046962 IP 192.168.43.147.8880 > 192.168.43.124.7773: UDP, length 120
00:44:27.088522 IP 192.168.43.146.8880 > 192.168.43.147.7772: UDP, length 120
00:44:27.096967 IP 192.168.43.147.8880 > 192.168.43.124.7773: UDP, length 120
00:44:27.138257 IP 192.168.43.146.8880 > 192.168.43.147.7772: UDP, length 120
00:44:27.146967 IP 192.168.43.147.8880 > 192.168.43.124.7773: UDP, length 120
00:44:27.189319 IP 192.168.43.146.8880 > 192.168.43.147.7772: UDP, length 120
00:44:27.196958 IP 192.168.43.147.8880 > 192.168.43.124.7773: UDP, length 120
00:44:27.246956 IP 192.168.43.147.8880 > 192.168.43.124.7773: UDP, length 120
00:44:27.296956 IP 192.168.43.147.8880 > 192.168.43.124.7773: UDP, length 120
00:44:27.346965 IP 192.168.43.147.8880 > 192.168.43.124.7773: UDP, length 120
00:44:27.396965 IP 192.168.43.147.8880 > 192.168.43.124.7773: UDP, length 120
00:44:27.446956 IP 192.168.43.147.8880 > 192.168.43.124.7773: UDP, length 120
00:44:27.448570 IP 192.168.43.146.8880 > 192.168.43.147.7772: UDP, length 120
00:44:27.448809 IP 192.168.43.146.8880 > 192.168.43.147.7772: UDP, length 120
00:44:27.448927 IP 192.168.43.146.8880 > 192.168.43.147.7772: UDP, length 120
00:44:27.449037 IP 192.168.43.146.8880 > 192.168.43.147.7772: UDP, length 120
00:44:27.449147 IP 192.168.43.146.8880 > 192.168.43.147.7772: UDP, length 120
00:44:27.496966 IP 192.168.43.147.8880 > 192.168.43.124.7773: UDP, length 120
00:44:27.500386 IP 192.168.43.146.8880 > 192.168.43.147.7772: UDP, length 120
00:44:27.538512 IP 192.168.43.146.8880 > 192.168.43.147.7772: UDP, length 120
00:44:27.546962 IP 192.168.43.147.8880 > 192.168.43.124.7773: UDP, length 120
00:44:27.594535 IP 192.168.43.146.8880 > 192.168.43.147.7772: UDP, length 120
00:44:27.596969 IP 192.168.43.147.8880 > 192.168.43.124.7773: UDP, length 120
00:44:27.646970 IP 192.168.43.147.8880 > 192.168.43.124.7773: UDP, length 120
00:44:27.647384 IP 192.168.43.146.8880 > 192.168.43.147.7772: UDP, length 120
00:44:27.696958 IP 192.168.43.147.8880 > 192.168.43.124.7773: UDP, length 120
00:44:27.704307 IP 192.168.43.146.8880 > 192.168.43.147.7772: UDP, length 120
00:44:27.746958 IP 192.168.43.147.8880 > 192.168.43.124.7773: UDP, length 120
00:44:27.750402 IP 192.168.43.146.8880 > 192.168.43.147.7772: UDP, length 120
00:44:27.796959 IP 192.168.43.147.8880 > 192.168.43.124.7773: UDP, length 120
00:44:27.801391 IP 192.168.43.146.8880 > 192.168.43.147.7772: UDP, length 120
00:44:27.846970 IP 192.168.43.147.8880 > 192.168.43.124.7773: UDP, length 120
00:44:27.853624 IP 192.168.43.146.8880 > 192.168.43.147.7772: UDP, length 120
00:44:27.891323 IP 192.168.43.146.8880 > 192.168.43.147.7772: UDP, length 120
00:44:27.896968 IP 192.168.43.147.8880 > 192.168.43.124.7773: UDP, length 120
00:44:27.937688 IP 192.168.43.146.8880 > 192.168.43.147.7772: UDP, length 120
00:44:27.946959 IP 192.168.43.147.8880 > 192.168.43.124.7773: UDP, length 120
00:44:27.994869 IP 192.168.43.146.8880 > 192.168.43.147.7772: UDP, length 120
00:44:27.996968 IP 192.168.43.147.8880 > 192.168.43.124.7773: UDP, length 120
00:44:28.047028 IP 192.168.43.147.8880 > 192.168.43.124.7773: UDP, length 120
00:44:28.051593 IP 192.168.43.146.8880 > 192.168.43.147.7772: UDP, length 120
00:44:28.096403 IP 192.168.43.146.8880 > 192.168.43.147.7772: UDP, length 120
00:44:28.096974 IP 192.168.43.147.8880 > 192.168.43.124.7773: UDP, length 120
00:44:28.146959 IP 192.168.43.147.8880 > 192.168.43.124.7773: UDP, length 120
00:44:28.155440 IP 192.168.43.146.8880 > 192.168.43.147.7772: UDP, length 120
00:44:28.196958 IP 192.168.43.147.8880 > 192.168.43.124.7773: UDP, length 120
00:44:28.246527 IP 192.168.43.146.8880 > 192.168.43.147.7772: UDP, length 120
00:44:28.246966 IP 192.168.43.147.8880 > 192.168.43.124.7773: UDP, length 120
00:44:28.254697 IP 192.168.43.146.8880 > 192.168.43.147.7772: UDP, length 120
00:44:28.293761 IP 192.168.43.146.8880 > 192.168.43.147.7772: UDP, length 120
00:44:28.296959 IP 192.168.43.147.8880 > 192.168.43.124.7773: UDP, length 120
00:44:28.346966 IP 192.168.43.147.8880 > 192.168.43.124.7773: UDP, length 120
00:44:28.350353 IP 192.168.43.146.8880 > 192.168.43.147.7772: UDP, length 120
00:44:28.396965 IP 192.168.43.147.8880 > 192.168.43.124.7773: UDP, length 120
00:44:28.398749 IP 192.168.43.146.8880 > 192.168.43.147.7772: UDP, length 120
00:44:28.446955 IP 192.168.43.147.8880 > 192.168.43.124.7773: UDP, length 120
00:44:28.451357 IP 192.168.43.146.8880 > 192.168.43.147.7772: UDP, length 120
00:44:28.496961 IP 192.168.43.147.8880 > 192.168.43.124.7773: UDP, length 120
00:44:28.546987 IP 192.168.43.147.8880 > 192.168.43.124.7773: UDP, length 120
00:44:28.568109 IP 192.168.43.146.8880 > 192.168.43.147.7772: UDP, length 120
00:44:28.568232 IP 192.168.43.146.8880 > 192.168.43.147.7772: UDP, length 120
00:44:28.596976 IP 192.168.43.147.8880 > 192.168.43.124.7773: UDP, length 120
00:44:28.646968 IP 192.168.43.147.8880 > 192.168.43.124.7773: UDP, length 120
00:44:28.680049 IP 192.168.43.146.8880 > 192.168.43.147.7772: UDP, length 120
00:44:28.680168 IP 192.168.43.146.8880 > 192.168.43.147.7772: UDP, length 120
00:44:28.696958 IP 192.168.43.147.8880 > 192.168.43.124.7773: UDP, length 120
00:44:28.710823 IP 192.168.43.146.8880 > 192.168.43.147.7772: UDP, length 120
00:44:28.746957 IP 192.168.43.147.8880 > 192.168.43.124.7773: UDP, length 120
00:44:28.796966 IP 192.168.43.147.8880 > 192.168.43.124.7773: UDP, length 120
00:44:28.823790 IP 192.168.43.146.8880 > 192.168.43.147.7772: UDP, length 120
00:44:28.823913 IP 192.168.43.146.8880 > 192.168.43.147.7772: UDP, length 120
00:44:28.846960 IP 192.168.43.147.8880 > 192.168.43.124.7773: UDP, length 120
00:44:28.854320 IP 192.168.43.146.8880 > 192.168.43.147.7772: UDP, length 120
00:44:28.896969 IP 192.168.43.147.8880 > 192.168.43.124.7773: UDP, length 120
00:44:28.946956 IP 192.168.43.147.8880 > 192.168.43.124.7773: UDP, length 120
00:44:28.971509 IP 192.168.43.146.8880 > 192.168.43.147.7772: UDP, length 120
00:44:28.973174 IP 192.168.43.146.8880 > 192.168.43.147.7772: UDP, length 120
00:44:28.996964 IP 192.168.43.147.8880 > 192.168.43.124.7773: UDP, length 120
00:44:29.008758 IP 192.168.43.146.8880 > 192.168.43.147.7772: UDP, length 120
00:44:29.046964 IP 192.168.43.147.8880 > 192.168.43.124.7773: UDP, length 120
00:44:29.096958 IP 192.168.43.147.8880 > 192.168.43.124.7773: UDP, length 120
00:44:29.146956 IP 192.168.43.147.8880 > 192.168.43.124.7773: UDP, length 120
00:44:29.196956 IP 192.168.43.147.8880 > 192.168.43.124.7773: UDP, length 120
00:44:29.246956 IP 192.168.43.147.8880 > 192.168.43.124.7773: UDP, length 120
00:44:29.266722 IP 192.168.43.146.8880 > 192.168.43.147.7772: UDP, length 120
00:44:29.281904 IP 192.168.43.146.8880 > 192.168.43.147.7772: UDP, length 120
00:44:29.282018 IP 192.168.43.146.8880 > 192.168.43.147.7772: UDP, length 120
00:44:29.282264 IP 192.168.43.146.8880 > 192.168.43.147.7772: UDP, length 120
00:44:29.282373 IP 192.168.43.146.8880 > 192.168.43.147.7772: UDP, length 120
00:44:29.285063 IP 192.168.43.146.8880 > 192.168.43.147.7772: UDP, length 120
00:44:29.296958 IP 192.168.43.147.8880 > 192.168.43.124.7773: UDP, length 120
00:44:29.346955 IP 192.168.43.147.8880 > 192.168.43.124.7773: UDP, length 120
00:44:29.388539 IP 192.168.43.146.8880 > 192.168.43.147.7772: UDP, length 120
00:44:29.388735 IP 192.168.43.146.8880 > 192.168.43.147.7772: UDP, length 120
00:44:29.396957 IP 192.168.43.147.8880 > 192.168.43.124.7773: UDP, length 120
00:44:29.439786 IP 192.168.43.146.8880 > 192.168.43.147.7772: UDP, length 120
00:44:29.446956 IP 192.168.43.147.8880 > 192.168.43.124.7773: UDP, length 120
00:44:29.490149 IP 192.168.43.146.8880 > 192.168.43.147.7772: UDP, length 120
00:44:29.496971 IP 192.168.43.147.8880 > 192.168.43.124.7773: UDP, length 120
00:44:29.547014 IP 192.168.43.147.8880 > 192.168.43.124.7773: UDP, length 120
00:44:29.549194 IP 192.168.43.146.8880 > 192.168.43.147.7772: UDP, length 120
00:44:29.589533 IP 192.168.43.146.8880 > 192.168.43.147.7772: UDP, length 120
00:44:29.596971 IP 192.168.43.147.8880 > 192.168.43.124.7773: UDP, length 120
00:44:29.646960 IP 192.168.43.147.8880 > 192.168.43.124.7773: UDP, length 120
00:44:29.650377 IP 192.168.43.146.8880 > 192.168.43.147.7772: UDP, length 120
00:44:29.694424 IP 192.168.43.146.8880 > 192.168.43.147.7772: UDP, length 120
00:44:29.696958 IP 192.168.43.147.8880 > 192.168.43.124.7773: UDP, length 120
00:44:29.744487 IP 192.168.43.146.8880 > 192.168.43.147.7772: UDP, length 120
00:44:29.746955 IP 192.168.43.147.8880 > 192.168.43.124.7773: UDP, length 120
00:44:29.796957 IP 192.168.43.147.8880 > 192.168.43.124.7773: UDP, length 120
00:44:29.800363 IP 192.168.43.146.8880 > 192.168.43.147.7772: UDP, length 120
00:44:29.840864 IP 192.168.43.146.8880 > 192.168.43.147.7772: UDP, length 120
00:44:29.846957 IP 192.168.43.147.8880 > 192.168.43.124.7773: UDP, length 120
00:44:29.889189 IP 192.168.43.146.8880 > 192.168.43.147.7772: UDP, length 120
00:44:29.896956 IP 192.168.43.147.8880 > 192.168.43.124.7773: UDP, length 120
00:44:29.941769 IP 192.168.43.146.8880 > 192.168.43.147.7772: UDP, length 120
00:44:29.946956 IP 192.168.43.147.8880 > 192.168.43.124.7773: UDP, length 120
00:44:29.991722 IP 192.168.43.146.8880 > 192.168.43.147.7772: UDP, length 120
00:44:29.996957 IP 192.168.43.147.8880 > 192.168.43.124.7773: UDP, length 120
00:44:30.038393 IP 192.168.43.146.8880 > 192.168.43.147.7772: UDP, length 120
00:44:30.046957 IP 192.168.43.147.8880 > 192.168.43.124.7773: UDP, length 120
00:44:30.088781 IP 192.168.43.146.8880 > 192.168.43.147.7772: UDP, length 120
00:44:30.097008 IP 192.168.43.147.8880 > 192.168.43.124.7773: UDP, length 120
00:44:30.139789 IP 192.168.43.146.8880 > 192.168.43.147.7772: UDP, length 120
00:44:30.147029 IP 192.168.43.147.8880 > 192.168.43.124.7773: UDP, length 120
00:44:30.184919 IP 192.168.43.146.8880 > 192.168.43.147.7772: UDP, length 120
00:44:30.197019 IP 192.168.43.147.8880 > 192.168.43.124.7773: UDP, length 120
00:44:30.236059 IP 192.168.43.146.8880 > 192.168.43.147.7772: UDP, length 120
00:44:30.247019 IP 192.168.43.147.8880 > 192.168.43.124.7773: UDP, length 120
00:44:30.287436 IP 192.168.43.146.8880 > 192.168.43.147.7772: UDP, length 120
00:44:30.297036 IP 192.168.43.147.8880 > 192.168.43.124.7773: UDP, length 120
00:44:30.338661 IP 192.168.43.146.8880 > 192.168.43.147.7772: UDP, length 120
00:44:30.347004 IP 192.168.43.147.8880 > 192.168.43.124.7773: UDP, length 120
00:44:30.397020 IP 192.168.43.147.8880 > 192.168.43.124.7773: UDP, length 120
00:44:30.414598 IP 192.168.43.146.8880 > 192.168.43.147.7772: UDP, length 120
00:44:30.447009 IP 192.168.43.147.8880 > 192.168.43.124.7773: UDP, length 120
00:44:30.452389 IP 192.168.43.146.8880 > 192.168.43.147.7772: UDP, length 120
00:44:30.492623 IP 192.168.43.146.8880 > 192.168.43.147.7772: UDP, length 120
00:44:30.497027 IP 192.168.43.147.8880 > 192.168.43.124.7773: UDP, length 120
00:44:30.546992 IP 192.168.43.147.8880 > 192.168.43.124.7773: UDP, length 120
00:44:30.596957 IP 192.168.43.147.8880 > 192.168.43.124.7773: UDP, length 120
00:44:30.625249 IP 192.168.43.146.8880 > 192.168.43.147.7772: UDP, length 120
00:44:30.625449 IP 192.168.43.146.8880 > 192.168.43.147.7772: UDP, length 120
00:44:30.633804 IP 192.168.43.146.8880 > 192.168.43.147.7772: UDP, length 120
00:44:30.646948 IP 192.168.43.147.8880 > 192.168.43.124.7773: UDP, length 120
00:44:30.696936 IP 192.168.43.147.8880 > 192.168.43.124.7773: UDP, length 120
00:44:30.746930 IP 192.168.43.147.8880 > 192.168.43.124.7773: UDP, length 120
00:44:30.758925 IP 192.168.43.146.8880 > 192.168.43.147.7772: UDP, length 120
00:44:30.761693 IP 192.168.43.146.8880 > 192.168.43.147.7772: UDP, length 120
00:44:30.795262 IP 192.168.43.146.8880 > 192.168.43.147.7772: UDP, length 120
00:44:30.796932 IP 192.168.43.147.8880 > 192.168.43.124.7773: UDP, length 120
00:44:30.846931 IP 192.168.43.147.8880 > 192.168.43.124.7773: UDP, length 120
00:44:30.896928 IP 192.168.43.147.8880 > 192.168.43.124.7773: UDP, length 120
00:44:30.897474 IP 192.168.43.146.8880 > 192.168.43.147.7772: UDP, length 120
00:44:30.897618 IP 192.168.43.146.8880 > 192.168.43.147.7772: UDP, length 120
00:44:30.946931 IP 192.168.43.147.8880 > 192.168.43.124.7773: UDP, length 120
00:44:30.996930 IP 192.168.43.147.8880 > 192.168.43.124.7773: UDP, length 120
00:44:31.046982 IP 192.168.43.147.8880 > 192.168.43.124.7773: UDP, length 120
00:44:31.096947 IP 192.168.43.147.8880 > 192.168.43.124.7773: UDP, length 120
00:44:31.146934 IP 192.168.43.147.8880 > 192.168.43.124.7773: UDP, length 120
00:44:31.171507 IP 192.168.43.146.8880 > 192.168.43.147.7772: UDP, length 120
00:44:31.171781 IP 192.168.43.146.8880 > 192.168.43.147.7772: UDP, length 120
00:44:31.171995 IP 192.168.43.146.8880 > 192.168.43.147.7772: UDP, length 120
00:44:31.172184 IP 192.168.43.146.8880 > 192.168.43.147.7772: UDP, length 120
00:44:31.172328 IP 192.168.43.146.8880 > 192.168.43.147.7772: UDP, length 120
00:44:31.187152 IP 192.168.43.146.8880 > 192.168.43.147.7772: UDP, length 120
00:44:31.196942 IP 192.168.43.147.8880 > 192.168.43.124.7773: UDP, length 120
00:44:31.237844 IP 192.168.43.146.8880 > 192.168.43.147.7772: UDP, length 120
00:44:31.246933 IP 192.168.43.147.8880 > 192.168.43.124.7773: UDP, length 120
00:44:31.289651 IP 192.168.43.146.8880 > 192.168.43.147.7772: UDP, length 120
00:44:31.296931 IP 192.168.43.147.8880 > 192.168.43.124.7773: UDP, length 120
00:44:31.338580 IP 192.168.43.146.8880 > 192.168.43.147.7772: UDP, length 120
00:44:31.346931 IP 192.168.43.147.8880 > 192.168.43.124.7773: UDP, length 120
00:44:31.382232 IP 192.168.43.146.8880 > 192.168.43.147.7772: UDP, length 120
00:44:31.396934 IP 192.168.43.147.8880 > 192.168.43.124.7773: UDP, length 120
00:44:31.438717 IP 192.168.43.146.8880 > 192.168.43.147.7772: UDP, length 120
00:44:31.446930 IP 192.168.43.147.8880 > 192.168.43.124.7773: UDP, length 120
00:44:31.488280 IP 192.168.43.146.8880 > 192.168.43.147.7772: UDP, length 120
00:44:31.496938 IP 192.168.43.147.8880 > 192.168.43.124.7773: UDP, length 120
00:44:31.541039 IP 192.168.43.146.8880 > 192.168.43.147.7772: UDP, length 120
00:44:31.546932 IP 192.168.43.147.8880 > 192.168.43.124.7773: UDP, length 120
00:44:31.588447 IP 192.168.43.146.8880 > 192.168.43.147.7772: UDP, length 120
00:44:31.596931 IP 192.168.43.147.8880 > 192.168.43.124.7773: UDP, length 120
00:44:31.641547 IP 192.168.43.146.8880 > 192.168.43.147.7772: UDP, length 120
00:44:31.646932 IP 192.168.43.147.8880 > 192.168.43.124.7773: UDP, length 120
00:44:31.694273 IP 192.168.43.146.8880 > 192.168.43.147.7772: UDP, length 120
00:44:31.696931 IP 192.168.43.147.8880 > 192.168.43.124.7773: UDP, length 120
00:44:31.738239 IP 192.168.43.146.8880 > 192.168.43.147.7772: UDP, length 120
00:44:31.746931 IP 192.168.43.147.8880 > 192.168.43.124.7773: UDP, length 120
00:44:31.787312 IP 192.168.43.146.8880 > 192.168.43.147.7772: UDP, length 120
00:44:31.796932 IP 192.168.43.147.8880 > 192.168.43.124.7773: UDP, length 120
00:44:31.838087 IP 192.168.43.146.8880 > 192.168.43.147.7772: UDP, length 120
00:44:31.846931 IP 192.168.43.147.8880 > 192.168.43.124.7773: UDP, length 120
00:44:31.888423 IP 192.168.43.146.8880 > 192.168.43.147.7772: UDP, length 120
00:44:31.896959 IP 192.168.43.147.8880 > 192.168.43.124.7773: UDP, length 120
00:44:31.938538 IP 192.168.43.146.8880 > 192.168.43.147.7772: UDP, length 120
00:44:31.946958 IP 192.168.43.147.8880 > 192.168.43.124.7773: UDP, length 120
00:44:31.988366 IP 192.168.43.146.8880 > 192.168.43.147.7772: UDP, length 120
00:44:31.996958 IP 192.168.43.147.8880 > 192.168.43.124.7773: UDP, length 120
00:44:32.038341 IP 192.168.43.146.8880 > 192.168.43.147.7772: UDP, length 120
00:44:32.046972 IP 192.168.43.147.8880 > 192.168.43.124.7773: UDP, length 120
00:44:32.090446 IP 192.168.43.146.8880 > 192.168.43.147.7772: UDP, length 120
00:44:32.096969 IP 192.168.43.147.8880 > 192.168.43.124.7773: UDP, length 120
00:44:32.137436 IP 192.168.43.146.8880 > 192.168.43.147.7772: UDP, length 120
00:44:32.146958 IP 192.168.43.147.8880 > 192.168.43.124.7773: UDP, length 120
00:44:32.195502 IP 192.168.43.146.8880 > 192.168.43.147.7772: UDP, length 120
00:44:32.196957 IP 192.168.43.147.8880 > 192.168.43.124.7773: UDP, length 120
00:44:32.239084 IP 192.168.43.146.8880 > 192.168.43.147.7772: UDP, length 120
00:44:32.246966 IP 192.168.43.147.8880 > 192.168.43.124.7773: UDP, length 120
00:44:32.290806 IP 192.168.43.146.8880 > 192.168.43.147.7772: UDP, length 120
00:44:32.296957 IP 192.168.43.147.8880 > 192.168.43.124.7773: UDP, length 120
00:44:32.346956 IP 192.168.43.147.8880 > 192.168.43.124.7773: UDP, length 120
00:44:32.373789 IP 192.168.43.146.8880 > 192.168.43.147.7772: UDP, length 120
00:44:32.396957 IP 192.168.43.147.8880 > 192.168.43.124.7773: UDP, length 120
00:44:32.400384 IP 192.168.43.146.8880 > 192.168.43.147.7772: UDP, length 120
00:44:32.440037 IP 192.168.43.146.8880 > 192.168.43.147.7772: UDP, length 120
00:44:32.446957 IP 192.168.43.147.8880 > 192.168.43.124.7773: UDP, length 120
00:44:32.489007 IP 192.168.43.146.8880 > 192.168.43.147.7772: UDP, length 120
00:44:32.496963 IP 192.168.43.147.8880 > 192.168.43.124.7773: UDP, length 120
00:44:32.538039 IP 192.168.43.146.8880 > 192.168.43.147.7772: UDP, length 120
00:44:32.547010 IP 192.168.43.147.8880 > 192.168.43.124.7773: UDP, length 120
00:44:32.595680 IP 192.168.43.146.8880 > 192.168.43.147.7772: UDP, length 120
00:44:32.596972 IP 192.168.43.147.8880 > 192.168.43.124.7773: UDP, length 120
00:44:32.646960 IP 192.168.43.147.8880 > 192.168.43.124.7773: UDP, length 120
00:44:32.660168 IP 192.168.43.146.8880 > 192.168.43.147.7772: UDP, length 120
00:44:32.688181 IP 192.168.43.146.8880 > 192.168.43.147.7772: UDP, length 120
00:44:32.696957 IP 192.168.43.147.8880 > 192.168.43.124.7773: UDP, length 120
00:44:32.746956 IP 192.168.43.147.8880 > 192.168.43.124.7773: UDP, length 120
00:44:32.749157 IP 192.168.43.146.8880 > 192.168.43.147.7772: UDP, length 120
00:44:32.790906 IP 192.168.43.146.8880 > 192.168.43.147.7772: UDP, length 120
00:44:32.796957 IP 192.168.43.147.8880 > 192.168.43.124.7773: UDP, length 120
00:44:32.846957 IP 192.168.43.147.8880 > 192.168.43.124.7773: UDP, length 120
00:44:32.863075 IP 192.168.43.146.8880 > 192.168.43.147.7772: UDP, length 120
00:44:32.896959 IP 192.168.43.147.8880 > 192.168.43.124.7773: UDP, length 120
00:44:32.925230 IP 192.168.43.146.8880 > 192.168.43.147.7772: UDP, length 120
00:44:32.946958 IP 192.168.43.147.8880 > 192.168.43.124.7773: UDP, length 120
00:44:32.995512 IP 192.168.43.146.8880 > 192.168.43.147.7772: UDP, length 120
00:44:32.996956 IP 192.168.43.147.8880 > 192.168.43.124.7773: UDP, length 120
00:44:33.046956 IP 192.168.43.147.8880 > 192.168.43.124.7773: UDP, length 120
00:44:33.052663 IP 192.168.43.146.8880 > 192.168.43.147.7772: UDP, length 120
00:44:33.096956 IP 192.168.43.147.8880 > 192.168.43.124.7773: UDP, length 120
00:44:33.111784 IP 192.168.43.146.8880 > 192.168.43.147.7772: UDP, length 120
00:44:33.146956 IP 192.168.43.147.8880 > 192.168.43.124.7773: UDP, length 120
00:44:33.155674 IP 192.168.43.146.8880 > 192.168.43.147.7772: UDP, length 120
00:44:33.190082 IP 192.168.43.146.8880 > 192.168.43.147.7772: UDP, length 120
00:44:33.196971 IP 192.168.43.147.8880 > 192.168.43.124.7773: UDP, length 120
00:44:33.246965 IP 192.168.43.147.8880 > 192.168.43.124.7773: UDP, length 120
00:44:33.279591 IP 192.168.43.146.8880 > 192.168.43.147.7772: UDP, length 120
00:44:33.291375 IP 192.168.43.146.8880 > 192.168.43.147.7772: UDP, length 120
00:44:33.296962 IP 192.168.43.147.8880 > 192.168.43.124.7773: UDP, length 120
00:44:33.334885 IP 192.168.43.146.8880 > 192.168.43.147.7772: UDP, length 120
00:44:33.346961 IP 192.168.43.147.8880 > 192.168.43.124.7773: UDP, length 120
00:44:33.387410 IP 192.168.43.146.8880 > 192.168.43.147.7772: UDP, length 120
00:44:33.396960 IP 192.168.43.147.8880 > 192.168.43.124.7773: UDP, length 120
00:44:33.446967 IP 192.168.43.147.8880 > 192.168.43.124.7773: UDP, length 120
00:44:33.486777 IP 192.168.43.146.8880 > 192.168.43.147.7772: UDP, length 120
00:44:33.496970 IP 192.168.43.147.8880 > 192.168.43.124.7773: UDP, length 120
00:44:33.546959 IP 192.168.43.147.8880 > 192.168.43.124.7773: UDP, length 120
00:44:33.564898 IP 192.168.43.146.8880 > 192.168.43.147.7772: UDP, length 120
00:44:33.588300 IP 192.168.43.146.8880 > 192.168.43.147.7772: UDP, length 120
00:44:33.596958 IP 192.168.43.147.8880 > 192.168.43.124.7773: UDP, length 120
00:44:33.646959 IP 192.168.43.147.8880 > 192.168.43.124.7773: UDP, length 120
00:44:33.695117 IP 192.168.43.146.8880 > 192.168.43.147.7772: UDP, length 120
00:44:33.696968 IP 192.168.43.147.8880 > 192.168.43.124.7773: UDP, length 120
00:44:33.740273 IP 192.168.43.146.8880 > 192.168.43.147.7772: UDP, length 120
00:44:33.746980 IP 192.168.43.147.8880 > 192.168.43.124.7773: UDP, length 120
00:44:33.787542 IP 192.168.43.146.8880 > 192.168.43.147.7772: UDP, length 120
00:44:33.796963 IP 192.168.43.147.8880 > 192.168.43.124.7773: UDP, length 120
00:44:33.846958 IP 192.168.43.147.8880 > 192.168.43.124.7773: UDP, length 120
00:44:33.849680 IP 192.168.43.146.8880 > 192.168.43.147.7772: UDP, length 120
00:44:33.893257 IP 192.168.43.146.8880 > 192.168.43.147.7772: UDP, length 120
00:44:33.896958 IP 192.168.43.147.8880 > 192.168.43.124.7773: UDP, length 120
00:44:33.946969 IP 192.168.43.147.8880 > 192.168.43.124.7773: UDP, length 120
00:44:33.947623 IP 192.168.43.146.8880 > 192.168.43.147.7772: UDP, length 120
00:44:33.992918 IP 192.168.43.146.8880 > 192.168.43.147.7772: UDP, length 120
00:44:33.996967 IP 192.168.43.147.8880 > 192.168.43.124.7773: UDP, length 120
00:44:34.047028 IP 192.168.43.147.8880 > 192.168.43.124.7773: UDP, length 120
00:44:34.096993 IP 192.168.43.147.8880 > 192.168.43.124.7773: UDP, length 120
00:44:34.099286 IP 192.168.43.146.8880 > 192.168.43.147.7772: UDP, length 120
00:44:34.099444 IP 192.168.43.146.8880 > 192.168.43.147.7772: UDP, length 120
00:44:34.146966 IP 192.168.43.147.8880 > 192.168.43.124.7773: UDP, length 120
00:44:34.155183 IP 192.168.43.146.8880 > 192.168.43.147.7772: UDP, length 120
00:44:34.196970 IP 192.168.43.147.8880 > 192.168.43.124.7773: UDP, length 120
00:44:34.200370 IP 192.168.43.146.8880 > 192.168.43.147.7772: UDP, length 120
00:44:34.246970 IP 192.168.43.147.8880 > 192.168.43.124.7773: UDP, length 120
00:44:34.254614 IP 192.168.43.146.8880 > 192.168.43.147.7772: UDP, length 120
00:44:34.296963 IP 192.168.43.147.8880 > 192.168.43.124.7773: UDP, length 120
00:44:34.301669 IP 192.168.43.146.8880 > 192.168.43.147.7772: UDP, length 120
00:44:34.346960 IP 192.168.43.147.8880 > 192.168.43.124.7773: UDP, length 120
00:44:34.396962 IP 192.168.43.147.8880 > 192.168.43.124.7773: UDP, length 120
00:44:34.402058 IP 192.168.43.146.8880 > 192.168.43.147.7772: UDP, length 120
00:44:34.402312 IP 192.168.43.146.8880 > 192.168.43.147.7772: UDP, length 120
00:44:34.442433 IP 192.168.43.146.8880 > 192.168.43.147.7772: UDP, length 120
00:44:34.446961 IP 192.168.43.147.8880 > 192.168.43.124.7773: UDP, length 120
00:44:34.496972 IP 192.168.43.147.8880 > 192.168.43.124.7773: UDP, length 120
00:44:34.502030 IP 192.168.43.146.8880 > 192.168.43.147.7772: UDP, length 120
00:44:34.546960 IP 192.168.43.147.8880 > 192.168.43.124.7773: UDP, length 120
00:44:34.550353 IP 192.168.43.146.8880 > 192.168.43.147.7772: UDP, length 120
00:44:34.596957 IP 192.168.43.147.8880 > 192.168.43.124.7773: UDP, length 120
00:44:34.607597 IP 192.168.43.146.8880 > 192.168.43.147.7772: UDP, length 120
00:44:34.646960 IP 192.168.43.147.8880 > 192.168.43.124.7773: UDP, length 120
00:44:34.656317 IP 192.168.43.146.8880 > 192.168.43.147.7772: UDP, length 120
00:44:34.696957 IP 192.168.43.147.8880 > 192.168.43.124.7773: UDP, length 120
00:44:34.713636 IP 192.168.43.146.8880 > 192.168.43.147.7772: UDP, length 120
00:44:34.746968 IP 192.168.43.147.8880 > 192.168.43.124.7773: UDP, length 120
00:44:34.796956 IP 192.168.43.147.8880 > 192.168.43.124.7773: UDP, length 120
00:44:34.846957 IP 192.168.43.147.8880 > 192.168.43.124.7773: UDP, length 120
00:44:34.852869 IP 192.168.43.146.8880 > 192.168.43.147.7772: UDP, length 120
00:44:34.896957 IP 192.168.43.147.8880 > 192.168.43.124.7773: UDP, length 120
00:44:34.946957 IP 192.168.43.147.8880 > 192.168.43.124.7773: UDP, length 120
00:44:34.975936 IP 192.168.43.146.8880 > 192.168.43.147.7772: UDP, length 120
00:44:34.976052 IP 192.168.43.146.8880 > 192.168.43.147.7772: UDP, length 120
00:44:34.996958 IP 192.168.43.147.8880 > 192.168.43.124.7773: UDP, length 120
00:44:35.000360 IP 192.168.43.146.8880 > 192.168.43.147.7772: UDP, length 120
00:44:35.000472 IP 192.168.43.146.8880 > 192.168.43.147.7772: UDP, length 120
00:44:35.008952 IP 192.168.43.146.8880 > 192.168.43.147.7772: UDP, length 120
00:44:35.046958 IP 192.168.43.147.8880 > 192.168.43.124.7773: UDP, length 120
00:44:35.096958 IP 192.168.43.147.8880 > 192.168.43.124.7773: UDP, length 120
00:44:35.112371 IP 192.168.43.146.8880 > 192.168.43.147.7772: UDP, length 120
00:44:35.117340 IP 192.168.43.146.8880 > 192.168.43.147.7772: UDP, length 120
00:44:35.146959 IP 192.168.43.147.8880 > 192.168.43.124.7773: UDP, length 120
00:44:35.196954 IP 192.168.43.147.8880 > 192.168.43.124.7773: UDP, length 120
00:44:35.246957 IP 192.168.43.147.8880 > 192.168.43.124.7773: UDP, length 120
00:44:35.252014 IP 192.168.43.146.8880 > 192.168.43.147.7772: UDP, length 120
00:44:35.261842 IP 192.168.43.146.8880 > 192.168.43.147.7772: UDP, length 120
00:44:35.261957 IP 192.168.43.146.8880 > 192.168.43.147.7772: UDP, length 120
00:44:35.296958 IP 192.168.43.147.8880 > 192.168.43.124.7773: UDP, length 120
00:44:35.346965 IP 192.168.43.147.8880 > 192.168.43.124.7773: UDP, length 120
00:44:35.396964 IP 192.168.43.147.8880 > 192.168.43.124.7773: UDP, length 120
00:44:35.397951 IP 192.168.43.146.8880 > 192.168.43.147.7772: UDP, length 120
00:44:35.398174 IP 192.168.43.146.8880 > 192.168.43.147.7772: UDP, length 120
00:44:35.398287 IP 192.168.43.146.8880 > 192.168.43.147.7772: UDP, length 120
00:44:35.439938 IP 192.168.43.146.8880 > 192.168.43.147.7772: UDP, length 120
00:44:35.446964 IP 192.168.43.147.8880 > 192.168.43.124.7773: UDP, length 120
00:44:35.496976 IP 192.168.43.147.8880 > 192.168.43.124.7773: UDP, length 120
00:44:35.497423 IP 192.168.43.146.8880 > 192.168.43.147.7772: UDP, length 120
00:44:35.537970 IP 192.168.43.146.8880 > 192.168.43.147.7772: UDP, length 120
00:44:35.547047 IP 192.168.43.147.8880 > 192.168.43.124.7773: UDP, length 120
00:44:35.592992 IP 192.168.43.146.8880 > 192.168.43.147.7772: UDP, length 120
00:44:35.597042 IP 192.168.43.147.8880 > 192.168.43.124.7773: UDP, length 120
00:44:35.638918 IP 192.168.43.146.8880 > 192.168.43.147.7772: UDP, length 120
00:44:35.647065 IP 192.168.43.147.8880 > 192.168.43.124.7773: UDP, length 120
00:44:35.686235 IP 192.168.43.146.8880 > 192.168.43.147.7772: UDP, length 120
00:44:35.697004 IP 192.168.43.147.8880 > 192.168.43.124.7773: UDP, length 120
00:44:35.734950 IP 192.168.43.146.8880 > 192.168.43.147.7772: UDP, length 120
00:44:35.747030 IP 192.168.43.147.8880 > 192.168.43.124.7773: UDP, length 120
00:44:35.787565 IP 192.168.43.146.8880 > 192.168.43.147.7772: UDP, length 120
00:44:35.797004 IP 192.168.43.147.8880 > 192.168.43.124.7773: UDP, length 120
00:44:35.837409 IP 192.168.43.146.8880 > 192.168.43.147.7772: UDP, length 120
00:44:35.846982 IP 192.168.43.147.8880 > 192.168.43.124.7773: UDP, length 120
00:44:35.889161 IP 192.168.43.146.8880 > 192.168.43.147.7772: UDP, length 120
00:44:35.897003 IP 192.168.43.147.8880 > 192.168.43.124.7773: UDP, length 120
00:44:35.937515 IP 192.168.43.146.8880 > 192.168.43.147.7772: UDP, length 120
00:44:35.947013 IP 192.168.43.147.8880 > 192.168.43.124.7773: UDP, length 120
00:44:35.992103 IP 192.168.43.146.8880 > 192.168.43.147.7772: UDP, length 120
00:44:35.997004 IP 192.168.43.147.8880 > 192.168.43.124.7773: UDP, length 120
00:44:36.039381 IP 192.168.43.146.8880 > 192.168.43.147.7772: UDP, length 120
00:44:36.046974 IP 192.168.43.147.8880 > 192.168.43.124.7773: UDP, length 120
00:44:36.087304 IP 192.168.43.146.8880 > 192.168.43.147.7772: UDP, length 120
00:44:36.096938 IP 192.168.43.147.8880 > 192.168.43.124.7773: UDP, length 120
00:44:36.138510 IP 192.168.43.146.8880 > 192.168.43.147.7772: UDP, length 120
00:44:36.146938 IP 192.168.43.147.8880 > 192.168.43.124.7773: UDP, length 120
00:44:36.196930 IP 192.168.43.147.8880 > 192.168.43.124.7773: UDP, length 120
00:44:36.198869 IP 192.168.43.146.8880 > 192.168.43.147.7772: UDP, length 120
00:44:36.240265 IP 192.168.43.146.8880 > 192.168.43.147.7772: UDP, length 120
00:44:36.246931 IP 192.168.43.147.8880 > 192.168.43.124.7773: UDP, length 120
00:44:36.288250 IP 192.168.43.146.8880 > 192.168.43.147.7772: UDP, length 120
00:44:36.296935 IP 192.168.43.147.8880 > 192.168.43.124.7773: UDP, length 120
00:44:36.338475 IP 192.168.43.146.8880 > 192.168.43.147.7772: UDP, length 120
00:44:36.346930 IP 192.168.43.147.8880 > 192.168.43.124.7773: UDP, length 120
00:44:36.394192 IP 192.168.43.146.8880 > 192.168.43.147.7772: UDP, length 120
00:44:36.396930 IP 192.168.43.147.8880 > 192.168.43.124.7773: UDP, length 120
00:44:36.444166 IP 192.168.43.146.8880 > 192.168.43.147.7772: UDP, length 120
00:44:36.446934 IP 192.168.43.147.8880 > 192.168.43.124.7773: UDP, length 120
00:44:36.494175 IP 192.168.43.146.8880 > 192.168.43.147.7772: UDP, length 120
00:44:36.496954 IP 192.168.43.147.8880 > 192.168.43.124.7773: UDP, length 120
00:44:36.540151 IP 192.168.43.146.8880 > 192.168.43.147.7772: UDP, length 120
00:44:36.546931 IP 192.168.43.147.8880 > 192.168.43.124.7773: UDP, length 120
00:44:36.593179 IP 192.168.43.146.8880 > 192.168.43.147.7772: UDP, length 120
00:44:36.596930 IP 192.168.43.147.8880 > 192.168.43.124.7773: UDP, length 120
00:44:36.637910 IP 192.168.43.146.8880 > 192.168.43.147.7772: UDP, length 120
00:44:36.646933 IP 192.168.43.147.8880 > 192.168.43.124.7773: UDP, length 120
00:44:36.687704 IP 192.168.43.146.8880 > 192.168.43.147.7772: UDP, length 120
00:44:36.696931 IP 192.168.43.147.8880 > 192.168.43.124.7773: UDP, length 120
00:44:36.736823 IP 192.168.43.146.8880 > 192.168.43.147.7772: UDP, length 120
00:44:36.746930 IP 192.168.43.147.8880 > 192.168.43.124.7773: UDP, length 120
00:44:36.783424 IP 192.168.43.146.8880 > 192.168.43.147.7772: UDP, length 120
00:44:36.796942 IP 192.168.43.147.8880 > 192.168.43.124.7773: UDP, length 120
00:44:36.839828 IP 192.168.43.146.8880 > 192.168.43.147.7772: UDP, length 120
00:44:36.846935 IP 192.168.43.147.8880 > 192.168.43.124.7773: UDP, length 120
00:44:36.888747 IP 192.168.43.146.8880 > 192.168.43.147.7772: UDP, length 120
00:44:36.896958 IP 192.168.43.147.8880 > 192.168.43.124.7773: UDP, length 120
00:44:36.943462 IP 192.168.43.146.8880 > 192.168.43.147.7772: UDP, length 120
00:44:36.946969 IP 192.168.43.147.8880 > 192.168.43.124.7773: UDP, length 120
00:44:36.988356 IP 192.168.43.146.8880 > 192.168.43.147.7772: UDP, length 120
00:44:36.996960 IP 192.168.43.147.8880 > 192.168.43.124.7773: UDP, length 120
00:44:37.037884 IP 192.168.43.146.8880 > 192.168.43.147.7772: UDP, length 120
00:44:37.046980 IP 192.168.43.147.8880 > 192.168.43.124.7773: UDP, length 120
00:44:37.090789 IP 192.168.43.146.8880 > 192.168.43.147.7772: UDP, length 120
00:44:37.097024 IP 192.168.43.147.8880 > 192.168.43.124.7773: UDP, length 120
00:44:37.137596 IP 192.168.43.146.8880 > 192.168.43.147.7772: UDP, length 120
00:44:37.146962 IP 192.168.43.147.8880 > 192.168.43.124.7773: UDP, length 120
00:44:37.188906 IP 192.168.43.146.8880 > 192.168.43.147.7772: UDP, length 120
00:44:37.196957 IP 192.168.43.147.8880 > 192.168.43.124.7773: UDP, length 120
00:44:37.239918 IP 192.168.43.146.8880 > 192.168.43.147.7772: UDP, length 120
00:44:37.246957 IP 192.168.43.147.8880 > 192.168.43.124.7773: UDP, length 120
00:44:37.287949 IP 192.168.43.146.8880 > 192.168.43.147.7772: UDP, length 120
00:44:37.296973 IP 192.168.43.147.8880 > 192.168.43.124.7773: UDP, length 120
00:44:37.344605 IP 192.168.43.146.8880 > 192.168.43.147.7772: UDP, length 120
00:44:37.346965 IP 192.168.43.147.8880 > 192.168.43.124.7773: UDP, length 120
00:44:37.385476 IP 192.168.43.146.8880 > 192.168.43.147.7772: UDP, length 120
