23:48:33.553181 IP 192.168.43.146.8880 > 192.168.43.147.7772: UDP, length 120
23:48:33.603246 IP 192.168.43.146.8880 > 192.168.43.147.7772: UDP, length 120
23:48:33.653222 IP 192.168.43.146.8880 > 192.168.43.147.7772: UDP, length 120
23:48:33.703213 IP 192.168.43.146.8880 > 192.168.43.147.7772: UDP, length 120
23:48:33.753213 IP 192.168.43.146.8880 > 192.168.43.147.7772: UDP, length 120
23:48:33.803210 IP 192.168.43.146.8880 > 192.168.43.147.7772: UDP, length 120
23:48:33.853208 IP 192.168.43.146.8880 > 192.168.43.147.7772: UDP, length 120
23:48:33.903208 IP 192.168.43.146.8880 > 192.168.43.147.7772: UDP, length 120
23:48:33.953205 IP 192.168.43.146.8880 > 192.168.43.147.7772: UDP, length 120
23:48:34.005039 IP 192.168.43.146.8880 > 192.168.43.147.7772: UDP, length 120
23:48:34.053287 IP 192.168.43.146.8880 > 192.168.43.147.7772: UDP, length 120
23:48:34.103223 IP 192.168.43.146.8880 > 192.168.43.147.7772: UDP, length 120
23:48:34.153207 IP 192.168.43.146.8880 > 192.168.43.147.7772: UDP, length 120
23:48:34.203281 IP 192.168.43.146.8880 > 192.168.43.147.7772: UDP, length 120
23:48:34.253358 IP 192.168.43.146.8880 > 192.168.43.147.7772: UDP, length 120
23:48:34.303314 IP 192.168.43.146.8880 > 192.168.43.147.7772: UDP, length 120
23:48:34.353250 IP 192.168.43.146.8880 > 192.168.43.147.7772: UDP, length 120
23:48:34.403246 IP 192.168.43.146.8880 > 192.168.43.147.7772: UDP, length 120
23:48:34.453300 IP 192.168.43.146.8880 > 192.168.43.147.7772: UDP, length 120
23:48:34.503281 IP 192.168.43.146.8880 > 192.168.43.147.7772: UDP, length 120
23:48:34.553245 IP 192.168.43.146.8880 > 192.168.43.147.7772: UDP, length 120
23:48:34.603273 IP 192.168.43.146.8880 > 192.168.43.147.7772: UDP, length 120
23:48:34.653240 IP 192.168.43.146.8880 > 192.168.43.147.7772: UDP, length 120
23:48:34.703194 IP 192.168.43.146.8880 > 192.168.43.147.7772: UDP, length 120
23:48:34.753183 IP 192.168.43.146.8880 > 192.168.43.147.7772: UDP, length 120
23:48:34.803181 IP 192.168.43.146.8880 > 192.168.43.147.7772: UDP, length 120
23:48:34.853182 IP 192.168.43.146.8880 > 192.168.43.147.7772: UDP, length 120
23:48:34.903230 IP 192.168.43.146.8880 > 192.168.43.147.7772: UDP, length 120
23:48:34.953186 IP 192.168.43.146.8880 > 192.168.43.147.7772: UDP, length 120
23:48:35.003180 IP 192.168.43.146.8880 > 192.168.43.147.7772: UDP, length 120
23:48:35.053227 IP 192.168.43.146.8880 > 192.168.43.147.7772: UDP, length 120
23:48:35.103194 IP 192.168.43.146.8880 > 192.168.43.147.7772: UDP, length 120
23:48:35.153181 IP 192.168.43.146.8880 > 192.168.43.147.7772: UDP, length 120
23:48:35.203178 IP 192.168.43.146.8880 > 192.168.43.147.7772: UDP, length 120
23:48:35.253179 IP 192.168.43.146.8880 > 192.168.43.147.7772: UDP, length 120
23:48:35.303180 IP 192.168.43.146.8880 > 192.168.43.147.7772: UDP, length 120
23:48:35.353181 IP 192.168.43.146.8880 > 192.168.43.147.7772: UDP, length 120
23:48:35.403179 IP 192.168.43.146.8880 > 192.168.43.147.7772: UDP, length 120
23:48:35.453179 IP 192.168.43.146.8880 > 192.168.43.147.7772: UDP, length 120
23:48:35.503183 IP 192.168.43.146.8880 > 192.168.43.147.7772: UDP, length 120
23:48:35.553183 IP 192.168.43.146.8880 > 192.168.43.147.7772: UDP, length 120
23:48:35.603206 IP 192.168.43.146.8880 > 192.168.43.147.7772: UDP, length 120
23:48:35.653183 IP 192.168.43.146.8880 > 192.168.43.147.7772: UDP, length 120
23:48:35.703179 IP 192.168.43.146.8880 > 192.168.43.147.7772: UDP, length 120
23:48:35.753180 IP 192.168.43.146.8880 > 192.168.43.147.7772: UDP, length 120
23:48:35.803180 IP 192.168.43.146.8880 > 192.168.43.147.7772: UDP, length 120
23:48:35.853180 IP 192.168.43.146.8880 > 192.168.43.147.7772: UDP, length 120
23:48:35.903179 IP 192.168.43.146.8880 > 192.168.43.147.7772: UDP, length 120
23:48:35.953179 IP 192.168.43.146.8880 > 192.168.43.147.7772: UDP, length 120
23:48:36.003180 IP 192.168.43.146.8880 > 192.168.43.147.7772: UDP, length 120
23:48:36.053179 IP 192.168.43.146.8880 > 192.168.43.147.7772: UDP, length 120
23:48:36.103179 IP 192.168.43.146.8880 > 192.168.43.147.7772: UDP, length 120
23:48:36.153179 IP 192.168.43.146.8880 > 192.168.43.147.7772: UDP, length 120
23:48:36.203179 IP 192.168.43.146.8880 > 192.168.43.147.7772: UDP, length 120
23:48:36.253179 IP 192.168.43.146.8880 > 192.168.43.147.7772: UDP, length 120
23:48:36.303178 IP 192.168.43.146.8880 > 192.168.43.147.7772: UDP, length 120
23:48:36.353180 IP 192.168.43.146.8880 > 192.168.43.147.7772: UDP, length 120
23:48:36.403232 IP 192.168.43.146.8880 > 192.168.43.147.7772: UDP, length 120
23:48:36.453184 IP 192.168.43.146.8880 > 192.168.43.147.7772: UDP, length 120
23:48:36.503179 IP 192.168.43.146.8880 > 192.168.43.147.7772: UDP, length 120
23:48:36.553183 IP 192.168.43.146.8880 > 192.168.43.147.7772: UDP, length 120
23:48:36.603215 IP 192.168.43.146.8880 > 192.168.43.147.7772: UDP, length 120
23:48:36.653184 IP 192.168.43.146.8880 > 192.168.43.147.7772: UDP, length 120
23:48:36.703179 IP 192.168.43.146.8880 > 192.168.43.147.7772: UDP, length 120
23:48:36.753180 IP 192.168.43.146.8880 > 192.168.43.147.7772: UDP, length 120
23:48:36.803179 IP 192.168.43.146.8880 > 192.168.43.147.7772: UDP, length 120
23:48:36.853180 IP 192.168.43.146.8880 > 192.168.43.147.7772: UDP, length 120
23:48:36.903178 IP 192.168.43.146.8880 > 192.168.43.147.7772: UDP, length 120
23:48:36.953184 IP 192.168.43.146.8880 > 192.168.43.147.7772: UDP, length 120
23:48:37.003179 IP 192.168.43.146.8880 > 192.168.43.147.7772: UDP, length 120
23:48:37.053246 IP 192.168.43.146.8880 > 192.168.43.147.7772: UDP, length 120
23:48:37.103264 IP 192.168.43.146.8880 > 192.168.43.147.7772: UDP, length 120
23:48:37.153234 IP 192.168.43.146.8880 > 192.168.43.147.7772: UDP, length 120
23:48:37.203188 IP 192.168.43.146.8880 > 192.168.43.147.7772: UDP, length 120
23:48:37.253181 IP 192.168.43.146.8880 > 192.168.43.147.7772: UDP, length 120
23:48:37.303182 IP 192.168.43.146.8880 > 192.168.43.147.7772: UDP, length 120
23:48:37.353182 IP 192.168.43.146.8880 > 192.168.43.147.7772: UDP, length 120
23:48:37.403179 IP 192.168.43.146.8880 > 192.168.43.147.7772: UDP, length 120
23:48:37.453180 IP 192.168.43.146.8880 > 192.168.43.147.7772: UDP, length 120
23:48:37.503181 IP 192.168.43.146.8880 > 192.168.43.147.7772: UDP, length 120
23:48:37.553181 IP 192.168.43.146.8880 > 192.168.43.147.7772: UDP, length 120
23:48:37.603213 IP 192.168.43.146.8880 > 192.168.43.147.7772: UDP, length 120
23:48:37.653228 IP 192.168.43.146.8880 > 192.168.43.147.7772: UDP, length 120
23:48:37.703207 IP 192.168.43.146.8880 > 192.168.43.147.7772: UDP, length 120
23:48:37.753205 IP 192.168.43.146.8880 > 192.168.43.147.7772: UDP, length 120
23:48:37.803204 IP 192.168.43.146.8880 > 192.168.43.147.7772: UDP, length 120
23:48:37.853212 IP 192.168.43.146.8880 > 192.168.43.147.7772: UDP, length 120
23:48:37.903272 IP 192.168.43.146.8880 > 192.168.43.147.7772: UDP, length 120
23:48:37.953216 IP 192.168.43.146.8880 > 192.168.43.147.7772: UDP, length 120
23:48:38.003205 IP 192.168.43.146.8880 > 192.168.43.147.7772: UDP, length 120
23:48:38.021364 IP 192.168.43.124.8880 > 192.168.43.146.7771: UDP, length 120
23:48:38.021710 IP 192.168.43.124.8880 > 192.168.43.146.7771: UDP, length 120
23:48:38.053213 IP 192.168.43.146.8880 > 192.168.43.147.7772: UDP, length 120
23:48:38.103205 IP 192.168.43.146.8880 > 192.168.43.147.7772: UDP, length 120
23:48:38.119762 IP 192.168.43.124.8880 > 192.168.43.146.7771: UDP, length 120
23:48:38.120142 IP 192.168.43.124.8880 > 192.168.43.146.7771: UDP, length 120
23:48:38.153309 IP 192.168.43.146.8880 > 192.168.43.147.7772: UDP, length 120
23:48:38.203289 IP 192.168.43.146.8880 > 192.168.43.147.7772: UDP, length 120
23:48:38.220848 IP 192.168.43.124.8880 > 192.168.43.146.7771: UDP, length 120
23:48:38.221144 IP 192.168.43.124.8880 > 192.168.43.146.7771: UDP, length 120
23:48:38.253231 IP 192.168.43.146.8880 > 192.168.43.147.7772: UDP, length 120
23:48:38.303211 IP 192.168.43.146.8880 > 192.168.43.147.7772: UDP, length 120
23:48:38.320503 IP 192.168.43.124.8880 > 192.168.43.146.7771: UDP, length 120
23:48:38.320798 IP 192.168.43.124.8880 > 192.168.43.146.7771: UDP, length 120
23:48:38.353214 IP 192.168.43.146.8880 > 192.168.43.147.7772: UDP, length 120
23:48:38.403204 IP 192.168.43.146.8880 > 192.168.43.147.7772: UDP, length 120
23:48:38.422007 IP 192.168.43.124.8880 > 192.168.43.146.7771: UDP, length 120
23:48:38.422226 IP 192.168.43.124.8880 > 192.168.43.146.7771: UDP, length 120
23:48:38.453209 IP 192.168.43.146.8880 > 192.168.43.147.7772: UDP, length 120
23:48:38.503205 IP 192.168.43.146.8880 > 192.168.43.147.7772: UDP, length 120
23:48:38.526835 IP 192.168.43.124.8880 > 192.168.43.146.7771: UDP, length 120
23:48:38.527048 IP 192.168.43.124.8880 > 192.168.43.146.7771: UDP, length 120
23:48:38.553211 IP 192.168.43.146.8880 > 192.168.43.147.7772: UDP, length 120
23:48:38.603239 IP 192.168.43.146.8880 > 192.168.43.147.7772: UDP, length 120
23:48:38.619465 IP 192.168.43.124.8880 > 192.168.43.146.7771: UDP, length 120
23:48:38.619798 IP 192.168.43.124.8880 > 192.168.43.146.7771: UDP, length 120
23:48:38.653229 IP 192.168.43.146.8880 > 192.168.43.147.7772: UDP, length 120
23:48:38.703210 IP 192.168.43.146.8880 > 192.168.43.147.7772: UDP, length 120
23:48:38.721428 IP 192.168.43.124.8880 > 192.168.43.146.7771: UDP, length 120
23:48:38.722493 IP 192.168.43.124.8880 > 192.168.43.146.7771: UDP, length 120
23:48:38.753220 IP 192.168.43.146.8880 > 192.168.43.147.7772: UDP, length 120
23:48:38.803205 IP 192.168.43.146.8880 > 192.168.43.147.7772: UDP, length 120
23:48:38.820169 IP 192.168.43.124.8880 > 192.168.43.146.7771: UDP, length 120
23:48:38.820459 IP 192.168.43.124.8880 > 192.168.43.146.7771: UDP, length 120
23:48:38.853210 IP 192.168.43.146.8880 > 192.168.43.147.7772: UDP, length 120
23:48:38.903205 IP 192.168.43.146.8880 > 192.168.43.147.7772: UDP, length 120
23:48:38.920695 IP 192.168.43.124.8880 > 192.168.43.146.7771: UDP, length 120
23:48:38.920943 IP 192.168.43.124.8880 > 192.168.43.146.7771: UDP, length 120
23:48:38.953209 IP 192.168.43.146.8880 > 192.168.43.147.7772: UDP, length 120
23:48:39.003204 IP 192.168.43.146.8880 > 192.168.43.147.7772: UDP, length 120
23:48:39.020669 IP 192.168.43.124.8880 > 192.168.43.146.7771: UDP, length 120
23:48:39.020958 IP 192.168.43.124.8880 > 192.168.43.146.7771: UDP, length 120
23:48:39.053209 IP 192.168.43.146.8880 > 192.168.43.147.7772: UDP, length 120
23:48:39.103206 IP 192.168.43.146.8880 > 192.168.43.147.7772: UDP, length 120
23:48:39.121485 IP 192.168.43.124.8880 > 192.168.43.146.7771: UDP, length 120
23:48:39.121745 IP 192.168.43.124.8880 > 192.168.43.146.7771: UDP, length 120
23:48:39.153209 IP 192.168.43.146.8880 > 192.168.43.147.7772: UDP, length 120
23:48:39.203281 IP 192.168.43.146.8880 > 192.168.43.147.7772: UDP, length 120
23:48:39.220678 IP 192.168.43.124.8880 > 192.168.43.146.7771: UDP, length 120
23:48:39.220971 IP 192.168.43.124.8880 > 192.168.43.146.7771: UDP, length 120
23:48:39.253241 IP 192.168.43.146.8880 > 192.168.43.147.7772: UDP, length 120
23:48:39.303209 IP 192.168.43.146.8880 > 192.168.43.147.7772: UDP, length 120
23:48:39.319648 IP 192.168.43.124.8880 > 192.168.43.146.7771: UDP, length 120
23:48:39.320142 IP 192.168.43.124.8880 > 192.168.43.146.7771: UDP, length 120
23:48:39.353217 IP 192.168.43.146.8880 > 192.168.43.147.7772: UDP, length 120
23:48:39.403272 IP 192.168.43.146.8880 > 192.168.43.147.7772: UDP, length 120
23:48:39.427043 IP 192.168.43.124.8880 > 192.168.43.146.7771: UDP, length 120
23:48:39.427301 IP 192.168.43.124.8880 > 192.168.43.146.7771: UDP, length 120
23:48:39.453221 IP 192.168.43.146.8880 > 192.168.43.147.7772: UDP, length 120
23:48:39.503205 IP 192.168.43.146.8880 > 192.168.43.147.7772: UDP, length 120
23:48:39.520651 IP 192.168.43.124.8880 > 192.168.43.146.7771: UDP, length 120
23:48:39.522208 IP 192.168.43.124.8880 > 192.168.43.146.7771: UDP, length 120
23:48:39.553210 IP 192.168.43.146.8880 > 192.168.43.147.7772: UDP, length 120
23:48:39.587050 IP 192.168.43.124.8880 > 192.168.43.146.7771: UDP, length 120
23:48:39.587295 IP 192.168.43.124.8880 > 192.168.43.146.7771: UDP, length 120
23:48:39.603237 IP 192.168.43.146.8880 > 192.168.43.147.7772: UDP, length 120
23:48:39.627156 IP 192.168.43.124.8880 > 192.168.43.146.7771: UDP, length 120
23:48:39.653276 IP 192.168.43.146.8880 > 192.168.43.147.7772: UDP, length 120
23:48:39.678751 IP 192.168.43.124.8880 > 192.168.43.146.7771: UDP, length 120
23:48:39.703293 IP 192.168.43.146.8880 > 192.168.43.147.7772: UDP, length 120
23:48:39.727308 IP 192.168.43.124.8880 > 192.168.43.146.7771: UDP, length 120
23:48:39.753342 IP 192.168.43.146.8880 > 192.168.43.147.7772: UDP, length 120
23:48:39.777330 IP 192.168.43.124.8880 > 192.168.43.146.7771: UDP, length 120
23:48:39.803310 IP 192.168.43.146.8880 > 192.168.43.147.7772: UDP, length 120
23:48:39.827173 IP 192.168.43.124.8880 > 192.168.43.146.7771: UDP, length 120
23:48:39.853290 IP 192.168.43.146.8880 > 192.168.43.147.7772: UDP, length 120
23:48:39.878649 IP 192.168.43.124.8880 > 192.168.43.146.7771: UDP, length 120
23:48:39.903255 IP 192.168.43.146.8880 > 192.168.43.147.7772: UDP, length 120
23:48:39.927126 IP 192.168.43.124.8880 > 192.168.43.146.7771: UDP, length 120
23:48:39.953257 IP 192.168.43.146.8880 > 192.168.43.147.7772: UDP, length 120
23:48:39.978699 IP 192.168.43.124.8880 > 192.168.43.146.7771: UDP, length 120
23:48:40.003287 IP 192.168.43.146.8880 > 192.168.43.147.7772: UDP, length 120
23:48:40.038824 IP 192.168.43.124.8880 > 192.168.43.146.7771: UDP, length 120
23:48:40.053281 IP 192.168.43.146.8880 > 192.168.43.147.7772: UDP, length 120
23:48:40.077089 IP 192.168.43.124.8880 > 192.168.43.146.7771: UDP, length 120
23:48:40.103259 IP 192.168.43.146.8880 > 192.168.43.147.7772: UDP, length 120
23:48:40.127025 IP 192.168.43.124.8880 > 192.168.43.146.7771: UDP, length 120
23:48:40.153240 IP 192.168.43.146.8880 > 192.168.43.147.7772: UDP, length 120
23:48:40.176923 IP 192.168.43.124.8880 > 192.168.43.146.7771: UDP, length 120
23:48:40.203237 IP 192.168.43.146.8880 > 192.168.43.147.7772: UDP, length 120
23:48:40.227439 IP 192.168.43.124.8880 > 192.168.43.146.7771: UDP, length 120
23:48:40.253204 IP 192.168.43.146.8880 > 192.168.43.147.7772: UDP, length 120
23:48:40.276941 IP 192.168.43.124.8880 > 192.168.43.146.7771: UDP, length 120
23:48:40.303187 IP 192.168.43.146.8880 > 192.168.43.147.7772: UDP, length 120
23:48:40.327911 IP 192.168.43.124.8880 > 192.168.43.146.7771: UDP, length 120
23:48:40.353184 IP 192.168.43.146.8880 > 192.168.43.147.7772: UDP, length 120
23:48:40.376912 IP 192.168.43.124.8880 > 192.168.43.146.7771: UDP, length 120
23:48:40.403185 IP 192.168.43.146.8880 > 192.168.43.147.7772: UDP, length 120
23:48:40.425889 IP 192.168.43.124.8880 > 192.168.43.146.7771: UDP, length 120
23:48:40.453194 IP 192.168.43.146.8880 > 192.168.43.147.7772: UDP, length 120
23:48:40.476900 IP 192.168.43.124.8880 > 192.168.43.146.7771: UDP, length 120
23:48:40.503185 IP 192.168.43.146.8880 > 192.168.43.147.7772: UDP, length 120
23:48:40.526891 IP 192.168.43.124.8880 > 192.168.43.146.7771: UDP, length 120
23:48:40.553185 IP 192.168.43.146.8880 > 192.168.43.147.7772: UDP, length 120
23:48:40.575634 IP 192.168.43.124.8880 > 192.168.43.146.7771: UDP, length 120
23:48:40.603206 IP 192.168.43.146.8880 > 192.168.43.147.7772: UDP, length 120
23:48:40.629002 IP 192.168.43.124.8880 > 192.168.43.146.7771: UDP, length 120
23:48:40.653195 IP 192.168.43.146.8880 > 192.168.43.147.7772: UDP, length 120
23:48:40.677372 IP 192.168.43.124.8880 > 192.168.43.146.7771: UDP, length 120
23:48:40.703187 IP 192.168.43.146.8880 > 192.168.43.147.7772: UDP, length 120
23:48:40.726798 IP 192.168.43.124.8880 > 192.168.43.146.7771: UDP, length 120
23:48:40.753185 IP 192.168.43.146.8880 > 192.168.43.147.7772: UDP, length 120
23:48:40.777537 IP 192.168.43.124.8880 > 192.168.43.146.7771: UDP, length 120
23:48:40.803189 IP 192.168.43.146.8880 > 192.168.43.147.7772: UDP, length 120
23:48:40.827032 IP 192.168.43.124.8880 > 192.168.43.146.7771: UDP, length 120
23:48:40.853192 IP 192.168.43.146.8880 > 192.168.43.147.7772: UDP, length 120
23:48:40.875534 IP 192.168.43.124.8880 > 192.168.43.146.7771: UDP, length 120
23:48:40.903222 IP 192.168.43.146.8880 > 192.168.43.147.7772: UDP, length 120
23:48:40.926869 IP 192.168.43.124.8880 > 192.168.43.146.7771: UDP, length 120
23:48:40.953187 IP 192.168.43.146.8880 > 192.168.43.147.7772: UDP, length 120
23:48:40.976858 IP 192.168.43.124.8880 > 192.168.43.146.7771: UDP, length 120
23:48:41.003183 IP 192.168.43.146.8880 > 192.168.43.147.7772: UDP, length 120
23:48:41.026907 IP 192.168.43.124.8880 > 192.168.43.146.7771: UDP, length 120
23:48:41.053184 IP 192.168.43.146.8880 > 192.168.43.147.7772: UDP, length 120
23:48:41.078560 IP 192.168.43.124.8880 > 192.168.43.146.7771: UDP, length 120
23:48:41.103184 IP 192.168.43.146.8880 > 192.168.43.147.7772: UDP, length 120
23:48:41.126899 IP 192.168.43.124.8880 > 192.168.43.146.7771: UDP, length 120
23:48:41.153184 IP 192.168.43.146.8880 > 192.168.43.147.7772: UDP, length 120
23:48:41.176814 IP 192.168.43.124.8880 > 192.168.43.146.7771: UDP, length 120
23:48:41.203207 IP 192.168.43.146.8880 > 192.168.43.147.7772: UDP, length 120
23:48:41.226848 IP 192.168.43.124.8880 > 192.168.43.146.7771: UDP, length 120
23:48:41.253225 IP 192.168.43.146.8880 > 192.168.43.147.7772: UDP, length 120
23:48:41.276793 IP 192.168.43.124.8880 > 192.168.43.146.7771: UDP, length 120
23:48:41.303187 IP 192.168.43.146.8880 > 192.168.43.147.7772: UDP, length 120
23:48:41.326297 IP 192.168.43.124.8880 > 192.168.43.146.7771: UDP, length 120
23:48:41.353185 IP 192.168.43.146.8880 > 192.168.43.147.7772: UDP, length 120
23:48:41.376920 IP 192.168.43.124.8880 > 192.168.43.146.7771: UDP, length 120
23:48:41.403183 IP 192.168.43.146.8880 > 192.168.43.147.7772: UDP, length 120
23:48:41.430698 IP 192.168.43.124.8880 > 192.168.43.146.7771: UDP, length 120
23:48:41.453184 IP 192.168.43.146.8880 > 192.168.43.147.7772: UDP, length 120
23:48:41.476830 IP 192.168.43.124.8880 > 192.168.43.146.7771: UDP, length 120
23:48:41.503182 IP 192.168.43.146.8880 > 192.168.43.147.7772: UDP, length 120
23:48:41.527593 IP 192.168.43.124.8880 > 192.168.43.146.7771: UDP, length 120
23:48:41.553184 IP 192.168.43.146.8880 > 192.168.43.147.7772: UDP, length 120
23:48:41.575633 IP 192.168.43.124.8880 > 192.168.43.146.7771: UDP, length 120
23:48:41.603204 IP 192.168.43.146.8880 > 192.168.43.147.7772: UDP, length 120
23:48:41.628411 IP 192.168.43.124.8880 > 192.168.43.146.7771: UDP, length 120
23:48:41.653191 IP 192.168.43.146.8880 > 192.168.43.147.7772: UDP, length 120
23:48:41.676746 IP 192.168.43.124.8880 > 192.168.43.146.7771: UDP, length 120
23:48:41.703192 IP 192.168.43.146.8880 > 192.168.43.147.7772: UDP, length 120
23:48:41.726479 IP 192.168.43.124.8880 > 192.168.43.146.7771: UDP, length 120
23:48:41.753190 IP 192.168.43.146.8880 > 192.168.43.147.7772: UDP, length 120
23:48:41.776723 IP 192.168.43.124.8880 > 192.168.43.146.7771: UDP, length 120
23:48:41.803184 IP 192.168.43.146.8880 > 192.168.43.147.7772: UDP, length 120
23:48:41.826031 IP 192.168.43.124.8880 > 192.168.43.146.7771: UDP, length 120
23:48:41.853189 IP 192.168.43.146.8880 > 192.168.43.147.7772: UDP, length 120
23:48:41.876739 IP 192.168.43.124.8880 > 192.168.43.146.7771: UDP, length 120
23:48:41.903188 IP 192.168.43.146.8880 > 192.168.43.147.7772: UDP, length 120
23:48:41.928602 IP 192.168.43.124.8880 > 192.168.43.146.7771: UDP, length 120
23:48:41.953182 IP 192.168.43.146.8880 > 192.168.43.147.7772: UDP, length 120
23:48:41.971744 IP 192.168.43.124.8880 > 192.168.43.146.7771: UDP, length 120
23:48:42.003182 IP 192.168.43.146.8880 > 192.168.43.147.7772: UDP, length 120
23:48:42.026895 IP 192.168.43.124.8880 > 192.168.43.146.7771: UDP, length 120
23:48:42.053183 IP 192.168.43.146.8880 > 192.168.43.147.7772: UDP, length 120
23:48:42.076737 IP 192.168.43.124.8880 > 192.168.43.146.7771: UDP, length 120
23:48:42.103183 IP 192.168.43.146.8880 > 192.168.43.147.7772: UDP, length 120
23:48:42.128740 IP 192.168.43.124.8880 > 192.168.43.146.7771: UDP, length 120
23:48:42.153183 IP 192.168.43.146.8880 > 192.168.43.147.7772: UDP, length 120
23:48:42.176868 IP 192.168.43.124.8880 > 192.168.43.146.7771: UDP, length 120
23:48:42.203184 IP 192.168.43.146.8880 > 192.168.43.147.7772: UDP, length 120
23:48:42.226744 IP 192.168.43.124.8880 > 192.168.43.146.7771: UDP, length 120
23:48:42.253228 IP 192.168.43.146.8880 > 192.168.43.147.7772: UDP, length 120
23:48:42.276740 IP 192.168.43.124.8880 > 192.168.43.146.7771: UDP, length 120
23:48:42.303186 IP 192.168.43.146.8880 > 192.168.43.147.7772: UDP, length 120
23:48:42.328522 IP 192.168.43.124.8880 > 192.168.43.146.7771: UDP, length 120
23:48:42.353186 IP 192.168.43.146.8880 > 192.168.43.147.7772: UDP, length 120
23:48:42.377644 IP 192.168.43.124.8880 > 192.168.43.146.7771: UDP, length 120
23:48:42.403224 IP 192.168.43.146.8880 > 192.168.43.147.7772: UDP, length 120
23:48:42.425777 IP 192.168.43.124.8880 > 192.168.43.146.7771: UDP, length 120
23:48:42.453187 IP 192.168.43.146.8880 > 192.168.43.147.7772: UDP, length 120
23:48:42.477956 IP 192.168.43.124.8880 > 192.168.43.146.7771: UDP, length 120
23:48:42.503184 IP 192.168.43.146.8880 > 192.168.43.147.7772: UDP, length 120
23:48:42.526622 IP 192.168.43.124.8880 > 192.168.43.146.7771: UDP, length 120
23:48:42.553184 IP 192.168.43.146.8880 > 192.168.43.147.7772: UDP, length 120
23:48:42.582865 IP 192.168.43.124.8880 > 192.168.43.146.7771: UDP, length 120
23:48:42.603201 IP 192.168.43.146.8880 > 192.168.43.147.7772: UDP, length 120
23:48:42.626810 IP 192.168.43.124.8880 > 192.168.43.146.7771: UDP, length 120
23:48:42.653215 IP 192.168.43.146.8880 > 192.168.43.147.7772: UDP, length 120
23:48:42.673901 IP 192.168.43.124.8880 > 192.168.43.146.7771: UDP, length 120
23:48:42.703210 IP 192.168.43.146.8880 > 192.168.43.147.7772: UDP, length 120
23:48:42.722924 IP 192.168.43.124.8880 > 192.168.43.146.7771: UDP, length 120
23:48:42.753211 IP 192.168.43.146.8880 > 192.168.43.147.7772: UDP, length 120
23:48:42.776735 IP 192.168.43.124.8880 > 192.168.43.146.7771: UDP, length 120
23:48:42.803209 IP 192.168.43.146.8880 > 192.168.43.147.7772: UDP, length 120
23:48:42.828080 IP 192.168.43.124.8880 > 192.168.43.146.7771: UDP, length 120
23:48:42.853209 IP 192.168.43.146.8880 > 192.168.43.147.7772: UDP, length 120
23:48:42.876736 IP 192.168.43.124.8880 > 192.168.43.146.7771: UDP, length 120
23:48:42.903214 IP 192.168.43.146.8880 > 192.168.43.147.7772: UDP, length 120
23:48:42.927849 IP 192.168.43.124.8880 > 192.168.43.146.7771: UDP, length 120
23:48:42.953222 IP 192.168.43.146.8880 > 192.168.43.147.7772: UDP, length 120
23:48:42.987716 IP 192.168.43.124.8880 > 192.168.43.146.7771: UDP, length 120
23:48:43.003220 IP 192.168.43.146.8880 > 192.168.43.147.7772: UDP, length 120
23:48:43.021770 IP 192.168.43.124.8880 > 192.168.43.146.7771: UDP, length 120
23:48:43.053214 IP 192.168.43.146.8880 > 192.168.43.147.7772: UDP, length 120
23:48:43.076418 IP 192.168.43.124.8880 > 192.168.43.146.7771: UDP, length 120
23:48:43.103214 IP 192.168.43.146.8880 > 192.168.43.147.7772: UDP, length 120
23:48:43.126688 IP 192.168.43.124.8880 > 192.168.43.146.7771: UDP, length 120
23:48:43.153212 IP 192.168.43.146.8880 > 192.168.43.147.7772: UDP, length 120
23:48:43.176404 IP 192.168.43.124.8880 > 192.168.43.146.7771: UDP, length 120
23:48:43.203209 IP 192.168.43.146.8880 > 192.168.43.147.7772: UDP, length 120
23:48:43.227146 IP 192.168.43.124.8880 > 192.168.43.146.7771: UDP, length 120
23:48:43.253269 IP 192.168.43.146.8880 > 192.168.43.147.7772: UDP, length 120
23:48:43.276673 IP 192.168.43.124.8880 > 192.168.43.146.7771: UDP, length 120
23:48:43.303227 IP 192.168.43.146.8880 > 192.168.43.147.7772: UDP, length 120
23:48:43.326724 IP 192.168.43.124.8880 > 192.168.43.146.7771: UDP, length 120
23:48:43.353222 IP 192.168.43.146.8880 > 192.168.43.147.7772: UDP, length 120
23:48:43.376446 IP 192.168.43.124.8880 > 192.168.43.146.7771: UDP, length 120
23:48:43.403212 IP 192.168.43.146.8880 > 192.168.43.147.7772: UDP, length 120
23:48:43.429197 IP 192.168.43.124.8880 > 192.168.43.146.7771: UDP, length 120
23:48:43.453214 IP 192.168.43.146.8880 > 192.168.43.147.7772: UDP, length 120
23:48:43.478594 IP 192.168.43.124.8880 > 192.168.43.146.7771: UDP, length 120
23:48:43.503213 IP 192.168.43.146.8880 > 192.168.43.147.7772: UDP, length 120
23:48:43.527124 IP 192.168.43.124.8880 > 192.168.43.146.7771: UDP, length 120
23:48:43.553215 IP 192.168.43.146.8880 > 192.168.43.147.7772: UDP, length 120
23:48:43.580109 IP 192.168.43.124.8880 > 192.168.43.146.7771: UDP, length 120
23:48:43.603233 IP 192.168.43.146.8880 > 192.168.43.147.7772: UDP, length 120
23:48:43.627248 IP 192.168.43.124.8880 > 192.168.43.146.7771: UDP, length 120
23:48:43.653221 IP 192.168.43.146.8880 > 192.168.43.147.7772: UDP, length 120
23:48:43.693489 IP 192.168.43.124.8880 > 192.168.43.146.7771: UDP, length 120
23:48:43.703215 IP 192.168.43.146.8880 > 192.168.43.147.7772: UDP, length 120
23:48:43.726569 IP 192.168.43.124.8880 > 192.168.43.146.7771: UDP, length 120
23:48:43.753214 IP 192.168.43.146.8880 > 192.168.43.147.7772: UDP, length 120
23:48:43.783989 IP 192.168.43.124.8880 > 192.168.43.146.7771: UDP, length 120
23:48:43.803211 IP 192.168.43.146.8880 > 192.168.43.147.7772: UDP, length 120
23:48:43.826609 IP 192.168.43.124.8880 > 192.168.43.146.7771: UDP, length 120
23:48:43.853212 IP 192.168.43.146.8880 > 192.168.43.147.7772: UDP, length 120
23:48:43.886368 IP 192.168.43.124.8880 > 192.168.43.146.7771: UDP, length 120
23:48:43.903260 IP 192.168.43.146.8880 > 192.168.43.147.7772: UDP, length 120
23:48:43.928044 IP 192.168.43.124.8880 > 192.168.43.146.7771: UDP, length 120
23:48:43.953221 IP 192.168.43.146.8880 > 192.168.43.147.7772: UDP, length 120
23:48:43.976618 IP 192.168.43.124.8880 > 192.168.43.146.7771: UDP, length 120
23:48:44.003219 IP 192.168.43.146.8880 > 192.168.43.147.7772: UDP, length 120
23:48:44.026562 IP 192.168.43.124.8880 > 192.168.43.146.7771: UDP, length 120
23:48:44.053224 IP 192.168.43.146.8880 > 192.168.43.147.7772: UDP, length 120
23:48:44.076770 IP 192.168.43.124.8880 > 192.168.43.146.7771: UDP, length 120
23:48:44.103211 IP 192.168.43.146.8880 > 192.168.43.147.7772: UDP, length 120
23:48:44.126631 IP 192.168.43.124.8880 > 192.168.43.146.7771: UDP, length 120
23:48:44.153212 IP 192.168.43.146.8880 > 192.168.43.147.7772: UDP, length 120
23:48:44.178729 IP 192.168.43.124.8880 > 192.168.43.146.7771: UDP, length 120
23:48:44.203218 IP 192.168.43.146.8880 > 192.168.43.147.7772: UDP, length 120
23:48:44.223435 IP 192.168.43.124.8880 > 192.168.43.146.7771: UDP, length 120
23:48:44.253216 IP 192.168.43.146.8880 > 192.168.43.147.7772: UDP, length 120
23:48:44.279127 IP 192.168.43.124.8880 > 192.168.43.146.7771: UDP, length 120
23:48:44.303211 IP 192.168.43.146.8880 > 192.168.43.147.7772: UDP, length 120
23:48:44.326560 IP 192.168.43.124.8880 > 192.168.43.146.7771: UDP, length 120
23:48:44.353216 IP 192.168.43.146.8880 > 192.168.43.147.7772: UDP, length 120
23:48:44.376511 IP 192.168.43.124.8880 > 192.168.43.146.7771: UDP, length 120
23:48:44.403241 IP 192.168.43.146.8880 > 192.168.43.147.7772: UDP, length 120
23:48:44.426715 IP 192.168.43.124.8880 > 192.168.43.146.7771: UDP, length 120
23:48:44.453230 IP 192.168.43.146.8880 > 192.168.43.147.7772: UDP, length 120
23:48:44.477461 IP 192.168.43.124.8880 > 192.168.43.146.7771: UDP, length 120
23:48:44.503214 IP 192.168.43.146.8880 > 192.168.43.147.7772: UDP, length 120
23:48:44.528070 IP 192.168.43.124.8880 > 192.168.43.146.7771: UDP, length 120
23:48:44.553220 IP 192.168.43.146.8880 > 192.168.43.147.7772: UDP, length 120
23:48:44.576492 IP 192.168.43.124.8880 > 192.168.43.146.7771: UDP, length 120
23:48:44.603236 IP 192.168.43.146.8880 > 192.168.43.147.7772: UDP, length 120
23:48:44.628082 IP 192.168.43.124.8880 > 192.168.43.146.7771: UDP, length 120
23:48:44.653223 IP 192.168.43.146.8880 > 192.168.43.147.7772: UDP, length 120
23:48:44.676567 IP 192.168.43.124.8880 > 192.168.43.146.7771: UDP, length 120
23:48:44.703210 IP 192.168.43.146.8880 > 192.168.43.147.7772: UDP, length 120
23:48:44.726547 IP 192.168.43.124.8880 > 192.168.43.146.7771: UDP, length 120
23:48:44.753214 IP 192.168.43.146.8880 > 192.168.43.147.7772: UDP, length 120
23:48:44.777730 IP 192.168.43.124.8880 > 192.168.43.146.7771: UDP, length 120
23:48:44.803218 IP 192.168.43.146.8880 > 192.168.43.147.7772: UDP, length 120
23:48:44.830279 IP 192.168.43.124.8880 > 192.168.43.146.7771: UDP, length 120
23:48:44.853214 IP 192.168.43.146.8880 > 192.168.43.147.7772: UDP, length 120
23:48:44.876058 IP 192.168.43.124.8880 > 192.168.43.146.7771: UDP, length 120
23:48:44.903212 IP 192.168.43.146.8880 > 192.168.43.147.7772: UDP, length 120
23:48:44.926514 IP 192.168.43.124.8880 > 192.168.43.146.7771: UDP, length 120
23:48:44.953213 IP 192.168.43.146.8880 > 192.168.43.147.7772: UDP, length 120
23:48:44.977627 IP 192.168.43.124.8880 > 192.168.43.146.7771: UDP, length 120
23:48:45.003210 IP 192.168.43.146.8880 > 192.168.43.147.7772: UDP, length 120
23:48:45.053226 IP 192.168.43.146.8880 > 192.168.43.147.7772: UDP, length 120
23:48:45.103216 IP 192.168.43.146.8880 > 192.168.43.147.7772: UDP, length 120
23:48:45.153283 IP 192.168.43.146.8880 > 192.168.43.147.7772: UDP, length 120
23:48:45.156775 IP 192.168.43.124.8880 > 192.168.43.146.7771: UDP, length 120
23:48:45.156926 IP 192.168.43.124.8880 > 192.168.43.146.7771: UDP, length 120
23:48:45.157036 IP 192.168.43.124.8880 > 192.168.43.146.7771: UDP, length 120
23:48:45.176734 IP 192.168.43.124.8880 > 192.168.43.146.7771: UDP, length 120
23:48:45.203296 IP 192.168.43.146.8880 > 192.168.43.147.7772: UDP, length 120
23:48:45.226772 IP 192.168.43.124.8880 > 192.168.43.146.7771: UDP, length 120
23:48:45.253314 IP 192.168.43.146.8880 > 192.168.43.147.7772: UDP, length 120
23:48:45.278379 IP 192.168.43.124.8880 > 192.168.43.146.7771: UDP, length 120
23:48:45.303282 IP 192.168.43.146.8880 > 192.168.43.147.7772: UDP, length 120
23:48:45.328981 IP 192.168.43.124.8880 > 192.168.43.146.7771: UDP, length 120
23:48:45.353293 IP 192.168.43.146.8880 > 192.168.43.147.7772: UDP, length 120
23:48:45.403252 IP 192.168.43.146.8880 > 192.168.43.147.7772: UDP, length 120
23:48:45.453275 IP 192.168.43.146.8880 > 192.168.43.147.7772: UDP, length 120
23:48:45.503186 IP 192.168.43.124.8880 > 192.168.43.146.7771: UDP, length 120
23:48:45.503397 IP 192.168.43.124.8880 > 192.168.43.146.7771: UDP, length 120
23:48:45.503471 IP 192.168.43.124.8880 > 192.168.43.146.7771: UDP, length 120
23:48:45.503509 IP 192.168.43.146.8880 > 192.168.43.147.7772: UDP, length 120
23:48:45.537063 IP 192.168.43.124.8880 > 192.168.43.146.7771: UDP, length 120
23:48:45.553270 IP 192.168.43.146.8880 > 192.168.43.147.7772: UDP, length 120
23:48:45.576144 IP 192.168.43.124.8880 > 192.168.43.146.7771: UDP, length 120
23:48:45.603244 IP 192.168.43.146.8880 > 192.168.43.147.7772: UDP, length 120
23:48:45.628676 IP 192.168.43.124.8880 > 192.168.43.146.7771: UDP, length 120
23:48:45.653200 IP 192.168.43.146.8880 > 192.168.43.147.7772: UDP, length 120
23:48:45.676965 IP 192.168.43.124.8880 > 192.168.43.146.7771: UDP, length 120
23:48:45.703186 IP 192.168.43.146.8880 > 192.168.43.147.7772: UDP, length 120
23:48:45.753185 IP 192.168.43.146.8880 > 192.168.43.147.7772: UDP, length 120
23:48:45.803179 IP 192.168.43.146.8880 > 192.168.43.147.7772: UDP, length 120
23:48:45.845331 IP 192.168.43.124.8880 > 192.168.43.146.7771: UDP, length 120
23:48:45.845519 IP 192.168.43.124.8880 > 192.168.43.146.7771: UDP, length 120
23:48:45.845636 IP 192.168.43.124.8880 > 192.168.43.146.7771: UDP, length 120
23:48:45.853186 IP 192.168.43.146.8880 > 192.168.43.147.7772: UDP, length 120
23:48:45.876248 IP 192.168.43.124.8880 > 192.168.43.146.7771: UDP, length 120
23:48:45.903183 IP 192.168.43.146.8880 > 192.168.43.147.7772: UDP, length 120
23:48:45.933803 IP 192.168.43.124.8880 > 192.168.43.146.7771: UDP, length 120
23:48:45.953183 IP 192.168.43.146.8880 > 192.168.43.147.7772: UDP, length 120
23:48:45.976284 IP 192.168.43.124.8880 > 192.168.43.146.7771: UDP, length 120
23:48:46.003182 IP 192.168.43.146.8880 > 192.168.43.147.7772: UDP, length 120
23:48:46.026260 IP 192.168.43.124.8880 > 192.168.43.146.7771: UDP, length 120
23:48:46.053183 IP 192.168.43.146.8880 > 192.168.43.147.7772: UDP, length 120
23:48:46.103185 IP 192.168.43.146.8880 > 192.168.43.147.7772: UDP, length 120
23:48:46.153186 IP 192.168.43.146.8880 > 192.168.43.147.7772: UDP, length 120
23:48:46.200802 IP 192.168.43.124.8880 > 192.168.43.146.7771: UDP, length 120
23:48:46.201010 IP 192.168.43.124.8880 > 192.168.43.146.7771: UDP, length 120
23:48:46.201133 IP 192.168.43.124.8880 > 192.168.43.146.7771: UDP, length 120
23:48:46.203189 IP 192.168.43.146.8880 > 192.168.43.147.7772: UDP, length 120
23:48:46.226660 IP 192.168.43.124.8880 > 192.168.43.146.7771: UDP, length 120
23:48:46.253184 IP 192.168.43.146.8880 > 192.168.43.147.7772: UDP, length 120
23:48:46.276238 IP 192.168.43.124.8880 > 192.168.43.146.7771: UDP, length 120
23:48:46.303185 IP 192.168.43.146.8880 > 192.168.43.147.7772: UDP, length 120
23:48:46.326915 IP 192.168.43.124.8880 > 192.168.43.146.7771: UDP, length 120
23:48:46.353254 IP 192.168.43.146.8880 > 192.168.43.147.7772: UDP, length 120
23:48:46.375598 IP 192.168.43.124.8880 > 192.168.43.146.7771: UDP, length 120
23:48:46.403229 IP 192.168.43.146.8880 > 192.168.43.147.7772: UDP, length 120
23:48:46.453189 IP 192.168.43.146.8880 > 192.168.43.147.7772: UDP, length 120
23:48:46.503181 IP 192.168.43.146.8880 > 192.168.43.147.7772: UDP, length 120
23:48:46.553188 IP 192.168.43.146.8880 > 192.168.43.147.7772: UDP, length 120
23:48:46.567638 IP 192.168.43.124.8880 > 192.168.43.146.7771: UDP, length 120
23:48:46.567804 IP 192.168.43.124.8880 > 192.168.43.146.7771: UDP, length 120
23:48:46.567876 IP 192.168.43.124.8880 > 192.168.43.146.7771: UDP, length 120
23:48:46.573353 IP 192.168.43.124.8880 > 192.168.43.146.7771: UDP, length 120
23:48:46.603203 IP 192.168.43.146.8880 > 192.168.43.147.7772: UDP, length 120
23:48:46.623156 IP 192.168.43.124.8880 > 192.168.43.146.7771: UDP, length 120
23:48:46.653191 IP 192.168.43.146.8880 > 192.168.43.147.7772: UDP, length 120
23:48:46.677683 IP 192.168.43.124.8880 > 192.168.43.146.7771: UDP, length 120
23:48:46.703198 IP 192.168.43.146.8880 > 192.168.43.147.7772: UDP, length 120
23:48:46.722840 IP 192.168.43.124.8880 > 192.168.43.146.7771: UDP, length 120
23:48:46.753191 IP 192.168.43.146.8880 > 192.168.43.147.7772: UDP, length 120
23:48:46.803181 IP 192.168.43.146.8880 > 192.168.43.147.7772: UDP, length 120
23:48:46.853186 IP 192.168.43.146.8880 > 192.168.43.147.7772: UDP, length 120
23:48:46.888896 IP 192.168.43.124.8880 > 192.168.43.146.7771: UDP, length 120
23:48:46.889011 IP 192.168.43.124.8880 > 192.168.43.146.7771: UDP, length 120
23:48:46.889082 IP 192.168.43.124.8880 > 192.168.43.146.7771: UDP, length 120
23:48:46.903221 IP 192.168.43.146.8880 > 192.168.43.147.7772: UDP, length 120
23:48:46.926095 IP 192.168.43.124.8880 > 192.168.43.146.7771: UDP, length 120
23:48:46.953190 IP 192.168.43.146.8880 > 192.168.43.147.7772: UDP, length 120
23:48:46.977244 IP 192.168.43.124.8880 > 192.168.43.146.7771: UDP, length 120
23:48:47.003185 IP 192.168.43.146.8880 > 192.168.43.147.7772: UDP, length 120
23:48:47.026122 IP 192.168.43.124.8880 > 192.168.43.146.7771: UDP, length 120
23:48:47.053186 IP 192.168.43.146.8880 > 192.168.43.147.7772: UDP, length 120
23:48:47.076114 IP 192.168.43.124.8880 > 192.168.43.146.7771: UDP, length 120
23:48:47.103194 IP 192.168.43.146.8880 > 192.168.43.147.7772: UDP, length 120
23:48:47.153186 IP 192.168.43.146.8880 > 192.168.43.147.7772: UDP, length 120
23:48:47.203188 IP 192.168.43.146.8880 > 192.168.43.147.7772: UDP, length 120
23:48:47.236811 IP 192.168.43.124.8880 > 192.168.43.146.7771: UDP, length 120
23:48:47.236900 IP 192.168.43.124.8880 > 192.168.43.146.7771: UDP, length 120
23:48:47.236971 IP 192.168.43.124.8880 > 192.168.43.146.7771: UDP, length 120
23:48:47.253189 IP 192.168.43.146.8880 > 192.168.43.147.7772: UDP, length 120
23:48:47.276086 IP 192.168.43.124.8880 > 192.168.43.146.7771: UDP, length 120
23:48:47.303187 IP 192.168.43.146.8880 > 192.168.43.147.7772: UDP, length 120
23:48:47.326056 IP 192.168.43.124.8880 > 192.168.43.146.7771: UDP, length 120
23:48:47.353188 IP 192.168.43.146.8880 > 192.168.43.147.7772: UDP, length 120
23:48:47.376215 IP 192.168.43.124.8880 > 192.168.43.146.7771: UDP, length 120
23:48:47.403226 IP 192.168.43.146.8880 > 192.168.43.147.7772: UDP, length 120
23:48:47.426481 IP 192.168.43.124.8880 > 192.168.43.146.7771: UDP, length 120
23:48:47.453192 IP 192.168.43.146.8880 > 192.168.43.147.7772: UDP, length 120
23:48:47.503188 IP 192.168.43.146.8880 > 192.168.43.147.7772: UDP, length 120
23:48:47.553186 IP 192.168.43.146.8880 > 192.168.43.147.7772: UDP, length 120
23:48:47.599347 IP 192.168.43.124.8880 > 192.168.43.146.7771: UDP, length 120
23:48:47.599438 IP 192.168.43.124.8880 > 192.168.43.146.7771: UDP, length 120
23:48:47.599507 IP 192.168.43.124.8880 > 192.168.43.146.7771: UDP, length 120
23:48:47.603198 IP 192.168.43.146.8880 > 192.168.43.147.7772: UDP, length 120
23:48:47.622590 IP 192.168.43.124.8880 > 192.168.43.146.7771: UDP, length 120
23:48:47.653219 IP 192.168.43.146.8880 > 192.168.43.147.7772: UDP, length 120
23:48:47.676611 IP 192.168.43.124.8880 > 192.168.43.146.7771: UDP, length 120
23:48:47.703211 IP 192.168.43.146.8880 > 192.168.43.147.7772: UDP, length 120
23:48:47.726938 IP 192.168.43.124.8880 > 192.168.43.146.7771: UDP, length 120
23:48:47.753215 IP 192.168.43.146.8880 > 192.168.43.147.7772: UDP, length 120
23:48:47.777474 IP 192.168.43.124.8880 > 192.168.43.146.7771: UDP, length 120
23:48:47.803212 IP 192.168.43.146.8880 > 192.168.43.147.7772: UDP, length 120
23:48:47.853211 IP 192.168.43.146.8880 > 192.168.43.147.7772: UDP, length 120
23:48:47.903207 IP 192.168.43.146.8880 > 192.168.43.147.7772: UDP, length 120
23:48:47.936965 IP 192.168.43.124.8880 > 192.168.43.146.7771: UDP, length 120
23:48:47.937085 IP 192.168.43.124.8880 > 192.168.43.146.7771: UDP, length 120
23:48:47.937196 IP 192.168.43.124.8880 > 192.168.43.146.7771: UDP, length 120
23:48:47.953227 IP 192.168.43.146.8880 > 192.168.43.147.7772: UDP, length 120
23:48:47.982056 IP 192.168.43.124.8880 > 192.168.43.146.7771: UDP, length 120
23:48:48.003213 IP 192.168.43.146.8880 > 192.168.43.147.7772: UDP, length 120
23:48:48.026049 IP 192.168.43.124.8880 > 192.168.43.146.7771: UDP, length 120
23:48:48.053216 IP 192.168.43.146.8880 > 192.168.43.147.7772: UDP, length 120
23:48:48.084006 IP 192.168.43.124.8880 > 192.168.43.146.7771: UDP, length 120
23:48:48.103214 IP 192.168.43.146.8880 > 192.168.43.147.7772: UDP, length 120
23:48:48.121146 IP 192.168.43.124.8880 > 192.168.43.146.7771: UDP, length 120
23:48:48.153215 IP 192.168.43.146.8880 > 192.168.43.147.7772: UDP, length 120
23:48:48.203215 IP 192.168.43.146.8880 > 192.168.43.147.7772: UDP, length 120
23:48:48.253213 IP 192.168.43.146.8880 > 192.168.43.147.7772: UDP, length 120
23:48:48.288524 IP 192.168.43.124.8880 > 192.168.43.146.7771: UDP, length 120
23:48:48.288658 IP 192.168.43.124.8880 > 192.168.43.146.7771: UDP, length 120
23:48:48.288771 IP 192.168.43.124.8880 > 192.168.43.146.7771: UDP, length 120
23:48:48.303217 IP 192.168.43.146.8880 > 192.168.43.147.7772: UDP, length 120
23:48:48.325843 IP 192.168.43.124.8880 > 192.168.43.146.7771: UDP, length 120
23:48:48.353214 IP 192.168.43.146.8880 > 192.168.43.147.7772: UDP, length 120
23:48:48.377107 IP 192.168.43.124.8880 > 192.168.43.146.7771: UDP, length 120
23:48:48.403278 IP 192.168.43.146.8880 > 192.168.43.147.7772: UDP, length 120
23:48:48.425970 IP 192.168.43.124.8880 > 192.168.43.146.7771: UDP, length 120
23:48:48.453226 IP 192.168.43.146.8880 > 192.168.43.147.7772: UDP, length 120
23:48:48.477162 IP 192.168.43.124.8880 > 192.168.43.146.7771: UDP, length 120
23:48:48.503215 IP 192.168.43.146.8880 > 192.168.43.147.7772: UDP, length 120
