03:45:03.454942 IP 192.168.43.124.8880 > 192.168.43.195.7771: UDP, length 120
03:45:03.495092 IP 192.168.43.124.8880 > 192.168.43.195.7771: UDP, length 120
03:45:03.545138 IP 192.168.43.124.8880 > 192.168.43.195.7771: UDP, length 120
03:45:03.595895 IP 192.168.43.124.8880 > 192.168.43.195.7771: UDP, length 120
03:45:03.644985 IP 192.168.43.124.8880 > 192.168.43.195.7771: UDP, length 120
03:45:03.697471 IP 192.168.43.124.8880 > 192.168.43.195.7771: UDP, length 120
03:45:03.745160 IP 192.168.43.124.8880 > 192.168.43.195.7771: UDP, length 120
03:45:03.795962 IP 192.168.43.124.8880 > 192.168.43.195.7771: UDP, length 120
03:45:03.842940 IP 192.168.43.124.8880 > 192.168.43.195.7771: UDP, length 120
03:45:03.897522 IP 192.168.43.124.8880 > 192.168.43.195.7771: UDP, length 120
03:45:03.944322 IP 192.168.43.124.8880 > 192.168.43.195.7771: UDP, length 120
03:45:03.995805 IP 192.168.43.124.8880 > 192.168.43.195.7771: UDP, length 120
03:45:04.046948 IP 192.168.43.124.8880 > 192.168.43.195.7771: UDP, length 120
03:45:04.245413 IP 192.168.43.124.8880 > 192.168.43.195.7771: UDP, length 120
03:45:04.245777 IP 192.168.43.124.8880 > 192.168.43.195.7771: UDP, length 120
03:45:04.345483 IP 192.168.43.124.8880 > 192.168.43.195.7771: UDP, length 120
03:45:04.345729 IP 192.168.43.124.8880 > 192.168.43.195.7771: UDP, length 120
03:45:04.446011 IP 192.168.43.124.8880 > 192.168.43.195.7771: UDP, length 120
03:45:04.446428 IP 192.168.43.124.8880 > 192.168.43.195.7771: UDP, length 120
03:45:04.465401 IP 192.168.43.195.8880 > 192.168.43.124.7772: UDP, length 120
03:45:04.515442 IP 192.168.43.195.8880 > 192.168.43.124.7772: UDP, length 120
03:45:04.545357 IP 192.168.43.124.8880 > 192.168.43.195.7771: UDP, length 120
03:45:04.545717 IP 192.168.43.124.8880 > 192.168.43.195.7771: UDP, length 120
03:45:04.565428 IP 192.168.43.195.8880 > 192.168.43.124.7772: UDP, length 120
03:45:04.615420 IP 192.168.43.195.8880 > 192.168.43.124.7772: UDP, length 120
03:45:04.655423 IP 192.168.43.124.8880 > 192.168.43.195.7771: UDP, length 120
03:45:04.655712 IP 192.168.43.124.8880 > 192.168.43.195.7771: UDP, length 120
03:45:04.655931 IP 192.168.43.124.8880 > 192.168.43.195.7771: UDP, length 120
03:45:04.665438 IP 192.168.43.195.8880 > 192.168.43.124.7772: UDP, length 120
03:45:04.715419 IP 192.168.43.195.8880 > 192.168.43.124.7772: UDP, length 120
03:45:04.765418 IP 192.168.43.195.8880 > 192.168.43.124.7772: UDP, length 120
03:45:04.795462 IP 192.168.43.124.8880 > 192.168.43.195.7771: UDP, length 120
03:45:04.795733 IP 192.168.43.124.8880 > 192.168.43.195.7771: UDP, length 120
03:45:04.815423 IP 192.168.43.195.8880 > 192.168.43.124.7772: UDP, length 120
03:45:04.865417 IP 192.168.43.195.8880 > 192.168.43.124.7772: UDP, length 120
03:45:04.913059 IP 192.168.43.124.8880 > 192.168.43.195.7771: UDP, length 120
03:45:04.913314 IP 192.168.43.124.8880 > 192.168.43.195.7771: UDP, length 120
03:45:04.913553 IP 192.168.43.124.8880 > 192.168.43.195.7771: UDP, length 120
03:45:04.915423 IP 192.168.43.195.8880 > 192.168.43.124.7772: UDP, length 120
03:45:04.965427 IP 192.168.43.195.8880 > 192.168.43.124.7772: UDP, length 120
03:45:05.015418 IP 192.168.43.195.8880 > 192.168.43.124.7772: UDP, length 120
03:45:05.062706 IP 192.168.43.124.8880 > 192.168.43.195.7771: UDP, length 120
03:45:05.062980 IP 192.168.43.124.8880 > 192.168.43.195.7771: UDP, length 120
03:45:05.063209 IP 192.168.43.124.8880 > 192.168.43.195.7771: UDP, length 120
03:45:05.065420 IP 192.168.43.195.8880 > 192.168.43.124.7772: UDP, length 120
03:45:05.115432 IP 192.168.43.195.8880 > 192.168.43.124.7772: UDP, length 120
03:45:05.165423 IP 192.168.43.195.8880 > 192.168.43.124.7772: UDP, length 120
03:45:05.205282 IP 192.168.43.124.8880 > 192.168.43.195.7771: UDP, length 120
03:45:05.205554 IP 192.168.43.124.8880 > 192.168.43.195.7771: UDP, length 120
03:45:05.215423 IP 192.168.43.195.8880 > 192.168.43.124.7772: UDP, length 120
03:45:05.265423 IP 192.168.43.195.8880 > 192.168.43.124.7772: UDP, length 120
03:45:05.298973 IP 192.168.43.124.8880 > 192.168.43.195.7771: UDP, length 120
03:45:05.299208 IP 192.168.43.124.8880 > 192.168.43.195.7771: UDP, length 120
03:45:05.299417 IP 192.168.43.124.8880 > 192.168.43.195.7771: UDP, length 120
03:45:05.315425 IP 192.168.43.195.8880 > 192.168.43.124.7772: UDP, length 120
03:45:05.365420 IP 192.168.43.195.8880 > 192.168.43.124.7772: UDP, length 120
03:45:05.415420 IP 192.168.43.195.8880 > 192.168.43.124.7772: UDP, length 120
03:45:05.454350 IP 192.168.43.124.8880 > 192.168.43.195.7771: UDP, length 120
03:45:05.454605 IP 192.168.43.124.8880 > 192.168.43.195.7771: UDP, length 120
03:45:05.454814 IP 192.168.43.124.8880 > 192.168.43.195.7771: UDP, length 120
03:45:05.465427 IP 192.168.43.195.8880 > 192.168.43.124.7772: UDP, length 120
03:45:05.515420 IP 192.168.43.195.8880 > 192.168.43.124.7772: UDP, length 120
03:45:05.565419 IP 192.168.43.195.8880 > 192.168.43.124.7772: UDP, length 120
03:45:05.601849 IP 192.168.43.124.8880 > 192.168.43.195.7771: UDP, length 120
03:45:05.602184 IP 192.168.43.124.8880 > 192.168.43.195.7771: UDP, length 120
03:45:05.602393 IP 192.168.43.124.8880 > 192.168.43.195.7771: UDP, length 120
03:45:05.615458 IP 192.168.43.195.8880 > 192.168.43.124.7772: UDP, length 120
03:45:05.665423 IP 192.168.43.195.8880 > 192.168.43.124.7772: UDP, length 120
03:45:05.715431 IP 192.168.43.195.8880 > 192.168.43.124.7772: UDP, length 120
03:45:05.765443 IP 192.168.43.195.8880 > 192.168.43.124.7772: UDP, length 120
03:45:05.765523 IP 192.168.43.124.8880 > 192.168.43.195.7771: UDP, length 120
03:45:05.765807 IP 192.168.43.124.8880 > 192.168.43.195.7771: UDP, length 120
03:45:05.766031 IP 192.168.43.124.8880 > 192.168.43.195.7771: UDP, length 120
03:45:05.815426 IP 192.168.43.195.8880 > 192.168.43.124.7772: UDP, length 120
03:45:05.865418 IP 192.168.43.195.8880 > 192.168.43.124.7772: UDP, length 120
03:45:05.908524 IP 192.168.43.124.8880 > 192.168.43.195.7771: UDP, length 120
03:45:05.908757 IP 192.168.43.124.8880 > 192.168.43.195.7771: UDP, length 120
03:45:05.908977 IP 192.168.43.124.8880 > 192.168.43.195.7771: UDP, length 120
03:45:05.915440 IP 192.168.43.195.8880 > 192.168.43.124.7772: UDP, length 120
03:45:05.965426 IP 192.168.43.195.8880 > 192.168.43.124.7772: UDP, length 120
03:45:06.015420 IP 192.168.43.195.8880 > 192.168.43.124.7772: UDP, length 120
03:45:06.044680 IP 192.168.43.124.8880 > 192.168.43.195.7771: UDP, length 120
03:45:06.044941 IP 192.168.43.124.8880 > 192.168.43.195.7771: UDP, length 120
03:45:06.065424 IP 192.168.43.195.8880 > 192.168.43.124.7772: UDP, length 120
03:45:06.115421 IP 192.168.43.195.8880 > 192.168.43.124.7772: UDP, length 120
03:45:06.144292 IP 192.168.43.124.8880 > 192.168.43.195.7771: UDP, length 120
03:45:06.144557 IP 192.168.43.124.8880 > 192.168.43.195.7771: UDP, length 120
03:45:06.165433 IP 192.168.43.195.8880 > 192.168.43.124.7772: UDP, length 120
03:45:06.215419 IP 192.168.43.195.8880 > 192.168.43.124.7772: UDP, length 120
03:45:06.257198 IP 192.168.43.124.8880 > 192.168.43.195.7771: UDP, length 120
03:45:06.257459 IP 192.168.43.124.8880 > 192.168.43.195.7771: UDP, length 120
03:45:06.257751 IP 192.168.43.124.8880 > 192.168.43.195.7771: UDP, length 120
03:45:06.265425 IP 192.168.43.195.8880 > 192.168.43.124.7772: UDP, length 120
03:45:06.315418 IP 192.168.43.195.8880 > 192.168.43.124.7772: UDP, length 120
03:45:06.365417 IP 192.168.43.195.8880 > 192.168.43.124.7772: UDP, length 120
03:45:06.393824 IP 192.168.43.124.8880 > 192.168.43.195.7771: UDP, length 120
03:45:06.394051 IP 192.168.43.124.8880 > 192.168.43.195.7771: UDP, length 120
03:45:06.415422 IP 192.168.43.195.8880 > 192.168.43.124.7772: UDP, length 120
03:45:06.465422 IP 192.168.43.195.8880 > 192.168.43.124.7772: UDP, length 120
03:45:06.493503 IP 192.168.43.124.8880 > 192.168.43.195.7771: UDP, length 120
03:45:06.493729 IP 192.168.43.124.8880 > 192.168.43.195.7771: UDP, length 120
03:45:06.515423 IP 192.168.43.195.8880 > 192.168.43.124.7772: UDP, length 120
03:45:06.565421 IP 192.168.43.195.8880 > 192.168.43.124.7772: UDP, length 120
03:45:06.607033 IP 192.168.43.124.8880 > 192.168.43.195.7771: UDP, length 120
03:45:06.607276 IP 192.168.43.124.8880 > 192.168.43.195.7771: UDP, length 120
03:45:06.607484 IP 192.168.43.124.8880 > 192.168.43.195.7771: UDP, length 120
03:45:06.615421 IP 192.168.43.195.8880 > 192.168.43.124.7772: UDP, length 120
03:45:06.665420 IP 192.168.43.195.8880 > 192.168.43.124.7772: UDP, length 120
03:45:06.715418 IP 192.168.43.195.8880 > 192.168.43.124.7772: UDP, length 120
03:45:06.741720 IP 192.168.43.124.8880 > 192.168.43.195.7771: UDP, length 120
03:45:06.741968 IP 192.168.43.124.8880 > 192.168.43.195.7771: UDP, length 120
03:45:06.765424 IP 192.168.43.195.8880 > 192.168.43.124.7772: UDP, length 120
03:45:06.815420 IP 192.168.43.195.8880 > 192.168.43.124.7772: UDP, length 120
03:45:06.841519 IP 192.168.43.124.8880 > 192.168.43.195.7771: UDP, length 120
03:45:06.841762 IP 192.168.43.124.8880 > 192.168.43.195.7771: UDP, length 120
03:45:06.865423 IP 192.168.43.195.8880 > 192.168.43.124.7772: UDP, length 120
03:45:06.915418 IP 192.168.43.195.8880 > 192.168.43.124.7772: UDP, length 120
03:45:06.965425 IP 192.168.43.195.8880 > 192.168.43.124.7772: UDP, length 120
03:45:06.968868 IP 192.168.43.124.8880 > 192.168.43.195.7771: UDP, length 120
03:45:06.969143 IP 192.168.43.124.8880 > 192.168.43.195.7771: UDP, length 120
03:45:06.969353 IP 192.168.43.124.8880 > 192.168.43.195.7771: UDP, length 120
03:45:07.015424 IP 192.168.43.195.8880 > 192.168.43.124.7772: UDP, length 120
03:45:07.065420 IP 192.168.43.195.8880 > 192.168.43.124.7772: UDP, length 120
03:45:07.092610 IP 192.168.43.124.8880 > 192.168.43.195.7771: UDP, length 120
03:45:07.092935 IP 192.168.43.124.8880 > 192.168.43.195.7771: UDP, length 120
03:45:07.115455 IP 192.168.43.195.8880 > 192.168.43.124.7772: UDP, length 120
03:45:07.165424 IP 192.168.43.195.8880 > 192.168.43.124.7772: UDP, length 120
03:45:07.195055 IP 192.168.43.124.8880 > 192.168.43.195.7771: UDP, length 120
03:45:07.195332 IP 192.168.43.124.8880 > 192.168.43.195.7771: UDP, length 120
03:45:07.215427 IP 192.168.43.195.8880 > 192.168.43.124.7772: UDP, length 120
03:45:07.265426 IP 192.168.43.195.8880 > 192.168.43.124.7772: UDP, length 120
03:45:07.304207 IP 192.168.43.124.8880 > 192.168.43.195.7771: UDP, length 120
03:45:07.304478 IP 192.168.43.124.8880 > 192.168.43.195.7771: UDP, length 120
03:45:07.304713 IP 192.168.43.124.8880 > 192.168.43.195.7771: UDP, length 120
03:45:07.315428 IP 192.168.43.195.8880 > 192.168.43.124.7772: UDP, length 120
03:45:07.344366 IP 192.168.43.124.8880 > 192.168.43.195.7771: UDP, length 120
03:45:07.365426 IP 192.168.43.195.8880 > 192.168.43.124.7772: UDP, length 120
03:45:07.395106 IP 192.168.43.124.8880 > 192.168.43.195.7771: UDP, length 120
03:45:07.415423 IP 192.168.43.195.8880 > 192.168.43.124.7772: UDP, length 120
03:45:07.444509 IP 192.168.43.124.8880 > 192.168.43.195.7771: UDP, length 120
03:45:07.465427 IP 192.168.43.195.8880 > 192.168.43.124.7772: UDP, length 120
03:45:07.495126 IP 192.168.43.124.8880 > 192.168.43.195.7771: UDP, length 120
03:45:07.515423 IP 192.168.43.195.8880 > 192.168.43.124.7772: UDP, length 120
03:45:07.561235 IP 192.168.43.124.8880 > 192.168.43.195.7771: UDP, length 120
03:45:07.565421 IP 192.168.43.195.8880 > 192.168.43.124.7772: UDP, length 120
03:45:07.595200 IP 192.168.43.124.8880 > 192.168.43.195.7771: UDP, length 120
03:45:07.615421 IP 192.168.43.195.8880 > 192.168.43.124.7772: UDP, length 120
03:45:07.644772 IP 192.168.43.124.8880 > 192.168.43.195.7771: UDP, length 120
03:45:07.665424 IP 192.168.43.195.8880 > 192.168.43.124.7772: UDP, length 120
03:45:07.695209 IP 192.168.43.124.8880 > 192.168.43.195.7771: UDP, length 120
03:45:07.715422 IP 192.168.43.195.8880 > 192.168.43.124.7772: UDP, length 120
03:45:07.755173 IP 192.168.43.124.8880 > 192.168.43.195.7771: UDP, length 120
03:45:07.765427 IP 192.168.43.195.8880 > 192.168.43.124.7772: UDP, length 120
03:45:07.795302 IP 192.168.43.124.8880 > 192.168.43.195.7771: UDP, length 120
03:45:07.815425 IP 192.168.43.195.8880 > 192.168.43.124.7772: UDP, length 120
03:45:07.845222 IP 192.168.43.124.8880 > 192.168.43.195.7771: UDP, length 120
03:45:07.865425 IP 192.168.43.195.8880 > 192.168.43.124.7772: UDP, length 120
03:45:07.895754 IP 192.168.43.124.8880 > 192.168.43.195.7771: UDP, length 120
03:45:07.915425 IP 192.168.43.195.8880 > 192.168.43.124.7772: UDP, length 120
03:45:07.946495 IP 192.168.43.124.8880 > 192.168.43.195.7771: UDP, length 120
03:45:07.965440 IP 192.168.43.195.8880 > 192.168.43.124.7772: UDP, length 120
03:45:07.995513 IP 192.168.43.124.8880 > 192.168.43.195.7771: UDP, length 120
03:45:08.015425 IP 192.168.43.195.8880 > 192.168.43.124.7772: UDP, length 120
03:45:08.055275 IP 192.168.43.124.8880 > 192.168.43.195.7771: UDP, length 120
03:45:08.065419 IP 192.168.43.195.8880 > 192.168.43.124.7772: UDP, length 120
03:45:08.096432 IP 192.168.43.124.8880 > 192.168.43.195.7771: UDP, length 120
03:45:08.115423 IP 192.168.43.195.8880 > 192.168.43.124.7772: UDP, length 120
03:45:08.146812 IP 192.168.43.124.8880 > 192.168.43.195.7771: UDP, length 120
03:45:08.165423 IP 192.168.43.195.8880 > 192.168.43.124.7772: UDP, length 120
03:45:08.197673 IP 192.168.43.124.8880 > 192.168.43.195.7771: UDP, length 120
03:45:08.215433 IP 192.168.43.195.8880 > 192.168.43.124.7772: UDP, length 120
03:45:08.245154 IP 192.168.43.124.8880 > 192.168.43.195.7771: UDP, length 120
03:45:08.265436 IP 192.168.43.195.8880 > 192.168.43.124.7772: UDP, length 120
03:45:08.295154 IP 192.168.43.124.8880 > 192.168.43.195.7771: UDP, length 120
03:45:08.315438 IP 192.168.43.195.8880 > 192.168.43.124.7772: UDP, length 120
03:45:08.345133 IP 192.168.43.124.8880 > 192.168.43.195.7771: UDP, length 120
03:45:08.365425 IP 192.168.43.195.8880 > 192.168.43.124.7772: UDP, length 120
03:45:08.395119 IP 192.168.43.124.8880 > 192.168.43.195.7771: UDP, length 120
03:45:08.415418 IP 192.168.43.195.8880 > 192.168.43.124.7772: UDP, length 120
03:45:08.445305 IP 192.168.43.124.8880 > 192.168.43.195.7771: UDP, length 120
03:45:08.465422 IP 192.168.43.195.8880 > 192.168.43.124.7772: UDP, length 120
03:45:08.495131 IP 192.168.43.124.8880 > 192.168.43.195.7771: UDP, length 120
03:45:08.515428 IP 192.168.43.195.8880 > 192.168.43.124.7772: UDP, length 120
03:45:08.551220 IP 192.168.43.124.8880 > 192.168.43.195.7771: UDP, length 120
03:45:08.565417 IP 192.168.43.195.8880 > 192.168.43.124.7772: UDP, length 120
03:45:08.595435 IP 192.168.43.124.8880 > 192.168.43.195.7771: UDP, length 120
03:45:08.615460 IP 192.168.43.195.8880 > 192.168.43.124.7772: UDP, length 120
03:45:08.646671 IP 192.168.43.124.8880 > 192.168.43.195.7771: UDP, length 120
03:45:08.665428 IP 192.168.43.195.8880 > 192.168.43.124.7772: UDP, length 120
03:45:08.705093 IP 192.168.43.124.8880 > 192.168.43.195.7771: UDP, length 120
03:45:08.715417 IP 192.168.43.195.8880 > 192.168.43.124.7772: UDP, length 120
03:45:08.745109 IP 192.168.43.124.8880 > 192.168.43.195.7771: UDP, length 120
03:45:08.765426 IP 192.168.43.195.8880 > 192.168.43.124.7772: UDP, length 120
03:45:08.795155 IP 192.168.43.124.8880 > 192.168.43.195.7771: UDP, length 120
03:45:08.815422 IP 192.168.43.195.8880 > 192.168.43.124.7772: UDP, length 120
03:45:08.846610 IP 192.168.43.124.8880 > 192.168.43.195.7771: UDP, length 120
03:45:08.865421 IP 192.168.43.195.8880 > 192.168.43.124.7772: UDP, length 120
03:45:08.894571 IP 192.168.43.124.8880 > 192.168.43.195.7771: UDP, length 120
03:45:08.915423 IP 192.168.43.195.8880 > 192.168.43.124.7772: UDP, length 120
03:45:08.945338 IP 192.168.43.124.8880 > 192.168.43.195.7771: UDP, length 120
03:45:08.965450 IP 192.168.43.195.8880 > 192.168.43.124.7772: UDP, length 120
03:45:08.996138 IP 192.168.43.124.8880 > 192.168.43.195.7771: UDP, length 120
03:45:09.015430 IP 192.168.43.195.8880 > 192.168.43.124.7772: UDP, length 120
03:45:09.065418 IP 192.168.43.195.8880 > 192.168.43.124.7772: UDP, length 120
03:45:09.066847 IP 192.168.43.124.8880 > 192.168.43.195.7771: UDP, length 120
03:45:09.095181 IP 192.168.43.124.8880 > 192.168.43.195.7771: UDP, length 120
03:45:09.115423 IP 192.168.43.195.8880 > 192.168.43.124.7772: UDP, length 120
03:45:09.146838 IP 192.168.43.124.8880 > 192.168.43.195.7771: UDP, length 120
03:45:09.165423 IP 192.168.43.195.8880 > 192.168.43.124.7772: UDP, length 120
03:45:09.195728 IP 192.168.43.124.8880 > 192.168.43.195.7771: UDP, length 120
03:45:09.215422 IP 192.168.43.195.8880 > 192.168.43.124.7772: UDP, length 120
03:45:09.259909 IP 192.168.43.124.8880 > 192.168.43.195.7771: UDP, length 120
03:45:09.265421 IP 192.168.43.195.8880 > 192.168.43.124.7772: UDP, length 120
03:45:09.295433 IP 192.168.43.124.8880 > 192.168.43.195.7771: UDP, length 120
03:45:09.315426 IP 192.168.43.195.8880 > 192.168.43.124.7772: UDP, length 120
03:45:09.352103 IP 192.168.43.124.8880 > 192.168.43.195.7771: UDP, length 120
03:45:09.365441 IP 192.168.43.195.8880 > 192.168.43.124.7772: UDP, length 120
03:45:09.395507 IP 192.168.43.124.8880 > 192.168.43.195.7771: UDP, length 120
03:45:09.415426 IP 192.168.43.195.8880 > 192.168.43.124.7772: UDP, length 120
03:45:09.453210 IP 192.168.43.124.8880 > 192.168.43.195.7771: UDP, length 120
03:45:09.465423 IP 192.168.43.195.8880 > 192.168.43.124.7772: UDP, length 120
03:45:09.495181 IP 192.168.43.124.8880 > 192.168.43.195.7771: UDP, length 120
03:45:09.515423 IP 192.168.43.195.8880 > 192.168.43.124.7772: UDP, length 120
03:45:09.545355 IP 192.168.43.124.8880 > 192.168.43.195.7771: UDP, length 120
03:45:09.565421 IP 192.168.43.195.8880 > 192.168.43.124.7772: UDP, length 120
03:45:09.595231 IP 192.168.43.124.8880 > 192.168.43.195.7771: UDP, length 120
03:45:09.615428 IP 192.168.43.195.8880 > 192.168.43.124.7772: UDP, length 120
03:45:09.657052 IP 192.168.43.124.8880 > 192.168.43.195.7771: UDP, length 120
03:45:09.665428 IP 192.168.43.195.8880 > 192.168.43.124.7772: UDP, length 120
03:45:09.695246 IP 192.168.43.124.8880 > 192.168.43.195.7771: UDP, length 120
03:45:09.715420 IP 192.168.43.195.8880 > 192.168.43.124.7772: UDP, length 120
03:45:09.745166 IP 192.168.43.124.8880 > 192.168.43.195.7771: UDP, length 120
03:45:09.765432 IP 192.168.43.195.8880 > 192.168.43.124.7772: UDP, length 120
03:45:09.805192 IP 192.168.43.124.8880 > 192.168.43.195.7771: UDP, length 120
03:45:09.815423 IP 192.168.43.195.8880 > 192.168.43.124.7772: UDP, length 120
03:45:09.845309 IP 192.168.43.124.8880 > 192.168.43.195.7771: UDP, length 120
03:45:09.865421 IP 192.168.43.195.8880 > 192.168.43.124.7772: UDP, length 120
03:45:09.895284 IP 192.168.43.124.8880 > 192.168.43.195.7771: UDP, length 120
03:45:09.915419 IP 192.168.43.195.8880 > 192.168.43.124.7772: UDP, length 120
03:45:09.945226 IP 192.168.43.124.8880 > 192.168.43.195.7771: UDP, length 120
03:45:09.965428 IP 192.168.43.195.8880 > 192.168.43.124.7772: UDP, length 120
03:45:09.995174 IP 192.168.43.124.8880 > 192.168.43.195.7771: UDP, length 120
03:45:10.015421 IP 192.168.43.195.8880 > 192.168.43.124.7772: UDP, length 120
03:45:10.046068 IP 192.168.43.124.8880 > 192.168.43.195.7771: UDP, length 120
03:45:10.065419 IP 192.168.43.195.8880 > 192.168.43.124.7772: UDP, length 120
03:45:10.097605 IP 192.168.43.124.8880 > 192.168.43.195.7771: UDP, length 120
03:45:10.115455 IP 192.168.43.195.8880 > 192.168.43.124.7772: UDP, length 120
03:45:10.155111 IP 192.168.43.124.8880 > 192.168.43.195.7771: UDP, length 120
03:45:10.165424 IP 192.168.43.195.8880 > 192.168.43.124.7772: UDP, length 120
03:45:10.195923 IP 192.168.43.124.8880 > 192.168.43.195.7771: UDP, length 120
03:45:10.215419 IP 192.168.43.195.8880 > 192.168.43.124.7772: UDP, length 120
03:45:10.246381 IP 192.168.43.124.8880 > 192.168.43.195.7771: UDP, length 120
03:45:10.265419 IP 192.168.43.195.8880 > 192.168.43.124.7772: UDP, length 120
03:45:10.296422 IP 192.168.43.124.8880 > 192.168.43.195.7771: UDP, length 120
03:45:10.315421 IP 192.168.43.195.8880 > 192.168.43.124.7772: UDP, length 120
03:45:10.345153 IP 192.168.43.124.8880 > 192.168.43.195.7771: UDP, length 120
03:45:10.365424 IP 192.168.43.195.8880 > 192.168.43.124.7772: UDP, length 120
03:45:10.395499 IP 192.168.43.124.8880 > 192.168.43.195.7771: UDP, length 120
03:45:10.415422 IP 192.168.43.195.8880 > 192.168.43.124.7772: UDP, length 120
03:45:10.445309 IP 192.168.43.124.8880 > 192.168.43.195.7771: UDP, length 120
03:45:10.465435 IP 192.168.43.195.8880 > 192.168.43.124.7772: UDP, length 120
03:45:10.515425 IP 192.168.43.195.8880 > 192.168.43.124.7772: UDP, length 120
03:45:10.565419 IP 192.168.43.195.8880 > 192.168.43.124.7772: UDP, length 120
03:45:10.615420 IP 192.168.43.195.8880 > 192.168.43.124.7772: UDP, length 120
03:45:10.632861 IP 192.168.43.124.8880 > 192.168.43.195.7771: UDP, length 120
03:45:10.633115 IP 192.168.43.124.8880 > 192.168.43.195.7771: UDP, length 120
03:45:10.665429 IP 192.168.43.195.8880 > 192.168.43.124.7772: UDP, length 120
03:45:10.715420 IP 192.168.43.195.8880 > 192.168.43.124.7772: UDP, length 120
03:45:10.749520 IP 192.168.43.124.8880 > 192.168.43.195.7771: UDP, length 120
03:45:10.749765 IP 192.168.43.124.8880 > 192.168.43.195.7771: UDP, length 120
03:45:10.749880 IP 192.168.43.124.8880 > 192.168.43.195.7771: UDP, length 120
03:45:10.765432 IP 192.168.43.195.8880 > 192.168.43.124.7772: UDP, length 120
03:45:10.815422 IP 192.168.43.195.8880 > 192.168.43.124.7772: UDP, length 120
03:45:10.865426 IP 192.168.43.195.8880 > 192.168.43.124.7772: UDP, length 120
03:45:10.901438 IP 192.168.43.124.8880 > 192.168.43.195.7771: UDP, length 120
03:45:10.901706 IP 192.168.43.124.8880 > 192.168.43.195.7771: UDP, length 120
03:45:10.901924 IP 192.168.43.124.8880 > 192.168.43.195.7771: UDP, length 120
03:45:10.915423 IP 192.168.43.195.8880 > 192.168.43.124.7772: UDP, length 120
03:45:10.965425 IP 192.168.43.195.8880 > 192.168.43.124.7772: UDP, length 120
03:45:11.015421 IP 192.168.43.195.8880 > 192.168.43.124.7772: UDP, length 120
03:45:11.056460 IP 192.168.43.124.8880 > 192.168.43.195.7771: UDP, length 120
03:45:11.056746 IP 192.168.43.124.8880 > 192.168.43.195.7771: UDP, length 120
03:45:11.065423 IP 192.168.43.195.8880 > 192.168.43.124.7772: UDP, length 120
03:45:11.115420 IP 192.168.43.195.8880 > 192.168.43.124.7772: UDP, length 120
03:45:11.156965 IP 192.168.43.124.8880 > 192.168.43.195.7771: UDP, length 120
03:45:11.157226 IP 192.168.43.124.8880 > 192.168.43.195.7771: UDP, length 120
03:45:11.157447 IP 192.168.43.124.8880 > 192.168.43.195.7771: UDP, length 120
03:45:11.165427 IP 192.168.43.195.8880 > 192.168.43.124.7772: UDP, length 120
03:45:11.215421 IP 192.168.43.195.8880 > 192.168.43.124.7772: UDP, length 120
03:45:11.265419 IP 192.168.43.195.8880 > 192.168.43.124.7772: UDP, length 120
03:45:11.303073 IP 192.168.43.124.8880 > 192.168.43.195.7771: UDP, length 120
03:45:11.303313 IP 192.168.43.124.8880 > 192.168.43.195.7771: UDP, length 120
03:45:11.303433 IP 192.168.43.124.8880 > 192.168.43.195.7771: UDP, length 120
03:45:11.315420 IP 192.168.43.195.8880 > 192.168.43.124.7772: UDP, length 120
03:45:11.365427 IP 192.168.43.195.8880 > 192.168.43.124.7772: UDP, length 120
03:45:11.415414 IP 192.168.43.195.8880 > 192.168.43.124.7772: UDP, length 120
03:45:11.461620 IP 192.168.43.124.8880 > 192.168.43.195.7771: UDP, length 120
03:45:11.461887 IP 192.168.43.124.8880 > 192.168.43.195.7771: UDP, length 120
03:45:11.462108 IP 192.168.43.124.8880 > 192.168.43.195.7771: UDP, length 120
03:45:11.465426 IP 192.168.43.195.8880 > 192.168.43.124.7772: UDP, length 120
03:45:11.515436 IP 192.168.43.195.8880 > 192.168.43.124.7772: UDP, length 120
03:45:11.565421 IP 192.168.43.195.8880 > 192.168.43.124.7772: UDP, length 120
03:45:11.605090 IP 192.168.43.124.8880 > 192.168.43.195.7771: UDP, length 120
03:45:11.605433 IP 192.168.43.124.8880 > 192.168.43.195.7771: UDP, length 120
03:45:11.605642 IP 192.168.43.124.8880 > 192.168.43.195.7771: UDP, length 120
03:45:11.615456 IP 192.168.43.195.8880 > 192.168.43.124.7772: UDP, length 120
03:45:11.665423 IP 192.168.43.195.8880 > 192.168.43.124.7772: UDP, length 120
03:45:11.715418 IP 192.168.43.195.8880 > 192.168.43.124.7772: UDP, length 120
03:45:11.758271 IP 192.168.43.124.8880 > 192.168.43.195.7771: UDP, length 120
03:45:11.758518 IP 192.168.43.124.8880 > 192.168.43.195.7771: UDP, length 120
03:45:11.758729 IP 192.168.43.124.8880 > 192.168.43.195.7771: UDP, length 120
03:45:11.765423 IP 192.168.43.195.8880 > 192.168.43.124.7772: UDP, length 120
03:45:11.815419 IP 192.168.43.195.8880 > 192.168.43.124.7772: UDP, length 120
03:45:11.865418 IP 192.168.43.195.8880 > 192.168.43.124.7772: UDP, length 120
03:45:11.905449 IP 192.168.43.124.8880 > 192.168.43.195.7771: UDP, length 120
03:45:11.905682 IP 192.168.43.124.8880 > 192.168.43.195.7771: UDP, length 120
03:45:11.915423 IP 192.168.43.195.8880 > 192.168.43.124.7772: UDP, length 120
03:45:11.965425 IP 192.168.43.195.8880 > 192.168.43.124.7772: UDP, length 120
03:45:12.003674 IP 192.168.43.124.8880 > 192.168.43.195.7771: UDP, length 120
03:45:12.004714 IP 192.168.43.124.8880 > 192.168.43.195.7771: UDP, length 120
03:45:12.004936 IP 192.168.43.124.8880 > 192.168.43.195.7771: UDP, length 120
03:45:12.015424 IP 192.168.43.195.8880 > 192.168.43.124.7772: UDP, length 120
03:45:12.065419 IP 192.168.43.195.8880 > 192.168.43.124.7772: UDP, length 120
03:45:12.115418 IP 192.168.43.195.8880 > 192.168.43.124.7772: UDP, length 120
03:45:12.152394 IP 192.168.43.124.8880 > 192.168.43.195.7771: UDP, length 120
03:45:12.152624 IP 192.168.43.124.8880 > 192.168.43.195.7771: UDP, length 120
03:45:12.152833 IP 192.168.43.124.8880 > 192.168.43.195.7771: UDP, length 120
03:45:12.165423 IP 192.168.43.195.8880 > 192.168.43.124.7772: UDP, length 120
03:45:12.215418 IP 192.168.43.195.8880 > 192.168.43.124.7772: UDP, length 120
03:45:12.265416 IP 192.168.43.195.8880 > 192.168.43.124.7772: UDP, length 120
03:45:12.296119 IP 192.168.43.124.8880 > 192.168.43.195.7771: UDP, length 120
03:45:12.296359 IP 192.168.43.124.8880 > 192.168.43.195.7771: UDP, length 120
03:45:12.296567 IP 192.168.43.124.8880 > 192.168.43.195.7771: UDP, length 120
03:45:12.315421 IP 192.168.43.195.8880 > 192.168.43.124.7772: UDP, length 120
03:45:12.365425 IP 192.168.43.195.8880 > 192.168.43.124.7772: UDP, length 120
03:45:12.415415 IP 192.168.43.195.8880 > 192.168.43.124.7772: UDP, length 120
03:45:12.436236 IP 192.168.43.124.8880 > 192.168.43.195.7771: UDP, length 120
03:45:12.436625 IP 192.168.43.124.8880 > 192.168.43.195.7771: UDP, length 120
03:45:12.465427 IP 192.168.43.195.8880 > 192.168.43.124.7772: UDP, length 120
03:45:12.515433 IP 192.168.43.195.8880 > 192.168.43.124.7772: UDP, length 120
03:45:12.536143 IP 192.168.43.124.8880 > 192.168.43.195.7771: UDP, length 120
03:45:12.536533 IP 192.168.43.124.8880 > 192.168.43.195.7771: UDP, length 120
03:45:12.565433 IP 192.168.43.195.8880 > 192.168.43.124.7772: UDP, length 120
03:45:12.615422 IP 192.168.43.195.8880 > 192.168.43.124.7772: UDP, length 120
03:45:12.663341 IP 192.168.43.124.8880 > 192.168.43.195.7771: UDP, length 120
03:45:12.663626 IP 192.168.43.124.8880 > 192.168.43.195.7771: UDP, length 120
03:45:12.663836 IP 192.168.43.124.8880 > 192.168.43.195.7771: UDP, length 120
03:45:12.665450 IP 192.168.43.195.8880 > 192.168.43.124.7772: UDP, length 120
03:45:12.715418 IP 192.168.43.195.8880 > 192.168.43.124.7772: UDP, length 120
03:45:12.765416 IP 192.168.43.195.8880 > 192.168.43.124.7772: UDP, length 120
03:45:12.799614 IP 192.168.43.124.8880 > 192.168.43.195.7771: UDP, length 120
03:45:12.799861 IP 192.168.43.124.8880 > 192.168.43.195.7771: UDP, length 120
03:45:12.800071 IP 192.168.43.124.8880 > 192.168.43.195.7771: UDP, length 120
03:45:12.815422 IP 192.168.43.195.8880 > 192.168.43.124.7772: UDP, length 120
03:45:12.865417 IP 192.168.43.195.8880 > 192.168.43.124.7772: UDP, length 120
03:45:12.915416 IP 192.168.43.195.8880 > 192.168.43.124.7772: UDP, length 120
03:45:12.944358 IP 192.168.43.124.8880 > 192.168.43.195.7771: UDP, length 120
03:45:12.944615 IP 192.168.43.124.8880 > 192.168.43.195.7771: UDP, length 120
03:45:12.965428 IP 192.168.43.195.8880 > 192.168.43.124.7772: UDP, length 120
03:45:13.015420 IP 192.168.43.195.8880 > 192.168.43.124.7772: UDP, length 120
03:45:13.044126 IP 192.168.43.124.8880 > 192.168.43.195.7771: UDP, length 120
03:45:13.044367 IP 192.168.43.124.8880 > 192.168.43.195.7771: UDP, length 120
03:45:13.065420 IP 192.168.43.195.8880 > 192.168.43.124.7772: UDP, length 120
03:45:13.115468 IP 192.168.43.195.8880 > 192.168.43.124.7772: UDP, length 120
03:45:13.165439 IP 192.168.43.195.8880 > 192.168.43.124.7772: UDP, length 120
03:45:13.176239 IP 192.168.43.124.8880 > 192.168.43.195.7771: UDP, length 120
03:45:13.176693 IP 192.168.43.124.8880 > 192.168.43.195.7771: UDP, length 120
03:45:13.176905 IP 192.168.43.124.8880 > 192.168.43.195.7771: UDP, length 120
03:45:13.215429 IP 192.168.43.195.8880 > 192.168.43.124.7772: UDP, length 120
03:45:13.265418 IP 192.168.43.195.8880 > 192.168.43.124.7772: UDP, length 120
03:45:13.306127 IP 192.168.43.124.8880 > 192.168.43.195.7771: UDP, length 120
03:45:13.306377 IP 192.168.43.124.8880 > 192.168.43.195.7771: UDP, length 120
03:45:13.306609 IP 192.168.43.124.8880 > 192.168.43.195.7771: UDP, length 120
03:45:13.315422 IP 192.168.43.195.8880 > 192.168.43.124.7772: UDP, length 120
03:45:13.365419 IP 192.168.43.195.8880 > 192.168.43.124.7772: UDP, length 120
03:45:13.415418 IP 192.168.43.195.8880 > 192.168.43.124.7772: UDP, length 120
03:45:13.457378 IP 192.168.43.124.8880 > 192.168.43.195.7771: UDP, length 120
03:45:13.457689 IP 192.168.43.124.8880 > 192.168.43.195.7771: UDP, length 120
03:45:13.465425 IP 192.168.43.195.8880 > 192.168.43.124.7772: UDP, length 120
03:45:13.515422 IP 192.168.43.195.8880 > 192.168.43.124.7772: UDP, length 120
03:45:13.556030 IP 192.168.43.124.8880 > 192.168.43.195.7771: UDP, length 120
03:45:13.556295 IP 192.168.43.124.8880 > 192.168.43.195.7771: UDP, length 120
03:45:13.556517 IP 192.168.43.124.8880 > 192.168.43.195.7771: UDP, length 120
03:45:13.565428 IP 192.168.43.195.8880 > 192.168.43.124.7772: UDP, length 120
03:45:13.615420 IP 192.168.43.195.8880 > 192.168.43.124.7772: UDP, length 120
03:45:13.665420 IP 192.168.43.195.8880 > 192.168.43.124.7772: UDP, length 120
03:45:13.695461 IP 192.168.43.124.8880 > 192.168.43.195.7771: UDP, length 120
03:45:13.695716 IP 192.168.43.124.8880 > 192.168.43.195.7771: UDP, length 120
03:45:13.695959 IP 192.168.43.124.8880 > 192.168.43.195.7771: UDP, length 120
03:45:13.715427 IP 192.168.43.195.8880 > 192.168.43.124.7772: UDP, length 120
03:45:13.762294 IP 192.168.43.124.8880 > 192.168.43.195.7771: UDP, length 120
03:45:13.765424 IP 192.168.43.195.8880 > 192.168.43.124.7772: UDP, length 120
03:45:13.795463 IP 192.168.43.124.8880 > 192.168.43.195.7771: UDP, length 120
03:45:13.815424 IP 192.168.43.195.8880 > 192.168.43.124.7772: UDP, length 120
03:45:13.845450 IP 192.168.43.124.8880 > 192.168.43.195.7771: UDP, length 120
03:45:13.865420 IP 192.168.43.195.8880 > 192.168.43.124.7772: UDP, length 120
03:45:13.895252 IP 192.168.43.124.8880 > 192.168.43.195.7771: UDP, length 120
03:45:13.915422 IP 192.168.43.195.8880 > 192.168.43.124.7772: UDP, length 120
03:45:13.945331 IP 192.168.43.124.8880 > 192.168.43.195.7771: UDP, length 120
03:45:13.965452 IP 192.168.43.195.8880 > 192.168.43.124.7772: UDP, length 120
03:45:13.995481 IP 192.168.43.124.8880 > 192.168.43.195.7771: UDP, length 120
03:45:14.015431 IP 192.168.43.195.8880 > 192.168.43.124.7772: UDP, length 120
03:45:14.045214 IP 192.168.43.124.8880 > 192.168.43.195.7771: UDP, length 120
03:45:14.065420 IP 192.168.43.195.8880 > 192.168.43.124.7772: UDP, length 120
03:45:14.109115 IP 192.168.43.124.8880 > 192.168.43.195.7771: UDP, length 120
03:45:14.115418 IP 192.168.43.195.8880 > 192.168.43.124.7772: UDP, length 120
03:45:14.145520 IP 192.168.43.124.8880 > 192.168.43.195.7771: UDP, length 120
03:45:14.165425 IP 192.168.43.195.8880 > 192.168.43.124.7772: UDP, length 120
03:45:14.195432 IP 192.168.43.124.8880 > 192.168.43.195.7771: UDP, length 120
03:45:14.215421 IP 192.168.43.195.8880 > 192.168.43.124.7772: UDP, length 120
03:45:14.245345 IP 192.168.43.124.8880 > 192.168.43.195.7771: UDP, length 120
03:45:14.265422 IP 192.168.43.195.8880 > 192.168.43.124.7772: UDP, length 120
03:45:14.305256 IP 192.168.43.124.8880 > 192.168.43.195.7771: UDP, length 120
03:45:14.315423 IP 192.168.43.195.8880 > 192.168.43.124.7772: UDP, length 120
03:45:14.346851 IP 192.168.43.124.8880 > 192.168.43.195.7771: UDP, length 120
03:45:14.365421 IP 192.168.43.195.8880 > 192.168.43.124.7772: UDP, length 120
03:45:14.395325 IP 192.168.43.124.8880 > 192.168.43.195.7771: UDP, length 120
03:45:14.415421 IP 192.168.43.195.8880 > 192.168.43.124.7772: UDP, length 120
03:45:14.455696 IP 192.168.43.124.8880 > 192.168.43.195.7771: UDP, length 120
03:45:14.465424 IP 192.168.43.195.8880 > 192.168.43.124.7772: UDP, length 120
03:45:14.495402 IP 192.168.43.124.8880 > 192.168.43.195.7771: UDP, length 120
03:45:14.515421 IP 192.168.43.195.8880 > 192.168.43.124.7772: UDP, length 120
03:45:14.547342 IP 192.168.43.124.8880 > 192.168.43.195.7771: UDP, length 120
03:45:14.565425 IP 192.168.43.195.8880 > 192.168.43.124.7772: UDP, length 120
03:45:14.597324 IP 192.168.43.124.8880 > 192.168.43.195.7771: UDP, length 120
03:45:14.615463 IP 192.168.43.195.8880 > 192.168.43.124.7772: UDP, length 120
03:45:14.645578 IP 192.168.43.124.8880 > 192.168.43.195.7771: UDP, length 120
03:45:14.665440 IP 192.168.43.195.8880 > 192.168.43.124.7772: UDP, length 120
03:45:14.695616 IP 192.168.43.124.8880 > 192.168.43.195.7771: UDP, length 120
03:45:14.715435 IP 192.168.43.195.8880 > 192.168.43.124.7772: UDP, length 120
03:45:14.752079 IP 192.168.43.124.8880 > 192.168.43.195.7771: UDP, length 120
03:45:14.765441 IP 192.168.43.195.8880 > 192.168.43.124.7772: UDP, length 120
03:45:14.805345 IP 192.168.43.124.8880 > 192.168.43.195.7771: UDP, length 120
03:45:14.815427 IP 192.168.43.195.8880 > 192.168.43.124.7772: UDP, length 120
03:45:14.845380 IP 192.168.43.124.8880 > 192.168.43.195.7771: UDP, length 120
03:45:14.865419 IP 192.168.43.195.8880 > 192.168.43.124.7772: UDP, length 120
03:45:14.895659 IP 192.168.43.124.8880 > 192.168.43.195.7771: UDP, length 120
03:45:14.915423 IP 192.168.43.195.8880 > 192.168.43.124.7772: UDP, length 120
03:45:14.945439 IP 192.168.43.124.8880 > 192.168.43.195.7771: UDP, length 120
03:45:14.965430 IP 192.168.43.195.8880 > 192.168.43.124.7772: UDP, length 120
03:45:14.995083 IP 192.168.43.124.8880 > 192.168.43.195.7771: UDP, length 120
03:45:15.015423 IP 192.168.43.195.8880 > 192.168.43.124.7772: UDP, length 120
03:45:15.045327 IP 192.168.43.124.8880 > 192.168.43.195.7771: UDP, length 120
03:45:15.065421 IP 192.168.43.195.8880 > 192.168.43.124.7772: UDP, length 120
03:45:15.095265 IP 192.168.43.124.8880 > 192.168.43.195.7771: UDP, length 120
03:45:15.115421 IP 192.168.43.195.8880 > 192.168.43.124.7772: UDP, length 120
03:45:15.145356 IP 192.168.43.124.8880 > 192.168.43.195.7771: UDP, length 120
03:45:15.165421 IP 192.168.43.195.8880 > 192.168.43.124.7772: UDP, length 120
03:45:15.195376 IP 192.168.43.124.8880 > 192.168.43.195.7771: UDP, length 120
03:45:15.215419 IP 192.168.43.195.8880 > 192.168.43.124.7772: UDP, length 120
03:45:15.245608 IP 192.168.43.124.8880 > 192.168.43.195.7771: UDP, length 120
03:45:15.265422 IP 192.168.43.195.8880 > 192.168.43.124.7772: UDP, length 120
03:45:15.292505 IP 192.168.43.124.8880 > 192.168.43.195.7771: UDP, length 120
03:45:15.315421 IP 192.168.43.195.8880 > 192.168.43.124.7772: UDP, length 120
03:45:15.355268 IP 192.168.43.124.8880 > 192.168.43.195.7771: UDP, length 120
03:45:15.365419 IP 192.168.43.195.8880 > 192.168.43.124.7772: UDP, length 120
03:45:15.395667 IP 192.168.43.124.8880 > 192.168.43.195.7771: UDP, length 120
03:45:15.415418 IP 192.168.43.195.8880 > 192.168.43.124.7772: UDP, length 120
03:45:15.447114 IP 192.168.43.124.8880 > 192.168.43.195.7771: UDP, length 120
03:45:15.465421 IP 192.168.43.195.8880 > 192.168.43.124.7772: UDP, length 120
03:45:15.495803 IP 192.168.43.124.8880 > 192.168.43.195.7771: UDP, length 120
03:45:15.515421 IP 192.168.43.195.8880 > 192.168.43.124.7772: UDP, length 120
03:45:15.545452 IP 192.168.43.124.8880 > 192.168.43.195.7771: UDP, length 120
03:45:15.565420 IP 192.168.43.195.8880 > 192.168.43.124.7772: UDP, length 120
03:45:15.598156 IP 192.168.43.124.8880 > 192.168.43.195.7771: UDP, length 120
03:45:15.615422 IP 192.168.43.195.8880 > 192.168.43.124.7772: UDP, length 120
03:45:15.645604 IP 192.168.43.124.8880 > 192.168.43.195.7771: UDP, length 120
03:45:15.665420 IP 192.168.43.195.8880 > 192.168.43.124.7772: UDP, length 120
03:45:15.700377 IP 192.168.43.124.8880 > 192.168.43.195.7771: UDP, length 120
03:45:15.715426 IP 192.168.43.195.8880 > 192.168.43.124.7772: UDP, length 120
03:45:15.745456 IP 192.168.43.124.8880 > 192.168.43.195.7771: UDP, length 120
03:45:15.765450 IP 192.168.43.195.8880 > 192.168.43.124.7772: UDP, length 120
03:45:15.803265 IP 192.168.43.124.8880 > 192.168.43.195.7771: UDP, length 120
03:45:15.815434 IP 192.168.43.195.8880 > 192.168.43.124.7772: UDP, length 120
03:45:15.845630 IP 192.168.43.124.8880 > 192.168.43.195.7771: UDP, length 120
03:45:15.865422 IP 192.168.43.195.8880 > 192.168.43.124.7772: UDP, length 120
03:45:15.905442 IP 192.168.43.124.8880 > 192.168.43.195.7771: UDP, length 120
03:45:15.915424 IP 192.168.43.195.8880 > 192.168.43.124.7772: UDP, length 120
03:45:15.947701 IP 192.168.43.124.8880 > 192.168.43.195.7771: UDP, length 120
03:45:15.965430 IP 192.168.43.195.8880 > 192.168.43.124.7772: UDP, length 120
03:45:16.001336 IP 192.168.43.124.8880 > 192.168.43.195.7771: UDP, length 120
03:45:16.015421 IP 192.168.43.195.8880 > 192.168.43.124.7772: UDP, length 120
03:45:16.045659 IP 192.168.43.124.8880 > 192.168.43.195.7771: UDP, length 120
03:45:16.065419 IP 192.168.43.195.8880 > 192.168.43.124.7772: UDP, length 120
03:45:16.095612 IP 192.168.43.124.8880 > 192.168.43.195.7771: UDP, length 120
03:45:16.115457 IP 192.168.43.195.8880 > 192.168.43.124.7772: UDP, length 120
03:45:16.148920 IP 192.168.43.124.8880 > 192.168.43.195.7771: UDP, length 120
03:45:16.165424 IP 192.168.43.195.8880 > 192.168.43.124.7772: UDP, length 120
03:45:16.195249 IP 192.168.43.124.8880 > 192.168.43.195.7771: UDP, length 120
03:45:16.215419 IP 192.168.43.195.8880 > 192.168.43.124.7772: UDP, length 120
03:45:16.245238 IP 192.168.43.124.8880 > 192.168.43.195.7771: UDP, length 120
03:45:16.265420 IP 192.168.43.195.8880 > 192.168.43.124.7772: UDP, length 120
03:45:16.295427 IP 192.168.43.124.8880 > 192.168.43.195.7771: UDP, length 120
03:45:16.315421 IP 192.168.43.195.8880 > 192.168.43.124.7772: UDP, length 120
03:45:16.353206 IP 192.168.43.124.8880 > 192.168.43.195.7771: UDP, length 120
03:45:16.365421 IP 192.168.43.195.8880 > 192.168.43.124.7772: UDP, length 120
03:45:16.395688 IP 192.168.43.124.8880 > 192.168.43.195.7771: UDP, length 120
03:45:16.415419 IP 192.168.43.195.8880 > 192.168.43.124.7772: UDP, length 120
03:45:16.445625 IP 192.168.43.124.8880 > 192.168.43.195.7771: UDP, length 120
03:45:16.465420 IP 192.168.43.195.8880 > 192.168.43.124.7772: UDP, length 120
03:45:16.505486 IP 192.168.43.124.8880 > 192.168.43.195.7771: UDP, length 120
03:45:16.515418 IP 192.168.43.195.8880 > 192.168.43.124.7772: UDP, length 120
03:45:16.545694 IP 192.168.43.124.8880 > 192.168.43.195.7771: UDP, length 120
03:45:16.565420 IP 192.168.43.195.8880 > 192.168.43.124.7772: UDP, length 120
03:45:16.595659 IP 192.168.43.124.8880 > 192.168.43.195.7771: UDP, length 120
03:45:16.615420 IP 192.168.43.195.8880 > 192.168.43.124.7772: UDP, length 120
03:45:16.645496 IP 192.168.43.124.8880 > 192.168.43.195.7771: UDP, length 120
03:45:16.665420 IP 192.168.43.195.8880 > 192.168.43.124.7772: UDP, length 120
03:45:16.697511 IP 192.168.43.124.8880 > 192.168.43.195.7771: UDP, length 120
03:45:16.715433 IP 192.168.43.195.8880 > 192.168.43.124.7772: UDP, length 120
03:45:16.747148 IP 192.168.43.124.8880 > 192.168.43.195.7771: UDP, length 120
03:45:16.765436 IP 192.168.43.195.8880 > 192.168.43.124.7772: UDP, length 120
03:45:16.795436 IP 192.168.43.124.8880 > 192.168.43.195.7771: UDP, length 120
03:45:16.815423 IP 192.168.43.195.8880 > 192.168.43.124.7772: UDP, length 120
03:45:16.855657 IP 192.168.43.124.8880 > 192.168.43.195.7771: UDP, length 120
03:45:16.865427 IP 192.168.43.195.8880 > 192.168.43.124.7772: UDP, length 120
03:45:16.915421 IP 192.168.43.195.8880 > 192.168.43.124.7772: UDP, length 120
03:45:16.917761 IP 192.168.43.124.8880 > 192.168.43.195.7771: UDP, length 120
03:45:16.945372 IP 192.168.43.124.8880 > 192.168.43.195.7771: UDP, length 120
03:45:16.965432 IP 192.168.43.195.8880 > 192.168.43.124.7772: UDP, length 120
03:45:16.995736 IP 192.168.43.124.8880 > 192.168.43.195.7771: UDP, length 120
03:45:17.015424 IP 192.168.43.195.8880 > 192.168.43.124.7772: UDP, length 120
03:45:17.045394 IP 192.168.43.124.8880 > 192.168.43.195.7771: UDP, length 120
03:45:17.065424 IP 192.168.43.195.8880 > 192.168.43.124.7772: UDP, length 120
03:45:17.095362 IP 192.168.43.124.8880 > 192.168.43.195.7771: UDP, length 120
03:45:17.115421 IP 192.168.43.195.8880 > 192.168.43.124.7772: UDP, length 120
03:45:17.145381 IP 192.168.43.124.8880 > 192.168.43.195.7771: UDP, length 120
03:45:17.165422 IP 192.168.43.195.8880 > 192.168.43.124.7772: UDP, length 120
03:45:17.195374 IP 192.168.43.124.8880 > 192.168.43.195.7771: UDP, length 120
03:45:17.215423 IP 192.168.43.195.8880 > 192.168.43.124.7772: UDP, length 120
03:45:17.245339 IP 192.168.43.124.8880 > 192.168.43.195.7771: UDP, length 120
03:45:17.265424 IP 192.168.43.195.8880 > 192.168.43.124.7772: UDP, length 120
03:45:17.295380 IP 192.168.43.124.8880 > 192.168.43.195.7771: UDP, length 120
03:45:17.315425 IP 192.168.43.195.8880 > 192.168.43.124.7772: UDP, length 120
03:45:17.345597 IP 192.168.43.124.8880 > 192.168.43.195.7771: UDP, length 120
03:45:17.365424 IP 192.168.43.195.8880 > 192.168.43.124.7772: UDP, length 120
03:45:17.392360 IP 192.168.43.124.8880 > 192.168.43.195.7771: UDP, length 120
03:45:17.415428 IP 192.168.43.195.8880 > 192.168.43.124.7772: UDP, length 120
03:45:17.448092 IP 192.168.43.124.8880 > 192.168.43.195.7771: UDP, length 120
03:45:17.465422 IP 192.168.43.195.8880 > 192.168.43.124.7772: UDP, length 120
03:45:17.495119 IP 192.168.43.124.8880 > 192.168.43.195.7771: UDP, length 120
03:45:17.515422 IP 192.168.43.195.8880 > 192.168.43.124.7772: UDP, length 120
03:45:17.545489 IP 192.168.43.124.8880 > 192.168.43.195.7771: UDP, length 120
03:45:17.565421 IP 192.168.43.195.8880 > 192.168.43.124.7772: UDP, length 120
03:45:17.597611 IP 192.168.43.124.8880 > 192.168.43.195.7771: UDP, length 120
03:45:17.615461 IP 192.168.43.195.8880 > 192.168.43.124.7772: UDP, length 120
03:45:17.646325 IP 192.168.43.124.8880 > 192.168.43.195.7771: UDP, length 120
03:45:17.665427 IP 192.168.43.195.8880 > 192.168.43.124.7772: UDP, length 120
03:45:17.695482 IP 192.168.43.124.8880 > 192.168.43.195.7771: UDP, length 120
03:45:17.715425 IP 192.168.43.195.8880 > 192.168.43.124.7772: UDP, length 120
03:45:17.765247 IP 192.168.43.124.8880 > 192.168.43.195.7771: UDP, length 120
03:45:17.765422 IP 192.168.43.195.8880 > 192.168.43.124.7772: UDP, length 120
03:45:17.795450 IP 192.168.43.124.8880 > 192.168.43.195.7771: UDP, length 120
03:45:17.815423 IP 192.168.43.195.8880 > 192.168.43.124.7772: UDP, length 120
03:45:17.850789 IP 192.168.43.124.8880 > 192.168.43.195.7771: UDP, length 120
03:45:17.865432 IP 192.168.43.195.8880 > 192.168.43.124.7772: UDP, length 120
03:45:17.913545 IP 192.168.43.124.8880 > 192.168.43.195.7771: UDP, length 120
03:45:17.915433 IP 192.168.43.195.8880 > 192.168.43.124.7772: UDP, length 120
03:45:17.953364 IP 192.168.43.124.8880 > 192.168.43.195.7771: UDP, length 120
03:45:17.965432 IP 192.168.43.195.8880 > 192.168.43.124.7772: UDP, length 120
03:45:17.995465 IP 192.168.43.124.8880 > 192.168.43.195.7771: UDP, length 120
03:45:18.015421 IP 192.168.43.195.8880 > 192.168.43.124.7772: UDP, length 120
03:45:18.055661 IP 192.168.43.124.8880 > 192.168.43.195.7771: UDP, length 120
03:45:18.065421 IP 192.168.43.195.8880 > 192.168.43.124.7772: UDP, length 120
03:45:18.095445 IP 192.168.43.124.8880 > 192.168.43.195.7771: UDP, length 120
03:45:18.115421 IP 192.168.43.195.8880 > 192.168.43.124.7772: UDP, length 120
03:45:18.145656 IP 192.168.43.124.8880 > 192.168.43.195.7771: UDP, length 120
03:45:18.165420 IP 192.168.43.195.8880 > 192.168.43.124.7772: UDP, length 120
03:45:18.198966 IP 192.168.43.124.8880 > 192.168.43.195.7771: UDP, length 120
03:45:18.215436 IP 192.168.43.195.8880 > 192.168.43.124.7772: UDP, length 120
03:45:18.255477 IP 192.168.43.124.8880 > 192.168.43.195.7771: UDP, length 120
03:45:18.265423 IP 192.168.43.195.8880 > 192.168.43.124.7772: UDP, length 120
03:45:18.295572 IP 192.168.43.124.8880 > 192.168.43.195.7771: UDP, length 120
03:45:18.315421 IP 192.168.43.195.8880 > 192.168.43.124.7772: UDP, length 120
03:45:18.345373 IP 192.168.43.124.8880 > 192.168.43.195.7771: UDP, length 120
03:45:18.365422 IP 192.168.43.195.8880 > 192.168.43.124.7772: UDP, length 120
03:45:18.415419 IP 192.168.43.195.8880 > 192.168.43.124.7772: UDP, length 120
03:45:18.416533 IP 192.168.43.124.8880 > 192.168.43.195.7771: UDP, length 120
03:45:18.445697 IP 192.168.43.124.8880 > 192.168.43.195.7771: UDP, length 120
03:45:18.465423 IP 192.168.43.195.8880 > 192.168.43.124.7772: UDP, length 120
03:45:18.495711 IP 192.168.43.124.8880 > 192.168.43.195.7771: UDP, length 120
03:45:18.515422 IP 192.168.43.195.8880 > 192.168.43.124.7772: UDP, length 120
03:45:18.546177 IP 192.168.43.124.8880 > 192.168.43.195.7771: UDP, length 120
03:45:18.565423 IP 192.168.43.195.8880 > 192.168.43.124.7772: UDP, length 120
03:45:18.595495 IP 192.168.43.124.8880 > 192.168.43.195.7771: UDP, length 120
03:45:18.615421 IP 192.168.43.195.8880 > 192.168.43.124.7772: UDP, length 120
03:45:18.647440 IP 192.168.43.124.8880 > 192.168.43.195.7771: UDP, length 120
03:45:18.665425 IP 192.168.43.195.8880 > 192.168.43.124.7772: UDP, length 120
03:45:18.695738 IP 192.168.43.124.8880 > 192.168.43.195.7771: UDP, length 120
03:45:18.715423 IP 192.168.43.195.8880 > 192.168.43.124.7772: UDP, length 120
03:45:18.755010 IP 192.168.43.124.8880 > 192.168.43.195.7771: UDP, length 120
03:45:18.765422 IP 192.168.43.195.8880 > 192.168.43.124.7772: UDP, length 120
03:45:18.795322 IP 192.168.43.124.8880 > 192.168.43.195.7771: UDP, length 120
03:45:18.815423 IP 192.168.43.195.8880 > 192.168.43.124.7772: UDP, length 120
03:45:18.847746 IP 192.168.43.124.8880 > 192.168.43.195.7771: UDP, length 120
03:45:18.865422 IP 192.168.43.195.8880 > 192.168.43.124.7772: UDP, length 120
03:45:18.897314 IP 192.168.43.124.8880 > 192.168.43.195.7771: UDP, length 120
03:45:18.915428 IP 192.168.43.195.8880 > 192.168.43.124.7772: UDP, length 120
03:45:18.949908 IP 192.168.43.124.8880 > 192.168.43.195.7771: UDP, length 120
03:45:18.965449 IP 192.168.43.195.8880 > 192.168.43.124.7772: UDP, length 120
03:45:18.995535 IP 192.168.43.124.8880 > 192.168.43.195.7771: UDP, length 120
03:45:19.015422 IP 192.168.43.195.8880 > 192.168.43.124.7772: UDP, length 120
03:45:19.045935 IP 192.168.43.124.8880 > 192.168.43.195.7771: UDP, length 120
03:45:19.065420 IP 192.168.43.195.8880 > 192.168.43.124.7772: UDP, length 120
03:45:19.105549 IP 192.168.43.124.8880 > 192.168.43.195.7771: UDP, length 120
03:45:19.115456 IP 192.168.43.195.8880 > 192.168.43.124.7772: UDP, length 120
03:45:19.145745 IP 192.168.43.124.8880 > 192.168.43.195.7771: UDP, length 120
03:45:19.165421 IP 192.168.43.195.8880 > 192.168.43.124.7772: UDP, length 120
03:45:19.195500 IP 192.168.43.124.8880 > 192.168.43.195.7771: UDP, length 120
03:45:19.215417 IP 192.168.43.195.8880 > 192.168.43.124.7772: UDP, length 120
03:45:19.245626 IP 192.168.43.124.8880 > 192.168.43.195.7771: UDP, length 120
03:45:19.265419 IP 192.168.43.195.8880 > 192.168.43.124.7772: UDP, length 120
03:45:19.295422 IP 192.168.43.124.8880 > 192.168.43.195.7771: UDP, length 120
03:45:19.315420 IP 192.168.43.195.8880 > 192.168.43.124.7772: UDP, length 120
03:45:19.345689 IP 192.168.43.124.8880 > 192.168.43.195.7771: UDP, length 120
03:45:19.365420 IP 192.168.43.195.8880 > 192.168.43.124.7772: UDP, length 120
03:45:19.395442 IP 192.168.43.124.8880 > 192.168.43.195.7771: UDP, length 120
03:45:19.415420 IP 192.168.43.195.8880 > 192.168.43.124.7772: UDP, length 120
03:45:19.465418 IP 192.168.43.195.8880 > 192.168.43.124.7772: UDP, length 120
03:45:19.466650 IP 192.168.43.124.8880 > 192.168.43.195.7771: UDP, length 120
03:45:19.495721 IP 192.168.43.124.8880 > 192.168.43.195.7771: UDP, length 120
03:45:19.515427 IP 192.168.43.195.8880 > 192.168.43.124.7772: UDP, length 120
03:45:19.545390 IP 192.168.43.124.8880 > 192.168.43.195.7771: UDP, length 120
03:45:19.565422 IP 192.168.43.195.8880 > 192.168.43.124.7772: UDP, length 120
03:45:19.595541 IP 192.168.43.124.8880 > 192.168.43.195.7771: UDP, length 120
03:45:19.615422 IP 192.168.43.195.8880 > 192.168.43.124.7772: UDP, length 120
03:45:19.645587 IP 192.168.43.124.8880 > 192.168.43.195.7771: UDP, length 120
03:45:19.665435 IP 192.168.43.195.8880 > 192.168.43.124.7772: UDP, length 120
03:45:19.696039 IP 192.168.43.124.8880 > 192.168.43.195.7771: UDP, length 120
03:45:19.715424 IP 192.168.43.195.8880 > 192.168.43.124.7772: UDP, length 120
03:45:19.745976 IP 192.168.43.124.8880 > 192.168.43.195.7771: UDP, length 120
03:45:19.765423 IP 192.168.43.195.8880 > 192.168.43.124.7772: UDP, length 120
03:45:19.806009 IP 192.168.43.124.8880 > 192.168.43.195.7771: UDP, length 120
03:45:19.815422 IP 192.168.43.195.8880 > 192.168.43.124.7772: UDP, length 120
03:45:19.845691 IP 192.168.43.124.8880 > 192.168.43.195.7771: UDP, length 120
03:45:19.865421 IP 192.168.43.195.8880 > 192.168.43.124.7772: UDP, length 120
03:45:19.897344 IP 192.168.43.124.8880 > 192.168.43.195.7771: UDP, length 120
03:45:19.915420 IP 192.168.43.195.8880 > 192.168.43.124.7772: UDP, length 120
03:45:19.945837 IP 192.168.43.124.8880 > 192.168.43.195.7771: UDP, length 120
03:45:19.965446 IP 192.168.43.195.8880 > 192.168.43.124.7772: UDP, length 120
03:45:20.001561 IP 192.168.43.124.8880 > 192.168.43.195.7771: UDP, length 120
03:45:20.015423 IP 192.168.43.195.8880 > 192.168.43.124.7772: UDP, length 120
03:45:20.044944 IP 192.168.43.124.8880 > 192.168.43.195.7771: UDP, length 120
03:45:20.065427 IP 192.168.43.195.8880 > 192.168.43.124.7772: UDP, length 120
03:45:20.098500 IP 192.168.43.124.8880 > 192.168.43.195.7771: UDP, length 120
03:45:20.115421 IP 192.168.43.195.8880 > 192.168.43.124.7772: UDP, length 120
03:45:20.145809 IP 192.168.43.124.8880 > 192.168.43.195.7771: UDP, length 120
03:45:20.165422 IP 192.168.43.195.8880 > 192.168.43.124.7772: UDP, length 120
03:45:20.199625 IP 192.168.43.124.8880 > 192.168.43.195.7771: UDP, length 120
03:45:20.215421 IP 192.168.43.195.8880 > 192.168.43.124.7772: UDP, length 120
03:45:20.245739 IP 192.168.43.124.8880 > 192.168.43.195.7771: UDP, length 120
03:45:20.265420 IP 192.168.43.195.8880 > 192.168.43.124.7772: UDP, length 120
03:45:20.295469 IP 192.168.43.124.8880 > 192.168.43.195.7771: UDP, length 120
03:45:20.315421 IP 192.168.43.195.8880 > 192.168.43.124.7772: UDP, length 120
03:45:20.355114 IP 192.168.43.124.8880 > 192.168.43.195.7771: UDP, length 120
03:45:20.365422 IP 192.168.43.195.8880 > 192.168.43.124.7772: UDP, length 120
03:45:20.395799 IP 192.168.43.124.8880 > 192.168.43.195.7771: UDP, length 120
03:45:20.415422 IP 192.168.43.195.8880 > 192.168.43.124.7772: UDP, length 120
03:45:20.445701 IP 192.168.43.124.8880 > 192.168.43.195.7771: UDP, length 120
03:45:20.465422 IP 192.168.43.195.8880 > 192.168.43.124.7772: UDP, length 120
03:45:20.495559 IP 192.168.43.124.8880 > 192.168.43.195.7771: UDP, length 120
03:45:20.515428 IP 192.168.43.195.8880 > 192.168.43.124.7772: UDP, length 120
03:45:20.557131 IP 192.168.43.124.8880 > 192.168.43.195.7771: UDP, length 120
03:45:20.565421 IP 192.168.43.195.8880 > 192.168.43.124.7772: UDP, length 120
03:45:20.595725 IP 192.168.43.124.8880 > 192.168.43.195.7771: UDP, length 120
03:45:20.615455 IP 192.168.43.195.8880 > 192.168.43.124.7772: UDP, length 120
03:45:20.645593 IP 192.168.43.124.8880 > 192.168.43.195.7771: UDP, length 120
03:45:20.665425 IP 192.168.43.195.8880 > 192.168.43.124.7772: UDP, length 120
03:45:20.705178 IP 192.168.43.124.8880 > 192.168.43.195.7771: UDP, length 120
03:45:20.715423 IP 192.168.43.195.8880 > 192.168.43.124.7772: UDP, length 120
03:45:20.745774 IP 192.168.43.124.8880 > 192.168.43.195.7771: UDP, length 120
03:45:20.765423 IP 192.168.43.195.8880 > 192.168.43.124.7772: UDP, length 120
03:45:20.797790 IP 192.168.43.124.8880 > 192.168.43.195.7771: UDP, length 120
03:45:20.815422 IP 192.168.43.195.8880 > 192.168.43.124.7772: UDP, length 120
03:45:20.845713 IP 192.168.43.124.8880 > 192.168.43.195.7771: UDP, length 120
03:45:20.865420 IP 192.168.43.195.8880 > 192.168.43.124.7772: UDP, length 120
03:45:20.896613 IP 192.168.43.124.8880 > 192.168.43.195.7771: UDP, length 120
03:45:20.915420 IP 192.168.43.195.8880 > 192.168.43.124.7772: UDP, length 120
03:45:20.945665 IP 192.168.43.124.8880 > 192.168.43.195.7771: UDP, length 120
03:45:20.965426 IP 192.168.43.195.8880 > 192.168.43.124.7772: UDP, length 120
03:45:20.998282 IP 192.168.43.124.8880 > 192.168.43.195.7771: UDP, length 120
03:45:21.015420 IP 192.168.43.195.8880 > 192.168.43.124.7772: UDP, length 120
03:45:21.059366 IP 192.168.43.124.8880 > 192.168.43.195.7771: UDP, length 120
03:45:21.065436 IP 192.168.43.195.8880 > 192.168.43.124.7772: UDP, length 120
03:45:21.095537 IP 192.168.43.124.8880 > 192.168.43.195.7771: UDP, length 120
03:45:21.115426 IP 192.168.43.195.8880 > 192.168.43.124.7772: UDP, length 120
03:45:21.145581 IP 192.168.43.124.8880 > 192.168.43.195.7771: UDP, length 120
03:45:21.165424 IP 192.168.43.195.8880 > 192.168.43.124.7772: UDP, length 120
03:45:21.195659 IP 192.168.43.124.8880 > 192.168.43.195.7771: UDP, length 120
03:45:21.215421 IP 192.168.43.195.8880 > 192.168.43.124.7772: UDP, length 120
03:45:21.245542 IP 192.168.43.124.8880 > 192.168.43.195.7771: UDP, length 120
03:45:21.265420 IP 192.168.43.195.8880 > 192.168.43.124.7772: UDP, length 120
03:45:21.294787 IP 192.168.43.124.8880 > 192.168.43.195.7771: UDP, length 120
03:45:21.315419 IP 192.168.43.195.8880 > 192.168.43.124.7772: UDP, length 120
03:45:21.345154 IP 192.168.43.124.8880 > 192.168.43.195.7771: UDP, length 120
03:45:21.365420 IP 192.168.43.195.8880 > 192.168.43.124.7772: UDP, length 120
03:45:21.407418 IP 192.168.43.124.8880 > 192.168.43.195.7771: UDP, length 120
03:45:21.415421 IP 192.168.43.195.8880 > 192.168.43.124.7772: UDP, length 120
03:45:21.445916 IP 192.168.43.124.8880 > 192.168.43.195.7771: UDP, length 120
03:45:21.465422 IP 192.168.43.195.8880 > 192.168.43.124.7772: UDP, length 120
03:45:21.496275 IP 192.168.43.124.8880 > 192.168.43.195.7771: UDP, length 120
03:45:21.515426 IP 192.168.43.195.8880 > 192.168.43.124.7772: UDP, length 120
03:45:21.545652 IP 192.168.43.124.8880 > 192.168.43.195.7771: UDP, length 120
03:45:21.565421 IP 192.168.43.195.8880 > 192.168.43.124.7772: UDP, length 120
03:45:21.596332 IP 192.168.43.124.8880 > 192.168.43.195.7771: UDP, length 120
03:45:21.615423 IP 192.168.43.195.8880 > 192.168.43.124.7772: UDP, length 120
03:45:21.645836 IP 192.168.43.124.8880 > 192.168.43.195.7771: UDP, length 120
03:45:21.665422 IP 192.168.43.195.8880 > 192.168.43.124.7772: UDP, length 120
03:45:21.696247 IP 192.168.43.124.8880 > 192.168.43.195.7771: UDP, length 120
03:45:21.715425 IP 192.168.43.195.8880 > 192.168.43.124.7772: UDP, length 120
03:45:21.746271 IP 192.168.43.124.8880 > 192.168.43.195.7771: UDP, length 120
03:45:21.765422 IP 192.168.43.195.8880 > 192.168.43.124.7772: UDP, length 120
03:45:21.796437 IP 192.168.43.124.8880 > 192.168.43.195.7771: UDP, length 120
03:45:21.815421 IP 192.168.43.195.8880 > 192.168.43.124.7772: UDP, length 120
03:45:21.847827 IP 192.168.43.124.8880 > 192.168.43.195.7771: UDP, length 120
03:45:21.865419 IP 192.168.43.195.8880 > 192.168.43.124.7772: UDP, length 120
03:45:21.905991 IP 192.168.43.124.8880 > 192.168.43.195.7771: UDP, length 120
03:45:21.915422 IP 192.168.43.195.8880 > 192.168.43.124.7772: UDP, length 120
03:45:21.947088 IP 192.168.43.124.8880 > 192.168.43.195.7771: UDP, length 120
03:45:21.965429 IP 192.168.43.195.8880 > 192.168.43.124.7772: UDP, length 120
03:45:21.995813 IP 192.168.43.124.8880 > 192.168.43.195.7771: UDP, length 120
03:45:22.015422 IP 192.168.43.195.8880 > 192.168.43.124.7772: UDP, length 120
03:45:22.049663 IP 192.168.43.124.8880 > 192.168.43.195.7771: UDP, length 120
03:45:22.065426 IP 192.168.43.195.8880 > 192.168.43.124.7772: UDP, length 120
03:45:22.095643 IP 192.168.43.124.8880 > 192.168.43.195.7771: UDP, length 120
03:45:22.115461 IP 192.168.43.195.8880 > 192.168.43.124.7772: UDP, length 120
03:45:22.150110 IP 192.168.43.124.8880 > 192.168.43.195.7771: UDP, length 120
03:45:22.165426 IP 192.168.43.195.8880 > 192.168.43.124.7772: UDP, length 120
03:45:22.195724 IP 192.168.43.124.8880 > 192.168.43.195.7771: UDP, length 120
03:45:22.215423 IP 192.168.43.195.8880 > 192.168.43.124.7772: UDP, length 120
03:45:22.248620 IP 192.168.43.124.8880 > 192.168.43.195.7771: UDP, length 120
03:45:22.265422 IP 192.168.43.195.8880 > 192.168.43.124.7772: UDP, length 120
03:45:22.295704 IP 192.168.43.124.8880 > 192.168.43.195.7771: UDP, length 120
03:45:22.315421 IP 192.168.43.195.8880 > 192.168.43.124.7772: UDP, length 120
03:45:22.349974 IP 192.168.43.124.8880 > 192.168.43.195.7771: UDP, length 120
03:45:22.365421 IP 192.168.43.195.8880 > 192.168.43.124.7772: UDP, length 120
03:45:22.395506 IP 192.168.43.124.8880 > 192.168.43.195.7771: UDP, length 120
03:45:22.415420 IP 192.168.43.195.8880 > 192.168.43.124.7772: UDP, length 120
03:45:22.445631 IP 192.168.43.124.8880 > 192.168.43.195.7771: UDP, length 120
03:45:22.465421 IP 192.168.43.195.8880 > 192.168.43.124.7772: UDP, length 120
03:45:22.496245 IP 192.168.43.124.8880 > 192.168.43.195.7771: UDP, length 120
03:45:22.515424 IP 192.168.43.195.8880 > 192.168.43.124.7772: UDP, length 120
03:45:22.545829 IP 192.168.43.124.8880 > 192.168.43.195.7771: UDP, length 120
03:45:22.565421 IP 192.168.43.195.8880 > 192.168.43.124.7772: UDP, length 120
03:45:22.595720 IP 192.168.43.124.8880 > 192.168.43.195.7771: UDP, length 120
03:45:22.615419 IP 192.168.43.195.8880 > 192.168.43.124.7772: UDP, length 120
03:45:22.644920 IP 192.168.43.124.8880 > 192.168.43.195.7771: UDP, length 120
03:45:22.665420 IP 192.168.43.195.8880 > 192.168.43.124.7772: UDP, length 120
03:45:22.709340 IP 192.168.43.124.8880 > 192.168.43.195.7771: UDP, length 120
03:45:22.715422 IP 192.168.43.195.8880 > 192.168.43.124.7772: UDP, length 120
03:45:22.745694 IP 192.168.43.124.8880 > 192.168.43.195.7771: UDP, length 120
03:45:22.765421 IP 192.168.43.195.8880 > 192.168.43.124.7772: UDP, length 120
03:45:22.795699 IP 192.168.43.124.8880 > 192.168.43.195.7771: UDP, length 120
03:45:22.815421 IP 192.168.43.195.8880 > 192.168.43.124.7772: UDP, length 120
03:45:22.845610 IP 192.168.43.124.8880 > 192.168.43.195.7771: UDP, length 120
03:45:22.865419 IP 192.168.43.195.8880 > 192.168.43.124.7772: UDP, length 120
03:45:22.895612 IP 192.168.43.124.8880 > 192.168.43.195.7771: UDP, length 120
03:45:22.915419 IP 192.168.43.195.8880 > 192.168.43.124.7772: UDP, length 120
03:45:22.945888 IP 192.168.43.124.8880 > 192.168.43.195.7771: UDP, length 120
03:45:22.965426 IP 192.168.43.195.8880 > 192.168.43.124.7772: UDP, length 120
03:45:23.002654 IP 192.168.43.124.8880 > 192.168.43.195.7771: UDP, length 120
03:45:23.015420 IP 192.168.43.195.8880 > 192.168.43.124.7772: UDP, length 120
03:45:23.056158 IP 192.168.43.124.8880 > 192.168.43.195.7771: UDP, length 120
03:45:23.065422 IP 192.168.43.195.8880 > 192.168.43.124.7772: UDP, length 120
03:45:23.096584 IP 192.168.43.124.8880 > 192.168.43.195.7771: UDP, length 120
03:45:23.115421 IP 192.168.43.195.8880 > 192.168.43.124.7772: UDP, length 120
03:45:23.145580 IP 192.168.43.124.8880 > 192.168.43.195.7771: UDP, length 120
03:45:23.165424 IP 192.168.43.195.8880 > 192.168.43.124.7772: UDP, length 120
03:45:23.195924 IP 192.168.43.124.8880 > 192.168.43.195.7771: UDP, length 120
03:45:23.215442 IP 192.168.43.195.8880 > 192.168.43.124.7772: UDP, length 120
03:45:23.245746 IP 192.168.43.124.8880 > 192.168.43.195.7771: UDP, length 120
03:45:23.265427 IP 192.168.43.195.8880 > 192.168.43.124.7772: UDP, length 120
03:45:23.315421 IP 192.168.43.195.8880 > 192.168.43.124.7772: UDP, length 120
03:45:23.365418 IP 192.168.43.195.8880 > 192.168.43.124.7772: UDP, length 120
03:45:23.415418 IP 192.168.43.195.8880 > 192.168.43.124.7772: UDP, length 120
03:45:23.450782 IP 192.168.43.124.8880 > 192.168.43.195.7771: UDP, length 120
03:45:23.451083 IP 192.168.43.124.8880 > 192.168.43.195.7771: UDP, length 120
03:45:23.451332 IP 192.168.43.124.8880 > 192.168.43.195.7771: UDP, length 120
03:45:23.465423 IP 192.168.43.195.8880 > 192.168.43.124.7772: UDP, length 120
03:45:23.515426 IP 192.168.43.195.8880 > 192.168.43.124.7772: UDP, length 120
03:45:23.565420 IP 192.168.43.195.8880 > 192.168.43.124.7772: UDP, length 120
03:45:23.587850 IP 192.168.43.124.8880 > 192.168.43.195.7771: UDP, length 120
03:45:23.588115 IP 192.168.43.124.8880 > 192.168.43.195.7771: UDP, length 120
03:45:23.615472 IP 192.168.43.195.8880 > 192.168.43.124.7772: UDP, length 120
03:45:23.665428 IP 192.168.43.195.8880 > 192.168.43.124.7772: UDP, length 120
03:45:23.694937 IP 192.168.43.124.8880 > 192.168.43.195.7771: UDP, length 120
03:45:23.695279 IP 192.168.43.124.8880 > 192.168.43.195.7771: UDP, length 120
03:45:23.715428 IP 192.168.43.195.8880 > 192.168.43.124.7772: UDP, length 120
03:45:23.765421 IP 192.168.43.195.8880 > 192.168.43.124.7772: UDP, length 120
03:45:23.794819 IP 192.168.43.124.8880 > 192.168.43.195.7771: UDP, length 120
03:45:23.795064 IP 192.168.43.124.8880 > 192.168.43.195.7771: UDP, length 120
03:45:23.815424 IP 192.168.43.195.8880 > 192.168.43.124.7772: UDP, length 120
03:45:23.865421 IP 192.168.43.195.8880 > 192.168.43.124.7772: UDP, length 120
03:45:23.894680 IP 192.168.43.124.8880 > 192.168.43.195.7771: UDP, length 120
03:45:23.894923 IP 192.168.43.124.8880 > 192.168.43.195.7771: UDP, length 120
03:45:23.915422 IP 192.168.43.195.8880 > 192.168.43.124.7772: UDP, length 120
03:45:23.965445 IP 192.168.43.195.8880 > 192.168.43.124.7772: UDP, length 120
03:45:24.004313 IP 192.168.43.124.8880 > 192.168.43.195.7771: UDP, length 120
03:45:24.004555 IP 192.168.43.124.8880 > 192.168.43.195.7771: UDP, length 120
03:45:24.004670 IP 192.168.43.124.8880 > 192.168.43.195.7771: UDP, length 120
03:45:24.015429 IP 192.168.43.195.8880 > 192.168.43.124.7772: UDP, length 120
03:45:24.065419 IP 192.168.43.195.8880 > 192.168.43.124.7772: UDP, length 120
03:45:24.115420 IP 192.168.43.195.8880 > 192.168.43.124.7772: UDP, length 120
03:45:24.155747 IP 192.168.43.124.8880 > 192.168.43.195.7771: UDP, length 120
03:45:24.155998 IP 192.168.43.124.8880 > 192.168.43.195.7771: UDP, length 120
03:45:24.165422 IP 192.168.43.195.8880 > 192.168.43.124.7772: UDP, length 120
03:45:24.215421 IP 192.168.43.195.8880 > 192.168.43.124.7772: UDP, length 120
03:45:24.248973 IP 192.168.43.124.8880 > 192.168.43.195.7771: UDP, length 120
03:45:24.249252 IP 192.168.43.124.8880 > 192.168.43.195.7771: UDP, length 120
03:45:24.249460 IP 192.168.43.124.8880 > 192.168.43.195.7771: UDP, length 120
03:45:24.265435 IP 192.168.43.195.8880 > 192.168.43.124.7772: UDP, length 120
03:45:24.315425 IP 192.168.43.195.8880 > 192.168.43.124.7772: UDP, length 120
03:45:24.365418 IP 192.168.43.195.8880 > 192.168.43.124.7772: UDP, length 120
03:45:24.413593 IP 192.168.43.124.8880 > 192.168.43.195.7771: UDP, length 120
03:45:24.413828 IP 192.168.43.124.8880 > 192.168.43.195.7771: UDP, length 120
03:45:24.414037 IP 192.168.43.124.8880 > 192.168.43.195.7771: UDP, length 120
03:45:24.415421 IP 192.168.43.195.8880 > 192.168.43.124.7772: UDP, length 120
03:45:24.465417 IP 192.168.43.195.8880 > 192.168.43.124.7772: UDP, length 120
03:45:24.515417 IP 192.168.43.195.8880 > 192.168.43.124.7772: UDP, length 120
03:45:24.542694 IP 192.168.43.124.8880 > 192.168.43.195.7771: UDP, length 120
03:45:24.542936 IP 192.168.43.124.8880 > 192.168.43.195.7771: UDP, length 120
03:45:24.565420 IP 192.168.43.195.8880 > 192.168.43.124.7772: UDP, length 120
03:45:24.615430 IP 192.168.43.195.8880 > 192.168.43.124.7772: UDP, length 120
03:45:24.648211 IP 192.168.43.124.8880 > 192.168.43.195.7771: UDP, length 120
03:45:24.648482 IP 192.168.43.124.8880 > 192.168.43.195.7771: UDP, length 120
03:45:24.648689 IP 192.168.43.124.8880 > 192.168.43.195.7771: UDP, length 120
03:45:24.665428 IP 192.168.43.195.8880 > 192.168.43.124.7772: UDP, length 120
03:45:24.715421 IP 192.168.43.195.8880 > 192.168.43.124.7772: UDP, length 120
03:45:24.765418 IP 192.168.43.195.8880 > 192.168.43.124.7772: UDP, length 120
03:45:24.798446 IP 192.168.43.124.8880 > 192.168.43.195.7771: UDP, length 120
03:45:24.798689 IP 192.168.43.124.8880 > 192.168.43.195.7771: UDP, length 120
03:45:24.798895 IP 192.168.43.124.8880 > 192.168.43.195.7771: UDP, length 120
03:45:24.815425 IP 192.168.43.195.8880 > 192.168.43.124.7772: UDP, length 120
03:45:24.865419 IP 192.168.43.195.8880 > 192.168.43.124.7772: UDP, length 120
03:45:24.915420 IP 192.168.43.195.8880 > 192.168.43.124.7772: UDP, length 120
03:45:24.955852 IP 192.168.43.124.8880 > 192.168.43.195.7771: UDP, length 120
03:45:24.956102 IP 192.168.43.124.8880 > 192.168.43.195.7771: UDP, length 120
03:45:24.965430 IP 192.168.43.195.8880 > 192.168.43.124.7772: UDP, length 120
03:45:25.015419 IP 192.168.43.195.8880 > 192.168.43.124.7772: UDP, length 120
03:45:25.048008 IP 192.168.43.124.8880 > 192.168.43.195.7771: UDP, length 120
03:45:25.048250 IP 192.168.43.124.8880 > 192.168.43.195.7771: UDP, length 120
03:45:25.048466 IP 192.168.43.124.8880 > 192.168.43.195.7771: UDP, length 120
03:45:25.065422 IP 192.168.43.195.8880 > 192.168.43.124.7772: UDP, length 120
03:45:25.115467 IP 192.168.43.195.8880 > 192.168.43.124.7772: UDP, length 120
03:45:25.165427 IP 192.168.43.195.8880 > 192.168.43.124.7772: UDP, length 120
03:45:25.215417 IP 192.168.43.195.8880 > 192.168.43.124.7772: UDP, length 120
03:45:25.217416 IP 192.168.43.124.8880 > 192.168.43.195.7771: UDP, length 120
03:45:25.217779 IP 192.168.43.124.8880 > 192.168.43.195.7771: UDP, length 120
03:45:25.218002 IP 192.168.43.124.8880 > 192.168.43.195.7771: UDP, length 120
03:45:25.265427 IP 192.168.43.195.8880 > 192.168.43.124.7772: UDP, length 120
03:45:25.315428 IP 192.168.43.195.8880 > 192.168.43.124.7772: UDP, length 120
03:45:25.355953 IP 192.168.43.124.8880 > 192.168.43.195.7771: UDP, length 120
03:45:25.356214 IP 192.168.43.124.8880 > 192.168.43.195.7771: UDP, length 120
03:45:25.365425 IP 192.168.43.195.8880 > 192.168.43.124.7772: UDP, length 120
03:45:25.415416 IP 192.168.43.195.8880 > 192.168.43.124.7772: UDP, length 120
03:45:25.453802 IP 192.168.43.124.8880 > 192.168.43.195.7771: UDP, length 120
03:45:25.454170 IP 192.168.43.124.8880 > 192.168.43.195.7771: UDP, length 120
03:45:25.454377 IP 192.168.43.124.8880 > 192.168.43.195.7771: UDP, length 120
03:45:25.465421 IP 192.168.43.195.8880 > 192.168.43.124.7772: UDP, length 120
03:45:25.515419 IP 192.168.43.195.8880 > 192.168.43.124.7772: UDP, length 120
03:45:25.565416 IP 192.168.43.195.8880 > 192.168.43.124.7772: UDP, length 120
03:45:25.600627 IP 192.168.43.124.8880 > 192.168.43.195.7771: UDP, length 120
03:45:25.600872 IP 192.168.43.124.8880 > 192.168.43.195.7771: UDP, length 120
03:45:25.601081 IP 192.168.43.124.8880 > 192.168.43.195.7771: UDP, length 120
03:45:25.615420 IP 192.168.43.195.8880 > 192.168.43.124.7772: UDP, length 120
03:45:25.665416 IP 192.168.43.195.8880 > 192.168.43.124.7772: UDP, length 120
03:45:25.715416 IP 192.168.43.195.8880 > 192.168.43.124.7772: UDP, length 120
03:45:25.752237 IP 192.168.43.124.8880 > 192.168.43.195.7771: UDP, length 120
03:45:25.752492 IP 192.168.43.124.8880 > 192.168.43.195.7771: UDP, length 120
03:45:25.752701 IP 192.168.43.124.8880 > 192.168.43.195.7771: UDP, length 120
03:45:25.765421 IP 192.168.43.195.8880 > 192.168.43.124.7772: UDP, length 120
03:45:25.815418 IP 192.168.43.195.8880 > 192.168.43.124.7772: UDP, length 120
03:45:25.865417 IP 192.168.43.195.8880 > 192.168.43.124.7772: UDP, length 120
03:45:25.913050 IP 192.168.43.124.8880 > 192.168.43.195.7771: UDP, length 120
03:45:25.913299 IP 192.168.43.124.8880 > 192.168.43.195.7771: UDP, length 120
03:45:25.913522 IP 192.168.43.124.8880 > 192.168.43.195.7771: UDP, length 120
03:45:25.915421 IP 192.168.43.195.8880 > 192.168.43.124.7772: UDP, length 120
03:45:25.965426 IP 192.168.43.195.8880 > 192.168.43.124.7772: UDP, length 120
03:45:26.015422 IP 192.168.43.195.8880 > 192.168.43.124.7772: UDP, length 120
03:45:26.044188 IP 192.168.43.124.8880 > 192.168.43.195.7771: UDP, length 120
03:45:26.044453 IP 192.168.43.124.8880 > 192.168.43.195.7771: UDP, length 120
03:45:26.065422 IP 192.168.43.195.8880 > 192.168.43.124.7772: UDP, length 120
03:45:26.115419 IP 192.168.43.195.8880 > 192.168.43.124.7772: UDP, length 120
03:45:26.144402 IP 192.168.43.124.8880 > 192.168.43.195.7771: UDP, length 120
03:45:26.144650 IP 192.168.43.124.8880 > 192.168.43.195.7771: UDP, length 120
03:45:26.165421 IP 192.168.43.195.8880 > 192.168.43.124.7772: UDP, length 120
03:45:26.215417 IP 192.168.43.195.8880 > 192.168.43.124.7772: UDP, length 120
03:45:26.262120 IP 192.168.43.124.8880 > 192.168.43.195.7771: UDP, length 120
03:45:26.262360 IP 192.168.43.124.8880 > 192.168.43.195.7771: UDP, length 120
03:45:26.262603 IP 192.168.43.124.8880 > 192.168.43.195.7771: UDP, length 120
03:45:26.265420 IP 192.168.43.195.8880 > 192.168.43.124.7772: UDP, length 120
03:45:26.315421 IP 192.168.43.195.8880 > 192.168.43.124.7772: UDP, length 120
03:45:26.365423 IP 192.168.43.195.8880 > 192.168.43.124.7772: UDP, length 120
03:45:26.408937 IP 192.168.43.124.8880 > 192.168.43.195.7771: UDP, length 120
03:45:26.409075 IP 192.168.43.124.8880 > 192.168.43.195.7771: UDP, length 120
03:45:26.415426 IP 192.168.43.195.8880 > 192.168.43.124.7772: UDP, length 120
03:45:26.447529 IP 192.168.43.124.8880 > 192.168.43.195.7771: UDP, length 120
03:45:26.447833 IP 192.168.43.124.8880 > 192.168.43.195.7771: UDP, length 120
03:45:26.465422 IP 192.168.43.195.8880 > 192.168.43.124.7772: UDP, length 120
03:45:26.495872 IP 192.168.43.124.8880 > 192.168.43.195.7771: UDP, length 120
03:45:26.515422 IP 192.168.43.195.8880 > 192.168.43.124.7772: UDP, length 120
03:45:26.550226 IP 192.168.43.124.8880 > 192.168.43.195.7771: UDP, length 120
03:45:26.565422 IP 192.168.43.195.8880 > 192.168.43.124.7772: UDP, length 120
03:45:26.597944 IP 192.168.43.124.8880 > 192.168.43.195.7771: UDP, length 120
03:45:26.615458 IP 192.168.43.195.8880 > 192.168.43.124.7772: UDP, length 120
03:45:26.645846 IP 192.168.43.124.8880 > 192.168.43.195.7771: UDP, length 120
03:45:26.665426 IP 192.168.43.195.8880 > 192.168.43.124.7772: UDP, length 120
03:45:26.695664 IP 192.168.43.124.8880 > 192.168.43.195.7771: UDP, length 120
03:45:26.715426 IP 192.168.43.195.8880 > 192.168.43.124.7772: UDP, length 120
03:45:26.745636 IP 192.168.43.124.8880 > 192.168.43.195.7771: UDP, length 120
03:45:26.765423 IP 192.168.43.195.8880 > 192.168.43.124.7772: UDP, length 120
03:45:26.799695 IP 192.168.43.124.8880 > 192.168.43.195.7771: UDP, length 120
03:45:26.815424 IP 192.168.43.195.8880 > 192.168.43.124.7772: UDP, length 120
03:45:26.845960 IP 192.168.43.124.8880 > 192.168.43.195.7771: UDP, length 120
03:45:26.865423 IP 192.168.43.195.8880 > 192.168.43.124.7772: UDP, length 120
03:45:26.895926 IP 192.168.43.124.8880 > 192.168.43.195.7771: UDP, length 120
03:45:26.915421 IP 192.168.43.195.8880 > 192.168.43.124.7772: UDP, length 120
03:45:26.945951 IP 192.168.43.124.8880 > 192.168.43.195.7771: UDP, length 120
03:45:26.965429 IP 192.168.43.195.8880 > 192.168.43.124.7772: UDP, length 120
03:45:26.995804 IP 192.168.43.124.8880 > 192.168.43.195.7771: UDP, length 120
03:45:27.015423 IP 192.168.43.195.8880 > 192.168.43.124.7772: UDP, length 120
03:45:27.046168 IP 192.168.43.124.8880 > 192.168.43.195.7771: UDP, length 120
03:45:27.065421 IP 192.168.43.195.8880 > 192.168.43.124.7772: UDP, length 120
03:45:27.095935 IP 192.168.43.124.8880 > 192.168.43.195.7771: UDP, length 120
03:45:27.115420 IP 192.168.43.195.8880 > 192.168.43.124.7772: UDP, length 120
03:45:27.157504 IP 192.168.43.124.8880 > 192.168.43.195.7771: UDP, length 120
03:45:27.165420 IP 192.168.43.195.8880 > 192.168.43.124.7772: UDP, length 120
03:45:27.195767 IP 192.168.43.124.8880 > 192.168.43.195.7771: UDP, length 120
03:45:27.215421 IP 192.168.43.195.8880 > 192.168.43.124.7772: UDP, length 120
03:45:27.245784 IP 192.168.43.124.8880 > 192.168.43.195.7771: UDP, length 120
03:45:27.265420 IP 192.168.43.195.8880 > 192.168.43.124.7772: UDP, length 120
03:45:27.295888 IP 192.168.43.124.8880 > 192.168.43.195.7771: UDP, length 120
03:45:27.315420 IP 192.168.43.195.8880 > 192.168.43.124.7772: UDP, length 120
03:45:27.347733 IP 192.168.43.124.8880 > 192.168.43.195.7771: UDP, length 120
03:45:27.365419 IP 192.168.43.195.8880 > 192.168.43.124.7772: UDP, length 120
03:45:27.407533 IP 192.168.43.124.8880 > 192.168.43.195.7771: UDP, length 120
03:45:27.415424 IP 192.168.43.195.8880 > 192.168.43.124.7772: UDP, length 120
03:45:27.445946 IP 192.168.43.124.8880 > 192.168.43.195.7771: UDP, length 120
03:45:27.465429 IP 192.168.43.195.8880 > 192.168.43.124.7772: UDP, length 120
03:45:27.495907 IP 192.168.43.124.8880 > 192.168.43.195.7771: UDP, length 120
03:45:27.515426 IP 192.168.43.195.8880 > 192.168.43.124.7772: UDP, length 120
03:45:27.545879 IP 192.168.43.124.8880 > 192.168.43.195.7771: UDP, length 120
03:45:27.565422 IP 192.168.43.195.8880 > 192.168.43.124.7772: UDP, length 120
03:45:27.601651 IP 192.168.43.124.8880 > 192.168.43.195.7771: UDP, length 120
03:45:27.615422 IP 192.168.43.195.8880 > 192.168.43.124.7772: UDP, length 120
03:45:27.645958 IP 192.168.43.124.8880 > 192.168.43.195.7771: UDP, length 120
03:45:27.665421 IP 192.168.43.195.8880 > 192.168.43.124.7772: UDP, length 120
03:45:27.695919 IP 192.168.43.124.8880 > 192.168.43.195.7771: UDP, length 120
03:45:27.715421 IP 192.168.43.195.8880 > 192.168.43.124.7772: UDP, length 120
03:45:27.756050 IP 192.168.43.124.8880 > 192.168.43.195.7771: UDP, length 120
03:45:27.765420 IP 192.168.43.195.8880 > 192.168.43.124.7772: UDP, length 120
03:45:27.795901 IP 192.168.43.124.8880 > 192.168.43.195.7771: UDP, length 120
03:45:27.815423 IP 192.168.43.195.8880 > 192.168.43.124.7772: UDP, length 120
03:45:27.845948 IP 192.168.43.124.8880 > 192.168.43.195.7771: UDP, length 120
03:45:27.865420 IP 192.168.43.195.8880 > 192.168.43.124.7772: UDP, length 120
03:45:27.895783 IP 192.168.43.124.8880 > 192.168.43.195.7771: UDP, length 120
03:45:27.915418 IP 192.168.43.195.8880 > 192.168.43.124.7772: UDP, length 120
03:45:27.946440 IP 192.168.43.124.8880 > 192.168.43.195.7771: UDP, length 120
03:45:27.965430 IP 192.168.43.195.8880 > 192.168.43.124.7772: UDP, length 120
03:45:27.995755 IP 192.168.43.124.8880 > 192.168.43.195.7771: UDP, length 120
03:45:28.015422 IP 192.168.43.195.8880 > 192.168.43.124.7772: UDP, length 120
03:45:28.045955 IP 192.168.43.124.8880 > 192.168.43.195.7771: UDP, length 120
03:45:28.065422 IP 192.168.43.195.8880 > 192.168.43.124.7772: UDP, length 120
03:45:28.105724 IP 192.168.43.124.8880 > 192.168.43.195.7771: UDP, length 120
03:45:28.115460 IP 192.168.43.195.8880 > 192.168.43.124.7772: UDP, length 120
03:45:28.146031 IP 192.168.43.124.8880 > 192.168.43.195.7771: UDP, length 120
03:45:28.165427 IP 192.168.43.195.8880 > 192.168.43.124.7772: UDP, length 120
03:45:28.195936 IP 192.168.43.124.8880 > 192.168.43.195.7771: UDP, length 120
03:45:28.215421 IP 192.168.43.195.8880 > 192.168.43.124.7772: UDP, length 120
03:45:28.245773 IP 192.168.43.124.8880 > 192.168.43.195.7771: UDP, length 120
03:45:28.265418 IP 192.168.43.195.8880 > 192.168.43.124.7772: UDP, length 120
03:45:28.295714 IP 192.168.43.124.8880 > 192.168.43.195.7771: UDP, length 120
03:45:28.315422 IP 192.168.43.195.8880 > 192.168.43.124.7772: UDP, length 120
03:45:28.345913 IP 192.168.43.124.8880 > 192.168.43.195.7771: UDP, length 120
03:45:28.365418 IP 192.168.43.195.8880 > 192.168.43.124.7772: UDP, length 120
03:45:28.398092 IP 192.168.43.124.8880 > 192.168.43.195.7771: UDP, length 120
03:45:28.415419 IP 192.168.43.195.8880 > 192.168.43.124.7772: UDP, length 120
03:45:28.465423 IP 192.168.43.195.8880 > 192.168.43.124.7772: UDP, length 120
03:45:28.515422 IP 192.168.43.195.8880 > 192.168.43.124.7772: UDP, length 120
03:45:28.565420 IP 192.168.43.195.8880 > 192.168.43.124.7772: UDP, length 120
03:45:28.615417 IP 192.168.43.195.8880 > 192.168.43.124.7772: UDP, length 120
03:45:28.665419 IP 192.168.43.195.8880 > 192.168.43.124.7772: UDP, length 120
03:45:28.715419 IP 192.168.43.195.8880 > 192.168.43.124.7772: UDP, length 120
03:45:28.765418 IP 192.168.43.195.8880 > 192.168.43.124.7772: UDP, length 120
03:45:28.815418 IP 192.168.43.195.8880 > 192.168.43.124.7772: UDP, length 120
03:45:28.865419 IP 192.168.43.195.8880 > 192.168.43.124.7772: UDP, length 120
03:45:28.915418 IP 192.168.43.195.8880 > 192.168.43.124.7772: UDP, length 120
03:45:28.965443 IP 192.168.43.195.8880 > 192.168.43.124.7772: UDP, length 120
03:45:29.015425 IP 192.168.43.195.8880 > 192.168.43.124.7772: UDP, length 120
03:45:29.065417 IP 192.168.43.195.8880 > 192.168.43.124.7772: UDP, length 120
03:45:29.115420 IP 192.168.43.195.8880 > 192.168.43.124.7772: UDP, length 120
03:45:29.165417 IP 192.168.43.195.8880 > 192.168.43.124.7772: UDP, length 120
03:45:29.215417 IP 192.168.43.195.8880 > 192.168.43.124.7772: UDP, length 120
03:45:29.265419 IP 192.168.43.195.8880 > 192.168.43.124.7772: UDP, length 120
03:45:29.315415 IP 192.168.43.195.8880 > 192.168.43.124.7772: UDP, length 120
03:45:29.365418 IP 192.168.43.195.8880 > 192.168.43.124.7772: UDP, length 120
03:45:29.415418 IP 192.168.43.195.8880 > 192.168.43.124.7772: UDP, length 120
