00:10:48.171430 IP 192.168.43.124.8880 > 192.168.43.146.7771: UDP, length 120
00:10:48.339335 IP 192.168.43.124.8880 > 192.168.43.146.7771: UDP, length 120
00:10:48.339464 IP 192.168.43.124.8880 > 192.168.43.146.7771: UDP, length 120
00:10:48.339570 IP 192.168.43.124.8880 > 192.168.43.146.7771: UDP, length 120
00:10:48.371211 IP 192.168.43.124.8880 > 192.168.43.146.7771: UDP, length 120
00:10:48.421495 IP 192.168.43.124.8880 > 192.168.43.146.7771: UDP, length 120
00:10:48.477740 IP 192.168.43.124.8880 > 192.168.43.146.7771: UDP, length 120
00:10:48.523144 IP 192.168.43.124.8880 > 192.168.43.146.7771: UDP, length 120
00:10:48.722751 IP 192.168.43.124.8880 > 192.168.43.146.7771: UDP, length 120
00:10:48.722933 IP 192.168.43.124.8880 > 192.168.43.146.7771: UDP, length 120
00:10:48.723008 IP 192.168.43.124.8880 > 192.168.43.146.7771: UDP, length 120
00:10:48.723083 IP 192.168.43.124.8880 > 192.168.43.146.7771: UDP, length 120
00:10:48.774374 IP 192.168.43.124.8880 > 192.168.43.146.7771: UDP, length 120
00:10:48.820446 IP 192.168.43.124.8880 > 192.168.43.146.7771: UDP, length 120
00:10:48.871352 IP 192.168.43.124.8880 > 192.168.43.146.7771: UDP, length 120
00:10:53.091249 IP 192.168.43.146.8880 > 192.168.43.147.7772: UDP, length 120
00:10:53.141320 IP 192.168.43.146.8880 > 192.168.43.147.7772: UDP, length 120
00:10:53.191349 IP 192.168.43.146.8880 > 192.168.43.147.7772: UDP, length 120
00:10:53.241334 IP 192.168.43.146.8880 > 192.168.43.147.7772: UDP, length 120
00:10:53.291319 IP 192.168.43.146.8880 > 192.168.43.147.7772: UDP, length 120
00:10:53.341317 IP 192.168.43.146.8880 > 192.168.43.147.7772: UDP, length 120
00:10:53.391328 IP 192.168.43.146.8880 > 192.168.43.147.7772: UDP, length 120
00:10:53.441355 IP 192.168.43.146.8880 > 192.168.43.147.7772: UDP, length 120
00:10:53.491326 IP 192.168.43.146.8880 > 192.168.43.147.7772: UDP, length 120
00:10:53.541269 IP 192.168.43.146.8880 > 192.168.43.147.7772: UDP, length 120
00:10:53.591252 IP 192.168.43.146.8880 > 192.168.43.147.7772: UDP, length 120
00:10:53.641301 IP 192.168.43.146.8880 > 192.168.43.147.7772: UDP, length 120
00:10:53.691257 IP 192.168.43.146.8880 > 192.168.43.147.7772: UDP, length 120
00:10:53.741249 IP 192.168.43.146.8880 > 192.168.43.147.7772: UDP, length 120
00:10:53.791249 IP 192.168.43.146.8880 > 192.168.43.147.7772: UDP, length 120
00:10:53.841264 IP 192.168.43.146.8880 > 192.168.43.147.7772: UDP, length 120
00:10:53.891256 IP 192.168.43.146.8880 > 192.168.43.147.7772: UDP, length 120
00:10:53.941256 IP 192.168.43.146.8880 > 192.168.43.147.7772: UDP, length 120
00:10:53.991249 IP 192.168.43.146.8880 > 192.168.43.147.7772: UDP, length 120
00:10:54.041247 IP 192.168.43.146.8880 > 192.168.43.147.7772: UDP, length 120
00:10:54.091248 IP 192.168.43.146.8880 > 192.168.43.147.7772: UDP, length 120
00:10:54.141248 IP 192.168.43.146.8880 > 192.168.43.147.7772: UDP, length 120
00:10:54.191249 IP 192.168.43.146.8880 > 192.168.43.147.7772: UDP, length 120
00:10:54.241246 IP 192.168.43.146.8880 > 192.168.43.147.7772: UDP, length 120
00:10:54.291247 IP 192.168.43.146.8880 > 192.168.43.147.7772: UDP, length 120
00:10:54.341248 IP 192.168.43.146.8880 > 192.168.43.147.7772: UDP, length 120
00:10:54.391247 IP 192.168.43.146.8880 > 192.168.43.147.7772: UDP, length 120
00:10:54.441248 IP 192.168.43.146.8880 > 192.168.43.147.7772: UDP, length 120
00:10:54.491248 IP 192.168.43.146.8880 > 192.168.43.147.7772: UDP, length 120
00:10:54.541246 IP 192.168.43.146.8880 > 192.168.43.147.7772: UDP, length 120
00:10:54.591247 IP 192.168.43.146.8880 > 192.168.43.147.7772: UDP, length 120
00:10:54.641292 IP 192.168.43.146.8880 > 192.168.43.147.7772: UDP, length 120
00:10:54.691254 IP 192.168.43.146.8880 > 192.168.43.147.7772: UDP, length 120
00:10:54.741247 IP 192.168.43.146.8880 > 192.168.43.147.7772: UDP, length 120
00:10:54.791248 IP 192.168.43.146.8880 > 192.168.43.147.7772: UDP, length 120
00:10:54.841263 IP 192.168.43.146.8880 > 192.168.43.147.7772: UDP, length 120
00:10:54.891251 IP 192.168.43.146.8880 > 192.168.43.147.7772: UDP, length 120
00:10:54.941250 IP 192.168.43.146.8880 > 192.168.43.147.7772: UDP, length 120
00:10:54.991247 IP 192.168.43.146.8880 > 192.168.43.147.7772: UDP, length 120
00:10:55.041249 IP 192.168.43.146.8880 > 192.168.43.147.7772: UDP, length 120
00:10:55.091247 IP 192.168.43.146.8880 > 192.168.43.147.7772: UDP, length 120
00:10:55.141247 IP 192.168.43.146.8880 > 192.168.43.147.7772: UDP, length 120
00:10:55.191248 IP 192.168.43.146.8880 > 192.168.43.147.7772: UDP, length 120
00:10:55.241248 IP 192.168.43.146.8880 > 192.168.43.147.7772: UDP, length 120
00:10:55.291248 IP 192.168.43.146.8880 > 192.168.43.147.7772: UDP, length 120
00:10:55.341247 IP 192.168.43.146.8880 > 192.168.43.147.7772: UDP, length 120
00:10:55.391248 IP 192.168.43.146.8880 > 192.168.43.147.7772: UDP, length 120
00:10:55.441248 IP 192.168.43.146.8880 > 192.168.43.147.7772: UDP, length 120
00:10:55.491249 IP 192.168.43.146.8880 > 192.168.43.147.7772: UDP, length 120
00:10:55.541249 IP 192.168.43.146.8880 > 192.168.43.147.7772: UDP, length 120
00:10:55.591246 IP 192.168.43.146.8880 > 192.168.43.147.7772: UDP, length 120
00:10:55.641246 IP 192.168.43.146.8880 > 192.168.43.147.7772: UDP, length 120
00:10:55.691249 IP 192.168.43.146.8880 > 192.168.43.147.7772: UDP, length 120
00:10:55.741248 IP 192.168.43.146.8880 > 192.168.43.147.7772: UDP, length 120
00:10:55.791249 IP 192.168.43.146.8880 > 192.168.43.147.7772: UDP, length 120
00:10:55.841288 IP 192.168.43.146.8880 > 192.168.43.147.7772: UDP, length 120
00:10:55.891258 IP 192.168.43.146.8880 > 192.168.43.147.7772: UDP, length 120
00:10:55.941273 IP 192.168.43.146.8880 > 192.168.43.147.7772: UDP, length 120
00:10:55.991259 IP 192.168.43.146.8880 > 192.168.43.147.7772: UDP, length 120
00:10:56.041261 IP 192.168.43.146.8880 > 192.168.43.147.7772: UDP, length 120
00:10:56.091253 IP 192.168.43.146.8880 > 192.168.43.147.7772: UDP, length 120
00:10:56.141285 IP 192.168.43.146.8880 > 192.168.43.147.7772: UDP, length 120
00:10:56.191255 IP 192.168.43.146.8880 > 192.168.43.147.7772: UDP, length 120
00:10:56.241246 IP 192.168.43.146.8880 > 192.168.43.147.7772: UDP, length 120
00:10:56.291248 IP 192.168.43.146.8880 > 192.168.43.147.7772: UDP, length 120
00:10:56.341247 IP 192.168.43.146.8880 > 192.168.43.147.7772: UDP, length 120
00:10:56.391248 IP 192.168.43.146.8880 > 192.168.43.147.7772: UDP, length 120
00:10:56.441246 IP 192.168.43.146.8880 > 192.168.43.147.7772: UDP, length 120
00:10:56.491246 IP 192.168.43.146.8880 > 192.168.43.147.7772: UDP, length 120
00:10:56.541246 IP 192.168.43.146.8880 > 192.168.43.147.7772: UDP, length 120
00:10:56.591248 IP 192.168.43.146.8880 > 192.168.43.147.7772: UDP, length 120
00:10:56.641326 IP 192.168.43.146.8880 > 192.168.43.147.7772: UDP, length 120
00:10:56.691341 IP 192.168.43.146.8880 > 192.168.43.147.7772: UDP, length 120
00:10:56.741301 IP 192.168.43.146.8880 > 192.168.43.147.7772: UDP, length 120
00:10:56.791253 IP 192.168.43.146.8880 > 192.168.43.147.7772: UDP, length 120
00:10:56.841270 IP 192.168.43.146.8880 > 192.168.43.147.7772: UDP, length 120
00:10:56.891253 IP 192.168.43.146.8880 > 192.168.43.147.7772: UDP, length 120
00:10:56.941247 IP 192.168.43.146.8880 > 192.168.43.147.7772: UDP, length 120
00:10:56.991248 IP 192.168.43.146.8880 > 192.168.43.147.7772: UDP, length 120
00:10:57.041248 IP 192.168.43.146.8880 > 192.168.43.147.7772: UDP, length 120
00:10:57.091250 IP 192.168.43.146.8880 > 192.168.43.147.7772: UDP, length 120
00:10:57.141252 IP 192.168.43.146.8880 > 192.168.43.147.7772: UDP, length 120
00:10:57.191249 IP 192.168.43.146.8880 > 192.168.43.147.7772: UDP, length 120
00:10:57.241246 IP 192.168.43.146.8880 > 192.168.43.147.7772: UDP, length 120
00:10:57.291247 IP 192.168.43.146.8880 > 192.168.43.147.7772: UDP, length 120
00:10:57.341247 IP 192.168.43.146.8880 > 192.168.43.147.7772: UDP, length 120
00:10:57.391246 IP 192.168.43.146.8880 > 192.168.43.147.7772: UDP, length 120
00:10:57.441247 IP 192.168.43.146.8880 > 192.168.43.147.7772: UDP, length 120
00:10:57.491246 IP 192.168.43.146.8880 > 192.168.43.147.7772: UDP, length 120
00:10:57.541247 IP 192.168.43.146.8880 > 192.168.43.147.7772: UDP, length 120
00:10:57.591248 IP 192.168.43.146.8880 > 192.168.43.147.7772: UDP, length 120
00:10:57.641311 IP 192.168.43.146.8880 > 192.168.43.147.7772: UDP, length 120
00:10:57.691278 IP 192.168.43.146.8880 > 192.168.43.147.7772: UDP, length 120
00:10:57.741364 IP 192.168.43.146.8880 > 192.168.43.147.7772: UDP, length 120
00:10:57.791339 IP 192.168.43.146.8880 > 192.168.43.147.7772: UDP, length 120
00:10:57.841319 IP 192.168.43.146.8880 > 192.168.43.147.7772: UDP, length 120
00:10:57.891282 IP 192.168.43.146.8880 > 192.168.43.147.7772: UDP, length 120
00:10:57.941274 IP 192.168.43.146.8880 > 192.168.43.147.7772: UDP, length 120
00:10:57.991277 IP 192.168.43.146.8880 > 192.168.43.147.7772: UDP, length 120
00:10:58.041273 IP 192.168.43.146.8880 > 192.168.43.147.7772: UDP, length 120
00:10:58.091270 IP 192.168.43.146.8880 > 192.168.43.147.7772: UDP, length 120
00:10:58.141285 IP 192.168.43.146.8880 > 192.168.43.147.7772: UDP, length 120
00:10:58.191276 IP 192.168.43.146.8880 > 192.168.43.147.7772: UDP, length 120
00:10:58.241276 IP 192.168.43.146.8880 > 192.168.43.147.7772: UDP, length 120
00:10:58.291276 IP 192.168.43.146.8880 > 192.168.43.147.7772: UDP, length 120
00:10:58.341280 IP 192.168.43.146.8880 > 192.168.43.147.7772: UDP, length 120
00:10:58.391277 IP 192.168.43.146.8880 > 192.168.43.147.7772: UDP, length 120
00:10:58.441269 IP 192.168.43.146.8880 > 192.168.43.147.7772: UDP, length 120
00:10:58.491276 IP 192.168.43.146.8880 > 192.168.43.147.7772: UDP, length 120
00:10:58.541374 IP 192.168.43.146.8880 > 192.168.43.147.7772: UDP, length 120
00:10:58.591428 IP 192.168.43.146.8880 > 192.168.43.147.7772: UDP, length 120
00:10:58.641323 IP 192.168.43.146.8880 > 192.168.43.147.7772: UDP, length 120
00:10:58.691319 IP 192.168.43.146.8880 > 192.168.43.147.7772: UDP, length 120
00:10:58.741327 IP 192.168.43.146.8880 > 192.168.43.147.7772: UDP, length 120
00:10:58.791315 IP 192.168.43.146.8880 > 192.168.43.147.7772: UDP, length 120
00:10:58.841316 IP 192.168.43.146.8880 > 192.168.43.147.7772: UDP, length 120
00:10:58.891376 IP 192.168.43.146.8880 > 192.168.43.147.7772: UDP, length 120
00:10:58.941341 IP 192.168.43.146.8880 > 192.168.43.147.7772: UDP, length 120
00:10:58.991306 IP 192.168.43.146.8880 > 192.168.43.147.7772: UDP, length 120
00:10:59.041255 IP 192.168.43.146.8880 > 192.168.43.147.7772: UDP, length 120
00:10:59.091251 IP 192.168.43.146.8880 > 192.168.43.147.7772: UDP, length 120
00:10:59.141292 IP 192.168.43.146.8880 > 192.168.43.147.7772: UDP, length 120
00:10:59.191255 IP 192.168.43.146.8880 > 192.168.43.147.7772: UDP, length 120
00:10:59.241252 IP 192.168.43.146.8880 > 192.168.43.147.7772: UDP, length 120
00:10:59.291248 IP 192.168.43.146.8880 > 192.168.43.147.7772: UDP, length 120
00:10:59.341248 IP 192.168.43.146.8880 > 192.168.43.147.7772: UDP, length 120
00:10:59.391248 IP 192.168.43.146.8880 > 192.168.43.147.7772: UDP, length 120
00:10:59.441246 IP 192.168.43.146.8880 > 192.168.43.147.7772: UDP, length 120
00:10:59.491246 IP 192.168.43.146.8880 > 192.168.43.147.7772: UDP, length 120
00:10:59.541245 IP 192.168.43.146.8880 > 192.168.43.147.7772: UDP, length 120
00:10:59.591246 IP 192.168.43.146.8880 > 192.168.43.147.7772: UDP, length 120
00:10:59.641246 IP 192.168.43.146.8880 > 192.168.43.147.7772: UDP, length 120
00:10:59.691246 IP 192.168.43.146.8880 > 192.168.43.147.7772: UDP, length 120
00:10:59.741246 IP 192.168.43.146.8880 > 192.168.43.147.7772: UDP, length 120
00:10:59.791305 IP 192.168.43.146.8880 > 192.168.43.147.7772: UDP, length 120
00:10:59.841277 IP 192.168.43.146.8880 > 192.168.43.147.7772: UDP, length 120
00:10:59.891255 IP 192.168.43.146.8880 > 192.168.43.147.7772: UDP, length 120
00:10:59.941245 IP 192.168.43.146.8880 > 192.168.43.147.7772: UDP, length 120
00:10:59.991247 IP 192.168.43.146.8880 > 192.168.43.147.7772: UDP, length 120
00:11:00.041246 IP 192.168.43.146.8880 > 192.168.43.147.7772: UDP, length 120
00:11:00.091246 IP 192.168.43.146.8880 > 192.168.43.147.7772: UDP, length 120
00:11:00.141246 IP 192.168.43.146.8880 > 192.168.43.147.7772: UDP, length 120
00:11:00.191247 IP 192.168.43.146.8880 > 192.168.43.147.7772: UDP, length 120
00:11:00.241247 IP 192.168.43.146.8880 > 192.168.43.147.7772: UDP, length 120
00:11:00.291249 IP 192.168.43.146.8880 > 192.168.43.147.7772: UDP, length 120
00:11:00.341245 IP 192.168.43.146.8880 > 192.168.43.147.7772: UDP, length 120
00:11:00.391246 IP 192.168.43.146.8880 > 192.168.43.147.7772: UDP, length 120
00:11:00.441246 IP 192.168.43.146.8880 > 192.168.43.147.7772: UDP, length 120
00:11:00.491246 IP 192.168.43.146.8880 > 192.168.43.147.7772: UDP, length 120
00:11:00.541246 IP 192.168.43.146.8880 > 192.168.43.147.7772: UDP, length 120
00:11:00.591246 IP 192.168.43.146.8880 > 192.168.43.147.7772: UDP, length 120
00:11:00.641292 IP 192.168.43.146.8880 > 192.168.43.147.7772: UDP, length 120
00:11:00.691254 IP 192.168.43.146.8880 > 192.168.43.147.7772: UDP, length 120
00:11:00.741248 IP 192.168.43.146.8880 > 192.168.43.147.7772: UDP, length 120
00:11:00.791316 IP 192.168.43.146.8880 > 192.168.43.147.7772: UDP, length 120
00:11:00.841280 IP 192.168.43.146.8880 > 192.168.43.147.7772: UDP, length 120
00:11:00.891253 IP 192.168.43.146.8880 > 192.168.43.147.7772: UDP, length 120
00:11:00.941247 IP 192.168.43.146.8880 > 192.168.43.147.7772: UDP, length 120
00:11:00.991249 IP 192.168.43.146.8880 > 192.168.43.147.7772: UDP, length 120
00:11:01.041299 IP 192.168.43.146.8880 > 192.168.43.147.7772: UDP, length 120
00:11:01.091254 IP 192.168.43.146.8880 > 192.168.43.147.7772: UDP, length 120
00:11:01.141249 IP 192.168.43.146.8880 > 192.168.43.147.7772: UDP, length 120
00:11:01.191250 IP 192.168.43.146.8880 > 192.168.43.147.7772: UDP, length 120
00:11:01.241247 IP 192.168.43.146.8880 > 192.168.43.147.7772: UDP, length 120
00:11:01.291248 IP 192.168.43.146.8880 > 192.168.43.147.7772: UDP, length 120
00:11:01.341249 IP 192.168.43.146.8880 > 192.168.43.147.7772: UDP, length 120
00:11:01.391250 IP 192.168.43.146.8880 > 192.168.43.147.7772: UDP, length 120
00:11:01.441247 IP 192.168.43.146.8880 > 192.168.43.147.7772: UDP, length 120
00:11:01.491247 IP 192.168.43.146.8880 > 192.168.43.147.7772: UDP, length 120
00:11:01.541246 IP 192.168.43.146.8880 > 192.168.43.147.7772: UDP, length 120
00:11:01.591248 IP 192.168.43.146.8880 > 192.168.43.147.7772: UDP, length 120
00:11:01.641259 IP 192.168.43.146.8880 > 192.168.43.147.7772: UDP, length 120
00:11:01.691249 IP 192.168.43.146.8880 > 192.168.43.147.7772: UDP, length 120
00:11:01.741249 IP 192.168.43.146.8880 > 192.168.43.147.7772: UDP, length 120
00:11:01.791261 IP 192.168.43.146.8880 > 192.168.43.147.7772: UDP, length 120
00:11:01.841274 IP 192.168.43.146.8880 > 192.168.43.147.7772: UDP, length 120
00:11:01.891252 IP 192.168.43.146.8880 > 192.168.43.147.7772: UDP, length 120
00:11:01.941249 IP 192.168.43.146.8880 > 192.168.43.147.7772: UDP, length 120
00:11:01.991247 IP 192.168.43.146.8880 > 192.168.43.147.7772: UDP, length 120
00:11:02.041249 IP 192.168.43.146.8880 > 192.168.43.147.7772: UDP, length 120
00:11:02.091249 IP 192.168.43.146.8880 > 192.168.43.147.7772: UDP, length 120
00:11:02.141293 IP 192.168.43.146.8880 > 192.168.43.147.7772: UDP, length 120
00:11:02.191254 IP 192.168.43.146.8880 > 192.168.43.147.7772: UDP, length 120
00:11:02.241248 IP 192.168.43.146.8880 > 192.168.43.147.7772: UDP, length 120
00:11:02.291247 IP 192.168.43.146.8880 > 192.168.43.147.7772: UDP, length 120
00:11:02.341247 IP 192.168.43.146.8880 > 192.168.43.147.7772: UDP, length 120
00:11:02.391251 IP 192.168.43.146.8880 > 192.168.43.147.7772: UDP, length 120
00:11:02.441249 IP 192.168.43.146.8880 > 192.168.43.147.7772: UDP, length 120
00:11:02.491249 IP 192.168.43.146.8880 > 192.168.43.147.7772: UDP, length 120
00:11:02.541246 IP 192.168.43.146.8880 > 192.168.43.147.7772: UDP, length 120
00:11:02.591248 IP 192.168.43.146.8880 > 192.168.43.147.7772: UDP, length 120
00:11:02.641272 IP 192.168.43.146.8880 > 192.168.43.147.7772: UDP, length 120
00:11:02.691274 IP 192.168.43.146.8880 > 192.168.43.147.7772: UDP, length 120
00:11:02.741272 IP 192.168.43.146.8880 > 192.168.43.147.7772: UDP, length 120
00:11:02.791270 IP 192.168.43.146.8880 > 192.168.43.147.7772: UDP, length 120
00:11:02.841338 IP 192.168.43.146.8880 > 192.168.43.147.7772: UDP, length 120
00:11:02.891277 IP 192.168.43.146.8880 > 192.168.43.147.7772: UDP, length 120
00:11:02.941276 IP 192.168.43.146.8880 > 192.168.43.147.7772: UDP, length 120
00:11:02.991272 IP 192.168.43.146.8880 > 192.168.43.147.7772: UDP, length 120
00:11:03.041272 IP 192.168.43.146.8880 > 192.168.43.147.7772: UDP, length 120
00:11:03.091276 IP 192.168.43.146.8880 > 192.168.43.147.7772: UDP, length 120
00:11:03.141273 IP 192.168.43.146.8880 > 192.168.43.147.7772: UDP, length 120
00:11:03.191273 IP 192.168.43.146.8880 > 192.168.43.147.7772: UDP, length 120
00:11:03.241272 IP 192.168.43.146.8880 > 192.168.43.147.7772: UDP, length 120
00:11:03.291277 IP 192.168.43.146.8880 > 192.168.43.147.7772: UDP, length 120
00:11:03.341272 IP 192.168.43.146.8880 > 192.168.43.147.7772: UDP, length 120
00:11:03.391273 IP 192.168.43.146.8880 > 192.168.43.147.7772: UDP, length 120
00:11:03.441278 IP 192.168.43.146.8880 > 192.168.43.147.7772: UDP, length 120
00:11:03.491275 IP 192.168.43.146.8880 > 192.168.43.147.7772: UDP, length 120
00:11:03.541272 IP 192.168.43.146.8880 > 192.168.43.147.7772: UDP, length 120
00:11:03.591273 IP 192.168.43.146.8880 > 192.168.43.147.7772: UDP, length 120
00:11:03.641332 IP 192.168.43.146.8880 > 192.168.43.147.7772: UDP, length 120
00:11:03.691287 IP 192.168.43.146.8880 > 192.168.43.147.7772: UDP, length 120
00:11:03.741274 IP 192.168.43.146.8880 > 192.168.43.147.7772: UDP, length 120
00:11:03.791273 IP 192.168.43.146.8880 > 192.168.43.147.7772: UDP, length 120
00:11:03.841292 IP 192.168.43.146.8880 > 192.168.43.147.7772: UDP, length 120
00:11:03.891277 IP 192.168.43.146.8880 > 192.168.43.147.7772: UDP, length 120
00:11:03.941274 IP 192.168.43.146.8880 > 192.168.43.147.7772: UDP, length 120
00:11:03.991338 IP 192.168.43.146.8880 > 192.168.43.147.7772: UDP, length 120
00:11:04.041351 IP 192.168.43.146.8880 > 192.168.43.147.7772: UDP, length 120
00:11:04.091402 IP 192.168.43.146.8880 > 192.168.43.147.7772: UDP, length 120
00:11:04.141324 IP 192.168.43.146.8880 > 192.168.43.147.7772: UDP, length 120
00:11:04.191363 IP 192.168.43.146.8880 > 192.168.43.147.7772: UDP, length 120
00:11:04.241309 IP 192.168.43.146.8880 > 192.168.43.147.7772: UDP, length 120
00:11:04.291314 IP 192.168.43.146.8880 > 192.168.43.147.7772: UDP, length 120
00:11:04.341335 IP 192.168.43.146.8880 > 192.168.43.147.7772: UDP, length 120
00:11:04.391340 IP 192.168.43.146.8880 > 192.168.43.147.7772: UDP, length 120
00:11:04.441308 IP 192.168.43.146.8880 > 192.168.43.147.7772: UDP, length 120
00:11:04.491274 IP 192.168.43.146.8880 > 192.168.43.147.7772: UDP, length 120
00:11:04.541259 IP 192.168.43.146.8880 > 192.168.43.147.7772: UDP, length 120
00:11:04.591250 IP 192.168.43.146.8880 > 192.168.43.147.7772: UDP, length 120
00:11:04.641249 IP 192.168.43.146.8880 > 192.168.43.147.7772: UDP, length 120
00:11:04.691248 IP 192.168.43.146.8880 > 192.168.43.147.7772: UDP, length 120
00:11:04.741247 IP 192.168.43.146.8880 > 192.168.43.147.7772: UDP, length 120
00:11:04.791247 IP 192.168.43.146.8880 > 192.168.43.147.7772: UDP, length 120
00:11:04.841324 IP 192.168.43.146.8880 > 192.168.43.147.7772: UDP, length 120
00:11:04.891324 IP 192.168.43.146.8880 > 192.168.43.147.7772: UDP, length 120
00:11:04.941302 IP 192.168.43.146.8880 > 192.168.43.147.7772: UDP, length 120
00:11:04.991255 IP 192.168.43.146.8880 > 192.168.43.147.7772: UDP, length 120
00:11:05.041250 IP 192.168.43.146.8880 > 192.168.43.147.7772: UDP, length 120
00:11:05.091249 IP 192.168.43.146.8880 > 192.168.43.147.7772: UDP, length 120
00:11:05.141293 IP 192.168.43.146.8880 > 192.168.43.147.7772: UDP, length 120
00:11:05.191254 IP 192.168.43.146.8880 > 192.168.43.147.7772: UDP, length 120
00:11:05.241248 IP 192.168.43.146.8880 > 192.168.43.147.7772: UDP, length 120
00:11:05.291247 IP 192.168.43.146.8880 > 192.168.43.147.7772: UDP, length 120
00:11:05.341247 IP 192.168.43.146.8880 > 192.168.43.147.7772: UDP, length 120
00:11:05.391247 IP 192.168.43.146.8880 > 192.168.43.147.7772: UDP, length 120
00:11:05.441249 IP 192.168.43.146.8880 > 192.168.43.147.7772: UDP, length 120
00:11:05.491247 IP 192.168.43.146.8880 > 192.168.43.147.7772: UDP, length 120
00:11:05.541248 IP 192.168.43.146.8880 > 192.168.43.147.7772: UDP, length 120
00:11:05.591252 IP 192.168.43.146.8880 > 192.168.43.147.7772: UDP, length 120
00:11:05.641249 IP 192.168.43.146.8880 > 192.168.43.147.7772: UDP, length 120
00:11:05.691248 IP 192.168.43.146.8880 > 192.168.43.147.7772: UDP, length 120
00:11:05.741247 IP 192.168.43.146.8880 > 192.168.43.147.7772: UDP, length 120
00:11:05.791247 IP 192.168.43.146.8880 > 192.168.43.147.7772: UDP, length 120
00:11:05.841259 IP 192.168.43.146.8880 > 192.168.43.147.7772: UDP, length 120
00:11:05.891248 IP 192.168.43.146.8880 > 192.168.43.147.7772: UDP, length 120
00:11:05.941306 IP 192.168.43.146.8880 > 192.168.43.147.7772: UDP, length 120
00:11:05.991264 IP 192.168.43.146.8880 > 192.168.43.147.7772: UDP, length 120
00:11:06.041251 IP 192.168.43.146.8880 > 192.168.43.147.7772: UDP, length 120
00:11:06.091249 IP 192.168.43.146.8880 > 192.168.43.147.7772: UDP, length 120
00:11:06.141249 IP 192.168.43.146.8880 > 192.168.43.147.7772: UDP, length 120
00:11:06.191247 IP 192.168.43.146.8880 > 192.168.43.147.7772: UDP, length 120
00:11:06.241248 IP 192.168.43.146.8880 > 192.168.43.147.7772: UDP, length 120
00:11:06.291247 IP 192.168.43.146.8880 > 192.168.43.147.7772: UDP, length 120
00:11:06.341249 IP 192.168.43.146.8880 > 192.168.43.147.7772: UDP, length 120
00:11:06.391248 IP 192.168.43.146.8880 > 192.168.43.147.7772: UDP, length 120
00:11:06.441247 IP 192.168.43.146.8880 > 192.168.43.147.7772: UDP, length 120
00:11:06.491247 IP 192.168.43.146.8880 > 192.168.43.147.7772: UDP, length 120
00:11:06.541247 IP 192.168.43.146.8880 > 192.168.43.147.7772: UDP, length 120
00:11:06.591248 IP 192.168.43.146.8880 > 192.168.43.147.7772: UDP, length 120
00:11:06.641272 IP 192.168.43.146.8880 > 192.168.43.147.7772: UDP, length 120
00:11:06.691252 IP 192.168.43.146.8880 > 192.168.43.147.7772: UDP, length 120
00:11:06.741248 IP 192.168.43.146.8880 > 192.168.43.147.7772: UDP, length 120
00:11:06.791247 IP 192.168.43.146.8880 > 192.168.43.147.7772: UDP, length 120
00:11:06.841271 IP 192.168.43.146.8880 > 192.168.43.147.7772: UDP, length 120
00:11:06.891252 IP 192.168.43.146.8880 > 192.168.43.147.7772: UDP, length 120
00:11:06.941303 IP 192.168.43.146.8880 > 192.168.43.147.7772: UDP, length 120
00:11:06.991289 IP 192.168.43.146.8880 > 192.168.43.147.7772: UDP, length 120
00:11:07.041250 IP 192.168.43.146.8880 > 192.168.43.147.7772: UDP, length 120
00:11:07.091248 IP 192.168.43.146.8880 > 192.168.43.147.7772: UDP, length 120
00:11:07.141248 IP 192.168.43.146.8880 > 192.168.43.147.7772: UDP, length 120
00:11:07.191247 IP 192.168.43.146.8880 > 192.168.43.147.7772: UDP, length 120
00:11:07.241247 IP 192.168.43.146.8880 > 192.168.43.147.7772: UDP, length 120
00:11:07.291247 IP 192.168.43.146.8880 > 192.168.43.147.7772: UDP, length 120
00:11:07.341248 IP 192.168.43.146.8880 > 192.168.43.147.7772: UDP, length 120
00:11:07.391248 IP 192.168.43.146.8880 > 192.168.43.147.7772: UDP, length 120
00:11:07.441247 IP 192.168.43.146.8880 > 192.168.43.147.7772: UDP, length 120
00:11:07.491247 IP 192.168.43.146.8880 > 192.168.43.147.7772: UDP, length 120
00:11:07.541247 IP 192.168.43.146.8880 > 192.168.43.147.7772: UDP, length 120
00:11:07.591247 IP 192.168.43.146.8880 > 192.168.43.147.7772: UDP, length 120
00:11:07.641277 IP 192.168.43.146.8880 > 192.168.43.147.7772: UDP, length 120
00:11:07.691277 IP 192.168.43.146.8880 > 192.168.43.147.7772: UDP, length 120
00:11:07.741275 IP 192.168.43.146.8880 > 192.168.43.147.7772: UDP, length 120
00:11:07.791274 IP 192.168.43.146.8880 > 192.168.43.147.7772: UDP, length 120
00:11:07.841287 IP 192.168.43.146.8880 > 192.168.43.147.7772: UDP, length 120
00:11:07.891277 IP 192.168.43.146.8880 > 192.168.43.147.7772: UDP, length 120
00:11:07.941273 IP 192.168.43.146.8880 > 192.168.43.147.7772: UDP, length 120
00:11:07.991340 IP 192.168.43.146.8880 > 192.168.43.147.7772: UDP, length 120
00:11:08.041283 IP 192.168.43.146.8880 > 192.168.43.147.7772: UDP, length 120
00:11:08.091278 IP 192.168.43.146.8880 > 192.168.43.147.7772: UDP, length 120
00:11:08.141337 IP 192.168.43.146.8880 > 192.168.43.147.7772: UDP, length 120
00:11:08.191284 IP 192.168.43.146.8880 > 192.168.43.147.7772: UDP, length 120
00:11:08.241274 IP 192.168.43.146.8880 > 192.168.43.147.7772: UDP, length 120
00:11:08.291273 IP 192.168.43.146.8880 > 192.168.43.147.7772: UDP, length 120
00:11:08.341277 IP 192.168.43.146.8880 > 192.168.43.147.7772: UDP, length 120
00:11:08.391274 IP 192.168.43.146.8880 > 192.168.43.147.7772: UDP, length 120
00:11:08.441272 IP 192.168.43.146.8880 > 192.168.43.147.7772: UDP, length 120
00:11:08.491272 IP 192.168.43.146.8880 > 192.168.43.147.7772: UDP, length 120
00:11:08.541272 IP 192.168.43.146.8880 > 192.168.43.147.7772: UDP, length 120
00:11:08.591273 IP 192.168.43.146.8880 > 192.168.43.147.7772: UDP, length 120
00:11:08.641273 IP 192.168.43.146.8880 > 192.168.43.147.7772: UDP, length 120
00:11:08.691275 IP 192.168.43.146.8880 > 192.168.43.147.7772: UDP, length 120
00:11:08.741273 IP 192.168.43.146.8880 > 192.168.43.147.7772: UDP, length 120
00:11:08.791273 IP 192.168.43.146.8880 > 192.168.43.147.7772: UDP, length 120
00:11:08.841291 IP 192.168.43.146.8880 > 192.168.43.147.7772: UDP, length 120
00:11:08.891279 IP 192.168.43.146.8880 > 192.168.43.147.7772: UDP, length 120
00:11:08.941272 IP 192.168.43.146.8880 > 192.168.43.147.7772: UDP, length 120
00:11:08.991336 IP 192.168.43.146.8880 > 192.168.43.147.7772: UDP, length 120
00:11:09.041286 IP 192.168.43.146.8880 > 192.168.43.147.7772: UDP, length 120
00:11:09.091279 IP 192.168.43.146.8880 > 192.168.43.147.7772: UDP, length 120
00:11:09.141274 IP 192.168.43.146.8880 > 192.168.43.147.7772: UDP, length 120
00:11:09.191272 IP 192.168.43.146.8880 > 192.168.43.147.7772: UDP, length 120
00:11:09.241272 IP 192.168.43.146.8880 > 192.168.43.147.7772: UDP, length 120
00:11:09.291272 IP 192.168.43.146.8880 > 192.168.43.147.7772: UDP, length 120
00:11:09.341276 IP 192.168.43.146.8880 > 192.168.43.147.7772: UDP, length 120
00:11:09.391273 IP 192.168.43.146.8880 > 192.168.43.147.7772: UDP, length 120
00:11:09.441351 IP 192.168.43.146.8880 > 192.168.43.147.7772: UDP, length 120
00:11:09.491367 IP 192.168.43.146.8880 > 192.168.43.147.7772: UDP, length 120
00:11:09.541361 IP 192.168.43.146.8880 > 192.168.43.147.7772: UDP, length 120
00:11:09.591405 IP 192.168.43.146.8880 > 192.168.43.147.7772: UDP, length 120
00:11:09.641311 IP 192.168.43.146.8880 > 192.168.43.147.7772: UDP, length 120
00:11:09.691349 IP 192.168.43.146.8880 > 192.168.43.147.7772: UDP, length 120
00:11:09.741323 IP 192.168.43.146.8880 > 192.168.43.147.7772: UDP, length 120
00:11:09.791350 IP 192.168.43.146.8880 > 192.168.43.147.7772: UDP, length 120
00:11:09.841318 IP 192.168.43.146.8880 > 192.168.43.147.7772: UDP, length 120
00:11:09.891327 IP 192.168.43.146.8880 > 192.168.43.147.7772: UDP, length 120
00:11:09.941341 IP 192.168.43.146.8880 > 192.168.43.147.7772: UDP, length 120
00:11:09.991364 IP 192.168.43.146.8880 > 192.168.43.147.7772: UDP, length 120
00:11:10.041283 IP 192.168.43.146.8880 > 192.168.43.147.7772: UDP, length 120
00:11:10.091279 IP 192.168.43.146.8880 > 192.168.43.147.7772: UDP, length 120
00:11:10.141276 IP 192.168.43.146.8880 > 192.168.43.147.7772: UDP, length 120
00:11:10.191272 IP 192.168.43.146.8880 > 192.168.43.147.7772: UDP, length 120
00:11:10.241274 IP 192.168.43.146.8880 > 192.168.43.147.7772: UDP, length 120
00:11:10.291272 IP 192.168.43.146.8880 > 192.168.43.147.7772: UDP, length 120
00:11:10.341272 IP 192.168.43.146.8880 > 192.168.43.147.7772: UDP, length 120
00:11:10.391273 IP 192.168.43.146.8880 > 192.168.43.147.7772: UDP, length 120
00:11:10.441272 IP 192.168.43.146.8880 > 192.168.43.147.7772: UDP, length 120
00:11:10.491272 IP 192.168.43.146.8880 > 192.168.43.147.7772: UDP, length 120
00:11:10.541272 IP 192.168.43.146.8880 > 192.168.43.147.7772: UDP, length 120
00:11:10.591274 IP 192.168.43.146.8880 > 192.168.43.147.7772: UDP, length 120
00:11:10.641274 IP 192.168.43.146.8880 > 192.168.43.147.7772: UDP, length 120
00:11:10.691273 IP 192.168.43.146.8880 > 192.168.43.147.7772: UDP, length 120
00:11:10.741271 IP 192.168.43.146.8880 > 192.168.43.147.7772: UDP, length 120
00:11:10.791271 IP 192.168.43.146.8880 > 192.168.43.147.7772: UDP, length 120
00:11:10.841300 IP 192.168.43.146.8880 > 192.168.43.147.7772: UDP, length 120
00:11:10.891277 IP 192.168.43.146.8880 > 192.168.43.147.7772: UDP, length 120
00:11:10.941271 IP 192.168.43.146.8880 > 192.168.43.147.7772: UDP, length 120
00:11:10.991345 IP 192.168.43.146.8880 > 192.168.43.147.7772: UDP, length 120
00:11:11.041288 IP 192.168.43.146.8880 > 192.168.43.147.7772: UDP, length 120
00:11:11.091281 IP 192.168.43.146.8880 > 192.168.43.147.7772: UDP, length 120
00:11:11.141332 IP 192.168.43.146.8880 > 192.168.43.147.7772: UDP, length 120
00:11:11.191293 IP 192.168.43.146.8880 > 192.168.43.147.7772: UDP, length 120
00:11:11.241273 IP 192.168.43.146.8880 > 192.168.43.147.7772: UDP, length 120
00:11:11.291273 IP 192.168.43.146.8880 > 192.168.43.147.7772: UDP, length 120
00:11:11.341272 IP 192.168.43.146.8880 > 192.168.43.147.7772: UDP, length 120
00:11:11.391274 IP 192.168.43.146.8880 > 192.168.43.147.7772: UDP, length 120
00:11:11.441268 IP 192.168.43.146.8880 > 192.168.43.147.7772: UDP, length 120
00:11:11.491272 IP 192.168.43.146.8880 > 192.168.43.147.7772: UDP, length 120
00:11:11.541273 IP 192.168.43.146.8880 > 192.168.43.147.7772: UDP, length 120
00:11:11.591274 IP 192.168.43.146.8880 > 192.168.43.147.7772: UDP, length 120
00:11:11.641276 IP 192.168.43.146.8880 > 192.168.43.147.7772: UDP, length 120
00:11:11.691274 IP 192.168.43.146.8880 > 192.168.43.147.7772: UDP, length 120
00:11:11.741274 IP 192.168.43.146.8880 > 192.168.43.147.7772: UDP, length 120
00:11:11.791275 IP 192.168.43.146.8880 > 192.168.43.147.7772: UDP, length 120
00:11:11.841288 IP 192.168.43.146.8880 > 192.168.43.147.7772: UDP, length 120
00:11:11.891275 IP 192.168.43.146.8880 > 192.168.43.147.7772: UDP, length 120
00:11:11.941275 IP 192.168.43.146.8880 > 192.168.43.147.7772: UDP, length 120
00:11:11.991270 IP 192.168.43.146.8880 > 192.168.43.147.7772: UDP, length 120
00:11:12.041273 IP 192.168.43.146.8880 > 192.168.43.147.7772: UDP, length 120
00:11:12.091275 IP 192.168.43.146.8880 > 192.168.43.147.7772: UDP, length 120
00:11:12.141274 IP 192.168.43.146.8880 > 192.168.43.147.7772: UDP, length 120
00:11:12.191272 IP 192.168.43.146.8880 > 192.168.43.147.7772: UDP, length 120
00:11:12.241272 IP 192.168.43.146.8880 > 192.168.43.147.7772: UDP, length 120
00:11:12.291273 IP 192.168.43.146.8880 > 192.168.43.147.7772: UDP, length 120
00:11:12.341274 IP 192.168.43.146.8880 > 192.168.43.147.7772: UDP, length 120
00:11:12.391274 IP 192.168.43.146.8880 > 192.168.43.147.7772: UDP, length 120
00:11:12.441273 IP 192.168.43.146.8880 > 192.168.43.147.7772: UDP, length 120
00:11:12.491272 IP 192.168.43.146.8880 > 192.168.43.147.7772: UDP, length 120
00:11:12.541274 IP 192.168.43.146.8880 > 192.168.43.147.7772: UDP, length 120
00:11:12.591280 IP 192.168.43.146.8880 > 192.168.43.147.7772: UDP, length 120
00:11:12.641330 IP 192.168.43.146.8880 > 192.168.43.147.7772: UDP, length 120
00:11:12.691287 IP 192.168.43.146.8880 > 192.168.43.147.7772: UDP, length 120
00:11:12.741275 IP 192.168.43.146.8880 > 192.168.43.147.7772: UDP, length 120
00:11:12.791273 IP 192.168.43.146.8880 > 192.168.43.147.7772: UDP, length 120
00:11:12.841283 IP 192.168.43.146.8880 > 192.168.43.147.7772: UDP, length 120
00:11:12.891276 IP 192.168.43.146.8880 > 192.168.43.147.7772: UDP, length 120
00:11:12.941273 IP 192.168.43.146.8880 > 192.168.43.147.7772: UDP, length 120
00:11:12.991352 IP 192.168.43.146.8880 > 192.168.43.147.7772: UDP, length 120
00:11:13.041348 IP 192.168.43.146.8880 > 192.168.43.147.7772: UDP, length 120
00:11:13.091372 IP 192.168.43.146.8880 > 192.168.43.147.7772: UDP, length 120
00:11:13.141372 IP 192.168.43.146.8880 > 192.168.43.147.7772: UDP, length 120
00:11:13.191337 IP 192.168.43.146.8880 > 192.168.43.147.7772: UDP, length 120
00:11:13.241284 IP 192.168.43.146.8880 > 192.168.43.147.7772: UDP, length 120
00:11:13.291279 IP 192.168.43.146.8880 > 192.168.43.147.7772: UDP, length 120
00:11:13.341274 IP 192.168.43.146.8880 > 192.168.43.147.7772: UDP, length 120
00:11:13.391275 IP 192.168.43.146.8880 > 192.168.43.147.7772: UDP, length 120
00:11:13.441272 IP 192.168.43.146.8880 > 192.168.43.147.7772: UDP, length 120
00:11:13.491272 IP 192.168.43.146.8880 > 192.168.43.147.7772: UDP, length 120
00:11:13.541272 IP 192.168.43.146.8880 > 192.168.43.147.7772: UDP, length 120
00:11:13.591275 IP 192.168.43.146.8880 > 192.168.43.147.7772: UDP, length 120
00:11:13.641272 IP 192.168.43.146.8880 > 192.168.43.147.7772: UDP, length 120
00:11:13.691274 IP 192.168.43.146.8880 > 192.168.43.147.7772: UDP, length 120
00:11:13.741272 IP 192.168.43.146.8880 > 192.168.43.147.7772: UDP, length 120
00:11:13.791274 IP 192.168.43.146.8880 > 192.168.43.147.7772: UDP, length 120
00:11:13.841290 IP 192.168.43.146.8880 > 192.168.43.147.7772: UDP, length 120
00:11:13.891279 IP 192.168.43.146.8880 > 192.168.43.147.7772: UDP, length 120
00:11:13.941272 IP 192.168.43.146.8880 > 192.168.43.147.7772: UDP, length 120
00:11:13.991272 IP 192.168.43.146.8880 > 192.168.43.147.7772: UDP, length 120
00:11:14.041277 IP 192.168.43.146.8880 > 192.168.43.147.7772: UDP, length 120
00:11:14.091276 IP 192.168.43.146.8880 > 192.168.43.147.7772: UDP, length 120
00:11:14.141342 IP 192.168.43.146.8880 > 192.168.43.147.7772: UDP, length 120
00:11:14.191389 IP 192.168.43.146.8880 > 192.168.43.147.7772: UDP, length 120
00:11:14.241334 IP 192.168.43.146.8880 > 192.168.43.147.7772: UDP, length 120
00:11:14.291289 IP 192.168.43.146.8880 > 192.168.43.147.7772: UDP, length 120
00:11:14.341278 IP 192.168.43.146.8880 > 192.168.43.147.7772: UDP, length 120
00:11:14.391278 IP 192.168.43.146.8880 > 192.168.43.147.7772: UDP, length 120
00:11:14.441276 IP 192.168.43.146.8880 > 192.168.43.147.7772: UDP, length 120
00:11:14.491273 IP 192.168.43.146.8880 > 192.168.43.147.7772: UDP, length 120
00:11:14.541274 IP 192.168.43.146.8880 > 192.168.43.147.7772: UDP, length 120
00:11:14.591274 IP 192.168.43.146.8880 > 192.168.43.147.7772: UDP, length 120
00:11:14.641275 IP 192.168.43.146.8880 > 192.168.43.147.7772: UDP, length 120
00:11:14.691271 IP 192.168.43.146.8880 > 192.168.43.147.7772: UDP, length 120
00:11:14.741272 IP 192.168.43.146.8880 > 192.168.43.147.7772: UDP, length 120
00:11:14.791273 IP 192.168.43.146.8880 > 192.168.43.147.7772: UDP, length 120
00:11:14.841295 IP 192.168.43.146.8880 > 192.168.43.147.7772: UDP, length 120
00:11:14.891280 IP 192.168.43.146.8880 > 192.168.43.147.7772: UDP, length 120
00:11:14.941348 IP 192.168.43.146.8880 > 192.168.43.147.7772: UDP, length 120
00:11:14.991363 IP 192.168.43.146.8880 > 192.168.43.147.7772: UDP, length 120
00:11:15.041329 IP 192.168.43.146.8880 > 192.168.43.147.7772: UDP, length 120
00:11:15.091319 IP 192.168.43.146.8880 > 192.168.43.147.7772: UDP, length 120
00:11:15.141383 IP 192.168.43.146.8880 > 192.168.43.147.7772: UDP, length 120
00:11:15.191337 IP 192.168.43.146.8880 > 192.168.43.147.7772: UDP, length 120
00:11:15.241330 IP 192.168.43.146.8880 > 192.168.43.147.7772: UDP, length 120
00:11:15.291325 IP 192.168.43.146.8880 > 192.168.43.147.7772: UDP, length 120
00:11:15.341340 IP 192.168.43.146.8880 > 192.168.43.147.7772: UDP, length 120
00:11:15.391303 IP 192.168.43.146.8880 > 192.168.43.147.7772: UDP, length 120
00:11:15.441259 IP 192.168.43.146.8880 > 192.168.43.147.7772: UDP, length 120
00:11:15.491252 IP 192.168.43.146.8880 > 192.168.43.147.7772: UDP, length 120
00:11:15.541248 IP 192.168.43.146.8880 > 192.168.43.147.7772: UDP, length 120
00:11:15.591247 IP 192.168.43.146.8880 > 192.168.43.147.7772: UDP, length 120
00:11:15.641316 IP 192.168.43.146.8880 > 192.168.43.147.7772: UDP, length 120
00:11:15.691260 IP 192.168.43.146.8880 > 192.168.43.147.7772: UDP, length 120
00:11:15.741248 IP 192.168.43.146.8880 > 192.168.43.147.7772: UDP, length 120
00:11:15.791249 IP 192.168.43.146.8880 > 192.168.43.147.7772: UDP, length 120
00:11:15.841258 IP 192.168.43.146.8880 > 192.168.43.147.7772: UDP, length 120
00:11:15.849467 IP 192.168.43.147.8880 > 192.168.43.146.7771: UDP, length 120
00:11:15.891253 IP 192.168.43.146.8880 > 192.168.43.147.7772: UDP, length 120
00:11:15.892988 IP 192.168.43.147.8880 > 192.168.43.146.7771: UDP, length 120
00:11:15.941249 IP 192.168.43.146.8880 > 192.168.43.147.7772: UDP, length 120
00:11:15.949214 IP 192.168.43.147.8880 > 192.168.43.146.7771: UDP, length 120
00:11:15.991249 IP 192.168.43.146.8880 > 192.168.43.147.7772: UDP, length 120
00:11:15.992681 IP 192.168.43.147.8880 > 192.168.43.146.7771: UDP, length 120
00:11:16.041248 IP 192.168.43.146.8880 > 192.168.43.147.7772: UDP, length 120
00:11:16.050406 IP 192.168.43.147.8880 > 192.168.43.146.7771: UDP, length 120
00:11:16.091252 IP 192.168.43.146.8880 > 192.168.43.147.7772: UDP, length 120
00:11:16.092615 IP 192.168.43.147.8880 > 192.168.43.146.7771: UDP, length 120
00:11:16.141248 IP 192.168.43.146.8880 > 192.168.43.147.7772: UDP, length 120
00:11:16.149983 IP 192.168.43.147.8880 > 192.168.43.146.7771: UDP, length 120
00:11:16.191256 IP 192.168.43.146.8880 > 192.168.43.147.7772: UDP, length 120
00:11:16.192816 IP 192.168.43.147.8880 > 192.168.43.146.7771: UDP, length 120
00:11:16.241303 IP 192.168.43.146.8880 > 192.168.43.147.7772: UDP, length 120
00:11:16.251886 IP 192.168.43.147.8880 > 192.168.43.146.7771: UDP, length 120
00:11:16.291266 IP 192.168.43.146.8880 > 192.168.43.147.7772: UDP, length 120
00:11:16.293978 IP 192.168.43.147.8880 > 192.168.43.146.7771: UDP, length 120
00:11:16.341264 IP 192.168.43.146.8880 > 192.168.43.147.7772: UDP, length 120
00:11:16.353022 IP 192.168.43.147.8880 > 192.168.43.146.7771: UDP, length 120
00:11:16.391255 IP 192.168.43.146.8880 > 192.168.43.147.7772: UDP, length 120
00:11:16.394196 IP 192.168.43.147.8880 > 192.168.43.146.7771: UDP, length 120
00:11:16.441248 IP 192.168.43.146.8880 > 192.168.43.147.7772: UDP, length 120
00:11:16.450373 IP 192.168.43.147.8880 > 192.168.43.146.7771: UDP, length 120
00:11:16.491248 IP 192.168.43.146.8880 > 192.168.43.147.7772: UDP, length 120
00:11:16.494514 IP 192.168.43.147.8880 > 192.168.43.146.7771: UDP, length 120
00:11:16.541248 IP 192.168.43.146.8880 > 192.168.43.147.7772: UDP, length 120
00:11:16.552915 IP 192.168.43.147.8880 > 192.168.43.146.7771: UDP, length 120
00:11:16.591250 IP 192.168.43.146.8880 > 192.168.43.147.7772: UDP, length 120
00:11:16.593916 IP 192.168.43.147.8880 > 192.168.43.146.7771: UDP, length 120
00:11:16.641248 IP 192.168.43.146.8880 > 192.168.43.147.7772: UDP, length 120
00:11:16.655347 IP 192.168.43.147.8880 > 192.168.43.146.7771: UDP, length 120
00:11:16.691249 IP 192.168.43.146.8880 > 192.168.43.147.7772: UDP, length 120
00:11:16.694503 IP 192.168.43.147.8880 > 192.168.43.146.7771: UDP, length 120
00:11:16.741248 IP 192.168.43.146.8880 > 192.168.43.147.7772: UDP, length 120
00:11:16.744498 IP 192.168.43.147.8880 > 192.168.43.146.7771: UDP, length 120
00:11:16.791248 IP 192.168.43.146.8880 > 192.168.43.147.7772: UDP, length 120
00:11:16.794499 IP 192.168.43.147.8880 > 192.168.43.146.7771: UDP, length 120
00:11:16.841264 IP 192.168.43.146.8880 > 192.168.43.147.7772: UDP, length 120
00:11:16.848383 IP 192.168.43.147.8880 > 192.168.43.146.7771: UDP, length 120
