23:42:16.946527 IP 192.168.43.146.8880 > 192.168.43.147.7772: UDP, length 120
23:42:16.995404 IP 192.168.43.146.8880 > 192.168.43.147.7772: UDP, length 120
23:42:17.044180 IP 192.168.43.146.8880 > 192.168.43.147.7772: UDP, length 120
23:42:17.089812 IP 192.168.43.146.8880 > 192.168.43.147.7772: UDP, length 120
23:42:17.144542 IP 192.168.43.146.8880 > 192.168.43.147.7772: UDP, length 120
23:42:17.190954 IP 192.168.43.146.8880 > 192.168.43.147.7772: UDP, length 120
23:42:17.240814 IP 192.168.43.146.8880 > 192.168.43.147.7772: UDP, length 120
23:42:17.291450 IP 192.168.43.146.8880 > 192.168.43.147.7772: UDP, length 120
23:42:17.341159 IP 192.168.43.146.8880 > 192.168.43.147.7772: UDP, length 120
23:42:17.390558 IP 192.168.43.146.8880 > 192.168.43.147.7772: UDP, length 120
23:42:17.441625 IP 192.168.43.146.8880 > 192.168.43.147.7772: UDP, length 120
23:42:17.497510 IP 192.168.43.146.8880 > 192.168.43.147.7772: UDP, length 120
23:42:17.541105 IP 192.168.43.146.8880 > 192.168.43.147.7772: UDP, length 120
23:42:17.589906 IP 192.168.43.146.8880 > 192.168.43.147.7772: UDP, length 120
23:42:17.664255 IP 192.168.43.146.8880 > 192.168.43.147.7772: UDP, length 120
23:42:17.693139 IP 192.168.43.146.8880 > 192.168.43.147.7772: UDP, length 120
23:42:17.741551 IP 192.168.43.146.8880 > 192.168.43.147.7772: UDP, length 120
23:42:17.788615 IP 192.168.43.146.8880 > 192.168.43.147.7772: UDP, length 120
23:42:17.853216 IP 192.168.43.146.8880 > 192.168.43.147.7772: UDP, length 120
23:42:17.888583 IP 192.168.43.146.8880 > 192.168.43.147.7772: UDP, length 120
23:42:17.955641 IP 192.168.43.146.8880 > 192.168.43.147.7772: UDP, length 120
23:42:17.991391 IP 192.168.43.146.8880 > 192.168.43.147.7772: UDP, length 120
23:42:18.047983 IP 192.168.43.146.8880 > 192.168.43.147.7772: UDP, length 120
23:42:18.090085 IP 192.168.43.146.8880 > 192.168.43.147.7772: UDP, length 120
23:42:18.143632 IP 192.168.43.146.8880 > 192.168.43.147.7772: UDP, length 120
23:42:18.190291 IP 192.168.43.146.8880 > 192.168.43.147.7772: UDP, length 120
23:42:18.241462 IP 192.168.43.146.8880 > 192.168.43.147.7772: UDP, length 120
23:42:18.262965 IP 192.168.43.147.8880 > 192.168.43.124.7773: UDP, length 120
23:42:18.294887 IP 192.168.43.146.8880 > 192.168.43.147.7772: UDP, length 120
23:42:18.313020 IP 192.168.43.147.8880 > 192.168.43.124.7773: UDP, length 120
23:42:18.343176 IP 192.168.43.146.8880 > 192.168.43.147.7772: UDP, length 120
23:42:18.363012 IP 192.168.43.147.8880 > 192.168.43.124.7773: UDP, length 120
23:42:18.392025 IP 192.168.43.146.8880 > 192.168.43.147.7772: UDP, length 120
23:42:18.413008 IP 192.168.43.147.8880 > 192.168.43.124.7773: UDP, length 120
23:42:18.446395 IP 192.168.43.146.8880 > 192.168.43.147.7772: UDP, length 120
23:42:18.463003 IP 192.168.43.147.8880 > 192.168.43.124.7773: UDP, length 120
23:42:18.503382 IP 192.168.43.146.8880 > 192.168.43.147.7772: UDP, length 120
23:42:18.512999 IP 192.168.43.147.8880 > 192.168.43.124.7773: UDP, length 120
23:42:18.559762 IP 192.168.43.146.8880 > 192.168.43.147.7772: UDP, length 120
23:42:18.562996 IP 192.168.43.147.8880 > 192.168.43.124.7773: UDP, length 120
23:42:18.590153 IP 192.168.43.146.8880 > 192.168.43.147.7772: UDP, length 120
23:42:18.612999 IP 192.168.43.147.8880 > 192.168.43.124.7773: UDP, length 120
23:42:18.640040 IP 192.168.43.146.8880 > 192.168.43.147.7772: UDP, length 120
23:42:18.662999 IP 192.168.43.147.8880 > 192.168.43.124.7773: UDP, length 120
23:42:18.690576 IP 192.168.43.146.8880 > 192.168.43.147.7772: UDP, length 120
23:42:18.712999 IP 192.168.43.147.8880 > 192.168.43.124.7773: UDP, length 120
23:42:18.754571 IP 192.168.43.146.8880 > 192.168.43.147.7772: UDP, length 120
23:42:18.763041 IP 192.168.43.147.8880 > 192.168.43.124.7773: UDP, length 120
23:42:18.790144 IP 192.168.43.146.8880 > 192.168.43.147.7772: UDP, length 120
23:42:18.813003 IP 192.168.43.147.8880 > 192.168.43.124.7773: UDP, length 120
23:42:18.842171 IP 192.168.43.146.8880 > 192.168.43.147.7772: UDP, length 120
23:42:18.863001 IP 192.168.43.147.8880 > 192.168.43.124.7773: UDP, length 120
23:42:18.891119 IP 192.168.43.146.8880 > 192.168.43.147.7772: UDP, length 120
23:42:18.913002 IP 192.168.43.147.8880 > 192.168.43.124.7773: UDP, length 120
23:42:18.940065 IP 192.168.43.146.8880 > 192.168.43.147.7772: UDP, length 120
23:42:18.963003 IP 192.168.43.147.8880 > 192.168.43.124.7773: UDP, length 120
23:42:18.992583 IP 192.168.43.146.8880 > 192.168.43.147.7772: UDP, length 120
23:42:19.013028 IP 192.168.43.147.8880 > 192.168.43.124.7773: UDP, length 120
23:42:19.057646 IP 192.168.43.146.8880 > 192.168.43.147.7772: UDP, length 120
23:42:19.063000 IP 192.168.43.147.8880 > 192.168.43.124.7773: UDP, length 120
23:42:19.100206 IP 192.168.43.146.8880 > 192.168.43.147.7772: UDP, length 120
23:42:19.112999 IP 192.168.43.147.8880 > 192.168.43.124.7773: UDP, length 120
23:42:19.151838 IP 192.168.43.146.8880 > 192.168.43.147.7772: UDP, length 120
23:42:19.162999 IP 192.168.43.147.8880 > 192.168.43.124.7773: UDP, length 120
23:42:19.196146 IP 192.168.43.146.8880 > 192.168.43.147.7772: UDP, length 120
23:42:19.212999 IP 192.168.43.147.8880 > 192.168.43.124.7773: UDP, length 120
23:42:19.239371 IP 192.168.43.146.8880 > 192.168.43.147.7772: UDP, length 120
23:42:19.262999 IP 192.168.43.147.8880 > 192.168.43.124.7773: UDP, length 120
23:42:19.291768 IP 192.168.43.146.8880 > 192.168.43.147.7772: UDP, length 120
23:42:19.312999 IP 192.168.43.147.8880 > 192.168.43.124.7773: UDP, length 120
23:42:19.351170 IP 192.168.43.146.8880 > 192.168.43.147.7772: UDP, length 120
23:42:19.363000 IP 192.168.43.147.8880 > 192.168.43.124.7773: UDP, length 120
23:42:19.389698 IP 192.168.43.146.8880 > 192.168.43.147.7772: UDP, length 120
23:42:19.413002 IP 192.168.43.147.8880 > 192.168.43.124.7773: UDP, length 120
23:42:19.449381 IP 192.168.43.146.8880 > 192.168.43.147.7772: UDP, length 120
23:42:19.463023 IP 192.168.43.147.8880 > 192.168.43.124.7773: UDP, length 120
23:42:19.490899 IP 192.168.43.146.8880 > 192.168.43.147.7772: UDP, length 120
23:42:19.513004 IP 192.168.43.147.8880 > 192.168.43.124.7773: UDP, length 120
23:42:19.544078 IP 192.168.43.146.8880 > 192.168.43.147.7772: UDP, length 120
23:42:19.563002 IP 192.168.43.147.8880 > 192.168.43.124.7773: UDP, length 120
23:42:19.591578 IP 192.168.43.146.8880 > 192.168.43.147.7772: UDP, length 120
23:42:19.612999 IP 192.168.43.147.8880 > 192.168.43.124.7773: UDP, length 120
23:42:19.639941 IP 192.168.43.146.8880 > 192.168.43.147.7772: UDP, length 120
23:42:19.663000 IP 192.168.43.147.8880 > 192.168.43.124.7773: UDP, length 120
23:42:19.689896 IP 192.168.43.146.8880 > 192.168.43.147.7772: UDP, length 120
23:42:19.712999 IP 192.168.43.147.8880 > 192.168.43.124.7773: UDP, length 120
23:42:19.742778 IP 192.168.43.146.8880 > 192.168.43.147.7772: UDP, length 120
23:42:19.762999 IP 192.168.43.147.8880 > 192.168.43.124.7773: UDP, length 120
23:42:19.798773 IP 192.168.43.146.8880 > 192.168.43.147.7772: UDP, length 120
23:42:19.813000 IP 192.168.43.147.8880 > 192.168.43.124.7773: UDP, length 120
23:42:19.842905 IP 192.168.43.146.8880 > 192.168.43.147.7772: UDP, length 120
23:42:19.863000 IP 192.168.43.147.8880 > 192.168.43.124.7773: UDP, length 120
23:42:19.891106 IP 192.168.43.146.8880 > 192.168.43.147.7772: UDP, length 120
23:42:19.913000 IP 192.168.43.147.8880 > 192.168.43.124.7773: UDP, length 120
23:42:19.938731 IP 192.168.43.146.8880 > 192.168.43.147.7772: UDP, length 120
23:42:19.962999 IP 192.168.43.147.8880 > 192.168.43.124.7773: UDP, length 120
23:42:19.995945 IP 192.168.43.146.8880 > 192.168.43.147.7772: UDP, length 120
23:42:20.013019 IP 192.168.43.147.8880 > 192.168.43.124.7773: UDP, length 120
23:42:20.045010 IP 192.168.43.146.8880 > 192.168.43.147.7772: UDP, length 120
23:42:20.063003 IP 192.168.43.147.8880 > 192.168.43.124.7773: UDP, length 120
23:42:20.093817 IP 192.168.43.146.8880 > 192.168.43.147.7772: UDP, length 120
23:42:20.113000 IP 192.168.43.147.8880 > 192.168.43.124.7773: UDP, length 120
23:42:20.143802 IP 192.168.43.146.8880 > 192.168.43.147.7772: UDP, length 120
23:42:20.163002 IP 192.168.43.147.8880 > 192.168.43.124.7773: UDP, length 120
23:42:20.194315 IP 192.168.43.146.8880 > 192.168.43.147.7772: UDP, length 120
23:42:20.212997 IP 192.168.43.147.8880 > 192.168.43.124.7773: UDP, length 120
23:42:20.240099 IP 192.168.43.146.8880 > 192.168.43.147.7772: UDP, length 120
23:42:20.263051 IP 192.168.43.147.8880 > 192.168.43.124.7773: UDP, length 120
23:42:20.300854 IP 192.168.43.146.8880 > 192.168.43.147.7772: UDP, length 120
23:42:20.313011 IP 192.168.43.147.8880 > 192.168.43.124.7773: UDP, length 120
23:42:20.340331 IP 192.168.43.146.8880 > 192.168.43.147.7772: UDP, length 120
23:42:20.362998 IP 192.168.43.147.8880 > 192.168.43.124.7773: UDP, length 120
23:42:20.393189 IP 192.168.43.146.8880 > 192.168.43.147.7772: UDP, length 120
23:42:20.412999 IP 192.168.43.147.8880 > 192.168.43.124.7773: UDP, length 120
23:42:20.443833 IP 192.168.43.146.8880 > 192.168.43.147.7772: UDP, length 120
23:42:20.463002 IP 192.168.43.147.8880 > 192.168.43.124.7773: UDP, length 120
23:42:20.493514 IP 192.168.43.146.8880 > 192.168.43.147.7772: UDP, length 120
23:42:20.513008 IP 192.168.43.147.8880 > 192.168.43.124.7773: UDP, length 120
23:42:20.543138 IP 192.168.43.146.8880 > 192.168.43.147.7772: UDP, length 120
23:42:20.563003 IP 192.168.43.147.8880 > 192.168.43.124.7773: UDP, length 120
23:42:20.595978 IP 192.168.43.146.8880 > 192.168.43.147.7772: UDP, length 120
23:42:20.612999 IP 192.168.43.147.8880 > 192.168.43.124.7773: UDP, length 120
23:42:20.645943 IP 192.168.43.146.8880 > 192.168.43.147.7772: UDP, length 120
23:42:20.662999 IP 192.168.43.147.8880 > 192.168.43.124.7773: UDP, length 120
23:42:20.694607 IP 192.168.43.146.8880 > 192.168.43.147.7772: UDP, length 120
23:42:20.713005 IP 192.168.43.147.8880 > 192.168.43.124.7773: UDP, length 120
23:42:20.745598 IP 192.168.43.146.8880 > 192.168.43.147.7772: UDP, length 120
23:42:20.762999 IP 192.168.43.147.8880 > 192.168.43.124.7773: UDP, length 120
23:42:20.794531 IP 192.168.43.146.8880 > 192.168.43.147.7772: UDP, length 120
23:42:20.813000 IP 192.168.43.147.8880 > 192.168.43.124.7773: UDP, length 120
23:42:20.843304 IP 192.168.43.146.8880 > 192.168.43.147.7772: UDP, length 120
23:42:20.862998 IP 192.168.43.147.8880 > 192.168.43.124.7773: UDP, length 120
23:42:20.891420 IP 192.168.43.146.8880 > 192.168.43.147.7772: UDP, length 120
23:42:20.912997 IP 192.168.43.147.8880 > 192.168.43.124.7773: UDP, length 120
23:42:20.943878 IP 192.168.43.146.8880 > 192.168.43.147.7772: UDP, length 120
23:42:20.963000 IP 192.168.43.147.8880 > 192.168.43.124.7773: UDP, length 120
23:42:20.994740 IP 192.168.43.146.8880 > 192.168.43.147.7772: UDP, length 120
23:42:21.013024 IP 192.168.43.147.8880 > 192.168.43.124.7773: UDP, length 120
23:42:21.042556 IP 192.168.43.146.8880 > 192.168.43.147.7772: UDP, length 120
23:42:21.063002 IP 192.168.43.147.8880 > 192.168.43.124.7773: UDP, length 120
23:42:21.103006 IP 192.168.43.146.8880 > 192.168.43.147.7772: UDP, length 120
23:42:21.112998 IP 192.168.43.147.8880 > 192.168.43.124.7773: UDP, length 120
23:42:21.143310 IP 192.168.43.146.8880 > 192.168.43.147.7772: UDP, length 120
23:42:21.162998 IP 192.168.43.147.8880 > 192.168.43.124.7773: UDP, length 120
23:42:21.193240 IP 192.168.43.146.8880 > 192.168.43.147.7772: UDP, length 120
23:42:21.213005 IP 192.168.43.147.8880 > 192.168.43.124.7773: UDP, length 120
23:42:21.243707 IP 192.168.43.146.8880 > 192.168.43.147.7772: UDP, length 120
23:42:21.263002 IP 192.168.43.147.8880 > 192.168.43.124.7773: UDP, length 120
23:42:21.303635 IP 192.168.43.146.8880 > 192.168.43.147.7772: UDP, length 120
23:42:21.312998 IP 192.168.43.147.8880 > 192.168.43.124.7773: UDP, length 120
23:42:21.349275 IP 192.168.43.146.8880 > 192.168.43.147.7772: UDP, length 120
23:42:21.362996 IP 192.168.43.147.8880 > 192.168.43.124.7773: UDP, length 120
23:42:21.393574 IP 192.168.43.146.8880 > 192.168.43.147.7772: UDP, length 120
23:42:21.412998 IP 192.168.43.147.8880 > 192.168.43.124.7773: UDP, length 120
23:42:21.445017 IP 192.168.43.146.8880 > 192.168.43.147.7772: UDP, length 120
23:42:21.463004 IP 192.168.43.147.8880 > 192.168.43.124.7773: UDP, length 120
23:42:21.493759 IP 192.168.43.146.8880 > 192.168.43.147.7772: UDP, length 120
23:42:21.513012 IP 192.168.43.147.8880 > 192.168.43.124.7773: UDP, length 120
23:42:21.543461 IP 192.168.43.146.8880 > 192.168.43.147.7772: UDP, length 120
23:42:21.563009 IP 192.168.43.147.8880 > 192.168.43.124.7773: UDP, length 120
23:42:21.596489 IP 192.168.43.146.8880 > 192.168.43.147.7772: UDP, length 120
23:42:21.613019 IP 192.168.43.147.8880 > 192.168.43.124.7773: UDP, length 120
23:42:21.642661 IP 192.168.43.146.8880 > 192.168.43.147.7772: UDP, length 120
23:42:21.663016 IP 192.168.43.147.8880 > 192.168.43.124.7773: UDP, length 120
23:42:21.697178 IP 192.168.43.146.8880 > 192.168.43.147.7772: UDP, length 120
23:42:21.713000 IP 192.168.43.147.8880 > 192.168.43.124.7773: UDP, length 120
23:42:21.744646 IP 192.168.43.146.8880 > 192.168.43.147.7772: UDP, length 120
23:42:21.763041 IP 192.168.43.147.8880 > 192.168.43.124.7773: UDP, length 120
23:42:21.799421 IP 192.168.43.146.8880 > 192.168.43.147.7772: UDP, length 120
23:42:21.813018 IP 192.168.43.147.8880 > 192.168.43.124.7773: UDP, length 120
23:42:21.846701 IP 192.168.43.146.8880 > 192.168.43.147.7772: UDP, length 120
23:42:21.863005 IP 192.168.43.147.8880 > 192.168.43.124.7773: UDP, length 120
23:42:21.890736 IP 192.168.43.146.8880 > 192.168.43.147.7772: UDP, length 120
23:42:21.913016 IP 192.168.43.147.8880 > 192.168.43.124.7773: UDP, length 120
23:42:21.943285 IP 192.168.43.146.8880 > 192.168.43.147.7772: UDP, length 120
23:42:21.963014 IP 192.168.43.147.8880 > 192.168.43.124.7773: UDP, length 120
23:42:21.989083 IP 192.168.43.146.8880 > 192.168.43.147.7772: UDP, length 120
23:42:22.013024 IP 192.168.43.147.8880 > 192.168.43.124.7773: UDP, length 120
23:42:22.042659 IP 192.168.43.146.8880 > 192.168.43.147.7772: UDP, length 120
23:42:22.063000 IP 192.168.43.147.8880 > 192.168.43.124.7773: UDP, length 120
23:42:22.095540 IP 192.168.43.146.8880 > 192.168.43.147.7772: UDP, length 120
23:42:22.112999 IP 192.168.43.147.8880 > 192.168.43.124.7773: UDP, length 120
23:42:22.144060 IP 192.168.43.146.8880 > 192.168.43.147.7772: UDP, length 120
23:42:22.162999 IP 192.168.43.147.8880 > 192.168.43.124.7773: UDP, length 120
23:42:22.195728 IP 192.168.43.146.8880 > 192.168.43.147.7772: UDP, length 120
23:42:22.212999 IP 192.168.43.147.8880 > 192.168.43.124.7773: UDP, length 120
23:42:22.243930 IP 192.168.43.146.8880 > 192.168.43.147.7772: UDP, length 120
23:42:22.262999 IP 192.168.43.147.8880 > 192.168.43.124.7773: UDP, length 120
23:42:22.293928 IP 192.168.43.146.8880 > 192.168.43.147.7772: UDP, length 120
23:42:22.312998 IP 192.168.43.147.8880 > 192.168.43.124.7773: UDP, length 120
23:42:22.344114 IP 192.168.43.146.8880 > 192.168.43.147.7772: UDP, length 120
23:42:22.362999 IP 192.168.43.147.8880 > 192.168.43.124.7773: UDP, length 120
23:42:22.400846 IP 192.168.43.146.8880 > 192.168.43.147.7772: UDP, length 120
23:42:22.413009 IP 192.168.43.147.8880 > 192.168.43.124.7773: UDP, length 120
23:42:22.443332 IP 192.168.43.146.8880 > 192.168.43.147.7772: UDP, length 120
23:42:22.463002 IP 192.168.43.147.8880 > 192.168.43.124.7773: UDP, length 120
23:42:22.491158 IP 192.168.43.146.8880 > 192.168.43.147.7772: UDP, length 120
23:42:22.512999 IP 192.168.43.147.8880 > 192.168.43.124.7773: UDP, length 120
23:42:22.543515 IP 192.168.43.146.8880 > 192.168.43.147.7772: UDP, length 120
23:42:22.563079 IP 192.168.43.147.8880 > 192.168.43.124.7773: UDP, length 120
23:42:22.593329 IP 192.168.43.146.8880 > 192.168.43.147.7772: UDP, length 120
23:42:22.613039 IP 192.168.43.147.8880 > 192.168.43.124.7773: UDP, length 120
23:42:22.643475 IP 192.168.43.146.8880 > 192.168.43.147.7772: UDP, length 120
23:42:22.663018 IP 192.168.43.147.8880 > 192.168.43.124.7773: UDP, length 120
23:42:22.693559 IP 192.168.43.146.8880 > 192.168.43.147.7772: UDP, length 120
23:42:22.713003 IP 192.168.43.147.8880 > 192.168.43.124.7773: UDP, length 120
23:42:22.743813 IP 192.168.43.146.8880 > 192.168.43.147.7772: UDP, length 120
23:42:22.763000 IP 192.168.43.147.8880 > 192.168.43.124.7773: UDP, length 120
23:42:22.795856 IP 192.168.43.146.8880 > 192.168.43.147.7772: UDP, length 120
23:42:22.812998 IP 192.168.43.147.8880 > 192.168.43.124.7773: UDP, length 120
23:42:22.848631 IP 192.168.43.146.8880 > 192.168.43.147.7772: UDP, length 120
23:42:22.862994 IP 192.168.43.147.8880 > 192.168.43.124.7773: UDP, length 120
23:42:22.890569 IP 192.168.43.146.8880 > 192.168.43.147.7772: UDP, length 120
23:42:22.913000 IP 192.168.43.147.8880 > 192.168.43.124.7773: UDP, length 120
23:42:22.949308 IP 192.168.43.146.8880 > 192.168.43.147.7772: UDP, length 120
23:42:22.963000 IP 192.168.43.147.8880 > 192.168.43.124.7773: UDP, length 120
23:42:22.990365 IP 192.168.43.146.8880 > 192.168.43.147.7772: UDP, length 120
23:42:23.013017 IP 192.168.43.147.8880 > 192.168.43.124.7773: UDP, length 120
23:42:23.042773 IP 192.168.43.146.8880 > 192.168.43.147.7772: UDP, length 120
23:42:23.063000 IP 192.168.43.147.8880 > 192.168.43.124.7773: UDP, length 120
23:42:23.090496 IP 192.168.43.146.8880 > 192.168.43.147.7772: UDP, length 120
23:42:23.112996 IP 192.168.43.147.8880 > 192.168.43.124.7773: UDP, length 120
23:42:23.143205 IP 192.168.43.146.8880 > 192.168.43.147.7772: UDP, length 120
23:42:23.162997 IP 192.168.43.147.8880 > 192.168.43.124.7773: UDP, length 120
23:42:23.190266 IP 192.168.43.146.8880 > 192.168.43.147.7772: UDP, length 120
23:42:23.213004 IP 192.168.43.147.8880 > 192.168.43.124.7773: UDP, length 120
23:42:23.237435 IP 192.168.43.146.8880 > 192.168.43.147.7772: UDP, length 120
23:42:23.263052 IP 192.168.43.147.8880 > 192.168.43.124.7773: UDP, length 120
23:42:23.293722 IP 192.168.43.146.8880 > 192.168.43.147.7772: UDP, length 120
23:42:23.313008 IP 192.168.43.147.8880 > 192.168.43.124.7773: UDP, length 120
23:42:23.344200 IP 192.168.43.146.8880 > 192.168.43.147.7772: UDP, length 120
23:42:23.362999 IP 192.168.43.147.8880 > 192.168.43.124.7773: UDP, length 120
23:42:23.398279 IP 192.168.43.146.8880 > 192.168.43.147.7772: UDP, length 120
23:42:23.412993 IP 192.168.43.147.8880 > 192.168.43.124.7773: UDP, length 120
23:42:23.445292 IP 192.168.43.146.8880 > 192.168.43.147.7772: UDP, length 120
23:42:23.462997 IP 192.168.43.147.8880 > 192.168.43.124.7773: UDP, length 120
23:42:23.495302 IP 192.168.43.146.8880 > 192.168.43.147.7772: UDP, length 120
23:42:23.512995 IP 192.168.43.147.8880 > 192.168.43.124.7773: UDP, length 120
23:42:23.546766 IP 192.168.43.146.8880 > 192.168.43.147.7772: UDP, length 120
23:42:23.563001 IP 192.168.43.147.8880 > 192.168.43.124.7773: UDP, length 120
23:42:23.600539 IP 192.168.43.146.8880 > 192.168.43.147.7772: UDP, length 120
23:42:23.612993 IP 192.168.43.147.8880 > 192.168.43.124.7773: UDP, length 120
23:42:23.644404 IP 192.168.43.146.8880 > 192.168.43.147.7772: UDP, length 120
23:42:23.663004 IP 192.168.43.147.8880 > 192.168.43.124.7773: UDP, length 120
23:42:23.690414 IP 192.168.43.146.8880 > 192.168.43.147.7772: UDP, length 120
23:42:23.713005 IP 192.168.43.147.8880 > 192.168.43.124.7773: UDP, length 120
23:42:23.743188 IP 192.168.43.146.8880 > 192.168.43.147.7772: UDP, length 120
23:42:23.763000 IP 192.168.43.147.8880 > 192.168.43.124.7773: UDP, length 120
23:42:23.794503 IP 192.168.43.146.8880 > 192.168.43.147.7772: UDP, length 120
23:42:23.812996 IP 192.168.43.147.8880 > 192.168.43.124.7773: UDP, length 120
23:42:23.844978 IP 192.168.43.146.8880 > 192.168.43.147.7772: UDP, length 120
23:42:23.862997 IP 192.168.43.147.8880 > 192.168.43.124.7773: UDP, length 120
23:42:23.890705 IP 192.168.43.146.8880 > 192.168.43.147.7772: UDP, length 120
23:42:23.912996 IP 192.168.43.147.8880 > 192.168.43.124.7773: UDP, length 120
23:42:23.949787 IP 192.168.43.146.8880 > 192.168.43.147.7772: UDP, length 120
23:42:23.962993 IP 192.168.43.147.8880 > 192.168.43.124.7773: UDP, length 120
23:42:23.985761 IP 192.168.43.146.8880 > 192.168.43.147.7772: UDP, length 120
23:42:24.013016 IP 192.168.43.147.8880 > 192.168.43.124.7773: UDP, length 120
23:42:24.043570 IP 192.168.43.146.8880 > 192.168.43.147.7772: UDP, length 120
23:42:24.062999 IP 192.168.43.147.8880 > 192.168.43.124.7773: UDP, length 120
23:42:24.093899 IP 192.168.43.146.8880 > 192.168.43.147.7772: UDP, length 120
23:42:24.112997 IP 192.168.43.147.8880 > 192.168.43.124.7773: UDP, length 120
23:42:24.143678 IP 192.168.43.146.8880 > 192.168.43.147.7772: UDP, length 120
23:42:24.162997 IP 192.168.43.147.8880 > 192.168.43.124.7773: UDP, length 120
23:42:24.192461 IP 192.168.43.146.8880 > 192.168.43.147.7772: UDP, length 120
23:42:24.212994 IP 192.168.43.147.8880 > 192.168.43.124.7773: UDP, length 120
23:42:24.244331 IP 192.168.43.146.8880 > 192.168.43.147.7772: UDP, length 120
23:42:24.262997 IP 192.168.43.147.8880 > 192.168.43.124.7773: UDP, length 120
23:42:24.294654 IP 192.168.43.146.8880 > 192.168.43.147.7772: UDP, length 120
23:42:24.312996 IP 192.168.43.147.8880 > 192.168.43.124.7773: UDP, length 120
23:42:24.346455 IP 192.168.43.146.8880 > 192.168.43.147.7772: UDP, length 120
23:42:24.362996 IP 192.168.43.147.8880 > 192.168.43.124.7773: UDP, length 120
23:42:24.401821 IP 192.168.43.146.8880 > 192.168.43.147.7772: UDP, length 120
23:42:24.412991 IP 192.168.43.147.8880 > 192.168.43.124.7773: UDP, length 120
23:42:24.443970 IP 192.168.43.146.8880 > 192.168.43.147.7772: UDP, length 120
23:42:24.463005 IP 192.168.43.147.8880 > 192.168.43.124.7773: UDP, length 120
23:42:24.499646 IP 192.168.43.146.8880 > 192.168.43.147.7772: UDP, length 120
23:42:24.512996 IP 192.168.43.147.8880 > 192.168.43.124.7773: UDP, length 120
23:42:24.544090 IP 192.168.43.146.8880 > 192.168.43.147.7772: UDP, length 120
23:42:24.562996 IP 192.168.43.147.8880 > 192.168.43.124.7773: UDP, length 120
23:42:24.594189 IP 192.168.43.146.8880 > 192.168.43.147.7772: UDP, length 120
23:42:24.613003 IP 192.168.43.147.8880 > 192.168.43.124.7773: UDP, length 120
23:42:24.643928 IP 192.168.43.146.8880 > 192.168.43.147.7772: UDP, length 120
23:42:24.662994 IP 192.168.43.147.8880 > 192.168.43.124.7773: UDP, length 120
23:42:24.690736 IP 192.168.43.146.8880 > 192.168.43.147.7772: UDP, length 120
23:42:24.713001 IP 192.168.43.147.8880 > 192.168.43.124.7773: UDP, length 120
23:42:24.744039 IP 192.168.43.146.8880 > 192.168.43.147.7772: UDP, length 120
23:42:24.763050 IP 192.168.43.147.8880 > 192.168.43.124.7773: UDP, length 120
23:42:24.794233 IP 192.168.43.146.8880 > 192.168.43.147.7772: UDP, length 120
23:42:24.813029 IP 192.168.43.147.8880 > 192.168.43.124.7773: UDP, length 120
23:42:24.844175 IP 192.168.43.146.8880 > 192.168.43.147.7772: UDP, length 120
23:42:24.863001 IP 192.168.43.147.8880 > 192.168.43.124.7773: UDP, length 120
23:42:24.895366 IP 192.168.43.146.8880 > 192.168.43.147.7772: UDP, length 120
23:42:24.912999 IP 192.168.43.147.8880 > 192.168.43.124.7773: UDP, length 120
23:42:24.955775 IP 192.168.43.146.8880 > 192.168.43.147.7772: UDP, length 120
23:42:24.962994 IP 192.168.43.147.8880 > 192.168.43.124.7773: UDP, length 120
23:42:24.996005 IP 192.168.43.146.8880 > 192.168.43.147.7772: UDP, length 120
23:42:25.013024 IP 192.168.43.147.8880 > 192.168.43.124.7773: UDP, length 120
23:42:25.048917 IP 192.168.43.146.8880 > 192.168.43.147.7772: UDP, length 120
23:42:25.063003 IP 192.168.43.147.8880 > 192.168.43.124.7773: UDP, length 120
23:42:25.090701 IP 192.168.43.146.8880 > 192.168.43.147.7772: UDP, length 120
23:42:25.113001 IP 192.168.43.147.8880 > 192.168.43.124.7773: UDP, length 120
23:42:25.151153 IP 192.168.43.146.8880 > 192.168.43.147.7772: UDP, length 120
23:42:25.163002 IP 192.168.43.147.8880 > 192.168.43.124.7773: UDP, length 120
23:42:25.193568 IP 192.168.43.146.8880 > 192.168.43.147.7772: UDP, length 120
23:42:25.213000 IP 192.168.43.147.8880 > 192.168.43.124.7773: UDP, length 120
23:42:25.244121 IP 192.168.43.146.8880 > 192.168.43.147.7772: UDP, length 120
23:42:25.262999 IP 192.168.43.147.8880 > 192.168.43.124.7773: UDP, length 120
23:42:25.290526 IP 192.168.43.146.8880 > 192.168.43.147.7772: UDP, length 120
23:42:25.313008 IP 192.168.43.147.8880 > 192.168.43.124.7773: UDP, length 120
23:42:25.343690 IP 192.168.43.146.8880 > 192.168.43.147.7772: UDP, length 120
23:42:25.362997 IP 192.168.43.147.8880 > 192.168.43.124.7773: UDP, length 120
23:42:25.392941 IP 192.168.43.146.8880 > 192.168.43.147.7772: UDP, length 120
23:42:25.412991 IP 192.168.43.147.8880 > 192.168.43.124.7773: UDP, length 120
23:42:25.450360 IP 192.168.43.146.8880 > 192.168.43.147.7772: UDP, length 120
23:42:25.463020 IP 192.168.43.147.8880 > 192.168.43.124.7773: UDP, length 120
23:42:25.493891 IP 192.168.43.146.8880 > 192.168.43.147.7772: UDP, length 120
23:42:25.513002 IP 192.168.43.147.8880 > 192.168.43.124.7773: UDP, length 120
23:42:25.546903 IP 192.168.43.146.8880 > 192.168.43.147.7772: UDP, length 120
23:42:25.563005 IP 192.168.43.147.8880 > 192.168.43.124.7773: UDP, length 120
23:42:25.600755 IP 192.168.43.146.8880 > 192.168.43.147.7772: UDP, length 120
23:42:25.613000 IP 192.168.43.147.8880 > 192.168.43.124.7773: UDP, length 120
23:42:25.646882 IP 192.168.43.146.8880 > 192.168.43.147.7772: UDP, length 120
23:42:25.662995 IP 192.168.43.147.8880 > 192.168.43.124.7773: UDP, length 120
23:42:25.692646 IP 192.168.43.146.8880 > 192.168.43.147.7772: UDP, length 120
23:42:25.713003 IP 192.168.43.147.8880 > 192.168.43.124.7773: UDP, length 120
23:42:25.745909 IP 192.168.43.146.8880 > 192.168.43.147.7772: UDP, length 120
23:42:25.763002 IP 192.168.43.147.8880 > 192.168.43.124.7773: UDP, length 120
23:42:25.792981 IP 192.168.43.146.8880 > 192.168.43.147.7772: UDP, length 120
23:42:25.813004 IP 192.168.43.147.8880 > 192.168.43.124.7773: UDP, length 120
23:42:25.845151 IP 192.168.43.146.8880 > 192.168.43.147.7772: UDP, length 120
23:42:25.863005 IP 192.168.43.147.8880 > 192.168.43.124.7773: UDP, length 120
23:42:25.892997 IP 192.168.43.146.8880 > 192.168.43.147.7772: UDP, length 120
23:42:25.912997 IP 192.168.43.147.8880 > 192.168.43.124.7773: UDP, length 120
23:42:25.945347 IP 192.168.43.146.8880 > 192.168.43.147.7772: UDP, length 120
23:42:25.962993 IP 192.168.43.147.8880 > 192.168.43.124.7773: UDP, length 120
23:42:25.993080 IP 192.168.43.146.8880 > 192.168.43.147.7772: UDP, length 120
23:42:26.013019 IP 192.168.43.147.8880 > 192.168.43.124.7773: UDP, length 120
23:42:26.053074 IP 192.168.43.146.8880 > 192.168.43.147.7772: UDP, length 120
23:42:26.062996 IP 192.168.43.147.8880 > 192.168.43.124.7773: UDP, length 120
23:42:26.095849 IP 192.168.43.146.8880 > 192.168.43.147.7772: UDP, length 120
23:42:26.113002 IP 192.168.43.147.8880 > 192.168.43.124.7773: UDP, length 120
23:42:26.147738 IP 192.168.43.146.8880 > 192.168.43.147.7772: UDP, length 120
23:42:26.162994 IP 192.168.43.147.8880 > 192.168.43.124.7773: UDP, length 120
23:42:26.194287 IP 192.168.43.146.8880 > 192.168.43.147.7772: UDP, length 120
23:42:26.212996 IP 192.168.43.147.8880 > 192.168.43.124.7773: UDP, length 120
23:42:26.244725 IP 192.168.43.146.8880 > 192.168.43.147.7772: UDP, length 120
23:42:26.263053 IP 192.168.43.147.8880 > 192.168.43.124.7773: UDP, length 120
23:42:26.294529 IP 192.168.43.146.8880 > 192.168.43.147.7772: UDP, length 120
23:42:26.313030 IP 192.168.43.147.8880 > 192.168.43.124.7773: UDP, length 120
23:42:26.346016 IP 192.168.43.146.8880 > 192.168.43.147.7772: UDP, length 120
23:42:26.363004 IP 192.168.43.147.8880 > 192.168.43.124.7773: UDP, length 120
23:42:26.400546 IP 192.168.43.146.8880 > 192.168.43.147.7772: UDP, length 120
23:42:26.412993 IP 192.168.43.147.8880 > 192.168.43.124.7773: UDP, length 120
23:42:26.447010 IP 192.168.43.146.8880 > 192.168.43.147.7772: UDP, length 120
23:42:26.462997 IP 192.168.43.147.8880 > 192.168.43.124.7773: UDP, length 120
23:42:26.497029 IP 192.168.43.146.8880 > 192.168.43.147.7772: UDP, length 120
23:42:26.512995 IP 192.168.43.147.8880 > 192.168.43.124.7773: UDP, length 120
23:42:26.548881 IP 192.168.43.146.8880 > 192.168.43.147.7772: UDP, length 120
23:42:26.563003 IP 192.168.43.147.8880 > 192.168.43.124.7773: UDP, length 120
23:42:26.593821 IP 192.168.43.146.8880 > 192.168.43.147.7772: UDP, length 120
23:42:26.613006 IP 192.168.43.147.8880 > 192.168.43.124.7773: UDP, length 120
23:42:26.640952 IP 192.168.43.146.8880 > 192.168.43.147.7772: UDP, length 120
23:42:26.662998 IP 192.168.43.147.8880 > 192.168.43.124.7773: UDP, length 120
23:42:26.694386 IP 192.168.43.146.8880 > 192.168.43.147.7772: UDP, length 120
23:42:26.712995 IP 192.168.43.147.8880 > 192.168.43.124.7773: UDP, length 120
23:42:26.743933 IP 192.168.43.146.8880 > 192.168.43.147.7772: UDP, length 120
23:42:26.762998 IP 192.168.43.147.8880 > 192.168.43.124.7773: UDP, length 120
23:42:26.793495 IP 192.168.43.146.8880 > 192.168.43.147.7772: UDP, length 120
23:42:26.812997 IP 192.168.43.147.8880 > 192.168.43.124.7773: UDP, length 120
23:42:26.842436 IP 192.168.43.146.8880 > 192.168.43.147.7772: UDP, length 120
23:42:26.863006 IP 192.168.43.147.8880 > 192.168.43.124.7773: UDP, length 120
23:42:26.892267 IP 192.168.43.146.8880 > 192.168.43.147.7772: UDP, length 120
23:42:26.913005 IP 192.168.43.147.8880 > 192.168.43.124.7773: UDP, length 120
23:42:26.943674 IP 192.168.43.146.8880 > 192.168.43.147.7772: UDP, length 120
23:42:26.963009 IP 192.168.43.147.8880 > 192.168.43.124.7773: UDP, length 120
23:42:26.994369 IP 192.168.43.146.8880 > 192.168.43.147.7772: UDP, length 120
23:42:27.013032 IP 192.168.43.147.8880 > 192.168.43.124.7773: UDP, length 120
23:42:27.044828 IP 192.168.43.146.8880 > 192.168.43.147.7772: UDP, length 120
23:42:27.063000 IP 192.168.43.147.8880 > 192.168.43.124.7773: UDP, length 120
23:42:27.097282 IP 192.168.43.146.8880 > 192.168.43.147.7772: UDP, length 120
23:42:27.112998 IP 192.168.43.147.8880 > 192.168.43.124.7773: UDP, length 120
23:42:27.148671 IP 192.168.43.146.8880 > 192.168.43.147.7772: UDP, length 120
23:42:27.162997 IP 192.168.43.147.8880 > 192.168.43.124.7773: UDP, length 120
23:42:27.197279 IP 192.168.43.146.8880 > 192.168.43.147.7772: UDP, length 120
23:42:27.212998 IP 192.168.43.147.8880 > 192.168.43.124.7773: UDP, length 120
23:42:27.250542 IP 192.168.43.146.8880 > 192.168.43.147.7772: UDP, length 120
23:42:27.262998 IP 192.168.43.147.8880 > 192.168.43.124.7773: UDP, length 120
23:42:27.293491 IP 192.168.43.146.8880 > 192.168.43.147.7772: UDP, length 120
23:42:27.312997 IP 192.168.43.147.8880 > 192.168.43.124.7773: UDP, length 120
23:42:27.343888 IP 192.168.43.146.8880 > 192.168.43.147.7772: UDP, length 120
23:42:27.362995 IP 192.168.43.147.8880 > 192.168.43.124.7773: UDP, length 120
23:42:27.393876 IP 192.168.43.146.8880 > 192.168.43.147.7772: UDP, length 120
23:42:27.413000 IP 192.168.43.147.8880 > 192.168.43.124.7773: UDP, length 120
23:42:27.445784 IP 192.168.43.146.8880 > 192.168.43.147.7772: UDP, length 120
23:42:27.462995 IP 192.168.43.147.8880 > 192.168.43.124.7773: UDP, length 120
23:42:27.512994 IP 192.168.43.147.8880 > 192.168.43.124.7773: UDP, length 120
23:42:27.515737 IP 192.168.43.146.8880 > 192.168.43.147.7772: UDP, length 120
23:42:27.546170 IP 192.168.43.146.8880 > 192.168.43.147.7772: UDP, length 120
23:42:27.562996 IP 192.168.43.147.8880 > 192.168.43.124.7773: UDP, length 120
23:42:27.596261 IP 192.168.43.146.8880 > 192.168.43.147.7772: UDP, length 120
23:42:27.612999 IP 192.168.43.147.8880 > 192.168.43.124.7773: UDP, length 120
23:42:27.651190 IP 192.168.43.146.8880 > 192.168.43.147.7772: UDP, length 120
23:42:27.662998 IP 192.168.43.147.8880 > 192.168.43.124.7773: UDP, length 120
23:42:27.699596 IP 192.168.43.146.8880 > 192.168.43.147.7772: UDP, length 120
23:42:27.712996 IP 192.168.43.147.8880 > 192.168.43.124.7773: UDP, length 120
23:42:27.750878 IP 192.168.43.146.8880 > 192.168.43.147.7772: UDP, length 120
23:42:27.762998 IP 192.168.43.147.8880 > 192.168.43.124.7773: UDP, length 120
23:42:27.802216 IP 192.168.43.146.8880 > 192.168.43.147.7772: UDP, length 120
23:42:27.813032 IP 192.168.43.147.8880 > 192.168.43.124.7773: UDP, length 120
23:42:27.853163 IP 192.168.43.146.8880 > 192.168.43.147.7772: UDP, length 120
23:42:27.862998 IP 192.168.43.147.8880 > 192.168.43.124.7773: UDP, length 120
23:42:27.903346 IP 192.168.43.146.8880 > 192.168.43.147.7772: UDP, length 120
23:42:27.913005 IP 192.168.43.147.8880 > 192.168.43.124.7773: UDP, length 120
23:42:27.949124 IP 192.168.43.146.8880 > 192.168.43.147.7772: UDP, length 120
23:42:27.962995 IP 192.168.43.147.8880 > 192.168.43.124.7773: UDP, length 120
23:42:27.994283 IP 192.168.43.146.8880 > 192.168.43.147.7772: UDP, length 120
23:42:28.013030 IP 192.168.43.147.8880 > 192.168.43.124.7773: UDP, length 120
23:42:28.045416 IP 192.168.43.146.8880 > 192.168.43.147.7772: UDP, length 120
23:42:28.063004 IP 192.168.43.147.8880 > 192.168.43.124.7773: UDP, length 120
23:42:28.094284 IP 192.168.43.146.8880 > 192.168.43.147.7772: UDP, length 120
23:42:28.113011 IP 192.168.43.147.8880 > 192.168.43.124.7773: UDP, length 120
23:42:28.145118 IP 192.168.43.146.8880 > 192.168.43.147.7772: UDP, length 120
23:42:28.162995 IP 192.168.43.147.8880 > 192.168.43.124.7773: UDP, length 120
23:42:28.195616 IP 192.168.43.146.8880 > 192.168.43.147.7772: UDP, length 120
23:42:28.213008 IP 192.168.43.147.8880 > 192.168.43.124.7773: UDP, length 120
23:42:28.241518 IP 192.168.43.146.8880 > 192.168.43.147.7772: UDP, length 120
23:42:28.263000 IP 192.168.43.147.8880 > 192.168.43.124.7773: UDP, length 120
23:42:28.297885 IP 192.168.43.146.8880 > 192.168.43.147.7772: UDP, length 120
23:42:28.313001 IP 192.168.43.147.8880 > 192.168.43.124.7773: UDP, length 120
23:42:28.342984 IP 192.168.43.146.8880 > 192.168.43.147.7772: UDP, length 120
23:42:28.363014 IP 192.168.43.147.8880 > 192.168.43.124.7773: UDP, length 120
23:42:28.397252 IP 192.168.43.146.8880 > 192.168.43.147.7772: UDP, length 120
23:42:28.413009 IP 192.168.43.147.8880 > 192.168.43.124.7773: UDP, length 120
23:42:28.444509 IP 192.168.43.146.8880 > 192.168.43.147.7772: UDP, length 120
23:42:28.463002 IP 192.168.43.147.8880 > 192.168.43.124.7773: UDP, length 120
23:42:28.497162 IP 192.168.43.146.8880 > 192.168.43.147.7772: UDP, length 120
23:42:28.512996 IP 192.168.43.147.8880 > 192.168.43.124.7773: UDP, length 120
23:42:28.545824 IP 192.168.43.146.8880 > 192.168.43.147.7772: UDP, length 120
23:42:28.562997 IP 192.168.43.147.8880 > 192.168.43.124.7773: UDP, length 120
23:42:28.597541 IP 192.168.43.146.8880 > 192.168.43.147.7772: UDP, length 120
23:42:28.613002 IP 192.168.43.147.8880 > 192.168.43.124.7773: UDP, length 120
23:42:28.647250 IP 192.168.43.146.8880 > 192.168.43.147.7772: UDP, length 120
23:42:28.663003 IP 192.168.43.147.8880 > 192.168.43.124.7773: UDP, length 120
23:42:28.693577 IP 192.168.43.146.8880 > 192.168.43.147.7772: UDP, length 120
23:42:28.712998 IP 192.168.43.147.8880 > 192.168.43.124.7773: UDP, length 120
23:42:28.758548 IP 192.168.43.146.8880 > 192.168.43.147.7772: UDP, length 120
23:42:28.763002 IP 192.168.43.147.8880 > 192.168.43.124.7773: UDP, length 120
23:42:28.812999 IP 192.168.43.147.8880 > 192.168.43.124.7773: UDP, length 120
23:42:28.819438 IP 192.168.43.146.8880 > 192.168.43.147.7772: UDP, length 120
23:42:28.847866 IP 192.168.43.146.8880 > 192.168.43.147.7772: UDP, length 120
23:42:28.863003 IP 192.168.43.147.8880 > 192.168.43.124.7773: UDP, length 120
23:42:28.892545 IP 192.168.43.146.8880 > 192.168.43.147.7772: UDP, length 120
23:42:28.913005 IP 192.168.43.147.8880 > 192.168.43.124.7773: UDP, length 120
23:42:28.942510 IP 192.168.43.146.8880 > 192.168.43.147.7772: UDP, length 120
23:42:28.962995 IP 192.168.43.147.8880 > 192.168.43.124.7773: UDP, length 120
23:42:28.990960 IP 192.168.43.146.8880 > 192.168.43.147.7772: UDP, length 120
23:42:29.013030 IP 192.168.43.147.8880 > 192.168.43.124.7773: UDP, length 120
23:42:29.042344 IP 192.168.43.146.8880 > 192.168.43.147.7772: UDP, length 120
23:42:29.063035 IP 192.168.43.147.8880 > 192.168.43.124.7773: UDP, length 120
23:42:29.094961 IP 192.168.43.146.8880 > 192.168.43.147.7772: UDP, length 120
23:42:29.113004 IP 192.168.43.147.8880 > 192.168.43.124.7773: UDP, length 120
23:42:29.144943 IP 192.168.43.146.8880 > 192.168.43.147.7772: UDP, length 120
23:42:29.162998 IP 192.168.43.147.8880 > 192.168.43.124.7773: UDP, length 120
23:42:29.195019 IP 192.168.43.146.8880 > 192.168.43.147.7772: UDP, length 120
23:42:29.212998 IP 192.168.43.147.8880 > 192.168.43.124.7773: UDP, length 120
23:42:29.247679 IP 192.168.43.146.8880 > 192.168.43.147.7772: UDP, length 120
23:42:29.262996 IP 192.168.43.147.8880 > 192.168.43.124.7773: UDP, length 120
23:42:29.299881 IP 192.168.43.146.8880 > 192.168.43.147.7772: UDP, length 120
23:42:29.313035 IP 192.168.43.147.8880 > 192.168.43.124.7773: UDP, length 120
23:42:29.351326 IP 192.168.43.146.8880 > 192.168.43.147.7772: UDP, length 120
23:42:29.362997 IP 192.168.43.147.8880 > 192.168.43.124.7773: UDP, length 120
23:42:29.394153 IP 192.168.43.146.8880 > 192.168.43.147.7772: UDP, length 120
23:42:29.413000 IP 192.168.43.147.8880 > 192.168.43.124.7773: UDP, length 120
23:42:29.452007 IP 192.168.43.146.8880 > 192.168.43.147.7772: UDP, length 120
23:42:29.463004 IP 192.168.43.147.8880 > 192.168.43.124.7773: UDP, length 120
23:42:29.491526 IP 192.168.43.146.8880 > 192.168.43.147.7772: UDP, length 120
23:42:29.512993 IP 192.168.43.147.8880 > 192.168.43.124.7773: UDP, length 120
23:42:29.544323 IP 192.168.43.146.8880 > 192.168.43.147.7772: UDP, length 120
23:42:29.563003 IP 192.168.43.147.8880 > 192.168.43.124.7773: UDP, length 120
23:42:29.591016 IP 192.168.43.146.8880 > 192.168.43.147.7772: UDP, length 120
23:42:29.613000 IP 192.168.43.147.8880 > 192.168.43.124.7773: UDP, length 120
23:42:29.644100 IP 192.168.43.146.8880 > 192.168.43.147.7772: UDP, length 120
23:42:29.662998 IP 192.168.43.147.8880 > 192.168.43.124.7773: UDP, length 120
23:42:29.697154 IP 192.168.43.146.8880 > 192.168.43.147.7772: UDP, length 120
23:42:29.712994 IP 192.168.43.147.8880 > 192.168.43.124.7773: UDP, length 120
23:42:29.744127 IP 192.168.43.146.8880 > 192.168.43.147.7772: UDP, length 120
23:42:29.762996 IP 192.168.43.147.8880 > 192.168.43.124.7773: UDP, length 120
23:42:29.794464 IP 192.168.43.146.8880 > 192.168.43.147.7772: UDP, length 120
23:42:29.812995 IP 192.168.43.147.8880 > 192.168.43.124.7773: UDP, length 120
23:42:29.844504 IP 192.168.43.146.8880 > 192.168.43.147.7772: UDP, length 120
23:42:29.862997 IP 192.168.43.147.8880 > 192.168.43.124.7773: UDP, length 120
23:42:29.891173 IP 192.168.43.146.8880 > 192.168.43.147.7772: UDP, length 120
23:42:29.912999 IP 192.168.43.147.8880 > 192.168.43.124.7773: UDP, length 120
23:42:29.948221 IP 192.168.43.146.8880 > 192.168.43.147.7772: UDP, length 120
23:42:29.962992 IP 192.168.43.147.8880 > 192.168.43.124.7773: UDP, length 120
23:42:29.996983 IP 192.168.43.146.8880 > 192.168.43.147.7772: UDP, length 120
23:42:30.013012 IP 192.168.43.147.8880 > 192.168.43.124.7773: UDP, length 120
23:42:30.044270 IP 192.168.43.146.8880 > 192.168.43.147.7772: UDP, length 120
23:42:30.063004 IP 192.168.43.147.8880 > 192.168.43.124.7773: UDP, length 120
23:42:30.096060 IP 192.168.43.146.8880 > 192.168.43.147.7772: UDP, length 120
23:42:30.113008 IP 192.168.43.147.8880 > 192.168.43.124.7773: UDP, length 120
23:42:30.141799 IP 192.168.43.146.8880 > 192.168.43.147.7772: UDP, length 120
23:42:30.163018 IP 192.168.43.147.8880 > 192.168.43.124.7773: UDP, length 120
23:42:30.193794 IP 192.168.43.146.8880 > 192.168.43.147.7772: UDP, length 120
23:42:30.213016 IP 192.168.43.147.8880 > 192.168.43.124.7773: UDP, length 120
23:42:30.241064 IP 192.168.43.146.8880 > 192.168.43.147.7772: UDP, length 120
23:42:30.263006 IP 192.168.43.147.8880 > 192.168.43.124.7773: UDP, length 120
23:42:30.296202 IP 192.168.43.146.8880 > 192.168.43.147.7772: UDP, length 120
23:42:30.313017 IP 192.168.43.147.8880 > 192.168.43.124.7773: UDP, length 120
23:42:30.346237 IP 192.168.43.146.8880 > 192.168.43.147.7772: UDP, length 120
23:42:30.363002 IP 192.168.43.147.8880 > 192.168.43.124.7773: UDP, length 120
