03:26:05.471042 IP 192.168.43.147.8880 > 192.168.43.124.7773: UDP, length 120
03:26:05.521093 IP 192.168.43.147.8880 > 192.168.43.124.7773: UDP, length 120
03:26:05.571062 IP 192.168.43.147.8880 > 192.168.43.124.7773: UDP, length 120
03:26:05.621063 IP 192.168.43.147.8880 > 192.168.43.124.7773: UDP, length 120
03:26:05.671060 IP 192.168.43.147.8880 > 192.168.43.124.7773: UDP, length 120
03:26:05.721059 IP 192.168.43.147.8880 > 192.168.43.124.7773: UDP, length 120
03:26:05.771060 IP 192.168.43.147.8880 > 192.168.43.124.7773: UDP, length 120
03:26:05.821059 IP 192.168.43.147.8880 > 192.168.43.124.7773: UDP, length 120
03:26:05.871059 IP 192.168.43.147.8880 > 192.168.43.124.7773: UDP, length 120
03:26:05.921060 IP 192.168.43.147.8880 > 192.168.43.124.7773: UDP, length 120
03:26:05.971062 IP 192.168.43.147.8880 > 192.168.43.124.7773: UDP, length 120
03:26:06.021058 IP 192.168.43.147.8880 > 192.168.43.124.7773: UDP, length 120
03:26:06.071107 IP 192.168.43.147.8880 > 192.168.43.124.7773: UDP, length 120
03:26:06.121064 IP 192.168.43.147.8880 > 192.168.43.124.7773: UDP, length 120
03:26:06.171059 IP 192.168.43.147.8880 > 192.168.43.124.7773: UDP, length 120
03:26:06.221059 IP 192.168.43.147.8880 > 192.168.43.124.7773: UDP, length 120
03:26:06.271059 IP 192.168.43.147.8880 > 192.168.43.124.7773: UDP, length 120
03:26:06.321059 IP 192.168.43.147.8880 > 192.168.43.124.7773: UDP, length 120
03:26:06.371058 IP 192.168.43.147.8880 > 192.168.43.124.7773: UDP, length 120
03:26:06.421058 IP 192.168.43.147.8880 > 192.168.43.124.7773: UDP, length 120
03:26:06.471058 IP 192.168.43.147.8880 > 192.168.43.124.7773: UDP, length 120
03:26:06.521059 IP 192.168.43.147.8880 > 192.168.43.124.7773: UDP, length 120
03:26:06.571059 IP 192.168.43.147.8880 > 192.168.43.124.7773: UDP, length 120
03:26:06.621062 IP 192.168.43.147.8880 > 192.168.43.124.7773: UDP, length 120
03:26:06.671059 IP 192.168.43.147.8880 > 192.168.43.124.7773: UDP, length 120
03:26:06.721063 IP 192.168.43.147.8880 > 192.168.43.124.7773: UDP, length 120
03:26:06.771059 IP 192.168.43.147.8880 > 192.168.43.124.7773: UDP, length 120
03:26:06.821059 IP 192.168.43.147.8880 > 192.168.43.124.7773: UDP, length 120
03:26:06.871058 IP 192.168.43.147.8880 > 192.168.43.124.7773: UDP, length 120
03:26:06.921084 IP 192.168.43.147.8880 > 192.168.43.124.7773: UDP, length 120
03:26:06.971083 IP 192.168.43.147.8880 > 192.168.43.124.7773: UDP, length 120
03:26:07.021084 IP 192.168.43.147.8880 > 192.168.43.124.7773: UDP, length 120
03:26:07.071084 IP 192.168.43.147.8880 > 192.168.43.124.7773: UDP, length 120
03:26:07.121086 IP 192.168.43.147.8880 > 192.168.43.124.7773: UDP, length 120
03:26:07.171084 IP 192.168.43.147.8880 > 192.168.43.124.7773: UDP, length 120
03:26:07.221085 IP 192.168.43.147.8880 > 192.168.43.124.7773: UDP, length 120
03:26:07.271084 IP 192.168.43.147.8880 > 192.168.43.124.7773: UDP, length 120
03:26:07.321085 IP 192.168.43.147.8880 > 192.168.43.124.7773: UDP, length 120
03:26:07.371084 IP 192.168.43.147.8880 > 192.168.43.124.7773: UDP, length 120
03:26:07.421084 IP 192.168.43.147.8880 > 192.168.43.124.7773: UDP, length 120
03:26:07.471084 IP 192.168.43.147.8880 > 192.168.43.124.7773: UDP, length 120
03:26:07.521096 IP 192.168.43.147.8880 > 192.168.43.124.7773: UDP, length 120
03:26:07.571131 IP 192.168.43.147.8880 > 192.168.43.124.7773: UDP, length 120
03:26:07.621094 IP 192.168.43.147.8880 > 192.168.43.124.7773: UDP, length 120
03:26:07.671085 IP 192.168.43.147.8880 > 192.168.43.124.7773: UDP, length 120
03:26:07.721085 IP 192.168.43.147.8880 > 192.168.43.124.7773: UDP, length 120
03:26:07.771086 IP 192.168.43.147.8880 > 192.168.43.124.7773: UDP, length 120
03:26:07.821085 IP 192.168.43.147.8880 > 192.168.43.124.7773: UDP, length 120
03:26:07.871228 IP 192.168.43.147.8880 > 192.168.43.124.7773: UDP, length 120
03:26:07.921177 IP 192.168.43.147.8880 > 192.168.43.124.7773: UDP, length 120
03:26:07.971186 IP 192.168.43.147.8880 > 192.168.43.124.7773: UDP, length 120
03:26:08.021142 IP 192.168.43.147.8880 > 192.168.43.124.7773: UDP, length 120
03:26:08.071135 IP 192.168.43.147.8880 > 192.168.43.124.7773: UDP, length 120
03:26:08.121161 IP 192.168.43.147.8880 > 192.168.43.124.7773: UDP, length 120
03:26:08.171152 IP 192.168.43.147.8880 > 192.168.43.124.7773: UDP, length 120
03:26:08.221149 IP 192.168.43.147.8880 > 192.168.43.124.7773: UDP, length 120
03:26:08.271138 IP 192.168.43.147.8880 > 192.168.43.124.7773: UDP, length 120
03:26:08.321113 IP 192.168.43.147.8880 > 192.168.43.124.7773: UDP, length 120
03:26:08.371063 IP 192.168.43.147.8880 > 192.168.43.124.7773: UDP, length 120
03:26:08.421060 IP 192.168.43.147.8880 > 192.168.43.124.7773: UDP, length 120
03:26:08.471060 IP 192.168.43.147.8880 > 192.168.43.124.7773: UDP, length 120
03:26:08.521062 IP 192.168.43.147.8880 > 192.168.43.124.7773: UDP, length 120
03:26:08.571059 IP 192.168.43.147.8880 > 192.168.43.124.7773: UDP, length 120
03:26:08.621061 IP 192.168.43.147.8880 > 192.168.43.124.7773: UDP, length 120
03:26:08.671059 IP 192.168.43.147.8880 > 192.168.43.124.7773: UDP, length 120
03:26:08.721059 IP 192.168.43.147.8880 > 192.168.43.124.7773: UDP, length 120
03:26:08.771059 IP 192.168.43.147.8880 > 192.168.43.124.7773: UDP, length 120
03:26:08.821058 IP 192.168.43.147.8880 > 192.168.43.124.7773: UDP, length 120
03:26:08.871059 IP 192.168.43.147.8880 > 192.168.43.124.7773: UDP, length 120
03:26:08.921061 IP 192.168.43.147.8880 > 192.168.43.124.7773: UDP, length 120
03:26:08.971059 IP 192.168.43.147.8880 > 192.168.43.124.7773: UDP, length 120
03:26:09.021058 IP 192.168.43.147.8880 > 192.168.43.124.7773: UDP, length 120
03:26:09.071106 IP 192.168.43.147.8880 > 192.168.43.124.7773: UDP, length 120
03:26:09.121065 IP 192.168.43.147.8880 > 192.168.43.124.7773: UDP, length 120
03:26:09.171060 IP 192.168.43.147.8880 > 192.168.43.124.7773: UDP, length 120
03:26:09.221059 IP 192.168.43.147.8880 > 192.168.43.124.7773: UDP, length 120
03:26:09.271059 IP 192.168.43.147.8880 > 192.168.43.124.7773: UDP, length 120
03:26:09.321058 IP 192.168.43.147.8880 > 192.168.43.124.7773: UDP, length 120
03:26:09.371057 IP 192.168.43.147.8880 > 192.168.43.124.7773: UDP, length 120
03:26:09.421059 IP 192.168.43.147.8880 > 192.168.43.124.7773: UDP, length 120
03:26:09.471058 IP 192.168.43.147.8880 > 192.168.43.124.7773: UDP, length 120
03:26:09.521060 IP 192.168.43.147.8880 > 192.168.43.124.7773: UDP, length 120
03:26:09.571059 IP 192.168.43.147.8880 > 192.168.43.124.7773: UDP, length 120
03:26:09.621061 IP 192.168.43.147.8880 > 192.168.43.124.7773: UDP, length 120
03:26:09.671059 IP 192.168.43.147.8880 > 192.168.43.124.7773: UDP, length 120
03:26:09.721059 IP 192.168.43.147.8880 > 192.168.43.124.7773: UDP, length 120
03:26:09.771057 IP 192.168.43.147.8880 > 192.168.43.124.7773: UDP, length 120
03:26:09.821058 IP 192.168.43.147.8880 > 192.168.43.124.7773: UDP, length 120
03:26:09.871089 IP 192.168.43.147.8880 > 192.168.43.124.7773: UDP, length 120
03:26:09.921073 IP 192.168.43.147.8880 > 192.168.43.124.7773: UDP, length 120
03:26:09.971060 IP 192.168.43.147.8880 > 192.168.43.124.7773: UDP, length 120
03:26:10.021059 IP 192.168.43.147.8880 > 192.168.43.124.7773: UDP, length 120
03:26:10.071059 IP 192.168.43.147.8880 > 192.168.43.124.7773: UDP, length 120
03:26:10.121059 IP 192.168.43.147.8880 > 192.168.43.124.7773: UDP, length 120
03:26:10.171058 IP 192.168.43.147.8880 > 192.168.43.124.7773: UDP, length 120
03:26:10.221058 IP 192.168.43.147.8880 > 192.168.43.124.7773: UDP, length 120
03:26:10.271057 IP 192.168.43.147.8880 > 192.168.43.124.7773: UDP, length 120
03:26:10.321058 IP 192.168.43.147.8880 > 192.168.43.124.7773: UDP, length 120
03:26:10.371057 IP 192.168.43.147.8880 > 192.168.43.124.7773: UDP, length 120
03:26:10.421058 IP 192.168.43.147.8880 > 192.168.43.124.7773: UDP, length 120
03:26:10.471057 IP 192.168.43.147.8880 > 192.168.43.124.7773: UDP, length 120
03:26:10.521059 IP 192.168.43.147.8880 > 192.168.43.124.7773: UDP, length 120
03:26:10.571105 IP 192.168.43.147.8880 > 192.168.43.124.7773: UDP, length 120
03:26:10.621066 IP 192.168.43.147.8880 > 192.168.43.124.7773: UDP, length 120
03:26:10.671059 IP 192.168.43.147.8880 > 192.168.43.124.7773: UDP, length 120
03:26:10.721060 IP 192.168.43.147.8880 > 192.168.43.124.7773: UDP, length 120
03:26:10.771059 IP 192.168.43.147.8880 > 192.168.43.124.7773: UDP, length 120
03:26:10.821059 IP 192.168.43.147.8880 > 192.168.43.124.7773: UDP, length 120
03:26:10.871057 IP 192.168.43.147.8880 > 192.168.43.124.7773: UDP, length 120
03:26:10.921065 IP 192.168.43.147.8880 > 192.168.43.124.7773: UDP, length 120
03:26:10.971060 IP 192.168.43.147.8880 > 192.168.43.124.7773: UDP, length 120
03:26:11.021060 IP 192.168.43.147.8880 > 192.168.43.124.7773: UDP, length 120
03:26:11.071059 IP 192.168.43.147.8880 > 192.168.43.124.7773: UDP, length 120
03:26:11.121059 IP 192.168.43.147.8880 > 192.168.43.124.7773: UDP, length 120
03:26:11.171058 IP 192.168.43.147.8880 > 192.168.43.124.7773: UDP, length 120
03:26:11.221057 IP 192.168.43.147.8880 > 192.168.43.124.7773: UDP, length 120
03:26:11.271057 IP 192.168.43.147.8880 > 192.168.43.124.7773: UDP, length 120
03:26:11.321058 IP 192.168.43.147.8880 > 192.168.43.124.7773: UDP, length 120
03:26:11.371058 IP 192.168.43.147.8880 > 192.168.43.124.7773: UDP, length 120
03:26:11.421059 IP 192.168.43.147.8880 > 192.168.43.124.7773: UDP, length 120
03:26:11.471058 IP 192.168.43.147.8880 > 192.168.43.124.7773: UDP, length 120
03:26:11.521060 IP 192.168.43.147.8880 > 192.168.43.124.7773: UDP, length 120
03:26:11.571058 IP 192.168.43.147.8880 > 192.168.43.124.7773: UDP, length 120
03:26:11.621059 IP 192.168.43.147.8880 > 192.168.43.124.7773: UDP, length 120
03:26:11.671059 IP 192.168.43.147.8880 > 192.168.43.124.7773: UDP, length 120
03:26:11.721058 IP 192.168.43.147.8880 > 192.168.43.124.7773: UDP, length 120
03:26:11.771057 IP 192.168.43.147.8880 > 192.168.43.124.7773: UDP, length 120
03:26:11.821057 IP 192.168.43.147.8880 > 192.168.43.124.7773: UDP, length 120
03:26:11.871058 IP 192.168.43.147.8880 > 192.168.43.124.7773: UDP, length 120
03:26:11.921084 IP 192.168.43.147.8880 > 192.168.43.124.7773: UDP, length 120
03:26:11.971084 IP 192.168.43.147.8880 > 192.168.43.124.7773: UDP, length 120
03:26:12.021084 IP 192.168.43.147.8880 > 192.168.43.124.7773: UDP, length 120
03:26:12.071144 IP 192.168.43.147.8880 > 192.168.43.124.7773: UDP, length 120
03:26:12.121095 IP 192.168.43.147.8880 > 192.168.43.124.7773: UDP, length 120
03:26:12.171085 IP 192.168.43.147.8880 > 192.168.43.124.7773: UDP, length 120
03:26:12.221085 IP 192.168.43.147.8880 > 192.168.43.124.7773: UDP, length 120
03:26:12.271084 IP 192.168.43.147.8880 > 192.168.43.124.7773: UDP, length 120
03:26:12.321084 IP 192.168.43.147.8880 > 192.168.43.124.7773: UDP, length 120
03:26:12.371083 IP 192.168.43.147.8880 > 192.168.43.124.7773: UDP, length 120
03:26:12.421085 IP 192.168.43.147.8880 > 192.168.43.124.7773: UDP, length 120
03:26:12.471084 IP 192.168.43.147.8880 > 192.168.43.124.7773: UDP, length 120
03:26:12.521096 IP 192.168.43.147.8880 > 192.168.43.124.7773: UDP, length 120
03:26:12.571091 IP 192.168.43.147.8880 > 192.168.43.124.7773: UDP, length 120
03:26:12.621088 IP 192.168.43.147.8880 > 192.168.43.124.7773: UDP, length 120
03:26:12.671086 IP 192.168.43.147.8880 > 192.168.43.124.7773: UDP, length 120
03:26:12.721085 IP 192.168.43.147.8880 > 192.168.43.124.7773: UDP, length 120
03:26:12.771082 IP 192.168.43.147.8880 > 192.168.43.124.7773: UDP, length 120
03:26:12.821084 IP 192.168.43.147.8880 > 192.168.43.124.7773: UDP, length 120
03:26:12.871082 IP 192.168.43.147.8880 > 192.168.43.124.7773: UDP, length 120
03:26:12.921087 IP 192.168.43.147.8880 > 192.168.43.124.7773: UDP, length 120
03:26:12.971110 IP 192.168.43.147.8880 > 192.168.43.124.7773: UDP, length 120
03:26:13.021086 IP 192.168.43.147.8880 > 192.168.43.124.7773: UDP, length 120
03:26:13.071088 IP 192.168.43.147.8880 > 192.168.43.124.7773: UDP, length 120
03:26:13.121086 IP 192.168.43.147.8880 > 192.168.43.124.7773: UDP, length 120
03:26:13.171084 IP 192.168.43.147.8880 > 192.168.43.124.7773: UDP, length 120
03:26:13.221083 IP 192.168.43.147.8880 > 192.168.43.124.7773: UDP, length 120
03:26:13.271083 IP 192.168.43.147.8880 > 192.168.43.124.7773: UDP, length 120
03:26:13.321152 IP 192.168.43.147.8880 > 192.168.43.124.7773: UDP, length 120
03:26:13.371179 IP 192.168.43.147.8880 > 192.168.43.124.7773: UDP, length 120
03:26:13.421144 IP 192.168.43.147.8880 > 192.168.43.124.7773: UDP, length 120
03:26:13.471111 IP 192.168.43.147.8880 > 192.168.43.124.7773: UDP, length 120
03:26:13.521156 IP 192.168.43.147.8880 > 192.168.43.124.7773: UDP, length 120
03:26:13.571151 IP 192.168.43.147.8880 > 192.168.43.124.7773: UDP, length 120
03:26:13.621140 IP 192.168.43.147.8880 > 192.168.43.124.7773: UDP, length 120
03:26:13.671142 IP 192.168.43.147.8880 > 192.168.43.124.7773: UDP, length 120
03:26:13.721129 IP 192.168.43.147.8880 > 192.168.43.124.7773: UDP, length 120
03:26:13.771109 IP 192.168.43.147.8880 > 192.168.43.124.7773: UDP, length 120
03:26:13.821068 IP 192.168.43.147.8880 > 192.168.43.124.7773: UDP, length 120
03:26:13.871059 IP 192.168.43.147.8880 > 192.168.43.124.7773: UDP, length 120
03:26:13.921060 IP 192.168.43.147.8880 > 192.168.43.124.7773: UDP, length 120
03:26:13.971059 IP 192.168.43.147.8880 > 192.168.43.124.7773: UDP, length 120
03:26:14.021059 IP 192.168.43.147.8880 > 192.168.43.124.7773: UDP, length 120
03:26:14.071059 IP 192.168.43.147.8880 > 192.168.43.124.7773: UDP, length 120
03:26:14.121064 IP 192.168.43.147.8880 > 192.168.43.124.7773: UDP, length 120
03:26:14.171059 IP 192.168.43.147.8880 > 192.168.43.124.7773: UDP, length 120
03:26:14.221059 IP 192.168.43.147.8880 > 192.168.43.124.7773: UDP, length 120
03:26:14.271058 IP 192.168.43.147.8880 > 192.168.43.124.7773: UDP, length 120
03:26:14.321057 IP 192.168.43.147.8880 > 192.168.43.124.7773: UDP, length 120
03:26:14.371057 IP 192.168.43.147.8880 > 192.168.43.124.7773: UDP, length 120
03:26:14.421059 IP 192.168.43.147.8880 > 192.168.43.124.7773: UDP, length 120
03:26:14.471058 IP 192.168.43.147.8880 > 192.168.43.124.7773: UDP, length 120
03:26:14.521059 IP 192.168.43.147.8880 > 192.168.43.124.7773: UDP, length 120
03:26:14.571060 IP 192.168.43.147.8880 > 192.168.43.124.7773: UDP, length 120
03:26:14.621061 IP 192.168.43.147.8880 > 192.168.43.124.7773: UDP, length 120
03:26:14.671059 IP 192.168.43.147.8880 > 192.168.43.124.7773: UDP, length 120
03:26:14.721059 IP 192.168.43.147.8880 > 192.168.43.124.7773: UDP, length 120
03:26:14.771060 IP 192.168.43.147.8880 > 192.168.43.124.7773: UDP, length 120
03:26:14.821060 IP 192.168.43.147.8880 > 192.168.43.124.7773: UDP, length 120
03:26:14.871059 IP 192.168.43.147.8880 > 192.168.43.124.7773: UDP, length 120
03:26:14.921060 IP 192.168.43.147.8880 > 192.168.43.124.7773: UDP, length 120
03:26:14.971058 IP 192.168.43.147.8880 > 192.168.43.124.7773: UDP, length 120
03:26:15.021058 IP 192.168.43.147.8880 > 192.168.43.124.7773: UDP, length 120
03:26:15.071104 IP 192.168.43.147.8880 > 192.168.43.124.7773: UDP, length 120
03:26:15.121070 IP 192.168.43.147.8880 > 192.168.43.124.7773: UDP, length 120
03:26:15.171061 IP 192.168.43.147.8880 > 192.168.43.124.7773: UDP, length 120
03:26:15.221061 IP 192.168.43.147.8880 > 192.168.43.124.7773: UDP, length 120
03:26:15.271058 IP 192.168.43.147.8880 > 192.168.43.124.7773: UDP, length 120
03:26:15.321058 IP 192.168.43.147.8880 > 192.168.43.124.7773: UDP, length 120
03:26:15.371059 IP 192.168.43.147.8880 > 192.168.43.124.7773: UDP, length 120
03:26:15.421059 IP 192.168.43.147.8880 > 192.168.43.124.7773: UDP, length 120
03:26:15.471058 IP 192.168.43.147.8880 > 192.168.43.124.7773: UDP, length 120
03:26:15.521059 IP 192.168.43.147.8880 > 192.168.43.124.7773: UDP, length 120
03:26:15.571058 IP 192.168.43.147.8880 > 192.168.43.124.7773: UDP, length 120
03:26:15.621061 IP 192.168.43.147.8880 > 192.168.43.124.7773: UDP, length 120
03:26:15.671059 IP 192.168.43.147.8880 > 192.168.43.124.7773: UDP, length 120
03:26:15.721059 IP 192.168.43.147.8880 > 192.168.43.124.7773: UDP, length 120
03:26:15.771058 IP 192.168.43.147.8880 > 192.168.43.124.7773: UDP, length 120
03:26:15.821058 IP 192.168.43.147.8880 > 192.168.43.124.7773: UDP, length 120
03:26:15.871058 IP 192.168.43.147.8880 > 192.168.43.124.7773: UDP, length 120
03:26:15.921058 IP 192.168.43.147.8880 > 192.168.43.124.7773: UDP, length 120
03:26:15.971058 IP 192.168.43.147.8880 > 192.168.43.124.7773: UDP, length 120
03:26:16.021060 IP 192.168.43.147.8880 > 192.168.43.124.7773: UDP, length 120
03:26:16.071059 IP 192.168.43.147.8880 > 192.168.43.124.7773: UDP, length 120
03:26:16.121059 IP 192.168.43.147.8880 > 192.168.43.124.7773: UDP, length 120
03:26:16.171060 IP 192.168.43.147.8880 > 192.168.43.124.7773: UDP, length 120
03:26:16.221060 IP 192.168.43.147.8880 > 192.168.43.124.7773: UDP, length 120
03:26:16.271058 IP 192.168.43.147.8880 > 192.168.43.124.7773: UDP, length 120
03:26:16.321058 IP 192.168.43.147.8880 > 192.168.43.124.7773: UDP, length 120
03:26:16.371057 IP 192.168.43.147.8880 > 192.168.43.124.7773: UDP, length 120
03:26:16.421058 IP 192.168.43.147.8880 > 192.168.43.124.7773: UDP, length 120
03:26:16.471057 IP 192.168.43.147.8880 > 192.168.43.124.7773: UDP, length 120
03:26:16.521061 IP 192.168.43.147.8880 > 192.168.43.124.7773: UDP, length 120
03:26:16.571105 IP 192.168.43.147.8880 > 192.168.43.124.7773: UDP, length 120
03:26:16.621070 IP 192.168.43.147.8880 > 192.168.43.124.7773: UDP, length 120
03:26:16.671060 IP 192.168.43.147.8880 > 192.168.43.124.7773: UDP, length 120
03:26:16.721059 IP 192.168.43.147.8880 > 192.168.43.124.7773: UDP, length 120
03:26:16.771058 IP 192.168.43.147.8880 > 192.168.43.124.7773: UDP, length 120
03:26:16.821059 IP 192.168.43.147.8880 > 192.168.43.124.7773: UDP, length 120
03:26:16.871059 IP 192.168.43.147.8880 > 192.168.43.124.7773: UDP, length 120
03:26:16.921085 IP 192.168.43.147.8880 > 192.168.43.124.7773: UDP, length 120
03:26:16.971084 IP 192.168.43.147.8880 > 192.168.43.124.7773: UDP, length 120
03:26:17.021084 IP 192.168.43.147.8880 > 192.168.43.124.7773: UDP, length 120
03:26:17.071082 IP 192.168.43.147.8880 > 192.168.43.124.7773: UDP, length 120
03:26:17.121084 IP 192.168.43.147.8880 > 192.168.43.124.7773: UDP, length 120
03:26:17.171084 IP 192.168.43.147.8880 > 192.168.43.124.7773: UDP, length 120
03:26:17.221083 IP 192.168.43.147.8880 > 192.168.43.124.7773: UDP, length 120
03:26:17.271082 IP 192.168.43.147.8880 > 192.168.43.124.7773: UDP, length 120
03:26:17.321086 IP 192.168.43.147.8880 > 192.168.43.124.7773: UDP, length 120
03:26:17.371121 IP 192.168.43.147.8880 > 192.168.43.124.7773: UDP, length 120
03:26:17.421085 IP 192.168.43.147.8880 > 192.168.43.124.7773: UDP, length 120
03:26:17.471083 IP 192.168.43.147.8880 > 192.168.43.124.7773: UDP, length 120
03:26:17.521084 IP 192.168.43.147.8880 > 192.168.43.124.7773: UDP, length 120
03:26:17.571083 IP 192.168.43.147.8880 > 192.168.43.124.7773: UDP, length 120
03:26:17.621088 IP 192.168.43.147.8880 > 192.168.43.124.7773: UDP, length 120
03:26:17.671084 IP 192.168.43.147.8880 > 192.168.43.124.7773: UDP, length 120
03:26:17.721083 IP 192.168.43.147.8880 > 192.168.43.124.7773: UDP, length 120
03:26:17.771082 IP 192.168.43.147.8880 > 192.168.43.124.7773: UDP, length 120
03:26:17.821085 IP 192.168.43.147.8880 > 192.168.43.124.7773: UDP, length 120
03:26:17.871083 IP 192.168.43.147.8880 > 192.168.43.124.7773: UDP, length 120
03:26:17.921085 IP 192.168.43.147.8880 > 192.168.43.124.7773: UDP, length 120
03:26:17.971083 IP 192.168.43.147.8880 > 192.168.43.124.7773: UDP, length 120
03:26:18.021084 IP 192.168.43.147.8880 > 192.168.43.124.7773: UDP, length 120
03:26:18.071144 IP 192.168.43.147.8880 > 192.168.43.124.7773: UDP, length 120
03:26:18.121098 IP 192.168.43.147.8880 > 192.168.43.124.7773: UDP, length 120
03:26:18.171086 IP 192.168.43.147.8880 > 192.168.43.124.7773: UDP, length 120
03:26:18.221084 IP 192.168.43.147.8880 > 192.168.43.124.7773: UDP, length 120
03:26:18.271084 IP 192.168.43.147.8880 > 192.168.43.124.7773: UDP, length 120
03:26:18.321084 IP 192.168.43.147.8880 > 192.168.43.124.7773: UDP, length 120
03:26:18.371083 IP 192.168.43.147.8880 > 192.168.43.124.7773: UDP, length 120
03:26:18.421086 IP 192.168.43.147.8880 > 192.168.43.124.7773: UDP, length 120
03:26:18.471084 IP 192.168.43.147.8880 > 192.168.43.124.7773: UDP, length 120
03:26:18.521095 IP 192.168.43.147.8880 > 192.168.43.124.7773: UDP, length 120
03:26:18.571090 IP 192.168.43.147.8880 > 192.168.43.124.7773: UDP, length 120
03:26:18.621089 IP 192.168.43.147.8880 > 192.168.43.124.7773: UDP, length 120
03:26:18.671085 IP 192.168.43.147.8880 > 192.168.43.124.7773: UDP, length 120
03:26:18.721085 IP 192.168.43.147.8880 > 192.168.43.124.7773: UDP, length 120
03:26:18.771154 IP 192.168.43.147.8880 > 192.168.43.124.7773: UDP, length 120
03:26:18.821172 IP 192.168.43.147.8880 > 192.168.43.124.7773: UDP, length 120
03:26:18.871186 IP 192.168.43.147.8880 > 192.168.43.124.7773: UDP, length 120
03:26:18.921147 IP 192.168.43.147.8880 > 192.168.43.124.7773: UDP, length 120
03:26:18.971131 IP 192.168.43.147.8880 > 192.168.43.124.7773: UDP, length 120
03:26:19.021133 IP 192.168.43.147.8880 > 192.168.43.124.7773: UDP, length 120
03:26:19.071131 IP 192.168.43.147.8880 > 192.168.43.124.7773: UDP, length 120
03:26:19.121167 IP 192.168.43.147.8880 > 192.168.43.124.7773: UDP, length 120
03:26:19.171152 IP 192.168.43.147.8880 > 192.168.43.124.7773: UDP, length 120
03:26:19.221141 IP 192.168.43.147.8880 > 192.168.43.124.7773: UDP, length 120
03:26:19.271116 IP 192.168.43.147.8880 > 192.168.43.124.7773: UDP, length 120
03:26:19.321066 IP 192.168.43.147.8880 > 192.168.43.124.7773: UDP, length 120
03:26:19.371060 IP 192.168.43.147.8880 > 192.168.43.124.7773: UDP, length 120
03:26:19.421062 IP 192.168.43.147.8880 > 192.168.43.124.7773: UDP, length 120
03:26:19.471059 IP 192.168.43.147.8880 > 192.168.43.124.7773: UDP, length 120
03:26:19.521062 IP 192.168.43.147.8880 > 192.168.43.124.7773: UDP, length 120
03:26:19.571106 IP 192.168.43.147.8880 > 192.168.43.124.7773: UDP, length 120
03:26:19.621071 IP 192.168.43.147.8880 > 192.168.43.124.7773: UDP, length 120
03:26:19.671061 IP 192.168.43.147.8880 > 192.168.43.124.7773: UDP, length 120
03:26:19.721059 IP 192.168.43.147.8880 > 192.168.43.124.7773: UDP, length 120
03:26:19.771060 IP 192.168.43.147.8880 > 192.168.43.124.7773: UDP, length 120
03:26:19.821059 IP 192.168.43.147.8880 > 192.168.43.124.7773: UDP, length 120
03:26:19.871059 IP 192.168.43.147.8880 > 192.168.43.124.7773: UDP, length 120
03:26:19.921059 IP 192.168.43.147.8880 > 192.168.43.124.7773: UDP, length 120
03:26:19.971059 IP 192.168.43.147.8880 > 192.168.43.124.7773: UDP, length 120
03:26:20.021058 IP 192.168.43.147.8880 > 192.168.43.124.7773: UDP, length 120
03:26:20.071058 IP 192.168.43.147.8880 > 192.168.43.124.7773: UDP, length 120
03:26:20.121057 IP 192.168.43.147.8880 > 192.168.43.124.7773: UDP, length 120
03:26:20.171059 IP 192.168.43.147.8880 > 192.168.43.124.7773: UDP, length 120
03:26:20.221059 IP 192.168.43.147.8880 > 192.168.43.124.7773: UDP, length 120
03:26:20.271058 IP 192.168.43.147.8880 > 192.168.43.124.7773: UDP, length 120
03:26:20.321057 IP 192.168.43.147.8880 > 192.168.43.124.7773: UDP, length 120
03:26:20.371057 IP 192.168.43.147.8880 > 192.168.43.124.7773: UDP, length 120
03:26:20.421058 IP 192.168.43.147.8880 > 192.168.43.124.7773: UDP, length 120
03:26:20.471060 IP 192.168.43.147.8880 > 192.168.43.124.7773: UDP, length 120
03:26:20.521060 IP 192.168.43.147.8880 > 192.168.43.124.7773: UDP, length 120
03:26:20.571058 IP 192.168.43.147.8880 > 192.168.43.124.7773: UDP, length 120
03:26:20.621060 IP 192.168.43.147.8880 > 192.168.43.124.7773: UDP, length 120
03:26:20.671060 IP 192.168.43.147.8880 > 192.168.43.124.7773: UDP, length 120
03:26:20.721058 IP 192.168.43.147.8880 > 192.168.43.124.7773: UDP, length 120
03:26:20.771058 IP 192.168.43.147.8880 > 192.168.43.124.7773: UDP, length 120
03:26:20.821057 IP 192.168.43.147.8880 > 192.168.43.124.7773: UDP, length 120
03:26:20.871058 IP 192.168.43.147.8880 > 192.168.43.124.7773: UDP, length 120
03:26:20.921058 IP 192.168.43.147.8880 > 192.168.43.124.7773: UDP, length 120
03:26:20.971058 IP 192.168.43.147.8880 > 192.168.43.124.7773: UDP, length 120
03:26:21.021059 IP 192.168.43.147.8880 > 192.168.43.124.7773: UDP, length 120
03:26:21.071104 IP 192.168.43.147.8880 > 192.168.43.124.7773: UDP, length 120
03:26:21.121068 IP 192.168.43.147.8880 > 192.168.43.124.7773: UDP, length 120
03:26:21.171060 IP 192.168.43.147.8880 > 192.168.43.124.7773: UDP, length 120
03:26:21.221059 IP 192.168.43.147.8880 > 192.168.43.124.7773: UDP, length 120
03:26:21.271059 IP 192.168.43.147.8880 > 192.168.43.124.7773: UDP, length 120
03:26:21.321058 IP 192.168.43.147.8880 > 192.168.43.124.7773: UDP, length 120
03:26:21.371057 IP 192.168.43.147.8880 > 192.168.43.124.7773: UDP, length 120
03:26:21.421058 IP 192.168.43.147.8880 > 192.168.43.124.7773: UDP, length 120
03:26:21.471057 IP 192.168.43.147.8880 > 192.168.43.124.7773: UDP, length 120
03:26:21.521062 IP 192.168.43.147.8880 > 192.168.43.124.7773: UDP, length 120
03:26:21.571061 IP 192.168.43.147.8880 > 192.168.43.124.7773: UDP, length 120
03:26:21.621062 IP 192.168.43.147.8880 > 192.168.43.124.7773: UDP, length 120
03:26:21.671060 IP 192.168.43.147.8880 > 192.168.43.124.7773: UDP, length 120
03:26:21.721058 IP 192.168.43.147.8880 > 192.168.43.124.7773: UDP, length 120
03:26:21.771057 IP 192.168.43.147.8880 > 192.168.43.124.7773: UDP, length 120
03:26:21.821057 IP 192.168.43.147.8880 > 192.168.43.124.7773: UDP, length 120
03:26:21.871058 IP 192.168.43.147.8880 > 192.168.43.124.7773: UDP, length 120
03:26:21.921086 IP 192.168.43.147.8880 > 192.168.43.124.7773: UDP, length 120
03:26:21.971085 IP 192.168.43.147.8880 > 192.168.43.124.7773: UDP, length 120
03:26:22.021084 IP 192.168.43.147.8880 > 192.168.43.124.7773: UDP, length 120
03:26:22.071084 IP 192.168.43.147.8880 > 192.168.43.124.7773: UDP, length 120
03:26:22.121084 IP 192.168.43.147.8880 > 192.168.43.124.7773: UDP, length 120
03:26:22.171086 IP 192.168.43.147.8880 > 192.168.43.124.7773: UDP, length 120
03:26:22.221083 IP 192.168.43.147.8880 > 192.168.43.124.7773: UDP, length 120
03:26:22.271082 IP 192.168.43.147.8880 > 192.168.43.124.7773: UDP, length 120
03:26:22.321084 IP 192.168.43.147.8880 > 192.168.43.124.7773: UDP, length 120
03:26:22.371082 IP 192.168.43.147.8880 > 192.168.43.124.7773: UDP, length 120
03:26:22.421085 IP 192.168.43.147.8880 > 192.168.43.124.7773: UDP, length 120
03:26:22.471084 IP 192.168.43.147.8880 > 192.168.43.124.7773: UDP, length 120
03:26:22.521083 IP 192.168.43.147.8880 > 192.168.43.124.7773: UDP, length 120
03:26:22.571146 IP 192.168.43.147.8880 > 192.168.43.124.7773: UDP, length 120
03:26:22.621103 IP 192.168.43.147.8880 > 192.168.43.124.7773: UDP, length 120
03:26:22.671087 IP 192.168.43.147.8880 > 192.168.43.124.7773: UDP, length 120
03:26:22.721085 IP 192.168.43.147.8880 > 192.168.43.124.7773: UDP, length 120
03:26:22.771084 IP 192.168.43.147.8880 > 192.168.43.124.7773: UDP, length 120
03:26:22.821084 IP 192.168.43.147.8880 > 192.168.43.124.7773: UDP, length 120
03:26:22.871084 IP 192.168.43.147.8880 > 192.168.43.124.7773: UDP, length 120
03:26:22.921086 IP 192.168.43.147.8880 > 192.168.43.124.7773: UDP, length 120
03:26:22.971085 IP 192.168.43.147.8880 > 192.168.43.124.7773: UDP, length 120
03:26:23.021084 IP 192.168.43.147.8880 > 192.168.43.124.7773: UDP, length 120
03:26:23.071082 IP 192.168.43.147.8880 > 192.168.43.124.7773: UDP, length 120
03:26:23.121083 IP 192.168.43.147.8880 > 192.168.43.124.7773: UDP, length 120
03:26:23.171086 IP 192.168.43.147.8880 > 192.168.43.124.7773: UDP, length 120
03:26:23.221083 IP 192.168.43.147.8880 > 192.168.43.124.7773: UDP, length 120
03:26:23.271085 IP 192.168.43.147.8880 > 192.168.43.124.7773: UDP, length 120
03:26:23.321083 IP 192.168.43.147.8880 > 192.168.43.124.7773: UDP, length 120
03:26:23.371082 IP 192.168.43.147.8880 > 192.168.43.124.7773: UDP, length 120
03:26:23.421084 IP 192.168.43.147.8880 > 192.168.43.124.7773: UDP, length 120
03:26:23.471083 IP 192.168.43.147.8880 > 192.168.43.124.7773: UDP, length 120
03:26:23.521084 IP 192.168.43.147.8880 > 192.168.43.124.7773: UDP, length 120
03:26:23.571084 IP 192.168.43.147.8880 > 192.168.43.124.7773: UDP, length 120
03:26:23.621092 IP 192.168.43.147.8880 > 192.168.43.124.7773: UDP, length 120
03:26:23.671085 IP 192.168.43.147.8880 > 192.168.43.124.7773: UDP, length 120
03:26:23.721083 IP 192.168.43.147.8880 > 192.168.43.124.7773: UDP, length 120
03:26:23.771082 IP 192.168.43.147.8880 > 192.168.43.124.7773: UDP, length 120
03:26:23.821082 IP 192.168.43.147.8880 > 192.168.43.124.7773: UDP, length 120
03:26:23.871084 IP 192.168.43.147.8880 > 192.168.43.124.7773: UDP, length 120
03:26:23.921086 IP 192.168.43.147.8880 > 192.168.43.124.7773: UDP, length 120
03:26:23.971086 IP 192.168.43.147.8880 > 192.168.43.124.7773: UDP, length 120
03:26:24.021084 IP 192.168.43.147.8880 > 192.168.43.124.7773: UDP, length 120
03:26:24.071147 IP 192.168.43.147.8880 > 192.168.43.124.7773: UDP, length 120
03:26:24.121101 IP 192.168.43.147.8880 > 192.168.43.124.7773: UDP, length 120
03:26:24.171089 IP 192.168.43.147.8880 > 192.168.43.124.7773: UDP, length 120
03:26:24.221083 IP 192.168.43.147.8880 > 192.168.43.124.7773: UDP, length 120
03:26:24.271149 IP 192.168.43.147.8880 > 192.168.43.124.7773: UDP, length 120
03:26:24.321193 IP 192.168.43.147.8880 > 192.168.43.124.7773: UDP, length 120
03:26:24.371167 IP 192.168.43.147.8880 > 192.168.43.124.7773: UDP, length 120
03:26:24.421178 IP 192.168.43.147.8880 > 192.168.43.124.7773: UDP, length 120
03:26:24.471139 IP 192.168.43.147.8880 > 192.168.43.124.7773: UDP, length 120
03:26:24.521138 IP 192.168.43.147.8880 > 192.168.43.124.7773: UDP, length 120
03:26:24.571119 IP 192.168.43.147.8880 > 192.168.43.124.7773: UDP, length 120
03:26:24.621131 IP 192.168.43.147.8880 > 192.168.43.124.7773: UDP, length 120
03:26:24.671145 IP 192.168.43.147.8880 > 192.168.43.124.7773: UDP, length 120
03:26:24.721119 IP 192.168.43.147.8880 > 192.168.43.124.7773: UDP, length 120
03:26:24.771068 IP 192.168.43.147.8880 > 192.168.43.124.7773: UDP, length 120
03:26:24.821067 IP 192.168.43.147.8880 > 192.168.43.124.7773: UDP, length 120
03:26:24.871061 IP 192.168.43.147.8880 > 192.168.43.124.7773: UDP, length 120
03:26:24.921062 IP 192.168.43.147.8880 > 192.168.43.124.7773: UDP, length 120
03:26:24.971060 IP 192.168.43.147.8880 > 192.168.43.124.7773: UDP, length 120
03:26:25.021059 IP 192.168.43.147.8880 > 192.168.43.124.7773: UDP, length 120
03:26:25.071059 IP 192.168.43.147.8880 > 192.168.43.124.7773: UDP, length 120
03:26:25.121060 IP 192.168.43.147.8880 > 192.168.43.124.7773: UDP, length 120
03:26:25.171059 IP 192.168.43.147.8880 > 192.168.43.124.7773: UDP, length 120
03:26:25.221059 IP 192.168.43.147.8880 > 192.168.43.124.7773: UDP, length 120
03:26:25.271059 IP 192.168.43.147.8880 > 192.168.43.124.7773: UDP, length 120
03:26:25.321059 IP 192.168.43.147.8880 > 192.168.43.124.7773: UDP, length 120
03:26:25.371058 IP 192.168.43.147.8880 > 192.168.43.124.7773: UDP, length 120
03:26:25.421059 IP 192.168.43.147.8880 > 192.168.43.124.7773: UDP, length 120
03:26:25.471059 IP 192.168.43.147.8880 > 192.168.43.124.7773: UDP, length 120
03:26:25.521059 IP 192.168.43.147.8880 > 192.168.43.124.7773: UDP, length 120
03:26:25.571110 IP 192.168.43.147.8880 > 192.168.43.124.7773: UDP, length 120
03:26:25.621075 IP 192.168.43.147.8880 > 192.168.43.124.7773: UDP, length 120
03:26:25.671060 IP 192.168.43.147.8880 > 192.168.43.124.7773: UDP, length 120
03:26:25.721060 IP 192.168.43.147.8880 > 192.168.43.124.7773: UDP, length 120
03:26:25.771059 IP 192.168.43.147.8880 > 192.168.43.124.7773: UDP, length 120
03:26:25.821059 IP 192.168.43.147.8880 > 192.168.43.124.7773: UDP, length 120
03:26:25.871060 IP 192.168.43.147.8880 > 192.168.43.124.7773: UDP, length 120
03:26:25.921064 IP 192.168.43.147.8880 > 192.168.43.124.7773: UDP, length 120
03:26:25.971058 IP 192.168.43.147.8880 > 192.168.43.124.7773: UDP, length 120
03:26:26.021059 IP 192.168.43.147.8880 > 192.168.43.124.7773: UDP, length 120
03:26:26.071069 IP 192.168.43.147.8880 > 192.168.43.124.7773: UDP, length 120
03:26:26.121061 IP 192.168.43.147.8880 > 192.168.43.124.7773: UDP, length 120
03:26:26.171060 IP 192.168.43.147.8880 > 192.168.43.124.7773: UDP, length 120
03:26:26.221058 IP 192.168.43.147.8880 > 192.168.43.124.7773: UDP, length 120
03:26:26.271057 IP 192.168.43.147.8880 > 192.168.43.124.7773: UDP, length 120
03:26:26.321059 IP 192.168.43.147.8880 > 192.168.43.124.7773: UDP, length 120
03:26:26.371058 IP 192.168.43.147.8880 > 192.168.43.124.7773: UDP, length 120
03:26:26.421058 IP 192.168.43.147.8880 > 192.168.43.124.7773: UDP, length 120
03:26:26.471057 IP 192.168.43.147.8880 > 192.168.43.124.7773: UDP, length 120
03:26:26.521099 IP 192.168.43.147.8880 > 192.168.43.124.7773: UDP, length 120
03:26:26.571058 IP 192.168.43.147.8880 > 192.168.43.124.7773: UDP, length 120
03:26:26.621060 IP 192.168.43.147.8880 > 192.168.43.124.7773: UDP, length 120
03:26:26.671059 IP 192.168.43.147.8880 > 192.168.43.124.7773: UDP, length 120
03:26:26.721059 IP 192.168.43.147.8880 > 192.168.43.124.7773: UDP, length 120
03:26:26.771059 IP 192.168.43.147.8880 > 192.168.43.124.7773: UDP, length 120
03:26:26.821061 IP 192.168.43.147.8880 > 192.168.43.124.7773: UDP, length 120
03:26:26.871059 IP 192.168.43.147.8880 > 192.168.43.124.7773: UDP, length 120
03:26:26.921083 IP 192.168.43.147.8880 > 192.168.43.124.7773: UDP, length 120
03:26:26.971083 IP 192.168.43.147.8880 > 192.168.43.124.7773: UDP, length 120
03:26:27.021085 IP 192.168.43.147.8880 > 192.168.43.124.7773: UDP, length 120
03:26:27.071682 IP 192.168.43.147.8880 > 192.168.43.124.7773: UDP, length 120
03:26:27.121110 IP 192.168.43.147.8880 > 192.168.43.124.7773: UDP, length 120
03:26:27.171089 IP 192.168.43.147.8880 > 192.168.43.124.7773: UDP, length 120
03:26:27.221082 IP 192.168.43.147.8880 > 192.168.43.124.7773: UDP, length 120
03:26:27.271083 IP 192.168.43.147.8880 > 192.168.43.124.7773: UDP, length 120
03:26:27.321083 IP 192.168.43.147.8880 > 192.168.43.124.7773: UDP, length 120
03:26:27.371085 IP 192.168.43.147.8880 > 192.168.43.124.7773: UDP, length 120
03:26:27.421085 IP 192.168.43.147.8880 > 192.168.43.124.7773: UDP, length 120
03:26:27.471084 IP 192.168.43.147.8880 > 192.168.43.124.7773: UDP, length 120
03:26:27.521084 IP 192.168.43.147.8880 > 192.168.43.124.7773: UDP, length 120
03:26:27.571086 IP 192.168.43.147.8880 > 192.168.43.124.7773: UDP, length 120
03:26:27.621088 IP 192.168.43.147.8880 > 192.168.43.124.7773: UDP, length 120
03:26:27.671086 IP 192.168.43.147.8880 > 192.168.43.124.7773: UDP, length 120
03:26:27.721085 IP 192.168.43.147.8880 > 192.168.43.124.7773: UDP, length 120
03:26:27.771083 IP 192.168.43.147.8880 > 192.168.43.124.7773: UDP, length 120
03:26:27.821084 IP 192.168.43.147.8880 > 192.168.43.124.7773: UDP, length 120
03:26:27.871085 IP 192.168.43.147.8880 > 192.168.43.124.7773: UDP, length 120
03:26:27.921089 IP 192.168.43.147.8880 > 192.168.43.124.7773: UDP, length 120
03:26:27.971084 IP 192.168.43.147.8880 > 192.168.43.124.7773: UDP, length 120
03:26:28.021084 IP 192.168.43.147.8880 > 192.168.43.124.7773: UDP, length 120
03:26:28.071083 IP 192.168.43.147.8880 > 192.168.43.124.7773: UDP, length 120
03:26:28.121083 IP 192.168.43.147.8880 > 192.168.43.124.7773: UDP, length 120
03:26:28.171085 IP 192.168.43.147.8880 > 192.168.43.124.7773: UDP, length 120
03:26:28.221085 IP 192.168.43.147.8880 > 192.168.43.124.7773: UDP, length 120
03:26:28.271084 IP 192.168.43.147.8880 > 192.168.43.124.7773: UDP, length 120
03:26:28.321082 IP 192.168.43.147.8880 > 192.168.43.124.7773: UDP, length 120
03:26:28.371084 IP 192.168.43.147.8880 > 192.168.43.124.7773: UDP, length 120
03:26:28.421083 IP 192.168.43.147.8880 > 192.168.43.124.7773: UDP, length 120
03:26:28.471083 IP 192.168.43.147.8880 > 192.168.43.124.7773: UDP, length 120
03:26:28.521083 IP 192.168.43.147.8880 > 192.168.43.124.7773: UDP, length 120
03:26:28.573456 IP 192.168.43.147.8880 > 192.168.43.124.7773: UDP, length 120
03:26:28.621117 IP 192.168.43.147.8880 > 192.168.43.124.7773: UDP, length 120
03:26:28.671086 IP 192.168.43.147.8880 > 192.168.43.124.7773: UDP, length 120
03:26:28.721085 IP 192.168.43.147.8880 > 192.168.43.124.7773: UDP, length 120
03:26:28.771084 IP 192.168.43.147.8880 > 192.168.43.124.7773: UDP, length 120
03:26:28.821084 IP 192.168.43.147.8880 > 192.168.43.124.7773: UDP, length 120
03:26:28.871084 IP 192.168.43.147.8880 > 192.168.43.124.7773: UDP, length 120
03:26:28.921093 IP 192.168.43.147.8880 > 192.168.43.124.7773: UDP, length 120
03:26:28.971086 IP 192.168.43.147.8880 > 192.168.43.124.7773: UDP, length 120
03:26:29.021083 IP 192.168.43.147.8880 > 192.168.43.124.7773: UDP, length 120
03:26:29.071084 IP 192.168.43.147.8880 > 192.168.43.124.7773: UDP, length 120
03:26:29.121084 IP 192.168.43.147.8880 > 192.168.43.124.7773: UDP, length 120
03:26:29.171084 IP 192.168.43.147.8880 > 192.168.43.124.7773: UDP, length 120
03:26:29.221083 IP 192.168.43.147.8880 > 192.168.43.124.7773: UDP, length 120
03:26:29.271084 IP 192.168.43.147.8880 > 192.168.43.124.7773: UDP, length 120
03:26:29.321083 IP 192.168.43.147.8880 > 192.168.43.124.7773: UDP, length 120
03:26:29.371083 IP 192.168.43.147.8880 > 192.168.43.124.7773: UDP, length 120
03:26:29.421083 IP 192.168.43.147.8880 > 192.168.43.124.7773: UDP, length 120
03:26:29.471083 IP 192.168.43.147.8880 > 192.168.43.124.7773: UDP, length 120
03:26:29.521092 IP 192.168.43.147.8880 > 192.168.43.124.7773: UDP, length 120
03:26:29.571088 IP 192.168.43.147.8880 > 192.168.43.124.7773: UDP, length 120
03:26:29.621090 IP 192.168.43.147.8880 > 192.168.43.124.7773: UDP, length 120
03:26:29.671085 IP 192.168.43.147.8880 > 192.168.43.124.7773: UDP, length 120
03:26:29.721179 IP 192.168.43.147.8880 > 192.168.43.124.7773: UDP, length 120
03:26:29.771186 IP 192.168.43.147.8880 > 192.168.43.124.7773: UDP, length 120
03:26:29.821160 IP 192.168.43.147.8880 > 192.168.43.124.7773: UDP, length 120
03:26:29.871117 IP 192.168.43.147.8880 > 192.168.43.124.7773: UDP, length 120
03:26:29.921166 IP 192.168.43.147.8880 > 192.168.43.124.7773: UDP, length 120
03:26:29.927681 IP 192.168.43.124.8880 > 192.168.43.147.7772: UDP, length 120
03:26:29.971132 IP 192.168.43.147.8880 > 192.168.43.124.7773: UDP, length 120
03:26:29.976030 IP 192.168.43.124.8880 > 192.168.43.147.7772: UDP, length 120
03:26:30.021167 IP 192.168.43.147.8880 > 192.168.43.124.7773: UDP, length 120
03:26:30.041899 IP 192.168.43.124.8880 > 192.168.43.147.7772: UDP, length 120
03:26:30.071197 IP 192.168.43.147.8880 > 192.168.43.124.7773: UDP, length 120
03:26:30.076346 IP 192.168.43.124.8880 > 192.168.43.147.7772: UDP, length 120
03:26:30.121137 IP 192.168.43.147.8880 > 192.168.43.124.7773: UDP, length 120
03:26:30.125716 IP 192.168.43.124.8880 > 192.168.43.147.7772: UDP, length 120
03:26:30.171117 IP 192.168.43.147.8880 > 192.168.43.124.7773: UDP, length 120
03:26:30.178257 IP 192.168.43.124.8880 > 192.168.43.147.7772: UDP, length 120
03:26:30.221073 IP 192.168.43.147.8880 > 192.168.43.124.7773: UDP, length 120
03:26:30.235783 IP 192.168.43.124.8880 > 192.168.43.147.7772: UDP, length 120
03:26:30.271061 IP 192.168.43.147.8880 > 192.168.43.124.7773: UDP, length 120
03:26:30.277635 IP 192.168.43.124.8880 > 192.168.43.147.7772: UDP, length 120
03:26:30.321060 IP 192.168.43.147.8880 > 192.168.43.124.7773: UDP, length 120
03:26:30.327246 IP 192.168.43.124.8880 > 192.168.43.147.7772: UDP, length 120
03:26:30.371060 IP 192.168.43.147.8880 > 192.168.43.124.7773: UDP, length 120
03:26:30.382789 IP 192.168.43.124.8880 > 192.168.43.147.7772: UDP, length 120
03:26:30.421059 IP 192.168.43.147.8880 > 192.168.43.124.7773: UDP, length 120
03:26:30.443585 IP 192.168.43.124.8880 > 192.168.43.147.7772: UDP, length 120
03:26:30.479558 IP 192.168.43.124.8880 > 192.168.43.147.7772: UDP, length 120
03:26:30.525796 IP 192.168.43.124.8880 > 192.168.43.147.7772: UDP, length 120
03:26:30.580278 IP 192.168.43.124.8880 > 192.168.43.147.7772: UDP, length 120
03:26:30.637921 IP 192.168.43.124.8880 > 192.168.43.147.7772: UDP, length 120
03:26:30.682241 IP 192.168.43.124.8880 > 192.168.43.147.7772: UDP, length 120
03:26:30.730000 IP 192.168.43.124.8880 > 192.168.43.147.7772: UDP, length 120
03:26:30.780307 IP 192.168.43.124.8880 > 192.168.43.147.7772: UDP, length 120
03:26:30.838498 IP 192.168.43.124.8880 > 192.168.43.147.7772: UDP, length 120
03:26:30.878778 IP 192.168.43.124.8880 > 192.168.43.147.7772: UDP, length 120
03:26:30.925932 IP 192.168.43.124.8880 > 192.168.43.147.7772: UDP, length 120
03:26:30.978771 IP 192.168.43.124.8880 > 192.168.43.147.7772: UDP, length 120
03:26:31.038845 IP 192.168.43.124.8880 > 192.168.43.147.7772: UDP, length 120
03:26:31.079157 IP 192.168.43.124.8880 > 192.168.43.147.7772: UDP, length 120
03:26:31.130917 IP 192.168.43.124.8880 > 192.168.43.147.7772: UDP, length 120
03:26:31.178848 IP 192.168.43.124.8880 > 192.168.43.147.7772: UDP, length 120
03:26:31.238608 IP 192.168.43.124.8880 > 192.168.43.147.7772: UDP, length 120
03:26:31.278968 IP 192.168.43.124.8880 > 192.168.43.147.7772: UDP, length 120
03:26:31.328823 IP 192.168.43.124.8880 > 192.168.43.147.7772: UDP, length 120
03:26:31.378850 IP 192.168.43.124.8880 > 192.168.43.147.7772: UDP, length 120
03:26:31.440747 IP 192.168.43.124.8880 > 192.168.43.147.7772: UDP, length 120
03:26:31.479065 IP 192.168.43.124.8880 > 192.168.43.147.7772: UDP, length 120
03:26:31.525539 IP 192.168.43.124.8880 > 192.168.43.147.7772: UDP, length 120
03:26:31.578980 IP 192.168.43.124.8880 > 192.168.43.147.7772: UDP, length 120
03:26:31.635729 IP 192.168.43.124.8880 > 192.168.43.147.7772: UDP, length 120
03:26:31.681240 IP 192.168.43.124.8880 > 192.168.43.147.7772: UDP, length 120
03:26:31.728608 IP 192.168.43.124.8880 > 192.168.43.147.7772: UDP, length 120
03:26:31.788876 IP 192.168.43.124.8880 > 192.168.43.147.7772: UDP, length 120
03:26:31.828686 IP 192.168.43.124.8880 > 192.168.43.147.7772: UDP, length 120
03:26:31.878872 IP 192.168.43.124.8880 > 192.168.43.147.7772: UDP, length 120
03:26:31.929357 IP 192.168.43.124.8880 > 192.168.43.147.7772: UDP, length 120
03:26:31.990531 IP 192.168.43.124.8880 > 192.168.43.147.7772: UDP, length 120
03:26:32.029630 IP 192.168.43.124.8880 > 192.168.43.147.7772: UDP, length 120
03:26:32.075875 IP 192.168.43.124.8880 > 192.168.43.147.7772: UDP, length 120
03:26:32.137174 IP 192.168.43.124.8880 > 192.168.43.147.7772: UDP, length 120
03:26:32.180424 IP 192.168.43.124.8880 > 192.168.43.147.7772: UDP, length 120
03:26:32.228792 IP 192.168.43.124.8880 > 192.168.43.147.7772: UDP, length 120
03:26:32.295373 IP 192.168.43.124.8880 > 192.168.43.147.7772: UDP, length 120
03:26:32.328924 IP 192.168.43.124.8880 > 192.168.43.147.7772: UDP, length 120
03:26:32.379214 IP 192.168.43.124.8880 > 192.168.43.147.7772: UDP, length 120
03:26:32.429931 IP 192.168.43.124.8880 > 192.168.43.147.7772: UDP, length 120
03:26:32.490388 IP 192.168.43.124.8880 > 192.168.43.147.7772: UDP, length 120
03:26:32.528859 IP 192.168.43.124.8880 > 192.168.43.147.7772: UDP, length 120
03:26:32.578976 IP 192.168.43.124.8880 > 192.168.43.147.7772: UDP, length 120
03:26:32.630973 IP 192.168.43.124.8880 > 192.168.43.147.7772: UDP, length 120
03:26:32.688632 IP 192.168.43.124.8880 > 192.168.43.147.7772: UDP, length 120
03:26:32.734793 IP 192.168.43.124.8880 > 192.168.43.147.7772: UDP, length 120
03:26:32.780605 IP 192.168.43.124.8880 > 192.168.43.147.7772: UDP, length 120
03:26:32.841233 IP 192.168.43.124.8880 > 192.168.43.147.7772: UDP, length 120
03:26:32.878937 IP 192.168.43.124.8880 > 192.168.43.147.7772: UDP, length 120
03:26:32.935111 IP 192.168.43.124.8880 > 192.168.43.147.7772: UDP, length 120
03:26:32.978855 IP 192.168.43.124.8880 > 192.168.43.147.7772: UDP, length 120
03:26:33.038895 IP 192.168.43.124.8880 > 192.168.43.147.7772: UDP, length 120
03:26:33.079204 IP 192.168.43.124.8880 > 192.168.43.147.7772: UDP, length 120
03:26:33.129167 IP 192.168.43.124.8880 > 192.168.43.147.7772: UDP, length 120
03:26:33.179261 IP 192.168.43.124.8880 > 192.168.43.147.7772: UDP, length 120
03:26:33.239644 IP 192.168.43.124.8880 > 192.168.43.147.7772: UDP, length 120
03:26:33.278891 IP 192.168.43.124.8880 > 192.168.43.147.7772: UDP, length 120
03:26:33.330078 IP 192.168.43.124.8880 > 192.168.43.147.7772: UDP, length 120
03:26:33.379972 IP 192.168.43.124.8880 > 192.168.43.147.7772: UDP, length 120
03:26:33.438977 IP 192.168.43.124.8880 > 192.168.43.147.7772: UDP, length 120
03:26:33.479620 IP 192.168.43.124.8880 > 192.168.43.147.7772: UDP, length 120
03:26:33.525736 IP 192.168.43.124.8880 > 192.168.43.147.7772: UDP, length 120
03:26:33.578911 IP 192.168.43.124.8880 > 192.168.43.147.7772: UDP, length 120
03:26:33.639012 IP 192.168.43.124.8880 > 192.168.43.147.7772: UDP, length 120
03:26:33.679644 IP 192.168.43.124.8880 > 192.168.43.147.7772: UDP, length 120
03:26:33.728784 IP 192.168.43.124.8880 > 192.168.43.147.7772: UDP, length 120
03:26:33.781363 IP 192.168.43.124.8880 > 192.168.43.147.7772: UDP, length 120
03:26:33.838573 IP 192.168.43.124.8880 > 192.168.43.147.7772: UDP, length 120
03:26:33.878992 IP 192.168.43.124.8880 > 192.168.43.147.7772: UDP, length 120
03:26:33.929121 IP 192.168.43.124.8880 > 192.168.43.147.7772: UDP, length 120
03:26:33.978902 IP 192.168.43.124.8880 > 192.168.43.147.7772: UDP, length 120
03:26:34.038534 IP 192.168.43.124.8880 > 192.168.43.147.7772: UDP, length 120
03:26:34.079134 IP 192.168.43.124.8880 > 192.168.43.147.7772: UDP, length 120
03:26:34.128733 IP 192.168.43.124.8880 > 192.168.43.147.7772: UDP, length 120
03:26:34.186327 IP 192.168.43.124.8880 > 192.168.43.147.7772: UDP, length 120
03:26:34.230067 IP 192.168.43.124.8880 > 192.168.43.147.7772: UDP, length 120
03:26:34.278750 IP 192.168.43.124.8880 > 192.168.43.147.7772: UDP, length 120
03:26:34.346444 IP 192.168.43.124.8880 > 192.168.43.147.7772: UDP, length 120
03:26:34.378881 IP 192.168.43.124.8880 > 192.168.43.147.7772: UDP, length 120
03:26:34.429303 IP 192.168.43.124.8880 > 192.168.43.147.7772: UDP, length 120
03:26:34.478963 IP 192.168.43.124.8880 > 192.168.43.147.7772: UDP, length 120
03:26:34.532963 IP 192.168.43.124.8880 > 192.168.43.147.7772: UDP, length 120
03:26:34.581371 IP 192.168.43.124.8880 > 192.168.43.147.7772: UDP, length 120
03:26:34.630579 IP 192.168.43.124.8880 > 192.168.43.147.7772: UDP, length 120
03:26:34.686776 IP 192.168.43.124.8880 > 192.168.43.147.7772: UDP, length 120
03:26:34.728761 IP 192.168.43.124.8880 > 192.168.43.147.7772: UDP, length 120
03:26:34.780035 IP 192.168.43.124.8880 > 192.168.43.147.7772: UDP, length 120
03:26:34.846520 IP 192.168.43.124.8880 > 192.168.43.147.7772: UDP, length 120
03:26:34.879824 IP 192.168.43.124.8880 > 192.168.43.147.7772: UDP, length 120
03:26:34.928930 IP 192.168.43.124.8880 > 192.168.43.147.7772: UDP, length 120
03:26:34.981396 IP 192.168.43.124.8880 > 192.168.43.147.7772: UDP, length 120
03:26:35.040082 IP 192.168.43.124.8880 > 192.168.43.147.7772: UDP, length 120
03:26:35.084104 IP 192.168.43.124.8880 > 192.168.43.147.7772: UDP, length 120
03:26:35.129259 IP 192.168.43.124.8880 > 192.168.43.147.7772: UDP, length 120
03:26:35.178951 IP 192.168.43.124.8880 > 192.168.43.147.7772: UDP, length 120
03:26:35.240514 IP 192.168.43.124.8880 > 192.168.43.147.7772: UDP, length 120
03:26:35.293349 IP 192.168.43.124.8880 > 192.168.43.147.7772: UDP, length 120
03:26:35.329564 IP 192.168.43.124.8880 > 192.168.43.147.7772: UDP, length 120
03:26:35.380052 IP 192.168.43.124.8880 > 192.168.43.147.7772: UDP, length 120
03:26:35.438847 IP 192.168.43.124.8880 > 192.168.43.147.7772: UDP, length 120
03:26:35.479460 IP 192.168.43.124.8880 > 192.168.43.147.7772: UDP, length 120
03:26:35.525852 IP 192.168.43.124.8880 > 192.168.43.147.7772: UDP, length 120
03:26:35.578635 IP 192.168.43.124.8880 > 192.168.43.147.7772: UDP, length 120
03:26:35.636742 IP 192.168.43.124.8880 > 192.168.43.147.7772: UDP, length 120
03:26:35.678788 IP 192.168.43.124.8880 > 192.168.43.147.7772: UDP, length 120
03:26:35.728612 IP 192.168.43.124.8880 > 192.168.43.147.7772: UDP, length 120
03:26:35.794589 IP 192.168.43.124.8880 > 192.168.43.147.7772: UDP, length 120
03:26:35.828947 IP 192.168.43.124.8880 > 192.168.43.147.7772: UDP, length 120
03:26:35.879209 IP 192.168.43.124.8880 > 192.168.43.147.7772: UDP, length 120
03:26:35.940814 IP 192.168.43.124.8880 > 192.168.43.147.7772: UDP, length 120
03:26:35.981654 IP 192.168.43.124.8880 > 192.168.43.147.7772: UDP, length 120
03:26:36.028838 IP 192.168.43.124.8880 > 192.168.43.147.7772: UDP, length 120
03:26:36.075176 IP 192.168.43.124.8880 > 192.168.43.147.7772: UDP, length 120
03:26:36.127240 IP 192.168.43.124.8880 > 192.168.43.147.7772: UDP, length 120
03:26:36.178940 IP 192.168.43.124.8880 > 192.168.43.147.7772: UDP, length 120
03:26:36.228655 IP 192.168.43.124.8880 > 192.168.43.147.7772: UDP, length 120
03:26:36.289499 IP 192.168.43.124.8880 > 192.168.43.147.7772: UDP, length 120
03:26:36.328791 IP 192.168.43.124.8880 > 192.168.43.147.7772: UDP, length 120
03:26:36.378571 IP 192.168.43.124.8880 > 192.168.43.147.7772: UDP, length 120
03:26:36.431090 IP 192.168.43.124.8880 > 192.168.43.147.7772: UDP, length 120
03:26:36.488689 IP 192.168.43.124.8880 > 192.168.43.147.7772: UDP, length 120
03:26:36.527238 IP 192.168.43.124.8880 > 192.168.43.147.7772: UDP, length 120
03:26:36.578547 IP 192.168.43.124.8880 > 192.168.43.147.7772: UDP, length 120
03:26:36.629857 IP 192.168.43.124.8880 > 192.168.43.147.7772: UDP, length 120
03:26:36.688521 IP 192.168.43.124.8880 > 192.168.43.147.7772: UDP, length 120
03:26:36.731117 IP 192.168.43.124.8880 > 192.168.43.147.7772: UDP, length 120
03:26:36.778855 IP 192.168.43.124.8880 > 192.168.43.147.7772: UDP, length 120
03:26:36.829112 IP 192.168.43.124.8880 > 192.168.43.147.7772: UDP, length 120
03:26:36.889858 IP 192.168.43.124.8880 > 192.168.43.147.7772: UDP, length 120
03:26:36.929044 IP 192.168.43.124.8880 > 192.168.43.147.7772: UDP, length 120
03:26:36.978967 IP 192.168.43.124.8880 > 192.168.43.147.7772: UDP, length 120
03:26:37.030162 IP 192.168.43.124.8880 > 192.168.43.147.7772: UDP, length 120
03:26:37.088790 IP 192.168.43.124.8880 > 192.168.43.147.7772: UDP, length 120
03:26:37.132813 IP 192.168.43.124.8880 > 192.168.43.147.7772: UDP, length 120
03:26:37.178821 IP 192.168.43.124.8880 > 192.168.43.147.7772: UDP, length 120
03:26:37.231301 IP 192.168.43.124.8880 > 192.168.43.147.7772: UDP, length 120
03:26:37.290445 IP 192.168.43.124.8880 > 192.168.43.147.7772: UDP, length 120
03:26:37.329146 IP 192.168.43.124.8880 > 192.168.43.147.7772: UDP, length 120
03:26:37.378820 IP 192.168.43.124.8880 > 192.168.43.147.7772: UDP, length 120
03:26:37.429750 IP 192.168.43.124.8880 > 192.168.43.147.7772: UDP, length 120
03:26:37.490070 IP 192.168.43.124.8880 > 192.168.43.147.7772: UDP, length 120
03:26:37.525219 IP 192.168.43.124.8880 > 192.168.43.147.7772: UDP, length 120
03:26:37.578698 IP 192.168.43.124.8880 > 192.168.43.147.7772: UDP, length 120
03:26:37.630484 IP 192.168.43.124.8880 > 192.168.43.147.7772: UDP, length 120
03:26:37.686058 IP 192.168.43.124.8880 > 192.168.43.147.7772: UDP, length 120
03:26:37.725903 IP 192.168.43.124.8880 > 192.168.43.147.7772: UDP, length 120
03:26:37.779957 IP 192.168.43.124.8880 > 192.168.43.147.7772: UDP, length 120
03:26:37.829243 IP 192.168.43.124.8880 > 192.168.43.147.7772: UDP, length 120
03:26:37.888593 IP 192.168.43.124.8880 > 192.168.43.147.7772: UDP, length 120
03:26:37.928710 IP 192.168.43.124.8880 > 192.168.43.147.7772: UDP, length 120
03:26:37.978861 IP 192.168.43.124.8880 > 192.168.43.147.7772: UDP, length 120
03:26:38.029560 IP 192.168.43.124.8880 > 192.168.43.147.7772: UDP, length 120
03:26:38.086843 IP 192.168.43.124.8880 > 192.168.43.147.7772: UDP, length 120
03:26:38.132051 IP 192.168.43.124.8880 > 192.168.43.147.7772: UDP, length 120
03:26:38.178677 IP 192.168.43.124.8880 > 192.168.43.147.7772: UDP, length 120
03:26:38.228823 IP 192.168.43.124.8880 > 192.168.43.147.7772: UDP, length 120
03:26:38.288306 IP 192.168.43.124.8880 > 192.168.43.147.7772: UDP, length 120
03:26:38.329252 IP 192.168.43.124.8880 > 192.168.43.147.7772: UDP, length 120
03:26:38.378746 IP 192.168.43.124.8880 > 192.168.43.147.7772: UDP, length 120
03:26:38.429126 IP 192.168.43.124.8880 > 192.168.43.147.7772: UDP, length 120
03:26:38.502065 IP 192.168.43.124.8880 > 192.168.43.147.7772: UDP, length 120
03:26:38.526402 IP 192.168.43.124.8880 > 192.168.43.147.7772: UDP, length 120
03:26:38.578959 IP 192.168.43.124.8880 > 192.168.43.147.7772: UDP, length 120
03:26:38.629441 IP 192.168.43.124.8880 > 192.168.43.147.7772: UDP, length 120
03:26:38.688783 IP 192.168.43.124.8880 > 192.168.43.147.7772: UDP, length 120
03:26:38.728631 IP 192.168.43.124.8880 > 192.168.43.147.7772: UDP, length 120
03:26:38.779606 IP 192.168.43.124.8880 > 192.168.43.147.7772: UDP, length 120
03:26:38.830458 IP 192.168.43.124.8880 > 192.168.43.147.7772: UDP, length 120
03:26:38.885723 IP 192.168.43.124.8880 > 192.168.43.147.7772: UDP, length 120
03:26:38.932430 IP 192.168.43.124.8880 > 192.168.43.147.7772: UDP, length 120
03:26:38.980586 IP 192.168.43.124.8880 > 192.168.43.147.7772: UDP, length 120
03:26:39.028797 IP 192.168.43.124.8880 > 192.168.43.147.7772: UDP, length 120
03:26:39.089760 IP 192.168.43.124.8880 > 192.168.43.147.7772: UDP, length 120
03:26:39.138534 IP 192.168.43.124.8880 > 192.168.43.147.7772: UDP, length 120
03:26:39.180490 IP 192.168.43.124.8880 > 192.168.43.147.7772: UDP, length 120
03:26:39.228969 IP 192.168.43.124.8880 > 192.168.43.147.7772: UDP, length 120
03:26:39.295672 IP 192.168.43.124.8880 > 192.168.43.147.7772: UDP, length 120
03:26:39.329817 IP 192.168.43.124.8880 > 192.168.43.147.7772: UDP, length 120
03:26:39.378888 IP 192.168.43.124.8880 > 192.168.43.147.7772: UDP, length 120
03:26:39.428792 IP 192.168.43.124.8880 > 192.168.43.147.7772: UDP, length 120
03:26:39.488828 IP 192.168.43.124.8880 > 192.168.43.147.7772: UDP, length 120
03:26:39.525972 IP 192.168.43.124.8880 > 192.168.43.147.7772: UDP, length 120
03:26:39.578553 IP 192.168.43.124.8880 > 192.168.43.147.7772: UDP, length 120
03:26:39.637384 IP 192.168.43.124.8880 > 192.168.43.147.7772: UDP, length 120
03:26:39.678626 IP 192.168.43.124.8880 > 192.168.43.147.7772: UDP, length 120
03:26:39.728694 IP 192.168.43.124.8880 > 192.168.43.147.7772: UDP, length 120
03:26:39.779186 IP 192.168.43.124.8880 > 192.168.43.147.7772: UDP, length 120
03:26:39.828886 IP 192.168.43.124.8880 > 192.168.43.147.7772: UDP, length 120
03:26:39.878591 IP 192.168.43.124.8880 > 192.168.43.147.7772: UDP, length 120
03:26:39.938226 IP 192.168.43.124.8880 > 192.168.43.147.7772: UDP, length 120
03:26:39.978816 IP 192.168.43.124.8880 > 192.168.43.147.7772: UDP, length 120
03:26:40.028769 IP 192.168.43.124.8880 > 192.168.43.147.7772: UDP, length 120
03:26:40.086551 IP 192.168.43.124.8880 > 192.168.43.147.7772: UDP, length 120
03:26:40.128874 IP 192.168.43.124.8880 > 192.168.43.147.7772: UDP, length 120
03:26:40.180057 IP 192.168.43.124.8880 > 192.168.43.147.7772: UDP, length 120
03:26:40.243749 IP 192.168.43.124.8880 > 192.168.43.147.7772: UDP, length 120
03:26:40.279052 IP 192.168.43.124.8880 > 192.168.43.147.7772: UDP, length 120
03:26:40.328962 IP 192.168.43.124.8880 > 192.168.43.147.7772: UDP, length 120
03:26:40.378777 IP 192.168.43.124.8880 > 192.168.43.147.7772: UDP, length 120
03:26:40.438781 IP 192.168.43.124.8880 > 192.168.43.147.7772: UDP, length 120
03:26:40.478903 IP 192.168.43.124.8880 > 192.168.43.147.7772: UDP, length 120
03:26:40.525751 IP 192.168.43.124.8880 > 192.168.43.147.7772: UDP, length 120
03:26:40.578745 IP 192.168.43.124.8880 > 192.168.43.147.7772: UDP, length 120
03:26:40.638379 IP 192.168.43.124.8880 > 192.168.43.147.7772: UDP, length 120
03:26:40.678944 IP 192.168.43.124.8880 > 192.168.43.147.7772: UDP, length 120
03:26:40.728561 IP 192.168.43.124.8880 > 192.168.43.147.7772: UDP, length 120
03:26:40.778631 IP 192.168.43.124.8880 > 192.168.43.147.7772: UDP, length 120
03:26:40.836136 IP 192.168.43.124.8880 > 192.168.43.147.7772: UDP, length 120
03:26:40.879546 IP 192.168.43.124.8880 > 192.168.43.147.7772: UDP, length 120
03:26:40.929982 IP 192.168.43.124.8880 > 192.168.43.147.7772: UDP, length 120
03:26:41.001778 IP 192.168.43.124.8880 > 192.168.43.147.7772: UDP, length 120
03:26:41.028768 IP 192.168.43.124.8880 > 192.168.43.147.7772: UDP, length 120
03:26:41.078761 IP 192.168.43.124.8880 > 192.168.43.147.7772: UDP, length 120
03:26:41.129356 IP 192.168.43.124.8880 > 192.168.43.147.7772: UDP, length 120
03:26:41.188804 IP 192.168.43.124.8880 > 192.168.43.147.7772: UDP, length 120
03:26:41.229027 IP 192.168.43.124.8880 > 192.168.43.147.7772: UDP, length 120
03:26:41.275825 IP 192.168.43.124.8880 > 192.168.43.147.7772: UDP, length 120
03:26:41.353381 IP 192.168.43.124.8880 > 192.168.43.147.7772: UDP, length 120
03:26:41.379052 IP 192.168.43.124.8880 > 192.168.43.147.7772: UDP, length 120
03:26:41.433592 IP 192.168.43.124.8880 > 192.168.43.147.7772: UDP, length 120
03:26:41.478832 IP 192.168.43.124.8880 > 192.168.43.147.7772: UDP, length 120
03:26:41.529076 IP 192.168.43.124.8880 > 192.168.43.147.7772: UDP, length 120
03:26:41.578686 IP 192.168.43.124.8880 > 192.168.43.147.7772: UDP, length 120
03:26:41.628872 IP 192.168.43.124.8880 > 192.168.43.147.7772: UDP, length 120
03:26:41.681461 IP 192.168.43.124.8880 > 192.168.43.147.7772: UDP, length 120
03:26:41.738563 IP 192.168.43.124.8880 > 192.168.43.147.7772: UDP, length 120
03:26:41.780825 IP 192.168.43.124.8880 > 192.168.43.147.7772: UDP, length 120
03:26:41.828822 IP 192.168.43.124.8880 > 192.168.43.147.7772: UDP, length 120
03:26:41.878536 IP 192.168.43.124.8880 > 192.168.43.147.7772: UDP, length 120
03:26:41.938717 IP 192.168.43.124.8880 > 192.168.43.147.7772: UDP, length 120
03:26:41.978698 IP 192.168.43.124.8880 > 192.168.43.147.7772: UDP, length 120
03:26:42.025773 IP 192.168.43.124.8880 > 192.168.43.147.7772: UDP, length 120
03:26:42.080844 IP 192.168.43.124.8880 > 192.168.43.147.7772: UDP, length 120
03:26:42.138720 IP 192.168.43.124.8880 > 192.168.43.147.7772: UDP, length 120
03:26:42.178661 IP 192.168.43.124.8880 > 192.168.43.147.7772: UDP, length 120
03:26:42.228575 IP 192.168.43.124.8880 > 192.168.43.147.7772: UDP, length 120
03:26:42.278673 IP 192.168.43.124.8880 > 192.168.43.147.7772: UDP, length 120
03:26:42.340546 IP 192.168.43.124.8880 > 192.168.43.147.7772: UDP, length 120
03:26:42.378926 IP 192.168.43.124.8880 > 192.168.43.147.7772: UDP, length 120
03:26:42.429020 IP 192.168.43.124.8880 > 192.168.43.147.7772: UDP, length 120
03:26:42.478663 IP 192.168.43.124.8880 > 192.168.43.147.7772: UDP, length 120
03:26:42.578122 IP 192.168.43.124.8880 > 192.168.43.147.7772: UDP, length 120
03:26:42.578372 IP 192.168.43.124.8880 > 192.168.43.147.7772: UDP, length 120
03:26:42.629184 IP 192.168.43.124.8880 > 192.168.43.147.7772: UDP, length 120
03:26:42.678532 IP 192.168.43.124.8880 > 192.168.43.147.7772: UDP, length 120
03:26:42.739488 IP 192.168.43.124.8880 > 192.168.43.147.7772: UDP, length 120
03:26:42.778873 IP 192.168.43.124.8880 > 192.168.43.147.7772: UDP, length 120
03:26:42.827033 IP 192.168.43.124.8880 > 192.168.43.147.7772: UDP, length 120
03:26:42.878745 IP 192.168.43.124.8880 > 192.168.43.147.7772: UDP, length 120
03:26:42.933365 IP 192.168.43.124.8880 > 192.168.43.147.7772: UDP, length 120
03:26:42.978517 IP 192.168.43.124.8880 > 192.168.43.147.7772: UDP, length 120
03:26:43.028501 IP 192.168.43.124.8880 > 192.168.43.147.7772: UDP, length 120
03:26:43.087905 IP 192.168.43.124.8880 > 192.168.43.147.7772: UDP, length 120
03:26:43.130193 IP 192.168.43.124.8880 > 192.168.43.147.7772: UDP, length 120
03:26:43.178560 IP 192.168.43.124.8880 > 192.168.43.147.7772: UDP, length 120
03:26:43.245748 IP 192.168.43.124.8880 > 192.168.43.147.7772: UDP, length 120
03:26:43.279133 IP 192.168.43.124.8880 > 192.168.43.147.7772: UDP, length 120
03:26:43.328816 IP 192.168.43.124.8880 > 192.168.43.147.7772: UDP, length 120
03:26:43.380190 IP 192.168.43.124.8880 > 192.168.43.147.7772: UDP, length 120
03:26:43.438644 IP 192.168.43.124.8880 > 192.168.43.147.7772: UDP, length 120
03:26:43.480858 IP 192.168.43.124.8880 > 192.168.43.147.7772: UDP, length 120
03:26:43.525397 IP 192.168.43.124.8880 > 192.168.43.147.7772: UDP, length 120
03:26:43.584375 IP 192.168.43.124.8880 > 192.168.43.147.7772: UDP, length 120
03:26:43.638333 IP 192.168.43.124.8880 > 192.168.43.147.7772: UDP, length 120
03:26:43.678934 IP 192.168.43.124.8880 > 192.168.43.147.7772: UDP, length 120
03:26:43.728612 IP 192.168.43.124.8880 > 192.168.43.147.7772: UDP, length 120
03:26:43.779084 IP 192.168.43.124.8880 > 192.168.43.147.7772: UDP, length 120
03:26:43.838613 IP 192.168.43.124.8880 > 192.168.43.147.7772: UDP, length 120
03:26:43.879205 IP 192.168.43.124.8880 > 192.168.43.147.7772: UDP, length 120
03:26:43.928980 IP 192.168.43.124.8880 > 192.168.43.147.7772: UDP, length 120
03:26:43.978654 IP 192.168.43.124.8880 > 192.168.43.147.7772: UDP, length 120
03:26:44.038752 IP 192.168.43.124.8880 > 192.168.43.147.7772: UDP, length 120
03:26:44.078910 IP 192.168.43.124.8880 > 192.168.43.147.7772: UDP, length 120
03:26:44.129198 IP 192.168.43.124.8880 > 192.168.43.147.7772: UDP, length 120
03:26:44.177939 IP 192.168.43.124.8880 > 192.168.43.147.7772: UDP, length 120
03:26:44.240857 IP 192.168.43.124.8880 > 192.168.43.147.7772: UDP, length 120
03:26:44.278992 IP 192.168.43.124.8880 > 192.168.43.147.7772: UDP, length 120
03:26:44.328949 IP 192.168.43.124.8880 > 192.168.43.147.7772: UDP, length 120
03:26:44.378851 IP 192.168.43.124.8880 > 192.168.43.147.7772: UDP, length 120
03:26:44.438511 IP 192.168.43.124.8880 > 192.168.43.147.7772: UDP, length 120
03:26:44.481390 IP 192.168.43.124.8880 > 192.168.43.147.7772: UDP, length 120
03:26:44.525518 IP 192.168.43.124.8880 > 192.168.43.147.7772: UDP, length 120
03:26:44.578682 IP 192.168.43.124.8880 > 192.168.43.147.7772: UDP, length 120
03:26:44.640454 IP 192.168.43.124.8880 > 192.168.43.147.7772: UDP, length 120
03:26:44.678948 IP 192.168.43.124.8880 > 192.168.43.147.7772: UDP, length 120
03:26:44.728799 IP 192.168.43.124.8880 > 192.168.43.147.7772: UDP, length 120
03:26:44.778641 IP 192.168.43.124.8880 > 192.168.43.147.7772: UDP, length 120
03:26:44.838799 IP 192.168.43.124.8880 > 192.168.43.147.7772: UDP, length 120
03:26:44.942773 IP 192.168.43.124.8880 > 192.168.43.147.7772: UDP, length 120
03:26:44.942903 IP 192.168.43.124.8880 > 192.168.43.147.7772: UDP, length 120
03:26:44.981225 IP 192.168.43.124.8880 > 192.168.43.147.7772: UDP, length 120
03:26:45.028886 IP 192.168.43.124.8880 > 192.168.43.147.7772: UDP, length 120
03:26:45.081625 IP 192.168.43.124.8880 > 192.168.43.147.7772: UDP, length 120
03:26:45.129250 IP 192.168.43.124.8880 > 192.168.43.147.7772: UDP, length 120
03:26:45.294255 IP 192.168.43.124.8880 > 192.168.43.147.7772: UDP, length 120
03:26:45.294378 IP 192.168.43.124.8880 > 192.168.43.147.7772: UDP, length 120
03:26:45.294488 IP 192.168.43.124.8880 > 192.168.43.147.7772: UDP, length 120
03:26:45.332868 IP 192.168.43.124.8880 > 192.168.43.147.7772: UDP, length 120
03:26:45.380352 IP 192.168.43.124.8880 > 192.168.43.147.7772: UDP, length 120
03:26:45.431861 IP 192.168.43.124.8880 > 192.168.43.147.7772: UDP, length 120
03:26:45.480586 IP 192.168.43.124.8880 > 192.168.43.147.7772: UDP, length 120
03:26:45.642617 IP 192.168.43.124.8880 > 192.168.43.147.7772: UDP, length 120
03:26:45.642814 IP 192.168.43.124.8880 > 192.168.43.147.7772: UDP, length 120
03:26:45.642930 IP 192.168.43.124.8880 > 192.168.43.147.7772: UDP, length 120
03:26:45.680598 IP 192.168.43.124.8880 > 192.168.43.147.7772: UDP, length 120
03:26:45.741596 IP 192.168.43.124.8880 > 192.168.43.147.7772: UDP, length 120
03:26:45.781181 IP 192.168.43.124.8880 > 192.168.43.147.7772: UDP, length 120
03:26:45.832851 IP 192.168.43.124.8880 > 192.168.43.147.7772: UDP, length 120
03:26:45.991209 IP 192.168.43.124.8880 > 192.168.43.147.7772: UDP, length 120
03:26:45.991369 IP 192.168.43.124.8880 > 192.168.43.147.7772: UDP, length 120
03:26:45.991482 IP 192.168.43.124.8880 > 192.168.43.147.7772: UDP, length 120
03:26:46.031354 IP 192.168.43.124.8880 > 192.168.43.147.7772: UDP, length 120
03:26:46.080402 IP 192.168.43.124.8880 > 192.168.43.147.7772: UDP, length 120
03:26:46.127297 IP 192.168.43.124.8880 > 192.168.43.147.7772: UDP, length 120
03:26:46.180307 IP 192.168.43.124.8880 > 192.168.43.147.7772: UDP, length 120
03:26:46.339051 IP 192.168.43.124.8880 > 192.168.43.147.7772: UDP, length 120
03:26:46.339168 IP 192.168.43.124.8880 > 192.168.43.147.7772: UDP, length 120
03:26:46.339279 IP 192.168.43.124.8880 > 192.168.43.147.7772: UDP, length 120
03:26:46.381282 IP 192.168.43.124.8880 > 192.168.43.147.7772: UDP, length 120
03:26:46.430478 IP 192.168.43.124.8880 > 192.168.43.147.7772: UDP, length 120
03:26:46.480389 IP 192.168.43.124.8880 > 192.168.43.147.7772: UDP, length 120
03:26:46.526206 IP 192.168.43.124.8880 > 192.168.43.147.7772: UDP, length 120
03:26:46.686271 IP 192.168.43.124.8880 > 192.168.43.147.7772: UDP, length 120
03:26:46.686511 IP 192.168.43.124.8880 > 192.168.43.147.7772: UDP, length 120
03:26:46.686626 IP 192.168.43.124.8880 > 192.168.43.147.7772: UDP, length 120
03:26:46.730423 IP 192.168.43.124.8880 > 192.168.43.147.7772: UDP, length 120
03:26:46.780394 IP 192.168.43.124.8880 > 192.168.43.147.7772: UDP, length 120
03:26:46.830352 IP 192.168.43.124.8880 > 192.168.43.147.7772: UDP, length 120
03:26:46.880420 IP 192.168.43.124.8880 > 192.168.43.147.7772: UDP, length 120
03:26:47.033113 IP 192.168.43.124.8880 > 192.168.43.147.7772: UDP, length 120
03:26:47.033240 IP 192.168.43.124.8880 > 192.168.43.147.7772: UDP, length 120
03:26:47.033331 IP 192.168.43.124.8880 > 192.168.43.147.7772: UDP, length 120
03:26:47.075448 IP 192.168.43.124.8880 > 192.168.43.147.7772: UDP, length 120
03:26:47.132115 IP 192.168.43.124.8880 > 192.168.43.147.7772: UDP, length 120
03:26:47.185974 IP 192.168.43.124.8880 > 192.168.43.147.7772: UDP, length 120
03:26:47.228719 IP 192.168.43.124.8880 > 192.168.43.147.7772: UDP, length 120
03:26:47.413703 IP 192.168.43.124.8880 > 192.168.43.147.7772: UDP, length 120
03:26:47.413785 IP 192.168.43.124.8880 > 192.168.43.147.7772: UDP, length 120
03:26:47.413859 IP 192.168.43.124.8880 > 192.168.43.147.7772: UDP, length 120
03:26:47.425335 IP 192.168.43.124.8880 > 192.168.43.147.7772: UDP, length 120
03:26:47.480027 IP 192.168.43.124.8880 > 192.168.43.147.7772: UDP, length 120
03:26:47.534202 IP 192.168.43.124.8880 > 192.168.43.147.7772: UDP, length 120
03:26:47.579292 IP 192.168.43.124.8880 > 192.168.43.147.7772: UDP, length 120
03:26:47.760232 IP 192.168.43.124.8880 > 192.168.43.147.7772: UDP, length 120
03:26:47.760313 IP 192.168.43.124.8880 > 192.168.43.147.7772: UDP, length 120
03:26:47.760383 IP 192.168.43.124.8880 > 192.168.43.147.7772: UDP, length 120
03:26:47.787235 IP 192.168.43.124.8880 > 192.168.43.147.7772: UDP, length 120
03:26:47.828236 IP 192.168.43.124.8880 > 192.168.43.147.7772: UDP, length 120
03:26:47.889337 IP 192.168.43.124.8880 > 192.168.43.147.7772: UDP, length 120
03:26:47.937106 IP 192.168.43.124.8880 > 192.168.43.147.7772: UDP, length 120
03:26:48.108005 IP 192.168.43.124.8880 > 192.168.43.147.7772: UDP, length 120
03:26:48.108120 IP 192.168.43.124.8880 > 192.168.43.147.7772: UDP, length 120
03:26:48.108193 IP 192.168.43.124.8880 > 192.168.43.147.7772: UDP, length 120
03:26:48.126327 IP 192.168.43.124.8880 > 192.168.43.147.7772: UDP, length 120
03:26:48.179753 IP 192.168.43.124.8880 > 192.168.43.147.7772: UDP, length 120
03:26:48.228368 IP 192.168.43.124.8880 > 192.168.43.147.7772: UDP, length 120
03:26:48.286345 IP 192.168.43.124.8880 > 192.168.43.147.7772: UDP, length 120
03:26:48.456094 IP 192.168.43.124.8880 > 192.168.43.147.7772: UDP, length 120
03:26:48.456169 IP 192.168.43.124.8880 > 192.168.43.147.7772: UDP, length 120
03:26:48.456239 IP 192.168.43.124.8880 > 192.168.43.147.7772: UDP, length 120
03:26:48.479855 IP 192.168.43.124.8880 > 192.168.43.147.7772: UDP, length 120
03:26:48.525512 IP 192.168.43.124.8880 > 192.168.43.147.7772: UDP, length 120
03:26:48.582333 IP 192.168.43.124.8880 > 192.168.43.147.7772: UDP, length 120
03:26:48.636224 IP 192.168.43.124.8880 > 192.168.43.147.7772: UDP, length 120
03:26:48.816167 IP 192.168.43.124.8880 > 192.168.43.147.7772: UDP, length 120
03:26:48.816245 IP 192.168.43.124.8880 > 192.168.43.147.7772: UDP, length 120
03:26:48.816315 IP 192.168.43.124.8880 > 192.168.43.147.7772: UDP, length 120
03:26:48.826936 IP 192.168.43.124.8880 > 192.168.43.147.7772: UDP, length 120
03:26:48.878561 IP 192.168.43.124.8880 > 192.168.43.147.7772: UDP, length 120
03:26:48.928562 IP 192.168.43.124.8880 > 192.168.43.147.7772: UDP, length 120
03:26:48.986677 IP 192.168.43.124.8880 > 192.168.43.147.7772: UDP, length 120
03:26:49.151483 IP 192.168.43.124.8880 > 192.168.43.147.7772: UDP, length 120
03:26:49.151567 IP 192.168.43.124.8880 > 192.168.43.147.7772: UDP, length 120
03:26:49.151638 IP 192.168.43.124.8880 > 192.168.43.147.7772: UDP, length 120
03:26:49.178727 IP 192.168.43.124.8880 > 192.168.43.147.7772: UDP, length 120
03:26:49.228570 IP 192.168.43.124.8880 > 192.168.43.147.7772: UDP, length 120
03:26:49.295549 IP 192.168.43.124.8880 > 192.168.43.147.7772: UDP, length 120
03:26:49.328616 IP 192.168.43.124.8880 > 192.168.43.147.7772: UDP, length 120
03:26:49.500626 IP 192.168.43.124.8880 > 192.168.43.147.7772: UDP, length 120
03:26:49.500699 IP 192.168.43.124.8880 > 192.168.43.147.7772: UDP, length 120
03:26:49.500769 IP 192.168.43.124.8880 > 192.168.43.147.7772: UDP, length 120
03:26:49.528584 IP 192.168.43.124.8880 > 192.168.43.147.7772: UDP, length 120
03:26:49.578320 IP 192.168.43.124.8880 > 192.168.43.147.7772: UDP, length 120
03:26:49.640619 IP 192.168.43.124.8880 > 192.168.43.147.7772: UDP, length 120
03:26:49.677906 IP 192.168.43.124.8880 > 192.168.43.147.7772: UDP, length 120
03:26:49.730284 IP 192.168.43.124.8880 > 192.168.43.147.7772: UDP, length 120
03:26:49.793959 IP 192.168.43.124.8880 > 192.168.43.147.7772: UDP, length 120
03:26:49.830194 IP 192.168.43.124.8880 > 192.168.43.147.7772: UDP, length 120
03:26:49.878508 IP 192.168.43.124.8880 > 192.168.43.147.7772: UDP, length 120
03:26:49.939191 IP 192.168.43.124.8880 > 192.168.43.147.7772: UDP, length 120
03:26:49.978604 IP 192.168.43.124.8880 > 192.168.43.147.7772: UDP, length 120
03:26:50.028227 IP 192.168.43.124.8880 > 192.168.43.147.7772: UDP, length 120
03:26:50.086346 IP 192.168.43.124.8880 > 192.168.43.147.7772: UDP, length 120
03:26:50.128620 IP 192.168.43.124.8880 > 192.168.43.147.7772: UDP, length 120
03:26:50.178416 IP 192.168.43.124.8880 > 192.168.43.147.7772: UDP, length 120
03:26:50.241390 IP 192.168.43.124.8880 > 192.168.43.147.7772: UDP, length 120
03:26:50.280057 IP 192.168.43.124.8880 > 192.168.43.147.7772: UDP, length 120
03:26:50.335894 IP 192.168.43.124.8880 > 192.168.43.147.7772: UDP, length 120
03:26:50.378455 IP 192.168.43.124.8880 > 192.168.43.147.7772: UDP, length 120
03:26:50.440751 IP 192.168.43.124.8880 > 192.168.43.147.7772: UDP, length 120
03:26:50.478711 IP 192.168.43.124.8880 > 192.168.43.147.7772: UDP, length 120
03:26:50.525650 IP 192.168.43.124.8880 > 192.168.43.147.7772: UDP, length 120
03:26:50.580451 IP 192.168.43.124.8880 > 192.168.43.147.7772: UDP, length 120
03:26:50.640701 IP 192.168.43.124.8880 > 192.168.43.147.7772: UDP, length 120
03:26:50.679209 IP 192.168.43.124.8880 > 192.168.43.147.7772: UDP, length 120
03:26:50.728243 IP 192.168.43.124.8880 > 192.168.43.147.7772: UDP, length 120
03:26:50.778273 IP 192.168.43.124.8880 > 192.168.43.147.7772: UDP, length 120
03:26:50.826301 IP 192.168.43.124.8880 > 192.168.43.147.7772: UDP, length 120
03:26:50.878483 IP 192.168.43.124.8880 > 192.168.43.147.7772: UDP, length 120
03:26:50.928310 IP 192.168.43.124.8880 > 192.168.43.147.7772: UDP, length 120
03:26:50.989156 IP 192.168.43.124.8880 > 192.168.43.147.7772: UDP, length 120
03:26:51.028716 IP 192.168.43.124.8880 > 192.168.43.147.7772: UDP, length 120
03:26:51.079589 IP 192.168.43.124.8880 > 192.168.43.147.7772: UDP, length 120
03:26:51.129408 IP 192.168.43.124.8880 > 192.168.43.147.7772: UDP, length 120
03:26:51.188457 IP 192.168.43.124.8880 > 192.168.43.147.7772: UDP, length 120
03:26:51.228848 IP 192.168.43.124.8880 > 192.168.43.147.7772: UDP, length 120
03:26:51.278623 IP 192.168.43.124.8880 > 192.168.43.147.7772: UDP, length 120
03:26:51.328991 IP 192.168.43.124.8880 > 192.168.43.147.7772: UDP, length 120
03:26:51.388296 IP 192.168.43.124.8880 > 192.168.43.147.7772: UDP, length 120
03:26:51.428557 IP 192.168.43.124.8880 > 192.168.43.147.7772: UDP, length 120
03:26:51.478517 IP 192.168.43.124.8880 > 192.168.43.147.7772: UDP, length 120
03:26:51.536231 IP 192.168.43.124.8880 > 192.168.43.147.7772: UDP, length 120
03:26:51.579844 IP 192.168.43.124.8880 > 192.168.43.147.7772: UDP, length 120
03:26:51.629279 IP 192.168.43.124.8880 > 192.168.43.147.7772: UDP, length 120
03:26:51.685696 IP 192.168.43.124.8880 > 192.168.43.147.7772: UDP, length 120
03:26:51.726433 IP 192.168.43.124.8880 > 192.168.43.147.7772: UDP, length 120
03:26:51.778405 IP 192.168.43.124.8880 > 192.168.43.147.7772: UDP, length 120
03:26:51.828411 IP 192.168.43.124.8880 > 192.168.43.147.7772: UDP, length 120
03:26:51.890480 IP 192.168.43.124.8880 > 192.168.43.147.7772: UDP, length 120
03:26:51.939568 IP 192.168.43.124.8880 > 192.168.43.147.7772: UDP, length 120
03:26:51.980477 IP 192.168.43.124.8880 > 192.168.43.147.7772: UDP, length 120
03:26:52.028714 IP 192.168.43.124.8880 > 192.168.43.147.7772: UDP, length 120
03:26:52.092238 IP 192.168.43.124.8880 > 192.168.43.147.7772: UDP, length 120
03:26:52.128819 IP 192.168.43.124.8880 > 192.168.43.147.7772: UDP, length 120
03:26:52.178829 IP 192.168.43.124.8880 > 192.168.43.147.7772: UDP, length 120
03:26:52.239216 IP 192.168.43.124.8880 > 192.168.43.147.7772: UDP, length 120
03:26:52.278762 IP 192.168.43.124.8880 > 192.168.43.147.7772: UDP, length 120
03:26:52.327451 IP 192.168.43.124.8880 > 192.168.43.147.7772: UDP, length 120
03:26:52.398509 IP 192.168.43.124.8880 > 192.168.43.147.7772: UDP, length 120
03:26:52.430328 IP 192.168.43.124.8880 > 192.168.43.147.7772: UDP, length 120
03:26:52.478438 IP 192.168.43.124.8880 > 192.168.43.147.7772: UDP, length 120
03:26:52.527128 IP 192.168.43.124.8880 > 192.168.43.147.7772: UDP, length 120
03:26:52.578543 IP 192.168.43.124.8880 > 192.168.43.147.7772: UDP, length 120
03:26:52.631378 IP 192.168.43.124.8880 > 192.168.43.147.7772: UDP, length 120
03:26:52.688381 IP 192.168.43.124.8880 > 192.168.43.147.7772: UDP, length 120
03:26:52.730392 IP 192.168.43.124.8880 > 192.168.43.147.7772: UDP, length 120
03:26:52.778225 IP 192.168.43.124.8880 > 192.168.43.147.7772: UDP, length 120
03:26:52.828467 IP 192.168.43.124.8880 > 192.168.43.147.7772: UDP, length 120
03:26:52.889847 IP 192.168.43.124.8880 > 192.168.43.147.7772: UDP, length 120
03:26:52.928333 IP 192.168.43.124.8880 > 192.168.43.147.7772: UDP, length 120
03:26:52.980212 IP 192.168.43.124.8880 > 192.168.43.147.7772: UDP, length 120
03:26:53.028347 IP 192.168.43.124.8880 > 192.168.43.147.7772: UDP, length 120
03:26:53.088462 IP 192.168.43.124.8880 > 192.168.43.147.7772: UDP, length 120
03:26:53.128290 IP 192.168.43.124.8880 > 192.168.43.147.7772: UDP, length 120
03:26:53.179784 IP 192.168.43.124.8880 > 192.168.43.147.7772: UDP, length 120
03:26:53.228325 IP 192.168.43.124.8880 > 192.168.43.147.7772: UDP, length 120
03:26:53.288231 IP 192.168.43.124.8880 > 192.168.43.147.7772: UDP, length 120
03:26:53.328476 IP 192.168.43.124.8880 > 192.168.43.147.7772: UDP, length 120
03:26:53.378502 IP 192.168.43.124.8880 > 192.168.43.147.7772: UDP, length 120
03:26:53.428311 IP 192.168.43.124.8880 > 192.168.43.147.7772: UDP, length 120
03:26:53.489385 IP 192.168.43.124.8880 > 192.168.43.147.7772: UDP, length 120
03:26:53.526114 IP 192.168.43.124.8880 > 192.168.43.147.7772: UDP, length 120
03:26:53.578459 IP 192.168.43.124.8880 > 192.168.43.147.7772: UDP, length 120
03:26:53.628451 IP 192.168.43.124.8880 > 192.168.43.147.7772: UDP, length 120
03:26:53.688313 IP 192.168.43.124.8880 > 192.168.43.147.7772: UDP, length 120
03:26:53.730052 IP 192.168.43.124.8880 > 192.168.43.147.7772: UDP, length 120
03:26:53.780090 IP 192.168.43.124.8880 > 192.168.43.147.7772: UDP, length 120
03:26:53.828737 IP 192.168.43.124.8880 > 192.168.43.147.7772: UDP, length 120
03:26:53.885294 IP 192.168.43.124.8880 > 192.168.43.147.7772: UDP, length 120
03:26:53.929500 IP 192.168.43.124.8880 > 192.168.43.147.7772: UDP, length 120
03:26:53.978268 IP 192.168.43.124.8880 > 192.168.43.147.7772: UDP, length 120
03:26:54.050262 IP 192.168.43.124.8880 > 192.168.43.147.7772: UDP, length 120
03:26:54.078448 IP 192.168.43.124.8880 > 192.168.43.147.7772: UDP, length 120
03:26:54.133588 IP 192.168.43.124.8880 > 192.168.43.147.7772: UDP, length 120
03:26:54.178318 IP 192.168.43.124.8880 > 192.168.43.147.7772: UDP, length 120
03:26:54.239723 IP 192.168.43.124.8880 > 192.168.43.147.7772: UDP, length 120
03:26:54.278581 IP 192.168.43.124.8880 > 192.168.43.147.7772: UDP, length 120
03:26:54.328484 IP 192.168.43.124.8880 > 192.168.43.147.7772: UDP, length 120
03:26:54.378248 IP 192.168.43.124.8880 > 192.168.43.147.7772: UDP, length 120
03:26:54.436417 IP 192.168.43.124.8880 > 192.168.43.147.7772: UDP, length 120
03:26:54.481451 IP 192.168.43.124.8880 > 192.168.43.147.7772: UDP, length 120
03:26:54.525530 IP 192.168.43.124.8880 > 192.168.43.147.7772: UDP, length 120
03:26:54.580714 IP 192.168.43.124.8880 > 192.168.43.147.7772: UDP, length 120
03:26:54.639149 IP 192.168.43.124.8880 > 192.168.43.147.7772: UDP, length 120
03:26:54.678994 IP 192.168.43.124.8880 > 192.168.43.147.7772: UDP, length 120
03:26:54.728174 IP 192.168.43.124.8880 > 192.168.43.147.7772: UDP, length 120
03:26:54.778252 IP 192.168.43.124.8880 > 192.168.43.147.7772: UDP, length 120
03:26:54.835591 IP 192.168.43.124.8880 > 192.168.43.147.7772: UDP, length 120
03:26:54.880373 IP 192.168.43.124.8880 > 192.168.43.147.7772: UDP, length 120
