23:19:34.456503 IP 192.168.43.147.8880 > 192.168.43.124.7773: UDP, length 120
23:19:34.509188 IP 192.168.43.147.8880 > 192.168.43.124.7773: UDP, length 120
23:19:34.582321 IP 192.168.43.147.8880 > 192.168.43.124.7773: UDP, length 120
23:19:34.609782 IP 192.168.43.147.8880 > 192.168.43.124.7773: UDP, length 120
23:19:34.660356 IP 192.168.43.147.8880 > 192.168.43.124.7773: UDP, length 120
23:19:34.716708 IP 192.168.43.147.8880 > 192.168.43.124.7773: UDP, length 120
23:19:34.771903 IP 192.168.43.147.8880 > 192.168.43.124.7773: UDP, length 120
23:19:34.811911 IP 192.168.43.147.8880 > 192.168.43.124.7773: UDP, length 120
23:19:34.856178 IP 192.168.43.147.8880 > 192.168.43.124.7773: UDP, length 120
23:19:34.909719 IP 192.168.43.147.8880 > 192.168.43.124.7773: UDP, length 120
23:19:34.970030 IP 192.168.43.147.8880 > 192.168.43.124.7773: UDP, length 120
23:19:35.009194 IP 192.168.43.147.8880 > 192.168.43.124.7773: UDP, length 120
23:19:35.059153 IP 192.168.43.147.8880 > 192.168.43.124.7773: UDP, length 120
23:19:35.110297 IP 192.168.43.147.8880 > 192.168.43.124.7773: UDP, length 120
23:19:35.171474 IP 192.168.43.147.8880 > 192.168.43.124.7773: UDP, length 120
23:19:35.213095 IP 192.168.43.147.8880 > 192.168.43.124.7773: UDP, length 120
23:19:35.259370 IP 192.168.43.147.8880 > 192.168.43.124.7773: UDP, length 120
23:19:35.309058 IP 192.168.43.147.8880 > 192.168.43.124.7773: UDP, length 120
23:19:35.371172 IP 192.168.43.147.8880 > 192.168.43.124.7773: UDP, length 120
23:19:35.410431 IP 192.168.43.147.8880 > 192.168.43.124.7773: UDP, length 120
23:19:35.459237 IP 192.168.43.147.8880 > 192.168.43.124.7773: UDP, length 120
23:19:35.509119 IP 192.168.43.147.8880 > 192.168.43.124.7773: UDP, length 120
23:19:35.581210 IP 192.168.43.147.8880 > 192.168.43.124.7773: UDP, length 120
23:19:35.609297 IP 192.168.43.147.8880 > 192.168.43.124.7773: UDP, length 120
23:19:35.675241 IP 192.168.43.147.8880 > 192.168.43.124.7773: UDP, length 120
23:19:35.738343 IP 192.168.43.147.8880 > 192.168.43.124.7773: UDP, length 120
23:19:35.759122 IP 192.168.43.147.8880 > 192.168.43.124.7773: UDP, length 120
23:19:35.813324 IP 192.168.43.147.8880 > 192.168.43.124.7773: UDP, length 120
23:19:35.858308 IP 192.168.43.147.8880 > 192.168.43.124.7773: UDP, length 120
23:19:35.910297 IP 192.168.43.147.8880 > 192.168.43.124.7773: UDP, length 120
23:19:35.970935 IP 192.168.43.147.8880 > 192.168.43.124.7773: UDP, length 120
23:19:36.009394 IP 192.168.43.147.8880 > 192.168.43.124.7773: UDP, length 120
23:19:36.060041 IP 192.168.43.147.8880 > 192.168.43.124.7773: UDP, length 120
23:19:36.109100 IP 192.168.43.147.8880 > 192.168.43.124.7773: UDP, length 120
23:19:36.170290 IP 192.168.43.147.8880 > 192.168.43.124.7773: UDP, length 120
23:19:36.210559 IP 192.168.43.147.8880 > 192.168.43.124.7773: UDP, length 120
23:19:36.261746 IP 192.168.43.147.8880 > 192.168.43.124.7773: UDP, length 120
23:19:36.338270 IP 192.168.43.147.8880 > 192.168.43.124.7773: UDP, length 120
23:19:36.359476 IP 192.168.43.147.8880 > 192.168.43.124.7773: UDP, length 120
23:19:36.414906 IP 192.168.43.147.8880 > 192.168.43.124.7773: UDP, length 120
23:19:36.461284 IP 192.168.43.147.8880 > 192.168.43.124.7773: UDP, length 120
23:19:36.521970 IP 192.168.43.147.8880 > 192.168.43.124.7773: UDP, length 120
23:19:36.559969 IP 192.168.43.147.8880 > 192.168.43.124.7773: UDP, length 120
23:19:36.609108 IP 192.168.43.147.8880 > 192.168.43.124.7773: UDP, length 120
23:19:36.691415 IP 192.168.43.147.8880 > 192.168.43.124.7773: UDP, length 120
23:19:36.709823 IP 192.168.43.147.8880 > 192.168.43.124.7773: UDP, length 120
23:19:36.760448 IP 192.168.43.147.8880 > 192.168.43.124.7773: UDP, length 120
23:19:36.810582 IP 192.168.43.147.8880 > 192.168.43.124.7773: UDP, length 120
23:19:36.873738 IP 192.168.43.147.8880 > 192.168.43.124.7773: UDP, length 120
23:19:36.912318 IP 192.168.43.147.8880 > 192.168.43.124.7773: UDP, length 120
23:19:36.959018 IP 192.168.43.147.8880 > 192.168.43.124.7773: UDP, length 120
23:19:37.024704 IP 192.168.43.147.8880 > 192.168.43.124.7773: UDP, length 120
23:19:37.059679 IP 192.168.43.147.8880 > 192.168.43.124.7773: UDP, length 120
23:19:37.111637 IP 192.168.43.147.8880 > 192.168.43.124.7773: UDP, length 120
23:19:37.159826 IP 192.168.43.147.8880 > 192.168.43.124.7773: UDP, length 120
23:19:37.220469 IP 192.168.43.147.8880 > 192.168.43.124.7773: UDP, length 120
23:19:37.261487 IP 192.168.43.147.8880 > 192.168.43.124.7773: UDP, length 120
23:19:37.311430 IP 192.168.43.147.8880 > 192.168.43.124.7773: UDP, length 120
23:19:37.393072 IP 192.168.43.147.8880 > 192.168.43.124.7773: UDP, length 120
23:19:37.413568 IP 192.168.43.147.8880 > 192.168.43.124.7773: UDP, length 120
23:19:37.470331 IP 192.168.43.147.8880 > 192.168.43.124.7773: UDP, length 120
23:19:37.511106 IP 192.168.43.147.8880 > 192.168.43.124.7773: UDP, length 120
23:19:37.571518 IP 192.168.43.147.8880 > 192.168.43.124.7773: UDP, length 120
23:19:37.610021 IP 192.168.43.147.8880 > 192.168.43.124.7773: UDP, length 120
23:19:37.664457 IP 192.168.43.147.8880 > 192.168.43.124.7773: UDP, length 120
23:19:37.710879 IP 192.168.43.147.8880 > 192.168.43.124.7773: UDP, length 120
23:19:37.773474 IP 192.168.43.147.8880 > 192.168.43.124.7773: UDP, length 120
23:19:37.809613 IP 192.168.43.147.8880 > 192.168.43.124.7773: UDP, length 120
23:19:37.859552 IP 192.168.43.147.8880 > 192.168.43.124.7773: UDP, length 120
23:19:37.916385 IP 192.168.43.147.8880 > 192.168.43.124.7773: UDP, length 120
23:19:37.972339 IP 192.168.43.147.8880 > 192.168.43.124.7773: UDP, length 120
23:19:38.011516 IP 192.168.43.147.8880 > 192.168.43.124.7773: UDP, length 120
23:19:38.059448 IP 192.168.43.147.8880 > 192.168.43.124.7773: UDP, length 120
23:19:38.109392 IP 192.168.43.147.8880 > 192.168.43.124.7773: UDP, length 120
23:19:38.170216 IP 192.168.43.147.8880 > 192.168.43.124.7773: UDP, length 120
23:19:38.210339 IP 192.168.43.147.8880 > 192.168.43.124.7773: UDP, length 120
23:19:38.264172 IP 192.168.43.147.8880 > 192.168.43.124.7773: UDP, length 120
23:19:38.310281 IP 192.168.43.147.8880 > 192.168.43.124.7773: UDP, length 120
23:19:38.373721 IP 192.168.43.147.8880 > 192.168.43.124.7773: UDP, length 120
23:19:38.412758 IP 192.168.43.147.8880 > 192.168.43.124.7773: UDP, length 120
23:19:38.463601 IP 192.168.43.147.8880 > 192.168.43.124.7773: UDP, length 120
23:19:38.576688 IP 192.168.43.147.8880 > 192.168.43.124.7773: UDP, length 120
23:19:38.576700 IP 192.168.43.147.8880 > 192.168.43.124.7773: UDP, length 120
23:19:38.610919 IP 192.168.43.147.8880 > 192.168.43.124.7773: UDP, length 120
23:19:38.666652 IP 192.168.43.147.8880 > 192.168.43.124.7773: UDP, length 120
23:19:38.709391 IP 192.168.43.147.8880 > 192.168.43.124.7773: UDP, length 120
23:19:38.770569 IP 192.168.43.147.8880 > 192.168.43.124.7773: UDP, length 120
23:19:38.809775 IP 192.168.43.147.8880 > 192.168.43.124.7773: UDP, length 120
23:19:38.860204 IP 192.168.43.147.8880 > 192.168.43.124.7773: UDP, length 120
23:19:38.910462 IP 192.168.43.147.8880 > 192.168.43.124.7773: UDP, length 120
23:19:38.961043 IP 192.168.43.147.8880 > 192.168.43.124.7773: UDP, length 120
23:19:39.013399 IP 192.168.43.147.8880 > 192.168.43.124.7773: UDP, length 120
23:19:39.062607 IP 192.168.43.147.8880 > 192.168.43.124.7773: UDP, length 120
23:19:39.114861 IP 192.168.43.147.8880 > 192.168.43.124.7773: UDP, length 120
23:19:39.165196 IP 192.168.43.147.8880 > 192.168.43.124.7773: UDP, length 120
23:19:39.210990 IP 192.168.43.147.8880 > 192.168.43.124.7773: UDP, length 120
23:19:39.260875 IP 192.168.43.147.8880 > 192.168.43.124.7773: UDP, length 120
23:19:39.309355 IP 192.168.43.147.8880 > 192.168.43.124.7773: UDP, length 120
23:19:39.360588 IP 192.168.43.147.8880 > 192.168.43.124.7773: UDP, length 120
23:19:39.433703 IP 192.168.43.147.8880 > 192.168.43.124.7773: UDP, length 120
23:19:39.462494 IP 192.168.43.147.8880 > 192.168.43.124.7773: UDP, length 120
23:19:39.514934 IP 192.168.43.147.8880 > 192.168.43.124.7773: UDP, length 120
23:19:39.560973 IP 192.168.43.147.8880 > 192.168.43.124.7773: UDP, length 120
23:19:39.613067 IP 192.168.43.147.8880 > 192.168.43.124.7773: UDP, length 120
23:19:39.665382 IP 192.168.43.147.8880 > 192.168.43.124.7773: UDP, length 120
23:19:39.715400 IP 192.168.43.147.8880 > 192.168.43.124.7773: UDP, length 120
23:19:39.760932 IP 192.168.43.147.8880 > 192.168.43.124.7773: UDP, length 120
23:19:39.810972 IP 192.168.43.147.8880 > 192.168.43.124.7773: UDP, length 120
23:19:39.858334 IP 192.168.43.147.8880 > 192.168.43.124.7773: UDP, length 120
23:19:39.908487 IP 192.168.43.147.8880 > 192.168.43.124.7773: UDP, length 120
23:19:39.959406 IP 192.168.43.147.8880 > 192.168.43.124.7773: UDP, length 120
23:19:40.011857 IP 192.168.43.147.8880 > 192.168.43.124.7773: UDP, length 120
23:19:40.061445 IP 192.168.43.147.8880 > 192.168.43.124.7773: UDP, length 120
23:19:40.113982 IP 192.168.43.147.8880 > 192.168.43.124.7773: UDP, length 120
23:19:40.163026 IP 192.168.43.147.8880 > 192.168.43.124.7773: UDP, length 120
23:19:40.211613 IP 192.168.43.147.8880 > 192.168.43.124.7773: UDP, length 120
23:19:40.261291 IP 192.168.43.147.8880 > 192.168.43.124.7773: UDP, length 120
23:19:40.311277 IP 192.168.43.147.8880 > 192.168.43.124.7773: UDP, length 120
23:19:40.361747 IP 192.168.43.147.8880 > 192.168.43.124.7773: UDP, length 120
23:19:40.411307 IP 192.168.43.147.8880 > 192.168.43.124.7773: UDP, length 120
23:19:40.462068 IP 192.168.43.147.8880 > 192.168.43.124.7773: UDP, length 120
23:19:40.512464 IP 192.168.43.147.8880 > 192.168.43.124.7773: UDP, length 120
23:19:40.563836 IP 192.168.43.147.8880 > 192.168.43.124.7773: UDP, length 120
23:19:40.615089 IP 192.168.43.147.8880 > 192.168.43.124.7773: UDP, length 120
23:19:40.662288 IP 192.168.43.147.8880 > 192.168.43.124.7773: UDP, length 120
23:19:40.717088 IP 192.168.43.147.8880 > 192.168.43.124.7773: UDP, length 120
23:19:40.762647 IP 192.168.43.147.8880 > 192.168.43.124.7773: UDP, length 120
23:19:40.815255 IP 192.168.43.147.8880 > 192.168.43.124.7773: UDP, length 120
23:19:40.857803 IP 192.168.43.147.8880 > 192.168.43.124.7773: UDP, length 120
23:19:40.910476 IP 192.168.43.147.8880 > 192.168.43.124.7773: UDP, length 120
23:19:40.975397 IP 192.168.43.147.8880 > 192.168.43.124.7773: UDP, length 120
23:19:41.009137 IP 192.168.43.147.8880 > 192.168.43.124.7773: UDP, length 120
23:19:41.060642 IP 192.168.43.147.8880 > 192.168.43.124.7773: UDP, length 120
23:19:41.127624 IP 192.168.43.147.8880 > 192.168.43.124.7773: UDP, length 120
23:19:41.160132 IP 192.168.43.147.8880 > 192.168.43.124.7773: UDP, length 120
23:19:41.213283 IP 192.168.43.147.8880 > 192.168.43.124.7773: UDP, length 120
23:19:41.273350 IP 192.168.43.147.8880 > 192.168.43.124.7773: UDP, length 120
23:19:41.309298 IP 192.168.43.147.8880 > 192.168.43.124.7773: UDP, length 120
23:19:41.359097 IP 192.168.43.147.8880 > 192.168.43.124.7773: UDP, length 120
23:19:41.424288 IP 192.168.43.147.8880 > 192.168.43.124.7773: UDP, length 120
23:19:41.459245 IP 192.168.43.147.8880 > 192.168.43.124.7773: UDP, length 120
23:19:41.506259 IP 192.168.43.147.8880 > 192.168.43.124.7773: UDP, length 120
23:19:41.571480 IP 192.168.43.147.8880 > 192.168.43.124.7773: UDP, length 120
23:19:41.609340 IP 192.168.43.147.8880 > 192.168.43.124.7773: UDP, length 120
23:19:41.670733 IP 192.168.43.147.8880 > 192.168.43.124.7773: UDP, length 120
23:19:41.717347 IP 192.168.43.147.8880 > 192.168.43.124.7773: UDP, length 120
23:19:41.759418 IP 192.168.43.147.8880 > 192.168.43.124.7773: UDP, length 120
23:19:41.814837 IP 192.168.43.147.8880 > 192.168.43.124.7773: UDP, length 120
23:19:41.862437 IP 192.168.43.147.8880 > 192.168.43.124.7773: UDP, length 120
23:19:41.909573 IP 192.168.43.147.8880 > 192.168.43.124.7773: UDP, length 120
23:19:41.958971 IP 192.168.43.147.8880 > 192.168.43.124.7773: UDP, length 120
23:19:42.016538 IP 192.168.43.147.8880 > 192.168.43.124.7773: UDP, length 120
23:19:42.060040 IP 192.168.43.147.8880 > 192.168.43.124.7773: UDP, length 120
23:19:42.118765 IP 192.168.43.147.8880 > 192.168.43.124.7773: UDP, length 120
23:19:42.170717 IP 192.168.43.147.8880 > 192.168.43.124.7773: UDP, length 120
23:19:42.209841 IP 192.168.43.147.8880 > 192.168.43.124.7773: UDP, length 120
23:19:42.263021 IP 192.168.43.147.8880 > 192.168.43.124.7773: UDP, length 120
23:19:42.319740 IP 192.168.43.147.8880 > 192.168.43.124.7773: UDP, length 120
23:19:42.365619 IP 192.168.43.147.8880 > 192.168.43.124.7773: UDP, length 120
23:19:42.411363 IP 192.168.43.147.8880 > 192.168.43.124.7773: UDP, length 120
23:19:42.474160 IP 192.168.43.147.8880 > 192.168.43.124.7773: UDP, length 120
23:19:42.509966 IP 192.168.43.147.8880 > 192.168.43.124.7773: UDP, length 120
23:19:42.559295 IP 192.168.43.147.8880 > 192.168.43.124.7773: UDP, length 120
23:19:42.637237 IP 192.168.43.147.8880 > 192.168.43.124.7773: UDP, length 120
23:19:42.664459 IP 192.168.43.147.8880 > 192.168.43.124.7773: UDP, length 120
23:19:42.712586 IP 192.168.43.147.8880 > 192.168.43.124.7773: UDP, length 120
23:19:42.766938 IP 192.168.43.147.8880 > 192.168.43.124.7773: UDP, length 120
23:19:42.810125 IP 192.168.43.147.8880 > 192.168.43.124.7773: UDP, length 120
23:19:42.856149 IP 192.168.43.147.8880 > 192.168.43.124.7773: UDP, length 120
23:19:42.912512 IP 192.168.43.147.8880 > 192.168.43.124.7773: UDP, length 120
23:19:42.969535 IP 192.168.43.147.8880 > 192.168.43.124.7773: UDP, length 120
23:19:43.014458 IP 192.168.43.147.8880 > 192.168.43.124.7773: UDP, length 120
23:19:43.059719 IP 192.168.43.147.8880 > 192.168.43.124.7773: UDP, length 120
23:19:43.117395 IP 192.168.43.147.8880 > 192.168.43.124.7773: UDP, length 120
23:19:43.161126 IP 192.168.43.147.8880 > 192.168.43.124.7773: UDP, length 120
23:19:43.209787 IP 192.168.43.147.8880 > 192.168.43.124.7773: UDP, length 120
23:19:43.274871 IP 192.168.43.147.8880 > 192.168.43.124.7773: UDP, length 120
23:19:43.311735 IP 192.168.43.147.8880 > 192.168.43.124.7773: UDP, length 120
23:19:43.361341 IP 192.168.43.147.8880 > 192.168.43.124.7773: UDP, length 120
23:19:43.422358 IP 192.168.43.147.8880 > 192.168.43.124.7773: UDP, length 120
23:19:43.460442 IP 192.168.43.147.8880 > 192.168.43.124.7773: UDP, length 120
23:19:43.510866 IP 192.168.43.147.8880 > 192.168.43.124.7773: UDP, length 120
23:19:43.572316 IP 192.168.43.147.8880 > 192.168.43.124.7773: UDP, length 120
23:19:43.609713 IP 192.168.43.147.8880 > 192.168.43.124.7773: UDP, length 120
23:19:43.660321 IP 192.168.43.147.8880 > 192.168.43.124.7773: UDP, length 120
23:19:43.719169 IP 192.168.43.147.8880 > 192.168.43.124.7773: UDP, length 120
23:19:43.766054 IP 192.168.43.147.8880 > 192.168.43.124.7773: UDP, length 120
23:19:43.809175 IP 192.168.43.147.8880 > 192.168.43.124.7773: UDP, length 120
23:19:43.860848 IP 192.168.43.147.8880 > 192.168.43.124.7773: UDP, length 120
23:19:43.910145 IP 192.168.43.147.8880 > 192.168.43.124.7773: UDP, length 120
23:19:43.961477 IP 192.168.43.147.8880 > 192.168.43.124.7773: UDP, length 120
23:19:44.017308 IP 192.168.43.147.8880 > 192.168.43.124.7773: UDP, length 120
23:19:44.060819 IP 192.168.43.147.8880 > 192.168.43.124.7773: UDP, length 120
23:19:44.118655 IP 192.168.43.147.8880 > 192.168.43.124.7773: UDP, length 120
23:19:44.171658 IP 192.168.43.147.8880 > 192.168.43.124.7773: UDP, length 120
23:19:44.210804 IP 192.168.43.147.8880 > 192.168.43.124.7773: UDP, length 120
23:19:44.260155 IP 192.168.43.147.8880 > 192.168.43.124.7773: UDP, length 120
23:19:44.310391 IP 192.168.43.147.8880 > 192.168.43.124.7773: UDP, length 120
23:19:44.371557 IP 192.168.43.147.8880 > 192.168.43.124.7773: UDP, length 120
23:19:44.412892 IP 192.168.43.147.8880 > 192.168.43.124.7773: UDP, length 120
23:19:44.459220 IP 192.168.43.147.8880 > 192.168.43.124.7773: UDP, length 120
23:19:44.511245 IP 192.168.43.147.8880 > 192.168.43.124.7773: UDP, length 120
23:19:44.570929 IP 192.168.43.147.8880 > 192.168.43.124.7773: UDP, length 120
23:19:44.609144 IP 192.168.43.147.8880 > 192.168.43.124.7773: UDP, length 120
23:19:44.669463 IP 192.168.43.147.8880 > 192.168.43.124.7773: UDP, length 120
23:19:44.710269 IP 192.168.43.147.8880 > 192.168.43.124.7773: UDP, length 120
23:19:44.770862 IP 192.168.43.147.8880 > 192.168.43.124.7773: UDP, length 120
23:19:44.810813 IP 192.168.43.147.8880 > 192.168.43.124.7773: UDP, length 120
23:19:44.857142 IP 192.168.43.147.8880 > 192.168.43.124.7773: UDP, length 120
23:19:44.913342 IP 192.168.43.147.8880 > 192.168.43.124.7773: UDP, length 120
23:19:44.969612 IP 192.168.43.147.8880 > 192.168.43.124.7773: UDP, length 120
23:19:45.013942 IP 192.168.43.147.8880 > 192.168.43.124.7773: UDP, length 120
23:19:45.059212 IP 192.168.43.147.8880 > 192.168.43.124.7773: UDP, length 120
23:19:45.117932 IP 192.168.43.147.8880 > 192.168.43.124.7773: UDP, length 120
23:19:45.159267 IP 192.168.43.147.8880 > 192.168.43.124.7773: UDP, length 120
23:19:45.209080 IP 192.168.43.147.8880 > 192.168.43.124.7773: UDP, length 120
23:19:45.267525 IP 192.168.43.147.8880 > 192.168.43.124.7773: UDP, length 120
23:19:45.309938 IP 192.168.43.147.8880 > 192.168.43.124.7773: UDP, length 120
23:19:45.358616 IP 192.168.43.147.8880 > 192.168.43.124.7773: UDP, length 120
23:19:45.412013 IP 192.168.43.147.8880 > 192.168.43.124.7773: UDP, length 120
23:19:45.467987 IP 192.168.43.147.8880 > 192.168.43.124.7773: UDP, length 120
23:19:45.511273 IP 192.168.43.147.8880 > 192.168.43.124.7773: UDP, length 120
23:19:45.559289 IP 192.168.43.147.8880 > 192.168.43.124.7773: UDP, length 120
23:19:45.627681 IP 192.168.43.147.8880 > 192.168.43.124.7773: UDP, length 120
23:19:45.668756 IP 192.168.43.147.8880 > 192.168.43.124.7773: UDP, length 120
23:19:45.709101 IP 192.168.43.147.8880 > 192.168.43.124.7773: UDP, length 120
23:19:45.759848 IP 192.168.43.147.8880 > 192.168.43.124.7773: UDP, length 120
23:19:45.821356 IP 192.168.43.147.8880 > 192.168.43.124.7773: UDP, length 120
23:19:45.859482 IP 192.168.43.147.8880 > 192.168.43.124.7773: UDP, length 120
23:19:45.909315 IP 192.168.43.147.8880 > 192.168.43.124.7773: UDP, length 120
23:19:45.959976 IP 192.168.43.147.8880 > 192.168.43.124.7773: UDP, length 120
23:19:46.020480 IP 192.168.43.147.8880 > 192.168.43.124.7773: UDP, length 120
23:19:46.062159 IP 192.168.43.147.8880 > 192.168.43.124.7773: UDP, length 120
23:19:46.112390 IP 192.168.43.147.8880 > 192.168.43.124.7773: UDP, length 120
23:19:46.159634 IP 192.168.43.147.8880 > 192.168.43.124.7773: UDP, length 120
23:19:46.220047 IP 192.168.43.147.8880 > 192.168.43.124.7773: UDP, length 120
23:19:46.262858 IP 192.168.43.147.8880 > 192.168.43.124.7773: UDP, length 120
23:19:46.309187 IP 192.168.43.147.8880 > 192.168.43.124.7773: UDP, length 120
23:19:46.359240 IP 192.168.43.147.8880 > 192.168.43.124.7773: UDP, length 120
23:19:46.419121 IP 192.168.43.147.8880 > 192.168.43.124.7773: UDP, length 120
23:19:46.460676 IP 192.168.43.147.8880 > 192.168.43.124.7773: UDP, length 120
23:19:46.510134 IP 192.168.43.147.8880 > 192.168.43.124.7773: UDP, length 120
23:19:46.559268 IP 192.168.43.147.8880 > 192.168.43.124.7773: UDP, length 120
23:19:46.619724 IP 192.168.43.147.8880 > 192.168.43.124.7773: UDP, length 120
23:19:46.661634 IP 192.168.43.147.8880 > 192.168.43.124.7773: UDP, length 120
23:19:46.709202 IP 192.168.43.147.8880 > 192.168.43.124.7773: UDP, length 120
23:19:46.759293 IP 192.168.43.147.8880 > 192.168.43.124.7773: UDP, length 120
23:19:46.819441 IP 192.168.43.147.8880 > 192.168.43.124.7773: UDP, length 120
23:19:46.859462 IP 192.168.43.147.8880 > 192.168.43.124.7773: UDP, length 120
23:19:46.911129 IP 192.168.43.147.8880 > 192.168.43.124.7773: UDP, length 120
23:19:46.961443 IP 192.168.43.147.8880 > 192.168.43.124.7773: UDP, length 120
23:19:47.019289 IP 192.168.43.147.8880 > 192.168.43.124.7773: UDP, length 120
23:19:47.067242 IP 192.168.43.147.8880 > 192.168.43.124.7773: UDP, length 120
23:19:47.117229 IP 192.168.43.147.8880 > 192.168.43.124.7773: UDP, length 120
23:19:47.160668 IP 192.168.43.147.8880 > 192.168.43.124.7773: UDP, length 120
23:19:47.223584 IP 192.168.43.147.8880 > 192.168.43.124.7773: UDP, length 120
23:19:47.266257 IP 192.168.43.147.8880 > 192.168.43.124.7773: UDP, length 120
23:19:47.310003 IP 192.168.43.147.8880 > 192.168.43.124.7773: UDP, length 120
23:19:47.359657 IP 192.168.43.147.8880 > 192.168.43.124.7773: UDP, length 120
23:19:47.422560 IP 192.168.43.147.8880 > 192.168.43.124.7773: UDP, length 120
23:19:47.469778 IP 192.168.43.147.8880 > 192.168.43.124.7773: UDP, length 120
23:19:47.509921 IP 192.168.43.147.8880 > 192.168.43.124.7773: UDP, length 120
23:19:47.562199 IP 192.168.43.147.8880 > 192.168.43.124.7773: UDP, length 120
23:19:47.621902 IP 192.168.43.147.8880 > 192.168.43.124.7773: UDP, length 120
23:19:47.664439 IP 192.168.43.147.8880 > 192.168.43.124.7773: UDP, length 120
23:19:47.714187 IP 192.168.43.147.8880 > 192.168.43.124.7773: UDP, length 120
23:19:47.759756 IP 192.168.43.147.8880 > 192.168.43.124.7773: UDP, length 120
23:19:47.820533 IP 192.168.43.147.8880 > 192.168.43.124.7773: UDP, length 120
23:19:47.858485 IP 192.168.43.147.8880 > 192.168.43.124.7773: UDP, length 120
23:19:47.911329 IP 192.168.43.147.8880 > 192.168.43.124.7773: UDP, length 120
23:19:47.961300 IP 192.168.43.147.8880 > 192.168.43.124.7773: UDP, length 120
23:19:48.022467 IP 192.168.43.147.8880 > 192.168.43.124.7773: UDP, length 120
23:19:48.060487 IP 192.168.43.147.8880 > 192.168.43.124.7773: UDP, length 120
23:19:48.113990 IP 192.168.43.147.8880 > 192.168.43.124.7773: UDP, length 120
23:19:48.160498 IP 192.168.43.147.8880 > 192.168.43.124.7773: UDP, length 120
23:19:48.221299 IP 192.168.43.147.8880 > 192.168.43.124.7773: UDP, length 120
23:19:48.258781 IP 192.168.43.147.8880 > 192.168.43.124.7773: UDP, length 120
23:19:48.310119 IP 192.168.43.147.8880 > 192.168.43.124.7773: UDP, length 120
23:19:48.361501 IP 192.168.43.147.8880 > 192.168.43.124.7773: UDP, length 120
23:19:48.421490 IP 192.168.43.147.8880 > 192.168.43.124.7773: UDP, length 120
23:19:48.460060 IP 192.168.43.147.8880 > 192.168.43.124.7773: UDP, length 120
23:19:48.511229 IP 192.168.43.147.8880 > 192.168.43.124.7773: UDP, length 120
23:19:48.571580 IP 192.168.43.147.8880 > 192.168.43.124.7773: UDP, length 120
23:19:48.621504 IP 192.168.43.147.8880 > 192.168.43.124.7773: UDP, length 120
23:19:48.660225 IP 192.168.43.147.8880 > 192.168.43.124.7773: UDP, length 120
23:19:48.710240 IP 192.168.43.147.8880 > 192.168.43.124.7773: UDP, length 120
23:19:48.759468 IP 192.168.43.147.8880 > 192.168.43.124.7773: UDP, length 120
23:19:48.820098 IP 192.168.43.147.8880 > 192.168.43.124.7773: UDP, length 120
23:19:48.856932 IP 192.168.43.147.8880 > 192.168.43.124.7773: UDP, length 120
23:19:48.910049 IP 192.168.43.147.8880 > 192.168.43.124.7773: UDP, length 120
23:19:48.961726 IP 192.168.43.147.8880 > 192.168.43.124.7773: UDP, length 120
23:19:49.020463 IP 192.168.43.147.8880 > 192.168.43.124.7773: UDP, length 120
23:19:49.061665 IP 192.168.43.147.8880 > 192.168.43.124.7773: UDP, length 120
23:19:49.114004 IP 192.168.43.147.8880 > 192.168.43.124.7773: UDP, length 120
23:19:49.184676 IP 192.168.43.147.8880 > 192.168.43.124.7773: UDP, length 120
23:19:49.214345 IP 192.168.43.147.8880 > 192.168.43.124.7773: UDP, length 120
23:19:49.261186 IP 192.168.43.147.8880 > 192.168.43.124.7773: UDP, length 120
23:19:49.317041 IP 192.168.43.147.8880 > 192.168.43.124.7773: UDP, length 120
23:19:49.369698 IP 192.168.43.147.8880 > 192.168.43.124.7773: UDP, length 120
23:19:49.410418 IP 192.168.43.147.8880 > 192.168.43.124.7773: UDP, length 120
23:19:49.459772 IP 192.168.43.147.8880 > 192.168.43.124.7773: UDP, length 120
23:19:49.510260 IP 192.168.43.147.8880 > 192.168.43.124.7773: UDP, length 120
23:19:49.569070 IP 192.168.43.147.8880 > 192.168.43.124.7773: UDP, length 120
23:19:49.611931 IP 192.168.43.147.8880 > 192.168.43.124.7773: UDP, length 120
23:19:49.776134 IP 192.168.43.147.8880 > 192.168.43.124.7773: UDP, length 120
23:19:49.776147 IP 192.168.43.147.8880 > 192.168.43.124.7773: UDP, length 120
23:19:49.776149 IP 192.168.43.147.8880 > 192.168.43.124.7773: UDP, length 120
23:19:49.810416 IP 192.168.43.147.8880 > 192.168.43.124.7773: UDP, length 120
23:19:49.865344 IP 192.168.43.147.8880 > 192.168.43.124.7773: UDP, length 120
23:19:49.922136 IP 192.168.43.147.8880 > 192.168.43.124.7773: UDP, length 120
23:19:49.970686 IP 192.168.43.147.8880 > 192.168.43.124.7773: UDP, length 120
23:19:50.010469 IP 192.168.43.147.8880 > 192.168.43.124.7773: UDP, length 120
23:19:50.061908 IP 192.168.43.147.8880 > 192.168.43.124.7773: UDP, length 120
23:19:50.111004 IP 192.168.43.147.8880 > 192.168.43.124.7773: UDP, length 120
23:19:50.169586 IP 192.168.43.147.8880 > 192.168.43.124.7773: UDP, length 120
23:19:50.213632 IP 192.168.43.147.8880 > 192.168.43.124.7773: UDP, length 120
23:19:50.260025 IP 192.168.43.147.8880 > 192.168.43.124.7773: UDP, length 120
23:19:50.311382 IP 192.168.43.147.8880 > 192.168.43.124.7773: UDP, length 120
23:19:50.370880 IP 192.168.43.147.8880 > 192.168.43.124.7773: UDP, length 120
23:19:50.410234 IP 192.168.43.147.8880 > 192.168.43.124.7773: UDP, length 120
23:19:50.459821 IP 192.168.43.147.8880 > 192.168.43.124.7773: UDP, length 120
23:19:50.510790 IP 192.168.43.147.8880 > 192.168.43.124.7773: UDP, length 120
23:19:50.566602 IP 192.168.43.147.8880 > 192.168.43.124.7773: UDP, length 120
23:19:50.609528 IP 192.168.43.147.8880 > 192.168.43.124.7773: UDP, length 120
23:19:50.669425 IP 192.168.43.147.8880 > 192.168.43.124.7773: UDP, length 120
23:19:50.715873 IP 192.168.43.147.8880 > 192.168.43.124.7773: UDP, length 120
23:19:50.761534 IP 192.168.43.147.8880 > 192.168.43.124.7773: UDP, length 120
23:19:50.810518 IP 192.168.43.147.8880 > 192.168.43.124.7773: UDP, length 120
23:19:50.873005 IP 192.168.43.147.8880 > 192.168.43.124.7773: UDP, length 120
23:19:50.909758 IP 192.168.43.147.8880 > 192.168.43.124.7773: UDP, length 120
23:19:50.959434 IP 192.168.43.147.8880 > 192.168.43.124.7773: UDP, length 120
23:19:51.009641 IP 192.168.43.147.8880 > 192.168.43.124.7773: UDP, length 120
23:19:51.068208 IP 192.168.43.147.8880 > 192.168.43.124.7773: UDP, length 120
23:19:51.109972 IP 192.168.43.147.8880 > 192.168.43.124.7773: UDP, length 120
23:19:51.161986 IP 192.168.43.147.8880 > 192.168.43.124.7773: UDP, length 120
23:19:51.212544 IP 192.168.43.147.8880 > 192.168.43.124.7773: UDP, length 120
23:19:51.269672 IP 192.168.43.147.8880 > 192.168.43.124.7773: UDP, length 120
23:19:51.309875 IP 192.168.43.147.8880 > 192.168.43.124.7773: UDP, length 120
23:19:51.367204 IP 192.168.43.147.8880 > 192.168.43.124.7773: UDP, length 120
23:19:51.412233 IP 192.168.43.147.8880 > 192.168.43.124.7773: UDP, length 120
23:19:51.471878 IP 192.168.43.147.8880 > 192.168.43.124.7773: UDP, length 120
23:19:51.509660 IP 192.168.43.147.8880 > 192.168.43.124.7773: UDP, length 120
23:19:51.559716 IP 192.168.43.147.8880 > 192.168.43.124.7773: UDP, length 120
23:19:51.609314 IP 192.168.43.147.8880 > 192.168.43.124.7773: UDP, length 120
23:19:51.671126 IP 192.168.43.147.8880 > 192.168.43.124.7773: UDP, length 120
23:19:51.710994 IP 192.168.43.147.8880 > 192.168.43.124.7773: UDP, length 120
23:19:51.761023 IP 192.168.43.147.8880 > 192.168.43.124.7773: UDP, length 120
23:19:51.818098 IP 192.168.43.147.8880 > 192.168.43.124.7773: UDP, length 120
23:19:51.856917 IP 192.168.43.147.8880 > 192.168.43.124.7773: UDP, length 120
23:19:51.909684 IP 192.168.43.147.8880 > 192.168.43.124.7773: UDP, length 120
23:19:51.967093 IP 192.168.43.147.8880 > 192.168.43.124.7773: UDP, length 120
23:19:52.009632 IP 192.168.43.147.8880 > 192.168.43.124.7773: UDP, length 120
23:19:52.059303 IP 192.168.43.147.8880 > 192.168.43.124.7773: UDP, length 120
23:19:52.124021 IP 192.168.43.147.8880 > 192.168.43.124.7773: UDP, length 120
23:19:52.159946 IP 192.168.43.147.8880 > 192.168.43.124.7773: UDP, length 120
23:19:52.244358 IP 192.168.43.147.8880 > 192.168.43.124.7773: UDP, length 120
23:19:52.261983 IP 192.168.43.147.8880 > 192.168.43.124.7773: UDP, length 120
23:19:52.326236 IP 192.168.43.147.8880 > 192.168.43.124.7773: UDP, length 120
23:19:52.359468 IP 192.168.43.147.8880 > 192.168.43.124.7773: UDP, length 120
23:19:52.417764 IP 192.168.43.147.8880 > 192.168.43.124.7773: UDP, length 120
23:19:52.461551 IP 192.168.43.147.8880 > 192.168.43.124.7773: UDP, length 120
23:19:52.522036 IP 192.168.43.147.8880 > 192.168.43.124.7773: UDP, length 120
23:19:52.559601 IP 192.168.43.147.8880 > 192.168.43.124.7773: UDP, length 120
23:19:52.609857 IP 192.168.43.147.8880 > 192.168.43.124.7773: UDP, length 120
23:19:52.662866 IP 192.168.43.147.8880 > 192.168.43.124.7773: UDP, length 120
23:19:52.721010 IP 192.168.43.147.8880 > 192.168.43.124.7773: UDP, length 120
23:19:52.763457 IP 192.168.43.147.8880 > 192.168.43.124.7773: UDP, length 120
23:19:52.809974 IP 192.168.43.147.8880 > 192.168.43.124.7773: UDP, length 120
23:19:52.858951 IP 192.168.43.147.8880 > 192.168.43.124.7773: UDP, length 120
23:19:52.913931 IP 192.168.43.147.8880 > 192.168.43.124.7773: UDP, length 120
23:19:52.961994 IP 192.168.43.147.8880 > 192.168.43.124.7773: UDP, length 120
23:19:53.024008 IP 192.168.43.147.8880 > 192.168.43.124.7773: UDP, length 120
23:19:53.060400 IP 192.168.43.147.8880 > 192.168.43.124.7773: UDP, length 120
23:19:53.109615 IP 192.168.43.147.8880 > 192.168.43.124.7773: UDP, length 120
23:19:53.160278 IP 192.168.43.147.8880 > 192.168.43.124.7773: UDP, length 120
23:19:53.219363 IP 192.168.43.147.8880 > 192.168.43.124.7773: UDP, length 120
23:19:53.259907 IP 192.168.43.147.8880 > 192.168.43.124.7773: UDP, length 120
23:19:53.310196 IP 192.168.43.147.8880 > 192.168.43.124.7773: UDP, length 120
23:19:53.362508 IP 192.168.43.147.8880 > 192.168.43.124.7773: UDP, length 120
23:19:53.423320 IP 192.168.43.147.8880 > 192.168.43.124.7773: UDP, length 120
23:19:53.464934 IP 192.168.43.147.8880 > 192.168.43.124.7773: UDP, length 120
23:19:53.518190 IP 192.168.43.147.8880 > 192.168.43.124.7773: UDP, length 120
23:19:53.561296 IP 192.168.43.147.8880 > 192.168.43.124.7773: UDP, length 120
23:19:53.628819 IP 192.168.43.147.8880 > 192.168.43.124.7773: UDP, length 120
23:19:53.663827 IP 192.168.43.147.8880 > 192.168.43.124.7773: UDP, length 120
23:19:53.710026 IP 192.168.43.147.8880 > 192.168.43.124.7773: UDP, length 120
23:19:53.759734 IP 192.168.43.147.8880 > 192.168.43.124.7773: UDP, length 120
23:19:53.822252 IP 192.168.43.147.8880 > 192.168.43.124.7773: UDP, length 120
23:19:53.857819 IP 192.168.43.147.8880 > 192.168.43.124.7773: UDP, length 120
23:19:53.912667 IP 192.168.43.147.8880 > 192.168.43.124.7773: UDP, length 120
23:19:53.961093 IP 192.168.43.147.8880 > 192.168.43.124.7773: UDP, length 120
23:19:54.020236 IP 192.168.43.147.8880 > 192.168.43.124.7773: UDP, length 120
23:19:54.062707 IP 192.168.43.147.8880 > 192.168.43.124.7773: UDP, length 120
23:19:54.110237 IP 192.168.43.147.8880 > 192.168.43.124.7773: UDP, length 120
23:19:54.160418 IP 192.168.43.147.8880 > 192.168.43.124.7773: UDP, length 120
23:19:54.221453 IP 192.168.43.147.8880 > 192.168.43.124.7773: UDP, length 120
23:19:54.283037 IP 192.168.43.147.8880 > 192.168.43.124.7773: UDP, length 120
23:19:54.311177 IP 192.168.43.147.8880 > 192.168.43.124.7773: UDP, length 120
23:19:54.369652 IP 192.168.43.147.8880 > 192.168.43.124.7773: UDP, length 120
23:19:54.423192 IP 192.168.43.147.8880 > 192.168.43.124.7773: UDP, length 120
23:19:54.461478 IP 192.168.43.147.8880 > 192.168.43.124.7773: UDP, length 120
23:19:54.509393 IP 192.168.43.147.8880 > 192.168.43.124.7773: UDP, length 120
23:19:54.559608 IP 192.168.43.147.8880 > 192.168.43.124.7773: UDP, length 120
23:19:54.622010 IP 192.168.43.147.8880 > 192.168.43.124.7773: UDP, length 120
23:19:54.669276 IP 192.168.43.147.8880 > 192.168.43.124.7773: UDP, length 120
23:19:54.709725 IP 192.168.43.147.8880 > 192.168.43.124.7773: UDP, length 120
23:19:54.759387 IP 192.168.43.147.8880 > 192.168.43.124.7773: UDP, length 120
23:19:54.822260 IP 192.168.43.147.8880 > 192.168.43.124.7773: UDP, length 120
23:19:54.857870 IP 192.168.43.147.8880 > 192.168.43.124.7773: UDP, length 120
23:19:54.914158 IP 192.168.43.147.8880 > 192.168.43.124.7773: UDP, length 120
23:19:54.960425 IP 192.168.43.147.8880 > 192.168.43.124.7773: UDP, length 120
23:19:55.021408 IP 192.168.43.147.8880 > 192.168.43.124.7773: UDP, length 120
23:19:55.063365 IP 192.168.43.147.8880 > 192.168.43.124.7773: UDP, length 120
23:19:55.112131 IP 192.168.43.147.8880 > 192.168.43.124.7773: UDP, length 120
23:19:55.161238 IP 192.168.43.147.8880 > 192.168.43.124.7773: UDP, length 120
23:19:55.226216 IP 192.168.43.147.8880 > 192.168.43.124.7773: UDP, length 120
23:19:55.260508 IP 192.168.43.147.8880 > 192.168.43.124.7773: UDP, length 120
23:19:55.310902 IP 192.168.43.147.8880 > 192.168.43.124.7773: UDP, length 120
23:19:55.359958 IP 192.168.43.147.8880 > 192.168.43.124.7773: UDP, length 120
23:19:55.421745 IP 192.168.43.147.8880 > 192.168.43.124.7773: UDP, length 120
23:19:55.460928 IP 192.168.43.147.8880 > 192.168.43.124.7773: UDP, length 120
23:19:55.512804 IP 192.168.43.147.8880 > 192.168.43.124.7773: UDP, length 120
23:19:55.564371 IP 192.168.43.147.8880 > 192.168.43.124.7773: UDP, length 120
23:19:55.620153 IP 192.168.43.147.8880 > 192.168.43.124.7773: UDP, length 120
23:19:55.666921 IP 192.168.43.147.8880 > 192.168.43.124.7773: UDP, length 120
23:19:55.712033 IP 192.168.43.147.8880 > 192.168.43.124.7773: UDP, length 120
23:19:55.759431 IP 192.168.43.147.8880 > 192.168.43.124.7773: UDP, length 120
23:19:55.820625 IP 192.168.43.147.8880 > 192.168.43.124.7773: UDP, length 120
23:19:55.857696 IP 192.168.43.147.8880 > 192.168.43.124.7773: UDP, length 120
23:19:55.909914 IP 192.168.43.147.8880 > 192.168.43.124.7773: UDP, length 120
23:19:55.959779 IP 192.168.43.147.8880 > 192.168.43.124.7773: UDP, length 120
23:19:56.022691 IP 192.168.43.147.8880 > 192.168.43.124.7773: UDP, length 120
23:19:56.076801 IP 192.168.43.147.8880 > 192.168.43.124.7773: UDP, length 120
23:19:56.110688 IP 192.168.43.147.8880 > 192.168.43.124.7773: UDP, length 120
23:19:56.161206 IP 192.168.43.147.8880 > 192.168.43.124.7773: UDP, length 120
23:19:56.223355 IP 192.168.43.147.8880 > 192.168.43.124.7773: UDP, length 120
23:19:56.260224 IP 192.168.43.147.8880 > 192.168.43.124.7773: UDP, length 120
23:19:56.308370 IP 192.168.43.147.8880 > 192.168.43.124.7773: UDP, length 120
23:19:56.357163 IP 192.168.43.147.8880 > 192.168.43.124.7773: UDP, length 120
23:19:56.419643 IP 192.168.43.147.8880 > 192.168.43.124.7773: UDP, length 120
23:19:56.460923 IP 192.168.43.147.8880 > 192.168.43.124.7773: UDP, length 120
23:19:56.512714 IP 192.168.43.147.8880 > 192.168.43.124.7773: UDP, length 120
23:19:56.560232 IP 192.168.43.147.8880 > 192.168.43.124.7773: UDP, length 120
23:19:56.620195 IP 192.168.43.147.8880 > 192.168.43.124.7773: UDP, length 120
23:19:56.667414 IP 192.168.43.147.8880 > 192.168.43.124.7773: UDP, length 120
23:19:56.709914 IP 192.168.43.147.8880 > 192.168.43.124.7773: UDP, length 120
23:19:56.778575 IP 192.168.43.147.8880 > 192.168.43.124.7773: UDP, length 120
23:19:56.825731 IP 192.168.43.147.8880 > 192.168.43.124.7773: UDP, length 120
23:19:56.856280 IP 192.168.43.147.8880 > 192.168.43.124.7773: UDP, length 120
23:19:56.909894 IP 192.168.43.147.8880 > 192.168.43.124.7773: UDP, length 120
23:19:56.961984 IP 192.168.43.147.8880 > 192.168.43.124.7773: UDP, length 120
23:19:57.021815 IP 192.168.43.147.8880 > 192.168.43.124.7773: UDP, length 120
23:19:57.064814 IP 192.168.43.147.8880 > 192.168.43.124.7773: UDP, length 120
23:19:57.111176 IP 192.168.43.147.8880 > 192.168.43.124.7773: UDP, length 120
23:19:57.160034 IP 192.168.43.147.8880 > 192.168.43.124.7773: UDP, length 120
23:19:57.223179 IP 192.168.43.147.8880 > 192.168.43.124.7773: UDP, length 120
23:19:57.262484 IP 192.168.43.147.8880 > 192.168.43.124.7773: UDP, length 120
23:19:57.309546 IP 192.168.43.147.8880 > 192.168.43.124.7773: UDP, length 120
23:19:57.359971 IP 192.168.43.147.8880 > 192.168.43.124.7773: UDP, length 120
23:19:57.419962 IP 192.168.43.147.8880 > 192.168.43.124.7773: UDP, length 120
23:19:57.459750 IP 192.168.43.147.8880 > 192.168.43.124.7773: UDP, length 120
23:19:57.509753 IP 192.168.43.147.8880 > 192.168.43.124.7773: UDP, length 120
23:19:57.561681 IP 192.168.43.147.8880 > 192.168.43.124.7773: UDP, length 120
23:19:57.622464 IP 192.168.43.147.8880 > 192.168.43.124.7773: UDP, length 120
23:19:57.669040 IP 192.168.43.147.8880 > 192.168.43.124.7773: UDP, length 120
23:19:57.714841 IP 192.168.43.147.8880 > 192.168.43.124.7773: UDP, length 120
23:19:57.759888 IP 192.168.43.147.8880 > 192.168.43.124.7773: UDP, length 120
23:19:57.820696 IP 192.168.43.147.8880 > 192.168.43.124.7773: UDP, length 120
23:19:57.857536 IP 192.168.43.147.8880 > 192.168.43.124.7773: UDP, length 120
23:19:57.910237 IP 192.168.43.147.8880 > 192.168.43.124.7773: UDP, length 120
23:19:57.960429 IP 192.168.43.147.8880 > 192.168.43.124.7773: UDP, length 120
23:19:58.021871 IP 192.168.43.147.8880 > 192.168.43.124.7773: UDP, length 120
23:19:58.060494 IP 192.168.43.147.8880 > 192.168.43.124.7773: UDP, length 120
23:19:58.111182 IP 192.168.43.147.8880 > 192.168.43.124.7773: UDP, length 120
23:19:58.171126 IP 192.168.43.147.8880 > 192.168.43.124.7773: UDP, length 120
23:19:58.212561 IP 192.168.43.147.8880 > 192.168.43.124.7773: UDP, length 120
23:19:58.264611 IP 192.168.43.147.8880 > 192.168.43.124.7773: UDP, length 120
23:19:58.331232 IP 192.168.43.147.8880 > 192.168.43.124.7773: UDP, length 120
23:19:58.367076 IP 192.168.43.147.8880 > 192.168.43.124.7773: UDP, length 120
23:19:58.410325 IP 192.168.43.147.8880 > 192.168.43.124.7773: UDP, length 120
23:19:58.461162 IP 192.168.43.147.8880 > 192.168.43.124.7773: UDP, length 120
23:19:58.519284 IP 192.168.43.147.8880 > 192.168.43.124.7773: UDP, length 120
23:19:58.560643 IP 192.168.43.147.8880 > 192.168.43.124.7773: UDP, length 120
23:19:58.609984 IP 192.168.43.147.8880 > 192.168.43.124.7773: UDP, length 120
23:19:58.682657 IP 192.168.43.147.8880 > 192.168.43.124.7773: UDP, length 120
23:19:58.713363 IP 192.168.43.147.8880 > 192.168.43.124.7773: UDP, length 120
23:19:58.762311 IP 192.168.43.147.8880 > 192.168.43.124.7773: UDP, length 120
23:19:58.810121 IP 192.168.43.147.8880 > 192.168.43.124.7773: UDP, length 120
23:19:58.861878 IP 192.168.43.147.8880 > 192.168.43.124.7773: UDP, length 120
23:19:58.913155 IP 192.168.43.147.8880 > 192.168.43.124.7773: UDP, length 120
23:19:58.962812 IP 192.168.43.147.8880 > 192.168.43.124.7773: UDP, length 120
23:19:59.025812 IP 192.168.43.147.8880 > 192.168.43.124.7773: UDP, length 120
23:19:59.061242 IP 192.168.43.147.8880 > 192.168.43.124.7773: UDP, length 120
23:19:59.109576 IP 192.168.43.147.8880 > 192.168.43.124.7773: UDP, length 120
23:19:59.161712 IP 192.168.43.147.8880 > 192.168.43.124.7773: UDP, length 120
23:19:59.219884 IP 192.168.43.147.8880 > 192.168.43.124.7773: UDP, length 120
23:19:59.262501 IP 192.168.43.147.8880 > 192.168.43.124.7773: UDP, length 120
23:19:59.310858 IP 192.168.43.147.8880 > 192.168.43.124.7773: UDP, length 120
23:19:59.360615 IP 192.168.43.147.8880 > 192.168.43.124.7773: UDP, length 120
23:19:59.424171 IP 192.168.43.147.8880 > 192.168.43.124.7773: UDP, length 120
23:20:04.018930 IP 192.168.43.124.8880 > 192.168.43.147.7772: UDP, length 120
23:20:04.069075 IP 192.168.43.124.8880 > 192.168.43.147.7772: UDP, length 120
23:20:04.118996 IP 192.168.43.124.8880 > 192.168.43.147.7772: UDP, length 120
23:20:04.169076 IP 192.168.43.124.8880 > 192.168.43.147.7772: UDP, length 120
23:20:04.219075 IP 192.168.43.124.8880 > 192.168.43.147.7772: UDP, length 120
23:20:04.269078 IP 192.168.43.124.8880 > 192.168.43.147.7772: UDP, length 120
23:20:04.319076 IP 192.168.43.124.8880 > 192.168.43.147.7772: UDP, length 120
23:20:04.369076 IP 192.168.43.124.8880 > 192.168.43.147.7772: UDP, length 120
23:20:04.419075 IP 192.168.43.124.8880 > 192.168.43.147.7772: UDP, length 120
23:20:04.469077 IP 192.168.43.124.8880 > 192.168.43.147.7772: UDP, length 120
23:20:04.519076 IP 192.168.43.124.8880 > 192.168.43.147.7772: UDP, length 120
23:20:04.569075 IP 192.168.43.124.8880 > 192.168.43.147.7772: UDP, length 120
23:20:04.619077 IP 192.168.43.124.8880 > 192.168.43.147.7772: UDP, length 120
23:20:04.669077 IP 192.168.43.124.8880 > 192.168.43.147.7772: UDP, length 120
23:20:04.719076 IP 192.168.43.124.8880 > 192.168.43.147.7772: UDP, length 120
23:20:04.769076 IP 192.168.43.124.8880 > 192.168.43.147.7772: UDP, length 120
23:20:04.819027 IP 192.168.43.124.8880 > 192.168.43.147.7772: UDP, length 120
23:20:04.869010 IP 192.168.43.124.8880 > 192.168.43.147.7772: UDP, length 120
23:20:04.919015 IP 192.168.43.124.8880 > 192.168.43.147.7772: UDP, length 120
23:20:04.969038 IP 192.168.43.124.8880 > 192.168.43.147.7772: UDP, length 120
23:20:05.019019 IP 192.168.43.124.8880 > 192.168.43.147.7772: UDP, length 120
23:20:05.069075 IP 192.168.43.124.8880 > 192.168.43.147.7772: UDP, length 120
23:20:05.119077 IP 192.168.43.124.8880 > 192.168.43.147.7772: UDP, length 120
23:20:05.169079 IP 192.168.43.124.8880 > 192.168.43.147.7772: UDP, length 120
23:20:05.219077 IP 192.168.43.124.8880 > 192.168.43.147.7772: UDP, length 120
23:20:05.269078 IP 192.168.43.124.8880 > 192.168.43.147.7772: UDP, length 120
23:20:05.319076 IP 192.168.43.124.8880 > 192.168.43.147.7772: UDP, length 120
23:20:05.369022 IP 192.168.43.124.8880 > 192.168.43.147.7772: UDP, length 120
23:20:05.419076 IP 192.168.43.124.8880 > 192.168.43.147.7772: UDP, length 120
23:20:05.469126 IP 192.168.43.124.8880 > 192.168.43.147.7772: UDP, length 120
23:20:05.519126 IP 192.168.43.124.8880 > 192.168.43.147.7772: UDP, length 120
23:20:05.569046 IP 192.168.43.124.8880 > 192.168.43.147.7772: UDP, length 120
23:20:05.619077 IP 192.168.43.124.8880 > 192.168.43.147.7772: UDP, length 120
23:20:05.669076 IP 192.168.43.124.8880 > 192.168.43.147.7772: UDP, length 120
23:20:05.719076 IP 192.168.43.124.8880 > 192.168.43.147.7772: UDP, length 120
23:20:05.769077 IP 192.168.43.124.8880 > 192.168.43.147.7772: UDP, length 120
23:20:05.819078 IP 192.168.43.124.8880 > 192.168.43.147.7772: UDP, length 120
23:20:05.869081 IP 192.168.43.124.8880 > 192.168.43.147.7772: UDP, length 120
23:20:05.919078 IP 192.168.43.124.8880 > 192.168.43.147.7772: UDP, length 120
23:20:05.969076 IP 192.168.43.124.8880 > 192.168.43.147.7772: UDP, length 120
23:20:06.019080 IP 192.168.43.124.8880 > 192.168.43.147.7772: UDP, length 120
23:20:06.069078 IP 192.168.43.124.8880 > 192.168.43.147.7772: UDP, length 120
23:20:06.119081 IP 192.168.43.124.8880 > 192.168.43.147.7772: UDP, length 120
23:20:06.169081 IP 192.168.43.124.8880 > 192.168.43.147.7772: UDP, length 120
23:20:06.219079 IP 192.168.43.124.8880 > 192.168.43.147.7772: UDP, length 120
23:20:06.269078 IP 192.168.43.124.8880 > 192.168.43.147.7772: UDP, length 120
23:20:06.319079 IP 192.168.43.124.8880 > 192.168.43.147.7772: UDP, length 120
23:20:06.369075 IP 192.168.43.124.8880 > 192.168.43.147.7772: UDP, length 120
23:20:06.419075 IP 192.168.43.124.8880 > 192.168.43.147.7772: UDP, length 120
23:20:06.469077 IP 192.168.43.124.8880 > 192.168.43.147.7772: UDP, length 120
23:20:06.519077 IP 192.168.43.124.8880 > 192.168.43.147.7772: UDP, length 120
23:20:06.569119 IP 192.168.43.124.8880 > 192.168.43.147.7772: UDP, length 120
23:20:06.619077 IP 192.168.43.124.8880 > 192.168.43.147.7772: UDP, length 120
23:20:06.669076 IP 192.168.43.124.8880 > 192.168.43.147.7772: UDP, length 120
23:20:06.719076 IP 192.168.43.124.8880 > 192.168.43.147.7772: UDP, length 120
23:20:06.769077 IP 192.168.43.124.8880 > 192.168.43.147.7772: UDP, length 120
23:20:06.819120 IP 192.168.43.124.8880 > 192.168.43.147.7772: UDP, length 120
23:20:06.869079 IP 192.168.43.124.8880 > 192.168.43.147.7772: UDP, length 120
23:20:06.919080 IP 192.168.43.124.8880 > 192.168.43.147.7772: UDP, length 120
23:20:06.969386 IP 192.168.43.124.8880 > 192.168.43.147.7772: UDP, length 120
23:20:07.019078 IP 192.168.43.124.8880 > 192.168.43.147.7772: UDP, length 120
23:20:07.069076 IP 192.168.43.124.8880 > 192.168.43.147.7772: UDP, length 120
23:20:07.119075 IP 192.168.43.124.8880 > 192.168.43.147.7772: UDP, length 120
23:20:07.169076 IP 192.168.43.124.8880 > 192.168.43.147.7772: UDP, length 120
23:20:07.219075 IP 192.168.43.124.8880 > 192.168.43.147.7772: UDP, length 120
23:20:07.269076 IP 192.168.43.124.8880 > 192.168.43.147.7772: UDP, length 120
23:20:07.319078 IP 192.168.43.124.8880 > 192.168.43.147.7772: UDP, length 120
23:20:07.369029 IP 192.168.43.124.8880 > 192.168.43.147.7772: UDP, length 120
23:20:07.419076 IP 192.168.43.124.8880 > 192.168.43.147.7772: UDP, length 120
23:20:07.469045 IP 192.168.43.124.8880 > 192.168.43.147.7772: UDP, length 120
23:20:07.519076 IP 192.168.43.124.8880 > 192.168.43.147.7772: UDP, length 120
23:20:07.569077 IP 192.168.43.124.8880 > 192.168.43.147.7772: UDP, length 120
23:20:07.619075 IP 192.168.43.124.8880 > 192.168.43.147.7772: UDP, length 120
23:20:07.668998 IP 192.168.43.124.8880 > 192.168.43.147.7772: UDP, length 120
23:20:07.718970 IP 192.168.43.124.8880 > 192.168.43.147.7772: UDP, length 120
23:20:07.769075 IP 192.168.43.124.8880 > 192.168.43.147.7772: UDP, length 120
23:20:07.819076 IP 192.168.43.124.8880 > 192.168.43.147.7772: UDP, length 120
23:20:07.869076 IP 192.168.43.124.8880 > 192.168.43.147.7772: UDP, length 120
23:20:07.919075 IP 192.168.43.124.8880 > 192.168.43.147.7772: UDP, length 120
23:20:07.969076 IP 192.168.43.124.8880 > 192.168.43.147.7772: UDP, length 120
23:20:08.019077 IP 192.168.43.124.8880 > 192.168.43.147.7772: UDP, length 120
23:20:08.069077 IP 192.168.43.124.8880 > 192.168.43.147.7772: UDP, length 120
23:20:08.119076 IP 192.168.43.124.8880 > 192.168.43.147.7772: UDP, length 120
23:20:08.169076 IP 192.168.43.124.8880 > 192.168.43.147.7772: UDP, length 120
23:20:08.219077 IP 192.168.43.124.8880 > 192.168.43.147.7772: UDP, length 120
23:20:08.269077 IP 192.168.43.124.8880 > 192.168.43.147.7772: UDP, length 120
23:20:08.319076 IP 192.168.43.124.8880 > 192.168.43.147.7772: UDP, length 120
23:20:08.369076 IP 192.168.43.124.8880 > 192.168.43.147.7772: UDP, length 120
23:20:08.419051 IP 192.168.43.124.8880 > 192.168.43.147.7772: UDP, length 120
23:20:08.469139 IP 192.168.43.124.8880 > 192.168.43.147.7772: UDP, length 120
23:20:08.519126 IP 192.168.43.124.8880 > 192.168.43.147.7772: UDP, length 120
23:20:08.569126 IP 192.168.43.124.8880 > 192.168.43.147.7772: UDP, length 120
23:20:08.619077 IP 192.168.43.124.8880 > 192.168.43.147.7772: UDP, length 120
23:20:08.669076 IP 192.168.43.124.8880 > 192.168.43.147.7772: UDP, length 120
23:20:08.719076 IP 192.168.43.124.8880 > 192.168.43.147.7772: UDP, length 120
23:20:08.769077 IP 192.168.43.124.8880 > 192.168.43.147.7772: UDP, length 120
23:20:08.819077 IP 192.168.43.124.8880 > 192.168.43.147.7772: UDP, length 120
23:20:08.869076 IP 192.168.43.124.8880 > 192.168.43.147.7772: UDP, length 120
23:20:08.919078 IP 192.168.43.124.8880 > 192.168.43.147.7772: UDP, length 120
23:20:08.969077 IP 192.168.43.124.8880 > 192.168.43.147.7772: UDP, length 120
23:20:09.019021 IP 192.168.43.124.8880 > 192.168.43.147.7772: UDP, length 120
23:20:09.069077 IP 192.168.43.124.8880 > 192.168.43.147.7772: UDP, length 120
23:20:09.119076 IP 192.168.43.124.8880 > 192.168.43.147.7772: UDP, length 120
23:20:09.169127 IP 192.168.43.124.8880 > 192.168.43.147.7772: UDP, length 120
23:20:09.219125 IP 192.168.43.124.8880 > 192.168.43.147.7772: UDP, length 120
23:20:09.269129 IP 192.168.43.124.8880 > 192.168.43.147.7772: UDP, length 120
23:20:09.319127 IP 192.168.43.124.8880 > 192.168.43.147.7772: UDP, length 120
23:20:09.369089 IP 192.168.43.124.8880 > 192.168.43.147.7772: UDP, length 120
23:20:09.419126 IP 192.168.43.124.8880 > 192.168.43.147.7772: UDP, length 120
23:20:09.469126 IP 192.168.43.124.8880 > 192.168.43.147.7772: UDP, length 120
23:20:09.519128 IP 192.168.43.124.8880 > 192.168.43.147.7772: UDP, length 120
23:20:09.569053 IP 192.168.43.124.8880 > 192.168.43.147.7772: UDP, length 120
23:20:09.619023 IP 192.168.43.124.8880 > 192.168.43.147.7772: UDP, length 120
23:20:09.669076 IP 192.168.43.124.8880 > 192.168.43.147.7772: UDP, length 120
23:20:09.719077 IP 192.168.43.124.8880 > 192.168.43.147.7772: UDP, length 120
23:20:09.769076 IP 192.168.43.124.8880 > 192.168.43.147.7772: UDP, length 120
23:20:09.819123 IP 192.168.43.124.8880 > 192.168.43.147.7772: UDP, length 120
23:20:09.869073 IP 192.168.43.124.8880 > 192.168.43.147.7772: UDP, length 120
23:20:09.919129 IP 192.168.43.124.8880 > 192.168.43.147.7772: UDP, length 120
23:20:09.968997 IP 192.168.43.124.8880 > 192.168.43.147.7772: UDP, length 120
23:20:10.019009 IP 192.168.43.124.8880 > 192.168.43.147.7772: UDP, length 120
23:20:10.069074 IP 192.168.43.124.8880 > 192.168.43.147.7772: UDP, length 120
23:20:10.119076 IP 192.168.43.124.8880 > 192.168.43.147.7772: UDP, length 120
23:20:10.169076 IP 192.168.43.124.8880 > 192.168.43.147.7772: UDP, length 120
23:20:10.219022 IP 192.168.43.124.8880 > 192.168.43.147.7772: UDP, length 120
23:20:10.269076 IP 192.168.43.124.8880 > 192.168.43.147.7772: UDP, length 120
23:20:10.319078 IP 192.168.43.124.8880 > 192.168.43.147.7772: UDP, length 120
23:20:10.369013 IP 192.168.43.124.8880 > 192.168.43.147.7772: UDP, length 120
23:20:10.419076 IP 192.168.43.124.8880 > 192.168.43.147.7772: UDP, length 120
23:20:10.469077 IP 192.168.43.124.8880 > 192.168.43.147.7772: UDP, length 120
23:20:10.519076 IP 192.168.43.124.8880 > 192.168.43.147.7772: UDP, length 120
23:20:10.569077 IP 192.168.43.124.8880 > 192.168.43.147.7772: UDP, length 120
23:20:10.619078 IP 192.168.43.124.8880 > 192.168.43.147.7772: UDP, length 120
23:20:10.669076 IP 192.168.43.124.8880 > 192.168.43.147.7772: UDP, length 120
23:20:10.719076 IP 192.168.43.124.8880 > 192.168.43.147.7772: UDP, length 120
23:20:10.769076 IP 192.168.43.124.8880 > 192.168.43.147.7772: UDP, length 120
23:20:10.819112 IP 192.168.43.124.8880 > 192.168.43.147.7772: UDP, length 120
23:20:10.869077 IP 192.168.43.124.8880 > 192.168.43.147.7772: UDP, length 120
23:20:10.919077 IP 192.168.43.124.8880 > 192.168.43.147.7772: UDP, length 120
23:20:10.969116 IP 192.168.43.124.8880 > 192.168.43.147.7772: UDP, length 120
23:20:11.019120 IP 192.168.43.124.8880 > 192.168.43.147.7772: UDP, length 120
23:20:11.069119 IP 192.168.43.124.8880 > 192.168.43.147.7772: UDP, length 120
23:20:11.119117 IP 192.168.43.124.8880 > 192.168.43.147.7772: UDP, length 120
23:20:11.169117 IP 192.168.43.124.8880 > 192.168.43.147.7772: UDP, length 120
23:20:11.219118 IP 192.168.43.124.8880 > 192.168.43.147.7772: UDP, length 120
23:20:11.269119 IP 192.168.43.124.8880 > 192.168.43.147.7772: UDP, length 120
23:20:11.319118 IP 192.168.43.124.8880 > 192.168.43.147.7772: UDP, length 120
23:20:11.369053 IP 192.168.43.124.8880 > 192.168.43.147.7772: UDP, length 120
23:20:11.419099 IP 192.168.43.124.8880 > 192.168.43.147.7772: UDP, length 120
23:20:11.469127 IP 192.168.43.124.8880 > 192.168.43.147.7772: UDP, length 120
23:20:11.519126 IP 192.168.43.124.8880 > 192.168.43.147.7772: UDP, length 120
23:20:11.569127 IP 192.168.43.124.8880 > 192.168.43.147.7772: UDP, length 120
23:20:11.619076 IP 192.168.43.124.8880 > 192.168.43.147.7772: UDP, length 120
23:20:11.669075 IP 192.168.43.124.8880 > 192.168.43.147.7772: UDP, length 120
23:20:11.719127 IP 192.168.43.124.8880 > 192.168.43.147.7772: UDP, length 120
23:20:11.769127 IP 192.168.43.124.8880 > 192.168.43.147.7772: UDP, length 120
23:20:11.819078 IP 192.168.43.124.8880 > 192.168.43.147.7772: UDP, length 120
23:20:11.869079 IP 192.168.43.124.8880 > 192.168.43.147.7772: UDP, length 120
23:20:11.919077 IP 192.168.43.124.8880 > 192.168.43.147.7772: UDP, length 120
23:20:11.969128 IP 192.168.43.124.8880 > 192.168.43.147.7772: UDP, length 120
23:20:12.019041 IP 192.168.43.124.8880 > 192.168.43.147.7772: UDP, length 120
23:20:12.069078 IP 192.168.43.124.8880 > 192.168.43.147.7772: UDP, length 120
23:20:12.119080 IP 192.168.43.124.8880 > 192.168.43.147.7772: UDP, length 120
23:20:12.169124 IP 192.168.43.124.8880 > 192.168.43.147.7772: UDP, length 120
23:20:12.219126 IP 192.168.43.124.8880 > 192.168.43.147.7772: UDP, length 120
23:20:12.269126 IP 192.168.43.124.8880 > 192.168.43.147.7772: UDP, length 120
23:20:12.319127 IP 192.168.43.124.8880 > 192.168.43.147.7772: UDP, length 120
23:20:12.369078 IP 192.168.43.124.8880 > 192.168.43.147.7772: UDP, length 120
23:20:12.419079 IP 192.168.43.124.8880 > 192.168.43.147.7772: UDP, length 120
23:20:12.469076 IP 192.168.43.124.8880 > 192.168.43.147.7772: UDP, length 120
23:20:12.519076 IP 192.168.43.124.8880 > 192.168.43.147.7772: UDP, length 120
23:20:12.569080 IP 192.168.43.124.8880 > 192.168.43.147.7772: UDP, length 120
23:20:12.619022 IP 192.168.43.124.8880 > 192.168.43.147.7772: UDP, length 120
23:20:12.669043 IP 192.168.43.124.8880 > 192.168.43.147.7772: UDP, length 120
23:20:12.719025 IP 192.168.43.124.8880 > 192.168.43.147.7772: UDP, length 120
23:20:12.769075 IP 192.168.43.124.8880 > 192.168.43.147.7772: UDP, length 120
23:20:12.819076 IP 192.168.43.124.8880 > 192.168.43.147.7772: UDP, length 120
23:20:12.869077 IP 192.168.43.124.8880 > 192.168.43.147.7772: UDP, length 120
23:20:12.919083 IP 192.168.43.124.8880 > 192.168.43.147.7772: UDP, length 120
23:20:12.969078 IP 192.168.43.124.8880 > 192.168.43.147.7772: UDP, length 120
23:20:13.019099 IP 192.168.43.124.8880 > 192.168.43.147.7772: UDP, length 120
23:20:13.069101 IP 192.168.43.124.8880 > 192.168.43.147.7772: UDP, length 120
23:20:13.119099 IP 192.168.43.124.8880 > 192.168.43.147.7772: UDP, length 120
23:20:13.169077 IP 192.168.43.124.8880 > 192.168.43.147.7772: UDP, length 120
23:20:13.219076 IP 192.168.43.124.8880 > 192.168.43.147.7772: UDP, length 120
23:20:13.269080 IP 192.168.43.124.8880 > 192.168.43.147.7772: UDP, length 120
23:20:13.319080 IP 192.168.43.124.8880 > 192.168.43.147.7772: UDP, length 120
23:20:13.369076 IP 192.168.43.124.8880 > 192.168.43.147.7772: UDP, length 120
23:20:13.419074 IP 192.168.43.124.8880 > 192.168.43.147.7772: UDP, length 120
23:20:13.469081 IP 192.168.43.124.8880 > 192.168.43.147.7772: UDP, length 120
23:20:13.519126 IP 192.168.43.124.8880 > 192.168.43.147.7772: UDP, length 120
23:20:13.569127 IP 192.168.43.124.8880 > 192.168.43.147.7772: UDP, length 120
23:20:13.619025 IP 192.168.43.124.8880 > 192.168.43.147.7772: UDP, length 120
23:20:13.669077 IP 192.168.43.124.8880 > 192.168.43.147.7772: UDP, length 120
23:20:13.719074 IP 192.168.43.124.8880 > 192.168.43.147.7772: UDP, length 120
23:20:13.769079 IP 192.168.43.124.8880 > 192.168.43.147.7772: UDP, length 120
23:20:13.819076 IP 192.168.43.124.8880 > 192.168.43.147.7772: UDP, length 120
23:20:13.869077 IP 192.168.43.124.8880 > 192.168.43.147.7772: UDP, length 120
23:20:13.919076 IP 192.168.43.124.8880 > 192.168.43.147.7772: UDP, length 120
23:20:13.969078 IP 192.168.43.124.8880 > 192.168.43.147.7772: UDP, length 120
23:20:14.019126 IP 192.168.43.124.8880 > 192.168.43.147.7772: UDP, length 120
23:20:14.069075 IP 192.168.43.124.8880 > 192.168.43.147.7772: UDP, length 120
23:20:14.119127 IP 192.168.43.124.8880 > 192.168.43.147.7772: UDP, length 120
23:20:14.169082 IP 192.168.43.124.8880 > 192.168.43.147.7772: UDP, length 120
23:20:14.219081 IP 192.168.43.124.8880 > 192.168.43.147.7772: UDP, length 120
23:20:14.269127 IP 192.168.43.124.8880 > 192.168.43.147.7772: UDP, length 120
23:20:14.319126 IP 192.168.43.124.8880 > 192.168.43.147.7772: UDP, length 120
23:20:14.369055 IP 192.168.43.124.8880 > 192.168.43.147.7772: UDP, length 120
23:20:14.419128 IP 192.168.43.124.8880 > 192.168.43.147.7772: UDP, length 120
23:20:14.469127 IP 192.168.43.124.8880 > 192.168.43.147.7772: UDP, length 120
23:20:14.519124 IP 192.168.43.124.8880 > 192.168.43.147.7772: UDP, length 120
23:20:14.569126 IP 192.168.43.124.8880 > 192.168.43.147.7772: UDP, length 120
23:20:14.619080 IP 192.168.43.124.8880 > 192.168.43.147.7772: UDP, length 120
23:20:14.669081 IP 192.168.43.124.8880 > 192.168.43.147.7772: UDP, length 120
23:20:14.719079 IP 192.168.43.124.8880 > 192.168.43.147.7772: UDP, length 120
23:20:14.769079 IP 192.168.43.124.8880 > 192.168.43.147.7772: UDP, length 120
23:20:14.819076 IP 192.168.43.124.8880 > 192.168.43.147.7772: UDP, length 120
23:20:14.869077 IP 192.168.43.124.8880 > 192.168.43.147.7772: UDP, length 120
23:20:14.919075 IP 192.168.43.124.8880 > 192.168.43.147.7772: UDP, length 120
23:20:14.969126 IP 192.168.43.124.8880 > 192.168.43.147.7772: UDP, length 120
23:20:15.019127 IP 192.168.43.124.8880 > 192.168.43.147.7772: UDP, length 120
23:20:15.069006 IP 192.168.43.124.8880 > 192.168.43.147.7772: UDP, length 120
23:20:15.119004 IP 192.168.43.124.8880 > 192.168.43.147.7772: UDP, length 120
23:20:15.169073 IP 192.168.43.124.8880 > 192.168.43.147.7772: UDP, length 120
23:20:15.219074 IP 192.168.43.124.8880 > 192.168.43.147.7772: UDP, length 120
23:20:15.269075 IP 192.168.43.124.8880 > 192.168.43.147.7772: UDP, length 120
23:20:15.319076 IP 192.168.43.124.8880 > 192.168.43.147.7772: UDP, length 120
23:20:15.369075 IP 192.168.43.124.8880 > 192.168.43.147.7772: UDP, length 120
23:20:15.419075 IP 192.168.43.124.8880 > 192.168.43.147.7772: UDP, length 120
23:20:15.469075 IP 192.168.43.124.8880 > 192.168.43.147.7772: UDP, length 120
23:20:15.519076 IP 192.168.43.124.8880 > 192.168.43.147.7772: UDP, length 120
23:20:15.569077 IP 192.168.43.124.8880 > 192.168.43.147.7772: UDP, length 120
23:20:15.619078 IP 192.168.43.124.8880 > 192.168.43.147.7772: UDP, length 120
23:20:15.669125 IP 192.168.43.124.8880 > 192.168.43.147.7772: UDP, length 120
23:20:15.719095 IP 192.168.43.124.8880 > 192.168.43.147.7772: UDP, length 120
23:20:15.769095 IP 192.168.43.124.8880 > 192.168.43.147.7772: UDP, length 120
23:20:15.819124 IP 192.168.43.124.8880 > 192.168.43.147.7772: UDP, length 120
23:20:15.869078 IP 192.168.43.124.8880 > 192.168.43.147.7772: UDP, length 120
23:20:15.919076 IP 192.168.43.124.8880 > 192.168.43.147.7772: UDP, length 120
23:20:15.969127 IP 192.168.43.124.8880 > 192.168.43.147.7772: UDP, length 120
23:20:16.019127 IP 192.168.43.124.8880 > 192.168.43.147.7772: UDP, length 120
23:20:16.069127 IP 192.168.43.124.8880 > 192.168.43.147.7772: UDP, length 120
23:20:16.119124 IP 192.168.43.124.8880 > 192.168.43.147.7772: UDP, length 120
23:20:16.169082 IP 192.168.43.124.8880 > 192.168.43.147.7772: UDP, length 120
23:20:16.219025 IP 192.168.43.124.8880 > 192.168.43.147.7772: UDP, length 120
23:20:16.269127 IP 192.168.43.124.8880 > 192.168.43.147.7772: UDP, length 120
23:20:16.319071 IP 192.168.43.124.8880 > 192.168.43.147.7772: UDP, length 120
23:20:16.369127 IP 192.168.43.124.8880 > 192.168.43.147.7772: UDP, length 120
23:20:16.419128 IP 192.168.43.124.8880 > 192.168.43.147.7772: UDP, length 120
23:20:16.469128 IP 192.168.43.124.8880 > 192.168.43.147.7772: UDP, length 120
23:20:16.519129 IP 192.168.43.124.8880 > 192.168.43.147.7772: UDP, length 120
23:20:16.569128 IP 192.168.43.124.8880 > 192.168.43.147.7772: UDP, length 120
23:20:16.619077 IP 192.168.43.124.8880 > 192.168.43.147.7772: UDP, length 120
23:20:16.669077 IP 192.168.43.124.8880 > 192.168.43.147.7772: UDP, length 120
23:20:16.719076 IP 192.168.43.124.8880 > 192.168.43.147.7772: UDP, length 120
23:20:16.769076 IP 192.168.43.124.8880 > 192.168.43.147.7772: UDP, length 120
23:20:16.819125 IP 192.168.43.124.8880 > 192.168.43.147.7772: UDP, length 120
23:20:16.869079 IP 192.168.43.124.8880 > 192.168.43.147.7772: UDP, length 120
23:20:16.919077 IP 192.168.43.124.8880 > 192.168.43.147.7772: UDP, length 120
23:20:16.969126 IP 192.168.43.124.8880 > 192.168.43.147.7772: UDP, length 120
23:20:17.019080 IP 192.168.43.124.8880 > 192.168.43.147.7772: UDP, length 120
23:20:17.069080 IP 192.168.43.124.8880 > 192.168.43.147.7772: UDP, length 120
23:20:17.119080 IP 192.168.43.124.8880 > 192.168.43.147.7772: UDP, length 120
23:20:17.169083 IP 192.168.43.124.8880 > 192.168.43.147.7772: UDP, length 120
23:20:17.219079 IP 192.168.43.124.8880 > 192.168.43.147.7772: UDP, length 120
23:20:17.269126 IP 192.168.43.124.8880 > 192.168.43.147.7772: UDP, length 120
23:20:17.319127 IP 192.168.43.124.8880 > 192.168.43.147.7772: UDP, length 120
23:20:17.369125 IP 192.168.43.124.8880 > 192.168.43.147.7772: UDP, length 120
23:20:17.419127 IP 192.168.43.124.8880 > 192.168.43.147.7772: UDP, length 120
23:20:17.469128 IP 192.168.43.124.8880 > 192.168.43.147.7772: UDP, length 120
23:20:17.519127 IP 192.168.43.124.8880 > 192.168.43.147.7772: UDP, length 120
23:20:17.569128 IP 192.168.43.124.8880 > 192.168.43.147.7772: UDP, length 120
23:20:17.619078 IP 192.168.43.124.8880 > 192.168.43.147.7772: UDP, length 120
23:20:17.669078 IP 192.168.43.124.8880 > 192.168.43.147.7772: UDP, length 120
23:20:17.719075 IP 192.168.43.124.8880 > 192.168.43.147.7772: UDP, length 120
23:20:17.769076 IP 192.168.43.124.8880 > 192.168.43.147.7772: UDP, length 120
23:20:17.819115 IP 192.168.43.124.8880 > 192.168.43.147.7772: UDP, length 120
23:20:17.869076 IP 192.168.43.124.8880 > 192.168.43.147.7772: UDP, length 120
23:20:17.919074 IP 192.168.43.124.8880 > 192.168.43.147.7772: UDP, length 120
23:20:17.969076 IP 192.168.43.124.8880 > 192.168.43.147.7772: UDP, length 120
23:20:18.019077 IP 192.168.43.124.8880 > 192.168.43.147.7772: UDP, length 120
23:20:18.069078 IP 192.168.43.124.8880 > 192.168.43.147.7772: UDP, length 120
23:20:18.119122 IP 192.168.43.124.8880 > 192.168.43.147.7772: UDP, length 120
23:20:18.169083 IP 192.168.43.124.8880 > 192.168.43.147.7772: UDP, length 120
23:20:18.219124 IP 192.168.43.124.8880 > 192.168.43.147.7772: UDP, length 120
23:20:18.269128 IP 192.168.43.124.8880 > 192.168.43.147.7772: UDP, length 120
23:20:18.319126 IP 192.168.43.124.8880 > 192.168.43.147.7772: UDP, length 120
23:20:18.369044 IP 192.168.43.124.8880 > 192.168.43.147.7772: UDP, length 120
23:20:18.419080 IP 192.168.43.124.8880 > 192.168.43.147.7772: UDP, length 120
23:20:18.469127 IP 192.168.43.124.8880 > 192.168.43.147.7772: UDP, length 120
23:20:18.519127 IP 192.168.43.124.8880 > 192.168.43.147.7772: UDP, length 120
23:20:18.569125 IP 192.168.43.124.8880 > 192.168.43.147.7772: UDP, length 120
23:20:18.619026 IP 192.168.43.124.8880 > 192.168.43.147.7772: UDP, length 120
23:20:18.669075 IP 192.168.43.124.8880 > 192.168.43.147.7772: UDP, length 120
23:20:18.719076 IP 192.168.43.124.8880 > 192.168.43.147.7772: UDP, length 120
23:20:18.769077 IP 192.168.43.124.8880 > 192.168.43.147.7772: UDP, length 120
23:20:18.819124 IP 192.168.43.124.8880 > 192.168.43.147.7772: UDP, length 120
23:20:18.869079 IP 192.168.43.124.8880 > 192.168.43.147.7772: UDP, length 120
23:20:18.919079 IP 192.168.43.124.8880 > 192.168.43.147.7772: UDP, length 120
23:20:18.969124 IP 192.168.43.124.8880 > 192.168.43.147.7772: UDP, length 120
23:20:19.019125 IP 192.168.43.124.8880 > 192.168.43.147.7772: UDP, length 120
23:20:19.069126 IP 192.168.43.124.8880 > 192.168.43.147.7772: UDP, length 120
23:20:19.119082 IP 192.168.43.124.8880 > 192.168.43.147.7772: UDP, length 120
23:20:19.169080 IP 192.168.43.124.8880 > 192.168.43.147.7772: UDP, length 120
23:20:19.219081 IP 192.168.43.124.8880 > 192.168.43.147.7772: UDP, length 120
23:20:19.269080 IP 192.168.43.124.8880 > 192.168.43.147.7772: UDP, length 120
23:20:19.319079 IP 192.168.43.124.8880 > 192.168.43.147.7772: UDP, length 120
23:20:19.369079 IP 192.168.43.124.8880 > 192.168.43.147.7772: UDP, length 120
23:20:19.419079 IP 192.168.43.124.8880 > 192.168.43.147.7772: UDP, length 120
23:20:19.469033 IP 192.168.43.124.8880 > 192.168.43.147.7772: UDP, length 120
23:20:19.519079 IP 192.168.43.124.8880 > 192.168.43.147.7772: UDP, length 120
23:20:19.569081 IP 192.168.43.124.8880 > 192.168.43.147.7772: UDP, length 120
23:20:19.619077 IP 192.168.43.124.8880 > 192.168.43.147.7772: UDP, length 120
23:20:19.669078 IP 192.168.43.124.8880 > 192.168.43.147.7772: UDP, length 120
23:20:19.719077 IP 192.168.43.124.8880 > 192.168.43.147.7772: UDP, length 120
23:20:19.769080 IP 192.168.43.124.8880 > 192.168.43.147.7772: UDP, length 120
23:20:19.819125 IP 192.168.43.124.8880 > 192.168.43.147.7772: UDP, length 120
23:20:19.868998 IP 192.168.43.124.8880 > 192.168.43.147.7772: UDP, length 120
23:20:19.919081 IP 192.168.43.124.8880 > 192.168.43.147.7772: UDP, length 120
23:20:19.969081 IP 192.168.43.124.8880 > 192.168.43.147.7772: UDP, length 120
23:20:20.019082 IP 192.168.43.124.8880 > 192.168.43.147.7772: UDP, length 120
23:20:20.069126 IP 192.168.43.124.8880 > 192.168.43.147.7772: UDP, length 120
23:20:20.119127 IP 192.168.43.124.8880 > 192.168.43.147.7772: UDP, length 120
23:20:20.169006 IP 192.168.43.124.8880 > 192.168.43.147.7772: UDP, length 120
23:20:20.219009 IP 192.168.43.124.8880 > 192.168.43.147.7772: UDP, length 120
23:20:20.269082 IP 192.168.43.124.8880 > 192.168.43.147.7772: UDP, length 120
23:20:20.319078 IP 192.168.43.124.8880 > 192.168.43.147.7772: UDP, length 120
23:20:20.369076 IP 192.168.43.124.8880 > 192.168.43.147.7772: UDP, length 120
23:20:20.419076 IP 192.168.43.124.8880 > 192.168.43.147.7772: UDP, length 120
23:20:20.469077 IP 192.168.43.124.8880 > 192.168.43.147.7772: UDP, length 120
23:20:20.518994 IP 192.168.43.124.8880 > 192.168.43.147.7772: UDP, length 120
23:20:20.569075 IP 192.168.43.124.8880 > 192.168.43.147.7772: UDP, length 120
23:20:20.619074 IP 192.168.43.124.8880 > 192.168.43.147.7772: UDP, length 120
23:20:20.669043 IP 192.168.43.124.8880 > 192.168.43.147.7772: UDP, length 120
23:20:20.719028 IP 192.168.43.124.8880 > 192.168.43.147.7772: UDP, length 120
23:20:20.769080 IP 192.168.43.124.8880 > 192.168.43.147.7772: UDP, length 120
23:20:20.819076 IP 192.168.43.124.8880 > 192.168.43.147.7772: UDP, length 120
23:20:20.869076 IP 192.168.43.124.8880 > 192.168.43.147.7772: UDP, length 120
23:20:20.919075 IP 192.168.43.124.8880 > 192.168.43.147.7772: UDP, length 120
23:20:20.969076 IP 192.168.43.124.8880 > 192.168.43.147.7772: UDP, length 120
23:20:21.019077 IP 192.168.43.124.8880 > 192.168.43.147.7772: UDP, length 120
23:20:21.069078 IP 192.168.43.124.8880 > 192.168.43.147.7772: UDP, length 120
23:20:21.119075 IP 192.168.43.124.8880 > 192.168.43.147.7772: UDP, length 120
23:20:21.169081 IP 192.168.43.124.8880 > 192.168.43.147.7772: UDP, length 120
23:20:21.219081 IP 192.168.43.124.8880 > 192.168.43.147.7772: UDP, length 120
23:20:21.269082 IP 192.168.43.124.8880 > 192.168.43.147.7772: UDP, length 120
23:20:21.319126 IP 192.168.43.124.8880 > 192.168.43.147.7772: UDP, length 120
23:20:21.369125 IP 192.168.43.124.8880 > 192.168.43.147.7772: UDP, length 120
23:20:21.419126 IP 192.168.43.124.8880 > 192.168.43.147.7772: UDP, length 120
23:20:21.469129 IP 192.168.43.124.8880 > 192.168.43.147.7772: UDP, length 120
23:20:21.519127 IP 192.168.43.124.8880 > 192.168.43.147.7772: UDP, length 120
23:20:21.569128 IP 192.168.43.124.8880 > 192.168.43.147.7772: UDP, length 120
23:20:21.619079 IP 192.168.43.124.8880 > 192.168.43.147.7772: UDP, length 120
23:20:21.669081 IP 192.168.43.124.8880 > 192.168.43.147.7772: UDP, length 120
23:20:21.719080 IP 192.168.43.124.8880 > 192.168.43.147.7772: UDP, length 120
23:20:21.769081 IP 192.168.43.124.8880 > 192.168.43.147.7772: UDP, length 120
23:20:21.819125 IP 192.168.43.124.8880 > 192.168.43.147.7772: UDP, length 120
23:20:21.869083 IP 192.168.43.124.8880 > 192.168.43.147.7772: UDP, length 120
23:20:21.919081 IP 192.168.43.124.8880 > 192.168.43.147.7772: UDP, length 120
23:20:21.969129 IP 192.168.43.124.8880 > 192.168.43.147.7772: UDP, length 120
23:20:22.019126 IP 192.168.43.124.8880 > 192.168.43.147.7772: UDP, length 120
23:20:22.069127 IP 192.168.43.124.8880 > 192.168.43.147.7772: UDP, length 120
23:20:22.119125 IP 192.168.43.124.8880 > 192.168.43.147.7772: UDP, length 120
23:20:22.169128 IP 192.168.43.124.8880 > 192.168.43.147.7772: UDP, length 120
23:20:22.219125 IP 192.168.43.124.8880 > 192.168.43.147.7772: UDP, length 120
23:20:22.269128 IP 192.168.43.124.8880 > 192.168.43.147.7772: UDP, length 120
23:20:22.319126 IP 192.168.43.124.8880 > 192.168.43.147.7772: UDP, length 120
23:20:22.369125 IP 192.168.43.124.8880 > 192.168.43.147.7772: UDP, length 120
23:20:22.419127 IP 192.168.43.124.8880 > 192.168.43.147.7772: UDP, length 120
23:20:22.469126 IP 192.168.43.124.8880 > 192.168.43.147.7772: UDP, length 120
23:20:22.519129 IP 192.168.43.124.8880 > 192.168.43.147.7772: UDP, length 120
23:20:22.569124 IP 192.168.43.124.8880 > 192.168.43.147.7772: UDP, length 120
23:20:22.619082 IP 192.168.43.124.8880 > 192.168.43.147.7772: UDP, length 120
23:20:22.669080 IP 192.168.43.124.8880 > 192.168.43.147.7772: UDP, length 120
23:20:22.719082 IP 192.168.43.124.8880 > 192.168.43.147.7772: UDP, length 120
23:20:22.769081 IP 192.168.43.124.8880 > 192.168.43.147.7772: UDP, length 120
23:20:22.819129 IP 192.168.43.124.8880 > 192.168.43.147.7772: UDP, length 120
23:20:22.869076 IP 192.168.43.124.8880 > 192.168.43.147.7772: UDP, length 120
23:20:22.919128 IP 192.168.43.124.8880 > 192.168.43.147.7772: UDP, length 120
23:20:22.969129 IP 192.168.43.124.8880 > 192.168.43.147.7772: UDP, length 120
23:20:23.019127 IP 192.168.43.124.8880 > 192.168.43.147.7772: UDP, length 120
23:20:23.069128 IP 192.168.43.124.8880 > 192.168.43.147.7772: UDP, length 120
23:20:23.119080 IP 192.168.43.124.8880 > 192.168.43.147.7772: UDP, length 120
23:20:23.169126 IP 192.168.43.124.8880 > 192.168.43.147.7772: UDP, length 120
23:20:23.219162 IP 192.168.43.124.8880 > 192.168.43.147.7772: UDP, length 120
23:20:23.269127 IP 192.168.43.124.8880 > 192.168.43.147.7772: UDP, length 120
23:20:23.319127 IP 192.168.43.124.8880 > 192.168.43.147.7772: UDP, length 120
23:20:23.369245 IP 192.168.43.124.8880 > 192.168.43.147.7772: UDP, length 120
23:20:23.419078 IP 192.168.43.124.8880 > 192.168.43.147.7772: UDP, length 120
23:20:23.469076 IP 192.168.43.124.8880 > 192.168.43.147.7772: UDP, length 120
23:20:23.519077 IP 192.168.43.124.8880 > 192.168.43.147.7772: UDP, length 120
23:20:23.569076 IP 192.168.43.124.8880 > 192.168.43.147.7772: UDP, length 120
23:20:23.619076 IP 192.168.43.124.8880 > 192.168.43.147.7772: UDP, length 120
23:20:23.669057 IP 192.168.43.124.8880 > 192.168.43.147.7772: UDP, length 120
23:20:23.719040 IP 192.168.43.124.8880 > 192.168.43.147.7772: UDP, length 120
23:20:23.769078 IP 192.168.43.124.8880 > 192.168.43.147.7772: UDP, length 120
23:20:23.819125 IP 192.168.43.124.8880 > 192.168.43.147.7772: UDP, length 120
23:20:23.869079 IP 192.168.43.124.8880 > 192.168.43.147.7772: UDP, length 120
23:20:23.919078 IP 192.168.43.124.8880 > 192.168.43.147.7772: UDP, length 120
23:20:23.969082 IP 192.168.43.124.8880 > 192.168.43.147.7772: UDP, length 120
23:20:24.019080 IP 192.168.43.124.8880 > 192.168.43.147.7772: UDP, length 120
23:20:24.069079 IP 192.168.43.124.8880 > 192.168.43.147.7772: UDP, length 120
23:20:24.118995 IP 192.168.43.124.8880 > 192.168.43.147.7772: UDP, length 120
23:20:24.169076 IP 192.168.43.124.8880 > 192.168.43.147.7772: UDP, length 120
23:20:24.219076 IP 192.168.43.124.8880 > 192.168.43.147.7772: UDP, length 120
23:20:24.269078 IP 192.168.43.124.8880 > 192.168.43.147.7772: UDP, length 120
23:20:24.319081 IP 192.168.43.124.8880 > 192.168.43.147.7772: UDP, length 120
23:20:24.369124 IP 192.168.43.124.8880 > 192.168.43.147.7772: UDP, length 120
23:20:24.419125 IP 192.168.43.124.8880 > 192.168.43.147.7772: UDP, length 120
23:20:24.469128 IP 192.168.43.124.8880 > 192.168.43.147.7772: UDP, length 120
23:20:24.519126 IP 192.168.43.124.8880 > 192.168.43.147.7772: UDP, length 120
23:20:24.569125 IP 192.168.43.124.8880 > 192.168.43.147.7772: UDP, length 120
23:20:24.619078 IP 192.168.43.124.8880 > 192.168.43.147.7772: UDP, length 120
23:20:24.669076 IP 192.168.43.124.8880 > 192.168.43.147.7772: UDP, length 120
23:20:24.719074 IP 192.168.43.124.8880 > 192.168.43.147.7772: UDP, length 120
23:20:24.769077 IP 192.168.43.124.8880 > 192.168.43.147.7772: UDP, length 120
23:20:24.819124 IP 192.168.43.124.8880 > 192.168.43.147.7772: UDP, length 120
23:20:24.869077 IP 192.168.43.124.8880 > 192.168.43.147.7772: UDP, length 120
23:20:24.919080 IP 192.168.43.124.8880 > 192.168.43.147.7772: UDP, length 120
23:20:24.969082 IP 192.168.43.124.8880 > 192.168.43.147.7772: UDP, length 120
23:20:25.019078 IP 192.168.43.124.8880 > 192.168.43.147.7772: UDP, length 120
23:20:25.069079 IP 192.168.43.124.8880 > 192.168.43.147.7772: UDP, length 120
23:20:25.119076 IP 192.168.43.124.8880 > 192.168.43.147.7772: UDP, length 120
23:20:25.169126 IP 192.168.43.124.8880 > 192.168.43.147.7772: UDP, length 120
23:20:25.219125 IP 192.168.43.124.8880 > 192.168.43.147.7772: UDP, length 120
23:20:25.269012 IP 192.168.43.124.8880 > 192.168.43.147.7772: UDP, length 120
23:20:25.319011 IP 192.168.43.124.8880 > 192.168.43.147.7772: UDP, length 120
23:20:25.369073 IP 192.168.43.124.8880 > 192.168.43.147.7772: UDP, length 120
23:20:25.419075 IP 192.168.43.124.8880 > 192.168.43.147.7772: UDP, length 120
23:20:25.469078 IP 192.168.43.124.8880 > 192.168.43.147.7772: UDP, length 120
23:20:25.519077 IP 192.168.43.124.8880 > 192.168.43.147.7772: UDP, length 120
23:20:25.569077 IP 192.168.43.124.8880 > 192.168.43.147.7772: UDP, length 120
23:20:25.619075 IP 192.168.43.124.8880 > 192.168.43.147.7772: UDP, length 120
23:20:25.669078 IP 192.168.43.124.8880 > 192.168.43.147.7772: UDP, length 120
23:20:25.719075 IP 192.168.43.124.8880 > 192.168.43.147.7772: UDP, length 120
23:20:25.769076 IP 192.168.43.124.8880 > 192.168.43.147.7772: UDP, length 120
23:20:25.819119 IP 192.168.43.124.8880 > 192.168.43.147.7772: UDP, length 120
23:20:25.869080 IP 192.168.43.124.8880 > 192.168.43.147.7772: UDP, length 120
23:20:25.919126 IP 192.168.43.124.8880 > 192.168.43.147.7772: UDP, length 120
23:20:25.969081 IP 192.168.43.124.8880 > 192.168.43.147.7772: UDP, length 120
23:20:26.019080 IP 192.168.43.124.8880 > 192.168.43.147.7772: UDP, length 120
23:20:26.069127 IP 192.168.43.124.8880 > 192.168.43.147.7772: UDP, length 120
23:20:26.119127 IP 192.168.43.124.8880 > 192.168.43.147.7772: UDP, length 120
23:20:26.169127 IP 192.168.43.124.8880 > 192.168.43.147.7772: UDP, length 120
23:20:26.219126 IP 192.168.43.124.8880 > 192.168.43.147.7772: UDP, length 120
23:20:26.269127 IP 192.168.43.124.8880 > 192.168.43.147.7772: UDP, length 120
23:20:26.319128 IP 192.168.43.124.8880 > 192.168.43.147.7772: UDP, length 120
23:20:26.369079 IP 192.168.43.124.8880 > 192.168.43.147.7772: UDP, length 120
23:20:26.419080 IP 192.168.43.124.8880 > 192.168.43.147.7772: UDP, length 120
23:20:26.469128 IP 192.168.43.124.8880 > 192.168.43.147.7772: UDP, length 120
23:20:26.519127 IP 192.168.43.124.8880 > 192.168.43.147.7772: UDP, length 120
23:20:26.569082 IP 192.168.43.124.8880 > 192.168.43.147.7772: UDP, length 120
23:20:26.619079 IP 192.168.43.124.8880 > 192.168.43.147.7772: UDP, length 120
23:20:26.669079 IP 192.168.43.124.8880 > 192.168.43.147.7772: UDP, length 120
23:20:26.719076 IP 192.168.43.124.8880 > 192.168.43.147.7772: UDP, length 120
23:20:26.769126 IP 192.168.43.124.8880 > 192.168.43.147.7772: UDP, length 120
23:20:26.819121 IP 192.168.43.124.8880 > 192.168.43.147.7772: UDP, length 120
23:20:26.869080 IP 192.168.43.124.8880 > 192.168.43.147.7772: UDP, length 120
23:20:26.919126 IP 192.168.43.124.8880 > 192.168.43.147.7772: UDP, length 120
23:20:26.969042 IP 192.168.43.124.8880 > 192.168.43.147.7772: UDP, length 120
23:20:27.019078 IP 192.168.43.124.8880 > 192.168.43.147.7772: UDP, length 120
23:20:27.069040 IP 192.168.43.124.8880 > 192.168.43.147.7772: UDP, length 120
23:20:27.119075 IP 192.168.43.124.8880 > 192.168.43.147.7772: UDP, length 120
23:20:27.169029 IP 192.168.43.124.8880 > 192.168.43.147.7772: UDP, length 120
23:20:27.219075 IP 192.168.43.124.8880 > 192.168.43.147.7772: UDP, length 120
23:20:27.269023 IP 192.168.43.124.8880 > 192.168.43.147.7772: UDP, length 120
23:20:27.319076 IP 192.168.43.124.8880 > 192.168.43.147.7772: UDP, length 120
23:20:27.369021 IP 192.168.43.124.8880 > 192.168.43.147.7772: UDP, length 120
23:20:27.419074 IP 192.168.43.124.8880 > 192.168.43.147.7772: UDP, length 120
23:20:27.469022 IP 192.168.43.124.8880 > 192.168.43.147.7772: UDP, length 120
23:20:27.519075 IP 192.168.43.124.8880 > 192.168.43.147.7772: UDP, length 120
23:20:27.569010 IP 192.168.43.124.8880 > 192.168.43.147.7772: UDP, length 120
23:20:27.619120 IP 192.168.43.124.8880 > 192.168.43.147.7772: UDP, length 120
23:20:27.669076 IP 192.168.43.124.8880 > 192.168.43.147.7772: UDP, length 120
23:20:27.719075 IP 192.168.43.124.8880 > 192.168.43.147.7772: UDP, length 120
23:20:27.769076 IP 192.168.43.124.8880 > 192.168.43.147.7772: UDP, length 120
23:20:27.819125 IP 192.168.43.124.8880 > 192.168.43.147.7772: UDP, length 120
23:20:27.869077 IP 192.168.43.124.8880 > 192.168.43.147.7772: UDP, length 120
23:20:27.919075 IP 192.168.43.124.8880 > 192.168.43.147.7772: UDP, length 120
23:20:27.969126 IP 192.168.43.124.8880 > 192.168.43.147.7772: UDP, length 120
23:20:28.019128 IP 192.168.43.124.8880 > 192.168.43.147.7772: UDP, length 120
23:20:28.069127 IP 192.168.43.124.8880 > 192.168.43.147.7772: UDP, length 120
23:20:28.119129 IP 192.168.43.124.8880 > 192.168.43.147.7772: UDP, length 120
23:20:28.169124 IP 192.168.43.124.8880 > 192.168.43.147.7772: UDP, length 120
23:20:28.219126 IP 192.168.43.124.8880 > 192.168.43.147.7772: UDP, length 120
23:20:28.269081 IP 192.168.43.124.8880 > 192.168.43.147.7772: UDP, length 120
23:20:28.319080 IP 192.168.43.124.8880 > 192.168.43.147.7772: UDP, length 120
23:20:28.369040 IP 192.168.43.124.8880 > 192.168.43.147.7772: UDP, length 120
23:20:28.419077 IP 192.168.43.124.8880 > 192.168.43.147.7772: UDP, length 120
23:20:28.469077 IP 192.168.43.124.8880 > 192.168.43.147.7772: UDP, length 120
23:20:28.519078 IP 192.168.43.124.8880 > 192.168.43.147.7772: UDP, length 120
23:20:28.569079 IP 192.168.43.124.8880 > 192.168.43.147.7772: UDP, length 120
23:20:28.619020 IP 192.168.43.124.8880 > 192.168.43.147.7772: UDP, length 120
23:20:28.669075 IP 192.168.43.124.8880 > 192.168.43.147.7772: UDP, length 120
23:20:28.719076 IP 192.168.43.124.8880 > 192.168.43.147.7772: UDP, length 120
23:20:28.769076 IP 192.168.43.124.8880 > 192.168.43.147.7772: UDP, length 120
23:20:28.819123 IP 192.168.43.124.8880 > 192.168.43.147.7772: UDP, length 120
23:20:28.869004 IP 192.168.43.124.8880 > 192.168.43.147.7772: UDP, length 120
23:20:28.919075 IP 192.168.43.124.8880 > 192.168.43.147.7772: UDP, length 120
23:20:28.969079 IP 192.168.43.124.8880 > 192.168.43.147.7772: UDP, length 120
