22:38:55.683284 IP 192.168.43.124.8880 > 192.168.43.195.7771: UDP, length 120
22:38:55.733430 IP 192.168.43.124.8880 > 192.168.43.195.7771: UDP, length 120
22:38:55.783432 IP 192.168.43.124.8880 > 192.168.43.195.7771: UDP, length 120
22:38:55.833432 IP 192.168.43.124.8880 > 192.168.43.195.7771: UDP, length 120
22:38:55.883434 IP 192.168.43.124.8880 > 192.168.43.195.7771: UDP, length 120
22:38:55.933433 IP 192.168.43.124.8880 > 192.168.43.195.7771: UDP, length 120
22:38:55.983432 IP 192.168.43.124.8880 > 192.168.43.195.7771: UDP, length 120
22:38:56.033433 IP 192.168.43.124.8880 > 192.168.43.195.7771: UDP, length 120
22:38:56.083483 IP 192.168.43.124.8880 > 192.168.43.195.7771: UDP, length 120
22:38:56.133484 IP 192.168.43.124.8880 > 192.168.43.195.7771: UDP, length 120
22:38:56.183484 IP 192.168.43.124.8880 > 192.168.43.195.7771: UDP, length 120
22:38:56.233411 IP 192.168.43.124.8880 > 192.168.43.195.7771: UDP, length 120
22:38:56.283471 IP 192.168.43.124.8880 > 192.168.43.195.7771: UDP, length 120
22:38:56.333431 IP 192.168.43.124.8880 > 192.168.43.195.7771: UDP, length 120
22:38:56.383433 IP 192.168.43.124.8880 > 192.168.43.195.7771: UDP, length 120
22:38:56.433433 IP 192.168.43.124.8880 > 192.168.43.195.7771: UDP, length 120
22:38:56.483431 IP 192.168.43.124.8880 > 192.168.43.195.7771: UDP, length 120
22:38:56.533433 IP 192.168.43.124.8880 > 192.168.43.195.7771: UDP, length 120
22:38:56.583431 IP 192.168.43.124.8880 > 192.168.43.195.7771: UDP, length 120
22:38:56.633432 IP 192.168.43.124.8880 > 192.168.43.195.7771: UDP, length 120
22:38:56.683432 IP 192.168.43.124.8880 > 192.168.43.195.7771: UDP, length 120
22:38:56.733432 IP 192.168.43.124.8880 > 192.168.43.195.7771: UDP, length 120
22:38:56.783432 IP 192.168.43.124.8880 > 192.168.43.195.7771: UDP, length 120
22:38:56.833433 IP 192.168.43.124.8880 > 192.168.43.195.7771: UDP, length 120
22:38:56.883432 IP 192.168.43.124.8880 > 192.168.43.195.7771: UDP, length 120
22:38:56.933433 IP 192.168.43.124.8880 > 192.168.43.195.7771: UDP, length 120
22:38:56.983432 IP 192.168.43.124.8880 > 192.168.43.195.7771: UDP, length 120
22:38:57.033432 IP 192.168.43.124.8880 > 192.168.43.195.7771: UDP, length 120
22:38:57.083433 IP 192.168.43.124.8880 > 192.168.43.195.7771: UDP, length 120
22:38:57.133433 IP 192.168.43.124.8880 > 192.168.43.195.7771: UDP, length 120
22:38:57.183431 IP 192.168.43.124.8880 > 192.168.43.195.7771: UDP, length 120
22:38:57.233430 IP 192.168.43.124.8880 > 192.168.43.195.7771: UDP, length 120
22:38:57.283432 IP 192.168.43.124.8880 > 192.168.43.195.7771: UDP, length 120
22:38:57.333432 IP 192.168.43.124.8880 > 192.168.43.195.7771: UDP, length 120
22:38:57.383433 IP 192.168.43.124.8880 > 192.168.43.195.7771: UDP, length 120
22:38:57.433430 IP 192.168.43.124.8880 > 192.168.43.195.7771: UDP, length 120
22:38:57.483432 IP 192.168.43.124.8880 > 192.168.43.195.7771: UDP, length 120
22:38:57.533370 IP 192.168.43.124.8880 > 192.168.43.195.7771: UDP, length 120
22:38:57.583432 IP 192.168.43.124.8880 > 192.168.43.195.7771: UDP, length 120
22:38:57.633433 IP 192.168.43.124.8880 > 192.168.43.195.7771: UDP, length 120
22:38:57.683431 IP 192.168.43.124.8880 > 192.168.43.195.7771: UDP, length 120
22:38:57.733432 IP 192.168.43.124.8880 > 192.168.43.195.7771: UDP, length 120
22:38:57.783379 IP 192.168.43.124.8880 > 192.168.43.195.7771: UDP, length 120
22:38:57.833432 IP 192.168.43.124.8880 > 192.168.43.195.7771: UDP, length 120
22:38:57.883432 IP 192.168.43.124.8880 > 192.168.43.195.7771: UDP, length 120
22:38:57.933432 IP 192.168.43.124.8880 > 192.168.43.195.7771: UDP, length 120
22:38:57.983432 IP 192.168.43.124.8880 > 192.168.43.195.7771: UDP, length 120
22:38:58.033432 IP 192.168.43.124.8880 > 192.168.43.195.7771: UDP, length 120
22:38:58.083479 IP 192.168.43.124.8880 > 192.168.43.195.7771: UDP, length 120
22:38:58.133522 IP 192.168.43.124.8880 > 192.168.43.195.7771: UDP, length 120
22:38:58.183522 IP 192.168.43.124.8880 > 192.168.43.195.7771: UDP, length 120
22:38:58.233483 IP 192.168.43.124.8880 > 192.168.43.195.7771: UDP, length 120
22:38:58.283433 IP 192.168.43.124.8880 > 192.168.43.195.7771: UDP, length 120
22:38:58.333432 IP 192.168.43.124.8880 > 192.168.43.195.7771: UDP, length 120
22:38:58.383433 IP 192.168.43.124.8880 > 192.168.43.195.7771: UDP, length 120
22:38:58.433432 IP 192.168.43.124.8880 > 192.168.43.195.7771: UDP, length 120
22:38:58.483434 IP 192.168.43.124.8880 > 192.168.43.195.7771: UDP, length 120
22:38:58.533433 IP 192.168.43.124.8880 > 192.168.43.195.7771: UDP, length 120
22:38:58.583434 IP 192.168.43.124.8880 > 192.168.43.195.7771: UDP, length 120
22:38:58.633434 IP 192.168.43.124.8880 > 192.168.43.195.7771: UDP, length 120
22:38:58.683434 IP 192.168.43.124.8880 > 192.168.43.195.7771: UDP, length 120
22:38:58.733435 IP 192.168.43.124.8880 > 192.168.43.195.7771: UDP, length 120
22:38:58.783434 IP 192.168.43.124.8880 > 192.168.43.195.7771: UDP, length 120
22:38:58.833434 IP 192.168.43.124.8880 > 192.168.43.195.7771: UDP, length 120
22:38:58.883434 IP 192.168.43.124.8880 > 192.168.43.195.7771: UDP, length 120
22:38:58.933435 IP 192.168.43.124.8880 > 192.168.43.195.7771: UDP, length 120
22:38:58.983433 IP 192.168.43.124.8880 > 192.168.43.195.7771: UDP, length 120
22:38:59.033433 IP 192.168.43.124.8880 > 192.168.43.195.7771: UDP, length 120
22:38:59.083435 IP 192.168.43.124.8880 > 192.168.43.195.7771: UDP, length 120
22:38:59.133432 IP 192.168.43.124.8880 > 192.168.43.195.7771: UDP, length 120
22:38:59.183432 IP 192.168.43.124.8880 > 192.168.43.195.7771: UDP, length 120
22:38:59.233434 IP 192.168.43.124.8880 > 192.168.43.195.7771: UDP, length 120
22:38:59.283432 IP 192.168.43.124.8880 > 192.168.43.195.7771: UDP, length 120
22:38:59.333430 IP 192.168.43.124.8880 > 192.168.43.195.7771: UDP, length 120
22:38:59.383432 IP 192.168.43.124.8880 > 192.168.43.195.7771: UDP, length 120
22:38:59.433431 IP 192.168.43.124.8880 > 192.168.43.195.7771: UDP, length 120
22:38:59.483431 IP 192.168.43.124.8880 > 192.168.43.195.7771: UDP, length 120
22:38:59.533431 IP 192.168.43.124.8880 > 192.168.43.195.7771: UDP, length 120
22:38:59.583431 IP 192.168.43.124.8880 > 192.168.43.195.7771: UDP, length 120
22:38:59.633431 IP 192.168.43.124.8880 > 192.168.43.195.7771: UDP, length 120
22:38:59.683483 IP 192.168.43.124.8880 > 192.168.43.195.7771: UDP, length 120
22:38:59.733422 IP 192.168.43.124.8880 > 192.168.43.195.7771: UDP, length 120
22:38:59.783358 IP 192.168.43.124.8880 > 192.168.43.195.7771: UDP, length 120
22:38:59.833431 IP 192.168.43.124.8880 > 192.168.43.195.7771: UDP, length 120
22:38:59.883432 IP 192.168.43.124.8880 > 192.168.43.195.7771: UDP, length 120
22:38:59.933659 IP 192.168.43.124.8880 > 192.168.43.195.7771: UDP, length 120
22:38:59.983431 IP 192.168.43.124.8880 > 192.168.43.195.7771: UDP, length 120
22:39:00.033431 IP 192.168.43.124.8880 > 192.168.43.195.7771: UDP, length 120
22:39:00.083394 IP 192.168.43.124.8880 > 192.168.43.195.7771: UDP, length 120
22:39:00.133430 IP 192.168.43.124.8880 > 192.168.43.195.7771: UDP, length 120
22:39:00.183431 IP 192.168.43.124.8880 > 192.168.43.195.7771: UDP, length 120
22:39:00.233430 IP 192.168.43.124.8880 > 192.168.43.195.7771: UDP, length 120
22:39:00.283480 IP 192.168.43.124.8880 > 192.168.43.195.7771: UDP, length 120
22:39:00.333432 IP 192.168.43.124.8880 > 192.168.43.195.7771: UDP, length 120
22:39:00.383430 IP 192.168.43.124.8880 > 192.168.43.195.7771: UDP, length 120
22:39:00.433431 IP 192.168.43.124.8880 > 192.168.43.195.7771: UDP, length 120
22:39:00.483429 IP 192.168.43.124.8880 > 192.168.43.195.7771: UDP, length 120
22:39:00.533430 IP 192.168.43.124.8880 > 192.168.43.195.7771: UDP, length 120
22:39:00.583430 IP 192.168.43.124.8880 > 192.168.43.195.7771: UDP, length 120
22:39:00.633432 IP 192.168.43.124.8880 > 192.168.43.195.7771: UDP, length 120
22:39:00.683430 IP 192.168.43.124.8880 > 192.168.43.195.7771: UDP, length 120
22:39:00.733430 IP 192.168.43.124.8880 > 192.168.43.195.7771: UDP, length 120
22:39:00.783429 IP 192.168.43.124.8880 > 192.168.43.195.7771: UDP, length 120
22:39:00.833431 IP 192.168.43.124.8880 > 192.168.43.195.7771: UDP, length 120
22:39:00.883430 IP 192.168.43.124.8880 > 192.168.43.195.7771: UDP, length 120
22:39:00.933430 IP 192.168.43.124.8880 > 192.168.43.195.7771: UDP, length 120
22:39:00.983431 IP 192.168.43.124.8880 > 192.168.43.195.7771: UDP, length 120
22:39:01.033431 IP 192.168.43.124.8880 > 192.168.43.195.7771: UDP, length 120
22:39:01.083431 IP 192.168.43.124.8880 > 192.168.43.195.7771: UDP, length 120
22:39:01.133430 IP 192.168.43.124.8880 > 192.168.43.195.7771: UDP, length 120
22:39:01.183431 IP 192.168.43.124.8880 > 192.168.43.195.7771: UDP, length 120
22:39:01.233430 IP 192.168.43.124.8880 > 192.168.43.195.7771: UDP, length 120
22:39:01.283430 IP 192.168.43.124.8880 > 192.168.43.195.7771: UDP, length 120
22:39:01.333430 IP 192.168.43.124.8880 > 192.168.43.195.7771: UDP, length 120
22:39:01.383431 IP 192.168.43.124.8880 > 192.168.43.195.7771: UDP, length 120
22:39:01.433432 IP 192.168.43.124.8880 > 192.168.43.195.7771: UDP, length 120
22:39:01.483431 IP 192.168.43.124.8880 > 192.168.43.195.7771: UDP, length 120
22:39:01.533431 IP 192.168.43.124.8880 > 192.168.43.195.7771: UDP, length 120
22:39:01.583431 IP 192.168.43.124.8880 > 192.168.43.195.7771: UDP, length 120
22:39:01.633431 IP 192.168.43.124.8880 > 192.168.43.195.7771: UDP, length 120
22:39:01.683431 IP 192.168.43.124.8880 > 192.168.43.195.7771: UDP, length 120
22:39:01.733430 IP 192.168.43.124.8880 > 192.168.43.195.7771: UDP, length 120
22:39:01.783432 IP 192.168.43.124.8880 > 192.168.43.195.7771: UDP, length 120
22:39:01.833431 IP 192.168.43.124.8880 > 192.168.43.195.7771: UDP, length 120
22:39:01.883430 IP 192.168.43.124.8880 > 192.168.43.195.7771: UDP, length 120
22:39:01.933432 IP 192.168.43.124.8880 > 192.168.43.195.7771: UDP, length 120
22:39:01.983439 IP 192.168.43.124.8880 > 192.168.43.195.7771: UDP, length 120
22:39:02.033431 IP 192.168.43.124.8880 > 192.168.43.195.7771: UDP, length 120
22:39:02.084065 IP 192.168.43.124.8880 > 192.168.43.195.7771: UDP, length 120
22:39:02.133430 IP 192.168.43.124.8880 > 192.168.43.195.7771: UDP, length 120
22:39:02.183431 IP 192.168.43.124.8880 > 192.168.43.195.7771: UDP, length 120
22:39:02.233431 IP 192.168.43.124.8880 > 192.168.43.195.7771: UDP, length 120
22:39:02.283431 IP 192.168.43.124.8880 > 192.168.43.195.7771: UDP, length 120
22:39:02.333431 IP 192.168.43.124.8880 > 192.168.43.195.7771: UDP, length 120
22:39:02.383432 IP 192.168.43.124.8880 > 192.168.43.195.7771: UDP, length 120
22:39:02.433431 IP 192.168.43.124.8880 > 192.168.43.195.7771: UDP, length 120
22:39:02.483430 IP 192.168.43.124.8880 > 192.168.43.195.7771: UDP, length 120
22:39:02.533431 IP 192.168.43.124.8880 > 192.168.43.195.7771: UDP, length 120
22:39:02.583430 IP 192.168.43.124.8880 > 192.168.43.195.7771: UDP, length 120
22:39:02.633432 IP 192.168.43.124.8880 > 192.168.43.195.7771: UDP, length 120
22:39:02.683481 IP 192.168.43.124.8880 > 192.168.43.195.7771: UDP, length 120
22:39:02.733481 IP 192.168.43.124.8880 > 192.168.43.195.7771: UDP, length 120
22:39:02.783484 IP 192.168.43.124.8880 > 192.168.43.195.7771: UDP, length 120
22:39:02.833482 IP 192.168.43.124.8880 > 192.168.43.195.7771: UDP, length 120
22:39:02.883483 IP 192.168.43.124.8880 > 192.168.43.195.7771: UDP, length 120
22:39:02.933483 IP 192.168.43.124.8880 > 192.168.43.195.7771: UDP, length 120
22:39:02.983483 IP 192.168.43.124.8880 > 192.168.43.195.7771: UDP, length 120
22:39:03.033483 IP 192.168.43.124.8880 > 192.168.43.195.7771: UDP, length 120
22:39:03.083481 IP 192.168.43.124.8880 > 192.168.43.195.7771: UDP, length 120
22:39:03.133481 IP 192.168.43.124.8880 > 192.168.43.195.7771: UDP, length 120
22:39:03.183482 IP 192.168.43.124.8880 > 192.168.43.195.7771: UDP, length 120
22:39:03.233436 IP 192.168.43.124.8880 > 192.168.43.195.7771: UDP, length 120
22:39:03.283432 IP 192.168.43.124.8880 > 192.168.43.195.7771: UDP, length 120
22:39:03.333430 IP 192.168.43.124.8880 > 192.168.43.195.7771: UDP, length 120
22:39:03.383431 IP 192.168.43.124.8880 > 192.168.43.195.7771: UDP, length 120
22:39:03.433431 IP 192.168.43.124.8880 > 192.168.43.195.7771: UDP, length 120
22:39:03.483432 IP 192.168.43.124.8880 > 192.168.43.195.7771: UDP, length 120
22:39:03.533432 IP 192.168.43.124.8880 > 192.168.43.195.7771: UDP, length 120
22:39:03.583431 IP 192.168.43.124.8880 > 192.168.43.195.7771: UDP, length 120
22:39:03.633431 IP 192.168.43.124.8880 > 192.168.43.195.7771: UDP, length 120
22:39:03.683430 IP 192.168.43.124.8880 > 192.168.43.195.7771: UDP, length 120
22:39:03.733431 IP 192.168.43.124.8880 > 192.168.43.195.7771: UDP, length 120
22:39:03.783430 IP 192.168.43.124.8880 > 192.168.43.195.7771: UDP, length 120
22:39:03.833430 IP 192.168.43.124.8880 > 192.168.43.195.7771: UDP, length 120
22:39:03.883480 IP 192.168.43.124.8880 > 192.168.43.195.7771: UDP, length 120
22:39:03.933480 IP 192.168.43.124.8880 > 192.168.43.195.7771: UDP, length 120
22:39:03.983482 IP 192.168.43.124.8880 > 192.168.43.195.7771: UDP, length 120
22:39:04.033482 IP 192.168.43.124.8880 > 192.168.43.195.7771: UDP, length 120
22:39:04.083482 IP 192.168.43.124.8880 > 192.168.43.195.7771: UDP, length 120
22:39:04.133482 IP 192.168.43.124.8880 > 192.168.43.195.7771: UDP, length 120
22:39:04.183484 IP 192.168.43.124.8880 > 192.168.43.195.7771: UDP, length 120
22:39:04.233434 IP 192.168.43.124.8880 > 192.168.43.195.7771: UDP, length 120
22:39:04.283431 IP 192.168.43.124.8880 > 192.168.43.195.7771: UDP, length 120
22:39:04.333430 IP 192.168.43.124.8880 > 192.168.43.195.7771: UDP, length 120
22:39:04.383431 IP 192.168.43.124.8880 > 192.168.43.195.7771: UDP, length 120
22:39:04.433431 IP 192.168.43.124.8880 > 192.168.43.195.7771: UDP, length 120
22:39:04.483429 IP 192.168.43.124.8880 > 192.168.43.195.7771: UDP, length 120
22:39:04.533430 IP 192.168.43.124.8880 > 192.168.43.195.7771: UDP, length 120
22:39:04.583431 IP 192.168.43.124.8880 > 192.168.43.195.7771: UDP, length 120
22:39:04.633429 IP 192.168.43.124.8880 > 192.168.43.195.7771: UDP, length 120
22:39:04.683430 IP 192.168.43.124.8880 > 192.168.43.195.7771: UDP, length 120
22:39:04.733430 IP 192.168.43.124.8880 > 192.168.43.195.7771: UDP, length 120
22:39:04.783430 IP 192.168.43.124.8880 > 192.168.43.195.7771: UDP, length 120
22:39:04.833360 IP 192.168.43.124.8880 > 192.168.43.195.7771: UDP, length 120
22:39:04.883355 IP 192.168.43.124.8880 > 192.168.43.195.7771: UDP, length 120
22:39:04.933430 IP 192.168.43.124.8880 > 192.168.43.195.7771: UDP, length 120
22:39:04.983429 IP 192.168.43.124.8880 > 192.168.43.195.7771: UDP, length 120
22:39:05.033431 IP 192.168.43.124.8880 > 192.168.43.195.7771: UDP, length 120
22:39:05.083430 IP 192.168.43.124.8880 > 192.168.43.195.7771: UDP, length 120
22:39:05.133480 IP 192.168.43.124.8880 > 192.168.43.195.7771: UDP, length 120
22:39:05.183483 IP 192.168.43.124.8880 > 192.168.43.195.7771: UDP, length 120
22:39:05.233481 IP 192.168.43.124.8880 > 192.168.43.195.7771: UDP, length 120
22:39:05.283434 IP 192.168.43.124.8880 > 192.168.43.195.7771: UDP, length 120
22:39:05.333432 IP 192.168.43.124.8880 > 192.168.43.195.7771: UDP, length 120
22:39:05.383429 IP 192.168.43.124.8880 > 192.168.43.195.7771: UDP, length 120
22:39:05.433432 IP 192.168.43.124.8880 > 192.168.43.195.7771: UDP, length 120
22:39:05.483430 IP 192.168.43.124.8880 > 192.168.43.195.7771: UDP, length 120
22:39:05.533431 IP 192.168.43.124.8880 > 192.168.43.195.7771: UDP, length 120
22:39:05.583431 IP 192.168.43.124.8880 > 192.168.43.195.7771: UDP, length 120
22:39:05.633430 IP 192.168.43.124.8880 > 192.168.43.195.7771: UDP, length 120
22:39:05.683434 IP 192.168.43.124.8880 > 192.168.43.195.7771: UDP, length 120
22:39:05.733434 IP 192.168.43.124.8880 > 192.168.43.195.7771: UDP, length 120
22:39:05.783435 IP 192.168.43.124.8880 > 192.168.43.195.7771: UDP, length 120
22:39:05.833434 IP 192.168.43.124.8880 > 192.168.43.195.7771: UDP, length 120
22:39:05.883434 IP 192.168.43.124.8880 > 192.168.43.195.7771: UDP, length 120
22:39:05.933433 IP 192.168.43.124.8880 > 192.168.43.195.7771: UDP, length 120
22:39:05.983435 IP 192.168.43.124.8880 > 192.168.43.195.7771: UDP, length 120
22:39:06.033434 IP 192.168.43.124.8880 > 192.168.43.195.7771: UDP, length 120
22:39:06.083433 IP 192.168.43.124.8880 > 192.168.43.195.7771: UDP, length 120
22:39:06.133434 IP 192.168.43.124.8880 > 192.168.43.195.7771: UDP, length 120
22:39:06.183436 IP 192.168.43.124.8880 > 192.168.43.195.7771: UDP, length 120
22:39:06.233435 IP 192.168.43.124.8880 > 192.168.43.195.7771: UDP, length 120
22:39:06.283429 IP 192.168.43.124.8880 > 192.168.43.195.7771: UDP, length 120
22:39:06.333430 IP 192.168.43.124.8880 > 192.168.43.195.7771: UDP, length 120
22:39:06.383431 IP 192.168.43.124.8880 > 192.168.43.195.7771: UDP, length 120
22:39:06.433429 IP 192.168.43.124.8880 > 192.168.43.195.7771: UDP, length 120
22:39:06.483430 IP 192.168.43.124.8880 > 192.168.43.195.7771: UDP, length 120
22:39:06.533430 IP 192.168.43.124.8880 > 192.168.43.195.7771: UDP, length 120
22:39:06.583433 IP 192.168.43.124.8880 > 192.168.43.195.7771: UDP, length 120
22:39:06.633432 IP 192.168.43.124.8880 > 192.168.43.195.7771: UDP, length 120
22:39:06.683429 IP 192.168.43.124.8880 > 192.168.43.195.7771: UDP, length 120
22:39:06.733428 IP 192.168.43.124.8880 > 192.168.43.195.7771: UDP, length 120
22:39:06.783431 IP 192.168.43.124.8880 > 192.168.43.195.7771: UDP, length 120
22:39:06.833432 IP 192.168.43.124.8880 > 192.168.43.195.7771: UDP, length 120
22:39:06.883431 IP 192.168.43.124.8880 > 192.168.43.195.7771: UDP, length 120
22:39:06.933429 IP 192.168.43.124.8880 > 192.168.43.195.7771: UDP, length 120
22:39:06.983433 IP 192.168.43.124.8880 > 192.168.43.195.7771: UDP, length 120
22:39:07.033431 IP 192.168.43.124.8880 > 192.168.43.195.7771: UDP, length 120
22:39:07.083431 IP 192.168.43.124.8880 > 192.168.43.195.7771: UDP, length 120
22:39:07.133430 IP 192.168.43.124.8880 > 192.168.43.195.7771: UDP, length 120
22:39:07.183431 IP 192.168.43.124.8880 > 192.168.43.195.7771: UDP, length 120
22:39:07.233432 IP 192.168.43.124.8880 > 192.168.43.195.7771: UDP, length 120
22:39:07.283432 IP 192.168.43.124.8880 > 192.168.43.195.7771: UDP, length 120
22:39:07.333429 IP 192.168.43.124.8880 > 192.168.43.195.7771: UDP, length 120
22:39:07.383431 IP 192.168.43.124.8880 > 192.168.43.195.7771: UDP, length 120
22:39:07.433432 IP 192.168.43.124.8880 > 192.168.43.195.7771: UDP, length 120
22:39:07.483482 IP 192.168.43.124.8880 > 192.168.43.195.7771: UDP, length 120
22:39:07.533482 IP 192.168.43.124.8880 > 192.168.43.195.7771: UDP, length 120
22:39:07.583480 IP 192.168.43.124.8880 > 192.168.43.195.7771: UDP, length 120
22:39:07.633480 IP 192.168.43.124.8880 > 192.168.43.195.7771: UDP, length 120
22:39:07.683482 IP 192.168.43.124.8880 > 192.168.43.195.7771: UDP, length 120
22:39:07.733482 IP 192.168.43.124.8880 > 192.168.43.195.7771: UDP, length 120
22:39:07.783483 IP 192.168.43.124.8880 > 192.168.43.195.7771: UDP, length 120
22:39:07.833480 IP 192.168.43.124.8880 > 192.168.43.195.7771: UDP, length 120
22:39:07.883480 IP 192.168.43.124.8880 > 192.168.43.195.7771: UDP, length 120
22:39:07.933483 IP 192.168.43.124.8880 > 192.168.43.195.7771: UDP, length 120
22:39:07.983481 IP 192.168.43.124.8880 > 192.168.43.195.7771: UDP, length 120
22:39:08.033482 IP 192.168.43.124.8880 > 192.168.43.195.7771: UDP, length 120
22:39:08.083481 IP 192.168.43.124.8880 > 192.168.43.195.7771: UDP, length 120
22:39:08.133482 IP 192.168.43.124.8880 > 192.168.43.195.7771: UDP, length 120
22:39:08.183481 IP 192.168.43.124.8880 > 192.168.43.195.7771: UDP, length 120
22:39:08.233481 IP 192.168.43.124.8880 > 192.168.43.195.7771: UDP, length 120
22:39:08.283430 IP 192.168.43.124.8880 > 192.168.43.195.7771: UDP, length 120
22:39:08.333432 IP 192.168.43.124.8880 > 192.168.43.195.7771: UDP, length 120
22:39:08.383431 IP 192.168.43.124.8880 > 192.168.43.195.7771: UDP, length 120
22:39:08.433378 IP 192.168.43.124.8880 > 192.168.43.195.7771: UDP, length 120
22:39:08.483428 IP 192.168.43.124.8880 > 192.168.43.195.7771: UDP, length 120
22:39:08.533430 IP 192.168.43.124.8880 > 192.168.43.195.7771: UDP, length 120
22:39:08.583430 IP 192.168.43.124.8880 > 192.168.43.195.7771: UDP, length 120
22:39:08.633428 IP 192.168.43.124.8880 > 192.168.43.195.7771: UDP, length 120
22:39:08.683433 IP 192.168.43.124.8880 > 192.168.43.195.7771: UDP, length 120
22:39:08.733433 IP 192.168.43.124.8880 > 192.168.43.195.7771: UDP, length 120
22:39:08.783432 IP 192.168.43.124.8880 > 192.168.43.195.7771: UDP, length 120
22:39:08.833430 IP 192.168.43.124.8880 > 192.168.43.195.7771: UDP, length 120
22:39:08.883430 IP 192.168.43.124.8880 > 192.168.43.195.7771: UDP, length 120
22:39:08.933430 IP 192.168.43.124.8880 > 192.168.43.195.7771: UDP, length 120
22:39:08.983431 IP 192.168.43.124.8880 > 192.168.43.195.7771: UDP, length 120
22:39:09.033433 IP 192.168.43.124.8880 > 192.168.43.195.7771: UDP, length 120
22:39:09.083433 IP 192.168.43.124.8880 > 192.168.43.195.7771: UDP, length 120
22:39:09.133433 IP 192.168.43.124.8880 > 192.168.43.195.7771: UDP, length 120
22:39:09.183435 IP 192.168.43.124.8880 > 192.168.43.195.7771: UDP, length 120
22:39:09.233434 IP 192.168.43.124.8880 > 192.168.43.195.7771: UDP, length 120
22:39:09.283430 IP 192.168.43.124.8880 > 192.168.43.195.7771: UDP, length 120
22:39:09.333430 IP 192.168.43.124.8880 > 192.168.43.195.7771: UDP, length 120
22:39:09.383431 IP 192.168.43.124.8880 > 192.168.43.195.7771: UDP, length 120
22:39:09.433430 IP 192.168.43.124.8880 > 192.168.43.195.7771: UDP, length 120
22:39:09.483430 IP 192.168.43.124.8880 > 192.168.43.195.7771: UDP, length 120
22:39:09.533432 IP 192.168.43.124.8880 > 192.168.43.195.7771: UDP, length 120
22:39:09.583430 IP 192.168.43.124.8880 > 192.168.43.195.7771: UDP, length 120
22:39:09.633428 IP 192.168.43.124.8880 > 192.168.43.195.7771: UDP, length 120
22:39:09.683430 IP 192.168.43.124.8880 > 192.168.43.195.7771: UDP, length 120
22:39:09.733430 IP 192.168.43.124.8880 > 192.168.43.195.7771: UDP, length 120
22:39:09.783430 IP 192.168.43.124.8880 > 192.168.43.195.7771: UDP, length 120
22:39:09.833430 IP 192.168.43.124.8880 > 192.168.43.195.7771: UDP, length 120
22:39:09.883431 IP 192.168.43.124.8880 > 192.168.43.195.7771: UDP, length 120
22:39:09.933373 IP 192.168.43.124.8880 > 192.168.43.195.7771: UDP, length 120
22:39:09.983367 IP 192.168.43.124.8880 > 192.168.43.195.7771: UDP, length 120
22:39:10.033395 IP 192.168.43.124.8880 > 192.168.43.195.7771: UDP, length 120
22:39:10.083427 IP 192.168.43.124.8880 > 192.168.43.195.7771: UDP, length 120
22:39:10.133429 IP 192.168.43.124.8880 > 192.168.43.195.7771: UDP, length 120
22:39:10.183433 IP 192.168.43.124.8880 > 192.168.43.195.7771: UDP, length 120
22:39:10.233430 IP 192.168.43.124.8880 > 192.168.43.195.7771: UDP, length 120
22:39:10.283381 IP 192.168.43.124.8880 > 192.168.43.195.7771: UDP, length 120
22:39:10.333431 IP 192.168.43.124.8880 > 192.168.43.195.7771: UDP, length 120
22:39:10.383431 IP 192.168.43.124.8880 > 192.168.43.195.7771: UDP, length 120
22:39:10.433431 IP 192.168.43.124.8880 > 192.168.43.195.7771: UDP, length 120
22:39:10.483432 IP 192.168.43.124.8880 > 192.168.43.195.7771: UDP, length 120
22:39:10.533431 IP 192.168.43.124.8880 > 192.168.43.195.7771: UDP, length 120
22:39:10.583622 IP 192.168.43.124.8880 > 192.168.43.195.7771: UDP, length 120
22:39:10.633394 IP 192.168.43.124.8880 > 192.168.43.195.7771: UDP, length 120
22:39:10.683431 IP 192.168.43.124.8880 > 192.168.43.195.7771: UDP, length 120
22:39:10.733431 IP 192.168.43.124.8880 > 192.168.43.195.7771: UDP, length 120
22:39:10.783430 IP 192.168.43.124.8880 > 192.168.43.195.7771: UDP, length 120
22:39:10.833431 IP 192.168.43.124.8880 > 192.168.43.195.7771: UDP, length 120
22:39:10.883432 IP 192.168.43.124.8880 > 192.168.43.195.7771: UDP, length 120
22:39:10.933431 IP 192.168.43.124.8880 > 192.168.43.195.7771: UDP, length 120
22:39:10.983396 IP 192.168.43.124.8880 > 192.168.43.195.7771: UDP, length 120
22:39:11.033431 IP 192.168.43.124.8880 > 192.168.43.195.7771: UDP, length 120
22:39:11.083395 IP 192.168.43.124.8880 > 192.168.43.195.7771: UDP, length 120
22:39:11.133432 IP 192.168.43.124.8880 > 192.168.43.195.7771: UDP, length 120
22:39:11.183386 IP 192.168.43.124.8880 > 192.168.43.195.7771: UDP, length 120
22:39:11.233482 IP 192.168.43.124.8880 > 192.168.43.195.7771: UDP, length 120
22:39:11.283388 IP 192.168.43.124.8880 > 192.168.43.195.7771: UDP, length 120
22:39:11.333429 IP 192.168.43.124.8880 > 192.168.43.195.7771: UDP, length 120
22:39:11.383379 IP 192.168.43.124.8880 > 192.168.43.195.7771: UDP, length 120
22:39:11.433432 IP 192.168.43.124.8880 > 192.168.43.195.7771: UDP, length 120
22:39:11.483378 IP 192.168.43.124.8880 > 192.168.43.195.7771: UDP, length 120
22:39:11.533431 IP 192.168.43.124.8880 > 192.168.43.195.7771: UDP, length 120
22:39:11.583350 IP 192.168.43.124.8880 > 192.168.43.195.7771: UDP, length 120
22:39:11.633377 IP 192.168.43.124.8880 > 192.168.43.195.7771: UDP, length 120
22:39:11.683441 IP 192.168.43.124.8880 > 192.168.43.195.7771: UDP, length 120
22:39:11.733431 IP 192.168.43.124.8880 > 192.168.43.195.7771: UDP, length 120
22:39:11.783439 IP 192.168.43.124.8880 > 192.168.43.195.7771: UDP, length 120
22:39:11.833431 IP 192.168.43.124.8880 > 192.168.43.195.7771: UDP, length 120
22:39:11.883431 IP 192.168.43.124.8880 > 192.168.43.195.7771: UDP, length 120
22:39:11.933431 IP 192.168.43.124.8880 > 192.168.43.195.7771: UDP, length 120
22:39:11.983421 IP 192.168.43.124.8880 > 192.168.43.195.7771: UDP, length 120
22:39:12.033479 IP 192.168.43.124.8880 > 192.168.43.195.7771: UDP, length 120
22:39:12.083476 IP 192.168.43.124.8880 > 192.168.43.195.7771: UDP, length 120
22:39:12.133481 IP 192.168.43.124.8880 > 192.168.43.195.7771: UDP, length 120
22:39:12.183450 IP 192.168.43.124.8880 > 192.168.43.195.7771: UDP, length 120
22:39:12.233481 IP 192.168.43.124.8880 > 192.168.43.195.7771: UDP, length 120
22:39:12.283385 IP 192.168.43.124.8880 > 192.168.43.195.7771: UDP, length 120
22:39:12.333434 IP 192.168.43.124.8880 > 192.168.43.195.7771: UDP, length 120
22:39:12.383436 IP 192.168.43.124.8880 > 192.168.43.195.7771: UDP, length 120
22:39:12.433433 IP 192.168.43.124.8880 > 192.168.43.195.7771: UDP, length 120
22:39:12.483436 IP 192.168.43.124.8880 > 192.168.43.195.7771: UDP, length 120
22:39:12.533482 IP 192.168.43.124.8880 > 192.168.43.195.7771: UDP, length 120
22:39:12.583480 IP 192.168.43.124.8880 > 192.168.43.195.7771: UDP, length 120
22:39:12.633487 IP 192.168.43.124.8880 > 192.168.43.195.7771: UDP, length 120
22:39:12.683483 IP 192.168.43.124.8880 > 192.168.43.195.7771: UDP, length 120
22:39:12.734062 IP 192.168.43.124.8880 > 192.168.43.195.7771: UDP, length 120
22:39:12.783482 IP 192.168.43.124.8880 > 192.168.43.195.7771: UDP, length 120
22:39:12.833482 IP 192.168.43.124.8880 > 192.168.43.195.7771: UDP, length 120
22:39:12.883480 IP 192.168.43.124.8880 > 192.168.43.195.7771: UDP, length 120
22:39:12.933481 IP 192.168.43.124.8880 > 192.168.43.195.7771: UDP, length 120
22:39:12.983482 IP 192.168.43.124.8880 > 192.168.43.195.7771: UDP, length 120
22:39:13.033482 IP 192.168.43.124.8880 > 192.168.43.195.7771: UDP, length 120
22:39:13.083484 IP 192.168.43.124.8880 > 192.168.43.195.7771: UDP, length 120
22:39:13.133483 IP 192.168.43.124.8880 > 192.168.43.195.7771: UDP, length 120
22:39:13.183481 IP 192.168.43.124.8880 > 192.168.43.195.7771: UDP, length 120
22:39:13.233434 IP 192.168.43.124.8880 > 192.168.43.195.7771: UDP, length 120
22:39:13.283391 IP 192.168.43.124.8880 > 192.168.43.195.7771: UDP, length 120
22:39:13.333429 IP 192.168.43.124.8880 > 192.168.43.195.7771: UDP, length 120
22:39:13.383431 IP 192.168.43.124.8880 > 192.168.43.195.7771: UDP, length 120
22:39:13.433430 IP 192.168.43.124.8880 > 192.168.43.195.7771: UDP, length 120
22:39:13.483429 IP 192.168.43.124.8880 > 192.168.43.195.7771: UDP, length 120
22:39:13.533429 IP 192.168.43.124.8880 > 192.168.43.195.7771: UDP, length 120
22:39:13.583431 IP 192.168.43.124.8880 > 192.168.43.195.7771: UDP, length 120
22:39:13.633431 IP 192.168.43.124.8880 > 192.168.43.195.7771: UDP, length 120
22:39:13.683430 IP 192.168.43.124.8880 > 192.168.43.195.7771: UDP, length 120
22:39:13.733431 IP 192.168.43.124.8880 > 192.168.43.195.7771: UDP, length 120
22:39:13.783429 IP 192.168.43.124.8880 > 192.168.43.195.7771: UDP, length 120
22:39:13.833431 IP 192.168.43.124.8880 > 192.168.43.195.7771: UDP, length 120
22:39:13.883433 IP 192.168.43.124.8880 > 192.168.43.195.7771: UDP, length 120
22:39:13.933431 IP 192.168.43.124.8880 > 192.168.43.195.7771: UDP, length 120
22:39:13.983388 IP 192.168.43.124.8880 > 192.168.43.195.7771: UDP, length 120
22:39:14.033433 IP 192.168.43.124.8880 > 192.168.43.195.7771: UDP, length 120
22:39:14.083431 IP 192.168.43.124.8880 > 192.168.43.195.7771: UDP, length 120
22:39:14.133429 IP 192.168.43.124.8880 > 192.168.43.195.7771: UDP, length 120
22:39:14.183429 IP 192.168.43.124.8880 > 192.168.43.195.7771: UDP, length 120
22:39:14.233430 IP 192.168.43.124.8880 > 192.168.43.195.7771: UDP, length 120
22:39:14.283385 IP 192.168.43.124.8880 > 192.168.43.195.7771: UDP, length 120
22:39:14.333433 IP 192.168.43.124.8880 > 192.168.43.195.7771: UDP, length 120
22:39:14.383431 IP 192.168.43.124.8880 > 192.168.43.195.7771: UDP, length 120
22:39:14.433431 IP 192.168.43.124.8880 > 192.168.43.195.7771: UDP, length 120
22:39:14.483430 IP 192.168.43.124.8880 > 192.168.43.195.7771: UDP, length 120
22:39:14.533430 IP 192.168.43.124.8880 > 192.168.43.195.7771: UDP, length 120
22:39:14.583431 IP 192.168.43.124.8880 > 192.168.43.195.7771: UDP, length 120
22:39:14.633431 IP 192.168.43.124.8880 > 192.168.43.195.7771: UDP, length 120
22:39:14.683432 IP 192.168.43.124.8880 > 192.168.43.195.7771: UDP, length 120
22:39:14.733431 IP 192.168.43.124.8880 > 192.168.43.195.7771: UDP, length 120
22:39:14.783431 IP 192.168.43.124.8880 > 192.168.43.195.7771: UDP, length 120
22:39:14.833431 IP 192.168.43.124.8880 > 192.168.43.195.7771: UDP, length 120
22:39:14.883431 IP 192.168.43.124.8880 > 192.168.43.195.7771: UDP, length 120
22:39:14.933432 IP 192.168.43.124.8880 > 192.168.43.195.7771: UDP, length 120
22:39:14.983431 IP 192.168.43.124.8880 > 192.168.43.195.7771: UDP, length 120
22:39:15.033406 IP 192.168.43.124.8880 > 192.168.43.195.7771: UDP, length 120
22:39:15.083370 IP 192.168.43.124.8880 > 192.168.43.195.7771: UDP, length 120
22:39:15.133380 IP 192.168.43.124.8880 > 192.168.43.195.7771: UDP, length 120
22:39:15.183432 IP 192.168.43.124.8880 > 192.168.43.195.7771: UDP, length 120
22:39:15.233431 IP 192.168.43.124.8880 > 192.168.43.195.7771: UDP, length 120
22:39:15.283373 IP 192.168.43.124.8880 > 192.168.43.195.7771: UDP, length 120
22:39:15.333432 IP 192.168.43.124.8880 > 192.168.43.195.7771: UDP, length 120
22:39:15.383432 IP 192.168.43.124.8880 > 192.168.43.195.7771: UDP, length 120
22:39:15.433432 IP 192.168.43.124.8880 > 192.168.43.195.7771: UDP, length 120
22:39:15.483433 IP 192.168.43.124.8880 > 192.168.43.195.7771: UDP, length 120
22:39:15.533433 IP 192.168.43.124.8880 > 192.168.43.195.7771: UDP, length 120
22:39:15.583432 IP 192.168.43.124.8880 > 192.168.43.195.7771: UDP, length 120
22:39:15.633433 IP 192.168.43.124.8880 > 192.168.43.195.7771: UDP, length 120
22:39:15.683430 IP 192.168.43.124.8880 > 192.168.43.195.7771: UDP, length 120
22:39:15.733432 IP 192.168.43.124.8880 > 192.168.43.195.7771: UDP, length 120
22:39:15.783432 IP 192.168.43.124.8880 > 192.168.43.195.7771: UDP, length 120
22:39:15.833433 IP 192.168.43.124.8880 > 192.168.43.195.7771: UDP, length 120
22:39:15.883378 IP 192.168.43.124.8880 > 192.168.43.195.7771: UDP, length 120
22:39:15.933431 IP 192.168.43.124.8880 > 192.168.43.195.7771: UDP, length 120
22:39:15.983432 IP 192.168.43.124.8880 > 192.168.43.195.7771: UDP, length 120
22:39:16.033484 IP 192.168.43.124.8880 > 192.168.43.195.7771: UDP, length 120
22:39:16.083485 IP 192.168.43.124.8880 > 192.168.43.195.7771: UDP, length 120
22:39:16.133523 IP 192.168.43.124.8880 > 192.168.43.195.7771: UDP, length 120
22:39:16.183521 IP 192.168.43.124.8880 > 192.168.43.195.7771: UDP, length 120
22:39:16.233521 IP 192.168.43.124.8880 > 192.168.43.195.7771: UDP, length 120
22:39:16.283425 IP 192.168.43.124.8880 > 192.168.43.195.7771: UDP, length 120
22:39:16.333385 IP 192.168.43.124.8880 > 192.168.43.195.7771: UDP, length 120
22:39:16.383357 IP 192.168.43.124.8880 > 192.168.43.195.7771: UDP, length 120
22:39:16.433354 IP 192.168.43.124.8880 > 192.168.43.195.7771: UDP, length 120
22:39:16.483433 IP 192.168.43.124.8880 > 192.168.43.195.7771: UDP, length 120
22:39:16.533433 IP 192.168.43.124.8880 > 192.168.43.195.7771: UDP, length 120
22:39:16.583433 IP 192.168.43.124.8880 > 192.168.43.195.7771: UDP, length 120
22:39:16.633433 IP 192.168.43.124.8880 > 192.168.43.195.7771: UDP, length 120
22:39:16.683440 IP 192.168.43.124.8880 > 192.168.43.195.7771: UDP, length 120
22:39:16.733432 IP 192.168.43.124.8880 > 192.168.43.195.7771: UDP, length 120
22:39:16.783431 IP 192.168.43.124.8880 > 192.168.43.195.7771: UDP, length 120
22:39:16.833432 IP 192.168.43.124.8880 > 192.168.43.195.7771: UDP, length 120
22:39:16.883433 IP 192.168.43.124.8880 > 192.168.43.195.7771: UDP, length 120
22:39:16.933384 IP 192.168.43.124.8880 > 192.168.43.195.7771: UDP, length 120
22:39:16.983432 IP 192.168.43.124.8880 > 192.168.43.195.7771: UDP, length 120
22:39:17.033434 IP 192.168.43.124.8880 > 192.168.43.195.7771: UDP, length 120
22:39:17.083480 IP 192.168.43.124.8880 > 192.168.43.195.7771: UDP, length 120
22:39:17.133681 IP 192.168.43.124.8880 > 192.168.43.195.7771: UDP, length 120
22:39:17.183540 IP 192.168.43.124.8880 > 192.168.43.195.7771: UDP, length 120
22:39:17.233691 IP 192.168.43.124.8880 > 192.168.43.195.7771: UDP, length 120
22:39:17.283646 IP 192.168.43.124.8880 > 192.168.43.195.7771: UDP, length 120
22:39:17.334154 IP 192.168.43.124.8880 > 192.168.43.195.7771: UDP, length 120
22:39:17.383432 IP 192.168.43.124.8880 > 192.168.43.195.7771: UDP, length 120
22:39:17.433432 IP 192.168.43.124.8880 > 192.168.43.195.7771: UDP, length 120
22:39:17.483432 IP 192.168.43.124.8880 > 192.168.43.195.7771: UDP, length 120
22:39:17.533432 IP 192.168.43.124.8880 > 192.168.43.195.7771: UDP, length 120
22:39:17.583431 IP 192.168.43.124.8880 > 192.168.43.195.7771: UDP, length 120
22:39:17.633433 IP 192.168.43.124.8880 > 192.168.43.195.7771: UDP, length 120
22:39:17.683432 IP 192.168.43.124.8880 > 192.168.43.195.7771: UDP, length 120
22:39:17.733483 IP 192.168.43.124.8880 > 192.168.43.195.7771: UDP, length 120
22:39:17.784223 IP 192.168.43.124.8880 > 192.168.43.195.7771: UDP, length 120
22:39:17.833681 IP 192.168.43.124.8880 > 192.168.43.195.7771: UDP, length 120
22:39:17.883693 IP 192.168.43.124.8880 > 192.168.43.195.7771: UDP, length 120
22:39:17.933484 IP 192.168.43.124.8880 > 192.168.43.195.7771: UDP, length 120
22:39:17.984228 IP 192.168.43.124.8880 > 192.168.43.195.7771: UDP, length 120
22:39:18.033485 IP 192.168.43.124.8880 > 192.168.43.195.7771: UDP, length 120
22:39:18.083521 IP 192.168.43.124.8880 > 192.168.43.195.7771: UDP, length 120
22:39:18.133522 IP 192.168.43.124.8880 > 192.168.43.195.7771: UDP, length 120
22:39:18.183521 IP 192.168.43.124.8880 > 192.168.43.195.7771: UDP, length 120
22:39:18.233520 IP 192.168.43.124.8880 > 192.168.43.195.7771: UDP, length 120
22:39:18.283428 IP 192.168.43.124.8880 > 192.168.43.195.7771: UDP, length 120
22:39:18.333432 IP 192.168.43.124.8880 > 192.168.43.195.7771: UDP, length 120
22:39:18.383431 IP 192.168.43.124.8880 > 192.168.43.195.7771: UDP, length 120
22:39:18.433433 IP 192.168.43.124.8880 > 192.168.43.195.7771: UDP, length 120
22:39:18.483431 IP 192.168.43.124.8880 > 192.168.43.195.7771: UDP, length 120
22:39:18.533432 IP 192.168.43.124.8880 > 192.168.43.195.7771: UDP, length 120
22:39:18.583431 IP 192.168.43.124.8880 > 192.168.43.195.7771: UDP, length 120
22:39:18.633431 IP 192.168.43.124.8880 > 192.168.43.195.7771: UDP, length 120
22:39:18.683432 IP 192.168.43.124.8880 > 192.168.43.195.7771: UDP, length 120
22:39:18.733432 IP 192.168.43.124.8880 > 192.168.43.195.7771: UDP, length 120
22:39:18.783432 IP 192.168.43.124.8880 > 192.168.43.195.7771: UDP, length 120
22:39:18.833432 IP 192.168.43.124.8880 > 192.168.43.195.7771: UDP, length 120
22:39:18.883430 IP 192.168.43.124.8880 > 192.168.43.195.7771: UDP, length 120
22:39:18.933453 IP 192.168.43.124.8880 > 192.168.43.195.7771: UDP, length 120
22:39:18.983455 IP 192.168.43.124.8880 > 192.168.43.195.7771: UDP, length 120
22:39:19.033482 IP 192.168.43.124.8880 > 192.168.43.195.7771: UDP, length 120
22:39:19.084538 IP 192.168.43.124.8880 > 192.168.43.195.7771: UDP, length 120
22:39:19.133526 IP 192.168.43.124.8880 > 192.168.43.195.7771: UDP, length 120
22:39:19.184590 IP 192.168.43.124.8880 > 192.168.43.195.7771: UDP, length 120
22:39:19.233482 IP 192.168.43.124.8880 > 192.168.43.195.7771: UDP, length 120
22:39:19.283653 IP 192.168.43.124.8880 > 192.168.43.195.7771: UDP, length 120
22:39:19.334175 IP 192.168.43.124.8880 > 192.168.43.195.7771: UDP, length 120
22:39:19.383431 IP 192.168.43.124.8880 > 192.168.43.195.7771: UDP, length 120
22:39:19.433432 IP 192.168.43.124.8880 > 192.168.43.195.7771: UDP, length 120
22:39:19.483481 IP 192.168.43.124.8880 > 192.168.43.195.7771: UDP, length 120
22:39:19.533440 IP 192.168.43.124.8880 > 192.168.43.195.7771: UDP, length 120
22:39:19.583439 IP 192.168.43.124.8880 > 192.168.43.195.7771: UDP, length 120
22:39:19.633438 IP 192.168.43.124.8880 > 192.168.43.195.7771: UDP, length 120
22:39:19.683437 IP 192.168.43.124.8880 > 192.168.43.195.7771: UDP, length 120
22:39:19.733437 IP 192.168.43.124.8880 > 192.168.43.195.7771: UDP, length 120
22:39:19.783480 IP 192.168.43.124.8880 > 192.168.43.195.7771: UDP, length 120
22:39:19.833538 IP 192.168.43.124.8880 > 192.168.43.195.7771: UDP, length 120
22:39:19.884223 IP 192.168.43.124.8880 > 192.168.43.195.7771: UDP, length 120
22:39:19.934548 IP 192.168.43.124.8880 > 192.168.43.195.7771: UDP, length 120
22:39:19.983483 IP 192.168.43.124.8880 > 192.168.43.195.7771: UDP, length 120
22:39:20.033485 IP 192.168.43.124.8880 > 192.168.43.195.7771: UDP, length 120
22:39:20.083483 IP 192.168.43.124.8880 > 192.168.43.195.7771: UDP, length 120
22:39:20.133456 IP 192.168.43.124.8880 > 192.168.43.195.7771: UDP, length 120
22:39:20.183401 IP 192.168.43.124.8880 > 192.168.43.195.7771: UDP, length 120
22:39:20.233362 IP 192.168.43.124.8880 > 192.168.43.195.7771: UDP, length 120
22:39:20.283382 IP 192.168.43.124.8880 > 192.168.43.195.7771: UDP, length 120
22:39:20.333429 IP 192.168.43.124.8880 > 192.168.43.195.7771: UDP, length 120
22:39:20.383433 IP 192.168.43.124.8880 > 192.168.43.195.7771: UDP, length 120
22:39:20.433431 IP 192.168.43.124.8880 > 192.168.43.195.7771: UDP, length 120
22:39:20.483431 IP 192.168.43.124.8880 > 192.168.43.195.7771: UDP, length 120
22:39:20.533431 IP 192.168.43.124.8880 > 192.168.43.195.7771: UDP, length 120
22:39:20.583432 IP 192.168.43.124.8880 > 192.168.43.195.7771: UDP, length 120
22:39:20.633431 IP 192.168.43.124.8880 > 192.168.43.195.7771: UDP, length 120
