03:09:57.549365 IP 192.168.43.147.8880 > 192.168.43.124.7773: UDP, length 120
03:09:57.599409 IP 192.168.43.147.8880 > 192.168.43.124.7773: UDP, length 120
03:09:57.649389 IP 192.168.43.147.8880 > 192.168.43.124.7773: UDP, length 120
03:09:57.699388 IP 192.168.43.147.8880 > 192.168.43.124.7773: UDP, length 120
03:09:57.749390 IP 192.168.43.147.8880 > 192.168.43.124.7773: UDP, length 120
03:09:57.799389 IP 192.168.43.147.8880 > 192.168.43.124.7773: UDP, length 120
03:09:57.849387 IP 192.168.43.147.8880 > 192.168.43.124.7773: UDP, length 120
03:09:57.899389 IP 192.168.43.147.8880 > 192.168.43.124.7773: UDP, length 120
03:09:57.949387 IP 192.168.43.147.8880 > 192.168.43.124.7773: UDP, length 120
03:09:57.999386 IP 192.168.43.147.8880 > 192.168.43.124.7773: UDP, length 120
03:09:58.049386 IP 192.168.43.147.8880 > 192.168.43.124.7773: UDP, length 120
03:09:58.099386 IP 192.168.43.147.8880 > 192.168.43.124.7773: UDP, length 120
03:09:58.149385 IP 192.168.43.147.8880 > 192.168.43.124.7773: UDP, length 120
03:09:58.199386 IP 192.168.43.147.8880 > 192.168.43.124.7773: UDP, length 120
03:09:58.249387 IP 192.168.43.147.8880 > 192.168.43.124.7773: UDP, length 120
03:09:58.299386 IP 192.168.43.147.8880 > 192.168.43.124.7773: UDP, length 120
03:09:58.349386 IP 192.168.43.147.8880 > 192.168.43.124.7773: UDP, length 120
03:09:58.399385 IP 192.168.43.147.8880 > 192.168.43.124.7773: UDP, length 120
03:09:58.449396 IP 192.168.43.147.8880 > 192.168.43.124.7773: UDP, length 120
03:09:58.499389 IP 192.168.43.147.8880 > 192.168.43.124.7773: UDP, length 120
03:09:58.549388 IP 192.168.43.147.8880 > 192.168.43.124.7773: UDP, length 120
03:09:58.599388 IP 192.168.43.147.8880 > 192.168.43.124.7773: UDP, length 120
03:09:58.627260 IP 192.168.43.146.8880 > 192.168.43.147.7772: UDP, length 120
03:09:58.649391 IP 192.168.43.147.8880 > 192.168.43.124.7773: UDP, length 120
03:09:58.681197 IP 192.168.43.146.8880 > 192.168.43.147.7772: UDP, length 120
03:09:58.699391 IP 192.168.43.147.8880 > 192.168.43.124.7773: UDP, length 120
03:09:58.743943 IP 192.168.43.146.8880 > 192.168.43.147.7772: UDP, length 120
03:09:58.749388 IP 192.168.43.147.8880 > 192.168.43.124.7773: UDP, length 120
03:09:58.794333 IP 192.168.43.146.8880 > 192.168.43.147.7772: UDP, length 120
03:09:58.799440 IP 192.168.43.147.8880 > 192.168.43.124.7773: UDP, length 120
03:09:58.833057 IP 192.168.43.146.8880 > 192.168.43.147.7772: UDP, length 120
03:09:58.849410 IP 192.168.43.147.8880 > 192.168.43.124.7773: UDP, length 120
03:09:58.866588 IP 192.168.43.146.8880 > 192.168.43.147.7772: UDP, length 120
03:09:58.899400 IP 192.168.43.147.8880 > 192.168.43.124.7773: UDP, length 120
03:09:58.949399 IP 192.168.43.147.8880 > 192.168.43.124.7773: UDP, length 120
03:09:58.953074 IP 192.168.43.146.8880 > 192.168.43.147.7772: UDP, length 120
03:09:58.963330 IP 192.168.43.146.8880 > 192.168.43.147.7772: UDP, length 120
03:09:58.999396 IP 192.168.43.147.8880 > 192.168.43.124.7773: UDP, length 120
03:09:59.045971 IP 192.168.43.146.8880 > 192.168.43.147.7772: UDP, length 120
03:09:59.049443 IP 192.168.43.147.8880 > 192.168.43.124.7773: UDP, length 120
03:09:59.099471 IP 192.168.43.147.8880 > 192.168.43.124.7773: UDP, length 120
03:09:59.115418 IP 192.168.43.146.8880 > 192.168.43.147.7772: UDP, length 120
03:09:59.117370 IP 192.168.43.146.8880 > 192.168.43.147.7772: UDP, length 120
03:09:59.149508 IP 192.168.43.147.8880 > 192.168.43.124.7773: UDP, length 120
03:09:59.188684 IP 192.168.43.146.8880 > 192.168.43.147.7772: UDP, length 120
03:09:59.199486 IP 192.168.43.147.8880 > 192.168.43.124.7773: UDP, length 120
03:09:59.249474 IP 192.168.43.147.8880 > 192.168.43.124.7773: UDP, length 120
03:09:59.262406 IP 192.168.43.146.8880 > 192.168.43.147.7772: UDP, length 120
03:09:59.297170 IP 192.168.43.146.8880 > 192.168.43.147.7772: UDP, length 120
03:09:59.299451 IP 192.168.43.147.8880 > 192.168.43.124.7773: UDP, length 120
03:09:59.334149 IP 192.168.43.146.8880 > 192.168.43.147.7772: UDP, length 120
03:09:59.349528 IP 192.168.43.147.8880 > 192.168.43.124.7773: UDP, length 120
03:09:59.364258 IP 192.168.43.146.8880 > 192.168.43.147.7772: UDP, length 120
03:09:59.399457 IP 192.168.43.147.8880 > 192.168.43.124.7773: UDP, length 120
03:09:59.425153 IP 192.168.43.146.8880 > 192.168.43.147.7772: UDP, length 120
03:09:59.449444 IP 192.168.43.147.8880 > 192.168.43.124.7773: UDP, length 120
03:09:59.487499 IP 192.168.43.146.8880 > 192.168.43.147.7772: UDP, length 120
03:09:59.499446 IP 192.168.43.147.8880 > 192.168.43.124.7773: UDP, length 120
03:09:59.549443 IP 192.168.43.147.8880 > 192.168.43.124.7773: UDP, length 120
03:09:59.560191 IP 192.168.43.146.8880 > 192.168.43.147.7772: UDP, length 120
03:09:59.567393 IP 192.168.43.146.8880 > 192.168.43.147.7772: UDP, length 120
03:09:59.599448 IP 192.168.43.147.8880 > 192.168.43.124.7773: UDP, length 120
03:09:59.649417 IP 192.168.43.147.8880 > 192.168.43.124.7773: UDP, length 120
03:09:59.662479 IP 192.168.43.146.8880 > 192.168.43.147.7772: UDP, length 120
03:09:59.662646 IP 192.168.43.146.8880 > 192.168.43.147.7772: UDP, length 120
03:09:59.699373 IP 192.168.43.147.8880 > 192.168.43.124.7773: UDP, length 120
03:09:59.737101 IP 192.168.43.146.8880 > 192.168.43.147.7772: UDP, length 120
03:09:59.749370 IP 192.168.43.147.8880 > 192.168.43.124.7773: UDP, length 120
03:09:59.764591 IP 192.168.43.146.8880 > 192.168.43.147.7772: UDP, length 120
03:09:59.799365 IP 192.168.43.147.8880 > 192.168.43.124.7773: UDP, length 120
03:09:59.834821 IP 192.168.43.146.8880 > 192.168.43.147.7772: UDP, length 120
03:09:59.849361 IP 192.168.43.147.8880 > 192.168.43.124.7773: UDP, length 120
03:09:59.885626 IP 192.168.43.146.8880 > 192.168.43.147.7772: UDP, length 120
03:09:59.899373 IP 192.168.43.147.8880 > 192.168.43.124.7773: UDP, length 120
03:09:59.930705 IP 192.168.43.146.8880 > 192.168.43.147.7772: UDP, length 120
03:09:59.949366 IP 192.168.43.147.8880 > 192.168.43.124.7773: UDP, length 120
03:09:59.967051 IP 192.168.43.146.8880 > 192.168.43.147.7772: UDP, length 120
03:09:59.999364 IP 192.168.43.147.8880 > 192.168.43.124.7773: UDP, length 120
03:10:00.036767 IP 192.168.43.146.8880 > 192.168.43.147.7772: UDP, length 120
03:10:00.049361 IP 192.168.43.147.8880 > 192.168.43.124.7773: UDP, length 120
03:10:00.072633 IP 192.168.43.146.8880 > 192.168.43.147.7772: UDP, length 120
03:10:00.099363 IP 192.168.43.147.8880 > 192.168.43.124.7773: UDP, length 120
03:10:00.114171 IP 192.168.43.146.8880 > 192.168.43.147.7772: UDP, length 120
03:10:00.149362 IP 192.168.43.147.8880 > 192.168.43.124.7773: UDP, length 120
03:10:00.186112 IP 192.168.43.146.8880 > 192.168.43.147.7772: UDP, length 120
03:10:00.199362 IP 192.168.43.147.8880 > 192.168.43.124.7773: UDP, length 120
03:10:00.213978 IP 192.168.43.146.8880 > 192.168.43.147.7772: UDP, length 120
03:10:00.249362 IP 192.168.43.147.8880 > 192.168.43.124.7773: UDP, length 120
03:10:00.264078 IP 192.168.43.146.8880 > 192.168.43.147.7772: UDP, length 120
03:10:00.299407 IP 192.168.43.147.8880 > 192.168.43.124.7773: UDP, length 120
03:10:00.336310 IP 192.168.43.146.8880 > 192.168.43.147.7772: UDP, length 120
03:10:00.349372 IP 192.168.43.147.8880 > 192.168.43.124.7773: UDP, length 120
03:10:00.363815 IP 192.168.43.146.8880 > 192.168.43.147.7772: UDP, length 120
03:10:00.399366 IP 192.168.43.147.8880 > 192.168.43.124.7773: UDP, length 120
03:10:00.416140 IP 192.168.43.146.8880 > 192.168.43.147.7772: UDP, length 120
03:10:00.449366 IP 192.168.43.147.8880 > 192.168.43.124.7773: UDP, length 120
03:10:00.486540 IP 192.168.43.146.8880 > 192.168.43.147.7772: UDP, length 120
03:10:00.499365 IP 192.168.43.147.8880 > 192.168.43.124.7773: UDP, length 120
03:10:00.522371 IP 192.168.43.146.8880 > 192.168.43.147.7772: UDP, length 120
03:10:00.549362 IP 192.168.43.147.8880 > 192.168.43.124.7773: UDP, length 120
03:10:00.566411 IP 192.168.43.146.8880 > 192.168.43.147.7772: UDP, length 120
03:10:00.599363 IP 192.168.43.147.8880 > 192.168.43.124.7773: UDP, length 120
03:10:00.636736 IP 192.168.43.146.8880 > 192.168.43.147.7772: UDP, length 120
03:10:00.649363 IP 192.168.43.147.8880 > 192.168.43.124.7773: UDP, length 120
03:10:00.662160 IP 192.168.43.146.8880 > 192.168.43.147.7772: UDP, length 120
03:10:00.699363 IP 192.168.43.147.8880 > 192.168.43.124.7773: UDP, length 120
03:10:00.710878 IP 192.168.43.146.8880 > 192.168.43.147.7772: UDP, length 120
03:10:00.749362 IP 192.168.43.147.8880 > 192.168.43.124.7773: UDP, length 120
03:10:00.763472 IP 192.168.43.146.8880 > 192.168.43.147.7772: UDP, length 120
03:10:00.799364 IP 192.168.43.147.8880 > 192.168.43.124.7773: UDP, length 120
03:10:00.814102 IP 192.168.43.146.8880 > 192.168.43.147.7772: UDP, length 120
03:10:00.849363 IP 192.168.43.147.8880 > 192.168.43.124.7773: UDP, length 120
03:10:00.888846 IP 192.168.43.146.8880 > 192.168.43.147.7772: UDP, length 120
03:10:00.899365 IP 192.168.43.147.8880 > 192.168.43.124.7773: UDP, length 120
03:10:00.914120 IP 192.168.43.146.8880 > 192.168.43.147.7772: UDP, length 120
03:10:00.949366 IP 192.168.43.147.8880 > 192.168.43.124.7773: UDP, length 120
03:10:00.964276 IP 192.168.43.146.8880 > 192.168.43.147.7772: UDP, length 120
03:10:00.999368 IP 192.168.43.147.8880 > 192.168.43.124.7773: UDP, length 120
03:10:01.012206 IP 192.168.43.146.8880 > 192.168.43.147.7772: UDP, length 120
03:10:01.049402 IP 192.168.43.147.8880 > 192.168.43.124.7773: UDP, length 120
03:10:01.066384 IP 192.168.43.146.8880 > 192.168.43.147.7772: UDP, length 120
03:10:01.099366 IP 192.168.43.147.8880 > 192.168.43.124.7773: UDP, length 120
03:10:01.111962 IP 192.168.43.146.8880 > 192.168.43.147.7772: UDP, length 120
03:10:01.149362 IP 192.168.43.147.8880 > 192.168.43.124.7773: UDP, length 120
03:10:01.163748 IP 192.168.43.146.8880 > 192.168.43.147.7772: UDP, length 120
03:10:01.199364 IP 192.168.43.147.8880 > 192.168.43.124.7773: UDP, length 120
03:10:01.235861 IP 192.168.43.146.8880 > 192.168.43.147.7772: UDP, length 120
03:10:01.249362 IP 192.168.43.147.8880 > 192.168.43.124.7773: UDP, length 120
03:10:01.262355 IP 192.168.43.146.8880 > 192.168.43.147.7772: UDP, length 120
03:10:01.299364 IP 192.168.43.147.8880 > 192.168.43.124.7773: UDP, length 120
03:10:01.314378 IP 192.168.43.146.8880 > 192.168.43.147.7772: UDP, length 120
03:10:01.349362 IP 192.168.43.147.8880 > 192.168.43.124.7773: UDP, length 120
03:10:01.388016 IP 192.168.43.146.8880 > 192.168.43.147.7772: UDP, length 120
03:10:01.399364 IP 192.168.43.147.8880 > 192.168.43.124.7773: UDP, length 120
03:10:01.413562 IP 192.168.43.146.8880 > 192.168.43.147.7772: UDP, length 120
03:10:01.449370 IP 192.168.43.147.8880 > 192.168.43.124.7773: UDP, length 120
03:10:01.465220 IP 192.168.43.146.8880 > 192.168.43.147.7772: UDP, length 120
03:10:01.499366 IP 192.168.43.147.8880 > 192.168.43.124.7773: UDP, length 120
03:10:01.541861 IP 192.168.43.146.8880 > 192.168.43.147.7772: UDP, length 120
03:10:01.549364 IP 192.168.43.147.8880 > 192.168.43.124.7773: UDP, length 120
03:10:01.565113 IP 192.168.43.146.8880 > 192.168.43.147.7772: UDP, length 120
03:10:01.599364 IP 192.168.43.147.8880 > 192.168.43.124.7773: UDP, length 120
03:10:01.616506 IP 192.168.43.146.8880 > 192.168.43.147.7772: UDP, length 120
03:10:01.649363 IP 192.168.43.147.8880 > 192.168.43.124.7773: UDP, length 120
03:10:01.687953 IP 192.168.43.146.8880 > 192.168.43.147.7772: UDP, length 120
03:10:01.699363 IP 192.168.43.147.8880 > 192.168.43.124.7773: UDP, length 120
03:10:01.712536 IP 192.168.43.146.8880 > 192.168.43.147.7772: UDP, length 120
03:10:01.749362 IP 192.168.43.147.8880 > 192.168.43.124.7773: UDP, length 120
03:10:01.764232 IP 192.168.43.146.8880 > 192.168.43.147.7772: UDP, length 120
03:10:01.799410 IP 192.168.43.147.8880 > 192.168.43.124.7773: UDP, length 120
03:10:01.837668 IP 192.168.43.146.8880 > 192.168.43.147.7772: UDP, length 120
03:10:01.849371 IP 192.168.43.147.8880 > 192.168.43.124.7773: UDP, length 120
03:10:01.862262 IP 192.168.43.146.8880 > 192.168.43.147.7772: UDP, length 120
03:10:01.899399 IP 192.168.43.147.8880 > 192.168.43.124.7773: UDP, length 120
03:10:01.912999 IP 192.168.43.146.8880 > 192.168.43.147.7772: UDP, length 120
03:10:01.949393 IP 192.168.43.147.8880 > 192.168.43.124.7773: UDP, length 120
03:10:01.979010 IP 192.168.43.146.8880 > 192.168.43.147.7772: UDP, length 120
03:10:01.999405 IP 192.168.43.147.8880 > 192.168.43.124.7773: UDP, length 120
03:10:02.017475 IP 192.168.43.146.8880 > 192.168.43.147.7772: UDP, length 120
03:10:02.049394 IP 192.168.43.147.8880 > 192.168.43.124.7773: UDP, length 120
03:10:02.059396 IP 192.168.43.146.8880 > 192.168.43.147.7772: UDP, length 120
03:10:02.099391 IP 192.168.43.147.8880 > 192.168.43.124.7773: UDP, length 120
03:10:02.123163 IP 192.168.43.146.8880 > 192.168.43.147.7772: UDP, length 120
03:10:02.149388 IP 192.168.43.147.8880 > 192.168.43.124.7773: UDP, length 120
03:10:02.161982 IP 192.168.43.146.8880 > 192.168.43.147.7772: UDP, length 120
03:10:02.199402 IP 192.168.43.147.8880 > 192.168.43.124.7773: UDP, length 120
03:10:02.212428 IP 192.168.43.146.8880 > 192.168.43.147.7772: UDP, length 120
03:10:02.249391 IP 192.168.43.147.8880 > 192.168.43.124.7773: UDP, length 120
03:10:02.264588 IP 192.168.43.146.8880 > 192.168.43.147.7772: UDP, length 120
03:10:02.299391 IP 192.168.43.147.8880 > 192.168.43.124.7773: UDP, length 120
03:10:02.338005 IP 192.168.43.146.8880 > 192.168.43.147.7772: UDP, length 120
03:10:02.349388 IP 192.168.43.147.8880 > 192.168.43.124.7773: UDP, length 120
03:10:02.363483 IP 192.168.43.146.8880 > 192.168.43.147.7772: UDP, length 120
03:10:02.399393 IP 192.168.43.147.8880 > 192.168.43.124.7773: UDP, length 120
03:10:02.432737 IP 192.168.43.146.8880 > 192.168.43.147.7772: UDP, length 120
03:10:02.449401 IP 192.168.43.147.8880 > 192.168.43.124.7773: UDP, length 120
03:10:02.462320 IP 192.168.43.146.8880 > 192.168.43.147.7772: UDP, length 120
03:10:02.499396 IP 192.168.43.147.8880 > 192.168.43.124.7773: UDP, length 120
03:10:02.527799 IP 192.168.43.146.8880 > 192.168.43.147.7772: UDP, length 120
03:10:02.549393 IP 192.168.43.147.8880 > 192.168.43.124.7773: UDP, length 120
03:10:02.564666 IP 192.168.43.146.8880 > 192.168.43.147.7772: UDP, length 120
03:10:02.599392 IP 192.168.43.147.8880 > 192.168.43.124.7773: UDP, length 120
03:10:02.626431 IP 192.168.43.146.8880 > 192.168.43.147.7772: UDP, length 120
03:10:02.649393 IP 192.168.43.147.8880 > 192.168.43.124.7773: UDP, length 120
03:10:02.675359 IP 192.168.43.146.8880 > 192.168.43.147.7772: UDP, length 120
03:10:02.699390 IP 192.168.43.147.8880 > 192.168.43.124.7773: UDP, length 120
03:10:02.738932 IP 192.168.43.146.8880 > 192.168.43.147.7772: UDP, length 120
03:10:02.749388 IP 192.168.43.147.8880 > 192.168.43.124.7773: UDP, length 120
03:10:02.778078 IP 192.168.43.146.8880 > 192.168.43.147.7772: UDP, length 120
03:10:02.799389 IP 192.168.43.147.8880 > 192.168.43.124.7773: UDP, length 120
03:10:02.838097 IP 192.168.43.146.8880 > 192.168.43.147.7772: UDP, length 120
03:10:02.849387 IP 192.168.43.147.8880 > 192.168.43.124.7773: UDP, length 120
03:10:02.893663 IP 192.168.43.146.8880 > 192.168.43.147.7772: UDP, length 120
03:10:02.899390 IP 192.168.43.147.8880 > 192.168.43.124.7773: UDP, length 120
03:10:02.933568 IP 192.168.43.146.8880 > 192.168.43.147.7772: UDP, length 120
03:10:02.949388 IP 192.168.43.147.8880 > 192.168.43.124.7773: UDP, length 120
03:10:02.999390 IP 192.168.43.147.8880 > 192.168.43.124.7773: UDP, length 120
03:10:03.006079 IP 192.168.43.146.8880 > 192.168.43.147.7772: UDP, length 120
03:10:03.049401 IP 192.168.43.147.8880 > 192.168.43.124.7773: UDP, length 120
03:10:03.051669 IP 192.168.43.146.8880 > 192.168.43.147.7772: UDP, length 120
03:10:03.086925 IP 192.168.43.146.8880 > 192.168.43.147.7772: UDP, length 120
03:10:03.099395 IP 192.168.43.147.8880 > 192.168.43.124.7773: UDP, length 120
03:10:03.145031 IP 192.168.43.146.8880 > 192.168.43.147.7772: UDP, length 120
03:10:03.149388 IP 192.168.43.147.8880 > 192.168.43.124.7773: UDP, length 120
03:10:03.195354 IP 192.168.43.146.8880 > 192.168.43.147.7772: UDP, length 120
03:10:03.199390 IP 192.168.43.147.8880 > 192.168.43.124.7773: UDP, length 120
03:10:03.249386 IP 192.168.43.147.8880 > 192.168.43.124.7773: UDP, length 120
03:10:03.261135 IP 192.168.43.146.8880 > 192.168.43.147.7772: UDP, length 120
03:10:03.299448 IP 192.168.43.147.8880 > 192.168.43.124.7773: UDP, length 120
03:10:03.349396 IP 192.168.43.147.8880 > 192.168.43.124.7773: UDP, length 120
03:10:03.350101 IP 192.168.43.146.8880 > 192.168.43.147.7772: UDP, length 120
03:10:03.350244 IP 192.168.43.146.8880 > 192.168.43.147.7772: UDP, length 120
03:10:03.364964 IP 192.168.43.146.8880 > 192.168.43.147.7772: UDP, length 120
03:10:03.399396 IP 192.168.43.147.8880 > 192.168.43.124.7773: UDP, length 120
03:10:03.449396 IP 192.168.43.147.8880 > 192.168.43.124.7773: UDP, length 120
03:10:03.452419 IP 192.168.43.146.8880 > 192.168.43.147.7772: UDP, length 120
03:10:03.489747 IP 192.168.43.146.8880 > 192.168.43.147.7772: UDP, length 120
03:10:03.499393 IP 192.168.43.147.8880 > 192.168.43.124.7773: UDP, length 120
03:10:03.549392 IP 192.168.43.147.8880 > 192.168.43.124.7773: UDP, length 120
03:10:03.556389 IP 192.168.43.146.8880 > 192.168.43.147.7772: UDP, length 120
03:10:03.562842 IP 192.168.43.146.8880 > 192.168.43.147.7772: UDP, length 120
03:10:03.599389 IP 192.168.43.147.8880 > 192.168.43.124.7773: UDP, length 120
03:10:03.649387 IP 192.168.43.147.8880 > 192.168.43.124.7773: UDP, length 120
03:10:03.649424 IP 192.168.43.146.8880 > 192.168.43.147.7772: UDP, length 120
03:10:03.662395 IP 192.168.43.146.8880 > 192.168.43.147.7772: UDP, length 120
03:10:03.699392 IP 192.168.43.147.8880 > 192.168.43.124.7773: UDP, length 120
03:10:03.735644 IP 192.168.43.146.8880 > 192.168.43.147.7772: UDP, length 120
03:10:03.749388 IP 192.168.43.147.8880 > 192.168.43.124.7773: UDP, length 120
03:10:03.788567 IP 192.168.43.146.8880 > 192.168.43.147.7772: UDP, length 120
03:10:03.799389 IP 192.168.43.147.8880 > 192.168.43.124.7773: UDP, length 120
03:10:03.849388 IP 192.168.43.147.8880 > 192.168.43.124.7773: UDP, length 120
03:10:03.859895 IP 192.168.43.146.8880 > 192.168.43.147.7772: UDP, length 120
03:10:03.862170 IP 192.168.43.146.8880 > 192.168.43.147.7772: UDP, length 120
03:10:03.899391 IP 192.168.43.147.8880 > 192.168.43.124.7773: UDP, length 120
03:10:03.931762 IP 192.168.43.146.8880 > 192.168.43.147.7772: UDP, length 120
03:10:03.949389 IP 192.168.43.147.8880 > 192.168.43.124.7773: UDP, length 120
03:10:03.962439 IP 192.168.43.146.8880 > 192.168.43.147.7772: UDP, length 120
03:10:03.999390 IP 192.168.43.147.8880 > 192.168.43.124.7773: UDP, length 120
03:10:04.031904 IP 192.168.43.146.8880 > 192.168.43.147.7772: UDP, length 120
03:10:04.049388 IP 192.168.43.147.8880 > 192.168.43.124.7773: UDP, length 120
03:10:04.074244 IP 192.168.43.146.8880 > 192.168.43.147.7772: UDP, length 120
03:10:04.099395 IP 192.168.43.147.8880 > 192.168.43.124.7773: UDP, length 120
03:10:04.149391 IP 192.168.43.147.8880 > 192.168.43.124.7773: UDP, length 120
03:10:04.159613 IP 192.168.43.146.8880 > 192.168.43.147.7772: UDP, length 120
03:10:04.167261 IP 192.168.43.146.8880 > 192.168.43.147.7772: UDP, length 120
03:10:04.199396 IP 192.168.43.147.8880 > 192.168.43.124.7773: UDP, length 120
03:10:04.245030 IP 192.168.43.146.8880 > 192.168.43.147.7772: UDP, length 120
03:10:04.249390 IP 192.168.43.147.8880 > 192.168.43.124.7773: UDP, length 120
03:10:04.270990 IP 192.168.43.146.8880 > 192.168.43.147.7772: UDP, length 120
03:10:04.299391 IP 192.168.43.147.8880 > 192.168.43.124.7773: UDP, length 120
03:10:04.315604 IP 192.168.43.146.8880 > 192.168.43.147.7772: UDP, length 120
03:10:04.349391 IP 192.168.43.147.8880 > 192.168.43.124.7773: UDP, length 120
03:10:04.363061 IP 192.168.43.146.8880 > 192.168.43.147.7772: UDP, length 120
03:10:04.399391 IP 192.168.43.147.8880 > 192.168.43.124.7773: UDP, length 120
03:10:04.443516 IP 192.168.43.146.8880 > 192.168.43.147.7772: UDP, length 120
03:10:04.449410 IP 192.168.43.147.8880 > 192.168.43.124.7773: UDP, length 120
03:10:04.486184 IP 192.168.43.146.8880 > 192.168.43.147.7772: UDP, length 120
03:10:04.499402 IP 192.168.43.147.8880 > 192.168.43.124.7773: UDP, length 120
03:10:04.549391 IP 192.168.43.147.8880 > 192.168.43.124.7773: UDP, length 120
03:10:04.563719 IP 192.168.43.146.8880 > 192.168.43.147.7772: UDP, length 120
03:10:04.580730 IP 192.168.43.146.8880 > 192.168.43.147.7772: UDP, length 120
03:10:04.599394 IP 192.168.43.147.8880 > 192.168.43.124.7773: UDP, length 120
03:10:04.630086 IP 192.168.43.146.8880 > 192.168.43.147.7772: UDP, length 120
03:10:04.649516 IP 192.168.43.147.8880 > 192.168.43.124.7773: UDP, length 120
03:10:04.670525 IP 192.168.43.146.8880 > 192.168.43.147.7772: UDP, length 120
03:10:04.699444 IP 192.168.43.147.8880 > 192.168.43.124.7773: UDP, length 120
03:10:04.749431 IP 192.168.43.147.8880 > 192.168.43.124.7773: UDP, length 120
03:10:04.766507 IP 192.168.43.146.8880 > 192.168.43.147.7772: UDP, length 120
03:10:04.772728 IP 192.168.43.146.8880 > 192.168.43.147.7772: UDP, length 120
03:10:04.799436 IP 192.168.43.147.8880 > 192.168.43.124.7773: UDP, length 120
03:10:04.841045 IP 192.168.43.146.8880 > 192.168.43.147.7772: UDP, length 120
03:10:04.849436 IP 192.168.43.147.8880 > 192.168.43.124.7773: UDP, length 120
03:10:04.882972 IP 192.168.43.146.8880 > 192.168.43.147.7772: UDP, length 120
03:10:04.899447 IP 192.168.43.147.8880 > 192.168.43.124.7773: UDP, length 120
03:10:04.949429 IP 192.168.43.147.8880 > 192.168.43.124.7773: UDP, length 120
03:10:04.991492 IP 192.168.43.146.8880 > 192.168.43.147.7772: UDP, length 120
03:10:04.991616 IP 192.168.43.146.8880 > 192.168.43.147.7772: UDP, length 120
03:10:04.999437 IP 192.168.43.147.8880 > 192.168.43.124.7773: UDP, length 120
03:10:05.031000 IP 192.168.43.146.8880 > 192.168.43.147.7772: UDP, length 120
03:10:05.049454 IP 192.168.43.147.8880 > 192.168.43.124.7773: UDP, length 120
03:10:05.092157 IP 192.168.43.146.8880 > 192.168.43.147.7772: UDP, length 120
03:10:05.099405 IP 192.168.43.147.8880 > 192.168.43.124.7773: UDP, length 120
03:10:05.149368 IP 192.168.43.147.8880 > 192.168.43.124.7773: UDP, length 120
03:10:05.158377 IP 192.168.43.146.8880 > 192.168.43.147.7772: UDP, length 120
03:10:05.192834 IP 192.168.43.146.8880 > 192.168.43.147.7772: UDP, length 120
03:10:05.199375 IP 192.168.43.147.8880 > 192.168.43.124.7773: UDP, length 120
03:10:05.235645 IP 192.168.43.146.8880 > 192.168.43.147.7772: UDP, length 120
03:10:05.249368 IP 192.168.43.147.8880 > 192.168.43.124.7773: UDP, length 120
03:10:05.288549 IP 192.168.43.146.8880 > 192.168.43.147.7772: UDP, length 120
03:10:05.299363 IP 192.168.43.147.8880 > 192.168.43.124.7773: UDP, length 120
03:10:05.346857 IP 192.168.43.146.8880 > 192.168.43.147.7772: UDP, length 120
03:10:05.349362 IP 192.168.43.147.8880 > 192.168.43.124.7773: UDP, length 120
03:10:05.372279 IP 192.168.43.146.8880 > 192.168.43.147.7772: UDP, length 120
03:10:05.399367 IP 192.168.43.147.8880 > 192.168.43.124.7773: UDP, length 120
03:10:05.423009 IP 192.168.43.146.8880 > 192.168.43.147.7772: UDP, length 120
03:10:05.449370 IP 192.168.43.147.8880 > 192.168.43.124.7773: UDP, length 120
03:10:05.464021 IP 192.168.43.146.8880 > 192.168.43.147.7772: UDP, length 120
03:10:05.499365 IP 192.168.43.147.8880 > 192.168.43.124.7773: UDP, length 120
03:10:05.532449 IP 192.168.43.146.8880 > 192.168.43.147.7772: UDP, length 120
03:10:05.549364 IP 192.168.43.147.8880 > 192.168.43.124.7773: UDP, length 120
03:10:05.565798 IP 192.168.43.146.8880 > 192.168.43.147.7772: UDP, length 120
03:10:05.599363 IP 192.168.43.147.8880 > 192.168.43.124.7773: UDP, length 120
03:10:05.612829 IP 192.168.43.146.8880 > 192.168.43.147.7772: UDP, length 120
03:10:05.649367 IP 192.168.43.147.8880 > 192.168.43.124.7773: UDP, length 120
03:10:05.663698 IP 192.168.43.146.8880 > 192.168.43.147.7772: UDP, length 120
03:10:05.699365 IP 192.168.43.147.8880 > 192.168.43.124.7773: UDP, length 120
03:10:05.717109 IP 192.168.43.146.8880 > 192.168.43.147.7772: UDP, length 120
03:10:05.749362 IP 192.168.43.147.8880 > 192.168.43.124.7773: UDP, length 120
03:10:05.766118 IP 192.168.43.146.8880 > 192.168.43.147.7772: UDP, length 120
03:10:05.799365 IP 192.168.43.147.8880 > 192.168.43.124.7773: UDP, length 120
03:10:05.822838 IP 192.168.43.146.8880 > 192.168.43.147.7772: UDP, length 120
03:10:05.849362 IP 192.168.43.147.8880 > 192.168.43.124.7773: UDP, length 120
03:10:05.862534 IP 192.168.43.146.8880 > 192.168.43.147.7772: UDP, length 120
03:10:05.899364 IP 192.168.43.147.8880 > 192.168.43.124.7773: UDP, length 120
03:10:05.909351 IP 192.168.43.146.8880 > 192.168.43.147.7772: UDP, length 120
03:10:05.949363 IP 192.168.43.147.8880 > 192.168.43.124.7773: UDP, length 120
03:10:05.965965 IP 192.168.43.146.8880 > 192.168.43.147.7772: UDP, length 120
03:10:05.999364 IP 192.168.43.147.8880 > 192.168.43.124.7773: UDP, length 120
03:10:06.011787 IP 192.168.43.146.8880 > 192.168.43.147.7772: UDP, length 120
03:10:06.049362 IP 192.168.43.147.8880 > 192.168.43.124.7773: UDP, length 120
03:10:06.059666 IP 192.168.43.146.8880 > 192.168.43.147.7772: UDP, length 120
03:10:06.099363 IP 192.168.43.147.8880 > 192.168.43.124.7773: UDP, length 120
03:10:06.114501 IP 192.168.43.146.8880 > 192.168.43.147.7772: UDP, length 120
03:10:06.149366 IP 192.168.43.147.8880 > 192.168.43.124.7773: UDP, length 120
03:10:06.162430 IP 192.168.43.146.8880 > 192.168.43.147.7772: UDP, length 120
03:10:06.199363 IP 192.168.43.147.8880 > 192.168.43.124.7773: UDP, length 120
03:10:06.213287 IP 192.168.43.146.8880 > 192.168.43.147.7772: UDP, length 120
03:10:06.249370 IP 192.168.43.147.8880 > 192.168.43.124.7773: UDP, length 120
03:10:06.263981 IP 192.168.43.146.8880 > 192.168.43.147.7772: UDP, length 120
03:10:06.299413 IP 192.168.43.147.8880 > 192.168.43.124.7773: UDP, length 120
03:10:06.337053 IP 192.168.43.146.8880 > 192.168.43.147.7772: UDP, length 120
03:10:06.349376 IP 192.168.43.147.8880 > 192.168.43.124.7773: UDP, length 120
03:10:06.366420 IP 192.168.43.146.8880 > 192.168.43.147.7772: UDP, length 120
03:10:06.399364 IP 192.168.43.147.8880 > 192.168.43.124.7773: UDP, length 120
03:10:06.409608 IP 192.168.43.146.8880 > 192.168.43.147.7772: UDP, length 120
03:10:06.449368 IP 192.168.43.147.8880 > 192.168.43.124.7773: UDP, length 120
03:10:06.476066 IP 192.168.43.146.8880 > 192.168.43.147.7772: UDP, length 120
03:10:06.499366 IP 192.168.43.147.8880 > 192.168.43.124.7773: UDP, length 120
03:10:06.521352 IP 192.168.43.146.8880 > 192.168.43.147.7772: UDP, length 120
03:10:06.549365 IP 192.168.43.147.8880 > 192.168.43.124.7773: UDP, length 120
03:10:06.560527 IP 192.168.43.146.8880 > 192.168.43.147.7772: UDP, length 120
03:10:06.599362 IP 192.168.43.147.8880 > 192.168.43.124.7773: UDP, length 120
03:10:06.613587 IP 192.168.43.146.8880 > 192.168.43.147.7772: UDP, length 120
03:10:06.649364 IP 192.168.43.147.8880 > 192.168.43.124.7773: UDP, length 120
03:10:06.688297 IP 192.168.43.146.8880 > 192.168.43.147.7772: UDP, length 120
03:10:06.699363 IP 192.168.43.147.8880 > 192.168.43.124.7773: UDP, length 120
03:10:06.712946 IP 192.168.43.146.8880 > 192.168.43.147.7772: UDP, length 120
03:10:06.749363 IP 192.168.43.147.8880 > 192.168.43.124.7773: UDP, length 120
03:10:06.759789 IP 192.168.43.146.8880 > 192.168.43.147.7772: UDP, length 120
03:10:06.799363 IP 192.168.43.147.8880 > 192.168.43.124.7773: UDP, length 120
03:10:06.828036 IP 192.168.43.146.8880 > 192.168.43.147.7772: UDP, length 120
03:10:06.849364 IP 192.168.43.147.8880 > 192.168.43.124.7773: UDP, length 120
03:10:06.862319 IP 192.168.43.146.8880 > 192.168.43.147.7772: UDP, length 120
03:10:06.899392 IP 192.168.43.147.8880 > 192.168.43.124.7773: UDP, length 120
03:10:06.910376 IP 192.168.43.146.8880 > 192.168.43.147.7772: UDP, length 120
03:10:06.949393 IP 192.168.43.147.8880 > 192.168.43.124.7773: UDP, length 120
03:10:06.964387 IP 192.168.43.146.8880 > 192.168.43.147.7772: UDP, length 120
03:10:06.999390 IP 192.168.43.147.8880 > 192.168.43.124.7773: UDP, length 120
03:10:07.037049 IP 192.168.43.146.8880 > 192.168.43.147.7772: UDP, length 120
03:10:07.049391 IP 192.168.43.147.8880 > 192.168.43.124.7773: UDP, length 120
03:10:07.062777 IP 192.168.43.146.8880 > 192.168.43.147.7772: UDP, length 120
03:10:07.099391 IP 192.168.43.147.8880 > 192.168.43.124.7773: UDP, length 120
03:10:07.109203 IP 192.168.43.146.8880 > 192.168.43.147.7772: UDP, length 120
03:10:07.149399 IP 192.168.43.147.8880 > 192.168.43.124.7773: UDP, length 120
03:10:07.177469 IP 192.168.43.146.8880 > 192.168.43.147.7772: UDP, length 120
03:10:07.199395 IP 192.168.43.147.8880 > 192.168.43.124.7773: UDP, length 120
03:10:07.213153 IP 192.168.43.146.8880 > 192.168.43.147.7772: UDP, length 120
03:10:07.249392 IP 192.168.43.147.8880 > 192.168.43.124.7773: UDP, length 120
03:10:07.262797 IP 192.168.43.146.8880 > 192.168.43.147.7772: UDP, length 120
03:10:07.299394 IP 192.168.43.147.8880 > 192.168.43.124.7773: UDP, length 120
03:10:07.322787 IP 192.168.43.146.8880 > 192.168.43.147.7772: UDP, length 120
03:10:07.349396 IP 192.168.43.147.8880 > 192.168.43.124.7773: UDP, length 120
03:10:07.366634 IP 192.168.43.146.8880 > 192.168.43.147.7772: UDP, length 120
03:10:07.399392 IP 192.168.43.147.8880 > 192.168.43.124.7773: UDP, length 120
03:10:07.409408 IP 192.168.43.146.8880 > 192.168.43.147.7772: UDP, length 120
03:10:07.449401 IP 192.168.43.147.8880 > 192.168.43.124.7773: UDP, length 120
03:10:07.472598 IP 192.168.43.146.8880 > 192.168.43.147.7772: UDP, length 120
03:10:07.499395 IP 192.168.43.147.8880 > 192.168.43.124.7773: UDP, length 120
03:10:07.538887 IP 192.168.43.146.8880 > 192.168.43.147.7772: UDP, length 120
03:10:07.549393 IP 192.168.43.147.8880 > 192.168.43.124.7773: UDP, length 120
03:10:07.562624 IP 192.168.43.146.8880 > 192.168.43.147.7772: UDP, length 120
03:10:07.599392 IP 192.168.43.147.8880 > 192.168.43.124.7773: UDP, length 120
03:10:07.639988 IP 192.168.43.146.8880 > 192.168.43.147.7772: UDP, length 120
03:10:07.649393 IP 192.168.43.147.8880 > 192.168.43.124.7773: UDP, length 120
03:10:07.693520 IP 192.168.43.146.8880 > 192.168.43.147.7772: UDP, length 120
03:10:07.699392 IP 192.168.43.147.8880 > 192.168.43.124.7773: UDP, length 120
03:10:07.720699 IP 192.168.43.146.8880 > 192.168.43.147.7772: UDP, length 120
03:10:07.749391 IP 192.168.43.147.8880 > 192.168.43.124.7773: UDP, length 120
03:10:07.759853 IP 192.168.43.146.8880 > 192.168.43.147.7772: UDP, length 120
03:10:07.799516 IP 192.168.43.147.8880 > 192.168.43.124.7773: UDP, length 120
03:10:07.827398 IP 192.168.43.146.8880 > 192.168.43.147.7772: UDP, length 120
03:10:07.849422 IP 192.168.43.147.8880 > 192.168.43.124.7773: UDP, length 120
03:10:07.863201 IP 192.168.43.146.8880 > 192.168.43.147.7772: UDP, length 120
03:10:07.899395 IP 192.168.43.147.8880 > 192.168.43.124.7773: UDP, length 120
03:10:07.925540 IP 192.168.43.146.8880 > 192.168.43.147.7772: UDP, length 120
03:10:07.949389 IP 192.168.43.147.8880 > 192.168.43.124.7773: UDP, length 120
03:10:07.965043 IP 192.168.43.146.8880 > 192.168.43.147.7772: UDP, length 120
03:10:07.999386 IP 192.168.43.147.8880 > 192.168.43.124.7773: UDP, length 120
03:10:08.038250 IP 192.168.43.146.8880 > 192.168.43.147.7772: UDP, length 120
03:10:08.049385 IP 192.168.43.147.8880 > 192.168.43.124.7773: UDP, length 120
03:10:08.063352 IP 192.168.43.146.8880 > 192.168.43.147.7772: UDP, length 120
03:10:08.099385 IP 192.168.43.147.8880 > 192.168.43.124.7773: UDP, length 120
03:10:08.111236 IP 192.168.43.146.8880 > 192.168.43.147.7772: UDP, length 120
03:10:08.149385 IP 192.168.43.147.8880 > 192.168.43.124.7773: UDP, length 120
03:10:08.177920 IP 192.168.43.146.8880 > 192.168.43.147.7772: UDP, length 120
03:10:08.199388 IP 192.168.43.147.8880 > 192.168.43.124.7773: UDP, length 120
03:10:08.246247 IP 192.168.43.146.8880 > 192.168.43.147.7772: UDP, length 120
03:10:08.249387 IP 192.168.43.147.8880 > 192.168.43.124.7773: UDP, length 120
03:10:08.262040 IP 192.168.43.146.8880 > 192.168.43.147.7772: UDP, length 120
03:10:08.299386 IP 192.168.43.147.8880 > 192.168.43.124.7773: UDP, length 120
03:10:08.334659 IP 192.168.43.146.8880 > 192.168.43.147.7772: UDP, length 120
03:10:08.349387 IP 192.168.43.147.8880 > 192.168.43.124.7773: UDP, length 120
03:10:08.387409 IP 192.168.43.146.8880 > 192.168.43.147.7772: UDP, length 120
03:10:08.399398 IP 192.168.43.147.8880 > 192.168.43.124.7773: UDP, length 120
03:10:08.449388 IP 192.168.43.147.8880 > 192.168.43.124.7773: UDP, length 120
03:10:08.454585 IP 192.168.43.146.8880 > 192.168.43.147.7772: UDP, length 120
03:10:08.473084 IP 192.168.43.146.8880 > 192.168.43.147.7772: UDP, length 120
03:10:08.499391 IP 192.168.43.147.8880 > 192.168.43.124.7773: UDP, length 120
03:10:08.537397 IP 192.168.43.146.8880 > 192.168.43.147.7772: UDP, length 120
03:10:08.549388 IP 192.168.43.147.8880 > 192.168.43.124.7773: UDP, length 120
03:10:08.573727 IP 192.168.43.146.8880 > 192.168.43.147.7772: UDP, length 120
03:10:08.599387 IP 192.168.43.147.8880 > 192.168.43.124.7773: UDP, length 120
03:10:08.649388 IP 192.168.43.147.8880 > 192.168.43.124.7773: UDP, length 120
03:10:08.676069 IP 192.168.43.146.8880 > 192.168.43.147.7772: UDP, length 120
03:10:08.676306 IP 192.168.43.146.8880 > 192.168.43.147.7772: UDP, length 120
03:10:08.699388 IP 192.168.43.147.8880 > 192.168.43.124.7773: UDP, length 120
03:10:08.741383 IP 192.168.43.146.8880 > 192.168.43.147.7772: UDP, length 120
03:10:08.749385 IP 192.168.43.147.8880 > 192.168.43.124.7773: UDP, length 120
03:10:08.777256 IP 192.168.43.146.8880 > 192.168.43.147.7772: UDP, length 120
03:10:08.799385 IP 192.168.43.147.8880 > 192.168.43.124.7773: UDP, length 120
03:10:08.815997 IP 192.168.43.146.8880 > 192.168.43.147.7772: UDP, length 120
03:10:08.849384 IP 192.168.43.147.8880 > 192.168.43.124.7773: UDP, length 120
03:10:08.876426 IP 192.168.43.146.8880 > 192.168.43.147.7772: UDP, length 120
03:10:08.899386 IP 192.168.43.147.8880 > 192.168.43.124.7773: UDP, length 120
03:10:08.949385 IP 192.168.43.147.8880 > 192.168.43.124.7773: UDP, length 120
03:10:08.984148 IP 192.168.43.146.8880 > 192.168.43.147.7772: UDP, length 120
03:10:08.984378 IP 192.168.43.146.8880 > 192.168.43.147.7772: UDP, length 120
03:10:08.999385 IP 192.168.43.147.8880 > 192.168.43.124.7773: UDP, length 120
03:10:09.023926 IP 192.168.43.146.8880 > 192.168.43.147.7772: UDP, length 120
03:10:09.049386 IP 192.168.43.147.8880 > 192.168.43.124.7773: UDP, length 120
03:10:09.059496 IP 192.168.43.146.8880 > 192.168.43.147.7772: UDP, length 120
03:10:09.099386 IP 192.168.43.147.8880 > 192.168.43.124.7773: UDP, length 120
03:10:09.126469 IP 192.168.43.146.8880 > 192.168.43.147.7772: UDP, length 120
03:10:09.149386 IP 192.168.43.147.8880 > 192.168.43.124.7773: UDP, length 120
03:10:09.197375 IP 192.168.43.146.8880 > 192.168.43.147.7772: UDP, length 120
03:10:09.199385 IP 192.168.43.147.8880 > 192.168.43.124.7773: UDP, length 120
03:10:09.229525 IP 192.168.43.146.8880 > 192.168.43.147.7772: UDP, length 120
03:10:09.249384 IP 192.168.43.147.8880 > 192.168.43.124.7773: UDP, length 120
03:10:09.285822 IP 192.168.43.146.8880 > 192.168.43.147.7772: UDP, length 120
03:10:09.299386 IP 192.168.43.147.8880 > 192.168.43.124.7773: UDP, length 120
03:10:09.341423 IP 192.168.43.146.8880 > 192.168.43.147.7772: UDP, length 120
03:10:09.349419 IP 192.168.43.147.8880 > 192.168.43.124.7773: UDP, length 120
03:10:09.383971 IP 192.168.43.146.8880 > 192.168.43.147.7772: UDP, length 120
03:10:09.399400 IP 192.168.43.147.8880 > 192.168.43.124.7773: UDP, length 120
03:10:09.436980 IP 192.168.43.146.8880 > 192.168.43.147.7772: UDP, length 120
03:10:09.449401 IP 192.168.43.147.8880 > 192.168.43.124.7773: UDP, length 120
03:10:09.496978 IP 192.168.43.146.8880 > 192.168.43.147.7772: UDP, length 120
03:10:09.499388 IP 192.168.43.147.8880 > 192.168.43.124.7773: UDP, length 120
03:10:09.510273 IP 192.168.43.146.8880 > 192.168.43.147.7772: UDP, length 120
03:10:09.549386 IP 192.168.43.147.8880 > 192.168.43.124.7773: UDP, length 120
03:10:09.597699 IP 192.168.43.146.8880 > 192.168.43.147.7772: UDP, length 120
03:10:09.599384 IP 192.168.43.147.8880 > 192.168.43.124.7773: UDP, length 120
03:10:09.612934 IP 192.168.43.146.8880 > 192.168.43.147.7772: UDP, length 120
03:10:09.649389 IP 192.168.43.147.8880 > 192.168.43.124.7773: UDP, length 120
03:10:09.662282 IP 192.168.43.146.8880 > 192.168.43.147.7772: UDP, length 120
03:10:09.699390 IP 192.168.43.147.8880 > 192.168.43.124.7773: UDP, length 120
03:10:09.713786 IP 192.168.43.146.8880 > 192.168.43.147.7772: UDP, length 120
03:10:09.749387 IP 192.168.43.147.8880 > 192.168.43.124.7773: UDP, length 120
03:10:09.766700 IP 192.168.43.146.8880 > 192.168.43.147.7772: UDP, length 120
03:10:09.799384 IP 192.168.43.147.8880 > 192.168.43.124.7773: UDP, length 120
03:10:09.839799 IP 192.168.43.146.8880 > 192.168.43.147.7772: UDP, length 120
03:10:09.849415 IP 192.168.43.147.8880 > 192.168.43.124.7773: UDP, length 120
03:10:09.899389 IP 192.168.43.147.8880 > 192.168.43.124.7773: UDP, length 120
03:10:09.907487 IP 192.168.43.146.8880 > 192.168.43.147.7772: UDP, length 120
03:10:09.923068 IP 192.168.43.146.8880 > 192.168.43.147.7772: UDP, length 120
03:10:09.949388 IP 192.168.43.147.8880 > 192.168.43.124.7773: UDP, length 120
03:10:09.993142 IP 192.168.43.146.8880 > 192.168.43.147.7772: UDP, length 120
03:10:09.999385 IP 192.168.43.147.8880 > 192.168.43.124.7773: UDP, length 120
03:10:10.022948 IP 192.168.43.146.8880 > 192.168.43.147.7772: UDP, length 120
03:10:10.049385 IP 192.168.43.147.8880 > 192.168.43.124.7773: UDP, length 120
03:10:10.075075 IP 192.168.43.146.8880 > 192.168.43.147.7772: UDP, length 120
03:10:10.099492 IP 192.168.43.147.8880 > 192.168.43.124.7773: UDP, length 120
03:10:10.146024 IP 192.168.43.146.8880 > 192.168.43.147.7772: UDP, length 120
03:10:10.149482 IP 192.168.43.147.8880 > 192.168.43.124.7773: UDP, length 120
03:10:10.161590 IP 192.168.43.146.8880 > 192.168.43.147.7772: UDP, length 120
03:10:10.199441 IP 192.168.43.147.8880 > 192.168.43.124.7773: UDP, length 120
03:10:10.221344 IP 192.168.43.146.8880 > 192.168.43.147.7772: UDP, length 120
03:10:10.249408 IP 192.168.43.147.8880 > 192.168.43.124.7773: UDP, length 120
03:10:10.299458 IP 192.168.43.147.8880 > 192.168.43.124.7773: UDP, length 120
03:10:10.302902 IP 192.168.43.146.8880 > 192.168.43.147.7772: UDP, length 120
03:10:10.312332 IP 192.168.43.146.8880 > 192.168.43.147.7772: UDP, length 120
03:10:10.349449 IP 192.168.43.147.8880 > 192.168.43.124.7773: UDP, length 120
03:10:10.363617 IP 192.168.43.146.8880 > 192.168.43.147.7772: UDP, length 120
03:10:10.399482 IP 192.168.43.147.8880 > 192.168.43.124.7773: UDP, length 120
03:10:10.437395 IP 192.168.43.146.8880 > 192.168.43.147.7772: UDP, length 120
03:10:10.449442 IP 192.168.43.147.8880 > 192.168.43.124.7773: UDP, length 120
03:10:10.499434 IP 192.168.43.147.8880 > 192.168.43.124.7773: UDP, length 120
03:10:10.506512 IP 192.168.43.146.8880 > 192.168.43.147.7772: UDP, length 120
03:10:10.516625 IP 192.168.43.146.8880 > 192.168.43.147.7772: UDP, length 120
03:10:10.549414 IP 192.168.43.147.8880 > 192.168.43.124.7773: UDP, length 120
03:10:10.587175 IP 192.168.43.146.8880 > 192.168.43.147.7772: UDP, length 120
03:10:10.599375 IP 192.168.43.147.8880 > 192.168.43.124.7773: UDP, length 120
03:10:10.649363 IP 192.168.43.147.8880 > 192.168.43.124.7773: UDP, length 120
03:10:10.670740 IP 192.168.43.146.8880 > 192.168.43.147.7772: UDP, length 120
03:10:10.699363 IP 192.168.43.147.8880 > 192.168.43.124.7773: UDP, length 120
03:10:10.725563 IP 192.168.43.146.8880 > 192.168.43.147.7772: UDP, length 120
03:10:10.749363 IP 192.168.43.147.8880 > 192.168.43.124.7773: UDP, length 120
03:10:10.770603 IP 192.168.43.146.8880 > 192.168.43.147.7772: UDP, length 120
03:10:10.799362 IP 192.168.43.147.8880 > 192.168.43.124.7773: UDP, length 120
03:10:10.820680 IP 192.168.43.146.8880 > 192.168.43.147.7772: UDP, length 120
03:10:10.849389 IP 192.168.43.147.8880 > 192.168.43.124.7773: UDP, length 120
03:10:10.864533 IP 192.168.43.146.8880 > 192.168.43.147.7772: UDP, length 120
