23:09:57.693683 IP 192.168.43.147.8880 > 192.168.43.124.7773: UDP, length 120
23:09:57.738544 IP 192.168.43.147.8880 > 192.168.43.124.7773: UDP, length 120
23:09:57.788065 IP 192.168.43.147.8880 > 192.168.43.124.7773: UDP, length 120
23:09:57.828293 IP 192.168.43.147.8880 > 192.168.43.124.7773: UDP, length 120
23:09:57.889846 IP 192.168.43.147.8880 > 192.168.43.124.7773: UDP, length 120
23:09:57.928728 IP 192.168.43.147.8880 > 192.168.43.124.7773: UDP, length 120
23:09:57.989193 IP 192.168.43.147.8880 > 192.168.43.124.7773: UDP, length 120
23:09:58.029831 IP 192.168.43.147.8880 > 192.168.43.124.7773: UDP, length 120
23:09:58.089082 IP 192.168.43.147.8880 > 192.168.43.124.7773: UDP, length 120
23:09:58.131711 IP 192.168.43.147.8880 > 192.168.43.124.7773: UDP, length 120
23:09:58.189117 IP 192.168.43.147.8880 > 192.168.43.124.7773: UDP, length 120
23:09:58.229430 IP 192.168.43.147.8880 > 192.168.43.124.7773: UDP, length 120
23:09:58.318618 IP 192.168.43.147.8880 > 192.168.43.124.7773: UDP, length 120
23:09:58.329248 IP 192.168.43.147.8880 > 192.168.43.124.7773: UDP, length 120
23:09:58.389563 IP 192.168.43.147.8880 > 192.168.43.124.7773: UDP, length 120
23:09:58.430454 IP 192.168.43.147.8880 > 192.168.43.124.7773: UDP, length 120
23:09:58.488601 IP 192.168.43.147.8880 > 192.168.43.124.7773: UDP, length 120
23:09:58.528097 IP 192.168.43.147.8880 > 192.168.43.124.7773: UDP, length 120
23:09:58.590678 IP 192.168.43.147.8880 > 192.168.43.124.7773: UDP, length 120
23:09:58.630495 IP 192.168.43.147.8880 > 192.168.43.124.7773: UDP, length 120
23:09:58.678502 IP 192.168.43.147.8880 > 192.168.43.124.7773: UDP, length 120
23:09:58.750169 IP 192.168.43.147.8880 > 192.168.43.124.7773: UDP, length 120
23:09:58.785222 IP 192.168.43.147.8880 > 192.168.43.124.7773: UDP, length 120
23:09:58.839501 IP 192.168.43.147.8880 > 192.168.43.124.7773: UDP, length 120
23:09:58.877883 IP 192.168.43.147.8880 > 192.168.43.124.7773: UDP, length 120
23:09:58.927730 IP 192.168.43.147.8880 > 192.168.43.124.7773: UDP, length 120
23:09:58.989777 IP 192.168.43.147.8880 > 192.168.43.124.7773: UDP, length 120
23:09:59.030057 IP 192.168.43.147.8880 > 192.168.43.124.7773: UDP, length 120
23:09:59.082658 IP 192.168.43.147.8880 > 192.168.43.124.7773: UDP, length 120
23:09:59.147073 IP 192.168.43.147.8880 > 192.168.43.124.7773: UDP, length 120
23:09:59.176758 IP 192.168.43.147.8880 > 192.168.43.124.7773: UDP, length 120
23:09:59.240353 IP 192.168.43.147.8880 > 192.168.43.124.7773: UDP, length 120
23:09:59.278790 IP 192.168.43.147.8880 > 192.168.43.124.7773: UDP, length 120
23:09:59.327920 IP 192.168.43.147.8880 > 192.168.43.124.7773: UDP, length 120
23:09:59.385504 IP 192.168.43.147.8880 > 192.168.43.124.7773: UDP, length 120
23:09:59.425461 IP 192.168.43.147.8880 > 192.168.43.124.7773: UDP, length 120
23:09:59.480850 IP 192.168.43.147.8880 > 192.168.43.124.7773: UDP, length 120
23:09:59.539495 IP 192.168.43.147.8880 > 192.168.43.124.7773: UDP, length 120
23:09:59.583235 IP 192.168.43.147.8880 > 192.168.43.124.7773: UDP, length 120
23:09:59.628808 IP 192.168.43.147.8880 > 192.168.43.124.7773: UDP, length 120
23:09:59.685217 IP 192.168.43.147.8880 > 192.168.43.124.7773: UDP, length 120
23:09:59.727457 IP 192.168.43.147.8880 > 192.168.43.124.7773: UDP, length 120
23:09:59.787036 IP 192.168.43.147.8880 > 192.168.43.124.7773: UDP, length 120
23:09:59.828311 IP 192.168.43.147.8880 > 192.168.43.124.7773: UDP, length 120
23:09:59.888886 IP 192.168.43.147.8880 > 192.168.43.124.7773: UDP, length 120
23:09:59.937992 IP 192.168.43.147.8880 > 192.168.43.124.7773: UDP, length 120
23:09:59.978457 IP 192.168.43.147.8880 > 192.168.43.124.7773: UDP, length 120
23:10:00.029824 IP 192.168.43.147.8880 > 192.168.43.124.7773: UDP, length 120
23:10:00.094370 IP 192.168.43.147.8880 > 192.168.43.124.7773: UDP, length 120
23:10:00.129159 IP 192.168.43.147.8880 > 192.168.43.124.7773: UDP, length 120
23:10:00.179961 IP 192.168.43.147.8880 > 192.168.43.124.7773: UDP, length 120
23:10:00.238512 IP 192.168.43.147.8880 > 192.168.43.124.7773: UDP, length 120
23:10:00.281629 IP 192.168.43.147.8880 > 192.168.43.124.7773: UDP, length 120
23:10:00.330082 IP 192.168.43.147.8880 > 192.168.43.124.7773: UDP, length 120
23:10:00.388898 IP 192.168.43.147.8880 > 192.168.43.124.7773: UDP, length 120
23:10:00.428849 IP 192.168.43.147.8880 > 192.168.43.124.7773: UDP, length 120
23:10:00.478735 IP 192.168.43.147.8880 > 192.168.43.124.7773: UDP, length 120
23:10:00.538278 IP 192.168.43.147.8880 > 192.168.43.124.7773: UDP, length 120
23:10:00.578523 IP 192.168.43.147.8880 > 192.168.43.124.7773: UDP, length 120
23:10:00.629323 IP 192.168.43.147.8880 > 192.168.43.124.7773: UDP, length 120
23:10:00.690716 IP 192.168.43.147.8880 > 192.168.43.124.7773: UDP, length 120
23:10:00.731520 IP 192.168.43.147.8880 > 192.168.43.124.7773: UDP, length 120
23:10:00.778336 IP 192.168.43.147.8880 > 192.168.43.124.7773: UDP, length 120
23:10:00.834576 IP 192.168.43.147.8880 > 192.168.43.124.7773: UDP, length 120
23:10:00.880798 IP 192.168.43.147.8880 > 192.168.43.124.7773: UDP, length 120
23:10:00.938420 IP 192.168.43.147.8880 > 192.168.43.124.7773: UDP, length 120
23:10:00.978734 IP 192.168.43.147.8880 > 192.168.43.124.7773: UDP, length 120
23:10:01.025722 IP 192.168.43.147.8880 > 192.168.43.124.7773: UDP, length 120
23:10:01.087680 IP 192.168.43.147.8880 > 192.168.43.124.7773: UDP, length 120
23:10:01.128316 IP 192.168.43.147.8880 > 192.168.43.124.7773: UDP, length 120
23:10:01.190455 IP 192.168.43.147.8880 > 192.168.43.124.7773: UDP, length 120
23:10:01.231042 IP 192.168.43.147.8880 > 192.168.43.124.7773: UDP, length 120
23:10:01.288586 IP 192.168.43.147.8880 > 192.168.43.124.7773: UDP, length 120
23:10:01.328909 IP 192.168.43.147.8880 > 192.168.43.124.7773: UDP, length 120
23:10:01.379120 IP 192.168.43.147.8880 > 192.168.43.124.7773: UDP, length 120
23:10:01.439079 IP 192.168.43.147.8880 > 192.168.43.124.7773: UDP, length 120
23:10:01.478413 IP 192.168.43.147.8880 > 192.168.43.124.7773: UDP, length 120
23:10:01.527894 IP 192.168.43.147.8880 > 192.168.43.124.7773: UDP, length 120
23:10:01.588002 IP 192.168.43.147.8880 > 192.168.43.124.7773: UDP, length 120
23:10:01.631292 IP 192.168.43.147.8880 > 192.168.43.124.7773: UDP, length 120
23:10:01.675972 IP 192.168.43.147.8880 > 192.168.43.124.7773: UDP, length 120
23:10:01.740829 IP 192.168.43.147.8880 > 192.168.43.124.7773: UDP, length 120
23:10:01.779992 IP 192.168.43.147.8880 > 192.168.43.124.7773: UDP, length 120
23:10:01.834465 IP 192.168.43.147.8880 > 192.168.43.124.7773: UDP, length 120
23:10:01.888388 IP 192.168.43.147.8880 > 192.168.43.124.7773: UDP, length 120
23:10:01.936841 IP 192.168.43.147.8880 > 192.168.43.124.7773: UDP, length 120
23:10:01.956180 IP 192.168.43.124.8880 > 192.168.43.146.7771: UDP, length 120
23:10:01.976855 IP 192.168.43.147.8880 > 192.168.43.124.7773: UDP, length 120
23:10:02.006326 IP 192.168.43.124.8880 > 192.168.43.146.7771: UDP, length 120
23:10:02.037080 IP 192.168.43.147.8880 > 192.168.43.124.7773: UDP, length 120
23:10:02.056286 IP 192.168.43.124.8880 > 192.168.43.146.7771: UDP, length 120
23:10:02.100143 IP 192.168.43.147.8880 > 192.168.43.124.7773: UDP, length 120
23:10:02.106324 IP 192.168.43.124.8880 > 192.168.43.146.7771: UDP, length 120
23:10:02.129852 IP 192.168.43.147.8880 > 192.168.43.124.7773: UDP, length 120
23:10:02.156327 IP 192.168.43.124.8880 > 192.168.43.146.7771: UDP, length 120
23:10:02.179498 IP 192.168.43.147.8880 > 192.168.43.124.7773: UDP, length 120
23:10:02.206326 IP 192.168.43.124.8880 > 192.168.43.146.7771: UDP, length 120
23:10:02.244336 IP 192.168.43.147.8880 > 192.168.43.124.7773: UDP, length 120
23:10:02.256326 IP 192.168.43.124.8880 > 192.168.43.146.7771: UDP, length 120
23:10:02.285198 IP 192.168.43.147.8880 > 192.168.43.124.7773: UDP, length 120
23:10:02.306326 IP 192.168.43.124.8880 > 192.168.43.146.7771: UDP, length 120
23:10:02.330179 IP 192.168.43.147.8880 > 192.168.43.124.7773: UDP, length 120
23:10:02.356326 IP 192.168.43.124.8880 > 192.168.43.146.7771: UDP, length 120
23:10:02.388847 IP 192.168.43.147.8880 > 192.168.43.124.7773: UDP, length 120
23:10:02.406272 IP 192.168.43.124.8880 > 192.168.43.146.7771: UDP, length 120
23:10:02.428857 IP 192.168.43.147.8880 > 192.168.43.124.7773: UDP, length 120
23:10:02.456265 IP 192.168.43.124.8880 > 192.168.43.146.7771: UDP, length 120
23:10:02.475704 IP 192.168.43.147.8880 > 192.168.43.124.7773: UDP, length 120
23:10:02.506249 IP 192.168.43.124.8880 > 192.168.43.146.7771: UDP, length 120
23:10:02.552987 IP 192.168.43.147.8880 > 192.168.43.124.7773: UDP, length 120
23:10:02.556326 IP 192.168.43.124.8880 > 192.168.43.146.7771: UDP, length 120
23:10:02.578506 IP 192.168.43.147.8880 > 192.168.43.124.7773: UDP, length 120
23:10:02.606325 IP 192.168.43.124.8880 > 192.168.43.146.7771: UDP, length 120
23:10:02.625708 IP 192.168.43.147.8880 > 192.168.43.124.7773: UDP, length 120
23:10:02.656326 IP 192.168.43.124.8880 > 192.168.43.146.7771: UDP, length 120
23:10:02.678705 IP 192.168.43.147.8880 > 192.168.43.124.7773: UDP, length 120
23:10:02.706326 IP 192.168.43.124.8880 > 192.168.43.146.7771: UDP, length 120
23:10:02.728607 IP 192.168.43.147.8880 > 192.168.43.124.7773: UDP, length 120
23:10:02.756326 IP 192.168.43.124.8880 > 192.168.43.146.7771: UDP, length 120
23:10:02.789516 IP 192.168.43.147.8880 > 192.168.43.124.7773: UDP, length 120
23:10:02.806326 IP 192.168.43.124.8880 > 192.168.43.146.7771: UDP, length 120
23:10:02.829910 IP 192.168.43.147.8880 > 192.168.43.124.7773: UDP, length 120
23:10:02.856326 IP 192.168.43.124.8880 > 192.168.43.146.7771: UDP, length 120
23:10:02.876551 IP 192.168.43.147.8880 > 192.168.43.124.7773: UDP, length 120
23:10:02.906377 IP 192.168.43.124.8880 > 192.168.43.146.7771: UDP, length 120
23:10:02.931382 IP 192.168.43.147.8880 > 192.168.43.124.7773: UDP, length 120
23:10:02.956327 IP 192.168.43.124.8880 > 192.168.43.146.7771: UDP, length 120
23:10:02.977070 IP 192.168.43.147.8880 > 192.168.43.124.7773: UDP, length 120
23:10:03.006303 IP 192.168.43.124.8880 > 192.168.43.146.7771: UDP, length 120
23:10:03.026811 IP 192.168.43.147.8880 > 192.168.43.124.7773: UDP, length 120
23:10:03.056375 IP 192.168.43.124.8880 > 192.168.43.146.7771: UDP, length 120
23:10:03.091555 IP 192.168.43.147.8880 > 192.168.43.124.7773: UDP, length 120
23:10:03.106376 IP 192.168.43.124.8880 > 192.168.43.146.7771: UDP, length 120
23:10:03.130562 IP 192.168.43.147.8880 > 192.168.43.124.7773: UDP, length 120
23:10:03.156373 IP 192.168.43.124.8880 > 192.168.43.146.7771: UDP, length 120
23:10:03.178217 IP 192.168.43.147.8880 > 192.168.43.124.7773: UDP, length 120
23:10:03.206377 IP 192.168.43.124.8880 > 192.168.43.146.7771: UDP, length 120
23:10:03.243410 IP 192.168.43.147.8880 > 192.168.43.124.7773: UDP, length 120
23:10:03.256374 IP 192.168.43.124.8880 > 192.168.43.146.7771: UDP, length 120
23:10:03.276712 IP 192.168.43.147.8880 > 192.168.43.124.7773: UDP, length 120
23:10:03.306376 IP 192.168.43.124.8880 > 192.168.43.146.7771: UDP, length 120
23:10:03.329235 IP 192.168.43.147.8880 > 192.168.43.124.7773: UDP, length 120
23:10:03.356374 IP 192.168.43.124.8880 > 192.168.43.146.7771: UDP, length 120
23:10:03.386579 IP 192.168.43.147.8880 > 192.168.43.124.7773: UDP, length 120
23:10:03.406378 IP 192.168.43.124.8880 > 192.168.43.146.7771: UDP, length 120
23:10:03.428822 IP 192.168.43.147.8880 > 192.168.43.124.7773: UDP, length 120
23:10:03.456326 IP 192.168.43.124.8880 > 192.168.43.146.7771: UDP, length 120
23:10:03.476608 IP 192.168.43.147.8880 > 192.168.43.124.7773: UDP, length 120
23:10:03.506327 IP 192.168.43.124.8880 > 192.168.43.146.7771: UDP, length 120
23:10:03.540725 IP 192.168.43.147.8880 > 192.168.43.124.7773: UDP, length 120
23:10:03.556325 IP 192.168.43.124.8880 > 192.168.43.146.7771: UDP, length 120
23:10:03.579263 IP 192.168.43.147.8880 > 192.168.43.124.7773: UDP, length 120
23:10:03.606266 IP 192.168.43.124.8880 > 192.168.43.146.7771: UDP, length 120
23:10:03.627010 IP 192.168.43.147.8880 > 192.168.43.124.7773: UDP, length 120
23:10:03.656289 IP 192.168.43.124.8880 > 192.168.43.146.7771: UDP, length 120
23:10:03.681526 IP 192.168.43.147.8880 > 192.168.43.124.7773: UDP, length 120
23:10:03.706327 IP 192.168.43.124.8880 > 192.168.43.146.7771: UDP, length 120
23:10:03.728768 IP 192.168.43.147.8880 > 192.168.43.124.7773: UDP, length 120
23:10:03.756291 IP 192.168.43.124.8880 > 192.168.43.146.7771: UDP, length 120
23:10:03.779254 IP 192.168.43.147.8880 > 192.168.43.124.7773: UDP, length 120
23:10:03.806329 IP 192.168.43.124.8880 > 192.168.43.146.7771: UDP, length 120
23:10:03.840377 IP 192.168.43.147.8880 > 192.168.43.124.7773: UDP, length 120
23:10:03.856281 IP 192.168.43.124.8880 > 192.168.43.146.7771: UDP, length 120
23:10:03.880742 IP 192.168.43.147.8880 > 192.168.43.124.7773: UDP, length 120
23:10:03.906327 IP 192.168.43.124.8880 > 192.168.43.146.7771: UDP, length 120
23:10:03.926678 IP 192.168.43.147.8880 > 192.168.43.124.7773: UDP, length 120
23:10:03.956273 IP 192.168.43.124.8880 > 192.168.43.146.7771: UDP, length 120
23:10:03.983962 IP 192.168.43.147.8880 > 192.168.43.124.7773: UDP, length 120
23:10:04.006334 IP 192.168.43.124.8880 > 192.168.43.146.7771: UDP, length 120
23:10:04.049753 IP 192.168.43.147.8880 > 192.168.43.124.7773: UDP, length 120
23:10:04.056271 IP 192.168.43.124.8880 > 192.168.43.146.7771: UDP, length 120
23:10:04.085523 IP 192.168.43.147.8880 > 192.168.43.124.7773: UDP, length 120
23:10:04.106326 IP 192.168.43.124.8880 > 192.168.43.146.7771: UDP, length 120
23:10:04.131135 IP 192.168.43.147.8880 > 192.168.43.124.7773: UDP, length 120
23:10:04.156272 IP 192.168.43.124.8880 > 192.168.43.146.7771: UDP, length 120
23:10:04.196296 IP 192.168.43.147.8880 > 192.168.43.124.7773: UDP, length 120
23:10:04.206378 IP 192.168.43.124.8880 > 192.168.43.146.7771: UDP, length 120
23:10:04.228732 IP 192.168.43.147.8880 > 192.168.43.124.7773: UDP, length 120
23:10:04.256254 IP 192.168.43.124.8880 > 192.168.43.146.7771: UDP, length 120
23:10:04.276015 IP 192.168.43.147.8880 > 192.168.43.124.7773: UDP, length 120
23:10:04.306325 IP 192.168.43.124.8880 > 192.168.43.146.7771: UDP, length 120
23:10:04.332572 IP 192.168.43.147.8880 > 192.168.43.124.7773: UDP, length 120
23:10:04.356378 IP 192.168.43.124.8880 > 192.168.43.146.7771: UDP, length 120
23:10:04.378804 IP 192.168.43.147.8880 > 192.168.43.124.7773: UDP, length 120
23:10:04.406377 IP 192.168.43.124.8880 > 192.168.43.146.7771: UDP, length 120
23:10:04.440723 IP 192.168.43.147.8880 > 192.168.43.124.7773: UDP, length 120
23:10:04.456332 IP 192.168.43.124.8880 > 192.168.43.146.7771: UDP, length 120
23:10:04.480933 IP 192.168.43.147.8880 > 192.168.43.124.7773: UDP, length 120
23:10:04.506329 IP 192.168.43.124.8880 > 192.168.43.146.7771: UDP, length 120
23:10:04.528715 IP 192.168.43.147.8880 > 192.168.43.124.7773: UDP, length 120
23:10:04.556329 IP 192.168.43.124.8880 > 192.168.43.146.7771: UDP, length 120
23:10:04.575610 IP 192.168.43.147.8880 > 192.168.43.124.7773: UDP, length 120
23:10:04.606330 IP 192.168.43.124.8880 > 192.168.43.146.7771: UDP, length 120
23:10:04.629567 IP 192.168.43.147.8880 > 192.168.43.124.7773: UDP, length 120
23:10:04.656332 IP 192.168.43.124.8880 > 192.168.43.146.7771: UDP, length 120
23:10:04.706335 IP 192.168.43.124.8880 > 192.168.43.146.7771: UDP, length 120
23:10:04.755877 IP 192.168.43.147.8880 > 192.168.43.124.7773: UDP, length 120
23:10:04.756268 IP 192.168.43.124.8880 > 192.168.43.146.7771: UDP, length 120
23:10:04.756517 IP 192.168.43.147.8880 > 192.168.43.124.7773: UDP, length 120
23:10:04.788174 IP 192.168.43.147.8880 > 192.168.43.124.7773: UDP, length 120
23:10:04.806257 IP 192.168.43.124.8880 > 192.168.43.146.7771: UDP, length 120
23:10:04.830596 IP 192.168.43.147.8880 > 192.168.43.124.7773: UDP, length 120
23:10:04.856327 IP 192.168.43.124.8880 > 192.168.43.146.7771: UDP, length 120
23:10:04.893206 IP 192.168.43.147.8880 > 192.168.43.124.7773: UDP, length 120
23:10:04.906256 IP 192.168.43.124.8880 > 192.168.43.146.7771: UDP, length 120
23:10:04.930513 IP 192.168.43.147.8880 > 192.168.43.124.7773: UDP, length 120
23:10:04.956327 IP 192.168.43.124.8880 > 192.168.43.146.7771: UDP, length 120
23:10:04.975478 IP 192.168.43.147.8880 > 192.168.43.124.7773: UDP, length 120
23:10:05.006326 IP 192.168.43.124.8880 > 192.168.43.146.7771: UDP, length 120
23:10:05.043071 IP 192.168.43.147.8880 > 192.168.43.124.7773: UDP, length 120
23:10:05.056326 IP 192.168.43.124.8880 > 192.168.43.146.7771: UDP, length 120
23:10:05.078562 IP 192.168.43.147.8880 > 192.168.43.124.7773: UDP, length 120
23:10:05.106326 IP 192.168.43.124.8880 > 192.168.43.146.7771: UDP, length 120
23:10:05.125503 IP 192.168.43.147.8880 > 192.168.43.124.7773: UDP, length 120
23:10:05.156326 IP 192.168.43.124.8880 > 192.168.43.146.7771: UDP, length 120
23:10:05.183948 IP 192.168.43.147.8880 > 192.168.43.124.7773: UDP, length 120
23:10:05.206275 IP 192.168.43.124.8880 > 192.168.43.146.7771: UDP, length 120
23:10:05.225555 IP 192.168.43.147.8880 > 192.168.43.124.7773: UDP, length 120
23:10:05.256325 IP 192.168.43.124.8880 > 192.168.43.146.7771: UDP, length 120
23:10:05.279204 IP 192.168.43.147.8880 > 192.168.43.124.7773: UDP, length 120
23:10:05.306326 IP 192.168.43.124.8880 > 192.168.43.146.7771: UDP, length 120
23:10:05.340337 IP 192.168.43.147.8880 > 192.168.43.124.7773: UDP, length 120
23:10:05.356327 IP 192.168.43.124.8880 > 192.168.43.146.7771: UDP, length 120
23:10:05.381170 IP 192.168.43.147.8880 > 192.168.43.124.7773: UDP, length 120
23:10:05.406274 IP 192.168.43.124.8880 > 192.168.43.146.7771: UDP, length 120
23:10:05.425510 IP 192.168.43.147.8880 > 192.168.43.124.7773: UDP, length 120
23:10:05.456327 IP 192.168.43.124.8880 > 192.168.43.146.7771: UDP, length 120
23:10:05.475297 IP 192.168.43.147.8880 > 192.168.43.124.7773: UDP, length 120
23:10:05.506326 IP 192.168.43.124.8880 > 192.168.43.146.7771: UDP, length 120
23:10:05.541582 IP 192.168.43.147.8880 > 192.168.43.124.7773: UDP, length 120
23:10:05.556328 IP 192.168.43.124.8880 > 192.168.43.146.7771: UDP, length 120
23:10:05.579165 IP 192.168.43.147.8880 > 192.168.43.124.7773: UDP, length 120
23:10:05.606375 IP 192.168.43.124.8880 > 192.168.43.146.7771: UDP, length 120
23:10:05.628973 IP 192.168.43.147.8880 > 192.168.43.124.7773: UDP, length 120
23:10:05.656379 IP 192.168.43.124.8880 > 192.168.43.146.7771: UDP, length 120
23:10:05.691354 IP 192.168.43.147.8880 > 192.168.43.124.7773: UDP, length 120
23:10:05.706376 IP 192.168.43.124.8880 > 192.168.43.146.7771: UDP, length 120
23:10:05.729143 IP 192.168.43.147.8880 > 192.168.43.124.7773: UDP, length 120
23:10:05.756331 IP 192.168.43.124.8880 > 192.168.43.146.7771: UDP, length 120
23:10:05.780076 IP 192.168.43.147.8880 > 192.168.43.124.7773: UDP, length 120
23:10:05.806369 IP 192.168.43.124.8880 > 192.168.43.146.7771: UDP, length 120
23:10:05.842413 IP 192.168.43.147.8880 > 192.168.43.124.7773: UDP, length 120
23:10:05.856328 IP 192.168.43.124.8880 > 192.168.43.146.7771: UDP, length 120
23:10:05.880374 IP 192.168.43.147.8880 > 192.168.43.124.7773: UDP, length 120
23:10:05.906330 IP 192.168.43.124.8880 > 192.168.43.146.7771: UDP, length 120
23:10:05.945114 IP 192.168.43.147.8880 > 192.168.43.124.7773: UDP, length 120
23:10:05.956329 IP 192.168.43.124.8880 > 192.168.43.146.7771: UDP, length 120
23:10:05.986913 IP 192.168.43.147.8880 > 192.168.43.124.7773: UDP, length 120
23:10:06.006277 IP 192.168.43.124.8880 > 192.168.43.146.7771: UDP, length 120
23:10:06.029922 IP 192.168.43.147.8880 > 192.168.43.124.7773: UDP, length 120
23:10:06.056331 IP 192.168.43.124.8880 > 192.168.43.146.7771: UDP, length 120
23:10:06.091178 IP 192.168.43.147.8880 > 192.168.43.124.7773: UDP, length 120
23:10:06.106294 IP 192.168.43.124.8880 > 192.168.43.146.7771: UDP, length 120
23:10:06.135681 IP 192.168.43.147.8880 > 192.168.43.124.7773: UDP, length 120
23:10:06.156331 IP 192.168.43.124.8880 > 192.168.43.146.7771: UDP, length 120
23:10:06.183888 IP 192.168.43.147.8880 > 192.168.43.124.7773: UDP, length 120
23:10:06.206330 IP 192.168.43.124.8880 > 192.168.43.146.7771: UDP, length 120
23:10:06.239705 IP 192.168.43.147.8880 > 192.168.43.124.7773: UDP, length 120
23:10:06.256331 IP 192.168.43.124.8880 > 192.168.43.146.7771: UDP, length 120
23:10:06.278306 IP 192.168.43.147.8880 > 192.168.43.124.7773: UDP, length 120
23:10:06.306330 IP 192.168.43.124.8880 > 192.168.43.146.7771: UDP, length 120
23:10:06.337668 IP 192.168.43.147.8880 > 192.168.43.124.7773: UDP, length 120
23:10:06.356330 IP 192.168.43.124.8880 > 192.168.43.146.7771: UDP, length 120
23:10:06.388390 IP 192.168.43.147.8880 > 192.168.43.124.7773: UDP, length 120
23:10:06.406376 IP 192.168.43.124.8880 > 192.168.43.146.7771: UDP, length 120
23:10:06.429122 IP 192.168.43.147.8880 > 192.168.43.124.7773: UDP, length 120
23:10:06.456441 IP 192.168.43.124.8880 > 192.168.43.146.7771: UDP, length 120
23:10:06.478634 IP 192.168.43.147.8880 > 192.168.43.124.7773: UDP, length 120
23:10:06.506335 IP 192.168.43.124.8880 > 192.168.43.146.7771: UDP, length 120
23:10:06.529543 IP 192.168.43.147.8880 > 192.168.43.124.7773: UDP, length 120
23:10:06.556327 IP 192.168.43.124.8880 > 192.168.43.146.7771: UDP, length 120
23:10:06.598320 IP 192.168.43.147.8880 > 192.168.43.124.7773: UDP, length 120
23:10:06.606327 IP 192.168.43.124.8880 > 192.168.43.146.7771: UDP, length 120
23:10:06.631547 IP 192.168.43.147.8880 > 192.168.43.124.7773: UDP, length 120
23:10:06.656375 IP 192.168.43.124.8880 > 192.168.43.146.7771: UDP, length 120
23:10:06.679064 IP 192.168.43.147.8880 > 192.168.43.124.7773: UDP, length 120
23:10:06.706376 IP 192.168.43.124.8880 > 192.168.43.146.7771: UDP, length 120
23:10:06.739278 IP 192.168.43.147.8880 > 192.168.43.124.7773: UDP, length 120
23:10:06.756377 IP 192.168.43.124.8880 > 192.168.43.146.7771: UDP, length 120
23:10:06.778943 IP 192.168.43.147.8880 > 192.168.43.124.7773: UDP, length 120
23:10:06.806371 IP 192.168.43.124.8880 > 192.168.43.146.7771: UDP, length 120
23:10:06.825465 IP 192.168.43.147.8880 > 192.168.43.124.7773: UDP, length 120
23:10:06.856332 IP 192.168.43.124.8880 > 192.168.43.146.7771: UDP, length 120
23:10:06.879662 IP 192.168.43.147.8880 > 192.168.43.124.7773: UDP, length 120
23:10:06.906331 IP 192.168.43.124.8880 > 192.168.43.146.7771: UDP, length 120
23:10:06.952817 IP 192.168.43.147.8880 > 192.168.43.124.7773: UDP, length 120
23:10:06.956329 IP 192.168.43.124.8880 > 192.168.43.146.7771: UDP, length 120
23:10:06.979310 IP 192.168.43.147.8880 > 192.168.43.124.7773: UDP, length 120
23:10:07.006329 IP 192.168.43.124.8880 > 192.168.43.146.7771: UDP, length 120
23:10:07.028610 IP 192.168.43.147.8880 > 192.168.43.124.7773: UDP, length 120
23:10:07.056273 IP 192.168.43.124.8880 > 192.168.43.146.7771: UDP, length 120
23:10:07.089561 IP 192.168.43.147.8880 > 192.168.43.124.7773: UDP, length 120
23:10:07.106374 IP 192.168.43.124.8880 > 192.168.43.146.7771: UDP, length 120
23:10:07.130124 IP 192.168.43.147.8880 > 192.168.43.124.7773: UDP, length 120
23:10:07.156376 IP 192.168.43.124.8880 > 192.168.43.146.7771: UDP, length 120
23:10:07.182662 IP 192.168.43.147.8880 > 192.168.43.124.7773: UDP, length 120
23:10:07.206378 IP 192.168.43.124.8880 > 192.168.43.146.7771: UDP, length 120
23:10:07.232344 IP 192.168.43.147.8880 > 192.168.43.124.7773: UDP, length 120
23:10:07.256376 IP 192.168.43.124.8880 > 192.168.43.146.7771: UDP, length 120
23:10:07.300018 IP 192.168.43.147.8880 > 192.168.43.124.7773: UDP, length 120
23:10:07.306376 IP 192.168.43.124.8880 > 192.168.43.146.7771: UDP, length 120
23:10:07.329439 IP 192.168.43.147.8880 > 192.168.43.124.7773: UDP, length 120
23:10:07.356332 IP 192.168.43.124.8880 > 192.168.43.146.7771: UDP, length 120
23:10:07.378618 IP 192.168.43.147.8880 > 192.168.43.124.7773: UDP, length 120
23:10:07.406331 IP 192.168.43.124.8880 > 192.168.43.146.7771: UDP, length 120
23:10:07.444872 IP 192.168.43.147.8880 > 192.168.43.124.7773: UDP, length 120
23:10:07.456332 IP 192.168.43.124.8880 > 192.168.43.146.7771: UDP, length 120
23:10:07.481703 IP 192.168.43.147.8880 > 192.168.43.124.7773: UDP, length 120
23:10:07.506332 IP 192.168.43.124.8880 > 192.168.43.146.7771: UDP, length 120
23:10:07.530353 IP 192.168.43.147.8880 > 192.168.43.124.7773: UDP, length 120
23:10:07.556250 IP 192.168.43.124.8880 > 192.168.43.146.7771: UDP, length 120
23:10:07.589648 IP 192.168.43.147.8880 > 192.168.43.124.7773: UDP, length 120
23:10:07.606256 IP 192.168.43.124.8880 > 192.168.43.146.7771: UDP, length 120
23:10:07.642130 IP 192.168.43.147.8880 > 192.168.43.124.7773: UDP, length 120
23:10:07.656281 IP 192.168.43.124.8880 > 192.168.43.146.7771: UDP, length 120
23:10:07.676366 IP 192.168.43.147.8880 > 192.168.43.124.7773: UDP, length 120
23:10:07.706328 IP 192.168.43.124.8880 > 192.168.43.146.7771: UDP, length 120
23:10:07.731981 IP 192.168.43.147.8880 > 192.168.43.124.7773: UDP, length 120
23:10:07.756327 IP 192.168.43.124.8880 > 192.168.43.146.7771: UDP, length 120
23:10:07.775645 IP 192.168.43.147.8880 > 192.168.43.124.7773: UDP, length 120
23:10:07.806324 IP 192.168.43.124.8880 > 192.168.43.146.7771: UDP, length 120
23:10:07.825292 IP 192.168.43.147.8880 > 192.168.43.124.7773: UDP, length 120
23:10:07.856327 IP 192.168.43.124.8880 > 192.168.43.146.7771: UDP, length 120
23:10:07.878821 IP 192.168.43.147.8880 > 192.168.43.124.7773: UDP, length 120
23:10:07.906328 IP 192.168.43.124.8880 > 192.168.43.146.7771: UDP, length 120
23:10:07.948635 IP 192.168.43.147.8880 > 192.168.43.124.7773: UDP, length 120
23:10:07.956325 IP 192.168.43.124.8880 > 192.168.43.146.7771: UDP, length 120
23:10:07.978670 IP 192.168.43.147.8880 > 192.168.43.124.7773: UDP, length 120
23:10:08.006325 IP 192.168.43.124.8880 > 192.168.43.146.7771: UDP, length 120
23:10:08.029415 IP 192.168.43.147.8880 > 192.168.43.124.7773: UDP, length 120
23:10:08.056328 IP 192.168.43.124.8880 > 192.168.43.146.7771: UDP, length 120
23:10:08.088506 IP 192.168.43.147.8880 > 192.168.43.124.7773: UDP, length 120
23:10:08.106326 IP 192.168.43.124.8880 > 192.168.43.146.7771: UDP, length 120
23:10:08.129590 IP 192.168.43.147.8880 > 192.168.43.124.7773: UDP, length 120
23:10:08.156327 IP 192.168.43.124.8880 > 192.168.43.146.7771: UDP, length 120
23:10:08.183720 IP 192.168.43.147.8880 > 192.168.43.124.7773: UDP, length 120
23:10:08.206326 IP 192.168.43.124.8880 > 192.168.43.146.7771: UDP, length 120
23:10:08.231617 IP 192.168.43.147.8880 > 192.168.43.124.7773: UDP, length 120
23:10:08.256274 IP 192.168.43.124.8880 > 192.168.43.146.7771: UDP, length 120
23:10:08.299995 IP 192.168.43.147.8880 > 192.168.43.124.7773: UDP, length 120
23:10:08.306326 IP 192.168.43.124.8880 > 192.168.43.146.7771: UDP, length 120
23:10:08.329564 IP 192.168.43.147.8880 > 192.168.43.124.7773: UDP, length 120
23:10:08.356376 IP 192.168.43.124.8880 > 192.168.43.146.7771: UDP, length 120
23:10:08.376588 IP 192.168.43.147.8880 > 192.168.43.124.7773: UDP, length 120
23:10:08.406377 IP 192.168.43.124.8880 > 192.168.43.146.7771: UDP, length 120
23:10:08.439605 IP 192.168.43.147.8880 > 192.168.43.124.7773: UDP, length 120
23:10:08.456329 IP 192.168.43.124.8880 > 192.168.43.146.7771: UDP, length 120
23:10:08.479302 IP 192.168.43.147.8880 > 192.168.43.124.7773: UDP, length 120
23:10:08.506327 IP 192.168.43.124.8880 > 192.168.43.146.7771: UDP, length 120
23:10:08.541035 IP 192.168.43.147.8880 > 192.168.43.124.7773: UDP, length 120
23:10:08.556331 IP 192.168.43.124.8880 > 192.168.43.146.7771: UDP, length 120
23:10:08.579855 IP 192.168.43.147.8880 > 192.168.43.124.7773: UDP, length 120
23:10:08.606330 IP 192.168.43.124.8880 > 192.168.43.146.7771: UDP, length 120
23:10:08.649274 IP 192.168.43.147.8880 > 192.168.43.124.7773: UDP, length 120
23:10:08.656329 IP 192.168.43.124.8880 > 192.168.43.146.7771: UDP, length 120
23:10:08.680195 IP 192.168.43.147.8880 > 192.168.43.124.7773: UDP, length 120
23:10:08.706329 IP 192.168.43.124.8880 > 192.168.43.146.7771: UDP, length 120
23:10:08.729299 IP 192.168.43.147.8880 > 192.168.43.124.7773: UDP, length 120
23:10:08.756328 IP 192.168.43.124.8880 > 192.168.43.146.7771: UDP, length 120
23:10:08.794043 IP 192.168.43.147.8880 > 192.168.43.124.7773: UDP, length 120
23:10:08.806324 IP 192.168.43.124.8880 > 192.168.43.146.7771: UDP, length 120
23:10:08.828640 IP 192.168.43.147.8880 > 192.168.43.124.7773: UDP, length 120
23:10:08.856325 IP 192.168.43.124.8880 > 192.168.43.146.7771: UDP, length 120
23:10:08.879362 IP 192.168.43.147.8880 > 192.168.43.124.7773: UDP, length 120
23:10:08.906326 IP 192.168.43.124.8880 > 192.168.43.146.7771: UDP, length 120
23:10:08.939517 IP 192.168.43.147.8880 > 192.168.43.124.7773: UDP, length 120
23:10:08.956374 IP 192.168.43.124.8880 > 192.168.43.146.7771: UDP, length 120
23:10:08.979665 IP 192.168.43.147.8880 > 192.168.43.124.7773: UDP, length 120
23:10:09.006376 IP 192.168.43.124.8880 > 192.168.43.146.7771: UDP, length 120
23:10:09.028514 IP 192.168.43.147.8880 > 192.168.43.124.7773: UDP, length 120
23:10:09.056330 IP 192.168.43.124.8880 > 192.168.43.146.7771: UDP, length 120
23:10:09.078730 IP 192.168.43.147.8880 > 192.168.43.124.7773: UDP, length 120
23:10:09.106331 IP 192.168.43.124.8880 > 192.168.43.146.7771: UDP, length 120
23:10:09.129120 IP 192.168.43.147.8880 > 192.168.43.124.7773: UDP, length 120
23:10:09.156330 IP 192.168.43.124.8880 > 192.168.43.146.7771: UDP, length 120
23:10:09.177983 IP 192.168.43.147.8880 > 192.168.43.124.7773: UDP, length 120
23:10:09.206331 IP 192.168.43.124.8880 > 192.168.43.146.7771: UDP, length 120
23:10:09.245866 IP 192.168.43.147.8880 > 192.168.43.124.7773: UDP, length 120
23:10:09.256331 IP 192.168.43.124.8880 > 192.168.43.146.7771: UDP, length 120
23:10:09.280825 IP 192.168.43.147.8880 > 192.168.43.124.7773: UDP, length 120
23:10:09.306329 IP 192.168.43.124.8880 > 192.168.43.146.7771: UDP, length 120
23:10:09.332562 IP 192.168.43.147.8880 > 192.168.43.124.7773: UDP, length 120
23:10:09.356332 IP 192.168.43.124.8880 > 192.168.43.146.7771: UDP, length 120
23:10:09.388817 IP 192.168.43.147.8880 > 192.168.43.124.7773: UDP, length 120
23:10:09.406329 IP 192.168.43.124.8880 > 192.168.43.146.7771: UDP, length 120
23:10:09.430454 IP 192.168.43.147.8880 > 192.168.43.124.7773: UDP, length 120
23:10:09.456329 IP 192.168.43.124.8880 > 192.168.43.146.7771: UDP, length 120
23:10:09.475732 IP 192.168.43.147.8880 > 192.168.43.124.7773: UDP, length 120
23:10:09.506329 IP 192.168.43.124.8880 > 192.168.43.146.7771: UDP, length 120
23:10:09.532589 IP 192.168.43.147.8880 > 192.168.43.124.7773: UDP, length 120
23:10:09.556329 IP 192.168.43.124.8880 > 192.168.43.146.7771: UDP, length 120
23:10:09.579395 IP 192.168.43.147.8880 > 192.168.43.124.7773: UDP, length 120
23:10:09.606329 IP 192.168.43.124.8880 > 192.168.43.146.7771: UDP, length 120
23:10:09.627886 IP 192.168.43.147.8880 > 192.168.43.124.7773: UDP, length 120
23:10:09.656329 IP 192.168.43.124.8880 > 192.168.43.146.7771: UDP, length 120
23:10:09.696141 IP 192.168.43.147.8880 > 192.168.43.124.7773: UDP, length 120
23:10:09.706329 IP 192.168.43.124.8880 > 192.168.43.146.7771: UDP, length 120
23:10:09.730142 IP 192.168.43.147.8880 > 192.168.43.124.7773: UDP, length 120
23:10:09.756331 IP 192.168.43.124.8880 > 192.168.43.146.7771: UDP, length 120
23:10:09.784531 IP 192.168.43.147.8880 > 192.168.43.124.7773: UDP, length 120
23:10:09.806374 IP 192.168.43.124.8880 > 192.168.43.146.7771: UDP, length 120
23:10:09.838969 IP 192.168.43.147.8880 > 192.168.43.124.7773: UDP, length 120
23:10:09.856334 IP 192.168.43.124.8880 > 192.168.43.146.7771: UDP, length 120
23:10:09.885157 IP 192.168.43.147.8880 > 192.168.43.124.7773: UDP, length 120
23:10:09.906327 IP 192.168.43.124.8880 > 192.168.43.146.7771: UDP, length 120
23:10:09.928601 IP 192.168.43.147.8880 > 192.168.43.124.7773: UDP, length 120
23:10:09.956327 IP 192.168.43.124.8880 > 192.168.43.146.7771: UDP, length 120
23:10:09.978503 IP 192.168.43.147.8880 > 192.168.43.124.7773: UDP, length 120
23:10:10.006326 IP 192.168.43.124.8880 > 192.168.43.146.7771: UDP, length 120
23:10:10.032642 IP 192.168.43.147.8880 > 192.168.43.124.7773: UDP, length 120
23:10:10.056325 IP 192.168.43.124.8880 > 192.168.43.146.7771: UDP, length 120
23:10:10.106326 IP 192.168.43.124.8880 > 192.168.43.146.7771: UDP, length 120
23:10:10.112985 IP 192.168.43.147.8880 > 192.168.43.124.7773: UDP, length 120
23:10:10.128433 IP 192.168.43.147.8880 > 192.168.43.124.7773: UDP, length 120
23:10:10.156326 IP 192.168.43.124.8880 > 192.168.43.146.7771: UDP, length 120
23:10:10.195662 IP 192.168.43.147.8880 > 192.168.43.124.7773: UDP, length 120
23:10:10.206326 IP 192.168.43.124.8880 > 192.168.43.146.7771: UDP, length 120
23:10:10.231885 IP 192.168.43.147.8880 > 192.168.43.124.7773: UDP, length 120
23:10:10.256328 IP 192.168.43.124.8880 > 192.168.43.146.7771: UDP, length 120
23:10:10.277426 IP 192.168.43.147.8880 > 192.168.43.124.7773: UDP, length 120
23:10:10.306323 IP 192.168.43.124.8880 > 192.168.43.146.7771: UDP, length 120
23:10:10.342582 IP 192.168.43.147.8880 > 192.168.43.124.7773: UDP, length 120
23:10:10.356327 IP 192.168.43.124.8880 > 192.168.43.146.7771: UDP, length 120
23:10:10.375498 IP 192.168.43.147.8880 > 192.168.43.124.7773: UDP, length 120
23:10:10.406256 IP 192.168.43.124.8880 > 192.168.43.146.7771: UDP, length 120
23:10:10.436887 IP 192.168.43.147.8880 > 192.168.43.124.7773: UDP, length 120
23:10:10.456291 IP 192.168.43.124.8880 > 192.168.43.146.7771: UDP, length 120
23:10:10.488651 IP 192.168.43.147.8880 > 192.168.43.124.7773: UDP, length 120
23:10:10.506326 IP 192.168.43.124.8880 > 192.168.43.146.7771: UDP, length 120
23:10:10.537085 IP 192.168.43.147.8880 > 192.168.43.124.7773: UDP, length 120
23:10:10.556326 IP 192.168.43.124.8880 > 192.168.43.146.7771: UDP, length 120
23:10:10.576625 IP 192.168.43.147.8880 > 192.168.43.124.7773: UDP, length 120
23:10:10.606326 IP 192.168.43.124.8880 > 192.168.43.146.7771: UDP, length 120
23:10:10.629154 IP 192.168.43.147.8880 > 192.168.43.124.7773: UDP, length 120
23:10:10.656391 IP 192.168.43.124.8880 > 192.168.43.146.7771: UDP, length 120
23:10:10.701867 IP 192.168.43.147.8880 > 192.168.43.124.7773: UDP, length 120
23:10:10.706327 IP 192.168.43.124.8880 > 192.168.43.146.7771: UDP, length 120
23:10:10.727484 IP 192.168.43.147.8880 > 192.168.43.124.7773: UDP, length 120
23:10:10.756327 IP 192.168.43.124.8880 > 192.168.43.146.7771: UDP, length 120
23:10:10.783911 IP 192.168.43.147.8880 > 192.168.43.124.7773: UDP, length 120
23:10:10.806370 IP 192.168.43.124.8880 > 192.168.43.146.7771: UDP, length 120
23:10:10.832624 IP 192.168.43.147.8880 > 192.168.43.124.7773: UDP, length 120
23:10:10.856327 IP 192.168.43.124.8880 > 192.168.43.146.7771: UDP, length 120
23:10:10.880225 IP 192.168.43.147.8880 > 192.168.43.124.7773: UDP, length 120
23:10:10.906328 IP 192.168.43.124.8880 > 192.168.43.146.7771: UDP, length 120
23:10:10.931049 IP 192.168.43.147.8880 > 192.168.43.124.7773: UDP, length 120
23:10:10.956329 IP 192.168.43.124.8880 > 192.168.43.146.7771: UDP, length 120
23:10:10.980693 IP 192.168.43.147.8880 > 192.168.43.124.7773: UDP, length 120
23:10:11.006377 IP 192.168.43.124.8880 > 192.168.43.146.7771: UDP, length 120
23:10:11.033952 IP 192.168.43.147.8880 > 192.168.43.124.7773: UDP, length 120
23:10:11.056378 IP 192.168.43.124.8880 > 192.168.43.146.7771: UDP, length 120
23:10:11.078090 IP 192.168.43.147.8880 > 192.168.43.124.7773: UDP, length 120
23:10:11.106378 IP 192.168.43.124.8880 > 192.168.43.146.7771: UDP, length 120
23:10:11.130819 IP 192.168.43.147.8880 > 192.168.43.124.7773: UDP, length 120
23:10:11.156377 IP 192.168.43.124.8880 > 192.168.43.146.7771: UDP, length 120
23:10:11.180372 IP 192.168.43.147.8880 > 192.168.43.124.7773: UDP, length 120
23:10:11.206375 IP 192.168.43.124.8880 > 192.168.43.146.7771: UDP, length 120
23:10:11.231241 IP 192.168.43.147.8880 > 192.168.43.124.7773: UDP, length 120
23:10:11.256376 IP 192.168.43.124.8880 > 192.168.43.146.7771: UDP, length 120
23:10:11.284358 IP 192.168.43.147.8880 > 192.168.43.124.7773: UDP, length 120
23:10:11.306375 IP 192.168.43.124.8880 > 192.168.43.146.7771: UDP, length 120
23:10:11.331206 IP 192.168.43.147.8880 > 192.168.43.124.7773: UDP, length 120
23:10:11.356376 IP 192.168.43.124.8880 > 192.168.43.146.7771: UDP, length 120
23:10:11.385282 IP 192.168.43.147.8880 > 192.168.43.124.7773: UDP, length 120
23:10:11.406378 IP 192.168.43.124.8880 > 192.168.43.146.7771: UDP, length 120
23:10:11.430359 IP 192.168.43.147.8880 > 192.168.43.124.7773: UDP, length 120
23:10:11.456330 IP 192.168.43.124.8880 > 192.168.43.146.7771: UDP, length 120
23:10:11.480800 IP 192.168.43.147.8880 > 192.168.43.124.7773: UDP, length 120
23:10:11.506328 IP 192.168.43.124.8880 > 192.168.43.146.7771: UDP, length 120
23:10:11.532731 IP 192.168.43.147.8880 > 192.168.43.124.7773: UDP, length 120
23:10:11.556327 IP 192.168.43.124.8880 > 192.168.43.146.7771: UDP, length 120
23:10:11.583188 IP 192.168.43.147.8880 > 192.168.43.124.7773: UDP, length 120
23:10:11.606328 IP 192.168.43.124.8880 > 192.168.43.146.7771: UDP, length 120
23:10:11.630609 IP 192.168.43.147.8880 > 192.168.43.124.7773: UDP, length 120
23:10:11.656330 IP 192.168.43.124.8880 > 192.168.43.146.7771: UDP, length 120
23:10:11.680381 IP 192.168.43.147.8880 > 192.168.43.124.7773: UDP, length 120
23:10:11.706328 IP 192.168.43.124.8880 > 192.168.43.146.7771: UDP, length 120
23:10:11.731401 IP 192.168.43.147.8880 > 192.168.43.124.7773: UDP, length 120
23:10:11.756378 IP 192.168.43.124.8880 > 192.168.43.146.7771: UDP, length 120
23:10:11.780904 IP 192.168.43.147.8880 > 192.168.43.124.7773: UDP, length 120
23:10:11.806374 IP 192.168.43.124.8880 > 192.168.43.146.7771: UDP, length 120
23:10:11.829183 IP 192.168.43.147.8880 > 192.168.43.124.7773: UDP, length 120
23:10:11.856328 IP 192.168.43.124.8880 > 192.168.43.146.7771: UDP, length 120
23:10:11.882023 IP 192.168.43.147.8880 > 192.168.43.124.7773: UDP, length 120
23:10:11.906329 IP 192.168.43.124.8880 > 192.168.43.146.7771: UDP, length 120
23:10:11.932679 IP 192.168.43.147.8880 > 192.168.43.124.7773: UDP, length 120
23:10:11.956329 IP 192.168.43.124.8880 > 192.168.43.146.7771: UDP, length 120
23:10:11.980298 IP 192.168.43.147.8880 > 192.168.43.124.7773: UDP, length 120
23:10:12.006330 IP 192.168.43.124.8880 > 192.168.43.146.7771: UDP, length 120
23:10:12.032698 IP 192.168.43.147.8880 > 192.168.43.124.7773: UDP, length 120
23:10:12.056279 IP 192.168.43.124.8880 > 192.168.43.146.7771: UDP, length 120
23:10:12.081374 IP 192.168.43.147.8880 > 192.168.43.124.7773: UDP, length 120
23:10:12.106329 IP 192.168.43.124.8880 > 192.168.43.146.7771: UDP, length 120
23:10:12.131284 IP 192.168.43.147.8880 > 192.168.43.124.7773: UDP, length 120
23:10:12.156332 IP 192.168.43.124.8880 > 192.168.43.146.7771: UDP, length 120
23:10:12.180326 IP 192.168.43.147.8880 > 192.168.43.124.7773: UDP, length 120
23:10:12.206330 IP 192.168.43.124.8880 > 192.168.43.146.7771: UDP, length 120
23:10:12.230456 IP 192.168.43.147.8880 > 192.168.43.124.7773: UDP, length 120
23:10:12.256329 IP 192.168.43.124.8880 > 192.168.43.146.7771: UDP, length 120
23:10:12.306331 IP 192.168.43.124.8880 > 192.168.43.146.7771: UDP, length 120
23:10:12.356330 IP 192.168.43.124.8880 > 192.168.43.146.7771: UDP, length 120
23:10:12.406330 IP 192.168.43.124.8880 > 192.168.43.146.7771: UDP, length 120
23:10:12.437218 IP 192.168.43.147.8880 > 192.168.43.124.7773: UDP, length 120
23:10:12.437231 IP 192.168.43.147.8880 > 192.168.43.124.7773: UDP, length 120
23:10:12.437233 IP 192.168.43.147.8880 > 192.168.43.124.7773: UDP, length 120
23:10:12.437235 IP 192.168.43.147.8880 > 192.168.43.124.7773: UDP, length 120
23:10:12.456326 IP 192.168.43.124.8880 > 192.168.43.146.7771: UDP, length 120
23:10:12.484749 IP 192.168.43.147.8880 > 192.168.43.124.7773: UDP, length 120
23:10:12.506327 IP 192.168.43.124.8880 > 192.168.43.146.7771: UDP, length 120
23:10:12.532805 IP 192.168.43.147.8880 > 192.168.43.124.7773: UDP, length 120
23:10:12.556327 IP 192.168.43.124.8880 > 192.168.43.146.7771: UDP, length 120
23:10:12.587582 IP 192.168.43.147.8880 > 192.168.43.124.7773: UDP, length 120
