23:08:54.217420 IP 192.168.43.124.8880 > 192.168.43.146.7771: UDP, length 120
23:08:54.267566 IP 192.168.43.124.8880 > 192.168.43.146.7771: UDP, length 120
23:08:54.317566 IP 192.168.43.124.8880 > 192.168.43.146.7771: UDP, length 120
23:08:54.367566 IP 192.168.43.124.8880 > 192.168.43.146.7771: UDP, length 120
23:08:54.417567 IP 192.168.43.124.8880 > 192.168.43.146.7771: UDP, length 120
23:08:54.467566 IP 192.168.43.124.8880 > 192.168.43.146.7771: UDP, length 120
23:08:54.517566 IP 192.168.43.124.8880 > 192.168.43.146.7771: UDP, length 120
23:08:54.567566 IP 192.168.43.124.8880 > 192.168.43.146.7771: UDP, length 120
23:08:54.617615 IP 192.168.43.124.8880 > 192.168.43.146.7771: UDP, length 120
23:08:54.667616 IP 192.168.43.124.8880 > 192.168.43.146.7771: UDP, length 120
23:08:54.717610 IP 192.168.43.124.8880 > 192.168.43.146.7771: UDP, length 120
23:08:54.767570 IP 192.168.43.124.8880 > 192.168.43.146.7771: UDP, length 120
23:08:54.817494 IP 192.168.43.124.8880 > 192.168.43.146.7771: UDP, length 120
23:08:54.867489 IP 192.168.43.124.8880 > 192.168.43.146.7771: UDP, length 120
23:08:54.917569 IP 192.168.43.124.8880 > 192.168.43.146.7771: UDP, length 120
23:08:54.967568 IP 192.168.43.124.8880 > 192.168.43.146.7771: UDP, length 120
23:08:55.017565 IP 192.168.43.124.8880 > 192.168.43.146.7771: UDP, length 120
23:08:55.067566 IP 192.168.43.124.8880 > 192.168.43.146.7771: UDP, length 120
23:08:55.117565 IP 192.168.43.124.8880 > 192.168.43.146.7771: UDP, length 120
23:08:55.167565 IP 192.168.43.124.8880 > 192.168.43.146.7771: UDP, length 120
23:08:55.168399 IP 192.168.43.147.8880 > 192.168.43.124.7773: UDP, length 120
23:08:55.217564 IP 192.168.43.124.8880 > 192.168.43.146.7771: UDP, length 120
23:08:55.219412 IP 192.168.43.147.8880 > 192.168.43.124.7773: UDP, length 120
23:08:55.260085 IP 192.168.43.147.8880 > 192.168.43.124.7773: UDP, length 120
23:08:55.267565 IP 192.168.43.124.8880 > 192.168.43.146.7771: UDP, length 120
23:08:55.310375 IP 192.168.43.147.8880 > 192.168.43.124.7773: UDP, length 120
23:08:55.317565 IP 192.168.43.124.8880 > 192.168.43.146.7771: UDP, length 120
23:08:55.367574 IP 192.168.43.124.8880 > 192.168.43.146.7771: UDP, length 120
23:08:55.372208 IP 192.168.43.147.8880 > 192.168.43.124.7773: UDP, length 120
23:08:55.412367 IP 192.168.43.147.8880 > 192.168.43.124.7773: UDP, length 120
23:08:55.417506 IP 192.168.43.124.8880 > 192.168.43.146.7771: UDP, length 120
23:08:55.462222 IP 192.168.43.147.8880 > 192.168.43.124.7773: UDP, length 120
23:08:55.467567 IP 192.168.43.124.8880 > 192.168.43.146.7771: UDP, length 120
23:08:55.517564 IP 192.168.43.124.8880 > 192.168.43.146.7771: UDP, length 120
23:08:55.518963 IP 192.168.43.147.8880 > 192.168.43.124.7773: UDP, length 120
23:08:55.567564 IP 192.168.43.124.8880 > 192.168.43.146.7771: UDP, length 120
23:08:55.588987 IP 192.168.43.147.8880 > 192.168.43.124.7773: UDP, length 120
23:08:55.607088 IP 192.168.43.147.8880 > 192.168.43.124.7773: UDP, length 120
23:08:55.617565 IP 192.168.43.124.8880 > 192.168.43.146.7771: UDP, length 120
23:08:55.656915 IP 192.168.43.147.8880 > 192.168.43.124.7773: UDP, length 120
23:08:55.667566 IP 192.168.43.124.8880 > 192.168.43.146.7771: UDP, length 120
23:08:55.709693 IP 192.168.43.147.8880 > 192.168.43.124.7773: UDP, length 120
23:08:55.717562 IP 192.168.43.124.8880 > 192.168.43.146.7771: UDP, length 120
23:08:55.767565 IP 192.168.43.124.8880 > 192.168.43.146.7771: UDP, length 120
23:08:55.769577 IP 192.168.43.147.8880 > 192.168.43.124.7773: UDP, length 120
23:08:55.809442 IP 192.168.43.147.8880 > 192.168.43.124.7773: UDP, length 120
23:08:55.817564 IP 192.168.43.124.8880 > 192.168.43.146.7771: UDP, length 120
23:08:55.865746 IP 192.168.43.147.8880 > 192.168.43.124.7773: UDP, length 120
23:08:55.867510 IP 192.168.43.124.8880 > 192.168.43.146.7771: UDP, length 120
23:08:55.917567 IP 192.168.43.124.8880 > 192.168.43.146.7771: UDP, length 120
23:08:55.919997 IP 192.168.43.147.8880 > 192.168.43.124.7773: UDP, length 120
23:08:55.959494 IP 192.168.43.147.8880 > 192.168.43.124.7773: UDP, length 120
23:08:55.967566 IP 192.168.43.124.8880 > 192.168.43.146.7771: UDP, length 120
23:08:56.017567 IP 192.168.43.124.8880 > 192.168.43.146.7771: UDP, length 120
23:08:56.022300 IP 192.168.43.147.8880 > 192.168.43.124.7773: UDP, length 120
23:08:56.060088 IP 192.168.43.147.8880 > 192.168.43.124.7773: UDP, length 120
23:08:56.067617 IP 192.168.43.124.8880 > 192.168.43.146.7771: UDP, length 120
23:08:56.111843 IP 192.168.43.147.8880 > 192.168.43.124.7773: UDP, length 120
23:08:56.117517 IP 192.168.43.124.8880 > 192.168.43.146.7771: UDP, length 120
23:08:56.157922 IP 192.168.43.147.8880 > 192.168.43.124.7773: UDP, length 120
23:08:56.167564 IP 192.168.43.124.8880 > 192.168.43.146.7771: UDP, length 120
23:08:56.217565 IP 192.168.43.124.8880 > 192.168.43.146.7771: UDP, length 120
23:08:56.218967 IP 192.168.43.147.8880 > 192.168.43.124.7773: UDP, length 120
23:08:56.259623 IP 192.168.43.147.8880 > 192.168.43.124.7773: UDP, length 120
23:08:56.267529 IP 192.168.43.124.8880 > 192.168.43.146.7771: UDP, length 120
23:08:56.309541 IP 192.168.43.147.8880 > 192.168.43.124.7773: UDP, length 120
23:08:56.317566 IP 192.168.43.124.8880 > 192.168.43.146.7771: UDP, length 120
23:08:56.359771 IP 192.168.43.147.8880 > 192.168.43.124.7773: UDP, length 120
23:08:56.367565 IP 192.168.43.124.8880 > 192.168.43.146.7771: UDP, length 120
23:08:56.417495 IP 192.168.43.124.8880 > 192.168.43.146.7771: UDP, length 120
23:08:56.421366 IP 192.168.43.147.8880 > 192.168.43.124.7773: UDP, length 120
23:08:56.461455 IP 192.168.43.147.8880 > 192.168.43.124.7773: UDP, length 120
23:08:56.467567 IP 192.168.43.124.8880 > 192.168.43.146.7771: UDP, length 120
23:08:56.506423 IP 192.168.43.147.8880 > 192.168.43.124.7773: UDP, length 120
23:08:56.517606 IP 192.168.43.124.8880 > 192.168.43.146.7771: UDP, length 120
23:08:56.567566 IP 192.168.43.124.8880 > 192.168.43.146.7771: UDP, length 120
23:08:56.573739 IP 192.168.43.147.8880 > 192.168.43.124.7773: UDP, length 120
23:08:56.609516 IP 192.168.43.147.8880 > 192.168.43.124.7773: UDP, length 120
23:08:56.617564 IP 192.168.43.124.8880 > 192.168.43.146.7771: UDP, length 120
23:08:56.656891 IP 192.168.43.147.8880 > 192.168.43.124.7773: UDP, length 120
23:08:56.667608 IP 192.168.43.124.8880 > 192.168.43.146.7771: UDP, length 120
23:08:56.717564 IP 192.168.43.124.8880 > 192.168.43.146.7771: UDP, length 120
23:08:56.720689 IP 192.168.43.147.8880 > 192.168.43.124.7773: UDP, length 120
23:08:56.759471 IP 192.168.43.147.8880 > 192.168.43.124.7773: UDP, length 120
23:08:56.767566 IP 192.168.43.124.8880 > 192.168.43.146.7771: UDP, length 120
23:08:56.808017 IP 192.168.43.147.8880 > 192.168.43.124.7773: UDP, length 120
23:08:56.817607 IP 192.168.43.124.8880 > 192.168.43.146.7771: UDP, length 120
23:08:56.861508 IP 192.168.43.147.8880 > 192.168.43.124.7773: UDP, length 120
23:08:56.867570 IP 192.168.43.124.8880 > 192.168.43.146.7771: UDP, length 120
23:08:56.910103 IP 192.168.43.147.8880 > 192.168.43.124.7773: UDP, length 120
23:08:56.917570 IP 192.168.43.124.8880 > 192.168.43.146.7771: UDP, length 120
23:08:56.959780 IP 192.168.43.147.8880 > 192.168.43.124.7773: UDP, length 120
23:08:56.967500 IP 192.168.43.124.8880 > 192.168.43.146.7771: UDP, length 120
23:08:57.017566 IP 192.168.43.124.8880 > 192.168.43.146.7771: UDP, length 120
23:08:57.020811 IP 192.168.43.147.8880 > 192.168.43.124.7773: UDP, length 120
23:08:57.065604 IP 192.168.43.147.8880 > 192.168.43.124.7773: UDP, length 120
23:08:57.067565 IP 192.168.43.124.8880 > 192.168.43.146.7771: UDP, length 120
23:08:57.108008 IP 192.168.43.147.8880 > 192.168.43.124.7773: UDP, length 120
23:08:57.117567 IP 192.168.43.124.8880 > 192.168.43.146.7771: UDP, length 120
23:08:57.167569 IP 192.168.43.124.8880 > 192.168.43.146.7771: UDP, length 120
23:08:57.169239 IP 192.168.43.147.8880 > 192.168.43.124.7773: UDP, length 120
23:08:57.215678 IP 192.168.43.147.8880 > 192.168.43.124.7773: UDP, length 120
23:08:57.217563 IP 192.168.43.124.8880 > 192.168.43.146.7771: UDP, length 120
23:08:57.256657 IP 192.168.43.147.8880 > 192.168.43.124.7773: UDP, length 120
23:08:57.267565 IP 192.168.43.124.8880 > 192.168.43.146.7771: UDP, length 120
23:08:57.317490 IP 192.168.43.124.8880 > 192.168.43.146.7771: UDP, length 120
23:08:57.328691 IP 192.168.43.147.8880 > 192.168.43.124.7773: UDP, length 120
23:08:57.359767 IP 192.168.43.147.8880 > 192.168.43.124.7773: UDP, length 120
23:08:57.367624 IP 192.168.43.124.8880 > 192.168.43.146.7771: UDP, length 120
23:08:57.417616 IP 192.168.43.124.8880 > 192.168.43.146.7771: UDP, length 120
23:08:57.421396 IP 192.168.43.147.8880 > 192.168.43.124.7773: UDP, length 120
23:08:57.461055 IP 192.168.43.147.8880 > 192.168.43.124.7773: UDP, length 120
23:08:57.467616 IP 192.168.43.124.8880 > 192.168.43.146.7771: UDP, length 120
23:08:57.510259 IP 192.168.43.147.8880 > 192.168.43.124.7773: UDP, length 120
23:08:57.517616 IP 192.168.43.124.8880 > 192.168.43.146.7771: UDP, length 120
23:08:57.567617 IP 192.168.43.124.8880 > 192.168.43.146.7771: UDP, length 120
23:08:57.571307 IP 192.168.43.147.8880 > 192.168.43.124.7773: UDP, length 120
23:08:57.612321 IP 192.168.43.147.8880 > 192.168.43.124.7773: UDP, length 120
23:08:57.617616 IP 192.168.43.124.8880 > 192.168.43.146.7771: UDP, length 120
23:08:57.661097 IP 192.168.43.147.8880 > 192.168.43.124.7773: UDP, length 120
23:08:57.667618 IP 192.168.43.124.8880 > 192.168.43.146.7771: UDP, length 120
23:08:57.717609 IP 192.168.43.124.8880 > 192.168.43.146.7771: UDP, length 120
23:08:57.719468 IP 192.168.43.147.8880 > 192.168.43.124.7773: UDP, length 120
23:08:57.759587 IP 192.168.43.147.8880 > 192.168.43.124.7773: UDP, length 120
23:08:57.767568 IP 192.168.43.124.8880 > 192.168.43.146.7771: UDP, length 120
23:08:57.806720 IP 192.168.43.147.8880 > 192.168.43.124.7773: UDP, length 120
23:08:57.817613 IP 192.168.43.124.8880 > 192.168.43.146.7771: UDP, length 120
23:08:57.867617 IP 192.168.43.124.8880 > 192.168.43.146.7771: UDP, length 120
23:08:57.870380 IP 192.168.43.147.8880 > 192.168.43.124.7773: UDP, length 120
23:08:57.911255 IP 192.168.43.147.8880 > 192.168.43.124.7773: UDP, length 120
23:08:57.917616 IP 192.168.43.124.8880 > 192.168.43.146.7771: UDP, length 120
23:08:57.960351 IP 192.168.43.147.8880 > 192.168.43.124.7773: UDP, length 120
23:08:57.967616 IP 192.168.43.124.8880 > 192.168.43.146.7771: UDP, length 120
23:08:58.017618 IP 192.168.43.124.8880 > 192.168.43.146.7771: UDP, length 120
23:08:58.020280 IP 192.168.43.147.8880 > 192.168.43.124.7773: UDP, length 120
23:08:58.060594 IP 192.168.43.147.8880 > 192.168.43.124.7773: UDP, length 120
23:08:58.067569 IP 192.168.43.124.8880 > 192.168.43.146.7771: UDP, length 120
23:08:58.110385 IP 192.168.43.147.8880 > 192.168.43.124.7773: UDP, length 120
23:08:58.117568 IP 192.168.43.124.8880 > 192.168.43.146.7771: UDP, length 120
23:08:58.162801 IP 192.168.43.147.8880 > 192.168.43.124.7773: UDP, length 120
23:08:58.167566 IP 192.168.43.124.8880 > 192.168.43.146.7771: UDP, length 120
23:08:58.217484 IP 192.168.43.124.8880 > 192.168.43.146.7771: UDP, length 120
23:08:58.229450 IP 192.168.43.147.8880 > 192.168.43.124.7773: UDP, length 120
23:08:58.259959 IP 192.168.43.147.8880 > 192.168.43.124.7773: UDP, length 120
23:08:58.267565 IP 192.168.43.124.8880 > 192.168.43.146.7771: UDP, length 120
23:08:58.306802 IP 192.168.43.147.8880 > 192.168.43.124.7773: UDP, length 120
23:08:58.317530 IP 192.168.43.124.8880 > 192.168.43.146.7771: UDP, length 120
23:08:58.367565 IP 192.168.43.124.8880 > 192.168.43.146.7771: UDP, length 120
23:08:58.368957 IP 192.168.43.147.8880 > 192.168.43.124.7773: UDP, length 120
23:08:58.411325 IP 192.168.43.147.8880 > 192.168.43.124.7773: UDP, length 120
23:08:58.417513 IP 192.168.43.124.8880 > 192.168.43.146.7771: UDP, length 120
23:08:58.458737 IP 192.168.43.147.8880 > 192.168.43.124.7773: UDP, length 120
23:08:58.467565 IP 192.168.43.124.8880 > 192.168.43.146.7771: UDP, length 120
23:08:58.510162 IP 192.168.43.147.8880 > 192.168.43.124.7773: UDP, length 120
23:08:58.517567 IP 192.168.43.124.8880 > 192.168.43.146.7771: UDP, length 120
23:08:58.556601 IP 192.168.43.147.8880 > 192.168.43.124.7773: UDP, length 120
23:08:58.567567 IP 192.168.43.124.8880 > 192.168.43.146.7771: UDP, length 120
23:08:58.611759 IP 192.168.43.147.8880 > 192.168.43.124.7773: UDP, length 120
23:08:58.617564 IP 192.168.43.124.8880 > 192.168.43.146.7771: UDP, length 120
23:08:58.663239 IP 192.168.43.147.8880 > 192.168.43.124.7773: UDP, length 120
23:08:58.667568 IP 192.168.43.124.8880 > 192.168.43.146.7771: UDP, length 120
23:08:58.717507 IP 192.168.43.124.8880 > 192.168.43.146.7771: UDP, length 120
23:08:58.732842 IP 192.168.43.147.8880 > 192.168.43.124.7773: UDP, length 120
23:08:58.759740 IP 192.168.43.147.8880 > 192.168.43.124.7773: UDP, length 120
23:08:58.767500 IP 192.168.43.124.8880 > 192.168.43.146.7771: UDP, length 120
23:08:58.809553 IP 192.168.43.147.8880 > 192.168.43.124.7773: UDP, length 120
23:08:58.817488 IP 192.168.43.124.8880 > 192.168.43.146.7771: UDP, length 120
23:08:58.857297 IP 192.168.43.147.8880 > 192.168.43.124.7773: UDP, length 120
23:08:58.867566 IP 192.168.43.124.8880 > 192.168.43.146.7771: UDP, length 120
23:08:58.909770 IP 192.168.43.147.8880 > 192.168.43.124.7773: UDP, length 120
23:08:58.917565 IP 192.168.43.124.8880 > 192.168.43.146.7771: UDP, length 120
23:08:58.962215 IP 192.168.43.147.8880 > 192.168.43.124.7773: UDP, length 120
23:08:58.967567 IP 192.168.43.124.8880 > 192.168.43.146.7771: UDP, length 120
23:08:59.011847 IP 192.168.43.147.8880 > 192.168.43.124.7773: UDP, length 120
23:08:59.017493 IP 192.168.43.124.8880 > 192.168.43.146.7771: UDP, length 120
23:08:59.061923 IP 192.168.43.147.8880 > 192.168.43.124.7773: UDP, length 120
23:08:59.067565 IP 192.168.43.124.8880 > 192.168.43.146.7771: UDP, length 120
23:08:59.113721 IP 192.168.43.147.8880 > 192.168.43.124.7773: UDP, length 120
23:08:59.117567 IP 192.168.43.124.8880 > 192.168.43.146.7771: UDP, length 120
23:08:59.162226 IP 192.168.43.147.8880 > 192.168.43.124.7773: UDP, length 120
23:08:59.167565 IP 192.168.43.124.8880 > 192.168.43.146.7771: UDP, length 120
23:08:59.213533 IP 192.168.43.147.8880 > 192.168.43.124.7773: UDP, length 120
23:08:59.217569 IP 192.168.43.124.8880 > 192.168.43.146.7771: UDP, length 120
23:08:59.267565 IP 192.168.43.124.8880 > 192.168.43.146.7771: UDP, length 120
23:08:59.269115 IP 192.168.43.147.8880 > 192.168.43.124.7773: UDP, length 120
23:08:59.316985 IP 192.168.43.147.8880 > 192.168.43.124.7773: UDP, length 120
23:08:59.317506 IP 192.168.43.124.8880 > 192.168.43.146.7771: UDP, length 120
23:08:59.367615 IP 192.168.43.124.8880 > 192.168.43.146.7771: UDP, length 120
23:08:59.368535 IP 192.168.43.147.8880 > 192.168.43.124.7773: UDP, length 120
23:08:59.417616 IP 192.168.43.124.8880 > 192.168.43.146.7771: UDP, length 120
23:08:59.424115 IP 192.168.43.147.8880 > 192.168.43.124.7773: UDP, length 120
23:08:59.462619 IP 192.168.43.147.8880 > 192.168.43.124.7773: UDP, length 120
23:08:59.467616 IP 192.168.43.124.8880 > 192.168.43.146.7771: UDP, length 120
23:08:59.512076 IP 192.168.43.147.8880 > 192.168.43.124.7773: UDP, length 120
23:08:59.517615 IP 192.168.43.124.8880 > 192.168.43.146.7771: UDP, length 120
23:08:59.562710 IP 192.168.43.147.8880 > 192.168.43.124.7773: UDP, length 120
23:08:59.567615 IP 192.168.43.124.8880 > 192.168.43.146.7771: UDP, length 120
23:08:59.613653 IP 192.168.43.147.8880 > 192.168.43.124.7773: UDP, length 120
23:08:59.617616 IP 192.168.43.124.8880 > 192.168.43.146.7771: UDP, length 120
23:08:59.662123 IP 192.168.43.147.8880 > 192.168.43.124.7773: UDP, length 120
23:08:59.667617 IP 192.168.43.124.8880 > 192.168.43.146.7771: UDP, length 120
23:08:59.714110 IP 192.168.43.147.8880 > 192.168.43.124.7773: UDP, length 120
23:08:59.717616 IP 192.168.43.124.8880 > 192.168.43.146.7771: UDP, length 120
23:08:59.763786 IP 192.168.43.147.8880 > 192.168.43.124.7773: UDP, length 120
23:08:59.767568 IP 192.168.43.124.8880 > 192.168.43.146.7771: UDP, length 120
23:08:59.812361 IP 192.168.43.147.8880 > 192.168.43.124.7773: UDP, length 120
23:08:59.817563 IP 192.168.43.124.8880 > 192.168.43.146.7771: UDP, length 120
23:08:59.866564 IP 192.168.43.147.8880 > 192.168.43.124.7773: UDP, length 120
23:08:59.867529 IP 192.168.43.124.8880 > 192.168.43.146.7771: UDP, length 120
23:08:59.911333 IP 192.168.43.147.8880 > 192.168.43.124.7773: UDP, length 120
23:08:59.917499 IP 192.168.43.124.8880 > 192.168.43.146.7771: UDP, length 120
23:08:59.961904 IP 192.168.43.147.8880 > 192.168.43.124.7773: UDP, length 120
23:08:59.967503 IP 192.168.43.124.8880 > 192.168.43.146.7771: UDP, length 120
23:09:00.011253 IP 192.168.43.147.8880 > 192.168.43.124.7773: UDP, length 120
23:09:00.017563 IP 192.168.43.124.8880 > 192.168.43.146.7771: UDP, length 120
23:09:00.061725 IP 192.168.43.147.8880 > 192.168.43.124.7773: UDP, length 120
23:09:00.067565 IP 192.168.43.124.8880 > 192.168.43.146.7771: UDP, length 120
23:09:00.111559 IP 192.168.43.147.8880 > 192.168.43.124.7773: UDP, length 120
23:09:00.117566 IP 192.168.43.124.8880 > 192.168.43.146.7771: UDP, length 120
23:09:00.160885 IP 192.168.43.147.8880 > 192.168.43.124.7773: UDP, length 120
23:09:00.167567 IP 192.168.43.124.8880 > 192.168.43.146.7771: UDP, length 120
23:09:00.213846 IP 192.168.43.147.8880 > 192.168.43.124.7773: UDP, length 120
23:09:00.217565 IP 192.168.43.124.8880 > 192.168.43.146.7771: UDP, length 120
23:09:00.258195 IP 192.168.43.147.8880 > 192.168.43.124.7773: UDP, length 120
23:09:00.267565 IP 192.168.43.124.8880 > 192.168.43.146.7771: UDP, length 120
23:09:00.313016 IP 192.168.43.147.8880 > 192.168.43.124.7773: UDP, length 120
23:09:00.317566 IP 192.168.43.124.8880 > 192.168.43.146.7771: UDP, length 120
23:09:00.362797 IP 192.168.43.147.8880 > 192.168.43.124.7773: UDP, length 120
23:09:00.367565 IP 192.168.43.124.8880 > 192.168.43.146.7771: UDP, length 120
23:09:00.412827 IP 192.168.43.147.8880 > 192.168.43.124.7773: UDP, length 120
23:09:00.417565 IP 192.168.43.124.8880 > 192.168.43.146.7771: UDP, length 120
23:09:00.465681 IP 192.168.43.147.8880 > 192.168.43.124.7773: UDP, length 120
23:09:00.467531 IP 192.168.43.124.8880 > 192.168.43.146.7771: UDP, length 120
23:09:00.517566 IP 192.168.43.124.8880 > 192.168.43.146.7771: UDP, length 120
23:09:00.520083 IP 192.168.43.147.8880 > 192.168.43.124.7773: UDP, length 120
23:09:00.561628 IP 192.168.43.147.8880 > 192.168.43.124.7773: UDP, length 120
23:09:00.567510 IP 192.168.43.124.8880 > 192.168.43.146.7771: UDP, length 120
23:09:00.609734 IP 192.168.43.147.8880 > 192.168.43.124.7773: UDP, length 120
23:09:00.617564 IP 192.168.43.124.8880 > 192.168.43.146.7771: UDP, length 120
23:09:00.663589 IP 192.168.43.147.8880 > 192.168.43.124.7773: UDP, length 120
23:09:00.667566 IP 192.168.43.124.8880 > 192.168.43.146.7771: UDP, length 120
23:09:00.713061 IP 192.168.43.147.8880 > 192.168.43.124.7773: UDP, length 120
23:09:00.717616 IP 192.168.43.124.8880 > 192.168.43.146.7771: UDP, length 120
23:09:00.763830 IP 192.168.43.147.8880 > 192.168.43.124.7773: UDP, length 120
23:09:00.767571 IP 192.168.43.124.8880 > 192.168.43.146.7771: UDP, length 120
23:09:00.809085 IP 192.168.43.147.8880 > 192.168.43.124.7773: UDP, length 120
23:09:00.817561 IP 192.168.43.124.8880 > 192.168.43.146.7771: UDP, length 120
23:09:00.864414 IP 192.168.43.147.8880 > 192.168.43.124.7773: UDP, length 120
23:09:00.867564 IP 192.168.43.124.8880 > 192.168.43.146.7771: UDP, length 120
23:09:00.913566 IP 192.168.43.147.8880 > 192.168.43.124.7773: UDP, length 120
23:09:00.917529 IP 192.168.43.124.8880 > 192.168.43.146.7771: UDP, length 120
23:09:00.961406 IP 192.168.43.147.8880 > 192.168.43.124.7773: UDP, length 120
23:09:00.967528 IP 192.168.43.124.8880 > 192.168.43.146.7771: UDP, length 120
23:09:01.011260 IP 192.168.43.147.8880 > 192.168.43.124.7773: UDP, length 120
23:09:01.017566 IP 192.168.43.124.8880 > 192.168.43.146.7771: UDP, length 120
23:09:01.059573 IP 192.168.43.147.8880 > 192.168.43.124.7773: UDP, length 120
23:09:01.067565 IP 192.168.43.124.8880 > 192.168.43.146.7771: UDP, length 120
23:09:01.110949 IP 192.168.43.147.8880 > 192.168.43.124.7773: UDP, length 120
23:09:01.117539 IP 192.168.43.124.8880 > 192.168.43.146.7771: UDP, length 120
23:09:01.158894 IP 192.168.43.147.8880 > 192.168.43.124.7773: UDP, length 120
23:09:01.167519 IP 192.168.43.124.8880 > 192.168.43.146.7771: UDP, length 120
23:09:01.210664 IP 192.168.43.147.8880 > 192.168.43.124.7773: UDP, length 120
23:09:01.217566 IP 192.168.43.124.8880 > 192.168.43.146.7771: UDP, length 120
23:09:01.261118 IP 192.168.43.147.8880 > 192.168.43.124.7773: UDP, length 120
23:09:01.267566 IP 192.168.43.124.8880 > 192.168.43.146.7771: UDP, length 120
23:09:01.314273 IP 192.168.43.147.8880 > 192.168.43.124.7773: UDP, length 120
23:09:01.317566 IP 192.168.43.124.8880 > 192.168.43.146.7771: UDP, length 120
23:09:01.367489 IP 192.168.43.124.8880 > 192.168.43.146.7771: UDP, length 120
23:09:01.370281 IP 192.168.43.147.8880 > 192.168.43.124.7773: UDP, length 120
23:09:01.417567 IP 192.168.43.124.8880 > 192.168.43.146.7771: UDP, length 120
23:09:01.427352 IP 192.168.43.147.8880 > 192.168.43.124.7773: UDP, length 120
23:09:01.459966 IP 192.168.43.147.8880 > 192.168.43.124.7773: UDP, length 120
23:09:01.467566 IP 192.168.43.124.8880 > 192.168.43.146.7771: UDP, length 120
23:09:01.516972 IP 192.168.43.147.8880 > 192.168.43.124.7773: UDP, length 120
23:09:01.517564 IP 192.168.43.124.8880 > 192.168.43.146.7771: UDP, length 120
23:09:01.564644 IP 192.168.43.147.8880 > 192.168.43.124.7773: UDP, length 120
23:09:01.567564 IP 192.168.43.124.8880 > 192.168.43.146.7771: UDP, length 120
23:09:01.617566 IP 192.168.43.124.8880 > 192.168.43.146.7771: UDP, length 120
23:09:01.622258 IP 192.168.43.147.8880 > 192.168.43.124.7773: UDP, length 120
23:09:01.667566 IP 192.168.43.124.8880 > 192.168.43.146.7771: UDP, length 120
23:09:01.674564 IP 192.168.43.147.8880 > 192.168.43.124.7773: UDP, length 120
23:09:01.717616 IP 192.168.43.124.8880 > 192.168.43.146.7771: UDP, length 120
23:09:01.726595 IP 192.168.43.147.8880 > 192.168.43.124.7773: UDP, length 120
23:09:01.760057 IP 192.168.43.147.8880 > 192.168.43.124.7773: UDP, length 120
23:09:01.767569 IP 192.168.43.124.8880 > 192.168.43.146.7771: UDP, length 120
23:09:01.810541 IP 192.168.43.147.8880 > 192.168.43.124.7773: UDP, length 120
23:09:01.817565 IP 192.168.43.124.8880 > 192.168.43.146.7771: UDP, length 120
23:09:01.864103 IP 192.168.43.147.8880 > 192.168.43.124.7773: UDP, length 120
23:09:01.867565 IP 192.168.43.124.8880 > 192.168.43.146.7771: UDP, length 120
23:09:01.913366 IP 192.168.43.147.8880 > 192.168.43.124.7773: UDP, length 120
23:09:01.917566 IP 192.168.43.124.8880 > 192.168.43.146.7771: UDP, length 120
23:09:01.967566 IP 192.168.43.124.8880 > 192.168.43.146.7771: UDP, length 120
23:09:01.982031 IP 192.168.43.147.8880 > 192.168.43.124.7773: UDP, length 120
23:09:02.009585 IP 192.168.43.147.8880 > 192.168.43.124.7773: UDP, length 120
23:09:02.017566 IP 192.168.43.124.8880 > 192.168.43.146.7771: UDP, length 120
23:09:02.056714 IP 192.168.43.147.8880 > 192.168.43.124.7773: UDP, length 120
23:09:02.067565 IP 192.168.43.124.8880 > 192.168.43.146.7771: UDP, length 120
23:09:02.108144 IP 192.168.43.147.8880 > 192.168.43.124.7773: UDP, length 120
23:09:02.117566 IP 192.168.43.124.8880 > 192.168.43.146.7771: UDP, length 120
23:09:02.157986 IP 192.168.43.147.8880 > 192.168.43.124.7773: UDP, length 120
23:09:02.167484 IP 192.168.43.124.8880 > 192.168.43.146.7771: UDP, length 120
23:09:02.211362 IP 192.168.43.147.8880 > 192.168.43.124.7773: UDP, length 120
23:09:02.217565 IP 192.168.43.124.8880 > 192.168.43.146.7771: UDP, length 120
23:09:02.261476 IP 192.168.43.147.8880 > 192.168.43.124.7773: UDP, length 120
23:09:02.267567 IP 192.168.43.124.8880 > 192.168.43.146.7771: UDP, length 120
23:09:02.310601 IP 192.168.43.147.8880 > 192.168.43.124.7773: UDP, length 120
23:09:02.317508 IP 192.168.43.124.8880 > 192.168.43.146.7771: UDP, length 120
23:09:02.362598 IP 192.168.43.147.8880 > 192.168.43.124.7773: UDP, length 120
23:09:02.367491 IP 192.168.43.124.8880 > 192.168.43.146.7771: UDP, length 120
23:09:02.413798 IP 192.168.43.147.8880 > 192.168.43.124.7773: UDP, length 120
23:09:02.417568 IP 192.168.43.124.8880 > 192.168.43.146.7771: UDP, length 120
23:09:02.465696 IP 192.168.43.147.8880 > 192.168.43.124.7773: UDP, length 120
23:09:02.467565 IP 192.168.43.124.8880 > 192.168.43.146.7771: UDP, length 120
23:09:02.517566 IP 192.168.43.124.8880 > 192.168.43.146.7771: UDP, length 120
23:09:02.540947 IP 192.168.43.147.8880 > 192.168.43.124.7773: UDP, length 120
23:09:02.567566 IP 192.168.43.124.8880 > 192.168.43.146.7771: UDP, length 120
23:09:02.570601 IP 192.168.43.147.8880 > 192.168.43.124.7773: UDP, length 120
23:09:02.611534 IP 192.168.43.147.8880 > 192.168.43.124.7773: UDP, length 120
23:09:02.617563 IP 192.168.43.124.8880 > 192.168.43.146.7771: UDP, length 120
23:09:02.659972 IP 192.168.43.147.8880 > 192.168.43.124.7773: UDP, length 120
23:09:02.667567 IP 192.168.43.124.8880 > 192.168.43.146.7771: UDP, length 120
23:09:02.711544 IP 192.168.43.147.8880 > 192.168.43.124.7773: UDP, length 120
23:09:02.717566 IP 192.168.43.124.8880 > 192.168.43.146.7771: UDP, length 120
23:09:02.760841 IP 192.168.43.147.8880 > 192.168.43.124.7773: UDP, length 120
23:09:02.767566 IP 192.168.43.124.8880 > 192.168.43.146.7771: UDP, length 120
23:09:02.811227 IP 192.168.43.147.8880 > 192.168.43.124.7773: UDP, length 120
23:09:02.817614 IP 192.168.43.124.8880 > 192.168.43.146.7771: UDP, length 120
23:09:02.862936 IP 192.168.43.147.8880 > 192.168.43.124.7773: UDP, length 120
23:09:02.867503 IP 192.168.43.124.8880 > 192.168.43.146.7771: UDP, length 120
23:09:02.915046 IP 192.168.43.147.8880 > 192.168.43.124.7773: UDP, length 120
23:09:02.917567 IP 192.168.43.124.8880 > 192.168.43.146.7771: UDP, length 120
23:09:02.961588 IP 192.168.43.147.8880 > 192.168.43.124.7773: UDP, length 120
23:09:02.967568 IP 192.168.43.124.8880 > 192.168.43.146.7771: UDP, length 120
23:09:03.016374 IP 192.168.43.147.8880 > 192.168.43.124.7773: UDP, length 120
23:09:03.017531 IP 192.168.43.124.8880 > 192.168.43.146.7771: UDP, length 120
23:09:03.061119 IP 192.168.43.147.8880 > 192.168.43.124.7773: UDP, length 120
23:09:03.067497 IP 192.168.43.124.8880 > 192.168.43.146.7771: UDP, length 120
23:09:03.111195 IP 192.168.43.147.8880 > 192.168.43.124.7773: UDP, length 120
23:09:03.117488 IP 192.168.43.124.8880 > 192.168.43.146.7771: UDP, length 120
23:09:03.161228 IP 192.168.43.147.8880 > 192.168.43.124.7773: UDP, length 120
23:09:03.167489 IP 192.168.43.124.8880 > 192.168.43.146.7771: UDP, length 120
23:09:03.208127 IP 192.168.43.147.8880 > 192.168.43.124.7773: UDP, length 120
23:09:03.217487 IP 192.168.43.124.8880 > 192.168.43.146.7771: UDP, length 120
23:09:03.262751 IP 192.168.43.147.8880 > 192.168.43.124.7773: UDP, length 120
23:09:03.267487 IP 192.168.43.124.8880 > 192.168.43.146.7771: UDP, length 120
23:09:03.311515 IP 192.168.43.147.8880 > 192.168.43.124.7773: UDP, length 120
23:09:03.317567 IP 192.168.43.124.8880 > 192.168.43.146.7771: UDP, length 120
23:09:03.363010 IP 192.168.43.147.8880 > 192.168.43.124.7773: UDP, length 120
23:09:03.367573 IP 192.168.43.124.8880 > 192.168.43.146.7771: UDP, length 120
23:09:03.412127 IP 192.168.43.147.8880 > 192.168.43.124.7773: UDP, length 120
23:09:03.417567 IP 192.168.43.124.8880 > 192.168.43.146.7771: UDP, length 120
23:09:03.466283 IP 192.168.43.147.8880 > 192.168.43.124.7773: UDP, length 120
23:09:03.467529 IP 192.168.43.124.8880 > 192.168.43.146.7771: UDP, length 120
23:09:03.515150 IP 192.168.43.147.8880 > 192.168.43.124.7773: UDP, length 120
23:09:03.517564 IP 192.168.43.124.8880 > 192.168.43.146.7771: UDP, length 120
23:09:03.567170 IP 192.168.43.147.8880 > 192.168.43.124.7773: UDP, length 120
23:09:03.567506 IP 192.168.43.124.8880 > 192.168.43.146.7771: UDP, length 120
23:09:03.613476 IP 192.168.43.147.8880 > 192.168.43.124.7773: UDP, length 120
23:09:03.617565 IP 192.168.43.124.8880 > 192.168.43.146.7771: UDP, length 120
23:09:03.667568 IP 192.168.43.124.8880 > 192.168.43.146.7771: UDP, length 120
23:09:03.669183 IP 192.168.43.147.8880 > 192.168.43.124.7773: UDP, length 120
23:09:03.711529 IP 192.168.43.147.8880 > 192.168.43.124.7773: UDP, length 120
23:09:03.717529 IP 192.168.43.124.8880 > 192.168.43.146.7771: UDP, length 120
23:09:03.759892 IP 192.168.43.147.8880 > 192.168.43.124.7773: UDP, length 120
23:09:03.767624 IP 192.168.43.124.8880 > 192.168.43.146.7771: UDP, length 120
23:09:03.811184 IP 192.168.43.147.8880 > 192.168.43.124.7773: UDP, length 120
23:09:03.817528 IP 192.168.43.124.8880 > 192.168.43.146.7771: UDP, length 120
23:09:03.861610 IP 192.168.43.147.8880 > 192.168.43.124.7773: UDP, length 120
23:09:03.867532 IP 192.168.43.124.8880 > 192.168.43.146.7771: UDP, length 120
23:09:03.911829 IP 192.168.43.147.8880 > 192.168.43.124.7773: UDP, length 120
23:09:03.917530 IP 192.168.43.124.8880 > 192.168.43.146.7771: UDP, length 120
23:09:03.964343 IP 192.168.43.147.8880 > 192.168.43.124.7773: UDP, length 120
23:09:03.967567 IP 192.168.43.124.8880 > 192.168.43.146.7771: UDP, length 120
23:09:04.014685 IP 192.168.43.147.8880 > 192.168.43.124.7773: UDP, length 120
23:09:04.017519 IP 192.168.43.124.8880 > 192.168.43.146.7771: UDP, length 120
23:09:04.059068 IP 192.168.43.147.8880 > 192.168.43.124.7773: UDP, length 120
23:09:04.067590 IP 192.168.43.124.8880 > 192.168.43.146.7771: UDP, length 120
23:09:04.113636 IP 192.168.43.147.8880 > 192.168.43.124.7773: UDP, length 120
23:09:04.117546 IP 192.168.43.124.8880 > 192.168.43.146.7771: UDP, length 120
23:09:04.166777 IP 192.168.43.147.8880 > 192.168.43.124.7773: UDP, length 120
23:09:04.167615 IP 192.168.43.124.8880 > 192.168.43.146.7771: UDP, length 120
23:09:04.217517 IP 192.168.43.124.8880 > 192.168.43.146.7771: UDP, length 120
23:09:04.232860 IP 192.168.43.147.8880 > 192.168.43.124.7773: UDP, length 120
23:09:04.267569 IP 192.168.43.124.8880 > 192.168.43.146.7771: UDP, length 120
23:09:04.288170 IP 192.168.43.147.8880 > 192.168.43.124.7773: UDP, length 120
23:09:04.307753 IP 192.168.43.147.8880 > 192.168.43.124.7773: UDP, length 120
23:09:04.317515 IP 192.168.43.124.8880 > 192.168.43.146.7771: UDP, length 120
23:09:04.363890 IP 192.168.43.147.8880 > 192.168.43.124.7773: UDP, length 120
23:09:04.367567 IP 192.168.43.124.8880 > 192.168.43.146.7771: UDP, length 120
23:09:04.412164 IP 192.168.43.147.8880 > 192.168.43.124.7773: UDP, length 120
23:09:04.417484 IP 192.168.43.124.8880 > 192.168.43.146.7771: UDP, length 120
23:09:04.461920 IP 192.168.43.147.8880 > 192.168.43.124.7773: UDP, length 120
23:09:04.467569 IP 192.168.43.124.8880 > 192.168.43.146.7771: UDP, length 120
23:09:04.509121 IP 192.168.43.147.8880 > 192.168.43.124.7773: UDP, length 120
23:09:04.517543 IP 192.168.43.124.8880 > 192.168.43.146.7771: UDP, length 120
23:09:04.565355 IP 192.168.43.147.8880 > 192.168.43.124.7773: UDP, length 120
23:09:04.567567 IP 192.168.43.124.8880 > 192.168.43.146.7771: UDP, length 120
23:09:04.611163 IP 192.168.43.147.8880 > 192.168.43.124.7773: UDP, length 120
23:09:04.617569 IP 192.168.43.124.8880 > 192.168.43.146.7771: UDP, length 120
23:09:04.659320 IP 192.168.43.147.8880 > 192.168.43.124.7773: UDP, length 120
23:09:04.667570 IP 192.168.43.124.8880 > 192.168.43.146.7771: UDP, length 120
23:09:04.713769 IP 192.168.43.147.8880 > 192.168.43.124.7773: UDP, length 120
23:09:04.717570 IP 192.168.43.124.8880 > 192.168.43.146.7771: UDP, length 120
23:09:04.762113 IP 192.168.43.147.8880 > 192.168.43.124.7773: UDP, length 120
23:09:04.767483 IP 192.168.43.124.8880 > 192.168.43.146.7771: UDP, length 120
23:09:04.811464 IP 192.168.43.147.8880 > 192.168.43.124.7773: UDP, length 120
23:09:04.817613 IP 192.168.43.124.8880 > 192.168.43.146.7771: UDP, length 120
23:09:04.861584 IP 192.168.43.147.8880 > 192.168.43.124.7773: UDP, length 120
23:09:04.867565 IP 192.168.43.124.8880 > 192.168.43.146.7771: UDP, length 120
23:09:04.911443 IP 192.168.43.147.8880 > 192.168.43.124.7773: UDP, length 120
23:09:04.917615 IP 192.168.43.124.8880 > 192.168.43.146.7771: UDP, length 120
23:09:04.967615 IP 192.168.43.124.8880 > 192.168.43.146.7771: UDP, length 120
23:09:04.971393 IP 192.168.43.147.8880 > 192.168.43.124.7773: UDP, length 120
23:09:05.013277 IP 192.168.43.147.8880 > 192.168.43.124.7773: UDP, length 120
23:09:05.017495 IP 192.168.43.124.8880 > 192.168.43.146.7771: UDP, length 120
23:09:05.065590 IP 192.168.43.147.8880 > 192.168.43.124.7773: UDP, length 120
23:09:05.067492 IP 192.168.43.124.8880 > 192.168.43.146.7771: UDP, length 120
23:09:05.117566 IP 192.168.43.124.8880 > 192.168.43.146.7771: UDP, length 120
23:09:05.128956 IP 192.168.43.147.8880 > 192.168.43.124.7773: UDP, length 120
23:09:05.162827 IP 192.168.43.147.8880 > 192.168.43.124.7773: UDP, length 120
23:09:05.167566 IP 192.168.43.124.8880 > 192.168.43.146.7771: UDP, length 120
23:09:05.211290 IP 192.168.43.147.8880 > 192.168.43.124.7773: UDP, length 120
23:09:05.217562 IP 192.168.43.124.8880 > 192.168.43.146.7771: UDP, length 120
23:09:05.267509 IP 192.168.43.124.8880 > 192.168.43.146.7771: UDP, length 120
23:09:05.267616 IP 192.168.43.147.8880 > 192.168.43.124.7773: UDP, length 120
23:09:05.317567 IP 192.168.43.124.8880 > 192.168.43.146.7771: UDP, length 120
23:09:05.322821 IP 192.168.43.147.8880 > 192.168.43.124.7773: UDP, length 120
23:09:05.359666 IP 192.168.43.147.8880 > 192.168.43.124.7773: UDP, length 120
23:09:05.367564 IP 192.168.43.124.8880 > 192.168.43.146.7771: UDP, length 120
23:09:05.411373 IP 192.168.43.147.8880 > 192.168.43.124.7773: UDP, length 120
23:09:05.417565 IP 192.168.43.124.8880 > 192.168.43.146.7771: UDP, length 120
23:09:05.459708 IP 192.168.43.147.8880 > 192.168.43.124.7773: UDP, length 120
23:09:05.467564 IP 192.168.43.124.8880 > 192.168.43.146.7771: UDP, length 120
23:09:05.511874 IP 192.168.43.147.8880 > 192.168.43.124.7773: UDP, length 120
23:09:05.517564 IP 192.168.43.124.8880 > 192.168.43.146.7771: UDP, length 120
23:09:05.567564 IP 192.168.43.124.8880 > 192.168.43.146.7771: UDP, length 120
23:09:05.569419 IP 192.168.43.147.8880 > 192.168.43.124.7773: UDP, length 120
23:09:05.617565 IP 192.168.43.124.8880 > 192.168.43.146.7771: UDP, length 120
23:09:05.623294 IP 192.168.43.147.8880 > 192.168.43.124.7773: UDP, length 120
23:09:05.667564 IP 192.168.43.124.8880 > 192.168.43.146.7771: UDP, length 120
23:09:05.678414 IP 192.168.43.147.8880 > 192.168.43.124.7773: UDP, length 120
23:09:05.716521 IP 192.168.43.147.8880 > 192.168.43.124.7773: UDP, length 120
23:09:05.717611 IP 192.168.43.124.8880 > 192.168.43.146.7771: UDP, length 120
23:09:05.760976 IP 192.168.43.147.8880 > 192.168.43.124.7773: UDP, length 120
23:09:05.767569 IP 192.168.43.124.8880 > 192.168.43.146.7771: UDP, length 120
23:09:05.817494 IP 192.168.43.124.8880 > 192.168.43.146.7771: UDP, length 120
23:09:05.822320 IP 192.168.43.147.8880 > 192.168.43.124.7773: UDP, length 120
23:09:05.867591 IP 192.168.43.124.8880 > 192.168.43.146.7771: UDP, length 120
23:09:05.868515 IP 192.168.43.147.8880 > 192.168.43.124.7773: UDP, length 120
23:09:05.917569 IP 192.168.43.124.8880 > 192.168.43.146.7771: UDP, length 120
23:09:05.922869 IP 192.168.43.147.8880 > 192.168.43.124.7773: UDP, length 120
23:09:05.967512 IP 192.168.43.124.8880 > 192.168.43.146.7771: UDP, length 120
23:09:05.977064 IP 192.168.43.147.8880 > 192.168.43.124.7773: UDP, length 120
23:09:06.010135 IP 192.168.43.147.8880 > 192.168.43.124.7773: UDP, length 120
23:09:06.017569 IP 192.168.43.124.8880 > 192.168.43.146.7771: UDP, length 120
23:09:06.063683 IP 192.168.43.147.8880 > 192.168.43.124.7773: UDP, length 120
23:09:06.067569 IP 192.168.43.124.8880 > 192.168.43.146.7771: UDP, length 120
23:09:06.111464 IP 192.168.43.147.8880 > 192.168.43.124.7773: UDP, length 120
23:09:06.117568 IP 192.168.43.124.8880 > 192.168.43.146.7771: UDP, length 120
23:09:06.167570 IP 192.168.43.124.8880 > 192.168.43.146.7771: UDP, length 120
23:09:06.172661 IP 192.168.43.147.8880 > 192.168.43.124.7773: UDP, length 120
23:09:06.217569 IP 192.168.43.124.8880 > 192.168.43.146.7771: UDP, length 120
23:09:06.230121 IP 192.168.43.147.8880 > 192.168.43.124.7773: UDP, length 120
23:09:06.256791 IP 192.168.43.147.8880 > 192.168.43.124.7773: UDP, length 120
23:09:06.267568 IP 192.168.43.124.8880 > 192.168.43.146.7771: UDP, length 120
23:09:06.310390 IP 192.168.43.147.8880 > 192.168.43.124.7773: UDP, length 120
23:09:06.317615 IP 192.168.43.124.8880 > 192.168.43.146.7771: UDP, length 120
23:09:06.359290 IP 192.168.43.147.8880 > 192.168.43.124.7773: UDP, length 120
23:09:06.367497 IP 192.168.43.124.8880 > 192.168.43.146.7771: UDP, length 120
23:09:06.417564 IP 192.168.43.124.8880 > 192.168.43.146.7771: UDP, length 120
23:09:06.418863 IP 192.168.43.147.8880 > 192.168.43.124.7773: UDP, length 120
23:09:06.459775 IP 192.168.43.147.8880 > 192.168.43.124.7773: UDP, length 120
23:09:06.467564 IP 192.168.43.124.8880 > 192.168.43.146.7771: UDP, length 120
23:09:06.510279 IP 192.168.43.147.8880 > 192.168.43.124.7773: UDP, length 120
23:09:06.517529 IP 192.168.43.124.8880 > 192.168.43.146.7771: UDP, length 120
23:09:06.559594 IP 192.168.43.147.8880 > 192.168.43.124.7773: UDP, length 120
23:09:06.567518 IP 192.168.43.124.8880 > 192.168.43.146.7771: UDP, length 120
23:09:06.606852 IP 192.168.43.147.8880 > 192.168.43.124.7773: UDP, length 120
23:09:06.617495 IP 192.168.43.124.8880 > 192.168.43.146.7771: UDP, length 120
23:09:06.657031 IP 192.168.43.147.8880 > 192.168.43.124.7773: UDP, length 120
23:09:06.667531 IP 192.168.43.124.8880 > 192.168.43.146.7771: UDP, length 120
23:09:06.712255 IP 192.168.43.147.8880 > 192.168.43.124.7773: UDP, length 120
23:09:06.717565 IP 192.168.43.124.8880 > 192.168.43.146.7771: UDP, length 120
23:09:06.756574 IP 192.168.43.147.8880 > 192.168.43.124.7773: UDP, length 120
23:09:06.767564 IP 192.168.43.124.8880 > 192.168.43.146.7771: UDP, length 120
23:09:06.806539 IP 192.168.43.147.8880 > 192.168.43.124.7773: UDP, length 120
23:09:06.817564 IP 192.168.43.124.8880 > 192.168.43.146.7771: UDP, length 120
23:09:06.867515 IP 192.168.43.124.8880 > 192.168.43.146.7771: UDP, length 120
23:09:06.867666 IP 192.168.43.147.8880 > 192.168.43.124.7773: UDP, length 120
23:09:06.917614 IP 192.168.43.124.8880 > 192.168.43.146.7771: UDP, length 120
23:09:06.923805 IP 192.168.43.147.8880 > 192.168.43.124.7773: UDP, length 120
23:09:06.959626 IP 192.168.43.147.8880 > 192.168.43.124.7773: UDP, length 120
23:09:06.967567 IP 192.168.43.124.8880 > 192.168.43.146.7771: UDP, length 120
23:09:07.009939 IP 192.168.43.147.8880 > 192.168.43.124.7773: UDP, length 120
23:09:07.017616 IP 192.168.43.124.8880 > 192.168.43.146.7771: UDP, length 120
23:09:07.067615 IP 192.168.43.124.8880 > 192.168.43.146.7771: UDP, length 120
23:09:07.068855 IP 192.168.43.147.8880 > 192.168.43.124.7773: UDP, length 120
23:09:07.117616 IP 192.168.43.124.8880 > 192.168.43.146.7771: UDP, length 120
23:09:07.121905 IP 192.168.43.147.8880 > 192.168.43.124.7773: UDP, length 120
23:09:07.156526 IP 192.168.43.147.8880 > 192.168.43.124.7773: UDP, length 120
23:09:07.167513 IP 192.168.43.124.8880 > 192.168.43.146.7771: UDP, length 120
23:09:07.216538 IP 192.168.43.147.8880 > 192.168.43.124.7773: UDP, length 120
23:09:07.217527 IP 192.168.43.124.8880 > 192.168.43.146.7771: UDP, length 120
23:09:07.261605 IP 192.168.43.147.8880 > 192.168.43.124.7773: UDP, length 120
23:09:07.267504 IP 192.168.43.124.8880 > 192.168.43.146.7771: UDP, length 120
23:09:07.317566 IP 192.168.43.124.8880 > 192.168.43.146.7771: UDP, length 120
23:09:07.320470 IP 192.168.43.147.8880 > 192.168.43.124.7773: UDP, length 120
23:09:07.361297 IP 192.168.43.147.8880 > 192.168.43.124.7773: UDP, length 120
23:09:07.367569 IP 192.168.43.124.8880 > 192.168.43.146.7771: UDP, length 120
23:09:07.410002 IP 192.168.43.147.8880 > 192.168.43.124.7773: UDP, length 120
23:09:07.417564 IP 192.168.43.124.8880 > 192.168.43.146.7771: UDP, length 120
23:09:07.459967 IP 192.168.43.147.8880 > 192.168.43.124.7773: UDP, length 120
23:09:07.467568 IP 192.168.43.124.8880 > 192.168.43.146.7771: UDP, length 120
23:09:07.512199 IP 192.168.43.147.8880 > 192.168.43.124.7773: UDP, length 120
23:09:07.517567 IP 192.168.43.124.8880 > 192.168.43.146.7771: UDP, length 120
23:09:07.562444 IP 192.168.43.147.8880 > 192.168.43.124.7773: UDP, length 120
23:09:07.567567 IP 192.168.43.124.8880 > 192.168.43.146.7771: UDP, length 120
23:09:07.611991 IP 192.168.43.147.8880 > 192.168.43.124.7773: UDP, length 120
23:09:07.617570 IP 192.168.43.124.8880 > 192.168.43.146.7771: UDP, length 120
23:09:07.665715 IP 192.168.43.147.8880 > 192.168.43.124.7773: UDP, length 120
23:09:07.667572 IP 192.168.43.124.8880 > 192.168.43.146.7771: UDP, length 120
23:09:07.713703 IP 192.168.43.147.8880 > 192.168.43.124.7773: UDP, length 120
23:09:07.717609 IP 192.168.43.124.8880 > 192.168.43.146.7771: UDP, length 120
23:09:07.764818 IP 192.168.43.147.8880 > 192.168.43.124.7773: UDP, length 120
23:09:07.767483 IP 192.168.43.124.8880 > 192.168.43.146.7771: UDP, length 120
23:09:07.817564 IP 192.168.43.124.8880 > 192.168.43.146.7771: UDP, length 120
23:09:07.822097 IP 192.168.43.147.8880 > 192.168.43.124.7773: UDP, length 120
23:09:07.867569 IP 192.168.43.124.8880 > 192.168.43.146.7771: UDP, length 120
23:09:07.869953 IP 192.168.43.147.8880 > 192.168.43.124.7773: UDP, length 120
23:09:07.913522 IP 192.168.43.147.8880 > 192.168.43.124.7773: UDP, length 120
23:09:07.917569 IP 192.168.43.124.8880 > 192.168.43.146.7771: UDP, length 120
23:09:07.967577 IP 192.168.43.124.8880 > 192.168.43.146.7771: UDP, length 120
23:09:07.970618 IP 192.168.43.147.8880 > 192.168.43.124.7773: UDP, length 120
23:09:08.011656 IP 192.168.43.147.8880 > 192.168.43.124.7773: UDP, length 120
23:09:08.017571 IP 192.168.43.124.8880 > 192.168.43.146.7771: UDP, length 120
23:09:08.061990 IP 192.168.43.147.8880 > 192.168.43.124.7773: UDP, length 120
23:09:08.067503 IP 192.168.43.124.8880 > 192.168.43.146.7771: UDP, length 120
23:09:08.114299 IP 192.168.43.147.8880 > 192.168.43.124.7773: UDP, length 120
23:09:08.117570 IP 192.168.43.124.8880 > 192.168.43.146.7771: UDP, length 120
23:09:08.159142 IP 192.168.43.147.8880 > 192.168.43.124.7773: UDP, length 120
23:09:08.167566 IP 192.168.43.124.8880 > 192.168.43.146.7771: UDP, length 120
23:09:08.212810 IP 192.168.43.147.8880 > 192.168.43.124.7773: UDP, length 120
23:09:08.217568 IP 192.168.43.124.8880 > 192.168.43.146.7771: UDP, length 120
23:09:08.262216 IP 192.168.43.147.8880 > 192.168.43.124.7773: UDP, length 120
23:09:08.267566 IP 192.168.43.124.8880 > 192.168.43.146.7771: UDP, length 120
23:09:08.313298 IP 192.168.43.147.8880 > 192.168.43.124.7773: UDP, length 120
23:09:08.317567 IP 192.168.43.124.8880 > 192.168.43.146.7771: UDP, length 120
23:09:08.367565 IP 192.168.43.124.8880 > 192.168.43.146.7771: UDP, length 120
23:09:08.417566 IP 192.168.43.124.8880 > 192.168.43.146.7771: UDP, length 120
23:09:08.435660 IP 192.168.43.147.8880 > 192.168.43.124.7773: UDP, length 120
23:09:08.435673 IP 192.168.43.147.8880 > 192.168.43.124.7773: UDP, length 120
23:09:08.461482 IP 192.168.43.147.8880 > 192.168.43.124.7773: UDP, length 120
23:09:08.467566 IP 192.168.43.124.8880 > 192.168.43.146.7771: UDP, length 120
23:09:08.511271 IP 192.168.43.147.8880 > 192.168.43.124.7773: UDP, length 120
23:09:08.517617 IP 192.168.43.124.8880 > 192.168.43.146.7771: UDP, length 120
23:09:08.559805 IP 192.168.43.147.8880 > 192.168.43.124.7773: UDP, length 120
23:09:08.567618 IP 192.168.43.124.8880 > 192.168.43.146.7771: UDP, length 120
23:09:08.611144 IP 192.168.43.147.8880 > 192.168.43.124.7773: UDP, length 120
23:09:08.617496 IP 192.168.43.124.8880 > 192.168.43.146.7771: UDP, length 120
23:09:08.661784 IP 192.168.43.147.8880 > 192.168.43.124.7773: UDP, length 120
23:09:08.667502 IP 192.168.43.124.8880 > 192.168.43.146.7771: UDP, length 120
23:09:08.712883 IP 192.168.43.147.8880 > 192.168.43.124.7773: UDP, length 120
23:09:08.717566 IP 192.168.43.124.8880 > 192.168.43.146.7771: UDP, length 120
23:09:08.762135 IP 192.168.43.147.8880 > 192.168.43.124.7773: UDP, length 120
23:09:08.767483 IP 192.168.43.124.8880 > 192.168.43.146.7771: UDP, length 120
23:09:08.813934 IP 192.168.43.147.8880 > 192.168.43.124.7773: UDP, length 120
23:09:08.817565 IP 192.168.43.124.8880 > 192.168.43.146.7771: UDP, length 120
23:09:08.862230 IP 192.168.43.147.8880 > 192.168.43.124.7773: UDP, length 120
23:09:08.867567 IP 192.168.43.124.8880 > 192.168.43.146.7771: UDP, length 120
23:09:08.912301 IP 192.168.43.147.8880 > 192.168.43.124.7773: UDP, length 120
23:09:08.917565 IP 192.168.43.124.8880 > 192.168.43.146.7771: UDP, length 120
23:09:08.961855 IP 192.168.43.147.8880 > 192.168.43.124.7773: UDP, length 120
23:09:08.967566 IP 192.168.43.124.8880 > 192.168.43.146.7771: UDP, length 120
23:09:09.017540 IP 192.168.43.124.8880 > 192.168.43.146.7771: UDP, length 120
23:09:09.026799 IP 192.168.43.147.8880 > 192.168.43.124.7773: UDP, length 120
23:09:09.067513 IP 192.168.43.124.8880 > 192.168.43.146.7771: UDP, length 120
23:09:09.079253 IP 192.168.43.147.8880 > 192.168.43.124.7773: UDP, length 120
23:09:09.108898 IP 192.168.43.147.8880 > 192.168.43.124.7773: UDP, length 120
23:09:09.117492 IP 192.168.43.124.8880 > 192.168.43.146.7771: UDP, length 120
23:09:09.159368 IP 192.168.43.147.8880 > 192.168.43.124.7773: UDP, length 120
23:09:09.167479 IP 192.168.43.124.8880 > 192.168.43.146.7771: UDP, length 120
23:09:09.212141 IP 192.168.43.147.8880 > 192.168.43.124.7773: UDP, length 120
23:09:09.217566 IP 192.168.43.124.8880 > 192.168.43.146.7771: UDP, length 120
23:09:09.261670 IP 192.168.43.147.8880 > 192.168.43.124.7773: UDP, length 120
23:09:09.267566 IP 192.168.43.124.8880 > 192.168.43.146.7771: UDP, length 120
23:09:09.315132 IP 192.168.43.147.8880 > 192.168.43.124.7773: UDP, length 120
23:09:09.317567 IP 192.168.43.124.8880 > 192.168.43.146.7771: UDP, length 120
23:09:09.364859 IP 192.168.43.147.8880 > 192.168.43.124.7773: UDP, length 120
23:09:09.367568 IP 192.168.43.124.8880 > 192.168.43.146.7771: UDP, length 120
23:09:09.411548 IP 192.168.43.147.8880 > 192.168.43.124.7773: UDP, length 120
23:09:09.417567 IP 192.168.43.124.8880 > 192.168.43.146.7771: UDP, length 120
23:09:09.460193 IP 192.168.43.147.8880 > 192.168.43.124.7773: UDP, length 120
23:09:09.467568 IP 192.168.43.124.8880 > 192.168.43.146.7771: UDP, length 120
23:09:09.511750 IP 192.168.43.147.8880 > 192.168.43.124.7773: UDP, length 120
23:09:09.517565 IP 192.168.43.124.8880 > 192.168.43.146.7771: UDP, length 120
23:09:09.559543 IP 192.168.43.147.8880 > 192.168.43.124.7773: UDP, length 120
23:09:09.567566 IP 192.168.43.124.8880 > 192.168.43.146.7771: UDP, length 120
23:09:09.611376 IP 192.168.43.147.8880 > 192.168.43.124.7773: UDP, length 120
23:09:09.617611 IP 192.168.43.124.8880 > 192.168.43.146.7771: UDP, length 120
23:09:09.660660 IP 192.168.43.147.8880 > 192.168.43.124.7773: UDP, length 120
23:09:09.667618 IP 192.168.43.124.8880 > 192.168.43.146.7771: UDP, length 120
23:09:09.718093 IP 192.168.43.124.8880 > 192.168.43.146.7771: UDP, length 120
23:09:09.718093 IP 192.168.43.147.8880 > 192.168.43.124.7773: UDP, length 120
23:09:09.761860 IP 192.168.43.147.8880 > 192.168.43.124.7773: UDP, length 120
23:09:09.767571 IP 192.168.43.124.8880 > 192.168.43.146.7771: UDP, length 120
23:09:09.814036 IP 192.168.43.147.8880 > 192.168.43.124.7773: UDP, length 120
23:09:09.817504 IP 192.168.43.124.8880 > 192.168.43.146.7771: UDP, length 120
23:09:09.865276 IP 192.168.43.147.8880 > 192.168.43.124.7773: UDP, length 120
23:09:09.867616 IP 192.168.43.124.8880 > 192.168.43.146.7771: UDP, length 120
23:09:09.917479 IP 192.168.43.147.8880 > 192.168.43.124.7773: UDP, length 120
23:09:09.917543 IP 192.168.43.124.8880 > 192.168.43.146.7771: UDP, length 120
23:09:09.966209 IP 192.168.43.147.8880 > 192.168.43.124.7773: UDP, length 120
23:09:09.967616 IP 192.168.43.124.8880 > 192.168.43.146.7771: UDP, length 120
23:09:10.017618 IP 192.168.43.124.8880 > 192.168.43.146.7771: UDP, length 120
23:09:10.018875 IP 192.168.43.147.8880 > 192.168.43.124.7773: UDP, length 120
23:09:10.064601 IP 192.168.43.147.8880 > 192.168.43.124.7773: UDP, length 120
23:09:10.067616 IP 192.168.43.124.8880 > 192.168.43.146.7771: UDP, length 120
23:09:10.111433 IP 192.168.43.147.8880 > 192.168.43.124.7773: UDP, length 120
23:09:10.117496 IP 192.168.43.124.8880 > 192.168.43.146.7771: UDP, length 120
23:09:10.162132 IP 192.168.43.147.8880 > 192.168.43.124.7773: UDP, length 120
23:09:10.167492 IP 192.168.43.124.8880 > 192.168.43.146.7771: UDP, length 120
23:09:10.211618 IP 192.168.43.147.8880 > 192.168.43.124.7773: UDP, length 120
23:09:10.217565 IP 192.168.43.124.8880 > 192.168.43.146.7771: UDP, length 120
23:09:10.267564 IP 192.168.43.124.8880 > 192.168.43.146.7771: UDP, length 120
23:09:10.269416 IP 192.168.43.147.8880 > 192.168.43.124.7773: UDP, length 120
23:09:10.317566 IP 192.168.43.124.8880 > 192.168.43.146.7771: UDP, length 120
23:09:10.326033 IP 192.168.43.147.8880 > 192.168.43.124.7773: UDP, length 120
23:09:10.363332 IP 192.168.43.147.8880 > 192.168.43.124.7773: UDP, length 120
23:09:10.367566 IP 192.168.43.124.8880 > 192.168.43.146.7771: UDP, length 120
23:09:10.407451 IP 192.168.43.147.8880 > 192.168.43.124.7773: UDP, length 120
23:09:10.417564 IP 192.168.43.124.8880 > 192.168.43.146.7771: UDP, length 120
23:09:10.456976 IP 192.168.43.147.8880 > 192.168.43.124.7773: UDP, length 120
23:09:10.467567 IP 192.168.43.124.8880 > 192.168.43.146.7771: UDP, length 120
23:09:10.509653 IP 192.168.43.147.8880 > 192.168.43.124.7773: UDP, length 120
23:09:10.517565 IP 192.168.43.124.8880 > 192.168.43.146.7771: UDP, length 120
23:09:10.567565 IP 192.168.43.124.8880 > 192.168.43.146.7771: UDP, length 120
23:09:10.567903 IP 192.168.43.147.8880 > 192.168.43.124.7773: UDP, length 120
23:09:10.617567 IP 192.168.43.124.8880 > 192.168.43.146.7771: UDP, length 120
23:09:10.623267 IP 192.168.43.147.8880 > 192.168.43.124.7773: UDP, length 120
23:09:10.657120 IP 192.168.43.147.8880 > 192.168.43.124.7773: UDP, length 120
23:09:10.667566 IP 192.168.43.124.8880 > 192.168.43.146.7771: UDP, length 120
23:09:10.709889 IP 192.168.43.147.8880 > 192.168.43.124.7773: UDP, length 120
23:09:10.717566 IP 192.168.43.124.8880 > 192.168.43.146.7771: UDP, length 120
23:09:10.760051 IP 192.168.43.147.8880 > 192.168.43.124.7773: UDP, length 120
23:09:10.767487 IP 192.168.43.124.8880 > 192.168.43.146.7771: UDP, length 120
23:09:10.817368 IP 192.168.43.147.8880 > 192.168.43.124.7773: UDP, length 120
23:09:10.817476 IP 192.168.43.124.8880 > 192.168.43.146.7771: UDP, length 120
23:09:10.867565 IP 192.168.43.124.8880 > 192.168.43.146.7771: UDP, length 120
23:09:10.873263 IP 192.168.43.147.8880 > 192.168.43.124.7773: UDP, length 120
23:09:10.917568 IP 192.168.43.124.8880 > 192.168.43.146.7771: UDP, length 120
23:09:10.927300 IP 192.168.43.147.8880 > 192.168.43.124.7773: UDP, length 120
23:09:10.964392 IP 192.168.43.147.8880 > 192.168.43.124.7773: UDP, length 120
23:09:10.967566 IP 192.168.43.124.8880 > 192.168.43.146.7771: UDP, length 120
23:09:11.006986 IP 192.168.43.147.8880 > 192.168.43.124.7773: UDP, length 120
23:09:11.017567 IP 192.168.43.124.8880 > 192.168.43.146.7771: UDP, length 120
23:09:11.056687 IP 192.168.43.147.8880 > 192.168.43.124.7773: UDP, length 120
23:09:11.067571 IP 192.168.43.124.8880 > 192.168.43.146.7771: UDP, length 120
23:09:11.117503 IP 192.168.43.124.8880 > 192.168.43.146.7771: UDP, length 120
23:09:11.117811 IP 192.168.43.147.8880 > 192.168.43.124.7773: UDP, length 120
23:09:11.167646 IP 192.168.43.124.8880 > 192.168.43.146.7771: UDP, length 120
23:09:11.183217 IP 192.168.43.147.8880 > 192.168.43.124.7773: UDP, length 120
23:09:11.209994 IP 192.168.43.147.8880 > 192.168.43.124.7773: UDP, length 120
23:09:11.217567 IP 192.168.43.124.8880 > 192.168.43.146.7771: UDP, length 120
23:09:11.258174 IP 192.168.43.147.8880 > 192.168.43.124.7773: UDP, length 120
23:09:11.267484 IP 192.168.43.124.8880 > 192.168.43.146.7771: UDP, length 120
23:09:11.311922 IP 192.168.43.147.8880 > 192.168.43.124.7773: UDP, length 120
23:09:11.317472 IP 192.168.43.124.8880 > 192.168.43.146.7771: UDP, length 120
23:09:11.367564 IP 192.168.43.124.8880 > 192.168.43.146.7771: UDP, length 120
23:09:11.370442 IP 192.168.43.147.8880 > 192.168.43.124.7773: UDP, length 120
23:09:11.417564 IP 192.168.43.124.8880 > 192.168.43.146.7771: UDP, length 120
23:09:11.424646 IP 192.168.43.147.8880 > 192.168.43.124.7773: UDP, length 120
23:09:11.467566 IP 192.168.43.124.8880 > 192.168.43.146.7771: UDP, length 120
23:09:11.479239 IP 192.168.43.147.8880 > 192.168.43.124.7773: UDP, length 120
23:09:11.516496 IP 192.168.43.147.8880 > 192.168.43.124.7773: UDP, length 120
23:09:11.517527 IP 192.168.43.124.8880 > 192.168.43.146.7771: UDP, length 120
23:09:11.559113 IP 192.168.43.147.8880 > 192.168.43.124.7773: UDP, length 120
23:09:11.567565 IP 192.168.43.124.8880 > 192.168.43.146.7771: UDP, length 120
23:09:11.608004 IP 192.168.43.147.8880 > 192.168.43.124.7773: UDP, length 120
23:09:11.617567 IP 192.168.43.124.8880 > 192.168.43.146.7771: UDP, length 120
23:09:11.667565 IP 192.168.43.124.8880 > 192.168.43.146.7771: UDP, length 120
23:09:11.677367 IP 192.168.43.147.8880 > 192.168.43.124.7773: UDP, length 120
23:09:11.711731 IP 192.168.43.147.8880 > 192.168.43.124.7773: UDP, length 120
23:09:11.717569 IP 192.168.43.124.8880 > 192.168.43.146.7771: UDP, length 120
23:09:11.759678 IP 192.168.43.147.8880 > 192.168.43.124.7773: UDP, length 120
23:09:11.767487 IP 192.168.43.124.8880 > 192.168.43.146.7771: UDP, length 120
23:09:11.810466 IP 192.168.43.147.8880 > 192.168.43.124.7773: UDP, length 120
23:09:11.817567 IP 192.168.43.124.8880 > 192.168.43.146.7771: UDP, length 120
23:09:11.867675 IP 192.168.43.147.8880 > 192.168.43.124.7773: UDP, length 120
23:09:11.867717 IP 192.168.43.124.8880 > 192.168.43.146.7771: UDP, length 120
23:09:11.917530 IP 192.168.43.124.8880 > 192.168.43.146.7771: UDP, length 120
23:09:11.925894 IP 192.168.43.147.8880 > 192.168.43.124.7773: UDP, length 120
23:09:11.967566 IP 192.168.43.124.8880 > 192.168.43.146.7771: UDP, length 120
23:09:11.977258 IP 192.168.43.147.8880 > 192.168.43.124.7773: UDP, length 120
23:09:12.011647 IP 192.168.43.147.8880 > 192.168.43.124.7773: UDP, length 120
23:09:12.017567 IP 192.168.43.124.8880 > 192.168.43.146.7771: UDP, length 120
23:09:12.064867 IP 192.168.43.147.8880 > 192.168.43.124.7773: UDP, length 120
23:09:12.067586 IP 192.168.43.124.8880 > 192.168.43.146.7771: UDP, length 120
23:09:12.112069 IP 192.168.43.147.8880 > 192.168.43.124.7773: UDP, length 120
23:09:12.117565 IP 192.168.43.124.8880 > 192.168.43.146.7771: UDP, length 120
23:09:12.167494 IP 192.168.43.124.8880 > 192.168.43.146.7771: UDP, length 120
23:09:12.174510 IP 192.168.43.147.8880 > 192.168.43.124.7773: UDP, length 120
23:09:12.217533 IP 192.168.43.124.8880 > 192.168.43.146.7771: UDP, length 120
23:09:12.233471 IP 192.168.43.147.8880 > 192.168.43.124.7773: UDP, length 120
23:09:12.257143 IP 192.168.43.147.8880 > 192.168.43.124.7773: UDP, length 120
23:09:12.267485 IP 192.168.43.124.8880 > 192.168.43.146.7771: UDP, length 120
23:09:12.311188 IP 192.168.43.147.8880 > 192.168.43.124.7773: UDP, length 120
23:09:12.317565 IP 192.168.43.124.8880 > 192.168.43.146.7771: UDP, length 120
23:09:12.357762 IP 192.168.43.147.8880 > 192.168.43.124.7773: UDP, length 120
23:09:12.367582 IP 192.168.43.124.8880 > 192.168.43.146.7771: UDP, length 120
23:09:12.417566 IP 192.168.43.124.8880 > 192.168.43.146.7771: UDP, length 120
23:09:12.419515 IP 192.168.43.147.8880 > 192.168.43.124.7773: UDP, length 120
23:09:12.460209 IP 192.168.43.147.8880 > 192.168.43.124.7773: UDP, length 120
23:09:12.467486 IP 192.168.43.124.8880 > 192.168.43.146.7771: UDP, length 120
23:09:12.514140 IP 192.168.43.147.8880 > 192.168.43.124.7773: UDP, length 120
23:09:12.517566 IP 192.168.43.124.8880 > 192.168.43.146.7771: UDP, length 120
23:09:12.557237 IP 192.168.43.147.8880 > 192.168.43.124.7773: UDP, length 120
23:09:12.567513 IP 192.168.43.124.8880 > 192.168.43.146.7771: UDP, length 120
23:09:12.617157 IP 192.168.43.147.8880 > 192.168.43.124.7773: UDP, length 120
23:09:12.617564 IP 192.168.43.124.8880 > 192.168.43.146.7771: UDP, length 120
23:09:12.667555 IP 192.168.43.124.8880 > 192.168.43.146.7771: UDP, length 120
23:09:12.667555 IP 192.168.43.147.8880 > 192.168.43.124.7773: UDP, length 120
23:09:12.717566 IP 192.168.43.124.8880 > 192.168.43.146.7771: UDP, length 120
23:09:12.724023 IP 192.168.43.147.8880 > 192.168.43.124.7773: UDP, length 120
23:09:12.760004 IP 192.168.43.147.8880 > 192.168.43.124.7773: UDP, length 120
23:09:12.767481 IP 192.168.43.124.8880 > 192.168.43.146.7771: UDP, length 120
23:09:12.809858 IP 192.168.43.147.8880 > 192.168.43.124.7773: UDP, length 120
23:09:12.817566 IP 192.168.43.124.8880 > 192.168.43.146.7771: UDP, length 120
23:09:12.860617 IP 192.168.43.147.8880 > 192.168.43.124.7773: UDP, length 120
23:09:12.867566 IP 192.168.43.124.8880 > 192.168.43.146.7771: UDP, length 120
23:09:12.909116 IP 192.168.43.147.8880 > 192.168.43.124.7773: UDP, length 120
23:09:12.917565 IP 192.168.43.124.8880 > 192.168.43.146.7771: UDP, length 120
23:09:12.967530 IP 192.168.43.124.8880 > 192.168.43.146.7771: UDP, length 120
23:09:12.979266 IP 192.168.43.147.8880 > 192.168.43.124.7773: UDP, length 120
23:09:13.007515 IP 192.168.43.147.8880 > 192.168.43.124.7773: UDP, length 120
23:09:13.017529 IP 192.168.43.124.8880 > 192.168.43.146.7771: UDP, length 120
23:09:13.060909 IP 192.168.43.147.8880 > 192.168.43.124.7773: UDP, length 120
23:09:13.067566 IP 192.168.43.124.8880 > 192.168.43.146.7771: UDP, length 120
23:09:13.113821 IP 192.168.43.147.8880 > 192.168.43.124.7773: UDP, length 120
23:09:13.117565 IP 192.168.43.124.8880 > 192.168.43.146.7771: UDP, length 120
23:09:13.167727 IP 192.168.43.124.8880 > 192.168.43.146.7771: UDP, length 120
23:09:13.167728 IP 192.168.43.147.8880 > 192.168.43.124.7773: UDP, length 120
23:09:13.217565 IP 192.168.43.124.8880 > 192.168.43.146.7771: UDP, length 120
23:09:13.223487 IP 192.168.43.147.8880 > 192.168.43.124.7773: UDP, length 120
23:09:13.267507 IP 192.168.43.124.8880 > 192.168.43.146.7771: UDP, length 120
23:09:13.278501 IP 192.168.43.147.8880 > 192.168.43.124.7773: UDP, length 120
23:09:13.306865 IP 192.168.43.147.8880 > 192.168.43.124.7773: UDP, length 120
23:09:13.317510 IP 192.168.43.124.8880 > 192.168.43.146.7771: UDP, length 120
23:09:13.360788 IP 192.168.43.147.8880 > 192.168.43.124.7773: UDP, length 120
23:09:13.367572 IP 192.168.43.124.8880 > 192.168.43.146.7771: UDP, length 120
23:09:13.410625 IP 192.168.43.147.8880 > 192.168.43.124.7773: UDP, length 120
23:09:13.417495 IP 192.168.43.124.8880 > 192.168.43.146.7771: UDP, length 120
23:09:13.467567 IP 192.168.43.124.8880 > 192.168.43.146.7771: UDP, length 120
23:09:13.470783 IP 192.168.43.147.8880 > 192.168.43.124.7773: UDP, length 120
23:09:13.517564 IP 192.168.43.124.8880 > 192.168.43.146.7771: UDP, length 120
23:09:13.524532 IP 192.168.43.147.8880 > 192.168.43.124.7773: UDP, length 120
23:09:13.561269 IP 192.168.43.147.8880 > 192.168.43.124.7773: UDP, length 120
23:09:13.567565 IP 192.168.43.124.8880 > 192.168.43.146.7771: UDP, length 120
23:09:13.609970 IP 192.168.43.147.8880 > 192.168.43.124.7773: UDP, length 120
23:09:13.617529 IP 192.168.43.124.8880 > 192.168.43.146.7771: UDP, length 120
23:09:13.662487 IP 192.168.43.147.8880 > 192.168.43.124.7773: UDP, length 120
23:09:13.667616 IP 192.168.43.124.8880 > 192.168.43.146.7771: UDP, length 120
23:09:13.708018 IP 192.168.43.147.8880 > 192.168.43.124.7773: UDP, length 120
23:09:13.717566 IP 192.168.43.124.8880 > 192.168.43.146.7771: UDP, length 120
23:09:13.767486 IP 192.168.43.124.8880 > 192.168.43.146.7771: UDP, length 120
23:09:13.770210 IP 192.168.43.147.8880 > 192.168.43.124.7773: UDP, length 120
23:09:13.817566 IP 192.168.43.124.8880 > 192.168.43.146.7771: UDP, length 120
23:09:13.824701 IP 192.168.43.147.8880 > 192.168.43.124.7773: UDP, length 120
23:09:13.857929 IP 192.168.43.147.8880 > 192.168.43.124.7773: UDP, length 120
23:09:13.867567 IP 192.168.43.124.8880 > 192.168.43.146.7771: UDP, length 120
23:09:13.913798 IP 192.168.43.147.8880 > 192.168.43.124.7773: UDP, length 120
23:09:13.917527 IP 192.168.43.124.8880 > 192.168.43.146.7771: UDP, length 120
23:09:13.960566 IP 192.168.43.147.8880 > 192.168.43.124.7773: UDP, length 120
23:09:13.967614 IP 192.168.43.124.8880 > 192.168.43.146.7771: UDP, length 120
23:09:14.010484 IP 192.168.43.147.8880 > 192.168.43.124.7773: UDP, length 120
23:09:14.018399 IP 192.168.43.124.8880 > 192.168.43.146.7771: UDP, length 120
23:09:14.067563 IP 192.168.43.124.8880 > 192.168.43.146.7771: UDP, length 120
23:09:14.075149 IP 192.168.43.147.8880 > 192.168.43.124.7773: UDP, length 120
23:09:14.113203 IP 192.168.43.147.8880 > 192.168.43.124.7773: UDP, length 120
23:09:14.117515 IP 192.168.43.124.8880 > 192.168.43.146.7771: UDP, length 120
23:09:14.157722 IP 192.168.43.147.8880 > 192.168.43.124.7773: UDP, length 120
23:09:14.167565 IP 192.168.43.124.8880 > 192.168.43.146.7771: UDP, length 120
23:09:14.217606 IP 192.168.43.124.8880 > 192.168.43.146.7771: UDP, length 120
23:09:14.218857 IP 192.168.43.147.8880 > 192.168.43.124.7773: UDP, length 120
23:09:14.261574 IP 192.168.43.147.8880 > 192.168.43.124.7773: UDP, length 120
23:09:14.267532 IP 192.168.43.124.8880 > 192.168.43.146.7771: UDP, length 120
23:09:14.317530 IP 192.168.43.124.8880 > 192.168.43.146.7771: UDP, length 120
23:09:14.318385 IP 192.168.43.147.8880 > 192.168.43.124.7773: UDP, length 120
23:09:14.367491 IP 192.168.43.124.8880 > 192.168.43.146.7771: UDP, length 120
23:09:14.370295 IP 192.168.43.147.8880 > 192.168.43.124.7773: UDP, length 120
23:09:14.409809 IP 192.168.43.147.8880 > 192.168.43.124.7773: UDP, length 120
23:09:14.417566 IP 192.168.43.124.8880 > 192.168.43.146.7771: UDP, length 120
23:09:14.460792 IP 192.168.43.147.8880 > 192.168.43.124.7773: UDP, length 120
23:09:14.467522 IP 192.168.43.124.8880 > 192.168.43.146.7771: UDP, length 120
23:09:14.518286 IP 192.168.43.124.8880 > 192.168.43.146.7771: UDP, length 120
23:09:14.522497 IP 192.168.43.147.8880 > 192.168.43.124.7773: UDP, length 120
23:09:14.561959 IP 192.168.43.147.8880 > 192.168.43.124.7773: UDP, length 120
23:09:14.567595 IP 192.168.43.124.8880 > 192.168.43.146.7771: UDP, length 120
23:09:14.611297 IP 192.168.43.147.8880 > 192.168.43.124.7773: UDP, length 120
23:09:14.617513 IP 192.168.43.124.8880 > 192.168.43.146.7771: UDP, length 120
23:09:14.667400 IP 192.168.43.147.8880 > 192.168.43.124.7773: UDP, length 120
23:09:14.667487 IP 192.168.43.124.8880 > 192.168.43.146.7771: UDP, length 120
23:09:14.717566 IP 192.168.43.124.8880 > 192.168.43.146.7771: UDP, length 120
23:09:14.733088 IP 192.168.43.147.8880 > 192.168.43.124.7773: UDP, length 120
23:09:14.767488 IP 192.168.43.124.8880 > 192.168.43.146.7771: UDP, length 120
23:09:14.817563 IP 192.168.43.124.8880 > 192.168.43.146.7771: UDP, length 120
23:09:14.831264 IP 192.168.43.147.8880 > 192.168.43.124.7773: UDP, length 120
23:09:14.831278 IP 192.168.43.147.8880 > 192.168.43.124.7773: UDP, length 120
23:09:14.867607 IP 192.168.43.124.8880 > 192.168.43.146.7771: UDP, length 120
23:09:14.876951 IP 192.168.43.147.8880 > 192.168.43.124.7773: UDP, length 120
23:09:14.910054 IP 192.168.43.147.8880 > 192.168.43.124.7773: UDP, length 120
23:09:14.917567 IP 192.168.43.124.8880 > 192.168.43.146.7771: UDP, length 120
23:09:14.957335 IP 192.168.43.147.8880 > 192.168.43.124.7773: UDP, length 120
23:09:14.967566 IP 192.168.43.124.8880 > 192.168.43.146.7771: UDP, length 120
23:09:15.017614 IP 192.168.43.124.8880 > 192.168.43.146.7771: UDP, length 120
23:09:15.018532 IP 192.168.43.147.8880 > 192.168.43.124.7773: UDP, length 120
23:09:15.059954 IP 192.168.43.147.8880 > 192.168.43.124.7773: UDP, length 120
23:09:15.067588 IP 192.168.43.124.8880 > 192.168.43.146.7771: UDP, length 120
23:09:15.109318 IP 192.168.43.147.8880 > 192.168.43.124.7773: UDP, length 120
23:09:15.117568 IP 192.168.43.124.8880 > 192.168.43.146.7771: UDP, length 120
23:09:15.167566 IP 192.168.43.124.8880 > 192.168.43.146.7771: UDP, length 120
23:09:15.172394 IP 192.168.43.147.8880 > 192.168.43.124.7773: UDP, length 120
23:09:15.212491 IP 192.168.43.147.8880 > 192.168.43.124.7773: UDP, length 120
23:09:15.217498 IP 192.168.43.124.8880 > 192.168.43.146.7771: UDP, length 120
23:09:15.261234 IP 192.168.43.147.8880 > 192.168.43.124.7773: UDP, length 120
23:09:15.267488 IP 192.168.43.124.8880 > 192.168.43.146.7771: UDP, length 120
23:09:15.317563 IP 192.168.43.124.8880 > 192.168.43.146.7771: UDP, length 120
23:09:15.344376 IP 192.168.43.147.8880 > 192.168.43.124.7773: UDP, length 120
23:09:15.361405 IP 192.168.43.147.8880 > 192.168.43.124.7773: UDP, length 120
23:09:15.367491 IP 192.168.43.124.8880 > 192.168.43.146.7771: UDP, length 120
23:09:15.416524 IP 192.168.43.147.8880 > 192.168.43.124.7773: UDP, length 120
23:09:15.417565 IP 192.168.43.124.8880 > 192.168.43.146.7771: UDP, length 120
23:09:15.458026 IP 192.168.43.147.8880 > 192.168.43.124.7773: UDP, length 120
23:09:15.467566 IP 192.168.43.124.8880 > 192.168.43.146.7771: UDP, length 120
23:09:15.510274 IP 192.168.43.147.8880 > 192.168.43.124.7773: UDP, length 120
23:09:15.517565 IP 192.168.43.124.8880 > 192.168.43.146.7771: UDP, length 120
23:09:15.559945 IP 192.168.43.147.8880 > 192.168.43.124.7773: UDP, length 120
23:09:15.567565 IP 192.168.43.124.8880 > 192.168.43.146.7771: UDP, length 120
23:09:15.617481 IP 192.168.43.124.8880 > 192.168.43.146.7771: UDP, length 120
23:09:15.629945 IP 192.168.43.147.8880 > 192.168.43.124.7773: UDP, length 120
23:09:15.661247 IP 192.168.43.147.8880 > 192.168.43.124.7773: UDP, length 120
23:09:15.667566 IP 192.168.43.124.8880 > 192.168.43.146.7771: UDP, length 120
23:09:15.717567 IP 192.168.43.124.8880 > 192.168.43.146.7771: UDP, length 120
23:09:15.724674 IP 192.168.43.147.8880 > 192.168.43.124.7773: UDP, length 120
23:09:15.757114 IP 192.168.43.147.8880 > 192.168.43.124.7773: UDP, length 120
23:09:15.767481 IP 192.168.43.124.8880 > 192.168.43.146.7771: UDP, length 120
23:09:15.807297 IP 192.168.43.147.8880 > 192.168.43.124.7773: UDP, length 120
23:09:15.817564 IP 192.168.43.124.8880 > 192.168.43.146.7771: UDP, length 120
23:09:15.867567 IP 192.168.43.124.8880 > 192.168.43.146.7771: UDP, length 120
23:09:15.872904 IP 192.168.43.147.8880 > 192.168.43.124.7773: UDP, length 120
23:09:15.908531 IP 192.168.43.147.8880 > 192.168.43.124.7773: UDP, length 120
23:09:15.917566 IP 192.168.43.124.8880 > 192.168.43.146.7771: UDP, length 120
23:09:15.958139 IP 192.168.43.147.8880 > 192.168.43.124.7773: UDP, length 120
23:09:15.967566 IP 192.168.43.124.8880 > 192.168.43.146.7771: UDP, length 120
23:09:16.013234 IP 192.168.43.147.8880 > 192.168.43.124.7773: UDP, length 120
23:09:16.017513 IP 192.168.43.124.8880 > 192.168.43.146.7771: UDP, length 120
23:09:16.060888 IP 192.168.43.147.8880 > 192.168.43.124.7773: UDP, length 120
23:09:16.067516 IP 192.168.43.124.8880 > 192.168.43.146.7771: UDP, length 120
23:09:16.110734 IP 192.168.43.147.8880 > 192.168.43.124.7773: UDP, length 120
23:09:16.117482 IP 192.168.43.124.8880 > 192.168.43.146.7771: UDP, length 120
23:09:16.163706 IP 192.168.43.147.8880 > 192.168.43.124.7773: UDP, length 120
23:09:16.167513 IP 192.168.43.124.8880 > 192.168.43.146.7771: UDP, length 120
23:09:16.210334 IP 192.168.43.147.8880 > 192.168.43.124.7773: UDP, length 120
23:09:16.217566 IP 192.168.43.124.8880 > 192.168.43.146.7771: UDP, length 120
23:09:16.262766 IP 192.168.43.147.8880 > 192.168.43.124.7773: UDP, length 120
23:09:16.267511 IP 192.168.43.124.8880 > 192.168.43.146.7771: UDP, length 120
23:09:16.317566 IP 192.168.43.124.8880 > 192.168.43.146.7771: UDP, length 120
23:09:16.329797 IP 192.168.43.147.8880 > 192.168.43.124.7773: UDP, length 120
23:09:16.367544 IP 192.168.43.124.8880 > 192.168.43.146.7771: UDP, length 120
23:09:16.368339 IP 192.168.43.147.8880 > 192.168.43.124.7773: UDP, length 120
23:09:16.417566 IP 192.168.43.124.8880 > 192.168.43.146.7771: UDP, length 120
23:09:16.421158 IP 192.168.43.147.8880 > 192.168.43.124.7773: UDP, length 120
23:09:16.465868 IP 192.168.43.147.8880 > 192.168.43.124.7773: UDP, length 120
23:09:16.467512 IP 192.168.43.124.8880 > 192.168.43.146.7771: UDP, length 120
23:09:16.517566 IP 192.168.43.124.8880 > 192.168.43.146.7771: UDP, length 120
23:09:16.531573 IP 192.168.43.147.8880 > 192.168.43.124.7773: UDP, length 120
23:09:16.567485 IP 192.168.43.124.8880 > 192.168.43.146.7771: UDP, length 120
23:09:16.570250 IP 192.168.43.147.8880 > 192.168.43.124.7773: UDP, length 120
23:09:16.610095 IP 192.168.43.147.8880 > 192.168.43.124.7773: UDP, length 120
23:09:16.617564 IP 192.168.43.124.8880 > 192.168.43.146.7771: UDP, length 120
23:09:16.659827 IP 192.168.43.147.8880 > 192.168.43.124.7773: UDP, length 120
23:09:16.667525 IP 192.168.43.124.8880 > 192.168.43.146.7771: UDP, length 120
23:09:16.717566 IP 192.168.43.124.8880 > 192.168.43.146.7771: UDP, length 120
23:09:16.720283 IP 192.168.43.147.8880 > 192.168.43.124.7773: UDP, length 120
23:09:16.760822 IP 192.168.43.147.8880 > 192.168.43.124.7773: UDP, length 120
23:09:16.767486 IP 192.168.43.124.8880 > 192.168.43.146.7771: UDP, length 120
23:09:16.807163 IP 192.168.43.147.8880 > 192.168.43.124.7773: UDP, length 120
23:09:16.817563 IP 192.168.43.124.8880 > 192.168.43.146.7771: UDP, length 120
23:09:16.867500 IP 192.168.43.124.8880 > 192.168.43.146.7771: UDP, length 120
23:09:16.867578 IP 192.168.43.147.8880 > 192.168.43.124.7773: UDP, length 120
23:09:16.910447 IP 192.168.43.147.8880 > 192.168.43.124.7773: UDP, length 120
23:09:16.917567 IP 192.168.43.124.8880 > 192.168.43.146.7771: UDP, length 120
23:09:16.957425 IP 192.168.43.147.8880 > 192.168.43.124.7773: UDP, length 120
23:09:16.967515 IP 192.168.43.124.8880 > 192.168.43.146.7771: UDP, length 120
23:09:17.013131 IP 192.168.43.147.8880 > 192.168.43.124.7773: UDP, length 120
23:09:17.017564 IP 192.168.43.124.8880 > 192.168.43.146.7771: UDP, length 120
23:09:17.060461 IP 192.168.43.147.8880 > 192.168.43.124.7773: UDP, length 120
23:09:17.067516 IP 192.168.43.124.8880 > 192.168.43.146.7771: UDP, length 120
23:09:17.111515 IP 192.168.43.147.8880 > 192.168.43.124.7773: UDP, length 120
23:09:17.117600 IP 192.168.43.124.8880 > 192.168.43.146.7771: UDP, length 120
23:09:17.159923 IP 192.168.43.147.8880 > 192.168.43.124.7773: UDP, length 120
23:09:17.167566 IP 192.168.43.124.8880 > 192.168.43.146.7771: UDP, length 120
23:09:17.217535 IP 192.168.43.124.8880 > 192.168.43.146.7771: UDP, length 120
23:09:17.228564 IP 192.168.43.147.8880 > 192.168.43.124.7773: UDP, length 120
23:09:17.259719 IP 192.168.43.147.8880 > 192.168.43.124.7773: UDP, length 120
23:09:17.267510 IP 192.168.43.124.8880 > 192.168.43.146.7771: UDP, length 120
23:09:17.311915 IP 192.168.43.147.8880 > 192.168.43.124.7773: UDP, length 120
23:09:17.317533 IP 192.168.43.124.8880 > 192.168.43.146.7771: UDP, length 120
23:09:17.368043 IP 192.168.43.124.8880 > 192.168.43.146.7771: UDP, length 120
23:09:17.370361 IP 192.168.43.147.8880 > 192.168.43.124.7773: UDP, length 120
23:09:17.409931 IP 192.168.43.147.8880 > 192.168.43.124.7773: UDP, length 120
23:09:17.417566 IP 192.168.43.124.8880 > 192.168.43.146.7771: UDP, length 120
23:09:17.456883 IP 192.168.43.147.8880 > 192.168.43.124.7773: UDP, length 120
23:09:17.467484 IP 192.168.43.124.8880 > 192.168.43.146.7771: UDP, length 120
23:09:17.511122 IP 192.168.43.147.8880 > 192.168.43.124.7773: UDP, length 120
23:09:17.517505 IP 192.168.43.124.8880 > 192.168.43.146.7771: UDP, length 120
23:09:17.556886 IP 192.168.43.147.8880 > 192.168.43.124.7773: UDP, length 120
23:09:17.567564 IP 192.168.43.124.8880 > 192.168.43.146.7771: UDP, length 120
23:09:17.609680 IP 192.168.43.147.8880 > 192.168.43.124.7773: UDP, length 120
23:09:17.617513 IP 192.168.43.124.8880 > 192.168.43.146.7771: UDP, length 120
23:09:17.660742 IP 192.168.43.147.8880 > 192.168.43.124.7773: UDP, length 120
23:09:17.667566 IP 192.168.43.124.8880 > 192.168.43.146.7771: UDP, length 120
23:09:17.711608 IP 192.168.43.147.8880 > 192.168.43.124.7773: UDP, length 120
23:09:17.717507 IP 192.168.43.124.8880 > 192.168.43.146.7771: UDP, length 120
23:09:17.761702 IP 192.168.43.147.8880 > 192.168.43.124.7773: UDP, length 120
23:09:17.767485 IP 192.168.43.124.8880 > 192.168.43.146.7771: UDP, length 120
23:09:17.811726 IP 192.168.43.147.8880 > 192.168.43.124.7773: UDP, length 120
23:09:17.817493 IP 192.168.43.124.8880 > 192.168.43.146.7771: UDP, length 120
23:09:17.867565 IP 192.168.43.124.8880 > 192.168.43.146.7771: UDP, length 120
23:09:17.877764 IP 192.168.43.147.8880 > 192.168.43.124.7773: UDP, length 120
23:09:17.908839 IP 192.168.43.147.8880 > 192.168.43.124.7773: UDP, length 120
23:09:17.917566 IP 192.168.43.124.8880 > 192.168.43.146.7771: UDP, length 120
23:09:17.967567 IP 192.168.43.124.8880 > 192.168.43.146.7771: UDP, length 120
23:09:17.969871 IP 192.168.43.147.8880 > 192.168.43.124.7773: UDP, length 120
23:09:18.007214 IP 192.168.43.147.8880 > 192.168.43.124.7773: UDP, length 120
23:09:18.017567 IP 192.168.43.124.8880 > 192.168.43.146.7771: UDP, length 120
23:09:18.059790 IP 192.168.43.147.8880 > 192.168.43.124.7773: UDP, length 120
23:09:18.067566 IP 192.168.43.124.8880 > 192.168.43.146.7771: UDP, length 120
23:09:18.117359 IP 192.168.43.147.8880 > 192.168.43.124.7773: UDP, length 120
23:09:18.117533 IP 192.168.43.124.8880 > 192.168.43.146.7771: UDP, length 120
23:09:18.160418 IP 192.168.43.147.8880 > 192.168.43.124.7773: UDP, length 120
23:09:18.167616 IP 192.168.43.124.8880 > 192.168.43.146.7771: UDP, length 120
23:09:18.211036 IP 192.168.43.147.8880 > 192.168.43.124.7773: UDP, length 120
23:09:18.217607 IP 192.168.43.124.8880 > 192.168.43.146.7771: UDP, length 120
23:09:18.262136 IP 192.168.43.147.8880 > 192.168.43.124.7773: UDP, length 120
23:09:18.267566 IP 192.168.43.124.8880 > 192.168.43.146.7771: UDP, length 120
23:09:18.317566 IP 192.168.43.124.8880 > 192.168.43.146.7771: UDP, length 120
23:09:18.328670 IP 192.168.43.147.8880 > 192.168.43.124.7773: UDP, length 120
23:09:18.358416 IP 192.168.43.147.8880 > 192.168.43.124.7773: UDP, length 120
23:09:18.367571 IP 192.168.43.124.8880 > 192.168.43.146.7771: UDP, length 120
23:09:18.417567 IP 192.168.43.124.8880 > 192.168.43.146.7771: UDP, length 120
23:09:18.428001 IP 192.168.43.147.8880 > 192.168.43.124.7773: UDP, length 120
23:09:18.463271 IP 192.168.43.147.8880 > 192.168.43.124.7773: UDP, length 120
23:09:18.467519 IP 192.168.43.124.8880 > 192.168.43.146.7771: UDP, length 120
23:09:18.507272 IP 192.168.43.147.8880 > 192.168.43.124.7773: UDP, length 120
23:09:18.517567 IP 192.168.43.124.8880 > 192.168.43.146.7771: UDP, length 120
23:09:18.567564 IP 192.168.43.124.8880 > 192.168.43.146.7771: UDP, length 120
23:09:18.570589 IP 192.168.43.147.8880 > 192.168.43.124.7773: UDP, length 120
23:09:18.617565 IP 192.168.43.124.8880 > 192.168.43.146.7771: UDP, length 120
23:09:18.641933 IP 192.168.43.147.8880 > 192.168.43.124.7773: UDP, length 120
23:09:18.658275 IP 192.168.43.147.8880 > 192.168.43.124.7773: UDP, length 120
23:09:18.667566 IP 192.168.43.124.8880 > 192.168.43.146.7771: UDP, length 120
23:09:18.717504 IP 192.168.43.124.8880 > 192.168.43.146.7771: UDP, length 120
23:09:18.723012 IP 192.168.43.147.8880 > 192.168.43.124.7773: UDP, length 120
23:09:18.760413 IP 192.168.43.147.8880 > 192.168.43.124.7773: UDP, length 120
23:09:18.767704 IP 192.168.43.124.8880 > 192.168.43.146.7771: UDP, length 120
23:09:18.809190 IP 192.168.43.147.8880 > 192.168.43.124.7773: UDP, length 120
23:09:18.817562 IP 192.168.43.124.8880 > 192.168.43.146.7771: UDP, length 120
23:09:18.867566 IP 192.168.43.124.8880 > 192.168.43.146.7771: UDP, length 120
23:09:18.870745 IP 192.168.43.147.8880 > 192.168.43.124.7773: UDP, length 120
23:09:18.906851 IP 192.168.43.147.8880 > 192.168.43.124.7773: UDP, length 120
23:09:18.917564 IP 192.168.43.124.8880 > 192.168.43.146.7771: UDP, length 120
23:09:18.957810 IP 192.168.43.147.8880 > 192.168.43.124.7773: UDP, length 120
23:09:18.967566 IP 192.168.43.124.8880 > 192.168.43.146.7771: UDP, length 120
23:09:19.013576 IP 192.168.43.147.8880 > 192.168.43.124.7773: UDP, length 120
23:09:19.017567 IP 192.168.43.124.8880 > 192.168.43.146.7771: UDP, length 120
23:09:19.059770 IP 192.168.43.147.8880 > 192.168.43.124.7773: UDP, length 120
23:09:19.067616 IP 192.168.43.124.8880 > 192.168.43.146.7771: UDP, length 120
23:09:19.107666 IP 192.168.43.147.8880 > 192.168.43.124.7773: UDP, length 120
23:09:19.117504 IP 192.168.43.124.8880 > 192.168.43.146.7771: UDP, length 120
23:09:19.157269 IP 192.168.43.147.8880 > 192.168.43.124.7773: UDP, length 120
23:09:19.167565 IP 192.168.43.124.8880 > 192.168.43.146.7771: UDP, length 120
23:09:19.224089 IP 192.168.43.147.8880 > 192.168.43.124.7773: UDP, length 120
23:09:19.230186 IP 192.168.43.124.8880 > 192.168.43.147.7772: UDP, length 120
23:09:19.259772 IP 192.168.43.147.8880 > 192.168.43.124.7773: UDP, length 120
23:09:19.280331 IP 192.168.43.124.8880 > 192.168.43.147.7772: UDP, length 120
23:09:19.310713 IP 192.168.43.147.8880 > 192.168.43.124.7773: UDP, length 120
23:09:19.330330 IP 192.168.43.124.8880 > 192.168.43.147.7772: UDP, length 120
23:09:19.366874 IP 192.168.43.147.8880 > 192.168.43.124.7773: UDP, length 120
23:09:19.380331 IP 192.168.43.124.8880 > 192.168.43.147.7772: UDP, length 120
23:09:19.410945 IP 192.168.43.147.8880 > 192.168.43.124.7773: UDP, length 120
23:09:19.430332 IP 192.168.43.124.8880 > 192.168.43.147.7772: UDP, length 120
23:09:19.459864 IP 192.168.43.147.8880 > 192.168.43.124.7773: UDP, length 120
23:09:19.480332 IP 192.168.43.124.8880 > 192.168.43.147.7772: UDP, length 120
23:09:19.515795 IP 192.168.43.147.8880 > 192.168.43.124.7773: UDP, length 120
23:09:19.530330 IP 192.168.43.124.8880 > 192.168.43.147.7772: UDP, length 120
23:09:19.562419 IP 192.168.43.147.8880 > 192.168.43.124.7773: UDP, length 120
23:09:19.580544 IP 192.168.43.124.8880 > 192.168.43.147.7772: UDP, length 120
23:09:19.614788 IP 192.168.43.147.8880 > 192.168.43.124.7773: UDP, length 120
23:09:19.630332 IP 192.168.43.124.8880 > 192.168.43.147.7772: UDP, length 120
23:09:19.669634 IP 192.168.43.147.8880 > 192.168.43.124.7773: UDP, length 120
23:09:19.680261 IP 192.168.43.124.8880 > 192.168.43.147.7772: UDP, length 120
23:09:19.708890 IP 192.168.43.147.8880 > 192.168.43.124.7773: UDP, length 120
23:09:19.730333 IP 192.168.43.124.8880 > 192.168.43.147.7772: UDP, length 120
23:09:19.734063 IP 192.168.43.146.8880 > 192.168.43.124.7773: UDP, length 120
23:09:19.762041 IP 192.168.43.147.8880 > 192.168.43.124.7773: UDP, length 120
23:09:19.767848 IP 192.168.43.146.8880 > 192.168.43.124.7773: UDP, length 120
23:09:19.780278 IP 192.168.43.124.8880 > 192.168.43.147.7772: UDP, length 120
23:09:19.811432 IP 192.168.43.147.8880 > 192.168.43.124.7773: UDP, length 120
23:09:19.830331 IP 192.168.43.124.8880 > 192.168.43.147.7772: UDP, length 120
23:09:19.848891 IP 192.168.43.146.8880 > 192.168.43.124.7773: UDP, length 120
23:09:19.862165 IP 192.168.43.147.8880 > 192.168.43.124.7773: UDP, length 120
23:09:19.867460 IP 192.168.43.146.8880 > 192.168.43.124.7773: UDP, length 120
23:09:19.880284 IP 192.168.43.124.8880 > 192.168.43.147.7772: UDP, length 120
23:09:19.911861 IP 192.168.43.147.8880 > 192.168.43.124.7773: UDP, length 120
23:09:19.930332 IP 192.168.43.124.8880 > 192.168.43.147.7772: UDP, length 120
23:09:19.942956 IP 192.168.43.146.8880 > 192.168.43.124.7773: UDP, length 120
23:09:19.963963 IP 192.168.43.147.8880 > 192.168.43.124.7773: UDP, length 120
23:09:19.980332 IP 192.168.43.124.8880 > 192.168.43.147.7772: UDP, length 120
23:09:19.997548 IP 192.168.43.146.8880 > 192.168.43.124.7773: UDP, length 120
23:09:20.014627 IP 192.168.43.147.8880 > 192.168.43.124.7773: UDP, length 120
23:09:20.021031 IP 192.168.43.146.8880 > 192.168.43.124.7773: UDP, length 120
23:09:20.030333 IP 192.168.43.124.8880 > 192.168.43.147.7772: UDP, length 120
23:09:20.061522 IP 192.168.43.147.8880 > 192.168.43.124.7773: UDP, length 120
23:09:20.075078 IP 192.168.43.146.8880 > 192.168.43.124.7773: UDP, length 120
23:09:20.080462 IP 192.168.43.124.8880 > 192.168.43.147.7772: UDP, length 120
23:09:20.115692 IP 192.168.43.147.8880 > 192.168.43.124.7773: UDP, length 120
23:09:20.123888 IP 192.168.43.146.8880 > 192.168.43.124.7773: UDP, length 120
23:09:20.130269 IP 192.168.43.124.8880 > 192.168.43.147.7772: UDP, length 120
23:09:20.177201 IP 192.168.43.146.8880 > 192.168.43.124.7773: UDP, length 120
23:09:20.180265 IP 192.168.43.124.8880 > 192.168.43.147.7772: UDP, length 120
23:09:20.230265 IP 192.168.43.124.8880 > 192.168.43.147.7772: UDP, length 120
23:09:20.249960 IP 192.168.43.146.8880 > 192.168.43.124.7773: UDP, length 120
23:09:20.269367 IP 192.168.43.146.8880 > 192.168.43.124.7773: UDP, length 120
23:09:20.280264 IP 192.168.43.124.8880 > 192.168.43.147.7772: UDP, length 120
23:09:20.330260 IP 192.168.43.124.8880 > 192.168.43.147.7772: UDP, length 120
23:09:20.361745 IP 192.168.43.146.8880 > 192.168.43.124.7773: UDP, length 120
23:09:20.380267 IP 192.168.43.124.8880 > 192.168.43.147.7772: UDP, length 120
23:09:20.392352 IP 192.168.43.146.8880 > 192.168.43.124.7773: UDP, length 120
23:09:20.430307 IP 192.168.43.124.8880 > 192.168.43.147.7772: UDP, length 120
23:09:20.441874 IP 192.168.43.146.8880 > 192.168.43.124.7773: UDP, length 120
23:09:20.474176 IP 192.168.43.146.8880 > 192.168.43.124.7773: UDP, length 120
23:09:20.480331 IP 192.168.43.124.8880 > 192.168.43.147.7772: UDP, length 120
23:09:20.530331 IP 192.168.43.124.8880 > 192.168.43.147.7772: UDP, length 120
23:09:20.568579 IP 192.168.43.146.8880 > 192.168.43.124.7773: UDP, length 120
23:09:20.568592 IP 192.168.43.146.8880 > 192.168.43.124.7773: UDP, length 120
23:09:20.580323 IP 192.168.43.124.8880 > 192.168.43.147.7772: UDP, length 120
23:09:20.630332 IP 192.168.43.124.8880 > 192.168.43.147.7772: UDP, length 120
23:09:20.656214 IP 192.168.43.146.8880 > 192.168.43.124.7773: UDP, length 120
23:09:20.667648 IP 192.168.43.146.8880 > 192.168.43.124.7773: UDP, length 120
23:09:20.680294 IP 192.168.43.124.8880 > 192.168.43.147.7772: UDP, length 120
23:09:20.718592 IP 192.168.43.146.8880 > 192.168.43.124.7773: UDP, length 120
23:09:20.730331 IP 192.168.43.124.8880 > 192.168.43.147.7772: UDP, length 120
23:09:20.771048 IP 192.168.43.146.8880 > 192.168.43.124.7773: UDP, length 120
23:09:20.780881 IP 192.168.43.124.8880 > 192.168.43.147.7772: UDP, length 120
23:09:20.826109 IP 192.168.43.146.8880 > 192.168.43.124.7773: UDP, length 120
23:09:20.830331 IP 192.168.43.124.8880 > 192.168.43.147.7772: UDP, length 120
23:09:20.864118 IP 192.168.43.146.8880 > 192.168.43.124.7773: UDP, length 120
23:09:20.880595 IP 192.168.43.124.8880 > 192.168.43.147.7772: UDP, length 120
23:09:20.930295 IP 192.168.43.124.8880 > 192.168.43.147.7772: UDP, length 120
23:09:20.948099 IP 192.168.43.146.8880 > 192.168.43.124.7773: UDP, length 120
23:09:20.967264 IP 192.168.43.146.8880 > 192.168.43.124.7773: UDP, length 120
23:09:20.980275 IP 192.168.43.124.8880 > 192.168.43.147.7772: UDP, length 120
23:09:21.016043 IP 192.168.43.146.8880 > 192.168.43.124.7773: UDP, length 120
23:09:21.030452 IP 192.168.43.124.8880 > 192.168.43.147.7772: UDP, length 120
23:09:21.063919 IP 192.168.43.146.8880 > 192.168.43.124.7773: UDP, length 120
23:09:21.080283 IP 192.168.43.124.8880 > 192.168.43.147.7772: UDP, length 120
23:09:21.118881 IP 192.168.43.146.8880 > 192.168.43.124.7773: UDP, length 120
23:09:21.130266 IP 192.168.43.124.8880 > 192.168.43.147.7772: UDP, length 120
23:09:21.180280 IP 192.168.43.124.8880 > 192.168.43.147.7772: UDP, length 120
23:09:21.230275 IP 192.168.43.124.8880 > 192.168.43.147.7772: UDP, length 120
23:09:21.280260 IP 192.168.43.124.8880 > 192.168.43.147.7772: UDP, length 120
23:09:21.283608 IP 192.168.43.146.8880 > 192.168.43.124.7773: UDP, length 120
23:09:21.285355 IP 192.168.43.146.8880 > 192.168.43.124.7773: UDP, length 120
23:09:21.285363 IP 192.168.43.146.8880 > 192.168.43.124.7773: UDP, length 120
23:09:21.318296 IP 192.168.43.146.8880 > 192.168.43.124.7773: UDP, length 120
23:09:21.330245 IP 192.168.43.124.8880 > 192.168.43.147.7772: UDP, length 120
23:09:21.371595 IP 192.168.43.146.8880 > 192.168.43.124.7773: UDP, length 120
23:09:21.380267 IP 192.168.43.124.8880 > 192.168.43.147.7772: UDP, length 120
23:09:21.415493 IP 192.168.43.146.8880 > 192.168.43.124.7773: UDP, length 120
23:09:21.430261 IP 192.168.43.124.8880 > 192.168.43.147.7772: UDP, length 120
23:09:21.473521 IP 192.168.43.146.8880 > 192.168.43.124.7773: UDP, length 120
23:09:21.480256 IP 192.168.43.124.8880 > 192.168.43.147.7772: UDP, length 120
23:09:21.518428 IP 192.168.43.146.8880 > 192.168.43.124.7773: UDP, length 120
23:09:21.530255 IP 192.168.43.124.8880 > 192.168.43.147.7772: UDP, length 120
23:09:21.564499 IP 192.168.43.146.8880 > 192.168.43.124.7773: UDP, length 120
23:09:21.580329 IP 192.168.43.124.8880 > 192.168.43.147.7772: UDP, length 120
23:09:21.616987 IP 192.168.43.146.8880 > 192.168.43.124.7773: UDP, length 120
23:09:21.630258 IP 192.168.43.124.8880 > 192.168.43.147.7772: UDP, length 120
23:09:21.668409 IP 192.168.43.146.8880 > 192.168.43.124.7773: UDP, length 120
23:09:21.680252 IP 192.168.43.124.8880 > 192.168.43.147.7772: UDP, length 120
23:09:21.718383 IP 192.168.43.146.8880 > 192.168.43.124.7773: UDP, length 120
23:09:21.730257 IP 192.168.43.124.8880 > 192.168.43.147.7772: UDP, length 120
23:09:21.768464 IP 192.168.43.146.8880 > 192.168.43.124.7773: UDP, length 120
23:09:21.780276 IP 192.168.43.124.8880 > 192.168.43.147.7772: UDP, length 120
23:09:21.821960 IP 192.168.43.146.8880 > 192.168.43.124.7773: UDP, length 120
23:09:21.830251 IP 192.168.43.124.8880 > 192.168.43.147.7772: UDP, length 120
23:09:21.865605 IP 192.168.43.146.8880 > 192.168.43.124.7773: UDP, length 120
23:09:21.880270 IP 192.168.43.124.8880 > 192.168.43.147.7772: UDP, length 120
23:09:21.917519 IP 192.168.43.146.8880 > 192.168.43.124.7773: UDP, length 120
23:09:21.930268 IP 192.168.43.124.8880 > 192.168.43.147.7772: UDP, length 120
23:09:21.971588 IP 192.168.43.146.8880 > 192.168.43.124.7773: UDP, length 120
23:09:21.980348 IP 192.168.43.124.8880 > 192.168.43.147.7772: UDP, length 120
23:09:22.015038 IP 192.168.43.146.8880 > 192.168.43.124.7773: UDP, length 120
23:09:22.030260 IP 192.168.43.124.8880 > 192.168.43.147.7772: UDP, length 120
23:09:22.069028 IP 192.168.43.146.8880 > 192.168.43.124.7773: UDP, length 120
23:09:22.080263 IP 192.168.43.124.8880 > 192.168.43.147.7772: UDP, length 120
23:09:22.114031 IP 192.168.43.146.8880 > 192.168.43.124.7773: UDP, length 120
23:09:22.130254 IP 192.168.43.124.8880 > 192.168.43.147.7772: UDP, length 120
23:09:22.165489 IP 192.168.43.146.8880 > 192.168.43.124.7773: UDP, length 120
23:09:22.180273 IP 192.168.43.124.8880 > 192.168.43.147.7772: UDP, length 120
23:09:22.225109 IP 192.168.43.146.8880 > 192.168.43.124.7773: UDP, length 120
23:09:22.230854 IP 192.168.43.124.8880 > 192.168.43.147.7772: UDP, length 120
23:09:22.267909 IP 192.168.43.146.8880 > 192.168.43.124.7773: UDP, length 120
23:09:22.280353 IP 192.168.43.124.8880 > 192.168.43.147.7772: UDP, length 120
23:09:22.316854 IP 192.168.43.146.8880 > 192.168.43.124.7773: UDP, length 120
23:09:22.330252 IP 192.168.43.124.8880 > 192.168.43.147.7772: UDP, length 120
23:09:22.371990 IP 192.168.43.146.8880 > 192.168.43.124.7773: UDP, length 120
23:09:22.381053 IP 192.168.43.124.8880 > 192.168.43.147.7772: UDP, length 120
23:09:22.414997 IP 192.168.43.146.8880 > 192.168.43.124.7773: UDP, length 120
23:09:22.430296 IP 192.168.43.124.8880 > 192.168.43.147.7772: UDP, length 120
23:09:22.472020 IP 192.168.43.146.8880 > 192.168.43.124.7773: UDP, length 120
23:09:22.481810 IP 192.168.43.124.8880 > 192.168.43.147.7772: UDP, length 120
23:09:22.520492 IP 192.168.43.146.8880 > 192.168.43.124.7773: UDP, length 120
23:09:22.530267 IP 192.168.43.124.8880 > 192.168.43.147.7772: UDP, length 120
23:09:22.580265 IP 192.168.43.124.8880 > 192.168.43.147.7772: UDP, length 120
23:09:22.612493 IP 192.168.43.146.8880 > 192.168.43.124.7773: UDP, length 120
23:09:22.617848 IP 192.168.43.146.8880 > 192.168.43.124.7773: UDP, length 120
23:09:22.630338 IP 192.168.43.124.8880 > 192.168.43.147.7772: UDP, length 120
23:09:22.666599 IP 192.168.43.146.8880 > 192.168.43.124.7773: UDP, length 120
23:09:22.680266 IP 192.168.43.124.8880 > 192.168.43.147.7772: UDP, length 120
23:09:22.730376 IP 192.168.43.124.8880 > 192.168.43.147.7772: UDP, length 120
23:09:22.737138 IP 192.168.43.146.8880 > 192.168.43.124.7773: UDP, length 120
23:09:22.780795 IP 192.168.43.124.8880 > 192.168.43.147.7772: UDP, length 120
23:09:22.783333 IP 192.168.43.146.8880 > 192.168.43.124.7773: UDP, length 120
23:09:22.819474 IP 192.168.43.146.8880 > 192.168.43.124.7773: UDP, length 120
23:09:22.830263 IP 192.168.43.124.8880 > 192.168.43.147.7772: UDP, length 120
23:09:22.875497 IP 192.168.43.146.8880 > 192.168.43.124.7773: UDP, length 120
23:09:22.880265 IP 192.168.43.124.8880 > 192.168.43.147.7772: UDP, length 120
23:09:22.920706 IP 192.168.43.146.8880 > 192.168.43.124.7773: UDP, length 120
23:09:22.930261 IP 192.168.43.124.8880 > 192.168.43.147.7772: UDP, length 120
23:09:22.980362 IP 192.168.43.124.8880 > 192.168.43.147.7772: UDP, length 120
23:09:23.025363 IP 192.168.43.146.8880 > 192.168.43.124.7773: UDP, length 120
23:09:23.025429 IP 192.168.43.146.8880 > 192.168.43.124.7773: UDP, length 120
23:09:23.030771 IP 192.168.43.124.8880 > 192.168.43.147.7772: UDP, length 120
23:09:23.080264 IP 192.168.43.124.8880 > 192.168.43.147.7772: UDP, length 120
23:09:23.091537 IP 192.168.43.146.8880 > 192.168.43.124.7773: UDP, length 120
23:09:23.126052 IP 192.168.43.146.8880 > 192.168.43.124.7773: UDP, length 120
23:09:23.130354 IP 192.168.43.124.8880 > 192.168.43.147.7772: UDP, length 120
23:09:23.180354 IP 192.168.43.124.8880 > 192.168.43.147.7772: UDP, length 120
23:09:23.226763 IP 192.168.43.146.8880 > 192.168.43.124.7773: UDP, length 120
23:09:23.226782 IP 192.168.43.146.8880 > 192.168.43.124.7773: UDP, length 120
23:09:23.230776 IP 192.168.43.124.8880 > 192.168.43.147.7772: UDP, length 120
23:09:23.271477 IP 192.168.43.146.8880 > 192.168.43.124.7773: UDP, length 120
23:09:23.280407 IP 192.168.43.124.8880 > 192.168.43.147.7772: UDP, length 120
23:09:23.316539 IP 192.168.43.146.8880 > 192.168.43.124.7773: UDP, length 120
23:09:23.330259 IP 192.168.43.124.8880 > 192.168.43.147.7772: UDP, length 120
23:09:23.372359 IP 192.168.43.146.8880 > 192.168.43.124.7773: UDP, length 120
23:09:23.380356 IP 192.168.43.124.8880 > 192.168.43.147.7772: UDP, length 120
23:09:23.430265 IP 192.168.43.124.8880 > 192.168.43.147.7772: UDP, length 120
23:09:23.430786 IP 192.168.43.146.8880 > 192.168.43.124.7773: UDP, length 120
23:09:23.480283 IP 192.168.43.124.8880 > 192.168.43.147.7772: UDP, length 120
23:09:23.494001 IP 192.168.43.146.8880 > 192.168.43.124.7773: UDP, length 120
23:09:23.522001 IP 192.168.43.146.8880 > 192.168.43.124.7773: UDP, length 120
23:09:23.530279 IP 192.168.43.124.8880 > 192.168.43.147.7772: UDP, length 120
23:09:23.576451 IP 192.168.43.146.8880 > 192.168.43.124.7773: UDP, length 120
23:09:23.580277 IP 192.168.43.124.8880 > 192.168.43.147.7772: UDP, length 120
23:09:23.630295 IP 192.168.43.124.8880 > 192.168.43.147.7772: UDP, length 120
23:09:23.642349 IP 192.168.43.146.8880 > 192.168.43.124.7773: UDP, length 120
23:09:23.680338 IP 192.168.43.124.8880 > 192.168.43.147.7772: UDP, length 120
23:09:23.730272 IP 192.168.43.124.8880 > 192.168.43.147.7772: UDP, length 120
23:09:23.740789 IP 192.168.43.146.8880 > 192.168.43.124.7773: UDP, length 120
23:09:23.740805 IP 192.168.43.146.8880 > 192.168.43.124.7773: UDP, length 120
23:09:23.780254 IP 192.168.43.124.8880 > 192.168.43.147.7772: UDP, length 120
23:09:23.786272 IP 192.168.43.146.8880 > 192.168.43.124.7773: UDP, length 120
23:09:23.830329 IP 192.168.43.124.8880 > 192.168.43.147.7772: UDP, length 120
23:09:23.855864 IP 192.168.43.146.8880 > 192.168.43.124.7773: UDP, length 120
23:09:23.880330 IP 192.168.43.124.8880 > 192.168.43.147.7772: UDP, length 120
23:09:23.930330 IP 192.168.43.124.8880 > 192.168.43.147.7772: UDP, length 120
23:09:23.943874 IP 192.168.43.146.8880 > 192.168.43.124.7773: UDP, length 120
23:09:23.943886 IP 192.168.43.146.8880 > 192.168.43.124.7773: UDP, length 120
23:09:23.980329 IP 192.168.43.124.8880 > 192.168.43.147.7772: UDP, length 120
23:09:23.997071 IP 192.168.43.146.8880 > 192.168.43.124.7773: UDP, length 120
23:09:24.030330 IP 192.168.43.124.8880 > 192.168.43.147.7772: UDP, length 120
23:09:24.066321 IP 192.168.43.146.8880 > 192.168.43.124.7773: UDP, length 120
23:09:24.080333 IP 192.168.43.124.8880 > 192.168.43.147.7772: UDP, length 120
23:09:24.084476 IP 192.168.43.146.8880 > 192.168.43.124.7773: UDP, length 120
23:09:24.130331 IP 192.168.43.124.8880 > 192.168.43.147.7772: UDP, length 120
23:09:24.148071 IP 192.168.43.146.8880 > 192.168.43.124.7773: UDP, length 120
23:09:24.180331 IP 192.168.43.124.8880 > 192.168.43.147.7772: UDP, length 120
23:09:24.213177 IP 192.168.43.146.8880 > 192.168.43.124.7773: UDP, length 120
23:09:24.230330 IP 192.168.43.124.8880 > 192.168.43.147.7772: UDP, length 120
23:09:24.250391 IP 192.168.43.146.8880 > 192.168.43.124.7773: UDP, length 120
23:09:24.280294 IP 192.168.43.124.8880 > 192.168.43.147.7772: UDP, length 120
23:09:24.283945 IP 192.168.43.146.8880 > 192.168.43.124.7773: UDP, length 120
23:09:24.320366 IP 192.168.43.146.8880 > 192.168.43.124.7773: UDP, length 120
23:09:24.330331 IP 192.168.43.124.8880 > 192.168.43.147.7772: UDP, length 120
23:09:24.371941 IP 192.168.43.146.8880 > 192.168.43.124.7773: UDP, length 120
23:09:24.380329 IP 192.168.43.124.8880 > 192.168.43.147.7772: UDP, length 120
23:09:24.430330 IP 192.168.43.124.8880 > 192.168.43.147.7772: UDP, length 120
23:09:24.448390 IP 192.168.43.146.8880 > 192.168.43.124.7773: UDP, length 120
23:09:24.465248 IP 192.168.43.146.8880 > 192.168.43.124.7773: UDP, length 120
23:09:24.480272 IP 192.168.43.124.8880 > 192.168.43.147.7772: UDP, length 120
23:09:24.526677 IP 192.168.43.146.8880 > 192.168.43.124.7773: UDP, length 120
23:09:24.530262 IP 192.168.43.124.8880 > 192.168.43.147.7772: UDP, length 120
23:09:24.570744 IP 192.168.43.146.8880 > 192.168.43.124.7773: UDP, length 120
23:09:24.580270 IP 192.168.43.124.8880 > 192.168.43.147.7772: UDP, length 120
23:09:24.630257 IP 192.168.43.124.8880 > 192.168.43.147.7772: UDP, length 120
23:09:24.661806 IP 192.168.43.146.8880 > 192.168.43.124.7773: UDP, length 120
23:09:24.664843 IP 192.168.43.146.8880 > 192.168.43.124.7773: UDP, length 120
23:09:24.680270 IP 192.168.43.124.8880 > 192.168.43.147.7772: UDP, length 120
23:09:24.730064 IP 192.168.43.146.8880 > 192.168.43.124.7773: UDP, length 120
23:09:24.730761 IP 192.168.43.124.8880 > 192.168.43.147.7772: UDP, length 120
23:09:24.780253 IP 192.168.43.124.8880 > 192.168.43.147.7772: UDP, length 120
23:09:24.793525 IP 192.168.43.146.8880 > 192.168.43.124.7773: UDP, length 120
23:09:24.814148 IP 192.168.43.146.8880 > 192.168.43.124.7773: UDP, length 120
23:09:24.830259 IP 192.168.43.124.8880 > 192.168.43.147.7772: UDP, length 120
23:09:24.875448 IP 192.168.43.146.8880 > 192.168.43.124.7773: UDP, length 120
23:09:24.880429 IP 192.168.43.124.8880 > 192.168.43.147.7772: UDP, length 120
23:09:24.915035 IP 192.168.43.146.8880 > 192.168.43.124.7773: UDP, length 120
23:09:24.930419 IP 192.168.43.124.8880 > 192.168.43.147.7772: UDP, length 120
23:09:24.970705 IP 192.168.43.146.8880 > 192.168.43.124.7773: UDP, length 120
23:09:24.980257 IP 192.168.43.124.8880 > 192.168.43.147.7772: UDP, length 120
23:09:25.025765 IP 192.168.43.146.8880 > 192.168.43.124.7773: UDP, length 120
23:09:25.030331 IP 192.168.43.124.8880 > 192.168.43.147.7772: UDP, length 120
23:09:25.070109 IP 192.168.43.146.8880 > 192.168.43.124.7773: UDP, length 120
23:09:25.080260 IP 192.168.43.124.8880 > 192.168.43.147.7772: UDP, length 120
23:09:25.113719 IP 192.168.43.146.8880 > 192.168.43.124.7773: UDP, length 120
23:09:25.130256 IP 192.168.43.124.8880 > 192.168.43.147.7772: UDP, length 120
23:09:25.171800 IP 192.168.43.146.8880 > 192.168.43.124.7773: UDP, length 120
23:09:25.180296 IP 192.168.43.124.8880 > 192.168.43.147.7772: UDP, length 120
23:09:25.214875 IP 192.168.43.146.8880 > 192.168.43.124.7773: UDP, length 120
23:09:25.230332 IP 192.168.43.124.8880 > 192.168.43.147.7772: UDP, length 120
23:09:25.264093 IP 192.168.43.146.8880 > 192.168.43.124.7773: UDP, length 120
23:09:25.280278 IP 192.168.43.124.8880 > 192.168.43.147.7772: UDP, length 120
23:09:25.317314 IP 192.168.43.146.8880 > 192.168.43.124.7773: UDP, length 120
23:09:25.330733 IP 192.168.43.124.8880 > 192.168.43.147.7772: UDP, length 120
23:09:25.380331 IP 192.168.43.124.8880 > 192.168.43.147.7772: UDP, length 120
23:09:25.384619 IP 192.168.43.146.8880 > 192.168.43.124.7773: UDP, length 120
23:09:25.417571 IP 192.168.43.146.8880 > 192.168.43.124.7773: UDP, length 120
23:09:25.430254 IP 192.168.43.124.8880 > 192.168.43.147.7772: UDP, length 120
23:09:25.470718 IP 192.168.43.146.8880 > 192.168.43.124.7773: UDP, length 120
23:09:25.480258 IP 192.168.43.124.8880 > 192.168.43.147.7772: UDP, length 120
23:09:25.530330 IP 192.168.43.124.8880 > 192.168.43.147.7772: UDP, length 120
23:09:25.580331 IP 192.168.43.124.8880 > 192.168.43.147.7772: UDP, length 120
23:09:25.630330 IP 192.168.43.124.8880 > 192.168.43.147.7772: UDP, length 120
23:09:25.680332 IP 192.168.43.124.8880 > 192.168.43.147.7772: UDP, length 120
23:09:25.730331 IP 192.168.43.124.8880 > 192.168.43.147.7772: UDP, length 120
23:09:25.780284 IP 192.168.43.124.8880 > 192.168.43.147.7772: UDP, length 120
23:09:25.830332 IP 192.168.43.124.8880 > 192.168.43.147.7772: UDP, length 120
23:09:25.880262 IP 192.168.43.124.8880 > 192.168.43.147.7772: UDP, length 120
23:09:25.930260 IP 192.168.43.124.8880 > 192.168.43.147.7772: UDP, length 120
23:09:25.980384 IP 192.168.43.124.8880 > 192.168.43.147.7772: UDP, length 120
23:09:26.030330 IP 192.168.43.124.8880 > 192.168.43.147.7772: UDP, length 120
23:09:26.080331 IP 192.168.43.124.8880 > 192.168.43.147.7772: UDP, length 120
23:09:26.130331 IP 192.168.43.124.8880 > 192.168.43.147.7772: UDP, length 120
23:09:26.180331 IP 192.168.43.124.8880 > 192.168.43.147.7772: UDP, length 120
23:09:26.230381 IP 192.168.43.124.8880 > 192.168.43.147.7772: UDP, length 120
23:09:26.280386 IP 192.168.43.124.8880 > 192.168.43.147.7772: UDP, length 120
23:09:26.330520 IP 192.168.43.124.8880 > 192.168.43.147.7772: UDP, length 120
23:09:26.380382 IP 192.168.43.124.8880 > 192.168.43.147.7772: UDP, length 120
23:09:26.430383 IP 192.168.43.124.8880 > 192.168.43.147.7772: UDP, length 120
23:09:26.480343 IP 192.168.43.124.8880 > 192.168.43.147.7772: UDP, length 120
23:09:26.530375 IP 192.168.43.124.8880 > 192.168.43.147.7772: UDP, length 120
23:09:26.580330 IP 192.168.43.124.8880 > 192.168.43.147.7772: UDP, length 120
23:09:26.630332 IP 192.168.43.124.8880 > 192.168.43.147.7772: UDP, length 120
23:09:26.680275 IP 192.168.43.124.8880 > 192.168.43.147.7772: UDP, length 120
23:09:26.730332 IP 192.168.43.124.8880 > 192.168.43.147.7772: UDP, length 120
23:09:26.780331 IP 192.168.43.124.8880 > 192.168.43.147.7772: UDP, length 120
23:09:26.830331 IP 192.168.43.124.8880 > 192.168.43.147.7772: UDP, length 120
23:09:26.880331 IP 192.168.43.124.8880 > 192.168.43.147.7772: UDP, length 120
23:09:26.930331 IP 192.168.43.124.8880 > 192.168.43.147.7772: UDP, length 120
23:09:26.980288 IP 192.168.43.124.8880 > 192.168.43.147.7772: UDP, length 120
23:09:27.030273 IP 192.168.43.124.8880 > 192.168.43.147.7772: UDP, length 120
23:09:27.080262 IP 192.168.43.124.8880 > 192.168.43.147.7772: UDP, length 120
23:09:27.130268 IP 192.168.43.124.8880 > 192.168.43.147.7772: UDP, length 120
23:09:27.180341 IP 192.168.43.124.8880 > 192.168.43.147.7772: UDP, length 120
23:09:27.230331 IP 192.168.43.124.8880 > 192.168.43.147.7772: UDP, length 120
