01:40:18.605606 IP 192.168.43.147.8880 > 192.168.43.124.7773: UDP, length 120
01:40:18.655657 IP 192.168.43.147.8880 > 192.168.43.124.7773: UDP, length 120
01:40:18.705642 IP 192.168.43.147.8880 > 192.168.43.124.7773: UDP, length 120
01:40:18.755631 IP 192.168.43.147.8880 > 192.168.43.124.7773: UDP, length 120
01:40:18.800949 IP 192.168.43.146.8880 > 192.168.43.147.7772: UDP, length 120
01:40:18.805631 IP 192.168.43.147.8880 > 192.168.43.124.7773: UDP, length 120
01:40:18.849509 IP 192.168.43.146.8880 > 192.168.43.147.7772: UDP, length 120
01:40:18.855657 IP 192.168.43.147.8880 > 192.168.43.124.7773: UDP, length 120
01:40:18.901492 IP 192.168.43.146.8880 > 192.168.43.147.7772: UDP, length 120
01:40:18.905637 IP 192.168.43.147.8880 > 192.168.43.124.7773: UDP, length 120
01:40:18.949343 IP 192.168.43.146.8880 > 192.168.43.147.7772: UDP, length 120
01:40:18.955630 IP 192.168.43.147.8880 > 192.168.43.124.7773: UDP, length 120
01:40:18.999861 IP 192.168.43.146.8880 > 192.168.43.147.7772: UDP, length 120
01:40:19.005629 IP 192.168.43.147.8880 > 192.168.43.124.7773: UDP, length 120
01:40:19.049534 IP 192.168.43.146.8880 > 192.168.43.147.7772: UDP, length 120
01:40:19.055629 IP 192.168.43.147.8880 > 192.168.43.124.7773: UDP, length 120
01:40:19.099106 IP 192.168.43.146.8880 > 192.168.43.147.7772: UDP, length 120
01:40:19.105628 IP 192.168.43.147.8880 > 192.168.43.124.7773: UDP, length 120
01:40:19.152224 IP 192.168.43.146.8880 > 192.168.43.147.7772: UDP, length 120
01:40:19.155628 IP 192.168.43.147.8880 > 192.168.43.124.7773: UDP, length 120
01:40:19.199912 IP 192.168.43.146.8880 > 192.168.43.147.7772: UDP, length 120
01:40:19.205638 IP 192.168.43.147.8880 > 192.168.43.124.7773: UDP, length 120
01:40:19.250713 IP 192.168.43.146.8880 > 192.168.43.147.7772: UDP, length 120
01:40:19.255633 IP 192.168.43.147.8880 > 192.168.43.124.7773: UDP, length 120
01:40:19.302308 IP 192.168.43.146.8880 > 192.168.43.147.7772: UDP, length 120
01:40:19.305630 IP 192.168.43.147.8880 > 192.168.43.124.7773: UDP, length 120
01:40:19.353113 IP 192.168.43.146.8880 > 192.168.43.147.7772: UDP, length 120
01:40:19.355628 IP 192.168.43.147.8880 > 192.168.43.124.7773: UDP, length 120
01:40:19.404078 IP 192.168.43.146.8880 > 192.168.43.147.7772: UDP, length 120
01:40:19.405629 IP 192.168.43.147.8880 > 192.168.43.124.7773: UDP, length 120
01:40:19.449537 IP 192.168.43.146.8880 > 192.168.43.147.7772: UDP, length 120
01:40:19.455628 IP 192.168.43.147.8880 > 192.168.43.124.7773: UDP, length 120
01:40:19.499441 IP 192.168.43.146.8880 > 192.168.43.147.7772: UDP, length 120
01:40:19.505629 IP 192.168.43.147.8880 > 192.168.43.124.7773: UDP, length 120
01:40:19.551937 IP 192.168.43.146.8880 > 192.168.43.147.7772: UDP, length 120
01:40:19.555628 IP 192.168.43.147.8880 > 192.168.43.124.7773: UDP, length 120
01:40:19.600985 IP 192.168.43.146.8880 > 192.168.43.147.7772: UDP, length 120
01:40:19.605629 IP 192.168.43.147.8880 > 192.168.43.124.7773: UDP, length 120
01:40:19.652055 IP 192.168.43.146.8880 > 192.168.43.147.7772: UDP, length 120
01:40:19.655634 IP 192.168.43.147.8880 > 192.168.43.124.7773: UDP, length 120
01:40:19.700126 IP 192.168.43.146.8880 > 192.168.43.147.7772: UDP, length 120
01:40:19.705630 IP 192.168.43.147.8880 > 192.168.43.124.7773: UDP, length 120
01:40:19.755628 IP 192.168.43.147.8880 > 192.168.43.124.7773: UDP, length 120
01:40:19.756789 IP 192.168.43.146.8880 > 192.168.43.147.7772: UDP, length 120
01:40:19.799109 IP 192.168.43.146.8880 > 192.168.43.147.7772: UDP, length 120
01:40:19.805629 IP 192.168.43.147.8880 > 192.168.43.124.7773: UDP, length 120
01:40:19.855632 IP 192.168.43.147.8880 > 192.168.43.124.7773: UDP, length 120
01:40:19.856808 IP 192.168.43.146.8880 > 192.168.43.147.7772: UDP, length 120
01:40:19.898859 IP 192.168.43.146.8880 > 192.168.43.147.7772: UDP, length 120
01:40:19.905632 IP 192.168.43.147.8880 > 192.168.43.124.7773: UDP, length 120
01:40:19.949159 IP 192.168.43.146.8880 > 192.168.43.147.7772: UDP, length 120
01:40:19.955629 IP 192.168.43.147.8880 > 192.168.43.124.7773: UDP, length 120
01:40:20.000609 IP 192.168.43.146.8880 > 192.168.43.147.7772: UDP, length 120
01:40:20.005629 IP 192.168.43.147.8880 > 192.168.43.124.7773: UDP, length 120
01:40:20.049029 IP 192.168.43.146.8880 > 192.168.43.147.7772: UDP, length 120
01:40:20.055628 IP 192.168.43.147.8880 > 192.168.43.124.7773: UDP, length 120
01:40:20.100184 IP 192.168.43.146.8880 > 192.168.43.147.7772: UDP, length 120
01:40:20.105628 IP 192.168.43.147.8880 > 192.168.43.124.7773: UDP, length 120
01:40:20.151535 IP 192.168.43.146.8880 > 192.168.43.147.7772: UDP, length 120
01:40:20.155629 IP 192.168.43.147.8880 > 192.168.43.124.7773: UDP, length 120
01:40:20.196982 IP 192.168.43.146.8880 > 192.168.43.147.7772: UDP, length 120
01:40:20.205628 IP 192.168.43.147.8880 > 192.168.43.124.7773: UDP, length 120
01:40:20.246448 IP 192.168.43.146.8880 > 192.168.43.147.7772: UDP, length 120
01:40:20.255633 IP 192.168.43.147.8880 > 192.168.43.124.7773: UDP, length 120
01:40:20.301268 IP 192.168.43.146.8880 > 192.168.43.147.7772: UDP, length 120
01:40:20.305631 IP 192.168.43.147.8880 > 192.168.43.124.7773: UDP, length 120
01:40:20.351974 IP 192.168.43.146.8880 > 192.168.43.147.7772: UDP, length 120
01:40:20.355652 IP 192.168.43.147.8880 > 192.168.43.124.7773: UDP, length 120
01:40:20.403513 IP 192.168.43.146.8880 > 192.168.43.147.7772: UDP, length 120
01:40:20.405635 IP 192.168.43.147.8880 > 192.168.43.124.7773: UDP, length 120
01:40:20.449343 IP 192.168.43.146.8880 > 192.168.43.147.7772: UDP, length 120
01:40:20.455630 IP 192.168.43.147.8880 > 192.168.43.124.7773: UDP, length 120
01:40:20.499322 IP 192.168.43.146.8880 > 192.168.43.147.7772: UDP, length 120
01:40:20.505631 IP 192.168.43.147.8880 > 192.168.43.124.7773: UDP, length 120
01:40:20.551703 IP 192.168.43.146.8880 > 192.168.43.147.7772: UDP, length 120
01:40:20.555629 IP 192.168.43.147.8880 > 192.168.43.124.7773: UDP, length 120
01:40:20.603007 IP 192.168.43.146.8880 > 192.168.43.147.7772: UDP, length 120
01:40:20.605630 IP 192.168.43.147.8880 > 192.168.43.124.7773: UDP, length 120
01:40:20.650968 IP 192.168.43.146.8880 > 192.168.43.147.7772: UDP, length 120
01:40:20.655639 IP 192.168.43.147.8880 > 192.168.43.124.7773: UDP, length 120
01:40:20.705629 IP 192.168.43.147.8880 > 192.168.43.124.7773: UDP, length 120
01:40:20.722225 IP 192.168.43.146.8880 > 192.168.43.147.7772: UDP, length 120
01:40:20.748893 IP 192.168.43.146.8880 > 192.168.43.147.7772: UDP, length 120
01:40:20.755629 IP 192.168.43.147.8880 > 192.168.43.124.7773: UDP, length 120
01:40:20.805632 IP 192.168.43.147.8880 > 192.168.43.124.7773: UDP, length 120
01:40:20.820768 IP 192.168.43.146.8880 > 192.168.43.147.7772: UDP, length 120
01:40:20.850499 IP 192.168.43.146.8880 > 192.168.43.147.7772: UDP, length 120
01:40:20.855641 IP 192.168.43.147.8880 > 192.168.43.124.7773: UDP, length 120
01:40:20.895890 IP 192.168.43.146.8880 > 192.168.43.147.7772: UDP, length 120
01:40:20.905630 IP 192.168.43.147.8880 > 192.168.43.124.7773: UDP, length 120
01:40:20.953779 IP 192.168.43.146.8880 > 192.168.43.147.7772: UDP, length 120
01:40:20.955629 IP 192.168.43.147.8880 > 192.168.43.124.7773: UDP, length 120
01:40:20.998787 IP 192.168.43.146.8880 > 192.168.43.147.7772: UDP, length 120
01:40:21.005628 IP 192.168.43.147.8880 > 192.168.43.124.7773: UDP, length 120
01:40:21.048822 IP 192.168.43.146.8880 > 192.168.43.147.7772: UDP, length 120
01:40:21.055627 IP 192.168.43.147.8880 > 192.168.43.124.7773: UDP, length 120
01:40:21.099594 IP 192.168.43.146.8880 > 192.168.43.147.7772: UDP, length 120
01:40:21.105627 IP 192.168.43.147.8880 > 192.168.43.124.7773: UDP, length 120
01:40:21.148917 IP 192.168.43.146.8880 > 192.168.43.147.7772: UDP, length 120
01:40:21.155628 IP 192.168.43.147.8880 > 192.168.43.124.7773: UDP, length 120
01:40:21.201006 IP 192.168.43.146.8880 > 192.168.43.147.7772: UDP, length 120
01:40:21.205627 IP 192.168.43.147.8880 > 192.168.43.124.7773: UDP, length 120
01:40:21.248731 IP 192.168.43.146.8880 > 192.168.43.147.7772: UDP, length 120
01:40:21.255628 IP 192.168.43.147.8880 > 192.168.43.124.7773: UDP, length 120
01:40:21.301218 IP 192.168.43.146.8880 > 192.168.43.147.7772: UDP, length 120
01:40:21.305629 IP 192.168.43.147.8880 > 192.168.43.124.7773: UDP, length 120
01:40:21.350588 IP 192.168.43.146.8880 > 192.168.43.147.7772: UDP, length 120
01:40:21.355636 IP 192.168.43.147.8880 > 192.168.43.124.7773: UDP, length 120
01:40:21.404935 IP 192.168.43.146.8880 > 192.168.43.147.7772: UDP, length 120
01:40:21.405629 IP 192.168.43.147.8880 > 192.168.43.124.7773: UDP, length 120
01:40:21.452701 IP 192.168.43.146.8880 > 192.168.43.147.7772: UDP, length 120
01:40:21.455628 IP 192.168.43.147.8880 > 192.168.43.124.7773: UDP, length 120
01:40:21.499102 IP 192.168.43.146.8880 > 192.168.43.147.7772: UDP, length 120
01:40:21.505627 IP 192.168.43.147.8880 > 192.168.43.124.7773: UDP, length 120
01:40:21.555627 IP 192.168.43.147.8880 > 192.168.43.124.7773: UDP, length 120
01:40:21.590680 IP 192.168.43.146.8880 > 192.168.43.147.7772: UDP, length 120
01:40:21.597169 IP 192.168.43.146.8880 > 192.168.43.147.7772: UDP, length 120
01:40:21.605629 IP 192.168.43.147.8880 > 192.168.43.124.7773: UDP, length 120
01:40:21.649076 IP 192.168.43.146.8880 > 192.168.43.147.7772: UDP, length 120
01:40:21.655634 IP 192.168.43.147.8880 > 192.168.43.124.7773: UDP, length 120
01:40:21.702318 IP 192.168.43.146.8880 > 192.168.43.147.7772: UDP, length 120
01:40:21.705628 IP 192.168.43.147.8880 > 192.168.43.124.7773: UDP, length 120
01:40:21.748869 IP 192.168.43.146.8880 > 192.168.43.147.7772: UDP, length 120
01:40:21.755627 IP 192.168.43.147.8880 > 192.168.43.124.7773: UDP, length 120
01:40:21.802396 IP 192.168.43.146.8880 > 192.168.43.147.7772: UDP, length 120
01:40:21.805627 IP 192.168.43.147.8880 > 192.168.43.124.7773: UDP, length 120
01:40:21.849105 IP 192.168.43.146.8880 > 192.168.43.147.7772: UDP, length 120
01:40:21.855660 IP 192.168.43.147.8880 > 192.168.43.124.7773: UDP, length 120
01:40:21.905074 IP 192.168.43.146.8880 > 192.168.43.147.7772: UDP, length 120
01:40:21.905671 IP 192.168.43.147.8880 > 192.168.43.124.7773: UDP, length 120
01:40:21.947374 IP 192.168.43.146.8880 > 192.168.43.147.7772: UDP, length 120
01:40:21.955654 IP 192.168.43.147.8880 > 192.168.43.124.7773: UDP, length 120
01:40:21.999107 IP 192.168.43.146.8880 > 192.168.43.147.7772: UDP, length 120
01:40:22.005654 IP 192.168.43.147.8880 > 192.168.43.124.7773: UDP, length 120
01:40:22.048961 IP 192.168.43.146.8880 > 192.168.43.147.7772: UDP, length 120
01:40:22.055655 IP 192.168.43.147.8880 > 192.168.43.124.7773: UDP, length 120
01:40:22.098760 IP 192.168.43.146.8880 > 192.168.43.147.7772: UDP, length 120
01:40:22.105653 IP 192.168.43.147.8880 > 192.168.43.124.7773: UDP, length 120
01:40:22.155654 IP 192.168.43.147.8880 > 192.168.43.124.7773: UDP, length 120
01:40:22.167469 IP 192.168.43.146.8880 > 192.168.43.147.7772: UDP, length 120
01:40:22.202539 IP 192.168.43.146.8880 > 192.168.43.147.7772: UDP, length 120
01:40:22.205725 IP 192.168.43.147.8880 > 192.168.43.124.7773: UDP, length 120
01:40:22.250873 IP 192.168.43.146.8880 > 192.168.43.147.7772: UDP, length 120
01:40:22.255814 IP 192.168.43.147.8880 > 192.168.43.124.7773: UDP, length 120
01:40:22.300598 IP 192.168.43.146.8880 > 192.168.43.147.7772: UDP, length 120
01:40:22.305707 IP 192.168.43.147.8880 > 192.168.43.124.7773: UDP, length 120
01:40:22.349976 IP 192.168.43.146.8880 > 192.168.43.147.7772: UDP, length 120
01:40:22.355678 IP 192.168.43.147.8880 > 192.168.43.124.7773: UDP, length 120
01:40:22.400115 IP 192.168.43.146.8880 > 192.168.43.147.7772: UDP, length 120
01:40:22.405713 IP 192.168.43.147.8880 > 192.168.43.124.7773: UDP, length 120
01:40:22.451441 IP 192.168.43.146.8880 > 192.168.43.147.7772: UDP, length 120
01:40:22.455723 IP 192.168.43.147.8880 > 192.168.43.124.7773: UDP, length 120
01:40:22.503976 IP 192.168.43.146.8880 > 192.168.43.147.7772: UDP, length 120
01:40:22.505700 IP 192.168.43.147.8880 > 192.168.43.124.7773: UDP, length 120
01:40:22.553903 IP 192.168.43.146.8880 > 192.168.43.147.7772: UDP, length 120
01:40:22.555704 IP 192.168.43.147.8880 > 192.168.43.124.7773: UDP, length 120
01:40:22.602461 IP 192.168.43.146.8880 > 192.168.43.147.7772: UDP, length 120
01:40:22.605726 IP 192.168.43.147.8880 > 192.168.43.124.7773: UDP, length 120
01:40:22.655677 IP 192.168.43.147.8880 > 192.168.43.124.7773: UDP, length 120
01:40:22.663159 IP 192.168.43.146.8880 > 192.168.43.147.7772: UDP, length 120
01:40:22.705640 IP 192.168.43.147.8880 > 192.168.43.124.7773: UDP, length 120
01:40:22.755631 IP 192.168.43.147.8880 > 192.168.43.124.7773: UDP, length 120
01:40:22.764950 IP 192.168.43.146.8880 > 192.168.43.147.7772: UDP, length 120
01:40:22.805629 IP 192.168.43.147.8880 > 192.168.43.124.7773: UDP, length 120
01:40:22.808897 IP 192.168.43.146.8880 > 192.168.43.147.7772: UDP, length 120
01:40:22.855629 IP 192.168.43.147.8880 > 192.168.43.124.7773: UDP, length 120
01:40:22.875465 IP 192.168.43.146.8880 > 192.168.43.147.7772: UDP, length 120
01:40:22.905630 IP 192.168.43.147.8880 > 192.168.43.124.7773: UDP, length 120
01:40:22.952772 IP 192.168.43.146.8880 > 192.168.43.147.7772: UDP, length 120
01:40:22.955627 IP 192.168.43.147.8880 > 192.168.43.124.7773: UDP, length 120
01:40:23.005643 IP 192.168.43.147.8880 > 192.168.43.124.7773: UDP, length 120
01:40:23.008684 IP 192.168.43.146.8880 > 192.168.43.147.7772: UDP, length 120
01:40:23.051265 IP 192.168.43.146.8880 > 192.168.43.147.7772: UDP, length 120
01:40:23.055644 IP 192.168.43.147.8880 > 192.168.43.124.7773: UDP, length 120
01:40:23.099757 IP 192.168.43.146.8880 > 192.168.43.147.7772: UDP, length 120
01:40:23.105635 IP 192.168.43.147.8880 > 192.168.43.124.7773: UDP, length 120
01:40:23.155628 IP 192.168.43.147.8880 > 192.168.43.124.7773: UDP, length 120
01:40:23.159242 IP 192.168.43.146.8880 > 192.168.43.147.7772: UDP, length 120
01:40:23.205628 IP 192.168.43.147.8880 > 192.168.43.124.7773: UDP, length 120
01:40:23.236006 IP 192.168.43.146.8880 > 192.168.43.147.7772: UDP, length 120
01:40:23.251091 IP 192.168.43.146.8880 > 192.168.43.147.7772: UDP, length 120
01:40:23.255627 IP 192.168.43.147.8880 > 192.168.43.124.7773: UDP, length 120
01:40:23.305628 IP 192.168.43.147.8880 > 192.168.43.124.7773: UDP, length 120
01:40:23.353407 IP 192.168.43.146.8880 > 192.168.43.147.7772: UDP, length 120
01:40:23.355659 IP 192.168.43.147.8880 > 192.168.43.124.7773: UDP, length 120
01:40:23.405641 IP 192.168.43.147.8880 > 192.168.43.124.7773: UDP, length 120
01:40:23.443455 IP 192.168.43.146.8880 > 192.168.43.147.7772: UDP, length 120
01:40:23.446606 IP 192.168.43.146.8880 > 192.168.43.147.7772: UDP, length 120
01:40:23.455629 IP 192.168.43.147.8880 > 192.168.43.124.7773: UDP, length 120
01:40:23.505634 IP 192.168.43.147.8880 > 192.168.43.124.7773: UDP, length 120
01:40:23.506525 IP 192.168.43.146.8880 > 192.168.43.147.7772: UDP, length 120
01:40:23.549565 IP 192.168.43.146.8880 > 192.168.43.147.7772: UDP, length 120
01:40:23.555631 IP 192.168.43.147.8880 > 192.168.43.124.7773: UDP, length 120
01:40:23.605630 IP 192.168.43.147.8880 > 192.168.43.124.7773: UDP, length 120
01:40:23.655632 IP 192.168.43.147.8880 > 192.168.43.124.7773: UDP, length 120
01:40:23.658918 IP 192.168.43.146.8880 > 192.168.43.147.7772: UDP, length 120
01:40:23.705631 IP 192.168.43.147.8880 > 192.168.43.124.7773: UDP, length 120
01:40:23.709203 IP 192.168.43.146.8880 > 192.168.43.147.7772: UDP, length 120
01:40:23.754429 IP 192.168.43.146.8880 > 192.168.43.147.7772: UDP, length 120
01:40:23.755632 IP 192.168.43.147.8880 > 192.168.43.124.7773: UDP, length 120
01:40:23.805634 IP 192.168.43.147.8880 > 192.168.43.124.7773: UDP, length 120
01:40:23.850436 IP 192.168.43.146.8880 > 192.168.43.147.7772: UDP, length 120
01:40:23.855633 IP 192.168.43.147.8880 > 192.168.43.124.7773: UDP, length 120
01:40:23.905629 IP 192.168.43.147.8880 > 192.168.43.124.7773: UDP, length 120
01:40:23.905943 IP 192.168.43.146.8880 > 192.168.43.147.7772: UDP, length 120
01:40:23.952835 IP 192.168.43.146.8880 > 192.168.43.147.7772: UDP, length 120
01:40:23.955630 IP 192.168.43.147.8880 > 192.168.43.124.7773: UDP, length 120
01:40:24.003758 IP 192.168.43.146.8880 > 192.168.43.147.7772: UDP, length 120
01:40:24.005630 IP 192.168.43.147.8880 > 192.168.43.124.7773: UDP, length 120
01:40:24.055628 IP 192.168.43.147.8880 > 192.168.43.124.7773: UDP, length 120
01:40:24.056891 IP 192.168.43.146.8880 > 192.168.43.147.7772: UDP, length 120
01:40:24.105630 IP 192.168.43.147.8880 > 192.168.43.124.7773: UDP, length 120
01:40:24.155629 IP 192.168.43.147.8880 > 192.168.43.124.7773: UDP, length 120
01:40:24.205628 IP 192.168.43.147.8880 > 192.168.43.124.7773: UDP, length 120
01:40:24.206510 IP 192.168.43.146.8880 > 192.168.43.147.7772: UDP, length 120
01:40:24.255629 IP 192.168.43.147.8880 > 192.168.43.124.7773: UDP, length 120
01:40:24.301712 IP 192.168.43.146.8880 > 192.168.43.147.7772: UDP, length 120
01:40:24.305628 IP 192.168.43.147.8880 > 192.168.43.124.7773: UDP, length 120
01:40:24.351930 IP 192.168.43.146.8880 > 192.168.43.147.7772: UDP, length 120
01:40:24.355628 IP 192.168.43.147.8880 > 192.168.43.124.7773: UDP, length 120
01:40:24.405181 IP 192.168.43.146.8880 > 192.168.43.147.7772: UDP, length 120
01:40:24.405630 IP 192.168.43.147.8880 > 192.168.43.124.7773: UDP, length 120
01:40:24.455628 IP 192.168.43.147.8880 > 192.168.43.124.7773: UDP, length 120
01:40:24.461800 IP 192.168.43.146.8880 > 192.168.43.147.7772: UDP, length 120
01:40:24.505639 IP 192.168.43.147.8880 > 192.168.43.124.7773: UDP, length 120
01:40:24.516143 IP 192.168.43.146.8880 > 192.168.43.147.7772: UDP, length 120
01:40:24.553189 IP 192.168.43.146.8880 > 192.168.43.147.7772: UDP, length 120
01:40:24.555633 IP 192.168.43.147.8880 > 192.168.43.124.7773: UDP, length 120
01:40:24.605411 IP 192.168.43.146.8880 > 192.168.43.147.7772: UDP, length 120
01:40:24.605630 IP 192.168.43.147.8880 > 192.168.43.124.7773: UDP, length 120
01:40:24.655634 IP 192.168.43.147.8880 > 192.168.43.124.7773: UDP, length 120
01:40:24.705628 IP 192.168.43.147.8880 > 192.168.43.124.7773: UDP, length 120
01:40:24.755628 IP 192.168.43.147.8880 > 192.168.43.124.7773: UDP, length 120
01:40:24.769161 IP 192.168.43.146.8880 > 192.168.43.147.7772: UDP, length 120
01:40:24.805635 IP 192.168.43.147.8880 > 192.168.43.124.7773: UDP, length 120
01:40:24.855669 IP 192.168.43.147.8880 > 192.168.43.124.7773: UDP, length 120
01:40:24.861021 IP 192.168.43.146.8880 > 192.168.43.147.7772: UDP, length 120
01:40:24.866195 IP 192.168.43.146.8880 > 192.168.43.147.7772: UDP, length 120
01:40:24.905642 IP 192.168.43.147.8880 > 192.168.43.124.7773: UDP, length 120
01:40:24.908949 IP 192.168.43.146.8880 > 192.168.43.147.7772: UDP, length 120
01:40:24.955633 IP 192.168.43.147.8880 > 192.168.43.124.7773: UDP, length 120
01:40:24.961664 IP 192.168.43.146.8880 > 192.168.43.147.7772: UDP, length 120
01:40:25.005630 IP 192.168.43.147.8880 > 192.168.43.124.7773: UDP, length 120
01:40:25.012358 IP 192.168.43.146.8880 > 192.168.43.147.7772: UDP, length 120
01:40:25.055628 IP 192.168.43.147.8880 > 192.168.43.124.7773: UDP, length 120
01:40:25.060550 IP 192.168.43.146.8880 > 192.168.43.147.7772: UDP, length 120
01:40:25.105629 IP 192.168.43.147.8880 > 192.168.43.124.7773: UDP, length 120
01:40:25.130717 IP 192.168.43.146.8880 > 192.168.43.147.7772: UDP, length 120
01:40:25.155631 IP 192.168.43.147.8880 > 192.168.43.124.7773: UDP, length 120
01:40:25.167539 IP 192.168.43.146.8880 > 192.168.43.147.7772: UDP, length 120
01:40:25.205628 IP 192.168.43.147.8880 > 192.168.43.124.7773: UDP, length 120
01:40:25.217174 IP 192.168.43.146.8880 > 192.168.43.147.7772: UDP, length 120
01:40:25.255629 IP 192.168.43.147.8880 > 192.168.43.124.7773: UDP, length 120
01:40:25.305628 IP 192.168.43.147.8880 > 192.168.43.124.7773: UDP, length 120
01:40:25.334908 IP 192.168.43.146.8880 > 192.168.43.147.7772: UDP, length 120
01:40:25.355628 IP 192.168.43.147.8880 > 192.168.43.124.7773: UDP, length 120
01:40:25.405629 IP 192.168.43.147.8880 > 192.168.43.124.7773: UDP, length 120
01:40:25.410983 IP 192.168.43.146.8880 > 192.168.43.147.7772: UDP, length 120
01:40:25.455629 IP 192.168.43.147.8880 > 192.168.43.124.7773: UDP, length 120
01:40:25.483293 IP 192.168.43.146.8880 > 192.168.43.147.7772: UDP, length 120
01:40:25.495021 IP 192.168.43.146.8880 > 192.168.43.147.7772: UDP, length 120
01:40:25.505629 IP 192.168.43.147.8880 > 192.168.43.124.7773: UDP, length 120
01:40:25.555634 IP 192.168.43.147.8880 > 192.168.43.124.7773: UDP, length 120
01:40:25.591216 IP 192.168.43.146.8880 > 192.168.43.147.7772: UDP, length 120
01:40:25.605632 IP 192.168.43.147.8880 > 192.168.43.124.7773: UDP, length 120
01:40:25.626508 IP 192.168.43.146.8880 > 192.168.43.147.7772: UDP, length 120
01:40:25.655636 IP 192.168.43.147.8880 > 192.168.43.124.7773: UDP, length 120
01:40:25.656529 IP 192.168.43.146.8880 > 192.168.43.147.7772: UDP, length 120
01:40:25.699855 IP 192.168.43.146.8880 > 192.168.43.147.7772: UDP, length 120
01:40:25.705629 IP 192.168.43.147.8880 > 192.168.43.124.7773: UDP, length 120
01:40:25.749365 IP 192.168.43.146.8880 > 192.168.43.147.7772: UDP, length 120
01:40:25.755630 IP 192.168.43.147.8880 > 192.168.43.124.7773: UDP, length 120
01:40:25.797844 IP 192.168.43.146.8880 > 192.168.43.147.7772: UDP, length 120
01:40:25.805627 IP 192.168.43.147.8880 > 192.168.43.124.7773: UDP, length 120
01:40:25.848163 IP 192.168.43.146.8880 > 192.168.43.147.7772: UDP, length 120
01:40:25.855627 IP 192.168.43.147.8880 > 192.168.43.124.7773: UDP, length 120
01:40:25.904098 IP 192.168.43.146.8880 > 192.168.43.147.7772: UDP, length 120
01:40:25.905629 IP 192.168.43.147.8880 > 192.168.43.124.7773: UDP, length 120
01:40:25.953463 IP 192.168.43.146.8880 > 192.168.43.147.7772: UDP, length 120
01:40:25.955630 IP 192.168.43.147.8880 > 192.168.43.124.7773: UDP, length 120
01:40:26.005628 IP 192.168.43.147.8880 > 192.168.43.124.7773: UDP, length 120
01:40:26.007137 IP 192.168.43.146.8880 > 192.168.43.147.7772: UDP, length 120
01:40:26.049129 IP 192.168.43.146.8880 > 192.168.43.147.7772: UDP, length 120
01:40:26.055629 IP 192.168.43.147.8880 > 192.168.43.124.7773: UDP, length 120
01:40:26.103210 IP 192.168.43.146.8880 > 192.168.43.147.7772: UDP, length 120
01:40:26.105628 IP 192.168.43.147.8880 > 192.168.43.124.7773: UDP, length 120
01:40:26.149104 IP 192.168.43.146.8880 > 192.168.43.147.7772: UDP, length 120
01:40:26.155629 IP 192.168.43.147.8880 > 192.168.43.124.7773: UDP, length 120
01:40:26.205627 IP 192.168.43.147.8880 > 192.168.43.124.7773: UDP, length 120
01:40:26.255626 IP 192.168.43.147.8880 > 192.168.43.124.7773: UDP, length 120
01:40:26.257644 IP 192.168.43.146.8880 > 192.168.43.147.7772: UDP, length 120
01:40:26.305626 IP 192.168.43.147.8880 > 192.168.43.124.7773: UDP, length 120
01:40:26.349203 IP 192.168.43.146.8880 > 192.168.43.147.7772: UDP, length 120
01:40:26.355668 IP 192.168.43.147.8880 > 192.168.43.124.7773: UDP, length 120
01:40:26.400977 IP 192.168.43.146.8880 > 192.168.43.147.7772: UDP, length 120
01:40:26.405640 IP 192.168.43.147.8880 > 192.168.43.124.7773: UDP, length 120
01:40:26.453863 IP 192.168.43.146.8880 > 192.168.43.147.7772: UDP, length 120
01:40:26.455629 IP 192.168.43.147.8880 > 192.168.43.124.7773: UDP, length 120
01:40:26.499982 IP 192.168.43.146.8880 > 192.168.43.147.7772: UDP, length 120
01:40:26.505628 IP 192.168.43.147.8880 > 192.168.43.124.7773: UDP, length 120
01:40:26.551413 IP 192.168.43.146.8880 > 192.168.43.147.7772: UDP, length 120
01:40:26.555629 IP 192.168.43.147.8880 > 192.168.43.124.7773: UDP, length 120
01:40:26.599272 IP 192.168.43.146.8880 > 192.168.43.147.7772: UDP, length 120
01:40:26.605631 IP 192.168.43.147.8880 > 192.168.43.124.7773: UDP, length 120
01:40:26.649897 IP 192.168.43.146.8880 > 192.168.43.147.7772: UDP, length 120
01:40:26.655643 IP 192.168.43.147.8880 > 192.168.43.124.7773: UDP, length 120
01:40:26.700530 IP 192.168.43.146.8880 > 192.168.43.147.7772: UDP, length 120
01:40:26.705628 IP 192.168.43.147.8880 > 192.168.43.124.7773: UDP, length 120
01:40:26.755629 IP 192.168.43.147.8880 > 192.168.43.124.7773: UDP, length 120
01:40:26.756218 IP 192.168.43.146.8880 > 192.168.43.147.7772: UDP, length 120
01:40:26.802812 IP 192.168.43.146.8880 > 192.168.43.147.7772: UDP, length 120
01:40:26.805629 IP 192.168.43.147.8880 > 192.168.43.124.7773: UDP, length 120
01:40:26.849576 IP 192.168.43.146.8880 > 192.168.43.147.7772: UDP, length 120
01:40:26.855629 IP 192.168.43.147.8880 > 192.168.43.124.7773: UDP, length 120
01:40:26.905656 IP 192.168.43.147.8880 > 192.168.43.124.7773: UDP, length 120
01:40:26.906084 IP 192.168.43.146.8880 > 192.168.43.147.7772: UDP, length 120
01:40:26.954066 IP 192.168.43.146.8880 > 192.168.43.147.7772: UDP, length 120
01:40:26.955659 IP 192.168.43.147.8880 > 192.168.43.124.7773: UDP, length 120
01:40:27.002953 IP 192.168.43.146.8880 > 192.168.43.147.7772: UDP, length 120
01:40:27.005655 IP 192.168.43.147.8880 > 192.168.43.124.7773: UDP, length 120
01:40:27.050072 IP 192.168.43.146.8880 > 192.168.43.147.7772: UDP, length 120
01:40:27.055657 IP 192.168.43.147.8880 > 192.168.43.124.7773: UDP, length 120
01:40:27.099241 IP 192.168.43.146.8880 > 192.168.43.147.7772: UDP, length 120
01:40:27.105654 IP 192.168.43.147.8880 > 192.168.43.124.7773: UDP, length 120
01:40:27.149855 IP 192.168.43.146.8880 > 192.168.43.147.7772: UDP, length 120
01:40:27.155656 IP 192.168.43.147.8880 > 192.168.43.124.7773: UDP, length 120
01:40:27.199675 IP 192.168.43.146.8880 > 192.168.43.147.7772: UDP, length 120
01:40:27.205656 IP 192.168.43.147.8880 > 192.168.43.124.7773: UDP, length 120
01:40:27.249090 IP 192.168.43.146.8880 > 192.168.43.147.7772: UDP, length 120
01:40:27.255656 IP 192.168.43.147.8880 > 192.168.43.124.7773: UDP, length 120
01:40:27.300585 IP 192.168.43.146.8880 > 192.168.43.147.7772: UDP, length 120
01:40:27.305654 IP 192.168.43.147.8880 > 192.168.43.124.7773: UDP, length 120
01:40:27.349472 IP 192.168.43.146.8880 > 192.168.43.147.7772: UDP, length 120
01:40:27.355655 IP 192.168.43.147.8880 > 192.168.43.124.7773: UDP, length 120
01:40:27.400691 IP 192.168.43.146.8880 > 192.168.43.147.7772: UDP, length 120
01:40:27.405655 IP 192.168.43.147.8880 > 192.168.43.124.7773: UDP, length 120
01:40:27.451632 IP 192.168.43.146.8880 > 192.168.43.147.7772: UDP, length 120
01:40:27.455657 IP 192.168.43.147.8880 > 192.168.43.124.7773: UDP, length 120
01:40:27.498934 IP 192.168.43.146.8880 > 192.168.43.147.7772: UDP, length 120
01:40:27.505655 IP 192.168.43.147.8880 > 192.168.43.124.7773: UDP, length 120
01:40:27.555655 IP 192.168.43.147.8880 > 192.168.43.124.7773: UDP, length 120
01:40:27.559099 IP 192.168.43.146.8880 > 192.168.43.147.7772: UDP, length 120
01:40:27.600279 IP 192.168.43.146.8880 > 192.168.43.147.7772: UDP, length 120
01:40:27.605657 IP 192.168.43.147.8880 > 192.168.43.124.7773: UDP, length 120
01:40:27.653013 IP 192.168.43.146.8880 > 192.168.43.147.7772: UDP, length 120
01:40:27.655723 IP 192.168.43.147.8880 > 192.168.43.124.7773: UDP, length 120
01:40:27.696667 IP 192.168.43.146.8880 > 192.168.43.147.7772: UDP, length 120
01:40:27.705745 IP 192.168.43.147.8880 > 192.168.43.124.7773: UDP, length 120
01:40:27.749584 IP 192.168.43.146.8880 > 192.168.43.147.7772: UDP, length 120
01:40:27.755793 IP 192.168.43.147.8880 > 192.168.43.124.7773: UDP, length 120
01:40:27.801818 IP 192.168.43.146.8880 > 192.168.43.147.7772: UDP, length 120
01:40:27.805690 IP 192.168.43.147.8880 > 192.168.43.124.7773: UDP, length 120
01:40:27.848753 IP 192.168.43.146.8880 > 192.168.43.147.7772: UDP, length 120
01:40:27.855698 IP 192.168.43.147.8880 > 192.168.43.124.7773: UDP, length 120
01:40:27.903547 IP 192.168.43.146.8880 > 192.168.43.147.7772: UDP, length 120
01:40:27.905717 IP 192.168.43.147.8880 > 192.168.43.124.7773: UDP, length 120
01:40:27.948688 IP 192.168.43.146.8880 > 192.168.43.147.7772: UDP, length 120
01:40:27.955713 IP 192.168.43.147.8880 > 192.168.43.124.7773: UDP, length 120
01:40:27.998828 IP 192.168.43.146.8880 > 192.168.43.147.7772: UDP, length 120
01:40:28.005702 IP 192.168.43.147.8880 > 192.168.43.124.7773: UDP, length 120
01:40:28.051296 IP 192.168.43.146.8880 > 192.168.43.147.7772: UDP, length 120
01:40:28.055702 IP 192.168.43.147.8880 > 192.168.43.124.7773: UDP, length 120
01:40:28.096258 IP 192.168.43.146.8880 > 192.168.43.147.7772: UDP, length 120
01:40:28.105698 IP 192.168.43.147.8880 > 192.168.43.124.7773: UDP, length 120
01:40:28.151215 IP 192.168.43.146.8880 > 192.168.43.147.7772: UDP, length 120
01:40:28.155669 IP 192.168.43.147.8880 > 192.168.43.124.7773: UDP, length 120
01:40:28.200180 IP 192.168.43.146.8880 > 192.168.43.147.7772: UDP, length 120
01:40:28.205631 IP 192.168.43.147.8880 > 192.168.43.124.7773: UDP, length 120
01:40:28.253618 IP 192.168.43.146.8880 > 192.168.43.147.7772: UDP, length 120
01:40:28.255633 IP 192.168.43.147.8880 > 192.168.43.124.7773: UDP, length 120
01:40:28.298602 IP 192.168.43.146.8880 > 192.168.43.147.7772: UDP, length 120
01:40:28.305629 IP 192.168.43.147.8880 > 192.168.43.124.7773: UDP, length 120
01:40:28.355629 IP 192.168.43.147.8880 > 192.168.43.124.7773: UDP, length 120
01:40:28.356206 IP 192.168.43.146.8880 > 192.168.43.147.7772: UDP, length 120
01:40:28.401133 IP 192.168.43.146.8880 > 192.168.43.147.7772: UDP, length 120
01:40:28.405629 IP 192.168.43.147.8880 > 192.168.43.124.7773: UDP, length 120
01:40:28.446149 IP 192.168.43.146.8880 > 192.168.43.147.7772: UDP, length 120
01:40:28.455629 IP 192.168.43.147.8880 > 192.168.43.124.7773: UDP, length 120
01:40:28.499493 IP 192.168.43.146.8880 > 192.168.43.147.7772: UDP, length 120
01:40:28.505628 IP 192.168.43.147.8880 > 192.168.43.124.7773: UDP, length 120
01:40:28.555627 IP 192.168.43.147.8880 > 192.168.43.124.7773: UDP, length 120
01:40:28.558589 IP 192.168.43.146.8880 > 192.168.43.147.7772: UDP, length 120
01:40:28.601829 IP 192.168.43.146.8880 > 192.168.43.147.7772: UDP, length 120
01:40:28.605632 IP 192.168.43.147.8880 > 192.168.43.124.7773: UDP, length 120
01:40:28.648813 IP 192.168.43.146.8880 > 192.168.43.147.7772: UDP, length 120
01:40:28.655643 IP 192.168.43.147.8880 > 192.168.43.124.7773: UDP, length 120
01:40:28.701162 IP 192.168.43.146.8880 > 192.168.43.147.7772: UDP, length 120
01:40:28.705643 IP 192.168.43.147.8880 > 192.168.43.124.7773: UDP, length 120
01:40:28.748924 IP 192.168.43.146.8880 > 192.168.43.147.7772: UDP, length 120
01:40:28.755631 IP 192.168.43.147.8880 > 192.168.43.124.7773: UDP, length 120
01:40:28.799982 IP 192.168.43.146.8880 > 192.168.43.147.7772: UDP, length 120
01:40:28.805630 IP 192.168.43.147.8880 > 192.168.43.124.7773: UDP, length 120
01:40:28.851538 IP 192.168.43.146.8880 > 192.168.43.147.7772: UDP, length 120
01:40:28.855630 IP 192.168.43.147.8880 > 192.168.43.124.7773: UDP, length 120
01:40:28.902507 IP 192.168.43.146.8880 > 192.168.43.147.7772: UDP, length 120
01:40:28.905635 IP 192.168.43.147.8880 > 192.168.43.124.7773: UDP, length 120
01:40:28.952605 IP 192.168.43.146.8880 > 192.168.43.147.7772: UDP, length 120
01:40:28.955629 IP 192.168.43.147.8880 > 192.168.43.124.7773: UDP, length 120
01:40:28.999296 IP 192.168.43.146.8880 > 192.168.43.147.7772: UDP, length 120
01:40:29.005628 IP 192.168.43.147.8880 > 192.168.43.124.7773: UDP, length 120
01:40:29.050317 IP 192.168.43.146.8880 > 192.168.43.147.7772: UDP, length 120
01:40:29.055629 IP 192.168.43.147.8880 > 192.168.43.124.7773: UDP, length 120
01:40:29.099416 IP 192.168.43.146.8880 > 192.168.43.147.7772: UDP, length 120
01:40:29.105628 IP 192.168.43.147.8880 > 192.168.43.124.7773: UDP, length 120
01:40:29.150204 IP 192.168.43.146.8880 > 192.168.43.147.7772: UDP, length 120
01:40:29.155630 IP 192.168.43.147.8880 > 192.168.43.124.7773: UDP, length 120
01:40:29.199034 IP 192.168.43.146.8880 > 192.168.43.147.7772: UDP, length 120
01:40:29.205628 IP 192.168.43.147.8880 > 192.168.43.124.7773: UDP, length 120
01:40:29.249084 IP 192.168.43.146.8880 > 192.168.43.147.7772: UDP, length 120
01:40:29.255628 IP 192.168.43.147.8880 > 192.168.43.124.7773: UDP, length 120
01:40:29.300762 IP 192.168.43.146.8880 > 192.168.43.147.7772: UDP, length 120
01:40:29.305629 IP 192.168.43.147.8880 > 192.168.43.124.7773: UDP, length 120
01:40:29.348847 IP 192.168.43.146.8880 > 192.168.43.147.7772: UDP, length 120
01:40:29.355628 IP 192.168.43.147.8880 > 192.168.43.124.7773: UDP, length 120
01:40:29.399337 IP 192.168.43.146.8880 > 192.168.43.147.7772: UDP, length 120
01:40:29.405654 IP 192.168.43.147.8880 > 192.168.43.124.7773: UDP, length 120
01:40:29.452026 IP 192.168.43.146.8880 > 192.168.43.147.7772: UDP, length 120
01:40:29.455628 IP 192.168.43.147.8880 > 192.168.43.124.7773: UDP, length 120
01:40:29.502875 IP 192.168.43.146.8880 > 192.168.43.147.7772: UDP, length 120
01:40:29.505628 IP 192.168.43.147.8880 > 192.168.43.124.7773: UDP, length 120
01:40:29.548995 IP 192.168.43.146.8880 > 192.168.43.147.7772: UDP, length 120
01:40:29.555629 IP 192.168.43.147.8880 > 192.168.43.124.7773: UDP, length 120
01:40:29.605628 IP 192.168.43.147.8880 > 192.168.43.124.7773: UDP, length 120
01:40:29.608463 IP 192.168.43.146.8880 > 192.168.43.147.7772: UDP, length 120
01:40:29.648014 IP 192.168.43.146.8880 > 192.168.43.147.7772: UDP, length 120
01:40:29.655645 IP 192.168.43.147.8880 > 192.168.43.124.7773: UDP, length 120
01:40:29.698867 IP 192.168.43.146.8880 > 192.168.43.147.7772: UDP, length 120
01:40:29.705635 IP 192.168.43.147.8880 > 192.168.43.124.7773: UDP, length 120
01:40:29.751874 IP 192.168.43.146.8880 > 192.168.43.147.7772: UDP, length 120
01:40:29.755635 IP 192.168.43.147.8880 > 192.168.43.124.7773: UDP, length 120
01:40:29.802752 IP 192.168.43.146.8880 > 192.168.43.147.7772: UDP, length 120
01:40:29.805633 IP 192.168.43.147.8880 > 192.168.43.124.7773: UDP, length 120
01:40:29.849279 IP 192.168.43.146.8880 > 192.168.43.147.7772: UDP, length 120
01:40:29.855632 IP 192.168.43.147.8880 > 192.168.43.124.7773: UDP, length 120
01:40:29.901105 IP 192.168.43.146.8880 > 192.168.43.147.7772: UDP, length 120
01:40:29.905629 IP 192.168.43.147.8880 > 192.168.43.124.7773: UDP, length 120
01:40:29.951962 IP 192.168.43.146.8880 > 192.168.43.147.7772: UDP, length 120
01:40:29.955630 IP 192.168.43.147.8880 > 192.168.43.124.7773: UDP, length 120
01:40:30.000506 IP 192.168.43.146.8880 > 192.168.43.147.7772: UDP, length 120
01:40:30.005631 IP 192.168.43.147.8880 > 192.168.43.124.7773: UDP, length 120
01:40:30.054928 IP 192.168.43.146.8880 > 192.168.43.147.7772: UDP, length 120
01:40:30.055630 IP 192.168.43.147.8880 > 192.168.43.124.7773: UDP, length 120
01:40:30.099065 IP 192.168.43.146.8880 > 192.168.43.147.7772: UDP, length 120
01:40:30.105628 IP 192.168.43.147.8880 > 192.168.43.124.7773: UDP, length 120
01:40:30.151848 IP 192.168.43.146.8880 > 192.168.43.147.7772: UDP, length 120
01:40:30.155630 IP 192.168.43.147.8880 > 192.168.43.124.7773: UDP, length 120
01:40:30.204906 IP 192.168.43.146.8880 > 192.168.43.147.7772: UDP, length 120
01:40:30.205629 IP 192.168.43.147.8880 > 192.168.43.124.7773: UDP, length 120
01:40:30.249126 IP 192.168.43.146.8880 > 192.168.43.147.7772: UDP, length 120
01:40:30.255630 IP 192.168.43.147.8880 > 192.168.43.124.7773: UDP, length 120
01:40:30.304048 IP 192.168.43.146.8880 > 192.168.43.147.7772: UDP, length 120
01:40:30.305630 IP 192.168.43.147.8880 > 192.168.43.124.7773: UDP, length 120
01:40:30.354382 IP 192.168.43.146.8880 > 192.168.43.147.7772: UDP, length 120
01:40:30.355631 IP 192.168.43.147.8880 > 192.168.43.124.7773: UDP, length 120
01:40:30.404057 IP 192.168.43.146.8880 > 192.168.43.147.7772: UDP, length 120
01:40:30.405629 IP 192.168.43.147.8880 > 192.168.43.124.7773: UDP, length 120
01:40:30.449423 IP 192.168.43.146.8880 > 192.168.43.147.7772: UDP, length 120
01:40:30.455630 IP 192.168.43.147.8880 > 192.168.43.124.7773: UDP, length 120
01:40:30.500716 IP 192.168.43.146.8880 > 192.168.43.147.7772: UDP, length 120
01:40:30.505629 IP 192.168.43.147.8880 > 192.168.43.124.7773: UDP, length 120
01:40:30.549011 IP 192.168.43.146.8880 > 192.168.43.147.7772: UDP, length 120
01:40:30.555630 IP 192.168.43.147.8880 > 192.168.43.124.7773: UDP, length 120
01:40:30.599264 IP 192.168.43.146.8880 > 192.168.43.147.7772: UDP, length 120
01:40:30.605629 IP 192.168.43.147.8880 > 192.168.43.124.7773: UDP, length 120
01:40:30.650940 IP 192.168.43.146.8880 > 192.168.43.147.7772: UDP, length 120
01:40:30.655636 IP 192.168.43.147.8880 > 192.168.43.124.7773: UDP, length 120
01:40:30.699105 IP 192.168.43.146.8880 > 192.168.43.147.7772: UDP, length 120
01:40:30.705631 IP 192.168.43.147.8880 > 192.168.43.124.7773: UDP, length 120
01:40:30.749843 IP 192.168.43.146.8880 > 192.168.43.147.7772: UDP, length 120
01:40:30.755632 IP 192.168.43.147.8880 > 192.168.43.124.7773: UDP, length 120
01:40:30.799602 IP 192.168.43.146.8880 > 192.168.43.147.7772: UDP, length 120
01:40:30.805635 IP 192.168.43.147.8880 > 192.168.43.124.7773: UDP, length 120
01:40:30.848663 IP 192.168.43.146.8880 > 192.168.43.147.7772: UDP, length 120
01:40:30.855637 IP 192.168.43.147.8880 > 192.168.43.124.7773: UDP, length 120
01:40:30.899389 IP 192.168.43.146.8880 > 192.168.43.147.7772: UDP, length 120
01:40:30.905658 IP 192.168.43.147.8880 > 192.168.43.124.7773: UDP, length 120
01:40:30.950819 IP 192.168.43.146.8880 > 192.168.43.147.7772: UDP, length 120
01:40:30.955634 IP 192.168.43.147.8880 > 192.168.43.124.7773: UDP, length 120
01:40:31.001558 IP 192.168.43.146.8880 > 192.168.43.147.7772: UDP, length 120
01:40:31.005629 IP 192.168.43.147.8880 > 192.168.43.124.7773: UDP, length 120
01:40:31.053536 IP 192.168.43.146.8880 > 192.168.43.147.7772: UDP, length 120
01:40:31.055629 IP 192.168.43.147.8880 > 192.168.43.124.7773: UDP, length 120
01:40:31.105629 IP 192.168.43.147.8880 > 192.168.43.124.7773: UDP, length 120
01:40:31.126015 IP 192.168.43.146.8880 > 192.168.43.147.7772: UDP, length 120
01:40:31.154856 IP 192.168.43.146.8880 > 192.168.43.147.7772: UDP, length 120
01:40:31.155629 IP 192.168.43.147.8880 > 192.168.43.124.7773: UDP, length 120
01:40:31.200859 IP 192.168.43.146.8880 > 192.168.43.147.7772: UDP, length 120
01:40:31.205629 IP 192.168.43.147.8880 > 192.168.43.124.7773: UDP, length 120
01:40:31.252061 IP 192.168.43.146.8880 > 192.168.43.147.7772: UDP, length 120
01:40:31.255630 IP 192.168.43.147.8880 > 192.168.43.124.7773: UDP, length 120
01:40:31.300401 IP 192.168.43.146.8880 > 192.168.43.147.7772: UDP, length 120
01:40:31.305630 IP 192.168.43.147.8880 > 192.168.43.124.7773: UDP, length 120
01:40:31.350183 IP 192.168.43.146.8880 > 192.168.43.147.7772: UDP, length 120
01:40:31.355628 IP 192.168.43.147.8880 > 192.168.43.124.7773: UDP, length 120
01:40:31.399428 IP 192.168.43.146.8880 > 192.168.43.147.7772: UDP, length 120
01:40:31.405627 IP 192.168.43.147.8880 > 192.168.43.124.7773: UDP, length 120
01:40:31.452473 IP 192.168.43.146.8880 > 192.168.43.147.7772: UDP, length 120
01:40:31.455628 IP 192.168.43.147.8880 > 192.168.43.124.7773: UDP, length 120
01:40:31.499594 IP 192.168.43.146.8880 > 192.168.43.147.7772: UDP, length 120
01:40:31.505627 IP 192.168.43.147.8880 > 192.168.43.124.7773: UDP, length 120
01:40:31.549840 IP 192.168.43.146.8880 > 192.168.43.147.7772: UDP, length 120
01:40:31.555627 IP 192.168.43.147.8880 > 192.168.43.124.7773: UDP, length 120
01:40:31.598950 IP 192.168.43.146.8880 > 192.168.43.147.7772: UDP, length 120
01:40:31.605628 IP 192.168.43.147.8880 > 192.168.43.124.7773: UDP, length 120
01:40:31.650853 IP 192.168.43.146.8880 > 192.168.43.147.7772: UDP, length 120
01:40:31.655635 IP 192.168.43.147.8880 > 192.168.43.124.7773: UDP, length 120
01:40:31.698750 IP 192.168.43.146.8880 > 192.168.43.147.7772: UDP, length 120
01:40:31.705629 IP 192.168.43.147.8880 > 192.168.43.124.7773: UDP, length 120
01:40:31.748761 IP 192.168.43.146.8880 > 192.168.43.147.7772: UDP, length 120
01:40:31.755631 IP 192.168.43.147.8880 > 192.168.43.124.7773: UDP, length 120
01:40:31.798905 IP 192.168.43.146.8880 > 192.168.43.147.7772: UDP, length 120
01:40:31.805629 IP 192.168.43.147.8880 > 192.168.43.124.7773: UDP, length 120
