02:36:16.359047 IP 192.168.43.146.8880 > 192.168.43.147.7772: UDP, length 120
02:36:16.412162 IP 192.168.43.146.8880 > 192.168.43.147.7772: UDP, length 120
02:36:16.467173 IP 192.168.43.146.8880 > 192.168.43.147.7772: UDP, length 120
02:36:16.468831 IP 192.168.43.147.8880 > 192.168.43.124.7773: UDP, length 120
02:36:16.518864 IP 192.168.43.147.8880 > 192.168.43.124.7773: UDP, length 120
02:36:16.519624 IP 192.168.43.146.8880 > 192.168.43.147.7772: UDP, length 120
02:36:16.549978 IP 192.168.43.146.8880 > 192.168.43.147.7772: UDP, length 120
02:36:16.568873 IP 192.168.43.147.8880 > 192.168.43.124.7773: UDP, length 120
02:36:16.600234 IP 192.168.43.146.8880 > 192.168.43.147.7772: UDP, length 120
02:36:16.618855 IP 192.168.43.147.8880 > 192.168.43.124.7773: UDP, length 120
02:36:16.649892 IP 192.168.43.146.8880 > 192.168.43.147.7772: UDP, length 120
02:36:16.668851 IP 192.168.43.147.8880 > 192.168.43.124.7773: UDP, length 120
02:36:16.700326 IP 192.168.43.146.8880 > 192.168.43.147.7772: UDP, length 120
02:36:16.718851 IP 192.168.43.147.8880 > 192.168.43.124.7773: UDP, length 120
02:36:16.757997 IP 192.168.43.146.8880 > 192.168.43.147.7772: UDP, length 120
02:36:16.768859 IP 192.168.43.147.8880 > 192.168.43.124.7773: UDP, length 120
02:36:16.811689 IP 192.168.43.146.8880 > 192.168.43.147.7772: UDP, length 120
02:36:16.818858 IP 192.168.43.147.8880 > 192.168.43.124.7773: UDP, length 120
02:36:16.865900 IP 192.168.43.146.8880 > 192.168.43.147.7772: UDP, length 120
02:36:16.868863 IP 192.168.43.147.8880 > 192.168.43.124.7773: UDP, length 120
02:36:16.901796 IP 192.168.43.146.8880 > 192.168.43.147.7772: UDP, length 120
02:36:16.918883 IP 192.168.43.147.8880 > 192.168.43.124.7773: UDP, length 120
02:36:16.951159 IP 192.168.43.146.8880 > 192.168.43.147.7772: UDP, length 120
02:36:16.968880 IP 192.168.43.147.8880 > 192.168.43.124.7773: UDP, length 120
02:36:16.999815 IP 192.168.43.146.8880 > 192.168.43.147.7772: UDP, length 120
02:36:17.018880 IP 192.168.43.147.8880 > 192.168.43.124.7773: UDP, length 120
02:36:17.062032 IP 192.168.43.146.8880 > 192.168.43.147.7772: UDP, length 120
02:36:17.068877 IP 192.168.43.147.8880 > 192.168.43.124.7773: UDP, length 120
02:36:17.118526 IP 192.168.43.146.8880 > 192.168.43.147.7772: UDP, length 120
02:36:17.118880 IP 192.168.43.147.8880 > 192.168.43.124.7773: UDP, length 120
02:36:17.149758 IP 192.168.43.146.8880 > 192.168.43.147.7772: UDP, length 120
02:36:17.168929 IP 192.168.43.147.8880 > 192.168.43.124.7773: UDP, length 120
02:36:17.201301 IP 192.168.43.146.8880 > 192.168.43.147.7772: UDP, length 120
02:36:17.218897 IP 192.168.43.147.8880 > 192.168.43.124.7773: UDP, length 120
02:36:17.250801 IP 192.168.43.146.8880 > 192.168.43.147.7772: UDP, length 120
02:36:17.268879 IP 192.168.43.147.8880 > 192.168.43.124.7773: UDP, length 120
02:36:17.308720 IP 192.168.43.146.8880 > 192.168.43.147.7772: UDP, length 120
02:36:17.318878 IP 192.168.43.147.8880 > 192.168.43.124.7773: UDP, length 120
02:36:17.362478 IP 192.168.43.146.8880 > 192.168.43.147.7772: UDP, length 120
02:36:17.368880 IP 192.168.43.147.8880 > 192.168.43.124.7773: UDP, length 120
02:36:17.414741 IP 192.168.43.146.8880 > 192.168.43.147.7772: UDP, length 120
02:36:17.418877 IP 192.168.43.147.8880 > 192.168.43.124.7773: UDP, length 120
02:36:17.450522 IP 192.168.43.146.8880 > 192.168.43.147.7772: UDP, length 120
02:36:17.468879 IP 192.168.43.147.8880 > 192.168.43.124.7773: UDP, length 120
02:36:17.518875 IP 192.168.43.147.8880 > 192.168.43.124.7773: UDP, length 120
02:36:17.521855 IP 192.168.43.146.8880 > 192.168.43.147.7772: UDP, length 120
02:36:17.550127 IP 192.168.43.146.8880 > 192.168.43.147.7772: UDP, length 120
02:36:17.568892 IP 192.168.43.147.8880 > 192.168.43.124.7773: UDP, length 120
02:36:17.600451 IP 192.168.43.146.8880 > 192.168.43.147.7772: UDP, length 120
02:36:17.618886 IP 192.168.43.147.8880 > 192.168.43.124.7773: UDP, length 120
02:36:17.666054 IP 192.168.43.146.8880 > 192.168.43.147.7772: UDP, length 120
02:36:17.668879 IP 192.168.43.147.8880 > 192.168.43.124.7773: UDP, length 120
02:36:17.718876 IP 192.168.43.147.8880 > 192.168.43.124.7773: UDP, length 120
02:36:17.741446 IP 192.168.43.146.8880 > 192.168.43.147.7772: UDP, length 120
02:36:17.755106 IP 192.168.43.146.8880 > 192.168.43.147.7772: UDP, length 120
02:36:17.768892 IP 192.168.43.147.8880 > 192.168.43.124.7773: UDP, length 120
02:36:17.818889 IP 192.168.43.147.8880 > 192.168.43.124.7773: UDP, length 120
02:36:17.841927 IP 192.168.43.146.8880 > 192.168.43.147.7772: UDP, length 120
02:36:17.856390 IP 192.168.43.146.8880 > 192.168.43.147.7772: UDP, length 120
02:36:17.868887 IP 192.168.43.147.8880 > 192.168.43.124.7773: UDP, length 120
02:36:17.918021 IP 192.168.43.146.8880 > 192.168.43.147.7772: UDP, length 120
02:36:17.918882 IP 192.168.43.147.8880 > 192.168.43.124.7773: UDP, length 120
02:36:17.968877 IP 192.168.43.147.8880 > 192.168.43.124.7773: UDP, length 120
02:36:17.972300 IP 192.168.43.146.8880 > 192.168.43.147.7772: UDP, length 120
02:36:18.018878 IP 192.168.43.147.8880 > 192.168.43.124.7773: UDP, length 120
02:36:18.023384 IP 192.168.43.146.8880 > 192.168.43.147.7772: UDP, length 120
02:36:18.052071 IP 192.168.43.146.8880 > 192.168.43.147.7772: UDP, length 120
02:36:18.068879 IP 192.168.43.147.8880 > 192.168.43.124.7773: UDP, length 120
02:36:18.104334 IP 192.168.43.146.8880 > 192.168.43.147.7772: UDP, length 120
02:36:18.118879 IP 192.168.43.147.8880 > 192.168.43.124.7773: UDP, length 120
02:36:18.168881 IP 192.168.43.147.8880 > 192.168.43.124.7773: UDP, length 120
02:36:18.172284 IP 192.168.43.146.8880 > 192.168.43.147.7772: UDP, length 120
02:36:18.215937 IP 192.168.43.146.8880 > 192.168.43.147.7772: UDP, length 120
02:36:18.218874 IP 192.168.43.147.8880 > 192.168.43.124.7773: UDP, length 120
02:36:18.262210 IP 192.168.43.146.8880 > 192.168.43.147.7772: UDP, length 120
02:36:18.268875 IP 192.168.43.147.8880 > 192.168.43.124.7773: UDP, length 120
02:36:18.318877 IP 192.168.43.147.8880 > 192.168.43.124.7773: UDP, length 120
02:36:18.368875 IP 192.168.43.147.8880 > 192.168.43.124.7773: UDP, length 120
02:36:18.372293 IP 192.168.43.146.8880 > 192.168.43.147.7772: UDP, length 120
02:36:18.372499 IP 192.168.43.146.8880 > 192.168.43.147.7772: UDP, length 120
02:36:18.418878 IP 192.168.43.147.8880 > 192.168.43.124.7773: UDP, length 120
02:36:18.430784 IP 192.168.43.146.8880 > 192.168.43.147.7772: UDP, length 120
02:36:18.468883 IP 192.168.43.147.8880 > 192.168.43.124.7773: UDP, length 120
02:36:18.475605 IP 192.168.43.146.8880 > 192.168.43.147.7772: UDP, length 120
02:36:18.518878 IP 192.168.43.147.8880 > 192.168.43.124.7773: UDP, length 120
02:36:18.529514 IP 192.168.43.146.8880 > 192.168.43.147.7772: UDP, length 120
02:36:18.560262 IP 192.168.43.146.8880 > 192.168.43.147.7772: UDP, length 120
02:36:18.568888 IP 192.168.43.147.8880 > 192.168.43.124.7773: UDP, length 120
02:36:18.618880 IP 192.168.43.147.8880 > 192.168.43.124.7773: UDP, length 120
02:36:18.668886 IP 192.168.43.147.8880 > 192.168.43.124.7773: UDP, length 120
02:36:18.669074 IP 192.168.43.146.8880 > 192.168.43.147.7772: UDP, length 120
02:36:18.675989 IP 192.168.43.146.8880 > 192.168.43.147.7772: UDP, length 120
02:36:18.718917 IP 192.168.43.147.8880 > 192.168.43.124.7773: UDP, length 120
02:36:18.736338 IP 192.168.43.146.8880 > 192.168.43.147.7772: UDP, length 120
02:36:18.768890 IP 192.168.43.147.8880 > 192.168.43.124.7773: UDP, length 120
02:36:18.778420 IP 192.168.43.146.8880 > 192.168.43.147.7772: UDP, length 120
02:36:18.809915 IP 192.168.43.146.8880 > 192.168.43.147.7772: UDP, length 120
02:36:18.818878 IP 192.168.43.147.8880 > 192.168.43.124.7773: UDP, length 120
02:36:18.850974 IP 192.168.43.146.8880 > 192.168.43.147.7772: UDP, length 120
02:36:18.868888 IP 192.168.43.147.8880 > 192.168.43.124.7773: UDP, length 120
02:36:18.901577 IP 192.168.43.146.8880 > 192.168.43.147.7772: UDP, length 120
02:36:18.918889 IP 192.168.43.147.8880 > 192.168.43.124.7773: UDP, length 120
02:36:18.968876 IP 192.168.43.147.8880 > 192.168.43.124.7773: UDP, length 120
02:36:18.976477 IP 192.168.43.146.8880 > 192.168.43.147.7772: UDP, length 120
02:36:19.004537 IP 192.168.43.146.8880 > 192.168.43.147.7772: UDP, length 120
02:36:19.018881 IP 192.168.43.147.8880 > 192.168.43.124.7773: UDP, length 120
02:36:19.051503 IP 192.168.43.146.8880 > 192.168.43.147.7772: UDP, length 120
02:36:19.068878 IP 192.168.43.147.8880 > 192.168.43.124.7773: UDP, length 120
02:36:19.117412 IP 192.168.43.146.8880 > 192.168.43.147.7772: UDP, length 120
02:36:19.118879 IP 192.168.43.147.8880 > 192.168.43.124.7773: UDP, length 120
02:36:19.154038 IP 192.168.43.146.8880 > 192.168.43.147.7772: UDP, length 120
02:36:19.168877 IP 192.168.43.147.8880 > 192.168.43.124.7773: UDP, length 120
02:36:19.210120 IP 192.168.43.146.8880 > 192.168.43.147.7772: UDP, length 120
02:36:19.218874 IP 192.168.43.147.8880 > 192.168.43.124.7773: UDP, length 120
02:36:19.266362 IP 192.168.43.146.8880 > 192.168.43.147.7772: UDP, length 120
02:36:19.268875 IP 192.168.43.147.8880 > 192.168.43.124.7773: UDP, length 120
02:36:19.300010 IP 192.168.43.146.8880 > 192.168.43.147.7772: UDP, length 120
02:36:19.318877 IP 192.168.43.147.8880 > 192.168.43.124.7773: UDP, length 120
02:36:19.357699 IP 192.168.43.146.8880 > 192.168.43.147.7772: UDP, length 120
02:36:19.368873 IP 192.168.43.147.8880 > 192.168.43.124.7773: UDP, length 120
02:36:19.418882 IP 192.168.43.147.8880 > 192.168.43.124.7773: UDP, length 120
02:36:19.422347 IP 192.168.43.146.8880 > 192.168.43.147.7772: UDP, length 120
02:36:19.450741 IP 192.168.43.146.8880 > 192.168.43.147.7772: UDP, length 120
02:36:19.468879 IP 192.168.43.147.8880 > 192.168.43.124.7773: UDP, length 120
02:36:19.501829 IP 192.168.43.146.8880 > 192.168.43.147.7772: UDP, length 120
02:36:19.518877 IP 192.168.43.147.8880 > 192.168.43.124.7773: UDP, length 120
02:36:19.562003 IP 192.168.43.146.8880 > 192.168.43.147.7772: UDP, length 120
02:36:19.568883 IP 192.168.43.147.8880 > 192.168.43.124.7773: UDP, length 120
02:36:19.610776 IP 192.168.43.146.8880 > 192.168.43.147.7772: UDP, length 120
02:36:19.618878 IP 192.168.43.147.8880 > 192.168.43.124.7773: UDP, length 120
02:36:19.650659 IP 192.168.43.146.8880 > 192.168.43.147.7772: UDP, length 120
02:36:19.668881 IP 192.168.43.147.8880 > 192.168.43.124.7773: UDP, length 120
02:36:19.710644 IP 192.168.43.146.8880 > 192.168.43.147.7772: UDP, length 120
02:36:19.718874 IP 192.168.43.147.8880 > 192.168.43.124.7773: UDP, length 120
02:36:19.750000 IP 192.168.43.146.8880 > 192.168.43.147.7772: UDP, length 120
02:36:19.768878 IP 192.168.43.147.8880 > 192.168.43.124.7773: UDP, length 120
02:36:19.800425 IP 192.168.43.146.8880 > 192.168.43.147.7772: UDP, length 120
02:36:19.818877 IP 192.168.43.147.8880 > 192.168.43.124.7773: UDP, length 120
02:36:19.860174 IP 192.168.43.146.8880 > 192.168.43.147.7772: UDP, length 120
02:36:19.868973 IP 192.168.43.147.8880 > 192.168.43.124.7773: UDP, length 120
02:36:19.902873 IP 192.168.43.146.8880 > 192.168.43.147.7772: UDP, length 120
02:36:19.918965 IP 192.168.43.147.8880 > 192.168.43.124.7773: UDP, length 120
02:36:19.952569 IP 192.168.43.146.8880 > 192.168.43.147.7772: UDP, length 120
02:36:19.968963 IP 192.168.43.147.8880 > 192.168.43.124.7773: UDP, length 120
02:36:20.011831 IP 192.168.43.146.8880 > 192.168.43.147.7772: UDP, length 120
02:36:20.018933 IP 192.168.43.147.8880 > 192.168.43.124.7773: UDP, length 120
02:36:20.051353 IP 192.168.43.146.8880 > 192.168.43.147.7772: UDP, length 120
02:36:20.068923 IP 192.168.43.147.8880 > 192.168.43.124.7773: UDP, length 120
02:36:20.102292 IP 192.168.43.146.8880 > 192.168.43.147.7772: UDP, length 120
02:36:20.118930 IP 192.168.43.147.8880 > 192.168.43.124.7773: UDP, length 120
02:36:20.158504 IP 192.168.43.146.8880 > 192.168.43.147.7772: UDP, length 120
02:36:20.168936 IP 192.168.43.147.8880 > 192.168.43.124.7773: UDP, length 120
02:36:20.203567 IP 192.168.43.146.8880 > 192.168.43.147.7772: UDP, length 120
02:36:20.218921 IP 192.168.43.147.8880 > 192.168.43.124.7773: UDP, length 120
02:36:20.259109 IP 192.168.43.146.8880 > 192.168.43.147.7772: UDP, length 120
02:36:20.268919 IP 192.168.43.147.8880 > 192.168.43.124.7773: UDP, length 120
02:36:20.305436 IP 192.168.43.146.8880 > 192.168.43.147.7772: UDP, length 120
02:36:20.318926 IP 192.168.43.147.8880 > 192.168.43.124.7773: UDP, length 120
02:36:20.346909 IP 192.168.43.146.8880 > 192.168.43.147.7772: UDP, length 120
02:36:20.368901 IP 192.168.43.147.8880 > 192.168.43.124.7773: UDP, length 120
02:36:20.401603 IP 192.168.43.146.8880 > 192.168.43.147.7772: UDP, length 120
02:36:20.418857 IP 192.168.43.147.8880 > 192.168.43.124.7773: UDP, length 120
02:36:20.464330 IP 192.168.43.146.8880 > 192.168.43.147.7772: UDP, length 120
02:36:20.468853 IP 192.168.43.147.8880 > 192.168.43.124.7773: UDP, length 120
02:36:20.518852 IP 192.168.43.147.8880 > 192.168.43.124.7773: UDP, length 120
02:36:20.529187 IP 192.168.43.146.8880 > 192.168.43.147.7772: UDP, length 120
02:36:20.550451 IP 192.168.43.146.8880 > 192.168.43.147.7772: UDP, length 120
02:36:20.568868 IP 192.168.43.147.8880 > 192.168.43.124.7773: UDP, length 120
02:36:20.611174 IP 192.168.43.146.8880 > 192.168.43.147.7772: UDP, length 120
02:36:20.618857 IP 192.168.43.147.8880 > 192.168.43.124.7773: UDP, length 120
02:36:20.650033 IP 192.168.43.146.8880 > 192.168.43.147.7772: UDP, length 120
02:36:20.668855 IP 192.168.43.147.8880 > 192.168.43.124.7773: UDP, length 120
02:36:20.702378 IP 192.168.43.146.8880 > 192.168.43.147.7772: UDP, length 120
02:36:20.718853 IP 192.168.43.147.8880 > 192.168.43.124.7773: UDP, length 120
02:36:20.759839 IP 192.168.43.146.8880 > 192.168.43.147.7772: UDP, length 120
02:36:20.768853 IP 192.168.43.147.8880 > 192.168.43.124.7773: UDP, length 120
02:36:20.805142 IP 192.168.43.146.8880 > 192.168.43.147.7772: UDP, length 120
02:36:20.818853 IP 192.168.43.147.8880 > 192.168.43.124.7773: UDP, length 120
02:36:20.850842 IP 192.168.43.146.8880 > 192.168.43.147.7772: UDP, length 120
02:36:20.868853 IP 192.168.43.147.8880 > 192.168.43.124.7773: UDP, length 120
02:36:20.905340 IP 192.168.43.146.8880 > 192.168.43.147.7772: UDP, length 120
02:36:20.918852 IP 192.168.43.147.8880 > 192.168.43.124.7773: UDP, length 120
02:36:20.948440 IP 192.168.43.146.8880 > 192.168.43.147.7772: UDP, length 120
02:36:20.968852 IP 192.168.43.147.8880 > 192.168.43.124.7773: UDP, length 120
02:36:20.997471 IP 192.168.43.146.8880 > 192.168.43.147.7772: UDP, length 120
02:36:21.018863 IP 192.168.43.147.8880 > 192.168.43.124.7773: UDP, length 120
02:36:21.055211 IP 192.168.43.146.8880 > 192.168.43.147.7772: UDP, length 120
02:36:21.068857 IP 192.168.43.147.8880 > 192.168.43.124.7773: UDP, length 120
02:36:21.100078 IP 192.168.43.146.8880 > 192.168.43.147.7772: UDP, length 120
02:36:21.118852 IP 192.168.43.147.8880 > 192.168.43.124.7773: UDP, length 120
02:36:21.149869 IP 192.168.43.146.8880 > 192.168.43.147.7772: UDP, length 120
02:36:21.168852 IP 192.168.43.147.8880 > 192.168.43.124.7773: UDP, length 120
02:36:21.206293 IP 192.168.43.146.8880 > 192.168.43.147.7772: UDP, length 120
02:36:21.218853 IP 192.168.43.147.8880 > 192.168.43.124.7773: UDP, length 120
02:36:21.251960 IP 192.168.43.146.8880 > 192.168.43.147.7772: UDP, length 120
02:36:21.268852 IP 192.168.43.147.8880 > 192.168.43.124.7773: UDP, length 120
02:36:21.297556 IP 192.168.43.146.8880 > 192.168.43.147.7772: UDP, length 120
02:36:21.318852 IP 192.168.43.147.8880 > 192.168.43.124.7773: UDP, length 120
02:36:21.361598 IP 192.168.43.146.8880 > 192.168.43.147.7772: UDP, length 120
02:36:21.368852 IP 192.168.43.147.8880 > 192.168.43.124.7773: UDP, length 120
02:36:21.395949 IP 192.168.43.146.8880 > 192.168.43.147.7772: UDP, length 120
02:36:21.418853 IP 192.168.43.147.8880 > 192.168.43.124.7773: UDP, length 120
02:36:21.449195 IP 192.168.43.146.8880 > 192.168.43.147.7772: UDP, length 120
02:36:21.468853 IP 192.168.43.147.8880 > 192.168.43.124.7773: UDP, length 120
02:36:21.515062 IP 192.168.43.146.8880 > 192.168.43.147.7772: UDP, length 120
02:36:21.518851 IP 192.168.43.147.8880 > 192.168.43.124.7773: UDP, length 120
02:36:21.548353 IP 192.168.43.146.8880 > 192.168.43.147.7772: UDP, length 120
02:36:21.568859 IP 192.168.43.147.8880 > 192.168.43.124.7773: UDP, length 120
02:36:21.598322 IP 192.168.43.146.8880 > 192.168.43.147.7772: UDP, length 120
02:36:21.618853 IP 192.168.43.147.8880 > 192.168.43.124.7773: UDP, length 120
02:36:21.660003 IP 192.168.43.146.8880 > 192.168.43.147.7772: UDP, length 120
02:36:21.668852 IP 192.168.43.147.8880 > 192.168.43.124.7773: UDP, length 120
02:36:21.701918 IP 192.168.43.146.8880 > 192.168.43.147.7772: UDP, length 120
02:36:21.718880 IP 192.168.43.147.8880 > 192.168.43.124.7773: UDP, length 120
02:36:21.749749 IP 192.168.43.146.8880 > 192.168.43.147.7772: UDP, length 120
02:36:21.768855 IP 192.168.43.147.8880 > 192.168.43.124.7773: UDP, length 120
02:36:21.798153 IP 192.168.43.146.8880 > 192.168.43.147.7772: UDP, length 120
02:36:21.818853 IP 192.168.43.147.8880 > 192.168.43.124.7773: UDP, length 120
02:36:21.846851 IP 192.168.43.146.8880 > 192.168.43.147.7772: UDP, length 120
02:36:21.868853 IP 192.168.43.147.8880 > 192.168.43.124.7773: UDP, length 120
02:36:21.906167 IP 192.168.43.146.8880 > 192.168.43.147.7772: UDP, length 120
02:36:21.918874 IP 192.168.43.147.8880 > 192.168.43.124.7773: UDP, length 120
02:36:21.949622 IP 192.168.43.146.8880 > 192.168.43.147.7772: UDP, length 120
02:36:21.968886 IP 192.168.43.147.8880 > 192.168.43.124.7773: UDP, length 120
02:36:22.000795 IP 192.168.43.146.8880 > 192.168.43.147.7772: UDP, length 120
02:36:22.018883 IP 192.168.43.147.8880 > 192.168.43.124.7773: UDP, length 120
02:36:22.061028 IP 192.168.43.146.8880 > 192.168.43.147.7772: UDP, length 120
02:36:22.068888 IP 192.168.43.147.8880 > 192.168.43.124.7773: UDP, length 120
02:36:22.118881 IP 192.168.43.147.8880 > 192.168.43.124.7773: UDP, length 120
02:36:22.168877 IP 192.168.43.147.8880 > 192.168.43.124.7773: UDP, length 120
02:36:22.170905 IP 192.168.43.146.8880 > 192.168.43.147.7772: UDP, length 120
02:36:22.207497 IP 192.168.43.146.8880 > 192.168.43.147.7772: UDP, length 120
02:36:22.218877 IP 192.168.43.147.8880 > 192.168.43.124.7773: UDP, length 120
02:36:22.252666 IP 192.168.43.146.8880 > 192.168.43.147.7772: UDP, length 120
02:36:22.268877 IP 192.168.43.147.8880 > 192.168.43.124.7773: UDP, length 120
02:36:22.307518 IP 192.168.43.146.8880 > 192.168.43.147.7772: UDP, length 120
02:36:22.318878 IP 192.168.43.147.8880 > 192.168.43.124.7773: UDP, length 120
02:36:22.368877 IP 192.168.43.147.8880 > 192.168.43.124.7773: UDP, length 120
02:36:22.372621 IP 192.168.43.146.8880 > 192.168.43.147.7772: UDP, length 120
02:36:22.401338 IP 192.168.43.146.8880 > 192.168.43.147.7772: UDP, length 120
02:36:22.418878 IP 192.168.43.147.8880 > 192.168.43.124.7773: UDP, length 120
02:36:22.450210 IP 192.168.43.146.8880 > 192.168.43.147.7772: UDP, length 120
02:36:22.468878 IP 192.168.43.147.8880 > 192.168.43.124.7773: UDP, length 120
02:36:22.518968 IP 192.168.43.147.8880 > 192.168.43.124.7773: UDP, length 120
02:36:22.522188 IP 192.168.43.146.8880 > 192.168.43.147.7772: UDP, length 120
02:36:22.547944 IP 192.168.43.146.8880 > 192.168.43.147.7772: UDP, length 120
02:36:22.568894 IP 192.168.43.147.8880 > 192.168.43.124.7773: UDP, length 120
02:36:22.618880 IP 192.168.43.147.8880 > 192.168.43.124.7773: UDP, length 120
02:36:22.668876 IP 192.168.43.147.8880 > 192.168.43.124.7773: UDP, length 120
02:36:22.682369 IP 192.168.43.146.8880 > 192.168.43.147.7772: UDP, length 120
02:36:22.683244 IP 192.168.43.146.8880 > 192.168.43.147.7772: UDP, length 120
02:36:22.712113 IP 192.168.43.146.8880 > 192.168.43.147.7772: UDP, length 120
02:36:22.718878 IP 192.168.43.147.8880 > 192.168.43.124.7773: UDP, length 120
02:36:22.756254 IP 192.168.43.146.8880 > 192.168.43.147.7772: UDP, length 120
02:36:22.768878 IP 192.168.43.147.8880 > 192.168.43.124.7773: UDP, length 120
02:36:22.797533 IP 192.168.43.146.8880 > 192.168.43.147.7772: UDP, length 120
02:36:22.818883 IP 192.168.43.147.8880 > 192.168.43.124.7773: UDP, length 120
02:36:22.868877 IP 192.168.43.147.8880 > 192.168.43.124.7773: UDP, length 120
02:36:22.871311 IP 192.168.43.146.8880 > 192.168.43.147.7772: UDP, length 120
02:36:22.918878 IP 192.168.43.147.8880 > 192.168.43.124.7773: UDP, length 120
02:36:22.923299 IP 192.168.43.146.8880 > 192.168.43.147.7772: UDP, length 120
02:36:22.963499 IP 192.168.43.146.8880 > 192.168.43.147.7772: UDP, length 120
02:36:22.968875 IP 192.168.43.147.8880 > 192.168.43.124.7773: UDP, length 120
02:36:23.018877 IP 192.168.43.147.8880 > 192.168.43.124.7773: UDP, length 120
02:36:23.024570 IP 192.168.43.146.8880 > 192.168.43.147.7772: UDP, length 120
02:36:23.068879 IP 192.168.43.147.8880 > 192.168.43.124.7773: UDP, length 120
02:36:23.072329 IP 192.168.43.146.8880 > 192.168.43.147.7772: UDP, length 120
02:36:23.097403 IP 192.168.43.146.8880 > 192.168.43.147.7772: UDP, length 120
02:36:23.118884 IP 192.168.43.147.8880 > 192.168.43.124.7773: UDP, length 120
02:36:23.168880 IP 192.168.43.147.8880 > 192.168.43.124.7773: UDP, length 120
02:36:23.181587 IP 192.168.43.146.8880 > 192.168.43.147.7772: UDP, length 120
02:36:23.212913 IP 192.168.43.146.8880 > 192.168.43.147.7772: UDP, length 120
02:36:23.218918 IP 192.168.43.147.8880 > 192.168.43.124.7773: UDP, length 120
02:36:23.268879 IP 192.168.43.147.8880 > 192.168.43.124.7773: UDP, length 120
02:36:23.294236 IP 192.168.43.146.8880 > 192.168.43.147.7772: UDP, length 120
02:36:23.296985 IP 192.168.43.146.8880 > 192.168.43.147.7772: UDP, length 120
02:36:23.318885 IP 192.168.43.147.8880 > 192.168.43.124.7773: UDP, length 120
02:36:23.368881 IP 192.168.43.147.8880 > 192.168.43.124.7773: UDP, length 120
02:36:23.395308 IP 192.168.43.146.8880 > 192.168.43.147.7772: UDP, length 120
02:36:23.399455 IP 192.168.43.146.8880 > 192.168.43.147.7772: UDP, length 120
02:36:23.418880 IP 192.168.43.147.8880 > 192.168.43.124.7773: UDP, length 120
02:36:23.468877 IP 192.168.43.147.8880 > 192.168.43.124.7773: UDP, length 120
02:36:23.486006 IP 192.168.43.146.8880 > 192.168.43.147.7772: UDP, length 120
02:36:23.496742 IP 192.168.43.146.8880 > 192.168.43.147.7772: UDP, length 120
02:36:23.518880 IP 192.168.43.147.8880 > 192.168.43.124.7773: UDP, length 120
02:36:23.568887 IP 192.168.43.147.8880 > 192.168.43.124.7773: UDP, length 120
02:36:23.574221 IP 192.168.43.146.8880 > 192.168.43.147.7772: UDP, length 120
02:36:23.613383 IP 192.168.43.146.8880 > 192.168.43.147.7772: UDP, length 120
02:36:23.618887 IP 192.168.43.147.8880 > 192.168.43.124.7773: UDP, length 120
02:36:23.655792 IP 192.168.43.146.8880 > 192.168.43.147.7772: UDP, length 120
02:36:23.668876 IP 192.168.43.147.8880 > 192.168.43.124.7773: UDP, length 120
02:36:23.696844 IP 192.168.43.146.8880 > 192.168.43.147.7772: UDP, length 120
02:36:23.718880 IP 192.168.43.147.8880 > 192.168.43.124.7773: UDP, length 120
02:36:23.756250 IP 192.168.43.146.8880 > 192.168.43.147.7772: UDP, length 120
02:36:23.768880 IP 192.168.43.147.8880 > 192.168.43.124.7773: UDP, length 120
02:36:23.802102 IP 192.168.43.146.8880 > 192.168.43.147.7772: UDP, length 120
02:36:23.818885 IP 192.168.43.147.8880 > 192.168.43.124.7773: UDP, length 120
02:36:23.868881 IP 192.168.43.147.8880 > 192.168.43.124.7773: UDP, length 120
02:36:23.906134 IP 192.168.43.146.8880 > 192.168.43.147.7772: UDP, length 120
02:36:23.906255 IP 192.168.43.146.8880 > 192.168.43.147.7772: UDP, length 120
02:36:23.918880 IP 192.168.43.147.8880 > 192.168.43.124.7773: UDP, length 120
02:36:23.968875 IP 192.168.43.147.8880 > 192.168.43.124.7773: UDP, length 120
02:36:23.990888 IP 192.168.43.146.8880 > 192.168.43.147.7772: UDP, length 120
02:36:24.000625 IP 192.168.43.146.8880 > 192.168.43.147.7772: UDP, length 120
02:36:24.018881 IP 192.168.43.147.8880 > 192.168.43.124.7773: UDP, length 120
02:36:24.064133 IP 192.168.43.146.8880 > 192.168.43.147.7772: UDP, length 120
02:36:24.068875 IP 192.168.43.147.8880 > 192.168.43.124.7773: UDP, length 120
02:36:24.106351 IP 192.168.43.146.8880 > 192.168.43.147.7772: UDP, length 120
02:36:24.118884 IP 192.168.43.147.8880 > 192.168.43.124.7773: UDP, length 120
02:36:24.168877 IP 192.168.43.147.8880 > 192.168.43.124.7773: UDP, length 120
02:36:24.210698 IP 192.168.43.146.8880 > 192.168.43.147.7772: UDP, length 120
02:36:24.210950 IP 192.168.43.146.8880 > 192.168.43.147.7772: UDP, length 120
02:36:24.218888 IP 192.168.43.147.8880 > 192.168.43.124.7773: UDP, length 120
02:36:24.268877 IP 192.168.43.147.8880 > 192.168.43.124.7773: UDP, length 120
02:36:24.292056 IP 192.168.43.146.8880 > 192.168.43.147.7772: UDP, length 120
02:36:24.311905 IP 192.168.43.146.8880 > 192.168.43.147.7772: UDP, length 120
02:36:24.318881 IP 192.168.43.147.8880 > 192.168.43.124.7773: UDP, length 120
02:36:24.358382 IP 192.168.43.146.8880 > 192.168.43.147.7772: UDP, length 120
02:36:24.368876 IP 192.168.43.147.8880 > 192.168.43.124.7773: UDP, length 120
02:36:24.418877 IP 192.168.43.147.8880 > 192.168.43.124.7773: UDP, length 120
02:36:24.423644 IP 192.168.43.146.8880 > 192.168.43.147.7772: UDP, length 120
02:36:24.452778 IP 192.168.43.146.8880 > 192.168.43.147.7772: UDP, length 120
02:36:24.468880 IP 192.168.43.147.8880 > 192.168.43.124.7773: UDP, length 120
02:36:24.517579 IP 192.168.43.146.8880 > 192.168.43.147.7772: UDP, length 120
02:36:24.518875 IP 192.168.43.147.8880 > 192.168.43.124.7773: UDP, length 120
02:36:24.565514 IP 192.168.43.146.8880 > 192.168.43.147.7772: UDP, length 120
02:36:24.568890 IP 192.168.43.147.8880 > 192.168.43.124.7773: UDP, length 120
02:36:24.618881 IP 192.168.43.147.8880 > 192.168.43.124.7773: UDP, length 120
02:36:24.632393 IP 192.168.43.146.8880 > 192.168.43.147.7772: UDP, length 120
02:36:24.657548 IP 192.168.43.146.8880 > 192.168.43.147.7772: UDP, length 120
02:36:24.668883 IP 192.168.43.147.8880 > 192.168.43.124.7773: UDP, length 120
02:36:24.718929 IP 192.168.43.147.8880 > 192.168.43.124.7773: UDP, length 120
02:36:24.723108 IP 192.168.43.146.8880 > 192.168.43.147.7772: UDP, length 120
02:36:24.768888 IP 192.168.43.147.8880 > 192.168.43.124.7773: UDP, length 120
02:36:24.804947 IP 192.168.43.146.8880 > 192.168.43.147.7772: UDP, length 120
02:36:24.818882 IP 192.168.43.147.8880 > 192.168.43.124.7773: UDP, length 120
02:36:24.822825 IP 192.168.43.146.8880 > 192.168.43.147.7772: UDP, length 120
02:36:24.868884 IP 192.168.43.147.8880 > 192.168.43.124.7773: UDP, length 120
02:36:24.918825 IP 192.168.43.146.8880 > 192.168.43.147.7772: UDP, length 120
02:36:24.918997 IP 192.168.43.147.8880 > 192.168.43.124.7773: UDP, length 120
02:36:24.922419 IP 192.168.43.146.8880 > 192.168.43.147.7772: UDP, length 120
02:36:24.956781 IP 192.168.43.146.8880 > 192.168.43.147.7772: UDP, length 120
02:36:24.968877 IP 192.168.43.147.8880 > 192.168.43.124.7773: UDP, length 120
02:36:24.997032 IP 192.168.43.146.8880 > 192.168.43.147.7772: UDP, length 120
02:36:25.018879 IP 192.168.43.147.8880 > 192.168.43.124.7773: UDP, length 120
02:36:25.046956 IP 192.168.43.146.8880 > 192.168.43.147.7772: UDP, length 120
02:36:25.068878 IP 192.168.43.147.8880 > 192.168.43.124.7773: UDP, length 120
02:36:25.105895 IP 192.168.43.146.8880 > 192.168.43.147.7772: UDP, length 120
02:36:25.118878 IP 192.168.43.147.8880 > 192.168.43.124.7773: UDP, length 120
02:36:25.148392 IP 192.168.43.146.8880 > 192.168.43.147.7772: UDP, length 120
02:36:25.168881 IP 192.168.43.147.8880 > 192.168.43.124.7773: UDP, length 120
02:36:25.197343 IP 192.168.43.146.8880 > 192.168.43.147.7772: UDP, length 120
02:36:25.218882 IP 192.168.43.147.8880 > 192.168.43.124.7773: UDP, length 120
02:36:25.256830 IP 192.168.43.146.8880 > 192.168.43.147.7772: UDP, length 120
02:36:25.268884 IP 192.168.43.147.8880 > 192.168.43.124.7773: UDP, length 120
02:36:25.298627 IP 192.168.43.146.8880 > 192.168.43.147.7772: UDP, length 120
02:36:25.318881 IP 192.168.43.147.8880 > 192.168.43.124.7773: UDP, length 120
02:36:25.348636 IP 192.168.43.146.8880 > 192.168.43.147.7772: UDP, length 120
02:36:25.368938 IP 192.168.43.147.8880 > 192.168.43.124.7773: UDP, length 120
02:36:25.406274 IP 192.168.43.146.8880 > 192.168.43.147.7772: UDP, length 120
02:36:25.418943 IP 192.168.43.147.8880 > 192.168.43.124.7773: UDP, length 120
02:36:25.450917 IP 192.168.43.146.8880 > 192.168.43.147.7772: UDP, length 120
02:36:25.468975 IP 192.168.43.147.8880 > 192.168.43.124.7773: UDP, length 120
02:36:25.508622 IP 192.168.43.146.8880 > 192.168.43.147.7772: UDP, length 120
02:36:25.518905 IP 192.168.43.147.8880 > 192.168.43.124.7773: UDP, length 120
02:36:25.553132 IP 192.168.43.146.8880 > 192.168.43.147.7772: UDP, length 120
02:36:25.568924 IP 192.168.43.147.8880 > 192.168.43.124.7773: UDP, length 120
02:36:25.597046 IP 192.168.43.146.8880 > 192.168.43.147.7772: UDP, length 120
02:36:25.618919 IP 192.168.43.147.8880 > 192.168.43.124.7773: UDP, length 120
02:36:25.646839 IP 192.168.43.146.8880 > 192.168.43.147.7772: UDP, length 120
02:36:25.668945 IP 192.168.43.147.8880 > 192.168.43.124.7773: UDP, length 120
02:36:25.709437 IP 192.168.43.146.8880 > 192.168.43.147.7772: UDP, length 120
02:36:25.718919 IP 192.168.43.147.8880 > 192.168.43.124.7773: UDP, length 120
02:36:25.747453 IP 192.168.43.146.8880 > 192.168.43.147.7772: UDP, length 120
02:36:25.768950 IP 192.168.43.147.8880 > 192.168.43.124.7773: UDP, length 120
02:36:25.793841 IP 192.168.43.146.8880 > 192.168.43.147.7772: UDP, length 120
02:36:25.818927 IP 192.168.43.147.8880 > 192.168.43.124.7773: UDP, length 120
02:36:25.851302 IP 192.168.43.146.8880 > 192.168.43.147.7772: UDP, length 120
02:36:25.868879 IP 192.168.43.147.8880 > 192.168.43.124.7773: UDP, length 120
02:36:25.897310 IP 192.168.43.146.8880 > 192.168.43.147.7772: UDP, length 120
02:36:25.918857 IP 192.168.43.147.8880 > 192.168.43.124.7773: UDP, length 120
02:36:25.947066 IP 192.168.43.146.8880 > 192.168.43.147.7772: UDP, length 120
02:36:25.968853 IP 192.168.43.147.8880 > 192.168.43.124.7773: UDP, length 120
02:36:26.007974 IP 192.168.43.146.8880 > 192.168.43.147.7772: UDP, length 120
02:36:26.018854 IP 192.168.43.147.8880 > 192.168.43.124.7773: UDP, length 120
02:36:26.047066 IP 192.168.43.146.8880 > 192.168.43.147.7772: UDP, length 120
02:36:26.068851 IP 192.168.43.147.8880 > 192.168.43.124.7773: UDP, length 120
02:36:26.097336 IP 192.168.43.146.8880 > 192.168.43.147.7772: UDP, length 120
02:36:26.118852 IP 192.168.43.147.8880 > 192.168.43.124.7773: UDP, length 120
02:36:26.154949 IP 192.168.43.146.8880 > 192.168.43.147.7772: UDP, length 120
02:36:26.168852 IP 192.168.43.147.8880 > 192.168.43.124.7773: UDP, length 120
02:36:26.197329 IP 192.168.43.146.8880 > 192.168.43.147.7772: UDP, length 120
02:36:26.218880 IP 192.168.43.147.8880 > 192.168.43.124.7773: UDP, length 120
02:36:26.246890 IP 192.168.43.146.8880 > 192.168.43.147.7772: UDP, length 120
02:36:26.268856 IP 192.168.43.147.8880 > 192.168.43.124.7773: UDP, length 120
02:36:26.307274 IP 192.168.43.146.8880 > 192.168.43.147.7772: UDP, length 120
02:36:26.318857 IP 192.168.43.147.8880 > 192.168.43.124.7773: UDP, length 120
02:36:26.347330 IP 192.168.43.146.8880 > 192.168.43.147.7772: UDP, length 120
02:36:26.368857 IP 192.168.43.147.8880 > 192.168.43.124.7773: UDP, length 120
02:36:26.404188 IP 192.168.43.146.8880 > 192.168.43.147.7772: UDP, length 120
02:36:26.418853 IP 192.168.43.147.8880 > 192.168.43.124.7773: UDP, length 120
02:36:26.455534 IP 192.168.43.146.8880 > 192.168.43.147.7772: UDP, length 120
02:36:26.468853 IP 192.168.43.147.8880 > 192.168.43.124.7773: UDP, length 120
02:36:26.518852 IP 192.168.43.147.8880 > 192.168.43.124.7773: UDP, length 120
02:36:26.523082 IP 192.168.43.146.8880 > 192.168.43.147.7772: UDP, length 120
02:36:26.554843 IP 192.168.43.146.8880 > 192.168.43.147.7772: UDP, length 120
02:36:26.568861 IP 192.168.43.147.8880 > 192.168.43.124.7773: UDP, length 120
02:36:26.601358 IP 192.168.43.146.8880 > 192.168.43.147.7772: UDP, length 120
02:36:26.618857 IP 192.168.43.147.8880 > 192.168.43.124.7773: UDP, length 120
02:36:26.666119 IP 192.168.43.146.8880 > 192.168.43.147.7772: UDP, length 120
02:36:26.668853 IP 192.168.43.147.8880 > 192.168.43.124.7773: UDP, length 120
02:36:26.697827 IP 192.168.43.146.8880 > 192.168.43.147.7772: UDP, length 120
02:36:26.718853 IP 192.168.43.147.8880 > 192.168.43.124.7773: UDP, length 120
02:36:26.747075 IP 192.168.43.146.8880 > 192.168.43.147.7772: UDP, length 120
02:36:26.768856 IP 192.168.43.147.8880 > 192.168.43.124.7773: UDP, length 120
02:36:26.806421 IP 192.168.43.146.8880 > 192.168.43.147.7772: UDP, length 120
02:36:26.818867 IP 192.168.43.147.8880 > 192.168.43.124.7773: UDP, length 120
02:36:26.846944 IP 192.168.43.146.8880 > 192.168.43.147.7772: UDP, length 120
02:36:26.868863 IP 192.168.43.147.8880 > 192.168.43.124.7773: UDP, length 120
02:36:26.900108 IP 192.168.43.146.8880 > 192.168.43.147.7772: UDP, length 120
02:36:26.918879 IP 192.168.43.147.8880 > 192.168.43.124.7773: UDP, length 120
02:36:26.956502 IP 192.168.43.146.8880 > 192.168.43.147.7772: UDP, length 120
02:36:26.968885 IP 192.168.43.147.8880 > 192.168.43.124.7773: UDP, length 120
02:36:26.997355 IP 192.168.43.146.8880 > 192.168.43.147.7772: UDP, length 120
02:36:27.018880 IP 192.168.43.147.8880 > 192.168.43.124.7773: UDP, length 120
02:36:27.049336 IP 192.168.43.146.8880 > 192.168.43.147.7772: UDP, length 120
02:36:27.068883 IP 192.168.43.147.8880 > 192.168.43.124.7773: UDP, length 120
02:36:27.111478 IP 192.168.43.146.8880 > 192.168.43.147.7772: UDP, length 120
02:36:27.118879 IP 192.168.43.147.8880 > 192.168.43.124.7773: UDP, length 120
02:36:27.147261 IP 192.168.43.146.8880 > 192.168.43.147.7772: UDP, length 120
02:36:27.168878 IP 192.168.43.147.8880 > 192.168.43.124.7773: UDP, length 120
02:36:27.197619 IP 192.168.43.146.8880 > 192.168.43.147.7772: UDP, length 120
02:36:27.218877 IP 192.168.43.147.8880 > 192.168.43.124.7773: UDP, length 120
02:36:27.256125 IP 192.168.43.146.8880 > 192.168.43.147.7772: UDP, length 120
02:36:27.268876 IP 192.168.43.147.8880 > 192.168.43.124.7773: UDP, length 120
02:36:27.297539 IP 192.168.43.146.8880 > 192.168.43.147.7772: UDP, length 120
02:36:27.318879 IP 192.168.43.147.8880 > 192.168.43.124.7773: UDP, length 120
02:36:27.344014 IP 192.168.43.146.8880 > 192.168.43.147.7772: UDP, length 120
02:36:27.368899 IP 192.168.43.147.8880 > 192.168.43.124.7773: UDP, length 120
02:36:27.397050 IP 192.168.43.146.8880 > 192.168.43.147.7772: UDP, length 120
02:36:27.418888 IP 192.168.43.147.8880 > 192.168.43.124.7773: UDP, length 120
02:36:27.452495 IP 192.168.43.146.8880 > 192.168.43.147.7772: UDP, length 120
02:36:27.468879 IP 192.168.43.147.8880 > 192.168.43.124.7773: UDP, length 120
02:36:27.498532 IP 192.168.43.146.8880 > 192.168.43.147.7772: UDP, length 120
02:36:27.518876 IP 192.168.43.147.8880 > 192.168.43.124.7773: UDP, length 120
02:36:27.551982 IP 192.168.43.146.8880 > 192.168.43.147.7772: UDP, length 120
02:36:27.568886 IP 192.168.43.147.8880 > 192.168.43.124.7773: UDP, length 120
02:36:27.601384 IP 192.168.43.146.8880 > 192.168.43.147.7772: UDP, length 120
02:36:27.618885 IP 192.168.43.147.8880 > 192.168.43.124.7773: UDP, length 120
02:36:27.657133 IP 192.168.43.146.8880 > 192.168.43.147.7772: UDP, length 120
02:36:27.668878 IP 192.168.43.147.8880 > 192.168.43.124.7773: UDP, length 120
02:36:27.703719 IP 192.168.43.146.8880 > 192.168.43.147.7772: UDP, length 120
02:36:27.718918 IP 192.168.43.147.8880 > 192.168.43.124.7773: UDP, length 120
02:36:27.760536 IP 192.168.43.146.8880 > 192.168.43.147.7772: UDP, length 120
02:36:27.768885 IP 192.168.43.147.8880 > 192.168.43.124.7773: UDP, length 120
02:36:27.805142 IP 192.168.43.146.8880 > 192.168.43.147.7772: UDP, length 120
02:36:27.818880 IP 192.168.43.147.8880 > 192.168.43.124.7773: UDP, length 120
02:36:27.852280 IP 192.168.43.146.8880 > 192.168.43.147.7772: UDP, length 120
02:36:27.868879 IP 192.168.43.147.8880 > 192.168.43.124.7773: UDP, length 120
02:36:27.905899 IP 192.168.43.146.8880 > 192.168.43.147.7772: UDP, length 120
02:36:27.918881 IP 192.168.43.147.8880 > 192.168.43.124.7773: UDP, length 120
02:36:27.968880 IP 192.168.43.147.8880 > 192.168.43.124.7773: UDP, length 120
02:36:27.972305 IP 192.168.43.146.8880 > 192.168.43.147.7772: UDP, length 120
02:36:27.999925 IP 192.168.43.146.8880 > 192.168.43.147.7772: UDP, length 120
02:36:28.018879 IP 192.168.43.147.8880 > 192.168.43.124.7773: UDP, length 120
02:36:28.068875 IP 192.168.43.147.8880 > 192.168.43.124.7773: UDP, length 120
02:36:28.094855 IP 192.168.43.146.8880 > 192.168.43.147.7772: UDP, length 120
02:36:28.100265 IP 192.168.43.146.8880 > 192.168.43.147.7772: UDP, length 120
02:36:28.118879 IP 192.168.43.147.8880 > 192.168.43.124.7773: UDP, length 120
02:36:28.147700 IP 192.168.43.146.8880 > 192.168.43.147.7772: UDP, length 120
02:36:28.168877 IP 192.168.43.147.8880 > 192.168.43.124.7773: UDP, length 120
02:36:28.200744 IP 192.168.43.146.8880 > 192.168.43.147.7772: UDP, length 120
02:36:28.218877 IP 192.168.43.147.8880 > 192.168.43.124.7773: UDP, length 120
02:36:28.250804 IP 192.168.43.146.8880 > 192.168.43.147.7772: UDP, length 120
02:36:28.268877 IP 192.168.43.147.8880 > 192.168.43.124.7773: UDP, length 120
02:36:28.304483 IP 192.168.43.146.8880 > 192.168.43.147.7772: UDP, length 120
02:36:28.318895 IP 192.168.43.147.8880 > 192.168.43.124.7773: UDP, length 120
02:36:28.353857 IP 192.168.43.146.8880 > 192.168.43.147.7772: UDP, length 120
02:36:28.368878 IP 192.168.43.147.8880 > 192.168.43.124.7773: UDP, length 120
02:36:28.409665 IP 192.168.43.146.8880 > 192.168.43.147.7772: UDP, length 120
02:36:28.418889 IP 192.168.43.147.8880 > 192.168.43.124.7773: UDP, length 120
02:36:28.455566 IP 192.168.43.146.8880 > 192.168.43.147.7772: UDP, length 120
02:36:28.468882 IP 192.168.43.147.8880 > 192.168.43.124.7773: UDP, length 120
02:36:28.514331 IP 192.168.43.146.8880 > 192.168.43.147.7772: UDP, length 120
02:36:28.518877 IP 192.168.43.147.8880 > 192.168.43.124.7773: UDP, length 120
02:36:28.568878 IP 192.168.43.147.8880 > 192.168.43.124.7773: UDP, length 120
02:36:28.615165 IP 192.168.43.146.8880 > 192.168.43.147.7772: UDP, length 120
02:36:28.615409 IP 192.168.43.146.8880 > 192.168.43.147.7772: UDP, length 120
02:36:28.618880 IP 192.168.43.147.8880 > 192.168.43.124.7773: UDP, length 120
02:36:28.661566 IP 192.168.43.146.8880 > 192.168.43.147.7772: UDP, length 120
02:36:28.668876 IP 192.168.43.147.8880 > 192.168.43.124.7773: UDP, length 120
02:36:28.717783 IP 192.168.43.146.8880 > 192.168.43.147.7772: UDP, length 120
02:36:28.718877 IP 192.168.43.147.8880 > 192.168.43.124.7773: UDP, length 120
02:36:28.757966 IP 192.168.43.146.8880 > 192.168.43.147.7772: UDP, length 120
02:36:28.768875 IP 192.168.43.147.8880 > 192.168.43.124.7773: UDP, length 120
02:36:28.801766 IP 192.168.43.146.8880 > 192.168.43.147.7772: UDP, length 120
02:36:28.818878 IP 192.168.43.147.8880 > 192.168.43.124.7773: UDP, length 120
02:36:28.861290 IP 192.168.43.146.8880 > 192.168.43.147.7772: UDP, length 120
02:36:28.868875 IP 192.168.43.147.8880 > 192.168.43.124.7773: UDP, length 120
02:36:28.902168 IP 192.168.43.146.8880 > 192.168.43.147.7772: UDP, length 120
02:36:28.918879 IP 192.168.43.147.8880 > 192.168.43.124.7773: UDP, length 120
02:36:28.950708 IP 192.168.43.146.8880 > 192.168.43.147.7772: UDP, length 120
02:36:28.968878 IP 192.168.43.147.8880 > 192.168.43.124.7773: UDP, length 120
02:36:29.018878 IP 192.168.43.147.8880 > 192.168.43.124.7773: UDP, length 120
02:36:29.019990 IP 192.168.43.146.8880 > 192.168.43.147.7772: UDP, length 120
02:36:29.068876 IP 192.168.43.147.8880 > 192.168.43.124.7773: UDP, length 120
02:36:29.092223 IP 192.168.43.146.8880 > 192.168.43.147.7772: UDP, length 120
02:36:29.118877 IP 192.168.43.147.8880 > 192.168.43.124.7773: UDP, length 120
02:36:29.122315 IP 192.168.43.146.8880 > 192.168.43.147.7772: UDP, length 120
02:36:29.163728 IP 192.168.43.146.8880 > 192.168.43.147.7772: UDP, length 120
02:36:29.168874 IP 192.168.43.147.8880 > 192.168.43.124.7773: UDP, length 120
02:36:29.218928 IP 192.168.43.147.8880 > 192.168.43.124.7773: UDP, length 120
