22:36:16.551436 IP 192.168.43.147.8880 > 192.168.43.124.7773: UDP, length 120
22:36:16.601394 IP 192.168.43.147.8880 > 192.168.43.124.7773: UDP, length 120
22:36:16.661871 IP 192.168.43.147.8880 > 192.168.43.124.7773: UDP, length 120
22:36:16.715537 IP 192.168.43.147.8880 > 192.168.43.124.7773: UDP, length 120
22:36:16.768775 IP 192.168.43.147.8880 > 192.168.43.124.7773: UDP, length 120
22:36:16.803613 IP 192.168.43.147.8880 > 192.168.43.124.7773: UDP, length 120
22:36:16.851890 IP 192.168.43.147.8880 > 192.168.43.124.7773: UDP, length 120
22:36:16.903752 IP 192.168.43.147.8880 > 192.168.43.124.7773: UDP, length 120
22:36:16.958460 IP 192.168.43.147.8880 > 192.168.43.124.7773: UDP, length 120
22:36:17.012249 IP 192.168.43.147.8880 > 192.168.43.124.7773: UDP, length 120
22:36:17.068240 IP 192.168.43.147.8880 > 192.168.43.124.7773: UDP, length 120
22:36:17.194643 IP 192.168.43.147.8880 > 192.168.43.124.7773: UDP, length 120
22:36:17.196570 IP 192.168.43.147.8880 > 192.168.43.124.7773: UDP, length 120
22:36:17.208778 IP 192.168.43.147.8880 > 192.168.43.124.7773: UDP, length 120
22:36:17.265629 IP 192.168.43.147.8880 > 192.168.43.124.7773: UDP, length 120
22:36:17.317920 IP 192.168.43.147.8880 > 192.168.43.124.7773: UDP, length 120
22:36:17.354677 IP 192.168.43.147.8880 > 192.168.43.124.7773: UDP, length 120
22:36:17.402649 IP 192.168.43.147.8880 > 192.168.43.124.7773: UDP, length 120
22:36:17.452881 IP 192.168.43.147.8880 > 192.168.43.124.7773: UDP, length 120
22:36:17.501735 IP 192.168.43.147.8880 > 192.168.43.124.7773: UDP, length 120
22:36:17.563304 IP 192.168.43.147.8880 > 192.168.43.124.7773: UDP, length 120
22:36:17.603750 IP 192.168.43.147.8880 > 192.168.43.124.7773: UDP, length 120
22:36:17.659062 IP 192.168.43.147.8880 > 192.168.43.124.7773: UDP, length 120
22:36:17.708039 IP 192.168.43.147.8880 > 192.168.43.124.7773: UDP, length 120
22:36:17.751020 IP 192.168.43.147.8880 > 192.168.43.124.7773: UDP, length 120
22:36:17.811906 IP 192.168.43.147.8880 > 192.168.43.124.7773: UDP, length 120
22:36:17.866066 IP 192.168.43.147.8880 > 192.168.43.124.7773: UDP, length 120
22:36:17.919835 IP 192.168.43.147.8880 > 192.168.43.124.7773: UDP, length 120
22:36:17.953782 IP 192.168.43.147.8880 > 192.168.43.124.7773: UDP, length 120
22:36:18.005390 IP 192.168.43.147.8880 > 192.168.43.124.7773: UDP, length 120
22:36:18.055694 IP 192.168.43.147.8880 > 192.168.43.124.7773: UDP, length 120
22:36:18.107626 IP 192.168.43.147.8880 > 192.168.43.124.7773: UDP, length 120
22:36:18.166517 IP 192.168.43.147.8880 > 192.168.43.124.7773: UDP, length 120
22:36:18.220593 IP 192.168.43.147.8880 > 192.168.43.124.7773: UDP, length 120
22:36:18.260219 IP 192.168.43.147.8880 > 192.168.43.124.7773: UDP, length 120
22:36:18.301816 IP 192.168.43.147.8880 > 192.168.43.124.7773: UDP, length 120
22:36:18.355543 IP 192.168.43.147.8880 > 192.168.43.124.7773: UDP, length 120
22:36:18.415509 IP 192.168.43.147.8880 > 192.168.43.124.7773: UDP, length 120
22:36:18.455963 IP 192.168.43.147.8880 > 192.168.43.124.7773: UDP, length 120
22:36:18.512185 IP 192.168.43.147.8880 > 192.168.43.124.7773: UDP, length 120
22:36:18.557427 IP 192.168.43.147.8880 > 192.168.43.124.7773: UDP, length 120
22:36:18.609675 IP 192.168.43.147.8880 > 192.168.43.124.7773: UDP, length 120
22:36:18.678288 IP 192.168.43.147.8880 > 192.168.43.124.7773: UDP, length 120
22:36:18.704269 IP 192.168.43.147.8880 > 192.168.43.124.7773: UDP, length 120
22:36:18.751106 IP 192.168.43.147.8880 > 192.168.43.124.7773: UDP, length 120
22:36:18.816538 IP 192.168.43.147.8880 > 192.168.43.124.7773: UDP, length 120
22:36:18.854430 IP 192.168.43.147.8880 > 192.168.43.124.7773: UDP, length 120
22:36:18.903893 IP 192.168.43.147.8880 > 192.168.43.124.7773: UDP, length 120
22:36:18.965749 IP 192.168.43.147.8880 > 192.168.43.124.7773: UDP, length 120
22:36:19.004978 IP 192.168.43.147.8880 > 192.168.43.124.7773: UDP, length 120
22:36:19.058004 IP 192.168.43.147.8880 > 192.168.43.124.7773: UDP, length 120
22:36:19.126143 IP 192.168.43.147.8880 > 192.168.43.124.7773: UDP, length 120
22:36:19.157922 IP 192.168.43.147.8880 > 192.168.43.124.7773: UDP, length 120
22:36:19.211037 IP 192.168.43.147.8880 > 192.168.43.124.7773: UDP, length 120
22:36:19.274619 IP 192.168.43.147.8880 > 192.168.43.124.7773: UDP, length 120
22:36:19.302036 IP 192.168.43.147.8880 > 192.168.43.124.7773: UDP, length 120
22:36:19.359113 IP 192.168.43.147.8880 > 192.168.43.124.7773: UDP, length 120
22:36:19.414497 IP 192.168.43.147.8880 > 192.168.43.124.7773: UDP, length 120
22:36:19.451594 IP 192.168.43.147.8880 > 192.168.43.124.7773: UDP, length 120
22:36:19.505360 IP 192.168.43.147.8880 > 192.168.43.124.7773: UDP, length 120
22:36:19.573695 IP 192.168.43.147.8880 > 192.168.43.124.7773: UDP, length 120
22:36:19.603738 IP 192.168.43.147.8880 > 192.168.43.124.7773: UDP, length 120
22:36:19.651765 IP 192.168.43.147.8880 > 192.168.43.124.7773: UDP, length 120
22:36:19.710575 IP 192.168.43.147.8880 > 192.168.43.124.7773: UDP, length 120
22:36:19.755889 IP 192.168.43.147.8880 > 192.168.43.124.7773: UDP, length 120
22:36:19.800961 IP 192.168.43.147.8880 > 192.168.43.124.7773: UDP, length 120
22:36:19.869024 IP 192.168.43.147.8880 > 192.168.43.124.7773: UDP, length 120
22:36:19.904145 IP 192.168.43.147.8880 > 192.168.43.124.7773: UDP, length 120
22:36:19.953348 IP 192.168.43.147.8880 > 192.168.43.124.7773: UDP, length 120
22:36:20.014447 IP 192.168.43.147.8880 > 192.168.43.124.7773: UDP, length 120
22:36:20.054083 IP 192.168.43.147.8880 > 192.168.43.124.7773: UDP, length 120
22:36:20.101294 IP 192.168.43.147.8880 > 192.168.43.124.7773: UDP, length 120
22:36:20.166125 IP 192.168.43.147.8880 > 192.168.43.124.7773: UDP, length 120
22:36:20.206428 IP 192.168.43.147.8880 > 192.168.43.124.7773: UDP, length 120
22:36:20.250842 IP 192.168.43.147.8880 > 192.168.43.124.7773: UDP, length 120
22:36:20.314212 IP 192.168.43.147.8880 > 192.168.43.124.7773: UDP, length 120
22:36:20.354460 IP 192.168.43.147.8880 > 192.168.43.124.7773: UDP, length 120
22:36:20.407637 IP 192.168.43.147.8880 > 192.168.43.124.7773: UDP, length 120
22:36:20.463885 IP 192.168.43.147.8880 > 192.168.43.124.7773: UDP, length 120
22:36:20.503829 IP 192.168.43.147.8880 > 192.168.43.124.7773: UDP, length 120
22:36:20.550936 IP 192.168.43.147.8880 > 192.168.43.124.7773: UDP, length 120
22:36:20.610342 IP 192.168.43.147.8880 > 192.168.43.124.7773: UDP, length 120
22:36:20.653809 IP 192.168.43.147.8880 > 192.168.43.124.7773: UDP, length 120
22:36:20.700582 IP 192.168.43.147.8880 > 192.168.43.124.7773: UDP, length 120
22:36:20.763904 IP 192.168.43.147.8880 > 192.168.43.124.7773: UDP, length 120
22:36:20.810720 IP 192.168.43.147.8880 > 192.168.43.124.7773: UDP, length 120
22:36:20.854253 IP 192.168.43.147.8880 > 192.168.43.124.7773: UDP, length 120
22:36:20.913356 IP 192.168.43.147.8880 > 192.168.43.124.7773: UDP, length 120
22:36:20.982534 IP 192.168.43.147.8880 > 192.168.43.124.7773: UDP, length 120
22:36:21.004207 IP 192.168.43.147.8880 > 192.168.43.124.7773: UDP, length 120
22:36:21.011028 IP 192.168.43.124.8880 > 192.168.43.146.7771: UDP, length 120
22:36:21.061174 IP 192.168.43.124.8880 > 192.168.43.146.7771: UDP, length 120
22:36:21.063811 IP 192.168.43.147.8880 > 192.168.43.124.7773: UDP, length 120
22:36:21.103849 IP 192.168.43.147.8880 > 192.168.43.124.7773: UDP, length 120
22:36:21.111172 IP 192.168.43.124.8880 > 192.168.43.146.7771: UDP, length 120
22:36:21.159348 IP 192.168.43.147.8880 > 192.168.43.124.7773: UDP, length 120
22:36:21.161173 IP 192.168.43.124.8880 > 192.168.43.146.7771: UDP, length 120
22:36:21.211174 IP 192.168.43.124.8880 > 192.168.43.146.7771: UDP, length 120
22:36:21.216950 IP 192.168.43.147.8880 > 192.168.43.124.7773: UDP, length 120
22:36:21.257777 IP 192.168.43.147.8880 > 192.168.43.124.7773: UDP, length 120
22:36:21.261174 IP 192.168.43.124.8880 > 192.168.43.146.7771: UDP, length 120
22:36:21.306371 IP 192.168.43.147.8880 > 192.168.43.124.7773: UDP, length 120
22:36:21.311174 IP 192.168.43.124.8880 > 192.168.43.146.7771: UDP, length 120
22:36:21.361174 IP 192.168.43.124.8880 > 192.168.43.146.7771: UDP, length 120
22:36:21.370333 IP 192.168.43.147.8880 > 192.168.43.124.7773: UDP, length 120
22:36:21.409176 IP 192.168.43.147.8880 > 192.168.43.124.7773: UDP, length 120
22:36:21.411221 IP 192.168.43.124.8880 > 192.168.43.146.7771: UDP, length 120
22:36:21.450780 IP 192.168.43.147.8880 > 192.168.43.124.7773: UDP, length 120
22:36:21.461176 IP 192.168.43.124.8880 > 192.168.43.146.7771: UDP, length 120
22:36:21.511177 IP 192.168.43.124.8880 > 192.168.43.146.7771: UDP, length 120
22:36:21.523228 IP 192.168.43.147.8880 > 192.168.43.124.7773: UDP, length 120
22:36:21.553825 IP 192.168.43.147.8880 > 192.168.43.124.7773: UDP, length 120
22:36:21.561175 IP 192.168.43.124.8880 > 192.168.43.146.7771: UDP, length 120
22:36:21.600761 IP 192.168.43.147.8880 > 192.168.43.124.7773: UDP, length 120
22:36:21.611174 IP 192.168.43.124.8880 > 192.168.43.146.7771: UDP, length 120
22:36:21.661174 IP 192.168.43.124.8880 > 192.168.43.146.7771: UDP, length 120
22:36:21.667785 IP 192.168.43.147.8880 > 192.168.43.124.7773: UDP, length 120
22:36:21.705775 IP 192.168.43.147.8880 > 192.168.43.124.7773: UDP, length 120
22:36:21.711174 IP 192.168.43.124.8880 > 192.168.43.146.7771: UDP, length 120
22:36:21.754344 IP 192.168.43.147.8880 > 192.168.43.124.7773: UDP, length 120
22:36:21.761174 IP 192.168.43.124.8880 > 192.168.43.146.7771: UDP, length 120
22:36:21.811173 IP 192.168.43.124.8880 > 192.168.43.146.7771: UDP, length 120
22:36:21.823500 IP 192.168.43.147.8880 > 192.168.43.124.7773: UDP, length 120
22:36:21.854143 IP 192.168.43.147.8880 > 192.168.43.124.7773: UDP, length 120
22:36:21.861172 IP 192.168.43.124.8880 > 192.168.43.146.7771: UDP, length 120
22:36:21.911172 IP 192.168.43.124.8880 > 192.168.43.146.7771: UDP, length 120
22:36:21.914674 IP 192.168.43.147.8880 > 192.168.43.124.7773: UDP, length 120
22:36:21.953979 IP 192.168.43.147.8880 > 192.168.43.124.7773: UDP, length 120
22:36:21.961215 IP 192.168.43.124.8880 > 192.168.43.146.7771: UDP, length 120
22:36:22.009528 IP 192.168.43.147.8880 > 192.168.43.124.7773: UDP, length 120
22:36:22.011213 IP 192.168.43.124.8880 > 192.168.43.146.7771: UDP, length 120
22:36:22.061216 IP 192.168.43.124.8880 > 192.168.43.146.7771: UDP, length 120
22:36:22.069033 IP 192.168.43.147.8880 > 192.168.43.124.7773: UDP, length 120
22:36:22.104968 IP 192.168.43.147.8880 > 192.168.43.124.7773: UDP, length 120
22:36:22.111171 IP 192.168.43.124.8880 > 192.168.43.146.7771: UDP, length 120
22:36:22.161174 IP 192.168.43.124.8880 > 192.168.43.146.7771: UDP, length 120
22:36:22.175557 IP 192.168.43.147.8880 > 192.168.43.124.7773: UDP, length 120
22:36:22.211173 IP 192.168.43.124.8880 > 192.168.43.146.7771: UDP, length 120
22:36:22.214148 IP 192.168.43.147.8880 > 192.168.43.124.7773: UDP, length 120
22:36:22.256669 IP 192.168.43.147.8880 > 192.168.43.124.7773: UDP, length 120
22:36:22.261223 IP 192.168.43.124.8880 > 192.168.43.146.7771: UDP, length 120
22:36:22.311222 IP 192.168.43.124.8880 > 192.168.43.146.7771: UDP, length 120
22:36:22.316587 IP 192.168.43.147.8880 > 192.168.43.124.7773: UDP, length 120
22:36:22.354060 IP 192.168.43.147.8880 > 192.168.43.124.7773: UDP, length 120
22:36:22.361178 IP 192.168.43.124.8880 > 192.168.43.146.7771: UDP, length 120
22:36:22.400892 IP 192.168.43.147.8880 > 192.168.43.124.7773: UDP, length 120
22:36:22.411178 IP 192.168.43.124.8880 > 192.168.43.146.7771: UDP, length 120
22:36:22.454856 IP 192.168.43.147.8880 > 192.168.43.124.7773: UDP, length 120
22:36:22.461226 IP 192.168.43.124.8880 > 192.168.43.146.7771: UDP, length 120
22:36:22.511218 IP 192.168.43.124.8880 > 192.168.43.146.7771: UDP, length 120
22:36:22.522813 IP 192.168.43.147.8880 > 192.168.43.124.7773: UDP, length 120
22:36:22.558873 IP 192.168.43.147.8880 > 192.168.43.124.7773: UDP, length 120
22:36:22.561175 IP 192.168.43.124.8880 > 192.168.43.146.7771: UDP, length 120
22:36:22.604526 IP 192.168.43.147.8880 > 192.168.43.124.7773: UDP, length 120
22:36:22.611174 IP 192.168.43.124.8880 > 192.168.43.146.7771: UDP, length 120
22:36:22.661171 IP 192.168.43.124.8880 > 192.168.43.146.7771: UDP, length 120
22:36:22.669249 IP 192.168.43.147.8880 > 192.168.43.124.7773: UDP, length 120
22:36:22.704342 IP 192.168.43.147.8880 > 192.168.43.124.7773: UDP, length 120
22:36:22.711172 IP 192.168.43.124.8880 > 192.168.43.146.7771: UDP, length 120
22:36:22.761172 IP 192.168.43.124.8880 > 192.168.43.146.7771: UDP, length 120
22:36:22.762971 IP 192.168.43.147.8880 > 192.168.43.124.7773: UDP, length 120
22:36:22.803683 IP 192.168.43.147.8880 > 192.168.43.124.7773: UDP, length 120
22:36:22.811124 IP 192.168.43.124.8880 > 192.168.43.146.7771: UDP, length 120
22:36:22.850951 IP 192.168.43.147.8880 > 192.168.43.124.7773: UDP, length 120
22:36:22.861173 IP 192.168.43.124.8880 > 192.168.43.146.7771: UDP, length 120
22:36:22.911175 IP 192.168.43.124.8880 > 192.168.43.146.7771: UDP, length 120
22:36:22.915690 IP 192.168.43.147.8880 > 192.168.43.124.7773: UDP, length 120
22:36:22.953607 IP 192.168.43.147.8880 > 192.168.43.124.7773: UDP, length 120
22:36:22.961173 IP 192.168.43.124.8880 > 192.168.43.146.7771: UDP, length 120
22:36:23.007247 IP 192.168.43.147.8880 > 192.168.43.124.7773: UDP, length 120
22:36:23.011221 IP 192.168.43.124.8880 > 192.168.43.146.7771: UDP, length 120
22:36:23.061224 IP 192.168.43.124.8880 > 192.168.43.146.7771: UDP, length 120
22:36:23.074229 IP 192.168.43.147.8880 > 192.168.43.124.7773: UDP, length 120
22:36:23.104457 IP 192.168.43.147.8880 > 192.168.43.124.7773: UDP, length 120
22:36:23.111224 IP 192.168.43.124.8880 > 192.168.43.146.7771: UDP, length 120
22:36:23.154381 IP 192.168.43.147.8880 > 192.168.43.124.7773: UDP, length 120
22:36:23.161224 IP 192.168.43.124.8880 > 192.168.43.146.7771: UDP, length 120
22:36:23.211224 IP 192.168.43.124.8880 > 192.168.43.146.7771: UDP, length 120
22:36:23.221598 IP 192.168.43.147.8880 > 192.168.43.124.7773: UDP, length 120
22:36:23.256915 IP 192.168.43.147.8880 > 192.168.43.124.7773: UDP, length 120
22:36:23.261225 IP 192.168.43.124.8880 > 192.168.43.146.7771: UDP, length 120
22:36:23.306132 IP 192.168.43.147.8880 > 192.168.43.124.7773: UDP, length 120
22:36:23.311226 IP 192.168.43.124.8880 > 192.168.43.146.7771: UDP, length 120
22:36:23.361177 IP 192.168.43.124.8880 > 192.168.43.146.7771: UDP, length 120
22:36:23.372199 IP 192.168.43.147.8880 > 192.168.43.124.7773: UDP, length 120
22:36:23.409191 IP 192.168.43.147.8880 > 192.168.43.124.7773: UDP, length 120
22:36:23.411174 IP 192.168.43.124.8880 > 192.168.43.146.7771: UDP, length 120
22:36:23.461222 IP 192.168.43.124.8880 > 192.168.43.146.7771: UDP, length 120
22:36:23.473346 IP 192.168.43.147.8880 > 192.168.43.124.7773: UDP, length 120
22:36:23.511223 IP 192.168.43.124.8880 > 192.168.43.146.7771: UDP, length 120
22:36:23.561173 IP 192.168.43.124.8880 > 192.168.43.146.7771: UDP, length 120
22:36:23.574957 IP 192.168.43.147.8880 > 192.168.43.124.7773: UDP, length 120
22:36:23.574970 IP 192.168.43.147.8880 > 192.168.43.124.7773: UDP, length 120
22:36:23.611172 IP 192.168.43.124.8880 > 192.168.43.146.7771: UDP, length 120
22:36:23.621548 IP 192.168.43.147.8880 > 192.168.43.124.7773: UDP, length 120
22:36:23.661119 IP 192.168.43.124.8880 > 192.168.43.146.7771: UDP, length 120
22:36:23.661231 IP 192.168.43.147.8880 > 192.168.43.124.7773: UDP, length 120
22:36:23.702672 IP 192.168.43.147.8880 > 192.168.43.124.7773: UDP, length 120
22:36:23.711174 IP 192.168.43.124.8880 > 192.168.43.146.7771: UDP, length 120
22:36:23.761172 IP 192.168.43.124.8880 > 192.168.43.146.7771: UDP, length 120
22:36:23.764183 IP 192.168.43.147.8880 > 192.168.43.124.7773: UDP, length 120
22:36:23.804128 IP 192.168.43.147.8880 > 192.168.43.124.7773: UDP, length 120
22:36:23.811216 IP 192.168.43.124.8880 > 192.168.43.146.7771: UDP, length 120
22:36:23.855900 IP 192.168.43.147.8880 > 192.168.43.124.7773: UDP, length 120
22:36:23.861224 IP 192.168.43.124.8880 > 192.168.43.146.7771: UDP, length 120
22:36:23.911224 IP 192.168.43.124.8880 > 192.168.43.146.7771: UDP, length 120
22:36:23.915158 IP 192.168.43.147.8880 > 192.168.43.124.7773: UDP, length 120
22:36:23.955021 IP 192.168.43.147.8880 > 192.168.43.124.7773: UDP, length 120
22:36:23.961224 IP 192.168.43.124.8880 > 192.168.43.146.7771: UDP, length 120
22:36:24.004781 IP 192.168.43.147.8880 > 192.168.43.124.7773: UDP, length 120
22:36:24.011224 IP 192.168.43.124.8880 > 192.168.43.146.7771: UDP, length 120
22:36:24.061226 IP 192.168.43.124.8880 > 192.168.43.146.7771: UDP, length 120
22:36:24.069277 IP 192.168.43.147.8880 > 192.168.43.124.7773: UDP, length 120
22:36:24.104954 IP 192.168.43.147.8880 > 192.168.43.124.7773: UDP, length 120
22:36:24.111221 IP 192.168.43.124.8880 > 192.168.43.146.7771: UDP, length 120
22:36:24.151679 IP 192.168.43.147.8880 > 192.168.43.124.7773: UDP, length 120
22:36:24.161224 IP 192.168.43.124.8880 > 192.168.43.146.7771: UDP, length 120
22:36:24.211223 IP 192.168.43.124.8880 > 192.168.43.146.7771: UDP, length 120
22:36:24.213014 IP 192.168.43.147.8880 > 192.168.43.124.7773: UDP, length 120
22:36:24.261226 IP 192.168.43.124.8880 > 192.168.43.146.7771: UDP, length 120
22:36:24.283131 IP 192.168.43.147.8880 > 192.168.43.124.7773: UDP, length 120
22:36:24.301396 IP 192.168.43.147.8880 > 192.168.43.124.7773: UDP, length 120
22:36:24.311224 IP 192.168.43.124.8880 > 192.168.43.146.7771: UDP, length 120
22:36:24.361178 IP 192.168.43.124.8880 > 192.168.43.146.7771: UDP, length 120
22:36:24.364559 IP 192.168.43.147.8880 > 192.168.43.124.7773: UDP, length 120
22:36:24.402092 IP 192.168.43.147.8880 > 192.168.43.124.7773: UDP, length 120
22:36:24.411177 IP 192.168.43.124.8880 > 192.168.43.146.7771: UDP, length 120
22:36:24.457000 IP 192.168.43.147.8880 > 192.168.43.124.7773: UDP, length 120
22:36:24.461225 IP 192.168.43.124.8880 > 192.168.43.146.7771: UDP, length 120
22:36:24.505231 IP 192.168.43.147.8880 > 192.168.43.124.7773: UDP, length 120
22:36:24.511223 IP 192.168.43.124.8880 > 192.168.43.146.7771: UDP, length 120
22:36:24.561175 IP 192.168.43.124.8880 > 192.168.43.146.7771: UDP, length 120
22:36:24.579825 IP 192.168.43.147.8880 > 192.168.43.124.7773: UDP, length 120
22:36:24.601528 IP 192.168.43.147.8880 > 192.168.43.124.7773: UDP, length 120
22:36:24.611174 IP 192.168.43.124.8880 > 192.168.43.146.7771: UDP, length 120
22:36:24.651147 IP 192.168.43.147.8880 > 192.168.43.124.7773: UDP, length 120
22:36:24.661174 IP 192.168.43.124.8880 > 192.168.43.146.7771: UDP, length 120
22:36:24.711174 IP 192.168.43.124.8880 > 192.168.43.146.7771: UDP, length 120
22:36:24.713025 IP 192.168.43.147.8880 > 192.168.43.124.7773: UDP, length 120
22:36:24.751309 IP 192.168.43.147.8880 > 192.168.43.124.7773: UDP, length 120
22:36:24.761174 IP 192.168.43.124.8880 > 192.168.43.146.7771: UDP, length 120
22:36:24.804983 IP 192.168.43.147.8880 > 192.168.43.124.7773: UDP, length 120
22:36:24.811153 IP 192.168.43.124.8880 > 192.168.43.146.7771: UDP, length 120
22:36:24.861184 IP 192.168.43.124.8880 > 192.168.43.146.7771: UDP, length 120
22:36:24.867306 IP 192.168.43.147.8880 > 192.168.43.124.7773: UDP, length 120
22:36:24.905227 IP 192.168.43.147.8880 > 192.168.43.124.7773: UDP, length 120
22:36:24.911110 IP 192.168.43.124.8880 > 192.168.43.146.7771: UDP, length 120
22:36:24.961110 IP 192.168.43.124.8880 > 192.168.43.146.7771: UDP, length 120
22:36:24.966628 IP 192.168.43.147.8880 > 192.168.43.124.7773: UDP, length 120
22:36:25.001999 IP 192.168.43.147.8880 > 192.168.43.124.7773: UDP, length 120
22:36:25.011171 IP 192.168.43.124.8880 > 192.168.43.146.7771: UDP, length 120
22:36:25.054580 IP 192.168.43.147.8880 > 192.168.43.124.7773: UDP, length 120
22:36:25.061174 IP 192.168.43.124.8880 > 192.168.43.146.7771: UDP, length 120
22:36:25.111174 IP 192.168.43.124.8880 > 192.168.43.146.7771: UDP, length 120
22:36:25.115785 IP 192.168.43.147.8880 > 192.168.43.124.7773: UDP, length 120
22:36:25.154561 IP 192.168.43.147.8880 > 192.168.43.124.7773: UDP, length 120
22:36:25.161175 IP 192.168.43.124.8880 > 192.168.43.146.7771: UDP, length 120
22:36:25.204220 IP 192.168.43.147.8880 > 192.168.43.124.7773: UDP, length 120
22:36:25.211174 IP 192.168.43.124.8880 > 192.168.43.146.7771: UDP, length 120
22:36:25.261174 IP 192.168.43.124.8880 > 192.168.43.146.7771: UDP, length 120
22:36:25.264838 IP 192.168.43.147.8880 > 192.168.43.124.7773: UDP, length 120
22:36:25.303945 IP 192.168.43.147.8880 > 192.168.43.124.7773: UDP, length 120
22:36:25.311175 IP 192.168.43.124.8880 > 192.168.43.146.7771: UDP, length 120
22:36:25.356327 IP 192.168.43.147.8880 > 192.168.43.124.7773: UDP, length 120
22:36:25.361174 IP 192.168.43.124.8880 > 192.168.43.146.7771: UDP, length 120
22:36:25.411173 IP 192.168.43.124.8880 > 192.168.43.146.7771: UDP, length 120
22:36:25.418221 IP 192.168.43.147.8880 > 192.168.43.124.7773: UDP, length 120
22:36:25.456295 IP 192.168.43.147.8880 > 192.168.43.124.7773: UDP, length 120
22:36:25.461174 IP 192.168.43.124.8880 > 192.168.43.146.7771: UDP, length 120
22:36:25.505651 IP 192.168.43.147.8880 > 192.168.43.124.7773: UDP, length 120
22:36:25.511173 IP 192.168.43.124.8880 > 192.168.43.146.7771: UDP, length 120
22:36:25.561171 IP 192.168.43.124.8880 > 192.168.43.146.7771: UDP, length 120
22:36:25.561755 IP 192.168.43.147.8880 > 192.168.43.124.7773: UDP, length 120
22:36:25.604690 IP 192.168.43.147.8880 > 192.168.43.124.7773: UDP, length 120
22:36:25.611175 IP 192.168.43.124.8880 > 192.168.43.146.7771: UDP, length 120
22:36:25.661121 IP 192.168.43.124.8880 > 192.168.43.146.7771: UDP, length 120
22:36:25.661985 IP 192.168.43.147.8880 > 192.168.43.124.7773: UDP, length 120
22:36:25.711173 IP 192.168.43.124.8880 > 192.168.43.146.7771: UDP, length 120
22:36:25.716800 IP 192.168.43.147.8880 > 192.168.43.124.7773: UDP, length 120
22:36:25.755824 IP 192.168.43.147.8880 > 192.168.43.124.7773: UDP, length 120
22:36:25.761175 IP 192.168.43.124.8880 > 192.168.43.146.7771: UDP, length 120
22:36:25.802394 IP 192.168.43.147.8880 > 192.168.43.124.7773: UDP, length 120
22:36:25.811174 IP 192.168.43.124.8880 > 192.168.43.146.7771: UDP, length 120
22:36:25.858417 IP 192.168.43.147.8880 > 192.168.43.124.7773: UDP, length 120
22:36:25.861173 IP 192.168.43.124.8880 > 192.168.43.146.7771: UDP, length 120
22:36:25.901051 IP 192.168.43.147.8880 > 192.168.43.124.7773: UDP, length 120
22:36:25.911177 IP 192.168.43.124.8880 > 192.168.43.146.7771: UDP, length 120
22:36:25.954029 IP 192.168.43.147.8880 > 192.168.43.124.7773: UDP, length 120
22:36:25.961175 IP 192.168.43.124.8880 > 192.168.43.146.7771: UDP, length 120
22:36:26.011139 IP 192.168.43.124.8880 > 192.168.43.146.7771: UDP, length 120
22:36:26.016155 IP 192.168.43.147.8880 > 192.168.43.124.7773: UDP, length 120
22:36:26.053102 IP 192.168.43.147.8880 > 192.168.43.124.7773: UDP, length 120
22:36:26.061175 IP 192.168.43.124.8880 > 192.168.43.146.7771: UDP, length 120
22:36:26.104877 IP 192.168.43.147.8880 > 192.168.43.124.7773: UDP, length 120
22:36:26.111173 IP 192.168.43.124.8880 > 192.168.43.146.7771: UDP, length 120
22:36:26.161151 IP 192.168.43.124.8880 > 192.168.43.146.7771: UDP, length 120
22:36:26.162952 IP 192.168.43.147.8880 > 192.168.43.124.7773: UDP, length 120
22:36:26.207808 IP 192.168.43.147.8880 > 192.168.43.124.7773: UDP, length 120
22:36:26.211221 IP 192.168.43.124.8880 > 192.168.43.146.7771: UDP, length 120
22:36:26.254877 IP 192.168.43.147.8880 > 192.168.43.124.7773: UDP, length 120
22:36:26.261227 IP 192.168.43.124.8880 > 192.168.43.146.7771: UDP, length 120
22:36:26.311224 IP 192.168.43.124.8880 > 192.168.43.146.7771: UDP, length 120
22:36:26.314013 IP 192.168.43.147.8880 > 192.168.43.124.7773: UDP, length 120
22:36:26.353571 IP 192.168.43.147.8880 > 192.168.43.124.7773: UDP, length 120
22:36:26.361179 IP 192.168.43.124.8880 > 192.168.43.146.7771: UDP, length 120
22:36:26.401130 IP 192.168.43.147.8880 > 192.168.43.124.7773: UDP, length 120
22:36:26.411178 IP 192.168.43.124.8880 > 192.168.43.146.7771: UDP, length 120
22:36:26.461224 IP 192.168.43.124.8880 > 192.168.43.146.7771: UDP, length 120
22:36:26.464224 IP 192.168.43.147.8880 > 192.168.43.124.7773: UDP, length 120
22:36:26.507306 IP 192.168.43.147.8880 > 192.168.43.124.7773: UDP, length 120
22:36:26.511228 IP 192.168.43.124.8880 > 192.168.43.146.7771: UDP, length 120
22:36:26.554306 IP 192.168.43.147.8880 > 192.168.43.124.7773: UDP, length 120
22:36:26.561119 IP 192.168.43.124.8880 > 192.168.43.146.7771: UDP, length 120
22:36:26.605177 IP 192.168.43.147.8880 > 192.168.43.124.7773: UDP, length 120
22:36:26.611174 IP 192.168.43.124.8880 > 192.168.43.146.7771: UDP, length 120
22:36:26.661175 IP 192.168.43.124.8880 > 192.168.43.146.7771: UDP, length 120
22:36:26.672507 IP 192.168.43.147.8880 > 192.168.43.124.7773: UDP, length 120
22:36:26.703883 IP 192.168.43.147.8880 > 192.168.43.124.7773: UDP, length 120
22:36:26.711175 IP 192.168.43.124.8880 > 192.168.43.146.7771: UDP, length 120
22:36:26.750690 IP 192.168.43.147.8880 > 192.168.43.124.7773: UDP, length 120
22:36:26.761174 IP 192.168.43.124.8880 > 192.168.43.146.7771: UDP, length 120
22:36:26.811154 IP 192.168.43.124.8880 > 192.168.43.146.7771: UDP, length 120
22:36:26.814896 IP 192.168.43.147.8880 > 192.168.43.124.7773: UDP, length 120
22:36:26.853319 IP 192.168.43.147.8880 > 192.168.43.124.7773: UDP, length 120
22:36:26.861176 IP 192.168.43.124.8880 > 192.168.43.146.7771: UDP, length 120
22:36:26.904454 IP 192.168.43.147.8880 > 192.168.43.124.7773: UDP, length 120
22:36:26.911112 IP 192.168.43.124.8880 > 192.168.43.146.7771: UDP, length 120
22:36:26.961100 IP 192.168.43.124.8880 > 192.168.43.146.7771: UDP, length 120
22:36:26.964647 IP 192.168.43.147.8880 > 192.168.43.124.7773: UDP, length 120
22:36:27.004081 IP 192.168.43.147.8880 > 192.168.43.124.7773: UDP, length 120
22:36:27.011096 IP 192.168.43.124.8880 > 192.168.43.146.7771: UDP, length 120
22:36:27.054245 IP 192.168.43.147.8880 > 192.168.43.124.7773: UDP, length 120
22:36:27.061095 IP 192.168.43.124.8880 > 192.168.43.146.7771: UDP, length 120
22:36:27.111175 IP 192.168.43.124.8880 > 192.168.43.146.7771: UDP, length 120
22:36:27.117005 IP 192.168.43.147.8880 > 192.168.43.124.7773: UDP, length 120
22:36:27.156482 IP 192.168.43.147.8880 > 192.168.43.124.7773: UDP, length 120
22:36:27.161174 IP 192.168.43.124.8880 > 192.168.43.146.7771: UDP, length 120
22:36:27.202808 IP 192.168.43.147.8880 > 192.168.43.124.7773: UDP, length 120
22:36:27.211175 IP 192.168.43.124.8880 > 192.168.43.146.7771: UDP, length 120
22:36:27.261175 IP 192.168.43.124.8880 > 192.168.43.146.7771: UDP, length 120
22:36:27.266191 IP 192.168.43.147.8880 > 192.168.43.124.7773: UDP, length 120
22:36:27.304168 IP 192.168.43.147.8880 > 192.168.43.124.7773: UDP, length 120
22:36:27.311173 IP 192.168.43.124.8880 > 192.168.43.146.7771: UDP, length 120
22:36:27.361175 IP 192.168.43.124.8880 > 192.168.43.146.7771: UDP, length 120
22:36:27.365320 IP 192.168.43.147.8880 > 192.168.43.124.7773: UDP, length 120
22:36:27.411174 IP 192.168.43.124.8880 > 192.168.43.146.7771: UDP, length 120
22:36:27.415214 IP 192.168.43.147.8880 > 192.168.43.124.7773: UDP, length 120
22:36:27.456054 IP 192.168.43.147.8880 > 192.168.43.124.7773: UDP, length 120
22:36:27.461174 IP 192.168.43.124.8880 > 192.168.43.146.7771: UDP, length 120
22:36:27.511179 IP 192.168.43.124.8880 > 192.168.43.146.7771: UDP, length 120
22:36:27.522968 IP 192.168.43.147.8880 > 192.168.43.124.7773: UDP, length 120
22:36:27.554214 IP 192.168.43.147.8880 > 192.168.43.124.7773: UDP, length 120
22:36:27.561173 IP 192.168.43.124.8880 > 192.168.43.146.7771: UDP, length 120
22:36:27.611174 IP 192.168.43.124.8880 > 192.168.43.146.7771: UDP, length 120
22:36:27.615941 IP 192.168.43.147.8880 > 192.168.43.124.7773: UDP, length 120
22:36:27.655360 IP 192.168.43.147.8880 > 192.168.43.124.7773: UDP, length 120
22:36:27.661173 IP 192.168.43.124.8880 > 192.168.43.146.7771: UDP, length 120
22:36:27.711174 IP 192.168.43.124.8880 > 192.168.43.146.7771: UDP, length 120
22:36:27.722578 IP 192.168.43.147.8880 > 192.168.43.124.7773: UDP, length 120
22:36:27.761222 IP 192.168.43.124.8880 > 192.168.43.146.7771: UDP, length 120
22:36:27.763393 IP 192.168.43.147.8880 > 192.168.43.124.7773: UDP, length 120
22:36:27.805969 IP 192.168.43.147.8880 > 192.168.43.124.7773: UDP, length 120
22:36:27.811176 IP 192.168.43.124.8880 > 192.168.43.146.7771: UDP, length 120
22:36:27.861222 IP 192.168.43.124.8880 > 192.168.43.146.7771: UDP, length 120
22:36:27.877526 IP 192.168.43.147.8880 > 192.168.43.124.7773: UDP, length 120
22:36:27.910306 IP 192.168.43.147.8880 > 192.168.43.124.7773: UDP, length 120
22:36:27.911164 IP 192.168.43.124.8880 > 192.168.43.146.7771: UDP, length 120
22:36:27.961179 IP 192.168.43.124.8880 > 192.168.43.146.7771: UDP, length 120
22:36:27.962745 IP 192.168.43.147.8880 > 192.168.43.124.7773: UDP, length 120
22:36:28.004945 IP 192.168.43.147.8880 > 192.168.43.124.7773: UDP, length 120
22:36:28.011177 IP 192.168.43.124.8880 > 192.168.43.146.7771: UDP, length 120
22:36:28.057164 IP 192.168.43.147.8880 > 192.168.43.124.7773: UDP, length 120
22:36:28.061176 IP 192.168.43.124.8880 > 192.168.43.146.7771: UDP, length 120
22:36:28.111148 IP 192.168.43.124.8880 > 192.168.43.146.7771: UDP, length 120
22:36:28.111306 IP 192.168.43.147.8880 > 192.168.43.124.7773: UDP, length 120
22:36:28.157486 IP 192.168.43.147.8880 > 192.168.43.124.7773: UDP, length 120
22:36:28.161223 IP 192.168.43.124.8880 > 192.168.43.146.7771: UDP, length 120
22:36:28.206165 IP 192.168.43.147.8880 > 192.168.43.124.7773: UDP, length 120
22:36:28.211224 IP 192.168.43.124.8880 > 192.168.43.146.7771: UDP, length 120
22:36:28.257820 IP 192.168.43.147.8880 > 192.168.43.124.7773: UDP, length 120
22:36:28.261224 IP 192.168.43.124.8880 > 192.168.43.146.7771: UDP, length 120
22:36:28.307064 IP 192.168.43.147.8880 > 192.168.43.124.7773: UDP, length 120
22:36:28.311224 IP 192.168.43.124.8880 > 192.168.43.146.7771: UDP, length 120
22:36:28.357689 IP 192.168.43.147.8880 > 192.168.43.124.7773: UDP, length 120
22:36:28.361177 IP 192.168.43.124.8880 > 192.168.43.146.7771: UDP, length 120
22:36:28.406428 IP 192.168.43.147.8880 > 192.168.43.124.7773: UDP, length 120
22:36:28.411178 IP 192.168.43.124.8880 > 192.168.43.146.7771: UDP, length 120
22:36:28.461156 IP 192.168.43.124.8880 > 192.168.43.146.7771: UDP, length 120
22:36:28.462590 IP 192.168.43.147.8880 > 192.168.43.124.7773: UDP, length 120
22:36:28.503993 IP 192.168.43.147.8880 > 192.168.43.124.7773: UDP, length 120
22:36:28.511226 IP 192.168.43.124.8880 > 192.168.43.146.7771: UDP, length 120
22:36:28.555980 IP 192.168.43.147.8880 > 192.168.43.124.7773: UDP, length 120
22:36:28.561176 IP 192.168.43.124.8880 > 192.168.43.146.7771: UDP, length 120
22:36:28.602688 IP 192.168.43.147.8880 > 192.168.43.124.7773: UDP, length 120
22:36:28.611177 IP 192.168.43.124.8880 > 192.168.43.146.7771: UDP, length 120
22:36:28.656215 IP 192.168.43.147.8880 > 192.168.43.124.7773: UDP, length 120
22:36:28.661176 IP 192.168.43.124.8880 > 192.168.43.146.7771: UDP, length 120
22:36:28.706758 IP 192.168.43.147.8880 > 192.168.43.124.7773: UDP, length 120
22:36:28.711178 IP 192.168.43.124.8880 > 192.168.43.146.7771: UDP, length 120
22:36:28.752681 IP 192.168.43.147.8880 > 192.168.43.124.7773: UDP, length 120
22:36:28.761177 IP 192.168.43.124.8880 > 192.168.43.146.7771: UDP, length 120
22:36:28.805628 IP 192.168.43.147.8880 > 192.168.43.124.7773: UDP, length 120
22:36:28.811154 IP 192.168.43.124.8880 > 192.168.43.146.7771: UDP, length 120
22:36:28.853007 IP 192.168.43.147.8880 > 192.168.43.124.7773: UDP, length 120
22:36:28.861176 IP 192.168.43.124.8880 > 192.168.43.146.7771: UDP, length 120
22:36:28.906850 IP 192.168.43.147.8880 > 192.168.43.124.7773: UDP, length 120
22:36:28.911223 IP 192.168.43.124.8880 > 192.168.43.146.7771: UDP, length 120
22:36:28.955136 IP 192.168.43.147.8880 > 192.168.43.124.7773: UDP, length 120
22:36:28.961224 IP 192.168.43.124.8880 > 192.168.43.146.7771: UDP, length 120
22:36:29.007506 IP 192.168.43.147.8880 > 192.168.43.124.7773: UDP, length 120
22:36:29.011223 IP 192.168.43.124.8880 > 192.168.43.146.7771: UDP, length 120
22:36:29.056312 IP 192.168.43.147.8880 > 192.168.43.124.7773: UDP, length 120
22:36:29.061223 IP 192.168.43.124.8880 > 192.168.43.146.7771: UDP, length 120
22:36:29.105704 IP 192.168.43.147.8880 > 192.168.43.124.7773: UDP, length 120
22:36:29.111222 IP 192.168.43.124.8880 > 192.168.43.146.7771: UDP, length 120
22:36:29.156380 IP 192.168.43.147.8880 > 192.168.43.124.7773: UDP, length 120
22:36:29.161224 IP 192.168.43.124.8880 > 192.168.43.146.7771: UDP, length 120
22:36:29.207298 IP 192.168.43.147.8880 > 192.168.43.124.7773: UDP, length 120
22:36:29.211223 IP 192.168.43.124.8880 > 192.168.43.146.7771: UDP, length 120
22:36:29.255846 IP 192.168.43.147.8880 > 192.168.43.124.7773: UDP, length 120
22:36:29.261224 IP 192.168.43.124.8880 > 192.168.43.146.7771: UDP, length 120
22:36:29.309234 IP 192.168.43.147.8880 > 192.168.43.124.7773: UDP, length 120
22:36:29.311220 IP 192.168.43.124.8880 > 192.168.43.146.7771: UDP, length 120
22:36:29.356593 IP 192.168.43.147.8880 > 192.168.43.124.7773: UDP, length 120
22:36:29.361221 IP 192.168.43.124.8880 > 192.168.43.146.7771: UDP, length 120
22:36:29.411169 IP 192.168.43.124.8880 > 192.168.43.146.7771: UDP, length 120
22:36:29.411389 IP 192.168.43.147.8880 > 192.168.43.124.7773: UDP, length 120
22:36:29.456289 IP 192.168.43.147.8880 > 192.168.43.124.7773: UDP, length 120
22:36:29.461222 IP 192.168.43.124.8880 > 192.168.43.146.7771: UDP, length 120
22:36:29.507402 IP 192.168.43.147.8880 > 192.168.43.124.7773: UDP, length 120
22:36:29.511222 IP 192.168.43.124.8880 > 192.168.43.146.7771: UDP, length 120
22:36:29.556839 IP 192.168.43.147.8880 > 192.168.43.124.7773: UDP, length 120
22:36:29.561172 IP 192.168.43.124.8880 > 192.168.43.146.7771: UDP, length 120
22:36:29.605577 IP 192.168.43.147.8880 > 192.168.43.124.7773: UDP, length 120
22:36:29.611174 IP 192.168.43.124.8880 > 192.168.43.146.7771: UDP, length 120
22:36:29.657589 IP 192.168.43.147.8880 > 192.168.43.124.7773: UDP, length 120
22:36:29.661173 IP 192.168.43.124.8880 > 192.168.43.146.7771: UDP, length 120
22:36:29.706417 IP 192.168.43.147.8880 > 192.168.43.124.7773: UDP, length 120
22:36:29.711174 IP 192.168.43.124.8880 > 192.168.43.146.7771: UDP, length 120
22:36:29.761118 IP 192.168.43.124.8880 > 192.168.43.146.7771: UDP, length 120
22:36:29.761169 IP 192.168.43.147.8880 > 192.168.43.124.7773: UDP, length 120
22:36:29.807023 IP 192.168.43.147.8880 > 192.168.43.124.7773: UDP, length 120
22:36:29.811172 IP 192.168.43.124.8880 > 192.168.43.146.7771: UDP, length 120
22:36:29.861215 IP 192.168.43.124.8880 > 192.168.43.146.7771: UDP, length 120
22:36:29.862126 IP 192.168.43.147.8880 > 192.168.43.124.7773: UDP, length 120
22:36:29.911145 IP 192.168.43.124.8880 > 192.168.43.146.7771: UDP, length 120
22:36:29.961212 IP 192.168.43.124.8880 > 192.168.43.146.7771: UDP, length 120
22:36:30.011119 IP 192.168.43.124.8880 > 192.168.43.146.7771: UDP, length 120
22:36:30.019198 IP 192.168.43.147.8880 > 192.168.43.124.7773: UDP, length 120
22:36:30.019217 IP 192.168.43.147.8880 > 192.168.43.124.7773: UDP, length 120
22:36:30.019219 IP 192.168.43.147.8880 > 192.168.43.124.7773: UDP, length 120
22:36:30.056219 IP 192.168.43.147.8880 > 192.168.43.124.7773: UDP, length 120
22:36:30.061106 IP 192.168.43.124.8880 > 192.168.43.146.7771: UDP, length 120
22:36:30.110315 IP 192.168.43.147.8880 > 192.168.43.124.7773: UDP, length 120
22:36:30.111158 IP 192.168.43.124.8880 > 192.168.43.146.7771: UDP, length 120
22:36:30.161172 IP 192.168.43.124.8880 > 192.168.43.146.7771: UDP, length 120
22:36:30.166151 IP 192.168.43.147.8880 > 192.168.43.124.7773: UDP, length 120
22:36:30.206191 IP 192.168.43.147.8880 > 192.168.43.124.7773: UDP, length 120
22:36:30.211173 IP 192.168.43.124.8880 > 192.168.43.146.7771: UDP, length 120
22:36:30.255822 IP 192.168.43.147.8880 > 192.168.43.124.7773: UDP, length 120
22:36:30.261173 IP 192.168.43.124.8880 > 192.168.43.146.7771: UDP, length 120
22:36:30.305741 IP 192.168.43.147.8880 > 192.168.43.124.7773: UDP, length 120
22:36:30.311173 IP 192.168.43.124.8880 > 192.168.43.146.7771: UDP, length 120
22:36:30.356527 IP 192.168.43.147.8880 > 192.168.43.124.7773: UDP, length 120
22:36:30.361172 IP 192.168.43.124.8880 > 192.168.43.146.7771: UDP, length 120
22:36:30.406134 IP 192.168.43.147.8880 > 192.168.43.124.7773: UDP, length 120
22:36:30.411173 IP 192.168.43.124.8880 > 192.168.43.146.7771: UDP, length 120
22:36:30.452977 IP 192.168.43.147.8880 > 192.168.43.124.7773: UDP, length 120
22:36:30.461171 IP 192.168.43.124.8880 > 192.168.43.146.7771: UDP, length 120
22:36:30.511171 IP 192.168.43.124.8880 > 192.168.43.146.7771: UDP, length 120
22:36:30.514185 IP 192.168.43.147.8880 > 192.168.43.124.7773: UDP, length 120
22:36:30.561170 IP 192.168.43.124.8880 > 192.168.43.146.7771: UDP, length 120
22:36:30.568438 IP 192.168.43.147.8880 > 192.168.43.124.7773: UDP, length 120
22:36:30.604293 IP 192.168.43.147.8880 > 192.168.43.124.7773: UDP, length 120
22:36:30.611125 IP 192.168.43.124.8880 > 192.168.43.146.7771: UDP, length 120
22:36:30.650814 IP 192.168.43.147.8880 > 192.168.43.124.7773: UDP, length 120
22:36:30.661174 IP 192.168.43.124.8880 > 192.168.43.146.7771: UDP, length 120
22:36:30.704596 IP 192.168.43.147.8880 > 192.168.43.124.7773: UDP, length 120
22:36:30.711172 IP 192.168.43.124.8880 > 192.168.43.146.7771: UDP, length 120
22:36:30.751289 IP 192.168.43.147.8880 > 192.168.43.124.7773: UDP, length 120
22:36:30.761174 IP 192.168.43.124.8880 > 192.168.43.146.7771: UDP, length 120
22:36:30.803972 IP 192.168.43.147.8880 > 192.168.43.124.7773: UDP, length 120
22:36:30.811122 IP 192.168.43.124.8880 > 192.168.43.146.7771: UDP, length 120
22:36:30.853758 IP 192.168.43.147.8880 > 192.168.43.124.7773: UDP, length 120
22:36:30.861174 IP 192.168.43.124.8880 > 192.168.43.146.7771: UDP, length 120
22:36:30.911170 IP 192.168.43.124.8880 > 192.168.43.146.7771: UDP, length 120
22:36:30.915445 IP 192.168.43.147.8880 > 192.168.43.124.7773: UDP, length 120
22:36:30.961115 IP 192.168.43.124.8880 > 192.168.43.146.7771: UDP, length 120
22:36:30.969454 IP 192.168.43.147.8880 > 192.168.43.124.7773: UDP, length 120
22:36:31.004724 IP 192.168.43.147.8880 > 192.168.43.124.7773: UDP, length 120
22:36:31.011215 IP 192.168.43.124.8880 > 192.168.43.146.7771: UDP, length 120
22:36:31.052725 IP 192.168.43.147.8880 > 192.168.43.124.7773: UDP, length 120
22:36:31.061221 IP 192.168.43.124.8880 > 192.168.43.146.7771: UDP, length 120
22:36:31.102400 IP 192.168.43.147.8880 > 192.168.43.124.7773: UDP, length 120
22:36:31.111171 IP 192.168.43.124.8880 > 192.168.43.146.7771: UDP, length 120
22:36:31.152576 IP 192.168.43.147.8880 > 192.168.43.124.7773: UDP, length 120
22:36:31.161180 IP 192.168.43.124.8880 > 192.168.43.146.7771: UDP, length 120
22:36:31.211176 IP 192.168.43.124.8880 > 192.168.43.146.7771: UDP, length 120
22:36:31.214579 IP 192.168.43.147.8880 > 192.168.43.124.7773: UDP, length 120
22:36:31.261177 IP 192.168.43.124.8880 > 192.168.43.146.7771: UDP, length 120
22:36:31.269140 IP 192.168.43.147.8880 > 192.168.43.124.7773: UDP, length 120
22:36:31.304447 IP 192.168.43.147.8880 > 192.168.43.124.7773: UDP, length 120
22:36:31.311223 IP 192.168.43.124.8880 > 192.168.43.146.7771: UDP, length 120
22:36:31.357692 IP 192.168.43.147.8880 > 192.168.43.124.7773: UDP, length 120
22:36:31.361175 IP 192.168.43.124.8880 > 192.168.43.146.7771: UDP, length 120
22:36:31.401276 IP 192.168.43.147.8880 > 192.168.43.124.7773: UDP, length 120
22:36:31.411172 IP 192.168.43.124.8880 > 192.168.43.146.7771: UDP, length 120
22:36:31.450791 IP 192.168.43.147.8880 > 192.168.43.124.7773: UDP, length 120
22:36:31.461175 IP 192.168.43.124.8880 > 192.168.43.146.7771: UDP, length 120
22:36:31.501518 IP 192.168.43.147.8880 > 192.168.43.124.7773: UDP, length 120
22:36:31.511173 IP 192.168.43.124.8880 > 192.168.43.146.7771: UDP, length 120
22:36:31.561170 IP 192.168.43.124.8880 > 192.168.43.146.7771: UDP, length 120
