00:53:52.188128 IP 192.168.43.146.8880 > 192.168.43.147.7772: UDP, length 120
00:53:52.237121 IP 192.168.43.146.8880 > 192.168.43.147.7772: UDP, length 120
00:53:52.285912 IP 192.168.43.146.8880 > 192.168.43.147.7772: UDP, length 120
00:53:52.336846 IP 192.168.43.146.8880 > 192.168.43.147.7772: UDP, length 120
00:53:52.385856 IP 192.168.43.146.8880 > 192.168.43.147.7772: UDP, length 120
00:53:52.442634 IP 192.168.43.146.8880 > 192.168.43.147.7772: UDP, length 120
00:53:52.484494 IP 192.168.43.146.8880 > 192.168.43.147.7772: UDP, length 120
00:53:52.539013 IP 192.168.43.146.8880 > 192.168.43.147.7772: UDP, length 120
00:53:52.586370 IP 192.168.43.147.8880 > 192.168.43.124.7773: UDP, length 120
00:53:52.587442 IP 192.168.43.146.8880 > 192.168.43.147.7772: UDP, length 120
00:53:52.636416 IP 192.168.43.147.8880 > 192.168.43.124.7773: UDP, length 120
00:53:52.638178 IP 192.168.43.146.8880 > 192.168.43.147.7772: UDP, length 120
00:53:52.686399 IP 192.168.43.147.8880 > 192.168.43.124.7773: UDP, length 120
00:53:52.689802 IP 192.168.43.146.8880 > 192.168.43.147.7772: UDP, length 120
00:53:52.736407 IP 192.168.43.147.8880 > 192.168.43.124.7773: UDP, length 120
00:53:52.739857 IP 192.168.43.146.8880 > 192.168.43.147.7772: UDP, length 120
00:53:52.786446 IP 192.168.43.147.8880 > 192.168.43.124.7773: UDP, length 120
00:53:52.789904 IP 192.168.43.146.8880 > 192.168.43.147.7772: UDP, length 120
00:53:52.836410 IP 192.168.43.147.8880 > 192.168.43.124.7773: UDP, length 120
00:53:52.837872 IP 192.168.43.146.8880 > 192.168.43.147.7772: UDP, length 120
00:53:52.886396 IP 192.168.43.147.8880 > 192.168.43.124.7773: UDP, length 120
00:53:52.889815 IP 192.168.43.146.8880 > 192.168.43.147.7772: UDP, length 120
00:53:52.936398 IP 192.168.43.147.8880 > 192.168.43.124.7773: UDP, length 120
00:53:52.939071 IP 192.168.43.146.8880 > 192.168.43.147.7772: UDP, length 120
00:53:52.986394 IP 192.168.43.147.8880 > 192.168.43.124.7773: UDP, length 120
00:53:53.000336 IP 192.168.43.146.8880 > 192.168.43.147.7772: UDP, length 120
00:53:53.036407 IP 192.168.43.147.8880 > 192.168.43.124.7773: UDP, length 120
00:53:53.043138 IP 192.168.43.146.8880 > 192.168.43.147.7772: UDP, length 120
00:53:53.086395 IP 192.168.43.147.8880 > 192.168.43.124.7773: UDP, length 120
00:53:53.094482 IP 192.168.43.146.8880 > 192.168.43.147.7772: UDP, length 120
00:53:53.136395 IP 192.168.43.147.8880 > 192.168.43.124.7773: UDP, length 120
00:53:53.139800 IP 192.168.43.146.8880 > 192.168.43.147.7772: UDP, length 120
00:53:53.186394 IP 192.168.43.147.8880 > 192.168.43.124.7773: UDP, length 120
00:53:53.193781 IP 192.168.43.146.8880 > 192.168.43.147.7772: UDP, length 120
00:53:53.236457 IP 192.168.43.147.8880 > 192.168.43.124.7773: UDP, length 120
00:53:53.262176 IP 192.168.43.146.8880 > 192.168.43.147.7772: UDP, length 120
00:53:53.286470 IP 192.168.43.147.8880 > 192.168.43.124.7773: UDP, length 120
00:53:53.287511 IP 192.168.43.146.8880 > 192.168.43.147.7772: UDP, length 120
00:53:53.336467 IP 192.168.43.147.8880 > 192.168.43.124.7773: UDP, length 120
00:53:53.338744 IP 192.168.43.146.8880 > 192.168.43.147.7772: UDP, length 120
00:53:53.386422 IP 192.168.43.147.8880 > 192.168.43.124.7773: UDP, length 120
00:53:53.389868 IP 192.168.43.146.8880 > 192.168.43.147.7772: UDP, length 120
00:53:53.436471 IP 192.168.43.147.8880 > 192.168.43.124.7773: UDP, length 120
00:53:53.439819 IP 192.168.43.146.8880 > 192.168.43.147.7772: UDP, length 120
00:53:53.486446 IP 192.168.43.147.8880 > 192.168.43.124.7773: UDP, length 120
00:53:53.510704 IP 192.168.43.146.8880 > 192.168.43.147.7772: UDP, length 120
00:53:53.536468 IP 192.168.43.147.8880 > 192.168.43.124.7773: UDP, length 120
00:53:53.541554 IP 192.168.43.146.8880 > 192.168.43.147.7772: UDP, length 120
00:53:53.586443 IP 192.168.43.147.8880 > 192.168.43.124.7773: UDP, length 120
00:53:53.604581 IP 192.168.43.146.8880 > 192.168.43.147.7772: UDP, length 120
00:53:53.636444 IP 192.168.43.147.8880 > 192.168.43.124.7773: UDP, length 120
00:53:53.643084 IP 192.168.43.146.8880 > 192.168.43.147.7772: UDP, length 120
00:53:53.686422 IP 192.168.43.147.8880 > 192.168.43.124.7773: UDP, length 120
00:53:53.692882 IP 192.168.43.146.8880 > 192.168.43.147.7772: UDP, length 120
00:53:53.736384 IP 192.168.43.147.8880 > 192.168.43.124.7773: UDP, length 120
00:53:53.756442 IP 192.168.43.146.8880 > 192.168.43.147.7772: UDP, length 120
00:53:53.786376 IP 192.168.43.147.8880 > 192.168.43.124.7773: UDP, length 120
00:53:53.816088 IP 192.168.43.146.8880 > 192.168.43.147.7772: UDP, length 120
00:53:53.836377 IP 192.168.43.147.8880 > 192.168.43.124.7773: UDP, length 120
00:53:53.847381 IP 192.168.43.146.8880 > 192.168.43.147.7772: UDP, length 120
00:53:53.886370 IP 192.168.43.147.8880 > 192.168.43.124.7773: UDP, length 120
00:53:53.899800 IP 192.168.43.146.8880 > 192.168.43.147.7772: UDP, length 120
00:53:53.936376 IP 192.168.43.147.8880 > 192.168.43.124.7773: UDP, length 120
00:53:53.942851 IP 192.168.43.146.8880 > 192.168.43.147.7772: UDP, length 120
00:53:53.986367 IP 192.168.43.147.8880 > 192.168.43.124.7773: UDP, length 120
00:53:54.002260 IP 192.168.43.146.8880 > 192.168.43.147.7772: UDP, length 120
00:53:54.036368 IP 192.168.43.147.8880 > 192.168.43.124.7773: UDP, length 120
00:53:54.041677 IP 192.168.43.146.8880 > 192.168.43.147.7772: UDP, length 120
00:53:54.086368 IP 192.168.43.147.8880 > 192.168.43.124.7773: UDP, length 120
00:53:54.100186 IP 192.168.43.146.8880 > 192.168.43.147.7772: UDP, length 120
00:53:54.136370 IP 192.168.43.147.8880 > 192.168.43.124.7773: UDP, length 120
00:53:54.173975 IP 192.168.43.146.8880 > 192.168.43.147.7772: UDP, length 120
00:53:54.186368 IP 192.168.43.147.8880 > 192.168.43.124.7773: UDP, length 120
00:53:54.209436 IP 192.168.43.146.8880 > 192.168.43.147.7772: UDP, length 120
00:53:54.236369 IP 192.168.43.147.8880 > 192.168.43.124.7773: UDP, length 120
00:53:54.244723 IP 192.168.43.146.8880 > 192.168.43.147.7772: UDP, length 120
00:53:54.286405 IP 192.168.43.147.8880 > 192.168.43.124.7773: UDP, length 120
00:53:54.326735 IP 192.168.43.146.8880 > 192.168.43.147.7772: UDP, length 120
00:53:54.335731 IP 192.168.43.146.8880 > 192.168.43.147.7772: UDP, length 120
00:53:54.336379 IP 192.168.43.147.8880 > 192.168.43.124.7773: UDP, length 120
00:53:54.386368 IP 192.168.43.147.8880 > 192.168.43.124.7773: UDP, length 120
00:53:54.388859 IP 192.168.43.146.8880 > 192.168.43.147.7772: UDP, length 120
00:53:54.436367 IP 192.168.43.147.8880 > 192.168.43.124.7773: UDP, length 120
00:53:54.439609 IP 192.168.43.146.8880 > 192.168.43.147.7772: UDP, length 120
00:53:54.486368 IP 192.168.43.147.8880 > 192.168.43.124.7773: UDP, length 120
00:53:54.515542 IP 192.168.43.146.8880 > 192.168.43.147.7772: UDP, length 120
00:53:54.534420 IP 192.168.43.146.8880 > 192.168.43.147.7772: UDP, length 120
00:53:54.536369 IP 192.168.43.147.8880 > 192.168.43.124.7773: UDP, length 120
00:53:54.586369 IP 192.168.43.147.8880 > 192.168.43.124.7773: UDP, length 120
00:53:54.614332 IP 192.168.43.146.8880 > 192.168.43.147.7772: UDP, length 120
00:53:54.635668 IP 192.168.43.146.8880 > 192.168.43.147.7772: UDP, length 120
00:53:54.636371 IP 192.168.43.147.8880 > 192.168.43.124.7773: UDP, length 120
00:53:54.686367 IP 192.168.43.147.8880 > 192.168.43.124.7773: UDP, length 120
00:53:54.733990 IP 192.168.43.146.8880 > 192.168.43.147.7772: UDP, length 120
00:53:54.735230 IP 192.168.43.146.8880 > 192.168.43.147.7772: UDP, length 120
00:53:54.736368 IP 192.168.43.147.8880 > 192.168.43.124.7773: UDP, length 120
00:53:54.786367 IP 192.168.43.147.8880 > 192.168.43.124.7773: UDP, length 120
00:53:54.787480 IP 192.168.43.146.8880 > 192.168.43.147.7772: UDP, length 120
00:53:54.836373 IP 192.168.43.147.8880 > 192.168.43.124.7773: UDP, length 120
00:53:54.836817 IP 192.168.43.146.8880 > 192.168.43.147.7772: UDP, length 120
00:53:54.886377 IP 192.168.43.147.8880 > 192.168.43.124.7773: UDP, length 120
00:53:54.889186 IP 192.168.43.146.8880 > 192.168.43.147.7772: UDP, length 120
00:53:54.936376 IP 192.168.43.147.8880 > 192.168.43.124.7773: UDP, length 120
00:53:54.939620 IP 192.168.43.146.8880 > 192.168.43.147.7772: UDP, length 120
00:53:54.986371 IP 192.168.43.147.8880 > 192.168.43.124.7773: UDP, length 120
00:53:54.991128 IP 192.168.43.146.8880 > 192.168.43.147.7772: UDP, length 120
00:53:55.036373 IP 192.168.43.147.8880 > 192.168.43.124.7773: UDP, length 120
00:53:55.039620 IP 192.168.43.146.8880 > 192.168.43.147.7772: UDP, length 120
00:53:55.086368 IP 192.168.43.147.8880 > 192.168.43.124.7773: UDP, length 120
00:53:55.092003 IP 192.168.43.146.8880 > 192.168.43.147.7772: UDP, length 120
00:53:55.136369 IP 192.168.43.147.8880 > 192.168.43.124.7773: UDP, length 120
00:53:55.139043 IP 192.168.43.146.8880 > 192.168.43.147.7772: UDP, length 120
00:53:55.186367 IP 192.168.43.147.8880 > 192.168.43.124.7773: UDP, length 120
00:53:55.194822 IP 192.168.43.146.8880 > 192.168.43.147.7772: UDP, length 120
00:53:55.235589 IP 192.168.43.146.8880 > 192.168.43.147.7772: UDP, length 120
00:53:55.236369 IP 192.168.43.147.8880 > 192.168.43.124.7773: UDP, length 120
00:53:55.286366 IP 192.168.43.147.8880 > 192.168.43.124.7773: UDP, length 120
00:53:55.296557 IP 192.168.43.146.8880 > 192.168.43.147.7772: UDP, length 120
00:53:55.336368 IP 192.168.43.147.8880 > 192.168.43.124.7773: UDP, length 120
00:53:55.345200 IP 192.168.43.146.8880 > 192.168.43.147.7772: UDP, length 120
00:53:55.386375 IP 192.168.43.147.8880 > 192.168.43.124.7773: UDP, length 120
00:53:55.403639 IP 192.168.43.146.8880 > 192.168.43.147.7772: UDP, length 120
00:53:55.436374 IP 192.168.43.147.8880 > 192.168.43.124.7773: UDP, length 120
00:53:55.445362 IP 192.168.43.146.8880 > 192.168.43.147.7772: UDP, length 120
00:53:55.486374 IP 192.168.43.147.8880 > 192.168.43.124.7773: UDP, length 120
00:53:55.489324 IP 192.168.43.146.8880 > 192.168.43.147.7772: UDP, length 120
00:53:55.536369 IP 192.168.43.147.8880 > 192.168.43.124.7773: UDP, length 120
00:53:55.562701 IP 192.168.43.146.8880 > 192.168.43.147.7772: UDP, length 120
00:53:55.586375 IP 192.168.43.147.8880 > 192.168.43.124.7773: UDP, length 120
00:53:55.587826 IP 192.168.43.146.8880 > 192.168.43.147.7772: UDP, length 120
00:53:55.632810 IP 192.168.43.146.8880 > 192.168.43.147.7772: UDP, length 120
00:53:55.636372 IP 192.168.43.147.8880 > 192.168.43.124.7773: UDP, length 120
00:53:55.685847 IP 192.168.43.146.8880 > 192.168.43.147.7772: UDP, length 120
00:53:55.686367 IP 192.168.43.147.8880 > 192.168.43.124.7773: UDP, length 120
00:53:55.736371 IP 192.168.43.147.8880 > 192.168.43.124.7773: UDP, length 120
00:53:55.736476 IP 192.168.43.146.8880 > 192.168.43.147.7772: UDP, length 120
00:53:55.786412 IP 192.168.43.147.8880 > 192.168.43.124.7773: UDP, length 120
00:53:55.786542 IP 192.168.43.146.8880 > 192.168.43.147.7772: UDP, length 120
00:53:55.836383 IP 192.168.43.147.8880 > 192.168.43.124.7773: UDP, length 120
00:53:55.836478 IP 192.168.43.146.8880 > 192.168.43.147.7772: UDP, length 120
00:53:55.886375 IP 192.168.43.147.8880 > 192.168.43.124.7773: UDP, length 120
00:53:55.888619 IP 192.168.43.146.8880 > 192.168.43.147.7772: UDP, length 120
00:53:55.936377 IP 192.168.43.147.8880 > 192.168.43.124.7773: UDP, length 120
00:53:55.937323 IP 192.168.43.146.8880 > 192.168.43.147.7772: UDP, length 120
00:53:55.986377 IP 192.168.43.147.8880 > 192.168.43.124.7773: UDP, length 120
00:53:55.986487 IP 192.168.43.146.8880 > 192.168.43.147.7772: UDP, length 120
00:53:56.036378 IP 192.168.43.147.8880 > 192.168.43.124.7773: UDP, length 120
00:53:56.083259 IP 192.168.43.146.8880 > 192.168.43.147.7772: UDP, length 120
00:53:56.086369 IP 192.168.43.147.8880 > 192.168.43.124.7773: UDP, length 120
00:53:56.100622 IP 192.168.43.146.8880 > 192.168.43.147.7772: UDP, length 120
00:53:56.136376 IP 192.168.43.147.8880 > 192.168.43.124.7773: UDP, length 120
00:53:56.136472 IP 192.168.43.146.8880 > 192.168.43.147.7772: UDP, length 120
00:53:56.186153 IP 192.168.43.146.8880 > 192.168.43.147.7772: UDP, length 120
00:53:56.186367 IP 192.168.43.147.8880 > 192.168.43.124.7773: UDP, length 120
00:53:56.236368 IP 192.168.43.147.8880 > 192.168.43.124.7773: UDP, length 120
00:53:56.238941 IP 192.168.43.146.8880 > 192.168.43.147.7772: UDP, length 120
00:53:56.286243 IP 192.168.43.146.8880 > 192.168.43.147.7772: UDP, length 120
00:53:56.286372 IP 192.168.43.147.8880 > 192.168.43.124.7773: UDP, length 120
00:53:56.336367 IP 192.168.43.147.8880 > 192.168.43.124.7773: UDP, length 120
00:53:56.339613 IP 192.168.43.146.8880 > 192.168.43.147.7772: UDP, length 120
00:53:56.386367 IP 192.168.43.147.8880 > 192.168.43.124.7773: UDP, length 120
00:53:56.389163 IP 192.168.43.146.8880 > 192.168.43.147.7772: UDP, length 120
00:53:56.436373 IP 192.168.43.147.8880 > 192.168.43.124.7773: UDP, length 120
00:53:56.443789 IP 192.168.43.146.8880 > 192.168.43.147.7772: UDP, length 120
00:53:56.485383 IP 192.168.43.146.8880 > 192.168.43.147.7772: UDP, length 120
00:53:56.486366 IP 192.168.43.147.8880 > 192.168.43.124.7773: UDP, length 120
00:53:56.535742 IP 192.168.43.146.8880 > 192.168.43.147.7772: UDP, length 120
00:53:56.536367 IP 192.168.43.147.8880 > 192.168.43.124.7773: UDP, length 120
00:53:56.582418 IP 192.168.43.146.8880 > 192.168.43.147.7772: UDP, length 120
00:53:56.586380 IP 192.168.43.147.8880 > 192.168.43.124.7773: UDP, length 120
00:53:56.635881 IP 192.168.43.146.8880 > 192.168.43.147.7772: UDP, length 120
00:53:56.636372 IP 192.168.43.147.8880 > 192.168.43.124.7773: UDP, length 120
00:53:56.685408 IP 192.168.43.146.8880 > 192.168.43.147.7772: UDP, length 120
00:53:56.686368 IP 192.168.43.147.8880 > 192.168.43.124.7773: UDP, length 120
00:53:56.735070 IP 192.168.43.146.8880 > 192.168.43.147.7772: UDP, length 120
00:53:56.736369 IP 192.168.43.147.8880 > 192.168.43.124.7773: UDP, length 120
00:53:56.786369 IP 192.168.43.147.8880 > 192.168.43.124.7773: UDP, length 120
00:53:56.786464 IP 192.168.43.146.8880 > 192.168.43.147.7772: UDP, length 120
00:53:56.836369 IP 192.168.43.147.8880 > 192.168.43.124.7773: UDP, length 120
00:53:56.852744 IP 192.168.43.146.8880 > 192.168.43.147.7772: UDP, length 120
00:53:56.886365 IP 192.168.43.147.8880 > 192.168.43.124.7773: UDP, length 120
00:53:56.887357 IP 192.168.43.146.8880 > 192.168.43.147.7772: UDP, length 120
00:53:56.934676 IP 192.168.43.146.8880 > 192.168.43.147.7772: UDP, length 120
00:53:56.936378 IP 192.168.43.147.8880 > 192.168.43.124.7773: UDP, length 120
00:53:56.984647 IP 192.168.43.146.8880 > 192.168.43.147.7772: UDP, length 120
00:53:56.986404 IP 192.168.43.147.8880 > 192.168.43.124.7773: UDP, length 120
00:53:57.036396 IP 192.168.43.147.8880 > 192.168.43.124.7773: UDP, length 120
00:53:57.037695 IP 192.168.43.146.8880 > 192.168.43.147.7772: UDP, length 120
00:53:57.086395 IP 192.168.43.147.8880 > 192.168.43.124.7773: UDP, length 120
00:53:57.087884 IP 192.168.43.146.8880 > 192.168.43.147.7772: UDP, length 120
00:53:57.136393 IP 192.168.43.147.8880 > 192.168.43.124.7773: UDP, length 120
00:53:57.139762 IP 192.168.43.146.8880 > 192.168.43.147.7772: UDP, length 120
00:53:57.185740 IP 192.168.43.146.8880 > 192.168.43.147.7772: UDP, length 120
00:53:57.186396 IP 192.168.43.147.8880 > 192.168.43.124.7773: UDP, length 120
00:53:57.236396 IP 192.168.43.147.8880 > 192.168.43.124.7773: UDP, length 120
00:53:57.238438 IP 192.168.43.146.8880 > 192.168.43.147.7772: UDP, length 120
00:53:57.286451 IP 192.168.43.147.8880 > 192.168.43.124.7773: UDP, length 120
00:53:57.289392 IP 192.168.43.146.8880 > 192.168.43.147.7772: UDP, length 120
00:53:57.336415 IP 192.168.43.147.8880 > 192.168.43.124.7773: UDP, length 120
00:53:57.340117 IP 192.168.43.146.8880 > 192.168.43.147.7772: UDP, length 120
00:53:57.386397 IP 192.168.43.147.8880 > 192.168.43.124.7773: UDP, length 120
00:53:57.387120 IP 192.168.43.146.8880 > 192.168.43.147.7772: UDP, length 120
00:53:57.436394 IP 192.168.43.147.8880 > 192.168.43.124.7773: UDP, length 120
00:53:57.443046 IP 192.168.43.146.8880 > 192.168.43.147.7772: UDP, length 120
00:53:57.484393 IP 192.168.43.146.8880 > 192.168.43.147.7772: UDP, length 120
00:53:57.486395 IP 192.168.43.147.8880 > 192.168.43.124.7773: UDP, length 120
00:53:57.536392 IP 192.168.43.147.8880 > 192.168.43.124.7773: UDP, length 120
00:53:57.538370 IP 192.168.43.146.8880 > 192.168.43.147.7772: UDP, length 120
00:53:57.586410 IP 192.168.43.147.8880 > 192.168.43.124.7773: UDP, length 120
00:53:57.589867 IP 192.168.43.146.8880 > 192.168.43.147.7772: UDP, length 120
00:53:57.636398 IP 192.168.43.147.8880 > 192.168.43.124.7773: UDP, length 120
00:53:57.650727 IP 192.168.43.146.8880 > 192.168.43.147.7772: UDP, length 120
00:53:57.686396 IP 192.168.43.147.8880 > 192.168.43.124.7773: UDP, length 120
00:53:57.705035 IP 192.168.43.146.8880 > 192.168.43.147.7772: UDP, length 120
00:53:57.736393 IP 192.168.43.147.8880 > 192.168.43.124.7773: UDP, length 120
00:53:57.739797 IP 192.168.43.146.8880 > 192.168.43.147.7772: UDP, length 120
00:53:57.786392 IP 192.168.43.147.8880 > 192.168.43.124.7773: UDP, length 120
00:53:57.791459 IP 192.168.43.146.8880 > 192.168.43.147.7772: UDP, length 120
00:53:57.836392 IP 192.168.43.147.8880 > 192.168.43.124.7773: UDP, length 120
00:53:57.856987 IP 192.168.43.146.8880 > 192.168.43.147.7772: UDP, length 120
00:53:57.886399 IP 192.168.43.147.8880 > 192.168.43.124.7773: UDP, length 120
00:53:57.886951 IP 192.168.43.146.8880 > 192.168.43.147.7772: UDP, length 120
00:53:57.936394 IP 192.168.43.147.8880 > 192.168.43.124.7773: UDP, length 120
00:53:57.986389 IP 192.168.43.147.8880 > 192.168.43.124.7773: UDP, length 120
00:53:57.996306 IP 192.168.43.146.8880 > 192.168.43.147.7772: UDP, length 120
00:53:58.011691 IP 192.168.43.146.8880 > 192.168.43.147.7772: UDP, length 120
00:53:58.036399 IP 192.168.43.147.8880 > 192.168.43.124.7773: UDP, length 120
00:53:58.046138 IP 192.168.43.146.8880 > 192.168.43.147.7772: UDP, length 120
00:53:58.086404 IP 192.168.43.147.8880 > 192.168.43.124.7773: UDP, length 120
00:53:58.086861 IP 192.168.43.146.8880 > 192.168.43.147.7772: UDP, length 120
00:53:58.136398 IP 192.168.43.147.8880 > 192.168.43.124.7773: UDP, length 120
00:53:58.142715 IP 192.168.43.146.8880 > 192.168.43.147.7772: UDP, length 120
00:53:58.184312 IP 192.168.43.146.8880 > 192.168.43.147.7772: UDP, length 120
00:53:58.186444 IP 192.168.43.147.8880 > 192.168.43.124.7773: UDP, length 120
00:53:58.235030 IP 192.168.43.146.8880 > 192.168.43.147.7772: UDP, length 120
00:53:58.236488 IP 192.168.43.147.8880 > 192.168.43.124.7773: UDP, length 120
00:53:58.286470 IP 192.168.43.147.8880 > 192.168.43.124.7773: UDP, length 120
00:53:58.305565 IP 192.168.43.146.8880 > 192.168.43.147.7772: UDP, length 120
00:53:58.333196 IP 192.168.43.146.8880 > 192.168.43.147.7772: UDP, length 120
00:53:58.336420 IP 192.168.43.147.8880 > 192.168.43.124.7773: UDP, length 120
00:53:58.386397 IP 192.168.43.147.8880 > 192.168.43.124.7773: UDP, length 120
00:53:58.389026 IP 192.168.43.146.8880 > 192.168.43.147.7772: UDP, length 120
00:53:58.436395 IP 192.168.43.147.8880 > 192.168.43.124.7773: UDP, length 120
00:53:58.441296 IP 192.168.43.146.8880 > 192.168.43.147.7772: UDP, length 120
00:53:58.484633 IP 192.168.43.146.8880 > 192.168.43.147.7772: UDP, length 120
00:53:58.486417 IP 192.168.43.147.8880 > 192.168.43.124.7773: UDP, length 120
00:53:58.536404 IP 192.168.43.147.8880 > 192.168.43.124.7773: UDP, length 120
00:53:58.537154 IP 192.168.43.146.8880 > 192.168.43.147.7772: UDP, length 120
00:53:58.584721 IP 192.168.43.146.8880 > 192.168.43.147.7772: UDP, length 120
00:53:58.586417 IP 192.168.43.147.8880 > 192.168.43.124.7773: UDP, length 120
00:53:58.636400 IP 192.168.43.147.8880 > 192.168.43.124.7773: UDP, length 120
00:53:58.645643 IP 192.168.43.146.8880 > 192.168.43.147.7772: UDP, length 120
00:53:58.684771 IP 192.168.43.146.8880 > 192.168.43.147.7772: UDP, length 120
00:53:58.686468 IP 192.168.43.147.8880 > 192.168.43.124.7773: UDP, length 120
00:53:58.734571 IP 192.168.43.146.8880 > 192.168.43.147.7772: UDP, length 120
00:53:58.736473 IP 192.168.43.147.8880 > 192.168.43.124.7773: UDP, length 120
00:53:58.784906 IP 192.168.43.146.8880 > 192.168.43.147.7772: UDP, length 120
00:53:58.786493 IP 192.168.43.147.8880 > 192.168.43.124.7773: UDP, length 120
00:53:58.836221 IP 192.168.43.146.8880 > 192.168.43.147.7772: UDP, length 120
00:53:58.836519 IP 192.168.43.147.8880 > 192.168.43.124.7773: UDP, length 120
00:53:58.886453 IP 192.168.43.147.8880 > 192.168.43.124.7773: UDP, length 120
00:53:58.886948 IP 192.168.43.146.8880 > 192.168.43.147.7772: UDP, length 120
00:53:58.936471 IP 192.168.43.147.8880 > 192.168.43.124.7773: UDP, length 120
00:53:58.937434 IP 192.168.43.146.8880 > 192.168.43.147.7772: UDP, length 120
00:53:58.984721 IP 192.168.43.146.8880 > 192.168.43.147.7772: UDP, length 120
00:53:58.986452 IP 192.168.43.147.8880 > 192.168.43.124.7773: UDP, length 120
00:53:59.034537 IP 192.168.43.146.8880 > 192.168.43.147.7772: UDP, length 120
00:53:59.039952 IP 192.168.43.147.8880 > 192.168.43.124.7773: UDP, length 120
00:53:59.084522 IP 192.168.43.146.8880 > 192.168.43.147.7772: UDP, length 120
00:53:59.086435 IP 192.168.43.147.8880 > 192.168.43.124.7773: UDP, length 120
00:53:59.136429 IP 192.168.43.147.8880 > 192.168.43.124.7773: UDP, length 120
00:53:59.151791 IP 192.168.43.146.8880 > 192.168.43.147.7772: UDP, length 120
00:53:59.186432 IP 192.168.43.147.8880 > 192.168.43.124.7773: UDP, length 120
00:53:59.191654 IP 192.168.43.146.8880 > 192.168.43.147.7772: UDP, length 120
00:53:59.236420 IP 192.168.43.147.8880 > 192.168.43.124.7773: UDP, length 120
00:53:59.239667 IP 192.168.43.146.8880 > 192.168.43.147.7772: UDP, length 120
00:53:59.286177 IP 192.168.43.146.8880 > 192.168.43.147.7772: UDP, length 120
00:53:59.286379 IP 192.168.43.147.8880 > 192.168.43.124.7773: UDP, length 120
00:53:59.336062 IP 192.168.43.146.8880 > 192.168.43.147.7772: UDP, length 120
00:53:59.336370 IP 192.168.43.147.8880 > 192.168.43.124.7773: UDP, length 120
00:53:59.386366 IP 192.168.43.147.8880 > 192.168.43.124.7773: UDP, length 120
00:53:59.421459 IP 192.168.43.146.8880 > 192.168.43.147.7772: UDP, length 120
00:53:59.436367 IP 192.168.43.147.8880 > 192.168.43.124.7773: UDP, length 120
00:53:59.439813 IP 192.168.43.146.8880 > 192.168.43.147.7772: UDP, length 120
00:53:59.486367 IP 192.168.43.147.8880 > 192.168.43.124.7773: UDP, length 120
00:53:59.489617 IP 192.168.43.146.8880 > 192.168.43.147.7772: UDP, length 120
00:53:59.536367 IP 192.168.43.147.8880 > 192.168.43.124.7773: UDP, length 120
00:53:59.539608 IP 192.168.43.146.8880 > 192.168.43.147.7772: UDP, length 120
00:53:59.586370 IP 192.168.43.147.8880 > 192.168.43.124.7773: UDP, length 120
00:53:59.590289 IP 192.168.43.146.8880 > 192.168.43.147.7772: UDP, length 120
00:53:59.636369 IP 192.168.43.147.8880 > 192.168.43.124.7773: UDP, length 120
00:53:59.636713 IP 192.168.43.146.8880 > 192.168.43.147.7772: UDP, length 120
00:53:59.684450 IP 192.168.43.146.8880 > 192.168.43.147.7772: UDP, length 120
00:53:59.686366 IP 192.168.43.147.8880 > 192.168.43.124.7773: UDP, length 120
00:53:59.734298 IP 192.168.43.146.8880 > 192.168.43.147.7772: UDP, length 120
00:53:59.736368 IP 192.168.43.147.8880 > 192.168.43.124.7773: UDP, length 120
00:53:59.784313 IP 192.168.43.146.8880 > 192.168.43.147.7772: UDP, length 120
00:53:59.786366 IP 192.168.43.147.8880 > 192.168.43.124.7773: UDP, length 120
00:53:59.836006 IP 192.168.43.146.8880 > 192.168.43.147.7772: UDP, length 120
00:53:59.836368 IP 192.168.43.147.8880 > 192.168.43.124.7773: UDP, length 120
00:53:59.884288 IP 192.168.43.146.8880 > 192.168.43.147.7772: UDP, length 120
00:53:59.886366 IP 192.168.43.147.8880 > 192.168.43.124.7773: UDP, length 120
00:53:59.936368 IP 192.168.43.147.8880 > 192.168.43.124.7773: UDP, length 120
00:53:59.953074 IP 192.168.43.146.8880 > 192.168.43.147.7772: UDP, length 120
00:53:59.986368 IP 192.168.43.147.8880 > 192.168.43.124.7773: UDP, length 120
00:53:59.996381 IP 192.168.43.146.8880 > 192.168.43.147.7772: UDP, length 120
00:54:00.036367 IP 192.168.43.147.8880 > 192.168.43.124.7773: UDP, length 120
00:54:00.040905 IP 192.168.43.146.8880 > 192.168.43.147.7772: UDP, length 120
00:54:00.086367 IP 192.168.43.147.8880 > 192.168.43.124.7773: UDP, length 120
00:54:00.088450 IP 192.168.43.146.8880 > 192.168.43.147.7772: UDP, length 120
00:54:00.136372 IP 192.168.43.147.8880 > 192.168.43.124.7773: UDP, length 120
00:54:00.138280 IP 192.168.43.146.8880 > 192.168.43.147.7772: UDP, length 120
00:54:00.183732 IP 192.168.43.146.8880 > 192.168.43.147.7772: UDP, length 120
00:54:00.186371 IP 192.168.43.147.8880 > 192.168.43.124.7773: UDP, length 120
00:54:00.234049 IP 192.168.43.146.8880 > 192.168.43.147.7772: UDP, length 120
00:54:00.236368 IP 192.168.43.147.8880 > 192.168.43.124.7773: UDP, length 120
00:54:00.286402 IP 192.168.43.147.8880 > 192.168.43.124.7773: UDP, length 120
00:54:00.286602 IP 192.168.43.146.8880 > 192.168.43.147.7772: UDP, length 120
00:54:00.334703 IP 192.168.43.146.8880 > 192.168.43.147.7772: UDP, length 120
00:54:00.336375 IP 192.168.43.147.8880 > 192.168.43.124.7773: UDP, length 120
00:54:00.386368 IP 192.168.43.147.8880 > 192.168.43.124.7773: UDP, length 120
00:54:00.389578 IP 192.168.43.146.8880 > 192.168.43.147.7772: UDP, length 120
00:54:00.436367 IP 192.168.43.147.8880 > 192.168.43.124.7773: UDP, length 120
00:54:00.447940 IP 192.168.43.146.8880 > 192.168.43.147.7772: UDP, length 120
00:54:00.484211 IP 192.168.43.146.8880 > 192.168.43.147.7772: UDP, length 120
00:54:00.486366 IP 192.168.43.147.8880 > 192.168.43.124.7773: UDP, length 120
00:54:00.536367 IP 192.168.43.147.8880 > 192.168.43.124.7773: UDP, length 120
00:54:00.539321 IP 192.168.43.146.8880 > 192.168.43.147.7772: UDP, length 120
00:54:00.586369 IP 192.168.43.147.8880 > 192.168.43.124.7773: UDP, length 120
00:54:00.587302 IP 192.168.43.146.8880 > 192.168.43.147.7772: UDP, length 120
00:54:00.635614 IP 192.168.43.146.8880 > 192.168.43.147.7772: UDP, length 120
00:54:00.636370 IP 192.168.43.147.8880 > 192.168.43.124.7773: UDP, length 120
00:54:00.686365 IP 192.168.43.147.8880 > 192.168.43.124.7773: UDP, length 120
00:54:00.686904 IP 192.168.43.146.8880 > 192.168.43.147.7772: UDP, length 120
00:54:00.734303 IP 192.168.43.146.8880 > 192.168.43.147.7772: UDP, length 120
00:54:00.736366 IP 192.168.43.147.8880 > 192.168.43.124.7773: UDP, length 120
00:54:00.784414 IP 192.168.43.146.8880 > 192.168.43.147.7772: UDP, length 120
00:54:00.786366 IP 192.168.43.147.8880 > 192.168.43.124.7773: UDP, length 120
00:54:00.836366 IP 192.168.43.147.8880 > 192.168.43.124.7773: UDP, length 120
00:54:00.837675 IP 192.168.43.146.8880 > 192.168.43.147.7772: UDP, length 120
00:54:00.886367 IP 192.168.43.147.8880 > 192.168.43.124.7773: UDP, length 120
00:54:00.886685 IP 192.168.43.146.8880 > 192.168.43.147.7772: UDP, length 120
00:54:00.934137 IP 192.168.43.146.8880 > 192.168.43.147.7772: UDP, length 120
00:54:00.936368 IP 192.168.43.147.8880 > 192.168.43.124.7773: UDP, length 120
00:54:00.986046 IP 192.168.43.146.8880 > 192.168.43.147.7772: UDP, length 120
00:54:00.986366 IP 192.168.43.147.8880 > 192.168.43.124.7773: UDP, length 120
00:54:01.032608 IP 192.168.43.146.8880 > 192.168.43.147.7772: UDP, length 120
00:54:01.036393 IP 192.168.43.147.8880 > 192.168.43.124.7773: UDP, length 120
00:54:01.084499 IP 192.168.43.146.8880 > 192.168.43.147.7772: UDP, length 120
00:54:01.086367 IP 192.168.43.147.8880 > 192.168.43.124.7773: UDP, length 120
00:54:01.136367 IP 192.168.43.147.8880 > 192.168.43.124.7773: UDP, length 120
00:54:01.160018 IP 192.168.43.146.8880 > 192.168.43.147.7772: UDP, length 120
00:54:01.184414 IP 192.168.43.146.8880 > 192.168.43.147.7772: UDP, length 120
00:54:01.186372 IP 192.168.43.147.8880 > 192.168.43.124.7773: UDP, length 120
00:54:01.232774 IP 192.168.43.146.8880 > 192.168.43.147.7772: UDP, length 120
00:54:01.236374 IP 192.168.43.147.8880 > 192.168.43.124.7773: UDP, length 120
00:54:01.282913 IP 192.168.43.146.8880 > 192.168.43.147.7772: UDP, length 120
00:54:01.286368 IP 192.168.43.147.8880 > 192.168.43.124.7773: UDP, length 120
00:54:01.336367 IP 192.168.43.147.8880 > 192.168.43.124.7773: UDP, length 120
00:54:01.337539 IP 192.168.43.146.8880 > 192.168.43.147.7772: UDP, length 120
00:54:01.383515 IP 192.168.43.146.8880 > 192.168.43.147.7772: UDP, length 120
00:54:01.386367 IP 192.168.43.147.8880 > 192.168.43.124.7773: UDP, length 120
00:54:01.436367 IP 192.168.43.147.8880 > 192.168.43.124.7773: UDP, length 120
00:54:01.441267 IP 192.168.43.146.8880 > 192.168.43.147.7772: UDP, length 120
00:54:01.486368 IP 192.168.43.147.8880 > 192.168.43.124.7773: UDP, length 120
00:54:01.489606 IP 192.168.43.146.8880 > 192.168.43.147.7772: UDP, length 120
00:54:01.536368 IP 192.168.43.147.8880 > 192.168.43.124.7773: UDP, length 120
00:54:01.538528 IP 192.168.43.146.8880 > 192.168.43.147.7772: UDP, length 120
00:54:01.586375 IP 192.168.43.147.8880 > 192.168.43.124.7773: UDP, length 120
00:54:01.586478 IP 192.168.43.146.8880 > 192.168.43.147.7772: UDP, length 120
00:54:01.634178 IP 192.168.43.146.8880 > 192.168.43.147.7772: UDP, length 120
00:54:01.636370 IP 192.168.43.147.8880 > 192.168.43.124.7773: UDP, length 120
00:54:01.684588 IP 192.168.43.146.8880 > 192.168.43.147.7772: UDP, length 120
00:54:01.686368 IP 192.168.43.147.8880 > 192.168.43.124.7773: UDP, length 120
00:54:01.736364 IP 192.168.43.147.8880 > 192.168.43.124.7773: UDP, length 120
00:54:01.740620 IP 192.168.43.146.8880 > 192.168.43.147.7772: UDP, length 120
00:54:01.784597 IP 192.168.43.146.8880 > 192.168.43.147.7772: UDP, length 120
00:54:01.786397 IP 192.168.43.147.8880 > 192.168.43.124.7773: UDP, length 120
00:54:01.834535 IP 192.168.43.146.8880 > 192.168.43.147.7772: UDP, length 120
00:54:01.836369 IP 192.168.43.147.8880 > 192.168.43.124.7773: UDP, length 120
00:54:01.886367 IP 192.168.43.147.8880 > 192.168.43.124.7773: UDP, length 120
00:54:01.886469 IP 192.168.43.146.8880 > 192.168.43.147.7772: UDP, length 120
00:54:01.935840 IP 192.168.43.146.8880 > 192.168.43.147.7772: UDP, length 120
00:54:01.936392 IP 192.168.43.147.8880 > 192.168.43.124.7773: UDP, length 120
00:54:01.985128 IP 192.168.43.146.8880 > 192.168.43.147.7772: UDP, length 120
00:54:01.986387 IP 192.168.43.147.8880 > 192.168.43.124.7773: UDP, length 120
00:54:02.036394 IP 192.168.43.147.8880 > 192.168.43.124.7773: UDP, length 120
00:54:02.038402 IP 192.168.43.146.8880 > 192.168.43.147.7772: UDP, length 120
00:54:02.086392 IP 192.168.43.147.8880 > 192.168.43.124.7773: UDP, length 120
00:54:02.087542 IP 192.168.43.146.8880 > 192.168.43.147.7772: UDP, length 120
00:54:02.133097 IP 192.168.43.146.8880 > 192.168.43.147.7772: UDP, length 120
00:54:02.136394 IP 192.168.43.147.8880 > 192.168.43.124.7773: UDP, length 120
00:54:02.186396 IP 192.168.43.147.8880 > 192.168.43.124.7773: UDP, length 120
00:54:02.186559 IP 192.168.43.146.8880 > 192.168.43.147.7772: UDP, length 120
00:54:02.236395 IP 192.168.43.147.8880 > 192.168.43.124.7773: UDP, length 120
00:54:02.239817 IP 192.168.43.146.8880 > 192.168.43.147.7772: UDP, length 120
00:54:02.286410 IP 192.168.43.147.8880 > 192.168.43.124.7773: UDP, length 120
00:54:02.286593 IP 192.168.43.146.8880 > 192.168.43.147.7772: UDP, length 120
00:54:02.333700 IP 192.168.43.146.8880 > 192.168.43.147.7772: UDP, length 120
00:54:02.336403 IP 192.168.43.147.8880 > 192.168.43.124.7773: UDP, length 120
00:54:02.386392 IP 192.168.43.147.8880 > 192.168.43.124.7773: UDP, length 120
00:54:02.388743 IP 192.168.43.146.8880 > 192.168.43.147.7772: UDP, length 120
00:54:02.436392 IP 192.168.43.147.8880 > 192.168.43.124.7773: UDP, length 120
00:54:02.445310 IP 192.168.43.146.8880 > 192.168.43.147.7772: UDP, length 120
00:54:02.485231 IP 192.168.43.146.8880 > 192.168.43.147.7772: UDP, length 120
00:54:02.486389 IP 192.168.43.147.8880 > 192.168.43.124.7773: UDP, length 120
00:54:02.536398 IP 192.168.43.147.8880 > 192.168.43.124.7773: UDP, length 120
00:54:02.536586 IP 192.168.43.146.8880 > 192.168.43.147.7772: UDP, length 120
00:54:02.586395 IP 192.168.43.147.8880 > 192.168.43.124.7773: UDP, length 120
00:54:02.605888 IP 192.168.43.146.8880 > 192.168.43.147.7772: UDP, length 120
00:54:02.636403 IP 192.168.43.147.8880 > 192.168.43.124.7773: UDP, length 120
00:54:02.639850 IP 192.168.43.146.8880 > 192.168.43.147.7772: UDP, length 120
00:54:02.686392 IP 192.168.43.147.8880 > 192.168.43.124.7773: UDP, length 120
00:54:02.703445 IP 192.168.43.146.8880 > 192.168.43.147.7772: UDP, length 120
00:54:02.736392 IP 192.168.43.147.8880 > 192.168.43.124.7773: UDP, length 120
00:54:02.748870 IP 192.168.43.146.8880 > 192.168.43.147.7772: UDP, length 120
00:54:02.786393 IP 192.168.43.147.8880 > 192.168.43.124.7773: UDP, length 120
00:54:02.786623 IP 192.168.43.146.8880 > 192.168.43.147.7772: UDP, length 120
00:54:02.836392 IP 192.168.43.147.8880 > 192.168.43.124.7773: UDP, length 120
00:54:02.862303 IP 192.168.43.146.8880 > 192.168.43.147.7772: UDP, length 120
00:54:02.886392 IP 192.168.43.147.8880 > 192.168.43.124.7773: UDP, length 120
00:54:02.932443 IP 192.168.43.146.8880 > 192.168.43.147.7772: UDP, length 120
00:54:02.932672 IP 192.168.43.146.8880 > 192.168.43.147.7772: UDP, length 120
00:54:02.936394 IP 192.168.43.147.8880 > 192.168.43.124.7773: UDP, length 120
00:54:02.986394 IP 192.168.43.147.8880 > 192.168.43.124.7773: UDP, length 120
00:54:02.989793 IP 192.168.43.146.8880 > 192.168.43.147.7772: UDP, length 120
00:54:03.035179 IP 192.168.43.146.8880 > 192.168.43.147.7772: UDP, length 120
00:54:03.036393 IP 192.168.43.147.8880 > 192.168.43.124.7773: UDP, length 120
00:54:03.086393 IP 192.168.43.147.8880 > 192.168.43.124.7773: UDP, length 120
00:54:03.118358 IP 192.168.43.146.8880 > 192.168.43.147.7772: UDP, length 120
00:54:03.131500 IP 192.168.43.146.8880 > 192.168.43.147.7772: UDP, length 120
00:54:03.136392 IP 192.168.43.147.8880 > 192.168.43.124.7773: UDP, length 120
00:54:03.186393 IP 192.168.43.147.8880 > 192.168.43.124.7773: UDP, length 120
00:54:03.199671 IP 192.168.43.146.8880 > 192.168.43.147.7772: UDP, length 120
00:54:03.236395 IP 192.168.43.147.8880 > 192.168.43.124.7773: UDP, length 120
00:54:03.240557 IP 192.168.43.146.8880 > 192.168.43.147.7772: UDP, length 120
00:54:03.286439 IP 192.168.43.147.8880 > 192.168.43.124.7773: UDP, length 120
00:54:03.286932 IP 192.168.43.146.8880 > 192.168.43.147.7772: UDP, length 120
00:54:03.336068 IP 192.168.43.146.8880 > 192.168.43.147.7772: UDP, length 120
00:54:03.336413 IP 192.168.43.147.8880 > 192.168.43.124.7773: UDP, length 120
00:54:03.384493 IP 192.168.43.146.8880 > 192.168.43.147.7772: UDP, length 120
00:54:03.386394 IP 192.168.43.147.8880 > 192.168.43.124.7773: UDP, length 120
00:54:03.436392 IP 192.168.43.147.8880 > 192.168.43.124.7773: UDP, length 120
00:54:03.439795 IP 192.168.43.146.8880 > 192.168.43.147.7772: UDP, length 120
00:54:03.486391 IP 192.168.43.147.8880 > 192.168.43.124.7773: UDP, length 120
00:54:03.487295 IP 192.168.43.146.8880 > 192.168.43.147.7772: UDP, length 120
00:54:03.536394 IP 192.168.43.147.8880 > 192.168.43.124.7773: UDP, length 120
00:54:03.546329 IP 192.168.43.146.8880 > 192.168.43.147.7772: UDP, length 120
00:54:03.585938 IP 192.168.43.146.8880 > 192.168.43.147.7772: UDP, length 120
00:54:03.586414 IP 192.168.43.147.8880 > 192.168.43.124.7773: UDP, length 120
00:54:03.636398 IP 192.168.43.147.8880 > 192.168.43.124.7773: UDP, length 120
00:54:03.639430 IP 192.168.43.146.8880 > 192.168.43.147.7772: UDP, length 120
00:54:03.686393 IP 192.168.43.147.8880 > 192.168.43.124.7773: UDP, length 120
00:54:03.695229 IP 192.168.43.146.8880 > 192.168.43.147.7772: UDP, length 120
00:54:03.736392 IP 192.168.43.147.8880 > 192.168.43.124.7773: UDP, length 120
00:54:03.742115 IP 192.168.43.146.8880 > 192.168.43.147.7772: UDP, length 120
00:54:03.786393 IP 192.168.43.147.8880 > 192.168.43.124.7773: UDP, length 120
00:54:03.834481 IP 192.168.43.146.8880 > 192.168.43.147.7772: UDP, length 120
00:54:03.834602 IP 192.168.43.146.8880 > 192.168.43.147.7772: UDP, length 120
00:54:03.836403 IP 192.168.43.147.8880 > 192.168.43.124.7773: UDP, length 120
00:54:03.886392 IP 192.168.43.147.8880 > 192.168.43.124.7773: UDP, length 120
00:54:03.898384 IP 192.168.43.146.8880 > 192.168.43.147.7772: UDP, length 120
00:54:03.936393 IP 192.168.43.147.8880 > 192.168.43.124.7773: UDP, length 120
00:54:03.938429 IP 192.168.43.146.8880 > 192.168.43.147.7772: UDP, length 120
00:54:03.986392 IP 192.168.43.147.8880 > 192.168.43.124.7773: UDP, length 120
00:54:04.015140 IP 192.168.43.146.8880 > 192.168.43.147.7772: UDP, length 120
00:54:04.036394 IP 192.168.43.147.8880 > 192.168.43.124.7773: UDP, length 120
00:54:04.048264 IP 192.168.43.146.8880 > 192.168.43.147.7772: UDP, length 120
00:54:04.086393 IP 192.168.43.147.8880 > 192.168.43.124.7773: UDP, length 120
00:54:04.136391 IP 192.168.43.147.8880 > 192.168.43.124.7773: UDP, length 120
00:54:04.139790 IP 192.168.43.146.8880 > 192.168.43.147.7772: UDP, length 120
00:54:04.152773 IP 192.168.43.146.8880 > 192.168.43.147.7772: UDP, length 120
00:54:04.186394 IP 192.168.43.147.8880 > 192.168.43.124.7773: UDP, length 120
00:54:04.218902 IP 192.168.43.146.8880 > 192.168.43.147.7772: UDP, length 120
00:54:04.236524 IP 192.168.43.147.8880 > 192.168.43.124.7773: UDP, length 120
00:54:04.237590 IP 192.168.43.146.8880 > 192.168.43.147.7772: UDP, length 120
00:54:04.286493 IP 192.168.43.147.8880 > 192.168.43.124.7773: UDP, length 120
00:54:04.292817 IP 192.168.43.146.8880 > 192.168.43.147.7772: UDP, length 120
00:54:04.336441 IP 192.168.43.147.8880 > 192.168.43.124.7773: UDP, length 120
00:54:04.346138 IP 192.168.43.146.8880 > 192.168.43.147.7772: UDP, length 120
00:54:04.386439 IP 192.168.43.147.8880 > 192.168.43.124.7773: UDP, length 120
00:54:04.388955 IP 192.168.43.146.8880 > 192.168.43.147.7772: UDP, length 120
00:54:04.436463 IP 192.168.43.147.8880 > 192.168.43.124.7773: UDP, length 120
00:54:04.447377 IP 192.168.43.146.8880 > 192.168.43.147.7772: UDP, length 120
00:54:04.486449 IP 192.168.43.147.8880 > 192.168.43.124.7773: UDP, length 120
00:54:04.486706 IP 192.168.43.146.8880 > 192.168.43.147.7772: UDP, length 120
00:54:04.536437 IP 192.168.43.147.8880 > 192.168.43.124.7773: UDP, length 120
00:54:04.547927 IP 192.168.43.146.8880 > 192.168.43.147.7772: UDP, length 120
00:54:04.586440 IP 192.168.43.147.8880 > 192.168.43.124.7773: UDP, length 120
00:54:04.587431 IP 192.168.43.146.8880 > 192.168.43.147.7772: UDP, length 120
00:54:04.636441 IP 192.168.43.147.8880 > 192.168.43.124.7773: UDP, length 120
00:54:04.666879 IP 192.168.43.146.8880 > 192.168.43.147.7772: UDP, length 120
00:54:04.686407 IP 192.168.43.147.8880 > 192.168.43.124.7773: UDP, length 120
00:54:04.689650 IP 192.168.43.146.8880 > 192.168.43.147.7772: UDP, length 120
00:54:04.736373 IP 192.168.43.147.8880 > 192.168.43.124.7773: UDP, length 120
00:54:04.755055 IP 192.168.43.146.8880 > 192.168.43.147.7772: UDP, length 120
00:54:04.786406 IP 192.168.43.147.8880 > 192.168.43.124.7773: UDP, length 120
00:54:04.790174 IP 192.168.43.146.8880 > 192.168.43.147.7772: UDP, length 120
00:54:04.836378 IP 192.168.43.147.8880 > 192.168.43.124.7773: UDP, length 120
00:54:04.872843 IP 192.168.43.146.8880 > 192.168.43.147.7772: UDP, length 120
00:54:04.886368 IP 192.168.43.147.8880 > 192.168.43.124.7773: UDP, length 120
00:54:04.936367 IP 192.168.43.147.8880 > 192.168.43.124.7773: UDP, length 120
00:54:04.937430 IP 192.168.43.146.8880 > 192.168.43.147.7772: UDP, length 120
00:54:04.962132 IP 192.168.43.146.8880 > 192.168.43.147.7772: UDP, length 120
00:54:04.984394 IP 192.168.43.146.8880 > 192.168.43.147.7772: UDP, length 120
00:54:04.986368 IP 192.168.43.147.8880 > 192.168.43.124.7773: UDP, length 120
00:54:05.036366 IP 192.168.43.147.8880 > 192.168.43.124.7773: UDP, length 120
00:54:05.066056 IP 192.168.43.146.8880 > 192.168.43.147.7772: UDP, length 120
00:54:05.084451 IP 192.168.43.146.8880 > 192.168.43.147.7772: UDP, length 120
00:54:05.086366 IP 192.168.43.147.8880 > 192.168.43.124.7773: UDP, length 120
00:54:05.136367 IP 192.168.43.147.8880 > 192.168.43.124.7773: UDP, length 120
00:54:05.166730 IP 192.168.43.146.8880 > 192.168.43.147.7772: UDP, length 120
