03:06:46.873422 IP 192.168.43.124.8880 > 192.168.43.146.7771: UDP, length 120
03:06:46.913721 IP 192.168.43.124.8880 > 192.168.43.146.7771: UDP, length 120
03:06:46.974441 IP 192.168.43.124.8880 > 192.168.43.146.7771: UDP, length 120
03:06:47.013714 IP 192.168.43.124.8880 > 192.168.43.146.7771: UDP, length 120
03:06:47.179491 IP 192.168.43.124.8880 > 192.168.43.146.7771: UDP, length 120
03:06:47.179647 IP 192.168.43.124.8880 > 192.168.43.146.7771: UDP, length 120
03:06:47.179766 IP 192.168.43.124.8880 > 192.168.43.146.7771: UDP, length 120
03:06:47.225136 IP 192.168.43.124.8880 > 192.168.43.146.7771: UDP, length 120
03:06:47.263721 IP 192.168.43.124.8880 > 192.168.43.146.7771: UDP, length 120
03:06:47.310754 IP 192.168.43.124.8880 > 192.168.43.146.7771: UDP, length 120
03:06:47.328876 IP 192.168.43.146.8880 > 192.168.43.147.7772: UDP, length 120
03:06:47.373638 IP 192.168.43.124.8880 > 192.168.43.146.7771: UDP, length 120
03:06:47.378918 IP 192.168.43.146.8880 > 192.168.43.147.7772: UDP, length 120
03:06:47.428924 IP 192.168.43.146.8880 > 192.168.43.147.7772: UDP, length 120
03:06:47.478961 IP 192.168.43.146.8880 > 192.168.43.147.7772: UDP, length 120
03:06:47.528192 IP 192.168.43.124.8880 > 192.168.43.146.7771: UDP, length 120
03:06:47.528334 IP 192.168.43.124.8880 > 192.168.43.146.7771: UDP, length 120
03:06:47.528406 IP 192.168.43.124.8880 > 192.168.43.146.7771: UDP, length 120
03:06:47.528912 IP 192.168.43.146.8880 > 192.168.43.147.7772: UDP, length 120
03:06:47.566729 IP 192.168.43.124.8880 > 192.168.43.146.7771: UDP, length 120
03:06:47.578902 IP 192.168.43.146.8880 > 192.168.43.147.7772: UDP, length 120
03:06:47.613814 IP 192.168.43.124.8880 > 192.168.43.146.7771: UDP, length 120
03:06:47.628934 IP 192.168.43.146.8880 > 192.168.43.147.7772: UDP, length 120
03:06:47.673846 IP 192.168.43.124.8880 > 192.168.43.146.7771: UDP, length 120
03:06:47.678928 IP 192.168.43.146.8880 > 192.168.43.147.7772: UDP, length 120
03:06:47.714083 IP 192.168.43.124.8880 > 192.168.43.146.7771: UDP, length 120
03:06:47.728927 IP 192.168.43.146.8880 > 192.168.43.147.7772: UDP, length 120
03:06:47.778921 IP 192.168.43.146.8880 > 192.168.43.147.7772: UDP, length 120
03:06:47.828933 IP 192.168.43.146.8880 > 192.168.43.147.7772: UDP, length 120
03:06:47.878926 IP 192.168.43.146.8880 > 192.168.43.147.7772: UDP, length 120
03:06:47.883358 IP 192.168.43.124.8880 > 192.168.43.146.7771: UDP, length 120
03:06:47.884880 IP 192.168.43.124.8880 > 192.168.43.146.7771: UDP, length 120
03:06:47.884991 IP 192.168.43.124.8880 > 192.168.43.146.7771: UDP, length 120
03:06:47.914038 IP 192.168.43.124.8880 > 192.168.43.146.7771: UDP, length 120
03:06:47.928924 IP 192.168.43.146.8880 > 192.168.43.147.7772: UDP, length 120
03:06:47.964041 IP 192.168.43.124.8880 > 192.168.43.146.7771: UDP, length 120
03:06:47.978922 IP 192.168.43.146.8880 > 192.168.43.147.7772: UDP, length 120
03:06:48.026253 IP 192.168.43.124.8880 > 192.168.43.146.7771: UDP, length 120
03:06:48.028921 IP 192.168.43.146.8880 > 192.168.43.147.7772: UDP, length 120
03:06:48.063860 IP 192.168.43.124.8880 > 192.168.43.146.7771: UDP, length 120
03:06:48.078923 IP 192.168.43.146.8880 > 192.168.43.147.7772: UDP, length 120
03:06:48.128921 IP 192.168.43.146.8880 > 192.168.43.147.7772: UDP, length 120
03:06:48.178921 IP 192.168.43.146.8880 > 192.168.43.147.7772: UDP, length 120
03:06:48.224017 IP 192.168.43.124.8880 > 192.168.43.146.7771: UDP, length 120
03:06:48.224245 IP 192.168.43.124.8880 > 192.168.43.146.7771: UDP, length 120
03:06:48.224365 IP 192.168.43.124.8880 > 192.168.43.146.7771: UDP, length 120
03:06:48.228922 IP 192.168.43.146.8880 > 192.168.43.147.7772: UDP, length 120
03:06:48.274609 IP 192.168.43.124.8880 > 192.168.43.146.7771: UDP, length 120
03:06:48.278924 IP 192.168.43.146.8880 > 192.168.43.147.7772: UDP, length 120
03:06:48.313857 IP 192.168.43.124.8880 > 192.168.43.146.7771: UDP, length 120
03:06:48.328924 IP 192.168.43.146.8880 > 192.168.43.147.7772: UDP, length 120
03:06:48.363772 IP 192.168.43.124.8880 > 192.168.43.146.7771: UDP, length 120
03:06:48.378923 IP 192.168.43.146.8880 > 192.168.43.147.7772: UDP, length 120
03:06:48.423526 IP 192.168.43.124.8880 > 192.168.43.146.7771: UDP, length 120
03:06:48.428938 IP 192.168.43.146.8880 > 192.168.43.147.7772: UDP, length 120
03:06:48.480261 IP 192.168.43.146.8880 > 192.168.43.147.7772: UDP, length 120
03:06:48.528994 IP 192.168.43.146.8880 > 192.168.43.147.7772: UDP, length 120
03:06:48.572395 IP 192.168.43.124.8880 > 192.168.43.146.7771: UDP, length 120
03:06:48.572613 IP 192.168.43.124.8880 > 192.168.43.146.7771: UDP, length 120
03:06:48.572726 IP 192.168.43.124.8880 > 192.168.43.146.7771: UDP, length 120
03:06:48.578939 IP 192.168.43.146.8880 > 192.168.43.147.7772: UDP, length 120
03:06:48.628925 IP 192.168.43.146.8880 > 192.168.43.147.7772: UDP, length 120
03:06:48.632337 IP 192.168.43.124.8880 > 192.168.43.146.7771: UDP, length 120
03:06:48.664779 IP 192.168.43.124.8880 > 192.168.43.146.7771: UDP, length 120
03:06:48.678923 IP 192.168.43.146.8880 > 192.168.43.147.7772: UDP, length 120
03:06:48.715203 IP 192.168.43.124.8880 > 192.168.43.146.7771: UDP, length 120
03:06:48.728924 IP 192.168.43.146.8880 > 192.168.43.147.7772: UDP, length 120
03:06:48.778975 IP 192.168.43.146.8880 > 192.168.43.147.7772: UDP, length 120
03:06:48.782052 IP 192.168.43.124.8880 > 192.168.43.146.7771: UDP, length 120
03:06:48.829000 IP 192.168.43.146.8880 > 192.168.43.147.7772: UDP, length 120
03:06:48.879012 IP 192.168.43.146.8880 > 192.168.43.147.7772: UDP, length 120
03:06:48.928966 IP 192.168.43.146.8880 > 192.168.43.147.7772: UDP, length 120
03:06:48.932006 IP 192.168.43.124.8880 > 192.168.43.146.7771: UDP, length 120
03:06:48.932124 IP 192.168.43.124.8880 > 192.168.43.146.7771: UDP, length 120
03:06:48.932196 IP 192.168.43.124.8880 > 192.168.43.146.7771: UDP, length 120
03:06:48.963880 IP 192.168.43.124.8880 > 192.168.43.146.7771: UDP, length 120
03:06:48.978967 IP 192.168.43.146.8880 > 192.168.43.147.7772: UDP, length 120
03:06:49.013564 IP 192.168.43.124.8880 > 192.168.43.146.7771: UDP, length 120
03:06:49.028972 IP 192.168.43.146.8880 > 192.168.43.147.7772: UDP, length 120
03:06:49.074112 IP 192.168.43.124.8880 > 192.168.43.146.7771: UDP, length 120
03:06:49.078989 IP 192.168.43.146.8880 > 192.168.43.147.7772: UDP, length 120
03:06:49.113979 IP 192.168.43.124.8880 > 192.168.43.146.7771: UDP, length 120
03:06:49.128989 IP 192.168.43.146.8880 > 192.168.43.147.7772: UDP, length 120
03:06:49.178979 IP 192.168.43.146.8880 > 192.168.43.147.7772: UDP, length 120
03:06:49.228978 IP 192.168.43.146.8880 > 192.168.43.147.7772: UDP, length 120
03:06:49.278935 IP 192.168.43.146.8880 > 192.168.43.147.7772: UDP, length 120
03:06:49.283004 IP 192.168.43.124.8880 > 192.168.43.146.7771: UDP, length 120
03:06:49.283143 IP 192.168.43.124.8880 > 192.168.43.146.7771: UDP, length 120
03:06:49.283214 IP 192.168.43.124.8880 > 192.168.43.146.7771: UDP, length 120
03:06:49.314030 IP 192.168.43.124.8880 > 192.168.43.146.7771: UDP, length 120
03:06:49.328908 IP 192.168.43.146.8880 > 192.168.43.147.7772: UDP, length 120
03:06:49.375413 IP 192.168.43.124.8880 > 192.168.43.146.7771: UDP, length 120
03:06:49.378898 IP 192.168.43.146.8880 > 192.168.43.147.7772: UDP, length 120
03:06:49.413998 IP 192.168.43.124.8880 > 192.168.43.146.7771: UDP, length 120
03:06:49.428915 IP 192.168.43.146.8880 > 192.168.43.147.7772: UDP, length 120
03:06:49.463591 IP 192.168.43.124.8880 > 192.168.43.146.7771: UDP, length 120
03:06:49.478911 IP 192.168.43.146.8880 > 192.168.43.147.7772: UDP, length 120
03:06:49.523973 IP 192.168.43.124.8880 > 192.168.43.146.7771: UDP, length 120
03:06:49.528937 IP 192.168.43.146.8880 > 192.168.43.147.7772: UDP, length 120
03:06:49.564821 IP 192.168.43.124.8880 > 192.168.43.146.7771: UDP, length 120
03:06:49.578901 IP 192.168.43.146.8880 > 192.168.43.147.7772: UDP, length 120
03:06:49.613892 IP 192.168.43.124.8880 > 192.168.43.146.7771: UDP, length 120
03:06:49.628901 IP 192.168.43.146.8880 > 192.168.43.147.7772: UDP, length 120
03:06:49.673683 IP 192.168.43.124.8880 > 192.168.43.146.7771: UDP, length 120
03:06:49.678897 IP 192.168.43.146.8880 > 192.168.43.147.7772: UDP, length 120
03:06:49.713711 IP 192.168.43.124.8880 > 192.168.43.146.7771: UDP, length 120
03:06:49.728897 IP 192.168.43.146.8880 > 192.168.43.147.7772: UDP, length 120
03:06:49.767246 IP 192.168.43.124.8880 > 192.168.43.146.7771: UDP, length 120
03:06:49.778895 IP 192.168.43.146.8880 > 192.168.43.147.7772: UDP, length 120
03:06:49.816313 IP 192.168.43.124.8880 > 192.168.43.146.7771: UDP, length 120
03:06:49.828896 IP 192.168.43.146.8880 > 192.168.43.147.7772: UDP, length 120
03:06:49.878896 IP 192.168.43.146.8880 > 192.168.43.147.7772: UDP, length 120
03:06:49.882258 IP 192.168.43.124.8880 > 192.168.43.146.7771: UDP, length 120
03:06:49.914011 IP 192.168.43.124.8880 > 192.168.43.146.7771: UDP, length 120
03:06:49.928901 IP 192.168.43.146.8880 > 192.168.43.147.7772: UDP, length 120
03:06:49.963687 IP 192.168.43.124.8880 > 192.168.43.146.7771: UDP, length 120
03:06:49.978902 IP 192.168.43.146.8880 > 192.168.43.147.7772: UDP, length 120
03:06:50.023510 IP 192.168.43.124.8880 > 192.168.43.146.7771: UDP, length 120
03:06:50.028896 IP 192.168.43.146.8880 > 192.168.43.147.7772: UDP, length 120
03:06:50.063716 IP 192.168.43.124.8880 > 192.168.43.146.7771: UDP, length 120
03:06:50.078897 IP 192.168.43.146.8880 > 192.168.43.147.7772: UDP, length 120
03:06:50.113711 IP 192.168.43.124.8880 > 192.168.43.146.7771: UDP, length 120
03:06:50.128897 IP 192.168.43.146.8880 > 192.168.43.147.7772: UDP, length 120
03:06:50.175281 IP 192.168.43.124.8880 > 192.168.43.146.7771: UDP, length 120
03:06:50.178898 IP 192.168.43.146.8880 > 192.168.43.147.7772: UDP, length 120
03:06:50.213882 IP 192.168.43.124.8880 > 192.168.43.146.7771: UDP, length 120
03:06:50.228898 IP 192.168.43.146.8880 > 192.168.43.147.7772: UDP, length 120
03:06:50.268451 IP 192.168.43.124.8880 > 192.168.43.146.7771: UDP, length 120
03:06:50.278896 IP 192.168.43.146.8880 > 192.168.43.147.7772: UDP, length 120
03:06:50.324733 IP 192.168.43.124.8880 > 192.168.43.146.7771: UDP, length 120
03:06:50.328926 IP 192.168.43.146.8880 > 192.168.43.147.7772: UDP, length 120
03:06:50.368014 IP 192.168.43.124.8880 > 192.168.43.146.7771: UDP, length 120
03:06:50.378900 IP 192.168.43.146.8880 > 192.168.43.147.7772: UDP, length 120
03:06:50.414894 IP 192.168.43.124.8880 > 192.168.43.146.7771: UDP, length 120
03:06:50.428905 IP 192.168.43.146.8880 > 192.168.43.147.7772: UDP, length 120
03:06:50.473892 IP 192.168.43.124.8880 > 192.168.43.146.7771: UDP, length 120
03:06:50.478897 IP 192.168.43.146.8880 > 192.168.43.147.7772: UDP, length 120
03:06:50.513719 IP 192.168.43.124.8880 > 192.168.43.146.7771: UDP, length 120
03:06:50.528935 IP 192.168.43.146.8880 > 192.168.43.147.7772: UDP, length 120
03:06:50.563731 IP 192.168.43.124.8880 > 192.168.43.146.7771: UDP, length 120
03:06:50.578904 IP 192.168.43.146.8880 > 192.168.43.147.7772: UDP, length 120
03:06:50.628897 IP 192.168.43.146.8880 > 192.168.43.147.7772: UDP, length 120
03:06:50.632962 IP 192.168.43.124.8880 > 192.168.43.146.7771: UDP, length 120
03:06:50.663726 IP 192.168.43.124.8880 > 192.168.43.146.7771: UDP, length 120
03:06:50.678897 IP 192.168.43.146.8880 > 192.168.43.147.7772: UDP, length 120
03:06:50.723395 IP 192.168.43.124.8880 > 192.168.43.146.7771: UDP, length 120
03:06:50.728900 IP 192.168.43.146.8880 > 192.168.43.147.7772: UDP, length 120
03:06:50.763638 IP 192.168.43.124.8880 > 192.168.43.146.7771: UDP, length 120
03:06:50.778895 IP 192.168.43.146.8880 > 192.168.43.147.7772: UDP, length 120
03:06:50.813838 IP 192.168.43.124.8880 > 192.168.43.146.7771: UDP, length 120
03:06:50.828897 IP 192.168.43.146.8880 > 192.168.43.147.7772: UDP, length 120
03:06:50.876206 IP 192.168.43.124.8880 > 192.168.43.146.7771: UDP, length 120
03:06:50.878897 IP 192.168.43.146.8880 > 192.168.43.147.7772: UDP, length 120
03:06:50.913719 IP 192.168.43.124.8880 > 192.168.43.146.7771: UDP, length 120
03:06:50.928897 IP 192.168.43.146.8880 > 192.168.43.147.7772: UDP, length 120
03:06:50.966712 IP 192.168.43.124.8880 > 192.168.43.146.7771: UDP, length 120
03:06:50.978905 IP 192.168.43.146.8880 > 192.168.43.147.7772: UDP, length 120
03:06:51.023824 IP 192.168.43.124.8880 > 192.168.43.146.7771: UDP, length 120
03:06:51.028897 IP 192.168.43.146.8880 > 192.168.43.147.7772: UDP, length 120
03:06:51.063697 IP 192.168.43.124.8880 > 192.168.43.146.7771: UDP, length 120
03:06:51.078896 IP 192.168.43.146.8880 > 192.168.43.147.7772: UDP, length 120
03:06:51.113800 IP 192.168.43.124.8880 > 192.168.43.146.7771: UDP, length 120
03:06:51.128897 IP 192.168.43.146.8880 > 192.168.43.147.7772: UDP, length 120
03:06:51.173514 IP 192.168.43.124.8880 > 192.168.43.146.7771: UDP, length 120
03:06:51.178896 IP 192.168.43.146.8880 > 192.168.43.147.7772: UDP, length 120
03:06:51.213681 IP 192.168.43.124.8880 > 192.168.43.146.7771: UDP, length 120
03:06:51.228897 IP 192.168.43.146.8880 > 192.168.43.147.7772: UDP, length 120
03:06:51.263098 IP 192.168.43.124.8880 > 192.168.43.146.7771: UDP, length 120
03:06:51.278895 IP 192.168.43.146.8880 > 192.168.43.147.7772: UDP, length 120
03:06:51.328909 IP 192.168.43.146.8880 > 192.168.43.147.7772: UDP, length 120
03:06:51.329811 IP 192.168.43.124.8880 > 192.168.43.146.7771: UDP, length 120
03:06:51.364776 IP 192.168.43.124.8880 > 192.168.43.146.7771: UDP, length 120
03:06:51.378907 IP 192.168.43.146.8880 > 192.168.43.147.7772: UDP, length 120
03:06:51.413718 IP 192.168.43.124.8880 > 192.168.43.146.7771: UDP, length 120
03:06:51.428907 IP 192.168.43.146.8880 > 192.168.43.147.7772: UDP, length 120
03:06:51.473693 IP 192.168.43.124.8880 > 192.168.43.146.7771: UDP, length 120
03:06:51.478898 IP 192.168.43.146.8880 > 192.168.43.147.7772: UDP, length 120
03:06:51.515738 IP 192.168.43.124.8880 > 192.168.43.146.7771: UDP, length 120
03:06:51.528898 IP 192.168.43.146.8880 > 192.168.43.147.7772: UDP, length 120
03:06:51.564947 IP 192.168.43.124.8880 > 192.168.43.146.7771: UDP, length 120
03:06:51.578897 IP 192.168.43.146.8880 > 192.168.43.147.7772: UDP, length 120
03:06:51.625508 IP 192.168.43.124.8880 > 192.168.43.146.7771: UDP, length 120
03:06:51.628898 IP 192.168.43.146.8880 > 192.168.43.147.7772: UDP, length 120
03:06:51.663999 IP 192.168.43.124.8880 > 192.168.43.146.7771: UDP, length 120
03:06:51.678895 IP 192.168.43.146.8880 > 192.168.43.147.7772: UDP, length 120
03:06:51.713757 IP 192.168.43.124.8880 > 192.168.43.146.7771: UDP, length 120
03:06:51.728898 IP 192.168.43.146.8880 > 192.168.43.147.7772: UDP, length 120
03:06:51.774010 IP 192.168.43.124.8880 > 192.168.43.146.7771: UDP, length 120
03:06:51.778895 IP 192.168.43.146.8880 > 192.168.43.147.7772: UDP, length 120
03:06:51.813659 IP 192.168.43.124.8880 > 192.168.43.146.7771: UDP, length 120
03:06:51.828937 IP 192.168.43.146.8880 > 192.168.43.147.7772: UDP, length 120
03:06:51.864874 IP 192.168.43.124.8880 > 192.168.43.146.7771: UDP, length 120
03:06:51.878909 IP 192.168.43.146.8880 > 192.168.43.147.7772: UDP, length 120
03:06:51.925293 IP 192.168.43.124.8880 > 192.168.43.146.7771: UDP, length 120
03:06:51.928898 IP 192.168.43.146.8880 > 192.168.43.147.7772: UDP, length 120
03:06:51.964408 IP 192.168.43.124.8880 > 192.168.43.146.7771: UDP, length 120
03:06:51.978898 IP 192.168.43.146.8880 > 192.168.43.147.7772: UDP, length 120
03:06:52.013758 IP 192.168.43.124.8880 > 192.168.43.146.7771: UDP, length 120
03:06:52.028903 IP 192.168.43.146.8880 > 192.168.43.147.7772: UDP, length 120
03:06:52.073232 IP 192.168.43.124.8880 > 192.168.43.146.7771: UDP, length 120
03:06:52.078898 IP 192.168.43.146.8880 > 192.168.43.147.7772: UDP, length 120
03:06:52.113656 IP 192.168.43.124.8880 > 192.168.43.146.7771: UDP, length 120
03:06:52.128896 IP 192.168.43.146.8880 > 192.168.43.147.7772: UDP, length 120
03:06:52.164382 IP 192.168.43.124.8880 > 192.168.43.146.7771: UDP, length 120
03:06:52.178896 IP 192.168.43.146.8880 > 192.168.43.147.7772: UDP, length 120
03:06:52.222997 IP 192.168.43.124.8880 > 192.168.43.146.7771: UDP, length 120
03:06:52.228897 IP 192.168.43.146.8880 > 192.168.43.147.7772: UDP, length 120
03:06:52.263660 IP 192.168.43.124.8880 > 192.168.43.146.7771: UDP, length 120
03:06:52.278896 IP 192.168.43.146.8880 > 192.168.43.147.7772: UDP, length 120
03:06:52.316287 IP 192.168.43.124.8880 > 192.168.43.146.7771: UDP, length 120
03:06:52.328896 IP 192.168.43.146.8880 > 192.168.43.147.7772: UDP, length 120
03:06:52.376517 IP 192.168.43.124.8880 > 192.168.43.146.7771: UDP, length 120
03:06:52.378896 IP 192.168.43.146.8880 > 192.168.43.147.7772: UDP, length 120
03:06:52.417840 IP 192.168.43.124.8880 > 192.168.43.146.7771: UDP, length 120
03:06:52.428900 IP 192.168.43.146.8880 > 192.168.43.147.7772: UDP, length 120
03:06:52.463739 IP 192.168.43.124.8880 > 192.168.43.146.7771: UDP, length 120
03:06:52.478897 IP 192.168.43.146.8880 > 192.168.43.147.7772: UDP, length 120
03:06:52.528966 IP 192.168.43.146.8880 > 192.168.43.147.7772: UDP, length 120
03:06:52.531251 IP 192.168.43.124.8880 > 192.168.43.146.7771: UDP, length 120
03:06:52.563890 IP 192.168.43.124.8880 > 192.168.43.146.7771: UDP, length 120
03:06:52.578964 IP 192.168.43.146.8880 > 192.168.43.147.7772: UDP, length 120
03:06:52.624954 IP 192.168.43.124.8880 > 192.168.43.146.7771: UDP, length 120
03:06:52.628974 IP 192.168.43.146.8880 > 192.168.43.147.7772: UDP, length 120
03:06:52.673821 IP 192.168.43.124.8880 > 192.168.43.146.7771: UDP, length 120
03:06:52.678934 IP 192.168.43.146.8880 > 192.168.43.147.7772: UDP, length 120
03:06:52.713987 IP 192.168.43.124.8880 > 192.168.43.146.7771: UDP, length 120
03:06:52.728927 IP 192.168.43.146.8880 > 192.168.43.147.7772: UDP, length 120
03:06:52.763806 IP 192.168.43.124.8880 > 192.168.43.146.7771: UDP, length 120
03:06:52.778923 IP 192.168.43.146.8880 > 192.168.43.147.7772: UDP, length 120
03:06:52.823694 IP 192.168.43.124.8880 > 192.168.43.146.7771: UDP, length 120
03:06:52.828922 IP 192.168.43.146.8880 > 192.168.43.147.7772: UDP, length 120
03:06:52.865198 IP 192.168.43.124.8880 > 192.168.43.146.7771: UDP, length 120
03:06:52.878921 IP 192.168.43.146.8880 > 192.168.43.147.7772: UDP, length 120
03:06:52.914482 IP 192.168.43.124.8880 > 192.168.43.146.7771: UDP, length 120
03:06:52.928924 IP 192.168.43.146.8880 > 192.168.43.147.7772: UDP, length 120
03:06:52.974695 IP 192.168.43.124.8880 > 192.168.43.146.7771: UDP, length 120
03:06:52.978917 IP 192.168.43.146.8880 > 192.168.43.147.7772: UDP, length 120
03:06:53.017017 IP 192.168.43.124.8880 > 192.168.43.146.7771: UDP, length 120
03:06:53.028922 IP 192.168.43.146.8880 > 192.168.43.147.7772: UDP, length 120
03:06:53.063905 IP 192.168.43.124.8880 > 192.168.43.146.7771: UDP, length 120
03:06:53.078926 IP 192.168.43.146.8880 > 192.168.43.147.7772: UDP, length 120
03:06:53.117320 IP 192.168.43.124.8880 > 192.168.43.146.7771: UDP, length 120
03:06:53.128929 IP 192.168.43.146.8880 > 192.168.43.147.7772: UDP, length 120
03:06:53.163849 IP 192.168.43.124.8880 > 192.168.43.146.7771: UDP, length 120
03:06:53.178928 IP 192.168.43.146.8880 > 192.168.43.147.7772: UDP, length 120
03:06:53.213965 IP 192.168.43.124.8880 > 192.168.43.146.7771: UDP, length 120
03:06:53.228926 IP 192.168.43.146.8880 > 192.168.43.147.7772: UDP, length 120
03:06:53.265632 IP 192.168.43.124.8880 > 192.168.43.146.7771: UDP, length 120
03:06:53.278917 IP 192.168.43.146.8880 > 192.168.43.147.7772: UDP, length 120
03:06:53.315733 IP 192.168.43.124.8880 > 192.168.43.146.7771: UDP, length 120
03:06:53.328993 IP 192.168.43.146.8880 > 192.168.43.147.7772: UDP, length 120
03:06:53.366066 IP 192.168.43.124.8880 > 192.168.43.146.7771: UDP, length 120
03:06:53.378957 IP 192.168.43.146.8880 > 192.168.43.147.7772: UDP, length 120
03:06:53.415097 IP 192.168.43.124.8880 > 192.168.43.146.7771: UDP, length 120
03:06:53.428943 IP 192.168.43.146.8880 > 192.168.43.147.7772: UDP, length 120
03:06:53.465618 IP 192.168.43.124.8880 > 192.168.43.146.7771: UDP, length 120
03:06:53.478926 IP 192.168.43.146.8880 > 192.168.43.147.7772: UDP, length 120
03:06:53.517247 IP 192.168.43.124.8880 > 192.168.43.146.7771: UDP, length 120
03:06:53.528926 IP 192.168.43.146.8880 > 192.168.43.147.7772: UDP, length 120
03:06:53.568352 IP 192.168.43.124.8880 > 192.168.43.146.7771: UDP, length 120
03:06:53.578923 IP 192.168.43.146.8880 > 192.168.43.147.7772: UDP, length 120
03:06:53.614370 IP 192.168.43.124.8880 > 192.168.43.146.7771: UDP, length 120
03:06:53.629016 IP 192.168.43.146.8880 > 192.168.43.147.7772: UDP, length 120
03:06:53.668170 IP 192.168.43.124.8880 > 192.168.43.146.7771: UDP, length 120
03:06:53.678974 IP 192.168.43.146.8880 > 192.168.43.147.7772: UDP, length 120
03:06:53.715984 IP 192.168.43.124.8880 > 192.168.43.146.7771: UDP, length 120
03:06:53.728931 IP 192.168.43.146.8880 > 192.168.43.147.7772: UDP, length 120
03:06:53.765522 IP 192.168.43.124.8880 > 192.168.43.146.7771: UDP, length 120
03:06:53.778925 IP 192.168.43.146.8880 > 192.168.43.147.7772: UDP, length 120
03:06:53.815544 IP 192.168.43.124.8880 > 192.168.43.146.7771: UDP, length 120
03:06:53.828924 IP 192.168.43.146.8880 > 192.168.43.147.7772: UDP, length 120
03:06:53.865233 IP 192.168.43.124.8880 > 192.168.43.146.7771: UDP, length 120
03:06:53.878920 IP 192.168.43.146.8880 > 192.168.43.147.7772: UDP, length 120
03:06:53.915671 IP 192.168.43.124.8880 > 192.168.43.146.7771: UDP, length 120
03:06:53.928921 IP 192.168.43.146.8880 > 192.168.43.147.7772: UDP, length 120
03:06:53.965655 IP 192.168.43.124.8880 > 192.168.43.146.7771: UDP, length 120
03:06:53.978922 IP 192.168.43.146.8880 > 192.168.43.147.7772: UDP, length 120
03:06:54.015043 IP 192.168.43.124.8880 > 192.168.43.146.7771: UDP, length 120
03:06:54.028922 IP 192.168.43.146.8880 > 192.168.43.147.7772: UDP, length 120
03:06:54.065877 IP 192.168.43.124.8880 > 192.168.43.146.7771: UDP, length 120
03:06:54.078951 IP 192.168.43.146.8880 > 192.168.43.147.7772: UDP, length 120
03:06:54.117516 IP 192.168.43.124.8880 > 192.168.43.146.7771: UDP, length 120
03:06:54.128927 IP 192.168.43.146.8880 > 192.168.43.147.7772: UDP, length 120
03:06:54.166140 IP 192.168.43.124.8880 > 192.168.43.146.7771: UDP, length 120
03:06:54.178932 IP 192.168.43.146.8880 > 192.168.43.147.7772: UDP, length 120
03:06:54.219690 IP 192.168.43.124.8880 > 192.168.43.146.7771: UDP, length 120
03:06:54.228924 IP 192.168.43.146.8880 > 192.168.43.147.7772: UDP, length 120
03:06:54.265992 IP 192.168.43.124.8880 > 192.168.43.146.7771: UDP, length 120
03:06:54.279000 IP 192.168.43.146.8880 > 192.168.43.147.7772: UDP, length 120
03:06:54.316091 IP 192.168.43.124.8880 > 192.168.43.146.7771: UDP, length 120
03:06:54.328989 IP 192.168.43.146.8880 > 192.168.43.147.7772: UDP, length 120
03:06:54.366222 IP 192.168.43.124.8880 > 192.168.43.146.7771: UDP, length 120
03:06:54.379002 IP 192.168.43.146.8880 > 192.168.43.147.7772: UDP, length 120
03:06:54.415497 IP 192.168.43.124.8880 > 192.168.43.146.7771: UDP, length 120
03:06:54.428971 IP 192.168.43.146.8880 > 192.168.43.147.7772: UDP, length 120
03:06:54.466837 IP 192.168.43.124.8880 > 192.168.43.146.7771: UDP, length 120
03:06:54.478961 IP 192.168.43.146.8880 > 192.168.43.147.7772: UDP, length 120
03:06:54.515517 IP 192.168.43.124.8880 > 192.168.43.146.7771: UDP, length 120
03:06:54.528967 IP 192.168.43.146.8880 > 192.168.43.147.7772: UDP, length 120
03:06:54.571195 IP 192.168.43.124.8880 > 192.168.43.146.7771: UDP, length 120
03:06:54.578964 IP 192.168.43.146.8880 > 192.168.43.147.7772: UDP, length 120
03:06:54.615478 IP 192.168.43.124.8880 > 192.168.43.146.7771: UDP, length 120
03:06:54.628998 IP 192.168.43.146.8880 > 192.168.43.147.7772: UDP, length 120
03:06:54.673864 IP 192.168.43.124.8880 > 192.168.43.146.7771: UDP, length 120
03:06:54.678940 IP 192.168.43.146.8880 > 192.168.43.147.7772: UDP, length 120
03:06:54.716955 IP 192.168.43.124.8880 > 192.168.43.146.7771: UDP, length 120
03:06:54.728910 IP 192.168.43.146.8880 > 192.168.43.147.7772: UDP, length 120
03:06:54.767308 IP 192.168.43.124.8880 > 192.168.43.146.7771: UDP, length 120
03:06:54.778896 IP 192.168.43.146.8880 > 192.168.43.147.7772: UDP, length 120
03:06:54.815399 IP 192.168.43.124.8880 > 192.168.43.146.7771: UDP, length 120
03:06:54.828898 IP 192.168.43.146.8880 > 192.168.43.147.7772: UDP, length 120
03:06:54.865121 IP 192.168.43.124.8880 > 192.168.43.146.7771: UDP, length 120
03:06:54.878927 IP 192.168.43.146.8880 > 192.168.43.147.7772: UDP, length 120
03:06:54.916149 IP 192.168.43.124.8880 > 192.168.43.146.7771: UDP, length 120
03:06:54.928901 IP 192.168.43.146.8880 > 192.168.43.147.7772: UDP, length 120
03:06:54.963598 IP 192.168.43.124.8880 > 192.168.43.146.7771: UDP, length 120
03:06:54.978899 IP 192.168.43.146.8880 > 192.168.43.147.7772: UDP, length 120
03:06:55.014533 IP 192.168.43.124.8880 > 192.168.43.146.7771: UDP, length 120
03:06:55.028899 IP 192.168.43.146.8880 > 192.168.43.147.7772: UDP, length 120
03:06:55.065745 IP 192.168.43.124.8880 > 192.168.43.146.7771: UDP, length 120
03:06:55.078896 IP 192.168.43.146.8880 > 192.168.43.147.7772: UDP, length 120
03:06:55.115954 IP 192.168.43.124.8880 > 192.168.43.146.7771: UDP, length 120
03:06:55.128898 IP 192.168.43.146.8880 > 192.168.43.147.7772: UDP, length 120
03:06:55.178899 IP 192.168.43.146.8880 > 192.168.43.147.7772: UDP, length 120
03:06:55.183510 IP 192.168.43.124.8880 > 192.168.43.146.7771: UDP, length 120
03:06:55.215062 IP 192.168.43.124.8880 > 192.168.43.146.7771: UDP, length 120
03:06:55.228903 IP 192.168.43.146.8880 > 192.168.43.147.7772: UDP, length 120
03:06:55.269117 IP 192.168.43.124.8880 > 192.168.43.146.7771: UDP, length 120
03:06:55.278895 IP 192.168.43.146.8880 > 192.168.43.147.7772: UDP, length 120
03:06:55.315049 IP 192.168.43.124.8880 > 192.168.43.146.7771: UDP, length 120
03:06:55.328898 IP 192.168.43.146.8880 > 192.168.43.147.7772: UDP, length 120
03:06:55.365271 IP 192.168.43.124.8880 > 192.168.43.146.7771: UDP, length 120
03:06:55.378895 IP 192.168.43.146.8880 > 192.168.43.147.7772: UDP, length 120
03:06:55.415358 IP 192.168.43.124.8880 > 192.168.43.146.7771: UDP, length 120
03:06:55.428903 IP 192.168.43.146.8880 > 192.168.43.147.7772: UDP, length 120
03:06:55.465339 IP 192.168.43.124.8880 > 192.168.43.146.7771: UDP, length 120
03:06:55.478895 IP 192.168.43.146.8880 > 192.168.43.147.7772: UDP, length 120
03:06:55.515857 IP 192.168.43.124.8880 > 192.168.43.146.7771: UDP, length 120
03:06:55.528897 IP 192.168.43.146.8880 > 192.168.43.147.7772: UDP, length 120
03:06:55.563904 IP 192.168.43.124.8880 > 192.168.43.146.7771: UDP, length 120
03:06:55.578896 IP 192.168.43.146.8880 > 192.168.43.147.7772: UDP, length 120
03:06:55.614267 IP 192.168.43.124.8880 > 192.168.43.146.7771: UDP, length 120
03:06:55.628900 IP 192.168.43.146.8880 > 192.168.43.147.7772: UDP, length 120
03:06:55.665264 IP 192.168.43.124.8880 > 192.168.43.146.7771: UDP, length 120
03:06:55.678959 IP 192.168.43.146.8880 > 192.168.43.147.7772: UDP, length 120
03:06:55.716835 IP 192.168.43.124.8880 > 192.168.43.146.7771: UDP, length 120
03:06:55.728917 IP 192.168.43.146.8880 > 192.168.43.147.7772: UDP, length 120
03:06:55.763343 IP 192.168.43.124.8880 > 192.168.43.146.7771: UDP, length 120
03:06:55.778899 IP 192.168.43.146.8880 > 192.168.43.147.7772: UDP, length 120
03:06:55.821541 IP 192.168.43.124.8880 > 192.168.43.146.7771: UDP, length 120
03:06:55.828897 IP 192.168.43.146.8880 > 192.168.43.147.7772: UDP, length 120
03:06:55.876967 IP 192.168.43.124.8880 > 192.168.43.146.7771: UDP, length 120
03:06:55.878895 IP 192.168.43.146.8880 > 192.168.43.147.7772: UDP, length 120
03:06:55.913739 IP 192.168.43.124.8880 > 192.168.43.146.7771: UDP, length 120
03:06:55.928896 IP 192.168.43.146.8880 > 192.168.43.147.7772: UDP, length 120
03:06:55.963782 IP 192.168.43.124.8880 > 192.168.43.146.7771: UDP, length 120
03:06:55.978896 IP 192.168.43.146.8880 > 192.168.43.147.7772: UDP, length 120
03:06:56.022267 IP 192.168.43.124.8880 > 192.168.43.146.7771: UDP, length 120
03:06:56.028897 IP 192.168.43.146.8880 > 192.168.43.147.7772: UDP, length 120
03:06:56.071061 IP 192.168.43.124.8880 > 192.168.43.146.7771: UDP, length 120
03:06:56.078897 IP 192.168.43.146.8880 > 192.168.43.147.7772: UDP, length 120
03:06:56.113559 IP 192.168.43.124.8880 > 192.168.43.146.7771: UDP, length 120
03:06:56.128898 IP 192.168.43.146.8880 > 192.168.43.147.7772: UDP, length 120
03:06:56.165325 IP 192.168.43.124.8880 > 192.168.43.146.7771: UDP, length 120
03:06:56.178896 IP 192.168.43.146.8880 > 192.168.43.147.7772: UDP, length 120
03:06:56.213562 IP 192.168.43.124.8880 > 192.168.43.146.7771: UDP, length 120
03:06:56.228904 IP 192.168.43.146.8880 > 192.168.43.147.7772: UDP, length 120
03:06:56.267894 IP 192.168.43.124.8880 > 192.168.43.146.7771: UDP, length 120
03:06:56.278900 IP 192.168.43.146.8880 > 192.168.43.147.7772: UDP, length 120
03:06:56.321691 IP 192.168.43.124.8880 > 192.168.43.146.7771: UDP, length 120
03:06:56.328898 IP 192.168.43.146.8880 > 192.168.43.147.7772: UDP, length 120
03:06:56.378934 IP 192.168.43.146.8880 > 192.168.43.147.7772: UDP, length 120
03:06:56.382211 IP 192.168.43.124.8880 > 192.168.43.146.7771: UDP, length 120
03:06:56.413565 IP 192.168.43.124.8880 > 192.168.43.146.7771: UDP, length 120
03:06:56.428918 IP 192.168.43.146.8880 > 192.168.43.147.7772: UDP, length 120
03:06:56.463668 IP 192.168.43.124.8880 > 192.168.43.146.7771: UDP, length 120
03:06:56.478903 IP 192.168.43.146.8880 > 192.168.43.147.7772: UDP, length 120
03:06:56.515102 IP 192.168.43.124.8880 > 192.168.43.146.7771: UDP, length 120
03:06:56.528903 IP 192.168.43.146.8880 > 192.168.43.147.7772: UDP, length 120
03:06:56.566026 IP 192.168.43.124.8880 > 192.168.43.146.7771: UDP, length 120
03:06:56.578899 IP 192.168.43.146.8880 > 192.168.43.147.7772: UDP, length 120
03:06:56.622641 IP 192.168.43.124.8880 > 192.168.43.146.7771: UDP, length 120
03:06:56.628899 IP 192.168.43.146.8880 > 192.168.43.147.7772: UDP, length 120
03:06:56.663839 IP 192.168.43.124.8880 > 192.168.43.146.7771: UDP, length 120
03:06:56.678977 IP 192.168.43.146.8880 > 192.168.43.147.7772: UDP, length 120
03:06:56.718054 IP 192.168.43.124.8880 > 192.168.43.146.7771: UDP, length 120
03:06:56.728929 IP 192.168.43.146.8880 > 192.168.43.147.7772: UDP, length 120
03:06:56.764775 IP 192.168.43.124.8880 > 192.168.43.146.7771: UDP, length 120
03:06:56.778899 IP 192.168.43.146.8880 > 192.168.43.147.7772: UDP, length 120
03:06:56.827496 IP 192.168.43.124.8880 > 192.168.43.146.7771: UDP, length 120
03:06:56.828898 IP 192.168.43.146.8880 > 192.168.43.147.7772: UDP, length 120
03:06:56.863672 IP 192.168.43.124.8880 > 192.168.43.146.7771: UDP, length 120
03:06:56.878896 IP 192.168.43.146.8880 > 192.168.43.147.7772: UDP, length 120
03:06:56.913874 IP 192.168.43.124.8880 > 192.168.43.146.7771: UDP, length 120
03:06:56.928897 IP 192.168.43.146.8880 > 192.168.43.147.7772: UDP, length 120
03:06:56.963687 IP 192.168.43.124.8880 > 192.168.43.146.7771: UDP, length 120
03:06:56.978896 IP 192.168.43.146.8880 > 192.168.43.147.7772: UDP, length 120
03:06:57.013693 IP 192.168.43.124.8880 > 192.168.43.146.7771: UDP, length 120
03:06:57.028898 IP 192.168.43.146.8880 > 192.168.43.147.7772: UDP, length 120
03:06:57.071546 IP 192.168.43.124.8880 > 192.168.43.146.7771: UDP, length 120
03:06:57.078898 IP 192.168.43.146.8880 > 192.168.43.147.7772: UDP, length 120
03:06:57.126324 IP 192.168.43.124.8880 > 192.168.43.146.7771: UDP, length 120
03:06:57.128897 IP 192.168.43.146.8880 > 192.168.43.147.7772: UDP, length 120
03:06:57.178897 IP 192.168.43.146.8880 > 192.168.43.147.7772: UDP, length 120
03:06:57.180504 IP 192.168.43.124.8880 > 192.168.43.146.7771: UDP, length 120
03:06:57.214606 IP 192.168.43.124.8880 > 192.168.43.146.7771: UDP, length 120
03:06:57.228897 IP 192.168.43.146.8880 > 192.168.43.147.7772: UDP, length 120
03:06:57.263743 IP 192.168.43.124.8880 > 192.168.43.146.7771: UDP, length 120
03:06:57.278896 IP 192.168.43.146.8880 > 192.168.43.147.7772: UDP, length 120
03:06:57.317155 IP 192.168.43.124.8880 > 192.168.43.146.7771: UDP, length 120
03:06:57.328909 IP 192.168.43.146.8880 > 192.168.43.147.7772: UDP, length 120
03:06:57.363357 IP 192.168.43.124.8880 > 192.168.43.146.7771: UDP, length 120
03:06:57.378898 IP 192.168.43.146.8880 > 192.168.43.147.7772: UDP, length 120
03:06:57.421428 IP 192.168.43.124.8880 > 192.168.43.146.7771: UDP, length 120
03:06:57.428904 IP 192.168.43.146.8880 > 192.168.43.147.7772: UDP, length 120
03:06:57.476712 IP 192.168.43.124.8880 > 192.168.43.146.7771: UDP, length 120
03:06:57.478898 IP 192.168.43.146.8880 > 192.168.43.147.7772: UDP, length 120
03:06:57.513677 IP 192.168.43.124.8880 > 192.168.43.146.7771: UDP, length 120
03:06:57.528898 IP 192.168.43.146.8880 > 192.168.43.147.7772: UDP, length 120
03:06:57.569343 IP 192.168.43.124.8880 > 192.168.43.146.7771: UDP, length 120
03:06:57.578896 IP 192.168.43.146.8880 > 192.168.43.147.7772: UDP, length 120
03:06:57.613625 IP 192.168.43.124.8880 > 192.168.43.146.7771: UDP, length 120
03:06:57.628928 IP 192.168.43.146.8880 > 192.168.43.147.7772: UDP, length 120
03:06:57.667966 IP 192.168.43.124.8880 > 192.168.43.146.7771: UDP, length 120
03:06:57.678921 IP 192.168.43.146.8880 > 192.168.43.147.7772: UDP, length 120
03:06:57.713973 IP 192.168.43.124.8880 > 192.168.43.146.7771: UDP, length 120
03:06:57.728971 IP 192.168.43.146.8880 > 192.168.43.147.7772: UDP, length 120
03:06:57.766173 IP 192.168.43.124.8880 > 192.168.43.146.7771: UDP, length 120
03:06:57.778925 IP 192.168.43.146.8880 > 192.168.43.147.7772: UDP, length 120
03:06:57.828924 IP 192.168.43.146.8880 > 192.168.43.147.7772: UDP, length 120
03:06:57.830859 IP 192.168.43.124.8880 > 192.168.43.146.7771: UDP, length 120
03:06:57.866396 IP 192.168.43.124.8880 > 192.168.43.146.7771: UDP, length 120
03:06:57.878964 IP 192.168.43.146.8880 > 192.168.43.147.7772: UDP, length 120
03:06:57.914026 IP 192.168.43.124.8880 > 192.168.43.146.7771: UDP, length 120
03:06:57.928926 IP 192.168.43.146.8880 > 192.168.43.147.7772: UDP, length 120
03:06:57.963715 IP 192.168.43.124.8880 > 192.168.43.146.7771: UDP, length 120
03:06:57.978921 IP 192.168.43.146.8880 > 192.168.43.147.7772: UDP, length 120
03:06:58.014705 IP 192.168.43.124.8880 > 192.168.43.146.7771: UDP, length 120
03:06:58.028922 IP 192.168.43.146.8880 > 192.168.43.147.7772: UDP, length 120
03:06:58.063742 IP 192.168.43.124.8880 > 192.168.43.146.7771: UDP, length 120
03:06:58.078922 IP 192.168.43.146.8880 > 192.168.43.147.7772: UDP, length 120
03:06:58.113635 IP 192.168.43.124.8880 > 192.168.43.146.7771: UDP, length 120
03:06:58.128924 IP 192.168.43.146.8880 > 192.168.43.147.7772: UDP, length 120
03:06:58.167581 IP 192.168.43.124.8880 > 192.168.43.146.7771: UDP, length 120
03:06:58.178921 IP 192.168.43.146.8880 > 192.168.43.147.7772: UDP, length 120
03:06:58.222424 IP 192.168.43.124.8880 > 192.168.43.146.7771: UDP, length 120
03:06:58.228925 IP 192.168.43.146.8880 > 192.168.43.147.7772: UDP, length 120
03:06:58.278816 IP 192.168.43.124.8880 > 192.168.43.146.7771: UDP, length 120
03:06:58.278985 IP 192.168.43.146.8880 > 192.168.43.147.7772: UDP, length 120
03:06:58.316069 IP 192.168.43.124.8880 > 192.168.43.146.7771: UDP, length 120
03:06:58.328925 IP 192.168.43.146.8880 > 192.168.43.147.7772: UDP, length 120
03:06:58.363920 IP 192.168.43.124.8880 > 192.168.43.146.7771: UDP, length 120
03:06:58.378932 IP 192.168.43.146.8880 > 192.168.43.147.7772: UDP, length 120
03:06:58.414740 IP 192.168.43.124.8880 > 192.168.43.146.7771: UDP, length 120
03:06:58.428937 IP 192.168.43.146.8880 > 192.168.43.147.7772: UDP, length 120
03:06:58.463765 IP 192.168.43.124.8880 > 192.168.43.146.7771: UDP, length 120
03:06:58.478926 IP 192.168.43.146.8880 > 192.168.43.147.7772: UDP, length 120
03:06:58.513661 IP 192.168.43.124.8880 > 192.168.43.146.7771: UDP, length 120
03:06:58.528926 IP 192.168.43.146.8880 > 192.168.43.147.7772: UDP, length 120
03:06:58.564333 IP 192.168.43.124.8880 > 192.168.43.146.7771: UDP, length 120
03:06:58.578923 IP 192.168.43.146.8880 > 192.168.43.147.7772: UDP, length 120
03:06:58.619203 IP 192.168.43.124.8880 > 192.168.43.146.7771: UDP, length 120
03:06:58.628921 IP 192.168.43.146.8880 > 192.168.43.147.7772: UDP, length 120
03:06:58.675331 IP 192.168.43.124.8880 > 192.168.43.146.7771: UDP, length 120
03:06:58.678921 IP 192.168.43.146.8880 > 192.168.43.147.7772: UDP, length 120
03:06:58.713446 IP 192.168.43.124.8880 > 192.168.43.146.7771: UDP, length 120
03:06:58.728971 IP 192.168.43.146.8880 > 192.168.43.147.7772: UDP, length 120
03:06:58.767254 IP 192.168.43.124.8880 > 192.168.43.146.7771: UDP, length 120
03:06:58.778930 IP 192.168.43.146.8880 > 192.168.43.147.7772: UDP, length 120
03:06:58.823971 IP 192.168.43.124.8880 > 192.168.43.146.7771: UDP, length 120
03:06:58.828925 IP 192.168.43.146.8880 > 192.168.43.147.7772: UDP, length 120
03:06:58.864595 IP 192.168.43.124.8880 > 192.168.43.146.7771: UDP, length 120
03:06:58.878922 IP 192.168.43.146.8880 > 192.168.43.147.7772: UDP, length 120
03:06:58.914826 IP 192.168.43.124.8880 > 192.168.43.146.7771: UDP, length 120
03:06:58.928923 IP 192.168.43.146.8880 > 192.168.43.147.7772: UDP, length 120
03:06:58.973624 IP 192.168.43.124.8880 > 192.168.43.146.7771: UDP, length 120
03:06:58.978922 IP 192.168.43.146.8880 > 192.168.43.147.7772: UDP, length 120
03:06:59.028921 IP 192.168.43.146.8880 > 192.168.43.147.7772: UDP, length 120
03:06:59.041604 IP 192.168.43.124.8880 > 192.168.43.146.7771: UDP, length 120
03:06:59.063785 IP 192.168.43.124.8880 > 192.168.43.146.7771: UDP, length 120
03:06:59.078924 IP 192.168.43.146.8880 > 192.168.43.147.7772: UDP, length 120
03:06:59.114113 IP 192.168.43.124.8880 > 192.168.43.146.7771: UDP, length 120
03:06:59.128922 IP 192.168.43.146.8880 > 192.168.43.147.7772: UDP, length 120
03:06:59.178922 IP 192.168.43.146.8880 > 192.168.43.147.7772: UDP, length 120
03:06:59.182362 IP 192.168.43.124.8880 > 192.168.43.146.7771: UDP, length 120
03:06:59.214245 IP 192.168.43.124.8880 > 192.168.43.146.7771: UDP, length 120
03:06:59.228923 IP 192.168.43.146.8880 > 192.168.43.147.7772: UDP, length 120
03:06:59.273825 IP 192.168.43.124.8880 > 192.168.43.146.7771: UDP, length 120
03:06:59.278922 IP 192.168.43.146.8880 > 192.168.43.147.7772: UDP, length 120
03:06:59.310868 IP 192.168.43.124.8880 > 192.168.43.146.7771: UDP, length 120
03:06:59.328924 IP 192.168.43.146.8880 > 192.168.43.147.7772: UDP, length 120
03:06:59.364438 IP 192.168.43.124.8880 > 192.168.43.146.7771: UDP, length 120
03:06:59.378959 IP 192.168.43.146.8880 > 192.168.43.147.7772: UDP, length 120
03:06:59.423669 IP 192.168.43.124.8880 > 192.168.43.146.7771: UDP, length 120
03:06:59.428943 IP 192.168.43.146.8880 > 192.168.43.147.7772: UDP, length 120
03:06:59.466056 IP 192.168.43.124.8880 > 192.168.43.146.7771: UDP, length 120
03:06:59.478936 IP 192.168.43.146.8880 > 192.168.43.147.7772: UDP, length 120
03:06:59.514236 IP 192.168.43.124.8880 > 192.168.43.146.7771: UDP, length 120
03:06:59.528931 IP 192.168.43.146.8880 > 192.168.43.147.7772: UDP, length 120
03:06:59.564258 IP 192.168.43.124.8880 > 192.168.43.146.7771: UDP, length 120
03:06:59.578936 IP 192.168.43.146.8880 > 192.168.43.147.7772: UDP, length 120
03:06:59.628933 IP 192.168.43.146.8880 > 192.168.43.147.7772: UDP, length 120
03:06:59.632359 IP 192.168.43.124.8880 > 192.168.43.146.7771: UDP, length 120
03:06:59.663890 IP 192.168.43.124.8880 > 192.168.43.146.7771: UDP, length 120
03:06:59.679030 IP 192.168.43.146.8880 > 192.168.43.147.7772: UDP, length 120
03:06:59.714304 IP 192.168.43.124.8880 > 192.168.43.146.7771: UDP, length 120
03:06:59.729033 IP 192.168.43.146.8880 > 192.168.43.147.7772: UDP, length 120
03:06:59.774044 IP 192.168.43.124.8880 > 192.168.43.146.7771: UDP, length 120
03:06:59.779039 IP 192.168.43.146.8880 > 192.168.43.147.7772: UDP, length 120
03:06:59.813817 IP 192.168.43.124.8880 > 192.168.43.146.7771: UDP, length 120
03:06:59.828969 IP 192.168.43.146.8880 > 192.168.43.147.7772: UDP, length 120
03:06:59.864374 IP 192.168.43.124.8880 > 192.168.43.146.7771: UDP, length 120
