00:18:32.661087 IP 192.168.43.124.8880 > 192.168.43.146.7771: UDP, length 120
00:18:32.661241 IP 192.168.43.124.8880 > 192.168.43.146.7771: UDP, length 120
00:18:32.661360 IP 192.168.43.124.8880 > 192.168.43.146.7771: UDP, length 120
00:18:32.797628 IP 192.168.43.124.8880 > 192.168.43.146.7771: UDP, length 120
00:18:32.797930 IP 192.168.43.124.8880 > 192.168.43.146.7771: UDP, length 120
00:18:32.964386 IP 192.168.43.124.8880 > 192.168.43.146.7771: UDP, length 120
00:18:32.964716 IP 192.168.43.124.8880 > 192.168.43.146.7771: UDP, length 120
00:18:32.964947 IP 192.168.43.124.8880 > 192.168.43.146.7771: UDP, length 120
00:18:32.965070 IP 192.168.43.124.8880 > 192.168.43.146.7771: UDP, length 120
00:18:33.096918 IP 192.168.43.124.8880 > 192.168.43.146.7771: UDP, length 120
00:18:33.097060 IP 192.168.43.124.8880 > 192.168.43.146.7771: UDP, length 120
00:18:33.130192 IP 192.168.43.146.8880 > 192.168.43.147.7772: UDP, length 120
00:18:33.180238 IP 192.168.43.146.8880 > 192.168.43.147.7772: UDP, length 120
00:18:33.218599 IP 192.168.43.124.8880 > 192.168.43.146.7771: UDP, length 120
00:18:33.219056 IP 192.168.43.124.8880 > 192.168.43.146.7771: UDP, length 120
00:18:33.230251 IP 192.168.43.146.8880 > 192.168.43.147.7772: UDP, length 120
00:18:33.280231 IP 192.168.43.146.8880 > 192.168.43.147.7772: UDP, length 120
00:18:33.325652 IP 192.168.43.124.8880 > 192.168.43.146.7771: UDP, length 120
00:18:33.326246 IP 192.168.43.124.8880 > 192.168.43.146.7771: UDP, length 120
00:18:33.326444 IP 192.168.43.124.8880 > 192.168.43.146.7771: UDP, length 120
00:18:33.330248 IP 192.168.43.146.8880 > 192.168.43.147.7772: UDP, length 120
00:18:33.380228 IP 192.168.43.146.8880 > 192.168.43.147.7772: UDP, length 120
00:18:33.398031 IP 192.168.43.124.8880 > 192.168.43.146.7771: UDP, length 120
00:18:33.398283 IP 192.168.43.124.8880 > 192.168.43.146.7771: UDP, length 120
00:18:33.430284 IP 192.168.43.146.8880 > 192.168.43.147.7772: UDP, length 120
00:18:33.445375 IP 192.168.43.124.8880 > 192.168.43.146.7771: UDP, length 120
00:18:33.480260 IP 192.168.43.146.8880 > 192.168.43.147.7772: UDP, length 120
00:18:33.497458 IP 192.168.43.124.8880 > 192.168.43.146.7771: UDP, length 120
00:18:33.530261 IP 192.168.43.146.8880 > 192.168.43.147.7772: UDP, length 120
00:18:33.550148 IP 192.168.43.124.8880 > 192.168.43.146.7771: UDP, length 120
00:18:33.580258 IP 192.168.43.146.8880 > 192.168.43.147.7772: UDP, length 120
00:18:33.594334 IP 192.168.43.124.8880 > 192.168.43.146.7771: UDP, length 120
00:18:33.630276 IP 192.168.43.146.8880 > 192.168.43.147.7772: UDP, length 120
00:18:33.644297 IP 192.168.43.124.8880 > 192.168.43.146.7771: UDP, length 120
00:18:33.680257 IP 192.168.43.146.8880 > 192.168.43.147.7772: UDP, length 120
00:18:33.700030 IP 192.168.43.124.8880 > 192.168.43.146.7771: UDP, length 120
00:18:33.730258 IP 192.168.43.146.8880 > 192.168.43.147.7772: UDP, length 120
00:18:33.767603 IP 192.168.43.124.8880 > 192.168.43.146.7771: UDP, length 120
00:18:33.780252 IP 192.168.43.146.8880 > 192.168.43.147.7772: UDP, length 120
00:18:33.794059 IP 192.168.43.124.8880 > 192.168.43.146.7771: UDP, length 120
00:18:33.830261 IP 192.168.43.146.8880 > 192.168.43.147.7772: UDP, length 120
00:18:33.846957 IP 192.168.43.124.8880 > 192.168.43.146.7771: UDP, length 120
00:18:33.880255 IP 192.168.43.146.8880 > 192.168.43.147.7772: UDP, length 120
00:18:33.914348 IP 192.168.43.124.8880 > 192.168.43.146.7771: UDP, length 120
00:18:33.930256 IP 192.168.43.146.8880 > 192.168.43.147.7772: UDP, length 120
00:18:33.944900 IP 192.168.43.124.8880 > 192.168.43.146.7771: UDP, length 120
00:18:33.980264 IP 192.168.43.146.8880 > 192.168.43.147.7772: UDP, length 120
00:18:33.997694 IP 192.168.43.124.8880 > 192.168.43.146.7771: UDP, length 120
00:18:34.030271 IP 192.168.43.146.8880 > 192.168.43.147.7772: UDP, length 120
00:18:34.053940 IP 192.168.43.124.8880 > 192.168.43.146.7771: UDP, length 120
00:18:34.080319 IP 192.168.43.146.8880 > 192.168.43.147.7772: UDP, length 120
00:18:34.094574 IP 192.168.43.124.8880 > 192.168.43.146.7771: UDP, length 120
00:18:34.130262 IP 192.168.43.146.8880 > 192.168.43.147.7772: UDP, length 120
00:18:34.144180 IP 192.168.43.124.8880 > 192.168.43.146.7771: UDP, length 120
00:18:34.180260 IP 192.168.43.146.8880 > 192.168.43.147.7772: UDP, length 120
00:18:34.201809 IP 192.168.43.124.8880 > 192.168.43.146.7771: UDP, length 120
00:18:34.230266 IP 192.168.43.146.8880 > 192.168.43.147.7772: UDP, length 120
00:18:34.244076 IP 192.168.43.124.8880 > 192.168.43.146.7771: UDP, length 120
00:18:34.280252 IP 192.168.43.146.8880 > 192.168.43.147.7772: UDP, length 120
00:18:34.294708 IP 192.168.43.124.8880 > 192.168.43.146.7771: UDP, length 120
00:18:34.330274 IP 192.168.43.146.8880 > 192.168.43.147.7772: UDP, length 120
00:18:34.344353 IP 192.168.43.124.8880 > 192.168.43.146.7771: UDP, length 120
00:18:34.380261 IP 192.168.43.146.8880 > 192.168.43.147.7772: UDP, length 120
00:18:34.395913 IP 192.168.43.124.8880 > 192.168.43.146.7771: UDP, length 120
00:18:34.430259 IP 192.168.43.146.8880 > 192.168.43.147.7772: UDP, length 120
00:18:34.466853 IP 192.168.43.124.8880 > 192.168.43.146.7771: UDP, length 120
00:18:34.480264 IP 192.168.43.146.8880 > 192.168.43.147.7772: UDP, length 120
00:18:34.494190 IP 192.168.43.124.8880 > 192.168.43.146.7771: UDP, length 120
00:18:34.530259 IP 192.168.43.146.8880 > 192.168.43.147.7772: UDP, length 120
00:18:34.549686 IP 192.168.43.124.8880 > 192.168.43.146.7771: UDP, length 120
00:18:34.580257 IP 192.168.43.146.8880 > 192.168.43.147.7772: UDP, length 120
00:18:34.594097 IP 192.168.43.124.8880 > 192.168.43.146.7771: UDP, length 120
00:18:34.630303 IP 192.168.43.146.8880 > 192.168.43.147.7772: UDP, length 120
00:18:34.658737 IP 192.168.43.124.8880 > 192.168.43.146.7771: UDP, length 120
00:18:34.680259 IP 192.168.43.146.8880 > 192.168.43.147.7772: UDP, length 120
00:18:34.713341 IP 192.168.43.124.8880 > 192.168.43.146.7771: UDP, length 120
00:18:34.730259 IP 192.168.43.146.8880 > 192.168.43.147.7772: UDP, length 120
00:18:34.745335 IP 192.168.43.124.8880 > 192.168.43.146.7771: UDP, length 120
00:18:34.780257 IP 192.168.43.146.8880 > 192.168.43.147.7772: UDP, length 120
00:18:34.794063 IP 192.168.43.124.8880 > 192.168.43.146.7771: UDP, length 120
00:18:34.830259 IP 192.168.43.146.8880 > 192.168.43.147.7772: UDP, length 120
00:18:34.859222 IP 192.168.43.124.8880 > 192.168.43.146.7771: UDP, length 120
00:18:34.880260 IP 192.168.43.146.8880 > 192.168.43.147.7772: UDP, length 120
00:18:34.894135 IP 192.168.43.124.8880 > 192.168.43.146.7771: UDP, length 120
00:18:34.930263 IP 192.168.43.146.8880 > 192.168.43.147.7772: UDP, length 120
00:18:34.947101 IP 192.168.43.124.8880 > 192.168.43.146.7771: UDP, length 120
00:18:34.980269 IP 192.168.43.146.8880 > 192.168.43.147.7772: UDP, length 120
00:18:35.002965 IP 192.168.43.124.8880 > 192.168.43.146.7771: UDP, length 120
00:18:35.030268 IP 192.168.43.146.8880 > 192.168.43.147.7772: UDP, length 120
00:18:35.044611 IP 192.168.43.124.8880 > 192.168.43.146.7771: UDP, length 120
00:18:35.080257 IP 192.168.43.146.8880 > 192.168.43.147.7772: UDP, length 120
00:18:35.094151 IP 192.168.43.124.8880 > 192.168.43.146.7771: UDP, length 120
00:18:35.130260 IP 192.168.43.146.8880 > 192.168.43.147.7772: UDP, length 120
00:18:35.150465 IP 192.168.43.124.8880 > 192.168.43.146.7771: UDP, length 120
00:18:35.180263 IP 192.168.43.146.8880 > 192.168.43.147.7772: UDP, length 120
00:18:35.193462 IP 192.168.43.124.8880 > 192.168.43.146.7771: UDP, length 120
00:18:35.230261 IP 192.168.43.146.8880 > 192.168.43.147.7772: UDP, length 120
00:18:35.244605 IP 192.168.43.124.8880 > 192.168.43.146.7771: UDP, length 120
00:18:35.280333 IP 192.168.43.146.8880 > 192.168.43.147.7772: UDP, length 120
00:18:35.294225 IP 192.168.43.124.8880 > 192.168.43.146.7771: UDP, length 120
00:18:35.330296 IP 192.168.43.146.8880 > 192.168.43.147.7772: UDP, length 120
00:18:35.361881 IP 192.168.43.124.8880 > 192.168.43.146.7771: UDP, length 120
00:18:35.380245 IP 192.168.43.146.8880 > 192.168.43.147.7772: UDP, length 120
00:18:35.399688 IP 192.168.43.124.8880 > 192.168.43.146.7771: UDP, length 120
00:18:35.430241 IP 192.168.43.146.8880 > 192.168.43.147.7772: UDP, length 120
00:18:35.450611 IP 192.168.43.124.8880 > 192.168.43.146.7771: UDP, length 120
00:18:35.480235 IP 192.168.43.146.8880 > 192.168.43.147.7772: UDP, length 120
00:18:35.498019 IP 192.168.43.124.8880 > 192.168.43.146.7771: UDP, length 120
00:18:35.530232 IP 192.168.43.146.8880 > 192.168.43.147.7772: UDP, length 120
00:18:35.543978 IP 192.168.43.124.8880 > 192.168.43.146.7771: UDP, length 120
00:18:35.580230 IP 192.168.43.146.8880 > 192.168.43.147.7772: UDP, length 120
00:18:35.597866 IP 192.168.43.124.8880 > 192.168.43.146.7771: UDP, length 120
00:18:35.630232 IP 192.168.43.146.8880 > 192.168.43.147.7772: UDP, length 120
00:18:35.651202 IP 192.168.43.124.8880 > 192.168.43.146.7771: UDP, length 120
00:18:35.680233 IP 192.168.43.146.8880 > 192.168.43.147.7772: UDP, length 120
00:18:35.695246 IP 192.168.43.124.8880 > 192.168.43.146.7771: UDP, length 120
00:18:35.730273 IP 192.168.43.146.8880 > 192.168.43.147.7772: UDP, length 120
00:18:35.745880 IP 192.168.43.124.8880 > 192.168.43.146.7771: UDP, length 120
00:18:35.780242 IP 192.168.43.146.8880 > 192.168.43.147.7772: UDP, length 120
00:18:35.797019 IP 192.168.43.124.8880 > 192.168.43.146.7771: UDP, length 120
00:18:35.830230 IP 192.168.43.146.8880 > 192.168.43.147.7772: UDP, length 120
00:18:35.846000 IP 192.168.43.124.8880 > 192.168.43.146.7771: UDP, length 120
00:18:35.880230 IP 192.168.43.146.8880 > 192.168.43.147.7772: UDP, length 120
00:18:35.897063 IP 192.168.43.124.8880 > 192.168.43.146.7771: UDP, length 120
00:18:35.930229 IP 192.168.43.146.8880 > 192.168.43.147.7772: UDP, length 120
00:18:35.948417 IP 192.168.43.124.8880 > 192.168.43.146.7771: UDP, length 120
00:18:35.980250 IP 192.168.43.146.8880 > 192.168.43.147.7772: UDP, length 120
00:18:35.993978 IP 192.168.43.124.8880 > 192.168.43.146.7771: UDP, length 120
00:18:36.030242 IP 192.168.43.146.8880 > 192.168.43.147.7772: UDP, length 120
00:18:36.063285 IP 192.168.43.124.8880 > 192.168.43.146.7771: UDP, length 120
00:18:36.080234 IP 192.168.43.146.8880 > 192.168.43.147.7772: UDP, length 120
00:18:36.097078 IP 192.168.43.124.8880 > 192.168.43.146.7771: UDP, length 120
00:18:36.130231 IP 192.168.43.146.8880 > 192.168.43.147.7772: UDP, length 120
00:18:36.147668 IP 192.168.43.124.8880 > 192.168.43.146.7771: UDP, length 120
00:18:36.180228 IP 192.168.43.146.8880 > 192.168.43.147.7772: UDP, length 120
00:18:36.194309 IP 192.168.43.124.8880 > 192.168.43.146.7771: UDP, length 120
00:18:36.230228 IP 192.168.43.146.8880 > 192.168.43.147.7772: UDP, length 120
00:18:36.248008 IP 192.168.43.124.8880 > 192.168.43.146.7771: UDP, length 120
00:18:36.280226 IP 192.168.43.146.8880 > 192.168.43.147.7772: UDP, length 120
00:18:36.313459 IP 192.168.43.124.8880 > 192.168.43.146.7771: UDP, length 120
00:18:36.330232 IP 192.168.43.146.8880 > 192.168.43.147.7772: UDP, length 120
00:18:36.348964 IP 192.168.43.124.8880 > 192.168.43.146.7771: UDP, length 120
00:18:36.380229 IP 192.168.43.146.8880 > 192.168.43.147.7772: UDP, length 120
00:18:36.394354 IP 192.168.43.124.8880 > 192.168.43.146.7771: UDP, length 120
00:18:36.430227 IP 192.168.43.146.8880 > 192.168.43.147.7772: UDP, length 120
00:18:36.465029 IP 192.168.43.124.8880 > 192.168.43.146.7771: UDP, length 120
00:18:36.480315 IP 192.168.43.146.8880 > 192.168.43.147.7772: UDP, length 120
00:18:36.497834 IP 192.168.43.124.8880 > 192.168.43.146.7771: UDP, length 120
00:18:36.530348 IP 192.168.43.146.8880 > 192.168.43.147.7772: UDP, length 120
00:18:36.544050 IP 192.168.43.124.8880 > 192.168.43.146.7771: UDP, length 120
00:18:36.580316 IP 192.168.43.146.8880 > 192.168.43.147.7772: UDP, length 120
00:18:36.611063 IP 192.168.43.124.8880 > 192.168.43.146.7771: UDP, length 120
00:18:36.630289 IP 192.168.43.146.8880 > 192.168.43.147.7772: UDP, length 120
00:18:36.643711 IP 192.168.43.124.8880 > 192.168.43.146.7771: UDP, length 120
00:18:36.680295 IP 192.168.43.146.8880 > 192.168.43.147.7772: UDP, length 120
00:18:36.696127 IP 192.168.43.124.8880 > 192.168.43.146.7771: UDP, length 120
00:18:36.730304 IP 192.168.43.146.8880 > 192.168.43.147.7772: UDP, length 120
00:18:36.757281 IP 192.168.43.124.8880 > 192.168.43.146.7771: UDP, length 120
00:18:36.780254 IP 192.168.43.146.8880 > 192.168.43.147.7772: UDP, length 120
00:18:36.793638 IP 192.168.43.124.8880 > 192.168.43.146.7771: UDP, length 120
00:18:36.830314 IP 192.168.43.146.8880 > 192.168.43.147.7772: UDP, length 120
00:18:36.844572 IP 192.168.43.124.8880 > 192.168.43.146.7771: UDP, length 120
00:18:36.880281 IP 192.168.43.146.8880 > 192.168.43.147.7772: UDP, length 120
00:18:36.901528 IP 192.168.43.124.8880 > 192.168.43.146.7771: UDP, length 120
00:18:36.930279 IP 192.168.43.146.8880 > 192.168.43.147.7772: UDP, length 120
00:18:36.943828 IP 192.168.43.124.8880 > 192.168.43.146.7771: UDP, length 120
00:18:36.980250 IP 192.168.43.146.8880 > 192.168.43.147.7772: UDP, length 120
00:18:36.993750 IP 192.168.43.124.8880 > 192.168.43.146.7771: UDP, length 120
00:18:37.030225 IP 192.168.43.146.8880 > 192.168.43.147.7772: UDP, length 120
00:18:37.047181 IP 192.168.43.124.8880 > 192.168.43.146.7771: UDP, length 120
00:18:37.080217 IP 192.168.43.146.8880 > 192.168.43.147.7772: UDP, length 120
00:18:37.093759 IP 192.168.43.124.8880 > 192.168.43.146.7771: UDP, length 120
00:18:37.130203 IP 192.168.43.146.8880 > 192.168.43.147.7772: UDP, length 120
00:18:37.143706 IP 192.168.43.124.8880 > 192.168.43.146.7771: UDP, length 120
00:18:37.180199 IP 192.168.43.146.8880 > 192.168.43.147.7772: UDP, length 120
00:18:37.219679 IP 192.168.43.124.8880 > 192.168.43.146.7771: UDP, length 120
00:18:37.230230 IP 192.168.43.146.8880 > 192.168.43.147.7772: UDP, length 120
00:18:37.268969 IP 192.168.43.124.8880 > 192.168.43.146.7771: UDP, length 120
00:18:37.280223 IP 192.168.43.146.8880 > 192.168.43.147.7772: UDP, length 120
00:18:37.297793 IP 192.168.43.124.8880 > 192.168.43.146.7771: UDP, length 120
00:18:37.330211 IP 192.168.43.146.8880 > 192.168.43.147.7772: UDP, length 120
00:18:37.343746 IP 192.168.43.124.8880 > 192.168.43.146.7771: UDP, length 120
00:18:37.380200 IP 192.168.43.146.8880 > 192.168.43.147.7772: UDP, length 120
00:18:37.410432 IP 192.168.43.124.8880 > 192.168.43.146.7771: UDP, length 120
00:18:37.430199 IP 192.168.43.146.8880 > 192.168.43.147.7772: UDP, length 120
00:18:37.444460 IP 192.168.43.124.8880 > 192.168.43.146.7771: UDP, length 120
00:18:37.480202 IP 192.168.43.146.8880 > 192.168.43.147.7772: UDP, length 120
00:18:37.493857 IP 192.168.43.124.8880 > 192.168.43.146.7771: UDP, length 120
00:18:37.530199 IP 192.168.43.146.8880 > 192.168.43.147.7772: UDP, length 120
00:18:37.554984 IP 192.168.43.124.8880 > 192.168.43.146.7771: UDP, length 120
00:18:37.580199 IP 192.168.43.146.8880 > 192.168.43.147.7772: UDP, length 120
00:18:37.595656 IP 192.168.43.124.8880 > 192.168.43.146.7771: UDP, length 120
00:18:37.630237 IP 192.168.43.146.8880 > 192.168.43.147.7772: UDP, length 120
00:18:37.643282 IP 192.168.43.124.8880 > 192.168.43.146.7771: UDP, length 120
00:18:37.680226 IP 192.168.43.146.8880 > 192.168.43.147.7772: UDP, length 120
00:18:37.698640 IP 192.168.43.124.8880 > 192.168.43.146.7771: UDP, length 120
00:18:37.730226 IP 192.168.43.146.8880 > 192.168.43.147.7772: UDP, length 120
00:18:37.744252 IP 192.168.43.124.8880 > 192.168.43.146.7771: UDP, length 120
00:18:37.780321 IP 192.168.43.146.8880 > 192.168.43.147.7772: UDP, length 120
00:18:37.793853 IP 192.168.43.124.8880 > 192.168.43.146.7771: UDP, length 120
00:18:37.830292 IP 192.168.43.146.8880 > 192.168.43.147.7772: UDP, length 120
00:18:37.858145 IP 192.168.43.124.8880 > 192.168.43.146.7771: UDP, length 120
00:18:37.880235 IP 192.168.43.146.8880 > 192.168.43.147.7772: UDP, length 120
00:18:37.894622 IP 192.168.43.124.8880 > 192.168.43.146.7771: UDP, length 120
00:18:37.930230 IP 192.168.43.146.8880 > 192.168.43.147.7772: UDP, length 120
00:18:37.959630 IP 192.168.43.124.8880 > 192.168.43.146.7771: UDP, length 120
00:18:37.980232 IP 192.168.43.146.8880 > 192.168.43.147.7772: UDP, length 120
00:18:37.993378 IP 192.168.43.124.8880 > 192.168.43.146.7771: UDP, length 120
00:18:38.030226 IP 192.168.43.146.8880 > 192.168.43.147.7772: UDP, length 120
00:18:38.048815 IP 192.168.43.124.8880 > 192.168.43.146.7771: UDP, length 120
00:18:38.080235 IP 192.168.43.146.8880 > 192.168.43.147.7772: UDP, length 120
00:18:38.098454 IP 192.168.43.124.8880 > 192.168.43.146.7771: UDP, length 120
00:18:38.130229 IP 192.168.43.146.8880 > 192.168.43.147.7772: UDP, length 120
00:18:38.145580 IP 192.168.43.124.8880 > 192.168.43.146.7771: UDP, length 120
00:18:38.180247 IP 192.168.43.146.8880 > 192.168.43.147.7772: UDP, length 120
00:18:38.200169 IP 192.168.43.124.8880 > 192.168.43.146.7771: UDP, length 120
00:18:38.230235 IP 192.168.43.146.8880 > 192.168.43.147.7772: UDP, length 120
00:18:38.246160 IP 192.168.43.124.8880 > 192.168.43.146.7771: UDP, length 120
00:18:38.280228 IP 192.168.43.146.8880 > 192.168.43.147.7772: UDP, length 120
00:18:38.296974 IP 192.168.43.124.8880 > 192.168.43.146.7771: UDP, length 120
00:18:38.330238 IP 192.168.43.146.8880 > 192.168.43.147.7772: UDP, length 120
00:18:38.345924 IP 192.168.43.124.8880 > 192.168.43.146.7771: UDP, length 120
00:18:38.380232 IP 192.168.43.146.8880 > 192.168.43.147.7772: UDP, length 120
00:18:38.394929 IP 192.168.43.124.8880 > 192.168.43.146.7771: UDP, length 120
00:18:38.430237 IP 192.168.43.146.8880 > 192.168.43.147.7772: UDP, length 120
00:18:38.444914 IP 192.168.43.124.8880 > 192.168.43.146.7771: UDP, length 120
00:18:38.480220 IP 192.168.43.146.8880 > 192.168.43.147.7772: UDP, length 120
00:18:38.497875 IP 192.168.43.124.8880 > 192.168.43.146.7771: UDP, length 120
00:18:38.530227 IP 192.168.43.146.8880 > 192.168.43.147.7772: UDP, length 120
00:18:38.545573 IP 192.168.43.124.8880 > 192.168.43.146.7771: UDP, length 120
00:18:38.580265 IP 192.168.43.146.8880 > 192.168.43.147.7772: UDP, length 120
00:18:38.596228 IP 192.168.43.124.8880 > 192.168.43.146.7771: UDP, length 120
00:18:38.630253 IP 192.168.43.146.8880 > 192.168.43.147.7772: UDP, length 120
00:18:38.647180 IP 192.168.43.124.8880 > 192.168.43.146.7771: UDP, length 120
00:18:38.680248 IP 192.168.43.146.8880 > 192.168.43.147.7772: UDP, length 120
00:18:38.695641 IP 192.168.43.124.8880 > 192.168.43.146.7771: UDP, length 120
00:18:38.730279 IP 192.168.43.146.8880 > 192.168.43.147.7772: UDP, length 120
00:18:38.749486 IP 192.168.43.124.8880 > 192.168.43.146.7771: UDP, length 120
00:18:38.780231 IP 192.168.43.146.8880 > 192.168.43.147.7772: UDP, length 120
00:18:38.796397 IP 192.168.43.124.8880 > 192.168.43.146.7771: UDP, length 120
00:18:38.830293 IP 192.168.43.146.8880 > 192.168.43.147.7772: UDP, length 120
00:18:38.846272 IP 192.168.43.124.8880 > 192.168.43.146.7771: UDP, length 120
00:18:38.880246 IP 192.168.43.146.8880 > 192.168.43.147.7772: UDP, length 120
00:18:38.896413 IP 192.168.43.124.8880 > 192.168.43.146.7771: UDP, length 120
00:18:38.930237 IP 192.168.43.146.8880 > 192.168.43.147.7772: UDP, length 120
00:18:38.945798 IP 192.168.43.124.8880 > 192.168.43.146.7771: UDP, length 120
00:18:38.980242 IP 192.168.43.146.8880 > 192.168.43.147.7772: UDP, length 120
00:18:38.996410 IP 192.168.43.124.8880 > 192.168.43.146.7771: UDP, length 120
00:18:39.030227 IP 192.168.43.146.8880 > 192.168.43.147.7772: UDP, length 120
00:18:39.045753 IP 192.168.43.124.8880 > 192.168.43.146.7771: UDP, length 120
00:18:39.080228 IP 192.168.43.146.8880 > 192.168.43.147.7772: UDP, length 120
00:18:39.094931 IP 192.168.43.124.8880 > 192.168.43.146.7771: UDP, length 120
00:18:39.130231 IP 192.168.43.146.8880 > 192.168.43.147.7772: UDP, length 120
00:18:39.147460 IP 192.168.43.124.8880 > 192.168.43.146.7771: UDP, length 120
00:18:39.180243 IP 192.168.43.146.8880 > 192.168.43.147.7772: UDP, length 120
00:18:39.197817 IP 192.168.43.124.8880 > 192.168.43.146.7771: UDP, length 120
00:18:39.230235 IP 192.168.43.146.8880 > 192.168.43.147.7772: UDP, length 120
00:18:39.245569 IP 192.168.43.124.8880 > 192.168.43.146.7771: UDP, length 120
00:18:39.280227 IP 192.168.43.146.8880 > 192.168.43.147.7772: UDP, length 120
00:18:39.296652 IP 192.168.43.124.8880 > 192.168.43.146.7771: UDP, length 120
00:18:39.330229 IP 192.168.43.146.8880 > 192.168.43.147.7772: UDP, length 120
00:18:39.345789 IP 192.168.43.124.8880 > 192.168.43.146.7771: UDP, length 120
00:18:39.380224 IP 192.168.43.146.8880 > 192.168.43.147.7772: UDP, length 120
00:18:39.395738 IP 192.168.43.124.8880 > 192.168.43.146.7771: UDP, length 120
00:18:39.430225 IP 192.168.43.146.8880 > 192.168.43.147.7772: UDP, length 120
00:18:39.445733 IP 192.168.43.124.8880 > 192.168.43.146.7771: UDP, length 120
00:18:39.480223 IP 192.168.43.146.8880 > 192.168.43.147.7772: UDP, length 120
00:18:39.495697 IP 192.168.43.124.8880 > 192.168.43.146.7771: UDP, length 120
00:18:39.530227 IP 192.168.43.146.8880 > 192.168.43.147.7772: UDP, length 120
00:18:39.544649 IP 192.168.43.124.8880 > 192.168.43.146.7771: UDP, length 120
00:18:39.580223 IP 192.168.43.146.8880 > 192.168.43.147.7772: UDP, length 120
00:18:39.596305 IP 192.168.43.124.8880 > 192.168.43.146.7771: UDP, length 120
00:18:39.630233 IP 192.168.43.146.8880 > 192.168.43.147.7772: UDP, length 120
00:18:39.646160 IP 192.168.43.124.8880 > 192.168.43.146.7771: UDP, length 120
00:18:39.680232 IP 192.168.43.146.8880 > 192.168.43.147.7772: UDP, length 120
00:18:39.697262 IP 192.168.43.124.8880 > 192.168.43.146.7771: UDP, length 120
00:18:39.730227 IP 192.168.43.146.8880 > 192.168.43.147.7772: UDP, length 120
00:18:39.747003 IP 192.168.43.124.8880 > 192.168.43.146.7771: UDP, length 120
00:18:39.780224 IP 192.168.43.146.8880 > 192.168.43.147.7772: UDP, length 120
00:18:39.799030 IP 192.168.43.124.8880 > 192.168.43.146.7771: UDP, length 120
00:18:39.830290 IP 192.168.43.146.8880 > 192.168.43.147.7772: UDP, length 120
00:18:39.844537 IP 192.168.43.124.8880 > 192.168.43.146.7771: UDP, length 120
00:18:39.880244 IP 192.168.43.146.8880 > 192.168.43.147.7772: UDP, length 120
00:18:39.895828 IP 192.168.43.124.8880 > 192.168.43.146.7771: UDP, length 120
00:18:39.930233 IP 192.168.43.146.8880 > 192.168.43.147.7772: UDP, length 120
00:18:39.945236 IP 192.168.43.124.8880 > 192.168.43.146.7771: UDP, length 120
00:18:39.980236 IP 192.168.43.146.8880 > 192.168.43.147.7772: UDP, length 120
00:18:39.995654 IP 192.168.43.124.8880 > 192.168.43.146.7771: UDP, length 120
00:18:40.030230 IP 192.168.43.146.8880 > 192.168.43.147.7772: UDP, length 120
00:18:40.045442 IP 192.168.43.124.8880 > 192.168.43.146.7771: UDP, length 120
00:18:40.080238 IP 192.168.43.146.8880 > 192.168.43.147.7772: UDP, length 120
00:18:40.095358 IP 192.168.43.124.8880 > 192.168.43.146.7771: UDP, length 120
00:18:40.130226 IP 192.168.43.146.8880 > 192.168.43.147.7772: UDP, length 120
00:18:40.144236 IP 192.168.43.124.8880 > 192.168.43.146.7771: UDP, length 120
00:18:40.180224 IP 192.168.43.146.8880 > 192.168.43.147.7772: UDP, length 120
00:18:40.195412 IP 192.168.43.124.8880 > 192.168.43.146.7771: UDP, length 120
00:18:40.230276 IP 192.168.43.146.8880 > 192.168.43.147.7772: UDP, length 120
00:18:40.245531 IP 192.168.43.124.8880 > 192.168.43.146.7771: UDP, length 120
00:18:40.280246 IP 192.168.43.146.8880 > 192.168.43.147.7772: UDP, length 120
00:18:40.295895 IP 192.168.43.124.8880 > 192.168.43.146.7771: UDP, length 120
00:18:40.330235 IP 192.168.43.146.8880 > 192.168.43.147.7772: UDP, length 120
00:18:40.347440 IP 192.168.43.124.8880 > 192.168.43.146.7771: UDP, length 120
00:18:40.380226 IP 192.168.43.146.8880 > 192.168.43.147.7772: UDP, length 120
00:18:40.393499 IP 192.168.43.124.8880 > 192.168.43.146.7771: UDP, length 120
00:18:40.430224 IP 192.168.43.146.8880 > 192.168.43.147.7772: UDP, length 120
00:18:40.447522 IP 192.168.43.124.8880 > 192.168.43.146.7771: UDP, length 120
00:18:40.480223 IP 192.168.43.146.8880 > 192.168.43.147.7772: UDP, length 120
00:18:40.505455 IP 192.168.43.124.8880 > 192.168.43.146.7771: UDP, length 120
00:18:40.530227 IP 192.168.43.146.8880 > 192.168.43.147.7772: UDP, length 120
00:18:40.560273 IP 192.168.43.124.8880 > 192.168.43.146.7771: UDP, length 120
00:18:40.580223 IP 192.168.43.146.8880 > 192.168.43.147.7772: UDP, length 120
00:18:40.614112 IP 192.168.43.124.8880 > 192.168.43.146.7771: UDP, length 120
00:18:40.630228 IP 192.168.43.146.8880 > 192.168.43.147.7772: UDP, length 120
00:18:40.649726 IP 192.168.43.124.8880 > 192.168.43.146.7771: UDP, length 120
00:18:40.680224 IP 192.168.43.146.8880 > 192.168.43.147.7772: UDP, length 120
00:18:40.705410 IP 192.168.43.124.8880 > 192.168.43.146.7771: UDP, length 120
00:18:40.730223 IP 192.168.43.146.8880 > 192.168.43.147.7772: UDP, length 120
00:18:40.759739 IP 192.168.43.124.8880 > 192.168.43.146.7771: UDP, length 120
00:18:40.780223 IP 192.168.43.146.8880 > 192.168.43.147.7772: UDP, length 120
00:18:40.813959 IP 192.168.43.124.8880 > 192.168.43.146.7771: UDP, length 120
00:18:40.830321 IP 192.168.43.146.8880 > 192.168.43.147.7772: UDP, length 120
00:18:40.846332 IP 192.168.43.124.8880 > 192.168.43.146.7771: UDP, length 120
00:18:40.880277 IP 192.168.43.146.8880 > 192.168.43.147.7772: UDP, length 120
00:18:40.905483 IP 192.168.43.124.8880 > 192.168.43.146.7771: UDP, length 120
00:18:40.930237 IP 192.168.43.146.8880 > 192.168.43.147.7772: UDP, length 120
00:18:40.959966 IP 192.168.43.124.8880 > 192.168.43.146.7771: UDP, length 120
00:18:40.980235 IP 192.168.43.146.8880 > 192.168.43.147.7772: UDP, length 120
00:18:40.993572 IP 192.168.43.124.8880 > 192.168.43.146.7771: UDP, length 120
00:18:41.030227 IP 192.168.43.146.8880 > 192.168.43.147.7772: UDP, length 120
00:18:41.044861 IP 192.168.43.124.8880 > 192.168.43.146.7771: UDP, length 120
00:18:41.080227 IP 192.168.43.146.8880 > 192.168.43.147.7772: UDP, length 120
00:18:41.093826 IP 192.168.43.124.8880 > 192.168.43.146.7771: UDP, length 120
00:18:41.130226 IP 192.168.43.146.8880 > 192.168.43.147.7772: UDP, length 120
00:18:41.143540 IP 192.168.43.124.8880 > 192.168.43.146.7771: UDP, length 120
00:18:41.180225 IP 192.168.43.146.8880 > 192.168.43.147.7772: UDP, length 120
00:18:41.205157 IP 192.168.43.124.8880 > 192.168.43.146.7771: UDP, length 120
00:18:41.230228 IP 192.168.43.146.8880 > 192.168.43.147.7772: UDP, length 120
00:18:41.259427 IP 192.168.43.124.8880 > 192.168.43.146.7771: UDP, length 120
00:18:41.280229 IP 192.168.43.146.8880 > 192.168.43.147.7772: UDP, length 120
00:18:41.293504 IP 192.168.43.124.8880 > 192.168.43.146.7771: UDP, length 120
00:18:41.330230 IP 192.168.43.146.8880 > 192.168.43.147.7772: UDP, length 120
00:18:41.343372 IP 192.168.43.124.8880 > 192.168.43.146.7771: UDP, length 120
00:18:41.380242 IP 192.168.43.146.8880 > 192.168.43.147.7772: UDP, length 120
00:18:41.392968 IP 192.168.43.124.8880 > 192.168.43.146.7771: UDP, length 120
00:18:41.430228 IP 192.168.43.146.8880 > 192.168.43.147.7772: UDP, length 120
00:18:41.455129 IP 192.168.43.124.8880 > 192.168.43.146.7771: UDP, length 120
00:18:41.480224 IP 192.168.43.146.8880 > 192.168.43.147.7772: UDP, length 120
00:18:41.509136 IP 192.168.43.124.8880 > 192.168.43.146.7771: UDP, length 120
00:18:41.530227 IP 192.168.43.146.8880 > 192.168.43.147.7772: UDP, length 120
00:18:41.544200 IP 192.168.43.124.8880 > 192.168.43.146.7771: UDP, length 120
00:18:41.580226 IP 192.168.43.146.8880 > 192.168.43.147.7772: UDP, length 120
00:18:41.593718 IP 192.168.43.124.8880 > 192.168.43.146.7771: UDP, length 120
00:18:41.630233 IP 192.168.43.146.8880 > 192.168.43.147.7772: UDP, length 120
00:18:41.646229 IP 192.168.43.124.8880 > 192.168.43.146.7771: UDP, length 120
00:18:41.680227 IP 192.168.43.146.8880 > 192.168.43.147.7772: UDP, length 120
00:18:41.693851 IP 192.168.43.124.8880 > 192.168.43.146.7771: UDP, length 120
00:18:41.730274 IP 192.168.43.146.8880 > 192.168.43.147.7772: UDP, length 120
00:18:41.746602 IP 192.168.43.124.8880 > 192.168.43.146.7771: UDP, length 120
00:18:41.780233 IP 192.168.43.146.8880 > 192.168.43.147.7772: UDP, length 120
00:18:41.796302 IP 192.168.43.124.8880 > 192.168.43.146.7771: UDP, length 120
00:18:41.830229 IP 192.168.43.146.8880 > 192.168.43.147.7772: UDP, length 120
00:18:41.847869 IP 192.168.43.124.8880 > 192.168.43.146.7771: UDP, length 120
00:18:41.880293 IP 192.168.43.146.8880 > 192.168.43.147.7772: UDP, length 120
00:18:41.897177 IP 192.168.43.124.8880 > 192.168.43.146.7771: UDP, length 120
00:18:41.930250 IP 192.168.43.146.8880 > 192.168.43.147.7772: UDP, length 120
00:18:41.947298 IP 192.168.43.124.8880 > 192.168.43.146.7771: UDP, length 120
00:18:41.980316 IP 192.168.43.146.8880 > 192.168.43.147.7772: UDP, length 120
00:18:41.995710 IP 192.168.43.124.8880 > 192.168.43.146.7771: UDP, length 120
00:18:42.030347 IP 192.168.43.146.8880 > 192.168.43.147.7772: UDP, length 120
00:18:42.046129 IP 192.168.43.124.8880 > 192.168.43.146.7771: UDP, length 120
00:18:42.080313 IP 192.168.43.146.8880 > 192.168.43.147.7772: UDP, length 120
00:18:42.095527 IP 192.168.43.124.8880 > 192.168.43.146.7771: UDP, length 120
00:18:42.130266 IP 192.168.43.146.8880 > 192.168.43.147.7772: UDP, length 120
00:18:42.144938 IP 192.168.43.124.8880 > 192.168.43.146.7771: UDP, length 120
00:18:42.180257 IP 192.168.43.146.8880 > 192.168.43.147.7772: UDP, length 120
00:18:42.195316 IP 192.168.43.124.8880 > 192.168.43.146.7771: UDP, length 120
00:18:42.230289 IP 192.168.43.146.8880 > 192.168.43.147.7772: UDP, length 120
00:18:42.245200 IP 192.168.43.124.8880 > 192.168.43.146.7771: UDP, length 120
00:18:42.280304 IP 192.168.43.146.8880 > 192.168.43.147.7772: UDP, length 120
00:18:42.298064 IP 192.168.43.124.8880 > 192.168.43.146.7771: UDP, length 120
00:18:42.330266 IP 192.168.43.146.8880 > 192.168.43.147.7772: UDP, length 120
00:18:42.345863 IP 192.168.43.124.8880 > 192.168.43.146.7771: UDP, length 120
00:18:42.380283 IP 192.168.43.146.8880 > 192.168.43.147.7772: UDP, length 120
00:18:42.396313 IP 192.168.43.124.8880 > 192.168.43.146.7771: UDP, length 120
00:18:42.430278 IP 192.168.43.146.8880 > 192.168.43.147.7772: UDP, length 120
00:18:42.444492 IP 192.168.43.124.8880 > 192.168.43.146.7771: UDP, length 120
00:18:42.480255 IP 192.168.43.146.8880 > 192.168.43.147.7772: UDP, length 120
00:18:42.505901 IP 192.168.43.124.8880 > 192.168.43.146.7771: UDP, length 120
00:18:42.530209 IP 192.168.43.146.8880 > 192.168.43.147.7772: UDP, length 120
00:18:42.545720 IP 192.168.43.124.8880 > 192.168.43.146.7771: UDP, length 120
00:18:42.580198 IP 192.168.43.146.8880 > 192.168.43.147.7772: UDP, length 120
00:18:42.594669 IP 192.168.43.124.8880 > 192.168.43.146.7771: UDP, length 120
00:18:42.630228 IP 192.168.43.146.8880 > 192.168.43.147.7772: UDP, length 120
00:18:42.645158 IP 192.168.43.124.8880 > 192.168.43.146.7771: UDP, length 120
00:18:42.680227 IP 192.168.43.146.8880 > 192.168.43.147.7772: UDP, length 120
00:18:42.696308 IP 192.168.43.124.8880 > 192.168.43.146.7771: UDP, length 120
00:18:42.730225 IP 192.168.43.146.8880 > 192.168.43.147.7772: UDP, length 120
00:18:42.744255 IP 192.168.43.124.8880 > 192.168.43.146.7771: UDP, length 120
00:18:42.780225 IP 192.168.43.146.8880 > 192.168.43.147.7772: UDP, length 120
00:18:42.795381 IP 192.168.43.124.8880 > 192.168.43.146.7771: UDP, length 120
00:18:42.830227 IP 192.168.43.146.8880 > 192.168.43.147.7772: UDP, length 120
00:18:42.845492 IP 192.168.43.124.8880 > 192.168.43.146.7771: UDP, length 120
00:18:42.880297 IP 192.168.43.146.8880 > 192.168.43.147.7772: UDP, length 120
00:18:42.895438 IP 192.168.43.124.8880 > 192.168.43.146.7771: UDP, length 120
00:18:42.930241 IP 192.168.43.146.8880 > 192.168.43.147.7772: UDP, length 120
00:18:42.946507 IP 192.168.43.124.8880 > 192.168.43.146.7771: UDP, length 120
00:18:42.980240 IP 192.168.43.146.8880 > 192.168.43.147.7772: UDP, length 120
00:18:42.995107 IP 192.168.43.124.8880 > 192.168.43.146.7771: UDP, length 120
00:18:43.030231 IP 192.168.43.146.8880 > 192.168.43.147.7772: UDP, length 120
00:18:43.045363 IP 192.168.43.124.8880 > 192.168.43.146.7771: UDP, length 120
00:18:43.080230 IP 192.168.43.146.8880 > 192.168.43.147.7772: UDP, length 120
00:18:43.098155 IP 192.168.43.124.8880 > 192.168.43.146.7771: UDP, length 120
00:18:43.130231 IP 192.168.43.146.8880 > 192.168.43.147.7772: UDP, length 120
00:18:43.145130 IP 192.168.43.124.8880 > 192.168.43.146.7771: UDP, length 120
00:18:43.180227 IP 192.168.43.146.8880 > 192.168.43.147.7772: UDP, length 120
00:18:43.195287 IP 192.168.43.124.8880 > 192.168.43.146.7771: UDP, length 120
00:18:43.230273 IP 192.168.43.146.8880 > 192.168.43.147.7772: UDP, length 120
00:18:43.245174 IP 192.168.43.124.8880 > 192.168.43.146.7771: UDP, length 120
00:18:43.280237 IP 192.168.43.146.8880 > 192.168.43.147.7772: UDP, length 120
00:18:43.295162 IP 192.168.43.124.8880 > 192.168.43.146.7771: UDP, length 120
00:18:43.330229 IP 192.168.43.146.8880 > 192.168.43.147.7772: UDP, length 120
00:18:43.344516 IP 192.168.43.124.8880 > 192.168.43.146.7771: UDP, length 120
00:18:43.380229 IP 192.168.43.146.8880 > 192.168.43.147.7772: UDP, length 120
00:18:43.396116 IP 192.168.43.124.8880 > 192.168.43.146.7771: UDP, length 120
00:18:43.430236 IP 192.168.43.146.8880 > 192.168.43.147.7772: UDP, length 120
00:18:43.444213 IP 192.168.43.124.8880 > 192.168.43.146.7771: UDP, length 120
00:18:43.480227 IP 192.168.43.146.8880 > 192.168.43.147.7772: UDP, length 120
00:18:43.497486 IP 192.168.43.124.8880 > 192.168.43.146.7771: UDP, length 120
00:18:43.530227 IP 192.168.43.146.8880 > 192.168.43.147.7772: UDP, length 120
00:18:43.545132 IP 192.168.43.124.8880 > 192.168.43.146.7771: UDP, length 120
00:18:43.580224 IP 192.168.43.146.8880 > 192.168.43.147.7772: UDP, length 120
00:18:43.607431 IP 192.168.43.124.8880 > 192.168.43.146.7771: UDP, length 120
00:18:43.630234 IP 192.168.43.146.8880 > 192.168.43.147.7772: UDP, length 120
00:18:43.644760 IP 192.168.43.124.8880 > 192.168.43.146.7771: UDP, length 120
00:18:43.680229 IP 192.168.43.146.8880 > 192.168.43.147.7772: UDP, length 120
00:18:43.695027 IP 192.168.43.124.8880 > 192.168.43.146.7771: UDP, length 120
00:18:43.730227 IP 192.168.43.146.8880 > 192.168.43.147.7772: UDP, length 120
00:18:43.744357 IP 192.168.43.124.8880 > 192.168.43.146.7771: UDP, length 120
00:18:43.780225 IP 192.168.43.146.8880 > 192.168.43.147.7772: UDP, length 120
00:18:43.794014 IP 192.168.43.124.8880 > 192.168.43.146.7771: UDP, length 120
00:18:43.830224 IP 192.168.43.146.8880 > 192.168.43.147.7772: UDP, length 120
00:18:43.844846 IP 192.168.43.124.8880 > 192.168.43.146.7771: UDP, length 120
00:18:43.880225 IP 192.168.43.146.8880 > 192.168.43.147.7772: UDP, length 120
00:18:43.893445 IP 192.168.43.124.8880 > 192.168.43.146.7771: UDP, length 120
00:18:43.930225 IP 192.168.43.146.8880 > 192.168.43.147.7772: UDP, length 120
00:18:43.958585 IP 192.168.43.124.8880 > 192.168.43.146.7771: UDP, length 120
00:18:43.980258 IP 192.168.43.146.8880 > 192.168.43.147.7772: UDP, length 120
00:18:44.013689 IP 192.168.43.124.8880 > 192.168.43.146.7771: UDP, length 120
00:18:44.030231 IP 192.168.43.146.8880 > 192.168.43.147.7772: UDP, length 120
00:18:44.046609 IP 192.168.43.124.8880 > 192.168.43.146.7771: UDP, length 120
00:18:44.080228 IP 192.168.43.146.8880 > 192.168.43.147.7772: UDP, length 120
00:18:44.101709 IP 192.168.43.124.8880 > 192.168.43.146.7771: UDP, length 120
00:18:44.130225 IP 192.168.43.146.8880 > 192.168.43.147.7772: UDP, length 120
00:18:44.156460 IP 192.168.43.124.8880 > 192.168.43.146.7771: UDP, length 120
00:18:44.180224 IP 192.168.43.146.8880 > 192.168.43.147.7772: UDP, length 120
00:18:44.210800 IP 192.168.43.124.8880 > 192.168.43.146.7771: UDP, length 120
00:18:44.230225 IP 192.168.43.146.8880 > 192.168.43.147.7772: UDP, length 120
00:18:44.243260 IP 192.168.43.124.8880 > 192.168.43.146.7771: UDP, length 120
00:18:44.280222 IP 192.168.43.146.8880 > 192.168.43.147.7772: UDP, length 120
00:18:44.293395 IP 192.168.43.124.8880 > 192.168.43.146.7771: UDP, length 120
00:18:44.330225 IP 192.168.43.146.8880 > 192.168.43.147.7772: UDP, length 120
00:18:44.345682 IP 192.168.43.124.8880 > 192.168.43.146.7771: UDP, length 120
00:18:44.380224 IP 192.168.43.146.8880 > 192.168.43.147.7772: UDP, length 120
00:18:44.401133 IP 192.168.43.124.8880 > 192.168.43.146.7771: UDP, length 120
00:18:44.430226 IP 192.168.43.146.8880 > 192.168.43.147.7772: UDP, length 120
00:18:44.460333 IP 192.168.43.124.8880 > 192.168.43.146.7771: UDP, length 120
00:18:44.480231 IP 192.168.43.146.8880 > 192.168.43.147.7772: UDP, length 120
00:18:44.493616 IP 192.168.43.124.8880 > 192.168.43.146.7771: UDP, length 120
00:18:44.530231 IP 192.168.43.146.8880 > 192.168.43.147.7772: UDP, length 120
00:18:44.545296 IP 192.168.43.124.8880 > 192.168.43.146.7771: UDP, length 120
00:18:44.580230 IP 192.168.43.146.8880 > 192.168.43.147.7772: UDP, length 120
00:18:44.604847 IP 192.168.43.124.8880 > 192.168.43.146.7771: UDP, length 120
00:18:44.630231 IP 192.168.43.146.8880 > 192.168.43.147.7772: UDP, length 120
00:18:44.658831 IP 192.168.43.124.8880 > 192.168.43.146.7771: UDP, length 120
00:18:44.680226 IP 192.168.43.146.8880 > 192.168.43.147.7772: UDP, length 120
00:18:44.712604 IP 192.168.43.124.8880 > 192.168.43.146.7771: UDP, length 120
00:18:44.730262 IP 192.168.43.146.8880 > 192.168.43.147.7772: UDP, length 120
00:18:44.745910 IP 192.168.43.124.8880 > 192.168.43.146.7771: UDP, length 120
00:18:44.780231 IP 192.168.43.146.8880 > 192.168.43.147.7772: UDP, length 120
00:18:44.800112 IP 192.168.43.124.8880 > 192.168.43.146.7771: UDP, length 120
00:18:44.830226 IP 192.168.43.146.8880 > 192.168.43.147.7772: UDP, length 120
00:18:44.862554 IP 192.168.43.124.8880 > 192.168.43.146.7771: UDP, length 120
00:18:44.880338 IP 192.168.43.146.8880 > 192.168.43.147.7772: UDP, length 120
00:18:44.920567 IP 192.168.43.124.8880 > 192.168.43.146.7771: UDP, length 120
00:18:44.930298 IP 192.168.43.146.8880 > 192.168.43.147.7772: UDP, length 120
00:18:44.946629 IP 192.168.43.124.8880 > 192.168.43.146.7771: UDP, length 120
00:18:44.980324 IP 192.168.43.146.8880 > 192.168.43.147.7772: UDP, length 120
00:18:45.030264 IP 192.168.43.146.8880 > 192.168.43.147.7772: UDP, length 120
00:18:45.080212 IP 192.168.43.146.8880 > 192.168.43.147.7772: UDP, length 120
00:18:45.120093 IP 192.168.43.124.8880 > 192.168.43.146.7771: UDP, length 120
00:18:45.120204 IP 192.168.43.124.8880 > 192.168.43.146.7771: UDP, length 120
00:18:45.120277 IP 192.168.43.124.8880 > 192.168.43.146.7771: UDP, length 120
00:18:45.130204 IP 192.168.43.146.8880 > 192.168.43.147.7772: UDP, length 120
00:18:45.145369 IP 192.168.43.124.8880 > 192.168.43.146.7771: UDP, length 120
00:18:45.180201 IP 192.168.43.146.8880 > 192.168.43.147.7772: UDP, length 120
00:18:45.193227 IP 192.168.43.124.8880 > 192.168.43.146.7771: UDP, length 120
00:18:45.230201 IP 192.168.43.146.8880 > 192.168.43.147.7772: UDP, length 120
00:18:45.248075 IP 192.168.43.124.8880 > 192.168.43.146.7771: UDP, length 120
00:18:45.280199 IP 192.168.43.146.8880 > 192.168.43.147.7772: UDP, length 120
00:18:45.307137 IP 192.168.43.124.8880 > 192.168.43.146.7771: UDP, length 120
00:18:45.330202 IP 192.168.43.146.8880 > 192.168.43.147.7772: UDP, length 120
00:18:45.380199 IP 192.168.43.146.8880 > 192.168.43.147.7772: UDP, length 120
00:18:45.430197 IP 192.168.43.146.8880 > 192.168.43.147.7772: UDP, length 120
00:18:45.470962 IP 192.168.43.124.8880 > 192.168.43.146.7771: UDP, length 120
00:18:45.471037 IP 192.168.43.124.8880 > 192.168.43.146.7771: UDP, length 120
00:18:45.471116 IP 192.168.43.124.8880 > 192.168.43.146.7771: UDP, length 120
00:18:45.480197 IP 192.168.43.146.8880 > 192.168.43.147.7772: UDP, length 120
00:18:45.500870 IP 192.168.43.124.8880 > 192.168.43.146.7771: UDP, length 120
00:18:45.530202 IP 192.168.43.146.8880 > 192.168.43.147.7772: UDP, length 120
00:18:45.551324 IP 192.168.43.124.8880 > 192.168.43.146.7771: UDP, length 120
00:18:45.580208 IP 192.168.43.146.8880 > 192.168.43.147.7772: UDP, length 120
00:18:45.607472 IP 192.168.43.124.8880 > 192.168.43.146.7771: UDP, length 120
