01:54:22.258149 IP 192.168.43.124.8880 > 192.168.43.195.7771: UDP, length 120
01:54:22.309319 IP 192.168.43.124.8880 > 192.168.43.195.7771: UDP, length 120
01:54:22.359139 IP 192.168.43.124.8880 > 192.168.43.195.7771: UDP, length 120
01:54:22.408164 IP 192.168.43.124.8880 > 192.168.43.195.7771: UDP, length 120
01:54:22.458916 IP 192.168.43.124.8880 > 192.168.43.195.7771: UDP, length 120
01:54:22.509152 IP 192.168.43.124.8880 > 192.168.43.195.7771: UDP, length 120
01:54:22.559345 IP 192.168.43.124.8880 > 192.168.43.195.7771: UDP, length 120
01:54:22.609162 IP 192.168.43.124.8880 > 192.168.43.195.7771: UDP, length 120
01:54:22.659165 IP 192.168.43.124.8880 > 192.168.43.195.7771: UDP, length 120
01:54:22.709121 IP 192.168.43.124.8880 > 192.168.43.195.7771: UDP, length 120
01:54:22.759283 IP 192.168.43.124.8880 > 192.168.43.195.7771: UDP, length 120
01:54:22.773058 IP 192.168.43.195.8880 > 192.168.43.124.7772: UDP, length 120
01:54:22.809136 IP 192.168.43.124.8880 > 192.168.43.195.7771: UDP, length 120
01:54:22.823101 IP 192.168.43.195.8880 > 192.168.43.124.7772: UDP, length 120
01:54:22.859181 IP 192.168.43.124.8880 > 192.168.43.195.7771: UDP, length 120
01:54:22.873119 IP 192.168.43.195.8880 > 192.168.43.124.7772: UDP, length 120
01:54:22.909161 IP 192.168.43.124.8880 > 192.168.43.195.7771: UDP, length 120
01:54:22.923079 IP 192.168.43.195.8880 > 192.168.43.124.7772: UDP, length 120
01:54:22.959159 IP 192.168.43.124.8880 > 192.168.43.195.7771: UDP, length 120
01:54:22.973071 IP 192.168.43.195.8880 > 192.168.43.124.7772: UDP, length 120
01:54:23.009267 IP 192.168.43.124.8880 > 192.168.43.195.7771: UDP, length 120
01:54:23.023070 IP 192.168.43.195.8880 > 192.168.43.124.7772: UDP, length 120
01:54:23.059553 IP 192.168.43.124.8880 > 192.168.43.195.7771: UDP, length 120
01:54:23.073073 IP 192.168.43.195.8880 > 192.168.43.124.7772: UDP, length 120
01:54:23.109139 IP 192.168.43.124.8880 > 192.168.43.195.7771: UDP, length 120
01:54:23.123076 IP 192.168.43.195.8880 > 192.168.43.124.7772: UDP, length 120
01:54:23.159141 IP 192.168.43.124.8880 > 192.168.43.195.7771: UDP, length 120
01:54:23.173072 IP 192.168.43.195.8880 > 192.168.43.124.7772: UDP, length 120
01:54:23.210851 IP 192.168.43.124.8880 > 192.168.43.195.7771: UDP, length 120
01:54:23.223076 IP 192.168.43.195.8880 > 192.168.43.124.7772: UDP, length 120
01:54:23.258193 IP 192.168.43.124.8880 > 192.168.43.195.7771: UDP, length 120
01:54:23.273071 IP 192.168.43.195.8880 > 192.168.43.124.7772: UDP, length 120
01:54:23.313078 IP 192.168.43.124.8880 > 192.168.43.195.7771: UDP, length 120
01:54:23.323069 IP 192.168.43.195.8880 > 192.168.43.124.7772: UDP, length 120
01:54:23.358603 IP 192.168.43.124.8880 > 192.168.43.195.7771: UDP, length 120
01:54:23.373076 IP 192.168.43.195.8880 > 192.168.43.124.7772: UDP, length 120
01:54:23.410552 IP 192.168.43.124.8880 > 192.168.43.195.7771: UDP, length 120
01:54:23.423069 IP 192.168.43.195.8880 > 192.168.43.124.7772: UDP, length 120
01:54:23.456528 IP 192.168.43.124.8880 > 192.168.43.195.7771: UDP, length 120
01:54:23.473073 IP 192.168.43.195.8880 > 192.168.43.124.7772: UDP, length 120
01:54:23.507510 IP 192.168.43.124.8880 > 192.168.43.195.7771: UDP, length 120
01:54:23.523099 IP 192.168.43.195.8880 > 192.168.43.124.7772: UDP, length 120
01:54:23.559218 IP 192.168.43.124.8880 > 192.168.43.195.7771: UDP, length 120
01:54:23.573095 IP 192.168.43.195.8880 > 192.168.43.124.7772: UDP, length 120
01:54:23.607729 IP 192.168.43.124.8880 > 192.168.43.195.7771: UDP, length 120
01:54:23.623099 IP 192.168.43.195.8880 > 192.168.43.124.7772: UDP, length 120
01:54:23.657955 IP 192.168.43.124.8880 > 192.168.43.195.7771: UDP, length 120
01:54:23.673108 IP 192.168.43.195.8880 > 192.168.43.124.7772: UDP, length 120
01:54:23.718065 IP 192.168.43.124.8880 > 192.168.43.195.7771: UDP, length 120
01:54:23.723095 IP 192.168.43.195.8880 > 192.168.43.124.7772: UDP, length 120
01:54:23.756997 IP 192.168.43.124.8880 > 192.168.43.195.7771: UDP, length 120
01:54:23.773099 IP 192.168.43.195.8880 > 192.168.43.124.7772: UDP, length 120
01:54:23.809694 IP 192.168.43.124.8880 > 192.168.43.195.7771: UDP, length 120
01:54:23.823161 IP 192.168.43.195.8880 > 192.168.43.124.7772: UDP, length 120
01:54:23.866215 IP 192.168.43.124.8880 > 192.168.43.195.7771: UDP, length 120
01:54:23.873122 IP 192.168.43.195.8880 > 192.168.43.124.7772: UDP, length 120
01:54:23.907765 IP 192.168.43.124.8880 > 192.168.43.195.7771: UDP, length 120
01:54:23.923116 IP 192.168.43.195.8880 > 192.168.43.124.7772: UDP, length 120
01:54:23.957259 IP 192.168.43.124.8880 > 192.168.43.195.7771: UDP, length 120
01:54:23.973099 IP 192.168.43.195.8880 > 192.168.43.124.7772: UDP, length 120
01:54:24.015394 IP 192.168.43.124.8880 > 192.168.43.195.7771: UDP, length 120
01:54:24.023096 IP 192.168.43.195.8880 > 192.168.43.124.7772: UDP, length 120
01:54:24.057378 IP 192.168.43.124.8880 > 192.168.43.195.7771: UDP, length 120
01:54:24.073095 IP 192.168.43.195.8880 > 192.168.43.124.7772: UDP, length 120
01:54:24.107237 IP 192.168.43.124.8880 > 192.168.43.195.7771: UDP, length 120
01:54:24.123108 IP 192.168.43.195.8880 > 192.168.43.124.7772: UDP, length 120
01:54:24.166663 IP 192.168.43.124.8880 > 192.168.43.195.7771: UDP, length 120
01:54:24.173101 IP 192.168.43.195.8880 > 192.168.43.124.7772: UDP, length 120
01:54:24.211969 IP 192.168.43.124.8880 > 192.168.43.195.7771: UDP, length 120
01:54:24.223096 IP 192.168.43.195.8880 > 192.168.43.124.7772: UDP, length 120
01:54:24.257665 IP 192.168.43.124.8880 > 192.168.43.195.7771: UDP, length 120
01:54:24.273098 IP 192.168.43.195.8880 > 192.168.43.124.7772: UDP, length 120
01:54:24.315564 IP 192.168.43.124.8880 > 192.168.43.195.7771: UDP, length 120
01:54:24.323115 IP 192.168.43.195.8880 > 192.168.43.124.7772: UDP, length 120
01:54:24.357504 IP 192.168.43.124.8880 > 192.168.43.195.7771: UDP, length 120
01:54:24.373107 IP 192.168.43.195.8880 > 192.168.43.124.7772: UDP, length 120
01:54:24.406596 IP 192.168.43.124.8880 > 192.168.43.195.7771: UDP, length 120
01:54:24.423099 IP 192.168.43.195.8880 > 192.168.43.124.7772: UDP, length 120
01:54:24.472377 IP 192.168.43.124.8880 > 192.168.43.195.7771: UDP, length 120
01:54:24.473096 IP 192.168.43.195.8880 > 192.168.43.124.7772: UDP, length 120
01:54:24.508898 IP 192.168.43.124.8880 > 192.168.43.195.7771: UDP, length 120
01:54:24.523097 IP 192.168.43.195.8880 > 192.168.43.124.7772: UDP, length 120
01:54:24.557735 IP 192.168.43.124.8880 > 192.168.43.195.7771: UDP, length 120
01:54:24.573095 IP 192.168.43.195.8880 > 192.168.43.124.7772: UDP, length 120
01:54:24.607849 IP 192.168.43.124.8880 > 192.168.43.195.7771: UDP, length 120
01:54:24.623095 IP 192.168.43.195.8880 > 192.168.43.124.7772: UDP, length 120
01:54:24.657635 IP 192.168.43.124.8880 > 192.168.43.195.7771: UDP, length 120
01:54:24.673096 IP 192.168.43.195.8880 > 192.168.43.124.7772: UDP, length 120
01:54:24.707479 IP 192.168.43.124.8880 > 192.168.43.195.7771: UDP, length 120
01:54:24.723098 IP 192.168.43.195.8880 > 192.168.43.124.7772: UDP, length 120
01:54:24.757456 IP 192.168.43.124.8880 > 192.168.43.195.7771: UDP, length 120
01:54:24.773097 IP 192.168.43.195.8880 > 192.168.43.124.7772: UDP, length 120
01:54:24.807500 IP 192.168.43.124.8880 > 192.168.43.195.7771: UDP, length 120
01:54:24.823096 IP 192.168.43.195.8880 > 192.168.43.124.7772: UDP, length 120
01:54:24.857488 IP 192.168.43.124.8880 > 192.168.43.195.7771: UDP, length 120
01:54:24.873105 IP 192.168.43.195.8880 > 192.168.43.124.7772: UDP, length 120
01:54:24.907488 IP 192.168.43.124.8880 > 192.168.43.195.7771: UDP, length 120
01:54:24.923099 IP 192.168.43.195.8880 > 192.168.43.124.7772: UDP, length 120
01:54:24.963050 IP 192.168.43.124.8880 > 192.168.43.195.7771: UDP, length 120
01:54:24.973094 IP 192.168.43.195.8880 > 192.168.43.124.7772: UDP, length 120
01:54:25.007484 IP 192.168.43.124.8880 > 192.168.43.195.7771: UDP, length 120
01:54:25.023097 IP 192.168.43.195.8880 > 192.168.43.124.7772: UDP, length 120
01:54:25.057430 IP 192.168.43.124.8880 > 192.168.43.195.7771: UDP, length 120
01:54:25.073097 IP 192.168.43.195.8880 > 192.168.43.124.7772: UDP, length 120
01:54:25.108145 IP 192.168.43.124.8880 > 192.168.43.195.7771: UDP, length 120
01:54:25.123095 IP 192.168.43.195.8880 > 192.168.43.124.7772: UDP, length 120
01:54:25.157489 IP 192.168.43.124.8880 > 192.168.43.195.7771: UDP, length 120
01:54:25.173106 IP 192.168.43.195.8880 > 192.168.43.124.7772: UDP, length 120
01:54:25.207660 IP 192.168.43.124.8880 > 192.168.43.195.7771: UDP, length 120
01:54:25.223100 IP 192.168.43.195.8880 > 192.168.43.124.7772: UDP, length 120
01:54:25.258982 IP 192.168.43.124.8880 > 192.168.43.195.7771: UDP, length 120
01:54:25.273120 IP 192.168.43.195.8880 > 192.168.43.124.7772: UDP, length 120
01:54:25.308781 IP 192.168.43.124.8880 > 192.168.43.195.7771: UDP, length 120
01:54:25.323161 IP 192.168.43.195.8880 > 192.168.43.124.7772: UDP, length 120
01:54:25.371552 IP 192.168.43.124.8880 > 192.168.43.195.7771: UDP, length 120
01:54:25.373117 IP 192.168.43.195.8880 > 192.168.43.124.7772: UDP, length 120
01:54:25.407867 IP 192.168.43.124.8880 > 192.168.43.195.7771: UDP, length 120
01:54:25.423098 IP 192.168.43.195.8880 > 192.168.43.124.7772: UDP, length 120
01:54:25.463640 IP 192.168.43.124.8880 > 192.168.43.195.7771: UDP, length 120
01:54:25.473097 IP 192.168.43.195.8880 > 192.168.43.124.7772: UDP, length 120
01:54:25.515010 IP 192.168.43.124.8880 > 192.168.43.195.7771: UDP, length 120
01:54:25.523112 IP 192.168.43.195.8880 > 192.168.43.124.7772: UDP, length 120
01:54:25.557609 IP 192.168.43.124.8880 > 192.168.43.195.7771: UDP, length 120
01:54:25.573111 IP 192.168.43.195.8880 > 192.168.43.124.7772: UDP, length 120
01:54:25.607489 IP 192.168.43.124.8880 > 192.168.43.195.7771: UDP, length 120
01:54:25.623107 IP 192.168.43.195.8880 > 192.168.43.124.7772: UDP, length 120
01:54:25.658079 IP 192.168.43.124.8880 > 192.168.43.195.7771: UDP, length 120
01:54:25.673096 IP 192.168.43.195.8880 > 192.168.43.124.7772: UDP, length 120
01:54:25.706502 IP 192.168.43.124.8880 > 192.168.43.195.7771: UDP, length 120
01:54:25.723097 IP 192.168.43.195.8880 > 192.168.43.124.7772: UDP, length 120
01:54:25.765559 IP 192.168.43.124.8880 > 192.168.43.195.7771: UDP, length 120
01:54:25.773093 IP 192.168.43.195.8880 > 192.168.43.124.7772: UDP, length 120
01:54:25.804370 IP 192.168.43.124.8880 > 192.168.43.195.7771: UDP, length 120
01:54:25.823108 IP 192.168.43.195.8880 > 192.168.43.124.7772: UDP, length 120
01:54:25.859145 IP 192.168.43.124.8880 > 192.168.43.195.7771: UDP, length 120
01:54:25.873118 IP 192.168.43.195.8880 > 192.168.43.124.7772: UDP, length 120
01:54:25.915423 IP 192.168.43.124.8880 > 192.168.43.195.7771: UDP, length 120
01:54:25.923099 IP 192.168.43.195.8880 > 192.168.43.124.7772: UDP, length 120
01:54:25.957703 IP 192.168.43.124.8880 > 192.168.43.195.7771: UDP, length 120
01:54:25.973101 IP 192.168.43.195.8880 > 192.168.43.124.7772: UDP, length 120
01:54:26.017438 IP 192.168.43.124.8880 > 192.168.43.195.7771: UDP, length 120
01:54:26.023095 IP 192.168.43.195.8880 > 192.168.43.124.7772: UDP, length 120
01:54:26.065495 IP 192.168.43.124.8880 > 192.168.43.195.7771: UDP, length 120
01:54:26.073106 IP 192.168.43.195.8880 > 192.168.43.124.7772: UDP, length 120
01:54:26.107549 IP 192.168.43.124.8880 > 192.168.43.195.7771: UDP, length 120
01:54:26.123109 IP 192.168.43.195.8880 > 192.168.43.124.7772: UDP, length 120
01:54:26.157534 IP 192.168.43.124.8880 > 192.168.43.195.7771: UDP, length 120
01:54:26.173094 IP 192.168.43.195.8880 > 192.168.43.124.7772: UDP, length 120
01:54:26.215600 IP 192.168.43.124.8880 > 192.168.43.195.7771: UDP, length 120
01:54:26.223095 IP 192.168.43.195.8880 > 192.168.43.124.7772: UDP, length 120
01:54:26.257659 IP 192.168.43.124.8880 > 192.168.43.195.7771: UDP, length 120
01:54:26.273111 IP 192.168.43.195.8880 > 192.168.43.124.7772: UDP, length 120
01:54:26.307403 IP 192.168.43.124.8880 > 192.168.43.195.7771: UDP, length 120
01:54:26.323674 IP 192.168.43.195.8880 > 192.168.43.124.7772: UDP, length 120
01:54:26.371350 IP 192.168.43.124.8880 > 192.168.43.195.7771: UDP, length 120
01:54:26.373161 IP 192.168.43.195.8880 > 192.168.43.124.7772: UDP, length 120
01:54:26.409362 IP 192.168.43.124.8880 > 192.168.43.195.7771: UDP, length 120
01:54:26.423191 IP 192.168.43.195.8880 > 192.168.43.124.7772: UDP, length 120
01:54:26.457447 IP 192.168.43.124.8880 > 192.168.43.195.7771: UDP, length 120
01:54:26.473241 IP 192.168.43.195.8880 > 192.168.43.124.7772: UDP, length 120
01:54:26.508079 IP 192.168.43.124.8880 > 192.168.43.195.7771: UDP, length 120
01:54:26.523138 IP 192.168.43.195.8880 > 192.168.43.124.7772: UDP, length 120
01:54:26.557757 IP 192.168.43.124.8880 > 192.168.43.195.7771: UDP, length 120
01:54:26.573156 IP 192.168.43.195.8880 > 192.168.43.124.7772: UDP, length 120
01:54:26.607501 IP 192.168.43.124.8880 > 192.168.43.195.7771: UDP, length 120
01:54:26.623150 IP 192.168.43.195.8880 > 192.168.43.124.7772: UDP, length 120
01:54:26.671540 IP 192.168.43.124.8880 > 192.168.43.195.7771: UDP, length 120
01:54:26.673179 IP 192.168.43.195.8880 > 192.168.43.124.7772: UDP, length 120
01:54:26.707944 IP 192.168.43.124.8880 > 192.168.43.195.7771: UDP, length 120
01:54:26.723156 IP 192.168.43.195.8880 > 192.168.43.124.7772: UDP, length 120
01:54:26.757654 IP 192.168.43.124.8880 > 192.168.43.195.7771: UDP, length 120
01:54:26.773147 IP 192.168.43.195.8880 > 192.168.43.124.7772: UDP, length 120
01:54:26.807524 IP 192.168.43.124.8880 > 192.168.43.195.7771: UDP, length 120
01:54:26.823124 IP 192.168.43.195.8880 > 192.168.43.124.7772: UDP, length 120
01:54:26.857530 IP 192.168.43.124.8880 > 192.168.43.195.7771: UDP, length 120
01:54:26.873103 IP 192.168.43.195.8880 > 192.168.43.124.7772: UDP, length 120
01:54:26.907589 IP 192.168.43.124.8880 > 192.168.43.195.7771: UDP, length 120
01:54:26.923080 IP 192.168.43.195.8880 > 192.168.43.124.7772: UDP, length 120
01:54:26.958143 IP 192.168.43.124.8880 > 192.168.43.195.7771: UDP, length 120
01:54:26.973073 IP 192.168.43.195.8880 > 192.168.43.124.7772: UDP, length 120
01:54:27.011418 IP 192.168.43.124.8880 > 192.168.43.195.7771: UDP, length 120
01:54:27.023072 IP 192.168.43.195.8880 > 192.168.43.124.7772: UDP, length 120
01:54:27.057543 IP 192.168.43.124.8880 > 192.168.43.195.7771: UDP, length 120
01:54:27.073079 IP 192.168.43.195.8880 > 192.168.43.124.7772: UDP, length 120
01:54:27.107278 IP 192.168.43.124.8880 > 192.168.43.195.7771: UDP, length 120
01:54:27.123071 IP 192.168.43.195.8880 > 192.168.43.124.7772: UDP, length 120
01:54:27.173071 IP 192.168.43.195.8880 > 192.168.43.124.7772: UDP, length 120
01:54:27.176337 IP 192.168.43.124.8880 > 192.168.43.195.7771: UDP, length 120
01:54:27.207500 IP 192.168.43.124.8880 > 192.168.43.195.7771: UDP, length 120
01:54:27.223072 IP 192.168.43.195.8880 > 192.168.43.124.7772: UDP, length 120
01:54:27.259126 IP 192.168.43.124.8880 > 192.168.43.195.7771: UDP, length 120
01:54:27.273072 IP 192.168.43.195.8880 > 192.168.43.124.7772: UDP, length 120
01:54:27.307969 IP 192.168.43.124.8880 > 192.168.43.195.7771: UDP, length 120
01:54:27.323076 IP 192.168.43.195.8880 > 192.168.43.124.7772: UDP, length 120
01:54:27.360739 IP 192.168.43.124.8880 > 192.168.43.195.7771: UDP, length 120
01:54:27.373077 IP 192.168.43.195.8880 > 192.168.43.124.7772: UDP, length 120
01:54:27.407912 IP 192.168.43.124.8880 > 192.168.43.195.7771: UDP, length 120
01:54:27.423071 IP 192.168.43.195.8880 > 192.168.43.124.7772: UDP, length 120
01:54:27.463437 IP 192.168.43.124.8880 > 192.168.43.195.7771: UDP, length 120
01:54:27.473072 IP 192.168.43.195.8880 > 192.168.43.124.7772: UDP, length 120
01:54:27.522226 IP 192.168.43.124.8880 > 192.168.43.195.7771: UDP, length 120
01:54:27.523080 IP 192.168.43.195.8880 > 192.168.43.124.7772: UDP, length 120
01:54:27.557453 IP 192.168.43.124.8880 > 192.168.43.195.7771: UDP, length 120
01:54:27.573071 IP 192.168.43.195.8880 > 192.168.43.124.7772: UDP, length 120
01:54:27.609504 IP 192.168.43.124.8880 > 192.168.43.195.7771: UDP, length 120
01:54:27.623071 IP 192.168.43.195.8880 > 192.168.43.124.7772: UDP, length 120
01:54:27.657443 IP 192.168.43.124.8880 > 192.168.43.195.7771: UDP, length 120
01:54:27.673072 IP 192.168.43.195.8880 > 192.168.43.124.7772: UDP, length 120
01:54:27.717468 IP 192.168.43.124.8880 > 192.168.43.195.7771: UDP, length 120
01:54:27.723071 IP 192.168.43.195.8880 > 192.168.43.124.7772: UDP, length 120
01:54:27.757502 IP 192.168.43.124.8880 > 192.168.43.195.7771: UDP, length 120
01:54:27.773071 IP 192.168.43.195.8880 > 192.168.43.124.7772: UDP, length 120
01:54:27.807455 IP 192.168.43.124.8880 > 192.168.43.195.7771: UDP, length 120
01:54:27.823071 IP 192.168.43.195.8880 > 192.168.43.124.7772: UDP, length 120
01:54:27.857399 IP 192.168.43.124.8880 > 192.168.43.195.7771: UDP, length 120
01:54:27.873079 IP 192.168.43.195.8880 > 192.168.43.124.7772: UDP, length 120
01:54:27.907370 IP 192.168.43.124.8880 > 192.168.43.195.7771: UDP, length 120
01:54:27.923072 IP 192.168.43.195.8880 > 192.168.43.124.7772: UDP, length 120
01:54:27.957510 IP 192.168.43.124.8880 > 192.168.43.195.7771: UDP, length 120
01:54:27.973071 IP 192.168.43.195.8880 > 192.168.43.124.7772: UDP, length 120
01:54:28.007546 IP 192.168.43.124.8880 > 192.168.43.195.7771: UDP, length 120
01:54:28.023071 IP 192.168.43.195.8880 > 192.168.43.124.7772: UDP, length 120
01:54:28.057270 IP 192.168.43.124.8880 > 192.168.43.195.7771: UDP, length 120
01:54:28.073071 IP 192.168.43.195.8880 > 192.168.43.124.7772: UDP, length 120
01:54:28.107465 IP 192.168.43.124.8880 > 192.168.43.195.7771: UDP, length 120
01:54:28.123072 IP 192.168.43.195.8880 > 192.168.43.124.7772: UDP, length 120
01:54:28.157919 IP 192.168.43.124.8880 > 192.168.43.195.7771: UDP, length 120
01:54:28.173071 IP 192.168.43.195.8880 > 192.168.43.124.7772: UDP, length 120
01:54:28.217941 IP 192.168.43.124.8880 > 192.168.43.195.7771: UDP, length 120
01:54:28.223072 IP 192.168.43.195.8880 > 192.168.43.124.7772: UDP, length 120
01:54:28.257618 IP 192.168.43.124.8880 > 192.168.43.195.7771: UDP, length 120
01:54:28.273072 IP 192.168.43.195.8880 > 192.168.43.124.7772: UDP, length 120
01:54:28.307505 IP 192.168.43.124.8880 > 192.168.43.195.7771: UDP, length 120
01:54:28.323115 IP 192.168.43.195.8880 > 192.168.43.124.7772: UDP, length 120
01:54:28.357318 IP 192.168.43.124.8880 > 192.168.43.195.7771: UDP, length 120
01:54:28.373093 IP 192.168.43.195.8880 > 192.168.43.124.7772: UDP, length 120
01:54:28.407367 IP 192.168.43.124.8880 > 192.168.43.195.7771: UDP, length 120
01:54:28.423080 IP 192.168.43.195.8880 > 192.168.43.124.7772: UDP, length 120
01:54:28.457457 IP 192.168.43.124.8880 > 192.168.43.195.7771: UDP, length 120
01:54:28.473080 IP 192.168.43.195.8880 > 192.168.43.124.7772: UDP, length 120
01:54:28.508960 IP 192.168.43.124.8880 > 192.168.43.195.7771: UDP, length 120
01:54:28.523111 IP 192.168.43.195.8880 > 192.168.43.124.7772: UDP, length 120
01:54:28.573107 IP 192.168.43.195.8880 > 192.168.43.124.7772: UDP, length 120
01:54:28.576533 IP 192.168.43.124.8880 > 192.168.43.195.7771: UDP, length 120
01:54:28.607744 IP 192.168.43.124.8880 > 192.168.43.195.7771: UDP, length 120
01:54:28.623100 IP 192.168.43.195.8880 > 192.168.43.124.7772: UDP, length 120
01:54:28.658069 IP 192.168.43.124.8880 > 192.168.43.195.7771: UDP, length 120
01:54:28.673107 IP 192.168.43.195.8880 > 192.168.43.124.7772: UDP, length 120
01:54:28.708707 IP 192.168.43.124.8880 > 192.168.43.195.7771: UDP, length 120
01:54:28.723100 IP 192.168.43.195.8880 > 192.168.43.124.7772: UDP, length 120
01:54:28.766185 IP 192.168.43.124.8880 > 192.168.43.195.7771: UDP, length 120
01:54:28.773112 IP 192.168.43.195.8880 > 192.168.43.124.7772: UDP, length 120
01:54:28.807812 IP 192.168.43.124.8880 > 192.168.43.195.7771: UDP, length 120
01:54:28.823105 IP 192.168.43.195.8880 > 192.168.43.124.7772: UDP, length 120
01:54:28.857377 IP 192.168.43.124.8880 > 192.168.43.195.7771: UDP, length 120
01:54:28.873106 IP 192.168.43.195.8880 > 192.168.43.124.7772: UDP, length 120
01:54:28.907518 IP 192.168.43.124.8880 > 192.168.43.195.7771: UDP, length 120
01:54:28.923104 IP 192.168.43.195.8880 > 192.168.43.124.7772: UDP, length 120
01:54:28.957485 IP 192.168.43.124.8880 > 192.168.43.195.7771: UDP, length 120
01:54:28.973098 IP 192.168.43.195.8880 > 192.168.43.124.7772: UDP, length 120
01:54:29.007599 IP 192.168.43.124.8880 > 192.168.43.195.7771: UDP, length 120
01:54:29.023118 IP 192.168.43.195.8880 > 192.168.43.124.7772: UDP, length 120
01:54:29.057621 IP 192.168.43.124.8880 > 192.168.43.195.7771: UDP, length 120
01:54:29.073107 IP 192.168.43.195.8880 > 192.168.43.124.7772: UDP, length 120
01:54:29.107410 IP 192.168.43.124.8880 > 192.168.43.195.7771: UDP, length 120
01:54:29.123097 IP 192.168.43.195.8880 > 192.168.43.124.7772: UDP, length 120
01:54:29.157592 IP 192.168.43.124.8880 > 192.168.43.195.7771: UDP, length 120
01:54:29.173097 IP 192.168.43.195.8880 > 192.168.43.124.7772: UDP, length 120
01:54:29.207795 IP 192.168.43.124.8880 > 192.168.43.195.7771: UDP, length 120
01:54:29.223099 IP 192.168.43.195.8880 > 192.168.43.124.7772: UDP, length 120
01:54:29.264630 IP 192.168.43.124.8880 > 192.168.43.195.7771: UDP, length 120
01:54:29.273117 IP 192.168.43.195.8880 > 192.168.43.124.7772: UDP, length 120
01:54:29.307649 IP 192.168.43.124.8880 > 192.168.43.195.7771: UDP, length 120
01:54:29.323110 IP 192.168.43.195.8880 > 192.168.43.124.7772: UDP, length 120
01:54:29.357738 IP 192.168.43.124.8880 > 192.168.43.195.7771: UDP, length 120
01:54:29.373102 IP 192.168.43.195.8880 > 192.168.43.124.7772: UDP, length 120
01:54:29.410935 IP 192.168.43.124.8880 > 192.168.43.195.7771: UDP, length 120
01:54:29.423103 IP 192.168.43.195.8880 > 192.168.43.124.7772: UDP, length 120
01:54:29.457515 IP 192.168.43.124.8880 > 192.168.43.195.7771: UDP, length 120
01:54:29.473106 IP 192.168.43.195.8880 > 192.168.43.124.7772: UDP, length 120
01:54:29.513379 IP 192.168.43.124.8880 > 192.168.43.195.7771: UDP, length 120
01:54:29.523099 IP 192.168.43.195.8880 > 192.168.43.124.7772: UDP, length 120
01:54:29.558548 IP 192.168.43.124.8880 > 192.168.43.195.7771: UDP, length 120
01:54:29.573109 IP 192.168.43.195.8880 > 192.168.43.124.7772: UDP, length 120
01:54:29.620417 IP 192.168.43.124.8880 > 192.168.43.195.7771: UDP, length 120
01:54:29.623092 IP 192.168.43.195.8880 > 192.168.43.124.7772: UDP, length 120
01:54:29.660828 IP 192.168.43.124.8880 > 192.168.43.195.7771: UDP, length 120
01:54:29.673094 IP 192.168.43.195.8880 > 192.168.43.124.7772: UDP, length 120
01:54:29.708075 IP 192.168.43.124.8880 > 192.168.43.195.7771: UDP, length 120
01:54:29.723094 IP 192.168.43.195.8880 > 192.168.43.124.7772: UDP, length 120
01:54:29.759979 IP 192.168.43.124.8880 > 192.168.43.195.7771: UDP, length 120
01:54:29.773093 IP 192.168.43.195.8880 > 192.168.43.124.7772: UDP, length 120
01:54:29.815587 IP 192.168.43.124.8880 > 192.168.43.195.7771: UDP, length 120
01:54:29.823131 IP 192.168.43.195.8880 > 192.168.43.124.7772: UDP, length 120
01:54:29.857733 IP 192.168.43.124.8880 > 192.168.43.195.7771: UDP, length 120
01:54:29.873138 IP 192.168.43.195.8880 > 192.168.43.124.7772: UDP, length 120
01:54:29.908053 IP 192.168.43.124.8880 > 192.168.43.195.7771: UDP, length 120
01:54:29.923100 IP 192.168.43.195.8880 > 192.168.43.124.7772: UDP, length 120
01:54:29.957371 IP 192.168.43.124.8880 > 192.168.43.195.7771: UDP, length 120
01:54:29.973099 IP 192.168.43.195.8880 > 192.168.43.124.7772: UDP, length 120
01:54:30.007398 IP 192.168.43.124.8880 > 192.168.43.195.7771: UDP, length 120
01:54:30.023098 IP 192.168.43.195.8880 > 192.168.43.124.7772: UDP, length 120
01:54:30.058236 IP 192.168.43.124.8880 > 192.168.43.195.7771: UDP, length 120
01:54:30.073099 IP 192.168.43.195.8880 > 192.168.43.124.7772: UDP, length 120
01:54:30.114306 IP 192.168.43.124.8880 > 192.168.43.195.7771: UDP, length 120
01:54:30.123096 IP 192.168.43.195.8880 > 192.168.43.124.7772: UDP, length 120
01:54:30.158147 IP 192.168.43.124.8880 > 192.168.43.195.7771: UDP, length 120
01:54:30.173107 IP 192.168.43.195.8880 > 192.168.43.124.7772: UDP, length 120
01:54:30.207792 IP 192.168.43.124.8880 > 192.168.43.195.7771: UDP, length 120
01:54:30.223096 IP 192.168.43.195.8880 > 192.168.43.124.7772: UDP, length 120
01:54:30.257997 IP 192.168.43.124.8880 > 192.168.43.195.7771: UDP, length 120
01:54:30.273099 IP 192.168.43.195.8880 > 192.168.43.124.7772: UDP, length 120
01:54:30.307398 IP 192.168.43.124.8880 > 192.168.43.195.7771: UDP, length 120
01:54:30.323097 IP 192.168.43.195.8880 > 192.168.43.124.7772: UDP, length 120
01:54:30.357614 IP 192.168.43.124.8880 > 192.168.43.195.7771: UDP, length 120
01:54:30.373097 IP 192.168.43.195.8880 > 192.168.43.124.7772: UDP, length 120
01:54:30.407523 IP 192.168.43.124.8880 > 192.168.43.195.7771: UDP, length 120
01:54:30.423107 IP 192.168.43.195.8880 > 192.168.43.124.7772: UDP, length 120
01:54:30.473101 IP 192.168.43.195.8880 > 192.168.43.124.7772: UDP, length 120
01:54:30.476132 IP 192.168.43.124.8880 > 192.168.43.195.7771: UDP, length 120
01:54:30.504410 IP 192.168.43.124.8880 > 192.168.43.195.7771: UDP, length 120
01:54:30.523101 IP 192.168.43.195.8880 > 192.168.43.124.7772: UDP, length 120
01:54:30.557381 IP 192.168.43.124.8880 > 192.168.43.195.7771: UDP, length 120
01:54:30.573098 IP 192.168.43.195.8880 > 192.168.43.124.7772: UDP, length 120
01:54:30.608320 IP 192.168.43.124.8880 > 192.168.43.195.7771: UDP, length 120
01:54:30.623130 IP 192.168.43.195.8880 > 192.168.43.124.7772: UDP, length 120
01:54:30.660923 IP 192.168.43.124.8880 > 192.168.43.195.7771: UDP, length 120
01:54:30.673098 IP 192.168.43.195.8880 > 192.168.43.124.7772: UDP, length 120
01:54:30.709395 IP 192.168.43.124.8880 > 192.168.43.195.7771: UDP, length 120
01:54:30.723097 IP 192.168.43.195.8880 > 192.168.43.124.7772: UDP, length 120
01:54:30.759290 IP 192.168.43.124.8880 > 192.168.43.195.7771: UDP, length 120
01:54:30.773098 IP 192.168.43.195.8880 > 192.168.43.124.7772: UDP, length 120
01:54:30.811807 IP 192.168.43.124.8880 > 192.168.43.195.7771: UDP, length 120
01:54:30.823100 IP 192.168.43.195.8880 > 192.168.43.124.7772: UDP, length 120
01:54:30.859201 IP 192.168.43.124.8880 > 192.168.43.195.7771: UDP, length 120
01:54:30.873106 IP 192.168.43.195.8880 > 192.168.43.124.7772: UDP, length 120
01:54:30.911161 IP 192.168.43.124.8880 > 192.168.43.195.7771: UDP, length 120
01:54:30.923101 IP 192.168.43.195.8880 > 192.168.43.124.7772: UDP, length 120
01:54:30.959263 IP 192.168.43.124.8880 > 192.168.43.195.7771: UDP, length 120
01:54:30.973099 IP 192.168.43.195.8880 > 192.168.43.124.7772: UDP, length 120
01:54:31.009455 IP 192.168.43.124.8880 > 192.168.43.195.7771: UDP, length 120
01:54:31.023098 IP 192.168.43.195.8880 > 192.168.43.124.7772: UDP, length 120
01:54:31.059199 IP 192.168.43.124.8880 > 192.168.43.195.7771: UDP, length 120
01:54:31.073097 IP 192.168.43.195.8880 > 192.168.43.124.7772: UDP, length 120
01:54:31.109164 IP 192.168.43.124.8880 > 192.168.43.195.7771: UDP, length 120
01:54:31.123109 IP 192.168.43.195.8880 > 192.168.43.124.7772: UDP, length 120
01:54:31.159133 IP 192.168.43.124.8880 > 192.168.43.195.7771: UDP, length 120
01:54:31.173098 IP 192.168.43.195.8880 > 192.168.43.124.7772: UDP, length 120
01:54:31.209191 IP 192.168.43.124.8880 > 192.168.43.195.7771: UDP, length 120
01:54:31.223097 IP 192.168.43.195.8880 > 192.168.43.124.7772: UDP, length 120
01:54:31.259203 IP 192.168.43.124.8880 > 192.168.43.195.7771: UDP, length 120
01:54:31.273097 IP 192.168.43.195.8880 > 192.168.43.124.7772: UDP, length 120
01:54:31.309142 IP 192.168.43.124.8880 > 192.168.43.195.7771: UDP, length 120
01:54:31.323109 IP 192.168.43.195.8880 > 192.168.43.124.7772: UDP, length 120
01:54:31.359227 IP 192.168.43.124.8880 > 192.168.43.195.7771: UDP, length 120
01:54:31.373135 IP 192.168.43.195.8880 > 192.168.43.124.7772: UDP, length 120
01:54:31.409264 IP 192.168.43.124.8880 > 192.168.43.195.7771: UDP, length 120
01:54:31.423098 IP 192.168.43.195.8880 > 192.168.43.124.7772: UDP, length 120
01:54:31.459186 IP 192.168.43.124.8880 > 192.168.43.195.7771: UDP, length 120
01:54:31.473096 IP 192.168.43.195.8880 > 192.168.43.124.7772: UDP, length 120
01:54:31.509275 IP 192.168.43.124.8880 > 192.168.43.195.7771: UDP, length 120
01:54:31.523119 IP 192.168.43.195.8880 > 192.168.43.124.7772: UDP, length 120
01:54:31.559596 IP 192.168.43.124.8880 > 192.168.43.195.7771: UDP, length 120
01:54:31.573099 IP 192.168.43.195.8880 > 192.168.43.124.7772: UDP, length 120
01:54:31.609183 IP 192.168.43.124.8880 > 192.168.43.195.7771: UDP, length 120
01:54:31.623104 IP 192.168.43.195.8880 > 192.168.43.124.7772: UDP, length 120
01:54:31.663243 IP 192.168.43.124.8880 > 192.168.43.195.7771: UDP, length 120
01:54:31.673108 IP 192.168.43.195.8880 > 192.168.43.124.7772: UDP, length 120
01:54:31.710227 IP 192.168.43.124.8880 > 192.168.43.195.7771: UDP, length 120
01:54:31.723106 IP 192.168.43.195.8880 > 192.168.43.124.7772: UDP, length 120
01:54:31.763730 IP 192.168.43.124.8880 > 192.168.43.195.7771: UDP, length 120
01:54:31.773097 IP 192.168.43.195.8880 > 192.168.43.124.7772: UDP, length 120
01:54:31.810576 IP 192.168.43.124.8880 > 192.168.43.195.7771: UDP, length 120
01:54:31.823189 IP 192.168.43.195.8880 > 192.168.43.124.7772: UDP, length 120
01:54:31.861391 IP 192.168.43.124.8880 > 192.168.43.195.7771: UDP, length 120
01:54:31.873206 IP 192.168.43.195.8880 > 192.168.43.124.7772: UDP, length 120
01:54:31.914160 IP 192.168.43.124.8880 > 192.168.43.195.7771: UDP, length 120
01:54:31.923161 IP 192.168.43.195.8880 > 192.168.43.124.7772: UDP, length 120
01:54:31.960292 IP 192.168.43.124.8880 > 192.168.43.195.7771: UDP, length 120
01:54:31.973158 IP 192.168.43.195.8880 > 192.168.43.124.7772: UDP, length 120
01:54:32.012350 IP 192.168.43.124.8880 > 192.168.43.195.7771: UDP, length 120
01:54:32.023160 IP 192.168.43.195.8880 > 192.168.43.124.7772: UDP, length 120
01:54:32.062644 IP 192.168.43.124.8880 > 192.168.43.195.7771: UDP, length 120
01:54:32.073144 IP 192.168.43.195.8880 > 192.168.43.124.7772: UDP, length 120
01:54:32.109190 IP 192.168.43.124.8880 > 192.168.43.195.7771: UDP, length 120
01:54:32.123240 IP 192.168.43.195.8880 > 192.168.43.124.7772: UDP, length 120
01:54:32.160601 IP 192.168.43.124.8880 > 192.168.43.195.7771: UDP, length 120
01:54:32.173136 IP 192.168.43.195.8880 > 192.168.43.124.7772: UDP, length 120
01:54:32.209248 IP 192.168.43.124.8880 > 192.168.43.195.7771: UDP, length 120
01:54:32.223156 IP 192.168.43.195.8880 > 192.168.43.124.7772: UDP, length 120
01:54:32.259257 IP 192.168.43.124.8880 > 192.168.43.195.7771: UDP, length 120
01:54:32.273135 IP 192.168.43.195.8880 > 192.168.43.124.7772: UDP, length 120
01:54:32.307994 IP 192.168.43.124.8880 > 192.168.43.195.7771: UDP, length 120
01:54:32.323092 IP 192.168.43.195.8880 > 192.168.43.124.7772: UDP, length 120
01:54:32.358144 IP 192.168.43.124.8880 > 192.168.43.195.7771: UDP, length 120
01:54:32.373074 IP 192.168.43.195.8880 > 192.168.43.124.7772: UDP, length 120
01:54:32.415764 IP 192.168.43.124.8880 > 192.168.43.195.7771: UDP, length 120
01:54:32.423074 IP 192.168.43.195.8880 > 192.168.43.124.7772: UDP, length 120
01:54:32.459054 IP 192.168.43.124.8880 > 192.168.43.195.7771: UDP, length 120
01:54:32.473073 IP 192.168.43.195.8880 > 192.168.43.124.7772: UDP, length 120
01:54:32.505050 IP 192.168.43.124.8880 > 192.168.43.195.7771: UDP, length 120
01:54:32.523078 IP 192.168.43.195.8880 > 192.168.43.124.7772: UDP, length 120
01:54:32.559006 IP 192.168.43.124.8880 > 192.168.43.195.7771: UDP, length 120
01:54:32.573083 IP 192.168.43.195.8880 > 192.168.43.124.7772: UDP, length 120
01:54:32.609210 IP 192.168.43.124.8880 > 192.168.43.195.7771: UDP, length 120
01:54:32.623085 IP 192.168.43.195.8880 > 192.168.43.124.7772: UDP, length 120
01:54:32.659126 IP 192.168.43.124.8880 > 192.168.43.195.7771: UDP, length 120
01:54:32.673078 IP 192.168.43.195.8880 > 192.168.43.124.7772: UDP, length 120
01:54:32.708741 IP 192.168.43.124.8880 > 192.168.43.195.7771: UDP, length 120
01:54:32.723072 IP 192.168.43.195.8880 > 192.168.43.124.7772: UDP, length 120
01:54:32.760057 IP 192.168.43.124.8880 > 192.168.43.195.7771: UDP, length 120
01:54:32.773072 IP 192.168.43.195.8880 > 192.168.43.124.7772: UDP, length 120
01:54:32.811274 IP 192.168.43.124.8880 > 192.168.43.195.7771: UDP, length 120
01:54:32.823071 IP 192.168.43.195.8880 > 192.168.43.124.7772: UDP, length 120
01:54:32.859978 IP 192.168.43.124.8880 > 192.168.43.195.7771: UDP, length 120
01:54:32.873105 IP 192.168.43.195.8880 > 192.168.43.124.7772: UDP, length 120
01:54:32.911590 IP 192.168.43.124.8880 > 192.168.43.195.7771: UDP, length 120
01:54:32.923074 IP 192.168.43.195.8880 > 192.168.43.124.7772: UDP, length 120
01:54:32.962095 IP 192.168.43.124.8880 > 192.168.43.195.7771: UDP, length 120
01:54:32.973071 IP 192.168.43.195.8880 > 192.168.43.124.7772: UDP, length 120
01:54:33.009130 IP 192.168.43.124.8880 > 192.168.43.195.7771: UDP, length 120
01:54:33.023071 IP 192.168.43.195.8880 > 192.168.43.124.7772: UDP, length 120
01:54:33.061240 IP 192.168.43.124.8880 > 192.168.43.195.7771: UDP, length 120
01:54:33.073071 IP 192.168.43.195.8880 > 192.168.43.124.7772: UDP, length 120
01:54:33.108726 IP 192.168.43.124.8880 > 192.168.43.195.7771: UDP, length 120
01:54:33.123071 IP 192.168.43.195.8880 > 192.168.43.124.7772: UDP, length 120
01:54:33.159110 IP 192.168.43.124.8880 > 192.168.43.195.7771: UDP, length 120
01:54:33.173071 IP 192.168.43.195.8880 > 192.168.43.124.7772: UDP, length 120
01:54:33.209340 IP 192.168.43.124.8880 > 192.168.43.195.7771: UDP, length 120
01:54:33.223071 IP 192.168.43.195.8880 > 192.168.43.124.7772: UDP, length 120
01:54:33.259103 IP 192.168.43.124.8880 > 192.168.43.195.7771: UDP, length 120
01:54:33.273077 IP 192.168.43.195.8880 > 192.168.43.124.7772: UDP, length 120
01:54:33.308733 IP 192.168.43.124.8880 > 192.168.43.195.7771: UDP, length 120
01:54:33.323070 IP 192.168.43.195.8880 > 192.168.43.124.7772: UDP, length 120
01:54:33.359041 IP 192.168.43.124.8880 > 192.168.43.195.7771: UDP, length 120
01:54:33.373070 IP 192.168.43.195.8880 > 192.168.43.124.7772: UDP, length 120
01:54:33.409062 IP 192.168.43.124.8880 > 192.168.43.195.7771: UDP, length 120
01:54:33.423078 IP 192.168.43.195.8880 > 192.168.43.124.7772: UDP, length 120
01:54:33.458980 IP 192.168.43.124.8880 > 192.168.43.195.7771: UDP, length 120
01:54:33.473071 IP 192.168.43.195.8880 > 192.168.43.124.7772: UDP, length 120
01:54:33.509274 IP 192.168.43.124.8880 > 192.168.43.195.7771: UDP, length 120
01:54:33.523110 IP 192.168.43.195.8880 > 192.168.43.124.7772: UDP, length 120
01:54:33.559181 IP 192.168.43.124.8880 > 192.168.43.195.7771: UDP, length 120
01:54:33.573096 IP 192.168.43.195.8880 > 192.168.43.124.7772: UDP, length 120
01:54:33.611206 IP 192.168.43.124.8880 > 192.168.43.195.7771: UDP, length 120
01:54:33.623101 IP 192.168.43.195.8880 > 192.168.43.124.7772: UDP, length 120
01:54:33.659229 IP 192.168.43.124.8880 > 192.168.43.195.7771: UDP, length 120
01:54:33.673116 IP 192.168.43.195.8880 > 192.168.43.124.7772: UDP, length 120
01:54:33.711548 IP 192.168.43.124.8880 > 192.168.43.195.7771: UDP, length 120
01:54:33.723106 IP 192.168.43.195.8880 > 192.168.43.124.7772: UDP, length 120
01:54:33.759167 IP 192.168.43.124.8880 > 192.168.43.195.7771: UDP, length 120
01:54:33.773097 IP 192.168.43.195.8880 > 192.168.43.124.7772: UDP, length 120
01:54:33.809776 IP 192.168.43.124.8880 > 192.168.43.195.7771: UDP, length 120
01:54:33.823096 IP 192.168.43.195.8880 > 192.168.43.124.7772: UDP, length 120
01:54:33.860662 IP 192.168.43.124.8880 > 192.168.43.195.7771: UDP, length 120
01:54:33.873105 IP 192.168.43.195.8880 > 192.168.43.124.7772: UDP, length 120
01:54:33.908577 IP 192.168.43.124.8880 > 192.168.43.195.7771: UDP, length 120
01:54:33.923097 IP 192.168.43.195.8880 > 192.168.43.124.7772: UDP, length 120
01:54:33.960299 IP 192.168.43.124.8880 > 192.168.43.195.7771: UDP, length 120
01:54:33.973094 IP 192.168.43.195.8880 > 192.168.43.124.7772: UDP, length 120
01:54:34.010440 IP 192.168.43.124.8880 > 192.168.43.195.7771: UDP, length 120
01:54:34.023096 IP 192.168.43.195.8880 > 192.168.43.124.7772: UDP, length 120
01:54:34.063364 IP 192.168.43.124.8880 > 192.168.43.195.7771: UDP, length 120
01:54:34.073093 IP 192.168.43.195.8880 > 192.168.43.124.7772: UDP, length 120
01:54:34.108834 IP 192.168.43.124.8880 > 192.168.43.195.7771: UDP, length 120
01:54:34.123094 IP 192.168.43.195.8880 > 192.168.43.124.7772: UDP, length 120
01:54:34.159209 IP 192.168.43.124.8880 > 192.168.43.195.7771: UDP, length 120
01:54:34.173095 IP 192.168.43.195.8880 > 192.168.43.124.7772: UDP, length 120
01:54:34.210719 IP 192.168.43.124.8880 > 192.168.43.195.7771: UDP, length 120
01:54:34.223094 IP 192.168.43.195.8880 > 192.168.43.124.7772: UDP, length 120
01:54:34.259188 IP 192.168.43.124.8880 > 192.168.43.195.7771: UDP, length 120
01:54:34.273096 IP 192.168.43.195.8880 > 192.168.43.124.7772: UDP, length 120
01:54:34.308845 IP 192.168.43.124.8880 > 192.168.43.195.7771: UDP, length 120
01:54:34.323094 IP 192.168.43.195.8880 > 192.168.43.124.7772: UDP, length 120
01:54:34.360098 IP 192.168.43.124.8880 > 192.168.43.195.7771: UDP, length 120
01:54:34.373135 IP 192.168.43.195.8880 > 192.168.43.124.7772: UDP, length 120
01:54:34.409158 IP 192.168.43.124.8880 > 192.168.43.195.7771: UDP, length 120
01:54:34.423099 IP 192.168.43.195.8880 > 192.168.43.124.7772: UDP, length 120
01:54:34.461065 IP 192.168.43.124.8880 > 192.168.43.195.7771: UDP, length 120
01:54:34.473095 IP 192.168.43.195.8880 > 192.168.43.124.7772: UDP, length 120
01:54:34.514646 IP 192.168.43.124.8880 > 192.168.43.195.7771: UDP, length 120
01:54:34.523102 IP 192.168.43.195.8880 > 192.168.43.124.7772: UDP, length 120
01:54:34.558558 IP 192.168.43.124.8880 > 192.168.43.195.7771: UDP, length 120
01:54:34.573094 IP 192.168.43.195.8880 > 192.168.43.124.7772: UDP, length 120
01:54:34.609073 IP 192.168.43.124.8880 > 192.168.43.195.7771: UDP, length 120
01:54:34.623097 IP 192.168.43.195.8880 > 192.168.43.124.7772: UDP, length 120
01:54:34.659173 IP 192.168.43.124.8880 > 192.168.43.195.7771: UDP, length 120
01:54:34.673093 IP 192.168.43.195.8880 > 192.168.43.124.7772: UDP, length 120
01:54:34.706084 IP 192.168.43.124.8880 > 192.168.43.195.7771: UDP, length 120
01:54:34.723113 IP 192.168.43.195.8880 > 192.168.43.124.7772: UDP, length 120
01:54:34.759250 IP 192.168.43.124.8880 > 192.168.43.195.7771: UDP, length 120
01:54:34.773099 IP 192.168.43.195.8880 > 192.168.43.124.7772: UDP, length 120
01:54:34.809115 IP 192.168.43.124.8880 > 192.168.43.195.7771: UDP, length 120
01:54:34.823107 IP 192.168.43.195.8880 > 192.168.43.124.7772: UDP, length 120
01:54:34.859479 IP 192.168.43.124.8880 > 192.168.43.195.7771: UDP, length 120
01:54:34.873131 IP 192.168.43.195.8880 > 192.168.43.124.7772: UDP, length 120
01:54:34.909986 IP 192.168.43.124.8880 > 192.168.43.195.7771: UDP, length 120
01:54:34.923111 IP 192.168.43.195.8880 > 192.168.43.124.7772: UDP, length 120
01:54:34.973112 IP 192.168.43.195.8880 > 192.168.43.124.7772: UDP, length 120
01:54:34.973290 IP 192.168.43.124.8880 > 192.168.43.195.7771: UDP, length 120
01:54:35.010282 IP 192.168.43.124.8880 > 192.168.43.195.7771: UDP, length 120
01:54:35.023095 IP 192.168.43.195.8880 > 192.168.43.124.7772: UDP, length 120
01:54:35.059202 IP 192.168.43.124.8880 > 192.168.43.195.7771: UDP, length 120
01:54:35.073094 IP 192.168.43.195.8880 > 192.168.43.124.7772: UDP, length 120
01:54:35.109557 IP 192.168.43.124.8880 > 192.168.43.195.7771: UDP, length 120
01:54:35.123097 IP 192.168.43.195.8880 > 192.168.43.124.7772: UDP, length 120
01:54:35.159197 IP 192.168.43.124.8880 > 192.168.43.195.7771: UDP, length 120
01:54:35.173107 IP 192.168.43.195.8880 > 192.168.43.124.7772: UDP, length 120
01:54:35.211969 IP 192.168.43.124.8880 > 192.168.43.195.7771: UDP, length 120
01:54:35.223107 IP 192.168.43.195.8880 > 192.168.43.124.7772: UDP, length 120
01:54:35.258787 IP 192.168.43.124.8880 > 192.168.43.195.7771: UDP, length 120
01:54:35.273099 IP 192.168.43.195.8880 > 192.168.43.124.7772: UDP, length 120
01:54:35.309176 IP 192.168.43.124.8880 > 192.168.43.195.7771: UDP, length 120
01:54:35.323096 IP 192.168.43.195.8880 > 192.168.43.124.7772: UDP, length 120
01:54:35.359215 IP 192.168.43.124.8880 > 192.168.43.195.7771: UDP, length 120
01:54:35.373094 IP 192.168.43.195.8880 > 192.168.43.124.7772: UDP, length 120
01:54:35.409192 IP 192.168.43.124.8880 > 192.168.43.195.7771: UDP, length 120
01:54:35.423109 IP 192.168.43.195.8880 > 192.168.43.124.7772: UDP, length 120
01:54:35.459205 IP 192.168.43.124.8880 > 192.168.43.195.7771: UDP, length 120
01:54:35.473105 IP 192.168.43.195.8880 > 192.168.43.124.7772: UDP, length 120
01:54:35.509298 IP 192.168.43.124.8880 > 192.168.43.195.7771: UDP, length 120
01:54:35.523103 IP 192.168.43.195.8880 > 192.168.43.124.7772: UDP, length 120
01:54:35.558389 IP 192.168.43.124.8880 > 192.168.43.195.7771: UDP, length 120
01:54:35.573097 IP 192.168.43.195.8880 > 192.168.43.124.7772: UDP, length 120
01:54:35.609153 IP 192.168.43.124.8880 > 192.168.43.195.7771: UDP, length 120
01:54:35.623096 IP 192.168.43.195.8880 > 192.168.43.124.7772: UDP, length 120
01:54:35.656932 IP 192.168.43.124.8880 > 192.168.43.195.7771: UDP, length 120
01:54:35.673121 IP 192.168.43.195.8880 > 192.168.43.124.7772: UDP, length 120
01:54:35.709191 IP 192.168.43.124.8880 > 192.168.43.195.7771: UDP, length 120
01:54:35.723105 IP 192.168.43.195.8880 > 192.168.43.124.7772: UDP, length 120
01:54:35.761417 IP 192.168.43.124.8880 > 192.168.43.195.7771: UDP, length 120
01:54:35.773102 IP 192.168.43.195.8880 > 192.168.43.124.7772: UDP, length 120
01:54:35.808344 IP 192.168.43.124.8880 > 192.168.43.195.7771: UDP, length 120
01:54:35.823108 IP 192.168.43.195.8880 > 192.168.43.124.7772: UDP, length 120
01:54:35.858069 IP 192.168.43.124.8880 > 192.168.43.195.7771: UDP, length 120
01:54:35.873139 IP 192.168.43.195.8880 > 192.168.43.124.7772: UDP, length 120
01:54:35.907346 IP 192.168.43.124.8880 > 192.168.43.195.7771: UDP, length 120
01:54:35.923102 IP 192.168.43.195.8880 > 192.168.43.124.7772: UDP, length 120
01:54:35.958582 IP 192.168.43.124.8880 > 192.168.43.195.7771: UDP, length 120
01:54:35.973096 IP 192.168.43.195.8880 > 192.168.43.124.7772: UDP, length 120
01:54:36.012657 IP 192.168.43.124.8880 > 192.168.43.195.7771: UDP, length 120
01:54:36.023105 IP 192.168.43.195.8880 > 192.168.43.124.7772: UDP, length 120
01:54:36.059198 IP 192.168.43.124.8880 > 192.168.43.195.7771: UDP, length 120
01:54:36.073094 IP 192.168.43.195.8880 > 192.168.43.124.7772: UDP, length 120
01:54:36.108863 IP 192.168.43.124.8880 > 192.168.43.195.7771: UDP, length 120
01:54:36.123094 IP 192.168.43.195.8880 > 192.168.43.124.7772: UDP, length 120
01:54:36.159238 IP 192.168.43.124.8880 > 192.168.43.195.7771: UDP, length 120
01:54:36.173095 IP 192.168.43.195.8880 > 192.168.43.124.7772: UDP, length 120
01:54:36.210221 IP 192.168.43.124.8880 > 192.168.43.195.7771: UDP, length 120
01:54:36.223094 IP 192.168.43.195.8880 > 192.168.43.124.7772: UDP, length 120
01:54:36.259162 IP 192.168.43.124.8880 > 192.168.43.195.7771: UDP, length 120
01:54:36.273114 IP 192.168.43.195.8880 > 192.168.43.124.7772: UDP, length 120
01:54:36.309323 IP 192.168.43.124.8880 > 192.168.43.195.7771: UDP, length 120
01:54:36.323094 IP 192.168.43.195.8880 > 192.168.43.124.7772: UDP, length 120
01:54:36.361098 IP 192.168.43.124.8880 > 192.168.43.195.7771: UDP, length 120
01:54:36.373096 IP 192.168.43.195.8880 > 192.168.43.124.7772: UDP, length 120
01:54:36.408910 IP 192.168.43.124.8880 > 192.168.43.195.7771: UDP, length 120
01:54:36.423095 IP 192.168.43.195.8880 > 192.168.43.124.7772: UDP, length 120
01:54:36.459208 IP 192.168.43.124.8880 > 192.168.43.195.7771: UDP, length 120
01:54:36.473095 IP 192.168.43.195.8880 > 192.168.43.124.7772: UDP, length 120
01:54:36.509345 IP 192.168.43.124.8880 > 192.168.43.195.7771: UDP, length 120
01:54:36.523096 IP 192.168.43.195.8880 > 192.168.43.124.7772: UDP, length 120
01:54:36.558686 IP 192.168.43.124.8880 > 192.168.43.195.7771: UDP, length 120
01:54:36.573096 IP 192.168.43.195.8880 > 192.168.43.124.7772: UDP, length 120
01:54:36.609082 IP 192.168.43.124.8880 > 192.168.43.195.7771: UDP, length 120
01:54:36.623097 IP 192.168.43.195.8880 > 192.168.43.124.7772: UDP, length 120
01:54:36.659223 IP 192.168.43.124.8880 > 192.168.43.195.7771: UDP, length 120
01:54:36.673094 IP 192.168.43.195.8880 > 192.168.43.124.7772: UDP, length 120
01:54:36.708898 IP 192.168.43.124.8880 > 192.168.43.195.7771: UDP, length 120
01:54:36.723095 IP 192.168.43.195.8880 > 192.168.43.124.7772: UDP, length 120
01:54:36.759233 IP 192.168.43.124.8880 > 192.168.43.195.7771: UDP, length 120
01:54:36.773095 IP 192.168.43.195.8880 > 192.168.43.124.7772: UDP, length 120
01:54:36.808532 IP 192.168.43.124.8880 > 192.168.43.195.7771: UDP, length 120
01:54:36.823096 IP 192.168.43.195.8880 > 192.168.43.124.7772: UDP, length 120
01:54:36.859183 IP 192.168.43.124.8880 > 192.168.43.195.7771: UDP, length 120
01:54:36.873113 IP 192.168.43.195.8880 > 192.168.43.124.7772: UDP, length 120
01:54:36.909172 IP 192.168.43.124.8880 > 192.168.43.195.7771: UDP, length 120
01:54:36.923101 IP 192.168.43.195.8880 > 192.168.43.124.7772: UDP, length 120
01:54:36.959136 IP 192.168.43.124.8880 > 192.168.43.195.7771: UDP, length 120
01:54:36.973103 IP 192.168.43.195.8880 > 192.168.43.124.7772: UDP, length 120
01:54:37.009847 IP 192.168.43.124.8880 > 192.168.43.195.7771: UDP, length 120
01:54:37.023094 IP 192.168.43.195.8880 > 192.168.43.124.7772: UDP, length 120
01:54:37.060327 IP 192.168.43.124.8880 > 192.168.43.195.7771: UDP, length 120
01:54:37.073094 IP 192.168.43.195.8880 > 192.168.43.124.7772: UDP, length 120
01:54:37.110149 IP 192.168.43.124.8880 > 192.168.43.195.7771: UDP, length 120
01:54:37.123093 IP 192.168.43.195.8880 > 192.168.43.124.7772: UDP, length 120
01:54:37.160720 IP 192.168.43.124.8880 > 192.168.43.195.7771: UDP, length 120
01:54:37.173095 IP 192.168.43.195.8880 > 192.168.43.124.7772: UDP, length 120
01:54:37.209152 IP 192.168.43.124.8880 > 192.168.43.195.7771: UDP, length 120
01:54:37.223095 IP 192.168.43.195.8880 > 192.168.43.124.7772: UDP, length 120
01:54:37.260214 IP 192.168.43.124.8880 > 192.168.43.195.7771: UDP, length 120
01:54:37.273181 IP 192.168.43.195.8880 > 192.168.43.124.7772: UDP, length 120
01:54:37.311278 IP 192.168.43.124.8880 > 192.168.43.195.7771: UDP, length 120
01:54:37.323191 IP 192.168.43.195.8880 > 192.168.43.124.7772: UDP, length 120
01:54:37.362585 IP 192.168.43.124.8880 > 192.168.43.195.7771: UDP, length 120
01:54:37.373215 IP 192.168.43.195.8880 > 192.168.43.124.7772: UDP, length 120
01:54:37.409347 IP 192.168.43.124.8880 > 192.168.43.195.7771: UDP, length 120
01:54:37.423144 IP 192.168.43.195.8880 > 192.168.43.124.7772: UDP, length 120
01:54:37.459145 IP 192.168.43.124.8880 > 192.168.43.195.7771: UDP, length 120
01:54:37.473155 IP 192.168.43.195.8880 > 192.168.43.124.7772: UDP, length 120
01:54:37.509519 IP 192.168.43.124.8880 > 192.168.43.195.7771: UDP, length 120
01:54:37.523145 IP 192.168.43.195.8880 > 192.168.43.124.7772: UDP, length 120
01:54:37.559188 IP 192.168.43.124.8880 > 192.168.43.195.7771: UDP, length 120
01:54:37.573150 IP 192.168.43.195.8880 > 192.168.43.124.7772: UDP, length 120
01:54:37.609311 IP 192.168.43.124.8880 > 192.168.43.195.7771: UDP, length 120
01:54:37.623146 IP 192.168.43.195.8880 > 192.168.43.124.7772: UDP, length 120
01:54:37.659270 IP 192.168.43.124.8880 > 192.168.43.195.7771: UDP, length 120
01:54:37.673149 IP 192.168.43.195.8880 > 192.168.43.124.7772: UDP, length 120
01:54:37.707800 IP 192.168.43.124.8880 > 192.168.43.195.7771: UDP, length 120
01:54:37.723148 IP 192.168.43.195.8880 > 192.168.43.124.7772: UDP, length 120
01:54:37.765044 IP 192.168.43.124.8880 > 192.168.43.195.7771: UDP, length 120
01:54:37.773112 IP 192.168.43.195.8880 > 192.168.43.124.7772: UDP, length 120
01:54:37.807640 IP 192.168.43.124.8880 > 192.168.43.195.7771: UDP, length 120
01:54:37.823075 IP 192.168.43.195.8880 > 192.168.43.124.7772: UDP, length 120
01:54:37.857166 IP 192.168.43.124.8880 > 192.168.43.195.7771: UDP, length 120
01:54:37.873084 IP 192.168.43.195.8880 > 192.168.43.124.7772: UDP, length 120
01:54:37.907427 IP 192.168.43.124.8880 > 192.168.43.195.7771: UDP, length 120
01:54:37.923077 IP 192.168.43.195.8880 > 192.168.43.124.7772: UDP, length 120
01:54:37.957476 IP 192.168.43.124.8880 > 192.168.43.195.7771: UDP, length 120
01:54:37.973080 IP 192.168.43.195.8880 > 192.168.43.124.7772: UDP, length 120
01:54:38.015007 IP 192.168.43.124.8880 > 192.168.43.195.7771: UDP, length 120
01:54:38.023072 IP 192.168.43.195.8880 > 192.168.43.124.7772: UDP, length 120
01:54:38.059332 IP 192.168.43.124.8880 > 192.168.43.195.7771: UDP, length 120
01:54:38.073071 IP 192.168.43.195.8880 > 192.168.43.124.7772: UDP, length 120
01:54:38.107952 IP 192.168.43.124.8880 > 192.168.43.195.7771: UDP, length 120
01:54:38.123072 IP 192.168.43.195.8880 > 192.168.43.124.7772: UDP, length 120
01:54:38.165071 IP 192.168.43.124.8880 > 192.168.43.195.7771: UDP, length 120
01:54:38.173071 IP 192.168.43.195.8880 > 192.168.43.124.7772: UDP, length 120
01:54:38.207432 IP 192.168.43.124.8880 > 192.168.43.195.7771: UDP, length 120
01:54:38.223072 IP 192.168.43.195.8880 > 192.168.43.124.7772: UDP, length 120
01:54:38.258768 IP 192.168.43.124.8880 > 192.168.43.195.7771: UDP, length 120
01:54:38.273073 IP 192.168.43.195.8880 > 192.168.43.124.7772: UDP, length 120
01:54:38.315011 IP 192.168.43.124.8880 > 192.168.43.195.7771: UDP, length 120
01:54:38.323078 IP 192.168.43.195.8880 > 192.168.43.124.7772: UDP, length 120
01:54:38.357320 IP 192.168.43.124.8880 > 192.168.43.195.7771: UDP, length 120
01:54:38.373077 IP 192.168.43.195.8880 > 192.168.43.124.7772: UDP, length 120
01:54:38.407996 IP 192.168.43.124.8880 > 192.168.43.195.7771: UDP, length 120
01:54:38.423077 IP 192.168.43.195.8880 > 192.168.43.124.7772: UDP, length 120
01:54:38.466511 IP 192.168.43.124.8880 > 192.168.43.195.7771: UDP, length 120
01:54:38.473071 IP 192.168.43.195.8880 > 192.168.43.124.7772: UDP, length 120
01:54:38.509379 IP 192.168.43.124.8880 > 192.168.43.195.7771: UDP, length 120
01:54:38.523097 IP 192.168.43.195.8880 > 192.168.43.124.7772: UDP, length 120
01:54:38.557258 IP 192.168.43.124.8880 > 192.168.43.195.7771: UDP, length 120
01:54:38.573100 IP 192.168.43.195.8880 > 192.168.43.124.7772: UDP, length 120
01:54:38.619131 IP 192.168.43.124.8880 > 192.168.43.195.7771: UDP, length 120
01:54:38.623098 IP 192.168.43.195.8880 > 192.168.43.124.7772: UDP, length 120
01:54:38.657624 IP 192.168.43.124.8880 > 192.168.43.195.7771: UDP, length 120
01:54:38.673119 IP 192.168.43.195.8880 > 192.168.43.124.7772: UDP, length 120
01:54:38.707396 IP 192.168.43.124.8880 > 192.168.43.195.7771: UDP, length 120
01:54:38.723112 IP 192.168.43.195.8880 > 192.168.43.124.7772: UDP, length 120
01:54:38.757384 IP 192.168.43.124.8880 > 192.168.43.195.7771: UDP, length 120
01:54:38.773099 IP 192.168.43.195.8880 > 192.168.43.124.7772: UDP, length 120
01:54:38.821149 IP 192.168.43.124.8880 > 192.168.43.195.7771: UDP, length 120
01:54:38.823095 IP 192.168.43.195.8880 > 192.168.43.124.7772: UDP, length 120
01:54:38.857581 IP 192.168.43.124.8880 > 192.168.43.195.7771: UDP, length 120
01:54:38.873151 IP 192.168.43.195.8880 > 192.168.43.124.7772: UDP, length 120
01:54:38.906971 IP 192.168.43.124.8880 > 192.168.43.195.7771: UDP, length 120
01:54:38.923110 IP 192.168.43.195.8880 > 192.168.43.124.7772: UDP, length 120
01:54:38.956983 IP 192.168.43.124.8880 > 192.168.43.195.7771: UDP, length 120
01:54:38.973124 IP 192.168.43.195.8880 > 192.168.43.124.7772: UDP, length 120
01:54:39.007733 IP 192.168.43.124.8880 > 192.168.43.195.7771: UDP, length 120
01:54:39.023106 IP 192.168.43.195.8880 > 192.168.43.124.7772: UDP, length 120
01:54:39.057386 IP 192.168.43.124.8880 > 192.168.43.195.7771: UDP, length 120
01:54:39.073098 IP 192.168.43.195.8880 > 192.168.43.124.7772: UDP, length 120
01:54:39.107278 IP 192.168.43.124.8880 > 192.168.43.195.7771: UDP, length 120
01:54:39.123098 IP 192.168.43.195.8880 > 192.168.43.124.7772: UDP, length 120
01:54:39.158704 IP 192.168.43.124.8880 > 192.168.43.195.7771: UDP, length 120
01:54:39.173095 IP 192.168.43.195.8880 > 192.168.43.124.7772: UDP, length 120
01:54:39.209217 IP 192.168.43.124.8880 > 192.168.43.195.7771: UDP, length 120
01:54:39.223107 IP 192.168.43.195.8880 > 192.168.43.124.7772: UDP, length 120
01:54:39.257329 IP 192.168.43.124.8880 > 192.168.43.195.7771: UDP, length 120
01:54:39.273098 IP 192.168.43.195.8880 > 192.168.43.124.7772: UDP, length 120
01:54:39.308343 IP 192.168.43.124.8880 > 192.168.43.195.7771: UDP, length 120
01:54:39.323094 IP 192.168.43.195.8880 > 192.168.43.124.7772: UDP, length 120
01:54:39.357682 IP 192.168.43.124.8880 > 192.168.43.195.7771: UDP, length 120
01:54:39.373114 IP 192.168.43.195.8880 > 192.168.43.124.7772: UDP, length 120
01:54:39.410382 IP 192.168.43.124.8880 > 192.168.43.195.7771: UDP, length 120
01:54:39.423099 IP 192.168.43.195.8880 > 192.168.43.124.7772: UDP, length 120
01:54:39.457587 IP 192.168.43.124.8880 > 192.168.43.195.7771: UDP, length 120
01:54:39.473114 IP 192.168.43.195.8880 > 192.168.43.124.7772: UDP, length 120
01:54:39.507676 IP 192.168.43.124.8880 > 192.168.43.195.7771: UDP, length 120
01:54:39.523105 IP 192.168.43.195.8880 > 192.168.43.124.7772: UDP, length 120
01:54:39.557662 IP 192.168.43.124.8880 > 192.168.43.195.7771: UDP, length 120
01:54:39.573096 IP 192.168.43.195.8880 > 192.168.43.124.7772: UDP, length 120
01:54:39.607369 IP 192.168.43.124.8880 > 192.168.43.195.7771: UDP, length 120
01:54:39.623099 IP 192.168.43.195.8880 > 192.168.43.124.7772: UDP, length 120
01:54:39.665675 IP 192.168.43.124.8880 > 192.168.43.195.7771: UDP, length 120
01:54:39.673095 IP 192.168.43.195.8880 > 192.168.43.124.7772: UDP, length 120
01:54:39.707599 IP 192.168.43.124.8880 > 192.168.43.195.7771: UDP, length 120
01:54:39.723106 IP 192.168.43.195.8880 > 192.168.43.124.7772: UDP, length 120
01:54:39.757355 IP 192.168.43.124.8880 > 192.168.43.195.7771: UDP, length 120
01:54:39.773111 IP 192.168.43.195.8880 > 192.168.43.124.7772: UDP, length 120
01:54:39.815406 IP 192.168.43.124.8880 > 192.168.43.195.7771: UDP, length 120
01:54:39.823108 IP 192.168.43.195.8880 > 192.168.43.124.7772: UDP, length 120
01:54:39.857603 IP 192.168.43.124.8880 > 192.168.43.195.7771: UDP, length 120
01:54:39.873111 IP 192.168.43.195.8880 > 192.168.43.124.7772: UDP, length 120
01:54:39.907286 IP 192.168.43.124.8880 > 192.168.43.195.7771: UDP, length 120
01:54:39.923099 IP 192.168.43.195.8880 > 192.168.43.124.7772: UDP, length 120
01:54:39.967285 IP 192.168.43.124.8880 > 192.168.43.195.7771: UDP, length 120
01:54:39.973097 IP 192.168.43.195.8880 > 192.168.43.124.7772: UDP, length 120
01:54:40.007337 IP 192.168.43.124.8880 > 192.168.43.195.7771: UDP, length 120
01:54:40.023106 IP 192.168.43.195.8880 > 192.168.43.124.7772: UDP, length 120
01:54:40.058072 IP 192.168.43.124.8880 > 192.168.43.195.7771: UDP, length 120
01:54:40.073106 IP 192.168.43.195.8880 > 192.168.43.124.7772: UDP, length 120
01:54:40.114894 IP 192.168.43.124.8880 > 192.168.43.195.7771: UDP, length 120
01:54:40.123099 IP 192.168.43.195.8880 > 192.168.43.124.7772: UDP, length 120
01:54:40.157431 IP 192.168.43.124.8880 > 192.168.43.195.7771: UDP, length 120
01:54:40.173107 IP 192.168.43.195.8880 > 192.168.43.124.7772: UDP, length 120
01:54:40.207054 IP 192.168.43.124.8880 > 192.168.43.195.7771: UDP, length 120
01:54:40.223098 IP 192.168.43.195.8880 > 192.168.43.124.7772: UDP, length 120
01:54:40.265327 IP 192.168.43.124.8880 > 192.168.43.195.7771: UDP, length 120
01:54:40.273094 IP 192.168.43.195.8880 > 192.168.43.124.7772: UDP, length 120
01:54:40.310467 IP 192.168.43.124.8880 > 192.168.43.195.7771: UDP, length 120
01:54:40.323096 IP 192.168.43.195.8880 > 192.168.43.124.7772: UDP, length 120
01:54:40.357369 IP 192.168.43.124.8880 > 192.168.43.195.7771: UDP, length 120
01:54:40.373138 IP 192.168.43.195.8880 > 192.168.43.124.7772: UDP, length 120
01:54:40.420685 IP 192.168.43.124.8880 > 192.168.43.195.7771: UDP, length 120
01:54:40.423102 IP 192.168.43.195.8880 > 192.168.43.124.7772: UDP, length 120
01:54:40.459043 IP 192.168.43.124.8880 > 192.168.43.195.7771: UDP, length 120
01:54:40.473106 IP 192.168.43.195.8880 > 192.168.43.124.7772: UDP, length 120
01:54:40.517255 IP 192.168.43.124.8880 > 192.168.43.195.7771: UDP, length 120
01:54:40.523098 IP 192.168.43.195.8880 > 192.168.43.124.7772: UDP, length 120
01:54:40.565470 IP 192.168.43.124.8880 > 192.168.43.195.7771: UDP, length 120
01:54:40.573094 IP 192.168.43.195.8880 > 192.168.43.124.7772: UDP, length 120
01:54:40.607731 IP 192.168.43.124.8880 > 192.168.43.195.7771: UDP, length 120
01:54:40.623098 IP 192.168.43.195.8880 > 192.168.43.124.7772: UDP, length 120
01:54:40.657288 IP 192.168.43.124.8880 > 192.168.43.195.7771: UDP, length 120
01:54:40.673098 IP 192.168.43.195.8880 > 192.168.43.124.7772: UDP, length 120
01:54:40.715868 IP 192.168.43.124.8880 > 192.168.43.195.7771: UDP, length 120
01:54:40.723095 IP 192.168.43.195.8880 > 192.168.43.124.7772: UDP, length 120
01:54:40.757597 IP 192.168.43.124.8880 > 192.168.43.195.7771: UDP, length 120
01:54:40.773112 IP 192.168.43.195.8880 > 192.168.43.124.7772: UDP, length 120
01:54:40.807195 IP 192.168.43.124.8880 > 192.168.43.195.7771: UDP, length 120
01:54:40.823099 IP 192.168.43.195.8880 > 192.168.43.124.7772: UDP, length 120
01:54:40.864706 IP 192.168.43.124.8880 > 192.168.43.195.7771: UDP, length 120
01:54:40.873099 IP 192.168.43.195.8880 > 192.168.43.124.7772: UDP, length 120
01:54:40.904473 IP 192.168.43.124.8880 > 192.168.43.195.7771: UDP, length 120
01:54:40.923157 IP 192.168.43.195.8880 > 192.168.43.124.7772: UDP, length 120
01:54:40.953515 IP 192.168.43.124.8880 > 192.168.43.195.7771: UDP, length 120
01:54:40.973131 IP 192.168.43.195.8880 > 192.168.43.124.7772: UDP, length 120
01:54:41.012056 IP 192.168.43.124.8880 > 192.168.43.195.7771: UDP, length 120
01:54:41.023095 IP 192.168.43.195.8880 > 192.168.43.124.7772: UDP, length 120
01:54:41.054030 IP 192.168.43.124.8880 > 192.168.43.195.7771: UDP, length 120
01:54:41.073129 IP 192.168.43.195.8880 > 192.168.43.124.7772: UDP, length 120
01:54:41.108460 IP 192.168.43.124.8880 > 192.168.43.195.7771: UDP, length 120
01:54:41.123149 IP 192.168.43.195.8880 > 192.168.43.124.7772: UDP, length 120
01:54:41.154173 IP 192.168.43.124.8880 > 192.168.43.195.7771: UDP, length 120
01:54:41.173150 IP 192.168.43.195.8880 > 192.168.43.124.7772: UDP, length 120
01:54:41.204256 IP 192.168.43.124.8880 > 192.168.43.195.7771: UDP, length 120
01:54:41.223142 IP 192.168.43.195.8880 > 192.168.43.124.7772: UDP, length 120
01:54:41.254995 IP 192.168.43.124.8880 > 192.168.43.195.7771: UDP, length 120
01:54:41.273146 IP 192.168.43.195.8880 > 192.168.43.124.7772: UDP, length 120
01:54:41.305962 IP 192.168.43.124.8880 > 192.168.43.195.7771: UDP, length 120
01:54:41.323140 IP 192.168.43.195.8880 > 192.168.43.124.7772: UDP, length 120
01:54:41.373100 IP 192.168.43.195.8880 > 192.168.43.124.7772: UDP, length 120
01:54:41.423097 IP 192.168.43.195.8880 > 192.168.43.124.7772: UDP, length 120
01:54:41.464645 IP 192.168.43.124.8880 > 192.168.43.195.7771: UDP, length 120
01:54:41.465174 IP 192.168.43.124.8880 > 192.168.43.195.7771: UDP, length 120
01:54:41.465417 IP 192.168.43.124.8880 > 192.168.43.195.7771: UDP, length 120
01:54:41.473123 IP 192.168.43.195.8880 > 192.168.43.124.7772: UDP, length 120
01:54:41.523113 IP 192.168.43.195.8880 > 192.168.43.124.7772: UDP, length 120
01:54:41.568982 IP 192.168.43.124.8880 > 192.168.43.195.7771: UDP, length 120
01:54:41.569248 IP 192.168.43.124.8880 > 192.168.43.195.7771: UDP, length 120
01:54:41.573125 IP 192.168.43.195.8880 > 192.168.43.124.7772: UDP, length 120
01:54:41.623104 IP 192.168.43.195.8880 > 192.168.43.124.7772: UDP, length 120
01:54:41.673098 IP 192.168.43.195.8880 > 192.168.43.124.7772: UDP, length 120
01:54:41.676818 IP 192.168.43.124.8880 > 192.168.43.195.7771: UDP, length 120
01:54:41.677067 IP 192.168.43.124.8880 > 192.168.43.195.7771: UDP, length 120
01:54:41.723109 IP 192.168.43.195.8880 > 192.168.43.124.7772: UDP, length 120
01:54:41.773109 IP 192.168.43.195.8880 > 192.168.43.124.7772: UDP, length 120
01:54:41.802850 IP 192.168.43.124.8880 > 192.168.43.195.7771: UDP, length 120
01:54:41.803264 IP 192.168.43.124.8880 > 192.168.43.195.7771: UDP, length 120
01:54:41.823128 IP 192.168.43.195.8880 > 192.168.43.124.7772: UDP, length 120
01:54:41.873151 IP 192.168.43.195.8880 > 192.168.43.124.7772: UDP, length 120
01:54:41.909198 IP 192.168.43.124.8880 > 192.168.43.195.7771: UDP, length 120
01:54:41.909782 IP 192.168.43.124.8880 > 192.168.43.195.7771: UDP, length 120
01:54:41.910032 IP 192.168.43.124.8880 > 192.168.43.195.7771: UDP, length 120
01:54:41.923162 IP 192.168.43.195.8880 > 192.168.43.124.7772: UDP, length 120
01:54:41.973106 IP 192.168.43.195.8880 > 192.168.43.124.7772: UDP, length 120
01:54:42.022728 IP 192.168.43.124.8880 > 192.168.43.195.7771: UDP, length 120
01:54:42.023118 IP 192.168.43.124.8880 > 192.168.43.195.7771: UDP, length 120
01:54:42.023462 IP 192.168.43.195.8880 > 192.168.43.124.7772: UDP, length 120
01:54:42.073167 IP 192.168.43.195.8880 > 192.168.43.124.7772: UDP, length 120
01:54:42.123132 IP 192.168.43.195.8880 > 192.168.43.124.7772: UDP, length 120
01:54:42.155457 IP 192.168.43.124.8880 > 192.168.43.195.7771: UDP, length 120
01:54:42.155819 IP 192.168.43.124.8880 > 192.168.43.195.7771: UDP, length 120
01:54:42.173125 IP 192.168.43.195.8880 > 192.168.43.124.7772: UDP, length 120
01:54:42.223102 IP 192.168.43.195.8880 > 192.168.43.124.7772: UDP, length 120
01:54:42.259014 IP 192.168.43.124.8880 > 192.168.43.195.7771: UDP, length 120
01:54:42.259244 IP 192.168.43.124.8880 > 192.168.43.195.7771: UDP, length 120
01:54:42.259357 IP 192.168.43.124.8880 > 192.168.43.195.7771: UDP, length 120
01:54:42.273102 IP 192.168.43.195.8880 > 192.168.43.124.7772: UDP, length 120
01:54:42.323098 IP 192.168.43.195.8880 > 192.168.43.124.7772: UDP, length 120
01:54:42.373097 IP 192.168.43.195.8880 > 192.168.43.124.7772: UDP, length 120
01:54:42.400651 IP 192.168.43.124.8880 > 192.168.43.195.7771: UDP, length 120
01:54:42.400774 IP 192.168.43.124.8880 > 192.168.43.195.7771: UDP, length 120
01:54:42.423098 IP 192.168.43.195.8880 > 192.168.43.124.7772: UDP, length 120
01:54:42.473117 IP 192.168.43.195.8880 > 192.168.43.124.7772: UDP, length 120
01:54:42.512896 IP 192.168.43.124.8880 > 192.168.43.195.7771: UDP, length 120
01:54:42.513117 IP 192.168.43.124.8880 > 192.168.43.195.7771: UDP, length 120
01:54:42.513234 IP 192.168.43.124.8880 > 192.168.43.195.7771: UDP, length 120
01:54:42.523120 IP 192.168.43.195.8880 > 192.168.43.124.7772: UDP, length 120
01:54:42.573099 IP 192.168.43.195.8880 > 192.168.43.124.7772: UDP, length 120
01:54:42.623095 IP 192.168.43.195.8880 > 192.168.43.124.7772: UDP, length 120
01:54:42.656575 IP 192.168.43.124.8880 > 192.168.43.195.7771: UDP, length 120
01:54:42.656797 IP 192.168.43.124.8880 > 192.168.43.195.7771: UDP, length 120
01:54:42.673096 IP 192.168.43.195.8880 > 192.168.43.124.7772: UDP, length 120
01:54:42.723096 IP 192.168.43.195.8880 > 192.168.43.124.7772: UDP, length 120
01:54:42.756832 IP 192.168.43.124.8880 > 192.168.43.195.7771: UDP, length 120
01:54:42.757054 IP 192.168.43.124.8880 > 192.168.43.195.7771: UDP, length 120
01:54:42.773177 IP 192.168.43.195.8880 > 192.168.43.124.7772: UDP, length 120
01:54:42.823153 IP 192.168.43.195.8880 > 192.168.43.124.7772: UDP, length 120
01:54:42.860889 IP 192.168.43.124.8880 > 192.168.43.195.7771: UDP, length 120
01:54:42.861030 IP 192.168.43.124.8880 > 192.168.43.195.7771: UDP, length 120
01:54:42.861106 IP 192.168.43.124.8880 > 192.168.43.195.7771: UDP, length 120
01:54:42.873170 IP 192.168.43.195.8880 > 192.168.43.124.7772: UDP, length 120
01:54:42.923154 IP 192.168.43.195.8880 > 192.168.43.124.7772: UDP, length 120
01:54:42.973135 IP 192.168.43.195.8880 > 192.168.43.124.7772: UDP, length 120
01:54:43.016069 IP 192.168.43.124.8880 > 192.168.43.195.7771: UDP, length 120
01:54:43.016212 IP 192.168.43.124.8880 > 192.168.43.195.7771: UDP, length 120
01:54:43.016287 IP 192.168.43.124.8880 > 192.168.43.195.7771: UDP, length 120
01:54:43.023154 IP 192.168.43.195.8880 > 192.168.43.124.7772: UDP, length 120
01:54:43.073152 IP 192.168.43.195.8880 > 192.168.43.124.7772: UDP, length 120
01:54:43.123159 IP 192.168.43.195.8880 > 192.168.43.124.7772: UDP, length 120
01:54:43.173167 IP 192.168.43.195.8880 > 192.168.43.124.7772: UDP, length 120
01:54:43.176487 IP 192.168.43.124.8880 > 192.168.43.195.7771: UDP, length 120
01:54:43.176607 IP 192.168.43.124.8880 > 192.168.43.195.7771: UDP, length 120
01:54:43.176680 IP 192.168.43.124.8880 > 192.168.43.195.7771: UDP, length 120
01:54:43.223113 IP 192.168.43.195.8880 > 192.168.43.124.7772: UDP, length 120
01:54:43.273071 IP 192.168.43.195.8880 > 192.168.43.124.7772: UDP, length 120
01:54:43.314129 IP 192.168.43.124.8880 > 192.168.43.195.7771: UDP, length 120
01:54:43.314275 IP 192.168.43.124.8880 > 192.168.43.195.7771: UDP, length 120
01:54:43.323074 IP 192.168.43.195.8880 > 192.168.43.124.7772: UDP, length 120
01:54:43.373103 IP 192.168.43.195.8880 > 192.168.43.124.7772: UDP, length 120
01:54:43.411248 IP 192.168.43.124.8880 > 192.168.43.195.7771: UDP, length 120
01:54:43.411393 IP 192.168.43.124.8880 > 192.168.43.195.7771: UDP, length 120
01:54:43.411466 IP 192.168.43.124.8880 > 192.168.43.195.7771: UDP, length 120
01:54:43.423083 IP 192.168.43.195.8880 > 192.168.43.124.7772: UDP, length 120
01:54:43.473072 IP 192.168.43.195.8880 > 192.168.43.124.7772: UDP, length 120
01:54:43.523100 IP 192.168.43.195.8880 > 192.168.43.124.7772: UDP, length 120
01:54:43.562046 IP 192.168.43.124.8880 > 192.168.43.195.7771: UDP, length 120
01:54:43.562285 IP 192.168.43.124.8880 > 192.168.43.195.7771: UDP, length 120
01:54:43.562400 IP 192.168.43.124.8880 > 192.168.43.195.7771: UDP, length 120
01:54:43.573106 IP 192.168.43.195.8880 > 192.168.43.124.7772: UDP, length 120
01:54:43.623098 IP 192.168.43.195.8880 > 192.168.43.124.7772: UDP, length 120
01:54:43.673097 IP 192.168.43.195.8880 > 192.168.43.124.7772: UDP, length 120
01:54:43.720105 IP 192.168.43.124.8880 > 192.168.43.195.7771: UDP, length 120
01:54:43.720327 IP 192.168.43.124.8880 > 192.168.43.195.7771: UDP, length 120
01:54:43.720440 IP 192.168.43.124.8880 > 192.168.43.195.7771: UDP, length 120
01:54:43.723099 IP 192.168.43.195.8880 > 192.168.43.124.7772: UDP, length 120
01:54:43.773097 IP 192.168.43.195.8880 > 192.168.43.124.7772: UDP, length 120
01:54:43.823098 IP 192.168.43.195.8880 > 192.168.43.124.7772: UDP, length 120
01:54:43.868635 IP 192.168.43.124.8880 > 192.168.43.195.7771: UDP, length 120
01:54:43.868771 IP 192.168.43.124.8880 > 192.168.43.195.7771: UDP, length 120
01:54:43.873112 IP 192.168.43.195.8880 > 192.168.43.124.7772: UDP, length 120
01:54:43.907625 IP 192.168.43.124.8880 > 192.168.43.195.7771: UDP, length 120
01:54:43.907849 IP 192.168.43.124.8880 > 192.168.43.195.7771: UDP, length 120
01:54:43.923101 IP 192.168.43.195.8880 > 192.168.43.124.7772: UDP, length 120
01:54:43.957524 IP 192.168.43.124.8880 > 192.168.43.195.7771: UDP, length 120
01:54:43.973097 IP 192.168.43.195.8880 > 192.168.43.124.7772: UDP, length 120
01:54:44.007413 IP 192.168.43.124.8880 > 192.168.43.195.7771: UDP, length 120
01:54:44.023097 IP 192.168.43.195.8880 > 192.168.43.124.7772: UDP, length 120
01:54:44.057368 IP 192.168.43.124.8880 > 192.168.43.195.7771: UDP, length 120
01:54:44.073096 IP 192.168.43.195.8880 > 192.168.43.124.7772: UDP, length 120
01:54:44.107479 IP 192.168.43.124.8880 > 192.168.43.195.7771: UDP, length 120
01:54:44.123097 IP 192.168.43.195.8880 > 192.168.43.124.7772: UDP, length 120
01:54:44.157758 IP 192.168.43.124.8880 > 192.168.43.195.7771: UDP, length 120
01:54:44.173096 IP 192.168.43.195.8880 > 192.168.43.124.7772: UDP, length 120
01:54:44.219117 IP 192.168.43.124.8880 > 192.168.43.195.7771: UDP, length 120
01:54:44.223103 IP 192.168.43.195.8880 > 192.168.43.124.7772: UDP, length 120
01:54:44.257611 IP 192.168.43.124.8880 > 192.168.43.195.7771: UDP, length 120
01:54:44.273100 IP 192.168.43.195.8880 > 192.168.43.124.7772: UDP, length 120
01:54:44.307471 IP 192.168.43.124.8880 > 192.168.43.195.7771: UDP, length 120
01:54:44.323110 IP 192.168.43.195.8880 > 192.168.43.124.7772: UDP, length 120
01:54:44.358943 IP 192.168.43.124.8880 > 192.168.43.195.7771: UDP, length 120
01:54:44.373109 IP 192.168.43.195.8880 > 192.168.43.124.7772: UDP, length 120
01:54:44.407446 IP 192.168.43.124.8880 > 192.168.43.195.7771: UDP, length 120
01:54:44.423112 IP 192.168.43.195.8880 > 192.168.43.124.7772: UDP, length 120
01:54:44.457693 IP 192.168.43.124.8880 > 192.168.43.195.7771: UDP, length 120
01:54:44.473106 IP 192.168.43.195.8880 > 192.168.43.124.7772: UDP, length 120
01:54:44.508666 IP 192.168.43.124.8880 > 192.168.43.195.7771: UDP, length 120
01:54:44.523105 IP 192.168.43.195.8880 > 192.168.43.124.7772: UDP, length 120
01:54:44.566935 IP 192.168.43.124.8880 > 192.168.43.195.7771: UDP, length 120
01:54:44.573100 IP 192.168.43.195.8880 > 192.168.43.124.7772: UDP, length 120
01:54:44.612561 IP 192.168.43.124.8880 > 192.168.43.195.7771: UDP, length 120
01:54:44.623094 IP 192.168.43.195.8880 > 192.168.43.124.7772: UDP, length 120
01:54:44.658218 IP 192.168.43.124.8880 > 192.168.43.195.7771: UDP, length 120
01:54:44.673094 IP 192.168.43.195.8880 > 192.168.43.124.7772: UDP, length 120
01:54:44.723097 IP 192.168.43.195.8880 > 192.168.43.124.7772: UDP, length 120
01:54:44.732009 IP 192.168.43.124.8880 > 192.168.43.195.7771: UDP, length 120
01:54:44.758218 IP 192.168.43.124.8880 > 192.168.43.195.7771: UDP, length 120
01:54:44.773100 IP 192.168.43.195.8880 > 192.168.43.124.7772: UDP, length 120
01:54:44.804438 IP 192.168.43.124.8880 > 192.168.43.195.7771: UDP, length 120
01:54:44.823104 IP 192.168.43.195.8880 > 192.168.43.124.7772: UDP, length 120
01:54:44.858535 IP 192.168.43.124.8880 > 192.168.43.195.7771: UDP, length 120
01:54:44.873146 IP 192.168.43.195.8880 > 192.168.43.124.7772: UDP, length 120
01:54:44.907838 IP 192.168.43.124.8880 > 192.168.43.195.7771: UDP, length 120
01:54:44.923104 IP 192.168.43.195.8880 > 192.168.43.124.7772: UDP, length 120
01:54:44.957483 IP 192.168.43.124.8880 > 192.168.43.195.7771: UDP, length 120
01:54:44.973097 IP 192.168.43.195.8880 > 192.168.43.124.7772: UDP, length 120
01:54:45.007322 IP 192.168.43.124.8880 > 192.168.43.195.7771: UDP, length 120
01:54:45.023103 IP 192.168.43.195.8880 > 192.168.43.124.7772: UDP, length 120
01:54:45.057335 IP 192.168.43.124.8880 > 192.168.43.195.7771: UDP, length 120
01:54:45.073103 IP 192.168.43.195.8880 > 192.168.43.124.7772: UDP, length 120
01:54:45.107461 IP 192.168.43.124.8880 > 192.168.43.195.7771: UDP, length 120
01:54:45.123099 IP 192.168.43.195.8880 > 192.168.43.124.7772: UDP, length 120
01:54:45.157630 IP 192.168.43.124.8880 > 192.168.43.195.7771: UDP, length 120
01:54:45.173098 IP 192.168.43.195.8880 > 192.168.43.124.7772: UDP, length 120
01:54:45.217543 IP 192.168.43.124.8880 > 192.168.43.195.7771: UDP, length 120
01:54:45.223094 IP 192.168.43.195.8880 > 192.168.43.124.7772: UDP, length 120
01:54:45.257637 IP 192.168.43.124.8880 > 192.168.43.195.7771: UDP, length 120
01:54:45.273100 IP 192.168.43.195.8880 > 192.168.43.124.7772: UDP, length 120
01:54:45.310086 IP 192.168.43.124.8880 > 192.168.43.195.7771: UDP, length 120
01:54:45.323114 IP 192.168.43.195.8880 > 192.168.43.124.7772: UDP, length 120
01:54:45.367507 IP 192.168.43.124.8880 > 192.168.43.195.7771: UDP, length 120
01:54:45.373101 IP 192.168.43.195.8880 > 192.168.43.124.7772: UDP, length 120
01:54:45.407740 IP 192.168.43.124.8880 > 192.168.43.195.7771: UDP, length 120
01:54:45.423096 IP 192.168.43.195.8880 > 192.168.43.124.7772: UDP, length 120
01:54:45.457330 IP 192.168.43.124.8880 > 192.168.43.195.7771: UDP, length 120
01:54:45.473097 IP 192.168.43.195.8880 > 192.168.43.124.7772: UDP, length 120
01:54:45.521421 IP 192.168.43.124.8880 > 192.168.43.195.7771: UDP, length 120
01:54:45.523095 IP 192.168.43.195.8880 > 192.168.43.124.7772: UDP, length 120
01:54:45.558846 IP 192.168.43.124.8880 > 192.168.43.195.7771: UDP, length 120
01:54:45.573094 IP 192.168.43.195.8880 > 192.168.43.124.7772: UDP, length 120
01:54:45.609655 IP 192.168.43.124.8880 > 192.168.43.195.7771: UDP, length 120
01:54:45.623093 IP 192.168.43.195.8880 > 192.168.43.124.7772: UDP, length 120
01:54:45.657875 IP 192.168.43.124.8880 > 192.168.43.195.7771: UDP, length 120
01:54:45.673093 IP 192.168.43.195.8880 > 192.168.43.124.7772: UDP, length 120
01:54:45.707580 IP 192.168.43.124.8880 > 192.168.43.195.7771: UDP, length 120
01:54:45.723101 IP 192.168.43.195.8880 > 192.168.43.124.7772: UDP, length 120
01:54:45.762330 IP 192.168.43.124.8880 > 192.168.43.195.7771: UDP, length 120
01:54:45.773100 IP 192.168.43.195.8880 > 192.168.43.124.7772: UDP, length 120
01:54:45.805916 IP 192.168.43.124.8880 > 192.168.43.195.7771: UDP, length 120
01:54:45.823098 IP 192.168.43.195.8880 > 192.168.43.124.7772: UDP, length 120
01:54:45.861467 IP 192.168.43.124.8880 > 192.168.43.195.7771: UDP, length 120
01:54:45.873108 IP 192.168.43.195.8880 > 192.168.43.124.7772: UDP, length 120
01:54:45.907963 IP 192.168.43.124.8880 > 192.168.43.195.7771: UDP, length 120
01:54:45.923098 IP 192.168.43.195.8880 > 192.168.43.124.7772: UDP, length 120
01:54:45.959226 IP 192.168.43.124.8880 > 192.168.43.195.7771: UDP, length 120
01:54:45.973093 IP 192.168.43.195.8880 > 192.168.43.124.7772: UDP, length 120
01:54:46.009104 IP 192.168.43.124.8880 > 192.168.43.195.7771: UDP, length 120
01:54:46.023093 IP 192.168.43.195.8880 > 192.168.43.124.7772: UDP, length 120
01:54:46.059177 IP 192.168.43.124.8880 > 192.168.43.195.7771: UDP, length 120
01:54:46.073093 IP 192.168.43.195.8880 > 192.168.43.124.7772: UDP, length 120
01:54:46.108863 IP 192.168.43.124.8880 > 192.168.43.195.7771: UDP, length 120
01:54:46.123099 IP 192.168.43.195.8880 > 192.168.43.124.7772: UDP, length 120
01:54:46.157375 IP 192.168.43.124.8880 > 192.168.43.195.7771: UDP, length 120
01:54:46.173098 IP 192.168.43.195.8880 > 192.168.43.124.7772: UDP, length 120
01:54:46.209229 IP 192.168.43.124.8880 > 192.168.43.195.7771: UDP, length 120
01:54:46.223092 IP 192.168.43.195.8880 > 192.168.43.124.7772: UDP, length 120
01:54:46.259382 IP 192.168.43.124.8880 > 192.168.43.195.7771: UDP, length 120
01:54:46.273094 IP 192.168.43.195.8880 > 192.168.43.124.7772: UDP, length 120
01:54:46.309038 IP 192.168.43.124.8880 > 192.168.43.195.7771: UDP, length 120
01:54:46.323094 IP 192.168.43.195.8880 > 192.168.43.124.7772: UDP, length 120
01:54:46.361398 IP 192.168.43.124.8880 > 192.168.43.195.7771: UDP, length 120
01:54:46.373140 IP 192.168.43.195.8880 > 192.168.43.124.7772: UDP, length 120
01:54:46.409148 IP 192.168.43.124.8880 > 192.168.43.195.7771: UDP, length 120
01:54:46.423106 IP 192.168.43.195.8880 > 192.168.43.124.7772: UDP, length 120
01:54:46.458821 IP 192.168.43.124.8880 > 192.168.43.195.7771: UDP, length 120
01:54:46.473096 IP 192.168.43.195.8880 > 192.168.43.124.7772: UDP, length 120
01:54:46.511223 IP 192.168.43.124.8880 > 192.168.43.195.7771: UDP, length 120
01:54:46.523098 IP 192.168.43.195.8880 > 192.168.43.124.7772: UDP, length 120
01:54:46.559159 IP 192.168.43.124.8880 > 192.168.43.195.7771: UDP, length 120
01:54:46.573094 IP 192.168.43.195.8880 > 192.168.43.124.7772: UDP, length 120
01:54:46.613553 IP 192.168.43.124.8880 > 192.168.43.195.7771: UDP, length 120
01:54:46.623095 IP 192.168.43.195.8880 > 192.168.43.124.7772: UDP, length 120
01:54:46.660543 IP 192.168.43.124.8880 > 192.168.43.195.7771: UDP, length 120
01:54:46.673098 IP 192.168.43.195.8880 > 192.168.43.124.7772: UDP, length 120
01:54:46.709167 IP 192.168.43.124.8880 > 192.168.43.195.7771: UDP, length 120
01:54:46.723093 IP 192.168.43.195.8880 > 192.168.43.124.7772: UDP, length 120
01:54:46.761097 IP 192.168.43.124.8880 > 192.168.43.195.7771: UDP, length 120
01:54:46.773098 IP 192.168.43.195.8880 > 192.168.43.124.7772: UDP, length 120
01:54:46.810410 IP 192.168.43.124.8880 > 192.168.43.195.7771: UDP, length 120
01:54:46.823095 IP 192.168.43.195.8880 > 192.168.43.124.7772: UDP, length 120
01:54:46.857810 IP 192.168.43.124.8880 > 192.168.43.195.7771: UDP, length 120
01:54:46.873104 IP 192.168.43.195.8880 > 192.168.43.124.7772: UDP, length 120
01:54:46.910726 IP 192.168.43.124.8880 > 192.168.43.195.7771: UDP, length 120
01:54:46.923097 IP 192.168.43.195.8880 > 192.168.43.124.7772: UDP, length 120
01:54:46.958838 IP 192.168.43.124.8880 > 192.168.43.195.7771: UDP, length 120
01:54:46.973098 IP 192.168.43.195.8880 > 192.168.43.124.7772: UDP, length 120
01:54:47.010746 IP 192.168.43.124.8880 > 192.168.43.195.7771: UDP, length 120
01:54:47.023094 IP 192.168.43.195.8880 > 192.168.43.124.7772: UDP, length 120
01:54:47.059065 IP 192.168.43.124.8880 > 192.168.43.195.7771: UDP, length 120
01:54:47.073094 IP 192.168.43.195.8880 > 192.168.43.124.7772: UDP, length 120
01:54:47.109062 IP 192.168.43.124.8880 > 192.168.43.195.7771: UDP, length 120
01:54:47.123095 IP 192.168.43.195.8880 > 192.168.43.124.7772: UDP, length 120
01:54:47.159083 IP 192.168.43.124.8880 > 192.168.43.195.7771: UDP, length 120
01:54:47.173093 IP 192.168.43.195.8880 > 192.168.43.124.7772: UDP, length 120
01:54:47.209066 IP 192.168.43.124.8880 > 192.168.43.195.7771: UDP, length 120
01:54:47.223093 IP 192.168.43.195.8880 > 192.168.43.124.7772: UDP, length 120
01:54:47.273097 IP 192.168.43.195.8880 > 192.168.43.124.7772: UDP, length 120
01:54:47.323095 IP 192.168.43.195.8880 > 192.168.43.124.7772: UDP, length 120
01:54:47.373095 IP 192.168.43.195.8880 > 192.168.43.124.7772: UDP, length 120
01:54:47.423098 IP 192.168.43.195.8880 > 192.168.43.124.7772: UDP, length 120
01:54:47.473096 IP 192.168.43.195.8880 > 192.168.43.124.7772: UDP, length 120
01:54:47.523097 IP 192.168.43.195.8880 > 192.168.43.124.7772: UDP, length 120
01:54:47.573095 IP 192.168.43.195.8880 > 192.168.43.124.7772: UDP, length 120
01:54:47.623096 IP 192.168.43.195.8880 > 192.168.43.124.7772: UDP, length 120
01:54:47.673102 IP 192.168.43.195.8880 > 192.168.43.124.7772: UDP, length 120
01:54:47.723099 IP 192.168.43.195.8880 > 192.168.43.124.7772: UDP, length 120
