02:48:11.880313 IP 192.168.43.146.8880 > 192.168.43.147.7772: UDP, length 120
02:48:11.930357 IP 192.168.43.146.8880 > 192.168.43.147.7772: UDP, length 120
02:48:11.980365 IP 192.168.43.146.8880 > 192.168.43.147.7772: UDP, length 120
02:48:12.030335 IP 192.168.43.146.8880 > 192.168.43.147.7772: UDP, length 120
02:48:12.080334 IP 192.168.43.146.8880 > 192.168.43.147.7772: UDP, length 120
02:48:12.130348 IP 192.168.43.146.8880 > 192.168.43.147.7772: UDP, length 120
02:48:12.180333 IP 192.168.43.146.8880 > 192.168.43.147.7772: UDP, length 120
02:48:12.230330 IP 192.168.43.146.8880 > 192.168.43.147.7772: UDP, length 120
02:48:12.280334 IP 192.168.43.146.8880 > 192.168.43.147.7772: UDP, length 120
02:48:12.330503 IP 192.168.43.146.8880 > 192.168.43.147.7772: UDP, length 120
02:48:12.380418 IP 192.168.43.146.8880 > 192.168.43.147.7772: UDP, length 120
02:48:12.430386 IP 192.168.43.146.8880 > 192.168.43.147.7772: UDP, length 120
02:48:12.480367 IP 192.168.43.146.8880 > 192.168.43.147.7772: UDP, length 120
02:48:12.530513 IP 192.168.43.146.8880 > 192.168.43.147.7772: UDP, length 120
02:48:12.580386 IP 192.168.43.146.8880 > 192.168.43.147.7772: UDP, length 120
02:48:12.630492 IP 192.168.43.146.8880 > 192.168.43.147.7772: UDP, length 120
02:48:12.680414 IP 192.168.43.146.8880 > 192.168.43.147.7772: UDP, length 120
02:48:12.730447 IP 192.168.43.146.8880 > 192.168.43.147.7772: UDP, length 120
02:48:12.780433 IP 192.168.43.146.8880 > 192.168.43.147.7772: UDP, length 120
02:48:12.830358 IP 192.168.43.146.8880 > 192.168.43.147.7772: UDP, length 120
02:48:12.880346 IP 192.168.43.146.8880 > 192.168.43.147.7772: UDP, length 120
02:48:12.930309 IP 192.168.43.146.8880 > 192.168.43.147.7772: UDP, length 120
02:48:12.980307 IP 192.168.43.146.8880 > 192.168.43.147.7772: UDP, length 120
02:48:13.030304 IP 192.168.43.146.8880 > 192.168.43.147.7772: UDP, length 120
02:48:13.080305 IP 192.168.43.146.8880 > 192.168.43.147.7772: UDP, length 120
02:48:13.130305 IP 192.168.43.146.8880 > 192.168.43.147.7772: UDP, length 120
02:48:13.180303 IP 192.168.43.146.8880 > 192.168.43.147.7772: UDP, length 120
02:48:13.230303 IP 192.168.43.146.8880 > 192.168.43.147.7772: UDP, length 120
02:48:13.280304 IP 192.168.43.146.8880 > 192.168.43.147.7772: UDP, length 120
02:48:13.330302 IP 192.168.43.146.8880 > 192.168.43.147.7772: UDP, length 120
02:48:13.380303 IP 192.168.43.146.8880 > 192.168.43.147.7772: UDP, length 120
02:48:13.430302 IP 192.168.43.146.8880 > 192.168.43.147.7772: UDP, length 120
02:48:13.480303 IP 192.168.43.146.8880 > 192.168.43.147.7772: UDP, length 120
02:48:13.530307 IP 192.168.43.146.8880 > 192.168.43.147.7772: UDP, length 120
02:48:13.580303 IP 192.168.43.146.8880 > 192.168.43.147.7772: UDP, length 120
02:48:13.630303 IP 192.168.43.146.8880 > 192.168.43.147.7772: UDP, length 120
02:48:13.680305 IP 192.168.43.146.8880 > 192.168.43.147.7772: UDP, length 120
02:48:13.730303 IP 192.168.43.146.8880 > 192.168.43.147.7772: UDP, length 120
02:48:13.780303 IP 192.168.43.146.8880 > 192.168.43.147.7772: UDP, length 120
02:48:13.830307 IP 192.168.43.146.8880 > 192.168.43.147.7772: UDP, length 120
02:48:13.880306 IP 192.168.43.146.8880 > 192.168.43.147.7772: UDP, length 120
02:48:13.930303 IP 192.168.43.146.8880 > 192.168.43.147.7772: UDP, length 120
02:48:13.980310 IP 192.168.43.146.8880 > 192.168.43.147.7772: UDP, length 120
02:48:14.030308 IP 192.168.43.146.8880 > 192.168.43.147.7772: UDP, length 120
02:48:14.080311 IP 192.168.43.146.8880 > 192.168.43.147.7772: UDP, length 120
02:48:14.130304 IP 192.168.43.146.8880 > 192.168.43.147.7772: UDP, length 120
02:48:14.180303 IP 192.168.43.146.8880 > 192.168.43.147.7772: UDP, length 120
02:48:14.230304 IP 192.168.43.146.8880 > 192.168.43.147.7772: UDP, length 120
02:48:14.280305 IP 192.168.43.146.8880 > 192.168.43.147.7772: UDP, length 120
02:48:14.330302 IP 192.168.43.146.8880 > 192.168.43.147.7772: UDP, length 120
02:48:14.380351 IP 192.168.43.146.8880 > 192.168.43.147.7772: UDP, length 120
02:48:14.430315 IP 192.168.43.146.8880 > 192.168.43.147.7772: UDP, length 120
02:48:14.480936 IP 192.168.43.146.8880 > 192.168.43.147.7772: UDP, length 120
02:48:14.530386 IP 192.168.43.146.8880 > 192.168.43.147.7772: UDP, length 120
02:48:14.580364 IP 192.168.43.146.8880 > 192.168.43.147.7772: UDP, length 120
02:48:14.630318 IP 192.168.43.146.8880 > 192.168.43.147.7772: UDP, length 120
02:48:14.680308 IP 192.168.43.146.8880 > 192.168.43.147.7772: UDP, length 120
02:48:14.730303 IP 192.168.43.146.8880 > 192.168.43.147.7772: UDP, length 120
02:48:14.780304 IP 192.168.43.146.8880 > 192.168.43.147.7772: UDP, length 120
02:48:14.830303 IP 192.168.43.146.8880 > 192.168.43.147.7772: UDP, length 120
02:48:14.880314 IP 192.168.43.146.8880 > 192.168.43.147.7772: UDP, length 120
02:48:14.930307 IP 192.168.43.146.8880 > 192.168.43.147.7772: UDP, length 120
02:48:14.980310 IP 192.168.43.146.8880 > 192.168.43.147.7772: UDP, length 120
02:48:15.030305 IP 192.168.43.146.8880 > 192.168.43.147.7772: UDP, length 120
02:48:15.080305 IP 192.168.43.146.8880 > 192.168.43.147.7772: UDP, length 120
02:48:15.130303 IP 192.168.43.146.8880 > 192.168.43.147.7772: UDP, length 120
02:48:15.180303 IP 192.168.43.146.8880 > 192.168.43.147.7772: UDP, length 120
02:48:15.230303 IP 192.168.43.146.8880 > 192.168.43.147.7772: UDP, length 120
02:48:15.280310 IP 192.168.43.146.8880 > 192.168.43.147.7772: UDP, length 120
02:48:15.330303 IP 192.168.43.146.8880 > 192.168.43.147.7772: UDP, length 120
02:48:15.380304 IP 192.168.43.146.8880 > 192.168.43.147.7772: UDP, length 120
02:48:15.430309 IP 192.168.43.146.8880 > 192.168.43.147.7772: UDP, length 120
02:48:15.480303 IP 192.168.43.146.8880 > 192.168.43.147.7772: UDP, length 120
02:48:15.530303 IP 192.168.43.146.8880 > 192.168.43.147.7772: UDP, length 120
02:48:15.580375 IP 192.168.43.146.8880 > 192.168.43.147.7772: UDP, length 120
02:48:15.630355 IP 192.168.43.146.8880 > 192.168.43.147.7772: UDP, length 120
02:48:15.680314 IP 192.168.43.146.8880 > 192.168.43.147.7772: UDP, length 120
02:48:15.730310 IP 192.168.43.146.8880 > 192.168.43.147.7772: UDP, length 120
02:48:15.774363 IP 192.168.43.124.8880 > 192.168.43.146.7771: UDP, length 120
02:48:15.780305 IP 192.168.43.146.8880 > 192.168.43.147.7772: UDP, length 120
02:48:15.824691 IP 192.168.43.124.8880 > 192.168.43.146.7771: UDP, length 120
02:48:15.830304 IP 192.168.43.146.8880 > 192.168.43.147.7772: UDP, length 120
02:48:15.872706 IP 192.168.43.124.8880 > 192.168.43.146.7771: UDP, length 120
02:48:15.880345 IP 192.168.43.146.8880 > 192.168.43.147.7772: UDP, length 120
02:48:15.925025 IP 192.168.43.124.8880 > 192.168.43.146.7771: UDP, length 120
02:48:15.930328 IP 192.168.43.146.8880 > 192.168.43.147.7772: UDP, length 120
02:48:15.975196 IP 192.168.43.124.8880 > 192.168.43.146.7771: UDP, length 120
02:48:15.980326 IP 192.168.43.146.8880 > 192.168.43.147.7772: UDP, length 120
02:48:16.022165 IP 192.168.43.124.8880 > 192.168.43.146.7771: UDP, length 120
02:48:16.030307 IP 192.168.43.146.8880 > 192.168.43.147.7772: UDP, length 120
02:48:16.072192 IP 192.168.43.124.8880 > 192.168.43.146.7771: UDP, length 120
02:48:16.080308 IP 192.168.43.146.8880 > 192.168.43.147.7772: UDP, length 120
02:48:16.122105 IP 192.168.43.124.8880 > 192.168.43.146.7771: UDP, length 120
02:48:16.130305 IP 192.168.43.146.8880 > 192.168.43.147.7772: UDP, length 120
02:48:16.172251 IP 192.168.43.124.8880 > 192.168.43.146.7771: UDP, length 120
02:48:16.180305 IP 192.168.43.146.8880 > 192.168.43.147.7772: UDP, length 120
02:48:16.222203 IP 192.168.43.124.8880 > 192.168.43.146.7771: UDP, length 120
02:48:16.230308 IP 192.168.43.146.8880 > 192.168.43.147.7772: UDP, length 120
02:48:16.272208 IP 192.168.43.124.8880 > 192.168.43.146.7771: UDP, length 120
02:48:16.280308 IP 192.168.43.146.8880 > 192.168.43.147.7772: UDP, length 120
02:48:16.324600 IP 192.168.43.124.8880 > 192.168.43.146.7771: UDP, length 120
02:48:16.330304 IP 192.168.43.146.8880 > 192.168.43.147.7772: UDP, length 120
02:48:16.372227 IP 192.168.43.124.8880 > 192.168.43.146.7771: UDP, length 120
02:48:16.380306 IP 192.168.43.146.8880 > 192.168.43.147.7772: UDP, length 120
02:48:16.424733 IP 192.168.43.124.8880 > 192.168.43.146.7771: UDP, length 120
02:48:16.430303 IP 192.168.43.146.8880 > 192.168.43.147.7772: UDP, length 120
02:48:16.472221 IP 192.168.43.124.8880 > 192.168.43.146.7771: UDP, length 120
02:48:16.480306 IP 192.168.43.146.8880 > 192.168.43.147.7772: UDP, length 120
02:48:16.523877 IP 192.168.43.124.8880 > 192.168.43.146.7771: UDP, length 120
02:48:16.530304 IP 192.168.43.146.8880 > 192.168.43.147.7772: UDP, length 120
02:48:16.572205 IP 192.168.43.124.8880 > 192.168.43.146.7771: UDP, length 120
02:48:16.580307 IP 192.168.43.146.8880 > 192.168.43.147.7772: UDP, length 120
02:48:16.621748 IP 192.168.43.124.8880 > 192.168.43.146.7771: UDP, length 120
02:48:16.630344 IP 192.168.43.146.8880 > 192.168.43.147.7772: UDP, length 120
02:48:16.671774 IP 192.168.43.124.8880 > 192.168.43.146.7771: UDP, length 120
02:48:16.680313 IP 192.168.43.146.8880 > 192.168.43.147.7772: UDP, length 120
02:48:16.722121 IP 192.168.43.124.8880 > 192.168.43.146.7771: UDP, length 120
02:48:16.730308 IP 192.168.43.146.8880 > 192.168.43.147.7772: UDP, length 120
02:48:16.772263 IP 192.168.43.124.8880 > 192.168.43.146.7771: UDP, length 120
02:48:16.780306 IP 192.168.43.146.8880 > 192.168.43.147.7772: UDP, length 120
02:48:16.822185 IP 192.168.43.124.8880 > 192.168.43.146.7771: UDP, length 120
02:48:16.830302 IP 192.168.43.146.8880 > 192.168.43.147.7772: UDP, length 120
02:48:16.873483 IP 192.168.43.124.8880 > 192.168.43.146.7771: UDP, length 120
02:48:16.880303 IP 192.168.43.146.8880 > 192.168.43.147.7772: UDP, length 120
02:48:16.922125 IP 192.168.43.124.8880 > 192.168.43.146.7771: UDP, length 120
02:48:16.930309 IP 192.168.43.146.8880 > 192.168.43.147.7772: UDP, length 120
02:48:16.973655 IP 192.168.43.124.8880 > 192.168.43.146.7771: UDP, length 120
02:48:16.980335 IP 192.168.43.146.8880 > 192.168.43.147.7772: UDP, length 120
02:48:17.023861 IP 192.168.43.124.8880 > 192.168.43.146.7771: UDP, length 120
02:48:17.030311 IP 192.168.43.146.8880 > 192.168.43.147.7772: UDP, length 120
02:48:17.072230 IP 192.168.43.124.8880 > 192.168.43.146.7771: UDP, length 120
02:48:17.080307 IP 192.168.43.146.8880 > 192.168.43.147.7772: UDP, length 120
02:48:17.122825 IP 192.168.43.124.8880 > 192.168.43.146.7771: UDP, length 120
02:48:17.130303 IP 192.168.43.146.8880 > 192.168.43.147.7772: UDP, length 120
02:48:17.172338 IP 192.168.43.124.8880 > 192.168.43.146.7771: UDP, length 120
02:48:17.180304 IP 192.168.43.146.8880 > 192.168.43.147.7772: UDP, length 120
02:48:17.222201 IP 192.168.43.124.8880 > 192.168.43.146.7771: UDP, length 120
02:48:17.230303 IP 192.168.43.146.8880 > 192.168.43.147.7772: UDP, length 120
02:48:17.272026 IP 192.168.43.124.8880 > 192.168.43.146.7771: UDP, length 120
02:48:17.280309 IP 192.168.43.146.8880 > 192.168.43.147.7772: UDP, length 120
02:48:17.322011 IP 192.168.43.124.8880 > 192.168.43.146.7771: UDP, length 120
02:48:17.330308 IP 192.168.43.146.8880 > 192.168.43.147.7772: UDP, length 120
02:48:17.375393 IP 192.168.43.124.8880 > 192.168.43.146.7771: UDP, length 120
02:48:17.380347 IP 192.168.43.146.8880 > 192.168.43.147.7772: UDP, length 120
02:48:17.421770 IP 192.168.43.124.8880 > 192.168.43.146.7771: UDP, length 120
02:48:17.430315 IP 192.168.43.146.8880 > 192.168.43.147.7772: UDP, length 120
02:48:17.477977 IP 192.168.43.124.8880 > 192.168.43.146.7771: UDP, length 120
02:48:17.480304 IP 192.168.43.146.8880 > 192.168.43.147.7772: UDP, length 120
02:48:17.522585 IP 192.168.43.124.8880 > 192.168.43.146.7771: UDP, length 120
02:48:17.530302 IP 192.168.43.146.8880 > 192.168.43.147.7772: UDP, length 120
02:48:17.570353 IP 192.168.43.124.8880 > 192.168.43.146.7771: UDP, length 120
02:48:17.580317 IP 192.168.43.146.8880 > 192.168.43.147.7772: UDP, length 120
02:48:17.622377 IP 192.168.43.124.8880 > 192.168.43.146.7771: UDP, length 120
02:48:17.630398 IP 192.168.43.146.8880 > 192.168.43.147.7772: UDP, length 120
02:48:17.671871 IP 192.168.43.124.8880 > 192.168.43.146.7771: UDP, length 120
02:48:17.680358 IP 192.168.43.146.8880 > 192.168.43.147.7772: UDP, length 120
02:48:17.730329 IP 192.168.43.146.8880 > 192.168.43.147.7772: UDP, length 120
02:48:17.738642 IP 192.168.43.124.8880 > 192.168.43.146.7771: UDP, length 120
02:48:17.772164 IP 192.168.43.124.8880 > 192.168.43.146.7771: UDP, length 120
02:48:17.780335 IP 192.168.43.146.8880 > 192.168.43.147.7772: UDP, length 120
02:48:17.822608 IP 192.168.43.124.8880 > 192.168.43.146.7771: UDP, length 120
02:48:17.830395 IP 192.168.43.146.8880 > 192.168.43.147.7772: UDP, length 120
02:48:17.874113 IP 192.168.43.124.8880 > 192.168.43.146.7771: UDP, length 120
02:48:17.880393 IP 192.168.43.146.8880 > 192.168.43.147.7772: UDP, length 120
02:48:17.923061 IP 192.168.43.124.8880 > 192.168.43.146.7771: UDP, length 120
02:48:17.930371 IP 192.168.43.146.8880 > 192.168.43.147.7772: UDP, length 120
02:48:17.973090 IP 192.168.43.124.8880 > 192.168.43.146.7771: UDP, length 120
02:48:17.980433 IP 192.168.43.146.8880 > 192.168.43.147.7772: UDP, length 120
02:48:18.023675 IP 192.168.43.124.8880 > 192.168.43.146.7771: UDP, length 120
02:48:18.030406 IP 192.168.43.146.8880 > 192.168.43.147.7772: UDP, length 120
02:48:18.075161 IP 192.168.43.124.8880 > 192.168.43.146.7771: UDP, length 120
02:48:18.080414 IP 192.168.43.146.8880 > 192.168.43.147.7772: UDP, length 120
02:48:18.121855 IP 192.168.43.124.8880 > 192.168.43.146.7771: UDP, length 120
02:48:18.130391 IP 192.168.43.146.8880 > 192.168.43.147.7772: UDP, length 120
02:48:18.172000 IP 192.168.43.124.8880 > 192.168.43.146.7771: UDP, length 120
02:48:18.180389 IP 192.168.43.146.8880 > 192.168.43.147.7772: UDP, length 120
02:48:18.221861 IP 192.168.43.124.8880 > 192.168.43.146.7771: UDP, length 120
02:48:18.230408 IP 192.168.43.146.8880 > 192.168.43.147.7772: UDP, length 120
02:48:18.271819 IP 192.168.43.124.8880 > 192.168.43.146.7771: UDP, length 120
02:48:18.280349 IP 192.168.43.146.8880 > 192.168.43.147.7772: UDP, length 120
02:48:18.321760 IP 192.168.43.124.8880 > 192.168.43.146.7771: UDP, length 120
02:48:18.330313 IP 192.168.43.146.8880 > 192.168.43.147.7772: UDP, length 120
02:48:18.370681 IP 192.168.43.124.8880 > 192.168.43.146.7771: UDP, length 120
02:48:18.380309 IP 192.168.43.146.8880 > 192.168.43.147.7772: UDP, length 120
02:48:18.422220 IP 192.168.43.124.8880 > 192.168.43.146.7771: UDP, length 120
02:48:18.430305 IP 192.168.43.146.8880 > 192.168.43.147.7772: UDP, length 120
02:48:18.472835 IP 192.168.43.124.8880 > 192.168.43.146.7771: UDP, length 120
02:48:18.480307 IP 192.168.43.146.8880 > 192.168.43.147.7772: UDP, length 120
02:48:18.521976 IP 192.168.43.124.8880 > 192.168.43.146.7771: UDP, length 120
02:48:18.530306 IP 192.168.43.146.8880 > 192.168.43.147.7772: UDP, length 120
02:48:18.572156 IP 192.168.43.124.8880 > 192.168.43.146.7771: UDP, length 120
02:48:18.580304 IP 192.168.43.146.8880 > 192.168.43.147.7772: UDP, length 120
02:48:18.622316 IP 192.168.43.124.8880 > 192.168.43.146.7771: UDP, length 120
02:48:18.630380 IP 192.168.43.146.8880 > 192.168.43.147.7772: UDP, length 120
02:48:18.678417 IP 192.168.43.124.8880 > 192.168.43.146.7771: UDP, length 120
02:48:18.680350 IP 192.168.43.146.8880 > 192.168.43.147.7772: UDP, length 120
02:48:18.721262 IP 192.168.43.124.8880 > 192.168.43.146.7771: UDP, length 120
02:48:18.730309 IP 192.168.43.146.8880 > 192.168.43.147.7772: UDP, length 120
02:48:18.771574 IP 192.168.43.124.8880 > 192.168.43.146.7771: UDP, length 120
02:48:18.780306 IP 192.168.43.146.8880 > 192.168.43.147.7772: UDP, length 120
02:48:18.821903 IP 192.168.43.124.8880 > 192.168.43.146.7771: UDP, length 120
02:48:18.830304 IP 192.168.43.146.8880 > 192.168.43.147.7772: UDP, length 120
02:48:18.872219 IP 192.168.43.124.8880 > 192.168.43.146.7771: UDP, length 120
02:48:18.880354 IP 192.168.43.146.8880 > 192.168.43.147.7772: UDP, length 120
02:48:18.922203 IP 192.168.43.124.8880 > 192.168.43.146.7771: UDP, length 120
02:48:18.930319 IP 192.168.43.146.8880 > 192.168.43.147.7772: UDP, length 120
02:48:18.972190 IP 192.168.43.124.8880 > 192.168.43.146.7771: UDP, length 120
02:48:18.980320 IP 192.168.43.146.8880 > 192.168.43.147.7772: UDP, length 120
02:48:19.023152 IP 192.168.43.124.8880 > 192.168.43.146.7771: UDP, length 120
02:48:19.030304 IP 192.168.43.146.8880 > 192.168.43.147.7772: UDP, length 120
02:48:19.072769 IP 192.168.43.124.8880 > 192.168.43.146.7771: UDP, length 120
02:48:19.080316 IP 192.168.43.146.8880 > 192.168.43.147.7772: UDP, length 120
02:48:19.123792 IP 192.168.43.124.8880 > 192.168.43.146.7771: UDP, length 120
02:48:19.130311 IP 192.168.43.146.8880 > 192.168.43.147.7772: UDP, length 120
02:48:19.173096 IP 192.168.43.124.8880 > 192.168.43.146.7771: UDP, length 120
02:48:19.180307 IP 192.168.43.146.8880 > 192.168.43.147.7772: UDP, length 120
02:48:19.222267 IP 192.168.43.124.8880 > 192.168.43.146.7771: UDP, length 120
02:48:19.230304 IP 192.168.43.146.8880 > 192.168.43.147.7772: UDP, length 120
02:48:19.272039 IP 192.168.43.124.8880 > 192.168.43.146.7771: UDP, length 120
02:48:19.280306 IP 192.168.43.146.8880 > 192.168.43.147.7772: UDP, length 120
02:48:19.322188 IP 192.168.43.124.8880 > 192.168.43.146.7771: UDP, length 120
02:48:19.330303 IP 192.168.43.146.8880 > 192.168.43.147.7772: UDP, length 120
02:48:19.372203 IP 192.168.43.124.8880 > 192.168.43.146.7771: UDP, length 120
02:48:19.380306 IP 192.168.43.146.8880 > 192.168.43.147.7772: UDP, length 120
02:48:19.423494 IP 192.168.43.124.8880 > 192.168.43.146.7771: UDP, length 120
02:48:19.430307 IP 192.168.43.146.8880 > 192.168.43.147.7772: UDP, length 120
02:48:19.472187 IP 192.168.43.124.8880 > 192.168.43.146.7771: UDP, length 120
02:48:19.480305 IP 192.168.43.146.8880 > 192.168.43.147.7772: UDP, length 120
02:48:19.525832 IP 192.168.43.124.8880 > 192.168.43.146.7771: UDP, length 120
02:48:19.530304 IP 192.168.43.146.8880 > 192.168.43.147.7772: UDP, length 120
02:48:19.572308 IP 192.168.43.124.8880 > 192.168.43.146.7771: UDP, length 120
02:48:19.580306 IP 192.168.43.146.8880 > 192.168.43.147.7772: UDP, length 120
02:48:19.628590 IP 192.168.43.124.8880 > 192.168.43.146.7771: UDP, length 120
02:48:19.630304 IP 192.168.43.146.8880 > 192.168.43.147.7772: UDP, length 120
02:48:19.673250 IP 192.168.43.124.8880 > 192.168.43.146.7771: UDP, length 120
02:48:19.680347 IP 192.168.43.146.8880 > 192.168.43.147.7772: UDP, length 120
02:48:19.724365 IP 192.168.43.124.8880 > 192.168.43.146.7771: UDP, length 120
02:48:19.730310 IP 192.168.43.146.8880 > 192.168.43.147.7772: UDP, length 120
02:48:19.772622 IP 192.168.43.124.8880 > 192.168.43.146.7771: UDP, length 120
02:48:19.780308 IP 192.168.43.146.8880 > 192.168.43.147.7772: UDP, length 120
02:48:19.822280 IP 192.168.43.124.8880 > 192.168.43.146.7771: UDP, length 120
02:48:19.830305 IP 192.168.43.146.8880 > 192.168.43.147.7772: UDP, length 120
02:48:19.872276 IP 192.168.43.124.8880 > 192.168.43.146.7771: UDP, length 120
02:48:19.880306 IP 192.168.43.146.8880 > 192.168.43.147.7772: UDP, length 120
02:48:19.922126 IP 192.168.43.124.8880 > 192.168.43.146.7771: UDP, length 120
02:48:19.930304 IP 192.168.43.146.8880 > 192.168.43.147.7772: UDP, length 120
02:48:19.974021 IP 192.168.43.124.8880 > 192.168.43.146.7771: UDP, length 120
02:48:19.980313 IP 192.168.43.146.8880 > 192.168.43.147.7772: UDP, length 120
02:48:20.022728 IP 192.168.43.124.8880 > 192.168.43.146.7771: UDP, length 120
02:48:20.030305 IP 192.168.43.146.8880 > 192.168.43.147.7772: UDP, length 120
02:48:20.074201 IP 192.168.43.124.8880 > 192.168.43.146.7771: UDP, length 120
02:48:20.080308 IP 192.168.43.146.8880 > 192.168.43.147.7772: UDP, length 120
02:48:20.123338 IP 192.168.43.124.8880 > 192.168.43.146.7771: UDP, length 120
02:48:20.130308 IP 192.168.43.146.8880 > 192.168.43.147.7772: UDP, length 120
02:48:20.173433 IP 192.168.43.124.8880 > 192.168.43.146.7771: UDP, length 120
02:48:20.180310 IP 192.168.43.146.8880 > 192.168.43.147.7772: UDP, length 120
02:48:20.223638 IP 192.168.43.124.8880 > 192.168.43.146.7771: UDP, length 120
02:48:20.230307 IP 192.168.43.146.8880 > 192.168.43.147.7772: UDP, length 120
02:48:20.280307 IP 192.168.43.146.8880 > 192.168.43.147.7772: UDP, length 120
02:48:20.287518 IP 192.168.43.124.8880 > 192.168.43.146.7771: UDP, length 120
02:48:20.322332 IP 192.168.43.124.8880 > 192.168.43.146.7771: UDP, length 120
02:48:20.330306 IP 192.168.43.146.8880 > 192.168.43.147.7772: UDP, length 120
02:48:20.372177 IP 192.168.43.124.8880 > 192.168.43.146.7771: UDP, length 120
02:48:20.380312 IP 192.168.43.146.8880 > 192.168.43.147.7772: UDP, length 120
02:48:20.422215 IP 192.168.43.124.8880 > 192.168.43.146.7771: UDP, length 120
02:48:20.430338 IP 192.168.43.146.8880 > 192.168.43.147.7772: UDP, length 120
02:48:20.472176 IP 192.168.43.124.8880 > 192.168.43.146.7771: UDP, length 120
02:48:20.480312 IP 192.168.43.146.8880 > 192.168.43.147.7772: UDP, length 120
02:48:20.519994 IP 192.168.43.124.8880 > 192.168.43.146.7771: UDP, length 120
02:48:20.530304 IP 192.168.43.146.8880 > 192.168.43.147.7772: UDP, length 120
02:48:20.580307 IP 192.168.43.146.8880 > 192.168.43.147.7772: UDP, length 120
02:48:20.582957 IP 192.168.43.124.8880 > 192.168.43.146.7771: UDP, length 120
02:48:20.622197 IP 192.168.43.124.8880 > 192.168.43.146.7771: UDP, length 120
02:48:20.630305 IP 192.168.43.146.8880 > 192.168.43.147.7772: UDP, length 120
02:48:20.672397 IP 192.168.43.124.8880 > 192.168.43.146.7771: UDP, length 120
02:48:20.680349 IP 192.168.43.146.8880 > 192.168.43.147.7772: UDP, length 120
02:48:20.721766 IP 192.168.43.124.8880 > 192.168.43.146.7771: UDP, length 120
02:48:20.730310 IP 192.168.43.146.8880 > 192.168.43.147.7772: UDP, length 120
02:48:20.772202 IP 192.168.43.124.8880 > 192.168.43.146.7771: UDP, length 120
02:48:20.780306 IP 192.168.43.146.8880 > 192.168.43.147.7772: UDP, length 120
02:48:20.819148 IP 192.168.43.124.8880 > 192.168.43.146.7771: UDP, length 120
02:48:20.830312 IP 192.168.43.146.8880 > 192.168.43.147.7772: UDP, length 120
02:48:20.872186 IP 192.168.43.124.8880 > 192.168.43.146.7771: UDP, length 120
02:48:20.880310 IP 192.168.43.146.8880 > 192.168.43.147.7772: UDP, length 120
02:48:20.922197 IP 192.168.43.124.8880 > 192.168.43.146.7771: UDP, length 120
02:48:20.930309 IP 192.168.43.146.8880 > 192.168.43.147.7772: UDP, length 120
02:48:20.972210 IP 192.168.43.124.8880 > 192.168.43.146.7771: UDP, length 120
02:48:20.980314 IP 192.168.43.146.8880 > 192.168.43.147.7772: UDP, length 120
02:48:21.022303 IP 192.168.43.124.8880 > 192.168.43.146.7771: UDP, length 120
02:48:21.030306 IP 192.168.43.146.8880 > 192.168.43.147.7772: UDP, length 120
02:48:21.072186 IP 192.168.43.124.8880 > 192.168.43.146.7771: UDP, length 120
02:48:21.080306 IP 192.168.43.146.8880 > 192.168.43.147.7772: UDP, length 120
02:48:21.122847 IP 192.168.43.124.8880 > 192.168.43.146.7771: UDP, length 120
02:48:21.130303 IP 192.168.43.146.8880 > 192.168.43.147.7772: UDP, length 120
02:48:21.174343 IP 192.168.43.124.8880 > 192.168.43.146.7771: UDP, length 120
02:48:21.180307 IP 192.168.43.146.8880 > 192.168.43.147.7772: UDP, length 120
02:48:21.220418 IP 192.168.43.124.8880 > 192.168.43.146.7771: UDP, length 120
02:48:21.230317 IP 192.168.43.146.8880 > 192.168.43.147.7772: UDP, length 120
02:48:21.272260 IP 192.168.43.124.8880 > 192.168.43.146.7771: UDP, length 120
02:48:21.280304 IP 192.168.43.146.8880 > 192.168.43.147.7772: UDP, length 120
02:48:21.322215 IP 192.168.43.124.8880 > 192.168.43.146.7771: UDP, length 120
02:48:21.330302 IP 192.168.43.146.8880 > 192.168.43.147.7772: UDP, length 120
02:48:21.372201 IP 192.168.43.124.8880 > 192.168.43.146.7771: UDP, length 120
02:48:21.380309 IP 192.168.43.146.8880 > 192.168.43.147.7772: UDP, length 120
02:48:21.422202 IP 192.168.43.124.8880 > 192.168.43.146.7771: UDP, length 120
02:48:21.430301 IP 192.168.43.146.8880 > 192.168.43.147.7772: UDP, length 120
02:48:21.472199 IP 192.168.43.124.8880 > 192.168.43.146.7771: UDP, length 120
02:48:21.480303 IP 192.168.43.146.8880 > 192.168.43.147.7772: UDP, length 120
02:48:21.522176 IP 192.168.43.124.8880 > 192.168.43.146.7771: UDP, length 120
02:48:21.530309 IP 192.168.43.146.8880 > 192.168.43.147.7772: UDP, length 120
02:48:21.573663 IP 192.168.43.124.8880 > 192.168.43.146.7771: UDP, length 120
02:48:21.580303 IP 192.168.43.146.8880 > 192.168.43.147.7772: UDP, length 120
02:48:21.622259 IP 192.168.43.124.8880 > 192.168.43.146.7771: UDP, length 120
02:48:21.630303 IP 192.168.43.146.8880 > 192.168.43.147.7772: UDP, length 120
02:48:21.673182 IP 192.168.43.124.8880 > 192.168.43.146.7771: UDP, length 120
02:48:21.680309 IP 192.168.43.146.8880 > 192.168.43.147.7772: UDP, length 120
02:48:21.722235 IP 192.168.43.124.8880 > 192.168.43.146.7771: UDP, length 120
02:48:21.730303 IP 192.168.43.146.8880 > 192.168.43.147.7772: UDP, length 120
02:48:21.775024 IP 192.168.43.124.8880 > 192.168.43.146.7771: UDP, length 120
02:48:21.780301 IP 192.168.43.146.8880 > 192.168.43.147.7772: UDP, length 120
02:48:21.823868 IP 192.168.43.124.8880 > 192.168.43.146.7771: UDP, length 120
02:48:21.830302 IP 192.168.43.146.8880 > 192.168.43.147.7772: UDP, length 120
02:48:21.874783 IP 192.168.43.124.8880 > 192.168.43.146.7771: UDP, length 120
02:48:21.880302 IP 192.168.43.146.8880 > 192.168.43.147.7772: UDP, length 120
02:48:21.922259 IP 192.168.43.124.8880 > 192.168.43.146.7771: UDP, length 120
02:48:21.930333 IP 192.168.43.146.8880 > 192.168.43.147.7772: UDP, length 120
02:48:21.972020 IP 192.168.43.124.8880 > 192.168.43.146.7771: UDP, length 120
02:48:21.980319 IP 192.168.43.146.8880 > 192.168.43.147.7772: UDP, length 120
02:48:22.022101 IP 192.168.43.124.8880 > 192.168.43.146.7771: UDP, length 120
02:48:22.030304 IP 192.168.43.146.8880 > 192.168.43.147.7772: UDP, length 120
02:48:22.072161 IP 192.168.43.124.8880 > 192.168.43.146.7771: UDP, length 120
02:48:22.080306 IP 192.168.43.146.8880 > 192.168.43.147.7772: UDP, length 120
02:48:22.122285 IP 192.168.43.124.8880 > 192.168.43.146.7771: UDP, length 120
02:48:22.130304 IP 192.168.43.146.8880 > 192.168.43.147.7772: UDP, length 120
02:48:22.173229 IP 192.168.43.124.8880 > 192.168.43.146.7771: UDP, length 120
02:48:22.180303 IP 192.168.43.146.8880 > 192.168.43.147.7772: UDP, length 120
02:48:22.230310 IP 192.168.43.146.8880 > 192.168.43.147.7772: UDP, length 120
02:48:22.234043 IP 192.168.43.124.8880 > 192.168.43.146.7771: UDP, length 120
02:48:22.273109 IP 192.168.43.124.8880 > 192.168.43.146.7771: UDP, length 120
02:48:22.280316 IP 192.168.43.146.8880 > 192.168.43.147.7772: UDP, length 120
02:48:22.323960 IP 192.168.43.124.8880 > 192.168.43.146.7771: UDP, length 120
02:48:22.330303 IP 192.168.43.146.8880 > 192.168.43.147.7772: UDP, length 120
02:48:22.372174 IP 192.168.43.124.8880 > 192.168.43.146.7771: UDP, length 120
02:48:22.380303 IP 192.168.43.146.8880 > 192.168.43.147.7772: UDP, length 120
02:48:22.421768 IP 192.168.43.124.8880 > 192.168.43.146.7771: UDP, length 120
02:48:22.430302 IP 192.168.43.146.8880 > 192.168.43.147.7772: UDP, length 120
02:48:22.472218 IP 192.168.43.124.8880 > 192.168.43.146.7771: UDP, length 120
02:48:22.480302 IP 192.168.43.146.8880 > 192.168.43.147.7772: UDP, length 120
02:48:22.522236 IP 192.168.43.124.8880 > 192.168.43.146.7771: UDP, length 120
02:48:22.530302 IP 192.168.43.146.8880 > 192.168.43.147.7772: UDP, length 120
02:48:22.572174 IP 192.168.43.124.8880 > 192.168.43.146.7771: UDP, length 120
02:48:22.580303 IP 192.168.43.146.8880 > 192.168.43.147.7772: UDP, length 120
02:48:22.622422 IP 192.168.43.124.8880 > 192.168.43.146.7771: UDP, length 120
02:48:22.630325 IP 192.168.43.146.8880 > 192.168.43.147.7772: UDP, length 120
02:48:22.673732 IP 192.168.43.124.8880 > 192.168.43.146.7771: UDP, length 120
02:48:22.680425 IP 192.168.43.146.8880 > 192.168.43.147.7772: UDP, length 120
02:48:22.721943 IP 192.168.43.124.8880 > 192.168.43.146.7771: UDP, length 120
02:48:22.730412 IP 192.168.43.146.8880 > 192.168.43.147.7772: UDP, length 120
02:48:22.773901 IP 192.168.43.124.8880 > 192.168.43.146.7771: UDP, length 120
02:48:22.780416 IP 192.168.43.146.8880 > 192.168.43.147.7772: UDP, length 120
02:48:22.821773 IP 192.168.43.124.8880 > 192.168.43.146.7771: UDP, length 120
02:48:22.830350 IP 192.168.43.146.8880 > 192.168.43.147.7772: UDP, length 120
02:48:22.871766 IP 192.168.43.124.8880 > 192.168.43.146.7771: UDP, length 120
02:48:22.880314 IP 192.168.43.146.8880 > 192.168.43.147.7772: UDP, length 120
02:48:22.922296 IP 192.168.43.124.8880 > 192.168.43.146.7771: UDP, length 120
02:48:22.930305 IP 192.168.43.146.8880 > 192.168.43.147.7772: UDP, length 120
02:48:22.972454 IP 192.168.43.124.8880 > 192.168.43.146.7771: UDP, length 120
02:48:22.980339 IP 192.168.43.146.8880 > 192.168.43.147.7772: UDP, length 120
02:48:23.024210 IP 192.168.43.124.8880 > 192.168.43.146.7771: UDP, length 120
02:48:23.030333 IP 192.168.43.146.8880 > 192.168.43.147.7772: UDP, length 120
02:48:23.072220 IP 192.168.43.124.8880 > 192.168.43.146.7771: UDP, length 120
02:48:23.080329 IP 192.168.43.146.8880 > 192.168.43.147.7772: UDP, length 120
02:48:23.122397 IP 192.168.43.124.8880 > 192.168.43.146.7771: UDP, length 120
02:48:23.130328 IP 192.168.43.146.8880 > 192.168.43.147.7772: UDP, length 120
02:48:23.173591 IP 192.168.43.124.8880 > 192.168.43.146.7771: UDP, length 120
02:48:23.180326 IP 192.168.43.146.8880 > 192.168.43.147.7772: UDP, length 120
02:48:23.222542 IP 192.168.43.124.8880 > 192.168.43.146.7771: UDP, length 120
02:48:23.230325 IP 192.168.43.146.8880 > 192.168.43.147.7772: UDP, length 120
02:48:23.271980 IP 192.168.43.124.8880 > 192.168.43.146.7771: UDP, length 120
02:48:23.280398 IP 192.168.43.146.8880 > 192.168.43.147.7772: UDP, length 120
02:48:23.322888 IP 192.168.43.124.8880 > 192.168.43.146.7771: UDP, length 120
02:48:23.330408 IP 192.168.43.146.8880 > 192.168.43.147.7772: UDP, length 120
02:48:23.375583 IP 192.168.43.124.8880 > 192.168.43.146.7771: UDP, length 120
02:48:23.380455 IP 192.168.43.146.8880 > 192.168.43.147.7772: UDP, length 120
02:48:23.421894 IP 192.168.43.124.8880 > 192.168.43.146.7771: UDP, length 120
02:48:23.430371 IP 192.168.43.146.8880 > 192.168.43.147.7772: UDP, length 120
02:48:23.471885 IP 192.168.43.124.8880 > 192.168.43.146.7771: UDP, length 120
02:48:23.480406 IP 192.168.43.146.8880 > 192.168.43.147.7772: UDP, length 120
02:48:23.521845 IP 192.168.43.124.8880 > 192.168.43.146.7771: UDP, length 120
02:48:23.530399 IP 192.168.43.146.8880 > 192.168.43.147.7772: UDP, length 120
02:48:23.571834 IP 192.168.43.124.8880 > 192.168.43.146.7771: UDP, length 120
02:48:23.580379 IP 192.168.43.146.8880 > 192.168.43.147.7772: UDP, length 120
02:48:23.621973 IP 192.168.43.124.8880 > 192.168.43.146.7771: UDP, length 120
02:48:23.630397 IP 192.168.43.146.8880 > 192.168.43.147.7772: UDP, length 120
02:48:23.671842 IP 192.168.43.124.8880 > 192.168.43.146.7771: UDP, length 120
02:48:23.680389 IP 192.168.43.146.8880 > 192.168.43.147.7772: UDP, length 120
02:48:23.721901 IP 192.168.43.124.8880 > 192.168.43.146.7771: UDP, length 120
02:48:23.730398 IP 192.168.43.146.8880 > 192.168.43.147.7772: UDP, length 120
02:48:23.771809 IP 192.168.43.124.8880 > 192.168.43.146.7771: UDP, length 120
02:48:23.780347 IP 192.168.43.146.8880 > 192.168.43.147.7772: UDP, length 120
02:48:23.823841 IP 192.168.43.124.8880 > 192.168.43.146.7771: UDP, length 120
02:48:23.830392 IP 192.168.43.146.8880 > 192.168.43.147.7772: UDP, length 120
02:48:23.871778 IP 192.168.43.124.8880 > 192.168.43.146.7771: UDP, length 120
02:48:23.880358 IP 192.168.43.146.8880 > 192.168.43.147.7772: UDP, length 120
02:48:23.927196 IP 192.168.43.124.8880 > 192.168.43.146.7771: UDP, length 120
02:48:23.930308 IP 192.168.43.146.8880 > 192.168.43.147.7772: UDP, length 120
02:48:23.974180 IP 192.168.43.124.8880 > 192.168.43.146.7771: UDP, length 120
02:48:23.980317 IP 192.168.43.146.8880 > 192.168.43.147.7772: UDP, length 120
02:48:24.025203 IP 192.168.43.124.8880 > 192.168.43.146.7771: UDP, length 120
02:48:24.030307 IP 192.168.43.146.8880 > 192.168.43.147.7772: UDP, length 120
02:48:24.072284 IP 192.168.43.124.8880 > 192.168.43.146.7771: UDP, length 120
02:48:24.080313 IP 192.168.43.146.8880 > 192.168.43.147.7772: UDP, length 120
02:48:24.130309 IP 192.168.43.146.8880 > 192.168.43.147.7772: UDP, length 120
02:48:24.133560 IP 192.168.43.124.8880 > 192.168.43.146.7771: UDP, length 120
02:48:24.172275 IP 192.168.43.124.8880 > 192.168.43.146.7771: UDP, length 120
02:48:24.180328 IP 192.168.43.146.8880 > 192.168.43.147.7772: UDP, length 120
02:48:24.222605 IP 192.168.43.124.8880 > 192.168.43.146.7771: UDP, length 120
02:48:24.230310 IP 192.168.43.146.8880 > 192.168.43.147.7772: UDP, length 120
02:48:24.272202 IP 192.168.43.124.8880 > 192.168.43.146.7771: UDP, length 120
02:48:24.280307 IP 192.168.43.146.8880 > 192.168.43.147.7772: UDP, length 120
02:48:24.323777 IP 192.168.43.124.8880 > 192.168.43.146.7771: UDP, length 120
02:48:24.330303 IP 192.168.43.146.8880 > 192.168.43.147.7772: UDP, length 120
02:48:24.372251 IP 192.168.43.124.8880 > 192.168.43.146.7771: UDP, length 120
02:48:24.380314 IP 192.168.43.146.8880 > 192.168.43.147.7772: UDP, length 120
02:48:24.424002 IP 192.168.43.124.8880 > 192.168.43.146.7771: UDP, length 120
02:48:24.430309 IP 192.168.43.146.8880 > 192.168.43.147.7772: UDP, length 120
02:48:24.477204 IP 192.168.43.124.8880 > 192.168.43.146.7771: UDP, length 120
02:48:24.480308 IP 192.168.43.146.8880 > 192.168.43.147.7772: UDP, length 120
02:48:24.522212 IP 192.168.43.124.8880 > 192.168.43.146.7771: UDP, length 120
02:48:24.530303 IP 192.168.43.146.8880 > 192.168.43.147.7772: UDP, length 120
02:48:24.572225 IP 192.168.43.124.8880 > 192.168.43.146.7771: UDP, length 120
02:48:24.580305 IP 192.168.43.146.8880 > 192.168.43.147.7772: UDP, length 120
02:48:24.622209 IP 192.168.43.124.8880 > 192.168.43.146.7771: UDP, length 120
02:48:24.630303 IP 192.168.43.146.8880 > 192.168.43.147.7772: UDP, length 120
02:48:24.672199 IP 192.168.43.124.8880 > 192.168.43.146.7771: UDP, length 120
02:48:24.680304 IP 192.168.43.146.8880 > 192.168.43.147.7772: UDP, length 120
02:48:24.722213 IP 192.168.43.124.8880 > 192.168.43.146.7771: UDP, length 120
02:48:24.730304 IP 192.168.43.146.8880 > 192.168.43.147.7772: UDP, length 120
02:48:24.772289 IP 192.168.43.124.8880 > 192.168.43.146.7771: UDP, length 120
02:48:24.780303 IP 192.168.43.146.8880 > 192.168.43.147.7772: UDP, length 120
02:48:24.824047 IP 192.168.43.124.8880 > 192.168.43.146.7771: UDP, length 120
02:48:24.830302 IP 192.168.43.146.8880 > 192.168.43.147.7772: UDP, length 120
02:48:24.871778 IP 192.168.43.124.8880 > 192.168.43.146.7771: UDP, length 120
02:48:24.880340 IP 192.168.43.146.8880 > 192.168.43.147.7772: UDP, length 120
02:48:24.924110 IP 192.168.43.124.8880 > 192.168.43.146.7771: UDP, length 120
02:48:24.930332 IP 192.168.43.146.8880 > 192.168.43.147.7772: UDP, length 120
02:48:24.971764 IP 192.168.43.124.8880 > 192.168.43.146.7771: UDP, length 120
02:48:24.980319 IP 192.168.43.146.8880 > 192.168.43.147.7772: UDP, length 120
02:48:25.023156 IP 192.168.43.124.8880 > 192.168.43.146.7771: UDP, length 120
02:48:25.030306 IP 192.168.43.146.8880 > 192.168.43.147.7772: UDP, length 120
02:48:25.072233 IP 192.168.43.124.8880 > 192.168.43.146.7771: UDP, length 120
02:48:25.080306 IP 192.168.43.146.8880 > 192.168.43.147.7772: UDP, length 120
02:48:25.122036 IP 192.168.43.124.8880 > 192.168.43.146.7771: UDP, length 120
02:48:25.130303 IP 192.168.43.146.8880 > 192.168.43.147.7772: UDP, length 120
02:48:25.172222 IP 192.168.43.124.8880 > 192.168.43.146.7771: UDP, length 120
02:48:25.180303 IP 192.168.43.146.8880 > 192.168.43.147.7772: UDP, length 120
02:48:25.223842 IP 192.168.43.124.8880 > 192.168.43.146.7771: UDP, length 120
02:48:25.230302 IP 192.168.43.146.8880 > 192.168.43.147.7772: UDP, length 120
02:48:25.272238 IP 192.168.43.124.8880 > 192.168.43.146.7771: UDP, length 120
02:48:25.280303 IP 192.168.43.146.8880 > 192.168.43.147.7772: UDP, length 120
02:48:25.323817 IP 192.168.43.124.8880 > 192.168.43.146.7771: UDP, length 120
02:48:25.330302 IP 192.168.43.146.8880 > 192.168.43.147.7772: UDP, length 120
02:48:25.372829 IP 192.168.43.124.8880 > 192.168.43.146.7771: UDP, length 120
02:48:25.380304 IP 192.168.43.146.8880 > 192.168.43.147.7772: UDP, length 120
02:48:25.421866 IP 192.168.43.124.8880 > 192.168.43.146.7771: UDP, length 120
02:48:25.430313 IP 192.168.43.146.8880 > 192.168.43.147.7772: UDP, length 120
02:48:25.472962 IP 192.168.43.124.8880 > 192.168.43.146.7771: UDP, length 120
02:48:25.480306 IP 192.168.43.146.8880 > 192.168.43.147.7772: UDP, length 120
02:48:25.522704 IP 192.168.43.124.8880 > 192.168.43.146.7771: UDP, length 120
02:48:25.530304 IP 192.168.43.146.8880 > 192.168.43.147.7772: UDP, length 120
02:48:25.572348 IP 192.168.43.124.8880 > 192.168.43.146.7771: UDP, length 120
02:48:25.580304 IP 192.168.43.146.8880 > 192.168.43.147.7772: UDP, length 120
02:48:25.622208 IP 192.168.43.124.8880 > 192.168.43.146.7771: UDP, length 120
02:48:25.630301 IP 192.168.43.146.8880 > 192.168.43.147.7772: UDP, length 120
02:48:25.671818 IP 192.168.43.124.8880 > 192.168.43.146.7771: UDP, length 120
02:48:25.680303 IP 192.168.43.146.8880 > 192.168.43.147.7772: UDP, length 120
02:48:25.722218 IP 192.168.43.124.8880 > 192.168.43.146.7771: UDP, length 120
02:48:25.730302 IP 192.168.43.146.8880 > 192.168.43.147.7772: UDP, length 120
02:48:25.772218 IP 192.168.43.124.8880 > 192.168.43.146.7771: UDP, length 120
02:48:25.780302 IP 192.168.43.146.8880 > 192.168.43.147.7772: UDP, length 120
02:48:25.822406 IP 192.168.43.124.8880 > 192.168.43.146.7771: UDP, length 120
02:48:25.830302 IP 192.168.43.146.8880 > 192.168.43.147.7772: UDP, length 120
02:48:25.871791 IP 192.168.43.124.8880 > 192.168.43.146.7771: UDP, length 120
02:48:25.880346 IP 192.168.43.146.8880 > 192.168.43.147.7772: UDP, length 120
02:48:25.922213 IP 192.168.43.124.8880 > 192.168.43.146.7771: UDP, length 120
02:48:25.930309 IP 192.168.43.146.8880 > 192.168.43.147.7772: UDP, length 120
02:48:25.976897 IP 192.168.43.124.8880 > 192.168.43.146.7771: UDP, length 120
02:48:25.980314 IP 192.168.43.146.8880 > 192.168.43.147.7772: UDP, length 120
02:48:26.022418 IP 192.168.43.124.8880 > 192.168.43.146.7771: UDP, length 120
02:48:26.030304 IP 192.168.43.146.8880 > 192.168.43.147.7772: UDP, length 120
02:48:26.073202 IP 192.168.43.124.8880 > 192.168.43.146.7771: UDP, length 120
02:48:26.080307 IP 192.168.43.146.8880 > 192.168.43.147.7772: UDP, length 120
02:48:26.122049 IP 192.168.43.124.8880 > 192.168.43.146.7771: UDP, length 120
02:48:26.130304 IP 192.168.43.146.8880 > 192.168.43.147.7772: UDP, length 120
02:48:26.172248 IP 192.168.43.124.8880 > 192.168.43.146.7771: UDP, length 120
02:48:26.180304 IP 192.168.43.146.8880 > 192.168.43.147.7772: UDP, length 120
02:48:26.222407 IP 192.168.43.124.8880 > 192.168.43.146.7771: UDP, length 120
02:48:26.230304 IP 192.168.43.146.8880 > 192.168.43.147.7772: UDP, length 120
02:48:26.272203 IP 192.168.43.124.8880 > 192.168.43.146.7771: UDP, length 120
02:48:26.280305 IP 192.168.43.146.8880 > 192.168.43.147.7772: UDP, length 120
02:48:26.322103 IP 192.168.43.124.8880 > 192.168.43.146.7771: UDP, length 120
02:48:26.330302 IP 192.168.43.146.8880 > 192.168.43.147.7772: UDP, length 120
02:48:26.372236 IP 192.168.43.124.8880 > 192.168.43.146.7771: UDP, length 120
02:48:26.380304 IP 192.168.43.146.8880 > 192.168.43.147.7772: UDP, length 120
02:48:26.422958 IP 192.168.43.124.8880 > 192.168.43.146.7771: UDP, length 120
02:48:26.430332 IP 192.168.43.146.8880 > 192.168.43.147.7772: UDP, length 120
02:48:26.473547 IP 192.168.43.124.8880 > 192.168.43.146.7771: UDP, length 120
02:48:26.480312 IP 192.168.43.146.8880 > 192.168.43.147.7772: UDP, length 120
02:48:26.521768 IP 192.168.43.124.8880 > 192.168.43.146.7771: UDP, length 120
02:48:26.530311 IP 192.168.43.146.8880 > 192.168.43.147.7772: UDP, length 120
02:48:26.575741 IP 192.168.43.124.8880 > 192.168.43.146.7771: UDP, length 120
02:48:26.580306 IP 192.168.43.146.8880 > 192.168.43.147.7772: UDP, length 120
