01:16:14.282099 IP 192.168.43.124.8880 > 192.168.43.146.7771: UDP, length 120
01:16:14.321154 IP 192.168.43.124.8880 > 192.168.43.146.7771: UDP, length 120
01:16:14.382208 IP 192.168.43.124.8880 > 192.168.43.146.7771: UDP, length 120
01:16:14.421135 IP 192.168.43.124.8880 > 192.168.43.146.7771: UDP, length 120
01:16:14.480927 IP 192.168.43.124.8880 > 192.168.43.146.7771: UDP, length 120
01:16:14.521849 IP 192.168.43.124.8880 > 192.168.43.146.7771: UDP, length 120
01:16:14.584458 IP 192.168.43.124.8880 > 192.168.43.146.7771: UDP, length 120
01:16:14.623891 IP 192.168.43.124.8880 > 192.168.43.146.7771: UDP, length 120
01:16:14.681070 IP 192.168.43.124.8880 > 192.168.43.146.7771: UDP, length 120
01:16:14.722820 IP 192.168.43.124.8880 > 192.168.43.146.7771: UDP, length 120
01:16:14.781260 IP 192.168.43.124.8880 > 192.168.43.146.7771: UDP, length 120
01:16:14.820165 IP 192.168.43.124.8880 > 192.168.43.146.7771: UDP, length 120
01:16:14.866989 IP 192.168.43.146.8880 > 192.168.43.147.7772: UDP, length 120
01:16:14.879424 IP 192.168.43.124.8880 > 192.168.43.146.7771: UDP, length 120
01:16:14.917033 IP 192.168.43.146.8880 > 192.168.43.147.7772: UDP, length 120
01:16:14.920535 IP 192.168.43.124.8880 > 192.168.43.146.7771: UDP, length 120
01:16:14.967033 IP 192.168.43.146.8880 > 192.168.43.147.7772: UDP, length 120
01:16:14.980731 IP 192.168.43.124.8880 > 192.168.43.146.7771: UDP, length 120
01:16:15.017018 IP 192.168.43.146.8880 > 192.168.43.147.7772: UDP, length 120
01:16:15.020265 IP 192.168.43.124.8880 > 192.168.43.146.7771: UDP, length 120
01:16:15.067006 IP 192.168.43.146.8880 > 192.168.43.147.7772: UDP, length 120
01:16:15.078583 IP 192.168.43.124.8880 > 192.168.43.146.7771: UDP, length 120
01:16:15.117047 IP 192.168.43.146.8880 > 192.168.43.147.7772: UDP, length 120
01:16:15.120300 IP 192.168.43.124.8880 > 192.168.43.146.7771: UDP, length 120
01:16:15.167013 IP 192.168.43.146.8880 > 192.168.43.147.7772: UDP, length 120
01:16:15.177717 IP 192.168.43.124.8880 > 192.168.43.146.7771: UDP, length 120
01:16:15.217006 IP 192.168.43.146.8880 > 192.168.43.147.7772: UDP, length 120
01:16:15.220257 IP 192.168.43.124.8880 > 192.168.43.146.7771: UDP, length 120
01:16:15.267004 IP 192.168.43.146.8880 > 192.168.43.147.7772: UDP, length 120
01:16:15.278229 IP 192.168.43.124.8880 > 192.168.43.146.7771: UDP, length 120
01:16:15.317008 IP 192.168.43.146.8880 > 192.168.43.147.7772: UDP, length 120
01:16:15.320258 IP 192.168.43.124.8880 > 192.168.43.146.7771: UDP, length 120
01:16:15.367005 IP 192.168.43.146.8880 > 192.168.43.147.7772: UDP, length 120
01:16:15.378181 IP 192.168.43.124.8880 > 192.168.43.146.7771: UDP, length 120
01:16:15.417004 IP 192.168.43.146.8880 > 192.168.43.147.7772: UDP, length 120
01:16:15.420247 IP 192.168.43.124.8880 > 192.168.43.146.7771: UDP, length 120
01:16:15.467005 IP 192.168.43.146.8880 > 192.168.43.147.7772: UDP, length 120
01:16:15.480315 IP 192.168.43.124.8880 > 192.168.43.146.7771: UDP, length 120
01:16:15.517005 IP 192.168.43.146.8880 > 192.168.43.147.7772: UDP, length 120
01:16:15.520251 IP 192.168.43.124.8880 > 192.168.43.146.7771: UDP, length 120
01:16:15.567054 IP 192.168.43.146.8880 > 192.168.43.147.7772: UDP, length 120
01:16:15.579267 IP 192.168.43.124.8880 > 192.168.43.146.7771: UDP, length 120
01:16:15.617007 IP 192.168.43.146.8880 > 192.168.43.147.7772: UDP, length 120
01:16:15.620260 IP 192.168.43.124.8880 > 192.168.43.146.7771: UDP, length 120
01:16:15.667005 IP 192.168.43.146.8880 > 192.168.43.147.7772: UDP, length 120
01:16:15.670249 IP 192.168.43.124.8880 > 192.168.43.146.7771: UDP, length 120
01:16:15.717005 IP 192.168.43.146.8880 > 192.168.43.147.7772: UDP, length 120
01:16:15.726809 IP 192.168.43.124.8880 > 192.168.43.146.7771: UDP, length 120
01:16:15.767003 IP 192.168.43.146.8880 > 192.168.43.147.7772: UDP, length 120
01:16:15.770250 IP 192.168.43.124.8880 > 192.168.43.146.7771: UDP, length 120
01:16:15.817005 IP 192.168.43.146.8880 > 192.168.43.147.7772: UDP, length 120
01:16:15.820249 IP 192.168.43.124.8880 > 192.168.43.146.7771: UDP, length 120
01:16:15.867003 IP 192.168.43.146.8880 > 192.168.43.147.7772: UDP, length 120
01:16:15.878368 IP 192.168.43.124.8880 > 192.168.43.146.7771: UDP, length 120
01:16:15.917012 IP 192.168.43.146.8880 > 192.168.43.147.7772: UDP, length 120
01:16:15.920272 IP 192.168.43.124.8880 > 192.168.43.146.7771: UDP, length 120
01:16:15.967025 IP 192.168.43.146.8880 > 192.168.43.147.7772: UDP, length 120
01:16:15.978641 IP 192.168.43.124.8880 > 192.168.43.146.7771: UDP, length 120
01:16:16.017010 IP 192.168.43.146.8880 > 192.168.43.147.7772: UDP, length 120
01:16:16.020258 IP 192.168.43.124.8880 > 192.168.43.146.7771: UDP, length 120
01:16:16.067004 IP 192.168.43.146.8880 > 192.168.43.147.7772: UDP, length 120
01:16:16.081133 IP 192.168.43.124.8880 > 192.168.43.146.7771: UDP, length 120
01:16:16.117050 IP 192.168.43.146.8880 > 192.168.43.147.7772: UDP, length 120
01:16:16.120317 IP 192.168.43.124.8880 > 192.168.43.146.7771: UDP, length 120
01:16:16.167010 IP 192.168.43.146.8880 > 192.168.43.147.7772: UDP, length 120
01:16:16.170255 IP 192.168.43.124.8880 > 192.168.43.146.7771: UDP, length 120
01:16:16.217051 IP 192.168.43.146.8880 > 192.168.43.147.7772: UDP, length 120
01:16:16.228195 IP 192.168.43.124.8880 > 192.168.43.146.7771: UDP, length 120
01:16:16.267009 IP 192.168.43.146.8880 > 192.168.43.147.7772: UDP, length 120
01:16:16.270244 IP 192.168.43.124.8880 > 192.168.43.146.7771: UDP, length 120
01:16:16.317006 IP 192.168.43.146.8880 > 192.168.43.147.7772: UDP, length 120
01:16:16.328907 IP 192.168.43.124.8880 > 192.168.43.146.7771: UDP, length 120
01:16:16.367004 IP 192.168.43.146.8880 > 192.168.43.147.7772: UDP, length 120
01:16:16.370251 IP 192.168.43.124.8880 > 192.168.43.146.7771: UDP, length 120
01:16:16.417008 IP 192.168.43.146.8880 > 192.168.43.147.7772: UDP, length 120
01:16:16.420251 IP 192.168.43.124.8880 > 192.168.43.146.7771: UDP, length 120
01:16:16.467004 IP 192.168.43.146.8880 > 192.168.43.147.7772: UDP, length 120
01:16:16.478273 IP 192.168.43.124.8880 > 192.168.43.146.7771: UDP, length 120
01:16:16.517004 IP 192.168.43.146.8880 > 192.168.43.147.7772: UDP, length 120
01:16:16.520247 IP 192.168.43.124.8880 > 192.168.43.146.7771: UDP, length 120
01:16:16.567004 IP 192.168.43.146.8880 > 192.168.43.147.7772: UDP, length 120
01:16:16.570245 IP 192.168.43.124.8880 > 192.168.43.146.7771: UDP, length 120
01:16:16.617004 IP 192.168.43.146.8880 > 192.168.43.147.7772: UDP, length 120
01:16:16.628855 IP 192.168.43.124.8880 > 192.168.43.146.7771: UDP, length 120
01:16:16.667005 IP 192.168.43.146.8880 > 192.168.43.147.7772: UDP, length 120
01:16:16.670243 IP 192.168.43.124.8880 > 192.168.43.146.7771: UDP, length 120
01:16:16.717005 IP 192.168.43.146.8880 > 192.168.43.147.7772: UDP, length 120
01:16:16.727508 IP 192.168.43.124.8880 > 192.168.43.146.7771: UDP, length 120
01:16:16.767007 IP 192.168.43.146.8880 > 192.168.43.147.7772: UDP, length 120
01:16:16.770243 IP 192.168.43.124.8880 > 192.168.43.146.7771: UDP, length 120
01:16:16.817004 IP 192.168.43.146.8880 > 192.168.43.147.7772: UDP, length 120
01:16:16.828101 IP 192.168.43.124.8880 > 192.168.43.146.7771: UDP, length 120
01:16:16.867002 IP 192.168.43.146.8880 > 192.168.43.147.7772: UDP, length 120
01:16:16.903094 IP 192.168.43.124.8880 > 192.168.43.146.7771: UDP, length 120
01:16:16.917005 IP 192.168.43.146.8880 > 192.168.43.147.7772: UDP, length 120
01:16:16.918042 IP 192.168.43.124.8880 > 192.168.43.146.7771: UDP, length 120
01:16:16.967016 IP 192.168.43.146.8880 > 192.168.43.147.7772: UDP, length 120
01:16:16.985084 IP 192.168.43.124.8880 > 192.168.43.146.7771: UDP, length 120
01:16:17.017019 IP 192.168.43.146.8880 > 192.168.43.147.7772: UDP, length 120
01:16:17.020257 IP 192.168.43.124.8880 > 192.168.43.146.7771: UDP, length 120
01:16:17.067006 IP 192.168.43.146.8880 > 192.168.43.147.7772: UDP, length 120
01:16:17.086765 IP 192.168.43.124.8880 > 192.168.43.146.7771: UDP, length 120
01:16:17.117053 IP 192.168.43.146.8880 > 192.168.43.147.7772: UDP, length 120
01:16:17.120332 IP 192.168.43.124.8880 > 192.168.43.146.7771: UDP, length 120
01:16:17.167010 IP 192.168.43.146.8880 > 192.168.43.147.7772: UDP, length 120
01:16:17.180808 IP 192.168.43.124.8880 > 192.168.43.146.7771: UDP, length 120
01:16:17.217004 IP 192.168.43.146.8880 > 192.168.43.147.7772: UDP, length 120
01:16:17.220265 IP 192.168.43.124.8880 > 192.168.43.146.7771: UDP, length 120
01:16:17.267004 IP 192.168.43.146.8880 > 192.168.43.147.7772: UDP, length 120
01:16:17.278686 IP 192.168.43.124.8880 > 192.168.43.146.7771: UDP, length 120
01:16:17.317006 IP 192.168.43.146.8880 > 192.168.43.147.7772: UDP, length 120
01:16:17.320267 IP 192.168.43.124.8880 > 192.168.43.146.7771: UDP, length 120
01:16:17.367004 IP 192.168.43.146.8880 > 192.168.43.147.7772: UDP, length 120
01:16:17.370262 IP 192.168.43.124.8880 > 192.168.43.146.7771: UDP, length 120
01:16:17.417006 IP 192.168.43.146.8880 > 192.168.43.147.7772: UDP, length 120
01:16:17.428092 IP 192.168.43.124.8880 > 192.168.43.146.7771: UDP, length 120
01:16:17.467004 IP 192.168.43.146.8880 > 192.168.43.147.7772: UDP, length 120
01:16:17.470262 IP 192.168.43.124.8880 > 192.168.43.146.7771: UDP, length 120
01:16:17.517003 IP 192.168.43.146.8880 > 192.168.43.147.7772: UDP, length 120
01:16:17.528289 IP 192.168.43.124.8880 > 192.168.43.146.7771: UDP, length 120
01:16:17.567005 IP 192.168.43.146.8880 > 192.168.43.147.7772: UDP, length 120
01:16:17.570268 IP 192.168.43.124.8880 > 192.168.43.146.7771: UDP, length 120
01:16:17.617031 IP 192.168.43.146.8880 > 192.168.43.147.7772: UDP, length 120
01:16:17.620649 IP 192.168.43.124.8880 > 192.168.43.146.7771: UDP, length 120
01:16:17.667029 IP 192.168.43.146.8880 > 192.168.43.147.7772: UDP, length 120
01:16:17.670464 IP 192.168.43.124.8880 > 192.168.43.146.7771: UDP, length 120
01:16:17.717096 IP 192.168.43.146.8880 > 192.168.43.147.7772: UDP, length 120
01:16:17.740293 IP 192.168.43.124.8880 > 192.168.43.146.7771: UDP, length 120
01:16:17.767038 IP 192.168.43.146.8880 > 192.168.43.147.7772: UDP, length 120
01:16:17.770431 IP 192.168.43.124.8880 > 192.168.43.146.7771: UDP, length 120
01:16:17.817030 IP 192.168.43.146.8880 > 192.168.43.147.7772: UDP, length 120
01:16:17.829235 IP 192.168.43.124.8880 > 192.168.43.146.7771: UDP, length 120
01:16:17.867030 IP 192.168.43.146.8880 > 192.168.43.147.7772: UDP, length 120
01:16:17.870160 IP 192.168.43.124.8880 > 192.168.43.146.7771: UDP, length 120
01:16:17.917030 IP 192.168.43.146.8880 > 192.168.43.147.7772: UDP, length 120
01:16:17.920436 IP 192.168.43.124.8880 > 192.168.43.146.7771: UDP, length 120
01:16:17.967046 IP 192.168.43.146.8880 > 192.168.43.147.7772: UDP, length 120
01:16:17.997606 IP 192.168.43.124.8880 > 192.168.43.146.7771: UDP, length 120
01:16:18.017038 IP 192.168.43.146.8880 > 192.168.43.147.7772: UDP, length 120
01:16:18.020433 IP 192.168.43.124.8880 > 192.168.43.146.7771: UDP, length 120
01:16:18.067036 IP 192.168.43.146.8880 > 192.168.43.147.7772: UDP, length 120
01:16:18.081498 IP 192.168.43.124.8880 > 192.168.43.146.7771: UDP, length 120
01:16:18.117039 IP 192.168.43.146.8880 > 192.168.43.147.7772: UDP, length 120
01:16:18.120431 IP 192.168.43.124.8880 > 192.168.43.146.7771: UDP, length 120
01:16:18.167030 IP 192.168.43.146.8880 > 192.168.43.147.7772: UDP, length 120
01:16:18.185068 IP 192.168.43.124.8880 > 192.168.43.146.7771: UDP, length 120
01:16:18.217036 IP 192.168.43.146.8880 > 192.168.43.147.7772: UDP, length 120
01:16:18.220440 IP 192.168.43.124.8880 > 192.168.43.146.7771: UDP, length 120
01:16:18.267030 IP 192.168.43.146.8880 > 192.168.43.147.7772: UDP, length 120
01:16:18.281426 IP 192.168.43.124.8880 > 192.168.43.146.7771: UDP, length 120
01:16:18.317037 IP 192.168.43.146.8880 > 192.168.43.147.7772: UDP, length 120
01:16:18.320449 IP 192.168.43.124.8880 > 192.168.43.146.7771: UDP, length 120
01:16:18.367031 IP 192.168.43.146.8880 > 192.168.43.147.7772: UDP, length 120
01:16:18.380958 IP 192.168.43.124.8880 > 192.168.43.146.7771: UDP, length 120
01:16:18.417035 IP 192.168.43.146.8880 > 192.168.43.147.7772: UDP, length 120
01:16:18.420436 IP 192.168.43.124.8880 > 192.168.43.146.7771: UDP, length 120
01:16:18.467054 IP 192.168.43.146.8880 > 192.168.43.147.7772: UDP, length 120
01:16:18.480756 IP 192.168.43.124.8880 > 192.168.43.146.7771: UDP, length 120
01:16:18.517042 IP 192.168.43.146.8880 > 192.168.43.147.7772: UDP, length 120
01:16:18.520441 IP 192.168.43.124.8880 > 192.168.43.146.7771: UDP, length 120
01:16:18.567035 IP 192.168.43.146.8880 > 192.168.43.147.7772: UDP, length 120
01:16:18.580557 IP 192.168.43.124.8880 > 192.168.43.146.7771: UDP, length 120
01:16:18.617035 IP 192.168.43.146.8880 > 192.168.43.147.7772: UDP, length 120
01:16:18.620442 IP 192.168.43.124.8880 > 192.168.43.146.7771: UDP, length 120
01:16:18.667031 IP 192.168.43.146.8880 > 192.168.43.147.7772: UDP, length 120
01:16:18.670425 IP 192.168.43.124.8880 > 192.168.43.146.7771: UDP, length 120
01:16:18.717032 IP 192.168.43.146.8880 > 192.168.43.147.7772: UDP, length 120
01:16:18.720446 IP 192.168.43.124.8880 > 192.168.43.146.7771: UDP, length 120
01:16:18.767112 IP 192.168.43.146.8880 > 192.168.43.147.7772: UDP, length 120
01:16:18.796588 IP 192.168.43.124.8880 > 192.168.43.146.7771: UDP, length 120
01:16:18.817185 IP 192.168.43.146.8880 > 192.168.43.147.7772: UDP, length 120
01:16:18.821949 IP 192.168.43.124.8880 > 192.168.43.146.7771: UDP, length 120
01:16:18.867127 IP 192.168.43.146.8880 > 192.168.43.147.7772: UDP, length 120
01:16:18.881289 IP 192.168.43.124.8880 > 192.168.43.146.7771: UDP, length 120
01:16:18.917124 IP 192.168.43.146.8880 > 192.168.43.147.7772: UDP, length 120
01:16:18.920609 IP 192.168.43.124.8880 > 192.168.43.146.7771: UDP, length 120
01:16:18.967104 IP 192.168.43.146.8880 > 192.168.43.147.7772: UDP, length 120
01:16:18.978948 IP 192.168.43.124.8880 > 192.168.43.146.7771: UDP, length 120
01:16:19.017092 IP 192.168.43.146.8880 > 192.168.43.147.7772: UDP, length 120
01:16:19.024925 IP 192.168.43.124.8880 > 192.168.43.146.7771: UDP, length 120
01:16:19.067079 IP 192.168.43.146.8880 > 192.168.43.147.7772: UDP, length 120
01:16:19.080751 IP 192.168.43.124.8880 > 192.168.43.146.7771: UDP, length 120
01:16:19.117084 IP 192.168.43.146.8880 > 192.168.43.147.7772: UDP, length 120
01:16:19.121991 IP 192.168.43.124.8880 > 192.168.43.146.7771: UDP, length 120
01:16:19.171533 IP 192.168.43.124.8880 > 192.168.43.146.7771: UDP, length 120
01:16:19.171819 IP 192.168.43.146.8880 > 192.168.43.147.7772: UDP, length 120
01:16:19.217081 IP 192.168.43.146.8880 > 192.168.43.147.7772: UDP, length 120
01:16:19.241788 IP 192.168.43.124.8880 > 192.168.43.146.7771: UDP, length 120
01:16:19.267066 IP 192.168.43.146.8880 > 192.168.43.147.7772: UDP, length 120
01:16:19.271161 IP 192.168.43.124.8880 > 192.168.43.146.7771: UDP, length 120
01:16:19.317051 IP 192.168.43.146.8880 > 192.168.43.147.7772: UDP, length 120
01:16:19.320328 IP 192.168.43.124.8880 > 192.168.43.146.7771: UDP, length 120
01:16:19.367020 IP 192.168.43.146.8880 > 192.168.43.147.7772: UDP, length 120
01:16:19.397872 IP 192.168.43.124.8880 > 192.168.43.146.7771: UDP, length 120
01:16:19.417010 IP 192.168.43.146.8880 > 192.168.43.147.7772: UDP, length 120
01:16:19.420251 IP 192.168.43.124.8880 > 192.168.43.146.7771: UDP, length 120
01:16:19.467004 IP 192.168.43.146.8880 > 192.168.43.147.7772: UDP, length 120
01:16:19.481118 IP 192.168.43.124.8880 > 192.168.43.146.7771: UDP, length 120
01:16:19.517004 IP 192.168.43.146.8880 > 192.168.43.147.7772: UDP, length 120
01:16:19.520244 IP 192.168.43.124.8880 > 192.168.43.146.7771: UDP, length 120
01:16:19.567006 IP 192.168.43.146.8880 > 192.168.43.147.7772: UDP, length 120
01:16:19.580633 IP 192.168.43.124.8880 > 192.168.43.146.7771: UDP, length 120
01:16:19.617005 IP 192.168.43.146.8880 > 192.168.43.147.7772: UDP, length 120
01:16:19.659726 IP 192.168.43.124.8880 > 192.168.43.146.7771: UDP, length 120
01:16:19.667004 IP 192.168.43.146.8880 > 192.168.43.147.7772: UDP, length 120
01:16:19.668334 IP 192.168.43.124.8880 > 192.168.43.146.7771: UDP, length 120
01:16:19.717004 IP 192.168.43.146.8880 > 192.168.43.147.7772: UDP, length 120
01:16:19.740922 IP 192.168.43.124.8880 > 192.168.43.146.7771: UDP, length 120
01:16:19.767003 IP 192.168.43.146.8880 > 192.168.43.147.7772: UDP, length 120
01:16:19.770252 IP 192.168.43.124.8880 > 192.168.43.146.7771: UDP, length 120
01:16:19.817004 IP 192.168.43.146.8880 > 192.168.43.147.7772: UDP, length 120
01:16:19.831594 IP 192.168.43.124.8880 > 192.168.43.146.7771: UDP, length 120
01:16:19.867003 IP 192.168.43.146.8880 > 192.168.43.147.7772: UDP, length 120
01:16:19.870507 IP 192.168.43.124.8880 > 192.168.43.146.7771: UDP, length 120
01:16:19.917009 IP 192.168.43.146.8880 > 192.168.43.147.7772: UDP, length 120
01:16:19.918217 IP 192.168.43.124.8880 > 192.168.43.146.7771: UDP, length 120
01:16:19.967014 IP 192.168.43.146.8880 > 192.168.43.147.7772: UDP, length 120
01:16:19.990451 IP 192.168.43.124.8880 > 192.168.43.146.7771: UDP, length 120
01:16:20.017009 IP 192.168.43.146.8880 > 192.168.43.147.7772: UDP, length 120
01:16:20.020249 IP 192.168.43.124.8880 > 192.168.43.146.7771: UDP, length 120
01:16:20.067005 IP 192.168.43.146.8880 > 192.168.43.147.7772: UDP, length 120
01:16:20.080455 IP 192.168.43.124.8880 > 192.168.43.146.7771: UDP, length 120
01:16:20.117004 IP 192.168.43.146.8880 > 192.168.43.147.7772: UDP, length 120
01:16:20.120245 IP 192.168.43.124.8880 > 192.168.43.146.7771: UDP, length 120
01:16:20.167008 IP 192.168.43.146.8880 > 192.168.43.147.7772: UDP, length 120
01:16:20.180786 IP 192.168.43.124.8880 > 192.168.43.146.7771: UDP, length 120
01:16:20.217075 IP 192.168.43.146.8880 > 192.168.43.147.7772: UDP, length 120
01:16:20.220416 IP 192.168.43.124.8880 > 192.168.43.146.7771: UDP, length 120
01:16:20.267063 IP 192.168.43.146.8880 > 192.168.43.147.7772: UDP, length 120
01:16:20.286342 IP 192.168.43.124.8880 > 192.168.43.146.7771: UDP, length 120
01:16:20.317017 IP 192.168.43.146.8880 > 192.168.43.147.7772: UDP, length 120
01:16:20.320601 IP 192.168.43.124.8880 > 192.168.43.146.7771: UDP, length 120
01:16:20.367007 IP 192.168.43.146.8880 > 192.168.43.147.7772: UDP, length 120
01:16:20.381688 IP 192.168.43.124.8880 > 192.168.43.146.7771: UDP, length 120
01:16:20.417003 IP 192.168.43.146.8880 > 192.168.43.147.7772: UDP, length 120
01:16:20.420244 IP 192.168.43.124.8880 > 192.168.43.146.7771: UDP, length 120
01:16:20.467002 IP 192.168.43.146.8880 > 192.168.43.147.7772: UDP, length 120
01:16:20.480390 IP 192.168.43.124.8880 > 192.168.43.146.7771: UDP, length 120
01:16:20.517003 IP 192.168.43.146.8880 > 192.168.43.147.7772: UDP, length 120
01:16:20.520241 IP 192.168.43.124.8880 > 192.168.43.146.7771: UDP, length 120
01:16:20.567005 IP 192.168.43.146.8880 > 192.168.43.147.7772: UDP, length 120
01:16:20.581045 IP 192.168.43.124.8880 > 192.168.43.146.7771: UDP, length 120
01:16:20.617005 IP 192.168.43.146.8880 > 192.168.43.147.7772: UDP, length 120
01:16:20.618404 IP 192.168.43.124.8880 > 192.168.43.146.7771: UDP, length 120
01:16:20.667002 IP 192.168.43.146.8880 > 192.168.43.147.7772: UDP, length 120
01:16:20.680278 IP 192.168.43.124.8880 > 192.168.43.146.7771: UDP, length 120
01:16:20.717051 IP 192.168.43.146.8880 > 192.168.43.147.7772: UDP, length 120
01:16:20.720325 IP 192.168.43.124.8880 > 192.168.43.146.7771: UDP, length 120
01:16:20.767009 IP 192.168.43.146.8880 > 192.168.43.147.7772: UDP, length 120
01:16:20.780197 IP 192.168.43.124.8880 > 192.168.43.146.7771: UDP, length 120
01:16:20.817004 IP 192.168.43.146.8880 > 192.168.43.147.7772: UDP, length 120
01:16:20.820244 IP 192.168.43.124.8880 > 192.168.43.146.7771: UDP, length 120
01:16:20.867003 IP 192.168.43.146.8880 > 192.168.43.147.7772: UDP, length 120
01:16:20.880554 IP 192.168.43.124.8880 > 192.168.43.146.7771: UDP, length 120
01:16:20.917004 IP 192.168.43.146.8880 > 192.168.43.147.7772: UDP, length 120
01:16:20.920242 IP 192.168.43.124.8880 > 192.168.43.146.7771: UDP, length 120
01:16:20.967012 IP 192.168.43.146.8880 > 192.168.43.147.7772: UDP, length 120
01:16:20.981049 IP 192.168.43.124.8880 > 192.168.43.146.7771: UDP, length 120
01:16:21.017009 IP 192.168.43.146.8880 > 192.168.43.147.7772: UDP, length 120
01:16:21.020250 IP 192.168.43.124.8880 > 192.168.43.146.7771: UDP, length 120
01:16:21.067004 IP 192.168.43.146.8880 > 192.168.43.147.7772: UDP, length 120
01:16:21.080462 IP 192.168.43.124.8880 > 192.168.43.146.7771: UDP, length 120
01:16:21.117004 IP 192.168.43.146.8880 > 192.168.43.147.7772: UDP, length 120
01:16:21.120247 IP 192.168.43.124.8880 > 192.168.43.146.7771: UDP, length 120
01:16:21.167003 IP 192.168.43.146.8880 > 192.168.43.147.7772: UDP, length 120
01:16:21.181275 IP 192.168.43.124.8880 > 192.168.43.146.7771: UDP, length 120
01:16:21.217009 IP 192.168.43.146.8880 > 192.168.43.147.7772: UDP, length 120
01:16:21.219705 IP 192.168.43.124.8880 > 192.168.43.146.7771: UDP, length 120
01:16:21.267053 IP 192.168.43.146.8880 > 192.168.43.147.7772: UDP, length 120
01:16:21.281422 IP 192.168.43.124.8880 > 192.168.43.146.7771: UDP, length 120
01:16:21.317025 IP 192.168.43.146.8880 > 192.168.43.147.7772: UDP, length 120
01:16:21.320262 IP 192.168.43.124.8880 > 192.168.43.146.7771: UDP, length 120
01:16:21.367006 IP 192.168.43.146.8880 > 192.168.43.147.7772: UDP, length 120
01:16:21.398843 IP 192.168.43.124.8880 > 192.168.43.146.7771: UDP, length 120
01:16:21.417006 IP 192.168.43.146.8880 > 192.168.43.147.7772: UDP, length 120
01:16:21.420241 IP 192.168.43.124.8880 > 192.168.43.146.7771: UDP, length 120
01:16:21.467004 IP 192.168.43.146.8880 > 192.168.43.147.7772: UDP, length 120
01:16:21.481553 IP 192.168.43.124.8880 > 192.168.43.146.7771: UDP, length 120
01:16:21.517003 IP 192.168.43.146.8880 > 192.168.43.147.7772: UDP, length 120
01:16:21.520249 IP 192.168.43.124.8880 > 192.168.43.146.7771: UDP, length 120
01:16:21.567004 IP 192.168.43.146.8880 > 192.168.43.147.7772: UDP, length 120
01:16:21.581093 IP 192.168.43.124.8880 > 192.168.43.146.7771: UDP, length 120
01:16:21.617005 IP 192.168.43.146.8880 > 192.168.43.147.7772: UDP, length 120
01:16:21.620247 IP 192.168.43.124.8880 > 192.168.43.146.7771: UDP, length 120
01:16:21.667004 IP 192.168.43.146.8880 > 192.168.43.147.7772: UDP, length 120
01:16:21.670238 IP 192.168.43.124.8880 > 192.168.43.146.7771: UDP, length 120
01:16:21.717002 IP 192.168.43.146.8880 > 192.168.43.147.7772: UDP, length 120
01:16:21.740343 IP 192.168.43.124.8880 > 192.168.43.146.7771: UDP, length 120
01:16:21.767005 IP 192.168.43.146.8880 > 192.168.43.147.7772: UDP, length 120
01:16:21.770247 IP 192.168.43.124.8880 > 192.168.43.146.7771: UDP, length 120
01:16:21.817004 IP 192.168.43.146.8880 > 192.168.43.147.7772: UDP, length 120
01:16:21.830920 IP 192.168.43.124.8880 > 192.168.43.146.7771: UDP, length 120
01:16:21.867004 IP 192.168.43.146.8880 > 192.168.43.147.7772: UDP, length 120
01:16:21.870251 IP 192.168.43.124.8880 > 192.168.43.146.7771: UDP, length 120
01:16:21.917003 IP 192.168.43.146.8880 > 192.168.43.147.7772: UDP, length 120
01:16:21.931487 IP 192.168.43.124.8880 > 192.168.43.146.7771: UDP, length 120
01:16:21.967013 IP 192.168.43.146.8880 > 192.168.43.147.7772: UDP, length 120
01:16:21.970261 IP 192.168.43.124.8880 > 192.168.43.146.7771: UDP, length 120
01:16:22.017006 IP 192.168.43.146.8880 > 192.168.43.147.7772: UDP, length 120
01:16:22.036926 IP 192.168.43.124.8880 > 192.168.43.146.7771: UDP, length 120
01:16:22.067005 IP 192.168.43.146.8880 > 192.168.43.147.7772: UDP, length 120
01:16:22.070241 IP 192.168.43.124.8880 > 192.168.43.146.7771: UDP, length 120
01:16:22.117004 IP 192.168.43.146.8880 > 192.168.43.147.7772: UDP, length 120
01:16:22.129837 IP 192.168.43.124.8880 > 192.168.43.146.7771: UDP, length 120
01:16:22.167003 IP 192.168.43.146.8880 > 192.168.43.147.7772: UDP, length 120
01:16:22.170241 IP 192.168.43.124.8880 > 192.168.43.146.7771: UDP, length 120
01:16:22.217050 IP 192.168.43.146.8880 > 192.168.43.147.7772: UDP, length 120
01:16:22.220346 IP 192.168.43.124.8880 > 192.168.43.146.7771: UDP, length 120
01:16:22.267060 IP 192.168.43.146.8880 > 192.168.43.147.7772: UDP, length 120
01:16:22.291774 IP 192.168.43.124.8880 > 192.168.43.146.7771: UDP, length 120
01:16:22.317028 IP 192.168.43.146.8880 > 192.168.43.147.7772: UDP, length 120
01:16:22.320278 IP 192.168.43.124.8880 > 192.168.43.146.7771: UDP, length 120
01:16:22.367009 IP 192.168.43.146.8880 > 192.168.43.147.7772: UDP, length 120
01:16:22.381198 IP 192.168.43.124.8880 > 192.168.43.146.7771: UDP, length 120
01:16:22.417005 IP 192.168.43.146.8880 > 192.168.43.147.7772: UDP, length 120
01:16:22.420243 IP 192.168.43.124.8880 > 192.168.43.146.7771: UDP, length 120
01:16:22.467003 IP 192.168.43.146.8880 > 192.168.43.147.7772: UDP, length 120
01:16:22.485194 IP 192.168.43.124.8880 > 192.168.43.146.7771: UDP, length 120
01:16:22.517005 IP 192.168.43.146.8880 > 192.168.43.147.7772: UDP, length 120
01:16:22.520244 IP 192.168.43.124.8880 > 192.168.43.146.7771: UDP, length 120
01:16:22.567005 IP 192.168.43.146.8880 > 192.168.43.147.7772: UDP, length 120
01:16:22.580616 IP 192.168.43.124.8880 > 192.168.43.146.7771: UDP, length 120
01:16:22.617031 IP 192.168.43.146.8880 > 192.168.43.147.7772: UDP, length 120
01:16:22.620484 IP 192.168.43.124.8880 > 192.168.43.146.7771: UDP, length 120
01:16:22.667028 IP 192.168.43.146.8880 > 192.168.43.147.7772: UDP, length 120
01:16:22.680483 IP 192.168.43.124.8880 > 192.168.43.146.7771: UDP, length 120
01:16:22.717030 IP 192.168.43.146.8880 > 192.168.43.147.7772: UDP, length 120
01:16:22.720471 IP 192.168.43.124.8880 > 192.168.43.146.7771: UDP, length 120
01:16:22.767029 IP 192.168.43.146.8880 > 192.168.43.147.7772: UDP, length 120
01:16:22.770471 IP 192.168.43.124.8880 > 192.168.43.146.7771: UDP, length 120
01:16:22.817029 IP 192.168.43.146.8880 > 192.168.43.147.7772: UDP, length 120
01:16:22.843068 IP 192.168.43.124.8880 > 192.168.43.146.7771: UDP, length 120
01:16:22.867029 IP 192.168.43.146.8880 > 192.168.43.147.7772: UDP, length 120
01:16:22.870456 IP 192.168.43.124.8880 > 192.168.43.146.7771: UDP, length 120
01:16:22.917029 IP 192.168.43.146.8880 > 192.168.43.147.7772: UDP, length 120
01:16:22.931493 IP 192.168.43.124.8880 > 192.168.43.146.7771: UDP, length 120
01:16:22.967126 IP 192.168.43.146.8880 > 192.168.43.147.7772: UDP, length 120
01:16:22.970581 IP 192.168.43.124.8880 > 192.168.43.146.7771: UDP, length 120
01:16:23.017045 IP 192.168.43.146.8880 > 192.168.43.147.7772: UDP, length 120
01:16:23.030412 IP 192.168.43.124.8880 > 192.168.43.146.7771: UDP, length 120
01:16:23.067034 IP 192.168.43.146.8880 > 192.168.43.147.7772: UDP, length 120
01:16:23.070462 IP 192.168.43.124.8880 > 192.168.43.146.7771: UDP, length 120
01:16:23.117031 IP 192.168.43.146.8880 > 192.168.43.147.7772: UDP, length 120
01:16:23.120495 IP 192.168.43.124.8880 > 192.168.43.146.7771: UDP, length 120
01:16:23.167031 IP 192.168.43.146.8880 > 192.168.43.147.7772: UDP, length 120
01:16:23.189330 IP 192.168.43.124.8880 > 192.168.43.146.7771: UDP, length 120
01:16:23.217028 IP 192.168.43.146.8880 > 192.168.43.147.7772: UDP, length 120
01:16:23.220433 IP 192.168.43.124.8880 > 192.168.43.146.7771: UDP, length 120
01:16:23.267107 IP 192.168.43.146.8880 > 192.168.43.147.7772: UDP, length 120
01:16:23.276875 IP 192.168.43.124.8880 > 192.168.43.146.7771: UDP, length 120
01:16:23.317078 IP 192.168.43.146.8880 > 192.168.43.147.7772: UDP, length 120
01:16:23.320547 IP 192.168.43.124.8880 > 192.168.43.146.7771: UDP, length 120
01:16:23.367047 IP 192.168.43.146.8880 > 192.168.43.147.7772: UDP, length 120
01:16:23.381551 IP 192.168.43.124.8880 > 192.168.43.146.7771: UDP, length 120
01:16:23.417035 IP 192.168.43.146.8880 > 192.168.43.147.7772: UDP, length 120
01:16:23.420427 IP 192.168.43.124.8880 > 192.168.43.146.7771: UDP, length 120
01:16:23.467030 IP 192.168.43.146.8880 > 192.168.43.147.7772: UDP, length 120
01:16:23.489097 IP 192.168.43.124.8880 > 192.168.43.146.7771: UDP, length 120
01:16:23.517028 IP 192.168.43.146.8880 > 192.168.43.147.7772: UDP, length 120
01:16:23.525495 IP 192.168.43.124.8880 > 192.168.43.146.7771: UDP, length 120
01:16:23.567031 IP 192.168.43.146.8880 > 192.168.43.147.7772: UDP, length 120
01:16:23.570590 IP 192.168.43.124.8880 > 192.168.43.146.7771: UDP, length 120
01:16:23.617048 IP 192.168.43.146.8880 > 192.168.43.147.7772: UDP, length 120
01:16:23.646803 IP 192.168.43.124.8880 > 192.168.43.146.7771: UDP, length 120
01:16:23.667033 IP 192.168.43.146.8880 > 192.168.43.147.7772: UDP, length 120
01:16:23.670422 IP 192.168.43.124.8880 > 192.168.43.146.7771: UDP, length 120
01:16:23.717092 IP 192.168.43.146.8880 > 192.168.43.147.7772: UDP, length 120
01:16:23.720520 IP 192.168.43.124.8880 > 192.168.43.146.7771: UDP, length 120
01:16:23.767037 IP 192.168.43.146.8880 > 192.168.43.147.7772: UDP, length 120
01:16:23.799840 IP 192.168.43.124.8880 > 192.168.43.146.7771: UDP, length 120
01:16:23.817033 IP 192.168.43.146.8880 > 192.168.43.147.7772: UDP, length 120
01:16:23.820422 IP 192.168.43.124.8880 > 192.168.43.146.7771: UDP, length 120
01:16:23.867028 IP 192.168.43.146.8880 > 192.168.43.147.7772: UDP, length 120
01:16:23.880391 IP 192.168.43.124.8880 > 192.168.43.146.7771: UDP, length 120
01:16:23.917034 IP 192.168.43.146.8880 > 192.168.43.147.7772: UDP, length 120
01:16:23.920421 IP 192.168.43.124.8880 > 192.168.43.146.7771: UDP, length 120
01:16:23.967044 IP 192.168.43.146.8880 > 192.168.43.147.7772: UDP, length 120
01:16:23.970449 IP 192.168.43.124.8880 > 192.168.43.146.7771: UDP, length 120
01:16:24.017033 IP 192.168.43.146.8880 > 192.168.43.147.7772: UDP, length 120
01:16:24.040874 IP 192.168.43.124.8880 > 192.168.43.146.7771: UDP, length 120
01:16:24.067029 IP 192.168.43.146.8880 > 192.168.43.147.7772: UDP, length 120
01:16:24.070422 IP 192.168.43.124.8880 > 192.168.43.146.7771: UDP, length 120
01:16:24.117030 IP 192.168.43.146.8880 > 192.168.43.147.7772: UDP, length 120
01:16:24.130750 IP 192.168.43.124.8880 > 192.168.43.146.7771: UDP, length 120
01:16:24.167029 IP 192.168.43.146.8880 > 192.168.43.147.7772: UDP, length 120
01:16:24.170639 IP 192.168.43.124.8880 > 192.168.43.146.7771: UDP, length 120
01:16:24.217029 IP 192.168.43.146.8880 > 192.168.43.147.7772: UDP, length 120
01:16:24.230874 IP 192.168.43.124.8880 > 192.168.43.146.7771: UDP, length 120
01:16:24.267028 IP 192.168.43.146.8880 > 192.168.43.147.7772: UDP, length 120
01:16:24.270462 IP 192.168.43.124.8880 > 192.168.43.146.7771: UDP, length 120
01:16:24.317107 IP 192.168.43.146.8880 > 192.168.43.147.7772: UDP, length 120
01:16:24.330838 IP 192.168.43.124.8880 > 192.168.43.146.7771: UDP, length 120
01:16:24.367119 IP 192.168.43.146.8880 > 192.168.43.147.7772: UDP, length 120
01:16:24.370645 IP 192.168.43.124.8880 > 192.168.43.146.7771: UDP, length 120
01:16:24.417147 IP 192.168.43.146.8880 > 192.168.43.147.7772: UDP, length 120
01:16:24.430231 IP 192.168.43.124.8880 > 192.168.43.146.7771: UDP, length 120
01:16:24.467109 IP 192.168.43.146.8880 > 192.168.43.147.7772: UDP, length 120
01:16:24.470598 IP 192.168.43.124.8880 > 192.168.43.146.7771: UDP, length 120
01:16:24.517101 IP 192.168.43.146.8880 > 192.168.43.147.7772: UDP, length 120
01:16:24.535376 IP 192.168.43.124.8880 > 192.168.43.146.7771: UDP, length 120
01:16:24.567069 IP 192.168.43.146.8880 > 192.168.43.147.7772: UDP, length 120
01:16:24.570473 IP 192.168.43.124.8880 > 192.168.43.146.7771: UDP, length 120
01:16:24.617087 IP 192.168.43.146.8880 > 192.168.43.147.7772: UDP, length 120
01:16:24.635062 IP 192.168.43.124.8880 > 192.168.43.146.7771: UDP, length 120
01:16:24.667096 IP 192.168.43.146.8880 > 192.168.43.147.7772: UDP, length 120
01:16:24.670505 IP 192.168.43.124.8880 > 192.168.43.146.7771: UDP, length 120
01:16:24.717082 IP 192.168.43.146.8880 > 192.168.43.147.7772: UDP, length 120
01:16:24.740916 IP 192.168.43.124.8880 > 192.168.43.146.7771: UDP, length 120
01:16:24.767084 IP 192.168.43.146.8880 > 192.168.43.147.7772: UDP, length 120
01:16:24.768314 IP 192.168.43.124.8880 > 192.168.43.146.7771: UDP, length 120
01:16:24.817049 IP 192.168.43.146.8880 > 192.168.43.147.7772: UDP, length 120
01:16:24.829992 IP 192.168.43.124.8880 > 192.168.43.146.7771: UDP, length 120
01:16:24.867012 IP 192.168.43.146.8880 > 192.168.43.147.7772: UDP, length 120
01:16:24.870255 IP 192.168.43.124.8880 > 192.168.43.146.7771: UDP, length 120
01:16:24.917008 IP 192.168.43.146.8880 > 192.168.43.147.7772: UDP, length 120
01:16:24.930356 IP 192.168.43.124.8880 > 192.168.43.146.7771: UDP, length 120
01:16:24.967009 IP 192.168.43.146.8880 > 192.168.43.147.7772: UDP, length 120
01:16:24.970250 IP 192.168.43.124.8880 > 192.168.43.146.7771: UDP, length 120
01:16:25.017010 IP 192.168.43.146.8880 > 192.168.43.147.7772: UDP, length 120
01:16:25.030895 IP 192.168.43.124.8880 > 192.168.43.146.7771: UDP, length 120
01:16:25.067006 IP 192.168.43.146.8880 > 192.168.43.147.7772: UDP, length 120
01:16:25.070256 IP 192.168.43.124.8880 > 192.168.43.146.7771: UDP, length 120
01:16:25.117005 IP 192.168.43.146.8880 > 192.168.43.147.7772: UDP, length 120
01:16:25.131124 IP 192.168.43.124.8880 > 192.168.43.146.7771: UDP, length 120
01:16:25.167004 IP 192.168.43.146.8880 > 192.168.43.147.7772: UDP, length 120
01:16:25.170245 IP 192.168.43.124.8880 > 192.168.43.146.7771: UDP, length 120
01:16:25.217057 IP 192.168.43.146.8880 > 192.168.43.147.7772: UDP, length 120
01:16:25.229960 IP 192.168.43.124.8880 > 192.168.43.146.7771: UDP, length 120
01:16:25.267014 IP 192.168.43.146.8880 > 192.168.43.147.7772: UDP, length 120
01:16:25.270368 IP 192.168.43.124.8880 > 192.168.43.146.7771: UDP, length 120
01:16:25.317048 IP 192.168.43.146.8880 > 192.168.43.147.7772: UDP, length 120
01:16:25.330229 IP 192.168.43.124.8880 > 192.168.43.146.7771: UDP, length 120
01:16:25.367011 IP 192.168.43.146.8880 > 192.168.43.147.7772: UDP, length 120
01:16:25.370277 IP 192.168.43.124.8880 > 192.168.43.146.7771: UDP, length 120
01:16:25.417006 IP 192.168.43.146.8880 > 192.168.43.147.7772: UDP, length 120
01:16:25.429904 IP 192.168.43.124.8880 > 192.168.43.146.7771: UDP, length 120
01:16:25.467013 IP 192.168.43.146.8880 > 192.168.43.147.7772: UDP, length 120
01:16:25.470282 IP 192.168.43.124.8880 > 192.168.43.146.7771: UDP, length 120
01:16:25.517012 IP 192.168.43.146.8880 > 192.168.43.147.7772: UDP, length 120
01:16:25.538367 IP 192.168.43.124.8880 > 192.168.43.146.7771: UDP, length 120
01:16:25.567007 IP 192.168.43.146.8880 > 192.168.43.147.7772: UDP, length 120
01:16:25.571534 IP 192.168.43.124.8880 > 192.168.43.146.7771: UDP, length 120
01:16:25.617007 IP 192.168.43.146.8880 > 192.168.43.147.7772: UDP, length 120
01:16:25.635840 IP 192.168.43.124.8880 > 192.168.43.146.7771: UDP, length 120
01:16:25.667003 IP 192.168.43.146.8880 > 192.168.43.147.7772: UDP, length 120
01:16:25.670237 IP 192.168.43.124.8880 > 192.168.43.146.7771: UDP, length 120
01:16:25.717003 IP 192.168.43.146.8880 > 192.168.43.147.7772: UDP, length 120
01:16:25.730435 IP 192.168.43.124.8880 > 192.168.43.146.7771: UDP, length 120
01:16:25.767003 IP 192.168.43.146.8880 > 192.168.43.147.7772: UDP, length 120
01:16:25.770247 IP 192.168.43.124.8880 > 192.168.43.146.7771: UDP, length 120
01:16:25.817004 IP 192.168.43.146.8880 > 192.168.43.147.7772: UDP, length 120
01:16:25.830205 IP 192.168.43.124.8880 > 192.168.43.146.7771: UDP, length 120
01:16:25.867004 IP 192.168.43.146.8880 > 192.168.43.147.7772: UDP, length 120
01:16:25.870244 IP 192.168.43.124.8880 > 192.168.43.146.7771: UDP, length 120
01:16:25.917006 IP 192.168.43.146.8880 > 192.168.43.147.7772: UDP, length 120
01:16:25.930256 IP 192.168.43.124.8880 > 192.168.43.146.7771: UDP, length 120
01:16:25.967009 IP 192.168.43.146.8880 > 192.168.43.147.7772: UDP, length 120
01:16:25.970281 IP 192.168.43.124.8880 > 192.168.43.146.7771: UDP, length 120
01:16:26.017006 IP 192.168.43.146.8880 > 192.168.43.147.7772: UDP, length 120
01:16:26.036099 IP 192.168.43.124.8880 > 192.168.43.146.7771: UDP, length 120
01:16:26.067004 IP 192.168.43.146.8880 > 192.168.43.147.7772: UDP, length 120
01:16:26.070245 IP 192.168.43.124.8880 > 192.168.43.146.7771: UDP, length 120
01:16:26.117005 IP 192.168.43.146.8880 > 192.168.43.147.7772: UDP, length 120
01:16:26.130214 IP 192.168.43.124.8880 > 192.168.43.146.7771: UDP, length 120
01:16:26.167003 IP 192.168.43.146.8880 > 192.168.43.147.7772: UDP, length 120
01:16:26.170239 IP 192.168.43.124.8880 > 192.168.43.146.7771: UDP, length 120
01:16:26.217004 IP 192.168.43.146.8880 > 192.168.43.147.7772: UDP, length 120
01:16:26.237508 IP 192.168.43.124.8880 > 192.168.43.146.7771: UDP, length 120
01:16:26.267003 IP 192.168.43.146.8880 > 192.168.43.147.7772: UDP, length 120
01:16:26.270262 IP 192.168.43.124.8880 > 192.168.43.146.7771: UDP, length 120
01:16:26.317004 IP 192.168.43.146.8880 > 192.168.43.147.7772: UDP, length 120
01:16:26.329938 IP 192.168.43.124.8880 > 192.168.43.146.7771: UDP, length 120
01:16:26.367004 IP 192.168.43.146.8880 > 192.168.43.147.7772: UDP, length 120
01:16:26.370239 IP 192.168.43.124.8880 > 192.168.43.146.7771: UDP, length 120
01:16:26.417007 IP 192.168.43.146.8880 > 192.168.43.147.7772: UDP, length 120
01:16:26.420244 IP 192.168.43.124.8880 > 192.168.43.146.7771: UDP, length 120
01:16:26.467001 IP 192.168.43.146.8880 > 192.168.43.147.7772: UDP, length 120
01:16:26.488348 IP 192.168.43.124.8880 > 192.168.43.146.7771: UDP, length 120
01:16:26.517012 IP 192.168.43.146.8880 > 192.168.43.147.7772: UDP, length 120
01:16:26.522039 IP 192.168.43.124.8880 > 192.168.43.146.7771: UDP, length 120
01:16:26.567013 IP 192.168.43.146.8880 > 192.168.43.147.7772: UDP, length 120
01:16:26.580357 IP 192.168.43.124.8880 > 192.168.43.146.7771: UDP, length 120
01:16:26.617005 IP 192.168.43.146.8880 > 192.168.43.147.7772: UDP, length 120
01:16:26.620242 IP 192.168.43.124.8880 > 192.168.43.146.7771: UDP, length 120
01:16:26.667003 IP 192.168.43.146.8880 > 192.168.43.147.7772: UDP, length 120
01:16:26.685115 IP 192.168.43.124.8880 > 192.168.43.146.7771: UDP, length 120
01:16:26.717050 IP 192.168.43.146.8880 > 192.168.43.147.7772: UDP, length 120
01:16:26.720320 IP 192.168.43.124.8880 > 192.168.43.146.7771: UDP, length 120
01:16:26.767012 IP 192.168.43.146.8880 > 192.168.43.147.7772: UDP, length 120
01:16:26.785936 IP 192.168.43.124.8880 > 192.168.43.146.7771: UDP, length 120
01:16:26.817004 IP 192.168.43.146.8880 > 192.168.43.147.7772: UDP, length 120
01:16:26.820277 IP 192.168.43.124.8880 > 192.168.43.146.7771: UDP, length 120
01:16:26.867003 IP 192.168.43.146.8880 > 192.168.43.147.7772: UDP, length 120
01:16:26.880273 IP 192.168.43.124.8880 > 192.168.43.146.7771: UDP, length 120
01:16:26.917003 IP 192.168.43.146.8880 > 192.168.43.147.7772: UDP, length 120
01:16:26.920239 IP 192.168.43.124.8880 > 192.168.43.146.7771: UDP, length 120
01:16:26.967009 IP 192.168.43.146.8880 > 192.168.43.147.7772: UDP, length 120
01:16:26.980127 IP 192.168.43.124.8880 > 192.168.43.146.7771: UDP, length 120
01:16:27.017007 IP 192.168.43.146.8880 > 192.168.43.147.7772: UDP, length 120
01:16:27.020244 IP 192.168.43.124.8880 > 192.168.43.146.7771: UDP, length 120
01:16:27.067005 IP 192.168.43.146.8880 > 192.168.43.147.7772: UDP, length 120
01:16:27.080537 IP 192.168.43.124.8880 > 192.168.43.146.7771: UDP, length 120
01:16:27.117006 IP 192.168.43.146.8880 > 192.168.43.147.7772: UDP, length 120
01:16:27.120241 IP 192.168.43.124.8880 > 192.168.43.146.7771: UDP, length 120
01:16:27.167003 IP 192.168.43.146.8880 > 192.168.43.147.7772: UDP, length 120
01:16:27.184948 IP 192.168.43.124.8880 > 192.168.43.146.7771: UDP, length 120
01:16:27.217003 IP 192.168.43.146.8880 > 192.168.43.147.7772: UDP, length 120
01:16:27.220261 IP 192.168.43.124.8880 > 192.168.43.146.7771: UDP, length 120
01:16:27.267003 IP 192.168.43.146.8880 > 192.168.43.147.7772: UDP, length 120
01:16:27.281507 IP 192.168.43.124.8880 > 192.168.43.146.7771: UDP, length 120
01:16:27.317070 IP 192.168.43.146.8880 > 192.168.43.147.7772: UDP, length 120
01:16:27.320439 IP 192.168.43.124.8880 > 192.168.43.146.7771: UDP, length 120
