21:16:14.312521 IP 192.168.43.124.8880 > 192.168.43.146.7771: UDP, length 120
21:16:14.362665 IP 192.168.43.124.8880 > 192.168.43.146.7771: UDP, length 120
21:16:14.412666 IP 192.168.43.124.8880 > 192.168.43.146.7771: UDP, length 120
21:16:14.462666 IP 192.168.43.124.8880 > 192.168.43.146.7771: UDP, length 120
21:16:14.512666 IP 192.168.43.124.8880 > 192.168.43.146.7771: UDP, length 120
21:16:14.562665 IP 192.168.43.124.8880 > 192.168.43.146.7771: UDP, length 120
21:16:14.612665 IP 192.168.43.124.8880 > 192.168.43.146.7771: UDP, length 120
21:16:14.662666 IP 192.168.43.124.8880 > 192.168.43.146.7771: UDP, length 120
21:16:14.712665 IP 192.168.43.124.8880 > 192.168.43.146.7771: UDP, length 120
21:16:14.762665 IP 192.168.43.124.8880 > 192.168.43.146.7771: UDP, length 120
21:16:14.812665 IP 192.168.43.124.8880 > 192.168.43.146.7771: UDP, length 120
21:16:14.862665 IP 192.168.43.124.8880 > 192.168.43.146.7771: UDP, length 120
21:16:14.912665 IP 192.168.43.124.8880 > 192.168.43.146.7771: UDP, length 120
21:16:14.925226 IP 192.168.43.147.8880 > 192.168.43.124.7773: UDP, length 120
21:16:14.962667 IP 192.168.43.124.8880 > 192.168.43.146.7771: UDP, length 120
21:16:14.970213 IP 192.168.43.147.8880 > 192.168.43.124.7773: UDP, length 120
21:16:15.012667 IP 192.168.43.124.8880 > 192.168.43.146.7771: UDP, length 120
21:16:15.027991 IP 192.168.43.147.8880 > 192.168.43.124.7773: UDP, length 120
21:16:15.062667 IP 192.168.43.124.8880 > 192.168.43.146.7771: UDP, length 120
21:16:15.070104 IP 192.168.43.147.8880 > 192.168.43.124.7773: UDP, length 120
21:16:15.112665 IP 192.168.43.124.8880 > 192.168.43.146.7771: UDP, length 120
21:16:15.125845 IP 192.168.43.147.8880 > 192.168.43.124.7773: UDP, length 120
21:16:15.162666 IP 192.168.43.124.8880 > 192.168.43.146.7771: UDP, length 120
21:16:15.169022 IP 192.168.43.147.8880 > 192.168.43.124.7773: UDP, length 120
21:16:15.212666 IP 192.168.43.124.8880 > 192.168.43.146.7771: UDP, length 120
21:16:15.224750 IP 192.168.43.147.8880 > 192.168.43.124.7773: UDP, length 120
21:16:15.262665 IP 192.168.43.124.8880 > 192.168.43.146.7771: UDP, length 120
21:16:15.271204 IP 192.168.43.147.8880 > 192.168.43.124.7773: UDP, length 120
21:16:15.312665 IP 192.168.43.124.8880 > 192.168.43.146.7771: UDP, length 120
21:16:15.325451 IP 192.168.43.147.8880 > 192.168.43.124.7773: UDP, length 120
21:16:15.362665 IP 192.168.43.124.8880 > 192.168.43.146.7771: UDP, length 120
21:16:15.368780 IP 192.168.43.147.8880 > 192.168.43.124.7773: UDP, length 120
21:16:15.412665 IP 192.168.43.124.8880 > 192.168.43.146.7771: UDP, length 120
21:16:15.425453 IP 192.168.43.147.8880 > 192.168.43.124.7773: UDP, length 120
21:16:15.462665 IP 192.168.43.124.8880 > 192.168.43.146.7771: UDP, length 120
21:16:15.468830 IP 192.168.43.147.8880 > 192.168.43.124.7773: UDP, length 120
21:16:15.512667 IP 192.168.43.124.8880 > 192.168.43.146.7771: UDP, length 120
21:16:15.527413 IP 192.168.43.147.8880 > 192.168.43.124.7773: UDP, length 120
21:16:15.562714 IP 192.168.43.124.8880 > 192.168.43.146.7771: UDP, length 120
21:16:15.571844 IP 192.168.43.147.8880 > 192.168.43.124.7773: UDP, length 120
21:16:15.612717 IP 192.168.43.124.8880 > 192.168.43.146.7771: UDP, length 120
21:16:15.626969 IP 192.168.43.147.8880 > 192.168.43.124.7773: UDP, length 120
21:16:15.662719 IP 192.168.43.124.8880 > 192.168.43.146.7771: UDP, length 120
21:16:15.697473 IP 192.168.43.147.8880 > 192.168.43.124.7773: UDP, length 120
21:16:15.712718 IP 192.168.43.124.8880 > 192.168.43.146.7771: UDP, length 120
21:16:15.724942 IP 192.168.43.147.8880 > 192.168.43.124.7773: UDP, length 120
21:16:15.762758 IP 192.168.43.124.8880 > 192.168.43.146.7771: UDP, length 120
21:16:15.774689 IP 192.168.43.147.8880 > 192.168.43.124.7773: UDP, length 120
21:16:15.812629 IP 192.168.43.124.8880 > 192.168.43.146.7771: UDP, length 120
21:16:15.842017 IP 192.168.43.147.8880 > 192.168.43.124.7773: UDP, length 120
21:16:15.862611 IP 192.168.43.124.8880 > 192.168.43.146.7771: UDP, length 120
21:16:15.868477 IP 192.168.43.147.8880 > 192.168.43.124.7773: UDP, length 120
21:16:15.912664 IP 192.168.43.124.8880 > 192.168.43.146.7771: UDP, length 120
21:16:15.925694 IP 192.168.43.147.8880 > 192.168.43.124.7773: UDP, length 120
21:16:15.962666 IP 192.168.43.124.8880 > 192.168.43.146.7771: UDP, length 120
21:16:15.968331 IP 192.168.43.147.8880 > 192.168.43.124.7773: UDP, length 120
21:16:16.012667 IP 192.168.43.124.8880 > 192.168.43.146.7771: UDP, length 120
21:16:16.025871 IP 192.168.43.147.8880 > 192.168.43.124.7773: UDP, length 120
21:16:16.062665 IP 192.168.43.124.8880 > 192.168.43.146.7771: UDP, length 120
21:16:16.069509 IP 192.168.43.147.8880 > 192.168.43.124.7773: UDP, length 120
21:16:16.112667 IP 192.168.43.124.8880 > 192.168.43.146.7771: UDP, length 120
21:16:16.124253 IP 192.168.43.147.8880 > 192.168.43.124.7773: UDP, length 120
21:16:16.162665 IP 192.168.43.124.8880 > 192.168.43.146.7771: UDP, length 120
21:16:16.171939 IP 192.168.43.147.8880 > 192.168.43.124.7773: UDP, length 120
21:16:16.212665 IP 192.168.43.124.8880 > 192.168.43.146.7771: UDP, length 120
21:16:16.215923 IP 192.168.43.147.8880 > 192.168.43.124.7773: UDP, length 120
21:16:16.262665 IP 192.168.43.124.8880 > 192.168.43.146.7771: UDP, length 120
21:16:16.275289 IP 192.168.43.147.8880 > 192.168.43.124.7773: UDP, length 120
21:16:16.312667 IP 192.168.43.124.8880 > 192.168.43.146.7771: UDP, length 120
21:16:16.318948 IP 192.168.43.147.8880 > 192.168.43.124.7773: UDP, length 120
21:16:16.362666 IP 192.168.43.124.8880 > 192.168.43.146.7771: UDP, length 120
21:16:16.375060 IP 192.168.43.147.8880 > 192.168.43.124.7773: UDP, length 120
21:16:16.412666 IP 192.168.43.124.8880 > 192.168.43.146.7771: UDP, length 120
21:16:16.439814 IP 192.168.43.147.8880 > 192.168.43.124.7773: UDP, length 120
21:16:16.462668 IP 192.168.43.124.8880 > 192.168.43.146.7771: UDP, length 120
21:16:16.469574 IP 192.168.43.147.8880 > 192.168.43.124.7773: UDP, length 120
21:16:16.512665 IP 192.168.43.124.8880 > 192.168.43.146.7771: UDP, length 120
21:16:16.525678 IP 192.168.43.147.8880 > 192.168.43.124.7773: UDP, length 120
21:16:16.562665 IP 192.168.43.124.8880 > 192.168.43.146.7771: UDP, length 120
21:16:16.594685 IP 192.168.43.147.8880 > 192.168.43.124.7773: UDP, length 120
21:16:16.612668 IP 192.168.43.124.8880 > 192.168.43.146.7771: UDP, length 120
21:16:16.615881 IP 192.168.43.147.8880 > 192.168.43.124.7773: UDP, length 120
21:16:16.662667 IP 192.168.43.124.8880 > 192.168.43.146.7771: UDP, length 120
21:16:16.675012 IP 192.168.43.147.8880 > 192.168.43.124.7773: UDP, length 120
21:16:16.712666 IP 192.168.43.124.8880 > 192.168.43.146.7771: UDP, length 120
21:16:16.719254 IP 192.168.43.147.8880 > 192.168.43.124.7773: UDP, length 120
21:16:16.762666 IP 192.168.43.124.8880 > 192.168.43.146.7771: UDP, length 120
21:16:16.774783 IP 192.168.43.147.8880 > 192.168.43.124.7773: UDP, length 120
21:16:16.812596 IP 192.168.43.124.8880 > 192.168.43.146.7771: UDP, length 120
21:16:16.819177 IP 192.168.43.147.8880 > 192.168.43.124.7773: UDP, length 120
21:16:16.862666 IP 192.168.43.124.8880 > 192.168.43.146.7771: UDP, length 120
21:16:16.875525 IP 192.168.43.147.8880 > 192.168.43.124.7773: UDP, length 120
21:16:16.912665 IP 192.168.43.124.8880 > 192.168.43.146.7771: UDP, length 120
21:16:16.921770 IP 192.168.43.147.8880 > 192.168.43.124.7773: UDP, length 120
21:16:16.962666 IP 192.168.43.124.8880 > 192.168.43.146.7771: UDP, length 120
21:16:16.968966 IP 192.168.43.147.8880 > 192.168.43.124.7773: UDP, length 120
21:16:17.012629 IP 192.168.43.124.8880 > 192.168.43.146.7771: UDP, length 120
21:16:17.030023 IP 192.168.43.147.8880 > 192.168.43.124.7773: UDP, length 120
21:16:17.062665 IP 192.168.43.124.8880 > 192.168.43.146.7771: UDP, length 120
21:16:17.069870 IP 192.168.43.147.8880 > 192.168.43.124.7773: UDP, length 120
21:16:17.112667 IP 192.168.43.124.8880 > 192.168.43.146.7771: UDP, length 120
21:16:17.146161 IP 192.168.43.147.8880 > 192.168.43.124.7773: UDP, length 120
21:16:17.162665 IP 192.168.43.124.8880 > 192.168.43.146.7771: UDP, length 120
21:16:17.170460 IP 192.168.43.147.8880 > 192.168.43.124.7773: UDP, length 120
21:16:17.212666 IP 192.168.43.124.8880 > 192.168.43.146.7771: UDP, length 120
21:16:17.262666 IP 192.168.43.124.8880 > 192.168.43.146.7771: UDP, length 120
21:16:17.312668 IP 192.168.43.124.8880 > 192.168.43.146.7771: UDP, length 120
21:16:17.324890 IP 192.168.43.147.8880 > 192.168.43.124.7773: UDP, length 120
21:16:17.324904 IP 192.168.43.147.8880 > 192.168.43.124.7773: UDP, length 120
21:16:17.324906 IP 192.168.43.147.8880 > 192.168.43.124.7773: UDP, length 120
21:16:17.362666 IP 192.168.43.124.8880 > 192.168.43.146.7771: UDP, length 120
21:16:17.395605 IP 192.168.43.147.8880 > 192.168.43.124.7773: UDP, length 120
21:16:17.412666 IP 192.168.43.124.8880 > 192.168.43.146.7771: UDP, length 120
21:16:17.421165 IP 192.168.43.147.8880 > 192.168.43.124.7773: UDP, length 120
21:16:17.462668 IP 192.168.43.124.8880 > 192.168.43.146.7771: UDP, length 120
21:16:17.475408 IP 192.168.43.147.8880 > 192.168.43.124.7773: UDP, length 120
21:16:17.512668 IP 192.168.43.124.8880 > 192.168.43.146.7771: UDP, length 120
21:16:17.520453 IP 192.168.43.147.8880 > 192.168.43.124.7773: UDP, length 120
21:16:17.562620 IP 192.168.43.124.8880 > 192.168.43.146.7771: UDP, length 120
21:16:17.575575 IP 192.168.43.147.8880 > 192.168.43.124.7773: UDP, length 120
21:16:17.612599 IP 192.168.43.124.8880 > 192.168.43.146.7771: UDP, length 120
21:16:17.619328 IP 192.168.43.147.8880 > 192.168.43.124.7773: UDP, length 120
21:16:17.662664 IP 192.168.43.124.8880 > 192.168.43.146.7771: UDP, length 120
21:16:17.669564 IP 192.168.43.147.8880 > 192.168.43.124.7773: UDP, length 120
21:16:17.712629 IP 192.168.43.124.8880 > 192.168.43.146.7771: UDP, length 120
21:16:17.719979 IP 192.168.43.147.8880 > 192.168.43.124.7773: UDP, length 120
21:16:17.762666 IP 192.168.43.124.8880 > 192.168.43.146.7771: UDP, length 120
21:16:17.783307 IP 192.168.43.147.8880 > 192.168.43.124.7773: UDP, length 120
21:16:17.812666 IP 192.168.43.124.8880 > 192.168.43.146.7771: UDP, length 120
21:16:17.821197 IP 192.168.43.147.8880 > 192.168.43.124.7773: UDP, length 120
21:16:17.862666 IP 192.168.43.124.8880 > 192.168.43.146.7771: UDP, length 120
21:16:17.876277 IP 192.168.43.147.8880 > 192.168.43.124.7773: UDP, length 120
21:16:17.912666 IP 192.168.43.124.8880 > 192.168.43.146.7771: UDP, length 120
21:16:17.919211 IP 192.168.43.147.8880 > 192.168.43.124.7773: UDP, length 120
21:16:17.962666 IP 192.168.43.124.8880 > 192.168.43.146.7771: UDP, length 120
21:16:17.965614 IP 192.168.43.147.8880 > 192.168.43.124.7773: UDP, length 120
21:16:18.012668 IP 192.168.43.124.8880 > 192.168.43.146.7771: UDP, length 120
21:16:18.040641 IP 192.168.43.147.8880 > 192.168.43.124.7773: UDP, length 120
21:16:18.062666 IP 192.168.43.124.8880 > 192.168.43.146.7771: UDP, length 120
21:16:18.069445 IP 192.168.43.147.8880 > 192.168.43.124.7773: UDP, length 120
21:16:18.112665 IP 192.168.43.124.8880 > 192.168.43.146.7771: UDP, length 120
21:16:18.127614 IP 192.168.43.147.8880 > 192.168.43.124.7773: UDP, length 120
21:16:18.162665 IP 192.168.43.124.8880 > 192.168.43.146.7771: UDP, length 120
21:16:18.170307 IP 192.168.43.147.8880 > 192.168.43.124.7773: UDP, length 120
21:16:18.212666 IP 192.168.43.124.8880 > 192.168.43.146.7771: UDP, length 120
21:16:18.227562 IP 192.168.43.147.8880 > 192.168.43.124.7773: UDP, length 120
21:16:18.262665 IP 192.168.43.124.8880 > 192.168.43.146.7771: UDP, length 120
21:16:18.271258 IP 192.168.43.147.8880 > 192.168.43.124.7773: UDP, length 120
21:16:18.312666 IP 192.168.43.124.8880 > 192.168.43.146.7771: UDP, length 120
21:16:18.327514 IP 192.168.43.147.8880 > 192.168.43.124.7773: UDP, length 120
21:16:18.362665 IP 192.168.43.124.8880 > 192.168.43.146.7771: UDP, length 120
21:16:18.370840 IP 192.168.43.147.8880 > 192.168.43.124.7773: UDP, length 120
21:16:18.412667 IP 192.168.43.124.8880 > 192.168.43.146.7771: UDP, length 120
21:16:18.427096 IP 192.168.43.147.8880 > 192.168.43.124.7773: UDP, length 120
21:16:18.462666 IP 192.168.43.124.8880 > 192.168.43.146.7771: UDP, length 120
21:16:18.466376 IP 192.168.43.147.8880 > 192.168.43.124.7773: UDP, length 120
21:16:18.512666 IP 192.168.43.124.8880 > 192.168.43.146.7771: UDP, length 120
21:16:18.527728 IP 192.168.43.147.8880 > 192.168.43.124.7773: UDP, length 120
21:16:18.562665 IP 192.168.43.124.8880 > 192.168.43.146.7771: UDP, length 120
21:16:18.568202 IP 192.168.43.147.8880 > 192.168.43.124.7773: UDP, length 120
21:16:18.612666 IP 192.168.43.124.8880 > 192.168.43.146.7771: UDP, length 120
21:16:18.627733 IP 192.168.43.147.8880 > 192.168.43.124.7773: UDP, length 120
21:16:18.662665 IP 192.168.43.124.8880 > 192.168.43.146.7771: UDP, length 120
21:16:18.666134 IP 192.168.43.147.8880 > 192.168.43.124.7773: UDP, length 120
21:16:18.712679 IP 192.168.43.124.8880 > 192.168.43.146.7771: UDP, length 120
21:16:18.717772 IP 192.168.43.147.8880 > 192.168.43.124.7773: UDP, length 120
21:16:18.762716 IP 192.168.43.124.8880 > 192.168.43.146.7771: UDP, length 120
21:16:18.770633 IP 192.168.43.147.8880 > 192.168.43.124.7773: UDP, length 120
21:16:18.812718 IP 192.168.43.124.8880 > 192.168.43.146.7771: UDP, length 120
21:16:18.840458 IP 192.168.43.147.8880 > 192.168.43.124.7773: UDP, length 120
21:16:18.862668 IP 192.168.43.124.8880 > 192.168.43.146.7771: UDP, length 120
21:16:18.869679 IP 192.168.43.147.8880 > 192.168.43.124.7773: UDP, length 120
21:16:18.912666 IP 192.168.43.124.8880 > 192.168.43.146.7771: UDP, length 120
21:16:18.927346 IP 192.168.43.147.8880 > 192.168.43.124.7773: UDP, length 120
21:16:18.962667 IP 192.168.43.124.8880 > 192.168.43.146.7771: UDP, length 120
21:16:18.969915 IP 192.168.43.147.8880 > 192.168.43.124.7773: UDP, length 120
21:16:19.012606 IP 192.168.43.124.8880 > 192.168.43.146.7771: UDP, length 120
21:16:19.025815 IP 192.168.43.147.8880 > 192.168.43.124.7773: UDP, length 120
21:16:19.062614 IP 192.168.43.124.8880 > 192.168.43.146.7771: UDP, length 120
21:16:19.073925 IP 192.168.43.147.8880 > 192.168.43.124.7773: UDP, length 120
21:16:19.112666 IP 192.168.43.124.8880 > 192.168.43.146.7771: UDP, length 120
21:16:19.128075 IP 192.168.43.147.8880 > 192.168.43.124.7773: UDP, length 120
21:16:19.162667 IP 192.168.43.124.8880 > 192.168.43.146.7771: UDP, length 120
21:16:19.175280 IP 192.168.43.147.8880 > 192.168.43.124.7773: UDP, length 120
21:16:19.212665 IP 192.168.43.124.8880 > 192.168.43.146.7771: UDP, length 120
21:16:19.219476 IP 192.168.43.147.8880 > 192.168.43.124.7773: UDP, length 120
21:16:19.262667 IP 192.168.43.124.8880 > 192.168.43.146.7771: UDP, length 120
21:16:19.284787 IP 192.168.43.147.8880 > 192.168.43.124.7773: UDP, length 120
21:16:19.312658 IP 192.168.43.124.8880 > 192.168.43.146.7771: UDP, length 120
21:16:19.326502 IP 192.168.43.147.8880 > 192.168.43.124.7773: UDP, length 120
21:16:19.362666 IP 192.168.43.124.8880 > 192.168.43.146.7771: UDP, length 120
21:16:19.370453 IP 192.168.43.147.8880 > 192.168.43.124.7773: UDP, length 120
21:16:19.412667 IP 192.168.43.124.8880 > 192.168.43.146.7771: UDP, length 120
21:16:19.441089 IP 192.168.43.147.8880 > 192.168.43.124.7773: UDP, length 120
21:16:19.462665 IP 192.168.43.124.8880 > 192.168.43.146.7771: UDP, length 120
21:16:19.466838 IP 192.168.43.147.8880 > 192.168.43.124.7773: UDP, length 120
21:16:19.512666 IP 192.168.43.124.8880 > 192.168.43.146.7771: UDP, length 120
21:16:19.527374 IP 192.168.43.147.8880 > 192.168.43.124.7773: UDP, length 120
21:16:19.562666 IP 192.168.43.124.8880 > 192.168.43.146.7771: UDP, length 120
21:16:19.576379 IP 192.168.43.147.8880 > 192.168.43.124.7773: UDP, length 120
21:16:19.612664 IP 192.168.43.124.8880 > 192.168.43.146.7771: UDP, length 120
21:16:19.626892 IP 192.168.43.147.8880 > 192.168.43.124.7773: UDP, length 120
21:16:19.662667 IP 192.168.43.124.8880 > 192.168.43.146.7771: UDP, length 120
21:16:19.712665 IP 192.168.43.124.8880 > 192.168.43.146.7771: UDP, length 120
21:16:19.762716 IP 192.168.43.124.8880 > 192.168.43.146.7771: UDP, length 120
21:16:19.783024 IP 192.168.43.147.8880 > 192.168.43.124.7773: UDP, length 120
21:16:19.783050 IP 192.168.43.147.8880 > 192.168.43.124.7773: UDP, length 120
21:16:19.783053 IP 192.168.43.147.8880 > 192.168.43.124.7773: UDP, length 120
21:16:19.812717 IP 192.168.43.124.8880 > 192.168.43.146.7771: UDP, length 120
21:16:19.820841 IP 192.168.43.147.8880 > 192.168.43.124.7773: UDP, length 120
21:16:19.862665 IP 192.168.43.124.8880 > 192.168.43.146.7771: UDP, length 120
21:16:19.878843 IP 192.168.43.147.8880 > 192.168.43.124.7773: UDP, length 120
21:16:19.912666 IP 192.168.43.124.8880 > 192.168.43.146.7771: UDP, length 120
21:16:19.922191 IP 192.168.43.147.8880 > 192.168.43.124.7773: UDP, length 120
21:16:19.962667 IP 192.168.43.124.8880 > 192.168.43.146.7771: UDP, length 120
21:16:19.975636 IP 192.168.43.147.8880 > 192.168.43.124.7773: UDP, length 120
21:16:20.012668 IP 192.168.43.124.8880 > 192.168.43.146.7771: UDP, length 120
21:16:20.033251 IP 192.168.43.147.8880 > 192.168.43.124.7773: UDP, length 120
21:16:20.062666 IP 192.168.43.124.8880 > 192.168.43.146.7771: UDP, length 120
21:16:20.069513 IP 192.168.43.147.8880 > 192.168.43.124.7773: UDP, length 120
21:16:20.112667 IP 192.168.43.124.8880 > 192.168.43.146.7771: UDP, length 120
21:16:20.127854 IP 192.168.43.147.8880 > 192.168.43.124.7773: UDP, length 120
21:16:20.163060 IP 192.168.43.124.8880 > 192.168.43.146.7771: UDP, length 120
21:16:20.170425 IP 192.168.43.147.8880 > 192.168.43.124.7773: UDP, length 120
21:16:20.212718 IP 192.168.43.124.8880 > 192.168.43.146.7771: UDP, length 120
21:16:20.227086 IP 192.168.43.147.8880 > 192.168.43.124.7773: UDP, length 120
21:16:20.262714 IP 192.168.43.124.8880 > 192.168.43.146.7771: UDP, length 120
21:16:20.270043 IP 192.168.43.147.8880 > 192.168.43.124.7773: UDP, length 120
21:16:20.312720 IP 192.168.43.124.8880 > 192.168.43.146.7771: UDP, length 120
21:16:20.329706 IP 192.168.43.147.8880 > 192.168.43.124.7773: UDP, length 120
21:16:20.362671 IP 192.168.43.124.8880 > 192.168.43.146.7771: UDP, length 120
21:16:20.371732 IP 192.168.43.147.8880 > 192.168.43.124.7773: UDP, length 120
21:16:20.412633 IP 192.168.43.124.8880 > 192.168.43.146.7771: UDP, length 120
21:16:20.429027 IP 192.168.43.147.8880 > 192.168.43.124.7773: UDP, length 120
21:16:20.462669 IP 192.168.43.124.8880 > 192.168.43.146.7771: UDP, length 120
21:16:20.472984 IP 192.168.43.147.8880 > 192.168.43.124.7773: UDP, length 120
21:16:20.512670 IP 192.168.43.124.8880 > 192.168.43.146.7771: UDP, length 120
21:16:20.527746 IP 192.168.43.147.8880 > 192.168.43.124.7773: UDP, length 120
21:16:20.562668 IP 192.168.43.124.8880 > 192.168.43.146.7771: UDP, length 120
21:16:20.575369 IP 192.168.43.147.8880 > 192.168.43.124.7773: UDP, length 120
21:16:20.612669 IP 192.168.43.124.8880 > 192.168.43.146.7771: UDP, length 120
21:16:20.627334 IP 192.168.43.147.8880 > 192.168.43.124.7773: UDP, length 120
21:16:20.662668 IP 192.168.43.124.8880 > 192.168.43.146.7771: UDP, length 120
21:16:20.672466 IP 192.168.43.147.8880 > 192.168.43.124.7773: UDP, length 120
21:16:20.712715 IP 192.168.43.124.8880 > 192.168.43.146.7771: UDP, length 120
21:16:20.727644 IP 192.168.43.147.8880 > 192.168.43.124.7773: UDP, length 120
21:16:20.762669 IP 192.168.43.124.8880 > 192.168.43.146.7771: UDP, length 120
21:16:20.769519 IP 192.168.43.147.8880 > 192.168.43.124.7773: UDP, length 120
21:16:20.812716 IP 192.168.43.124.8880 > 192.168.43.146.7771: UDP, length 120
21:16:20.827889 IP 192.168.43.147.8880 > 192.168.43.124.7773: UDP, length 120
21:16:20.862667 IP 192.168.43.124.8880 > 192.168.43.146.7771: UDP, length 120
21:16:20.870477 IP 192.168.43.147.8880 > 192.168.43.124.7773: UDP, length 120
21:16:20.912665 IP 192.168.43.124.8880 > 192.168.43.146.7771: UDP, length 120
21:16:20.927897 IP 192.168.43.147.8880 > 192.168.43.124.7773: UDP, length 120
21:16:20.962666 IP 192.168.43.124.8880 > 192.168.43.146.7771: UDP, length 120
21:16:20.971183 IP 192.168.43.147.8880 > 192.168.43.124.7773: UDP, length 120
21:16:21.012667 IP 192.168.43.124.8880 > 192.168.43.146.7771: UDP, length 120
21:16:21.027188 IP 192.168.43.147.8880 > 192.168.43.124.7773: UDP, length 120
21:16:21.062665 IP 192.168.43.124.8880 > 192.168.43.146.7771: UDP, length 120
21:16:21.069076 IP 192.168.43.147.8880 > 192.168.43.124.7773: UDP, length 120
21:16:21.112666 IP 192.168.43.124.8880 > 192.168.43.146.7771: UDP, length 120
21:16:21.127955 IP 192.168.43.147.8880 > 192.168.43.124.7773: UDP, length 120
21:16:21.162665 IP 192.168.43.124.8880 > 192.168.43.146.7771: UDP, length 120
21:16:21.169353 IP 192.168.43.147.8880 > 192.168.43.124.7773: UDP, length 120
21:16:21.212667 IP 192.168.43.124.8880 > 192.168.43.146.7771: UDP, length 120
21:16:21.228825 IP 192.168.43.147.8880 > 192.168.43.124.7773: UDP, length 120
21:16:21.262666 IP 192.168.43.124.8880 > 192.168.43.146.7771: UDP, length 120
21:16:21.269175 IP 192.168.43.147.8880 > 192.168.43.124.7773: UDP, length 120
21:16:21.312668 IP 192.168.43.124.8880 > 192.168.43.146.7771: UDP, length 120
21:16:21.328813 IP 192.168.43.147.8880 > 192.168.43.124.7773: UDP, length 120
21:16:21.362667 IP 192.168.43.124.8880 > 192.168.43.146.7771: UDP, length 120
21:16:21.370967 IP 192.168.43.147.8880 > 192.168.43.124.7773: UDP, length 120
21:16:21.412665 IP 192.168.43.124.8880 > 192.168.43.146.7771: UDP, length 120
21:16:21.447260 IP 192.168.43.147.8880 > 192.168.43.124.7773: UDP, length 120
21:16:21.462666 IP 192.168.43.124.8880 > 192.168.43.146.7771: UDP, length 120
21:16:21.473293 IP 192.168.43.147.8880 > 192.168.43.124.7773: UDP, length 120
21:16:21.512665 IP 192.168.43.124.8880 > 192.168.43.146.7771: UDP, length 120
21:16:21.532066 IP 192.168.43.147.8880 > 192.168.43.124.7773: UDP, length 120
21:16:21.562666 IP 192.168.43.124.8880 > 192.168.43.146.7771: UDP, length 120
21:16:21.569744 IP 192.168.43.147.8880 > 192.168.43.124.7773: UDP, length 120
21:16:21.612667 IP 192.168.43.124.8880 > 192.168.43.146.7771: UDP, length 120
21:16:21.627407 IP 192.168.43.147.8880 > 192.168.43.124.7773: UDP, length 120
21:16:21.662665 IP 192.168.43.124.8880 > 192.168.43.146.7771: UDP, length 120
21:16:21.706089 IP 192.168.43.147.8880 > 192.168.43.124.7773: UDP, length 120
21:16:21.712663 IP 192.168.43.124.8880 > 192.168.43.146.7771: UDP, length 120
21:16:21.719755 IP 192.168.43.147.8880 > 192.168.43.124.7773: UDP, length 120
21:16:21.762665 IP 192.168.43.124.8880 > 192.168.43.146.7771: UDP, length 120
21:16:21.784741 IP 192.168.43.147.8880 > 192.168.43.124.7773: UDP, length 120
21:16:21.812716 IP 192.168.43.124.8880 > 192.168.43.146.7771: UDP, length 120
21:16:21.819861 IP 192.168.43.147.8880 > 192.168.43.124.7773: UDP, length 120
21:16:21.862667 IP 192.168.43.124.8880 > 192.168.43.146.7771: UDP, length 120
21:16:21.877235 IP 192.168.43.147.8880 > 192.168.43.124.7773: UDP, length 120
21:16:21.912667 IP 192.168.43.124.8880 > 192.168.43.146.7771: UDP, length 120
21:16:21.919971 IP 192.168.43.147.8880 > 192.168.43.124.7773: UDP, length 120
21:16:21.962665 IP 192.168.43.124.8880 > 192.168.43.146.7771: UDP, length 120
21:16:21.978933 IP 192.168.43.147.8880 > 192.168.43.124.7773: UDP, length 120
21:16:22.012666 IP 192.168.43.124.8880 > 192.168.43.146.7771: UDP, length 120
21:16:22.021852 IP 192.168.43.147.8880 > 192.168.43.124.7773: UDP, length 120
21:16:22.062667 IP 192.168.43.124.8880 > 192.168.43.146.7771: UDP, length 120
21:16:22.081184 IP 192.168.43.147.8880 > 192.168.43.124.7773: UDP, length 120
21:16:22.112665 IP 192.168.43.124.8880 > 192.168.43.146.7771: UDP, length 120
21:16:22.125598 IP 192.168.43.147.8880 > 192.168.43.124.7773: UDP, length 120
21:16:22.162717 IP 192.168.43.124.8880 > 192.168.43.146.7771: UDP, length 120
21:16:22.177257 IP 192.168.43.147.8880 > 192.168.43.124.7773: UDP, length 120
21:16:22.212717 IP 192.168.43.124.8880 > 192.168.43.146.7771: UDP, length 120
21:16:22.255060 IP 192.168.43.147.8880 > 192.168.43.124.7773: UDP, length 120
21:16:22.262717 IP 192.168.43.124.8880 > 192.168.43.146.7771: UDP, length 120
21:16:22.271948 IP 192.168.43.147.8880 > 192.168.43.124.7773: UDP, length 120
21:16:22.313357 IP 192.168.43.124.8880 > 192.168.43.146.7771: UDP, length 120
21:16:22.336923 IP 192.168.43.147.8880 > 192.168.43.124.7773: UDP, length 120
21:16:22.362670 IP 192.168.43.124.8880 > 192.168.43.146.7771: UDP, length 120
21:16:22.369094 IP 192.168.43.147.8880 > 192.168.43.124.7773: UDP, length 120
21:16:22.412671 IP 192.168.43.124.8880 > 192.168.43.146.7771: UDP, length 120
21:16:22.428620 IP 192.168.43.147.8880 > 192.168.43.124.7773: UDP, length 120
21:16:22.462669 IP 192.168.43.124.8880 > 192.168.43.146.7771: UDP, length 120
21:16:22.469697 IP 192.168.43.147.8880 > 192.168.43.124.7773: UDP, length 120
21:16:22.512668 IP 192.168.43.124.8880 > 192.168.43.146.7771: UDP, length 120
21:16:22.528490 IP 192.168.43.147.8880 > 192.168.43.124.7773: UDP, length 120
21:16:22.562669 IP 192.168.43.124.8880 > 192.168.43.146.7771: UDP, length 120
21:16:22.569250 IP 192.168.43.147.8880 > 192.168.43.124.7773: UDP, length 120
21:16:22.612670 IP 192.168.43.124.8880 > 192.168.43.146.7771: UDP, length 120
21:16:22.626962 IP 192.168.43.147.8880 > 192.168.43.124.7773: UDP, length 120
21:16:22.662604 IP 192.168.43.124.8880 > 192.168.43.146.7771: UDP, length 120
21:16:22.671842 IP 192.168.43.147.8880 > 192.168.43.124.7773: UDP, length 120
21:16:22.712602 IP 192.168.43.124.8880 > 192.168.43.146.7771: UDP, length 120
21:16:22.726694 IP 192.168.43.147.8880 > 192.168.43.124.7773: UDP, length 120
21:16:22.762668 IP 192.168.43.124.8880 > 192.168.43.146.7771: UDP, length 120
21:16:22.770947 IP 192.168.43.147.8880 > 192.168.43.124.7773: UDP, length 120
21:16:22.812664 IP 192.168.43.124.8880 > 192.168.43.146.7771: UDP, length 120
21:16:22.816292 IP 192.168.43.147.8880 > 192.168.43.124.7773: UDP, length 120
21:16:22.862666 IP 192.168.43.124.8880 > 192.168.43.146.7771: UDP, length 120
21:16:22.886249 IP 192.168.43.147.8880 > 192.168.43.124.7773: UDP, length 120
21:16:22.912666 IP 192.168.43.124.8880 > 192.168.43.146.7771: UDP, length 120
21:16:22.919102 IP 192.168.43.147.8880 > 192.168.43.124.7773: UDP, length 120
21:16:22.962666 IP 192.168.43.124.8880 > 192.168.43.146.7771: UDP, length 120
21:16:22.977768 IP 192.168.43.147.8880 > 192.168.43.124.7773: UDP, length 120
21:16:23.012667 IP 192.168.43.124.8880 > 192.168.43.146.7771: UDP, length 120
21:16:23.021022 IP 192.168.43.147.8880 > 192.168.43.124.7773: UDP, length 120
21:16:23.062666 IP 192.168.43.124.8880 > 192.168.43.146.7771: UDP, length 120
21:16:23.077735 IP 192.168.43.147.8880 > 192.168.43.124.7773: UDP, length 120
21:16:23.112668 IP 192.168.43.124.8880 > 192.168.43.146.7771: UDP, length 120
21:16:23.120400 IP 192.168.43.147.8880 > 192.168.43.124.7773: UDP, length 120
21:16:23.162665 IP 192.168.43.124.8880 > 192.168.43.146.7771: UDP, length 120
21:16:23.167528 IP 192.168.43.147.8880 > 192.168.43.124.7773: UDP, length 120
21:16:23.212667 IP 192.168.43.124.8880 > 192.168.43.146.7771: UDP, length 120
21:16:23.232522 IP 192.168.43.147.8880 > 192.168.43.124.7773: UDP, length 120
21:16:23.262664 IP 192.168.43.124.8880 > 192.168.43.146.7771: UDP, length 120
21:16:23.265882 IP 192.168.43.147.8880 > 192.168.43.124.7773: UDP, length 120
21:16:23.312666 IP 192.168.43.124.8880 > 192.168.43.146.7771: UDP, length 120
21:16:23.322764 IP 192.168.43.147.8880 > 192.168.43.124.7773: UDP, length 120
21:16:23.362666 IP 192.168.43.124.8880 > 192.168.43.146.7771: UDP, length 120
21:16:23.371894 IP 192.168.43.147.8880 > 192.168.43.124.7773: UDP, length 120
21:16:23.412665 IP 192.168.43.124.8880 > 192.168.43.146.7771: UDP, length 120
21:16:23.427823 IP 192.168.43.147.8880 > 192.168.43.124.7773: UDP, length 120
21:16:23.462665 IP 192.168.43.124.8880 > 192.168.43.146.7771: UDP, length 120
21:16:23.474132 IP 192.168.43.147.8880 > 192.168.43.124.7773: UDP, length 120
21:16:23.512666 IP 192.168.43.124.8880 > 192.168.43.146.7771: UDP, length 120
21:16:23.533126 IP 192.168.43.147.8880 > 192.168.43.124.7773: UDP, length 120
21:16:23.562668 IP 192.168.43.124.8880 > 192.168.43.146.7771: UDP, length 120
21:16:23.579825 IP 192.168.43.147.8880 > 192.168.43.124.7773: UDP, length 120
21:16:23.612667 IP 192.168.43.124.8880 > 192.168.43.146.7771: UDP, length 120
21:16:23.618771 IP 192.168.43.147.8880 > 192.168.43.124.7773: UDP, length 120
21:16:23.662666 IP 192.168.43.124.8880 > 192.168.43.146.7771: UDP, length 120
21:16:23.689994 IP 192.168.43.147.8880 > 192.168.43.124.7773: UDP, length 120
21:16:23.712667 IP 192.168.43.124.8880 > 192.168.43.146.7771: UDP, length 120
21:16:23.724268 IP 192.168.43.147.8880 > 192.168.43.124.7773: UDP, length 120
21:16:23.762716 IP 192.168.43.124.8880 > 192.168.43.146.7771: UDP, length 120
21:16:23.775269 IP 192.168.43.147.8880 > 192.168.43.124.7773: UDP, length 120
21:16:23.812624 IP 192.168.43.124.8880 > 192.168.43.146.7771: UDP, length 120
21:16:23.844234 IP 192.168.43.147.8880 > 192.168.43.124.7773: UDP, length 120
21:16:23.862613 IP 192.168.43.124.8880 > 192.168.43.146.7771: UDP, length 120
21:16:23.869894 IP 192.168.43.147.8880 > 192.168.43.124.7773: UDP, length 120
21:16:23.912668 IP 192.168.43.124.8880 > 192.168.43.146.7771: UDP, length 120
21:16:23.928958 IP 192.168.43.147.8880 > 192.168.43.124.7773: UDP, length 120
21:16:23.962667 IP 192.168.43.124.8880 > 192.168.43.146.7771: UDP, length 120
21:16:23.972301 IP 192.168.43.147.8880 > 192.168.43.124.7773: UDP, length 120
21:16:24.012670 IP 192.168.43.124.8880 > 192.168.43.146.7771: UDP, length 120
21:16:24.016588 IP 192.168.43.147.8880 > 192.168.43.124.7773: UDP, length 120
21:16:24.062667 IP 192.168.43.124.8880 > 192.168.43.146.7771: UDP, length 120
21:16:24.084093 IP 192.168.43.147.8880 > 192.168.43.124.7773: UDP, length 120
21:16:24.112667 IP 192.168.43.124.8880 > 192.168.43.146.7771: UDP, length 120
21:16:24.119233 IP 192.168.43.147.8880 > 192.168.43.124.7773: UDP, length 120
21:16:24.162666 IP 192.168.43.124.8880 > 192.168.43.146.7771: UDP, length 120
21:16:24.177046 IP 192.168.43.147.8880 > 192.168.43.124.7773: UDP, length 120
21:16:24.212667 IP 192.168.43.124.8880 > 192.168.43.146.7771: UDP, length 120
21:16:24.221525 IP 192.168.43.147.8880 > 192.168.43.124.7773: UDP, length 120
21:16:24.262666 IP 192.168.43.124.8880 > 192.168.43.146.7771: UDP, length 120
21:16:24.277015 IP 192.168.43.147.8880 > 192.168.43.124.7773: UDP, length 120
21:16:24.312666 IP 192.168.43.124.8880 > 192.168.43.146.7771: UDP, length 120
21:16:24.321143 IP 192.168.43.147.8880 > 192.168.43.124.7773: UDP, length 120
21:16:24.362635 IP 192.168.43.124.8880 > 192.168.43.146.7771: UDP, length 120
21:16:24.377085 IP 192.168.43.147.8880 > 192.168.43.124.7773: UDP, length 120
21:16:24.412669 IP 192.168.43.124.8880 > 192.168.43.146.7771: UDP, length 120
21:16:24.422383 IP 192.168.43.147.8880 > 192.168.43.124.7773: UDP, length 120
21:16:24.462669 IP 192.168.43.124.8880 > 192.168.43.146.7771: UDP, length 120
21:16:24.477609 IP 192.168.43.147.8880 > 192.168.43.124.7773: UDP, length 120
21:16:24.512670 IP 192.168.43.124.8880 > 192.168.43.146.7771: UDP, length 120
21:16:24.519570 IP 192.168.43.147.8880 > 192.168.43.124.7773: UDP, length 120
21:16:24.562667 IP 192.168.43.124.8880 > 192.168.43.146.7771: UDP, length 120
21:16:24.578739 IP 192.168.43.147.8880 > 192.168.43.124.7773: UDP, length 120
21:16:24.612666 IP 192.168.43.124.8880 > 192.168.43.146.7771: UDP, length 120
21:16:24.620422 IP 192.168.43.147.8880 > 192.168.43.124.7773: UDP, length 120
21:16:24.662667 IP 192.168.43.124.8880 > 192.168.43.146.7771: UDP, length 120
21:16:24.679529 IP 192.168.43.147.8880 > 192.168.43.124.7773: UDP, length 120
21:16:24.712673 IP 192.168.43.124.8880 > 192.168.43.146.7771: UDP, length 120
21:16:24.725517 IP 192.168.43.147.8880 > 192.168.43.124.7773: UDP, length 120
21:16:24.762665 IP 192.168.43.124.8880 > 192.168.43.146.7771: UDP, length 120
21:16:24.787693 IP 192.168.43.147.8880 > 192.168.43.124.7773: UDP, length 120
21:16:24.812631 IP 192.168.43.124.8880 > 192.168.43.146.7771: UDP, length 120
21:16:24.823022 IP 192.168.43.147.8880 > 192.168.43.124.7773: UDP, length 120
21:16:24.862666 IP 192.168.43.124.8880 > 192.168.43.146.7771: UDP, length 120
21:16:24.877517 IP 192.168.43.147.8880 > 192.168.43.124.7773: UDP, length 120
21:16:24.912668 IP 192.168.43.124.8880 > 192.168.43.146.7771: UDP, length 120
21:16:24.919062 IP 192.168.43.147.8880 > 192.168.43.124.7773: UDP, length 120
21:16:24.962665 IP 192.168.43.124.8880 > 192.168.43.146.7771: UDP, length 120
21:16:24.977782 IP 192.168.43.147.8880 > 192.168.43.124.7773: UDP, length 120
21:16:25.012667 IP 192.168.43.124.8880 > 192.168.43.146.7771: UDP, length 120
21:16:25.019467 IP 192.168.43.147.8880 > 192.168.43.124.7773: UDP, length 120
21:16:25.062666 IP 192.168.43.124.8880 > 192.168.43.146.7771: UDP, length 120
21:16:25.078264 IP 192.168.43.147.8880 > 192.168.43.124.7773: UDP, length 120
21:16:25.112667 IP 192.168.43.124.8880 > 192.168.43.146.7771: UDP, length 120
21:16:25.123191 IP 192.168.43.147.8880 > 192.168.43.124.7773: UDP, length 120
21:16:25.162667 IP 192.168.43.124.8880 > 192.168.43.146.7771: UDP, length 120
21:16:25.180187 IP 192.168.43.147.8880 > 192.168.43.124.7773: UDP, length 120
21:16:25.212667 IP 192.168.43.124.8880 > 192.168.43.146.7771: UDP, length 120
21:16:25.219441 IP 192.168.43.147.8880 > 192.168.43.124.7773: UDP, length 120
21:16:25.262666 IP 192.168.43.124.8880 > 192.168.43.146.7771: UDP, length 120
21:16:25.277440 IP 192.168.43.147.8880 > 192.168.43.124.7773: UDP, length 120
21:16:25.312667 IP 192.168.43.124.8880 > 192.168.43.146.7771: UDP, length 120
21:16:25.319135 IP 192.168.43.147.8880 > 192.168.43.124.7773: UDP, length 120
21:16:25.362667 IP 192.168.43.124.8880 > 192.168.43.146.7771: UDP, length 120
21:16:25.377685 IP 192.168.43.147.8880 > 192.168.43.124.7773: UDP, length 120
21:16:25.412668 IP 192.168.43.124.8880 > 192.168.43.146.7771: UDP, length 120
21:16:25.420746 IP 192.168.43.147.8880 > 192.168.43.124.7773: UDP, length 120
21:16:25.462664 IP 192.168.43.124.8880 > 192.168.43.146.7771: UDP, length 120
21:16:25.477360 IP 192.168.43.147.8880 > 192.168.43.124.7773: UDP, length 120
21:16:25.512667 IP 192.168.43.124.8880 > 192.168.43.146.7771: UDP, length 120
21:16:25.523232 IP 192.168.43.147.8880 > 192.168.43.124.7773: UDP, length 120
21:16:25.562664 IP 192.168.43.124.8880 > 192.168.43.146.7771: UDP, length 120
21:16:25.582750 IP 192.168.43.147.8880 > 192.168.43.124.7773: UDP, length 120
21:16:25.612666 IP 192.168.43.124.8880 > 192.168.43.146.7771: UDP, length 120
21:16:25.625419 IP 192.168.43.147.8880 > 192.168.43.124.7773: UDP, length 120
21:16:25.662667 IP 192.168.43.124.8880 > 192.168.43.146.7771: UDP, length 120
21:16:25.677948 IP 192.168.43.147.8880 > 192.168.43.124.7773: UDP, length 120
21:16:25.712627 IP 192.168.43.124.8880 > 192.168.43.146.7771: UDP, length 120
21:16:25.720467 IP 192.168.43.147.8880 > 192.168.43.124.7773: UDP, length 120
21:16:25.762665 IP 192.168.43.124.8880 > 192.168.43.146.7771: UDP, length 120
21:16:25.777943 IP 192.168.43.147.8880 > 192.168.43.124.7773: UDP, length 120
21:16:25.812635 IP 192.168.43.124.8880 > 192.168.43.146.7771: UDP, length 120
21:16:25.825024 IP 192.168.43.147.8880 > 192.168.43.124.7773: UDP, length 120
21:16:25.862667 IP 192.168.43.124.8880 > 192.168.43.146.7771: UDP, length 120
21:16:25.877736 IP 192.168.43.147.8880 > 192.168.43.124.7773: UDP, length 120
21:16:25.912667 IP 192.168.43.124.8880 > 192.168.43.146.7771: UDP, length 120
21:16:25.921516 IP 192.168.43.147.8880 > 192.168.43.124.7773: UDP, length 120
21:16:25.962666 IP 192.168.43.124.8880 > 192.168.43.146.7771: UDP, length 120
21:16:25.977750 IP 192.168.43.147.8880 > 192.168.43.124.7773: UDP, length 120
21:16:26.012668 IP 192.168.43.124.8880 > 192.168.43.146.7771: UDP, length 120
21:16:26.019557 IP 192.168.43.147.8880 > 192.168.43.124.7773: UDP, length 120
21:16:26.062665 IP 192.168.43.124.8880 > 192.168.43.146.7771: UDP, length 120
21:16:26.080385 IP 192.168.43.147.8880 > 192.168.43.124.7773: UDP, length 120
21:16:26.112668 IP 192.168.43.124.8880 > 192.168.43.146.7771: UDP, length 120
21:16:26.119431 IP 192.168.43.147.8880 > 192.168.43.124.7773: UDP, length 120
21:16:26.162715 IP 192.168.43.124.8880 > 192.168.43.146.7771: UDP, length 120
21:16:26.177783 IP 192.168.43.147.8880 > 192.168.43.124.7773: UDP, length 120
21:16:26.212719 IP 192.168.43.124.8880 > 192.168.43.146.7771: UDP, length 120
21:16:26.221868 IP 192.168.43.147.8880 > 192.168.43.124.7773: UDP, length 120
21:16:26.262717 IP 192.168.43.124.8880 > 192.168.43.146.7771: UDP, length 120
21:16:26.282003 IP 192.168.43.147.8880 > 192.168.43.124.7773: UDP, length 120
21:16:26.312719 IP 192.168.43.124.8880 > 192.168.43.146.7771: UDP, length 120
21:16:26.324286 IP 192.168.43.147.8880 > 192.168.43.124.7773: UDP, length 120
21:16:26.362670 IP 192.168.43.124.8880 > 192.168.43.146.7771: UDP, length 120
21:16:26.377442 IP 192.168.43.147.8880 > 192.168.43.124.7773: UDP, length 120
21:16:26.412670 IP 192.168.43.124.8880 > 192.168.43.146.7771: UDP, length 120
21:16:26.455210 IP 192.168.43.147.8880 > 192.168.43.124.7773: UDP, length 120
21:16:26.462668 IP 192.168.43.124.8880 > 192.168.43.146.7771: UDP, length 120
21:16:26.466218 IP 192.168.43.147.8880 > 192.168.43.124.7773: UDP, length 120
21:16:26.512635 IP 192.168.43.124.8880 > 192.168.43.146.7771: UDP, length 120
21:16:26.531753 IP 192.168.43.147.8880 > 192.168.43.124.7773: UDP, length 120
21:16:26.562669 IP 192.168.43.124.8880 > 192.168.43.146.7771: UDP, length 120
21:16:26.572731 IP 192.168.43.147.8880 > 192.168.43.124.7773: UDP, length 120
21:16:26.612670 IP 192.168.43.124.8880 > 192.168.43.146.7771: UDP, length 120
21:16:26.626821 IP 192.168.43.147.8880 > 192.168.43.124.7773: UDP, length 120
21:16:26.662668 IP 192.168.43.124.8880 > 192.168.43.146.7771: UDP, length 120
21:16:26.669755 IP 192.168.43.147.8880 > 192.168.43.124.7773: UDP, length 120
21:16:26.712669 IP 192.168.43.124.8880 > 192.168.43.146.7771: UDP, length 120
21:16:26.729643 IP 192.168.43.147.8880 > 192.168.43.124.7773: UDP, length 120
21:16:26.762670 IP 192.168.43.124.8880 > 192.168.43.146.7771: UDP, length 120
21:16:26.774356 IP 192.168.43.147.8880 > 192.168.43.124.7773: UDP, length 120
21:16:26.812668 IP 192.168.43.124.8880 > 192.168.43.146.7771: UDP, length 120
21:16:26.829297 IP 192.168.43.147.8880 > 192.168.43.124.7773: UDP, length 120
21:16:26.862667 IP 192.168.43.124.8880 > 192.168.43.146.7771: UDP, length 120
21:16:26.874023 IP 192.168.43.147.8880 > 192.168.43.124.7773: UDP, length 120
21:16:26.912665 IP 192.168.43.124.8880 > 192.168.43.146.7771: UDP, length 120
21:16:26.927906 IP 192.168.43.147.8880 > 192.168.43.124.7773: UDP, length 120
21:16:26.962666 IP 192.168.43.124.8880 > 192.168.43.146.7771: UDP, length 120
21:16:26.969145 IP 192.168.43.147.8880 > 192.168.43.124.7773: UDP, length 120
21:16:27.012715 IP 192.168.43.124.8880 > 192.168.43.146.7771: UDP, length 120
21:16:27.028072 IP 192.168.43.147.8880 > 192.168.43.124.7773: UDP, length 120
21:16:27.062716 IP 192.168.43.124.8880 > 192.168.43.146.7771: UDP, length 120
21:16:27.070642 IP 192.168.43.147.8880 > 192.168.43.124.7773: UDP, length 120
21:16:27.112717 IP 192.168.43.124.8880 > 192.168.43.146.7771: UDP, length 120
21:16:27.128594 IP 192.168.43.147.8880 > 192.168.43.124.7773: UDP, length 120
21:16:27.162718 IP 192.168.43.124.8880 > 192.168.43.146.7771: UDP, length 120
21:16:27.172188 IP 192.168.43.147.8880 > 192.168.43.124.7773: UDP, length 120
21:16:27.212725 IP 192.168.43.124.8880 > 192.168.43.146.7771: UDP, length 120
21:16:27.228746 IP 192.168.43.147.8880 > 192.168.43.124.7773: UDP, length 120
21:16:27.262717 IP 192.168.43.124.8880 > 192.168.43.146.7771: UDP, length 120
21:16:27.274784 IP 192.168.43.147.8880 > 192.168.43.124.7773: UDP, length 120
21:16:27.312717 IP 192.168.43.124.8880 > 192.168.43.146.7771: UDP, length 120
21:16:27.331242 IP 192.168.43.147.8880 > 192.168.43.124.7773: UDP, length 120
21:16:27.362669 IP 192.168.43.124.8880 > 192.168.43.146.7771: UDP, length 120
21:16:27.369805 IP 192.168.43.147.8880 > 192.168.43.124.7773: UDP, length 120
