01:16:14.806320 IP 192.168.43.147.8880 > 192.168.43.124.7773: UDP, length 120
01:16:14.816482 IP 192.168.43.146.8880 > 192.168.43.147.7772: UDP, length 120
01:16:14.856375 IP 192.168.43.147.8880 > 192.168.43.124.7773: UDP, length 120
01:16:14.861153 IP 192.168.43.146.8880 > 192.168.43.147.7772: UDP, length 120
01:16:14.906349 IP 192.168.43.147.8880 > 192.168.43.124.7773: UDP, length 120
01:16:14.919268 IP 192.168.43.146.8880 > 192.168.43.147.7772: UDP, length 120
01:16:14.956351 IP 192.168.43.147.8880 > 192.168.43.124.7773: UDP, length 120
01:16:14.959911 IP 192.168.43.146.8880 > 192.168.43.147.7772: UDP, length 120
01:16:15.006349 IP 192.168.43.147.8880 > 192.168.43.124.7773: UDP, length 120
01:16:15.017093 IP 192.168.43.146.8880 > 192.168.43.147.7772: UDP, length 120
01:16:15.056341 IP 192.168.43.147.8880 > 192.168.43.124.7773: UDP, length 120
01:16:15.059953 IP 192.168.43.146.8880 > 192.168.43.147.7772: UDP, length 120
01:16:15.106341 IP 192.168.43.147.8880 > 192.168.43.124.7773: UDP, length 120
01:16:15.116934 IP 192.168.43.146.8880 > 192.168.43.147.7772: UDP, length 120
01:16:15.156340 IP 192.168.43.147.8880 > 192.168.43.124.7773: UDP, length 120
01:16:15.159831 IP 192.168.43.146.8880 > 192.168.43.147.7772: UDP, length 120
01:16:15.206340 IP 192.168.43.147.8880 > 192.168.43.124.7773: UDP, length 120
01:16:15.216722 IP 192.168.43.146.8880 > 192.168.43.147.7772: UDP, length 120
01:16:15.256343 IP 192.168.43.147.8880 > 192.168.43.124.7773: UDP, length 120
01:16:15.259612 IP 192.168.43.146.8880 > 192.168.43.147.7772: UDP, length 120
01:16:15.306340 IP 192.168.43.147.8880 > 192.168.43.124.7773: UDP, length 120
01:16:15.316782 IP 192.168.43.146.8880 > 192.168.43.147.7772: UDP, length 120
01:16:15.356341 IP 192.168.43.147.8880 > 192.168.43.124.7773: UDP, length 120
01:16:15.359595 IP 192.168.43.146.8880 > 192.168.43.147.7772: UDP, length 120
01:16:15.406343 IP 192.168.43.147.8880 > 192.168.43.124.7773: UDP, length 120
01:16:15.418792 IP 192.168.43.146.8880 > 192.168.43.147.7772: UDP, length 120
01:16:15.456340 IP 192.168.43.147.8880 > 192.168.43.124.7773: UDP, length 120
01:16:15.460724 IP 192.168.43.146.8880 > 192.168.43.147.7772: UDP, length 120
01:16:15.506382 IP 192.168.43.147.8880 > 192.168.43.124.7773: UDP, length 120
01:16:15.517792 IP 192.168.43.146.8880 > 192.168.43.147.7772: UDP, length 120
01:16:15.556355 IP 192.168.43.147.8880 > 192.168.43.124.7773: UDP, length 120
01:16:15.592170 IP 192.168.43.146.8880 > 192.168.43.147.7772: UDP, length 120
01:16:15.606342 IP 192.168.43.147.8880 > 192.168.43.124.7773: UDP, length 120
01:16:15.610173 IP 192.168.43.146.8880 > 192.168.43.147.7772: UDP, length 120
01:16:15.656342 IP 192.168.43.147.8880 > 192.168.43.124.7773: UDP, length 120
01:16:15.665424 IP 192.168.43.146.8880 > 192.168.43.147.7772: UDP, length 120
01:16:15.706340 IP 192.168.43.147.8880 > 192.168.43.124.7773: UDP, length 120
01:16:15.740346 IP 192.168.43.146.8880 > 192.168.43.147.7772: UDP, length 120
01:16:15.756343 IP 192.168.43.147.8880 > 192.168.43.124.7773: UDP, length 120
01:16:15.759797 IP 192.168.43.146.8880 > 192.168.43.147.7772: UDP, length 120
01:16:15.806342 IP 192.168.43.147.8880 > 192.168.43.124.7773: UDP, length 120
01:16:15.816956 IP 192.168.43.146.8880 > 192.168.43.147.7772: UDP, length 120
01:16:15.856345 IP 192.168.43.147.8880 > 192.168.43.124.7773: UDP, length 120
01:16:15.859633 IP 192.168.43.146.8880 > 192.168.43.147.7772: UDP, length 120
01:16:15.906343 IP 192.168.43.147.8880 > 192.168.43.124.7773: UDP, length 120
01:16:15.917238 IP 192.168.43.146.8880 > 192.168.43.147.7772: UDP, length 120
01:16:15.956340 IP 192.168.43.147.8880 > 192.168.43.124.7773: UDP, length 120
01:16:15.961909 IP 192.168.43.146.8880 > 192.168.43.147.7772: UDP, length 120
01:16:16.006345 IP 192.168.43.147.8880 > 192.168.43.124.7773: UDP, length 120
01:16:16.019589 IP 192.168.43.146.8880 > 192.168.43.147.7772: UDP, length 120
01:16:16.056344 IP 192.168.43.147.8880 > 192.168.43.124.7773: UDP, length 120
01:16:16.089033 IP 192.168.43.146.8880 > 192.168.43.147.7772: UDP, length 120
01:16:16.106340 IP 192.168.43.147.8880 > 192.168.43.124.7773: UDP, length 120
01:16:16.109621 IP 192.168.43.146.8880 > 192.168.43.147.7772: UDP, length 120
01:16:16.156340 IP 192.168.43.147.8880 > 192.168.43.124.7773: UDP, length 120
01:16:16.168049 IP 192.168.43.146.8880 > 192.168.43.147.7772: UDP, length 120
01:16:16.206341 IP 192.168.43.147.8880 > 192.168.43.124.7773: UDP, length 120
01:16:16.211128 IP 192.168.43.146.8880 > 192.168.43.147.7772: UDP, length 120
01:16:16.256339 IP 192.168.43.147.8880 > 192.168.43.124.7773: UDP, length 120
01:16:16.267305 IP 192.168.43.146.8880 > 192.168.43.147.7772: UDP, length 120
01:16:16.306340 IP 192.168.43.147.8880 > 192.168.43.124.7773: UDP, length 120
01:16:16.334180 IP 192.168.43.146.8880 > 192.168.43.147.7772: UDP, length 120
01:16:16.356399 IP 192.168.43.147.8880 > 192.168.43.124.7773: UDP, length 120
01:16:16.360131 IP 192.168.43.146.8880 > 192.168.43.147.7772: UDP, length 120
01:16:16.406431 IP 192.168.43.147.8880 > 192.168.43.124.7773: UDP, length 120
01:16:16.416933 IP 192.168.43.146.8880 > 192.168.43.147.7772: UDP, length 120
01:16:16.456439 IP 192.168.43.147.8880 > 192.168.43.124.7773: UDP, length 120
01:16:16.489150 IP 192.168.43.146.8880 > 192.168.43.147.7772: UDP, length 120
01:16:16.506408 IP 192.168.43.147.8880 > 192.168.43.124.7773: UDP, length 120
01:16:16.511798 IP 192.168.43.146.8880 > 192.168.43.147.7772: UDP, length 120
01:16:16.556413 IP 192.168.43.147.8880 > 192.168.43.124.7773: UDP, length 120
01:16:16.567533 IP 192.168.43.146.8880 > 192.168.43.147.7772: UDP, length 120
01:16:16.606393 IP 192.168.43.147.8880 > 192.168.43.124.7773: UDP, length 120
01:16:16.610018 IP 192.168.43.146.8880 > 192.168.43.147.7772: UDP, length 120
01:16:16.656397 IP 192.168.43.147.8880 > 192.168.43.124.7773: UDP, length 120
01:16:16.666211 IP 192.168.43.146.8880 > 192.168.43.147.7772: UDP, length 120
01:16:16.706405 IP 192.168.43.147.8880 > 192.168.43.124.7773: UDP, length 120
01:16:16.710291 IP 192.168.43.146.8880 > 192.168.43.147.7772: UDP, length 120
01:16:16.756396 IP 192.168.43.147.8880 > 192.168.43.124.7773: UDP, length 120
01:16:16.766731 IP 192.168.43.146.8880 > 192.168.43.147.7772: UDP, length 120
01:16:16.806357 IP 192.168.43.147.8880 > 192.168.43.124.7773: UDP, length 120
01:16:16.812312 IP 192.168.43.146.8880 > 192.168.43.147.7772: UDP, length 120
01:16:16.856355 IP 192.168.43.147.8880 > 192.168.43.124.7773: UDP, length 120
01:16:16.859627 IP 192.168.43.146.8880 > 192.168.43.147.7772: UDP, length 120
01:16:16.906372 IP 192.168.43.147.8880 > 192.168.43.124.7773: UDP, length 120
01:16:16.921744 IP 192.168.43.146.8880 > 192.168.43.147.7772: UDP, length 120
01:16:16.956366 IP 192.168.43.147.8880 > 192.168.43.124.7773: UDP, length 120
01:16:16.962130 IP 192.168.43.146.8880 > 192.168.43.147.7772: UDP, length 120
01:16:17.006423 IP 192.168.43.147.8880 > 192.168.43.124.7773: UDP, length 120
01:16:17.022309 IP 192.168.43.146.8880 > 192.168.43.147.7772: UDP, length 120
01:16:17.056387 IP 192.168.43.147.8880 > 192.168.43.124.7773: UDP, length 120
01:16:17.059710 IP 192.168.43.146.8880 > 192.168.43.147.7772: UDP, length 120
01:16:17.106369 IP 192.168.43.147.8880 > 192.168.43.124.7773: UDP, length 120
01:16:17.119469 IP 192.168.43.146.8880 > 192.168.43.147.7772: UDP, length 120
01:16:17.156371 IP 192.168.43.147.8880 > 192.168.43.124.7773: UDP, length 120
01:16:17.160641 IP 192.168.43.146.8880 > 192.168.43.147.7772: UDP, length 120
01:16:17.206373 IP 192.168.43.147.8880 > 192.168.43.124.7773: UDP, length 120
01:16:17.217257 IP 192.168.43.146.8880 > 192.168.43.147.7772: UDP, length 120
01:16:17.256366 IP 192.168.43.147.8880 > 192.168.43.124.7773: UDP, length 120
01:16:17.259763 IP 192.168.43.146.8880 > 192.168.43.147.7772: UDP, length 120
01:16:17.306365 IP 192.168.43.147.8880 > 192.168.43.124.7773: UDP, length 120
01:16:17.312497 IP 192.168.43.146.8880 > 192.168.43.147.7772: UDP, length 120
01:16:17.356364 IP 192.168.43.147.8880 > 192.168.43.124.7773: UDP, length 120
01:16:17.366779 IP 192.168.43.146.8880 > 192.168.43.147.7772: UDP, length 120
01:16:17.406364 IP 192.168.43.147.8880 > 192.168.43.124.7773: UDP, length 120
01:16:17.410022 IP 192.168.43.146.8880 > 192.168.43.147.7772: UDP, length 120
01:16:17.456365 IP 192.168.43.147.8880 > 192.168.43.124.7773: UDP, length 120
01:16:17.467035 IP 192.168.43.146.8880 > 192.168.43.147.7772: UDP, length 120
01:16:17.506363 IP 192.168.43.147.8880 > 192.168.43.124.7773: UDP, length 120
01:16:17.509760 IP 192.168.43.146.8880 > 192.168.43.147.7772: UDP, length 120
01:16:17.556364 IP 192.168.43.147.8880 > 192.168.43.124.7773: UDP, length 120
01:16:17.570381 IP 192.168.43.146.8880 > 192.168.43.147.7772: UDP, length 120
01:16:17.606365 IP 192.168.43.147.8880 > 192.168.43.124.7773: UDP, length 120
01:16:17.622977 IP 192.168.43.146.8880 > 192.168.43.147.7772: UDP, length 120
01:16:17.656364 IP 192.168.43.147.8880 > 192.168.43.124.7773: UDP, length 120
01:16:17.676430 IP 192.168.43.146.8880 > 192.168.43.147.7772: UDP, length 120
01:16:17.706365 IP 192.168.43.147.8880 > 192.168.43.124.7773: UDP, length 120
01:16:17.710070 IP 192.168.43.146.8880 > 192.168.43.147.7772: UDP, length 120
01:16:17.756363 IP 192.168.43.147.8880 > 192.168.43.124.7773: UDP, length 120
01:16:17.806364 IP 192.168.43.147.8880 > 192.168.43.124.7773: UDP, length 120
01:16:17.809760 IP 192.168.43.146.8880 > 192.168.43.147.7772: UDP, length 120
01:16:17.843483 IP 192.168.43.146.8880 > 192.168.43.147.7772: UDP, length 120
01:16:17.856375 IP 192.168.43.147.8880 > 192.168.43.124.7773: UDP, length 120
01:16:17.871202 IP 192.168.43.146.8880 > 192.168.43.147.7772: UDP, length 120
01:16:17.906371 IP 192.168.43.147.8880 > 192.168.43.124.7773: UDP, length 120
01:16:17.936055 IP 192.168.43.146.8880 > 192.168.43.147.7772: UDP, length 120
01:16:17.956365 IP 192.168.43.147.8880 > 192.168.43.124.7773: UDP, length 120
01:16:17.970106 IP 192.168.43.146.8880 > 192.168.43.147.7772: UDP, length 120
01:16:18.006365 IP 192.168.43.147.8880 > 192.168.43.124.7773: UDP, length 120
01:16:18.035940 IP 192.168.43.146.8880 > 192.168.43.147.7772: UDP, length 120
01:16:18.056364 IP 192.168.43.147.8880 > 192.168.43.124.7773: UDP, length 120
01:16:18.106364 IP 192.168.43.147.8880 > 192.168.43.124.7773: UDP, length 120
01:16:18.121493 IP 192.168.43.146.8880 > 192.168.43.147.7772: UDP, length 120
01:16:18.134967 IP 192.168.43.146.8880 > 192.168.43.147.7772: UDP, length 120
01:16:18.156378 IP 192.168.43.147.8880 > 192.168.43.124.7773: UDP, length 120
01:16:18.163513 IP 192.168.43.146.8880 > 192.168.43.147.7772: UDP, length 120
01:16:18.206366 IP 192.168.43.147.8880 > 192.168.43.124.7773: UDP, length 120
01:16:18.219822 IP 192.168.43.146.8880 > 192.168.43.147.7772: UDP, length 120
01:16:18.256374 IP 192.168.43.147.8880 > 192.168.43.124.7773: UDP, length 120
01:16:18.265668 IP 192.168.43.146.8880 > 192.168.43.147.7772: UDP, length 120
01:16:18.306367 IP 192.168.43.147.8880 > 192.168.43.124.7773: UDP, length 120
01:16:18.341134 IP 192.168.43.146.8880 > 192.168.43.147.7772: UDP, length 120
01:16:18.356363 IP 192.168.43.147.8880 > 192.168.43.124.7773: UDP, length 120
01:16:18.406364 IP 192.168.43.147.8880 > 192.168.43.124.7773: UDP, length 120
01:16:18.421529 IP 192.168.43.146.8880 > 192.168.43.147.7772: UDP, length 120
01:16:18.443888 IP 192.168.43.146.8880 > 192.168.43.147.7772: UDP, length 120
01:16:18.456362 IP 192.168.43.147.8880 > 192.168.43.124.7773: UDP, length 120
01:16:18.506414 IP 192.168.43.147.8880 > 192.168.43.124.7773: UDP, length 120
01:16:18.519238 IP 192.168.43.146.8880 > 192.168.43.147.7772: UDP, length 120
01:16:18.549255 IP 192.168.43.146.8880 > 192.168.43.147.7772: UDP, length 120
01:16:18.556382 IP 192.168.43.147.8880 > 192.168.43.124.7773: UDP, length 120
01:16:18.600216 IP 192.168.43.146.8880 > 192.168.43.147.7772: UDP, length 120
01:16:18.606363 IP 192.168.43.147.8880 > 192.168.43.124.7773: UDP, length 120
01:16:18.628538 IP 192.168.43.146.8880 > 192.168.43.147.7772: UDP, length 120
01:16:18.656366 IP 192.168.43.147.8880 > 192.168.43.124.7773: UDP, length 120
01:16:18.661353 IP 192.168.43.146.8880 > 192.168.43.147.7772: UDP, length 120
01:16:18.706364 IP 192.168.43.147.8880 > 192.168.43.124.7773: UDP, length 120
01:16:18.734988 IP 192.168.43.146.8880 > 192.168.43.147.7772: UDP, length 120
01:16:18.756365 IP 192.168.43.147.8880 > 192.168.43.124.7773: UDP, length 120
01:16:18.771557 IP 192.168.43.146.8880 > 192.168.43.147.7772: UDP, length 120
01:16:18.806364 IP 192.168.43.147.8880 > 192.168.43.124.7773: UDP, length 120
01:16:18.834113 IP 192.168.43.146.8880 > 192.168.43.147.7772: UDP, length 120
01:16:18.856371 IP 192.168.43.147.8880 > 192.168.43.124.7773: UDP, length 120
01:16:18.861372 IP 192.168.43.146.8880 > 192.168.43.147.7772: UDP, length 120
01:16:18.906366 IP 192.168.43.147.8880 > 192.168.43.124.7773: UDP, length 120
01:16:18.919314 IP 192.168.43.146.8880 > 192.168.43.147.7772: UDP, length 120
01:16:18.956371 IP 192.168.43.147.8880 > 192.168.43.124.7773: UDP, length 120
01:16:18.962623 IP 192.168.43.146.8880 > 192.168.43.147.7772: UDP, length 120
01:16:19.006367 IP 192.168.43.147.8880 > 192.168.43.124.7773: UDP, length 120
01:16:19.019456 IP 192.168.43.146.8880 > 192.168.43.147.7772: UDP, length 120
01:16:19.056365 IP 192.168.43.147.8880 > 192.168.43.124.7773: UDP, length 120
01:16:19.061215 IP 192.168.43.146.8880 > 192.168.43.147.7772: UDP, length 120
01:16:19.106364 IP 192.168.43.147.8880 > 192.168.43.124.7773: UDP, length 120
01:16:19.111754 IP 192.168.43.146.8880 > 192.168.43.147.7772: UDP, length 120
01:16:19.156367 IP 192.168.43.147.8880 > 192.168.43.124.7773: UDP, length 120
01:16:19.177101 IP 192.168.43.146.8880 > 192.168.43.147.7772: UDP, length 120
01:16:19.206373 IP 192.168.43.147.8880 > 192.168.43.124.7773: UDP, length 120
01:16:19.209817 IP 192.168.43.146.8880 > 192.168.43.147.7772: UDP, length 120
01:16:19.256366 IP 192.168.43.147.8880 > 192.168.43.124.7773: UDP, length 120
01:16:19.262877 IP 192.168.43.146.8880 > 192.168.43.147.7772: UDP, length 120
01:16:19.306364 IP 192.168.43.147.8880 > 192.168.43.124.7773: UDP, length 120
01:16:19.338367 IP 192.168.43.146.8880 > 192.168.43.147.7772: UDP, length 120
01:16:19.356362 IP 192.168.43.147.8880 > 192.168.43.124.7773: UDP, length 120
01:16:19.361320 IP 192.168.43.146.8880 > 192.168.43.147.7772: UDP, length 120
01:16:19.406364 IP 192.168.43.147.8880 > 192.168.43.124.7773: UDP, length 120
01:16:19.419667 IP 192.168.43.146.8880 > 192.168.43.147.7772: UDP, length 120
01:16:19.456364 IP 192.168.43.147.8880 > 192.168.43.124.7773: UDP, length 120
01:16:19.468633 IP 192.168.43.146.8880 > 192.168.43.147.7772: UDP, length 120
01:16:19.506365 IP 192.168.43.147.8880 > 192.168.43.124.7773: UDP, length 120
01:16:19.519188 IP 192.168.43.146.8880 > 192.168.43.147.7772: UDP, length 120
01:16:19.556364 IP 192.168.43.147.8880 > 192.168.43.124.7773: UDP, length 120
01:16:19.606363 IP 192.168.43.147.8880 > 192.168.43.124.7773: UDP, length 120
01:16:19.656364 IP 192.168.43.147.8880 > 192.168.43.124.7773: UDP, length 120
01:16:19.673904 IP 192.168.43.146.8880 > 192.168.43.147.7772: UDP, length 120
01:16:19.676013 IP 192.168.43.146.8880 > 192.168.43.147.7772: UDP, length 120
01:16:19.676127 IP 192.168.43.146.8880 > 192.168.43.147.7772: UDP, length 120
01:16:19.706365 IP 192.168.43.147.8880 > 192.168.43.124.7773: UDP, length 120
01:16:19.710054 IP 192.168.43.146.8880 > 192.168.43.147.7772: UDP, length 120
01:16:19.756364 IP 192.168.43.147.8880 > 192.168.43.124.7773: UDP, length 120
01:16:19.770293 IP 192.168.43.146.8880 > 192.168.43.147.7772: UDP, length 120
01:16:19.806364 IP 192.168.43.147.8880 > 192.168.43.124.7773: UDP, length 120
01:16:19.812288 IP 192.168.43.146.8880 > 192.168.43.147.7772: UDP, length 120
01:16:19.856366 IP 192.168.43.147.8880 > 192.168.43.124.7773: UDP, length 120
01:16:19.859800 IP 192.168.43.146.8880 > 192.168.43.147.7772: UDP, length 120
01:16:19.906367 IP 192.168.43.147.8880 > 192.168.43.124.7773: UDP, length 120
01:16:19.924671 IP 192.168.43.146.8880 > 192.168.43.147.7772: UDP, length 120
01:16:19.956364 IP 192.168.43.147.8880 > 192.168.43.124.7773: UDP, length 120
01:16:19.960564 IP 192.168.43.146.8880 > 192.168.43.147.7772: UDP, length 120
01:16:20.006416 IP 192.168.43.147.8880 > 192.168.43.124.7773: UDP, length 120
01:16:20.019231 IP 192.168.43.146.8880 > 192.168.43.147.7772: UDP, length 120
01:16:20.056372 IP 192.168.43.147.8880 > 192.168.43.124.7773: UDP, length 120
01:16:20.062656 IP 192.168.43.146.8880 > 192.168.43.147.7772: UDP, length 120
01:16:20.106364 IP 192.168.43.147.8880 > 192.168.43.124.7773: UDP, length 120
01:16:20.119356 IP 192.168.43.146.8880 > 192.168.43.147.7772: UDP, length 120
01:16:20.156364 IP 192.168.43.147.8880 > 192.168.43.124.7773: UDP, length 120
01:16:20.159969 IP 192.168.43.146.8880 > 192.168.43.147.7772: UDP, length 120
01:16:20.206364 IP 192.168.43.147.8880 > 192.168.43.124.7773: UDP, length 120
01:16:20.220619 IP 192.168.43.146.8880 > 192.168.43.147.7772: UDP, length 120
01:16:20.256372 IP 192.168.43.147.8880 > 192.168.43.124.7773: UDP, length 120
01:16:20.262783 IP 192.168.43.146.8880 > 192.168.43.147.7772: UDP, length 120
01:16:20.306363 IP 192.168.43.147.8880 > 192.168.43.124.7773: UDP, length 120
01:16:20.320447 IP 192.168.43.146.8880 > 192.168.43.147.7772: UDP, length 120
01:16:20.356366 IP 192.168.43.147.8880 > 192.168.43.124.7773: UDP, length 120
01:16:20.361493 IP 192.168.43.146.8880 > 192.168.43.147.7772: UDP, length 120
01:16:20.406364 IP 192.168.43.147.8880 > 192.168.43.124.7773: UDP, length 120
01:16:20.419209 IP 192.168.43.146.8880 > 192.168.43.147.7772: UDP, length 120
01:16:20.456372 IP 192.168.43.147.8880 > 192.168.43.124.7773: UDP, length 120
01:16:20.467616 IP 192.168.43.146.8880 > 192.168.43.147.7772: UDP, length 120
01:16:20.506369 IP 192.168.43.147.8880 > 192.168.43.124.7773: UDP, length 120
01:16:20.519645 IP 192.168.43.146.8880 > 192.168.43.147.7772: UDP, length 120
01:16:20.556364 IP 192.168.43.147.8880 > 192.168.43.124.7773: UDP, length 120
01:16:20.557296 IP 192.168.43.146.8880 > 192.168.43.147.7772: UDP, length 120
01:16:20.606366 IP 192.168.43.147.8880 > 192.168.43.124.7773: UDP, length 120
01:16:20.619049 IP 192.168.43.146.8880 > 192.168.43.147.7772: UDP, length 120
01:16:20.656364 IP 192.168.43.147.8880 > 192.168.43.124.7773: UDP, length 120
01:16:20.659952 IP 192.168.43.146.8880 > 192.168.43.147.7772: UDP, length 120
01:16:20.706365 IP 192.168.43.147.8880 > 192.168.43.124.7773: UDP, length 120
01:16:20.718935 IP 192.168.43.146.8880 > 192.168.43.147.7772: UDP, length 120
01:16:20.756367 IP 192.168.43.147.8880 > 192.168.43.124.7773: UDP, length 120
01:16:20.759830 IP 192.168.43.146.8880 > 192.168.43.147.7772: UDP, length 120
01:16:20.806367 IP 192.168.43.147.8880 > 192.168.43.124.7773: UDP, length 120
01:16:20.819369 IP 192.168.43.146.8880 > 192.168.43.147.7772: UDP, length 120
01:16:20.856370 IP 192.168.43.147.8880 > 192.168.43.124.7773: UDP, length 120
01:16:20.865475 IP 192.168.43.146.8880 > 192.168.43.147.7772: UDP, length 120
01:16:20.906368 IP 192.168.43.147.8880 > 192.168.43.124.7773: UDP, length 120
01:16:20.919638 IP 192.168.43.146.8880 > 192.168.43.147.7772: UDP, length 120
01:16:20.956365 IP 192.168.43.147.8880 > 192.168.43.124.7773: UDP, length 120
01:16:20.960471 IP 192.168.43.146.8880 > 192.168.43.147.7772: UDP, length 120
01:16:21.006364 IP 192.168.43.147.8880 > 192.168.43.124.7773: UDP, length 120
01:16:21.019287 IP 192.168.43.146.8880 > 192.168.43.147.7772: UDP, length 120
01:16:21.056366 IP 192.168.43.147.8880 > 192.168.43.124.7773: UDP, length 120
01:16:21.059932 IP 192.168.43.146.8880 > 192.168.43.147.7772: UDP, length 120
01:16:21.106363 IP 192.168.43.147.8880 > 192.168.43.124.7773: UDP, length 120
01:16:21.120002 IP 192.168.43.146.8880 > 192.168.43.147.7772: UDP, length 120
01:16:21.156363 IP 192.168.43.147.8880 > 192.168.43.124.7773: UDP, length 120
01:16:21.159761 IP 192.168.43.146.8880 > 192.168.43.147.7772: UDP, length 120
01:16:21.206363 IP 192.168.43.147.8880 > 192.168.43.124.7773: UDP, length 120
01:16:21.220267 IP 192.168.43.146.8880 > 192.168.43.147.7772: UDP, length 120
01:16:21.256364 IP 192.168.43.147.8880 > 192.168.43.124.7773: UDP, length 120
01:16:21.260666 IP 192.168.43.146.8880 > 192.168.43.147.7772: UDP, length 120
01:16:21.306370 IP 192.168.43.147.8880 > 192.168.43.124.7773: UDP, length 120
01:16:21.341725 IP 192.168.43.146.8880 > 192.168.43.147.7772: UDP, length 120
01:16:21.356374 IP 192.168.43.147.8880 > 192.168.43.124.7773: UDP, length 120
01:16:21.361733 IP 192.168.43.146.8880 > 192.168.43.147.7772: UDP, length 120
01:16:21.406366 IP 192.168.43.147.8880 > 192.168.43.124.7773: UDP, length 120
01:16:21.420297 IP 192.168.43.146.8880 > 192.168.43.147.7772: UDP, length 120
01:16:21.456365 IP 192.168.43.147.8880 > 192.168.43.124.7773: UDP, length 120
01:16:21.461994 IP 192.168.43.146.8880 > 192.168.43.147.7772: UDP, length 120
01:16:21.506417 IP 192.168.43.147.8880 > 192.168.43.124.7773: UDP, length 120
01:16:21.519748 IP 192.168.43.146.8880 > 192.168.43.147.7772: UDP, length 120
01:16:21.556377 IP 192.168.43.147.8880 > 192.168.43.124.7773: UDP, length 120
01:16:21.563147 IP 192.168.43.146.8880 > 192.168.43.147.7772: UDP, length 120
01:16:21.606366 IP 192.168.43.147.8880 > 192.168.43.124.7773: UDP, length 120
01:16:21.610414 IP 192.168.43.146.8880 > 192.168.43.147.7772: UDP, length 120
01:16:21.656364 IP 192.168.43.147.8880 > 192.168.43.124.7773: UDP, length 120
01:16:21.676152 IP 192.168.43.146.8880 > 192.168.43.147.7772: UDP, length 120
01:16:21.706365 IP 192.168.43.147.8880 > 192.168.43.124.7773: UDP, length 120
01:16:21.712291 IP 192.168.43.146.8880 > 192.168.43.147.7772: UDP, length 120
01:16:21.756438 IP 192.168.43.147.8880 > 192.168.43.124.7773: UDP, length 120
01:16:21.769541 IP 192.168.43.146.8880 > 192.168.43.147.7772: UDP, length 120
01:16:21.806481 IP 192.168.43.147.8880 > 192.168.43.124.7773: UDP, length 120
01:16:21.810776 IP 192.168.43.146.8880 > 192.168.43.147.7772: UDP, length 120
01:16:21.856452 IP 192.168.43.147.8880 > 192.168.43.124.7773: UDP, length 120
01:16:21.870479 IP 192.168.43.146.8880 > 192.168.43.147.7772: UDP, length 120
01:16:21.906406 IP 192.168.43.147.8880 > 192.168.43.124.7773: UDP, length 120
01:16:21.912321 IP 192.168.43.146.8880 > 192.168.43.147.7772: UDP, length 120
01:16:21.956425 IP 192.168.43.147.8880 > 192.168.43.124.7773: UDP, length 120
01:16:21.972681 IP 192.168.43.146.8880 > 192.168.43.147.7772: UDP, length 120
01:16:22.006427 IP 192.168.43.147.8880 > 192.168.43.124.7773: UDP, length 120
01:16:22.012608 IP 192.168.43.146.8880 > 192.168.43.147.7772: UDP, length 120
01:16:22.056427 IP 192.168.43.147.8880 > 192.168.43.124.7773: UDP, length 120
01:16:22.068667 IP 192.168.43.146.8880 > 192.168.43.147.7772: UDP, length 120
01:16:22.106419 IP 192.168.43.147.8880 > 192.168.43.124.7773: UDP, length 120
01:16:22.156410 IP 192.168.43.147.8880 > 192.168.43.124.7773: UDP, length 120
01:16:22.206422 IP 192.168.43.147.8880 > 192.168.43.124.7773: UDP, length 120
01:16:22.230916 IP 192.168.43.146.8880 > 192.168.43.147.7772: UDP, length 120
01:16:22.231152 IP 192.168.43.146.8880 > 192.168.43.147.7772: UDP, length 120
01:16:22.231261 IP 192.168.43.146.8880 > 192.168.43.147.7772: UDP, length 120
01:16:22.256385 IP 192.168.43.147.8880 > 192.168.43.124.7773: UDP, length 120
01:16:22.260166 IP 192.168.43.146.8880 > 192.168.43.147.7772: UDP, length 120
01:16:22.306347 IP 192.168.43.147.8880 > 192.168.43.124.7773: UDP, length 120
01:16:22.319967 IP 192.168.43.146.8880 > 192.168.43.147.7772: UDP, length 120
01:16:22.356344 IP 192.168.43.147.8880 > 192.168.43.124.7773: UDP, length 120
01:16:22.361881 IP 192.168.43.146.8880 > 192.168.43.147.7772: UDP, length 120
01:16:22.406349 IP 192.168.43.147.8880 > 192.168.43.124.7773: UDP, length 120
01:16:22.421927 IP 192.168.43.146.8880 > 192.168.43.147.7772: UDP, length 120
01:16:22.456341 IP 192.168.43.147.8880 > 192.168.43.124.7773: UDP, length 120
01:16:22.461426 IP 192.168.43.146.8880 > 192.168.43.147.7772: UDP, length 120
01:16:22.506340 IP 192.168.43.147.8880 > 192.168.43.124.7773: UDP, length 120
01:16:22.519159 IP 192.168.43.146.8880 > 192.168.43.147.7772: UDP, length 120
01:16:22.556339 IP 192.168.43.147.8880 > 192.168.43.124.7773: UDP, length 120
01:16:22.565051 IP 192.168.43.146.8880 > 192.168.43.147.7772: UDP, length 120
01:16:22.606341 IP 192.168.43.147.8880 > 192.168.43.124.7773: UDP, length 120
01:16:22.633395 IP 192.168.43.146.8880 > 192.168.43.147.7772: UDP, length 120
01:16:22.656340 IP 192.168.43.147.8880 > 192.168.43.124.7773: UDP, length 120
01:16:22.699694 IP 192.168.43.146.8880 > 192.168.43.147.7772: UDP, length 120
01:16:22.706339 IP 192.168.43.147.8880 > 192.168.43.124.7773: UDP, length 120
01:16:22.742620 IP 192.168.43.146.8880 > 192.168.43.147.7772: UDP, length 120
01:16:22.756337 IP 192.168.43.147.8880 > 192.168.43.124.7773: UDP, length 120
01:16:22.781491 IP 192.168.43.146.8880 > 192.168.43.147.7772: UDP, length 120
01:16:22.806339 IP 192.168.43.147.8880 > 192.168.43.124.7773: UDP, length 120
01:16:22.824132 IP 192.168.43.146.8880 > 192.168.43.147.7772: UDP, length 120
01:16:22.856345 IP 192.168.43.147.8880 > 192.168.43.124.7773: UDP, length 120
01:16:22.873050 IP 192.168.43.146.8880 > 192.168.43.147.7772: UDP, length 120
01:16:22.906342 IP 192.168.43.147.8880 > 192.168.43.124.7773: UDP, length 120
01:16:22.911294 IP 192.168.43.146.8880 > 192.168.43.147.7772: UDP, length 120
01:16:22.956340 IP 192.168.43.147.8880 > 192.168.43.124.7773: UDP, length 120
01:16:22.969030 IP 192.168.43.146.8880 > 192.168.43.147.7772: UDP, length 120
01:16:23.006378 IP 192.168.43.147.8880 > 192.168.43.124.7773: UDP, length 120
01:16:23.049958 IP 192.168.43.146.8880 > 192.168.43.147.7772: UDP, length 120
01:16:23.056345 IP 192.168.43.147.8880 > 192.168.43.124.7773: UDP, length 120
01:16:23.064888 IP 192.168.43.146.8880 > 192.168.43.147.7772: UDP, length 120
01:16:23.106341 IP 192.168.43.147.8880 > 192.168.43.124.7773: UDP, length 120
01:16:23.154888 IP 192.168.43.146.8880 > 192.168.43.147.7772: UDP, length 120
01:16:23.156336 IP 192.168.43.147.8880 > 192.168.43.124.7773: UDP, length 120
01:16:23.206338 IP 192.168.43.147.8880 > 192.168.43.124.7773: UDP, length 120
01:16:23.214007 IP 192.168.43.146.8880 > 192.168.43.147.7772: UDP, length 120
01:16:23.220849 IP 192.168.43.146.8880 > 192.168.43.147.7772: UDP, length 120
01:16:23.256339 IP 192.168.43.147.8880 > 192.168.43.124.7773: UDP, length 120
01:16:23.260203 IP 192.168.43.146.8880 > 192.168.43.147.7772: UDP, length 120
01:16:23.306311 IP 192.168.43.147.8880 > 192.168.43.124.7773: UDP, length 120
01:16:23.321869 IP 192.168.43.146.8880 > 192.168.43.147.7772: UDP, length 120
01:16:23.356340 IP 192.168.43.147.8880 > 192.168.43.124.7773: UDP, length 120
01:16:23.361571 IP 192.168.43.146.8880 > 192.168.43.147.7772: UDP, length 120
01:16:23.406341 IP 192.168.43.147.8880 > 192.168.43.124.7773: UDP, length 120
01:16:23.456339 IP 192.168.43.147.8880 > 192.168.43.124.7773: UDP, length 120
01:16:23.506343 IP 192.168.43.147.8880 > 192.168.43.124.7773: UDP, length 120
01:16:23.506443 IP 192.168.43.146.8880 > 192.168.43.147.7772: UDP, length 120
01:16:23.541112 IP 192.168.43.146.8880 > 192.168.43.147.7772: UDP, length 120
01:16:23.546231 IP 192.168.43.146.8880 > 192.168.43.147.7772: UDP, length 120
01:16:23.556340 IP 192.168.43.147.8880 > 192.168.43.124.7773: UDP, length 120
01:16:23.585237 IP 192.168.43.146.8880 > 192.168.43.147.7772: UDP, length 120
01:16:23.606341 IP 192.168.43.147.8880 > 192.168.43.124.7773: UDP, length 120
01:16:23.611968 IP 192.168.43.146.8880 > 192.168.43.147.7772: UDP, length 120
01:16:23.656341 IP 192.168.43.147.8880 > 192.168.43.124.7773: UDP, length 120
01:16:23.663747 IP 192.168.43.146.8880 > 192.168.43.147.7772: UDP, length 120
01:16:23.706341 IP 192.168.43.147.8880 > 192.168.43.124.7773: UDP, length 120
01:16:23.738647 IP 192.168.43.146.8880 > 192.168.43.147.7772: UDP, length 120
01:16:23.756339 IP 192.168.43.147.8880 > 192.168.43.124.7773: UDP, length 120
01:16:23.760836 IP 192.168.43.146.8880 > 192.168.43.147.7772: UDP, length 120
01:16:23.806340 IP 192.168.43.147.8880 > 192.168.43.124.7773: UDP, length 120
01:16:23.819074 IP 192.168.43.146.8880 > 192.168.43.147.7772: UDP, length 120
01:16:23.856343 IP 192.168.43.147.8880 > 192.168.43.124.7773: UDP, length 120
01:16:23.899452 IP 192.168.43.146.8880 > 192.168.43.147.7772: UDP, length 120
01:16:23.906345 IP 192.168.43.147.8880 > 192.168.43.124.7773: UDP, length 120
01:16:23.924230 IP 192.168.43.146.8880 > 192.168.43.147.7772: UDP, length 120
01:16:23.956345 IP 192.168.43.147.8880 > 192.168.43.124.7773: UDP, length 120
01:16:23.976294 IP 192.168.43.146.8880 > 192.168.43.147.7772: UDP, length 120
01:16:24.006344 IP 192.168.43.147.8880 > 192.168.43.124.7773: UDP, length 120
01:16:24.012383 IP 192.168.43.146.8880 > 192.168.43.147.7772: UDP, length 120
01:16:24.056341 IP 192.168.43.147.8880 > 192.168.43.124.7773: UDP, length 120
01:16:24.073309 IP 192.168.43.146.8880 > 192.168.43.147.7772: UDP, length 120
01:16:24.106340 IP 192.168.43.147.8880 > 192.168.43.124.7773: UDP, length 120
01:16:24.113676 IP 192.168.43.146.8880 > 192.168.43.147.7772: UDP, length 120
01:16:24.156338 IP 192.168.43.147.8880 > 192.168.43.124.7773: UDP, length 120
01:16:24.169365 IP 192.168.43.146.8880 > 192.168.43.147.7772: UDP, length 120
01:16:24.206340 IP 192.168.43.147.8880 > 192.168.43.124.7773: UDP, length 120
01:16:24.215735 IP 192.168.43.146.8880 > 192.168.43.147.7772: UDP, length 120
01:16:24.256339 IP 192.168.43.147.8880 > 192.168.43.124.7773: UDP, length 120
01:16:24.269314 IP 192.168.43.146.8880 > 192.168.43.147.7772: UDP, length 120
01:16:24.306340 IP 192.168.43.147.8880 > 192.168.43.124.7773: UDP, length 120
01:16:24.310482 IP 192.168.43.146.8880 > 192.168.43.147.7772: UDP, length 120
01:16:24.356339 IP 192.168.43.147.8880 > 192.168.43.124.7773: UDP, length 120
01:16:24.368887 IP 192.168.43.146.8880 > 192.168.43.147.7772: UDP, length 120
01:16:24.406339 IP 192.168.43.147.8880 > 192.168.43.124.7773: UDP, length 120
01:16:24.413841 IP 192.168.43.146.8880 > 192.168.43.147.7772: UDP, length 120
01:16:24.456342 IP 192.168.43.147.8880 > 192.168.43.124.7773: UDP, length 120
01:16:24.470094 IP 192.168.43.146.8880 > 192.168.43.147.7772: UDP, length 120
01:16:24.506377 IP 192.168.43.147.8880 > 192.168.43.124.7773: UDP, length 120
01:16:24.511411 IP 192.168.43.146.8880 > 192.168.43.147.7772: UDP, length 120
01:16:24.556347 IP 192.168.43.147.8880 > 192.168.43.124.7773: UDP, length 120
01:16:24.572287 IP 192.168.43.146.8880 > 192.168.43.147.7772: UDP, length 120
01:16:24.606343 IP 192.168.43.147.8880 > 192.168.43.124.7773: UDP, length 120
01:16:24.611606 IP 192.168.43.146.8880 > 192.168.43.147.7772: UDP, length 120
01:16:24.656339 IP 192.168.43.147.8880 > 192.168.43.124.7773: UDP, length 120
01:16:24.682583 IP 192.168.43.146.8880 > 192.168.43.147.7772: UDP, length 120
01:16:24.706339 IP 192.168.43.147.8880 > 192.168.43.124.7773: UDP, length 120
01:16:24.709579 IP 192.168.43.146.8880 > 192.168.43.147.7772: UDP, length 120
01:16:24.756339 IP 192.168.43.147.8880 > 192.168.43.124.7773: UDP, length 120
01:16:24.768805 IP 192.168.43.146.8880 > 192.168.43.147.7772: UDP, length 120
01:16:24.806339 IP 192.168.43.147.8880 > 192.168.43.124.7773: UDP, length 120
01:16:24.810170 IP 192.168.43.146.8880 > 192.168.43.147.7772: UDP, length 120
01:16:24.856343 IP 192.168.43.147.8880 > 192.168.43.124.7773: UDP, length 120
01:16:24.869143 IP 192.168.43.146.8880 > 192.168.43.147.7772: UDP, length 120
01:16:24.906346 IP 192.168.43.147.8880 > 192.168.43.124.7773: UDP, length 120
01:16:24.910009 IP 192.168.43.146.8880 > 192.168.43.147.7772: UDP, length 120
01:16:24.956340 IP 192.168.43.147.8880 > 192.168.43.124.7773: UDP, length 120
01:16:24.969632 IP 192.168.43.146.8880 > 192.168.43.147.7772: UDP, length 120
01:16:25.006340 IP 192.168.43.147.8880 > 192.168.43.124.7773: UDP, length 120
01:16:25.010113 IP 192.168.43.146.8880 > 192.168.43.147.7772: UDP, length 120
01:16:25.056340 IP 192.168.43.147.8880 > 192.168.43.124.7773: UDP, length 120
01:16:25.072503 IP 192.168.43.146.8880 > 192.168.43.147.7772: UDP, length 120
01:16:25.106339 IP 192.168.43.147.8880 > 192.168.43.124.7773: UDP, length 120
01:16:25.110665 IP 192.168.43.146.8880 > 192.168.43.147.7772: UDP, length 120
01:16:25.156339 IP 192.168.43.147.8880 > 192.168.43.124.7773: UDP, length 120
01:16:25.168690 IP 192.168.43.146.8880 > 192.168.43.147.7772: UDP, length 120
01:16:25.206339 IP 192.168.43.147.8880 > 192.168.43.124.7773: UDP, length 120
01:16:25.210267 IP 192.168.43.146.8880 > 192.168.43.147.7772: UDP, length 120
01:16:25.256342 IP 192.168.43.147.8880 > 192.168.43.124.7773: UDP, length 120
01:16:25.269001 IP 192.168.43.146.8880 > 192.168.43.147.7772: UDP, length 120
01:16:25.306340 IP 192.168.43.147.8880 > 192.168.43.124.7773: UDP, length 120
01:16:25.312905 IP 192.168.43.146.8880 > 192.168.43.147.7772: UDP, length 120
01:16:25.356339 IP 192.168.43.147.8880 > 192.168.43.124.7773: UDP, length 120
01:16:25.368655 IP 192.168.43.146.8880 > 192.168.43.147.7772: UDP, length 120
01:16:25.406342 IP 192.168.43.147.8880 > 192.168.43.124.7773: UDP, length 120
01:16:25.410190 IP 192.168.43.146.8880 > 192.168.43.147.7772: UDP, length 120
01:16:25.456340 IP 192.168.43.147.8880 > 192.168.43.124.7773: UDP, length 120
01:16:25.474105 IP 192.168.43.146.8880 > 192.168.43.147.7772: UDP, length 120
01:16:25.506340 IP 192.168.43.147.8880 > 192.168.43.124.7773: UDP, length 120
01:16:25.512104 IP 192.168.43.146.8880 > 192.168.43.147.7772: UDP, length 120
01:16:25.556348 IP 192.168.43.147.8880 > 192.168.43.124.7773: UDP, length 120
01:16:25.569304 IP 192.168.43.146.8880 > 192.168.43.147.7772: UDP, length 120
01:16:25.606344 IP 192.168.43.147.8880 > 192.168.43.124.7773: UDP, length 120
01:16:25.610782 IP 192.168.43.146.8880 > 192.168.43.147.7772: UDP, length 120
01:16:25.656341 IP 192.168.43.147.8880 > 192.168.43.124.7773: UDP, length 120
01:16:25.669229 IP 192.168.43.146.8880 > 192.168.43.147.7772: UDP, length 120
01:16:25.706340 IP 192.168.43.147.8880 > 192.168.43.124.7773: UDP, length 120
01:16:25.713073 IP 192.168.43.146.8880 > 192.168.43.147.7772: UDP, length 120
01:16:25.756338 IP 192.168.43.147.8880 > 192.168.43.124.7773: UDP, length 120
01:16:25.768963 IP 192.168.43.146.8880 > 192.168.43.147.7772: UDP, length 120
01:16:25.806339 IP 192.168.43.147.8880 > 192.168.43.124.7773: UDP, length 120
01:16:25.811893 IP 192.168.43.146.8880 > 192.168.43.147.7772: UDP, length 120
01:16:25.856342 IP 192.168.43.147.8880 > 192.168.43.124.7773: UDP, length 120
01:16:25.869011 IP 192.168.43.146.8880 > 192.168.43.147.7772: UDP, length 120
01:16:25.906342 IP 192.168.43.147.8880 > 192.168.43.124.7773: UDP, length 120
01:16:25.910325 IP 192.168.43.146.8880 > 192.168.43.147.7772: UDP, length 120
01:16:25.956342 IP 192.168.43.147.8880 > 192.168.43.124.7773: UDP, length 120
01:16:25.975090 IP 192.168.43.146.8880 > 192.168.43.147.7772: UDP, length 120
01:16:26.006380 IP 192.168.43.147.8880 > 192.168.43.124.7773: UDP, length 120
01:16:26.010928 IP 192.168.43.146.8880 > 192.168.43.147.7772: UDP, length 120
01:16:26.056369 IP 192.168.43.147.8880 > 192.168.43.124.7773: UDP, length 120
01:16:26.069019 IP 192.168.43.146.8880 > 192.168.43.147.7772: UDP, length 120
01:16:26.106346 IP 192.168.43.147.8880 > 192.168.43.124.7773: UDP, length 120
01:16:26.111043 IP 192.168.43.146.8880 > 192.168.43.147.7772: UDP, length 120
01:16:26.156340 IP 192.168.43.147.8880 > 192.168.43.124.7773: UDP, length 120
01:16:26.173309 IP 192.168.43.146.8880 > 192.168.43.147.7772: UDP, length 120
01:16:26.206340 IP 192.168.43.147.8880 > 192.168.43.124.7773: UDP, length 120
01:16:26.213302 IP 192.168.43.146.8880 > 192.168.43.147.7772: UDP, length 120
01:16:26.256339 IP 192.168.43.147.8880 > 192.168.43.124.7773: UDP, length 120
01:16:26.268746 IP 192.168.43.146.8880 > 192.168.43.147.7772: UDP, length 120
01:16:26.306341 IP 192.168.43.147.8880 > 192.168.43.124.7773: UDP, length 120
01:16:26.349525 IP 192.168.43.146.8880 > 192.168.43.147.7772: UDP, length 120
01:16:26.356337 IP 192.168.43.147.8880 > 192.168.43.124.7773: UDP, length 120
01:16:26.363060 IP 192.168.43.146.8880 > 192.168.43.147.7772: UDP, length 120
01:16:26.406339 IP 192.168.43.147.8880 > 192.168.43.124.7773: UDP, length 120
01:16:26.423937 IP 192.168.43.146.8880 > 192.168.43.147.7772: UDP, length 120
01:16:26.456339 IP 192.168.43.147.8880 > 192.168.43.124.7773: UDP, length 120
01:16:26.465239 IP 192.168.43.146.8880 > 192.168.43.147.7772: UDP, length 120
01:16:26.506339 IP 192.168.43.147.8880 > 192.168.43.124.7773: UDP, length 120
01:16:26.519007 IP 192.168.43.146.8880 > 192.168.43.147.7772: UDP, length 120
01:16:26.556339 IP 192.168.43.147.8880 > 192.168.43.124.7773: UDP, length 120
01:16:26.561005 IP 192.168.43.146.8880 > 192.168.43.147.7772: UDP, length 120
01:16:26.606345 IP 192.168.43.147.8880 > 192.168.43.124.7773: UDP, length 120
01:16:26.620906 IP 192.168.43.146.8880 > 192.168.43.147.7772: UDP, length 120
01:16:26.656348 IP 192.168.43.147.8880 > 192.168.43.124.7773: UDP, length 120
01:16:26.669047 IP 192.168.43.146.8880 > 192.168.43.147.7772: UDP, length 120
01:16:26.706342 IP 192.168.43.147.8880 > 192.168.43.124.7773: UDP, length 120
01:16:26.723041 IP 192.168.43.146.8880 > 192.168.43.147.7772: UDP, length 120
01:16:26.756340 IP 192.168.43.147.8880 > 192.168.43.124.7773: UDP, length 120
01:16:26.763189 IP 192.168.43.146.8880 > 192.168.43.147.7772: UDP, length 120
01:16:26.806340 IP 192.168.43.147.8880 > 192.168.43.124.7773: UDP, length 120
01:16:26.819158 IP 192.168.43.146.8880 > 192.168.43.147.7772: UDP, length 120
01:16:26.856356 IP 192.168.43.147.8880 > 192.168.43.124.7773: UDP, length 120
01:16:26.860151 IP 192.168.43.146.8880 > 192.168.43.147.7772: UDP, length 120
01:16:26.906374 IP 192.168.43.147.8880 > 192.168.43.124.7773: UDP, length 120
01:16:26.919119 IP 192.168.43.146.8880 > 192.168.43.147.7772: UDP, length 120
01:16:26.956377 IP 192.168.43.147.8880 > 192.168.43.124.7773: UDP, length 120
01:16:26.960303 IP 192.168.43.146.8880 > 192.168.43.147.7772: UDP, length 120
01:16:27.006371 IP 192.168.43.147.8880 > 192.168.43.124.7773: UDP, length 120
01:16:27.019506 IP 192.168.43.146.8880 > 192.168.43.147.7772: UDP, length 120
01:16:27.056368 IP 192.168.43.147.8880 > 192.168.43.124.7773: UDP, length 120
01:16:27.065781 IP 192.168.43.146.8880 > 192.168.43.147.7772: UDP, length 120
01:16:27.106365 IP 192.168.43.147.8880 > 192.168.43.124.7773: UDP, length 120
01:16:27.120669 IP 192.168.43.146.8880 > 192.168.43.147.7772: UDP, length 120
01:16:27.156365 IP 192.168.43.147.8880 > 192.168.43.124.7773: UDP, length 120
01:16:27.160195 IP 192.168.43.146.8880 > 192.168.43.147.7772: UDP, length 120
01:16:27.206363 IP 192.168.43.147.8880 > 192.168.43.124.7773: UDP, length 120
01:16:27.220494 IP 192.168.43.146.8880 > 192.168.43.147.7772: UDP, length 120
01:16:27.256450 IP 192.168.43.147.8880 > 192.168.43.124.7773: UDP, length 120
01:16:27.260611 IP 192.168.43.146.8880 > 192.168.43.147.7772: UDP, length 120
01:16:27.306529 IP 192.168.43.147.8880 > 192.168.43.124.7773: UDP, length 120
01:16:27.319204 IP 192.168.43.146.8880 > 192.168.43.147.7772: UDP, length 120
01:16:27.356458 IP 192.168.43.147.8880 > 192.168.43.124.7773: UDP, length 120
01:16:27.360502 IP 192.168.43.146.8880 > 192.168.43.147.7772: UDP, length 120
01:16:27.406426 IP 192.168.43.147.8880 > 192.168.43.124.7773: UDP, length 120
01:16:27.418629 IP 192.168.43.146.8880 > 192.168.43.147.7772: UDP, length 120
01:16:27.456400 IP 192.168.43.147.8880 > 192.168.43.124.7773: UDP, length 120
01:16:27.506430 IP 192.168.43.147.8880 > 192.168.43.124.7773: UDP, length 120
01:16:27.518568 IP 192.168.43.146.8880 > 192.168.43.147.7772: UDP, length 120
01:16:27.519386 IP 192.168.43.146.8880 > 192.168.43.147.7772: UDP, length 120
01:16:27.556418 IP 192.168.43.147.8880 > 192.168.43.124.7773: UDP, length 120
01:16:27.560592 IP 192.168.43.146.8880 > 192.168.43.147.7772: UDP, length 120
