23:02:23.573941 IP 192.168.43.124.8880 > 192.168.43.195.7771: UDP, length 120
23:02:23.624087 IP 192.168.43.124.8880 > 192.168.43.195.7771: UDP, length 120
23:02:23.674266 IP 192.168.43.124.8880 > 192.168.43.195.7771: UDP, length 120
23:02:23.724089 IP 192.168.43.124.8880 > 192.168.43.195.7771: UDP, length 120
23:02:23.774136 IP 192.168.43.124.8880 > 192.168.43.195.7771: UDP, length 120
23:02:23.824614 IP 192.168.43.124.8880 > 192.168.43.195.7771: UDP, length 120
23:02:23.874137 IP 192.168.43.124.8880 > 192.168.43.195.7771: UDP, length 120
23:02:23.924139 IP 192.168.43.124.8880 > 192.168.43.195.7771: UDP, length 120
23:02:23.974136 IP 192.168.43.124.8880 > 192.168.43.195.7771: UDP, length 120
23:02:24.024138 IP 192.168.43.124.8880 > 192.168.43.195.7771: UDP, length 120
23:02:24.074138 IP 192.168.43.124.8880 > 192.168.43.195.7771: UDP, length 120
23:02:24.124086 IP 192.168.43.124.8880 > 192.168.43.195.7771: UDP, length 120
23:02:24.174086 IP 192.168.43.124.8880 > 192.168.43.195.7771: UDP, length 120
23:02:24.224087 IP 192.168.43.124.8880 > 192.168.43.195.7771: UDP, length 120
23:02:24.274086 IP 192.168.43.124.8880 > 192.168.43.195.7771: UDP, length 120
23:02:24.324026 IP 192.168.43.124.8880 > 192.168.43.195.7771: UDP, length 120
23:02:24.374011 IP 192.168.43.124.8880 > 192.168.43.195.7771: UDP, length 120
23:02:24.424049 IP 192.168.43.124.8880 > 192.168.43.195.7771: UDP, length 120
23:02:24.474086 IP 192.168.43.124.8880 > 192.168.43.195.7771: UDP, length 120
23:02:24.524088 IP 192.168.43.124.8880 > 192.168.43.195.7771: UDP, length 120
23:02:24.574088 IP 192.168.43.124.8880 > 192.168.43.195.7771: UDP, length 120
23:02:24.624087 IP 192.168.43.124.8880 > 192.168.43.195.7771: UDP, length 120
23:02:24.674088 IP 192.168.43.124.8880 > 192.168.43.195.7771: UDP, length 120
23:02:24.724089 IP 192.168.43.124.8880 > 192.168.43.195.7771: UDP, length 120
23:02:24.774088 IP 192.168.43.124.8880 > 192.168.43.195.7771: UDP, length 120
23:02:24.824087 IP 192.168.43.124.8880 > 192.168.43.195.7771: UDP, length 120
23:02:24.874088 IP 192.168.43.124.8880 > 192.168.43.195.7771: UDP, length 120
23:02:24.924087 IP 192.168.43.124.8880 > 192.168.43.195.7771: UDP, length 120
23:02:24.974087 IP 192.168.43.124.8880 > 192.168.43.195.7771: UDP, length 120
23:02:25.024087 IP 192.168.43.124.8880 > 192.168.43.195.7771: UDP, length 120
23:02:25.074090 IP 192.168.43.124.8880 > 192.168.43.195.7771: UDP, length 120
23:02:25.124087 IP 192.168.43.124.8880 > 192.168.43.195.7771: UDP, length 120
23:02:25.174089 IP 192.168.43.124.8880 > 192.168.43.195.7771: UDP, length 120
23:02:25.224050 IP 192.168.43.124.8880 > 192.168.43.195.7771: UDP, length 120
23:02:25.274087 IP 192.168.43.124.8880 > 192.168.43.195.7771: UDP, length 120
23:02:25.324141 IP 192.168.43.124.8880 > 192.168.43.195.7771: UDP, length 120
23:02:25.374140 IP 192.168.43.124.8880 > 192.168.43.195.7771: UDP, length 120
23:02:25.424137 IP 192.168.43.124.8880 > 192.168.43.195.7771: UDP, length 120
23:02:25.474138 IP 192.168.43.124.8880 > 192.168.43.195.7771: UDP, length 120
23:02:25.524139 IP 192.168.43.124.8880 > 192.168.43.195.7771: UDP, length 120
23:02:25.574347 IP 192.168.43.124.8880 > 192.168.43.195.7771: UDP, length 120
23:02:25.624136 IP 192.168.43.124.8880 > 192.168.43.195.7771: UDP, length 120
23:02:25.674338 IP 192.168.43.124.8880 > 192.168.43.195.7771: UDP, length 120
23:02:25.724139 IP 192.168.43.124.8880 > 192.168.43.195.7771: UDP, length 120
23:02:25.774138 IP 192.168.43.124.8880 > 192.168.43.195.7771: UDP, length 120
23:02:25.824853 IP 192.168.43.124.8880 > 192.168.43.195.7771: UDP, length 120
23:02:25.874179 IP 192.168.43.124.8880 > 192.168.43.195.7771: UDP, length 120
23:02:25.924142 IP 192.168.43.124.8880 > 192.168.43.195.7771: UDP, length 120
23:02:25.974664 IP 192.168.43.124.8880 > 192.168.43.195.7771: UDP, length 120
23:02:26.024857 IP 192.168.43.124.8880 > 192.168.43.195.7771: UDP, length 120
23:02:26.074140 IP 192.168.43.124.8880 > 192.168.43.195.7771: UDP, length 120
23:02:26.124084 IP 192.168.43.124.8880 > 192.168.43.195.7771: UDP, length 120
23:02:26.174090 IP 192.168.43.124.8880 > 192.168.43.195.7771: UDP, length 120
23:02:26.224085 IP 192.168.43.124.8880 > 192.168.43.195.7771: UDP, length 120
23:02:26.274136 IP 192.168.43.124.8880 > 192.168.43.195.7771: UDP, length 120
23:02:26.324138 IP 192.168.43.124.8880 > 192.168.43.195.7771: UDP, length 120
23:02:26.374138 IP 192.168.43.124.8880 > 192.168.43.195.7771: UDP, length 120
23:02:26.424134 IP 192.168.43.124.8880 > 192.168.43.195.7771: UDP, length 120
23:02:26.474140 IP 192.168.43.124.8880 > 192.168.43.195.7771: UDP, length 120
23:02:26.524140 IP 192.168.43.124.8880 > 192.168.43.195.7771: UDP, length 120
23:02:26.574137 IP 192.168.43.124.8880 > 192.168.43.195.7771: UDP, length 120
23:02:26.624141 IP 192.168.43.124.8880 > 192.168.43.195.7771: UDP, length 120
23:02:26.674140 IP 192.168.43.124.8880 > 192.168.43.195.7771: UDP, length 120
23:02:26.724139 IP 192.168.43.124.8880 > 192.168.43.195.7771: UDP, length 120
23:02:26.774138 IP 192.168.43.124.8880 > 192.168.43.195.7771: UDP, length 120
23:02:26.824093 IP 192.168.43.124.8880 > 192.168.43.195.7771: UDP, length 120
23:02:26.874092 IP 192.168.43.124.8880 > 192.168.43.195.7771: UDP, length 120
23:02:26.924141 IP 192.168.43.124.8880 > 192.168.43.195.7771: UDP, length 120
23:02:26.974139 IP 192.168.43.124.8880 > 192.168.43.195.7771: UDP, length 120
23:02:27.024142 IP 192.168.43.124.8880 > 192.168.43.195.7771: UDP, length 120
23:02:27.074179 IP 192.168.43.124.8880 > 192.168.43.195.7771: UDP, length 120
23:02:27.124085 IP 192.168.43.124.8880 > 192.168.43.195.7771: UDP, length 120
23:02:27.174091 IP 192.168.43.124.8880 > 192.168.43.195.7771: UDP, length 120
23:02:27.224088 IP 192.168.43.124.8880 > 192.168.43.195.7771: UDP, length 120
23:02:27.274139 IP 192.168.43.124.8880 > 192.168.43.195.7771: UDP, length 120
23:02:27.324140 IP 192.168.43.124.8880 > 192.168.43.195.7771: UDP, length 120
23:02:27.374859 IP 192.168.43.124.8880 > 192.168.43.195.7771: UDP, length 120
23:02:27.424140 IP 192.168.43.124.8880 > 192.168.43.195.7771: UDP, length 120
23:02:27.474186 IP 192.168.43.124.8880 > 192.168.43.195.7771: UDP, length 120
23:02:27.524066 IP 192.168.43.124.8880 > 192.168.43.195.7771: UDP, length 120
23:02:27.574623 IP 192.168.43.124.8880 > 192.168.43.195.7771: UDP, length 120
23:02:27.624087 IP 192.168.43.124.8880 > 192.168.43.195.7771: UDP, length 120
23:02:27.674087 IP 192.168.43.124.8880 > 192.168.43.195.7771: UDP, length 120
23:02:27.724086 IP 192.168.43.124.8880 > 192.168.43.195.7771: UDP, length 120
23:02:27.774089 IP 192.168.43.124.8880 > 192.168.43.195.7771: UDP, length 120
23:02:27.824088 IP 192.168.43.124.8880 > 192.168.43.195.7771: UDP, length 120
23:02:27.874052 IP 192.168.43.124.8880 > 192.168.43.195.7771: UDP, length 120
23:02:27.924087 IP 192.168.43.124.8880 > 192.168.43.195.7771: UDP, length 120
23:02:27.974089 IP 192.168.43.124.8880 > 192.168.43.195.7771: UDP, length 120
23:02:28.024092 IP 192.168.43.124.8880 > 192.168.43.195.7771: UDP, length 120
23:02:28.074090 IP 192.168.43.124.8880 > 192.168.43.195.7771: UDP, length 120
23:02:28.124086 IP 192.168.43.124.8880 > 192.168.43.195.7771: UDP, length 120
23:02:28.174088 IP 192.168.43.124.8880 > 192.168.43.195.7771: UDP, length 120
23:02:28.224084 IP 192.168.43.124.8880 > 192.168.43.195.7771: UDP, length 120
23:02:28.274088 IP 192.168.43.124.8880 > 192.168.43.195.7771: UDP, length 120
23:02:28.324088 IP 192.168.43.124.8880 > 192.168.43.195.7771: UDP, length 120
23:02:28.374088 IP 192.168.43.124.8880 > 192.168.43.195.7771: UDP, length 120
23:02:28.424089 IP 192.168.43.124.8880 > 192.168.43.195.7771: UDP, length 120
23:02:28.474087 IP 192.168.43.124.8880 > 192.168.43.195.7771: UDP, length 120
23:02:28.524089 IP 192.168.43.124.8880 > 192.168.43.195.7771: UDP, length 120
23:02:28.574090 IP 192.168.43.124.8880 > 192.168.43.195.7771: UDP, length 120
23:02:28.624088 IP 192.168.43.124.8880 > 192.168.43.195.7771: UDP, length 120
23:02:28.674089 IP 192.168.43.124.8880 > 192.168.43.195.7771: UDP, length 120
23:02:28.724067 IP 192.168.43.124.8880 > 192.168.43.195.7771: UDP, length 120
23:02:28.774093 IP 192.168.43.124.8880 > 192.168.43.195.7771: UDP, length 120
23:02:28.824087 IP 192.168.43.124.8880 > 192.168.43.195.7771: UDP, length 120
23:02:28.874087 IP 192.168.43.124.8880 > 192.168.43.195.7771: UDP, length 120
23:02:28.924093 IP 192.168.43.124.8880 > 192.168.43.195.7771: UDP, length 120
23:02:28.974092 IP 192.168.43.124.8880 > 192.168.43.195.7771: UDP, length 120
23:02:29.024087 IP 192.168.43.124.8880 > 192.168.43.195.7771: UDP, length 120
23:02:29.074088 IP 192.168.43.124.8880 > 192.168.43.195.7771: UDP, length 120
23:02:29.124084 IP 192.168.43.124.8880 > 192.168.43.195.7771: UDP, length 120
23:02:29.174088 IP 192.168.43.124.8880 > 192.168.43.195.7771: UDP, length 120
23:02:29.224085 IP 192.168.43.124.8880 > 192.168.43.195.7771: UDP, length 120
23:02:29.274134 IP 192.168.43.124.8880 > 192.168.43.195.7771: UDP, length 120
23:02:29.324197 IP 192.168.43.124.8880 > 192.168.43.195.7771: UDP, length 120
23:02:29.374086 IP 192.168.43.124.8880 > 192.168.43.195.7771: UDP, length 120
23:02:29.424071 IP 192.168.43.124.8880 > 192.168.43.195.7771: UDP, length 120
23:02:29.474765 IP 192.168.43.124.8880 > 192.168.43.195.7771: UDP, length 120
23:02:29.524035 IP 192.168.43.124.8880 > 192.168.43.195.7771: UDP, length 120
23:02:29.574086 IP 192.168.43.124.8880 > 192.168.43.195.7771: UDP, length 120
23:02:29.624089 IP 192.168.43.124.8880 > 192.168.43.195.7771: UDP, length 120
23:02:29.674085 IP 192.168.43.124.8880 > 192.168.43.195.7771: UDP, length 120
23:02:29.724087 IP 192.168.43.124.8880 > 192.168.43.195.7771: UDP, length 120
23:02:29.774086 IP 192.168.43.124.8880 > 192.168.43.195.7771: UDP, length 120
23:02:29.824088 IP 192.168.43.124.8880 > 192.168.43.195.7771: UDP, length 120
23:02:29.874084 IP 192.168.43.124.8880 > 192.168.43.195.7771: UDP, length 120
23:02:29.924019 IP 192.168.43.124.8880 > 192.168.43.195.7771: UDP, length 120
23:02:29.974086 IP 192.168.43.124.8880 > 192.168.43.195.7771: UDP, length 120
23:02:30.024032 IP 192.168.43.124.8880 > 192.168.43.195.7771: UDP, length 120
23:02:30.074086 IP 192.168.43.124.8880 > 192.168.43.195.7771: UDP, length 120
23:02:30.124112 IP 192.168.43.124.8880 > 192.168.43.195.7771: UDP, length 120
23:02:30.174109 IP 192.168.43.124.8880 > 192.168.43.195.7771: UDP, length 120
23:02:30.224053 IP 192.168.43.124.8880 > 192.168.43.195.7771: UDP, length 120
23:02:30.274136 IP 192.168.43.124.8880 > 192.168.43.195.7771: UDP, length 120
23:02:30.324136 IP 192.168.43.124.8880 > 192.168.43.195.7771: UDP, length 120
23:02:30.374137 IP 192.168.43.124.8880 > 192.168.43.195.7771: UDP, length 120
23:02:30.424052 IP 192.168.43.124.8880 > 192.168.43.195.7771: UDP, length 120
23:02:30.474135 IP 192.168.43.124.8880 > 192.168.43.195.7771: UDP, length 120
23:02:30.524065 IP 192.168.43.124.8880 > 192.168.43.195.7771: UDP, length 120
23:02:30.574089 IP 192.168.43.124.8880 > 192.168.43.195.7771: UDP, length 120
23:02:30.624088 IP 192.168.43.124.8880 > 192.168.43.195.7771: UDP, length 120
23:02:30.674135 IP 192.168.43.124.8880 > 192.168.43.195.7771: UDP, length 120
23:02:30.724137 IP 192.168.43.124.8880 > 192.168.43.195.7771: UDP, length 120
23:02:30.774136 IP 192.168.43.124.8880 > 192.168.43.195.7771: UDP, length 120
23:02:30.824137 IP 192.168.43.124.8880 > 192.168.43.195.7771: UDP, length 120
23:02:30.874136 IP 192.168.43.124.8880 > 192.168.43.195.7771: UDP, length 120
23:02:30.924138 IP 192.168.43.124.8880 > 192.168.43.195.7771: UDP, length 120
23:02:30.974138 IP 192.168.43.124.8880 > 192.168.43.195.7771: UDP, length 120
23:02:31.024138 IP 192.168.43.124.8880 > 192.168.43.195.7771: UDP, length 120
23:02:31.074137 IP 192.168.43.124.8880 > 192.168.43.195.7771: UDP, length 120
23:02:31.124020 IP 192.168.43.124.8880 > 192.168.43.195.7771: UDP, length 120
23:02:31.174087 IP 192.168.43.124.8880 > 192.168.43.195.7771: UDP, length 120
23:02:31.224132 IP 192.168.43.124.8880 > 192.168.43.195.7771: UDP, length 120
23:02:31.274138 IP 192.168.43.124.8880 > 192.168.43.195.7771: UDP, length 120
23:02:31.324137 IP 192.168.43.124.8880 > 192.168.43.195.7771: UDP, length 120
23:02:31.374137 IP 192.168.43.124.8880 > 192.168.43.195.7771: UDP, length 120
23:02:31.424133 IP 192.168.43.124.8880 > 192.168.43.195.7771: UDP, length 120
23:02:31.474137 IP 192.168.43.124.8880 > 192.168.43.195.7771: UDP, length 120
23:02:31.524137 IP 192.168.43.124.8880 > 192.168.43.195.7771: UDP, length 120
23:02:31.574138 IP 192.168.43.124.8880 > 192.168.43.195.7771: UDP, length 120
23:02:31.624136 IP 192.168.43.124.8880 > 192.168.43.195.7771: UDP, length 120
23:02:31.674135 IP 192.168.43.124.8880 > 192.168.43.195.7771: UDP, length 120
23:02:31.724038 IP 192.168.43.124.8880 > 192.168.43.195.7771: UDP, length 120
23:02:31.774136 IP 192.168.43.124.8880 > 192.168.43.195.7771: UDP, length 120
23:02:31.824052 IP 192.168.43.124.8880 > 192.168.43.195.7771: UDP, length 120
23:02:31.874135 IP 192.168.43.124.8880 > 192.168.43.195.7771: UDP, length 120
23:02:31.924053 IP 192.168.43.124.8880 > 192.168.43.195.7771: UDP, length 120
23:02:31.974136 IP 192.168.43.124.8880 > 192.168.43.195.7771: UDP, length 120
23:02:32.024053 IP 192.168.43.124.8880 > 192.168.43.195.7771: UDP, length 120
23:02:32.074133 IP 192.168.43.124.8880 > 192.168.43.195.7771: UDP, length 120
23:02:32.124131 IP 192.168.43.124.8880 > 192.168.43.195.7771: UDP, length 120
23:02:32.174010 IP 192.168.43.124.8880 > 192.168.43.195.7771: UDP, length 120
23:02:32.224133 IP 192.168.43.124.8880 > 192.168.43.195.7771: UDP, length 120
23:02:32.274136 IP 192.168.43.124.8880 > 192.168.43.195.7771: UDP, length 120
23:02:32.324141 IP 192.168.43.124.8880 > 192.168.43.195.7771: UDP, length 120
23:02:32.374136 IP 192.168.43.124.8880 > 192.168.43.195.7771: UDP, length 120
23:02:32.424099 IP 192.168.43.124.8880 > 192.168.43.195.7771: UDP, length 120
23:02:32.474138 IP 192.168.43.124.8880 > 192.168.43.195.7771: UDP, length 120
23:02:32.524135 IP 192.168.43.124.8880 > 192.168.43.195.7771: UDP, length 120
23:02:32.574135 IP 192.168.43.124.8880 > 192.168.43.195.7771: UDP, length 120
23:02:32.624135 IP 192.168.43.124.8880 > 192.168.43.195.7771: UDP, length 120
23:02:32.674136 IP 192.168.43.124.8880 > 192.168.43.195.7771: UDP, length 120
23:02:32.724135 IP 192.168.43.124.8880 > 192.168.43.195.7771: UDP, length 120
23:02:32.774137 IP 192.168.43.124.8880 > 192.168.43.195.7771: UDP, length 120
23:02:32.824135 IP 192.168.43.124.8880 > 192.168.43.195.7771: UDP, length 120
23:02:32.874137 IP 192.168.43.124.8880 > 192.168.43.195.7771: UDP, length 120
23:02:32.924138 IP 192.168.43.124.8880 > 192.168.43.195.7771: UDP, length 120
23:02:32.974089 IP 192.168.43.124.8880 > 192.168.43.195.7771: UDP, length 120
23:02:33.024091 IP 192.168.43.124.8880 > 192.168.43.195.7771: UDP, length 120
23:02:33.074090 IP 192.168.43.124.8880 > 192.168.43.195.7771: UDP, length 120
23:02:33.124086 IP 192.168.43.124.8880 > 192.168.43.195.7771: UDP, length 120
23:02:33.174086 IP 192.168.43.124.8880 > 192.168.43.195.7771: UDP, length 120
23:02:33.224085 IP 192.168.43.124.8880 > 192.168.43.195.7771: UDP, length 120
23:02:33.274136 IP 192.168.43.124.8880 > 192.168.43.195.7771: UDP, length 120
23:02:33.324094 IP 192.168.43.124.8880 > 192.168.43.195.7771: UDP, length 120
23:02:33.374096 IP 192.168.43.124.8880 > 192.168.43.195.7771: UDP, length 120
23:02:33.424094 IP 192.168.43.124.8880 > 192.168.43.195.7771: UDP, length 120
23:02:33.474135 IP 192.168.43.124.8880 > 192.168.43.195.7771: UDP, length 120
23:02:33.524083 IP 192.168.43.124.8880 > 192.168.43.195.7771: UDP, length 120
23:02:33.574086 IP 192.168.43.124.8880 > 192.168.43.195.7771: UDP, length 120
23:02:33.624087 IP 192.168.43.124.8880 > 192.168.43.195.7771: UDP, length 120
23:02:33.674084 IP 192.168.43.124.8880 > 192.168.43.195.7771: UDP, length 120
23:02:33.724089 IP 192.168.43.124.8880 > 192.168.43.195.7771: UDP, length 120
23:02:33.774087 IP 192.168.43.124.8880 > 192.168.43.195.7771: UDP, length 120
23:02:33.824085 IP 192.168.43.124.8880 > 192.168.43.195.7771: UDP, length 120
23:02:33.874086 IP 192.168.43.124.8880 > 192.168.43.195.7771: UDP, length 120
23:02:33.924088 IP 192.168.43.124.8880 > 192.168.43.195.7771: UDP, length 120
23:02:33.974086 IP 192.168.43.124.8880 > 192.168.43.195.7771: UDP, length 120
23:02:34.024088 IP 192.168.43.124.8880 > 192.168.43.195.7771: UDP, length 120
23:02:34.074086 IP 192.168.43.124.8880 > 192.168.43.195.7771: UDP, length 120
23:02:34.124096 IP 192.168.43.124.8880 > 192.168.43.195.7771: UDP, length 120
23:02:34.174087 IP 192.168.43.124.8880 > 192.168.43.195.7771: UDP, length 120
23:02:34.224087 IP 192.168.43.124.8880 > 192.168.43.195.7771: UDP, length 120
23:02:34.274138 IP 192.168.43.124.8880 > 192.168.43.195.7771: UDP, length 120
23:02:34.324383 IP 192.168.43.124.8880 > 192.168.43.195.7771: UDP, length 120
23:02:34.374137 IP 192.168.43.124.8880 > 192.168.43.195.7771: UDP, length 120
23:02:34.424053 IP 192.168.43.124.8880 > 192.168.43.195.7771: UDP, length 120
23:02:34.474135 IP 192.168.43.124.8880 > 192.168.43.195.7771: UDP, length 120
23:02:34.524083 IP 192.168.43.124.8880 > 192.168.43.195.7771: UDP, length 120
23:02:34.574015 IP 192.168.43.124.8880 > 192.168.43.195.7771: UDP, length 120
23:02:34.624019 IP 192.168.43.124.8880 > 192.168.43.195.7771: UDP, length 120
23:02:34.674084 IP 192.168.43.124.8880 > 192.168.43.195.7771: UDP, length 120
23:02:34.724088 IP 192.168.43.124.8880 > 192.168.43.195.7771: UDP, length 120
23:02:34.774086 IP 192.168.43.124.8880 > 192.168.43.195.7771: UDP, length 120
23:02:34.824084 IP 192.168.43.124.8880 > 192.168.43.195.7771: UDP, length 120
23:02:34.874086 IP 192.168.43.124.8880 > 192.168.43.195.7771: UDP, length 120
23:02:34.924131 IP 192.168.43.124.8880 > 192.168.43.195.7771: UDP, length 120
23:02:34.974139 IP 192.168.43.124.8880 > 192.168.43.195.7771: UDP, length 120
23:02:35.024138 IP 192.168.43.124.8880 > 192.168.43.195.7771: UDP, length 120
23:02:35.074134 IP 192.168.43.124.8880 > 192.168.43.195.7771: UDP, length 120
23:02:35.124132 IP 192.168.43.124.8880 > 192.168.43.195.7771: UDP, length 120
23:02:35.174089 IP 192.168.43.124.8880 > 192.168.43.195.7771: UDP, length 120
23:02:35.224134 IP 192.168.43.124.8880 > 192.168.43.195.7771: UDP, length 120
23:02:35.274086 IP 192.168.43.124.8880 > 192.168.43.195.7771: UDP, length 120
23:02:35.324087 IP 192.168.43.124.8880 > 192.168.43.195.7771: UDP, length 120
23:02:35.374138 IP 192.168.43.124.8880 > 192.168.43.195.7771: UDP, length 120
23:02:35.424137 IP 192.168.43.124.8880 > 192.168.43.195.7771: UDP, length 120
23:02:35.474135 IP 192.168.43.124.8880 > 192.168.43.195.7771: UDP, length 120
23:02:35.524090 IP 192.168.43.124.8880 > 192.168.43.195.7771: UDP, length 120
23:02:35.574091 IP 192.168.43.124.8880 > 192.168.43.195.7771: UDP, length 120
23:02:35.624053 IP 192.168.43.124.8880 > 192.168.43.195.7771: UDP, length 120
23:02:35.674091 IP 192.168.43.124.8880 > 192.168.43.195.7771: UDP, length 120
23:02:35.724089 IP 192.168.43.124.8880 > 192.168.43.195.7771: UDP, length 120
23:02:35.774088 IP 192.168.43.124.8880 > 192.168.43.195.7771: UDP, length 120
23:02:35.824088 IP 192.168.43.124.8880 > 192.168.43.195.7771: UDP, length 120
23:02:35.874091 IP 192.168.43.124.8880 > 192.168.43.195.7771: UDP, length 120
23:02:35.924091 IP 192.168.43.124.8880 > 192.168.43.195.7771: UDP, length 120
23:02:35.974136 IP 192.168.43.124.8880 > 192.168.43.195.7771: UDP, length 120
23:02:36.024139 IP 192.168.43.124.8880 > 192.168.43.195.7771: UDP, length 120
23:02:36.074137 IP 192.168.43.124.8880 > 192.168.43.195.7771: UDP, length 120
23:02:36.124128 IP 192.168.43.124.8880 > 192.168.43.195.7771: UDP, length 120
23:02:36.174089 IP 192.168.43.124.8880 > 192.168.43.195.7771: UDP, length 120
23:02:36.224134 IP 192.168.43.124.8880 > 192.168.43.195.7771: UDP, length 120
23:02:36.274136 IP 192.168.43.124.8880 > 192.168.43.195.7771: UDP, length 120
23:02:36.324137 IP 192.168.43.124.8880 > 192.168.43.195.7771: UDP, length 120
23:02:36.374133 IP 192.168.43.124.8880 > 192.168.43.195.7771: UDP, length 120
23:02:36.424137 IP 192.168.43.124.8880 > 192.168.43.195.7771: UDP, length 120
23:02:36.474739 IP 192.168.43.124.8880 > 192.168.43.195.7771: UDP, length 120
23:02:36.524138 IP 192.168.43.124.8880 > 192.168.43.195.7771: UDP, length 120
23:02:36.574138 IP 192.168.43.124.8880 > 192.168.43.195.7771: UDP, length 120
23:02:36.624136 IP 192.168.43.124.8880 > 192.168.43.195.7771: UDP, length 120
23:02:36.674137 IP 192.168.43.124.8880 > 192.168.43.195.7771: UDP, length 120
23:02:36.724136 IP 192.168.43.124.8880 > 192.168.43.195.7771: UDP, length 120
23:02:36.774135 IP 192.168.43.124.8880 > 192.168.43.195.7771: UDP, length 120
23:02:36.824137 IP 192.168.43.124.8880 > 192.168.43.195.7771: UDP, length 120
23:02:36.874135 IP 192.168.43.124.8880 > 192.168.43.195.7771: UDP, length 120
23:02:36.924137 IP 192.168.43.124.8880 > 192.168.43.195.7771: UDP, length 120
23:02:36.974132 IP 192.168.43.124.8880 > 192.168.43.195.7771: UDP, length 120
23:02:37.024136 IP 192.168.43.124.8880 > 192.168.43.195.7771: UDP, length 120
23:02:37.074137 IP 192.168.43.124.8880 > 192.168.43.195.7771: UDP, length 120
23:02:37.124020 IP 192.168.43.124.8880 > 192.168.43.195.7771: UDP, length 120
23:02:37.174091 IP 192.168.43.124.8880 > 192.168.43.195.7771: UDP, length 120
23:02:37.224086 IP 192.168.43.124.8880 > 192.168.43.195.7771: UDP, length 120
23:02:37.274136 IP 192.168.43.124.8880 > 192.168.43.195.7771: UDP, length 120
23:02:37.324137 IP 192.168.43.124.8880 > 192.168.43.195.7771: UDP, length 120
23:02:37.374136 IP 192.168.43.124.8880 > 192.168.43.195.7771: UDP, length 120
23:02:37.424089 IP 192.168.43.124.8880 > 192.168.43.195.7771: UDP, length 120
23:02:37.474091 IP 192.168.43.124.8880 > 192.168.43.195.7771: UDP, length 120
23:02:37.524137 IP 192.168.43.124.8880 > 192.168.43.195.7771: UDP, length 120
23:02:37.574140 IP 192.168.43.124.8880 > 192.168.43.195.7771: UDP, length 120
23:02:37.624137 IP 192.168.43.124.8880 > 192.168.43.195.7771: UDP, length 120
23:02:37.674092 IP 192.168.43.124.8880 > 192.168.43.195.7771: UDP, length 120
23:02:37.724091 IP 192.168.43.124.8880 > 192.168.43.195.7771: UDP, length 120
23:02:37.774090 IP 192.168.43.124.8880 > 192.168.43.195.7771: UDP, length 120
23:02:37.824138 IP 192.168.43.124.8880 > 192.168.43.195.7771: UDP, length 120
23:02:37.874140 IP 192.168.43.124.8880 > 192.168.43.195.7771: UDP, length 120
23:02:37.924138 IP 192.168.43.124.8880 > 192.168.43.195.7771: UDP, length 120
23:02:37.974138 IP 192.168.43.124.8880 > 192.168.43.195.7771: UDP, length 120
23:02:38.024137 IP 192.168.43.124.8880 > 192.168.43.195.7771: UDP, length 120
23:02:38.074139 IP 192.168.43.124.8880 > 192.168.43.195.7771: UDP, length 120
23:02:38.124133 IP 192.168.43.124.8880 > 192.168.43.195.7771: UDP, length 120
23:02:38.174036 IP 192.168.43.124.8880 > 192.168.43.195.7771: UDP, length 120
23:02:38.224084 IP 192.168.43.124.8880 > 192.168.43.195.7771: UDP, length 120
23:02:38.274088 IP 192.168.43.124.8880 > 192.168.43.195.7771: UDP, length 120
23:02:38.324087 IP 192.168.43.124.8880 > 192.168.43.195.7771: UDP, length 120
23:02:38.374087 IP 192.168.43.124.8880 > 192.168.43.195.7771: UDP, length 120
23:02:38.424086 IP 192.168.43.124.8880 > 192.168.43.195.7771: UDP, length 120
23:02:38.474086 IP 192.168.43.124.8880 > 192.168.43.195.7771: UDP, length 120
23:02:38.524051 IP 192.168.43.124.8880 > 192.168.43.195.7771: UDP, length 120
23:02:38.574086 IP 192.168.43.124.8880 > 192.168.43.195.7771: UDP, length 120
23:02:38.624086 IP 192.168.43.124.8880 > 192.168.43.195.7771: UDP, length 120
23:02:38.674087 IP 192.168.43.124.8880 > 192.168.43.195.7771: UDP, length 120
23:02:38.724087 IP 192.168.43.124.8880 > 192.168.43.195.7771: UDP, length 120
23:02:38.774085 IP 192.168.43.124.8880 > 192.168.43.195.7771: UDP, length 120
23:02:38.824087 IP 192.168.43.124.8880 > 192.168.43.195.7771: UDP, length 120
23:02:38.874086 IP 192.168.43.124.8880 > 192.168.43.195.7771: UDP, length 120
23:02:38.924088 IP 192.168.43.124.8880 > 192.168.43.195.7771: UDP, length 120
23:02:38.974086 IP 192.168.43.124.8880 > 192.168.43.195.7771: UDP, length 120
23:02:39.024088 IP 192.168.43.124.8880 > 192.168.43.195.7771: UDP, length 120
23:02:39.074086 IP 192.168.43.124.8880 > 192.168.43.195.7771: UDP, length 120
23:02:39.124087 IP 192.168.43.124.8880 > 192.168.43.195.7771: UDP, length 120
23:02:39.174089 IP 192.168.43.124.8880 > 192.168.43.195.7771: UDP, length 120
23:02:39.224100 IP 192.168.43.124.8880 > 192.168.43.195.7771: UDP, length 120
23:02:39.274090 IP 192.168.43.124.8880 > 192.168.43.195.7771: UDP, length 120
23:02:39.324055 IP 192.168.43.124.8880 > 192.168.43.195.7771: UDP, length 120
23:02:39.374137 IP 192.168.43.124.8880 > 192.168.43.195.7771: UDP, length 120
23:02:39.424036 IP 192.168.43.124.8880 > 192.168.43.195.7771: UDP, length 120
23:02:39.474090 IP 192.168.43.124.8880 > 192.168.43.195.7771: UDP, length 120
23:02:39.524065 IP 192.168.43.124.8880 > 192.168.43.195.7771: UDP, length 120
23:02:39.574092 IP 192.168.43.124.8880 > 192.168.43.195.7771: UDP, length 120
23:02:39.624042 IP 192.168.43.124.8880 > 192.168.43.195.7771: UDP, length 120
23:02:39.674018 IP 192.168.43.124.8880 > 192.168.43.195.7771: UDP, length 120
23:02:39.724011 IP 192.168.43.124.8880 > 192.168.43.195.7771: UDP, length 120
23:02:39.774084 IP 192.168.43.124.8880 > 192.168.43.195.7771: UDP, length 120
23:02:39.824033 IP 192.168.43.124.8880 > 192.168.43.195.7771: UDP, length 120
23:02:39.874089 IP 192.168.43.124.8880 > 192.168.43.195.7771: UDP, length 120
23:02:39.924006 IP 192.168.43.124.8880 > 192.168.43.195.7771: UDP, length 120
23:02:39.974089 IP 192.168.43.124.8880 > 192.168.43.195.7771: UDP, length 120
23:02:40.024089 IP 192.168.43.124.8880 > 192.168.43.195.7771: UDP, length 120
23:02:40.074088 IP 192.168.43.124.8880 > 192.168.43.195.7771: UDP, length 120
23:02:40.124089 IP 192.168.43.124.8880 > 192.168.43.195.7771: UDP, length 120
23:02:40.174089 IP 192.168.43.124.8880 > 192.168.43.195.7771: UDP, length 120
23:02:40.224088 IP 192.168.43.124.8880 > 192.168.43.195.7771: UDP, length 120
23:02:40.274089 IP 192.168.43.124.8880 > 192.168.43.195.7771: UDP, length 120
23:02:40.324089 IP 192.168.43.124.8880 > 192.168.43.195.7771: UDP, length 120
23:02:40.374087 IP 192.168.43.124.8880 > 192.168.43.195.7771: UDP, length 120
23:02:40.424099 IP 192.168.43.124.8880 > 192.168.43.195.7771: UDP, length 120
23:02:40.474089 IP 192.168.43.124.8880 > 192.168.43.195.7771: UDP, length 120
23:02:40.524089 IP 192.168.43.124.8880 > 192.168.43.195.7771: UDP, length 120
23:02:40.574088 IP 192.168.43.124.8880 > 192.168.43.195.7771: UDP, length 120
23:02:40.624090 IP 192.168.43.124.8880 > 192.168.43.195.7771: UDP, length 120
23:02:40.674136 IP 192.168.43.124.8880 > 192.168.43.195.7771: UDP, length 120
23:02:40.724140 IP 192.168.43.124.8880 > 192.168.43.195.7771: UDP, length 120
23:02:40.774140 IP 192.168.43.124.8880 > 192.168.43.195.7771: UDP, length 120
23:02:40.824139 IP 192.168.43.124.8880 > 192.168.43.195.7771: UDP, length 120
23:02:40.874140 IP 192.168.43.124.8880 > 192.168.43.195.7771: UDP, length 120
23:02:40.924139 IP 192.168.43.124.8880 > 192.168.43.195.7771: UDP, length 120
23:02:40.974139 IP 192.168.43.124.8880 > 192.168.43.195.7771: UDP, length 120
23:02:41.024143 IP 192.168.43.124.8880 > 192.168.43.195.7771: UDP, length 120
23:02:41.074141 IP 192.168.43.124.8880 > 192.168.43.195.7771: UDP, length 120
23:02:41.124141 IP 192.168.43.124.8880 > 192.168.43.195.7771: UDP, length 120
23:02:41.174096 IP 192.168.43.124.8880 > 192.168.43.195.7771: UDP, length 120
23:02:41.224085 IP 192.168.43.124.8880 > 192.168.43.195.7771: UDP, length 120
23:02:41.274089 IP 192.168.43.124.8880 > 192.168.43.195.7771: UDP, length 120
23:02:41.324091 IP 192.168.43.124.8880 > 192.168.43.195.7771: UDP, length 120
23:02:41.374089 IP 192.168.43.124.8880 > 192.168.43.195.7771: UDP, length 120
23:02:41.424087 IP 192.168.43.124.8880 > 192.168.43.195.7771: UDP, length 120
23:02:41.474087 IP 192.168.43.124.8880 > 192.168.43.195.7771: UDP, length 120
23:02:41.524086 IP 192.168.43.124.8880 > 192.168.43.195.7771: UDP, length 120
23:02:41.574089 IP 192.168.43.124.8880 > 192.168.43.195.7771: UDP, length 120
23:02:41.624569 IP 192.168.43.124.8880 > 192.168.43.195.7771: UDP, length 120
23:02:41.674089 IP 192.168.43.124.8880 > 192.168.43.195.7771: UDP, length 120
23:02:41.724091 IP 192.168.43.124.8880 > 192.168.43.195.7771: UDP, length 120
23:02:41.774090 IP 192.168.43.124.8880 > 192.168.43.195.7771: UDP, length 120
23:02:41.824090 IP 192.168.43.124.8880 > 192.168.43.195.7771: UDP, length 120
23:02:41.874089 IP 192.168.43.124.8880 > 192.168.43.195.7771: UDP, length 120
23:02:41.924091 IP 192.168.43.124.8880 > 192.168.43.195.7771: UDP, length 120
23:02:41.974086 IP 192.168.43.124.8880 > 192.168.43.195.7771: UDP, length 120
23:02:42.024567 IP 192.168.43.124.8880 > 192.168.43.195.7771: UDP, length 120
23:02:42.074088 IP 192.168.43.124.8880 > 192.168.43.195.7771: UDP, length 120
23:02:42.124091 IP 192.168.43.124.8880 > 192.168.43.195.7771: UDP, length 120
23:02:42.174090 IP 192.168.43.124.8880 > 192.168.43.195.7771: UDP, length 120
23:02:42.224087 IP 192.168.43.124.8880 > 192.168.43.195.7771: UDP, length 120
23:02:42.274138 IP 192.168.43.124.8880 > 192.168.43.195.7771: UDP, length 120
23:02:42.324138 IP 192.168.43.124.8880 > 192.168.43.195.7771: UDP, length 120
23:02:42.374139 IP 192.168.43.124.8880 > 192.168.43.195.7771: UDP, length 120
23:02:42.424135 IP 192.168.43.124.8880 > 192.168.43.195.7771: UDP, length 120
23:02:42.474139 IP 192.168.43.124.8880 > 192.168.43.195.7771: UDP, length 120
23:02:42.524140 IP 192.168.43.124.8880 > 192.168.43.195.7771: UDP, length 120
23:02:42.574139 IP 192.168.43.124.8880 > 192.168.43.195.7771: UDP, length 120
23:02:42.624139 IP 192.168.43.124.8880 > 192.168.43.195.7771: UDP, length 120
23:02:42.674137 IP 192.168.43.124.8880 > 192.168.43.195.7771: UDP, length 120
23:02:42.724138 IP 192.168.43.124.8880 > 192.168.43.195.7771: UDP, length 120
23:02:42.774140 IP 192.168.43.124.8880 > 192.168.43.195.7771: UDP, length 120
23:02:42.824359 IP 192.168.43.124.8880 > 192.168.43.195.7771: UDP, length 120
23:02:42.874139 IP 192.168.43.124.8880 > 192.168.43.195.7771: UDP, length 120
23:02:42.924141 IP 192.168.43.124.8880 > 192.168.43.195.7771: UDP, length 120
23:02:42.974141 IP 192.168.43.124.8880 > 192.168.43.195.7771: UDP, length 120
23:02:43.024142 IP 192.168.43.124.8880 > 192.168.43.195.7771: UDP, length 120
23:02:43.074139 IP 192.168.43.124.8880 > 192.168.43.195.7771: UDP, length 120
23:02:43.124138 IP 192.168.43.124.8880 > 192.168.43.195.7771: UDP, length 120
23:02:43.174195 IP 192.168.43.124.8880 > 192.168.43.195.7771: UDP, length 120
23:02:43.224089 IP 192.168.43.124.8880 > 192.168.43.195.7771: UDP, length 120
23:02:43.274088 IP 192.168.43.124.8880 > 192.168.43.195.7771: UDP, length 120
23:02:43.324140 IP 192.168.43.124.8880 > 192.168.43.195.7771: UDP, length 120
23:02:43.374139 IP 192.168.43.124.8880 > 192.168.43.195.7771: UDP, length 120
23:02:43.424140 IP 192.168.43.124.8880 > 192.168.43.195.7771: UDP, length 120
23:02:43.474136 IP 192.168.43.124.8880 > 192.168.43.195.7771: UDP, length 120
23:02:43.524139 IP 192.168.43.124.8880 > 192.168.43.195.7771: UDP, length 120
23:02:43.574139 IP 192.168.43.124.8880 > 192.168.43.195.7771: UDP, length 120
23:02:43.624140 IP 192.168.43.124.8880 > 192.168.43.195.7771: UDP, length 120
23:02:43.674138 IP 192.168.43.124.8880 > 192.168.43.195.7771: UDP, length 120
23:02:43.724091 IP 192.168.43.124.8880 > 192.168.43.195.7771: UDP, length 120
23:02:43.774092 IP 192.168.43.124.8880 > 192.168.43.195.7771: UDP, length 120
23:02:43.824140 IP 192.168.43.124.8880 > 192.168.43.195.7771: UDP, length 120
23:02:43.874137 IP 192.168.43.124.8880 > 192.168.43.195.7771: UDP, length 120
23:02:43.924139 IP 192.168.43.124.8880 > 192.168.43.195.7771: UDP, length 120
23:02:43.974141 IP 192.168.43.124.8880 > 192.168.43.195.7771: UDP, length 120
23:02:44.024141 IP 192.168.43.124.8880 > 192.168.43.195.7771: UDP, length 120
23:02:44.074140 IP 192.168.43.124.8880 > 192.168.43.195.7771: UDP, length 120
23:02:44.124138 IP 192.168.43.124.8880 > 192.168.43.195.7771: UDP, length 120
23:02:44.174090 IP 192.168.43.124.8880 > 192.168.43.195.7771: UDP, length 120
23:02:44.224088 IP 192.168.43.124.8880 > 192.168.43.195.7771: UDP, length 120
23:02:44.274089 IP 192.168.43.124.8880 > 192.168.43.195.7771: UDP, length 120
23:02:44.324138 IP 192.168.43.124.8880 > 192.168.43.195.7771: UDP, length 120
23:02:44.374139 IP 192.168.43.124.8880 > 192.168.43.195.7771: UDP, length 120
23:02:44.424141 IP 192.168.43.124.8880 > 192.168.43.195.7771: UDP, length 120
23:02:44.474138 IP 192.168.43.124.8880 > 192.168.43.195.7771: UDP, length 120
23:02:44.524139 IP 192.168.43.124.8880 > 192.168.43.195.7771: UDP, length 120
23:02:44.574139 IP 192.168.43.124.8880 > 192.168.43.195.7771: UDP, length 120
23:02:44.624143 IP 192.168.43.124.8880 > 192.168.43.195.7771: UDP, length 120
23:02:44.674140 IP 192.168.43.124.8880 > 192.168.43.195.7771: UDP, length 120
23:02:44.724139 IP 192.168.43.124.8880 > 192.168.43.195.7771: UDP, length 120
23:02:44.774026 IP 192.168.43.124.8880 > 192.168.43.195.7771: UDP, length 120
23:02:44.824019 IP 192.168.43.124.8880 > 192.168.43.195.7771: UDP, length 120
23:02:44.874081 IP 192.168.43.124.8880 > 192.168.43.195.7771: UDP, length 120
23:02:44.924088 IP 192.168.43.124.8880 > 192.168.43.195.7771: UDP, length 120
23:02:44.974049 IP 192.168.43.124.8880 > 192.168.43.195.7771: UDP, length 120
23:02:45.024088 IP 192.168.43.124.8880 > 192.168.43.195.7771: UDP, length 120
23:02:45.074085 IP 192.168.43.124.8880 > 192.168.43.195.7771: UDP, length 120
23:02:45.124088 IP 192.168.43.124.8880 > 192.168.43.195.7771: UDP, length 120
23:02:45.174087 IP 192.168.43.124.8880 > 192.168.43.195.7771: UDP, length 120
23:02:45.224085 IP 192.168.43.124.8880 > 192.168.43.195.7771: UDP, length 120
23:02:45.274135 IP 192.168.43.124.8880 > 192.168.43.195.7771: UDP, length 120
23:02:45.324139 IP 192.168.43.124.8880 > 192.168.43.195.7771: UDP, length 120
23:02:45.374137 IP 192.168.43.124.8880 > 192.168.43.195.7771: UDP, length 120
23:02:45.424133 IP 192.168.43.124.8880 > 192.168.43.195.7771: UDP, length 120
23:02:45.474144 IP 192.168.43.124.8880 > 192.168.43.195.7771: UDP, length 120
23:02:45.524137 IP 192.168.43.124.8880 > 192.168.43.195.7771: UDP, length 120
23:02:45.574136 IP 192.168.43.124.8880 > 192.168.43.195.7771: UDP, length 120
23:02:45.624089 IP 192.168.43.124.8880 > 192.168.43.195.7771: UDP, length 120
23:02:45.674090 IP 192.168.43.124.8880 > 192.168.43.195.7771: UDP, length 120
23:02:45.724053 IP 192.168.43.124.8880 > 192.168.43.195.7771: UDP, length 120
23:02:45.774138 IP 192.168.43.124.8880 > 192.168.43.195.7771: UDP, length 120
23:02:45.824136 IP 192.168.43.124.8880 > 192.168.43.195.7771: UDP, length 120
23:02:45.874137 IP 192.168.43.124.8880 > 192.168.43.195.7771: UDP, length 120
23:02:45.924138 IP 192.168.43.124.8880 > 192.168.43.195.7771: UDP, length 120
23:02:45.974137 IP 192.168.43.124.8880 > 192.168.43.195.7771: UDP, length 120
23:02:46.024054 IP 192.168.43.124.8880 > 192.168.43.195.7771: UDP, length 120
23:02:46.074137 IP 192.168.43.124.8880 > 192.168.43.195.7771: UDP, length 120
23:02:46.124138 IP 192.168.43.124.8880 > 192.168.43.195.7771: UDP, length 120
23:02:46.174087 IP 192.168.43.124.8880 > 192.168.43.195.7771: UDP, length 120
23:02:46.224133 IP 192.168.43.124.8880 > 192.168.43.195.7771: UDP, length 120
23:02:46.274136 IP 192.168.43.124.8880 > 192.168.43.195.7771: UDP, length 120
23:02:46.324137 IP 192.168.43.124.8880 > 192.168.43.195.7771: UDP, length 120
23:02:46.374136 IP 192.168.43.124.8880 > 192.168.43.195.7771: UDP, length 120
23:02:46.424135 IP 192.168.43.124.8880 > 192.168.43.195.7771: UDP, length 120
23:02:46.474136 IP 192.168.43.124.8880 > 192.168.43.195.7771: UDP, length 120
23:02:46.524099 IP 192.168.43.124.8880 > 192.168.43.195.7771: UDP, length 120
23:02:46.574092 IP 192.168.43.124.8880 > 192.168.43.195.7771: UDP, length 120
23:02:46.624027 IP 192.168.43.124.8880 > 192.168.43.195.7771: UDP, length 120
23:02:46.674000 IP 192.168.43.124.8880 > 192.168.43.195.7771: UDP, length 120
23:02:46.724043 IP 192.168.43.124.8880 > 192.168.43.195.7771: UDP, length 120
23:02:46.774088 IP 192.168.43.124.8880 > 192.168.43.195.7771: UDP, length 120
23:02:46.824026 IP 192.168.43.124.8880 > 192.168.43.195.7771: UDP, length 120
23:02:46.874087 IP 192.168.43.124.8880 > 192.168.43.195.7771: UDP, length 120
23:02:46.924090 IP 192.168.43.124.8880 > 192.168.43.195.7771: UDP, length 120
23:02:46.974132 IP 192.168.43.124.8880 > 192.168.43.195.7771: UDP, length 120
23:02:47.024136 IP 192.168.43.124.8880 > 192.168.43.195.7771: UDP, length 120
23:02:47.074137 IP 192.168.43.124.8880 > 192.168.43.195.7771: UDP, length 120
23:02:47.124713 IP 192.168.43.124.8880 > 192.168.43.195.7771: UDP, length 120
23:02:47.174086 IP 192.168.43.124.8880 > 192.168.43.195.7771: UDP, length 120
23:02:47.224087 IP 192.168.43.124.8880 > 192.168.43.195.7771: UDP, length 120
23:02:47.274088 IP 192.168.43.124.8880 > 192.168.43.195.7771: UDP, length 120
23:02:47.324090 IP 192.168.43.124.8880 > 192.168.43.195.7771: UDP, length 120
23:02:47.374136 IP 192.168.43.124.8880 > 192.168.43.195.7771: UDP, length 120
23:02:47.424119 IP 192.168.43.124.8880 > 192.168.43.195.7771: UDP, length 120
23:02:47.474119 IP 192.168.43.124.8880 > 192.168.43.195.7771: UDP, length 120
23:02:47.524086 IP 192.168.43.124.8880 > 192.168.43.195.7771: UDP, length 120
23:02:47.574086 IP 192.168.43.124.8880 > 192.168.43.195.7771: UDP, length 120
23:02:47.624054 IP 192.168.43.124.8880 > 192.168.43.195.7771: UDP, length 120
23:02:47.674135 IP 192.168.43.124.8880 > 192.168.43.195.7771: UDP, length 120
23:02:47.724139 IP 192.168.43.124.8880 > 192.168.43.195.7771: UDP, length 120
23:02:47.774144 IP 192.168.43.124.8880 > 192.168.43.195.7771: UDP, length 120
23:02:47.824091 IP 192.168.43.124.8880 > 192.168.43.195.7771: UDP, length 120
23:02:47.874090 IP 192.168.43.124.8880 > 192.168.43.195.7771: UDP, length 120
23:02:47.924090 IP 192.168.43.124.8880 > 192.168.43.195.7771: UDP, length 120
23:02:47.974091 IP 192.168.43.124.8880 > 192.168.43.195.7771: UDP, length 120
23:02:48.024089 IP 192.168.43.124.8880 > 192.168.43.195.7771: UDP, length 120
23:02:48.074085 IP 192.168.43.124.8880 > 192.168.43.195.7771: UDP, length 120
23:02:48.124090 IP 192.168.43.124.8880 > 192.168.43.195.7771: UDP, length 120
23:02:48.174084 IP 192.168.43.124.8880 > 192.168.43.195.7771: UDP, length 120
23:02:48.224084 IP 192.168.43.124.8880 > 192.168.43.195.7771: UDP, length 120
23:02:48.274086 IP 192.168.43.124.8880 > 192.168.43.195.7771: UDP, length 120
23:02:48.324088 IP 192.168.43.124.8880 > 192.168.43.195.7771: UDP, length 120
23:02:48.374087 IP 192.168.43.124.8880 > 192.168.43.195.7771: UDP, length 120
23:02:48.424087 IP 192.168.43.124.8880 > 192.168.43.195.7771: UDP, length 120
23:02:48.474089 IP 192.168.43.124.8880 > 192.168.43.195.7771: UDP, length 120
23:02:48.524088 IP 192.168.43.124.8880 > 192.168.43.195.7771: UDP, length 120
