01:56:00.866761 IP 192.168.43.146.8880 > 192.168.43.147.7772: UDP, length 120
01:56:00.918044 IP 192.168.43.146.8880 > 192.168.43.147.7772: UDP, length 120
01:56:00.965315 IP 192.168.43.146.8880 > 192.168.43.147.7772: UDP, length 120
01:56:01.017880 IP 192.168.43.147.8880 > 192.168.43.124.7773: UDP, length 120
01:56:01.018991 IP 192.168.43.146.8880 > 192.168.43.147.7772: UDP, length 120
01:56:01.067933 IP 192.168.43.147.8880 > 192.168.43.124.7773: UDP, length 120
01:56:01.069085 IP 192.168.43.146.8880 > 192.168.43.147.7772: UDP, length 120
01:56:01.117911 IP 192.168.43.147.8880 > 192.168.43.124.7773: UDP, length 120
01:56:01.121160 IP 192.168.43.146.8880 > 192.168.43.147.7772: UDP, length 120
01:56:01.166967 IP 192.168.43.146.8880 > 192.168.43.147.7772: UDP, length 120
01:56:01.167910 IP 192.168.43.147.8880 > 192.168.43.124.7773: UDP, length 120
01:56:01.217904 IP 192.168.43.147.8880 > 192.168.43.124.7773: UDP, length 120
01:56:01.220007 IP 192.168.43.146.8880 > 192.168.43.147.7772: UDP, length 120
01:56:01.265849 IP 192.168.43.146.8880 > 192.168.43.147.7772: UDP, length 120
01:56:01.267907 IP 192.168.43.147.8880 > 192.168.43.124.7773: UDP, length 120
01:56:01.316233 IP 192.168.43.146.8880 > 192.168.43.147.7772: UDP, length 120
01:56:01.317910 IP 192.168.43.147.8880 > 192.168.43.124.7773: UDP, length 120
01:56:01.367920 IP 192.168.43.147.8880 > 192.168.43.124.7773: UDP, length 120
01:56:01.368001 IP 192.168.43.146.8880 > 192.168.43.147.7772: UDP, length 120
01:56:01.417919 IP 192.168.43.147.8880 > 192.168.43.124.7773: UDP, length 120
01:56:01.417999 IP 192.168.43.146.8880 > 192.168.43.147.7772: UDP, length 120
01:56:01.467919 IP 192.168.43.147.8880 > 192.168.43.124.7773: UDP, length 120
01:56:01.468000 IP 192.168.43.146.8880 > 192.168.43.147.7772: UDP, length 120
01:56:01.517904 IP 192.168.43.147.8880 > 192.168.43.124.7773: UDP, length 120
01:56:01.567901 IP 192.168.43.147.8880 > 192.168.43.124.7773: UDP, length 120
01:56:01.570324 IP 192.168.43.146.8880 > 192.168.43.147.7772: UDP, length 120
01:56:01.615787 IP 192.168.43.146.8880 > 192.168.43.147.7772: UDP, length 120
01:56:01.617902 IP 192.168.43.147.8880 > 192.168.43.124.7773: UDP, length 120
01:56:01.667903 IP 192.168.43.147.8880 > 192.168.43.124.7773: UDP, length 120
01:56:01.698234 IP 192.168.43.146.8880 > 192.168.43.147.7772: UDP, length 120
01:56:01.715985 IP 192.168.43.146.8880 > 192.168.43.147.7772: UDP, length 120
01:56:01.717900 IP 192.168.43.147.8880 > 192.168.43.124.7773: UDP, length 120
01:56:01.766609 IP 192.168.43.146.8880 > 192.168.43.147.7772: UDP, length 120
01:56:01.767902 IP 192.168.43.147.8880 > 192.168.43.124.7773: UDP, length 120
01:56:01.817751 IP 192.168.43.146.8880 > 192.168.43.147.7772: UDP, length 120
01:56:01.817903 IP 192.168.43.147.8880 > 192.168.43.124.7773: UDP, length 120
01:56:01.867906 IP 192.168.43.147.8880 > 192.168.43.124.7773: UDP, length 120
01:56:01.868161 IP 192.168.43.146.8880 > 192.168.43.147.7772: UDP, length 120
01:56:01.917933 IP 192.168.43.147.8880 > 192.168.43.124.7773: UDP, length 120
01:56:01.919991 IP 192.168.43.146.8880 > 192.168.43.147.7772: UDP, length 120
01:56:01.965343 IP 192.168.43.146.8880 > 192.168.43.147.7772: UDP, length 120
01:56:01.967928 IP 192.168.43.147.8880 > 192.168.43.124.7773: UDP, length 120
01:56:02.016562 IP 192.168.43.146.8880 > 192.168.43.147.7772: UDP, length 120
01:56:02.017928 IP 192.168.43.147.8880 > 192.168.43.124.7773: UDP, length 120
01:56:02.067401 IP 192.168.43.146.8880 > 192.168.43.147.7772: UDP, length 120
01:56:02.067967 IP 192.168.43.147.8880 > 192.168.43.124.7773: UDP, length 120
01:56:02.117927 IP 192.168.43.147.8880 > 192.168.43.124.7773: UDP, length 120
01:56:02.118801 IP 192.168.43.146.8880 > 192.168.43.147.7772: UDP, length 120
01:56:02.167926 IP 192.168.43.147.8880 > 192.168.43.124.7773: UDP, length 120
01:56:02.170033 IP 192.168.43.146.8880 > 192.168.43.147.7772: UDP, length 120
01:56:02.217951 IP 192.168.43.147.8880 > 192.168.43.124.7773: UDP, length 120
01:56:02.218376 IP 192.168.43.146.8880 > 192.168.43.147.7772: UDP, length 120
01:56:02.267929 IP 192.168.43.147.8880 > 192.168.43.124.7773: UDP, length 120
01:56:02.301279 IP 192.168.43.146.8880 > 192.168.43.147.7772: UDP, length 120
01:56:02.314762 IP 192.168.43.146.8880 > 192.168.43.147.7772: UDP, length 120
01:56:02.317931 IP 192.168.43.147.8880 > 192.168.43.124.7773: UDP, length 120
01:56:02.367930 IP 192.168.43.146.8880 > 192.168.43.147.7772: UDP, length 120
01:56:02.367954 IP 192.168.43.147.8880 > 192.168.43.124.7773: UDP, length 120
01:56:02.417934 IP 192.168.43.147.8880 > 192.168.43.124.7773: UDP, length 120
01:56:02.467955 IP 192.168.43.147.8880 > 192.168.43.124.7773: UDP, length 120
01:56:02.492367 IP 192.168.43.146.8880 > 192.168.43.147.7772: UDP, length 120
01:56:02.492998 IP 192.168.43.146.8880 > 192.168.43.147.7772: UDP, length 120
01:56:02.514947 IP 192.168.43.146.8880 > 192.168.43.147.7772: UDP, length 120
01:56:02.517939 IP 192.168.43.147.8880 > 192.168.43.124.7773: UDP, length 120
01:56:02.565509 IP 192.168.43.146.8880 > 192.168.43.147.7772: UDP, length 120
01:56:02.567938 IP 192.168.43.147.8880 > 192.168.43.124.7773: UDP, length 120
01:56:02.617474 IP 192.168.43.146.8880 > 192.168.43.147.7772: UDP, length 120
01:56:02.617925 IP 192.168.43.147.8880 > 192.168.43.124.7773: UDP, length 120
01:56:02.666067 IP 192.168.43.146.8880 > 192.168.43.147.7772: UDP, length 120
01:56:02.667924 IP 192.168.43.147.8880 > 192.168.43.124.7773: UDP, length 120
01:56:02.717018 IP 192.168.43.146.8880 > 192.168.43.147.7772: UDP, length 120
01:56:02.717925 IP 192.168.43.147.8880 > 192.168.43.124.7773: UDP, length 120
01:56:02.767963 IP 192.168.43.147.8880 > 192.168.43.124.7773: UDP, length 120
01:56:02.768002 IP 192.168.43.146.8880 > 192.168.43.147.7772: UDP, length 120
01:56:02.817939 IP 192.168.43.147.8880 > 192.168.43.124.7773: UDP, length 120
01:56:02.852603 IP 192.168.43.146.8880 > 192.168.43.147.7772: UDP, length 120
01:56:02.865337 IP 192.168.43.146.8880 > 192.168.43.147.7772: UDP, length 120
01:56:02.867925 IP 192.168.43.147.8880 > 192.168.43.124.7773: UDP, length 120
01:56:02.917928 IP 192.168.43.147.8880 > 192.168.43.124.7773: UDP, length 120
01:56:02.967927 IP 192.168.43.147.8880 > 192.168.43.124.7773: UDP, length 120
01:56:03.017940 IP 192.168.43.147.8880 > 192.168.43.124.7773: UDP, length 120
01:56:03.057892 IP 192.168.43.146.8880 > 192.168.43.147.7772: UDP, length 120
01:56:03.058019 IP 192.168.43.146.8880 > 192.168.43.147.7772: UDP, length 120
01:56:03.058136 IP 192.168.43.146.8880 > 192.168.43.147.7772: UDP, length 120
01:56:03.066065 IP 192.168.43.146.8880 > 192.168.43.147.7772: UDP, length 120
01:56:03.067957 IP 192.168.43.147.8880 > 192.168.43.124.7773: UDP, length 120
01:56:03.117932 IP 192.168.43.147.8880 > 192.168.43.124.7773: UDP, length 120
01:56:03.167930 IP 192.168.43.147.8880 > 192.168.43.124.7773: UDP, length 120
01:56:03.171559 IP 192.168.43.146.8880 > 192.168.43.147.7772: UDP, length 120
01:56:03.217929 IP 192.168.43.147.8880 > 192.168.43.124.7773: UDP, length 120
01:56:03.221317 IP 192.168.43.146.8880 > 192.168.43.147.7772: UDP, length 120
01:56:03.267941 IP 192.168.43.147.8880 > 192.168.43.124.7773: UDP, length 120
01:56:03.276088 IP 192.168.43.146.8880 > 192.168.43.147.7772: UDP, length 120
01:56:03.317938 IP 192.168.43.147.8880 > 192.168.43.124.7773: UDP, length 120
01:56:03.364509 IP 192.168.43.146.8880 > 192.168.43.147.7772: UDP, length 120
01:56:03.367929 IP 192.168.43.147.8880 > 192.168.43.124.7773: UDP, length 120
01:56:03.380594 IP 192.168.43.146.8880 > 192.168.43.147.7772: UDP, length 120
01:56:03.417932 IP 192.168.43.147.8880 > 192.168.43.124.7773: UDP, length 120
01:56:03.467758 IP 192.168.43.146.8880 > 192.168.43.147.7772: UDP, length 120
01:56:03.467884 IP 192.168.43.146.8880 > 192.168.43.147.7772: UDP, length 120
01:56:03.467954 IP 192.168.43.147.8880 > 192.168.43.124.7773: UDP, length 120
01:56:03.517932 IP 192.168.43.147.8880 > 192.168.43.124.7773: UDP, length 120
01:56:03.523879 IP 192.168.43.146.8880 > 192.168.43.147.7772: UDP, length 120
01:56:03.567997 IP 192.168.43.147.8880 > 192.168.43.124.7773: UDP, length 120
01:56:03.570970 IP 192.168.43.146.8880 > 192.168.43.147.7772: UDP, length 120
01:56:03.615612 IP 192.168.43.146.8880 > 192.168.43.147.7772: UDP, length 120
01:56:03.617948 IP 192.168.43.147.8880 > 192.168.43.124.7773: UDP, length 120
01:56:03.667930 IP 192.168.43.147.8880 > 192.168.43.124.7773: UDP, length 120
01:56:03.671333 IP 192.168.43.146.8880 > 192.168.43.147.7772: UDP, length 120
01:56:03.717926 IP 192.168.43.147.8880 > 192.168.43.124.7773: UDP, length 120
01:56:03.718700 IP 192.168.43.146.8880 > 192.168.43.147.7772: UDP, length 120
01:56:03.767932 IP 192.168.43.147.8880 > 192.168.43.124.7773: UDP, length 120
01:56:03.771331 IP 192.168.43.146.8880 > 192.168.43.147.7772: UDP, length 120
01:56:03.817931 IP 192.168.43.147.8880 > 192.168.43.124.7773: UDP, length 120
01:56:03.829483 IP 192.168.43.146.8880 > 192.168.43.147.7772: UDP, length 120
01:56:03.867941 IP 192.168.43.147.8880 > 192.168.43.124.7773: UDP, length 120
01:56:03.917936 IP 192.168.43.147.8880 > 192.168.43.124.7773: UDP, length 120
01:56:03.918545 IP 192.168.43.146.8880 > 192.168.43.147.7772: UDP, length 120
01:56:03.967930 IP 192.168.43.147.8880 > 192.168.43.124.7773: UDP, length 120
01:56:03.975460 IP 192.168.43.146.8880 > 192.168.43.147.7772: UDP, length 120
01:56:04.017930 IP 192.168.43.147.8880 > 192.168.43.124.7773: UDP, length 120
01:56:04.021336 IP 192.168.43.146.8880 > 192.168.43.147.7772: UDP, length 120
01:56:04.067940 IP 192.168.43.147.8880 > 192.168.43.124.7773: UDP, length 120
01:56:04.078263 IP 192.168.43.146.8880 > 192.168.43.147.7772: UDP, length 120
01:56:04.117933 IP 192.168.43.147.8880 > 192.168.43.124.7773: UDP, length 120
01:56:04.167940 IP 192.168.43.147.8880 > 192.168.43.124.7773: UDP, length 120
01:56:04.181134 IP 192.168.43.146.8880 > 192.168.43.147.7772: UDP, length 120
01:56:04.201282 IP 192.168.43.146.8880 > 192.168.43.147.7772: UDP, length 120
01:56:04.217925 IP 192.168.43.147.8880 > 192.168.43.124.7773: UDP, length 120
01:56:04.236545 IP 192.168.43.146.8880 > 192.168.43.147.7772: UDP, length 120
01:56:04.267934 IP 192.168.43.147.8880 > 192.168.43.124.7773: UDP, length 120
01:56:04.268119 IP 192.168.43.146.8880 > 192.168.43.147.7772: UDP, length 120
01:56:04.317929 IP 192.168.43.147.8880 > 192.168.43.124.7773: UDP, length 120
01:56:04.328643 IP 192.168.43.146.8880 > 192.168.43.147.7772: UDP, length 120
01:56:04.367929 IP 192.168.43.147.8880 > 192.168.43.124.7773: UDP, length 120
01:56:04.385391 IP 192.168.43.146.8880 > 192.168.43.147.7772: UDP, length 120
01:56:04.417943 IP 192.168.43.147.8880 > 192.168.43.124.7773: UDP, length 120
01:56:04.422007 IP 192.168.43.146.8880 > 192.168.43.147.7772: UDP, length 120
01:56:04.467935 IP 192.168.43.147.8880 > 192.168.43.124.7773: UDP, length 120
01:56:04.517929 IP 192.168.43.147.8880 > 192.168.43.124.7773: UDP, length 120
01:56:04.567940 IP 192.168.43.147.8880 > 192.168.43.124.7773: UDP, length 120
01:56:04.593322 IP 192.168.43.146.8880 > 192.168.43.147.7772: UDP, length 120
01:56:04.593587 IP 192.168.43.146.8880 > 192.168.43.147.7772: UDP, length 120
01:56:04.593701 IP 192.168.43.146.8880 > 192.168.43.147.7772: UDP, length 120
01:56:04.617932 IP 192.168.43.147.8880 > 192.168.43.124.7773: UDP, length 120
01:56:04.624176 IP 192.168.43.146.8880 > 192.168.43.147.7772: UDP, length 120
01:56:04.667928 IP 192.168.43.147.8880 > 192.168.43.124.7773: UDP, length 120
01:56:04.681355 IP 192.168.43.146.8880 > 192.168.43.147.7772: UDP, length 120
01:56:04.717934 IP 192.168.43.147.8880 > 192.168.43.124.7773: UDP, length 120
01:56:04.737341 IP 192.168.43.146.8880 > 192.168.43.147.7772: UDP, length 120
01:56:04.767941 IP 192.168.43.147.8880 > 192.168.43.124.7773: UDP, length 120
01:56:04.798197 IP 192.168.43.146.8880 > 192.168.43.147.7772: UDP, length 120
01:56:04.814175 IP 192.168.43.146.8880 > 192.168.43.147.7772: UDP, length 120
01:56:04.817924 IP 192.168.43.147.8880 > 192.168.43.124.7773: UDP, length 120
01:56:04.867945 IP 192.168.43.147.8880 > 192.168.43.124.7773: UDP, length 120
01:56:04.870183 IP 192.168.43.146.8880 > 192.168.43.147.7772: UDP, length 120
01:56:04.917926 IP 192.168.43.147.8880 > 192.168.43.124.7773: UDP, length 120
01:56:04.920792 IP 192.168.43.146.8880 > 192.168.43.147.7772: UDP, length 120
01:56:04.967939 IP 192.168.43.147.8880 > 192.168.43.124.7773: UDP, length 120
01:56:05.002850 IP 192.168.43.146.8880 > 192.168.43.147.7772: UDP, length 120
01:56:05.017929 IP 192.168.43.147.8880 > 192.168.43.124.7773: UDP, length 120
01:56:05.062887 IP 192.168.43.146.8880 > 192.168.43.147.7772: UDP, length 120
01:56:05.067965 IP 192.168.43.147.8880 > 192.168.43.124.7773: UDP, length 120
01:56:05.095746 IP 192.168.43.146.8880 > 192.168.43.147.7772: UDP, length 120
01:56:05.117942 IP 192.168.43.147.8880 > 192.168.43.124.7773: UDP, length 120
01:56:05.120654 IP 192.168.43.146.8880 > 192.168.43.147.7772: UDP, length 120
01:56:05.167832 IP 192.168.43.146.8880 > 192.168.43.147.7772: UDP, length 120
01:56:05.167965 IP 192.168.43.147.8880 > 192.168.43.124.7773: UDP, length 120
01:56:05.216148 IP 192.168.43.146.8880 > 192.168.43.147.7772: UDP, length 120
01:56:05.217925 IP 192.168.43.147.8880 > 192.168.43.124.7773: UDP, length 120
01:56:05.267619 IP 192.168.43.146.8880 > 192.168.43.147.7772: UDP, length 120
01:56:05.267926 IP 192.168.43.147.8880 > 192.168.43.124.7773: UDP, length 120
01:56:05.316188 IP 192.168.43.146.8880 > 192.168.43.147.7772: UDP, length 120
01:56:05.317924 IP 192.168.43.147.8880 > 192.168.43.124.7773: UDP, length 120
01:56:05.366656 IP 192.168.43.146.8880 > 192.168.43.147.7772: UDP, length 120
01:56:05.367926 IP 192.168.43.147.8880 > 192.168.43.124.7773: UDP, length 120
01:56:05.417926 IP 192.168.43.147.8880 > 192.168.43.124.7773: UDP, length 120
01:56:05.420801 IP 192.168.43.146.8880 > 192.168.43.147.7772: UDP, length 120
01:56:05.465492 IP 192.168.43.146.8880 > 192.168.43.147.7772: UDP, length 120
01:56:05.467945 IP 192.168.43.147.8880 > 192.168.43.124.7773: UDP, length 120
01:56:05.517933 IP 192.168.43.147.8880 > 192.168.43.124.7773: UDP, length 120
01:56:05.521368 IP 192.168.43.146.8880 > 192.168.43.147.7772: UDP, length 120
01:56:05.567929 IP 192.168.43.147.8880 > 192.168.43.124.7773: UDP, length 120
01:56:05.569777 IP 192.168.43.146.8880 > 192.168.43.147.7772: UDP, length 120
01:56:05.615413 IP 192.168.43.146.8880 > 192.168.43.147.7772: UDP, length 120
01:56:05.617935 IP 192.168.43.147.8880 > 192.168.43.124.7773: UDP, length 120
01:56:05.666482 IP 192.168.43.146.8880 > 192.168.43.147.7772: UDP, length 120
01:56:05.667940 IP 192.168.43.147.8880 > 192.168.43.124.7773: UDP, length 120
01:56:05.717938 IP 192.168.43.147.8880 > 192.168.43.124.7773: UDP, length 120
01:56:05.719702 IP 192.168.43.146.8880 > 192.168.43.147.7772: UDP, length 120
01:56:05.765541 IP 192.168.43.146.8880 > 192.168.43.147.7772: UDP, length 120
01:56:05.767941 IP 192.168.43.147.8880 > 192.168.43.124.7773: UDP, length 120
01:56:05.818038 IP 192.168.43.147.8880 > 192.168.43.124.7773: UDP, length 120
01:56:05.821625 IP 192.168.43.146.8880 > 192.168.43.147.7772: UDP, length 120
01:56:05.866172 IP 192.168.43.146.8880 > 192.168.43.147.7772: UDP, length 120
01:56:05.868013 IP 192.168.43.147.8880 > 192.168.43.124.7773: UDP, length 120
01:56:05.917993 IP 192.168.43.147.8880 > 192.168.43.124.7773: UDP, length 120
01:56:05.919919 IP 192.168.43.146.8880 > 192.168.43.147.7772: UDP, length 120
01:56:05.962599 IP 192.168.43.146.8880 > 192.168.43.147.7772: UDP, length 120
01:56:05.967985 IP 192.168.43.147.8880 > 192.168.43.124.7773: UDP, length 120
01:56:06.015950 IP 192.168.43.146.8880 > 192.168.43.147.7772: UDP, length 120
01:56:06.017970 IP 192.168.43.147.8880 > 192.168.43.124.7773: UDP, length 120
01:56:06.067965 IP 192.168.43.147.8880 > 192.168.43.124.7773: UDP, length 120
01:56:06.100112 IP 192.168.43.146.8880 > 192.168.43.147.7772: UDP, length 120
01:56:06.114750 IP 192.168.43.146.8880 > 192.168.43.147.7772: UDP, length 120
01:56:06.117981 IP 192.168.43.147.8880 > 192.168.43.124.7773: UDP, length 120
01:56:06.166303 IP 192.168.43.146.8880 > 192.168.43.147.7772: UDP, length 120
01:56:06.167993 IP 192.168.43.147.8880 > 192.168.43.124.7773: UDP, length 120
01:56:06.214519 IP 192.168.43.146.8880 > 192.168.43.147.7772: UDP, length 120
01:56:06.217987 IP 192.168.43.147.8880 > 192.168.43.124.7773: UDP, length 120
01:56:06.262425 IP 192.168.43.146.8880 > 192.168.43.147.7772: UDP, length 120
01:56:06.267944 IP 192.168.43.147.8880 > 192.168.43.124.7773: UDP, length 120
01:56:06.316750 IP 192.168.43.146.8880 > 192.168.43.147.7772: UDP, length 120
01:56:06.317906 IP 192.168.43.147.8880 > 192.168.43.124.7773: UDP, length 120
01:56:06.366135 IP 192.168.43.146.8880 > 192.168.43.147.7772: UDP, length 120
01:56:06.367901 IP 192.168.43.147.8880 > 192.168.43.124.7773: UDP, length 120
01:56:06.415619 IP 192.168.43.146.8880 > 192.168.43.147.7772: UDP, length 120
01:56:06.417901 IP 192.168.43.147.8880 > 192.168.43.124.7773: UDP, length 120
01:56:06.464955 IP 192.168.43.146.8880 > 192.168.43.147.7772: UDP, length 120
01:56:06.467901 IP 192.168.43.147.8880 > 192.168.43.124.7773: UDP, length 120
01:56:06.515957 IP 192.168.43.146.8880 > 192.168.43.147.7772: UDP, length 120
01:56:06.517901 IP 192.168.43.147.8880 > 192.168.43.124.7773: UDP, length 120
01:56:06.566013 IP 192.168.43.146.8880 > 192.168.43.147.7772: UDP, length 120
01:56:06.567943 IP 192.168.43.147.8880 > 192.168.43.124.7773: UDP, length 120
01:56:06.615932 IP 192.168.43.146.8880 > 192.168.43.147.7772: UDP, length 120
01:56:06.617928 IP 192.168.43.147.8880 > 192.168.43.124.7773: UDP, length 120
01:56:06.666102 IP 192.168.43.146.8880 > 192.168.43.147.7772: UDP, length 120
01:56:06.667910 IP 192.168.43.147.8880 > 192.168.43.124.7773: UDP, length 120
01:56:06.715784 IP 192.168.43.146.8880 > 192.168.43.147.7772: UDP, length 120
01:56:06.717900 IP 192.168.43.147.8880 > 192.168.43.124.7773: UDP, length 120
01:56:06.767902 IP 192.168.43.147.8880 > 192.168.43.124.7773: UDP, length 120
01:56:06.817902 IP 192.168.43.147.8880 > 192.168.43.124.7773: UDP, length 120
01:56:06.846397 IP 192.168.43.146.8880 > 192.168.43.147.7772: UDP, length 120
01:56:06.846543 IP 192.168.43.146.8880 > 192.168.43.147.7772: UDP, length 120
01:56:06.865927 IP 192.168.43.146.8880 > 192.168.43.147.7772: UDP, length 120
01:56:06.867902 IP 192.168.43.147.8880 > 192.168.43.124.7773: UDP, length 120
01:56:06.915510 IP 192.168.43.146.8880 > 192.168.43.147.7772: UDP, length 120
01:56:06.917927 IP 192.168.43.147.8880 > 192.168.43.124.7773: UDP, length 120
01:56:06.966051 IP 192.168.43.146.8880 > 192.168.43.147.7772: UDP, length 120
01:56:06.967925 IP 192.168.43.147.8880 > 192.168.43.124.7773: UDP, length 120
01:56:07.017790 IP 192.168.43.146.8880 > 192.168.43.147.7772: UDP, length 120
01:56:07.017938 IP 192.168.43.147.8880 > 192.168.43.124.7773: UDP, length 120
01:56:07.065986 IP 192.168.43.146.8880 > 192.168.43.147.7772: UDP, length 120
01:56:07.067935 IP 192.168.43.147.8880 > 192.168.43.124.7773: UDP, length 120
01:56:07.115714 IP 192.168.43.146.8880 > 192.168.43.147.7772: UDP, length 120
01:56:07.117927 IP 192.168.43.147.8880 > 192.168.43.124.7773: UDP, length 120
01:56:07.167931 IP 192.168.43.147.8880 > 192.168.43.124.7773: UDP, length 120
01:56:07.168119 IP 192.168.43.146.8880 > 192.168.43.147.7772: UDP, length 120
01:56:07.215647 IP 192.168.43.146.8880 > 192.168.43.147.7772: UDP, length 120
01:56:07.217926 IP 192.168.43.147.8880 > 192.168.43.124.7773: UDP, length 120
01:56:07.266126 IP 192.168.43.146.8880 > 192.168.43.147.7772: UDP, length 120
01:56:07.267937 IP 192.168.43.147.8880 > 192.168.43.124.7773: UDP, length 120
01:56:07.317932 IP 192.168.43.147.8880 > 192.168.43.124.7773: UDP, length 120
01:56:07.318101 IP 192.168.43.146.8880 > 192.168.43.147.7772: UDP, length 120
01:56:07.366688 IP 192.168.43.146.8880 > 192.168.43.147.7772: UDP, length 120
01:56:07.367926 IP 192.168.43.147.8880 > 192.168.43.124.7773: UDP, length 120
01:56:07.417931 IP 192.168.43.147.8880 > 192.168.43.124.7773: UDP, length 120
01:56:07.418118 IP 192.168.43.146.8880 > 192.168.43.147.7772: UDP, length 120
01:56:07.467927 IP 192.168.43.147.8880 > 192.168.43.124.7773: UDP, length 120
01:56:07.496556 IP 192.168.43.146.8880 > 192.168.43.147.7772: UDP, length 120
01:56:07.516963 IP 192.168.43.146.8880 > 192.168.43.147.7772: UDP, length 120
01:56:07.517923 IP 192.168.43.147.8880 > 192.168.43.124.7773: UDP, length 120
01:56:07.567928 IP 192.168.43.147.8880 > 192.168.43.124.7773: UDP, length 120
01:56:07.571341 IP 192.168.43.146.8880 > 192.168.43.147.7772: UDP, length 120
01:56:07.617928 IP 192.168.43.147.8880 > 192.168.43.124.7773: UDP, length 120
01:56:07.632433 IP 192.168.43.146.8880 > 192.168.43.147.7772: UDP, length 120
01:56:07.667938 IP 192.168.43.147.8880 > 192.168.43.124.7773: UDP, length 120
01:56:07.671375 IP 192.168.43.146.8880 > 192.168.43.147.7772: UDP, length 120
01:56:07.717940 IP 192.168.43.147.8880 > 192.168.43.124.7773: UDP, length 120
01:56:07.767153 IP 192.168.43.146.8880 > 192.168.43.147.7772: UDP, length 120
01:56:07.767449 IP 192.168.43.146.8880 > 192.168.43.147.7772: UDP, length 120
01:56:07.767928 IP 192.168.43.147.8880 > 192.168.43.124.7773: UDP, length 120
01:56:07.817934 IP 192.168.43.147.8880 > 192.168.43.124.7773: UDP, length 120
01:56:07.828054 IP 192.168.43.146.8880 > 192.168.43.147.7772: UDP, length 120
01:56:07.867946 IP 192.168.43.147.8880 > 192.168.43.124.7773: UDP, length 120
01:56:07.871318 IP 192.168.43.146.8880 > 192.168.43.147.7772: UDP, length 120
01:56:07.917940 IP 192.168.43.147.8880 > 192.168.43.124.7773: UDP, length 120
01:56:07.920633 IP 192.168.43.146.8880 > 192.168.43.147.7772: UDP, length 120
01:56:07.967931 IP 192.168.43.147.8880 > 192.168.43.124.7773: UDP, length 120
01:56:07.971667 IP 192.168.43.146.8880 > 192.168.43.147.7772: UDP, length 120
01:56:08.017927 IP 192.168.43.147.8880 > 192.168.43.124.7773: UDP, length 120
01:56:08.018379 IP 192.168.43.146.8880 > 192.168.43.147.7772: UDP, length 120
01:56:08.067978 IP 192.168.43.147.8880 > 192.168.43.124.7773: UDP, length 120
01:56:08.117941 IP 192.168.43.147.8880 > 192.168.43.124.7773: UDP, length 120
01:56:08.167930 IP 192.168.43.147.8880 > 192.168.43.124.7773: UDP, length 120
01:56:08.217924 IP 192.168.43.147.8880 > 192.168.43.124.7773: UDP, length 120
01:56:08.267927 IP 192.168.43.147.8880 > 192.168.43.124.7773: UDP, length 120
01:56:08.317926 IP 192.168.43.147.8880 > 192.168.43.124.7773: UDP, length 120
01:56:08.367933 IP 192.168.43.147.8880 > 192.168.43.124.7773: UDP, length 120
01:56:08.417933 IP 192.168.43.147.8880 > 192.168.43.124.7773: UDP, length 120
01:56:08.467932 IP 192.168.43.147.8880 > 192.168.43.124.7773: UDP, length 120
01:56:08.517923 IP 192.168.43.147.8880 > 192.168.43.124.7773: UDP, length 120
01:56:08.567927 IP 192.168.43.147.8880 > 192.168.43.124.7773: UDP, length 120
01:56:08.617929 IP 192.168.43.147.8880 > 192.168.43.124.7773: UDP, length 120
01:56:08.667932 IP 192.168.43.147.8880 > 192.168.43.124.7773: UDP, length 120
01:56:08.692783 IP 192.168.43.146.8880 > 192.168.43.147.7772: UDP, length 120
01:56:08.693070 IP 192.168.43.146.8880 > 192.168.43.147.7772: UDP, length 120
01:56:08.693185 IP 192.168.43.146.8880 > 192.168.43.147.7772: UDP, length 120
01:56:08.693298 IP 192.168.43.146.8880 > 192.168.43.147.7772: UDP, length 120
01:56:08.693406 IP 192.168.43.146.8880 > 192.168.43.147.7772: UDP, length 120
01:56:08.693513 IP 192.168.43.146.8880 > 192.168.43.147.7772: UDP, length 120
01:56:08.693620 IP 192.168.43.146.8880 > 192.168.43.147.7772: UDP, length 120
01:56:08.693728 IP 192.168.43.146.8880 > 192.168.43.147.7772: UDP, length 120
01:56:08.717947 IP 192.168.43.147.8880 > 192.168.43.124.7773: UDP, length 120
01:56:08.767936 IP 192.168.43.147.8880 > 192.168.43.124.7773: UDP, length 120
01:56:08.794076 IP 192.168.43.146.8880 > 192.168.43.147.7772: UDP, length 120
01:56:08.794300 IP 192.168.43.146.8880 > 192.168.43.147.7772: UDP, length 120
01:56:08.794412 IP 192.168.43.146.8880 > 192.168.43.147.7772: UDP, length 120
01:56:08.817951 IP 192.168.43.147.8880 > 192.168.43.124.7773: UDP, length 120
01:56:08.820997 IP 192.168.43.146.8880 > 192.168.43.147.7772: UDP, length 120
01:56:08.867941 IP 192.168.43.147.8880 > 192.168.43.124.7773: UDP, length 120
01:56:08.871362 IP 192.168.43.146.8880 > 192.168.43.147.7772: UDP, length 120
01:56:08.917929 IP 192.168.43.147.8880 > 192.168.43.124.7773: UDP, length 120
01:56:08.967928 IP 192.168.43.147.8880 > 192.168.43.124.7773: UDP, length 120
01:56:08.986492 IP 192.168.43.146.8880 > 192.168.43.147.7772: UDP, length 120
01:56:09.017928 IP 192.168.43.147.8880 > 192.168.43.124.7773: UDP, length 120
01:56:09.019756 IP 192.168.43.146.8880 > 192.168.43.147.7772: UDP, length 120
01:56:09.067950 IP 192.168.43.147.8880 > 192.168.43.124.7773: UDP, length 120
01:56:09.090719 IP 192.168.43.146.8880 > 192.168.43.147.7772: UDP, length 120
01:56:09.117945 IP 192.168.43.147.8880 > 192.168.43.124.7773: UDP, length 120
01:56:09.145910 IP 192.168.43.146.8880 > 192.168.43.147.7772: UDP, length 120
01:56:09.167927 IP 192.168.43.147.8880 > 192.168.43.124.7773: UDP, length 120
01:56:09.217923 IP 192.168.43.147.8880 > 192.168.43.124.7773: UDP, length 120
01:56:09.221341 IP 192.168.43.146.8880 > 192.168.43.147.7772: UDP, length 120
01:56:09.267929 IP 192.168.43.147.8880 > 192.168.43.124.7773: UDP, length 120
01:56:09.279387 IP 192.168.43.146.8880 > 192.168.43.147.7772: UDP, length 120
01:56:09.317532 IP 192.168.43.146.8880 > 192.168.43.147.7772: UDP, length 120
01:56:09.317937 IP 192.168.43.147.8880 > 192.168.43.124.7773: UDP, length 120
01:56:09.367938 IP 192.168.43.147.8880 > 192.168.43.124.7773: UDP, length 120
01:56:09.403645 IP 192.168.43.146.8880 > 192.168.43.147.7772: UDP, length 120
01:56:09.417924 IP 192.168.43.147.8880 > 192.168.43.124.7773: UDP, length 120
01:56:09.422667 IP 192.168.43.146.8880 > 192.168.43.147.7772: UDP, length 120
01:56:09.467929 IP 192.168.43.147.8880 > 192.168.43.124.7773: UDP, length 120
01:56:09.475740 IP 192.168.43.146.8880 > 192.168.43.147.7772: UDP, length 120
01:56:09.517928 IP 192.168.43.147.8880 > 192.168.43.124.7773: UDP, length 120
01:56:09.521353 IP 192.168.43.146.8880 > 192.168.43.147.7772: UDP, length 120
01:56:09.568047 IP 192.168.43.147.8880 > 192.168.43.124.7773: UDP, length 120
01:56:09.571307 IP 192.168.43.146.8880 > 192.168.43.147.7772: UDP, length 120
01:56:09.617954 IP 192.168.43.147.8880 > 192.168.43.124.7773: UDP, length 120
01:56:09.621839 IP 192.168.43.146.8880 > 192.168.43.147.7772: UDP, length 120
01:56:09.667932 IP 192.168.43.147.8880 > 192.168.43.124.7773: UDP, length 120
01:56:09.680902 IP 192.168.43.146.8880 > 192.168.43.147.7772: UDP, length 120
01:56:09.717926 IP 192.168.43.147.8880 > 192.168.43.124.7773: UDP, length 120
01:56:09.721360 IP 192.168.43.146.8880 > 192.168.43.147.7772: UDP, length 120
01:56:09.767929 IP 192.168.43.147.8880 > 192.168.43.124.7773: UDP, length 120
01:56:09.771357 IP 192.168.43.146.8880 > 192.168.43.147.7772: UDP, length 120
01:56:09.815927 IP 192.168.43.146.8880 > 192.168.43.147.7772: UDP, length 120
01:56:09.817949 IP 192.168.43.147.8880 > 192.168.43.124.7773: UDP, length 120
01:56:09.865975 IP 192.168.43.146.8880 > 192.168.43.147.7772: UDP, length 120
01:56:09.867940 IP 192.168.43.147.8880 > 192.168.43.124.7773: UDP, length 120
01:56:09.917929 IP 192.168.43.147.8880 > 192.168.43.124.7773: UDP, length 120
01:56:09.919869 IP 192.168.43.146.8880 > 192.168.43.147.7772: UDP, length 120
01:56:09.967932 IP 192.168.43.147.8880 > 192.168.43.124.7773: UDP, length 120
01:56:09.975429 IP 192.168.43.146.8880 > 192.168.43.147.7772: UDP, length 120
01:56:10.017942 IP 192.168.43.147.8880 > 192.168.43.124.7773: UDP, length 120
01:56:10.065901 IP 192.168.43.146.8880 > 192.168.43.147.7772: UDP, length 120
01:56:10.067941 IP 192.168.43.147.8880 > 192.168.43.124.7773: UDP, length 120
01:56:10.117929 IP 192.168.43.147.8880 > 192.168.43.124.7773: UDP, length 120
01:56:10.167926 IP 192.168.43.147.8880 > 192.168.43.124.7773: UDP, length 120
01:56:10.169093 IP 192.168.43.146.8880 > 192.168.43.147.7772: UDP, length 120
01:56:10.217150 IP 192.168.43.146.8880 > 192.168.43.147.7772: UDP, length 120
01:56:10.217936 IP 192.168.43.147.8880 > 192.168.43.124.7773: UDP, length 120
01:56:10.267932 IP 192.168.43.147.8880 > 192.168.43.124.7773: UDP, length 120
01:56:10.271378 IP 192.168.43.146.8880 > 192.168.43.147.7772: UDP, length 120
01:56:10.317938 IP 192.168.43.147.8880 > 192.168.43.124.7773: UDP, length 120
01:56:10.321344 IP 192.168.43.146.8880 > 192.168.43.147.7772: UDP, length 120
01:56:10.367926 IP 192.168.43.147.8880 > 192.168.43.124.7773: UDP, length 120
01:56:10.369985 IP 192.168.43.146.8880 > 192.168.43.147.7772: UDP, length 120
01:56:10.417928 IP 192.168.43.147.8880 > 192.168.43.124.7773: UDP, length 120
01:56:10.421342 IP 192.168.43.146.8880 > 192.168.43.147.7772: UDP, length 120
01:56:10.467929 IP 192.168.43.147.8880 > 192.168.43.124.7773: UDP, length 120
01:56:10.471137 IP 192.168.43.146.8880 > 192.168.43.147.7772: UDP, length 120
01:56:10.517931 IP 192.168.43.147.8880 > 192.168.43.124.7773: UDP, length 120
01:56:10.521424 IP 192.168.43.146.8880 > 192.168.43.147.7772: UDP, length 120
01:56:10.567944 IP 192.168.43.147.8880 > 192.168.43.124.7773: UDP, length 120
01:56:10.574687 IP 192.168.43.146.8880 > 192.168.43.147.7772: UDP, length 120
01:56:10.617929 IP 192.168.43.147.8880 > 192.168.43.124.7773: UDP, length 120
01:56:10.667927 IP 192.168.43.147.8880 > 192.168.43.124.7773: UDP, length 120
01:56:10.674208 IP 192.168.43.146.8880 > 192.168.43.147.7772: UDP, length 120
01:56:10.674442 IP 192.168.43.146.8880 > 192.168.43.147.7772: UDP, length 120
01:56:10.715259 IP 192.168.43.146.8880 > 192.168.43.147.7772: UDP, length 120
01:56:10.717926 IP 192.168.43.147.8880 > 192.168.43.124.7773: UDP, length 120
01:56:10.765466 IP 192.168.43.146.8880 > 192.168.43.147.7772: UDP, length 120
01:56:10.767924 IP 192.168.43.147.8880 > 192.168.43.124.7773: UDP, length 120
01:56:10.815416 IP 192.168.43.146.8880 > 192.168.43.147.7772: UDP, length 120
01:56:10.817926 IP 192.168.43.147.8880 > 192.168.43.124.7773: UDP, length 120
01:56:10.865928 IP 192.168.43.146.8880 > 192.168.43.147.7772: UDP, length 120
01:56:10.867932 IP 192.168.43.147.8880 > 192.168.43.124.7773: UDP, length 120
01:56:10.915120 IP 192.168.43.146.8880 > 192.168.43.147.7772: UDP, length 120
01:56:10.917931 IP 192.168.43.147.8880 > 192.168.43.124.7773: UDP, length 120
01:56:10.965437 IP 192.168.43.146.8880 > 192.168.43.147.7772: UDP, length 120
01:56:10.967926 IP 192.168.43.147.8880 > 192.168.43.124.7773: UDP, length 120
01:56:11.015368 IP 192.168.43.146.8880 > 192.168.43.147.7772: UDP, length 120
01:56:11.017927 IP 192.168.43.147.8880 > 192.168.43.124.7773: UDP, length 120
01:56:11.065658 IP 192.168.43.146.8880 > 192.168.43.147.7772: UDP, length 120
01:56:11.067970 IP 192.168.43.147.8880 > 192.168.43.124.7773: UDP, length 120
01:56:11.116669 IP 192.168.43.146.8880 > 192.168.43.147.7772: UDP, length 120
01:56:11.117937 IP 192.168.43.147.8880 > 192.168.43.124.7773: UDP, length 120
01:56:11.166068 IP 192.168.43.146.8880 > 192.168.43.147.7772: UDP, length 120
01:56:11.167930 IP 192.168.43.147.8880 > 192.168.43.124.7773: UDP, length 120
01:56:11.217930 IP 192.168.43.147.8880 > 192.168.43.124.7773: UDP, length 120
01:56:11.218162 IP 192.168.43.146.8880 > 192.168.43.147.7772: UDP, length 120
01:56:11.266747 IP 192.168.43.146.8880 > 192.168.43.147.7772: UDP, length 120
01:56:11.267991 IP 192.168.43.147.8880 > 192.168.43.124.7773: UDP, length 120
01:56:11.318096 IP 192.168.43.147.8880 > 192.168.43.124.7773: UDP, length 120
01:56:11.321308 IP 192.168.43.146.8880 > 192.168.43.147.7772: UDP, length 120
01:56:11.368061 IP 192.168.43.147.8880 > 192.168.43.124.7773: UDP, length 120
01:56:11.371769 IP 192.168.43.146.8880 > 192.168.43.147.7772: UDP, length 120
01:56:11.417994 IP 192.168.43.147.8880 > 192.168.43.124.7773: UDP, length 120
01:56:11.418928 IP 192.168.43.146.8880 > 192.168.43.147.7772: UDP, length 120
01:56:11.468055 IP 192.168.43.147.8880 > 192.168.43.124.7773: UDP, length 120
01:56:11.517970 IP 192.168.43.147.8880 > 192.168.43.124.7773: UDP, length 120
01:56:11.567994 IP 192.168.43.147.8880 > 192.168.43.124.7773: UDP, length 120
01:56:11.617985 IP 192.168.43.147.8880 > 192.168.43.124.7773: UDP, length 120
01:56:11.667971 IP 192.168.43.147.8880 > 192.168.43.124.7773: UDP, length 120
01:56:11.717968 IP 192.168.43.147.8880 > 192.168.43.124.7773: UDP, length 120
01:56:11.719128 IP 192.168.43.146.8880 > 192.168.43.147.7772: UDP, length 120
01:56:11.767934 IP 192.168.43.147.8880 > 192.168.43.124.7773: UDP, length 120
01:56:11.769355 IP 192.168.43.146.8880 > 192.168.43.147.7772: UDP, length 120
01:56:11.817914 IP 192.168.43.147.8880 > 192.168.43.124.7773: UDP, length 120
01:56:11.818516 IP 192.168.43.146.8880 > 192.168.43.147.7772: UDP, length 120
01:56:11.866055 IP 192.168.43.146.8880 > 192.168.43.147.7772: UDP, length 120
01:56:11.867904 IP 192.168.43.147.8880 > 192.168.43.124.7773: UDP, length 120
01:56:11.917937 IP 192.168.43.147.8880 > 192.168.43.124.7773: UDP, length 120
01:56:11.919791 IP 192.168.43.146.8880 > 192.168.43.147.7772: UDP, length 120
01:56:11.966398 IP 192.168.43.146.8880 > 192.168.43.147.7772: UDP, length 120
01:56:11.967934 IP 192.168.43.147.8880 > 192.168.43.124.7773: UDP, length 120
01:56:12.017938 IP 192.168.43.147.8880 > 192.168.43.124.7773: UDP, length 120
01:56:12.018293 IP 192.168.43.146.8880 > 192.168.43.147.7772: UDP, length 120
01:56:12.067948 IP 192.168.43.147.8880 > 192.168.43.124.7773: UDP, length 120
01:56:12.069350 IP 192.168.43.146.8880 > 192.168.43.147.7772: UDP, length 120
01:56:12.117941 IP 192.168.43.147.8880 > 192.168.43.124.7773: UDP, length 120
01:56:12.118986 IP 192.168.43.146.8880 > 192.168.43.147.7772: UDP, length 120
01:56:12.166057 IP 192.168.43.146.8880 > 192.168.43.147.7772: UDP, length 120
01:56:12.167931 IP 192.168.43.147.8880 > 192.168.43.124.7773: UDP, length 120
01:56:12.217967 IP 192.168.43.147.8880 > 192.168.43.124.7773: UDP, length 120
01:56:12.217972 IP 192.168.43.146.8880 > 192.168.43.147.7772: UDP, length 120
01:56:12.265218 IP 192.168.43.146.8880 > 192.168.43.147.7772: UDP, length 120
01:56:12.267933 IP 192.168.43.147.8880 > 192.168.43.124.7773: UDP, length 120
01:56:12.315640 IP 192.168.43.146.8880 > 192.168.43.147.7772: UDP, length 120
01:56:12.317939 IP 192.168.43.147.8880 > 192.168.43.124.7773: UDP, length 120
01:56:12.365373 IP 192.168.43.146.8880 > 192.168.43.147.7772: UDP, length 120
01:56:12.367937 IP 192.168.43.147.8880 > 192.168.43.124.7773: UDP, length 120
01:56:12.415451 IP 192.168.43.146.8880 > 192.168.43.147.7772: UDP, length 120
01:56:12.417932 IP 192.168.43.147.8880 > 192.168.43.124.7773: UDP, length 120
01:56:12.467268 IP 192.168.43.146.8880 > 192.168.43.147.7772: UDP, length 120
01:56:12.467929 IP 192.168.43.147.8880 > 192.168.43.124.7773: UDP, length 120
01:56:12.517928 IP 192.168.43.147.8880 > 192.168.43.124.7773: UDP, length 120
01:56:12.518936 IP 192.168.43.146.8880 > 192.168.43.147.7772: UDP, length 120
01:56:12.567991 IP 192.168.43.147.8880 > 192.168.43.124.7773: UDP, length 120
01:56:12.570014 IP 192.168.43.146.8880 > 192.168.43.147.7772: UDP, length 120
01:56:12.617950 IP 192.168.43.147.8880 > 192.168.43.124.7773: UDP, length 120
01:56:12.626771 IP 192.168.43.146.8880 > 192.168.43.147.7772: UDP, length 120
01:56:12.667936 IP 192.168.43.147.8880 > 192.168.43.124.7773: UDP, length 120
01:56:12.671348 IP 192.168.43.146.8880 > 192.168.43.147.7772: UDP, length 120
01:56:12.717304 IP 192.168.43.146.8880 > 192.168.43.147.7772: UDP, length 120
01:56:12.717930 IP 192.168.43.147.8880 > 192.168.43.124.7773: UDP, length 120
01:56:12.767927 IP 192.168.43.147.8880 > 192.168.43.124.7773: UDP, length 120
01:56:12.780336 IP 192.168.43.146.8880 > 192.168.43.147.7772: UDP, length 120
01:56:12.817940 IP 192.168.43.147.8880 > 192.168.43.124.7773: UDP, length 120
01:56:12.826525 IP 192.168.43.146.8880 > 192.168.43.147.7772: UDP, length 120
01:56:12.867939 IP 192.168.43.147.8880 > 192.168.43.124.7773: UDP, length 120
01:56:12.874792 IP 192.168.43.146.8880 > 192.168.43.147.7772: UDP, length 120
01:56:12.917937 IP 192.168.43.147.8880 > 192.168.43.124.7773: UDP, length 120
01:56:12.967927 IP 192.168.43.147.8880 > 192.168.43.124.7773: UDP, length 120
01:56:12.980624 IP 192.168.43.146.8880 > 192.168.43.147.7772: UDP, length 120
01:56:12.981059 IP 192.168.43.146.8880 > 192.168.43.147.7772: UDP, length 120
01:56:13.017947 IP 192.168.43.147.8880 > 192.168.43.124.7773: UDP, length 120
01:56:13.043594 IP 192.168.43.146.8880 > 192.168.43.147.7772: UDP, length 120
01:56:13.067961 IP 192.168.43.147.8880 > 192.168.43.124.7773: UDP, length 120
01:56:13.070589 IP 192.168.43.146.8880 > 192.168.43.147.7772: UDP, length 120
01:56:13.117934 IP 192.168.43.147.8880 > 192.168.43.124.7773: UDP, length 120
01:56:13.141769 IP 192.168.43.146.8880 > 192.168.43.147.7772: UDP, length 120
01:56:13.167927 IP 192.168.43.147.8880 > 192.168.43.124.7773: UDP, length 120
01:56:13.217928 IP 192.168.43.147.8880 > 192.168.43.124.7773: UDP, length 120
01:56:13.267936 IP 192.168.43.147.8880 > 192.168.43.124.7773: UDP, length 120
01:56:13.317927 IP 192.168.43.147.8880 > 192.168.43.124.7773: UDP, length 120
01:56:13.367927 IP 192.168.43.147.8880 > 192.168.43.124.7773: UDP, length 120
01:56:13.398038 IP 192.168.43.146.8880 > 192.168.43.147.7772: UDP, length 120
01:56:13.398301 IP 192.168.43.146.8880 > 192.168.43.147.7772: UDP, length 120
01:56:13.398510 IP 192.168.43.146.8880 > 192.168.43.147.7772: UDP, length 120
01:56:13.398713 IP 192.168.43.146.8880 > 192.168.43.147.7772: UDP, length 120
01:56:13.398919 IP 192.168.43.146.8880 > 192.168.43.147.7772: UDP, length 120
01:56:13.413589 IP 192.168.43.146.8880 > 192.168.43.147.7772: UDP, length 120
01:56:13.417930 IP 192.168.43.147.8880 > 192.168.43.124.7773: UDP, length 120
01:56:13.467926 IP 192.168.43.147.8880 > 192.168.43.124.7773: UDP, length 120
01:56:13.480090 IP 192.168.43.146.8880 > 192.168.43.147.7772: UDP, length 120
01:56:13.517942 IP 192.168.43.147.8880 > 192.168.43.124.7773: UDP, length 120
01:56:13.520871 IP 192.168.43.146.8880 > 192.168.43.147.7772: UDP, length 120
01:56:13.567927 IP 192.168.43.147.8880 > 192.168.43.124.7773: UDP, length 120
01:56:13.571343 IP 192.168.43.146.8880 > 192.168.43.147.7772: UDP, length 120
01:56:13.617930 IP 192.168.43.147.8880 > 192.168.43.124.7773: UDP, length 120
01:56:13.620572 IP 192.168.43.146.8880 > 192.168.43.147.7772: UDP, length 120
01:56:13.667931 IP 192.168.43.147.8880 > 192.168.43.124.7773: UDP, length 120
01:56:13.668122 IP 192.168.43.146.8880 > 192.168.43.147.7772: UDP, length 120
01:56:13.717927 IP 192.168.43.147.8880 > 192.168.43.124.7773: UDP, length 120
01:56:13.723095 IP 192.168.43.146.8880 > 192.168.43.147.7772: UDP, length 120
01:56:13.767927 IP 192.168.43.147.8880 > 192.168.43.124.7773: UDP, length 120
01:56:13.804848 IP 192.168.43.146.8880 > 192.168.43.147.7772: UDP, length 120
01:56:13.816860 IP 192.168.43.146.8880 > 192.168.43.147.7772: UDP, length 120
01:56:13.817927 IP 192.168.43.147.8880 > 192.168.43.124.7773: UDP, length 120
01:56:13.867928 IP 192.168.43.147.8880 > 192.168.43.124.7773: UDP, length 120
01:56:13.878681 IP 192.168.43.146.8880 > 192.168.43.147.7772: UDP, length 120
01:56:13.917931 IP 192.168.43.147.8880 > 192.168.43.124.7773: UDP, length 120
01:56:13.926177 IP 192.168.43.146.8880 > 192.168.43.147.7772: UDP, length 120
01:56:13.967928 IP 192.168.43.147.8880 > 192.168.43.124.7773: UDP, length 120
01:56:13.974605 IP 192.168.43.146.8880 > 192.168.43.147.7772: UDP, length 120
01:56:14.016780 IP 192.168.43.146.8880 > 192.168.43.147.7772: UDP, length 120
01:56:14.017935 IP 192.168.43.147.8880 > 192.168.43.124.7773: UDP, length 120
01:56:14.067982 IP 192.168.43.147.8880 > 192.168.43.124.7773: UDP, length 120
01:56:14.084668 IP 192.168.43.146.8880 > 192.168.43.147.7772: UDP, length 120
01:56:14.116646 IP 192.168.43.146.8880 > 192.168.43.147.7772: UDP, length 120
