01:18:23.312416 IP 192.168.43.147.8880 > 192.168.43.124.7773: UDP, length 120
01:18:23.324678 IP 192.168.43.146.8880 > 192.168.43.147.7772: UDP, length 120
01:18:23.362471 IP 192.168.43.147.8880 > 192.168.43.124.7773: UDP, length 120
01:18:23.374180 IP 192.168.43.146.8880 > 192.168.43.147.7772: UDP, length 120
01:18:23.412467 IP 192.168.43.147.8880 > 192.168.43.124.7773: UDP, length 120
01:18:23.424526 IP 192.168.43.146.8880 > 192.168.43.147.7772: UDP, length 120
01:18:23.462451 IP 192.168.43.147.8880 > 192.168.43.124.7773: UDP, length 120
01:18:23.476892 IP 192.168.43.146.8880 > 192.168.43.147.7772: UDP, length 120
01:18:23.512444 IP 192.168.43.147.8880 > 192.168.43.124.7773: UDP, length 120
01:18:23.531121 IP 192.168.43.146.8880 > 192.168.43.147.7772: UDP, length 120
01:18:23.562441 IP 192.168.43.147.8880 > 192.168.43.124.7773: UDP, length 120
01:18:23.572146 IP 192.168.43.146.8880 > 192.168.43.147.7772: UDP, length 120
01:18:23.612443 IP 192.168.43.147.8880 > 192.168.43.124.7773: UDP, length 120
01:18:23.627174 IP 192.168.43.146.8880 > 192.168.43.147.7772: UDP, length 120
01:18:23.662442 IP 192.168.43.147.8880 > 192.168.43.124.7773: UDP, length 120
01:18:23.672118 IP 192.168.43.146.8880 > 192.168.43.147.7772: UDP, length 120
01:18:23.712443 IP 192.168.43.147.8880 > 192.168.43.124.7773: UDP, length 120
01:18:23.745672 IP 192.168.43.146.8880 > 192.168.43.147.7772: UDP, length 120
01:18:23.762443 IP 192.168.43.147.8880 > 192.168.43.124.7773: UDP, length 120
01:18:23.772649 IP 192.168.43.146.8880 > 192.168.43.147.7772: UDP, length 120
01:18:23.812443 IP 192.168.43.147.8880 > 192.168.43.124.7773: UDP, length 120
01:18:23.821872 IP 192.168.43.146.8880 > 192.168.43.147.7772: UDP, length 120
01:18:23.862451 IP 192.168.43.147.8880 > 192.168.43.124.7773: UDP, length 120
01:18:23.873403 IP 192.168.43.146.8880 > 192.168.43.147.7772: UDP, length 120
01:18:23.912455 IP 192.168.43.147.8880 > 192.168.43.124.7773: UDP, length 120
01:18:23.922497 IP 192.168.43.146.8880 > 192.168.43.147.7772: UDP, length 120
01:18:23.962449 IP 192.168.43.147.8880 > 192.168.43.124.7773: UDP, length 120
01:18:23.975376 IP 192.168.43.146.8880 > 192.168.43.147.7772: UDP, length 120
01:18:24.012443 IP 192.168.43.147.8880 > 192.168.43.124.7773: UDP, length 120
01:18:24.024448 IP 192.168.43.146.8880 > 192.168.43.147.7772: UDP, length 120
01:18:24.062442 IP 192.168.43.147.8880 > 192.168.43.124.7773: UDP, length 120
01:18:24.070243 IP 192.168.43.146.8880 > 192.168.43.147.7772: UDP, length 120
01:18:24.112442 IP 192.168.43.147.8880 > 192.168.43.124.7773: UDP, length 120
01:18:24.119308 IP 192.168.43.146.8880 > 192.168.43.147.7772: UDP, length 120
01:18:24.162443 IP 192.168.43.147.8880 > 192.168.43.124.7773: UDP, length 120
01:18:24.170153 IP 192.168.43.146.8880 > 192.168.43.147.7772: UDP, length 120
01:18:24.212450 IP 192.168.43.147.8880 > 192.168.43.124.7773: UDP, length 120
01:18:24.221822 IP 192.168.43.146.8880 > 192.168.43.147.7772: UDP, length 120
01:18:24.262446 IP 192.168.43.147.8880 > 192.168.43.124.7773: UDP, length 120
01:18:24.272231 IP 192.168.43.146.8880 > 192.168.43.147.7772: UDP, length 120
01:18:24.312449 IP 192.168.43.147.8880 > 192.168.43.124.7773: UDP, length 120
01:18:24.323443 IP 192.168.43.146.8880 > 192.168.43.147.7772: UDP, length 120
01:18:24.362448 IP 192.168.43.147.8880 > 192.168.43.124.7773: UDP, length 120
01:18:24.375447 IP 192.168.43.146.8880 > 192.168.43.147.7772: UDP, length 120
01:18:24.412451 IP 192.168.43.147.8880 > 192.168.43.124.7773: UDP, length 120
01:18:24.425978 IP 192.168.43.146.8880 > 192.168.43.147.7772: UDP, length 120
01:18:24.462448 IP 192.168.43.147.8880 > 192.168.43.124.7773: UDP, length 120
01:18:24.481217 IP 192.168.43.146.8880 > 192.168.43.147.7772: UDP, length 120
01:18:24.512441 IP 192.168.43.147.8880 > 192.168.43.124.7773: UDP, length 120
01:18:24.520294 IP 192.168.43.146.8880 > 192.168.43.147.7772: UDP, length 120
01:18:24.562445 IP 192.168.43.147.8880 > 192.168.43.124.7773: UDP, length 120
01:18:24.575167 IP 192.168.43.146.8880 > 192.168.43.147.7772: UDP, length 120
01:18:24.612444 IP 192.168.43.147.8880 > 192.168.43.124.7773: UDP, length 120
01:18:24.622532 IP 192.168.43.146.8880 > 192.168.43.147.7772: UDP, length 120
01:18:24.662493 IP 192.168.43.147.8880 > 192.168.43.124.7773: UDP, length 120
01:18:24.671310 IP 192.168.43.146.8880 > 192.168.43.147.7772: UDP, length 120
01:18:24.712453 IP 192.168.43.147.8880 > 192.168.43.124.7773: UDP, length 120
01:18:24.721686 IP 192.168.43.146.8880 > 192.168.43.147.7772: UDP, length 120
01:18:24.762445 IP 192.168.43.147.8880 > 192.168.43.124.7773: UDP, length 120
01:18:24.771562 IP 192.168.43.146.8880 > 192.168.43.147.7772: UDP, length 120
01:18:24.812447 IP 192.168.43.147.8880 > 192.168.43.124.7773: UDP, length 120
01:18:24.822090 IP 192.168.43.146.8880 > 192.168.43.147.7772: UDP, length 120
01:18:24.862450 IP 192.168.43.147.8880 > 192.168.43.124.7773: UDP, length 120
01:18:24.871223 IP 192.168.43.146.8880 > 192.168.43.147.7772: UDP, length 120
01:18:24.912456 IP 192.168.43.147.8880 > 192.168.43.124.7773: UDP, length 120
01:18:24.922402 IP 192.168.43.146.8880 > 192.168.43.147.7772: UDP, length 120
01:18:24.962450 IP 192.168.43.147.8880 > 192.168.43.124.7773: UDP, length 120
01:18:24.973515 IP 192.168.43.146.8880 > 192.168.43.147.7772: UDP, length 120
01:18:25.012417 IP 192.168.43.147.8880 > 192.168.43.124.7773: UDP, length 120
01:18:25.021890 IP 192.168.43.146.8880 > 192.168.43.147.7772: UDP, length 120
01:18:25.062441 IP 192.168.43.147.8880 > 192.168.43.124.7773: UDP, length 120
01:18:25.070085 IP 192.168.43.146.8880 > 192.168.43.147.7772: UDP, length 120
01:18:25.112443 IP 192.168.43.147.8880 > 192.168.43.124.7773: UDP, length 120
01:18:25.123548 IP 192.168.43.146.8880 > 192.168.43.147.7772: UDP, length 120
01:18:25.162444 IP 192.168.43.147.8880 > 192.168.43.124.7773: UDP, length 120
01:18:25.169573 IP 192.168.43.146.8880 > 192.168.43.147.7772: UDP, length 120
01:18:25.212442 IP 192.168.43.147.8880 > 192.168.43.124.7773: UDP, length 120
01:18:25.223366 IP 192.168.43.146.8880 > 192.168.43.147.7772: UDP, length 120
01:18:25.262442 IP 192.168.43.147.8880 > 192.168.43.124.7773: UDP, length 120
01:18:25.272889 IP 192.168.43.146.8880 > 192.168.43.147.7772: UDP, length 120
01:18:25.312443 IP 192.168.43.147.8880 > 192.168.43.124.7773: UDP, length 120
01:18:25.321709 IP 192.168.43.146.8880 > 192.168.43.147.7772: UDP, length 120
01:18:25.362442 IP 192.168.43.147.8880 > 192.168.43.124.7773: UDP, length 120
01:18:25.376739 IP 192.168.43.146.8880 > 192.168.43.147.7772: UDP, length 120
01:18:25.412454 IP 192.168.43.147.8880 > 192.168.43.124.7773: UDP, length 120
01:18:25.433838 IP 192.168.43.146.8880 > 192.168.43.147.7772: UDP, length 120
01:18:25.462446 IP 192.168.43.147.8880 > 192.168.43.124.7773: UDP, length 120
01:18:25.488431 IP 192.168.43.146.8880 > 192.168.43.147.7772: UDP, length 120
01:18:25.512444 IP 192.168.43.147.8880 > 192.168.43.124.7773: UDP, length 120
01:18:25.541735 IP 192.168.43.146.8880 > 192.168.43.147.7772: UDP, length 120
01:18:25.562451 IP 192.168.43.147.8880 > 192.168.43.124.7773: UDP, length 120
01:18:25.574337 IP 192.168.43.146.8880 > 192.168.43.147.7772: UDP, length 120
01:18:25.612444 IP 192.168.43.147.8880 > 192.168.43.124.7773: UDP, length 120
01:18:25.624616 IP 192.168.43.146.8880 > 192.168.43.147.7772: UDP, length 120
01:18:25.662444 IP 192.168.43.147.8880 > 192.168.43.124.7773: UDP, length 120
01:18:25.680840 IP 192.168.43.146.8880 > 192.168.43.147.7772: UDP, length 120
01:18:25.712448 IP 192.168.43.147.8880 > 192.168.43.124.7773: UDP, length 120
01:18:25.734149 IP 192.168.43.146.8880 > 192.168.43.147.7772: UDP, length 120
01:18:25.762442 IP 192.168.43.147.8880 > 192.168.43.124.7773: UDP, length 120
01:18:25.787347 IP 192.168.43.146.8880 > 192.168.43.147.7772: UDP, length 120
01:18:25.812444 IP 192.168.43.147.8880 > 192.168.43.124.7773: UDP, length 120
01:18:25.819951 IP 192.168.43.146.8880 > 192.168.43.147.7772: UDP, length 120
01:18:25.862448 IP 192.168.43.147.8880 > 192.168.43.124.7773: UDP, length 120
01:18:25.876082 IP 192.168.43.146.8880 > 192.168.43.147.7772: UDP, length 120
01:18:25.912443 IP 192.168.43.147.8880 > 192.168.43.124.7773: UDP, length 120
01:18:25.920984 IP 192.168.43.146.8880 > 192.168.43.147.7772: UDP, length 120
01:18:25.962448 IP 192.168.43.147.8880 > 192.168.43.124.7773: UDP, length 120
01:18:25.982452 IP 192.168.43.146.8880 > 192.168.43.147.7772: UDP, length 120
01:18:26.012447 IP 192.168.43.147.8880 > 192.168.43.124.7773: UDP, length 120
01:18:26.042372 IP 192.168.43.146.8880 > 192.168.43.147.7772: UDP, length 120
01:18:26.062443 IP 192.168.43.147.8880 > 192.168.43.124.7773: UDP, length 120
01:18:26.074361 IP 192.168.43.146.8880 > 192.168.43.147.7772: UDP, length 120
01:18:26.112441 IP 192.168.43.147.8880 > 192.168.43.124.7773: UDP, length 120
01:18:26.125632 IP 192.168.43.146.8880 > 192.168.43.147.7772: UDP, length 120
01:18:26.162482 IP 192.168.43.147.8880 > 192.168.43.124.7773: UDP, length 120
01:18:26.182029 IP 192.168.43.146.8880 > 192.168.43.147.7772: UDP, length 120
01:18:26.212452 IP 192.168.43.147.8880 > 192.168.43.124.7773: UDP, length 120
01:18:26.236591 IP 192.168.43.146.8880 > 192.168.43.147.7772: UDP, length 120
01:18:26.262442 IP 192.168.43.147.8880 > 192.168.43.124.7773: UDP, length 120
01:18:26.269033 IP 192.168.43.146.8880 > 192.168.43.147.7772: UDP, length 120
01:18:26.312442 IP 192.168.43.147.8880 > 192.168.43.124.7773: UDP, length 120
01:18:26.324802 IP 192.168.43.146.8880 > 192.168.43.147.7772: UDP, length 120
01:18:26.362441 IP 192.168.43.147.8880 > 192.168.43.124.7773: UDP, length 120
01:18:26.380908 IP 192.168.43.146.8880 > 192.168.43.147.7772: UDP, length 120
01:18:26.412447 IP 192.168.43.147.8880 > 192.168.43.124.7773: UDP, length 120
01:18:26.435629 IP 192.168.43.146.8880 > 192.168.43.147.7772: UDP, length 120
01:18:26.462443 IP 192.168.43.147.8880 > 192.168.43.124.7773: UDP, length 120
01:18:26.499217 IP 192.168.43.146.8880 > 192.168.43.147.7772: UDP, length 120
01:18:26.512444 IP 192.168.43.147.8880 > 192.168.43.124.7773: UDP, length 120
01:18:26.543659 IP 192.168.43.146.8880 > 192.168.43.147.7772: UDP, length 120
01:18:26.562440 IP 192.168.43.147.8880 > 192.168.43.124.7773: UDP, length 120
01:18:26.571845 IP 192.168.43.146.8880 > 192.168.43.147.7772: UDP, length 120
01:18:26.612459 IP 192.168.43.147.8880 > 192.168.43.124.7773: UDP, length 120
01:18:26.630959 IP 192.168.43.146.8880 > 192.168.43.147.7772: UDP, length 120
01:18:26.662441 IP 192.168.43.147.8880 > 192.168.43.124.7773: UDP, length 120
01:18:26.684913 IP 192.168.43.146.8880 > 192.168.43.147.7772: UDP, length 120
01:18:26.712442 IP 192.168.43.147.8880 > 192.168.43.124.7773: UDP, length 120
01:18:26.739628 IP 192.168.43.146.8880 > 192.168.43.147.7772: UDP, length 120
01:18:26.762446 IP 192.168.43.147.8880 > 192.168.43.124.7773: UDP, length 120
01:18:26.769254 IP 192.168.43.146.8880 > 192.168.43.147.7772: UDP, length 120
01:18:26.812442 IP 192.168.43.147.8880 > 192.168.43.124.7773: UDP, length 120
01:18:26.832537 IP 192.168.43.146.8880 > 192.168.43.147.7772: UDP, length 120
01:18:26.862442 IP 192.168.43.147.8880 > 192.168.43.124.7773: UDP, length 120
01:18:26.886736 IP 192.168.43.146.8880 > 192.168.43.147.7772: UDP, length 120
01:18:26.912468 IP 192.168.43.147.8880 > 192.168.43.124.7773: UDP, length 120
01:18:26.940527 IP 192.168.43.146.8880 > 192.168.43.147.7772: UDP, length 120
01:18:26.962473 IP 192.168.43.147.8880 > 192.168.43.124.7773: UDP, length 120
01:18:26.971908 IP 192.168.43.146.8880 > 192.168.43.147.7772: UDP, length 120
01:18:27.012475 IP 192.168.43.147.8880 > 192.168.43.124.7773: UDP, length 120
01:18:27.024536 IP 192.168.43.146.8880 > 192.168.43.147.7772: UDP, length 120
01:18:27.062472 IP 192.168.43.147.8880 > 192.168.43.124.7773: UDP, length 120
01:18:27.081749 IP 192.168.43.146.8880 > 192.168.43.147.7772: UDP, length 120
01:18:27.112471 IP 192.168.43.147.8880 > 192.168.43.124.7773: UDP, length 120
01:18:27.138404 IP 192.168.43.146.8880 > 192.168.43.147.7772: UDP, length 120
01:18:27.162504 IP 192.168.43.147.8880 > 192.168.43.124.7773: UDP, length 120
01:18:27.170535 IP 192.168.43.146.8880 > 192.168.43.147.7772: UDP, length 120
01:18:27.212481 IP 192.168.43.147.8880 > 192.168.43.124.7773: UDP, length 120
01:18:27.233483 IP 192.168.43.146.8880 > 192.168.43.147.7772: UDP, length 120
01:18:27.262479 IP 192.168.43.147.8880 > 192.168.43.124.7773: UDP, length 120
01:18:27.286159 IP 192.168.43.146.8880 > 192.168.43.147.7772: UDP, length 120
01:18:27.312470 IP 192.168.43.147.8880 > 192.168.43.124.7773: UDP, length 120
01:18:27.319745 IP 192.168.43.146.8880 > 192.168.43.147.7772: UDP, length 120
01:18:27.362468 IP 192.168.43.147.8880 > 192.168.43.124.7773: UDP, length 120
01:18:27.375748 IP 192.168.43.146.8880 > 192.168.43.147.7772: UDP, length 120
01:18:27.412503 IP 192.168.43.147.8880 > 192.168.43.124.7773: UDP, length 120
01:18:27.433281 IP 192.168.43.146.8880 > 192.168.43.147.7772: UDP, length 120
01:18:27.462487 IP 192.168.43.147.8880 > 192.168.43.124.7773: UDP, length 120
01:18:27.487846 IP 192.168.43.146.8880 > 192.168.43.147.7772: UDP, length 120
01:18:27.512481 IP 192.168.43.147.8880 > 192.168.43.124.7773: UDP, length 120
01:18:27.542206 IP 192.168.43.146.8880 > 192.168.43.147.7772: UDP, length 120
01:18:27.562479 IP 192.168.43.147.8880 > 192.168.43.124.7773: UDP, length 120
01:18:27.595916 IP 192.168.43.146.8880 > 192.168.43.147.7772: UDP, length 120
01:18:27.612550 IP 192.168.43.147.8880 > 192.168.43.124.7773: UDP, length 120
01:18:27.625277 IP 192.168.43.146.8880 > 192.168.43.147.7772: UDP, length 120
01:18:27.662561 IP 192.168.43.147.8880 > 192.168.43.124.7773: UDP, length 120
01:18:27.677119 IP 192.168.43.146.8880 > 192.168.43.147.7772: UDP, length 120
01:18:27.712519 IP 192.168.43.147.8880 > 192.168.43.124.7773: UDP, length 120
01:18:27.732470 IP 192.168.43.146.8880 > 192.168.43.147.7772: UDP, length 120
01:18:27.762544 IP 192.168.43.147.8880 > 192.168.43.124.7773: UDP, length 120
01:18:27.786713 IP 192.168.43.146.8880 > 192.168.43.147.7772: UDP, length 120
01:18:27.812521 IP 192.168.43.147.8880 > 192.168.43.124.7773: UDP, length 120
01:18:27.842348 IP 192.168.43.146.8880 > 192.168.43.147.7772: UDP, length 120
01:18:27.862552 IP 192.168.43.147.8880 > 192.168.43.124.7773: UDP, length 120
01:18:27.897048 IP 192.168.43.146.8880 > 192.168.43.147.7772: UDP, length 120
01:18:27.912535 IP 192.168.43.147.8880 > 192.168.43.124.7773: UDP, length 120
01:18:27.951779 IP 192.168.43.146.8880 > 192.168.43.147.7772: UDP, length 120
01:18:27.962515 IP 192.168.43.147.8880 > 192.168.43.124.7773: UDP, length 120
01:18:27.982706 IP 192.168.43.146.8880 > 192.168.43.147.7772: UDP, length 120
01:18:28.012546 IP 192.168.43.147.8880 > 192.168.43.124.7773: UDP, length 120
01:18:28.050612 IP 192.168.43.146.8880 > 192.168.43.147.7772: UDP, length 120
01:18:28.062531 IP 192.168.43.147.8880 > 192.168.43.124.7773: UDP, length 120
01:18:28.084751 IP 192.168.43.146.8880 > 192.168.43.147.7772: UDP, length 120
01:18:28.112488 IP 192.168.43.147.8880 > 192.168.43.124.7773: UDP, length 120
01:18:28.162452 IP 192.168.43.147.8880 > 192.168.43.124.7773: UDP, length 120
01:18:28.168542 IP 192.168.43.146.8880 > 192.168.43.147.7772: UDP, length 120
01:18:28.201040 IP 192.168.43.146.8880 > 192.168.43.147.7772: UDP, length 120
01:18:28.212448 IP 192.168.43.147.8880 > 192.168.43.124.7773: UDP, length 120
01:18:28.225703 IP 192.168.43.146.8880 > 192.168.43.147.7772: UDP, length 120
01:18:28.262444 IP 192.168.43.147.8880 > 192.168.43.124.7773: UDP, length 120
01:18:28.285272 IP 192.168.43.146.8880 > 192.168.43.147.7772: UDP, length 120
01:18:28.312442 IP 192.168.43.147.8880 > 192.168.43.124.7773: UDP, length 120
01:18:28.335088 IP 192.168.43.146.8880 > 192.168.43.147.7772: UDP, length 120
01:18:28.362442 IP 192.168.43.147.8880 > 192.168.43.124.7773: UDP, length 120
01:18:28.393932 IP 192.168.43.146.8880 > 192.168.43.147.7772: UDP, length 120
01:18:28.412446 IP 192.168.43.147.8880 > 192.168.43.124.7773: UDP, length 120
01:18:28.420894 IP 192.168.43.146.8880 > 192.168.43.147.7772: UDP, length 120
01:18:28.462445 IP 192.168.43.147.8880 > 192.168.43.124.7773: UDP, length 120
01:18:28.497354 IP 192.168.43.146.8880 > 192.168.43.147.7772: UDP, length 120
01:18:28.512450 IP 192.168.43.147.8880 > 192.168.43.124.7773: UDP, length 120
01:18:28.562443 IP 192.168.43.147.8880 > 192.168.43.124.7773: UDP, length 120
01:18:28.597985 IP 192.168.43.146.8880 > 192.168.43.147.7772: UDP, length 120
01:18:28.598154 IP 192.168.43.146.8880 > 192.168.43.147.7772: UDP, length 120
01:18:28.612443 IP 192.168.43.147.8880 > 192.168.43.124.7773: UDP, length 120
01:18:28.635864 IP 192.168.43.146.8880 > 192.168.43.147.7772: UDP, length 120
01:18:28.662444 IP 192.168.43.147.8880 > 192.168.43.124.7773: UDP, length 120
01:18:28.698631 IP 192.168.43.146.8880 > 192.168.43.147.7772: UDP, length 120
01:18:28.712443 IP 192.168.43.147.8880 > 192.168.43.124.7773: UDP, length 120
01:18:28.740380 IP 192.168.43.146.8880 > 192.168.43.147.7772: UDP, length 120
01:18:28.762442 IP 192.168.43.147.8880 > 192.168.43.124.7773: UDP, length 120
01:18:28.781561 IP 192.168.43.146.8880 > 192.168.43.147.7772: UDP, length 120
01:18:28.812443 IP 192.168.43.147.8880 > 192.168.43.124.7773: UDP, length 120
01:18:28.862341 IP 192.168.43.146.8880 > 192.168.43.147.7772: UDP, length 120
01:18:28.862452 IP 192.168.43.147.8880 > 192.168.43.124.7773: UDP, length 120
01:18:28.883822 IP 192.168.43.146.8880 > 192.168.43.147.7772: UDP, length 120
01:18:28.912447 IP 192.168.43.147.8880 > 192.168.43.124.7773: UDP, length 120
01:18:28.961394 IP 192.168.43.146.8880 > 192.168.43.147.7772: UDP, length 120
01:18:28.962440 IP 192.168.43.147.8880 > 192.168.43.124.7773: UDP, length 120
01:18:29.006278 IP 192.168.43.146.8880 > 192.168.43.147.7772: UDP, length 120
01:18:29.012442 IP 192.168.43.147.8880 > 192.168.43.124.7773: UDP, length 120
01:18:29.019431 IP 192.168.43.146.8880 > 192.168.43.147.7772: UDP, length 120
01:18:29.062442 IP 192.168.43.147.8880 > 192.168.43.124.7773: UDP, length 120
01:18:29.089064 IP 192.168.43.146.8880 > 192.168.43.147.7772: UDP, length 120
01:18:29.112443 IP 192.168.43.147.8880 > 192.168.43.124.7773: UDP, length 120
01:18:29.162483 IP 192.168.43.147.8880 > 192.168.43.124.7773: UDP, length 120
01:18:29.168273 IP 192.168.43.146.8880 > 192.168.43.147.7772: UDP, length 120
01:18:29.210470 IP 192.168.43.146.8880 > 192.168.43.147.7772: UDP, length 120
01:18:29.212463 IP 192.168.43.147.8880 > 192.168.43.124.7773: UDP, length 120
01:18:29.241153 IP 192.168.43.146.8880 > 192.168.43.147.7772: UDP, length 120
01:18:29.262445 IP 192.168.43.147.8880 > 192.168.43.124.7773: UDP, length 120
01:18:29.312411 IP 192.168.43.147.8880 > 192.168.43.124.7773: UDP, length 120
01:18:29.314545 IP 192.168.43.146.8880 > 192.168.43.147.7772: UDP, length 120
01:18:29.324552 IP 192.168.43.146.8880 > 192.168.43.147.7772: UDP, length 120
01:18:29.362441 IP 192.168.43.147.8880 > 192.168.43.124.7773: UDP, length 120
01:18:29.408447 IP 192.168.43.146.8880 > 192.168.43.147.7772: UDP, length 120
01:18:29.412446 IP 192.168.43.147.8880 > 192.168.43.124.7773: UDP, length 120
01:18:29.421893 IP 192.168.43.146.8880 > 192.168.43.147.7772: UDP, length 120
01:18:29.462443 IP 192.168.43.147.8880 > 192.168.43.124.7773: UDP, length 120
01:18:29.482922 IP 192.168.43.146.8880 > 192.168.43.147.7772: UDP, length 120
01:18:29.512442 IP 192.168.43.147.8880 > 192.168.43.124.7773: UDP, length 120
01:18:29.520767 IP 192.168.43.146.8880 > 192.168.43.147.7772: UDP, length 120
01:18:29.562443 IP 192.168.43.147.8880 > 192.168.43.124.7773: UDP, length 120
01:18:29.585777 IP 192.168.43.146.8880 > 192.168.43.147.7772: UDP, length 120
01:18:29.612443 IP 192.168.43.147.8880 > 192.168.43.124.7773: UDP, length 120
01:18:29.622954 IP 192.168.43.146.8880 > 192.168.43.147.7772: UDP, length 120
01:18:29.662443 IP 192.168.43.147.8880 > 192.168.43.124.7773: UDP, length 120
01:18:29.687270 IP 192.168.43.146.8880 > 192.168.43.147.7772: UDP, length 120
01:18:29.712442 IP 192.168.43.147.8880 > 192.168.43.124.7773: UDP, length 120
01:18:29.719904 IP 192.168.43.146.8880 > 192.168.43.147.7772: UDP, length 120
01:18:29.762442 IP 192.168.43.147.8880 > 192.168.43.124.7773: UDP, length 120
01:18:29.773079 IP 192.168.43.146.8880 > 192.168.43.147.7772: UDP, length 120
01:18:29.812443 IP 192.168.43.147.8880 > 192.168.43.124.7773: UDP, length 120
01:18:29.826107 IP 192.168.43.146.8880 > 192.168.43.147.7772: UDP, length 120
01:18:29.862443 IP 192.168.43.147.8880 > 192.168.43.124.7773: UDP, length 120
01:18:29.908191 IP 192.168.43.146.8880 > 192.168.43.147.7772: UDP, length 120
01:18:29.912440 IP 192.168.43.147.8880 > 192.168.43.124.7773: UDP, length 120
01:18:29.925592 IP 192.168.43.146.8880 > 192.168.43.147.7772: UDP, length 120
01:18:29.962442 IP 192.168.43.147.8880 > 192.168.43.124.7773: UDP, length 120
01:18:30.012441 IP 192.168.43.147.8880 > 192.168.43.124.7773: UDP, length 120
01:18:30.048603 IP 192.168.43.146.8880 > 192.168.43.147.7772: UDP, length 120
01:18:30.048786 IP 192.168.43.146.8880 > 192.168.43.147.7772: UDP, length 120
01:18:30.062441 IP 192.168.43.147.8880 > 192.168.43.124.7773: UDP, length 120
01:18:30.112442 IP 192.168.43.147.8880 > 192.168.43.124.7773: UDP, length 120
01:18:30.120770 IP 192.168.43.146.8880 > 192.168.43.147.7772: UDP, length 120
01:18:30.162442 IP 192.168.43.147.8880 > 192.168.43.124.7773: UDP, length 120
01:18:30.212442 IP 192.168.43.147.8880 > 192.168.43.124.7773: UDP, length 120
01:18:30.236925 IP 192.168.43.146.8880 > 192.168.43.147.7772: UDP, length 120
01:18:30.237107 IP 192.168.43.146.8880 > 192.168.43.147.7772: UDP, length 120
01:18:30.237267 IP 192.168.43.146.8880 > 192.168.43.147.7772: UDP, length 120
01:18:30.262447 IP 192.168.43.147.8880 > 192.168.43.124.7773: UDP, length 120
01:18:30.286301 IP 192.168.43.146.8880 > 192.168.43.147.7772: UDP, length 120
01:18:30.312445 IP 192.168.43.147.8880 > 192.168.43.124.7773: UDP, length 120
01:18:30.324282 IP 192.168.43.146.8880 > 192.168.43.147.7772: UDP, length 120
01:18:30.362450 IP 192.168.43.147.8880 > 192.168.43.124.7773: UDP, length 120
01:18:30.377020 IP 192.168.43.146.8880 > 192.168.43.147.7772: UDP, length 120
01:18:30.412455 IP 192.168.43.147.8880 > 192.168.43.124.7773: UDP, length 120
01:18:30.426481 IP 192.168.43.146.8880 > 192.168.43.147.7772: UDP, length 120
01:18:30.462453 IP 192.168.43.147.8880 > 192.168.43.124.7773: UDP, length 120
01:18:30.476620 IP 192.168.43.146.8880 > 192.168.43.147.7772: UDP, length 120
01:18:30.512447 IP 192.168.43.147.8880 > 192.168.43.124.7773: UDP, length 120
01:18:30.519360 IP 192.168.43.146.8880 > 192.168.43.147.7772: UDP, length 120
01:18:30.562443 IP 192.168.43.147.8880 > 192.168.43.124.7773: UDP, length 120
01:18:30.569866 IP 192.168.43.146.8880 > 192.168.43.147.7772: UDP, length 120
01:18:30.612444 IP 192.168.43.147.8880 > 192.168.43.124.7773: UDP, length 120
01:18:30.630754 IP 192.168.43.146.8880 > 192.168.43.147.7772: UDP, length 120
01:18:30.662491 IP 192.168.43.147.8880 > 192.168.43.124.7773: UDP, length 120
01:18:30.667816 IP 192.168.43.146.8880 > 192.168.43.147.7772: UDP, length 120
01:18:30.712452 IP 192.168.43.147.8880 > 192.168.43.124.7773: UDP, length 120
01:18:30.723804 IP 192.168.43.146.8880 > 192.168.43.147.7772: UDP, length 120
01:18:30.762444 IP 192.168.43.147.8880 > 192.168.43.124.7773: UDP, length 120
01:18:30.776611 IP 192.168.43.146.8880 > 192.168.43.147.7772: UDP, length 120
01:18:30.812443 IP 192.168.43.147.8880 > 192.168.43.124.7773: UDP, length 120
01:18:30.822154 IP 192.168.43.146.8880 > 192.168.43.147.7772: UDP, length 120
01:18:30.862449 IP 192.168.43.147.8880 > 192.168.43.124.7773: UDP, length 120
01:18:30.869653 IP 192.168.43.146.8880 > 192.168.43.147.7772: UDP, length 120
01:18:30.912451 IP 192.168.43.147.8880 > 192.168.43.124.7773: UDP, length 120
01:18:30.930839 IP 192.168.43.146.8880 > 192.168.43.147.7772: UDP, length 120
01:18:30.962449 IP 192.168.43.147.8880 > 192.168.43.124.7773: UDP, length 120
01:18:30.969515 IP 192.168.43.146.8880 > 192.168.43.147.7772: UDP, length 120
01:18:31.012445 IP 192.168.43.147.8880 > 192.168.43.124.7773: UDP, length 120
01:18:31.032949 IP 192.168.43.146.8880 > 192.168.43.147.7772: UDP, length 120
01:18:31.062441 IP 192.168.43.147.8880 > 192.168.43.124.7773: UDP, length 120
01:18:31.081850 IP 192.168.43.146.8880 > 192.168.43.147.7772: UDP, length 120
01:18:31.112444 IP 192.168.43.147.8880 > 192.168.43.124.7773: UDP, length 120
01:18:31.119524 IP 192.168.43.146.8880 > 192.168.43.147.7772: UDP, length 120
01:18:31.162442 IP 192.168.43.147.8880 > 192.168.43.124.7773: UDP, length 120
01:18:31.169715 IP 192.168.43.146.8880 > 192.168.43.147.7772: UDP, length 120
01:18:31.212442 IP 192.168.43.147.8880 > 192.168.43.124.7773: UDP, length 120
01:18:31.234606 IP 192.168.43.146.8880 > 192.168.43.147.7772: UDP, length 120
01:18:31.262450 IP 192.168.43.147.8880 > 192.168.43.124.7773: UDP, length 120
01:18:31.269345 IP 192.168.43.146.8880 > 192.168.43.147.7772: UDP, length 120
01:18:31.312455 IP 192.168.43.147.8880 > 192.168.43.124.7773: UDP, length 120
01:18:31.323237 IP 192.168.43.146.8880 > 192.168.43.147.7772: UDP, length 120
01:18:31.362443 IP 192.168.43.147.8880 > 192.168.43.124.7773: UDP, length 120
01:18:31.380733 IP 192.168.43.146.8880 > 192.168.43.147.7772: UDP, length 120
01:18:31.412449 IP 192.168.43.147.8880 > 192.168.43.124.7773: UDP, length 120
01:18:31.419640 IP 192.168.43.146.8880 > 192.168.43.147.7772: UDP, length 120
01:18:31.462451 IP 192.168.43.147.8880 > 192.168.43.124.7773: UDP, length 120
01:18:31.471377 IP 192.168.43.146.8880 > 192.168.43.147.7772: UDP, length 120
01:18:31.512443 IP 192.168.43.147.8880 > 192.168.43.124.7773: UDP, length 120
01:18:31.532346 IP 192.168.43.146.8880 > 192.168.43.147.7772: UDP, length 120
01:18:31.562443 IP 192.168.43.147.8880 > 192.168.43.124.7773: UDP, length 120
01:18:31.568881 IP 192.168.43.146.8880 > 192.168.43.147.7772: UDP, length 120
01:18:31.612455 IP 192.168.43.147.8880 > 192.168.43.124.7773: UDP, length 120
01:18:31.633611 IP 192.168.43.146.8880 > 192.168.43.147.7772: UDP, length 120
01:18:31.662445 IP 192.168.43.147.8880 > 192.168.43.124.7773: UDP, length 120
01:18:31.671386 IP 192.168.43.146.8880 > 192.168.43.147.7772: UDP, length 120
01:18:31.712442 IP 192.168.43.147.8880 > 192.168.43.124.7773: UDP, length 120
01:18:31.733504 IP 192.168.43.146.8880 > 192.168.43.147.7772: UDP, length 120
01:18:31.762446 IP 192.168.43.147.8880 > 192.168.43.124.7773: UDP, length 120
01:18:31.773231 IP 192.168.43.146.8880 > 192.168.43.147.7772: UDP, length 120
01:18:31.812442 IP 192.168.43.147.8880 > 192.168.43.124.7773: UDP, length 120
01:18:31.823989 IP 192.168.43.146.8880 > 192.168.43.147.7772: UDP, length 120
01:18:31.862442 IP 192.168.43.147.8880 > 192.168.43.124.7773: UDP, length 120
01:18:31.882484 IP 192.168.43.146.8880 > 192.168.43.147.7772: UDP, length 120
01:18:31.912468 IP 192.168.43.147.8880 > 192.168.43.124.7773: UDP, length 120
01:18:31.921746 IP 192.168.43.146.8880 > 192.168.43.147.7772: UDP, length 120
01:18:31.962469 IP 192.168.43.147.8880 > 192.168.43.124.7773: UDP, length 120
01:18:31.969583 IP 192.168.43.146.8880 > 192.168.43.147.7772: UDP, length 120
01:18:32.012470 IP 192.168.43.147.8880 > 192.168.43.124.7773: UDP, length 120
01:18:32.044281 IP 192.168.43.146.8880 > 192.168.43.147.7772: UDP, length 120
01:18:32.062488 IP 192.168.43.147.8880 > 192.168.43.124.7773: UDP, length 120
01:18:32.070775 IP 192.168.43.146.8880 > 192.168.43.147.7772: UDP, length 120
01:18:32.112469 IP 192.168.43.147.8880 > 192.168.43.124.7773: UDP, length 120
01:18:32.132098 IP 192.168.43.146.8880 > 192.168.43.147.7772: UDP, length 120
01:18:32.162520 IP 192.168.43.147.8880 > 192.168.43.124.7773: UDP, length 120
01:18:32.169746 IP 192.168.43.146.8880 > 192.168.43.147.7772: UDP, length 120
01:18:32.212487 IP 192.168.43.147.8880 > 192.168.43.124.7773: UDP, length 120
01:18:32.219533 IP 192.168.43.146.8880 > 192.168.43.147.7772: UDP, length 120
01:18:32.262468 IP 192.168.43.147.8880 > 192.168.43.124.7773: UDP, length 120
01:18:32.282202 IP 192.168.43.146.8880 > 192.168.43.147.7772: UDP, length 120
01:18:32.312485 IP 192.168.43.147.8880 > 192.168.43.124.7773: UDP, length 120
01:18:32.319404 IP 192.168.43.146.8880 > 192.168.43.147.7772: UDP, length 120
01:18:32.362475 IP 192.168.43.147.8880 > 192.168.43.124.7773: UDP, length 120
01:18:32.380866 IP 192.168.43.146.8880 > 192.168.43.147.7772: UDP, length 120
01:18:32.412488 IP 192.168.43.147.8880 > 192.168.43.124.7773: UDP, length 120
01:18:32.422185 IP 192.168.43.146.8880 > 192.168.43.147.7772: UDP, length 120
01:18:32.462469 IP 192.168.43.147.8880 > 192.168.43.124.7773: UDP, length 120
01:18:32.469702 IP 192.168.43.146.8880 > 192.168.43.147.7772: UDP, length 120
01:18:32.512468 IP 192.168.43.147.8880 > 192.168.43.124.7773: UDP, length 120
01:18:32.530723 IP 192.168.43.146.8880 > 192.168.43.147.7772: UDP, length 120
01:18:32.562474 IP 192.168.43.147.8880 > 192.168.43.124.7773: UDP, length 120
01:18:32.600140 IP 192.168.43.146.8880 > 192.168.43.147.7772: UDP, length 120
01:18:32.612482 IP 192.168.43.147.8880 > 192.168.43.124.7773: UDP, length 120
01:18:32.638567 IP 192.168.43.146.8880 > 192.168.43.147.7772: UDP, length 120
01:18:32.662468 IP 192.168.43.147.8880 > 192.168.43.124.7773: UDP, length 120
01:18:32.684657 IP 192.168.43.146.8880 > 192.168.43.147.7772: UDP, length 120
01:18:32.712468 IP 192.168.43.147.8880 > 192.168.43.124.7773: UDP, length 120
01:18:32.753077 IP 192.168.43.146.8880 > 192.168.43.147.7772: UDP, length 120
01:18:32.762469 IP 192.168.43.147.8880 > 192.168.43.124.7773: UDP, length 120
01:18:32.796251 IP 192.168.43.146.8880 > 192.168.43.147.7772: UDP, length 120
01:18:32.812474 IP 192.168.43.147.8880 > 192.168.43.124.7773: UDP, length 120
01:18:32.862473 IP 192.168.43.147.8880 > 192.168.43.124.7773: UDP, length 120
01:18:32.863294 IP 192.168.43.146.8880 > 192.168.43.147.7772: UDP, length 120
01:18:32.908231 IP 192.168.43.146.8880 > 192.168.43.147.7772: UDP, length 120
01:18:32.912473 IP 192.168.43.147.8880 > 192.168.43.124.7773: UDP, length 120
01:18:32.962467 IP 192.168.43.147.8880 > 192.168.43.124.7773: UDP, length 120
01:18:32.974655 IP 192.168.43.146.8880 > 192.168.43.147.7772: UDP, length 120
01:18:32.976426 IP 192.168.43.146.8880 > 192.168.43.147.7772: UDP, length 120
01:18:33.012470 IP 192.168.43.147.8880 > 192.168.43.124.7773: UDP, length 120
01:18:33.047335 IP 192.168.43.146.8880 > 192.168.43.147.7772: UDP, length 120
01:18:33.062465 IP 192.168.43.147.8880 > 192.168.43.124.7773: UDP, length 120
01:18:33.112589 IP 192.168.43.147.8880 > 192.168.43.124.7773: UDP, length 120
01:18:33.118879 IP 192.168.43.146.8880 > 192.168.43.147.7772: UDP, length 120
01:18:33.143087 IP 192.168.43.146.8880 > 192.168.43.147.7772: UDP, length 120
01:18:33.162599 IP 192.168.43.147.8880 > 192.168.43.124.7773: UDP, length 120
01:18:33.205181 IP 192.168.43.146.8880 > 192.168.43.147.7772: UDP, length 120
01:18:33.212517 IP 192.168.43.147.8880 > 192.168.43.124.7773: UDP, length 120
01:18:33.231118 IP 192.168.43.146.8880 > 192.168.43.147.7772: UDP, length 120
01:18:33.262559 IP 192.168.43.147.8880 > 192.168.43.124.7773: UDP, length 120
01:18:33.282635 IP 192.168.43.146.8880 > 192.168.43.147.7772: UDP, length 120
01:18:33.312542 IP 192.168.43.147.8880 > 192.168.43.124.7773: UDP, length 120
01:18:33.358922 IP 192.168.43.146.8880 > 192.168.43.147.7772: UDP, length 120
01:18:33.362489 IP 192.168.43.147.8880 > 192.168.43.124.7773: UDP, length 120
01:18:33.389389 IP 192.168.43.146.8880 > 192.168.43.147.7772: UDP, length 120
01:18:33.412523 IP 192.168.43.147.8880 > 192.168.43.124.7773: UDP, length 120
01:18:33.448854 IP 192.168.43.146.8880 > 192.168.43.147.7772: UDP, length 120
01:18:33.462559 IP 192.168.43.147.8880 > 192.168.43.124.7773: UDP, length 120
01:18:33.476128 IP 192.168.43.146.8880 > 192.168.43.147.7772: UDP, length 120
01:18:33.512545 IP 192.168.43.147.8880 > 192.168.43.124.7773: UDP, length 120
01:18:33.562495 IP 192.168.43.147.8880 > 192.168.43.124.7773: UDP, length 120
01:18:33.580434 IP 192.168.43.146.8880 > 192.168.43.147.7772: UDP, length 120
01:18:33.612466 IP 192.168.43.147.8880 > 192.168.43.124.7773: UDP, length 120
01:18:33.621937 IP 192.168.43.146.8880 > 192.168.43.147.7772: UDP, length 120
01:18:33.626910 IP 192.168.43.146.8880 > 192.168.43.147.7772: UDP, length 120
01:18:33.662489 IP 192.168.43.147.8880 > 192.168.43.124.7773: UDP, length 120
01:18:33.712455 IP 192.168.43.147.8880 > 192.168.43.124.7773: UDP, length 120
01:18:33.715962 IP 192.168.43.146.8880 > 192.168.43.147.7772: UDP, length 120
01:18:33.722804 IP 192.168.43.146.8880 > 192.168.43.147.7772: UDP, length 120
01:18:33.762445 IP 192.168.43.147.8880 > 192.168.43.124.7773: UDP, length 120
01:18:33.784443 IP 192.168.43.146.8880 > 192.168.43.147.7772: UDP, length 120
01:18:33.812443 IP 192.168.43.147.8880 > 192.168.43.124.7773: UDP, length 120
01:18:33.819872 IP 192.168.43.146.8880 > 192.168.43.147.7772: UDP, length 120
01:18:33.862444 IP 192.168.43.147.8880 > 192.168.43.124.7773: UDP, length 120
01:18:33.880935 IP 192.168.43.146.8880 > 192.168.43.147.7772: UDP, length 120
01:18:33.912443 IP 192.168.43.147.8880 > 192.168.43.124.7773: UDP, length 120
01:18:33.921060 IP 192.168.43.146.8880 > 192.168.43.147.7772: UDP, length 120
01:18:33.962442 IP 192.168.43.147.8880 > 192.168.43.124.7773: UDP, length 120
01:18:34.012441 IP 192.168.43.147.8880 > 192.168.43.124.7773: UDP, length 120
01:18:34.015687 IP 192.168.43.146.8880 > 192.168.43.147.7772: UDP, length 120
01:18:34.021932 IP 192.168.43.146.8880 > 192.168.43.147.7772: UDP, length 120
01:18:34.062450 IP 192.168.43.147.8880 > 192.168.43.124.7773: UDP, length 120
01:18:34.086907 IP 192.168.43.146.8880 > 192.168.43.147.7772: UDP, length 120
01:18:34.112449 IP 192.168.43.147.8880 > 192.168.43.124.7773: UDP, length 120
01:18:34.122651 IP 192.168.43.146.8880 > 192.168.43.147.7772: UDP, length 120
01:18:34.162448 IP 192.168.43.147.8880 > 192.168.43.124.7773: UDP, length 120
01:18:34.183155 IP 192.168.43.146.8880 > 192.168.43.147.7772: UDP, length 120
01:18:34.212455 IP 192.168.43.147.8880 > 192.168.43.124.7773: UDP, length 120
01:18:34.249474 IP 192.168.43.146.8880 > 192.168.43.147.7772: UDP, length 120
01:18:34.262442 IP 192.168.43.147.8880 > 192.168.43.124.7773: UDP, length 120
01:18:34.284887 IP 192.168.43.146.8880 > 192.168.43.147.7772: UDP, length 120
01:18:34.312445 IP 192.168.43.147.8880 > 192.168.43.124.7773: UDP, length 120
01:18:34.333297 IP 192.168.43.146.8880 > 192.168.43.147.7772: UDP, length 120
01:18:34.362441 IP 192.168.43.147.8880 > 192.168.43.124.7773: UDP, length 120
01:18:34.368926 IP 192.168.43.146.8880 > 192.168.43.147.7772: UDP, length 120
01:18:34.412456 IP 192.168.43.147.8880 > 192.168.43.124.7773: UDP, length 120
01:18:34.421591 IP 192.168.43.146.8880 > 192.168.43.147.7772: UDP, length 120
01:18:34.462453 IP 192.168.43.147.8880 > 192.168.43.124.7773: UDP, length 120
01:18:34.483234 IP 192.168.43.146.8880 > 192.168.43.147.7772: UDP, length 120
01:18:34.512444 IP 192.168.43.147.8880 > 192.168.43.124.7773: UDP, length 120
01:18:34.551813 IP 192.168.43.146.8880 > 192.168.43.147.7772: UDP, length 120
01:18:34.562447 IP 192.168.43.147.8880 > 192.168.43.124.7773: UDP, length 120
01:18:34.587414 IP 192.168.43.146.8880 > 192.168.43.147.7772: UDP, length 120
01:18:34.612444 IP 192.168.43.147.8880 > 192.168.43.124.7773: UDP, length 120
01:18:34.630579 IP 192.168.43.146.8880 > 192.168.43.147.7772: UDP, length 120
01:18:34.662442 IP 192.168.43.147.8880 > 192.168.43.124.7773: UDP, length 120
01:18:34.700191 IP 192.168.43.146.8880 > 192.168.43.147.7772: UDP, length 120
01:18:34.712449 IP 192.168.43.147.8880 > 192.168.43.124.7773: UDP, length 120
01:18:34.723107 IP 192.168.43.146.8880 > 192.168.43.147.7772: UDP, length 120
01:18:34.762441 IP 192.168.43.147.8880 > 192.168.43.124.7773: UDP, length 120
01:18:34.795683 IP 192.168.43.146.8880 > 192.168.43.147.7772: UDP, length 120
01:18:34.812442 IP 192.168.43.147.8880 > 192.168.43.124.7773: UDP, length 120
01:18:34.852142 IP 192.168.43.146.8880 > 192.168.43.147.7772: UDP, length 120
01:18:34.862447 IP 192.168.43.147.8880 > 192.168.43.124.7773: UDP, length 120
01:18:34.888354 IP 192.168.43.146.8880 > 192.168.43.147.7772: UDP, length 120
01:18:34.912444 IP 192.168.43.147.8880 > 192.168.43.124.7773: UDP, length 120
01:18:34.947002 IP 192.168.43.146.8880 > 192.168.43.147.7772: UDP, length 120
01:18:34.962441 IP 192.168.43.147.8880 > 192.168.43.124.7773: UDP, length 120
01:18:34.974129 IP 192.168.43.146.8880 > 192.168.43.147.7772: UDP, length 120
01:18:35.012449 IP 192.168.43.147.8880 > 192.168.43.124.7773: UDP, length 120
01:18:35.048729 IP 192.168.43.146.8880 > 192.168.43.147.7772: UDP, length 120
01:18:35.062442 IP 192.168.43.147.8880 > 192.168.43.124.7773: UDP, length 120
01:18:35.112441 IP 192.168.43.147.8880 > 192.168.43.124.7773: UDP, length 120
01:18:35.114831 IP 192.168.43.146.8880 > 192.168.43.147.7772: UDP, length 120
01:18:35.127095 IP 192.168.43.146.8880 > 192.168.43.147.7772: UDP, length 120
01:18:35.162484 IP 192.168.43.147.8880 > 192.168.43.124.7773: UDP, length 120
01:18:35.180532 IP 192.168.43.146.8880 > 192.168.43.147.7772: UDP, length 120
01:18:35.212458 IP 192.168.43.147.8880 > 192.168.43.124.7773: UDP, length 120
01:18:35.257732 IP 192.168.43.146.8880 > 192.168.43.147.7772: UDP, length 120
01:18:35.262443 IP 192.168.43.147.8880 > 192.168.43.124.7773: UDP, length 120
01:18:35.282454 IP 192.168.43.146.8880 > 192.168.43.147.7772: UDP, length 120
01:18:35.312442 IP 192.168.43.147.8880 > 192.168.43.124.7773: UDP, length 120
01:18:35.334753 IP 192.168.43.146.8880 > 192.168.43.147.7772: UDP, length 120
01:18:35.362444 IP 192.168.43.147.8880 > 192.168.43.124.7773: UDP, length 120
01:18:35.368272 IP 192.168.43.146.8880 > 192.168.43.147.7772: UDP, length 120
01:18:35.412448 IP 192.168.43.147.8880 > 192.168.43.124.7773: UDP, length 120
01:18:35.462446 IP 192.168.43.147.8880 > 192.168.43.124.7773: UDP, length 120
01:18:35.466691 IP 192.168.43.146.8880 > 192.168.43.147.7772: UDP, length 120
01:18:35.512451 IP 192.168.43.147.8880 > 192.168.43.124.7773: UDP, length 120
01:18:35.562441 IP 192.168.43.147.8880 > 192.168.43.124.7773: UDP, length 120
01:18:35.565095 IP 192.168.43.146.8880 > 192.168.43.147.7772: UDP, length 120
01:18:35.565235 IP 192.168.43.146.8880 > 192.168.43.147.7772: UDP, length 120
01:18:35.610669 IP 192.168.43.146.8880 > 192.168.43.147.7772: UDP, length 120
01:18:35.612446 IP 192.168.43.147.8880 > 192.168.43.124.7773: UDP, length 120
01:18:35.662442 IP 192.168.43.147.8880 > 192.168.43.124.7773: UDP, length 120
01:18:35.680467 IP 192.168.43.146.8880 > 192.168.43.147.7772: UDP, length 120
01:18:35.693060 IP 192.168.43.146.8880 > 192.168.43.147.7772: UDP, length 120
01:18:35.712442 IP 192.168.43.147.8880 > 192.168.43.124.7773: UDP, length 120
01:18:35.750067 IP 192.168.43.146.8880 > 192.168.43.147.7772: UDP, length 120
01:18:35.762442 IP 192.168.43.147.8880 > 192.168.43.124.7773: UDP, length 120
01:18:35.774415 IP 192.168.43.146.8880 > 192.168.43.147.7772: UDP, length 120
01:18:35.812440 IP 192.168.43.147.8880 > 192.168.43.124.7773: UDP, length 120
01:18:35.832803 IP 192.168.43.146.8880 > 192.168.43.147.7772: UDP, length 120
01:18:35.862441 IP 192.168.43.147.8880 > 192.168.43.124.7773: UDP, length 120
01:18:35.869993 IP 192.168.43.146.8880 > 192.168.43.147.7772: UDP, length 120
01:18:35.912443 IP 192.168.43.147.8880 > 192.168.43.124.7773: UDP, length 120
01:18:35.916615 IP 192.168.43.146.8880 > 192.168.43.147.7772: UDP, length 120
01:18:35.962442 IP 192.168.43.147.8880 > 192.168.43.124.7773: UDP, length 120
01:18:35.982628 IP 192.168.43.146.8880 > 192.168.43.147.7772: UDP, length 120
01:18:36.012442 IP 192.168.43.147.8880 > 192.168.43.124.7773: UDP, length 120
01:18:36.021524 IP 192.168.43.146.8880 > 192.168.43.147.7772: UDP, length 120
01:18:36.062465 IP 192.168.43.147.8880 > 192.168.43.124.7773: UDP, length 120
01:18:36.081911 IP 192.168.43.146.8880 > 192.168.43.147.7772: UDP, length 120
