00:16:28.064560 IP 192.168.43.124.8880 > 192.168.43.146.7771: UDP, length 120
00:16:28.115278 IP 192.168.43.124.8880 > 192.168.43.146.7771: UDP, length 120
00:16:28.164641 IP 192.168.43.124.8880 > 192.168.43.146.7771: UDP, length 120
00:16:28.214335 IP 192.168.43.124.8880 > 192.168.43.146.7771: UDP, length 120
00:16:28.264565 IP 192.168.43.124.8880 > 192.168.43.146.7771: UDP, length 120
00:16:28.316711 IP 192.168.43.124.8880 > 192.168.43.146.7771: UDP, length 120
00:16:28.364668 IP 192.168.43.124.8880 > 192.168.43.146.7771: UDP, length 120
00:16:28.416205 IP 192.168.43.124.8880 > 192.168.43.146.7771: UDP, length 120
00:16:28.465835 IP 192.168.43.124.8880 > 192.168.43.146.7771: UDP, length 120
00:16:28.515735 IP 192.168.43.124.8880 > 192.168.43.146.7771: UDP, length 120
00:16:28.566984 IP 192.168.43.124.8880 > 192.168.43.146.7771: UDP, length 120
00:16:28.611514 IP 192.168.43.124.8880 > 192.168.43.146.7771: UDP, length 120
00:16:28.665506 IP 192.168.43.124.8880 > 192.168.43.146.7771: UDP, length 120
00:16:28.675663 IP 192.168.43.146.8880 > 192.168.43.147.7772: UDP, length 120
00:16:28.714509 IP 192.168.43.124.8880 > 192.168.43.146.7771: UDP, length 120
00:16:28.725734 IP 192.168.43.146.8880 > 192.168.43.147.7772: UDP, length 120
00:16:28.764823 IP 192.168.43.124.8880 > 192.168.43.146.7771: UDP, length 120
00:16:28.775732 IP 192.168.43.146.8880 > 192.168.43.147.7772: UDP, length 120
00:16:28.815577 IP 192.168.43.124.8880 > 192.168.43.146.7771: UDP, length 120
00:16:28.825707 IP 192.168.43.146.8880 > 192.168.43.147.7772: UDP, length 120
00:16:28.866747 IP 192.168.43.124.8880 > 192.168.43.146.7771: UDP, length 120
00:16:28.875701 IP 192.168.43.146.8880 > 192.168.43.147.7772: UDP, length 120
00:16:28.916051 IP 192.168.43.124.8880 > 192.168.43.146.7771: UDP, length 120
00:16:28.925699 IP 192.168.43.146.8880 > 192.168.43.147.7772: UDP, length 120
00:16:28.964523 IP 192.168.43.124.8880 > 192.168.43.146.7771: UDP, length 120
00:16:28.975698 IP 192.168.43.146.8880 > 192.168.43.147.7772: UDP, length 120
00:16:29.014498 IP 192.168.43.124.8880 > 192.168.43.146.7771: UDP, length 120
00:16:29.025700 IP 192.168.43.146.8880 > 192.168.43.147.7772: UDP, length 120
00:16:29.065805 IP 192.168.43.124.8880 > 192.168.43.146.7771: UDP, length 120
00:16:29.075703 IP 192.168.43.146.8880 > 192.168.43.147.7772: UDP, length 120
00:16:29.114879 IP 192.168.43.124.8880 > 192.168.43.146.7771: UDP, length 120
00:16:29.125702 IP 192.168.43.146.8880 > 192.168.43.147.7772: UDP, length 120
00:16:29.166091 IP 192.168.43.124.8880 > 192.168.43.146.7771: UDP, length 120
00:16:29.175700 IP 192.168.43.146.8880 > 192.168.43.147.7772: UDP, length 120
00:16:29.215432 IP 192.168.43.124.8880 > 192.168.43.146.7771: UDP, length 120
00:16:29.225735 IP 192.168.43.146.8880 > 192.168.43.147.7772: UDP, length 120
00:16:29.265072 IP 192.168.43.124.8880 > 192.168.43.146.7771: UDP, length 120
00:16:29.275705 IP 192.168.43.146.8880 > 192.168.43.147.7772: UDP, length 120
00:16:29.314550 IP 192.168.43.124.8880 > 192.168.43.146.7771: UDP, length 120
00:16:29.325705 IP 192.168.43.146.8880 > 192.168.43.147.7772: UDP, length 120
00:16:29.365346 IP 192.168.43.124.8880 > 192.168.43.146.7771: UDP, length 120
00:16:29.375769 IP 192.168.43.146.8880 > 192.168.43.147.7772: UDP, length 120
00:16:29.414499 IP 192.168.43.124.8880 > 192.168.43.146.7771: UDP, length 120
00:16:29.425729 IP 192.168.43.146.8880 > 192.168.43.147.7772: UDP, length 120
00:16:29.464528 IP 192.168.43.124.8880 > 192.168.43.146.7771: UDP, length 120
00:16:29.475701 IP 192.168.43.146.8880 > 192.168.43.147.7772: UDP, length 120
00:16:29.516254 IP 192.168.43.124.8880 > 192.168.43.146.7771: UDP, length 120
00:16:29.525701 IP 192.168.43.146.8880 > 192.168.43.147.7772: UDP, length 120
00:16:29.561860 IP 192.168.43.124.8880 > 192.168.43.146.7771: UDP, length 120
00:16:29.575737 IP 192.168.43.146.8880 > 192.168.43.147.7772: UDP, length 120
00:16:29.618590 IP 192.168.43.124.8880 > 192.168.43.146.7771: UDP, length 120
00:16:29.625705 IP 192.168.43.146.8880 > 192.168.43.147.7772: UDP, length 120
00:16:29.664388 IP 192.168.43.124.8880 > 192.168.43.146.7771: UDP, length 120
00:16:29.675702 IP 192.168.43.146.8880 > 192.168.43.147.7772: UDP, length 120
00:16:29.714402 IP 192.168.43.124.8880 > 192.168.43.146.7771: UDP, length 120
00:16:29.725695 IP 192.168.43.146.8880 > 192.168.43.147.7772: UDP, length 120
00:16:29.764489 IP 192.168.43.124.8880 > 192.168.43.146.7771: UDP, length 120
00:16:29.775707 IP 192.168.43.146.8880 > 192.168.43.147.7772: UDP, length 120
00:16:29.814391 IP 192.168.43.124.8880 > 192.168.43.146.7771: UDP, length 120
00:16:29.825700 IP 192.168.43.146.8880 > 192.168.43.147.7772: UDP, length 120
00:16:29.864600 IP 192.168.43.124.8880 > 192.168.43.146.7771: UDP, length 120
00:16:29.875700 IP 192.168.43.146.8880 > 192.168.43.147.7772: UDP, length 120
00:16:29.916252 IP 192.168.43.124.8880 > 192.168.43.146.7771: UDP, length 120
00:16:29.925698 IP 192.168.43.146.8880 > 192.168.43.147.7772: UDP, length 120
00:16:29.965498 IP 192.168.43.124.8880 > 192.168.43.146.7771: UDP, length 120
00:16:29.975698 IP 192.168.43.146.8880 > 192.168.43.147.7772: UDP, length 120
00:16:30.016997 IP 192.168.43.124.8880 > 192.168.43.146.7771: UDP, length 120
00:16:30.025696 IP 192.168.43.146.8880 > 192.168.43.147.7772: UDP, length 120
00:16:30.065084 IP 192.168.43.124.8880 > 192.168.43.146.7771: UDP, length 120
00:16:30.075701 IP 192.168.43.146.8880 > 192.168.43.147.7772: UDP, length 120
00:16:30.114523 IP 192.168.43.124.8880 > 192.168.43.146.7771: UDP, length 120
00:16:30.125701 IP 192.168.43.146.8880 > 192.168.43.147.7772: UDP, length 120
00:16:30.165699 IP 192.168.43.124.8880 > 192.168.43.146.7771: UDP, length 120
00:16:30.175699 IP 192.168.43.146.8880 > 192.168.43.147.7772: UDP, length 120
00:16:30.214348 IP 192.168.43.124.8880 > 192.168.43.146.7771: UDP, length 120
00:16:30.225698 IP 192.168.43.146.8880 > 192.168.43.147.7772: UDP, length 120
00:16:30.264388 IP 192.168.43.124.8880 > 192.168.43.146.7771: UDP, length 120
00:16:30.275709 IP 192.168.43.146.8880 > 192.168.43.147.7772: UDP, length 120
00:16:30.314333 IP 192.168.43.124.8880 > 192.168.43.146.7771: UDP, length 120
00:16:30.325708 IP 192.168.43.146.8880 > 192.168.43.147.7772: UDP, length 120
00:16:30.363012 IP 192.168.43.124.8880 > 192.168.43.146.7771: UDP, length 120
00:16:30.375779 IP 192.168.43.146.8880 > 192.168.43.147.7772: UDP, length 120
00:16:30.411907 IP 192.168.43.124.8880 > 192.168.43.146.7771: UDP, length 120
00:16:30.425754 IP 192.168.43.146.8880 > 192.168.43.147.7772: UDP, length 120
00:16:30.464286 IP 192.168.43.124.8880 > 192.168.43.146.7771: UDP, length 120
00:16:30.475704 IP 192.168.43.146.8880 > 192.168.43.147.7772: UDP, length 120
00:16:30.513046 IP 192.168.43.124.8880 > 192.168.43.146.7771: UDP, length 120
00:16:30.525766 IP 192.168.43.146.8880 > 192.168.43.147.7772: UDP, length 120
00:16:30.571191 IP 192.168.43.124.8880 > 192.168.43.146.7771: UDP, length 120
00:16:30.575701 IP 192.168.43.146.8880 > 192.168.43.147.7772: UDP, length 120
00:16:30.625695 IP 192.168.43.146.8880 > 192.168.43.147.7772: UDP, length 120
00:16:30.625872 IP 192.168.43.124.8880 > 192.168.43.146.7771: UDP, length 120
00:16:30.675695 IP 192.168.43.146.8880 > 192.168.43.147.7772: UDP, length 120
00:16:30.679160 IP 192.168.43.124.8880 > 192.168.43.146.7771: UDP, length 120
00:16:30.712609 IP 192.168.43.124.8880 > 192.168.43.146.7771: UDP, length 120
00:16:30.725693 IP 192.168.43.146.8880 > 192.168.43.147.7772: UDP, length 120
00:16:30.762548 IP 192.168.43.124.8880 > 192.168.43.146.7771: UDP, length 120
00:16:30.775712 IP 192.168.43.146.8880 > 192.168.43.147.7772: UDP, length 120
00:16:30.812760 IP 192.168.43.124.8880 > 192.168.43.146.7771: UDP, length 120
00:16:30.825698 IP 192.168.43.146.8880 > 192.168.43.147.7772: UDP, length 120
00:16:30.862474 IP 192.168.43.124.8880 > 192.168.43.146.7771: UDP, length 120
00:16:30.875701 IP 192.168.43.146.8880 > 192.168.43.147.7772: UDP, length 120
00:16:30.923721 IP 192.168.43.124.8880 > 192.168.43.146.7771: UDP, length 120
00:16:30.925696 IP 192.168.43.146.8880 > 192.168.43.147.7772: UDP, length 120
00:16:30.975700 IP 192.168.43.146.8880 > 192.168.43.147.7772: UDP, length 120
00:16:30.979103 IP 192.168.43.124.8880 > 192.168.43.146.7771: UDP, length 120
00:16:31.012391 IP 192.168.43.124.8880 > 192.168.43.146.7771: UDP, length 120
00:16:31.025700 IP 192.168.43.146.8880 > 192.168.43.147.7772: UDP, length 120
00:16:31.061866 IP 192.168.43.124.8880 > 192.168.43.146.7771: UDP, length 120
00:16:31.075745 IP 192.168.43.146.8880 > 192.168.43.147.7772: UDP, length 120
00:16:31.112915 IP 192.168.43.124.8880 > 192.168.43.146.7771: UDP, length 120
00:16:31.126776 IP 192.168.43.146.8880 > 192.168.43.147.7772: UDP, length 120
00:16:31.171831 IP 192.168.43.124.8880 > 192.168.43.146.7771: UDP, length 120
00:16:31.175837 IP 192.168.43.146.8880 > 192.168.43.147.7772: UDP, length 120
00:16:31.225740 IP 192.168.43.146.8880 > 192.168.43.147.7772: UDP, length 120
00:16:31.225964 IP 192.168.43.124.8880 > 192.168.43.146.7771: UDP, length 120
00:16:31.261841 IP 192.168.43.124.8880 > 192.168.43.146.7771: UDP, length 120
00:16:31.275742 IP 192.168.43.146.8880 > 192.168.43.147.7772: UDP, length 120
00:16:31.316799 IP 192.168.43.124.8880 > 192.168.43.146.7771: UDP, length 120
00:16:31.325747 IP 192.168.43.146.8880 > 192.168.43.147.7772: UDP, length 120
00:16:31.363293 IP 192.168.43.124.8880 > 192.168.43.146.7771: UDP, length 120
00:16:31.375733 IP 192.168.43.146.8880 > 192.168.43.147.7772: UDP, length 120
00:16:31.414069 IP 192.168.43.124.8880 > 192.168.43.146.7771: UDP, length 120
00:16:31.425786 IP 192.168.43.146.8880 > 192.168.43.147.7772: UDP, length 120
00:16:31.461980 IP 192.168.43.124.8880 > 192.168.43.146.7771: UDP, length 120
00:16:31.475743 IP 192.168.43.146.8880 > 192.168.43.147.7772: UDP, length 120
00:16:31.512989 IP 192.168.43.124.8880 > 192.168.43.146.7771: UDP, length 120
00:16:31.525756 IP 192.168.43.146.8880 > 192.168.43.147.7772: UDP, length 120
00:16:31.567916 IP 192.168.43.124.8880 > 192.168.43.146.7771: UDP, length 120
00:16:31.575716 IP 192.168.43.146.8880 > 192.168.43.147.7772: UDP, length 120
00:16:31.613679 IP 192.168.43.124.8880 > 192.168.43.146.7771: UDP, length 120
00:16:31.625682 IP 192.168.43.146.8880 > 192.168.43.147.7772: UDP, length 120
00:16:31.670297 IP 192.168.43.124.8880 > 192.168.43.146.7771: UDP, length 120
00:16:31.675676 IP 192.168.43.146.8880 > 192.168.43.147.7772: UDP, length 120
00:16:31.725640 IP 192.168.43.146.8880 > 192.168.43.147.7772: UDP, length 120
00:16:31.727556 IP 192.168.43.124.8880 > 192.168.43.146.7771: UDP, length 120
00:16:31.773273 IP 192.168.43.124.8880 > 192.168.43.146.7771: UDP, length 120
00:16:31.775700 IP 192.168.43.146.8880 > 192.168.43.147.7772: UDP, length 120
00:16:31.812281 IP 192.168.43.124.8880 > 192.168.43.146.7771: UDP, length 120
00:16:31.825685 IP 192.168.43.146.8880 > 192.168.43.147.7772: UDP, length 120
00:16:31.862574 IP 192.168.43.124.8880 > 192.168.43.146.7771: UDP, length 120
00:16:31.875674 IP 192.168.43.146.8880 > 192.168.43.147.7772: UDP, length 120
00:16:31.912288 IP 192.168.43.124.8880 > 192.168.43.146.7771: UDP, length 120
00:16:31.925669 IP 192.168.43.146.8880 > 192.168.43.147.7772: UDP, length 120
00:16:31.974407 IP 192.168.43.124.8880 > 192.168.43.146.7771: UDP, length 120
00:16:31.975669 IP 192.168.43.146.8880 > 192.168.43.147.7772: UDP, length 120
00:16:32.025670 IP 192.168.43.146.8880 > 192.168.43.147.7772: UDP, length 120
00:16:32.028221 IP 192.168.43.124.8880 > 192.168.43.146.7771: UDP, length 120
00:16:32.064969 IP 192.168.43.124.8880 > 192.168.43.146.7771: UDP, length 120
00:16:32.075679 IP 192.168.43.146.8880 > 192.168.43.147.7772: UDP, length 120
00:16:32.116078 IP 192.168.43.124.8880 > 192.168.43.146.7771: UDP, length 120
00:16:32.125676 IP 192.168.43.146.8880 > 192.168.43.147.7772: UDP, length 120
00:16:32.170100 IP 192.168.43.124.8880 > 192.168.43.146.7771: UDP, length 120
00:16:32.175673 IP 192.168.43.146.8880 > 192.168.43.147.7772: UDP, length 120
00:16:32.225389 IP 192.168.43.124.8880 > 192.168.43.146.7771: UDP, length 120
00:16:32.225674 IP 192.168.43.146.8880 > 192.168.43.147.7772: UDP, length 120
00:16:32.275671 IP 192.168.43.146.8880 > 192.168.43.147.7772: UDP, length 120
00:16:32.279094 IP 192.168.43.124.8880 > 192.168.43.146.7771: UDP, length 120
00:16:32.312295 IP 192.168.43.124.8880 > 192.168.43.146.7771: UDP, length 120
00:16:32.325672 IP 192.168.43.146.8880 > 192.168.43.147.7772: UDP, length 120
00:16:32.362657 IP 192.168.43.124.8880 > 192.168.43.146.7771: UDP, length 120
00:16:32.375679 IP 192.168.43.146.8880 > 192.168.43.147.7772: UDP, length 120
00:16:32.411761 IP 192.168.43.124.8880 > 192.168.43.146.7771: UDP, length 120
00:16:32.425673 IP 192.168.43.146.8880 > 192.168.43.147.7772: UDP, length 120
00:16:32.462100 IP 192.168.43.124.8880 > 192.168.43.146.7771: UDP, length 120
00:16:32.475673 IP 192.168.43.146.8880 > 192.168.43.147.7772: UDP, length 120
00:16:32.521697 IP 192.168.43.124.8880 > 192.168.43.146.7771: UDP, length 120
00:16:32.525669 IP 192.168.43.146.8880 > 192.168.43.147.7772: UDP, length 120
00:16:32.575710 IP 192.168.43.146.8880 > 192.168.43.147.7772: UDP, length 120
00:16:32.577735 IP 192.168.43.124.8880 > 192.168.43.146.7771: UDP, length 120
00:16:32.611806 IP 192.168.43.124.8880 > 192.168.43.146.7771: UDP, length 120
00:16:32.625724 IP 192.168.43.146.8880 > 192.168.43.147.7772: UDP, length 120
00:16:32.665326 IP 192.168.43.124.8880 > 192.168.43.146.7771: UDP, length 120
00:16:32.675704 IP 192.168.43.146.8880 > 192.168.43.147.7772: UDP, length 120
00:16:32.714034 IP 192.168.43.124.8880 > 192.168.43.146.7771: UDP, length 120
00:16:32.725696 IP 192.168.43.146.8880 > 192.168.43.147.7772: UDP, length 120
00:16:32.762535 IP 192.168.43.124.8880 > 192.168.43.146.7771: UDP, length 120
00:16:32.775706 IP 192.168.43.146.8880 > 192.168.43.147.7772: UDP, length 120
00:16:32.813849 IP 192.168.43.124.8880 > 192.168.43.146.7771: UDP, length 120
00:16:32.825697 IP 192.168.43.146.8880 > 192.168.43.147.7772: UDP, length 120
00:16:32.862413 IP 192.168.43.124.8880 > 192.168.43.146.7771: UDP, length 120
00:16:32.875698 IP 192.168.43.146.8880 > 192.168.43.147.7772: UDP, length 120
00:16:32.912215 IP 192.168.43.124.8880 > 192.168.43.146.7771: UDP, length 120
00:16:32.925695 IP 192.168.43.146.8880 > 192.168.43.147.7772: UDP, length 120
00:16:32.963286 IP 192.168.43.124.8880 > 192.168.43.146.7771: UDP, length 120
00:16:32.975696 IP 192.168.43.146.8880 > 192.168.43.147.7772: UDP, length 120
00:16:33.012434 IP 192.168.43.124.8880 > 192.168.43.146.7771: UDP, length 120
00:16:33.025697 IP 192.168.43.146.8880 > 192.168.43.147.7772: UDP, length 120
00:16:33.066401 IP 192.168.43.124.8880 > 192.168.43.146.7771: UDP, length 120
00:16:33.075698 IP 192.168.43.146.8880 > 192.168.43.147.7772: UDP, length 120
00:16:33.123476 IP 192.168.43.124.8880 > 192.168.43.146.7771: UDP, length 120
00:16:33.125696 IP 192.168.43.146.8880 > 192.168.43.147.7772: UDP, length 120
00:16:33.175697 IP 192.168.43.146.8880 > 192.168.43.147.7772: UDP, length 120
00:16:33.176265 IP 192.168.43.124.8880 > 192.168.43.146.7771: UDP, length 120
00:16:33.212304 IP 192.168.43.124.8880 > 192.168.43.146.7771: UDP, length 120
00:16:33.225696 IP 192.168.43.146.8880 > 192.168.43.147.7772: UDP, length 120
00:16:33.262570 IP 192.168.43.124.8880 > 192.168.43.146.7771: UDP, length 120
00:16:33.275697 IP 192.168.43.146.8880 > 192.168.43.147.7772: UDP, length 120
00:16:33.312285 IP 192.168.43.124.8880 > 192.168.43.146.7771: UDP, length 120
00:16:33.325697 IP 192.168.43.146.8880 > 192.168.43.147.7772: UDP, length 120
00:16:33.366636 IP 192.168.43.124.8880 > 192.168.43.146.7771: UDP, length 120
00:16:33.375697 IP 192.168.43.146.8880 > 192.168.43.147.7772: UDP, length 120
00:16:33.425775 IP 192.168.43.146.8880 > 192.168.43.147.7772: UDP, length 120
00:16:33.428723 IP 192.168.43.124.8880 > 192.168.43.146.7771: UDP, length 120
00:16:33.462031 IP 192.168.43.124.8880 > 192.168.43.146.7771: UDP, length 120
00:16:33.475773 IP 192.168.43.146.8880 > 192.168.43.147.7772: UDP, length 120
00:16:33.512006 IP 192.168.43.124.8880 > 192.168.43.146.7771: UDP, length 120
00:16:33.525740 IP 192.168.43.146.8880 > 192.168.43.147.7772: UDP, length 120
00:16:33.564705 IP 192.168.43.124.8880 > 192.168.43.146.7771: UDP, length 120
00:16:33.575712 IP 192.168.43.146.8880 > 192.168.43.147.7772: UDP, length 120
00:16:33.612921 IP 192.168.43.124.8880 > 192.168.43.146.7771: UDP, length 120
00:16:33.625678 IP 192.168.43.146.8880 > 192.168.43.147.7772: UDP, length 120
00:16:33.672417 IP 192.168.43.124.8880 > 192.168.43.146.7771: UDP, length 120
00:16:33.675674 IP 192.168.43.146.8880 > 192.168.43.147.7772: UDP, length 120
00:16:33.725674 IP 192.168.43.146.8880 > 192.168.43.147.7772: UDP, length 120
00:16:33.725786 IP 192.168.43.124.8880 > 192.168.43.146.7771: UDP, length 120
00:16:33.762044 IP 192.168.43.124.8880 > 192.168.43.146.7771: UDP, length 120
00:16:33.775680 IP 192.168.43.146.8880 > 192.168.43.147.7772: UDP, length 120
00:16:33.812086 IP 192.168.43.124.8880 > 192.168.43.146.7771: UDP, length 120
00:16:33.825671 IP 192.168.43.146.8880 > 192.168.43.147.7772: UDP, length 120
00:16:33.862093 IP 192.168.43.124.8880 > 192.168.43.146.7771: UDP, length 120
00:16:33.875672 IP 192.168.43.146.8880 > 192.168.43.147.7772: UDP, length 120
00:16:33.912212 IP 192.168.43.124.8880 > 192.168.43.146.7771: UDP, length 120
00:16:33.925668 IP 192.168.43.146.8880 > 192.168.43.147.7772: UDP, length 120
00:16:33.972578 IP 192.168.43.124.8880 > 192.168.43.146.7771: UDP, length 120
00:16:33.975670 IP 192.168.43.146.8880 > 192.168.43.147.7772: UDP, length 120
00:16:34.012123 IP 192.168.43.124.8880 > 192.168.43.146.7771: UDP, length 120
00:16:34.025670 IP 192.168.43.146.8880 > 192.168.43.147.7772: UDP, length 120
00:16:34.062862 IP 192.168.43.124.8880 > 192.168.43.146.7771: UDP, length 120
00:16:34.075702 IP 192.168.43.146.8880 > 192.168.43.147.7772: UDP, length 120
00:16:34.122921 IP 192.168.43.124.8880 > 192.168.43.146.7771: UDP, length 120
00:16:34.125672 IP 192.168.43.146.8880 > 192.168.43.147.7772: UDP, length 120
00:16:34.164158 IP 192.168.43.124.8880 > 192.168.43.146.7771: UDP, length 120
00:16:34.175669 IP 192.168.43.146.8880 > 192.168.43.147.7772: UDP, length 120
00:16:34.212552 IP 192.168.43.124.8880 > 192.168.43.146.7771: UDP, length 120
00:16:34.225669 IP 192.168.43.146.8880 > 192.168.43.147.7772: UDP, length 120
00:16:34.272720 IP 192.168.43.124.8880 > 192.168.43.146.7771: UDP, length 120
00:16:34.275670 IP 192.168.43.146.8880 > 192.168.43.147.7772: UDP, length 120
00:16:34.325671 IP 192.168.43.146.8880 > 192.168.43.147.7772: UDP, length 120
00:16:34.375669 IP 192.168.43.146.8880 > 192.168.43.147.7772: UDP, length 120
00:16:34.425669 IP 192.168.43.146.8880 > 192.168.43.147.7772: UDP, length 120
00:16:34.467089 IP 192.168.43.124.8880 > 192.168.43.146.7771: UDP, length 120
00:16:34.467253 IP 192.168.43.124.8880 > 192.168.43.146.7771: UDP, length 120
00:16:34.467374 IP 192.168.43.124.8880 > 192.168.43.146.7771: UDP, length 120
00:16:34.475676 IP 192.168.43.146.8880 > 192.168.43.147.7772: UDP, length 120
00:16:34.525676 IP 192.168.43.146.8880 > 192.168.43.147.7772: UDP, length 120
00:16:34.575731 IP 192.168.43.146.8880 > 192.168.43.147.7772: UDP, length 120
00:16:34.625689 IP 192.168.43.146.8880 > 192.168.43.147.7772: UDP, length 120
00:16:34.654399 IP 192.168.43.124.8880 > 192.168.43.146.7771: UDP, length 120
00:16:34.654599 IP 192.168.43.124.8880 > 192.168.43.146.7771: UDP, length 120
00:16:34.654718 IP 192.168.43.124.8880 > 192.168.43.146.7771: UDP, length 120
00:16:34.675678 IP 192.168.43.146.8880 > 192.168.43.147.7772: UDP, length 120
00:16:34.725677 IP 192.168.43.146.8880 > 192.168.43.147.7772: UDP, length 120
00:16:34.762792 IP 192.168.43.124.8880 > 192.168.43.146.7771: UDP, length 120
00:16:34.762877 IP 192.168.43.124.8880 > 192.168.43.146.7771: UDP, length 120
00:16:34.762952 IP 192.168.43.124.8880 > 192.168.43.146.7771: UDP, length 120
00:16:34.775682 IP 192.168.43.146.8880 > 192.168.43.147.7772: UDP, length 120
00:16:34.825673 IP 192.168.43.146.8880 > 192.168.43.147.7772: UDP, length 120
00:16:34.875674 IP 192.168.43.146.8880 > 192.168.43.147.7772: UDP, length 120
00:16:34.925671 IP 192.168.43.146.8880 > 192.168.43.147.7772: UDP, length 120
00:16:34.934742 IP 192.168.43.124.8880 > 192.168.43.146.7771: UDP, length 120
00:16:34.934906 IP 192.168.43.124.8880 > 192.168.43.146.7771: UDP, length 120
00:16:34.934979 IP 192.168.43.124.8880 > 192.168.43.146.7771: UDP, length 120
00:16:34.975677 IP 192.168.43.146.8880 > 192.168.43.147.7772: UDP, length 120
00:16:35.025673 IP 192.168.43.146.8880 > 192.168.43.147.7772: UDP, length 120
00:16:35.075670 IP 192.168.43.146.8880 > 192.168.43.147.7772: UDP, length 120
00:16:35.077582 IP 192.168.43.124.8880 > 192.168.43.146.7771: UDP, length 120
00:16:35.077662 IP 192.168.43.124.8880 > 192.168.43.146.7771: UDP, length 120
00:16:35.125673 IP 192.168.43.146.8880 > 192.168.43.147.7772: UDP, length 120
00:16:35.173392 IP 192.168.43.124.8880 > 192.168.43.146.7771: UDP, length 120
00:16:35.173619 IP 192.168.43.124.8880 > 192.168.43.146.7771: UDP, length 120
00:16:35.173761 IP 192.168.43.124.8880 > 192.168.43.146.7771: UDP, length 120
00:16:35.175672 IP 192.168.43.146.8880 > 192.168.43.147.7772: UDP, length 120
00:16:35.225670 IP 192.168.43.146.8880 > 192.168.43.147.7772: UDP, length 120
00:16:35.275670 IP 192.168.43.146.8880 > 192.168.43.147.7772: UDP, length 120
00:16:35.320010 IP 192.168.43.124.8880 > 192.168.43.146.7771: UDP, length 120
00:16:35.320158 IP 192.168.43.124.8880 > 192.168.43.146.7771: UDP, length 120
00:16:35.320280 IP 192.168.43.124.8880 > 192.168.43.146.7771: UDP, length 120
00:16:35.325672 IP 192.168.43.146.8880 > 192.168.43.147.7772: UDP, length 120
00:16:35.375674 IP 192.168.43.146.8880 > 192.168.43.147.7772: UDP, length 120
00:16:35.425671 IP 192.168.43.146.8880 > 192.168.43.147.7772: UDP, length 120
00:16:35.475621 IP 192.168.43.124.8880 > 192.168.43.146.7771: UDP, length 120
00:16:35.475719 IP 192.168.43.146.8880 > 192.168.43.147.7772: UDP, length 120
00:16:35.475797 IP 192.168.43.124.8880 > 192.168.43.146.7771: UDP, length 120
00:16:35.475921 IP 192.168.43.124.8880 > 192.168.43.146.7771: UDP, length 120
00:16:35.525674 IP 192.168.43.146.8880 > 192.168.43.147.7772: UDP, length 120
00:16:35.575748 IP 192.168.43.146.8880 > 192.168.43.147.7772: UDP, length 120
00:16:35.625443 IP 192.168.43.124.8880 > 192.168.43.146.7771: UDP, length 120
00:16:35.625560 IP 192.168.43.124.8880 > 192.168.43.146.7771: UDP, length 120
00:16:35.625638 IP 192.168.43.124.8880 > 192.168.43.146.7771: UDP, length 120
00:16:35.625718 IP 192.168.43.146.8880 > 192.168.43.147.7772: UDP, length 120
00:16:35.675678 IP 192.168.43.146.8880 > 192.168.43.147.7772: UDP, length 120
00:16:35.725672 IP 192.168.43.146.8880 > 192.168.43.147.7772: UDP, length 120
00:16:35.773514 IP 192.168.43.124.8880 > 192.168.43.146.7771: UDP, length 120
00:16:35.773600 IP 192.168.43.124.8880 > 192.168.43.146.7771: UDP, length 120
00:16:35.773672 IP 192.168.43.124.8880 > 192.168.43.146.7771: UDP, length 120
00:16:35.775680 IP 192.168.43.146.8880 > 192.168.43.147.7772: UDP, length 120
00:16:35.825674 IP 192.168.43.146.8880 > 192.168.43.147.7772: UDP, length 120
00:16:35.875671 IP 192.168.43.146.8880 > 192.168.43.147.7772: UDP, length 120
00:16:35.916307 IP 192.168.43.124.8880 > 192.168.43.146.7771: UDP, length 120
00:16:35.916391 IP 192.168.43.124.8880 > 192.168.43.146.7771: UDP, length 120
00:16:35.916476 IP 192.168.43.124.8880 > 192.168.43.146.7771: UDP, length 120
00:16:35.925673 IP 192.168.43.146.8880 > 192.168.43.147.7772: UDP, length 120
00:16:35.975672 IP 192.168.43.146.8880 > 192.168.43.147.7772: UDP, length 120
00:16:36.025672 IP 192.168.43.146.8880 > 192.168.43.147.7772: UDP, length 120
00:16:36.056266 IP 192.168.43.124.8880 > 192.168.43.146.7771: UDP, length 120
00:16:36.056579 IP 192.168.43.124.8880 > 192.168.43.146.7771: UDP, length 120
00:16:36.075674 IP 192.168.43.146.8880 > 192.168.43.147.7772: UDP, length 120
00:16:36.125670 IP 192.168.43.146.8880 > 192.168.43.147.7772: UDP, length 120
00:16:36.157568 IP 192.168.43.124.8880 > 192.168.43.146.7771: UDP, length 120
00:16:36.157711 IP 192.168.43.124.8880 > 192.168.43.146.7771: UDP, length 120
00:16:36.175672 IP 192.168.43.146.8880 > 192.168.43.147.7772: UDP, length 120
00:16:36.225670 IP 192.168.43.146.8880 > 192.168.43.147.7772: UDP, length 120
00:16:36.266465 IP 192.168.43.124.8880 > 192.168.43.146.7771: UDP, length 120
00:16:36.266609 IP 192.168.43.124.8880 > 192.168.43.146.7771: UDP, length 120
00:16:36.266726 IP 192.168.43.124.8880 > 192.168.43.146.7771: UDP, length 120
00:16:36.275671 IP 192.168.43.146.8880 > 192.168.43.147.7772: UDP, length 120
00:16:36.325674 IP 192.168.43.146.8880 > 192.168.43.147.7772: UDP, length 120
00:16:36.375671 IP 192.168.43.146.8880 > 192.168.43.147.7772: UDP, length 120
00:16:36.407782 IP 192.168.43.124.8880 > 192.168.43.146.7771: UDP, length 120
00:16:36.407928 IP 192.168.43.124.8880 > 192.168.43.146.7771: UDP, length 120
00:16:36.425675 IP 192.168.43.146.8880 > 192.168.43.147.7772: UDP, length 120
00:16:36.475671 IP 192.168.43.146.8880 > 192.168.43.147.7772: UDP, length 120
00:16:36.507517 IP 192.168.43.124.8880 > 192.168.43.146.7771: UDP, length 120
00:16:36.507659 IP 192.168.43.124.8880 > 192.168.43.146.7771: UDP, length 120
00:16:36.525673 IP 192.168.43.146.8880 > 192.168.43.147.7772: UDP, length 120
00:16:36.575724 IP 192.168.43.146.8880 > 192.168.43.147.7772: UDP, length 120
00:16:36.608661 IP 192.168.43.124.8880 > 192.168.43.146.7771: UDP, length 120
00:16:36.608801 IP 192.168.43.124.8880 > 192.168.43.146.7771: UDP, length 120
00:16:36.625749 IP 192.168.43.146.8880 > 192.168.43.147.7772: UDP, length 120
00:16:36.675769 IP 192.168.43.146.8880 > 192.168.43.147.7772: UDP, length 120
00:16:36.707967 IP 192.168.43.124.8880 > 192.168.43.146.7771: UDP, length 120
00:16:36.708338 IP 192.168.43.124.8880 > 192.168.43.146.7771: UDP, length 120
00:16:36.725748 IP 192.168.43.146.8880 > 192.168.43.147.7772: UDP, length 120
00:16:36.775737 IP 192.168.43.146.8880 > 192.168.43.147.7772: UDP, length 120
00:16:36.806992 IP 192.168.43.124.8880 > 192.168.43.146.7771: UDP, length 120
00:16:36.807232 IP 192.168.43.124.8880 > 192.168.43.146.7771: UDP, length 120
00:16:36.825746 IP 192.168.43.146.8880 > 192.168.43.147.7772: UDP, length 120
00:16:36.875742 IP 192.168.43.146.8880 > 192.168.43.147.7772: UDP, length 120
00:16:36.916742 IP 192.168.43.124.8880 > 192.168.43.146.7771: UDP, length 120
00:16:36.917018 IP 192.168.43.124.8880 > 192.168.43.146.7771: UDP, length 120
00:16:36.917147 IP 192.168.43.124.8880 > 192.168.43.146.7771: UDP, length 120
00:16:36.925752 IP 192.168.43.146.8880 > 192.168.43.147.7772: UDP, length 120
00:16:36.975741 IP 192.168.43.146.8880 > 192.168.43.147.7772: UDP, length 120
00:16:37.025692 IP 192.168.43.146.8880 > 192.168.43.147.7772: UDP, length 120
00:16:37.058518 IP 192.168.43.124.8880 > 192.168.43.146.7771: UDP, length 120
00:16:37.058748 IP 192.168.43.124.8880 > 192.168.43.146.7771: UDP, length 120
00:16:37.075707 IP 192.168.43.146.8880 > 192.168.43.147.7772: UDP, length 120
00:16:37.125671 IP 192.168.43.146.8880 > 192.168.43.147.7772: UDP, length 120
00:16:37.157581 IP 192.168.43.124.8880 > 192.168.43.146.7771: UDP, length 120
00:16:37.157733 IP 192.168.43.124.8880 > 192.168.43.146.7771: UDP, length 120
00:16:37.175672 IP 192.168.43.146.8880 > 192.168.43.147.7772: UDP, length 120
00:16:37.225668 IP 192.168.43.146.8880 > 192.168.43.147.7772: UDP, length 120
00:16:37.257563 IP 192.168.43.124.8880 > 192.168.43.146.7771: UDP, length 120
00:16:37.257714 IP 192.168.43.124.8880 > 192.168.43.146.7771: UDP, length 120
00:16:37.275671 IP 192.168.43.146.8880 > 192.168.43.147.7772: UDP, length 120
00:16:37.325670 IP 192.168.43.146.8880 > 192.168.43.147.7772: UDP, length 120
00:16:37.358377 IP 192.168.43.124.8880 > 192.168.43.146.7771: UDP, length 120
00:16:37.358528 IP 192.168.43.124.8880 > 192.168.43.146.7771: UDP, length 120
00:16:37.375672 IP 192.168.43.146.8880 > 192.168.43.147.7772: UDP, length 120
00:16:37.425668 IP 192.168.43.146.8880 > 192.168.43.147.7772: UDP, length 120
00:16:37.457728 IP 192.168.43.124.8880 > 192.168.43.146.7771: UDP, length 120
00:16:37.457878 IP 192.168.43.124.8880 > 192.168.43.146.7771: UDP, length 120
00:16:37.461029 IP 192.168.43.124.8880 > 192.168.43.146.7771: UDP, length 120
00:16:37.475673 IP 192.168.43.146.8880 > 192.168.43.147.7772: UDP, length 120
00:16:37.512513 IP 192.168.43.124.8880 > 192.168.43.146.7771: UDP, length 120
00:16:37.525670 IP 192.168.43.146.8880 > 192.168.43.147.7772: UDP, length 120
00:16:37.565420 IP 192.168.43.124.8880 > 192.168.43.146.7771: UDP, length 120
00:16:37.575674 IP 192.168.43.146.8880 > 192.168.43.147.7772: UDP, length 120
00:16:37.613268 IP 192.168.43.124.8880 > 192.168.43.146.7771: UDP, length 120
00:16:37.625751 IP 192.168.43.146.8880 > 192.168.43.147.7772: UDP, length 120
00:16:37.665734 IP 192.168.43.124.8880 > 192.168.43.146.7771: UDP, length 120
00:16:37.675708 IP 192.168.43.146.8880 > 192.168.43.147.7772: UDP, length 120
00:16:37.711837 IP 192.168.43.124.8880 > 192.168.43.146.7771: UDP, length 120
00:16:37.725706 IP 192.168.43.146.8880 > 192.168.43.147.7772: UDP, length 120
00:16:37.764410 IP 192.168.43.124.8880 > 192.168.43.146.7771: UDP, length 120
00:16:37.775727 IP 192.168.43.146.8880 > 192.168.43.147.7772: UDP, length 120
00:16:37.811790 IP 192.168.43.124.8880 > 192.168.43.146.7771: UDP, length 120
00:16:37.825702 IP 192.168.43.146.8880 > 192.168.43.147.7772: UDP, length 120
00:16:37.861748 IP 192.168.43.124.8880 > 192.168.43.146.7771: UDP, length 120
00:16:37.875700 IP 192.168.43.146.8880 > 192.168.43.147.7772: UDP, length 120
00:16:37.911970 IP 192.168.43.124.8880 > 192.168.43.146.7771: UDP, length 120
00:16:37.925697 IP 192.168.43.146.8880 > 192.168.43.147.7772: UDP, length 120
00:16:37.961844 IP 192.168.43.124.8880 > 192.168.43.146.7771: UDP, length 120
00:16:37.975703 IP 192.168.43.146.8880 > 192.168.43.147.7772: UDP, length 120
00:16:38.016301 IP 192.168.43.124.8880 > 192.168.43.146.7771: UDP, length 120
00:16:38.025701 IP 192.168.43.146.8880 > 192.168.43.147.7772: UDP, length 120
00:16:38.063256 IP 192.168.43.124.8880 > 192.168.43.146.7771: UDP, length 120
00:16:38.075699 IP 192.168.43.146.8880 > 192.168.43.147.7772: UDP, length 120
00:16:38.112712 IP 192.168.43.124.8880 > 192.168.43.146.7771: UDP, length 120
00:16:38.125698 IP 192.168.43.146.8880 > 192.168.43.147.7772: UDP, length 120
00:16:38.173731 IP 192.168.43.124.8880 > 192.168.43.146.7771: UDP, length 120
00:16:38.175696 IP 192.168.43.146.8880 > 192.168.43.147.7772: UDP, length 120
00:16:38.211397 IP 192.168.43.124.8880 > 192.168.43.146.7771: UDP, length 120
00:16:38.225701 IP 192.168.43.146.8880 > 192.168.43.147.7772: UDP, length 120
00:16:38.265646 IP 192.168.43.124.8880 > 192.168.43.146.7771: UDP, length 120
00:16:38.275699 IP 192.168.43.146.8880 > 192.168.43.147.7772: UDP, length 120
00:16:38.312642 IP 192.168.43.124.8880 > 192.168.43.146.7771: UDP, length 120
00:16:38.325700 IP 192.168.43.146.8880 > 192.168.43.147.7772: UDP, length 120
00:16:38.363512 IP 192.168.43.124.8880 > 192.168.43.146.7771: UDP, length 120
00:16:38.375696 IP 192.168.43.146.8880 > 192.168.43.147.7772: UDP, length 120
00:16:38.414292 IP 192.168.43.124.8880 > 192.168.43.146.7771: UDP, length 120
00:16:38.425695 IP 192.168.43.146.8880 > 192.168.43.147.7772: UDP, length 120
00:16:38.464720 IP 192.168.43.124.8880 > 192.168.43.146.7771: UDP, length 120
00:16:38.475695 IP 192.168.43.146.8880 > 192.168.43.147.7772: UDP, length 120
00:16:38.512383 IP 192.168.43.124.8880 > 192.168.43.146.7771: UDP, length 120
00:16:38.525696 IP 192.168.43.146.8880 > 192.168.43.147.7772: UDP, length 120
00:16:38.563227 IP 192.168.43.124.8880 > 192.168.43.146.7771: UDP, length 120
00:16:38.575738 IP 192.168.43.146.8880 > 192.168.43.147.7772: UDP, length 120
00:16:38.621864 IP 192.168.43.124.8880 > 192.168.43.146.7771: UDP, length 120
00:16:38.625743 IP 192.168.43.146.8880 > 192.168.43.147.7772: UDP, length 120
00:16:38.661613 IP 192.168.43.124.8880 > 192.168.43.146.7771: UDP, length 120
00:16:38.675705 IP 192.168.43.146.8880 > 192.168.43.147.7772: UDP, length 120
00:16:38.711892 IP 192.168.43.124.8880 > 192.168.43.146.7771: UDP, length 120
00:16:38.725711 IP 192.168.43.146.8880 > 192.168.43.147.7772: UDP, length 120
00:16:38.775717 IP 192.168.43.146.8880 > 192.168.43.147.7772: UDP, length 120
00:16:38.779149 IP 192.168.43.124.8880 > 192.168.43.146.7771: UDP, length 120
00:16:38.811957 IP 192.168.43.124.8880 > 192.168.43.146.7771: UDP, length 120
00:16:38.825702 IP 192.168.43.146.8880 > 192.168.43.147.7772: UDP, length 120
00:16:38.871849 IP 192.168.43.124.8880 > 192.168.43.146.7771: UDP, length 120
00:16:38.875700 IP 192.168.43.146.8880 > 192.168.43.147.7772: UDP, length 120
00:16:38.911590 IP 192.168.43.124.8880 > 192.168.43.146.7771: UDP, length 120
00:16:38.925698 IP 192.168.43.146.8880 > 192.168.43.147.7772: UDP, length 120
00:16:38.961615 IP 192.168.43.124.8880 > 192.168.43.146.7771: UDP, length 120
00:16:38.975697 IP 192.168.43.146.8880 > 192.168.43.147.7772: UDP, length 120
00:16:39.023385 IP 192.168.43.124.8880 > 192.168.43.146.7771: UDP, length 120
00:16:39.025698 IP 192.168.43.146.8880 > 192.168.43.147.7772: UDP, length 120
00:16:39.063229 IP 192.168.43.124.8880 > 192.168.43.146.7771: UDP, length 120
00:16:39.075698 IP 192.168.43.146.8880 > 192.168.43.147.7772: UDP, length 120
00:16:39.111620 IP 192.168.43.124.8880 > 192.168.43.146.7771: UDP, length 120
00:16:39.125699 IP 192.168.43.146.8880 > 192.168.43.147.7772: UDP, length 120
00:16:39.172342 IP 192.168.43.124.8880 > 192.168.43.146.7771: UDP, length 120
00:16:39.175700 IP 192.168.43.146.8880 > 192.168.43.147.7772: UDP, length 120
00:16:39.211634 IP 192.168.43.124.8880 > 192.168.43.146.7771: UDP, length 120
00:16:39.225697 IP 192.168.43.146.8880 > 192.168.43.147.7772: UDP, length 120
00:16:39.262296 IP 192.168.43.124.8880 > 192.168.43.146.7771: UDP, length 120
00:16:39.275698 IP 192.168.43.146.8880 > 192.168.43.147.7772: UDP, length 120
00:16:39.322464 IP 192.168.43.124.8880 > 192.168.43.146.7771: UDP, length 120
00:16:39.325701 IP 192.168.43.146.8880 > 192.168.43.147.7772: UDP, length 120
00:16:39.361606 IP 192.168.43.124.8880 > 192.168.43.146.7771: UDP, length 120
00:16:39.375701 IP 192.168.43.146.8880 > 192.168.43.147.7772: UDP, length 120
00:16:39.414430 IP 192.168.43.124.8880 > 192.168.43.146.7771: UDP, length 120
00:16:39.425697 IP 192.168.43.146.8880 > 192.168.43.147.7772: UDP, length 120
00:16:39.472965 IP 192.168.43.124.8880 > 192.168.43.146.7771: UDP, length 120
00:16:39.475697 IP 192.168.43.146.8880 > 192.168.43.147.7772: UDP, length 120
00:16:39.511556 IP 192.168.43.124.8880 > 192.168.43.146.7771: UDP, length 120
00:16:39.525696 IP 192.168.43.146.8880 > 192.168.43.147.7772: UDP, length 120
00:16:39.562791 IP 192.168.43.124.8880 > 192.168.43.146.7771: UDP, length 120
00:16:39.575700 IP 192.168.43.146.8880 > 192.168.43.147.7772: UDP, length 120
00:16:39.625759 IP 192.168.43.146.8880 > 192.168.43.147.7772: UDP, length 120
00:16:39.629787 IP 192.168.43.124.8880 > 192.168.43.146.7771: UDP, length 120
00:16:39.661789 IP 192.168.43.124.8880 > 192.168.43.146.7771: UDP, length 120
00:16:39.675715 IP 192.168.43.146.8880 > 192.168.43.147.7772: UDP, length 120
00:16:39.714181 IP 192.168.43.124.8880 > 192.168.43.146.7771: UDP, length 120
00:16:39.725700 IP 192.168.43.146.8880 > 192.168.43.147.7772: UDP, length 120
00:16:39.772266 IP 192.168.43.124.8880 > 192.168.43.146.7771: UDP, length 120
00:16:39.775718 IP 192.168.43.146.8880 > 192.168.43.147.7772: UDP, length 120
00:16:39.811793 IP 192.168.43.124.8880 > 192.168.43.146.7771: UDP, length 120
00:16:39.825707 IP 192.168.43.146.8880 > 192.168.43.147.7772: UDP, length 120
00:16:39.862286 IP 192.168.43.124.8880 > 192.168.43.146.7771: UDP, length 120
00:16:39.875703 IP 192.168.43.146.8880 > 192.168.43.147.7772: UDP, length 120
00:16:39.914895 IP 192.168.43.124.8880 > 192.168.43.146.7771: UDP, length 120
00:16:39.925696 IP 192.168.43.146.8880 > 192.168.43.147.7772: UDP, length 120
00:16:39.975694 IP 192.168.43.146.8880 > 192.168.43.147.7772: UDP, length 120
00:16:39.979115 IP 192.168.43.124.8880 > 192.168.43.146.7771: UDP, length 120
00:16:40.012607 IP 192.168.43.124.8880 > 192.168.43.146.7771: UDP, length 120
00:16:40.025702 IP 192.168.43.146.8880 > 192.168.43.147.7772: UDP, length 120
00:16:40.064893 IP 192.168.43.124.8880 > 192.168.43.146.7771: UDP, length 120
00:16:40.075738 IP 192.168.43.146.8880 > 192.168.43.147.7772: UDP, length 120
00:16:40.123600 IP 192.168.43.124.8880 > 192.168.43.146.7771: UDP, length 120
00:16:40.125699 IP 192.168.43.146.8880 > 192.168.43.147.7772: UDP, length 120
00:16:40.161454 IP 192.168.43.124.8880 > 192.168.43.146.7771: UDP, length 120
00:16:40.175698 IP 192.168.43.146.8880 > 192.168.43.147.7772: UDP, length 120
00:16:40.212308 IP 192.168.43.124.8880 > 192.168.43.146.7771: UDP, length 120
00:16:40.225694 IP 192.168.43.146.8880 > 192.168.43.147.7772: UDP, length 120
00:16:40.267748 IP 192.168.43.124.8880 > 192.168.43.146.7771: UDP, length 120
00:16:40.275692 IP 192.168.43.146.8880 > 192.168.43.147.7772: UDP, length 120
00:16:40.325696 IP 192.168.43.146.8880 > 192.168.43.147.7772: UDP, length 120
00:16:40.329140 IP 192.168.43.124.8880 > 192.168.43.146.7771: UDP, length 120
00:16:40.361502 IP 192.168.43.124.8880 > 192.168.43.146.7771: UDP, length 120
00:16:40.375701 IP 192.168.43.146.8880 > 192.168.43.147.7772: UDP, length 120
00:16:40.411460 IP 192.168.43.124.8880 > 192.168.43.146.7771: UDP, length 120
00:16:40.425696 IP 192.168.43.146.8880 > 192.168.43.147.7772: UDP, length 120
00:16:40.473984 IP 192.168.43.124.8880 > 192.168.43.146.7771: UDP, length 120
00:16:40.475695 IP 192.168.43.146.8880 > 192.168.43.147.7772: UDP, length 120
00:16:40.513161 IP 192.168.43.124.8880 > 192.168.43.146.7771: UDP, length 120
00:16:40.525693 IP 192.168.43.146.8880 > 192.168.43.147.7772: UDP, length 120
00:16:40.562490 IP 192.168.43.124.8880 > 192.168.43.146.7771: UDP, length 120
00:16:40.575706 IP 192.168.43.146.8880 > 192.168.43.147.7772: UDP, length 120
00:16:40.621831 IP 192.168.43.124.8880 > 192.168.43.146.7771: UDP, length 120
00:16:40.625697 IP 192.168.43.146.8880 > 192.168.43.147.7772: UDP, length 120
00:16:40.662387 IP 192.168.43.124.8880 > 192.168.43.146.7771: UDP, length 120
00:16:40.675695 IP 192.168.43.146.8880 > 192.168.43.147.7772: UDP, length 120
00:16:40.725693 IP 192.168.43.146.8880 > 192.168.43.147.7772: UDP, length 120
00:16:40.775703 IP 192.168.43.146.8880 > 192.168.43.147.7772: UDP, length 120
00:16:40.825701 IP 192.168.43.146.8880 > 192.168.43.147.7772: UDP, length 120
00:16:40.866523 IP 192.168.43.124.8880 > 192.168.43.146.7771: UDP, length 120
00:16:40.866816 IP 192.168.43.124.8880 > 192.168.43.146.7771: UDP, length 120
00:16:40.867029 IP 192.168.43.124.8880 > 192.168.43.146.7771: UDP, length 120
00:16:40.875701 IP 192.168.43.146.8880 > 192.168.43.147.7772: UDP, length 120
00:16:40.925698 IP 192.168.43.146.8880 > 192.168.43.147.7772: UDP, length 120
00:16:40.975697 IP 192.168.43.146.8880 > 192.168.43.147.7772: UDP, length 120
00:16:41.015192 IP 192.168.43.124.8880 > 192.168.43.146.7771: UDP, length 120
00:16:41.015457 IP 192.168.43.124.8880 > 192.168.43.146.7771: UDP, length 120
00:16:41.015662 IP 192.168.43.124.8880 > 192.168.43.146.7771: UDP, length 120
00:16:41.025697 IP 192.168.43.146.8880 > 192.168.43.147.7772: UDP, length 120
00:16:41.075700 IP 192.168.43.146.8880 > 192.168.43.147.7772: UDP, length 120
00:16:41.125698 IP 192.168.43.146.8880 > 192.168.43.147.7772: UDP, length 120
00:16:41.163257 IP 192.168.43.124.8880 > 192.168.43.146.7771: UDP, length 120
00:16:41.163495 IP 192.168.43.124.8880 > 192.168.43.146.7771: UDP, length 120
00:16:41.175695 IP 192.168.43.146.8880 > 192.168.43.147.7772: UDP, length 120
00:16:41.225694 IP 192.168.43.146.8880 > 192.168.43.147.7772: UDP, length 120
