20:16:28.084241 IP 192.168.43.124.8880 > 192.168.43.146.7771: UDP, length 120
20:16:28.134346 IP 192.168.43.124.8880 > 192.168.43.146.7771: UDP, length 120
20:16:28.184338 IP 192.168.43.124.8880 > 192.168.43.146.7771: UDP, length 120
20:16:28.234348 IP 192.168.43.124.8880 > 192.168.43.146.7771: UDP, length 120
20:16:28.284314 IP 192.168.43.124.8880 > 192.168.43.146.7771: UDP, length 120
20:16:28.334317 IP 192.168.43.124.8880 > 192.168.43.146.7771: UDP, length 120
20:16:28.384346 IP 192.168.43.124.8880 > 192.168.43.146.7771: UDP, length 120
20:16:28.434351 IP 192.168.43.124.8880 > 192.168.43.146.7771: UDP, length 120
20:16:28.484316 IP 192.168.43.124.8880 > 192.168.43.146.7771: UDP, length 120
20:16:28.534349 IP 192.168.43.124.8880 > 192.168.43.146.7771: UDP, length 120
20:16:28.584352 IP 192.168.43.124.8880 > 192.168.43.146.7771: UDP, length 120
20:16:28.634339 IP 192.168.43.124.8880 > 192.168.43.146.7771: UDP, length 120
20:16:28.684360 IP 192.168.43.124.8880 > 192.168.43.146.7771: UDP, length 120
20:16:28.734352 IP 192.168.43.124.8880 > 192.168.43.146.7771: UDP, length 120
20:16:28.784335 IP 192.168.43.124.8880 > 192.168.43.146.7771: UDP, length 120
20:16:28.834352 IP 192.168.43.124.8880 > 192.168.43.146.7771: UDP, length 120
20:16:28.884348 IP 192.168.43.124.8880 > 192.168.43.146.7771: UDP, length 120
20:16:28.934306 IP 192.168.43.124.8880 > 192.168.43.146.7771: UDP, length 120
20:16:28.984353 IP 192.168.43.124.8880 > 192.168.43.146.7771: UDP, length 120
20:16:29.034347 IP 192.168.43.124.8880 > 192.168.43.146.7771: UDP, length 120
20:16:29.084344 IP 192.168.43.124.8880 > 192.168.43.146.7771: UDP, length 120
20:16:29.134349 IP 192.168.43.124.8880 > 192.168.43.146.7771: UDP, length 120
20:16:29.184344 IP 192.168.43.124.8880 > 192.168.43.146.7771: UDP, length 120
20:16:29.234348 IP 192.168.43.124.8880 > 192.168.43.146.7771: UDP, length 120
20:16:29.284405 IP 192.168.43.124.8880 > 192.168.43.146.7771: UDP, length 120
20:16:29.294618 IP 192.168.43.147.8880 > 192.168.43.124.7773: UDP, length 120
20:16:29.334405 IP 192.168.43.124.8880 > 192.168.43.146.7771: UDP, length 120
20:16:29.345760 IP 192.168.43.147.8880 > 192.168.43.124.7773: UDP, length 120
20:16:29.384392 IP 192.168.43.124.8880 > 192.168.43.146.7771: UDP, length 120
20:16:29.395218 IP 192.168.43.147.8880 > 192.168.43.124.7773: UDP, length 120
20:16:29.434356 IP 192.168.43.124.8880 > 192.168.43.146.7771: UDP, length 120
20:16:29.447970 IP 192.168.43.147.8880 > 192.168.43.124.7773: UDP, length 120
20:16:29.484398 IP 192.168.43.124.8880 > 192.168.43.146.7771: UDP, length 120
20:16:29.492383 IP 192.168.43.147.8880 > 192.168.43.124.7773: UDP, length 120
20:16:29.534358 IP 192.168.43.124.8880 > 192.168.43.146.7771: UDP, length 120
20:16:29.547100 IP 192.168.43.147.8880 > 192.168.43.124.7773: UDP, length 120
20:16:29.584388 IP 192.168.43.124.8880 > 192.168.43.146.7771: UDP, length 120
20:16:29.596328 IP 192.168.43.147.8880 > 192.168.43.124.7773: UDP, length 120
20:16:29.634349 IP 192.168.43.124.8880 > 192.168.43.146.7771: UDP, length 120
20:16:29.648308 IP 192.168.43.147.8880 > 192.168.43.124.7773: UDP, length 120
20:16:29.684388 IP 192.168.43.124.8880 > 192.168.43.146.7771: UDP, length 120
20:16:29.692626 IP 192.168.43.147.8880 > 192.168.43.124.7773: UDP, length 120
20:16:29.734342 IP 192.168.43.124.8880 > 192.168.43.146.7771: UDP, length 120
20:16:29.747189 IP 192.168.43.147.8880 > 192.168.43.124.7773: UDP, length 120
20:16:29.784451 IP 192.168.43.124.8880 > 192.168.43.146.7771: UDP, length 120
20:16:29.796010 IP 192.168.43.147.8880 > 192.168.43.124.7773: UDP, length 120
20:16:29.834344 IP 192.168.43.124.8880 > 192.168.43.146.7771: UDP, length 120
20:16:29.849297 IP 192.168.43.147.8880 > 192.168.43.124.7773: UDP, length 120
20:16:29.884351 IP 192.168.43.124.8880 > 192.168.43.146.7771: UDP, length 120
20:16:29.897650 IP 192.168.43.147.8880 > 192.168.43.124.7773: UDP, length 120
20:16:29.934381 IP 192.168.43.124.8880 > 192.168.43.146.7771: UDP, length 120
20:16:29.947796 IP 192.168.43.147.8880 > 192.168.43.124.7773: UDP, length 120
20:16:29.984400 IP 192.168.43.124.8880 > 192.168.43.146.7771: UDP, length 120
20:16:29.999826 IP 192.168.43.147.8880 > 192.168.43.124.7773: UDP, length 120
20:16:30.034408 IP 192.168.43.124.8880 > 192.168.43.146.7771: UDP, length 120
20:16:30.045258 IP 192.168.43.147.8880 > 192.168.43.124.7773: UDP, length 120
20:16:30.084454 IP 192.168.43.124.8880 > 192.168.43.146.7771: UDP, length 120
20:16:30.095722 IP 192.168.43.147.8880 > 192.168.43.124.7773: UDP, length 120
20:16:30.134355 IP 192.168.43.124.8880 > 192.168.43.146.7771: UDP, length 120
20:16:30.145403 IP 192.168.43.147.8880 > 192.168.43.124.7773: UDP, length 120
20:16:30.184363 IP 192.168.43.124.8880 > 192.168.43.146.7771: UDP, length 120
20:16:30.196161 IP 192.168.43.147.8880 > 192.168.43.124.7773: UDP, length 120
20:16:30.234354 IP 192.168.43.124.8880 > 192.168.43.146.7771: UDP, length 120
20:16:30.248065 IP 192.168.43.147.8880 > 192.168.43.124.7773: UDP, length 120
20:16:30.284396 IP 192.168.43.124.8880 > 192.168.43.146.7771: UDP, length 120
20:16:30.295449 IP 192.168.43.147.8880 > 192.168.43.124.7773: UDP, length 120
20:16:30.334347 IP 192.168.43.124.8880 > 192.168.43.146.7771: UDP, length 120
20:16:30.345211 IP 192.168.43.147.8880 > 192.168.43.124.7773: UDP, length 120
20:16:30.384412 IP 192.168.43.124.8880 > 192.168.43.146.7771: UDP, length 120
20:16:30.395270 IP 192.168.43.147.8880 > 192.168.43.124.7773: UDP, length 120
20:16:30.434413 IP 192.168.43.124.8880 > 192.168.43.146.7771: UDP, length 120
20:16:30.445113 IP 192.168.43.147.8880 > 192.168.43.124.7773: UDP, length 120
20:16:30.484398 IP 192.168.43.124.8880 > 192.168.43.146.7771: UDP, length 120
20:16:30.504871 IP 192.168.43.147.8880 > 192.168.43.124.7773: UDP, length 120
20:16:30.534423 IP 192.168.43.124.8880 > 192.168.43.146.7771: UDP, length 120
20:16:30.541722 IP 192.168.43.147.8880 > 192.168.43.124.7773: UDP, length 120
20:16:30.584446 IP 192.168.43.124.8880 > 192.168.43.146.7771: UDP, length 120
20:16:30.595137 IP 192.168.43.147.8880 > 192.168.43.124.7773: UDP, length 120
20:16:30.634353 IP 192.168.43.124.8880 > 192.168.43.146.7771: UDP, length 120
20:16:30.649190 IP 192.168.43.147.8880 > 192.168.43.124.7773: UDP, length 120
20:16:30.684351 IP 192.168.43.124.8880 > 192.168.43.146.7771: UDP, length 120
20:16:30.702895 IP 192.168.43.147.8880 > 192.168.43.124.7773: UDP, length 120
20:16:30.734340 IP 192.168.43.124.8880 > 192.168.43.146.7771: UDP, length 120
20:16:30.757236 IP 192.168.43.147.8880 > 192.168.43.124.7773: UDP, length 120
20:16:30.784346 IP 192.168.43.124.8880 > 192.168.43.146.7771: UDP, length 120
20:16:30.812751 IP 192.168.43.147.8880 > 192.168.43.124.7773: UDP, length 120
20:16:30.834348 IP 192.168.43.124.8880 > 192.168.43.146.7771: UDP, length 120
20:16:30.848255 IP 192.168.43.147.8880 > 192.168.43.124.7773: UDP, length 120
20:16:30.884346 IP 192.168.43.124.8880 > 192.168.43.146.7771: UDP, length 120
20:16:30.890903 IP 192.168.43.147.8880 > 192.168.43.124.7773: UDP, length 120
20:16:30.934316 IP 192.168.43.124.8880 > 192.168.43.146.7771: UDP, length 120
20:16:30.947082 IP 192.168.43.147.8880 > 192.168.43.124.7773: UDP, length 120
20:16:30.984392 IP 192.168.43.124.8880 > 192.168.43.146.7771: UDP, length 120
20:16:31.002007 IP 192.168.43.147.8880 > 192.168.43.124.7773: UDP, length 120
20:16:31.034341 IP 192.168.43.124.8880 > 192.168.43.146.7771: UDP, length 120
20:16:31.057387 IP 192.168.43.147.8880 > 192.168.43.124.7773: UDP, length 120
20:16:31.084392 IP 192.168.43.124.8880 > 192.168.43.146.7771: UDP, length 120
20:16:31.093651 IP 192.168.43.147.8880 > 192.168.43.124.7773: UDP, length 120
20:16:31.134397 IP 192.168.43.124.8880 > 192.168.43.146.7771: UDP, length 120
20:16:31.145758 IP 192.168.43.147.8880 > 192.168.43.124.7773: UDP, length 120
20:16:31.184394 IP 192.168.43.124.8880 > 192.168.43.146.7771: UDP, length 120
20:16:31.194462 IP 192.168.43.147.8880 > 192.168.43.124.7773: UDP, length 120
20:16:31.234395 IP 192.168.43.124.8880 > 192.168.43.146.7771: UDP, length 120
20:16:31.249811 IP 192.168.43.147.8880 > 192.168.43.124.7773: UDP, length 120
20:16:31.284395 IP 192.168.43.124.8880 > 192.168.43.146.7771: UDP, length 120
20:16:31.305312 IP 192.168.43.147.8880 > 192.168.43.124.7773: UDP, length 120
20:16:31.334405 IP 192.168.43.124.8880 > 192.168.43.146.7771: UDP, length 120
20:16:31.361016 IP 192.168.43.147.8880 > 192.168.43.124.7773: UDP, length 120
20:16:31.384454 IP 192.168.43.124.8880 > 192.168.43.146.7771: UDP, length 120
20:16:31.393801 IP 192.168.43.147.8880 > 192.168.43.124.7773: UDP, length 120
20:16:31.434450 IP 192.168.43.124.8880 > 192.168.43.146.7771: UDP, length 120
20:16:31.444427 IP 192.168.43.147.8880 > 192.168.43.124.7773: UDP, length 120
20:16:31.484452 IP 192.168.43.124.8880 > 192.168.43.146.7771: UDP, length 120
20:16:31.494925 IP 192.168.43.147.8880 > 192.168.43.124.7773: UDP, length 120
20:16:31.534452 IP 192.168.43.124.8880 > 192.168.43.146.7771: UDP, length 120
20:16:31.541717 IP 192.168.43.147.8880 > 192.168.43.124.7773: UDP, length 120
20:16:31.584410 IP 192.168.43.124.8880 > 192.168.43.146.7771: UDP, length 120
20:16:31.595186 IP 192.168.43.147.8880 > 192.168.43.124.7773: UDP, length 120
20:16:31.634395 IP 192.168.43.124.8880 > 192.168.43.146.7771: UDP, length 120
20:16:31.643608 IP 192.168.43.147.8880 > 192.168.43.124.7773: UDP, length 120
20:16:31.684390 IP 192.168.43.124.8880 > 192.168.43.146.7771: UDP, length 120
20:16:31.696150 IP 192.168.43.147.8880 > 192.168.43.124.7773: UDP, length 120
20:16:31.734395 IP 192.168.43.124.8880 > 192.168.43.146.7771: UDP, length 120
20:16:31.751140 IP 192.168.43.147.8880 > 192.168.43.124.7773: UDP, length 120
20:16:31.784448 IP 192.168.43.124.8880 > 192.168.43.146.7771: UDP, length 120
20:16:31.809859 IP 192.168.43.147.8880 > 192.168.43.124.7773: UDP, length 120
20:16:31.834394 IP 192.168.43.124.8880 > 192.168.43.146.7771: UDP, length 120
20:16:31.843966 IP 192.168.43.147.8880 > 192.168.43.124.7773: UDP, length 120
20:16:31.884453 IP 192.168.43.124.8880 > 192.168.43.146.7771: UDP, length 120
20:16:31.896891 IP 192.168.43.147.8880 > 192.168.43.124.7773: UDP, length 120
20:16:31.934445 IP 192.168.43.124.8880 > 192.168.43.146.7771: UDP, length 120
20:16:31.944190 IP 192.168.43.147.8880 > 192.168.43.124.7773: UDP, length 120
20:16:31.984446 IP 192.168.43.124.8880 > 192.168.43.146.7771: UDP, length 120
20:16:32.002518 IP 192.168.43.147.8880 > 192.168.43.124.7773: UDP, length 120
20:16:32.034447 IP 192.168.43.124.8880 > 192.168.43.146.7771: UDP, length 120
20:16:32.052579 IP 192.168.43.147.8880 > 192.168.43.124.7773: UDP, length 120
20:16:32.084448 IP 192.168.43.124.8880 > 192.168.43.146.7771: UDP, length 120
20:16:32.107265 IP 192.168.43.147.8880 > 192.168.43.124.7773: UDP, length 120
20:16:32.134393 IP 192.168.43.124.8880 > 192.168.43.146.7771: UDP, length 120
20:16:32.145280 IP 192.168.43.147.8880 > 192.168.43.124.7773: UDP, length 120
20:16:32.184396 IP 192.168.43.124.8880 > 192.168.43.146.7771: UDP, length 120
20:16:32.195067 IP 192.168.43.147.8880 > 192.168.43.124.7773: UDP, length 120
20:16:32.234395 IP 192.168.43.124.8880 > 192.168.43.146.7771: UDP, length 120
20:16:32.249065 IP 192.168.43.147.8880 > 192.168.43.124.7773: UDP, length 120
20:16:32.284394 IP 192.168.43.124.8880 > 192.168.43.146.7771: UDP, length 120
20:16:32.304495 IP 192.168.43.147.8880 > 192.168.43.124.7773: UDP, length 120
20:16:32.334398 IP 192.168.43.124.8880 > 192.168.43.146.7771: UDP, length 120
20:16:32.358294 IP 192.168.43.147.8880 > 192.168.43.124.7773: UDP, length 120
20:16:32.384394 IP 192.168.43.124.8880 > 192.168.43.146.7771: UDP, length 120
20:16:32.413143 IP 192.168.43.147.8880 > 192.168.43.124.7773: UDP, length 120
20:16:32.434339 IP 192.168.43.124.8880 > 192.168.43.146.7771: UDP, length 120
20:16:32.447635 IP 192.168.43.147.8880 > 192.168.43.124.7773: UDP, length 120
20:16:32.484313 IP 192.168.43.124.8880 > 192.168.43.146.7771: UDP, length 120
20:16:32.494259 IP 192.168.43.147.8880 > 192.168.43.124.7773: UDP, length 120
20:16:32.534288 IP 192.168.43.124.8880 > 192.168.43.146.7771: UDP, length 120
20:16:32.545386 IP 192.168.43.147.8880 > 192.168.43.124.7773: UDP, length 120
20:16:32.584398 IP 192.168.43.124.8880 > 192.168.43.146.7771: UDP, length 120
20:16:32.601434 IP 192.168.43.147.8880 > 192.168.43.124.7773: UDP, length 120
20:16:32.634393 IP 192.168.43.124.8880 > 192.168.43.146.7771: UDP, length 120
20:16:32.655840 IP 192.168.43.147.8880 > 192.168.43.124.7773: UDP, length 120
20:16:32.684359 IP 192.168.43.124.8880 > 192.168.43.146.7771: UDP, length 120
20:16:32.701265 IP 192.168.43.147.8880 > 192.168.43.124.7773: UDP, length 120
20:16:32.734317 IP 192.168.43.124.8880 > 192.168.43.146.7771: UDP, length 120
20:16:32.758475 IP 192.168.43.147.8880 > 192.168.43.124.7773: UDP, length 120
20:16:32.784306 IP 192.168.43.124.8880 > 192.168.43.146.7771: UDP, length 120
20:16:32.811986 IP 192.168.43.147.8880 > 192.168.43.124.7773: UDP, length 120
20:16:32.834388 IP 192.168.43.124.8880 > 192.168.43.146.7771: UDP, length 120
20:16:32.847235 IP 192.168.43.147.8880 > 192.168.43.124.7773: UDP, length 120
20:16:32.884392 IP 192.168.43.124.8880 > 192.168.43.146.7771: UDP, length 120
20:16:32.905660 IP 192.168.43.147.8880 > 192.168.43.124.7773: UDP, length 120
20:16:32.934389 IP 192.168.43.124.8880 > 192.168.43.146.7771: UDP, length 120
20:16:32.960925 IP 192.168.43.147.8880 > 192.168.43.124.7773: UDP, length 120
20:16:32.984396 IP 192.168.43.124.8880 > 192.168.43.146.7771: UDP, length 120
20:16:32.995809 IP 192.168.43.147.8880 > 192.168.43.124.7773: UDP, length 120
20:16:33.034393 IP 192.168.43.124.8880 > 192.168.43.146.7771: UDP, length 120
20:16:33.040854 IP 192.168.43.147.8880 > 192.168.43.124.7773: UDP, length 120
20:16:33.084395 IP 192.168.43.124.8880 > 192.168.43.146.7771: UDP, length 120
20:16:33.103333 IP 192.168.43.147.8880 > 192.168.43.124.7773: UDP, length 120
20:16:33.134444 IP 192.168.43.124.8880 > 192.168.43.146.7771: UDP, length 120
20:16:33.148460 IP 192.168.43.147.8880 > 192.168.43.124.7773: UDP, length 120
20:16:33.184444 IP 192.168.43.124.8880 > 192.168.43.146.7771: UDP, length 120
20:16:33.200297 IP 192.168.43.147.8880 > 192.168.43.124.7773: UDP, length 120
20:16:33.234452 IP 192.168.43.124.8880 > 192.168.43.146.7771: UDP, length 120
20:16:33.255074 IP 192.168.43.147.8880 > 192.168.43.124.7773: UDP, length 120
20:16:33.284447 IP 192.168.43.124.8880 > 192.168.43.146.7771: UDP, length 120
20:16:33.309598 IP 192.168.43.147.8880 > 192.168.43.124.7773: UDP, length 120
20:16:33.334444 IP 192.168.43.124.8880 > 192.168.43.146.7771: UDP, length 120
20:16:33.344960 IP 192.168.43.147.8880 > 192.168.43.124.7773: UDP, length 120
20:16:33.384451 IP 192.168.43.124.8880 > 192.168.43.146.7771: UDP, length 120
20:16:33.398832 IP 192.168.43.147.8880 > 192.168.43.124.7773: UDP, length 120
20:16:33.434449 IP 192.168.43.124.8880 > 192.168.43.146.7771: UDP, length 120
20:16:33.452452 IP 192.168.43.147.8880 > 192.168.43.124.7773: UDP, length 120
20:16:33.484451 IP 192.168.43.124.8880 > 192.168.43.146.7771: UDP, length 120
20:16:33.512315 IP 192.168.43.147.8880 > 192.168.43.124.7773: UDP, length 120
20:16:33.534451 IP 192.168.43.124.8880 > 192.168.43.146.7771: UDP, length 120
20:16:33.543278 IP 192.168.43.147.8880 > 192.168.43.124.7773: UDP, length 120
20:16:33.584397 IP 192.168.43.124.8880 > 192.168.43.146.7771: UDP, length 120
20:16:33.594706 IP 192.168.43.147.8880 > 192.168.43.124.7773: UDP, length 120
20:16:33.634389 IP 192.168.43.124.8880 > 192.168.43.146.7771: UDP, length 120
20:16:33.644185 IP 192.168.43.147.8880 > 192.168.43.124.7773: UDP, length 120
20:16:33.684393 IP 192.168.43.124.8880 > 192.168.43.146.7771: UDP, length 120
20:16:33.697178 IP 192.168.43.147.8880 > 192.168.43.124.7773: UDP, length 120
20:16:33.734397 IP 192.168.43.124.8880 > 192.168.43.146.7771: UDP, length 120
20:16:33.749873 IP 192.168.43.147.8880 > 192.168.43.124.7773: UDP, length 120
20:16:33.784392 IP 192.168.43.124.8880 > 192.168.43.146.7771: UDP, length 120
20:16:33.806536 IP 192.168.43.147.8880 > 192.168.43.124.7773: UDP, length 120
20:16:33.834444 IP 192.168.43.124.8880 > 192.168.43.146.7771: UDP, length 120
20:16:33.861090 IP 192.168.43.147.8880 > 192.168.43.124.7773: UDP, length 120
20:16:33.884450 IP 192.168.43.124.8880 > 192.168.43.146.7771: UDP, length 120
20:16:33.896642 IP 192.168.43.147.8880 > 192.168.43.124.7773: UDP, length 120
20:16:33.934396 IP 192.168.43.124.8880 > 192.168.43.146.7771: UDP, length 120
20:16:33.945545 IP 192.168.43.147.8880 > 192.168.43.124.7773: UDP, length 120
20:16:33.984450 IP 192.168.43.124.8880 > 192.168.43.146.7771: UDP, length 120
20:16:33.997894 IP 192.168.43.147.8880 > 192.168.43.124.7773: UDP, length 120
20:16:34.034451 IP 192.168.43.124.8880 > 192.168.43.146.7771: UDP, length 120
20:16:34.067333 IP 192.168.43.147.8880 > 192.168.43.124.7773: UDP, length 120
20:16:34.084446 IP 192.168.43.124.8880 > 192.168.43.146.7771: UDP, length 120
20:16:34.095427 IP 192.168.43.147.8880 > 192.168.43.124.7773: UDP, length 120
20:16:34.134399 IP 192.168.43.124.8880 > 192.168.43.146.7771: UDP, length 120
20:16:34.146818 IP 192.168.43.147.8880 > 192.168.43.124.7773: UDP, length 120
20:16:34.184441 IP 192.168.43.124.8880 > 192.168.43.146.7771: UDP, length 120
20:16:34.218334 IP 192.168.43.147.8880 > 192.168.43.124.7773: UDP, length 120
20:16:34.234447 IP 192.168.43.124.8880 > 192.168.43.146.7771: UDP, length 120
20:16:34.245672 IP 192.168.43.147.8880 > 192.168.43.124.7773: UDP, length 120
20:16:34.284451 IP 192.168.43.124.8880 > 192.168.43.146.7771: UDP, length 120
20:16:34.296993 IP 192.168.43.147.8880 > 192.168.43.124.7773: UDP, length 120
20:16:34.334444 IP 192.168.43.124.8880 > 192.168.43.146.7771: UDP, length 120
20:16:34.384450 IP 192.168.43.124.8880 > 192.168.43.146.7771: UDP, length 120
20:16:34.403726 IP 192.168.43.147.8880 > 192.168.43.124.7773: UDP, length 120
20:16:34.403750 IP 192.168.43.147.8880 > 192.168.43.124.7773: UDP, length 120
20:16:34.434454 IP 192.168.43.124.8880 > 192.168.43.146.7771: UDP, length 120
20:16:34.447258 IP 192.168.43.147.8880 > 192.168.43.124.7773: UDP, length 120
20:16:34.484447 IP 192.168.43.124.8880 > 192.168.43.146.7771: UDP, length 120
20:16:34.517453 IP 192.168.43.147.8880 > 192.168.43.124.7773: UDP, length 120
20:16:34.534446 IP 192.168.43.124.8880 > 192.168.43.146.7771: UDP, length 120
20:16:34.560601 IP 192.168.43.147.8880 > 192.168.43.124.7773: UDP, length 120
20:16:34.584434 IP 192.168.43.124.8880 > 192.168.43.146.7771: UDP, length 120
20:16:34.597705 IP 192.168.43.147.8880 > 192.168.43.124.7773: UDP, length 120
20:16:34.634390 IP 192.168.43.124.8880 > 192.168.43.146.7771: UDP, length 120
20:16:34.644239 IP 192.168.43.147.8880 > 192.168.43.124.7773: UDP, length 120
20:16:34.684393 IP 192.168.43.124.8880 > 192.168.43.146.7771: UDP, length 120
20:16:34.697854 IP 192.168.43.147.8880 > 192.168.43.124.7773: UDP, length 120
20:16:34.734392 IP 192.168.43.124.8880 > 192.168.43.146.7771: UDP, length 120
20:16:34.746633 IP 192.168.43.147.8880 > 192.168.43.124.7773: UDP, length 120
20:16:34.784391 IP 192.168.43.124.8880 > 192.168.43.146.7771: UDP, length 120
20:16:34.794209 IP 192.168.43.147.8880 > 192.168.43.124.7773: UDP, length 120
20:16:34.834387 IP 192.168.43.124.8880 > 192.168.43.146.7771: UDP, length 120
20:16:34.844450 IP 192.168.43.147.8880 > 192.168.43.124.7773: UDP, length 120
20:16:34.884393 IP 192.168.43.124.8880 > 192.168.43.146.7771: UDP, length 120
20:16:34.896505 IP 192.168.43.147.8880 > 192.168.43.124.7773: UDP, length 120
20:16:34.934333 IP 192.168.43.124.8880 > 192.168.43.146.7771: UDP, length 120
20:16:34.961746 IP 192.168.43.147.8880 > 192.168.43.124.7773: UDP, length 120
20:16:34.984395 IP 192.168.43.124.8880 > 192.168.43.146.7771: UDP, length 120
20:16:34.995247 IP 192.168.43.147.8880 > 192.168.43.124.7773: UDP, length 120
20:16:35.034391 IP 192.168.43.124.8880 > 192.168.43.146.7771: UDP, length 120
20:16:35.048991 IP 192.168.43.147.8880 > 192.168.43.124.7773: UDP, length 120
20:16:35.084394 IP 192.168.43.124.8880 > 192.168.43.146.7771: UDP, length 120
20:16:35.101582 IP 192.168.43.147.8880 > 192.168.43.124.7773: UDP, length 120
20:16:35.134391 IP 192.168.43.124.8880 > 192.168.43.146.7771: UDP, length 120
20:16:35.145911 IP 192.168.43.147.8880 > 192.168.43.124.7773: UDP, length 120
20:16:35.184395 IP 192.168.43.124.8880 > 192.168.43.146.7771: UDP, length 120
20:16:35.194453 IP 192.168.43.147.8880 > 192.168.43.124.7773: UDP, length 120
20:16:35.234392 IP 192.168.43.124.8880 > 192.168.43.146.7771: UDP, length 120
20:16:35.248344 IP 192.168.43.147.8880 > 192.168.43.124.7773: UDP, length 120
20:16:35.284393 IP 192.168.43.124.8880 > 192.168.43.146.7771: UDP, length 120
20:16:35.294480 IP 192.168.43.147.8880 > 192.168.43.124.7773: UDP, length 120
20:16:35.334443 IP 192.168.43.124.8880 > 192.168.43.146.7771: UDP, length 120
20:16:35.345241 IP 192.168.43.147.8880 > 192.168.43.124.7773: UDP, length 120
20:16:35.384448 IP 192.168.43.124.8880 > 192.168.43.146.7771: UDP, length 120
20:16:35.397017 IP 192.168.43.147.8880 > 192.168.43.124.7773: UDP, length 120
20:16:35.434450 IP 192.168.43.124.8880 > 192.168.43.146.7771: UDP, length 120
20:16:35.466263 IP 192.168.43.147.8880 > 192.168.43.124.7773: UDP, length 120
20:16:35.484422 IP 192.168.43.124.8880 > 192.168.43.146.7771: UDP, length 120
20:16:35.495509 IP 192.168.43.147.8880 > 192.168.43.124.7773: UDP, length 120
20:16:35.534397 IP 192.168.43.124.8880 > 192.168.43.146.7771: UDP, length 120
20:16:35.549345 IP 192.168.43.147.8880 > 192.168.43.124.7773: UDP, length 120
20:16:35.584365 IP 192.168.43.124.8880 > 192.168.43.146.7771: UDP, length 120
20:16:35.625516 IP 192.168.43.147.8880 > 192.168.43.124.7773: UDP, length 120
20:16:35.634395 IP 192.168.43.124.8880 > 192.168.43.146.7771: UDP, length 120
20:16:35.643243 IP 192.168.43.147.8880 > 192.168.43.124.7773: UDP, length 120
20:16:35.684397 IP 192.168.43.124.8880 > 192.168.43.146.7771: UDP, length 120
20:16:35.697399 IP 192.168.43.147.8880 > 192.168.43.124.7773: UDP, length 120
20:16:35.734400 IP 192.168.43.124.8880 > 192.168.43.146.7771: UDP, length 120
20:16:35.766746 IP 192.168.43.147.8880 > 192.168.43.124.7773: UDP, length 120
20:16:35.784398 IP 192.168.43.124.8880 > 192.168.43.146.7771: UDP, length 120
20:16:35.797858 IP 192.168.43.147.8880 > 192.168.43.124.7773: UDP, length 120
20:16:35.834388 IP 192.168.43.124.8880 > 192.168.43.146.7771: UDP, length 120
20:16:35.847558 IP 192.168.43.147.8880 > 192.168.43.124.7773: UDP, length 120
20:16:35.884391 IP 192.168.43.124.8880 > 192.168.43.146.7771: UDP, length 120
20:16:35.896099 IP 192.168.43.147.8880 > 192.168.43.124.7773: UDP, length 120
20:16:35.934400 IP 192.168.43.124.8880 > 192.168.43.146.7771: UDP, length 120
20:16:35.949494 IP 192.168.43.147.8880 > 192.168.43.124.7773: UDP, length 120
20:16:35.984397 IP 192.168.43.124.8880 > 192.168.43.146.7771: UDP, length 120
20:16:35.996141 IP 192.168.43.147.8880 > 192.168.43.124.7773: UDP, length 120
20:16:36.034451 IP 192.168.43.124.8880 > 192.168.43.146.7771: UDP, length 120
20:16:36.046567 IP 192.168.43.147.8880 > 192.168.43.124.7773: UDP, length 120
20:16:36.084445 IP 192.168.43.124.8880 > 192.168.43.146.7771: UDP, length 120
20:16:36.101048 IP 192.168.43.147.8880 > 192.168.43.124.7773: UDP, length 120
20:16:36.134448 IP 192.168.43.124.8880 > 192.168.43.146.7771: UDP, length 120
20:16:36.149040 IP 192.168.43.147.8880 > 192.168.43.124.7773: UDP, length 120
20:16:36.184455 IP 192.168.43.124.8880 > 192.168.43.146.7771: UDP, length 120
20:16:36.201312 IP 192.168.43.147.8880 > 192.168.43.124.7773: UDP, length 120
20:16:36.234450 IP 192.168.43.124.8880 > 192.168.43.146.7771: UDP, length 120
20:16:36.248000 IP 192.168.43.147.8880 > 192.168.43.124.7773: UDP, length 120
20:16:36.284452 IP 192.168.43.124.8880 > 192.168.43.146.7771: UDP, length 120
20:16:36.291973 IP 192.168.43.147.8880 > 192.168.43.124.7773: UDP, length 120
20:16:36.334444 IP 192.168.43.124.8880 > 192.168.43.146.7771: UDP, length 120
20:16:36.347071 IP 192.168.43.147.8880 > 192.168.43.124.7773: UDP, length 120
20:16:36.384448 IP 192.168.43.124.8880 > 192.168.43.146.7771: UDP, length 120
20:16:36.397449 IP 192.168.43.147.8880 > 192.168.43.124.7773: UDP, length 120
20:16:36.434357 IP 192.168.43.124.8880 > 192.168.43.146.7771: UDP, length 120
20:16:36.447337 IP 192.168.43.147.8880 > 192.168.43.124.7773: UDP, length 120
20:16:36.484391 IP 192.168.43.124.8880 > 192.168.43.146.7771: UDP, length 120
20:16:36.496714 IP 192.168.43.147.8880 > 192.168.43.124.7773: UDP, length 120
20:16:36.534395 IP 192.168.43.124.8880 > 192.168.43.146.7771: UDP, length 120
20:16:36.549433 IP 192.168.43.147.8880 > 192.168.43.124.7773: UDP, length 120
20:16:36.584395 IP 192.168.43.124.8880 > 192.168.43.146.7771: UDP, length 120
20:16:36.598573 IP 192.168.43.147.8880 > 192.168.43.124.7773: UDP, length 120
20:16:36.634394 IP 192.168.43.124.8880 > 192.168.43.146.7771: UDP, length 120
20:16:36.648438 IP 192.168.43.147.8880 > 192.168.43.124.7773: UDP, length 120
20:16:36.684396 IP 192.168.43.124.8880 > 192.168.43.146.7771: UDP, length 120
20:16:36.698321 IP 192.168.43.147.8880 > 192.168.43.124.7773: UDP, length 120
20:16:36.734396 IP 192.168.43.124.8880 > 192.168.43.146.7771: UDP, length 120
20:16:36.746625 IP 192.168.43.147.8880 > 192.168.43.124.7773: UDP, length 120
20:16:36.784394 IP 192.168.43.124.8880 > 192.168.43.146.7771: UDP, length 120
20:16:36.796499 IP 192.168.43.147.8880 > 192.168.43.124.7773: UDP, length 120
20:16:36.834397 IP 192.168.43.124.8880 > 192.168.43.146.7771: UDP, length 120
20:16:36.848129 IP 192.168.43.147.8880 > 192.168.43.124.7773: UDP, length 120
20:16:36.884392 IP 192.168.43.124.8880 > 192.168.43.146.7771: UDP, length 120
20:16:36.922365 IP 192.168.43.147.8880 > 192.168.43.124.7773: UDP, length 120
20:16:36.934392 IP 192.168.43.124.8880 > 192.168.43.146.7771: UDP, length 120
20:16:36.946617 IP 192.168.43.147.8880 > 192.168.43.124.7773: UDP, length 120
20:16:36.984394 IP 192.168.43.124.8880 > 192.168.43.146.7771: UDP, length 120
20:16:36.996536 IP 192.168.43.147.8880 > 192.168.43.124.7773: UDP, length 120
20:16:37.034390 IP 192.168.43.124.8880 > 192.168.43.146.7771: UDP, length 120
20:16:37.047722 IP 192.168.43.147.8880 > 192.168.43.124.7773: UDP, length 120
20:16:37.084396 IP 192.168.43.124.8880 > 192.168.43.146.7771: UDP, length 120
20:16:37.098747 IP 192.168.43.147.8880 > 192.168.43.124.7773: UDP, length 120
20:16:37.134395 IP 192.168.43.124.8880 > 192.168.43.146.7771: UDP, length 120
20:16:37.147800 IP 192.168.43.147.8880 > 192.168.43.124.7773: UDP, length 120
20:16:37.184390 IP 192.168.43.124.8880 > 192.168.43.146.7771: UDP, length 120
20:16:37.199720 IP 192.168.43.147.8880 > 192.168.43.124.7773: UDP, length 120
20:16:37.234391 IP 192.168.43.124.8880 > 192.168.43.146.7771: UDP, length 120
20:16:37.247846 IP 192.168.43.147.8880 > 192.168.43.124.7773: UDP, length 120
20:16:37.284392 IP 192.168.43.124.8880 > 192.168.43.146.7771: UDP, length 120
20:16:37.306512 IP 192.168.43.147.8880 > 192.168.43.124.7773: UDP, length 120
20:16:37.334387 IP 192.168.43.124.8880 > 192.168.43.146.7771: UDP, length 120
20:16:37.350520 IP 192.168.43.147.8880 > 192.168.43.124.7773: UDP, length 120
20:16:37.384393 IP 192.168.43.124.8880 > 192.168.43.146.7771: UDP, length 120
20:16:37.398893 IP 192.168.43.147.8880 > 192.168.43.124.7773: UDP, length 120
20:16:37.434393 IP 192.168.43.124.8880 > 192.168.43.146.7771: UDP, length 120
20:16:37.449601 IP 192.168.43.147.8880 > 192.168.43.124.7773: UDP, length 120
20:16:37.484346 IP 192.168.43.124.8880 > 192.168.43.146.7771: UDP, length 120
20:16:37.495886 IP 192.168.43.147.8880 > 192.168.43.124.7773: UDP, length 120
20:16:37.534326 IP 192.168.43.124.8880 > 192.168.43.146.7771: UDP, length 120
20:16:37.547128 IP 192.168.43.147.8880 > 192.168.43.124.7773: UDP, length 120
20:16:37.584393 IP 192.168.43.124.8880 > 192.168.43.146.7771: UDP, length 120
20:16:37.598006 IP 192.168.43.147.8880 > 192.168.43.124.7773: UDP, length 120
20:16:37.634353 IP 192.168.43.124.8880 > 192.168.43.146.7771: UDP, length 120
20:16:37.648254 IP 192.168.43.147.8880 > 192.168.43.124.7773: UDP, length 120
20:16:37.684392 IP 192.168.43.124.8880 > 192.168.43.146.7771: UDP, length 120
20:16:37.697639 IP 192.168.43.147.8880 > 192.168.43.124.7773: UDP, length 120
20:16:37.734394 IP 192.168.43.124.8880 > 192.168.43.146.7771: UDP, length 120
20:16:37.746374 IP 192.168.43.147.8880 > 192.168.43.124.7773: UDP, length 120
20:16:37.784393 IP 192.168.43.124.8880 > 192.168.43.146.7771: UDP, length 120
20:16:37.796814 IP 192.168.43.147.8880 > 192.168.43.124.7773: UDP, length 120
20:16:37.834315 IP 192.168.43.124.8880 > 192.168.43.146.7771: UDP, length 120
20:16:37.846292 IP 192.168.43.147.8880 > 192.168.43.124.7773: UDP, length 120
20:16:37.884336 IP 192.168.43.124.8880 > 192.168.43.146.7771: UDP, length 120
20:16:37.895619 IP 192.168.43.147.8880 > 192.168.43.124.7773: UDP, length 120
20:16:37.934394 IP 192.168.43.124.8880 > 192.168.43.146.7771: UDP, length 120
20:16:37.945111 IP 192.168.43.147.8880 > 192.168.43.124.7773: UDP, length 120
20:16:37.984392 IP 192.168.43.124.8880 > 192.168.43.146.7771: UDP, length 120
20:16:37.997637 IP 192.168.43.147.8880 > 192.168.43.124.7773: UDP, length 120
20:16:38.034391 IP 192.168.43.124.8880 > 192.168.43.146.7771: UDP, length 120
20:16:38.046692 IP 192.168.43.147.8880 > 192.168.43.124.7773: UDP, length 120
20:16:38.084392 IP 192.168.43.124.8880 > 192.168.43.146.7771: UDP, length 120
20:16:38.095613 IP 192.168.43.147.8880 > 192.168.43.124.7773: UDP, length 120
20:16:38.134337 IP 192.168.43.124.8880 > 192.168.43.146.7771: UDP, length 120
20:16:38.148840 IP 192.168.43.147.8880 > 192.168.43.124.7773: UDP, length 120
20:16:38.184393 IP 192.168.43.124.8880 > 192.168.43.146.7771: UDP, length 120
20:16:38.234339 IP 192.168.43.124.8880 > 192.168.43.146.7771: UDP, length 120
20:16:38.234405 IP 192.168.43.147.8880 > 192.168.43.124.7773: UDP, length 120
20:16:38.248289 IP 192.168.43.147.8880 > 192.168.43.124.7773: UDP, length 120
20:16:38.284391 IP 192.168.43.124.8880 > 192.168.43.146.7771: UDP, length 120
20:16:38.297209 IP 192.168.43.147.8880 > 192.168.43.124.7773: UDP, length 120
20:16:38.334340 IP 192.168.43.124.8880 > 192.168.43.146.7771: UDP, length 120
20:16:38.353601 IP 192.168.43.147.8880 > 192.168.43.124.7773: UDP, length 120
20:16:38.384354 IP 192.168.43.124.8880 > 192.168.43.146.7771: UDP, length 120
20:16:38.397616 IP 192.168.43.147.8880 > 192.168.43.124.7773: UDP, length 120
20:16:38.434308 IP 192.168.43.124.8880 > 192.168.43.146.7771: UDP, length 120
20:16:38.448003 IP 192.168.43.147.8880 > 192.168.43.124.7773: UDP, length 120
20:16:38.484324 IP 192.168.43.124.8880 > 192.168.43.146.7771: UDP, length 120
20:16:38.495982 IP 192.168.43.147.8880 > 192.168.43.124.7773: UDP, length 120
20:16:38.534406 IP 192.168.43.124.8880 > 192.168.43.146.7771: UDP, length 120
20:16:38.546874 IP 192.168.43.147.8880 > 192.168.43.124.7773: UDP, length 120
20:16:38.585128 IP 192.168.43.124.8880 > 192.168.43.146.7771: UDP, length 120
20:16:38.594789 IP 192.168.43.147.8880 > 192.168.43.124.7773: UDP, length 120
20:16:38.634353 IP 192.168.43.124.8880 > 192.168.43.146.7771: UDP, length 120
20:16:38.647370 IP 192.168.43.147.8880 > 192.168.43.124.7773: UDP, length 120
20:16:38.684383 IP 192.168.43.124.8880 > 192.168.43.146.7771: UDP, length 120
20:16:38.716269 IP 192.168.43.147.8880 > 192.168.43.124.7773: UDP, length 120
20:16:38.734396 IP 192.168.43.124.8880 > 192.168.43.146.7771: UDP, length 120
20:16:38.747093 IP 192.168.43.147.8880 > 192.168.43.124.7773: UDP, length 120
20:16:38.784392 IP 192.168.43.124.8880 > 192.168.43.146.7771: UDP, length 120
20:16:38.804053 IP 192.168.43.147.8880 > 192.168.43.124.7773: UDP, length 120
20:16:38.834393 IP 192.168.43.124.8880 > 192.168.43.146.7771: UDP, length 120
20:16:38.845093 IP 192.168.43.147.8880 > 192.168.43.124.7773: UDP, length 120
20:16:38.884390 IP 192.168.43.124.8880 > 192.168.43.146.7771: UDP, length 120
20:16:38.897404 IP 192.168.43.147.8880 > 192.168.43.124.7773: UDP, length 120
20:16:38.934394 IP 192.168.43.124.8880 > 192.168.43.146.7771: UDP, length 120
20:16:38.968401 IP 192.168.43.147.8880 > 192.168.43.124.7773: UDP, length 120
20:16:38.984393 IP 192.168.43.124.8880 > 192.168.43.146.7771: UDP, length 120
20:16:38.995247 IP 192.168.43.147.8880 > 192.168.43.124.7773: UDP, length 120
20:16:39.034397 IP 192.168.43.124.8880 > 192.168.43.146.7771: UDP, length 120
20:16:39.047684 IP 192.168.43.147.8880 > 192.168.43.124.7773: UDP, length 120
20:16:39.084394 IP 192.168.43.124.8880 > 192.168.43.146.7771: UDP, length 120
20:16:39.095270 IP 192.168.43.147.8880 > 192.168.43.124.7773: UDP, length 120
20:16:39.134444 IP 192.168.43.124.8880 > 192.168.43.146.7771: UDP, length 120
20:16:39.144312 IP 192.168.43.147.8880 > 192.168.43.124.7773: UDP, length 120
20:16:39.184451 IP 192.168.43.124.8880 > 192.168.43.146.7771: UDP, length 120
20:16:39.197204 IP 192.168.43.147.8880 > 192.168.43.124.7773: UDP, length 120
20:16:39.234450 IP 192.168.43.124.8880 > 192.168.43.146.7771: UDP, length 120
20:16:39.270333 IP 192.168.43.147.8880 > 192.168.43.124.7773: UDP, length 120
20:16:39.284443 IP 192.168.43.124.8880 > 192.168.43.146.7771: UDP, length 120
20:16:39.297556 IP 192.168.43.147.8880 > 192.168.43.124.7773: UDP, length 120
20:16:39.334449 IP 192.168.43.124.8880 > 192.168.43.146.7771: UDP, length 120
20:16:39.351134 IP 192.168.43.147.8880 > 192.168.43.124.7773: UDP, length 120
20:16:39.384448 IP 192.168.43.124.8880 > 192.168.43.146.7771: UDP, length 120
20:16:39.417461 IP 192.168.43.147.8880 > 192.168.43.124.7773: UDP, length 120
20:16:39.434448 IP 192.168.43.124.8880 > 192.168.43.146.7771: UDP, length 120
20:16:39.449442 IP 192.168.43.147.8880 > 192.168.43.124.7773: UDP, length 120
20:16:39.484449 IP 192.168.43.124.8880 > 192.168.43.146.7771: UDP, length 120
20:16:39.498702 IP 192.168.43.147.8880 > 192.168.43.124.7773: UDP, length 120
20:16:39.534449 IP 192.168.43.124.8880 > 192.168.43.146.7771: UDP, length 120
20:16:39.544411 IP 192.168.43.147.8880 > 192.168.43.124.7773: UDP, length 120
20:16:39.584449 IP 192.168.43.124.8880 > 192.168.43.146.7771: UDP, length 120
20:16:39.594525 IP 192.168.43.147.8880 > 192.168.43.124.7773: UDP, length 120
20:16:39.634392 IP 192.168.43.124.8880 > 192.168.43.146.7771: UDP, length 120
20:16:39.657257 IP 192.168.43.147.8880 > 192.168.43.124.7773: UDP, length 120
20:16:39.684392 IP 192.168.43.124.8880 > 192.168.43.146.7771: UDP, length 120
20:16:39.694196 IP 192.168.43.147.8880 > 192.168.43.124.7773: UDP, length 120
20:16:39.734393 IP 192.168.43.124.8880 > 192.168.43.146.7771: UDP, length 120
20:16:39.743309 IP 192.168.43.147.8880 > 192.168.43.124.7773: UDP, length 120
20:16:39.784444 IP 192.168.43.124.8880 > 192.168.43.146.7771: UDP, length 120
20:16:39.797165 IP 192.168.43.147.8880 > 192.168.43.124.7773: UDP, length 120
20:16:39.834443 IP 192.168.43.124.8880 > 192.168.43.146.7771: UDP, length 120
20:16:39.866788 IP 192.168.43.147.8880 > 192.168.43.124.7773: UDP, length 120
20:16:39.884332 IP 192.168.43.124.8880 > 192.168.43.146.7771: UDP, length 120
20:16:39.904609 IP 192.168.43.147.8880 > 192.168.43.124.7773: UDP, length 120
20:16:39.934395 IP 192.168.43.124.8880 > 192.168.43.146.7771: UDP, length 120
20:16:39.942190 IP 192.168.43.147.8880 > 192.168.43.124.7773: UDP, length 120
20:16:39.984392 IP 192.168.43.124.8880 > 192.168.43.146.7771: UDP, length 120
20:16:40.006407 IP 192.168.43.147.8880 > 192.168.43.124.7773: UDP, length 120
20:16:40.034391 IP 192.168.43.124.8880 > 192.168.43.146.7771: UDP, length 120
20:16:40.046488 IP 192.168.43.147.8880 > 192.168.43.124.7773: UDP, length 120
20:16:40.084370 IP 192.168.43.124.8880 > 192.168.43.146.7771: UDP, length 120
20:16:40.094141 IP 192.168.43.147.8880 > 192.168.43.124.7773: UDP, length 120
20:16:40.134395 IP 192.168.43.124.8880 > 192.168.43.146.7771: UDP, length 120
20:16:40.149206 IP 192.168.43.147.8880 > 192.168.43.124.7773: UDP, length 120
20:16:40.184393 IP 192.168.43.124.8880 > 192.168.43.146.7771: UDP, length 120
20:16:40.217712 IP 192.168.43.147.8880 > 192.168.43.124.7773: UDP, length 120
20:16:40.234369 IP 192.168.43.124.8880 > 192.168.43.146.7771: UDP, length 120
20:16:40.244797 IP 192.168.43.147.8880 > 192.168.43.124.7773: UDP, length 120
20:16:40.284385 IP 192.168.43.124.8880 > 192.168.43.146.7771: UDP, length 120
20:16:40.296385 IP 192.168.43.147.8880 > 192.168.43.124.7773: UDP, length 120
20:16:40.334332 IP 192.168.43.124.8880 > 192.168.43.146.7771: UDP, length 120
20:16:40.356705 IP 192.168.43.147.8880 > 192.168.43.124.7773: UDP, length 120
20:16:40.384392 IP 192.168.43.124.8880 > 192.168.43.146.7771: UDP, length 120
20:16:40.397264 IP 192.168.43.147.8880 > 192.168.43.124.7773: UDP, length 120
20:16:40.434394 IP 192.168.43.124.8880 > 192.168.43.146.7771: UDP, length 120
20:16:40.445588 IP 192.168.43.147.8880 > 192.168.43.124.7773: UDP, length 120
20:16:40.484392 IP 192.168.43.124.8880 > 192.168.43.146.7771: UDP, length 120
20:16:40.503615 IP 192.168.43.147.8880 > 192.168.43.124.7773: UDP, length 120
20:16:40.534393 IP 192.168.43.124.8880 > 192.168.43.146.7771: UDP, length 120
20:16:40.542455 IP 192.168.43.147.8880 > 192.168.43.124.7773: UDP, length 120
20:16:40.584393 IP 192.168.43.124.8880 > 192.168.43.146.7771: UDP, length 120
20:16:40.599249 IP 192.168.43.147.8880 > 192.168.43.124.7773: UDP, length 120
20:16:40.634386 IP 192.168.43.124.8880 > 192.168.43.146.7771: UDP, length 120
20:16:40.652163 IP 192.168.43.147.8880 > 192.168.43.124.7773: UDP, length 120
20:16:40.684395 IP 192.168.43.124.8880 > 192.168.43.146.7771: UDP, length 120
20:16:40.718663 IP 192.168.43.147.8880 > 192.168.43.124.7773: UDP, length 120
20:16:40.734331 IP 192.168.43.124.8880 > 192.168.43.146.7771: UDP, length 120
20:16:40.763329 IP 192.168.43.147.8880 > 192.168.43.124.7773: UDP, length 120
20:16:40.784391 IP 192.168.43.124.8880 > 192.168.43.146.7771: UDP, length 120
20:16:40.796644 IP 192.168.43.147.8880 > 192.168.43.124.7773: UDP, length 120
20:16:40.834352 IP 192.168.43.124.8880 > 192.168.43.146.7771: UDP, length 120
20:16:40.866154 IP 192.168.43.147.8880 > 192.168.43.124.7773: UDP, length 120
20:16:40.884334 IP 192.168.43.124.8880 > 192.168.43.146.7771: UDP, length 120
20:16:40.897532 IP 192.168.43.147.8880 > 192.168.43.124.7773: UDP, length 120
20:16:40.934323 IP 192.168.43.124.8880 > 192.168.43.146.7771: UDP, length 120
20:16:40.942304 IP 192.168.43.147.8880 > 192.168.43.124.7773: UDP, length 120
20:16:40.984326 IP 192.168.43.124.8880 > 192.168.43.146.7771: UDP, length 120
20:16:41.006141 IP 192.168.43.147.8880 > 192.168.43.124.7773: UDP, length 120
20:16:41.034337 IP 192.168.43.124.8880 > 192.168.43.146.7771: UDP, length 120
20:16:41.047104 IP 192.168.43.147.8880 > 192.168.43.124.7773: UDP, length 120
20:16:41.084323 IP 192.168.43.124.8880 > 192.168.43.146.7771: UDP, length 120
20:16:41.093381 IP 192.168.43.147.8880 > 192.168.43.124.7773: UDP, length 120
20:16:41.134394 IP 192.168.43.124.8880 > 192.168.43.146.7771: UDP, length 120
20:16:41.146463 IP 192.168.43.147.8880 > 192.168.43.124.7773: UDP, length 120
20:16:41.184392 IP 192.168.43.124.8880 > 192.168.43.146.7771: UDP, length 120
20:16:41.216303 IP 192.168.43.147.8880 > 192.168.43.124.7773: UDP, length 120
20:16:41.234405 IP 192.168.43.124.8880 > 192.168.43.146.7771: UDP, length 120
20:16:41.246609 IP 192.168.43.147.8880 > 192.168.43.124.7773: UDP, length 120
20:16:41.284442 IP 192.168.43.124.8880 > 192.168.43.146.7771: UDP, length 120
20:16:41.296407 IP 192.168.43.147.8880 > 192.168.43.124.7773: UDP, length 120
20:16:41.334396 IP 192.168.43.124.8880 > 192.168.43.146.7771: UDP, length 120
20:16:41.356022 IP 192.168.43.147.8880 > 192.168.43.124.7773: UDP, length 120
20:16:41.384399 IP 192.168.43.124.8880 > 192.168.43.146.7771: UDP, length 120
20:16:41.398712 IP 192.168.43.147.8880 > 192.168.43.124.7773: UDP, length 120
20:16:41.434400 IP 192.168.43.124.8880 > 192.168.43.146.7771: UDP, length 120
20:16:41.447855 IP 192.168.43.147.8880 > 192.168.43.124.7773: UDP, length 120
