00:06:35.962908 IP 192.168.43.146.8880 > 192.168.43.147.7772: UDP, length 120
00:06:36.031859 IP 192.168.43.146.8880 > 192.168.43.147.7772: UDP, length 120
00:06:36.063946 IP 192.168.43.146.8880 > 192.168.43.147.7772: UDP, length 120
00:06:36.082637 IP 192.168.43.147.8880 > 192.168.43.124.7773: UDP, length 120
00:06:36.107083 IP 192.168.43.146.8880 > 192.168.43.147.7772: UDP, length 120
00:06:36.132656 IP 192.168.43.147.8880 > 192.168.43.124.7773: UDP, length 120
00:06:36.174431 IP 192.168.43.146.8880 > 192.168.43.147.7772: UDP, length 120
00:06:36.182645 IP 192.168.43.147.8880 > 192.168.43.124.7773: UDP, length 120
00:06:36.208098 IP 192.168.43.146.8880 > 192.168.43.147.7772: UDP, length 120
00:06:36.232641 IP 192.168.43.147.8880 > 192.168.43.124.7773: UDP, length 120
00:06:36.262917 IP 192.168.43.146.8880 > 192.168.43.147.7772: UDP, length 120
00:06:36.282651 IP 192.168.43.147.8880 > 192.168.43.124.7773: UDP, length 120
00:06:36.328439 IP 192.168.43.146.8880 > 192.168.43.147.7772: UDP, length 120
00:06:36.332639 IP 192.168.43.147.8880 > 192.168.43.124.7773: UDP, length 120
00:06:36.358075 IP 192.168.43.146.8880 > 192.168.43.147.7772: UDP, length 120
00:06:36.382639 IP 192.168.43.147.8880 > 192.168.43.124.7773: UDP, length 120
00:06:36.410221 IP 192.168.43.146.8880 > 192.168.43.147.7772: UDP, length 120
00:06:36.432641 IP 192.168.43.147.8880 > 192.168.43.124.7773: UDP, length 120
00:06:36.476846 IP 192.168.43.146.8880 > 192.168.43.147.7772: UDP, length 120
00:06:36.482640 IP 192.168.43.147.8880 > 192.168.43.124.7773: UDP, length 120
00:06:36.508031 IP 192.168.43.146.8880 > 192.168.43.147.7772: UDP, length 120
00:06:36.532647 IP 192.168.43.147.8880 > 192.168.43.124.7773: UDP, length 120
00:06:36.557897 IP 192.168.43.146.8880 > 192.168.43.147.7772: UDP, length 120
00:06:36.582656 IP 192.168.43.147.8880 > 192.168.43.124.7773: UDP, length 120
00:06:36.621560 IP 192.168.43.146.8880 > 192.168.43.147.7772: UDP, length 120
00:06:36.632657 IP 192.168.43.147.8880 > 192.168.43.124.7773: UDP, length 120
00:06:36.658766 IP 192.168.43.146.8880 > 192.168.43.147.7772: UDP, length 120
00:06:36.682647 IP 192.168.43.147.8880 > 192.168.43.124.7773: UDP, length 120
00:06:36.710424 IP 192.168.43.146.8880 > 192.168.43.147.7772: UDP, length 120
00:06:36.732642 IP 192.168.43.147.8880 > 192.168.43.124.7773: UDP, length 120
00:06:36.770001 IP 192.168.43.146.8880 > 192.168.43.147.7772: UDP, length 120
00:06:36.782640 IP 192.168.43.147.8880 > 192.168.43.124.7773: UDP, length 120
00:06:36.808766 IP 192.168.43.146.8880 > 192.168.43.147.7772: UDP, length 120
00:06:36.832641 IP 192.168.43.147.8880 > 192.168.43.124.7773: UDP, length 120
00:06:36.866930 IP 192.168.43.146.8880 > 192.168.43.147.7772: UDP, length 120
00:06:36.882651 IP 192.168.43.147.8880 > 192.168.43.124.7773: UDP, length 120
00:06:36.921896 IP 192.168.43.146.8880 > 192.168.43.147.7772: UDP, length 120
00:06:36.932650 IP 192.168.43.147.8880 > 192.168.43.124.7773: UDP, length 120
00:06:36.959365 IP 192.168.43.146.8880 > 192.168.43.147.7772: UDP, length 120
00:06:36.982640 IP 192.168.43.147.8880 > 192.168.43.124.7773: UDP, length 120
00:06:37.011348 IP 192.168.43.146.8880 > 192.168.43.147.7772: UDP, length 120
00:06:37.032655 IP 192.168.43.147.8880 > 192.168.43.124.7773: UDP, length 120
00:06:37.082646 IP 192.168.43.147.8880 > 192.168.43.124.7773: UDP, length 120
00:06:37.083638 IP 192.168.43.146.8880 > 192.168.43.147.7772: UDP, length 120
00:06:37.112263 IP 192.168.43.146.8880 > 192.168.43.147.7772: UDP, length 120
00:06:37.132656 IP 192.168.43.147.8880 > 192.168.43.124.7773: UDP, length 120
00:06:37.161532 IP 192.168.43.146.8880 > 192.168.43.147.7772: UDP, length 120
00:06:37.182684 IP 192.168.43.147.8880 > 192.168.43.124.7773: UDP, length 120
00:06:37.223904 IP 192.168.43.146.8880 > 192.168.43.147.7772: UDP, length 120
00:06:37.232652 IP 192.168.43.147.8880 > 192.168.43.124.7773: UDP, length 120
00:06:37.282638 IP 192.168.43.147.8880 > 192.168.43.124.7773: UDP, length 120
00:06:37.290950 IP 192.168.43.146.8880 > 192.168.43.147.7772: UDP, length 120
00:06:37.307031 IP 192.168.43.146.8880 > 192.168.43.147.7772: UDP, length 120
00:06:37.332641 IP 192.168.43.147.8880 > 192.168.43.124.7773: UDP, length 120
00:06:37.372763 IP 192.168.43.146.8880 > 192.168.43.147.7772: UDP, length 120
00:06:37.382639 IP 192.168.43.147.8880 > 192.168.43.124.7773: UDP, length 120
00:06:37.408089 IP 192.168.43.146.8880 > 192.168.43.147.7772: UDP, length 120
00:06:37.432671 IP 192.168.43.147.8880 > 192.168.43.124.7773: UDP, length 120
00:06:37.458743 IP 192.168.43.146.8880 > 192.168.43.147.7772: UDP, length 120
00:06:37.482655 IP 192.168.43.147.8880 > 192.168.43.124.7773: UDP, length 120
00:06:37.520282 IP 192.168.43.146.8880 > 192.168.43.147.7772: UDP, length 120
00:06:37.532645 IP 192.168.43.147.8880 > 192.168.43.124.7773: UDP, length 120
00:06:37.558963 IP 192.168.43.146.8880 > 192.168.43.147.7772: UDP, length 120
00:06:37.582643 IP 192.168.43.147.8880 > 192.168.43.124.7773: UDP, length 120
00:06:37.611210 IP 192.168.43.146.8880 > 192.168.43.147.7772: UDP, length 120
00:06:37.632665 IP 192.168.43.147.8880 > 192.168.43.124.7773: UDP, length 120
00:06:37.680253 IP 192.168.43.146.8880 > 192.168.43.147.7772: UDP, length 120
00:06:37.682639 IP 192.168.43.147.8880 > 192.168.43.124.7773: UDP, length 120
00:06:37.716115 IP 192.168.43.146.8880 > 192.168.43.147.7772: UDP, length 120
00:06:37.732642 IP 192.168.43.147.8880 > 192.168.43.124.7773: UDP, length 120
00:06:37.762139 IP 192.168.43.146.8880 > 192.168.43.147.7772: UDP, length 120
00:06:37.782641 IP 192.168.43.147.8880 > 192.168.43.124.7773: UDP, length 120
00:06:37.832639 IP 192.168.43.147.8880 > 192.168.43.124.7773: UDP, length 120
00:06:37.857767 IP 192.168.43.146.8880 > 192.168.43.147.7772: UDP, length 120
00:06:37.862724 IP 192.168.43.146.8880 > 192.168.43.147.7772: UDP, length 120
00:06:37.882639 IP 192.168.43.147.8880 > 192.168.43.124.7773: UDP, length 120
00:06:37.908440 IP 192.168.43.146.8880 > 192.168.43.147.7772: UDP, length 120
00:06:37.932646 IP 192.168.43.147.8880 > 192.168.43.124.7773: UDP, length 120
00:06:37.972202 IP 192.168.43.146.8880 > 192.168.43.147.7772: UDP, length 120
00:06:37.982639 IP 192.168.43.147.8880 > 192.168.43.124.7773: UDP, length 120
00:06:38.032662 IP 192.168.43.147.8880 > 192.168.43.124.7773: UDP, length 120
00:06:38.037994 IP 192.168.43.146.8880 > 192.168.43.147.7772: UDP, length 120
00:06:38.068111 IP 192.168.43.146.8880 > 192.168.43.147.7772: UDP, length 120
00:06:38.082650 IP 192.168.43.147.8880 > 192.168.43.124.7773: UDP, length 120
00:06:38.127350 IP 192.168.43.146.8880 > 192.168.43.147.7772: UDP, length 120
00:06:38.132653 IP 192.168.43.147.8880 > 192.168.43.124.7773: UDP, length 120
00:06:38.182640 IP 192.168.43.147.8880 > 192.168.43.124.7773: UDP, length 120
00:06:38.189946 IP 192.168.43.146.8880 > 192.168.43.147.7772: UDP, length 120
00:06:38.218963 IP 192.168.43.146.8880 > 192.168.43.147.7772: UDP, length 120
00:06:38.232650 IP 192.168.43.147.8880 > 192.168.43.124.7773: UDP, length 120
00:06:38.282640 IP 192.168.43.147.8880 > 192.168.43.124.7773: UDP, length 120
00:06:38.289812 IP 192.168.43.146.8880 > 192.168.43.147.7772: UDP, length 120
00:06:38.321786 IP 192.168.43.146.8880 > 192.168.43.147.7772: UDP, length 120
00:06:38.332638 IP 192.168.43.147.8880 > 192.168.43.124.7773: UDP, length 120
00:06:38.367990 IP 192.168.43.146.8880 > 192.168.43.147.7772: UDP, length 120
00:06:38.382636 IP 192.168.43.147.8880 > 192.168.43.124.7773: UDP, length 120
00:06:38.432652 IP 192.168.43.147.8880 > 192.168.43.124.7773: UDP, length 120
00:06:38.434262 IP 192.168.43.146.8880 > 192.168.43.147.7772: UDP, length 120
00:06:38.470559 IP 192.168.43.146.8880 > 192.168.43.147.7772: UDP, length 120
00:06:38.482651 IP 192.168.43.147.8880 > 192.168.43.124.7773: UDP, length 120
00:06:38.525300 IP 192.168.43.146.8880 > 192.168.43.147.7772: UDP, length 120
00:06:38.532644 IP 192.168.43.147.8880 > 192.168.43.124.7773: UDP, length 120
00:06:38.582641 IP 192.168.43.147.8880 > 192.168.43.124.7773: UDP, length 120
00:06:38.588897 IP 192.168.43.146.8880 > 192.168.43.147.7772: UDP, length 120
00:06:38.629354 IP 192.168.43.146.8880 > 192.168.43.147.7772: UDP, length 120
00:06:38.632653 IP 192.168.43.147.8880 > 192.168.43.124.7773: UDP, length 120
00:06:38.679359 IP 192.168.43.146.8880 > 192.168.43.147.7772: UDP, length 120
00:06:38.682682 IP 192.168.43.147.8880 > 192.168.43.124.7773: UDP, length 120
00:06:38.732642 IP 192.168.43.147.8880 > 192.168.43.124.7773: UDP, length 120
00:06:38.751844 IP 192.168.43.146.8880 > 192.168.43.147.7772: UDP, length 120
00:06:38.779387 IP 192.168.43.146.8880 > 192.168.43.147.7772: UDP, length 120
00:06:38.782639 IP 192.168.43.147.8880 > 192.168.43.124.7773: UDP, length 120
00:06:38.832639 IP 192.168.43.147.8880 > 192.168.43.124.7773: UDP, length 120
00:06:38.840557 IP 192.168.43.146.8880 > 192.168.43.147.7772: UDP, length 120
00:06:38.880898 IP 192.168.43.146.8880 > 192.168.43.147.7772: UDP, length 120
00:06:38.882638 IP 192.168.43.147.8880 > 192.168.43.124.7773: UDP, length 120
00:06:38.932641 IP 192.168.43.147.8880 > 192.168.43.124.7773: UDP, length 120
00:06:38.936076 IP 192.168.43.146.8880 > 192.168.43.147.7772: UDP, length 120
00:06:38.982640 IP 192.168.43.147.8880 > 192.168.43.124.7773: UDP, length 120
00:06:38.991070 IP 192.168.43.146.8880 > 192.168.43.147.7772: UDP, length 120
00:06:39.032660 IP 192.168.43.147.8880 > 192.168.43.124.7773: UDP, length 120
00:06:39.082644 IP 192.168.43.147.8880 > 192.168.43.124.7773: UDP, length 120
00:06:39.092191 IP 192.168.43.146.8880 > 192.168.43.147.7772: UDP, length 120
00:06:39.092843 IP 192.168.43.146.8880 > 192.168.43.147.7772: UDP, length 120
00:06:39.132641 IP 192.168.43.147.8880 > 192.168.43.124.7773: UDP, length 120
00:06:39.144822 IP 192.168.43.146.8880 > 192.168.43.147.7772: UDP, length 120
00:06:39.182642 IP 192.168.43.147.8880 > 192.168.43.124.7773: UDP, length 120
00:06:39.227936 IP 192.168.43.146.8880 > 192.168.43.147.7772: UDP, length 120
00:06:39.228049 IP 192.168.43.146.8880 > 192.168.43.147.7772: UDP, length 120
00:06:39.232637 IP 192.168.43.147.8880 > 192.168.43.124.7773: UDP, length 120
00:06:39.282640 IP 192.168.43.147.8880 > 192.168.43.124.7773: UDP, length 120
00:06:39.305434 IP 192.168.43.146.8880 > 192.168.43.147.7772: UDP, length 120
00:06:39.311273 IP 192.168.43.146.8880 > 192.168.43.147.7772: UDP, length 120
00:06:39.332640 IP 192.168.43.147.8880 > 192.168.43.124.7773: UDP, length 120
00:06:39.382639 IP 192.168.43.147.8880 > 192.168.43.124.7773: UDP, length 120
00:06:39.401265 IP 192.168.43.146.8880 > 192.168.43.147.7772: UDP, length 120
00:06:39.432640 IP 192.168.43.147.8880 > 192.168.43.124.7773: UDP, length 120
00:06:39.446433 IP 192.168.43.146.8880 > 192.168.43.147.7772: UDP, length 120
00:06:39.482636 IP 192.168.43.147.8880 > 192.168.43.124.7773: UDP, length 120
00:06:39.492129 IP 192.168.43.146.8880 > 192.168.43.147.7772: UDP, length 120
00:06:39.521154 IP 192.168.43.146.8880 > 192.168.43.147.7772: UDP, length 120
00:06:39.532644 IP 192.168.43.147.8880 > 192.168.43.124.7773: UDP, length 120
00:06:39.582641 IP 192.168.43.147.8880 > 192.168.43.124.7773: UDP, length 120
00:06:39.596047 IP 192.168.43.146.8880 > 192.168.43.147.7772: UDP, length 120
00:06:39.604725 IP 192.168.43.146.8880 > 192.168.43.147.7772: UDP, length 120
00:06:39.632640 IP 192.168.43.147.8880 > 192.168.43.124.7773: UDP, length 120
00:06:39.682646 IP 192.168.43.147.8880 > 192.168.43.124.7773: UDP, length 120
00:06:39.723598 IP 192.168.43.146.8880 > 192.168.43.147.7772: UDP, length 120
00:06:39.723720 IP 192.168.43.146.8880 > 192.168.43.147.7772: UDP, length 120
00:06:39.732649 IP 192.168.43.147.8880 > 192.168.43.124.7773: UDP, length 120
00:06:39.782647 IP 192.168.43.147.8880 > 192.168.43.124.7773: UDP, length 120
00:06:39.791640 IP 192.168.43.146.8880 > 192.168.43.147.7772: UDP, length 120
00:06:39.810651 IP 192.168.43.146.8880 > 192.168.43.147.7772: UDP, length 120
00:06:39.832644 IP 192.168.43.147.8880 > 192.168.43.124.7773: UDP, length 120
00:06:39.867485 IP 192.168.43.146.8880 > 192.168.43.147.7772: UDP, length 120
00:06:39.882641 IP 192.168.43.147.8880 > 192.168.43.124.7773: UDP, length 120
00:06:39.912778 IP 192.168.43.146.8880 > 192.168.43.147.7772: UDP, length 120
00:06:39.932652 IP 192.168.43.147.8880 > 192.168.43.124.7773: UDP, length 120
00:06:39.982648 IP 192.168.43.147.8880 > 192.168.43.124.7773: UDP, length 120
00:06:39.993865 IP 192.168.43.146.8880 > 192.168.43.147.7772: UDP, length 120
00:06:40.020838 IP 192.168.43.146.8880 > 192.168.43.147.7772: UDP, length 120
00:06:40.032667 IP 192.168.43.147.8880 > 192.168.43.124.7773: UDP, length 120
00:06:40.082646 IP 192.168.43.147.8880 > 192.168.43.124.7773: UDP, length 120
00:06:40.122454 IP 192.168.43.146.8880 > 192.168.43.147.7772: UDP, length 120
00:06:40.122582 IP 192.168.43.146.8880 > 192.168.43.147.7772: UDP, length 120
00:06:40.132641 IP 192.168.43.147.8880 > 192.168.43.124.7773: UDP, length 120
00:06:40.172298 IP 192.168.43.146.8880 > 192.168.43.147.7772: UDP, length 120
00:06:40.182692 IP 192.168.43.147.8880 > 192.168.43.124.7773: UDP, length 120
00:06:40.216864 IP 192.168.43.146.8880 > 192.168.43.147.7772: UDP, length 120
00:06:40.232653 IP 192.168.43.147.8880 > 192.168.43.124.7773: UDP, length 120
00:06:40.264310 IP 192.168.43.146.8880 > 192.168.43.147.7772: UDP, length 120
00:06:40.282650 IP 192.168.43.147.8880 > 192.168.43.124.7773: UDP, length 120
00:06:40.330032 IP 192.168.43.146.8880 > 192.168.43.147.7772: UDP, length 120
00:06:40.332645 IP 192.168.43.147.8880 > 192.168.43.124.7773: UDP, length 120
00:06:40.382639 IP 192.168.43.147.8880 > 192.168.43.124.7773: UDP, length 120
00:06:40.407541 IP 192.168.43.146.8880 > 192.168.43.147.7772: UDP, length 120
00:06:40.421836 IP 192.168.43.146.8880 > 192.168.43.147.7772: UDP, length 120
00:06:40.432640 IP 192.168.43.147.8880 > 192.168.43.124.7773: UDP, length 120
00:06:40.482639 IP 192.168.43.147.8880 > 192.168.43.124.7773: UDP, length 120
00:06:40.491294 IP 192.168.43.146.8880 > 192.168.43.147.7772: UDP, length 120
00:06:40.527893 IP 192.168.43.146.8880 > 192.168.43.147.7772: UDP, length 120
00:06:40.532653 IP 192.168.43.147.8880 > 192.168.43.124.7773: UDP, length 120
00:06:40.569211 IP 192.168.43.146.8880 > 192.168.43.147.7772: UDP, length 120
00:06:40.582653 IP 192.168.43.147.8880 > 192.168.43.124.7773: UDP, length 120
00:06:40.632661 IP 192.168.43.147.8880 > 192.168.43.124.7773: UDP, length 120
00:06:40.635794 IP 192.168.43.146.8880 > 192.168.43.147.7772: UDP, length 120
00:06:40.673814 IP 192.168.43.146.8880 > 192.168.43.147.7772: UDP, length 120
00:06:40.682640 IP 192.168.43.147.8880 > 192.168.43.124.7773: UDP, length 120
00:06:40.725327 IP 192.168.43.146.8880 > 192.168.43.147.7772: UDP, length 120
00:06:40.732640 IP 192.168.43.147.8880 > 192.168.43.124.7773: UDP, length 120
00:06:40.780937 IP 192.168.43.146.8880 > 192.168.43.147.7772: UDP, length 120
00:06:40.782670 IP 192.168.43.147.8880 > 192.168.43.124.7773: UDP, length 120
00:06:40.821075 IP 192.168.43.146.8880 > 192.168.43.147.7772: UDP, length 120
00:06:40.832661 IP 192.168.43.147.8880 > 192.168.43.124.7773: UDP, length 120
00:06:40.882639 IP 192.168.43.147.8880 > 192.168.43.124.7773: UDP, length 120
00:06:40.891156 IP 192.168.43.146.8880 > 192.168.43.147.7772: UDP, length 120
00:06:40.929755 IP 192.168.43.146.8880 > 192.168.43.147.7772: UDP, length 120
00:06:40.932639 IP 192.168.43.147.8880 > 192.168.43.124.7773: UDP, length 120
00:06:40.982640 IP 192.168.43.147.8880 > 192.168.43.124.7773: UDP, length 120
00:06:40.987412 IP 192.168.43.146.8880 > 192.168.43.147.7772: UDP, length 120
00:06:41.025628 IP 192.168.43.146.8880 > 192.168.43.147.7772: UDP, length 120
00:06:41.032676 IP 192.168.43.147.8880 > 192.168.43.124.7773: UDP, length 120
00:06:41.082674 IP 192.168.43.147.8880 > 192.168.43.124.7773: UDP, length 120
00:06:41.083802 IP 192.168.43.146.8880 > 192.168.43.147.7772: UDP, length 120
00:06:41.132647 IP 192.168.43.147.8880 > 192.168.43.124.7773: UDP, length 120
00:06:41.144388 IP 192.168.43.146.8880 > 192.168.43.147.7772: UDP, length 120
00:06:41.156003 IP 192.168.43.146.8880 > 192.168.43.147.7772: UDP, length 120
00:06:41.182650 IP 192.168.43.147.8880 > 192.168.43.124.7773: UDP, length 120
00:06:41.227019 IP 192.168.43.146.8880 > 192.168.43.147.7772: UDP, length 120
00:06:41.232642 IP 192.168.43.147.8880 > 192.168.43.124.7773: UDP, length 120
00:06:41.262492 IP 192.168.43.146.8880 > 192.168.43.147.7772: UDP, length 120
00:06:41.282641 IP 192.168.43.147.8880 > 192.168.43.124.7773: UDP, length 120
00:06:41.332639 IP 192.168.43.147.8880 > 192.168.43.124.7773: UDP, length 120
00:06:41.336038 IP 192.168.43.146.8880 > 192.168.43.147.7772: UDP, length 120
00:06:41.370614 IP 192.168.43.146.8880 > 192.168.43.147.7772: UDP, length 120
00:06:41.382641 IP 192.168.43.147.8880 > 192.168.43.124.7773: UDP, length 120
00:06:41.432649 IP 192.168.43.147.8880 > 192.168.43.124.7773: UDP, length 120
00:06:41.439482 IP 192.168.43.146.8880 > 192.168.43.147.7772: UDP, length 120
00:06:41.482671 IP 192.168.43.147.8880 > 192.168.43.124.7773: UDP, length 120
00:06:41.509000 IP 192.168.43.146.8880 > 192.168.43.147.7772: UDP, length 120
00:06:41.510462 IP 192.168.43.146.8880 > 192.168.43.147.7772: UDP, length 120
00:06:41.532641 IP 192.168.43.147.8880 > 192.168.43.124.7773: UDP, length 120
00:06:41.578696 IP 192.168.43.146.8880 > 192.168.43.147.7772: UDP, length 120
00:06:41.582640 IP 192.168.43.147.8880 > 192.168.43.124.7773: UDP, length 120
00:06:41.621425 IP 192.168.43.146.8880 > 192.168.43.147.7772: UDP, length 120
00:06:41.632638 IP 192.168.43.147.8880 > 192.168.43.124.7773: UDP, length 120
00:06:41.670612 IP 192.168.43.146.8880 > 192.168.43.147.7772: UDP, length 120
00:06:41.682691 IP 192.168.43.147.8880 > 192.168.43.124.7773: UDP, length 120
00:06:41.711991 IP 192.168.43.146.8880 > 192.168.43.147.7772: UDP, length 120
00:06:41.732645 IP 192.168.43.147.8880 > 192.168.43.124.7773: UDP, length 120
00:06:41.757964 IP 192.168.43.146.8880 > 192.168.43.147.7772: UDP, length 120
00:06:41.782651 IP 192.168.43.147.8880 > 192.168.43.124.7773: UDP, length 120
00:06:41.822880 IP 192.168.43.146.8880 > 192.168.43.147.7772: UDP, length 120
00:06:41.832645 IP 192.168.43.147.8880 > 192.168.43.124.7773: UDP, length 120
00:06:41.858737 IP 192.168.43.146.8880 > 192.168.43.147.7772: UDP, length 120
00:06:41.882647 IP 192.168.43.147.8880 > 192.168.43.124.7773: UDP, length 120
00:06:41.908536 IP 192.168.43.146.8880 > 192.168.43.147.7772: UDP, length 120
00:06:41.932643 IP 192.168.43.147.8880 > 192.168.43.124.7773: UDP, length 120
00:06:41.970790 IP 192.168.43.146.8880 > 192.168.43.147.7772: UDP, length 120
00:06:41.982639 IP 192.168.43.147.8880 > 192.168.43.124.7773: UDP, length 120
00:06:42.009618 IP 192.168.43.146.8880 > 192.168.43.147.7772: UDP, length 120
00:06:42.032654 IP 192.168.43.147.8880 > 192.168.43.124.7773: UDP, length 120
00:06:42.056818 IP 192.168.43.146.8880 > 192.168.43.147.7772: UDP, length 120
00:06:42.082648 IP 192.168.43.147.8880 > 192.168.43.124.7773: UDP, length 120
00:06:42.119602 IP 192.168.43.146.8880 > 192.168.43.147.7772: UDP, length 120
00:06:42.132641 IP 192.168.43.147.8880 > 192.168.43.124.7773: UDP, length 120
00:06:42.157906 IP 192.168.43.146.8880 > 192.168.43.147.7772: UDP, length 120
00:06:42.182640 IP 192.168.43.147.8880 > 192.168.43.124.7773: UDP, length 120
00:06:42.208119 IP 192.168.43.146.8880 > 192.168.43.147.7772: UDP, length 120
00:06:42.232644 IP 192.168.43.147.8880 > 192.168.43.124.7773: UDP, length 120
00:06:42.272837 IP 192.168.43.146.8880 > 192.168.43.147.7772: UDP, length 120
00:06:42.282640 IP 192.168.43.147.8880 > 192.168.43.124.7773: UDP, length 120
00:06:42.310927 IP 192.168.43.146.8880 > 192.168.43.147.7772: UDP, length 120
00:06:42.332641 IP 192.168.43.147.8880 > 192.168.43.124.7773: UDP, length 120
00:06:42.357974 IP 192.168.43.146.8880 > 192.168.43.147.7772: UDP, length 120
00:06:42.382642 IP 192.168.43.147.8880 > 192.168.43.124.7773: UDP, length 120
00:06:42.422821 IP 192.168.43.146.8880 > 192.168.43.147.7772: UDP, length 120
00:06:42.432645 IP 192.168.43.147.8880 > 192.168.43.124.7773: UDP, length 120
00:06:42.458540 IP 192.168.43.146.8880 > 192.168.43.147.7772: UDP, length 120
00:06:42.482643 IP 192.168.43.147.8880 > 192.168.43.124.7773: UDP, length 120
00:06:42.515799 IP 192.168.43.146.8880 > 192.168.43.147.7772: UDP, length 120
00:06:42.532643 IP 192.168.43.147.8880 > 192.168.43.124.7773: UDP, length 120
00:06:42.576679 IP 192.168.43.146.8880 > 192.168.43.147.7772: UDP, length 120
00:06:42.582640 IP 192.168.43.147.8880 > 192.168.43.124.7773: UDP, length 120
00:06:42.617563 IP 192.168.43.146.8880 > 192.168.43.147.7772: UDP, length 120
00:06:42.632638 IP 192.168.43.147.8880 > 192.168.43.124.7773: UDP, length 120
00:06:42.666972 IP 192.168.43.146.8880 > 192.168.43.147.7772: UDP, length 120
00:06:42.682643 IP 192.168.43.147.8880 > 192.168.43.124.7773: UDP, length 120
00:06:42.732641 IP 192.168.43.147.8880 > 192.168.43.124.7773: UDP, length 120
00:06:42.735247 IP 192.168.43.146.8880 > 192.168.43.147.7772: UDP, length 120
00:06:42.773486 IP 192.168.43.146.8880 > 192.168.43.147.7772: UDP, length 120
00:06:42.782640 IP 192.168.43.147.8880 > 192.168.43.124.7773: UDP, length 120
00:06:42.823713 IP 192.168.43.146.8880 > 192.168.43.147.7772: UDP, length 120
00:06:42.832639 IP 192.168.43.147.8880 > 192.168.43.124.7773: UDP, length 120
00:06:42.882644 IP 192.168.43.147.8880 > 192.168.43.124.7773: UDP, length 120
00:06:42.895061 IP 192.168.43.146.8880 > 192.168.43.147.7772: UDP, length 120
00:06:42.932662 IP 192.168.43.147.8880 > 192.168.43.124.7773: UDP, length 120
00:06:42.982644 IP 192.168.43.147.8880 > 192.168.43.124.7773: UDP, length 120
00:06:42.986063 IP 192.168.43.146.8880 > 192.168.43.147.7772: UDP, length 120
00:06:42.986381 IP 192.168.43.146.8880 > 192.168.43.147.7772: UDP, length 120
00:06:43.007986 IP 192.168.43.146.8880 > 192.168.43.147.7772: UDP, length 120
00:06:43.032680 IP 192.168.43.147.8880 > 192.168.43.124.7773: UDP, length 120
00:06:43.073853 IP 192.168.43.146.8880 > 192.168.43.147.7772: UDP, length 120
00:06:43.082662 IP 192.168.43.147.8880 > 192.168.43.124.7773: UDP, length 120
00:06:43.123848 IP 192.168.43.146.8880 > 192.168.43.147.7772: UDP, length 120
00:06:43.132656 IP 192.168.43.147.8880 > 192.168.43.124.7773: UDP, length 120
00:06:43.182699 IP 192.168.43.147.8880 > 192.168.43.124.7773: UDP, length 120
00:06:43.187359 IP 192.168.43.146.8880 > 192.168.43.147.7772: UDP, length 120
00:06:43.232654 IP 192.168.43.147.8880 > 192.168.43.124.7773: UDP, length 120
00:06:43.234330 IP 192.168.43.146.8880 > 192.168.43.147.7772: UDP, length 120
00:06:43.271414 IP 192.168.43.146.8880 > 192.168.43.147.7772: UDP, length 120
00:06:43.282648 IP 192.168.43.147.8880 > 192.168.43.124.7773: UDP, length 120
00:06:43.332639 IP 192.168.43.147.8880 > 192.168.43.124.7773: UDP, length 120
00:06:43.333996 IP 192.168.43.146.8880 > 192.168.43.147.7772: UDP, length 120
00:06:43.377445 IP 192.168.43.146.8880 > 192.168.43.147.7772: UDP, length 120
00:06:43.382652 IP 192.168.43.147.8880 > 192.168.43.124.7773: UDP, length 120
00:06:43.432652 IP 192.168.43.147.8880 > 192.168.43.124.7773: UDP, length 120
00:06:43.482647 IP 192.168.43.147.8880 > 192.168.43.124.7773: UDP, length 120
00:06:43.495777 IP 192.168.43.146.8880 > 192.168.43.147.7772: UDP, length 120
00:06:43.496014 IP 192.168.43.146.8880 > 192.168.43.147.7772: UDP, length 120
00:06:43.513558 IP 192.168.43.146.8880 > 192.168.43.147.7772: UDP, length 120
00:06:43.532656 IP 192.168.43.147.8880 > 192.168.43.124.7773: UDP, length 120
00:06:43.561627 IP 192.168.43.146.8880 > 192.168.43.147.7772: UDP, length 120
00:06:43.582647 IP 192.168.43.147.8880 > 192.168.43.124.7773: UDP, length 120
00:06:43.621225 IP 192.168.43.146.8880 > 192.168.43.147.7772: UDP, length 120
00:06:43.632650 IP 192.168.43.147.8880 > 192.168.43.124.7773: UDP, length 120
00:06:43.658698 IP 192.168.43.146.8880 > 192.168.43.147.7772: UDP, length 120
00:06:43.682655 IP 192.168.43.147.8880 > 192.168.43.124.7773: UDP, length 120
00:06:43.717480 IP 192.168.43.146.8880 > 192.168.43.147.7772: UDP, length 120
00:06:43.732650 IP 192.168.43.147.8880 > 192.168.43.124.7773: UDP, length 120
00:06:43.782640 IP 192.168.43.147.8880 > 192.168.43.124.7773: UDP, length 120
00:06:43.804532 IP 192.168.43.146.8880 > 192.168.43.147.7772: UDP, length 120
00:06:43.832643 IP 192.168.43.147.8880 > 192.168.43.124.7773: UDP, length 120
00:06:43.837403 IP 192.168.43.146.8880 > 192.168.43.147.7772: UDP, length 120
00:06:43.861631 IP 192.168.43.146.8880 > 192.168.43.147.7772: UDP, length 120
00:06:43.882642 IP 192.168.43.147.8880 > 192.168.43.124.7773: UDP, length 120
00:06:43.912020 IP 192.168.43.146.8880 > 192.168.43.147.7772: UDP, length 120
00:06:43.932656 IP 192.168.43.147.8880 > 192.168.43.124.7773: UDP, length 120
00:06:43.982657 IP 192.168.43.147.8880 > 192.168.43.124.7773: UDP, length 120
00:06:43.996641 IP 192.168.43.146.8880 > 192.168.43.147.7772: UDP, length 120
00:06:44.006194 IP 192.168.43.146.8880 > 192.168.43.147.7772: UDP, length 120
00:06:44.032665 IP 192.168.43.147.8880 > 192.168.43.124.7773: UDP, length 120
00:06:44.071412 IP 192.168.43.146.8880 > 192.168.43.147.7772: UDP, length 120
00:06:44.082661 IP 192.168.43.147.8880 > 192.168.43.124.7773: UDP, length 120
00:06:44.111308 IP 192.168.43.146.8880 > 192.168.43.147.7772: UDP, length 120
00:06:44.132644 IP 192.168.43.147.8880 > 192.168.43.124.7773: UDP, length 120
00:06:44.159396 IP 192.168.43.146.8880 > 192.168.43.147.7772: UDP, length 120
00:06:44.182643 IP 192.168.43.147.8880 > 192.168.43.124.7773: UDP, length 120
00:06:44.221772 IP 192.168.43.146.8880 > 192.168.43.147.7772: UDP, length 120
00:06:44.232637 IP 192.168.43.147.8880 > 192.168.43.124.7773: UDP, length 120
00:06:44.262932 IP 192.168.43.146.8880 > 192.168.43.147.7772: UDP, length 120
00:06:44.282642 IP 192.168.43.147.8880 > 192.168.43.124.7773: UDP, length 120
00:06:44.328708 IP 192.168.43.146.8880 > 192.168.43.147.7772: UDP, length 120
00:06:44.332639 IP 192.168.43.147.8880 > 192.168.43.124.7773: UDP, length 120
00:06:44.373753 IP 192.168.43.146.8880 > 192.168.43.147.7772: UDP, length 120
00:06:44.382639 IP 192.168.43.147.8880 > 192.168.43.124.7773: UDP, length 120
00:06:44.407855 IP 192.168.43.146.8880 > 192.168.43.147.7772: UDP, length 120
00:06:44.432649 IP 192.168.43.147.8880 > 192.168.43.124.7773: UDP, length 120
00:06:44.471329 IP 192.168.43.146.8880 > 192.168.43.147.7772: UDP, length 120
00:06:44.482639 IP 192.168.43.147.8880 > 192.168.43.124.7773: UDP, length 120
00:06:44.508469 IP 192.168.43.146.8880 > 192.168.43.147.7772: UDP, length 120
00:06:44.532641 IP 192.168.43.147.8880 > 192.168.43.124.7773: UDP, length 120
00:06:44.563856 IP 192.168.43.146.8880 > 192.168.43.147.7772: UDP, length 120
00:06:44.582642 IP 192.168.43.147.8880 > 192.168.43.124.7773: UDP, length 120
00:06:44.610002 IP 192.168.43.146.8880 > 192.168.43.147.7772: UDP, length 120
00:06:44.632643 IP 192.168.43.147.8880 > 192.168.43.124.7773: UDP, length 120
00:06:44.660078 IP 192.168.43.146.8880 > 192.168.43.147.7772: UDP, length 120
00:06:44.682697 IP 192.168.43.147.8880 > 192.168.43.124.7773: UDP, length 120
00:06:44.725848 IP 192.168.43.146.8880 > 192.168.43.147.7772: UDP, length 120
00:06:44.732651 IP 192.168.43.147.8880 > 192.168.43.124.7773: UDP, length 120
00:06:44.766783 IP 192.168.43.146.8880 > 192.168.43.147.7772: UDP, length 120
00:06:44.782648 IP 192.168.43.147.8880 > 192.168.43.124.7773: UDP, length 120
00:06:44.813013 IP 192.168.43.146.8880 > 192.168.43.147.7772: UDP, length 120
00:06:44.832642 IP 192.168.43.147.8880 > 192.168.43.124.7773: UDP, length 120
00:06:44.874880 IP 192.168.43.146.8880 > 192.168.43.147.7772: UDP, length 120
00:06:44.882640 IP 192.168.43.147.8880 > 192.168.43.124.7773: UDP, length 120
00:06:44.907916 IP 192.168.43.146.8880 > 192.168.43.147.7772: UDP, length 120
00:06:44.932642 IP 192.168.43.147.8880 > 192.168.43.124.7773: UDP, length 120
00:06:44.959457 IP 192.168.43.146.8880 > 192.168.43.147.7772: UDP, length 120
00:06:44.982643 IP 192.168.43.147.8880 > 192.168.43.124.7773: UDP, length 120
00:06:45.018010 IP 192.168.43.146.8880 > 192.168.43.147.7772: UDP, length 120
00:06:45.032674 IP 192.168.43.147.8880 > 192.168.43.124.7773: UDP, length 120
00:06:45.078919 IP 192.168.43.146.8880 > 192.168.43.147.7772: UDP, length 120
00:06:45.082655 IP 192.168.43.147.8880 > 192.168.43.124.7773: UDP, length 120
00:06:45.110749 IP 192.168.43.146.8880 > 192.168.43.147.7772: UDP, length 120
00:06:45.132646 IP 192.168.43.147.8880 > 192.168.43.124.7773: UDP, length 120
00:06:45.158544 IP 192.168.43.146.8880 > 192.168.43.147.7772: UDP, length 120
00:06:45.182643 IP 192.168.43.147.8880 > 192.168.43.124.7773: UDP, length 120
00:06:45.223935 IP 192.168.43.146.8880 > 192.168.43.147.7772: UDP, length 120
00:06:45.232640 IP 192.168.43.147.8880 > 192.168.43.124.7773: UDP, length 120
00:06:45.261805 IP 192.168.43.146.8880 > 192.168.43.147.7772: UDP, length 120
00:06:45.282643 IP 192.168.43.147.8880 > 192.168.43.124.7773: UDP, length 120
00:06:45.312107 IP 192.168.43.146.8880 > 192.168.43.147.7772: UDP, length 120
00:06:45.332638 IP 192.168.43.147.8880 > 192.168.43.124.7773: UDP, length 120
00:06:45.372421 IP 192.168.43.146.8880 > 192.168.43.147.7772: UDP, length 120
00:06:45.382639 IP 192.168.43.147.8880 > 192.168.43.124.7773: UDP, length 120
00:06:45.415174 IP 192.168.43.146.8880 > 192.168.43.147.7772: UDP, length 120
00:06:45.432642 IP 192.168.43.147.8880 > 192.168.43.124.7773: UDP, length 120
00:06:45.482639 IP 192.168.43.147.8880 > 192.168.43.124.7773: UDP, length 120
00:06:45.491168 IP 192.168.43.146.8880 > 192.168.43.147.7772: UDP, length 120
00:06:45.520097 IP 192.168.43.146.8880 > 192.168.43.147.7772: UDP, length 120
00:06:45.532640 IP 192.168.43.147.8880 > 192.168.43.124.7773: UDP, length 120
00:06:45.569254 IP 192.168.43.146.8880 > 192.168.43.147.7772: UDP, length 120
00:06:45.582639 IP 192.168.43.147.8880 > 192.168.43.124.7773: UDP, length 120
00:06:45.621775 IP 192.168.43.146.8880 > 192.168.43.147.7772: UDP, length 120
00:06:45.632638 IP 192.168.43.147.8880 > 192.168.43.124.7773: UDP, length 120
00:06:45.668489 IP 192.168.43.146.8880 > 192.168.43.147.7772: UDP, length 120
00:06:45.682639 IP 192.168.43.147.8880 > 192.168.43.124.7773: UDP, length 120
00:06:45.717311 IP 192.168.43.146.8880 > 192.168.43.147.7772: UDP, length 120
00:06:45.732639 IP 192.168.43.147.8880 > 192.168.43.124.7773: UDP, length 120
00:06:45.781087 IP 192.168.43.146.8880 > 192.168.43.147.7772: UDP, length 120
00:06:45.782638 IP 192.168.43.147.8880 > 192.168.43.124.7773: UDP, length 120
00:06:45.816132 IP 192.168.43.146.8880 > 192.168.43.147.7772: UDP, length 120
00:06:45.832644 IP 192.168.43.147.8880 > 192.168.43.124.7773: UDP, length 120
00:06:45.861637 IP 192.168.43.146.8880 > 192.168.43.147.7772: UDP, length 120
00:06:45.882642 IP 192.168.43.147.8880 > 192.168.43.124.7773: UDP, length 120
00:06:45.920752 IP 192.168.43.146.8880 > 192.168.43.147.7772: UDP, length 120
00:06:45.932639 IP 192.168.43.147.8880 > 192.168.43.124.7773: UDP, length 120
00:06:45.961076 IP 192.168.43.146.8880 > 192.168.43.147.7772: UDP, length 120
00:06:45.982648 IP 192.168.43.147.8880 > 192.168.43.124.7773: UDP, length 120
00:06:46.005846 IP 192.168.43.146.8880 > 192.168.43.147.7772: UDP, length 120
00:06:46.032671 IP 192.168.43.147.8880 > 192.168.43.124.7773: UDP, length 120
00:06:46.072953 IP 192.168.43.146.8880 > 192.168.43.147.7772: UDP, length 120
00:06:46.082671 IP 192.168.43.147.8880 > 192.168.43.124.7773: UDP, length 120
00:06:46.114159 IP 192.168.43.146.8880 > 192.168.43.147.7772: UDP, length 120
00:06:46.132641 IP 192.168.43.147.8880 > 192.168.43.124.7773: UDP, length 120
00:06:46.158714 IP 192.168.43.146.8880 > 192.168.43.147.7772: UDP, length 120
00:06:46.182698 IP 192.168.43.147.8880 > 192.168.43.124.7773: UDP, length 120
00:06:46.223230 IP 192.168.43.146.8880 > 192.168.43.147.7772: UDP, length 120
00:06:46.232659 IP 192.168.43.147.8880 > 192.168.43.124.7773: UDP, length 120
00:06:46.263311 IP 192.168.43.146.8880 > 192.168.43.147.7772: UDP, length 120
00:06:46.282644 IP 192.168.43.147.8880 > 192.168.43.124.7773: UDP, length 120
00:06:46.312212 IP 192.168.43.146.8880 > 192.168.43.147.7772: UDP, length 120
00:06:46.332643 IP 192.168.43.147.8880 > 192.168.43.124.7773: UDP, length 120
00:06:46.370977 IP 192.168.43.146.8880 > 192.168.43.147.7772: UDP, length 120
00:06:46.382638 IP 192.168.43.147.8880 > 192.168.43.124.7773: UDP, length 120
00:06:46.414396 IP 192.168.43.146.8880 > 192.168.43.147.7772: UDP, length 120
00:06:46.432655 IP 192.168.43.147.8880 > 192.168.43.124.7773: UDP, length 120
00:06:46.482652 IP 192.168.43.147.8880 > 192.168.43.124.7773: UDP, length 120
00:06:46.525946 IP 192.168.43.146.8880 > 192.168.43.147.7772: UDP, length 120
00:06:46.532648 IP 192.168.43.147.8880 > 192.168.43.124.7773: UDP, length 120
00:06:46.582640 IP 192.168.43.147.8880 > 192.168.43.124.7773: UDP, length 120
00:06:46.632640 IP 192.168.43.147.8880 > 192.168.43.124.7773: UDP, length 120
00:06:46.672431 IP 192.168.43.146.8880 > 192.168.43.147.7772: UDP, length 120
00:06:46.672735 IP 192.168.43.146.8880 > 192.168.43.147.7772: UDP, length 120
00:06:46.672952 IP 192.168.43.146.8880 > 192.168.43.147.7772: UDP, length 120
00:06:46.682639 IP 192.168.43.147.8880 > 192.168.43.124.7773: UDP, length 120
00:06:46.708223 IP 192.168.43.146.8880 > 192.168.43.147.7772: UDP, length 120
00:06:46.732654 IP 192.168.43.147.8880 > 192.168.43.124.7773: UDP, length 120
00:06:46.775612 IP 192.168.43.146.8880 > 192.168.43.147.7772: UDP, length 120
00:06:46.782651 IP 192.168.43.147.8880 > 192.168.43.124.7773: UDP, length 120
00:06:46.831448 IP 192.168.43.146.8880 > 192.168.43.147.7772: UDP, length 120
00:06:46.832639 IP 192.168.43.147.8880 > 192.168.43.124.7773: UDP, length 120
00:06:46.870518 IP 192.168.43.146.8880 > 192.168.43.147.7772: UDP, length 120
00:06:46.882640 IP 192.168.43.147.8880 > 192.168.43.124.7773: UDP, length 120
00:06:46.915166 IP 192.168.43.146.8880 > 192.168.43.147.7772: UDP, length 120
00:06:46.932643 IP 192.168.43.147.8880 > 192.168.43.124.7773: UDP, length 120
00:06:46.982639 IP 192.168.43.147.8880 > 192.168.43.124.7773: UDP, length 120
00:06:46.991599 IP 192.168.43.146.8880 > 192.168.43.147.7772: UDP, length 120
00:06:47.032665 IP 192.168.43.147.8880 > 192.168.43.124.7773: UDP, length 120
00:06:47.063589 IP 192.168.43.146.8880 > 192.168.43.147.7772: UDP, length 120
00:06:47.081715 IP 192.168.43.146.8880 > 192.168.43.147.7772: UDP, length 120
00:06:47.082658 IP 192.168.43.147.8880 > 192.168.43.124.7773: UDP, length 120
00:06:47.132639 IP 192.168.43.147.8880 > 192.168.43.124.7773: UDP, length 120
00:06:47.134642 IP 192.168.43.146.8880 > 192.168.43.147.7772: UDP, length 120
00:06:47.177556 IP 192.168.43.146.8880 > 192.168.43.147.7772: UDP, length 120
00:06:47.182654 IP 192.168.43.147.8880 > 192.168.43.124.7773: UDP, length 120
00:06:47.232644 IP 192.168.43.147.8880 > 192.168.43.124.7773: UDP, length 120
00:06:47.252256 IP 192.168.43.146.8880 > 192.168.43.147.7772: UDP, length 120
00:06:47.257383 IP 192.168.43.146.8880 > 192.168.43.147.7772: UDP, length 120
00:06:47.282654 IP 192.168.43.147.8880 > 192.168.43.124.7773: UDP, length 120
00:06:47.316350 IP 192.168.43.146.8880 > 192.168.43.147.7772: UDP, length 120
00:06:47.332646 IP 192.168.43.147.8880 > 192.168.43.124.7773: UDP, length 120
00:06:47.362578 IP 192.168.43.146.8880 > 192.168.43.147.7772: UDP, length 120
00:06:47.382649 IP 192.168.43.147.8880 > 192.168.43.124.7773: UDP, length 120
00:06:47.408191 IP 192.168.43.146.8880 > 192.168.43.147.7772: UDP, length 120
00:06:47.432644 IP 192.168.43.147.8880 > 192.168.43.124.7773: UDP, length 120
00:06:47.473123 IP 192.168.43.146.8880 > 192.168.43.147.7772: UDP, length 120
00:06:47.482650 IP 192.168.43.147.8880 > 192.168.43.124.7773: UDP, length 120
00:06:47.512970 IP 192.168.43.146.8880 > 192.168.43.147.7772: UDP, length 120
00:06:47.532643 IP 192.168.43.147.8880 > 192.168.43.124.7773: UDP, length 120
00:06:47.570443 IP 192.168.43.146.8880 > 192.168.43.147.7772: UDP, length 120
00:06:47.582638 IP 192.168.43.147.8880 > 192.168.43.124.7773: UDP, length 120
00:06:47.612991 IP 192.168.43.146.8880 > 192.168.43.147.7772: UDP, length 120
00:06:47.632649 IP 192.168.43.147.8880 > 192.168.43.124.7773: UDP, length 120
00:06:47.662227 IP 192.168.43.146.8880 > 192.168.43.147.7772: UDP, length 120
00:06:47.682684 IP 192.168.43.147.8880 > 192.168.43.124.7773: UDP, length 120
00:06:47.717308 IP 192.168.43.146.8880 > 192.168.43.147.7772: UDP, length 120
00:06:47.732657 IP 192.168.43.147.8880 > 192.168.43.124.7773: UDP, length 120
00:06:47.782645 IP 192.168.43.147.8880 > 192.168.43.124.7773: UDP, length 120
00:06:47.799752 IP 192.168.43.146.8880 > 192.168.43.147.7772: UDP, length 120
00:06:47.815674 IP 192.168.43.146.8880 > 192.168.43.147.7772: UDP, length 120
00:06:47.832649 IP 192.168.43.147.8880 > 192.168.43.124.7773: UDP, length 120
00:06:47.882645 IP 192.168.43.147.8880 > 192.168.43.124.7773: UDP, length 120
00:06:47.902514 IP 192.168.43.146.8880 > 192.168.43.147.7772: UDP, length 120
00:06:47.915230 IP 192.168.43.146.8880 > 192.168.43.147.7772: UDP, length 120
00:06:47.932651 IP 192.168.43.147.8880 > 192.168.43.124.7773: UDP, length 120
00:06:47.982644 IP 192.168.43.147.8880 > 192.168.43.124.7773: UDP, length 120
00:06:47.992044 IP 192.168.43.146.8880 > 192.168.43.147.7772: UDP, length 120
00:06:48.018831 IP 192.168.43.146.8880 > 192.168.43.147.7772: UDP, length 120
00:06:48.032672 IP 192.168.43.147.8880 > 192.168.43.124.7773: UDP, length 120
00:06:48.069884 IP 192.168.43.146.8880 > 192.168.43.147.7772: UDP, length 120
00:06:48.082662 IP 192.168.43.147.8880 > 192.168.43.124.7773: UDP, length 120
00:06:48.109603 IP 192.168.43.146.8880 > 192.168.43.147.7772: UDP, length 120
00:06:48.132645 IP 192.168.43.147.8880 > 192.168.43.124.7773: UDP, length 120
00:06:48.182644 IP 192.168.43.147.8880 > 192.168.43.124.7773: UDP, length 120
00:06:48.210967 IP 192.168.43.146.8880 > 192.168.43.147.7772: UDP, length 120
00:06:48.211103 IP 192.168.43.146.8880 > 192.168.43.147.7772: UDP, length 120
00:06:48.232652 IP 192.168.43.147.8880 > 192.168.43.124.7773: UDP, length 120
00:06:48.282648 IP 192.168.43.147.8880 > 192.168.43.124.7773: UDP, length 120
00:06:48.312796 IP 192.168.43.146.8880 > 192.168.43.147.7772: UDP, length 120
00:06:48.312921 IP 192.168.43.146.8880 > 192.168.43.147.7772: UDP, length 120
00:06:48.332649 IP 192.168.43.147.8880 > 192.168.43.124.7773: UDP, length 120
00:06:48.382643 IP 192.168.43.147.8880 > 192.168.43.124.7773: UDP, length 120
00:06:48.383764 IP 192.168.43.146.8880 > 192.168.43.147.7772: UDP, length 120
00:06:48.412298 IP 192.168.43.146.8880 > 192.168.43.147.7772: UDP, length 120
00:06:48.432645 IP 192.168.43.147.8880 > 192.168.43.124.7773: UDP, length 120
00:06:48.463743 IP 192.168.43.146.8880 > 192.168.43.147.7772: UDP, length 120
00:06:48.482654 IP 192.168.43.147.8880 > 192.168.43.124.7773: UDP, length 120
00:06:48.514991 IP 192.168.43.146.8880 > 192.168.43.147.7772: UDP, length 120
00:06:48.532653 IP 192.168.43.147.8880 > 192.168.43.124.7773: UDP, length 120
00:06:48.562637 IP 192.168.43.146.8880 > 192.168.43.147.7772: UDP, length 120
00:06:48.582649 IP 192.168.43.147.8880 > 192.168.43.124.7773: UDP, length 120
00:06:48.616992 IP 192.168.43.146.8880 > 192.168.43.147.7772: UDP, length 120
00:06:48.632647 IP 192.168.43.147.8880 > 192.168.43.124.7773: UDP, length 120
00:06:48.666868 IP 192.168.43.146.8880 > 192.168.43.147.7772: UDP, length 120
00:06:48.682645 IP 192.168.43.147.8880 > 192.168.43.124.7773: UDP, length 120
00:06:48.719512 IP 192.168.43.146.8880 > 192.168.43.147.7772: UDP, length 120
00:06:48.732644 IP 192.168.43.147.8880 > 192.168.43.124.7773: UDP, length 120
00:06:48.778747 IP 192.168.43.146.8880 > 192.168.43.147.7772: UDP, length 120
00:06:48.782653 IP 192.168.43.147.8880 > 192.168.43.124.7773: UDP, length 120
00:06:48.814174 IP 192.168.43.146.8880 > 192.168.43.147.7772: UDP, length 120
