02:20:17.487940 IP 192.168.43.124.8880 > 192.168.43.146.7771: UDP, length 120
02:20:17.531762 IP 192.168.43.124.8880 > 192.168.43.146.7771: UDP, length 120
02:20:17.579578 IP 192.168.43.124.8880 > 192.168.43.146.7771: UDP, length 120
02:20:17.633016 IP 192.168.43.124.8880 > 192.168.43.146.7771: UDP, length 120
02:20:17.680664 IP 192.168.43.124.8880 > 192.168.43.146.7771: UDP, length 120
02:20:17.737998 IP 192.168.43.124.8880 > 192.168.43.146.7771: UDP, length 120
02:20:17.783072 IP 192.168.43.124.8880 > 192.168.43.146.7771: UDP, length 120
02:20:17.846623 IP 192.168.43.124.8880 > 192.168.43.146.7771: UDP, length 120
02:20:17.877877 IP 192.168.43.124.8880 > 192.168.43.146.7771: UDP, length 120
02:20:17.938385 IP 192.168.43.124.8880 > 192.168.43.146.7771: UDP, length 120
02:20:17.978581 IP 192.168.43.124.8880 > 192.168.43.146.7771: UDP, length 120
02:20:18.038690 IP 192.168.43.124.8880 > 192.168.43.146.7771: UDP, length 120
02:20:18.078558 IP 192.168.43.124.8880 > 192.168.43.146.7771: UDP, length 120
02:20:18.139738 IP 192.168.43.124.8880 > 192.168.43.146.7771: UDP, length 120
02:20:18.179765 IP 192.168.43.124.8880 > 192.168.43.146.7771: UDP, length 120
02:20:18.230716 IP 192.168.43.124.8880 > 192.168.43.146.7771: UDP, length 120
02:20:18.295419 IP 192.168.43.146.8880 > 192.168.43.147.7772: UDP, length 120
02:20:18.298884 IP 192.168.43.124.8880 > 192.168.43.146.7771: UDP, length 120
02:20:18.328880 IP 192.168.43.124.8880 > 192.168.43.146.7771: UDP, length 120
02:20:18.345466 IP 192.168.43.146.8880 > 192.168.43.147.7772: UDP, length 120
02:20:18.388316 IP 192.168.43.124.8880 > 192.168.43.146.7771: UDP, length 120
02:20:18.395451 IP 192.168.43.146.8880 > 192.168.43.147.7772: UDP, length 120
02:20:18.427906 IP 192.168.43.124.8880 > 192.168.43.146.7771: UDP, length 120
02:20:18.445439 IP 192.168.43.146.8880 > 192.168.43.147.7772: UDP, length 120
02:20:18.478231 IP 192.168.43.124.8880 > 192.168.43.146.7771: UDP, length 120
02:20:18.495440 IP 192.168.43.146.8880 > 192.168.43.147.7772: UDP, length 120
02:20:18.539823 IP 192.168.43.124.8880 > 192.168.43.146.7771: UDP, length 120
02:20:18.545437 IP 192.168.43.146.8880 > 192.168.43.147.7772: UDP, length 120
02:20:18.579325 IP 192.168.43.124.8880 > 192.168.43.146.7771: UDP, length 120
02:20:18.595438 IP 192.168.43.146.8880 > 192.168.43.147.7772: UDP, length 120
02:20:18.629863 IP 192.168.43.124.8880 > 192.168.43.146.7771: UDP, length 120
02:20:18.645438 IP 192.168.43.146.8880 > 192.168.43.147.7772: UDP, length 120
02:20:18.692180 IP 192.168.43.124.8880 > 192.168.43.146.7771: UDP, length 120
02:20:18.695472 IP 192.168.43.146.8880 > 192.168.43.147.7772: UDP, length 120
02:20:18.732790 IP 192.168.43.124.8880 > 192.168.43.146.7771: UDP, length 120
02:20:18.745459 IP 192.168.43.146.8880 > 192.168.43.147.7772: UDP, length 120
02:20:18.789515 IP 192.168.43.124.8880 > 192.168.43.146.7771: UDP, length 120
02:20:18.795823 IP 192.168.43.146.8880 > 192.168.43.147.7772: UDP, length 120
02:20:18.835763 IP 192.168.43.124.8880 > 192.168.43.146.7771: UDP, length 120
02:20:18.845470 IP 192.168.43.146.8880 > 192.168.43.147.7772: UDP, length 120
02:20:18.878698 IP 192.168.43.124.8880 > 192.168.43.146.7771: UDP, length 120
02:20:18.895445 IP 192.168.43.146.8880 > 192.168.43.147.7772: UDP, length 120
02:20:18.944077 IP 192.168.43.124.8880 > 192.168.43.146.7771: UDP, length 120
02:20:18.945440 IP 192.168.43.146.8880 > 192.168.43.147.7772: UDP, length 120
02:20:18.979195 IP 192.168.43.124.8880 > 192.168.43.146.7771: UDP, length 120
02:20:18.995441 IP 192.168.43.146.8880 > 192.168.43.147.7772: UDP, length 120
02:20:19.029252 IP 192.168.43.124.8880 > 192.168.43.146.7771: UDP, length 120
02:20:19.045438 IP 192.168.43.146.8880 > 192.168.43.147.7772: UDP, length 120
02:20:19.095436 IP 192.168.43.146.8880 > 192.168.43.147.7772: UDP, length 120
02:20:19.095890 IP 192.168.43.124.8880 > 192.168.43.146.7771: UDP, length 120
02:20:19.129103 IP 192.168.43.124.8880 > 192.168.43.146.7771: UDP, length 120
02:20:19.145439 IP 192.168.43.146.8880 > 192.168.43.147.7772: UDP, length 120
02:20:19.178504 IP 192.168.43.124.8880 > 192.168.43.146.7771: UDP, length 120
02:20:19.195439 IP 192.168.43.146.8880 > 192.168.43.147.7772: UDP, length 120
02:20:19.244069 IP 192.168.43.124.8880 > 192.168.43.146.7771: UDP, length 120
02:20:19.245448 IP 192.168.43.146.8880 > 192.168.43.147.7772: UDP, length 120
02:20:19.278810 IP 192.168.43.124.8880 > 192.168.43.146.7771: UDP, length 120
02:20:19.295442 IP 192.168.43.146.8880 > 192.168.43.147.7772: UDP, length 120
02:20:19.333459 IP 192.168.43.124.8880 > 192.168.43.146.7771: UDP, length 120
02:20:19.345441 IP 192.168.43.146.8880 > 192.168.43.147.7772: UDP, length 120
02:20:19.379919 IP 192.168.43.124.8880 > 192.168.43.146.7771: UDP, length 120
02:20:19.395440 IP 192.168.43.146.8880 > 192.168.43.147.7772: UDP, length 120
02:20:19.432617 IP 192.168.43.124.8880 > 192.168.43.146.7771: UDP, length 120
02:20:19.445439 IP 192.168.43.146.8880 > 192.168.43.147.7772: UDP, length 120
02:20:19.495435 IP 192.168.43.146.8880 > 192.168.43.147.7772: UDP, length 120
02:20:19.498856 IP 192.168.43.124.8880 > 192.168.43.146.7771: UDP, length 120
02:20:19.528586 IP 192.168.43.124.8880 > 192.168.43.146.7771: UDP, length 120
02:20:19.545438 IP 192.168.43.146.8880 > 192.168.43.147.7772: UDP, length 120
02:20:19.579374 IP 192.168.43.124.8880 > 192.168.43.146.7771: UDP, length 120
02:20:19.595443 IP 192.168.43.146.8880 > 192.168.43.147.7772: UDP, length 120
02:20:19.641291 IP 192.168.43.124.8880 > 192.168.43.146.7771: UDP, length 120
02:20:19.645526 IP 192.168.43.146.8880 > 192.168.43.147.7772: UDP, length 120
02:20:19.681067 IP 192.168.43.124.8880 > 192.168.43.146.7771: UDP, length 120
02:20:19.695558 IP 192.168.43.146.8880 > 192.168.43.147.7772: UDP, length 120
02:20:19.740160 IP 192.168.43.124.8880 > 192.168.43.146.7771: UDP, length 120
02:20:19.745558 IP 192.168.43.146.8880 > 192.168.43.147.7772: UDP, length 120
02:20:19.779066 IP 192.168.43.124.8880 > 192.168.43.146.7771: UDP, length 120
02:20:19.795547 IP 192.168.43.146.8880 > 192.168.43.147.7772: UDP, length 120
02:20:19.830610 IP 192.168.43.124.8880 > 192.168.43.146.7771: UDP, length 120
02:20:19.845477 IP 192.168.43.146.8880 > 192.168.43.147.7772: UDP, length 120
02:20:19.889482 IP 192.168.43.124.8880 > 192.168.43.146.7771: UDP, length 120
02:20:19.895548 IP 192.168.43.146.8880 > 192.168.43.147.7772: UDP, length 120
02:20:19.928493 IP 192.168.43.124.8880 > 192.168.43.146.7771: UDP, length 120
02:20:19.945490 IP 192.168.43.146.8880 > 192.168.43.147.7772: UDP, length 120
02:20:19.978503 IP 192.168.43.124.8880 > 192.168.43.146.7771: UDP, length 120
02:20:19.995506 IP 192.168.43.146.8880 > 192.168.43.147.7772: UDP, length 120
02:20:20.039262 IP 192.168.43.124.8880 > 192.168.43.146.7771: UDP, length 120
02:20:20.045499 IP 192.168.43.146.8880 > 192.168.43.147.7772: UDP, length 120
02:20:20.080823 IP 192.168.43.124.8880 > 192.168.43.146.7771: UDP, length 120
02:20:20.095498 IP 192.168.43.146.8880 > 192.168.43.147.7772: UDP, length 120
02:20:20.128545 IP 192.168.43.124.8880 > 192.168.43.146.7771: UDP, length 120
02:20:20.145460 IP 192.168.43.146.8880 > 192.168.43.147.7772: UDP, length 120
02:20:20.188827 IP 192.168.43.124.8880 > 192.168.43.146.7771: UDP, length 120
02:20:20.195423 IP 192.168.43.146.8880 > 192.168.43.147.7772: UDP, length 120
02:20:20.228428 IP 192.168.43.124.8880 > 192.168.43.146.7771: UDP, length 120
02:20:20.245422 IP 192.168.43.146.8880 > 192.168.43.147.7772: UDP, length 120
02:20:20.278646 IP 192.168.43.124.8880 > 192.168.43.146.7771: UDP, length 120
02:20:20.295415 IP 192.168.43.146.8880 > 192.168.43.147.7772: UDP, length 120
02:20:20.343133 IP 192.168.43.124.8880 > 192.168.43.146.7771: UDP, length 120
02:20:20.345413 IP 192.168.43.146.8880 > 192.168.43.147.7772: UDP, length 120
02:20:20.378413 IP 192.168.43.124.8880 > 192.168.43.146.7771: UDP, length 120
02:20:20.395412 IP 192.168.43.146.8880 > 192.168.43.147.7772: UDP, length 120
02:20:20.428560 IP 192.168.43.124.8880 > 192.168.43.146.7771: UDP, length 120
02:20:20.445410 IP 192.168.43.146.8880 > 192.168.43.147.7772: UDP, length 120
02:20:20.478432 IP 192.168.43.124.8880 > 192.168.43.146.7771: UDP, length 120
02:20:20.495411 IP 192.168.43.146.8880 > 192.168.43.147.7772: UDP, length 120
02:20:20.545409 IP 192.168.43.146.8880 > 192.168.43.147.7772: UDP, length 120
02:20:20.548648 IP 192.168.43.124.8880 > 192.168.43.146.7771: UDP, length 120
02:20:20.579216 IP 192.168.43.124.8880 > 192.168.43.146.7771: UDP, length 120
02:20:20.595418 IP 192.168.43.146.8880 > 192.168.43.147.7772: UDP, length 120
02:20:20.627949 IP 192.168.43.124.8880 > 192.168.43.146.7771: UDP, length 120
02:20:20.645416 IP 192.168.43.146.8880 > 192.168.43.147.7772: UDP, length 120
02:20:20.689372 IP 192.168.43.124.8880 > 192.168.43.146.7771: UDP, length 120
02:20:20.695411 IP 192.168.43.146.8880 > 192.168.43.147.7772: UDP, length 120
02:20:20.728517 IP 192.168.43.124.8880 > 192.168.43.146.7771: UDP, length 120
02:20:20.745410 IP 192.168.43.146.8880 > 192.168.43.147.7772: UDP, length 120
02:20:20.780807 IP 192.168.43.124.8880 > 192.168.43.146.7771: UDP, length 120
02:20:20.795411 IP 192.168.43.146.8880 > 192.168.43.147.7772: UDP, length 120
02:20:20.835738 IP 192.168.43.124.8880 > 192.168.43.146.7771: UDP, length 120
02:20:20.845453 IP 192.168.43.146.8880 > 192.168.43.147.7772: UDP, length 120
02:20:20.882554 IP 192.168.43.124.8880 > 192.168.43.146.7771: UDP, length 120
02:20:20.895431 IP 192.168.43.146.8880 > 192.168.43.147.7772: UDP, length 120
02:20:20.932596 IP 192.168.43.124.8880 > 192.168.43.146.7771: UDP, length 120
02:20:20.945417 IP 192.168.43.146.8880 > 192.168.43.147.7772: UDP, length 120
02:20:20.992921 IP 192.168.43.124.8880 > 192.168.43.146.7771: UDP, length 120
02:20:20.995411 IP 192.168.43.146.8880 > 192.168.43.147.7772: UDP, length 120
02:20:21.028550 IP 192.168.43.124.8880 > 192.168.43.146.7771: UDP, length 120
02:20:21.045410 IP 192.168.43.146.8880 > 192.168.43.147.7772: UDP, length 120
02:20:21.078703 IP 192.168.43.124.8880 > 192.168.43.146.7771: UDP, length 120
02:20:21.095411 IP 192.168.43.146.8880 > 192.168.43.147.7772: UDP, length 120
02:20:21.138918 IP 192.168.43.124.8880 > 192.168.43.146.7771: UDP, length 120
02:20:21.145409 IP 192.168.43.146.8880 > 192.168.43.147.7772: UDP, length 120
02:20:21.178932 IP 192.168.43.124.8880 > 192.168.43.146.7771: UDP, length 120
02:20:21.195442 IP 192.168.43.146.8880 > 192.168.43.147.7772: UDP, length 120
02:20:21.228708 IP 192.168.43.124.8880 > 192.168.43.146.7771: UDP, length 120
02:20:21.245420 IP 192.168.43.146.8880 > 192.168.43.147.7772: UDP, length 120
02:20:21.289265 IP 192.168.43.124.8880 > 192.168.43.146.7771: UDP, length 120
02:20:21.295413 IP 192.168.43.146.8880 > 192.168.43.147.7772: UDP, length 120
02:20:21.329092 IP 192.168.43.124.8880 > 192.168.43.146.7771: UDP, length 120
02:20:21.345409 IP 192.168.43.146.8880 > 192.168.43.147.7772: UDP, length 120
02:20:21.379826 IP 192.168.43.124.8880 > 192.168.43.146.7771: UDP, length 120
02:20:21.395412 IP 192.168.43.146.8880 > 192.168.43.147.7772: UDP, length 120
02:20:21.439094 IP 192.168.43.124.8880 > 192.168.43.146.7771: UDP, length 120
02:20:21.445411 IP 192.168.43.146.8880 > 192.168.43.147.7772: UDP, length 120
02:20:21.479594 IP 192.168.43.124.8880 > 192.168.43.146.7771: UDP, length 120
02:20:21.495412 IP 192.168.43.146.8880 > 192.168.43.147.7772: UDP, length 120
02:20:21.528932 IP 192.168.43.124.8880 > 192.168.43.146.7771: UDP, length 120
02:20:21.545411 IP 192.168.43.146.8880 > 192.168.43.147.7772: UDP, length 120
02:20:21.588964 IP 192.168.43.124.8880 > 192.168.43.146.7771: UDP, length 120
02:20:21.595411 IP 192.168.43.146.8880 > 192.168.43.147.7772: UDP, length 120
02:20:21.628408 IP 192.168.43.124.8880 > 192.168.43.146.7771: UDP, length 120
02:20:21.645411 IP 192.168.43.146.8880 > 192.168.43.147.7772: UDP, length 120
02:20:21.679125 IP 192.168.43.124.8880 > 192.168.43.146.7771: UDP, length 120
02:20:21.695411 IP 192.168.43.146.8880 > 192.168.43.147.7772: UDP, length 120
02:20:21.739060 IP 192.168.43.124.8880 > 192.168.43.146.7771: UDP, length 120
02:20:21.745410 IP 192.168.43.146.8880 > 192.168.43.147.7772: UDP, length 120
02:20:21.778871 IP 192.168.43.124.8880 > 192.168.43.146.7771: UDP, length 120
02:20:21.795409 IP 192.168.43.146.8880 > 192.168.43.147.7772: UDP, length 120
02:20:21.831424 IP 192.168.43.124.8880 > 192.168.43.146.7771: UDP, length 120
02:20:21.845452 IP 192.168.43.146.8880 > 192.168.43.147.7772: UDP, length 120
02:20:21.889090 IP 192.168.43.124.8880 > 192.168.43.146.7771: UDP, length 120
02:20:21.895419 IP 192.168.43.146.8880 > 192.168.43.147.7772: UDP, length 120
02:20:21.929822 IP 192.168.43.124.8880 > 192.168.43.146.7771: UDP, length 120
02:20:21.945415 IP 192.168.43.146.8880 > 192.168.43.147.7772: UDP, length 120
02:20:21.992990 IP 192.168.43.124.8880 > 192.168.43.146.7771: UDP, length 120
02:20:21.995416 IP 192.168.43.146.8880 > 192.168.43.147.7772: UDP, length 120
02:20:22.028298 IP 192.168.43.124.8880 > 192.168.43.146.7771: UDP, length 120
02:20:22.045412 IP 192.168.43.146.8880 > 192.168.43.147.7772: UDP, length 120
02:20:22.095409 IP 192.168.43.146.8880 > 192.168.43.147.7772: UDP, length 120
02:20:22.097490 IP 192.168.43.124.8880 > 192.168.43.146.7771: UDP, length 120
02:20:22.128695 IP 192.168.43.124.8880 > 192.168.43.146.7771: UDP, length 120
02:20:22.145410 IP 192.168.43.146.8880 > 192.168.43.147.7772: UDP, length 120
02:20:22.178915 IP 192.168.43.124.8880 > 192.168.43.146.7771: UDP, length 120
02:20:22.195411 IP 192.168.43.146.8880 > 192.168.43.147.7772: UDP, length 120
02:20:22.240293 IP 192.168.43.124.8880 > 192.168.43.146.7771: UDP, length 120
02:20:22.245414 IP 192.168.43.146.8880 > 192.168.43.147.7772: UDP, length 120
02:20:22.279036 IP 192.168.43.124.8880 > 192.168.43.146.7771: UDP, length 120
02:20:22.295412 IP 192.168.43.146.8880 > 192.168.43.147.7772: UDP, length 120
02:20:22.328872 IP 192.168.43.124.8880 > 192.168.43.146.7771: UDP, length 120
02:20:22.345411 IP 192.168.43.146.8880 > 192.168.43.147.7772: UDP, length 120
02:20:22.391229 IP 192.168.43.124.8880 > 192.168.43.146.7771: UDP, length 120
02:20:22.395411 IP 192.168.43.146.8880 > 192.168.43.147.7772: UDP, length 120
02:20:22.428457 IP 192.168.43.124.8880 > 192.168.43.146.7771: UDP, length 120
02:20:22.445410 IP 192.168.43.146.8880 > 192.168.43.147.7772: UDP, length 120
02:20:22.480322 IP 192.168.43.124.8880 > 192.168.43.146.7771: UDP, length 120
02:20:22.495411 IP 192.168.43.146.8880 > 192.168.43.147.7772: UDP, length 120
02:20:22.539160 IP 192.168.43.124.8880 > 192.168.43.146.7771: UDP, length 120
02:20:22.545411 IP 192.168.43.146.8880 > 192.168.43.147.7772: UDP, length 120
02:20:22.579171 IP 192.168.43.124.8880 > 192.168.43.146.7771: UDP, length 120
02:20:22.595413 IP 192.168.43.146.8880 > 192.168.43.147.7772: UDP, length 120
02:20:22.639285 IP 192.168.43.124.8880 > 192.168.43.146.7771: UDP, length 120
02:20:22.645438 IP 192.168.43.146.8880 > 192.168.43.147.7772: UDP, length 120
02:20:22.679124 IP 192.168.43.124.8880 > 192.168.43.146.7771: UDP, length 120
02:20:22.695481 IP 192.168.43.146.8880 > 192.168.43.147.7772: UDP, length 120
02:20:22.728492 IP 192.168.43.124.8880 > 192.168.43.146.7771: UDP, length 120
02:20:22.745445 IP 192.168.43.146.8880 > 192.168.43.147.7772: UDP, length 120
02:20:22.789706 IP 192.168.43.124.8880 > 192.168.43.146.7771: UDP, length 120
02:20:22.795437 IP 192.168.43.146.8880 > 192.168.43.147.7772: UDP, length 120
02:20:22.828604 IP 192.168.43.124.8880 > 192.168.43.146.7771: UDP, length 120
02:20:22.845502 IP 192.168.43.146.8880 > 192.168.43.147.7772: UDP, length 120
02:20:22.878388 IP 192.168.43.124.8880 > 192.168.43.146.7771: UDP, length 120
02:20:22.895462 IP 192.168.43.146.8880 > 192.168.43.147.7772: UDP, length 120
02:20:22.939691 IP 192.168.43.124.8880 > 192.168.43.146.7771: UDP, length 120
02:20:22.945448 IP 192.168.43.146.8880 > 192.168.43.147.7772: UDP, length 120
02:20:22.979134 IP 192.168.43.124.8880 > 192.168.43.146.7771: UDP, length 120
02:20:22.995447 IP 192.168.43.146.8880 > 192.168.43.147.7772: UDP, length 120
02:20:23.039081 IP 192.168.43.124.8880 > 192.168.43.146.7771: UDP, length 120
02:20:23.045444 IP 192.168.43.146.8880 > 192.168.43.147.7772: UDP, length 120
02:20:23.078525 IP 192.168.43.124.8880 > 192.168.43.146.7771: UDP, length 120
02:20:23.095440 IP 192.168.43.146.8880 > 192.168.43.147.7772: UDP, length 120
02:20:23.138377 IP 192.168.43.124.8880 > 192.168.43.146.7771: UDP, length 120
02:20:23.145439 IP 192.168.43.146.8880 > 192.168.43.147.7772: UDP, length 120
02:20:23.179182 IP 192.168.43.124.8880 > 192.168.43.146.7771: UDP, length 120
02:20:23.195437 IP 192.168.43.146.8880 > 192.168.43.147.7772: UDP, length 120
02:20:23.239697 IP 192.168.43.124.8880 > 192.168.43.146.7771: UDP, length 120
02:20:23.245446 IP 192.168.43.146.8880 > 192.168.43.147.7772: UDP, length 120
02:20:23.278636 IP 192.168.43.124.8880 > 192.168.43.146.7771: UDP, length 120
02:20:23.295442 IP 192.168.43.146.8880 > 192.168.43.147.7772: UDP, length 120
02:20:23.330468 IP 192.168.43.124.8880 > 192.168.43.146.7771: UDP, length 120
02:20:23.345441 IP 192.168.43.146.8880 > 192.168.43.147.7772: UDP, length 120
02:20:23.395438 IP 192.168.43.146.8880 > 192.168.43.147.7772: UDP, length 120
02:20:23.398829 IP 192.168.43.124.8880 > 192.168.43.146.7771: UDP, length 120
02:20:23.429517 IP 192.168.43.124.8880 > 192.168.43.146.7771: UDP, length 120
02:20:23.445437 IP 192.168.43.146.8880 > 192.168.43.147.7772: UDP, length 120
02:20:23.495432 IP 192.168.43.146.8880 > 192.168.43.147.7772: UDP, length 120
02:20:23.496241 IP 192.168.43.124.8880 > 192.168.43.146.7771: UDP, length 120
02:20:23.529792 IP 192.168.43.124.8880 > 192.168.43.146.7771: UDP, length 120
02:20:23.545438 IP 192.168.43.146.8880 > 192.168.43.147.7772: UDP, length 120
02:20:23.577893 IP 192.168.43.124.8880 > 192.168.43.146.7771: UDP, length 120
02:20:23.595439 IP 192.168.43.146.8880 > 192.168.43.147.7772: UDP, length 120
02:20:23.628991 IP 192.168.43.124.8880 > 192.168.43.146.7771: UDP, length 120
02:20:23.645440 IP 192.168.43.146.8880 > 192.168.43.147.7772: UDP, length 120
02:20:23.678766 IP 192.168.43.124.8880 > 192.168.43.146.7771: UDP, length 120
02:20:23.695440 IP 192.168.43.146.8880 > 192.168.43.147.7772: UDP, length 120
02:20:23.745434 IP 192.168.43.146.8880 > 192.168.43.147.7772: UDP, length 120
02:20:23.747341 IP 192.168.43.124.8880 > 192.168.43.146.7771: UDP, length 120
02:20:23.781184 IP 192.168.43.124.8880 > 192.168.43.146.7771: UDP, length 120
02:20:23.795440 IP 192.168.43.146.8880 > 192.168.43.147.7772: UDP, length 120
02:20:23.827931 IP 192.168.43.124.8880 > 192.168.43.146.7771: UDP, length 120
02:20:23.845439 IP 192.168.43.146.8880 > 192.168.43.147.7772: UDP, length 120
02:20:23.889568 IP 192.168.43.124.8880 > 192.168.43.146.7771: UDP, length 120
02:20:23.895437 IP 192.168.43.146.8880 > 192.168.43.147.7772: UDP, length 120
02:20:23.928592 IP 192.168.43.124.8880 > 192.168.43.146.7771: UDP, length 120
02:20:23.945437 IP 192.168.43.146.8880 > 192.168.43.147.7772: UDP, length 120
02:20:23.982106 IP 192.168.43.124.8880 > 192.168.43.146.7771: UDP, length 120
02:20:23.995440 IP 192.168.43.146.8880 > 192.168.43.147.7772: UDP, length 120
02:20:24.040230 IP 192.168.43.124.8880 > 192.168.43.146.7771: UDP, length 120
02:20:24.045444 IP 192.168.43.146.8880 > 192.168.43.147.7772: UDP, length 120
02:20:24.079724 IP 192.168.43.124.8880 > 192.168.43.146.7771: UDP, length 120
02:20:24.095446 IP 192.168.43.146.8880 > 192.168.43.147.7772: UDP, length 120
02:20:24.131317 IP 192.168.43.124.8880 > 192.168.43.146.7771: UDP, length 120
02:20:24.145458 IP 192.168.43.146.8880 > 192.168.43.147.7772: UDP, length 120
02:20:24.181899 IP 192.168.43.124.8880 > 192.168.43.146.7771: UDP, length 120
02:20:24.195486 IP 192.168.43.146.8880 > 192.168.43.147.7772: UDP, length 120
02:20:24.238911 IP 192.168.43.124.8880 > 192.168.43.146.7771: UDP, length 120
02:20:24.245473 IP 192.168.43.146.8880 > 192.168.43.147.7772: UDP, length 120
02:20:24.278516 IP 192.168.43.124.8880 > 192.168.43.146.7771: UDP, length 120
02:20:24.295447 IP 192.168.43.146.8880 > 192.168.43.147.7772: UDP, length 120
02:20:24.328403 IP 192.168.43.124.8880 > 192.168.43.146.7771: UDP, length 120
02:20:24.345436 IP 192.168.43.146.8880 > 192.168.43.147.7772: UDP, length 120
02:20:24.395422 IP 192.168.43.124.8880 > 192.168.43.146.7771: UDP, length 120
02:20:24.395433 IP 192.168.43.146.8880 > 192.168.43.147.7772: UDP, length 120
02:20:24.428201 IP 192.168.43.124.8880 > 192.168.43.146.7771: UDP, length 120
02:20:24.445436 IP 192.168.43.146.8880 > 192.168.43.147.7772: UDP, length 120
02:20:24.477982 IP 192.168.43.124.8880 > 192.168.43.146.7771: UDP, length 120
02:20:24.495437 IP 192.168.43.146.8880 > 192.168.43.147.7772: UDP, length 120
02:20:24.545433 IP 192.168.43.146.8880 > 192.168.43.147.7772: UDP, length 120
02:20:24.547854 IP 192.168.43.124.8880 > 192.168.43.146.7771: UDP, length 120
02:20:24.578872 IP 192.168.43.124.8880 > 192.168.43.146.7771: UDP, length 120
02:20:24.595438 IP 192.168.43.146.8880 > 192.168.43.147.7772: UDP, length 120
02:20:24.633718 IP 192.168.43.124.8880 > 192.168.43.146.7771: UDP, length 120
02:20:24.645443 IP 192.168.43.146.8880 > 192.168.43.147.7772: UDP, length 120
02:20:24.678671 IP 192.168.43.124.8880 > 192.168.43.146.7771: UDP, length 120
02:20:24.695437 IP 192.168.43.146.8880 > 192.168.43.147.7772: UDP, length 120
02:20:24.739239 IP 192.168.43.124.8880 > 192.168.43.146.7771: UDP, length 120
02:20:24.745435 IP 192.168.43.146.8880 > 192.168.43.147.7772: UDP, length 120
02:20:24.778486 IP 192.168.43.124.8880 > 192.168.43.146.7771: UDP, length 120
02:20:24.795437 IP 192.168.43.146.8880 > 192.168.43.147.7772: UDP, length 120
02:20:24.830084 IP 192.168.43.124.8880 > 192.168.43.146.7771: UDP, length 120
02:20:24.845543 IP 192.168.43.146.8880 > 192.168.43.147.7772: UDP, length 120
02:20:24.889244 IP 192.168.43.124.8880 > 192.168.43.146.7771: UDP, length 120
02:20:24.895535 IP 192.168.43.146.8880 > 192.168.43.147.7772: UDP, length 120
02:20:24.929065 IP 192.168.43.124.8880 > 192.168.43.146.7771: UDP, length 120
02:20:24.945542 IP 192.168.43.146.8880 > 192.168.43.147.7772: UDP, length 120
02:20:24.980117 IP 192.168.43.124.8880 > 192.168.43.146.7771: UDP, length 120
02:20:24.995525 IP 192.168.43.146.8880 > 192.168.43.147.7772: UDP, length 120
02:20:25.040742 IP 192.168.43.124.8880 > 192.168.43.146.7771: UDP, length 120
02:20:25.045438 IP 192.168.43.146.8880 > 192.168.43.147.7772: UDP, length 120
02:20:25.081375 IP 192.168.43.124.8880 > 192.168.43.146.7771: UDP, length 120
02:20:25.095427 IP 192.168.43.146.8880 > 192.168.43.147.7772: UDP, length 120
02:20:25.128356 IP 192.168.43.124.8880 > 192.168.43.146.7771: UDP, length 120
02:20:25.145483 IP 192.168.43.146.8880 > 192.168.43.147.7772: UDP, length 120
02:20:25.194013 IP 192.168.43.124.8880 > 192.168.43.146.7771: UDP, length 120
02:20:25.195483 IP 192.168.43.146.8880 > 192.168.43.147.7772: UDP, length 120
02:20:25.228684 IP 192.168.43.124.8880 > 192.168.43.146.7771: UDP, length 120
02:20:25.245486 IP 192.168.43.146.8880 > 192.168.43.147.7772: UDP, length 120
02:20:25.278692 IP 192.168.43.124.8880 > 192.168.43.146.7771: UDP, length 120
02:20:25.295540 IP 192.168.43.146.8880 > 192.168.43.147.7772: UDP, length 120
02:20:25.339592 IP 192.168.43.124.8880 > 192.168.43.146.7771: UDP, length 120
02:20:25.345493 IP 192.168.43.146.8880 > 192.168.43.147.7772: UDP, length 120
02:20:25.379020 IP 192.168.43.124.8880 > 192.168.43.146.7771: UDP, length 120
02:20:25.395526 IP 192.168.43.146.8880 > 192.168.43.147.7772: UDP, length 120
02:20:25.430370 IP 192.168.43.124.8880 > 192.168.43.146.7771: UDP, length 120
02:20:25.445484 IP 192.168.43.146.8880 > 192.168.43.147.7772: UDP, length 120
02:20:25.489473 IP 192.168.43.124.8880 > 192.168.43.146.7771: UDP, length 120
02:20:25.495489 IP 192.168.43.146.8880 > 192.168.43.147.7772: UDP, length 120
02:20:25.529344 IP 192.168.43.124.8880 > 192.168.43.146.7771: UDP, length 120
02:20:25.545472 IP 192.168.43.146.8880 > 192.168.43.147.7772: UDP, length 120
02:20:25.580061 IP 192.168.43.124.8880 > 192.168.43.146.7771: UDP, length 120
02:20:25.595434 IP 192.168.43.146.8880 > 192.168.43.147.7772: UDP, length 120
02:20:25.639075 IP 192.168.43.124.8880 > 192.168.43.146.7771: UDP, length 120
02:20:25.645416 IP 192.168.43.146.8880 > 192.168.43.147.7772: UDP, length 120
02:20:25.678920 IP 192.168.43.124.8880 > 192.168.43.146.7771: UDP, length 120
02:20:25.695453 IP 192.168.43.146.8880 > 192.168.43.147.7772: UDP, length 120
02:20:25.728759 IP 192.168.43.124.8880 > 192.168.43.146.7771: UDP, length 120
02:20:25.745419 IP 192.168.43.146.8880 > 192.168.43.147.7772: UDP, length 120
02:20:25.789134 IP 192.168.43.124.8880 > 192.168.43.146.7771: UDP, length 120
02:20:25.795410 IP 192.168.43.146.8880 > 192.168.43.147.7772: UDP, length 120
02:20:25.828968 IP 192.168.43.124.8880 > 192.168.43.146.7771: UDP, length 120
02:20:25.845413 IP 192.168.43.146.8880 > 192.168.43.147.7772: UDP, length 120
02:20:25.879549 IP 192.168.43.124.8880 > 192.168.43.146.7771: UDP, length 120
02:20:25.895415 IP 192.168.43.146.8880 > 192.168.43.147.7772: UDP, length 120
02:20:25.939133 IP 192.168.43.124.8880 > 192.168.43.146.7771: UDP, length 120
02:20:25.945413 IP 192.168.43.146.8880 > 192.168.43.147.7772: UDP, length 120
02:20:25.979002 IP 192.168.43.124.8880 > 192.168.43.146.7771: UDP, length 120
02:20:25.995479 IP 192.168.43.146.8880 > 192.168.43.147.7772: UDP, length 120
02:20:26.045471 IP 192.168.43.146.8880 > 192.168.43.147.7772: UDP, length 120
02:20:26.095422 IP 192.168.43.146.8880 > 192.168.43.147.7772: UDP, length 120
02:20:26.145411 IP 192.168.43.146.8880 > 192.168.43.147.7772: UDP, length 120
02:20:26.183505 IP 192.168.43.124.8880 > 192.168.43.146.7771: UDP, length 120
02:20:26.183611 IP 192.168.43.124.8880 > 192.168.43.146.7771: UDP, length 120
02:20:26.183684 IP 192.168.43.124.8880 > 192.168.43.146.7771: UDP, length 120
02:20:26.195421 IP 192.168.43.146.8880 > 192.168.43.147.7772: UDP, length 120
02:20:26.245415 IP 192.168.43.146.8880 > 192.168.43.147.7772: UDP, length 120
02:20:26.295410 IP 192.168.43.146.8880 > 192.168.43.147.7772: UDP, length 120
02:20:26.345409 IP 192.168.43.146.8880 > 192.168.43.147.7772: UDP, length 120
02:20:26.346633 IP 192.168.43.124.8880 > 192.168.43.146.7771: UDP, length 120
02:20:26.346718 IP 192.168.43.124.8880 > 192.168.43.146.7771: UDP, length 120
02:20:26.346791 IP 192.168.43.124.8880 > 192.168.43.146.7771: UDP, length 120
02:20:26.395412 IP 192.168.43.146.8880 > 192.168.43.147.7772: UDP, length 120
02:20:26.445409 IP 192.168.43.146.8880 > 192.168.43.147.7772: UDP, length 120
02:20:26.494176 IP 192.168.43.124.8880 > 192.168.43.146.7771: UDP, length 120
02:20:26.494257 IP 192.168.43.124.8880 > 192.168.43.146.7771: UDP, length 120
02:20:26.494329 IP 192.168.43.124.8880 > 192.168.43.146.7771: UDP, length 120
02:20:26.495410 IP 192.168.43.146.8880 > 192.168.43.147.7772: UDP, length 120
02:20:26.545409 IP 192.168.43.146.8880 > 192.168.43.147.7772: UDP, length 120
02:20:26.595410 IP 192.168.43.146.8880 > 192.168.43.147.7772: UDP, length 120
02:20:26.645412 IP 192.168.43.146.8880 > 192.168.43.147.7772: UDP, length 120
02:20:26.645587 IP 192.168.43.124.8880 > 192.168.43.146.7771: UDP, length 120
02:20:26.645670 IP 192.168.43.124.8880 > 192.168.43.146.7771: UDP, length 120
02:20:26.645741 IP 192.168.43.124.8880 > 192.168.43.146.7771: UDP, length 120
02:20:26.695412 IP 192.168.43.146.8880 > 192.168.43.147.7772: UDP, length 120
02:20:26.745408 IP 192.168.43.146.8880 > 192.168.43.147.7772: UDP, length 120
02:20:26.793231 IP 192.168.43.124.8880 > 192.168.43.146.7771: UDP, length 120
02:20:26.793309 IP 192.168.43.124.8880 > 192.168.43.146.7771: UDP, length 120
02:20:26.793381 IP 192.168.43.124.8880 > 192.168.43.146.7771: UDP, length 120
02:20:26.795409 IP 192.168.43.146.8880 > 192.168.43.147.7772: UDP, length 120
02:20:26.845410 IP 192.168.43.146.8880 > 192.168.43.147.7772: UDP, length 120
02:20:26.895413 IP 192.168.43.146.8880 > 192.168.43.147.7772: UDP, length 120
02:20:26.939529 IP 192.168.43.124.8880 > 192.168.43.146.7771: UDP, length 120
02:20:26.939612 IP 192.168.43.124.8880 > 192.168.43.146.7771: UDP, length 120
02:20:26.939685 IP 192.168.43.124.8880 > 192.168.43.146.7771: UDP, length 120
02:20:26.945413 IP 192.168.43.146.8880 > 192.168.43.147.7772: UDP, length 120
02:20:26.995410 IP 192.168.43.146.8880 > 192.168.43.147.7772: UDP, length 120
02:20:27.045470 IP 192.168.43.146.8880 > 192.168.43.147.7772: UDP, length 120
02:20:27.083184 IP 192.168.43.124.8880 > 192.168.43.146.7771: UDP, length 120
02:20:27.083291 IP 192.168.43.124.8880 > 192.168.43.146.7771: UDP, length 120
02:20:27.083365 IP 192.168.43.124.8880 > 192.168.43.146.7771: UDP, length 120
02:20:27.095429 IP 192.168.43.146.8880 > 192.168.43.147.7772: UDP, length 120
02:20:27.145415 IP 192.168.43.146.8880 > 192.168.43.147.7772: UDP, length 120
02:20:27.195455 IP 192.168.43.146.8880 > 192.168.43.147.7772: UDP, length 120
02:20:27.245437 IP 192.168.43.146.8880 > 192.168.43.147.7772: UDP, length 120
02:20:27.289308 IP 192.168.43.124.8880 > 192.168.43.146.7771: UDP, length 120
02:20:27.289407 IP 192.168.43.124.8880 > 192.168.43.146.7771: UDP, length 120
02:20:27.290147 IP 192.168.43.124.8880 > 192.168.43.146.7771: UDP, length 120
02:20:27.295419 IP 192.168.43.146.8880 > 192.168.43.147.7772: UDP, length 120
02:20:27.345410 IP 192.168.43.146.8880 > 192.168.43.147.7772: UDP, length 120
02:20:27.395349 IP 192.168.43.124.8880 > 192.168.43.146.7771: UDP, length 120
02:20:27.395413 IP 192.168.43.146.8880 > 192.168.43.147.7772: UDP, length 120
02:20:27.395463 IP 192.168.43.124.8880 > 192.168.43.146.7771: UDP, length 120
02:20:27.395536 IP 192.168.43.124.8880 > 192.168.43.146.7771: UDP, length 120
02:20:27.445410 IP 192.168.43.146.8880 > 192.168.43.147.7772: UDP, length 120
02:20:27.495410 IP 192.168.43.146.8880 > 192.168.43.147.7772: UDP, length 120
02:20:27.545413 IP 192.168.43.146.8880 > 192.168.43.147.7772: UDP, length 120
02:20:27.545604 IP 192.168.43.124.8880 > 192.168.43.146.7771: UDP, length 120
02:20:27.545683 IP 192.168.43.124.8880 > 192.168.43.146.7771: UDP, length 120
02:20:27.545755 IP 192.168.43.124.8880 > 192.168.43.146.7771: UDP, length 120
02:20:27.595412 IP 192.168.43.146.8880 > 192.168.43.147.7772: UDP, length 120
02:20:27.645436 IP 192.168.43.146.8880 > 192.168.43.147.7772: UDP, length 120
02:20:27.695435 IP 192.168.43.146.8880 > 192.168.43.147.7772: UDP, length 120
02:20:27.697946 IP 192.168.43.124.8880 > 192.168.43.146.7771: UDP, length 120
02:20:27.698077 IP 192.168.43.124.8880 > 192.168.43.146.7771: UDP, length 120
02:20:27.698192 IP 192.168.43.124.8880 > 192.168.43.146.7771: UDP, length 120
02:20:27.745437 IP 192.168.43.146.8880 > 192.168.43.147.7772: UDP, length 120
02:20:27.795435 IP 192.168.43.146.8880 > 192.168.43.147.7772: UDP, length 120
02:20:27.835675 IP 192.168.43.124.8880 > 192.168.43.146.7771: UDP, length 120
02:20:27.835917 IP 192.168.43.124.8880 > 192.168.43.146.7771: UDP, length 120
02:20:27.836031 IP 192.168.43.124.8880 > 192.168.43.146.7771: UDP, length 120
02:20:27.845438 IP 192.168.43.146.8880 > 192.168.43.147.7772: UDP, length 120
02:20:27.895436 IP 192.168.43.146.8880 > 192.168.43.147.7772: UDP, length 120
02:20:27.945435 IP 192.168.43.146.8880 > 192.168.43.147.7772: UDP, length 120
02:20:27.990647 IP 192.168.43.124.8880 > 192.168.43.146.7771: UDP, length 120
02:20:27.990889 IP 192.168.43.124.8880 > 192.168.43.146.7771: UDP, length 120
02:20:27.991004 IP 192.168.43.124.8880 > 192.168.43.146.7771: UDP, length 120
02:20:27.995439 IP 192.168.43.146.8880 > 192.168.43.147.7772: UDP, length 120
02:20:28.046487 IP 192.168.43.146.8880 > 192.168.43.147.7772: UDP, length 120
02:20:28.095496 IP 192.168.43.146.8880 > 192.168.43.147.7772: UDP, length 120
02:20:28.145439 IP 192.168.43.146.8880 > 192.168.43.147.7772: UDP, length 120
02:20:28.148844 IP 192.168.43.124.8880 > 192.168.43.146.7771: UDP, length 120
02:20:28.149010 IP 192.168.43.124.8880 > 192.168.43.146.7771: UDP, length 120
02:20:28.149121 IP 192.168.43.124.8880 > 192.168.43.146.7771: UDP, length 120
02:20:28.195436 IP 192.168.43.146.8880 > 192.168.43.147.7772: UDP, length 120
02:20:28.245443 IP 192.168.43.146.8880 > 192.168.43.147.7772: UDP, length 120
02:20:28.295441 IP 192.168.43.146.8880 > 192.168.43.147.7772: UDP, length 120
02:20:28.295678 IP 192.168.43.124.8880 > 192.168.43.146.7771: UDP, length 120
02:20:28.295971 IP 192.168.43.124.8880 > 192.168.43.146.7771: UDP, length 120
02:20:28.296182 IP 192.168.43.124.8880 > 192.168.43.146.7771: UDP, length 120
02:20:28.345451 IP 192.168.43.146.8880 > 192.168.43.147.7772: UDP, length 120
02:20:28.395439 IP 192.168.43.146.8880 > 192.168.43.147.7772: UDP, length 120
02:20:28.445437 IP 192.168.43.146.8880 > 192.168.43.147.7772: UDP, length 120
02:20:28.473336 IP 192.168.43.124.8880 > 192.168.43.146.7771: UDP, length 120
02:20:28.473593 IP 192.168.43.124.8880 > 192.168.43.146.7771: UDP, length 120
02:20:28.473715 IP 192.168.43.124.8880 > 192.168.43.146.7771: UDP, length 120
02:20:28.495441 IP 192.168.43.146.8880 > 192.168.43.147.7772: UDP, length 120
02:20:28.545437 IP 192.168.43.146.8880 > 192.168.43.147.7772: UDP, length 120
02:20:28.579806 IP 192.168.43.124.8880 > 192.168.43.146.7771: UDP, length 120
02:20:28.580070 IP 192.168.43.124.8880 > 192.168.43.146.7771: UDP, length 120
02:20:28.580193 IP 192.168.43.124.8880 > 192.168.43.146.7771: UDP, length 120
02:20:28.595442 IP 192.168.43.146.8880 > 192.168.43.147.7772: UDP, length 120
02:20:28.645437 IP 192.168.43.146.8880 > 192.168.43.147.7772: UDP, length 120
02:20:28.695487 IP 192.168.43.146.8880 > 192.168.43.147.7772: UDP, length 120
02:20:28.742864 IP 192.168.43.124.8880 > 192.168.43.146.7771: UDP, length 120
02:20:28.743179 IP 192.168.43.124.8880 > 192.168.43.146.7771: UDP, length 120
02:20:28.743302 IP 192.168.43.124.8880 > 192.168.43.146.7771: UDP, length 120
02:20:28.745452 IP 192.168.43.146.8880 > 192.168.43.147.7772: UDP, length 120
02:20:28.795438 IP 192.168.43.146.8880 > 192.168.43.147.7772: UDP, length 120
02:20:28.845436 IP 192.168.43.146.8880 > 192.168.43.147.7772: UDP, length 120
02:20:28.883833 IP 192.168.43.124.8880 > 192.168.43.146.7771: UDP, length 120
02:20:28.884121 IP 192.168.43.124.8880 > 192.168.43.146.7771: UDP, length 120
02:20:28.884245 IP 192.168.43.124.8880 > 192.168.43.146.7771: UDP, length 120
02:20:28.895441 IP 192.168.43.146.8880 > 192.168.43.147.7772: UDP, length 120
02:20:28.945440 IP 192.168.43.146.8880 > 192.168.43.147.7772: UDP, length 120
02:20:28.995434 IP 192.168.43.146.8880 > 192.168.43.147.7772: UDP, length 120
02:20:29.033725 IP 192.168.43.124.8880 > 192.168.43.146.7771: UDP, length 120
02:20:29.033977 IP 192.168.43.124.8880 > 192.168.43.146.7771: UDP, length 120
02:20:29.034099 IP 192.168.43.124.8880 > 192.168.43.146.7771: UDP, length 120
02:20:29.045438 IP 192.168.43.146.8880 > 192.168.43.147.7772: UDP, length 120
02:20:29.095505 IP 192.168.43.146.8880 > 192.168.43.147.7772: UDP, length 120
02:20:29.145445 IP 192.168.43.146.8880 > 192.168.43.147.7772: UDP, length 120
02:20:29.185068 IP 192.168.43.124.8880 > 192.168.43.146.7771: UDP, length 120
02:20:29.185233 IP 192.168.43.124.8880 > 192.168.43.146.7771: UDP, length 120
02:20:29.185345 IP 192.168.43.124.8880 > 192.168.43.146.7771: UDP, length 120
02:20:29.195441 IP 192.168.43.146.8880 > 192.168.43.147.7772: UDP, length 120
02:20:29.239466 IP 192.168.43.124.8880 > 192.168.43.146.7771: UDP, length 120
02:20:29.245461 IP 192.168.43.146.8880 > 192.168.43.147.7772: UDP, length 120
02:20:29.282557 IP 192.168.43.124.8880 > 192.168.43.146.7771: UDP, length 120
02:20:29.295441 IP 192.168.43.146.8880 > 192.168.43.147.7772: UDP, length 120
02:20:29.342167 IP 192.168.43.124.8880 > 192.168.43.146.7771: UDP, length 120
02:20:29.345437 IP 192.168.43.146.8880 > 192.168.43.147.7772: UDP, length 120
02:20:29.382915 IP 192.168.43.124.8880 > 192.168.43.146.7771: UDP, length 120
02:20:29.395445 IP 192.168.43.146.8880 > 192.168.43.147.7772: UDP, length 120
02:20:29.428411 IP 192.168.43.124.8880 > 192.168.43.146.7771: UDP, length 120
02:20:29.445442 IP 192.168.43.146.8880 > 192.168.43.147.7772: UDP, length 120
02:20:29.492682 IP 192.168.43.124.8880 > 192.168.43.146.7771: UDP, length 120
02:20:29.495438 IP 192.168.43.146.8880 > 192.168.43.147.7772: UDP, length 120
02:20:29.528310 IP 192.168.43.124.8880 > 192.168.43.146.7771: UDP, length 120
02:20:29.545435 IP 192.168.43.146.8880 > 192.168.43.147.7772: UDP, length 120
02:20:29.578591 IP 192.168.43.124.8880 > 192.168.43.146.7771: UDP, length 120
02:20:29.595438 IP 192.168.43.146.8880 > 192.168.43.147.7772: UDP, length 120
02:20:29.643117 IP 192.168.43.124.8880 > 192.168.43.146.7771: UDP, length 120
02:20:29.645434 IP 192.168.43.146.8880 > 192.168.43.147.7772: UDP, length 120
02:20:29.678712 IP 192.168.43.124.8880 > 192.168.43.146.7771: UDP, length 120
02:20:29.695437 IP 192.168.43.146.8880 > 192.168.43.147.7772: UDP, length 120
02:20:29.726090 IP 192.168.43.124.8880 > 192.168.43.146.7771: UDP, length 120
02:20:29.745443 IP 192.168.43.146.8880 > 192.168.43.147.7772: UDP, length 120
02:20:29.780915 IP 192.168.43.124.8880 > 192.168.43.146.7771: UDP, length 120
02:20:29.795440 IP 192.168.43.146.8880 > 192.168.43.147.7772: UDP, length 120
02:20:29.834753 IP 192.168.43.124.8880 > 192.168.43.146.7771: UDP, length 120
02:20:29.845441 IP 192.168.43.146.8880 > 192.168.43.147.7772: UDP, length 120
02:20:29.879961 IP 192.168.43.124.8880 > 192.168.43.146.7771: UDP, length 120
02:20:29.895438 IP 192.168.43.146.8880 > 192.168.43.147.7772: UDP, length 120
02:20:29.928567 IP 192.168.43.124.8880 > 192.168.43.146.7771: UDP, length 120
02:20:29.945436 IP 192.168.43.146.8880 > 192.168.43.147.7772: UDP, length 120
02:20:29.988337 IP 192.168.43.124.8880 > 192.168.43.146.7771: UDP, length 120
02:20:29.995436 IP 192.168.43.146.8880 > 192.168.43.147.7772: UDP, length 120
02:20:30.029993 IP 192.168.43.124.8880 > 192.168.43.146.7771: UDP, length 120
02:20:30.045436 IP 192.168.43.146.8880 > 192.168.43.147.7772: UDP, length 120
02:20:30.083051 IP 192.168.43.124.8880 > 192.168.43.146.7771: UDP, length 120
02:20:30.095496 IP 192.168.43.146.8880 > 192.168.43.147.7772: UDP, length 120
02:20:30.128916 IP 192.168.43.124.8880 > 192.168.43.146.7771: UDP, length 120
02:20:30.145449 IP 192.168.43.146.8880 > 192.168.43.147.7772: UDP, length 120
02:20:30.187511 IP 192.168.43.124.8880 > 192.168.43.146.7771: UDP, length 120
02:20:30.195497 IP 192.168.43.146.8880 > 192.168.43.147.7772: UDP, length 120
02:20:30.229429 IP 192.168.43.124.8880 > 192.168.43.146.7771: UDP, length 120
02:20:30.245471 IP 192.168.43.146.8880 > 192.168.43.147.7772: UDP, length 120
02:20:30.289457 IP 192.168.43.124.8880 > 192.168.43.146.7771: UDP, length 120
02:20:30.295439 IP 192.168.43.146.8880 > 192.168.43.147.7772: UDP, length 120
02:20:30.330518 IP 192.168.43.124.8880 > 192.168.43.146.7771: UDP, length 120
02:20:30.345438 IP 192.168.43.146.8880 > 192.168.43.147.7772: UDP, length 120
02:20:30.378702 IP 192.168.43.124.8880 > 192.168.43.146.7771: UDP, length 120
02:20:30.395444 IP 192.168.43.146.8880 > 192.168.43.147.7772: UDP, length 120
02:20:30.443335 IP 192.168.43.124.8880 > 192.168.43.146.7771: UDP, length 120
02:20:30.445445 IP 192.168.43.146.8880 > 192.168.43.147.7772: UDP, length 120
02:20:30.479763 IP 192.168.43.124.8880 > 192.168.43.146.7771: UDP, length 120
02:20:30.495438 IP 192.168.43.146.8880 > 192.168.43.147.7772: UDP, length 120
02:20:30.531495 IP 192.168.43.124.8880 > 192.168.43.146.7771: UDP, length 120
02:20:30.546069 IP 192.168.43.146.8880 > 192.168.43.147.7772: UDP, length 120
02:20:30.593527 IP 192.168.43.124.8880 > 192.168.43.146.7771: UDP, length 120
02:20:30.595510 IP 192.168.43.146.8880 > 192.168.43.147.7772: UDP, length 120
02:20:30.629772 IP 192.168.43.124.8880 > 192.168.43.146.7771: UDP, length 120
02:20:30.645482 IP 192.168.43.146.8880 > 192.168.43.147.7772: UDP, length 120
02:20:30.678622 IP 192.168.43.124.8880 > 192.168.43.146.7771: UDP, length 120
