23:44:23.658683 IP 192.168.43.147.8880 > 192.168.43.124.7773: UDP, length 120
23:44:23.678928 IP 192.168.43.146.8880 > 192.168.43.147.7772: UDP, length 120
23:44:23.708829 IP 192.168.43.146.8880 > 192.168.43.147.7772: UDP, length 120
23:44:23.708967 IP 192.168.43.147.8880 > 192.168.43.124.7773: UDP, length 120
23:44:23.758717 IP 192.168.43.147.8880 > 192.168.43.124.7773: UDP, length 120
23:44:23.762118 IP 192.168.43.146.8880 > 192.168.43.147.7772: UDP, length 120
23:44:23.808861 IP 192.168.43.147.8880 > 192.168.43.124.7773: UDP, length 120
23:44:23.812026 IP 192.168.43.146.8880 > 192.168.43.147.7772: UDP, length 120
23:44:23.858716 IP 192.168.43.147.8880 > 192.168.43.124.7773: UDP, length 120
23:44:23.861118 IP 192.168.43.146.8880 > 192.168.43.147.7772: UDP, length 120
23:44:23.907262 IP 192.168.43.146.8880 > 192.168.43.147.7772: UDP, length 120
23:44:23.908744 IP 192.168.43.147.8880 > 192.168.43.124.7773: UDP, length 120
23:44:23.958717 IP 192.168.43.147.8880 > 192.168.43.124.7773: UDP, length 120
23:44:23.962112 IP 192.168.43.146.8880 > 192.168.43.147.7772: UDP, length 120
23:44:24.008718 IP 192.168.43.147.8880 > 192.168.43.124.7773: UDP, length 120
23:44:24.012069 IP 192.168.43.146.8880 > 192.168.43.147.7772: UDP, length 120
23:44:24.058721 IP 192.168.43.147.8880 > 192.168.43.124.7773: UDP, length 120
23:44:24.062119 IP 192.168.43.146.8880 > 192.168.43.147.7772: UDP, length 120
23:44:24.108719 IP 192.168.43.147.8880 > 192.168.43.124.7773: UDP, length 120
23:44:24.112114 IP 192.168.43.146.8880 > 192.168.43.147.7772: UDP, length 120
23:44:24.158719 IP 192.168.43.147.8880 > 192.168.43.124.7773: UDP, length 120
23:44:24.162116 IP 192.168.43.146.8880 > 192.168.43.147.7772: UDP, length 120
23:44:24.208716 IP 192.168.43.147.8880 > 192.168.43.124.7773: UDP, length 120
23:44:24.213059 IP 192.168.43.146.8880 > 192.168.43.147.7772: UDP, length 120
23:44:24.258717 IP 192.168.43.147.8880 > 192.168.43.124.7773: UDP, length 120
23:44:24.262110 IP 192.168.43.146.8880 > 192.168.43.147.7772: UDP, length 120
23:44:24.308714 IP 192.168.43.147.8880 > 192.168.43.124.7773: UDP, length 120
23:44:24.312132 IP 192.168.43.146.8880 > 192.168.43.147.7772: UDP, length 120
23:44:24.358717 IP 192.168.43.147.8880 > 192.168.43.124.7773: UDP, length 120
23:44:24.363046 IP 192.168.43.146.8880 > 192.168.43.147.7772: UDP, length 120
23:44:24.408716 IP 192.168.43.147.8880 > 192.168.43.124.7773: UDP, length 120
23:44:24.411368 IP 192.168.43.146.8880 > 192.168.43.147.7772: UDP, length 120
23:44:24.458715 IP 192.168.43.147.8880 > 192.168.43.124.7773: UDP, length 120
23:44:24.462122 IP 192.168.43.146.8880 > 192.168.43.147.7772: UDP, length 120
23:44:24.508724 IP 192.168.43.147.8880 > 192.168.43.124.7773: UDP, length 120
23:44:24.511044 IP 192.168.43.146.8880 > 192.168.43.147.7772: UDP, length 120
23:44:24.558722 IP 192.168.43.147.8880 > 192.168.43.124.7773: UDP, length 120
23:44:24.561648 IP 192.168.43.146.8880 > 192.168.43.147.7772: UDP, length 120
23:44:24.608719 IP 192.168.43.147.8880 > 192.168.43.124.7773: UDP, length 120
23:44:24.610680 IP 192.168.43.146.8880 > 192.168.43.147.7772: UDP, length 120
23:44:24.658715 IP 192.168.43.147.8880 > 192.168.43.124.7773: UDP, length 120
23:44:24.661314 IP 192.168.43.146.8880 > 192.168.43.147.7772: UDP, length 120
23:44:24.708715 IP 192.168.43.147.8880 > 192.168.43.124.7773: UDP, length 120
23:44:24.713010 IP 192.168.43.146.8880 > 192.168.43.147.7772: UDP, length 120
23:44:24.758714 IP 192.168.43.147.8880 > 192.168.43.124.7773: UDP, length 120
23:44:24.761551 IP 192.168.43.146.8880 > 192.168.43.147.7772: UDP, length 120
23:44:24.808715 IP 192.168.43.147.8880 > 192.168.43.124.7773: UDP, length 120
23:44:24.811179 IP 192.168.43.146.8880 > 192.168.43.147.7772: UDP, length 120
23:44:24.858716 IP 192.168.43.147.8880 > 192.168.43.124.7773: UDP, length 120
23:44:24.871495 IP 192.168.43.146.8880 > 192.168.43.147.7772: UDP, length 120
23:44:24.908745 IP 192.168.43.147.8880 > 192.168.43.124.7773: UDP, length 120
23:44:24.915180 IP 192.168.43.146.8880 > 192.168.43.147.7772: UDP, length 120
23:44:24.958768 IP 192.168.43.147.8880 > 192.168.43.124.7773: UDP, length 120
23:44:24.961436 IP 192.168.43.146.8880 > 192.168.43.147.7772: UDP, length 120
23:44:25.008724 IP 192.168.43.147.8880 > 192.168.43.124.7773: UDP, length 120
23:44:25.012172 IP 192.168.43.146.8880 > 192.168.43.147.7772: UDP, length 120
23:44:25.058717 IP 192.168.43.147.8880 > 192.168.43.124.7773: UDP, length 120
23:44:25.062159 IP 192.168.43.146.8880 > 192.168.43.147.7772: UDP, length 120
23:44:25.108720 IP 192.168.43.147.8880 > 192.168.43.124.7773: UDP, length 120
23:44:25.113275 IP 192.168.43.146.8880 > 192.168.43.147.7772: UDP, length 120
23:44:25.158718 IP 192.168.43.147.8880 > 192.168.43.124.7773: UDP, length 120
23:44:25.163211 IP 192.168.43.146.8880 > 192.168.43.147.7772: UDP, length 120
23:44:25.208716 IP 192.168.43.147.8880 > 192.168.43.124.7773: UDP, length 120
23:44:25.210884 IP 192.168.43.146.8880 > 192.168.43.147.7772: UDP, length 120
23:44:25.258716 IP 192.168.43.147.8880 > 192.168.43.124.7773: UDP, length 120
23:44:25.282783 IP 192.168.43.146.8880 > 192.168.43.147.7772: UDP, length 120
23:44:25.308716 IP 192.168.43.147.8880 > 192.168.43.124.7773: UDP, length 120
23:44:25.314908 IP 192.168.43.146.8880 > 192.168.43.147.7772: UDP, length 120
23:44:25.358716 IP 192.168.43.147.8880 > 192.168.43.124.7773: UDP, length 120
23:44:25.362160 IP 192.168.43.146.8880 > 192.168.43.147.7772: UDP, length 120
23:44:25.408727 IP 192.168.43.147.8880 > 192.168.43.124.7773: UDP, length 120
23:44:25.417489 IP 192.168.43.146.8880 > 192.168.43.147.7772: UDP, length 120
23:44:25.458721 IP 192.168.43.147.8880 > 192.168.43.124.7773: UDP, length 120
23:44:25.461417 IP 192.168.43.146.8880 > 192.168.43.147.7772: UDP, length 120
23:44:25.508716 IP 192.168.43.147.8880 > 192.168.43.124.7773: UDP, length 120
23:44:25.512163 IP 192.168.43.146.8880 > 192.168.43.147.7772: UDP, length 120
23:44:25.558734 IP 192.168.43.147.8880 > 192.168.43.124.7773: UDP, length 120
23:44:25.563447 IP 192.168.43.146.8880 > 192.168.43.147.7772: UDP, length 120
23:44:25.608721 IP 192.168.43.147.8880 > 192.168.43.124.7773: UDP, length 120
23:44:25.611215 IP 192.168.43.146.8880 > 192.168.43.147.7772: UDP, length 120
23:44:25.658729 IP 192.168.43.147.8880 > 192.168.43.124.7773: UDP, length 120
23:44:25.661340 IP 192.168.43.146.8880 > 192.168.43.147.7772: UDP, length 120
23:44:25.708719 IP 192.168.43.147.8880 > 192.168.43.124.7773: UDP, length 120
23:44:25.712137 IP 192.168.43.146.8880 > 192.168.43.147.7772: UDP, length 120
23:44:25.758718 IP 192.168.43.147.8880 > 192.168.43.124.7773: UDP, length 120
23:44:25.762132 IP 192.168.43.146.8880 > 192.168.43.147.7772: UDP, length 120
23:44:25.808717 IP 192.168.43.147.8880 > 192.168.43.124.7773: UDP, length 120
23:44:25.812108 IP 192.168.43.146.8880 > 192.168.43.147.7772: UDP, length 120
23:44:25.858716 IP 192.168.43.147.8880 > 192.168.43.124.7773: UDP, length 120
23:44:25.862118 IP 192.168.43.146.8880 > 192.168.43.147.7772: UDP, length 120
23:44:25.906376 IP 192.168.43.146.8880 > 192.168.43.147.7772: UDP, length 120
23:44:25.908735 IP 192.168.43.147.8880 > 192.168.43.124.7773: UDP, length 120
23:44:25.958717 IP 192.168.43.147.8880 > 192.168.43.124.7773: UDP, length 120
23:44:25.961119 IP 192.168.43.146.8880 > 192.168.43.147.7772: UDP, length 120
23:44:26.008716 IP 192.168.43.147.8880 > 192.168.43.124.7773: UDP, length 120
23:44:26.011644 IP 192.168.43.146.8880 > 192.168.43.147.7772: UDP, length 120
23:44:26.058717 IP 192.168.43.147.8880 > 192.168.43.124.7773: UDP, length 120
23:44:26.062118 IP 192.168.43.146.8880 > 192.168.43.147.7772: UDP, length 120
23:44:26.108719 IP 192.168.43.147.8880 > 192.168.43.124.7773: UDP, length 120
23:44:26.112124 IP 192.168.43.146.8880 > 192.168.43.147.7772: UDP, length 120
23:44:26.158717 IP 192.168.43.147.8880 > 192.168.43.124.7773: UDP, length 120
23:44:26.161641 IP 192.168.43.146.8880 > 192.168.43.147.7772: UDP, length 120
23:44:26.208732 IP 192.168.43.147.8880 > 192.168.43.124.7773: UDP, length 120
23:44:26.212153 IP 192.168.43.146.8880 > 192.168.43.147.7772: UDP, length 120
23:44:26.258719 IP 192.168.43.147.8880 > 192.168.43.124.7773: UDP, length 120
23:44:26.264489 IP 192.168.43.146.8880 > 192.168.43.147.7772: UDP, length 120
23:44:26.308717 IP 192.168.43.147.8880 > 192.168.43.124.7773: UDP, length 120
23:44:26.312126 IP 192.168.43.146.8880 > 192.168.43.147.7772: UDP, length 120
23:44:26.358722 IP 192.168.43.147.8880 > 192.168.43.124.7773: UDP, length 120
23:44:26.363346 IP 192.168.43.146.8880 > 192.168.43.147.7772: UDP, length 120
23:44:26.408718 IP 192.168.43.147.8880 > 192.168.43.124.7773: UDP, length 120
23:44:26.412121 IP 192.168.43.146.8880 > 192.168.43.147.7772: UDP, length 120
23:44:26.458767 IP 192.168.43.147.8880 > 192.168.43.124.7773: UDP, length 120
23:44:26.462213 IP 192.168.43.146.8880 > 192.168.43.147.7772: UDP, length 120
23:44:26.508724 IP 192.168.43.147.8880 > 192.168.43.124.7773: UDP, length 120
23:44:26.511712 IP 192.168.43.146.8880 > 192.168.43.147.7772: UDP, length 120
23:44:26.558719 IP 192.168.43.147.8880 > 192.168.43.124.7773: UDP, length 120
23:44:26.562128 IP 192.168.43.146.8880 > 192.168.43.147.7772: UDP, length 120
23:44:26.608718 IP 192.168.43.147.8880 > 192.168.43.124.7773: UDP, length 120
23:44:26.615674 IP 192.168.43.146.8880 > 192.168.43.147.7772: UDP, length 120
23:44:26.658732 IP 192.168.43.147.8880 > 192.168.43.124.7773: UDP, length 120
23:44:26.661301 IP 192.168.43.146.8880 > 192.168.43.147.7772: UDP, length 120
23:44:26.708730 IP 192.168.43.147.8880 > 192.168.43.124.7773: UDP, length 120
23:44:26.712177 IP 192.168.43.146.8880 > 192.168.43.147.7772: UDP, length 120
23:44:26.758718 IP 192.168.43.147.8880 > 192.168.43.124.7773: UDP, length 120
23:44:26.761551 IP 192.168.43.146.8880 > 192.168.43.147.7772: UDP, length 120
23:44:26.808715 IP 192.168.43.147.8880 > 192.168.43.124.7773: UDP, length 120
23:44:26.811105 IP 192.168.43.146.8880 > 192.168.43.147.7772: UDP, length 120
23:44:26.858718 IP 192.168.43.147.8880 > 192.168.43.124.7773: UDP, length 120
23:44:26.861449 IP 192.168.43.146.8880 > 192.168.43.147.7772: UDP, length 120
23:44:26.908746 IP 192.168.43.147.8880 > 192.168.43.124.7773: UDP, length 120
23:44:26.908812 IP 192.168.43.146.8880 > 192.168.43.147.7772: UDP, length 120
23:44:26.958725 IP 192.168.43.147.8880 > 192.168.43.124.7773: UDP, length 120
23:44:26.961503 IP 192.168.43.146.8880 > 192.168.43.147.7772: UDP, length 120
23:44:27.008354 IP 192.168.43.146.8880 > 192.168.43.147.7772: UDP, length 120
23:44:27.008719 IP 192.168.43.147.8880 > 192.168.43.124.7773: UDP, length 120
23:44:27.058713 IP 192.168.43.147.8880 > 192.168.43.124.7773: UDP, length 120
23:44:27.061057 IP 192.168.43.146.8880 > 192.168.43.147.7772: UDP, length 120
23:44:27.108717 IP 192.168.43.147.8880 > 192.168.43.124.7773: UDP, length 120
23:44:27.111690 IP 192.168.43.146.8880 > 192.168.43.147.7772: UDP, length 120
23:44:27.158716 IP 192.168.43.147.8880 > 192.168.43.124.7773: UDP, length 120
23:44:27.162069 IP 192.168.43.146.8880 > 192.168.43.147.7772: UDP, length 120
23:44:27.208715 IP 192.168.43.147.8880 > 192.168.43.124.7773: UDP, length 120
23:44:27.212142 IP 192.168.43.146.8880 > 192.168.43.147.7772: UDP, length 120
23:44:27.258720 IP 192.168.43.147.8880 > 192.168.43.124.7773: UDP, length 120
23:44:27.262149 IP 192.168.43.146.8880 > 192.168.43.147.7772: UDP, length 120
23:44:27.308715 IP 192.168.43.147.8880 > 192.168.43.124.7773: UDP, length 120
23:44:27.315195 IP 192.168.43.146.8880 > 192.168.43.147.7772: UDP, length 120
23:44:27.358715 IP 192.168.43.147.8880 > 192.168.43.124.7773: UDP, length 120
23:44:27.362785 IP 192.168.43.146.8880 > 192.168.43.147.7772: UDP, length 120
23:44:27.408722 IP 192.168.43.147.8880 > 192.168.43.124.7773: UDP, length 120
23:44:27.408882 IP 192.168.43.146.8880 > 192.168.43.147.7772: UDP, length 120
23:44:27.458726 IP 192.168.43.147.8880 > 192.168.43.124.7773: UDP, length 120
23:44:27.462153 IP 192.168.43.146.8880 > 192.168.43.147.7772: UDP, length 120
23:44:27.508716 IP 192.168.43.147.8880 > 192.168.43.124.7773: UDP, length 120
23:44:27.511446 IP 192.168.43.146.8880 > 192.168.43.147.7772: UDP, length 120
23:44:27.558714 IP 192.168.43.147.8880 > 192.168.43.124.7773: UDP, length 120
23:44:27.569909 IP 192.168.43.146.8880 > 192.168.43.147.7772: UDP, length 120
23:44:27.608719 IP 192.168.43.147.8880 > 192.168.43.124.7773: UDP, length 120
23:44:27.632051 IP 192.168.43.146.8880 > 192.168.43.147.7772: UDP, length 120
23:44:27.658718 IP 192.168.43.147.8880 > 192.168.43.124.7773: UDP, length 120
23:44:27.662112 IP 192.168.43.146.8880 > 192.168.43.147.7772: UDP, length 120
23:44:27.708740 IP 192.168.43.147.8880 > 192.168.43.124.7773: UDP, length 120
23:44:27.736360 IP 192.168.43.146.8880 > 192.168.43.147.7772: UDP, length 120
23:44:27.758725 IP 192.168.43.147.8880 > 192.168.43.124.7773: UDP, length 120
23:44:27.783765 IP 192.168.43.146.8880 > 192.168.43.147.7772: UDP, length 120
23:44:27.808716 IP 192.168.43.147.8880 > 192.168.43.124.7773: UDP, length 120
23:44:27.858712 IP 192.168.43.147.8880 > 192.168.43.124.7773: UDP, length 120
23:44:27.908728 IP 192.168.43.147.8880 > 192.168.43.124.7773: UDP, length 120
23:44:27.951796 IP 192.168.43.146.8880 > 192.168.43.147.7772: UDP, length 120
23:44:27.952045 IP 192.168.43.146.8880 > 192.168.43.147.7772: UDP, length 120
23:44:27.952156 IP 192.168.43.146.8880 > 192.168.43.147.7772: UDP, length 120
23:44:27.958236 IP 192.168.43.146.8880 > 192.168.43.147.7772: UDP, length 120
23:44:27.958761 IP 192.168.43.147.8880 > 192.168.43.124.7773: UDP, length 120
23:44:28.008717 IP 192.168.43.147.8880 > 192.168.43.124.7773: UDP, length 120
23:44:28.012111 IP 192.168.43.146.8880 > 192.168.43.147.7772: UDP, length 120
23:44:28.058718 IP 192.168.43.147.8880 > 192.168.43.124.7773: UDP, length 120
23:44:28.060275 IP 192.168.43.146.8880 > 192.168.43.147.7772: UDP, length 120
23:44:28.108717 IP 192.168.43.147.8880 > 192.168.43.124.7773: UDP, length 120
23:44:28.110669 IP 192.168.43.146.8880 > 192.168.43.147.7772: UDP, length 120
23:44:28.158716 IP 192.168.43.147.8880 > 192.168.43.124.7773: UDP, length 120
23:44:28.161106 IP 192.168.43.146.8880 > 192.168.43.147.7772: UDP, length 120
23:44:28.208715 IP 192.168.43.147.8880 > 192.168.43.124.7773: UDP, length 120
23:44:28.211309 IP 192.168.43.146.8880 > 192.168.43.147.7772: UDP, length 120
23:44:28.258717 IP 192.168.43.147.8880 > 192.168.43.124.7773: UDP, length 120
23:44:28.262119 IP 192.168.43.146.8880 > 192.168.43.147.7772: UDP, length 120
23:44:28.308716 IP 192.168.43.147.8880 > 192.168.43.124.7773: UDP, length 120
23:44:28.312106 IP 192.168.43.146.8880 > 192.168.43.147.7772: UDP, length 120
23:44:28.358719 IP 192.168.43.147.8880 > 192.168.43.124.7773: UDP, length 120
23:44:28.362152 IP 192.168.43.146.8880 > 192.168.43.147.7772: UDP, length 120
23:44:28.408717 IP 192.168.43.147.8880 > 192.168.43.124.7773: UDP, length 120
23:44:28.414346 IP 192.168.43.146.8880 > 192.168.43.147.7772: UDP, length 120
23:44:28.458715 IP 192.168.43.147.8880 > 192.168.43.124.7773: UDP, length 120
23:44:28.462105 IP 192.168.43.146.8880 > 192.168.43.147.7772: UDP, length 120
23:44:28.508716 IP 192.168.43.147.8880 > 192.168.43.124.7773: UDP, length 120
23:44:28.512104 IP 192.168.43.146.8880 > 192.168.43.147.7772: UDP, length 120
23:44:28.558717 IP 192.168.43.147.8880 > 192.168.43.124.7773: UDP, length 120
23:44:28.562718 IP 192.168.43.146.8880 > 192.168.43.147.7772: UDP, length 120
23:44:28.608718 IP 192.168.43.147.8880 > 192.168.43.124.7773: UDP, length 120
23:44:28.612110 IP 192.168.43.146.8880 > 192.168.43.147.7772: UDP, length 120
23:44:28.658722 IP 192.168.43.147.8880 > 192.168.43.124.7773: UDP, length 120
23:44:28.663625 IP 192.168.43.146.8880 > 192.168.43.147.7772: UDP, length 120
23:44:28.708732 IP 192.168.43.147.8880 > 192.168.43.124.7773: UDP, length 120
23:44:28.712130 IP 192.168.43.146.8880 > 192.168.43.147.7772: UDP, length 120
23:44:28.758727 IP 192.168.43.147.8880 > 192.168.43.124.7773: UDP, length 120
23:44:28.762122 IP 192.168.43.146.8880 > 192.168.43.147.7772: UDP, length 120
23:44:28.808738 IP 192.168.43.147.8880 > 192.168.43.124.7773: UDP, length 120
23:44:28.812145 IP 192.168.43.146.8880 > 192.168.43.147.7772: UDP, length 120
23:44:28.858735 IP 192.168.43.147.8880 > 192.168.43.124.7773: UDP, length 120
23:44:28.861806 IP 192.168.43.146.8880 > 192.168.43.147.7772: UDP, length 120
23:44:28.908742 IP 192.168.43.147.8880 > 192.168.43.124.7773: UDP, length 120
23:44:28.909984 IP 192.168.43.146.8880 > 192.168.43.147.7772: UDP, length 120
23:44:28.958721 IP 192.168.43.147.8880 > 192.168.43.124.7773: UDP, length 120
23:44:28.961086 IP 192.168.43.146.8880 > 192.168.43.147.7772: UDP, length 120
23:44:29.008719 IP 192.168.43.147.8880 > 192.168.43.124.7773: UDP, length 120
23:44:29.016716 IP 192.168.43.146.8880 > 192.168.43.147.7772: UDP, length 120
23:44:29.058716 IP 192.168.43.147.8880 > 192.168.43.124.7773: UDP, length 120
23:44:29.061380 IP 192.168.43.146.8880 > 192.168.43.147.7772: UDP, length 120
23:44:29.108717 IP 192.168.43.147.8880 > 192.168.43.124.7773: UDP, length 120
23:44:29.158715 IP 192.168.43.147.8880 > 192.168.43.124.7773: UDP, length 120
23:44:29.162135 IP 192.168.43.146.8880 > 192.168.43.147.7772: UDP, length 120
23:44:29.162259 IP 192.168.43.146.8880 > 192.168.43.147.7772: UDP, length 120
23:44:29.208715 IP 192.168.43.147.8880 > 192.168.43.124.7773: UDP, length 120
23:44:29.211266 IP 192.168.43.146.8880 > 192.168.43.147.7772: UDP, length 120
23:44:29.258765 IP 192.168.43.147.8880 > 192.168.43.124.7773: UDP, length 120
23:44:29.261915 IP 192.168.43.146.8880 > 192.168.43.147.7772: UDP, length 120
23:44:29.308716 IP 192.168.43.147.8880 > 192.168.43.124.7773: UDP, length 120
23:44:29.311571 IP 192.168.43.146.8880 > 192.168.43.147.7772: UDP, length 120
23:44:29.358718 IP 192.168.43.147.8880 > 192.168.43.124.7773: UDP, length 120
23:44:29.362121 IP 192.168.43.146.8880 > 192.168.43.147.7772: UDP, length 120
23:44:29.408717 IP 192.168.43.147.8880 > 192.168.43.124.7773: UDP, length 120
23:44:29.413461 IP 192.168.43.146.8880 > 192.168.43.147.7772: UDP, length 120
23:44:29.458764 IP 192.168.43.147.8880 > 192.168.43.124.7773: UDP, length 120
23:44:29.464951 IP 192.168.43.146.8880 > 192.168.43.147.7772: UDP, length 120
23:44:29.508736 IP 192.168.43.147.8880 > 192.168.43.124.7773: UDP, length 120
23:44:29.511747 IP 192.168.43.146.8880 > 192.168.43.147.7772: UDP, length 120
23:44:29.558721 IP 192.168.43.147.8880 > 192.168.43.124.7773: UDP, length 120
23:44:29.561856 IP 192.168.43.146.8880 > 192.168.43.147.7772: UDP, length 120
23:44:29.608146 IP 192.168.43.146.8880 > 192.168.43.147.7772: UDP, length 120
23:44:29.608717 IP 192.168.43.147.8880 > 192.168.43.124.7773: UDP, length 120
23:44:29.658715 IP 192.168.43.147.8880 > 192.168.43.124.7773: UDP, length 120
23:44:29.662123 IP 192.168.43.146.8880 > 192.168.43.147.7772: UDP, length 120
23:44:29.708739 IP 192.168.43.147.8880 > 192.168.43.124.7773: UDP, length 120
23:44:29.712118 IP 192.168.43.146.8880 > 192.168.43.147.7772: UDP, length 120
23:44:29.758721 IP 192.168.43.147.8880 > 192.168.43.124.7773: UDP, length 120
23:44:29.761111 IP 192.168.43.146.8880 > 192.168.43.147.7772: UDP, length 120
23:44:29.808732 IP 192.168.43.147.8880 > 192.168.43.124.7773: UDP, length 120
23:44:29.812141 IP 192.168.43.146.8880 > 192.168.43.147.7772: UDP, length 120
23:44:29.858729 IP 192.168.43.147.8880 > 192.168.43.124.7773: UDP, length 120
23:44:29.862119 IP 192.168.43.146.8880 > 192.168.43.147.7772: UDP, length 120
23:44:29.908742 IP 192.168.43.147.8880 > 192.168.43.124.7773: UDP, length 120
23:44:29.913980 IP 192.168.43.146.8880 > 192.168.43.147.7772: UDP, length 120
23:44:29.958742 IP 192.168.43.147.8880 > 192.168.43.124.7773: UDP, length 120
23:44:29.961240 IP 192.168.43.146.8880 > 192.168.43.147.7772: UDP, length 120
23:44:30.008721 IP 192.168.43.147.8880 > 192.168.43.124.7773: UDP, length 120
23:44:30.012111 IP 192.168.43.146.8880 > 192.168.43.147.7772: UDP, length 120
23:44:30.058723 IP 192.168.43.147.8880 > 192.168.43.124.7773: UDP, length 120
23:44:30.062127 IP 192.168.43.146.8880 > 192.168.43.147.7772: UDP, length 120
23:44:30.108717 IP 192.168.43.147.8880 > 192.168.43.124.7773: UDP, length 120
23:44:30.111563 IP 192.168.43.146.8880 > 192.168.43.147.7772: UDP, length 120
23:44:30.158716 IP 192.168.43.147.8880 > 192.168.43.124.7773: UDP, length 120
23:44:30.161267 IP 192.168.43.146.8880 > 192.168.43.147.7772: UDP, length 120
23:44:30.208721 IP 192.168.43.147.8880 > 192.168.43.124.7773: UDP, length 120
23:44:30.211203 IP 192.168.43.146.8880 > 192.168.43.147.7772: UDP, length 120
23:44:30.258720 IP 192.168.43.147.8880 > 192.168.43.124.7773: UDP, length 120
23:44:30.259899 IP 192.168.43.146.8880 > 192.168.43.147.7772: UDP, length 120
23:44:30.308724 IP 192.168.43.147.8880 > 192.168.43.124.7773: UDP, length 120
23:44:30.309432 IP 192.168.43.146.8880 > 192.168.43.147.7772: UDP, length 120
23:44:30.358721 IP 192.168.43.147.8880 > 192.168.43.124.7773: UDP, length 120
23:44:30.362117 IP 192.168.43.146.8880 > 192.168.43.147.7772: UDP, length 120
23:44:30.408718 IP 192.168.43.147.8880 > 192.168.43.124.7773: UDP, length 120
23:44:30.412114 IP 192.168.43.146.8880 > 192.168.43.147.7772: UDP, length 120
23:44:30.458716 IP 192.168.43.147.8880 > 192.168.43.124.7773: UDP, length 120
23:44:30.462111 IP 192.168.43.146.8880 > 192.168.43.147.7772: UDP, length 120
23:44:30.508715 IP 192.168.43.147.8880 > 192.168.43.124.7773: UDP, length 120
23:44:30.512167 IP 192.168.43.146.8880 > 192.168.43.147.7772: UDP, length 120
23:44:30.558717 IP 192.168.43.147.8880 > 192.168.43.124.7773: UDP, length 120
23:44:30.562115 IP 192.168.43.146.8880 > 192.168.43.147.7772: UDP, length 120
23:44:30.608717 IP 192.168.43.147.8880 > 192.168.43.124.7773: UDP, length 120
23:44:30.612113 IP 192.168.43.146.8880 > 192.168.43.147.7772: UDP, length 120
23:44:30.658713 IP 192.168.43.147.8880 > 192.168.43.124.7773: UDP, length 120
23:44:30.661283 IP 192.168.43.146.8880 > 192.168.43.147.7772: UDP, length 120
23:44:30.708715 IP 192.168.43.147.8880 > 192.168.43.124.7773: UDP, length 120
23:44:30.716721 IP 192.168.43.146.8880 > 192.168.43.147.7772: UDP, length 120
23:44:30.758715 IP 192.168.43.147.8880 > 192.168.43.124.7773: UDP, length 120
23:44:30.762110 IP 192.168.43.146.8880 > 192.168.43.147.7772: UDP, length 120
23:44:30.808715 IP 192.168.43.147.8880 > 192.168.43.124.7773: UDP, length 120
23:44:30.812109 IP 192.168.43.146.8880 > 192.168.43.147.7772: UDP, length 120
23:44:30.858716 IP 192.168.43.147.8880 > 192.168.43.124.7773: UDP, length 120
23:44:30.862112 IP 192.168.43.146.8880 > 192.168.43.147.7772: UDP, length 120
23:44:30.908742 IP 192.168.43.147.8880 > 192.168.43.124.7773: UDP, length 120
23:44:30.913582 IP 192.168.43.146.8880 > 192.168.43.147.7772: UDP, length 120
23:44:30.958773 IP 192.168.43.147.8880 > 192.168.43.124.7773: UDP, length 120
23:44:30.961379 IP 192.168.43.146.8880 > 192.168.43.147.7772: UDP, length 120
23:44:31.008724 IP 192.168.43.147.8880 > 192.168.43.124.7773: UDP, length 120
23:44:31.011694 IP 192.168.43.146.8880 > 192.168.43.147.7772: UDP, length 120
23:44:31.058715 IP 192.168.43.147.8880 > 192.168.43.124.7773: UDP, length 120
23:44:31.061129 IP 192.168.43.146.8880 > 192.168.43.147.7772: UDP, length 120
23:44:31.108715 IP 192.168.43.147.8880 > 192.168.43.124.7773: UDP, length 120
23:44:31.111441 IP 192.168.43.146.8880 > 192.168.43.147.7772: UDP, length 120
23:44:31.158715 IP 192.168.43.147.8880 > 192.168.43.124.7773: UDP, length 120
23:44:31.161631 IP 192.168.43.146.8880 > 192.168.43.147.7772: UDP, length 120
23:44:31.207984 IP 192.168.43.146.8880 > 192.168.43.147.7772: UDP, length 120
23:44:31.208737 IP 192.168.43.147.8880 > 192.168.43.124.7773: UDP, length 120
23:44:31.258718 IP 192.168.43.147.8880 > 192.168.43.124.7773: UDP, length 120
23:44:31.261283 IP 192.168.43.146.8880 > 192.168.43.147.7772: UDP, length 120
23:44:31.308718 IP 192.168.43.147.8880 > 192.168.43.124.7773: UDP, length 120
23:44:31.312612 IP 192.168.43.146.8880 > 192.168.43.147.7772: UDP, length 120
23:44:31.358715 IP 192.168.43.147.8880 > 192.168.43.124.7773: UDP, length 120
23:44:31.362105 IP 192.168.43.146.8880 > 192.168.43.147.7772: UDP, length 120
23:44:31.408722 IP 192.168.43.147.8880 > 192.168.43.124.7773: UDP, length 120
23:44:31.412123 IP 192.168.43.146.8880 > 192.168.43.147.7772: UDP, length 120
23:44:31.458717 IP 192.168.43.147.8880 > 192.168.43.124.7773: UDP, length 120
23:44:31.462109 IP 192.168.43.146.8880 > 192.168.43.147.7772: UDP, length 120
23:44:31.508716 IP 192.168.43.147.8880 > 192.168.43.124.7773: UDP, length 120
23:44:31.512280 IP 192.168.43.146.8880 > 192.168.43.147.7772: UDP, length 120
23:44:31.558828 IP 192.168.43.147.8880 > 192.168.43.124.7773: UDP, length 120
23:44:31.561499 IP 192.168.43.146.8880 > 192.168.43.147.7772: UDP, length 120
23:44:31.608718 IP 192.168.43.147.8880 > 192.168.43.124.7773: UDP, length 120
23:44:31.614302 IP 192.168.43.146.8880 > 192.168.43.147.7772: UDP, length 120
23:44:31.658716 IP 192.168.43.147.8880 > 192.168.43.124.7773: UDP, length 120
23:44:31.682391 IP 192.168.43.146.8880 > 192.168.43.147.7772: UDP, length 120
23:44:31.708719 IP 192.168.43.147.8880 > 192.168.43.124.7773: UDP, length 120
23:44:31.716950 IP 192.168.43.146.8880 > 192.168.43.147.7772: UDP, length 120
23:44:31.758716 IP 192.168.43.147.8880 > 192.168.43.124.7773: UDP, length 120
23:44:31.759540 IP 192.168.43.146.8880 > 192.168.43.147.7772: UDP, length 120
23:44:31.808721 IP 192.168.43.147.8880 > 192.168.43.124.7773: UDP, length 120
23:44:31.811408 IP 192.168.43.146.8880 > 192.168.43.147.7772: UDP, length 120
23:44:31.858718 IP 192.168.43.147.8880 > 192.168.43.124.7773: UDP, length 120
23:44:31.862111 IP 192.168.43.146.8880 > 192.168.43.147.7772: UDP, length 120
23:44:31.908740 IP 192.168.43.147.8880 > 192.168.43.124.7773: UDP, length 120
23:44:31.914583 IP 192.168.43.146.8880 > 192.168.43.147.7772: UDP, length 120
23:44:31.958727 IP 192.168.43.147.8880 > 192.168.43.124.7773: UDP, length 120
23:44:31.961146 IP 192.168.43.146.8880 > 192.168.43.147.7772: UDP, length 120
23:44:32.008720 IP 192.168.43.147.8880 > 192.168.43.124.7773: UDP, length 120
23:44:32.011418 IP 192.168.43.146.8880 > 192.168.43.147.7772: UDP, length 120
23:44:32.058729 IP 192.168.43.147.8880 > 192.168.43.124.7773: UDP, length 120
23:44:32.062137 IP 192.168.43.146.8880 > 192.168.43.147.7772: UDP, length 120
23:44:32.108719 IP 192.168.43.147.8880 > 192.168.43.124.7773: UDP, length 120
23:44:32.110739 IP 192.168.43.146.8880 > 192.168.43.147.7772: UDP, length 120
23:44:32.158718 IP 192.168.43.147.8880 > 192.168.43.124.7773: UDP, length 120
23:44:32.161304 IP 192.168.43.146.8880 > 192.168.43.147.7772: UDP, length 120
23:44:32.208715 IP 192.168.43.147.8880 > 192.168.43.124.7773: UDP, length 120
23:44:32.211680 IP 192.168.43.146.8880 > 192.168.43.147.7772: UDP, length 120
23:44:32.258728 IP 192.168.43.147.8880 > 192.168.43.124.7773: UDP, length 120
23:44:32.264395 IP 192.168.43.146.8880 > 192.168.43.147.7772: UDP, length 120
23:44:32.308719 IP 192.168.43.147.8880 > 192.168.43.124.7773: UDP, length 120
23:44:32.311284 IP 192.168.43.146.8880 > 192.168.43.147.7772: UDP, length 120
23:44:32.358716 IP 192.168.43.147.8880 > 192.168.43.124.7773: UDP, length 120
23:44:32.361265 IP 192.168.43.146.8880 > 192.168.43.147.7772: UDP, length 120
23:44:32.408717 IP 192.168.43.147.8880 > 192.168.43.124.7773: UDP, length 120
23:44:32.411320 IP 192.168.43.146.8880 > 192.168.43.147.7772: UDP, length 120
23:44:32.458769 IP 192.168.43.147.8880 > 192.168.43.124.7773: UDP, length 120
23:44:32.462223 IP 192.168.43.146.8880 > 192.168.43.147.7772: UDP, length 120
23:44:32.508740 IP 192.168.43.147.8880 > 192.168.43.124.7773: UDP, length 120
23:44:32.512169 IP 192.168.43.146.8880 > 192.168.43.147.7772: UDP, length 120
23:44:32.558721 IP 192.168.43.147.8880 > 192.168.43.124.7773: UDP, length 120
23:44:32.562167 IP 192.168.43.146.8880 > 192.168.43.147.7772: UDP, length 120
23:44:32.608721 IP 192.168.43.147.8880 > 192.168.43.124.7773: UDP, length 120
23:44:32.613924 IP 192.168.43.146.8880 > 192.168.43.147.7772: UDP, length 120
23:44:32.658721 IP 192.168.43.147.8880 > 192.168.43.124.7773: UDP, length 120
23:44:32.664650 IP 192.168.43.146.8880 > 192.168.43.147.7772: UDP, length 120
23:44:32.708719 IP 192.168.43.147.8880 > 192.168.43.124.7773: UDP, length 120
23:44:32.712426 IP 192.168.43.146.8880 > 192.168.43.147.7772: UDP, length 120
23:44:32.758719 IP 192.168.43.147.8880 > 192.168.43.124.7773: UDP, length 120
23:44:32.760378 IP 192.168.43.146.8880 > 192.168.43.147.7772: UDP, length 120
23:44:32.808728 IP 192.168.43.147.8880 > 192.168.43.124.7773: UDP, length 120
23:44:32.815425 IP 192.168.43.146.8880 > 192.168.43.147.7772: UDP, length 120
23:44:32.858718 IP 192.168.43.147.8880 > 192.168.43.124.7773: UDP, length 120
23:44:32.862169 IP 192.168.43.146.8880 > 192.168.43.147.7772: UDP, length 120
23:44:32.908739 IP 192.168.43.147.8880 > 192.168.43.124.7773: UDP, length 120
23:44:32.958719 IP 192.168.43.147.8880 > 192.168.43.124.7773: UDP, length 120
23:44:32.962103 IP 192.168.43.146.8880 > 192.168.43.147.7772: UDP, length 120
23:44:32.962244 IP 192.168.43.146.8880 > 192.168.43.147.7772: UDP, length 120
23:44:33.008729 IP 192.168.43.147.8880 > 192.168.43.124.7773: UDP, length 120
23:44:33.058117 IP 192.168.43.146.8880 > 192.168.43.147.7772: UDP, length 120
23:44:33.058724 IP 192.168.43.147.8880 > 192.168.43.124.7773: UDP, length 120
23:44:33.062700 IP 192.168.43.146.8880 > 192.168.43.147.7772: UDP, length 120
23:44:33.108720 IP 192.168.43.147.8880 > 192.168.43.124.7773: UDP, length 120
23:44:33.123033 IP 192.168.43.146.8880 > 192.168.43.147.7772: UDP, length 120
23:44:33.158720 IP 192.168.43.147.8880 > 192.168.43.124.7773: UDP, length 120
23:44:33.165034 IP 192.168.43.146.8880 > 192.168.43.147.7772: UDP, length 120
23:44:33.208716 IP 192.168.43.147.8880 > 192.168.43.124.7773: UDP, length 120
23:44:33.224841 IP 192.168.43.146.8880 > 192.168.43.147.7772: UDP, length 120
23:44:33.258718 IP 192.168.43.147.8880 > 192.168.43.124.7773: UDP, length 120
23:44:33.262114 IP 192.168.43.146.8880 > 192.168.43.147.7772: UDP, length 120
23:44:33.308716 IP 192.168.43.147.8880 > 192.168.43.124.7773: UDP, length 120
23:44:33.312397 IP 192.168.43.146.8880 > 192.168.43.147.7772: UDP, length 120
23:44:33.358717 IP 192.168.43.147.8880 > 192.168.43.124.7773: UDP, length 120
23:44:33.362121 IP 192.168.43.146.8880 > 192.168.43.147.7772: UDP, length 120
23:44:33.408714 IP 192.168.43.147.8880 > 192.168.43.124.7773: UDP, length 120
23:44:33.410731 IP 192.168.43.146.8880 > 192.168.43.147.7772: UDP, length 120
23:44:33.458716 IP 192.168.43.147.8880 > 192.168.43.124.7773: UDP, length 120
23:44:33.464417 IP 192.168.43.146.8880 > 192.168.43.147.7772: UDP, length 120
23:44:33.508717 IP 192.168.43.147.8880 > 192.168.43.124.7773: UDP, length 120
23:44:33.519421 IP 192.168.43.146.8880 > 192.168.43.147.7772: UDP, length 120
23:44:33.558723 IP 192.168.43.147.8880 > 192.168.43.124.7773: UDP, length 120
23:44:33.562987 IP 192.168.43.146.8880 > 192.168.43.147.7772: UDP, length 120
23:44:33.608720 IP 192.168.43.147.8880 > 192.168.43.124.7773: UDP, length 120
23:44:33.612117 IP 192.168.43.146.8880 > 192.168.43.147.7772: UDP, length 120
23:44:33.658716 IP 192.168.43.147.8880 > 192.168.43.124.7773: UDP, length 120
23:44:33.660117 IP 192.168.43.146.8880 > 192.168.43.147.7772: UDP, length 120
23:44:33.708727 IP 192.168.43.147.8880 > 192.168.43.124.7773: UDP, length 120
23:44:33.713753 IP 192.168.43.146.8880 > 192.168.43.147.7772: UDP, length 120
23:44:33.758718 IP 192.168.43.147.8880 > 192.168.43.124.7773: UDP, length 120
23:44:33.766260 IP 192.168.43.146.8880 > 192.168.43.147.7772: UDP, length 120
23:44:33.808715 IP 192.168.43.147.8880 > 192.168.43.124.7773: UDP, length 120
23:44:33.815377 IP 192.168.43.146.8880 > 192.168.43.147.7772: UDP, length 120
23:44:33.858715 IP 192.168.43.147.8880 > 192.168.43.124.7773: UDP, length 120
23:44:33.867789 IP 192.168.43.146.8880 > 192.168.43.147.7772: UDP, length 120
23:44:33.908743 IP 192.168.43.147.8880 > 192.168.43.124.7773: UDP, length 120
23:44:33.914130 IP 192.168.43.146.8880 > 192.168.43.147.7772: UDP, length 120
23:44:33.958760 IP 192.168.43.147.8880 > 192.168.43.124.7773: UDP, length 120
23:44:33.970794 IP 192.168.43.146.8880 > 192.168.43.147.7772: UDP, length 120
23:44:34.008726 IP 192.168.43.147.8880 > 192.168.43.124.7773: UDP, length 120
23:44:34.012313 IP 192.168.43.146.8880 > 192.168.43.147.7772: UDP, length 120
23:44:34.058723 IP 192.168.43.147.8880 > 192.168.43.124.7773: UDP, length 120
23:44:34.062141 IP 192.168.43.146.8880 > 192.168.43.147.7772: UDP, length 120
23:44:34.108719 IP 192.168.43.147.8880 > 192.168.43.124.7773: UDP, length 120
23:44:34.113909 IP 192.168.43.146.8880 > 192.168.43.147.7772: UDP, length 120
23:44:34.158720 IP 192.168.43.147.8880 > 192.168.43.124.7773: UDP, length 120
23:44:34.159929 IP 192.168.43.146.8880 > 192.168.43.147.7772: UDP, length 120
23:44:34.208714 IP 192.168.43.147.8880 > 192.168.43.124.7773: UDP, length 120
23:44:34.211608 IP 192.168.43.146.8880 > 192.168.43.147.7772: UDP, length 120
23:44:34.258789 IP 192.168.43.147.8880 > 192.168.43.124.7773: UDP, length 120
23:44:34.262004 IP 192.168.43.146.8880 > 192.168.43.147.7772: UDP, length 120
23:44:34.308714 IP 192.168.43.147.8880 > 192.168.43.124.7773: UDP, length 120
23:44:34.312558 IP 192.168.43.146.8880 > 192.168.43.147.7772: UDP, length 120
23:44:34.358714 IP 192.168.43.147.8880 > 192.168.43.124.7773: UDP, length 120
23:44:34.361721 IP 192.168.43.146.8880 > 192.168.43.147.7772: UDP, length 120
23:44:34.408714 IP 192.168.43.147.8880 > 192.168.43.124.7773: UDP, length 120
23:44:34.414536 IP 192.168.43.146.8880 > 192.168.43.147.7772: UDP, length 120
23:44:34.458714 IP 192.168.43.147.8880 > 192.168.43.124.7773: UDP, length 120
23:44:34.459518 IP 192.168.43.146.8880 > 192.168.43.147.7772: UDP, length 120
23:44:34.508715 IP 192.168.43.147.8880 > 192.168.43.124.7773: UDP, length 120
23:44:34.512109 IP 192.168.43.146.8880 > 192.168.43.147.7772: UDP, length 120
23:44:34.558719 IP 192.168.43.147.8880 > 192.168.43.124.7773: UDP, length 120
23:44:34.559045 IP 192.168.43.146.8880 > 192.168.43.147.7772: UDP, length 120
23:44:34.608719 IP 192.168.43.147.8880 > 192.168.43.124.7773: UDP, length 120
23:44:34.612113 IP 192.168.43.146.8880 > 192.168.43.147.7772: UDP, length 120
23:44:34.658720 IP 192.168.43.147.8880 > 192.168.43.124.7773: UDP, length 120
23:44:34.670794 IP 192.168.43.146.8880 > 192.168.43.147.7772: UDP, length 120
23:44:34.708715 IP 192.168.43.147.8880 > 192.168.43.124.7773: UDP, length 120
23:44:34.711332 IP 192.168.43.146.8880 > 192.168.43.147.7772: UDP, length 120
23:44:34.758719 IP 192.168.43.147.8880 > 192.168.43.124.7773: UDP, length 120
23:44:34.760252 IP 192.168.43.146.8880 > 192.168.43.147.7772: UDP, length 120
23:44:34.808716 IP 192.168.43.147.8880 > 192.168.43.124.7773: UDP, length 120
23:44:34.812737 IP 192.168.43.146.8880 > 192.168.43.147.7772: UDP, length 120
23:44:34.858715 IP 192.168.43.147.8880 > 192.168.43.124.7773: UDP, length 120
23:44:34.865919 IP 192.168.43.146.8880 > 192.168.43.147.7772: UDP, length 120
23:44:34.908740 IP 192.168.43.147.8880 > 192.168.43.124.7773: UDP, length 120
23:44:34.936970 IP 192.168.43.146.8880 > 192.168.43.147.7772: UDP, length 120
23:44:34.958731 IP 192.168.43.147.8880 > 192.168.43.124.7773: UDP, length 120
23:44:34.965273 IP 192.168.43.146.8880 > 192.168.43.147.7772: UDP, length 120
23:44:35.008726 IP 192.168.43.147.8880 > 192.168.43.124.7773: UDP, length 120
23:44:35.012119 IP 192.168.43.146.8880 > 192.168.43.147.7772: UDP, length 120
23:44:35.058720 IP 192.168.43.147.8880 > 192.168.43.124.7773: UDP, length 120
23:44:35.062112 IP 192.168.43.146.8880 > 192.168.43.147.7772: UDP, length 120
23:44:35.108723 IP 192.168.43.147.8880 > 192.168.43.124.7773: UDP, length 120
23:44:35.110793 IP 192.168.43.146.8880 > 192.168.43.147.7772: UDP, length 120
23:44:35.158717 IP 192.168.43.147.8880 > 192.168.43.124.7773: UDP, length 120
23:44:35.170123 IP 192.168.43.146.8880 > 192.168.43.147.7772: UDP, length 120
23:44:35.208581 IP 192.168.43.146.8880 > 192.168.43.147.7772: UDP, length 120
23:44:35.208733 IP 192.168.43.147.8880 > 192.168.43.124.7773: UDP, length 120
23:44:35.258721 IP 192.168.43.147.8880 > 192.168.43.124.7773: UDP, length 120
23:44:35.263712 IP 192.168.43.146.8880 > 192.168.43.147.7772: UDP, length 120
23:44:35.308521 IP 192.168.43.146.8880 > 192.168.43.147.7772: UDP, length 120
23:44:35.308714 IP 192.168.43.147.8880 > 192.168.43.124.7773: UDP, length 120
23:44:35.358713 IP 192.168.43.147.8880 > 192.168.43.124.7773: UDP, length 120
23:44:35.362129 IP 192.168.43.146.8880 > 192.168.43.147.7772: UDP, length 120
23:44:35.408722 IP 192.168.43.147.8880 > 192.168.43.124.7773: UDP, length 120
23:44:35.413061 IP 192.168.43.146.8880 > 192.168.43.147.7772: UDP, length 120
23:44:35.458773 IP 192.168.43.147.8880 > 192.168.43.124.7773: UDP, length 120
23:44:35.462282 IP 192.168.43.146.8880 > 192.168.43.147.7772: UDP, length 120
23:44:35.508725 IP 192.168.43.147.8880 > 192.168.43.124.7773: UDP, length 120
23:44:35.519888 IP 192.168.43.146.8880 > 192.168.43.147.7772: UDP, length 120
23:44:35.558714 IP 192.168.43.147.8880 > 192.168.43.124.7773: UDP, length 120
23:44:35.562124 IP 192.168.43.146.8880 > 192.168.43.147.7772: UDP, length 120
23:44:35.608715 IP 192.168.43.147.8880 > 192.168.43.124.7773: UDP, length 120
23:44:35.612671 IP 192.168.43.146.8880 > 192.168.43.147.7772: UDP, length 120
23:44:35.658724 IP 192.168.43.147.8880 > 192.168.43.124.7773: UDP, length 120
23:44:35.662152 IP 192.168.43.146.8880 > 192.168.43.147.7772: UDP, length 120
23:44:35.708718 IP 192.168.43.147.8880 > 192.168.43.124.7773: UDP, length 120
23:44:35.715357 IP 192.168.43.146.8880 > 192.168.43.147.7772: UDP, length 120
23:44:35.758725 IP 192.168.43.147.8880 > 192.168.43.124.7773: UDP, length 120
23:44:35.762730 IP 192.168.43.146.8880 > 192.168.43.147.7772: UDP, length 120
23:44:35.808719 IP 192.168.43.147.8880 > 192.168.43.124.7773: UDP, length 120
23:44:35.813912 IP 192.168.43.146.8880 > 192.168.43.147.7772: UDP, length 120
23:44:35.858717 IP 192.168.43.147.8880 > 192.168.43.124.7773: UDP, length 120
23:44:35.862371 IP 192.168.43.146.8880 > 192.168.43.147.7772: UDP, length 120
23:44:35.908745 IP 192.168.43.147.8880 > 192.168.43.124.7773: UDP, length 120
23:44:35.912385 IP 192.168.43.146.8880 > 192.168.43.147.7772: UDP, length 120
23:44:35.958723 IP 192.168.43.147.8880 > 192.168.43.124.7773: UDP, length 120
23:44:35.964503 IP 192.168.43.146.8880 > 192.168.43.147.7772: UDP, length 120
23:44:36.008717 IP 192.168.43.147.8880 > 192.168.43.124.7773: UDP, length 120
23:44:36.009048 IP 192.168.43.146.8880 > 192.168.43.147.7772: UDP, length 120
23:44:36.058747 IP 192.168.43.147.8880 > 192.168.43.124.7773: UDP, length 120
23:44:36.062197 IP 192.168.43.146.8880 > 192.168.43.147.7772: UDP, length 120
23:44:36.107335 IP 192.168.43.146.8880 > 192.168.43.147.7772: UDP, length 120
23:44:36.108732 IP 192.168.43.147.8880 > 192.168.43.124.7773: UDP, length 120
23:44:36.158717 IP 192.168.43.147.8880 > 192.168.43.124.7773: UDP, length 120
23:44:36.162788 IP 192.168.43.146.8880 > 192.168.43.147.7772: UDP, length 120
23:44:36.208751 IP 192.168.43.147.8880 > 192.168.43.124.7773: UDP, length 120
23:44:36.209103 IP 192.168.43.146.8880 > 192.168.43.147.7772: UDP, length 120
23:44:36.258726 IP 192.168.43.147.8880 > 192.168.43.124.7773: UDP, length 120
23:44:36.262170 IP 192.168.43.146.8880 > 192.168.43.147.7772: UDP, length 120
23:44:36.308544 IP 192.168.43.146.8880 > 192.168.43.147.7772: UDP, length 120
23:44:36.308715 IP 192.168.43.147.8880 > 192.168.43.124.7773: UDP, length 120
23:44:36.358715 IP 192.168.43.147.8880 > 192.168.43.124.7773: UDP, length 120
23:44:36.364379 IP 192.168.43.146.8880 > 192.168.43.147.7772: UDP, length 120
23:44:36.408747 IP 192.168.43.147.8880 > 192.168.43.124.7773: UDP, length 120
23:44:36.411894 IP 192.168.43.146.8880 > 192.168.43.147.7772: UDP, length 120
