22:46:03.884118 IP 192.168.43.124.8880 > 192.168.43.146.7771: UDP, length 120
22:46:03.934259 IP 192.168.43.124.8880 > 192.168.43.146.7771: UDP, length 120
22:46:03.984259 IP 192.168.43.124.8880 > 192.168.43.146.7771: UDP, length 120
22:46:04.034261 IP 192.168.43.124.8880 > 192.168.43.146.7771: UDP, length 120
22:46:04.084259 IP 192.168.43.124.8880 > 192.168.43.146.7771: UDP, length 120
22:46:04.134261 IP 192.168.43.124.8880 > 192.168.43.146.7771: UDP, length 120
22:46:04.184259 IP 192.168.43.124.8880 > 192.168.43.146.7771: UDP, length 120
22:46:04.234258 IP 192.168.43.124.8880 > 192.168.43.146.7771: UDP, length 120
22:46:04.284197 IP 192.168.43.124.8880 > 192.168.43.146.7771: UDP, length 120
22:46:04.334185 IP 192.168.43.124.8880 > 192.168.43.146.7771: UDP, length 120
22:46:04.384213 IP 192.168.43.124.8880 > 192.168.43.146.7771: UDP, length 120
22:46:04.434260 IP 192.168.43.124.8880 > 192.168.43.146.7771: UDP, length 120
22:46:04.484259 IP 192.168.43.124.8880 > 192.168.43.146.7771: UDP, length 120
22:46:04.534259 IP 192.168.43.124.8880 > 192.168.43.146.7771: UDP, length 120
22:46:04.584262 IP 192.168.43.124.8880 > 192.168.43.146.7771: UDP, length 120
22:46:04.634260 IP 192.168.43.124.8880 > 192.168.43.146.7771: UDP, length 120
22:46:04.684260 IP 192.168.43.124.8880 > 192.168.43.146.7771: UDP, length 120
22:46:04.734260 IP 192.168.43.124.8880 > 192.168.43.146.7771: UDP, length 120
22:46:04.784210 IP 192.168.43.124.8880 > 192.168.43.146.7771: UDP, length 120
22:46:04.834258 IP 192.168.43.124.8880 > 192.168.43.146.7771: UDP, length 120
22:46:04.884261 IP 192.168.43.124.8880 > 192.168.43.146.7771: UDP, length 120
22:46:04.934260 IP 192.168.43.124.8880 > 192.168.43.146.7771: UDP, length 120
22:46:04.984261 IP 192.168.43.124.8880 > 192.168.43.146.7771: UDP, length 120
22:46:05.034261 IP 192.168.43.124.8880 > 192.168.43.146.7771: UDP, length 120
22:46:05.084260 IP 192.168.43.124.8880 > 192.168.43.146.7771: UDP, length 120
22:46:05.134259 IP 192.168.43.124.8880 > 192.168.43.146.7771: UDP, length 120
22:46:05.184262 IP 192.168.43.124.8880 > 192.168.43.146.7771: UDP, length 120
22:46:05.234260 IP 192.168.43.124.8880 > 192.168.43.146.7771: UDP, length 120
22:46:05.284261 IP 192.168.43.124.8880 > 192.168.43.146.7771: UDP, length 120
22:46:05.334260 IP 192.168.43.124.8880 > 192.168.43.146.7771: UDP, length 120
22:46:05.384261 IP 192.168.43.124.8880 > 192.168.43.146.7771: UDP, length 120
22:46:05.434262 IP 192.168.43.124.8880 > 192.168.43.146.7771: UDP, length 120
22:46:05.484209 IP 192.168.43.124.8880 > 192.168.43.146.7771: UDP, length 120
22:46:05.534260 IP 192.168.43.124.8880 > 192.168.43.146.7771: UDP, length 120
22:46:05.584266 IP 192.168.43.124.8880 > 192.168.43.146.7771: UDP, length 120
22:46:05.634259 IP 192.168.43.124.8880 > 192.168.43.146.7771: UDP, length 120
22:46:05.684261 IP 192.168.43.124.8880 > 192.168.43.146.7771: UDP, length 120
22:46:05.734260 IP 192.168.43.124.8880 > 192.168.43.146.7771: UDP, length 120
22:46:05.784311 IP 192.168.43.124.8880 > 192.168.43.146.7771: UDP, length 120
22:46:05.834264 IP 192.168.43.124.8880 > 192.168.43.146.7771: UDP, length 120
22:46:05.884262 IP 192.168.43.124.8880 > 192.168.43.146.7771: UDP, length 120
22:46:05.934264 IP 192.168.43.124.8880 > 192.168.43.146.7771: UDP, length 120
22:46:05.984265 IP 192.168.43.124.8880 > 192.168.43.146.7771: UDP, length 120
22:46:06.034230 IP 192.168.43.124.8880 > 192.168.43.146.7771: UDP, length 120
22:46:06.084201 IP 192.168.43.124.8880 > 192.168.43.146.7771: UDP, length 120
22:46:06.134260 IP 192.168.43.124.8880 > 192.168.43.146.7771: UDP, length 120
22:46:06.184261 IP 192.168.43.124.8880 > 192.168.43.146.7771: UDP, length 120
22:46:06.234260 IP 192.168.43.124.8880 > 192.168.43.146.7771: UDP, length 120
22:46:06.284261 IP 192.168.43.124.8880 > 192.168.43.146.7771: UDP, length 120
22:46:06.334260 IP 192.168.43.124.8880 > 192.168.43.146.7771: UDP, length 120
22:46:06.384260 IP 192.168.43.124.8880 > 192.168.43.146.7771: UDP, length 120
22:46:06.388378 IP 192.168.43.147.8880 > 192.168.43.124.7773: UDP, length 120
22:46:06.434260 IP 192.168.43.124.8880 > 192.168.43.146.7771: UDP, length 120
22:46:06.443330 IP 192.168.43.147.8880 > 192.168.43.124.7773: UDP, length 120
22:46:06.484262 IP 192.168.43.124.8880 > 192.168.43.146.7771: UDP, length 120
22:46:06.488813 IP 192.168.43.147.8880 > 192.168.43.124.7773: UDP, length 120
22:46:06.534261 IP 192.168.43.124.8880 > 192.168.43.146.7771: UDP, length 120
22:46:06.540172 IP 192.168.43.147.8880 > 192.168.43.124.7773: UDP, length 120
22:46:06.584261 IP 192.168.43.124.8880 > 192.168.43.146.7771: UDP, length 120
22:46:06.588852 IP 192.168.43.147.8880 > 192.168.43.124.7773: UDP, length 120
22:46:06.634260 IP 192.168.43.124.8880 > 192.168.43.146.7771: UDP, length 120
22:46:06.642775 IP 192.168.43.147.8880 > 192.168.43.124.7773: UDP, length 120
22:46:06.684217 IP 192.168.43.124.8880 > 192.168.43.146.7771: UDP, length 120
22:46:06.685118 IP 192.168.43.147.8880 > 192.168.43.124.7773: UDP, length 120
22:46:06.734243 IP 192.168.43.124.8880 > 192.168.43.146.7771: UDP, length 120
22:46:06.736197 IP 192.168.43.147.8880 > 192.168.43.124.7773: UDP, length 120
22:46:06.784266 IP 192.168.43.124.8880 > 192.168.43.146.7771: UDP, length 120
22:46:06.789758 IP 192.168.43.147.8880 > 192.168.43.124.7773: UDP, length 120
22:46:06.834260 IP 192.168.43.124.8880 > 192.168.43.146.7771: UDP, length 120
22:46:06.838544 IP 192.168.43.147.8880 > 192.168.43.124.7773: UDP, length 120
22:46:06.884259 IP 192.168.43.124.8880 > 192.168.43.146.7771: UDP, length 120
22:46:06.889548 IP 192.168.43.147.8880 > 192.168.43.124.7773: UDP, length 120
22:46:06.934260 IP 192.168.43.124.8880 > 192.168.43.146.7771: UDP, length 120
22:46:06.938595 IP 192.168.43.147.8880 > 192.168.43.124.7773: UDP, length 120
22:46:06.984260 IP 192.168.43.124.8880 > 192.168.43.146.7771: UDP, length 120
22:46:06.989403 IP 192.168.43.147.8880 > 192.168.43.124.7773: UDP, length 120
22:46:07.034313 IP 192.168.43.124.8880 > 192.168.43.146.7771: UDP, length 120
22:46:07.040877 IP 192.168.43.147.8880 > 192.168.43.124.7773: UDP, length 120
22:46:07.084258 IP 192.168.43.124.8880 > 192.168.43.146.7771: UDP, length 120
22:46:07.089029 IP 192.168.43.147.8880 > 192.168.43.124.7773: UDP, length 120
22:46:07.134260 IP 192.168.43.124.8880 > 192.168.43.146.7771: UDP, length 120
22:46:07.141967 IP 192.168.43.147.8880 > 192.168.43.124.7773: UDP, length 120
22:46:07.184258 IP 192.168.43.124.8880 > 192.168.43.146.7771: UDP, length 120
22:46:07.213645 IP 192.168.43.147.8880 > 192.168.43.124.7773: UDP, length 120
22:46:07.234264 IP 192.168.43.124.8880 > 192.168.43.146.7771: UDP, length 120
22:46:07.242406 IP 192.168.43.147.8880 > 192.168.43.124.7773: UDP, length 120
22:46:07.284265 IP 192.168.43.124.8880 > 192.168.43.146.7771: UDP, length 120
22:46:07.288629 IP 192.168.43.147.8880 > 192.168.43.124.7773: UDP, length 120
22:46:07.334259 IP 192.168.43.124.8880 > 192.168.43.146.7771: UDP, length 120
22:46:07.338449 IP 192.168.43.147.8880 > 192.168.43.124.7773: UDP, length 120
22:46:07.384260 IP 192.168.43.124.8880 > 192.168.43.146.7771: UDP, length 120
22:46:07.388593 IP 192.168.43.147.8880 > 192.168.43.124.7773: UDP, length 120
22:46:07.434260 IP 192.168.43.124.8880 > 192.168.43.146.7771: UDP, length 120
22:46:07.438716 IP 192.168.43.147.8880 > 192.168.43.124.7773: UDP, length 120
22:46:07.484260 IP 192.168.43.124.8880 > 192.168.43.146.7771: UDP, length 120
22:46:07.488798 IP 192.168.43.147.8880 > 192.168.43.124.7773: UDP, length 120
22:46:07.534259 IP 192.168.43.124.8880 > 192.168.43.146.7771: UDP, length 120
22:46:07.540481 IP 192.168.43.147.8880 > 192.168.43.124.7773: UDP, length 120
22:46:07.584259 IP 192.168.43.124.8880 > 192.168.43.146.7771: UDP, length 120
22:46:07.600773 IP 192.168.43.147.8880 > 192.168.43.124.7773: UDP, length 120
22:46:07.634259 IP 192.168.43.124.8880 > 192.168.43.146.7771: UDP, length 120
22:46:07.641574 IP 192.168.43.147.8880 > 192.168.43.124.7773: UDP, length 120
22:46:07.684260 IP 192.168.43.124.8880 > 192.168.43.146.7771: UDP, length 120
22:46:07.688906 IP 192.168.43.147.8880 > 192.168.43.124.7773: UDP, length 120
22:46:07.734261 IP 192.168.43.124.8880 > 192.168.43.146.7771: UDP, length 120
22:46:07.742194 IP 192.168.43.147.8880 > 192.168.43.124.7773: UDP, length 120
22:46:07.784263 IP 192.168.43.124.8880 > 192.168.43.146.7771: UDP, length 120
22:46:07.788620 IP 192.168.43.147.8880 > 192.168.43.124.7773: UDP, length 120
22:46:07.834263 IP 192.168.43.124.8880 > 192.168.43.146.7771: UDP, length 120
22:46:07.838612 IP 192.168.43.147.8880 > 192.168.43.124.7773: UDP, length 120
22:46:07.884214 IP 192.168.43.124.8880 > 192.168.43.146.7771: UDP, length 120
22:46:07.888499 IP 192.168.43.147.8880 > 192.168.43.124.7773: UDP, length 120
22:46:07.934265 IP 192.168.43.124.8880 > 192.168.43.146.7771: UDP, length 120
22:46:07.938341 IP 192.168.43.147.8880 > 192.168.43.124.7773: UDP, length 120
22:46:07.984264 IP 192.168.43.124.8880 > 192.168.43.146.7771: UDP, length 120
22:46:07.986098 IP 192.168.43.147.8880 > 192.168.43.124.7773: UDP, length 120
22:46:08.034266 IP 192.168.43.124.8880 > 192.168.43.146.7771: UDP, length 120
22:46:08.038629 IP 192.168.43.147.8880 > 192.168.43.124.7773: UDP, length 120
22:46:08.084264 IP 192.168.43.124.8880 > 192.168.43.146.7771: UDP, length 120
22:46:08.093026 IP 192.168.43.147.8880 > 192.168.43.124.7773: UDP, length 120
22:46:08.134264 IP 192.168.43.124.8880 > 192.168.43.146.7771: UDP, length 120
22:46:08.142722 IP 192.168.43.147.8880 > 192.168.43.124.7773: UDP, length 120
22:46:08.184263 IP 192.168.43.124.8880 > 192.168.43.146.7771: UDP, length 120
22:46:08.193807 IP 192.168.43.147.8880 > 192.168.43.124.7773: UDP, length 120
22:46:08.234266 IP 192.168.43.124.8880 > 192.168.43.146.7771: UDP, length 120
22:46:08.238780 IP 192.168.43.147.8880 > 192.168.43.124.7773: UDP, length 120
22:46:08.284268 IP 192.168.43.124.8880 > 192.168.43.146.7771: UDP, length 120
22:46:08.288343 IP 192.168.43.147.8880 > 192.168.43.124.7773: UDP, length 120
22:46:08.334261 IP 192.168.43.124.8880 > 192.168.43.146.7771: UDP, length 120
22:46:08.340958 IP 192.168.43.147.8880 > 192.168.43.124.7773: UDP, length 120
22:46:08.384259 IP 192.168.43.124.8880 > 192.168.43.146.7771: UDP, length 120
22:46:08.388332 IP 192.168.43.147.8880 > 192.168.43.124.7773: UDP, length 120
22:46:08.434261 IP 192.168.43.124.8880 > 192.168.43.146.7771: UDP, length 120
22:46:08.438332 IP 192.168.43.147.8880 > 192.168.43.124.7773: UDP, length 120
22:46:08.484260 IP 192.168.43.124.8880 > 192.168.43.146.7771: UDP, length 120
22:46:08.488864 IP 192.168.43.147.8880 > 192.168.43.124.7773: UDP, length 120
22:46:08.534264 IP 192.168.43.124.8880 > 192.168.43.146.7771: UDP, length 120
22:46:08.538107 IP 192.168.43.147.8880 > 192.168.43.124.7773: UDP, length 120
22:46:08.584264 IP 192.168.43.124.8880 > 192.168.43.146.7771: UDP, length 120
22:46:08.589472 IP 192.168.43.147.8880 > 192.168.43.124.7773: UDP, length 120
22:46:08.634263 IP 192.168.43.124.8880 > 192.168.43.146.7771: UDP, length 120
22:46:08.638347 IP 192.168.43.147.8880 > 192.168.43.124.7773: UDP, length 120
22:46:08.684264 IP 192.168.43.124.8880 > 192.168.43.146.7771: UDP, length 120
22:46:08.690863 IP 192.168.43.147.8880 > 192.168.43.124.7773: UDP, length 120
22:46:08.734264 IP 192.168.43.124.8880 > 192.168.43.146.7771: UDP, length 120
22:46:08.739236 IP 192.168.43.147.8880 > 192.168.43.124.7773: UDP, length 120
22:46:08.784263 IP 192.168.43.124.8880 > 192.168.43.146.7771: UDP, length 120
22:46:08.790843 IP 192.168.43.147.8880 > 192.168.43.124.7773: UDP, length 120
22:46:08.834261 IP 192.168.43.124.8880 > 192.168.43.146.7771: UDP, length 120
22:46:08.838160 IP 192.168.43.147.8880 > 192.168.43.124.7773: UDP, length 120
22:46:08.884259 IP 192.168.43.124.8880 > 192.168.43.146.7771: UDP, length 120
22:46:08.888595 IP 192.168.43.147.8880 > 192.168.43.124.7773: UDP, length 120
22:46:08.934260 IP 192.168.43.124.8880 > 192.168.43.146.7771: UDP, length 120
22:46:08.938321 IP 192.168.43.147.8880 > 192.168.43.124.7773: UDP, length 120
22:46:08.984261 IP 192.168.43.124.8880 > 192.168.43.146.7771: UDP, length 120
22:46:08.986898 IP 192.168.43.147.8880 > 192.168.43.124.7773: UDP, length 120
22:46:09.034260 IP 192.168.43.124.8880 > 192.168.43.146.7771: UDP, length 120
22:46:09.038230 IP 192.168.43.147.8880 > 192.168.43.124.7773: UDP, length 120
22:46:09.084259 IP 192.168.43.124.8880 > 192.168.43.146.7771: UDP, length 120
22:46:09.088343 IP 192.168.43.147.8880 > 192.168.43.124.7773: UDP, length 120
22:46:09.134262 IP 192.168.43.124.8880 > 192.168.43.146.7771: UDP, length 120
22:46:09.145972 IP 192.168.43.147.8880 > 192.168.43.124.7773: UDP, length 120
22:46:09.184260 IP 192.168.43.124.8880 > 192.168.43.146.7771: UDP, length 120
22:46:09.193479 IP 192.168.43.147.8880 > 192.168.43.124.7773: UDP, length 120
22:46:09.234261 IP 192.168.43.124.8880 > 192.168.43.146.7771: UDP, length 120
22:46:09.244411 IP 192.168.43.147.8880 > 192.168.43.124.7773: UDP, length 120
22:46:09.284260 IP 192.168.43.124.8880 > 192.168.43.146.7771: UDP, length 120
22:46:09.291464 IP 192.168.43.147.8880 > 192.168.43.124.7773: UDP, length 120
22:46:09.334208 IP 192.168.43.124.8880 > 192.168.43.146.7771: UDP, length 120
22:46:09.342269 IP 192.168.43.147.8880 > 192.168.43.124.7773: UDP, length 120
22:46:09.384188 IP 192.168.43.124.8880 > 192.168.43.146.7771: UDP, length 120
22:46:09.398462 IP 192.168.43.147.8880 > 192.168.43.124.7773: UDP, length 120
22:46:09.434184 IP 192.168.43.124.8880 > 192.168.43.146.7771: UDP, length 120
22:46:09.438368 IP 192.168.43.147.8880 > 192.168.43.124.7773: UDP, length 120
22:46:09.484208 IP 192.168.43.124.8880 > 192.168.43.146.7771: UDP, length 120
22:46:09.493325 IP 192.168.43.147.8880 > 192.168.43.124.7773: UDP, length 120
22:46:09.534261 IP 192.168.43.124.8880 > 192.168.43.146.7771: UDP, length 120
22:46:09.538747 IP 192.168.43.147.8880 > 192.168.43.124.7773: UDP, length 120
22:46:09.584224 IP 192.168.43.124.8880 > 192.168.43.146.7771: UDP, length 120
22:46:09.593002 IP 192.168.43.147.8880 > 192.168.43.124.7773: UDP, length 120
22:46:09.634262 IP 192.168.43.124.8880 > 192.168.43.146.7771: UDP, length 120
22:46:09.638935 IP 192.168.43.147.8880 > 192.168.43.124.7773: UDP, length 120
22:46:09.684260 IP 192.168.43.124.8880 > 192.168.43.146.7771: UDP, length 120
22:46:09.693272 IP 192.168.43.147.8880 > 192.168.43.124.7773: UDP, length 120
22:46:09.734262 IP 192.168.43.124.8880 > 192.168.43.146.7771: UDP, length 120
22:46:09.739456 IP 192.168.43.147.8880 > 192.168.43.124.7773: UDP, length 120
22:46:09.784261 IP 192.168.43.124.8880 > 192.168.43.146.7771: UDP, length 120
22:46:09.793164 IP 192.168.43.147.8880 > 192.168.43.124.7773: UDP, length 120
22:46:09.834302 IP 192.168.43.124.8880 > 192.168.43.146.7771: UDP, length 120
22:46:09.835178 IP 192.168.43.147.8880 > 192.168.43.124.7773: UDP, length 120
22:46:09.884304 IP 192.168.43.124.8880 > 192.168.43.146.7771: UDP, length 120
22:46:09.893564 IP 192.168.43.147.8880 > 192.168.43.124.7773: UDP, length 120
22:46:09.934302 IP 192.168.43.124.8880 > 192.168.43.146.7771: UDP, length 120
22:46:09.935172 IP 192.168.43.147.8880 > 192.168.43.124.7773: UDP, length 120
22:46:09.984310 IP 192.168.43.124.8880 > 192.168.43.146.7771: UDP, length 120
22:46:09.989172 IP 192.168.43.147.8880 > 192.168.43.124.7773: UDP, length 120
22:46:10.034268 IP 192.168.43.124.8880 > 192.168.43.146.7771: UDP, length 120
22:46:10.035858 IP 192.168.43.147.8880 > 192.168.43.124.7773: UDP, length 120
22:46:10.084264 IP 192.168.43.124.8880 > 192.168.43.146.7771: UDP, length 120
22:46:10.088519 IP 192.168.43.147.8880 > 192.168.43.124.7773: UDP, length 120
22:46:10.134266 IP 192.168.43.124.8880 > 192.168.43.146.7771: UDP, length 120
22:46:10.138616 IP 192.168.43.147.8880 > 192.168.43.124.7773: UDP, length 120
22:46:10.184263 IP 192.168.43.124.8880 > 192.168.43.146.7771: UDP, length 120
22:46:10.188590 IP 192.168.43.147.8880 > 192.168.43.124.7773: UDP, length 120
22:46:10.234263 IP 192.168.43.124.8880 > 192.168.43.146.7771: UDP, length 120
22:46:10.241885 IP 192.168.43.147.8880 > 192.168.43.124.7773: UDP, length 120
22:46:10.284264 IP 192.168.43.124.8880 > 192.168.43.146.7771: UDP, length 120
22:46:10.293306 IP 192.168.43.147.8880 > 192.168.43.124.7773: UDP, length 120
22:46:10.334262 IP 192.168.43.124.8880 > 192.168.43.146.7771: UDP, length 120
22:46:10.340206 IP 192.168.43.147.8880 > 192.168.43.124.7773: UDP, length 120
22:46:10.384261 IP 192.168.43.124.8880 > 192.168.43.146.7771: UDP, length 120
22:46:10.388594 IP 192.168.43.147.8880 > 192.168.43.124.7773: UDP, length 120
22:46:10.434264 IP 192.168.43.124.8880 > 192.168.43.146.7771: UDP, length 120
22:46:10.434759 IP 192.168.43.147.8880 > 192.168.43.124.7773: UDP, length 120
22:46:10.484261 IP 192.168.43.124.8880 > 192.168.43.146.7771: UDP, length 120
22:46:10.488601 IP 192.168.43.147.8880 > 192.168.43.124.7773: UDP, length 120
22:46:10.534265 IP 192.168.43.124.8880 > 192.168.43.146.7771: UDP, length 120
22:46:10.537264 IP 192.168.43.147.8880 > 192.168.43.124.7773: UDP, length 120
22:46:10.584260 IP 192.168.43.124.8880 > 192.168.43.146.7771: UDP, length 120
22:46:10.588341 IP 192.168.43.147.8880 > 192.168.43.124.7773: UDP, length 120
22:46:10.634264 IP 192.168.43.124.8880 > 192.168.43.146.7771: UDP, length 120
22:46:10.637084 IP 192.168.43.147.8880 > 192.168.43.124.7773: UDP, length 120
22:46:10.684261 IP 192.168.43.124.8880 > 192.168.43.146.7771: UDP, length 120
22:46:10.688352 IP 192.168.43.147.8880 > 192.168.43.124.7773: UDP, length 120
22:46:10.734264 IP 192.168.43.124.8880 > 192.168.43.146.7771: UDP, length 120
22:46:10.749007 IP 192.168.43.147.8880 > 192.168.43.124.7773: UDP, length 120
22:46:10.784263 IP 192.168.43.124.8880 > 192.168.43.146.7771: UDP, length 120
22:46:10.788553 IP 192.168.43.147.8880 > 192.168.43.124.7773: UDP, length 120
22:46:10.834260 IP 192.168.43.124.8880 > 192.168.43.146.7771: UDP, length 120
22:46:10.839651 IP 192.168.43.147.8880 > 192.168.43.124.7773: UDP, length 120
22:46:10.884260 IP 192.168.43.124.8880 > 192.168.43.146.7771: UDP, length 120
22:46:10.889475 IP 192.168.43.147.8880 > 192.168.43.124.7773: UDP, length 120
22:46:10.934261 IP 192.168.43.124.8880 > 192.168.43.146.7771: UDP, length 120
22:46:10.934954 IP 192.168.43.147.8880 > 192.168.43.124.7773: UDP, length 120
22:46:10.984259 IP 192.168.43.124.8880 > 192.168.43.146.7771: UDP, length 120
22:46:10.990128 IP 192.168.43.147.8880 > 192.168.43.124.7773: UDP, length 120
22:46:11.034261 IP 192.168.43.124.8880 > 192.168.43.146.7771: UDP, length 120
22:46:11.084260 IP 192.168.43.124.8880 > 192.168.43.146.7771: UDP, length 120
22:46:11.134312 IP 192.168.43.124.8880 > 192.168.43.146.7771: UDP, length 120
22:46:11.147139 IP 192.168.43.147.8880 > 192.168.43.124.7773: UDP, length 120
22:46:11.147167 IP 192.168.43.147.8880 > 192.168.43.124.7773: UDP, length 120
22:46:11.147171 IP 192.168.43.147.8880 > 192.168.43.124.7773: UDP, length 120
22:46:11.184314 IP 192.168.43.124.8880 > 192.168.43.146.7771: UDP, length 120
22:46:11.189347 IP 192.168.43.147.8880 > 192.168.43.124.7773: UDP, length 120
22:46:11.234315 IP 192.168.43.124.8880 > 192.168.43.146.7771: UDP, length 120
22:46:11.239916 IP 192.168.43.147.8880 > 192.168.43.124.7773: UDP, length 120
22:46:11.284313 IP 192.168.43.124.8880 > 192.168.43.146.7771: UDP, length 120
22:46:11.288490 IP 192.168.43.147.8880 > 192.168.43.124.7773: UDP, length 120
22:46:11.334265 IP 192.168.43.124.8880 > 192.168.43.146.7771: UDP, length 120
22:46:11.345523 IP 192.168.43.147.8880 > 192.168.43.124.7773: UDP, length 120
22:46:11.384261 IP 192.168.43.124.8880 > 192.168.43.146.7771: UDP, length 120
22:46:11.398178 IP 192.168.43.147.8880 > 192.168.43.124.7773: UDP, length 120
22:46:11.434263 IP 192.168.43.124.8880 > 192.168.43.146.7771: UDP, length 120
22:46:11.439734 IP 192.168.43.147.8880 > 192.168.43.124.7773: UDP, length 120
22:46:11.484262 IP 192.168.43.124.8880 > 192.168.43.146.7771: UDP, length 120
22:46:11.488623 IP 192.168.43.147.8880 > 192.168.43.124.7773: UDP, length 120
22:46:11.534263 IP 192.168.43.124.8880 > 192.168.43.146.7771: UDP, length 120
22:46:11.538567 IP 192.168.43.147.8880 > 192.168.43.124.7773: UDP, length 120
22:46:11.584264 IP 192.168.43.124.8880 > 192.168.43.146.7771: UDP, length 120
22:46:11.588752 IP 192.168.43.147.8880 > 192.168.43.124.7773: UDP, length 120
22:46:11.634264 IP 192.168.43.124.8880 > 192.168.43.146.7771: UDP, length 120
22:46:11.638517 IP 192.168.43.147.8880 > 192.168.43.124.7773: UDP, length 120
22:46:11.684263 IP 192.168.43.124.8880 > 192.168.43.146.7771: UDP, length 120
22:46:11.689148 IP 192.168.43.147.8880 > 192.168.43.124.7773: UDP, length 120
22:46:11.734209 IP 192.168.43.124.8880 > 192.168.43.146.7771: UDP, length 120
22:46:11.739216 IP 192.168.43.147.8880 > 192.168.43.124.7773: UDP, length 120
22:46:11.784265 IP 192.168.43.124.8880 > 192.168.43.146.7771: UDP, length 120
22:46:11.789596 IP 192.168.43.147.8880 > 192.168.43.124.7773: UDP, length 120
22:46:11.834259 IP 192.168.43.124.8880 > 192.168.43.146.7771: UDP, length 120
22:46:11.840907 IP 192.168.43.147.8880 > 192.168.43.124.7773: UDP, length 120
22:46:11.884261 IP 192.168.43.124.8880 > 192.168.43.146.7771: UDP, length 120
22:46:11.889641 IP 192.168.43.147.8880 > 192.168.43.124.7773: UDP, length 120
22:46:11.934262 IP 192.168.43.124.8880 > 192.168.43.146.7771: UDP, length 120
22:46:11.941298 IP 192.168.43.147.8880 > 192.168.43.124.7773: UDP, length 120
22:46:11.984262 IP 192.168.43.124.8880 > 192.168.43.146.7771: UDP, length 120
22:46:11.991012 IP 192.168.43.147.8880 > 192.168.43.124.7773: UDP, length 120
22:46:12.034262 IP 192.168.43.124.8880 > 192.168.43.146.7771: UDP, length 120
22:46:12.038822 IP 192.168.43.147.8880 > 192.168.43.124.7773: UDP, length 120
22:46:12.084260 IP 192.168.43.124.8880 > 192.168.43.146.7771: UDP, length 120
22:46:12.088511 IP 192.168.43.147.8880 > 192.168.43.124.7773: UDP, length 120
22:46:12.134262 IP 192.168.43.124.8880 > 192.168.43.146.7771: UDP, length 120
22:46:12.138331 IP 192.168.43.147.8880 > 192.168.43.124.7773: UDP, length 120
22:46:12.184259 IP 192.168.43.124.8880 > 192.168.43.146.7771: UDP, length 120
22:46:12.188562 IP 192.168.43.147.8880 > 192.168.43.124.7773: UDP, length 120
22:46:12.234262 IP 192.168.43.124.8880 > 192.168.43.146.7771: UDP, length 120
22:46:12.241125 IP 192.168.43.147.8880 > 192.168.43.124.7773: UDP, length 120
22:46:12.284259 IP 192.168.43.124.8880 > 192.168.43.146.7771: UDP, length 120
22:46:12.297567 IP 192.168.43.147.8880 > 192.168.43.124.7773: UDP, length 120
22:46:12.334260 IP 192.168.43.124.8880 > 192.168.43.146.7771: UDP, length 120
22:46:12.338999 IP 192.168.43.147.8880 > 192.168.43.124.7773: UDP, length 120
22:46:12.384259 IP 192.168.43.124.8880 > 192.168.43.146.7771: UDP, length 120
22:46:12.390128 IP 192.168.43.147.8880 > 192.168.43.124.7773: UDP, length 120
22:46:12.434260 IP 192.168.43.124.8880 > 192.168.43.146.7771: UDP, length 120
22:46:12.438489 IP 192.168.43.147.8880 > 192.168.43.124.7773: UDP, length 120
22:46:12.484260 IP 192.168.43.124.8880 > 192.168.43.146.7771: UDP, length 120
22:46:12.488976 IP 192.168.43.147.8880 > 192.168.43.124.7773: UDP, length 120
22:46:12.534262 IP 192.168.43.124.8880 > 192.168.43.146.7771: UDP, length 120
22:46:12.538599 IP 192.168.43.147.8880 > 192.168.43.124.7773: UDP, length 120
22:46:12.584260 IP 192.168.43.124.8880 > 192.168.43.146.7771: UDP, length 120
22:46:12.588512 IP 192.168.43.147.8880 > 192.168.43.124.7773: UDP, length 120
22:46:12.634261 IP 192.168.43.124.8880 > 192.168.43.146.7771: UDP, length 120
22:46:12.638844 IP 192.168.43.147.8880 > 192.168.43.124.7773: UDP, length 120
22:46:12.684261 IP 192.168.43.124.8880 > 192.168.43.146.7771: UDP, length 120
22:46:12.688556 IP 192.168.43.147.8880 > 192.168.43.124.7773: UDP, length 120
22:46:12.734261 IP 192.168.43.124.8880 > 192.168.43.146.7771: UDP, length 120
22:46:12.738745 IP 192.168.43.147.8880 > 192.168.43.124.7773: UDP, length 120
22:46:12.784261 IP 192.168.43.124.8880 > 192.168.43.146.7771: UDP, length 120
22:46:12.788844 IP 192.168.43.147.8880 > 192.168.43.124.7773: UDP, length 120
22:46:12.834260 IP 192.168.43.124.8880 > 192.168.43.146.7771: UDP, length 120
22:46:12.838585 IP 192.168.43.147.8880 > 192.168.43.124.7773: UDP, length 120
22:46:12.884261 IP 192.168.43.124.8880 > 192.168.43.146.7771: UDP, length 120
22:46:12.889289 IP 192.168.43.147.8880 > 192.168.43.124.7773: UDP, length 120
22:46:12.934262 IP 192.168.43.124.8880 > 192.168.43.146.7771: UDP, length 120
22:46:12.938683 IP 192.168.43.147.8880 > 192.168.43.124.7773: UDP, length 120
22:46:12.984261 IP 192.168.43.124.8880 > 192.168.43.146.7771: UDP, length 120
22:46:12.991352 IP 192.168.43.147.8880 > 192.168.43.124.7773: UDP, length 120
22:46:13.034311 IP 192.168.43.124.8880 > 192.168.43.146.7771: UDP, length 120
22:46:13.039107 IP 192.168.43.147.8880 > 192.168.43.124.7773: UDP, length 120
22:46:13.084248 IP 192.168.43.124.8880 > 192.168.43.146.7771: UDP, length 120
22:46:13.085465 IP 192.168.43.147.8880 > 192.168.43.124.7773: UDP, length 120
22:46:13.134201 IP 192.168.43.124.8880 > 192.168.43.146.7771: UDP, length 120
22:46:13.138849 IP 192.168.43.147.8880 > 192.168.43.124.7773: UDP, length 120
22:46:13.184263 IP 192.168.43.124.8880 > 192.168.43.146.7771: UDP, length 120
22:46:13.186675 IP 192.168.43.147.8880 > 192.168.43.124.7773: UDP, length 120
22:46:13.234262 IP 192.168.43.124.8880 > 192.168.43.146.7771: UDP, length 120
22:46:13.238850 IP 192.168.43.147.8880 > 192.168.43.124.7773: UDP, length 120
22:46:13.284262 IP 192.168.43.124.8880 > 192.168.43.146.7771: UDP, length 120
22:46:13.288371 IP 192.168.43.147.8880 > 192.168.43.124.7773: UDP, length 120
22:46:13.334213 IP 192.168.43.124.8880 > 192.168.43.146.7771: UDP, length 120
22:46:13.340959 IP 192.168.43.147.8880 > 192.168.43.124.7773: UDP, length 120
22:46:13.384263 IP 192.168.43.124.8880 > 192.168.43.146.7771: UDP, length 120
22:46:13.389997 IP 192.168.43.147.8880 > 192.168.43.124.7773: UDP, length 120
22:46:13.434262 IP 192.168.43.124.8880 > 192.168.43.146.7771: UDP, length 120
22:46:13.439882 IP 192.168.43.147.8880 > 192.168.43.124.7773: UDP, length 120
22:46:13.484260 IP 192.168.43.124.8880 > 192.168.43.146.7771: UDP, length 120
22:46:13.491394 IP 192.168.43.147.8880 > 192.168.43.124.7773: UDP, length 120
22:46:13.534262 IP 192.168.43.124.8880 > 192.168.43.146.7771: UDP, length 120
22:46:13.538528 IP 192.168.43.147.8880 > 192.168.43.124.7773: UDP, length 120
22:46:13.584261 IP 192.168.43.124.8880 > 192.168.43.146.7771: UDP, length 120
22:46:13.607089 IP 192.168.43.147.8880 > 192.168.43.124.7773: UDP, length 120
22:46:13.634263 IP 192.168.43.124.8880 > 192.168.43.146.7771: UDP, length 120
22:46:13.638334 IP 192.168.43.147.8880 > 192.168.43.124.7773: UDP, length 120
22:46:13.684263 IP 192.168.43.124.8880 > 192.168.43.146.7771: UDP, length 120
22:46:13.688788 IP 192.168.43.147.8880 > 192.168.43.124.7773: UDP, length 120
22:46:13.734264 IP 192.168.43.124.8880 > 192.168.43.146.7771: UDP, length 120
22:46:13.740829 IP 192.168.43.147.8880 > 192.168.43.124.7773: UDP, length 120
22:46:13.784264 IP 192.168.43.124.8880 > 192.168.43.146.7771: UDP, length 120
22:46:13.788549 IP 192.168.43.147.8880 > 192.168.43.124.7773: UDP, length 120
22:46:13.834309 IP 192.168.43.124.8880 > 192.168.43.146.7771: UDP, length 120
22:46:13.840324 IP 192.168.43.147.8880 > 192.168.43.124.7773: UDP, length 120
22:46:13.884778 IP 192.168.43.124.8880 > 192.168.43.146.7771: UDP, length 120
22:46:13.889632 IP 192.168.43.147.8880 > 192.168.43.124.7773: UDP, length 120
22:46:13.934350 IP 192.168.43.124.8880 > 192.168.43.146.7771: UDP, length 120
22:46:13.950577 IP 192.168.43.147.8880 > 192.168.43.124.7773: UDP, length 120
22:46:13.984312 IP 192.168.43.124.8880 > 192.168.43.146.7771: UDP, length 120
22:46:13.991859 IP 192.168.43.147.8880 > 192.168.43.124.7773: UDP, length 120
22:46:14.034315 IP 192.168.43.124.8880 > 192.168.43.146.7771: UDP, length 120
22:46:14.035202 IP 192.168.43.147.8880 > 192.168.43.124.7773: UDP, length 120
22:46:14.084310 IP 192.168.43.124.8880 > 192.168.43.146.7771: UDP, length 120
22:46:14.092208 IP 192.168.43.147.8880 > 192.168.43.124.7773: UDP, length 120
22:46:14.135039 IP 192.168.43.124.8880 > 192.168.43.146.7771: UDP, length 120
22:46:14.138396 IP 192.168.43.147.8880 > 192.168.43.124.7773: UDP, length 120
22:46:14.184311 IP 192.168.43.124.8880 > 192.168.43.146.7771: UDP, length 120
22:46:14.189309 IP 192.168.43.147.8880 > 192.168.43.124.7773: UDP, length 120
22:46:14.234359 IP 192.168.43.124.8880 > 192.168.43.146.7771: UDP, length 120
22:46:14.235243 IP 192.168.43.147.8880 > 192.168.43.124.7773: UDP, length 120
22:46:14.284310 IP 192.168.43.124.8880 > 192.168.43.146.7771: UDP, length 120
22:46:14.287116 IP 192.168.43.147.8880 > 192.168.43.124.7773: UDP, length 120
22:46:14.334262 IP 192.168.43.124.8880 > 192.168.43.146.7771: UDP, length 120
22:46:14.338258 IP 192.168.43.147.8880 > 192.168.43.124.7773: UDP, length 120
22:46:14.384259 IP 192.168.43.124.8880 > 192.168.43.146.7771: UDP, length 120
22:46:14.388370 IP 192.168.43.147.8880 > 192.168.43.124.7773: UDP, length 120
22:46:14.434262 IP 192.168.43.124.8880 > 192.168.43.146.7771: UDP, length 120
22:46:14.438503 IP 192.168.43.147.8880 > 192.168.43.124.7773: UDP, length 120
22:46:14.484185 IP 192.168.43.124.8880 > 192.168.43.146.7771: UDP, length 120
22:46:14.492108 IP 192.168.43.147.8880 > 192.168.43.124.7773: UDP, length 120
22:46:14.534198 IP 192.168.43.124.8880 > 192.168.43.146.7771: UDP, length 120
22:46:14.540040 IP 192.168.43.147.8880 > 192.168.43.124.7773: UDP, length 120
22:46:14.584263 IP 192.168.43.124.8880 > 192.168.43.146.7771: UDP, length 120
22:46:14.591948 IP 192.168.43.147.8880 > 192.168.43.124.7773: UDP, length 120
22:46:14.634261 IP 192.168.43.124.8880 > 192.168.43.146.7771: UDP, length 120
22:46:14.640773 IP 192.168.43.147.8880 > 192.168.43.124.7773: UDP, length 120
22:46:14.684259 IP 192.168.43.124.8880 > 192.168.43.146.7771: UDP, length 120
22:46:14.688613 IP 192.168.43.147.8880 > 192.168.43.124.7773: UDP, length 120
22:46:14.734261 IP 192.168.43.124.8880 > 192.168.43.146.7771: UDP, length 120
22:46:14.738520 IP 192.168.43.147.8880 > 192.168.43.124.7773: UDP, length 120
22:46:14.784263 IP 192.168.43.124.8880 > 192.168.43.146.7771: UDP, length 120
22:46:14.788409 IP 192.168.43.147.8880 > 192.168.43.124.7773: UDP, length 120
22:46:14.834260 IP 192.168.43.124.8880 > 192.168.43.146.7771: UDP, length 120
22:46:14.834962 IP 192.168.43.147.8880 > 192.168.43.124.7773: UDP, length 120
22:46:14.884259 IP 192.168.43.124.8880 > 192.168.43.146.7771: UDP, length 120
22:46:14.888368 IP 192.168.43.147.8880 > 192.168.43.124.7773: UDP, length 120
22:46:14.934260 IP 192.168.43.124.8880 > 192.168.43.146.7771: UDP, length 120
22:46:14.939472 IP 192.168.43.147.8880 > 192.168.43.124.7773: UDP, length 120
22:46:14.984260 IP 192.168.43.124.8880 > 192.168.43.146.7771: UDP, length 120
22:46:14.988212 IP 192.168.43.147.8880 > 192.168.43.124.7773: UDP, length 120
22:46:15.034261 IP 192.168.43.124.8880 > 192.168.43.146.7771: UDP, length 120
22:46:15.036625 IP 192.168.43.147.8880 > 192.168.43.124.7773: UDP, length 120
22:46:15.084258 IP 192.168.43.124.8880 > 192.168.43.146.7771: UDP, length 120
22:46:15.088515 IP 192.168.43.147.8880 > 192.168.43.124.7773: UDP, length 120
22:46:15.134259 IP 192.168.43.124.8880 > 192.168.43.146.7771: UDP, length 120
22:46:15.135112 IP 192.168.43.147.8880 > 192.168.43.124.7773: UDP, length 120
22:46:15.184260 IP 192.168.43.124.8880 > 192.168.43.146.7771: UDP, length 120
22:46:15.188449 IP 192.168.43.147.8880 > 192.168.43.124.7773: UDP, length 120
22:46:15.234263 IP 192.168.43.124.8880 > 192.168.43.146.7771: UDP, length 120
22:46:15.242548 IP 192.168.43.147.8880 > 192.168.43.124.7773: UDP, length 120
22:46:15.284307 IP 192.168.43.124.8880 > 192.168.43.146.7771: UDP, length 120
22:46:15.291006 IP 192.168.43.147.8880 > 192.168.43.124.7773: UDP, length 120
22:46:15.334312 IP 192.168.43.124.8880 > 192.168.43.146.7771: UDP, length 120
22:46:15.337666 IP 192.168.43.147.8880 > 192.168.43.124.7773: UDP, length 120
22:46:15.384264 IP 192.168.43.124.8880 > 192.168.43.146.7771: UDP, length 120
22:46:15.388965 IP 192.168.43.147.8880 > 192.168.43.124.7773: UDP, length 120
22:46:15.434265 IP 192.168.43.124.8880 > 192.168.43.146.7771: UDP, length 120
22:46:15.438510 IP 192.168.43.147.8880 > 192.168.43.124.7773: UDP, length 120
22:46:15.484264 IP 192.168.43.124.8880 > 192.168.43.146.7771: UDP, length 120
22:46:15.488708 IP 192.168.43.147.8880 > 192.168.43.124.7773: UDP, length 120
22:46:15.534267 IP 192.168.43.124.8880 > 192.168.43.146.7771: UDP, length 120
22:46:15.542508 IP 192.168.43.147.8880 > 192.168.43.124.7773: UDP, length 120
22:46:15.584264 IP 192.168.43.124.8880 > 192.168.43.146.7771: UDP, length 120
22:46:15.590639 IP 192.168.43.147.8880 > 192.168.43.124.7773: UDP, length 120
22:46:15.634260 IP 192.168.43.124.8880 > 192.168.43.146.7771: UDP, length 120
22:46:15.640890 IP 192.168.43.147.8880 > 192.168.43.124.7773: UDP, length 120
22:46:15.684259 IP 192.168.43.124.8880 > 192.168.43.146.7771: UDP, length 120
22:46:15.691060 IP 192.168.43.147.8880 > 192.168.43.124.7773: UDP, length 120
22:46:15.734260 IP 192.168.43.124.8880 > 192.168.43.146.7771: UDP, length 120
22:46:15.738395 IP 192.168.43.147.8880 > 192.168.43.124.7773: UDP, length 120
22:46:15.784261 IP 192.168.43.124.8880 > 192.168.43.146.7771: UDP, length 120
22:46:15.788201 IP 192.168.43.147.8880 > 192.168.43.124.7773: UDP, length 120
22:46:15.834265 IP 192.168.43.124.8880 > 192.168.43.146.7771: UDP, length 120
22:46:15.835117 IP 192.168.43.147.8880 > 192.168.43.124.7773: UDP, length 120
22:46:15.884274 IP 192.168.43.124.8880 > 192.168.43.146.7771: UDP, length 120
22:46:15.889982 IP 192.168.43.147.8880 > 192.168.43.124.7773: UDP, length 120
22:46:15.934262 IP 192.168.43.124.8880 > 192.168.43.146.7771: UDP, length 120
22:46:15.938375 IP 192.168.43.147.8880 > 192.168.43.124.7773: UDP, length 120
22:46:15.984259 IP 192.168.43.124.8880 > 192.168.43.146.7771: UDP, length 120
22:46:15.988354 IP 192.168.43.147.8880 > 192.168.43.124.7773: UDP, length 120
22:46:16.034761 IP 192.168.43.124.8880 > 192.168.43.146.7771: UDP, length 120
22:46:16.039619 IP 192.168.43.147.8880 > 192.168.43.124.7773: UDP, length 120
22:46:16.084259 IP 192.168.43.124.8880 > 192.168.43.146.7771: UDP, length 120
22:46:16.088205 IP 192.168.43.147.8880 > 192.168.43.124.7773: UDP, length 120
22:46:16.134262 IP 192.168.43.124.8880 > 192.168.43.146.7771: UDP, length 120
22:46:16.140706 IP 192.168.43.147.8880 > 192.168.43.124.7773: UDP, length 120
22:46:16.184260 IP 192.168.43.124.8880 > 192.168.43.146.7771: UDP, length 120
22:46:16.188618 IP 192.168.43.147.8880 > 192.168.43.124.7773: UDP, length 120
22:46:16.234261 IP 192.168.43.124.8880 > 192.168.43.146.7771: UDP, length 120
22:46:16.242200 IP 192.168.43.147.8880 > 192.168.43.124.7773: UDP, length 120
22:46:16.284260 IP 192.168.43.124.8880 > 192.168.43.146.7771: UDP, length 120
22:46:16.285813 IP 192.168.43.147.8880 > 192.168.43.124.7773: UDP, length 120
22:46:16.334306 IP 192.168.43.124.8880 > 192.168.43.146.7771: UDP, length 120
22:46:16.338654 IP 192.168.43.147.8880 > 192.168.43.124.7773: UDP, length 120
22:46:16.384260 IP 192.168.43.124.8880 > 192.168.43.146.7771: UDP, length 120
22:46:16.385806 IP 192.168.43.147.8880 > 192.168.43.124.7773: UDP, length 120
22:46:16.434262 IP 192.168.43.124.8880 > 192.168.43.146.7771: UDP, length 120
22:46:16.438527 IP 192.168.43.147.8880 > 192.168.43.124.7773: UDP, length 120
22:46:16.484259 IP 192.168.43.124.8880 > 192.168.43.146.7771: UDP, length 120
22:46:16.487202 IP 192.168.43.147.8880 > 192.168.43.124.7773: UDP, length 120
22:46:16.534259 IP 192.168.43.124.8880 > 192.168.43.146.7771: UDP, length 120
22:46:16.538534 IP 192.168.43.147.8880 > 192.168.43.124.7773: UDP, length 120
22:46:16.584260 IP 192.168.43.124.8880 > 192.168.43.146.7771: UDP, length 120
22:46:16.588577 IP 192.168.43.147.8880 > 192.168.43.124.7773: UDP, length 120
22:46:16.634260 IP 192.168.43.124.8880 > 192.168.43.146.7771: UDP, length 120
22:46:16.638575 IP 192.168.43.147.8880 > 192.168.43.124.7773: UDP, length 120
22:46:16.684261 IP 192.168.43.124.8880 > 192.168.43.146.7771: UDP, length 120
22:46:16.692096 IP 192.168.43.147.8880 > 192.168.43.124.7773: UDP, length 120
22:46:16.734261 IP 192.168.43.124.8880 > 192.168.43.146.7771: UDP, length 120
22:46:16.739163 IP 192.168.43.147.8880 > 192.168.43.124.7773: UDP, length 120
22:46:16.784261 IP 192.168.43.124.8880 > 192.168.43.146.7771: UDP, length 120
22:46:16.786875 IP 192.168.43.147.8880 > 192.168.43.124.7773: UDP, length 120
22:46:16.834258 IP 192.168.43.124.8880 > 192.168.43.146.7771: UDP, length 120
22:46:16.838573 IP 192.168.43.147.8880 > 192.168.43.124.7773: UDP, length 120
22:46:16.884260 IP 192.168.43.124.8880 > 192.168.43.146.7771: UDP, length 120
22:46:16.885808 IP 192.168.43.147.8880 > 192.168.43.124.7773: UDP, length 120
22:46:16.934198 IP 192.168.43.124.8880 > 192.168.43.146.7771: UDP, length 120
22:46:16.936536 IP 192.168.43.147.8880 > 192.168.43.124.7773: UDP, length 120
22:46:16.984259 IP 192.168.43.124.8880 > 192.168.43.146.7771: UDP, length 120
22:46:16.988807 IP 192.168.43.147.8880 > 192.168.43.124.7773: UDP, length 120
22:46:17.034310 IP 192.168.43.124.8880 > 192.168.43.146.7771: UDP, length 120
22:46:17.039083 IP 192.168.43.147.8880 > 192.168.43.124.7773: UDP, length 120
22:46:17.084308 IP 192.168.43.124.8880 > 192.168.43.146.7771: UDP, length 120
22:46:17.089193 IP 192.168.43.147.8880 > 192.168.43.124.7773: UDP, length 120
22:46:17.134310 IP 192.168.43.124.8880 > 192.168.43.146.7771: UDP, length 120
22:46:17.139112 IP 192.168.43.147.8880 > 192.168.43.124.7773: UDP, length 120
22:46:17.184310 IP 192.168.43.124.8880 > 192.168.43.146.7771: UDP, length 120
22:46:17.191519 IP 192.168.43.147.8880 > 192.168.43.124.7773: UDP, length 120
22:46:17.234308 IP 192.168.43.124.8880 > 192.168.43.146.7771: UDP, length 120
22:46:17.239084 IP 192.168.43.147.8880 > 192.168.43.124.7773: UDP, length 120
22:46:17.284310 IP 192.168.43.124.8880 > 192.168.43.146.7771: UDP, length 120
22:46:17.293641 IP 192.168.43.147.8880 > 192.168.43.124.7773: UDP, length 120
22:46:17.334309 IP 192.168.43.124.8880 > 192.168.43.146.7771: UDP, length 120
22:46:17.338918 IP 192.168.43.147.8880 > 192.168.43.124.7773: UDP, length 120
22:46:17.384265 IP 192.168.43.124.8880 > 192.168.43.146.7771: UDP, length 120
22:46:17.388539 IP 192.168.43.147.8880 > 192.168.43.124.7773: UDP, length 120
22:46:17.434228 IP 192.168.43.124.8880 > 192.168.43.146.7771: UDP, length 120
22:46:17.484264 IP 192.168.43.124.8880 > 192.168.43.146.7771: UDP, length 120
22:46:17.497025 IP 192.168.43.147.8880 > 192.168.43.124.7773: UDP, length 120
22:46:17.497039 IP 192.168.43.147.8880 > 192.168.43.124.7773: UDP, length 120
22:46:17.534228 IP 192.168.43.124.8880 > 192.168.43.146.7771: UDP, length 120
22:46:17.538664 IP 192.168.43.147.8880 > 192.168.43.124.7773: UDP, length 120
22:46:17.584264 IP 192.168.43.124.8880 > 192.168.43.146.7771: UDP, length 120
22:46:17.588179 IP 192.168.43.147.8880 > 192.168.43.124.7773: UDP, length 120
22:46:17.634218 IP 192.168.43.124.8880 > 192.168.43.146.7771: UDP, length 120
22:46:17.648806 IP 192.168.43.147.8880 > 192.168.43.124.7773: UDP, length 120
22:46:17.684263 IP 192.168.43.124.8880 > 192.168.43.146.7771: UDP, length 120
22:46:17.690684 IP 192.168.43.147.8880 > 192.168.43.124.7773: UDP, length 120
22:46:17.734211 IP 192.168.43.124.8880 > 192.168.43.146.7771: UDP, length 120
22:46:17.741376 IP 192.168.43.147.8880 > 192.168.43.124.7773: UDP, length 120
22:46:17.784263 IP 192.168.43.124.8880 > 192.168.43.146.7771: UDP, length 120
22:46:17.797117 IP 192.168.43.147.8880 > 192.168.43.124.7773: UDP, length 120
22:46:17.834208 IP 192.168.43.124.8880 > 192.168.43.146.7771: UDP, length 120
22:46:17.843864 IP 192.168.43.147.8880 > 192.168.43.124.7773: UDP, length 120
22:46:17.884261 IP 192.168.43.124.8880 > 192.168.43.146.7771: UDP, length 120
22:46:17.896100 IP 192.168.43.147.8880 > 192.168.43.124.7773: UDP, length 120
