02:44:55.425581 IP 192.168.43.124.8880 > 192.168.43.146.7771: UDP, length 120
02:44:55.493870 IP 192.168.43.124.8880 > 192.168.43.146.7771: UDP, length 120
02:44:55.526860 IP 192.168.43.124.8880 > 192.168.43.146.7771: UDP, length 120
02:44:55.579459 IP 192.168.43.124.8880 > 192.168.43.146.7771: UDP, length 120
02:44:55.622502 IP 192.168.43.124.8880 > 192.168.43.146.7771: UDP, length 120
02:44:55.672491 IP 192.168.43.124.8880 > 192.168.43.146.7771: UDP, length 120
02:44:55.724869 IP 192.168.43.124.8880 > 192.168.43.146.7771: UDP, length 120
02:44:55.771811 IP 192.168.43.124.8880 > 192.168.43.146.7771: UDP, length 120
02:44:55.822911 IP 192.168.43.124.8880 > 192.168.43.146.7771: UDP, length 120
02:44:55.870297 IP 192.168.43.124.8880 > 192.168.43.146.7771: UDP, length 120
02:44:55.923921 IP 192.168.43.124.8880 > 192.168.43.146.7771: UDP, length 120
02:44:55.973934 IP 192.168.43.124.8880 > 192.168.43.146.7771: UDP, length 120
02:44:56.025908 IP 192.168.43.124.8880 > 192.168.43.146.7771: UDP, length 120
02:44:56.071005 IP 192.168.43.124.8880 > 192.168.43.146.7771: UDP, length 120
02:44:56.121793 IP 192.168.43.124.8880 > 192.168.43.146.7771: UDP, length 120
02:44:56.173399 IP 192.168.43.124.8880 > 192.168.43.146.7771: UDP, length 120
02:44:56.221460 IP 192.168.43.124.8880 > 192.168.43.146.7771: UDP, length 120
02:44:56.272866 IP 192.168.43.124.8880 > 192.168.43.146.7771: UDP, length 120
02:44:56.322528 IP 192.168.43.124.8880 > 192.168.43.146.7771: UDP, length 120
02:44:56.372518 IP 192.168.43.124.8880 > 192.168.43.146.7771: UDP, length 120
02:44:56.423513 IP 192.168.43.124.8880 > 192.168.43.146.7771: UDP, length 120
02:44:56.473588 IP 192.168.43.124.8880 > 192.168.43.146.7771: UDP, length 120
02:44:56.524798 IP 192.168.43.124.8880 > 192.168.43.146.7771: UDP, length 120
02:44:56.575334 IP 192.168.43.124.8880 > 192.168.43.146.7771: UDP, length 120
02:44:56.627733 IP 192.168.43.124.8880 > 192.168.43.146.7771: UDP, length 120
02:44:56.679896 IP 192.168.43.124.8880 > 192.168.43.146.7771: UDP, length 120
02:44:56.721845 IP 192.168.43.124.8880 > 192.168.43.146.7771: UDP, length 120
02:44:56.768401 IP 192.168.43.146.8880 > 192.168.43.147.7772: UDP, length 120
02:44:56.768910 IP 192.168.43.124.8880 > 192.168.43.146.7771: UDP, length 120
02:44:56.783972 IP 192.168.43.146.8880 > 192.168.43.147.7772: UDP, length 120
02:44:56.822552 IP 192.168.43.124.8880 > 192.168.43.146.7771: UDP, length 120
02:44:56.833960 IP 192.168.43.146.8880 > 192.168.43.147.7772: UDP, length 120
02:44:56.874588 IP 192.168.43.124.8880 > 192.168.43.146.7771: UDP, length 120
02:44:56.883952 IP 192.168.43.146.8880 > 192.168.43.147.7772: UDP, length 120
02:44:56.922541 IP 192.168.43.124.8880 > 192.168.43.146.7771: UDP, length 120
02:44:56.933948 IP 192.168.43.146.8880 > 192.168.43.147.7772: UDP, length 120
02:44:56.974278 IP 192.168.43.124.8880 > 192.168.43.146.7771: UDP, length 120
02:44:56.983948 IP 192.168.43.146.8880 > 192.168.43.147.7772: UDP, length 120
02:44:57.023161 IP 192.168.43.124.8880 > 192.168.43.146.7771: UDP, length 120
02:44:57.033948 IP 192.168.43.146.8880 > 192.168.43.147.7772: UDP, length 120
02:44:57.073363 IP 192.168.43.124.8880 > 192.168.43.146.7771: UDP, length 120
02:44:57.083958 IP 192.168.43.146.8880 > 192.168.43.147.7772: UDP, length 120
02:44:57.129747 IP 192.168.43.124.8880 > 192.168.43.146.7771: UDP, length 120
02:44:57.133956 IP 192.168.43.146.8880 > 192.168.43.147.7772: UDP, length 120
02:44:57.171501 IP 192.168.43.124.8880 > 192.168.43.146.7771: UDP, length 120
02:44:57.183952 IP 192.168.43.146.8880 > 192.168.43.147.7772: UDP, length 120
02:44:57.222891 IP 192.168.43.124.8880 > 192.168.43.146.7771: UDP, length 120
02:44:57.233949 IP 192.168.43.146.8880 > 192.168.43.147.7772: UDP, length 120
02:44:57.273817 IP 192.168.43.124.8880 > 192.168.43.146.7771: UDP, length 120
02:44:57.283949 IP 192.168.43.146.8880 > 192.168.43.147.7772: UDP, length 120
02:44:57.324936 IP 192.168.43.124.8880 > 192.168.43.146.7771: UDP, length 120
02:44:57.333949 IP 192.168.43.146.8880 > 192.168.43.147.7772: UDP, length 120
02:44:57.373608 IP 192.168.43.124.8880 > 192.168.43.146.7771: UDP, length 120
02:44:57.384833 IP 192.168.43.146.8880 > 192.168.43.147.7772: UDP, length 120
02:44:57.421945 IP 192.168.43.124.8880 > 192.168.43.146.7771: UDP, length 120
02:44:57.434007 IP 192.168.43.146.8880 > 192.168.43.147.7772: UDP, length 120
02:44:57.471779 IP 192.168.43.124.8880 > 192.168.43.146.7771: UDP, length 120
02:44:57.483973 IP 192.168.43.146.8880 > 192.168.43.147.7772: UDP, length 120
02:44:57.524655 IP 192.168.43.124.8880 > 192.168.43.146.7771: UDP, length 120
02:44:57.533952 IP 192.168.43.146.8880 > 192.168.43.147.7772: UDP, length 120
02:44:57.576379 IP 192.168.43.124.8880 > 192.168.43.146.7771: UDP, length 120
02:44:57.583953 IP 192.168.43.146.8880 > 192.168.43.147.7772: UDP, length 120
02:44:57.628985 IP 192.168.43.124.8880 > 192.168.43.146.7771: UDP, length 120
02:44:57.634018 IP 192.168.43.146.8880 > 192.168.43.147.7772: UDP, length 120
02:44:57.680603 IP 192.168.43.124.8880 > 192.168.43.146.7771: UDP, length 120
02:44:57.683980 IP 192.168.43.146.8880 > 192.168.43.147.7772: UDP, length 120
02:44:57.724287 IP 192.168.43.124.8880 > 192.168.43.146.7771: UDP, length 120
02:44:57.733974 IP 192.168.43.146.8880 > 192.168.43.147.7772: UDP, length 120
02:44:57.772984 IP 192.168.43.124.8880 > 192.168.43.146.7771: UDP, length 120
02:44:57.783971 IP 192.168.43.146.8880 > 192.168.43.147.7772: UDP, length 120
02:44:57.823676 IP 192.168.43.124.8880 > 192.168.43.146.7771: UDP, length 120
02:44:57.833991 IP 192.168.43.146.8880 > 192.168.43.147.7772: UDP, length 120
02:44:57.874052 IP 192.168.43.124.8880 > 192.168.43.146.7771: UDP, length 120
02:44:57.884009 IP 192.168.43.146.8880 > 192.168.43.147.7772: UDP, length 120
02:44:57.924353 IP 192.168.43.124.8880 > 192.168.43.146.7771: UDP, length 120
02:44:57.933978 IP 192.168.43.146.8880 > 192.168.43.147.7772: UDP, length 120
02:44:57.974526 IP 192.168.43.124.8880 > 192.168.43.146.7771: UDP, length 120
02:44:57.984000 IP 192.168.43.146.8880 > 192.168.43.147.7772: UDP, length 120
02:44:58.024284 IP 192.168.43.124.8880 > 192.168.43.146.7771: UDP, length 120
02:44:58.033993 IP 192.168.43.146.8880 > 192.168.43.147.7772: UDP, length 120
02:44:58.075627 IP 192.168.43.124.8880 > 192.168.43.146.7771: UDP, length 120
02:44:58.084008 IP 192.168.43.146.8880 > 192.168.43.147.7772: UDP, length 120
02:44:58.124252 IP 192.168.43.124.8880 > 192.168.43.146.7771: UDP, length 120
02:44:58.133997 IP 192.168.43.146.8880 > 192.168.43.147.7772: UDP, length 120
02:44:58.175794 IP 192.168.43.124.8880 > 192.168.43.146.7771: UDP, length 120
02:44:58.183985 IP 192.168.43.146.8880 > 192.168.43.147.7772: UDP, length 120
02:44:58.223408 IP 192.168.43.124.8880 > 192.168.43.146.7771: UDP, length 120
02:44:58.233973 IP 192.168.43.146.8880 > 192.168.43.147.7772: UDP, length 120
02:44:58.273346 IP 192.168.43.124.8880 > 192.168.43.146.7771: UDP, length 120
02:44:58.283972 IP 192.168.43.146.8880 > 192.168.43.147.7772: UDP, length 120
02:44:58.323371 IP 192.168.43.124.8880 > 192.168.43.146.7771: UDP, length 120
02:44:58.333970 IP 192.168.43.146.8880 > 192.168.43.147.7772: UDP, length 120
02:44:58.373309 IP 192.168.43.124.8880 > 192.168.43.146.7771: UDP, length 120
02:44:58.383974 IP 192.168.43.146.8880 > 192.168.43.147.7772: UDP, length 120
02:44:58.423494 IP 192.168.43.124.8880 > 192.168.43.146.7771: UDP, length 120
02:44:58.434095 IP 192.168.43.146.8880 > 192.168.43.147.7772: UDP, length 120
02:44:58.473558 IP 192.168.43.124.8880 > 192.168.43.146.7771: UDP, length 120
02:44:58.484061 IP 192.168.43.146.8880 > 192.168.43.147.7772: UDP, length 120
02:44:58.523383 IP 192.168.43.124.8880 > 192.168.43.146.7771: UDP, length 120
02:44:58.533988 IP 192.168.43.146.8880 > 192.168.43.147.7772: UDP, length 120
02:44:58.573815 IP 192.168.43.124.8880 > 192.168.43.146.7771: UDP, length 120
02:44:58.583956 IP 192.168.43.146.8880 > 192.168.43.147.7772: UDP, length 120
02:44:58.624575 IP 192.168.43.124.8880 > 192.168.43.146.7771: UDP, length 120
02:44:58.633952 IP 192.168.43.146.8880 > 192.168.43.147.7772: UDP, length 120
02:44:58.674534 IP 192.168.43.124.8880 > 192.168.43.146.7771: UDP, length 120
02:44:58.683948 IP 192.168.43.146.8880 > 192.168.43.147.7772: UDP, length 120
02:44:58.723402 IP 192.168.43.124.8880 > 192.168.43.146.7771: UDP, length 120
02:44:58.733947 IP 192.168.43.146.8880 > 192.168.43.147.7772: UDP, length 120
02:44:58.773484 IP 192.168.43.124.8880 > 192.168.43.146.7771: UDP, length 120
02:44:58.784029 IP 192.168.43.146.8880 > 192.168.43.147.7772: UDP, length 120
02:44:58.823512 IP 192.168.43.124.8880 > 192.168.43.146.7771: UDP, length 120
02:44:58.834011 IP 192.168.43.146.8880 > 192.168.43.147.7772: UDP, length 120
02:44:58.873501 IP 192.168.43.124.8880 > 192.168.43.146.7771: UDP, length 120
02:44:58.884002 IP 192.168.43.146.8880 > 192.168.43.147.7772: UDP, length 120
02:44:58.923412 IP 192.168.43.124.8880 > 192.168.43.146.7771: UDP, length 120
02:44:58.934036 IP 192.168.43.146.8880 > 192.168.43.147.7772: UDP, length 120
02:44:58.971867 IP 192.168.43.124.8880 > 192.168.43.146.7771: UDP, length 120
02:44:58.984055 IP 192.168.43.146.8880 > 192.168.43.147.7772: UDP, length 120
02:44:59.023392 IP 192.168.43.124.8880 > 192.168.43.146.7771: UDP, length 120
02:44:59.034021 IP 192.168.43.146.8880 > 192.168.43.147.7772: UDP, length 120
02:44:59.073494 IP 192.168.43.124.8880 > 192.168.43.146.7771: UDP, length 120
02:44:59.084010 IP 192.168.43.146.8880 > 192.168.43.147.7772: UDP, length 120
02:44:59.125711 IP 192.168.43.124.8880 > 192.168.43.146.7771: UDP, length 120
02:44:59.134024 IP 192.168.43.146.8880 > 192.168.43.147.7772: UDP, length 120
02:44:59.171893 IP 192.168.43.124.8880 > 192.168.43.146.7771: UDP, length 120
02:44:59.183992 IP 192.168.43.146.8880 > 192.168.43.147.7772: UDP, length 120
02:44:59.223700 IP 192.168.43.124.8880 > 192.168.43.146.7771: UDP, length 120
02:44:59.233962 IP 192.168.43.146.8880 > 192.168.43.147.7772: UDP, length 120
02:44:59.272106 IP 192.168.43.124.8880 > 192.168.43.146.7771: UDP, length 120
02:44:59.283953 IP 192.168.43.146.8880 > 192.168.43.147.7772: UDP, length 120
02:44:59.331838 IP 192.168.43.124.8880 > 192.168.43.146.7771: UDP, length 120
02:44:59.333948 IP 192.168.43.146.8880 > 192.168.43.147.7772: UDP, length 120
02:44:59.372779 IP 192.168.43.124.8880 > 192.168.43.146.7771: UDP, length 120
02:44:59.383950 IP 192.168.43.146.8880 > 192.168.43.147.7772: UDP, length 120
02:44:59.422887 IP 192.168.43.124.8880 > 192.168.43.146.7771: UDP, length 120
02:44:59.433947 IP 192.168.43.146.8880 > 192.168.43.147.7772: UDP, length 120
02:44:59.472717 IP 192.168.43.124.8880 > 192.168.43.146.7771: UDP, length 120
02:44:59.483949 IP 192.168.43.146.8880 > 192.168.43.147.7772: UDP, length 120
02:44:59.521794 IP 192.168.43.124.8880 > 192.168.43.146.7771: UDP, length 120
02:44:59.533989 IP 192.168.43.146.8880 > 192.168.43.147.7772: UDP, length 120
02:44:59.573135 IP 192.168.43.124.8880 > 192.168.43.146.7771: UDP, length 120
02:44:59.583958 IP 192.168.43.146.8880 > 192.168.43.147.7772: UDP, length 120
02:44:59.622860 IP 192.168.43.124.8880 > 192.168.43.146.7771: UDP, length 120
02:44:59.633950 IP 192.168.43.146.8880 > 192.168.43.147.7772: UDP, length 120
02:44:59.675082 IP 192.168.43.124.8880 > 192.168.43.146.7771: UDP, length 120
02:44:59.683951 IP 192.168.43.146.8880 > 192.168.43.147.7772: UDP, length 120
02:44:59.722712 IP 192.168.43.124.8880 > 192.168.43.146.7771: UDP, length 120
02:44:59.733947 IP 192.168.43.146.8880 > 192.168.43.147.7772: UDP, length 120
02:44:59.775727 IP 192.168.43.124.8880 > 192.168.43.146.7771: UDP, length 120
02:44:59.783948 IP 192.168.43.146.8880 > 192.168.43.147.7772: UDP, length 120
02:44:59.822708 IP 192.168.43.124.8880 > 192.168.43.146.7771: UDP, length 120
02:44:59.833953 IP 192.168.43.146.8880 > 192.168.43.147.7772: UDP, length 120
02:44:59.872719 IP 192.168.43.124.8880 > 192.168.43.146.7771: UDP, length 120
02:44:59.883949 IP 192.168.43.146.8880 > 192.168.43.147.7772: UDP, length 120
02:44:59.921717 IP 192.168.43.124.8880 > 192.168.43.146.7771: UDP, length 120
02:44:59.933948 IP 192.168.43.146.8880 > 192.168.43.147.7772: UDP, length 120
02:44:59.972730 IP 192.168.43.124.8880 > 192.168.43.146.7771: UDP, length 120
02:44:59.983948 IP 192.168.43.146.8880 > 192.168.43.147.7772: UDP, length 120
02:45:00.022718 IP 192.168.43.124.8880 > 192.168.43.146.7771: UDP, length 120
02:45:00.033948 IP 192.168.43.146.8880 > 192.168.43.147.7772: UDP, length 120
02:45:00.072663 IP 192.168.43.124.8880 > 192.168.43.146.7771: UDP, length 120
02:45:00.083953 IP 192.168.43.146.8880 > 192.168.43.147.7772: UDP, length 120
02:45:00.123789 IP 192.168.43.124.8880 > 192.168.43.146.7771: UDP, length 120
02:45:00.133949 IP 192.168.43.146.8880 > 192.168.43.147.7772: UDP, length 120
02:45:00.170895 IP 192.168.43.124.8880 > 192.168.43.146.7771: UDP, length 120
02:45:00.183952 IP 192.168.43.146.8880 > 192.168.43.147.7772: UDP, length 120
02:45:00.225382 IP 192.168.43.124.8880 > 192.168.43.146.7771: UDP, length 120
02:45:00.233953 IP 192.168.43.146.8880 > 192.168.43.147.7772: UDP, length 120
02:45:00.272669 IP 192.168.43.124.8880 > 192.168.43.146.7771: UDP, length 120
02:45:00.283957 IP 192.168.43.146.8880 > 192.168.43.147.7772: UDP, length 120
02:45:00.325480 IP 192.168.43.124.8880 > 192.168.43.146.7771: UDP, length 120
02:45:00.333949 IP 192.168.43.146.8880 > 192.168.43.147.7772: UDP, length 120
02:45:00.372131 IP 192.168.43.124.8880 > 192.168.43.146.7771: UDP, length 120
02:45:00.383951 IP 192.168.43.146.8880 > 192.168.43.147.7772: UDP, length 120
02:45:00.422446 IP 192.168.43.124.8880 > 192.168.43.146.7771: UDP, length 120
02:45:00.433947 IP 192.168.43.146.8880 > 192.168.43.147.7772: UDP, length 120
02:45:00.472750 IP 192.168.43.124.8880 > 192.168.43.146.7771: UDP, length 120
02:45:00.483948 IP 192.168.43.146.8880 > 192.168.43.147.7772: UDP, length 120
02:45:00.521798 IP 192.168.43.124.8880 > 192.168.43.146.7771: UDP, length 120
02:45:00.533992 IP 192.168.43.146.8880 > 192.168.43.147.7772: UDP, length 120
02:45:00.571761 IP 192.168.43.124.8880 > 192.168.43.146.7771: UDP, length 120
02:45:00.583953 IP 192.168.43.146.8880 > 192.168.43.147.7772: UDP, length 120
02:45:00.622778 IP 192.168.43.124.8880 > 192.168.43.146.7771: UDP, length 120
02:45:00.633985 IP 192.168.43.146.8880 > 192.168.43.147.7772: UDP, length 120
02:45:00.672776 IP 192.168.43.124.8880 > 192.168.43.146.7771: UDP, length 120
02:45:00.683955 IP 192.168.43.146.8880 > 192.168.43.147.7772: UDP, length 120
02:45:00.722747 IP 192.168.43.124.8880 > 192.168.43.146.7771: UDP, length 120
02:45:00.733952 IP 192.168.43.146.8880 > 192.168.43.147.7772: UDP, length 120
02:45:00.774669 IP 192.168.43.124.8880 > 192.168.43.146.7771: UDP, length 120
02:45:00.783950 IP 192.168.43.146.8880 > 192.168.43.147.7772: UDP, length 120
02:45:00.823466 IP 192.168.43.124.8880 > 192.168.43.146.7771: UDP, length 120
02:45:00.833954 IP 192.168.43.146.8880 > 192.168.43.147.7772: UDP, length 120
02:45:00.874803 IP 192.168.43.124.8880 > 192.168.43.146.7771: UDP, length 120
02:45:00.883950 IP 192.168.43.146.8880 > 192.168.43.147.7772: UDP, length 120
02:45:00.922578 IP 192.168.43.124.8880 > 192.168.43.146.7771: UDP, length 120
02:45:00.933949 IP 192.168.43.146.8880 > 192.168.43.147.7772: UDP, length 120
02:45:00.972653 IP 192.168.43.124.8880 > 192.168.43.146.7771: UDP, length 120
02:45:00.983949 IP 192.168.43.146.8880 > 192.168.43.147.7772: UDP, length 120
02:45:01.022857 IP 192.168.43.124.8880 > 192.168.43.146.7771: UDP, length 120
02:45:01.033982 IP 192.168.43.146.8880 > 192.168.43.147.7772: UDP, length 120
02:45:01.071959 IP 192.168.43.124.8880 > 192.168.43.146.7771: UDP, length 120
02:45:01.083957 IP 192.168.43.146.8880 > 192.168.43.147.7772: UDP, length 120
02:45:01.121012 IP 192.168.43.124.8880 > 192.168.43.146.7771: UDP, length 120
02:45:01.133953 IP 192.168.43.146.8880 > 192.168.43.147.7772: UDP, length 120
02:45:01.172725 IP 192.168.43.124.8880 > 192.168.43.146.7771: UDP, length 120
02:45:01.183952 IP 192.168.43.146.8880 > 192.168.43.147.7772: UDP, length 120
02:45:01.222139 IP 192.168.43.124.8880 > 192.168.43.146.7771: UDP, length 120
02:45:01.233949 IP 192.168.43.146.8880 > 192.168.43.147.7772: UDP, length 120
02:45:01.277378 IP 192.168.43.124.8880 > 192.168.43.146.7771: UDP, length 120
02:45:01.283952 IP 192.168.43.146.8880 > 192.168.43.147.7772: UDP, length 120
02:45:01.322645 IP 192.168.43.124.8880 > 192.168.43.146.7771: UDP, length 120
02:45:01.333957 IP 192.168.43.146.8880 > 192.168.43.147.7772: UDP, length 120
02:45:01.374038 IP 192.168.43.124.8880 > 192.168.43.146.7771: UDP, length 120
02:45:01.383955 IP 192.168.43.146.8880 > 192.168.43.147.7772: UDP, length 120
02:45:01.422677 IP 192.168.43.124.8880 > 192.168.43.146.7771: UDP, length 120
02:45:01.433948 IP 192.168.43.146.8880 > 192.168.43.147.7772: UDP, length 120
02:45:01.472643 IP 192.168.43.124.8880 > 192.168.43.146.7771: UDP, length 120
02:45:01.483948 IP 192.168.43.146.8880 > 192.168.43.147.7772: UDP, length 120
02:45:01.522770 IP 192.168.43.124.8880 > 192.168.43.146.7771: UDP, length 120
02:45:01.533988 IP 192.168.43.146.8880 > 192.168.43.147.7772: UDP, length 120
02:45:01.572701 IP 192.168.43.124.8880 > 192.168.43.146.7771: UDP, length 120
02:45:01.583956 IP 192.168.43.146.8880 > 192.168.43.147.7772: UDP, length 120
02:45:01.622723 IP 192.168.43.124.8880 > 192.168.43.146.7771: UDP, length 120
02:45:01.633949 IP 192.168.43.146.8880 > 192.168.43.147.7772: UDP, length 120
02:45:01.672721 IP 192.168.43.124.8880 > 192.168.43.146.7771: UDP, length 120
02:45:01.683950 IP 192.168.43.146.8880 > 192.168.43.147.7772: UDP, length 120
02:45:01.722728 IP 192.168.43.124.8880 > 192.168.43.146.7771: UDP, length 120
02:45:01.733949 IP 192.168.43.146.8880 > 192.168.43.147.7772: UDP, length 120
02:45:01.774915 IP 192.168.43.124.8880 > 192.168.43.146.7771: UDP, length 120
02:45:01.783949 IP 192.168.43.146.8880 > 192.168.43.147.7772: UDP, length 120
02:45:01.823425 IP 192.168.43.124.8880 > 192.168.43.146.7771: UDP, length 120
02:45:01.833956 IP 192.168.43.146.8880 > 192.168.43.147.7772: UDP, length 120
02:45:01.883949 IP 192.168.43.146.8880 > 192.168.43.147.7772: UDP, length 120
02:45:01.887201 IP 192.168.43.124.8880 > 192.168.43.146.7771: UDP, length 120
02:45:01.921825 IP 192.168.43.124.8880 > 192.168.43.146.7771: UDP, length 120
02:45:01.933948 IP 192.168.43.146.8880 > 192.168.43.147.7772: UDP, length 120
02:45:01.971628 IP 192.168.43.124.8880 > 192.168.43.146.7771: UDP, length 120
02:45:01.983952 IP 192.168.43.146.8880 > 192.168.43.147.7772: UDP, length 120
02:45:02.022466 IP 192.168.43.124.8880 > 192.168.43.146.7771: UDP, length 120
02:45:02.033952 IP 192.168.43.146.8880 > 192.168.43.147.7772: UDP, length 120
02:45:02.072600 IP 192.168.43.124.8880 > 192.168.43.146.7771: UDP, length 120
02:45:02.083949 IP 192.168.43.146.8880 > 192.168.43.147.7772: UDP, length 120
02:45:02.122646 IP 192.168.43.124.8880 > 192.168.43.146.7771: UDP, length 120
02:45:02.133980 IP 192.168.43.146.8880 > 192.168.43.147.7772: UDP, length 120
02:45:02.183957 IP 192.168.43.146.8880 > 192.168.43.147.7772: UDP, length 120
02:45:02.194254 IP 192.168.43.124.8880 > 192.168.43.146.7771: UDP, length 120
02:45:02.222595 IP 192.168.43.124.8880 > 192.168.43.146.7771: UDP, length 120
02:45:02.233950 IP 192.168.43.146.8880 > 192.168.43.147.7772: UDP, length 120
02:45:02.273149 IP 192.168.43.124.8880 > 192.168.43.146.7771: UDP, length 120
02:45:02.283949 IP 192.168.43.146.8880 > 192.168.43.147.7772: UDP, length 120
02:45:02.322610 IP 192.168.43.124.8880 > 192.168.43.146.7771: UDP, length 120
02:45:02.333956 IP 192.168.43.146.8880 > 192.168.43.147.7772: UDP, length 120
02:45:02.374667 IP 192.168.43.124.8880 > 192.168.43.146.7771: UDP, length 120
02:45:02.383956 IP 192.168.43.146.8880 > 192.168.43.147.7772: UDP, length 120
02:45:02.422645 IP 192.168.43.124.8880 > 192.168.43.146.7771: UDP, length 120
02:45:02.433948 IP 192.168.43.146.8880 > 192.168.43.147.7772: UDP, length 120
02:45:02.475288 IP 192.168.43.124.8880 > 192.168.43.146.7771: UDP, length 120
02:45:02.483949 IP 192.168.43.146.8880 > 192.168.43.147.7772: UDP, length 120
02:45:02.521879 IP 192.168.43.124.8880 > 192.168.43.146.7771: UDP, length 120
02:45:02.534054 IP 192.168.43.146.8880 > 192.168.43.147.7772: UDP, length 120
02:45:02.571781 IP 192.168.43.124.8880 > 192.168.43.146.7771: UDP, length 120
02:45:02.583975 IP 192.168.43.146.8880 > 192.168.43.147.7772: UDP, length 120
02:45:02.622856 IP 192.168.43.124.8880 > 192.168.43.146.7771: UDP, length 120
02:45:02.633981 IP 192.168.43.146.8880 > 192.168.43.147.7772: UDP, length 120
02:45:02.672711 IP 192.168.43.124.8880 > 192.168.43.146.7771: UDP, length 120
02:45:02.683976 IP 192.168.43.146.8880 > 192.168.43.147.7772: UDP, length 120
02:45:02.722633 IP 192.168.43.124.8880 > 192.168.43.146.7771: UDP, length 120
02:45:02.733973 IP 192.168.43.146.8880 > 192.168.43.147.7772: UDP, length 120
02:45:02.772682 IP 192.168.43.124.8880 > 192.168.43.146.7771: UDP, length 120
02:45:02.783972 IP 192.168.43.146.8880 > 192.168.43.147.7772: UDP, length 120
02:45:02.822700 IP 192.168.43.124.8880 > 192.168.43.146.7771: UDP, length 120
02:45:02.833983 IP 192.168.43.146.8880 > 192.168.43.147.7772: UDP, length 120
02:45:02.872671 IP 192.168.43.124.8880 > 192.168.43.146.7771: UDP, length 120
02:45:02.883975 IP 192.168.43.146.8880 > 192.168.43.147.7772: UDP, length 120
02:45:02.922892 IP 192.168.43.124.8880 > 192.168.43.146.7771: UDP, length 120
02:45:02.933973 IP 192.168.43.146.8880 > 192.168.43.147.7772: UDP, length 120
02:45:02.970715 IP 192.168.43.124.8880 > 192.168.43.146.7771: UDP, length 120
02:45:02.983975 IP 192.168.43.146.8880 > 192.168.43.147.7772: UDP, length 120
02:45:03.020688 IP 192.168.43.124.8880 > 192.168.43.146.7771: UDP, length 120
02:45:03.033974 IP 192.168.43.146.8880 > 192.168.43.147.7772: UDP, length 120
02:45:03.070841 IP 192.168.43.124.8880 > 192.168.43.146.7771: UDP, length 120
02:45:03.083978 IP 192.168.43.146.8880 > 192.168.43.147.7772: UDP, length 120
02:45:03.120086 IP 192.168.43.124.8880 > 192.168.43.146.7771: UDP, length 120
02:45:03.133975 IP 192.168.43.146.8880 > 192.168.43.147.7772: UDP, length 120
02:45:03.173505 IP 192.168.43.124.8880 > 192.168.43.146.7771: UDP, length 120
02:45:03.183973 IP 192.168.43.146.8880 > 192.168.43.147.7772: UDP, length 120
02:45:03.223381 IP 192.168.43.124.8880 > 192.168.43.146.7771: UDP, length 120
02:45:03.233972 IP 192.168.43.146.8880 > 192.168.43.147.7772: UDP, length 120
02:45:03.272912 IP 192.168.43.124.8880 > 192.168.43.146.7771: UDP, length 120
02:45:03.283971 IP 192.168.43.146.8880 > 192.168.43.147.7772: UDP, length 120
02:45:03.325660 IP 192.168.43.124.8880 > 192.168.43.146.7771: UDP, length 120
02:45:03.333973 IP 192.168.43.146.8880 > 192.168.43.147.7772: UDP, length 120
02:45:03.374514 IP 192.168.43.124.8880 > 192.168.43.146.7771: UDP, length 120
02:45:03.383983 IP 192.168.43.146.8880 > 192.168.43.147.7772: UDP, length 120
02:45:03.424868 IP 192.168.43.124.8880 > 192.168.43.146.7771: UDP, length 120
02:45:03.433976 IP 192.168.43.146.8880 > 192.168.43.147.7772: UDP, length 120
02:45:03.472735 IP 192.168.43.124.8880 > 192.168.43.146.7771: UDP, length 120
02:45:03.483981 IP 192.168.43.146.8880 > 192.168.43.147.7772: UDP, length 120
02:45:03.524523 IP 192.168.43.124.8880 > 192.168.43.146.7771: UDP, length 120
02:45:03.533979 IP 192.168.43.146.8880 > 192.168.43.147.7772: UDP, length 120
02:45:03.571859 IP 192.168.43.124.8880 > 192.168.43.146.7771: UDP, length 120
02:45:03.584022 IP 192.168.43.146.8880 > 192.168.43.147.7772: UDP, length 120
02:45:03.622785 IP 192.168.43.124.8880 > 192.168.43.146.7771: UDP, length 120
02:45:03.634033 IP 192.168.43.146.8880 > 192.168.43.147.7772: UDP, length 120
02:45:03.673778 IP 192.168.43.124.8880 > 192.168.43.146.7771: UDP, length 120
02:45:03.683992 IP 192.168.43.146.8880 > 192.168.43.147.7772: UDP, length 120
02:45:03.722640 IP 192.168.43.124.8880 > 192.168.43.146.7771: UDP, length 120
02:45:03.733979 IP 192.168.43.146.8880 > 192.168.43.147.7772: UDP, length 120
02:45:03.772809 IP 192.168.43.124.8880 > 192.168.43.146.7771: UDP, length 120
02:45:03.783973 IP 192.168.43.146.8880 > 192.168.43.147.7772: UDP, length 120
02:45:03.822368 IP 192.168.43.124.8880 > 192.168.43.146.7771: UDP, length 120
02:45:03.833980 IP 192.168.43.146.8880 > 192.168.43.147.7772: UDP, length 120
02:45:03.873013 IP 192.168.43.124.8880 > 192.168.43.146.7771: UDP, length 120
02:45:03.883975 IP 192.168.43.146.8880 > 192.168.43.147.7772: UDP, length 120
02:45:03.923476 IP 192.168.43.124.8880 > 192.168.43.146.7771: UDP, length 120
02:45:03.933972 IP 192.168.43.146.8880 > 192.168.43.147.7772: UDP, length 120
02:45:03.974214 IP 192.168.43.124.8880 > 192.168.43.146.7771: UDP, length 120
02:45:03.983982 IP 192.168.43.146.8880 > 192.168.43.147.7772: UDP, length 120
02:45:04.023633 IP 192.168.43.124.8880 > 192.168.43.146.7771: UDP, length 120
02:45:04.033979 IP 192.168.43.146.8880 > 192.168.43.147.7772: UDP, length 120
02:45:04.072831 IP 192.168.43.124.8880 > 192.168.43.146.7771: UDP, length 120
02:45:04.083977 IP 192.168.43.146.8880 > 192.168.43.147.7772: UDP, length 120
02:45:04.122748 IP 192.168.43.124.8880 > 192.168.43.146.7771: UDP, length 120
02:45:04.133975 IP 192.168.43.146.8880 > 192.168.43.147.7772: UDP, length 120
02:45:04.172823 IP 192.168.43.124.8880 > 192.168.43.146.7771: UDP, length 120
02:45:04.184041 IP 192.168.43.146.8880 > 192.168.43.147.7772: UDP, length 120
02:45:04.221252 IP 192.168.43.124.8880 > 192.168.43.146.7771: UDP, length 120
02:45:04.234098 IP 192.168.43.146.8880 > 192.168.43.147.7772: UDP, length 120
02:45:04.278355 IP 192.168.43.124.8880 > 192.168.43.146.7771: UDP, length 120
02:45:04.284088 IP 192.168.43.146.8880 > 192.168.43.147.7772: UDP, length 120
02:45:04.322833 IP 192.168.43.124.8880 > 192.168.43.146.7771: UDP, length 120
02:45:04.334009 IP 192.168.43.146.8880 > 192.168.43.147.7772: UDP, length 120
02:45:04.371830 IP 192.168.43.124.8880 > 192.168.43.146.7771: UDP, length 120
02:45:04.384023 IP 192.168.43.146.8880 > 192.168.43.147.7772: UDP, length 120
02:45:04.423873 IP 192.168.43.124.8880 > 192.168.43.146.7771: UDP, length 120
02:45:04.434028 IP 192.168.43.146.8880 > 192.168.43.147.7772: UDP, length 120
02:45:04.468803 IP 192.168.43.124.8880 > 192.168.43.146.7771: UDP, length 120
02:45:04.484030 IP 192.168.43.146.8880 > 192.168.43.147.7772: UDP, length 120
02:45:04.526073 IP 192.168.43.124.8880 > 192.168.43.146.7771: UDP, length 120
02:45:04.534016 IP 192.168.43.146.8880 > 192.168.43.147.7772: UDP, length 120
02:45:04.571932 IP 192.168.43.124.8880 > 192.168.43.146.7771: UDP, length 120
02:45:04.584016 IP 192.168.43.146.8880 > 192.168.43.147.7772: UDP, length 120
02:45:04.626278 IP 192.168.43.124.8880 > 192.168.43.146.7771: UDP, length 120
02:45:04.634011 IP 192.168.43.146.8880 > 192.168.43.147.7772: UDP, length 120
02:45:04.671781 IP 192.168.43.124.8880 > 192.168.43.146.7771: UDP, length 120
02:45:04.683989 IP 192.168.43.146.8880 > 192.168.43.147.7772: UDP, length 120
02:45:04.721768 IP 192.168.43.124.8880 > 192.168.43.146.7771: UDP, length 120
02:45:04.733954 IP 192.168.43.146.8880 > 192.168.43.147.7772: UDP, length 120
02:45:04.771612 IP 192.168.43.124.8880 > 192.168.43.146.7771: UDP, length 120
02:45:04.783950 IP 192.168.43.146.8880 > 192.168.43.147.7772: UDP, length 120
02:45:04.822746 IP 192.168.43.124.8880 > 192.168.43.146.7771: UDP, length 120
02:45:04.833958 IP 192.168.43.146.8880 > 192.168.43.147.7772: UDP, length 120
02:45:04.872605 IP 192.168.43.124.8880 > 192.168.43.146.7771: UDP, length 120
02:45:04.883950 IP 192.168.43.146.8880 > 192.168.43.147.7772: UDP, length 120
02:45:04.922588 IP 192.168.43.124.8880 > 192.168.43.146.7771: UDP, length 120
02:45:04.933949 IP 192.168.43.146.8880 > 192.168.43.147.7772: UDP, length 120
02:45:04.971618 IP 192.168.43.124.8880 > 192.168.43.146.7771: UDP, length 120
02:45:04.983952 IP 192.168.43.146.8880 > 192.168.43.147.7772: UDP, length 120
02:45:05.024134 IP 192.168.43.124.8880 > 192.168.43.146.7771: UDP, length 120
02:45:05.033950 IP 192.168.43.146.8880 > 192.168.43.147.7772: UDP, length 120
02:45:05.072744 IP 192.168.43.124.8880 > 192.168.43.146.7771: UDP, length 120
02:45:05.083951 IP 192.168.43.146.8880 > 192.168.43.147.7772: UDP, length 120
02:45:05.122598 IP 192.168.43.124.8880 > 192.168.43.146.7771: UDP, length 120
02:45:05.133987 IP 192.168.43.146.8880 > 192.168.43.147.7772: UDP, length 120
02:45:05.172686 IP 192.168.43.124.8880 > 192.168.43.146.7771: UDP, length 120
02:45:05.183965 IP 192.168.43.146.8880 > 192.168.43.147.7772: UDP, length 120
02:45:05.222635 IP 192.168.43.124.8880 > 192.168.43.146.7771: UDP, length 120
02:45:05.233948 IP 192.168.43.146.8880 > 192.168.43.147.7772: UDP, length 120
02:45:05.272609 IP 192.168.43.124.8880 > 192.168.43.146.7771: UDP, length 120
02:45:05.283950 IP 192.168.43.146.8880 > 192.168.43.147.7772: UDP, length 120
02:45:05.322662 IP 192.168.43.124.8880 > 192.168.43.146.7771: UDP, length 120
02:45:05.333951 IP 192.168.43.146.8880 > 192.168.43.147.7772: UDP, length 120
02:45:05.371647 IP 192.168.43.124.8880 > 192.168.43.146.7771: UDP, length 120
02:45:05.383950 IP 192.168.43.146.8880 > 192.168.43.147.7772: UDP, length 120
02:45:05.422563 IP 192.168.43.124.8880 > 192.168.43.146.7771: UDP, length 120
02:45:05.433947 IP 192.168.43.146.8880 > 192.168.43.147.7772: UDP, length 120
02:45:05.476197 IP 192.168.43.124.8880 > 192.168.43.146.7771: UDP, length 120
02:45:05.483951 IP 192.168.43.146.8880 > 192.168.43.147.7772: UDP, length 120
02:45:05.521778 IP 192.168.43.124.8880 > 192.168.43.146.7771: UDP, length 120
02:45:05.533955 IP 192.168.43.146.8880 > 192.168.43.147.7772: UDP, length 120
02:45:05.574197 IP 192.168.43.124.8880 > 192.168.43.146.7771: UDP, length 120
02:45:05.584025 IP 192.168.43.146.8880 > 192.168.43.147.7772: UDP, length 120
02:45:05.621910 IP 192.168.43.124.8880 > 192.168.43.146.7771: UDP, length 120
02:45:05.634012 IP 192.168.43.146.8880 > 192.168.43.147.7772: UDP, length 120
02:45:05.674857 IP 192.168.43.124.8880 > 192.168.43.146.7771: UDP, length 120
02:45:05.683971 IP 192.168.43.146.8880 > 192.168.43.147.7772: UDP, length 120
02:45:05.731686 IP 192.168.43.124.8880 > 192.168.43.146.7771: UDP, length 120
02:45:05.733952 IP 192.168.43.146.8880 > 192.168.43.147.7772: UDP, length 120
02:45:05.772664 IP 192.168.43.124.8880 > 192.168.43.146.7771: UDP, length 120
02:45:05.783949 IP 192.168.43.146.8880 > 192.168.43.147.7772: UDP, length 120
02:45:05.823851 IP 192.168.43.124.8880 > 192.168.43.146.7771: UDP, length 120
02:45:05.833959 IP 192.168.43.146.8880 > 192.168.43.147.7772: UDP, length 120
02:45:05.870984 IP 192.168.43.124.8880 > 192.168.43.146.7771: UDP, length 120
02:45:05.883952 IP 192.168.43.146.8880 > 192.168.43.147.7772: UDP, length 120
02:45:05.921314 IP 192.168.43.124.8880 > 192.168.43.146.7771: UDP, length 120
02:45:05.933949 IP 192.168.43.146.8880 > 192.168.43.147.7772: UDP, length 120
02:45:05.972600 IP 192.168.43.124.8880 > 192.168.43.146.7771: UDP, length 120
02:45:05.983951 IP 192.168.43.146.8880 > 192.168.43.147.7772: UDP, length 120
02:45:06.022023 IP 192.168.43.124.8880 > 192.168.43.146.7771: UDP, length 120
02:45:06.033951 IP 192.168.43.146.8880 > 192.168.43.147.7772: UDP, length 120
02:45:06.073231 IP 192.168.43.124.8880 > 192.168.43.146.7771: UDP, length 120
02:45:06.083952 IP 192.168.43.146.8880 > 192.168.43.147.7772: UDP, length 120
02:45:06.121823 IP 192.168.43.124.8880 > 192.168.43.146.7771: UDP, length 120
02:45:06.133948 IP 192.168.43.146.8880 > 192.168.43.147.7772: UDP, length 120
02:45:06.176033 IP 192.168.43.124.8880 > 192.168.43.146.7771: UDP, length 120
02:45:06.183950 IP 192.168.43.146.8880 > 192.168.43.147.7772: UDP, length 120
02:45:06.221773 IP 192.168.43.124.8880 > 192.168.43.146.7771: UDP, length 120
02:45:06.233948 IP 192.168.43.146.8880 > 192.168.43.147.7772: UDP, length 120
02:45:06.272621 IP 192.168.43.124.8880 > 192.168.43.146.7771: UDP, length 120
02:45:06.283948 IP 192.168.43.146.8880 > 192.168.43.147.7772: UDP, length 120
02:45:06.320071 IP 192.168.43.124.8880 > 192.168.43.146.7771: UDP, length 120
02:45:06.333949 IP 192.168.43.146.8880 > 192.168.43.147.7772: UDP, length 120
02:45:06.370986 IP 192.168.43.124.8880 > 192.168.43.146.7771: UDP, length 120
02:45:06.383951 IP 192.168.43.146.8880 > 192.168.43.147.7772: UDP, length 120
02:45:06.422611 IP 192.168.43.124.8880 > 192.168.43.146.7771: UDP, length 120
02:45:06.433949 IP 192.168.43.146.8880 > 192.168.43.147.7772: UDP, length 120
02:45:06.472556 IP 192.168.43.124.8880 > 192.168.43.146.7771: UDP, length 120
02:45:06.483950 IP 192.168.43.146.8880 > 192.168.43.147.7772: UDP, length 120
02:45:06.522662 IP 192.168.43.124.8880 > 192.168.43.146.7771: UDP, length 120
02:45:06.533952 IP 192.168.43.146.8880 > 192.168.43.147.7772: UDP, length 120
02:45:06.574213 IP 192.168.43.124.8880 > 192.168.43.146.7771: UDP, length 120
02:45:06.583957 IP 192.168.43.146.8880 > 192.168.43.147.7772: UDP, length 120
02:45:06.622657 IP 192.168.43.124.8880 > 192.168.43.146.7771: UDP, length 120
02:45:06.634020 IP 192.168.43.146.8880 > 192.168.43.147.7772: UDP, length 120
02:45:06.674247 IP 192.168.43.124.8880 > 192.168.43.146.7771: UDP, length 120
02:45:06.683995 IP 192.168.43.146.8880 > 192.168.43.147.7772: UDP, length 120
02:45:06.721776 IP 192.168.43.124.8880 > 192.168.43.146.7771: UDP, length 120
02:45:06.733959 IP 192.168.43.146.8880 > 192.168.43.147.7772: UDP, length 120
02:45:06.781594 IP 192.168.43.124.8880 > 192.168.43.146.7771: UDP, length 120
02:45:06.783953 IP 192.168.43.146.8880 > 192.168.43.147.7772: UDP, length 120
02:45:06.822588 IP 192.168.43.124.8880 > 192.168.43.146.7771: UDP, length 120
02:45:06.833958 IP 192.168.43.146.8880 > 192.168.43.147.7772: UDP, length 120
02:45:06.872559 IP 192.168.43.124.8880 > 192.168.43.146.7771: UDP, length 120
02:45:06.883952 IP 192.168.43.146.8880 > 192.168.43.147.7772: UDP, length 120
02:45:06.922350 IP 192.168.43.124.8880 > 192.168.43.146.7771: UDP, length 120
02:45:06.933950 IP 192.168.43.146.8880 > 192.168.43.147.7772: UDP, length 120
02:45:06.971006 IP 192.168.43.124.8880 > 192.168.43.146.7771: UDP, length 120
02:45:06.983950 IP 192.168.43.146.8880 > 192.168.43.147.7772: UDP, length 120
02:45:07.021761 IP 192.168.43.124.8880 > 192.168.43.146.7771: UDP, length 120
02:45:07.033950 IP 192.168.43.146.8880 > 192.168.43.147.7772: UDP, length 120
02:45:07.072590 IP 192.168.43.124.8880 > 192.168.43.146.7771: UDP, length 120
02:45:07.083952 IP 192.168.43.146.8880 > 192.168.43.147.7772: UDP, length 120
02:45:07.122971 IP 192.168.43.124.8880 > 192.168.43.146.7771: UDP, length 120
02:45:07.133948 IP 192.168.43.146.8880 > 192.168.43.147.7772: UDP, length 120
02:45:07.173560 IP 192.168.43.124.8880 > 192.168.43.146.7771: UDP, length 120
02:45:07.183950 IP 192.168.43.146.8880 > 192.168.43.147.7772: UDP, length 120
02:45:07.224345 IP 192.168.43.124.8880 > 192.168.43.146.7771: UDP, length 120
02:45:07.233950 IP 192.168.43.146.8880 > 192.168.43.147.7772: UDP, length 120
02:45:07.273876 IP 192.168.43.124.8880 > 192.168.43.146.7771: UDP, length 120
02:45:07.283949 IP 192.168.43.146.8880 > 192.168.43.147.7772: UDP, length 120
02:45:07.322546 IP 192.168.43.124.8880 > 192.168.43.146.7771: UDP, length 120
02:45:07.333949 IP 192.168.43.146.8880 > 192.168.43.147.7772: UDP, length 120
02:45:07.372600 IP 192.168.43.124.8880 > 192.168.43.146.7771: UDP, length 120
02:45:07.383950 IP 192.168.43.146.8880 > 192.168.43.147.7772: UDP, length 120
02:45:07.422714 IP 192.168.43.124.8880 > 192.168.43.146.7771: UDP, length 120
02:45:07.433949 IP 192.168.43.146.8880 > 192.168.43.147.7772: UDP, length 120
02:45:07.471764 IP 192.168.43.124.8880 > 192.168.43.146.7771: UDP, length 120
02:45:07.483951 IP 192.168.43.146.8880 > 192.168.43.147.7772: UDP, length 120
02:45:07.522581 IP 192.168.43.124.8880 > 192.168.43.146.7771: UDP, length 120
02:45:07.533949 IP 192.168.43.146.8880 > 192.168.43.147.7772: UDP, length 120
02:45:07.572479 IP 192.168.43.124.8880 > 192.168.43.146.7771: UDP, length 120
02:45:07.583951 IP 192.168.43.146.8880 > 192.168.43.147.7772: UDP, length 120
02:45:07.623204 IP 192.168.43.124.8880 > 192.168.43.146.7771: UDP, length 120
02:45:07.634000 IP 192.168.43.146.8880 > 192.168.43.147.7772: UDP, length 120
02:45:07.671942 IP 192.168.43.124.8880 > 192.168.43.146.7771: UDP, length 120
02:45:07.684039 IP 192.168.43.146.8880 > 192.168.43.147.7772: UDP, length 120
02:45:07.725453 IP 192.168.43.124.8880 > 192.168.43.146.7771: UDP, length 120
02:45:07.733991 IP 192.168.43.146.8880 > 192.168.43.147.7772: UDP, length 120
02:45:07.771789 IP 192.168.43.124.8880 > 192.168.43.146.7771: UDP, length 120
02:45:07.783975 IP 192.168.43.146.8880 > 192.168.43.147.7772: UDP, length 120
02:45:07.825336 IP 192.168.43.124.8880 > 192.168.43.146.7771: UDP, length 120
02:45:07.833985 IP 192.168.43.146.8880 > 192.168.43.147.7772: UDP, length 120
02:45:07.873185 IP 192.168.43.124.8880 > 192.168.43.146.7771: UDP, length 120
02:45:07.883980 IP 192.168.43.146.8880 > 192.168.43.147.7772: UDP, length 120
02:45:07.920937 IP 192.168.43.124.8880 > 192.168.43.146.7771: UDP, length 120
02:45:07.933977 IP 192.168.43.146.8880 > 192.168.43.147.7772: UDP, length 120
02:45:07.974758 IP 192.168.43.124.8880 > 192.168.43.146.7771: UDP, length 120
02:45:07.983981 IP 192.168.43.146.8880 > 192.168.43.147.7772: UDP, length 120
02:45:08.022931 IP 192.168.43.124.8880 > 192.168.43.146.7771: UDP, length 120
02:45:08.033979 IP 192.168.43.146.8880 > 192.168.43.147.7772: UDP, length 120
02:45:08.071855 IP 192.168.43.124.8880 > 192.168.43.146.7771: UDP, length 120
02:45:08.083976 IP 192.168.43.146.8880 > 192.168.43.147.7772: UDP, length 120
02:45:08.122734 IP 192.168.43.124.8880 > 192.168.43.146.7771: UDP, length 120
02:45:08.134027 IP 192.168.43.146.8880 > 192.168.43.147.7772: UDP, length 120
02:45:08.174057 IP 192.168.43.124.8880 > 192.168.43.146.7771: UDP, length 120
02:45:08.183990 IP 192.168.43.146.8880 > 192.168.43.147.7772: UDP, length 120
02:45:08.225454 IP 192.168.43.124.8880 > 192.168.43.146.7771: UDP, length 120
02:45:08.233975 IP 192.168.43.146.8880 > 192.168.43.147.7772: UDP, length 120
02:45:08.283973 IP 192.168.43.146.8880 > 192.168.43.147.7772: UDP, length 120
02:45:08.287399 IP 192.168.43.124.8880 > 192.168.43.146.7771: UDP, length 120
02:45:08.327989 IP 192.168.43.124.8880 > 192.168.43.146.7771: UDP, length 120
02:45:08.333976 IP 192.168.43.146.8880 > 192.168.43.147.7772: UDP, length 120
02:45:08.372779 IP 192.168.43.124.8880 > 192.168.43.146.7771: UDP, length 120
02:45:08.383975 IP 192.168.43.146.8880 > 192.168.43.147.7772: UDP, length 120
02:45:08.422743 IP 192.168.43.124.8880 > 192.168.43.146.7771: UDP, length 120
02:45:08.433972 IP 192.168.43.146.8880 > 192.168.43.147.7772: UDP, length 120
02:45:08.472909 IP 192.168.43.124.8880 > 192.168.43.146.7771: UDP, length 120
02:45:08.483976 IP 192.168.43.146.8880 > 192.168.43.147.7772: UDP, length 120
02:45:08.521221 IP 192.168.43.124.8880 > 192.168.43.146.7771: UDP, length 120
02:45:08.533975 IP 192.168.43.146.8880 > 192.168.43.147.7772: UDP, length 120
02:45:08.572118 IP 192.168.43.124.8880 > 192.168.43.146.7771: UDP, length 120
02:45:08.583976 IP 192.168.43.146.8880 > 192.168.43.147.7772: UDP, length 120
02:45:08.623117 IP 192.168.43.124.8880 > 192.168.43.146.7771: UDP, length 120
02:45:08.633977 IP 192.168.43.146.8880 > 192.168.43.147.7772: UDP, length 120
02:45:08.672676 IP 192.168.43.124.8880 > 192.168.43.146.7771: UDP, length 120
02:45:08.684046 IP 192.168.43.146.8880 > 192.168.43.147.7772: UDP, length 120
02:45:08.724790 IP 192.168.43.124.8880 > 192.168.43.146.7771: UDP, length 120
02:45:08.734035 IP 192.168.43.146.8880 > 192.168.43.147.7772: UDP, length 120
02:45:08.771856 IP 192.168.43.124.8880 > 192.168.43.146.7771: UDP, length 120
02:45:08.783982 IP 192.168.43.146.8880 > 192.168.43.147.7772: UDP, length 120
02:45:08.824757 IP 192.168.43.124.8880 > 192.168.43.146.7771: UDP, length 120
02:45:08.833985 IP 192.168.43.146.8880 > 192.168.43.147.7772: UDP, length 120
