02:46:03.852824 IP 192.168.43.124.8880 > 192.168.43.146.7771: UDP, length 120
02:46:03.902045 IP 192.168.43.124.8880 > 192.168.43.146.7771: UDP, length 120
02:46:03.951866 IP 192.168.43.124.8880 > 192.168.43.146.7771: UDP, length 120
02:46:04.001893 IP 192.168.43.124.8880 > 192.168.43.146.7771: UDP, length 120
02:46:04.051873 IP 192.168.43.124.8880 > 192.168.43.146.7771: UDP, length 120
02:46:04.101855 IP 192.168.43.124.8880 > 192.168.43.146.7771: UDP, length 120
02:46:04.151870 IP 192.168.43.124.8880 > 192.168.43.146.7771: UDP, length 120
02:46:04.201778 IP 192.168.43.124.8880 > 192.168.43.146.7771: UDP, length 120
02:46:04.252852 IP 192.168.43.124.8880 > 192.168.43.146.7771: UDP, length 120
02:46:04.301798 IP 192.168.43.124.8880 > 192.168.43.146.7771: UDP, length 120
02:46:04.356230 IP 192.168.43.124.8880 > 192.168.43.146.7771: UDP, length 120
02:46:04.402719 IP 192.168.43.124.8880 > 192.168.43.146.7771: UDP, length 120
02:46:04.452983 IP 192.168.43.124.8880 > 192.168.43.146.7771: UDP, length 120
02:46:04.503368 IP 192.168.43.124.8880 > 192.168.43.146.7771: UDP, length 120
02:46:04.551821 IP 192.168.43.124.8880 > 192.168.43.146.7771: UDP, length 120
02:46:04.617174 IP 192.168.43.124.8880 > 192.168.43.146.7771: UDP, length 120
02:46:04.651831 IP 192.168.43.124.8880 > 192.168.43.146.7771: UDP, length 120
02:46:04.701996 IP 192.168.43.124.8880 > 192.168.43.146.7771: UDP, length 120
02:46:04.751792 IP 192.168.43.124.8880 > 192.168.43.146.7771: UDP, length 120
02:46:04.801818 IP 192.168.43.124.8880 > 192.168.43.146.7771: UDP, length 120
02:46:04.852864 IP 192.168.43.124.8880 > 192.168.43.146.7771: UDP, length 120
02:46:04.901821 IP 192.168.43.124.8880 > 192.168.43.146.7771: UDP, length 120
02:46:04.954732 IP 192.168.43.124.8880 > 192.168.43.146.7771: UDP, length 120
02:46:05.001567 IP 192.168.43.124.8880 > 192.168.43.146.7771: UDP, length 120
02:46:05.052547 IP 192.168.43.124.8880 > 192.168.43.146.7771: UDP, length 120
02:46:05.101821 IP 192.168.43.124.8880 > 192.168.43.146.7771: UDP, length 120
02:46:05.152071 IP 192.168.43.124.8880 > 192.168.43.146.7771: UDP, length 120
02:46:05.201790 IP 192.168.43.124.8880 > 192.168.43.146.7771: UDP, length 120
02:46:05.251683 IP 192.168.43.124.8880 > 192.168.43.146.7771: UDP, length 120
02:46:05.301842 IP 192.168.43.124.8880 > 192.168.43.146.7771: UDP, length 120
02:46:05.353197 IP 192.168.43.124.8880 > 192.168.43.146.7771: UDP, length 120
02:46:05.401832 IP 192.168.43.124.8880 > 192.168.43.146.7771: UDP, length 120
02:46:05.451148 IP 192.168.43.124.8880 > 192.168.43.146.7771: UDP, length 120
02:46:05.492965 IP 192.168.43.146.8880 > 192.168.43.147.7772: UDP, length 120
02:46:05.501273 IP 192.168.43.124.8880 > 192.168.43.146.7771: UDP, length 120
02:46:05.543004 IP 192.168.43.146.8880 > 192.168.43.147.7772: UDP, length 120
02:46:05.556549 IP 192.168.43.124.8880 > 192.168.43.146.7771: UDP, length 120
02:46:05.592990 IP 192.168.43.146.8880 > 192.168.43.147.7772: UDP, length 120
02:46:05.599295 IP 192.168.43.124.8880 > 192.168.43.146.7771: UDP, length 120
02:46:05.642993 IP 192.168.43.146.8880 > 192.168.43.147.7772: UDP, length 120
02:46:05.649094 IP 192.168.43.124.8880 > 192.168.43.146.7771: UDP, length 120
02:46:05.692987 IP 192.168.43.146.8880 > 192.168.43.147.7772: UDP, length 120
02:46:05.698979 IP 192.168.43.124.8880 > 192.168.43.146.7771: UDP, length 120
02:46:05.742985 IP 192.168.43.146.8880 > 192.168.43.147.7772: UDP, length 120
02:46:05.749090 IP 192.168.43.124.8880 > 192.168.43.146.7771: UDP, length 120
02:46:05.793001 IP 192.168.43.146.8880 > 192.168.43.147.7772: UDP, length 120
02:46:05.799352 IP 192.168.43.124.8880 > 192.168.43.146.7771: UDP, length 120
02:46:05.843000 IP 192.168.43.146.8880 > 192.168.43.147.7772: UDP, length 120
02:46:05.849190 IP 192.168.43.124.8880 > 192.168.43.146.7771: UDP, length 120
02:46:05.892991 IP 192.168.43.146.8880 > 192.168.43.147.7772: UDP, length 120
02:46:05.898789 IP 192.168.43.124.8880 > 192.168.43.146.7771: UDP, length 120
02:46:05.942984 IP 192.168.43.146.8880 > 192.168.43.147.7772: UDP, length 120
02:46:05.948800 IP 192.168.43.124.8880 > 192.168.43.146.7771: UDP, length 120
02:46:05.992984 IP 192.168.43.146.8880 > 192.168.43.147.7772: UDP, length 120
02:46:05.998860 IP 192.168.43.124.8880 > 192.168.43.146.7771: UDP, length 120
02:46:06.042984 IP 192.168.43.146.8880 > 192.168.43.147.7772: UDP, length 120
02:46:06.048736 IP 192.168.43.124.8880 > 192.168.43.146.7771: UDP, length 120
02:46:06.092991 IP 192.168.43.146.8880 > 192.168.43.147.7772: UDP, length 120
02:46:06.098812 IP 192.168.43.124.8880 > 192.168.43.146.7771: UDP, length 120
02:46:06.142986 IP 192.168.43.146.8880 > 192.168.43.147.7772: UDP, length 120
02:46:06.148798 IP 192.168.43.124.8880 > 192.168.43.146.7771: UDP, length 120
02:46:06.193043 IP 192.168.43.146.8880 > 192.168.43.147.7772: UDP, length 120
02:46:06.198825 IP 192.168.43.124.8880 > 192.168.43.146.7771: UDP, length 120
02:46:06.243001 IP 192.168.43.146.8880 > 192.168.43.147.7772: UDP, length 120
02:46:06.248756 IP 192.168.43.124.8880 > 192.168.43.146.7771: UDP, length 120
02:46:06.292987 IP 192.168.43.146.8880 > 192.168.43.147.7772: UDP, length 120
02:46:06.299673 IP 192.168.43.124.8880 > 192.168.43.146.7771: UDP, length 120
02:46:06.342984 IP 192.168.43.146.8880 > 192.168.43.147.7772: UDP, length 120
02:46:06.349863 IP 192.168.43.124.8880 > 192.168.43.146.7771: UDP, length 120
02:46:06.392994 IP 192.168.43.146.8880 > 192.168.43.147.7772: UDP, length 120
02:46:06.404155 IP 192.168.43.124.8880 > 192.168.43.146.7771: UDP, length 120
02:46:06.442987 IP 192.168.43.146.8880 > 192.168.43.147.7772: UDP, length 120
02:46:06.448785 IP 192.168.43.124.8880 > 192.168.43.146.7771: UDP, length 120
02:46:06.492987 IP 192.168.43.146.8880 > 192.168.43.147.7772: UDP, length 120
02:46:06.504287 IP 192.168.43.124.8880 > 192.168.43.146.7771: UDP, length 120
02:46:06.542984 IP 192.168.43.146.8880 > 192.168.43.147.7772: UDP, length 120
02:46:06.548763 IP 192.168.43.124.8880 > 192.168.43.146.7771: UDP, length 120
02:46:06.593081 IP 192.168.43.146.8880 > 192.168.43.147.7772: UDP, length 120
02:46:06.600313 IP 192.168.43.124.8880 > 192.168.43.146.7771: UDP, length 120
02:46:06.643099 IP 192.168.43.146.8880 > 192.168.43.147.7772: UDP, length 120
02:46:06.651084 IP 192.168.43.124.8880 > 192.168.43.146.7771: UDP, length 120
02:46:06.693055 IP 192.168.43.146.8880 > 192.168.43.147.7772: UDP, length 120
02:46:06.697414 IP 192.168.43.124.8880 > 192.168.43.146.7771: UDP, length 120
02:46:06.743050 IP 192.168.43.146.8880 > 192.168.43.147.7772: UDP, length 120
02:46:06.749428 IP 192.168.43.124.8880 > 192.168.43.146.7771: UDP, length 120
02:46:06.793054 IP 192.168.43.146.8880 > 192.168.43.147.7772: UDP, length 120
02:46:06.798762 IP 192.168.43.124.8880 > 192.168.43.146.7771: UDP, length 120
02:46:06.843069 IP 192.168.43.146.8880 > 192.168.43.147.7772: UDP, length 120
02:46:06.851099 IP 192.168.43.124.8880 > 192.168.43.146.7771: UDP, length 120
02:46:06.893098 IP 192.168.43.146.8880 > 192.168.43.147.7772: UDP, length 120
02:46:06.898822 IP 192.168.43.124.8880 > 192.168.43.146.7771: UDP, length 120
02:46:06.943063 IP 192.168.43.146.8880 > 192.168.43.147.7772: UDP, length 120
02:46:06.949447 IP 192.168.43.124.8880 > 192.168.43.146.7771: UDP, length 120
02:46:06.993044 IP 192.168.43.146.8880 > 192.168.43.147.7772: UDP, length 120
02:46:06.999648 IP 192.168.43.124.8880 > 192.168.43.146.7771: UDP, length 120
02:46:07.042999 IP 192.168.43.146.8880 > 192.168.43.147.7772: UDP, length 120
02:46:07.049284 IP 192.168.43.124.8880 > 192.168.43.146.7771: UDP, length 120
02:46:07.092995 IP 192.168.43.146.8880 > 192.168.43.147.7772: UDP, length 120
02:46:07.099908 IP 192.168.43.124.8880 > 192.168.43.146.7771: UDP, length 120
02:46:07.142988 IP 192.168.43.146.8880 > 192.168.43.147.7772: UDP, length 120
02:46:07.169304 IP 192.168.43.124.8880 > 192.168.43.146.7771: UDP, length 120
02:46:07.193042 IP 192.168.43.146.8880 > 192.168.43.147.7772: UDP, length 120
02:46:07.202423 IP 192.168.43.124.8880 > 192.168.43.146.7771: UDP, length 120
02:46:07.243005 IP 192.168.43.146.8880 > 192.168.43.147.7772: UDP, length 120
02:46:07.248766 IP 192.168.43.124.8880 > 192.168.43.146.7771: UDP, length 120
02:46:07.292988 IP 192.168.43.146.8880 > 192.168.43.147.7772: UDP, length 120
02:46:07.298575 IP 192.168.43.124.8880 > 192.168.43.146.7771: UDP, length 120
02:46:07.342988 IP 192.168.43.146.8880 > 192.168.43.147.7772: UDP, length 120
02:46:07.348707 IP 192.168.43.124.8880 > 192.168.43.146.7771: UDP, length 120
02:46:07.392995 IP 192.168.43.146.8880 > 192.168.43.147.7772: UDP, length 120
02:46:07.398739 IP 192.168.43.124.8880 > 192.168.43.146.7771: UDP, length 120
02:46:07.442992 IP 192.168.43.146.8880 > 192.168.43.147.7772: UDP, length 120
02:46:07.448712 IP 192.168.43.124.8880 > 192.168.43.146.7771: UDP, length 120
02:46:07.492987 IP 192.168.43.146.8880 > 192.168.43.147.7772: UDP, length 120
02:46:07.500549 IP 192.168.43.124.8880 > 192.168.43.146.7771: UDP, length 120
02:46:07.543071 IP 192.168.43.146.8880 > 192.168.43.147.7772: UDP, length 120
02:46:07.552948 IP 192.168.43.124.8880 > 192.168.43.146.7771: UDP, length 120
02:46:07.592987 IP 192.168.43.146.8880 > 192.168.43.147.7772: UDP, length 120
02:46:07.601729 IP 192.168.43.124.8880 > 192.168.43.146.7771: UDP, length 120
02:46:07.643016 IP 192.168.43.146.8880 > 192.168.43.147.7772: UDP, length 120
02:46:07.648802 IP 192.168.43.124.8880 > 192.168.43.146.7771: UDP, length 120
02:46:07.693015 IP 192.168.43.146.8880 > 192.168.43.147.7772: UDP, length 120
02:46:07.703316 IP 192.168.43.124.8880 > 192.168.43.146.7771: UDP, length 120
02:46:07.743012 IP 192.168.43.146.8880 > 192.168.43.147.7772: UDP, length 120
02:46:07.748805 IP 192.168.43.124.8880 > 192.168.43.146.7771: UDP, length 120
02:46:07.793011 IP 192.168.43.146.8880 > 192.168.43.147.7772: UDP, length 120
02:46:07.798825 IP 192.168.43.124.8880 > 192.168.43.146.7771: UDP, length 120
02:46:07.843013 IP 192.168.43.146.8880 > 192.168.43.147.7772: UDP, length 120
02:46:07.848805 IP 192.168.43.124.8880 > 192.168.43.146.7771: UDP, length 120
02:46:07.893018 IP 192.168.43.146.8880 > 192.168.43.147.7772: UDP, length 120
02:46:07.898615 IP 192.168.43.124.8880 > 192.168.43.146.7771: UDP, length 120
02:46:07.943024 IP 192.168.43.146.8880 > 192.168.43.147.7772: UDP, length 120
02:46:07.947414 IP 192.168.43.124.8880 > 192.168.43.146.7771: UDP, length 120
02:46:07.993016 IP 192.168.43.146.8880 > 192.168.43.147.7772: UDP, length 120
02:46:07.998829 IP 192.168.43.124.8880 > 192.168.43.146.7771: UDP, length 120
02:46:08.043013 IP 192.168.43.146.8880 > 192.168.43.147.7772: UDP, length 120
02:46:08.049180 IP 192.168.43.124.8880 > 192.168.43.146.7771: UDP, length 120
02:46:08.093021 IP 192.168.43.146.8880 > 192.168.43.147.7772: UDP, length 120
02:46:08.102936 IP 192.168.43.124.8880 > 192.168.43.146.7771: UDP, length 120
02:46:08.143015 IP 192.168.43.146.8880 > 192.168.43.147.7772: UDP, length 120
02:46:08.150125 IP 192.168.43.124.8880 > 192.168.43.146.7771: UDP, length 120
02:46:08.193112 IP 192.168.43.146.8880 > 192.168.43.147.7772: UDP, length 120
02:46:08.199491 IP 192.168.43.124.8880 > 192.168.43.146.7771: UDP, length 120
02:46:08.243075 IP 192.168.43.146.8880 > 192.168.43.147.7772: UDP, length 120
02:46:08.249462 IP 192.168.43.124.8880 > 192.168.43.146.7771: UDP, length 120
02:46:08.293023 IP 192.168.43.146.8880 > 192.168.43.147.7772: UDP, length 120
02:46:08.298828 IP 192.168.43.124.8880 > 192.168.43.146.7771: UDP, length 120
02:46:08.343010 IP 192.168.43.146.8880 > 192.168.43.147.7772: UDP, length 120
02:46:08.349460 IP 192.168.43.124.8880 > 192.168.43.146.7771: UDP, length 120
02:46:08.393020 IP 192.168.43.146.8880 > 192.168.43.147.7772: UDP, length 120
02:46:08.399453 IP 192.168.43.124.8880 > 192.168.43.146.7771: UDP, length 120
02:46:08.443016 IP 192.168.43.146.8880 > 192.168.43.147.7772: UDP, length 120
02:46:08.449975 IP 192.168.43.124.8880 > 192.168.43.146.7771: UDP, length 120
02:46:08.493013 IP 192.168.43.146.8880 > 192.168.43.147.7772: UDP, length 120
02:46:08.499224 IP 192.168.43.124.8880 > 192.168.43.146.7771: UDP, length 120
02:46:08.543013 IP 192.168.43.146.8880 > 192.168.43.147.7772: UDP, length 120
02:46:08.550590 IP 192.168.43.124.8880 > 192.168.43.146.7771: UDP, length 120
02:46:08.593017 IP 192.168.43.146.8880 > 192.168.43.147.7772: UDP, length 120
02:46:08.599482 IP 192.168.43.124.8880 > 192.168.43.146.7771: UDP, length 120
02:46:08.643020 IP 192.168.43.146.8880 > 192.168.43.147.7772: UDP, length 120
02:46:08.654070 IP 192.168.43.124.8880 > 192.168.43.146.7771: UDP, length 120
02:46:08.693022 IP 192.168.43.146.8880 > 192.168.43.147.7772: UDP, length 120
02:46:08.700358 IP 192.168.43.124.8880 > 192.168.43.146.7771: UDP, length 120
02:46:08.743009 IP 192.168.43.146.8880 > 192.168.43.147.7772: UDP, length 120
02:46:08.751050 IP 192.168.43.124.8880 > 192.168.43.146.7771: UDP, length 120
02:46:08.793010 IP 192.168.43.146.8880 > 192.168.43.147.7772: UDP, length 120
02:46:08.799280 IP 192.168.43.124.8880 > 192.168.43.146.7771: UDP, length 120
02:46:08.843009 IP 192.168.43.146.8880 > 192.168.43.147.7772: UDP, length 120
02:46:08.850108 IP 192.168.43.124.8880 > 192.168.43.146.7771: UDP, length 120
02:46:08.893009 IP 192.168.43.146.8880 > 192.168.43.147.7772: UDP, length 120
02:46:08.901490 IP 192.168.43.124.8880 > 192.168.43.146.7771: UDP, length 120
02:46:08.943021 IP 192.168.43.146.8880 > 192.168.43.147.7772: UDP, length 120
02:46:08.948176 IP 192.168.43.124.8880 > 192.168.43.146.7771: UDP, length 120
02:46:08.993022 IP 192.168.43.146.8880 > 192.168.43.147.7772: UDP, length 120
02:46:08.999503 IP 192.168.43.124.8880 > 192.168.43.146.7771: UDP, length 120
02:46:09.043015 IP 192.168.43.146.8880 > 192.168.43.147.7772: UDP, length 120
02:46:09.049103 IP 192.168.43.124.8880 > 192.168.43.146.7771: UDP, length 120
02:46:09.093013 IP 192.168.43.146.8880 > 192.168.43.147.7772: UDP, length 120
02:46:09.099719 IP 192.168.43.124.8880 > 192.168.43.146.7771: UDP, length 120
02:46:09.143010 IP 192.168.43.146.8880 > 192.168.43.147.7772: UDP, length 120
02:46:09.149473 IP 192.168.43.124.8880 > 192.168.43.146.7771: UDP, length 120
02:46:09.193009 IP 192.168.43.146.8880 > 192.168.43.147.7772: UDP, length 120
02:46:09.199877 IP 192.168.43.124.8880 > 192.168.43.146.7771: UDP, length 120
02:46:09.243072 IP 192.168.43.146.8880 > 192.168.43.147.7772: UDP, length 120
02:46:09.252235 IP 192.168.43.124.8880 > 192.168.43.146.7771: UDP, length 120
02:46:09.293026 IP 192.168.43.146.8880 > 192.168.43.147.7772: UDP, length 120
02:46:09.298787 IP 192.168.43.124.8880 > 192.168.43.146.7771: UDP, length 120
02:46:09.343017 IP 192.168.43.146.8880 > 192.168.43.147.7772: UDP, length 120
02:46:09.348763 IP 192.168.43.124.8880 > 192.168.43.146.7771: UDP, length 120
02:46:09.393020 IP 192.168.43.146.8880 > 192.168.43.147.7772: UDP, length 120
02:46:09.398753 IP 192.168.43.124.8880 > 192.168.43.146.7771: UDP, length 120
02:46:09.443010 IP 192.168.43.146.8880 > 192.168.43.147.7772: UDP, length 120
02:46:09.449544 IP 192.168.43.124.8880 > 192.168.43.146.7771: UDP, length 120
02:46:09.493010 IP 192.168.43.146.8880 > 192.168.43.147.7772: UDP, length 120
02:46:09.499065 IP 192.168.43.124.8880 > 192.168.43.146.7771: UDP, length 120
02:46:09.543006 IP 192.168.43.146.8880 > 192.168.43.147.7772: UDP, length 120
02:46:09.553288 IP 192.168.43.124.8880 > 192.168.43.146.7771: UDP, length 120
02:46:09.593019 IP 192.168.43.146.8880 > 192.168.43.147.7772: UDP, length 120
02:46:09.600063 IP 192.168.43.124.8880 > 192.168.43.146.7771: UDP, length 120
02:46:09.643012 IP 192.168.43.146.8880 > 192.168.43.147.7772: UDP, length 120
02:46:09.653521 IP 192.168.43.124.8880 > 192.168.43.146.7771: UDP, length 120
02:46:09.693011 IP 192.168.43.146.8880 > 192.168.43.147.7772: UDP, length 120
02:46:09.698845 IP 192.168.43.124.8880 > 192.168.43.146.7771: UDP, length 120
02:46:09.743071 IP 192.168.43.146.8880 > 192.168.43.147.7772: UDP, length 120
02:46:09.753455 IP 192.168.43.124.8880 > 192.168.43.146.7771: UDP, length 120
02:46:09.793022 IP 192.168.43.146.8880 > 192.168.43.147.7772: UDP, length 120
02:46:09.798766 IP 192.168.43.124.8880 > 192.168.43.146.7771: UDP, length 120
02:46:09.843010 IP 192.168.43.146.8880 > 192.168.43.147.7772: UDP, length 120
02:46:09.854345 IP 192.168.43.124.8880 > 192.168.43.146.7771: UDP, length 120
02:46:09.893010 IP 192.168.43.146.8880 > 192.168.43.147.7772: UDP, length 120
02:46:09.898876 IP 192.168.43.124.8880 > 192.168.43.146.7771: UDP, length 120
02:46:09.943015 IP 192.168.43.146.8880 > 192.168.43.147.7772: UDP, length 120
02:46:09.948898 IP 192.168.43.124.8880 > 192.168.43.146.7771: UDP, length 120
02:46:09.993011 IP 192.168.43.146.8880 > 192.168.43.147.7772: UDP, length 120
02:46:09.999160 IP 192.168.43.124.8880 > 192.168.43.146.7771: UDP, length 120
02:46:10.043013 IP 192.168.43.146.8880 > 192.168.43.147.7772: UDP, length 120
02:46:10.048831 IP 192.168.43.124.8880 > 192.168.43.146.7771: UDP, length 120
02:46:10.093024 IP 192.168.43.146.8880 > 192.168.43.147.7772: UDP, length 120
02:46:10.098835 IP 192.168.43.124.8880 > 192.168.43.146.7771: UDP, length 120
02:46:10.143014 IP 192.168.43.146.8880 > 192.168.43.147.7772: UDP, length 120
02:46:10.148836 IP 192.168.43.124.8880 > 192.168.43.146.7771: UDP, length 120
02:46:10.193012 IP 192.168.43.146.8880 > 192.168.43.147.7772: UDP, length 120
02:46:10.198812 IP 192.168.43.124.8880 > 192.168.43.146.7771: UDP, length 120
02:46:10.243017 IP 192.168.43.146.8880 > 192.168.43.147.7772: UDP, length 120
02:46:10.248658 IP 192.168.43.124.8880 > 192.168.43.146.7771: UDP, length 120
02:46:10.293017 IP 192.168.43.146.8880 > 192.168.43.147.7772: UDP, length 120
02:46:10.300354 IP 192.168.43.124.8880 > 192.168.43.146.7771: UDP, length 120
02:46:10.343004 IP 192.168.43.146.8880 > 192.168.43.147.7772: UDP, length 120
02:46:10.348828 IP 192.168.43.124.8880 > 192.168.43.146.7771: UDP, length 120
02:46:10.393046 IP 192.168.43.146.8880 > 192.168.43.147.7772: UDP, length 120
02:46:10.398507 IP 192.168.43.124.8880 > 192.168.43.146.7771: UDP, length 120
02:46:10.443023 IP 192.168.43.146.8880 > 192.168.43.147.7772: UDP, length 120
02:46:10.448829 IP 192.168.43.124.8880 > 192.168.43.146.7771: UDP, length 120
02:46:10.493013 IP 192.168.43.146.8880 > 192.168.43.147.7772: UDP, length 120
02:46:10.497120 IP 192.168.43.124.8880 > 192.168.43.146.7771: UDP, length 120
02:46:10.543013 IP 192.168.43.146.8880 > 192.168.43.147.7772: UDP, length 120
02:46:10.549477 IP 192.168.43.124.8880 > 192.168.43.146.7771: UDP, length 120
02:46:10.593013 IP 192.168.43.146.8880 > 192.168.43.147.7772: UDP, length 120
02:46:10.599828 IP 192.168.43.124.8880 > 192.168.43.146.7771: UDP, length 120
02:46:10.643013 IP 192.168.43.146.8880 > 192.168.43.147.7772: UDP, length 120
02:46:10.649490 IP 192.168.43.124.8880 > 192.168.43.146.7771: UDP, length 120
02:46:10.693012 IP 192.168.43.146.8880 > 192.168.43.147.7772: UDP, length 120
02:46:10.702263 IP 192.168.43.124.8880 > 192.168.43.146.7771: UDP, length 120
02:46:10.743015 IP 192.168.43.146.8880 > 192.168.43.147.7772: UDP, length 120
02:46:10.748887 IP 192.168.43.124.8880 > 192.168.43.146.7771: UDP, length 120
02:46:10.793016 IP 192.168.43.146.8880 > 192.168.43.147.7772: UDP, length 120
02:46:10.804748 IP 192.168.43.124.8880 > 192.168.43.146.7771: UDP, length 120
02:46:10.843011 IP 192.168.43.146.8880 > 192.168.43.147.7772: UDP, length 120
02:46:10.850608 IP 192.168.43.124.8880 > 192.168.43.146.7771: UDP, length 120
02:46:10.893012 IP 192.168.43.146.8880 > 192.168.43.147.7772: UDP, length 120
02:46:10.901117 IP 192.168.43.124.8880 > 192.168.43.146.7771: UDP, length 120
02:46:10.943012 IP 192.168.43.146.8880 > 192.168.43.147.7772: UDP, length 120
02:46:10.951421 IP 192.168.43.124.8880 > 192.168.43.146.7771: UDP, length 120
02:46:10.993013 IP 192.168.43.146.8880 > 192.168.43.147.7772: UDP, length 120
02:46:11.016268 IP 192.168.43.124.8880 > 192.168.43.146.7771: UDP, length 120
02:46:11.043009 IP 192.168.43.146.8880 > 192.168.43.147.7772: UDP, length 120
02:46:11.048818 IP 192.168.43.124.8880 > 192.168.43.146.7771: UDP, length 120
02:46:11.093017 IP 192.168.43.146.8880 > 192.168.43.147.7772: UDP, length 120
02:46:11.098551 IP 192.168.43.124.8880 > 192.168.43.146.7771: UDP, length 120
02:46:11.143020 IP 192.168.43.146.8880 > 192.168.43.147.7772: UDP, length 120
02:46:11.149118 IP 192.168.43.124.8880 > 192.168.43.146.7771: UDP, length 120
02:46:11.193014 IP 192.168.43.146.8880 > 192.168.43.147.7772: UDP, length 120
02:46:11.199919 IP 192.168.43.124.8880 > 192.168.43.146.7771: UDP, length 120
02:46:11.243105 IP 192.168.43.146.8880 > 192.168.43.147.7772: UDP, length 120
02:46:11.249608 IP 192.168.43.124.8880 > 192.168.43.146.7771: UDP, length 120
02:46:11.293090 IP 192.168.43.146.8880 > 192.168.43.147.7772: UDP, length 120
02:46:11.299997 IP 192.168.43.124.8880 > 192.168.43.146.7771: UDP, length 120
02:46:11.343067 IP 192.168.43.146.8880 > 192.168.43.147.7772: UDP, length 120
02:46:11.352551 IP 192.168.43.124.8880 > 192.168.43.146.7771: UDP, length 120
02:46:11.393026 IP 192.168.43.146.8880 > 192.168.43.147.7772: UDP, length 120
02:46:11.400356 IP 192.168.43.124.8880 > 192.168.43.146.7771: UDP, length 120
02:46:11.442991 IP 192.168.43.146.8880 > 192.168.43.147.7772: UDP, length 120
02:46:11.448737 IP 192.168.43.124.8880 > 192.168.43.146.7771: UDP, length 120
02:46:11.492986 IP 192.168.43.146.8880 > 192.168.43.147.7772: UDP, length 120
02:46:11.498731 IP 192.168.43.124.8880 > 192.168.43.146.7771: UDP, length 120
02:46:11.542982 IP 192.168.43.146.8880 > 192.168.43.147.7772: UDP, length 120
02:46:11.548913 IP 192.168.43.124.8880 > 192.168.43.146.7771: UDP, length 120
02:46:11.592987 IP 192.168.43.146.8880 > 192.168.43.147.7772: UDP, length 120
02:46:11.598719 IP 192.168.43.124.8880 > 192.168.43.146.7771: UDP, length 120
02:46:11.642985 IP 192.168.43.146.8880 > 192.168.43.147.7772: UDP, length 120
02:46:11.650185 IP 192.168.43.124.8880 > 192.168.43.146.7771: UDP, length 120
02:46:11.692985 IP 192.168.43.146.8880 > 192.168.43.147.7772: UDP, length 120
02:46:11.699171 IP 192.168.43.124.8880 > 192.168.43.146.7771: UDP, length 120
02:46:11.742984 IP 192.168.43.146.8880 > 192.168.43.147.7772: UDP, length 120
02:46:11.749817 IP 192.168.43.124.8880 > 192.168.43.146.7771: UDP, length 120
02:46:11.792984 IP 192.168.43.146.8880 > 192.168.43.147.7772: UDP, length 120
02:46:11.801960 IP 192.168.43.124.8880 > 192.168.43.146.7771: UDP, length 120
02:46:11.842983 IP 192.168.43.146.8880 > 192.168.43.147.7772: UDP, length 120
02:46:11.849881 IP 192.168.43.124.8880 > 192.168.43.146.7771: UDP, length 120
02:46:11.892985 IP 192.168.43.146.8880 > 192.168.43.147.7772: UDP, length 120
02:46:11.901536 IP 192.168.43.124.8880 > 192.168.43.146.7771: UDP, length 120
02:46:11.942981 IP 192.168.43.146.8880 > 192.168.43.147.7772: UDP, length 120
02:46:11.948723 IP 192.168.43.124.8880 > 192.168.43.146.7771: UDP, length 120
02:46:11.994754 IP 192.168.43.146.8880 > 192.168.43.147.7772: UDP, length 120
02:46:11.998753 IP 192.168.43.124.8880 > 192.168.43.146.7771: UDP, length 120
02:46:12.043084 IP 192.168.43.146.8880 > 192.168.43.147.7772: UDP, length 120
02:46:12.048798 IP 192.168.43.124.8880 > 192.168.43.146.7771: UDP, length 120
02:46:12.093048 IP 192.168.43.146.8880 > 192.168.43.147.7772: UDP, length 120
02:46:12.098811 IP 192.168.43.124.8880 > 192.168.43.146.7771: UDP, length 120
02:46:12.143095 IP 192.168.43.146.8880 > 192.168.43.147.7772: UDP, length 120
02:46:12.148790 IP 192.168.43.124.8880 > 192.168.43.146.7771: UDP, length 120
02:46:12.193069 IP 192.168.43.146.8880 > 192.168.43.147.7772: UDP, length 120
02:46:12.198753 IP 192.168.43.124.8880 > 192.168.43.146.7771: UDP, length 120
02:46:12.243086 IP 192.168.43.146.8880 > 192.168.43.147.7772: UDP, length 120
02:46:12.248196 IP 192.168.43.124.8880 > 192.168.43.146.7771: UDP, length 120
02:46:12.293050 IP 192.168.43.146.8880 > 192.168.43.147.7772: UDP, length 120
02:46:12.299107 IP 192.168.43.124.8880 > 192.168.43.146.7771: UDP, length 120
02:46:12.343073 IP 192.168.43.146.8880 > 192.168.43.147.7772: UDP, length 120
02:46:12.351132 IP 192.168.43.124.8880 > 192.168.43.146.7771: UDP, length 120
02:46:12.393046 IP 192.168.43.146.8880 > 192.168.43.147.7772: UDP, length 120
02:46:12.398753 IP 192.168.43.124.8880 > 192.168.43.146.7771: UDP, length 120
02:46:12.442998 IP 192.168.43.146.8880 > 192.168.43.147.7772: UDP, length 120
02:46:12.448953 IP 192.168.43.124.8880 > 192.168.43.146.7771: UDP, length 120
02:46:12.492989 IP 192.168.43.146.8880 > 192.168.43.147.7772: UDP, length 120
02:46:12.498753 IP 192.168.43.124.8880 > 192.168.43.146.7771: UDP, length 120
02:46:12.542984 IP 192.168.43.146.8880 > 192.168.43.147.7772: UDP, length 120
02:46:12.548470 IP 192.168.43.124.8880 > 192.168.43.146.7771: UDP, length 120
02:46:12.592986 IP 192.168.43.146.8880 > 192.168.43.147.7772: UDP, length 120
02:46:12.598734 IP 192.168.43.124.8880 > 192.168.43.146.7771: UDP, length 120
02:46:12.643010 IP 192.168.43.146.8880 > 192.168.43.147.7772: UDP, length 120
02:46:12.648847 IP 192.168.43.124.8880 > 192.168.43.146.7771: UDP, length 120
02:46:12.693008 IP 192.168.43.146.8880 > 192.168.43.147.7772: UDP, length 120
02:46:12.699007 IP 192.168.43.124.8880 > 192.168.43.146.7771: UDP, length 120
02:46:12.743071 IP 192.168.43.146.8880 > 192.168.43.147.7772: UDP, length 120
02:46:12.751224 IP 192.168.43.124.8880 > 192.168.43.146.7771: UDP, length 120
02:46:12.793025 IP 192.168.43.146.8880 > 192.168.43.147.7772: UDP, length 120
02:46:12.798829 IP 192.168.43.124.8880 > 192.168.43.146.7771: UDP, length 120
02:46:12.843010 IP 192.168.43.146.8880 > 192.168.43.147.7772: UDP, length 120
02:46:12.850517 IP 192.168.43.124.8880 > 192.168.43.146.7771: UDP, length 120
02:46:12.893010 IP 192.168.43.146.8880 > 192.168.43.147.7772: UDP, length 120
02:46:12.898840 IP 192.168.43.124.8880 > 192.168.43.146.7771: UDP, length 120
02:46:12.943008 IP 192.168.43.146.8880 > 192.168.43.147.7772: UDP, length 120
02:46:12.955699 IP 192.168.43.124.8880 > 192.168.43.146.7771: UDP, length 120
02:46:12.993008 IP 192.168.43.146.8880 > 192.168.43.147.7772: UDP, length 120
02:46:13.000222 IP 192.168.43.124.8880 > 192.168.43.146.7771: UDP, length 120
02:46:13.043011 IP 192.168.43.146.8880 > 192.168.43.147.7772: UDP, length 120
02:46:13.051744 IP 192.168.43.124.8880 > 192.168.43.146.7771: UDP, length 120
02:46:13.093014 IP 192.168.43.146.8880 > 192.168.43.147.7772: UDP, length 120
02:46:13.099342 IP 192.168.43.124.8880 > 192.168.43.146.7771: UDP, length 120
02:46:13.143010 IP 192.168.43.146.8880 > 192.168.43.147.7772: UDP, length 120
02:46:13.148271 IP 192.168.43.124.8880 > 192.168.43.146.7771: UDP, length 120
02:46:13.193015 IP 192.168.43.146.8880 > 192.168.43.147.7772: UDP, length 120
02:46:13.200003 IP 192.168.43.124.8880 > 192.168.43.146.7771: UDP, length 120
02:46:13.243029 IP 192.168.43.146.8880 > 192.168.43.147.7772: UDP, length 120
02:46:13.249522 IP 192.168.43.124.8880 > 192.168.43.146.7771: UDP, length 120
02:46:13.293023 IP 192.168.43.146.8880 > 192.168.43.147.7772: UDP, length 120
02:46:13.298771 IP 192.168.43.124.8880 > 192.168.43.146.7771: UDP, length 120
02:46:13.343009 IP 192.168.43.146.8880 > 192.168.43.147.7772: UDP, length 120
02:46:13.350261 IP 192.168.43.124.8880 > 192.168.43.146.7771: UDP, length 120
02:46:13.393077 IP 192.168.43.146.8880 > 192.168.43.147.7772: UDP, length 120
02:46:13.401116 IP 192.168.43.124.8880 > 192.168.43.146.7771: UDP, length 120
02:46:13.443072 IP 192.168.43.146.8880 > 192.168.43.147.7772: UDP, length 120
02:46:13.452707 IP 192.168.43.124.8880 > 192.168.43.146.7771: UDP, length 120
02:46:13.493022 IP 192.168.43.146.8880 > 192.168.43.147.7772: UDP, length 120
02:46:13.499687 IP 192.168.43.124.8880 > 192.168.43.146.7771: UDP, length 120
02:46:13.543014 IP 192.168.43.146.8880 > 192.168.43.147.7772: UDP, length 120
02:46:13.576112 IP 192.168.43.124.8880 > 192.168.43.146.7771: UDP, length 120
02:46:13.593017 IP 192.168.43.146.8880 > 192.168.43.147.7772: UDP, length 120
02:46:13.599468 IP 192.168.43.124.8880 > 192.168.43.146.7771: UDP, length 120
02:46:13.643017 IP 192.168.43.146.8880 > 192.168.43.147.7772: UDP, length 120
02:46:13.649932 IP 192.168.43.124.8880 > 192.168.43.146.7771: UDP, length 120
02:46:13.693010 IP 192.168.43.146.8880 > 192.168.43.147.7772: UDP, length 120
02:46:13.698617 IP 192.168.43.124.8880 > 192.168.43.146.7771: UDP, length 120
02:46:13.743010 IP 192.168.43.146.8880 > 192.168.43.147.7772: UDP, length 120
02:46:13.748830 IP 192.168.43.124.8880 > 192.168.43.146.7771: UDP, length 120
02:46:13.793011 IP 192.168.43.146.8880 > 192.168.43.147.7772: UDP, length 120
02:46:13.800029 IP 192.168.43.124.8880 > 192.168.43.146.7771: UDP, length 120
02:46:13.843009 IP 192.168.43.146.8880 > 192.168.43.147.7772: UDP, length 120
02:46:13.849441 IP 192.168.43.124.8880 > 192.168.43.146.7771: UDP, length 120
02:46:13.893009 IP 192.168.43.146.8880 > 192.168.43.147.7772: UDP, length 120
02:46:13.916902 IP 192.168.43.124.8880 > 192.168.43.146.7771: UDP, length 120
02:46:13.943009 IP 192.168.43.146.8880 > 192.168.43.147.7772: UDP, length 120
02:46:13.951570 IP 192.168.43.124.8880 > 192.168.43.146.7771: UDP, length 120
02:46:13.993013 IP 192.168.43.146.8880 > 192.168.43.147.7772: UDP, length 120
02:46:13.998779 IP 192.168.43.124.8880 > 192.168.43.146.7771: UDP, length 120
02:46:14.043011 IP 192.168.43.146.8880 > 192.168.43.147.7772: UDP, length 120
02:46:14.052372 IP 192.168.43.124.8880 > 192.168.43.146.7771: UDP, length 120
02:46:14.093018 IP 192.168.43.146.8880 > 192.168.43.147.7772: UDP, length 120
02:46:14.099027 IP 192.168.43.124.8880 > 192.168.43.146.7771: UDP, length 120
02:46:14.143014 IP 192.168.43.146.8880 > 192.168.43.147.7772: UDP, length 120
02:46:14.148923 IP 192.168.43.124.8880 > 192.168.43.146.7771: UDP, length 120
02:46:14.193011 IP 192.168.43.146.8880 > 192.168.43.147.7772: UDP, length 120
02:46:14.197554 IP 192.168.43.124.8880 > 192.168.43.146.7771: UDP, length 120
02:46:14.243069 IP 192.168.43.146.8880 > 192.168.43.147.7772: UDP, length 120
02:46:14.248667 IP 192.168.43.124.8880 > 192.168.43.146.7771: UDP, length 120
02:46:14.293034 IP 192.168.43.146.8880 > 192.168.43.147.7772: UDP, length 120
02:46:14.299432 IP 192.168.43.124.8880 > 192.168.43.146.7771: UDP, length 120
02:46:14.343021 IP 192.168.43.146.8880 > 192.168.43.147.7772: UDP, length 120
02:46:14.349519 IP 192.168.43.124.8880 > 192.168.43.146.7771: UDP, length 120
02:46:14.393023 IP 192.168.43.146.8880 > 192.168.43.147.7772: UDP, length 120
02:46:14.398819 IP 192.168.43.124.8880 > 192.168.43.146.7771: UDP, length 120
02:46:14.443068 IP 192.168.43.146.8880 > 192.168.43.147.7772: UDP, length 120
02:46:14.449044 IP 192.168.43.124.8880 > 192.168.43.146.7771: UDP, length 120
02:46:14.493022 IP 192.168.43.146.8880 > 192.168.43.147.7772: UDP, length 120
02:46:14.500469 IP 192.168.43.124.8880 > 192.168.43.146.7771: UDP, length 120
02:46:14.543014 IP 192.168.43.146.8880 > 192.168.43.147.7772: UDP, length 120
02:46:14.551955 IP 192.168.43.124.8880 > 192.168.43.146.7771: UDP, length 120
02:46:14.593011 IP 192.168.43.146.8880 > 192.168.43.147.7772: UDP, length 120
02:46:14.600879 IP 192.168.43.124.8880 > 192.168.43.146.7771: UDP, length 120
02:46:14.643015 IP 192.168.43.146.8880 > 192.168.43.147.7772: UDP, length 120
02:46:14.648822 IP 192.168.43.124.8880 > 192.168.43.146.7771: UDP, length 120
02:46:14.693010 IP 192.168.43.146.8880 > 192.168.43.147.7772: UDP, length 120
02:46:14.698827 IP 192.168.43.124.8880 > 192.168.43.146.7771: UDP, length 120
02:46:14.743007 IP 192.168.43.146.8880 > 192.168.43.147.7772: UDP, length 120
02:46:14.748671 IP 192.168.43.124.8880 > 192.168.43.146.7771: UDP, length 120
02:46:14.793011 IP 192.168.43.146.8880 > 192.168.43.147.7772: UDP, length 120
02:46:14.798578 IP 192.168.43.124.8880 > 192.168.43.146.7771: UDP, length 120
02:46:14.843008 IP 192.168.43.146.8880 > 192.168.43.147.7772: UDP, length 120
02:46:14.849514 IP 192.168.43.124.8880 > 192.168.43.146.7771: UDP, length 120
02:46:14.893008 IP 192.168.43.146.8880 > 192.168.43.147.7772: UDP, length 120
02:46:14.901249 IP 192.168.43.124.8880 > 192.168.43.146.7771: UDP, length 120
02:46:14.943008 IP 192.168.43.146.8880 > 192.168.43.147.7772: UDP, length 120
02:46:14.949520 IP 192.168.43.124.8880 > 192.168.43.146.7771: UDP, length 120
02:46:14.993010 IP 192.168.43.146.8880 > 192.168.43.147.7772: UDP, length 120
02:46:15.000880 IP 192.168.43.124.8880 > 192.168.43.146.7771: UDP, length 120
02:46:15.043009 IP 192.168.43.146.8880 > 192.168.43.147.7772: UDP, length 120
02:46:15.048821 IP 192.168.43.124.8880 > 192.168.43.146.7771: UDP, length 120
02:46:15.093011 IP 192.168.43.146.8880 > 192.168.43.147.7772: UDP, length 120
02:46:15.105705 IP 192.168.43.124.8880 > 192.168.43.146.7771: UDP, length 120
02:46:15.143013 IP 192.168.43.146.8880 > 192.168.43.147.7772: UDP, length 120
02:46:15.148679 IP 192.168.43.124.8880 > 192.168.43.146.7771: UDP, length 120
02:46:15.193010 IP 192.168.43.146.8880 > 192.168.43.147.7772: UDP, length 120
02:46:15.202586 IP 192.168.43.124.8880 > 192.168.43.146.7771: UDP, length 120
02:46:15.243009 IP 192.168.43.146.8880 > 192.168.43.147.7772: UDP, length 120
02:46:15.251314 IP 192.168.43.124.8880 > 192.168.43.146.7771: UDP, length 120
02:46:15.293010 IP 192.168.43.146.8880 > 192.168.43.147.7772: UDP, length 120
02:46:15.298803 IP 192.168.43.124.8880 > 192.168.43.146.7771: UDP, length 120
02:46:15.343014 IP 192.168.43.146.8880 > 192.168.43.147.7772: UDP, length 120
02:46:15.349246 IP 192.168.43.124.8880 > 192.168.43.146.7771: UDP, length 120
02:46:15.393047 IP 192.168.43.146.8880 > 192.168.43.147.7772: UDP, length 120
02:46:15.398844 IP 192.168.43.124.8880 > 192.168.43.146.7771: UDP, length 120
02:46:15.443073 IP 192.168.43.146.8880 > 192.168.43.147.7772: UDP, length 120
02:46:15.448996 IP 192.168.43.124.8880 > 192.168.43.146.7771: UDP, length 120
02:46:15.493030 IP 192.168.43.146.8880 > 192.168.43.147.7772: UDP, length 120
02:46:15.500326 IP 192.168.43.124.8880 > 192.168.43.146.7771: UDP, length 120
02:46:15.543012 IP 192.168.43.146.8880 > 192.168.43.147.7772: UDP, length 120
02:46:15.551821 IP 192.168.43.124.8880 > 192.168.43.146.7771: UDP, length 120
02:46:15.593012 IP 192.168.43.146.8880 > 192.168.43.147.7772: UDP, length 120
02:46:15.600962 IP 192.168.43.124.8880 > 192.168.43.146.7771: UDP, length 120
02:46:15.643012 IP 192.168.43.146.8880 > 192.168.43.147.7772: UDP, length 120
02:46:15.652253 IP 192.168.43.124.8880 > 192.168.43.146.7771: UDP, length 120
02:46:15.693008 IP 192.168.43.146.8880 > 192.168.43.147.7772: UDP, length 120
02:46:15.699552 IP 192.168.43.124.8880 > 192.168.43.146.7771: UDP, length 120
02:46:15.743069 IP 192.168.43.146.8880 > 192.168.43.147.7772: UDP, length 120
02:46:15.749403 IP 192.168.43.124.8880 > 192.168.43.146.7771: UDP, length 120
02:46:15.793023 IP 192.168.43.146.8880 > 192.168.43.147.7772: UDP, length 120
02:46:15.798702 IP 192.168.43.124.8880 > 192.168.43.146.7771: UDP, length 120
02:46:15.843010 IP 192.168.43.146.8880 > 192.168.43.147.7772: UDP, length 120
02:46:15.850387 IP 192.168.43.124.8880 > 192.168.43.146.7771: UDP, length 120
02:46:15.893011 IP 192.168.43.146.8880 > 192.168.43.147.7772: UDP, length 120
02:46:15.899534 IP 192.168.43.124.8880 > 192.168.43.146.7771: UDP, length 120
02:46:15.943007 IP 192.168.43.146.8880 > 192.168.43.147.7772: UDP, length 120
02:46:15.949512 IP 192.168.43.124.8880 > 192.168.43.146.7771: UDP, length 120
02:46:15.993011 IP 192.168.43.146.8880 > 192.168.43.147.7772: UDP, length 120
02:46:15.999906 IP 192.168.43.124.8880 > 192.168.43.146.7771: UDP, length 120
02:46:16.043016 IP 192.168.43.146.8880 > 192.168.43.147.7772: UDP, length 120
02:46:16.049369 IP 192.168.43.124.8880 > 192.168.43.146.7771: UDP, length 120
02:46:16.093017 IP 192.168.43.146.8880 > 192.168.43.147.7772: UDP, length 120
02:46:16.102243 IP 192.168.43.124.8880 > 192.168.43.146.7771: UDP, length 120
02:46:16.143013 IP 192.168.43.146.8880 > 192.168.43.147.7772: UDP, length 120
02:46:16.148844 IP 192.168.43.124.8880 > 192.168.43.146.7771: UDP, length 120
02:46:16.193011 IP 192.168.43.146.8880 > 192.168.43.147.7772: UDP, length 120
02:46:16.202443 IP 192.168.43.124.8880 > 192.168.43.146.7771: UDP, length 120
02:46:16.243007 IP 192.168.43.146.8880 > 192.168.43.147.7772: UDP, length 120
02:46:16.248935 IP 192.168.43.124.8880 > 192.168.43.146.7771: UDP, length 120
02:46:16.293008 IP 192.168.43.146.8880 > 192.168.43.147.7772: UDP, length 120
02:46:16.298888 IP 192.168.43.124.8880 > 192.168.43.146.7771: UDP, length 120
02:46:16.343008 IP 192.168.43.146.8880 > 192.168.43.147.7772: UDP, length 120
02:46:16.348938 IP 192.168.43.124.8880 > 192.168.43.146.7771: UDP, length 120
02:46:16.393035 IP 192.168.43.146.8880 > 192.168.43.147.7772: UDP, length 120
02:46:16.398867 IP 192.168.43.124.8880 > 192.168.43.146.7771: UDP, length 120
02:46:16.443080 IP 192.168.43.146.8880 > 192.168.43.147.7772: UDP, length 120
02:46:16.448425 IP 192.168.43.124.8880 > 192.168.43.146.7771: UDP, length 120
02:46:16.493036 IP 192.168.43.146.8880 > 192.168.43.147.7772: UDP, length 120
02:46:16.498828 IP 192.168.43.124.8880 > 192.168.43.146.7771: UDP, length 120
02:46:16.543017 IP 192.168.43.146.8880 > 192.168.43.147.7772: UDP, length 120
02:46:16.548850 IP 192.168.43.124.8880 > 192.168.43.146.7771: UDP, length 120
02:46:16.593016 IP 192.168.43.146.8880 > 192.168.43.147.7772: UDP, length 120
02:46:16.598828 IP 192.168.43.124.8880 > 192.168.43.146.7771: UDP, length 120
02:46:16.643014 IP 192.168.43.146.8880 > 192.168.43.147.7772: UDP, length 120
02:46:16.652456 IP 192.168.43.124.8880 > 192.168.43.146.7771: UDP, length 120
02:46:16.693010 IP 192.168.43.146.8880 > 192.168.43.147.7772: UDP, length 120
02:46:16.699476 IP 192.168.43.124.8880 > 192.168.43.146.7771: UDP, length 120
02:46:16.743009 IP 192.168.43.146.8880 > 192.168.43.147.7772: UDP, length 120
02:46:16.748082 IP 192.168.43.124.8880 > 192.168.43.146.7771: UDP, length 120
02:46:16.793010 IP 192.168.43.146.8880 > 192.168.43.147.7772: UDP, length 120
02:46:16.798855 IP 192.168.43.124.8880 > 192.168.43.146.7771: UDP, length 120
02:46:16.843010 IP 192.168.43.146.8880 > 192.168.43.147.7772: UDP, length 120
02:46:16.848928 IP 192.168.43.124.8880 > 192.168.43.146.7771: UDP, length 120
02:46:16.893013 IP 192.168.43.146.8880 > 192.168.43.147.7772: UDP, length 120
02:46:16.896998 IP 192.168.43.124.8880 > 192.168.43.146.7771: UDP, length 120
02:46:16.943011 IP 192.168.43.146.8880 > 192.168.43.147.7772: UDP, length 120
02:46:16.949133 IP 192.168.43.124.8880 > 192.168.43.146.7771: UDP, length 120
02:46:16.993014 IP 192.168.43.146.8880 > 192.168.43.147.7772: UDP, length 120
02:46:16.998887 IP 192.168.43.124.8880 > 192.168.43.146.7771: UDP, length 120
02:46:17.043010 IP 192.168.43.146.8880 > 192.168.43.147.7772: UDP, length 120
02:46:17.052013 IP 192.168.43.124.8880 > 192.168.43.146.7771: UDP, length 120
02:46:17.093012 IP 192.168.43.146.8880 > 192.168.43.147.7772: UDP, length 120
02:46:17.098905 IP 192.168.43.124.8880 > 192.168.43.146.7771: UDP, length 120
02:46:17.143013 IP 192.168.43.146.8880 > 192.168.43.147.7772: UDP, length 120
02:46:17.154144 IP 192.168.43.124.8880 > 192.168.43.146.7771: UDP, length 120
02:46:17.193010 IP 192.168.43.146.8880 > 192.168.43.147.7772: UDP, length 120
02:46:17.198902 IP 192.168.43.124.8880 > 192.168.43.146.7771: UDP, length 120
02:46:17.243074 IP 192.168.43.146.8880 > 192.168.43.147.7772: UDP, length 120
02:46:17.250255 IP 192.168.43.124.8880 > 192.168.43.146.7771: UDP, length 120
02:46:17.293022 IP 192.168.43.146.8880 > 192.168.43.147.7772: UDP, length 120
02:46:17.298720 IP 192.168.43.124.8880 > 192.168.43.146.7771: UDP, length 120
02:46:17.343010 IP 192.168.43.146.8880 > 192.168.43.147.7772: UDP, length 120
02:46:17.348878 IP 192.168.43.124.8880 > 192.168.43.146.7771: UDP, length 120
02:46:17.393077 IP 192.168.43.146.8880 > 192.168.43.147.7772: UDP, length 120
02:46:17.419745 IP 192.168.43.124.8880 > 192.168.43.146.7771: UDP, length 120
02:46:17.443098 IP 192.168.43.146.8880 > 192.168.43.147.7772: UDP, length 120
