02:54:33.145970 IP 192.168.43.146.8880 > 192.168.43.147.7772: UDP, length 120
02:54:33.201377 IP 192.168.43.146.8880 > 192.168.43.147.7772: UDP, length 120
02:54:33.247466 IP 192.168.43.146.8880 > 192.168.43.147.7772: UDP, length 120
02:54:33.284902 IP 192.168.43.147.8880 > 192.168.43.124.7773: UDP, length 120
02:54:33.296924 IP 192.168.43.146.8880 > 192.168.43.147.7772: UDP, length 120
02:54:33.334944 IP 192.168.43.147.8880 > 192.168.43.124.7773: UDP, length 120
02:54:33.384926 IP 192.168.43.147.8880 > 192.168.43.124.7773: UDP, length 120
02:54:33.434922 IP 192.168.43.147.8880 > 192.168.43.124.7773: UDP, length 120
02:54:33.449423 IP 192.168.43.146.8880 > 192.168.43.147.7772: UDP, length 120
02:54:33.449699 IP 192.168.43.146.8880 > 192.168.43.147.7772: UDP, length 120
02:54:33.484934 IP 192.168.43.147.8880 > 192.168.43.124.7773: UDP, length 120
02:54:33.499345 IP 192.168.43.146.8880 > 192.168.43.147.7772: UDP, length 120
02:54:33.534923 IP 192.168.43.147.8880 > 192.168.43.124.7773: UDP, length 120
02:54:33.550832 IP 192.168.43.146.8880 > 192.168.43.147.7772: UDP, length 120
02:54:33.584922 IP 192.168.43.147.8880 > 192.168.43.124.7773: UDP, length 120
02:54:33.591556 IP 192.168.43.146.8880 > 192.168.43.147.7772: UDP, length 120
02:54:33.634972 IP 192.168.43.147.8880 > 192.168.43.124.7773: UDP, length 120
02:54:33.684933 IP 192.168.43.147.8880 > 192.168.43.124.7773: UDP, length 120
02:54:33.734920 IP 192.168.43.147.8880 > 192.168.43.124.7773: UDP, length 120
02:54:33.755485 IP 192.168.43.146.8880 > 192.168.43.147.7772: UDP, length 120
02:54:33.755630 IP 192.168.43.146.8880 > 192.168.43.147.7772: UDP, length 120
02:54:33.784925 IP 192.168.43.147.8880 > 192.168.43.124.7773: UDP, length 120
02:54:33.834922 IP 192.168.43.147.8880 > 192.168.43.124.7773: UDP, length 120
02:54:33.884938 IP 192.168.43.147.8880 > 192.168.43.124.7773: UDP, length 120
02:54:33.898430 IP 192.168.43.146.8880 > 192.168.43.147.7772: UDP, length 120
02:54:33.899402 IP 192.168.43.146.8880 > 192.168.43.147.7772: UDP, length 120
02:54:33.899516 IP 192.168.43.146.8880 > 192.168.43.147.7772: UDP, length 120
02:54:33.934929 IP 192.168.43.147.8880 > 192.168.43.124.7773: UDP, length 120
02:54:33.984922 IP 192.168.43.147.8880 > 192.168.43.124.7773: UDP, length 120
02:54:34.034921 IP 192.168.43.147.8880 > 192.168.43.124.7773: UDP, length 120
02:54:34.048395 IP 192.168.43.146.8880 > 192.168.43.147.7772: UDP, length 120
02:54:34.084929 IP 192.168.43.147.8880 > 192.168.43.124.7773: UDP, length 120
02:54:34.134922 IP 192.168.43.147.8880 > 192.168.43.124.7773: UDP, length 120
02:54:34.184932 IP 192.168.43.147.8880 > 192.168.43.124.7773: UDP, length 120
02:54:34.222050 IP 192.168.43.146.8880 > 192.168.43.147.7772: UDP, length 120
02:54:34.234918 IP 192.168.43.147.8880 > 192.168.43.124.7773: UDP, length 120
02:54:34.284919 IP 192.168.43.147.8880 > 192.168.43.124.7773: UDP, length 120
02:54:34.334922 IP 192.168.43.147.8880 > 192.168.43.124.7773: UDP, length 120
02:54:34.356533 IP 192.168.43.146.8880 > 192.168.43.147.7772: UDP, length 120
02:54:34.356711 IP 192.168.43.146.8880 > 192.168.43.147.7772: UDP, length 120
02:54:34.384921 IP 192.168.43.147.8880 > 192.168.43.124.7773: UDP, length 120
02:54:34.427598 IP 192.168.43.146.8880 > 192.168.43.147.7772: UDP, length 120
02:54:34.434918 IP 192.168.43.147.8880 > 192.168.43.124.7773: UDP, length 120
02:54:34.476365 IP 192.168.43.146.8880 > 192.168.43.147.7772: UDP, length 120
02:54:34.484932 IP 192.168.43.147.8880 > 192.168.43.124.7773: UDP, length 120
02:54:34.534922 IP 192.168.43.147.8880 > 192.168.43.124.7773: UDP, length 120
02:54:34.538819 IP 192.168.43.146.8880 > 192.168.43.147.7772: UDP, length 120
02:54:34.584922 IP 192.168.43.147.8880 > 192.168.43.124.7773: UDP, length 120
02:54:34.599872 IP 192.168.43.146.8880 > 192.168.43.147.7772: UDP, length 120
02:54:34.634923 IP 192.168.43.147.8880 > 192.168.43.124.7773: UDP, length 120
02:54:34.684928 IP 192.168.43.147.8880 > 192.168.43.124.7773: UDP, length 120
02:54:34.690893 IP 192.168.43.146.8880 > 192.168.43.147.7772: UDP, length 120
02:54:34.734925 IP 192.168.43.147.8880 > 192.168.43.124.7773: UDP, length 120
02:54:34.743392 IP 192.168.43.146.8880 > 192.168.43.147.7772: UDP, length 120
02:54:34.784926 IP 192.168.43.147.8880 > 192.168.43.124.7773: UDP, length 120
02:54:34.794917 IP 192.168.43.146.8880 > 192.168.43.147.7772: UDP, length 120
02:54:34.834927 IP 192.168.43.147.8880 > 192.168.43.124.7773: UDP, length 120
02:54:34.871005 IP 192.168.43.146.8880 > 192.168.43.147.7772: UDP, length 120
02:54:34.884963 IP 192.168.43.147.8880 > 192.168.43.124.7773: UDP, length 120
02:54:34.890201 IP 192.168.43.146.8880 > 192.168.43.147.7772: UDP, length 120
02:54:34.934937 IP 192.168.43.147.8880 > 192.168.43.124.7773: UDP, length 120
02:54:34.941897 IP 192.168.43.146.8880 > 192.168.43.147.7772: UDP, length 120
02:54:34.984934 IP 192.168.43.147.8880 > 192.168.43.124.7773: UDP, length 120
02:54:34.991688 IP 192.168.43.146.8880 > 192.168.43.147.7772: UDP, length 120
02:54:35.034924 IP 192.168.43.147.8880 > 192.168.43.124.7773: UDP, length 120
02:54:35.041306 IP 192.168.43.146.8880 > 192.168.43.147.7772: UDP, length 120
02:54:35.084923 IP 192.168.43.147.8880 > 192.168.43.124.7773: UDP, length 120
02:54:35.092639 IP 192.168.43.146.8880 > 192.168.43.147.7772: UDP, length 120
02:54:35.134973 IP 192.168.43.147.8880 > 192.168.43.124.7773: UDP, length 120
02:54:35.141713 IP 192.168.43.146.8880 > 192.168.43.147.7772: UDP, length 120
02:54:35.184936 IP 192.168.43.147.8880 > 192.168.43.124.7773: UDP, length 120
02:54:35.191257 IP 192.168.43.146.8880 > 192.168.43.147.7772: UDP, length 120
02:54:35.234935 IP 192.168.43.147.8880 > 192.168.43.124.7773: UDP, length 120
02:54:35.241924 IP 192.168.43.146.8880 > 192.168.43.147.7772: UDP, length 120
02:54:35.284926 IP 192.168.43.147.8880 > 192.168.43.124.7773: UDP, length 120
02:54:35.293160 IP 192.168.43.146.8880 > 192.168.43.147.7772: UDP, length 120
02:54:35.334923 IP 192.168.43.147.8880 > 192.168.43.124.7773: UDP, length 120
02:54:35.344690 IP 192.168.43.146.8880 > 192.168.43.147.7772: UDP, length 120
02:54:35.384924 IP 192.168.43.147.8880 > 192.168.43.124.7773: UDP, length 120
02:54:35.394800 IP 192.168.43.146.8880 > 192.168.43.147.7772: UDP, length 120
02:54:35.434944 IP 192.168.43.147.8880 > 192.168.43.124.7773: UDP, length 120
02:54:35.446171 IP 192.168.43.146.8880 > 192.168.43.147.7772: UDP, length 120
02:54:35.484931 IP 192.168.43.147.8880 > 192.168.43.124.7773: UDP, length 120
02:54:35.501326 IP 192.168.43.146.8880 > 192.168.43.147.7772: UDP, length 120
02:54:35.534923 IP 192.168.43.147.8880 > 192.168.43.124.7773: UDP, length 120
02:54:35.549872 IP 192.168.43.146.8880 > 192.168.43.147.7772: UDP, length 120
02:54:35.584925 IP 192.168.43.147.8880 > 192.168.43.124.7773: UDP, length 120
02:54:35.598805 IP 192.168.43.146.8880 > 192.168.43.147.7772: UDP, length 120
02:54:35.634927 IP 192.168.43.147.8880 > 192.168.43.124.7773: UDP, length 120
02:54:35.684945 IP 192.168.43.147.8880 > 192.168.43.124.7773: UDP, length 120
02:54:35.704666 IP 192.168.43.146.8880 > 192.168.43.147.7772: UDP, length 120
02:54:35.704961 IP 192.168.43.146.8880 > 192.168.43.147.7772: UDP, length 120
02:54:35.734933 IP 192.168.43.147.8880 > 192.168.43.124.7773: UDP, length 120
02:54:35.743009 IP 192.168.43.146.8880 > 192.168.43.147.7772: UDP, length 120
02:54:35.784935 IP 192.168.43.147.8880 > 192.168.43.124.7773: UDP, length 120
02:54:35.834923 IP 192.168.43.147.8880 > 192.168.43.124.7773: UDP, length 120
02:54:35.844779 IP 192.168.43.146.8880 > 192.168.43.147.7772: UDP, length 120
02:54:35.845785 IP 192.168.43.146.8880 > 192.168.43.147.7772: UDP, length 120
02:54:35.884927 IP 192.168.43.147.8880 > 192.168.43.124.7773: UDP, length 120
02:54:35.934924 IP 192.168.43.147.8880 > 192.168.43.124.7773: UDP, length 120
02:54:35.984916 IP 192.168.43.147.8880 > 192.168.43.124.7773: UDP, length 120
02:54:35.988365 IP 192.168.43.146.8880 > 192.168.43.147.7772: UDP, length 120
02:54:35.993737 IP 192.168.43.146.8880 > 192.168.43.147.7772: UDP, length 120
02:54:36.002176 IP 192.168.43.146.8880 > 192.168.43.147.7772: UDP, length 120
02:54:36.034923 IP 192.168.43.147.8880 > 192.168.43.124.7773: UDP, length 120
02:54:36.084919 IP 192.168.43.147.8880 > 192.168.43.124.7773: UDP, length 120
02:54:36.124078 IP 192.168.43.146.8880 > 192.168.43.147.7772: UDP, length 120
02:54:36.130454 IP 192.168.43.146.8880 > 192.168.43.147.7772: UDP, length 120
02:54:36.134920 IP 192.168.43.147.8880 > 192.168.43.124.7773: UDP, length 120
02:54:36.141898 IP 192.168.43.146.8880 > 192.168.43.147.7772: UDP, length 120
02:54:36.184920 IP 192.168.43.147.8880 > 192.168.43.124.7773: UDP, length 120
02:54:36.234932 IP 192.168.43.147.8880 > 192.168.43.124.7773: UDP, length 120
02:54:36.268207 IP 192.168.43.146.8880 > 192.168.43.147.7772: UDP, length 120
02:54:36.268468 IP 192.168.43.146.8880 > 192.168.43.147.7772: UDP, length 120
02:54:36.284921 IP 192.168.43.147.8880 > 192.168.43.124.7773: UDP, length 120
02:54:36.292386 IP 192.168.43.146.8880 > 192.168.43.147.7772: UDP, length 120
02:54:36.334922 IP 192.168.43.147.8880 > 192.168.43.124.7773: UDP, length 120
02:54:36.341821 IP 192.168.43.146.8880 > 192.168.43.147.7772: UDP, length 120
02:54:36.384922 IP 192.168.43.147.8880 > 192.168.43.124.7773: UDP, length 120
02:54:36.394985 IP 192.168.43.146.8880 > 192.168.43.147.7772: UDP, length 120
02:54:36.434921 IP 192.168.43.147.8880 > 192.168.43.124.7773: UDP, length 120
02:54:36.443428 IP 192.168.43.146.8880 > 192.168.43.147.7772: UDP, length 120
02:54:36.484935 IP 192.168.43.147.8880 > 192.168.43.124.7773: UDP, length 120
02:54:36.497067 IP 192.168.43.146.8880 > 192.168.43.147.7772: UDP, length 120
02:54:36.534923 IP 192.168.43.147.8880 > 192.168.43.124.7773: UDP, length 120
02:54:36.541872 IP 192.168.43.146.8880 > 192.168.43.147.7772: UDP, length 120
02:54:36.584923 IP 192.168.43.147.8880 > 192.168.43.124.7773: UDP, length 120
02:54:36.593755 IP 192.168.43.146.8880 > 192.168.43.147.7772: UDP, length 120
02:54:36.634961 IP 192.168.43.147.8880 > 192.168.43.124.7773: UDP, length 120
02:54:36.645213 IP 192.168.43.146.8880 > 192.168.43.147.7772: UDP, length 120
02:54:36.685015 IP 192.168.43.147.8880 > 192.168.43.124.7773: UDP, length 120
02:54:36.702676 IP 192.168.43.146.8880 > 192.168.43.147.7772: UDP, length 120
02:54:36.735054 IP 192.168.43.147.8880 > 192.168.43.124.7773: UDP, length 120
02:54:36.742388 IP 192.168.43.146.8880 > 192.168.43.147.7772: UDP, length 120
02:54:36.785026 IP 192.168.43.147.8880 > 192.168.43.124.7773: UDP, length 120
02:54:36.791909 IP 192.168.43.146.8880 > 192.168.43.147.7772: UDP, length 120
02:54:36.834988 IP 192.168.43.147.8880 > 192.168.43.124.7773: UDP, length 120
02:54:36.858938 IP 192.168.43.146.8880 > 192.168.43.147.7772: UDP, length 120
02:54:36.885037 IP 192.168.43.147.8880 > 192.168.43.124.7773: UDP, length 120
02:54:36.893002 IP 192.168.43.146.8880 > 192.168.43.147.7772: UDP, length 120
02:54:36.935032 IP 192.168.43.147.8880 > 192.168.43.124.7773: UDP, length 120
02:54:36.945048 IP 192.168.43.146.8880 > 192.168.43.147.7772: UDP, length 120
02:54:36.985015 IP 192.168.43.147.8880 > 192.168.43.124.7773: UDP, length 120
02:54:36.995836 IP 192.168.43.146.8880 > 192.168.43.147.7772: UDP, length 120
02:54:37.034961 IP 192.168.43.147.8880 > 192.168.43.124.7773: UDP, length 120
02:54:37.041175 IP 192.168.43.146.8880 > 192.168.43.147.7772: UDP, length 120
02:54:37.084978 IP 192.168.43.147.8880 > 192.168.43.124.7773: UDP, length 120
02:54:37.093527 IP 192.168.43.146.8880 > 192.168.43.147.7772: UDP, length 120
02:54:37.134995 IP 192.168.43.147.8880 > 192.168.43.124.7773: UDP, length 120
02:54:37.142862 IP 192.168.43.146.8880 > 192.168.43.147.7772: UDP, length 120
02:54:37.184947 IP 192.168.43.147.8880 > 192.168.43.124.7773: UDP, length 120
02:54:37.234898 IP 192.168.43.147.8880 > 192.168.43.124.7773: UDP, length 120
02:54:37.243147 IP 192.168.43.146.8880 > 192.168.43.147.7772: UDP, length 120
02:54:37.246476 IP 192.168.43.146.8880 > 192.168.43.147.7772: UDP, length 120
02:54:37.284898 IP 192.168.43.147.8880 > 192.168.43.124.7773: UDP, length 120
02:54:37.334896 IP 192.168.43.147.8880 > 192.168.43.124.7773: UDP, length 120
02:54:37.384357 IP 192.168.43.146.8880 > 192.168.43.147.7772: UDP, length 120
02:54:37.384500 IP 192.168.43.146.8880 > 192.168.43.147.7772: UDP, length 120
02:54:37.384895 IP 192.168.43.147.8880 > 192.168.43.124.7773: UDP, length 120
02:54:37.392465 IP 192.168.43.146.8880 > 192.168.43.147.7772: UDP, length 120
02:54:37.434896 IP 192.168.43.147.8880 > 192.168.43.124.7773: UDP, length 120
02:54:37.484897 IP 192.168.43.147.8880 > 192.168.43.124.7773: UDP, length 120
02:54:37.533338 IP 192.168.43.146.8880 > 192.168.43.147.7772: UDP, length 120
02:54:37.534896 IP 192.168.43.147.8880 > 192.168.43.124.7773: UDP, length 120
02:54:37.545939 IP 192.168.43.146.8880 > 192.168.43.147.7772: UDP, length 120
02:54:37.546207 IP 192.168.43.146.8880 > 192.168.43.147.7772: UDP, length 120
02:54:37.584898 IP 192.168.43.147.8880 > 192.168.43.124.7773: UDP, length 120
02:54:37.634896 IP 192.168.43.147.8880 > 192.168.43.124.7773: UDP, length 120
02:54:37.661769 IP 192.168.43.146.8880 > 192.168.43.147.7772: UDP, length 120
02:54:37.684898 IP 192.168.43.147.8880 > 192.168.43.124.7773: UDP, length 120
02:54:37.734896 IP 192.168.43.147.8880 > 192.168.43.124.7773: UDP, length 120
02:54:37.747232 IP 192.168.43.146.8880 > 192.168.43.147.7772: UDP, length 120
02:54:37.747432 IP 192.168.43.146.8880 > 192.168.43.147.7772: UDP, length 120
02:54:37.747570 IP 192.168.43.146.8880 > 192.168.43.147.7772: UDP, length 120
02:54:37.784898 IP 192.168.43.147.8880 > 192.168.43.124.7773: UDP, length 120
02:54:37.799842 IP 192.168.43.146.8880 > 192.168.43.147.7772: UDP, length 120
02:54:37.834895 IP 192.168.43.147.8880 > 192.168.43.124.7773: UDP, length 120
02:54:37.850973 IP 192.168.43.146.8880 > 192.168.43.147.7772: UDP, length 120
02:54:37.884919 IP 192.168.43.147.8880 > 192.168.43.124.7773: UDP, length 120
02:54:37.934904 IP 192.168.43.147.8880 > 192.168.43.124.7773: UDP, length 120
02:54:37.938156 IP 192.168.43.146.8880 > 192.168.43.147.7772: UDP, length 120
02:54:37.984898 IP 192.168.43.147.8880 > 192.168.43.124.7773: UDP, length 120
02:54:38.034895 IP 192.168.43.147.8880 > 192.168.43.124.7773: UDP, length 120
02:54:38.053725 IP 192.168.43.146.8880 > 192.168.43.147.7772: UDP, length 120
02:54:38.053956 IP 192.168.43.146.8880 > 192.168.43.147.7772: UDP, length 120
02:54:38.084897 IP 192.168.43.147.8880 > 192.168.43.124.7773: UDP, length 120
02:54:38.121657 IP 192.168.43.146.8880 > 192.168.43.147.7772: UDP, length 120
02:54:38.134929 IP 192.168.43.147.8880 > 192.168.43.124.7773: UDP, length 120
02:54:38.157198 IP 192.168.43.146.8880 > 192.168.43.147.7772: UDP, length 120
02:54:38.184906 IP 192.168.43.147.8880 > 192.168.43.124.7773: UDP, length 120
02:54:38.196812 IP 192.168.43.146.8880 > 192.168.43.147.7772: UDP, length 120
02:54:38.234922 IP 192.168.43.147.8880 > 192.168.43.124.7773: UDP, length 120
02:54:38.261358 IP 192.168.43.146.8880 > 192.168.43.147.7772: UDP, length 120
02:54:38.284901 IP 192.168.43.147.8880 > 192.168.43.124.7773: UDP, length 120
02:54:38.297420 IP 192.168.43.146.8880 > 192.168.43.147.7772: UDP, length 120
02:54:38.334899 IP 192.168.43.147.8880 > 192.168.43.124.7773: UDP, length 120
02:54:38.360985 IP 192.168.43.146.8880 > 192.168.43.147.7772: UDP, length 120
02:54:38.384894 IP 192.168.43.147.8880 > 192.168.43.124.7773: UDP, length 120
02:54:38.400079 IP 192.168.43.146.8880 > 192.168.43.147.7772: UDP, length 120
02:54:38.434895 IP 192.168.43.147.8880 > 192.168.43.124.7773: UDP, length 120
02:54:38.465130 IP 192.168.43.146.8880 > 192.168.43.147.7772: UDP, length 120
02:54:38.484898 IP 192.168.43.147.8880 > 192.168.43.124.7773: UDP, length 120
02:54:38.497391 IP 192.168.43.146.8880 > 192.168.43.147.7772: UDP, length 120
02:54:38.534895 IP 192.168.43.147.8880 > 192.168.43.124.7773: UDP, length 120
02:54:38.554081 IP 192.168.43.146.8880 > 192.168.43.147.7772: UDP, length 120
02:54:38.584897 IP 192.168.43.147.8880 > 192.168.43.124.7773: UDP, length 120
02:54:38.633612 IP 192.168.43.146.8880 > 192.168.43.147.7772: UDP, length 120
02:54:38.634896 IP 192.168.43.147.8880 > 192.168.43.124.7773: UDP, length 120
02:54:38.659641 IP 192.168.43.146.8880 > 192.168.43.147.7772: UDP, length 120
02:54:38.684905 IP 192.168.43.147.8880 > 192.168.43.124.7773: UDP, length 120
02:54:38.734900 IP 192.168.43.147.8880 > 192.168.43.124.7773: UDP, length 120
02:54:38.736826 IP 192.168.43.146.8880 > 192.168.43.147.7772: UDP, length 120
02:54:38.754373 IP 192.168.43.146.8880 > 192.168.43.147.7772: UDP, length 120
02:54:38.784902 IP 192.168.43.147.8880 > 192.168.43.124.7773: UDP, length 120
02:54:38.828547 IP 192.168.43.146.8880 > 192.168.43.147.7772: UDP, length 120
02:54:38.834896 IP 192.168.43.147.8880 > 192.168.43.124.7773: UDP, length 120
02:54:38.874175 IP 192.168.43.146.8880 > 192.168.43.147.7772: UDP, length 120
02:54:38.884905 IP 192.168.43.147.8880 > 192.168.43.124.7773: UDP, length 120
02:54:38.895991 IP 192.168.43.146.8880 > 192.168.43.147.7772: UDP, length 120
02:54:38.934903 IP 192.168.43.147.8880 > 192.168.43.124.7773: UDP, length 120
02:54:38.966762 IP 192.168.43.146.8880 > 192.168.43.147.7772: UDP, length 120
02:54:38.984913 IP 192.168.43.147.8880 > 192.168.43.124.7773: UDP, length 120
02:54:38.994064 IP 192.168.43.146.8880 > 192.168.43.147.7772: UDP, length 120
02:54:39.034898 IP 192.168.43.147.8880 > 192.168.43.124.7773: UDP, length 120
02:54:39.068891 IP 192.168.43.146.8880 > 192.168.43.147.7772: UDP, length 120
02:54:39.084899 IP 192.168.43.147.8880 > 192.168.43.124.7773: UDP, length 120
02:54:39.096005 IP 192.168.43.146.8880 > 192.168.43.147.7772: UDP, length 120
02:54:39.134895 IP 192.168.43.147.8880 > 192.168.43.124.7773: UDP, length 120
02:54:39.181996 IP 192.168.43.146.8880 > 192.168.43.147.7772: UDP, length 120
02:54:39.184896 IP 192.168.43.147.8880 > 192.168.43.124.7773: UDP, length 120
02:54:39.202006 IP 192.168.43.146.8880 > 192.168.43.147.7772: UDP, length 120
02:54:39.234895 IP 192.168.43.147.8880 > 192.168.43.124.7773: UDP, length 120
02:54:39.248407 IP 192.168.43.146.8880 > 192.168.43.147.7772: UDP, length 120
02:54:39.284896 IP 192.168.43.147.8880 > 192.168.43.124.7773: UDP, length 120
02:54:39.292303 IP 192.168.43.146.8880 > 192.168.43.147.7772: UDP, length 120
02:54:39.334896 IP 192.168.43.147.8880 > 192.168.43.124.7773: UDP, length 120
02:54:39.348306 IP 192.168.43.146.8880 > 192.168.43.147.7772: UDP, length 120
02:54:39.384897 IP 192.168.43.147.8880 > 192.168.43.124.7773: UDP, length 120
02:54:39.392665 IP 192.168.43.146.8880 > 192.168.43.147.7772: UDP, length 120
02:54:39.434896 IP 192.168.43.147.8880 > 192.168.43.124.7773: UDP, length 120
02:54:39.484896 IP 192.168.43.147.8880 > 192.168.43.124.7773: UDP, length 120
02:54:39.488142 IP 192.168.43.146.8880 > 192.168.43.147.7772: UDP, length 120
02:54:39.511527 IP 192.168.43.146.8880 > 192.168.43.147.7772: UDP, length 120
02:54:39.534897 IP 192.168.43.147.8880 > 192.168.43.124.7773: UDP, length 120
02:54:39.584895 IP 192.168.43.147.8880 > 192.168.43.124.7773: UDP, length 120
02:54:39.588141 IP 192.168.43.146.8880 > 192.168.43.147.7772: UDP, length 120
02:54:39.592632 IP 192.168.43.146.8880 > 192.168.43.147.7772: UDP, length 120
02:54:39.634942 IP 192.168.43.147.8880 > 192.168.43.124.7773: UDP, length 120
02:54:39.654883 IP 192.168.43.146.8880 > 192.168.43.147.7772: UDP, length 120
02:54:39.684903 IP 192.168.43.147.8880 > 192.168.43.124.7773: UDP, length 120
02:54:39.691497 IP 192.168.43.146.8880 > 192.168.43.147.7772: UDP, length 120
02:54:39.734896 IP 192.168.43.147.8880 > 192.168.43.124.7773: UDP, length 120
02:54:39.784900 IP 192.168.43.147.8880 > 192.168.43.124.7773: UDP, length 120
02:54:39.785001 IP 192.168.43.146.8880 > 192.168.43.147.7772: UDP, length 120
02:54:39.794575 IP 192.168.43.146.8880 > 192.168.43.147.7772: UDP, length 120
02:54:39.834896 IP 192.168.43.147.8880 > 192.168.43.124.7773: UDP, length 120
02:54:39.850210 IP 192.168.43.146.8880 > 192.168.43.147.7772: UDP, length 120
02:54:39.884901 IP 192.168.43.147.8880 > 192.168.43.124.7773: UDP, length 120
02:54:39.895294 IP 192.168.43.146.8880 > 192.168.43.147.7772: UDP, length 120
02:54:39.934898 IP 192.168.43.147.8880 > 192.168.43.124.7773: UDP, length 120
02:54:39.964769 IP 192.168.43.146.8880 > 192.168.43.147.7772: UDP, length 120
02:54:39.984905 IP 192.168.43.147.8880 > 192.168.43.124.7773: UDP, length 120
02:54:39.997837 IP 192.168.43.146.8880 > 192.168.43.147.7772: UDP, length 120
02:54:40.034898 IP 192.168.43.147.8880 > 192.168.43.124.7773: UDP, length 120
02:54:40.068148 IP 192.168.43.146.8880 > 192.168.43.147.7772: UDP, length 120
02:54:40.084896 IP 192.168.43.147.8880 > 192.168.43.124.7773: UDP, length 120
02:54:40.101220 IP 192.168.43.146.8880 > 192.168.43.147.7772: UDP, length 120
02:54:40.134897 IP 192.168.43.147.8880 > 192.168.43.124.7773: UDP, length 120
02:54:40.170365 IP 192.168.43.146.8880 > 192.168.43.147.7772: UDP, length 120
02:54:40.184895 IP 192.168.43.147.8880 > 192.168.43.124.7773: UDP, length 120
02:54:40.204950 IP 192.168.43.146.8880 > 192.168.43.147.7772: UDP, length 120
02:54:40.234896 IP 192.168.43.147.8880 > 192.168.43.124.7773: UDP, length 120
02:54:40.277339 IP 192.168.43.146.8880 > 192.168.43.147.7772: UDP, length 120
02:54:40.284895 IP 192.168.43.147.8880 > 192.168.43.124.7773: UDP, length 120
02:54:40.307621 IP 192.168.43.146.8880 > 192.168.43.147.7772: UDP, length 120
02:54:40.334895 IP 192.168.43.147.8880 > 192.168.43.124.7773: UDP, length 120
02:54:40.346208 IP 192.168.43.146.8880 > 192.168.43.147.7772: UDP, length 120
02:54:40.384896 IP 192.168.43.147.8880 > 192.168.43.124.7773: UDP, length 120
02:54:40.416076 IP 192.168.43.146.8880 > 192.168.43.147.7772: UDP, length 120
02:54:40.434896 IP 192.168.43.147.8880 > 192.168.43.124.7773: UDP, length 120
02:54:40.442462 IP 192.168.43.146.8880 > 192.168.43.147.7772: UDP, length 120
02:54:40.484896 IP 192.168.43.147.8880 > 192.168.43.124.7773: UDP, length 120
02:54:40.491014 IP 192.168.43.146.8880 > 192.168.43.147.7772: UDP, length 120
02:54:40.534896 IP 192.168.43.147.8880 > 192.168.43.124.7773: UDP, length 120
02:54:40.540635 IP 192.168.43.146.8880 > 192.168.43.147.7772: UDP, length 120
02:54:40.584896 IP 192.168.43.147.8880 > 192.168.43.124.7773: UDP, length 120
02:54:40.592532 IP 192.168.43.146.8880 > 192.168.43.147.7772: UDP, length 120
02:54:40.634897 IP 192.168.43.147.8880 > 192.168.43.124.7773: UDP, length 120
02:54:40.642352 IP 192.168.43.146.8880 > 192.168.43.147.7772: UDP, length 120
02:54:40.684895 IP 192.168.43.147.8880 > 192.168.43.124.7773: UDP, length 120
02:54:40.692783 IP 192.168.43.146.8880 > 192.168.43.147.7772: UDP, length 120
02:54:40.734895 IP 192.168.43.147.8880 > 192.168.43.124.7773: UDP, length 120
02:54:40.740789 IP 192.168.43.146.8880 > 192.168.43.147.7772: UDP, length 120
02:54:40.784897 IP 192.168.43.147.8880 > 192.168.43.124.7773: UDP, length 120
02:54:40.790955 IP 192.168.43.146.8880 > 192.168.43.147.7772: UDP, length 120
02:54:40.834896 IP 192.168.43.147.8880 > 192.168.43.124.7773: UDP, length 120
02:54:40.842730 IP 192.168.43.146.8880 > 192.168.43.147.7772: UDP, length 120
02:54:40.884902 IP 192.168.43.147.8880 > 192.168.43.124.7773: UDP, length 120
02:54:40.893975 IP 192.168.43.146.8880 > 192.168.43.147.7772: UDP, length 120
02:54:40.934897 IP 192.168.43.147.8880 > 192.168.43.124.7773: UDP, length 120
02:54:40.940718 IP 192.168.43.146.8880 > 192.168.43.147.7772: UDP, length 120
02:54:40.984897 IP 192.168.43.147.8880 > 192.168.43.124.7773: UDP, length 120
02:54:40.990920 IP 192.168.43.146.8880 > 192.168.43.147.7772: UDP, length 120
02:54:41.034900 IP 192.168.43.147.8880 > 192.168.43.124.7773: UDP, length 120
02:54:41.041662 IP 192.168.43.146.8880 > 192.168.43.147.7772: UDP, length 120
02:54:41.084903 IP 192.168.43.147.8880 > 192.168.43.124.7773: UDP, length 120
02:54:41.102395 IP 192.168.43.146.8880 > 192.168.43.147.7772: UDP, length 120
02:54:41.134929 IP 192.168.43.147.8880 > 192.168.43.124.7773: UDP, length 120
02:54:41.142612 IP 192.168.43.146.8880 > 192.168.43.147.7772: UDP, length 120
02:54:41.184901 IP 192.168.43.147.8880 > 192.168.43.124.7773: UDP, length 120
02:54:41.191775 IP 192.168.43.146.8880 > 192.168.43.147.7772: UDP, length 120
02:54:41.234897 IP 192.168.43.147.8880 > 192.168.43.124.7773: UDP, length 120
02:54:41.247889 IP 192.168.43.146.8880 > 192.168.43.147.7772: UDP, length 120
02:54:41.284897 IP 192.168.43.147.8880 > 192.168.43.124.7773: UDP, length 120
02:54:41.290855 IP 192.168.43.146.8880 > 192.168.43.147.7772: UDP, length 120
02:54:41.334896 IP 192.168.43.147.8880 > 192.168.43.124.7773: UDP, length 120
02:54:41.341192 IP 192.168.43.146.8880 > 192.168.43.147.7772: UDP, length 120
02:54:41.384897 IP 192.168.43.147.8880 > 192.168.43.124.7773: UDP, length 120
02:54:41.434583 IP 192.168.43.146.8880 > 192.168.43.147.7772: UDP, length 120
02:54:41.434895 IP 192.168.43.147.8880 > 192.168.43.124.7773: UDP, length 120
02:54:41.442253 IP 192.168.43.146.8880 > 192.168.43.147.7772: UDP, length 120
02:54:41.484901 IP 192.168.43.147.8880 > 192.168.43.124.7773: UDP, length 120
02:54:41.497929 IP 192.168.43.146.8880 > 192.168.43.147.7772: UDP, length 120
02:54:41.534900 IP 192.168.43.147.8880 > 192.168.43.124.7773: UDP, length 120
02:54:41.540701 IP 192.168.43.146.8880 > 192.168.43.147.7772: UDP, length 120
02:54:41.584903 IP 192.168.43.147.8880 > 192.168.43.124.7773: UDP, length 120
02:54:41.592857 IP 192.168.43.146.8880 > 192.168.43.147.7772: UDP, length 120
02:54:41.634898 IP 192.168.43.147.8880 > 192.168.43.124.7773: UDP, length 120
02:54:41.639995 IP 192.168.43.146.8880 > 192.168.43.147.7772: UDP, length 120
02:54:41.684897 IP 192.168.43.147.8880 > 192.168.43.124.7773: UDP, length 120
02:54:41.695374 IP 192.168.43.146.8880 > 192.168.43.147.7772: UDP, length 120
02:54:41.734896 IP 192.168.43.147.8880 > 192.168.43.124.7773: UDP, length 120
02:54:41.741667 IP 192.168.43.146.8880 > 192.168.43.147.7772: UDP, length 120
02:54:41.784898 IP 192.168.43.147.8880 > 192.168.43.124.7773: UDP, length 120
02:54:41.792138 IP 192.168.43.146.8880 > 192.168.43.147.7772: UDP, length 120
02:54:41.834895 IP 192.168.43.147.8880 > 192.168.43.124.7773: UDP, length 120
02:54:41.842385 IP 192.168.43.146.8880 > 192.168.43.147.7772: UDP, length 120
02:54:41.884922 IP 192.168.43.147.8880 > 192.168.43.124.7773: UDP, length 120
02:54:41.891124 IP 192.168.43.146.8880 > 192.168.43.147.7772: UDP, length 120
02:54:41.934955 IP 192.168.43.147.8880 > 192.168.43.124.7773: UDP, length 120
02:54:41.941907 IP 192.168.43.146.8880 > 192.168.43.147.7772: UDP, length 120
02:54:41.984929 IP 192.168.43.147.8880 > 192.168.43.124.7773: UDP, length 120
02:54:41.998881 IP 192.168.43.146.8880 > 192.168.43.147.7772: UDP, length 120
02:54:42.034924 IP 192.168.43.147.8880 > 192.168.43.124.7773: UDP, length 120
02:54:42.047799 IP 192.168.43.146.8880 > 192.168.43.147.7772: UDP, length 120
02:54:42.084926 IP 192.168.43.147.8880 > 192.168.43.124.7773: UDP, length 120
02:54:42.092916 IP 192.168.43.146.8880 > 192.168.43.147.7772: UDP, length 120
02:54:42.134941 IP 192.168.43.147.8880 > 192.168.43.124.7773: UDP, length 120
02:54:42.146450 IP 192.168.43.146.8880 > 192.168.43.147.7772: UDP, length 120
02:54:42.184998 IP 192.168.43.147.8880 > 192.168.43.124.7773: UDP, length 120
02:54:42.193457 IP 192.168.43.146.8880 > 192.168.43.147.7772: UDP, length 120
02:54:42.235043 IP 192.168.43.147.8880 > 192.168.43.124.7773: UDP, length 120
02:54:42.268980 IP 192.168.43.146.8880 > 192.168.43.147.7772: UDP, length 120
02:54:42.285017 IP 192.168.43.147.8880 > 192.168.43.124.7773: UDP, length 120
02:54:42.305509 IP 192.168.43.146.8880 > 192.168.43.147.7772: UDP, length 120
02:54:42.334996 IP 192.168.43.147.8880 > 192.168.43.124.7773: UDP, length 120
02:54:42.340884 IP 192.168.43.146.8880 > 192.168.43.147.7772: UDP, length 120
02:54:42.385005 IP 192.168.43.147.8880 > 192.168.43.124.7773: UDP, length 120
02:54:42.396835 IP 192.168.43.146.8880 > 192.168.43.147.7772: UDP, length 120
02:54:42.434958 IP 192.168.43.147.8880 > 192.168.43.124.7773: UDP, length 120
02:54:42.445437 IP 192.168.43.146.8880 > 192.168.43.147.7772: UDP, length 120
02:54:42.484978 IP 192.168.43.147.8880 > 192.168.43.124.7773: UDP, length 120
02:54:42.499563 IP 192.168.43.146.8880 > 192.168.43.147.7772: UDP, length 120
02:54:42.534979 IP 192.168.43.147.8880 > 192.168.43.124.7773: UDP, length 120
02:54:42.540876 IP 192.168.43.146.8880 > 192.168.43.147.7772: UDP, length 120
02:54:42.584982 IP 192.168.43.147.8880 > 192.168.43.124.7773: UDP, length 120
02:54:42.635013 IP 192.168.43.147.8880 > 192.168.43.124.7773: UDP, length 120
02:54:42.663160 IP 192.168.43.146.8880 > 192.168.43.147.7772: UDP, length 120
02:54:42.663373 IP 192.168.43.146.8880 > 192.168.43.147.7772: UDP, length 120
02:54:42.684941 IP 192.168.43.147.8880 > 192.168.43.124.7773: UDP, length 120
02:54:42.694793 IP 192.168.43.146.8880 > 192.168.43.147.7772: UDP, length 120
02:54:42.734900 IP 192.168.43.147.8880 > 192.168.43.124.7773: UDP, length 120
02:54:42.766304 IP 192.168.43.146.8880 > 192.168.43.147.7772: UDP, length 120
02:54:42.784900 IP 192.168.43.147.8880 > 192.168.43.124.7773: UDP, length 120
02:54:42.795912 IP 192.168.43.146.8880 > 192.168.43.147.7772: UDP, length 120
02:54:42.834902 IP 192.168.43.147.8880 > 192.168.43.124.7773: UDP, length 120
02:54:42.847326 IP 192.168.43.146.8880 > 192.168.43.147.7772: UDP, length 120
02:54:42.884904 IP 192.168.43.147.8880 > 192.168.43.124.7773: UDP, length 120
02:54:42.924453 IP 192.168.43.146.8880 > 192.168.43.147.7772: UDP, length 120
02:54:42.934899 IP 192.168.43.147.8880 > 192.168.43.124.7773: UDP, length 120
02:54:42.971256 IP 192.168.43.146.8880 > 192.168.43.147.7772: UDP, length 120
02:54:42.984901 IP 192.168.43.147.8880 > 192.168.43.124.7773: UDP, length 120
02:54:43.001071 IP 192.168.43.146.8880 > 192.168.43.147.7772: UDP, length 120
02:54:43.034896 IP 192.168.43.147.8880 > 192.168.43.124.7773: UDP, length 120
02:54:43.074444 IP 192.168.43.146.8880 > 192.168.43.147.7772: UDP, length 120
02:54:43.084897 IP 192.168.43.147.8880 > 192.168.43.124.7773: UDP, length 120
02:54:43.107166 IP 192.168.43.146.8880 > 192.168.43.147.7772: UDP, length 120
02:54:43.134904 IP 192.168.43.147.8880 > 192.168.43.124.7773: UDP, length 120
02:54:43.154624 IP 192.168.43.146.8880 > 192.168.43.147.7772: UDP, length 120
02:54:43.184906 IP 192.168.43.147.8880 > 192.168.43.124.7773: UDP, length 120
02:54:43.192336 IP 192.168.43.146.8880 > 192.168.43.147.7772: UDP, length 120
02:54:43.234913 IP 192.168.43.147.8880 > 192.168.43.124.7773: UDP, length 120
02:54:43.267426 IP 192.168.43.146.8880 > 192.168.43.147.7772: UDP, length 120
02:54:43.284895 IP 192.168.43.147.8880 > 192.168.43.124.7773: UDP, length 120
02:54:43.301695 IP 192.168.43.146.8880 > 192.168.43.147.7772: UDP, length 120
02:54:43.334897 IP 192.168.43.147.8880 > 192.168.43.124.7773: UDP, length 120
02:54:43.381543 IP 192.168.43.146.8880 > 192.168.43.147.7772: UDP, length 120
02:54:43.384896 IP 192.168.43.147.8880 > 192.168.43.124.7773: UDP, length 120
02:54:43.434896 IP 192.168.43.147.8880 > 192.168.43.124.7773: UDP, length 120
02:54:43.484895 IP 192.168.43.147.8880 > 192.168.43.124.7773: UDP, length 120
02:54:43.485106 IP 192.168.43.146.8880 > 192.168.43.147.7772: UDP, length 120
02:54:43.485262 IP 192.168.43.146.8880 > 192.168.43.147.7772: UDP, length 120
02:54:43.502281 IP 192.168.43.146.8880 > 192.168.43.147.7772: UDP, length 120
02:54:43.534898 IP 192.168.43.147.8880 > 192.168.43.124.7773: UDP, length 120
02:54:43.575316 IP 192.168.43.146.8880 > 192.168.43.147.7772: UDP, length 120
02:54:43.584896 IP 192.168.43.147.8880 > 192.168.43.124.7773: UDP, length 120
02:54:43.592104 IP 192.168.43.146.8880 > 192.168.43.147.7772: UDP, length 120
02:54:43.634896 IP 192.168.43.147.8880 > 192.168.43.124.7773: UDP, length 120
02:54:43.684895 IP 192.168.43.147.8880 > 192.168.43.124.7773: UDP, length 120
02:54:43.688138 IP 192.168.43.146.8880 > 192.168.43.147.7772: UDP, length 120
02:54:43.692634 IP 192.168.43.146.8880 > 192.168.43.147.7772: UDP, length 120
02:54:43.734896 IP 192.168.43.147.8880 > 192.168.43.124.7773: UDP, length 120
02:54:43.750155 IP 192.168.43.146.8880 > 192.168.43.147.7772: UDP, length 120
02:54:43.784895 IP 192.168.43.147.8880 > 192.168.43.124.7773: UDP, length 120
02:54:43.791492 IP 192.168.43.146.8880 > 192.168.43.147.7772: UDP, length 120
02:54:43.834895 IP 192.168.43.147.8880 > 192.168.43.124.7773: UDP, length 120
02:54:43.853190 IP 192.168.43.146.8880 > 192.168.43.147.7772: UDP, length 120
02:54:43.884899 IP 192.168.43.147.8880 > 192.168.43.124.7773: UDP, length 120
02:54:43.891666 IP 192.168.43.146.8880 > 192.168.43.147.7772: UDP, length 120
02:54:43.934897 IP 192.168.43.147.8880 > 192.168.43.124.7773: UDP, length 120
02:54:43.946129 IP 192.168.43.146.8880 > 192.168.43.147.7772: UDP, length 120
02:54:43.984896 IP 192.168.43.147.8880 > 192.168.43.124.7773: UDP, length 120
02:54:43.991894 IP 192.168.43.146.8880 > 192.168.43.147.7772: UDP, length 120
02:54:44.034901 IP 192.168.43.147.8880 > 192.168.43.124.7773: UDP, length 120
02:54:44.046113 IP 192.168.43.146.8880 > 192.168.43.147.7772: UDP, length 120
02:54:44.084897 IP 192.168.43.147.8880 > 192.168.43.124.7773: UDP, length 120
02:54:44.095895 IP 192.168.43.146.8880 > 192.168.43.147.7772: UDP, length 120
02:54:44.134933 IP 192.168.43.147.8880 > 192.168.43.124.7773: UDP, length 120
02:54:44.150145 IP 192.168.43.146.8880 > 192.168.43.147.7772: UDP, length 120
02:54:44.184913 IP 192.168.43.147.8880 > 192.168.43.124.7773: UDP, length 120
02:54:44.197512 IP 192.168.43.146.8880 > 192.168.43.147.7772: UDP, length 120
02:54:44.234906 IP 192.168.43.147.8880 > 192.168.43.124.7773: UDP, length 120
02:54:44.265936 IP 192.168.43.146.8880 > 192.168.43.147.7772: UDP, length 120
02:54:44.284906 IP 192.168.43.147.8880 > 192.168.43.124.7773: UDP, length 120
02:54:44.298754 IP 192.168.43.146.8880 > 192.168.43.147.7772: UDP, length 120
02:54:44.334903 IP 192.168.43.147.8880 > 192.168.43.124.7773: UDP, length 120
02:54:44.343800 IP 192.168.43.146.8880 > 192.168.43.147.7772: UDP, length 120
02:54:44.384901 IP 192.168.43.147.8880 > 192.168.43.124.7773: UDP, length 120
02:54:44.400368 IP 192.168.43.146.8880 > 192.168.43.147.7772: UDP, length 120
02:54:44.434895 IP 192.168.43.147.8880 > 192.168.43.124.7773: UDP, length 120
02:54:44.447100 IP 192.168.43.146.8880 > 192.168.43.147.7772: UDP, length 120
02:54:44.484897 IP 192.168.43.147.8880 > 192.168.43.124.7773: UDP, length 120
02:54:44.493122 IP 192.168.43.146.8880 > 192.168.43.147.7772: UDP, length 120
02:54:44.534896 IP 192.168.43.147.8880 > 192.168.43.124.7773: UDP, length 120
02:54:44.584897 IP 192.168.43.147.8880 > 192.168.43.124.7773: UDP, length 120
02:54:44.606656 IP 192.168.43.146.8880 > 192.168.43.147.7772: UDP, length 120
02:54:44.606809 IP 192.168.43.146.8880 > 192.168.43.147.7772: UDP, length 120
02:54:44.634898 IP 192.168.43.147.8880 > 192.168.43.124.7773: UDP, length 120
02:54:44.640854 IP 192.168.43.146.8880 > 192.168.43.147.7772: UDP, length 120
02:54:44.684897 IP 192.168.43.147.8880 > 192.168.43.124.7773: UDP, length 120
02:54:44.711301 IP 192.168.43.146.8880 > 192.168.43.147.7772: UDP, length 120
02:54:44.734902 IP 192.168.43.147.8880 > 192.168.43.124.7773: UDP, length 120
02:54:44.784902 IP 192.168.43.147.8880 > 192.168.43.124.7773: UDP, length 120
02:54:44.815291 IP 192.168.43.146.8880 > 192.168.43.147.7772: UDP, length 120
02:54:44.815444 IP 192.168.43.146.8880 > 192.168.43.147.7772: UDP, length 120
02:54:44.834903 IP 192.168.43.147.8880 > 192.168.43.124.7773: UDP, length 120
02:54:44.851193 IP 192.168.43.146.8880 > 192.168.43.147.7772: UDP, length 120
02:54:44.884902 IP 192.168.43.147.8880 > 192.168.43.124.7773: UDP, length 120
02:54:44.917757 IP 192.168.43.146.8880 > 192.168.43.147.7772: UDP, length 120
02:54:44.934897 IP 192.168.43.147.8880 > 192.168.43.124.7773: UDP, length 120
02:54:44.957072 IP 192.168.43.146.8880 > 192.168.43.147.7772: UDP, length 120
02:54:44.984897 IP 192.168.43.147.8880 > 192.168.43.124.7773: UDP, length 120
02:54:45.018683 IP 192.168.43.146.8880 > 192.168.43.147.7772: UDP, length 120
02:54:45.034895 IP 192.168.43.147.8880 > 192.168.43.124.7773: UDP, length 120
02:54:45.052178 IP 192.168.43.146.8880 > 192.168.43.147.7772: UDP, length 120
02:54:45.084897 IP 192.168.43.147.8880 > 192.168.43.124.7773: UDP, length 120
02:54:45.120941 IP 192.168.43.146.8880 > 192.168.43.147.7772: UDP, length 120
02:54:45.134895 IP 192.168.43.147.8880 > 192.168.43.124.7773: UDP, length 120
02:54:45.144831 IP 192.168.43.146.8880 > 192.168.43.147.7772: UDP, length 120
02:54:45.184902 IP 192.168.43.147.8880 > 192.168.43.124.7773: UDP, length 120
02:54:45.212966 IP 192.168.43.146.8880 > 192.168.43.147.7772: UDP, length 120
02:54:45.234905 IP 192.168.43.147.8880 > 192.168.43.124.7773: UDP, length 120
02:54:45.256448 IP 192.168.43.146.8880 > 192.168.43.147.7772: UDP, length 120
02:54:45.284907 IP 192.168.43.147.8880 > 192.168.43.124.7773: UDP, length 120
02:54:45.315483 IP 192.168.43.146.8880 > 192.168.43.147.7772: UDP, length 120
02:54:45.334900 IP 192.168.43.147.8880 > 192.168.43.124.7773: UDP, length 120
02:54:45.348980 IP 192.168.43.146.8880 > 192.168.43.147.7772: UDP, length 120
02:54:45.384897 IP 192.168.43.147.8880 > 192.168.43.124.7773: UDP, length 120
02:54:45.407311 IP 192.168.43.146.8880 > 192.168.43.147.7772: UDP, length 120
02:54:45.434896 IP 192.168.43.147.8880 > 192.168.43.124.7773: UDP, length 120
02:54:45.454436 IP 192.168.43.146.8880 > 192.168.43.147.7772: UDP, length 120
02:54:45.484896 IP 192.168.43.147.8880 > 192.168.43.124.7773: UDP, length 120
02:54:45.491792 IP 192.168.43.146.8880 > 192.168.43.147.7772: UDP, length 120
02:54:45.534897 IP 192.168.43.147.8880 > 192.168.43.124.7773: UDP, length 120
02:54:45.542551 IP 192.168.43.146.8880 > 192.168.43.147.7772: UDP, length 120
02:54:45.584897 IP 192.168.43.147.8880 > 192.168.43.124.7773: UDP, length 120
02:54:45.633133 IP 192.168.43.146.8880 > 192.168.43.147.7772: UDP, length 120
02:54:45.634933 IP 192.168.43.147.8880 > 192.168.43.124.7773: UDP, length 120
02:54:45.652527 IP 192.168.43.146.8880 > 192.168.43.147.7772: UDP, length 120
02:54:45.684901 IP 192.168.43.147.8880 > 192.168.43.124.7773: UDP, length 120
02:54:45.724990 IP 192.168.43.146.8880 > 192.168.43.147.7772: UDP, length 120
02:54:45.734895 IP 192.168.43.147.8880 > 192.168.43.124.7773: UDP, length 120
02:54:45.753883 IP 192.168.43.146.8880 > 192.168.43.147.7772: UDP, length 120
02:54:45.784904 IP 192.168.43.147.8880 > 192.168.43.124.7773: UDP, length 120
02:54:45.790927 IP 192.168.43.146.8880 > 192.168.43.147.7772: UDP, length 120
02:54:45.834897 IP 192.168.43.147.8880 > 192.168.43.124.7773: UDP, length 120
02:54:45.840794 IP 192.168.43.146.8880 > 192.168.43.147.7772: UDP, length 120
02:54:45.884902 IP 192.168.43.147.8880 > 192.168.43.124.7773: UDP, length 120
02:54:45.890199 IP 192.168.43.146.8880 > 192.168.43.147.7772: UDP, length 120
02:54:45.934905 IP 192.168.43.147.8880 > 192.168.43.124.7773: UDP, length 120
02:54:45.945161 IP 192.168.43.146.8880 > 192.168.43.147.7772: UDP, length 120
02:54:45.984899 IP 192.168.43.147.8880 > 192.168.43.124.7773: UDP, length 120
02:54:45.996798 IP 192.168.43.146.8880 > 192.168.43.147.7772: UDP, length 120
02:54:46.034920 IP 192.168.43.147.8880 > 192.168.43.124.7773: UDP, length 120
02:54:46.044520 IP 192.168.43.146.8880 > 192.168.43.147.7772: UDP, length 120
02:54:46.084911 IP 192.168.43.147.8880 > 192.168.43.124.7773: UDP, length 120
02:54:46.093127 IP 192.168.43.146.8880 > 192.168.43.147.7772: UDP, length 120
02:54:46.134896 IP 192.168.43.147.8880 > 192.168.43.124.7773: UDP, length 120
02:54:46.145325 IP 192.168.43.146.8880 > 192.168.43.147.7772: UDP, length 120
02:54:46.184898 IP 192.168.43.147.8880 > 192.168.43.124.7773: UDP, length 120
02:54:46.193898 IP 192.168.43.146.8880 > 192.168.43.147.7772: UDP, length 120
02:54:46.234901 IP 192.168.43.147.8880 > 192.168.43.124.7773: UDP, length 120
