23:10:56.542709 IP 192.168.43.124.8880 > 192.168.43.195.7771: UDP, length 120
23:10:56.592855 IP 192.168.43.124.8880 > 192.168.43.195.7771: UDP, length 120
23:10:56.642854 IP 192.168.43.124.8880 > 192.168.43.195.7771: UDP, length 120
23:10:56.692855 IP 192.168.43.124.8880 > 192.168.43.195.7771: UDP, length 120
23:10:56.742855 IP 192.168.43.124.8880 > 192.168.43.195.7771: UDP, length 120
23:10:56.792851 IP 192.168.43.124.8880 > 192.168.43.195.7771: UDP, length 120
23:10:56.842854 IP 192.168.43.124.8880 > 192.168.43.195.7771: UDP, length 120
23:10:56.892854 IP 192.168.43.124.8880 > 192.168.43.195.7771: UDP, length 120
23:10:56.942853 IP 192.168.43.124.8880 > 192.168.43.195.7771: UDP, length 120
23:10:56.992854 IP 192.168.43.124.8880 > 192.168.43.195.7771: UDP, length 120
23:10:57.042853 IP 192.168.43.124.8880 > 192.168.43.195.7771: UDP, length 120
23:10:57.092853 IP 192.168.43.124.8880 > 192.168.43.195.7771: UDP, length 120
23:10:57.142855 IP 192.168.43.124.8880 > 192.168.43.195.7771: UDP, length 120
23:10:57.192855 IP 192.168.43.124.8880 > 192.168.43.195.7771: UDP, length 120
23:10:57.242852 IP 192.168.43.124.8880 > 192.168.43.195.7771: UDP, length 120
23:10:57.292854 IP 192.168.43.124.8880 > 192.168.43.195.7771: UDP, length 120
23:10:57.342856 IP 192.168.43.124.8880 > 192.168.43.195.7771: UDP, length 120
23:10:57.392857 IP 192.168.43.124.8880 > 192.168.43.195.7771: UDP, length 120
23:10:57.442858 IP 192.168.43.124.8880 > 192.168.43.195.7771: UDP, length 120
23:10:57.492857 IP 192.168.43.124.8880 > 192.168.43.195.7771: UDP, length 120
23:10:57.542856 IP 192.168.43.124.8880 > 192.168.43.195.7771: UDP, length 120
23:10:57.592857 IP 192.168.43.124.8880 > 192.168.43.195.7771: UDP, length 120
23:10:57.642857 IP 192.168.43.124.8880 > 192.168.43.195.7771: UDP, length 120
23:10:57.692855 IP 192.168.43.124.8880 > 192.168.43.195.7771: UDP, length 120
23:10:57.742857 IP 192.168.43.124.8880 > 192.168.43.195.7771: UDP, length 120
23:10:57.792854 IP 192.168.43.124.8880 > 192.168.43.195.7771: UDP, length 120
23:10:57.842857 IP 192.168.43.124.8880 > 192.168.43.195.7771: UDP, length 120
23:10:57.892855 IP 192.168.43.124.8880 > 192.168.43.195.7771: UDP, length 120
23:10:57.942855 IP 192.168.43.124.8880 > 192.168.43.195.7771: UDP, length 120
23:10:57.992857 IP 192.168.43.124.8880 > 192.168.43.195.7771: UDP, length 120
23:10:58.043491 IP 192.168.43.124.8880 > 192.168.43.195.7771: UDP, length 120
23:10:58.092856 IP 192.168.43.124.8880 > 192.168.43.195.7771: UDP, length 120
23:10:58.142855 IP 192.168.43.124.8880 > 192.168.43.195.7771: UDP, length 120
23:10:58.192855 IP 192.168.43.124.8880 > 192.168.43.195.7771: UDP, length 120
23:10:58.242902 IP 192.168.43.124.8880 > 192.168.43.195.7771: UDP, length 120
23:10:58.292901 IP 192.168.43.124.8880 > 192.168.43.195.7771: UDP, length 120
23:10:58.342904 IP 192.168.43.124.8880 > 192.168.43.195.7771: UDP, length 120
23:10:58.392904 IP 192.168.43.124.8880 > 192.168.43.195.7771: UDP, length 120
23:10:58.442904 IP 192.168.43.124.8880 > 192.168.43.195.7771: UDP, length 120
23:10:58.492905 IP 192.168.43.124.8880 > 192.168.43.195.7771: UDP, length 120
23:10:58.542903 IP 192.168.43.124.8880 > 192.168.43.195.7771: UDP, length 120
23:10:58.592902 IP 192.168.43.124.8880 > 192.168.43.195.7771: UDP, length 120
23:10:58.642904 IP 192.168.43.124.8880 > 192.168.43.195.7771: UDP, length 120
23:10:58.692904 IP 192.168.43.124.8880 > 192.168.43.195.7771: UDP, length 120
23:10:58.742903 IP 192.168.43.124.8880 > 192.168.43.195.7771: UDP, length 120
23:10:58.792904 IP 192.168.43.124.8880 > 192.168.43.195.7771: UDP, length 120
23:10:58.842905 IP 192.168.43.124.8880 > 192.168.43.195.7771: UDP, length 120
23:10:58.892904 IP 192.168.43.124.8880 > 192.168.43.195.7771: UDP, length 120
23:10:58.942903 IP 192.168.43.124.8880 > 192.168.43.195.7771: UDP, length 120
23:10:58.992903 IP 192.168.43.124.8880 > 192.168.43.195.7771: UDP, length 120
23:10:59.042904 IP 192.168.43.124.8880 > 192.168.43.195.7771: UDP, length 120
23:10:59.092903 IP 192.168.43.124.8880 > 192.168.43.195.7771: UDP, length 120
23:10:59.142853 IP 192.168.43.124.8880 > 192.168.43.195.7771: UDP, length 120
23:10:59.192853 IP 192.168.43.124.8880 > 192.168.43.195.7771: UDP, length 120
23:10:59.242904 IP 192.168.43.124.8880 > 192.168.43.195.7771: UDP, length 120
23:10:59.292857 IP 192.168.43.124.8880 > 192.168.43.195.7771: UDP, length 120
23:10:59.342809 IP 192.168.43.124.8880 > 192.168.43.195.7771: UDP, length 120
23:10:59.392904 IP 192.168.43.124.8880 > 192.168.43.195.7771: UDP, length 120
23:10:59.442901 IP 192.168.43.124.8880 > 192.168.43.195.7771: UDP, length 120
23:10:59.492903 IP 192.168.43.124.8880 > 192.168.43.195.7771: UDP, length 120
23:10:59.542906 IP 192.168.43.124.8880 > 192.168.43.195.7771: UDP, length 120
23:10:59.592906 IP 192.168.43.124.8880 > 192.168.43.195.7771: UDP, length 120
23:10:59.642903 IP 192.168.43.124.8880 > 192.168.43.195.7771: UDP, length 120
23:10:59.692905 IP 192.168.43.124.8880 > 192.168.43.195.7771: UDP, length 120
23:10:59.742904 IP 192.168.43.124.8880 > 192.168.43.195.7771: UDP, length 120
23:10:59.792904 IP 192.168.43.124.8880 > 192.168.43.195.7771: UDP, length 120
23:10:59.842905 IP 192.168.43.124.8880 > 192.168.43.195.7771: UDP, length 120
23:10:59.892897 IP 192.168.43.124.8880 > 192.168.43.195.7771: UDP, length 120
23:10:59.942903 IP 192.168.43.124.8880 > 192.168.43.195.7771: UDP, length 120
23:10:59.992903 IP 192.168.43.124.8880 > 192.168.43.195.7771: UDP, length 120
23:11:00.042904 IP 192.168.43.124.8880 > 192.168.43.195.7771: UDP, length 120
23:11:00.092789 IP 192.168.43.124.8880 > 192.168.43.195.7771: UDP, length 120
23:11:00.142790 IP 192.168.43.124.8880 > 192.168.43.195.7771: UDP, length 120
23:11:00.192853 IP 192.168.43.124.8880 > 192.168.43.195.7771: UDP, length 120
23:11:00.242853 IP 192.168.43.124.8880 > 192.168.43.195.7771: UDP, length 120
23:11:00.292852 IP 192.168.43.124.8880 > 192.168.43.195.7771: UDP, length 120
23:11:00.342854 IP 192.168.43.124.8880 > 192.168.43.195.7771: UDP, length 120
23:11:00.392852 IP 192.168.43.124.8880 > 192.168.43.195.7771: UDP, length 120
23:11:00.442856 IP 192.168.43.124.8880 > 192.168.43.195.7771: UDP, length 120
23:11:00.492854 IP 192.168.43.124.8880 > 192.168.43.195.7771: UDP, length 120
23:11:00.542854 IP 192.168.43.124.8880 > 192.168.43.195.7771: UDP, length 120
23:11:00.592851 IP 192.168.43.124.8880 > 192.168.43.195.7771: UDP, length 120
23:11:00.642854 IP 192.168.43.124.8880 > 192.168.43.195.7771: UDP, length 120
23:11:00.692854 IP 192.168.43.124.8880 > 192.168.43.195.7771: UDP, length 120
23:11:00.742854 IP 192.168.43.124.8880 > 192.168.43.195.7771: UDP, length 120
23:11:00.792853 IP 192.168.43.124.8880 > 192.168.43.195.7771: UDP, length 120
23:11:00.842854 IP 192.168.43.124.8880 > 192.168.43.195.7771: UDP, length 120
23:11:00.892852 IP 192.168.43.124.8880 > 192.168.43.195.7771: UDP, length 120
23:11:00.942854 IP 192.168.43.124.8880 > 192.168.43.195.7771: UDP, length 120
23:11:00.992853 IP 192.168.43.124.8880 > 192.168.43.195.7771: UDP, length 120
23:11:01.042854 IP 192.168.43.124.8880 > 192.168.43.195.7771: UDP, length 120
23:11:01.092819 IP 192.168.43.124.8880 > 192.168.43.195.7771: UDP, length 120
23:11:01.142841 IP 192.168.43.124.8880 > 192.168.43.195.7771: UDP, length 120
23:11:01.192853 IP 192.168.43.124.8880 > 192.168.43.195.7771: UDP, length 120
23:11:01.242906 IP 192.168.43.124.8880 > 192.168.43.195.7771: UDP, length 120
23:11:01.292903 IP 192.168.43.124.8880 > 192.168.43.195.7771: UDP, length 120
23:11:01.342854 IP 192.168.43.124.8880 > 192.168.43.195.7771: UDP, length 120
23:11:01.392904 IP 192.168.43.124.8880 > 192.168.43.195.7771: UDP, length 120
23:11:01.442904 IP 192.168.43.124.8880 > 192.168.43.195.7771: UDP, length 120
23:11:01.492904 IP 192.168.43.124.8880 > 192.168.43.195.7771: UDP, length 120
23:11:01.542904 IP 192.168.43.124.8880 > 192.168.43.195.7771: UDP, length 120
23:11:01.592904 IP 192.168.43.124.8880 > 192.168.43.195.7771: UDP, length 120
23:11:01.642905 IP 192.168.43.124.8880 > 192.168.43.195.7771: UDP, length 120
23:11:01.692903 IP 192.168.43.124.8880 > 192.168.43.195.7771: UDP, length 120
23:11:01.742904 IP 192.168.43.124.8880 > 192.168.43.195.7771: UDP, length 120
23:11:01.792897 IP 192.168.43.124.8880 > 192.168.43.195.7771: UDP, length 120
23:11:01.842905 IP 192.168.43.124.8880 > 192.168.43.195.7771: UDP, length 120
23:11:01.892902 IP 192.168.43.124.8880 > 192.168.43.195.7771: UDP, length 120
23:11:01.942854 IP 192.168.43.124.8880 > 192.168.43.195.7771: UDP, length 120
23:11:01.992903 IP 192.168.43.124.8880 > 192.168.43.195.7771: UDP, length 120
23:11:02.042905 IP 192.168.43.124.8880 > 192.168.43.195.7771: UDP, length 120
23:11:02.092905 IP 192.168.43.124.8880 > 192.168.43.195.7771: UDP, length 120
23:11:02.142858 IP 192.168.43.124.8880 > 192.168.43.195.7771: UDP, length 120
23:11:02.192858 IP 192.168.43.124.8880 > 192.168.43.195.7771: UDP, length 120
23:11:02.242852 IP 192.168.43.124.8880 > 192.168.43.195.7771: UDP, length 120
23:11:02.292854 IP 192.168.43.124.8880 > 192.168.43.195.7771: UDP, length 120
23:11:02.342818 IP 192.168.43.124.8880 > 192.168.43.195.7771: UDP, length 120
23:11:02.392852 IP 192.168.43.124.8880 > 192.168.43.195.7771: UDP, length 120
23:11:02.442853 IP 192.168.43.124.8880 > 192.168.43.195.7771: UDP, length 120
23:11:02.492852 IP 192.168.43.124.8880 > 192.168.43.195.7771: UDP, length 120
23:11:02.542853 IP 192.168.43.124.8880 > 192.168.43.195.7771: UDP, length 120
23:11:02.592855 IP 192.168.43.124.8880 > 192.168.43.195.7771: UDP, length 120
23:11:02.642853 IP 192.168.43.124.8880 > 192.168.43.195.7771: UDP, length 120
23:11:02.692854 IP 192.168.43.124.8880 > 192.168.43.195.7771: UDP, length 120
23:11:02.742816 IP 192.168.43.124.8880 > 192.168.43.195.7771: UDP, length 120
23:11:02.792853 IP 192.168.43.124.8880 > 192.168.43.195.7771: UDP, length 120
23:11:02.842805 IP 192.168.43.124.8880 > 192.168.43.195.7771: UDP, length 120
23:11:02.892854 IP 192.168.43.124.8880 > 192.168.43.195.7771: UDP, length 120
23:11:02.942818 IP 192.168.43.124.8880 > 192.168.43.195.7771: UDP, length 120
23:11:02.992853 IP 192.168.43.124.8880 > 192.168.43.195.7771: UDP, length 120
23:11:03.042808 IP 192.168.43.124.8880 > 192.168.43.195.7771: UDP, length 120
23:11:03.092855 IP 192.168.43.124.8880 > 192.168.43.195.7771: UDP, length 120
23:11:03.142800 IP 192.168.43.124.8880 > 192.168.43.195.7771: UDP, length 120
23:11:03.192856 IP 192.168.43.124.8880 > 192.168.43.195.7771: UDP, length 120
23:11:03.242831 IP 192.168.43.124.8880 > 192.168.43.195.7771: UDP, length 120
23:11:03.292855 IP 192.168.43.124.8880 > 192.168.43.195.7771: UDP, length 120
23:11:03.342802 IP 192.168.43.124.8880 > 192.168.43.195.7771: UDP, length 120
23:11:03.392903 IP 192.168.43.124.8880 > 192.168.43.195.7771: UDP, length 120
23:11:03.442911 IP 192.168.43.124.8880 > 192.168.43.195.7771: UDP, length 120
23:11:03.492905 IP 192.168.43.124.8880 > 192.168.43.195.7771: UDP, length 120
23:11:03.542904 IP 192.168.43.124.8880 > 192.168.43.195.7771: UDP, length 120
23:11:03.592905 IP 192.168.43.124.8880 > 192.168.43.195.7771: UDP, length 120
23:11:03.642905 IP 192.168.43.124.8880 > 192.168.43.195.7771: UDP, length 120
23:11:03.692904 IP 192.168.43.124.8880 > 192.168.43.195.7771: UDP, length 120
23:11:03.742904 IP 192.168.43.124.8880 > 192.168.43.195.7771: UDP, length 120
23:11:03.792905 IP 192.168.43.124.8880 > 192.168.43.195.7771: UDP, length 120
23:11:03.842903 IP 192.168.43.124.8880 > 192.168.43.195.7771: UDP, length 120
23:11:03.892896 IP 192.168.43.124.8880 > 192.168.43.195.7771: UDP, length 120
23:11:03.942904 IP 192.168.43.124.8880 > 192.168.43.195.7771: UDP, length 120
23:11:03.992905 IP 192.168.43.124.8880 > 192.168.43.195.7771: UDP, length 120
23:11:04.042904 IP 192.168.43.124.8880 > 192.168.43.195.7771: UDP, length 120
23:11:04.092904 IP 192.168.43.124.8880 > 192.168.43.195.7771: UDP, length 120
23:11:04.142858 IP 192.168.43.124.8880 > 192.168.43.195.7771: UDP, length 120
23:11:04.192856 IP 192.168.43.124.8880 > 192.168.43.195.7771: UDP, length 120
23:11:04.243476 IP 192.168.43.124.8880 > 192.168.43.195.7771: UDP, length 120
23:11:04.292903 IP 192.168.43.124.8880 > 192.168.43.195.7771: UDP, length 120
23:11:04.343105 IP 192.168.43.124.8880 > 192.168.43.195.7771: UDP, length 120
23:11:04.393034 IP 192.168.43.124.8880 > 192.168.43.195.7771: UDP, length 120
23:11:04.442941 IP 192.168.43.124.8880 > 192.168.43.195.7771: UDP, length 120
23:11:04.492949 IP 192.168.43.124.8880 > 192.168.43.195.7771: UDP, length 120
23:11:04.543056 IP 192.168.43.124.8880 > 192.168.43.195.7771: UDP, length 120
23:11:04.592858 IP 192.168.43.124.8880 > 192.168.43.195.7771: UDP, length 120
23:11:04.642858 IP 192.168.43.124.8880 > 192.168.43.195.7771: UDP, length 120
23:11:04.692856 IP 192.168.43.124.8880 > 192.168.43.195.7771: UDP, length 120
23:11:04.742857 IP 192.168.43.124.8880 > 192.168.43.195.7771: UDP, length 120
23:11:04.792857 IP 192.168.43.124.8880 > 192.168.43.195.7771: UDP, length 120
23:11:04.842859 IP 192.168.43.124.8880 > 192.168.43.195.7771: UDP, length 120
23:11:04.892860 IP 192.168.43.124.8880 > 192.168.43.195.7771: UDP, length 120
23:11:04.942859 IP 192.168.43.124.8880 > 192.168.43.195.7771: UDP, length 120
23:11:04.992859 IP 192.168.43.124.8880 > 192.168.43.195.7771: UDP, length 120
23:11:05.042860 IP 192.168.43.124.8880 > 192.168.43.195.7771: UDP, length 120
23:11:05.092859 IP 192.168.43.124.8880 > 192.168.43.195.7771: UDP, length 120
23:11:05.142790 IP 192.168.43.124.8880 > 192.168.43.195.7771: UDP, length 120
23:11:05.192788 IP 192.168.43.124.8880 > 192.168.43.195.7771: UDP, length 120
23:11:05.242781 IP 192.168.43.124.8880 > 192.168.43.195.7771: UDP, length 120
23:11:05.292852 IP 192.168.43.124.8880 > 192.168.43.195.7771: UDP, length 120
23:11:05.342811 IP 192.168.43.124.8880 > 192.168.43.195.7771: UDP, length 120
23:11:05.392854 IP 192.168.43.124.8880 > 192.168.43.195.7771: UDP, length 120
23:11:05.442856 IP 192.168.43.124.8880 > 192.168.43.195.7771: UDP, length 120
23:11:05.492854 IP 192.168.43.124.8880 > 192.168.43.195.7771: UDP, length 120
23:11:05.542852 IP 192.168.43.124.8880 > 192.168.43.195.7771: UDP, length 120
23:11:05.592858 IP 192.168.43.124.8880 > 192.168.43.195.7771: UDP, length 120
23:11:05.642854 IP 192.168.43.124.8880 > 192.168.43.195.7771: UDP, length 120
23:11:05.692854 IP 192.168.43.124.8880 > 192.168.43.195.7771: UDP, length 120
23:11:05.742904 IP 192.168.43.124.8880 > 192.168.43.195.7771: UDP, length 120
23:11:05.792905 IP 192.168.43.124.8880 > 192.168.43.195.7771: UDP, length 120
23:11:05.842905 IP 192.168.43.124.8880 > 192.168.43.195.7771: UDP, length 120
23:11:05.892906 IP 192.168.43.124.8880 > 192.168.43.195.7771: UDP, length 120
23:11:05.942906 IP 192.168.43.124.8880 > 192.168.43.195.7771: UDP, length 120
23:11:05.992907 IP 192.168.43.124.8880 > 192.168.43.195.7771: UDP, length 120
23:11:06.042904 IP 192.168.43.124.8880 > 192.168.43.195.7771: UDP, length 120
23:11:06.092906 IP 192.168.43.124.8880 > 192.168.43.195.7771: UDP, length 120
23:11:06.142802 IP 192.168.43.124.8880 > 192.168.43.195.7771: UDP, length 120
23:11:06.192855 IP 192.168.43.124.8880 > 192.168.43.195.7771: UDP, length 120
23:11:06.242905 IP 192.168.43.124.8880 > 192.168.43.195.7771: UDP, length 120
23:11:06.292903 IP 192.168.43.124.8880 > 192.168.43.195.7771: UDP, length 120
23:11:06.342904 IP 192.168.43.124.8880 > 192.168.43.195.7771: UDP, length 120
23:11:06.392908 IP 192.168.43.124.8880 > 192.168.43.195.7771: UDP, length 120
23:11:06.442905 IP 192.168.43.124.8880 > 192.168.43.195.7771: UDP, length 120
23:11:06.492905 IP 192.168.43.124.8880 > 192.168.43.195.7771: UDP, length 120
23:11:06.543084 IP 192.168.43.124.8880 > 192.168.43.195.7771: UDP, length 120
23:11:06.592902 IP 192.168.43.124.8880 > 192.168.43.195.7771: UDP, length 120
23:11:06.642904 IP 192.168.43.124.8880 > 192.168.43.195.7771: UDP, length 120
23:11:06.692904 IP 192.168.43.124.8880 > 192.168.43.195.7771: UDP, length 120
23:11:06.742906 IP 192.168.43.124.8880 > 192.168.43.195.7771: UDP, length 120
23:11:06.792902 IP 192.168.43.124.8880 > 192.168.43.195.7771: UDP, length 120
23:11:06.842904 IP 192.168.43.124.8880 > 192.168.43.195.7771: UDP, length 120
23:11:06.892906 IP 192.168.43.124.8880 > 192.168.43.195.7771: UDP, length 120
23:11:06.942905 IP 192.168.43.124.8880 > 192.168.43.195.7771: UDP, length 120
23:11:06.992909 IP 192.168.43.124.8880 > 192.168.43.195.7771: UDP, length 120
23:11:07.042905 IP 192.168.43.124.8880 > 192.168.43.195.7771: UDP, length 120
23:11:07.092907 IP 192.168.43.124.8880 > 192.168.43.195.7771: UDP, length 120
23:11:07.142861 IP 192.168.43.124.8880 > 192.168.43.195.7771: UDP, length 120
23:11:07.192856 IP 192.168.43.124.8880 > 192.168.43.195.7771: UDP, length 120
23:11:07.242908 IP 192.168.43.124.8880 > 192.168.43.195.7771: UDP, length 120
23:11:07.292905 IP 192.168.43.124.8880 > 192.168.43.195.7771: UDP, length 120
23:11:07.342905 IP 192.168.43.124.8880 > 192.168.43.195.7771: UDP, length 120
23:11:07.392903 IP 192.168.43.124.8880 > 192.168.43.195.7771: UDP, length 120
23:11:07.442904 IP 192.168.43.124.8880 > 192.168.43.195.7771: UDP, length 120
23:11:07.492906 IP 192.168.43.124.8880 > 192.168.43.195.7771: UDP, length 120
23:11:07.542904 IP 192.168.43.124.8880 > 192.168.43.195.7771: UDP, length 120
23:11:07.592907 IP 192.168.43.124.8880 > 192.168.43.195.7771: UDP, length 120
23:11:07.642905 IP 192.168.43.124.8880 > 192.168.43.195.7771: UDP, length 120
23:11:07.692905 IP 192.168.43.124.8880 > 192.168.43.195.7771: UDP, length 120
23:11:07.742906 IP 192.168.43.124.8880 > 192.168.43.195.7771: UDP, length 120
23:11:07.792907 IP 192.168.43.124.8880 > 192.168.43.195.7771: UDP, length 120
23:11:07.842904 IP 192.168.43.124.8880 > 192.168.43.195.7771: UDP, length 120
23:11:07.892908 IP 192.168.43.124.8880 > 192.168.43.195.7771: UDP, length 120
23:11:07.942906 IP 192.168.43.124.8880 > 192.168.43.195.7771: UDP, length 120
23:11:07.992902 IP 192.168.43.124.8880 > 192.168.43.195.7771: UDP, length 120
23:11:08.042906 IP 192.168.43.124.8880 > 192.168.43.195.7771: UDP, length 120
23:11:08.092906 IP 192.168.43.124.8880 > 192.168.43.195.7771: UDP, length 120
23:11:08.142789 IP 192.168.43.124.8880 > 192.168.43.195.7771: UDP, length 120
23:11:08.192856 IP 192.168.43.124.8880 > 192.168.43.195.7771: UDP, length 120
23:11:08.242855 IP 192.168.43.124.8880 > 192.168.43.195.7771: UDP, length 120
23:11:08.292904 IP 192.168.43.124.8880 > 192.168.43.195.7771: UDP, length 120
23:11:08.342906 IP 192.168.43.124.8880 > 192.168.43.195.7771: UDP, length 120
23:11:08.392906 IP 192.168.43.124.8880 > 192.168.43.195.7771: UDP, length 120
23:11:08.442905 IP 192.168.43.124.8880 > 192.168.43.195.7771: UDP, length 120
23:11:08.492905 IP 192.168.43.124.8880 > 192.168.43.195.7771: UDP, length 120
23:11:08.542908 IP 192.168.43.124.8880 > 192.168.43.195.7771: UDP, length 120
23:11:08.592901 IP 192.168.43.124.8880 > 192.168.43.195.7771: UDP, length 120
23:11:08.642904 IP 192.168.43.124.8880 > 192.168.43.195.7771: UDP, length 120
23:11:08.693474 IP 192.168.43.124.8880 > 192.168.43.195.7771: UDP, length 120
23:11:08.742908 IP 192.168.43.124.8880 > 192.168.43.195.7771: UDP, length 120
23:11:08.792909 IP 192.168.43.124.8880 > 192.168.43.195.7771: UDP, length 120
23:11:08.842903 IP 192.168.43.124.8880 > 192.168.43.195.7771: UDP, length 120
23:11:08.892906 IP 192.168.43.124.8880 > 192.168.43.195.7771: UDP, length 120
23:11:08.942905 IP 192.168.43.124.8880 > 192.168.43.195.7771: UDP, length 120
23:11:08.992905 IP 192.168.43.124.8880 > 192.168.43.195.7771: UDP, length 120
23:11:09.042908 IP 192.168.43.124.8880 > 192.168.43.195.7771: UDP, length 120
23:11:09.092904 IP 192.168.43.124.8880 > 192.168.43.195.7771: UDP, length 120
23:11:09.142778 IP 192.168.43.124.8880 > 192.168.43.195.7771: UDP, length 120
23:11:09.192860 IP 192.168.43.124.8880 > 192.168.43.195.7771: UDP, length 120
23:11:09.242905 IP 192.168.43.124.8880 > 192.168.43.195.7771: UDP, length 120
23:11:09.292857 IP 192.168.43.124.8880 > 192.168.43.195.7771: UDP, length 120
23:11:09.342856 IP 192.168.43.124.8880 > 192.168.43.195.7771: UDP, length 120
23:11:09.392856 IP 192.168.43.124.8880 > 192.168.43.195.7771: UDP, length 120
23:11:09.442907 IP 192.168.43.124.8880 > 192.168.43.195.7771: UDP, length 120
23:11:09.492907 IP 192.168.43.124.8880 > 192.168.43.195.7771: UDP, length 120
23:11:09.542809 IP 192.168.43.124.8880 > 192.168.43.195.7771: UDP, length 120
23:11:09.592854 IP 192.168.43.124.8880 > 192.168.43.195.7771: UDP, length 120
23:11:09.642855 IP 192.168.43.124.8880 > 192.168.43.195.7771: UDP, length 120
23:11:09.692852 IP 192.168.43.124.8880 > 192.168.43.195.7771: UDP, length 120
23:11:09.742854 IP 192.168.43.124.8880 > 192.168.43.195.7771: UDP, length 120
23:11:09.792854 IP 192.168.43.124.8880 > 192.168.43.195.7771: UDP, length 120
23:11:09.842807 IP 192.168.43.124.8880 > 192.168.43.195.7771: UDP, length 120
23:11:09.892855 IP 192.168.43.124.8880 > 192.168.43.195.7771: UDP, length 120
23:11:09.942858 IP 192.168.43.124.8880 > 192.168.43.195.7771: UDP, length 120
23:11:09.992856 IP 192.168.43.124.8880 > 192.168.43.195.7771: UDP, length 120
23:11:10.042857 IP 192.168.43.124.8880 > 192.168.43.195.7771: UDP, length 120
23:11:10.092857 IP 192.168.43.124.8880 > 192.168.43.195.7771: UDP, length 120
23:11:10.142778 IP 192.168.43.124.8880 > 192.168.43.195.7771: UDP, length 120
23:11:10.192856 IP 192.168.43.124.8880 > 192.168.43.195.7771: UDP, length 120
23:11:10.242832 IP 192.168.43.124.8880 > 192.168.43.195.7771: UDP, length 120
23:11:10.292785 IP 192.168.43.124.8880 > 192.168.43.195.7771: UDP, length 120
23:11:10.342774 IP 192.168.43.124.8880 > 192.168.43.195.7771: UDP, length 120
23:11:10.392853 IP 192.168.43.124.8880 > 192.168.43.195.7771: UDP, length 120
23:11:10.442855 IP 192.168.43.124.8880 > 192.168.43.195.7771: UDP, length 120
23:11:10.492854 IP 192.168.43.124.8880 > 192.168.43.195.7771: UDP, length 120
23:11:10.542855 IP 192.168.43.124.8880 > 192.168.43.195.7771: UDP, length 120
23:11:10.592856 IP 192.168.43.124.8880 > 192.168.43.195.7771: UDP, length 120
23:11:10.642855 IP 192.168.43.124.8880 > 192.168.43.195.7771: UDP, length 120
23:11:10.692852 IP 192.168.43.124.8880 > 192.168.43.195.7771: UDP, length 120
23:11:10.742853 IP 192.168.43.124.8880 > 192.168.43.195.7771: UDP, length 120
23:11:10.792855 IP 192.168.43.124.8880 > 192.168.43.195.7771: UDP, length 120
23:11:10.842855 IP 192.168.43.124.8880 > 192.168.43.195.7771: UDP, length 120
23:11:10.892857 IP 192.168.43.124.8880 > 192.168.43.195.7771: UDP, length 120
23:11:10.942855 IP 192.168.43.124.8880 > 192.168.43.195.7771: UDP, length 120
23:11:10.992855 IP 192.168.43.124.8880 > 192.168.43.195.7771: UDP, length 120
23:11:11.042855 IP 192.168.43.124.8880 > 192.168.43.195.7771: UDP, length 120
23:11:11.092854 IP 192.168.43.124.8880 > 192.168.43.195.7771: UDP, length 120
23:11:11.142773 IP 192.168.43.124.8880 > 192.168.43.195.7771: UDP, length 120
23:11:11.192854 IP 192.168.43.124.8880 > 192.168.43.195.7771: UDP, length 120
23:11:11.242896 IP 192.168.43.124.8880 > 192.168.43.195.7771: UDP, length 120
23:11:11.292897 IP 192.168.43.124.8880 > 192.168.43.195.7771: UDP, length 120
23:11:11.342896 IP 192.168.43.124.8880 > 192.168.43.195.7771: UDP, length 120
23:11:11.392898 IP 192.168.43.124.8880 > 192.168.43.195.7771: UDP, length 120
23:11:11.442895 IP 192.168.43.124.8880 > 192.168.43.195.7771: UDP, length 120
23:11:11.492896 IP 192.168.43.124.8880 > 192.168.43.195.7771: UDP, length 120
23:11:11.542895 IP 192.168.43.124.8880 > 192.168.43.195.7771: UDP, length 120
23:11:11.592895 IP 192.168.43.124.8880 > 192.168.43.195.7771: UDP, length 120
23:11:11.642904 IP 192.168.43.124.8880 > 192.168.43.195.7771: UDP, length 120
23:11:11.692906 IP 192.168.43.124.8880 > 192.168.43.195.7771: UDP, length 120
23:11:11.742805 IP 192.168.43.124.8880 > 192.168.43.195.7771: UDP, length 120
23:11:11.792854 IP 192.168.43.124.8880 > 192.168.43.195.7771: UDP, length 120
23:11:11.842784 IP 192.168.43.124.8880 > 192.168.43.195.7771: UDP, length 120
23:11:11.892854 IP 192.168.43.124.8880 > 192.168.43.195.7771: UDP, length 120
23:11:11.942856 IP 192.168.43.124.8880 > 192.168.43.195.7771: UDP, length 120
23:11:11.992856 IP 192.168.43.124.8880 > 192.168.43.195.7771: UDP, length 120
23:11:12.042857 IP 192.168.43.124.8880 > 192.168.43.195.7771: UDP, length 120
23:11:12.092855 IP 192.168.43.124.8880 > 192.168.43.195.7771: UDP, length 120
23:11:12.142814 IP 192.168.43.124.8880 > 192.168.43.195.7771: UDP, length 120
23:11:12.192858 IP 192.168.43.124.8880 > 192.168.43.195.7771: UDP, length 120
23:11:12.242906 IP 192.168.43.124.8880 > 192.168.43.195.7771: UDP, length 120
23:11:12.292907 IP 192.168.43.124.8880 > 192.168.43.195.7771: UDP, length 120
23:11:12.342826 IP 192.168.43.124.8880 > 192.168.43.195.7771: UDP, length 120
23:11:12.392856 IP 192.168.43.124.8880 > 192.168.43.195.7771: UDP, length 120
23:11:12.442862 IP 192.168.43.124.8880 > 192.168.43.195.7771: UDP, length 120
23:11:12.492858 IP 192.168.43.124.8880 > 192.168.43.195.7771: UDP, length 120
23:11:12.542860 IP 192.168.43.124.8880 > 192.168.43.195.7771: UDP, length 120
23:11:12.592858 IP 192.168.43.124.8880 > 192.168.43.195.7771: UDP, length 120
23:11:12.642859 IP 192.168.43.124.8880 > 192.168.43.195.7771: UDP, length 120
23:11:12.692857 IP 192.168.43.124.8880 > 192.168.43.195.7771: UDP, length 120
23:11:12.742857 IP 192.168.43.124.8880 > 192.168.43.195.7771: UDP, length 120
23:11:12.792858 IP 192.168.43.124.8880 > 192.168.43.195.7771: UDP, length 120
23:11:12.842858 IP 192.168.43.124.8880 > 192.168.43.195.7771: UDP, length 120
23:11:12.892856 IP 192.168.43.124.8880 > 192.168.43.195.7771: UDP, length 120
23:11:12.942797 IP 192.168.43.124.8880 > 192.168.43.195.7771: UDP, length 120
23:11:12.992906 IP 192.168.43.124.8880 > 192.168.43.195.7771: UDP, length 120
23:11:13.042907 IP 192.168.43.124.8880 > 192.168.43.195.7771: UDP, length 120
23:11:13.092904 IP 192.168.43.124.8880 > 192.168.43.195.7771: UDP, length 120
23:11:13.142781 IP 192.168.43.124.8880 > 192.168.43.195.7771: UDP, length 120
23:11:13.192858 IP 192.168.43.124.8880 > 192.168.43.195.7771: UDP, length 120
23:11:13.242906 IP 192.168.43.124.8880 > 192.168.43.195.7771: UDP, length 120
23:11:13.292907 IP 192.168.43.124.8880 > 192.168.43.195.7771: UDP, length 120
23:11:13.342811 IP 192.168.43.124.8880 > 192.168.43.195.7771: UDP, length 120
23:11:13.392906 IP 192.168.43.124.8880 > 192.168.43.195.7771: UDP, length 120
23:11:13.442904 IP 192.168.43.124.8880 > 192.168.43.195.7771: UDP, length 120
23:11:13.492905 IP 192.168.43.124.8880 > 192.168.43.195.7771: UDP, length 120
23:11:13.542803 IP 192.168.43.124.8880 > 192.168.43.195.7771: UDP, length 120
23:11:13.592859 IP 192.168.43.124.8880 > 192.168.43.195.7771: UDP, length 120
23:11:13.642858 IP 192.168.43.124.8880 > 192.168.43.195.7771: UDP, length 120
23:11:13.692860 IP 192.168.43.124.8880 > 192.168.43.195.7771: UDP, length 120
23:11:13.742859 IP 192.168.43.124.8880 > 192.168.43.195.7771: UDP, length 120
23:11:13.792858 IP 192.168.43.124.8880 > 192.168.43.195.7771: UDP, length 120
23:11:13.843403 IP 192.168.43.124.8880 > 192.168.43.195.7771: UDP, length 120
23:11:13.892857 IP 192.168.43.124.8880 > 192.168.43.195.7771: UDP, length 120
23:11:13.942857 IP 192.168.43.124.8880 > 192.168.43.195.7771: UDP, length 120
23:11:13.992860 IP 192.168.43.124.8880 > 192.168.43.195.7771: UDP, length 120
23:11:14.042856 IP 192.168.43.124.8880 > 192.168.43.195.7771: UDP, length 120
23:11:14.092857 IP 192.168.43.124.8880 > 192.168.43.195.7771: UDP, length 120
23:11:14.142786 IP 192.168.43.124.8880 > 192.168.43.195.7771: UDP, length 120
23:11:14.192855 IP 192.168.43.124.8880 > 192.168.43.195.7771: UDP, length 120
23:11:14.242855 IP 192.168.43.124.8880 > 192.168.43.195.7771: UDP, length 120
23:11:14.292856 IP 192.168.43.124.8880 > 192.168.43.195.7771: UDP, length 120
23:11:14.342855 IP 192.168.43.124.8880 > 192.168.43.195.7771: UDP, length 120
23:11:14.392856 IP 192.168.43.124.8880 > 192.168.43.195.7771: UDP, length 120
23:11:14.442855 IP 192.168.43.124.8880 > 192.168.43.195.7771: UDP, length 120
23:11:14.492854 IP 192.168.43.124.8880 > 192.168.43.195.7771: UDP, length 120
23:11:14.542855 IP 192.168.43.124.8880 > 192.168.43.195.7771: UDP, length 120
23:11:14.592859 IP 192.168.43.124.8880 > 192.168.43.195.7771: UDP, length 120
23:11:14.642907 IP 192.168.43.124.8880 > 192.168.43.195.7771: UDP, length 120
23:11:14.692901 IP 192.168.43.124.8880 > 192.168.43.195.7771: UDP, length 120
23:11:14.742840 IP 192.168.43.124.8880 > 192.168.43.195.7771: UDP, length 120
23:11:14.792903 IP 192.168.43.124.8880 > 192.168.43.195.7771: UDP, length 120
23:11:14.842904 IP 192.168.43.124.8880 > 192.168.43.195.7771: UDP, length 120
23:11:14.892906 IP 192.168.43.124.8880 > 192.168.43.195.7771: UDP, length 120
23:11:14.942904 IP 192.168.43.124.8880 > 192.168.43.195.7771: UDP, length 120
23:11:14.992907 IP 192.168.43.124.8880 > 192.168.43.195.7771: UDP, length 120
23:11:15.042905 IP 192.168.43.124.8880 > 192.168.43.195.7771: UDP, length 120
23:11:15.092903 IP 192.168.43.124.8880 > 192.168.43.195.7771: UDP, length 120
23:11:15.142813 IP 192.168.43.124.8880 > 192.168.43.195.7771: UDP, length 120
23:11:15.192859 IP 192.168.43.124.8880 > 192.168.43.195.7771: UDP, length 120
23:11:15.242902 IP 192.168.43.124.8880 > 192.168.43.195.7771: UDP, length 120
23:11:15.292910 IP 192.168.43.124.8880 > 192.168.43.195.7771: UDP, length 120
23:11:15.342855 IP 192.168.43.124.8880 > 192.168.43.195.7771: UDP, length 120
23:11:15.392787 IP 192.168.43.124.8880 > 192.168.43.195.7771: UDP, length 120
23:11:15.442776 IP 192.168.43.124.8880 > 192.168.43.195.7771: UDP, length 120
23:11:15.492853 IP 192.168.43.124.8880 > 192.168.43.195.7771: UDP, length 120
23:11:15.542851 IP 192.168.43.124.8880 > 192.168.43.195.7771: UDP, length 120
23:11:15.592854 IP 192.168.43.124.8880 > 192.168.43.195.7771: UDP, length 120
23:11:15.642855 IP 192.168.43.124.8880 > 192.168.43.195.7771: UDP, length 120
23:11:15.692855 IP 192.168.43.124.8880 > 192.168.43.195.7771: UDP, length 120
23:11:15.742855 IP 192.168.43.124.8880 > 192.168.43.195.7771: UDP, length 120
23:11:15.792855 IP 192.168.43.124.8880 > 192.168.43.195.7771: UDP, length 120
23:11:15.842855 IP 192.168.43.124.8880 > 192.168.43.195.7771: UDP, length 120
23:11:15.892857 IP 192.168.43.124.8880 > 192.168.43.195.7771: UDP, length 120
23:11:15.942855 IP 192.168.43.124.8880 > 192.168.43.195.7771: UDP, length 120
23:11:15.992907 IP 192.168.43.124.8880 > 192.168.43.195.7771: UDP, length 120
23:11:16.042946 IP 192.168.43.124.8880 > 192.168.43.195.7771: UDP, length 120
23:11:16.092955 IP 192.168.43.124.8880 > 192.168.43.195.7771: UDP, length 120
23:11:16.142775 IP 192.168.43.124.8880 > 192.168.43.195.7771: UDP, length 120
23:11:16.192850 IP 192.168.43.124.8880 > 192.168.43.195.7771: UDP, length 120
23:11:16.242853 IP 192.168.43.124.8880 > 192.168.43.195.7771: UDP, length 120
23:11:16.292855 IP 192.168.43.124.8880 > 192.168.43.195.7771: UDP, length 120
23:11:16.342854 IP 192.168.43.124.8880 > 192.168.43.195.7771: UDP, length 120
23:11:16.392856 IP 192.168.43.124.8880 > 192.168.43.195.7771: UDP, length 120
23:11:16.442855 IP 192.168.43.124.8880 > 192.168.43.195.7771: UDP, length 120
23:11:16.492854 IP 192.168.43.124.8880 > 192.168.43.195.7771: UDP, length 120
23:11:16.542854 IP 192.168.43.124.8880 > 192.168.43.195.7771: UDP, length 120
23:11:16.592902 IP 192.168.43.124.8880 > 192.168.43.195.7771: UDP, length 120
23:11:16.642907 IP 192.168.43.124.8880 > 192.168.43.195.7771: UDP, length 120
23:11:16.693115 IP 192.168.43.124.8880 > 192.168.43.195.7771: UDP, length 120
23:11:16.743103 IP 192.168.43.124.8880 > 192.168.43.195.7771: UDP, length 120
23:11:16.793443 IP 192.168.43.124.8880 > 192.168.43.195.7771: UDP, length 120
23:11:16.842949 IP 192.168.43.124.8880 > 192.168.43.195.7771: UDP, length 120
23:11:16.893628 IP 192.168.43.124.8880 > 192.168.43.195.7771: UDP, length 120
23:11:16.942906 IP 192.168.43.124.8880 > 192.168.43.195.7771: UDP, length 120
23:11:16.993114 IP 192.168.43.124.8880 > 192.168.43.195.7771: UDP, length 120
23:11:17.043114 IP 192.168.43.124.8880 > 192.168.43.195.7771: UDP, length 120
23:11:17.092903 IP 192.168.43.124.8880 > 192.168.43.195.7771: UDP, length 120
23:11:17.143039 IP 192.168.43.124.8880 > 192.168.43.195.7771: UDP, length 120
23:11:17.192899 IP 192.168.43.124.8880 > 192.168.43.195.7771: UDP, length 120
23:11:17.242855 IP 192.168.43.124.8880 > 192.168.43.195.7771: UDP, length 120
23:11:17.292854 IP 192.168.43.124.8880 > 192.168.43.195.7771: UDP, length 120
23:11:17.342855 IP 192.168.43.124.8880 > 192.168.43.195.7771: UDP, length 120
23:11:17.392853 IP 192.168.43.124.8880 > 192.168.43.195.7771: UDP, length 120
23:11:17.442855 IP 192.168.43.124.8880 > 192.168.43.195.7771: UDP, length 120
23:11:17.492855 IP 192.168.43.124.8880 > 192.168.43.195.7771: UDP, length 120
23:11:17.542854 IP 192.168.43.124.8880 > 192.168.43.195.7771: UDP, length 120
23:11:17.592857 IP 192.168.43.124.8880 > 192.168.43.195.7771: UDP, length 120
23:11:17.642855 IP 192.168.43.124.8880 > 192.168.43.195.7771: UDP, length 120
23:11:17.692854 IP 192.168.43.124.8880 > 192.168.43.195.7771: UDP, length 120
23:11:17.742855 IP 192.168.43.124.8880 > 192.168.43.195.7771: UDP, length 120
23:11:17.792853 IP 192.168.43.124.8880 > 192.168.43.195.7771: UDP, length 120
23:11:17.842854 IP 192.168.43.124.8880 > 192.168.43.195.7771: UDP, length 120
23:11:17.892854 IP 192.168.43.124.8880 > 192.168.43.195.7771: UDP, length 120
23:11:17.942855 IP 192.168.43.124.8880 > 192.168.43.195.7771: UDP, length 120
23:11:17.992852 IP 192.168.43.124.8880 > 192.168.43.195.7771: UDP, length 120
23:11:18.042855 IP 192.168.43.124.8880 > 192.168.43.195.7771: UDP, length 120
23:11:18.092854 IP 192.168.43.124.8880 > 192.168.43.195.7771: UDP, length 120
23:11:18.142824 IP 192.168.43.124.8880 > 192.168.43.195.7771: UDP, length 120
23:11:18.192892 IP 192.168.43.124.8880 > 192.168.43.195.7771: UDP, length 120
23:11:18.242857 IP 192.168.43.124.8880 > 192.168.43.195.7771: UDP, length 120
23:11:18.292797 IP 192.168.43.124.8880 > 192.168.43.195.7771: UDP, length 120
23:11:18.342859 IP 192.168.43.124.8880 > 192.168.43.195.7771: UDP, length 120
23:11:18.392857 IP 192.168.43.124.8880 > 192.168.43.195.7771: UDP, length 120
23:11:18.442861 IP 192.168.43.124.8880 > 192.168.43.195.7771: UDP, length 120
23:11:18.492860 IP 192.168.43.124.8880 > 192.168.43.195.7771: UDP, length 120
23:11:18.542857 IP 192.168.43.124.8880 > 192.168.43.195.7771: UDP, length 120
23:11:18.592905 IP 192.168.43.124.8880 > 192.168.43.195.7771: UDP, length 120
23:11:18.643105 IP 192.168.43.124.8880 > 192.168.43.195.7771: UDP, length 120
23:11:18.693103 IP 192.168.43.124.8880 > 192.168.43.195.7771: UDP, length 120
23:11:18.743116 IP 192.168.43.124.8880 > 192.168.43.195.7771: UDP, length 120
23:11:18.792904 IP 192.168.43.124.8880 > 192.168.43.195.7771: UDP, length 120
23:11:18.843103 IP 192.168.43.124.8880 > 192.168.43.195.7771: UDP, length 120
23:11:18.893429 IP 192.168.43.124.8880 > 192.168.43.195.7771: UDP, length 120
23:11:18.943104 IP 192.168.43.124.8880 > 192.168.43.195.7771: UDP, length 120
23:11:18.993074 IP 192.168.43.124.8880 > 192.168.43.195.7771: UDP, length 120
23:11:19.042862 IP 192.168.43.124.8880 > 192.168.43.195.7771: UDP, length 120
23:11:19.092861 IP 192.168.43.124.8880 > 192.168.43.195.7771: UDP, length 120
23:11:19.142821 IP 192.168.43.124.8880 > 192.168.43.195.7771: UDP, length 120
23:11:19.193056 IP 192.168.43.124.8880 > 192.168.43.195.7771: UDP, length 120
23:11:19.242856 IP 192.168.43.124.8880 > 192.168.43.195.7771: UDP, length 120
23:11:19.292859 IP 192.168.43.124.8880 > 192.168.43.195.7771: UDP, length 120
23:11:19.343371 IP 192.168.43.124.8880 > 192.168.43.195.7771: UDP, length 120
23:11:19.392855 IP 192.168.43.124.8880 > 192.168.43.195.7771: UDP, length 120
23:11:19.442854 IP 192.168.43.124.8880 > 192.168.43.195.7771: UDP, length 120
23:11:19.492854 IP 192.168.43.124.8880 > 192.168.43.195.7771: UDP, length 120
23:11:19.542854 IP 192.168.43.124.8880 > 192.168.43.195.7771: UDP, length 120
23:11:19.592904 IP 192.168.43.124.8880 > 192.168.43.195.7771: UDP, length 120
23:11:19.642905 IP 192.168.43.124.8880 > 192.168.43.195.7771: UDP, length 120
23:11:19.692904 IP 192.168.43.124.8880 > 192.168.43.195.7771: UDP, length 120
23:11:19.742902 IP 192.168.43.124.8880 > 192.168.43.195.7771: UDP, length 120
23:11:19.792904 IP 192.168.43.124.8880 > 192.168.43.195.7771: UDP, length 120
23:11:19.842905 IP 192.168.43.124.8880 > 192.168.43.195.7771: UDP, length 120
23:11:19.892904 IP 192.168.43.124.8880 > 192.168.43.195.7771: UDP, length 120
23:11:19.942853 IP 192.168.43.124.8880 > 192.168.43.195.7771: UDP, length 120
23:11:19.992852 IP 192.168.43.124.8880 > 192.168.43.195.7771: UDP, length 120
23:11:20.042854 IP 192.168.43.124.8880 > 192.168.43.195.7771: UDP, length 120
23:11:20.092854 IP 192.168.43.124.8880 > 192.168.43.195.7771: UDP, length 120
23:11:20.142776 IP 192.168.43.124.8880 > 192.168.43.195.7771: UDP, length 120
23:11:20.192853 IP 192.168.43.124.8880 > 192.168.43.195.7771: UDP, length 120
23:11:20.242811 IP 192.168.43.124.8880 > 192.168.43.195.7771: UDP, length 120
23:11:20.292905 IP 192.168.43.124.8880 > 192.168.43.195.7771: UDP, length 120
23:11:20.342903 IP 192.168.43.124.8880 > 192.168.43.195.7771: UDP, length 120
23:11:20.392904 IP 192.168.43.124.8880 > 192.168.43.195.7771: UDP, length 120
23:11:20.442905 IP 192.168.43.124.8880 > 192.168.43.195.7771: UDP, length 120
23:11:20.492794 IP 192.168.43.124.8880 > 192.168.43.195.7771: UDP, length 120
23:11:20.542784 IP 192.168.43.124.8880 > 192.168.43.195.7771: UDP, length 120
23:11:20.592852 IP 192.168.43.124.8880 > 192.168.43.195.7771: UDP, length 120
23:11:20.642854 IP 192.168.43.124.8880 > 192.168.43.195.7771: UDP, length 120
23:11:20.692855 IP 192.168.43.124.8880 > 192.168.43.195.7771: UDP, length 120
23:11:20.742854 IP 192.168.43.124.8880 > 192.168.43.195.7771: UDP, length 120
23:11:20.792854 IP 192.168.43.124.8880 > 192.168.43.195.7771: UDP, length 120
23:11:20.842855 IP 192.168.43.124.8880 > 192.168.43.195.7771: UDP, length 120
23:11:20.892853 IP 192.168.43.124.8880 > 192.168.43.195.7771: UDP, length 120
23:11:20.942855 IP 192.168.43.124.8880 > 192.168.43.195.7771: UDP, length 120
23:11:20.992852 IP 192.168.43.124.8880 > 192.168.43.195.7771: UDP, length 120
23:11:21.042854 IP 192.168.43.124.8880 > 192.168.43.195.7771: UDP, length 120
23:11:21.092854 IP 192.168.43.124.8880 > 192.168.43.195.7771: UDP, length 120
23:11:21.142772 IP 192.168.43.124.8880 > 192.168.43.195.7771: UDP, length 120
23:11:21.192850 IP 192.168.43.124.8880 > 192.168.43.195.7771: UDP, length 120
23:11:21.242853 IP 192.168.43.124.8880 > 192.168.43.195.7771: UDP, length 120
23:11:21.292854 IP 192.168.43.124.8880 > 192.168.43.195.7771: UDP, length 120
23:11:21.342854 IP 192.168.43.124.8880 > 192.168.43.195.7771: UDP, length 120
23:11:21.392839 IP 192.168.43.124.8880 > 192.168.43.195.7771: UDP, length 120
23:11:21.442881 IP 192.168.43.124.8880 > 192.168.43.195.7771: UDP, length 120
23:11:21.492878 IP 192.168.43.124.8880 > 192.168.43.195.7771: UDP, length 120
