02:40:28.772030 IP 192.168.43.146.8880 > 192.168.43.147.7772: UDP, length 120
02:40:28.820325 IP 192.168.43.146.8880 > 192.168.43.147.7772: UDP, length 120
02:40:28.864388 IP 192.168.43.146.8880 > 192.168.43.147.7772: UDP, length 120
02:40:28.907563 IP 192.168.43.146.8880 > 192.168.43.147.7772: UDP, length 120
02:40:28.957385 IP 192.168.43.146.8880 > 192.168.43.147.7772: UDP, length 120
02:40:29.024901 IP 192.168.43.146.8880 > 192.168.43.147.7772: UDP, length 120
02:40:29.056849 IP 192.168.43.146.8880 > 192.168.43.147.7772: UDP, length 120
02:40:29.127479 IP 192.168.43.146.8880 > 192.168.43.147.7772: UDP, length 120
02:40:29.156634 IP 192.168.43.146.8880 > 192.168.43.147.7772: UDP, length 120
02:40:29.212582 IP 192.168.43.146.8880 > 192.168.43.147.7772: UDP, length 120
02:40:29.257535 IP 192.168.43.146.8880 > 192.168.43.147.7772: UDP, length 120
02:40:29.316957 IP 192.168.43.146.8880 > 192.168.43.147.7772: UDP, length 120
02:40:29.360637 IP 192.168.43.146.8880 > 192.168.43.147.7772: UDP, length 120
02:40:29.407121 IP 192.168.43.146.8880 > 192.168.43.147.7772: UDP, length 120
02:40:29.462304 IP 192.168.43.146.8880 > 192.168.43.147.7772: UDP, length 120
02:40:29.521282 IP 192.168.43.146.8880 > 192.168.43.147.7772: UDP, length 120
02:40:29.563510 IP 192.168.43.146.8880 > 192.168.43.147.7772: UDP, length 120
02:40:29.608951 IP 192.168.43.146.8880 > 192.168.43.147.7772: UDP, length 120
02:40:29.666216 IP 192.168.43.146.8880 > 192.168.43.147.7772: UDP, length 120
02:40:29.725675 IP 192.168.43.146.8880 > 192.168.43.147.7772: UDP, length 120
02:40:29.757437 IP 192.168.43.146.8880 > 192.168.43.147.7772: UDP, length 120
02:40:29.814041 IP 192.168.43.146.8880 > 192.168.43.147.7772: UDP, length 120
02:40:29.871693 IP 192.168.43.146.8880 > 192.168.43.147.7772: UDP, length 120
02:40:29.920278 IP 192.168.43.146.8880 > 192.168.43.147.7772: UDP, length 120
02:40:29.936744 IP 192.168.43.147.8880 > 192.168.43.124.7773: UDP, length 120
02:40:29.968578 IP 192.168.43.146.8880 > 192.168.43.147.7772: UDP, length 120
02:40:29.986788 IP 192.168.43.147.8880 > 192.168.43.124.7773: UDP, length 120
02:40:30.027669 IP 192.168.43.146.8880 > 192.168.43.147.7772: UDP, length 120
02:40:30.036777 IP 192.168.43.147.8880 > 192.168.43.124.7773: UDP, length 120
02:40:30.069587 IP 192.168.43.146.8880 > 192.168.43.147.7772: UDP, length 120
02:40:30.086770 IP 192.168.43.147.8880 > 192.168.43.124.7773: UDP, length 120
02:40:30.117462 IP 192.168.43.146.8880 > 192.168.43.147.7772: UDP, length 120
02:40:30.136771 IP 192.168.43.147.8880 > 192.168.43.124.7773: UDP, length 120
02:40:30.158630 IP 192.168.43.146.8880 > 192.168.43.147.7772: UDP, length 120
02:40:30.186769 IP 192.168.43.147.8880 > 192.168.43.124.7773: UDP, length 120
02:40:30.222881 IP 192.168.43.146.8880 > 192.168.43.147.7772: UDP, length 120
02:40:30.236768 IP 192.168.43.147.8880 > 192.168.43.124.7773: UDP, length 120
02:40:30.278591 IP 192.168.43.146.8880 > 192.168.43.147.7772: UDP, length 120
02:40:30.286767 IP 192.168.43.147.8880 > 192.168.43.124.7773: UDP, length 120
02:40:30.333821 IP 192.168.43.146.8880 > 192.168.43.147.7772: UDP, length 120
02:40:30.336768 IP 192.168.43.147.8880 > 192.168.43.124.7773: UDP, length 120
02:40:30.382413 IP 192.168.43.146.8880 > 192.168.43.147.7772: UDP, length 120
02:40:30.386766 IP 192.168.43.147.8880 > 192.168.43.124.7773: UDP, length 120
02:40:30.430568 IP 192.168.43.146.8880 > 192.168.43.147.7772: UDP, length 120
02:40:30.436768 IP 192.168.43.147.8880 > 192.168.43.124.7773: UDP, length 120
02:40:30.486768 IP 192.168.43.147.8880 > 192.168.43.124.7773: UDP, length 120
02:40:30.536769 IP 192.168.43.147.8880 > 192.168.43.124.7773: UDP, length 120
02:40:30.586767 IP 192.168.43.147.8880 > 192.168.43.124.7773: UDP, length 120
02:40:30.590209 IP 192.168.43.146.8880 > 192.168.43.147.7772: UDP, length 120
02:40:30.590326 IP 192.168.43.146.8880 > 192.168.43.147.7772: UDP, length 120
02:40:30.590436 IP 192.168.43.146.8880 > 192.168.43.147.7772: UDP, length 120
02:40:30.635483 IP 192.168.43.146.8880 > 192.168.43.147.7772: UDP, length 120
02:40:30.636784 IP 192.168.43.147.8880 > 192.168.43.124.7773: UDP, length 120
02:40:30.663667 IP 192.168.43.146.8880 > 192.168.43.147.7772: UDP, length 120
02:40:30.686778 IP 192.168.43.147.8880 > 192.168.43.124.7773: UDP, length 120
02:40:30.703716 IP 192.168.43.146.8880 > 192.168.43.147.7772: UDP, length 120
02:40:30.736773 IP 192.168.43.147.8880 > 192.168.43.124.7773: UDP, length 120
02:40:30.753806 IP 192.168.43.146.8880 > 192.168.43.147.7772: UDP, length 120
02:40:30.786786 IP 192.168.43.147.8880 > 192.168.43.124.7773: UDP, length 120
02:40:30.804835 IP 192.168.43.146.8880 > 192.168.43.147.7772: UDP, length 120
02:40:30.836788 IP 192.168.43.147.8880 > 192.168.43.124.7773: UDP, length 120
02:40:30.855527 IP 192.168.43.146.8880 > 192.168.43.147.7772: UDP, length 120
02:40:30.886767 IP 192.168.43.147.8880 > 192.168.43.124.7773: UDP, length 120
02:40:30.902646 IP 192.168.43.146.8880 > 192.168.43.147.7772: UDP, length 120
02:40:30.936773 IP 192.168.43.147.8880 > 192.168.43.124.7773: UDP, length 120
02:40:30.954560 IP 192.168.43.146.8880 > 192.168.43.147.7772: UDP, length 120
02:40:30.986782 IP 192.168.43.147.8880 > 192.168.43.124.7773: UDP, length 120
02:40:31.004477 IP 192.168.43.146.8880 > 192.168.43.147.7772: UDP, length 120
02:40:31.036818 IP 192.168.43.147.8880 > 192.168.43.124.7773: UDP, length 120
02:40:31.053019 IP 192.168.43.146.8880 > 192.168.43.147.7772: UDP, length 120
02:40:31.086781 IP 192.168.43.147.8880 > 192.168.43.124.7773: UDP, length 120
02:40:31.105940 IP 192.168.43.146.8880 > 192.168.43.147.7772: UDP, length 120
02:40:31.136770 IP 192.168.43.147.8880 > 192.168.43.124.7773: UDP, length 120
02:40:31.153071 IP 192.168.43.146.8880 > 192.168.43.147.7772: UDP, length 120
02:40:31.186769 IP 192.168.43.147.8880 > 192.168.43.124.7773: UDP, length 120
02:40:31.203335 IP 192.168.43.146.8880 > 192.168.43.147.7772: UDP, length 120
02:40:31.236770 IP 192.168.43.147.8880 > 192.168.43.124.7773: UDP, length 120
02:40:31.252259 IP 192.168.43.146.8880 > 192.168.43.147.7772: UDP, length 120
02:40:31.286781 IP 192.168.43.147.8880 > 192.168.43.124.7773: UDP, length 120
02:40:31.304862 IP 192.168.43.146.8880 > 192.168.43.147.7772: UDP, length 120
02:40:31.336893 IP 192.168.43.147.8880 > 192.168.43.124.7773: UDP, length 120
02:40:31.353396 IP 192.168.43.146.8880 > 192.168.43.147.7772: UDP, length 120
02:40:31.386885 IP 192.168.43.147.8880 > 192.168.43.124.7773: UDP, length 120
02:40:31.405524 IP 192.168.43.146.8880 > 192.168.43.147.7772: UDP, length 120
02:40:31.436837 IP 192.168.43.147.8880 > 192.168.43.124.7773: UDP, length 120
02:40:31.453819 IP 192.168.43.146.8880 > 192.168.43.147.7772: UDP, length 120
02:40:31.486819 IP 192.168.43.147.8880 > 192.168.43.124.7773: UDP, length 120
02:40:31.512554 IP 192.168.43.146.8880 > 192.168.43.147.7772: UDP, length 120
02:40:31.536831 IP 192.168.43.147.8880 > 192.168.43.124.7773: UDP, length 120
02:40:31.555017 IP 192.168.43.146.8880 > 192.168.43.147.7772: UDP, length 120
02:40:31.586801 IP 192.168.43.147.8880 > 192.168.43.124.7773: UDP, length 120
02:40:31.603103 IP 192.168.43.146.8880 > 192.168.43.147.7772: UDP, length 120
02:40:31.636815 IP 192.168.43.147.8880 > 192.168.43.124.7773: UDP, length 120
02:40:31.652401 IP 192.168.43.146.8880 > 192.168.43.147.7772: UDP, length 120
02:40:31.686800 IP 192.168.43.147.8880 > 192.168.43.124.7773: UDP, length 120
02:40:31.703111 IP 192.168.43.146.8880 > 192.168.43.147.7772: UDP, length 120
02:40:31.736879 IP 192.168.43.147.8880 > 192.168.43.124.7773: UDP, length 120
02:40:31.784117 IP 192.168.43.146.8880 > 192.168.43.147.7772: UDP, length 120
02:40:31.786785 IP 192.168.43.147.8880 > 192.168.43.124.7773: UDP, length 120
02:40:31.803543 IP 192.168.43.146.8880 > 192.168.43.147.7772: UDP, length 120
02:40:31.836759 IP 192.168.43.147.8880 > 192.168.43.124.7773: UDP, length 120
02:40:31.855414 IP 192.168.43.146.8880 > 192.168.43.147.7772: UDP, length 120
02:40:31.886753 IP 192.168.43.147.8880 > 192.168.43.124.7773: UDP, length 120
02:40:31.904983 IP 192.168.43.146.8880 > 192.168.43.147.7772: UDP, length 120
02:40:31.936777 IP 192.168.43.147.8880 > 192.168.43.124.7773: UDP, length 120
02:40:31.960662 IP 192.168.43.146.8880 > 192.168.43.147.7772: UDP, length 120
02:40:31.986770 IP 192.168.43.147.8880 > 192.168.43.124.7773: UDP, length 120
02:40:32.006038 IP 192.168.43.146.8880 > 192.168.43.147.7772: UDP, length 120
02:40:32.036769 IP 192.168.43.147.8880 > 192.168.43.124.7773: UDP, length 120
02:40:32.060624 IP 192.168.43.146.8880 > 192.168.43.147.7772: UDP, length 120
02:40:32.086776 IP 192.168.43.147.8880 > 192.168.43.124.7773: UDP, length 120
02:40:32.101645 IP 192.168.43.146.8880 > 192.168.43.147.7772: UDP, length 120
02:40:32.136768 IP 192.168.43.147.8880 > 192.168.43.124.7773: UDP, length 120
02:40:32.154706 IP 192.168.43.146.8880 > 192.168.43.147.7772: UDP, length 120
02:40:32.186767 IP 192.168.43.147.8880 > 192.168.43.124.7773: UDP, length 120
02:40:32.206434 IP 192.168.43.146.8880 > 192.168.43.147.7772: UDP, length 120
02:40:32.236769 IP 192.168.43.147.8880 > 192.168.43.124.7773: UDP, length 120
02:40:32.254591 IP 192.168.43.146.8880 > 192.168.43.147.7772: UDP, length 120
02:40:32.286768 IP 192.168.43.147.8880 > 192.168.43.124.7773: UDP, length 120
02:40:32.304647 IP 192.168.43.146.8880 > 192.168.43.147.7772: UDP, length 120
02:40:32.336769 IP 192.168.43.147.8880 > 192.168.43.124.7773: UDP, length 120
02:40:32.354416 IP 192.168.43.146.8880 > 192.168.43.147.7772: UDP, length 120
02:40:32.386776 IP 192.168.43.147.8880 > 192.168.43.124.7773: UDP, length 120
02:40:32.403577 IP 192.168.43.146.8880 > 192.168.43.147.7772: UDP, length 120
02:40:32.436772 IP 192.168.43.147.8880 > 192.168.43.124.7773: UDP, length 120
02:40:32.454183 IP 192.168.43.146.8880 > 192.168.43.147.7772: UDP, length 120
02:40:32.486769 IP 192.168.43.147.8880 > 192.168.43.124.7773: UDP, length 120
02:40:32.506002 IP 192.168.43.146.8880 > 192.168.43.147.7772: UDP, length 120
02:40:32.536807 IP 192.168.43.147.8880 > 192.168.43.124.7773: UDP, length 120
02:40:32.556027 IP 192.168.43.146.8880 > 192.168.43.147.7772: UDP, length 120
02:40:32.586771 IP 192.168.43.147.8880 > 192.168.43.124.7773: UDP, length 120
02:40:32.610725 IP 192.168.43.146.8880 > 192.168.43.147.7772: UDP, length 120
02:40:32.636786 IP 192.168.43.147.8880 > 192.168.43.124.7773: UDP, length 120
02:40:32.678467 IP 192.168.43.146.8880 > 192.168.43.147.7772: UDP, length 120
02:40:32.686782 IP 192.168.43.147.8880 > 192.168.43.124.7773: UDP, length 120
02:40:32.706293 IP 192.168.43.146.8880 > 192.168.43.147.7772: UDP, length 120
02:40:32.736775 IP 192.168.43.147.8880 > 192.168.43.124.7773: UDP, length 120
02:40:32.786768 IP 192.168.43.147.8880 > 192.168.43.124.7773: UDP, length 120
02:40:32.797099 IP 192.168.43.146.8880 > 192.168.43.147.7772: UDP, length 120
02:40:32.824272 IP 192.168.43.146.8880 > 192.168.43.147.7772: UDP, length 120
02:40:32.836782 IP 192.168.43.147.8880 > 192.168.43.124.7773: UDP, length 120
02:40:32.886773 IP 192.168.43.147.8880 > 192.168.43.124.7773: UDP, length 120
02:40:32.888390 IP 192.168.43.146.8880 > 192.168.43.147.7772: UDP, length 120
02:40:32.936776 IP 192.168.43.147.8880 > 192.168.43.124.7773: UDP, length 120
02:40:32.941706 IP 192.168.43.146.8880 > 192.168.43.147.7772: UDP, length 120
02:40:32.986775 IP 192.168.43.147.8880 > 192.168.43.124.7773: UDP, length 120
02:40:32.990207 IP 192.168.43.146.8880 > 192.168.43.147.7772: UDP, length 120
02:40:33.019457 IP 192.168.43.146.8880 > 192.168.43.147.7772: UDP, length 120
02:40:33.036773 IP 192.168.43.147.8880 > 192.168.43.124.7773: UDP, length 120
02:40:33.059518 IP 192.168.43.146.8880 > 192.168.43.147.7772: UDP, length 120
02:40:33.086767 IP 192.168.43.147.8880 > 192.168.43.124.7773: UDP, length 120
02:40:33.122151 IP 192.168.43.146.8880 > 192.168.43.147.7772: UDP, length 120
02:40:33.136769 IP 192.168.43.147.8880 > 192.168.43.124.7773: UDP, length 120
02:40:33.160912 IP 192.168.43.146.8880 > 192.168.43.147.7772: UDP, length 120
02:40:33.186766 IP 192.168.43.147.8880 > 192.168.43.124.7773: UDP, length 120
02:40:33.236769 IP 192.168.43.147.8880 > 192.168.43.124.7773: UDP, length 120
02:40:33.239618 IP 192.168.43.146.8880 > 192.168.43.147.7772: UDP, length 120
02:40:33.256100 IP 192.168.43.146.8880 > 192.168.43.147.7772: UDP, length 120
02:40:33.286767 IP 192.168.43.147.8880 > 192.168.43.124.7773: UDP, length 120
02:40:33.331842 IP 192.168.43.146.8880 > 192.168.43.147.7772: UDP, length 120
02:40:33.336768 IP 192.168.43.147.8880 > 192.168.43.124.7773: UDP, length 120
02:40:33.356358 IP 192.168.43.146.8880 > 192.168.43.147.7772: UDP, length 120
02:40:33.386767 IP 192.168.43.147.8880 > 192.168.43.124.7773: UDP, length 120
02:40:33.413307 IP 192.168.43.146.8880 > 192.168.43.147.7772: UDP, length 120
02:40:33.436767 IP 192.168.43.147.8880 > 192.168.43.124.7773: UDP, length 120
02:40:33.454905 IP 192.168.43.146.8880 > 192.168.43.147.7772: UDP, length 120
02:40:33.486768 IP 192.168.43.147.8880 > 192.168.43.124.7773: UDP, length 120
02:40:33.536768 IP 192.168.43.147.8880 > 192.168.43.124.7773: UDP, length 120
02:40:33.540187 IP 192.168.43.146.8880 > 192.168.43.147.7772: UDP, length 120
02:40:33.555520 IP 192.168.43.146.8880 > 192.168.43.147.7772: UDP, length 120
02:40:33.586768 IP 192.168.43.147.8880 > 192.168.43.124.7773: UDP, length 120
02:40:33.636781 IP 192.168.43.147.8880 > 192.168.43.124.7773: UDP, length 120
02:40:33.640210 IP 192.168.43.146.8880 > 192.168.43.147.7772: UDP, length 120
02:40:33.661449 IP 192.168.43.146.8880 > 192.168.43.147.7772: UDP, length 120
02:40:33.686772 IP 192.168.43.147.8880 > 192.168.43.124.7773: UDP, length 120
02:40:33.724922 IP 192.168.43.146.8880 > 192.168.43.147.7772: UDP, length 120
02:40:33.736769 IP 192.168.43.147.8880 > 192.168.43.124.7773: UDP, length 120
02:40:33.763502 IP 192.168.43.146.8880 > 192.168.43.147.7772: UDP, length 120
02:40:33.786768 IP 192.168.43.147.8880 > 192.168.43.124.7773: UDP, length 120
02:40:33.806081 IP 192.168.43.146.8880 > 192.168.43.147.7772: UDP, length 120
02:40:33.836767 IP 192.168.43.147.8880 > 192.168.43.124.7773: UDP, length 120
02:40:33.863271 IP 192.168.43.146.8880 > 192.168.43.147.7772: UDP, length 120
02:40:33.886771 IP 192.168.43.147.8880 > 192.168.43.124.7773: UDP, length 120
02:40:33.926126 IP 192.168.43.146.8880 > 192.168.43.147.7772: UDP, length 120
02:40:33.936772 IP 192.168.43.147.8880 > 192.168.43.124.7773: UDP, length 120
02:40:33.959804 IP 192.168.43.146.8880 > 192.168.43.147.7772: UDP, length 120
02:40:33.986782 IP 192.168.43.147.8880 > 192.168.43.124.7773: UDP, length 120
02:40:34.036814 IP 192.168.43.147.8880 > 192.168.43.124.7773: UDP, length 120
02:40:34.042028 IP 192.168.43.146.8880 > 192.168.43.147.7772: UDP, length 120
02:40:34.070914 IP 192.168.43.146.8880 > 192.168.43.147.7772: UDP, length 120
02:40:34.086782 IP 192.168.43.147.8880 > 192.168.43.124.7773: UDP, length 120
02:40:34.114920 IP 192.168.43.146.8880 > 192.168.43.147.7772: UDP, length 120
02:40:34.136769 IP 192.168.43.147.8880 > 192.168.43.124.7773: UDP, length 120
02:40:34.172813 IP 192.168.43.146.8880 > 192.168.43.147.7772: UDP, length 120
02:40:34.186778 IP 192.168.43.147.8880 > 192.168.43.124.7773: UDP, length 120
02:40:34.218351 IP 192.168.43.146.8880 > 192.168.43.147.7772: UDP, length 120
02:40:34.236777 IP 192.168.43.147.8880 > 192.168.43.124.7773: UDP, length 120
02:40:34.265013 IP 192.168.43.146.8880 > 192.168.43.147.7772: UDP, length 120
02:40:34.286776 IP 192.168.43.147.8880 > 192.168.43.124.7773: UDP, length 120
02:40:34.336768 IP 192.168.43.147.8880 > 192.168.43.124.7773: UDP, length 120
02:40:34.339242 IP 192.168.43.146.8880 > 192.168.43.147.7772: UDP, length 120
02:40:34.371386 IP 192.168.43.146.8880 > 192.168.43.147.7772: UDP, length 120
02:40:34.386767 IP 192.168.43.147.8880 > 192.168.43.124.7773: UDP, length 120
02:40:34.436780 IP 192.168.43.147.8880 > 192.168.43.124.7773: UDP, length 120
02:40:34.468478 IP 192.168.43.146.8880 > 192.168.43.147.7772: UDP, length 120
02:40:34.468741 IP 192.168.43.146.8880 > 192.168.43.147.7772: UDP, length 120
02:40:34.486778 IP 192.168.43.147.8880 > 192.168.43.124.7773: UDP, length 120
02:40:34.524939 IP 192.168.43.146.8880 > 192.168.43.147.7772: UDP, length 120
02:40:34.536780 IP 192.168.43.147.8880 > 192.168.43.124.7773: UDP, length 120
02:40:34.583008 IP 192.168.43.146.8880 > 192.168.43.147.7772: UDP, length 120
02:40:34.586767 IP 192.168.43.147.8880 > 192.168.43.124.7773: UDP, length 120
02:40:34.626926 IP 192.168.43.146.8880 > 192.168.43.147.7772: UDP, length 120
02:40:34.636790 IP 192.168.43.147.8880 > 192.168.43.124.7773: UDP, length 120
02:40:34.668739 IP 192.168.43.146.8880 > 192.168.43.147.7772: UDP, length 120
02:40:34.686784 IP 192.168.43.147.8880 > 192.168.43.124.7773: UDP, length 120
02:40:34.736779 IP 192.168.43.147.8880 > 192.168.43.124.7773: UDP, length 120
02:40:34.773174 IP 192.168.43.146.8880 > 192.168.43.147.7772: UDP, length 120
02:40:34.784230 IP 192.168.43.146.8880 > 192.168.43.147.7772: UDP, length 120
02:40:34.786777 IP 192.168.43.147.8880 > 192.168.43.124.7773: UDP, length 120
02:40:34.832576 IP 192.168.43.146.8880 > 192.168.43.147.7772: UDP, length 120
02:40:34.836769 IP 192.168.43.147.8880 > 192.168.43.124.7773: UDP, length 120
02:40:34.886780 IP 192.168.43.147.8880 > 192.168.43.124.7773: UDP, length 120
02:40:34.886876 IP 192.168.43.146.8880 > 192.168.43.147.7772: UDP, length 120
02:40:34.934307 IP 192.168.43.146.8880 > 192.168.43.147.7772: UDP, length 120
02:40:34.936775 IP 192.168.43.147.8880 > 192.168.43.124.7773: UDP, length 120
02:40:34.986780 IP 192.168.43.147.8880 > 192.168.43.124.7773: UDP, length 120
02:40:34.990213 IP 192.168.43.146.8880 > 192.168.43.147.7772: UDP, length 120
02:40:35.005643 IP 192.168.43.146.8880 > 192.168.43.147.7772: UDP, length 120
02:40:35.036780 IP 192.168.43.147.8880 > 192.168.43.124.7773: UDP, length 120
02:40:35.086768 IP 192.168.43.147.8880 > 192.168.43.124.7773: UDP, length 120
02:40:35.090915 IP 192.168.43.146.8880 > 192.168.43.147.7772: UDP, length 120
02:40:35.104665 IP 192.168.43.146.8880 > 192.168.43.147.7772: UDP, length 120
02:40:35.136771 IP 192.168.43.147.8880 > 192.168.43.124.7773: UDP, length 120
02:40:35.186768 IP 192.168.43.147.8880 > 192.168.43.124.7773: UDP, length 120
02:40:35.192040 IP 192.168.43.146.8880 > 192.168.43.147.7772: UDP, length 120
02:40:35.206023 IP 192.168.43.146.8880 > 192.168.43.147.7772: UDP, length 120
02:40:35.236768 IP 192.168.43.147.8880 > 192.168.43.124.7773: UDP, length 120
02:40:35.286776 IP 192.168.43.147.8880 > 192.168.43.124.7773: UDP, length 120
02:40:35.295716 IP 192.168.43.146.8880 > 192.168.43.147.7772: UDP, length 120
02:40:35.315357 IP 192.168.43.146.8880 > 192.168.43.147.7772: UDP, length 120
02:40:35.336769 IP 192.168.43.147.8880 > 192.168.43.124.7773: UDP, length 120
02:40:35.386766 IP 192.168.43.147.8880 > 192.168.43.124.7773: UDP, length 120
02:40:35.400105 IP 192.168.43.146.8880 > 192.168.43.147.7772: UDP, length 120
02:40:35.404447 IP 192.168.43.146.8880 > 192.168.43.147.7772: UDP, length 120
02:40:35.436770 IP 192.168.43.147.8880 > 192.168.43.124.7773: UDP, length 120
02:40:35.482757 IP 192.168.43.146.8880 > 192.168.43.147.7772: UDP, length 120
02:40:35.486767 IP 192.168.43.147.8880 > 192.168.43.124.7773: UDP, length 120
02:40:35.511499 IP 192.168.43.146.8880 > 192.168.43.147.7772: UDP, length 120
02:40:35.536818 IP 192.168.43.147.8880 > 192.168.43.124.7773: UDP, length 120
02:40:35.564261 IP 192.168.43.146.8880 > 192.168.43.147.7772: UDP, length 120
02:40:35.586770 IP 192.168.43.147.8880 > 192.168.43.124.7773: UDP, length 120
02:40:35.605885 IP 192.168.43.146.8880 > 192.168.43.147.7772: UDP, length 120
02:40:35.636783 IP 192.168.43.147.8880 > 192.168.43.124.7773: UDP, length 120
02:40:35.686771 IP 192.168.43.147.8880 > 192.168.43.124.7773: UDP, length 120
02:40:35.690177 IP 192.168.43.146.8880 > 192.168.43.147.7772: UDP, length 120
02:40:35.706385 IP 192.168.43.146.8880 > 192.168.43.147.7772: UDP, length 120
02:40:35.736772 IP 192.168.43.147.8880 > 192.168.43.124.7773: UDP, length 120
02:40:35.775052 IP 192.168.43.146.8880 > 192.168.43.147.7772: UDP, length 120
02:40:35.786777 IP 192.168.43.147.8880 > 192.168.43.124.7773: UDP, length 120
02:40:35.810962 IP 192.168.43.146.8880 > 192.168.43.147.7772: UDP, length 120
02:40:35.836770 IP 192.168.43.147.8880 > 192.168.43.124.7773: UDP, length 120
02:40:35.880209 IP 192.168.43.146.8880 > 192.168.43.147.7772: UDP, length 120
02:40:35.886767 IP 192.168.43.147.8880 > 192.168.43.124.7773: UDP, length 120
02:40:35.913440 IP 192.168.43.146.8880 > 192.168.43.147.7772: UDP, length 120
02:40:35.936775 IP 192.168.43.147.8880 > 192.168.43.124.7773: UDP, length 120
02:40:35.986772 IP 192.168.43.147.8880 > 192.168.43.124.7773: UDP, length 120
02:40:35.988185 IP 192.168.43.146.8880 > 192.168.43.147.7772: UDP, length 120
02:40:36.016820 IP 192.168.43.146.8880 > 192.168.43.147.7772: UDP, length 120
02:40:36.036784 IP 192.168.43.147.8880 > 192.168.43.124.7773: UDP, length 120
02:40:36.053282 IP 192.168.43.146.8880 > 192.168.43.147.7772: UDP, length 120
02:40:36.086774 IP 192.168.43.147.8880 > 192.168.43.124.7773: UDP, length 120
02:40:36.111134 IP 192.168.43.146.8880 > 192.168.43.147.7772: UDP, length 120
02:40:36.136771 IP 192.168.43.147.8880 > 192.168.43.124.7773: UDP, length 120
02:40:36.165055 IP 192.168.43.146.8880 > 192.168.43.147.7772: UDP, length 120
02:40:36.186777 IP 192.168.43.147.8880 > 192.168.43.124.7773: UDP, length 120
02:40:36.203922 IP 192.168.43.146.8880 > 192.168.43.147.7772: UDP, length 120
02:40:36.236768 IP 192.168.43.147.8880 > 192.168.43.124.7773: UDP, length 120
02:40:36.264894 IP 192.168.43.146.8880 > 192.168.43.147.7772: UDP, length 120
02:40:36.286766 IP 192.168.43.147.8880 > 192.168.43.124.7773: UDP, length 120
02:40:36.307060 IP 192.168.43.146.8880 > 192.168.43.147.7772: UDP, length 120
02:40:36.336772 IP 192.168.43.147.8880 > 192.168.43.124.7773: UDP, length 120
02:40:36.352763 IP 192.168.43.146.8880 > 192.168.43.147.7772: UDP, length 120
02:40:36.386770 IP 192.168.43.147.8880 > 192.168.43.124.7773: UDP, length 120
02:40:36.406762 IP 192.168.43.146.8880 > 192.168.43.147.7772: UDP, length 120
02:40:36.436768 IP 192.168.43.147.8880 > 192.168.43.124.7773: UDP, length 120
02:40:36.455162 IP 192.168.43.146.8880 > 192.168.43.147.7772: UDP, length 120
02:40:36.486778 IP 192.168.43.147.8880 > 192.168.43.124.7773: UDP, length 120
02:40:36.519623 IP 192.168.43.146.8880 > 192.168.43.147.7772: UDP, length 120
02:40:36.536766 IP 192.168.43.147.8880 > 192.168.43.124.7773: UDP, length 120
02:40:36.555130 IP 192.168.43.146.8880 > 192.168.43.147.7772: UDP, length 120
02:40:36.586767 IP 192.168.43.147.8880 > 192.168.43.124.7773: UDP, length 120
02:40:36.614838 IP 192.168.43.146.8880 > 192.168.43.147.7772: UDP, length 120
02:40:36.636807 IP 192.168.43.147.8880 > 192.168.43.124.7773: UDP, length 120
02:40:36.652807 IP 192.168.43.146.8880 > 192.168.43.147.7772: UDP, length 120
02:40:36.686780 IP 192.168.43.147.8880 > 192.168.43.124.7773: UDP, length 120
02:40:36.706644 IP 192.168.43.146.8880 > 192.168.43.147.7772: UDP, length 120
02:40:36.736774 IP 192.168.43.147.8880 > 192.168.43.124.7773: UDP, length 120
02:40:36.753895 IP 192.168.43.146.8880 > 192.168.43.147.7772: UDP, length 120
02:40:36.786843 IP 192.168.43.147.8880 > 192.168.43.124.7773: UDP, length 120
02:40:36.806972 IP 192.168.43.146.8880 > 192.168.43.147.7772: UDP, length 120
02:40:36.836850 IP 192.168.43.147.8880 > 192.168.43.124.7773: UDP, length 120
02:40:36.853609 IP 192.168.43.146.8880 > 192.168.43.147.7772: UDP, length 120
02:40:36.886931 IP 192.168.43.147.8880 > 192.168.43.124.7773: UDP, length 120
02:40:36.906748 IP 192.168.43.146.8880 > 192.168.43.147.7772: UDP, length 120
02:40:36.936832 IP 192.168.43.147.8880 > 192.168.43.124.7773: UDP, length 120
02:40:36.957303 IP 192.168.43.146.8880 > 192.168.43.147.7772: UDP, length 120
02:40:36.986802 IP 192.168.43.147.8880 > 192.168.43.124.7773: UDP, length 120
02:40:37.003390 IP 192.168.43.146.8880 > 192.168.43.147.7772: UDP, length 120
02:40:37.036829 IP 192.168.43.147.8880 > 192.168.43.124.7773: UDP, length 120
02:40:37.053635 IP 192.168.43.146.8880 > 192.168.43.147.7772: UDP, length 120
02:40:37.086804 IP 192.168.43.147.8880 > 192.168.43.124.7773: UDP, length 120
02:40:37.101334 IP 192.168.43.146.8880 > 192.168.43.147.7772: UDP, length 120
02:40:37.136813 IP 192.168.43.147.8880 > 192.168.43.124.7773: UDP, length 120
02:40:37.151602 IP 192.168.43.146.8880 > 192.168.43.147.7772: UDP, length 120
02:40:37.186835 IP 192.168.43.147.8880 > 192.168.43.124.7773: UDP, length 120
02:40:37.205054 IP 192.168.43.146.8880 > 192.168.43.147.7772: UDP, length 120
02:40:37.236828 IP 192.168.43.147.8880 > 192.168.43.124.7773: UDP, length 120
02:40:37.254174 IP 192.168.43.146.8880 > 192.168.43.147.7772: UDP, length 120
02:40:37.286781 IP 192.168.43.147.8880 > 192.168.43.124.7773: UDP, length 120
02:40:37.307249 IP 192.168.43.146.8880 > 192.168.43.147.7772: UDP, length 120
02:40:37.336748 IP 192.168.43.147.8880 > 192.168.43.124.7773: UDP, length 120
02:40:37.354176 IP 192.168.43.146.8880 > 192.168.43.147.7772: UDP, length 120
02:40:37.386747 IP 192.168.43.147.8880 > 192.168.43.124.7773: UDP, length 120
02:40:37.401338 IP 192.168.43.146.8880 > 192.168.43.147.7772: UDP, length 120
02:40:37.436752 IP 192.168.43.147.8880 > 192.168.43.124.7773: UDP, length 120
02:40:37.460502 IP 192.168.43.146.8880 > 192.168.43.147.7772: UDP, length 120
02:40:37.486744 IP 192.168.43.147.8880 > 192.168.43.124.7773: UDP, length 120
02:40:37.516719 IP 192.168.43.146.8880 > 192.168.43.147.7772: UDP, length 120
02:40:37.536740 IP 192.168.43.147.8880 > 192.168.43.124.7773: UDP, length 120
02:40:37.553903 IP 192.168.43.146.8880 > 192.168.43.147.7772: UDP, length 120
02:40:37.586742 IP 192.168.43.147.8880 > 192.168.43.124.7773: UDP, length 120
02:40:37.613802 IP 192.168.43.146.8880 > 192.168.43.147.7772: UDP, length 120
02:40:37.636753 IP 192.168.43.147.8880 > 192.168.43.124.7773: UDP, length 120
02:40:37.654243 IP 192.168.43.146.8880 > 192.168.43.147.7772: UDP, length 120
02:40:37.686745 IP 192.168.43.147.8880 > 192.168.43.124.7773: UDP, length 120
02:40:37.717315 IP 192.168.43.146.8880 > 192.168.43.147.7772: UDP, length 120
02:40:37.736745 IP 192.168.43.147.8880 > 192.168.43.124.7773: UDP, length 120
02:40:37.758791 IP 192.168.43.146.8880 > 192.168.43.147.7772: UDP, length 120
02:40:37.786744 IP 192.168.43.147.8880 > 192.168.43.124.7773: UDP, length 120
02:40:37.819741 IP 192.168.43.146.8880 > 192.168.43.147.7772: UDP, length 120
02:40:37.836740 IP 192.168.43.147.8880 > 192.168.43.124.7773: UDP, length 120
02:40:37.859474 IP 192.168.43.146.8880 > 192.168.43.147.7772: UDP, length 120
02:40:37.886751 IP 192.168.43.147.8880 > 192.168.43.124.7773: UDP, length 120
02:40:37.903164 IP 192.168.43.146.8880 > 192.168.43.147.7772: UDP, length 120
02:40:37.936748 IP 192.168.43.147.8880 > 192.168.43.124.7773: UDP, length 120
02:40:37.962105 IP 192.168.43.146.8880 > 192.168.43.147.7772: UDP, length 120
02:40:37.986742 IP 192.168.43.147.8880 > 192.168.43.124.7773: UDP, length 120
02:40:38.030733 IP 192.168.43.146.8880 > 192.168.43.147.7772: UDP, length 120
02:40:38.036742 IP 192.168.43.147.8880 > 192.168.43.124.7773: UDP, length 120
02:40:38.064692 IP 192.168.43.146.8880 > 192.168.43.147.7772: UDP, length 120
02:40:38.086742 IP 192.168.43.147.8880 > 192.168.43.124.7773: UDP, length 120
02:40:38.136745 IP 192.168.43.147.8880 > 192.168.43.124.7773: UDP, length 120
02:40:38.138490 IP 192.168.43.146.8880 > 192.168.43.147.7772: UDP, length 120
02:40:38.168941 IP 192.168.43.146.8880 > 192.168.43.147.7772: UDP, length 120
02:40:38.186749 IP 192.168.43.147.8880 > 192.168.43.124.7773: UDP, length 120
02:40:38.236741 IP 192.168.43.147.8880 > 192.168.43.124.7773: UDP, length 120
02:40:38.249299 IP 192.168.43.146.8880 > 192.168.43.147.7772: UDP, length 120
02:40:38.266077 IP 192.168.43.146.8880 > 192.168.43.147.7772: UDP, length 120
02:40:38.286742 IP 192.168.43.147.8880 > 192.168.43.124.7773: UDP, length 120
02:40:38.336742 IP 192.168.43.147.8880 > 192.168.43.124.7773: UDP, length 120
02:40:38.354691 IP 192.168.43.146.8880 > 192.168.43.147.7772: UDP, length 120
02:40:38.366777 IP 192.168.43.146.8880 > 192.168.43.147.7772: UDP, length 120
02:40:38.386741 IP 192.168.43.147.8880 > 192.168.43.124.7773: UDP, length 120
02:40:38.436742 IP 192.168.43.147.8880 > 192.168.43.124.7773: UDP, length 120
02:40:38.460530 IP 192.168.43.146.8880 > 192.168.43.147.7772: UDP, length 120
02:40:38.471170 IP 192.168.43.146.8880 > 192.168.43.147.7772: UDP, length 120
02:40:38.486741 IP 192.168.43.147.8880 > 192.168.43.124.7773: UDP, length 120
02:40:38.516220 IP 192.168.43.146.8880 > 192.168.43.147.7772: UDP, length 120
02:40:38.536770 IP 192.168.43.147.8880 > 192.168.43.124.7773: UDP, length 120
02:40:38.576181 IP 192.168.43.146.8880 > 192.168.43.147.7772: UDP, length 120
02:40:38.586743 IP 192.168.43.147.8880 > 192.168.43.124.7773: UDP, length 120
02:40:38.636749 IP 192.168.43.147.8880 > 192.168.43.124.7773: UDP, length 120
02:40:38.665040 IP 192.168.43.146.8880 > 192.168.43.147.7772: UDP, length 120
02:40:38.675834 IP 192.168.43.146.8880 > 192.168.43.147.7772: UDP, length 120
02:40:38.686743 IP 192.168.43.147.8880 > 192.168.43.124.7773: UDP, length 120
02:40:38.736741 IP 192.168.43.147.8880 > 192.168.43.124.7773: UDP, length 120
02:40:38.749849 IP 192.168.43.146.8880 > 192.168.43.147.7772: UDP, length 120
02:40:38.781291 IP 192.168.43.146.8880 > 192.168.43.147.7772: UDP, length 120
02:40:38.786740 IP 192.168.43.147.8880 > 192.168.43.124.7773: UDP, length 120
02:40:38.836742 IP 192.168.43.147.8880 > 192.168.43.124.7773: UDP, length 120
02:40:38.846996 IP 192.168.43.146.8880 > 192.168.43.147.7772: UDP, length 120
02:40:38.885843 IP 192.168.43.146.8880 > 192.168.43.147.7772: UDP, length 120
02:40:38.886740 IP 192.168.43.147.8880 > 192.168.43.124.7773: UDP, length 120
02:40:38.936744 IP 192.168.43.147.8880 > 192.168.43.124.7773: UDP, length 120
02:40:38.985267 IP 192.168.43.146.8880 > 192.168.43.147.7772: UDP, length 120
02:40:38.985426 IP 192.168.43.146.8880 > 192.168.43.147.7772: UDP, length 120
02:40:38.986740 IP 192.168.43.147.8880 > 192.168.43.124.7773: UDP, length 120
02:40:39.036741 IP 192.168.43.147.8880 > 192.168.43.124.7773: UDP, length 120
02:40:39.071800 IP 192.168.43.146.8880 > 192.168.43.147.7772: UDP, length 120
02:40:39.082361 IP 192.168.43.146.8880 > 192.168.43.147.7772: UDP, length 120
02:40:39.086741 IP 192.168.43.147.8880 > 192.168.43.124.7773: UDP, length 120
02:40:39.136741 IP 192.168.43.147.8880 > 192.168.43.124.7773: UDP, length 120
02:40:39.177242 IP 192.168.43.146.8880 > 192.168.43.147.7772: UDP, length 120
02:40:39.181674 IP 192.168.43.146.8880 > 192.168.43.147.7772: UDP, length 120
02:40:39.186754 IP 192.168.43.147.8880 > 192.168.43.124.7773: UDP, length 120
02:40:39.236746 IP 192.168.43.147.8880 > 192.168.43.124.7773: UDP, length 120
02:40:39.238365 IP 192.168.43.146.8880 > 192.168.43.147.7772: UDP, length 120
02:40:39.286741 IP 192.168.43.147.8880 > 192.168.43.124.7773: UDP, length 120
02:40:39.290250 IP 192.168.43.146.8880 > 192.168.43.147.7772: UDP, length 120
02:40:39.336741 IP 192.168.43.147.8880 > 192.168.43.124.7773: UDP, length 120
02:40:39.353997 IP 192.168.43.146.8880 > 192.168.43.147.7772: UDP, length 120
02:40:39.386741 IP 192.168.43.147.8880 > 192.168.43.124.7773: UDP, length 120
02:40:39.390811 IP 192.168.43.146.8880 > 192.168.43.147.7772: UDP, length 120
02:40:39.406465 IP 192.168.43.146.8880 > 192.168.43.147.7772: UDP, length 120
02:40:39.436742 IP 192.168.43.147.8880 > 192.168.43.124.7773: UDP, length 120
02:40:39.485081 IP 192.168.43.146.8880 > 192.168.43.147.7772: UDP, length 120
02:40:39.486741 IP 192.168.43.147.8880 > 192.168.43.124.7773: UDP, length 120
02:40:39.511735 IP 192.168.43.146.8880 > 192.168.43.147.7772: UDP, length 120
02:40:39.536740 IP 192.168.43.147.8880 > 192.168.43.124.7773: UDP, length 120
02:40:39.586740 IP 192.168.43.147.8880 > 192.168.43.124.7773: UDP, length 120
02:40:39.598866 IP 192.168.43.146.8880 > 192.168.43.147.7772: UDP, length 120
02:40:39.612821 IP 192.168.43.146.8880 > 192.168.43.147.7772: UDP, length 120
02:40:39.636747 IP 192.168.43.147.8880 > 192.168.43.124.7773: UDP, length 120
02:40:39.686742 IP 192.168.43.147.8880 > 192.168.43.124.7773: UDP, length 120
02:40:39.698039 IP 192.168.43.146.8880 > 192.168.43.147.7772: UDP, length 120
02:40:39.706954 IP 192.168.43.146.8880 > 192.168.43.147.7772: UDP, length 120
02:40:39.736742 IP 192.168.43.147.8880 > 192.168.43.124.7773: UDP, length 120
02:40:39.786741 IP 192.168.43.147.8880 > 192.168.43.124.7773: UDP, length 120
02:40:39.789972 IP 192.168.43.146.8880 > 192.168.43.147.7772: UDP, length 120
02:40:39.804054 IP 192.168.43.146.8880 > 192.168.43.147.7772: UDP, length 120
02:40:39.836743 IP 192.168.43.147.8880 > 192.168.43.124.7773: UDP, length 120
02:40:39.886739 IP 192.168.43.147.8880 > 192.168.43.124.7773: UDP, length 120
02:40:39.889972 IP 192.168.43.146.8880 > 192.168.43.147.7772: UDP, length 120
02:40:39.902611 IP 192.168.43.146.8880 > 192.168.43.147.7772: UDP, length 120
02:40:39.936743 IP 192.168.43.147.8880 > 192.168.43.124.7773: UDP, length 120
02:40:39.981699 IP 192.168.43.146.8880 > 192.168.43.147.7772: UDP, length 120
02:40:39.986741 IP 192.168.43.147.8880 > 192.168.43.124.7773: UDP, length 120
02:40:40.010464 IP 192.168.43.146.8880 > 192.168.43.147.7772: UDP, length 120
02:40:40.036771 IP 192.168.43.147.8880 > 192.168.43.124.7773: UDP, length 120
02:40:40.086741 IP 192.168.43.147.8880 > 192.168.43.124.7773: UDP, length 120
02:40:40.103076 IP 192.168.43.146.8880 > 192.168.43.147.7772: UDP, length 120
02:40:40.109060 IP 192.168.43.146.8880 > 192.168.43.147.7772: UDP, length 120
02:40:40.136741 IP 192.168.43.147.8880 > 192.168.43.124.7773: UDP, length 120
02:40:40.186505 IP 192.168.43.146.8880 > 192.168.43.147.7772: UDP, length 120
02:40:40.186743 IP 192.168.43.147.8880 > 192.168.43.124.7773: UDP, length 120
02:40:40.214123 IP 192.168.43.146.8880 > 192.168.43.147.7772: UDP, length 120
02:40:40.236747 IP 192.168.43.147.8880 > 192.168.43.124.7773: UDP, length 120
02:40:40.265165 IP 192.168.43.146.8880 > 192.168.43.147.7772: UDP, length 120
02:40:40.286744 IP 192.168.43.147.8880 > 192.168.43.124.7773: UDP, length 120
02:40:40.314253 IP 192.168.43.146.8880 > 192.168.43.147.7772: UDP, length 120
02:40:40.336745 IP 192.168.43.147.8880 > 192.168.43.124.7773: UDP, length 120
02:40:40.386740 IP 192.168.43.147.8880 > 192.168.43.124.7773: UDP, length 120
02:40:40.389982 IP 192.168.43.146.8880 > 192.168.43.147.7772: UDP, length 120
02:40:40.400923 IP 192.168.43.146.8880 > 192.168.43.147.7772: UDP, length 120
02:40:40.436744 IP 192.168.43.147.8880 > 192.168.43.124.7773: UDP, length 120
02:40:40.486742 IP 192.168.43.147.8880 > 192.168.43.124.7773: UDP, length 120
02:40:40.495682 IP 192.168.43.146.8880 > 192.168.43.147.7772: UDP, length 120
02:40:40.515971 IP 192.168.43.146.8880 > 192.168.43.147.7772: UDP, length 120
02:40:40.536747 IP 192.168.43.147.8880 > 192.168.43.124.7773: UDP, length 120
02:40:40.586744 IP 192.168.43.147.8880 > 192.168.43.124.7773: UDP, length 120
02:40:40.593063 IP 192.168.43.146.8880 > 192.168.43.147.7772: UDP, length 120
02:40:40.623702 IP 192.168.43.146.8880 > 192.168.43.147.7772: UDP, length 120
02:40:40.636752 IP 192.168.43.147.8880 > 192.168.43.124.7773: UDP, length 120
02:40:40.686742 IP 192.168.43.147.8880 > 192.168.43.124.7773: UDP, length 120
02:40:40.728790 IP 192.168.43.146.8880 > 192.168.43.147.7772: UDP, length 120
02:40:40.728929 IP 192.168.43.146.8880 > 192.168.43.147.7772: UDP, length 120
02:40:40.736742 IP 192.168.43.147.8880 > 192.168.43.124.7773: UDP, length 120
02:40:40.767330 IP 192.168.43.146.8880 > 192.168.43.147.7772: UDP, length 120
02:40:40.786740 IP 192.168.43.147.8880 > 192.168.43.124.7773: UDP, length 120
02:40:40.828468 IP 192.168.43.146.8880 > 192.168.43.147.7772: UDP, length 120
02:40:40.836741 IP 192.168.43.147.8880 > 192.168.43.124.7773: UDP, length 120
02:40:40.886740 IP 192.168.43.147.8880 > 192.168.43.124.7773: UDP, length 120
02:40:40.910700 IP 192.168.43.146.8880 > 192.168.43.147.7772: UDP, length 120
02:40:40.932419 IP 192.168.43.146.8880 > 192.168.43.147.7772: UDP, length 120
02:40:40.936745 IP 192.168.43.147.8880 > 192.168.43.124.7773: UDP, length 120
02:40:40.976027 IP 192.168.43.146.8880 > 192.168.43.147.7772: UDP, length 120
02:40:40.986741 IP 192.168.43.147.8880 > 192.168.43.124.7773: UDP, length 120
02:40:41.031347 IP 192.168.43.146.8880 > 192.168.43.147.7772: UDP, length 120
02:40:41.036744 IP 192.168.43.147.8880 > 192.168.43.124.7773: UDP, length 120
02:40:41.086738 IP 192.168.43.147.8880 > 192.168.43.124.7773: UDP, length 120
02:40:41.099714 IP 192.168.43.146.8880 > 192.168.43.147.7772: UDP, length 120
02:40:41.136546 IP 192.168.43.146.8880 > 192.168.43.147.7772: UDP, length 120
02:40:41.136741 IP 192.168.43.147.8880 > 192.168.43.124.7773: UDP, length 120
02:40:41.186741 IP 192.168.43.147.8880 > 192.168.43.124.7773: UDP, length 120
02:40:41.210548 IP 192.168.43.146.8880 > 192.168.43.147.7772: UDP, length 120
02:40:41.224251 IP 192.168.43.146.8880 > 192.168.43.147.7772: UDP, length 120
02:40:41.236742 IP 192.168.43.147.8880 > 192.168.43.124.7773: UDP, length 120
02:40:41.286747 IP 192.168.43.147.8880 > 192.168.43.124.7773: UDP, length 120
02:40:41.304990 IP 192.168.43.146.8880 > 192.168.43.147.7772: UDP, length 120
02:40:41.336746 IP 192.168.43.147.8880 > 192.168.43.124.7773: UDP, length 120
02:40:41.339037 IP 192.168.43.146.8880 > 192.168.43.147.7772: UDP, length 120
02:40:41.356162 IP 192.168.43.146.8880 > 192.168.43.147.7772: UDP, length 120
02:40:41.386744 IP 192.168.43.147.8880 > 192.168.43.124.7773: UDP, length 120
02:40:41.436740 IP 192.168.43.147.8880 > 192.168.43.124.7773: UDP, length 120
02:40:41.439980 IP 192.168.43.146.8880 > 192.168.43.147.7772: UDP, length 120
02:40:41.454866 IP 192.168.43.146.8880 > 192.168.43.147.7772: UDP, length 120
02:40:41.486742 IP 192.168.43.147.8880 > 192.168.43.124.7773: UDP, length 120
02:40:41.512278 IP 192.168.43.146.8880 > 192.168.43.147.7772: UDP, length 120
02:40:41.536768 IP 192.168.43.147.8880 > 192.168.43.124.7773: UDP, length 120
02:40:41.586746 IP 192.168.43.147.8880 > 192.168.43.124.7773: UDP, length 120
02:40:41.614238 IP 192.168.43.146.8880 > 192.168.43.147.7772: UDP, length 120
02:40:41.636765 IP 192.168.43.147.8880 > 192.168.43.124.7773: UDP, length 120
02:40:41.646310 IP 192.168.43.146.8880 > 192.168.43.147.7772: UDP, length 120
02:40:41.660479 IP 192.168.43.146.8880 > 192.168.43.147.7772: UDP, length 120
02:40:41.686752 IP 192.168.43.147.8880 > 192.168.43.124.7773: UDP, length 120
02:40:41.703009 IP 192.168.43.146.8880 > 192.168.43.147.7772: UDP, length 120
02:40:41.736743 IP 192.168.43.147.8880 > 192.168.43.124.7773: UDP, length 120
02:40:41.754686 IP 192.168.43.146.8880 > 192.168.43.147.7772: UDP, length 120
02:40:41.786743 IP 192.168.43.147.8880 > 192.168.43.124.7773: UDP, length 120
02:40:41.801936 IP 192.168.43.146.8880 > 192.168.43.147.7772: UDP, length 120
02:40:41.836741 IP 192.168.43.147.8880 > 192.168.43.124.7773: UDP, length 120
02:40:41.853045 IP 192.168.43.146.8880 > 192.168.43.147.7772: UDP, length 120
02:40:41.886741 IP 192.168.43.147.8880 > 192.168.43.124.7773: UDP, length 120
02:40:41.902364 IP 192.168.43.146.8880 > 192.168.43.147.7772: UDP, length 120
02:40:41.936768 IP 192.168.43.147.8880 > 192.168.43.124.7773: UDP, length 120
02:40:41.954304 IP 192.168.43.146.8880 > 192.168.43.147.7772: UDP, length 120
02:40:41.986765 IP 192.168.43.147.8880 > 192.168.43.124.7773: UDP, length 120
02:40:42.006582 IP 192.168.43.146.8880 > 192.168.43.147.7772: UDP, length 120
02:40:42.036766 IP 192.168.43.147.8880 > 192.168.43.124.7773: UDP, length 120
02:40:42.055173 IP 192.168.43.146.8880 > 192.168.43.147.7772: UDP, length 120
02:40:42.086766 IP 192.168.43.147.8880 > 192.168.43.124.7773: UDP, length 120
02:40:42.100755 IP 192.168.43.146.8880 > 192.168.43.147.7772: UDP, length 120
