01:09:31.211919 IP 192.168.43.146.8880 > 192.168.43.147.7772: UDP, length 120
01:09:31.261955 IP 192.168.43.146.8880 > 192.168.43.147.7772: UDP, length 120
01:09:31.311954 IP 192.168.43.146.8880 > 192.168.43.147.7772: UDP, length 120
01:09:31.361943 IP 192.168.43.146.8880 > 192.168.43.147.7772: UDP, length 120
01:09:31.411941 IP 192.168.43.146.8880 > 192.168.43.147.7772: UDP, length 120
01:09:31.461992 IP 192.168.43.146.8880 > 192.168.43.147.7772: UDP, length 120
01:09:31.511946 IP 192.168.43.146.8880 > 192.168.43.147.7772: UDP, length 120
01:09:31.561944 IP 192.168.43.146.8880 > 192.168.43.147.7772: UDP, length 120
01:09:31.611940 IP 192.168.43.146.8880 > 192.168.43.147.7772: UDP, length 120
01:09:31.661939 IP 192.168.43.146.8880 > 192.168.43.147.7772: UDP, length 120
01:09:31.711939 IP 192.168.43.146.8880 > 192.168.43.147.7772: UDP, length 120
01:09:31.761944 IP 192.168.43.146.8880 > 192.168.43.147.7772: UDP, length 120
01:09:31.811943 IP 192.168.43.146.8880 > 192.168.43.147.7772: UDP, length 120
01:09:31.861938 IP 192.168.43.146.8880 > 192.168.43.147.7772: UDP, length 120
01:09:31.911942 IP 192.168.43.146.8880 > 192.168.43.147.7772: UDP, length 120
01:09:31.961941 IP 192.168.43.146.8880 > 192.168.43.147.7772: UDP, length 120
01:09:32.011940 IP 192.168.43.146.8880 > 192.168.43.147.7772: UDP, length 120
01:09:32.061941 IP 192.168.43.146.8880 > 192.168.43.147.7772: UDP, length 120
01:09:32.111955 IP 192.168.43.146.8880 > 192.168.43.147.7772: UDP, length 120
01:09:32.161980 IP 192.168.43.146.8880 > 192.168.43.147.7772: UDP, length 120
01:09:32.211945 IP 192.168.43.146.8880 > 192.168.43.147.7772: UDP, length 120
01:09:32.261941 IP 192.168.43.146.8880 > 192.168.43.147.7772: UDP, length 120
01:09:32.311943 IP 192.168.43.146.8880 > 192.168.43.147.7772: UDP, length 120
01:09:32.361942 IP 192.168.43.146.8880 > 192.168.43.147.7772: UDP, length 120
01:09:32.411939 IP 192.168.43.146.8880 > 192.168.43.147.7772: UDP, length 120
01:09:32.461991 IP 192.168.43.146.8880 > 192.168.43.147.7772: UDP, length 120
01:09:32.511949 IP 192.168.43.146.8880 > 192.168.43.147.7772: UDP, length 120
01:09:32.561942 IP 192.168.43.146.8880 > 192.168.43.147.7772: UDP, length 120
01:09:32.611941 IP 192.168.43.146.8880 > 192.168.43.147.7772: UDP, length 120
01:09:32.661966 IP 192.168.43.146.8880 > 192.168.43.147.7772: UDP, length 120
01:09:32.711964 IP 192.168.43.146.8880 > 192.168.43.147.7772: UDP, length 120
01:09:32.761963 IP 192.168.43.146.8880 > 192.168.43.147.7772: UDP, length 120
01:09:32.811964 IP 192.168.43.146.8880 > 192.168.43.147.7772: UDP, length 120
01:09:32.861964 IP 192.168.43.146.8880 > 192.168.43.147.7772: UDP, length 120
01:09:32.911969 IP 192.168.43.146.8880 > 192.168.43.147.7772: UDP, length 120
01:09:32.961969 IP 192.168.43.146.8880 > 192.168.43.147.7772: UDP, length 120
01:09:33.011960 IP 192.168.43.146.8880 > 192.168.43.147.7772: UDP, length 120
01:09:33.061964 IP 192.168.43.146.8880 > 192.168.43.147.7772: UDP, length 120
01:09:33.111973 IP 192.168.43.146.8880 > 192.168.43.147.7772: UDP, length 120
01:09:33.161969 IP 192.168.43.146.8880 > 192.168.43.147.7772: UDP, length 120
01:09:33.211963 IP 192.168.43.146.8880 > 192.168.43.147.7772: UDP, length 120
01:09:33.261965 IP 192.168.43.146.8880 > 192.168.43.147.7772: UDP, length 120
01:09:33.311970 IP 192.168.43.146.8880 > 192.168.43.147.7772: UDP, length 120
01:09:33.361966 IP 192.168.43.146.8880 > 192.168.43.147.7772: UDP, length 120
01:09:33.411963 IP 192.168.43.146.8880 > 192.168.43.147.7772: UDP, length 120
01:09:33.462032 IP 192.168.43.146.8880 > 192.168.43.147.7772: UDP, length 120
01:09:33.511976 IP 192.168.43.146.8880 > 192.168.43.147.7772: UDP, length 120
01:09:33.561966 IP 192.168.43.146.8880 > 192.168.43.147.7772: UDP, length 120
01:09:33.611965 IP 192.168.43.146.8880 > 192.168.43.147.7772: UDP, length 120
01:09:33.662016 IP 192.168.43.146.8880 > 192.168.43.147.7772: UDP, length 120
01:09:33.711991 IP 192.168.43.146.8880 > 192.168.43.147.7772: UDP, length 120
01:09:33.761966 IP 192.168.43.146.8880 > 192.168.43.147.7772: UDP, length 120
01:09:33.812477 IP 192.168.43.146.8880 > 192.168.43.147.7772: UDP, length 120
01:09:33.862076 IP 192.168.43.146.8880 > 192.168.43.147.7772: UDP, length 120
01:09:33.912052 IP 192.168.43.146.8880 > 192.168.43.147.7772: UDP, length 120
01:09:33.961989 IP 192.168.43.146.8880 > 192.168.43.147.7772: UDP, length 120
01:09:34.012030 IP 192.168.43.146.8880 > 192.168.43.147.7772: UDP, length 120
01:09:34.062021 IP 192.168.43.146.8880 > 192.168.43.147.7772: UDP, length 120
01:09:34.112022 IP 192.168.43.146.8880 > 192.168.43.147.7772: UDP, length 120
01:09:34.162029 IP 192.168.43.146.8880 > 192.168.43.147.7772: UDP, length 120
01:09:34.212027 IP 192.168.43.146.8880 > 192.168.43.147.7772: UDP, length 120
01:09:34.261992 IP 192.168.43.146.8880 > 192.168.43.147.7772: UDP, length 120
01:09:34.311958 IP 192.168.43.146.8880 > 192.168.43.147.7772: UDP, length 120
01:09:34.361944 IP 192.168.43.146.8880 > 192.168.43.147.7772: UDP, length 120
01:09:34.411943 IP 192.168.43.146.8880 > 192.168.43.147.7772: UDP, length 120
01:09:34.461987 IP 192.168.43.146.8880 > 192.168.43.147.7772: UDP, length 120
01:09:34.511947 IP 192.168.43.146.8880 > 192.168.43.147.7772: UDP, length 120
01:09:34.561940 IP 192.168.43.146.8880 > 192.168.43.147.7772: UDP, length 120
01:09:34.611941 IP 192.168.43.146.8880 > 192.168.43.147.7772: UDP, length 120
01:09:34.661939 IP 192.168.43.146.8880 > 192.168.43.147.7772: UDP, length 120
01:09:34.711942 IP 192.168.43.146.8880 > 192.168.43.147.7772: UDP, length 120
01:09:34.761937 IP 192.168.43.146.8880 > 192.168.43.147.7772: UDP, length 120
01:09:34.811942 IP 192.168.43.146.8880 > 192.168.43.147.7772: UDP, length 120
01:09:34.861939 IP 192.168.43.146.8880 > 192.168.43.147.7772: UDP, length 120
01:09:34.911941 IP 192.168.43.146.8880 > 192.168.43.147.7772: UDP, length 120
01:09:34.961943 IP 192.168.43.146.8880 > 192.168.43.147.7772: UDP, length 120
01:09:35.011943 IP 192.168.43.146.8880 > 192.168.43.147.7772: UDP, length 120
01:09:35.061941 IP 192.168.43.146.8880 > 192.168.43.147.7772: UDP, length 120
01:09:35.111939 IP 192.168.43.146.8880 > 192.168.43.147.7772: UDP, length 120
01:09:35.161982 IP 192.168.43.146.8880 > 192.168.43.147.7772: UDP, length 120
01:09:35.211961 IP 192.168.43.146.8880 > 192.168.43.147.7772: UDP, length 120
01:09:35.261950 IP 192.168.43.146.8880 > 192.168.43.147.7772: UDP, length 120
01:09:35.311949 IP 192.168.43.146.8880 > 192.168.43.147.7772: UDP, length 120
01:09:35.361949 IP 192.168.43.146.8880 > 192.168.43.147.7772: UDP, length 120
01:09:35.411944 IP 192.168.43.146.8880 > 192.168.43.147.7772: UDP, length 120
01:09:35.461939 IP 192.168.43.146.8880 > 192.168.43.147.7772: UDP, length 120
01:09:35.511939 IP 192.168.43.146.8880 > 192.168.43.147.7772: UDP, length 120
01:09:35.561941 IP 192.168.43.146.8880 > 192.168.43.147.7772: UDP, length 120
01:09:35.611940 IP 192.168.43.146.8880 > 192.168.43.147.7772: UDP, length 120
01:09:35.661953 IP 192.168.43.146.8880 > 192.168.43.147.7772: UDP, length 120
01:09:35.711943 IP 192.168.43.146.8880 > 192.168.43.147.7772: UDP, length 120
01:09:35.761943 IP 192.168.43.146.8880 > 192.168.43.147.7772: UDP, length 120
01:09:35.811942 IP 192.168.43.146.8880 > 192.168.43.147.7772: UDP, length 120
01:09:35.821414 IP 192.168.43.124.8880 > 192.168.43.146.7771: UDP, length 120
01:09:35.861944 IP 192.168.43.146.8880 > 192.168.43.147.7772: UDP, length 120
01:09:35.874301 IP 192.168.43.124.8880 > 192.168.43.146.7771: UDP, length 120
01:09:35.911944 IP 192.168.43.146.8880 > 192.168.43.147.7772: UDP, length 120
01:09:35.923233 IP 192.168.43.124.8880 > 192.168.43.146.7771: UDP, length 120
01:09:35.961941 IP 192.168.43.146.8880 > 192.168.43.147.7772: UDP, length 120
01:09:35.973488 IP 192.168.43.124.8880 > 192.168.43.146.7771: UDP, length 120
01:09:36.011940 IP 192.168.43.146.8880 > 192.168.43.147.7772: UDP, length 120
01:09:36.021578 IP 192.168.43.124.8880 > 192.168.43.146.7771: UDP, length 120
01:09:36.061939 IP 192.168.43.146.8880 > 192.168.43.147.7772: UDP, length 120
01:09:36.072035 IP 192.168.43.124.8880 > 192.168.43.146.7771: UDP, length 120
01:09:36.111941 IP 192.168.43.146.8880 > 192.168.43.147.7772: UDP, length 120
01:09:36.123214 IP 192.168.43.124.8880 > 192.168.43.146.7771: UDP, length 120
01:09:36.161941 IP 192.168.43.146.8880 > 192.168.43.147.7772: UDP, length 120
01:09:36.173203 IP 192.168.43.124.8880 > 192.168.43.146.7771: UDP, length 120
01:09:36.211939 IP 192.168.43.146.8880 > 192.168.43.147.7772: UDP, length 120
01:09:36.225592 IP 192.168.43.124.8880 > 192.168.43.146.7771: UDP, length 120
01:09:36.261951 IP 192.168.43.146.8880 > 192.168.43.147.7772: UDP, length 120
01:09:36.273600 IP 192.168.43.124.8880 > 192.168.43.146.7771: UDP, length 120
01:09:36.311964 IP 192.168.43.146.8880 > 192.168.43.147.7772: UDP, length 120
01:09:36.321957 IP 192.168.43.124.8880 > 192.168.43.146.7771: UDP, length 120
01:09:36.361948 IP 192.168.43.146.8880 > 192.168.43.147.7772: UDP, length 120
01:09:36.373212 IP 192.168.43.124.8880 > 192.168.43.146.7771: UDP, length 120
01:09:36.411950 IP 192.168.43.146.8880 > 192.168.43.147.7772: UDP, length 120
01:09:36.445836 IP 192.168.43.124.8880 > 192.168.43.146.7771: UDP, length 120
01:09:36.462021 IP 192.168.43.146.8880 > 192.168.43.147.7772: UDP, length 120
01:09:36.471622 IP 192.168.43.124.8880 > 192.168.43.146.7771: UDP, length 120
01:09:36.512011 IP 192.168.43.146.8880 > 192.168.43.147.7772: UDP, length 120
01:09:36.524815 IP 192.168.43.124.8880 > 192.168.43.146.7771: UDP, length 120
01:09:36.561996 IP 192.168.43.146.8880 > 192.168.43.147.7772: UDP, length 120
01:09:36.573256 IP 192.168.43.124.8880 > 192.168.43.146.7771: UDP, length 120
01:09:36.611960 IP 192.168.43.146.8880 > 192.168.43.147.7772: UDP, length 120
01:09:36.624439 IP 192.168.43.124.8880 > 192.168.43.146.7771: UDP, length 120
01:09:36.661983 IP 192.168.43.146.8880 > 192.168.43.147.7772: UDP, length 120
01:09:36.675387 IP 192.168.43.124.8880 > 192.168.43.146.7771: UDP, length 120
01:09:36.711968 IP 192.168.43.146.8880 > 192.168.43.147.7772: UDP, length 120
01:09:36.721839 IP 192.168.43.124.8880 > 192.168.43.146.7771: UDP, length 120
01:09:36.761941 IP 192.168.43.146.8880 > 192.168.43.147.7772: UDP, length 120
01:09:36.773949 IP 192.168.43.124.8880 > 192.168.43.146.7771: UDP, length 120
01:09:36.811958 IP 192.168.43.146.8880 > 192.168.43.147.7772: UDP, length 120
01:09:36.825880 IP 192.168.43.124.8880 > 192.168.43.146.7771: UDP, length 120
01:09:36.861961 IP 192.168.43.146.8880 > 192.168.43.147.7772: UDP, length 120
01:09:36.873855 IP 192.168.43.124.8880 > 192.168.43.146.7771: UDP, length 120
01:09:36.911959 IP 192.168.43.146.8880 > 192.168.43.147.7772: UDP, length 120
01:09:36.921711 IP 192.168.43.124.8880 > 192.168.43.146.7771: UDP, length 120
01:09:36.961944 IP 192.168.43.146.8880 > 192.168.43.147.7772: UDP, length 120
01:09:36.972612 IP 192.168.43.124.8880 > 192.168.43.146.7771: UDP, length 120
01:09:37.011943 IP 192.168.43.146.8880 > 192.168.43.147.7772: UDP, length 120
01:09:37.023202 IP 192.168.43.124.8880 > 192.168.43.146.7771: UDP, length 120
01:09:37.061941 IP 192.168.43.146.8880 > 192.168.43.147.7772: UDP, length 120
01:09:37.073511 IP 192.168.43.124.8880 > 192.168.43.146.7771: UDP, length 120
01:09:37.111942 IP 192.168.43.146.8880 > 192.168.43.147.7772: UDP, length 120
01:09:37.123026 IP 192.168.43.124.8880 > 192.168.43.146.7771: UDP, length 120
01:09:37.161942 IP 192.168.43.146.8880 > 192.168.43.147.7772: UDP, length 120
01:09:37.174806 IP 192.168.43.124.8880 > 192.168.43.146.7771: UDP, length 120
01:09:37.211941 IP 192.168.43.146.8880 > 192.168.43.147.7772: UDP, length 120
01:09:37.223039 IP 192.168.43.124.8880 > 192.168.43.146.7771: UDP, length 120
01:09:37.261941 IP 192.168.43.146.8880 > 192.168.43.147.7772: UDP, length 120
01:09:37.274038 IP 192.168.43.124.8880 > 192.168.43.146.7771: UDP, length 120
01:09:37.311955 IP 192.168.43.146.8880 > 192.168.43.147.7772: UDP, length 120
01:09:37.323204 IP 192.168.43.124.8880 > 192.168.43.146.7771: UDP, length 120
01:09:37.361953 IP 192.168.43.146.8880 > 192.168.43.147.7772: UDP, length 120
01:09:37.371368 IP 192.168.43.124.8880 > 192.168.43.146.7771: UDP, length 120
01:09:37.411950 IP 192.168.43.146.8880 > 192.168.43.147.7772: UDP, length 120
01:09:37.422613 IP 192.168.43.124.8880 > 192.168.43.146.7771: UDP, length 120
01:09:37.461943 IP 192.168.43.146.8880 > 192.168.43.147.7772: UDP, length 120
01:09:37.471836 IP 192.168.43.124.8880 > 192.168.43.146.7771: UDP, length 120
01:09:37.511945 IP 192.168.43.146.8880 > 192.168.43.147.7772: UDP, length 120
01:09:37.531248 IP 192.168.43.124.8880 > 192.168.43.146.7771: UDP, length 120
01:09:37.562004 IP 192.168.43.146.8880 > 192.168.43.147.7772: UDP, length 120
01:09:37.589316 IP 192.168.43.124.8880 > 192.168.43.146.7771: UDP, length 120
01:09:37.611982 IP 192.168.43.146.8880 > 192.168.43.147.7772: UDP, length 120
01:09:37.621456 IP 192.168.43.124.8880 > 192.168.43.146.7771: UDP, length 120
01:09:37.661978 IP 192.168.43.146.8880 > 192.168.43.147.7772: UDP, length 120
01:09:37.671385 IP 192.168.43.124.8880 > 192.168.43.146.7771: UDP, length 120
01:09:37.711972 IP 192.168.43.146.8880 > 192.168.43.147.7772: UDP, length 120
01:09:37.725775 IP 192.168.43.124.8880 > 192.168.43.146.7771: UDP, length 120
01:09:37.761971 IP 192.168.43.146.8880 > 192.168.43.147.7772: UDP, length 120
01:09:37.780775 IP 192.168.43.124.8880 > 192.168.43.146.7771: UDP, length 120
01:09:37.811965 IP 192.168.43.146.8880 > 192.168.43.147.7772: UDP, length 120
01:09:37.840285 IP 192.168.43.124.8880 > 192.168.43.146.7771: UDP, length 120
01:09:37.861964 IP 192.168.43.146.8880 > 192.168.43.147.7772: UDP, length 120
01:09:37.871502 IP 192.168.43.124.8880 > 192.168.43.146.7771: UDP, length 120
01:09:37.911969 IP 192.168.43.146.8880 > 192.168.43.147.7772: UDP, length 120
01:09:37.922427 IP 192.168.43.124.8880 > 192.168.43.146.7771: UDP, length 120
01:09:37.961969 IP 192.168.43.146.8880 > 192.168.43.147.7772: UDP, length 120
01:09:37.971414 IP 192.168.43.124.8880 > 192.168.43.146.7771: UDP, length 120
01:09:38.011970 IP 192.168.43.146.8880 > 192.168.43.147.7772: UDP, length 120
01:09:38.024076 IP 192.168.43.124.8880 > 192.168.43.146.7771: UDP, length 120
01:09:38.061968 IP 192.168.43.146.8880 > 192.168.43.147.7772: UDP, length 120
01:09:38.079164 IP 192.168.43.124.8880 > 192.168.43.146.7771: UDP, length 120
01:09:38.111965 IP 192.168.43.146.8880 > 192.168.43.147.7772: UDP, length 120
01:09:38.127186 IP 192.168.43.124.8880 > 192.168.43.146.7771: UDP, length 120
01:09:38.161969 IP 192.168.43.146.8880 > 192.168.43.147.7772: UDP, length 120
01:09:38.171826 IP 192.168.43.124.8880 > 192.168.43.146.7771: UDP, length 120
01:09:38.212004 IP 192.168.43.146.8880 > 192.168.43.147.7772: UDP, length 120
01:09:38.229346 IP 192.168.43.124.8880 > 192.168.43.146.7771: UDP, length 120
01:09:38.261970 IP 192.168.43.146.8880 > 192.168.43.147.7772: UDP, length 120
01:09:38.286248 IP 192.168.43.124.8880 > 192.168.43.146.7771: UDP, length 120
01:09:38.311982 IP 192.168.43.146.8880 > 192.168.43.147.7772: UDP, length 120
01:09:38.340287 IP 192.168.43.124.8880 > 192.168.43.146.7771: UDP, length 120
01:09:38.361970 IP 192.168.43.146.8880 > 192.168.43.147.7772: UDP, length 120
01:09:38.373489 IP 192.168.43.124.8880 > 192.168.43.146.7771: UDP, length 120
01:09:38.411976 IP 192.168.43.146.8880 > 192.168.43.147.7772: UDP, length 120
01:09:38.423709 IP 192.168.43.124.8880 > 192.168.43.146.7771: UDP, length 120
01:09:38.461968 IP 192.168.43.146.8880 > 192.168.43.147.7772: UDP, length 120
01:09:38.471815 IP 192.168.43.124.8880 > 192.168.43.146.7771: UDP, length 120
01:09:38.511970 IP 192.168.43.146.8880 > 192.168.43.147.7772: UDP, length 120
01:09:38.529441 IP 192.168.43.124.8880 > 192.168.43.146.7771: UDP, length 120
01:09:38.561971 IP 192.168.43.146.8880 > 192.168.43.147.7772: UDP, length 120
01:09:38.587069 IP 192.168.43.124.8880 > 192.168.43.146.7771: UDP, length 120
01:09:38.612031 IP 192.168.43.146.8880 > 192.168.43.147.7772: UDP, length 120
01:09:38.621502 IP 192.168.43.124.8880 > 192.168.43.146.7771: UDP, length 120
01:09:38.661979 IP 192.168.43.146.8880 > 192.168.43.147.7772: UDP, length 120
01:09:38.673279 IP 192.168.43.124.8880 > 192.168.43.146.7771: UDP, length 120
01:09:38.711973 IP 192.168.43.146.8880 > 192.168.43.147.7772: UDP, length 120
01:09:38.723793 IP 192.168.43.124.8880 > 192.168.43.146.7771: UDP, length 120
01:09:38.761968 IP 192.168.43.146.8880 > 192.168.43.147.7772: UDP, length 120
01:09:38.771887 IP 192.168.43.124.8880 > 192.168.43.146.7771: UDP, length 120
01:09:38.811964 IP 192.168.43.146.8880 > 192.168.43.147.7772: UDP, length 120
01:09:38.826668 IP 192.168.43.124.8880 > 192.168.43.146.7771: UDP, length 120
01:09:38.861966 IP 192.168.43.146.8880 > 192.168.43.147.7772: UDP, length 120
01:09:38.881763 IP 192.168.43.124.8880 > 192.168.43.146.7771: UDP, length 120
01:09:38.911967 IP 192.168.43.146.8880 > 192.168.43.147.7772: UDP, length 120
01:09:38.939668 IP 192.168.43.124.8880 > 192.168.43.146.7771: UDP, length 120
01:09:38.961966 IP 192.168.43.146.8880 > 192.168.43.147.7772: UDP, length 120
01:09:38.986614 IP 192.168.43.124.8880 > 192.168.43.146.7771: UDP, length 120
01:09:39.011966 IP 192.168.43.146.8880 > 192.168.43.147.7772: UDP, length 120
01:09:39.021581 IP 192.168.43.124.8880 > 192.168.43.146.7771: UDP, length 120
01:09:39.061968 IP 192.168.43.146.8880 > 192.168.43.147.7772: UDP, length 120
01:09:39.071543 IP 192.168.43.124.8880 > 192.168.43.146.7771: UDP, length 120
01:09:39.111967 IP 192.168.43.146.8880 > 192.168.43.147.7772: UDP, length 120
01:09:39.121976 IP 192.168.43.124.8880 > 192.168.43.146.7771: UDP, length 120
01:09:39.161971 IP 192.168.43.146.8880 > 192.168.43.147.7772: UDP, length 120
01:09:39.179185 IP 192.168.43.124.8880 > 192.168.43.146.7771: UDP, length 120
01:09:39.211967 IP 192.168.43.146.8880 > 192.168.43.147.7772: UDP, length 120
01:09:39.238954 IP 192.168.43.124.8880 > 192.168.43.146.7771: UDP, length 120
01:09:39.262034 IP 192.168.43.146.8880 > 192.168.43.147.7772: UDP, length 120
01:09:39.274349 IP 192.168.43.124.8880 > 192.168.43.146.7771: UDP, length 120
01:09:39.312048 IP 192.168.43.146.8880 > 192.168.43.147.7772: UDP, length 120
01:09:39.321490 IP 192.168.43.124.8880 > 192.168.43.146.7771: UDP, length 120
01:09:39.362018 IP 192.168.43.146.8880 > 192.168.43.147.7772: UDP, length 120
01:09:39.372316 IP 192.168.43.124.8880 > 192.168.43.146.7771: UDP, length 120
01:09:39.412006 IP 192.168.43.146.8880 > 192.168.43.147.7772: UDP, length 120
01:09:39.427857 IP 192.168.43.124.8880 > 192.168.43.146.7771: UDP, length 120
01:09:39.462024 IP 192.168.43.146.8880 > 192.168.43.147.7772: UDP, length 120
01:09:39.486179 IP 192.168.43.124.8880 > 192.168.43.146.7771: UDP, length 120
01:09:39.511992 IP 192.168.43.146.8880 > 192.168.43.147.7772: UDP, length 120
01:09:39.541865 IP 192.168.43.124.8880 > 192.168.43.146.7771: UDP, length 120
01:09:39.562025 IP 192.168.43.146.8880 > 192.168.43.147.7772: UDP, length 120
01:09:39.571522 IP 192.168.43.124.8880 > 192.168.43.146.7771: UDP, length 120
01:09:39.612018 IP 192.168.43.146.8880 > 192.168.43.147.7772: UDP, length 120
01:09:39.621439 IP 192.168.43.124.8880 > 192.168.43.146.7771: UDP, length 120
01:09:39.662020 IP 192.168.43.146.8880 > 192.168.43.147.7772: UDP, length 120
01:09:39.673057 IP 192.168.43.124.8880 > 192.168.43.146.7771: UDP, length 120
01:09:39.711987 IP 192.168.43.146.8880 > 192.168.43.147.7772: UDP, length 120
01:09:39.729600 IP 192.168.43.124.8880 > 192.168.43.146.7771: UDP, length 120
01:09:39.761946 IP 192.168.43.146.8880 > 192.168.43.147.7772: UDP, length 120
01:09:39.786436 IP 192.168.43.124.8880 > 192.168.43.146.7771: UDP, length 120
01:09:39.811945 IP 192.168.43.146.8880 > 192.168.43.147.7772: UDP, length 120
01:09:39.821320 IP 192.168.43.124.8880 > 192.168.43.146.7771: UDP, length 120
01:09:39.861941 IP 192.168.43.146.8880 > 192.168.43.147.7772: UDP, length 120
01:09:39.873116 IP 192.168.43.124.8880 > 192.168.43.146.7771: UDP, length 120
01:09:39.911941 IP 192.168.43.146.8880 > 192.168.43.147.7772: UDP, length 120
01:09:39.922038 IP 192.168.43.124.8880 > 192.168.43.146.7771: UDP, length 120
01:09:39.961941 IP 192.168.43.146.8880 > 192.168.43.147.7772: UDP, length 120
01:09:39.975570 IP 192.168.43.124.8880 > 192.168.43.146.7771: UDP, length 120
01:09:40.011941 IP 192.168.43.146.8880 > 192.168.43.147.7772: UDP, length 120
01:09:40.030928 IP 192.168.43.124.8880 > 192.168.43.146.7771: UDP, length 120
01:09:40.061941 IP 192.168.43.146.8880 > 192.168.43.147.7772: UDP, length 120
01:09:40.072738 IP 192.168.43.124.8880 > 192.168.43.146.7771: UDP, length 120
01:09:40.111947 IP 192.168.43.146.8880 > 192.168.43.147.7772: UDP, length 120
01:09:40.121361 IP 192.168.43.124.8880 > 192.168.43.146.7771: UDP, length 120
01:09:40.161941 IP 192.168.43.146.8880 > 192.168.43.147.7772: UDP, length 120
01:09:40.174074 IP 192.168.43.124.8880 > 192.168.43.146.7771: UDP, length 120
01:09:40.211942 IP 192.168.43.146.8880 > 192.168.43.147.7772: UDP, length 120
01:09:40.222269 IP 192.168.43.124.8880 > 192.168.43.146.7771: UDP, length 120
01:09:40.261941 IP 192.168.43.146.8880 > 192.168.43.147.7772: UDP, length 120
01:09:40.287713 IP 192.168.43.124.8880 > 192.168.43.146.7771: UDP, length 120
01:09:40.311954 IP 192.168.43.146.8880 > 192.168.43.147.7772: UDP, length 120
01:09:40.321682 IP 192.168.43.124.8880 > 192.168.43.146.7771: UDP, length 120
01:09:40.361942 IP 192.168.43.146.8880 > 192.168.43.147.7772: UDP, length 120
01:09:40.379262 IP 192.168.43.124.8880 > 192.168.43.146.7771: UDP, length 120
01:09:40.411941 IP 192.168.43.146.8880 > 192.168.43.147.7772: UDP, length 120
01:09:40.436929 IP 192.168.43.124.8880 > 192.168.43.146.7771: UDP, length 120
01:09:40.461940 IP 192.168.43.146.8880 > 192.168.43.147.7772: UDP, length 120
01:09:40.471959 IP 192.168.43.124.8880 > 192.168.43.146.7771: UDP, length 120
01:09:40.511948 IP 192.168.43.146.8880 > 192.168.43.147.7772: UDP, length 120
01:09:40.523860 IP 192.168.43.124.8880 > 192.168.43.146.7771: UDP, length 120
01:09:40.561947 IP 192.168.43.146.8880 > 192.168.43.147.7772: UDP, length 120
01:09:40.571474 IP 192.168.43.124.8880 > 192.168.43.146.7771: UDP, length 120
01:09:40.612002 IP 192.168.43.146.8880 > 192.168.43.147.7772: UDP, length 120
01:09:40.639983 IP 192.168.43.124.8880 > 192.168.43.146.7771: UDP, length 120
01:09:40.661954 IP 192.168.43.146.8880 > 192.168.43.147.7772: UDP, length 120
01:09:40.671613 IP 192.168.43.124.8880 > 192.168.43.146.7771: UDP, length 120
01:09:40.711949 IP 192.168.43.146.8880 > 192.168.43.147.7772: UDP, length 120
01:09:40.721381 IP 192.168.43.124.8880 > 192.168.43.146.7771: UDP, length 120
01:09:40.761943 IP 192.168.43.146.8880 > 192.168.43.147.7772: UDP, length 120
01:09:40.789839 IP 192.168.43.124.8880 > 192.168.43.146.7771: UDP, length 120
01:09:40.811939 IP 192.168.43.146.8880 > 192.168.43.147.7772: UDP, length 120
01:09:40.821925 IP 192.168.43.124.8880 > 192.168.43.146.7771: UDP, length 120
01:09:40.861940 IP 192.168.43.146.8880 > 192.168.43.147.7772: UDP, length 120
01:09:40.871453 IP 192.168.43.124.8880 > 192.168.43.146.7771: UDP, length 120
01:09:40.911944 IP 192.168.43.146.8880 > 192.168.43.147.7772: UDP, length 120
01:09:40.922387 IP 192.168.43.124.8880 > 192.168.43.146.7771: UDP, length 120
01:09:40.961941 IP 192.168.43.146.8880 > 192.168.43.147.7772: UDP, length 120
01:09:40.981129 IP 192.168.43.124.8880 > 192.168.43.146.7771: UDP, length 120
01:09:41.011943 IP 192.168.43.146.8880 > 192.168.43.147.7772: UDP, length 120
01:09:41.022579 IP 192.168.43.124.8880 > 192.168.43.146.7771: UDP, length 120
01:09:41.061941 IP 192.168.43.146.8880 > 192.168.43.147.7772: UDP, length 120
01:09:41.071479 IP 192.168.43.124.8880 > 192.168.43.146.7771: UDP, length 120
01:09:41.111942 IP 192.168.43.146.8880 > 192.168.43.147.7772: UDP, length 120
01:09:41.121714 IP 192.168.43.124.8880 > 192.168.43.146.7771: UDP, length 120
01:09:41.161940 IP 192.168.43.146.8880 > 192.168.43.147.7772: UDP, length 120
01:09:41.171455 IP 192.168.43.124.8880 > 192.168.43.146.7771: UDP, length 120
01:09:41.211975 IP 192.168.43.146.8880 > 192.168.43.147.7772: UDP, length 120
01:09:41.246114 IP 192.168.43.124.8880 > 192.168.43.146.7771: UDP, length 120
01:09:41.261943 IP 192.168.43.146.8880 > 192.168.43.147.7772: UDP, length 120
01:09:41.271453 IP 192.168.43.124.8880 > 192.168.43.146.7771: UDP, length 120
01:09:41.311975 IP 192.168.43.146.8880 > 192.168.43.147.7772: UDP, length 120
01:09:41.331625 IP 192.168.43.124.8880 > 192.168.43.146.7771: UDP, length 120
01:09:41.361949 IP 192.168.43.146.8880 > 192.168.43.147.7772: UDP, length 120
01:09:41.390155 IP 192.168.43.124.8880 > 192.168.43.146.7771: UDP, length 120
01:09:41.411946 IP 192.168.43.146.8880 > 192.168.43.147.7772: UDP, length 120
01:09:41.421396 IP 192.168.43.124.8880 > 192.168.43.146.7771: UDP, length 120
01:09:41.461944 IP 192.168.43.146.8880 > 192.168.43.147.7772: UDP, length 120
01:09:41.471842 IP 192.168.43.124.8880 > 192.168.43.146.7771: UDP, length 120
01:09:41.511947 IP 192.168.43.146.8880 > 192.168.43.147.7772: UDP, length 120
01:09:41.546495 IP 192.168.43.124.8880 > 192.168.43.146.7771: UDP, length 120
01:09:41.561949 IP 192.168.43.146.8880 > 192.168.43.147.7772: UDP, length 120
01:09:41.573454 IP 192.168.43.124.8880 > 192.168.43.146.7771: UDP, length 120
01:09:41.612001 IP 192.168.43.146.8880 > 192.168.43.147.7772: UDP, length 120
01:09:41.621421 IP 192.168.43.124.8880 > 192.168.43.146.7771: UDP, length 120
01:09:41.661961 IP 192.168.43.146.8880 > 192.168.43.147.7772: UDP, length 120
01:09:41.685878 IP 192.168.43.124.8880 > 192.168.43.146.7771: UDP, length 120
01:09:41.711947 IP 192.168.43.146.8880 > 192.168.43.147.7772: UDP, length 120
01:09:41.721972 IP 192.168.43.124.8880 > 192.168.43.146.7771: UDP, length 120
01:09:41.761941 IP 192.168.43.146.8880 > 192.168.43.147.7772: UDP, length 120
01:09:41.771416 IP 192.168.43.124.8880 > 192.168.43.146.7771: UDP, length 120
01:09:41.811941 IP 192.168.43.146.8880 > 192.168.43.147.7772: UDP, length 120
01:09:41.839960 IP 192.168.43.124.8880 > 192.168.43.146.7771: UDP, length 120
01:09:41.861940 IP 192.168.43.146.8880 > 192.168.43.147.7772: UDP, length 120
01:09:41.871847 IP 192.168.43.124.8880 > 192.168.43.146.7771: UDP, length 120
01:09:41.911942 IP 192.168.43.146.8880 > 192.168.43.147.7772: UDP, length 120
01:09:41.921364 IP 192.168.43.124.8880 > 192.168.43.146.7771: UDP, length 120
01:09:41.961940 IP 192.168.43.146.8880 > 192.168.43.147.7772: UDP, length 120
01:09:41.989540 IP 192.168.43.124.8880 > 192.168.43.146.7771: UDP, length 120
01:09:42.011943 IP 192.168.43.146.8880 > 192.168.43.147.7772: UDP, length 120
01:09:42.023752 IP 192.168.43.124.8880 > 192.168.43.146.7771: UDP, length 120
01:09:42.061941 IP 192.168.43.146.8880 > 192.168.43.147.7772: UDP, length 120
01:09:42.071689 IP 192.168.43.124.8880 > 192.168.43.146.7771: UDP, length 120
01:09:42.111944 IP 192.168.43.146.8880 > 192.168.43.147.7772: UDP, length 120
01:09:42.143917 IP 192.168.43.124.8880 > 192.168.43.146.7771: UDP, length 120
01:09:42.161938 IP 192.168.43.146.8880 > 192.168.43.147.7772: UDP, length 120
01:09:42.171367 IP 192.168.43.124.8880 > 192.168.43.146.7771: UDP, length 120
01:09:42.211940 IP 192.168.43.146.8880 > 192.168.43.147.7772: UDP, length 120
01:09:42.223318 IP 192.168.43.124.8880 > 192.168.43.146.7771: UDP, length 120
01:09:42.261940 IP 192.168.43.146.8880 > 192.168.43.147.7772: UDP, length 120
01:09:42.292723 IP 192.168.43.124.8880 > 192.168.43.146.7771: UDP, length 120
01:09:42.311952 IP 192.168.43.146.8880 > 192.168.43.147.7772: UDP, length 120
01:09:42.324842 IP 192.168.43.124.8880 > 192.168.43.146.7771: UDP, length 120
01:09:42.361941 IP 192.168.43.146.8880 > 192.168.43.147.7772: UDP, length 120
01:09:42.371324 IP 192.168.43.124.8880 > 192.168.43.146.7771: UDP, length 120
01:09:42.411943 IP 192.168.43.146.8880 > 192.168.43.147.7772: UDP, length 120
01:09:42.439568 IP 192.168.43.124.8880 > 192.168.43.146.7771: UDP, length 120
01:09:42.461940 IP 192.168.43.146.8880 > 192.168.43.147.7772: UDP, length 120
01:09:42.471378 IP 192.168.43.124.8880 > 192.168.43.146.7771: UDP, length 120
01:09:42.511942 IP 192.168.43.146.8880 > 192.168.43.147.7772: UDP, length 120
01:09:42.529450 IP 192.168.43.124.8880 > 192.168.43.146.7771: UDP, length 120
01:09:42.561941 IP 192.168.43.146.8880 > 192.168.43.147.7772: UDP, length 120
01:09:42.571935 IP 192.168.43.124.8880 > 192.168.43.146.7771: UDP, length 120
01:09:42.611999 IP 192.168.43.146.8880 > 192.168.43.147.7772: UDP, length 120
01:09:42.622608 IP 192.168.43.124.8880 > 192.168.43.146.7771: UDP, length 120
01:09:42.662026 IP 192.168.43.146.8880 > 192.168.43.147.7772: UDP, length 120
01:09:42.690495 IP 192.168.43.124.8880 > 192.168.43.146.7771: UDP, length 120
01:09:42.712016 IP 192.168.43.146.8880 > 192.168.43.147.7772: UDP, length 120
01:09:42.721522 IP 192.168.43.124.8880 > 192.168.43.146.7771: UDP, length 120
01:09:42.761970 IP 192.168.43.146.8880 > 192.168.43.147.7772: UDP, length 120
01:09:42.771805 IP 192.168.43.124.8880 > 192.168.43.146.7771: UDP, length 120
01:09:42.811969 IP 192.168.43.146.8880 > 192.168.43.147.7772: UDP, length 120
01:09:42.840304 IP 192.168.43.124.8880 > 192.168.43.146.7771: UDP, length 120
01:09:42.861964 IP 192.168.43.146.8880 > 192.168.43.147.7772: UDP, length 120
01:09:42.871547 IP 192.168.43.124.8880 > 192.168.43.146.7771: UDP, length 120
01:09:42.911968 IP 192.168.43.146.8880 > 192.168.43.147.7772: UDP, length 120
01:09:42.921497 IP 192.168.43.124.8880 > 192.168.43.146.7771: UDP, length 120
01:09:42.961971 IP 192.168.43.146.8880 > 192.168.43.147.7772: UDP, length 120
01:09:42.989408 IP 192.168.43.124.8880 > 192.168.43.146.7771: UDP, length 120
01:09:43.011967 IP 192.168.43.146.8880 > 192.168.43.147.7772: UDP, length 120
01:09:43.021573 IP 192.168.43.124.8880 > 192.168.43.146.7771: UDP, length 120
01:09:43.061965 IP 192.168.43.146.8880 > 192.168.43.147.7772: UDP, length 120
01:09:43.071607 IP 192.168.43.124.8880 > 192.168.43.146.7771: UDP, length 120
01:09:43.111972 IP 192.168.43.146.8880 > 192.168.43.147.7772: UDP, length 120
01:09:43.138730 IP 192.168.43.124.8880 > 192.168.43.146.7771: UDP, length 120
01:09:43.161965 IP 192.168.43.146.8880 > 192.168.43.147.7772: UDP, length 120
01:09:43.173747 IP 192.168.43.124.8880 > 192.168.43.146.7771: UDP, length 120
01:09:43.211974 IP 192.168.43.146.8880 > 192.168.43.147.7772: UDP, length 120
01:09:43.221455 IP 192.168.43.124.8880 > 192.168.43.146.7771: UDP, length 120
01:09:43.261965 IP 192.168.43.146.8880 > 192.168.43.147.7772: UDP, length 120
01:09:43.290372 IP 192.168.43.124.8880 > 192.168.43.146.7771: UDP, length 120
01:09:43.311983 IP 192.168.43.146.8880 > 192.168.43.147.7772: UDP, length 120
01:09:43.321597 IP 192.168.43.124.8880 > 192.168.43.146.7771: UDP, length 120
01:09:43.361971 IP 192.168.43.146.8880 > 192.168.43.147.7772: UDP, length 120
01:09:43.371506 IP 192.168.43.124.8880 > 192.168.43.146.7771: UDP, length 120
01:09:43.411968 IP 192.168.43.146.8880 > 192.168.43.147.7772: UDP, length 120
01:09:43.438396 IP 192.168.43.124.8880 > 192.168.43.146.7771: UDP, length 120
01:09:43.461970 IP 192.168.43.146.8880 > 192.168.43.147.7772: UDP, length 120
01:09:43.471542 IP 192.168.43.124.8880 > 192.168.43.146.7771: UDP, length 120
01:09:43.511973 IP 192.168.43.146.8880 > 192.168.43.147.7772: UDP, length 120
01:09:43.526164 IP 192.168.43.124.8880 > 192.168.43.146.7771: UDP, length 120
01:09:43.561973 IP 192.168.43.146.8880 > 192.168.43.147.7772: UDP, length 120
01:09:43.571564 IP 192.168.43.124.8880 > 192.168.43.146.7771: UDP, length 120
01:09:43.611973 IP 192.168.43.146.8880 > 192.168.43.147.7772: UDP, length 120
01:09:43.622708 IP 192.168.43.124.8880 > 192.168.43.146.7771: UDP, length 120
01:09:43.661967 IP 192.168.43.146.8880 > 192.168.43.147.7772: UDP, length 120
01:09:43.671476 IP 192.168.43.124.8880 > 192.168.43.146.7771: UDP, length 120
01:09:43.711982 IP 192.168.43.146.8880 > 192.168.43.147.7772: UDP, length 120
01:09:43.738527 IP 192.168.43.124.8880 > 192.168.43.146.7771: UDP, length 120
01:09:43.761975 IP 192.168.43.146.8880 > 192.168.43.147.7772: UDP, length 120
01:09:43.771567 IP 192.168.43.124.8880 > 192.168.43.146.7771: UDP, length 120
01:09:43.811973 IP 192.168.43.146.8880 > 192.168.43.147.7772: UDP, length 120
01:09:43.821463 IP 192.168.43.124.8880 > 192.168.43.146.7771: UDP, length 120
01:09:43.861966 IP 192.168.43.146.8880 > 192.168.43.147.7772: UDP, length 120
01:09:43.892699 IP 192.168.43.124.8880 > 192.168.43.146.7771: UDP, length 120
01:09:43.911966 IP 192.168.43.146.8880 > 192.168.43.147.7772: UDP, length 120
01:09:43.921542 IP 192.168.43.124.8880 > 192.168.43.146.7771: UDP, length 120
01:09:43.961970 IP 192.168.43.146.8880 > 192.168.43.147.7772: UDP, length 120
01:09:43.975516 IP 192.168.43.124.8880 > 192.168.43.146.7771: UDP, length 120
01:09:44.011966 IP 192.168.43.146.8880 > 192.168.43.147.7772: UDP, length 120
01:09:44.028883 IP 192.168.43.124.8880 > 192.168.43.146.7771: UDP, length 120
01:09:44.061969 IP 192.168.43.146.8880 > 192.168.43.147.7772: UDP, length 120
01:09:44.072069 IP 192.168.43.124.8880 > 192.168.43.146.7771: UDP, length 120
01:09:44.111967 IP 192.168.43.146.8880 > 192.168.43.147.7772: UDP, length 120
01:09:44.126883 IP 192.168.43.124.8880 > 192.168.43.146.7771: UDP, length 120
01:09:44.161988 IP 192.168.43.146.8880 > 192.168.43.147.7772: UDP, length 120
01:09:44.174047 IP 192.168.43.124.8880 > 192.168.43.146.7771: UDP, length 120
01:09:44.212017 IP 192.168.43.146.8880 > 192.168.43.147.7772: UDP, length 120
01:09:44.221451 IP 192.168.43.124.8880 > 192.168.43.146.7771: UDP, length 120
01:09:44.261970 IP 192.168.43.146.8880 > 192.168.43.147.7772: UDP, length 120
01:09:44.289805 IP 192.168.43.124.8880 > 192.168.43.146.7771: UDP, length 120
01:09:44.311987 IP 192.168.43.146.8880 > 192.168.43.147.7772: UDP, length 120
01:09:44.327577 IP 192.168.43.124.8880 > 192.168.43.146.7771: UDP, length 120
01:09:44.361966 IP 192.168.43.146.8880 > 192.168.43.147.7772: UDP, length 120
01:09:44.373513 IP 192.168.43.124.8880 > 192.168.43.146.7771: UDP, length 120
01:09:44.411974 IP 192.168.43.146.8880 > 192.168.43.147.7772: UDP, length 120
01:09:44.444085 IP 192.168.43.124.8880 > 192.168.43.146.7771: UDP, length 120
01:09:44.461965 IP 192.168.43.146.8880 > 192.168.43.147.7772: UDP, length 120
01:09:44.472356 IP 192.168.43.124.8880 > 192.168.43.146.7771: UDP, length 120
01:09:44.511973 IP 192.168.43.146.8880 > 192.168.43.147.7772: UDP, length 120
01:09:44.530041 IP 192.168.43.124.8880 > 192.168.43.146.7771: UDP, length 120
01:09:44.561971 IP 192.168.43.146.8880 > 192.168.43.147.7772: UDP, length 120
01:09:44.571400 IP 192.168.43.124.8880 > 192.168.43.146.7771: UDP, length 120
01:09:44.611967 IP 192.168.43.146.8880 > 192.168.43.147.7772: UDP, length 120
01:09:44.620882 IP 192.168.43.124.8880 > 192.168.43.146.7771: UDP, length 120
01:09:44.662052 IP 192.168.43.146.8880 > 192.168.43.147.7772: UDP, length 120
01:09:44.693902 IP 192.168.43.124.8880 > 192.168.43.146.7771: UDP, length 120
01:09:44.712089 IP 192.168.43.146.8880 > 192.168.43.147.7772: UDP, length 120
01:09:44.722595 IP 192.168.43.124.8880 > 192.168.43.146.7771: UDP, length 120
01:09:44.762045 IP 192.168.43.146.8880 > 192.168.43.147.7772: UDP, length 120
01:09:44.773138 IP 192.168.43.124.8880 > 192.168.43.146.7771: UDP, length 120
01:09:44.812110 IP 192.168.43.146.8880 > 192.168.43.147.7772: UDP, length 120
01:09:44.841598 IP 192.168.43.124.8880 > 192.168.43.146.7771: UDP, length 120
01:09:44.862035 IP 192.168.43.146.8880 > 192.168.43.147.7772: UDP, length 120
01:09:44.875091 IP 192.168.43.124.8880 > 192.168.43.146.7771: UDP, length 120
01:09:44.912038 IP 192.168.43.146.8880 > 192.168.43.147.7772: UDP, length 120
01:09:44.923180 IP 192.168.43.124.8880 > 192.168.43.146.7771: UDP, length 120
01:09:44.962004 IP 192.168.43.146.8880 > 192.168.43.147.7772: UDP, length 120
01:09:44.980884 IP 192.168.43.124.8880 > 192.168.43.146.7771: UDP, length 120
01:09:45.012013 IP 192.168.43.146.8880 > 192.168.43.147.7772: UDP, length 120
01:09:45.021462 IP 192.168.43.124.8880 > 192.168.43.146.7771: UDP, length 120
01:09:45.061998 IP 192.168.43.146.8880 > 192.168.43.147.7772: UDP, length 120
01:09:45.072469 IP 192.168.43.124.8880 > 192.168.43.146.7771: UDP, length 120
01:09:45.112033 IP 192.168.43.146.8880 > 192.168.43.147.7772: UDP, length 120
01:09:45.140280 IP 192.168.43.124.8880 > 192.168.43.146.7771: UDP, length 120
01:09:45.162038 IP 192.168.43.146.8880 > 192.168.43.147.7772: UDP, length 120
01:09:45.171574 IP 192.168.43.124.8880 > 192.168.43.146.7771: UDP, length 120
01:09:45.211992 IP 192.168.43.146.8880 > 192.168.43.147.7772: UDP, length 120
01:09:45.221343 IP 192.168.43.124.8880 > 192.168.43.146.7771: UDP, length 120
01:09:45.261948 IP 192.168.43.146.8880 > 192.168.43.147.7772: UDP, length 120
01:09:45.288717 IP 192.168.43.124.8880 > 192.168.43.146.7771: UDP, length 120
01:09:45.311955 IP 192.168.43.146.8880 > 192.168.43.147.7772: UDP, length 120
01:09:45.324145 IP 192.168.43.124.8880 > 192.168.43.146.7771: UDP, length 120
01:09:45.361943 IP 192.168.43.146.8880 > 192.168.43.147.7772: UDP, length 120
01:09:45.371919 IP 192.168.43.124.8880 > 192.168.43.146.7771: UDP, length 120
01:09:45.411944 IP 192.168.43.146.8880 > 192.168.43.147.7772: UDP, length 120
01:09:45.421352 IP 192.168.43.124.8880 > 192.168.43.146.7771: UDP, length 120
01:09:45.461941 IP 192.168.43.146.8880 > 192.168.43.147.7772: UDP, length 120
01:09:45.489063 IP 192.168.43.124.8880 > 192.168.43.146.7771: UDP, length 120
01:09:45.511947 IP 192.168.43.146.8880 > 192.168.43.147.7772: UDP, length 120
01:09:45.521390 IP 192.168.43.124.8880 > 192.168.43.146.7771: UDP, length 120
01:09:45.561942 IP 192.168.43.146.8880 > 192.168.43.147.7772: UDP, length 120
01:09:45.571979 IP 192.168.43.124.8880 > 192.168.43.146.7771: UDP, length 120
01:09:45.611945 IP 192.168.43.146.8880 > 192.168.43.147.7772: UDP, length 120
01:09:45.639180 IP 192.168.43.124.8880 > 192.168.43.146.7771: UDP, length 120
01:09:45.661943 IP 192.168.43.146.8880 > 192.168.43.147.7772: UDP, length 120
01:09:45.671426 IP 192.168.43.124.8880 > 192.168.43.146.7771: UDP, length 120
01:09:45.711980 IP 192.168.43.146.8880 > 192.168.43.147.7772: UDP, length 120
01:09:45.721392 IP 192.168.43.124.8880 > 192.168.43.146.7771: UDP, length 120
01:09:45.761948 IP 192.168.43.146.8880 > 192.168.43.147.7772: UDP, length 120
01:09:45.788881 IP 192.168.43.124.8880 > 192.168.43.146.7771: UDP, length 120
01:09:45.812019 IP 192.168.43.146.8880 > 192.168.43.147.7772: UDP, length 120
01:09:45.821577 IP 192.168.43.124.8880 > 192.168.43.146.7771: UDP, length 120
01:09:45.861993 IP 192.168.43.146.8880 > 192.168.43.147.7772: UDP, length 120
01:09:45.871356 IP 192.168.43.124.8880 > 192.168.43.146.7771: UDP, length 120
01:09:45.911960 IP 192.168.43.146.8880 > 192.168.43.147.7772: UDP, length 120
01:09:45.940337 IP 192.168.43.124.8880 > 192.168.43.146.7771: UDP, length 120
01:09:45.961944 IP 192.168.43.146.8880 > 192.168.43.147.7772: UDP, length 120
01:09:45.971426 IP 192.168.43.124.8880 > 192.168.43.146.7771: UDP, length 120
01:09:46.011946 IP 192.168.43.146.8880 > 192.168.43.147.7772: UDP, length 120
01:09:46.021359 IP 192.168.43.124.8880 > 192.168.43.146.7771: UDP, length 120
01:09:46.061940 IP 192.168.43.146.8880 > 192.168.43.147.7772: UDP, length 120
01:09:46.090144 IP 192.168.43.124.8880 > 192.168.43.146.7771: UDP, length 120
01:09:46.111944 IP 192.168.43.146.8880 > 192.168.43.147.7772: UDP, length 120
01:09:46.122232 IP 192.168.43.124.8880 > 192.168.43.146.7771: UDP, length 120
01:09:46.161943 IP 192.168.43.146.8880 > 192.168.43.147.7772: UDP, length 120
01:09:46.177546 IP 192.168.43.124.8880 > 192.168.43.146.7771: UDP, length 120
01:09:46.211941 IP 192.168.43.146.8880 > 192.168.43.147.7772: UDP, length 120
01:09:46.222292 IP 192.168.43.124.8880 > 192.168.43.146.7771: UDP, length 120
01:09:46.261941 IP 192.168.43.146.8880 > 192.168.43.147.7772: UDP, length 120
01:09:46.271506 IP 192.168.43.124.8880 > 192.168.43.146.7771: UDP, length 120
