01:09:31.151104 IP 192.168.43.146.8880 > 192.168.43.147.7772: UDP, length 120
01:09:31.203788 IP 192.168.43.146.8880 > 192.168.43.147.7772: UDP, length 120
01:09:31.251197 IP 192.168.43.146.8880 > 192.168.43.147.7772: UDP, length 120
01:09:31.281608 IP 192.168.43.147.8880 > 192.168.43.124.7773: UDP, length 120
01:09:31.301409 IP 192.168.43.146.8880 > 192.168.43.147.7772: UDP, length 120
01:09:31.331687 IP 192.168.43.147.8880 > 192.168.43.124.7773: UDP, length 120
01:09:31.353205 IP 192.168.43.146.8880 > 192.168.43.147.7772: UDP, length 120
01:09:31.381722 IP 192.168.43.147.8880 > 192.168.43.124.7773: UDP, length 120
01:09:31.401049 IP 192.168.43.146.8880 > 192.168.43.147.7772: UDP, length 120
01:09:31.431684 IP 192.168.43.147.8880 > 192.168.43.124.7773: UDP, length 120
01:09:31.460923 IP 192.168.43.146.8880 > 192.168.43.147.7772: UDP, length 120
01:09:31.481699 IP 192.168.43.147.8880 > 192.168.43.124.7773: UDP, length 120
01:09:31.504085 IP 192.168.43.146.8880 > 192.168.43.147.7772: UDP, length 120
01:09:31.531653 IP 192.168.43.147.8880 > 192.168.43.124.7773: UDP, length 120
01:09:31.551291 IP 192.168.43.146.8880 > 192.168.43.147.7772: UDP, length 120
01:09:31.581634 IP 192.168.43.147.8880 > 192.168.43.124.7773: UDP, length 120
01:09:31.601105 IP 192.168.43.146.8880 > 192.168.43.147.7772: UDP, length 120
01:09:31.631633 IP 192.168.43.147.8880 > 192.168.43.124.7773: UDP, length 120
01:09:31.652202 IP 192.168.43.146.8880 > 192.168.43.147.7772: UDP, length 120
01:09:31.681630 IP 192.168.43.147.8880 > 192.168.43.124.7773: UDP, length 120
01:09:31.703811 IP 192.168.43.146.8880 > 192.168.43.147.7772: UDP, length 120
01:09:31.731627 IP 192.168.43.147.8880 > 192.168.43.124.7773: UDP, length 120
01:09:31.752104 IP 192.168.43.146.8880 > 192.168.43.147.7772: UDP, length 120
01:09:31.781628 IP 192.168.43.147.8880 > 192.168.43.124.7773: UDP, length 120
01:09:31.804063 IP 192.168.43.146.8880 > 192.168.43.147.7772: UDP, length 120
01:09:31.831627 IP 192.168.43.147.8880 > 192.168.43.124.7773: UDP, length 120
01:09:31.850621 IP 192.168.43.146.8880 > 192.168.43.147.7772: UDP, length 120
01:09:31.881661 IP 192.168.43.147.8880 > 192.168.43.124.7773: UDP, length 120
01:09:31.900719 IP 192.168.43.146.8880 > 192.168.43.147.7772: UDP, length 120
01:09:31.931658 IP 192.168.43.147.8880 > 192.168.43.124.7773: UDP, length 120
01:09:31.954167 IP 192.168.43.146.8880 > 192.168.43.147.7772: UDP, length 120
01:09:31.981659 IP 192.168.43.147.8880 > 192.168.43.124.7773: UDP, length 120
01:09:32.002515 IP 192.168.43.146.8880 > 192.168.43.147.7772: UDP, length 120
01:09:32.031658 IP 192.168.43.147.8880 > 192.168.43.124.7773: UDP, length 120
01:09:32.050703 IP 192.168.43.146.8880 > 192.168.43.147.7772: UDP, length 120
01:09:32.081670 IP 192.168.43.147.8880 > 192.168.43.124.7773: UDP, length 120
01:09:32.102801 IP 192.168.43.146.8880 > 192.168.43.147.7772: UDP, length 120
01:09:32.131663 IP 192.168.43.147.8880 > 192.168.43.124.7773: UDP, length 120
01:09:32.150841 IP 192.168.43.146.8880 > 192.168.43.147.7772: UDP, length 120
01:09:32.181657 IP 192.168.43.147.8880 > 192.168.43.124.7773: UDP, length 120
01:09:32.231653 IP 192.168.43.147.8880 > 192.168.43.124.7773: UDP, length 120
01:09:32.254587 IP 192.168.43.146.8880 > 192.168.43.147.7772: UDP, length 120
01:09:32.281653 IP 192.168.43.147.8880 > 192.168.43.124.7773: UDP, length 120
01:09:32.314879 IP 192.168.43.146.8880 > 192.168.43.147.7772: UDP, length 120
01:09:32.331656 IP 192.168.43.147.8880 > 192.168.43.124.7773: UDP, length 120
01:09:32.356802 IP 192.168.43.146.8880 > 192.168.43.147.7772: UDP, length 120
01:09:32.381655 IP 192.168.43.147.8880 > 192.168.43.124.7773: UDP, length 120
01:09:32.401450 IP 192.168.43.146.8880 > 192.168.43.147.7772: UDP, length 120
01:09:32.431653 IP 192.168.43.147.8880 > 192.168.43.124.7773: UDP, length 120
01:09:32.468777 IP 192.168.43.146.8880 > 192.168.43.147.7772: UDP, length 120
01:09:32.481656 IP 192.168.43.147.8880 > 192.168.43.124.7773: UDP, length 120
01:09:32.502169 IP 192.168.43.146.8880 > 192.168.43.147.7772: UDP, length 120
01:09:32.531653 IP 192.168.43.147.8880 > 192.168.43.124.7773: UDP, length 120
01:09:32.552625 IP 192.168.43.146.8880 > 192.168.43.147.7772: UDP, length 120
01:09:32.581653 IP 192.168.43.147.8880 > 192.168.43.124.7773: UDP, length 120
01:09:32.630484 IP 192.168.43.146.8880 > 192.168.43.147.7772: UDP, length 120
01:09:32.631659 IP 192.168.43.147.8880 > 192.168.43.124.7773: UDP, length 120
01:09:32.652044 IP 192.168.43.146.8880 > 192.168.43.147.7772: UDP, length 120
01:09:32.681654 IP 192.168.43.147.8880 > 192.168.43.124.7773: UDP, length 120
01:09:32.720637 IP 192.168.43.146.8880 > 192.168.43.147.7772: UDP, length 120
01:09:32.731653 IP 192.168.43.147.8880 > 192.168.43.124.7773: UDP, length 120
01:09:32.754215 IP 192.168.43.146.8880 > 192.168.43.147.7772: UDP, length 120
01:09:32.781653 IP 192.168.43.147.8880 > 192.168.43.124.7773: UDP, length 120
01:09:32.815506 IP 192.168.43.146.8880 > 192.168.43.147.7772: UDP, length 120
01:09:32.831653 IP 192.168.43.147.8880 > 192.168.43.124.7773: UDP, length 120
01:09:32.872612 IP 192.168.43.146.8880 > 192.168.43.147.7772: UDP, length 120
01:09:32.881654 IP 192.168.43.147.8880 > 192.168.43.124.7773: UDP, length 120
01:09:32.925087 IP 192.168.43.146.8880 > 192.168.43.147.7772: UDP, length 120
01:09:32.931654 IP 192.168.43.147.8880 > 192.168.43.124.7773: UDP, length 120
01:09:32.964585 IP 192.168.43.146.8880 > 192.168.43.147.7772: UDP, length 120
01:09:32.981673 IP 192.168.43.147.8880 > 192.168.43.124.7773: UDP, length 120
01:09:33.031657 IP 192.168.43.147.8880 > 192.168.43.124.7773: UDP, length 120
01:09:33.035066 IP 192.168.43.146.8880 > 192.168.43.147.7772: UDP, length 120
01:09:33.052460 IP 192.168.43.146.8880 > 192.168.43.147.7772: UDP, length 120
01:09:33.081662 IP 192.168.43.147.8880 > 192.168.43.124.7773: UDP, length 120
01:09:33.121919 IP 192.168.43.146.8880 > 192.168.43.147.7772: UDP, length 120
01:09:33.131655 IP 192.168.43.147.8880 > 192.168.43.124.7773: UDP, length 120
01:09:33.154079 IP 192.168.43.146.8880 > 192.168.43.147.7772: UDP, length 120
01:09:33.181656 IP 192.168.43.147.8880 > 192.168.43.124.7773: UDP, length 120
01:09:33.207171 IP 192.168.43.146.8880 > 192.168.43.147.7772: UDP, length 120
01:09:33.231659 IP 192.168.43.147.8880 > 192.168.43.124.7773: UDP, length 120
01:09:33.256991 IP 192.168.43.146.8880 > 192.168.43.147.7772: UDP, length 120
01:09:33.281656 IP 192.168.43.147.8880 > 192.168.43.124.7773: UDP, length 120
01:09:33.331654 IP 192.168.43.147.8880 > 192.168.43.124.7773: UDP, length 120
01:09:33.354204 IP 192.168.43.146.8880 > 192.168.43.147.7772: UDP, length 120
01:09:33.354452 IP 192.168.43.146.8880 > 192.168.43.147.7772: UDP, length 120
01:09:33.381656 IP 192.168.43.147.8880 > 192.168.43.124.7773: UDP, length 120
01:09:33.403935 IP 192.168.43.146.8880 > 192.168.43.147.7772: UDP, length 120
01:09:33.431654 IP 192.168.43.147.8880 > 192.168.43.124.7773: UDP, length 120
01:09:33.456324 IP 192.168.43.146.8880 > 192.168.43.147.7772: UDP, length 120
01:09:33.481654 IP 192.168.43.147.8880 > 192.168.43.124.7773: UDP, length 120
01:09:33.503897 IP 192.168.43.146.8880 > 192.168.43.147.7772: UDP, length 120
01:09:33.531654 IP 192.168.43.147.8880 > 192.168.43.124.7773: UDP, length 120
01:09:33.551916 IP 192.168.43.146.8880 > 192.168.43.147.7772: UDP, length 120
01:09:33.581652 IP 192.168.43.147.8880 > 192.168.43.124.7773: UDP, length 120
01:09:33.612672 IP 192.168.43.146.8880 > 192.168.43.147.7772: UDP, length 120
01:09:33.631658 IP 192.168.43.147.8880 > 192.168.43.124.7773: UDP, length 120
01:09:33.653068 IP 192.168.43.146.8880 > 192.168.43.147.7772: UDP, length 120
01:09:33.681653 IP 192.168.43.147.8880 > 192.168.43.124.7773: UDP, length 120
01:09:33.705646 IP 192.168.43.146.8880 > 192.168.43.147.7772: UDP, length 120
01:09:33.731653 IP 192.168.43.147.8880 > 192.168.43.124.7773: UDP, length 120
01:09:33.758631 IP 192.168.43.146.8880 > 192.168.43.147.7772: UDP, length 120
01:09:33.781653 IP 192.168.43.147.8880 > 192.168.43.124.7773: UDP, length 120
01:09:33.831655 IP 192.168.43.147.8880 > 192.168.43.124.7773: UDP, length 120
01:09:33.844479 IP 192.168.43.146.8880 > 192.168.43.147.7772: UDP, length 120
01:09:33.849751 IP 192.168.43.146.8880 > 192.168.43.147.7772: UDP, length 120
01:09:33.881657 IP 192.168.43.147.8880 > 192.168.43.124.7773: UDP, length 120
01:09:33.893358 IP 192.168.43.146.8880 > 192.168.43.147.7772: UDP, length 120
01:09:33.931655 IP 192.168.43.147.8880 > 192.168.43.124.7773: UDP, length 120
01:09:33.950943 IP 192.168.43.146.8880 > 192.168.43.147.7772: UDP, length 120
01:09:33.981653 IP 192.168.43.147.8880 > 192.168.43.124.7773: UDP, length 120
01:09:34.000951 IP 192.168.43.146.8880 > 192.168.43.147.7772: UDP, length 120
01:09:34.031652 IP 192.168.43.147.8880 > 192.168.43.124.7773: UDP, length 120
01:09:34.050998 IP 192.168.43.146.8880 > 192.168.43.147.7772: UDP, length 120
01:09:34.081654 IP 192.168.43.147.8880 > 192.168.43.124.7773: UDP, length 120
01:09:34.102419 IP 192.168.43.146.8880 > 192.168.43.147.7772: UDP, length 120
01:09:34.131654 IP 192.168.43.147.8880 > 192.168.43.124.7773: UDP, length 120
01:09:34.144926 IP 192.168.43.146.8880 > 192.168.43.147.7772: UDP, length 120
01:09:34.181659 IP 192.168.43.147.8880 > 192.168.43.124.7773: UDP, length 120
01:09:34.201819 IP 192.168.43.146.8880 > 192.168.43.147.7772: UDP, length 120
01:09:34.231657 IP 192.168.43.147.8880 > 192.168.43.124.7773: UDP, length 120
01:09:34.251940 IP 192.168.43.146.8880 > 192.168.43.147.7772: UDP, length 120
01:09:34.281653 IP 192.168.43.147.8880 > 192.168.43.124.7773: UDP, length 120
01:09:34.298176 IP 192.168.43.146.8880 > 192.168.43.147.7772: UDP, length 120
01:09:34.331662 IP 192.168.43.147.8880 > 192.168.43.124.7773: UDP, length 120
01:09:34.355647 IP 192.168.43.146.8880 > 192.168.43.147.7772: UDP, length 120
01:09:34.381656 IP 192.168.43.147.8880 > 192.168.43.124.7773: UDP, length 120
01:09:34.403460 IP 192.168.43.146.8880 > 192.168.43.147.7772: UDP, length 120
01:09:34.431653 IP 192.168.43.147.8880 > 192.168.43.124.7773: UDP, length 120
01:09:34.453358 IP 192.168.43.146.8880 > 192.168.43.147.7772: UDP, length 120
01:09:34.481703 IP 192.168.43.147.8880 > 192.168.43.124.7773: UDP, length 120
01:09:34.503830 IP 192.168.43.146.8880 > 192.168.43.147.7772: UDP, length 120
01:09:34.531664 IP 192.168.43.147.8880 > 192.168.43.124.7773: UDP, length 120
01:09:34.552555 IP 192.168.43.146.8880 > 192.168.43.147.7772: UDP, length 120
01:09:34.581654 IP 192.168.43.147.8880 > 192.168.43.124.7773: UDP, length 120
01:09:34.602121 IP 192.168.43.146.8880 > 192.168.43.147.7772: UDP, length 120
01:09:34.631659 IP 192.168.43.147.8880 > 192.168.43.124.7773: UDP, length 120
01:09:34.652407 IP 192.168.43.146.8880 > 192.168.43.147.7772: UDP, length 120
01:09:34.681656 IP 192.168.43.147.8880 > 192.168.43.124.7773: UDP, length 120
01:09:34.695826 IP 192.168.43.146.8880 > 192.168.43.147.7772: UDP, length 120
01:09:34.731654 IP 192.168.43.147.8880 > 192.168.43.124.7773: UDP, length 120
01:09:34.752434 IP 192.168.43.146.8880 > 192.168.43.147.7772: UDP, length 120
01:09:34.781653 IP 192.168.43.147.8880 > 192.168.43.124.7773: UDP, length 120
01:09:34.802097 IP 192.168.43.146.8880 > 192.168.43.147.7772: UDP, length 120
01:09:34.831654 IP 192.168.43.147.8880 > 192.168.43.124.7773: UDP, length 120
01:09:34.852110 IP 192.168.43.146.8880 > 192.168.43.147.7772: UDP, length 120
01:09:34.881655 IP 192.168.43.147.8880 > 192.168.43.124.7773: UDP, length 120
01:09:34.902316 IP 192.168.43.146.8880 > 192.168.43.147.7772: UDP, length 120
01:09:34.931655 IP 192.168.43.147.8880 > 192.168.43.124.7773: UDP, length 120
01:09:34.952959 IP 192.168.43.146.8880 > 192.168.43.147.7772: UDP, length 120
01:09:34.981654 IP 192.168.43.147.8880 > 192.168.43.124.7773: UDP, length 120
01:09:35.001187 IP 192.168.43.146.8880 > 192.168.43.147.7772: UDP, length 120
01:09:35.031654 IP 192.168.43.147.8880 > 192.168.43.124.7773: UDP, length 120
01:09:35.051566 IP 192.168.43.146.8880 > 192.168.43.147.7772: UDP, length 120
01:09:35.081654 IP 192.168.43.147.8880 > 192.168.43.124.7773: UDP, length 120
01:09:35.101479 IP 192.168.43.146.8880 > 192.168.43.147.7772: UDP, length 120
01:09:35.131656 IP 192.168.43.147.8880 > 192.168.43.124.7773: UDP, length 120
01:09:35.151581 IP 192.168.43.146.8880 > 192.168.43.147.7772: UDP, length 120
01:09:35.181661 IP 192.168.43.147.8880 > 192.168.43.124.7773: UDP, length 120
01:09:35.201024 IP 192.168.43.146.8880 > 192.168.43.147.7772: UDP, length 120
01:09:35.231659 IP 192.168.43.147.8880 > 192.168.43.124.7773: UDP, length 120
01:09:35.250678 IP 192.168.43.146.8880 > 192.168.43.147.7772: UDP, length 120
01:09:35.281655 IP 192.168.43.147.8880 > 192.168.43.124.7773: UDP, length 120
01:09:35.296709 IP 192.168.43.146.8880 > 192.168.43.147.7772: UDP, length 120
01:09:35.331657 IP 192.168.43.147.8880 > 192.168.43.124.7773: UDP, length 120
01:09:35.345950 IP 192.168.43.146.8880 > 192.168.43.147.7772: UDP, length 120
01:09:35.381655 IP 192.168.43.147.8880 > 192.168.43.124.7773: UDP, length 120
01:09:35.395639 IP 192.168.43.146.8880 > 192.168.43.147.7772: UDP, length 120
01:09:35.431653 IP 192.168.43.147.8880 > 192.168.43.124.7773: UDP, length 120
01:09:35.453591 IP 192.168.43.146.8880 > 192.168.43.147.7772: UDP, length 120
01:09:35.481653 IP 192.168.43.147.8880 > 192.168.43.124.7773: UDP, length 120
01:09:35.504599 IP 192.168.43.146.8880 > 192.168.43.147.7772: UDP, length 120
01:09:35.531653 IP 192.168.43.147.8880 > 192.168.43.124.7773: UDP, length 120
01:09:35.558921 IP 192.168.43.146.8880 > 192.168.43.147.7772: UDP, length 120
01:09:35.581652 IP 192.168.43.147.8880 > 192.168.43.124.7773: UDP, length 120
01:09:35.601440 IP 192.168.43.146.8880 > 192.168.43.147.7772: UDP, length 120
01:09:35.631660 IP 192.168.43.147.8880 > 192.168.43.124.7773: UDP, length 120
01:09:35.650933 IP 192.168.43.146.8880 > 192.168.43.147.7772: UDP, length 120
01:09:35.681653 IP 192.168.43.147.8880 > 192.168.43.124.7773: UDP, length 120
01:09:35.701253 IP 192.168.43.146.8880 > 192.168.43.147.7772: UDP, length 120
01:09:35.731652 IP 192.168.43.147.8880 > 192.168.43.124.7773: UDP, length 120
01:09:35.747405 IP 192.168.43.146.8880 > 192.168.43.147.7772: UDP, length 120
01:09:35.781653 IP 192.168.43.147.8880 > 192.168.43.124.7773: UDP, length 120
01:09:35.800693 IP 192.168.43.146.8880 > 192.168.43.147.7772: UDP, length 120
01:09:35.831653 IP 192.168.43.147.8880 > 192.168.43.124.7773: UDP, length 120
01:09:35.850694 IP 192.168.43.146.8880 > 192.168.43.147.7772: UDP, length 120
01:09:35.881652 IP 192.168.43.147.8880 > 192.168.43.124.7773: UDP, length 120
01:09:35.896816 IP 192.168.43.146.8880 > 192.168.43.147.7772: UDP, length 120
01:09:35.931652 IP 192.168.43.147.8880 > 192.168.43.124.7773: UDP, length 120
01:09:35.951491 IP 192.168.43.146.8880 > 192.168.43.147.7772: UDP, length 120
01:09:35.981701 IP 192.168.43.147.8880 > 192.168.43.124.7773: UDP, length 120
01:09:36.001975 IP 192.168.43.146.8880 > 192.168.43.147.7772: UDP, length 120
01:09:36.031664 IP 192.168.43.147.8880 > 192.168.43.124.7773: UDP, length 120
01:09:36.053128 IP 192.168.43.146.8880 > 192.168.43.147.7772: UDP, length 120
01:09:36.081655 IP 192.168.43.147.8880 > 192.168.43.124.7773: UDP, length 120
01:09:36.100758 IP 192.168.43.146.8880 > 192.168.43.147.7772: UDP, length 120
01:09:36.131655 IP 192.168.43.147.8880 > 192.168.43.124.7773: UDP, length 120
01:09:36.151045 IP 192.168.43.146.8880 > 192.168.43.147.7772: UDP, length 120
01:09:36.181654 IP 192.168.43.147.8880 > 192.168.43.124.7773: UDP, length 120
01:09:36.196202 IP 192.168.43.146.8880 > 192.168.43.147.7772: UDP, length 120
01:09:36.231658 IP 192.168.43.147.8880 > 192.168.43.124.7773: UDP, length 120
01:09:36.255067 IP 192.168.43.146.8880 > 192.168.43.147.7772: UDP, length 120
01:09:36.281661 IP 192.168.43.147.8880 > 192.168.43.124.7773: UDP, length 120
01:09:36.302140 IP 192.168.43.146.8880 > 192.168.43.147.7772: UDP, length 120
01:09:36.331685 IP 192.168.43.147.8880 > 192.168.43.124.7773: UDP, length 120
01:09:36.381657 IP 192.168.43.147.8880 > 192.168.43.124.7773: UDP, length 120
01:09:36.385081 IP 192.168.43.146.8880 > 192.168.43.147.7772: UDP, length 120
01:09:36.400696 IP 192.168.43.146.8880 > 192.168.43.147.7772: UDP, length 120
01:09:36.431654 IP 192.168.43.147.8880 > 192.168.43.124.7773: UDP, length 120
01:09:36.457815 IP 192.168.43.146.8880 > 192.168.43.147.7772: UDP, length 120
01:09:36.481727 IP 192.168.43.147.8880 > 192.168.43.124.7773: UDP, length 120
01:09:36.502076 IP 192.168.43.146.8880 > 192.168.43.147.7772: UDP, length 120
01:09:36.531733 IP 192.168.43.147.8880 > 192.168.43.124.7773: UDP, length 120
01:09:36.551917 IP 192.168.43.146.8880 > 192.168.43.147.7772: UDP, length 120
01:09:36.581817 IP 192.168.43.147.8880 > 192.168.43.124.7773: UDP, length 120
01:09:36.604840 IP 192.168.43.146.8880 > 192.168.43.147.7772: UDP, length 120
01:09:36.631699 IP 192.168.43.147.8880 > 192.168.43.124.7773: UDP, length 120
01:09:36.651157 IP 192.168.43.146.8880 > 192.168.43.147.7772: UDP, length 120
01:09:36.681702 IP 192.168.43.147.8880 > 192.168.43.124.7773: UDP, length 120
01:09:36.701555 IP 192.168.43.146.8880 > 192.168.43.147.7772: UDP, length 120
01:09:36.731724 IP 192.168.43.147.8880 > 192.168.43.124.7773: UDP, length 120
01:09:36.751799 IP 192.168.43.146.8880 > 192.168.43.147.7772: UDP, length 120
01:09:36.781722 IP 192.168.43.147.8880 > 192.168.43.124.7773: UDP, length 120
01:09:36.804412 IP 192.168.43.146.8880 > 192.168.43.147.7772: UDP, length 120
01:09:36.831709 IP 192.168.43.147.8880 > 192.168.43.124.7773: UDP, length 120
01:09:36.854788 IP 192.168.43.146.8880 > 192.168.43.147.7772: UDP, length 120
01:09:36.881700 IP 192.168.43.147.8880 > 192.168.43.124.7773: UDP, length 120
01:09:36.897581 IP 192.168.43.146.8880 > 192.168.43.147.7772: UDP, length 120
01:09:36.931754 IP 192.168.43.147.8880 > 192.168.43.124.7773: UDP, length 120
01:09:36.952937 IP 192.168.43.146.8880 > 192.168.43.147.7772: UDP, length 120
01:09:36.981733 IP 192.168.43.147.8880 > 192.168.43.124.7773: UDP, length 120
01:09:36.997278 IP 192.168.43.146.8880 > 192.168.43.147.7772: UDP, length 120
01:09:37.031679 IP 192.168.43.147.8880 > 192.168.43.124.7773: UDP, length 120
01:09:37.051295 IP 192.168.43.146.8880 > 192.168.43.147.7772: UDP, length 120
01:09:37.081680 IP 192.168.43.147.8880 > 192.168.43.124.7773: UDP, length 120
01:09:37.104351 IP 192.168.43.146.8880 > 192.168.43.147.7772: UDP, length 120
01:09:37.131667 IP 192.168.43.147.8880 > 192.168.43.124.7773: UDP, length 120
01:09:37.152381 IP 192.168.43.146.8880 > 192.168.43.147.7772: UDP, length 120
01:09:37.181663 IP 192.168.43.147.8880 > 192.168.43.124.7773: UDP, length 120
01:09:37.201074 IP 192.168.43.146.8880 > 192.168.43.147.7772: UDP, length 120
01:09:37.231656 IP 192.168.43.147.8880 > 192.168.43.124.7773: UDP, length 120
01:09:37.250845 IP 192.168.43.146.8880 > 192.168.43.147.7772: UDP, length 120
01:09:37.281660 IP 192.168.43.147.8880 > 192.168.43.124.7773: UDP, length 120
01:09:37.301387 IP 192.168.43.146.8880 > 192.168.43.147.7772: UDP, length 120
01:09:37.331662 IP 192.168.43.147.8880 > 192.168.43.124.7773: UDP, length 120
01:09:37.346858 IP 192.168.43.146.8880 > 192.168.43.147.7772: UDP, length 120
01:09:37.381660 IP 192.168.43.147.8880 > 192.168.43.124.7773: UDP, length 120
01:09:37.403301 IP 192.168.43.146.8880 > 192.168.43.147.7772: UDP, length 120
01:09:37.431657 IP 192.168.43.147.8880 > 192.168.43.124.7773: UDP, length 120
01:09:37.463506 IP 192.168.43.146.8880 > 192.168.43.147.7772: UDP, length 120
01:09:37.481702 IP 192.168.43.147.8880 > 192.168.43.124.7773: UDP, length 120
01:09:37.496244 IP 192.168.43.146.8880 > 192.168.43.147.7772: UDP, length 120
01:09:37.531664 IP 192.168.43.147.8880 > 192.168.43.124.7773: UDP, length 120
01:09:37.545864 IP 192.168.43.146.8880 > 192.168.43.147.7772: UDP, length 120
01:09:37.581657 IP 192.168.43.147.8880 > 192.168.43.124.7773: UDP, length 120
01:09:37.624371 IP 192.168.43.146.8880 > 192.168.43.147.7772: UDP, length 120
01:09:37.631660 IP 192.168.43.147.8880 > 192.168.43.124.7773: UDP, length 120
01:09:37.658713 IP 192.168.43.146.8880 > 192.168.43.147.7772: UDP, length 120
01:09:37.681656 IP 192.168.43.147.8880 > 192.168.43.124.7773: UDP, length 120
01:09:37.713836 IP 192.168.43.146.8880 > 192.168.43.147.7772: UDP, length 120
01:09:37.731654 IP 192.168.43.147.8880 > 192.168.43.124.7773: UDP, length 120
01:09:37.753306 IP 192.168.43.146.8880 > 192.168.43.147.7772: UDP, length 120
01:09:37.781653 IP 192.168.43.147.8880 > 192.168.43.124.7773: UDP, length 120
01:09:37.824468 IP 192.168.43.146.8880 > 192.168.43.147.7772: UDP, length 120
01:09:37.831654 IP 192.168.43.147.8880 > 192.168.43.124.7773: UDP, length 120
01:09:37.852167 IP 192.168.43.146.8880 > 192.168.43.147.7772: UDP, length 120
01:09:37.881656 IP 192.168.43.147.8880 > 192.168.43.124.7773: UDP, length 120
01:09:37.900860 IP 192.168.43.146.8880 > 192.168.43.147.7772: UDP, length 120
01:09:37.931654 IP 192.168.43.147.8880 > 192.168.43.124.7773: UDP, length 120
01:09:37.957349 IP 192.168.43.146.8880 > 192.168.43.147.7772: UDP, length 120
01:09:37.981653 IP 192.168.43.147.8880 > 192.168.43.124.7773: UDP, length 120
01:09:38.012124 IP 192.168.43.146.8880 > 192.168.43.147.7772: UDP, length 120
01:09:38.031656 IP 192.168.43.147.8880 > 192.168.43.124.7773: UDP, length 120
01:09:38.059364 IP 192.168.43.146.8880 > 192.168.43.147.7772: UDP, length 120
01:09:38.081656 IP 192.168.43.147.8880 > 192.168.43.124.7773: UDP, length 120
01:09:38.106394 IP 192.168.43.146.8880 > 192.168.43.147.7772: UDP, length 120
01:09:38.131655 IP 192.168.43.147.8880 > 192.168.43.124.7773: UDP, length 120
01:09:38.162312 IP 192.168.43.146.8880 > 192.168.43.147.7772: UDP, length 120
01:09:38.181655 IP 192.168.43.147.8880 > 192.168.43.124.7773: UDP, length 120
01:09:38.215758 IP 192.168.43.146.8880 > 192.168.43.147.7772: UDP, length 120
01:09:38.231655 IP 192.168.43.147.8880 > 192.168.43.124.7773: UDP, length 120
01:09:38.270258 IP 192.168.43.146.8880 > 192.168.43.147.7772: UDP, length 120
01:09:38.281658 IP 192.168.43.147.8880 > 192.168.43.124.7773: UDP, length 120
01:09:38.300816 IP 192.168.43.146.8880 > 192.168.43.147.7772: UDP, length 120
01:09:38.331663 IP 192.168.43.147.8880 > 192.168.43.124.7773: UDP, length 120
01:09:38.350694 IP 192.168.43.146.8880 > 192.168.43.147.7772: UDP, length 120
01:09:38.381668 IP 192.168.43.147.8880 > 192.168.43.124.7773: UDP, length 120
01:09:38.403088 IP 192.168.43.146.8880 > 192.168.43.147.7772: UDP, length 120
01:09:38.431660 IP 192.168.43.147.8880 > 192.168.43.124.7773: UDP, length 120
01:09:38.462399 IP 192.168.43.146.8880 > 192.168.43.147.7772: UDP, length 120
01:09:38.481654 IP 192.168.43.147.8880 > 192.168.43.124.7773: UDP, length 120
01:09:38.517452 IP 192.168.43.146.8880 > 192.168.43.147.7772: UDP, length 120
01:09:38.531653 IP 192.168.43.147.8880 > 192.168.43.124.7773: UDP, length 120
01:09:38.571768 IP 192.168.43.146.8880 > 192.168.43.147.7772: UDP, length 120
01:09:38.581654 IP 192.168.43.147.8880 > 192.168.43.124.7773: UDP, length 120
01:09:38.606240 IP 192.168.43.146.8880 > 192.168.43.147.7772: UDP, length 120
01:09:38.631658 IP 192.168.43.147.8880 > 192.168.43.124.7773: UDP, length 120
01:09:38.666419 IP 192.168.43.146.8880 > 192.168.43.147.7772: UDP, length 120
01:09:38.681655 IP 192.168.43.147.8880 > 192.168.43.124.7773: UDP, length 120
01:09:38.709085 IP 192.168.43.146.8880 > 192.168.43.147.7772: UDP, length 120
01:09:38.731659 IP 192.168.43.147.8880 > 192.168.43.124.7773: UDP, length 120
01:09:38.760017 IP 192.168.43.146.8880 > 192.168.43.147.7772: UDP, length 120
01:09:38.781656 IP 192.168.43.147.8880 > 192.168.43.124.7773: UDP, length 120
01:09:38.814763 IP 192.168.43.146.8880 > 192.168.43.147.7772: UDP, length 120
01:09:38.831655 IP 192.168.43.147.8880 > 192.168.43.124.7773: UDP, length 120
01:09:38.869672 IP 192.168.43.146.8880 > 192.168.43.147.7772: UDP, length 120
01:09:38.881655 IP 192.168.43.147.8880 > 192.168.43.124.7773: UDP, length 120
01:09:38.931656 IP 192.168.43.147.8880 > 192.168.43.124.7773: UDP, length 120
01:09:38.935039 IP 192.168.43.146.8880 > 192.168.43.147.7772: UDP, length 120
01:09:38.963984 IP 192.168.43.146.8880 > 192.168.43.147.7772: UDP, length 120
01:09:38.981701 IP 192.168.43.147.8880 > 192.168.43.124.7773: UDP, length 120
01:09:39.003641 IP 192.168.43.146.8880 > 192.168.43.147.7772: UDP, length 120
01:09:39.031663 IP 192.168.43.147.8880 > 192.168.43.124.7773: UDP, length 120
01:09:39.067251 IP 192.168.43.146.8880 > 192.168.43.147.7772: UDP, length 120
01:09:39.081655 IP 192.168.43.147.8880 > 192.168.43.124.7773: UDP, length 120
01:09:39.112266 IP 192.168.43.146.8880 > 192.168.43.147.7772: UDP, length 120
01:09:39.131706 IP 192.168.43.147.8880 > 192.168.43.124.7773: UDP, length 120
01:09:39.169667 IP 192.168.43.146.8880 > 192.168.43.147.7772: UDP, length 120
01:09:39.181653 IP 192.168.43.147.8880 > 192.168.43.124.7773: UDP, length 120
01:09:39.204621 IP 192.168.43.146.8880 > 192.168.43.147.7772: UDP, length 120
01:09:39.231653 IP 192.168.43.147.8880 > 192.168.43.124.7773: UDP, length 120
01:09:39.246037 IP 192.168.43.146.8880 > 192.168.43.147.7772: UDP, length 120
01:09:39.281653 IP 192.168.43.147.8880 > 192.168.43.124.7773: UDP, length 120
01:09:39.303656 IP 192.168.43.146.8880 > 192.168.43.147.7772: UDP, length 120
01:09:39.331660 IP 192.168.43.147.8880 > 192.168.43.124.7773: UDP, length 120
01:09:39.360775 IP 192.168.43.146.8880 > 192.168.43.147.7772: UDP, length 120
01:09:39.381655 IP 192.168.43.147.8880 > 192.168.43.124.7773: UDP, length 120
01:09:39.395431 IP 192.168.43.146.8880 > 192.168.43.147.7772: UDP, length 120
01:09:39.431659 IP 192.168.43.147.8880 > 192.168.43.124.7773: UDP, length 120
01:09:39.452994 IP 192.168.43.146.8880 > 192.168.43.147.7772: UDP, length 120
01:09:39.481655 IP 192.168.43.147.8880 > 192.168.43.124.7773: UDP, length 120
01:09:39.495904 IP 192.168.43.146.8880 > 192.168.43.147.7772: UDP, length 120
01:09:39.531654 IP 192.168.43.147.8880 > 192.168.43.124.7773: UDP, length 120
01:09:39.546349 IP 192.168.43.146.8880 > 192.168.43.147.7772: UDP, length 120
01:09:39.581652 IP 192.168.43.147.8880 > 192.168.43.124.7773: UDP, length 120
01:09:39.604572 IP 192.168.43.146.8880 > 192.168.43.147.7772: UDP, length 120
01:09:39.631658 IP 192.168.43.147.8880 > 192.168.43.124.7773: UDP, length 120
01:09:39.662707 IP 192.168.43.146.8880 > 192.168.43.147.7772: UDP, length 120
01:09:39.681653 IP 192.168.43.147.8880 > 192.168.43.124.7773: UDP, length 120
01:09:39.695633 IP 192.168.43.146.8880 > 192.168.43.147.7772: UDP, length 120
01:09:39.731654 IP 192.168.43.147.8880 > 192.168.43.124.7773: UDP, length 120
01:09:39.745908 IP 192.168.43.146.8880 > 192.168.43.147.7772: UDP, length 120
01:09:39.781653 IP 192.168.43.147.8880 > 192.168.43.124.7773: UDP, length 120
01:09:39.800966 IP 192.168.43.146.8880 > 192.168.43.147.7772: UDP, length 120
01:09:39.831653 IP 192.168.43.147.8880 > 192.168.43.124.7773: UDP, length 120
01:09:39.853436 IP 192.168.43.146.8880 > 192.168.43.147.7772: UDP, length 120
01:09:39.881653 IP 192.168.43.147.8880 > 192.168.43.124.7773: UDP, length 120
01:09:39.908696 IP 192.168.43.146.8880 > 192.168.43.147.7772: UDP, length 120
01:09:39.931653 IP 192.168.43.147.8880 > 192.168.43.124.7773: UDP, length 120
01:09:39.963966 IP 192.168.43.146.8880 > 192.168.43.147.7772: UDP, length 120
01:09:39.981654 IP 192.168.43.147.8880 > 192.168.43.124.7773: UDP, length 120
01:09:39.998772 IP 192.168.43.146.8880 > 192.168.43.147.7772: UDP, length 120
01:09:40.031654 IP 192.168.43.147.8880 > 192.168.43.124.7773: UDP, length 120
01:09:40.053057 IP 192.168.43.146.8880 > 192.168.43.147.7772: UDP, length 120
01:09:40.081653 IP 192.168.43.147.8880 > 192.168.43.124.7773: UDP, length 120
01:09:40.100705 IP 192.168.43.146.8880 > 192.168.43.147.7772: UDP, length 120
01:09:40.131653 IP 192.168.43.147.8880 > 192.168.43.124.7773: UDP, length 120
01:09:40.154476 IP 192.168.43.146.8880 > 192.168.43.147.7772: UDP, length 120
01:09:40.181654 IP 192.168.43.147.8880 > 192.168.43.124.7773: UDP, length 120
01:09:40.216862 IP 192.168.43.146.8880 > 192.168.43.147.7772: UDP, length 120
01:09:40.231652 IP 192.168.43.147.8880 > 192.168.43.124.7773: UDP, length 120
01:09:40.251827 IP 192.168.43.146.8880 > 192.168.43.147.7772: UDP, length 120
01:09:40.281652 IP 192.168.43.147.8880 > 192.168.43.124.7773: UDP, length 120
01:09:40.307063 IP 192.168.43.146.8880 > 192.168.43.147.7772: UDP, length 120
01:09:40.331655 IP 192.168.43.147.8880 > 192.168.43.124.7773: UDP, length 120
01:09:40.345925 IP 192.168.43.146.8880 > 192.168.43.147.7772: UDP, length 120
01:09:40.381654 IP 192.168.43.147.8880 > 192.168.43.124.7773: UDP, length 120
01:09:40.395756 IP 192.168.43.146.8880 > 192.168.43.147.7772: UDP, length 120
01:09:40.431655 IP 192.168.43.147.8880 > 192.168.43.124.7773: UDP, length 120
01:09:40.450973 IP 192.168.43.146.8880 > 192.168.43.147.7772: UDP, length 120
01:09:40.481695 IP 192.168.43.147.8880 > 192.168.43.124.7773: UDP, length 120
01:09:40.496878 IP 192.168.43.146.8880 > 192.168.43.147.7772: UDP, length 120
01:09:40.531674 IP 192.168.43.147.8880 > 192.168.43.124.7773: UDP, length 120
01:09:40.566066 IP 192.168.43.146.8880 > 192.168.43.147.7772: UDP, length 120
01:09:40.581658 IP 192.168.43.147.8880 > 192.168.43.124.7773: UDP, length 120
01:09:40.603276 IP 192.168.43.146.8880 > 192.168.43.147.7772: UDP, length 120
01:09:40.631661 IP 192.168.43.147.8880 > 192.168.43.124.7773: UDP, length 120
01:09:40.654953 IP 192.168.43.146.8880 > 192.168.43.147.7772: UDP, length 120
01:09:40.681658 IP 192.168.43.147.8880 > 192.168.43.124.7773: UDP, length 120
01:09:40.721445 IP 192.168.43.146.8880 > 192.168.43.147.7772: UDP, length 120
01:09:40.731655 IP 192.168.43.147.8880 > 192.168.43.124.7773: UDP, length 120
01:09:40.752263 IP 192.168.43.146.8880 > 192.168.43.147.7772: UDP, length 120
01:09:40.781655 IP 192.168.43.147.8880 > 192.168.43.124.7773: UDP, length 120
01:09:40.802095 IP 192.168.43.146.8880 > 192.168.43.147.7772: UDP, length 120
01:09:40.831653 IP 192.168.43.147.8880 > 192.168.43.124.7773: UDP, length 120
01:09:40.855411 IP 192.168.43.146.8880 > 192.168.43.147.7772: UDP, length 120
01:09:40.881655 IP 192.168.43.147.8880 > 192.168.43.124.7773: UDP, length 120
01:09:40.914250 IP 192.168.43.146.8880 > 192.168.43.147.7772: UDP, length 120
01:09:40.931655 IP 192.168.43.147.8880 > 192.168.43.124.7773: UDP, length 120
01:09:40.946082 IP 192.168.43.146.8880 > 192.168.43.147.7772: UDP, length 120
01:09:40.981653 IP 192.168.43.147.8880 > 192.168.43.124.7773: UDP, length 120
01:09:41.000824 IP 192.168.43.146.8880 > 192.168.43.147.7772: UDP, length 120
01:09:41.031654 IP 192.168.43.147.8880 > 192.168.43.124.7773: UDP, length 120
01:09:41.057530 IP 192.168.43.146.8880 > 192.168.43.147.7772: UDP, length 120
01:09:41.081653 IP 192.168.43.147.8880 > 192.168.43.124.7773: UDP, length 120
01:09:41.101785 IP 192.168.43.146.8880 > 192.168.43.147.7772: UDP, length 120
01:09:41.131653 IP 192.168.43.147.8880 > 192.168.43.124.7773: UDP, length 120
01:09:41.153672 IP 192.168.43.146.8880 > 192.168.43.147.7772: UDP, length 120
01:09:41.181654 IP 192.168.43.147.8880 > 192.168.43.124.7773: UDP, length 120
01:09:41.197072 IP 192.168.43.146.8880 > 192.168.43.147.7772: UDP, length 120
01:09:41.231652 IP 192.168.43.147.8880 > 192.168.43.124.7773: UDP, length 120
01:09:41.246900 IP 192.168.43.146.8880 > 192.168.43.147.7772: UDP, length 120
01:09:41.281653 IP 192.168.43.147.8880 > 192.168.43.124.7773: UDP, length 120
01:09:41.320058 IP 192.168.43.146.8880 > 192.168.43.147.7772: UDP, length 120
01:09:41.331684 IP 192.168.43.147.8880 > 192.168.43.124.7773: UDP, length 120
01:09:41.350285 IP 192.168.43.146.8880 > 192.168.43.147.7772: UDP, length 120
01:09:41.381659 IP 192.168.43.147.8880 > 192.168.43.124.7773: UDP, length 120
01:09:41.396360 IP 192.168.43.146.8880 > 192.168.43.147.7772: UDP, length 120
01:09:41.431655 IP 192.168.43.147.8880 > 192.168.43.124.7773: UDP, length 120
01:09:41.476451 IP 192.168.43.146.8880 > 192.168.43.147.7772: UDP, length 120
01:09:41.481655 IP 192.168.43.147.8880 > 192.168.43.124.7773: UDP, length 120
01:09:41.496101 IP 192.168.43.146.8880 > 192.168.43.147.7772: UDP, length 120
01:09:41.531655 IP 192.168.43.147.8880 > 192.168.43.124.7773: UDP, length 120
01:09:41.551665 IP 192.168.43.146.8880 > 192.168.43.147.7772: UDP, length 120
01:09:41.581663 IP 192.168.43.147.8880 > 192.168.43.124.7773: UDP, length 120
01:09:41.615883 IP 192.168.43.146.8880 > 192.168.43.147.7772: UDP, length 120
01:09:41.631663 IP 192.168.43.147.8880 > 192.168.43.124.7773: UDP, length 120
01:09:41.646543 IP 192.168.43.146.8880 > 192.168.43.147.7772: UDP, length 120
01:09:41.681656 IP 192.168.43.147.8880 > 192.168.43.124.7773: UDP, length 120
01:09:41.697139 IP 192.168.43.146.8880 > 192.168.43.147.7772: UDP, length 120
01:09:41.731657 IP 192.168.43.147.8880 > 192.168.43.124.7773: UDP, length 120
01:09:41.769909 IP 192.168.43.146.8880 > 192.168.43.147.7772: UDP, length 120
01:09:41.781654 IP 192.168.43.147.8880 > 192.168.43.124.7773: UDP, length 120
01:09:41.800758 IP 192.168.43.146.8880 > 192.168.43.147.7772: UDP, length 120
01:09:41.831654 IP 192.168.43.147.8880 > 192.168.43.124.7773: UDP, length 120
01:09:41.846030 IP 192.168.43.146.8880 > 192.168.43.147.7772: UDP, length 120
01:09:41.881654 IP 192.168.43.147.8880 > 192.168.43.124.7773: UDP, length 120
01:09:41.918096 IP 192.168.43.146.8880 > 192.168.43.147.7772: UDP, length 120
01:09:41.931653 IP 192.168.43.147.8880 > 192.168.43.124.7773: UDP, length 120
01:09:41.946283 IP 192.168.43.146.8880 > 192.168.43.147.7772: UDP, length 120
01:09:41.983603 IP 192.168.43.147.8880 > 192.168.43.124.7773: UDP, length 120
01:09:42.003061 IP 192.168.43.146.8880 > 192.168.43.147.7772: UDP, length 120
01:09:42.031757 IP 192.168.43.147.8880 > 192.168.43.124.7773: UDP, length 120
01:09:42.046420 IP 192.168.43.146.8880 > 192.168.43.147.7772: UDP, length 120
01:09:42.081773 IP 192.168.43.147.8880 > 192.168.43.124.7773: UDP, length 120
01:09:42.096867 IP 192.168.43.146.8880 > 192.168.43.147.7772: UDP, length 120
01:09:42.131720 IP 192.168.43.147.8880 > 192.168.43.124.7773: UDP, length 120
01:09:42.147429 IP 192.168.43.146.8880 > 192.168.43.147.7772: UDP, length 120
01:09:42.181696 IP 192.168.43.147.8880 > 192.168.43.124.7773: UDP, length 120
01:09:42.222810 IP 192.168.43.146.8880 > 192.168.43.147.7772: UDP, length 120
01:09:42.231703 IP 192.168.43.147.8880 > 192.168.43.124.7773: UDP, length 120
01:09:42.245727 IP 192.168.43.146.8880 > 192.168.43.147.7772: UDP, length 120
01:09:42.281721 IP 192.168.43.147.8880 > 192.168.43.124.7773: UDP, length 120
01:09:42.300650 IP 192.168.43.146.8880 > 192.168.43.147.7772: UDP, length 120
01:09:42.331710 IP 192.168.43.147.8880 > 192.168.43.124.7773: UDP, length 120
01:09:42.369492 IP 192.168.43.146.8880 > 192.168.43.147.7772: UDP, length 120
01:09:42.381712 IP 192.168.43.147.8880 > 192.168.43.124.7773: UDP, length 120
01:09:42.403407 IP 192.168.43.146.8880 > 192.168.43.147.7772: UDP, length 120
01:09:42.431709 IP 192.168.43.147.8880 > 192.168.43.124.7773: UDP, length 120
01:09:42.460637 IP 192.168.43.146.8880 > 192.168.43.147.7772: UDP, length 120
01:09:42.481666 IP 192.168.43.147.8880 > 192.168.43.124.7773: UDP, length 120
01:09:42.496877 IP 192.168.43.146.8880 > 192.168.43.147.7772: UDP, length 120
01:09:42.531634 IP 192.168.43.147.8880 > 192.168.43.124.7773: UDP, length 120
01:09:42.551181 IP 192.168.43.146.8880 > 192.168.43.147.7772: UDP, length 120
01:09:42.581632 IP 192.168.43.147.8880 > 192.168.43.124.7773: UDP, length 120
01:09:42.620129 IP 192.168.43.146.8880 > 192.168.43.147.7772: UDP, length 120
01:09:42.631640 IP 192.168.43.147.8880 > 192.168.43.124.7773: UDP, length 120
01:09:42.651000 IP 192.168.43.146.8880 > 192.168.43.147.7772: UDP, length 120
01:09:42.681630 IP 192.168.43.147.8880 > 192.168.43.124.7773: UDP, length 120
01:09:42.703588 IP 192.168.43.146.8880 > 192.168.43.147.7772: UDP, length 120
01:09:42.731629 IP 192.168.43.147.8880 > 192.168.43.124.7773: UDP, length 120
01:09:42.771170 IP 192.168.43.146.8880 > 192.168.43.147.7772: UDP, length 120
01:09:42.781628 IP 192.168.43.147.8880 > 192.168.43.124.7773: UDP, length 120
01:09:42.804959 IP 192.168.43.146.8880 > 192.168.43.147.7772: UDP, length 120
01:09:42.831627 IP 192.168.43.147.8880 > 192.168.43.124.7773: UDP, length 120
01:09:42.855599 IP 192.168.43.146.8880 > 192.168.43.147.7772: UDP, length 120
01:09:42.881628 IP 192.168.43.147.8880 > 192.168.43.124.7773: UDP, length 120
01:09:42.919161 IP 192.168.43.146.8880 > 192.168.43.147.7772: UDP, length 120
01:09:42.931628 IP 192.168.43.147.8880 > 192.168.43.124.7773: UDP, length 120
01:09:42.958371 IP 192.168.43.146.8880 > 192.168.43.147.7772: UDP, length 120
01:09:42.981627 IP 192.168.43.147.8880 > 192.168.43.124.7773: UDP, length 120
01:09:43.031629 IP 192.168.43.147.8880 > 192.168.43.124.7773: UDP, length 120
01:09:43.069567 IP 192.168.43.146.8880 > 192.168.43.147.7772: UDP, length 120
01:09:43.071924 IP 192.168.43.146.8880 > 192.168.43.147.7772: UDP, length 120
01:09:43.081628 IP 192.168.43.147.8880 > 192.168.43.124.7773: UDP, length 120
01:09:43.112391 IP 192.168.43.146.8880 > 192.168.43.147.7772: UDP, length 120
01:09:43.131627 IP 192.168.43.147.8880 > 192.168.43.124.7773: UDP, length 120
01:09:43.165481 IP 192.168.43.146.8880 > 192.168.43.147.7772: UDP, length 120
01:09:43.181632 IP 192.168.43.147.8880 > 192.168.43.124.7773: UDP, length 120
01:09:43.220102 IP 192.168.43.146.8880 > 192.168.43.147.7772: UDP, length 120
01:09:43.231627 IP 192.168.43.147.8880 > 192.168.43.124.7773: UDP, length 120
01:09:43.265539 IP 192.168.43.146.8880 > 192.168.43.147.7772: UDP, length 120
01:09:43.281627 IP 192.168.43.147.8880 > 192.168.43.124.7773: UDP, length 120
01:09:43.316899 IP 192.168.43.146.8880 > 192.168.43.147.7772: UDP, length 120
01:09:43.331631 IP 192.168.43.147.8880 > 192.168.43.124.7773: UDP, length 120
01:09:43.368091 IP 192.168.43.146.8880 > 192.168.43.147.7772: UDP, length 120
01:09:43.381630 IP 192.168.43.147.8880 > 192.168.43.124.7773: UDP, length 120
01:09:43.405964 IP 192.168.43.146.8880 > 192.168.43.147.7772: UDP, length 120
01:09:43.431628 IP 192.168.43.147.8880 > 192.168.43.124.7773: UDP, length 120
01:09:43.479233 IP 192.168.43.146.8880 > 192.168.43.147.7772: UDP, length 120
01:09:43.481656 IP 192.168.43.147.8880 > 192.168.43.124.7773: UDP, length 120
01:09:43.528372 IP 192.168.43.146.8880 > 192.168.43.147.7772: UDP, length 120
01:09:43.531630 IP 192.168.43.147.8880 > 192.168.43.124.7773: UDP, length 120
01:09:43.581633 IP 192.168.43.147.8880 > 192.168.43.124.7773: UDP, length 120
01:09:43.595393 IP 192.168.43.146.8880 > 192.168.43.147.7772: UDP, length 120
01:09:43.611812 IP 192.168.43.146.8880 > 192.168.43.147.7772: UDP, length 120
01:09:43.631634 IP 192.168.43.147.8880 > 192.168.43.124.7773: UDP, length 120
01:09:43.668270 IP 192.168.43.146.8880 > 192.168.43.147.7772: UDP, length 120
01:09:43.681631 IP 192.168.43.147.8880 > 192.168.43.124.7773: UDP, length 120
01:09:43.708514 IP 192.168.43.146.8880 > 192.168.43.147.7772: UDP, length 120
01:09:43.731630 IP 192.168.43.147.8880 > 192.168.43.124.7773: UDP, length 120
01:09:43.781632 IP 192.168.43.147.8880 > 192.168.43.124.7773: UDP, length 120
01:09:43.785509 IP 192.168.43.146.8880 > 192.168.43.147.7772: UDP, length 120
01:09:43.822419 IP 192.168.43.146.8880 > 192.168.43.147.7772: UDP, length 120
01:09:43.831631 IP 192.168.43.147.8880 > 192.168.43.124.7773: UDP, length 120
01:09:43.881629 IP 192.168.43.147.8880 > 192.168.43.124.7773: UDP, length 120
01:09:43.886836 IP 192.168.43.146.8880 > 192.168.43.147.7772: UDP, length 120
01:09:43.901498 IP 192.168.43.146.8880 > 192.168.43.147.7772: UDP, length 120
01:09:43.931630 IP 192.168.43.147.8880 > 192.168.43.124.7773: UDP, length 120
01:09:43.960232 IP 192.168.43.146.8880 > 192.168.43.147.7772: UDP, length 120
01:09:43.981628 IP 192.168.43.147.8880 > 192.168.43.124.7773: UDP, length 120
01:09:44.004024 IP 192.168.43.146.8880 > 192.168.43.147.7772: UDP, length 120
