23:54:49.359994 IP 192.168.43.146.8880 > 192.168.43.147.7772: UDP, length 120
23:54:49.409970 IP 192.168.43.146.8880 > 192.168.43.147.7772: UDP, length 120
23:54:49.459983 IP 192.168.43.146.8880 > 192.168.43.147.7772: UDP, length 120
23:54:49.509962 IP 192.168.43.146.8880 > 192.168.43.147.7772: UDP, length 120
23:54:49.559959 IP 192.168.43.146.8880 > 192.168.43.147.7772: UDP, length 120
23:54:49.609958 IP 192.168.43.146.8880 > 192.168.43.147.7772: UDP, length 120
23:54:49.660022 IP 192.168.43.146.8880 > 192.168.43.147.7772: UDP, length 120
23:54:49.709983 IP 192.168.43.146.8880 > 192.168.43.147.7772: UDP, length 120
23:54:49.759961 IP 192.168.43.146.8880 > 192.168.43.147.7772: UDP, length 120
23:54:49.809959 IP 192.168.43.146.8880 > 192.168.43.147.7772: UDP, length 120
23:54:49.859959 IP 192.168.43.146.8880 > 192.168.43.147.7772: UDP, length 120
23:54:49.909963 IP 192.168.43.146.8880 > 192.168.43.147.7772: UDP, length 120
23:54:49.959959 IP 192.168.43.146.8880 > 192.168.43.147.7772: UDP, length 120
23:54:50.009967 IP 192.168.43.146.8880 > 192.168.43.147.7772: UDP, length 120
23:54:50.059966 IP 192.168.43.146.8880 > 192.168.43.147.7772: UDP, length 120
23:54:50.109959 IP 192.168.43.146.8880 > 192.168.43.147.7772: UDP, length 120
23:54:50.159958 IP 192.168.43.146.8880 > 192.168.43.147.7772: UDP, length 120
23:54:50.209958 IP 192.168.43.146.8880 > 192.168.43.147.7772: UDP, length 120
23:54:50.259958 IP 192.168.43.146.8880 > 192.168.43.147.7772: UDP, length 120
23:54:50.309956 IP 192.168.43.146.8880 > 192.168.43.147.7772: UDP, length 120
23:54:50.359958 IP 192.168.43.146.8880 > 192.168.43.147.7772: UDP, length 120
23:54:50.409998 IP 192.168.43.146.8880 > 192.168.43.147.7772: UDP, length 120
23:54:50.459981 IP 192.168.43.146.8880 > 192.168.43.147.7772: UDP, length 120
23:54:50.509963 IP 192.168.43.146.8880 > 192.168.43.147.7772: UDP, length 120
23:54:50.559968 IP 192.168.43.146.8880 > 192.168.43.147.7772: UDP, length 120
23:54:50.609967 IP 192.168.43.146.8880 > 192.168.43.147.7772: UDP, length 120
23:54:50.660044 IP 192.168.43.146.8880 > 192.168.43.147.7772: UDP, length 120
23:54:50.709980 IP 192.168.43.146.8880 > 192.168.43.147.7772: UDP, length 120
23:54:50.759960 IP 192.168.43.146.8880 > 192.168.43.147.7772: UDP, length 120
23:54:50.809967 IP 192.168.43.146.8880 > 192.168.43.147.7772: UDP, length 120
23:54:50.859967 IP 192.168.43.146.8880 > 192.168.43.147.7772: UDP, length 120
23:54:50.909966 IP 192.168.43.146.8880 > 192.168.43.147.7772: UDP, length 120
23:54:50.959968 IP 192.168.43.146.8880 > 192.168.43.147.7772: UDP, length 120
23:54:51.009971 IP 192.168.43.146.8880 > 192.168.43.147.7772: UDP, length 120
23:54:51.060010 IP 192.168.43.146.8880 > 192.168.43.147.7772: UDP, length 120
23:54:51.110030 IP 192.168.43.146.8880 > 192.168.43.147.7772: UDP, length 120
23:54:51.160065 IP 192.168.43.146.8880 > 192.168.43.147.7772: UDP, length 120
23:54:51.210035 IP 192.168.43.146.8880 > 192.168.43.147.7772: UDP, length 120
23:54:51.260032 IP 192.168.43.146.8880 > 192.168.43.147.7772: UDP, length 120
23:54:51.310032 IP 192.168.43.146.8880 > 192.168.43.147.7772: UDP, length 120
23:54:51.360046 IP 192.168.43.146.8880 > 192.168.43.147.7772: UDP, length 120
23:54:51.410053 IP 192.168.43.146.8880 > 192.168.43.147.7772: UDP, length 120
23:54:51.460046 IP 192.168.43.146.8880 > 192.168.43.147.7772: UDP, length 120
23:54:51.510006 IP 192.168.43.146.8880 > 192.168.43.147.7772: UDP, length 120
23:54:51.559966 IP 192.168.43.146.8880 > 192.168.43.147.7772: UDP, length 120
23:54:51.609960 IP 192.168.43.146.8880 > 192.168.43.147.7772: UDP, length 120
23:54:51.659958 IP 192.168.43.146.8880 > 192.168.43.147.7772: UDP, length 120
23:54:51.710013 IP 192.168.43.146.8880 > 192.168.43.147.7772: UDP, length 120
23:54:51.759961 IP 192.168.43.146.8880 > 192.168.43.147.7772: UDP, length 120
23:54:51.809958 IP 192.168.43.146.8880 > 192.168.43.147.7772: UDP, length 120
23:54:51.859958 IP 192.168.43.146.8880 > 192.168.43.147.7772: UDP, length 120
23:54:51.909999 IP 192.168.43.146.8880 > 192.168.43.147.7772: UDP, length 120
23:54:51.959961 IP 192.168.43.146.8880 > 192.168.43.147.7772: UDP, length 120
23:54:52.009965 IP 192.168.43.146.8880 > 192.168.43.147.7772: UDP, length 120
23:54:52.059959 IP 192.168.43.146.8880 > 192.168.43.147.7772: UDP, length 120
23:54:52.109960 IP 192.168.43.146.8880 > 192.168.43.147.7772: UDP, length 120
23:54:52.159957 IP 192.168.43.146.8880 > 192.168.43.147.7772: UDP, length 120
23:54:52.209957 IP 192.168.43.146.8880 > 192.168.43.147.7772: UDP, length 120
23:54:52.259956 IP 192.168.43.146.8880 > 192.168.43.147.7772: UDP, length 120
23:54:52.309956 IP 192.168.43.146.8880 > 192.168.43.147.7772: UDP, length 120
23:54:52.359954 IP 192.168.43.146.8880 > 192.168.43.147.7772: UDP, length 120
23:54:52.409958 IP 192.168.43.146.8880 > 192.168.43.147.7772: UDP, length 120
23:54:52.459974 IP 192.168.43.146.8880 > 192.168.43.147.7772: UDP, length 120
23:54:52.509958 IP 192.168.43.146.8880 > 192.168.43.147.7772: UDP, length 120
23:54:52.559957 IP 192.168.43.146.8880 > 192.168.43.147.7772: UDP, length 120
23:54:52.609958 IP 192.168.43.146.8880 > 192.168.43.147.7772: UDP, length 120
23:54:52.659988 IP 192.168.43.146.8880 > 192.168.43.147.7772: UDP, length 120
23:54:52.710025 IP 192.168.43.146.8880 > 192.168.43.147.7772: UDP, length 120
23:54:52.759988 IP 192.168.43.146.8880 > 192.168.43.147.7772: UDP, length 120
23:54:52.809985 IP 192.168.43.146.8880 > 192.168.43.147.7772: UDP, length 120
23:54:52.859983 IP 192.168.43.146.8880 > 192.168.43.147.7772: UDP, length 120
23:54:52.909982 IP 192.168.43.146.8880 > 192.168.43.147.7772: UDP, length 120
23:54:52.959983 IP 192.168.43.146.8880 > 192.168.43.147.7772: UDP, length 120
23:54:53.009984 IP 192.168.43.146.8880 > 192.168.43.147.7772: UDP, length 120
23:54:53.059988 IP 192.168.43.146.8880 > 192.168.43.147.7772: UDP, length 120
23:54:53.109985 IP 192.168.43.146.8880 > 192.168.43.147.7772: UDP, length 120
23:54:53.159982 IP 192.168.43.146.8880 > 192.168.43.147.7772: UDP, length 120
23:54:53.209981 IP 192.168.43.146.8880 > 192.168.43.147.7772: UDP, length 120
23:54:53.259979 IP 192.168.43.146.8880 > 192.168.43.147.7772: UDP, length 120
23:54:53.309979 IP 192.168.43.146.8880 > 192.168.43.147.7772: UDP, length 120
23:54:53.359977 IP 192.168.43.146.8880 > 192.168.43.147.7772: UDP, length 120
23:54:53.410034 IP 192.168.43.146.8880 > 192.168.43.147.7772: UDP, length 120
23:54:53.460007 IP 192.168.43.146.8880 > 192.168.43.147.7772: UDP, length 120
23:54:53.509983 IP 192.168.43.146.8880 > 192.168.43.147.7772: UDP, length 120
23:54:53.559983 IP 192.168.43.146.8880 > 192.168.43.147.7772: UDP, length 120
23:54:53.609983 IP 192.168.43.146.8880 > 192.168.43.147.7772: UDP, length 120
23:54:53.659981 IP 192.168.43.146.8880 > 192.168.43.147.7772: UDP, length 120
23:54:53.709981 IP 192.168.43.146.8880 > 192.168.43.147.7772: UDP, length 120
23:54:53.759980 IP 192.168.43.146.8880 > 192.168.43.147.7772: UDP, length 120
23:54:53.809944 IP 192.168.43.146.8880 > 192.168.43.147.7772: UDP, length 120
23:54:53.859981 IP 192.168.43.146.8880 > 192.168.43.147.7772: UDP, length 120
23:54:53.909982 IP 192.168.43.146.8880 > 192.168.43.147.7772: UDP, length 120
23:54:53.959983 IP 192.168.43.146.8880 > 192.168.43.147.7772: UDP, length 120
23:54:54.009982 IP 192.168.43.146.8880 > 192.168.43.147.7772: UDP, length 120
23:54:54.059983 IP 192.168.43.146.8880 > 192.168.43.147.7772: UDP, length 120
23:54:54.109986 IP 192.168.43.146.8880 > 192.168.43.147.7772: UDP, length 120
23:54:54.159986 IP 192.168.43.146.8880 > 192.168.43.147.7772: UDP, length 120
23:54:54.209983 IP 192.168.43.146.8880 > 192.168.43.147.7772: UDP, length 120
23:54:54.259982 IP 192.168.43.146.8880 > 192.168.43.147.7772: UDP, length 120
23:54:54.309983 IP 192.168.43.146.8880 > 192.168.43.147.7772: UDP, length 120
23:54:54.359979 IP 192.168.43.146.8880 > 192.168.43.147.7772: UDP, length 120
23:54:54.409985 IP 192.168.43.146.8880 > 192.168.43.147.7772: UDP, length 120
23:54:54.460020 IP 192.168.43.146.8880 > 192.168.43.147.7772: UDP, length 120
23:54:54.509987 IP 192.168.43.146.8880 > 192.168.43.147.7772: UDP, length 120
23:54:54.559983 IP 192.168.43.146.8880 > 192.168.43.147.7772: UDP, length 120
23:54:54.609983 IP 192.168.43.146.8880 > 192.168.43.147.7772: UDP, length 120
23:54:54.659983 IP 192.168.43.146.8880 > 192.168.43.147.7772: UDP, length 120
23:54:54.710074 IP 192.168.43.146.8880 > 192.168.43.147.7772: UDP, length 120
23:54:54.760109 IP 192.168.43.146.8880 > 192.168.43.147.7772: UDP, length 120
23:54:54.810068 IP 192.168.43.146.8880 > 192.168.43.147.7772: UDP, length 120
23:54:54.860060 IP 192.168.43.146.8880 > 192.168.43.147.7772: UDP, length 120
23:54:54.910037 IP 192.168.43.146.8880 > 192.168.43.147.7772: UDP, length 120
23:54:54.959989 IP 192.168.43.146.8880 > 192.168.43.147.7772: UDP, length 120
23:54:55.009984 IP 192.168.43.146.8880 > 192.168.43.147.7772: UDP, length 120
23:54:55.059982 IP 192.168.43.146.8880 > 192.168.43.147.7772: UDP, length 120
23:54:55.109984 IP 192.168.43.146.8880 > 192.168.43.147.7772: UDP, length 120
23:54:55.159984 IP 192.168.43.146.8880 > 192.168.43.147.7772: UDP, length 120
23:54:55.209988 IP 192.168.43.146.8880 > 192.168.43.147.7772: UDP, length 120
23:54:55.259986 IP 192.168.43.146.8880 > 192.168.43.147.7772: UDP, length 120
23:54:55.309982 IP 192.168.43.146.8880 > 192.168.43.147.7772: UDP, length 120
23:54:55.359982 IP 192.168.43.146.8880 > 192.168.43.147.7772: UDP, length 120
23:54:55.409986 IP 192.168.43.146.8880 > 192.168.43.147.7772: UDP, length 120
23:54:55.459998 IP 192.168.43.146.8880 > 192.168.43.147.7772: UDP, length 120
23:54:55.509987 IP 192.168.43.146.8880 > 192.168.43.147.7772: UDP, length 120
23:54:55.559985 IP 192.168.43.146.8880 > 192.168.43.147.7772: UDP, length 120
23:54:55.609987 IP 192.168.43.146.8880 > 192.168.43.147.7772: UDP, length 120
23:54:55.659983 IP 192.168.43.146.8880 > 192.168.43.147.7772: UDP, length 120
23:54:55.709989 IP 192.168.43.146.8880 > 192.168.43.147.7772: UDP, length 120
23:54:55.759984 IP 192.168.43.146.8880 > 192.168.43.147.7772: UDP, length 120
23:54:55.809982 IP 192.168.43.146.8880 > 192.168.43.147.7772: UDP, length 120
23:54:55.860064 IP 192.168.43.146.8880 > 192.168.43.147.7772: UDP, length 120
23:54:55.910077 IP 192.168.43.146.8880 > 192.168.43.147.7772: UDP, length 120
23:54:55.960031 IP 192.168.43.146.8880 > 192.168.43.147.7772: UDP, length 120
23:54:56.009988 IP 192.168.43.146.8880 > 192.168.43.147.7772: UDP, length 120
23:54:56.059983 IP 192.168.43.146.8880 > 192.168.43.147.7772: UDP, length 120
23:54:56.109984 IP 192.168.43.146.8880 > 192.168.43.147.7772: UDP, length 120
23:54:56.159983 IP 192.168.43.146.8880 > 192.168.43.147.7772: UDP, length 120
23:54:56.209983 IP 192.168.43.146.8880 > 192.168.43.147.7772: UDP, length 120
23:54:56.259991 IP 192.168.43.146.8880 > 192.168.43.147.7772: UDP, length 120
23:54:56.309993 IP 192.168.43.146.8880 > 192.168.43.147.7772: UDP, length 120
23:54:56.359982 IP 192.168.43.146.8880 > 192.168.43.147.7772: UDP, length 120
23:54:56.410031 IP 192.168.43.146.8880 > 192.168.43.147.7772: UDP, length 120
23:54:56.460013 IP 192.168.43.146.8880 > 192.168.43.147.7772: UDP, length 120
23:54:56.510068 IP 192.168.43.146.8880 > 192.168.43.147.7772: UDP, length 120
23:54:56.560107 IP 192.168.43.146.8880 > 192.168.43.147.7772: UDP, length 120
23:54:56.610069 IP 192.168.43.146.8880 > 192.168.43.147.7772: UDP, length 120
23:54:56.660043 IP 192.168.43.146.8880 > 192.168.43.147.7772: UDP, length 120
23:54:56.710023 IP 192.168.43.146.8880 > 192.168.43.147.7772: UDP, length 120
23:54:56.760029 IP 192.168.43.146.8880 > 192.168.43.147.7772: UDP, length 120
23:54:56.810027 IP 192.168.43.146.8880 > 192.168.43.147.7772: UDP, length 120
23:54:56.860059 IP 192.168.43.146.8880 > 192.168.43.147.7772: UDP, length 120
23:54:56.910038 IP 192.168.43.146.8880 > 192.168.43.147.7772: UDP, length 120
23:54:56.960015 IP 192.168.43.146.8880 > 192.168.43.147.7772: UDP, length 120
23:54:57.009968 IP 192.168.43.146.8880 > 192.168.43.147.7772: UDP, length 120
23:54:57.059961 IP 192.168.43.146.8880 > 192.168.43.147.7772: UDP, length 120
23:54:57.109961 IP 192.168.43.146.8880 > 192.168.43.147.7772: UDP, length 120
23:54:57.159958 IP 192.168.43.146.8880 > 192.168.43.147.7772: UDP, length 120
23:54:57.209960 IP 192.168.43.146.8880 > 192.168.43.147.7772: UDP, length 120
23:54:57.259960 IP 192.168.43.146.8880 > 192.168.43.147.7772: UDP, length 120
23:54:57.309960 IP 192.168.43.146.8880 > 192.168.43.147.7772: UDP, length 120
23:54:57.359963 IP 192.168.43.146.8880 > 192.168.43.147.7772: UDP, length 120
23:54:57.409963 IP 192.168.43.146.8880 > 192.168.43.147.7772: UDP, length 120
23:54:57.459973 IP 192.168.43.146.8880 > 192.168.43.147.7772: UDP, length 120
23:54:57.509959 IP 192.168.43.146.8880 > 192.168.43.147.7772: UDP, length 120
23:54:57.559958 IP 192.168.43.146.8880 > 192.168.43.147.7772: UDP, length 120
23:54:57.609958 IP 192.168.43.146.8880 > 192.168.43.147.7772: UDP, length 120
23:54:57.659989 IP 192.168.43.146.8880 > 192.168.43.147.7772: UDP, length 120
23:54:57.709985 IP 192.168.43.146.8880 > 192.168.43.147.7772: UDP, length 120
23:54:57.759985 IP 192.168.43.146.8880 > 192.168.43.147.7772: UDP, length 120
23:54:57.809987 IP 192.168.43.146.8880 > 192.168.43.147.7772: UDP, length 120
23:54:57.859984 IP 192.168.43.146.8880 > 192.168.43.147.7772: UDP, length 120
23:54:57.910039 IP 192.168.43.146.8880 > 192.168.43.147.7772: UDP, length 120
23:54:57.960052 IP 192.168.43.146.8880 > 192.168.43.147.7772: UDP, length 120
23:54:58.009990 IP 192.168.43.146.8880 > 192.168.43.147.7772: UDP, length 120
23:54:58.059992 IP 192.168.43.146.8880 > 192.168.43.147.7772: UDP, length 120
23:54:58.109990 IP 192.168.43.146.8880 > 192.168.43.147.7772: UDP, length 120
23:54:58.159994 IP 192.168.43.146.8880 > 192.168.43.147.7772: UDP, length 120
23:54:58.209985 IP 192.168.43.146.8880 > 192.168.43.147.7772: UDP, length 120
23:54:58.259985 IP 192.168.43.146.8880 > 192.168.43.147.7772: UDP, length 120
23:54:58.309986 IP 192.168.43.146.8880 > 192.168.43.147.7772: UDP, length 120
23:54:58.359993 IP 192.168.43.146.8880 > 192.168.43.147.7772: UDP, length 120
23:54:58.409993 IP 192.168.43.146.8880 > 192.168.43.147.7772: UDP, length 120
23:54:58.460003 IP 192.168.43.146.8880 > 192.168.43.147.7772: UDP, length 120
23:54:58.509990 IP 192.168.43.146.8880 > 192.168.43.147.7772: UDP, length 120
23:54:58.559985 IP 192.168.43.146.8880 > 192.168.43.147.7772: UDP, length 120
23:54:58.609986 IP 192.168.43.146.8880 > 192.168.43.147.7772: UDP, length 120
23:54:58.659985 IP 192.168.43.146.8880 > 192.168.43.147.7772: UDP, length 120
23:54:58.709986 IP 192.168.43.146.8880 > 192.168.43.147.7772: UDP, length 120
23:54:58.759985 IP 192.168.43.146.8880 > 192.168.43.147.7772: UDP, length 120
23:54:58.809986 IP 192.168.43.146.8880 > 192.168.43.147.7772: UDP, length 120
23:54:58.859984 IP 192.168.43.146.8880 > 192.168.43.147.7772: UDP, length 120
23:54:58.909985 IP 192.168.43.146.8880 > 192.168.43.147.7772: UDP, length 120
23:54:58.960055 IP 192.168.43.146.8880 > 192.168.43.147.7772: UDP, length 120
23:54:59.009990 IP 192.168.43.146.8880 > 192.168.43.147.7772: UDP, length 120
23:54:59.059988 IP 192.168.43.146.8880 > 192.168.43.147.7772: UDP, length 120
23:54:59.109992 IP 192.168.43.146.8880 > 192.168.43.147.7772: UDP, length 120
23:54:59.159987 IP 192.168.43.146.8880 > 192.168.43.147.7772: UDP, length 120
23:54:59.209985 IP 192.168.43.146.8880 > 192.168.43.147.7772: UDP, length 120
23:54:59.259985 IP 192.168.43.146.8880 > 192.168.43.147.7772: UDP, length 120
23:54:59.309988 IP 192.168.43.146.8880 > 192.168.43.147.7772: UDP, length 120
23:54:59.359987 IP 192.168.43.146.8880 > 192.168.43.147.7772: UDP, length 120
23:54:59.410039 IP 192.168.43.146.8880 > 192.168.43.147.7772: UDP, length 120
23:54:59.460018 IP 192.168.43.146.8880 > 192.168.43.147.7772: UDP, length 120
23:54:59.509988 IP 192.168.43.146.8880 > 192.168.43.147.7772: UDP, length 120
23:54:59.559985 IP 192.168.43.146.8880 > 192.168.43.147.7772: UDP, length 120
23:54:59.609983 IP 192.168.43.146.8880 > 192.168.43.147.7772: UDP, length 120
23:54:59.659985 IP 192.168.43.146.8880 > 192.168.43.147.7772: UDP, length 120
23:54:59.709983 IP 192.168.43.146.8880 > 192.168.43.147.7772: UDP, length 120
23:54:59.759983 IP 192.168.43.146.8880 > 192.168.43.147.7772: UDP, length 120
23:54:59.809982 IP 192.168.43.146.8880 > 192.168.43.147.7772: UDP, length 120
23:54:59.859982 IP 192.168.43.146.8880 > 192.168.43.147.7772: UDP, length 120
23:54:59.909982 IP 192.168.43.146.8880 > 192.168.43.147.7772: UDP, length 120
23:54:59.960066 IP 192.168.43.146.8880 > 192.168.43.147.7772: UDP, length 120
23:55:00.009993 IP 192.168.43.146.8880 > 192.168.43.147.7772: UDP, length 120
23:55:00.059989 IP 192.168.43.146.8880 > 192.168.43.147.7772: UDP, length 120
23:55:00.109989 IP 192.168.43.146.8880 > 192.168.43.147.7772: UDP, length 120
23:55:00.159986 IP 192.168.43.146.8880 > 192.168.43.147.7772: UDP, length 120
23:55:00.209983 IP 192.168.43.146.8880 > 192.168.43.147.7772: UDP, length 120
23:55:00.259985 IP 192.168.43.146.8880 > 192.168.43.147.7772: UDP, length 120
23:55:00.309986 IP 192.168.43.146.8880 > 192.168.43.147.7772: UDP, length 120
23:55:00.359986 IP 192.168.43.146.8880 > 192.168.43.147.7772: UDP, length 120
23:55:00.409992 IP 192.168.43.146.8880 > 192.168.43.147.7772: UDP, length 120
23:55:00.460005 IP 192.168.43.146.8880 > 192.168.43.147.7772: UDP, length 120
23:55:00.509992 IP 192.168.43.146.8880 > 192.168.43.147.7772: UDP, length 120
23:55:00.559990 IP 192.168.43.146.8880 > 192.168.43.147.7772: UDP, length 120
23:55:00.609986 IP 192.168.43.146.8880 > 192.168.43.147.7772: UDP, length 120
23:55:00.659985 IP 192.168.43.146.8880 > 192.168.43.147.7772: UDP, length 120
23:55:00.709982 IP 192.168.43.146.8880 > 192.168.43.147.7772: UDP, length 120
23:55:00.759985 IP 192.168.43.146.8880 > 192.168.43.147.7772: UDP, length 120
23:55:00.809985 IP 192.168.43.146.8880 > 192.168.43.147.7772: UDP, length 120
23:55:00.859984 IP 192.168.43.146.8880 > 192.168.43.147.7772: UDP, length 120
23:55:00.910027 IP 192.168.43.146.8880 > 192.168.43.147.7772: UDP, length 120
23:55:00.960077 IP 192.168.43.146.8880 > 192.168.43.147.7772: UDP, length 120
23:55:01.010047 IP 192.168.43.146.8880 > 192.168.43.147.7772: UDP, length 120
23:55:01.060006 IP 192.168.43.146.8880 > 192.168.43.147.7772: UDP, length 120
23:55:01.109995 IP 192.168.43.146.8880 > 192.168.43.147.7772: UDP, length 120
23:55:01.159990 IP 192.168.43.146.8880 > 192.168.43.147.7772: UDP, length 120
23:55:01.209987 IP 192.168.43.146.8880 > 192.168.43.147.7772: UDP, length 120
23:55:01.259987 IP 192.168.43.146.8880 > 192.168.43.147.7772: UDP, length 120
23:55:01.309985 IP 192.168.43.146.8880 > 192.168.43.147.7772: UDP, length 120
23:55:01.359987 IP 192.168.43.146.8880 > 192.168.43.147.7772: UDP, length 120
23:55:01.409987 IP 192.168.43.146.8880 > 192.168.43.147.7772: UDP, length 120
23:55:01.459995 IP 192.168.43.146.8880 > 192.168.43.147.7772: UDP, length 120
23:55:01.509987 IP 192.168.43.146.8880 > 192.168.43.147.7772: UDP, length 120
23:55:01.559992 IP 192.168.43.146.8880 > 192.168.43.147.7772: UDP, length 120
23:55:01.609988 IP 192.168.43.146.8880 > 192.168.43.147.7772: UDP, length 120
23:55:01.659987 IP 192.168.43.146.8880 > 192.168.43.147.7772: UDP, length 120
23:55:01.709984 IP 192.168.43.146.8880 > 192.168.43.147.7772: UDP, length 120
23:55:01.759985 IP 192.168.43.146.8880 > 192.168.43.147.7772: UDP, length 120
23:55:01.809985 IP 192.168.43.146.8880 > 192.168.43.147.7772: UDP, length 120
23:55:01.859984 IP 192.168.43.146.8880 > 192.168.43.147.7772: UDP, length 120
23:55:01.909985 IP 192.168.43.146.8880 > 192.168.43.147.7772: UDP, length 120
23:55:01.960087 IP 192.168.43.146.8880 > 192.168.43.147.7772: UDP, length 120
23:55:02.010106 IP 192.168.43.146.8880 > 192.168.43.147.7772: UDP, length 120
23:55:02.060037 IP 192.168.43.146.8880 > 192.168.43.147.7772: UDP, length 120
23:55:02.110042 IP 192.168.43.146.8880 > 192.168.43.147.7772: UDP, length 120
23:55:02.160093 IP 192.168.43.146.8880 > 192.168.43.147.7772: UDP, length 120
23:55:02.210051 IP 192.168.43.146.8880 > 192.168.43.147.7772: UDP, length 120
23:55:02.260033 IP 192.168.43.146.8880 > 192.168.43.147.7772: UDP, length 120
23:55:02.310044 IP 192.168.43.146.8880 > 192.168.43.147.7772: UDP, length 120
23:55:02.360033 IP 192.168.43.146.8880 > 192.168.43.147.7772: UDP, length 120
23:55:02.410012 IP 192.168.43.146.8880 > 192.168.43.147.7772: UDP, length 120
23:55:02.459984 IP 192.168.43.146.8880 > 192.168.43.147.7772: UDP, length 120
23:55:02.509963 IP 192.168.43.146.8880 > 192.168.43.147.7772: UDP, length 120
23:55:02.559958 IP 192.168.43.146.8880 > 192.168.43.147.7772: UDP, length 120
23:55:02.609963 IP 192.168.43.146.8880 > 192.168.43.147.7772: UDP, length 120
23:55:02.659987 IP 192.168.43.146.8880 > 192.168.43.147.7772: UDP, length 120
23:55:02.709985 IP 192.168.43.146.8880 > 192.168.43.147.7772: UDP, length 120
23:55:02.759985 IP 192.168.43.146.8880 > 192.168.43.147.7772: UDP, length 120
23:55:02.809985 IP 192.168.43.146.8880 > 192.168.43.147.7772: UDP, length 120
23:55:02.859985 IP 192.168.43.146.8880 > 192.168.43.147.7772: UDP, length 120
23:55:02.909984 IP 192.168.43.146.8880 > 192.168.43.147.7772: UDP, length 120
23:55:02.959985 IP 192.168.43.146.8880 > 192.168.43.147.7772: UDP, length 120
23:55:03.010085 IP 192.168.43.146.8880 > 192.168.43.147.7772: UDP, length 120
23:55:03.060186 IP 192.168.43.146.8880 > 192.168.43.147.7772: UDP, length 120
23:55:03.110071 IP 192.168.43.146.8880 > 192.168.43.147.7772: UDP, length 120
23:55:03.160013 IP 192.168.43.146.8880 > 192.168.43.147.7772: UDP, length 120
23:55:03.209968 IP 192.168.43.146.8880 > 192.168.43.147.7772: UDP, length 120
23:55:03.259958 IP 192.168.43.146.8880 > 192.168.43.147.7772: UDP, length 120
23:55:03.309959 IP 192.168.43.146.8880 > 192.168.43.147.7772: UDP, length 120
23:55:03.359957 IP 192.168.43.146.8880 > 192.168.43.147.7772: UDP, length 120
23:55:03.409959 IP 192.168.43.146.8880 > 192.168.43.147.7772: UDP, length 120
23:55:03.459963 IP 192.168.43.146.8880 > 192.168.43.147.7772: UDP, length 120
23:55:03.509959 IP 192.168.43.146.8880 > 192.168.43.147.7772: UDP, length 120
23:55:03.559958 IP 192.168.43.146.8880 > 192.168.43.147.7772: UDP, length 120
23:55:03.609959 IP 192.168.43.146.8880 > 192.168.43.147.7772: UDP, length 120
23:55:03.659957 IP 192.168.43.146.8880 > 192.168.43.147.7772: UDP, length 120
23:55:03.709960 IP 192.168.43.146.8880 > 192.168.43.147.7772: UDP, length 120
23:55:03.759959 IP 192.168.43.146.8880 > 192.168.43.147.7772: UDP, length 120
23:55:03.809958 IP 192.168.43.146.8880 > 192.168.43.147.7772: UDP, length 120
23:55:03.859957 IP 192.168.43.146.8880 > 192.168.43.147.7772: UDP, length 120
23:55:03.910000 IP 192.168.43.146.8880 > 192.168.43.147.7772: UDP, length 120
23:55:03.959966 IP 192.168.43.146.8880 > 192.168.43.147.7772: UDP, length 120
23:55:04.009959 IP 192.168.43.146.8880 > 192.168.43.147.7772: UDP, length 120
23:55:04.059957 IP 192.168.43.146.8880 > 192.168.43.147.7772: UDP, length 120
23:55:04.109959 IP 192.168.43.146.8880 > 192.168.43.147.7772: UDP, length 120
23:55:04.160021 IP 192.168.43.146.8880 > 192.168.43.147.7772: UDP, length 120
23:55:04.209976 IP 192.168.43.146.8880 > 192.168.43.147.7772: UDP, length 120
23:55:04.259960 IP 192.168.43.146.8880 > 192.168.43.147.7772: UDP, length 120
23:55:04.309959 IP 192.168.43.146.8880 > 192.168.43.147.7772: UDP, length 120
23:55:04.359957 IP 192.168.43.146.8880 > 192.168.43.147.7772: UDP, length 120
23:55:04.409960 IP 192.168.43.146.8880 > 192.168.43.147.7772: UDP, length 120
23:55:04.459965 IP 192.168.43.146.8880 > 192.168.43.147.7772: UDP, length 120
23:55:04.509959 IP 192.168.43.146.8880 > 192.168.43.147.7772: UDP, length 120
23:55:04.559959 IP 192.168.43.146.8880 > 192.168.43.147.7772: UDP, length 120
23:55:04.609958 IP 192.168.43.146.8880 > 192.168.43.147.7772: UDP, length 120
23:55:04.659958 IP 192.168.43.146.8880 > 192.168.43.147.7772: UDP, length 120
23:55:04.709964 IP 192.168.43.146.8880 > 192.168.43.147.7772: UDP, length 120
23:55:04.759959 IP 192.168.43.146.8880 > 192.168.43.147.7772: UDP, length 120
23:55:04.809956 IP 192.168.43.146.8880 > 192.168.43.147.7772: UDP, length 120
23:55:04.859957 IP 192.168.43.146.8880 > 192.168.43.147.7772: UDP, length 120
23:55:04.909957 IP 192.168.43.146.8880 > 192.168.43.147.7772: UDP, length 120
23:55:04.960003 IP 192.168.43.146.8880 > 192.168.43.147.7772: UDP, length 120
23:55:05.009956 IP 192.168.43.146.8880 > 192.168.43.147.7772: UDP, length 120
23:55:05.059956 IP 192.168.43.146.8880 > 192.168.43.147.7772: UDP, length 120
23:55:05.109959 IP 192.168.43.146.8880 > 192.168.43.147.7772: UDP, length 120
23:55:05.160020 IP 192.168.43.146.8880 > 192.168.43.147.7772: UDP, length 120
23:55:05.210009 IP 192.168.43.146.8880 > 192.168.43.147.7772: UDP, length 120
23:55:05.259964 IP 192.168.43.146.8880 > 192.168.43.147.7772: UDP, length 120
23:55:05.309957 IP 192.168.43.146.8880 > 192.168.43.147.7772: UDP, length 120
23:55:05.359958 IP 192.168.43.146.8880 > 192.168.43.147.7772: UDP, length 120
23:55:05.410001 IP 192.168.43.146.8880 > 192.168.43.147.7772: UDP, length 120
23:55:05.459984 IP 192.168.43.146.8880 > 192.168.43.147.7772: UDP, length 120
23:55:05.509962 IP 192.168.43.146.8880 > 192.168.43.147.7772: UDP, length 120
23:55:05.559958 IP 192.168.43.146.8880 > 192.168.43.147.7772: UDP, length 120
23:55:05.609959 IP 192.168.43.146.8880 > 192.168.43.147.7772: UDP, length 120
23:55:05.659957 IP 192.168.43.146.8880 > 192.168.43.147.7772: UDP, length 120
23:55:05.709960 IP 192.168.43.146.8880 > 192.168.43.147.7772: UDP, length 120
23:55:05.759962 IP 192.168.43.146.8880 > 192.168.43.147.7772: UDP, length 120
23:55:05.809959 IP 192.168.43.146.8880 > 192.168.43.147.7772: UDP, length 120
23:55:05.859957 IP 192.168.43.146.8880 > 192.168.43.147.7772: UDP, length 120
23:55:05.909958 IP 192.168.43.146.8880 > 192.168.43.147.7772: UDP, length 120
23:55:05.959958 IP 192.168.43.146.8880 > 192.168.43.147.7772: UDP, length 120
23:55:06.009957 IP 192.168.43.146.8880 > 192.168.43.147.7772: UDP, length 120
23:55:06.059956 IP 192.168.43.146.8880 > 192.168.43.147.7772: UDP, length 120
23:55:06.109956 IP 192.168.43.146.8880 > 192.168.43.147.7772: UDP, length 120
23:55:06.159956 IP 192.168.43.146.8880 > 192.168.43.147.7772: UDP, length 120
23:55:06.210011 IP 192.168.43.146.8880 > 192.168.43.147.7772: UDP, length 120
23:55:06.259967 IP 192.168.43.146.8880 > 192.168.43.147.7772: UDP, length 120
23:55:06.309960 IP 192.168.43.146.8880 > 192.168.43.147.7772: UDP, length 120
23:55:06.359958 IP 192.168.43.146.8880 > 192.168.43.147.7772: UDP, length 120
23:55:06.409960 IP 192.168.43.146.8880 > 192.168.43.147.7772: UDP, length 120
23:55:06.459965 IP 192.168.43.146.8880 > 192.168.43.147.7772: UDP, length 120
23:55:06.509958 IP 192.168.43.146.8880 > 192.168.43.147.7772: UDP, length 120
23:55:06.559958 IP 192.168.43.146.8880 > 192.168.43.147.7772: UDP, length 120
23:55:06.609958 IP 192.168.43.146.8880 > 192.168.43.147.7772: UDP, length 120
23:55:06.659957 IP 192.168.43.146.8880 > 192.168.43.147.7772: UDP, length 120
23:55:06.709957 IP 192.168.43.146.8880 > 192.168.43.147.7772: UDP, length 120
23:55:06.759957 IP 192.168.43.146.8880 > 192.168.43.147.7772: UDP, length 120
23:55:06.809959 IP 192.168.43.146.8880 > 192.168.43.147.7772: UDP, length 120
23:55:06.859961 IP 192.168.43.146.8880 > 192.168.43.147.7772: UDP, length 120
23:55:06.910003 IP 192.168.43.146.8880 > 192.168.43.147.7772: UDP, length 120
23:55:06.959967 IP 192.168.43.146.8880 > 192.168.43.147.7772: UDP, length 120
23:55:07.009959 IP 192.168.43.146.8880 > 192.168.43.147.7772: UDP, length 120
23:55:07.059957 IP 192.168.43.146.8880 > 192.168.43.147.7772: UDP, length 120
23:55:07.109958 IP 192.168.43.146.8880 > 192.168.43.147.7772: UDP, length 120
23:55:07.159957 IP 192.168.43.146.8880 > 192.168.43.147.7772: UDP, length 120
23:55:07.210011 IP 192.168.43.146.8880 > 192.168.43.147.7772: UDP, length 120
23:55:07.259970 IP 192.168.43.146.8880 > 192.168.43.147.7772: UDP, length 120
23:55:07.309962 IP 192.168.43.146.8880 > 192.168.43.147.7772: UDP, length 120
23:55:07.359957 IP 192.168.43.146.8880 > 192.168.43.147.7772: UDP, length 120
23:55:07.410030 IP 192.168.43.146.8880 > 192.168.43.147.7772: UDP, length 120
23:55:07.460035 IP 192.168.43.146.8880 > 192.168.43.147.7772: UDP, length 120
23:55:07.510039 IP 192.168.43.146.8880 > 192.168.43.147.7772: UDP, length 120
23:55:07.560031 IP 192.168.43.146.8880 > 192.168.43.147.7772: UDP, length 120
23:55:07.610023 IP 192.168.43.146.8880 > 192.168.43.147.7772: UDP, length 120
23:55:07.660098 IP 192.168.43.146.8880 > 192.168.43.147.7772: UDP, length 120
23:55:07.710092 IP 192.168.43.146.8880 > 192.168.43.147.7772: UDP, length 120
23:55:07.760034 IP 192.168.43.146.8880 > 192.168.43.147.7772: UDP, length 120
23:55:07.810040 IP 192.168.43.146.8880 > 192.168.43.147.7772: UDP, length 120
23:55:07.860017 IP 192.168.43.146.8880 > 192.168.43.147.7772: UDP, length 120
23:55:07.909972 IP 192.168.43.146.8880 > 192.168.43.147.7772: UDP, length 120
23:55:07.959960 IP 192.168.43.146.8880 > 192.168.43.147.7772: UDP, length 120
23:55:08.009959 IP 192.168.43.146.8880 > 192.168.43.147.7772: UDP, length 120
23:55:08.059957 IP 192.168.43.146.8880 > 192.168.43.147.7772: UDP, length 120
23:55:08.109957 IP 192.168.43.146.8880 > 192.168.43.147.7772: UDP, length 120
23:55:08.159958 IP 192.168.43.146.8880 > 192.168.43.147.7772: UDP, length 120
23:55:08.210008 IP 192.168.43.146.8880 > 192.168.43.147.7772: UDP, length 120
23:55:08.259968 IP 192.168.43.146.8880 > 192.168.43.147.7772: UDP, length 120
23:55:08.309960 IP 192.168.43.146.8880 > 192.168.43.147.7772: UDP, length 120
23:55:08.359958 IP 192.168.43.146.8880 > 192.168.43.147.7772: UDP, length 120
23:55:08.410000 IP 192.168.43.146.8880 > 192.168.43.147.7772: UDP, length 120
23:55:08.459982 IP 192.168.43.146.8880 > 192.168.43.147.7772: UDP, length 120
23:55:08.509960 IP 192.168.43.146.8880 > 192.168.43.147.7772: UDP, length 120
23:55:08.559958 IP 192.168.43.146.8880 > 192.168.43.147.7772: UDP, length 120
23:55:08.609955 IP 192.168.43.146.8880 > 192.168.43.147.7772: UDP, length 120
23:55:08.659957 IP 192.168.43.146.8880 > 192.168.43.147.7772: UDP, length 120
23:55:08.709957 IP 192.168.43.146.8880 > 192.168.43.147.7772: UDP, length 120
23:55:08.759957 IP 192.168.43.146.8880 > 192.168.43.147.7772: UDP, length 120
23:55:08.809957 IP 192.168.43.146.8880 > 192.168.43.147.7772: UDP, length 120
23:55:08.859958 IP 192.168.43.146.8880 > 192.168.43.147.7772: UDP, length 120
23:55:08.909962 IP 192.168.43.146.8880 > 192.168.43.147.7772: UDP, length 120
23:55:08.959959 IP 192.168.43.146.8880 > 192.168.43.147.7772: UDP, length 120
23:55:09.009957 IP 192.168.43.146.8880 > 192.168.43.147.7772: UDP, length 120
23:55:09.059957 IP 192.168.43.146.8880 > 192.168.43.147.7772: UDP, length 120
23:55:09.109957 IP 192.168.43.146.8880 > 192.168.43.147.7772: UDP, length 120
23:55:09.159957 IP 192.168.43.146.8880 > 192.168.43.147.7772: UDP, length 120
23:55:09.210009 IP 192.168.43.146.8880 > 192.168.43.147.7772: UDP, length 120
23:55:09.259967 IP 192.168.43.146.8880 > 192.168.43.147.7772: UDP, length 120
23:55:09.309960 IP 192.168.43.146.8880 > 192.168.43.147.7772: UDP, length 120
23:55:09.359956 IP 192.168.43.146.8880 > 192.168.43.147.7772: UDP, length 120
23:55:09.409958 IP 192.168.43.146.8880 > 192.168.43.147.7772: UDP, length 120
23:55:09.459966 IP 192.168.43.146.8880 > 192.168.43.147.7772: UDP, length 120
23:55:09.509961 IP 192.168.43.146.8880 > 192.168.43.147.7772: UDP, length 120
23:55:09.559958 IP 192.168.43.146.8880 > 192.168.43.147.7772: UDP, length 120
23:55:09.609957 IP 192.168.43.146.8880 > 192.168.43.147.7772: UDP, length 120
23:55:09.659957 IP 192.168.43.146.8880 > 192.168.43.147.7772: UDP, length 120
23:55:09.709957 IP 192.168.43.146.8880 > 192.168.43.147.7772: UDP, length 120
23:55:09.759957 IP 192.168.43.146.8880 > 192.168.43.147.7772: UDP, length 120
23:55:09.809956 IP 192.168.43.146.8880 > 192.168.43.147.7772: UDP, length 120
23:55:09.859957 IP 192.168.43.146.8880 > 192.168.43.147.7772: UDP, length 120
23:55:09.910003 IP 192.168.43.146.8880 > 192.168.43.147.7772: UDP, length 120
23:55:09.959971 IP 192.168.43.146.8880 > 192.168.43.147.7772: UDP, length 120
23:55:10.009963 IP 192.168.43.146.8880 > 192.168.43.147.7772: UDP, length 120
23:55:10.059959 IP 192.168.43.146.8880 > 192.168.43.147.7772: UDP, length 120
23:55:10.109960 IP 192.168.43.146.8880 > 192.168.43.147.7772: UDP, length 120
23:55:10.159957 IP 192.168.43.146.8880 > 192.168.43.147.7772: UDP, length 120
23:55:10.209956 IP 192.168.43.146.8880 > 192.168.43.147.7772: UDP, length 120
23:55:10.259958 IP 192.168.43.146.8880 > 192.168.43.147.7772: UDP, length 120
23:55:10.309958 IP 192.168.43.146.8880 > 192.168.43.147.7772: UDP, length 120
23:55:10.359957 IP 192.168.43.146.8880 > 192.168.43.147.7772: UDP, length 120
23:55:10.409959 IP 192.168.43.146.8880 > 192.168.43.147.7772: UDP, length 120
23:55:10.459984 IP 192.168.43.146.8880 > 192.168.43.147.7772: UDP, length 120
23:55:10.509963 IP 192.168.43.146.8880 > 192.168.43.147.7772: UDP, length 120
23:55:10.559959 IP 192.168.43.146.8880 > 192.168.43.147.7772: UDP, length 120
23:55:10.609960 IP 192.168.43.146.8880 > 192.168.43.147.7772: UDP, length 120
23:55:10.659958 IP 192.168.43.146.8880 > 192.168.43.147.7772: UDP, length 120
23:55:10.709997 IP 192.168.43.146.8880 > 192.168.43.147.7772: UDP, length 120
23:55:10.759978 IP 192.168.43.146.8880 > 192.168.43.147.7772: UDP, length 120
23:55:10.809966 IP 192.168.43.146.8880 > 192.168.43.147.7772: UDP, length 120
23:55:10.859957 IP 192.168.43.146.8880 > 192.168.43.147.7772: UDP, length 120
23:55:10.909959 IP 192.168.43.146.8880 > 192.168.43.147.7772: UDP, length 120
23:55:10.959957 IP 192.168.43.146.8880 > 192.168.43.147.7772: UDP, length 120
23:55:11.009960 IP 192.168.43.146.8880 > 192.168.43.147.7772: UDP, length 120
23:55:11.059959 IP 192.168.43.146.8880 > 192.168.43.147.7772: UDP, length 120
23:55:11.109958 IP 192.168.43.146.8880 > 192.168.43.147.7772: UDP, length 120
23:55:11.159957 IP 192.168.43.146.8880 > 192.168.43.147.7772: UDP, length 120
23:55:11.210028 IP 192.168.43.146.8880 > 192.168.43.147.7772: UDP, length 120
23:55:11.260035 IP 192.168.43.146.8880 > 192.168.43.147.7772: UDP, length 120
23:55:11.310011 IP 192.168.43.146.8880 > 192.168.43.147.7772: UDP, length 120
23:55:11.359969 IP 192.168.43.146.8880 > 192.168.43.147.7772: UDP, length 120
23:55:11.410004 IP 192.168.43.146.8880 > 192.168.43.147.7772: UDP, length 120
23:55:11.459982 IP 192.168.43.146.8880 > 192.168.43.147.7772: UDP, length 120
23:55:11.509961 IP 192.168.43.146.8880 > 192.168.43.147.7772: UDP, length 120
23:55:11.559957 IP 192.168.43.146.8880 > 192.168.43.147.7772: UDP, length 120
23:55:11.609960 IP 192.168.43.146.8880 > 192.168.43.147.7772: UDP, length 120
23:55:11.659957 IP 192.168.43.146.8880 > 192.168.43.147.7772: UDP, length 120
23:55:11.709958 IP 192.168.43.146.8880 > 192.168.43.147.7772: UDP, length 120
23:55:11.759957 IP 192.168.43.146.8880 > 192.168.43.147.7772: UDP, length 120
23:55:11.809958 IP 192.168.43.146.8880 > 192.168.43.147.7772: UDP, length 120
23:55:11.859955 IP 192.168.43.146.8880 > 192.168.43.147.7772: UDP, length 120
23:55:11.909958 IP 192.168.43.146.8880 > 192.168.43.147.7772: UDP, length 120
23:55:11.959956 IP 192.168.43.146.8880 > 192.168.43.147.7772: UDP, length 120
23:55:12.009958 IP 192.168.43.146.8880 > 192.168.43.147.7772: UDP, length 120
23:55:12.059961 IP 192.168.43.146.8880 > 192.168.43.147.7772: UDP, length 120
23:55:12.109962 IP 192.168.43.146.8880 > 192.168.43.147.7772: UDP, length 120
23:55:12.159957 IP 192.168.43.146.8880 > 192.168.43.147.7772: UDP, length 120
23:55:12.209958 IP 192.168.43.146.8880 > 192.168.43.147.7772: UDP, length 120
23:55:12.259956 IP 192.168.43.146.8880 > 192.168.43.147.7772: UDP, length 120
23:55:12.310028 IP 192.168.43.146.8880 > 192.168.43.147.7772: UDP, length 120
23:55:12.360011 IP 192.168.43.146.8880 > 192.168.43.147.7772: UDP, length 120
23:55:12.409965 IP 192.168.43.146.8880 > 192.168.43.147.7772: UDP, length 120
23:55:12.460018 IP 192.168.43.146.8880 > 192.168.43.147.7772: UDP, length 120
23:55:12.509959 IP 192.168.43.146.8880 > 192.168.43.147.7772: UDP, length 120
23:55:12.559958 IP 192.168.43.146.8880 > 192.168.43.147.7772: UDP, length 120
23:55:12.609958 IP 192.168.43.146.8880 > 192.168.43.147.7772: UDP, length 120
23:55:12.659981 IP 192.168.43.146.8880 > 192.168.43.147.7772: UDP, length 120
23:55:12.709981 IP 192.168.43.146.8880 > 192.168.43.147.7772: UDP, length 120
23:55:12.759981 IP 192.168.43.146.8880 > 192.168.43.147.7772: UDP, length 120
23:55:12.809984 IP 192.168.43.146.8880 > 192.168.43.147.7772: UDP, length 120
23:55:12.860039 IP 192.168.43.146.8880 > 192.168.43.147.7772: UDP, length 120
23:55:12.910061 IP 192.168.43.146.8880 > 192.168.43.147.7772: UDP, length 120
23:55:12.960065 IP 192.168.43.146.8880 > 192.168.43.147.7772: UDP, length 120
23:55:13.010066 IP 192.168.43.146.8880 > 192.168.43.147.7772: UDP, length 120
23:55:13.060060 IP 192.168.43.146.8880 > 192.168.43.147.7772: UDP, length 120
23:55:13.110020 IP 192.168.43.146.8880 > 192.168.43.147.7772: UDP, length 120
23:55:13.160045 IP 192.168.43.146.8880 > 192.168.43.147.7772: UDP, length 120
23:55:13.210043 IP 192.168.43.146.8880 > 192.168.43.147.7772: UDP, length 120
23:55:13.260052 IP 192.168.43.146.8880 > 192.168.43.147.7772: UDP, length 120
23:55:13.310014 IP 192.168.43.146.8880 > 192.168.43.147.7772: UDP, length 120
23:55:13.360003 IP 192.168.43.146.8880 > 192.168.43.147.7772: UDP, length 120
23:55:13.409967 IP 192.168.43.146.8880 > 192.168.43.147.7772: UDP, length 120
23:55:13.459968 IP 192.168.43.146.8880 > 192.168.43.147.7772: UDP, length 120
23:55:13.509961 IP 192.168.43.146.8880 > 192.168.43.147.7772: UDP, length 120
23:55:13.559959 IP 192.168.43.146.8880 > 192.168.43.147.7772: UDP, length 120
23:55:13.609959 IP 192.168.43.146.8880 > 192.168.43.147.7772: UDP, length 120
23:55:13.659957 IP 192.168.43.146.8880 > 192.168.43.147.7772: UDP, length 120
23:55:13.709959 IP 192.168.43.146.8880 > 192.168.43.147.7772: UDP, length 120
23:55:13.759958 IP 192.168.43.146.8880 > 192.168.43.147.7772: UDP, length 120
23:55:13.809969 IP 192.168.43.146.8880 > 192.168.43.147.7772: UDP, length 120
23:55:13.859958 IP 192.168.43.146.8880 > 192.168.43.147.7772: UDP, length 120
23:55:13.909958 IP 192.168.43.146.8880 > 192.168.43.147.7772: UDP, length 120
23:55:13.959957 IP 192.168.43.146.8880 > 192.168.43.147.7772: UDP, length 120
23:55:14.009958 IP 192.168.43.146.8880 > 192.168.43.147.7772: UDP, length 120
23:55:14.059956 IP 192.168.43.146.8880 > 192.168.43.147.7772: UDP, length 120
23:55:14.109957 IP 192.168.43.146.8880 > 192.168.43.147.7772: UDP, length 120
23:55:14.159961 IP 192.168.43.146.8880 > 192.168.43.147.7772: UDP, length 120
23:55:14.209961 IP 192.168.43.146.8880 > 192.168.43.147.7772: UDP, length 120
23:55:14.259956 IP 192.168.43.146.8880 > 192.168.43.147.7772: UDP, length 120
23:55:14.309957 IP 192.168.43.146.8880 > 192.168.43.147.7772: UDP, length 120
23:55:14.412480 IP 192.168.43.146.8880 > 192.168.43.124.7773: UDP, length 120
23:55:14.462532 IP 192.168.43.146.8880 > 192.168.43.124.7773: UDP, length 120
23:55:14.512504 IP 192.168.43.146.8880 > 192.168.43.124.7773: UDP, length 120
23:55:14.562501 IP 192.168.43.146.8880 > 192.168.43.124.7773: UDP, length 120
23:55:14.612497 IP 192.168.43.146.8880 > 192.168.43.124.7773: UDP, length 120
23:55:14.662498 IP 192.168.43.146.8880 > 192.168.43.124.7773: UDP, length 120
23:55:14.712499 IP 192.168.43.146.8880 > 192.168.43.124.7773: UDP, length 120
23:55:14.762498 IP 192.168.43.146.8880 > 192.168.43.124.7773: UDP, length 120
23:55:14.812498 IP 192.168.43.146.8880 > 192.168.43.124.7773: UDP, length 120
23:55:14.862499 IP 192.168.43.146.8880 > 192.168.43.124.7773: UDP, length 120
23:55:14.912499 IP 192.168.43.146.8880 > 192.168.43.124.7773: UDP, length 120
23:55:14.923084 IP 192.168.43.147.8880 > 192.168.43.146.7771: UDP, length 120
