19:54:53.903229 IP 192.168.43.124.8880 > 192.168.43.146.7771: UDP, length 120
19:54:53.953371 IP 192.168.43.124.8880 > 192.168.43.146.7771: UDP, length 120
19:54:54.003372 IP 192.168.43.124.8880 > 192.168.43.146.7771: UDP, length 120
19:54:54.053361 IP 192.168.43.124.8880 > 192.168.43.146.7771: UDP, length 120
19:54:54.103376 IP 192.168.43.124.8880 > 192.168.43.146.7771: UDP, length 120
19:54:54.153361 IP 192.168.43.124.8880 > 192.168.43.146.7771: UDP, length 120
19:54:54.203363 IP 192.168.43.124.8880 > 192.168.43.146.7771: UDP, length 120
19:54:54.253362 IP 192.168.43.124.8880 > 192.168.43.146.7771: UDP, length 120
19:54:54.303360 IP 192.168.43.124.8880 > 192.168.43.146.7771: UDP, length 120
19:54:54.353414 IP 192.168.43.124.8880 > 192.168.43.146.7771: UDP, length 120
19:54:54.403413 IP 192.168.43.124.8880 > 192.168.43.146.7771: UDP, length 120
19:54:54.453365 IP 192.168.43.124.8880 > 192.168.43.146.7771: UDP, length 120
19:54:54.503367 IP 192.168.43.124.8880 > 192.168.43.146.7771: UDP, length 120
19:54:54.553362 IP 192.168.43.124.8880 > 192.168.43.146.7771: UDP, length 120
19:54:54.603362 IP 192.168.43.124.8880 > 192.168.43.146.7771: UDP, length 120
19:54:54.653360 IP 192.168.43.124.8880 > 192.168.43.146.7771: UDP, length 120
19:54:54.703362 IP 192.168.43.124.8880 > 192.168.43.146.7771: UDP, length 120
19:54:54.753362 IP 192.168.43.124.8880 > 192.168.43.146.7771: UDP, length 120
19:54:54.803379 IP 192.168.43.124.8880 > 192.168.43.146.7771: UDP, length 120
19:54:54.853371 IP 192.168.43.124.8880 > 192.168.43.146.7771: UDP, length 120
19:54:54.903367 IP 192.168.43.124.8880 > 192.168.43.146.7771: UDP, length 120
19:54:54.953360 IP 192.168.43.124.8880 > 192.168.43.146.7771: UDP, length 120
19:54:55.003366 IP 192.168.43.124.8880 > 192.168.43.146.7771: UDP, length 120
19:54:55.053360 IP 192.168.43.124.8880 > 192.168.43.146.7771: UDP, length 120
19:54:55.103367 IP 192.168.43.124.8880 > 192.168.43.146.7771: UDP, length 120
19:54:55.153361 IP 192.168.43.124.8880 > 192.168.43.146.7771: UDP, length 120
19:54:55.203368 IP 192.168.43.124.8880 > 192.168.43.146.7771: UDP, length 120
19:54:55.253360 IP 192.168.43.124.8880 > 192.168.43.146.7771: UDP, length 120
19:54:55.303417 IP 192.168.43.124.8880 > 192.168.43.146.7771: UDP, length 120
19:54:55.353417 IP 192.168.43.124.8880 > 192.168.43.146.7771: UDP, length 120
19:54:55.403419 IP 192.168.43.124.8880 > 192.168.43.146.7771: UDP, length 120
19:54:55.453366 IP 192.168.43.124.8880 > 192.168.43.146.7771: UDP, length 120
19:54:55.503373 IP 192.168.43.124.8880 > 192.168.43.146.7771: UDP, length 120
19:54:55.553365 IP 192.168.43.124.8880 > 192.168.43.146.7771: UDP, length 120
19:54:55.603374 IP 192.168.43.124.8880 > 192.168.43.146.7771: UDP, length 120
19:54:55.653364 IP 192.168.43.124.8880 > 192.168.43.146.7771: UDP, length 120
19:54:55.703373 IP 192.168.43.124.8880 > 192.168.43.146.7771: UDP, length 120
19:54:55.753410 IP 192.168.43.124.8880 > 192.168.43.146.7771: UDP, length 120
19:54:55.803898 IP 192.168.43.124.8880 > 192.168.43.146.7771: UDP, length 120
19:54:55.853368 IP 192.168.43.124.8880 > 192.168.43.146.7771: UDP, length 120
19:54:55.903336 IP 192.168.43.124.8880 > 192.168.43.146.7771: UDP, length 120
19:54:55.953361 IP 192.168.43.124.8880 > 192.168.43.146.7771: UDP, length 120
19:54:56.003347 IP 192.168.43.124.8880 > 192.168.43.146.7771: UDP, length 120
19:54:56.053364 IP 192.168.43.124.8880 > 192.168.43.146.7771: UDP, length 120
19:54:56.103388 IP 192.168.43.124.8880 > 192.168.43.146.7771: UDP, length 120
19:54:56.153361 IP 192.168.43.124.8880 > 192.168.43.146.7771: UDP, length 120
19:54:56.203360 IP 192.168.43.124.8880 > 192.168.43.146.7771: UDP, length 120
19:54:56.253363 IP 192.168.43.124.8880 > 192.168.43.146.7771: UDP, length 120
19:54:56.303298 IP 192.168.43.124.8880 > 192.168.43.146.7771: UDP, length 120
19:54:56.353309 IP 192.168.43.124.8880 > 192.168.43.146.7771: UDP, length 120
19:54:56.403391 IP 192.168.43.124.8880 > 192.168.43.146.7771: UDP, length 120
19:54:56.453371 IP 192.168.43.124.8880 > 192.168.43.146.7771: UDP, length 120
19:54:56.503368 IP 192.168.43.124.8880 > 192.168.43.146.7771: UDP, length 120
19:54:56.553371 IP 192.168.43.124.8880 > 192.168.43.146.7771: UDP, length 120
19:54:56.603361 IP 192.168.43.124.8880 > 192.168.43.146.7771: UDP, length 120
19:54:56.653364 IP 192.168.43.124.8880 > 192.168.43.146.7771: UDP, length 120
19:54:56.703361 IP 192.168.43.124.8880 > 192.168.43.146.7771: UDP, length 120
19:54:56.753366 IP 192.168.43.124.8880 > 192.168.43.146.7771: UDP, length 120
19:54:56.803378 IP 192.168.43.124.8880 > 192.168.43.146.7771: UDP, length 120
19:54:56.853369 IP 192.168.43.124.8880 > 192.168.43.146.7771: UDP, length 120
19:54:56.903369 IP 192.168.43.124.8880 > 192.168.43.146.7771: UDP, length 120
19:54:56.953362 IP 192.168.43.124.8880 > 192.168.43.146.7771: UDP, length 120
19:54:57.003378 IP 192.168.43.124.8880 > 192.168.43.146.7771: UDP, length 120
19:54:57.053362 IP 192.168.43.124.8880 > 192.168.43.146.7771: UDP, length 120
19:54:57.103362 IP 192.168.43.124.8880 > 192.168.43.146.7771: UDP, length 120
19:54:57.153361 IP 192.168.43.124.8880 > 192.168.43.146.7771: UDP, length 120
19:54:57.203362 IP 192.168.43.124.8880 > 192.168.43.146.7771: UDP, length 120
19:54:57.253363 IP 192.168.43.124.8880 > 192.168.43.146.7771: UDP, length 120
19:54:57.303369 IP 192.168.43.124.8880 > 192.168.43.146.7771: UDP, length 120
19:54:57.353361 IP 192.168.43.124.8880 > 192.168.43.146.7771: UDP, length 120
19:54:57.403362 IP 192.168.43.124.8880 > 192.168.43.146.7771: UDP, length 120
19:54:57.453368 IP 192.168.43.124.8880 > 192.168.43.146.7771: UDP, length 120
19:54:57.503362 IP 192.168.43.124.8880 > 192.168.43.146.7771: UDP, length 120
19:54:57.553362 IP 192.168.43.124.8880 > 192.168.43.146.7771: UDP, length 120
19:54:57.603362 IP 192.168.43.124.8880 > 192.168.43.146.7771: UDP, length 120
19:54:57.653362 IP 192.168.43.124.8880 > 192.168.43.146.7771: UDP, length 120
19:54:57.703369 IP 192.168.43.124.8880 > 192.168.43.146.7771: UDP, length 120
19:54:57.753361 IP 192.168.43.124.8880 > 192.168.43.146.7771: UDP, length 120
19:54:57.803411 IP 192.168.43.124.8880 > 192.168.43.146.7771: UDP, length 120
19:54:57.853370 IP 192.168.43.124.8880 > 192.168.43.146.7771: UDP, length 120
19:54:57.903364 IP 192.168.43.124.8880 > 192.168.43.146.7771: UDP, length 120
19:54:57.953416 IP 192.168.43.124.8880 > 192.168.43.146.7771: UDP, length 120
19:54:58.003349 IP 192.168.43.124.8880 > 192.168.43.146.7771: UDP, length 120
19:54:58.053367 IP 192.168.43.124.8880 > 192.168.43.146.7771: UDP, length 120
19:54:58.103370 IP 192.168.43.124.8880 > 192.168.43.146.7771: UDP, length 120
19:54:58.153362 IP 192.168.43.124.8880 > 192.168.43.146.7771: UDP, length 120
19:54:58.203363 IP 192.168.43.124.8880 > 192.168.43.146.7771: UDP, length 120
19:54:58.253363 IP 192.168.43.124.8880 > 192.168.43.146.7771: UDP, length 120
19:54:58.303363 IP 192.168.43.124.8880 > 192.168.43.146.7771: UDP, length 120
19:54:58.353370 IP 192.168.43.124.8880 > 192.168.43.146.7771: UDP, length 120
19:54:58.403362 IP 192.168.43.124.8880 > 192.168.43.146.7771: UDP, length 120
19:54:58.453370 IP 192.168.43.124.8880 > 192.168.43.146.7771: UDP, length 120
19:54:58.503364 IP 192.168.43.124.8880 > 192.168.43.146.7771: UDP, length 120
19:54:58.553362 IP 192.168.43.124.8880 > 192.168.43.146.7771: UDP, length 120
19:54:58.603364 IP 192.168.43.124.8880 > 192.168.43.146.7771: UDP, length 120
19:54:58.653368 IP 192.168.43.124.8880 > 192.168.43.146.7771: UDP, length 120
19:54:58.703370 IP 192.168.43.124.8880 > 192.168.43.146.7771: UDP, length 120
19:54:58.753363 IP 192.168.43.124.8880 > 192.168.43.146.7771: UDP, length 120
19:54:58.803378 IP 192.168.43.124.8880 > 192.168.43.146.7771: UDP, length 120
19:54:58.853366 IP 192.168.43.124.8880 > 192.168.43.146.7771: UDP, length 120
19:54:58.903366 IP 192.168.43.124.8880 > 192.168.43.146.7771: UDP, length 120
19:54:58.953360 IP 192.168.43.124.8880 > 192.168.43.146.7771: UDP, length 120
19:54:59.003371 IP 192.168.43.124.8880 > 192.168.43.146.7771: UDP, length 120
19:54:59.053361 IP 192.168.43.124.8880 > 192.168.43.146.7771: UDP, length 120
19:54:59.103366 IP 192.168.43.124.8880 > 192.168.43.146.7771: UDP, length 120
19:54:59.153362 IP 192.168.43.124.8880 > 192.168.43.146.7771: UDP, length 120
19:54:59.203366 IP 192.168.43.124.8880 > 192.168.43.146.7771: UDP, length 120
19:54:59.253417 IP 192.168.43.124.8880 > 192.168.43.146.7771: UDP, length 120
19:54:59.303421 IP 192.168.43.124.8880 > 192.168.43.146.7771: UDP, length 120
19:54:59.353418 IP 192.168.43.124.8880 > 192.168.43.146.7771: UDP, length 120
19:54:59.403368 IP 192.168.43.124.8880 > 192.168.43.146.7771: UDP, length 120
19:54:59.453369 IP 192.168.43.124.8880 > 192.168.43.146.7771: UDP, length 120
19:54:59.503368 IP 192.168.43.124.8880 > 192.168.43.146.7771: UDP, length 120
19:54:59.553362 IP 192.168.43.124.8880 > 192.168.43.146.7771: UDP, length 120
19:54:59.603368 IP 192.168.43.124.8880 > 192.168.43.146.7771: UDP, length 120
19:54:59.653360 IP 192.168.43.124.8880 > 192.168.43.146.7771: UDP, length 120
19:54:59.703368 IP 192.168.43.124.8880 > 192.168.43.146.7771: UDP, length 120
19:54:59.753365 IP 192.168.43.124.8880 > 192.168.43.146.7771: UDP, length 120
19:54:59.803383 IP 192.168.43.124.8880 > 192.168.43.146.7771: UDP, length 120
19:54:59.853421 IP 192.168.43.124.8880 > 192.168.43.146.7771: UDP, length 120
19:54:59.903419 IP 192.168.43.124.8880 > 192.168.43.146.7771: UDP, length 120
19:54:59.953414 IP 192.168.43.124.8880 > 192.168.43.146.7771: UDP, length 120
19:55:00.003352 IP 192.168.43.124.8880 > 192.168.43.146.7771: UDP, length 120
19:55:00.053361 IP 192.168.43.124.8880 > 192.168.43.146.7771: UDP, length 120
19:55:00.103333 IP 192.168.43.124.8880 > 192.168.43.146.7771: UDP, length 120
19:55:00.153364 IP 192.168.43.124.8880 > 192.168.43.146.7771: UDP, length 120
19:55:00.203313 IP 192.168.43.124.8880 > 192.168.43.146.7771: UDP, length 120
19:55:00.253361 IP 192.168.43.124.8880 > 192.168.43.146.7771: UDP, length 120
19:55:00.303363 IP 192.168.43.124.8880 > 192.168.43.146.7771: UDP, length 120
19:55:00.353368 IP 192.168.43.124.8880 > 192.168.43.146.7771: UDP, length 120
19:55:00.403362 IP 192.168.43.124.8880 > 192.168.43.146.7771: UDP, length 120
19:55:00.453370 IP 192.168.43.124.8880 > 192.168.43.146.7771: UDP, length 120
19:55:00.503371 IP 192.168.43.124.8880 > 192.168.43.146.7771: UDP, length 120
19:55:00.553361 IP 192.168.43.124.8880 > 192.168.43.146.7771: UDP, length 120
19:55:00.603415 IP 192.168.43.124.8880 > 192.168.43.146.7771: UDP, length 120
19:55:00.653411 IP 192.168.43.124.8880 > 192.168.43.146.7771: UDP, length 120
19:55:00.703415 IP 192.168.43.124.8880 > 192.168.43.146.7771: UDP, length 120
19:55:00.753412 IP 192.168.43.124.8880 > 192.168.43.146.7771: UDP, length 120
19:55:00.803417 IP 192.168.43.124.8880 > 192.168.43.146.7771: UDP, length 120
19:55:00.853369 IP 192.168.43.124.8880 > 192.168.43.146.7771: UDP, length 120
19:55:00.903374 IP 192.168.43.124.8880 > 192.168.43.146.7771: UDP, length 120
19:55:00.953367 IP 192.168.43.124.8880 > 192.168.43.146.7771: UDP, length 120
19:55:01.003370 IP 192.168.43.124.8880 > 192.168.43.146.7771: UDP, length 120
19:55:01.053360 IP 192.168.43.124.8880 > 192.168.43.146.7771: UDP, length 120
19:55:01.103361 IP 192.168.43.124.8880 > 192.168.43.146.7771: UDP, length 120
19:55:01.153360 IP 192.168.43.124.8880 > 192.168.43.146.7771: UDP, length 120
19:55:01.203417 IP 192.168.43.124.8880 > 192.168.43.146.7771: UDP, length 120
19:55:01.253410 IP 192.168.43.124.8880 > 192.168.43.146.7771: UDP, length 120
19:55:01.303420 IP 192.168.43.124.8880 > 192.168.43.146.7771: UDP, length 120
19:55:01.353411 IP 192.168.43.124.8880 > 192.168.43.146.7771: UDP, length 120
19:55:01.403299 IP 192.168.43.124.8880 > 192.168.43.146.7771: UDP, length 120
19:55:01.453300 IP 192.168.43.124.8880 > 192.168.43.146.7771: UDP, length 120
19:55:01.503404 IP 192.168.43.124.8880 > 192.168.43.146.7771: UDP, length 120
19:55:01.553282 IP 192.168.43.124.8880 > 192.168.43.146.7771: UDP, length 120
19:55:01.603259 IP 192.168.43.124.8880 > 192.168.43.146.7771: UDP, length 120
19:55:01.653360 IP 192.168.43.124.8880 > 192.168.43.146.7771: UDP, length 120
19:55:01.703371 IP 192.168.43.124.8880 > 192.168.43.146.7771: UDP, length 120
19:55:01.753361 IP 192.168.43.124.8880 > 192.168.43.146.7771: UDP, length 120
19:55:01.803382 IP 192.168.43.124.8880 > 192.168.43.146.7771: UDP, length 120
19:55:01.853367 IP 192.168.43.124.8880 > 192.168.43.146.7771: UDP, length 120
19:55:01.903368 IP 192.168.43.124.8880 > 192.168.43.146.7771: UDP, length 120
19:55:01.953361 IP 192.168.43.124.8880 > 192.168.43.146.7771: UDP, length 120
19:55:02.003372 IP 192.168.43.124.8880 > 192.168.43.146.7771: UDP, length 120
19:55:02.053363 IP 192.168.43.124.8880 > 192.168.43.146.7771: UDP, length 120
19:55:02.103372 IP 192.168.43.124.8880 > 192.168.43.146.7771: UDP, length 120
19:55:02.129620 IP 192.168.43.147.8880 > 192.168.43.124.7773: UDP, length 120
19:55:02.147825 IP 192.168.43.147.8880 > 192.168.43.124.7773: UDP, length 120
19:55:02.153369 IP 192.168.43.124.8880 > 192.168.43.146.7771: UDP, length 120
19:55:02.188762 IP 192.168.43.147.8880 > 192.168.43.124.7773: UDP, length 120
19:55:02.203369 IP 192.168.43.124.8880 > 192.168.43.146.7771: UDP, length 120
19:55:02.233346 IP 192.168.43.147.8880 > 192.168.43.124.7773: UDP, length 120
19:55:02.253367 IP 192.168.43.124.8880 > 192.168.43.146.7771: UDP, length 120
19:55:02.297333 IP 192.168.43.147.8880 > 192.168.43.124.7773: UDP, length 120
19:55:02.303371 IP 192.168.43.124.8880 > 192.168.43.146.7771: UDP, length 120
19:55:02.353364 IP 192.168.43.124.8880 > 192.168.43.146.7771: UDP, length 120
19:55:02.403374 IP 192.168.43.124.8880 > 192.168.43.146.7771: UDP, length 120
19:55:02.404305 IP 192.168.43.147.8880 > 192.168.43.124.7773: UDP, length 120
19:55:02.439921 IP 192.168.43.147.8880 > 192.168.43.124.7773: UDP, length 120
19:55:02.453369 IP 192.168.43.124.8880 > 192.168.43.146.7771: UDP, length 120
19:55:02.503357 IP 192.168.43.124.8880 > 192.168.43.146.7771: UDP, length 120
19:55:02.553334 IP 192.168.43.124.8880 > 192.168.43.146.7771: UDP, length 120
19:55:02.603374 IP 192.168.43.124.8880 > 192.168.43.146.7771: UDP, length 120
19:55:02.653372 IP 192.168.43.124.8880 > 192.168.43.146.7771: UDP, length 120
19:55:02.654263 IP 192.168.43.147.8880 > 192.168.43.124.7773: UDP, length 120
19:55:02.703364 IP 192.168.43.124.8880 > 192.168.43.146.7771: UDP, length 120
19:55:02.741862 IP 192.168.43.147.8880 > 192.168.43.124.7773: UDP, length 120
19:55:02.753312 IP 192.168.43.124.8880 > 192.168.43.146.7771: UDP, length 120
19:55:02.794762 IP 192.168.43.147.8880 > 192.168.43.124.7773: UDP, length 120
19:55:02.803409 IP 192.168.43.124.8880 > 192.168.43.146.7771: UDP, length 120
19:55:02.840520 IP 192.168.43.147.8880 > 192.168.43.124.7773: UDP, length 120
19:55:02.853334 IP 192.168.43.124.8880 > 192.168.43.146.7771: UDP, length 120
19:55:02.903364 IP 192.168.43.124.8880 > 192.168.43.146.7771: UDP, length 120
19:55:02.928165 IP 192.168.43.147.8880 > 192.168.43.124.7773: UDP, length 120
19:55:02.939362 IP 192.168.43.147.8880 > 192.168.43.124.7773: UDP, length 120
19:55:02.953338 IP 192.168.43.124.8880 > 192.168.43.146.7771: UDP, length 120
19:55:02.971944 IP 192.168.43.147.8880 > 192.168.43.124.7773: UDP, length 120
19:55:02.996330 IP 192.168.43.147.8880 > 192.168.43.124.7773: UDP, length 120
19:55:03.003336 IP 192.168.43.124.8880 > 192.168.43.146.7771: UDP, length 120
19:55:03.027641 IP 192.168.43.147.8880 > 192.168.43.124.7773: UDP, length 120
19:55:03.053366 IP 192.168.43.124.8880 > 192.168.43.146.7771: UDP, length 120
19:55:03.077815 IP 192.168.43.147.8880 > 192.168.43.124.7773: UDP, length 120
19:55:03.102623 IP 192.168.43.147.8880 > 192.168.43.124.7773: UDP, length 120
19:55:03.103365 IP 192.168.43.124.8880 > 192.168.43.146.7771: UDP, length 120
19:55:03.153367 IP 192.168.43.124.8880 > 192.168.43.146.7771: UDP, length 120
19:55:03.168061 IP 192.168.43.147.8880 > 192.168.43.124.7773: UDP, length 120
19:55:03.203363 IP 192.168.43.124.8880 > 192.168.43.146.7771: UDP, length 120
19:55:03.253318 IP 192.168.43.124.8880 > 192.168.43.146.7771: UDP, length 120
19:55:03.277249 IP 192.168.43.147.8880 > 192.168.43.124.7773: UDP, length 120
19:55:03.303298 IP 192.168.43.124.8880 > 192.168.43.146.7771: UDP, length 120
19:55:03.353933 IP 192.168.43.124.8880 > 192.168.43.146.7771: UDP, length 120
19:55:03.374833 IP 192.168.43.147.8880 > 192.168.43.124.7773: UDP, length 120
19:55:03.396666 IP 192.168.43.147.8880 > 192.168.43.124.7773: UDP, length 120
19:55:03.403368 IP 192.168.43.124.8880 > 192.168.43.146.7771: UDP, length 120
19:55:03.421643 IP 192.168.43.147.8880 > 192.168.43.124.7773: UDP, length 120
19:55:03.439402 IP 192.168.43.147.8880 > 192.168.43.124.7773: UDP, length 120
19:55:03.453407 IP 192.168.43.124.8880 > 192.168.43.146.7771: UDP, length 120
19:55:03.497149 IP 192.168.43.147.8880 > 192.168.43.124.7773: UDP, length 120
19:55:03.503369 IP 192.168.43.124.8880 > 192.168.43.146.7771: UDP, length 120
19:55:03.529021 IP 192.168.43.147.8880 > 192.168.43.124.7773: UDP, length 120
19:55:03.553367 IP 192.168.43.124.8880 > 192.168.43.146.7771: UDP, length 120
19:55:03.603412 IP 192.168.43.124.8880 > 192.168.43.146.7771: UDP, length 120
19:55:03.653513 IP 192.168.43.124.8880 > 192.168.43.146.7771: UDP, length 120
19:55:03.671618 IP 192.168.43.147.8880 > 192.168.43.124.7773: UDP, length 120
19:55:03.703368 IP 192.168.43.124.8880 > 192.168.43.146.7771: UDP, length 120
19:55:03.737571 IP 192.168.43.147.8880 > 192.168.43.124.7773: UDP, length 120
19:55:03.745710 IP 192.168.43.147.8880 > 192.168.43.124.7773: UDP, length 120
19:55:03.753366 IP 192.168.43.124.8880 > 192.168.43.146.7771: UDP, length 120
19:55:03.804053 IP 192.168.43.124.8880 > 192.168.43.146.7771: UDP, length 120
19:55:03.847285 IP 192.168.43.147.8880 > 192.168.43.124.7773: UDP, length 120
19:55:03.853465 IP 192.168.43.124.8880 > 192.168.43.146.7771: UDP, length 120
19:55:03.903386 IP 192.168.43.124.8880 > 192.168.43.146.7771: UDP, length 120
19:55:03.904766 IP 192.168.43.147.8880 > 192.168.43.124.7773: UDP, length 120
19:55:03.921695 IP 192.168.43.147.8880 > 192.168.43.124.7773: UDP, length 120
19:55:03.953374 IP 192.168.43.124.8880 > 192.168.43.146.7771: UDP, length 120
19:55:03.997328 IP 192.168.43.147.8880 > 192.168.43.124.7773: UDP, length 120
19:55:04.003337 IP 192.168.43.124.8880 > 192.168.43.146.7771: UDP, length 120
19:55:04.021617 IP 192.168.43.147.8880 > 192.168.43.124.7773: UDP, length 120
19:55:04.053735 IP 192.168.43.124.8880 > 192.168.43.146.7771: UDP, length 120
19:55:04.066856 IP 192.168.43.147.8880 > 192.168.43.124.7773: UDP, length 120
19:55:04.076932 IP 192.168.43.147.8880 > 192.168.43.124.7773: UDP, length 120
19:55:04.087719 IP 192.168.43.147.8880 > 192.168.43.124.7773: UDP, length 120
19:55:04.103524 IP 192.168.43.124.8880 > 192.168.43.146.7771: UDP, length 120
19:55:04.153790 IP 192.168.43.124.8880 > 192.168.43.146.7771: UDP, length 120
19:55:04.203370 IP 192.168.43.124.8880 > 192.168.43.146.7771: UDP, length 120
19:55:04.204434 IP 192.168.43.147.8880 > 192.168.43.124.7773: UDP, length 120
19:55:04.241867 IP 192.168.43.147.8880 > 192.168.43.124.7773: UDP, length 120
19:55:04.252589 IP 192.168.43.147.8880 > 192.168.43.124.7773: UDP, length 120
19:55:04.253369 IP 192.168.43.124.8880 > 192.168.43.146.7771: UDP, length 120
19:55:04.293622 IP 192.168.43.147.8880 > 192.168.43.124.7773: UDP, length 120
19:55:04.303363 IP 192.168.43.124.8880 > 192.168.43.146.7771: UDP, length 120
19:55:04.327253 IP 192.168.43.147.8880 > 192.168.43.124.7773: UDP, length 120
19:55:04.353368 IP 192.168.43.124.8880 > 192.168.43.146.7771: UDP, length 120
19:55:04.373886 IP 192.168.43.147.8880 > 192.168.43.124.7773: UDP, length 120
19:55:04.403363 IP 192.168.43.124.8880 > 192.168.43.146.7771: UDP, length 120
19:55:04.430125 IP 192.168.43.147.8880 > 192.168.43.124.7773: UDP, length 120
19:55:04.448221 IP 192.168.43.147.8880 > 192.168.43.124.7773: UDP, length 120
19:55:04.453368 IP 192.168.43.124.8880 > 192.168.43.146.7771: UDP, length 120
19:55:04.469443 IP 192.168.43.147.8880 > 192.168.43.124.7773: UDP, length 120
19:55:04.513722 IP 192.168.43.147.8880 > 192.168.43.124.7773: UDP, length 120
19:55:04.530939 IP 192.168.43.147.8880 > 192.168.43.124.7773: UDP, length 120
19:55:04.532730 IP 192.168.43.147.8880 > 192.168.43.124.7773: UDP, length 120
19:55:04.589623 IP 192.168.43.147.8880 > 192.168.43.124.7773: UDP, length 120
19:55:04.603243 IP 192.168.43.147.8880 > 192.168.43.124.7773: UDP, length 120
19:55:04.648735 IP 192.168.43.147.8880 > 192.168.43.124.7773: UDP, length 120
19:55:04.678226 IP 192.168.43.147.8880 > 192.168.43.124.7773: UDP, length 120
19:55:04.800573 IP 192.168.43.147.8880 > 192.168.43.124.7773: UDP, length 120
19:55:04.823992 IP 192.168.43.147.8880 > 192.168.43.124.7773: UDP, length 120
19:55:04.866797 IP 192.168.43.147.8880 > 192.168.43.124.7773: UDP, length 120
19:55:04.901708 IP 192.168.43.147.8880 > 192.168.43.124.7773: UDP, length 120
19:55:04.975323 IP 192.168.43.147.8880 > 192.168.43.124.7773: UDP, length 120
19:55:05.035779 IP 192.168.43.147.8880 > 192.168.43.124.7773: UDP, length 120
19:55:05.099972 IP 192.168.43.147.8880 > 192.168.43.124.7773: UDP, length 120
19:55:05.154630 IP 192.168.43.147.8880 > 192.168.43.124.7773: UDP, length 120
19:55:05.159198 IP 192.168.43.147.8880 > 192.168.43.124.7773: UDP, length 120
19:55:05.178859 IP 192.168.43.147.8880 > 192.168.43.124.7773: UDP, length 120
19:55:05.218231 IP 192.168.43.147.8880 > 192.168.43.124.7773: UDP, length 120
19:55:05.311927 IP 192.168.43.147.8880 > 192.168.43.124.7773: UDP, length 120
19:55:05.396580 IP 192.168.43.147.8880 > 192.168.43.124.7773: UDP, length 120
19:55:05.398910 IP 192.168.43.147.8880 > 192.168.43.124.7773: UDP, length 120
19:55:05.432398 IP 192.168.43.147.8880 > 192.168.43.124.7773: UDP, length 120
19:55:05.475999 IP 192.168.43.147.8880 > 192.168.43.124.7773: UDP, length 120
19:55:05.487937 IP 192.168.43.147.8880 > 192.168.43.124.7773: UDP, length 120
19:55:05.518733 IP 192.168.43.147.8880 > 192.168.43.124.7773: UDP, length 120
19:55:05.563705 IP 192.168.43.147.8880 > 192.168.43.124.7773: UDP, length 120
19:55:05.620200 IP 192.168.43.147.8880 > 192.168.43.124.7773: UDP, length 120
19:55:05.631904 IP 192.168.43.147.8880 > 192.168.43.124.7773: UDP, length 120
19:55:05.653258 IP 192.168.43.147.8880 > 192.168.43.124.7773: UDP, length 120
19:55:05.665813 IP 192.168.43.147.8880 > 192.168.43.124.7773: UDP, length 120
19:55:05.688747 IP 192.168.43.147.8880 > 192.168.43.124.7773: UDP, length 120
19:55:05.740236 IP 192.168.43.147.8880 > 192.168.43.124.7773: UDP, length 120
19:55:05.742470 IP 192.168.43.147.8880 > 192.168.43.124.7773: UDP, length 120
19:55:05.751334 IP 192.168.43.147.8880 > 192.168.43.124.7773: UDP, length 120
19:55:05.773486 IP 192.168.43.147.8880 > 192.168.43.124.7773: UDP, length 120
19:55:05.785651 IP 192.168.43.147.8880 > 192.168.43.124.7773: UDP, length 120
19:55:05.790181 IP 192.168.43.147.8880 > 192.168.43.124.7773: UDP, length 120
19:55:05.797629 IP 192.168.43.147.8880 > 192.168.43.124.7773: UDP, length 120
19:55:05.863753 IP 192.168.43.147.8880 > 192.168.43.124.7773: UDP, length 120
19:55:05.885527 IP 192.168.43.147.8880 > 192.168.43.124.7773: UDP, length 120
19:55:05.887779 IP 192.168.43.147.8880 > 192.168.43.124.7773: UDP, length 120
19:55:05.934930 IP 192.168.43.147.8880 > 192.168.43.124.7773: UDP, length 120
19:55:05.946444 IP 192.168.43.147.8880 > 192.168.43.124.7773: UDP, length 120
19:55:05.948254 IP 192.168.43.147.8880 > 192.168.43.124.7773: UDP, length 120
19:55:05.966690 IP 192.168.43.147.8880 > 192.168.43.124.7773: UDP, length 120
19:55:05.980029 IP 192.168.43.147.8880 > 192.168.43.124.7773: UDP, length 120
19:55:05.987703 IP 192.168.43.147.8880 > 192.168.43.124.7773: UDP, length 120
19:55:06.008687 IP 192.168.43.147.8880 > 192.168.43.124.7773: UDP, length 120
19:55:06.013930 IP 192.168.43.147.8880 > 192.168.43.124.7773: UDP, length 120
19:55:06.033189 IP 192.168.43.147.8880 > 192.168.43.124.7773: UDP, length 120
19:55:06.036278 IP 192.168.43.147.8880 > 192.168.43.124.7773: UDP, length 120
19:55:06.047981 IP 192.168.43.147.8880 > 192.168.43.124.7773: UDP, length 120
19:55:06.068276 IP 192.168.43.147.8880 > 192.168.43.124.7773: UDP, length 120
19:55:06.070583 IP 192.168.43.147.8880 > 192.168.43.124.7773: UDP, length 120
19:55:06.072774 IP 192.168.43.147.8880 > 192.168.43.124.7773: UDP, length 120
19:55:06.074942 IP 192.168.43.147.8880 > 192.168.43.124.7773: UDP, length 120
19:55:06.097152 IP 192.168.43.147.8880 > 192.168.43.124.7773: UDP, length 120
19:55:06.143342 IP 192.168.43.147.8880 > 192.168.43.124.7773: UDP, length 120
19:55:06.179098 IP 192.168.43.147.8880 > 192.168.43.124.7773: UDP, length 120
19:55:06.200412 IP 192.168.43.147.8880 > 192.168.43.124.7773: UDP, length 120
19:55:06.202681 IP 192.168.43.147.8880 > 192.168.43.124.7773: UDP, length 120
19:55:06.225835 IP 192.168.43.147.8880 > 192.168.43.124.7773: UDP, length 120
19:55:06.243622 IP 192.168.43.147.8880 > 192.168.43.124.7773: UDP, length 120
19:55:06.254720 IP 192.168.43.147.8880 > 192.168.43.124.7773: UDP, length 120
19:55:06.382079 IP 192.168.43.147.8880 > 192.168.43.124.7773: UDP, length 120
19:55:06.445570 IP 192.168.43.147.8880 > 192.168.43.124.7773: UDP, length 120
19:55:06.476958 IP 192.168.43.147.8880 > 192.168.43.124.7773: UDP, length 120
19:55:06.578725 IP 192.168.43.147.8880 > 192.168.43.124.7773: UDP, length 120
19:55:06.666074 IP 192.168.43.147.8880 > 192.168.43.124.7773: UDP, length 120
19:55:06.711920 IP 192.168.43.147.8880 > 192.168.43.124.7773: UDP, length 120
19:55:06.827881 IP 192.168.43.147.8880 > 192.168.43.124.7773: UDP, length 120
19:55:06.869667 IP 192.168.43.147.8880 > 192.168.43.124.7773: UDP, length 120
19:55:06.925706 IP 192.168.43.147.8880 > 192.168.43.124.7773: UDP, length 120
19:55:06.973366 IP 192.168.43.147.8880 > 192.168.43.124.7773: UDP, length 120
19:55:07.002558 IP 192.168.43.147.8880 > 192.168.43.124.7773: UDP, length 120
19:55:07.015513 IP 192.168.43.147.8880 > 192.168.43.124.7773: UDP, length 120
19:55:07.061416 IP 192.168.43.147.8880 > 192.168.43.124.7773: UDP, length 120
19:55:07.085481 IP 192.168.43.147.8880 > 192.168.43.124.7773: UDP, length 120
19:55:07.249334 IP 192.168.43.147.8880 > 192.168.43.124.7773: UDP, length 120
19:55:07.253861 IP 192.168.43.147.8880 > 192.168.43.124.7773: UDP, length 120
19:55:07.317973 IP 192.168.43.147.8880 > 192.168.43.124.7773: UDP, length 120
19:55:07.350886 IP 192.168.43.147.8880 > 192.168.43.124.7773: UDP, length 120
19:55:07.428010 IP 192.168.43.147.8880 > 192.168.43.124.7773: UDP, length 120
19:55:07.551861 IP 192.168.43.147.8880 > 192.168.43.124.7773: UDP, length 120
19:55:07.574851 IP 192.168.43.147.8880 > 192.168.43.124.7773: UDP, length 120
19:55:07.673607 IP 192.168.43.147.8880 > 192.168.43.124.7773: UDP, length 120
19:55:07.743081 IP 192.168.43.147.8880 > 192.168.43.124.7773: UDP, length 120
19:55:07.762800 IP 192.168.43.147.8880 > 192.168.43.124.7773: UDP, length 120
19:55:07.810075 IP 192.168.43.147.8880 > 192.168.43.124.7773: UDP, length 120
19:55:07.820339 IP 192.168.43.147.8880 > 192.168.43.124.7773: UDP, length 120
19:55:07.840601 IP 192.168.43.147.8880 > 192.168.43.124.7773: UDP, length 120
19:55:07.953147 IP 192.168.43.147.8880 > 192.168.43.124.7773: UDP, length 120
19:55:07.987459 IP 192.168.43.147.8880 > 192.168.43.124.7773: UDP, length 120
19:55:08.032723 IP 192.168.43.147.8880 > 192.168.43.124.7773: UDP, length 120
19:55:08.042256 IP 192.168.43.147.8880 > 192.168.43.124.7773: UDP, length 120
19:55:08.075542 IP 192.168.43.147.8880 > 192.168.43.124.7773: UDP, length 120
19:55:08.142355 IP 192.168.43.147.8880 > 192.168.43.124.7773: UDP, length 120
19:55:08.155583 IP 192.168.43.124.8880 > 192.168.43.146.7771: UDP, length 120
19:55:08.156164 IP 192.168.43.124.8880 > 192.168.43.146.7771: UDP, length 120
19:55:08.156202 IP 192.168.43.124.8880 > 192.168.43.146.7771: UDP, length 120
19:55:08.156207 IP 192.168.43.124.8880 > 192.168.43.146.7771: UDP, length 120
19:55:08.156365 IP 192.168.43.124.8880 > 192.168.43.146.7771: UDP, length 120
19:55:08.156369 IP 192.168.43.124.8880 > 192.168.43.146.7771: UDP, length 120
19:55:08.156399 IP 192.168.43.124.8880 > 192.168.43.146.7771: UDP, length 120
19:55:08.156404 IP 192.168.43.124.8880 > 192.168.43.146.7771: UDP, length 120
19:55:08.156435 IP 192.168.43.124.8880 > 192.168.43.146.7771: UDP, length 120
19:55:08.156440 IP 192.168.43.124.8880 > 192.168.43.146.7771: UDP, length 120
19:55:08.156444 IP 192.168.43.124.8880 > 192.168.43.146.7771: UDP, length 120
19:55:08.156475 IP 192.168.43.124.8880 > 192.168.43.146.7771: UDP, length 120
19:55:08.156480 IP 192.168.43.124.8880 > 192.168.43.146.7771: UDP, length 120
19:55:08.179271 IP 192.168.43.147.8880 > 192.168.43.124.7773: UDP, length 120
19:55:08.188645 IP 192.168.43.147.8880 > 192.168.43.124.7773: UDP, length 120
19:55:08.192510 IP 192.168.43.147.8880 > 192.168.43.124.7773: UDP, length 120
19:55:08.203458 IP 192.168.43.124.8880 > 192.168.43.146.7771: UDP, length 120
19:55:08.224700 IP 192.168.43.147.8880 > 192.168.43.124.7773: UDP, length 120
19:55:08.253368 IP 192.168.43.124.8880 > 192.168.43.146.7771: UDP, length 120
19:55:08.276274 IP 192.168.43.147.8880 > 192.168.43.124.7773: UDP, length 120
19:55:08.298628 IP 192.168.43.147.8880 > 192.168.43.124.7773: UDP, length 120
19:55:08.303376 IP 192.168.43.124.8880 > 192.168.43.146.7771: UDP, length 120
19:55:08.333616 IP 192.168.43.147.8880 > 192.168.43.124.7773: UDP, length 120
19:55:08.344647 IP 192.168.43.147.8880 > 192.168.43.124.7773: UDP, length 120
19:55:08.353369 IP 192.168.43.124.8880 > 192.168.43.146.7771: UDP, length 120
19:55:08.357710 IP 192.168.43.147.8880 > 192.168.43.124.7773: UDP, length 120
19:55:08.403369 IP 192.168.43.124.8880 > 192.168.43.146.7771: UDP, length 120
19:55:08.453324 IP 192.168.43.124.8880 > 192.168.43.146.7771: UDP, length 120
19:55:08.503365 IP 192.168.43.124.8880 > 192.168.43.146.7771: UDP, length 120
19:55:08.524715 IP 192.168.43.147.8880 > 192.168.43.124.7773: UDP, length 120
19:55:08.530054 IP 192.168.43.147.8880 > 192.168.43.124.7773: UDP, length 120
19:55:08.550106 IP 192.168.43.147.8880 > 192.168.43.124.7773: UDP, length 120
19:55:08.553369 IP 192.168.43.124.8880 > 192.168.43.146.7771: UDP, length 120
19:55:08.554897 IP 192.168.43.147.8880 > 192.168.43.124.7773: UDP, length 120
19:55:08.580109 IP 192.168.43.147.8880 > 192.168.43.124.7773: UDP, length 120
19:55:08.603337 IP 192.168.43.124.8880 > 192.168.43.146.7771: UDP, length 120
19:55:08.610713 IP 192.168.43.147.8880 > 192.168.43.124.7773: UDP, length 120
19:55:08.645564 IP 192.168.43.147.8880 > 192.168.43.124.7773: UDP, length 120
19:55:08.653368 IP 192.168.43.124.8880 > 192.168.43.146.7771: UDP, length 120
19:55:08.669363 IP 192.168.43.147.8880 > 192.168.43.124.7773: UDP, length 120
19:55:08.703349 IP 192.168.43.124.8880 > 192.168.43.146.7771: UDP, length 120
19:55:08.721725 IP 192.168.43.147.8880 > 192.168.43.124.7773: UDP, length 120
19:55:08.753335 IP 192.168.43.124.8880 > 192.168.43.146.7771: UDP, length 120
19:55:08.793375 IP 192.168.43.147.8880 > 192.168.43.124.7773: UDP, length 120
19:55:08.803412 IP 192.168.43.124.8880 > 192.168.43.146.7771: UDP, length 120
19:55:08.853370 IP 192.168.43.124.8880 > 192.168.43.146.7771: UDP, length 120
19:55:08.856812 IP 192.168.43.147.8880 > 192.168.43.124.7773: UDP, length 120
19:55:08.903313 IP 192.168.43.124.8880 > 192.168.43.146.7771: UDP, length 120
19:55:08.911428 IP 192.168.43.147.8880 > 192.168.43.124.7773: UDP, length 120
19:55:08.946681 IP 192.168.43.147.8880 > 192.168.43.124.7773: UDP, length 120
19:55:08.953368 IP 192.168.43.124.8880 > 192.168.43.146.7771: UDP, length 120
19:55:08.958634 IP 192.168.43.147.8880 > 192.168.43.124.7773: UDP, length 120
19:55:09.003370 IP 192.168.43.124.8880 > 192.168.43.146.7771: UDP, length 120
19:55:09.013283 IP 192.168.43.147.8880 > 192.168.43.124.7773: UDP, length 120
19:55:09.042345 IP 192.168.43.147.8880 > 192.168.43.124.7773: UDP, length 120
19:55:09.053367 IP 192.168.43.124.8880 > 192.168.43.146.7771: UDP, length 120
19:55:09.103345 IP 192.168.43.124.8880 > 192.168.43.146.7771: UDP, length 120
19:55:09.153335 IP 192.168.43.124.8880 > 192.168.43.146.7771: UDP, length 120
19:55:09.160177 IP 192.168.43.147.8880 > 192.168.43.124.7773: UDP, length 120
19:55:09.203370 IP 192.168.43.124.8880 > 192.168.43.146.7771: UDP, length 120
19:55:09.253339 IP 192.168.43.124.8880 > 192.168.43.146.7771: UDP, length 120
19:55:09.303362 IP 192.168.43.124.8880 > 192.168.43.146.7771: UDP, length 120
19:55:09.307508 IP 192.168.43.147.8880 > 192.168.43.124.7773: UDP, length 120
19:55:09.326140 IP 192.168.43.147.8880 > 192.168.43.124.7773: UDP, length 120
19:55:09.353371 IP 192.168.43.124.8880 > 192.168.43.146.7771: UDP, length 120
19:55:09.361288 IP 192.168.43.147.8880 > 192.168.43.124.7773: UDP, length 120
19:55:09.378830 IP 192.168.43.147.8880 > 192.168.43.124.7773: UDP, length 120
19:55:09.388070 IP 192.168.43.147.8880 > 192.168.43.124.7773: UDP, length 120
19:55:09.390716 IP 192.168.43.147.8880 > 192.168.43.124.7773: UDP, length 120
19:55:09.393015 IP 192.168.43.147.8880 > 192.168.43.124.7773: UDP, length 120
19:55:09.397567 IP 192.168.43.147.8880 > 192.168.43.124.7773: UDP, length 120
19:55:09.399784 IP 192.168.43.147.8880 > 192.168.43.124.7773: UDP, length 120
19:55:09.403370 IP 192.168.43.124.8880 > 192.168.43.146.7771: UDP, length 120
19:55:09.412388 IP 192.168.43.147.8880 > 192.168.43.124.7773: UDP, length 120
19:55:09.426742 IP 192.168.43.147.8880 > 192.168.43.124.7773: UDP, length 120
19:55:09.437594 IP 192.168.43.147.8880 > 192.168.43.124.7773: UDP, length 120
19:55:09.453316 IP 192.168.43.124.8880 > 192.168.43.146.7771: UDP, length 120
19:55:09.468861 IP 192.168.43.147.8880 > 192.168.43.124.7773: UDP, length 120
19:55:09.471156 IP 192.168.43.147.8880 > 192.168.43.124.7773: UDP, length 120
19:55:09.480643 IP 192.168.43.147.8880 > 192.168.43.124.7773: UDP, length 120
19:55:09.482221 IP 192.168.43.147.8880 > 192.168.43.124.7773: UDP, length 120
19:55:09.494944 IP 192.168.43.147.8880 > 192.168.43.124.7773: UDP, length 120
19:55:09.503372 IP 192.168.43.124.8880 > 192.168.43.146.7771: UDP, length 120
19:55:09.525743 IP 192.168.43.147.8880 > 192.168.43.124.7773: UDP, length 120
19:55:09.534535 IP 192.168.43.147.8880 > 192.168.43.124.7773: UDP, length 120
19:55:09.548018 IP 192.168.43.147.8880 > 192.168.43.124.7773: UDP, length 120
19:55:09.549797 IP 192.168.43.147.8880 > 192.168.43.124.7773: UDP, length 120
19:55:09.553374 IP 192.168.43.124.8880 > 192.168.43.146.7771: UDP, length 120
19:55:09.560999 IP 192.168.43.147.8880 > 192.168.43.124.7773: UDP, length 120
19:55:09.581638 IP 192.168.43.147.8880 > 192.168.43.124.7773: UDP, length 120
19:55:09.587615 IP 192.168.43.147.8880 > 192.168.43.124.7773: UDP, length 120
19:55:09.589800 IP 192.168.43.147.8880 > 192.168.43.124.7773: UDP, length 120
19:55:09.592051 IP 192.168.43.147.8880 > 192.168.43.124.7773: UDP, length 120
19:55:09.603372 IP 192.168.43.124.8880 > 192.168.43.146.7771: UDP, length 120
19:55:09.605089 IP 192.168.43.147.8880 > 192.168.43.124.7773: UDP, length 120
19:55:09.616145 IP 192.168.43.147.8880 > 192.168.43.124.7773: UDP, length 120
19:55:09.627788 IP 192.168.43.147.8880 > 192.168.43.124.7773: UDP, length 120
19:55:09.629994 IP 192.168.43.147.8880 > 192.168.43.124.7773: UDP, length 120
19:55:09.637834 IP 192.168.43.147.8880 > 192.168.43.124.7773: UDP, length 120
19:55:09.651208 IP 192.168.43.147.8880 > 192.168.43.124.7773: UDP, length 120
19:55:09.653371 IP 192.168.43.124.8880 > 192.168.43.146.7771: UDP, length 120
19:55:09.654283 IP 192.168.43.147.8880 > 192.168.43.124.7773: UDP, length 120
19:55:09.658742 IP 192.168.43.147.8880 > 192.168.43.124.7773: UDP, length 120
19:55:09.660571 IP 192.168.43.147.8880 > 192.168.43.124.7773: UDP, length 120
19:55:09.664598 IP 192.168.43.147.8880 > 192.168.43.124.7773: UDP, length 120
19:55:09.703369 IP 192.168.43.124.8880 > 192.168.43.146.7771: UDP, length 120
19:55:09.704325 IP 192.168.43.147.8880 > 192.168.43.124.7773: UDP, length 120
19:55:09.713757 IP 192.168.43.147.8880 > 192.168.43.124.7773: UDP, length 120
19:55:09.745152 IP 192.168.43.147.8880 > 192.168.43.124.7773: UDP, length 120
19:55:09.753372 IP 192.168.43.124.8880 > 192.168.43.146.7771: UDP, length 120
19:55:09.764849 IP 192.168.43.147.8880 > 192.168.43.124.7773: UDP, length 120
19:55:09.770133 IP 192.168.43.147.8880 > 192.168.43.124.7773: UDP, length 120
19:55:09.772263 IP 192.168.43.147.8880 > 192.168.43.124.7773: UDP, length 120
19:55:09.774720 IP 192.168.43.147.8880 > 192.168.43.124.7773: UDP, length 120
19:55:09.786543 IP 192.168.43.147.8880 > 192.168.43.124.7773: UDP, length 120
19:55:09.803410 IP 192.168.43.124.8880 > 192.168.43.146.7771: UDP, length 120
19:55:09.835626 IP 192.168.43.147.8880 > 192.168.43.124.7773: UDP, length 120
19:55:09.853371 IP 192.168.43.124.8880 > 192.168.43.146.7771: UDP, length 120
19:55:09.888066 IP 192.168.43.147.8880 > 192.168.43.124.7773: UDP, length 120
19:55:09.903369 IP 192.168.43.124.8880 > 192.168.43.146.7771: UDP, length 120
19:55:09.937646 IP 192.168.43.147.8880 > 192.168.43.124.7773: UDP, length 120
19:55:09.953372 IP 192.168.43.124.8880 > 192.168.43.146.7771: UDP, length 120
19:55:09.986004 IP 192.168.43.147.8880 > 192.168.43.124.7773: UDP, length 120
19:55:10.003373 IP 192.168.43.124.8880 > 192.168.43.146.7771: UDP, length 120
19:55:10.035575 IP 192.168.43.147.8880 > 192.168.43.124.7773: UDP, length 120
19:55:10.053370 IP 192.168.43.124.8880 > 192.168.43.146.7771: UDP, length 120
19:55:10.085847 IP 192.168.43.147.8880 > 192.168.43.124.7773: UDP, length 120
19:55:10.103439 IP 192.168.43.124.8880 > 192.168.43.146.7771: UDP, length 120
19:55:10.136386 IP 192.168.43.147.8880 > 192.168.43.124.7773: UDP, length 120
19:55:10.153369 IP 192.168.43.124.8880 > 192.168.43.146.7771: UDP, length 120
19:55:10.185191 IP 192.168.43.147.8880 > 192.168.43.124.7773: UDP, length 120
19:55:10.203455 IP 192.168.43.124.8880 > 192.168.43.146.7771: UDP, length 120
19:55:10.236289 IP 192.168.43.147.8880 > 192.168.43.124.7773: UDP, length 120
19:55:10.253441 IP 192.168.43.124.8880 > 192.168.43.146.7771: UDP, length 120
19:55:10.291928 IP 192.168.43.147.8880 > 192.168.43.124.7773: UDP, length 120
19:55:10.303445 IP 192.168.43.124.8880 > 192.168.43.146.7771: UDP, length 120
19:55:10.353383 IP 192.168.43.124.8880 > 192.168.43.146.7771: UDP, length 120
19:55:10.377744 IP 192.168.43.147.8880 > 192.168.43.124.7773: UDP, length 120
19:55:10.403439 IP 192.168.43.124.8880 > 192.168.43.146.7771: UDP, length 120
19:55:10.453392 IP 192.168.43.124.8880 > 192.168.43.146.7771: UDP, length 120
19:55:10.481610 IP 192.168.43.147.8880 > 192.168.43.124.7773: UDP, length 120
19:55:10.492647 IP 192.168.43.147.8880 > 192.168.43.124.7773: UDP, length 120
19:55:10.499927 IP 192.168.43.147.8880 > 192.168.43.124.7773: UDP, length 120
19:55:10.503395 IP 192.168.43.124.8880 > 192.168.43.146.7771: UDP, length 120
19:55:10.553396 IP 192.168.43.124.8880 > 192.168.43.146.7771: UDP, length 120
19:55:10.603387 IP 192.168.43.124.8880 > 192.168.43.146.7771: UDP, length 120
19:55:10.617849 IP 192.168.43.147.8880 > 192.168.43.124.7773: UDP, length 120
19:55:10.620154 IP 192.168.43.147.8880 > 192.168.43.124.7773: UDP, length 120
19:55:10.633241 IP 192.168.43.147.8880 > 192.168.43.124.7773: UDP, length 120
19:55:10.653399 IP 192.168.43.124.8880 > 192.168.43.146.7771: UDP, length 120
19:55:10.685891 IP 192.168.43.147.8880 > 192.168.43.124.7773: UDP, length 120
19:55:10.703396 IP 192.168.43.124.8880 > 192.168.43.146.7771: UDP, length 120
19:55:10.734634 IP 192.168.43.147.8880 > 192.168.43.124.7773: UDP, length 120
19:55:10.753391 IP 192.168.43.124.8880 > 192.168.43.146.7771: UDP, length 120
19:55:10.785400 IP 192.168.43.147.8880 > 192.168.43.124.7773: UDP, length 120
19:55:10.803451 IP 192.168.43.124.8880 > 192.168.43.146.7771: UDP, length 120
19:55:10.835498 IP 192.168.43.147.8880 > 192.168.43.124.7773: UDP, length 120
