01:53:51.159039 IP 192.168.43.124.8880 > 192.168.43.146.7771: UDP, length 120
01:53:51.199455 IP 192.168.43.124.8880 > 192.168.43.146.7771: UDP, length 120
01:53:51.249405 IP 192.168.43.124.8880 > 192.168.43.146.7771: UDP, length 120
01:53:51.299600 IP 192.168.43.124.8880 > 192.168.43.146.7771: UDP, length 120
01:53:51.349614 IP 192.168.43.124.8880 > 192.168.43.146.7771: UDP, length 120
01:53:51.399649 IP 192.168.43.124.8880 > 192.168.43.146.7771: UDP, length 120
01:53:51.449612 IP 192.168.43.124.8880 > 192.168.43.146.7771: UDP, length 120
01:53:51.499599 IP 192.168.43.124.8880 > 192.168.43.146.7771: UDP, length 120
01:53:51.549775 IP 192.168.43.124.8880 > 192.168.43.146.7771: UDP, length 120
01:53:51.600600 IP 192.168.43.124.8880 > 192.168.43.146.7771: UDP, length 120
01:53:51.649644 IP 192.168.43.124.8880 > 192.168.43.146.7771: UDP, length 120
01:53:51.700950 IP 192.168.43.124.8880 > 192.168.43.146.7771: UDP, length 120
01:53:51.750499 IP 192.168.43.124.8880 > 192.168.43.146.7771: UDP, length 120
01:53:51.800831 IP 192.168.43.124.8880 > 192.168.43.146.7771: UDP, length 120
01:53:51.849651 IP 192.168.43.124.8880 > 192.168.43.146.7771: UDP, length 120
01:53:51.899678 IP 192.168.43.124.8880 > 192.168.43.146.7771: UDP, length 120
01:53:51.949620 IP 192.168.43.124.8880 > 192.168.43.146.7771: UDP, length 120
01:53:51.997755 IP 192.168.43.124.8880 > 192.168.43.146.7771: UDP, length 120
01:53:52.049560 IP 192.168.43.124.8880 > 192.168.43.146.7771: UDP, length 120
01:53:52.099187 IP 192.168.43.124.8880 > 192.168.43.146.7771: UDP, length 120
01:53:52.149387 IP 192.168.43.124.8880 > 192.168.43.146.7771: UDP, length 120
01:53:52.200255 IP 192.168.43.124.8880 > 192.168.43.146.7771: UDP, length 120
01:53:52.249777 IP 192.168.43.124.8880 > 192.168.43.146.7771: UDP, length 120
01:53:52.301347 IP 192.168.43.124.8880 > 192.168.43.146.7771: UDP, length 120
01:53:52.347892 IP 192.168.43.124.8880 > 192.168.43.146.7771: UDP, length 120
01:53:52.397739 IP 192.168.43.124.8880 > 192.168.43.146.7771: UDP, length 120
01:53:52.446887 IP 192.168.43.124.8880 > 192.168.43.146.7771: UDP, length 120
01:53:52.474248 IP 192.168.43.146.8880 > 192.168.43.147.7772: UDP, length 120
01:53:52.499488 IP 192.168.43.124.8880 > 192.168.43.146.7771: UDP, length 120
01:53:52.524291 IP 192.168.43.146.8880 > 192.168.43.147.7772: UDP, length 120
01:53:52.549496 IP 192.168.43.124.8880 > 192.168.43.146.7771: UDP, length 120
01:53:52.574277 IP 192.168.43.146.8880 > 192.168.43.147.7772: UDP, length 120
01:53:52.600312 IP 192.168.43.124.8880 > 192.168.43.146.7771: UDP, length 120
01:53:52.624308 IP 192.168.43.146.8880 > 192.168.43.147.7772: UDP, length 120
01:53:52.650456 IP 192.168.43.124.8880 > 192.168.43.146.7771: UDP, length 120
01:53:52.674299 IP 192.168.43.146.8880 > 192.168.43.147.7772: UDP, length 120
01:53:52.701122 IP 192.168.43.124.8880 > 192.168.43.146.7771: UDP, length 120
01:53:52.724295 IP 192.168.43.146.8880 > 192.168.43.147.7772: UDP, length 120
01:53:52.750540 IP 192.168.43.124.8880 > 192.168.43.146.7771: UDP, length 120
01:53:52.774293 IP 192.168.43.146.8880 > 192.168.43.147.7772: UDP, length 120
01:53:52.801880 IP 192.168.43.124.8880 > 192.168.43.146.7771: UDP, length 120
01:53:52.824296 IP 192.168.43.146.8880 > 192.168.43.147.7772: UDP, length 120
01:53:52.852307 IP 192.168.43.124.8880 > 192.168.43.146.7771: UDP, length 120
01:53:52.874296 IP 192.168.43.146.8880 > 192.168.43.147.7772: UDP, length 120
01:53:52.899625 IP 192.168.43.124.8880 > 192.168.43.146.7771: UDP, length 120
01:53:52.924306 IP 192.168.43.146.8880 > 192.168.43.147.7772: UDP, length 120
01:53:52.949592 IP 192.168.43.124.8880 > 192.168.43.146.7771: UDP, length 120
01:53:52.974314 IP 192.168.43.146.8880 > 192.168.43.147.7772: UDP, length 120
01:53:52.998992 IP 192.168.43.124.8880 > 192.168.43.146.7771: UDP, length 120
01:53:53.024294 IP 192.168.43.146.8880 > 192.168.43.147.7772: UDP, length 120
01:53:53.050543 IP 192.168.43.124.8880 > 192.168.43.146.7771: UDP, length 120
01:53:53.074307 IP 192.168.43.146.8880 > 192.168.43.147.7772: UDP, length 120
01:53:53.099666 IP 192.168.43.124.8880 > 192.168.43.146.7771: UDP, length 120
01:53:53.124316 IP 192.168.43.146.8880 > 192.168.43.147.7772: UDP, length 120
01:53:53.151034 IP 192.168.43.124.8880 > 192.168.43.146.7771: UDP, length 120
01:53:53.174301 IP 192.168.43.146.8880 > 192.168.43.147.7772: UDP, length 120
01:53:53.201461 IP 192.168.43.124.8880 > 192.168.43.146.7771: UDP, length 120
01:53:53.224374 IP 192.168.43.146.8880 > 192.168.43.147.7772: UDP, length 120
01:53:53.253417 IP 192.168.43.124.8880 > 192.168.43.146.7771: UDP, length 120
01:53:53.274327 IP 192.168.43.146.8880 > 192.168.43.147.7772: UDP, length 120
01:53:53.301320 IP 192.168.43.124.8880 > 192.168.43.146.7771: UDP, length 120
01:53:53.324312 IP 192.168.43.146.8880 > 192.168.43.147.7772: UDP, length 120
01:53:53.354436 IP 192.168.43.124.8880 > 192.168.43.146.7771: UDP, length 120
01:53:53.374298 IP 192.168.43.146.8880 > 192.168.43.147.7772: UDP, length 120
01:53:53.401849 IP 192.168.43.124.8880 > 192.168.43.146.7771: UDP, length 120
01:53:53.424295 IP 192.168.43.146.8880 > 192.168.43.147.7772: UDP, length 120
01:53:53.449575 IP 192.168.43.124.8880 > 192.168.43.146.7771: UDP, length 120
01:53:53.474308 IP 192.168.43.146.8880 > 192.168.43.147.7772: UDP, length 120
01:53:53.499773 IP 192.168.43.124.8880 > 192.168.43.146.7771: UDP, length 120
01:53:53.524306 IP 192.168.43.146.8880 > 192.168.43.147.7772: UDP, length 120
01:53:53.549565 IP 192.168.43.124.8880 > 192.168.43.146.7771: UDP, length 120
01:53:53.574309 IP 192.168.43.146.8880 > 192.168.43.147.7772: UDP, length 120
01:53:53.599083 IP 192.168.43.124.8880 > 192.168.43.146.7771: UDP, length 120
01:53:53.624366 IP 192.168.43.146.8880 > 192.168.43.147.7772: UDP, length 120
01:53:53.650318 IP 192.168.43.124.8880 > 192.168.43.146.7771: UDP, length 120
01:53:53.674311 IP 192.168.43.146.8880 > 192.168.43.147.7772: UDP, length 120
01:53:53.712295 IP 192.168.43.124.8880 > 192.168.43.146.7771: UDP, length 120
01:53:53.724292 IP 192.168.43.146.8880 > 192.168.43.147.7772: UDP, length 120
01:53:53.752719 IP 192.168.43.124.8880 > 192.168.43.146.7771: UDP, length 120
01:53:53.774306 IP 192.168.43.146.8880 > 192.168.43.147.7772: UDP, length 120
01:53:53.799732 IP 192.168.43.124.8880 > 192.168.43.146.7771: UDP, length 120
01:53:53.824308 IP 192.168.43.146.8880 > 192.168.43.147.7772: UDP, length 120
01:53:53.851572 IP 192.168.43.124.8880 > 192.168.43.146.7771: UDP, length 120
01:53:53.874295 IP 192.168.43.146.8880 > 192.168.43.147.7772: UDP, length 120
01:53:53.900544 IP 192.168.43.124.8880 > 192.168.43.146.7771: UDP, length 120
01:53:53.924309 IP 192.168.43.146.8880 > 192.168.43.147.7772: UDP, length 120
01:53:53.953998 IP 192.168.43.124.8880 > 192.168.43.146.7771: UDP, length 120
01:53:53.974297 IP 192.168.43.146.8880 > 192.168.43.147.7772: UDP, length 120
01:53:53.999690 IP 192.168.43.124.8880 > 192.168.43.146.7771: UDP, length 120
01:53:54.024308 IP 192.168.43.146.8880 > 192.168.43.147.7772: UDP, length 120
01:53:54.049673 IP 192.168.43.124.8880 > 192.168.43.146.7771: UDP, length 120
01:53:54.074319 IP 192.168.43.146.8880 > 192.168.43.147.7772: UDP, length 120
01:53:54.099671 IP 192.168.43.124.8880 > 192.168.43.146.7771: UDP, length 120
01:53:54.124326 IP 192.168.43.146.8880 > 192.168.43.147.7772: UDP, length 120
01:53:54.149551 IP 192.168.43.124.8880 > 192.168.43.146.7771: UDP, length 120
01:53:54.174297 IP 192.168.43.146.8880 > 192.168.43.147.7772: UDP, length 120
01:53:54.199884 IP 192.168.43.124.8880 > 192.168.43.146.7771: UDP, length 120
01:53:54.224378 IP 192.168.43.146.8880 > 192.168.43.147.7772: UDP, length 120
01:53:54.249110 IP 192.168.43.124.8880 > 192.168.43.146.7771: UDP, length 120
01:53:54.274343 IP 192.168.43.146.8880 > 192.168.43.147.7772: UDP, length 120
01:53:54.299911 IP 192.168.43.124.8880 > 192.168.43.146.7771: UDP, length 120
01:53:54.324299 IP 192.168.43.146.8880 > 192.168.43.147.7772: UDP, length 120
01:53:54.350462 IP 192.168.43.124.8880 > 192.168.43.146.7771: UDP, length 120
01:53:54.374297 IP 192.168.43.146.8880 > 192.168.43.147.7772: UDP, length 120
01:53:54.399654 IP 192.168.43.124.8880 > 192.168.43.146.7771: UDP, length 120
01:53:54.424382 IP 192.168.43.146.8880 > 192.168.43.147.7772: UDP, length 120
01:53:54.451140 IP 192.168.43.124.8880 > 192.168.43.146.7771: UDP, length 120
01:53:54.474485 IP 192.168.43.146.8880 > 192.168.43.147.7772: UDP, length 120
01:53:54.500197 IP 192.168.43.124.8880 > 192.168.43.146.7771: UDP, length 120
01:53:54.524370 IP 192.168.43.146.8880 > 192.168.43.147.7772: UDP, length 120
01:53:54.549660 IP 192.168.43.124.8880 > 192.168.43.146.7771: UDP, length 120
01:53:54.574366 IP 192.168.43.146.8880 > 192.168.43.147.7772: UDP, length 120
01:53:54.600283 IP 192.168.43.124.8880 > 192.168.43.146.7771: UDP, length 120
01:53:54.624333 IP 192.168.43.146.8880 > 192.168.43.147.7772: UDP, length 120
01:53:54.649602 IP 192.168.43.124.8880 > 192.168.43.146.7771: UDP, length 120
01:53:54.674327 IP 192.168.43.146.8880 > 192.168.43.147.7772: UDP, length 120
01:53:54.700002 IP 192.168.43.124.8880 > 192.168.43.146.7771: UDP, length 120
01:53:54.724384 IP 192.168.43.146.8880 > 192.168.43.147.7772: UDP, length 120
01:53:54.751910 IP 192.168.43.124.8880 > 192.168.43.146.7771: UDP, length 120
01:53:54.774361 IP 192.168.43.146.8880 > 192.168.43.147.7772: UDP, length 120
01:53:54.800829 IP 192.168.43.124.8880 > 192.168.43.146.7771: UDP, length 120
01:53:54.824351 IP 192.168.43.146.8880 > 192.168.43.147.7772: UDP, length 120
01:53:54.850259 IP 192.168.43.124.8880 > 192.168.43.146.7771: UDP, length 120
01:53:54.874321 IP 192.168.43.146.8880 > 192.168.43.147.7772: UDP, length 120
01:53:54.901021 IP 192.168.43.124.8880 > 192.168.43.146.7771: UDP, length 120
01:53:54.924287 IP 192.168.43.146.8880 > 192.168.43.147.7772: UDP, length 120
01:53:54.955033 IP 192.168.43.124.8880 > 192.168.43.146.7771: UDP, length 120
01:53:54.974275 IP 192.168.43.146.8880 > 192.168.43.147.7772: UDP, length 120
01:53:55.003625 IP 192.168.43.124.8880 > 192.168.43.146.7771: UDP, length 120
01:53:55.024272 IP 192.168.43.146.8880 > 192.168.43.147.7772: UDP, length 120
01:53:55.049518 IP 192.168.43.124.8880 > 192.168.43.146.7771: UDP, length 120
01:53:55.074278 IP 192.168.43.146.8880 > 192.168.43.147.7772: UDP, length 120
01:53:55.102835 IP 192.168.43.124.8880 > 192.168.43.146.7771: UDP, length 120
01:53:55.124310 IP 192.168.43.146.8880 > 192.168.43.147.7772: UDP, length 120
01:53:55.149481 IP 192.168.43.124.8880 > 192.168.43.146.7771: UDP, length 120
01:53:55.174288 IP 192.168.43.146.8880 > 192.168.43.147.7772: UDP, length 120
01:53:55.200724 IP 192.168.43.124.8880 > 192.168.43.146.7771: UDP, length 120
01:53:55.224271 IP 192.168.43.146.8880 > 192.168.43.147.7772: UDP, length 120
01:53:55.249514 IP 192.168.43.124.8880 > 192.168.43.146.7771: UDP, length 120
01:53:55.274317 IP 192.168.43.146.8880 > 192.168.43.147.7772: UDP, length 120
01:53:55.301159 IP 192.168.43.124.8880 > 192.168.43.146.7771: UDP, length 120
01:53:55.324273 IP 192.168.43.146.8880 > 192.168.43.147.7772: UDP, length 120
01:53:55.351349 IP 192.168.43.124.8880 > 192.168.43.146.7771: UDP, length 120
01:53:55.374272 IP 192.168.43.146.8880 > 192.168.43.147.7772: UDP, length 120
01:53:55.405601 IP 192.168.43.124.8880 > 192.168.43.146.7771: UDP, length 120
01:53:55.424269 IP 192.168.43.146.8880 > 192.168.43.147.7772: UDP, length 120
01:53:55.449506 IP 192.168.43.124.8880 > 192.168.43.146.7771: UDP, length 120
01:53:55.474270 IP 192.168.43.146.8880 > 192.168.43.147.7772: UDP, length 120
01:53:55.499461 IP 192.168.43.124.8880 > 192.168.43.146.7771: UDP, length 120
01:53:55.524271 IP 192.168.43.146.8880 > 192.168.43.147.7772: UDP, length 120
01:53:55.549631 IP 192.168.43.124.8880 > 192.168.43.146.7771: UDP, length 120
01:53:55.574270 IP 192.168.43.146.8880 > 192.168.43.147.7772: UDP, length 120
01:53:55.599526 IP 192.168.43.124.8880 > 192.168.43.146.7771: UDP, length 120
01:53:55.624277 IP 192.168.43.146.8880 > 192.168.43.147.7772: UDP, length 120
01:53:55.649481 IP 192.168.43.124.8880 > 192.168.43.146.7771: UDP, length 120
01:53:55.674274 IP 192.168.43.146.8880 > 192.168.43.147.7772: UDP, length 120
01:53:55.699544 IP 192.168.43.124.8880 > 192.168.43.146.7771: UDP, length 120
01:53:55.724271 IP 192.168.43.146.8880 > 192.168.43.147.7772: UDP, length 120
01:53:55.749172 IP 192.168.43.124.8880 > 192.168.43.146.7771: UDP, length 120
01:53:55.774270 IP 192.168.43.146.8880 > 192.168.43.147.7772: UDP, length 120
01:53:55.800358 IP 192.168.43.124.8880 > 192.168.43.146.7771: UDP, length 120
01:53:55.824270 IP 192.168.43.146.8880 > 192.168.43.147.7772: UDP, length 120
01:53:55.851284 IP 192.168.43.124.8880 > 192.168.43.146.7771: UDP, length 120
01:53:55.874271 IP 192.168.43.146.8880 > 192.168.43.147.7772: UDP, length 120
01:53:55.901820 IP 192.168.43.124.8880 > 192.168.43.146.7771: UDP, length 120
01:53:55.924271 IP 192.168.43.146.8880 > 192.168.43.147.7772: UDP, length 120
01:53:55.949548 IP 192.168.43.124.8880 > 192.168.43.146.7771: UDP, length 120
01:53:55.974269 IP 192.168.43.146.8880 > 192.168.43.147.7772: UDP, length 120
01:53:55.999530 IP 192.168.43.124.8880 > 192.168.43.146.7771: UDP, length 120
01:53:56.024271 IP 192.168.43.146.8880 > 192.168.43.147.7772: UDP, length 120
01:53:56.048188 IP 192.168.43.124.8880 > 192.168.43.146.7771: UDP, length 120
01:53:56.074272 IP 192.168.43.146.8880 > 192.168.43.147.7772: UDP, length 120
01:53:56.099685 IP 192.168.43.124.8880 > 192.168.43.146.7771: UDP, length 120
01:53:56.124271 IP 192.168.43.146.8880 > 192.168.43.147.7772: UDP, length 120
01:53:56.149544 IP 192.168.43.124.8880 > 192.168.43.146.7771: UDP, length 120
01:53:56.174273 IP 192.168.43.146.8880 > 192.168.43.147.7772: UDP, length 120
01:53:56.199911 IP 192.168.43.124.8880 > 192.168.43.146.7771: UDP, length 120
01:53:56.224274 IP 192.168.43.146.8880 > 192.168.43.147.7772: UDP, length 120
01:53:56.247997 IP 192.168.43.124.8880 > 192.168.43.146.7771: UDP, length 120
01:53:56.274308 IP 192.168.43.146.8880 > 192.168.43.147.7772: UDP, length 120
01:53:56.299534 IP 192.168.43.124.8880 > 192.168.43.146.7771: UDP, length 120
01:53:56.324277 IP 192.168.43.146.8880 > 192.168.43.147.7772: UDP, length 120
01:53:56.349449 IP 192.168.43.124.8880 > 192.168.43.146.7771: UDP, length 120
01:53:56.374271 IP 192.168.43.146.8880 > 192.168.43.147.7772: UDP, length 120
01:53:56.399430 IP 192.168.43.124.8880 > 192.168.43.146.7771: UDP, length 120
01:53:56.424273 IP 192.168.43.146.8880 > 192.168.43.147.7772: UDP, length 120
01:53:56.449567 IP 192.168.43.124.8880 > 192.168.43.146.7771: UDP, length 120
01:53:56.474274 IP 192.168.43.146.8880 > 192.168.43.147.7772: UDP, length 120
01:53:56.501092 IP 192.168.43.124.8880 > 192.168.43.146.7771: UDP, length 120
01:53:56.524278 IP 192.168.43.146.8880 > 192.168.43.147.7772: UDP, length 120
01:53:56.549561 IP 192.168.43.124.8880 > 192.168.43.146.7771: UDP, length 120
01:53:56.574276 IP 192.168.43.146.8880 > 192.168.43.147.7772: UDP, length 120
01:53:56.599244 IP 192.168.43.124.8880 > 192.168.43.146.7771: UDP, length 120
01:53:56.624319 IP 192.168.43.146.8880 > 192.168.43.147.7772: UDP, length 120
01:53:56.649580 IP 192.168.43.124.8880 > 192.168.43.146.7771: UDP, length 120
01:53:56.674284 IP 192.168.43.146.8880 > 192.168.43.147.7772: UDP, length 120
01:53:56.699477 IP 192.168.43.124.8880 > 192.168.43.146.7771: UDP, length 120
01:53:56.724271 IP 192.168.43.146.8880 > 192.168.43.147.7772: UDP, length 120
01:53:56.749587 IP 192.168.43.124.8880 > 192.168.43.146.7771: UDP, length 120
01:53:56.774271 IP 192.168.43.146.8880 > 192.168.43.147.7772: UDP, length 120
01:53:56.801065 IP 192.168.43.124.8880 > 192.168.43.146.7771: UDP, length 120
01:53:56.824269 IP 192.168.43.146.8880 > 192.168.43.147.7772: UDP, length 120
01:53:56.849603 IP 192.168.43.124.8880 > 192.168.43.146.7771: UDP, length 120
01:53:56.874272 IP 192.168.43.146.8880 > 192.168.43.147.7772: UDP, length 120
01:53:56.902860 IP 192.168.43.124.8880 > 192.168.43.146.7771: UDP, length 120
01:53:56.924272 IP 192.168.43.146.8880 > 192.168.43.147.7772: UDP, length 120
01:53:56.950876 IP 192.168.43.124.8880 > 192.168.43.146.7771: UDP, length 120
01:53:56.974271 IP 192.168.43.146.8880 > 192.168.43.147.7772: UDP, length 120
01:53:57.000658 IP 192.168.43.124.8880 > 192.168.43.146.7771: UDP, length 120
01:53:57.024277 IP 192.168.43.146.8880 > 192.168.43.147.7772: UDP, length 120
01:53:57.051403 IP 192.168.43.124.8880 > 192.168.43.146.7771: UDP, length 120
01:53:57.074277 IP 192.168.43.146.8880 > 192.168.43.147.7772: UDP, length 120
01:53:57.105425 IP 192.168.43.124.8880 > 192.168.43.146.7771: UDP, length 120
01:53:57.124274 IP 192.168.43.146.8880 > 192.168.43.147.7772: UDP, length 120
01:53:57.153878 IP 192.168.43.124.8880 > 192.168.43.146.7771: UDP, length 120
01:53:57.174275 IP 192.168.43.146.8880 > 192.168.43.147.7772: UDP, length 120
01:53:57.199342 IP 192.168.43.124.8880 > 192.168.43.146.7771: UDP, length 120
01:53:57.224278 IP 192.168.43.146.8880 > 192.168.43.147.7772: UDP, length 120
01:53:57.249667 IP 192.168.43.124.8880 > 192.168.43.146.7771: UDP, length 120
01:53:57.274314 IP 192.168.43.146.8880 > 192.168.43.147.7772: UDP, length 120
01:53:57.299633 IP 192.168.43.124.8880 > 192.168.43.146.7771: UDP, length 120
01:53:57.324274 IP 192.168.43.146.8880 > 192.168.43.147.7772: UDP, length 120
01:53:57.351170 IP 192.168.43.124.8880 > 192.168.43.146.7771: UDP, length 120
01:53:57.374274 IP 192.168.43.146.8880 > 192.168.43.147.7772: UDP, length 120
01:53:57.397791 IP 192.168.43.124.8880 > 192.168.43.146.7771: UDP, length 120
01:53:57.424274 IP 192.168.43.146.8880 > 192.168.43.147.7772: UDP, length 120
01:53:57.450439 IP 192.168.43.124.8880 > 192.168.43.146.7771: UDP, length 120
01:53:57.474273 IP 192.168.43.146.8880 > 192.168.43.147.7772: UDP, length 120
01:53:57.498897 IP 192.168.43.124.8880 > 192.168.43.146.7771: UDP, length 120
01:53:57.524274 IP 192.168.43.146.8880 > 192.168.43.147.7772: UDP, length 120
01:53:57.556488 IP 192.168.43.124.8880 > 192.168.43.146.7771: UDP, length 120
01:53:57.574272 IP 192.168.43.146.8880 > 192.168.43.147.7772: UDP, length 120
01:53:57.599181 IP 192.168.43.124.8880 > 192.168.43.146.7771: UDP, length 120
01:53:57.624310 IP 192.168.43.146.8880 > 192.168.43.147.7772: UDP, length 120
01:53:57.650037 IP 192.168.43.124.8880 > 192.168.43.146.7771: UDP, length 120
01:53:57.674303 IP 192.168.43.146.8880 > 192.168.43.147.7772: UDP, length 120
01:53:57.699843 IP 192.168.43.124.8880 > 192.168.43.146.7771: UDP, length 120
01:53:57.724318 IP 192.168.43.146.8880 > 192.168.43.147.7772: UDP, length 120
01:53:57.749779 IP 192.168.43.124.8880 > 192.168.43.146.7771: UDP, length 120
01:53:57.774307 IP 192.168.43.146.8880 > 192.168.43.147.7772: UDP, length 120
01:53:57.799901 IP 192.168.43.124.8880 > 192.168.43.146.7771: UDP, length 120
01:53:57.824296 IP 192.168.43.146.8880 > 192.168.43.147.7772: UDP, length 120
01:53:57.849913 IP 192.168.43.124.8880 > 192.168.43.146.7771: UDP, length 120
01:53:57.874296 IP 192.168.43.146.8880 > 192.168.43.147.7772: UDP, length 120
01:53:57.898440 IP 192.168.43.124.8880 > 192.168.43.146.7771: UDP, length 120
01:53:57.924297 IP 192.168.43.146.8880 > 192.168.43.147.7772: UDP, length 120
01:53:57.950081 IP 192.168.43.124.8880 > 192.168.43.146.7771: UDP, length 120
01:53:57.974296 IP 192.168.43.146.8880 > 192.168.43.147.7772: UDP, length 120
01:53:57.999870 IP 192.168.43.124.8880 > 192.168.43.146.7771: UDP, length 120
01:53:58.024305 IP 192.168.43.146.8880 > 192.168.43.147.7772: UDP, length 120
01:53:58.050321 IP 192.168.43.124.8880 > 192.168.43.146.7771: UDP, length 120
01:53:58.074297 IP 192.168.43.146.8880 > 192.168.43.147.7772: UDP, length 120
01:53:58.099885 IP 192.168.43.124.8880 > 192.168.43.146.7771: UDP, length 120
01:53:58.124347 IP 192.168.43.146.8880 > 192.168.43.147.7772: UDP, length 120
01:53:58.150087 IP 192.168.43.124.8880 > 192.168.43.146.7771: UDP, length 120
01:53:58.174314 IP 192.168.43.146.8880 > 192.168.43.147.7772: UDP, length 120
01:53:58.199825 IP 192.168.43.124.8880 > 192.168.43.146.7771: UDP, length 120
01:53:58.224297 IP 192.168.43.146.8880 > 192.168.43.147.7772: UDP, length 120
01:53:58.249826 IP 192.168.43.124.8880 > 192.168.43.146.7771: UDP, length 120
01:53:58.274304 IP 192.168.43.146.8880 > 192.168.43.147.7772: UDP, length 120
01:53:58.300117 IP 192.168.43.124.8880 > 192.168.43.146.7771: UDP, length 120
01:53:58.324304 IP 192.168.43.146.8880 > 192.168.43.147.7772: UDP, length 120
01:53:58.350292 IP 192.168.43.124.8880 > 192.168.43.146.7771: UDP, length 120
01:53:58.374300 IP 192.168.43.146.8880 > 192.168.43.147.7772: UDP, length 120
01:53:58.399931 IP 192.168.43.124.8880 > 192.168.43.146.7771: UDP, length 120
01:53:58.424301 IP 192.168.43.146.8880 > 192.168.43.147.7772: UDP, length 120
01:53:58.449820 IP 192.168.43.124.8880 > 192.168.43.146.7771: UDP, length 120
01:53:58.474297 IP 192.168.43.146.8880 > 192.168.43.147.7772: UDP, length 120
01:53:58.499872 IP 192.168.43.124.8880 > 192.168.43.146.7771: UDP, length 120
01:53:58.524296 IP 192.168.43.146.8880 > 192.168.43.147.7772: UDP, length 120
01:53:58.550320 IP 192.168.43.124.8880 > 192.168.43.146.7771: UDP, length 120
01:53:58.574302 IP 192.168.43.146.8880 > 192.168.43.147.7772: UDP, length 120
01:53:58.599878 IP 192.168.43.124.8880 > 192.168.43.146.7771: UDP, length 120
01:53:58.624326 IP 192.168.43.146.8880 > 192.168.43.147.7772: UDP, length 120
01:53:58.649886 IP 192.168.43.124.8880 > 192.168.43.146.7771: UDP, length 120
01:53:58.674307 IP 192.168.43.146.8880 > 192.168.43.147.7772: UDP, length 120
01:53:58.699849 IP 192.168.43.124.8880 > 192.168.43.146.7771: UDP, length 120
01:53:58.724297 IP 192.168.43.146.8880 > 192.168.43.147.7772: UDP, length 120
01:53:58.749641 IP 192.168.43.124.8880 > 192.168.43.146.7771: UDP, length 120
01:53:58.774297 IP 192.168.43.146.8880 > 192.168.43.147.7772: UDP, length 120
01:53:58.799841 IP 192.168.43.124.8880 > 192.168.43.146.7771: UDP, length 120
01:53:58.824297 IP 192.168.43.146.8880 > 192.168.43.147.7772: UDP, length 120
01:53:58.849819 IP 192.168.43.124.8880 > 192.168.43.146.7771: UDP, length 120
01:53:58.874299 IP 192.168.43.146.8880 > 192.168.43.147.7772: UDP, length 120
01:53:58.899827 IP 192.168.43.124.8880 > 192.168.43.146.7771: UDP, length 120
01:53:58.924298 IP 192.168.43.146.8880 > 192.168.43.147.7772: UDP, length 120
01:53:58.949885 IP 192.168.43.124.8880 > 192.168.43.146.7771: UDP, length 120
01:53:58.974297 IP 192.168.43.146.8880 > 192.168.43.147.7772: UDP, length 120
01:53:58.999926 IP 192.168.43.124.8880 > 192.168.43.146.7771: UDP, length 120
01:53:59.024297 IP 192.168.43.146.8880 > 192.168.43.147.7772: UDP, length 120
01:53:59.051069 IP 192.168.43.124.8880 > 192.168.43.146.7771: UDP, length 120
01:53:59.074298 IP 192.168.43.146.8880 > 192.168.43.147.7772: UDP, length 120
01:53:59.101576 IP 192.168.43.124.8880 > 192.168.43.146.7771: UDP, length 120
01:53:59.124297 IP 192.168.43.146.8880 > 192.168.43.147.7772: UDP, length 120
01:53:59.151220 IP 192.168.43.124.8880 > 192.168.43.146.7771: UDP, length 120
01:53:59.174301 IP 192.168.43.146.8880 > 192.168.43.147.7772: UDP, length 120
01:53:59.199823 IP 192.168.43.124.8880 > 192.168.43.146.7771: UDP, length 120
01:53:59.224298 IP 192.168.43.146.8880 > 192.168.43.147.7772: UDP, length 120
01:53:59.250418 IP 192.168.43.124.8880 > 192.168.43.146.7771: UDP, length 120
01:53:59.276031 IP 192.168.43.146.8880 > 192.168.43.147.7772: UDP, length 120
01:53:59.299852 IP 192.168.43.124.8880 > 192.168.43.146.7771: UDP, length 120
01:53:59.324398 IP 192.168.43.146.8880 > 192.168.43.147.7772: UDP, length 120
01:53:59.349922 IP 192.168.43.124.8880 > 192.168.43.146.7771: UDP, length 120
01:53:59.374382 IP 192.168.43.146.8880 > 192.168.43.147.7772: UDP, length 120
01:53:59.400093 IP 192.168.43.124.8880 > 192.168.43.146.7771: UDP, length 120
01:53:59.424365 IP 192.168.43.146.8880 > 192.168.43.147.7772: UDP, length 120
01:53:59.449817 IP 192.168.43.124.8880 > 192.168.43.146.7771: UDP, length 120
01:53:59.474348 IP 192.168.43.146.8880 > 192.168.43.147.7772: UDP, length 120
01:53:59.501634 IP 192.168.43.124.8880 > 192.168.43.146.7771: UDP, length 120
01:53:59.524324 IP 192.168.43.146.8880 > 192.168.43.147.7772: UDP, length 120
01:53:59.550194 IP 192.168.43.124.8880 > 192.168.43.146.7771: UDP, length 120
01:53:59.574297 IP 192.168.43.146.8880 > 192.168.43.147.7772: UDP, length 120
01:53:59.601058 IP 192.168.43.124.8880 > 192.168.43.146.7771: UDP, length 120
01:53:59.624360 IP 192.168.43.146.8880 > 192.168.43.147.7772: UDP, length 120
01:53:59.653116 IP 192.168.43.124.8880 > 192.168.43.146.7771: UDP, length 120
01:53:59.674314 IP 192.168.43.146.8880 > 192.168.43.147.7772: UDP, length 120
01:53:59.708560 IP 192.168.43.124.8880 > 192.168.43.146.7771: UDP, length 120
01:53:59.724306 IP 192.168.43.146.8880 > 192.168.43.147.7772: UDP, length 120
01:53:59.749784 IP 192.168.43.124.8880 > 192.168.43.146.7771: UDP, length 120
01:53:59.774304 IP 192.168.43.146.8880 > 192.168.43.147.7772: UDP, length 120
01:53:59.799751 IP 192.168.43.124.8880 > 192.168.43.146.7771: UDP, length 120
01:53:59.824294 IP 192.168.43.146.8880 > 192.168.43.147.7772: UDP, length 120
01:53:59.849130 IP 192.168.43.124.8880 > 192.168.43.146.7771: UDP, length 120
01:53:59.874360 IP 192.168.43.146.8880 > 192.168.43.147.7772: UDP, length 120
01:53:59.900042 IP 192.168.43.124.8880 > 192.168.43.146.7771: UDP, length 120
01:53:59.924364 IP 192.168.43.146.8880 > 192.168.43.147.7772: UDP, length 120
01:53:59.949831 IP 192.168.43.124.8880 > 192.168.43.146.7771: UDP, length 120
01:53:59.974325 IP 192.168.43.146.8880 > 192.168.43.147.7772: UDP, length 120
01:53:59.999782 IP 192.168.43.124.8880 > 192.168.43.146.7771: UDP, length 120
01:54:00.024335 IP 192.168.43.146.8880 > 192.168.43.147.7772: UDP, length 120
01:54:00.049892 IP 192.168.43.124.8880 > 192.168.43.146.7771: UDP, length 120
01:54:00.074377 IP 192.168.43.146.8880 > 192.168.43.147.7772: UDP, length 120
01:54:00.111826 IP 192.168.43.124.8880 > 192.168.43.146.7771: UDP, length 120
01:54:00.124346 IP 192.168.43.146.8880 > 192.168.43.147.7772: UDP, length 120
01:54:00.149892 IP 192.168.43.124.8880 > 192.168.43.146.7771: UDP, length 120
01:54:00.174328 IP 192.168.43.146.8880 > 192.168.43.147.7772: UDP, length 120
01:54:00.200451 IP 192.168.43.124.8880 > 192.168.43.146.7771: UDP, length 120
01:54:00.224338 IP 192.168.43.146.8880 > 192.168.43.147.7772: UDP, length 120
01:54:00.249864 IP 192.168.43.124.8880 > 192.168.43.146.7771: UDP, length 120
01:54:00.274351 IP 192.168.43.146.8880 > 192.168.43.147.7772: UDP, length 120
01:54:00.299743 IP 192.168.43.124.8880 > 192.168.43.146.7771: UDP, length 120
01:54:00.324310 IP 192.168.43.146.8880 > 192.168.43.147.7772: UDP, length 120
01:54:00.349833 IP 192.168.43.124.8880 > 192.168.43.146.7771: UDP, length 120
01:54:00.374280 IP 192.168.43.146.8880 > 192.168.43.147.7772: UDP, length 120
01:54:00.399734 IP 192.168.43.124.8880 > 192.168.43.146.7771: UDP, length 120
01:54:00.424339 IP 192.168.43.146.8880 > 192.168.43.147.7772: UDP, length 120
01:54:00.449887 IP 192.168.43.124.8880 > 192.168.43.146.7771: UDP, length 120
01:54:00.474318 IP 192.168.43.146.8880 > 192.168.43.147.7772: UDP, length 120
01:54:00.499738 IP 192.168.43.124.8880 > 192.168.43.146.7771: UDP, length 120
01:54:00.524279 IP 192.168.43.146.8880 > 192.168.43.147.7772: UDP, length 120
01:54:00.550407 IP 192.168.43.124.8880 > 192.168.43.146.7771: UDP, length 120
01:54:00.574272 IP 192.168.43.146.8880 > 192.168.43.147.7772: UDP, length 120
01:54:00.599469 IP 192.168.43.124.8880 > 192.168.43.146.7771: UDP, length 120
01:54:00.624279 IP 192.168.43.146.8880 > 192.168.43.147.7772: UDP, length 120
01:54:00.649740 IP 192.168.43.124.8880 > 192.168.43.146.7771: UDP, length 120
01:54:00.674274 IP 192.168.43.146.8880 > 192.168.43.147.7772: UDP, length 120
01:54:00.699685 IP 192.168.43.124.8880 > 192.168.43.146.7771: UDP, length 120
01:54:00.724269 IP 192.168.43.146.8880 > 192.168.43.147.7772: UDP, length 120
01:54:00.749452 IP 192.168.43.124.8880 > 192.168.43.146.7771: UDP, length 120
01:54:00.774270 IP 192.168.43.146.8880 > 192.168.43.147.7772: UDP, length 120
01:54:00.799893 IP 192.168.43.124.8880 > 192.168.43.146.7771: UDP, length 120
01:54:00.824268 IP 192.168.43.146.8880 > 192.168.43.147.7772: UDP, length 120
01:54:00.849724 IP 192.168.43.124.8880 > 192.168.43.146.7771: UDP, length 120
01:54:00.874270 IP 192.168.43.146.8880 > 192.168.43.147.7772: UDP, length 120
01:54:00.899728 IP 192.168.43.124.8880 > 192.168.43.146.7771: UDP, length 120
01:54:00.924270 IP 192.168.43.146.8880 > 192.168.43.147.7772: UDP, length 120
01:54:00.949720 IP 192.168.43.124.8880 > 192.168.43.146.7771: UDP, length 120
01:54:00.974271 IP 192.168.43.146.8880 > 192.168.43.147.7772: UDP, length 120
01:54:00.999742 IP 192.168.43.124.8880 > 192.168.43.146.7771: UDP, length 120
01:54:01.024308 IP 192.168.43.146.8880 > 192.168.43.147.7772: UDP, length 120
01:54:01.051072 IP 192.168.43.124.8880 > 192.168.43.146.7771: UDP, length 120
01:54:01.074282 IP 192.168.43.146.8880 > 192.168.43.147.7772: UDP, length 120
01:54:01.100101 IP 192.168.43.124.8880 > 192.168.43.146.7771: UDP, length 120
01:54:01.124307 IP 192.168.43.146.8880 > 192.168.43.147.7772: UDP, length 120
01:54:01.149870 IP 192.168.43.124.8880 > 192.168.43.146.7771: UDP, length 120
01:54:01.174287 IP 192.168.43.146.8880 > 192.168.43.147.7772: UDP, length 120
01:54:01.201390 IP 192.168.43.124.8880 > 192.168.43.146.7771: UDP, length 120
01:54:01.224272 IP 192.168.43.146.8880 > 192.168.43.147.7772: UDP, length 120
01:54:01.251129 IP 192.168.43.124.8880 > 192.168.43.146.7771: UDP, length 120
01:54:01.274269 IP 192.168.43.146.8880 > 192.168.43.147.7772: UDP, length 120
01:54:01.301572 IP 192.168.43.124.8880 > 192.168.43.146.7771: UDP, length 120
01:54:01.324270 IP 192.168.43.146.8880 > 192.168.43.147.7772: UDP, length 120
01:54:01.350174 IP 192.168.43.124.8880 > 192.168.43.146.7771: UDP, length 120
01:54:01.374272 IP 192.168.43.146.8880 > 192.168.43.147.7772: UDP, length 120
01:54:01.399817 IP 192.168.43.124.8880 > 192.168.43.146.7771: UDP, length 120
01:54:01.424268 IP 192.168.43.146.8880 > 192.168.43.147.7772: UDP, length 120
01:54:01.448145 IP 192.168.43.124.8880 > 192.168.43.146.7771: UDP, length 120
01:54:01.474324 IP 192.168.43.146.8880 > 192.168.43.147.7772: UDP, length 120
01:54:01.499821 IP 192.168.43.124.8880 > 192.168.43.146.7771: UDP, length 120
01:54:01.524287 IP 192.168.43.146.8880 > 192.168.43.147.7772: UDP, length 120
01:54:01.549835 IP 192.168.43.124.8880 > 192.168.43.146.7771: UDP, length 120
01:54:01.574274 IP 192.168.43.146.8880 > 192.168.43.147.7772: UDP, length 120
01:54:01.599578 IP 192.168.43.124.8880 > 192.168.43.146.7771: UDP, length 120
01:54:01.624279 IP 192.168.43.146.8880 > 192.168.43.147.7772: UDP, length 120
01:54:01.652672 IP 192.168.43.124.8880 > 192.168.43.146.7771: UDP, length 120
01:54:01.674274 IP 192.168.43.146.8880 > 192.168.43.147.7772: UDP, length 120
01:54:01.708973 IP 192.168.43.124.8880 > 192.168.43.146.7771: UDP, length 120
01:54:01.724270 IP 192.168.43.146.8880 > 192.168.43.147.7772: UDP, length 120
01:54:01.754901 IP 192.168.43.124.8880 > 192.168.43.146.7771: UDP, length 120
01:54:01.774270 IP 192.168.43.146.8880 > 192.168.43.147.7772: UDP, length 120
01:54:01.800619 IP 192.168.43.124.8880 > 192.168.43.146.7771: UDP, length 120
01:54:01.824268 IP 192.168.43.146.8880 > 192.168.43.147.7772: UDP, length 120
01:54:01.853967 IP 192.168.43.124.8880 > 192.168.43.146.7771: UDP, length 120
01:54:01.874271 IP 192.168.43.146.8880 > 192.168.43.147.7772: UDP, length 120
01:54:01.899802 IP 192.168.43.124.8880 > 192.168.43.146.7771: UDP, length 120
01:54:01.924268 IP 192.168.43.146.8880 > 192.168.43.147.7772: UDP, length 120
01:54:01.949912 IP 192.168.43.124.8880 > 192.168.43.146.7771: UDP, length 120
01:54:01.974271 IP 192.168.43.146.8880 > 192.168.43.147.7772: UDP, length 120
01:54:01.999767 IP 192.168.43.124.8880 > 192.168.43.146.7771: UDP, length 120
01:54:02.024271 IP 192.168.43.146.8880 > 192.168.43.147.7772: UDP, length 120
01:54:02.049745 IP 192.168.43.124.8880 > 192.168.43.146.7771: UDP, length 120
01:54:02.074272 IP 192.168.43.146.8880 > 192.168.43.147.7772: UDP, length 120
01:54:02.099769 IP 192.168.43.124.8880 > 192.168.43.146.7771: UDP, length 120
01:54:02.124270 IP 192.168.43.146.8880 > 192.168.43.147.7772: UDP, length 120
01:54:02.149745 IP 192.168.43.124.8880 > 192.168.43.146.7771: UDP, length 120
01:54:02.174269 IP 192.168.43.146.8880 > 192.168.43.147.7772: UDP, length 120
01:54:02.199509 IP 192.168.43.124.8880 > 192.168.43.146.7771: UDP, length 120
01:54:02.224268 IP 192.168.43.146.8880 > 192.168.43.147.7772: UDP, length 120
01:54:02.251045 IP 192.168.43.124.8880 > 192.168.43.146.7771: UDP, length 120
01:54:02.274270 IP 192.168.43.146.8880 > 192.168.43.147.7772: UDP, length 120
01:54:02.298850 IP 192.168.43.124.8880 > 192.168.43.146.7771: UDP, length 120
01:54:02.324268 IP 192.168.43.146.8880 > 192.168.43.147.7772: UDP, length 120
01:54:02.350854 IP 192.168.43.124.8880 > 192.168.43.146.7771: UDP, length 120
01:54:02.374271 IP 192.168.43.146.8880 > 192.168.43.147.7772: UDP, length 120
01:54:02.401082 IP 192.168.43.124.8880 > 192.168.43.146.7771: UDP, length 120
01:54:02.424269 IP 192.168.43.146.8880 > 192.168.43.147.7772: UDP, length 120
01:54:02.449794 IP 192.168.43.124.8880 > 192.168.43.146.7771: UDP, length 120
01:54:02.474319 IP 192.168.43.146.8880 > 192.168.43.147.7772: UDP, length 120
01:54:02.499795 IP 192.168.43.124.8880 > 192.168.43.146.7771: UDP, length 120
01:54:02.524293 IP 192.168.43.146.8880 > 192.168.43.147.7772: UDP, length 120
01:54:02.549753 IP 192.168.43.124.8880 > 192.168.43.146.7771: UDP, length 120
01:54:02.574281 IP 192.168.43.146.8880 > 192.168.43.147.7772: UDP, length 120
01:54:02.599516 IP 192.168.43.124.8880 > 192.168.43.146.7771: UDP, length 120
01:54:02.624351 IP 192.168.43.146.8880 > 192.168.43.147.7772: UDP, length 120
01:54:02.648098 IP 192.168.43.124.8880 > 192.168.43.146.7771: UDP, length 120
01:54:02.674313 IP 192.168.43.146.8880 > 192.168.43.147.7772: UDP, length 120
01:54:02.699634 IP 192.168.43.124.8880 > 192.168.43.146.7771: UDP, length 120
01:54:02.724296 IP 192.168.43.146.8880 > 192.168.43.147.7772: UDP, length 120
01:54:02.749990 IP 192.168.43.124.8880 > 192.168.43.146.7771: UDP, length 120
01:54:02.774306 IP 192.168.43.146.8880 > 192.168.43.147.7772: UDP, length 120
01:54:02.798040 IP 192.168.43.124.8880 > 192.168.43.146.7771: UDP, length 120
01:54:02.824295 IP 192.168.43.146.8880 > 192.168.43.147.7772: UDP, length 120
01:54:02.850251 IP 192.168.43.124.8880 > 192.168.43.146.7771: UDP, length 120
01:54:02.874297 IP 192.168.43.146.8880 > 192.168.43.147.7772: UDP, length 120
01:54:02.900198 IP 192.168.43.124.8880 > 192.168.43.146.7771: UDP, length 120
01:54:02.924296 IP 192.168.43.146.8880 > 192.168.43.147.7772: UDP, length 120
01:54:02.950476 IP 192.168.43.124.8880 > 192.168.43.146.7771: UDP, length 120
01:54:02.974297 IP 192.168.43.146.8880 > 192.168.43.147.7772: UDP, length 120
01:54:02.999959 IP 192.168.43.124.8880 > 192.168.43.146.7771: UDP, length 120
01:54:03.024251 IP 192.168.43.146.8880 > 192.168.43.147.7772: UDP, length 120
01:54:03.049904 IP 192.168.43.124.8880 > 192.168.43.146.7771: UDP, length 120
01:54:03.074301 IP 192.168.43.146.8880 > 192.168.43.147.7772: UDP, length 120
01:54:03.099906 IP 192.168.43.124.8880 > 192.168.43.146.7771: UDP, length 120
01:54:03.124298 IP 192.168.43.146.8880 > 192.168.43.147.7772: UDP, length 120
01:54:03.149779 IP 192.168.43.124.8880 > 192.168.43.146.7771: UDP, length 120
01:54:03.174300 IP 192.168.43.146.8880 > 192.168.43.147.7772: UDP, length 120
01:54:03.199948 IP 192.168.43.124.8880 > 192.168.43.146.7771: UDP, length 120
01:54:03.224299 IP 192.168.43.146.8880 > 192.168.43.147.7772: UDP, length 120
01:54:03.249970 IP 192.168.43.124.8880 > 192.168.43.146.7771: UDP, length 120
01:54:03.274298 IP 192.168.43.146.8880 > 192.168.43.147.7772: UDP, length 120
01:54:03.300079 IP 192.168.43.124.8880 > 192.168.43.146.7771: UDP, length 120
01:54:03.324296 IP 192.168.43.146.8880 > 192.168.43.147.7772: UDP, length 120
01:54:03.351981 IP 192.168.43.124.8880 > 192.168.43.146.7771: UDP, length 120
01:54:03.374299 IP 192.168.43.146.8880 > 192.168.43.147.7772: UDP, length 120
01:54:03.400263 IP 192.168.43.124.8880 > 192.168.43.146.7771: UDP, length 120
01:54:03.424299 IP 192.168.43.146.8880 > 192.168.43.147.7772: UDP, length 120
01:54:03.452154 IP 192.168.43.124.8880 > 192.168.43.146.7771: UDP, length 120
01:54:03.474387 IP 192.168.43.146.8880 > 192.168.43.147.7772: UDP, length 120
01:54:03.502689 IP 192.168.43.124.8880 > 192.168.43.146.7771: UDP, length 120
01:54:03.524332 IP 192.168.43.146.8880 > 192.168.43.147.7772: UDP, length 120
01:54:03.555115 IP 192.168.43.124.8880 > 192.168.43.146.7771: UDP, length 120
01:54:03.574312 IP 192.168.43.146.8880 > 192.168.43.147.7772: UDP, length 120
01:54:03.598539 IP 192.168.43.124.8880 > 192.168.43.146.7771: UDP, length 120
01:54:03.624345 IP 192.168.43.146.8880 > 192.168.43.147.7772: UDP, length 120
01:54:03.649961 IP 192.168.43.124.8880 > 192.168.43.146.7771: UDP, length 120
01:54:03.674307 IP 192.168.43.146.8880 > 192.168.43.147.7772: UDP, length 120
01:54:03.700774 IP 192.168.43.124.8880 > 192.168.43.146.7771: UDP, length 120
01:54:03.724295 IP 192.168.43.146.8880 > 192.168.43.147.7772: UDP, length 120
01:54:03.749613 IP 192.168.43.124.8880 > 192.168.43.146.7771: UDP, length 120
01:54:03.774301 IP 192.168.43.146.8880 > 192.168.43.147.7772: UDP, length 120
01:54:03.802705 IP 192.168.43.124.8880 > 192.168.43.146.7771: UDP, length 120
01:54:03.824294 IP 192.168.43.146.8880 > 192.168.43.147.7772: UDP, length 120
01:54:03.851002 IP 192.168.43.124.8880 > 192.168.43.146.7771: UDP, length 120
01:54:03.874299 IP 192.168.43.146.8880 > 192.168.43.147.7772: UDP, length 120
01:54:03.900471 IP 192.168.43.124.8880 > 192.168.43.146.7771: UDP, length 120
01:54:03.924297 IP 192.168.43.146.8880 > 192.168.43.147.7772: UDP, length 120
01:54:03.956109 IP 192.168.43.124.8880 > 192.168.43.146.7771: UDP, length 120
01:54:03.974299 IP 192.168.43.146.8880 > 192.168.43.147.7772: UDP, length 120
01:54:04.000644 IP 192.168.43.124.8880 > 192.168.43.146.7771: UDP, length 120
01:54:04.024295 IP 192.168.43.146.8880 > 192.168.43.147.7772: UDP, length 120
01:54:04.049975 IP 192.168.43.124.8880 > 192.168.43.146.7771: UDP, length 120
01:54:04.074298 IP 192.168.43.146.8880 > 192.168.43.147.7772: UDP, length 120
01:54:04.099948 IP 192.168.43.124.8880 > 192.168.43.146.7771: UDP, length 120
01:54:04.124346 IP 192.168.43.146.8880 > 192.168.43.147.7772: UDP, length 120
01:54:04.149965 IP 192.168.43.124.8880 > 192.168.43.146.7771: UDP, length 120
01:54:04.174337 IP 192.168.43.146.8880 > 192.168.43.147.7772: UDP, length 120
01:54:04.199958 IP 192.168.43.124.8880 > 192.168.43.146.7771: UDP, length 120
01:54:04.224299 IP 192.168.43.146.8880 > 192.168.43.147.7772: UDP, length 120
01:54:04.249972 IP 192.168.43.124.8880 > 192.168.43.146.7771: UDP, length 120
01:54:04.274296 IP 192.168.43.146.8880 > 192.168.43.147.7772: UDP, length 120
01:54:04.299958 IP 192.168.43.124.8880 > 192.168.43.146.7771: UDP, length 120
01:54:04.324297 IP 192.168.43.146.8880 > 192.168.43.147.7772: UDP, length 120
01:54:04.349956 IP 192.168.43.124.8880 > 192.168.43.146.7771: UDP, length 120
01:54:04.374300 IP 192.168.43.146.8880 > 192.168.43.147.7772: UDP, length 120
01:54:04.401248 IP 192.168.43.124.8880 > 192.168.43.146.7771: UDP, length 120
01:54:04.424294 IP 192.168.43.146.8880 > 192.168.43.147.7772: UDP, length 120
01:54:04.449652 IP 192.168.43.124.8880 > 192.168.43.146.7771: UDP, length 120
01:54:04.474296 IP 192.168.43.146.8880 > 192.168.43.147.7772: UDP, length 120
01:54:04.501455 IP 192.168.43.124.8880 > 192.168.43.146.7771: UDP, length 120
01:54:04.524349 IP 192.168.43.146.8880 > 192.168.43.147.7772: UDP, length 120
01:54:04.549896 IP 192.168.43.124.8880 > 192.168.43.146.7771: UDP, length 120
01:54:04.574304 IP 192.168.43.146.8880 > 192.168.43.147.7772: UDP, length 120
