00:00:01.280116 IP 192.168.43.147.8880 > 192.168.43.124.7773: UDP, length 120
00:00:01.330162 IP 192.168.43.147.8880 > 192.168.43.124.7773: UDP, length 120
00:00:01.380153 IP 192.168.43.147.8880 > 192.168.43.124.7773: UDP, length 120
00:00:01.430162 IP 192.168.43.147.8880 > 192.168.43.124.7773: UDP, length 120
00:00:01.480161 IP 192.168.43.147.8880 > 192.168.43.124.7773: UDP, length 120
00:00:01.530161 IP 192.168.43.147.8880 > 192.168.43.124.7773: UDP, length 120
00:00:01.560114 IP 192.168.43.146.8880 > 192.168.43.147.7772: UDP, length 120
00:00:01.580163 IP 192.168.43.147.8880 > 192.168.43.124.7773: UDP, length 120
00:00:01.623258 IP 192.168.43.146.8880 > 192.168.43.147.7772: UDP, length 120
00:00:01.630165 IP 192.168.43.147.8880 > 192.168.43.124.7773: UDP, length 120
00:00:01.662566 IP 192.168.43.146.8880 > 192.168.43.147.7772: UDP, length 120
00:00:01.680155 IP 192.168.43.147.8880 > 192.168.43.124.7773: UDP, length 120
00:00:01.709921 IP 192.168.43.146.8880 > 192.168.43.147.7772: UDP, length 120
00:00:01.730153 IP 192.168.43.147.8880 > 192.168.43.124.7773: UDP, length 120
00:00:01.773081 IP 192.168.43.146.8880 > 192.168.43.147.7772: UDP, length 120
00:00:01.780151 IP 192.168.43.147.8880 > 192.168.43.124.7773: UDP, length 120
00:00:01.809552 IP 192.168.43.146.8880 > 192.168.43.147.7772: UDP, length 120
00:00:01.830155 IP 192.168.43.147.8880 > 192.168.43.124.7773: UDP, length 120
00:00:01.863736 IP 192.168.43.146.8880 > 192.168.43.147.7772: UDP, length 120
00:00:01.880153 IP 192.168.43.147.8880 > 192.168.43.124.7773: UDP, length 120
00:00:01.924554 IP 192.168.43.146.8880 > 192.168.43.147.7772: UDP, length 120
00:00:01.930181 IP 192.168.43.147.8880 > 192.168.43.124.7773: UDP, length 120
00:00:01.962115 IP 192.168.43.146.8880 > 192.168.43.147.7772: UDP, length 120
00:00:01.980178 IP 192.168.43.147.8880 > 192.168.43.124.7773: UDP, length 120
00:00:02.013025 IP 192.168.43.146.8880 > 192.168.43.147.7772: UDP, length 120
00:00:02.030180 IP 192.168.43.147.8880 > 192.168.43.124.7773: UDP, length 120
00:00:02.074528 IP 192.168.43.146.8880 > 192.168.43.147.7772: UDP, length 120
00:00:02.080185 IP 192.168.43.147.8880 > 192.168.43.124.7773: UDP, length 120
00:00:02.111328 IP 192.168.43.146.8880 > 192.168.43.147.7772: UDP, length 120
00:00:02.130179 IP 192.168.43.147.8880 > 192.168.43.124.7773: UDP, length 120
00:00:02.162757 IP 192.168.43.146.8880 > 192.168.43.147.7772: UDP, length 120
00:00:02.180217 IP 192.168.43.147.8880 > 192.168.43.124.7773: UDP, length 120
00:00:02.214718 IP 192.168.43.146.8880 > 192.168.43.147.7772: UDP, length 120
00:00:02.230183 IP 192.168.43.147.8880 > 192.168.43.124.7773: UDP, length 120
00:00:02.280195 IP 192.168.43.147.8880 > 192.168.43.124.7773: UDP, length 120
00:00:02.288116 IP 192.168.43.146.8880 > 192.168.43.147.7772: UDP, length 120
00:00:02.312856 IP 192.168.43.146.8880 > 192.168.43.147.7772: UDP, length 120
00:00:02.330186 IP 192.168.43.147.8880 > 192.168.43.124.7773: UDP, length 120
00:00:02.361651 IP 192.168.43.146.8880 > 192.168.43.147.7772: UDP, length 120
00:00:02.380196 IP 192.168.43.147.8880 > 192.168.43.124.7773: UDP, length 120
00:00:02.429346 IP 192.168.43.146.8880 > 192.168.43.147.7772: UDP, length 120
00:00:02.430183 IP 192.168.43.147.8880 > 192.168.43.124.7773: UDP, length 120
00:00:02.458912 IP 192.168.43.146.8880 > 192.168.43.147.7772: UDP, length 120
00:00:02.480198 IP 192.168.43.147.8880 > 192.168.43.124.7773: UDP, length 120
00:00:02.512949 IP 192.168.43.146.8880 > 192.168.43.147.7772: UDP, length 120
00:00:02.530182 IP 192.168.43.147.8880 > 192.168.43.124.7773: UDP, length 120
00:00:02.572498 IP 192.168.43.146.8880 > 192.168.43.147.7772: UDP, length 120
00:00:02.580178 IP 192.168.43.147.8880 > 192.168.43.124.7773: UDP, length 120
00:00:02.630222 IP 192.168.43.147.8880 > 192.168.43.124.7773: UDP, length 120
00:00:02.650175 IP 192.168.43.146.8880 > 192.168.43.147.7772: UDP, length 120
00:00:02.680194 IP 192.168.43.147.8880 > 192.168.43.124.7773: UDP, length 120
00:00:02.682024 IP 192.168.43.146.8880 > 192.168.43.147.7772: UDP, length 120
00:00:02.730184 IP 192.168.43.147.8880 > 192.168.43.124.7773: UDP, length 120
00:00:02.738598 IP 192.168.43.146.8880 > 192.168.43.147.7772: UDP, length 120
00:00:02.765611 IP 192.168.43.146.8880 > 192.168.43.147.7772: UDP, length 120
00:00:02.780189 IP 192.168.43.147.8880 > 192.168.43.124.7773: UDP, length 120
00:00:02.827373 IP 192.168.43.146.8880 > 192.168.43.147.7772: UDP, length 120
00:00:02.830185 IP 192.168.43.147.8880 > 192.168.43.124.7773: UDP, length 120
00:00:02.860805 IP 192.168.43.146.8880 > 192.168.43.147.7772: UDP, length 120
00:00:02.880190 IP 192.168.43.147.8880 > 192.168.43.124.7773: UDP, length 120
00:00:02.909755 IP 192.168.43.146.8880 > 192.168.43.147.7772: UDP, length 120
00:00:02.930189 IP 192.168.43.147.8880 > 192.168.43.124.7773: UDP, length 120
00:00:02.980180 IP 192.168.43.147.8880 > 192.168.43.124.7773: UDP, length 120
00:00:02.983577 IP 192.168.43.146.8880 > 192.168.43.147.7772: UDP, length 120
00:00:03.030179 IP 192.168.43.147.8880 > 192.168.43.124.7773: UDP, length 120
00:00:03.046353 IP 192.168.43.146.8880 > 192.168.43.147.7772: UDP, length 120
00:00:03.080180 IP 192.168.43.147.8880 > 192.168.43.124.7773: UDP, length 120
00:00:03.091050 IP 192.168.43.146.8880 > 192.168.43.147.7772: UDP, length 120
00:00:03.112938 IP 192.168.43.146.8880 > 192.168.43.147.7772: UDP, length 120
00:00:03.130181 IP 192.168.43.147.8880 > 192.168.43.124.7773: UDP, length 120
00:00:03.180178 IP 192.168.43.147.8880 > 192.168.43.124.7773: UDP, length 120
00:00:03.192305 IP 192.168.43.146.8880 > 192.168.43.147.7772: UDP, length 120
00:00:03.230203 IP 192.168.43.147.8880 > 192.168.43.124.7773: UDP, length 120
00:00:03.233626 IP 192.168.43.146.8880 > 192.168.43.147.7772: UDP, length 120
00:00:03.280206 IP 192.168.43.147.8880 > 192.168.43.124.7773: UDP, length 120
00:00:03.302677 IP 192.168.43.146.8880 > 192.168.43.147.7772: UDP, length 120
00:00:03.322736 IP 192.168.43.146.8880 > 192.168.43.147.7772: UDP, length 120
00:00:03.330201 IP 192.168.43.147.8880 > 192.168.43.124.7773: UDP, length 120
00:00:03.380189 IP 192.168.43.147.8880 > 192.168.43.124.7773: UDP, length 120
00:00:03.402478 IP 192.168.43.146.8880 > 192.168.43.147.7772: UDP, length 120
00:00:03.430187 IP 192.168.43.147.8880 > 192.168.43.124.7773: UDP, length 120
00:00:03.433131 IP 192.168.43.146.8880 > 192.168.43.147.7772: UDP, length 120
00:00:03.480175 IP 192.168.43.147.8880 > 192.168.43.124.7773: UDP, length 120
00:00:03.502313 IP 192.168.43.146.8880 > 192.168.43.147.7772: UDP, length 120
00:00:03.524983 IP 192.168.43.146.8880 > 192.168.43.147.7772: UDP, length 120
00:00:03.530192 IP 192.168.43.147.8880 > 192.168.43.124.7773: UDP, length 120
00:00:03.580183 IP 192.168.43.147.8880 > 192.168.43.124.7773: UDP, length 120
00:00:03.601789 IP 192.168.43.146.8880 > 192.168.43.147.7772: UDP, length 120
00:00:03.606714 IP 192.168.43.146.8880 > 192.168.43.147.7772: UDP, length 120
00:00:03.630200 IP 192.168.43.147.8880 > 192.168.43.124.7773: UDP, length 120
00:00:03.680228 IP 192.168.43.147.8880 > 192.168.43.124.7773: UDP, length 120
00:00:03.687825 IP 192.168.43.146.8880 > 192.168.43.147.7772: UDP, length 120
00:00:03.716667 IP 192.168.43.146.8880 > 192.168.43.147.7772: UDP, length 120
00:00:03.730205 IP 192.168.43.147.8880 > 192.168.43.124.7773: UDP, length 120
00:00:03.780189 IP 192.168.43.147.8880 > 192.168.43.124.7773: UDP, length 120
00:00:03.809075 IP 192.168.43.146.8880 > 192.168.43.147.7772: UDP, length 120
00:00:03.809204 IP 192.168.43.146.8880 > 192.168.43.147.7772: UDP, length 120
00:00:03.830203 IP 192.168.43.147.8880 > 192.168.43.124.7773: UDP, length 120
00:00:03.880199 IP 192.168.43.147.8880 > 192.168.43.124.7773: UDP, length 120
00:00:03.930182 IP 192.168.43.147.8880 > 192.168.43.124.7773: UDP, length 120
00:00:03.933633 IP 192.168.43.146.8880 > 192.168.43.147.7772: UDP, length 120
00:00:03.933765 IP 192.168.43.146.8880 > 192.168.43.147.7772: UDP, length 120
00:00:03.971075 IP 192.168.43.146.8880 > 192.168.43.147.7772: UDP, length 120
00:00:03.980178 IP 192.168.43.147.8880 > 192.168.43.124.7773: UDP, length 120
00:00:04.013987 IP 192.168.43.146.8880 > 192.168.43.147.7772: UDP, length 120
00:00:04.030181 IP 192.168.43.147.8880 > 192.168.43.124.7773: UDP, length 120
00:00:04.072974 IP 192.168.43.146.8880 > 192.168.43.147.7772: UDP, length 120
00:00:04.080182 IP 192.168.43.147.8880 > 192.168.43.124.7773: UDP, length 120
00:00:04.113140 IP 192.168.43.146.8880 > 192.168.43.147.7772: UDP, length 120
00:00:04.130182 IP 192.168.43.147.8880 > 192.168.43.124.7773: UDP, length 120
00:00:04.180178 IP 192.168.43.147.8880 > 192.168.43.124.7773: UDP, length 120
00:00:04.183626 IP 192.168.43.146.8880 > 192.168.43.147.7772: UDP, length 120
00:00:04.214973 IP 192.168.43.146.8880 > 192.168.43.147.7772: UDP, length 120
00:00:04.230192 IP 192.168.43.147.8880 > 192.168.43.124.7773: UDP, length 120
00:00:04.280198 IP 192.168.43.147.8880 > 192.168.43.124.7773: UDP, length 120
00:00:04.330182 IP 192.168.43.147.8880 > 192.168.43.124.7773: UDP, length 120
00:00:04.331478 IP 192.168.43.146.8880 > 192.168.43.147.7772: UDP, length 120
00:00:04.332042 IP 192.168.43.146.8880 > 192.168.43.147.7772: UDP, length 120
00:00:04.380192 IP 192.168.43.147.8880 > 192.168.43.124.7773: UDP, length 120
00:00:04.402244 IP 192.168.43.146.8880 > 192.168.43.147.7772: UDP, length 120
00:00:04.430189 IP 192.168.43.147.8880 > 192.168.43.124.7773: UDP, length 120
00:00:04.434117 IP 192.168.43.146.8880 > 192.168.43.147.7772: UDP, length 120
00:00:04.480200 IP 192.168.43.147.8880 > 192.168.43.124.7773: UDP, length 120
00:00:04.530190 IP 192.168.43.147.8880 > 192.168.43.124.7773: UDP, length 120
00:00:04.545593 IP 192.168.43.146.8880 > 192.168.43.147.7772: UDP, length 120
00:00:04.545873 IP 192.168.43.146.8880 > 192.168.43.147.7772: UDP, length 120
00:00:04.580188 IP 192.168.43.147.8880 > 192.168.43.124.7773: UDP, length 120
00:00:04.624590 IP 192.168.43.146.8880 > 192.168.43.147.7772: UDP, length 120
00:00:04.624720 IP 192.168.43.146.8880 > 192.168.43.147.7772: UDP, length 120
00:00:04.630192 IP 192.168.43.147.8880 > 192.168.43.124.7773: UDP, length 120
00:00:04.680179 IP 192.168.43.147.8880 > 192.168.43.124.7773: UDP, length 120
00:00:04.700975 IP 192.168.43.146.8880 > 192.168.43.147.7772: UDP, length 120
00:00:04.730183 IP 192.168.43.147.8880 > 192.168.43.124.7773: UDP, length 120
00:00:04.731318 IP 192.168.43.146.8880 > 192.168.43.147.7772: UDP, length 120
00:00:04.778700 IP 192.168.43.146.8880 > 192.168.43.147.7772: UDP, length 120
00:00:04.780175 IP 192.168.43.147.8880 > 192.168.43.124.7773: UDP, length 120
00:00:04.830189 IP 192.168.43.147.8880 > 192.168.43.124.7773: UDP, length 120
00:00:04.846952 IP 192.168.43.146.8880 > 192.168.43.147.7772: UDP, length 120
00:00:04.880184 IP 192.168.43.147.8880 > 192.168.43.124.7773: UDP, length 120
00:00:04.930182 IP 192.168.43.147.8880 > 192.168.43.124.7773: UDP, length 120
00:00:04.936681 IP 192.168.43.146.8880 > 192.168.43.147.7772: UDP, length 120
00:00:04.936808 IP 192.168.43.146.8880 > 192.168.43.147.7772: UDP, length 120
00:00:04.963317 IP 192.168.43.146.8880 > 192.168.43.147.7772: UDP, length 120
00:00:04.980183 IP 192.168.43.147.8880 > 192.168.43.124.7773: UDP, length 120
00:00:05.025388 IP 192.168.43.146.8880 > 192.168.43.147.7772: UDP, length 120
00:00:05.030179 IP 192.168.43.147.8880 > 192.168.43.124.7773: UDP, length 120
00:00:05.080177 IP 192.168.43.147.8880 > 192.168.43.124.7773: UDP, length 120
00:00:05.111449 IP 192.168.43.146.8880 > 192.168.43.147.7772: UDP, length 120
00:00:05.130184 IP 192.168.43.147.8880 > 192.168.43.124.7773: UDP, length 120
00:00:05.138301 IP 192.168.43.146.8880 > 192.168.43.147.7772: UDP, length 120
00:00:05.180237 IP 192.168.43.147.8880 > 192.168.43.124.7773: UDP, length 120
00:00:05.201125 IP 192.168.43.146.8880 > 192.168.43.147.7772: UDP, length 120
00:00:05.210124 IP 192.168.43.146.8880 > 192.168.43.147.7772: UDP, length 120
00:00:05.230184 IP 192.168.43.147.8880 > 192.168.43.124.7773: UDP, length 120
00:00:05.258585 IP 192.168.43.146.8880 > 192.168.43.147.7772: UDP, length 120
00:00:05.280199 IP 192.168.43.147.8880 > 192.168.43.124.7773: UDP, length 120
00:00:05.330181 IP 192.168.43.147.8880 > 192.168.43.124.7773: UDP, length 120
00:00:05.332670 IP 192.168.43.146.8880 > 192.168.43.147.7772: UDP, length 120
00:00:05.380191 IP 192.168.43.147.8880 > 192.168.43.124.7773: UDP, length 120
00:00:05.405245 IP 192.168.43.146.8880 > 192.168.43.147.7772: UDP, length 120
00:00:05.430189 IP 192.168.43.147.8880 > 192.168.43.124.7773: UDP, length 120
00:00:05.451535 IP 192.168.43.146.8880 > 192.168.43.147.7772: UDP, length 120
00:00:05.480178 IP 192.168.43.147.8880 > 192.168.43.124.7773: UDP, length 120
00:00:05.530178 IP 192.168.43.147.8880 > 192.168.43.124.7773: UDP, length 120
00:00:05.549169 IP 192.168.43.146.8880 > 192.168.43.147.7772: UDP, length 120
00:00:05.549305 IP 192.168.43.146.8880 > 192.168.43.147.7772: UDP, length 120
00:00:05.564346 IP 192.168.43.146.8880 > 192.168.43.147.7772: UDP, length 120
00:00:05.580196 IP 192.168.43.147.8880 > 192.168.43.124.7773: UDP, length 120
00:00:05.630182 IP 192.168.43.147.8880 > 192.168.43.124.7773: UDP, length 120
00:00:05.643485 IP 192.168.43.146.8880 > 192.168.43.147.7772: UDP, length 120
00:00:05.656664 IP 192.168.43.146.8880 > 192.168.43.147.7772: UDP, length 120
00:00:05.680186 IP 192.168.43.147.8880 > 192.168.43.124.7773: UDP, length 120
00:00:05.730184 IP 192.168.43.147.8880 > 192.168.43.124.7773: UDP, length 120
00:00:05.756890 IP 192.168.43.146.8880 > 192.168.43.147.7772: UDP, length 120
00:00:05.757022 IP 192.168.43.146.8880 > 192.168.43.147.7772: UDP, length 120
00:00:05.780179 IP 192.168.43.147.8880 > 192.168.43.124.7773: UDP, length 120
00:00:05.825444 IP 192.168.43.146.8880 > 192.168.43.147.7772: UDP, length 120
00:00:05.830195 IP 192.168.43.147.8880 > 192.168.43.124.7773: UDP, length 120
00:00:05.880181 IP 192.168.43.147.8880 > 192.168.43.124.7773: UDP, length 120
00:00:05.900818 IP 192.168.43.146.8880 > 192.168.43.147.7772: UDP, length 120
00:00:05.930184 IP 192.168.43.147.8880 > 192.168.43.124.7773: UDP, length 120
00:00:05.967286 IP 192.168.43.146.8880 > 192.168.43.147.7772: UDP, length 120
00:00:05.967513 IP 192.168.43.146.8880 > 192.168.43.147.7772: UDP, length 120
00:00:05.980191 IP 192.168.43.147.8880 > 192.168.43.124.7773: UDP, length 120
00:00:06.030178 IP 192.168.43.147.8880 > 192.168.43.124.7773: UDP, length 120
00:00:06.037079 IP 192.168.43.146.8880 > 192.168.43.147.7772: UDP, length 120
00:00:06.058914 IP 192.168.43.146.8880 > 192.168.43.147.7772: UDP, length 120
00:00:06.080196 IP 192.168.43.147.8880 > 192.168.43.124.7773: UDP, length 120
00:00:06.130182 IP 192.168.43.147.8880 > 192.168.43.124.7773: UDP, length 120
00:00:06.162598 IP 192.168.43.146.8880 > 192.168.43.147.7772: UDP, length 120
00:00:06.168303 IP 192.168.43.146.8880 > 192.168.43.147.7772: UDP, length 120
00:00:06.180197 IP 192.168.43.147.8880 > 192.168.43.124.7773: UDP, length 120
00:00:06.225064 IP 192.168.43.146.8880 > 192.168.43.147.7772: UDP, length 120
00:00:06.230180 IP 192.168.43.147.8880 > 192.168.43.124.7773: UDP, length 120
00:00:06.269737 IP 192.168.43.146.8880 > 192.168.43.147.7772: UDP, length 120
00:00:06.280200 IP 192.168.43.147.8880 > 192.168.43.124.7773: UDP, length 120
00:00:06.325151 IP 192.168.43.146.8880 > 192.168.43.147.7772: UDP, length 120
00:00:06.330193 IP 192.168.43.147.8880 > 192.168.43.124.7773: UDP, length 120
00:00:06.379218 IP 192.168.43.146.8880 > 192.168.43.147.7772: UDP, length 120
00:00:06.380177 IP 192.168.43.147.8880 > 192.168.43.124.7773: UDP, length 120
00:00:06.430181 IP 192.168.43.147.8880 > 192.168.43.124.7773: UDP, length 120
00:00:06.453015 IP 192.168.43.146.8880 > 192.168.43.147.7772: UDP, length 120
00:00:06.471701 IP 192.168.43.146.8880 > 192.168.43.147.7772: UDP, length 120
00:00:06.480197 IP 192.168.43.147.8880 > 192.168.43.124.7773: UDP, length 120
00:00:06.528671 IP 192.168.43.146.8880 > 192.168.43.147.7772: UDP, length 120
00:00:06.530182 IP 192.168.43.147.8880 > 192.168.43.124.7773: UDP, length 120
00:00:06.574009 IP 192.168.43.146.8880 > 192.168.43.147.7772: UDP, length 120
00:00:06.580183 IP 192.168.43.147.8880 > 192.168.43.124.7773: UDP, length 120
00:00:06.630199 IP 192.168.43.147.8880 > 192.168.43.124.7773: UDP, length 120
00:00:06.668289 IP 192.168.43.146.8880 > 192.168.43.147.7772: UDP, length 120
00:00:06.678773 IP 192.168.43.146.8880 > 192.168.43.147.7772: UDP, length 120
00:00:06.680211 IP 192.168.43.147.8880 > 192.168.43.124.7773: UDP, length 120
00:00:06.725277 IP 192.168.43.146.8880 > 192.168.43.147.7772: UDP, length 120
00:00:06.730182 IP 192.168.43.147.8880 > 192.168.43.124.7773: UDP, length 120
00:00:06.780183 IP 192.168.43.147.8880 > 192.168.43.124.7773: UDP, length 120
00:00:06.780355 IP 192.168.43.146.8880 > 192.168.43.147.7772: UDP, length 120
00:00:06.830183 IP 192.168.43.147.8880 > 192.168.43.124.7773: UDP, length 120
00:00:06.857993 IP 192.168.43.146.8880 > 192.168.43.147.7772: UDP, length 120
00:00:06.872665 IP 192.168.43.146.8880 > 192.168.43.147.7772: UDP, length 120
00:00:06.880213 IP 192.168.43.147.8880 > 192.168.43.124.7773: UDP, length 120
00:00:06.915878 IP 192.168.43.146.8880 > 192.168.43.147.7772: UDP, length 120
00:00:06.930189 IP 192.168.43.147.8880 > 192.168.43.124.7773: UDP, length 120
00:00:06.971177 IP 192.168.43.146.8880 > 192.168.43.147.7772: UDP, length 120
00:00:06.980178 IP 192.168.43.147.8880 > 192.168.43.124.7773: UDP, length 120
00:00:07.007490 IP 192.168.43.146.8880 > 192.168.43.147.7772: UDP, length 120
00:00:07.030199 IP 192.168.43.147.8880 > 192.168.43.124.7773: UDP, length 120
00:00:07.060054 IP 192.168.43.146.8880 > 192.168.43.147.7772: UDP, length 120
00:00:07.080195 IP 192.168.43.147.8880 > 192.168.43.124.7773: UDP, length 120
00:00:07.119779 IP 192.168.43.146.8880 > 192.168.43.147.7772: UDP, length 120
00:00:07.130182 IP 192.168.43.147.8880 > 192.168.43.124.7773: UDP, length 120
00:00:07.164798 IP 192.168.43.146.8880 > 192.168.43.147.7772: UDP, length 120
00:00:07.180178 IP 192.168.43.147.8880 > 192.168.43.124.7773: UDP, length 120
00:00:07.215263 IP 192.168.43.146.8880 > 192.168.43.147.7772: UDP, length 120
00:00:07.230182 IP 192.168.43.147.8880 > 192.168.43.124.7773: UDP, length 120
00:00:07.265072 IP 192.168.43.146.8880 > 192.168.43.147.7772: UDP, length 120
00:00:07.280197 IP 192.168.43.147.8880 > 192.168.43.124.7773: UDP, length 120
00:00:07.315226 IP 192.168.43.146.8880 > 192.168.43.147.7772: UDP, length 120
00:00:07.330181 IP 192.168.43.147.8880 > 192.168.43.124.7773: UDP, length 120
00:00:07.363007 IP 192.168.43.146.8880 > 192.168.43.147.7772: UDP, length 120
00:00:07.380178 IP 192.168.43.147.8880 > 192.168.43.124.7773: UDP, length 120
00:00:07.418224 IP 192.168.43.146.8880 > 192.168.43.147.7772: UDP, length 120
00:00:07.430179 IP 192.168.43.147.8880 > 192.168.43.124.7773: UDP, length 120
00:00:07.469423 IP 192.168.43.146.8880 > 192.168.43.147.7772: UDP, length 120
00:00:07.480181 IP 192.168.43.147.8880 > 192.168.43.124.7773: UDP, length 120
00:00:07.517943 IP 192.168.43.146.8880 > 192.168.43.147.7772: UDP, length 120
00:00:07.530180 IP 192.168.43.147.8880 > 192.168.43.124.7773: UDP, length 120
00:00:07.564404 IP 192.168.43.146.8880 > 192.168.43.147.7772: UDP, length 120
00:00:07.580178 IP 192.168.43.147.8880 > 192.168.43.124.7773: UDP, length 120
00:00:07.624179 IP 192.168.43.146.8880 > 192.168.43.147.7772: UDP, length 120
00:00:07.630177 IP 192.168.43.147.8880 > 192.168.43.124.7773: UDP, length 120
00:00:07.674245 IP 192.168.43.146.8880 > 192.168.43.147.7772: UDP, length 120
00:00:07.680177 IP 192.168.43.147.8880 > 192.168.43.124.7773: UDP, length 120
00:00:07.714917 IP 192.168.43.146.8880 > 192.168.43.147.7772: UDP, length 120
00:00:07.730179 IP 192.168.43.147.8880 > 192.168.43.124.7773: UDP, length 120
00:00:07.768568 IP 192.168.43.146.8880 > 192.168.43.147.7772: UDP, length 120
00:00:07.780182 IP 192.168.43.147.8880 > 192.168.43.124.7773: UDP, length 120
00:00:07.812804 IP 192.168.43.146.8880 > 192.168.43.147.7772: UDP, length 120
00:00:07.830188 IP 192.168.43.147.8880 > 192.168.43.124.7773: UDP, length 120
00:00:07.865249 IP 192.168.43.146.8880 > 192.168.43.147.7772: UDP, length 120
00:00:07.880181 IP 192.168.43.147.8880 > 192.168.43.124.7773: UDP, length 120
00:00:07.914243 IP 192.168.43.146.8880 > 192.168.43.147.7772: UDP, length 120
00:00:07.930192 IP 192.168.43.147.8880 > 192.168.43.124.7773: UDP, length 120
00:00:07.964459 IP 192.168.43.146.8880 > 192.168.43.147.7772: UDP, length 120
00:00:07.980181 IP 192.168.43.147.8880 > 192.168.43.124.7773: UDP, length 120
00:00:08.013433 IP 192.168.43.146.8880 > 192.168.43.147.7772: UDP, length 120
00:00:08.030184 IP 192.168.43.147.8880 > 192.168.43.124.7773: UDP, length 120
00:00:08.065269 IP 192.168.43.146.8880 > 192.168.43.147.7772: UDP, length 120
00:00:08.080180 IP 192.168.43.147.8880 > 192.168.43.124.7773: UDP, length 120
00:00:08.114304 IP 192.168.43.146.8880 > 192.168.43.147.7772: UDP, length 120
00:00:08.130193 IP 192.168.43.147.8880 > 192.168.43.124.7773: UDP, length 120
00:00:08.158385 IP 192.168.43.146.8880 > 192.168.43.147.7772: UDP, length 120
00:00:08.180226 IP 192.168.43.147.8880 > 192.168.43.124.7773: UDP, length 120
00:00:08.214320 IP 192.168.43.146.8880 > 192.168.43.147.7772: UDP, length 120
00:00:08.230187 IP 192.168.43.147.8880 > 192.168.43.124.7773: UDP, length 120
00:00:08.261969 IP 192.168.43.146.8880 > 192.168.43.147.7772: UDP, length 120
00:00:08.280197 IP 192.168.43.147.8880 > 192.168.43.124.7773: UDP, length 120
00:00:08.313474 IP 192.168.43.146.8880 > 192.168.43.147.7772: UDP, length 120
00:00:08.330190 IP 192.168.43.147.8880 > 192.168.43.124.7773: UDP, length 120
00:00:08.360623 IP 192.168.43.146.8880 > 192.168.43.147.7772: UDP, length 120
00:00:08.380199 IP 192.168.43.147.8880 > 192.168.43.124.7773: UDP, length 120
00:00:08.412886 IP 192.168.43.146.8880 > 192.168.43.147.7772: UDP, length 120
00:00:08.430186 IP 192.168.43.147.8880 > 192.168.43.124.7773: UDP, length 120
00:00:08.462095 IP 192.168.43.146.8880 > 192.168.43.147.7772: UDP, length 120
00:00:08.480198 IP 192.168.43.147.8880 > 192.168.43.124.7773: UDP, length 120
00:00:08.519016 IP 192.168.43.146.8880 > 192.168.43.147.7772: UDP, length 120
00:00:08.530184 IP 192.168.43.147.8880 > 192.168.43.124.7773: UDP, length 120
00:00:08.562651 IP 192.168.43.146.8880 > 192.168.43.147.7772: UDP, length 120
00:00:08.580195 IP 192.168.43.147.8880 > 192.168.43.124.7773: UDP, length 120
00:00:08.615131 IP 192.168.43.146.8880 > 192.168.43.147.7772: UDP, length 120
00:00:08.630185 IP 192.168.43.147.8880 > 192.168.43.124.7773: UDP, length 120
00:00:08.676232 IP 192.168.43.146.8880 > 192.168.43.147.7772: UDP, length 120
00:00:08.680180 IP 192.168.43.147.8880 > 192.168.43.124.7773: UDP, length 120
00:00:08.714227 IP 192.168.43.146.8880 > 192.168.43.147.7772: UDP, length 120
00:00:08.730182 IP 192.168.43.147.8880 > 192.168.43.124.7773: UDP, length 120
00:00:08.767263 IP 192.168.43.146.8880 > 192.168.43.147.7772: UDP, length 120
00:00:08.780180 IP 192.168.43.147.8880 > 192.168.43.124.7773: UDP, length 120
00:00:08.807879 IP 192.168.43.146.8880 > 192.168.43.147.7772: UDP, length 120
00:00:08.830200 IP 192.168.43.147.8880 > 192.168.43.124.7773: UDP, length 120
00:00:08.870149 IP 192.168.43.146.8880 > 192.168.43.147.7772: UDP, length 120
00:00:08.880185 IP 192.168.43.147.8880 > 192.168.43.124.7773: UDP, length 120
00:00:08.912944 IP 192.168.43.146.8880 > 192.168.43.147.7772: UDP, length 120
00:00:08.930182 IP 192.168.43.147.8880 > 192.168.43.124.7773: UDP, length 120
00:00:08.958881 IP 192.168.43.146.8880 > 192.168.43.147.7772: UDP, length 120
00:00:08.980204 IP 192.168.43.147.8880 > 192.168.43.124.7773: UDP, length 120
00:00:09.010617 IP 192.168.43.146.8880 > 192.168.43.147.7772: UDP, length 120
00:00:09.030200 IP 192.168.43.147.8880 > 192.168.43.124.7773: UDP, length 120
00:00:09.061450 IP 192.168.43.146.8880 > 192.168.43.147.7772: UDP, length 120
00:00:09.080190 IP 192.168.43.147.8880 > 192.168.43.124.7773: UDP, length 120
00:00:09.110509 IP 192.168.43.146.8880 > 192.168.43.147.7772: UDP, length 120
00:00:09.130198 IP 192.168.43.147.8880 > 192.168.43.124.7773: UDP, length 120
00:00:09.173054 IP 192.168.43.146.8880 > 192.168.43.147.7772: UDP, length 120
00:00:09.180184 IP 192.168.43.147.8880 > 192.168.43.124.7773: UDP, length 120
00:00:09.225844 IP 192.168.43.146.8880 > 192.168.43.147.7772: UDP, length 120
00:00:09.230180 IP 192.168.43.147.8880 > 192.168.43.124.7773: UDP, length 120
00:00:09.260020 IP 192.168.43.146.8880 > 192.168.43.147.7772: UDP, length 120
00:00:09.280193 IP 192.168.43.147.8880 > 192.168.43.124.7773: UDP, length 120
00:00:09.313934 IP 192.168.43.146.8880 > 192.168.43.147.7772: UDP, length 120
00:00:09.330202 IP 192.168.43.147.8880 > 192.168.43.124.7773: UDP, length 120
00:00:09.361100 IP 192.168.43.146.8880 > 192.168.43.147.7772: UDP, length 120
00:00:09.380183 IP 192.168.43.147.8880 > 192.168.43.124.7773: UDP, length 120
00:00:09.410881 IP 192.168.43.146.8880 > 192.168.43.147.7772: UDP, length 120
00:00:09.430182 IP 192.168.43.147.8880 > 192.168.43.124.7773: UDP, length 120
00:00:09.462686 IP 192.168.43.146.8880 > 192.168.43.147.7772: UDP, length 120
00:00:09.480180 IP 192.168.43.147.8880 > 192.168.43.124.7773: UDP, length 120
00:00:09.513657 IP 192.168.43.146.8880 > 192.168.43.147.7772: UDP, length 120
00:00:09.530183 IP 192.168.43.147.8880 > 192.168.43.124.7773: UDP, length 120
00:00:09.565911 IP 192.168.43.146.8880 > 192.168.43.147.7772: UDP, length 120
00:00:09.580200 IP 192.168.43.147.8880 > 192.168.43.124.7773: UDP, length 120
00:00:09.619909 IP 192.168.43.146.8880 > 192.168.43.147.7772: UDP, length 120
00:00:09.630190 IP 192.168.43.147.8880 > 192.168.43.124.7773: UDP, length 120
00:00:09.663947 IP 192.168.43.146.8880 > 192.168.43.147.7772: UDP, length 120
00:00:09.680215 IP 192.168.43.147.8880 > 192.168.43.124.7773: UDP, length 120
00:00:09.712915 IP 192.168.43.146.8880 > 192.168.43.147.7772: UDP, length 120
00:00:09.730183 IP 192.168.43.147.8880 > 192.168.43.124.7773: UDP, length 120
00:00:09.772198 IP 192.168.43.146.8880 > 192.168.43.147.7772: UDP, length 120
00:00:09.780179 IP 192.168.43.147.8880 > 192.168.43.124.7773: UDP, length 120
00:00:09.815511 IP 192.168.43.146.8880 > 192.168.43.147.7772: UDP, length 120
00:00:09.830180 IP 192.168.43.147.8880 > 192.168.43.124.7773: UDP, length 120
00:00:09.876426 IP 192.168.43.146.8880 > 192.168.43.147.7772: UDP, length 120
00:00:09.880177 IP 192.168.43.147.8880 > 192.168.43.124.7773: UDP, length 120
00:00:09.930182 IP 192.168.43.147.8880 > 192.168.43.124.7773: UDP, length 120
00:00:09.930866 IP 192.168.43.146.8880 > 192.168.43.147.7772: UDP, length 120
00:00:09.980180 IP 192.168.43.147.8880 > 192.168.43.124.7773: UDP, length 120
00:00:09.984213 IP 192.168.43.146.8880 > 192.168.43.147.7772: UDP, length 120
00:00:10.012959 IP 192.168.43.146.8880 > 192.168.43.147.7772: UDP, length 120
00:00:10.030183 IP 192.168.43.147.8880 > 192.168.43.124.7773: UDP, length 120
00:00:10.060187 IP 192.168.43.146.8880 > 192.168.43.147.7772: UDP, length 120
00:00:10.080191 IP 192.168.43.147.8880 > 192.168.43.124.7773: UDP, length 120
00:00:10.109810 IP 192.168.43.146.8880 > 192.168.43.147.7772: UDP, length 120
00:00:10.130184 IP 192.168.43.147.8880 > 192.168.43.124.7773: UDP, length 120
00:00:10.162894 IP 192.168.43.146.8880 > 192.168.43.147.7772: UDP, length 120
00:00:10.180179 IP 192.168.43.147.8880 > 192.168.43.124.7773: UDP, length 120
00:00:10.220484 IP 192.168.43.146.8880 > 192.168.43.147.7772: UDP, length 120
00:00:10.230180 IP 192.168.43.147.8880 > 192.168.43.124.7773: UDP, length 120
00:00:10.278272 IP 192.168.43.146.8880 > 192.168.43.147.7772: UDP, length 120
00:00:10.280191 IP 192.168.43.147.8880 > 192.168.43.124.7773: UDP, length 120
00:00:10.309983 IP 192.168.43.146.8880 > 192.168.43.147.7772: UDP, length 120
00:00:10.330190 IP 192.168.43.147.8880 > 192.168.43.124.7773: UDP, length 120
00:00:10.363915 IP 192.168.43.146.8880 > 192.168.43.147.7772: UDP, length 120
00:00:10.380180 IP 192.168.43.147.8880 > 192.168.43.124.7773: UDP, length 120
00:00:10.412555 IP 192.168.43.146.8880 > 192.168.43.147.7772: UDP, length 120
00:00:10.430180 IP 192.168.43.147.8880 > 192.168.43.124.7773: UDP, length 120
00:00:10.464629 IP 192.168.43.146.8880 > 192.168.43.147.7772: UDP, length 120
00:00:10.480179 IP 192.168.43.147.8880 > 192.168.43.124.7773: UDP, length 120
00:00:10.513425 IP 192.168.43.146.8880 > 192.168.43.147.7772: UDP, length 120
00:00:10.530181 IP 192.168.43.147.8880 > 192.168.43.124.7773: UDP, length 120
00:00:10.567521 IP 192.168.43.146.8880 > 192.168.43.147.7772: UDP, length 120
00:00:10.580179 IP 192.168.43.147.8880 > 192.168.43.124.7773: UDP, length 120
00:00:10.613058 IP 192.168.43.146.8880 > 192.168.43.147.7772: UDP, length 120
00:00:10.630179 IP 192.168.43.147.8880 > 192.168.43.124.7773: UDP, length 120
00:00:10.673242 IP 192.168.43.146.8880 > 192.168.43.147.7772: UDP, length 120
00:00:10.680178 IP 192.168.43.147.8880 > 192.168.43.124.7773: UDP, length 120
00:00:10.728451 IP 192.168.43.146.8880 > 192.168.43.147.7772: UDP, length 120
00:00:10.730178 IP 192.168.43.147.8880 > 192.168.43.124.7773: UDP, length 120
00:00:10.763691 IP 192.168.43.146.8880 > 192.168.43.147.7772: UDP, length 120
00:00:10.780178 IP 192.168.43.147.8880 > 192.168.43.124.7773: UDP, length 120
00:00:10.813766 IP 192.168.43.146.8880 > 192.168.43.147.7772: UDP, length 120
00:00:10.830180 IP 192.168.43.147.8880 > 192.168.43.124.7773: UDP, length 120
00:00:10.863519 IP 192.168.43.146.8880 > 192.168.43.147.7772: UDP, length 120
00:00:10.880178 IP 192.168.43.147.8880 > 192.168.43.124.7773: UDP, length 120
00:00:10.918578 IP 192.168.43.146.8880 > 192.168.43.147.7772: UDP, length 120
00:00:10.930181 IP 192.168.43.147.8880 > 192.168.43.124.7773: UDP, length 120
00:00:10.970405 IP 192.168.43.146.8880 > 192.168.43.147.7772: UDP, length 120
00:00:10.980177 IP 192.168.43.147.8880 > 192.168.43.124.7773: UDP, length 120
00:00:11.028201 IP 192.168.43.146.8880 > 192.168.43.147.7772: UDP, length 120
00:00:11.030180 IP 192.168.43.147.8880 > 192.168.43.124.7773: UDP, length 120
00:00:11.062398 IP 192.168.43.146.8880 > 192.168.43.147.7772: UDP, length 120
00:00:11.080180 IP 192.168.43.147.8880 > 192.168.43.124.7773: UDP, length 120
00:00:11.111258 IP 192.168.43.146.8880 > 192.168.43.147.7772: UDP, length 120
00:00:11.130184 IP 192.168.43.147.8880 > 192.168.43.124.7773: UDP, length 120
00:00:11.161053 IP 192.168.43.146.8880 > 192.168.43.147.7772: UDP, length 120
00:00:11.180217 IP 192.168.43.147.8880 > 192.168.43.124.7773: UDP, length 120
00:00:11.212690 IP 192.168.43.146.8880 > 192.168.43.147.7772: UDP, length 120
00:00:11.230182 IP 192.168.43.147.8880 > 192.168.43.124.7773: UDP, length 120
00:00:11.256215 IP 192.168.43.146.8880 > 192.168.43.147.7772: UDP, length 120
00:00:11.280194 IP 192.168.43.147.8880 > 192.168.43.124.7773: UDP, length 120
00:00:11.328007 IP 192.168.43.146.8880 > 192.168.43.147.7772: UDP, length 120
00:00:11.330181 IP 192.168.43.147.8880 > 192.168.43.124.7773: UDP, length 120
00:00:11.376218 IP 192.168.43.146.8880 > 192.168.43.147.7772: UDP, length 120
00:00:11.380179 IP 192.168.43.147.8880 > 192.168.43.124.7773: UDP, length 120
00:00:11.412312 IP 192.168.43.146.8880 > 192.168.43.147.7772: UDP, length 120
00:00:11.430183 IP 192.168.43.147.8880 > 192.168.43.124.7773: UDP, length 120
00:00:11.460272 IP 192.168.43.146.8880 > 192.168.43.147.7772: UDP, length 120
00:00:11.480180 IP 192.168.43.147.8880 > 192.168.43.124.7773: UDP, length 120
00:00:11.512810 IP 192.168.43.146.8880 > 192.168.43.147.7772: UDP, length 120
00:00:11.530181 IP 192.168.43.147.8880 > 192.168.43.124.7773: UDP, length 120
00:00:11.562824 IP 192.168.43.146.8880 > 192.168.43.147.7772: UDP, length 120
00:00:11.580184 IP 192.168.43.147.8880 > 192.168.43.124.7773: UDP, length 120
00:00:11.612126 IP 192.168.43.146.8880 > 192.168.43.147.7772: UDP, length 120
00:00:11.630190 IP 192.168.43.147.8880 > 192.168.43.124.7773: UDP, length 120
00:00:11.666025 IP 192.168.43.146.8880 > 192.168.43.147.7772: UDP, length 120
00:00:11.680181 IP 192.168.43.147.8880 > 192.168.43.124.7773: UDP, length 120
00:00:11.712502 IP 192.168.43.146.8880 > 192.168.43.147.7772: UDP, length 120
00:00:11.730182 IP 192.168.43.147.8880 > 192.168.43.124.7773: UDP, length 120
00:00:11.764780 IP 192.168.43.146.8880 > 192.168.43.147.7772: UDP, length 120
00:00:11.780179 IP 192.168.43.147.8880 > 192.168.43.124.7773: UDP, length 120
00:00:11.815523 IP 192.168.43.146.8880 > 192.168.43.147.7772: UDP, length 120
00:00:11.830180 IP 192.168.43.147.8880 > 192.168.43.124.7773: UDP, length 120
00:00:11.870246 IP 192.168.43.146.8880 > 192.168.43.147.7772: UDP, length 120
00:00:11.880179 IP 192.168.43.147.8880 > 192.168.43.124.7773: UDP, length 120
00:00:11.922348 IP 192.168.43.146.8880 > 192.168.43.147.7772: UDP, length 120
00:00:11.930180 IP 192.168.43.147.8880 > 192.168.43.124.7773: UDP, length 120
00:00:11.975196 IP 192.168.43.146.8880 > 192.168.43.147.7772: UDP, length 120
00:00:11.980178 IP 192.168.43.147.8880 > 192.168.43.124.7773: UDP, length 120
00:00:12.014199 IP 192.168.43.146.8880 > 192.168.43.147.7772: UDP, length 120
00:00:12.030182 IP 192.168.43.147.8880 > 192.168.43.124.7773: UDP, length 120
00:00:12.062892 IP 192.168.43.146.8880 > 192.168.43.147.7772: UDP, length 120
00:00:12.080178 IP 192.168.43.147.8880 > 192.168.43.124.7773: UDP, length 120
00:00:12.111538 IP 192.168.43.146.8880 > 192.168.43.147.7772: UDP, length 120
00:00:12.130200 IP 192.168.43.147.8880 > 192.168.43.124.7773: UDP, length 120
00:00:12.161553 IP 192.168.43.146.8880 > 192.168.43.147.7772: UDP, length 120
00:00:12.180202 IP 192.168.43.147.8880 > 192.168.43.124.7773: UDP, length 120
00:00:12.214479 IP 192.168.43.146.8880 > 192.168.43.147.7772: UDP, length 120
00:00:12.230202 IP 192.168.43.147.8880 > 192.168.43.124.7773: UDP, length 120
00:00:12.273397 IP 192.168.43.146.8880 > 192.168.43.147.7772: UDP, length 120
00:00:12.280199 IP 192.168.43.147.8880 > 192.168.43.124.7773: UDP, length 120
00:00:12.314637 IP 192.168.43.146.8880 > 192.168.43.147.7772: UDP, length 120
00:00:12.330183 IP 192.168.43.147.8880 > 192.168.43.124.7773: UDP, length 120
00:00:12.365015 IP 192.168.43.146.8880 > 192.168.43.147.7772: UDP, length 120
00:00:12.380188 IP 192.168.43.147.8880 > 192.168.43.124.7773: UDP, length 120
00:00:12.415437 IP 192.168.43.146.8880 > 192.168.43.147.7772: UDP, length 120
00:00:12.430183 IP 192.168.43.147.8880 > 192.168.43.124.7773: UDP, length 120
00:00:12.462898 IP 192.168.43.146.8880 > 192.168.43.147.7772: UDP, length 120
00:00:12.480180 IP 192.168.43.147.8880 > 192.168.43.124.7773: UDP, length 120
00:00:12.530178 IP 192.168.43.147.8880 > 192.168.43.124.7773: UDP, length 120
00:00:12.532020 IP 192.168.43.146.8880 > 192.168.43.147.7772: UDP, length 120
00:00:12.565642 IP 192.168.43.146.8880 > 192.168.43.147.7772: UDP, length 120
00:00:12.580179 IP 192.168.43.147.8880 > 192.168.43.124.7773: UDP, length 120
00:00:12.618145 IP 192.168.43.146.8880 > 192.168.43.147.7772: UDP, length 120
00:00:12.630182 IP 192.168.43.147.8880 > 192.168.43.124.7773: UDP, length 120
00:00:12.666036 IP 192.168.43.146.8880 > 192.168.43.147.7772: UDP, length 120
00:00:12.680216 IP 192.168.43.147.8880 > 192.168.43.124.7773: UDP, length 120
00:00:12.710609 IP 192.168.43.146.8880 > 192.168.43.147.7772: UDP, length 120
00:00:12.730206 IP 192.168.43.147.8880 > 192.168.43.124.7773: UDP, length 120
00:00:12.767178 IP 192.168.43.146.8880 > 192.168.43.147.7772: UDP, length 120
00:00:12.780184 IP 192.168.43.147.8880 > 192.168.43.124.7773: UDP, length 120
00:00:12.822273 IP 192.168.43.146.8880 > 192.168.43.147.7772: UDP, length 120
00:00:12.830208 IP 192.168.43.147.8880 > 192.168.43.124.7773: UDP, length 120
00:00:12.872161 IP 192.168.43.146.8880 > 192.168.43.147.7772: UDP, length 120
00:00:12.880195 IP 192.168.43.147.8880 > 192.168.43.124.7773: UDP, length 120
00:00:12.913890 IP 192.168.43.146.8880 > 192.168.43.147.7772: UDP, length 120
00:00:12.930187 IP 192.168.43.147.8880 > 192.168.43.124.7773: UDP, length 120
00:00:12.973065 IP 192.168.43.146.8880 > 192.168.43.147.7772: UDP, length 120
00:00:12.980194 IP 192.168.43.147.8880 > 192.168.43.124.7773: UDP, length 120
00:00:13.011619 IP 192.168.43.146.8880 > 192.168.43.147.7772: UDP, length 120
00:00:13.030197 IP 192.168.43.147.8880 > 192.168.43.124.7773: UDP, length 120
00:00:13.069716 IP 192.168.43.146.8880 > 192.168.43.147.7772: UDP, length 120
00:00:13.080181 IP 192.168.43.147.8880 > 192.168.43.124.7773: UDP, length 120
00:00:13.106612 IP 192.168.43.146.8880 > 192.168.43.147.7772: UDP, length 120
00:00:13.130194 IP 192.168.43.147.8880 > 192.168.43.124.7773: UDP, length 120
00:00:13.165754 IP 192.168.43.146.8880 > 192.168.43.147.7772: UDP, length 120
00:00:13.180183 IP 192.168.43.147.8880 > 192.168.43.124.7773: UDP, length 120
00:00:13.214344 IP 192.168.43.146.8880 > 192.168.43.147.7772: UDP, length 120
00:00:13.230189 IP 192.168.43.147.8880 > 192.168.43.124.7773: UDP, length 120
00:00:13.269926 IP 192.168.43.146.8880 > 192.168.43.147.7772: UDP, length 120
00:00:13.280201 IP 192.168.43.147.8880 > 192.168.43.124.7773: UDP, length 120
00:00:13.314284 IP 192.168.43.146.8880 > 192.168.43.147.7772: UDP, length 120
00:00:13.330186 IP 192.168.43.147.8880 > 192.168.43.124.7773: UDP, length 120
00:00:13.380187 IP 192.168.43.147.8880 > 192.168.43.124.7773: UDP, length 120
00:00:13.382768 IP 192.168.43.146.8880 > 192.168.43.147.7772: UDP, length 120
00:00:13.410169 IP 192.168.43.146.8880 > 192.168.43.147.7772: UDP, length 120
00:00:13.430195 IP 192.168.43.147.8880 > 192.168.43.124.7773: UDP, length 120
00:00:13.461575 IP 192.168.43.146.8880 > 192.168.43.147.7772: UDP, length 120
00:00:13.480194 IP 192.168.43.147.8880 > 192.168.43.124.7773: UDP, length 120
00:00:13.514334 IP 192.168.43.146.8880 > 192.168.43.147.7772: UDP, length 120
00:00:13.530182 IP 192.168.43.147.8880 > 192.168.43.124.7773: UDP, length 120
00:00:13.564684 IP 192.168.43.146.8880 > 192.168.43.147.7772: UDP, length 120
00:00:13.580179 IP 192.168.43.147.8880 > 192.168.43.124.7773: UDP, length 120
00:00:13.616158 IP 192.168.43.146.8880 > 192.168.43.147.7772: UDP, length 120
00:00:13.630181 IP 192.168.43.147.8880 > 192.168.43.124.7773: UDP, length 120
00:00:13.663137 IP 192.168.43.146.8880 > 192.168.43.147.7772: UDP, length 120
00:00:13.680195 IP 192.168.43.147.8880 > 192.168.43.124.7773: UDP, length 120
00:00:13.716645 IP 192.168.43.146.8880 > 192.168.43.147.7772: UDP, length 120
00:00:13.730183 IP 192.168.43.147.8880 > 192.168.43.124.7773: UDP, length 120
00:00:13.760320 IP 192.168.43.146.8880 > 192.168.43.147.7772: UDP, length 120
00:00:13.780179 IP 192.168.43.147.8880 > 192.168.43.124.7773: UDP, length 120
00:00:13.814101 IP 192.168.43.146.8880 > 192.168.43.147.7772: UDP, length 120
00:00:13.830181 IP 192.168.43.147.8880 > 192.168.43.124.7773: UDP, length 120
00:00:13.875093 IP 192.168.43.146.8880 > 192.168.43.147.7772: UDP, length 120
00:00:13.880175 IP 192.168.43.147.8880 > 192.168.43.124.7773: UDP, length 120
00:00:13.921219 IP 192.168.43.146.8880 > 192.168.43.147.7772: UDP, length 120
00:00:13.930181 IP 192.168.43.147.8880 > 192.168.43.124.7773: UDP, length 120
00:00:13.968526 IP 192.168.43.146.8880 > 192.168.43.147.7772: UDP, length 120
00:00:13.980178 IP 192.168.43.147.8880 > 192.168.43.124.7773: UDP, length 120
00:00:14.017466 IP 192.168.43.146.8880 > 192.168.43.147.7772: UDP, length 120
00:00:14.030179 IP 192.168.43.147.8880 > 192.168.43.124.7773: UDP, length 120
00:00:14.064202 IP 192.168.43.146.8880 > 192.168.43.147.7772: UDP, length 120
00:00:14.080182 IP 192.168.43.147.8880 > 192.168.43.124.7773: UDP, length 120
00:00:14.118611 IP 192.168.43.146.8880 > 192.168.43.147.7772: UDP, length 120
00:00:14.130195 IP 192.168.43.147.8880 > 192.168.43.124.7773: UDP, length 120
00:00:14.164533 IP 192.168.43.146.8880 > 192.168.43.147.7772: UDP, length 120
00:00:14.180230 IP 192.168.43.147.8880 > 192.168.43.124.7773: UDP, length 120
