23:14:07.329623 IP 192.168.43.124.8880 > 192.168.43.146.7771: UDP, length 120
23:14:07.379768 IP 192.168.43.124.8880 > 192.168.43.146.7771: UDP, length 120
23:14:07.429767 IP 192.168.43.124.8880 > 192.168.43.146.7771: UDP, length 120
23:14:07.479769 IP 192.168.43.124.8880 > 192.168.43.146.7771: UDP, length 120
23:14:07.529697 IP 192.168.43.124.8880 > 192.168.43.146.7771: UDP, length 120
23:14:07.579704 IP 192.168.43.124.8880 > 192.168.43.146.7771: UDP, length 120
23:14:07.629760 IP 192.168.43.124.8880 > 192.168.43.146.7771: UDP, length 120
23:14:07.679768 IP 192.168.43.124.8880 > 192.168.43.146.7771: UDP, length 120
23:14:07.729768 IP 192.168.43.124.8880 > 192.168.43.146.7771: UDP, length 120
23:14:07.779716 IP 192.168.43.124.8880 > 192.168.43.146.7771: UDP, length 120
23:14:07.829815 IP 192.168.43.124.8880 > 192.168.43.146.7771: UDP, length 120
23:14:07.879773 IP 192.168.43.124.8880 > 192.168.43.146.7771: UDP, length 120
23:14:07.915981 IP 192.168.43.147.8880 > 192.168.43.124.7773: UDP, length 120
23:14:07.929771 IP 192.168.43.124.8880 > 192.168.43.146.7771: UDP, length 120
23:14:07.972156 IP 192.168.43.147.8880 > 192.168.43.124.7773: UDP, length 120
23:14:07.979718 IP 192.168.43.124.8880 > 192.168.43.146.7771: UDP, length 120
23:14:08.015926 IP 192.168.43.147.8880 > 192.168.43.124.7773: UDP, length 120
23:14:08.029740 IP 192.168.43.124.8880 > 192.168.43.146.7771: UDP, length 120
23:14:08.076928 IP 192.168.43.147.8880 > 192.168.43.124.7773: UDP, length 120
23:14:08.079771 IP 192.168.43.124.8880 > 192.168.43.146.7771: UDP, length 120
23:14:08.117228 IP 192.168.43.147.8880 > 192.168.43.124.7773: UDP, length 120
23:14:08.129770 IP 192.168.43.124.8880 > 192.168.43.146.7771: UDP, length 120
23:14:08.176943 IP 192.168.43.147.8880 > 192.168.43.124.7773: UDP, length 120
23:14:08.179767 IP 192.168.43.124.8880 > 192.168.43.146.7771: UDP, length 120
23:14:08.228525 IP 192.168.43.147.8880 > 192.168.43.124.7773: UDP, length 120
23:14:08.229736 IP 192.168.43.124.8880 > 192.168.43.146.7771: UDP, length 120
23:14:08.279768 IP 192.168.43.124.8880 > 192.168.43.146.7771: UDP, length 120
23:14:08.297959 IP 192.168.43.147.8880 > 192.168.43.124.7773: UDP, length 120
23:14:08.318196 IP 192.168.43.147.8880 > 192.168.43.124.7773: UDP, length 120
23:14:08.329767 IP 192.168.43.124.8880 > 192.168.43.146.7771: UDP, length 120
23:14:08.379769 IP 192.168.43.124.8880 > 192.168.43.146.7771: UDP, length 120
23:14:08.380466 IP 192.168.43.147.8880 > 192.168.43.124.7773: UDP, length 120
23:14:08.418951 IP 192.168.43.147.8880 > 192.168.43.124.7773: UDP, length 120
23:14:08.429769 IP 192.168.43.124.8880 > 192.168.43.146.7771: UDP, length 120
23:14:08.467384 IP 192.168.43.147.8880 > 192.168.43.124.7773: UDP, length 120
23:14:08.479769 IP 192.168.43.124.8880 > 192.168.43.146.7771: UDP, length 120
23:14:08.522512 IP 192.168.43.147.8880 > 192.168.43.124.7773: UDP, length 120
23:14:08.529768 IP 192.168.43.124.8880 > 192.168.43.146.7771: UDP, length 120
23:14:08.566956 IP 192.168.43.147.8880 > 192.168.43.124.7773: UDP, length 120
23:14:08.579770 IP 192.168.43.124.8880 > 192.168.43.146.7771: UDP, length 120
23:14:08.625072 IP 192.168.43.147.8880 > 192.168.43.124.7773: UDP, length 120
23:14:08.629767 IP 192.168.43.124.8880 > 192.168.43.146.7771: UDP, length 120
23:14:08.678231 IP 192.168.43.147.8880 > 192.168.43.124.7773: UDP, length 120
23:14:08.679818 IP 192.168.43.124.8880 > 192.168.43.146.7771: UDP, length 120
23:14:08.717989 IP 192.168.43.147.8880 > 192.168.43.124.7773: UDP, length 120
23:14:08.730543 IP 192.168.43.124.8880 > 192.168.43.146.7771: UDP, length 120
23:14:08.766689 IP 192.168.43.147.8880 > 192.168.43.124.7773: UDP, length 120
23:14:08.779720 IP 192.168.43.124.8880 > 192.168.43.146.7771: UDP, length 120
23:14:08.829317 IP 192.168.43.147.8880 > 192.168.43.124.7773: UDP, length 120
23:14:08.829735 IP 192.168.43.124.8880 > 192.168.43.146.7771: UDP, length 120
23:14:08.867220 IP 192.168.43.147.8880 > 192.168.43.124.7773: UDP, length 120
23:14:08.879768 IP 192.168.43.124.8880 > 192.168.43.146.7771: UDP, length 120
23:14:08.917410 IP 192.168.43.147.8880 > 192.168.43.124.7773: UDP, length 120
23:14:08.929769 IP 192.168.43.124.8880 > 192.168.43.146.7771: UDP, length 120
23:14:08.979397 IP 192.168.43.147.8880 > 192.168.43.124.7773: UDP, length 120
23:14:08.979706 IP 192.168.43.124.8880 > 192.168.43.146.7771: UDP, length 120
23:14:09.019697 IP 192.168.43.147.8880 > 192.168.43.124.7773: UDP, length 120
23:14:09.029769 IP 192.168.43.124.8880 > 192.168.43.146.7771: UDP, length 120
23:14:09.064148 IP 192.168.43.147.8880 > 192.168.43.124.7773: UDP, length 120
23:14:09.079767 IP 192.168.43.124.8880 > 192.168.43.146.7771: UDP, length 120
23:14:09.126888 IP 192.168.43.147.8880 > 192.168.43.124.7773: UDP, length 120
23:14:09.129767 IP 192.168.43.124.8880 > 192.168.43.146.7771: UDP, length 120
23:14:09.179769 IP 192.168.43.124.8880 > 192.168.43.146.7771: UDP, length 120
23:14:09.209457 IP 192.168.43.147.8880 > 192.168.43.124.7773: UDP, length 120
23:14:09.217645 IP 192.168.43.147.8880 > 192.168.43.124.7773: UDP, length 120
23:14:09.229768 IP 192.168.43.124.8880 > 192.168.43.146.7771: UDP, length 120
23:14:09.277723 IP 192.168.43.147.8880 > 192.168.43.124.7773: UDP, length 120
23:14:09.279769 IP 192.168.43.124.8880 > 192.168.43.146.7771: UDP, length 120
23:14:09.317504 IP 192.168.43.147.8880 > 192.168.43.124.7773: UDP, length 120
23:14:09.329820 IP 192.168.43.124.8880 > 192.168.43.146.7771: UDP, length 120
23:14:09.366744 IP 192.168.43.147.8880 > 192.168.43.124.7773: UDP, length 120
23:14:09.379773 IP 192.168.43.124.8880 > 192.168.43.146.7771: UDP, length 120
23:14:09.429228 IP 192.168.43.147.8880 > 192.168.43.124.7773: UDP, length 120
23:14:09.429709 IP 192.168.43.124.8880 > 192.168.43.146.7771: UDP, length 120
23:14:09.470261 IP 192.168.43.147.8880 > 192.168.43.124.7773: UDP, length 120
23:14:09.479774 IP 192.168.43.124.8880 > 192.168.43.146.7771: UDP, length 120
23:14:09.516115 IP 192.168.43.147.8880 > 192.168.43.124.7773: UDP, length 120
23:14:09.529774 IP 192.168.43.124.8880 > 192.168.43.146.7771: UDP, length 120
23:14:09.577203 IP 192.168.43.147.8880 > 192.168.43.124.7773: UDP, length 120
23:14:09.579770 IP 192.168.43.124.8880 > 192.168.43.146.7771: UDP, length 120
23:14:09.622916 IP 192.168.43.147.8880 > 192.168.43.124.7773: UDP, length 120
23:14:09.629773 IP 192.168.43.124.8880 > 192.168.43.146.7771: UDP, length 120
23:14:09.664394 IP 192.168.43.147.8880 > 192.168.43.124.7773: UDP, length 120
23:14:09.679773 IP 192.168.43.124.8880 > 192.168.43.146.7771: UDP, length 120
23:14:09.728905 IP 192.168.43.147.8880 > 192.168.43.124.7773: UDP, length 120
23:14:09.729737 IP 192.168.43.124.8880 > 192.168.43.146.7771: UDP, length 120
23:14:09.764110 IP 192.168.43.147.8880 > 192.168.43.124.7773: UDP, length 120
23:14:09.779719 IP 192.168.43.124.8880 > 192.168.43.146.7771: UDP, length 120
23:14:09.815148 IP 192.168.43.147.8880 > 192.168.43.124.7773: UDP, length 120
23:14:09.829774 IP 192.168.43.124.8880 > 192.168.43.146.7771: UDP, length 120
23:14:09.879770 IP 192.168.43.147.8880 > 192.168.43.124.7773: UDP, length 120
23:14:09.879812 IP 192.168.43.124.8880 > 192.168.43.146.7771: UDP, length 120
23:14:09.916929 IP 192.168.43.147.8880 > 192.168.43.124.7773: UDP, length 120
23:14:09.929768 IP 192.168.43.124.8880 > 192.168.43.146.7771: UDP, length 120
23:14:09.967956 IP 192.168.43.147.8880 > 192.168.43.124.7773: UDP, length 120
23:14:09.979695 IP 192.168.43.124.8880 > 192.168.43.146.7771: UDP, length 120
23:14:10.029573 IP 192.168.43.147.8880 > 192.168.43.124.7773: UDP, length 120
23:14:10.029719 IP 192.168.43.124.8880 > 192.168.43.146.7771: UDP, length 120
23:14:10.064241 IP 192.168.43.147.8880 > 192.168.43.124.7773: UDP, length 120
23:14:10.079767 IP 192.168.43.124.8880 > 192.168.43.146.7771: UDP, length 120
23:14:10.118467 IP 192.168.43.147.8880 > 192.168.43.124.7773: UDP, length 120
23:14:10.129768 IP 192.168.43.124.8880 > 192.168.43.146.7771: UDP, length 120
23:14:10.173697 IP 192.168.43.147.8880 > 192.168.43.124.7773: UDP, length 120
23:14:10.179767 IP 192.168.43.124.8880 > 192.168.43.146.7771: UDP, length 120
23:14:10.227787 IP 192.168.43.147.8880 > 192.168.43.124.7773: UDP, length 120
23:14:10.229767 IP 192.168.43.124.8880 > 192.168.43.146.7771: UDP, length 120
23:14:10.269326 IP 192.168.43.147.8880 > 192.168.43.124.7773: UDP, length 120
23:14:10.279768 IP 192.168.43.124.8880 > 192.168.43.146.7771: UDP, length 120
23:14:10.315282 IP 192.168.43.147.8880 > 192.168.43.124.7773: UDP, length 120
23:14:10.329768 IP 192.168.43.124.8880 > 192.168.43.146.7771: UDP, length 120
23:14:10.370455 IP 192.168.43.147.8880 > 192.168.43.124.7773: UDP, length 120
23:14:10.379812 IP 192.168.43.124.8880 > 192.168.43.146.7771: UDP, length 120
23:14:10.429810 IP 192.168.43.124.8880 > 192.168.43.146.7771: UDP, length 120
23:14:10.442162 IP 192.168.43.147.8880 > 192.168.43.124.7773: UDP, length 120
23:14:10.468506 IP 192.168.43.147.8880 > 192.168.43.124.7773: UDP, length 120
23:14:10.479770 IP 192.168.43.124.8880 > 192.168.43.146.7771: UDP, length 120
23:14:10.518079 IP 192.168.43.147.8880 > 192.168.43.124.7773: UDP, length 120
23:14:10.529769 IP 192.168.43.124.8880 > 192.168.43.146.7771: UDP, length 120
23:14:10.579769 IP 192.168.43.124.8880 > 192.168.43.146.7771: UDP, length 120
23:14:10.581787 IP 192.168.43.147.8880 > 192.168.43.124.7773: UDP, length 120
23:14:10.620297 IP 192.168.43.147.8880 > 192.168.43.124.7773: UDP, length 120
23:14:10.629769 IP 192.168.43.124.8880 > 192.168.43.146.7771: UDP, length 120
23:14:10.672971 IP 192.168.43.147.8880 > 192.168.43.124.7773: UDP, length 120
23:14:10.679769 IP 192.168.43.124.8880 > 192.168.43.146.7771: UDP, length 120
23:14:10.728986 IP 192.168.43.147.8880 > 192.168.43.124.7773: UDP, length 120
23:14:10.729766 IP 192.168.43.124.8880 > 192.168.43.146.7771: UDP, length 120
23:14:10.779807 IP 192.168.43.124.8880 > 192.168.43.146.7771: UDP, length 120
23:14:10.799753 IP 192.168.43.147.8880 > 192.168.43.124.7773: UDP, length 120
23:14:10.829025 IP 192.168.43.147.8880 > 192.168.43.124.7773: UDP, length 120
23:14:10.829815 IP 192.168.43.124.8880 > 192.168.43.146.7771: UDP, length 120
23:14:10.878692 IP 192.168.43.147.8880 > 192.168.43.124.7773: UDP, length 120
23:14:10.879768 IP 192.168.43.124.8880 > 192.168.43.146.7771: UDP, length 120
23:14:10.929768 IP 192.168.43.124.8880 > 192.168.43.146.7771: UDP, length 120
23:14:10.947506 IP 192.168.43.147.8880 > 192.168.43.124.7773: UDP, length 120
23:14:10.979767 IP 192.168.43.124.8880 > 192.168.43.146.7771: UDP, length 120
23:14:10.982432 IP 192.168.43.147.8880 > 192.168.43.124.7773: UDP, length 120
23:14:11.029304 IP 192.168.43.147.8880 > 192.168.43.124.7773: UDP, length 120
23:14:11.029767 IP 192.168.43.124.8880 > 192.168.43.146.7771: UDP, length 120
23:14:11.079768 IP 192.168.43.124.8880 > 192.168.43.146.7771: UDP, length 120
23:14:11.082746 IP 192.168.43.147.8880 > 192.168.43.124.7773: UDP, length 120
23:14:11.114660 IP 192.168.43.147.8880 > 192.168.43.124.7773: UDP, length 120
23:14:11.129768 IP 192.168.43.124.8880 > 192.168.43.146.7771: UDP, length 120
23:14:11.179767 IP 192.168.43.124.8880 > 192.168.43.146.7771: UDP, length 120
23:14:11.196914 IP 192.168.43.147.8880 > 192.168.43.124.7773: UDP, length 120
23:14:11.218031 IP 192.168.43.147.8880 > 192.168.43.124.7773: UDP, length 120
23:14:11.229768 IP 192.168.43.124.8880 > 192.168.43.146.7771: UDP, length 120
23:14:11.277380 IP 192.168.43.147.8880 > 192.168.43.124.7773: UDP, length 120
23:14:11.279768 IP 192.168.43.124.8880 > 192.168.43.146.7771: UDP, length 120
23:14:11.317569 IP 192.168.43.147.8880 > 192.168.43.124.7773: UDP, length 120
23:14:11.329767 IP 192.168.43.124.8880 > 192.168.43.146.7771: UDP, length 120
23:14:11.366283 IP 192.168.43.147.8880 > 192.168.43.124.7773: UDP, length 120
23:14:11.379769 IP 192.168.43.124.8880 > 192.168.43.146.7771: UDP, length 120
23:14:11.427443 IP 192.168.43.147.8880 > 192.168.43.124.7773: UDP, length 120
23:14:11.429768 IP 192.168.43.124.8880 > 192.168.43.146.7771: UDP, length 120
23:14:11.468323 IP 192.168.43.147.8880 > 192.168.43.124.7773: UDP, length 120
23:14:11.479769 IP 192.168.43.124.8880 > 192.168.43.146.7771: UDP, length 120
23:14:11.518537 IP 192.168.43.147.8880 > 192.168.43.124.7773: UDP, length 120
23:14:11.529767 IP 192.168.43.124.8880 > 192.168.43.146.7771: UDP, length 120
23:14:11.579355 IP 192.168.43.147.8880 > 192.168.43.124.7773: UDP, length 120
23:14:11.579768 IP 192.168.43.124.8880 > 192.168.43.146.7771: UDP, length 120
23:14:11.620135 IP 192.168.43.147.8880 > 192.168.43.124.7773: UDP, length 120
23:14:11.629768 IP 192.168.43.124.8880 > 192.168.43.146.7771: UDP, length 120
23:14:11.666856 IP 192.168.43.147.8880 > 192.168.43.124.7773: UDP, length 120
23:14:11.679770 IP 192.168.43.124.8880 > 192.168.43.146.7771: UDP, length 120
23:14:11.729768 IP 192.168.43.124.8880 > 192.168.43.146.7771: UDP, length 120
23:14:11.734566 IP 192.168.43.147.8880 > 192.168.43.124.7773: UDP, length 120
23:14:11.764534 IP 192.168.43.147.8880 > 192.168.43.124.7773: UDP, length 120
23:14:11.779769 IP 192.168.43.124.8880 > 192.168.43.146.7771: UDP, length 120
23:14:11.814255 IP 192.168.43.147.8880 > 192.168.43.124.7773: UDP, length 120
23:14:11.829820 IP 192.168.43.124.8880 > 192.168.43.146.7771: UDP, length 120
23:14:11.877519 IP 192.168.43.147.8880 > 192.168.43.124.7773: UDP, length 120
23:14:11.879697 IP 192.168.43.124.8880 > 192.168.43.146.7771: UDP, length 120
23:14:11.917249 IP 192.168.43.147.8880 > 192.168.43.124.7773: UDP, length 120
23:14:11.929768 IP 192.168.43.124.8880 > 192.168.43.146.7771: UDP, length 120
23:14:11.965175 IP 192.168.43.147.8880 > 192.168.43.124.7773: UDP, length 120
23:14:11.979720 IP 192.168.43.124.8880 > 192.168.43.146.7771: UDP, length 120
23:14:12.027317 IP 192.168.43.147.8880 > 192.168.43.124.7773: UDP, length 120
23:14:12.029767 IP 192.168.43.124.8880 > 192.168.43.146.7771: UDP, length 120
23:14:12.067479 IP 192.168.43.147.8880 > 192.168.43.124.7773: UDP, length 120
23:14:12.079767 IP 192.168.43.124.8880 > 192.168.43.146.7771: UDP, length 120
23:14:12.121999 IP 192.168.43.147.8880 > 192.168.43.124.7773: UDP, length 120
23:14:12.129767 IP 192.168.43.124.8880 > 192.168.43.146.7771: UDP, length 120
23:14:12.179047 IP 192.168.43.147.8880 > 192.168.43.124.7773: UDP, length 120
23:14:12.179767 IP 192.168.43.124.8880 > 192.168.43.146.7771: UDP, length 120
23:14:12.220041 IP 192.168.43.147.8880 > 192.168.43.124.7773: UDP, length 120
23:14:12.229768 IP 192.168.43.124.8880 > 192.168.43.146.7771: UDP, length 120
23:14:12.265948 IP 192.168.43.147.8880 > 192.168.43.124.7773: UDP, length 120
23:14:12.279768 IP 192.168.43.124.8880 > 192.168.43.146.7771: UDP, length 120
23:14:12.317864 IP 192.168.43.147.8880 > 192.168.43.124.7773: UDP, length 120
23:14:12.329767 IP 192.168.43.124.8880 > 192.168.43.146.7771: UDP, length 120
23:14:12.367651 IP 192.168.43.147.8880 > 192.168.43.124.7773: UDP, length 120
23:14:12.379817 IP 192.168.43.124.8880 > 192.168.43.146.7771: UDP, length 120
23:14:12.419858 IP 192.168.43.147.8880 > 192.168.43.124.7773: UDP, length 120
23:14:12.429819 IP 192.168.43.124.8880 > 192.168.43.146.7771: UDP, length 120
23:14:12.468936 IP 192.168.43.147.8880 > 192.168.43.124.7773: UDP, length 120
23:14:12.479755 IP 192.168.43.124.8880 > 192.168.43.146.7771: UDP, length 120
23:14:12.520972 IP 192.168.43.147.8880 > 192.168.43.124.7773: UDP, length 120
23:14:12.529820 IP 192.168.43.124.8880 > 192.168.43.146.7771: UDP, length 120
23:14:12.569571 IP 192.168.43.147.8880 > 192.168.43.124.7773: UDP, length 120
23:14:12.579818 IP 192.168.43.124.8880 > 192.168.43.146.7771: UDP, length 120
23:14:12.620238 IP 192.168.43.147.8880 > 192.168.43.124.7773: UDP, length 120
23:14:12.629734 IP 192.168.43.124.8880 > 192.168.43.146.7771: UDP, length 120
23:14:12.671428 IP 192.168.43.147.8880 > 192.168.43.124.7773: UDP, length 120
23:14:12.679700 IP 192.168.43.124.8880 > 192.168.43.146.7771: UDP, length 120
23:14:12.724281 IP 192.168.43.147.8880 > 192.168.43.124.7773: UDP, length 120
23:14:12.729713 IP 192.168.43.124.8880 > 192.168.43.146.7771: UDP, length 120
23:14:12.771044 IP 192.168.43.147.8880 > 192.168.43.124.7773: UDP, length 120
23:14:12.779767 IP 192.168.43.124.8880 > 192.168.43.146.7771: UDP, length 120
23:14:12.823948 IP 192.168.43.147.8880 > 192.168.43.124.7773: UDP, length 120
23:14:12.829769 IP 192.168.43.124.8880 > 192.168.43.146.7771: UDP, length 120
23:14:12.876570 IP 192.168.43.147.8880 > 192.168.43.124.7773: UDP, length 120
23:14:12.879768 IP 192.168.43.124.8880 > 192.168.43.146.7771: UDP, length 120
23:14:12.925724 IP 192.168.43.147.8880 > 192.168.43.124.7773: UDP, length 120
23:14:12.929768 IP 192.168.43.124.8880 > 192.168.43.146.7771: UDP, length 120
23:14:12.965697 IP 192.168.43.147.8880 > 192.168.43.124.7773: UDP, length 120
23:14:12.979768 IP 192.168.43.124.8880 > 192.168.43.146.7771: UDP, length 120
23:14:13.029439 IP 192.168.43.147.8880 > 192.168.43.124.7773: UDP, length 120
23:14:13.029732 IP 192.168.43.124.8880 > 192.168.43.146.7771: UDP, length 120
23:14:13.068781 IP 192.168.43.147.8880 > 192.168.43.124.7773: UDP, length 120
23:14:13.079769 IP 192.168.43.124.8880 > 192.168.43.146.7771: UDP, length 120
23:14:13.118608 IP 192.168.43.147.8880 > 192.168.43.124.7773: UDP, length 120
23:14:13.129769 IP 192.168.43.124.8880 > 192.168.43.146.7771: UDP, length 120
23:14:13.173673 IP 192.168.43.147.8880 > 192.168.43.124.7773: UDP, length 120
23:14:13.179767 IP 192.168.43.124.8880 > 192.168.43.146.7771: UDP, length 120
23:14:13.219129 IP 192.168.43.147.8880 > 192.168.43.124.7773: UDP, length 120
23:14:13.229768 IP 192.168.43.124.8880 > 192.168.43.146.7771: UDP, length 120
23:14:13.270876 IP 192.168.43.147.8880 > 192.168.43.124.7773: UDP, length 120
23:14:13.279768 IP 192.168.43.124.8880 > 192.168.43.146.7771: UDP, length 120
23:14:13.315963 IP 192.168.43.147.8880 > 192.168.43.124.7773: UDP, length 120
23:14:13.329790 IP 192.168.43.124.8880 > 192.168.43.146.7771: UDP, length 120
23:14:13.370955 IP 192.168.43.147.8880 > 192.168.43.124.7773: UDP, length 120
23:14:13.379789 IP 192.168.43.124.8880 > 192.168.43.146.7771: UDP, length 120
23:14:13.421804 IP 192.168.43.147.8880 > 192.168.43.124.7773: UDP, length 120
23:14:13.429789 IP 192.168.43.124.8880 > 192.168.43.146.7771: UDP, length 120
23:14:13.473509 IP 192.168.43.147.8880 > 192.168.43.124.7773: UDP, length 120
23:14:13.479818 IP 192.168.43.124.8880 > 192.168.43.146.7771: UDP, length 120
23:14:13.516291 IP 192.168.43.147.8880 > 192.168.43.124.7773: UDP, length 120
23:14:13.529769 IP 192.168.43.124.8880 > 192.168.43.146.7771: UDP, length 120
23:14:13.571111 IP 192.168.43.147.8880 > 192.168.43.124.7773: UDP, length 120
23:14:13.579768 IP 192.168.43.124.8880 > 192.168.43.146.7771: UDP, length 120
23:14:13.618964 IP 192.168.43.147.8880 > 192.168.43.124.7773: UDP, length 120
23:14:13.629767 IP 192.168.43.124.8880 > 192.168.43.146.7771: UDP, length 120
23:14:13.669231 IP 192.168.43.147.8880 > 192.168.43.124.7773: UDP, length 120
23:14:13.679767 IP 192.168.43.124.8880 > 192.168.43.146.7771: UDP, length 120
23:14:13.719818 IP 192.168.43.147.8880 > 192.168.43.124.7773: UDP, length 120
23:14:13.729767 IP 192.168.43.124.8880 > 192.168.43.146.7771: UDP, length 120
23:14:13.772349 IP 192.168.43.147.8880 > 192.168.43.124.7773: UDP, length 120
23:14:13.779770 IP 192.168.43.124.8880 > 192.168.43.146.7771: UDP, length 120
23:14:13.823477 IP 192.168.43.147.8880 > 192.168.43.124.7773: UDP, length 120
23:14:13.829769 IP 192.168.43.124.8880 > 192.168.43.146.7771: UDP, length 120
23:14:13.869903 IP 192.168.43.147.8880 > 192.168.43.124.7773: UDP, length 120
23:14:13.879767 IP 192.168.43.124.8880 > 192.168.43.146.7771: UDP, length 120
23:14:13.919407 IP 192.168.43.147.8880 > 192.168.43.124.7773: UDP, length 120
23:14:13.929768 IP 192.168.43.124.8880 > 192.168.43.146.7771: UDP, length 120
23:14:13.970568 IP 192.168.43.147.8880 > 192.168.43.124.7773: UDP, length 120
23:14:13.979767 IP 192.168.43.124.8880 > 192.168.43.146.7771: UDP, length 120
23:14:14.019283 IP 192.168.43.147.8880 > 192.168.43.124.7773: UDP, length 120
23:14:14.029817 IP 192.168.43.124.8880 > 192.168.43.146.7771: UDP, length 120
23:14:14.070101 IP 192.168.43.147.8880 > 192.168.43.124.7773: UDP, length 120
23:14:14.079817 IP 192.168.43.124.8880 > 192.168.43.146.7771: UDP, length 120
23:14:14.118950 IP 192.168.43.147.8880 > 192.168.43.124.7773: UDP, length 120
23:14:14.129770 IP 192.168.43.124.8880 > 192.168.43.146.7771: UDP, length 120
23:14:14.167305 IP 192.168.43.147.8880 > 192.168.43.124.7773: UDP, length 120
23:14:14.179770 IP 192.168.43.124.8880 > 192.168.43.146.7771: UDP, length 120
23:14:14.217946 IP 192.168.43.147.8880 > 192.168.43.124.7773: UDP, length 120
23:14:14.229768 IP 192.168.43.124.8880 > 192.168.43.146.7771: UDP, length 120
23:14:14.265662 IP 192.168.43.147.8880 > 192.168.43.124.7773: UDP, length 120
23:14:14.279768 IP 192.168.43.124.8880 > 192.168.43.146.7771: UDP, length 120
23:14:14.320012 IP 192.168.43.147.8880 > 192.168.43.124.7773: UDP, length 120
23:14:14.329729 IP 192.168.43.124.8880 > 192.168.43.146.7771: UDP, length 120
23:14:14.368022 IP 192.168.43.147.8880 > 192.168.43.124.7773: UDP, length 120
23:14:14.379767 IP 192.168.43.124.8880 > 192.168.43.146.7771: UDP, length 120
23:14:14.423541 IP 192.168.43.147.8880 > 192.168.43.124.7773: UDP, length 120
23:14:14.429817 IP 192.168.43.124.8880 > 192.168.43.146.7771: UDP, length 120
23:14:14.466639 IP 192.168.43.147.8880 > 192.168.43.124.7773: UDP, length 120
23:14:14.479818 IP 192.168.43.124.8880 > 192.168.43.146.7771: UDP, length 120
23:14:14.517512 IP 192.168.43.147.8880 > 192.168.43.124.7773: UDP, length 120
23:14:14.529819 IP 192.168.43.124.8880 > 192.168.43.146.7771: UDP, length 120
23:14:14.571330 IP 192.168.43.147.8880 > 192.168.43.124.7773: UDP, length 120
23:14:14.579819 IP 192.168.43.124.8880 > 192.168.43.146.7771: UDP, length 120
23:14:14.621958 IP 192.168.43.147.8880 > 192.168.43.124.7773: UDP, length 120
23:14:14.629818 IP 192.168.43.124.8880 > 192.168.43.146.7771: UDP, length 120
23:14:14.672936 IP 192.168.43.147.8880 > 192.168.43.124.7773: UDP, length 120
23:14:14.679818 IP 192.168.43.124.8880 > 192.168.43.146.7771: UDP, length 120
23:14:14.718383 IP 192.168.43.147.8880 > 192.168.43.124.7773: UDP, length 120
23:14:14.729818 IP 192.168.43.124.8880 > 192.168.43.146.7771: UDP, length 120
23:14:14.767858 IP 192.168.43.147.8880 > 192.168.43.124.7773: UDP, length 120
23:14:14.779815 IP 192.168.43.124.8880 > 192.168.43.146.7771: UDP, length 120
23:14:14.820120 IP 192.168.43.147.8880 > 192.168.43.124.7773: UDP, length 120
23:14:14.829773 IP 192.168.43.124.8880 > 192.168.43.146.7771: UDP, length 120
23:14:14.870350 IP 192.168.43.147.8880 > 192.168.43.124.7773: UDP, length 120
23:14:14.879768 IP 192.168.43.124.8880 > 192.168.43.146.7771: UDP, length 120
23:14:14.929772 IP 192.168.43.124.8880 > 192.168.43.146.7771: UDP, length 120
23:14:14.930838 IP 192.168.43.147.8880 > 192.168.43.124.7773: UDP, length 120
23:14:14.979772 IP 192.168.43.124.8880 > 192.168.43.146.7771: UDP, length 120
23:14:14.985831 IP 192.168.43.147.8880 > 192.168.43.124.7773: UDP, length 120
23:14:15.018439 IP 192.168.43.147.8880 > 192.168.43.124.7773: UDP, length 120
23:14:15.029771 IP 192.168.43.124.8880 > 192.168.43.146.7771: UDP, length 120
23:14:15.064726 IP 192.168.43.147.8880 > 192.168.43.124.7773: UDP, length 120
23:14:15.079770 IP 192.168.43.124.8880 > 192.168.43.146.7771: UDP, length 120
23:14:15.129771 IP 192.168.43.124.8880 > 192.168.43.146.7771: UDP, length 120
23:14:15.130223 IP 192.168.43.147.8880 > 192.168.43.124.7773: UDP, length 120
23:14:15.177679 IP 192.168.43.147.8880 > 192.168.43.124.7773: UDP, length 120
23:14:15.179770 IP 192.168.43.124.8880 > 192.168.43.146.7771: UDP, length 120
23:14:15.229160 IP 192.168.43.147.8880 > 192.168.43.124.7773: UDP, length 120
23:14:15.229771 IP 192.168.43.124.8880 > 192.168.43.146.7771: UDP, length 120
23:14:15.279771 IP 192.168.43.124.8880 > 192.168.43.146.7771: UDP, length 120
23:14:15.283518 IP 192.168.43.147.8880 > 192.168.43.124.7773: UDP, length 120
23:14:15.318906 IP 192.168.43.147.8880 > 192.168.43.124.7773: UDP, length 120
23:14:15.329771 IP 192.168.43.124.8880 > 192.168.43.146.7771: UDP, length 120
23:14:15.364385 IP 192.168.43.147.8880 > 192.168.43.124.7773: UDP, length 120
23:14:15.379768 IP 192.168.43.124.8880 > 192.168.43.146.7771: UDP, length 120
23:14:15.421463 IP 192.168.43.147.8880 > 192.168.43.124.7773: UDP, length 120
23:14:15.429766 IP 192.168.43.124.8880 > 192.168.43.146.7771: UDP, length 120
23:14:15.475379 IP 192.168.43.147.8880 > 192.168.43.124.7773: UDP, length 120
23:14:15.479769 IP 192.168.43.124.8880 > 192.168.43.146.7771: UDP, length 120
23:14:15.529700 IP 192.168.43.124.8880 > 192.168.43.146.7771: UDP, length 120
23:14:15.530743 IP 192.168.43.147.8880 > 192.168.43.124.7773: UDP, length 120
23:14:15.579771 IP 192.168.43.124.8880 > 192.168.43.146.7771: UDP, length 120
23:14:15.587915 IP 192.168.43.147.8880 > 192.168.43.124.7773: UDP, length 120
23:14:15.618098 IP 192.168.43.147.8880 > 192.168.43.124.7773: UDP, length 120
23:14:15.629821 IP 192.168.43.124.8880 > 192.168.43.146.7771: UDP, length 120
23:14:15.668700 IP 192.168.43.147.8880 > 192.168.43.124.7773: UDP, length 120
23:14:15.679820 IP 192.168.43.124.8880 > 192.168.43.146.7771: UDP, length 120
23:14:15.722352 IP 192.168.43.147.8880 > 192.168.43.124.7773: UDP, length 120
23:14:15.729818 IP 192.168.43.124.8880 > 192.168.43.146.7771: UDP, length 120
23:14:15.766271 IP 192.168.43.147.8880 > 192.168.43.124.7773: UDP, length 120
23:14:15.779817 IP 192.168.43.124.8880 > 192.168.43.146.7771: UDP, length 120
23:14:15.828845 IP 192.168.43.147.8880 > 192.168.43.124.7773: UDP, length 120
23:14:15.829773 IP 192.168.43.124.8880 > 192.168.43.146.7771: UDP, length 120
23:14:15.879714 IP 192.168.43.124.8880 > 192.168.43.146.7771: UDP, length 120
23:14:15.881430 IP 192.168.43.147.8880 > 192.168.43.124.7773: UDP, length 120
23:14:15.929767 IP 192.168.43.124.8880 > 192.168.43.146.7771: UDP, length 120
23:14:15.937521 IP 192.168.43.147.8880 > 192.168.43.124.7773: UDP, length 120
23:14:15.972201 IP 192.168.43.147.8880 > 192.168.43.124.7773: UDP, length 120
23:14:15.979768 IP 192.168.43.124.8880 > 192.168.43.146.7771: UDP, length 120
23:14:16.017888 IP 192.168.43.147.8880 > 192.168.43.124.7773: UDP, length 120
23:14:16.029769 IP 192.168.43.124.8880 > 192.168.43.146.7771: UDP, length 120
23:14:16.067833 IP 192.168.43.147.8880 > 192.168.43.124.7773: UDP, length 120
23:14:16.079766 IP 192.168.43.124.8880 > 192.168.43.146.7771: UDP, length 120
23:14:16.120368 IP 192.168.43.147.8880 > 192.168.43.124.7773: UDP, length 120
23:14:16.129767 IP 192.168.43.124.8880 > 192.168.43.146.7771: UDP, length 120
23:14:16.165521 IP 192.168.43.147.8880 > 192.168.43.124.7773: UDP, length 120
23:14:16.179766 IP 192.168.43.124.8880 > 192.168.43.146.7771: UDP, length 120
23:14:16.218057 IP 192.168.43.147.8880 > 192.168.43.124.7773: UDP, length 120
23:14:16.229769 IP 192.168.43.124.8880 > 192.168.43.146.7771: UDP, length 120
23:14:16.277145 IP 192.168.43.147.8880 > 192.168.43.124.7773: UDP, length 120
23:14:16.279768 IP 192.168.43.124.8880 > 192.168.43.146.7771: UDP, length 120
23:14:16.329767 IP 192.168.43.124.8880 > 192.168.43.146.7771: UDP, length 120
23:14:16.334101 IP 192.168.43.147.8880 > 192.168.43.124.7773: UDP, length 120
23:14:16.365551 IP 192.168.43.147.8880 > 192.168.43.124.7773: UDP, length 120
23:14:16.379768 IP 192.168.43.124.8880 > 192.168.43.146.7771: UDP, length 120
23:14:16.418853 IP 192.168.43.147.8880 > 192.168.43.124.7773: UDP, length 120
23:14:16.429768 IP 192.168.43.124.8880 > 192.168.43.146.7771: UDP, length 120
23:14:16.465165 IP 192.168.43.147.8880 > 192.168.43.124.7773: UDP, length 120
23:14:16.479816 IP 192.168.43.124.8880 > 192.168.43.146.7771: UDP, length 120
23:14:16.514175 IP 192.168.43.147.8880 > 192.168.43.124.7773: UDP, length 120
23:14:16.529771 IP 192.168.43.124.8880 > 192.168.43.146.7771: UDP, length 120
23:14:16.570219 IP 192.168.43.147.8880 > 192.168.43.124.7773: UDP, length 120
23:14:16.579771 IP 192.168.43.124.8880 > 192.168.43.146.7771: UDP, length 120
23:14:16.618295 IP 192.168.43.147.8880 > 192.168.43.124.7773: UDP, length 120
23:14:16.629773 IP 192.168.43.124.8880 > 192.168.43.146.7771: UDP, length 120
23:14:16.668057 IP 192.168.43.147.8880 > 192.168.43.124.7773: UDP, length 120
23:14:16.679771 IP 192.168.43.124.8880 > 192.168.43.146.7771: UDP, length 120
23:14:16.717353 IP 192.168.43.147.8880 > 192.168.43.124.7773: UDP, length 120
23:14:16.729772 IP 192.168.43.124.8880 > 192.168.43.146.7771: UDP, length 120
23:14:16.777772 IP 192.168.43.147.8880 > 192.168.43.124.7773: UDP, length 120
23:14:16.779767 IP 192.168.43.124.8880 > 192.168.43.146.7771: UDP, length 120
23:14:16.829817 IP 192.168.43.124.8880 > 192.168.43.146.7771: UDP, length 120
23:14:16.832117 IP 192.168.43.147.8880 > 192.168.43.124.7773: UDP, length 120
23:14:16.869885 IP 192.168.43.147.8880 > 192.168.43.124.7773: UDP, length 120
23:14:16.879717 IP 192.168.43.124.8880 > 192.168.43.146.7771: UDP, length 120
23:14:16.926359 IP 192.168.43.147.8880 > 192.168.43.124.7773: UDP, length 120
23:14:16.929767 IP 192.168.43.124.8880 > 192.168.43.146.7771: UDP, length 120
23:14:16.979769 IP 192.168.43.124.8880 > 192.168.43.146.7771: UDP, length 120
23:14:16.982609 IP 192.168.43.147.8880 > 192.168.43.124.7773: UDP, length 120
23:14:17.029771 IP 192.168.43.124.8880 > 192.168.43.146.7771: UDP, length 120
23:14:17.035647 IP 192.168.43.147.8880 > 192.168.43.124.7773: UDP, length 120
23:14:17.067605 IP 192.168.43.147.8880 > 192.168.43.124.7773: UDP, length 120
23:14:17.079768 IP 192.168.43.124.8880 > 192.168.43.146.7771: UDP, length 120
23:14:17.122794 IP 192.168.43.147.8880 > 192.168.43.124.7773: UDP, length 120
23:14:17.129769 IP 192.168.43.124.8880 > 192.168.43.146.7771: UDP, length 120
23:14:17.165176 IP 192.168.43.147.8880 > 192.168.43.124.7773: UDP, length 120
23:14:17.179773 IP 192.168.43.124.8880 > 192.168.43.146.7771: UDP, length 120
23:14:17.226357 IP 192.168.43.147.8880 > 192.168.43.124.7773: UDP, length 120
23:14:17.229769 IP 192.168.43.124.8880 > 192.168.43.146.7771: UDP, length 120
23:14:17.279769 IP 192.168.43.124.8880 > 192.168.43.146.7771: UDP, length 120
23:14:17.280515 IP 192.168.43.147.8880 > 192.168.43.124.7773: UDP, length 120
23:14:17.329768 IP 192.168.43.124.8880 > 192.168.43.146.7771: UDP, length 120
23:14:17.334361 IP 192.168.43.147.8880 > 192.168.43.124.7773: UDP, length 120
23:14:17.367434 IP 192.168.43.147.8880 > 192.168.43.124.7773: UDP, length 120
23:14:17.379769 IP 192.168.43.124.8880 > 192.168.43.146.7771: UDP, length 120
23:14:17.416397 IP 192.168.43.147.8880 > 192.168.43.124.7773: UDP, length 120
23:14:17.429762 IP 192.168.43.124.8880 > 192.168.43.146.7771: UDP, length 120
23:14:17.469364 IP 192.168.43.147.8880 > 192.168.43.124.7773: UDP, length 120
23:14:17.479734 IP 192.168.43.124.8880 > 192.168.43.146.7771: UDP, length 120
23:14:17.529770 IP 192.168.43.124.8880 > 192.168.43.146.7771: UDP, length 120
23:14:17.534539 IP 192.168.43.147.8880 > 192.168.43.124.7773: UDP, length 120
23:14:17.579767 IP 192.168.43.124.8880 > 192.168.43.146.7771: UDP, length 120
23:14:17.583285 IP 192.168.43.147.8880 > 192.168.43.124.7773: UDP, length 120
23:14:17.623556 IP 192.168.43.147.8880 > 192.168.43.124.7773: UDP, length 120
23:14:17.629768 IP 192.168.43.124.8880 > 192.168.43.146.7771: UDP, length 120
23:14:17.665222 IP 192.168.43.147.8880 > 192.168.43.124.7773: UDP, length 120
23:14:17.679769 IP 192.168.43.124.8880 > 192.168.43.146.7771: UDP, length 120
23:14:17.718570 IP 192.168.43.147.8880 > 192.168.43.124.7773: UDP, length 120
23:14:17.729740 IP 192.168.43.124.8880 > 192.168.43.146.7771: UDP, length 120
23:14:17.767146 IP 192.168.43.147.8880 > 192.168.43.124.7773: UDP, length 120
23:14:17.779702 IP 192.168.43.124.8880 > 192.168.43.146.7771: UDP, length 120
23:14:17.814886 IP 192.168.43.147.8880 > 192.168.43.124.7773: UDP, length 120
23:14:17.829734 IP 192.168.43.124.8880 > 192.168.43.146.7771: UDP, length 120
23:14:17.869524 IP 192.168.43.147.8880 > 192.168.43.124.7773: UDP, length 120
23:14:17.879716 IP 192.168.43.124.8880 > 192.168.43.146.7771: UDP, length 120
23:14:17.928786 IP 192.168.43.147.8880 > 192.168.43.124.7773: UDP, length 120
23:14:17.929767 IP 192.168.43.124.8880 > 192.168.43.146.7771: UDP, length 120
23:14:17.968530 IP 192.168.43.147.8880 > 192.168.43.124.7773: UDP, length 120
23:14:17.979767 IP 192.168.43.124.8880 > 192.168.43.146.7771: UDP, length 120
23:14:18.018268 IP 192.168.43.147.8880 > 192.168.43.124.7773: UDP, length 120
23:14:18.029766 IP 192.168.43.124.8880 > 192.168.43.146.7771: UDP, length 120
23:14:18.079769 IP 192.168.43.124.8880 > 192.168.43.146.7771: UDP, length 120
23:14:18.081123 IP 192.168.43.147.8880 > 192.168.43.124.7773: UDP, length 120
23:14:18.120768 IP 192.168.43.147.8880 > 192.168.43.124.7773: UDP, length 120
23:14:18.129767 IP 192.168.43.124.8880 > 192.168.43.146.7771: UDP, length 120
23:14:18.164307 IP 192.168.43.147.8880 > 192.168.43.124.7773: UDP, length 120
23:14:18.179768 IP 192.168.43.124.8880 > 192.168.43.146.7771: UDP, length 120
23:14:18.228052 IP 192.168.43.147.8880 > 192.168.43.124.7773: UDP, length 120
23:14:18.229766 IP 192.168.43.124.8880 > 192.168.43.146.7771: UDP, length 120
23:14:18.267568 IP 192.168.43.147.8880 > 192.168.43.124.7773: UDP, length 120
23:14:18.279769 IP 192.168.43.124.8880 > 192.168.43.146.7771: UDP, length 120
23:14:18.314266 IP 192.168.43.147.8880 > 192.168.43.124.7773: UDP, length 120
23:14:18.329767 IP 192.168.43.124.8880 > 192.168.43.146.7771: UDP, length 120
23:14:18.368313 IP 192.168.43.147.8880 > 192.168.43.124.7773: UDP, length 120
23:14:18.379819 IP 192.168.43.124.8880 > 192.168.43.146.7771: UDP, length 120
23:14:18.429818 IP 192.168.43.124.8880 > 192.168.43.146.7771: UDP, length 120
23:14:18.439768 IP 192.168.43.147.8880 > 192.168.43.124.7773: UDP, length 120
23:14:18.466438 IP 192.168.43.147.8880 > 192.168.43.124.7773: UDP, length 120
23:14:18.479818 IP 192.168.43.124.8880 > 192.168.43.146.7771: UDP, length 120
23:14:18.519122 IP 192.168.43.147.8880 > 192.168.43.124.7773: UDP, length 120
23:14:18.529816 IP 192.168.43.124.8880 > 192.168.43.146.7771: UDP, length 120
23:14:18.571548 IP 192.168.43.147.8880 > 192.168.43.124.7773: UDP, length 120
23:14:18.579748 IP 192.168.43.124.8880 > 192.168.43.146.7771: UDP, length 120
23:14:18.621484 IP 192.168.43.147.8880 > 192.168.43.124.7773: UDP, length 120
23:14:18.629791 IP 192.168.43.124.8880 > 192.168.43.146.7771: UDP, length 120
23:14:18.669532 IP 192.168.43.147.8880 > 192.168.43.124.7773: UDP, length 120
23:14:18.679819 IP 192.168.43.124.8880 > 192.168.43.146.7771: UDP, length 120
23:14:18.716713 IP 192.168.43.147.8880 > 192.168.43.124.7773: UDP, length 120
23:14:18.729818 IP 192.168.43.124.8880 > 192.168.43.146.7771: UDP, length 120
23:14:18.769495 IP 192.168.43.147.8880 > 192.168.43.124.7773: UDP, length 120
23:14:18.779818 IP 192.168.43.124.8880 > 192.168.43.146.7771: UDP, length 120
23:14:18.819223 IP 192.168.43.147.8880 > 192.168.43.124.7773: UDP, length 120
23:14:18.829771 IP 192.168.43.124.8880 > 192.168.43.146.7771: UDP, length 120
23:14:18.867863 IP 192.168.43.147.8880 > 192.168.43.124.7773: UDP, length 120
23:14:18.879712 IP 192.168.43.124.8880 > 192.168.43.146.7771: UDP, length 120
23:14:18.919434 IP 192.168.43.147.8880 > 192.168.43.124.7773: UDP, length 120
23:14:18.929768 IP 192.168.43.124.8880 > 192.168.43.146.7771: UDP, length 120
23:14:18.969636 IP 192.168.43.147.8880 > 192.168.43.124.7773: UDP, length 120
23:14:18.979767 IP 192.168.43.124.8880 > 192.168.43.146.7771: UDP, length 120
23:14:19.018445 IP 192.168.43.147.8880 > 192.168.43.124.7773: UDP, length 120
23:14:19.029768 IP 192.168.43.124.8880 > 192.168.43.146.7771: UDP, length 120
23:14:19.071681 IP 192.168.43.147.8880 > 192.168.43.124.7773: UDP, length 120
23:14:19.079768 IP 192.168.43.124.8880 > 192.168.43.146.7771: UDP, length 120
23:14:19.121320 IP 192.168.43.147.8880 > 192.168.43.124.7773: UDP, length 120
23:14:19.129766 IP 192.168.43.124.8880 > 192.168.43.146.7771: UDP, length 120
23:14:19.177343 IP 192.168.43.147.8880 > 192.168.43.124.7773: UDP, length 120
23:14:19.179768 IP 192.168.43.124.8880 > 192.168.43.146.7771: UDP, length 120
23:14:19.219707 IP 192.168.43.147.8880 > 192.168.43.124.7773: UDP, length 120
23:14:19.229767 IP 192.168.43.124.8880 > 192.168.43.146.7771: UDP, length 120
23:14:19.274470 IP 192.168.43.147.8880 > 192.168.43.124.7773: UDP, length 120
23:14:19.279768 IP 192.168.43.124.8880 > 192.168.43.146.7771: UDP, length 120
23:14:19.322630 IP 192.168.43.147.8880 > 192.168.43.124.7773: UDP, length 120
23:14:19.329818 IP 192.168.43.124.8880 > 192.168.43.146.7771: UDP, length 120
23:14:19.377322 IP 192.168.43.147.8880 > 192.168.43.124.7773: UDP, length 120
23:14:19.379771 IP 192.168.43.124.8880 > 192.168.43.146.7771: UDP, length 120
23:14:19.429771 IP 192.168.43.124.8880 > 192.168.43.146.7771: UDP, length 120
23:14:19.430878 IP 192.168.43.147.8880 > 192.168.43.124.7773: UDP, length 120
23:14:19.465699 IP 192.168.43.147.8880 > 192.168.43.124.7773: UDP, length 120
23:14:19.479771 IP 192.168.43.124.8880 > 192.168.43.146.7771: UDP, length 120
23:14:19.520015 IP 192.168.43.147.8880 > 192.168.43.124.7773: UDP, length 120
23:14:19.529819 IP 192.168.43.124.8880 > 192.168.43.146.7771: UDP, length 120
23:14:19.570113 IP 192.168.43.147.8880 > 192.168.43.124.7773: UDP, length 120
23:14:19.579820 IP 192.168.43.124.8880 > 192.168.43.146.7771: UDP, length 120
23:14:19.619810 IP 192.168.43.147.8880 > 192.168.43.124.7773: UDP, length 120
23:14:19.629772 IP 192.168.43.124.8880 > 192.168.43.146.7771: UDP, length 120
23:14:19.671925 IP 192.168.43.147.8880 > 192.168.43.124.7773: UDP, length 120
23:14:19.679817 IP 192.168.43.124.8880 > 192.168.43.146.7771: UDP, length 120
23:14:19.722403 IP 192.168.43.147.8880 > 192.168.43.124.7773: UDP, length 120
23:14:19.729817 IP 192.168.43.124.8880 > 192.168.43.146.7771: UDP, length 120
23:14:19.774434 IP 192.168.43.147.8880 > 192.168.43.124.7773: UDP, length 120
23:14:19.779820 IP 192.168.43.124.8880 > 192.168.43.146.7771: UDP, length 120
23:14:19.821956 IP 192.168.43.147.8880 > 192.168.43.124.7773: UDP, length 120
23:14:19.829816 IP 192.168.43.124.8880 > 192.168.43.146.7771: UDP, length 120
23:14:19.871543 IP 192.168.43.147.8880 > 192.168.43.124.7773: UDP, length 120
23:14:19.879715 IP 192.168.43.124.8880 > 192.168.43.146.7771: UDP, length 120
23:14:19.919306 IP 192.168.43.147.8880 > 192.168.43.124.7773: UDP, length 120
23:14:19.929770 IP 192.168.43.124.8880 > 192.168.43.146.7771: UDP, length 120
23:14:19.969222 IP 192.168.43.147.8880 > 192.168.43.124.7773: UDP, length 120
23:14:19.979768 IP 192.168.43.124.8880 > 192.168.43.146.7771: UDP, length 120
23:14:20.019724 IP 192.168.43.147.8880 > 192.168.43.124.7773: UDP, length 120
23:14:20.029768 IP 192.168.43.124.8880 > 192.168.43.146.7771: UDP, length 120
23:14:20.069215 IP 192.168.43.147.8880 > 192.168.43.124.7773: UDP, length 120
23:14:20.079768 IP 192.168.43.124.8880 > 192.168.43.146.7771: UDP, length 120
23:14:20.121462 IP 192.168.43.147.8880 > 192.168.43.124.7773: UDP, length 120
23:14:20.129770 IP 192.168.43.124.8880 > 192.168.43.146.7771: UDP, length 120
23:14:20.170630 IP 192.168.43.147.8880 > 192.168.43.124.7773: UDP, length 120
23:14:20.179768 IP 192.168.43.124.8880 > 192.168.43.146.7771: UDP, length 120
23:14:20.223819 IP 192.168.43.147.8880 > 192.168.43.124.7773: UDP, length 120
23:14:20.229769 IP 192.168.43.124.8880 > 192.168.43.146.7771: UDP, length 120
23:14:20.272947 IP 192.168.43.147.8880 > 192.168.43.124.7773: UDP, length 120
23:14:20.279769 IP 192.168.43.124.8880 > 192.168.43.146.7771: UDP, length 120
23:14:20.320891 IP 192.168.43.147.8880 > 192.168.43.124.7773: UDP, length 120
23:14:20.329721 IP 192.168.43.124.8880 > 192.168.43.146.7771: UDP, length 120
23:14:20.371276 IP 192.168.43.147.8880 > 192.168.43.124.7773: UDP, length 120
23:14:20.379817 IP 192.168.43.124.8880 > 192.168.43.146.7771: UDP, length 120
