02:18:11.433058 IP 192.168.43.146.8880 > 192.168.43.147.7772: UDP, length 120
02:18:11.483097 IP 192.168.43.146.8880 > 192.168.43.147.7772: UDP, length 120
02:18:11.533105 IP 192.168.43.146.8880 > 192.168.43.147.7772: UDP, length 120
02:18:11.583078 IP 192.168.43.146.8880 > 192.168.43.147.7772: UDP, length 120
02:18:11.633087 IP 192.168.43.146.8880 > 192.168.43.147.7772: UDP, length 120
02:18:11.683084 IP 192.168.43.146.8880 > 192.168.43.147.7772: UDP, length 120
02:18:11.733076 IP 192.168.43.146.8880 > 192.168.43.147.7772: UDP, length 120
02:18:11.783075 IP 192.168.43.146.8880 > 192.168.43.147.7772: UDP, length 120
02:18:11.833076 IP 192.168.43.146.8880 > 192.168.43.147.7772: UDP, length 120
02:18:11.883091 IP 192.168.43.146.8880 > 192.168.43.147.7772: UDP, length 120
02:18:11.933078 IP 192.168.43.146.8880 > 192.168.43.147.7772: UDP, length 120
02:18:11.983077 IP 192.168.43.146.8880 > 192.168.43.147.7772: UDP, length 120
02:18:12.033112 IP 192.168.43.146.8880 > 192.168.43.147.7772: UDP, length 120
02:18:12.083084 IP 192.168.43.146.8880 > 192.168.43.147.7772: UDP, length 120
02:18:12.133077 IP 192.168.43.146.8880 > 192.168.43.147.7772: UDP, length 120
02:18:12.183075 IP 192.168.43.146.8880 > 192.168.43.147.7772: UDP, length 120
02:18:12.233077 IP 192.168.43.146.8880 > 192.168.43.147.7772: UDP, length 120
02:18:12.283076 IP 192.168.43.146.8880 > 192.168.43.147.7772: UDP, length 120
02:18:12.333075 IP 192.168.43.146.8880 > 192.168.43.147.7772: UDP, length 120
02:18:12.383075 IP 192.168.43.146.8880 > 192.168.43.147.7772: UDP, length 120
02:18:12.433075 IP 192.168.43.146.8880 > 192.168.43.147.7772: UDP, length 120
02:18:12.483076 IP 192.168.43.146.8880 > 192.168.43.147.7772: UDP, length 120
02:18:12.533098 IP 192.168.43.146.8880 > 192.168.43.147.7772: UDP, length 120
02:18:12.583083 IP 192.168.43.146.8880 > 192.168.43.147.7772: UDP, length 120
02:18:12.633106 IP 192.168.43.146.8880 > 192.168.43.147.7772: UDP, length 120
02:18:12.683103 IP 192.168.43.146.8880 > 192.168.43.147.7772: UDP, length 120
02:18:12.733101 IP 192.168.43.146.8880 > 192.168.43.147.7772: UDP, length 120
02:18:12.783102 IP 192.168.43.146.8880 > 192.168.43.147.7772: UDP, length 120
02:18:12.833102 IP 192.168.43.146.8880 > 192.168.43.147.7772: UDP, length 120
02:18:12.883102 IP 192.168.43.146.8880 > 192.168.43.147.7772: UDP, length 120
02:18:12.933101 IP 192.168.43.146.8880 > 192.168.43.147.7772: UDP, length 120
02:18:12.983119 IP 192.168.43.146.8880 > 192.168.43.147.7772: UDP, length 120
02:18:13.033112 IP 192.168.43.146.8880 > 192.168.43.147.7772: UDP, length 120
02:18:13.083103 IP 192.168.43.146.8880 > 192.168.43.147.7772: UDP, length 120
02:18:13.133139 IP 192.168.43.146.8880 > 192.168.43.147.7772: UDP, length 120
02:18:13.183099 IP 192.168.43.146.8880 > 192.168.43.147.7772: UDP, length 120
02:18:13.233104 IP 192.168.43.146.8880 > 192.168.43.147.7772: UDP, length 120
02:18:13.283101 IP 192.168.43.146.8880 > 192.168.43.147.7772: UDP, length 120
02:18:13.333101 IP 192.168.43.146.8880 > 192.168.43.147.7772: UDP, length 120
02:18:13.384808 IP 192.168.43.146.8880 > 192.168.43.147.7772: UDP, length 120
02:18:13.433200 IP 192.168.43.146.8880 > 192.168.43.147.7772: UDP, length 120
02:18:13.483210 IP 192.168.43.146.8880 > 192.168.43.147.7772: UDP, length 120
02:18:13.533159 IP 192.168.43.146.8880 > 192.168.43.147.7772: UDP, length 120
02:18:13.583149 IP 192.168.43.146.8880 > 192.168.43.147.7772: UDP, length 120
02:18:13.633149 IP 192.168.43.146.8880 > 192.168.43.147.7772: UDP, length 120
02:18:13.683137 IP 192.168.43.146.8880 > 192.168.43.147.7772: UDP, length 120
02:18:13.733136 IP 192.168.43.146.8880 > 192.168.43.147.7772: UDP, length 120
02:18:13.783141 IP 192.168.43.146.8880 > 192.168.43.147.7772: UDP, length 120
02:18:13.833173 IP 192.168.43.146.8880 > 192.168.43.147.7772: UDP, length 120
02:18:13.883138 IP 192.168.43.146.8880 > 192.168.43.147.7772: UDP, length 120
02:18:13.933129 IP 192.168.43.146.8880 > 192.168.43.147.7772: UDP, length 120
02:18:13.983088 IP 192.168.43.146.8880 > 192.168.43.147.7772: UDP, length 120
02:18:14.033085 IP 192.168.43.146.8880 > 192.168.43.147.7772: UDP, length 120
02:18:14.083081 IP 192.168.43.146.8880 > 192.168.43.147.7772: UDP, length 120
02:18:14.133078 IP 192.168.43.146.8880 > 192.168.43.147.7772: UDP, length 120
02:18:14.183075 IP 192.168.43.146.8880 > 192.168.43.147.7772: UDP, length 120
02:18:14.233075 IP 192.168.43.146.8880 > 192.168.43.147.7772: UDP, length 120
02:18:14.283075 IP 192.168.43.146.8880 > 192.168.43.147.7772: UDP, length 120
02:18:14.333074 IP 192.168.43.146.8880 > 192.168.43.147.7772: UDP, length 120
02:18:14.383075 IP 192.168.43.146.8880 > 192.168.43.147.7772: UDP, length 120
02:18:14.433075 IP 192.168.43.146.8880 > 192.168.43.147.7772: UDP, length 120
02:18:14.483075 IP 192.168.43.146.8880 > 192.168.43.147.7772: UDP, length 120
02:18:14.533154 IP 192.168.43.146.8880 > 192.168.43.147.7772: UDP, length 120
02:18:14.583130 IP 192.168.43.146.8880 > 192.168.43.147.7772: UDP, length 120
02:18:14.633083 IP 192.168.43.146.8880 > 192.168.43.147.7772: UDP, length 120
02:18:14.683077 IP 192.168.43.146.8880 > 192.168.43.147.7772: UDP, length 120
02:18:14.733079 IP 192.168.43.146.8880 > 192.168.43.147.7772: UDP, length 120
02:18:14.783075 IP 192.168.43.146.8880 > 192.168.43.147.7772: UDP, length 120
02:18:14.833076 IP 192.168.43.146.8880 > 192.168.43.147.7772: UDP, length 120
02:18:14.883076 IP 192.168.43.146.8880 > 192.168.43.147.7772: UDP, length 120
02:18:14.933076 IP 192.168.43.146.8880 > 192.168.43.147.7772: UDP, length 120
02:18:14.983078 IP 192.168.43.146.8880 > 192.168.43.147.7772: UDP, length 120
02:18:15.033115 IP 192.168.43.146.8880 > 192.168.43.147.7772: UDP, length 120
02:18:15.083086 IP 192.168.43.146.8880 > 192.168.43.147.7772: UDP, length 120
02:18:15.133084 IP 192.168.43.146.8880 > 192.168.43.147.7772: UDP, length 120
02:18:15.183075 IP 192.168.43.146.8880 > 192.168.43.147.7772: UDP, length 120
02:18:15.233076 IP 192.168.43.146.8880 > 192.168.43.147.7772: UDP, length 120
02:18:15.283076 IP 192.168.43.146.8880 > 192.168.43.147.7772: UDP, length 120
02:18:15.333078 IP 192.168.43.146.8880 > 192.168.43.147.7772: UDP, length 120
02:18:15.383078 IP 192.168.43.146.8880 > 192.168.43.147.7772: UDP, length 120
02:18:15.433075 IP 192.168.43.146.8880 > 192.168.43.147.7772: UDP, length 120
02:18:15.483079 IP 192.168.43.146.8880 > 192.168.43.147.7772: UDP, length 120
02:18:15.533080 IP 192.168.43.146.8880 > 192.168.43.147.7772: UDP, length 120
02:18:15.583151 IP 192.168.43.146.8880 > 192.168.43.147.7772: UDP, length 120
02:18:15.633087 IP 192.168.43.146.8880 > 192.168.43.147.7772: UDP, length 120
02:18:15.683078 IP 192.168.43.146.8880 > 192.168.43.147.7772: UDP, length 120
02:18:15.733080 IP 192.168.43.146.8880 > 192.168.43.147.7772: UDP, length 120
02:18:15.783079 IP 192.168.43.146.8880 > 192.168.43.147.7772: UDP, length 120
02:18:15.833078 IP 192.168.43.146.8880 > 192.168.43.147.7772: UDP, length 120
02:18:15.879337 IP 192.168.43.124.8880 > 192.168.43.146.7771: UDP, length 120
02:18:15.883078 IP 192.168.43.146.8880 > 192.168.43.147.7772: UDP, length 120
02:18:15.933079 IP 192.168.43.146.8880 > 192.168.43.147.7772: UDP, length 120
02:18:15.936321 IP 192.168.43.124.8880 > 192.168.43.146.7771: UDP, length 120
02:18:15.979654 IP 192.168.43.124.8880 > 192.168.43.146.7771: UDP, length 120
02:18:15.983078 IP 192.168.43.146.8880 > 192.168.43.147.7772: UDP, length 120
02:18:16.030926 IP 192.168.43.124.8880 > 192.168.43.146.7771: UDP, length 120
02:18:16.033079 IP 192.168.43.146.8880 > 192.168.43.147.7772: UDP, length 120
02:18:16.083076 IP 192.168.43.146.8880 > 192.168.43.147.7772: UDP, length 120
02:18:16.086318 IP 192.168.43.124.8880 > 192.168.43.146.7771: UDP, length 120
02:18:16.130086 IP 192.168.43.124.8880 > 192.168.43.146.7771: UDP, length 120
02:18:16.133092 IP 192.168.43.146.8880 > 192.168.43.147.7772: UDP, length 120
02:18:16.180315 IP 192.168.43.124.8880 > 192.168.43.146.7771: UDP, length 120
02:18:16.183083 IP 192.168.43.146.8880 > 192.168.43.147.7772: UDP, length 120
02:18:16.233077 IP 192.168.43.146.8880 > 192.168.43.147.7772: UDP, length 120
02:18:16.236317 IP 192.168.43.124.8880 > 192.168.43.146.7771: UDP, length 120
02:18:16.278636 IP 192.168.43.124.8880 > 192.168.43.146.7771: UDP, length 120
02:18:16.283078 IP 192.168.43.146.8880 > 192.168.43.147.7772: UDP, length 120
02:18:16.333077 IP 192.168.43.146.8880 > 192.168.43.147.7772: UDP, length 120
02:18:16.337521 IP 192.168.43.124.8880 > 192.168.43.146.7771: UDP, length 120
02:18:16.378705 IP 192.168.43.124.8880 > 192.168.43.146.7771: UDP, length 120
02:18:16.383078 IP 192.168.43.146.8880 > 192.168.43.147.7772: UDP, length 120
02:18:16.433078 IP 192.168.43.146.8880 > 192.168.43.147.7772: UDP, length 120
02:18:16.456631 IP 192.168.43.124.8880 > 192.168.43.146.7771: UDP, length 120
02:18:16.483078 IP 192.168.43.146.8880 > 192.168.43.147.7772: UDP, length 120
02:18:16.486316 IP 192.168.43.124.8880 > 192.168.43.146.7771: UDP, length 120
02:18:16.529547 IP 192.168.43.124.8880 > 192.168.43.146.7771: UDP, length 120
02:18:16.533110 IP 192.168.43.146.8880 > 192.168.43.147.7772: UDP, length 120
02:18:16.578735 IP 192.168.43.124.8880 > 192.168.43.146.7771: UDP, length 120
02:18:16.583119 IP 192.168.43.146.8880 > 192.168.43.147.7772: UDP, length 120
02:18:16.633087 IP 192.168.43.146.8880 > 192.168.43.147.7772: UDP, length 120
02:18:16.649373 IP 192.168.43.124.8880 > 192.168.43.146.7771: UDP, length 120
02:18:16.678880 IP 192.168.43.124.8880 > 192.168.43.146.7771: UDP, length 120
02:18:16.683080 IP 192.168.43.146.8880 > 192.168.43.147.7772: UDP, length 120
02:18:16.728528 IP 192.168.43.124.8880 > 192.168.43.146.7771: UDP, length 120
02:18:16.733077 IP 192.168.43.146.8880 > 192.168.43.147.7772: UDP, length 120
02:18:16.783078 IP 192.168.43.146.8880 > 192.168.43.147.7772: UDP, length 120
02:18:16.791906 IP 192.168.43.124.8880 > 192.168.43.146.7771: UDP, length 120
02:18:16.827728 IP 192.168.43.124.8880 > 192.168.43.146.7771: UDP, length 120
02:18:16.833078 IP 192.168.43.146.8880 > 192.168.43.147.7772: UDP, length 120
02:18:16.877792 IP 192.168.43.124.8880 > 192.168.43.146.7771: UDP, length 120
02:18:16.883077 IP 192.168.43.146.8880 > 192.168.43.147.7772: UDP, length 120
02:18:16.933077 IP 192.168.43.146.8880 > 192.168.43.147.7772: UDP, length 120
02:18:16.936311 IP 192.168.43.124.8880 > 192.168.43.146.7771: UDP, length 120
02:18:16.977942 IP 192.168.43.124.8880 > 192.168.43.146.7771: UDP, length 120
02:18:16.983079 IP 192.168.43.146.8880 > 192.168.43.147.7772: UDP, length 120
02:18:17.028010 IP 192.168.43.124.8880 > 192.168.43.146.7771: UDP, length 120
02:18:17.033077 IP 192.168.43.146.8880 > 192.168.43.147.7772: UDP, length 120
02:18:17.083076 IP 192.168.43.146.8880 > 192.168.43.147.7772: UDP, length 120
02:18:17.087398 IP 192.168.43.124.8880 > 192.168.43.146.7771: UDP, length 120
02:18:17.128148 IP 192.168.43.124.8880 > 192.168.43.146.7771: UDP, length 120
02:18:17.133081 IP 192.168.43.146.8880 > 192.168.43.147.7772: UDP, length 120
02:18:17.182888 IP 192.168.43.124.8880 > 192.168.43.146.7771: UDP, length 120
02:18:17.183084 IP 192.168.43.146.8880 > 192.168.43.147.7772: UDP, length 120
02:18:17.233077 IP 192.168.43.146.8880 > 192.168.43.147.7772: UDP, length 120
02:18:17.236318 IP 192.168.43.124.8880 > 192.168.43.146.7771: UDP, length 120
02:18:17.283076 IP 192.168.43.146.8880 > 192.168.43.147.7772: UDP, length 120
02:18:17.310297 IP 192.168.43.124.8880 > 192.168.43.146.7771: UDP, length 120
02:18:17.328454 IP 192.168.43.124.8880 > 192.168.43.146.7771: UDP, length 120
02:18:17.333077 IP 192.168.43.146.8880 > 192.168.43.147.7772: UDP, length 120
02:18:17.383075 IP 192.168.43.146.8880 > 192.168.43.147.7772: UDP, length 120
02:18:17.386311 IP 192.168.43.124.8880 > 192.168.43.146.7771: UDP, length 120
02:18:17.428593 IP 192.168.43.124.8880 > 192.168.43.146.7771: UDP, length 120
02:18:17.433080 IP 192.168.43.146.8880 > 192.168.43.147.7772: UDP, length 120
02:18:17.478665 IP 192.168.43.124.8880 > 192.168.43.146.7771: UDP, length 120
02:18:17.483075 IP 192.168.43.146.8880 > 192.168.43.147.7772: UDP, length 120
02:18:17.533085 IP 192.168.43.146.8880 > 192.168.43.147.7772: UDP, length 120
02:18:17.537875 IP 192.168.43.124.8880 > 192.168.43.146.7771: UDP, length 120
02:18:17.578646 IP 192.168.43.124.8880 > 192.168.43.146.7771: UDP, length 120
02:18:17.583142 IP 192.168.43.146.8880 > 192.168.43.147.7772: UDP, length 120
02:18:17.628950 IP 192.168.43.124.8880 > 192.168.43.146.7771: UDP, length 120
02:18:17.633158 IP 192.168.43.146.8880 > 192.168.43.147.7772: UDP, length 120
02:18:17.679104 IP 192.168.43.124.8880 > 192.168.43.146.7771: UDP, length 120
02:18:17.683110 IP 192.168.43.146.8880 > 192.168.43.147.7772: UDP, length 120
02:18:17.733101 IP 192.168.43.146.8880 > 192.168.43.147.7772: UDP, length 120
02:18:17.736488 IP 192.168.43.124.8880 > 192.168.43.146.7771: UDP, length 120
02:18:17.779672 IP 192.168.43.124.8880 > 192.168.43.146.7771: UDP, length 120
02:18:17.783104 IP 192.168.43.146.8880 > 192.168.43.147.7772: UDP, length 120
02:18:17.831317 IP 192.168.43.124.8880 > 192.168.43.146.7771: UDP, length 120
02:18:17.833102 IP 192.168.43.146.8880 > 192.168.43.147.7772: UDP, length 120
02:18:17.883103 IP 192.168.43.146.8880 > 192.168.43.147.7772: UDP, length 120
02:18:17.886522 IP 192.168.43.124.8880 > 192.168.43.146.7771: UDP, length 120
02:18:17.928756 IP 192.168.43.124.8880 > 192.168.43.146.7771: UDP, length 120
02:18:17.933105 IP 192.168.43.146.8880 > 192.168.43.147.7772: UDP, length 120
02:18:17.978900 IP 192.168.43.124.8880 > 192.168.43.146.7771: UDP, length 120
02:18:17.983109 IP 192.168.43.146.8880 > 192.168.43.147.7772: UDP, length 120
02:18:18.033148 IP 192.168.43.146.8880 > 192.168.43.147.7772: UDP, length 120
02:18:18.036628 IP 192.168.43.124.8880 > 192.168.43.146.7771: UDP, length 120
02:18:18.078764 IP 192.168.43.124.8880 > 192.168.43.146.7771: UDP, length 120
02:18:18.083115 IP 192.168.43.146.8880 > 192.168.43.147.7772: UDP, length 120
02:18:18.129255 IP 192.168.43.124.8880 > 192.168.43.146.7771: UDP, length 120
02:18:18.133104 IP 192.168.43.146.8880 > 192.168.43.147.7772: UDP, length 120
02:18:18.179621 IP 192.168.43.124.8880 > 192.168.43.146.7771: UDP, length 120
02:18:18.183105 IP 192.168.43.146.8880 > 192.168.43.147.7772: UDP, length 120
02:18:18.233109 IP 192.168.43.146.8880 > 192.168.43.147.7772: UDP, length 120
02:18:18.246782 IP 192.168.43.124.8880 > 192.168.43.146.7771: UDP, length 120
02:18:18.279512 IP 192.168.43.124.8880 > 192.168.43.146.7771: UDP, length 120
02:18:18.283111 IP 192.168.43.146.8880 > 192.168.43.147.7772: UDP, length 120
02:18:18.330951 IP 192.168.43.124.8880 > 192.168.43.146.7771: UDP, length 120
02:18:18.333108 IP 192.168.43.146.8880 > 192.168.43.147.7772: UDP, length 120
02:18:18.383102 IP 192.168.43.146.8880 > 192.168.43.147.7772: UDP, length 120
02:18:18.386512 IP 192.168.43.124.8880 > 192.168.43.146.7771: UDP, length 120
02:18:18.428079 IP 192.168.43.124.8880 > 192.168.43.146.7771: UDP, length 120
02:18:18.433108 IP 192.168.43.146.8880 > 192.168.43.147.7772: UDP, length 120
02:18:18.479049 IP 192.168.43.124.8880 > 192.168.43.146.7771: UDP, length 120
02:18:18.483113 IP 192.168.43.146.8880 > 192.168.43.147.7772: UDP, length 120
02:18:18.533139 IP 192.168.43.146.8880 > 192.168.43.147.7772: UDP, length 120
02:18:18.541959 IP 192.168.43.124.8880 > 192.168.43.146.7771: UDP, length 120
02:18:18.578966 IP 192.168.43.124.8880 > 192.168.43.146.7771: UDP, length 120
02:18:18.583115 IP 192.168.43.146.8880 > 192.168.43.147.7772: UDP, length 120
02:18:18.628839 IP 192.168.43.124.8880 > 192.168.43.146.7771: UDP, length 120
02:18:18.633157 IP 192.168.43.146.8880 > 192.168.43.147.7772: UDP, length 120
02:18:18.683105 IP 192.168.43.146.8880 > 192.168.43.147.7772: UDP, length 120
02:18:18.686756 IP 192.168.43.124.8880 > 192.168.43.146.7771: UDP, length 120
02:18:18.728726 IP 192.168.43.124.8880 > 192.168.43.146.7771: UDP, length 120
02:18:18.733108 IP 192.168.43.146.8880 > 192.168.43.147.7772: UDP, length 120
02:18:18.779951 IP 192.168.43.124.8880 > 192.168.43.146.7771: UDP, length 120
02:18:18.783105 IP 192.168.43.146.8880 > 192.168.43.147.7772: UDP, length 120
02:18:18.828601 IP 192.168.43.124.8880 > 192.168.43.146.7771: UDP, length 120
02:18:18.833107 IP 192.168.43.146.8880 > 192.168.43.147.7772: UDP, length 120
02:18:18.883103 IP 192.168.43.146.8880 > 192.168.43.147.7772: UDP, length 120
02:18:18.895050 IP 192.168.43.124.8880 > 192.168.43.146.7771: UDP, length 120
02:18:18.929147 IP 192.168.43.124.8880 > 192.168.43.146.7771: UDP, length 120
02:18:18.933164 IP 192.168.43.146.8880 > 192.168.43.147.7772: UDP, length 120
02:18:18.978764 IP 192.168.43.124.8880 > 192.168.43.146.7771: UDP, length 120
02:18:18.983167 IP 192.168.43.146.8880 > 192.168.43.147.7772: UDP, length 120
02:18:19.033157 IP 192.168.43.146.8880 > 192.168.43.147.7772: UDP, length 120
02:18:19.036533 IP 192.168.43.124.8880 > 192.168.43.146.7771: UDP, length 120
02:18:19.078917 IP 192.168.43.124.8880 > 192.168.43.146.7771: UDP, length 120
02:18:19.083126 IP 192.168.43.146.8880 > 192.168.43.147.7772: UDP, length 120
02:18:19.128830 IP 192.168.43.124.8880 > 192.168.43.146.7771: UDP, length 120
02:18:19.133152 IP 192.168.43.146.8880 > 192.168.43.147.7772: UDP, length 120
02:18:19.183158 IP 192.168.43.146.8880 > 192.168.43.147.7772: UDP, length 120
02:18:19.186586 IP 192.168.43.124.8880 > 192.168.43.146.7771: UDP, length 120
02:18:19.230859 IP 192.168.43.124.8880 > 192.168.43.146.7771: UDP, length 120
02:18:19.233193 IP 192.168.43.146.8880 > 192.168.43.147.7772: UDP, length 120
02:18:19.278847 IP 192.168.43.124.8880 > 192.168.43.146.7771: UDP, length 120
02:18:19.283143 IP 192.168.43.146.8880 > 192.168.43.147.7772: UDP, length 120
02:18:19.333144 IP 192.168.43.146.8880 > 192.168.43.147.7772: UDP, length 120
02:18:19.339741 IP 192.168.43.124.8880 > 192.168.43.146.7771: UDP, length 120
02:18:19.378996 IP 192.168.43.124.8880 > 192.168.43.146.7771: UDP, length 120
02:18:19.383124 IP 192.168.43.146.8880 > 192.168.43.147.7772: UDP, length 120
02:18:19.428554 IP 192.168.43.124.8880 > 192.168.43.146.7771: UDP, length 120
02:18:19.433088 IP 192.168.43.146.8880 > 192.168.43.147.7772: UDP, length 120
02:18:19.483078 IP 192.168.43.146.8880 > 192.168.43.147.7772: UDP, length 120
02:18:19.486324 IP 192.168.43.124.8880 > 192.168.43.146.7771: UDP, length 120
02:18:19.528558 IP 192.168.43.124.8880 > 192.168.43.146.7771: UDP, length 120
02:18:19.533113 IP 192.168.43.146.8880 > 192.168.43.147.7772: UDP, length 120
02:18:19.578613 IP 192.168.43.124.8880 > 192.168.43.146.7771: UDP, length 120
02:18:19.583080 IP 192.168.43.146.8880 > 192.168.43.147.7772: UDP, length 120
02:18:19.633125 IP 192.168.43.146.8880 > 192.168.43.147.7772: UDP, length 120
02:18:19.651037 IP 192.168.43.124.8880 > 192.168.43.146.7771: UDP, length 120
02:18:19.678696 IP 192.168.43.124.8880 > 192.168.43.146.7771: UDP, length 120
02:18:19.683092 IP 192.168.43.146.8880 > 192.168.43.147.7772: UDP, length 120
02:18:19.728723 IP 192.168.43.124.8880 > 192.168.43.146.7771: UDP, length 120
02:18:19.733080 IP 192.168.43.146.8880 > 192.168.43.147.7772: UDP, length 120
02:18:19.783077 IP 192.168.43.146.8880 > 192.168.43.147.7772: UDP, length 120
02:18:19.786317 IP 192.168.43.124.8880 > 192.168.43.146.7771: UDP, length 120
02:18:19.829968 IP 192.168.43.124.8880 > 192.168.43.146.7771: UDP, length 120
02:18:19.833079 IP 192.168.43.146.8880 > 192.168.43.147.7772: UDP, length 120
02:18:19.879457 IP 192.168.43.124.8880 > 192.168.43.146.7771: UDP, length 120
02:18:19.883078 IP 192.168.43.146.8880 > 192.168.43.147.7772: UDP, length 120
02:18:19.930284 IP 192.168.43.124.8880 > 192.168.43.146.7771: UDP, length 120
02:18:19.933078 IP 192.168.43.146.8880 > 192.168.43.147.7772: UDP, length 120
02:18:19.983076 IP 192.168.43.146.8880 > 192.168.43.147.7772: UDP, length 120
02:18:19.995691 IP 192.168.43.124.8880 > 192.168.43.146.7771: UDP, length 120
02:18:20.028582 IP 192.168.43.124.8880 > 192.168.43.146.7771: UDP, length 120
02:18:20.033078 IP 192.168.43.146.8880 > 192.168.43.147.7772: UDP, length 120
02:18:20.079706 IP 192.168.43.124.8880 > 192.168.43.146.7771: UDP, length 120
02:18:20.083078 IP 192.168.43.146.8880 > 192.168.43.147.7772: UDP, length 120
02:18:20.133076 IP 192.168.43.146.8880 > 192.168.43.147.7772: UDP, length 120
02:18:20.136317 IP 192.168.43.124.8880 > 192.168.43.146.7771: UDP, length 120
02:18:20.178784 IP 192.168.43.124.8880 > 192.168.43.146.7771: UDP, length 120
02:18:20.183077 IP 192.168.43.146.8880 > 192.168.43.147.7772: UDP, length 120
02:18:20.228618 IP 192.168.43.124.8880 > 192.168.43.146.7771: UDP, length 120
02:18:20.233076 IP 192.168.43.146.8880 > 192.168.43.147.7772: UDP, length 120
02:18:20.283076 IP 192.168.43.146.8880 > 192.168.43.147.7772: UDP, length 120
02:18:20.286315 IP 192.168.43.124.8880 > 192.168.43.146.7771: UDP, length 120
02:18:20.329352 IP 192.168.43.124.8880 > 192.168.43.146.7771: UDP, length 120
02:18:20.333082 IP 192.168.43.146.8880 > 192.168.43.147.7772: UDP, length 120
02:18:20.381261 IP 192.168.43.124.8880 > 192.168.43.146.7771: UDP, length 120
02:18:20.383083 IP 192.168.43.146.8880 > 192.168.43.147.7772: UDP, length 120
02:18:20.433077 IP 192.168.43.146.8880 > 192.168.43.147.7772: UDP, length 120
02:18:20.438595 IP 192.168.43.124.8880 > 192.168.43.146.7771: UDP, length 120
02:18:20.480852 IP 192.168.43.124.8880 > 192.168.43.146.7771: UDP, length 120
02:18:20.483076 IP 192.168.43.146.8880 > 192.168.43.147.7772: UDP, length 120
02:18:20.525813 IP 192.168.43.124.8880 > 192.168.43.146.7771: UDP, length 120
02:18:20.533085 IP 192.168.43.146.8880 > 192.168.43.147.7772: UDP, length 120
02:18:20.583076 IP 192.168.43.146.8880 > 192.168.43.147.7772: UDP, length 120
02:18:20.596342 IP 192.168.43.124.8880 > 192.168.43.146.7771: UDP, length 120
02:18:20.628588 IP 192.168.43.124.8880 > 192.168.43.146.7771: UDP, length 120
02:18:20.633078 IP 192.168.43.146.8880 > 192.168.43.147.7772: UDP, length 120
02:18:20.678626 IP 192.168.43.124.8880 > 192.168.43.146.7771: UDP, length 120
02:18:20.683076 IP 192.168.43.146.8880 > 192.168.43.147.7772: UDP, length 120
02:18:20.733076 IP 192.168.43.146.8880 > 192.168.43.147.7772: UDP, length 120
02:18:20.736304 IP 192.168.43.124.8880 > 192.168.43.146.7771: UDP, length 120
02:18:20.778619 IP 192.168.43.124.8880 > 192.168.43.146.7771: UDP, length 120
02:18:20.783077 IP 192.168.43.146.8880 > 192.168.43.147.7772: UDP, length 120
02:18:20.828601 IP 192.168.43.124.8880 > 192.168.43.146.7771: UDP, length 120
02:18:20.833077 IP 192.168.43.146.8880 > 192.168.43.147.7772: UDP, length 120
02:18:20.883077 IP 192.168.43.146.8880 > 192.168.43.147.7772: UDP, length 120
02:18:20.887305 IP 192.168.43.124.8880 > 192.168.43.146.7771: UDP, length 120
02:18:20.930238 IP 192.168.43.124.8880 > 192.168.43.146.7771: UDP, length 120
02:18:20.933077 IP 192.168.43.146.8880 > 192.168.43.147.7772: UDP, length 120
02:18:20.979044 IP 192.168.43.124.8880 > 192.168.43.146.7771: UDP, length 120
02:18:20.983079 IP 192.168.43.146.8880 > 192.168.43.147.7772: UDP, length 120
02:18:21.033111 IP 192.168.43.146.8880 > 192.168.43.147.7772: UDP, length 120
02:18:21.036428 IP 192.168.43.124.8880 > 192.168.43.146.7771: UDP, length 120
02:18:21.078627 IP 192.168.43.124.8880 > 192.168.43.146.7771: UDP, length 120
02:18:21.083086 IP 192.168.43.146.8880 > 192.168.43.147.7772: UDP, length 120
02:18:21.129212 IP 192.168.43.124.8880 > 192.168.43.146.7771: UDP, length 120
02:18:21.133079 IP 192.168.43.146.8880 > 192.168.43.147.7772: UDP, length 120
02:18:21.180260 IP 192.168.43.124.8880 > 192.168.43.146.7771: UDP, length 120
02:18:21.183075 IP 192.168.43.146.8880 > 192.168.43.147.7772: UDP, length 120
02:18:21.233075 IP 192.168.43.146.8880 > 192.168.43.147.7772: UDP, length 120
02:18:21.247103 IP 192.168.43.124.8880 > 192.168.43.146.7771: UDP, length 120
02:18:21.278905 IP 192.168.43.124.8880 > 192.168.43.146.7771: UDP, length 120
02:18:21.283075 IP 192.168.43.146.8880 > 192.168.43.147.7772: UDP, length 120
02:18:21.333074 IP 192.168.43.146.8880 > 192.168.43.147.7772: UDP, length 120
02:18:21.337207 IP 192.168.43.124.8880 > 192.168.43.146.7771: UDP, length 120
02:18:21.380311 IP 192.168.43.124.8880 > 192.168.43.146.7771: UDP, length 120
02:18:21.383079 IP 192.168.43.146.8880 > 192.168.43.147.7772: UDP, length 120
02:18:21.428625 IP 192.168.43.124.8880 > 192.168.43.146.7771: UDP, length 120
02:18:21.433083 IP 192.168.43.146.8880 > 192.168.43.147.7772: UDP, length 120
02:18:21.483082 IP 192.168.43.146.8880 > 192.168.43.147.7772: UDP, length 120
02:18:21.490434 IP 192.168.43.124.8880 > 192.168.43.146.7771: UDP, length 120
02:18:21.528626 IP 192.168.43.124.8880 > 192.168.43.146.7771: UDP, length 120
02:18:21.533089 IP 192.168.43.146.8880 > 192.168.43.147.7772: UDP, length 120
02:18:21.578665 IP 192.168.43.124.8880 > 192.168.43.146.7771: UDP, length 120
02:18:21.583079 IP 192.168.43.146.8880 > 192.168.43.147.7772: UDP, length 120
02:18:21.633142 IP 192.168.43.146.8880 > 192.168.43.147.7772: UDP, length 120
02:18:21.636096 IP 192.168.43.124.8880 > 192.168.43.146.7771: UDP, length 120
02:18:21.678790 IP 192.168.43.124.8880 > 192.168.43.146.7771: UDP, length 120
02:18:21.683157 IP 192.168.43.146.8880 > 192.168.43.147.7772: UDP, length 120
02:18:21.728629 IP 192.168.43.124.8880 > 192.168.43.146.7771: UDP, length 120
02:18:21.733119 IP 192.168.43.146.8880 > 192.168.43.147.7772: UDP, length 120
02:18:21.783083 IP 192.168.43.146.8880 > 192.168.43.147.7772: UDP, length 120
02:18:21.786318 IP 192.168.43.124.8880 > 192.168.43.146.7771: UDP, length 120
02:18:21.828608 IP 192.168.43.124.8880 > 192.168.43.146.7771: UDP, length 120
02:18:21.833081 IP 192.168.43.146.8880 > 192.168.43.147.7772: UDP, length 120
02:18:21.880193 IP 192.168.43.124.8880 > 192.168.43.146.7771: UDP, length 120
02:18:21.883079 IP 192.168.43.146.8880 > 192.168.43.147.7772: UDP, length 120
02:18:21.933077 IP 192.168.43.146.8880 > 192.168.43.147.7772: UDP, length 120
02:18:21.947839 IP 192.168.43.124.8880 > 192.168.43.146.7771: UDP, length 120
02:18:21.978401 IP 192.168.43.124.8880 > 192.168.43.146.7771: UDP, length 120
02:18:21.983077 IP 192.168.43.146.8880 > 192.168.43.147.7772: UDP, length 120
02:18:22.033077 IP 192.168.43.146.8880 > 192.168.43.147.7772: UDP, length 120
02:18:22.036321 IP 192.168.43.124.8880 > 192.168.43.146.7771: UDP, length 120
02:18:22.078560 IP 192.168.43.124.8880 > 192.168.43.146.7771: UDP, length 120
02:18:22.083079 IP 192.168.43.146.8880 > 192.168.43.147.7772: UDP, length 120
02:18:22.132226 IP 192.168.43.124.8880 > 192.168.43.146.7771: UDP, length 120
02:18:22.133076 IP 192.168.43.146.8880 > 192.168.43.147.7772: UDP, length 120
02:18:22.183077 IP 192.168.43.146.8880 > 192.168.43.147.7772: UDP, length 120
02:18:22.186324 IP 192.168.43.124.8880 > 192.168.43.146.7771: UDP, length 120
02:18:22.229977 IP 192.168.43.124.8880 > 192.168.43.146.7771: UDP, length 120
02:18:22.233078 IP 192.168.43.146.8880 > 192.168.43.147.7772: UDP, length 120
02:18:22.278705 IP 192.168.43.124.8880 > 192.168.43.146.7771: UDP, length 120
02:18:22.283077 IP 192.168.43.146.8880 > 192.168.43.147.7772: UDP, length 120
02:18:22.333076 IP 192.168.43.146.8880 > 192.168.43.147.7772: UDP, length 120
02:18:22.336321 IP 192.168.43.124.8880 > 192.168.43.146.7771: UDP, length 120
02:18:22.378652 IP 192.168.43.124.8880 > 192.168.43.146.7771: UDP, length 120
02:18:22.383078 IP 192.168.43.146.8880 > 192.168.43.147.7772: UDP, length 120
02:18:22.431227 IP 192.168.43.124.8880 > 192.168.43.146.7771: UDP, length 120
02:18:22.433076 IP 192.168.43.146.8880 > 192.168.43.147.7772: UDP, length 120
02:18:22.483083 IP 192.168.43.146.8880 > 192.168.43.147.7772: UDP, length 120
02:18:22.486330 IP 192.168.43.124.8880 > 192.168.43.146.7771: UDP, length 120
02:18:22.529189 IP 192.168.43.124.8880 > 192.168.43.146.7771: UDP, length 120
02:18:22.533117 IP 192.168.43.146.8880 > 192.168.43.147.7772: UDP, length 120
02:18:22.581423 IP 192.168.43.124.8880 > 192.168.43.146.7771: UDP, length 120
02:18:22.583083 IP 192.168.43.146.8880 > 192.168.43.147.7772: UDP, length 120
02:18:22.633107 IP 192.168.43.146.8880 > 192.168.43.147.7772: UDP, length 120
02:18:22.636514 IP 192.168.43.124.8880 > 192.168.43.146.7771: UDP, length 120
02:18:22.678708 IP 192.168.43.124.8880 > 192.168.43.146.7771: UDP, length 120
02:18:22.683105 IP 192.168.43.146.8880 > 192.168.43.147.7772: UDP, length 120
02:18:22.729038 IP 192.168.43.124.8880 > 192.168.43.146.7771: UDP, length 120
02:18:22.733188 IP 192.168.43.146.8880 > 192.168.43.147.7772: UDP, length 120
02:18:22.783172 IP 192.168.43.146.8880 > 192.168.43.147.7772: UDP, length 120
02:18:22.786628 IP 192.168.43.124.8880 > 192.168.43.146.7771: UDP, length 120
02:18:22.828732 IP 192.168.43.124.8880 > 192.168.43.146.7771: UDP, length 120
02:18:22.833120 IP 192.168.43.146.8880 > 192.168.43.147.7772: UDP, length 120
02:18:22.878760 IP 192.168.43.124.8880 > 192.168.43.146.7771: UDP, length 120
02:18:22.883107 IP 192.168.43.146.8880 > 192.168.43.147.7772: UDP, length 120
02:18:22.933103 IP 192.168.43.146.8880 > 192.168.43.147.7772: UDP, length 120
02:18:22.936494 IP 192.168.43.124.8880 > 192.168.43.146.7771: UDP, length 120
02:18:22.978691 IP 192.168.43.124.8880 > 192.168.43.146.7771: UDP, length 120
02:18:22.983107 IP 192.168.43.146.8880 > 192.168.43.147.7772: UDP, length 120
02:18:23.028866 IP 192.168.43.124.8880 > 192.168.43.146.7771: UDP, length 120
02:18:23.033106 IP 192.168.43.146.8880 > 192.168.43.147.7772: UDP, length 120
02:18:23.083101 IP 192.168.43.146.8880 > 192.168.43.147.7772: UDP, length 120
02:18:23.090330 IP 192.168.43.124.8880 > 192.168.43.146.7771: UDP, length 120
02:18:23.129229 IP 192.168.43.124.8880 > 192.168.43.146.7771: UDP, length 120
02:18:23.133103 IP 192.168.43.146.8880 > 192.168.43.147.7772: UDP, length 120
02:18:23.183101 IP 192.168.43.146.8880 > 192.168.43.147.7772: UDP, length 120
02:18:23.186517 IP 192.168.43.124.8880 > 192.168.43.146.7771: UDP, length 120
02:18:23.229139 IP 192.168.43.124.8880 > 192.168.43.146.7771: UDP, length 120
02:18:23.233100 IP 192.168.43.146.8880 > 192.168.43.147.7772: UDP, length 120
02:18:23.278582 IP 192.168.43.124.8880 > 192.168.43.146.7771: UDP, length 120
02:18:23.283099 IP 192.168.43.146.8880 > 192.168.43.147.7772: UDP, length 120
02:18:23.328205 IP 192.168.43.124.8880 > 192.168.43.146.7771: UDP, length 120
02:18:23.333104 IP 192.168.43.146.8880 > 192.168.43.147.7772: UDP, length 120
02:18:23.380913 IP 192.168.43.124.8880 > 192.168.43.146.7771: UDP, length 120
02:18:23.383101 IP 192.168.43.146.8880 > 192.168.43.147.7772: UDP, length 120
02:18:23.433115 IP 192.168.43.146.8880 > 192.168.43.147.7772: UDP, length 120
02:18:23.436553 IP 192.168.43.124.8880 > 192.168.43.146.7771: UDP, length 120
02:18:23.478727 IP 192.168.43.124.8880 > 192.168.43.146.7771: UDP, length 120
02:18:23.483112 IP 192.168.43.146.8880 > 192.168.43.147.7772: UDP, length 120
02:18:23.532795 IP 192.168.43.124.8880 > 192.168.43.146.7771: UDP, length 120
02:18:23.533129 IP 192.168.43.146.8880 > 192.168.43.147.7772: UDP, length 120
02:18:23.583105 IP 192.168.43.146.8880 > 192.168.43.147.7772: UDP, length 120
02:18:23.586543 IP 192.168.43.124.8880 > 192.168.43.146.7771: UDP, length 120
02:18:23.630442 IP 192.168.43.124.8880 > 192.168.43.146.7771: UDP, length 120
02:18:23.633123 IP 192.168.43.146.8880 > 192.168.43.147.7772: UDP, length 120
02:18:23.678731 IP 192.168.43.124.8880 > 192.168.43.146.7771: UDP, length 120
02:18:23.683102 IP 192.168.43.146.8880 > 192.168.43.147.7772: UDP, length 120
02:18:23.729083 IP 192.168.43.124.8880 > 192.168.43.146.7771: UDP, length 120
02:18:23.733101 IP 192.168.43.146.8880 > 192.168.43.147.7772: UDP, length 120
02:18:23.783159 IP 192.168.43.146.8880 > 192.168.43.147.7772: UDP, length 120
02:18:23.796325 IP 192.168.43.124.8880 > 192.168.43.146.7771: UDP, length 120
02:18:23.828900 IP 192.168.43.124.8880 > 192.168.43.146.7771: UDP, length 120
02:18:23.833120 IP 192.168.43.146.8880 > 192.168.43.147.7772: UDP, length 120
02:18:23.878749 IP 192.168.43.124.8880 > 192.168.43.146.7771: UDP, length 120
02:18:23.883104 IP 192.168.43.146.8880 > 192.168.43.147.7772: UDP, length 120
02:18:23.933112 IP 192.168.43.146.8880 > 192.168.43.147.7772: UDP, length 120
02:18:23.937739 IP 192.168.43.124.8880 > 192.168.43.146.7771: UDP, length 120
02:18:23.978915 IP 192.168.43.124.8880 > 192.168.43.146.7771: UDP, length 120
02:18:23.983102 IP 192.168.43.146.8880 > 192.168.43.147.7772: UDP, length 120
02:18:24.029088 IP 192.168.43.124.8880 > 192.168.43.146.7771: UDP, length 120
02:18:24.033139 IP 192.168.43.146.8880 > 192.168.43.147.7772: UDP, length 120
02:18:24.083105 IP 192.168.43.146.8880 > 192.168.43.147.7772: UDP, length 120
02:18:24.086550 IP 192.168.43.124.8880 > 192.168.43.146.7771: UDP, length 120
02:18:24.128712 IP 192.168.43.124.8880 > 192.168.43.146.7771: UDP, length 120
02:18:24.133103 IP 192.168.43.146.8880 > 192.168.43.147.7772: UDP, length 120
02:18:24.181235 IP 192.168.43.124.8880 > 192.168.43.146.7771: UDP, length 120
02:18:24.183126 IP 192.168.43.146.8880 > 192.168.43.147.7772: UDP, length 120
02:18:24.233104 IP 192.168.43.146.8880 > 192.168.43.147.7772: UDP, length 120
02:18:24.236542 IP 192.168.43.124.8880 > 192.168.43.146.7771: UDP, length 120
02:18:24.277948 IP 192.168.43.124.8880 > 192.168.43.146.7771: UDP, length 120
02:18:24.283101 IP 192.168.43.146.8880 > 192.168.43.147.7772: UDP, length 120
02:18:24.328324 IP 192.168.43.124.8880 > 192.168.43.146.7771: UDP, length 120
02:18:24.333099 IP 192.168.43.146.8880 > 192.168.43.147.7772: UDP, length 120
02:18:24.383188 IP 192.168.43.146.8880 > 192.168.43.147.7772: UDP, length 120
02:18:24.386779 IP 192.168.43.124.8880 > 192.168.43.146.7771: UDP, length 120
02:18:24.433207 IP 192.168.43.146.8880 > 192.168.43.147.7772: UDP, length 120
02:18:24.436875 IP 192.168.43.124.8880 > 192.168.43.146.7771: UDP, length 120
02:18:24.479168 IP 192.168.43.124.8880 > 192.168.43.146.7771: UDP, length 120
02:18:24.483206 IP 192.168.43.146.8880 > 192.168.43.147.7772: UDP, length 120
02:18:24.533139 IP 192.168.43.146.8880 > 192.168.43.147.7772: UDP, length 120
02:18:24.536496 IP 192.168.43.124.8880 > 192.168.43.146.7771: UDP, length 120
02:18:24.580341 IP 192.168.43.124.8880 > 192.168.43.146.7771: UDP, length 120
02:18:24.583184 IP 192.168.43.146.8880 > 192.168.43.147.7772: UDP, length 120
02:18:24.631358 IP 192.168.43.124.8880 > 192.168.43.146.7771: UDP, length 120
02:18:24.633148 IP 192.168.43.146.8880 > 192.168.43.147.7772: UDP, length 120
02:18:24.683141 IP 192.168.43.146.8880 > 192.168.43.147.7772: UDP, length 120
02:18:24.686570 IP 192.168.43.124.8880 > 192.168.43.146.7771: UDP, length 120
02:18:24.733135 IP 192.168.43.146.8880 > 192.168.43.147.7772: UDP, length 120
02:18:24.733680 IP 192.168.43.124.8880 > 192.168.43.146.7771: UDP, length 120
02:18:24.779513 IP 192.168.43.124.8880 > 192.168.43.146.7771: UDP, length 120
02:18:24.783138 IP 192.168.43.146.8880 > 192.168.43.147.7772: UDP, length 120
02:18:24.833159 IP 192.168.43.146.8880 > 192.168.43.147.7772: UDP, length 120
02:18:24.836569 IP 192.168.43.124.8880 > 192.168.43.146.7771: UDP, length 120
02:18:24.878628 IP 192.168.43.124.8880 > 192.168.43.146.7771: UDP, length 120
02:18:24.883121 IP 192.168.43.146.8880 > 192.168.43.147.7772: UDP, length 120
02:18:24.928881 IP 192.168.43.124.8880 > 192.168.43.146.7771: UDP, length 120
02:18:24.933088 IP 192.168.43.146.8880 > 192.168.43.147.7772: UDP, length 120
02:18:24.983080 IP 192.168.43.146.8880 > 192.168.43.147.7772: UDP, length 120
02:18:24.986327 IP 192.168.43.124.8880 > 192.168.43.146.7771: UDP, length 120
02:18:25.028581 IP 192.168.43.124.8880 > 192.168.43.146.7771: UDP, length 120
02:18:25.033081 IP 192.168.43.146.8880 > 192.168.43.147.7772: UDP, length 120
02:18:25.079258 IP 192.168.43.124.8880 > 192.168.43.146.7771: UDP, length 120
02:18:25.083080 IP 192.168.43.146.8880 > 192.168.43.147.7772: UDP, length 120
02:18:25.133077 IP 192.168.43.146.8880 > 192.168.43.147.7772: UDP, length 120
02:18:25.137784 IP 192.168.43.124.8880 > 192.168.43.146.7771: UDP, length 120
02:18:25.178516 IP 192.168.43.124.8880 > 192.168.43.146.7771: UDP, length 120
02:18:25.183078 IP 192.168.43.146.8880 > 192.168.43.147.7772: UDP, length 120
02:18:25.233075 IP 192.168.43.146.8880 > 192.168.43.147.7772: UDP, length 120
02:18:25.242888 IP 192.168.43.124.8880 > 192.168.43.146.7771: UDP, length 120
02:18:25.283076 IP 192.168.43.146.8880 > 192.168.43.147.7772: UDP, length 120
02:18:25.286315 IP 192.168.43.124.8880 > 192.168.43.146.7771: UDP, length 120
02:18:25.328717 IP 192.168.43.124.8880 > 192.168.43.146.7771: UDP, length 120
02:18:25.333078 IP 192.168.43.146.8880 > 192.168.43.147.7772: UDP, length 120
02:18:25.378630 IP 192.168.43.124.8880 > 192.168.43.146.7771: UDP, length 120
02:18:25.383077 IP 192.168.43.146.8880 > 192.168.43.147.7772: UDP, length 120
02:18:25.433079 IP 192.168.43.146.8880 > 192.168.43.147.7772: UDP, length 120
02:18:25.436313 IP 192.168.43.124.8880 > 192.168.43.146.7771: UDP, length 120
02:18:25.478607 IP 192.168.43.124.8880 > 192.168.43.146.7771: UDP, length 120
02:18:25.483078 IP 192.168.43.146.8880 > 192.168.43.147.7772: UDP, length 120
02:18:25.528651 IP 192.168.43.124.8880 > 192.168.43.146.7771: UDP, length 120
02:18:25.533110 IP 192.168.43.146.8880 > 192.168.43.147.7772: UDP, length 120
02:18:25.581776 IP 192.168.43.124.8880 > 192.168.43.146.7771: UDP, length 120
02:18:25.583081 IP 192.168.43.146.8880 > 192.168.43.147.7772: UDP, length 120
02:18:25.628401 IP 192.168.43.124.8880 > 192.168.43.146.7771: UDP, length 120
02:18:25.633086 IP 192.168.43.146.8880 > 192.168.43.147.7772: UDP, length 120
02:18:25.682507 IP 192.168.43.124.8880 > 192.168.43.146.7771: UDP, length 120
02:18:25.683083 IP 192.168.43.146.8880 > 192.168.43.147.7772: UDP, length 120
02:18:25.733077 IP 192.168.43.146.8880 > 192.168.43.147.7772: UDP, length 120
02:18:25.739993 IP 192.168.43.124.8880 > 192.168.43.146.7771: UDP, length 120
02:18:25.783149 IP 192.168.43.146.8880 > 192.168.43.147.7772: UDP, length 120
02:18:25.783439 IP 192.168.43.124.8880 > 192.168.43.146.7771: UDP, length 120
02:18:25.829581 IP 192.168.43.124.8880 > 192.168.43.146.7771: UDP, length 120
02:18:25.833110 IP 192.168.43.146.8880 > 192.168.43.147.7772: UDP, length 120
02:18:25.883079 IP 192.168.43.146.8880 > 192.168.43.147.7772: UDP, length 120
02:18:25.886322 IP 192.168.43.124.8880 > 192.168.43.146.7771: UDP, length 120
02:18:25.928585 IP 192.168.43.124.8880 > 192.168.43.146.7771: UDP, length 120
02:18:25.933081 IP 192.168.43.146.8880 > 192.168.43.147.7772: UDP, length 120
02:18:25.980897 IP 192.168.43.124.8880 > 192.168.43.146.7771: UDP, length 120
02:18:25.983078 IP 192.168.43.146.8880 > 192.168.43.147.7772: UDP, length 120
02:18:26.028602 IP 192.168.43.124.8880 > 192.168.43.146.7771: UDP, length 120
02:18:26.033077 IP 192.168.43.146.8880 > 192.168.43.147.7772: UDP, length 120
02:18:26.078627 IP 192.168.43.124.8880 > 192.168.43.146.7771: UDP, length 120
02:18:26.083077 IP 192.168.43.146.8880 > 192.168.43.147.7772: UDP, length 120
02:18:26.133075 IP 192.168.43.146.8880 > 192.168.43.147.7772: UDP, length 120
02:18:26.136314 IP 192.168.43.124.8880 > 192.168.43.146.7771: UDP, length 120
02:18:26.178601 IP 192.168.43.124.8880 > 192.168.43.146.7771: UDP, length 120
02:18:26.183077 IP 192.168.43.146.8880 > 192.168.43.147.7772: UDP, length 120
02:18:26.229147 IP 192.168.43.124.8880 > 192.168.43.146.7771: UDP, length 120
02:18:26.233076 IP 192.168.43.146.8880 > 192.168.43.147.7772: UDP, length 120
02:18:26.283075 IP 192.168.43.146.8880 > 192.168.43.147.7772: UDP, length 120
02:18:26.286314 IP 192.168.43.124.8880 > 192.168.43.146.7771: UDP, length 120
02:18:26.332021 IP 192.168.43.124.8880 > 192.168.43.146.7771: UDP, length 120
02:18:26.333076 IP 192.168.43.146.8880 > 192.168.43.147.7772: UDP, length 120
02:18:26.379635 IP 192.168.43.124.8880 > 192.168.43.146.7771: UDP, length 120
02:18:26.383069 IP 192.168.43.146.8880 > 192.168.43.147.7772: UDP, length 120
02:18:26.433079 IP 192.168.43.146.8880 > 192.168.43.147.7772: UDP, length 120
