22:31:05.341472 IP 192.168.43.124.8880 > 192.168.43.195.7771: UDP, length 120
22:31:05.391621 IP 192.168.43.124.8880 > 192.168.43.195.7771: UDP, length 120
22:31:05.441624 IP 192.168.43.124.8880 > 192.168.43.195.7771: UDP, length 120
22:31:05.491624 IP 192.168.43.124.8880 > 192.168.43.195.7771: UDP, length 120
22:31:05.541623 IP 192.168.43.124.8880 > 192.168.43.195.7771: UDP, length 120
22:31:05.591623 IP 192.168.43.124.8880 > 192.168.43.195.7771: UDP, length 120
22:31:05.641624 IP 192.168.43.124.8880 > 192.168.43.195.7771: UDP, length 120
22:31:05.691621 IP 192.168.43.124.8880 > 192.168.43.195.7771: UDP, length 120
22:31:05.741672 IP 192.168.43.124.8880 > 192.168.43.195.7771: UDP, length 120
22:31:05.791673 IP 192.168.43.124.8880 > 192.168.43.195.7771: UDP, length 120
22:31:05.841672 IP 192.168.43.124.8880 > 192.168.43.195.7771: UDP, length 120
22:31:05.891630 IP 192.168.43.124.8880 > 192.168.43.195.7771: UDP, length 120
22:31:05.941623 IP 192.168.43.124.8880 > 192.168.43.195.7771: UDP, length 120
22:31:05.991626 IP 192.168.43.124.8880 > 192.168.43.195.7771: UDP, length 120
22:31:06.041624 IP 192.168.43.124.8880 > 192.168.43.195.7771: UDP, length 120
22:31:06.091623 IP 192.168.43.124.8880 > 192.168.43.195.7771: UDP, length 120
22:31:06.141624 IP 192.168.43.124.8880 > 192.168.43.195.7771: UDP, length 120
22:31:06.191623 IP 192.168.43.124.8880 > 192.168.43.195.7771: UDP, length 120
22:31:06.241623 IP 192.168.43.124.8880 > 192.168.43.195.7771: UDP, length 120
22:31:06.291624 IP 192.168.43.124.8880 > 192.168.43.195.7771: UDP, length 120
22:31:06.341671 IP 192.168.43.124.8880 > 192.168.43.195.7771: UDP, length 120
22:31:06.391672 IP 192.168.43.124.8880 > 192.168.43.195.7771: UDP, length 120
22:31:06.441674 IP 192.168.43.124.8880 > 192.168.43.195.7771: UDP, length 120
22:31:06.491673 IP 192.168.43.124.8880 > 192.168.43.195.7771: UDP, length 120
22:31:06.541673 IP 192.168.43.124.8880 > 192.168.43.195.7771: UDP, length 120
22:31:06.591673 IP 192.168.43.124.8880 > 192.168.43.195.7771: UDP, length 120
22:31:06.641673 IP 192.168.43.124.8880 > 192.168.43.195.7771: UDP, length 120
22:31:06.691674 IP 192.168.43.124.8880 > 192.168.43.195.7771: UDP, length 120
22:31:06.741673 IP 192.168.43.124.8880 > 192.168.43.195.7771: UDP, length 120
22:31:06.791672 IP 192.168.43.124.8880 > 192.168.43.195.7771: UDP, length 120
22:31:06.841673 IP 192.168.43.124.8880 > 192.168.43.195.7771: UDP, length 120
22:31:06.891615 IP 192.168.43.124.8880 > 192.168.43.195.7771: UDP, length 120
22:31:06.941623 IP 192.168.43.124.8880 > 192.168.43.195.7771: UDP, length 120
22:31:06.991552 IP 192.168.43.124.8880 > 192.168.43.195.7771: UDP, length 120
22:31:07.041626 IP 192.168.43.124.8880 > 192.168.43.195.7771: UDP, length 120
22:31:07.091622 IP 192.168.43.124.8880 > 192.168.43.195.7771: UDP, length 120
22:31:07.141622 IP 192.168.43.124.8880 > 192.168.43.195.7771: UDP, length 120
22:31:07.191624 IP 192.168.43.124.8880 > 192.168.43.195.7771: UDP, length 120
22:31:07.241623 IP 192.168.43.124.8880 > 192.168.43.195.7771: UDP, length 120
22:31:07.291621 IP 192.168.43.124.8880 > 192.168.43.195.7771: UDP, length 120
22:31:07.341671 IP 192.168.43.124.8880 > 192.168.43.195.7771: UDP, length 120
22:31:07.391624 IP 192.168.43.124.8880 > 192.168.43.195.7771: UDP, length 120
22:31:07.441586 IP 192.168.43.124.8880 > 192.168.43.195.7771: UDP, length 120
22:31:07.491623 IP 192.168.43.124.8880 > 192.168.43.195.7771: UDP, length 120
22:31:07.541623 IP 192.168.43.124.8880 > 192.168.43.195.7771: UDP, length 120
22:31:07.591625 IP 192.168.43.124.8880 > 192.168.43.195.7771: UDP, length 120
22:31:07.641624 IP 192.168.43.124.8880 > 192.168.43.195.7771: UDP, length 120
22:31:07.691627 IP 192.168.43.124.8880 > 192.168.43.195.7771: UDP, length 120
22:31:07.741624 IP 192.168.43.124.8880 > 192.168.43.195.7771: UDP, length 120
22:31:07.791671 IP 192.168.43.124.8880 > 192.168.43.195.7771: UDP, length 120
22:31:07.841673 IP 192.168.43.124.8880 > 192.168.43.195.7771: UDP, length 120
22:31:07.891672 IP 192.168.43.124.8880 > 192.168.43.195.7771: UDP, length 120
22:31:07.941629 IP 192.168.43.124.8880 > 192.168.43.195.7771: UDP, length 120
22:31:07.991630 IP 192.168.43.124.8880 > 192.168.43.195.7771: UDP, length 120
22:31:08.041628 IP 192.168.43.124.8880 > 192.168.43.195.7771: UDP, length 120
22:31:08.091627 IP 192.168.43.124.8880 > 192.168.43.195.7771: UDP, length 120
22:31:08.141625 IP 192.168.43.124.8880 > 192.168.43.195.7771: UDP, length 120
22:31:08.191627 IP 192.168.43.124.8880 > 192.168.43.195.7771: UDP, length 120
22:31:08.241629 IP 192.168.43.124.8880 > 192.168.43.195.7771: UDP, length 120
22:31:08.291622 IP 192.168.43.124.8880 > 192.168.43.195.7771: UDP, length 120
22:31:08.341624 IP 192.168.43.124.8880 > 192.168.43.195.7771: UDP, length 120
22:31:08.391673 IP 192.168.43.124.8880 > 192.168.43.195.7771: UDP, length 120
22:31:08.441672 IP 192.168.43.124.8880 > 192.168.43.195.7771: UDP, length 120
22:31:08.491674 IP 192.168.43.124.8880 > 192.168.43.195.7771: UDP, length 120
22:31:08.541674 IP 192.168.43.124.8880 > 192.168.43.195.7771: UDP, length 120
22:31:08.591671 IP 192.168.43.124.8880 > 192.168.43.195.7771: UDP, length 120
22:31:08.641672 IP 192.168.43.124.8880 > 192.168.43.195.7771: UDP, length 120
22:31:08.691674 IP 192.168.43.124.8880 > 192.168.43.195.7771: UDP, length 120
22:31:08.741626 IP 192.168.43.124.8880 > 192.168.43.195.7771: UDP, length 120
22:31:08.791628 IP 192.168.43.124.8880 > 192.168.43.195.7771: UDP, length 120
22:31:08.841626 IP 192.168.43.124.8880 > 192.168.43.195.7771: UDP, length 120
22:31:08.891628 IP 192.168.43.124.8880 > 192.168.43.195.7771: UDP, length 120
22:31:08.941622 IP 192.168.43.124.8880 > 192.168.43.195.7771: UDP, length 120
22:31:08.991624 IP 192.168.43.124.8880 > 192.168.43.195.7771: UDP, length 120
22:31:09.041624 IP 192.168.43.124.8880 > 192.168.43.195.7771: UDP, length 120
22:31:09.091624 IP 192.168.43.124.8880 > 192.168.43.195.7771: UDP, length 120
22:31:09.141622 IP 192.168.43.124.8880 > 192.168.43.195.7771: UDP, length 120
22:31:09.191622 IP 192.168.43.124.8880 > 192.168.43.195.7771: UDP, length 120
22:31:09.241620 IP 192.168.43.124.8880 > 192.168.43.195.7771: UDP, length 120
22:31:09.291620 IP 192.168.43.124.8880 > 192.168.43.195.7771: UDP, length 120
22:31:09.341622 IP 192.168.43.124.8880 > 192.168.43.195.7771: UDP, length 120
22:31:09.391620 IP 192.168.43.124.8880 > 192.168.43.195.7771: UDP, length 120
22:31:09.441621 IP 192.168.43.124.8880 > 192.168.43.195.7771: UDP, length 120
22:31:09.491622 IP 192.168.43.124.8880 > 192.168.43.195.7771: UDP, length 120
22:31:09.541585 IP 192.168.43.124.8880 > 192.168.43.195.7771: UDP, length 120
22:31:09.591745 IP 192.168.43.124.8880 > 192.168.43.195.7771: UDP, length 120
22:31:09.641625 IP 192.168.43.124.8880 > 192.168.43.195.7771: UDP, length 120
22:31:09.691623 IP 192.168.43.124.8880 > 192.168.43.195.7771: UDP, length 120
22:31:09.741624 IP 192.168.43.124.8880 > 192.168.43.195.7771: UDP, length 120
22:31:09.791622 IP 192.168.43.124.8880 > 192.168.43.195.7771: UDP, length 120
22:31:09.841624 IP 192.168.43.124.8880 > 192.168.43.195.7771: UDP, length 120
22:31:09.891622 IP 192.168.43.124.8880 > 192.168.43.195.7771: UDP, length 120
22:31:09.941559 IP 192.168.43.124.8880 > 192.168.43.195.7771: UDP, length 120
22:31:09.991557 IP 192.168.43.124.8880 > 192.168.43.195.7771: UDP, length 120
22:31:10.041555 IP 192.168.43.124.8880 > 192.168.43.195.7771: UDP, length 120
22:31:10.091570 IP 192.168.43.124.8880 > 192.168.43.195.7771: UDP, length 120
22:31:10.141621 IP 192.168.43.124.8880 > 192.168.43.195.7771: UDP, length 120
22:31:10.191619 IP 192.168.43.124.8880 > 192.168.43.195.7771: UDP, length 120
22:31:10.241619 IP 192.168.43.124.8880 > 192.168.43.195.7771: UDP, length 120
22:31:10.291622 IP 192.168.43.124.8880 > 192.168.43.195.7771: UDP, length 120
22:31:10.341621 IP 192.168.43.124.8880 > 192.168.43.195.7771: UDP, length 120
22:31:10.391622 IP 192.168.43.124.8880 > 192.168.43.195.7771: UDP, length 120
22:31:10.441622 IP 192.168.43.124.8880 > 192.168.43.195.7771: UDP, length 120
22:31:10.491620 IP 192.168.43.124.8880 > 192.168.43.195.7771: UDP, length 120
22:31:10.541672 IP 192.168.43.124.8880 > 192.168.43.195.7771: UDP, length 120
22:31:10.591671 IP 192.168.43.124.8880 > 192.168.43.195.7771: UDP, length 120
22:31:10.641671 IP 192.168.43.124.8880 > 192.168.43.195.7771: UDP, length 120
22:31:10.691673 IP 192.168.43.124.8880 > 192.168.43.195.7771: UDP, length 120
22:31:10.741672 IP 192.168.43.124.8880 > 192.168.43.195.7771: UDP, length 120
22:31:10.791672 IP 192.168.43.124.8880 > 192.168.43.195.7771: UDP, length 120
22:31:10.841671 IP 192.168.43.124.8880 > 192.168.43.195.7771: UDP, length 120
22:31:10.891672 IP 192.168.43.124.8880 > 192.168.43.195.7771: UDP, length 120
22:31:10.941623 IP 192.168.43.124.8880 > 192.168.43.195.7771: UDP, length 120
22:31:10.991624 IP 192.168.43.124.8880 > 192.168.43.195.7771: UDP, length 120
22:31:11.041625 IP 192.168.43.124.8880 > 192.168.43.195.7771: UDP, length 120
22:31:11.091626 IP 192.168.43.124.8880 > 192.168.43.195.7771: UDP, length 120
22:31:11.141670 IP 192.168.43.124.8880 > 192.168.43.195.7771: UDP, length 120
22:31:11.191672 IP 192.168.43.124.8880 > 192.168.43.195.7771: UDP, length 120
22:31:11.241665 IP 192.168.43.124.8880 > 192.168.43.195.7771: UDP, length 120
22:31:11.291672 IP 192.168.43.124.8880 > 192.168.43.195.7771: UDP, length 120
22:31:11.341599 IP 192.168.43.124.8880 > 192.168.43.195.7771: UDP, length 120
22:31:11.391625 IP 192.168.43.124.8880 > 192.168.43.195.7771: UDP, length 120
22:31:11.441625 IP 192.168.43.124.8880 > 192.168.43.195.7771: UDP, length 120
22:31:11.491625 IP 192.168.43.124.8880 > 192.168.43.195.7771: UDP, length 120
22:31:11.541624 IP 192.168.43.124.8880 > 192.168.43.195.7771: UDP, length 120
22:31:11.591626 IP 192.168.43.124.8880 > 192.168.43.195.7771: UDP, length 120
22:31:11.641622 IP 192.168.43.124.8880 > 192.168.43.195.7771: UDP, length 120
22:31:11.691624 IP 192.168.43.124.8880 > 192.168.43.195.7771: UDP, length 120
22:31:11.742233 IP 192.168.43.124.8880 > 192.168.43.195.7771: UDP, length 120
22:31:11.791625 IP 192.168.43.124.8880 > 192.168.43.195.7771: UDP, length 120
22:31:11.841621 IP 192.168.43.124.8880 > 192.168.43.195.7771: UDP, length 120
22:31:11.891620 IP 192.168.43.124.8880 > 192.168.43.195.7771: UDP, length 120
22:31:11.941624 IP 192.168.43.124.8880 > 192.168.43.195.7771: UDP, length 120
22:31:11.991624 IP 192.168.43.124.8880 > 192.168.43.195.7771: UDP, length 120
22:31:12.041623 IP 192.168.43.124.8880 > 192.168.43.195.7771: UDP, length 120
22:31:12.091625 IP 192.168.43.124.8880 > 192.168.43.195.7771: UDP, length 120
22:31:12.141624 IP 192.168.43.124.8880 > 192.168.43.195.7771: UDP, length 120
22:31:12.191623 IP 192.168.43.124.8880 > 192.168.43.195.7771: UDP, length 120
22:31:12.241597 IP 192.168.43.124.8880 > 192.168.43.195.7771: UDP, length 120
22:31:12.291671 IP 192.168.43.124.8880 > 192.168.43.195.7771: UDP, length 120
22:31:12.341670 IP 192.168.43.124.8880 > 192.168.43.195.7771: UDP, length 120
22:31:12.391625 IP 192.168.43.124.8880 > 192.168.43.195.7771: UDP, length 120
22:31:12.441624 IP 192.168.43.124.8880 > 192.168.43.195.7771: UDP, length 120
22:31:12.491626 IP 192.168.43.124.8880 > 192.168.43.195.7771: UDP, length 120
22:31:12.541625 IP 192.168.43.124.8880 > 192.168.43.195.7771: UDP, length 120
22:31:12.591625 IP 192.168.43.124.8880 > 192.168.43.195.7771: UDP, length 120
22:31:12.641623 IP 192.168.43.124.8880 > 192.168.43.195.7771: UDP, length 120
22:31:12.691624 IP 192.168.43.124.8880 > 192.168.43.195.7771: UDP, length 120
22:31:12.741624 IP 192.168.43.124.8880 > 192.168.43.195.7771: UDP, length 120
22:31:12.791625 IP 192.168.43.124.8880 > 192.168.43.195.7771: UDP, length 120
22:31:12.841624 IP 192.168.43.124.8880 > 192.168.43.195.7771: UDP, length 120
22:31:12.891623 IP 192.168.43.124.8880 > 192.168.43.195.7771: UDP, length 120
22:31:12.941622 IP 192.168.43.124.8880 > 192.168.43.195.7771: UDP, length 120
22:31:12.991626 IP 192.168.43.124.8880 > 192.168.43.195.7771: UDP, length 120
22:31:13.041624 IP 192.168.43.124.8880 > 192.168.43.195.7771: UDP, length 120
22:31:13.091625 IP 192.168.43.124.8880 > 192.168.43.195.7771: UDP, length 120
22:31:13.141624 IP 192.168.43.124.8880 > 192.168.43.195.7771: UDP, length 120
22:31:13.191624 IP 192.168.43.124.8880 > 192.168.43.195.7771: UDP, length 120
22:31:13.241669 IP 192.168.43.124.8880 > 192.168.43.195.7771: UDP, length 120
22:31:13.291671 IP 192.168.43.124.8880 > 192.168.43.195.7771: UDP, length 120
22:31:13.341594 IP 192.168.43.124.8880 > 192.168.43.195.7771: UDP, length 120
22:31:13.391671 IP 192.168.43.124.8880 > 192.168.43.195.7771: UDP, length 120
22:31:13.441673 IP 192.168.43.124.8880 > 192.168.43.195.7771: UDP, length 120
22:31:13.491669 IP 192.168.43.124.8880 > 192.168.43.195.7771: UDP, length 120
22:31:13.541631 IP 192.168.43.124.8880 > 192.168.43.195.7771: UDP, length 120
22:31:13.591626 IP 192.168.43.124.8880 > 192.168.43.195.7771: UDP, length 120
22:31:13.641626 IP 192.168.43.124.8880 > 192.168.43.195.7771: UDP, length 120
22:31:13.691624 IP 192.168.43.124.8880 > 192.168.43.195.7771: UDP, length 120
22:31:13.741624 IP 192.168.43.124.8880 > 192.168.43.195.7771: UDP, length 120
22:31:13.791588 IP 192.168.43.124.8880 > 192.168.43.195.7771: UDP, length 120
22:31:13.841625 IP 192.168.43.124.8880 > 192.168.43.195.7771: UDP, length 120
22:31:13.891624 IP 192.168.43.124.8880 > 192.168.43.195.7771: UDP, length 120
22:31:13.941624 IP 192.168.43.124.8880 > 192.168.43.195.7771: UDP, length 120
22:31:13.991623 IP 192.168.43.124.8880 > 192.168.43.195.7771: UDP, length 120
22:31:14.041624 IP 192.168.43.124.8880 > 192.168.43.195.7771: UDP, length 120
22:31:14.091624 IP 192.168.43.124.8880 > 192.168.43.195.7771: UDP, length 120
22:31:14.141671 IP 192.168.43.124.8880 > 192.168.43.195.7771: UDP, length 120
22:31:14.191673 IP 192.168.43.124.8880 > 192.168.43.195.7771: UDP, length 120
22:31:14.241624 IP 192.168.43.124.8880 > 192.168.43.195.7771: UDP, length 120
22:31:14.291671 IP 192.168.43.124.8880 > 192.168.43.195.7771: UDP, length 120
22:31:14.341672 IP 192.168.43.124.8880 > 192.168.43.195.7771: UDP, length 120
22:31:14.391673 IP 192.168.43.124.8880 > 192.168.43.195.7771: UDP, length 120
22:31:14.441673 IP 192.168.43.124.8880 > 192.168.43.195.7771: UDP, length 120
22:31:14.491674 IP 192.168.43.124.8880 > 192.168.43.195.7771: UDP, length 120
22:31:14.541671 IP 192.168.43.124.8880 > 192.168.43.195.7771: UDP, length 120
22:31:14.591673 IP 192.168.43.124.8880 > 192.168.43.195.7771: UDP, length 120
22:31:14.641673 IP 192.168.43.124.8880 > 192.168.43.195.7771: UDP, length 120
22:31:14.691673 IP 192.168.43.124.8880 > 192.168.43.195.7771: UDP, length 120
22:31:14.741672 IP 192.168.43.124.8880 > 192.168.43.195.7771: UDP, length 120
22:31:14.791626 IP 192.168.43.124.8880 > 192.168.43.195.7771: UDP, length 120
22:31:14.841626 IP 192.168.43.124.8880 > 192.168.43.195.7771: UDP, length 120
22:31:14.891623 IP 192.168.43.124.8880 > 192.168.43.195.7771: UDP, length 120
22:31:14.941655 IP 192.168.43.124.8880 > 192.168.43.195.7771: UDP, length 120
22:31:14.991624 IP 192.168.43.124.8880 > 192.168.43.195.7771: UDP, length 120
22:31:15.041621 IP 192.168.43.124.8880 > 192.168.43.195.7771: UDP, length 120
22:31:15.091553 IP 192.168.43.124.8880 > 192.168.43.195.7771: UDP, length 120
22:31:15.141543 IP 192.168.43.124.8880 > 192.168.43.195.7771: UDP, length 120
22:31:15.191573 IP 192.168.43.124.8880 > 192.168.43.195.7771: UDP, length 120
22:31:15.241619 IP 192.168.43.124.8880 > 192.168.43.195.7771: UDP, length 120
22:31:15.291620 IP 192.168.43.124.8880 > 192.168.43.195.7771: UDP, length 120
22:31:15.341625 IP 192.168.43.124.8880 > 192.168.43.195.7771: UDP, length 120
22:31:15.391620 IP 192.168.43.124.8880 > 192.168.43.195.7771: UDP, length 120
22:31:15.441599 IP 192.168.43.124.8880 > 192.168.43.195.7771: UDP, length 120
22:31:15.491670 IP 192.168.43.124.8880 > 192.168.43.195.7771: UDP, length 120
22:31:15.541670 IP 192.168.43.124.8880 > 192.168.43.195.7771: UDP, length 120
22:31:15.591670 IP 192.168.43.124.8880 > 192.168.43.195.7771: UDP, length 120
22:31:15.641671 IP 192.168.43.124.8880 > 192.168.43.195.7771: UDP, length 120
22:31:15.691671 IP 192.168.43.124.8880 > 192.168.43.195.7771: UDP, length 120
22:31:15.741671 IP 192.168.43.124.8880 > 192.168.43.195.7771: UDP, length 120
22:31:15.791666 IP 192.168.43.124.8880 > 192.168.43.195.7771: UDP, length 120
22:31:15.841671 IP 192.168.43.124.8880 > 192.168.43.195.7771: UDP, length 120
22:31:15.891671 IP 192.168.43.124.8880 > 192.168.43.195.7771: UDP, length 120
22:31:15.941571 IP 192.168.43.124.8880 > 192.168.43.195.7771: UDP, length 120
22:31:15.991620 IP 192.168.43.124.8880 > 192.168.43.195.7771: UDP, length 120
22:31:16.041622 IP 192.168.43.124.8880 > 192.168.43.195.7771: UDP, length 120
22:31:16.091622 IP 192.168.43.124.8880 > 192.168.43.195.7771: UDP, length 120
22:31:16.141622 IP 192.168.43.124.8880 > 192.168.43.195.7771: UDP, length 120
22:31:16.191620 IP 192.168.43.124.8880 > 192.168.43.195.7771: UDP, length 120
22:31:16.241670 IP 192.168.43.124.8880 > 192.168.43.195.7771: UDP, length 120
22:31:16.291672 IP 192.168.43.124.8880 > 192.168.43.195.7771: UDP, length 120
22:31:16.341670 IP 192.168.43.124.8880 > 192.168.43.195.7771: UDP, length 120
22:31:16.391673 IP 192.168.43.124.8880 > 192.168.43.195.7771: UDP, length 120
22:31:16.441670 IP 192.168.43.124.8880 > 192.168.43.195.7771: UDP, length 120
22:31:16.491671 IP 192.168.43.124.8880 > 192.168.43.195.7771: UDP, length 120
22:31:16.541618 IP 192.168.43.124.8880 > 192.168.43.195.7771: UDP, length 120
22:31:16.591621 IP 192.168.43.124.8880 > 192.168.43.195.7771: UDP, length 120
22:31:16.641623 IP 192.168.43.124.8880 > 192.168.43.195.7771: UDP, length 120
22:31:16.691623 IP 192.168.43.124.8880 > 192.168.43.195.7771: UDP, length 120
22:31:16.741624 IP 192.168.43.124.8880 > 192.168.43.195.7771: UDP, length 120
22:31:16.791622 IP 192.168.43.124.8880 > 192.168.43.195.7771: UDP, length 120
22:31:16.841553 IP 192.168.43.124.8880 > 192.168.43.195.7771: UDP, length 120
22:31:16.891534 IP 192.168.43.124.8880 > 192.168.43.195.7771: UDP, length 120
22:31:16.941623 IP 192.168.43.124.8880 > 192.168.43.195.7771: UDP, length 120
22:31:16.991623 IP 192.168.43.124.8880 > 192.168.43.195.7771: UDP, length 120
22:31:17.041625 IP 192.168.43.124.8880 > 192.168.43.195.7771: UDP, length 120
22:31:17.091624 IP 192.168.43.124.8880 > 192.168.43.195.7771: UDP, length 120
22:31:17.141622 IP 192.168.43.124.8880 > 192.168.43.195.7771: UDP, length 120
22:31:17.191624 IP 192.168.43.124.8880 > 192.168.43.195.7771: UDP, length 120
22:31:17.241671 IP 192.168.43.124.8880 > 192.168.43.195.7771: UDP, length 120
22:31:17.291673 IP 192.168.43.124.8880 > 192.168.43.195.7771: UDP, length 120
22:31:17.341672 IP 192.168.43.124.8880 > 192.168.43.195.7771: UDP, length 120
22:31:17.391671 IP 192.168.43.124.8880 > 192.168.43.195.7771: UDP, length 120
22:31:17.441670 IP 192.168.43.124.8880 > 192.168.43.195.7771: UDP, length 120
22:31:17.491672 IP 192.168.43.124.8880 > 192.168.43.195.7771: UDP, length 120
22:31:17.541671 IP 192.168.43.124.8880 > 192.168.43.195.7771: UDP, length 120
22:31:17.591671 IP 192.168.43.124.8880 > 192.168.43.195.7771: UDP, length 120
22:31:17.641670 IP 192.168.43.124.8880 > 192.168.43.195.7771: UDP, length 120
22:31:17.691671 IP 192.168.43.124.8880 > 192.168.43.195.7771: UDP, length 120
22:31:17.741671 IP 192.168.43.124.8880 > 192.168.43.195.7771: UDP, length 120
22:31:17.791668 IP 192.168.43.124.8880 > 192.168.43.195.7771: UDP, length 120
22:31:17.841670 IP 192.168.43.124.8880 > 192.168.43.195.7771: UDP, length 120
22:31:17.891671 IP 192.168.43.124.8880 > 192.168.43.195.7771: UDP, length 120
22:31:17.941620 IP 192.168.43.124.8880 > 192.168.43.195.7771: UDP, length 120
22:31:17.991621 IP 192.168.43.124.8880 > 192.168.43.195.7771: UDP, length 120
22:31:18.041622 IP 192.168.43.124.8880 > 192.168.43.195.7771: UDP, length 120
22:31:18.091555 IP 192.168.43.124.8880 > 192.168.43.195.7771: UDP, length 120
22:31:18.141621 IP 192.168.43.124.8880 > 192.168.43.195.7771: UDP, length 120
22:31:18.191623 IP 192.168.43.124.8880 > 192.168.43.195.7771: UDP, length 120
22:31:18.241619 IP 192.168.43.124.8880 > 192.168.43.195.7771: UDP, length 120
22:31:18.291672 IP 192.168.43.124.8880 > 192.168.43.195.7771: UDP, length 120
22:31:18.341671 IP 192.168.43.124.8880 > 192.168.43.195.7771: UDP, length 120
22:31:18.391624 IP 192.168.43.124.8880 > 192.168.43.195.7771: UDP, length 120
22:31:18.441624 IP 192.168.43.124.8880 > 192.168.43.195.7771: UDP, length 120
22:31:18.491623 IP 192.168.43.124.8880 > 192.168.43.195.7771: UDP, length 120
22:31:18.541625 IP 192.168.43.124.8880 > 192.168.43.195.7771: UDP, length 120
22:31:18.591626 IP 192.168.43.124.8880 > 192.168.43.195.7771: UDP, length 120
22:31:18.641624 IP 192.168.43.124.8880 > 192.168.43.195.7771: UDP, length 120
22:31:18.691623 IP 192.168.43.124.8880 > 192.168.43.195.7771: UDP, length 120
22:31:18.741624 IP 192.168.43.124.8880 > 192.168.43.195.7771: UDP, length 120
22:31:18.791625 IP 192.168.43.124.8880 > 192.168.43.195.7771: UDP, length 120
22:31:18.841624 IP 192.168.43.124.8880 > 192.168.43.195.7771: UDP, length 120
22:31:18.891625 IP 192.168.43.124.8880 > 192.168.43.195.7771: UDP, length 120
22:31:18.941613 IP 192.168.43.124.8880 > 192.168.43.195.7771: UDP, length 120
22:31:18.991621 IP 192.168.43.124.8880 > 192.168.43.195.7771: UDP, length 120
22:31:19.041622 IP 192.168.43.124.8880 > 192.168.43.195.7771: UDP, length 120
22:31:19.091622 IP 192.168.43.124.8880 > 192.168.43.195.7771: UDP, length 120
22:31:19.141621 IP 192.168.43.124.8880 > 192.168.43.195.7771: UDP, length 120
22:31:19.191621 IP 192.168.43.124.8880 > 192.168.43.195.7771: UDP, length 120
22:31:19.241670 IP 192.168.43.124.8880 > 192.168.43.195.7771: UDP, length 120
22:31:19.291670 IP 192.168.43.124.8880 > 192.168.43.195.7771: UDP, length 120
22:31:19.341627 IP 192.168.43.124.8880 > 192.168.43.195.7771: UDP, length 120
22:31:19.391625 IP 192.168.43.124.8880 > 192.168.43.195.7771: UDP, length 120
22:31:19.441623 IP 192.168.43.124.8880 > 192.168.43.195.7771: UDP, length 120
22:31:19.491579 IP 192.168.43.124.8880 > 192.168.43.195.7771: UDP, length 120
22:31:19.541625 IP 192.168.43.124.8880 > 192.168.43.195.7771: UDP, length 120
22:31:19.591624 IP 192.168.43.124.8880 > 192.168.43.195.7771: UDP, length 120
22:31:19.641669 IP 192.168.43.124.8880 > 192.168.43.195.7771: UDP, length 120
22:31:19.691671 IP 192.168.43.124.8880 > 192.168.43.195.7771: UDP, length 120
22:31:19.741670 IP 192.168.43.124.8880 > 192.168.43.195.7771: UDP, length 120
22:31:19.791672 IP 192.168.43.124.8880 > 192.168.43.195.7771: UDP, length 120
22:31:19.841671 IP 192.168.43.124.8880 > 192.168.43.195.7771: UDP, length 120
22:31:19.891672 IP 192.168.43.124.8880 > 192.168.43.195.7771: UDP, length 120
22:31:19.941616 IP 192.168.43.124.8880 > 192.168.43.195.7771: UDP, length 120
22:31:19.991620 IP 192.168.43.124.8880 > 192.168.43.195.7771: UDP, length 120
22:31:20.041620 IP 192.168.43.124.8880 > 192.168.43.195.7771: UDP, length 120
22:31:20.091621 IP 192.168.43.124.8880 > 192.168.43.195.7771: UDP, length 120
22:31:20.141619 IP 192.168.43.124.8880 > 192.168.43.195.7771: UDP, length 120
22:31:20.191549 IP 192.168.43.124.8880 > 192.168.43.195.7771: UDP, length 120
22:31:20.241788 IP 192.168.43.124.8880 > 192.168.43.195.7771: UDP, length 120
22:31:20.291571 IP 192.168.43.124.8880 > 192.168.43.195.7771: UDP, length 120
22:31:20.341621 IP 192.168.43.124.8880 > 192.168.43.195.7771: UDP, length 120
22:31:20.391622 IP 192.168.43.124.8880 > 192.168.43.195.7771: UDP, length 120
22:31:20.441620 IP 192.168.43.124.8880 > 192.168.43.195.7771: UDP, length 120
22:31:20.491622 IP 192.168.43.124.8880 > 192.168.43.195.7771: UDP, length 120
22:31:20.541621 IP 192.168.43.124.8880 > 192.168.43.195.7771: UDP, length 120
22:31:20.591623 IP 192.168.43.124.8880 > 192.168.43.195.7771: UDP, length 120
22:31:20.641621 IP 192.168.43.124.8880 > 192.168.43.195.7771: UDP, length 120
22:31:20.691624 IP 192.168.43.124.8880 > 192.168.43.195.7771: UDP, length 120
22:31:20.741621 IP 192.168.43.124.8880 > 192.168.43.195.7771: UDP, length 120
22:31:20.791623 IP 192.168.43.124.8880 > 192.168.43.195.7771: UDP, length 120
22:31:20.841622 IP 192.168.43.124.8880 > 192.168.43.195.7771: UDP, length 120
22:31:20.891621 IP 192.168.43.124.8880 > 192.168.43.195.7771: UDP, length 120
22:31:20.941615 IP 192.168.43.124.8880 > 192.168.43.195.7771: UDP, length 120
22:31:20.991621 IP 192.168.43.124.8880 > 192.168.43.195.7771: UDP, length 120
22:31:21.041621 IP 192.168.43.124.8880 > 192.168.43.195.7771: UDP, length 120
22:31:21.091623 IP 192.168.43.124.8880 > 192.168.43.195.7771: UDP, length 120
22:31:21.141623 IP 192.168.43.124.8880 > 192.168.43.195.7771: UDP, length 120
22:31:21.191623 IP 192.168.43.124.8880 > 192.168.43.195.7771: UDP, length 120
22:31:21.241671 IP 192.168.43.124.8880 > 192.168.43.195.7771: UDP, length 120
22:31:21.291625 IP 192.168.43.124.8880 > 192.168.43.195.7771: UDP, length 120
22:31:21.341627 IP 192.168.43.124.8880 > 192.168.43.195.7771: UDP, length 120
22:31:21.391620 IP 192.168.43.124.8880 > 192.168.43.195.7771: UDP, length 120
22:31:21.441624 IP 192.168.43.124.8880 > 192.168.43.195.7771: UDP, length 120
22:31:21.491626 IP 192.168.43.124.8880 > 192.168.43.195.7771: UDP, length 120
22:31:21.541623 IP 192.168.43.124.8880 > 192.168.43.195.7771: UDP, length 120
22:31:21.591626 IP 192.168.43.124.8880 > 192.168.43.195.7771: UDP, length 120
22:31:21.641625 IP 192.168.43.124.8880 > 192.168.43.195.7771: UDP, length 120
22:31:21.691627 IP 192.168.43.124.8880 > 192.168.43.195.7771: UDP, length 120
22:31:21.741625 IP 192.168.43.124.8880 > 192.168.43.195.7771: UDP, length 120
22:31:21.791627 IP 192.168.43.124.8880 > 192.168.43.195.7771: UDP, length 120
22:31:21.841621 IP 192.168.43.124.8880 > 192.168.43.195.7771: UDP, length 120
22:31:21.891623 IP 192.168.43.124.8880 > 192.168.43.195.7771: UDP, length 120
22:31:21.941618 IP 192.168.43.124.8880 > 192.168.43.195.7771: UDP, length 120
22:31:21.991622 IP 192.168.43.124.8880 > 192.168.43.195.7771: UDP, length 120
22:31:22.041622 IP 192.168.43.124.8880 > 192.168.43.195.7771: UDP, length 120
22:31:22.091624 IP 192.168.43.124.8880 > 192.168.43.195.7771: UDP, length 120
22:31:22.141619 IP 192.168.43.124.8880 > 192.168.43.195.7771: UDP, length 120
22:31:22.191621 IP 192.168.43.124.8880 > 192.168.43.195.7771: UDP, length 120
22:31:22.241620 IP 192.168.43.124.8880 > 192.168.43.195.7771: UDP, length 120
22:31:22.291624 IP 192.168.43.124.8880 > 192.168.43.195.7771: UDP, length 120
22:31:22.341622 IP 192.168.43.124.8880 > 192.168.43.195.7771: UDP, length 120
22:31:22.392262 IP 192.168.43.124.8880 > 192.168.43.195.7771: UDP, length 120
22:31:22.441621 IP 192.168.43.124.8880 > 192.168.43.195.7771: UDP, length 120
22:31:22.491622 IP 192.168.43.124.8880 > 192.168.43.195.7771: UDP, length 120
22:31:22.541622 IP 192.168.43.124.8880 > 192.168.43.195.7771: UDP, length 120
22:31:22.591623 IP 192.168.43.124.8880 > 192.168.43.195.7771: UDP, length 120
22:31:22.641622 IP 192.168.43.124.8880 > 192.168.43.195.7771: UDP, length 120
22:31:22.691621 IP 192.168.43.124.8880 > 192.168.43.195.7771: UDP, length 120
22:31:22.741622 IP 192.168.43.124.8880 > 192.168.43.195.7771: UDP, length 120
22:31:22.791622 IP 192.168.43.124.8880 > 192.168.43.195.7771: UDP, length 120
22:31:22.841621 IP 192.168.43.124.8880 > 192.168.43.195.7771: UDP, length 120
22:31:22.891623 IP 192.168.43.124.8880 > 192.168.43.195.7771: UDP, length 120
22:31:22.941614 IP 192.168.43.124.8880 > 192.168.43.195.7771: UDP, length 120
22:31:22.991621 IP 192.168.43.124.8880 > 192.168.43.195.7771: UDP, length 120
22:31:23.041622 IP 192.168.43.124.8880 > 192.168.43.195.7771: UDP, length 120
22:31:23.091584 IP 192.168.43.124.8880 > 192.168.43.195.7771: UDP, length 120
22:31:23.141622 IP 192.168.43.124.8880 > 192.168.43.195.7771: UDP, length 120
22:31:23.191620 IP 192.168.43.124.8880 > 192.168.43.195.7771: UDP, length 120
22:31:23.241669 IP 192.168.43.124.8880 > 192.168.43.195.7771: UDP, length 120
22:31:23.291674 IP 192.168.43.124.8880 > 192.168.43.195.7771: UDP, length 120
22:31:23.341671 IP 192.168.43.124.8880 > 192.168.43.195.7771: UDP, length 120
22:31:23.391673 IP 192.168.43.124.8880 > 192.168.43.195.7771: UDP, length 120
22:31:23.441669 IP 192.168.43.124.8880 > 192.168.43.195.7771: UDP, length 120
22:31:23.491673 IP 192.168.43.124.8880 > 192.168.43.195.7771: UDP, length 120
22:31:23.541673 IP 192.168.43.124.8880 > 192.168.43.195.7771: UDP, length 120
22:31:23.591672 IP 192.168.43.124.8880 > 192.168.43.195.7771: UDP, length 120
22:31:23.641672 IP 192.168.43.124.8880 > 192.168.43.195.7771: UDP, length 120
22:31:23.691673 IP 192.168.43.124.8880 > 192.168.43.195.7771: UDP, length 120
22:31:23.741671 IP 192.168.43.124.8880 > 192.168.43.195.7771: UDP, length 120
22:31:23.791673 IP 192.168.43.124.8880 > 192.168.43.195.7771: UDP, length 120
22:31:23.841672 IP 192.168.43.124.8880 > 192.168.43.195.7771: UDP, length 120
22:31:23.891675 IP 192.168.43.124.8880 > 192.168.43.195.7771: UDP, length 120
22:31:23.941625 IP 192.168.43.124.8880 > 192.168.43.195.7771: UDP, length 120
22:31:23.991624 IP 192.168.43.124.8880 > 192.168.43.195.7771: UDP, length 120
22:31:24.041625 IP 192.168.43.124.8880 > 192.168.43.195.7771: UDP, length 120
22:31:24.091626 IP 192.168.43.124.8880 > 192.168.43.195.7771: UDP, length 120
22:31:24.141626 IP 192.168.43.124.8880 > 192.168.43.195.7771: UDP, length 120
22:31:24.191627 IP 192.168.43.124.8880 > 192.168.43.195.7771: UDP, length 120
22:31:24.241621 IP 192.168.43.124.8880 > 192.168.43.195.7771: UDP, length 120
22:31:24.291623 IP 192.168.43.124.8880 > 192.168.43.195.7771: UDP, length 120
22:31:24.341621 IP 192.168.43.124.8880 > 192.168.43.195.7771: UDP, length 120
22:31:24.391672 IP 192.168.43.124.8880 > 192.168.43.195.7771: UDP, length 120
22:31:24.441667 IP 192.168.43.124.8880 > 192.168.43.195.7771: UDP, length 120
22:31:24.491672 IP 192.168.43.124.8880 > 192.168.43.195.7771: UDP, length 120
22:31:24.541670 IP 192.168.43.124.8880 > 192.168.43.195.7771: UDP, length 120
22:31:24.591675 IP 192.168.43.124.8880 > 192.168.43.195.7771: UDP, length 120
22:31:24.641670 IP 192.168.43.124.8880 > 192.168.43.195.7771: UDP, length 120
22:31:24.691672 IP 192.168.43.124.8880 > 192.168.43.195.7771: UDP, length 120
22:31:24.741671 IP 192.168.43.124.8880 > 192.168.43.195.7771: UDP, length 120
22:31:24.791670 IP 192.168.43.124.8880 > 192.168.43.195.7771: UDP, length 120
22:31:24.841670 IP 192.168.43.124.8880 > 192.168.43.195.7771: UDP, length 120
22:31:24.891670 IP 192.168.43.124.8880 > 192.168.43.195.7771: UDP, length 120
22:31:24.941635 IP 192.168.43.124.8880 > 192.168.43.195.7771: UDP, length 120
22:31:24.991621 IP 192.168.43.124.8880 > 192.168.43.195.7771: UDP, length 120
22:31:25.041621 IP 192.168.43.124.8880 > 192.168.43.195.7771: UDP, length 120
22:31:25.091621 IP 192.168.43.124.8880 > 192.168.43.195.7771: UDP, length 120
22:31:25.141619 IP 192.168.43.124.8880 > 192.168.43.195.7771: UDP, length 120
22:31:25.191624 IP 192.168.43.124.8880 > 192.168.43.195.7771: UDP, length 120
22:31:25.241666 IP 192.168.43.124.8880 > 192.168.43.195.7771: UDP, length 120
22:31:25.291560 IP 192.168.43.124.8880 > 192.168.43.195.7771: UDP, length 120
22:31:25.341562 IP 192.168.43.124.8880 > 192.168.43.195.7771: UDP, length 120
22:31:25.391571 IP 192.168.43.124.8880 > 192.168.43.195.7771: UDP, length 120
22:31:25.441622 IP 192.168.43.124.8880 > 192.168.43.195.7771: UDP, length 120
22:31:25.491568 IP 192.168.43.124.8880 > 192.168.43.195.7771: UDP, length 120
22:31:25.541571 IP 192.168.43.124.8880 > 192.168.43.195.7771: UDP, length 120
22:31:25.591622 IP 192.168.43.124.8880 > 192.168.43.195.7771: UDP, length 120
22:31:25.641624 IP 192.168.43.124.8880 > 192.168.43.195.7771: UDP, length 120
22:31:25.691622 IP 192.168.43.124.8880 > 192.168.43.195.7771: UDP, length 120
22:31:25.741621 IP 192.168.43.124.8880 > 192.168.43.195.7771: UDP, length 120
22:31:25.791621 IP 192.168.43.124.8880 > 192.168.43.195.7771: UDP, length 120
22:31:25.841621 IP 192.168.43.124.8880 > 192.168.43.195.7771: UDP, length 120
22:31:25.891620 IP 192.168.43.124.8880 > 192.168.43.195.7771: UDP, length 120
22:31:25.941665 IP 192.168.43.124.8880 > 192.168.43.195.7771: UDP, length 120
22:31:25.991822 IP 192.168.43.124.8880 > 192.168.43.195.7771: UDP, length 120
22:31:26.041625 IP 192.168.43.124.8880 > 192.168.43.195.7771: UDP, length 120
22:31:26.091624 IP 192.168.43.124.8880 > 192.168.43.195.7771: UDP, length 120
22:31:26.141553 IP 192.168.43.124.8880 > 192.168.43.195.7771: UDP, length 120
22:31:26.191627 IP 192.168.43.124.8880 > 192.168.43.195.7771: UDP, length 120
22:31:26.241669 IP 192.168.43.124.8880 > 192.168.43.195.7771: UDP, length 120
22:31:26.291626 IP 192.168.43.124.8880 > 192.168.43.195.7771: UDP, length 120
22:31:26.341626 IP 192.168.43.124.8880 > 192.168.43.195.7771: UDP, length 120
22:31:26.391627 IP 192.168.43.124.8880 > 192.168.43.195.7771: UDP, length 120
22:31:26.441625 IP 192.168.43.124.8880 > 192.168.43.195.7771: UDP, length 120
22:31:26.491626 IP 192.168.43.124.8880 > 192.168.43.195.7771: UDP, length 120
22:31:26.541627 IP 192.168.43.124.8880 > 192.168.43.195.7771: UDP, length 120
22:31:26.591572 IP 192.168.43.124.8880 > 192.168.43.195.7771: UDP, length 120
22:31:26.641626 IP 192.168.43.124.8880 > 192.168.43.195.7771: UDP, length 120
22:31:26.691628 IP 192.168.43.124.8880 > 192.168.43.195.7771: UDP, length 120
22:31:26.741627 IP 192.168.43.124.8880 > 192.168.43.195.7771: UDP, length 120
22:31:26.791630 IP 192.168.43.124.8880 > 192.168.43.195.7771: UDP, length 120
22:31:26.841627 IP 192.168.43.124.8880 > 192.168.43.195.7771: UDP, length 120
22:31:26.891623 IP 192.168.43.124.8880 > 192.168.43.195.7771: UDP, length 120
22:31:26.941617 IP 192.168.43.124.8880 > 192.168.43.195.7771: UDP, length 120
22:31:26.991623 IP 192.168.43.124.8880 > 192.168.43.195.7771: UDP, length 120
22:31:27.041622 IP 192.168.43.124.8880 > 192.168.43.195.7771: UDP, length 120
22:31:27.091623 IP 192.168.43.124.8880 > 192.168.43.195.7771: UDP, length 120
22:31:27.141622 IP 192.168.43.124.8880 > 192.168.43.195.7771: UDP, length 120
22:31:27.191582 IP 192.168.43.124.8880 > 192.168.43.195.7771: UDP, length 120
22:31:27.241671 IP 192.168.43.124.8880 > 192.168.43.195.7771: UDP, length 120
22:31:27.291712 IP 192.168.43.124.8880 > 192.168.43.195.7771: UDP, length 120
22:31:27.341710 IP 192.168.43.124.8880 > 192.168.43.195.7771: UDP, length 120
22:31:27.391711 IP 192.168.43.124.8880 > 192.168.43.195.7771: UDP, length 120
22:31:27.441672 IP 192.168.43.124.8880 > 192.168.43.195.7771: UDP, length 120
22:31:27.492462 IP 192.168.43.124.8880 > 192.168.43.195.7771: UDP, length 120
22:31:27.541725 IP 192.168.43.124.8880 > 192.168.43.195.7771: UDP, length 120
22:31:27.591673 IP 192.168.43.124.8880 > 192.168.43.195.7771: UDP, length 120
22:31:27.641670 IP 192.168.43.124.8880 > 192.168.43.195.7771: UDP, length 120
22:31:27.691627 IP 192.168.43.124.8880 > 192.168.43.195.7771: UDP, length 120
22:31:27.741800 IP 192.168.43.124.8880 > 192.168.43.195.7771: UDP, length 120
22:31:27.792401 IP 192.168.43.124.8880 > 192.168.43.195.7771: UDP, length 120
22:31:27.841669 IP 192.168.43.124.8880 > 192.168.43.195.7771: UDP, length 120
22:31:27.892738 IP 192.168.43.124.8880 > 192.168.43.195.7771: UDP, length 120
22:31:27.941864 IP 192.168.43.124.8880 > 192.168.43.195.7771: UDP, length 120
22:31:27.992425 IP 192.168.43.124.8880 > 192.168.43.195.7771: UDP, length 120
22:31:28.041622 IP 192.168.43.124.8880 > 192.168.43.195.7771: UDP, length 120
22:31:28.091625 IP 192.168.43.124.8880 > 192.168.43.195.7771: UDP, length 120
22:31:28.141621 IP 192.168.43.124.8880 > 192.168.43.195.7771: UDP, length 120
22:31:28.191626 IP 192.168.43.124.8880 > 192.168.43.195.7771: UDP, length 120
22:31:28.241670 IP 192.168.43.124.8880 > 192.168.43.195.7771: UDP, length 120
22:31:28.292166 IP 192.168.43.124.8880 > 192.168.43.195.7771: UDP, length 120
22:31:28.341572 IP 192.168.43.124.8880 > 192.168.43.195.7771: UDP, length 120
22:31:28.391622 IP 192.168.43.124.8880 > 192.168.43.195.7771: UDP, length 120
22:31:28.441620 IP 192.168.43.124.8880 > 192.168.43.195.7771: UDP, length 120
22:31:28.491622 IP 192.168.43.124.8880 > 192.168.43.195.7771: UDP, length 120
22:31:28.541621 IP 192.168.43.124.8880 > 192.168.43.195.7771: UDP, length 120
22:31:28.591624 IP 192.168.43.124.8880 > 192.168.43.195.7771: UDP, length 120
22:31:28.641621 IP 192.168.43.124.8880 > 192.168.43.195.7771: UDP, length 120
22:31:28.691623 IP 192.168.43.124.8880 > 192.168.43.195.7771: UDP, length 120
22:31:28.741541 IP 192.168.43.124.8880 > 192.168.43.195.7771: UDP, length 120
22:31:28.791624 IP 192.168.43.124.8880 > 192.168.43.195.7771: UDP, length 120
22:31:28.841630 IP 192.168.43.124.8880 > 192.168.43.195.7771: UDP, length 120
22:31:28.891623 IP 192.168.43.124.8880 > 192.168.43.195.7771: UDP, length 120
22:31:28.941661 IP 192.168.43.124.8880 > 192.168.43.195.7771: UDP, length 120
22:31:28.991627 IP 192.168.43.124.8880 > 192.168.43.195.7771: UDP, length 120
22:31:29.041633 IP 192.168.43.124.8880 > 192.168.43.195.7771: UDP, length 120
22:31:29.091712 IP 192.168.43.124.8880 > 192.168.43.195.7771: UDP, length 120
22:31:29.141710 IP 192.168.43.124.8880 > 192.168.43.195.7771: UDP, length 120
22:31:29.191712 IP 192.168.43.124.8880 > 192.168.43.195.7771: UDP, length 120
22:31:29.241709 IP 192.168.43.124.8880 > 192.168.43.195.7771: UDP, length 120
22:31:29.291675 IP 192.168.43.124.8880 > 192.168.43.195.7771: UDP, length 120
22:31:29.341713 IP 192.168.43.124.8880 > 192.168.43.195.7771: UDP, length 120
22:31:29.391711 IP 192.168.43.124.8880 > 192.168.43.195.7771: UDP, length 120
22:31:29.441673 IP 192.168.43.124.8880 > 192.168.43.195.7771: UDP, length 120
22:31:29.491882 IP 192.168.43.124.8880 > 192.168.43.195.7771: UDP, length 120
22:31:29.541885 IP 192.168.43.124.8880 > 192.168.43.195.7771: UDP, length 120
22:31:29.592411 IP 192.168.43.124.8880 > 192.168.43.195.7771: UDP, length 120
22:31:29.641885 IP 192.168.43.124.8880 > 192.168.43.195.7771: UDP, length 120
22:31:29.691887 IP 192.168.43.124.8880 > 192.168.43.195.7771: UDP, length 120
22:31:29.741885 IP 192.168.43.124.8880 > 192.168.43.195.7771: UDP, length 120
22:31:29.792687 IP 192.168.43.124.8880 > 192.168.43.195.7771: UDP, length 120
22:31:29.841626 IP 192.168.43.124.8880 > 192.168.43.195.7771: UDP, length 120
22:31:29.891626 IP 192.168.43.124.8880 > 192.168.43.195.7771: UDP, length 120
22:31:29.941664 IP 192.168.43.124.8880 > 192.168.43.195.7771: UDP, length 120
22:31:29.991822 IP 192.168.43.124.8880 > 192.168.43.195.7771: UDP, length 120
22:31:30.041623 IP 192.168.43.124.8880 > 192.168.43.195.7771: UDP, length 120
22:31:30.091621 IP 192.168.43.124.8880 > 192.168.43.195.7771: UDP, length 120
22:31:30.141621 IP 192.168.43.124.8880 > 192.168.43.195.7771: UDP, length 120
22:31:30.191622 IP 192.168.43.124.8880 > 192.168.43.195.7771: UDP, length 120
22:31:30.241669 IP 192.168.43.124.8880 > 192.168.43.195.7771: UDP, length 120
22:31:30.291623 IP 192.168.43.124.8880 > 192.168.43.195.7771: UDP, length 120
