22:48:24.545506 IP 192.168.43.124.8880 > 192.168.43.195.7771: UDP, length 120
22:48:24.595608 IP 192.168.43.124.8880 > 192.168.43.195.7771: UDP, length 120
22:48:24.645656 IP 192.168.43.124.8880 > 192.168.43.195.7771: UDP, length 120
22:48:24.695654 IP 192.168.43.124.8880 > 192.168.43.195.7771: UDP, length 120
22:48:24.745706 IP 192.168.43.124.8880 > 192.168.43.195.7771: UDP, length 120
22:48:24.795705 IP 192.168.43.124.8880 > 192.168.43.195.7771: UDP, length 120
22:48:24.845704 IP 192.168.43.124.8880 > 192.168.43.195.7771: UDP, length 120
22:48:24.895708 IP 192.168.43.124.8880 > 192.168.43.195.7771: UDP, length 120
22:48:24.945707 IP 192.168.43.124.8880 > 192.168.43.195.7771: UDP, length 120
22:48:24.995701 IP 192.168.43.124.8880 > 192.168.43.195.7771: UDP, length 120
22:48:25.045704 IP 192.168.43.124.8880 > 192.168.43.195.7771: UDP, length 120
22:48:25.095587 IP 192.168.43.124.8880 > 192.168.43.195.7771: UDP, length 120
22:48:25.145658 IP 192.168.43.124.8880 > 192.168.43.195.7771: UDP, length 120
22:48:25.195658 IP 192.168.43.124.8880 > 192.168.43.195.7771: UDP, length 120
22:48:25.245705 IP 192.168.43.124.8880 > 192.168.43.195.7771: UDP, length 120
22:48:25.295618 IP 192.168.43.124.8880 > 192.168.43.195.7771: UDP, length 120
22:48:25.345656 IP 192.168.43.124.8880 > 192.168.43.195.7771: UDP, length 120
22:48:25.395654 IP 192.168.43.124.8880 > 192.168.43.195.7771: UDP, length 120
22:48:25.445654 IP 192.168.43.124.8880 > 192.168.43.195.7771: UDP, length 120
22:48:25.495656 IP 192.168.43.124.8880 > 192.168.43.195.7771: UDP, length 120
22:48:25.545654 IP 192.168.43.124.8880 > 192.168.43.195.7771: UDP, length 120
22:48:25.595655 IP 192.168.43.124.8880 > 192.168.43.195.7771: UDP, length 120
22:48:25.645655 IP 192.168.43.124.8880 > 192.168.43.195.7771: UDP, length 120
22:48:25.695656 IP 192.168.43.124.8880 > 192.168.43.195.7771: UDP, length 120
22:48:25.745656 IP 192.168.43.124.8880 > 192.168.43.195.7771: UDP, length 120
22:48:25.795655 IP 192.168.43.124.8880 > 192.168.43.195.7771: UDP, length 120
22:48:25.845655 IP 192.168.43.124.8880 > 192.168.43.195.7771: UDP, length 120
22:48:25.895620 IP 192.168.43.124.8880 > 192.168.43.195.7771: UDP, length 120
22:48:25.945658 IP 192.168.43.124.8880 > 192.168.43.195.7771: UDP, length 120
22:48:25.995655 IP 192.168.43.124.8880 > 192.168.43.195.7771: UDP, length 120
22:48:26.045657 IP 192.168.43.124.8880 > 192.168.43.195.7771: UDP, length 120
22:48:26.095653 IP 192.168.43.124.8880 > 192.168.43.195.7771: UDP, length 120
22:48:26.145656 IP 192.168.43.124.8880 > 192.168.43.195.7771: UDP, length 120
22:48:26.195654 IP 192.168.43.124.8880 > 192.168.43.195.7771: UDP, length 120
22:48:26.245706 IP 192.168.43.124.8880 > 192.168.43.195.7771: UDP, length 120
22:48:26.295703 IP 192.168.43.124.8880 > 192.168.43.195.7771: UDP, length 120
22:48:26.345705 IP 192.168.43.124.8880 > 192.168.43.195.7771: UDP, length 120
22:48:26.395666 IP 192.168.43.124.8880 > 192.168.43.195.7771: UDP, length 120
22:48:26.445706 IP 192.168.43.124.8880 > 192.168.43.195.7771: UDP, length 120
22:48:26.495716 IP 192.168.43.124.8880 > 192.168.43.195.7771: UDP, length 120
22:48:26.545706 IP 192.168.43.124.8880 > 192.168.43.195.7771: UDP, length 120
22:48:26.595658 IP 192.168.43.124.8880 > 192.168.43.195.7771: UDP, length 120
22:48:26.645709 IP 192.168.43.124.8880 > 192.168.43.195.7771: UDP, length 120
22:48:26.695705 IP 192.168.43.124.8880 > 192.168.43.195.7771: UDP, length 120
22:48:26.745707 IP 192.168.43.124.8880 > 192.168.43.195.7771: UDP, length 120
22:48:26.795623 IP 192.168.43.124.8880 > 192.168.43.195.7771: UDP, length 120
22:48:26.845584 IP 192.168.43.124.8880 > 192.168.43.195.7771: UDP, length 120
22:48:26.895606 IP 192.168.43.124.8880 > 192.168.43.195.7771: UDP, length 120
22:48:26.945656 IP 192.168.43.124.8880 > 192.168.43.195.7771: UDP, length 120
22:48:26.995655 IP 192.168.43.124.8880 > 192.168.43.195.7771: UDP, length 120
22:48:27.045654 IP 192.168.43.124.8880 > 192.168.43.195.7771: UDP, length 120
22:48:27.095607 IP 192.168.43.124.8880 > 192.168.43.195.7771: UDP, length 120
22:48:27.145600 IP 192.168.43.124.8880 > 192.168.43.195.7771: UDP, length 120
22:48:27.195656 IP 192.168.43.124.8880 > 192.168.43.195.7771: UDP, length 120
22:48:27.245705 IP 192.168.43.124.8880 > 192.168.43.195.7771: UDP, length 120
22:48:27.295657 IP 192.168.43.124.8880 > 192.168.43.195.7771: UDP, length 120
22:48:27.345657 IP 192.168.43.124.8880 > 192.168.43.195.7771: UDP, length 120
22:48:27.395657 IP 192.168.43.124.8880 > 192.168.43.195.7771: UDP, length 120
22:48:27.445658 IP 192.168.43.124.8880 > 192.168.43.195.7771: UDP, length 120
22:48:27.495659 IP 192.168.43.124.8880 > 192.168.43.195.7771: UDP, length 120
22:48:27.545659 IP 192.168.43.124.8880 > 192.168.43.195.7771: UDP, length 120
22:48:27.595658 IP 192.168.43.124.8880 > 192.168.43.195.7771: UDP, length 120
22:48:27.645660 IP 192.168.43.124.8880 > 192.168.43.195.7771: UDP, length 120
22:48:27.695657 IP 192.168.43.124.8880 > 192.168.43.195.7771: UDP, length 120
22:48:27.745659 IP 192.168.43.124.8880 > 192.168.43.195.7771: UDP, length 120
22:48:27.795660 IP 192.168.43.124.8880 > 192.168.43.195.7771: UDP, length 120
22:48:27.845660 IP 192.168.43.124.8880 > 192.168.43.195.7771: UDP, length 120
22:48:27.895659 IP 192.168.43.124.8880 > 192.168.43.195.7771: UDP, length 120
22:48:27.945661 IP 192.168.43.124.8880 > 192.168.43.195.7771: UDP, length 120
22:48:27.995661 IP 192.168.43.124.8880 > 192.168.43.195.7771: UDP, length 120
22:48:28.045661 IP 192.168.43.124.8880 > 192.168.43.195.7771: UDP, length 120
22:48:28.095621 IP 192.168.43.124.8880 > 192.168.43.195.7771: UDP, length 120
22:48:28.145658 IP 192.168.43.124.8880 > 192.168.43.195.7771: UDP, length 120
22:48:28.195659 IP 192.168.43.124.8880 > 192.168.43.195.7771: UDP, length 120
22:48:28.245654 IP 192.168.43.124.8880 > 192.168.43.195.7771: UDP, length 120
22:48:28.295654 IP 192.168.43.124.8880 > 192.168.43.195.7771: UDP, length 120
22:48:28.345656 IP 192.168.43.124.8880 > 192.168.43.195.7771: UDP, length 120
22:48:28.395655 IP 192.168.43.124.8880 > 192.168.43.195.7771: UDP, length 120
22:48:28.445656 IP 192.168.43.124.8880 > 192.168.43.195.7771: UDP, length 120
22:48:28.495656 IP 192.168.43.124.8880 > 192.168.43.195.7771: UDP, length 120
22:48:28.545655 IP 192.168.43.124.8880 > 192.168.43.195.7771: UDP, length 120
22:48:28.595656 IP 192.168.43.124.8880 > 192.168.43.195.7771: UDP, length 120
22:48:28.645655 IP 192.168.43.124.8880 > 192.168.43.195.7771: UDP, length 120
22:48:28.695655 IP 192.168.43.124.8880 > 192.168.43.195.7771: UDP, length 120
22:48:28.745655 IP 192.168.43.124.8880 > 192.168.43.195.7771: UDP, length 120
22:48:28.795655 IP 192.168.43.124.8880 > 192.168.43.195.7771: UDP, length 120
22:48:28.845656 IP 192.168.43.124.8880 > 192.168.43.195.7771: UDP, length 120
22:48:28.895654 IP 192.168.43.124.8880 > 192.168.43.195.7771: UDP, length 120
22:48:28.945655 IP 192.168.43.124.8880 > 192.168.43.195.7771: UDP, length 120
22:48:28.995654 IP 192.168.43.124.8880 > 192.168.43.195.7771: UDP, length 120
22:48:29.045706 IP 192.168.43.124.8880 > 192.168.43.195.7771: UDP, length 120
22:48:29.095712 IP 192.168.43.124.8880 > 192.168.43.195.7771: UDP, length 120
22:48:29.145656 IP 192.168.43.124.8880 > 192.168.43.195.7771: UDP, length 120
22:48:29.195655 IP 192.168.43.124.8880 > 192.168.43.195.7771: UDP, length 120
22:48:29.245704 IP 192.168.43.124.8880 > 192.168.43.195.7771: UDP, length 120
22:48:29.295614 IP 192.168.43.124.8880 > 192.168.43.195.7771: UDP, length 120
22:48:29.345660 IP 192.168.43.124.8880 > 192.168.43.195.7771: UDP, length 120
22:48:29.395660 IP 192.168.43.124.8880 > 192.168.43.195.7771: UDP, length 120
22:48:29.445661 IP 192.168.43.124.8880 > 192.168.43.195.7771: UDP, length 120
22:48:29.495660 IP 192.168.43.124.8880 > 192.168.43.195.7771: UDP, length 120
22:48:29.545658 IP 192.168.43.124.8880 > 192.168.43.195.7771: UDP, length 120
22:48:29.595658 IP 192.168.43.124.8880 > 192.168.43.195.7771: UDP, length 120
22:48:29.645704 IP 192.168.43.124.8880 > 192.168.43.195.7771: UDP, length 120
22:48:29.695839 IP 192.168.43.124.8880 > 192.168.43.195.7771: UDP, length 120
22:48:29.745904 IP 192.168.43.124.8880 > 192.168.43.195.7771: UDP, length 120
22:48:29.795972 IP 192.168.43.124.8880 > 192.168.43.195.7771: UDP, length 120
22:48:29.846446 IP 192.168.43.124.8880 > 192.168.43.195.7771: UDP, length 120
22:48:29.895704 IP 192.168.43.124.8880 > 192.168.43.195.7771: UDP, length 120
22:48:29.946425 IP 192.168.43.124.8880 > 192.168.43.195.7771: UDP, length 120
22:48:29.995705 IP 192.168.43.124.8880 > 192.168.43.195.7771: UDP, length 120
22:48:30.045905 IP 192.168.43.124.8880 > 192.168.43.195.7771: UDP, length 120
22:48:30.095924 IP 192.168.43.124.8880 > 192.168.43.195.7771: UDP, length 120
22:48:30.145659 IP 192.168.43.124.8880 > 192.168.43.195.7771: UDP, length 120
22:48:30.195658 IP 192.168.43.124.8880 > 192.168.43.195.7771: UDP, length 120
22:48:30.245653 IP 192.168.43.124.8880 > 192.168.43.195.7771: UDP, length 120
22:48:30.295595 IP 192.168.43.124.8880 > 192.168.43.195.7771: UDP, length 120
22:48:30.345655 IP 192.168.43.124.8880 > 192.168.43.195.7771: UDP, length 120
22:48:30.395656 IP 192.168.43.124.8880 > 192.168.43.195.7771: UDP, length 120
22:48:30.445659 IP 192.168.43.124.8880 > 192.168.43.195.7771: UDP, length 120
22:48:30.495656 IP 192.168.43.124.8880 > 192.168.43.195.7771: UDP, length 120
22:48:30.545656 IP 192.168.43.124.8880 > 192.168.43.195.7771: UDP, length 120
22:48:30.595655 IP 192.168.43.124.8880 > 192.168.43.195.7771: UDP, length 120
22:48:30.645657 IP 192.168.43.124.8880 > 192.168.43.195.7771: UDP, length 120
22:48:30.695658 IP 192.168.43.124.8880 > 192.168.43.195.7771: UDP, length 120
22:48:30.745658 IP 192.168.43.124.8880 > 192.168.43.195.7771: UDP, length 120
22:48:30.795655 IP 192.168.43.124.8880 > 192.168.43.195.7771: UDP, length 120
22:48:30.845657 IP 192.168.43.124.8880 > 192.168.43.195.7771: UDP, length 120
22:48:30.895632 IP 192.168.43.124.8880 > 192.168.43.195.7771: UDP, length 120
22:48:30.945706 IP 192.168.43.124.8880 > 192.168.43.195.7771: UDP, length 120
22:48:30.995709 IP 192.168.43.124.8880 > 192.168.43.195.7771: UDP, length 120
22:48:31.046427 IP 192.168.43.124.8880 > 192.168.43.195.7771: UDP, length 120
22:48:31.095704 IP 192.168.43.124.8880 > 192.168.43.195.7771: UDP, length 120
22:48:31.146380 IP 192.168.43.124.8880 > 192.168.43.195.7771: UDP, length 120
22:48:31.195664 IP 192.168.43.124.8880 > 192.168.43.195.7771: UDP, length 120
22:48:31.245659 IP 192.168.43.124.8880 > 192.168.43.195.7771: UDP, length 120
22:48:31.295708 IP 192.168.43.124.8880 > 192.168.43.195.7771: UDP, length 120
22:48:31.345742 IP 192.168.43.124.8880 > 192.168.43.195.7771: UDP, length 120
22:48:31.395710 IP 192.168.43.124.8880 > 192.168.43.195.7771: UDP, length 120
22:48:31.446257 IP 192.168.43.124.8880 > 192.168.43.195.7771: UDP, length 120
22:48:31.495638 IP 192.168.43.124.8880 > 192.168.43.195.7771: UDP, length 120
22:48:31.545710 IP 192.168.43.124.8880 > 192.168.43.195.7771: UDP, length 120
22:48:31.596244 IP 192.168.43.124.8880 > 192.168.43.195.7771: UDP, length 120
22:48:31.645919 IP 192.168.43.124.8880 > 192.168.43.195.7771: UDP, length 120
22:48:31.695712 IP 192.168.43.124.8880 > 192.168.43.195.7771: UDP, length 120
22:48:31.746769 IP 192.168.43.124.8880 > 192.168.43.195.7771: UDP, length 120
22:48:31.795901 IP 192.168.43.124.8880 > 192.168.43.195.7771: UDP, length 120
22:48:31.845763 IP 192.168.43.124.8880 > 192.168.43.195.7771: UDP, length 120
22:48:31.896415 IP 192.168.43.124.8880 > 192.168.43.195.7771: UDP, length 120
22:48:31.945799 IP 192.168.43.124.8880 > 192.168.43.195.7771: UDP, length 120
22:48:31.995577 IP 192.168.43.124.8880 > 192.168.43.195.7771: UDP, length 120
22:48:32.045659 IP 192.168.43.124.8880 > 192.168.43.195.7771: UDP, length 120
22:48:32.095610 IP 192.168.43.124.8880 > 192.168.43.195.7771: UDP, length 120
22:48:32.145662 IP 192.168.43.124.8880 > 192.168.43.195.7771: UDP, length 120
22:48:32.195660 IP 192.168.43.124.8880 > 192.168.43.195.7771: UDP, length 120
22:48:32.245664 IP 192.168.43.124.8880 > 192.168.43.195.7771: UDP, length 120
22:48:32.295666 IP 192.168.43.124.8880 > 192.168.43.195.7771: UDP, length 120
22:48:32.345668 IP 192.168.43.124.8880 > 192.168.43.195.7771: UDP, length 120
22:48:32.395666 IP 192.168.43.124.8880 > 192.168.43.195.7771: UDP, length 120
22:48:32.445666 IP 192.168.43.124.8880 > 192.168.43.195.7771: UDP, length 120
22:48:32.495667 IP 192.168.43.124.8880 > 192.168.43.195.7771: UDP, length 120
22:48:32.545668 IP 192.168.43.124.8880 > 192.168.43.195.7771: UDP, length 120
22:48:32.595669 IP 192.168.43.124.8880 > 192.168.43.195.7771: UDP, length 120
22:48:32.645669 IP 192.168.43.124.8880 > 192.168.43.195.7771: UDP, length 120
22:48:32.695670 IP 192.168.43.124.8880 > 192.168.43.195.7771: UDP, length 120
22:48:32.745719 IP 192.168.43.124.8880 > 192.168.43.195.7771: UDP, length 120
22:48:32.795719 IP 192.168.43.124.8880 > 192.168.43.195.7771: UDP, length 120
22:48:32.845721 IP 192.168.43.124.8880 > 192.168.43.195.7771: UDP, length 120
22:48:32.895714 IP 192.168.43.124.8880 > 192.168.43.195.7771: UDP, length 120
22:48:32.945717 IP 192.168.43.124.8880 > 192.168.43.195.7771: UDP, length 120
22:48:32.995769 IP 192.168.43.124.8880 > 192.168.43.195.7771: UDP, length 120
22:48:33.045904 IP 192.168.43.124.8880 > 192.168.43.195.7771: UDP, length 120
22:48:33.096496 IP 192.168.43.124.8880 > 192.168.43.195.7771: UDP, length 120
22:48:33.146195 IP 192.168.43.124.8880 > 192.168.43.195.7771: UDP, length 120
22:48:33.195716 IP 192.168.43.124.8880 > 192.168.43.195.7771: UDP, length 120
22:48:33.245667 IP 192.168.43.124.8880 > 192.168.43.195.7771: UDP, length 120
22:48:33.295666 IP 192.168.43.124.8880 > 192.168.43.195.7771: UDP, length 120
22:48:33.345668 IP 192.168.43.124.8880 > 192.168.43.195.7771: UDP, length 120
22:48:33.395666 IP 192.168.43.124.8880 > 192.168.43.195.7771: UDP, length 120
22:48:33.445668 IP 192.168.43.124.8880 > 192.168.43.195.7771: UDP, length 120
22:48:33.495664 IP 192.168.43.124.8880 > 192.168.43.195.7771: UDP, length 120
22:48:33.545666 IP 192.168.43.124.8880 > 192.168.43.195.7771: UDP, length 120
22:48:33.595667 IP 192.168.43.124.8880 > 192.168.43.195.7771: UDP, length 120
22:48:33.645663 IP 192.168.43.124.8880 > 192.168.43.195.7771: UDP, length 120
22:48:33.695665 IP 192.168.43.124.8880 > 192.168.43.195.7771: UDP, length 120
22:48:33.745719 IP 192.168.43.124.8880 > 192.168.43.195.7771: UDP, length 120
22:48:33.795811 IP 192.168.43.124.8880 > 192.168.43.195.7771: UDP, length 120
22:48:33.845569 IP 192.168.43.124.8880 > 192.168.43.195.7771: UDP, length 120
22:48:33.895569 IP 192.168.43.124.8880 > 192.168.43.195.7771: UDP, length 120
22:48:33.945661 IP 192.168.43.124.8880 > 192.168.43.195.7771: UDP, length 120
22:48:33.995666 IP 192.168.43.124.8880 > 192.168.43.195.7771: UDP, length 120
22:48:34.045664 IP 192.168.43.124.8880 > 192.168.43.195.7771: UDP, length 120
22:48:34.095669 IP 192.168.43.124.8880 > 192.168.43.195.7771: UDP, length 120
22:48:34.145659 IP 192.168.43.124.8880 > 192.168.43.195.7771: UDP, length 120
22:48:34.195664 IP 192.168.43.124.8880 > 192.168.43.195.7771: UDP, length 120
22:48:34.245657 IP 192.168.43.124.8880 > 192.168.43.195.7771: UDP, length 120
22:48:34.295719 IP 192.168.43.124.8880 > 192.168.43.195.7771: UDP, length 120
22:48:34.345715 IP 192.168.43.124.8880 > 192.168.43.195.7771: UDP, length 120
22:48:34.395927 IP 192.168.43.124.8880 > 192.168.43.195.7771: UDP, length 120
22:48:34.445910 IP 192.168.43.124.8880 > 192.168.43.195.7771: UDP, length 120
22:48:34.495832 IP 192.168.43.124.8880 > 192.168.43.195.7771: UDP, length 120
22:48:34.545722 IP 192.168.43.124.8880 > 192.168.43.195.7771: UDP, length 120
22:48:34.596768 IP 192.168.43.124.8880 > 192.168.43.195.7771: UDP, length 120
22:48:34.645667 IP 192.168.43.124.8880 > 192.168.43.195.7771: UDP, length 120
22:48:34.695668 IP 192.168.43.124.8880 > 192.168.43.195.7771: UDP, length 120
22:48:34.745665 IP 192.168.43.124.8880 > 192.168.43.195.7771: UDP, length 120
22:48:34.795667 IP 192.168.43.124.8880 > 192.168.43.195.7771: UDP, length 120
22:48:34.845665 IP 192.168.43.124.8880 > 192.168.43.195.7771: UDP, length 120
22:48:34.895666 IP 192.168.43.124.8880 > 192.168.43.195.7771: UDP, length 120
22:48:34.945666 IP 192.168.43.124.8880 > 192.168.43.195.7771: UDP, length 120
22:48:34.995668 IP 192.168.43.124.8880 > 192.168.43.195.7771: UDP, length 120
22:48:35.045668 IP 192.168.43.124.8880 > 192.168.43.195.7771: UDP, length 120
22:48:35.095673 IP 192.168.43.124.8880 > 192.168.43.195.7771: UDP, length 120
22:48:35.145873 IP 192.168.43.124.8880 > 192.168.43.195.7771: UDP, length 120
22:48:35.195662 IP 192.168.43.124.8880 > 192.168.43.195.7771: UDP, length 120
22:48:35.245662 IP 192.168.43.124.8880 > 192.168.43.195.7771: UDP, length 120
22:48:35.295720 IP 192.168.43.124.8880 > 192.168.43.195.7771: UDP, length 120
22:48:35.345768 IP 192.168.43.124.8880 > 192.168.43.195.7771: UDP, length 120
22:48:35.395716 IP 192.168.43.124.8880 > 192.168.43.195.7771: UDP, length 120
22:48:35.445716 IP 192.168.43.124.8880 > 192.168.43.195.7771: UDP, length 120
22:48:35.495758 IP 192.168.43.124.8880 > 192.168.43.195.7771: UDP, length 120
22:48:35.545721 IP 192.168.43.124.8880 > 192.168.43.195.7771: UDP, length 120
22:48:35.595718 IP 192.168.43.124.8880 > 192.168.43.195.7771: UDP, length 120
22:48:35.645878 IP 192.168.43.124.8880 > 192.168.43.195.7771: UDP, length 120
22:48:35.695719 IP 192.168.43.124.8880 > 192.168.43.195.7771: UDP, length 120
22:48:35.745711 IP 192.168.43.124.8880 > 192.168.43.195.7771: UDP, length 120
22:48:35.795666 IP 192.168.43.124.8880 > 192.168.43.195.7771: UDP, length 120
22:48:35.845666 IP 192.168.43.124.8880 > 192.168.43.195.7771: UDP, length 120
22:48:35.895669 IP 192.168.43.124.8880 > 192.168.43.195.7771: UDP, length 120
22:48:35.945664 IP 192.168.43.124.8880 > 192.168.43.195.7771: UDP, length 120
22:48:35.995666 IP 192.168.43.124.8880 > 192.168.43.195.7771: UDP, length 120
22:48:36.045670 IP 192.168.43.124.8880 > 192.168.43.195.7771: UDP, length 120
22:48:36.095668 IP 192.168.43.124.8880 > 192.168.43.195.7771: UDP, length 120
22:48:36.146399 IP 192.168.43.124.8880 > 192.168.43.195.7771: UDP, length 120
22:48:36.195665 IP 192.168.43.124.8880 > 192.168.43.195.7771: UDP, length 120
22:48:36.245657 IP 192.168.43.124.8880 > 192.168.43.195.7771: UDP, length 120
22:48:36.295658 IP 192.168.43.124.8880 > 192.168.43.195.7771: UDP, length 120
22:48:36.345661 IP 192.168.43.124.8880 > 192.168.43.195.7771: UDP, length 120
22:48:36.395663 IP 192.168.43.124.8880 > 192.168.43.195.7771: UDP, length 120
22:48:36.445663 IP 192.168.43.124.8880 > 192.168.43.195.7771: UDP, length 120
22:48:36.495660 IP 192.168.43.124.8880 > 192.168.43.195.7771: UDP, length 120
22:48:36.545661 IP 192.168.43.124.8880 > 192.168.43.195.7771: UDP, length 120
22:48:36.595663 IP 192.168.43.124.8880 > 192.168.43.195.7771: UDP, length 120
22:48:36.645663 IP 192.168.43.124.8880 > 192.168.43.195.7771: UDP, length 120
22:48:36.695664 IP 192.168.43.124.8880 > 192.168.43.195.7771: UDP, length 120
22:48:36.745659 IP 192.168.43.124.8880 > 192.168.43.195.7771: UDP, length 120
22:48:36.795660 IP 192.168.43.124.8880 > 192.168.43.195.7771: UDP, length 120
22:48:36.845658 IP 192.168.43.124.8880 > 192.168.43.195.7771: UDP, length 120
22:48:36.895918 IP 192.168.43.124.8880 > 192.168.43.195.7771: UDP, length 120
22:48:36.945877 IP 192.168.43.124.8880 > 192.168.43.195.7771: UDP, length 120
22:48:36.995667 IP 192.168.43.124.8880 > 192.168.43.195.7771: UDP, length 120
22:48:37.045600 IP 192.168.43.124.8880 > 192.168.43.195.7771: UDP, length 120
22:48:37.095679 IP 192.168.43.124.8880 > 192.168.43.195.7771: UDP, length 120
22:48:37.145658 IP 192.168.43.124.8880 > 192.168.43.195.7771: UDP, length 120
22:48:37.195658 IP 192.168.43.124.8880 > 192.168.43.195.7771: UDP, length 120
22:48:37.245659 IP 192.168.43.124.8880 > 192.168.43.195.7771: UDP, length 120
22:48:37.295720 IP 192.168.43.124.8880 > 192.168.43.195.7771: UDP, length 120
22:48:37.345718 IP 192.168.43.124.8880 > 192.168.43.195.7771: UDP, length 120
22:48:37.395713 IP 192.168.43.124.8880 > 192.168.43.195.7771: UDP, length 120
22:48:37.445718 IP 192.168.43.124.8880 > 192.168.43.195.7771: UDP, length 120
22:48:37.495717 IP 192.168.43.124.8880 > 192.168.43.195.7771: UDP, length 120
22:48:37.545661 IP 192.168.43.124.8880 > 192.168.43.195.7771: UDP, length 120
22:48:37.595661 IP 192.168.43.124.8880 > 192.168.43.195.7771: UDP, length 120
22:48:37.645661 IP 192.168.43.124.8880 > 192.168.43.195.7771: UDP, length 120
22:48:37.695662 IP 192.168.43.124.8880 > 192.168.43.195.7771: UDP, length 120
22:48:37.745659 IP 192.168.43.124.8880 > 192.168.43.195.7771: UDP, length 120
22:48:37.795662 IP 192.168.43.124.8880 > 192.168.43.195.7771: UDP, length 120
22:48:37.845716 IP 192.168.43.124.8880 > 192.168.43.195.7771: UDP, length 120
22:48:37.895715 IP 192.168.43.124.8880 > 192.168.43.195.7771: UDP, length 120
22:48:37.945719 IP 192.168.43.124.8880 > 192.168.43.195.7771: UDP, length 120
22:48:37.995717 IP 192.168.43.124.8880 > 192.168.43.195.7771: UDP, length 120
22:48:38.045717 IP 192.168.43.124.8880 > 192.168.43.195.7771: UDP, length 120
22:48:38.095718 IP 192.168.43.124.8880 > 192.168.43.195.7771: UDP, length 120
22:48:38.145662 IP 192.168.43.124.8880 > 192.168.43.195.7771: UDP, length 120
22:48:38.195663 IP 192.168.43.124.8880 > 192.168.43.195.7771: UDP, length 120
22:48:38.245665 IP 192.168.43.124.8880 > 192.168.43.195.7771: UDP, length 120
22:48:38.295717 IP 192.168.43.124.8880 > 192.168.43.195.7771: UDP, length 120
22:48:38.345720 IP 192.168.43.124.8880 > 192.168.43.195.7771: UDP, length 120
22:48:38.395715 IP 192.168.43.124.8880 > 192.168.43.195.7771: UDP, length 120
22:48:38.445715 IP 192.168.43.124.8880 > 192.168.43.195.7771: UDP, length 120
22:48:38.495716 IP 192.168.43.124.8880 > 192.168.43.195.7771: UDP, length 120
22:48:38.545719 IP 192.168.43.124.8880 > 192.168.43.195.7771: UDP, length 120
22:48:38.595721 IP 192.168.43.124.8880 > 192.168.43.195.7771: UDP, length 120
22:48:38.645718 IP 192.168.43.124.8880 > 192.168.43.195.7771: UDP, length 120
22:48:38.695717 IP 192.168.43.124.8880 > 192.168.43.195.7771: UDP, length 120
22:48:38.745719 IP 192.168.43.124.8880 > 192.168.43.195.7771: UDP, length 120
22:48:38.795716 IP 192.168.43.124.8880 > 192.168.43.195.7771: UDP, length 120
22:48:38.845713 IP 192.168.43.124.8880 > 192.168.43.195.7771: UDP, length 120
22:48:38.895718 IP 192.168.43.124.8880 > 192.168.43.195.7771: UDP, length 120
22:48:38.945719 IP 192.168.43.124.8880 > 192.168.43.195.7771: UDP, length 120
22:48:38.995716 IP 192.168.43.124.8880 > 192.168.43.195.7771: UDP, length 120
22:48:39.045716 IP 192.168.43.124.8880 > 192.168.43.195.7771: UDP, length 120
22:48:39.095716 IP 192.168.43.124.8880 > 192.168.43.195.7771: UDP, length 120
22:48:39.145608 IP 192.168.43.124.8880 > 192.168.43.195.7771: UDP, length 120
22:48:39.195660 IP 192.168.43.124.8880 > 192.168.43.195.7771: UDP, length 120
22:48:39.245661 IP 192.168.43.124.8880 > 192.168.43.195.7771: UDP, length 120
22:48:39.295659 IP 192.168.43.124.8880 > 192.168.43.195.7771: UDP, length 120
22:48:39.345718 IP 192.168.43.124.8880 > 192.168.43.195.7771: UDP, length 120
22:48:39.395716 IP 192.168.43.124.8880 > 192.168.43.195.7771: UDP, length 120
22:48:39.445714 IP 192.168.43.124.8880 > 192.168.43.195.7771: UDP, length 120
22:48:39.495716 IP 192.168.43.124.8880 > 192.168.43.195.7771: UDP, length 120
22:48:39.545718 IP 192.168.43.124.8880 > 192.168.43.195.7771: UDP, length 120
22:48:39.595720 IP 192.168.43.124.8880 > 192.168.43.195.7771: UDP, length 120
22:48:39.645716 IP 192.168.43.124.8880 > 192.168.43.195.7771: UDP, length 120
22:48:39.695717 IP 192.168.43.124.8880 > 192.168.43.195.7771: UDP, length 120
22:48:39.745718 IP 192.168.43.124.8880 > 192.168.43.195.7771: UDP, length 120
22:48:39.795719 IP 192.168.43.124.8880 > 192.168.43.195.7771: UDP, length 120
22:48:39.845714 IP 192.168.43.124.8880 > 192.168.43.195.7771: UDP, length 120
22:48:39.895717 IP 192.168.43.124.8880 > 192.168.43.195.7771: UDP, length 120
22:48:39.945699 IP 192.168.43.124.8880 > 192.168.43.195.7771: UDP, length 120
22:48:39.995718 IP 192.168.43.124.8880 > 192.168.43.195.7771: UDP, length 120
22:48:40.045717 IP 192.168.43.124.8880 > 192.168.43.195.7771: UDP, length 120
22:48:40.095714 IP 192.168.43.124.8880 > 192.168.43.195.7771: UDP, length 120
22:48:40.145665 IP 192.168.43.124.8880 > 192.168.43.195.7771: UDP, length 120
22:48:40.195662 IP 192.168.43.124.8880 > 192.168.43.195.7771: UDP, length 120
22:48:40.245713 IP 192.168.43.124.8880 > 192.168.43.195.7771: UDP, length 120
22:48:40.295716 IP 192.168.43.124.8880 > 192.168.43.195.7771: UDP, length 120
22:48:40.345714 IP 192.168.43.124.8880 > 192.168.43.195.7771: UDP, length 120
22:48:40.395718 IP 192.168.43.124.8880 > 192.168.43.195.7771: UDP, length 120
22:48:40.445715 IP 192.168.43.124.8880 > 192.168.43.195.7771: UDP, length 120
22:48:40.495714 IP 192.168.43.124.8880 > 192.168.43.195.7771: UDP, length 120
22:48:40.545717 IP 192.168.43.124.8880 > 192.168.43.195.7771: UDP, length 120
22:48:40.595720 IP 192.168.43.124.8880 > 192.168.43.195.7771: UDP, length 120
22:48:40.645718 IP 192.168.43.124.8880 > 192.168.43.195.7771: UDP, length 120
22:48:40.695716 IP 192.168.43.124.8880 > 192.168.43.195.7771: UDP, length 120
22:48:40.745715 IP 192.168.43.124.8880 > 192.168.43.195.7771: UDP, length 120
22:48:40.795718 IP 192.168.43.124.8880 > 192.168.43.195.7771: UDP, length 120
22:48:40.845715 IP 192.168.43.124.8880 > 192.168.43.195.7771: UDP, length 120
22:48:40.895717 IP 192.168.43.124.8880 > 192.168.43.195.7771: UDP, length 120
22:48:40.945717 IP 192.168.43.124.8880 > 192.168.43.195.7771: UDP, length 120
22:48:40.995718 IP 192.168.43.124.8880 > 192.168.43.195.7771: UDP, length 120
22:48:41.045714 IP 192.168.43.124.8880 > 192.168.43.195.7771: UDP, length 120
22:48:41.095714 IP 192.168.43.124.8880 > 192.168.43.195.7771: UDP, length 120
22:48:41.145663 IP 192.168.43.124.8880 > 192.168.43.195.7771: UDP, length 120
22:48:41.195659 IP 192.168.43.124.8880 > 192.168.43.195.7771: UDP, length 120
22:48:41.245715 IP 192.168.43.124.8880 > 192.168.43.195.7771: UDP, length 120
22:48:41.295715 IP 192.168.43.124.8880 > 192.168.43.195.7771: UDP, length 120
22:48:41.345717 IP 192.168.43.124.8880 > 192.168.43.195.7771: UDP, length 120
22:48:41.395717 IP 192.168.43.124.8880 > 192.168.43.195.7771: UDP, length 120
22:48:41.445716 IP 192.168.43.124.8880 > 192.168.43.195.7771: UDP, length 120
22:48:41.495716 IP 192.168.43.124.8880 > 192.168.43.195.7771: UDP, length 120
22:48:41.545717 IP 192.168.43.124.8880 > 192.168.43.195.7771: UDP, length 120
22:48:41.595717 IP 192.168.43.124.8880 > 192.168.43.195.7771: UDP, length 120
22:48:41.645721 IP 192.168.43.124.8880 > 192.168.43.195.7771: UDP, length 120
22:48:41.695717 IP 192.168.43.124.8880 > 192.168.43.195.7771: UDP, length 120
22:48:41.745717 IP 192.168.43.124.8880 > 192.168.43.195.7771: UDP, length 120
22:48:41.795609 IP 192.168.43.124.8880 > 192.168.43.195.7771: UDP, length 120
22:48:41.845730 IP 192.168.43.124.8880 > 192.168.43.195.7771: UDP, length 120
22:48:41.895715 IP 192.168.43.124.8880 > 192.168.43.195.7771: UDP, length 120
22:48:41.945716 IP 192.168.43.124.8880 > 192.168.43.195.7771: UDP, length 120
22:48:41.995717 IP 192.168.43.124.8880 > 192.168.43.195.7771: UDP, length 120
22:48:42.045720 IP 192.168.43.124.8880 > 192.168.43.195.7771: UDP, length 120
22:48:42.096166 IP 192.168.43.124.8880 > 192.168.43.195.7771: UDP, length 120
22:48:42.145581 IP 192.168.43.124.8880 > 192.168.43.195.7771: UDP, length 120
22:48:42.195584 IP 192.168.43.124.8880 > 192.168.43.195.7771: UDP, length 120
22:48:42.245598 IP 192.168.43.124.8880 > 192.168.43.195.7771: UDP, length 120
22:48:42.295663 IP 192.168.43.124.8880 > 192.168.43.195.7771: UDP, length 120
22:48:42.345663 IP 192.168.43.124.8880 > 192.168.43.195.7771: UDP, length 120
22:48:42.395663 IP 192.168.43.124.8880 > 192.168.43.195.7771: UDP, length 120
22:48:42.445660 IP 192.168.43.124.8880 > 192.168.43.195.7771: UDP, length 120
22:48:42.495663 IP 192.168.43.124.8880 > 192.168.43.195.7771: UDP, length 120
22:48:42.545661 IP 192.168.43.124.8880 > 192.168.43.195.7771: UDP, length 120
22:48:42.595659 IP 192.168.43.124.8880 > 192.168.43.195.7771: UDP, length 120
22:48:42.645577 IP 192.168.43.124.8880 > 192.168.43.195.7771: UDP, length 120
22:48:42.695661 IP 192.168.43.124.8880 > 192.168.43.195.7771: UDP, length 120
22:48:42.745664 IP 192.168.43.124.8880 > 192.168.43.195.7771: UDP, length 120
22:48:42.795658 IP 192.168.43.124.8880 > 192.168.43.195.7771: UDP, length 120
22:48:42.845670 IP 192.168.43.124.8880 > 192.168.43.195.7771: UDP, length 120
22:48:42.895660 IP 192.168.43.124.8880 > 192.168.43.195.7771: UDP, length 120
22:48:42.945661 IP 192.168.43.124.8880 > 192.168.43.195.7771: UDP, length 120
22:48:42.995660 IP 192.168.43.124.8880 > 192.168.43.195.7771: UDP, length 120
22:48:43.045667 IP 192.168.43.124.8880 > 192.168.43.195.7771: UDP, length 120
22:48:43.095661 IP 192.168.43.124.8880 > 192.168.43.195.7771: UDP, length 120
22:48:43.145659 IP 192.168.43.124.8880 > 192.168.43.195.7771: UDP, length 120
22:48:43.195664 IP 192.168.43.124.8880 > 192.168.43.195.7771: UDP, length 120
22:48:43.245708 IP 192.168.43.124.8880 > 192.168.43.195.7771: UDP, length 120
22:48:43.295716 IP 192.168.43.124.8880 > 192.168.43.195.7771: UDP, length 120
22:48:43.345716 IP 192.168.43.124.8880 > 192.168.43.195.7771: UDP, length 120
22:48:43.395716 IP 192.168.43.124.8880 > 192.168.43.195.7771: UDP, length 120
22:48:43.445718 IP 192.168.43.124.8880 > 192.168.43.195.7771: UDP, length 120
22:48:43.495715 IP 192.168.43.124.8880 > 192.168.43.195.7771: UDP, length 120
22:48:43.545716 IP 192.168.43.124.8880 > 192.168.43.195.7771: UDP, length 120
22:48:43.595717 IP 192.168.43.124.8880 > 192.168.43.195.7771: UDP, length 120
22:48:43.645720 IP 192.168.43.124.8880 > 192.168.43.195.7771: UDP, length 120
22:48:43.695715 IP 192.168.43.124.8880 > 192.168.43.195.7771: UDP, length 120
22:48:43.745716 IP 192.168.43.124.8880 > 192.168.43.195.7771: UDP, length 120
22:48:43.795715 IP 192.168.43.124.8880 > 192.168.43.195.7771: UDP, length 120
22:48:43.845718 IP 192.168.43.124.8880 > 192.168.43.195.7771: UDP, length 120
22:48:43.895717 IP 192.168.43.124.8880 > 192.168.43.195.7771: UDP, length 120
22:48:43.945715 IP 192.168.43.124.8880 > 192.168.43.195.7771: UDP, length 120
22:48:43.995717 IP 192.168.43.124.8880 > 192.168.43.195.7771: UDP, length 120
22:48:44.045717 IP 192.168.43.124.8880 > 192.168.43.195.7771: UDP, length 120
22:48:44.095721 IP 192.168.43.124.8880 > 192.168.43.195.7771: UDP, length 120
22:48:44.145601 IP 192.168.43.124.8880 > 192.168.43.195.7771: UDP, length 120
22:48:44.195666 IP 192.168.43.124.8880 > 192.168.43.195.7771: UDP, length 120
22:48:44.245659 IP 192.168.43.124.8880 > 192.168.43.195.7771: UDP, length 120
22:48:44.295659 IP 192.168.43.124.8880 > 192.168.43.195.7771: UDP, length 120
22:48:44.345662 IP 192.168.43.124.8880 > 192.168.43.195.7771: UDP, length 120
22:48:44.395664 IP 192.168.43.124.8880 > 192.168.43.195.7771: UDP, length 120
22:48:44.445660 IP 192.168.43.124.8880 > 192.168.43.195.7771: UDP, length 120
22:48:44.495663 IP 192.168.43.124.8880 > 192.168.43.195.7771: UDP, length 120
22:48:44.545662 IP 192.168.43.124.8880 > 192.168.43.195.7771: UDP, length 120
22:48:44.595660 IP 192.168.43.124.8880 > 192.168.43.195.7771: UDP, length 120
22:48:44.645661 IP 192.168.43.124.8880 > 192.168.43.195.7771: UDP, length 120
22:48:44.695660 IP 192.168.43.124.8880 > 192.168.43.195.7771: UDP, length 120
22:48:44.745658 IP 192.168.43.124.8880 > 192.168.43.195.7771: UDP, length 120
22:48:44.795666 IP 192.168.43.124.8880 > 192.168.43.195.7771: UDP, length 120
22:48:44.845659 IP 192.168.43.124.8880 > 192.168.43.195.7771: UDP, length 120
22:48:44.895662 IP 192.168.43.124.8880 > 192.168.43.195.7771: UDP, length 120
22:48:44.945660 IP 192.168.43.124.8880 > 192.168.43.195.7771: UDP, length 120
22:48:44.995662 IP 192.168.43.124.8880 > 192.168.43.195.7771: UDP, length 120
22:48:45.045661 IP 192.168.43.124.8880 > 192.168.43.195.7771: UDP, length 120
22:48:45.095660 IP 192.168.43.124.8880 > 192.168.43.195.7771: UDP, length 120
22:48:45.145657 IP 192.168.43.124.8880 > 192.168.43.195.7771: UDP, length 120
22:48:45.195664 IP 192.168.43.124.8880 > 192.168.43.195.7771: UDP, length 120
22:48:45.245659 IP 192.168.43.124.8880 > 192.168.43.195.7771: UDP, length 120
22:48:45.295722 IP 192.168.43.124.8880 > 192.168.43.195.7771: UDP, length 120
22:48:45.345713 IP 192.168.43.124.8880 > 192.168.43.195.7771: UDP, length 120
22:48:45.395715 IP 192.168.43.124.8880 > 192.168.43.195.7771: UDP, length 120
22:48:45.445713 IP 192.168.43.124.8880 > 192.168.43.195.7771: UDP, length 120
22:48:45.495719 IP 192.168.43.124.8880 > 192.168.43.195.7771: UDP, length 120
22:48:45.545715 IP 192.168.43.124.8880 > 192.168.43.195.7771: UDP, length 120
22:48:45.595716 IP 192.168.43.124.8880 > 192.168.43.195.7771: UDP, length 120
22:48:45.645714 IP 192.168.43.124.8880 > 192.168.43.195.7771: UDP, length 120
22:48:45.695718 IP 192.168.43.124.8880 > 192.168.43.195.7771: UDP, length 120
22:48:45.745713 IP 192.168.43.124.8880 > 192.168.43.195.7771: UDP, length 120
22:48:45.795713 IP 192.168.43.124.8880 > 192.168.43.195.7771: UDP, length 120
22:48:45.845714 IP 192.168.43.124.8880 > 192.168.43.195.7771: UDP, length 120
22:48:45.895718 IP 192.168.43.124.8880 > 192.168.43.195.7771: UDP, length 120
22:48:45.945712 IP 192.168.43.124.8880 > 192.168.43.195.7771: UDP, length 120
22:48:45.995717 IP 192.168.43.124.8880 > 192.168.43.195.7771: UDP, length 120
22:48:46.045715 IP 192.168.43.124.8880 > 192.168.43.195.7771: UDP, length 120
22:48:46.095718 IP 192.168.43.124.8880 > 192.168.43.195.7771: UDP, length 120
22:48:46.145665 IP 192.168.43.124.8880 > 192.168.43.195.7771: UDP, length 120
22:48:46.195665 IP 192.168.43.124.8880 > 192.168.43.195.7771: UDP, length 120
22:48:46.245661 IP 192.168.43.124.8880 > 192.168.43.195.7771: UDP, length 120
22:48:46.295710 IP 192.168.43.124.8880 > 192.168.43.195.7771: UDP, length 120
22:48:46.345684 IP 192.168.43.124.8880 > 192.168.43.195.7771: UDP, length 120
22:48:46.395715 IP 192.168.43.124.8880 > 192.168.43.195.7771: UDP, length 120
22:48:46.445675 IP 192.168.43.124.8880 > 192.168.43.195.7771: UDP, length 120
22:48:46.495716 IP 192.168.43.124.8880 > 192.168.43.195.7771: UDP, length 120
22:48:46.545640 IP 192.168.43.124.8880 > 192.168.43.195.7771: UDP, length 120
22:48:46.595719 IP 192.168.43.124.8880 > 192.168.43.195.7771: UDP, length 120
22:48:46.645643 IP 192.168.43.124.8880 > 192.168.43.195.7771: UDP, length 120
22:48:46.695718 IP 192.168.43.124.8880 > 192.168.43.195.7771: UDP, length 120
22:48:46.745638 IP 192.168.43.124.8880 > 192.168.43.195.7771: UDP, length 120
22:48:46.795724 IP 192.168.43.124.8880 > 192.168.43.195.7771: UDP, length 120
22:48:46.845805 IP 192.168.43.124.8880 > 192.168.43.195.7771: UDP, length 120
22:48:46.895668 IP 192.168.43.124.8880 > 192.168.43.195.7771: UDP, length 120
22:48:46.945670 IP 192.168.43.124.8880 > 192.168.43.195.7771: UDP, length 120
22:48:46.995661 IP 192.168.43.124.8880 > 192.168.43.195.7771: UDP, length 120
22:48:47.045662 IP 192.168.43.124.8880 > 192.168.43.195.7771: UDP, length 120
22:48:47.095659 IP 192.168.43.124.8880 > 192.168.43.195.7771: UDP, length 120
22:48:47.145621 IP 192.168.43.124.8880 > 192.168.43.195.7771: UDP, length 120
22:48:47.195664 IP 192.168.43.124.8880 > 192.168.43.195.7771: UDP, length 120
22:48:47.245600 IP 192.168.43.124.8880 > 192.168.43.195.7771: UDP, length 120
22:48:47.295587 IP 192.168.43.124.8880 > 192.168.43.195.7771: UDP, length 120
22:48:47.345652 IP 192.168.43.124.8880 > 192.168.43.195.7771: UDP, length 120
22:48:47.395661 IP 192.168.43.124.8880 > 192.168.43.195.7771: UDP, length 120
22:48:47.445661 IP 192.168.43.124.8880 > 192.168.43.195.7771: UDP, length 120
22:48:47.495660 IP 192.168.43.124.8880 > 192.168.43.195.7771: UDP, length 120
22:48:47.545658 IP 192.168.43.124.8880 > 192.168.43.195.7771: UDP, length 120
22:48:47.595660 IP 192.168.43.124.8880 > 192.168.43.195.7771: UDP, length 120
22:48:47.645662 IP 192.168.43.124.8880 > 192.168.43.195.7771: UDP, length 120
22:48:47.695665 IP 192.168.43.124.8880 > 192.168.43.195.7771: UDP, length 120
22:48:47.745661 IP 192.168.43.124.8880 > 192.168.43.195.7771: UDP, length 120
22:48:47.795661 IP 192.168.43.124.8880 > 192.168.43.195.7771: UDP, length 120
22:48:47.845661 IP 192.168.43.124.8880 > 192.168.43.195.7771: UDP, length 120
22:48:47.895664 IP 192.168.43.124.8880 > 192.168.43.195.7771: UDP, length 120
22:48:47.945660 IP 192.168.43.124.8880 > 192.168.43.195.7771: UDP, length 120
22:48:47.995661 IP 192.168.43.124.8880 > 192.168.43.195.7771: UDP, length 120
22:48:48.045663 IP 192.168.43.124.8880 > 192.168.43.195.7771: UDP, length 120
22:48:48.095716 IP 192.168.43.124.8880 > 192.168.43.195.7771: UDP, length 120
22:48:48.145882 IP 192.168.43.124.8880 > 192.168.43.195.7771: UDP, length 120
22:48:48.195671 IP 192.168.43.124.8880 > 192.168.43.195.7771: UDP, length 120
22:48:48.245663 IP 192.168.43.124.8880 > 192.168.43.195.7771: UDP, length 120
22:48:48.295718 IP 192.168.43.124.8880 > 192.168.43.195.7771: UDP, length 120
22:48:48.345723 IP 192.168.43.124.8880 > 192.168.43.195.7771: UDP, length 120
22:48:48.395991 IP 192.168.43.124.8880 > 192.168.43.195.7771: UDP, length 120
22:48:48.445643 IP 192.168.43.124.8880 > 192.168.43.195.7771: UDP, length 120
22:48:48.496447 IP 192.168.43.124.8880 > 192.168.43.195.7771: UDP, length 120
22:48:48.545715 IP 192.168.43.124.8880 > 192.168.43.195.7771: UDP, length 120
22:48:48.595720 IP 192.168.43.124.8880 > 192.168.43.195.7771: UDP, length 120
22:48:48.645662 IP 192.168.43.124.8880 > 192.168.43.195.7771: UDP, length 120
22:48:48.695665 IP 192.168.43.124.8880 > 192.168.43.195.7771: UDP, length 120
22:48:48.745663 IP 192.168.43.124.8880 > 192.168.43.195.7771: UDP, length 120
22:48:48.795663 IP 192.168.43.124.8880 > 192.168.43.195.7771: UDP, length 120
22:48:48.845663 IP 192.168.43.124.8880 > 192.168.43.195.7771: UDP, length 120
22:48:48.895667 IP 192.168.43.124.8880 > 192.168.43.195.7771: UDP, length 120
22:48:48.945663 IP 192.168.43.124.8880 > 192.168.43.195.7771: UDP, length 120
22:48:48.995667 IP 192.168.43.124.8880 > 192.168.43.195.7771: UDP, length 120
22:48:49.045662 IP 192.168.43.124.8880 > 192.168.43.195.7771: UDP, length 120
22:48:49.095664 IP 192.168.43.124.8880 > 192.168.43.195.7771: UDP, length 120
22:48:49.145591 IP 192.168.43.124.8880 > 192.168.43.195.7771: UDP, length 120
22:48:49.195661 IP 192.168.43.124.8880 > 192.168.43.195.7771: UDP, length 120
22:48:49.245656 IP 192.168.43.124.8880 > 192.168.43.195.7771: UDP, length 120
22:48:49.295661 IP 192.168.43.124.8880 > 192.168.43.195.7771: UDP, length 120
22:48:49.345623 IP 192.168.43.124.8880 > 192.168.43.195.7771: UDP, length 120
22:48:49.395660 IP 192.168.43.124.8880 > 192.168.43.195.7771: UDP, length 120
22:48:49.445616 IP 192.168.43.124.8880 > 192.168.43.195.7771: UDP, length 120
22:48:49.495661 IP 192.168.43.124.8880 > 192.168.43.195.7771: UDP, length 120
