20:51:48.182537 IP 192.168.43.124.8880 > 192.168.43.146.7771: UDP, length 120
20:51:48.232645 IP 192.168.43.124.8880 > 192.168.43.146.7771: UDP, length 120
20:51:48.282620 IP 192.168.43.124.8880 > 192.168.43.146.7771: UDP, length 120
20:51:48.332685 IP 192.168.43.124.8880 > 192.168.43.146.7771: UDP, length 120
20:51:48.382686 IP 192.168.43.124.8880 > 192.168.43.146.7771: UDP, length 120
20:51:48.432603 IP 192.168.43.124.8880 > 192.168.43.146.7771: UDP, length 120
20:51:48.482627 IP 192.168.43.124.8880 > 192.168.43.146.7771: UDP, length 120
20:51:48.532612 IP 192.168.43.124.8880 > 192.168.43.146.7771: UDP, length 120
20:51:48.582684 IP 192.168.43.124.8880 > 192.168.43.146.7771: UDP, length 120
20:51:48.632683 IP 192.168.43.124.8880 > 192.168.43.146.7771: UDP, length 120
20:51:48.682686 IP 192.168.43.124.8880 > 192.168.43.146.7771: UDP, length 120
20:51:48.732681 IP 192.168.43.124.8880 > 192.168.43.146.7771: UDP, length 120
20:51:48.782681 IP 192.168.43.124.8880 > 192.168.43.146.7771: UDP, length 120
20:51:48.832651 IP 192.168.43.124.8880 > 192.168.43.146.7771: UDP, length 120
20:51:48.882687 IP 192.168.43.124.8880 > 192.168.43.146.7771: UDP, length 120
20:51:48.932686 IP 192.168.43.124.8880 > 192.168.43.146.7771: UDP, length 120
20:51:48.982684 IP 192.168.43.124.8880 > 192.168.43.146.7771: UDP, length 120
20:51:49.032683 IP 192.168.43.124.8880 > 192.168.43.146.7771: UDP, length 120
20:51:49.082685 IP 192.168.43.124.8880 > 192.168.43.146.7771: UDP, length 120
20:51:49.132685 IP 192.168.43.124.8880 > 192.168.43.146.7771: UDP, length 120
20:51:49.182626 IP 192.168.43.124.8880 > 192.168.43.146.7771: UDP, length 120
20:51:49.232650 IP 192.168.43.124.8880 > 192.168.43.146.7771: UDP, length 120
20:51:49.282683 IP 192.168.43.124.8880 > 192.168.43.146.7771: UDP, length 120
20:51:49.332685 IP 192.168.43.124.8880 > 192.168.43.146.7771: UDP, length 120
20:51:49.382686 IP 192.168.43.124.8880 > 192.168.43.146.7771: UDP, length 120
20:51:49.432686 IP 192.168.43.124.8880 > 192.168.43.146.7771: UDP, length 120
20:51:49.482680 IP 192.168.43.124.8880 > 192.168.43.146.7771: UDP, length 120
20:51:49.532688 IP 192.168.43.124.8880 > 192.168.43.146.7771: UDP, length 120
20:51:49.582683 IP 192.168.43.124.8880 > 192.168.43.146.7771: UDP, length 120
20:51:49.632684 IP 192.168.43.124.8880 > 192.168.43.146.7771: UDP, length 120
20:51:49.682681 IP 192.168.43.124.8880 > 192.168.43.146.7771: UDP, length 120
20:51:49.732628 IP 192.168.43.124.8880 > 192.168.43.146.7771: UDP, length 120
20:51:49.782735 IP 192.168.43.124.8880 > 192.168.43.146.7771: UDP, length 120
20:51:49.832703 IP 192.168.43.124.8880 > 192.168.43.146.7771: UDP, length 120
20:51:49.882736 IP 192.168.43.124.8880 > 192.168.43.146.7771: UDP, length 120
20:51:49.932687 IP 192.168.43.124.8880 > 192.168.43.146.7771: UDP, length 120
20:51:49.982684 IP 192.168.43.124.8880 > 192.168.43.146.7771: UDP, length 120
20:51:50.032690 IP 192.168.43.124.8880 > 192.168.43.146.7771: UDP, length 120
20:51:50.082687 IP 192.168.43.124.8880 > 192.168.43.146.7771: UDP, length 120
20:51:50.132602 IP 192.168.43.124.8880 > 192.168.43.146.7771: UDP, length 120
20:51:50.182685 IP 192.168.43.124.8880 > 192.168.43.146.7771: UDP, length 120
20:51:50.232684 IP 192.168.43.124.8880 > 192.168.43.146.7771: UDP, length 120
20:51:50.282681 IP 192.168.43.124.8880 > 192.168.43.146.7771: UDP, length 120
20:51:50.332648 IP 192.168.43.124.8880 > 192.168.43.146.7771: UDP, length 120
20:51:50.382680 IP 192.168.43.124.8880 > 192.168.43.146.7771: UDP, length 120
20:51:50.432679 IP 192.168.43.124.8880 > 192.168.43.146.7771: UDP, length 120
20:51:50.482680 IP 192.168.43.124.8880 > 192.168.43.146.7771: UDP, length 120
20:51:50.532685 IP 192.168.43.124.8880 > 192.168.43.146.7771: UDP, length 120
20:51:50.582685 IP 192.168.43.124.8880 > 192.168.43.146.7771: UDP, length 120
20:51:50.632683 IP 192.168.43.124.8880 > 192.168.43.146.7771: UDP, length 120
20:51:50.682623 IP 192.168.43.124.8880 > 192.168.43.146.7771: UDP, length 120
20:51:50.732682 IP 192.168.43.124.8880 > 192.168.43.146.7771: UDP, length 120
20:51:50.782612 IP 192.168.43.124.8880 > 192.168.43.146.7771: UDP, length 120
20:51:50.832680 IP 192.168.43.124.8880 > 192.168.43.146.7771: UDP, length 120
20:51:50.882684 IP 192.168.43.124.8880 > 192.168.43.146.7771: UDP, length 120
20:51:50.932686 IP 192.168.43.124.8880 > 192.168.43.146.7771: UDP, length 120
20:51:50.982683 IP 192.168.43.124.8880 > 192.168.43.146.7771: UDP, length 120
20:51:51.032684 IP 192.168.43.124.8880 > 192.168.43.146.7771: UDP, length 120
20:51:51.082683 IP 192.168.43.124.8880 > 192.168.43.146.7771: UDP, length 120
20:51:51.132682 IP 192.168.43.124.8880 > 192.168.43.146.7771: UDP, length 120
20:51:51.182682 IP 192.168.43.124.8880 > 192.168.43.146.7771: UDP, length 120
20:51:51.232691 IP 192.168.43.124.8880 > 192.168.43.146.7771: UDP, length 120
20:51:51.282681 IP 192.168.43.124.8880 > 192.168.43.146.7771: UDP, length 120
20:51:51.332681 IP 192.168.43.124.8880 > 192.168.43.146.7771: UDP, length 120
20:51:51.382684 IP 192.168.43.124.8880 > 192.168.43.146.7771: UDP, length 120
20:51:51.432739 IP 192.168.43.124.8880 > 192.168.43.146.7771: UDP, length 120
20:51:51.482735 IP 192.168.43.124.8880 > 192.168.43.146.7771: UDP, length 120
20:51:51.532688 IP 192.168.43.124.8880 > 192.168.43.146.7771: UDP, length 120
20:51:51.582687 IP 192.168.43.124.8880 > 192.168.43.146.7771: UDP, length 120
20:51:51.632687 IP 192.168.43.124.8880 > 192.168.43.146.7771: UDP, length 120
20:51:51.682687 IP 192.168.43.124.8880 > 192.168.43.146.7771: UDP, length 120
20:51:51.725389 IP 192.168.43.147.8880 > 192.168.43.124.7773: UDP, length 120
20:51:51.732689 IP 192.168.43.124.8880 > 192.168.43.146.7771: UDP, length 120
20:51:51.780499 IP 192.168.43.147.8880 > 192.168.43.124.7773: UDP, length 120
20:51:51.782685 IP 192.168.43.124.8880 > 192.168.43.146.7771: UDP, length 120
20:51:51.821032 IP 192.168.43.147.8880 > 192.168.43.124.7773: UDP, length 120
20:51:51.832653 IP 192.168.43.124.8880 > 192.168.43.146.7771: UDP, length 120
20:51:51.875968 IP 192.168.43.147.8880 > 192.168.43.124.7773: UDP, length 120
20:51:51.882689 IP 192.168.43.124.8880 > 192.168.43.146.7771: UDP, length 120
20:51:51.923279 IP 192.168.43.147.8880 > 192.168.43.124.7773: UDP, length 120
20:51:51.932687 IP 192.168.43.124.8880 > 192.168.43.146.7771: UDP, length 120
20:51:51.978910 IP 192.168.43.147.8880 > 192.168.43.124.7773: UDP, length 120
20:51:51.982690 IP 192.168.43.124.8880 > 192.168.43.146.7771: UDP, length 120
20:51:52.026770 IP 192.168.43.147.8880 > 192.168.43.124.7773: UDP, length 120
20:51:52.032689 IP 192.168.43.124.8880 > 192.168.43.146.7771: UDP, length 120
20:51:52.075250 IP 192.168.43.147.8880 > 192.168.43.124.7773: UDP, length 120
20:51:52.082686 IP 192.168.43.124.8880 > 192.168.43.146.7771: UDP, length 120
20:51:52.125721 IP 192.168.43.147.8880 > 192.168.43.124.7773: UDP, length 120
20:51:52.132683 IP 192.168.43.124.8880 > 192.168.43.146.7771: UDP, length 120
20:51:52.174198 IP 192.168.43.147.8880 > 192.168.43.124.7773: UDP, length 120
20:51:52.182684 IP 192.168.43.124.8880 > 192.168.43.146.7771: UDP, length 120
20:51:52.224445 IP 192.168.43.147.8880 > 192.168.43.124.7773: UDP, length 120
20:51:52.232687 IP 192.168.43.124.8880 > 192.168.43.146.7771: UDP, length 120
20:51:52.274690 IP 192.168.43.147.8880 > 192.168.43.124.7773: UDP, length 120
20:51:52.282691 IP 192.168.43.124.8880 > 192.168.43.146.7771: UDP, length 120
20:51:52.324020 IP 192.168.43.147.8880 > 192.168.43.124.7773: UDP, length 120
20:51:52.332652 IP 192.168.43.124.8880 > 192.168.43.146.7771: UDP, length 120
20:51:52.375903 IP 192.168.43.147.8880 > 192.168.43.124.7773: UDP, length 120
20:51:52.382686 IP 192.168.43.124.8880 > 192.168.43.146.7771: UDP, length 120
20:51:52.426323 IP 192.168.43.147.8880 > 192.168.43.124.7773: UDP, length 120
20:51:52.432687 IP 192.168.43.124.8880 > 192.168.43.146.7771: UDP, length 120
20:51:52.473645 IP 192.168.43.147.8880 > 192.168.43.124.7773: UDP, length 120
20:51:52.482685 IP 192.168.43.124.8880 > 192.168.43.146.7771: UDP, length 120
20:51:52.532687 IP 192.168.43.124.8880 > 192.168.43.146.7771: UDP, length 120
20:51:52.537879 IP 192.168.43.147.8880 > 192.168.43.124.7773: UDP, length 120
20:51:52.575230 IP 192.168.43.147.8880 > 192.168.43.124.7773: UDP, length 120
20:51:52.582632 IP 192.168.43.124.8880 > 192.168.43.146.7771: UDP, length 120
20:51:52.628815 IP 192.168.43.147.8880 > 192.168.43.124.7773: UDP, length 120
20:51:52.632647 IP 192.168.43.124.8880 > 192.168.43.146.7771: UDP, length 120
20:51:52.677007 IP 192.168.43.147.8880 > 192.168.43.124.7773: UDP, length 120
20:51:52.682682 IP 192.168.43.124.8880 > 192.168.43.146.7771: UDP, length 120
20:51:52.730035 IP 192.168.43.147.8880 > 192.168.43.124.7773: UDP, length 120
20:51:52.732686 IP 192.168.43.124.8880 > 192.168.43.146.7771: UDP, length 120
20:51:52.773335 IP 192.168.43.147.8880 > 192.168.43.124.7773: UDP, length 120
20:51:52.782736 IP 192.168.43.124.8880 > 192.168.43.146.7771: UDP, length 120
20:51:52.827480 IP 192.168.43.147.8880 > 192.168.43.124.7773: UDP, length 120
20:51:52.832688 IP 192.168.43.124.8880 > 192.168.43.146.7771: UDP, length 120
20:51:52.873296 IP 192.168.43.147.8880 > 192.168.43.124.7773: UDP, length 120
20:51:52.882689 IP 192.168.43.124.8880 > 192.168.43.146.7771: UDP, length 120
20:51:52.925232 IP 192.168.43.147.8880 > 192.168.43.124.7773: UDP, length 120
20:51:52.932686 IP 192.168.43.124.8880 > 192.168.43.146.7771: UDP, length 120
20:51:52.971212 IP 192.168.43.147.8880 > 192.168.43.124.7773: UDP, length 120
20:51:52.982686 IP 192.168.43.124.8880 > 192.168.43.146.7771: UDP, length 120
20:51:53.023758 IP 192.168.43.147.8880 > 192.168.43.124.7773: UDP, length 120
20:51:53.032687 IP 192.168.43.124.8880 > 192.168.43.146.7771: UDP, length 120
20:51:53.074127 IP 192.168.43.147.8880 > 192.168.43.124.7773: UDP, length 120
20:51:53.082688 IP 192.168.43.124.8880 > 192.168.43.146.7771: UDP, length 120
20:51:53.123727 IP 192.168.43.147.8880 > 192.168.43.124.7773: UDP, length 120
20:51:53.132688 IP 192.168.43.124.8880 > 192.168.43.146.7771: UDP, length 120
20:51:53.170753 IP 192.168.43.147.8880 > 192.168.43.124.7773: UDP, length 120
20:51:53.182686 IP 192.168.43.124.8880 > 192.168.43.146.7771: UDP, length 120
20:51:53.223673 IP 192.168.43.147.8880 > 192.168.43.124.7773: UDP, length 120
20:51:53.232685 IP 192.168.43.124.8880 > 192.168.43.146.7771: UDP, length 120
20:51:53.272688 IP 192.168.43.147.8880 > 192.168.43.124.7773: UDP, length 120
20:51:53.282688 IP 192.168.43.124.8880 > 192.168.43.146.7771: UDP, length 120
20:51:53.326010 IP 192.168.43.147.8880 > 192.168.43.124.7773: UDP, length 120
20:51:53.332683 IP 192.168.43.124.8880 > 192.168.43.146.7771: UDP, length 120
20:51:53.375186 IP 192.168.43.147.8880 > 192.168.43.124.7773: UDP, length 120
20:51:53.382687 IP 192.168.43.124.8880 > 192.168.43.146.7771: UDP, length 120
20:51:53.423563 IP 192.168.43.147.8880 > 192.168.43.124.7773: UDP, length 120
20:51:53.432643 IP 192.168.43.124.8880 > 192.168.43.146.7771: UDP, length 120
20:51:53.474047 IP 192.168.43.147.8880 > 192.168.43.124.7773: UDP, length 120
20:51:53.482727 IP 192.168.43.124.8880 > 192.168.43.146.7771: UDP, length 120
20:51:53.530465 IP 192.168.43.147.8880 > 192.168.43.124.7773: UDP, length 120
20:51:53.532727 IP 192.168.43.124.8880 > 192.168.43.146.7771: UDP, length 120
20:51:53.574175 IP 192.168.43.147.8880 > 192.168.43.124.7773: UDP, length 120
20:51:53.582615 IP 192.168.43.124.8880 > 192.168.43.146.7771: UDP, length 120
20:51:53.623826 IP 192.168.43.147.8880 > 192.168.43.124.7773: UDP, length 120
20:51:53.632600 IP 192.168.43.124.8880 > 192.168.43.146.7771: UDP, length 120
20:51:53.671600 IP 192.168.43.147.8880 > 192.168.43.124.7773: UDP, length 120
20:51:53.682682 IP 192.168.43.124.8880 > 192.168.43.146.7771: UDP, length 120
20:51:53.725858 IP 192.168.43.147.8880 > 192.168.43.124.7773: UDP, length 120
20:51:53.732682 IP 192.168.43.124.8880 > 192.168.43.146.7771: UDP, length 120
20:51:53.774796 IP 192.168.43.147.8880 > 192.168.43.124.7773: UDP, length 120
20:51:53.782684 IP 192.168.43.124.8880 > 192.168.43.146.7771: UDP, length 120
20:51:53.828718 IP 192.168.43.147.8880 > 192.168.43.124.7773: UDP, length 120
20:51:53.832683 IP 192.168.43.124.8880 > 192.168.43.146.7771: UDP, length 120
20:51:53.876495 IP 192.168.43.147.8880 > 192.168.43.124.7773: UDP, length 120
20:51:53.882686 IP 192.168.43.124.8880 > 192.168.43.146.7771: UDP, length 120
20:51:53.931039 IP 192.168.43.147.8880 > 192.168.43.124.7773: UDP, length 120
20:51:53.932688 IP 192.168.43.124.8880 > 192.168.43.146.7771: UDP, length 120
20:51:53.970662 IP 192.168.43.147.8880 > 192.168.43.124.7773: UDP, length 120
20:51:53.982685 IP 192.168.43.124.8880 > 192.168.43.146.7771: UDP, length 120
20:51:54.032743 IP 192.168.43.124.8880 > 192.168.43.146.7771: UDP, length 120
20:51:54.065279 IP 192.168.43.147.8880 > 192.168.43.124.7773: UDP, length 120
20:51:54.074276 IP 192.168.43.147.8880 > 192.168.43.124.7773: UDP, length 120
20:51:54.082738 IP 192.168.43.124.8880 > 192.168.43.146.7771: UDP, length 120
20:51:54.123090 IP 192.168.43.147.8880 > 192.168.43.124.7773: UDP, length 120
20:51:54.132747 IP 192.168.43.124.8880 > 192.168.43.146.7771: UDP, length 120
20:51:54.174126 IP 192.168.43.147.8880 > 192.168.43.124.7773: UDP, length 120
20:51:54.182740 IP 192.168.43.124.8880 > 192.168.43.146.7771: UDP, length 120
20:51:54.224090 IP 192.168.43.147.8880 > 192.168.43.124.7773: UDP, length 120
20:51:54.232741 IP 192.168.43.124.8880 > 192.168.43.146.7771: UDP, length 120
20:51:54.274091 IP 192.168.43.147.8880 > 192.168.43.124.7773: UDP, length 120
20:51:54.282736 IP 192.168.43.124.8880 > 192.168.43.146.7771: UDP, length 120
20:51:54.324131 IP 192.168.43.147.8880 > 192.168.43.124.7773: UDP, length 120
20:51:54.332705 IP 192.168.43.124.8880 > 192.168.43.146.7771: UDP, length 120
20:51:54.374901 IP 192.168.43.147.8880 > 192.168.43.124.7773: UDP, length 120
20:51:54.382740 IP 192.168.43.124.8880 > 192.168.43.146.7771: UDP, length 120
20:51:54.427042 IP 192.168.43.147.8880 > 192.168.43.124.7773: UDP, length 120
20:51:54.432746 IP 192.168.43.124.8880 > 192.168.43.146.7771: UDP, length 120
20:51:54.474869 IP 192.168.43.147.8880 > 192.168.43.124.7773: UDP, length 120
20:51:54.482743 IP 192.168.43.124.8880 > 192.168.43.146.7771: UDP, length 120
20:51:54.528488 IP 192.168.43.147.8880 > 192.168.43.124.7773: UDP, length 120
20:51:54.532688 IP 192.168.43.124.8880 > 192.168.43.146.7771: UDP, length 120
20:51:54.577223 IP 192.168.43.147.8880 > 192.168.43.124.7773: UDP, length 120
20:51:54.582681 IP 192.168.43.124.8880 > 192.168.43.146.7771: UDP, length 120
20:51:54.623547 IP 192.168.43.147.8880 > 192.168.43.124.7773: UDP, length 120
20:51:54.632683 IP 192.168.43.124.8880 > 192.168.43.146.7771: UDP, length 120
20:51:54.675638 IP 192.168.43.147.8880 > 192.168.43.124.7773: UDP, length 120
20:51:54.682683 IP 192.168.43.124.8880 > 192.168.43.146.7771: UDP, length 120
20:51:54.724654 IP 192.168.43.147.8880 > 192.168.43.124.7773: UDP, length 120
20:51:54.732684 IP 192.168.43.124.8880 > 192.168.43.146.7771: UDP, length 120
20:51:54.773518 IP 192.168.43.147.8880 > 192.168.43.124.7773: UDP, length 120
20:51:54.782629 IP 192.168.43.124.8880 > 192.168.43.146.7771: UDP, length 120
20:51:54.823597 IP 192.168.43.147.8880 > 192.168.43.124.7773: UDP, length 120
20:51:54.832684 IP 192.168.43.124.8880 > 192.168.43.146.7771: UDP, length 120
20:51:54.875324 IP 192.168.43.147.8880 > 192.168.43.124.7773: UDP, length 120
20:51:54.882685 IP 192.168.43.124.8880 > 192.168.43.146.7771: UDP, length 120
20:51:54.923858 IP 192.168.43.147.8880 > 192.168.43.124.7773: UDP, length 120
20:51:54.932646 IP 192.168.43.124.8880 > 192.168.43.146.7771: UDP, length 120
20:51:54.976062 IP 192.168.43.147.8880 > 192.168.43.124.7773: UDP, length 120
20:51:54.982684 IP 192.168.43.124.8880 > 192.168.43.146.7771: UDP, length 120
20:51:55.027091 IP 192.168.43.147.8880 > 192.168.43.124.7773: UDP, length 120
20:51:55.032687 IP 192.168.43.124.8880 > 192.168.43.146.7771: UDP, length 120
20:51:55.072880 IP 192.168.43.147.8880 > 192.168.43.124.7773: UDP, length 120
20:51:55.082683 IP 192.168.43.124.8880 > 192.168.43.146.7771: UDP, length 120
20:51:55.120477 IP 192.168.43.147.8880 > 192.168.43.124.7773: UDP, length 120
20:51:55.132684 IP 192.168.43.124.8880 > 192.168.43.146.7771: UDP, length 120
20:51:55.173918 IP 192.168.43.147.8880 > 192.168.43.124.7773: UDP, length 120
20:51:55.182683 IP 192.168.43.124.8880 > 192.168.43.146.7771: UDP, length 120
20:51:55.220429 IP 192.168.43.147.8880 > 192.168.43.124.7773: UDP, length 120
20:51:55.232740 IP 192.168.43.124.8880 > 192.168.43.146.7771: UDP, length 120
20:51:55.273478 IP 192.168.43.147.8880 > 192.168.43.124.7773: UDP, length 120
20:51:55.282703 IP 192.168.43.124.8880 > 192.168.43.146.7771: UDP, length 120
20:51:55.332737 IP 192.168.43.124.8880 > 192.168.43.146.7771: UDP, length 120
20:51:55.343395 IP 192.168.43.147.8880 > 192.168.43.124.7773: UDP, length 120
20:51:55.373971 IP 192.168.43.147.8880 > 192.168.43.124.7773: UDP, length 120
20:51:55.382705 IP 192.168.43.124.8880 > 192.168.43.146.7771: UDP, length 120
20:51:55.425717 IP 192.168.43.147.8880 > 192.168.43.124.7773: UDP, length 120
20:51:55.432743 IP 192.168.43.124.8880 > 192.168.43.146.7771: UDP, length 120
20:51:55.482037 IP 192.168.43.147.8880 > 192.168.43.124.7773: UDP, length 120
20:51:55.482650 IP 192.168.43.124.8880 > 192.168.43.146.7771: UDP, length 120
20:51:55.525733 IP 192.168.43.147.8880 > 192.168.43.124.7773: UDP, length 120
20:51:55.532739 IP 192.168.43.124.8880 > 192.168.43.146.7771: UDP, length 120
20:51:55.571470 IP 192.168.43.147.8880 > 192.168.43.124.7773: UDP, length 120
20:51:55.582665 IP 192.168.43.124.8880 > 192.168.43.146.7771: UDP, length 120
20:51:55.623485 IP 192.168.43.147.8880 > 192.168.43.124.7773: UDP, length 120
20:51:55.632683 IP 192.168.43.124.8880 > 192.168.43.146.7771: UDP, length 120
20:51:55.673403 IP 192.168.43.147.8880 > 192.168.43.124.7773: UDP, length 120
20:51:55.682600 IP 192.168.43.124.8880 > 192.168.43.146.7771: UDP, length 120
20:51:55.726174 IP 192.168.43.147.8880 > 192.168.43.124.7773: UDP, length 120
20:51:55.732684 IP 192.168.43.124.8880 > 192.168.43.146.7771: UDP, length 120
20:51:55.774488 IP 192.168.43.147.8880 > 192.168.43.124.7773: UDP, length 120
20:51:55.782689 IP 192.168.43.124.8880 > 192.168.43.146.7771: UDP, length 120
20:51:55.826068 IP 192.168.43.147.8880 > 192.168.43.124.7773: UDP, length 120
20:51:55.832634 IP 192.168.43.124.8880 > 192.168.43.146.7771: UDP, length 120
20:51:55.876879 IP 192.168.43.147.8880 > 192.168.43.124.7773: UDP, length 120
20:51:55.882684 IP 192.168.43.124.8880 > 192.168.43.146.7771: UDP, length 120
20:51:55.923807 IP 192.168.43.147.8880 > 192.168.43.124.7773: UDP, length 120
20:51:55.932686 IP 192.168.43.124.8880 > 192.168.43.146.7771: UDP, length 120
20:51:55.979468 IP 192.168.43.147.8880 > 192.168.43.124.7773: UDP, length 120
20:51:55.982681 IP 192.168.43.124.8880 > 192.168.43.146.7771: UDP, length 120
20:51:56.024812 IP 192.168.43.147.8880 > 192.168.43.124.7773: UDP, length 120
20:51:56.032683 IP 192.168.43.124.8880 > 192.168.43.146.7771: UDP, length 120
20:51:56.079684 IP 192.168.43.147.8880 > 192.168.43.124.7773: UDP, length 120
20:51:56.082691 IP 192.168.43.124.8880 > 192.168.43.146.7771: UDP, length 120
20:51:56.127170 IP 192.168.43.147.8880 > 192.168.43.124.7773: UDP, length 120
20:51:56.132685 IP 192.168.43.124.8880 > 192.168.43.146.7771: UDP, length 120
20:51:56.179606 IP 192.168.43.147.8880 > 192.168.43.124.7773: UDP, length 120
20:51:56.182683 IP 192.168.43.124.8880 > 192.168.43.146.7771: UDP, length 120
20:51:56.224690 IP 192.168.43.147.8880 > 192.168.43.124.7773: UDP, length 120
20:51:56.232686 IP 192.168.43.124.8880 > 192.168.43.146.7771: UDP, length 120
20:51:56.273707 IP 192.168.43.147.8880 > 192.168.43.124.7773: UDP, length 120
20:51:56.282683 IP 192.168.43.124.8880 > 192.168.43.146.7771: UDP, length 120
20:51:56.323572 IP 192.168.43.147.8880 > 192.168.43.124.7773: UDP, length 120
20:51:56.332648 IP 192.168.43.124.8880 > 192.168.43.146.7771: UDP, length 120
20:51:56.373796 IP 192.168.43.147.8880 > 192.168.43.124.7773: UDP, length 120
20:51:56.382685 IP 192.168.43.124.8880 > 192.168.43.146.7771: UDP, length 120
20:51:56.423508 IP 192.168.43.147.8880 > 192.168.43.124.7773: UDP, length 120
20:51:56.432684 IP 192.168.43.124.8880 > 192.168.43.146.7771: UDP, length 120
20:51:56.474617 IP 192.168.43.147.8880 > 192.168.43.124.7773: UDP, length 120
20:51:56.482687 IP 192.168.43.124.8880 > 192.168.43.146.7771: UDP, length 120
20:51:56.532629 IP 192.168.43.124.8880 > 192.168.43.146.7771: UDP, length 120
20:51:56.532629 IP 192.168.43.147.8880 > 192.168.43.124.7773: UDP, length 120
20:51:56.575360 IP 192.168.43.147.8880 > 192.168.43.124.7773: UDP, length 120
20:51:56.582681 IP 192.168.43.124.8880 > 192.168.43.146.7771: UDP, length 120
20:51:56.625250 IP 192.168.43.147.8880 > 192.168.43.124.7773: UDP, length 120
20:51:56.632684 IP 192.168.43.124.8880 > 192.168.43.146.7771: UDP, length 120
20:51:56.678062 IP 192.168.43.147.8880 > 192.168.43.124.7773: UDP, length 120
20:51:56.682685 IP 192.168.43.124.8880 > 192.168.43.146.7771: UDP, length 120
20:51:56.729642 IP 192.168.43.147.8880 > 192.168.43.124.7773: UDP, length 120
20:51:56.732688 IP 192.168.43.124.8880 > 192.168.43.146.7771: UDP, length 120
20:51:56.773541 IP 192.168.43.147.8880 > 192.168.43.124.7773: UDP, length 120
20:51:56.782682 IP 192.168.43.124.8880 > 192.168.43.146.7771: UDP, length 120
20:51:56.826515 IP 192.168.43.147.8880 > 192.168.43.124.7773: UDP, length 120
20:51:56.832683 IP 192.168.43.124.8880 > 192.168.43.146.7771: UDP, length 120
20:51:56.875323 IP 192.168.43.147.8880 > 192.168.43.124.7773: UDP, length 120
20:51:56.882683 IP 192.168.43.124.8880 > 192.168.43.146.7771: UDP, length 120
20:51:56.923653 IP 192.168.43.147.8880 > 192.168.43.124.7773: UDP, length 120
20:51:56.932685 IP 192.168.43.124.8880 > 192.168.43.146.7771: UDP, length 120
20:51:56.973448 IP 192.168.43.147.8880 > 192.168.43.124.7773: UDP, length 120
20:51:56.982683 IP 192.168.43.124.8880 > 192.168.43.146.7771: UDP, length 120
20:51:57.031310 IP 192.168.43.147.8880 > 192.168.43.124.7773: UDP, length 120
20:51:57.032683 IP 192.168.43.124.8880 > 192.168.43.146.7771: UDP, length 120
20:51:57.074395 IP 192.168.43.147.8880 > 192.168.43.124.7773: UDP, length 120
20:51:57.082684 IP 192.168.43.124.8880 > 192.168.43.146.7771: UDP, length 120
20:51:57.128313 IP 192.168.43.147.8880 > 192.168.43.124.7773: UDP, length 120
20:51:57.132684 IP 192.168.43.124.8880 > 192.168.43.146.7771: UDP, length 120
20:51:57.176722 IP 192.168.43.147.8880 > 192.168.43.124.7773: UDP, length 120
20:51:57.182713 IP 192.168.43.124.8880 > 192.168.43.146.7771: UDP, length 120
20:51:57.228751 IP 192.168.43.147.8880 > 192.168.43.124.7773: UDP, length 120
20:51:57.232741 IP 192.168.43.124.8880 > 192.168.43.146.7771: UDP, length 120
20:51:57.276647 IP 192.168.43.147.8880 > 192.168.43.124.7773: UDP, length 120
20:51:57.282739 IP 192.168.43.124.8880 > 192.168.43.146.7771: UDP, length 120
20:51:57.323928 IP 192.168.43.147.8880 > 192.168.43.124.7773: UDP, length 120
20:51:57.332738 IP 192.168.43.124.8880 > 192.168.43.146.7771: UDP, length 120
20:51:57.375103 IP 192.168.43.147.8880 > 192.168.43.124.7773: UDP, length 120
20:51:57.382688 IP 192.168.43.124.8880 > 192.168.43.146.7771: UDP, length 120
20:51:57.424080 IP 192.168.43.147.8880 > 192.168.43.124.7773: UDP, length 120
20:51:57.432686 IP 192.168.43.124.8880 > 192.168.43.146.7771: UDP, length 120
20:51:57.473592 IP 192.168.43.147.8880 > 192.168.43.124.7773: UDP, length 120
20:51:57.482687 IP 192.168.43.124.8880 > 192.168.43.146.7771: UDP, length 120
20:51:57.528364 IP 192.168.43.147.8880 > 192.168.43.124.7773: UDP, length 120
20:51:57.532685 IP 192.168.43.124.8880 > 192.168.43.146.7771: UDP, length 120
20:51:57.574532 IP 192.168.43.147.8880 > 192.168.43.124.7773: UDP, length 120
20:51:57.582624 IP 192.168.43.124.8880 > 192.168.43.146.7771: UDP, length 120
20:51:57.629908 IP 192.168.43.147.8880 > 192.168.43.124.7773: UDP, length 120
20:51:57.632648 IP 192.168.43.124.8880 > 192.168.43.146.7771: UDP, length 120
20:51:57.676446 IP 192.168.43.147.8880 > 192.168.43.124.7773: UDP, length 120
20:51:57.682684 IP 192.168.43.124.8880 > 192.168.43.146.7771: UDP, length 120
20:51:57.722792 IP 192.168.43.147.8880 > 192.168.43.124.7773: UDP, length 120
20:51:57.732689 IP 192.168.43.124.8880 > 192.168.43.146.7771: UDP, length 120
20:51:57.774261 IP 192.168.43.147.8880 > 192.168.43.124.7773: UDP, length 120
20:51:57.782736 IP 192.168.43.124.8880 > 192.168.43.146.7771: UDP, length 120
20:51:57.824582 IP 192.168.43.147.8880 > 192.168.43.124.7773: UDP, length 120
20:51:57.832699 IP 192.168.43.124.8880 > 192.168.43.146.7771: UDP, length 120
20:51:57.882742 IP 192.168.43.124.8880 > 192.168.43.146.7771: UDP, length 120
20:51:57.883366 IP 192.168.43.147.8880 > 192.168.43.124.7773: UDP, length 120
20:51:57.932737 IP 192.168.43.124.8880 > 192.168.43.146.7771: UDP, length 120
20:51:57.961445 IP 192.168.43.147.8880 > 192.168.43.124.7773: UDP, length 120
20:51:57.977090 IP 192.168.43.147.8880 > 192.168.43.124.7773: UDP, length 120
20:51:57.982737 IP 192.168.43.124.8880 > 192.168.43.146.7771: UDP, length 120
20:51:58.026709 IP 192.168.43.147.8880 > 192.168.43.124.7773: UDP, length 120
20:51:58.032740 IP 192.168.43.124.8880 > 192.168.43.146.7771: UDP, length 120
20:51:58.080698 IP 192.168.43.147.8880 > 192.168.43.124.7773: UDP, length 120
20:51:58.082740 IP 192.168.43.124.8880 > 192.168.43.146.7771: UDP, length 120
20:51:58.129535 IP 192.168.43.147.8880 > 192.168.43.124.7773: UDP, length 120
20:51:58.132689 IP 192.168.43.124.8880 > 192.168.43.146.7771: UDP, length 120
20:51:58.175984 IP 192.168.43.147.8880 > 192.168.43.124.7773: UDP, length 120
20:51:58.182687 IP 192.168.43.124.8880 > 192.168.43.146.7771: UDP, length 120
20:51:58.231775 IP 192.168.43.147.8880 > 192.168.43.124.7773: UDP, length 120
20:51:58.232738 IP 192.168.43.124.8880 > 192.168.43.146.7771: UDP, length 120
20:51:58.276977 IP 192.168.43.147.8880 > 192.168.43.124.7773: UDP, length 120
20:51:58.282741 IP 192.168.43.124.8880 > 192.168.43.146.7771: UDP, length 120
20:51:58.329427 IP 192.168.43.147.8880 > 192.168.43.124.7773: UDP, length 120
20:51:58.332700 IP 192.168.43.124.8880 > 192.168.43.146.7771: UDP, length 120
20:51:58.371795 IP 192.168.43.147.8880 > 192.168.43.124.7773: UDP, length 120
20:51:58.382734 IP 192.168.43.124.8880 > 192.168.43.146.7771: UDP, length 120
20:51:58.424230 IP 192.168.43.147.8880 > 192.168.43.124.7773: UDP, length 120
20:51:58.432740 IP 192.168.43.124.8880 > 192.168.43.146.7771: UDP, length 120
20:51:58.474293 IP 192.168.43.147.8880 > 192.168.43.124.7773: UDP, length 120
20:51:58.482736 IP 192.168.43.124.8880 > 192.168.43.146.7771: UDP, length 120
20:51:58.527447 IP 192.168.43.147.8880 > 192.168.43.124.7773: UDP, length 120
20:51:58.532739 IP 192.168.43.124.8880 > 192.168.43.146.7771: UDP, length 120
20:51:58.571034 IP 192.168.43.147.8880 > 192.168.43.124.7773: UDP, length 120
20:51:58.582734 IP 192.168.43.124.8880 > 192.168.43.146.7771: UDP, length 120
20:51:58.625205 IP 192.168.43.147.8880 > 192.168.43.124.7773: UDP, length 120
20:51:58.632686 IP 192.168.43.124.8880 > 192.168.43.146.7771: UDP, length 120
20:51:58.676938 IP 192.168.43.147.8880 > 192.168.43.124.7773: UDP, length 120
20:51:58.682615 IP 192.168.43.124.8880 > 192.168.43.146.7771: UDP, length 120
20:51:58.725666 IP 192.168.43.147.8880 > 192.168.43.124.7773: UDP, length 120
20:51:58.732598 IP 192.168.43.124.8880 > 192.168.43.146.7771: UDP, length 120
20:51:58.775679 IP 192.168.43.147.8880 > 192.168.43.124.7773: UDP, length 120
20:51:58.782684 IP 192.168.43.124.8880 > 192.168.43.146.7771: UDP, length 120
20:51:58.828543 IP 192.168.43.147.8880 > 192.168.43.124.7773: UDP, length 120
20:51:58.832682 IP 192.168.43.124.8880 > 192.168.43.146.7771: UDP, length 120
20:51:58.874588 IP 192.168.43.147.8880 > 192.168.43.124.7773: UDP, length 120
20:51:58.882684 IP 192.168.43.124.8880 > 192.168.43.146.7771: UDP, length 120
20:51:58.923215 IP 192.168.43.147.8880 > 192.168.43.124.7773: UDP, length 120
20:51:58.932686 IP 192.168.43.124.8880 > 192.168.43.146.7771: UDP, length 120
20:51:58.976497 IP 192.168.43.147.8880 > 192.168.43.124.7773: UDP, length 120
20:51:58.982681 IP 192.168.43.124.8880 > 192.168.43.146.7771: UDP, length 120
20:51:59.025463 IP 192.168.43.147.8880 > 192.168.43.124.7773: UDP, length 120
20:51:59.032684 IP 192.168.43.124.8880 > 192.168.43.146.7771: UDP, length 120
20:51:59.073871 IP 192.168.43.147.8880 > 192.168.43.124.7773: UDP, length 120
20:51:59.082623 IP 192.168.43.124.8880 > 192.168.43.146.7771: UDP, length 120
20:51:59.120350 IP 192.168.43.147.8880 > 192.168.43.124.7773: UDP, length 120
20:51:59.132683 IP 192.168.43.124.8880 > 192.168.43.146.7771: UDP, length 120
20:51:59.174545 IP 192.168.43.147.8880 > 192.168.43.124.7773: UDP, length 120
20:51:59.182683 IP 192.168.43.124.8880 > 192.168.43.146.7771: UDP, length 120
20:51:59.225253 IP 192.168.43.147.8880 > 192.168.43.124.7773: UDP, length 120
20:51:59.232739 IP 192.168.43.124.8880 > 192.168.43.146.7771: UDP, length 120
20:51:59.276962 IP 192.168.43.147.8880 > 192.168.43.124.7773: UDP, length 120
20:51:59.282740 IP 192.168.43.124.8880 > 192.168.43.146.7771: UDP, length 120
20:51:59.327870 IP 192.168.43.147.8880 > 192.168.43.124.7773: UDP, length 120
20:51:59.332737 IP 192.168.43.124.8880 > 192.168.43.146.7771: UDP, length 120
20:51:59.380053 IP 192.168.43.147.8880 > 192.168.43.124.7773: UDP, length 120
20:51:59.382738 IP 192.168.43.124.8880 > 192.168.43.146.7771: UDP, length 120
20:51:59.420814 IP 192.168.43.147.8880 > 192.168.43.124.7773: UDP, length 120
20:51:59.432740 IP 192.168.43.124.8880 > 192.168.43.146.7771: UDP, length 120
20:51:59.473936 IP 192.168.43.147.8880 > 192.168.43.124.7773: UDP, length 120
20:51:59.482737 IP 192.168.43.124.8880 > 192.168.43.146.7771: UDP, length 120
20:51:59.521089 IP 192.168.43.147.8880 > 192.168.43.124.7773: UDP, length 120
20:51:59.532739 IP 192.168.43.124.8880 > 192.168.43.146.7771: UDP, length 120
20:51:59.574130 IP 192.168.43.147.8880 > 192.168.43.124.7773: UDP, length 120
20:51:59.582737 IP 192.168.43.124.8880 > 192.168.43.146.7771: UDP, length 120
20:51:59.623962 IP 192.168.43.147.8880 > 192.168.43.124.7773: UDP, length 120
20:51:59.632686 IP 192.168.43.124.8880 > 192.168.43.146.7771: UDP, length 120
20:51:59.673110 IP 192.168.43.147.8880 > 192.168.43.124.7773: UDP, length 120
20:51:59.682685 IP 192.168.43.124.8880 > 192.168.43.146.7771: UDP, length 120
20:51:59.724117 IP 192.168.43.147.8880 > 192.168.43.124.7773: UDP, length 120
20:51:59.732684 IP 192.168.43.124.8880 > 192.168.43.146.7771: UDP, length 120
20:51:59.774479 IP 192.168.43.147.8880 > 192.168.43.124.7773: UDP, length 120
20:51:59.782683 IP 192.168.43.124.8880 > 192.168.43.146.7771: UDP, length 120
20:51:59.828815 IP 192.168.43.147.8880 > 192.168.43.124.7773: UDP, length 120
20:51:59.832683 IP 192.168.43.124.8880 > 192.168.43.146.7771: UDP, length 120
20:51:59.873703 IP 192.168.43.147.8880 > 192.168.43.124.7773: UDP, length 120
20:51:59.882683 IP 192.168.43.124.8880 > 192.168.43.146.7771: UDP, length 120
20:51:59.924264 IP 192.168.43.147.8880 > 192.168.43.124.7773: UDP, length 120
20:51:59.932739 IP 192.168.43.124.8880 > 192.168.43.146.7771: UDP, length 120
20:51:59.972471 IP 192.168.43.147.8880 > 192.168.43.124.7773: UDP, length 120
20:51:59.982652 IP 192.168.43.124.8880 > 192.168.43.146.7771: UDP, length 120
20:52:00.024048 IP 192.168.43.147.8880 > 192.168.43.124.7773: UDP, length 120
20:52:00.032767 IP 192.168.43.124.8880 > 192.168.43.146.7771: UDP, length 120
20:52:00.075494 IP 192.168.43.147.8880 > 192.168.43.124.7773: UDP, length 120
20:52:00.082661 IP 192.168.43.124.8880 > 192.168.43.146.7771: UDP, length 120
20:52:00.123557 IP 192.168.43.147.8880 > 192.168.43.124.7773: UDP, length 120
20:52:00.132691 IP 192.168.43.124.8880 > 192.168.43.146.7771: UDP, length 120
20:52:00.175872 IP 192.168.43.147.8880 > 192.168.43.124.7773: UDP, length 120
20:52:00.182688 IP 192.168.43.124.8880 > 192.168.43.146.7771: UDP, length 120
20:52:00.224499 IP 192.168.43.147.8880 > 192.168.43.124.7773: UDP, length 120
20:52:00.232687 IP 192.168.43.124.8880 > 192.168.43.146.7771: UDP, length 120
20:52:00.280173 IP 192.168.43.147.8880 > 192.168.43.124.7773: UDP, length 120
20:52:00.282685 IP 192.168.43.124.8880 > 192.168.43.146.7771: UDP, length 120
20:52:00.320775 IP 192.168.43.147.8880 > 192.168.43.124.7773: UDP, length 120
20:52:00.332651 IP 192.168.43.124.8880 > 192.168.43.146.7771: UDP, length 120
20:52:00.375993 IP 192.168.43.147.8880 > 192.168.43.124.7773: UDP, length 120
20:52:00.382689 IP 192.168.43.124.8880 > 192.168.43.146.7771: UDP, length 120
20:52:00.432688 IP 192.168.43.124.8880 > 192.168.43.146.7771: UDP, length 120
20:52:00.460328 IP 192.168.43.147.8880 > 192.168.43.124.7773: UDP, length 120
20:52:00.474489 IP 192.168.43.147.8880 > 192.168.43.124.7773: UDP, length 120
20:52:00.482686 IP 192.168.43.124.8880 > 192.168.43.146.7771: UDP, length 120
20:52:00.525878 IP 192.168.43.147.8880 > 192.168.43.124.7773: UDP, length 120
20:52:00.532743 IP 192.168.43.124.8880 > 192.168.43.146.7771: UDP, length 120
20:52:00.573849 IP 192.168.43.147.8880 > 192.168.43.124.7773: UDP, length 120
20:52:00.582739 IP 192.168.43.124.8880 > 192.168.43.146.7771: UDP, length 120
20:52:00.624279 IP 192.168.43.147.8880 > 192.168.43.124.7773: UDP, length 120
20:52:00.632690 IP 192.168.43.124.8880 > 192.168.43.146.7771: UDP, length 120
20:52:00.673574 IP 192.168.43.147.8880 > 192.168.43.124.7773: UDP, length 120
20:52:00.682685 IP 192.168.43.124.8880 > 192.168.43.146.7771: UDP, length 120
20:52:00.723540 IP 192.168.43.147.8880 > 192.168.43.124.7773: UDP, length 120
20:52:00.732686 IP 192.168.43.124.8880 > 192.168.43.146.7771: UDP, length 120
20:52:00.774016 IP 192.168.43.147.8880 > 192.168.43.124.7773: UDP, length 120
20:52:00.782686 IP 192.168.43.124.8880 > 192.168.43.146.7771: UDP, length 120
20:52:00.825921 IP 192.168.43.147.8880 > 192.168.43.124.7773: UDP, length 120
20:52:00.832683 IP 192.168.43.124.8880 > 192.168.43.146.7771: UDP, length 120
20:52:00.877052 IP 192.168.43.147.8880 > 192.168.43.124.7773: UDP, length 120
20:52:00.882684 IP 192.168.43.124.8880 > 192.168.43.146.7771: UDP, length 120
20:52:00.925624 IP 192.168.43.147.8880 > 192.168.43.124.7773: UDP, length 120
20:52:00.932684 IP 192.168.43.124.8880 > 192.168.43.146.7771: UDP, length 120
20:52:00.976087 IP 192.168.43.147.8880 > 192.168.43.124.7773: UDP, length 120
20:52:00.982683 IP 192.168.43.124.8880 > 192.168.43.146.7771: UDP, length 120
20:52:01.025221 IP 192.168.43.147.8880 > 192.168.43.124.7773: UDP, length 120
20:52:01.032685 IP 192.168.43.124.8880 > 192.168.43.146.7771: UDP, length 120
20:52:01.073573 IP 192.168.43.147.8880 > 192.168.43.124.7773: UDP, length 120
20:52:01.082684 IP 192.168.43.124.8880 > 192.168.43.146.7771: UDP, length 120
20:52:01.123626 IP 192.168.43.147.8880 > 192.168.43.124.7773: UDP, length 120
20:52:01.132684 IP 192.168.43.124.8880 > 192.168.43.146.7771: UDP, length 120
20:52:01.173350 IP 192.168.43.147.8880 > 192.168.43.124.7773: UDP, length 120
20:52:01.182682 IP 192.168.43.124.8880 > 192.168.43.146.7771: UDP, length 120
20:52:01.232684 IP 192.168.43.124.8880 > 192.168.43.146.7771: UDP, length 120
20:52:01.261161 IP 192.168.43.147.8880 > 192.168.43.124.7773: UDP, length 120
20:52:01.275642 IP 192.168.43.147.8880 > 192.168.43.124.7773: UDP, length 120
20:52:01.282635 IP 192.168.43.124.8880 > 192.168.43.146.7771: UDP, length 120
20:52:01.327175 IP 192.168.43.147.8880 > 192.168.43.124.7773: UDP, length 120
20:52:01.332734 IP 192.168.43.124.8880 > 192.168.43.146.7771: UDP, length 120
20:52:01.375458 IP 192.168.43.147.8880 > 192.168.43.124.7773: UDP, length 120
20:52:01.382686 IP 192.168.43.124.8880 > 192.168.43.146.7771: UDP, length 120
20:52:01.427952 IP 192.168.43.147.8880 > 192.168.43.124.7773: UDP, length 120
20:52:01.432687 IP 192.168.43.124.8880 > 192.168.43.146.7771: UDP, length 120
20:52:01.477342 IP 192.168.43.147.8880 > 192.168.43.124.7773: UDP, length 120
20:52:01.482640 IP 192.168.43.124.8880 > 192.168.43.146.7771: UDP, length 120
20:52:01.522901 IP 192.168.43.147.8880 > 192.168.43.124.7773: UDP, length 120
20:52:01.532787 IP 192.168.43.124.8880 > 192.168.43.146.7771: UDP, length 120
20:52:01.573864 IP 192.168.43.147.8880 > 192.168.43.124.7773: UDP, length 120
20:52:01.582645 IP 192.168.43.124.8880 > 192.168.43.146.7771: UDP, length 120
20:52:01.623475 IP 192.168.43.147.8880 > 192.168.43.124.7773: UDP, length 120
20:52:01.632685 IP 192.168.43.124.8880 > 192.168.43.146.7771: UDP, length 120
20:52:01.673893 IP 192.168.43.147.8880 > 192.168.43.124.7773: UDP, length 120
20:52:01.682686 IP 192.168.43.124.8880 > 192.168.43.146.7771: UDP, length 120
20:52:01.725193 IP 192.168.43.147.8880 > 192.168.43.124.7773: UDP, length 120
20:52:01.732683 IP 192.168.43.124.8880 > 192.168.43.146.7771: UDP, length 120
20:52:01.774689 IP 192.168.43.147.8880 > 192.168.43.124.7773: UDP, length 120
20:52:01.782734 IP 192.168.43.124.8880 > 192.168.43.146.7771: UDP, length 120
20:52:01.823678 IP 192.168.43.147.8880 > 192.168.43.124.7773: UDP, length 120
20:52:01.832703 IP 192.168.43.124.8880 > 192.168.43.146.7771: UDP, length 120
20:52:01.876820 IP 192.168.43.147.8880 > 192.168.43.124.7773: UDP, length 120
20:52:01.882739 IP 192.168.43.124.8880 > 192.168.43.146.7771: UDP, length 120
20:52:01.924071 IP 192.168.43.147.8880 > 192.168.43.124.7773: UDP, length 120
20:52:01.932740 IP 192.168.43.124.8880 > 192.168.43.146.7771: UDP, length 120
20:52:01.978934 IP 192.168.43.147.8880 > 192.168.43.124.7773: UDP, length 120
20:52:01.982738 IP 192.168.43.124.8880 > 192.168.43.146.7771: UDP, length 120
20:52:02.023775 IP 192.168.43.147.8880 > 192.168.43.124.7773: UDP, length 120
20:52:02.032689 IP 192.168.43.124.8880 > 192.168.43.146.7771: UDP, length 120
20:52:02.074192 IP 192.168.43.147.8880 > 192.168.43.124.7773: UDP, length 120
20:52:02.082740 IP 192.168.43.124.8880 > 192.168.43.146.7771: UDP, length 120
20:52:02.123943 IP 192.168.43.147.8880 > 192.168.43.124.7773: UDP, length 120
20:52:02.132742 IP 192.168.43.124.8880 > 192.168.43.146.7771: UDP, length 120
20:52:02.176099 IP 192.168.43.147.8880 > 192.168.43.124.7773: UDP, length 120
20:52:02.182740 IP 192.168.43.124.8880 > 192.168.43.146.7771: UDP, length 120
20:52:02.226000 IP 192.168.43.147.8880 > 192.168.43.124.7773: UDP, length 120
20:52:02.232741 IP 192.168.43.124.8880 > 192.168.43.146.7771: UDP, length 120
20:52:02.282740 IP 192.168.43.124.8880 > 192.168.43.146.7771: UDP, length 120
20:52:02.286249 IP 192.168.43.147.8880 > 192.168.43.124.7773: UDP, length 120
20:52:02.327577 IP 192.168.43.147.8880 > 192.168.43.124.7773: UDP, length 120
20:52:02.332701 IP 192.168.43.124.8880 > 192.168.43.146.7771: UDP, length 120
20:52:02.375707 IP 192.168.43.147.8880 > 192.168.43.124.7773: UDP, length 120
20:52:02.382736 IP 192.168.43.124.8880 > 192.168.43.146.7771: UDP, length 120
20:52:02.430200 IP 192.168.43.147.8880 > 192.168.43.124.7773: UDP, length 120
20:52:02.432738 IP 192.168.43.124.8880 > 192.168.43.146.7771: UDP, length 120
20:52:02.478194 IP 192.168.43.147.8880 > 192.168.43.124.7773: UDP, length 120
20:52:02.482737 IP 192.168.43.124.8880 > 192.168.43.146.7771: UDP, length 120
20:52:02.529358 IP 192.168.43.147.8880 > 192.168.43.124.7773: UDP, length 120
20:52:02.532740 IP 192.168.43.124.8880 > 192.168.43.146.7771: UDP, length 120
20:52:02.572488 IP 192.168.43.147.8880 > 192.168.43.124.7773: UDP, length 120
20:52:02.582671 IP 192.168.43.124.8880 > 192.168.43.146.7771: UDP, length 120
20:52:02.631209 IP 192.168.43.147.8880 > 192.168.43.124.7773: UDP, length 120
20:52:02.632649 IP 192.168.43.124.8880 > 192.168.43.146.7771: UDP, length 120
20:52:02.673928 IP 192.168.43.147.8880 > 192.168.43.124.7773: UDP, length 120
20:52:02.682684 IP 192.168.43.124.8880 > 192.168.43.146.7771: UDP, length 120
20:52:02.724844 IP 192.168.43.147.8880 > 192.168.43.124.7773: UDP, length 120
