00:50:46.027964 IP 192.168.43.147.8880 > 192.168.43.124.7773: UDP, length 120
00:50:46.047328 IP 192.168.43.146.8880 > 192.168.43.147.7772: UDP, length 120
00:50:46.078028 IP 192.168.43.147.8880 > 192.168.43.124.7773: UDP, length 120
00:50:46.085923 IP 192.168.43.146.8880 > 192.168.43.147.7772: UDP, length 120
00:50:46.127989 IP 192.168.43.147.8880 > 192.168.43.124.7773: UDP, length 120
00:50:46.132934 IP 192.168.43.146.8880 > 192.168.43.147.7772: UDP, length 120
00:50:46.177980 IP 192.168.43.147.8880 > 192.168.43.124.7773: UDP, length 120
00:50:46.188306 IP 192.168.43.146.8880 > 192.168.43.147.7772: UDP, length 120
00:50:46.227979 IP 192.168.43.147.8880 > 192.168.43.124.7773: UDP, length 120
00:50:46.234227 IP 192.168.43.146.8880 > 192.168.43.147.7772: UDP, length 120
00:50:46.277978 IP 192.168.43.147.8880 > 192.168.43.124.7773: UDP, length 120
00:50:46.293448 IP 192.168.43.146.8880 > 192.168.43.147.7772: UDP, length 120
00:50:46.327978 IP 192.168.43.147.8880 > 192.168.43.124.7773: UDP, length 120
00:50:46.335499 IP 192.168.43.146.8880 > 192.168.43.147.7772: UDP, length 120
00:50:46.377977 IP 192.168.43.147.8880 > 192.168.43.124.7773: UDP, length 120
00:50:46.387725 IP 192.168.43.146.8880 > 192.168.43.147.7772: UDP, length 120
00:50:46.428045 IP 192.168.43.147.8880 > 192.168.43.124.7773: UDP, length 120
00:50:46.436832 IP 192.168.43.146.8880 > 192.168.43.147.7772: UDP, length 120
00:50:46.478113 IP 192.168.43.147.8880 > 192.168.43.124.7773: UDP, length 120
00:50:46.486511 IP 192.168.43.146.8880 > 192.168.43.147.7772: UDP, length 120
00:50:46.528070 IP 192.168.43.147.8880 > 192.168.43.124.7773: UDP, length 120
00:50:46.535489 IP 192.168.43.146.8880 > 192.168.43.147.7772: UDP, length 120
00:50:46.578050 IP 192.168.43.147.8880 > 192.168.43.124.7773: UDP, length 120
00:50:46.588640 IP 192.168.43.146.8880 > 192.168.43.147.7772: UDP, length 120
00:50:46.628039 IP 192.168.43.147.8880 > 192.168.43.124.7773: UDP, length 120
00:50:46.639352 IP 192.168.43.146.8880 > 192.168.43.147.7772: UDP, length 120
00:50:46.678040 IP 192.168.43.147.8880 > 192.168.43.124.7773: UDP, length 120
00:50:46.684073 IP 192.168.43.146.8880 > 192.168.43.147.7772: UDP, length 120
00:50:46.728028 IP 192.168.43.147.8880 > 192.168.43.124.7773: UDP, length 120
00:50:46.734131 IP 192.168.43.146.8880 > 192.168.43.147.7772: UDP, length 120
00:50:46.778059 IP 192.168.43.147.8880 > 192.168.43.124.7773: UDP, length 120
00:50:46.782654 IP 192.168.43.146.8880 > 192.168.43.147.7772: UDP, length 120
00:50:46.828033 IP 192.168.43.147.8880 > 192.168.43.124.7773: UDP, length 120
00:50:46.832802 IP 192.168.43.146.8880 > 192.168.43.147.7772: UDP, length 120
00:50:46.878035 IP 192.168.43.147.8880 > 192.168.43.124.7773: UDP, length 120
00:50:46.884845 IP 192.168.43.146.8880 > 192.168.43.147.7772: UDP, length 120
00:50:46.928010 IP 192.168.43.147.8880 > 192.168.43.124.7773: UDP, length 120
00:50:46.933982 IP 192.168.43.146.8880 > 192.168.43.147.7772: UDP, length 120
00:50:46.977970 IP 192.168.43.147.8880 > 192.168.43.124.7773: UDP, length 120
00:50:46.986919 IP 192.168.43.146.8880 > 192.168.43.147.7772: UDP, length 120
00:50:47.027962 IP 192.168.43.147.8880 > 192.168.43.124.7773: UDP, length 120
00:50:47.034096 IP 192.168.43.146.8880 > 192.168.43.147.7772: UDP, length 120
00:50:47.077958 IP 192.168.43.147.8880 > 192.168.43.124.7773: UDP, length 120
00:50:47.086710 IP 192.168.43.146.8880 > 192.168.43.147.7772: UDP, length 120
00:50:47.127955 IP 192.168.43.147.8880 > 192.168.43.124.7773: UDP, length 120
00:50:47.132515 IP 192.168.43.146.8880 > 192.168.43.147.7772: UDP, length 120
00:50:47.177955 IP 192.168.43.147.8880 > 192.168.43.124.7773: UDP, length 120
00:50:47.183965 IP 192.168.43.146.8880 > 192.168.43.147.7772: UDP, length 120
00:50:47.227954 IP 192.168.43.147.8880 > 192.168.43.124.7773: UDP, length 120
00:50:47.234212 IP 192.168.43.146.8880 > 192.168.43.147.7772: UDP, length 120
00:50:47.277955 IP 192.168.43.147.8880 > 192.168.43.124.7773: UDP, length 120
00:50:47.284044 IP 192.168.43.146.8880 > 192.168.43.147.7772: UDP, length 120
00:50:47.327955 IP 192.168.43.147.8880 > 192.168.43.124.7773: UDP, length 120
00:50:47.335416 IP 192.168.43.146.8880 > 192.168.43.147.7772: UDP, length 120
00:50:47.377956 IP 192.168.43.147.8880 > 192.168.43.124.7773: UDP, length 120
00:50:47.394857 IP 192.168.43.146.8880 > 192.168.43.147.7772: UDP, length 120
00:50:47.427957 IP 192.168.43.147.8880 > 192.168.43.124.7773: UDP, length 120
00:50:47.437070 IP 192.168.43.146.8880 > 192.168.43.147.7772: UDP, length 120
00:50:47.477954 IP 192.168.43.147.8880 > 192.168.43.124.7773: UDP, length 120
00:50:47.486681 IP 192.168.43.146.8880 > 192.168.43.147.7772: UDP, length 120
00:50:47.527955 IP 192.168.43.147.8880 > 192.168.43.124.7773: UDP, length 120
00:50:47.534233 IP 192.168.43.146.8880 > 192.168.43.147.7772: UDP, length 120
00:50:47.577954 IP 192.168.43.147.8880 > 192.168.43.124.7773: UDP, length 120
00:50:47.611131 IP 192.168.43.146.8880 > 192.168.43.147.7772: UDP, length 120
00:50:47.627953 IP 192.168.43.147.8880 > 192.168.43.124.7773: UDP, length 120
00:50:47.646740 IP 192.168.43.146.8880 > 192.168.43.147.7772: UDP, length 120
00:50:47.677956 IP 192.168.43.147.8880 > 192.168.43.124.7773: UDP, length 120
00:50:47.727954 IP 192.168.43.147.8880 > 192.168.43.124.7773: UDP, length 120
00:50:47.755062 IP 192.168.43.146.8880 > 192.168.43.147.7772: UDP, length 120
00:50:47.755134 IP 192.168.43.146.8880 > 192.168.43.147.7772: UDP, length 120
00:50:47.777957 IP 192.168.43.147.8880 > 192.168.43.124.7773: UDP, length 120
00:50:47.792906 IP 192.168.43.146.8880 > 192.168.43.147.7772: UDP, length 120
00:50:47.827960 IP 192.168.43.147.8880 > 192.168.43.124.7773: UDP, length 120
00:50:47.834201 IP 192.168.43.146.8880 > 192.168.43.147.7772: UDP, length 120
00:50:47.877969 IP 192.168.43.147.8880 > 192.168.43.124.7773: UDP, length 120
00:50:47.890271 IP 192.168.43.146.8880 > 192.168.43.147.7772: UDP, length 120
00:50:47.927959 IP 192.168.43.147.8880 > 192.168.43.124.7773: UDP, length 120
00:50:47.940608 IP 192.168.43.146.8880 > 192.168.43.147.7772: UDP, length 120
00:50:47.977957 IP 192.168.43.147.8880 > 192.168.43.124.7773: UDP, length 120
00:50:47.992425 IP 192.168.43.146.8880 > 192.168.43.147.7772: UDP, length 120
00:50:48.027999 IP 192.168.43.147.8880 > 192.168.43.124.7773: UDP, length 120
00:50:48.043303 IP 192.168.43.146.8880 > 192.168.43.147.7772: UDP, length 120
00:50:48.077978 IP 192.168.43.147.8880 > 192.168.43.124.7773: UDP, length 120
00:50:48.094834 IP 192.168.43.146.8880 > 192.168.43.147.7772: UDP, length 120
00:50:48.127962 IP 192.168.43.147.8880 > 192.168.43.124.7773: UDP, length 120
00:50:48.162583 IP 192.168.43.146.8880 > 192.168.43.147.7772: UDP, length 120
00:50:48.177956 IP 192.168.43.147.8880 > 192.168.43.124.7773: UDP, length 120
00:50:48.227955 IP 192.168.43.147.8880 > 192.168.43.124.7773: UDP, length 120
00:50:48.245101 IP 192.168.43.146.8880 > 192.168.43.147.7772: UDP, length 120
00:50:48.268853 IP 192.168.43.146.8880 > 192.168.43.147.7772: UDP, length 120
00:50:48.277955 IP 192.168.43.147.8880 > 192.168.43.124.7773: UDP, length 120
00:50:48.314098 IP 192.168.43.146.8880 > 192.168.43.147.7772: UDP, length 120
00:50:48.327954 IP 192.168.43.147.8880 > 192.168.43.124.7773: UDP, length 120
00:50:48.353582 IP 192.168.43.146.8880 > 192.168.43.147.7772: UDP, length 120
00:50:48.377955 IP 192.168.43.147.8880 > 192.168.43.124.7773: UDP, length 120
00:50:48.425971 IP 192.168.43.146.8880 > 192.168.43.147.7772: UDP, length 120
00:50:48.427955 IP 192.168.43.147.8880 > 192.168.43.124.7773: UDP, length 120
00:50:48.453586 IP 192.168.43.146.8880 > 192.168.43.147.7772: UDP, length 120
00:50:48.477955 IP 192.168.43.147.8880 > 192.168.43.124.7773: UDP, length 120
00:50:48.486189 IP 192.168.43.146.8880 > 192.168.43.147.7772: UDP, length 120
00:50:48.527954 IP 192.168.43.147.8880 > 192.168.43.124.7773: UDP, length 120
00:50:48.574217 IP 192.168.43.146.8880 > 192.168.43.147.7772: UDP, length 120
00:50:48.577959 IP 192.168.43.147.8880 > 192.168.43.124.7773: UDP, length 120
00:50:48.588563 IP 192.168.43.146.8880 > 192.168.43.147.7772: UDP, length 120
00:50:48.627958 IP 192.168.43.147.8880 > 192.168.43.124.7773: UDP, length 120
00:50:48.677956 IP 192.168.43.147.8880 > 192.168.43.124.7773: UDP, length 120
00:50:48.681203 IP 192.168.43.146.8880 > 192.168.43.147.7772: UDP, length 120
00:50:48.688570 IP 192.168.43.146.8880 > 192.168.43.147.7772: UDP, length 120
00:50:48.727956 IP 192.168.43.147.8880 > 192.168.43.124.7773: UDP, length 120
00:50:48.760207 IP 192.168.43.146.8880 > 192.168.43.147.7772: UDP, length 120
00:50:48.777955 IP 192.168.43.147.8880 > 192.168.43.124.7773: UDP, length 120
00:50:48.821168 IP 192.168.43.146.8880 > 192.168.43.147.7772: UDP, length 120
00:50:48.827956 IP 192.168.43.147.8880 > 192.168.43.124.7773: UDP, length 120
00:50:48.877954 IP 192.168.43.147.8880 > 192.168.43.124.7773: UDP, length 120
00:50:48.881195 IP 192.168.43.146.8880 > 192.168.43.147.7772: UDP, length 120
00:50:48.894124 IP 192.168.43.146.8880 > 192.168.43.147.7772: UDP, length 120
00:50:48.927962 IP 192.168.43.147.8880 > 192.168.43.124.7773: UDP, length 120
00:50:48.967913 IP 192.168.43.146.8880 > 192.168.43.147.7772: UDP, length 120
00:50:48.977958 IP 192.168.43.147.8880 > 192.168.43.124.7773: UDP, length 120
00:50:48.986571 IP 192.168.43.146.8880 > 192.168.43.147.7772: UDP, length 120
00:50:49.027956 IP 192.168.43.147.8880 > 192.168.43.124.7773: UDP, length 120
00:50:49.041691 IP 192.168.43.146.8880 > 192.168.43.147.7772: UDP, length 120
00:50:49.077960 IP 192.168.43.147.8880 > 192.168.43.124.7773: UDP, length 120
00:50:49.087310 IP 192.168.43.146.8880 > 192.168.43.147.7772: UDP, length 120
00:50:49.127956 IP 192.168.43.147.8880 > 192.168.43.124.7773: UDP, length 120
00:50:49.144093 IP 192.168.43.146.8880 > 192.168.43.147.7772: UDP, length 120
00:50:49.177954 IP 192.168.43.147.8880 > 192.168.43.124.7773: UDP, length 120
00:50:49.186889 IP 192.168.43.146.8880 > 192.168.43.147.7772: UDP, length 120
00:50:49.227954 IP 192.168.43.147.8880 > 192.168.43.124.7773: UDP, length 120
00:50:49.246491 IP 192.168.43.146.8880 > 192.168.43.147.7772: UDP, length 120
00:50:49.277955 IP 192.168.43.147.8880 > 192.168.43.124.7773: UDP, length 120
00:50:49.287659 IP 192.168.43.146.8880 > 192.168.43.147.7772: UDP, length 120
00:50:49.327955 IP 192.168.43.147.8880 > 192.168.43.124.7773: UDP, length 120
00:50:49.346546 IP 192.168.43.146.8880 > 192.168.43.147.7772: UDP, length 120
00:50:49.377954 IP 192.168.43.147.8880 > 192.168.43.124.7773: UDP, length 120
00:50:49.390433 IP 192.168.43.146.8880 > 192.168.43.147.7772: UDP, length 120
00:50:49.427954 IP 192.168.43.147.8880 > 192.168.43.124.7773: UDP, length 120
00:50:49.454343 IP 192.168.43.146.8880 > 192.168.43.147.7772: UDP, length 120
00:50:49.477954 IP 192.168.43.147.8880 > 192.168.43.124.7773: UDP, length 120
00:50:49.492640 IP 192.168.43.146.8880 > 192.168.43.147.7772: UDP, length 120
00:50:49.527998 IP 192.168.43.147.8880 > 192.168.43.124.7773: UDP, length 120
00:50:49.577962 IP 192.168.43.147.8880 > 192.168.43.124.7773: UDP, length 120
00:50:49.581216 IP 192.168.43.146.8880 > 192.168.43.147.7772: UDP, length 120
00:50:49.595272 IP 192.168.43.146.8880 > 192.168.43.147.7772: UDP, length 120
00:50:49.627958 IP 192.168.43.147.8880 > 192.168.43.124.7773: UDP, length 120
00:50:49.656372 IP 192.168.43.146.8880 > 192.168.43.147.7772: UDP, length 120
00:50:49.677956 IP 192.168.43.147.8880 > 192.168.43.124.7773: UDP, length 120
00:50:49.702117 IP 192.168.43.146.8880 > 192.168.43.147.7772: UDP, length 120
00:50:49.727955 IP 192.168.43.147.8880 > 192.168.43.124.7773: UDP, length 120
00:50:49.777954 IP 192.168.43.147.8880 > 192.168.43.124.7773: UDP, length 120
00:50:49.781812 IP 192.168.43.146.8880 > 192.168.43.147.7772: UDP, length 120
00:50:49.802702 IP 192.168.43.146.8880 > 192.168.43.147.7772: UDP, length 120
00:50:49.827956 IP 192.168.43.147.8880 > 192.168.43.124.7773: UDP, length 120
00:50:49.863950 IP 192.168.43.146.8880 > 192.168.43.147.7772: UDP, length 120
00:50:49.877953 IP 192.168.43.147.8880 > 192.168.43.124.7773: UDP, length 120
00:50:49.910066 IP 192.168.43.146.8880 > 192.168.43.147.7772: UDP, length 120
00:50:49.927956 IP 192.168.43.147.8880 > 192.168.43.124.7773: UDP, length 120
00:50:49.963548 IP 192.168.43.146.8880 > 192.168.43.147.7772: UDP, length 120
00:50:49.977964 IP 192.168.43.147.8880 > 192.168.43.124.7773: UDP, length 120
00:50:50.007177 IP 192.168.43.146.8880 > 192.168.43.147.7772: UDP, length 120
00:50:50.027957 IP 192.168.43.147.8880 > 192.168.43.124.7773: UDP, length 120
00:50:50.040495 IP 192.168.43.146.8880 > 192.168.43.147.7772: UDP, length 120
00:50:50.077960 IP 192.168.43.147.8880 > 192.168.43.124.7773: UDP, length 120
00:50:50.088531 IP 192.168.43.146.8880 > 192.168.43.147.7772: UDP, length 120
00:50:50.127959 IP 192.168.43.147.8880 > 192.168.43.124.7773: UDP, length 120
00:50:50.171308 IP 192.168.43.146.8880 > 192.168.43.147.7772: UDP, length 120
00:50:50.177963 IP 192.168.43.147.8880 > 192.168.43.124.7773: UDP, length 120
00:50:50.212438 IP 192.168.43.146.8880 > 192.168.43.147.7772: UDP, length 120
00:50:50.227954 IP 192.168.43.147.8880 > 192.168.43.124.7773: UDP, length 120
00:50:50.242383 IP 192.168.43.146.8880 > 192.168.43.147.7772: UDP, length 120
00:50:50.277965 IP 192.168.43.147.8880 > 192.168.43.124.7773: UDP, length 120
00:50:50.316526 IP 192.168.43.146.8880 > 192.168.43.147.7772: UDP, length 120
00:50:50.327965 IP 192.168.43.147.8880 > 192.168.43.124.7773: UDP, length 120
00:50:50.371785 IP 192.168.43.146.8880 > 192.168.43.147.7772: UDP, length 120
00:50:50.377951 IP 192.168.43.147.8880 > 192.168.43.124.7773: UDP, length 120
00:50:50.401205 IP 192.168.43.146.8880 > 192.168.43.147.7772: UDP, length 120
00:50:50.427954 IP 192.168.43.147.8880 > 192.168.43.124.7773: UDP, length 120
00:50:50.477957 IP 192.168.43.147.8880 > 192.168.43.124.7773: UDP, length 120
00:50:50.505653 IP 192.168.43.146.8880 > 192.168.43.147.7772: UDP, length 120
00:50:50.515213 IP 192.168.43.146.8880 > 192.168.43.147.7772: UDP, length 120
00:50:50.527955 IP 192.168.43.147.8880 > 192.168.43.124.7773: UDP, length 120
00:50:50.552453 IP 192.168.43.146.8880 > 192.168.43.147.7772: UDP, length 120
00:50:50.577954 IP 192.168.43.147.8880 > 192.168.43.124.7773: UDP, length 120
00:50:50.622295 IP 192.168.43.146.8880 > 192.168.43.147.7772: UDP, length 120
00:50:50.627954 IP 192.168.43.147.8880 > 192.168.43.124.7773: UDP, length 120
00:50:50.677955 IP 192.168.43.147.8880 > 192.168.43.124.7773: UDP, length 120
00:50:50.724340 IP 192.168.43.146.8880 > 192.168.43.147.7772: UDP, length 120
00:50:50.724484 IP 192.168.43.146.8880 > 192.168.43.147.7772: UDP, length 120
00:50:50.727953 IP 192.168.43.147.8880 > 192.168.43.124.7773: UDP, length 120
00:50:50.777955 IP 192.168.43.147.8880 > 192.168.43.124.7773: UDP, length 120
00:50:50.782513 IP 192.168.43.146.8880 > 192.168.43.147.7772: UDP, length 120
00:50:50.825323 IP 192.168.43.146.8880 > 192.168.43.147.7772: UDP, length 120
00:50:50.827954 IP 192.168.43.147.8880 > 192.168.43.124.7773: UDP, length 120
00:50:50.862706 IP 192.168.43.146.8880 > 192.168.43.147.7772: UDP, length 120
00:50:50.877954 IP 192.168.43.147.8880 > 192.168.43.124.7773: UDP, length 120
00:50:50.913345 IP 192.168.43.146.8880 > 192.168.43.147.7772: UDP, length 120
00:50:50.927955 IP 192.168.43.147.8880 > 192.168.43.124.7773: UDP, length 120
00:50:50.945788 IP 192.168.43.146.8880 > 192.168.43.147.7772: UDP, length 120
00:50:50.977956 IP 192.168.43.147.8880 > 192.168.43.124.7773: UDP, length 120
00:50:50.994949 IP 192.168.43.146.8880 > 192.168.43.147.7772: UDP, length 120
00:50:51.028570 IP 192.168.43.147.8880 > 192.168.43.124.7773: UDP, length 120
00:50:51.034672 IP 192.168.43.146.8880 > 192.168.43.147.7772: UDP, length 120
00:50:51.078118 IP 192.168.43.147.8880 > 192.168.43.124.7773: UDP, length 120
00:50:51.127963 IP 192.168.43.147.8880 > 192.168.43.124.7773: UDP, length 120
00:50:51.130938 IP 192.168.43.146.8880 > 192.168.43.147.7772: UDP, length 120
00:50:51.134277 IP 192.168.43.146.8880 > 192.168.43.147.7772: UDP, length 120
00:50:51.177963 IP 192.168.43.147.8880 > 192.168.43.124.7773: UDP, length 120
00:50:51.192117 IP 192.168.43.146.8880 > 192.168.43.147.7772: UDP, length 120
00:50:51.227962 IP 192.168.43.147.8880 > 192.168.43.124.7773: UDP, length 120
00:50:51.240238 IP 192.168.43.146.8880 > 192.168.43.147.7772: UDP, length 120
00:50:51.277957 IP 192.168.43.147.8880 > 192.168.43.124.7773: UDP, length 120
00:50:51.292047 IP 192.168.43.146.8880 > 192.168.43.147.7772: UDP, length 120
00:50:51.327957 IP 192.168.43.147.8880 > 192.168.43.124.7773: UDP, length 120
00:50:51.334628 IP 192.168.43.146.8880 > 192.168.43.147.7772: UDP, length 120
00:50:51.377956 IP 192.168.43.147.8880 > 192.168.43.124.7773: UDP, length 120
00:50:51.383971 IP 192.168.43.146.8880 > 192.168.43.147.7772: UDP, length 120
00:50:51.427956 IP 192.168.43.147.8880 > 192.168.43.124.7773: UDP, length 120
00:50:51.477960 IP 192.168.43.147.8880 > 192.168.43.124.7773: UDP, length 120
00:50:51.527955 IP 192.168.43.147.8880 > 192.168.43.124.7773: UDP, length 120
00:50:51.541153 IP 192.168.43.146.8880 > 192.168.43.147.7772: UDP, length 120
00:50:51.541306 IP 192.168.43.146.8880 > 192.168.43.147.7772: UDP, length 120
00:50:51.541451 IP 192.168.43.146.8880 > 192.168.43.147.7772: UDP, length 120
00:50:51.577965 IP 192.168.43.147.8880 > 192.168.43.124.7773: UDP, length 120
00:50:51.590686 IP 192.168.43.146.8880 > 192.168.43.147.7772: UDP, length 120
00:50:51.627961 IP 192.168.43.147.8880 > 192.168.43.124.7773: UDP, length 120
00:50:51.642484 IP 192.168.43.146.8880 > 192.168.43.147.7772: UDP, length 120
00:50:51.677967 IP 192.168.43.147.8880 > 192.168.43.124.7773: UDP, length 120
00:50:51.691255 IP 192.168.43.146.8880 > 192.168.43.147.7772: UDP, length 120
00:50:51.727959 IP 192.168.43.147.8880 > 192.168.43.124.7773: UDP, length 120
00:50:51.741515 IP 192.168.43.146.8880 > 192.168.43.147.7772: UDP, length 120
00:50:51.777957 IP 192.168.43.147.8880 > 192.168.43.124.7773: UDP, length 120
00:50:51.788455 IP 192.168.43.146.8880 > 192.168.43.147.7772: UDP, length 120
00:50:51.827959 IP 192.168.43.147.8880 > 192.168.43.124.7773: UDP, length 120
00:50:51.845941 IP 192.168.43.146.8880 > 192.168.43.147.7772: UDP, length 120
00:50:51.877967 IP 192.168.43.147.8880 > 192.168.43.124.7773: UDP, length 120
00:50:51.890878 IP 192.168.43.146.8880 > 192.168.43.147.7772: UDP, length 120
00:50:51.928050 IP 192.168.43.147.8880 > 192.168.43.124.7773: UDP, length 120
00:50:51.943054 IP 192.168.43.146.8880 > 192.168.43.147.7772: UDP, length 120
00:50:51.978053 IP 192.168.43.147.8880 > 192.168.43.124.7773: UDP, length 120
00:50:51.997324 IP 192.168.43.146.8880 > 192.168.43.147.7772: UDP, length 120
00:50:52.028055 IP 192.168.43.147.8880 > 192.168.43.124.7773: UDP, length 120
00:50:52.037544 IP 192.168.43.146.8880 > 192.168.43.147.7772: UDP, length 120
00:50:52.078292 IP 192.168.43.147.8880 > 192.168.43.124.7773: UDP, length 120
00:50:52.084463 IP 192.168.43.146.8880 > 192.168.43.147.7772: UDP, length 120
00:50:52.128085 IP 192.168.43.147.8880 > 192.168.43.124.7773: UDP, length 120
00:50:52.134261 IP 192.168.43.146.8880 > 192.168.43.147.7772: UDP, length 120
00:50:52.178079 IP 192.168.43.147.8880 > 192.168.43.124.7773: UDP, length 120
00:50:52.186172 IP 192.168.43.146.8880 > 192.168.43.147.7772: UDP, length 120
00:50:52.228015 IP 192.168.43.147.8880 > 192.168.43.124.7773: UDP, length 120
00:50:52.232606 IP 192.168.43.146.8880 > 192.168.43.147.7772: UDP, length 120
00:50:52.278030 IP 192.168.43.147.8880 > 192.168.43.124.7773: UDP, length 120
00:50:52.283182 IP 192.168.43.146.8880 > 192.168.43.147.7772: UDP, length 120
00:50:52.328019 IP 192.168.43.147.8880 > 192.168.43.124.7773: UDP, length 120
00:50:52.336109 IP 192.168.43.146.8880 > 192.168.43.147.7772: UDP, length 120
00:50:52.378033 IP 192.168.43.147.8880 > 192.168.43.124.7773: UDP, length 120
00:50:52.388411 IP 192.168.43.146.8880 > 192.168.43.147.7772: UDP, length 120
00:50:52.428006 IP 192.168.43.147.8880 > 192.168.43.124.7773: UDP, length 120
00:50:52.435706 IP 192.168.43.146.8880 > 192.168.43.147.7772: UDP, length 120
00:50:52.477971 IP 192.168.43.147.8880 > 192.168.43.124.7773: UDP, length 120
00:50:52.505451 IP 192.168.43.146.8880 > 192.168.43.147.7772: UDP, length 120
00:50:52.529447 IP 192.168.43.147.8880 > 192.168.43.124.7773: UDP, length 120
00:50:52.538636 IP 192.168.43.146.8880 > 192.168.43.147.7772: UDP, length 120
00:50:52.577976 IP 192.168.43.147.8880 > 192.168.43.124.7773: UDP, length 120
00:50:52.588984 IP 192.168.43.146.8880 > 192.168.43.147.7772: UDP, length 120
00:50:52.627957 IP 192.168.43.147.8880 > 192.168.43.124.7773: UDP, length 120
00:50:52.654663 IP 192.168.43.146.8880 > 192.168.43.147.7772: UDP, length 120
00:50:52.677954 IP 192.168.43.147.8880 > 192.168.43.124.7773: UDP, length 120
00:50:52.688111 IP 192.168.43.146.8880 > 192.168.43.147.7772: UDP, length 120
00:50:52.727956 IP 192.168.43.147.8880 > 192.168.43.124.7773: UDP, length 120
00:50:52.766928 IP 192.168.43.146.8880 > 192.168.43.147.7772: UDP, length 120
00:50:52.777958 IP 192.168.43.147.8880 > 192.168.43.124.7773: UDP, length 120
00:50:52.827955 IP 192.168.43.147.8880 > 192.168.43.124.7773: UDP, length 120
00:50:52.871791 IP 192.168.43.146.8880 > 192.168.43.147.7772: UDP, length 120
00:50:52.871931 IP 192.168.43.146.8880 > 192.168.43.147.7772: UDP, length 120
00:50:52.877960 IP 192.168.43.147.8880 > 192.168.43.124.7773: UDP, length 120
00:50:52.894354 IP 192.168.43.146.8880 > 192.168.43.147.7772: UDP, length 120
00:50:52.927958 IP 192.168.43.147.8880 > 192.168.43.124.7773: UDP, length 120
00:50:52.974998 IP 192.168.43.146.8880 > 192.168.43.147.7772: UDP, length 120
00:50:52.977957 IP 192.168.43.147.8880 > 192.168.43.124.7773: UDP, length 120
00:50:53.013142 IP 192.168.43.146.8880 > 192.168.43.147.7772: UDP, length 120
00:50:53.027954 IP 192.168.43.147.8880 > 192.168.43.124.7773: UDP, length 120
00:50:53.041765 IP 192.168.43.146.8880 > 192.168.43.147.7772: UDP, length 120
00:50:53.077958 IP 192.168.43.147.8880 > 192.168.43.124.7773: UDP, length 120
00:50:53.096052 IP 192.168.43.146.8880 > 192.168.43.147.7772: UDP, length 120
00:50:53.127964 IP 192.168.43.147.8880 > 192.168.43.124.7773: UDP, length 120
00:50:53.163927 IP 192.168.43.146.8880 > 192.168.43.147.7772: UDP, length 120
00:50:53.177961 IP 192.168.43.147.8880 > 192.168.43.124.7773: UDP, length 120
00:50:53.184498 IP 192.168.43.146.8880 > 192.168.43.147.7772: UDP, length 120
00:50:53.227956 IP 192.168.43.147.8880 > 192.168.43.124.7773: UDP, length 120
00:50:53.268457 IP 192.168.43.146.8880 > 192.168.43.147.7772: UDP, length 120
00:50:53.277954 IP 192.168.43.147.8880 > 192.168.43.124.7773: UDP, length 120
00:50:53.285261 IP 192.168.43.146.8880 > 192.168.43.147.7772: UDP, length 120
00:50:53.327957 IP 192.168.43.147.8880 > 192.168.43.124.7773: UDP, length 120
00:50:53.344152 IP 192.168.43.146.8880 > 192.168.43.147.7772: UDP, length 120
00:50:53.377954 IP 192.168.43.147.8880 > 192.168.43.124.7773: UDP, length 120
00:50:53.386023 IP 192.168.43.146.8880 > 192.168.43.147.7772: UDP, length 120
00:50:53.427956 IP 192.168.43.147.8880 > 192.168.43.124.7773: UDP, length 120
00:50:53.477959 IP 192.168.43.147.8880 > 192.168.43.124.7773: UDP, length 120
00:50:53.481220 IP 192.168.43.146.8880 > 192.168.43.147.7772: UDP, length 120
00:50:53.484481 IP 192.168.43.146.8880 > 192.168.43.147.7772: UDP, length 120
00:50:53.527956 IP 192.168.43.147.8880 > 192.168.43.124.7773: UDP, length 120
00:50:53.534605 IP 192.168.43.146.8880 > 192.168.43.147.7772: UDP, length 120
00:50:53.577955 IP 192.168.43.147.8880 > 192.168.43.124.7773: UDP, length 120
00:50:53.588424 IP 192.168.43.146.8880 > 192.168.43.147.7772: UDP, length 120
00:50:53.627956 IP 192.168.43.147.8880 > 192.168.43.124.7773: UDP, length 120
00:50:53.638250 IP 192.168.43.146.8880 > 192.168.43.147.7772: UDP, length 120
00:50:53.677958 IP 192.168.43.147.8880 > 192.168.43.124.7773: UDP, length 120
00:50:53.688750 IP 192.168.43.146.8880 > 192.168.43.147.7772: UDP, length 120
00:50:53.727956 IP 192.168.43.147.8880 > 192.168.43.124.7773: UDP, length 120
00:50:53.744778 IP 192.168.43.146.8880 > 192.168.43.147.7772: UDP, length 120
00:50:53.777955 IP 192.168.43.147.8880 > 192.168.43.124.7773: UDP, length 120
00:50:53.801549 IP 192.168.43.146.8880 > 192.168.43.147.7772: UDP, length 120
00:50:53.827954 IP 192.168.43.147.8880 > 192.168.43.124.7773: UDP, length 120
00:50:53.857665 IP 192.168.43.146.8880 > 192.168.43.147.7772: UDP, length 120
00:50:53.877954 IP 192.168.43.147.8880 > 192.168.43.124.7773: UDP, length 120
00:50:53.895845 IP 192.168.43.146.8880 > 192.168.43.147.7772: UDP, length 120
00:50:53.927956 IP 192.168.43.147.8880 > 192.168.43.124.7773: UDP, length 120
00:50:53.977955 IP 192.168.43.147.8880 > 192.168.43.124.7773: UDP, length 120
00:50:53.981206 IP 192.168.43.146.8880 > 192.168.43.147.7772: UDP, length 120
00:50:54.001773 IP 192.168.43.146.8880 > 192.168.43.147.7772: UDP, length 120
00:50:54.027958 IP 192.168.43.147.8880 > 192.168.43.124.7773: UDP, length 120
00:50:54.070639 IP 192.168.43.146.8880 > 192.168.43.147.7772: UDP, length 120
00:50:54.077994 IP 192.168.43.147.8880 > 192.168.43.124.7773: UDP, length 120
00:50:54.103171 IP 192.168.43.146.8880 > 192.168.43.147.7772: UDP, length 120
00:50:54.127960 IP 192.168.43.147.8880 > 192.168.43.124.7773: UDP, length 120
00:50:54.158106 IP 192.168.43.146.8880 > 192.168.43.147.7772: UDP, length 120
00:50:54.177959 IP 192.168.43.147.8880 > 192.168.43.124.7773: UDP, length 120
00:50:54.188702 IP 192.168.43.146.8880 > 192.168.43.147.7772: UDP, length 120
00:50:54.227959 IP 192.168.43.147.8880 > 192.168.43.124.7773: UDP, length 120
00:50:54.255564 IP 192.168.43.146.8880 > 192.168.43.147.7772: UDP, length 120
00:50:54.277957 IP 192.168.43.147.8880 > 192.168.43.124.7773: UDP, length 120
00:50:54.285596 IP 192.168.43.146.8880 > 192.168.43.147.7772: UDP, length 120
00:50:54.327956 IP 192.168.43.147.8880 > 192.168.43.124.7773: UDP, length 120
00:50:54.347090 IP 192.168.43.146.8880 > 192.168.43.147.7772: UDP, length 120
00:50:54.377955 IP 192.168.43.147.8880 > 192.168.43.124.7773: UDP, length 120
00:50:54.388430 IP 192.168.43.146.8880 > 192.168.43.147.7772: UDP, length 120
00:50:54.427955 IP 192.168.43.147.8880 > 192.168.43.124.7773: UDP, length 120
00:50:54.443703 IP 192.168.43.146.8880 > 192.168.43.147.7772: UDP, length 120
00:50:54.477955 IP 192.168.43.147.8880 > 192.168.43.124.7773: UDP, length 120
00:50:54.513649 IP 192.168.43.146.8880 > 192.168.43.147.7772: UDP, length 120
00:50:54.527954 IP 192.168.43.147.8880 > 192.168.43.124.7773: UDP, length 120
00:50:54.541779 IP 192.168.43.146.8880 > 192.168.43.147.7772: UDP, length 120
00:50:54.577954 IP 192.168.43.147.8880 > 192.168.43.124.7773: UDP, length 120
00:50:54.597151 IP 192.168.43.146.8880 > 192.168.43.147.7772: UDP, length 120
00:50:54.627958 IP 192.168.43.147.8880 > 192.168.43.124.7773: UDP, length 120
00:50:54.638354 IP 192.168.43.146.8880 > 192.168.43.147.7772: UDP, length 120
00:50:54.677955 IP 192.168.43.147.8880 > 192.168.43.124.7773: UDP, length 120
00:50:54.702493 IP 192.168.43.146.8880 > 192.168.43.147.7772: UDP, length 120
00:50:54.727954 IP 192.168.43.147.8880 > 192.168.43.124.7773: UDP, length 120
00:50:54.740185 IP 192.168.43.146.8880 > 192.168.43.147.7772: UDP, length 120
00:50:54.777955 IP 192.168.43.147.8880 > 192.168.43.124.7773: UDP, length 120
00:50:54.811977 IP 192.168.43.146.8880 > 192.168.43.147.7772: UDP, length 120
00:50:54.827955 IP 192.168.43.147.8880 > 192.168.43.124.7773: UDP, length 120
00:50:54.834038 IP 192.168.43.146.8880 > 192.168.43.147.7772: UDP, length 120
00:50:54.877955 IP 192.168.43.147.8880 > 192.168.43.124.7773: UDP, length 120
00:50:54.904090 IP 192.168.43.146.8880 > 192.168.43.147.7772: UDP, length 120
00:50:54.927956 IP 192.168.43.147.8880 > 192.168.43.124.7773: UDP, length 120
00:50:54.934651 IP 192.168.43.146.8880 > 192.168.43.147.7772: UDP, length 120
00:50:54.977955 IP 192.168.43.147.8880 > 192.168.43.124.7773: UDP, length 120
00:50:55.023149 IP 192.168.43.146.8880 > 192.168.43.147.7772: UDP, length 120
00:50:55.027955 IP 192.168.43.147.8880 > 192.168.43.124.7773: UDP, length 120
00:50:55.052707 IP 192.168.43.146.8880 > 192.168.43.147.7772: UDP, length 120
00:50:55.077958 IP 192.168.43.147.8880 > 192.168.43.124.7773: UDP, length 120
00:50:55.122254 IP 192.168.43.146.8880 > 192.168.43.147.7772: UDP, length 120
00:50:55.127953 IP 192.168.43.147.8880 > 192.168.43.124.7773: UDP, length 120
00:50:55.138321 IP 192.168.43.146.8880 > 192.168.43.147.7772: UDP, length 120
00:50:55.177955 IP 192.168.43.147.8880 > 192.168.43.124.7773: UDP, length 120
00:50:55.191385 IP 192.168.43.146.8880 > 192.168.43.147.7772: UDP, length 120
00:50:55.227960 IP 192.168.43.147.8880 > 192.168.43.124.7773: UDP, length 120
00:50:55.237079 IP 192.168.43.146.8880 > 192.168.43.147.7772: UDP, length 120
00:50:55.277958 IP 192.168.43.147.8880 > 192.168.43.124.7773: UDP, length 120
00:50:55.294126 IP 192.168.43.146.8880 > 192.168.43.147.7772: UDP, length 120
00:50:55.327957 IP 192.168.43.147.8880 > 192.168.43.124.7773: UDP, length 120
00:50:55.334591 IP 192.168.43.146.8880 > 192.168.43.147.7772: UDP, length 120
00:50:55.377956 IP 192.168.43.147.8880 > 192.168.43.124.7773: UDP, length 120
00:50:55.387703 IP 192.168.43.146.8880 > 192.168.43.147.7772: UDP, length 120
00:50:55.427955 IP 192.168.43.147.8880 > 192.168.43.124.7773: UDP, length 120
00:50:55.436395 IP 192.168.43.146.8880 > 192.168.43.147.7772: UDP, length 120
00:50:55.477955 IP 192.168.43.147.8880 > 192.168.43.124.7773: UDP, length 120
00:50:55.490584 IP 192.168.43.146.8880 > 192.168.43.147.7772: UDP, length 120
00:50:55.527955 IP 192.168.43.147.8880 > 192.168.43.124.7773: UDP, length 120
00:50:55.534563 IP 192.168.43.146.8880 > 192.168.43.147.7772: UDP, length 120
00:50:55.577993 IP 192.168.43.147.8880 > 192.168.43.124.7773: UDP, length 120
00:50:55.584673 IP 192.168.43.146.8880 > 192.168.43.147.7772: UDP, length 120
00:50:55.627963 IP 192.168.43.147.8880 > 192.168.43.124.7773: UDP, length 120
00:50:55.634091 IP 192.168.43.146.8880 > 192.168.43.147.7772: UDP, length 120
00:50:55.677956 IP 192.168.43.147.8880 > 192.168.43.124.7773: UDP, length 120
00:50:55.683879 IP 192.168.43.146.8880 > 192.168.43.147.7772: UDP, length 120
00:50:55.727955 IP 192.168.43.147.8880 > 192.168.43.124.7773: UDP, length 120
00:50:55.733833 IP 192.168.43.146.8880 > 192.168.43.147.7772: UDP, length 120
00:50:55.777955 IP 192.168.43.147.8880 > 192.168.43.124.7773: UDP, length 120
00:50:55.783945 IP 192.168.43.146.8880 > 192.168.43.147.7772: UDP, length 120
00:50:55.827955 IP 192.168.43.147.8880 > 192.168.43.124.7773: UDP, length 120
00:50:55.833906 IP 192.168.43.146.8880 > 192.168.43.147.7772: UDP, length 120
00:50:55.877955 IP 192.168.43.147.8880 > 192.168.43.124.7773: UDP, length 120
00:50:55.887003 IP 192.168.43.146.8880 > 192.168.43.147.7772: UDP, length 120
00:50:55.927956 IP 192.168.43.147.8880 > 192.168.43.124.7773: UDP, length 120
00:50:55.935440 IP 192.168.43.146.8880 > 192.168.43.147.7772: UDP, length 120
00:50:55.977956 IP 192.168.43.147.8880 > 192.168.43.124.7773: UDP, length 120
00:50:55.985602 IP 192.168.43.146.8880 > 192.168.43.147.7772: UDP, length 120
00:50:56.027955 IP 192.168.43.147.8880 > 192.168.43.124.7773: UDP, length 120
00:50:56.033877 IP 192.168.43.146.8880 > 192.168.43.147.7772: UDP, length 120
00:50:56.077959 IP 192.168.43.147.8880 > 192.168.43.124.7773: UDP, length 120
00:50:56.087412 IP 192.168.43.146.8880 > 192.168.43.147.7772: UDP, length 120
00:50:56.127956 IP 192.168.43.147.8880 > 192.168.43.124.7773: UDP, length 120
00:50:56.136795 IP 192.168.43.146.8880 > 192.168.43.147.7772: UDP, length 120
00:50:56.177956 IP 192.168.43.147.8880 > 192.168.43.124.7773: UDP, length 120
00:50:56.191216 IP 192.168.43.146.8880 > 192.168.43.147.7772: UDP, length 120
00:50:56.227954 IP 192.168.43.147.8880 > 192.168.43.124.7773: UDP, length 120
00:50:56.238701 IP 192.168.43.146.8880 > 192.168.43.147.7772: UDP, length 120
00:50:56.277959 IP 192.168.43.147.8880 > 192.168.43.124.7773: UDP, length 120
00:50:56.281514 IP 192.168.43.146.8880 > 192.168.43.147.7772: UDP, length 120
00:50:56.327956 IP 192.168.43.147.8880 > 192.168.43.124.7773: UDP, length 120
00:50:56.361161 IP 192.168.43.146.8880 > 192.168.43.147.7772: UDP, length 120
00:50:56.377957 IP 192.168.43.147.8880 > 192.168.43.124.7773: UDP, length 120
00:50:56.384489 IP 192.168.43.146.8880 > 192.168.43.147.7772: UDP, length 120
00:50:56.427958 IP 192.168.43.147.8880 > 192.168.43.124.7773: UDP, length 120
00:50:56.443610 IP 192.168.43.146.8880 > 192.168.43.147.7772: UDP, length 120
00:50:56.477953 IP 192.168.43.147.8880 > 192.168.43.124.7773: UDP, length 120
00:50:56.489050 IP 192.168.43.146.8880 > 192.168.43.147.7772: UDP, length 120
00:50:56.527953 IP 192.168.43.147.8880 > 192.168.43.124.7773: UDP, length 120
00:50:56.534611 IP 192.168.43.146.8880 > 192.168.43.147.7772: UDP, length 120
00:50:56.577953 IP 192.168.43.147.8880 > 192.168.43.124.7773: UDP, length 120
00:50:56.583921 IP 192.168.43.146.8880 > 192.168.43.147.7772: UDP, length 120
00:50:56.627955 IP 192.168.43.147.8880 > 192.168.43.124.7773: UDP, length 120
00:50:56.635697 IP 192.168.43.146.8880 > 192.168.43.147.7772: UDP, length 120
00:50:56.677955 IP 192.168.43.147.8880 > 192.168.43.124.7773: UDP, length 120
00:50:56.685989 IP 192.168.43.146.8880 > 192.168.43.147.7772: UDP, length 120
00:50:56.727955 IP 192.168.43.147.8880 > 192.168.43.124.7773: UDP, length 120
00:50:56.733878 IP 192.168.43.146.8880 > 192.168.43.147.7772: UDP, length 120
00:50:56.777954 IP 192.168.43.147.8880 > 192.168.43.124.7773: UDP, length 120
00:50:56.788071 IP 192.168.43.146.8880 > 192.168.43.147.7772: UDP, length 120
00:50:56.827955 IP 192.168.43.147.8880 > 192.168.43.124.7773: UDP, length 120
00:50:56.840957 IP 192.168.43.146.8880 > 192.168.43.147.7772: UDP, length 120
00:50:56.877954 IP 192.168.43.147.8880 > 192.168.43.124.7773: UDP, length 120
00:50:56.889842 IP 192.168.43.146.8880 > 192.168.43.147.7772: UDP, length 120
00:50:56.927988 IP 192.168.43.147.8880 > 192.168.43.124.7773: UDP, length 120
00:50:56.941047 IP 192.168.43.146.8880 > 192.168.43.147.7772: UDP, length 120
00:50:56.977988 IP 192.168.43.147.8880 > 192.168.43.124.7773: UDP, length 120
00:50:56.986610 IP 192.168.43.146.8880 > 192.168.43.147.7772: UDP, length 120
00:50:57.027987 IP 192.168.43.147.8880 > 192.168.43.124.7773: UDP, length 120
00:50:57.035372 IP 192.168.43.146.8880 > 192.168.43.147.7772: UDP, length 120
00:50:57.078041 IP 192.168.43.147.8880 > 192.168.43.124.7773: UDP, length 120
00:50:57.084002 IP 192.168.43.146.8880 > 192.168.43.147.7772: UDP, length 120
00:50:57.128010 IP 192.168.43.147.8880 > 192.168.43.124.7773: UDP, length 120
00:50:57.136614 IP 192.168.43.146.8880 > 192.168.43.147.7772: UDP, length 120
00:50:57.177983 IP 192.168.43.147.8880 > 192.168.43.124.7773: UDP, length 120
00:50:57.184845 IP 192.168.43.146.8880 > 192.168.43.147.7772: UDP, length 120
00:50:57.227987 IP 192.168.43.147.8880 > 192.168.43.124.7773: UDP, length 120
00:50:57.237847 IP 192.168.43.146.8880 > 192.168.43.147.7772: UDP, length 120
00:50:57.277985 IP 192.168.43.147.8880 > 192.168.43.124.7773: UDP, length 120
00:50:57.288958 IP 192.168.43.146.8880 > 192.168.43.147.7772: UDP, length 120
00:50:57.327991 IP 192.168.43.147.8880 > 192.168.43.124.7773: UDP, length 120
00:50:57.337256 IP 192.168.43.146.8880 > 192.168.43.147.7772: UDP, length 120
00:50:57.377978 IP 192.168.43.147.8880 > 192.168.43.124.7773: UDP, length 120
00:50:57.384022 IP 192.168.43.146.8880 > 192.168.43.147.7772: UDP, length 120
00:50:57.428043 IP 192.168.43.147.8880 > 192.168.43.124.7773: UDP, length 120
00:50:57.435790 IP 192.168.43.146.8880 > 192.168.43.147.7772: UDP, length 120
00:50:57.478056 IP 192.168.43.147.8880 > 192.168.43.124.7773: UDP, length 120
00:50:57.484238 IP 192.168.43.146.8880 > 192.168.43.147.7772: UDP, length 120
00:50:57.528034 IP 192.168.43.147.8880 > 192.168.43.124.7773: UDP, length 120
00:50:57.534174 IP 192.168.43.146.8880 > 192.168.43.147.7772: UDP, length 120
00:50:57.578037 IP 192.168.43.147.8880 > 192.168.43.124.7773: UDP, length 120
00:50:57.587039 IP 192.168.43.146.8880 > 192.168.43.147.7772: UDP, length 120
00:50:57.628046 IP 192.168.43.147.8880 > 192.168.43.124.7773: UDP, length 120
00:50:57.640792 IP 192.168.43.146.8880 > 192.168.43.147.7772: UDP, length 120
00:50:57.678035 IP 192.168.43.147.8880 > 192.168.43.124.7773: UDP, length 120
00:50:57.686375 IP 192.168.43.146.8880 > 192.168.43.147.7772: UDP, length 120
00:50:57.728064 IP 192.168.43.147.8880 > 192.168.43.124.7773: UDP, length 120
00:50:57.736157 IP 192.168.43.146.8880 > 192.168.43.147.7772: UDP, length 120
00:50:57.778034 IP 192.168.43.147.8880 > 192.168.43.124.7773: UDP, length 120
00:50:57.784106 IP 192.168.43.146.8880 > 192.168.43.147.7772: UDP, length 120
00:50:57.828030 IP 192.168.43.147.8880 > 192.168.43.124.7773: UDP, length 120
00:50:57.837978 IP 192.168.43.146.8880 > 192.168.43.147.7772: UDP, length 120
00:50:57.878007 IP 192.168.43.147.8880 > 192.168.43.124.7773: UDP, length 120
00:50:57.885607 IP 192.168.43.146.8880 > 192.168.43.147.7772: UDP, length 120
00:50:57.927970 IP 192.168.43.147.8880 > 192.168.43.124.7773: UDP, length 120
00:50:57.934629 IP 192.168.43.146.8880 > 192.168.43.147.7772: UDP, length 120
00:50:57.977959 IP 192.168.43.147.8880 > 192.168.43.124.7773: UDP, length 120
00:50:57.983837 IP 192.168.43.146.8880 > 192.168.43.147.7772: UDP, length 120
00:50:58.027957 IP 192.168.43.147.8880 > 192.168.43.124.7773: UDP, length 120
00:50:58.034262 IP 192.168.43.146.8880 > 192.168.43.147.7772: UDP, length 120
00:50:58.077959 IP 192.168.43.147.8880 > 192.168.43.124.7773: UDP, length 120
00:50:58.084740 IP 192.168.43.146.8880 > 192.168.43.147.7772: UDP, length 120
00:50:58.127957 IP 192.168.43.147.8880 > 192.168.43.124.7773: UDP, length 120
00:50:58.136529 IP 192.168.43.146.8880 > 192.168.43.147.7772: UDP, length 120
00:50:58.177959 IP 192.168.43.147.8880 > 192.168.43.124.7773: UDP, length 120
00:50:58.186789 IP 192.168.43.146.8880 > 192.168.43.147.7772: UDP, length 120
00:50:58.227955 IP 192.168.43.147.8880 > 192.168.43.124.7773: UDP, length 120
00:50:58.240244 IP 192.168.43.146.8880 > 192.168.43.147.7772: UDP, length 120
00:50:58.277957 IP 192.168.43.147.8880 > 192.168.43.124.7773: UDP, length 120
00:50:58.288598 IP 192.168.43.146.8880 > 192.168.43.147.7772: UDP, length 120
00:50:58.327955 IP 192.168.43.147.8880 > 192.168.43.124.7773: UDP, length 120
00:50:58.338457 IP 192.168.43.146.8880 > 192.168.43.147.7772: UDP, length 120
00:50:58.377955 IP 192.168.43.147.8880 > 192.168.43.124.7773: UDP, length 120
00:50:58.385464 IP 192.168.43.146.8880 > 192.168.43.147.7772: UDP, length 120
00:50:58.427962 IP 192.168.43.147.8880 > 192.168.43.124.7773: UDP, length 120
00:50:58.441144 IP 192.168.43.146.8880 > 192.168.43.147.7772: UDP, length 120
00:50:58.477958 IP 192.168.43.147.8880 > 192.168.43.124.7773: UDP, length 120
00:50:58.484008 IP 192.168.43.146.8880 > 192.168.43.147.7772: UDP, length 120
00:50:58.527954 IP 192.168.43.147.8880 > 192.168.43.124.7773: UDP, length 120
00:50:58.533939 IP 192.168.43.146.8880 > 192.168.43.147.7772: UDP, length 120
00:50:58.578002 IP 192.168.43.147.8880 > 192.168.43.124.7773: UDP, length 120
00:50:58.584300 IP 192.168.43.146.8880 > 192.168.43.147.7772: UDP, length 120
00:50:58.627965 IP 192.168.43.147.8880 > 192.168.43.124.7773: UDP, length 120
00:50:58.634148 IP 192.168.43.146.8880 > 192.168.43.147.7772: UDP, length 120
00:50:58.677956 IP 192.168.43.147.8880 > 192.168.43.124.7773: UDP, length 120
00:50:58.683808 IP 192.168.43.146.8880 > 192.168.43.147.7772: UDP, length 120
00:50:58.727956 IP 192.168.43.147.8880 > 192.168.43.124.7773: UDP, length 120
00:50:58.734053 IP 192.168.43.146.8880 > 192.168.43.147.7772: UDP, length 120
00:50:58.777956 IP 192.168.43.147.8880 > 192.168.43.124.7773: UDP, length 120
00:50:58.786115 IP 192.168.43.146.8880 > 192.168.43.147.7772: UDP, length 120
