00:50:45.545447 IP 192.168.43.124.8880 > 192.168.43.146.7771: UDP, length 120
00:50:45.597106 IP 192.168.43.124.8880 > 192.168.43.146.7771: UDP, length 120
00:50:45.646059 IP 192.168.43.124.8880 > 192.168.43.146.7771: UDP, length 120
00:50:45.826456 IP 192.168.43.124.8880 > 192.168.43.146.7771: UDP, length 120
00:50:45.826622 IP 192.168.43.124.8880 > 192.168.43.146.7771: UDP, length 120
00:50:45.826732 IP 192.168.43.124.8880 > 192.168.43.146.7771: UDP, length 120
00:50:45.845528 IP 192.168.43.124.8880 > 192.168.43.146.7771: UDP, length 120
00:50:45.896801 IP 192.168.43.124.8880 > 192.168.43.146.7771: UDP, length 120
00:50:45.945548 IP 192.168.43.124.8880 > 192.168.43.146.7771: UDP, length 120
00:50:45.995770 IP 192.168.43.124.8880 > 192.168.43.146.7771: UDP, length 120
00:50:46.083851 IP 192.168.43.146.8880 > 192.168.43.147.7772: UDP, length 120
00:50:46.133894 IP 192.168.43.146.8880 > 192.168.43.147.7772: UDP, length 120
00:50:46.174720 IP 192.168.43.124.8880 > 192.168.43.146.7771: UDP, length 120
00:50:46.174866 IP 192.168.43.124.8880 > 192.168.43.146.7771: UDP, length 120
00:50:46.174938 IP 192.168.43.124.8880 > 192.168.43.146.7771: UDP, length 120
00:50:46.183858 IP 192.168.43.146.8880 > 192.168.43.147.7772: UDP, length 120
00:50:46.193253 IP 192.168.43.124.8880 > 192.168.43.146.7771: UDP, length 120
00:50:46.233850 IP 192.168.43.146.8880 > 192.168.43.147.7772: UDP, length 120
00:50:46.243639 IP 192.168.43.124.8880 > 192.168.43.146.7771: UDP, length 120
00:50:46.283846 IP 192.168.43.146.8880 > 192.168.43.147.7772: UDP, length 120
00:50:46.294310 IP 192.168.43.124.8880 > 192.168.43.146.7771: UDP, length 120
00:50:46.333850 IP 192.168.43.146.8880 > 192.168.43.147.7772: UDP, length 120
00:50:46.344823 IP 192.168.43.124.8880 > 192.168.43.146.7771: UDP, length 120
00:50:46.383848 IP 192.168.43.146.8880 > 192.168.43.147.7772: UDP, length 120
00:50:46.433901 IP 192.168.43.146.8880 > 192.168.43.147.7772: UDP, length 120
00:50:46.483947 IP 192.168.43.146.8880 > 192.168.43.147.7772: UDP, length 120
00:50:46.521053 IP 192.168.43.124.8880 > 192.168.43.146.7771: UDP, length 120
00:50:46.521198 IP 192.168.43.124.8880 > 192.168.43.146.7771: UDP, length 120
00:50:46.521272 IP 192.168.43.124.8880 > 192.168.43.146.7771: UDP, length 120
00:50:46.533952 IP 192.168.43.146.8880 > 192.168.43.147.7772: UDP, length 120
00:50:46.541821 IP 192.168.43.124.8880 > 192.168.43.146.7771: UDP, length 120
00:50:46.583953 IP 192.168.43.146.8880 > 192.168.43.147.7772: UDP, length 120
00:50:46.592640 IP 192.168.43.124.8880 > 192.168.43.146.7771: UDP, length 120
00:50:46.633923 IP 192.168.43.146.8880 > 192.168.43.147.7772: UDP, length 120
00:50:46.644122 IP 192.168.43.124.8880 > 192.168.43.146.7771: UDP, length 120
00:50:46.683920 IP 192.168.43.146.8880 > 192.168.43.147.7772: UDP, length 120
00:50:46.693293 IP 192.168.43.124.8880 > 192.168.43.146.7771: UDP, length 120
00:50:46.733939 IP 192.168.43.146.8880 > 192.168.43.147.7772: UDP, length 120
00:50:46.783927 IP 192.168.43.146.8880 > 192.168.43.147.7772: UDP, length 120
00:50:46.833911 IP 192.168.43.146.8880 > 192.168.43.147.7772: UDP, length 120
00:50:46.875658 IP 192.168.43.124.8880 > 192.168.43.146.7771: UDP, length 120
00:50:46.875833 IP 192.168.43.124.8880 > 192.168.43.146.7771: UDP, length 120
00:50:46.875923 IP 192.168.43.124.8880 > 192.168.43.146.7771: UDP, length 120
00:50:46.883889 IP 192.168.43.146.8880 > 192.168.43.147.7772: UDP, length 120
00:50:46.894564 IP 192.168.43.124.8880 > 192.168.43.146.7771: UDP, length 120
00:50:46.933852 IP 192.168.43.146.8880 > 192.168.43.147.7772: UDP, length 120
00:50:46.942330 IP 192.168.43.124.8880 > 192.168.43.146.7771: UDP, length 120
00:50:46.983844 IP 192.168.43.146.8880 > 192.168.43.147.7772: UDP, length 120
00:50:46.992007 IP 192.168.43.124.8880 > 192.168.43.146.7771: UDP, length 120
00:50:47.033852 IP 192.168.43.146.8880 > 192.168.43.147.7772: UDP, length 120
00:50:47.040854 IP 192.168.43.124.8880 > 192.168.43.146.7771: UDP, length 120
00:50:47.083860 IP 192.168.43.146.8880 > 192.168.43.147.7772: UDP, length 120
00:50:47.133896 IP 192.168.43.146.8880 > 192.168.43.147.7772: UDP, length 120
00:50:47.183886 IP 192.168.43.146.8880 > 192.168.43.147.7772: UDP, length 120
00:50:47.219800 IP 192.168.43.124.8880 > 192.168.43.146.7771: UDP, length 120
00:50:47.219977 IP 192.168.43.124.8880 > 192.168.43.146.7771: UDP, length 120
00:50:47.220052 IP 192.168.43.124.8880 > 192.168.43.146.7771: UDP, length 120
00:50:47.233861 IP 192.168.43.146.8880 > 192.168.43.147.7772: UDP, length 120
00:50:47.242444 IP 192.168.43.124.8880 > 192.168.43.146.7771: UDP, length 120
00:50:47.283844 IP 192.168.43.146.8880 > 192.168.43.147.7772: UDP, length 120
00:50:47.291827 IP 192.168.43.124.8880 > 192.168.43.146.7771: UDP, length 120
00:50:47.333845 IP 192.168.43.146.8880 > 192.168.43.147.7772: UDP, length 120
00:50:47.341873 IP 192.168.43.124.8880 > 192.168.43.146.7771: UDP, length 120
00:50:47.383845 IP 192.168.43.146.8880 > 192.168.43.147.7772: UDP, length 120
00:50:47.392407 IP 192.168.43.124.8880 > 192.168.43.146.7771: UDP, length 120
00:50:47.433845 IP 192.168.43.146.8880 > 192.168.43.147.7772: UDP, length 120
00:50:47.483843 IP 192.168.43.146.8880 > 192.168.43.147.7772: UDP, length 120
00:50:47.533850 IP 192.168.43.146.8880 > 192.168.43.147.7772: UDP, length 120
00:50:47.567845 IP 192.168.43.124.8880 > 192.168.43.146.7771: UDP, length 120
00:50:47.568001 IP 192.168.43.124.8880 > 192.168.43.146.7771: UDP, length 120
00:50:47.568071 IP 192.168.43.124.8880 > 192.168.43.146.7771: UDP, length 120
00:50:47.583847 IP 192.168.43.146.8880 > 192.168.43.147.7772: UDP, length 120
00:50:47.590397 IP 192.168.43.124.8880 > 192.168.43.146.7771: UDP, length 120
00:50:47.633876 IP 192.168.43.146.8880 > 192.168.43.147.7772: UDP, length 120
00:50:47.642978 IP 192.168.43.124.8880 > 192.168.43.146.7771: UDP, length 120
00:50:47.683872 IP 192.168.43.146.8880 > 192.168.43.147.7772: UDP, length 120
00:50:47.693951 IP 192.168.43.124.8880 > 192.168.43.146.7771: UDP, length 120
00:50:47.733874 IP 192.168.43.146.8880 > 192.168.43.147.7772: UDP, length 120
00:50:47.742883 IP 192.168.43.124.8880 > 192.168.43.146.7771: UDP, length 120
00:50:47.783872 IP 192.168.43.146.8880 > 192.168.43.147.7772: UDP, length 120
00:50:47.833881 IP 192.168.43.146.8880 > 192.168.43.147.7772: UDP, length 120
00:50:47.883869 IP 192.168.43.146.8880 > 192.168.43.147.7772: UDP, length 120
00:50:47.913960 IP 192.168.43.124.8880 > 192.168.43.146.7771: UDP, length 120
00:50:47.914079 IP 192.168.43.124.8880 > 192.168.43.146.7771: UDP, length 120
00:50:47.914193 IP 192.168.43.124.8880 > 192.168.43.146.7771: UDP, length 120
00:50:47.933873 IP 192.168.43.146.8880 > 192.168.43.147.7772: UDP, length 120
00:50:47.941771 IP 192.168.43.124.8880 > 192.168.43.146.7771: UDP, length 120
00:50:47.983872 IP 192.168.43.146.8880 > 192.168.43.147.7772: UDP, length 120
00:50:47.989962 IP 192.168.43.124.8880 > 192.168.43.146.7771: UDP, length 120
00:50:48.033876 IP 192.168.43.146.8880 > 192.168.43.147.7772: UDP, length 120
00:50:48.042273 IP 192.168.43.124.8880 > 192.168.43.146.7771: UDP, length 120
00:50:48.083921 IP 192.168.43.146.8880 > 192.168.43.147.7772: UDP, length 120
00:50:48.092804 IP 192.168.43.124.8880 > 192.168.43.146.7771: UDP, length 120
00:50:48.133891 IP 192.168.43.146.8880 > 192.168.43.147.7772: UDP, length 120
00:50:48.183872 IP 192.168.43.146.8880 > 192.168.43.147.7772: UDP, length 120
00:50:48.233873 IP 192.168.43.146.8880 > 192.168.43.147.7772: UDP, length 120
00:50:48.261788 IP 192.168.43.124.8880 > 192.168.43.146.7771: UDP, length 120
00:50:48.261916 IP 192.168.43.124.8880 > 192.168.43.146.7771: UDP, length 120
00:50:48.262024 IP 192.168.43.124.8880 > 192.168.43.146.7771: UDP, length 120
00:50:48.283873 IP 192.168.43.146.8880 > 192.168.43.147.7772: UDP, length 120
00:50:48.292943 IP 192.168.43.124.8880 > 192.168.43.146.7771: UDP, length 120
00:50:48.333880 IP 192.168.43.146.8880 > 192.168.43.147.7772: UDP, length 120
00:50:48.343128 IP 192.168.43.124.8880 > 192.168.43.146.7771: UDP, length 120
00:50:48.383875 IP 192.168.43.146.8880 > 192.168.43.147.7772: UDP, length 120
00:50:48.393606 IP 192.168.43.124.8880 > 192.168.43.146.7771: UDP, length 120
00:50:48.433883 IP 192.168.43.146.8880 > 192.168.43.147.7772: UDP, length 120
00:50:48.443115 IP 192.168.43.124.8880 > 192.168.43.146.7771: UDP, length 120
00:50:48.483866 IP 192.168.43.146.8880 > 192.168.43.147.7772: UDP, length 120
00:50:48.533881 IP 192.168.43.146.8880 > 192.168.43.147.7772: UDP, length 120
00:50:48.583875 IP 192.168.43.146.8880 > 192.168.43.147.7772: UDP, length 120
00:50:48.608970 IP 192.168.43.124.8880 > 192.168.43.146.7771: UDP, length 120
00:50:48.609242 IP 192.168.43.124.8880 > 192.168.43.146.7771: UDP, length 120
00:50:48.609354 IP 192.168.43.124.8880 > 192.168.43.146.7771: UDP, length 120
00:50:48.633877 IP 192.168.43.146.8880 > 192.168.43.147.7772: UDP, length 120
00:50:48.642604 IP 192.168.43.124.8880 > 192.168.43.146.7771: UDP, length 120
00:50:48.683928 IP 192.168.43.146.8880 > 192.168.43.147.7772: UDP, length 120
00:50:48.691639 IP 192.168.43.124.8880 > 192.168.43.146.7771: UDP, length 120
00:50:48.733895 IP 192.168.43.146.8880 > 192.168.43.147.7772: UDP, length 120
00:50:48.742622 IP 192.168.43.124.8880 > 192.168.43.146.7771: UDP, length 120
00:50:48.783871 IP 192.168.43.146.8880 > 192.168.43.147.7772: UDP, length 120
00:50:48.793682 IP 192.168.43.124.8880 > 192.168.43.146.7771: UDP, length 120
00:50:48.833870 IP 192.168.43.146.8880 > 192.168.43.147.7772: UDP, length 120
00:50:48.883868 IP 192.168.43.146.8880 > 192.168.43.147.7772: UDP, length 120
00:50:48.933868 IP 192.168.43.146.8880 > 192.168.43.147.7772: UDP, length 120
00:50:48.956959 IP 192.168.43.124.8880 > 192.168.43.146.7771: UDP, length 120
00:50:48.957218 IP 192.168.43.124.8880 > 192.168.43.146.7771: UDP, length 120
00:50:48.957328 IP 192.168.43.124.8880 > 192.168.43.146.7771: UDP, length 120
00:50:48.983879 IP 192.168.43.146.8880 > 192.168.43.147.7772: UDP, length 120
00:50:48.994104 IP 192.168.43.124.8880 > 192.168.43.146.7771: UDP, length 120
00:50:49.033873 IP 192.168.43.146.8880 > 192.168.43.147.7772: UDP, length 120
00:50:49.040684 IP 192.168.43.124.8880 > 192.168.43.146.7771: UDP, length 120
00:50:49.083889 IP 192.168.43.146.8880 > 192.168.43.147.7772: UDP, length 120
00:50:49.092420 IP 192.168.43.124.8880 > 192.168.43.146.7771: UDP, length 120
00:50:49.133988 IP 192.168.43.146.8880 > 192.168.43.147.7772: UDP, length 120
00:50:49.143951 IP 192.168.43.124.8880 > 192.168.43.146.7771: UDP, length 120
00:50:49.183957 IP 192.168.43.146.8880 > 192.168.43.147.7772: UDP, length 120
00:50:49.233959 IP 192.168.43.146.8880 > 192.168.43.147.7772: UDP, length 120
00:50:49.283957 IP 192.168.43.146.8880 > 192.168.43.147.7772: UDP, length 120
00:50:49.306733 IP 192.168.43.124.8880 > 192.168.43.146.7771: UDP, length 120
00:50:49.306888 IP 192.168.43.124.8880 > 192.168.43.146.7771: UDP, length 120
00:50:49.306998 IP 192.168.43.124.8880 > 192.168.43.146.7771: UDP, length 120
00:50:49.333916 IP 192.168.43.146.8880 > 192.168.43.147.7772: UDP, length 120
00:50:49.341907 IP 192.168.43.124.8880 > 192.168.43.146.7771: UDP, length 120
00:50:49.383881 IP 192.168.43.146.8880 > 192.168.43.147.7772: UDP, length 120
00:50:49.392560 IP 192.168.43.124.8880 > 192.168.43.146.7771: UDP, length 120
00:50:49.433877 IP 192.168.43.146.8880 > 192.168.43.147.7772: UDP, length 120
00:50:49.442235 IP 192.168.43.124.8880 > 192.168.43.146.7771: UDP, length 120
00:50:49.483872 IP 192.168.43.146.8880 > 192.168.43.147.7772: UDP, length 120
00:50:49.491774 IP 192.168.43.124.8880 > 192.168.43.146.7771: UDP, length 120
00:50:49.533874 IP 192.168.43.146.8880 > 192.168.43.147.7772: UDP, length 120
00:50:49.541313 IP 192.168.43.124.8880 > 192.168.43.146.7771: UDP, length 120
00:50:49.583891 IP 192.168.43.146.8880 > 192.168.43.147.7772: UDP, length 120
00:50:49.591210 IP 192.168.43.124.8880 > 192.168.43.146.7771: UDP, length 120
00:50:49.633877 IP 192.168.43.146.8880 > 192.168.43.147.7772: UDP, length 120
00:50:49.641949 IP 192.168.43.124.8880 > 192.168.43.146.7771: UDP, length 120
00:50:49.683877 IP 192.168.43.146.8880 > 192.168.43.147.7772: UDP, length 120
00:50:49.693158 IP 192.168.43.124.8880 > 192.168.43.146.7771: UDP, length 120
00:50:49.733876 IP 192.168.43.146.8880 > 192.168.43.147.7772: UDP, length 120
00:50:49.741002 IP 192.168.43.124.8880 > 192.168.43.146.7771: UDP, length 120
00:50:49.783903 IP 192.168.43.146.8880 > 192.168.43.147.7772: UDP, length 120
00:50:49.793235 IP 192.168.43.124.8880 > 192.168.43.146.7771: UDP, length 120
00:50:49.833892 IP 192.168.43.146.8880 > 192.168.43.147.7772: UDP, length 120
00:50:49.842543 IP 192.168.43.124.8880 > 192.168.43.146.7771: UDP, length 120
00:50:49.883881 IP 192.168.43.146.8880 > 192.168.43.147.7772: UDP, length 120
00:50:49.893350 IP 192.168.43.124.8880 > 192.168.43.146.7771: UDP, length 120
00:50:49.933872 IP 192.168.43.146.8880 > 192.168.43.147.7772: UDP, length 120
00:50:49.942089 IP 192.168.43.124.8880 > 192.168.43.146.7771: UDP, length 120
00:50:49.983869 IP 192.168.43.146.8880 > 192.168.43.147.7772: UDP, length 120
00:50:50.012781 IP 192.168.43.124.8880 > 192.168.43.146.7771: UDP, length 120
00:50:50.033876 IP 192.168.43.146.8880 > 192.168.43.147.7772: UDP, length 120
00:50:50.045648 IP 192.168.43.124.8880 > 192.168.43.146.7771: UDP, length 120
00:50:50.083914 IP 192.168.43.146.8880 > 192.168.43.147.7772: UDP, length 120
00:50:50.092182 IP 192.168.43.124.8880 > 192.168.43.146.7771: UDP, length 120
00:50:50.133890 IP 192.168.43.146.8880 > 192.168.43.147.7772: UDP, length 120
00:50:50.142738 IP 192.168.43.124.8880 > 192.168.43.146.7771: UDP, length 120
00:50:50.183885 IP 192.168.43.146.8880 > 192.168.43.147.7772: UDP, length 120
00:50:50.192339 IP 192.168.43.124.8880 > 192.168.43.146.7771: UDP, length 120
00:50:50.233910 IP 192.168.43.146.8880 > 192.168.43.147.7772: UDP, length 120
00:50:50.243089 IP 192.168.43.124.8880 > 192.168.43.146.7771: UDP, length 120
00:50:50.283976 IP 192.168.43.146.8880 > 192.168.43.147.7772: UDP, length 120
00:50:50.293861 IP 192.168.43.124.8880 > 192.168.43.146.7771: UDP, length 120
00:50:50.333968 IP 192.168.43.146.8880 > 192.168.43.147.7772: UDP, length 120
00:50:50.342996 IP 192.168.43.124.8880 > 192.168.43.146.7771: UDP, length 120
00:50:50.383943 IP 192.168.43.146.8880 > 192.168.43.147.7772: UDP, length 120
00:50:50.392803 IP 192.168.43.124.8880 > 192.168.43.146.7771: UDP, length 120
00:50:50.433905 IP 192.168.43.146.8880 > 192.168.43.147.7772: UDP, length 120
00:50:50.443315 IP 192.168.43.124.8880 > 192.168.43.146.7771: UDP, length 120
00:50:50.483875 IP 192.168.43.146.8880 > 192.168.43.147.7772: UDP, length 120
00:50:50.495362 IP 192.168.43.124.8880 > 192.168.43.146.7771: UDP, length 120
00:50:50.533873 IP 192.168.43.146.8880 > 192.168.43.147.7772: UDP, length 120
00:50:50.543867 IP 192.168.43.124.8880 > 192.168.43.146.7771: UDP, length 120
00:50:50.583874 IP 192.168.43.146.8880 > 192.168.43.147.7772: UDP, length 120
00:50:50.593631 IP 192.168.43.124.8880 > 192.168.43.146.7771: UDP, length 120
00:50:50.633884 IP 192.168.43.146.8880 > 192.168.43.147.7772: UDP, length 120
00:50:50.643220 IP 192.168.43.124.8880 > 192.168.43.146.7771: UDP, length 120
00:50:50.683894 IP 192.168.43.146.8880 > 192.168.43.147.7772: UDP, length 120
00:50:50.692600 IP 192.168.43.124.8880 > 192.168.43.146.7771: UDP, length 120
00:50:50.733886 IP 192.168.43.146.8880 > 192.168.43.147.7772: UDP, length 120
00:50:50.742351 IP 192.168.43.124.8880 > 192.168.43.146.7771: UDP, length 120
00:50:50.783873 IP 192.168.43.146.8880 > 192.168.43.147.7772: UDP, length 120
00:50:50.792018 IP 192.168.43.124.8880 > 192.168.43.146.7771: UDP, length 120
00:50:50.833872 IP 192.168.43.146.8880 > 192.168.43.147.7772: UDP, length 120
00:50:50.842223 IP 192.168.43.124.8880 > 192.168.43.146.7771: UDP, length 120
00:50:50.883872 IP 192.168.43.146.8880 > 192.168.43.147.7772: UDP, length 120
00:50:50.891794 IP 192.168.43.124.8880 > 192.168.43.146.7771: UDP, length 120
00:50:50.933872 IP 192.168.43.146.8880 > 192.168.43.147.7772: UDP, length 120
00:50:50.942527 IP 192.168.43.124.8880 > 192.168.43.146.7771: UDP, length 120
00:50:50.983873 IP 192.168.43.146.8880 > 192.168.43.147.7772: UDP, length 120
00:50:50.993343 IP 192.168.43.124.8880 > 192.168.43.146.7771: UDP, length 120
00:50:51.033872 IP 192.168.43.146.8880 > 192.168.43.147.7772: UDP, length 120
00:50:51.042577 IP 192.168.43.124.8880 > 192.168.43.146.7771: UDP, length 120
00:50:51.083890 IP 192.168.43.146.8880 > 192.168.43.147.7772: UDP, length 120
00:50:51.092815 IP 192.168.43.124.8880 > 192.168.43.146.7771: UDP, length 120
00:50:51.133881 IP 192.168.43.146.8880 > 192.168.43.147.7772: UDP, length 120
00:50:51.146134 IP 192.168.43.124.8880 > 192.168.43.146.7771: UDP, length 120
00:50:51.183881 IP 192.168.43.146.8880 > 192.168.43.147.7772: UDP, length 120
00:50:51.195245 IP 192.168.43.124.8880 > 192.168.43.146.7771: UDP, length 120
00:50:51.233883 IP 192.168.43.146.8880 > 192.168.43.147.7772: UDP, length 120
00:50:51.241924 IP 192.168.43.124.8880 > 192.168.43.146.7771: UDP, length 120
00:50:51.283870 IP 192.168.43.146.8880 > 192.168.43.147.7772: UDP, length 120
00:50:51.293335 IP 192.168.43.124.8880 > 192.168.43.146.7771: UDP, length 120
00:50:51.333870 IP 192.168.43.146.8880 > 192.168.43.147.7772: UDP, length 120
00:50:51.342475 IP 192.168.43.124.8880 > 192.168.43.146.7771: UDP, length 120
00:50:51.383930 IP 192.168.43.146.8880 > 192.168.43.147.7772: UDP, length 120
00:50:51.391953 IP 192.168.43.124.8880 > 192.168.43.146.7771: UDP, length 120
00:50:51.433895 IP 192.168.43.146.8880 > 192.168.43.147.7772: UDP, length 120
00:50:51.442750 IP 192.168.43.124.8880 > 192.168.43.146.7771: UDP, length 120
00:50:51.483871 IP 192.168.43.146.8880 > 192.168.43.147.7772: UDP, length 120
00:50:51.492917 IP 192.168.43.124.8880 > 192.168.43.146.7771: UDP, length 120
00:50:51.533870 IP 192.168.43.146.8880 > 192.168.43.147.7772: UDP, length 120
00:50:51.542534 IP 192.168.43.124.8880 > 192.168.43.146.7771: UDP, length 120
00:50:51.583864 IP 192.168.43.146.8880 > 192.168.43.147.7772: UDP, length 120
00:50:51.592620 IP 192.168.43.124.8880 > 192.168.43.146.7771: UDP, length 120
00:50:51.633870 IP 192.168.43.146.8880 > 192.168.43.147.7772: UDP, length 120
00:50:51.641927 IP 192.168.43.124.8880 > 192.168.43.146.7771: UDP, length 120
00:50:51.683874 IP 192.168.43.146.8880 > 192.168.43.147.7772: UDP, length 120
00:50:51.692452 IP 192.168.43.124.8880 > 192.168.43.146.7771: UDP, length 120
00:50:51.733931 IP 192.168.43.146.8880 > 192.168.43.147.7772: UDP, length 120
00:50:51.740894 IP 192.168.43.124.8880 > 192.168.43.146.7771: UDP, length 120
00:50:51.783879 IP 192.168.43.146.8880 > 192.168.43.147.7772: UDP, length 120
00:50:51.795725 IP 192.168.43.124.8880 > 192.168.43.146.7771: UDP, length 120
00:50:51.833874 IP 192.168.43.146.8880 > 192.168.43.147.7772: UDP, length 120
00:50:51.842707 IP 192.168.43.124.8880 > 192.168.43.146.7771: UDP, length 120
00:50:51.884050 IP 192.168.43.146.8880 > 192.168.43.147.7772: UDP, length 120
00:50:51.890795 IP 192.168.43.124.8880 > 192.168.43.146.7771: UDP, length 120
00:50:51.933938 IP 192.168.43.146.8880 > 192.168.43.147.7772: UDP, length 120
00:50:51.942748 IP 192.168.43.124.8880 > 192.168.43.146.7771: UDP, length 120
00:50:51.983958 IP 192.168.43.146.8880 > 192.168.43.147.7772: UDP, length 120
00:50:51.992697 IP 192.168.43.124.8880 > 192.168.43.146.7771: UDP, length 120
00:50:52.033890 IP 192.168.43.146.8880 > 192.168.43.147.7772: UDP, length 120
00:50:52.043730 IP 192.168.43.124.8880 > 192.168.43.146.7771: UDP, length 120
00:50:52.083953 IP 192.168.43.146.8880 > 192.168.43.147.7772: UDP, length 120
00:50:52.093150 IP 192.168.43.124.8880 > 192.168.43.146.7771: UDP, length 120
00:50:52.133910 IP 192.168.43.146.8880 > 192.168.43.147.7772: UDP, length 120
00:50:52.143889 IP 192.168.43.124.8880 > 192.168.43.146.7771: UDP, length 120
00:50:52.184018 IP 192.168.43.146.8880 > 192.168.43.147.7772: UDP, length 120
00:50:52.190143 IP 192.168.43.124.8880 > 192.168.43.146.7771: UDP, length 120
00:50:52.233906 IP 192.168.43.146.8880 > 192.168.43.147.7772: UDP, length 120
00:50:52.246051 IP 192.168.43.124.8880 > 192.168.43.146.7771: UDP, length 120
00:50:52.283921 IP 192.168.43.146.8880 > 192.168.43.147.7772: UDP, length 120
00:50:52.291458 IP 192.168.43.124.8880 > 192.168.43.146.7771: UDP, length 120
00:50:52.333892 IP 192.168.43.146.8880 > 192.168.43.147.7772: UDP, length 120
00:50:52.342590 IP 192.168.43.124.8880 > 192.168.43.146.7771: UDP, length 120
00:50:52.383894 IP 192.168.43.146.8880 > 192.168.43.147.7772: UDP, length 120
00:50:52.392448 IP 192.168.43.124.8880 > 192.168.43.146.7771: UDP, length 120
00:50:52.433862 IP 192.168.43.146.8880 > 192.168.43.147.7772: UDP, length 120
00:50:52.443305 IP 192.168.43.124.8880 > 192.168.43.146.7771: UDP, length 120
00:50:52.483846 IP 192.168.43.146.8880 > 192.168.43.147.7772: UDP, length 120
00:50:52.490884 IP 192.168.43.124.8880 > 192.168.43.146.7771: UDP, length 120
00:50:52.533846 IP 192.168.43.146.8880 > 192.168.43.147.7772: UDP, length 120
00:50:52.544212 IP 192.168.43.124.8880 > 192.168.43.146.7771: UDP, length 120
00:50:52.583842 IP 192.168.43.146.8880 > 192.168.43.147.7772: UDP, length 120
00:50:52.592972 IP 192.168.43.124.8880 > 192.168.43.146.7771: UDP, length 120
00:50:52.633872 IP 192.168.43.146.8880 > 192.168.43.147.7772: UDP, length 120
00:50:52.643325 IP 192.168.43.124.8880 > 192.168.43.146.7771: UDP, length 120
00:50:52.683871 IP 192.168.43.146.8880 > 192.168.43.147.7772: UDP, length 120
00:50:52.694596 IP 192.168.43.124.8880 > 192.168.43.146.7771: UDP, length 120
00:50:52.733869 IP 192.168.43.146.8880 > 192.168.43.147.7772: UDP, length 120
00:50:52.742116 IP 192.168.43.124.8880 > 192.168.43.146.7771: UDP, length 120
00:50:52.783875 IP 192.168.43.146.8880 > 192.168.43.147.7772: UDP, length 120
00:50:52.790998 IP 192.168.43.124.8880 > 192.168.43.146.7771: UDP, length 120
00:50:52.833873 IP 192.168.43.146.8880 > 192.168.43.147.7772: UDP, length 120
00:50:52.842220 IP 192.168.43.124.8880 > 192.168.43.146.7771: UDP, length 120
00:50:52.883886 IP 192.168.43.146.8880 > 192.168.43.147.7772: UDP, length 120
00:50:52.892789 IP 192.168.43.124.8880 > 192.168.43.146.7771: UDP, length 120
00:50:52.933881 IP 192.168.43.146.8880 > 192.168.43.147.7772: UDP, length 120
00:50:52.941969 IP 192.168.43.124.8880 > 192.168.43.146.7771: UDP, length 120
00:50:52.983868 IP 192.168.43.146.8880 > 192.168.43.147.7772: UDP, length 120
00:50:52.993059 IP 192.168.43.124.8880 > 192.168.43.146.7771: UDP, length 120
00:50:53.033885 IP 192.168.43.146.8880 > 192.168.43.147.7772: UDP, length 120
00:50:53.042591 IP 192.168.43.124.8880 > 192.168.43.146.7771: UDP, length 120
00:50:53.083910 IP 192.168.43.146.8880 > 192.168.43.147.7772: UDP, length 120
00:50:53.093140 IP 192.168.43.124.8880 > 192.168.43.146.7771: UDP, length 120
00:50:53.133892 IP 192.168.43.146.8880 > 192.168.43.147.7772: UDP, length 120
00:50:53.144974 IP 192.168.43.124.8880 > 192.168.43.146.7771: UDP, length 120
00:50:53.183880 IP 192.168.43.146.8880 > 192.168.43.147.7772: UDP, length 120
00:50:53.194550 IP 192.168.43.124.8880 > 192.168.43.146.7771: UDP, length 120
00:50:53.233917 IP 192.168.43.146.8880 > 192.168.43.147.7772: UDP, length 120
00:50:53.245303 IP 192.168.43.124.8880 > 192.168.43.146.7771: UDP, length 120
00:50:53.283886 IP 192.168.43.146.8880 > 192.168.43.147.7772: UDP, length 120
00:50:53.291982 IP 192.168.43.124.8880 > 192.168.43.146.7771: UDP, length 120
00:50:53.333874 IP 192.168.43.146.8880 > 192.168.43.147.7772: UDP, length 120
00:50:53.342509 IP 192.168.43.124.8880 > 192.168.43.146.7771: UDP, length 120
00:50:53.383948 IP 192.168.43.146.8880 > 192.168.43.147.7772: UDP, length 120
00:50:53.392556 IP 192.168.43.124.8880 > 192.168.43.146.7771: UDP, length 120
00:50:53.433923 IP 192.168.43.146.8880 > 192.168.43.147.7772: UDP, length 120
00:50:53.442977 IP 192.168.43.124.8880 > 192.168.43.146.7771: UDP, length 120
00:50:53.483888 IP 192.168.43.146.8880 > 192.168.43.147.7772: UDP, length 120
00:50:53.493009 IP 192.168.43.124.8880 > 192.168.43.146.7771: UDP, length 120
00:50:53.533874 IP 192.168.43.146.8880 > 192.168.43.147.7772: UDP, length 120
00:50:53.543277 IP 192.168.43.124.8880 > 192.168.43.146.7771: UDP, length 120
00:50:53.583871 IP 192.168.43.146.8880 > 192.168.43.147.7772: UDP, length 120
00:50:53.591939 IP 192.168.43.124.8880 > 192.168.43.146.7771: UDP, length 120
00:50:53.633875 IP 192.168.43.146.8880 > 192.168.43.147.7772: UDP, length 120
00:50:53.642798 IP 192.168.43.124.8880 > 192.168.43.146.7771: UDP, length 120
00:50:53.683892 IP 192.168.43.146.8880 > 192.168.43.147.7772: UDP, length 120
00:50:53.692566 IP 192.168.43.124.8880 > 192.168.43.146.7771: UDP, length 120
00:50:53.733881 IP 192.168.43.146.8880 > 192.168.43.147.7772: UDP, length 120
00:50:53.743034 IP 192.168.43.124.8880 > 192.168.43.146.7771: UDP, length 120
00:50:53.783869 IP 192.168.43.146.8880 > 192.168.43.147.7772: UDP, length 120
00:50:53.792694 IP 192.168.43.124.8880 > 192.168.43.146.7771: UDP, length 120
00:50:53.833871 IP 192.168.43.146.8880 > 192.168.43.147.7772: UDP, length 120
00:50:53.866207 IP 192.168.43.124.8880 > 192.168.43.146.7771: UDP, length 120
00:50:53.883882 IP 192.168.43.146.8880 > 192.168.43.147.7772: UDP, length 120
00:50:53.891876 IP 192.168.43.124.8880 > 192.168.43.146.7771: UDP, length 120
00:50:53.933881 IP 192.168.43.146.8880 > 192.168.43.147.7772: UDP, length 120
00:50:53.942392 IP 192.168.43.124.8880 > 192.168.43.146.7771: UDP, length 120
00:50:53.983868 IP 192.168.43.146.8880 > 192.168.43.147.7772: UDP, length 120
00:50:53.991552 IP 192.168.43.124.8880 > 192.168.43.146.7771: UDP, length 120
00:50:54.033873 IP 192.168.43.146.8880 > 192.168.43.147.7772: UDP, length 120
00:50:54.044362 IP 192.168.43.124.8880 > 192.168.43.146.7771: UDP, length 120
00:50:54.083892 IP 192.168.43.146.8880 > 192.168.43.147.7772: UDP, length 120
00:50:54.093203 IP 192.168.43.124.8880 > 192.168.43.146.7771: UDP, length 120
00:50:54.133885 IP 192.168.43.146.8880 > 192.168.43.147.7772: UDP, length 120
00:50:54.142759 IP 192.168.43.124.8880 > 192.168.43.146.7771: UDP, length 120
00:50:54.183870 IP 192.168.43.146.8880 > 192.168.43.147.7772: UDP, length 120
00:50:54.194025 IP 192.168.43.124.8880 > 192.168.43.146.7771: UDP, length 120
00:50:54.233875 IP 192.168.43.146.8880 > 192.168.43.147.7772: UDP, length 120
00:50:54.243899 IP 192.168.43.124.8880 > 192.168.43.146.7771: UDP, length 120
00:50:54.283869 IP 192.168.43.146.8880 > 192.168.43.147.7772: UDP, length 120
00:50:54.290787 IP 192.168.43.124.8880 > 192.168.43.146.7771: UDP, length 120
00:50:54.333881 IP 192.168.43.146.8880 > 192.168.43.147.7772: UDP, length 120
00:50:54.340966 IP 192.168.43.124.8880 > 192.168.43.146.7771: UDP, length 120
00:50:54.383955 IP 192.168.43.146.8880 > 192.168.43.147.7772: UDP, length 120
00:50:54.392600 IP 192.168.43.124.8880 > 192.168.43.146.7771: UDP, length 120
00:50:54.433927 IP 192.168.43.146.8880 > 192.168.43.147.7772: UDP, length 120
00:50:54.442732 IP 192.168.43.124.8880 > 192.168.43.146.7771: UDP, length 120
00:50:54.483873 IP 192.168.43.146.8880 > 192.168.43.147.7772: UDP, length 120
00:50:54.492511 IP 192.168.43.124.8880 > 192.168.43.146.7771: UDP, length 120
00:50:54.533871 IP 192.168.43.146.8880 > 192.168.43.147.7772: UDP, length 120
00:50:54.542635 IP 192.168.43.124.8880 > 192.168.43.146.7771: UDP, length 120
00:50:54.583884 IP 192.168.43.146.8880 > 192.168.43.147.7772: UDP, length 120
00:50:54.590685 IP 192.168.43.124.8880 > 192.168.43.146.7771: UDP, length 120
00:50:54.633873 IP 192.168.43.146.8880 > 192.168.43.147.7772: UDP, length 120
00:50:54.642602 IP 192.168.43.124.8880 > 192.168.43.146.7771: UDP, length 120
00:50:54.683868 IP 192.168.43.146.8880 > 192.168.43.147.7772: UDP, length 120
00:50:54.692768 IP 192.168.43.124.8880 > 192.168.43.146.7771: UDP, length 120
00:50:54.733913 IP 192.168.43.146.8880 > 192.168.43.147.7772: UDP, length 120
00:50:54.744399 IP 192.168.43.124.8880 > 192.168.43.146.7771: UDP, length 120
00:50:54.783871 IP 192.168.43.146.8880 > 192.168.43.147.7772: UDP, length 120
00:50:54.794462 IP 192.168.43.124.8880 > 192.168.43.146.7771: UDP, length 120
00:50:54.833872 IP 192.168.43.146.8880 > 192.168.43.147.7772: UDP, length 120
00:50:54.857960 IP 192.168.43.124.8880 > 192.168.43.146.7771: UDP, length 120
00:50:54.883869 IP 192.168.43.146.8880 > 192.168.43.147.7772: UDP, length 120
00:50:54.894696 IP 192.168.43.124.8880 > 192.168.43.146.7771: UDP, length 120
00:50:54.933892 IP 192.168.43.146.8880 > 192.168.43.147.7772: UDP, length 120
00:50:54.941488 IP 192.168.43.124.8880 > 192.168.43.146.7771: UDP, length 120
00:50:54.983877 IP 192.168.43.146.8880 > 192.168.43.147.7772: UDP, length 120
00:50:54.990263 IP 192.168.43.124.8880 > 192.168.43.146.7771: UDP, length 120
00:50:55.033874 IP 192.168.43.146.8880 > 192.168.43.147.7772: UDP, length 120
00:50:55.046437 IP 192.168.43.124.8880 > 192.168.43.146.7771: UDP, length 120
00:50:55.083886 IP 192.168.43.146.8880 > 192.168.43.147.7772: UDP, length 120
00:50:55.093323 IP 192.168.43.124.8880 > 192.168.43.146.7771: UDP, length 120
00:50:55.133876 IP 192.168.43.146.8880 > 192.168.43.147.7772: UDP, length 120
00:50:55.143298 IP 192.168.43.124.8880 > 192.168.43.146.7771: UDP, length 120
00:50:55.183870 IP 192.168.43.146.8880 > 192.168.43.147.7772: UDP, length 120
00:50:55.192734 IP 192.168.43.124.8880 > 192.168.43.146.7771: UDP, length 120
00:50:55.233871 IP 192.168.43.146.8880 > 192.168.43.147.7772: UDP, length 120
00:50:55.243030 IP 192.168.43.124.8880 > 192.168.43.146.7771: UDP, length 120
00:50:55.283868 IP 192.168.43.146.8880 > 192.168.43.147.7772: UDP, length 120
00:50:55.294319 IP 192.168.43.124.8880 > 192.168.43.146.7771: UDP, length 120
00:50:55.333870 IP 192.168.43.146.8880 > 192.168.43.147.7772: UDP, length 120
00:50:55.345250 IP 192.168.43.124.8880 > 192.168.43.146.7771: UDP, length 120
00:50:55.383869 IP 192.168.43.146.8880 > 192.168.43.147.7772: UDP, length 120
00:50:55.390247 IP 192.168.43.124.8880 > 192.168.43.146.7771: UDP, length 120
00:50:55.433930 IP 192.168.43.146.8880 > 192.168.43.147.7772: UDP, length 120
00:50:55.442161 IP 192.168.43.124.8880 > 192.168.43.146.7771: UDP, length 120
00:50:55.483878 IP 192.168.43.146.8880 > 192.168.43.147.7772: UDP, length 120
00:50:55.492933 IP 192.168.43.124.8880 > 192.168.43.146.7771: UDP, length 120
00:50:55.533873 IP 192.168.43.146.8880 > 192.168.43.147.7772: UDP, length 120
00:50:55.542140 IP 192.168.43.124.8880 > 192.168.43.146.7771: UDP, length 120
00:50:55.583868 IP 192.168.43.146.8880 > 192.168.43.147.7772: UDP, length 120
00:50:55.592591 IP 192.168.43.124.8880 > 192.168.43.146.7771: UDP, length 120
00:50:55.633871 IP 192.168.43.146.8880 > 192.168.43.147.7772: UDP, length 120
00:50:55.642082 IP 192.168.43.124.8880 > 192.168.43.146.7771: UDP, length 120
00:50:55.683869 IP 192.168.43.146.8880 > 192.168.43.147.7772: UDP, length 120
00:50:55.692165 IP 192.168.43.124.8880 > 192.168.43.146.7771: UDP, length 120
00:50:55.733869 IP 192.168.43.146.8880 > 192.168.43.147.7772: UDP, length 120
00:50:55.742066 IP 192.168.43.124.8880 > 192.168.43.146.7771: UDP, length 120
00:50:55.783868 IP 192.168.43.146.8880 > 192.168.43.147.7772: UDP, length 120
00:50:55.792022 IP 192.168.43.124.8880 > 192.168.43.146.7771: UDP, length 120
00:50:55.833868 IP 192.168.43.146.8880 > 192.168.43.147.7772: UDP, length 120
00:50:55.842466 IP 192.168.43.124.8880 > 192.168.43.146.7771: UDP, length 120
00:50:55.883869 IP 192.168.43.146.8880 > 192.168.43.147.7772: UDP, length 120
00:50:55.892764 IP 192.168.43.124.8880 > 192.168.43.146.7771: UDP, length 120
00:50:55.933869 IP 192.168.43.146.8880 > 192.168.43.147.7772: UDP, length 120
00:50:55.941458 IP 192.168.43.124.8880 > 192.168.43.146.7771: UDP, length 120
00:50:55.983875 IP 192.168.43.146.8880 > 192.168.43.147.7772: UDP, length 120
00:50:55.990908 IP 192.168.43.124.8880 > 192.168.43.146.7771: UDP, length 120
00:50:56.033875 IP 192.168.43.146.8880 > 192.168.43.147.7772: UDP, length 120
00:50:56.043499 IP 192.168.43.124.8880 > 192.168.43.146.7771: UDP, length 120
00:50:56.083909 IP 192.168.43.146.8880 > 192.168.43.147.7772: UDP, length 120
00:50:56.092253 IP 192.168.43.124.8880 > 192.168.43.146.7771: UDP, length 120
00:50:56.133894 IP 192.168.43.146.8880 > 192.168.43.147.7772: UDP, length 120
00:50:56.143282 IP 192.168.43.124.8880 > 192.168.43.146.7771: UDP, length 120
00:50:56.183883 IP 192.168.43.146.8880 > 192.168.43.147.7772: UDP, length 120
00:50:56.192385 IP 192.168.43.124.8880 > 192.168.43.146.7771: UDP, length 120
00:50:56.233925 IP 192.168.43.146.8880 > 192.168.43.147.7772: UDP, length 120
00:50:56.242129 IP 192.168.43.124.8880 > 192.168.43.146.7771: UDP, length 120
00:50:56.283877 IP 192.168.43.146.8880 > 192.168.43.147.7772: UDP, length 120
00:50:56.293123 IP 192.168.43.124.8880 > 192.168.43.146.7771: UDP, length 120
00:50:56.333870 IP 192.168.43.146.8880 > 192.168.43.147.7772: UDP, length 120
00:50:56.342902 IP 192.168.43.124.8880 > 192.168.43.146.7771: UDP, length 120
00:50:56.383894 IP 192.168.43.146.8880 > 192.168.43.147.7772: UDP, length 120
00:50:56.413278 IP 192.168.43.124.8880 > 192.168.43.146.7771: UDP, length 120
00:50:56.433885 IP 192.168.43.146.8880 > 192.168.43.147.7772: UDP, length 120
00:50:56.444016 IP 192.168.43.124.8880 > 192.168.43.146.7771: UDP, length 120
00:50:56.483879 IP 192.168.43.146.8880 > 192.168.43.147.7772: UDP, length 120
00:50:56.496318 IP 192.168.43.124.8880 > 192.168.43.146.7771: UDP, length 120
00:50:56.533869 IP 192.168.43.146.8880 > 192.168.43.147.7772: UDP, length 120
00:50:56.541795 IP 192.168.43.124.8880 > 192.168.43.146.7771: UDP, length 120
00:50:56.583870 IP 192.168.43.146.8880 > 192.168.43.147.7772: UDP, length 120
00:50:56.590312 IP 192.168.43.124.8880 > 192.168.43.146.7771: UDP, length 120
00:50:56.633871 IP 192.168.43.146.8880 > 192.168.43.147.7772: UDP, length 120
00:50:56.642334 IP 192.168.43.124.8880 > 192.168.43.146.7771: UDP, length 120
00:50:56.683892 IP 192.168.43.146.8880 > 192.168.43.147.7772: UDP, length 120
00:50:56.693136 IP 192.168.43.124.8880 > 192.168.43.146.7771: UDP, length 120
00:50:56.733879 IP 192.168.43.146.8880 > 192.168.43.147.7772: UDP, length 120
00:50:56.741913 IP 192.168.43.124.8880 > 192.168.43.146.7771: UDP, length 120
00:50:56.783876 IP 192.168.43.146.8880 > 192.168.43.147.7772: UDP, length 120
00:50:56.792798 IP 192.168.43.124.8880 > 192.168.43.146.7771: UDP, length 120
00:50:56.833871 IP 192.168.43.146.8880 > 192.168.43.147.7772: UDP, length 120
00:50:56.843622 IP 192.168.43.124.8880 > 192.168.43.146.7771: UDP, length 120
00:50:56.883872 IP 192.168.43.146.8880 > 192.168.43.147.7772: UDP, length 120
00:50:56.897169 IP 192.168.43.124.8880 > 192.168.43.146.7771: UDP, length 120
00:50:56.933871 IP 192.168.43.146.8880 > 192.168.43.147.7772: UDP, length 120
00:50:56.944248 IP 192.168.43.124.8880 > 192.168.43.146.7771: UDP, length 120
00:50:56.983891 IP 192.168.43.146.8880 > 192.168.43.147.7772: UDP, length 120
00:50:56.995429 IP 192.168.43.124.8880 > 192.168.43.146.7771: UDP, length 120
00:50:57.033881 IP 192.168.43.146.8880 > 192.168.43.147.7772: UDP, length 120
00:50:57.045064 IP 192.168.43.124.8880 > 192.168.43.146.7771: UDP, length 120
00:50:57.083905 IP 192.168.43.146.8880 > 192.168.43.147.7772: UDP, length 120
00:50:57.092638 IP 192.168.43.124.8880 > 192.168.43.146.7771: UDP, length 120
00:50:57.133900 IP 192.168.43.146.8880 > 192.168.43.147.7772: UDP, length 120
00:50:57.142209 IP 192.168.43.124.8880 > 192.168.43.146.7771: UDP, length 120
00:50:57.183871 IP 192.168.43.146.8880 > 192.168.43.147.7772: UDP, length 120
00:50:57.192100 IP 192.168.43.124.8880 > 192.168.43.146.7771: UDP, length 120
00:50:57.233871 IP 192.168.43.146.8880 > 192.168.43.147.7772: UDP, length 120
00:50:57.242786 IP 192.168.43.124.8880 > 192.168.43.146.7771: UDP, length 120
00:50:57.283869 IP 192.168.43.146.8880 > 192.168.43.147.7772: UDP, length 120
00:50:57.292207 IP 192.168.43.124.8880 > 192.168.43.146.7771: UDP, length 120
00:50:57.333942 IP 192.168.43.146.8880 > 192.168.43.147.7772: UDP, length 120
00:50:57.343505 IP 192.168.43.124.8880 > 192.168.43.146.7771: UDP, length 120
00:50:57.383971 IP 192.168.43.146.8880 > 192.168.43.147.7772: UDP, length 120
00:50:57.396037 IP 192.168.43.124.8880 > 192.168.43.146.7771: UDP, length 120
00:50:57.434000 IP 192.168.43.146.8880 > 192.168.43.147.7772: UDP, length 120
00:50:57.444661 IP 192.168.43.124.8880 > 192.168.43.146.7771: UDP, length 120
00:50:57.483943 IP 192.168.43.146.8880 > 192.168.43.147.7772: UDP, length 120
00:50:57.495902 IP 192.168.43.124.8880 > 192.168.43.146.7771: UDP, length 120
00:50:57.533897 IP 192.168.43.146.8880 > 192.168.43.147.7772: UDP, length 120
00:50:57.540373 IP 192.168.43.124.8880 > 192.168.43.146.7771: UDP, length 120
00:50:57.583941 IP 192.168.43.146.8880 > 192.168.43.147.7772: UDP, length 120
00:50:57.592097 IP 192.168.43.124.8880 > 192.168.43.146.7771: UDP, length 120
00:50:57.633912 IP 192.168.43.146.8880 > 192.168.43.147.7772: UDP, length 120
00:50:57.641450 IP 192.168.43.124.8880 > 192.168.43.146.7771: UDP, length 120
00:50:57.683900 IP 192.168.43.146.8880 > 192.168.43.147.7772: UDP, length 120
00:50:57.693281 IP 192.168.43.124.8880 > 192.168.43.146.7771: UDP, length 120
00:50:57.733915 IP 192.168.43.146.8880 > 192.168.43.147.7772: UDP, length 120
00:50:57.740519 IP 192.168.43.124.8880 > 192.168.43.146.7771: UDP, length 120
00:50:57.784005 IP 192.168.43.146.8880 > 192.168.43.147.7772: UDP, length 120
00:50:57.792609 IP 192.168.43.124.8880 > 192.168.43.146.7771: UDP, length 120
00:50:57.833886 IP 192.168.43.146.8880 > 192.168.43.147.7772: UDP, length 120
00:50:57.843050 IP 192.168.43.124.8880 > 192.168.43.146.7771: UDP, length 120
00:50:57.883849 IP 192.168.43.146.8880 > 192.168.43.147.7772: UDP, length 120
00:50:57.892221 IP 192.168.43.124.8880 > 192.168.43.146.7771: UDP, length 120
00:50:57.933847 IP 192.168.43.146.8880 > 192.168.43.147.7772: UDP, length 120
00:50:57.942895 IP 192.168.43.124.8880 > 192.168.43.146.7771: UDP, length 120
00:50:57.983844 IP 192.168.43.146.8880 > 192.168.43.147.7772: UDP, length 120
00:50:57.990648 IP 192.168.43.124.8880 > 192.168.43.146.7771: UDP, length 120
00:50:58.033862 IP 192.168.43.146.8880 > 192.168.43.147.7772: UDP, length 120
00:50:58.041701 IP 192.168.43.124.8880 > 192.168.43.146.7771: UDP, length 120
00:50:58.083873 IP 192.168.43.146.8880 > 192.168.43.147.7772: UDP, length 120
00:50:58.090831 IP 192.168.43.124.8880 > 192.168.43.146.7771: UDP, length 120
00:50:58.133922 IP 192.168.43.146.8880 > 192.168.43.147.7772: UDP, length 120
00:50:58.140875 IP 192.168.43.124.8880 > 192.168.43.146.7771: UDP, length 120
00:50:58.183851 IP 192.168.43.146.8880 > 192.168.43.147.7772: UDP, length 120
00:50:58.191933 IP 192.168.43.124.8880 > 192.168.43.146.7771: UDP, length 120
00:50:58.233857 IP 192.168.43.146.8880 > 192.168.43.147.7772: UDP, length 120
00:50:58.241121 IP 192.168.43.124.8880 > 192.168.43.146.7771: UDP, length 120
00:50:58.283844 IP 192.168.43.146.8880 > 192.168.43.147.7772: UDP, length 120
00:50:58.291459 IP 192.168.43.124.8880 > 192.168.43.146.7771: UDP, length 120
00:50:58.333846 IP 192.168.43.146.8880 > 192.168.43.147.7772: UDP, length 120
00:50:58.343173 IP 192.168.43.124.8880 > 192.168.43.146.7771: UDP, length 120
00:50:58.383846 IP 192.168.43.146.8880 > 192.168.43.147.7772: UDP, length 120
00:50:58.392788 IP 192.168.43.124.8880 > 192.168.43.146.7771: UDP, length 120
00:50:58.433843 IP 192.168.43.146.8880 > 192.168.43.147.7772: UDP, length 120
00:50:58.443946 IP 192.168.43.124.8880 > 192.168.43.146.7771: UDP, length 120
00:50:58.483844 IP 192.168.43.146.8880 > 192.168.43.147.7772: UDP, length 120
00:50:58.493277 IP 192.168.43.124.8880 > 192.168.43.146.7771: UDP, length 120
00:50:58.533934 IP 192.168.43.146.8880 > 192.168.43.147.7772: UDP, length 120
00:50:58.543760 IP 192.168.43.124.8880 > 192.168.43.146.7771: UDP, length 120
00:50:58.583896 IP 192.168.43.146.8880 > 192.168.43.147.7772: UDP, length 120
