19:46:28.243258 IP 192.168.43.124.8880 > 192.168.43.146.7771: UDP, length 120
19:46:28.293400 IP 192.168.43.124.8880 > 192.168.43.146.7771: UDP, length 120
19:46:28.343400 IP 192.168.43.124.8880 > 192.168.43.146.7771: UDP, length 120
19:46:28.393400 IP 192.168.43.124.8880 > 192.168.43.146.7771: UDP, length 120
19:46:28.443406 IP 192.168.43.124.8880 > 192.168.43.146.7771: UDP, length 120
19:46:28.493401 IP 192.168.43.124.8880 > 192.168.43.146.7771: UDP, length 120
19:46:28.543400 IP 192.168.43.124.8880 > 192.168.43.146.7771: UDP, length 120
19:46:28.593400 IP 192.168.43.124.8880 > 192.168.43.146.7771: UDP, length 120
19:46:28.643403 IP 192.168.43.124.8880 > 192.168.43.146.7771: UDP, length 120
19:46:28.693399 IP 192.168.43.124.8880 > 192.168.43.146.7771: UDP, length 120
19:46:28.743523 IP 192.168.43.124.8880 > 192.168.43.146.7771: UDP, length 120
19:46:28.793401 IP 192.168.43.124.8880 > 192.168.43.146.7771: UDP, length 120
19:46:28.843423 IP 192.168.43.124.8880 > 192.168.43.146.7771: UDP, length 120
19:46:28.893347 IP 192.168.43.124.8880 > 192.168.43.146.7771: UDP, length 120
19:46:28.943400 IP 192.168.43.124.8880 > 192.168.43.146.7771: UDP, length 120
19:46:28.993398 IP 192.168.43.124.8880 > 192.168.43.146.7771: UDP, length 120
19:46:29.043400 IP 192.168.43.124.8880 > 192.168.43.146.7771: UDP, length 120
19:46:29.093440 IP 192.168.43.124.8880 > 192.168.43.146.7771: UDP, length 120
19:46:29.143453 IP 192.168.43.124.8880 > 192.168.43.146.7771: UDP, length 120
19:46:29.193449 IP 192.168.43.124.8880 > 192.168.43.146.7771: UDP, length 120
19:46:29.243453 IP 192.168.43.124.8880 > 192.168.43.146.7771: UDP, length 120
19:46:29.293403 IP 192.168.43.124.8880 > 192.168.43.146.7771: UDP, length 120
19:46:29.343401 IP 192.168.43.124.8880 > 192.168.43.146.7771: UDP, length 120
19:46:29.393364 IP 192.168.43.124.8880 > 192.168.43.146.7771: UDP, length 120
19:46:29.443400 IP 192.168.43.124.8880 > 192.168.43.146.7771: UDP, length 120
19:46:29.493334 IP 192.168.43.124.8880 > 192.168.43.146.7771: UDP, length 120
19:46:29.543406 IP 192.168.43.124.8880 > 192.168.43.146.7771: UDP, length 120
19:46:29.593404 IP 192.168.43.124.8880 > 192.168.43.146.7771: UDP, length 120
19:46:29.643405 IP 192.168.43.124.8880 > 192.168.43.146.7771: UDP, length 120
19:46:29.693405 IP 192.168.43.124.8880 > 192.168.43.146.7771: UDP, length 120
19:46:29.743458 IP 192.168.43.124.8880 > 192.168.43.146.7771: UDP, length 120
19:46:29.793404 IP 192.168.43.124.8880 > 192.168.43.146.7771: UDP, length 120
19:46:29.843568 IP 192.168.43.124.8880 > 192.168.43.146.7771: UDP, length 120
19:46:29.893401 IP 192.168.43.124.8880 > 192.168.43.146.7771: UDP, length 120
19:46:29.943399 IP 192.168.43.124.8880 > 192.168.43.146.7771: UDP, length 120
19:46:29.993484 IP 192.168.43.124.8880 > 192.168.43.146.7771: UDP, length 120
19:46:30.043404 IP 192.168.43.124.8880 > 192.168.43.146.7771: UDP, length 120
19:46:30.093338 IP 192.168.43.124.8880 > 192.168.43.146.7771: UDP, length 120
19:46:30.096007 IP 192.168.43.147.8880 > 192.168.43.124.7773: UDP, length 120
19:46:30.143399 IP 192.168.43.124.8880 > 192.168.43.146.7771: UDP, length 120
19:46:30.146191 IP 192.168.43.147.8880 > 192.168.43.124.7773: UDP, length 120
19:46:30.193402 IP 192.168.43.124.8880 > 192.168.43.146.7771: UDP, length 120
19:46:30.197314 IP 192.168.43.147.8880 > 192.168.43.124.7773: UDP, length 120
19:46:30.243400 IP 192.168.43.124.8880 > 192.168.43.146.7771: UDP, length 120
19:46:30.253762 IP 192.168.43.147.8880 > 192.168.43.124.7773: UDP, length 120
19:46:30.293399 IP 192.168.43.124.8880 > 192.168.43.146.7771: UDP, length 120
19:46:30.298013 IP 192.168.43.147.8880 > 192.168.43.124.7773: UDP, length 120
19:46:30.343400 IP 192.168.43.124.8880 > 192.168.43.146.7771: UDP, length 120
19:46:30.351190 IP 192.168.43.147.8880 > 192.168.43.124.7773: UDP, length 120
19:46:30.393401 IP 192.168.43.124.8880 > 192.168.43.146.7771: UDP, length 120
19:46:30.399774 IP 192.168.43.147.8880 > 192.168.43.124.7773: UDP, length 120
19:46:30.443402 IP 192.168.43.124.8880 > 192.168.43.146.7771: UDP, length 120
19:46:30.451556 IP 192.168.43.147.8880 > 192.168.43.124.7773: UDP, length 120
19:46:30.493402 IP 192.168.43.124.8880 > 192.168.43.146.7771: UDP, length 120
19:46:30.502317 IP 192.168.43.147.8880 > 192.168.43.124.7773: UDP, length 120
19:46:30.543402 IP 192.168.43.124.8880 > 192.168.43.146.7771: UDP, length 120
19:46:30.555110 IP 192.168.43.147.8880 > 192.168.43.124.7773: UDP, length 120
19:46:30.593402 IP 192.168.43.124.8880 > 192.168.43.146.7771: UDP, length 120
19:46:30.609255 IP 192.168.43.147.8880 > 192.168.43.124.7773: UDP, length 120
19:46:30.643402 IP 192.168.43.124.8880 > 192.168.43.146.7771: UDP, length 120
19:46:30.656198 IP 192.168.43.147.8880 > 192.168.43.124.7773: UDP, length 120
19:46:30.693401 IP 192.168.43.124.8880 > 192.168.43.146.7771: UDP, length 120
19:46:30.704496 IP 192.168.43.147.8880 > 192.168.43.124.7773: UDP, length 120
19:46:30.743408 IP 192.168.43.124.8880 > 192.168.43.146.7771: UDP, length 120
19:46:30.781119 IP 192.168.43.147.8880 > 192.168.43.124.7773: UDP, length 120
19:46:30.793401 IP 192.168.43.124.8880 > 192.168.43.146.7771: UDP, length 120
19:46:30.801350 IP 192.168.43.147.8880 > 192.168.43.124.7773: UDP, length 120
19:46:30.843456 IP 192.168.43.124.8880 > 192.168.43.146.7771: UDP, length 120
19:46:30.848735 IP 192.168.43.147.8880 > 192.168.43.124.7773: UDP, length 120
19:46:30.893349 IP 192.168.43.124.8880 > 192.168.43.146.7771: UDP, length 120
19:46:30.899447 IP 192.168.43.147.8880 > 192.168.43.124.7773: UDP, length 120
19:46:30.943398 IP 192.168.43.124.8880 > 192.168.43.146.7771: UDP, length 120
19:46:30.950181 IP 192.168.43.147.8880 > 192.168.43.124.7773: UDP, length 120
19:46:30.993335 IP 192.168.43.124.8880 > 192.168.43.146.7771: UDP, length 120
19:46:30.999042 IP 192.168.43.147.8880 > 192.168.43.124.7773: UDP, length 120
19:46:31.043353 IP 192.168.43.124.8880 > 192.168.43.146.7771: UDP, length 120
19:46:31.049605 IP 192.168.43.147.8880 > 192.168.43.124.7773: UDP, length 120
19:46:31.093402 IP 192.168.43.124.8880 > 192.168.43.146.7771: UDP, length 120
19:46:31.101152 IP 192.168.43.147.8880 > 192.168.43.124.7773: UDP, length 120
19:46:31.143400 IP 192.168.43.124.8880 > 192.168.43.146.7771: UDP, length 120
19:46:31.147402 IP 192.168.43.147.8880 > 192.168.43.124.7773: UDP, length 120
19:46:31.193402 IP 192.168.43.124.8880 > 192.168.43.146.7771: UDP, length 120
19:46:31.199646 IP 192.168.43.147.8880 > 192.168.43.124.7773: UDP, length 120
19:46:31.243399 IP 192.168.43.124.8880 > 192.168.43.146.7771: UDP, length 120
19:46:31.250937 IP 192.168.43.147.8880 > 192.168.43.124.7773: UDP, length 120
19:46:31.293399 IP 192.168.43.124.8880 > 192.168.43.146.7771: UDP, length 120
19:46:31.297864 IP 192.168.43.147.8880 > 192.168.43.124.7773: UDP, length 120
19:46:31.343399 IP 192.168.43.124.8880 > 192.168.43.146.7771: UDP, length 120
19:46:31.350973 IP 192.168.43.147.8880 > 192.168.43.124.7773: UDP, length 120
19:46:31.393400 IP 192.168.43.124.8880 > 192.168.43.146.7771: UDP, length 120
19:46:31.396975 IP 192.168.43.147.8880 > 192.168.43.124.7773: UDP, length 120
19:46:31.443400 IP 192.168.43.124.8880 > 192.168.43.146.7771: UDP, length 120
19:46:31.453371 IP 192.168.43.147.8880 > 192.168.43.124.7773: UDP, length 120
19:46:31.493401 IP 192.168.43.124.8880 > 192.168.43.146.7771: UDP, length 120
19:46:31.500063 IP 192.168.43.147.8880 > 192.168.43.124.7773: UDP, length 120
19:46:31.543399 IP 192.168.43.124.8880 > 192.168.43.146.7771: UDP, length 120
19:46:31.553204 IP 192.168.43.147.8880 > 192.168.43.124.7773: UDP, length 120
19:46:31.593400 IP 192.168.43.124.8880 > 192.168.43.146.7771: UDP, length 120
19:46:31.601915 IP 192.168.43.147.8880 > 192.168.43.124.7773: UDP, length 120
19:46:31.643400 IP 192.168.43.124.8880 > 192.168.43.146.7771: UDP, length 120
19:46:31.649855 IP 192.168.43.147.8880 > 192.168.43.124.7773: UDP, length 120
19:46:31.693399 IP 192.168.43.124.8880 > 192.168.43.146.7771: UDP, length 120
19:46:31.704879 IP 192.168.43.147.8880 > 192.168.43.124.7773: UDP, length 120
19:46:31.743480 IP 192.168.43.124.8880 > 192.168.43.146.7771: UDP, length 120
19:46:31.763474 IP 192.168.43.147.8880 > 192.168.43.124.7773: UDP, length 120
19:46:31.793401 IP 192.168.43.124.8880 > 192.168.43.146.7771: UDP, length 120
19:46:31.797912 IP 192.168.43.147.8880 > 192.168.43.124.7773: UDP, length 120
19:46:31.843402 IP 192.168.43.124.8880 > 192.168.43.146.7771: UDP, length 120
19:46:31.854301 IP 192.168.43.147.8880 > 192.168.43.124.7773: UDP, length 120
19:46:31.893401 IP 192.168.43.124.8880 > 192.168.43.146.7771: UDP, length 120
19:46:31.897679 IP 192.168.43.147.8880 > 192.168.43.124.7773: UDP, length 120
19:46:31.943399 IP 192.168.43.124.8880 > 192.168.43.146.7771: UDP, length 120
19:46:31.951210 IP 192.168.43.147.8880 > 192.168.43.124.7773: UDP, length 120
19:46:31.993400 IP 192.168.43.124.8880 > 192.168.43.146.7771: UDP, length 120
19:46:31.998430 IP 192.168.43.147.8880 > 192.168.43.124.7773: UDP, length 120
19:46:32.043401 IP 192.168.43.124.8880 > 192.168.43.146.7771: UDP, length 120
19:46:32.047575 IP 192.168.43.147.8880 > 192.168.43.124.7773: UDP, length 120
19:46:32.093341 IP 192.168.43.124.8880 > 192.168.43.146.7771: UDP, length 120
19:46:32.143417 IP 192.168.43.124.8880 > 192.168.43.146.7771: UDP, length 120
19:46:32.150587 IP 192.168.43.147.8880 > 192.168.43.124.7773: UDP, length 120
19:46:32.193401 IP 192.168.43.124.8880 > 192.168.43.146.7771: UDP, length 120
19:46:32.202371 IP 192.168.43.147.8880 > 192.168.43.124.7773: UDP, length 120
19:46:32.243401 IP 192.168.43.124.8880 > 192.168.43.146.7771: UDP, length 120
19:46:32.247589 IP 192.168.43.147.8880 > 192.168.43.124.7773: UDP, length 120
19:46:32.293402 IP 192.168.43.124.8880 > 192.168.43.146.7771: UDP, length 120
19:46:32.300724 IP 192.168.43.147.8880 > 192.168.43.124.7773: UDP, length 120
19:46:32.343401 IP 192.168.43.124.8880 > 192.168.43.146.7771: UDP, length 120
19:46:32.347693 IP 192.168.43.147.8880 > 192.168.43.124.7773: UDP, length 120
19:46:32.393401 IP 192.168.43.124.8880 > 192.168.43.146.7771: UDP, length 120
19:46:32.399624 IP 192.168.43.147.8880 > 192.168.43.124.7773: UDP, length 120
19:46:32.443401 IP 192.168.43.124.8880 > 192.168.43.146.7771: UDP, length 120
19:46:32.449928 IP 192.168.43.147.8880 > 192.168.43.124.7773: UDP, length 120
19:46:32.493400 IP 192.168.43.124.8880 > 192.168.43.146.7771: UDP, length 120
19:46:32.501504 IP 192.168.43.147.8880 > 192.168.43.124.7773: UDP, length 120
19:46:32.543352 IP 192.168.43.124.8880 > 192.168.43.146.7771: UDP, length 120
19:46:32.551281 IP 192.168.43.147.8880 > 192.168.43.124.7773: UDP, length 120
19:46:32.593399 IP 192.168.43.124.8880 > 192.168.43.146.7771: UDP, length 120
19:46:32.602684 IP 192.168.43.147.8880 > 192.168.43.124.7773: UDP, length 120
19:46:32.643401 IP 192.168.43.124.8880 > 192.168.43.146.7771: UDP, length 120
19:46:32.651540 IP 192.168.43.147.8880 > 192.168.43.124.7773: UDP, length 120
19:46:32.693400 IP 192.168.43.124.8880 > 192.168.43.146.7771: UDP, length 120
19:46:32.705297 IP 192.168.43.147.8880 > 192.168.43.124.7773: UDP, length 120
19:46:32.743450 IP 192.168.43.124.8880 > 192.168.43.146.7771: UDP, length 120
19:46:32.750964 IP 192.168.43.147.8880 > 192.168.43.124.7773: UDP, length 120
19:46:32.793401 IP 192.168.43.124.8880 > 192.168.43.146.7771: UDP, length 120
19:46:32.807228 IP 192.168.43.147.8880 > 192.168.43.124.7773: UDP, length 120
19:46:32.843341 IP 192.168.43.124.8880 > 192.168.43.146.7771: UDP, length 120
19:46:32.846318 IP 192.168.43.147.8880 > 192.168.43.124.7773: UDP, length 120
19:46:32.893402 IP 192.168.43.124.8880 > 192.168.43.146.7771: UDP, length 120
19:46:32.899764 IP 192.168.43.147.8880 > 192.168.43.124.7773: UDP, length 120
19:46:32.943402 IP 192.168.43.124.8880 > 192.168.43.146.7771: UDP, length 120
19:46:32.950412 IP 192.168.43.147.8880 > 192.168.43.124.7773: UDP, length 120
19:46:32.993401 IP 192.168.43.124.8880 > 192.168.43.146.7771: UDP, length 120
19:46:33.023287 IP 192.168.43.147.8880 > 192.168.43.124.7773: UDP, length 120
19:46:33.043451 IP 192.168.43.124.8880 > 192.168.43.146.7771: UDP, length 120
19:46:33.057224 IP 192.168.43.147.8880 > 192.168.43.124.7773: UDP, length 120
19:46:33.093446 IP 192.168.43.124.8880 > 192.168.43.146.7771: UDP, length 120
19:46:33.103178 IP 192.168.43.147.8880 > 192.168.43.124.7773: UDP, length 120
19:46:33.143453 IP 192.168.43.124.8880 > 192.168.43.146.7771: UDP, length 120
19:46:33.148427 IP 192.168.43.147.8880 > 192.168.43.124.7773: UDP, length 120
19:46:33.193452 IP 192.168.43.124.8880 > 192.168.43.146.7771: UDP, length 120
19:46:33.198195 IP 192.168.43.147.8880 > 192.168.43.124.7773: UDP, length 120
19:46:33.243452 IP 192.168.43.124.8880 > 192.168.43.146.7771: UDP, length 120
19:46:33.251136 IP 192.168.43.147.8880 > 192.168.43.124.7773: UDP, length 120
19:46:33.293401 IP 192.168.43.124.8880 > 192.168.43.146.7771: UDP, length 120
19:46:33.298757 IP 192.168.43.147.8880 > 192.168.43.124.7773: UDP, length 120
19:46:33.343354 IP 192.168.43.124.8880 > 192.168.43.146.7771: UDP, length 120
19:46:33.346082 IP 192.168.43.147.8880 > 192.168.43.124.7773: UDP, length 120
19:46:33.393401 IP 192.168.43.124.8880 > 192.168.43.146.7771: UDP, length 120
19:46:33.401406 IP 192.168.43.147.8880 > 192.168.43.124.7773: UDP, length 120
19:46:33.443401 IP 192.168.43.124.8880 > 192.168.43.146.7771: UDP, length 120
19:46:33.447862 IP 192.168.43.147.8880 > 192.168.43.124.7773: UDP, length 120
19:46:33.493399 IP 192.168.43.124.8880 > 192.168.43.146.7771: UDP, length 120
19:46:33.503654 IP 192.168.43.147.8880 > 192.168.43.124.7773: UDP, length 120
19:46:33.543400 IP 192.168.43.124.8880 > 192.168.43.146.7771: UDP, length 120
19:46:33.547897 IP 192.168.43.147.8880 > 192.168.43.124.7773: UDP, length 120
19:46:33.593401 IP 192.168.43.124.8880 > 192.168.43.146.7771: UDP, length 120
19:46:33.603331 IP 192.168.43.147.8880 > 192.168.43.124.7773: UDP, length 120
19:46:33.643400 IP 192.168.43.124.8880 > 192.168.43.146.7771: UDP, length 120
19:46:33.650576 IP 192.168.43.147.8880 > 192.168.43.124.7773: UDP, length 120
19:46:33.693401 IP 192.168.43.124.8880 > 192.168.43.146.7771: UDP, length 120
19:46:33.703577 IP 192.168.43.147.8880 > 192.168.43.124.7773: UDP, length 120
19:46:33.743347 IP 192.168.43.124.8880 > 192.168.43.146.7771: UDP, length 120
19:46:33.752748 IP 192.168.43.147.8880 > 192.168.43.124.7773: UDP, length 120
19:46:33.793401 IP 192.168.43.124.8880 > 192.168.43.146.7771: UDP, length 120
19:46:33.800413 IP 192.168.43.147.8880 > 192.168.43.124.7773: UDP, length 120
19:46:33.843617 IP 192.168.43.124.8880 > 192.168.43.146.7771: UDP, length 120
19:46:33.853250 IP 192.168.43.147.8880 > 192.168.43.124.7773: UDP, length 120
19:46:33.893401 IP 192.168.43.124.8880 > 192.168.43.146.7771: UDP, length 120
19:46:33.899987 IP 192.168.43.147.8880 > 192.168.43.124.7773: UDP, length 120
19:46:33.943400 IP 192.168.43.124.8880 > 192.168.43.146.7771: UDP, length 120
19:46:33.951902 IP 192.168.43.147.8880 > 192.168.43.124.7773: UDP, length 120
19:46:33.993399 IP 192.168.43.124.8880 > 192.168.43.146.7771: UDP, length 120
19:46:34.000940 IP 192.168.43.147.8880 > 192.168.43.124.7773: UDP, length 120
19:46:34.043400 IP 192.168.43.124.8880 > 192.168.43.146.7771: UDP, length 120
19:46:34.050643 IP 192.168.43.147.8880 > 192.168.43.124.7773: UDP, length 120
19:46:34.093400 IP 192.168.43.124.8880 > 192.168.43.146.7771: UDP, length 120
19:46:34.107834 IP 192.168.43.147.8880 > 192.168.43.124.7773: UDP, length 120
19:46:34.143400 IP 192.168.43.124.8880 > 192.168.43.146.7771: UDP, length 120
19:46:34.148110 IP 192.168.43.147.8880 > 192.168.43.124.7773: UDP, length 120
19:46:34.193401 IP 192.168.43.124.8880 > 192.168.43.146.7771: UDP, length 120
19:46:34.199990 IP 192.168.43.147.8880 > 192.168.43.124.7773: UDP, length 120
19:46:34.243402 IP 192.168.43.124.8880 > 192.168.43.146.7771: UDP, length 120
19:46:34.250099 IP 192.168.43.147.8880 > 192.168.43.124.7773: UDP, length 120
19:46:34.293401 IP 192.168.43.124.8880 > 192.168.43.146.7771: UDP, length 120
19:46:34.299819 IP 192.168.43.147.8880 > 192.168.43.124.7773: UDP, length 120
19:46:34.343401 IP 192.168.43.124.8880 > 192.168.43.146.7771: UDP, length 120
19:46:34.393400 IP 192.168.43.124.8880 > 192.168.43.146.7771: UDP, length 120
19:46:34.403329 IP 192.168.43.147.8880 > 192.168.43.124.7773: UDP, length 120
19:46:34.443401 IP 192.168.43.124.8880 > 192.168.43.146.7771: UDP, length 120
19:46:34.447378 IP 192.168.43.147.8880 > 192.168.43.124.7773: UDP, length 120
19:46:34.493401 IP 192.168.43.124.8880 > 192.168.43.146.7771: UDP, length 120
19:46:34.498426 IP 192.168.43.147.8880 > 192.168.43.124.7773: UDP, length 120
19:46:34.543400 IP 192.168.43.124.8880 > 192.168.43.146.7771: UDP, length 120
19:46:34.549810 IP 192.168.43.147.8880 > 192.168.43.124.7773: UDP, length 120
19:46:34.593395 IP 192.168.43.124.8880 > 192.168.43.146.7771: UDP, length 120
19:46:34.643401 IP 192.168.43.124.8880 > 192.168.43.146.7771: UDP, length 120
19:46:34.661993 IP 192.168.43.147.8880 > 192.168.43.124.7773: UDP, length 120
19:46:34.680805 IP 192.168.43.147.8880 > 192.168.43.124.7773: UDP, length 120
19:46:34.693399 IP 192.168.43.124.8880 > 192.168.43.146.7771: UDP, length 120
19:46:34.708719 IP 192.168.43.147.8880 > 192.168.43.124.7773: UDP, length 120
19:46:34.743400 IP 192.168.43.124.8880 > 192.168.43.146.7771: UDP, length 120
19:46:34.749736 IP 192.168.43.147.8880 > 192.168.43.124.7773: UDP, length 120
19:46:34.793392 IP 192.168.43.124.8880 > 192.168.43.146.7771: UDP, length 120
19:46:34.803180 IP 192.168.43.147.8880 > 192.168.43.124.7773: UDP, length 120
19:46:34.843403 IP 192.168.43.124.8880 > 192.168.43.146.7771: UDP, length 120
19:46:34.856955 IP 192.168.43.147.8880 > 192.168.43.124.7773: UDP, length 120
19:46:34.893365 IP 192.168.43.124.8880 > 192.168.43.146.7771: UDP, length 120
19:46:34.905444 IP 192.168.43.147.8880 > 192.168.43.124.7773: UDP, length 120
19:46:34.943400 IP 192.168.43.124.8880 > 192.168.43.146.7771: UDP, length 120
19:46:34.949634 IP 192.168.43.147.8880 > 192.168.43.124.7773: UDP, length 120
19:46:34.993402 IP 192.168.43.124.8880 > 192.168.43.146.7771: UDP, length 120
19:46:34.999658 IP 192.168.43.147.8880 > 192.168.43.124.7773: UDP, length 120
19:46:35.043408 IP 192.168.43.124.8880 > 192.168.43.146.7771: UDP, length 120
19:46:35.049683 IP 192.168.43.147.8880 > 192.168.43.124.7773: UDP, length 120
19:46:35.093402 IP 192.168.43.124.8880 > 192.168.43.146.7771: UDP, length 120
19:46:35.096471 IP 192.168.43.147.8880 > 192.168.43.124.7773: UDP, length 120
19:46:35.143402 IP 192.168.43.124.8880 > 192.168.43.146.7771: UDP, length 120
19:46:35.147006 IP 192.168.43.147.8880 > 192.168.43.124.7773: UDP, length 120
19:46:35.193312 IP 192.168.43.124.8880 > 192.168.43.146.7771: UDP, length 120
19:46:35.196214 IP 192.168.43.147.8880 > 192.168.43.124.7773: UDP, length 120
19:46:35.243400 IP 192.168.43.124.8880 > 192.168.43.146.7771: UDP, length 120
19:46:35.247534 IP 192.168.43.147.8880 > 192.168.43.124.7773: UDP, length 120
19:46:35.293401 IP 192.168.43.124.8880 > 192.168.43.146.7771: UDP, length 120
19:46:35.305013 IP 192.168.43.147.8880 > 192.168.43.124.7773: UDP, length 120
19:46:35.343442 IP 192.168.43.124.8880 > 192.168.43.146.7771: UDP, length 120
19:46:35.350012 IP 192.168.43.147.8880 > 192.168.43.124.7773: UDP, length 120
19:46:35.393442 IP 192.168.43.124.8880 > 192.168.43.146.7771: UDP, length 120
19:46:35.402468 IP 192.168.43.147.8880 > 192.168.43.124.7773: UDP, length 120
19:46:35.443443 IP 192.168.43.124.8880 > 192.168.43.146.7771: UDP, length 120
19:46:35.448630 IP 192.168.43.147.8880 > 192.168.43.124.7773: UDP, length 120
19:46:35.493451 IP 192.168.43.124.8880 > 192.168.43.146.7771: UDP, length 120
19:46:35.499107 IP 192.168.43.147.8880 > 192.168.43.124.7773: UDP, length 120
19:46:35.543452 IP 192.168.43.124.8880 > 192.168.43.146.7771: UDP, length 120
19:46:35.551824 IP 192.168.43.147.8880 > 192.168.43.124.7773: UDP, length 120
19:46:35.593453 IP 192.168.43.124.8880 > 192.168.43.146.7771: UDP, length 120
19:46:35.599756 IP 192.168.43.147.8880 > 192.168.43.124.7773: UDP, length 120
19:46:35.643451 IP 192.168.43.124.8880 > 192.168.43.146.7771: UDP, length 120
19:46:35.654348 IP 192.168.43.147.8880 > 192.168.43.124.7773: UDP, length 120
19:46:35.693451 IP 192.168.43.124.8880 > 192.168.43.146.7771: UDP, length 120
19:46:35.705298 IP 192.168.43.147.8880 > 192.168.43.124.7773: UDP, length 120
19:46:35.743452 IP 192.168.43.124.8880 > 192.168.43.146.7771: UDP, length 120
19:46:35.749967 IP 192.168.43.147.8880 > 192.168.43.124.7773: UDP, length 120
19:46:35.793480 IP 192.168.43.124.8880 > 192.168.43.146.7771: UDP, length 120
19:46:35.801372 IP 192.168.43.147.8880 > 192.168.43.124.7773: UDP, length 120
19:46:35.843401 IP 192.168.43.124.8880 > 192.168.43.146.7771: UDP, length 120
19:46:35.852203 IP 192.168.43.147.8880 > 192.168.43.124.7773: UDP, length 120
19:46:35.893401 IP 192.168.43.124.8880 > 192.168.43.146.7771: UDP, length 120
19:46:35.905357 IP 192.168.43.147.8880 > 192.168.43.124.7773: UDP, length 120
19:46:35.943403 IP 192.168.43.124.8880 > 192.168.43.146.7771: UDP, length 120
19:46:35.950009 IP 192.168.43.147.8880 > 192.168.43.124.7773: UDP, length 120
19:46:35.993401 IP 192.168.43.124.8880 > 192.168.43.146.7771: UDP, length 120
19:46:36.004981 IP 192.168.43.147.8880 > 192.168.43.124.7773: UDP, length 120
19:46:36.043345 IP 192.168.43.124.8880 > 192.168.43.146.7771: UDP, length 120
19:46:36.053821 IP 192.168.43.147.8880 > 192.168.43.124.7773: UDP, length 120
19:46:36.093338 IP 192.168.43.124.8880 > 192.168.43.146.7771: UDP, length 120
19:46:36.112357 IP 192.168.43.147.8880 > 192.168.43.124.7773: UDP, length 120
19:46:36.143433 IP 192.168.43.124.8880 > 192.168.43.146.7771: UDP, length 120
19:46:36.150885 IP 192.168.43.147.8880 > 192.168.43.124.7773: UDP, length 120
19:46:36.193401 IP 192.168.43.124.8880 > 192.168.43.146.7771: UDP, length 120
19:46:36.214285 IP 192.168.43.147.8880 > 192.168.43.124.7773: UDP, length 120
19:46:36.243353 IP 192.168.43.124.8880 > 192.168.43.146.7771: UDP, length 120
19:46:36.247729 IP 192.168.43.147.8880 > 192.168.43.124.7773: UDP, length 120
19:46:36.293401 IP 192.168.43.124.8880 > 192.168.43.146.7771: UDP, length 120
19:46:36.300346 IP 192.168.43.147.8880 > 192.168.43.124.7773: UDP, length 120
19:46:36.343402 IP 192.168.43.124.8880 > 192.168.43.146.7771: UDP, length 120
19:46:36.351701 IP 192.168.43.147.8880 > 192.168.43.124.7773: UDP, length 120
19:46:36.393405 IP 192.168.43.124.8880 > 192.168.43.146.7771: UDP, length 120
19:46:36.443400 IP 192.168.43.124.8880 > 192.168.43.146.7771: UDP, length 120
19:46:36.449645 IP 192.168.43.147.8880 > 192.168.43.124.7773: UDP, length 120
19:46:36.493401 IP 192.168.43.124.8880 > 192.168.43.146.7771: UDP, length 120
19:46:36.543403 IP 192.168.43.124.8880 > 192.168.43.146.7771: UDP, length 120
19:46:36.549802 IP 192.168.43.147.8880 > 192.168.43.124.7773: UDP, length 120
19:46:36.593401 IP 192.168.43.124.8880 > 192.168.43.146.7771: UDP, length 120
19:46:36.597905 IP 192.168.43.147.8880 > 192.168.43.124.7773: UDP, length 120
19:46:36.643400 IP 192.168.43.124.8880 > 192.168.43.146.7771: UDP, length 120
19:46:36.648072 IP 192.168.43.147.8880 > 192.168.43.124.7773: UDP, length 120
19:46:36.693425 IP 192.168.43.124.8880 > 192.168.43.146.7771: UDP, length 120
19:46:36.698488 IP 192.168.43.147.8880 > 192.168.43.124.7773: UDP, length 120
19:46:36.743423 IP 192.168.43.124.8880 > 192.168.43.146.7771: UDP, length 120
19:46:36.747697 IP 192.168.43.147.8880 > 192.168.43.124.7773: UDP, length 120
19:46:36.793404 IP 192.168.43.124.8880 > 192.168.43.146.7771: UDP, length 120
19:46:36.801836 IP 192.168.43.147.8880 > 192.168.43.124.7773: UDP, length 120
19:46:36.843400 IP 192.168.43.124.8880 > 192.168.43.146.7771: UDP, length 120
19:46:36.851498 IP 192.168.43.147.8880 > 192.168.43.124.7773: UDP, length 120
19:46:36.893401 IP 192.168.43.124.8880 > 192.168.43.146.7771: UDP, length 120
19:46:36.902608 IP 192.168.43.147.8880 > 192.168.43.124.7773: UDP, length 120
19:46:36.943403 IP 192.168.43.124.8880 > 192.168.43.146.7771: UDP, length 120
19:46:36.952715 IP 192.168.43.147.8880 > 192.168.43.124.7773: UDP, length 120
19:46:36.993403 IP 192.168.43.124.8880 > 192.168.43.146.7771: UDP, length 120
19:46:37.007083 IP 192.168.43.147.8880 > 192.168.43.124.7773: UDP, length 120
19:46:37.043395 IP 192.168.43.124.8880 > 192.168.43.146.7771: UDP, length 120
19:46:37.053612 IP 192.168.43.147.8880 > 192.168.43.124.7773: UDP, length 120
19:46:37.093888 IP 192.168.43.124.8880 > 192.168.43.146.7771: UDP, length 120
19:46:37.108045 IP 192.168.43.147.8880 > 192.168.43.124.7773: UDP, length 120
19:46:37.143487 IP 192.168.43.124.8880 > 192.168.43.146.7771: UDP, length 120
19:46:37.193401 IP 192.168.43.124.8880 > 192.168.43.146.7771: UDP, length 120
19:46:37.217854 IP 192.168.43.147.8880 > 192.168.43.124.7773: UDP, length 120
19:46:37.220231 IP 192.168.43.147.8880 > 192.168.43.124.7773: UDP, length 120
19:46:37.243401 IP 192.168.43.124.8880 > 192.168.43.146.7771: UDP, length 120
19:46:37.258345 IP 192.168.43.147.8880 > 192.168.43.124.7773: UDP, length 120
19:46:37.293401 IP 192.168.43.124.8880 > 192.168.43.146.7771: UDP, length 120
19:46:37.299951 IP 192.168.43.147.8880 > 192.168.43.124.7773: UDP, length 120
19:46:37.343400 IP 192.168.43.124.8880 > 192.168.43.146.7771: UDP, length 120
19:46:37.353387 IP 192.168.43.147.8880 > 192.168.43.124.7773: UDP, length 120
19:46:37.393364 IP 192.168.43.124.8880 > 192.168.43.146.7771: UDP, length 120
19:46:37.401229 IP 192.168.43.147.8880 > 192.168.43.124.7773: UDP, length 120
19:46:37.443402 IP 192.168.43.124.8880 > 192.168.43.146.7771: UDP, length 120
19:46:37.459963 IP 192.168.43.147.8880 > 192.168.43.124.7773: UDP, length 120
19:46:37.493402 IP 192.168.43.124.8880 > 192.168.43.146.7771: UDP, length 120
19:46:37.499956 IP 192.168.43.147.8880 > 192.168.43.124.7773: UDP, length 120
19:46:37.543400 IP 192.168.43.124.8880 > 192.168.43.146.7771: UDP, length 120
19:46:37.558072 IP 192.168.43.147.8880 > 192.168.43.124.7773: UDP, length 120
19:46:37.593400 IP 192.168.43.124.8880 > 192.168.43.146.7771: UDP, length 120
19:46:37.597572 IP 192.168.43.147.8880 > 192.168.43.124.7773: UDP, length 120
19:46:37.643401 IP 192.168.43.124.8880 > 192.168.43.146.7771: UDP, length 120
19:46:37.648119 IP 192.168.43.147.8880 > 192.168.43.124.7773: UDP, length 120
19:46:37.693400 IP 192.168.43.124.8880 > 192.168.43.146.7771: UDP, length 120
19:46:37.702130 IP 192.168.43.147.8880 > 192.168.43.124.7773: UDP, length 120
19:46:37.743399 IP 192.168.43.124.8880 > 192.168.43.146.7771: UDP, length 120
19:46:37.748235 IP 192.168.43.147.8880 > 192.168.43.124.7773: UDP, length 120
19:46:37.793400 IP 192.168.43.124.8880 > 192.168.43.146.7771: UDP, length 120
19:46:37.804396 IP 192.168.43.147.8880 > 192.168.43.124.7773: UDP, length 120
19:46:37.843374 IP 192.168.43.124.8880 > 192.168.43.146.7771: UDP, length 120
19:46:37.850390 IP 192.168.43.147.8880 > 192.168.43.124.7773: UDP, length 120
19:46:37.893401 IP 192.168.43.124.8880 > 192.168.43.146.7771: UDP, length 120
19:46:37.897452 IP 192.168.43.147.8880 > 192.168.43.124.7773: UDP, length 120
19:46:37.943400 IP 192.168.43.124.8880 > 192.168.43.146.7771: UDP, length 120
19:46:37.953195 IP 192.168.43.147.8880 > 192.168.43.124.7773: UDP, length 120
19:46:37.993400 IP 192.168.43.124.8880 > 192.168.43.146.7771: UDP, length 120
19:46:37.997005 IP 192.168.43.147.8880 > 192.168.43.124.7773: UDP, length 120
19:46:38.043404 IP 192.168.43.124.8880 > 192.168.43.146.7771: UDP, length 120
19:46:38.051065 IP 192.168.43.147.8880 > 192.168.43.124.7773: UDP, length 120
19:46:38.093400 IP 192.168.43.124.8880 > 192.168.43.146.7771: UDP, length 120
19:46:38.101523 IP 192.168.43.147.8880 > 192.168.43.124.7773: UDP, length 120
19:46:38.143399 IP 192.168.43.124.8880 > 192.168.43.146.7771: UDP, length 120
19:46:38.155635 IP 192.168.43.147.8880 > 192.168.43.124.7773: UDP, length 120
19:46:38.193414 IP 192.168.43.124.8880 > 192.168.43.146.7771: UDP, length 120
19:46:38.197344 IP 192.168.43.147.8880 > 192.168.43.124.7773: UDP, length 120
19:46:38.243405 IP 192.168.43.124.8880 > 192.168.43.146.7771: UDP, length 120
19:46:38.254981 IP 192.168.43.147.8880 > 192.168.43.124.7773: UDP, length 120
19:46:38.293401 IP 192.168.43.124.8880 > 192.168.43.146.7771: UDP, length 120
19:46:38.301339 IP 192.168.43.147.8880 > 192.168.43.124.7773: UDP, length 120
19:46:38.343434 IP 192.168.43.124.8880 > 192.168.43.146.7771: UDP, length 120
19:46:38.365278 IP 192.168.43.147.8880 > 192.168.43.124.7773: UDP, length 120
19:46:38.393402 IP 192.168.43.124.8880 > 192.168.43.146.7771: UDP, length 120
19:46:38.400739 IP 192.168.43.147.8880 > 192.168.43.124.7773: UDP, length 120
19:46:38.443423 IP 192.168.43.124.8880 > 192.168.43.146.7771: UDP, length 120
19:46:38.450556 IP 192.168.43.147.8880 > 192.168.43.124.7773: UDP, length 120
19:46:38.493425 IP 192.168.43.124.8880 > 192.168.43.146.7771: UDP, length 120
19:46:38.501308 IP 192.168.43.147.8880 > 192.168.43.124.7773: UDP, length 120
19:46:38.543422 IP 192.168.43.124.8880 > 192.168.43.146.7771: UDP, length 120
19:46:38.554568 IP 192.168.43.147.8880 > 192.168.43.124.7773: UDP, length 120
19:46:38.593399 IP 192.168.43.124.8880 > 192.168.43.146.7771: UDP, length 120
19:46:38.600045 IP 192.168.43.147.8880 > 192.168.43.124.7773: UDP, length 120
19:46:38.643401 IP 192.168.43.124.8880 > 192.168.43.146.7771: UDP, length 120
19:46:38.693401 IP 192.168.43.124.8880 > 192.168.43.146.7771: UDP, length 120
19:46:38.699675 IP 192.168.43.147.8880 > 192.168.43.124.7773: UDP, length 120
19:46:38.743401 IP 192.168.43.124.8880 > 192.168.43.146.7771: UDP, length 120
19:46:38.750199 IP 192.168.43.147.8880 > 192.168.43.124.7773: UDP, length 120
19:46:38.793343 IP 192.168.43.124.8880 > 192.168.43.146.7771: UDP, length 120
19:46:38.796619 IP 192.168.43.147.8880 > 192.168.43.124.7773: UDP, length 120
19:46:38.843400 IP 192.168.43.124.8880 > 192.168.43.146.7771: UDP, length 120
19:46:38.849834 IP 192.168.43.147.8880 > 192.168.43.124.7773: UDP, length 120
19:46:38.893400 IP 192.168.43.124.8880 > 192.168.43.146.7771: UDP, length 120
19:46:38.898322 IP 192.168.43.147.8880 > 192.168.43.124.7773: UDP, length 120
19:46:38.943401 IP 192.168.43.124.8880 > 192.168.43.146.7771: UDP, length 120
19:46:38.949724 IP 192.168.43.147.8880 > 192.168.43.124.7773: UDP, length 120
19:46:38.993400 IP 192.168.43.124.8880 > 192.168.43.146.7771: UDP, length 120
19:46:39.002886 IP 192.168.43.147.8880 > 192.168.43.124.7773: UDP, length 120
19:46:39.043401 IP 192.168.43.124.8880 > 192.168.43.146.7771: UDP, length 120
19:46:39.054816 IP 192.168.43.147.8880 > 192.168.43.124.7773: UDP, length 120
19:46:39.093402 IP 192.168.43.124.8880 > 192.168.43.146.7771: UDP, length 120
19:46:39.117291 IP 192.168.43.147.8880 > 192.168.43.124.7773: UDP, length 120
19:46:39.143401 IP 192.168.43.124.8880 > 192.168.43.146.7771: UDP, length 120
19:46:39.152394 IP 192.168.43.147.8880 > 192.168.43.124.7773: UDP, length 120
19:46:39.193400 IP 192.168.43.124.8880 > 192.168.43.146.7771: UDP, length 120
19:46:39.203081 IP 192.168.43.147.8880 > 192.168.43.124.7773: UDP, length 120
19:46:39.243401 IP 192.168.43.124.8880 > 192.168.43.146.7771: UDP, length 120
19:46:39.248952 IP 192.168.43.147.8880 > 192.168.43.124.7773: UDP, length 120
19:46:39.293403 IP 192.168.43.124.8880 > 192.168.43.146.7771: UDP, length 120
19:46:39.298463 IP 192.168.43.147.8880 > 192.168.43.124.7773: UDP, length 120
19:46:39.343401 IP 192.168.43.124.8880 > 192.168.43.146.7771: UDP, length 120
19:46:39.349641 IP 192.168.43.147.8880 > 192.168.43.124.7773: UDP, length 120
19:46:39.393400 IP 192.168.43.124.8880 > 192.168.43.146.7771: UDP, length 120
19:46:39.401419 IP 192.168.43.147.8880 > 192.168.43.124.7773: UDP, length 120
19:46:39.443400 IP 192.168.43.124.8880 > 192.168.43.146.7771: UDP, length 120
19:46:39.449805 IP 192.168.43.147.8880 > 192.168.43.124.7773: UDP, length 120
19:46:39.493402 IP 192.168.43.124.8880 > 192.168.43.146.7771: UDP, length 120
19:46:39.501285 IP 192.168.43.147.8880 > 192.168.43.124.7773: UDP, length 120
19:46:39.543400 IP 192.168.43.124.8880 > 192.168.43.146.7771: UDP, length 120
19:46:39.551827 IP 192.168.43.147.8880 > 192.168.43.124.7773: UDP, length 120
19:46:39.593399 IP 192.168.43.124.8880 > 192.168.43.146.7771: UDP, length 120
19:46:39.600631 IP 192.168.43.147.8880 > 192.168.43.124.7773: UDP, length 120
19:46:39.643398 IP 192.168.43.124.8880 > 192.168.43.146.7771: UDP, length 120
19:46:39.650065 IP 192.168.43.147.8880 > 192.168.43.124.7773: UDP, length 120
19:46:39.693404 IP 192.168.43.124.8880 > 192.168.43.146.7771: UDP, length 120
19:46:39.712982 IP 192.168.43.147.8880 > 192.168.43.124.7773: UDP, length 120
19:46:39.743407 IP 192.168.43.124.8880 > 192.168.43.146.7771: UDP, length 120
19:46:39.749963 IP 192.168.43.147.8880 > 192.168.43.124.7773: UDP, length 120
19:46:39.793443 IP 192.168.43.124.8880 > 192.168.43.146.7771: UDP, length 120
19:46:39.805657 IP 192.168.43.147.8880 > 192.168.43.124.7773: UDP, length 120
19:46:39.843370 IP 192.168.43.124.8880 > 192.168.43.146.7771: UDP, length 120
19:46:39.846959 IP 192.168.43.147.8880 > 192.168.43.124.7773: UDP, length 120
19:46:39.893402 IP 192.168.43.124.8880 > 192.168.43.146.7771: UDP, length 120
19:46:39.898879 IP 192.168.43.147.8880 > 192.168.43.124.7773: UDP, length 120
19:46:39.943401 IP 192.168.43.124.8880 > 192.168.43.146.7771: UDP, length 120
19:46:39.950120 IP 192.168.43.147.8880 > 192.168.43.124.7773: UDP, length 120
19:46:39.993401 IP 192.168.43.124.8880 > 192.168.43.146.7771: UDP, length 120
19:46:39.999003 IP 192.168.43.147.8880 > 192.168.43.124.7773: UDP, length 120
19:46:40.043405 IP 192.168.43.124.8880 > 192.168.43.146.7771: UDP, length 120
19:46:40.046742 IP 192.168.43.147.8880 > 192.168.43.124.7773: UDP, length 120
19:46:40.093405 IP 192.168.43.124.8880 > 192.168.43.146.7771: UDP, length 120
19:46:40.101814 IP 192.168.43.147.8880 > 192.168.43.124.7773: UDP, length 120
19:46:40.143401 IP 192.168.43.124.8880 > 192.168.43.146.7771: UDP, length 120
19:46:40.152937 IP 192.168.43.147.8880 > 192.168.43.124.7773: UDP, length 120
19:46:40.193401 IP 192.168.43.124.8880 > 192.168.43.146.7771: UDP, length 120
19:46:40.243400 IP 192.168.43.124.8880 > 192.168.43.146.7771: UDP, length 120
19:46:40.259396 IP 192.168.43.147.8880 > 192.168.43.124.7773: UDP, length 120
19:46:40.263450 IP 192.168.43.147.8880 > 192.168.43.124.7773: UDP, length 120
19:46:40.293400 IP 192.168.43.124.8880 > 192.168.43.146.7771: UDP, length 120
19:46:40.303943 IP 192.168.43.147.8880 > 192.168.43.124.7773: UDP, length 120
19:46:40.343401 IP 192.168.43.124.8880 > 192.168.43.146.7771: UDP, length 120
19:46:40.347821 IP 192.168.43.147.8880 > 192.168.43.124.7773: UDP, length 120
19:46:40.393401 IP 192.168.43.124.8880 > 192.168.43.146.7771: UDP, length 120
19:46:40.406534 IP 192.168.43.147.8880 > 192.168.43.124.7773: UDP, length 120
19:46:40.443449 IP 192.168.43.124.8880 > 192.168.43.146.7771: UDP, length 120
19:46:40.451208 IP 192.168.43.147.8880 > 192.168.43.124.7773: UDP, length 120
19:46:40.493450 IP 192.168.43.124.8880 > 192.168.43.146.7771: UDP, length 120
19:46:40.501350 IP 192.168.43.147.8880 > 192.168.43.124.7773: UDP, length 120
19:46:40.543453 IP 192.168.43.124.8880 > 192.168.43.146.7771: UDP, length 120
19:46:40.551243 IP 192.168.43.147.8880 > 192.168.43.124.7773: UDP, length 120
19:46:40.593452 IP 192.168.43.124.8880 > 192.168.43.146.7771: UDP, length 120
19:46:40.601214 IP 192.168.43.147.8880 > 192.168.43.124.7773: UDP, length 120
19:46:40.643452 IP 192.168.43.124.8880 > 192.168.43.146.7771: UDP, length 120
19:46:40.650376 IP 192.168.43.147.8880 > 192.168.43.124.7773: UDP, length 120
19:46:40.693451 IP 192.168.43.124.8880 > 192.168.43.146.7771: UDP, length 120
19:46:40.702589 IP 192.168.43.147.8880 > 192.168.43.124.7773: UDP, length 120
19:46:40.743452 IP 192.168.43.124.8880 > 192.168.43.146.7771: UDP, length 120
19:46:40.748373 IP 192.168.43.147.8880 > 192.168.43.124.7773: UDP, length 120
19:46:40.793337 IP 192.168.43.124.8880 > 192.168.43.146.7771: UDP, length 120
19:46:40.843354 IP 192.168.43.124.8880 > 192.168.43.146.7771: UDP, length 120
19:46:40.846536 IP 192.168.43.147.8880 > 192.168.43.124.7773: UDP, length 120
19:46:40.893407 IP 192.168.43.124.8880 > 192.168.43.146.7771: UDP, length 120
19:46:40.943407 IP 192.168.43.124.8880 > 192.168.43.146.7771: UDP, length 120
19:46:40.950286 IP 192.168.43.147.8880 > 192.168.43.124.7773: UDP, length 120
19:46:40.993450 IP 192.168.43.124.8880 > 192.168.43.146.7771: UDP, length 120
19:46:41.030860 IP 192.168.43.147.8880 > 192.168.43.124.7773: UDP, length 120
19:46:41.043454 IP 192.168.43.124.8880 > 192.168.43.146.7771: UDP, length 120
19:46:41.050385 IP 192.168.43.147.8880 > 192.168.43.124.7773: UDP, length 120
19:46:41.093452 IP 192.168.43.124.8880 > 192.168.43.146.7771: UDP, length 120
19:46:41.102331 IP 192.168.43.147.8880 > 192.168.43.124.7773: UDP, length 120
19:46:41.143436 IP 192.168.43.124.8880 > 192.168.43.146.7771: UDP, length 120
19:46:41.152295 IP 192.168.43.147.8880 > 192.168.43.124.7773: UDP, length 120
19:46:41.193330 IP 192.168.43.124.8880 > 192.168.43.146.7771: UDP, length 120
19:46:41.203420 IP 192.168.43.147.8880 > 192.168.43.124.7773: UDP, length 120
19:46:41.243409 IP 192.168.43.124.8880 > 192.168.43.146.7771: UDP, length 120
19:46:41.254243 IP 192.168.43.147.8880 > 192.168.43.124.7773: UDP, length 120
19:46:41.293401 IP 192.168.43.124.8880 > 192.168.43.146.7771: UDP, length 120
19:46:41.305823 IP 192.168.43.147.8880 > 192.168.43.124.7773: UDP, length 120
19:46:41.343461 IP 192.168.43.124.8880 > 192.168.43.146.7771: UDP, length 120
19:46:41.355460 IP 192.168.43.147.8880 > 192.168.43.124.7773: UDP, length 120
19:46:41.393403 IP 192.168.43.124.8880 > 192.168.43.146.7771: UDP, length 120
19:46:41.400013 IP 192.168.43.147.8880 > 192.168.43.124.7773: UDP, length 120
19:46:41.443454 IP 192.168.43.124.8880 > 192.168.43.146.7771: UDP, length 120
19:46:41.450384 IP 192.168.43.147.8880 > 192.168.43.124.7773: UDP, length 120
19:46:41.493451 IP 192.168.43.124.8880 > 192.168.43.146.7771: UDP, length 120
19:46:41.498477 IP 192.168.43.147.8880 > 192.168.43.124.7773: UDP, length 120
19:46:41.543405 IP 192.168.43.124.8880 > 192.168.43.146.7771: UDP, length 120
19:46:41.552453 IP 192.168.43.147.8880 > 192.168.43.124.7773: UDP, length 120
19:46:41.593370 IP 192.168.43.124.8880 > 192.168.43.146.7771: UDP, length 120
19:46:41.599789 IP 192.168.43.147.8880 > 192.168.43.124.7773: UDP, length 120
19:46:41.643407 IP 192.168.43.124.8880 > 192.168.43.146.7771: UDP, length 120
19:46:41.647744 IP 192.168.43.147.8880 > 192.168.43.124.7773: UDP, length 120
19:46:41.693350 IP 192.168.43.124.8880 > 192.168.43.146.7771: UDP, length 120
19:46:41.698289 IP 192.168.43.147.8880 > 192.168.43.124.7773: UDP, length 120
19:46:41.743406 IP 192.168.43.124.8880 > 192.168.43.146.7771: UDP, length 120
19:46:41.749295 IP 192.168.43.147.8880 > 192.168.43.124.7773: UDP, length 120
19:46:41.793400 IP 192.168.43.124.8880 > 192.168.43.146.7771: UDP, length 120
19:46:41.798102 IP 192.168.43.147.8880 > 192.168.43.124.7773: UDP, length 120
19:46:41.843402 IP 192.168.43.124.8880 > 192.168.43.146.7771: UDP, length 120
19:46:41.859372 IP 192.168.43.147.8880 > 192.168.43.124.7773: UDP, length 120
19:46:41.893400 IP 192.168.43.124.8880 > 192.168.43.146.7771: UDP, length 120
19:46:41.901347 IP 192.168.43.147.8880 > 192.168.43.124.7773: UDP, length 120
19:46:41.943363 IP 192.168.43.124.8880 > 192.168.43.146.7771: UDP, length 120
19:46:41.951050 IP 192.168.43.147.8880 > 192.168.43.124.7773: UDP, length 120
19:46:41.993402 IP 192.168.43.124.8880 > 192.168.43.146.7771: UDP, length 120
19:46:42.004028 IP 192.168.43.147.8880 > 192.168.43.124.7773: UDP, length 120
19:46:42.043401 IP 192.168.43.124.8880 > 192.168.43.146.7771: UDP, length 120
19:46:42.048632 IP 192.168.43.147.8880 > 192.168.43.124.7773: UDP, length 120
19:46:42.093402 IP 192.168.43.124.8880 > 192.168.43.146.7771: UDP, length 120
19:46:42.099874 IP 192.168.43.147.8880 > 192.168.43.124.7773: UDP, length 120
