23:46:28.259561 IP 192.168.43.124.8880 > 192.168.43.146.7771: UDP, length 120
23:46:28.311808 IP 192.168.43.124.8880 > 192.168.43.146.7771: UDP, length 120
23:46:28.359690 IP 192.168.43.124.8880 > 192.168.43.146.7771: UDP, length 120
23:46:28.411859 IP 192.168.43.124.8880 > 192.168.43.146.7771: UDP, length 120
23:46:28.459946 IP 192.168.43.124.8880 > 192.168.43.146.7771: UDP, length 120
23:46:28.511162 IP 192.168.43.124.8880 > 192.168.43.146.7771: UDP, length 120
23:46:28.560466 IP 192.168.43.124.8880 > 192.168.43.146.7771: UDP, length 120
23:46:28.609690 IP 192.168.43.124.8880 > 192.168.43.146.7771: UDP, length 120
23:46:28.659273 IP 192.168.43.124.8880 > 192.168.43.146.7771: UDP, length 120
23:46:28.710432 IP 192.168.43.124.8880 > 192.168.43.146.7771: UDP, length 120
23:46:28.755115 IP 192.168.43.124.8880 > 192.168.43.146.7771: UDP, length 120
23:46:28.757948 IP 192.168.43.146.8880 > 192.168.43.147.7772: UDP, length 120
23:46:28.808007 IP 192.168.43.146.8880 > 192.168.43.147.7772: UDP, length 120
23:46:28.808726 IP 192.168.43.124.8880 > 192.168.43.146.7771: UDP, length 120
23:46:28.858030 IP 192.168.43.146.8880 > 192.168.43.147.7772: UDP, length 120
23:46:28.858285 IP 192.168.43.124.8880 > 192.168.43.146.7771: UDP, length 120
23:46:28.907985 IP 192.168.43.146.8880 > 192.168.43.147.7772: UDP, length 120
23:46:28.909230 IP 192.168.43.124.8880 > 192.168.43.146.7771: UDP, length 120
23:46:28.957980 IP 192.168.43.146.8880 > 192.168.43.147.7772: UDP, length 120
23:46:28.959724 IP 192.168.43.124.8880 > 192.168.43.146.7771: UDP, length 120
23:46:29.007948 IP 192.168.43.124.8880 > 192.168.43.146.7771: UDP, length 120
23:46:29.007978 IP 192.168.43.146.8880 > 192.168.43.147.7772: UDP, length 120
23:46:29.057979 IP 192.168.43.146.8880 > 192.168.43.147.7772: UDP, length 120
23:46:29.059589 IP 192.168.43.124.8880 > 192.168.43.146.7771: UDP, length 120
23:46:29.107976 IP 192.168.43.146.8880 > 192.168.43.147.7772: UDP, length 120
23:46:29.110028 IP 192.168.43.124.8880 > 192.168.43.146.7771: UDP, length 120
23:46:29.157978 IP 192.168.43.146.8880 > 192.168.43.147.7772: UDP, length 120
23:46:29.159562 IP 192.168.43.124.8880 > 192.168.43.146.7771: UDP, length 120
23:46:29.207977 IP 192.168.43.146.8880 > 192.168.43.147.7772: UDP, length 120
23:46:29.209671 IP 192.168.43.124.8880 > 192.168.43.146.7771: UDP, length 120
23:46:29.257977 IP 192.168.43.146.8880 > 192.168.43.147.7772: UDP, length 120
23:46:29.259685 IP 192.168.43.124.8880 > 192.168.43.146.7771: UDP, length 120
23:46:29.307977 IP 192.168.43.146.8880 > 192.168.43.147.7772: UDP, length 120
23:46:29.309276 IP 192.168.43.124.8880 > 192.168.43.146.7771: UDP, length 120
23:46:29.357977 IP 192.168.43.146.8880 > 192.168.43.147.7772: UDP, length 120
23:46:29.359616 IP 192.168.43.124.8880 > 192.168.43.146.7771: UDP, length 120
23:46:29.407977 IP 192.168.43.146.8880 > 192.168.43.147.7772: UDP, length 120
23:46:29.409573 IP 192.168.43.124.8880 > 192.168.43.146.7771: UDP, length 120
23:46:29.457977 IP 192.168.43.146.8880 > 192.168.43.147.7772: UDP, length 120
23:46:29.459767 IP 192.168.43.124.8880 > 192.168.43.146.7771: UDP, length 120
23:46:29.507987 IP 192.168.43.146.8880 > 192.168.43.147.7772: UDP, length 120
23:46:29.557979 IP 192.168.43.146.8880 > 192.168.43.147.7772: UDP, length 120
23:46:29.602879 IP 192.168.43.124.8880 > 192.168.43.146.7771: UDP, length 120
23:46:29.603033 IP 192.168.43.124.8880 > 192.168.43.146.7771: UDP, length 120
23:46:29.607976 IP 192.168.43.146.8880 > 192.168.43.147.7772: UDP, length 120
23:46:29.657977 IP 192.168.43.146.8880 > 192.168.43.147.7772: UDP, length 120
23:46:29.698063 IP 192.168.43.124.8880 > 192.168.43.146.7771: UDP, length 120
23:46:29.698302 IP 192.168.43.124.8880 > 192.168.43.146.7771: UDP, length 120
23:46:29.707978 IP 192.168.43.146.8880 > 192.168.43.147.7772: UDP, length 120
23:46:29.757979 IP 192.168.43.146.8880 > 192.168.43.147.7772: UDP, length 120
23:46:29.801415 IP 192.168.43.124.8880 > 192.168.43.146.7771: UDP, length 120
23:46:29.801517 IP 192.168.43.124.8880 > 192.168.43.146.7771: UDP, length 120
23:46:29.807997 IP 192.168.43.146.8880 > 192.168.43.147.7772: UDP, length 120
23:46:29.858033 IP 192.168.43.146.8880 > 192.168.43.147.7772: UDP, length 120
23:46:29.902936 IP 192.168.43.124.8880 > 192.168.43.146.7771: UDP, length 120
23:46:29.903698 IP 192.168.43.124.8880 > 192.168.43.146.7771: UDP, length 120
23:46:29.907994 IP 192.168.43.146.8880 > 192.168.43.147.7772: UDP, length 120
23:46:29.957980 IP 192.168.43.146.8880 > 192.168.43.147.7772: UDP, length 120
23:46:30.002874 IP 192.168.43.124.8880 > 192.168.43.146.7771: UDP, length 120
23:46:30.003030 IP 192.168.43.124.8880 > 192.168.43.146.7771: UDP, length 120
23:46:30.007978 IP 192.168.43.146.8880 > 192.168.43.147.7772: UDP, length 120
23:46:30.057978 IP 192.168.43.146.8880 > 192.168.43.147.7772: UDP, length 120
23:46:30.101288 IP 192.168.43.124.8880 > 192.168.43.146.7771: UDP, length 120
23:46:30.101452 IP 192.168.43.124.8880 > 192.168.43.146.7771: UDP, length 120
23:46:30.107979 IP 192.168.43.146.8880 > 192.168.43.147.7772: UDP, length 120
23:46:30.157977 IP 192.168.43.146.8880 > 192.168.43.147.7772: UDP, length 120
23:46:30.204224 IP 192.168.43.124.8880 > 192.168.43.146.7771: UDP, length 120
23:46:30.204354 IP 192.168.43.124.8880 > 192.168.43.146.7771: UDP, length 120
23:46:30.208010 IP 192.168.43.146.8880 > 192.168.43.147.7772: UDP, length 120
23:46:30.257982 IP 192.168.43.146.8880 > 192.168.43.147.7772: UDP, length 120
23:46:30.303101 IP 192.168.43.124.8880 > 192.168.43.146.7771: UDP, length 120
23:46:30.303265 IP 192.168.43.124.8880 > 192.168.43.146.7771: UDP, length 120
23:46:30.307978 IP 192.168.43.146.8880 > 192.168.43.147.7772: UDP, length 120
23:46:30.357976 IP 192.168.43.146.8880 > 192.168.43.147.7772: UDP, length 120
23:46:30.405343 IP 192.168.43.124.8880 > 192.168.43.146.7771: UDP, length 120
23:46:30.405489 IP 192.168.43.124.8880 > 192.168.43.146.7771: UDP, length 120
23:46:30.407979 IP 192.168.43.146.8880 > 192.168.43.147.7772: UDP, length 120
23:46:30.457977 IP 192.168.43.146.8880 > 192.168.43.147.7772: UDP, length 120
23:46:30.503076 IP 192.168.43.124.8880 > 192.168.43.146.7771: UDP, length 120
23:46:30.503215 IP 192.168.43.124.8880 > 192.168.43.146.7771: UDP, length 120
23:46:30.507976 IP 192.168.43.146.8880 > 192.168.43.147.7772: UDP, length 120
23:46:30.557978 IP 192.168.43.146.8880 > 192.168.43.147.7772: UDP, length 120
23:46:30.605167 IP 192.168.43.124.8880 > 192.168.43.146.7771: UDP, length 120
23:46:30.605319 IP 192.168.43.124.8880 > 192.168.43.146.7771: UDP, length 120
23:46:30.607978 IP 192.168.43.146.8880 > 192.168.43.147.7772: UDP, length 120
23:46:30.657976 IP 192.168.43.146.8880 > 192.168.43.147.7772: UDP, length 120
23:46:30.703086 IP 192.168.43.124.8880 > 192.168.43.146.7771: UDP, length 120
23:46:30.703232 IP 192.168.43.124.8880 > 192.168.43.146.7771: UDP, length 120
23:46:30.707978 IP 192.168.43.146.8880 > 192.168.43.147.7772: UDP, length 120
23:46:30.757977 IP 192.168.43.146.8880 > 192.168.43.147.7772: UDP, length 120
23:46:30.801130 IP 192.168.43.124.8880 > 192.168.43.146.7771: UDP, length 120
23:46:30.808008 IP 192.168.43.146.8880 > 192.168.43.147.7772: UDP, length 120
23:46:30.858035 IP 192.168.43.146.8880 > 192.168.43.147.7772: UDP, length 120
23:46:30.907990 IP 192.168.43.146.8880 > 192.168.43.147.7772: UDP, length 120
23:46:30.957979 IP 192.168.43.146.8880 > 192.168.43.147.7772: UDP, length 120
23:46:30.969430 IP 192.168.43.124.8880 > 192.168.43.146.7771: UDP, length 120
23:46:30.971994 IP 192.168.43.124.8880 > 192.168.43.146.7771: UDP, length 120
23:46:30.972080 IP 192.168.43.124.8880 > 192.168.43.146.7771: UDP, length 120
23:46:30.974706 IP 192.168.43.124.8880 > 192.168.43.146.7771: UDP, length 120
23:46:31.007988 IP 192.168.43.146.8880 > 192.168.43.147.7772: UDP, length 120
23:46:31.057979 IP 192.168.43.146.8880 > 192.168.43.147.7772: UDP, length 120
23:46:31.093463 IP 192.168.43.124.8880 > 192.168.43.146.7771: UDP, length 120
23:46:31.093603 IP 192.168.43.124.8880 > 192.168.43.146.7771: UDP, length 120
23:46:31.107979 IP 192.168.43.146.8880 > 192.168.43.147.7772: UDP, length 120
23:46:31.157976 IP 192.168.43.146.8880 > 192.168.43.147.7772: UDP, length 120
23:46:31.202861 IP 192.168.43.124.8880 > 192.168.43.146.7771: UDP, length 120
23:46:31.202939 IP 192.168.43.124.8880 > 192.168.43.146.7771: UDP, length 120
23:46:31.207977 IP 192.168.43.146.8880 > 192.168.43.147.7772: UDP, length 120
23:46:31.257979 IP 192.168.43.146.8880 > 192.168.43.147.7772: UDP, length 120
23:46:31.304777 IP 192.168.43.124.8880 > 192.168.43.146.7771: UDP, length 120
23:46:31.304851 IP 192.168.43.124.8880 > 192.168.43.146.7771: UDP, length 120
23:46:31.307975 IP 192.168.43.146.8880 > 192.168.43.147.7772: UDP, length 120
23:46:31.357976 IP 192.168.43.146.8880 > 192.168.43.147.7772: UDP, length 120
23:46:31.403218 IP 192.168.43.124.8880 > 192.168.43.146.7771: UDP, length 120
23:46:31.403294 IP 192.168.43.124.8880 > 192.168.43.146.7771: UDP, length 120
23:46:31.407978 IP 192.168.43.146.8880 > 192.168.43.147.7772: UDP, length 120
23:46:31.457977 IP 192.168.43.146.8880 > 192.168.43.147.7772: UDP, length 120
23:46:31.506483 IP 192.168.43.124.8880 > 192.168.43.146.7771: UDP, length 120
23:46:31.506557 IP 192.168.43.124.8880 > 192.168.43.146.7771: UDP, length 120
23:46:31.507975 IP 192.168.43.146.8880 > 192.168.43.147.7772: UDP, length 120
23:46:31.557981 IP 192.168.43.146.8880 > 192.168.43.147.7772: UDP, length 120
23:46:31.604327 IP 192.168.43.124.8880 > 192.168.43.146.7771: UDP, length 120
23:46:31.604407 IP 192.168.43.124.8880 > 192.168.43.146.7771: UDP, length 120
23:46:31.607976 IP 192.168.43.146.8880 > 192.168.43.147.7772: UDP, length 120
23:46:31.657978 IP 192.168.43.146.8880 > 192.168.43.147.7772: UDP, length 120
23:46:31.706117 IP 192.168.43.124.8880 > 192.168.43.146.7771: UDP, length 120
23:46:31.706229 IP 192.168.43.124.8880 > 192.168.43.146.7771: UDP, length 120
23:46:31.708006 IP 192.168.43.146.8880 > 192.168.43.147.7772: UDP, length 120
23:46:31.757981 IP 192.168.43.146.8880 > 192.168.43.147.7772: UDP, length 120
23:46:31.802907 IP 192.168.43.124.8880 > 192.168.43.146.7771: UDP, length 120
23:46:31.803001 IP 192.168.43.124.8880 > 192.168.43.146.7771: UDP, length 120
23:46:31.807988 IP 192.168.43.146.8880 > 192.168.43.147.7772: UDP, length 120
23:46:31.858064 IP 192.168.43.146.8880 > 192.168.43.147.7772: UDP, length 120
23:46:31.902907 IP 192.168.43.124.8880 > 192.168.43.146.7771: UDP, length 120
23:46:31.903016 IP 192.168.43.124.8880 > 192.168.43.146.7771: UDP, length 120
23:46:31.908008 IP 192.168.43.146.8880 > 192.168.43.147.7772: UDP, length 120
23:46:31.957982 IP 192.168.43.146.8880 > 192.168.43.147.7772: UDP, length 120
23:46:32.002989 IP 192.168.43.124.8880 > 192.168.43.146.7771: UDP, length 120
23:46:32.003068 IP 192.168.43.124.8880 > 192.168.43.146.7771: UDP, length 120
23:46:32.007975 IP 192.168.43.146.8880 > 192.168.43.147.7772: UDP, length 120
23:46:32.057978 IP 192.168.43.146.8880 > 192.168.43.147.7772: UDP, length 120
23:46:32.103115 IP 192.168.43.124.8880 > 192.168.43.146.7771: UDP, length 120
23:46:32.103192 IP 192.168.43.124.8880 > 192.168.43.146.7771: UDP, length 120
23:46:32.107982 IP 192.168.43.146.8880 > 192.168.43.147.7772: UDP, length 120
23:46:32.157988 IP 192.168.43.146.8880 > 192.168.43.147.7772: UDP, length 120
23:46:32.207978 IP 192.168.43.146.8880 > 192.168.43.147.7772: UDP, length 120
23:46:32.211254 IP 192.168.43.124.8880 > 192.168.43.146.7771: UDP, length 120
23:46:32.211550 IP 192.168.43.124.8880 > 192.168.43.146.7771: UDP, length 120
23:46:32.211621 IP 192.168.43.124.8880 > 192.168.43.146.7771: UDP, length 120
23:46:32.257977 IP 192.168.43.146.8880 > 192.168.43.147.7772: UDP, length 120
23:46:32.307975 IP 192.168.43.146.8880 > 192.168.43.147.7772: UDP, length 120
23:46:32.353160 IP 192.168.43.124.8880 > 192.168.43.146.7771: UDP, length 120
23:46:32.353233 IP 192.168.43.124.8880 > 192.168.43.146.7771: UDP, length 120
23:46:32.356625 IP 192.168.43.124.8880 > 192.168.43.146.7771: UDP, length 120
23:46:32.357975 IP 192.168.43.146.8880 > 192.168.43.147.7772: UDP, length 120
23:46:32.407976 IP 192.168.43.146.8880 > 192.168.43.147.7772: UDP, length 120
23:46:32.409587 IP 192.168.43.124.8880 > 192.168.43.146.7771: UDP, length 120
23:46:32.457978 IP 192.168.43.146.8880 > 192.168.43.147.7772: UDP, length 120
23:46:32.459597 IP 192.168.43.124.8880 > 192.168.43.146.7771: UDP, length 120
23:46:32.507975 IP 192.168.43.146.8880 > 192.168.43.147.7772: UDP, length 120
23:46:32.510647 IP 192.168.43.124.8880 > 192.168.43.146.7771: UDP, length 120
23:46:32.557976 IP 192.168.43.146.8880 > 192.168.43.147.7772: UDP, length 120
23:46:32.559552 IP 192.168.43.124.8880 > 192.168.43.146.7771: UDP, length 120
23:46:32.607975 IP 192.168.43.146.8880 > 192.168.43.147.7772: UDP, length 120
23:46:32.610939 IP 192.168.43.124.8880 > 192.168.43.146.7771: UDP, length 120
23:46:32.658004 IP 192.168.43.146.8880 > 192.168.43.147.7772: UDP, length 120
23:46:32.659755 IP 192.168.43.124.8880 > 192.168.43.146.7771: UDP, length 120
23:46:32.708003 IP 192.168.43.146.8880 > 192.168.43.147.7772: UDP, length 120
23:46:32.710073 IP 192.168.43.124.8880 > 192.168.43.146.7771: UDP, length 120
23:46:32.758002 IP 192.168.43.146.8880 > 192.168.43.147.7772: UDP, length 120
23:46:32.760329 IP 192.168.43.124.8880 > 192.168.43.146.7771: UDP, length 120
23:46:32.808020 IP 192.168.43.146.8880 > 192.168.43.147.7772: UDP, length 120
23:46:32.811495 IP 192.168.43.124.8880 > 192.168.43.146.7771: UDP, length 120
23:46:32.858021 IP 192.168.43.146.8880 > 192.168.43.147.7772: UDP, length 120
23:46:32.858210 IP 192.168.43.124.8880 > 192.168.43.146.7771: UDP, length 120
23:46:32.908011 IP 192.168.43.146.8880 > 192.168.43.147.7772: UDP, length 120
23:46:32.909974 IP 192.168.43.124.8880 > 192.168.43.146.7771: UDP, length 120
23:46:32.958006 IP 192.168.43.146.8880 > 192.168.43.147.7772: UDP, length 120
23:46:32.960245 IP 192.168.43.124.8880 > 192.168.43.146.7771: UDP, length 120
23:46:33.008009 IP 192.168.43.146.8880 > 192.168.43.147.7772: UDP, length 120
23:46:33.010652 IP 192.168.43.124.8880 > 192.168.43.146.7771: UDP, length 120
23:46:33.058005 IP 192.168.43.146.8880 > 192.168.43.147.7772: UDP, length 120
23:46:33.059833 IP 192.168.43.124.8880 > 192.168.43.146.7771: UDP, length 120
23:46:33.108003 IP 192.168.43.146.8880 > 192.168.43.147.7772: UDP, length 120
23:46:33.110922 IP 192.168.43.124.8880 > 192.168.43.146.7771: UDP, length 120
23:46:33.158002 IP 192.168.43.146.8880 > 192.168.43.147.7772: UDP, length 120
23:46:33.160030 IP 192.168.43.124.8880 > 192.168.43.146.7771: UDP, length 120
23:46:33.208054 IP 192.168.43.146.8880 > 192.168.43.147.7772: UDP, length 120
23:46:33.209918 IP 192.168.43.124.8880 > 192.168.43.146.7771: UDP, length 120
23:46:33.258056 IP 192.168.43.146.8880 > 192.168.43.147.7772: UDP, length 120
23:46:33.261296 IP 192.168.43.124.8880 > 192.168.43.146.7771: UDP, length 120
23:46:33.308003 IP 192.168.43.146.8880 > 192.168.43.147.7772: UDP, length 120
23:46:33.310782 IP 192.168.43.124.8880 > 192.168.43.146.7771: UDP, length 120
23:46:33.355967 IP 192.168.43.124.8880 > 192.168.43.146.7771: UDP, length 120
23:46:33.358012 IP 192.168.43.146.8880 > 192.168.43.147.7772: UDP, length 120
23:46:33.408003 IP 192.168.43.146.8880 > 192.168.43.147.7772: UDP, length 120
23:46:33.410980 IP 192.168.43.124.8880 > 192.168.43.146.7771: UDP, length 120
23:46:33.458004 IP 192.168.43.146.8880 > 192.168.43.147.7772: UDP, length 120
23:46:33.459658 IP 192.168.43.124.8880 > 192.168.43.146.7771: UDP, length 120
23:46:33.507990 IP 192.168.43.146.8880 > 192.168.43.147.7772: UDP, length 120
23:46:33.509656 IP 192.168.43.124.8880 > 192.168.43.146.7771: UDP, length 120
23:46:33.558003 IP 192.168.43.146.8880 > 192.168.43.147.7772: UDP, length 120
23:46:33.559894 IP 192.168.43.124.8880 > 192.168.43.146.7771: UDP, length 120
23:46:33.608091 IP 192.168.43.146.8880 > 192.168.43.147.7772: UDP, length 120
23:46:33.614171 IP 192.168.43.124.8880 > 192.168.43.146.7771: UDP, length 120
23:46:33.658135 IP 192.168.43.146.8880 > 192.168.43.147.7772: UDP, length 120
23:46:33.661915 IP 192.168.43.124.8880 > 192.168.43.146.7771: UDP, length 120
23:46:33.708112 IP 192.168.43.146.8880 > 192.168.43.147.7772: UDP, length 120
23:46:33.710209 IP 192.168.43.124.8880 > 192.168.43.146.7771: UDP, length 120
23:46:33.758032 IP 192.168.43.146.8880 > 192.168.43.147.7772: UDP, length 120
23:46:33.759461 IP 192.168.43.124.8880 > 192.168.43.146.7771: UDP, length 120
23:46:33.808070 IP 192.168.43.146.8880 > 192.168.43.147.7772: UDP, length 120
23:46:33.809589 IP 192.168.43.124.8880 > 192.168.43.146.7771: UDP, length 120
23:46:33.858048 IP 192.168.43.146.8880 > 192.168.43.147.7772: UDP, length 120
23:46:33.860953 IP 192.168.43.124.8880 > 192.168.43.146.7771: UDP, length 120
23:46:33.908070 IP 192.168.43.146.8880 > 192.168.43.147.7772: UDP, length 120
23:46:33.910694 IP 192.168.43.124.8880 > 192.168.43.146.7771: UDP, length 120
23:46:33.958666 IP 192.168.43.146.8880 > 192.168.43.147.7772: UDP, length 120
23:46:33.958872 IP 192.168.43.124.8880 > 192.168.43.146.7771: UDP, length 120
23:46:34.008078 IP 192.168.43.146.8880 > 192.168.43.147.7772: UDP, length 120
23:46:34.011451 IP 192.168.43.124.8880 > 192.168.43.146.7771: UDP, length 120
23:46:34.058088 IP 192.168.43.146.8880 > 192.168.43.147.7772: UDP, length 120
23:46:34.061146 IP 192.168.43.124.8880 > 192.168.43.146.7771: UDP, length 120
23:46:34.108010 IP 192.168.43.146.8880 > 192.168.43.147.7772: UDP, length 120
23:46:34.111255 IP 192.168.43.124.8880 > 192.168.43.146.7771: UDP, length 120
23:46:34.157982 IP 192.168.43.146.8880 > 192.168.43.147.7772: UDP, length 120
23:46:34.159061 IP 192.168.43.124.8880 > 192.168.43.146.7771: UDP, length 120
23:46:34.207974 IP 192.168.43.146.8880 > 192.168.43.147.7772: UDP, length 120
23:46:34.209339 IP 192.168.43.124.8880 > 192.168.43.146.7771: UDP, length 120
23:46:34.257974 IP 192.168.43.146.8880 > 192.168.43.147.7772: UDP, length 120
23:46:34.260535 IP 192.168.43.124.8880 > 192.168.43.146.7771: UDP, length 120
23:46:34.307964 IP 192.168.43.146.8880 > 192.168.43.147.7772: UDP, length 120
23:46:34.309312 IP 192.168.43.124.8880 > 192.168.43.146.7771: UDP, length 120
23:46:34.357973 IP 192.168.43.146.8880 > 192.168.43.147.7772: UDP, length 120
23:46:34.359524 IP 192.168.43.124.8880 > 192.168.43.146.7771: UDP, length 120
23:46:34.407965 IP 192.168.43.146.8880 > 192.168.43.147.7772: UDP, length 120
23:46:34.409600 IP 192.168.43.124.8880 > 192.168.43.146.7771: UDP, length 120
23:46:34.457972 IP 192.168.43.146.8880 > 192.168.43.147.7772: UDP, length 120
23:46:34.459930 IP 192.168.43.124.8880 > 192.168.43.146.7771: UDP, length 120
23:46:34.507963 IP 192.168.43.146.8880 > 192.168.43.147.7772: UDP, length 120
23:46:34.508935 IP 192.168.43.124.8880 > 192.168.43.146.7771: UDP, length 120
23:46:34.557974 IP 192.168.43.146.8880 > 192.168.43.147.7772: UDP, length 120
23:46:34.559399 IP 192.168.43.124.8880 > 192.168.43.146.7771: UDP, length 120
23:46:34.607981 IP 192.168.43.146.8880 > 192.168.43.147.7772: UDP, length 120
23:46:34.657975 IP 192.168.43.146.8880 > 192.168.43.147.7772: UDP, length 120
23:46:34.707964 IP 192.168.43.146.8880 > 192.168.43.147.7772: UDP, length 120
23:46:34.758005 IP 192.168.43.146.8880 > 192.168.43.147.7772: UDP, length 120
23:46:34.761280 IP 192.168.43.124.8880 > 192.168.43.146.7771: UDP, length 120
23:46:34.761380 IP 192.168.43.124.8880 > 192.168.43.146.7771: UDP, length 120
23:46:34.761452 IP 192.168.43.124.8880 > 192.168.43.146.7771: UDP, length 120
23:46:34.807988 IP 192.168.43.146.8880 > 192.168.43.147.7772: UDP, length 120
23:46:34.857975 IP 192.168.43.146.8880 > 192.168.43.147.7772: UDP, length 120
23:46:34.870161 IP 192.168.43.124.8880 > 192.168.43.146.7771: UDP, length 120
23:46:34.870371 IP 192.168.43.124.8880 > 192.168.43.146.7771: UDP, length 120
23:46:34.907970 IP 192.168.43.146.8880 > 192.168.43.147.7772: UDP, length 120
23:46:34.957973 IP 192.168.43.146.8880 > 192.168.43.147.7772: UDP, length 120
23:46:34.969249 IP 192.168.43.124.8880 > 192.168.43.146.7771: UDP, length 120
23:46:34.969322 IP 192.168.43.124.8880 > 192.168.43.146.7771: UDP, length 120
23:46:35.008056 IP 192.168.43.146.8880 > 192.168.43.147.7772: UDP, length 120
23:46:35.058027 IP 192.168.43.146.8880 > 192.168.43.147.7772: UDP, length 120
23:46:35.103803 IP 192.168.43.124.8880 > 192.168.43.146.7771: UDP, length 120
23:46:35.103951 IP 192.168.43.124.8880 > 192.168.43.146.7771: UDP, length 120
23:46:35.107991 IP 192.168.43.146.8880 > 192.168.43.147.7772: UDP, length 120
23:46:35.157976 IP 192.168.43.146.8880 > 192.168.43.147.7772: UDP, length 120
23:46:35.200542 IP 192.168.43.124.8880 > 192.168.43.146.7771: UDP, length 120
23:46:35.200682 IP 192.168.43.124.8880 > 192.168.43.146.7771: UDP, length 120
23:46:35.207976 IP 192.168.43.146.8880 > 192.168.43.147.7772: UDP, length 120
23:46:35.257974 IP 192.168.43.146.8880 > 192.168.43.147.7772: UDP, length 120
23:46:35.302574 IP 192.168.43.124.8880 > 192.168.43.146.7771: UDP, length 120
23:46:35.304268 IP 192.168.43.124.8880 > 192.168.43.146.7771: UDP, length 120
23:46:35.307974 IP 192.168.43.146.8880 > 192.168.43.147.7772: UDP, length 120
23:46:35.357973 IP 192.168.43.146.8880 > 192.168.43.147.7772: UDP, length 120
23:46:35.402621 IP 192.168.43.124.8880 > 192.168.43.146.7771: UDP, length 120
23:46:35.402759 IP 192.168.43.124.8880 > 192.168.43.146.7771: UDP, length 120
23:46:35.407975 IP 192.168.43.146.8880 > 192.168.43.147.7772: UDP, length 120
23:46:35.457976 IP 192.168.43.146.8880 > 192.168.43.147.7772: UDP, length 120
23:46:35.501754 IP 192.168.43.124.8880 > 192.168.43.146.7771: UDP, length 120
23:46:35.501892 IP 192.168.43.124.8880 > 192.168.43.146.7771: UDP, length 120
23:46:35.507974 IP 192.168.43.146.8880 > 192.168.43.147.7772: UDP, length 120
23:46:35.557973 IP 192.168.43.146.8880 > 192.168.43.147.7772: UDP, length 120
23:46:35.602746 IP 192.168.43.124.8880 > 192.168.43.146.7771: UDP, length 120
23:46:35.602884 IP 192.168.43.124.8880 > 192.168.43.146.7771: UDP, length 120
23:46:35.607973 IP 192.168.43.146.8880 > 192.168.43.147.7772: UDP, length 120
23:46:35.657974 IP 192.168.43.146.8880 > 192.168.43.147.7772: UDP, length 120
23:46:35.702603 IP 192.168.43.124.8880 > 192.168.43.146.7771: UDP, length 120
23:46:35.702741 IP 192.168.43.124.8880 > 192.168.43.146.7771: UDP, length 120
23:46:35.707972 IP 192.168.43.146.8880 > 192.168.43.147.7772: UDP, length 120
23:46:35.757972 IP 192.168.43.146.8880 > 192.168.43.147.7772: UDP, length 120
23:46:35.807990 IP 192.168.43.146.8880 > 192.168.43.147.7772: UDP, length 120
23:46:35.811250 IP 192.168.43.124.8880 > 192.168.43.146.7771: UDP, length 120
23:46:35.811431 IP 192.168.43.124.8880 > 192.168.43.146.7771: UDP, length 120
23:46:35.857984 IP 192.168.43.146.8880 > 192.168.43.147.7772: UDP, length 120
23:46:35.907965 IP 192.168.43.146.8880 > 192.168.43.147.7772: UDP, length 120
23:46:35.911205 IP 192.168.43.124.8880 > 192.168.43.146.7771: UDP, length 120
23:46:35.911329 IP 192.168.43.124.8880 > 192.168.43.146.7771: UDP, length 120
23:46:35.911467 IP 192.168.43.124.8880 > 192.168.43.146.7771: UDP, length 120
23:46:35.957986 IP 192.168.43.146.8880 > 192.168.43.147.7772: UDP, length 120
23:46:36.007965 IP 192.168.43.146.8880 > 192.168.43.147.7772: UDP, length 120
23:46:36.017967 IP 192.168.43.124.8880 > 192.168.43.146.7771: UDP, length 120
23:46:36.018249 IP 192.168.43.124.8880 > 192.168.43.146.7771: UDP, length 120
23:46:36.058016 IP 192.168.43.146.8880 > 192.168.43.147.7772: UDP, length 120
23:46:36.107983 IP 192.168.43.146.8880 > 192.168.43.147.7772: UDP, length 120
23:46:36.110345 IP 192.168.43.124.8880 > 192.168.43.146.7771: UDP, length 120
23:46:36.110508 IP 192.168.43.124.8880 > 192.168.43.146.7771: UDP, length 120
23:46:36.157986 IP 192.168.43.146.8880 > 192.168.43.147.7772: UDP, length 120
23:46:36.159339 IP 192.168.43.124.8880 > 192.168.43.146.7771: UDP, length 120
23:46:36.207974 IP 192.168.43.146.8880 > 192.168.43.147.7772: UDP, length 120
23:46:36.211827 IP 192.168.43.124.8880 > 192.168.43.146.7771: UDP, length 120
23:46:36.258005 IP 192.168.43.146.8880 > 192.168.43.147.7772: UDP, length 120
23:46:36.258974 IP 192.168.43.124.8880 > 192.168.43.146.7771: UDP, length 120
23:46:36.307970 IP 192.168.43.146.8880 > 192.168.43.147.7772: UDP, length 120
23:46:36.308903 IP 192.168.43.124.8880 > 192.168.43.146.7771: UDP, length 120
23:46:36.357977 IP 192.168.43.146.8880 > 192.168.43.147.7772: UDP, length 120
23:46:36.358794 IP 192.168.43.124.8880 > 192.168.43.146.7771: UDP, length 120
23:46:36.407966 IP 192.168.43.146.8880 > 192.168.43.147.7772: UDP, length 120
23:46:36.409348 IP 192.168.43.124.8880 > 192.168.43.146.7771: UDP, length 120
23:46:36.457975 IP 192.168.43.146.8880 > 192.168.43.147.7772: UDP, length 120
23:46:36.458803 IP 192.168.43.124.8880 > 192.168.43.146.7771: UDP, length 120
23:46:36.507969 IP 192.168.43.146.8880 > 192.168.43.147.7772: UDP, length 120
23:46:36.508874 IP 192.168.43.124.8880 > 192.168.43.146.7771: UDP, length 120
23:46:36.557976 IP 192.168.43.146.8880 > 192.168.43.147.7772: UDP, length 120
23:46:36.558775 IP 192.168.43.124.8880 > 192.168.43.146.7771: UDP, length 120
23:46:36.607971 IP 192.168.43.146.8880 > 192.168.43.147.7772: UDP, length 120
23:46:36.609093 IP 192.168.43.124.8880 > 192.168.43.146.7771: UDP, length 120
23:46:36.657976 IP 192.168.43.146.8880 > 192.168.43.147.7772: UDP, length 120
23:46:36.658747 IP 192.168.43.124.8880 > 192.168.43.146.7771: UDP, length 120
23:46:36.707965 IP 192.168.43.146.8880 > 192.168.43.147.7772: UDP, length 120
23:46:36.708456 IP 192.168.43.124.8880 > 192.168.43.146.7771: UDP, length 120
23:46:36.757973 IP 192.168.43.146.8880 > 192.168.43.147.7772: UDP, length 120
23:46:36.758912 IP 192.168.43.124.8880 > 192.168.43.146.7771: UDP, length 120
23:46:36.807987 IP 192.168.43.146.8880 > 192.168.43.147.7772: UDP, length 120
23:46:36.810679 IP 192.168.43.124.8880 > 192.168.43.146.7771: UDP, length 120
23:46:36.857979 IP 192.168.43.146.8880 > 192.168.43.147.7772: UDP, length 120
23:46:36.858664 IP 192.168.43.124.8880 > 192.168.43.146.7771: UDP, length 120
23:46:36.907965 IP 192.168.43.146.8880 > 192.168.43.147.7772: UDP, length 120
23:46:36.910931 IP 192.168.43.124.8880 > 192.168.43.146.7771: UDP, length 120
23:46:36.957977 IP 192.168.43.146.8880 > 192.168.43.147.7772: UDP, length 120
23:46:36.958690 IP 192.168.43.124.8880 > 192.168.43.146.7771: UDP, length 120
23:46:37.007965 IP 192.168.43.146.8880 > 192.168.43.147.7772: UDP, length 120
23:46:37.008933 IP 192.168.43.124.8880 > 192.168.43.146.7771: UDP, length 120
23:46:37.058024 IP 192.168.43.146.8880 > 192.168.43.147.7772: UDP, length 120
23:46:37.060424 IP 192.168.43.124.8880 > 192.168.43.146.7771: UDP, length 120
23:46:37.107988 IP 192.168.43.146.8880 > 192.168.43.147.7772: UDP, length 120
23:46:37.108604 IP 192.168.43.124.8880 > 192.168.43.146.7771: UDP, length 120
23:46:37.157997 IP 192.168.43.146.8880 > 192.168.43.147.7772: UDP, length 120
23:46:37.207977 IP 192.168.43.146.8880 > 192.168.43.147.7772: UDP, length 120
23:46:37.257972 IP 192.168.43.146.8880 > 192.168.43.147.7772: UDP, length 120
23:46:37.301272 IP 192.168.43.124.8880 > 192.168.43.146.7771: UDP, length 120
23:46:37.301445 IP 192.168.43.124.8880 > 192.168.43.146.7771: UDP, length 120
23:46:37.307978 IP 192.168.43.146.8880 > 192.168.43.147.7772: UDP, length 120
23:46:37.357973 IP 192.168.43.146.8880 > 192.168.43.147.7772: UDP, length 120
23:46:37.403626 IP 192.168.43.124.8880 > 192.168.43.146.7771: UDP, length 120
23:46:37.403753 IP 192.168.43.124.8880 > 192.168.43.146.7771: UDP, length 120
23:46:37.407974 IP 192.168.43.146.8880 > 192.168.43.147.7772: UDP, length 120
23:46:37.457974 IP 192.168.43.146.8880 > 192.168.43.147.7772: UDP, length 120
23:46:37.502331 IP 192.168.43.124.8880 > 192.168.43.146.7771: UDP, length 120
23:46:37.502491 IP 192.168.43.124.8880 > 192.168.43.146.7771: UDP, length 120
23:46:37.507974 IP 192.168.43.146.8880 > 192.168.43.147.7772: UDP, length 120
23:46:37.557974 IP 192.168.43.146.8880 > 192.168.43.147.7772: UDP, length 120
23:46:37.602157 IP 192.168.43.124.8880 > 192.168.43.146.7771: UDP, length 120
23:46:37.602312 IP 192.168.43.124.8880 > 192.168.43.146.7771: UDP, length 120
23:46:37.607975 IP 192.168.43.146.8880 > 192.168.43.147.7772: UDP, length 120
23:46:37.657999 IP 192.168.43.146.8880 > 192.168.43.147.7772: UDP, length 120
23:46:37.702617 IP 192.168.43.124.8880 > 192.168.43.146.7771: UDP, length 120
23:46:37.702833 IP 192.168.43.124.8880 > 192.168.43.146.7771: UDP, length 120
23:46:37.708002 IP 192.168.43.146.8880 > 192.168.43.147.7772: UDP, length 120
23:46:37.758045 IP 192.168.43.146.8880 > 192.168.43.147.7772: UDP, length 120
23:46:37.802225 IP 192.168.43.124.8880 > 192.168.43.146.7771: UDP, length 120
23:46:37.802546 IP 192.168.43.124.8880 > 192.168.43.146.7771: UDP, length 120
23:46:37.808021 IP 192.168.43.146.8880 > 192.168.43.147.7772: UDP, length 120
23:46:37.858002 IP 192.168.43.146.8880 > 192.168.43.147.7772: UDP, length 120
23:46:37.902114 IP 192.168.43.124.8880 > 192.168.43.146.7771: UDP, length 120
23:46:37.902697 IP 192.168.43.124.8880 > 192.168.43.146.7771: UDP, length 120
23:46:37.908003 IP 192.168.43.146.8880 > 192.168.43.147.7772: UDP, length 120
23:46:37.958000 IP 192.168.43.146.8880 > 192.168.43.147.7772: UDP, length 120
23:46:38.001802 IP 192.168.43.124.8880 > 192.168.43.146.7771: UDP, length 120
23:46:38.002041 IP 192.168.43.124.8880 > 192.168.43.146.7771: UDP, length 120
23:46:38.008001 IP 192.168.43.146.8880 > 192.168.43.147.7772: UDP, length 120
23:46:38.058067 IP 192.168.43.146.8880 > 192.168.43.147.7772: UDP, length 120
23:46:38.100065 IP 192.168.43.124.8880 > 192.168.43.146.7771: UDP, length 120
23:46:38.100378 IP 192.168.43.124.8880 > 192.168.43.146.7771: UDP, length 120
23:46:38.108020 IP 192.168.43.146.8880 > 192.168.43.147.7772: UDP, length 120
23:46:38.158005 IP 192.168.43.146.8880 > 192.168.43.147.7772: UDP, length 120
23:46:38.200456 IP 192.168.43.124.8880 > 192.168.43.146.7771: UDP, length 120
23:46:38.200714 IP 192.168.43.124.8880 > 192.168.43.146.7771: UDP, length 120
23:46:38.208010 IP 192.168.43.146.8880 > 192.168.43.147.7772: UDP, length 120
23:46:38.258003 IP 192.168.43.146.8880 > 192.168.43.147.7772: UDP, length 120
23:46:38.301778 IP 192.168.43.124.8880 > 192.168.43.146.7771: UDP, length 120
23:46:38.302043 IP 192.168.43.124.8880 > 192.168.43.146.7771: UDP, length 120
23:46:38.308003 IP 192.168.43.146.8880 > 192.168.43.147.7772: UDP, length 120
23:46:38.358000 IP 192.168.43.146.8880 > 192.168.43.147.7772: UDP, length 120
23:46:38.401767 IP 192.168.43.124.8880 > 192.168.43.146.7771: UDP, length 120
23:46:38.402016 IP 192.168.43.124.8880 > 192.168.43.146.7771: UDP, length 120
23:46:38.408005 IP 192.168.43.146.8880 > 192.168.43.147.7772: UDP, length 120
23:46:38.458002 IP 192.168.43.146.8880 > 192.168.43.147.7772: UDP, length 120
23:46:38.502191 IP 192.168.43.124.8880 > 192.168.43.146.7771: UDP, length 120
23:46:38.502484 IP 192.168.43.124.8880 > 192.168.43.146.7771: UDP, length 120
23:46:38.508012 IP 192.168.43.146.8880 > 192.168.43.147.7772: UDP, length 120
23:46:38.558004 IP 192.168.43.146.8880 > 192.168.43.147.7772: UDP, length 120
23:46:38.601220 IP 192.168.43.124.8880 > 192.168.43.146.7771: UDP, length 120
23:46:38.601624 IP 192.168.43.124.8880 > 192.168.43.146.7771: UDP, length 120
23:46:38.608004 IP 192.168.43.146.8880 > 192.168.43.147.7772: UDP, length 120
23:46:38.658000 IP 192.168.43.146.8880 > 192.168.43.147.7772: UDP, length 120
23:46:38.702065 IP 192.168.43.124.8880 > 192.168.43.146.7771: UDP, length 120
23:46:38.702323 IP 192.168.43.124.8880 > 192.168.43.146.7771: UDP, length 120
23:46:38.708002 IP 192.168.43.146.8880 > 192.168.43.147.7772: UDP, length 120
23:46:38.757998 IP 192.168.43.146.8880 > 192.168.43.147.7772: UDP, length 120
23:46:38.801367 IP 192.168.43.124.8880 > 192.168.43.146.7771: UDP, length 120
23:46:38.801645 IP 192.168.43.124.8880 > 192.168.43.146.7771: UDP, length 120
23:46:38.808021 IP 192.168.43.146.8880 > 192.168.43.147.7772: UDP, length 120
23:46:38.858001 IP 192.168.43.146.8880 > 192.168.43.147.7772: UDP, length 120
23:46:38.903197 IP 192.168.43.124.8880 > 192.168.43.146.7771: UDP, length 120
23:46:38.903427 IP 192.168.43.124.8880 > 192.168.43.146.7771: UDP, length 120
23:46:38.908000 IP 192.168.43.146.8880 > 192.168.43.147.7772: UDP, length 120
23:46:38.958000 IP 192.168.43.146.8880 > 192.168.43.147.7772: UDP, length 120
23:46:39.001943 IP 192.168.43.124.8880 > 192.168.43.146.7771: UDP, length 120
23:46:39.002199 IP 192.168.43.124.8880 > 192.168.43.146.7771: UDP, length 120
23:46:39.008001 IP 192.168.43.146.8880 > 192.168.43.147.7772: UDP, length 120
23:46:39.058068 IP 192.168.43.146.8880 > 192.168.43.147.7772: UDP, length 120
23:46:39.103256 IP 192.168.43.124.8880 > 192.168.43.146.7771: UDP, length 120
23:46:39.103430 IP 192.168.43.124.8880 > 192.168.43.146.7771: UDP, length 120
23:46:39.108079 IP 192.168.43.146.8880 > 192.168.43.147.7772: UDP, length 120
23:46:39.108795 IP 192.168.43.124.8880 > 192.168.43.146.7771: UDP, length 120
23:46:39.158134 IP 192.168.43.146.8880 > 192.168.43.147.7772: UDP, length 120
23:46:39.159436 IP 192.168.43.124.8880 > 192.168.43.146.7771: UDP, length 120
23:46:39.208112 IP 192.168.43.146.8880 > 192.168.43.147.7772: UDP, length 120
23:46:39.209722 IP 192.168.43.124.8880 > 192.168.43.146.7771: UDP, length 120
23:46:39.258064 IP 192.168.43.146.8880 > 192.168.43.147.7772: UDP, length 120
23:46:39.258286 IP 192.168.43.124.8880 > 192.168.43.146.7771: UDP, length 120
23:46:39.308052 IP 192.168.43.146.8880 > 192.168.43.147.7772: UDP, length 120
23:46:39.308153 IP 192.168.43.124.8880 > 192.168.43.146.7771: UDP, length 120
23:46:39.358053 IP 192.168.43.146.8880 > 192.168.43.147.7772: UDP, length 120
23:46:39.358229 IP 192.168.43.124.8880 > 192.168.43.146.7771: UDP, length 120
23:46:39.408063 IP 192.168.43.146.8880 > 192.168.43.147.7772: UDP, length 120
23:46:39.410011 IP 192.168.43.124.8880 > 192.168.43.146.7771: UDP, length 120
23:46:39.458039 IP 192.168.43.146.8880 > 192.168.43.147.7772: UDP, length 120
23:46:39.458203 IP 192.168.43.124.8880 > 192.168.43.146.7771: UDP, length 120
23:46:39.508060 IP 192.168.43.146.8880 > 192.168.43.147.7772: UDP, length 120
23:46:39.508237 IP 192.168.43.124.8880 > 192.168.43.146.7771: UDP, length 120
23:46:39.558033 IP 192.168.43.146.8880 > 192.168.43.147.7772: UDP, length 120
23:46:39.558175 IP 192.168.43.124.8880 > 192.168.43.146.7771: UDP, length 120
23:46:39.607995 IP 192.168.43.146.8880 > 192.168.43.147.7772: UDP, length 120
23:46:39.608106 IP 192.168.43.124.8880 > 192.168.43.146.7771: UDP, length 120
23:46:39.657983 IP 192.168.43.146.8880 > 192.168.43.147.7772: UDP, length 120
23:46:39.658083 IP 192.168.43.124.8880 > 192.168.43.146.7771: UDP, length 120
23:46:39.707988 IP 192.168.43.146.8880 > 192.168.43.147.7772: UDP, length 120
23:46:39.708089 IP 192.168.43.124.8880 > 192.168.43.146.7771: UDP, length 120
23:46:39.757980 IP 192.168.43.146.8880 > 192.168.43.147.7772: UDP, length 120
23:46:39.758089 IP 192.168.43.124.8880 > 192.168.43.146.7771: UDP, length 120
23:46:39.807998 IP 192.168.43.146.8880 > 192.168.43.147.7772: UDP, length 120
23:46:39.808105 IP 192.168.43.124.8880 > 192.168.43.146.7771: UDP, length 120
23:46:39.856550 IP 192.168.43.124.8880 > 192.168.43.146.7771: UDP, length 120
23:46:39.857982 IP 192.168.43.146.8880 > 192.168.43.147.7772: UDP, length 120
23:46:39.907737 IP 192.168.43.124.8880 > 192.168.43.146.7771: UDP, length 120
23:46:39.907976 IP 192.168.43.146.8880 > 192.168.43.147.7772: UDP, length 120
23:46:39.957976 IP 192.168.43.146.8880 > 192.168.43.147.7772: UDP, length 120
23:46:39.958074 IP 192.168.43.124.8880 > 192.168.43.146.7771: UDP, length 120
23:46:40.007975 IP 192.168.43.146.8880 > 192.168.43.147.7772: UDP, length 120
23:46:40.010940 IP 192.168.43.124.8880 > 192.168.43.146.7771: UDP, length 120
23:46:40.057714 IP 192.168.43.124.8880 > 192.168.43.146.7771: UDP, length 120
23:46:40.058018 IP 192.168.43.146.8880 > 192.168.43.147.7772: UDP, length 120
23:46:40.107678 IP 192.168.43.124.8880 > 192.168.43.146.7771: UDP, length 120
23:46:40.107988 IP 192.168.43.146.8880 > 192.168.43.147.7772: UDP, length 120
23:46:40.157941 IP 192.168.43.146.8880 > 192.168.43.147.7772: UDP, length 120
23:46:40.158041 IP 192.168.43.124.8880 > 192.168.43.146.7771: UDP, length 120
23:46:40.206169 IP 192.168.43.124.8880 > 192.168.43.146.7771: UDP, length 120
23:46:40.207977 IP 192.168.43.146.8880 > 192.168.43.147.7772: UDP, length 120
23:46:40.257975 IP 192.168.43.146.8880 > 192.168.43.147.7772: UDP, length 120
23:46:40.259360 IP 192.168.43.124.8880 > 192.168.43.146.7771: UDP, length 120
23:46:40.307838 IP 192.168.43.124.8880 > 192.168.43.146.7771: UDP, length 120
23:46:40.307981 IP 192.168.43.146.8880 > 192.168.43.147.7772: UDP, length 120
23:46:40.357981 IP 192.168.43.146.8880 > 192.168.43.147.7772: UDP, length 120
23:46:40.358082 IP 192.168.43.124.8880 > 192.168.43.146.7771: UDP, length 120
23:46:40.407980 IP 192.168.43.146.8880 > 192.168.43.147.7772: UDP, length 120
23:46:40.408083 IP 192.168.43.124.8880 > 192.168.43.146.7771: UDP, length 120
23:46:40.457976 IP 192.168.43.146.8880 > 192.168.43.147.7772: UDP, length 120
23:46:40.459426 IP 192.168.43.124.8880 > 192.168.43.146.7771: UDP, length 120
23:46:40.507973 IP 192.168.43.146.8880 > 192.168.43.147.7772: UDP, length 120
23:46:40.511227 IP 192.168.43.124.8880 > 192.168.43.146.7771: UDP, length 120
23:46:40.557942 IP 192.168.43.124.8880 > 192.168.43.146.7771: UDP, length 120
23:46:40.557981 IP 192.168.43.146.8880 > 192.168.43.147.7772: UDP, length 120
23:46:40.607974 IP 192.168.43.146.8880 > 192.168.43.147.7772: UDP, length 120
23:46:40.611218 IP 192.168.43.124.8880 > 192.168.43.146.7771: UDP, length 120
23:46:40.657931 IP 192.168.43.124.8880 > 192.168.43.146.7771: UDP, length 120
23:46:40.657982 IP 192.168.43.146.8880 > 192.168.43.147.7772: UDP, length 120
23:46:40.707932 IP 192.168.43.124.8880 > 192.168.43.146.7771: UDP, length 120
23:46:40.707981 IP 192.168.43.146.8880 > 192.168.43.147.7772: UDP, length 120
23:46:40.758015 IP 192.168.43.146.8880 > 192.168.43.147.7772: UDP, length 120
23:46:40.758142 IP 192.168.43.124.8880 > 192.168.43.146.7771: UDP, length 120
23:46:40.807891 IP 192.168.43.124.8880 > 192.168.43.146.7771: UDP, length 120
23:46:40.808012 IP 192.168.43.146.8880 > 192.168.43.147.7772: UDP, length 120
23:46:40.857448 IP 192.168.43.124.8880 > 192.168.43.146.7771: UDP, length 120
23:46:40.857980 IP 192.168.43.146.8880 > 192.168.43.147.7772: UDP, length 120
23:46:40.906367 IP 192.168.43.124.8880 > 192.168.43.146.7771: UDP, length 120
23:46:40.907979 IP 192.168.43.146.8880 > 192.168.43.147.7772: UDP, length 120
23:46:40.957797 IP 192.168.43.124.8880 > 192.168.43.146.7771: UDP, length 120
23:46:40.957983 IP 192.168.43.146.8880 > 192.168.43.147.7772: UDP, length 120
23:46:41.007975 IP 192.168.43.146.8880 > 192.168.43.147.7772: UDP, length 120
23:46:41.019601 IP 192.168.43.124.8880 > 192.168.43.146.7771: UDP, length 120
23:46:41.057835 IP 192.168.43.124.8880 > 192.168.43.146.7771: UDP, length 120
23:46:41.057978 IP 192.168.43.146.8880 > 192.168.43.147.7772: UDP, length 120
23:46:41.107978 IP 192.168.43.146.8880 > 192.168.43.147.7772: UDP, length 120
23:46:41.108076 IP 192.168.43.124.8880 > 192.168.43.146.7771: UDP, length 120
23:46:41.157958 IP 192.168.43.146.8880 > 192.168.43.147.7772: UDP, length 120
23:46:41.158057 IP 192.168.43.124.8880 > 192.168.43.146.7771: UDP, length 120
23:46:41.207974 IP 192.168.43.146.8880 > 192.168.43.147.7772: UDP, length 120
23:46:41.211223 IP 192.168.43.124.8880 > 192.168.43.146.7771: UDP, length 120
23:46:41.256858 IP 192.168.43.124.8880 > 192.168.43.146.7771: UDP, length 120
23:46:41.257976 IP 192.168.43.146.8880 > 192.168.43.147.7772: UDP, length 120
23:46:41.307975 IP 192.168.43.146.8880 > 192.168.43.147.7772: UDP, length 120
23:46:41.309347 IP 192.168.43.124.8880 > 192.168.43.146.7771: UDP, length 120
23:46:41.357982 IP 192.168.43.146.8880 > 192.168.43.147.7772: UDP, length 120
