02:26:50.045939 IP 192.168.43.146.8880 > 192.168.43.147.7772: UDP, length 120
02:26:50.095996 IP 192.168.43.146.8880 > 192.168.43.147.7772: UDP, length 120
02:26:50.145970 IP 192.168.43.146.8880 > 192.168.43.147.7772: UDP, length 120
02:26:50.196006 IP 192.168.43.146.8880 > 192.168.43.147.7772: UDP, length 120
02:26:50.245965 IP 192.168.43.146.8880 > 192.168.43.147.7772: UDP, length 120
02:26:50.295978 IP 192.168.43.146.8880 > 192.168.43.147.7772: UDP, length 120
02:26:50.345957 IP 192.168.43.146.8880 > 192.168.43.147.7772: UDP, length 120
02:26:50.355898 IP 192.168.43.124.8880 > 192.168.43.146.7771: UDP, length 120
02:26:50.356825 IP 192.168.43.124.8880 > 192.168.43.146.7771: UDP, length 120
02:26:50.357071 IP 192.168.43.124.8880 > 192.168.43.146.7771: UDP, length 120
02:26:50.357321 IP 192.168.43.124.8880 > 192.168.43.146.7771: UDP, length 120
02:26:50.357553 IP 192.168.43.124.8880 > 192.168.43.146.7771: UDP, length 120
02:26:50.357667 IP 192.168.43.124.8880 > 192.168.43.146.7771: UDP, length 120
02:26:50.357780 IP 192.168.43.124.8880 > 192.168.43.146.7771: UDP, length 120
02:26:50.357910 IP 192.168.43.124.8880 > 192.168.43.146.7771: UDP, length 120
02:26:50.358023 IP 192.168.43.124.8880 > 192.168.43.146.7771: UDP, length 120
02:26:50.358135 IP 192.168.43.124.8880 > 192.168.43.146.7771: UDP, length 120
02:26:50.358264 IP 192.168.43.124.8880 > 192.168.43.146.7771: UDP, length 120
02:26:50.358498 IP 192.168.43.124.8880 > 192.168.43.146.7771: UDP, length 120
02:26:50.358612 IP 192.168.43.124.8880 > 192.168.43.146.7771: UDP, length 120
02:26:50.358724 IP 192.168.43.124.8880 > 192.168.43.146.7771: UDP, length 120
02:26:50.358838 IP 192.168.43.124.8880 > 192.168.43.146.7771: UDP, length 120
02:26:50.358949 IP 192.168.43.124.8880 > 192.168.43.146.7771: UDP, length 120
02:26:50.359055 IP 192.168.43.124.8880 > 192.168.43.146.7771: UDP, length 120
02:26:50.359167 IP 192.168.43.124.8880 > 192.168.43.146.7771: UDP, length 120
02:26:50.359279 IP 192.168.43.124.8880 > 192.168.43.146.7771: UDP, length 120
02:26:50.360330 IP 192.168.43.124.8880 > 192.168.43.146.7771: UDP, length 120
02:26:50.395962 IP 192.168.43.146.8880 > 192.168.43.147.7772: UDP, length 120
02:26:50.423991 IP 192.168.43.124.8880 > 192.168.43.146.7771: UDP, length 120
02:26:50.445955 IP 192.168.43.146.8880 > 192.168.43.147.7772: UDP, length 120
02:26:50.458995 IP 192.168.43.124.8880 > 192.168.43.146.7771: UDP, length 120
02:26:50.496023 IP 192.168.43.146.8880 > 192.168.43.147.7772: UDP, length 120
02:26:50.510016 IP 192.168.43.124.8880 > 192.168.43.146.7771: UDP, length 120
02:26:50.545971 IP 192.168.43.146.8880 > 192.168.43.147.7772: UDP, length 120
02:26:50.560827 IP 192.168.43.124.8880 > 192.168.43.146.7771: UDP, length 120
02:26:50.595972 IP 192.168.43.146.8880 > 192.168.43.147.7772: UDP, length 120
02:26:50.633978 IP 192.168.43.124.8880 > 192.168.43.146.7771: UDP, length 120
02:26:50.645959 IP 192.168.43.146.8880 > 192.168.43.147.7772: UDP, length 120
02:26:50.659124 IP 192.168.43.124.8880 > 192.168.43.146.7771: UDP, length 120
02:26:50.695957 IP 192.168.43.146.8880 > 192.168.43.147.7772: UDP, length 120
02:26:50.718303 IP 192.168.43.124.8880 > 192.168.43.146.7771: UDP, length 120
02:26:50.745960 IP 192.168.43.146.8880 > 192.168.43.147.7772: UDP, length 120
02:26:50.759150 IP 192.168.43.124.8880 > 192.168.43.146.7771: UDP, length 120
02:26:50.795956 IP 192.168.43.146.8880 > 192.168.43.147.7772: UDP, length 120
02:26:50.810100 IP 192.168.43.124.8880 > 192.168.43.146.7771: UDP, length 120
02:26:50.845953 IP 192.168.43.146.8880 > 192.168.43.147.7772: UDP, length 120
02:26:50.865257 IP 192.168.43.124.8880 > 192.168.43.146.7771: UDP, length 120
02:26:50.895955 IP 192.168.43.146.8880 > 192.168.43.147.7772: UDP, length 120
02:26:50.908996 IP 192.168.43.124.8880 > 192.168.43.146.7771: UDP, length 120
02:26:50.945956 IP 192.168.43.146.8880 > 192.168.43.147.7772: UDP, length 120
02:26:50.959266 IP 192.168.43.124.8880 > 192.168.43.146.7771: UDP, length 120
02:26:50.995956 IP 192.168.43.146.8880 > 192.168.43.147.7772: UDP, length 120
02:26:51.011036 IP 192.168.43.124.8880 > 192.168.43.146.7771: UDP, length 120
02:26:51.045982 IP 192.168.43.146.8880 > 192.168.43.147.7772: UDP, length 120
02:26:51.084873 IP 192.168.43.124.8880 > 192.168.43.146.7771: UDP, length 120
02:26:51.095974 IP 192.168.43.146.8880 > 192.168.43.147.7772: UDP, length 120
02:26:51.109274 IP 192.168.43.124.8880 > 192.168.43.146.7771: UDP, length 120
02:26:51.145970 IP 192.168.43.146.8880 > 192.168.43.147.7772: UDP, length 120
02:26:51.160618 IP 192.168.43.124.8880 > 192.168.43.146.7771: UDP, length 120
02:26:51.195964 IP 192.168.43.146.8880 > 192.168.43.147.7772: UDP, length 120
02:26:51.222325 IP 192.168.43.124.8880 > 192.168.43.146.7771: UDP, length 120
02:26:51.245957 IP 192.168.43.146.8880 > 192.168.43.147.7772: UDP, length 120
02:26:51.260700 IP 192.168.43.124.8880 > 192.168.43.146.7771: UDP, length 120
02:26:51.295955 IP 192.168.43.146.8880 > 192.168.43.147.7772: UDP, length 120
02:26:51.337611 IP 192.168.43.124.8880 > 192.168.43.146.7771: UDP, length 120
02:26:51.345953 IP 192.168.43.146.8880 > 192.168.43.147.7772: UDP, length 120
02:26:51.372528 IP 192.168.43.124.8880 > 192.168.43.146.7771: UDP, length 120
02:26:51.395956 IP 192.168.43.146.8880 > 192.168.43.147.7772: UDP, length 120
02:26:51.409088 IP 192.168.43.124.8880 > 192.168.43.146.7771: UDP, length 120
02:26:51.445952 IP 192.168.43.146.8880 > 192.168.43.147.7772: UDP, length 120
02:26:51.461507 IP 192.168.43.124.8880 > 192.168.43.146.7771: UDP, length 120
02:26:51.495956 IP 192.168.43.146.8880 > 192.168.43.147.7772: UDP, length 120
02:26:51.519051 IP 192.168.43.124.8880 > 192.168.43.146.7771: UDP, length 120
02:26:51.546034 IP 192.168.43.146.8880 > 192.168.43.147.7772: UDP, length 120
02:26:51.559344 IP 192.168.43.124.8880 > 192.168.43.146.7771: UDP, length 120
02:26:51.596092 IP 192.168.43.146.8880 > 192.168.43.147.7772: UDP, length 120
02:26:51.609889 IP 192.168.43.124.8880 > 192.168.43.146.7771: UDP, length 120
02:26:51.645992 IP 192.168.43.146.8880 > 192.168.43.147.7772: UDP, length 120
02:26:51.661639 IP 192.168.43.124.8880 > 192.168.43.146.7771: UDP, length 120
02:26:51.695986 IP 192.168.43.146.8880 > 192.168.43.147.7772: UDP, length 120
02:26:51.709062 IP 192.168.43.124.8880 > 192.168.43.146.7771: UDP, length 120
02:26:51.746058 IP 192.168.43.146.8880 > 192.168.43.147.7772: UDP, length 120
02:26:51.760381 IP 192.168.43.124.8880 > 192.168.43.146.7771: UDP, length 120
02:26:51.796012 IP 192.168.43.146.8880 > 192.168.43.147.7772: UDP, length 120
02:26:51.810706 IP 192.168.43.124.8880 > 192.168.43.146.7771: UDP, length 120
02:26:51.846026 IP 192.168.43.146.8880 > 192.168.43.147.7772: UDP, length 120
02:26:51.859398 IP 192.168.43.124.8880 > 192.168.43.146.7771: UDP, length 120
02:26:51.896003 IP 192.168.43.146.8880 > 192.168.43.147.7772: UDP, length 120
02:26:51.915982 IP 192.168.43.124.8880 > 192.168.43.146.7771: UDP, length 120
02:26:51.946006 IP 192.168.43.146.8880 > 192.168.43.147.7772: UDP, length 120
02:26:51.959184 IP 192.168.43.124.8880 > 192.168.43.146.7771: UDP, length 120
02:26:51.995985 IP 192.168.43.146.8880 > 192.168.43.147.7772: UDP, length 120
02:26:52.016301 IP 192.168.43.124.8880 > 192.168.43.146.7771: UDP, length 120
02:26:52.045994 IP 192.168.43.146.8880 > 192.168.43.147.7772: UDP, length 120
02:26:52.058971 IP 192.168.43.124.8880 > 192.168.43.146.7771: UDP, length 120
02:26:52.095965 IP 192.168.43.146.8880 > 192.168.43.147.7772: UDP, length 120
02:26:52.110769 IP 192.168.43.124.8880 > 192.168.43.146.7771: UDP, length 120
02:26:52.145962 IP 192.168.43.146.8880 > 192.168.43.147.7772: UDP, length 120
02:26:52.161247 IP 192.168.43.124.8880 > 192.168.43.146.7771: UDP, length 120
02:26:52.195960 IP 192.168.43.146.8880 > 192.168.43.147.7772: UDP, length 120
02:26:52.208928 IP 192.168.43.124.8880 > 192.168.43.146.7771: UDP, length 120
02:26:52.245967 IP 192.168.43.146.8880 > 192.168.43.147.7772: UDP, length 120
02:26:52.258992 IP 192.168.43.124.8880 > 192.168.43.146.7771: UDP, length 120
02:26:52.295965 IP 192.168.43.146.8880 > 192.168.43.147.7772: UDP, length 120
02:26:52.318374 IP 192.168.43.124.8880 > 192.168.43.146.7771: UDP, length 120
02:26:52.345957 IP 192.168.43.146.8880 > 192.168.43.147.7772: UDP, length 120
02:26:52.359089 IP 192.168.43.124.8880 > 192.168.43.146.7771: UDP, length 120
02:26:52.395955 IP 192.168.43.146.8880 > 192.168.43.147.7772: UDP, length 120
02:26:52.409453 IP 192.168.43.124.8880 > 192.168.43.146.7771: UDP, length 120
02:26:52.445954 IP 192.168.43.146.8880 > 192.168.43.147.7772: UDP, length 120
02:26:52.460801 IP 192.168.43.124.8880 > 192.168.43.146.7771: UDP, length 120
02:26:52.496056 IP 192.168.43.146.8880 > 192.168.43.147.7772: UDP, length 120
02:26:52.531906 IP 192.168.43.124.8880 > 192.168.43.146.7771: UDP, length 120
02:26:52.546045 IP 192.168.43.146.8880 > 192.168.43.147.7772: UDP, length 120
02:26:52.559694 IP 192.168.43.124.8880 > 192.168.43.146.7771: UDP, length 120
02:26:52.596032 IP 192.168.43.146.8880 > 192.168.43.147.7772: UDP, length 120
02:26:52.621924 IP 192.168.43.124.8880 > 192.168.43.146.7771: UDP, length 120
02:26:52.645988 IP 192.168.43.146.8880 > 192.168.43.147.7772: UDP, length 120
02:26:52.660192 IP 192.168.43.124.8880 > 192.168.43.146.7771: UDP, length 120
02:26:52.695944 IP 192.168.43.146.8880 > 192.168.43.147.7772: UDP, length 120
02:26:52.709063 IP 192.168.43.124.8880 > 192.168.43.146.7771: UDP, length 120
02:26:52.745967 IP 192.168.43.146.8880 > 192.168.43.147.7772: UDP, length 120
02:26:52.766732 IP 192.168.43.124.8880 > 192.168.43.146.7771: UDP, length 120
02:26:52.795964 IP 192.168.43.146.8880 > 192.168.43.147.7772: UDP, length 120
02:26:52.808890 IP 192.168.43.124.8880 > 192.168.43.146.7771: UDP, length 120
02:26:52.845960 IP 192.168.43.146.8880 > 192.168.43.147.7772: UDP, length 120
02:26:52.870866 IP 192.168.43.124.8880 > 192.168.43.146.7771: UDP, length 120
02:26:52.895952 IP 192.168.43.146.8880 > 192.168.43.147.7772: UDP, length 120
02:26:52.919096 IP 192.168.43.124.8880 > 192.168.43.146.7771: UDP, length 120
02:26:52.945957 IP 192.168.43.146.8880 > 192.168.43.147.7772: UDP, length 120
02:26:52.958967 IP 192.168.43.124.8880 > 192.168.43.146.7771: UDP, length 120
02:26:52.995955 IP 192.168.43.146.8880 > 192.168.43.147.7772: UDP, length 120
02:26:53.008935 IP 192.168.43.124.8880 > 192.168.43.146.7771: UDP, length 120
02:26:53.045975 IP 192.168.43.146.8880 > 192.168.43.147.7772: UDP, length 120
02:26:53.072648 IP 192.168.43.124.8880 > 192.168.43.146.7771: UDP, length 120
02:26:53.095968 IP 192.168.43.146.8880 > 192.168.43.147.7772: UDP, length 120
02:26:53.109140 IP 192.168.43.124.8880 > 192.168.43.146.7771: UDP, length 120
02:26:53.145958 IP 192.168.43.146.8880 > 192.168.43.147.7772: UDP, length 120
02:26:53.159232 IP 192.168.43.124.8880 > 192.168.43.146.7771: UDP, length 120
02:26:53.196010 IP 192.168.43.146.8880 > 192.168.43.147.7772: UDP, length 120
02:26:53.215951 IP 192.168.43.124.8880 > 192.168.43.146.7771: UDP, length 120
02:26:53.245977 IP 192.168.43.146.8880 > 192.168.43.147.7772: UDP, length 120
02:26:53.258978 IP 192.168.43.124.8880 > 192.168.43.146.7771: UDP, length 120
02:26:53.295972 IP 192.168.43.146.8880 > 192.168.43.147.7772: UDP, length 120
02:26:53.309283 IP 192.168.43.124.8880 > 192.168.43.146.7771: UDP, length 120
02:26:53.345961 IP 192.168.43.146.8880 > 192.168.43.147.7772: UDP, length 120
02:26:53.369074 IP 192.168.43.124.8880 > 192.168.43.146.7771: UDP, length 120
02:26:53.395954 IP 192.168.43.146.8880 > 192.168.43.147.7772: UDP, length 120
02:26:53.415269 IP 192.168.43.124.8880 > 192.168.43.146.7771: UDP, length 120
02:26:53.445953 IP 192.168.43.146.8880 > 192.168.43.147.7772: UDP, length 120
02:26:53.459039 IP 192.168.43.124.8880 > 192.168.43.146.7771: UDP, length 120
02:26:53.495954 IP 192.168.43.146.8880 > 192.168.43.147.7772: UDP, length 120
02:26:53.524138 IP 192.168.43.124.8880 > 192.168.43.146.7771: UDP, length 120
02:26:53.545955 IP 192.168.43.146.8880 > 192.168.43.147.7772: UDP, length 120
02:26:53.559091 IP 192.168.43.124.8880 > 192.168.43.146.7771: UDP, length 120
02:26:53.595957 IP 192.168.43.146.8880 > 192.168.43.147.7772: UDP, length 120
02:26:53.608981 IP 192.168.43.124.8880 > 192.168.43.146.7771: UDP, length 120
02:26:53.646045 IP 192.168.43.146.8880 > 192.168.43.147.7772: UDP, length 120
02:26:53.670212 IP 192.168.43.124.8880 > 192.168.43.146.7771: UDP, length 120
02:26:53.696049 IP 192.168.43.146.8880 > 192.168.43.147.7772: UDP, length 120
02:26:53.709552 IP 192.168.43.124.8880 > 192.168.43.146.7771: UDP, length 120
02:26:53.746001 IP 192.168.43.146.8880 > 192.168.43.147.7772: UDP, length 120
02:26:53.762008 IP 192.168.43.124.8880 > 192.168.43.146.7771: UDP, length 120
02:26:53.795962 IP 192.168.43.146.8880 > 192.168.43.147.7772: UDP, length 120
02:26:53.824472 IP 192.168.43.124.8880 > 192.168.43.146.7771: UDP, length 120
02:26:53.845954 IP 192.168.43.146.8880 > 192.168.43.147.7772: UDP, length 120
02:26:53.858933 IP 192.168.43.124.8880 > 192.168.43.146.7771: UDP, length 120
02:26:53.895955 IP 192.168.43.146.8880 > 192.168.43.147.7772: UDP, length 120
02:26:53.909498 IP 192.168.43.124.8880 > 192.168.43.146.7771: UDP, length 120
02:26:53.945956 IP 192.168.43.146.8880 > 192.168.43.147.7772: UDP, length 120
02:26:53.972253 IP 192.168.43.124.8880 > 192.168.43.146.7771: UDP, length 120
02:26:53.995954 IP 192.168.43.146.8880 > 192.168.43.147.7772: UDP, length 120
02:26:54.008933 IP 192.168.43.124.8880 > 192.168.43.146.7771: UDP, length 120
02:26:54.045970 IP 192.168.43.146.8880 > 192.168.43.147.7772: UDP, length 120
02:26:54.059038 IP 192.168.43.124.8880 > 192.168.43.146.7771: UDP, length 120
02:26:54.095961 IP 192.168.43.146.8880 > 192.168.43.147.7772: UDP, length 120
02:26:54.111052 IP 192.168.43.124.8880 > 192.168.43.146.7771: UDP, length 120
02:26:54.145956 IP 192.168.43.146.8880 > 192.168.43.147.7772: UDP, length 120
02:26:54.183281 IP 192.168.43.124.8880 > 192.168.43.146.7771: UDP, length 120
02:26:54.195953 IP 192.168.43.146.8880 > 192.168.43.147.7772: UDP, length 120
02:26:54.209242 IP 192.168.43.124.8880 > 192.168.43.146.7771: UDP, length 120
02:26:54.245955 IP 192.168.43.146.8880 > 192.168.43.147.7772: UDP, length 120
02:26:54.261339 IP 192.168.43.124.8880 > 192.168.43.146.7771: UDP, length 120
02:26:54.295958 IP 192.168.43.146.8880 > 192.168.43.147.7772: UDP, length 120
02:26:54.335955 IP 192.168.43.124.8880 > 192.168.43.146.7771: UDP, length 120
02:26:54.345963 IP 192.168.43.146.8880 > 192.168.43.147.7772: UDP, length 120
02:26:54.359037 IP 192.168.43.124.8880 > 192.168.43.146.7771: UDP, length 120
02:26:54.395958 IP 192.168.43.146.8880 > 192.168.43.147.7772: UDP, length 120
02:26:54.411387 IP 192.168.43.124.8880 > 192.168.43.146.7771: UDP, length 120
02:26:54.445956 IP 192.168.43.146.8880 > 192.168.43.147.7772: UDP, length 120
02:26:54.484393 IP 192.168.43.124.8880 > 192.168.43.146.7771: UDP, length 120
02:26:54.495952 IP 192.168.43.146.8880 > 192.168.43.147.7772: UDP, length 120
02:26:54.509409 IP 192.168.43.124.8880 > 192.168.43.146.7771: UDP, length 120
02:26:54.545954 IP 192.168.43.146.8880 > 192.168.43.147.7772: UDP, length 120
02:26:54.568306 IP 192.168.43.124.8880 > 192.168.43.146.7771: UDP, length 120
02:26:54.595955 IP 192.168.43.146.8880 > 192.168.43.147.7772: UDP, length 120
02:26:54.609011 IP 192.168.43.124.8880 > 192.168.43.146.7771: UDP, length 120
02:26:54.645953 IP 192.168.43.146.8880 > 192.168.43.147.7772: UDP, length 120
02:26:54.660357 IP 192.168.43.124.8880 > 192.168.43.146.7771: UDP, length 120
02:26:54.696003 IP 192.168.43.146.8880 > 192.168.43.147.7772: UDP, length 120
02:26:54.711430 IP 192.168.43.124.8880 > 192.168.43.146.7771: UDP, length 120
02:26:54.746015 IP 192.168.43.146.8880 > 192.168.43.147.7772: UDP, length 120
02:26:54.784138 IP 192.168.43.124.8880 > 192.168.43.146.7771: UDP, length 120
02:26:54.795961 IP 192.168.43.146.8880 > 192.168.43.147.7772: UDP, length 120
02:26:54.810800 IP 192.168.43.124.8880 > 192.168.43.146.7771: UDP, length 120
02:26:54.845955 IP 192.168.43.146.8880 > 192.168.43.147.7772: UDP, length 120
02:26:54.861247 IP 192.168.43.124.8880 > 192.168.43.146.7771: UDP, length 120
02:26:54.895956 IP 192.168.43.146.8880 > 192.168.43.147.7772: UDP, length 120
02:26:54.933998 IP 192.168.43.124.8880 > 192.168.43.146.7771: UDP, length 120
02:26:54.945953 IP 192.168.43.146.8880 > 192.168.43.147.7772: UDP, length 120
02:26:54.959233 IP 192.168.43.124.8880 > 192.168.43.146.7771: UDP, length 120
02:26:54.995954 IP 192.168.43.146.8880 > 192.168.43.147.7772: UDP, length 120
02:26:55.023334 IP 192.168.43.124.8880 > 192.168.43.146.7771: UDP, length 120
02:26:55.045964 IP 192.168.43.146.8880 > 192.168.43.147.7772: UDP, length 120
02:26:55.059241 IP 192.168.43.124.8880 > 192.168.43.146.7771: UDP, length 120
02:26:55.096069 IP 192.168.43.146.8880 > 192.168.43.147.7772: UDP, length 120
02:26:55.109009 IP 192.168.43.124.8880 > 192.168.43.146.7771: UDP, length 120
02:26:55.145962 IP 192.168.43.146.8880 > 192.168.43.147.7772: UDP, length 120
02:26:55.185634 IP 192.168.43.124.8880 > 192.168.43.146.7771: UDP, length 120
02:26:55.195951 IP 192.168.43.146.8880 > 192.168.43.147.7772: UDP, length 120
02:26:55.208981 IP 192.168.43.124.8880 > 192.168.43.146.7771: UDP, length 120
02:26:55.245954 IP 192.168.43.146.8880 > 192.168.43.147.7772: UDP, length 120
02:26:55.260189 IP 192.168.43.124.8880 > 192.168.43.146.7771: UDP, length 120
02:26:55.295991 IP 192.168.43.146.8880 > 192.168.43.147.7772: UDP, length 120
02:26:55.332942 IP 192.168.43.124.8880 > 192.168.43.146.7771: UDP, length 120
02:26:55.345972 IP 192.168.43.146.8880 > 192.168.43.147.7772: UDP, length 120
02:26:55.358983 IP 192.168.43.124.8880 > 192.168.43.146.7771: UDP, length 120
02:26:55.395966 IP 192.168.43.146.8880 > 192.168.43.147.7772: UDP, length 120
02:26:55.422755 IP 192.168.43.124.8880 > 192.168.43.146.7771: UDP, length 120
02:26:55.445963 IP 192.168.43.146.8880 > 192.168.43.147.7772: UDP, length 120
02:26:55.459485 IP 192.168.43.124.8880 > 192.168.43.146.7771: UDP, length 120
02:26:55.495958 IP 192.168.43.146.8880 > 192.168.43.147.7772: UDP, length 120
02:26:55.509995 IP 192.168.43.124.8880 > 192.168.43.146.7771: UDP, length 120
02:26:55.545958 IP 192.168.43.146.8880 > 192.168.43.147.7772: UDP, length 120
02:26:55.569218 IP 192.168.43.124.8880 > 192.168.43.146.7771: UDP, length 120
02:26:55.595957 IP 192.168.43.146.8880 > 192.168.43.147.7772: UDP, length 120
02:26:55.608960 IP 192.168.43.124.8880 > 192.168.43.146.7771: UDP, length 120
02:26:55.645956 IP 192.168.43.146.8880 > 192.168.43.147.7772: UDP, length 120
02:26:55.660891 IP 192.168.43.124.8880 > 192.168.43.146.7771: UDP, length 120
02:26:55.695954 IP 192.168.43.146.8880 > 192.168.43.147.7772: UDP, length 120
02:26:55.718157 IP 192.168.43.124.8880 > 192.168.43.146.7771: UDP, length 120
02:26:55.746020 IP 192.168.43.146.8880 > 192.168.43.147.7772: UDP, length 120
02:26:55.759040 IP 192.168.43.124.8880 > 192.168.43.146.7771: UDP, length 120
02:26:55.795969 IP 192.168.43.146.8880 > 192.168.43.147.7772: UDP, length 120
02:26:55.810903 IP 192.168.43.124.8880 > 192.168.43.146.7771: UDP, length 120
02:26:55.845958 IP 192.168.43.146.8880 > 192.168.43.147.7772: UDP, length 120
02:26:55.873089 IP 192.168.43.124.8880 > 192.168.43.146.7771: UDP, length 120
02:26:55.895953 IP 192.168.43.146.8880 > 192.168.43.147.7772: UDP, length 120
02:26:55.911500 IP 192.168.43.124.8880 > 192.168.43.146.7771: UDP, length 120
02:26:55.945958 IP 192.168.43.146.8880 > 192.168.43.147.7772: UDP, length 120
02:26:55.959695 IP 192.168.43.124.8880 > 192.168.43.146.7771: UDP, length 120
02:26:55.995954 IP 192.168.43.146.8880 > 192.168.43.147.7772: UDP, length 120
02:26:56.022052 IP 192.168.43.124.8880 > 192.168.43.146.7771: UDP, length 120
02:26:56.045962 IP 192.168.43.146.8880 > 192.168.43.147.7772: UDP, length 120
02:26:56.059032 IP 192.168.43.124.8880 > 192.168.43.146.7771: UDP, length 120
02:26:56.095956 IP 192.168.43.146.8880 > 192.168.43.147.7772: UDP, length 120
02:26:56.111299 IP 192.168.43.124.8880 > 192.168.43.146.7771: UDP, length 120
02:26:56.145955 IP 192.168.43.146.8880 > 192.168.43.147.7772: UDP, length 120
02:26:56.159328 IP 192.168.43.124.8880 > 192.168.43.146.7771: UDP, length 120
02:26:56.196002 IP 192.168.43.146.8880 > 192.168.43.147.7772: UDP, length 120
02:26:56.231814 IP 192.168.43.124.8880 > 192.168.43.146.7771: UDP, length 120
02:26:56.245977 IP 192.168.43.146.8880 > 192.168.43.147.7772: UDP, length 120
02:26:56.258934 IP 192.168.43.124.8880 > 192.168.43.146.7771: UDP, length 120
02:26:56.295956 IP 192.168.43.146.8880 > 192.168.43.147.7772: UDP, length 120
02:26:56.311220 IP 192.168.43.124.8880 > 192.168.43.146.7771: UDP, length 120
02:26:56.345955 IP 192.168.43.146.8880 > 192.168.43.147.7772: UDP, length 120
02:26:56.384684 IP 192.168.43.124.8880 > 192.168.43.146.7771: UDP, length 120
02:26:56.395955 IP 192.168.43.146.8880 > 192.168.43.147.7772: UDP, length 120
02:26:56.411632 IP 192.168.43.124.8880 > 192.168.43.146.7771: UDP, length 120
02:26:56.445963 IP 192.168.43.146.8880 > 192.168.43.147.7772: UDP, length 120
02:26:56.459366 IP 192.168.43.124.8880 > 192.168.43.146.7771: UDP, length 120
02:26:56.495968 IP 192.168.43.146.8880 > 192.168.43.147.7772: UDP, length 120
02:26:56.524574 IP 192.168.43.124.8880 > 192.168.43.146.7771: UDP, length 120
02:26:56.545961 IP 192.168.43.146.8880 > 192.168.43.147.7772: UDP, length 120
02:26:56.559026 IP 192.168.43.124.8880 > 192.168.43.146.7771: UDP, length 120
02:26:56.595955 IP 192.168.43.146.8880 > 192.168.43.147.7772: UDP, length 120
02:26:56.611036 IP 192.168.43.124.8880 > 192.168.43.146.7771: UDP, length 120
02:26:56.645954 IP 192.168.43.146.8880 > 192.168.43.147.7772: UDP, length 120
02:26:56.667090 IP 192.168.43.124.8880 > 192.168.43.146.7771: UDP, length 120
02:26:56.695955 IP 192.168.43.146.8880 > 192.168.43.147.7772: UDP, length 120
02:26:56.709166 IP 192.168.43.124.8880 > 192.168.43.146.7771: UDP, length 120
02:26:56.746023 IP 192.168.43.146.8880 > 192.168.43.147.7772: UDP, length 120
02:26:56.759400 IP 192.168.43.124.8880 > 192.168.43.146.7771: UDP, length 120
02:26:56.795971 IP 192.168.43.146.8880 > 192.168.43.147.7772: UDP, length 120
02:26:56.823981 IP 192.168.43.124.8880 > 192.168.43.146.7771: UDP, length 120
02:26:56.845957 IP 192.168.43.146.8880 > 192.168.43.147.7772: UDP, length 120
02:26:56.859189 IP 192.168.43.124.8880 > 192.168.43.146.7771: UDP, length 120
02:26:56.895955 IP 192.168.43.146.8880 > 192.168.43.147.7772: UDP, length 120
02:26:56.909150 IP 192.168.43.124.8880 > 192.168.43.146.7771: UDP, length 120
02:26:56.945954 IP 192.168.43.146.8880 > 192.168.43.147.7772: UDP, length 120
02:26:56.961860 IP 192.168.43.124.8880 > 192.168.43.146.7771: UDP, length 120
02:26:56.996024 IP 192.168.43.146.8880 > 192.168.43.147.7772: UDP, length 120
02:26:57.009085 IP 192.168.43.124.8880 > 192.168.43.146.7771: UDP, length 120
02:26:57.046034 IP 192.168.43.146.8880 > 192.168.43.147.7772: UDP, length 120
02:26:57.066970 IP 192.168.43.124.8880 > 192.168.43.146.7771: UDP, length 120
02:26:57.096054 IP 192.168.43.146.8880 > 192.168.43.147.7772: UDP, length 120
02:26:57.111550 IP 192.168.43.124.8880 > 192.168.43.146.7771: UDP, length 120
02:26:57.146049 IP 192.168.43.146.8880 > 192.168.43.147.7772: UDP, length 120
02:26:57.159124 IP 192.168.43.124.8880 > 192.168.43.146.7771: UDP, length 120
02:26:57.196046 IP 192.168.43.146.8880 > 192.168.43.147.7772: UDP, length 120
02:26:57.209056 IP 192.168.43.124.8880 > 192.168.43.146.7771: UDP, length 120
02:26:57.246013 IP 192.168.43.146.8880 > 192.168.43.147.7772: UDP, length 120
02:26:57.260682 IP 192.168.43.124.8880 > 192.168.43.146.7771: UDP, length 120
02:26:57.296017 IP 192.168.43.146.8880 > 192.168.43.147.7772: UDP, length 120
02:26:57.308917 IP 192.168.43.124.8880 > 192.168.43.146.7771: UDP, length 120
02:26:57.345999 IP 192.168.43.146.8880 > 192.168.43.147.7772: UDP, length 120
02:26:57.359155 IP 192.168.43.124.8880 > 192.168.43.146.7771: UDP, length 120
02:26:57.396012 IP 192.168.43.146.8880 > 192.168.43.147.7772: UDP, length 120
02:26:57.410305 IP 192.168.43.124.8880 > 192.168.43.146.7771: UDP, length 120
02:26:57.446019 IP 192.168.43.146.8880 > 192.168.43.147.7772: UDP, length 120
02:26:57.483286 IP 192.168.43.124.8880 > 192.168.43.146.7771: UDP, length 120
02:26:57.495981 IP 192.168.43.146.8880 > 192.168.43.147.7772: UDP, length 120
02:26:57.508994 IP 192.168.43.124.8880 > 192.168.43.146.7771: UDP, length 120
02:26:57.545990 IP 192.168.43.146.8880 > 192.168.43.147.7772: UDP, length 120
02:26:57.559686 IP 192.168.43.124.8880 > 192.168.43.146.7771: UDP, length 120
02:26:57.595962 IP 192.168.43.146.8880 > 192.168.43.147.7772: UDP, length 120
02:26:57.623110 IP 192.168.43.124.8880 > 192.168.43.146.7771: UDP, length 120
02:26:57.645961 IP 192.168.43.146.8880 > 192.168.43.147.7772: UDP, length 120
02:26:57.660350 IP 192.168.43.124.8880 > 192.168.43.146.7771: UDP, length 120
02:26:57.695989 IP 192.168.43.146.8880 > 192.168.43.147.7772: UDP, length 120
02:26:57.719077 IP 192.168.43.124.8880 > 192.168.43.146.7771: UDP, length 120
02:26:57.746046 IP 192.168.43.146.8880 > 192.168.43.147.7772: UDP, length 120
02:26:57.780135 IP 192.168.43.124.8880 > 192.168.43.146.7771: UDP, length 120
02:26:57.795978 IP 192.168.43.146.8880 > 192.168.43.147.7772: UDP, length 120
02:26:57.809398 IP 192.168.43.124.8880 > 192.168.43.146.7771: UDP, length 120
02:26:57.845959 IP 192.168.43.146.8880 > 192.168.43.147.7772: UDP, length 120
02:26:57.871314 IP 192.168.43.124.8880 > 192.168.43.146.7771: UDP, length 120
02:26:57.895955 IP 192.168.43.146.8880 > 192.168.43.147.7772: UDP, length 120
02:26:57.909195 IP 192.168.43.124.8880 > 192.168.43.146.7771: UDP, length 120
02:26:57.945956 IP 192.168.43.146.8880 > 192.168.43.147.7772: UDP, length 120
02:26:57.961509 IP 192.168.43.124.8880 > 192.168.43.146.7771: UDP, length 120
02:26:57.995953 IP 192.168.43.146.8880 > 192.168.43.147.7772: UDP, length 120
02:26:58.024883 IP 192.168.43.124.8880 > 192.168.43.146.7771: UDP, length 120
02:26:58.045966 IP 192.168.43.146.8880 > 192.168.43.147.7772: UDP, length 120
02:26:58.059014 IP 192.168.43.124.8880 > 192.168.43.146.7771: UDP, length 120
02:26:58.095957 IP 192.168.43.146.8880 > 192.168.43.147.7772: UDP, length 120
02:26:58.108969 IP 192.168.43.124.8880 > 192.168.43.146.7771: UDP, length 120
02:26:58.145957 IP 192.168.43.146.8880 > 192.168.43.147.7772: UDP, length 120
02:26:58.176764 IP 192.168.43.124.8880 > 192.168.43.146.7771: UDP, length 120
02:26:58.195954 IP 192.168.43.146.8880 > 192.168.43.147.7772: UDP, length 120
02:26:58.208981 IP 192.168.43.124.8880 > 192.168.43.146.7771: UDP, length 120
02:26:58.245953 IP 192.168.43.146.8880 > 192.168.43.147.7772: UDP, length 120
02:26:58.259372 IP 192.168.43.124.8880 > 192.168.43.146.7771: UDP, length 120
02:26:58.295952 IP 192.168.43.146.8880 > 192.168.43.147.7772: UDP, length 120
02:26:58.309267 IP 192.168.43.124.8880 > 192.168.43.146.7771: UDP, length 120
02:26:58.345954 IP 192.168.43.146.8880 > 192.168.43.147.7772: UDP, length 120
02:26:58.381015 IP 192.168.43.124.8880 > 192.168.43.146.7771: UDP, length 120
02:26:58.395955 IP 192.168.43.146.8880 > 192.168.43.147.7772: UDP, length 120
02:26:58.409225 IP 192.168.43.124.8880 > 192.168.43.146.7771: UDP, length 120
02:26:58.445957 IP 192.168.43.146.8880 > 192.168.43.147.7772: UDP, length 120
02:26:58.459668 IP 192.168.43.124.8880 > 192.168.43.146.7771: UDP, length 120
02:26:58.495955 IP 192.168.43.146.8880 > 192.168.43.147.7772: UDP, length 120
02:26:58.518579 IP 192.168.43.124.8880 > 192.168.43.146.7771: UDP, length 120
02:26:58.545965 IP 192.168.43.146.8880 > 192.168.43.147.7772: UDP, length 120
02:26:58.565117 IP 192.168.43.124.8880 > 192.168.43.146.7771: UDP, length 120
02:26:58.595959 IP 192.168.43.146.8880 > 192.168.43.147.7772: UDP, length 120
02:26:58.608966 IP 192.168.43.124.8880 > 192.168.43.146.7771: UDP, length 120
02:26:58.645969 IP 192.168.43.146.8880 > 192.168.43.147.7772: UDP, length 120
02:26:58.672204 IP 192.168.43.124.8880 > 192.168.43.146.7771: UDP, length 120
02:26:58.695960 IP 192.168.43.146.8880 > 192.168.43.147.7772: UDP, length 120
02:26:58.708944 IP 192.168.43.124.8880 > 192.168.43.146.7771: UDP, length 120
02:26:58.745959 IP 192.168.43.146.8880 > 192.168.43.147.7772: UDP, length 120
02:26:58.759381 IP 192.168.43.124.8880 > 192.168.43.146.7771: UDP, length 120
02:26:58.796006 IP 192.168.43.146.8880 > 192.168.43.147.7772: UDP, length 120
02:26:58.818004 IP 192.168.43.124.8880 > 192.168.43.146.7771: UDP, length 120
02:26:58.845963 IP 192.168.43.146.8880 > 192.168.43.147.7772: UDP, length 120
02:26:58.858903 IP 192.168.43.124.8880 > 192.168.43.146.7771: UDP, length 120
02:26:58.895959 IP 192.168.43.146.8880 > 192.168.43.147.7772: UDP, length 120
02:26:58.909628 IP 192.168.43.124.8880 > 192.168.43.146.7771: UDP, length 120
02:26:58.945959 IP 192.168.43.146.8880 > 192.168.43.147.7772: UDP, length 120
02:26:58.974400 IP 192.168.43.124.8880 > 192.168.43.146.7771: UDP, length 120
02:26:58.995957 IP 192.168.43.146.8880 > 192.168.43.147.7772: UDP, length 120
02:26:59.009135 IP 192.168.43.124.8880 > 192.168.43.146.7771: UDP, length 120
02:26:59.045967 IP 192.168.43.146.8880 > 192.168.43.147.7772: UDP, length 120
02:26:59.073151 IP 192.168.43.124.8880 > 192.168.43.146.7771: UDP, length 120
02:26:59.095958 IP 192.168.43.146.8880 > 192.168.43.147.7772: UDP, length 120
02:26:59.118956 IP 192.168.43.124.8880 > 192.168.43.146.7771: UDP, length 120
02:26:59.145956 IP 192.168.43.146.8880 > 192.168.43.147.7772: UDP, length 120
02:26:59.163452 IP 192.168.43.124.8880 > 192.168.43.146.7771: UDP, length 120
02:26:59.195953 IP 192.168.43.146.8880 > 192.168.43.147.7772: UDP, length 120
02:26:59.219580 IP 192.168.43.124.8880 > 192.168.43.146.7771: UDP, length 120
02:26:59.245990 IP 192.168.43.146.8880 > 192.168.43.147.7772: UDP, length 120
02:26:59.267772 IP 192.168.43.124.8880 > 192.168.43.146.7771: UDP, length 120
02:26:59.295958 IP 192.168.43.146.8880 > 192.168.43.147.7772: UDP, length 120
02:26:59.309031 IP 192.168.43.124.8880 > 192.168.43.146.7771: UDP, length 120
02:26:59.345959 IP 192.168.43.146.8880 > 192.168.43.147.7772: UDP, length 120
02:26:59.359388 IP 192.168.43.124.8880 > 192.168.43.146.7771: UDP, length 120
02:26:59.395955 IP 192.168.43.146.8880 > 192.168.43.147.7772: UDP, length 120
02:26:59.422188 IP 192.168.43.124.8880 > 192.168.43.146.7771: UDP, length 120
02:26:59.445957 IP 192.168.43.146.8880 > 192.168.43.147.7772: UDP, length 120
02:26:59.458953 IP 192.168.43.124.8880 > 192.168.43.146.7771: UDP, length 120
02:26:59.495956 IP 192.168.43.146.8880 > 192.168.43.147.7772: UDP, length 120
02:26:59.509017 IP 192.168.43.124.8880 > 192.168.43.146.7771: UDP, length 120
02:26:59.545963 IP 192.168.43.146.8880 > 192.168.43.147.7772: UDP, length 120
02:26:59.572160 IP 192.168.43.124.8880 > 192.168.43.146.7771: UDP, length 120
02:26:59.595956 IP 192.168.43.146.8880 > 192.168.43.147.7772: UDP, length 120
02:26:59.609008 IP 192.168.43.124.8880 > 192.168.43.146.7771: UDP, length 120
02:26:59.645966 IP 192.168.43.146.8880 > 192.168.43.147.7772: UDP, length 120
02:26:59.659032 IP 192.168.43.124.8880 > 192.168.43.146.7771: UDP, length 120
02:26:59.695961 IP 192.168.43.146.8880 > 192.168.43.147.7772: UDP, length 120
02:26:59.722087 IP 192.168.43.124.8880 > 192.168.43.146.7771: UDP, length 120
02:26:59.745957 IP 192.168.43.146.8880 > 192.168.43.147.7772: UDP, length 120
02:26:59.761211 IP 192.168.43.124.8880 > 192.168.43.146.7771: UDP, length 120
02:26:59.795954 IP 192.168.43.146.8880 > 192.168.43.147.7772: UDP, length 120
02:26:59.810825 IP 192.168.43.124.8880 > 192.168.43.146.7771: UDP, length 120
02:26:59.845955 IP 192.168.43.146.8880 > 192.168.43.147.7772: UDP, length 120
02:26:59.874167 IP 192.168.43.124.8880 > 192.168.43.146.7771: UDP, length 120
02:26:59.895953 IP 192.168.43.146.8880 > 192.168.43.147.7772: UDP, length 120
02:26:59.918393 IP 192.168.43.124.8880 > 192.168.43.146.7771: UDP, length 120
02:26:59.945959 IP 192.168.43.146.8880 > 192.168.43.147.7772: UDP, length 120
02:26:59.959025 IP 192.168.43.124.8880 > 192.168.43.146.7771: UDP, length 120
02:26:59.995953 IP 192.168.43.146.8880 > 192.168.43.147.7772: UDP, length 120
02:27:00.028698 IP 192.168.43.124.8880 > 192.168.43.146.7771: UDP, length 120
02:27:00.045964 IP 192.168.43.146.8880 > 192.168.43.147.7772: UDP, length 120
02:27:00.070262 IP 192.168.43.124.8880 > 192.168.43.146.7771: UDP, length 120
02:27:00.095957 IP 192.168.43.146.8880 > 192.168.43.147.7772: UDP, length 120
02:27:00.115445 IP 192.168.43.124.8880 > 192.168.43.146.7771: UDP, length 120
02:27:00.145956 IP 192.168.43.146.8880 > 192.168.43.147.7772: UDP, length 120
02:27:00.176531 IP 192.168.43.124.8880 > 192.168.43.146.7771: UDP, length 120
02:27:00.195954 IP 192.168.43.146.8880 > 192.168.43.147.7772: UDP, length 120
02:27:00.208504 IP 192.168.43.124.8880 > 192.168.43.146.7771: UDP, length 120
02:27:00.245955 IP 192.168.43.146.8880 > 192.168.43.147.7772: UDP, length 120
02:27:00.258969 IP 192.168.43.124.8880 > 192.168.43.146.7771: UDP, length 120
02:27:00.295971 IP 192.168.43.146.8880 > 192.168.43.147.7772: UDP, length 120
02:27:00.323017 IP 192.168.43.124.8880 > 192.168.43.146.7771: UDP, length 120
02:27:00.345963 IP 192.168.43.146.8880 > 192.168.43.147.7772: UDP, length 120
02:27:00.359140 IP 192.168.43.124.8880 > 192.168.43.146.7771: UDP, length 120
02:27:00.395953 IP 192.168.43.146.8880 > 192.168.43.147.7772: UDP, length 120
02:27:00.409013 IP 192.168.43.124.8880 > 192.168.43.146.7771: UDP, length 120
02:27:00.445955 IP 192.168.43.146.8880 > 192.168.43.147.7772: UDP, length 120
02:27:00.460773 IP 192.168.43.124.8880 > 192.168.43.146.7771: UDP, length 120
02:27:00.495954 IP 192.168.43.146.8880 > 192.168.43.147.7772: UDP, length 120
02:27:00.532805 IP 192.168.43.124.8880 > 192.168.43.146.7771: UDP, length 120
02:27:00.545953 IP 192.168.43.146.8880 > 192.168.43.147.7772: UDP, length 120
02:27:00.559151 IP 192.168.43.124.8880 > 192.168.43.146.7771: UDP, length 120
02:27:00.595962 IP 192.168.43.146.8880 > 192.168.43.147.7772: UDP, length 120
02:27:00.625128 IP 192.168.43.124.8880 > 192.168.43.146.7771: UDP, length 120
02:27:00.645959 IP 192.168.43.146.8880 > 192.168.43.147.7772: UDP, length 120
02:27:00.658995 IP 192.168.43.124.8880 > 192.168.43.146.7771: UDP, length 120
02:27:00.695965 IP 192.168.43.146.8880 > 192.168.43.147.7772: UDP, length 120
02:27:00.709078 IP 192.168.43.124.8880 > 192.168.43.146.7771: UDP, length 120
02:27:00.745994 IP 192.168.43.146.8880 > 192.168.43.147.7772: UDP, length 120
02:27:00.760386 IP 192.168.43.124.8880 > 192.168.43.146.7771: UDP, length 120
02:27:00.796043 IP 192.168.43.146.8880 > 192.168.43.147.7772: UDP, length 120
02:27:00.834982 IP 192.168.43.124.8880 > 192.168.43.146.7771: UDP, length 120
02:27:00.846037 IP 192.168.43.146.8880 > 192.168.43.147.7772: UDP, length 120
02:27:00.859571 IP 192.168.43.124.8880 > 192.168.43.146.7771: UDP, length 120
02:27:00.896029 IP 192.168.43.146.8880 > 192.168.43.147.7772: UDP, length 120
02:27:00.915396 IP 192.168.43.124.8880 > 192.168.43.146.7771: UDP, length 120
02:27:00.945972 IP 192.168.43.146.8880 > 192.168.43.147.7772: UDP, length 120
02:27:00.958814 IP 192.168.43.124.8880 > 192.168.43.146.7771: UDP, length 120
02:27:00.995936 IP 192.168.43.146.8880 > 192.168.43.147.7772: UDP, length 120
02:27:01.009767 IP 192.168.43.124.8880 > 192.168.43.146.7771: UDP, length 120
02:27:01.045964 IP 192.168.43.146.8880 > 192.168.43.147.7772: UDP, length 120
02:27:01.060196 IP 192.168.43.124.8880 > 192.168.43.146.7771: UDP, length 120
02:27:01.095934 IP 192.168.43.146.8880 > 192.168.43.147.7772: UDP, length 120
02:27:01.133147 IP 192.168.43.124.8880 > 192.168.43.146.7771: UDP, length 120
02:27:01.145928 IP 192.168.43.146.8880 > 192.168.43.147.7772: UDP, length 120
02:27:01.159551 IP 192.168.43.124.8880 > 192.168.43.146.7771: UDP, length 120
02:27:01.195927 IP 192.168.43.146.8880 > 192.168.43.147.7772: UDP, length 120
02:27:01.211166 IP 192.168.43.124.8880 > 192.168.43.146.7771: UDP, length 120
02:27:01.245928 IP 192.168.43.146.8880 > 192.168.43.147.7772: UDP, length 120
02:27:01.283842 IP 192.168.43.124.8880 > 192.168.43.146.7771: UDP, length 120
02:27:01.295927 IP 192.168.43.146.8880 > 192.168.43.147.7772: UDP, length 120
02:27:01.309151 IP 192.168.43.124.8880 > 192.168.43.146.7771: UDP, length 120
02:27:01.345928 IP 192.168.43.146.8880 > 192.168.43.147.7772: UDP, length 120
02:27:01.365214 IP 192.168.43.124.8880 > 192.168.43.146.7771: UDP, length 120
02:27:01.395928 IP 192.168.43.146.8880 > 192.168.43.147.7772: UDP, length 120
02:27:01.408847 IP 192.168.43.124.8880 > 192.168.43.146.7771: UDP, length 120
02:27:01.445928 IP 192.168.43.146.8880 > 192.168.43.147.7772: UDP, length 120
02:27:01.459165 IP 192.168.43.124.8880 > 192.168.43.146.7771: UDP, length 120
02:27:01.495927 IP 192.168.43.146.8880 > 192.168.43.147.7772: UDP, length 120
02:27:01.515229 IP 192.168.43.124.8880 > 192.168.43.146.7771: UDP, length 120
02:27:01.545928 IP 192.168.43.146.8880 > 192.168.43.147.7772: UDP, length 120
02:27:01.584281 IP 192.168.43.124.8880 > 192.168.43.146.7771: UDP, length 120
02:27:01.595927 IP 192.168.43.146.8880 > 192.168.43.147.7772: UDP, length 120
02:27:01.609119 IP 192.168.43.124.8880 > 192.168.43.146.7771: UDP, length 120
02:27:01.645930 IP 192.168.43.146.8880 > 192.168.43.147.7772: UDP, length 120
02:27:01.660069 IP 192.168.43.124.8880 > 192.168.43.146.7771: UDP, length 120
02:27:01.695929 IP 192.168.43.146.8880 > 192.168.43.147.7772: UDP, length 120
02:27:01.733331 IP 192.168.43.124.8880 > 192.168.43.146.7771: UDP, length 120
02:27:01.745934 IP 192.168.43.146.8880 > 192.168.43.147.7772: UDP, length 120
02:27:01.759308 IP 192.168.43.124.8880 > 192.168.43.146.7771: UDP, length 120
02:27:01.795931 IP 192.168.43.146.8880 > 192.168.43.147.7772: UDP, length 120
02:27:01.821890 IP 192.168.43.124.8880 > 192.168.43.146.7771: UDP, length 120
02:27:01.845931 IP 192.168.43.146.8880 > 192.168.43.147.7772: UDP, length 120
02:27:01.860509 IP 192.168.43.124.8880 > 192.168.43.146.7771: UDP, length 120
02:27:01.895928 IP 192.168.43.146.8880 > 192.168.43.147.7772: UDP, length 120
02:27:01.927798 IP 192.168.43.124.8880 > 192.168.43.146.7771: UDP, length 120
02:27:01.946003 IP 192.168.43.146.8880 > 192.168.43.147.7772: UDP, length 120
02:27:01.960954 IP 192.168.43.124.8880 > 192.168.43.146.7771: UDP, length 120
02:27:01.995967 IP 192.168.43.146.8880 > 192.168.43.147.7772: UDP, length 120
02:27:02.045947 IP 192.168.43.146.8880 > 192.168.43.147.7772: UDP, length 120
02:27:02.051547 IP 192.168.43.124.8880 > 192.168.43.146.7771: UDP, length 120
02:27:02.085680 IP 192.168.43.124.8880 > 192.168.43.146.7771: UDP, length 120
02:27:02.095962 IP 192.168.43.146.8880 > 192.168.43.147.7772: UDP, length 120
02:27:02.118287 IP 192.168.43.124.8880 > 192.168.43.146.7771: UDP, length 120
02:27:02.145930 IP 192.168.43.146.8880 > 192.168.43.147.7772: UDP, length 120
02:27:02.160267 IP 192.168.43.124.8880 > 192.168.43.146.7771: UDP, length 120
02:27:02.195925 IP 192.168.43.146.8880 > 192.168.43.147.7772: UDP, length 120
02:27:02.233577 IP 192.168.43.124.8880 > 192.168.43.146.7771: UDP, length 120
02:27:02.245957 IP 192.168.43.146.8880 > 192.168.43.147.7772: UDP, length 120
02:27:02.259128 IP 192.168.43.124.8880 > 192.168.43.146.7771: UDP, length 120
02:27:02.295929 IP 192.168.43.146.8880 > 192.168.43.147.7772: UDP, length 120
02:27:02.310747 IP 192.168.43.124.8880 > 192.168.43.146.7771: UDP, length 120
02:27:02.345929 IP 192.168.43.146.8880 > 192.168.43.147.7772: UDP, length 120
02:27:02.383097 IP 192.168.43.124.8880 > 192.168.43.146.7771: UDP, length 120
02:27:02.395926 IP 192.168.43.146.8880 > 192.168.43.147.7772: UDP, length 120
02:27:02.408969 IP 192.168.43.124.8880 > 192.168.43.146.7771: UDP, length 120
02:27:02.445930 IP 192.168.43.146.8880 > 192.168.43.147.7772: UDP, length 120
02:27:02.460448 IP 192.168.43.124.8880 > 192.168.43.146.7771: UDP, length 120
02:27:02.496003 IP 192.168.43.146.8880 > 192.168.43.147.7772: UDP, length 120
