03:58:48.335916 IP 192.168.43.124.8880 > 192.168.43.195.7771: UDP, length 120
03:58:48.336092 IP 192.168.43.124.8880 > 192.168.43.195.7771: UDP, length 120
03:58:48.466028 IP 192.168.43.124.8880 > 192.168.43.195.7771: UDP, length 120
03:58:48.466148 IP 192.168.43.124.8880 > 192.168.43.195.7771: UDP, length 120
03:58:48.501917 IP 192.168.43.124.8880 > 192.168.43.195.7771: UDP, length 120
03:58:48.502151 IP 192.168.43.124.8880 > 192.168.43.195.7771: UDP, length 120
03:58:48.502265 IP 192.168.43.124.8880 > 192.168.43.195.7771: UDP, length 120
03:58:48.502376 IP 192.168.43.124.8880 > 192.168.43.195.7771: UDP, length 120
03:58:48.620144 IP 192.168.43.124.8880 > 192.168.43.195.7771: UDP, length 120
03:58:48.620390 IP 192.168.43.124.8880 > 192.168.43.195.7771: UDP, length 120
03:58:48.720387 IP 192.168.43.124.8880 > 192.168.43.195.7771: UDP, length 120
03:58:48.720620 IP 192.168.43.124.8880 > 192.168.43.195.7771: UDP, length 120
03:58:48.815474 IP 192.168.43.124.8880 > 192.168.43.195.7771: UDP, length 120
03:58:48.815886 IP 192.168.43.124.8880 > 192.168.43.195.7771: UDP, length 120
03:58:48.892647 IP 192.168.43.195.8880 > 192.168.43.124.7772: UDP, length 120
03:58:48.924913 IP 192.168.43.124.8880 > 192.168.43.195.7771: UDP, length 120
03:58:48.925079 IP 192.168.43.124.8880 > 192.168.43.195.7771: UDP, length 120
03:58:48.925200 IP 192.168.43.124.8880 > 192.168.43.195.7771: UDP, length 120
03:58:48.942705 IP 192.168.43.195.8880 > 192.168.43.124.7772: UDP, length 120
03:58:48.988002 IP 192.168.43.124.8880 > 192.168.43.195.7771: UDP, length 120
03:58:48.992675 IP 192.168.43.195.8880 > 192.168.43.124.7772: UDP, length 120
03:58:49.022296 IP 192.168.43.124.8880 > 192.168.43.195.7771: UDP, length 120
03:58:49.042668 IP 192.168.43.195.8880 > 192.168.43.124.7772: UDP, length 120
03:58:49.075628 IP 192.168.43.124.8880 > 192.168.43.195.7771: UDP, length 120
03:58:49.092666 IP 192.168.43.195.8880 > 192.168.43.124.7772: UDP, length 120
03:58:49.123325 IP 192.168.43.124.8880 > 192.168.43.195.7771: UDP, length 120
03:58:49.142665 IP 192.168.43.195.8880 > 192.168.43.124.7772: UDP, length 120
03:58:49.173268 IP 192.168.43.124.8880 > 192.168.43.195.7771: UDP, length 120
03:58:49.192664 IP 192.168.43.195.8880 > 192.168.43.124.7772: UDP, length 120
03:58:49.222158 IP 192.168.43.124.8880 > 192.168.43.195.7771: UDP, length 120
03:58:49.242666 IP 192.168.43.195.8880 > 192.168.43.124.7772: UDP, length 120
03:58:49.272175 IP 192.168.43.124.8880 > 192.168.43.195.7771: UDP, length 120
03:58:49.292667 IP 192.168.43.195.8880 > 192.168.43.124.7772: UDP, length 120
03:58:49.322154 IP 192.168.43.124.8880 > 192.168.43.195.7771: UDP, length 120
03:58:49.342665 IP 192.168.43.195.8880 > 192.168.43.124.7772: UDP, length 120
03:58:49.378524 IP 192.168.43.124.8880 > 192.168.43.195.7771: UDP, length 120
03:58:49.392663 IP 192.168.43.195.8880 > 192.168.43.124.7772: UDP, length 120
03:58:49.422155 IP 192.168.43.124.8880 > 192.168.43.195.7771: UDP, length 120
03:58:49.442664 IP 192.168.43.195.8880 > 192.168.43.124.7772: UDP, length 120
03:58:49.491249 IP 192.168.43.124.8880 > 192.168.43.195.7771: UDP, length 120
03:58:49.492661 IP 192.168.43.195.8880 > 192.168.43.124.7772: UDP, length 120
03:58:49.522197 IP 192.168.43.124.8880 > 192.168.43.195.7771: UDP, length 120
03:58:49.542674 IP 192.168.43.195.8880 > 192.168.43.124.7772: UDP, length 120
03:58:49.568999 IP 192.168.43.124.8880 > 192.168.43.195.7771: UDP, length 120
03:58:49.592672 IP 192.168.43.195.8880 > 192.168.43.124.7772: UDP, length 120
03:58:49.622216 IP 192.168.43.124.8880 > 192.168.43.195.7771: UDP, length 120
03:58:49.642666 IP 192.168.43.195.8880 > 192.168.43.124.7772: UDP, length 120
03:58:49.672267 IP 192.168.43.124.8880 > 192.168.43.195.7771: UDP, length 120
03:58:49.692664 IP 192.168.43.195.8880 > 192.168.43.124.7772: UDP, length 120
03:58:49.742660 IP 192.168.43.195.8880 > 192.168.43.124.7772: UDP, length 120
03:58:49.744978 IP 192.168.43.124.8880 > 192.168.43.195.7771: UDP, length 120
03:58:49.772747 IP 192.168.43.124.8880 > 192.168.43.195.7771: UDP, length 120
03:58:49.792668 IP 192.168.43.195.8880 > 192.168.43.124.7772: UDP, length 120
03:58:49.823994 IP 192.168.43.124.8880 > 192.168.43.195.7771: UDP, length 120
03:58:49.842666 IP 192.168.43.195.8880 > 192.168.43.124.7772: UDP, length 120
03:58:49.872890 IP 192.168.43.124.8880 > 192.168.43.195.7771: UDP, length 120
03:58:49.892684 IP 192.168.43.195.8880 > 192.168.43.124.7772: UDP, length 120
03:58:49.942675 IP 192.168.43.195.8880 > 192.168.43.124.7772: UDP, length 120
03:58:49.982222 IP 192.168.43.124.8880 > 192.168.43.195.7771: UDP, length 120
03:58:49.982496 IP 192.168.43.124.8880 > 192.168.43.195.7771: UDP, length 120
03:58:49.992670 IP 192.168.43.195.8880 > 192.168.43.124.7772: UDP, length 120
03:58:50.042661 IP 192.168.43.195.8880 > 192.168.43.124.7772: UDP, length 120
03:58:50.092661 IP 192.168.43.195.8880 > 192.168.43.124.7772: UDP, length 120
03:58:50.142725 IP 192.168.43.195.8880 > 192.168.43.124.7772: UDP, length 120
03:58:50.192669 IP 192.168.43.195.8880 > 192.168.43.124.7772: UDP, length 120
03:58:50.242665 IP 192.168.43.195.8880 > 192.168.43.124.7772: UDP, length 120
03:58:50.292663 IP 192.168.43.195.8880 > 192.168.43.124.7772: UDP, length 120
03:58:50.342661 IP 192.168.43.195.8880 > 192.168.43.124.7772: UDP, length 120
03:58:50.392664 IP 192.168.43.195.8880 > 192.168.43.124.7772: UDP, length 120
03:58:50.424207 IP 192.168.43.124.8880 > 192.168.43.195.7771: UDP, length 120
03:58:50.424514 IP 192.168.43.124.8880 > 192.168.43.195.7771: UDP, length 120
03:58:50.442666 IP 192.168.43.195.8880 > 192.168.43.124.7772: UDP, length 120
03:58:50.492662 IP 192.168.43.195.8880 > 192.168.43.124.7772: UDP, length 120
03:58:50.542662 IP 192.168.43.195.8880 > 192.168.43.124.7772: UDP, length 120
03:58:50.586474 IP 192.168.43.124.8880 > 192.168.43.195.7771: UDP, length 120
03:58:50.586768 IP 192.168.43.124.8880 > 192.168.43.195.7771: UDP, length 120
03:58:50.586982 IP 192.168.43.124.8880 > 192.168.43.195.7771: UDP, length 120
03:58:50.587190 IP 192.168.43.124.8880 > 192.168.43.195.7771: UDP, length 120
03:58:50.592670 IP 192.168.43.195.8880 > 192.168.43.124.7772: UDP, length 120
03:58:50.642666 IP 192.168.43.195.8880 > 192.168.43.124.7772: UDP, length 120
03:58:50.649578 IP 192.168.43.124.8880 > 192.168.43.195.7771: UDP, length 120
03:58:50.692666 IP 192.168.43.195.8880 > 192.168.43.124.7772: UDP, length 120
03:58:50.728607 IP 192.168.43.124.8880 > 192.168.43.195.7771: UDP, length 120
03:58:50.735746 IP 192.168.43.124.8880 > 192.168.43.195.7771: UDP, length 120
03:58:50.742668 IP 192.168.43.195.8880 > 192.168.43.124.7772: UDP, length 120
03:58:50.774249 IP 192.168.43.124.8880 > 192.168.43.195.7771: UDP, length 120
03:58:50.792667 IP 192.168.43.195.8880 > 192.168.43.124.7772: UDP, length 120
03:58:50.822294 IP 192.168.43.124.8880 > 192.168.43.195.7771: UDP, length 120
03:58:50.842666 IP 192.168.43.195.8880 > 192.168.43.124.7772: UDP, length 120
03:58:50.870505 IP 192.168.43.124.8880 > 192.168.43.195.7771: UDP, length 120
03:58:50.892671 IP 192.168.43.195.8880 > 192.168.43.124.7772: UDP, length 120
03:58:50.922731 IP 192.168.43.124.8880 > 192.168.43.195.7771: UDP, length 120
03:58:50.942688 IP 192.168.43.195.8880 > 192.168.43.124.7772: UDP, length 120
03:58:50.974302 IP 192.168.43.124.8880 > 192.168.43.195.7771: UDP, length 120
03:58:50.992670 IP 192.168.43.195.8880 > 192.168.43.124.7772: UDP, length 120
03:58:51.024404 IP 192.168.43.124.8880 > 192.168.43.195.7771: UDP, length 120
03:58:51.042668 IP 192.168.43.195.8880 > 192.168.43.124.7772: UDP, length 120
03:58:51.076239 IP 192.168.43.124.8880 > 192.168.43.195.7771: UDP, length 120
03:58:51.092663 IP 192.168.43.195.8880 > 192.168.43.124.7772: UDP, length 120
03:58:51.126811 IP 192.168.43.124.8880 > 192.168.43.195.7771: UDP, length 120
03:58:51.142663 IP 192.168.43.195.8880 > 192.168.43.124.7772: UDP, length 120
03:58:51.172315 IP 192.168.43.124.8880 > 192.168.43.195.7771: UDP, length 120
03:58:51.192663 IP 192.168.43.195.8880 > 192.168.43.124.7772: UDP, length 120
03:58:51.222246 IP 192.168.43.124.8880 > 192.168.43.195.7771: UDP, length 120
03:58:51.242665 IP 192.168.43.195.8880 > 192.168.43.124.7772: UDP, length 120
03:58:51.273871 IP 192.168.43.124.8880 > 192.168.43.195.7771: UDP, length 120
03:58:51.292663 IP 192.168.43.195.8880 > 192.168.43.124.7772: UDP, length 120
03:58:51.320730 IP 192.168.43.124.8880 > 192.168.43.195.7771: UDP, length 120
03:58:51.342665 IP 192.168.43.195.8880 > 192.168.43.124.7772: UDP, length 120
03:58:51.370449 IP 192.168.43.124.8880 > 192.168.43.195.7771: UDP, length 120
03:58:51.392662 IP 192.168.43.195.8880 > 192.168.43.124.7772: UDP, length 120
03:58:51.422516 IP 192.168.43.124.8880 > 192.168.43.195.7771: UDP, length 120
03:58:51.442664 IP 192.168.43.195.8880 > 192.168.43.124.7772: UDP, length 120
03:58:51.470727 IP 192.168.43.124.8880 > 192.168.43.195.7771: UDP, length 120
03:58:51.492667 IP 192.168.43.195.8880 > 192.168.43.124.7772: UDP, length 120
03:58:51.522531 IP 192.168.43.124.8880 > 192.168.43.195.7771: UDP, length 120
03:58:51.542666 IP 192.168.43.195.8880 > 192.168.43.124.7772: UDP, length 120
03:58:51.572574 IP 192.168.43.124.8880 > 192.168.43.195.7771: UDP, length 120
03:58:51.592667 IP 192.168.43.195.8880 > 192.168.43.124.7772: UDP, length 120
03:58:51.622580 IP 192.168.43.124.8880 > 192.168.43.195.7771: UDP, length 120
03:58:51.642715 IP 192.168.43.195.8880 > 192.168.43.124.7772: UDP, length 120
03:58:51.671996 IP 192.168.43.124.8880 > 192.168.43.195.7771: UDP, length 120
03:58:51.692670 IP 192.168.43.195.8880 > 192.168.43.124.7772: UDP, length 120
03:58:51.722008 IP 192.168.43.124.8880 > 192.168.43.195.7771: UDP, length 120
03:58:51.742665 IP 192.168.43.195.8880 > 192.168.43.124.7772: UDP, length 120
03:58:51.772124 IP 192.168.43.124.8880 > 192.168.43.195.7771: UDP, length 120
03:58:51.792665 IP 192.168.43.195.8880 > 192.168.43.124.7772: UDP, length 120
03:58:51.819988 IP 192.168.43.124.8880 > 192.168.43.195.7771: UDP, length 120
03:58:51.842667 IP 192.168.43.195.8880 > 192.168.43.124.7772: UDP, length 120
03:58:51.870369 IP 192.168.43.124.8880 > 192.168.43.195.7771: UDP, length 120
03:58:51.892668 IP 192.168.43.195.8880 > 192.168.43.124.7772: UDP, length 120
03:58:51.922801 IP 192.168.43.124.8880 > 192.168.43.195.7771: UDP, length 120
03:58:51.942679 IP 192.168.43.195.8880 > 192.168.43.124.7772: UDP, length 120
03:58:51.973321 IP 192.168.43.124.8880 > 192.168.43.195.7771: UDP, length 120
03:58:51.992672 IP 192.168.43.195.8880 > 192.168.43.124.7772: UDP, length 120
03:58:52.020478 IP 192.168.43.124.8880 > 192.168.43.195.7771: UDP, length 120
03:58:52.042674 IP 192.168.43.195.8880 > 192.168.43.124.7772: UDP, length 120
03:58:52.071064 IP 192.168.43.124.8880 > 192.168.43.195.7771: UDP, length 120
03:58:52.092666 IP 192.168.43.195.8880 > 192.168.43.124.7772: UDP, length 120
03:58:52.120465 IP 192.168.43.124.8880 > 192.168.43.195.7771: UDP, length 120
03:58:52.142666 IP 192.168.43.195.8880 > 192.168.43.124.7772: UDP, length 120
03:58:52.170576 IP 192.168.43.124.8880 > 192.168.43.195.7771: UDP, length 120
03:58:52.192668 IP 192.168.43.195.8880 > 192.168.43.124.7772: UDP, length 120
03:58:52.220869 IP 192.168.43.124.8880 > 192.168.43.195.7771: UDP, length 120
03:58:52.242667 IP 192.168.43.195.8880 > 192.168.43.124.7772: UDP, length 120
03:58:52.292662 IP 192.168.43.195.8880 > 192.168.43.124.7772: UDP, length 120
03:58:52.342661 IP 192.168.43.195.8880 > 192.168.43.124.7772: UDP, length 120
03:58:52.392661 IP 192.168.43.195.8880 > 192.168.43.124.7772: UDP, length 120
03:58:52.419512 IP 192.168.43.124.8880 > 192.168.43.195.7771: UDP, length 120
03:58:52.419761 IP 192.168.43.124.8880 > 192.168.43.195.7771: UDP, length 120
03:58:52.442665 IP 192.168.43.195.8880 > 192.168.43.124.7772: UDP, length 120
03:58:52.492663 IP 192.168.43.195.8880 > 192.168.43.124.7772: UDP, length 120
03:58:52.519182 IP 192.168.43.124.8880 > 192.168.43.195.7771: UDP, length 120
03:58:52.519451 IP 192.168.43.124.8880 > 192.168.43.195.7771: UDP, length 120
03:58:52.542667 IP 192.168.43.195.8880 > 192.168.43.124.7772: UDP, length 120
03:58:52.592664 IP 192.168.43.195.8880 > 192.168.43.124.7772: UDP, length 120
03:58:52.618512 IP 192.168.43.124.8880 > 192.168.43.195.7771: UDP, length 120
03:58:52.618795 IP 192.168.43.124.8880 > 192.168.43.195.7771: UDP, length 120
03:58:52.642669 IP 192.168.43.195.8880 > 192.168.43.124.7772: UDP, length 120
03:58:52.692663 IP 192.168.43.195.8880 > 192.168.43.124.7772: UDP, length 120
03:58:52.742662 IP 192.168.43.195.8880 > 192.168.43.124.7772: UDP, length 120
03:58:52.764392 IP 192.168.43.124.8880 > 192.168.43.195.7771: UDP, length 120
03:58:52.764642 IP 192.168.43.124.8880 > 192.168.43.195.7771: UDP, length 120
03:58:52.792666 IP 192.168.43.195.8880 > 192.168.43.124.7772: UDP, length 120
03:58:52.842663 IP 192.168.43.195.8880 > 192.168.43.124.7772: UDP, length 120
03:58:52.867940 IP 192.168.43.124.8880 > 192.168.43.195.7771: UDP, length 120
03:58:52.868072 IP 192.168.43.124.8880 > 192.168.43.195.7771: UDP, length 120
03:58:52.892669 IP 192.168.43.195.8880 > 192.168.43.124.7772: UDP, length 120
03:58:52.942671 IP 192.168.43.195.8880 > 192.168.43.124.7772: UDP, length 120
03:58:52.984666 IP 192.168.43.124.8880 > 192.168.43.195.7771: UDP, length 120
03:58:52.984794 IP 192.168.43.124.8880 > 192.168.43.195.7771: UDP, length 120
03:58:52.992668 IP 192.168.43.195.8880 > 192.168.43.124.7772: UDP, length 120
03:58:53.024433 IP 192.168.43.124.8880 > 192.168.43.195.7771: UDP, length 120
03:58:53.042668 IP 192.168.43.195.8880 > 192.168.43.124.7772: UDP, length 120
03:58:53.092667 IP 192.168.43.195.8880 > 192.168.43.124.7772: UDP, length 120
03:58:53.105917 IP 192.168.43.124.8880 > 192.168.43.195.7771: UDP, length 120
03:58:53.142722 IP 192.168.43.195.8880 > 192.168.43.124.7772: UDP, length 120
03:58:53.192668 IP 192.168.43.195.8880 > 192.168.43.124.7772: UDP, length 120
03:58:53.242662 IP 192.168.43.195.8880 > 192.168.43.124.7772: UDP, length 120
03:58:53.292661 IP 192.168.43.195.8880 > 192.168.43.124.7772: UDP, length 120
03:58:53.313389 IP 192.168.43.124.8880 > 192.168.43.195.7771: UDP, length 120
03:58:53.313696 IP 192.168.43.124.8880 > 192.168.43.195.7771: UDP, length 120
03:58:53.313909 IP 192.168.43.124.8880 > 192.168.43.195.7771: UDP, length 120
03:58:53.314116 IP 192.168.43.124.8880 > 192.168.43.195.7771: UDP, length 120
03:58:53.314329 IP 192.168.43.124.8880 > 192.168.43.195.7771: UDP, length 120
03:58:53.342664 IP 192.168.43.195.8880 > 192.168.43.124.7772: UDP, length 120
03:58:53.392665 IP 192.168.43.195.8880 > 192.168.43.124.7772: UDP, length 120
03:58:53.442660 IP 192.168.43.195.8880 > 192.168.43.124.7772: UDP, length 120
03:58:53.492660 IP 192.168.43.195.8880 > 192.168.43.124.7772: UDP, length 120
03:58:53.515479 IP 192.168.43.124.8880 > 192.168.43.195.7771: UDP, length 120
03:58:53.515720 IP 192.168.43.124.8880 > 192.168.43.195.7771: UDP, length 120
03:58:53.542663 IP 192.168.43.195.8880 > 192.168.43.124.7772: UDP, length 120
03:58:53.582524 IP 192.168.43.124.8880 > 192.168.43.195.7771: UDP, length 120
03:58:53.582793 IP 192.168.43.124.8880 > 192.168.43.195.7771: UDP, length 120
03:58:53.592666 IP 192.168.43.195.8880 > 192.168.43.124.7772: UDP, length 120
03:58:53.642661 IP 192.168.43.195.8880 > 192.168.43.124.7772: UDP, length 120
03:58:53.692662 IP 192.168.43.195.8880 > 192.168.43.124.7772: UDP, length 120
03:58:53.742660 IP 192.168.43.195.8880 > 192.168.43.124.7772: UDP, length 120
03:58:53.791995 IP 192.168.43.124.8880 > 192.168.43.195.7771: UDP, length 120
03:58:53.792252 IP 192.168.43.124.8880 > 192.168.43.195.7771: UDP, length 120
03:58:53.792463 IP 192.168.43.124.8880 > 192.168.43.195.7771: UDP, length 120
03:58:53.792665 IP 192.168.43.195.8880 > 192.168.43.124.7772: UDP, length 120
03:58:53.792672 IP 192.168.43.124.8880 > 192.168.43.195.7771: UDP, length 120
03:58:53.792879 IP 192.168.43.124.8880 > 192.168.43.195.7771: UDP, length 120
03:58:53.822506 IP 192.168.43.124.8880 > 192.168.43.195.7771: UDP, length 120
03:58:53.842668 IP 192.168.43.195.8880 > 192.168.43.124.7772: UDP, length 120
03:58:53.872407 IP 192.168.43.124.8880 > 192.168.43.195.7771: UDP, length 120
03:58:53.892679 IP 192.168.43.195.8880 > 192.168.43.124.7772: UDP, length 120
03:58:53.922355 IP 192.168.43.124.8880 > 192.168.43.195.7771: UDP, length 120
03:58:53.942706 IP 192.168.43.195.8880 > 192.168.43.124.7772: UDP, length 120
03:58:53.972671 IP 192.168.43.124.8880 > 192.168.43.195.7771: UDP, length 120
03:58:53.992683 IP 192.168.43.195.8880 > 192.168.43.124.7772: UDP, length 120
03:58:54.022392 IP 192.168.43.124.8880 > 192.168.43.195.7771: UDP, length 120
03:58:54.042667 IP 192.168.43.195.8880 > 192.168.43.124.7772: UDP, length 120
03:58:54.074627 IP 192.168.43.124.8880 > 192.168.43.195.7771: UDP, length 120
03:58:54.092668 IP 192.168.43.195.8880 > 192.168.43.124.7772: UDP, length 120
03:58:54.125115 IP 192.168.43.124.8880 > 192.168.43.195.7771: UDP, length 120
03:58:54.142676 IP 192.168.43.195.8880 > 192.168.43.124.7772: UDP, length 120
03:58:54.176135 IP 192.168.43.124.8880 > 192.168.43.195.7771: UDP, length 120
03:58:54.192667 IP 192.168.43.195.8880 > 192.168.43.124.7772: UDP, length 120
03:58:54.222341 IP 192.168.43.124.8880 > 192.168.43.195.7771: UDP, length 120
03:58:54.242668 IP 192.168.43.195.8880 > 192.168.43.124.7772: UDP, length 120
03:58:54.272310 IP 192.168.43.124.8880 > 192.168.43.195.7771: UDP, length 120
03:58:54.292665 IP 192.168.43.195.8880 > 192.168.43.124.7772: UDP, length 120
03:58:54.322113 IP 192.168.43.124.8880 > 192.168.43.195.7771: UDP, length 120
03:58:54.342665 IP 192.168.43.195.8880 > 192.168.43.124.7772: UDP, length 120
03:58:54.372332 IP 192.168.43.124.8880 > 192.168.43.195.7771: UDP, length 120
03:58:54.392664 IP 192.168.43.195.8880 > 192.168.43.124.7772: UDP, length 120
03:58:54.422468 IP 192.168.43.124.8880 > 192.168.43.195.7771: UDP, length 120
03:58:54.442664 IP 192.168.43.195.8880 > 192.168.43.124.7772: UDP, length 120
03:58:54.473436 IP 192.168.43.124.8880 > 192.168.43.195.7771: UDP, length 120
03:58:54.492664 IP 192.168.43.195.8880 > 192.168.43.124.7772: UDP, length 120
03:58:54.522362 IP 192.168.43.124.8880 > 192.168.43.195.7771: UDP, length 120
03:58:54.542669 IP 192.168.43.195.8880 > 192.168.43.124.7772: UDP, length 120
03:58:54.572052 IP 192.168.43.124.8880 > 192.168.43.195.7771: UDP, length 120
03:58:54.592670 IP 192.168.43.195.8880 > 192.168.43.124.7772: UDP, length 120
03:58:54.622531 IP 192.168.43.124.8880 > 192.168.43.195.7771: UDP, length 120
03:58:54.642714 IP 192.168.43.195.8880 > 192.168.43.124.7772: UDP, length 120
03:58:54.671514 IP 192.168.43.124.8880 > 192.168.43.195.7771: UDP, length 120
03:58:54.692672 IP 192.168.43.195.8880 > 192.168.43.124.7772: UDP, length 120
03:58:54.721898 IP 192.168.43.124.8880 > 192.168.43.195.7771: UDP, length 120
03:58:54.742666 IP 192.168.43.195.8880 > 192.168.43.124.7772: UDP, length 120
03:58:54.772279 IP 192.168.43.124.8880 > 192.168.43.195.7771: UDP, length 120
03:58:54.792668 IP 192.168.43.195.8880 > 192.168.43.124.7772: UDP, length 120
03:58:54.822305 IP 192.168.43.124.8880 > 192.168.43.195.7771: UDP, length 120
03:58:54.842666 IP 192.168.43.195.8880 > 192.168.43.124.7772: UDP, length 120
03:58:54.872313 IP 192.168.43.124.8880 > 192.168.43.195.7771: UDP, length 120
03:58:54.892671 IP 192.168.43.195.8880 > 192.168.43.124.7772: UDP, length 120
03:58:54.942677 IP 192.168.43.195.8880 > 192.168.43.124.7772: UDP, length 120
03:58:54.992666 IP 192.168.43.195.8880 > 192.168.43.124.7772: UDP, length 120
03:58:55.004842 IP 192.168.43.124.8880 > 192.168.43.195.7771: UDP, length 120
03:58:55.042664 IP 192.168.43.195.8880 > 192.168.43.124.7772: UDP, length 120
03:58:55.046048 IP 192.168.43.124.8880 > 192.168.43.195.7771: UDP, length 120
03:58:55.054419 IP 192.168.43.124.8880 > 192.168.43.195.7771: UDP, length 120
03:58:55.092666 IP 192.168.43.195.8880 > 192.168.43.124.7772: UDP, length 120
03:58:55.142665 IP 192.168.43.195.8880 > 192.168.43.124.7772: UDP, length 120
03:58:55.192665 IP 192.168.43.195.8880 > 192.168.43.124.7772: UDP, length 120
03:58:55.242665 IP 192.168.43.195.8880 > 192.168.43.124.7772: UDP, length 120
03:58:55.245258 IP 192.168.43.124.8880 > 192.168.43.195.7771: UDP, length 120
03:58:55.263514 IP 192.168.43.124.8880 > 192.168.43.195.7771: UDP, length 120
03:58:55.292668 IP 192.168.43.195.8880 > 192.168.43.124.7772: UDP, length 120
03:58:55.342666 IP 192.168.43.195.8880 > 192.168.43.124.7772: UDP, length 120
03:58:55.371819 IP 192.168.43.124.8880 > 192.168.43.195.7771: UDP, length 120
03:58:55.372065 IP 192.168.43.124.8880 > 192.168.43.195.7771: UDP, length 120
03:58:55.372282 IP 192.168.43.124.8880 > 192.168.43.195.7771: UDP, length 120
03:58:55.372489 IP 192.168.43.124.8880 > 192.168.43.195.7771: UDP, length 120
03:58:55.392669 IP 192.168.43.195.8880 > 192.168.43.124.7772: UDP, length 120
03:58:55.442662 IP 192.168.43.195.8880 > 192.168.43.124.7772: UDP, length 120
03:58:55.492663 IP 192.168.43.195.8880 > 192.168.43.124.7772: UDP, length 120
03:58:55.542662 IP 192.168.43.195.8880 > 192.168.43.124.7772: UDP, length 120
03:58:55.575677 IP 192.168.43.124.8880 > 192.168.43.195.7771: UDP, length 120
03:58:55.592666 IP 192.168.43.195.8880 > 192.168.43.124.7772: UDP, length 120
03:58:55.642662 IP 192.168.43.195.8880 > 192.168.43.124.7772: UDP, length 120
03:58:55.685276 IP 192.168.43.124.8880 > 192.168.43.195.7771: UDP, length 120
03:58:55.685504 IP 192.168.43.124.8880 > 192.168.43.195.7771: UDP, length 120
03:58:55.685618 IP 192.168.43.124.8880 > 192.168.43.195.7771: UDP, length 120
03:58:55.685730 IP 192.168.43.124.8880 > 192.168.43.195.7771: UDP, length 120
03:58:55.692664 IP 192.168.43.195.8880 > 192.168.43.124.7772: UDP, length 120
03:58:55.703144 IP 192.168.43.124.8880 > 192.168.43.195.7771: UDP, length 120
03:58:55.742662 IP 192.168.43.195.8880 > 192.168.43.124.7772: UDP, length 120
03:58:55.792665 IP 192.168.43.195.8880 > 192.168.43.124.7772: UDP, length 120
03:58:55.842662 IP 192.168.43.195.8880 > 192.168.43.124.7772: UDP, length 120
03:58:55.892666 IP 192.168.43.195.8880 > 192.168.43.124.7772: UDP, length 120
03:58:55.942672 IP 192.168.43.195.8880 > 192.168.43.124.7772: UDP, length 120
03:58:55.992664 IP 192.168.43.195.8880 > 192.168.43.124.7772: UDP, length 120
03:58:56.013866 IP 192.168.43.124.8880 > 192.168.43.195.7771: UDP, length 120
03:58:56.014150 IP 192.168.43.124.8880 > 192.168.43.195.7771: UDP, length 120
03:58:56.014276 IP 192.168.43.124.8880 > 192.168.43.195.7771: UDP, length 120
03:58:56.014388 IP 192.168.43.124.8880 > 192.168.43.195.7771: UDP, length 120
03:58:56.026075 IP 192.168.43.124.8880 > 192.168.43.195.7771: UDP, length 120
03:58:56.027904 IP 192.168.43.124.8880 > 192.168.43.195.7771: UDP, length 120
03:58:56.042669 IP 192.168.43.195.8880 > 192.168.43.124.7772: UDP, length 120
03:58:56.072410 IP 192.168.43.124.8880 > 192.168.43.195.7771: UDP, length 120
03:58:56.092667 IP 192.168.43.195.8880 > 192.168.43.124.7772: UDP, length 120
03:58:56.138401 IP 192.168.43.124.8880 > 192.168.43.195.7771: UDP, length 120
03:58:56.142714 IP 192.168.43.195.8880 > 192.168.43.124.7772: UDP, length 120
03:58:56.172622 IP 192.168.43.124.8880 > 192.168.43.195.7771: UDP, length 120
03:58:56.192671 IP 192.168.43.195.8880 > 192.168.43.124.7772: UDP, length 120
03:58:56.224280 IP 192.168.43.124.8880 > 192.168.43.195.7771: UDP, length 120
03:58:56.242673 IP 192.168.43.195.8880 > 192.168.43.124.7772: UDP, length 120
03:58:56.274773 IP 192.168.43.124.8880 > 192.168.43.195.7771: UDP, length 120
03:58:56.292675 IP 192.168.43.195.8880 > 192.168.43.124.7772: UDP, length 120
03:58:56.335590 IP 192.168.43.124.8880 > 192.168.43.195.7771: UDP, length 120
03:58:56.342667 IP 192.168.43.195.8880 > 192.168.43.124.7772: UDP, length 120
03:58:56.372462 IP 192.168.43.124.8880 > 192.168.43.195.7771: UDP, length 120
03:58:56.392667 IP 192.168.43.195.8880 > 192.168.43.124.7772: UDP, length 120
03:58:56.422531 IP 192.168.43.124.8880 > 192.168.43.195.7771: UDP, length 120
03:58:56.442668 IP 192.168.43.195.8880 > 192.168.43.124.7772: UDP, length 120
03:58:56.472849 IP 192.168.43.124.8880 > 192.168.43.195.7771: UDP, length 120
03:58:56.492665 IP 192.168.43.195.8880 > 192.168.43.124.7772: UDP, length 120
03:58:56.522392 IP 192.168.43.124.8880 > 192.168.43.195.7771: UDP, length 120
03:58:56.542663 IP 192.168.43.195.8880 > 192.168.43.124.7772: UDP, length 120
03:58:56.572374 IP 192.168.43.124.8880 > 192.168.43.195.7771: UDP, length 120
03:58:56.592667 IP 192.168.43.195.8880 > 192.168.43.124.7772: UDP, length 120
03:58:56.620771 IP 192.168.43.124.8880 > 192.168.43.195.7771: UDP, length 120
03:58:56.642666 IP 192.168.43.195.8880 > 192.168.43.124.7772: UDP, length 120
03:58:56.672121 IP 192.168.43.124.8880 > 192.168.43.195.7771: UDP, length 120
03:58:56.692664 IP 192.168.43.195.8880 > 192.168.43.124.7772: UDP, length 120
03:58:56.722359 IP 192.168.43.124.8880 > 192.168.43.195.7771: UDP, length 120
03:58:56.742663 IP 192.168.43.195.8880 > 192.168.43.124.7772: UDP, length 120
03:58:56.772396 IP 192.168.43.124.8880 > 192.168.43.195.7771: UDP, length 120
03:58:56.792665 IP 192.168.43.195.8880 > 192.168.43.124.7772: UDP, length 120
03:58:56.822396 IP 192.168.43.124.8880 > 192.168.43.195.7771: UDP, length 120
03:58:56.842666 IP 192.168.43.195.8880 > 192.168.43.124.7772: UDP, length 120
03:58:56.872473 IP 192.168.43.124.8880 > 192.168.43.195.7771: UDP, length 120
03:58:56.892667 IP 192.168.43.195.8880 > 192.168.43.124.7772: UDP, length 120
03:58:56.922404 IP 192.168.43.124.8880 > 192.168.43.195.7771: UDP, length 120
03:58:56.942681 IP 192.168.43.195.8880 > 192.168.43.124.7772: UDP, length 120
03:58:56.972481 IP 192.168.43.124.8880 > 192.168.43.195.7771: UDP, length 120
03:58:56.992671 IP 192.168.43.195.8880 > 192.168.43.124.7772: UDP, length 120
03:58:57.022842 IP 192.168.43.124.8880 > 192.168.43.195.7771: UDP, length 120
03:58:57.042666 IP 192.168.43.195.8880 > 192.168.43.124.7772: UDP, length 120
03:58:57.070868 IP 192.168.43.124.8880 > 192.168.43.195.7771: UDP, length 120
03:58:57.092665 IP 192.168.43.195.8880 > 192.168.43.124.7772: UDP, length 120
03:58:57.120839 IP 192.168.43.124.8880 > 192.168.43.195.7771: UDP, length 120
03:58:57.142664 IP 192.168.43.195.8880 > 192.168.43.124.7772: UDP, length 120
03:58:57.171060 IP 192.168.43.124.8880 > 192.168.43.195.7771: UDP, length 120
03:58:57.192662 IP 192.168.43.195.8880 > 192.168.43.124.7772: UDP, length 120
03:58:57.220655 IP 192.168.43.124.8880 > 192.168.43.195.7771: UDP, length 120
03:58:57.242667 IP 192.168.43.195.8880 > 192.168.43.124.7772: UDP, length 120
03:58:57.271329 IP 192.168.43.124.8880 > 192.168.43.195.7771: UDP, length 120
03:58:57.292672 IP 192.168.43.195.8880 > 192.168.43.124.7772: UDP, length 120
03:58:57.323140 IP 192.168.43.124.8880 > 192.168.43.195.7771: UDP, length 120
03:58:57.342675 IP 192.168.43.195.8880 > 192.168.43.124.7772: UDP, length 120
03:58:57.376542 IP 192.168.43.124.8880 > 192.168.43.195.7771: UDP, length 120
03:58:57.392666 IP 192.168.43.195.8880 > 192.168.43.124.7772: UDP, length 120
03:58:57.425516 IP 192.168.43.124.8880 > 192.168.43.195.7771: UDP, length 120
03:58:57.442665 IP 192.168.43.195.8880 > 192.168.43.124.7772: UDP, length 120
03:58:57.480887 IP 192.168.43.124.8880 > 192.168.43.195.7771: UDP, length 120
03:58:57.492663 IP 192.168.43.195.8880 > 192.168.43.124.7772: UDP, length 120
03:58:57.522422 IP 192.168.43.124.8880 > 192.168.43.195.7771: UDP, length 120
03:58:57.542666 IP 192.168.43.195.8880 > 192.168.43.124.7772: UDP, length 120
03:58:57.582823 IP 192.168.43.124.8880 > 192.168.43.195.7771: UDP, length 120
03:58:57.592666 IP 192.168.43.195.8880 > 192.168.43.124.7772: UDP, length 120
03:58:57.622883 IP 192.168.43.124.8880 > 192.168.43.195.7771: UDP, length 120
03:58:57.642717 IP 192.168.43.195.8880 > 192.168.43.124.7772: UDP, length 120
03:58:57.683000 IP 192.168.43.124.8880 > 192.168.43.195.7771: UDP, length 120
03:58:57.692671 IP 192.168.43.195.8880 > 192.168.43.124.7772: UDP, length 120
03:58:57.722424 IP 192.168.43.124.8880 > 192.168.43.195.7771: UDP, length 120
03:58:57.742663 IP 192.168.43.195.8880 > 192.168.43.124.7772: UDP, length 120
03:58:57.773516 IP 192.168.43.124.8880 > 192.168.43.195.7771: UDP, length 120
03:58:57.792665 IP 192.168.43.195.8880 > 192.168.43.124.7772: UDP, length 120
03:58:57.820839 IP 192.168.43.124.8880 > 192.168.43.195.7771: UDP, length 120
03:58:57.842664 IP 192.168.43.195.8880 > 192.168.43.124.7772: UDP, length 120
03:58:57.873870 IP 192.168.43.124.8880 > 192.168.43.195.7771: UDP, length 120
03:58:57.892667 IP 192.168.43.195.8880 > 192.168.43.124.7772: UDP, length 120
03:58:57.922450 IP 192.168.43.124.8880 > 192.168.43.195.7771: UDP, length 120
03:58:57.942679 IP 192.168.43.195.8880 > 192.168.43.124.7772: UDP, length 120
03:58:57.992665 IP 192.168.43.195.8880 > 192.168.43.124.7772: UDP, length 120
03:58:58.033226 IP 192.168.43.124.8880 > 192.168.43.195.7771: UDP, length 120
03:58:58.033350 IP 192.168.43.124.8880 > 192.168.43.195.7771: UDP, length 120
03:58:58.042664 IP 192.168.43.195.8880 > 192.168.43.124.7772: UDP, length 120
03:58:58.092663 IP 192.168.43.195.8880 > 192.168.43.124.7772: UDP, length 120
03:58:58.142661 IP 192.168.43.195.8880 > 192.168.43.124.7772: UDP, length 120
03:58:58.157327 IP 192.168.43.124.8880 > 192.168.43.195.7771: UDP, length 120
03:58:58.157445 IP 192.168.43.124.8880 > 192.168.43.195.7771: UDP, length 120
03:58:58.192664 IP 192.168.43.195.8880 > 192.168.43.124.7772: UDP, length 120
03:58:58.242664 IP 192.168.43.195.8880 > 192.168.43.124.7772: UDP, length 120
03:58:58.262495 IP 192.168.43.124.8880 > 192.168.43.195.7771: UDP, length 120
03:58:58.262622 IP 192.168.43.124.8880 > 192.168.43.195.7771: UDP, length 120
03:58:58.282072 IP 192.168.43.124.8880 > 192.168.43.195.7771: UDP, length 120
03:58:58.292663 IP 192.168.43.195.8880 > 192.168.43.124.7772: UDP, length 120
03:58:58.342671 IP 192.168.43.195.8880 > 192.168.43.124.7772: UDP, length 120
03:58:58.392662 IP 192.168.43.195.8880 > 192.168.43.124.7772: UDP, length 120
03:58:58.442666 IP 192.168.43.195.8880 > 192.168.43.124.7772: UDP, length 120
03:58:58.479483 IP 192.168.43.124.8880 > 192.168.43.195.7771: UDP, length 120
03:58:58.479710 IP 192.168.43.124.8880 > 192.168.43.195.7771: UDP, length 120
03:58:58.479826 IP 192.168.43.124.8880 > 192.168.43.195.7771: UDP, length 120
03:58:58.479939 IP 192.168.43.124.8880 > 192.168.43.195.7771: UDP, length 120
03:58:58.492662 IP 192.168.43.195.8880 > 192.168.43.124.7772: UDP, length 120
03:58:58.534652 IP 192.168.43.124.8880 > 192.168.43.195.7771: UDP, length 120
03:58:58.542662 IP 192.168.43.195.8880 > 192.168.43.124.7772: UDP, length 120
03:58:58.592663 IP 192.168.43.195.8880 > 192.168.43.124.7772: UDP, length 120
03:58:58.600125 IP 192.168.43.124.8880 > 192.168.43.195.7771: UDP, length 120
03:58:58.630837 IP 192.168.43.124.8880 > 192.168.43.195.7771: UDP, length 120
03:58:58.642671 IP 192.168.43.195.8880 > 192.168.43.124.7772: UDP, length 120
03:58:58.692665 IP 192.168.43.195.8880 > 192.168.43.124.7772: UDP, length 120
03:58:58.742660 IP 192.168.43.195.8880 > 192.168.43.124.7772: UDP, length 120
03:58:58.792697 IP 192.168.43.195.8880 > 192.168.43.124.7772: UDP, length 120
03:58:58.842676 IP 192.168.43.195.8880 > 192.168.43.124.7772: UDP, length 120
03:58:58.892670 IP 192.168.43.195.8880 > 192.168.43.124.7772: UDP, length 120
03:58:58.907243 IP 192.168.43.124.8880 > 192.168.43.195.7771: UDP, length 120
03:58:58.907465 IP 192.168.43.124.8880 > 192.168.43.195.7771: UDP, length 120
03:58:58.907603 IP 192.168.43.124.8880 > 192.168.43.195.7771: UDP, length 120
03:58:58.907732 IP 192.168.43.124.8880 > 192.168.43.195.7771: UDP, length 120
03:58:58.907859 IP 192.168.43.124.8880 > 192.168.43.195.7771: UDP, length 120
03:58:58.942707 IP 192.168.43.195.8880 > 192.168.43.124.7772: UDP, length 120
03:58:58.992683 IP 192.168.43.195.8880 > 192.168.43.124.7772: UDP, length 120
03:58:59.042663 IP 192.168.43.195.8880 > 192.168.43.124.7772: UDP, length 120
03:58:59.053834 IP 192.168.43.124.8880 > 192.168.43.195.7771: UDP, length 120
03:58:59.092667 IP 192.168.43.195.8880 > 192.168.43.124.7772: UDP, length 120
03:58:59.142725 IP 192.168.43.195.8880 > 192.168.43.124.7772: UDP, length 120
03:58:59.192669 IP 192.168.43.195.8880 > 192.168.43.124.7772: UDP, length 120
03:58:59.214164 IP 192.168.43.124.8880 > 192.168.43.195.7771: UDP, length 120
03:58:59.214477 IP 192.168.43.124.8880 > 192.168.43.195.7771: UDP, length 120
03:58:59.214690 IP 192.168.43.124.8880 > 192.168.43.195.7771: UDP, length 120
03:58:59.242670 IP 192.168.43.195.8880 > 192.168.43.124.7772: UDP, length 120
03:58:59.292662 IP 192.168.43.195.8880 > 192.168.43.124.7772: UDP, length 120
03:58:59.342659 IP 192.168.43.195.8880 > 192.168.43.124.7772: UDP, length 120
03:58:59.382555 IP 192.168.43.124.8880 > 192.168.43.195.7771: UDP, length 120
03:58:59.382796 IP 192.168.43.124.8880 > 192.168.43.195.7771: UDP, length 120
03:58:59.382917 IP 192.168.43.124.8880 > 192.168.43.195.7771: UDP, length 120
03:58:59.383030 IP 192.168.43.124.8880 > 192.168.43.195.7771: UDP, length 120
03:58:59.392665 IP 192.168.43.195.8880 > 192.168.43.124.7772: UDP, length 120
03:58:59.442673 IP 192.168.43.195.8880 > 192.168.43.124.7772: UDP, length 120
03:58:59.492674 IP 192.168.43.195.8880 > 192.168.43.124.7772: UDP, length 120
03:58:59.507493 IP 192.168.43.124.8880 > 192.168.43.195.7771: UDP, length 120
03:58:59.513823 IP 192.168.43.124.8880 > 192.168.43.195.7771: UDP, length 120
03:58:59.542673 IP 192.168.43.195.8880 > 192.168.43.124.7772: UDP, length 120
03:58:59.592666 IP 192.168.43.195.8880 > 192.168.43.124.7772: UDP, length 120
03:58:59.642670 IP 192.168.43.195.8880 > 192.168.43.124.7772: UDP, length 120
03:58:59.654964 IP 192.168.43.124.8880 > 192.168.43.195.7771: UDP, length 120
03:58:59.692667 IP 192.168.43.195.8880 > 192.168.43.124.7772: UDP, length 120
03:58:59.706814 IP 192.168.43.124.8880 > 192.168.43.195.7771: UDP, length 120
03:58:59.707066 IP 192.168.43.124.8880 > 192.168.43.195.7771: UDP, length 120
03:58:59.707277 IP 192.168.43.124.8880 > 192.168.43.195.7771: UDP, length 120
03:58:59.707484 IP 192.168.43.124.8880 > 192.168.43.195.7771: UDP, length 120
03:58:59.742669 IP 192.168.43.195.8880 > 192.168.43.124.7772: UDP, length 120
03:58:59.792663 IP 192.168.43.195.8880 > 192.168.43.124.7772: UDP, length 120
03:58:59.842658 IP 192.168.43.195.8880 > 192.168.43.124.7772: UDP, length 120
03:58:59.892665 IP 192.168.43.195.8880 > 192.168.43.124.7772: UDP, length 120
03:58:59.942674 IP 192.168.43.195.8880 > 192.168.43.124.7772: UDP, length 120
03:58:59.992667 IP 192.168.43.195.8880 > 192.168.43.124.7772: UDP, length 120
03:59:00.003278 IP 192.168.43.124.8880 > 192.168.43.195.7771: UDP, length 120
03:59:00.003560 IP 192.168.43.124.8880 > 192.168.43.195.7771: UDP, length 120
03:59:00.042666 IP 192.168.43.195.8880 > 192.168.43.124.7772: UDP, length 120
03:59:00.092662 IP 192.168.43.195.8880 > 192.168.43.124.7772: UDP, length 120
03:59:00.142661 IP 192.168.43.195.8880 > 192.168.43.124.7772: UDP, length 120
03:59:00.187856 IP 192.168.43.124.8880 > 192.168.43.195.7771: UDP, length 120
03:59:00.188127 IP 192.168.43.124.8880 > 192.168.43.195.7771: UDP, length 120
03:59:00.188351 IP 192.168.43.124.8880 > 192.168.43.195.7771: UDP, length 120
03:59:00.188558 IP 192.168.43.124.8880 > 192.168.43.195.7771: UDP, length 120
03:59:00.192664 IP 192.168.43.195.8880 > 192.168.43.124.7772: UDP, length 120
03:59:00.242664 IP 192.168.43.195.8880 > 192.168.43.124.7772: UDP, length 120
03:59:00.292661 IP 192.168.43.195.8880 > 192.168.43.124.7772: UDP, length 120
03:59:00.342661 IP 192.168.43.195.8880 > 192.168.43.124.7772: UDP, length 120
03:59:00.392661 IP 192.168.43.195.8880 > 192.168.43.124.7772: UDP, length 120
03:59:00.442661 IP 192.168.43.195.8880 > 192.168.43.124.7772: UDP, length 120
03:59:00.449767 IP 192.168.43.124.8880 > 192.168.43.195.7771: UDP, length 120
03:59:00.450034 IP 192.168.43.124.8880 > 192.168.43.195.7771: UDP, length 120
03:59:00.450249 IP 192.168.43.124.8880 > 192.168.43.195.7771: UDP, length 120
03:59:00.450473 IP 192.168.43.124.8880 > 192.168.43.195.7771: UDP, length 120
03:59:00.492679 IP 192.168.43.195.8880 > 192.168.43.124.7772: UDP, length 120
03:59:00.542667 IP 192.168.43.195.8880 > 192.168.43.124.7772: UDP, length 120
03:59:00.581845 IP 192.168.43.124.8880 > 192.168.43.195.7771: UDP, length 120
03:59:00.582135 IP 192.168.43.124.8880 > 192.168.43.195.7771: UDP, length 120
03:59:00.582351 IP 192.168.43.124.8880 > 192.168.43.195.7771: UDP, length 120
03:59:00.582563 IP 192.168.43.124.8880 > 192.168.43.195.7771: UDP, length 120
03:59:00.592669 IP 192.168.43.195.8880 > 192.168.43.124.7772: UDP, length 120
03:59:00.642719 IP 192.168.43.195.8880 > 192.168.43.124.7772: UDP, length 120
03:59:00.692669 IP 192.168.43.195.8880 > 192.168.43.124.7772: UDP, length 120
03:59:00.692749 IP 192.168.43.124.8880 > 192.168.43.195.7771: UDP, length 120
03:59:00.693081 IP 192.168.43.124.8880 > 192.168.43.195.7771: UDP, length 120
03:59:00.693301 IP 192.168.43.124.8880 > 192.168.43.195.7771: UDP, length 120
03:59:00.693511 IP 192.168.43.124.8880 > 192.168.43.195.7771: UDP, length 120
03:59:00.742666 IP 192.168.43.195.8880 > 192.168.43.124.7772: UDP, length 120
03:59:00.782970 IP 192.168.43.124.8880 > 192.168.43.195.7771: UDP, length 120
03:59:00.783091 IP 192.168.43.124.8880 > 192.168.43.195.7771: UDP, length 120
03:59:00.783204 IP 192.168.43.124.8880 > 192.168.43.195.7771: UDP, length 120
03:59:00.792665 IP 192.168.43.195.8880 > 192.168.43.124.7772: UDP, length 120
03:59:00.842662 IP 192.168.43.195.8880 > 192.168.43.124.7772: UDP, length 120
03:59:00.853695 IP 192.168.43.124.8880 > 192.168.43.195.7771: UDP, length 120
03:59:00.892666 IP 192.168.43.195.8880 > 192.168.43.124.7772: UDP, length 120
03:59:00.918676 IP 192.168.43.124.8880 > 192.168.43.195.7771: UDP, length 120
03:59:00.918793 IP 192.168.43.124.8880 > 192.168.43.195.7771: UDP, length 120
03:59:00.942679 IP 192.168.43.195.8880 > 192.168.43.124.7772: UDP, length 120
03:59:00.946103 IP 192.168.43.124.8880 > 192.168.43.195.7771: UDP, length 120
03:59:00.969298 IP 192.168.43.124.8880 > 192.168.43.195.7771: UDP, length 120
03:59:00.992666 IP 192.168.43.195.8880 > 192.168.43.124.7772: UDP, length 120
03:59:01.021168 IP 192.168.43.124.8880 > 192.168.43.195.7771: UDP, length 120
03:59:01.042716 IP 192.168.43.195.8880 > 192.168.43.124.7772: UDP, length 120
03:59:01.070844 IP 192.168.43.124.8880 > 192.168.43.195.7771: UDP, length 120
03:59:01.092670 IP 192.168.43.195.8880 > 192.168.43.124.7772: UDP, length 120
03:59:01.120959 IP 192.168.43.124.8880 > 192.168.43.195.7771: UDP, length 120
03:59:01.142664 IP 192.168.43.195.8880 > 192.168.43.124.7772: UDP, length 120
03:59:01.170955 IP 192.168.43.124.8880 > 192.168.43.195.7771: UDP, length 120
03:59:01.192664 IP 192.168.43.195.8880 > 192.168.43.124.7772: UDP, length 120
03:59:01.222704 IP 192.168.43.124.8880 > 192.168.43.195.7771: UDP, length 120
03:59:01.242664 IP 192.168.43.195.8880 > 192.168.43.124.7772: UDP, length 120
03:59:01.272708 IP 192.168.43.124.8880 > 192.168.43.195.7771: UDP, length 120
03:59:01.292661 IP 192.168.43.195.8880 > 192.168.43.124.7772: UDP, length 120
03:59:01.321884 IP 192.168.43.124.8880 > 192.168.43.195.7771: UDP, length 120
03:59:01.342663 IP 192.168.43.195.8880 > 192.168.43.124.7772: UDP, length 120
03:59:01.370978 IP 192.168.43.124.8880 > 192.168.43.195.7771: UDP, length 120
03:59:01.392665 IP 192.168.43.195.8880 > 192.168.43.124.7772: UDP, length 120
03:59:01.422641 IP 192.168.43.124.8880 > 192.168.43.195.7771: UDP, length 120
03:59:01.442661 IP 192.168.43.195.8880 > 192.168.43.124.7772: UDP, length 120
03:59:01.474906 IP 192.168.43.124.8880 > 192.168.43.195.7771: UDP, length 120
03:59:01.492664 IP 192.168.43.195.8880 > 192.168.43.124.7772: UDP, length 120
03:59:01.522561 IP 192.168.43.124.8880 > 192.168.43.195.7771: UDP, length 120
03:59:01.542667 IP 192.168.43.195.8880 > 192.168.43.124.7772: UDP, length 120
03:59:01.573798 IP 192.168.43.124.8880 > 192.168.43.195.7771: UDP, length 120
03:59:01.592667 IP 192.168.43.195.8880 > 192.168.43.124.7772: UDP, length 120
03:59:01.622443 IP 192.168.43.124.8880 > 192.168.43.195.7771: UDP, length 120
03:59:01.642670 IP 192.168.43.195.8880 > 192.168.43.124.7772: UDP, length 120
03:59:01.674295 IP 192.168.43.124.8880 > 192.168.43.195.7771: UDP, length 120
03:59:01.692668 IP 192.168.43.195.8880 > 192.168.43.124.7772: UDP, length 120
03:59:01.723465 IP 192.168.43.124.8880 > 192.168.43.195.7771: UDP, length 120
03:59:01.742663 IP 192.168.43.195.8880 > 192.168.43.124.7772: UDP, length 120
03:59:01.776708 IP 192.168.43.124.8880 > 192.168.43.195.7771: UDP, length 120
03:59:01.792664 IP 192.168.43.195.8880 > 192.168.43.124.7772: UDP, length 120
03:59:01.823353 IP 192.168.43.124.8880 > 192.168.43.195.7771: UDP, length 120
03:59:01.842665 IP 192.168.43.195.8880 > 192.168.43.124.7772: UDP, length 120
03:59:01.879152 IP 192.168.43.124.8880 > 192.168.43.195.7771: UDP, length 120
03:59:01.892667 IP 192.168.43.195.8880 > 192.168.43.124.7772: UDP, length 120
03:59:01.923553 IP 192.168.43.124.8880 > 192.168.43.195.7771: UDP, length 120
03:59:01.942680 IP 192.168.43.195.8880 > 192.168.43.124.7772: UDP, length 120
03:59:01.973003 IP 192.168.43.124.8880 > 192.168.43.195.7771: UDP, length 120
03:59:01.992668 IP 192.168.43.195.8880 > 192.168.43.124.7772: UDP, length 120
03:59:02.022643 IP 192.168.43.124.8880 > 192.168.43.195.7771: UDP, length 120
03:59:02.042664 IP 192.168.43.195.8880 > 192.168.43.124.7772: UDP, length 120
03:59:02.072820 IP 192.168.43.124.8880 > 192.168.43.195.7771: UDP, length 120
03:59:02.092664 IP 192.168.43.195.8880 > 192.168.43.124.7772: UDP, length 120
03:59:02.122720 IP 192.168.43.124.8880 > 192.168.43.195.7771: UDP, length 120
03:59:02.142713 IP 192.168.43.195.8880 > 192.168.43.124.7772: UDP, length 120
03:59:02.192670 IP 192.168.43.195.8880 > 192.168.43.124.7772: UDP, length 120
03:59:02.205132 IP 192.168.43.124.8880 > 192.168.43.195.7771: UDP, length 120
03:59:02.222384 IP 192.168.43.124.8880 > 192.168.43.195.7771: UDP, length 120
03:59:02.242666 IP 192.168.43.195.8880 > 192.168.43.124.7772: UDP, length 120
03:59:02.292665 IP 192.168.43.195.8880 > 192.168.43.124.7772: UDP, length 120
03:59:02.342661 IP 192.168.43.195.8880 > 192.168.43.124.7772: UDP, length 120
03:59:02.392662 IP 192.168.43.195.8880 > 192.168.43.124.7772: UDP, length 120
03:59:02.442661 IP 192.168.43.195.8880 > 192.168.43.124.7772: UDP, length 120
03:59:02.492662 IP 192.168.43.195.8880 > 192.168.43.124.7772: UDP, length 120
03:59:02.500111 IP 192.168.43.124.8880 > 192.168.43.195.7771: UDP, length 120
03:59:02.500270 IP 192.168.43.124.8880 > 192.168.43.195.7771: UDP, length 120
03:59:02.542666 IP 192.168.43.195.8880 > 192.168.43.124.7772: UDP, length 120
03:59:02.592665 IP 192.168.43.195.8880 > 192.168.43.124.7772: UDP, length 120
03:59:02.634492 IP 192.168.43.124.8880 > 192.168.43.195.7771: UDP, length 120
03:59:02.634629 IP 192.168.43.124.8880 > 192.168.43.195.7771: UDP, length 120
03:59:02.634753 IP 192.168.43.124.8880 > 192.168.43.195.7771: UDP, length 120
03:59:02.634876 IP 192.168.43.124.8880 > 192.168.43.195.7771: UDP, length 120
03:59:02.642669 IP 192.168.43.195.8880 > 192.168.43.124.7772: UDP, length 120
03:59:02.692664 IP 192.168.43.195.8880 > 192.168.43.124.7772: UDP, length 120
03:59:02.742665 IP 192.168.43.195.8880 > 192.168.43.124.7772: UDP, length 120
03:59:02.792661 IP 192.168.43.195.8880 > 192.168.43.124.7772: UDP, length 120
03:59:02.842660 IP 192.168.43.195.8880 > 192.168.43.124.7772: UDP, length 120
03:59:02.855276 IP 192.168.43.124.8880 > 192.168.43.195.7771: UDP, length 120
03:59:02.855547 IP 192.168.43.124.8880 > 192.168.43.195.7771: UDP, length 120
03:59:02.855761 IP 192.168.43.124.8880 > 192.168.43.195.7771: UDP, length 120
03:59:02.855968 IP 192.168.43.124.8880 > 192.168.43.195.7771: UDP, length 120
03:59:02.892673 IP 192.168.43.195.8880 > 192.168.43.124.7772: UDP, length 120
03:59:02.942674 IP 192.168.43.195.8880 > 192.168.43.124.7772: UDP, length 120
03:59:02.992666 IP 192.168.43.195.8880 > 192.168.43.124.7772: UDP, length 120
03:59:03.004064 IP 192.168.43.124.8880 > 192.168.43.195.7771: UDP, length 120
03:59:03.004322 IP 192.168.43.124.8880 > 192.168.43.195.7771: UDP, length 120
03:59:03.042667 IP 192.168.43.195.8880 > 192.168.43.124.7772: UDP, length 120
03:59:03.065099 IP 192.168.43.124.8880 > 192.168.43.195.7771: UDP, length 120
03:59:03.065333 IP 192.168.43.124.8880 > 192.168.43.195.7771: UDP, length 120
03:59:03.065553 IP 192.168.43.124.8880 > 192.168.43.195.7771: UDP, length 120
03:59:03.066193 IP 192.168.43.124.8880 > 192.168.43.195.7771: UDP, length 120
03:59:03.092666 IP 192.168.43.195.8880 > 192.168.43.124.7772: UDP, length 120
03:59:03.126723 IP 192.168.43.124.8880 > 192.168.43.195.7771: UDP, length 120
03:59:03.142665 IP 192.168.43.195.8880 > 192.168.43.124.7772: UDP, length 120
03:59:03.192663 IP 192.168.43.195.8880 > 192.168.43.124.7772: UDP, length 120
03:59:03.242661 IP 192.168.43.195.8880 > 192.168.43.124.7772: UDP, length 120
03:59:03.292662 IP 192.168.43.195.8880 > 192.168.43.124.7772: UDP, length 120
03:59:03.293953 IP 192.168.43.124.8880 > 192.168.43.195.7771: UDP, length 120
03:59:03.342662 IP 192.168.43.195.8880 > 192.168.43.124.7772: UDP, length 120
03:59:03.392661 IP 192.168.43.195.8880 > 192.168.43.124.7772: UDP, length 120
03:59:03.422912 IP 192.168.43.124.8880 > 192.168.43.195.7771: UDP, length 120
03:59:03.442661 IP 192.168.43.195.8880 > 192.168.43.124.7772: UDP, length 120
03:59:03.492662 IP 192.168.43.195.8880 > 192.168.43.124.7772: UDP, length 120
03:59:03.542661 IP 192.168.43.195.8880 > 192.168.43.124.7772: UDP, length 120
03:59:03.592662 IP 192.168.43.195.8880 > 192.168.43.124.7772: UDP, length 120
03:59:03.642721 IP 192.168.43.195.8880 > 192.168.43.124.7772: UDP, length 120
03:59:03.661638 IP 192.168.43.124.8880 > 192.168.43.195.7771: UDP, length 120
03:59:03.662217 IP 192.168.43.124.8880 > 192.168.43.195.7771: UDP, length 120
03:59:03.662330 IP 192.168.43.124.8880 > 192.168.43.195.7771: UDP, length 120
03:59:03.662443 IP 192.168.43.124.8880 > 192.168.43.195.7771: UDP, length 120
03:59:03.692689 IP 192.168.43.195.8880 > 192.168.43.124.7772: UDP, length 120
03:59:03.742670 IP 192.168.43.195.8880 > 192.168.43.124.7772: UDP, length 120
03:59:03.774631 IP 192.168.43.124.8880 > 192.168.43.195.7771: UDP, length 120
03:59:03.774762 IP 192.168.43.124.8880 > 192.168.43.195.7771: UDP, length 120
03:59:03.792668 IP 192.168.43.195.8880 > 192.168.43.124.7772: UDP, length 120
03:59:03.796083 IP 192.168.43.124.8880 > 192.168.43.195.7771: UDP, length 120
03:59:03.829021 IP 192.168.43.124.8880 > 192.168.43.195.7771: UDP, length 120
03:59:03.842665 IP 192.168.43.195.8880 > 192.168.43.124.7772: UDP, length 120
03:59:03.877357 IP 192.168.43.124.8880 > 192.168.43.195.7771: UDP, length 120
03:59:03.892668 IP 192.168.43.195.8880 > 192.168.43.124.7772: UDP, length 120
03:59:03.942701 IP 192.168.43.195.8880 > 192.168.43.124.7772: UDP, length 120
03:59:03.992671 IP 192.168.43.195.8880 > 192.168.43.124.7772: UDP, length 120
03:59:04.021115 IP 192.168.43.124.8880 > 192.168.43.195.7771: UDP, length 120
03:59:04.021432 IP 192.168.43.124.8880 > 192.168.43.195.7771: UDP, length 120
03:59:04.021662 IP 192.168.43.124.8880 > 192.168.43.195.7771: UDP, length 120
03:59:04.021871 IP 192.168.43.124.8880 > 192.168.43.195.7771: UDP, length 120
03:59:04.042664 IP 192.168.43.195.8880 > 192.168.43.124.7772: UDP, length 120
03:59:04.092664 IP 192.168.43.195.8880 > 192.168.43.124.7772: UDP, length 120
03:59:04.123095 IP 192.168.43.124.8880 > 192.168.43.195.7771: UDP, length 120
03:59:04.123374 IP 192.168.43.124.8880 > 192.168.43.195.7771: UDP, length 120
03:59:04.123585 IP 192.168.43.124.8880 > 192.168.43.195.7771: UDP, length 120
03:59:04.123793 IP 192.168.43.124.8880 > 192.168.43.195.7771: UDP, length 120
03:59:04.142665 IP 192.168.43.195.8880 > 192.168.43.124.7772: UDP, length 120
03:59:04.192661 IP 192.168.43.195.8880 > 192.168.43.124.7772: UDP, length 120
03:59:04.242661 IP 192.168.43.195.8880 > 192.168.43.124.7772: UDP, length 120
03:59:04.244003 IP 192.168.43.124.8880 > 192.168.43.195.7771: UDP, length 120
03:59:04.244243 IP 192.168.43.124.8880 > 192.168.43.195.7771: UDP, length 120
03:59:04.292663 IP 192.168.43.195.8880 > 192.168.43.124.7772: UDP, length 120
03:59:04.296091 IP 192.168.43.124.8880 > 192.168.43.195.7771: UDP, length 120
03:59:04.296323 IP 192.168.43.124.8880 > 192.168.43.195.7771: UDP, length 120
03:59:04.324615 IP 192.168.43.124.8880 > 192.168.43.195.7771: UDP, length 120
03:59:04.342663 IP 192.168.43.195.8880 > 192.168.43.124.7772: UDP, length 120
03:59:04.372651 IP 192.168.43.124.8880 > 192.168.43.195.7771: UDP, length 120
03:59:04.392667 IP 192.168.43.195.8880 > 192.168.43.124.7772: UDP, length 120
03:59:04.422872 IP 192.168.43.124.8880 > 192.168.43.195.7771: UDP, length 120
03:59:04.442663 IP 192.168.43.195.8880 > 192.168.43.124.7772: UDP, length 120
03:59:04.471019 IP 192.168.43.124.8880 > 192.168.43.195.7771: UDP, length 120
03:59:04.492662 IP 192.168.43.195.8880 > 192.168.43.124.7772: UDP, length 120
03:59:04.522636 IP 192.168.43.124.8880 > 192.168.43.195.7771: UDP, length 120
03:59:04.542659 IP 192.168.43.195.8880 > 192.168.43.124.7772: UDP, length 120
03:59:04.572683 IP 192.168.43.124.8880 > 192.168.43.195.7771: UDP, length 120
03:59:04.592674 IP 192.168.43.195.8880 > 192.168.43.124.7772: UDP, length 120
03:59:04.622676 IP 192.168.43.124.8880 > 192.168.43.195.7771: UDP, length 120
03:59:04.642666 IP 192.168.43.195.8880 > 192.168.43.124.7772: UDP, length 120
03:59:04.672670 IP 192.168.43.124.8880 > 192.168.43.195.7771: UDP, length 120
03:59:04.692666 IP 192.168.43.195.8880 > 192.168.43.124.7772: UDP, length 120
03:59:04.723591 IP 192.168.43.124.8880 > 192.168.43.195.7771: UDP, length 120
03:59:04.742670 IP 192.168.43.195.8880 > 192.168.43.124.7772: UDP, length 120
03:59:04.774436 IP 192.168.43.124.8880 > 192.168.43.195.7771: UDP, length 120
03:59:04.792668 IP 192.168.43.195.8880 > 192.168.43.124.7772: UDP, length 120
03:59:04.826033 IP 192.168.43.124.8880 > 192.168.43.195.7771: UDP, length 120
03:59:04.842670 IP 192.168.43.195.8880 > 192.168.43.124.7772: UDP, length 120
03:59:04.872589 IP 192.168.43.124.8880 > 192.168.43.195.7771: UDP, length 120
03:59:04.892672 IP 192.168.43.195.8880 > 192.168.43.124.7772: UDP, length 120
03:59:04.922697 IP 192.168.43.124.8880 > 192.168.43.195.7771: UDP, length 120
03:59:04.942682 IP 192.168.43.195.8880 > 192.168.43.124.7772: UDP, length 120
03:59:04.991045 IP 192.168.43.124.8880 > 192.168.43.195.7771: UDP, length 120
03:59:04.992671 IP 192.168.43.195.8880 > 192.168.43.124.7772: UDP, length 120
03:59:05.023204 IP 192.168.43.124.8880 > 192.168.43.195.7771: UDP, length 120
03:59:05.042666 IP 192.168.43.195.8880 > 192.168.43.124.7772: UDP, length 120
03:59:05.092663 IP 192.168.43.195.8880 > 192.168.43.124.7772: UDP, length 120
03:59:05.142718 IP 192.168.43.195.8880 > 192.168.43.124.7772: UDP, length 120
03:59:05.192670 IP 192.168.43.195.8880 > 192.168.43.124.7772: UDP, length 120
03:59:05.242665 IP 192.168.43.195.8880 > 192.168.43.124.7772: UDP, length 120
03:59:05.262882 IP 192.168.43.124.8880 > 192.168.43.195.7771: UDP, length 120
03:59:05.263040 IP 192.168.43.124.8880 > 192.168.43.195.7771: UDP, length 120
03:59:05.292666 IP 192.168.43.195.8880 > 192.168.43.124.7772: UDP, length 120
03:59:05.342663 IP 192.168.43.195.8880 > 192.168.43.124.7772: UDP, length 120
03:59:05.392663 IP 192.168.43.195.8880 > 192.168.43.124.7772: UDP, length 120
03:59:05.442662 IP 192.168.43.195.8880 > 192.168.43.124.7772: UDP, length 120
03:59:05.448946 IP 192.168.43.124.8880 > 192.168.43.195.7771: UDP, length 120
03:59:05.449084 IP 192.168.43.124.8880 > 192.168.43.195.7771: UDP, length 120
03:59:05.449209 IP 192.168.43.124.8880 > 192.168.43.195.7771: UDP, length 120
03:59:05.492668 IP 192.168.43.195.8880 > 192.168.43.124.7772: UDP, length 120
03:59:05.542661 IP 192.168.43.195.8880 > 192.168.43.124.7772: UDP, length 120
03:59:05.592663 IP 192.168.43.195.8880 > 192.168.43.124.7772: UDP, length 120
03:59:05.642661 IP 192.168.43.195.8880 > 192.168.43.124.7772: UDP, length 120
03:59:05.692675 IP 192.168.43.195.8880 > 192.168.43.124.7772: UDP, length 120
03:59:05.742665 IP 192.168.43.195.8880 > 192.168.43.124.7772: UDP, length 120
03:59:05.792660 IP 192.168.43.195.8880 > 192.168.43.124.7772: UDP, length 120
03:59:05.842665 IP 192.168.43.195.8880 > 192.168.43.124.7772: UDP, length 120
03:59:05.892672 IP 192.168.43.195.8880 > 192.168.43.124.7772: UDP, length 120
03:59:05.915596 IP 192.168.43.124.8880 > 192.168.43.195.7771: UDP, length 120
03:59:05.915743 IP 192.168.43.124.8880 > 192.168.43.195.7771: UDP, length 120
03:59:05.915855 IP 192.168.43.124.8880 > 192.168.43.195.7771: UDP, length 120
03:59:05.915977 IP 192.168.43.124.8880 > 192.168.43.195.7771: UDP, length 120
03:59:05.916088 IP 192.168.43.124.8880 > 192.168.43.195.7771: UDP, length 120
03:59:05.916200 IP 192.168.43.124.8880 > 192.168.43.195.7771: UDP, length 120
03:59:05.916307 IP 192.168.43.124.8880 > 192.168.43.195.7771: UDP, length 120
03:59:05.916417 IP 192.168.43.124.8880 > 192.168.43.195.7771: UDP, length 120
03:59:05.916528 IP 192.168.43.124.8880 > 192.168.43.195.7771: UDP, length 120
03:59:05.916637 IP 192.168.43.124.8880 > 192.168.43.195.7771: UDP, length 120
03:59:05.916785 IP 192.168.43.124.8880 > 192.168.43.195.7771: UDP, length 120
03:59:05.942683 IP 192.168.43.195.8880 > 192.168.43.124.7772: UDP, length 120
03:59:05.992668 IP 192.168.43.195.8880 > 192.168.43.124.7772: UDP, length 120
03:59:06.042663 IP 192.168.43.195.8880 > 192.168.43.124.7772: UDP, length 120
03:59:06.061016 IP 192.168.43.124.8880 > 192.168.43.195.7771: UDP, length 120
03:59:06.092666 IP 192.168.43.195.8880 > 192.168.43.124.7772: UDP, length 120
03:59:06.142662 IP 192.168.43.195.8880 > 192.168.43.124.7772: UDP, length 120
03:59:06.192661 IP 192.168.43.195.8880 > 192.168.43.124.7772: UDP, length 120
03:59:06.242661 IP 192.168.43.195.8880 > 192.168.43.124.7772: UDP, length 120
03:59:06.252261 IP 192.168.43.124.8880 > 192.168.43.195.7771: UDP, length 120
03:59:06.252386 IP 192.168.43.124.8880 > 192.168.43.195.7771: UDP, length 120
03:59:06.252501 IP 192.168.43.124.8880 > 192.168.43.195.7771: UDP, length 120
03:59:06.252621 IP 192.168.43.124.8880 > 192.168.43.195.7771: UDP, length 120
03:59:06.292664 IP 192.168.43.195.8880 > 192.168.43.124.7772: UDP, length 120
03:59:06.342660 IP 192.168.43.195.8880 > 192.168.43.124.7772: UDP, length 120
03:59:06.383818 IP 192.168.43.124.8880 > 192.168.43.195.7771: UDP, length 120
03:59:06.383947 IP 192.168.43.124.8880 > 192.168.43.195.7771: UDP, length 120
03:59:06.384059 IP 192.168.43.124.8880 > 192.168.43.195.7771: UDP, length 120
03:59:06.392664 IP 192.168.43.195.8880 > 192.168.43.124.7772: UDP, length 120
03:59:06.442661 IP 192.168.43.195.8880 > 192.168.43.124.7772: UDP, length 120
03:59:06.492661 IP 192.168.43.195.8880 > 192.168.43.124.7772: UDP, length 120
03:59:06.526011 IP 192.168.43.124.8880 > 192.168.43.195.7771: UDP, length 120
03:59:06.526129 IP 192.168.43.124.8880 > 192.168.43.195.7771: UDP, length 120
03:59:06.542664 IP 192.168.43.195.8880 > 192.168.43.124.7772: UDP, length 120
03:59:06.592665 IP 192.168.43.195.8880 > 192.168.43.124.7772: UDP, length 120
03:59:06.642718 IP 192.168.43.195.8880 > 192.168.43.124.7772: UDP, length 120
03:59:06.692668 IP 192.168.43.195.8880 > 192.168.43.124.7772: UDP, length 120
03:59:06.742662 IP 192.168.43.195.8880 > 192.168.43.124.7772: UDP, length 120
03:59:06.792663 IP 192.168.43.195.8880 > 192.168.43.124.7772: UDP, length 120
03:59:06.814297 IP 192.168.43.124.8880 > 192.168.43.195.7771: UDP, length 120
03:59:06.814447 IP 192.168.43.124.8880 > 192.168.43.195.7771: UDP, length 120
03:59:06.814567 IP 192.168.43.124.8880 > 192.168.43.195.7771: UDP, length 120
03:59:06.814679 IP 192.168.43.124.8880 > 192.168.43.195.7771: UDP, length 120
03:59:06.842665 IP 192.168.43.195.8880 > 192.168.43.124.7772: UDP, length 120
03:59:06.892672 IP 192.168.43.195.8880 > 192.168.43.124.7772: UDP, length 120
03:59:06.942680 IP 192.168.43.195.8880 > 192.168.43.124.7772: UDP, length 120
03:59:06.992666 IP 192.168.43.195.8880 > 192.168.43.124.7772: UDP, length 120
03:59:07.042662 IP 192.168.43.195.8880 > 192.168.43.124.7772: UDP, length 120
03:59:07.092661 IP 192.168.43.195.8880 > 192.168.43.124.7772: UDP, length 120
03:59:07.107332 IP 192.168.43.124.8880 > 192.168.43.195.7771: UDP, length 120
03:59:07.107467 IP 192.168.43.124.8880 > 192.168.43.195.7771: UDP, length 120
03:59:07.142666 IP 192.168.43.195.8880 > 192.168.43.124.7772: UDP, length 120
03:59:07.192660 IP 192.168.43.195.8880 > 192.168.43.124.7772: UDP, length 120
03:59:07.204984 IP 192.168.43.124.8880 > 192.168.43.195.7771: UDP, length 120
03:59:07.205243 IP 192.168.43.124.8880 > 192.168.43.195.7771: UDP, length 120
03:59:07.226220 IP 192.168.43.124.8880 > 192.168.43.195.7771: UDP, length 120
03:59:07.242666 IP 192.168.43.195.8880 > 192.168.43.124.7772: UDP, length 120
03:59:07.292662 IP 192.168.43.195.8880 > 192.168.43.124.7772: UDP, length 120
03:59:07.342661 IP 192.168.43.195.8880 > 192.168.43.124.7772: UDP, length 120
03:59:07.384698 IP 192.168.43.124.8880 > 192.168.43.195.7771: UDP, length 120
03:59:07.387795 IP 192.168.43.124.8880 > 192.168.43.195.7771: UDP, length 120
03:59:07.387912 IP 192.168.43.124.8880 > 192.168.43.195.7771: UDP, length 120
03:59:07.388025 IP 192.168.43.124.8880 > 192.168.43.195.7771: UDP, length 120
03:59:07.392664 IP 192.168.43.195.8880 > 192.168.43.124.7772: UDP, length 120
03:59:07.442661 IP 192.168.43.195.8880 > 192.168.43.124.7772: UDP, length 120
03:59:07.492661 IP 192.168.43.195.8880 > 192.168.43.124.7772: UDP, length 120
03:59:07.542660 IP 192.168.43.195.8880 > 192.168.43.124.7772: UDP, length 120
03:59:07.592164 IP 192.168.43.124.8880 > 192.168.43.195.7771: UDP, length 120
03:59:07.592286 IP 192.168.43.124.8880 > 192.168.43.195.7771: UDP, length 120
03:59:07.592663 IP 192.168.43.195.8880 > 192.168.43.124.7772: UDP, length 120
03:59:07.642663 IP 192.168.43.195.8880 > 192.168.43.124.7772: UDP, length 120
03:59:07.692663 IP 192.168.43.195.8880 > 192.168.43.124.7772: UDP, length 120
03:59:07.721180 IP 192.168.43.124.8880 > 192.168.43.195.7771: UDP, length 120
03:59:07.721298 IP 192.168.43.124.8880 > 192.168.43.195.7771: UDP, length 120
03:59:07.742661 IP 192.168.43.195.8880 > 192.168.43.124.7772: UDP, length 120
03:59:07.792661 IP 192.168.43.195.8880 > 192.168.43.124.7772: UDP, length 120
03:59:07.817338 IP 192.168.43.124.8880 > 192.168.43.195.7771: UDP, length 120
03:59:07.817460 IP 192.168.43.124.8880 > 192.168.43.195.7771: UDP, length 120
03:59:07.817635 IP 192.168.43.124.8880 > 192.168.43.195.7771: UDP, length 120
03:59:07.817760 IP 192.168.43.124.8880 > 192.168.43.195.7771: UDP, length 120
03:59:07.842665 IP 192.168.43.195.8880 > 192.168.43.124.7772: UDP, length 120
03:59:07.892684 IP 192.168.43.195.8880 > 192.168.43.124.7772: UDP, length 120
03:59:07.914700 IP 192.168.43.124.8880 > 192.168.43.195.7771: UDP, length 120
03:59:07.914847 IP 192.168.43.124.8880 > 192.168.43.195.7771: UDP, length 120
03:59:07.914964 IP 192.168.43.124.8880 > 192.168.43.195.7771: UDP, length 120
03:59:07.942701 IP 192.168.43.195.8880 > 192.168.43.124.7772: UDP, length 120
03:59:07.992678 IP 192.168.43.195.8880 > 192.168.43.124.7772: UDP, length 120
03:59:08.042670 IP 192.168.43.195.8880 > 192.168.43.124.7772: UDP, length 120
03:59:08.092664 IP 192.168.43.195.8880 > 192.168.43.124.7772: UDP, length 120
03:59:08.093276 IP 192.168.43.124.8880 > 192.168.43.195.7771: UDP, length 120
03:59:08.093579 IP 192.168.43.124.8880 > 192.168.43.195.7771: UDP, length 120
03:59:08.093833 IP 192.168.43.124.8880 > 192.168.43.195.7771: UDP, length 120
03:59:08.094049 IP 192.168.43.124.8880 > 192.168.43.195.7771: UDP, length 120
03:59:08.094266 IP 192.168.43.124.8880 > 192.168.43.195.7771: UDP, length 120
03:59:08.094476 IP 192.168.43.124.8880 > 192.168.43.195.7771: UDP, length 120
03:59:08.142718 IP 192.168.43.195.8880 > 192.168.43.124.7772: UDP, length 120
03:59:08.192672 IP 192.168.43.195.8880 > 192.168.43.124.7772: UDP, length 120
03:59:08.224286 IP 192.168.43.124.8880 > 192.168.43.195.7771: UDP, length 120
03:59:08.224596 IP 192.168.43.124.8880 > 192.168.43.195.7771: UDP, length 120
03:59:08.242671 IP 192.168.43.195.8880 > 192.168.43.124.7772: UDP, length 120
03:59:08.292663 IP 192.168.43.195.8880 > 192.168.43.124.7772: UDP, length 120
03:59:08.323676 IP 192.168.43.124.8880 > 192.168.43.195.7771: UDP, length 120
03:59:08.323919 IP 192.168.43.124.8880 > 192.168.43.195.7771: UDP, length 120
03:59:08.342668 IP 192.168.43.195.8880 > 192.168.43.124.7772: UDP, length 120
03:59:08.392663 IP 192.168.43.195.8880 > 192.168.43.124.7772: UDP, length 120
03:59:08.422266 IP 192.168.43.124.8880 > 192.168.43.195.7771: UDP, length 120
03:59:08.422532 IP 192.168.43.124.8880 > 192.168.43.195.7771: UDP, length 120
03:59:08.422748 IP 192.168.43.124.8880 > 192.168.43.195.7771: UDP, length 120
03:59:08.442667 IP 192.168.43.195.8880 > 192.168.43.124.7772: UDP, length 120
03:59:08.492663 IP 192.168.43.195.8880 > 192.168.43.124.7772: UDP, length 120
03:59:08.542661 IP 192.168.43.195.8880 > 192.168.43.124.7772: UDP, length 120
03:59:08.572718 IP 192.168.43.124.8880 > 192.168.43.195.7771: UDP, length 120
03:59:08.572849 IP 192.168.43.124.8880 > 192.168.43.195.7771: UDP, length 120
03:59:08.592670 IP 192.168.43.195.8880 > 192.168.43.124.7772: UDP, length 120
03:59:08.642663 IP 192.168.43.195.8880 > 192.168.43.124.7772: UDP, length 120
03:59:08.672628 IP 192.168.43.124.8880 > 192.168.43.195.7771: UDP, length 120
03:59:08.672761 IP 192.168.43.124.8880 > 192.168.43.195.7771: UDP, length 120
03:59:08.672885 IP 192.168.43.124.8880 > 192.168.43.195.7771: UDP, length 120
03:59:08.692665 IP 192.168.43.195.8880 > 192.168.43.124.7772: UDP, length 120
03:59:08.742662 IP 192.168.43.195.8880 > 192.168.43.124.7772: UDP, length 120
03:59:08.772955 IP 192.168.43.124.8880 > 192.168.43.195.7771: UDP, length 120
03:59:08.773088 IP 192.168.43.124.8880 > 192.168.43.195.7771: UDP, length 120
03:59:08.792667 IP 192.168.43.195.8880 > 192.168.43.124.7772: UDP, length 120
03:59:08.822809 IP 192.168.43.124.8880 > 192.168.43.195.7771: UDP, length 120
03:59:08.842673 IP 192.168.43.195.8880 > 192.168.43.124.7772: UDP, length 120
03:59:08.872801 IP 192.168.43.124.8880 > 192.168.43.195.7771: UDP, length 120
03:59:08.892671 IP 192.168.43.195.8880 > 192.168.43.124.7772: UDP, length 120
03:59:08.942690 IP 192.168.43.195.8880 > 192.168.43.124.7772: UDP, length 120
03:59:08.948175 IP 192.168.43.124.8880 > 192.168.43.195.7771: UDP, length 120
03:59:08.992675 IP 192.168.43.195.8880 > 192.168.43.124.7772: UDP, length 120
03:59:08.996094 IP 192.168.43.124.8880 > 192.168.43.195.7771: UDP, length 120
03:59:09.024430 IP 192.168.43.124.8880 > 192.168.43.195.7771: UDP, length 120
03:59:09.042680 IP 192.168.43.195.8880 > 192.168.43.124.7772: UDP, length 120
03:59:09.092662 IP 192.168.43.195.8880 > 192.168.43.124.7772: UDP, length 120
03:59:09.142661 IP 192.168.43.195.8880 > 192.168.43.124.7772: UDP, length 120
03:59:09.192661 IP 192.168.43.195.8880 > 192.168.43.124.7772: UDP, length 120
03:59:09.242661 IP 192.168.43.195.8880 > 192.168.43.124.7772: UDP, length 120
03:59:09.277737 IP 192.168.43.124.8880 > 192.168.43.195.7771: UDP, length 120
03:59:09.277997 IP 192.168.43.124.8880 > 192.168.43.195.7771: UDP, length 120
03:59:09.292665 IP 192.168.43.195.8880 > 192.168.43.124.7772: UDP, length 120
03:59:09.342662 IP 192.168.43.195.8880 > 192.168.43.124.7772: UDP, length 120
03:59:09.392659 IP 192.168.43.195.8880 > 192.168.43.124.7772: UDP, length 120
03:59:09.442659 IP 192.168.43.195.8880 > 192.168.43.124.7772: UDP, length 120
03:59:09.481856 IP 192.168.43.124.8880 > 192.168.43.195.7771: UDP, length 120
03:59:09.481988 IP 192.168.43.124.8880 > 192.168.43.195.7771: UDP, length 120
03:59:09.482101 IP 192.168.43.124.8880 > 192.168.43.195.7771: UDP, length 120
03:59:09.492663 IP 192.168.43.195.8880 > 192.168.43.124.7772: UDP, length 120
03:59:09.542662 IP 192.168.43.195.8880 > 192.168.43.124.7772: UDP, length 120
03:59:09.592671 IP 192.168.43.195.8880 > 192.168.43.124.7772: UDP, length 120
03:59:09.604637 IP 192.168.43.124.8880 > 192.168.43.195.7771: UDP, length 120
03:59:09.604776 IP 192.168.43.124.8880 > 192.168.43.195.7771: UDP, length 120
03:59:09.642720 IP 192.168.43.195.8880 > 192.168.43.124.7772: UDP, length 120
03:59:09.692669 IP 192.168.43.195.8880 > 192.168.43.124.7772: UDP, length 120
03:59:09.742661 IP 192.168.43.195.8880 > 192.168.43.124.7772: UDP, length 120
03:59:09.783139 IP 192.168.43.124.8880 > 192.168.43.195.7771: UDP, length 120
03:59:09.783296 IP 192.168.43.124.8880 > 192.168.43.195.7771: UDP, length 120
03:59:09.783408 IP 192.168.43.124.8880 > 192.168.43.195.7771: UDP, length 120
03:59:09.792665 IP 192.168.43.195.8880 > 192.168.43.124.7772: UDP, length 120
03:59:09.842660 IP 192.168.43.195.8880 > 192.168.43.124.7772: UDP, length 120
03:59:09.892664 IP 192.168.43.195.8880 > 192.168.43.124.7772: UDP, length 120
03:59:09.942670 IP 192.168.43.195.8880 > 192.168.43.124.7772: UDP, length 120
03:59:09.992664 IP 192.168.43.195.8880 > 192.168.43.124.7772: UDP, length 120
03:59:10.035700 IP 192.168.43.124.8880 > 192.168.43.195.7771: UDP, length 120
03:59:10.035830 IP 192.168.43.124.8880 > 192.168.43.195.7771: UDP, length 120
03:59:10.035943 IP 192.168.43.124.8880 > 192.168.43.195.7771: UDP, length 120
03:59:10.036054 IP 192.168.43.124.8880 > 192.168.43.195.7771: UDP, length 120
03:59:10.042667 IP 192.168.43.195.8880 > 192.168.43.124.7772: UDP, length 120
03:59:10.092668 IP 192.168.43.195.8880 > 192.168.43.124.7772: UDP, length 120
03:59:10.142664 IP 192.168.43.195.8880 > 192.168.43.124.7772: UDP, length 120
03:59:10.192686 IP 192.168.43.195.8880 > 192.168.43.124.7772: UDP, length 120
03:59:10.242669 IP 192.168.43.195.8880 > 192.168.43.124.7772: UDP, length 120
03:59:10.292661 IP 192.168.43.195.8880 > 192.168.43.124.7772: UDP, length 120
03:59:10.297945 IP 192.168.43.124.8880 > 192.168.43.195.7771: UDP, length 120
03:59:10.298092 IP 192.168.43.124.8880 > 192.168.43.195.7771: UDP, length 120
03:59:10.342666 IP 192.168.43.195.8880 > 192.168.43.124.7772: UDP, length 120
03:59:10.392662 IP 192.168.43.195.8880 > 192.168.43.124.7772: UDP, length 120
03:59:10.436964 IP 192.168.43.124.8880 > 192.168.43.195.7771: UDP, length 120
03:59:10.437082 IP 192.168.43.124.8880 > 192.168.43.195.7771: UDP, length 120
03:59:10.442663 IP 192.168.43.195.8880 > 192.168.43.124.7772: UDP, length 120
03:59:10.477382 IP 192.168.43.124.8880 > 192.168.43.195.7771: UDP, length 120
03:59:10.477499 IP 192.168.43.124.8880 > 192.168.43.195.7771: UDP, length 120
03:59:10.477659 IP 192.168.43.124.8880 > 192.168.43.195.7771: UDP, length 120
03:59:10.480635 IP 192.168.43.124.8880 > 192.168.43.195.7771: UDP, length 120
03:59:10.480748 IP 192.168.43.124.8880 > 192.168.43.195.7771: UDP, length 120
03:59:10.492667 IP 192.168.43.195.8880 > 192.168.43.124.7772: UDP, length 120
03:59:10.542664 IP 192.168.43.195.8880 > 192.168.43.124.7772: UDP, length 120
03:59:10.592661 IP 192.168.43.195.8880 > 192.168.43.124.7772: UDP, length 120
03:59:10.642661 IP 192.168.43.195.8880 > 192.168.43.124.7772: UDP, length 120
03:59:10.692660 IP 192.168.43.195.8880 > 192.168.43.124.7772: UDP, length 120
03:59:10.701987 IP 192.168.43.124.8880 > 192.168.43.195.7771: UDP, length 120
03:59:10.702110 IP 192.168.43.124.8880 > 192.168.43.195.7771: UDP, length 120
03:59:10.742660 IP 192.168.43.195.8880 > 192.168.43.124.7772: UDP, length 120
03:59:10.776116 IP 192.168.43.124.8880 > 192.168.43.195.7771: UDP, length 120
03:59:10.776236 IP 192.168.43.124.8880 > 192.168.43.195.7771: UDP, length 120
03:59:10.779626 IP 192.168.43.124.8880 > 192.168.43.195.7771: UDP, length 120
03:59:10.779766 IP 192.168.43.124.8880 > 192.168.43.195.7771: UDP, length 120
03:59:10.781849 IP 192.168.43.124.8880 > 192.168.43.195.7771: UDP, length 120
03:59:10.792666 IP 192.168.43.195.8880 > 192.168.43.124.7772: UDP, length 120
03:59:10.822836 IP 192.168.43.124.8880 > 192.168.43.195.7771: UDP, length 120
03:59:10.842664 IP 192.168.43.195.8880 > 192.168.43.124.7772: UDP, length 120
03:59:10.874308 IP 192.168.43.124.8880 > 192.168.43.195.7771: UDP, length 120
03:59:10.892664 IP 192.168.43.195.8880 > 192.168.43.124.7772: UDP, length 120
03:59:10.922958 IP 192.168.43.124.8880 > 192.168.43.195.7771: UDP, length 120
03:59:10.942678 IP 192.168.43.195.8880 > 192.168.43.124.7772: UDP, length 120
03:59:10.972983 IP 192.168.43.124.8880 > 192.168.43.195.7771: UDP, length 120
03:59:10.992668 IP 192.168.43.195.8880 > 192.168.43.124.7772: UDP, length 120
03:59:11.042661 IP 192.168.43.195.8880 > 192.168.43.124.7772: UDP, length 120
03:59:11.048124 IP 192.168.43.124.8880 > 192.168.43.195.7771: UDP, length 120
03:59:11.079997 IP 192.168.43.124.8880 > 192.168.43.195.7771: UDP, length 120
03:59:11.092666 IP 192.168.43.195.8880 > 192.168.43.124.7772: UDP, length 120
03:59:11.142719 IP 192.168.43.195.8880 > 192.168.43.124.7772: UDP, length 120
03:59:11.163220 IP 192.168.43.124.8880 > 192.168.43.195.7771: UDP, length 120
03:59:11.192682 IP 192.168.43.195.8880 > 192.168.43.124.7772: UDP, length 120
03:59:11.212558 IP 192.168.43.124.8880 > 192.168.43.195.7771: UDP, length 120
03:59:11.242674 IP 192.168.43.195.8880 > 192.168.43.124.7772: UDP, length 120
03:59:11.292664 IP 192.168.43.195.8880 > 192.168.43.124.7772: UDP, length 120
03:59:11.318585 IP 192.168.43.124.8880 > 192.168.43.195.7771: UDP, length 120
03:59:11.342665 IP 192.168.43.195.8880 > 192.168.43.124.7772: UDP, length 120
03:59:11.392664 IP 192.168.43.195.8880 > 192.168.43.124.7772: UDP, length 120
03:59:11.442663 IP 192.168.43.195.8880 > 192.168.43.124.7772: UDP, length 120
03:59:11.492663 IP 192.168.43.195.8880 > 192.168.43.124.7772: UDP, length 120
03:59:11.530534 IP 192.168.43.124.8880 > 192.168.43.195.7771: UDP, length 120
03:59:11.530669 IP 192.168.43.124.8880 > 192.168.43.195.7771: UDP, length 120
03:59:11.530826 IP 192.168.43.124.8880 > 192.168.43.195.7771: UDP, length 120
03:59:11.542670 IP 192.168.43.195.8880 > 192.168.43.124.7772: UDP, length 120
03:59:11.592662 IP 192.168.43.195.8880 > 192.168.43.124.7772: UDP, length 120
03:59:11.642661 IP 192.168.43.195.8880 > 192.168.43.124.7772: UDP, length 120
03:59:11.689508 IP 192.168.43.124.8880 > 192.168.43.195.7771: UDP, length 120
03:59:11.689638 IP 192.168.43.124.8880 > 192.168.43.195.7771: UDP, length 120
03:59:11.689784 IP 192.168.43.124.8880 > 192.168.43.195.7771: UDP, length 120
03:59:11.692664 IP 192.168.43.195.8880 > 192.168.43.124.7772: UDP, length 120
03:59:11.742661 IP 192.168.43.195.8880 > 192.168.43.124.7772: UDP, length 120
03:59:11.792369 IP 192.168.43.124.8880 > 192.168.43.195.7771: UDP, length 120
03:59:11.792501 IP 192.168.43.124.8880 > 192.168.43.195.7771: UDP, length 120
03:59:11.792641 IP 192.168.43.124.8880 > 192.168.43.195.7771: UDP, length 120
03:59:11.792665 IP 192.168.43.195.8880 > 192.168.43.124.7772: UDP, length 120
03:59:11.792763 IP 192.168.43.124.8880 > 192.168.43.195.7771: UDP, length 120
03:59:11.794575 IP 192.168.43.124.8880 > 192.168.43.195.7771: UDP, length 120
03:59:11.822980 IP 192.168.43.124.8880 > 192.168.43.195.7771: UDP, length 120
03:59:11.842670 IP 192.168.43.195.8880 > 192.168.43.124.7772: UDP, length 120
03:59:11.873972 IP 192.168.43.124.8880 > 192.168.43.195.7771: UDP, length 120
03:59:11.892667 IP 192.168.43.195.8880 > 192.168.43.124.7772: UDP, length 120
03:59:11.923006 IP 192.168.43.124.8880 > 192.168.43.195.7771: UDP, length 120
03:59:11.942684 IP 192.168.43.195.8880 > 192.168.43.124.7772: UDP, length 120
03:59:11.972988 IP 192.168.43.124.8880 > 192.168.43.195.7771: UDP, length 120
03:59:11.992669 IP 192.168.43.195.8880 > 192.168.43.124.7772: UDP, length 120
03:59:12.023224 IP 192.168.43.124.8880 > 192.168.43.195.7771: UDP, length 120
03:59:12.042668 IP 192.168.43.195.8880 > 192.168.43.124.7772: UDP, length 120
03:59:12.073119 IP 192.168.43.124.8880 > 192.168.43.195.7771: UDP, length 120
03:59:12.092669 IP 192.168.43.195.8880 > 192.168.43.124.7772: UDP, length 120
03:59:12.122823 IP 192.168.43.124.8880 > 192.168.43.195.7771: UDP, length 120
03:59:12.142667 IP 192.168.43.195.8880 > 192.168.43.124.7772: UDP, length 120
03:59:12.172939 IP 192.168.43.124.8880 > 192.168.43.195.7771: UDP, length 120
03:59:12.192668 IP 192.168.43.195.8880 > 192.168.43.124.7772: UDP, length 120
03:59:12.225501 IP 192.168.43.124.8880 > 192.168.43.195.7771: UDP, length 120
03:59:12.242674 IP 192.168.43.195.8880 > 192.168.43.124.7772: UDP, length 120
03:59:12.273533 IP 192.168.43.124.8880 > 192.168.43.195.7771: UDP, length 120
03:59:12.292669 IP 192.168.43.195.8880 > 192.168.43.124.7772: UDP, length 120
03:59:12.324167 IP 192.168.43.124.8880 > 192.168.43.195.7771: UDP, length 120
03:59:12.342665 IP 192.168.43.195.8880 > 192.168.43.124.7772: UDP, length 120
03:59:12.376428 IP 192.168.43.124.8880 > 192.168.43.195.7771: UDP, length 120
03:59:12.392664 IP 192.168.43.195.8880 > 192.168.43.124.7772: UDP, length 120
03:59:12.430734 IP 192.168.43.124.8880 > 192.168.43.195.7771: UDP, length 120
03:59:12.442663 IP 192.168.43.195.8880 > 192.168.43.124.7772: UDP, length 120
03:59:12.472944 IP 192.168.43.124.8880 > 192.168.43.195.7771: UDP, length 120
03:59:12.492664 IP 192.168.43.195.8880 > 192.168.43.124.7772: UDP, length 120
03:59:12.525985 IP 192.168.43.124.8880 > 192.168.43.195.7771: UDP, length 120
03:59:12.542664 IP 192.168.43.195.8880 > 192.168.43.124.7772: UDP, length 120
03:59:12.573752 IP 192.168.43.124.8880 > 192.168.43.195.7771: UDP, length 120
03:59:12.592666 IP 192.168.43.195.8880 > 192.168.43.124.7772: UDP, length 120
03:59:12.623873 IP 192.168.43.124.8880 > 192.168.43.195.7771: UDP, length 120
03:59:12.642719 IP 192.168.43.195.8880 > 192.168.43.124.7772: UDP, length 120
03:59:12.675499 IP 192.168.43.124.8880 > 192.168.43.195.7771: UDP, length 120
03:59:12.692678 IP 192.168.43.195.8880 > 192.168.43.124.7772: UDP, length 120
03:59:12.724170 IP 192.168.43.124.8880 > 192.168.43.195.7771: UDP, length 120
03:59:12.742667 IP 192.168.43.195.8880 > 192.168.43.124.7772: UDP, length 120
03:59:12.772996 IP 192.168.43.124.8880 > 192.168.43.195.7771: UDP, length 120
03:59:12.792665 IP 192.168.43.195.8880 > 192.168.43.124.7772: UDP, length 120
03:59:12.836946 IP 192.168.43.124.8880 > 192.168.43.195.7771: UDP, length 120
03:59:12.842664 IP 192.168.43.195.8880 > 192.168.43.124.7772: UDP, length 120
03:59:12.880254 IP 192.168.43.124.8880 > 192.168.43.195.7771: UDP, length 120
03:59:12.892663 IP 192.168.43.195.8880 > 192.168.43.124.7772: UDP, length 120
03:59:12.942674 IP 192.168.43.195.8880 > 192.168.43.124.7772: UDP, length 120
03:59:12.990636 IP 192.168.43.124.8880 > 192.168.43.195.7771: UDP, length 120
03:59:12.990853 IP 192.168.43.124.8880 > 192.168.43.195.7771: UDP, length 120
03:59:12.992666 IP 192.168.43.195.8880 > 192.168.43.124.7772: UDP, length 120
03:59:13.042663 IP 192.168.43.195.8880 > 192.168.43.124.7772: UDP, length 120
03:59:13.092660 IP 192.168.43.195.8880 > 192.168.43.124.7772: UDP, length 120
03:59:13.105379 IP 192.168.43.124.8880 > 192.168.43.195.7771: UDP, length 120
03:59:13.128602 IP 192.168.43.124.8880 > 192.168.43.195.7771: UDP, length 120
03:59:13.142663 IP 192.168.43.195.8880 > 192.168.43.124.7772: UDP, length 120
03:59:13.192662 IP 192.168.43.195.8880 > 192.168.43.124.7772: UDP, length 120
03:59:13.242665 IP 192.168.43.195.8880 > 192.168.43.124.7772: UDP, length 120
03:59:13.292669 IP 192.168.43.195.8880 > 192.168.43.124.7772: UDP, length 120
03:59:13.342660 IP 192.168.43.195.8880 > 192.168.43.124.7772: UDP, length 120
03:59:13.392661 IP 192.168.43.195.8880 > 192.168.43.124.7772: UDP, length 120
03:59:13.442660 IP 192.168.43.195.8880 > 192.168.43.124.7772: UDP, length 120
03:59:13.492661 IP 192.168.43.195.8880 > 192.168.43.124.7772: UDP, length 120
03:59:13.542657 IP 192.168.43.195.8880 > 192.168.43.124.7772: UDP, length 120
03:59:13.592665 IP 192.168.43.195.8880 > 192.168.43.124.7772: UDP, length 120
03:59:13.642660 IP 192.168.43.195.8880 > 192.168.43.124.7772: UDP, length 120
03:59:13.692660 IP 192.168.43.195.8880 > 192.168.43.124.7772: UDP, length 120
03:59:13.742659 IP 192.168.43.195.8880 > 192.168.43.124.7772: UDP, length 120
03:59:13.792659 IP 192.168.43.195.8880 > 192.168.43.124.7772: UDP, length 120
03:59:13.842667 IP 192.168.43.195.8880 > 192.168.43.124.7772: UDP, length 120
