00:38:34.136668 IP 192.168.43.124.8880 > 192.168.43.146.7771: UDP, length 120
00:38:34.275760 IP 192.168.43.124.8880 > 192.168.43.146.7771: UDP, length 120
00:38:34.275933 IP 192.168.43.124.8880 > 192.168.43.146.7771: UDP, length 120
00:38:34.283890 IP 192.168.43.124.8880 > 192.168.43.146.7771: UDP, length 120
00:38:34.337000 IP 192.168.43.124.8880 > 192.168.43.146.7771: UDP, length 120
00:38:34.387281 IP 192.168.43.124.8880 > 192.168.43.146.7771: UDP, length 120
00:38:34.434515 IP 192.168.43.124.8880 > 192.168.43.146.7771: UDP, length 120
00:38:34.485251 IP 192.168.43.124.8880 > 192.168.43.146.7771: UDP, length 120
00:38:34.537065 IP 192.168.43.124.8880 > 192.168.43.146.7771: UDP, length 120
00:38:34.587275 IP 192.168.43.124.8880 > 192.168.43.146.7771: UDP, length 120
00:38:34.638464 IP 192.168.43.124.8880 > 192.168.43.146.7771: UDP, length 120
00:38:34.651322 IP 192.168.43.146.8880 > 192.168.43.147.7772: UDP, length 120
00:38:34.686529 IP 192.168.43.124.8880 > 192.168.43.146.7771: UDP, length 120
00:38:34.701348 IP 192.168.43.146.8880 > 192.168.43.147.7772: UDP, length 120
00:38:34.739923 IP 192.168.43.124.8880 > 192.168.43.146.7771: UDP, length 120
00:38:34.751321 IP 192.168.43.146.8880 > 192.168.43.147.7772: UDP, length 120
00:38:34.786670 IP 192.168.43.124.8880 > 192.168.43.146.7771: UDP, length 120
00:38:34.801317 IP 192.168.43.146.8880 > 192.168.43.147.7772: UDP, length 120
00:38:34.837111 IP 192.168.43.124.8880 > 192.168.43.146.7771: UDP, length 120
00:38:34.851323 IP 192.168.43.146.8880 > 192.168.43.147.7772: UDP, length 120
00:38:34.887248 IP 192.168.43.124.8880 > 192.168.43.146.7771: UDP, length 120
00:38:34.901326 IP 192.168.43.146.8880 > 192.168.43.147.7772: UDP, length 120
00:38:34.937350 IP 192.168.43.124.8880 > 192.168.43.146.7771: UDP, length 120
00:38:34.951316 IP 192.168.43.146.8880 > 192.168.43.147.7772: UDP, length 120
00:38:34.987696 IP 192.168.43.124.8880 > 192.168.43.146.7771: UDP, length 120
00:38:35.001311 IP 192.168.43.146.8880 > 192.168.43.147.7772: UDP, length 120
00:38:35.037087 IP 192.168.43.124.8880 > 192.168.43.146.7771: UDP, length 120
00:38:35.051399 IP 192.168.43.146.8880 > 192.168.43.147.7772: UDP, length 120
00:38:35.087841 IP 192.168.43.124.8880 > 192.168.43.146.7771: UDP, length 120
00:38:35.101423 IP 192.168.43.146.8880 > 192.168.43.147.7772: UDP, length 120
00:38:35.137796 IP 192.168.43.124.8880 > 192.168.43.146.7771: UDP, length 120
00:38:35.151417 IP 192.168.43.146.8880 > 192.168.43.147.7772: UDP, length 120
00:38:35.187384 IP 192.168.43.124.8880 > 192.168.43.146.7771: UDP, length 120
00:38:35.201408 IP 192.168.43.146.8880 > 192.168.43.147.7772: UDP, length 120
00:38:35.238253 IP 192.168.43.124.8880 > 192.168.43.146.7771: UDP, length 120
00:38:35.251449 IP 192.168.43.146.8880 > 192.168.43.147.7772: UDP, length 120
00:38:35.286905 IP 192.168.43.124.8880 > 192.168.43.146.7771: UDP, length 120
00:38:35.301405 IP 192.168.43.146.8880 > 192.168.43.147.7772: UDP, length 120
00:38:35.338626 IP 192.168.43.124.8880 > 192.168.43.146.7771: UDP, length 120
00:38:35.351440 IP 192.168.43.146.8880 > 192.168.43.147.7772: UDP, length 120
00:38:35.387226 IP 192.168.43.124.8880 > 192.168.43.146.7771: UDP, length 120
00:38:35.401414 IP 192.168.43.146.8880 > 192.168.43.147.7772: UDP, length 120
00:38:35.437145 IP 192.168.43.124.8880 > 192.168.43.146.7771: UDP, length 120
00:38:35.451373 IP 192.168.43.146.8880 > 192.168.43.147.7772: UDP, length 120
00:38:35.485591 IP 192.168.43.124.8880 > 192.168.43.146.7771: UDP, length 120
00:38:35.501406 IP 192.168.43.146.8880 > 192.168.43.147.7772: UDP, length 120
00:38:35.538246 IP 192.168.43.124.8880 > 192.168.43.146.7771: UDP, length 120
00:38:35.551366 IP 192.168.43.146.8880 > 192.168.43.147.7772: UDP, length 120
00:38:35.587132 IP 192.168.43.124.8880 > 192.168.43.146.7771: UDP, length 120
00:38:35.601369 IP 192.168.43.146.8880 > 192.168.43.147.7772: UDP, length 120
00:38:35.636995 IP 192.168.43.124.8880 > 192.168.43.146.7771: UDP, length 120
00:38:35.651331 IP 192.168.43.146.8880 > 192.168.43.147.7772: UDP, length 120
00:38:35.687729 IP 192.168.43.124.8880 > 192.168.43.146.7771: UDP, length 120
00:38:35.701300 IP 192.168.43.146.8880 > 192.168.43.147.7772: UDP, length 120
00:38:35.736949 IP 192.168.43.124.8880 > 192.168.43.146.7771: UDP, length 120
00:38:35.751338 IP 192.168.43.146.8880 > 192.168.43.147.7772: UDP, length 120
00:38:35.786958 IP 192.168.43.124.8880 > 192.168.43.146.7771: UDP, length 120
00:38:35.801321 IP 192.168.43.146.8880 > 192.168.43.147.7772: UDP, length 120
00:38:35.838622 IP 192.168.43.124.8880 > 192.168.43.146.7771: UDP, length 120
00:38:35.851296 IP 192.168.43.146.8880 > 192.168.43.147.7772: UDP, length 120
00:38:35.887022 IP 192.168.43.124.8880 > 192.168.43.146.7771: UDP, length 120
00:38:35.901302 IP 192.168.43.146.8880 > 192.168.43.147.7772: UDP, length 120
00:38:35.939479 IP 192.168.43.124.8880 > 192.168.43.146.7771: UDP, length 120
00:38:35.951292 IP 192.168.43.146.8880 > 192.168.43.147.7772: UDP, length 120
00:38:35.987137 IP 192.168.43.124.8880 > 192.168.43.146.7771: UDP, length 120
00:38:36.001290 IP 192.168.43.146.8880 > 192.168.43.147.7772: UDP, length 120
00:38:36.037015 IP 192.168.43.124.8880 > 192.168.43.146.7771: UDP, length 120
00:38:36.051287 IP 192.168.43.146.8880 > 192.168.43.147.7772: UDP, length 120
00:38:36.087360 IP 192.168.43.124.8880 > 192.168.43.146.7771: UDP, length 120
00:38:36.101287 IP 192.168.43.146.8880 > 192.168.43.147.7772: UDP, length 120
00:38:36.136417 IP 192.168.43.124.8880 > 192.168.43.146.7771: UDP, length 120
00:38:36.151289 IP 192.168.43.146.8880 > 192.168.43.147.7772: UDP, length 120
00:38:36.186975 IP 192.168.43.124.8880 > 192.168.43.146.7771: UDP, length 120
00:38:36.201286 IP 192.168.43.146.8880 > 192.168.43.147.7772: UDP, length 120
00:38:36.236849 IP 192.168.43.124.8880 > 192.168.43.146.7771: UDP, length 120
00:38:36.251287 IP 192.168.43.146.8880 > 192.168.43.147.7772: UDP, length 120
00:38:36.286961 IP 192.168.43.124.8880 > 192.168.43.146.7771: UDP, length 120
00:38:36.301287 IP 192.168.43.146.8880 > 192.168.43.147.7772: UDP, length 120
00:38:36.336864 IP 192.168.43.124.8880 > 192.168.43.146.7771: UDP, length 120
00:38:36.351293 IP 192.168.43.146.8880 > 192.168.43.147.7772: UDP, length 120
00:38:36.386884 IP 192.168.43.124.8880 > 192.168.43.146.7771: UDP, length 120
00:38:36.401289 IP 192.168.43.146.8880 > 192.168.43.147.7772: UDP, length 120
00:38:36.436867 IP 192.168.43.124.8880 > 192.168.43.146.7771: UDP, length 120
00:38:36.451288 IP 192.168.43.146.8880 > 192.168.43.147.7772: UDP, length 120
00:38:36.485504 IP 192.168.43.124.8880 > 192.168.43.146.7771: UDP, length 120
00:38:36.501287 IP 192.168.43.146.8880 > 192.168.43.147.7772: UDP, length 120
00:38:36.551287 IP 192.168.43.146.8880 > 192.168.43.147.7772: UDP, length 120
00:38:36.554527 IP 192.168.43.124.8880 > 192.168.43.146.7771: UDP, length 120
00:38:36.586417 IP 192.168.43.124.8880 > 192.168.43.146.7771: UDP, length 120
00:38:36.601289 IP 192.168.43.146.8880 > 192.168.43.147.7772: UDP, length 120
00:38:36.636731 IP 192.168.43.124.8880 > 192.168.43.146.7771: UDP, length 120
00:38:36.651287 IP 192.168.43.146.8880 > 192.168.43.147.7772: UDP, length 120
00:38:36.687049 IP 192.168.43.124.8880 > 192.168.43.146.7771: UDP, length 120
00:38:36.701292 IP 192.168.43.146.8880 > 192.168.43.147.7772: UDP, length 120
00:38:36.736929 IP 192.168.43.124.8880 > 192.168.43.146.7771: UDP, length 120
00:38:36.751289 IP 192.168.43.146.8880 > 192.168.43.147.7772: UDP, length 120
00:38:36.789015 IP 192.168.43.124.8880 > 192.168.43.146.7771: UDP, length 120
00:38:36.801286 IP 192.168.43.146.8880 > 192.168.43.147.7772: UDP, length 120
00:38:36.836928 IP 192.168.43.124.8880 > 192.168.43.146.7771: UDP, length 120
00:38:36.851286 IP 192.168.43.146.8880 > 192.168.43.147.7772: UDP, length 120
00:38:36.889788 IP 192.168.43.124.8880 > 192.168.43.146.7771: UDP, length 120
00:38:36.901291 IP 192.168.43.146.8880 > 192.168.43.147.7772: UDP, length 120
00:38:36.937006 IP 192.168.43.124.8880 > 192.168.43.146.7771: UDP, length 120
00:38:36.951292 IP 192.168.43.146.8880 > 192.168.43.147.7772: UDP, length 120
00:38:36.985736 IP 192.168.43.124.8880 > 192.168.43.146.7771: UDP, length 120
00:38:37.001292 IP 192.168.43.146.8880 > 192.168.43.147.7772: UDP, length 120
00:38:37.037777 IP 192.168.43.124.8880 > 192.168.43.146.7771: UDP, length 120
00:38:37.051287 IP 192.168.43.146.8880 > 192.168.43.147.7772: UDP, length 120
00:38:37.087020 IP 192.168.43.124.8880 > 192.168.43.146.7771: UDP, length 120
00:38:37.101287 IP 192.168.43.146.8880 > 192.168.43.147.7772: UDP, length 120
00:38:37.137993 IP 192.168.43.124.8880 > 192.168.43.146.7771: UDP, length 120
00:38:37.151297 IP 192.168.43.146.8880 > 192.168.43.147.7772: UDP, length 120
00:38:37.186971 IP 192.168.43.124.8880 > 192.168.43.146.7771: UDP, length 120
00:38:37.201289 IP 192.168.43.146.8880 > 192.168.43.147.7772: UDP, length 120
00:38:37.236947 IP 192.168.43.124.8880 > 192.168.43.146.7771: UDP, length 120
00:38:37.251334 IP 192.168.43.146.8880 > 192.168.43.147.7772: UDP, length 120
00:38:37.287353 IP 192.168.43.124.8880 > 192.168.43.146.7771: UDP, length 120
00:38:37.301301 IP 192.168.43.146.8880 > 192.168.43.147.7772: UDP, length 120
00:38:37.337305 IP 192.168.43.124.8880 > 192.168.43.146.7771: UDP, length 120
00:38:37.351295 IP 192.168.43.146.8880 > 192.168.43.147.7772: UDP, length 120
00:38:37.388392 IP 192.168.43.124.8880 > 192.168.43.146.7771: UDP, length 120
00:38:37.401290 IP 192.168.43.146.8880 > 192.168.43.147.7772: UDP, length 120
00:38:37.437701 IP 192.168.43.124.8880 > 192.168.43.146.7771: UDP, length 120
00:38:37.451289 IP 192.168.43.146.8880 > 192.168.43.147.7772: UDP, length 120
00:38:37.488540 IP 192.168.43.124.8880 > 192.168.43.146.7771: UDP, length 120
00:38:37.501286 IP 192.168.43.146.8880 > 192.168.43.147.7772: UDP, length 120
00:38:37.537037 IP 192.168.43.124.8880 > 192.168.43.146.7771: UDP, length 120
00:38:37.551288 IP 192.168.43.146.8880 > 192.168.43.147.7772: UDP, length 120
00:38:37.587433 IP 192.168.43.124.8880 > 192.168.43.146.7771: UDP, length 120
00:38:37.601357 IP 192.168.43.146.8880 > 192.168.43.147.7772: UDP, length 120
00:38:37.637197 IP 192.168.43.124.8880 > 192.168.43.146.7771: UDP, length 120
00:38:37.651414 IP 192.168.43.146.8880 > 192.168.43.147.7772: UDP, length 120
00:38:37.688943 IP 192.168.43.124.8880 > 192.168.43.146.7771: UDP, length 120
00:38:37.701389 IP 192.168.43.146.8880 > 192.168.43.147.7772: UDP, length 120
00:38:37.736843 IP 192.168.43.124.8880 > 192.168.43.146.7771: UDP, length 120
00:38:37.751331 IP 192.168.43.146.8880 > 192.168.43.147.7772: UDP, length 120
00:38:37.787019 IP 192.168.43.124.8880 > 192.168.43.146.7771: UDP, length 120
00:38:37.801322 IP 192.168.43.146.8880 > 192.168.43.147.7772: UDP, length 120
00:38:37.837503 IP 192.168.43.124.8880 > 192.168.43.146.7771: UDP, length 120
00:38:37.851322 IP 192.168.43.146.8880 > 192.168.43.147.7772: UDP, length 120
00:38:37.886979 IP 192.168.43.124.8880 > 192.168.43.146.7771: UDP, length 120
00:38:37.901317 IP 192.168.43.146.8880 > 192.168.43.147.7772: UDP, length 120
00:38:37.937035 IP 192.168.43.124.8880 > 192.168.43.146.7771: UDP, length 120
00:38:37.951311 IP 192.168.43.146.8880 > 192.168.43.147.7772: UDP, length 120
00:38:37.985678 IP 192.168.43.124.8880 > 192.168.43.146.7771: UDP, length 120
00:38:38.001317 IP 192.168.43.146.8880 > 192.168.43.147.7772: UDP, length 120
00:38:38.037043 IP 192.168.43.124.8880 > 192.168.43.146.7771: UDP, length 120
00:38:38.051324 IP 192.168.43.146.8880 > 192.168.43.147.7772: UDP, length 120
00:38:38.087031 IP 192.168.43.124.8880 > 192.168.43.146.7771: UDP, length 120
00:38:38.101311 IP 192.168.43.146.8880 > 192.168.43.147.7772: UDP, length 120
00:38:38.137074 IP 192.168.43.124.8880 > 192.168.43.146.7771: UDP, length 120
00:38:38.151315 IP 192.168.43.146.8880 > 192.168.43.147.7772: UDP, length 120
00:38:38.187098 IP 192.168.43.124.8880 > 192.168.43.146.7771: UDP, length 120
00:38:38.201312 IP 192.168.43.146.8880 > 192.168.43.147.7772: UDP, length 120
00:38:38.237031 IP 192.168.43.124.8880 > 192.168.43.146.7771: UDP, length 120
00:38:38.251311 IP 192.168.43.146.8880 > 192.168.43.147.7772: UDP, length 120
00:38:38.287022 IP 192.168.43.124.8880 > 192.168.43.146.7771: UDP, length 120
00:38:38.301315 IP 192.168.43.146.8880 > 192.168.43.147.7772: UDP, length 120
00:38:38.337098 IP 192.168.43.124.8880 > 192.168.43.146.7771: UDP, length 120
00:38:38.351324 IP 192.168.43.146.8880 > 192.168.43.147.7772: UDP, length 120
00:38:38.387185 IP 192.168.43.124.8880 > 192.168.43.146.7771: UDP, length 120
00:38:38.401316 IP 192.168.43.146.8880 > 192.168.43.147.7772: UDP, length 120
00:38:38.437166 IP 192.168.43.124.8880 > 192.168.43.146.7771: UDP, length 120
00:38:38.451317 IP 192.168.43.146.8880 > 192.168.43.147.7772: UDP, length 120
00:38:38.485634 IP 192.168.43.124.8880 > 192.168.43.146.7771: UDP, length 120
00:38:38.501312 IP 192.168.43.146.8880 > 192.168.43.147.7772: UDP, length 120
00:38:38.537229 IP 192.168.43.124.8880 > 192.168.43.146.7771: UDP, length 120
00:38:38.551318 IP 192.168.43.146.8880 > 192.168.43.147.7772: UDP, length 120
00:38:38.587064 IP 192.168.43.124.8880 > 192.168.43.146.7771: UDP, length 120
00:38:38.601315 IP 192.168.43.146.8880 > 192.168.43.147.7772: UDP, length 120
00:38:38.637102 IP 192.168.43.124.8880 > 192.168.43.146.7771: UDP, length 120
00:38:38.651315 IP 192.168.43.146.8880 > 192.168.43.147.7772: UDP, length 120
00:38:38.687121 IP 192.168.43.124.8880 > 192.168.43.146.7771: UDP, length 120
00:38:38.701402 IP 192.168.43.146.8880 > 192.168.43.147.7772: UDP, length 120
00:38:38.737650 IP 192.168.43.124.8880 > 192.168.43.146.7771: UDP, length 120
00:38:38.751405 IP 192.168.43.146.8880 > 192.168.43.147.7772: UDP, length 120
00:38:38.787214 IP 192.168.43.124.8880 > 192.168.43.146.7771: UDP, length 120
00:38:38.801372 IP 192.168.43.146.8880 > 192.168.43.147.7772: UDP, length 120
00:38:38.837144 IP 192.168.43.124.8880 > 192.168.43.146.7771: UDP, length 120
00:38:38.851328 IP 192.168.43.146.8880 > 192.168.43.147.7772: UDP, length 120
00:38:38.887854 IP 192.168.43.124.8880 > 192.168.43.146.7771: UDP, length 120
00:38:38.901315 IP 192.168.43.146.8880 > 192.168.43.147.7772: UDP, length 120
00:38:38.937178 IP 192.168.43.124.8880 > 192.168.43.146.7771: UDP, length 120
00:38:38.951318 IP 192.168.43.146.8880 > 192.168.43.147.7772: UDP, length 120
00:38:38.984412 IP 192.168.43.124.8880 > 192.168.43.146.7771: UDP, length 120
00:38:39.001314 IP 192.168.43.146.8880 > 192.168.43.147.7772: UDP, length 120
00:38:39.037170 IP 192.168.43.124.8880 > 192.168.43.146.7771: UDP, length 120
00:38:39.051323 IP 192.168.43.146.8880 > 192.168.43.147.7772: UDP, length 120
00:38:39.086669 IP 192.168.43.124.8880 > 192.168.43.146.7771: UDP, length 120
00:38:39.101322 IP 192.168.43.146.8880 > 192.168.43.147.7772: UDP, length 120
00:38:39.136886 IP 192.168.43.124.8880 > 192.168.43.146.7771: UDP, length 120
00:38:39.151327 IP 192.168.43.146.8880 > 192.168.43.147.7772: UDP, length 120
00:38:39.188479 IP 192.168.43.124.8880 > 192.168.43.146.7771: UDP, length 120
00:38:39.201314 IP 192.168.43.146.8880 > 192.168.43.147.7772: UDP, length 120
00:38:39.237214 IP 192.168.43.124.8880 > 192.168.43.146.7771: UDP, length 120
00:38:39.251314 IP 192.168.43.146.8880 > 192.168.43.147.7772: UDP, length 120
00:38:39.288500 IP 192.168.43.124.8880 > 192.168.43.146.7771: UDP, length 120
00:38:39.301312 IP 192.168.43.146.8880 > 192.168.43.147.7772: UDP, length 120
00:38:39.335599 IP 192.168.43.124.8880 > 192.168.43.146.7771: UDP, length 120
00:38:39.351319 IP 192.168.43.146.8880 > 192.168.43.147.7772: UDP, length 120
00:38:39.387193 IP 192.168.43.124.8880 > 192.168.43.146.7771: UDP, length 120
00:38:39.401314 IP 192.168.43.146.8880 > 192.168.43.147.7772: UDP, length 120
00:38:39.437419 IP 192.168.43.124.8880 > 192.168.43.146.7771: UDP, length 120
00:38:39.451314 IP 192.168.43.146.8880 > 192.168.43.147.7772: UDP, length 120
00:38:39.485561 IP 192.168.43.124.8880 > 192.168.43.146.7771: UDP, length 120
00:38:39.501313 IP 192.168.43.146.8880 > 192.168.43.147.7772: UDP, length 120
00:38:39.538944 IP 192.168.43.124.8880 > 192.168.43.146.7771: UDP, length 120
00:38:39.551316 IP 192.168.43.146.8880 > 192.168.43.147.7772: UDP, length 120
00:38:39.587441 IP 192.168.43.124.8880 > 192.168.43.146.7771: UDP, length 120
00:38:39.601313 IP 192.168.43.146.8880 > 192.168.43.147.7772: UDP, length 120
00:38:39.639085 IP 192.168.43.124.8880 > 192.168.43.146.7771: UDP, length 120
00:38:39.651315 IP 192.168.43.146.8880 > 192.168.43.147.7772: UDP, length 120
00:38:39.686909 IP 192.168.43.124.8880 > 192.168.43.146.7771: UDP, length 120
00:38:39.701335 IP 192.168.43.146.8880 > 192.168.43.147.7772: UDP, length 120
00:38:39.737126 IP 192.168.43.124.8880 > 192.168.43.146.7771: UDP, length 120
00:38:39.751316 IP 192.168.43.146.8880 > 192.168.43.147.7772: UDP, length 120
00:38:39.791491 IP 192.168.43.124.8880 > 192.168.43.146.7771: UDP, length 120
00:38:39.801366 IP 192.168.43.146.8880 > 192.168.43.147.7772: UDP, length 120
00:38:39.839082 IP 192.168.43.124.8880 > 192.168.43.146.7771: UDP, length 120
00:38:39.851328 IP 192.168.43.146.8880 > 192.168.43.147.7772: UDP, length 120
00:38:39.887623 IP 192.168.43.124.8880 > 192.168.43.146.7771: UDP, length 120
00:38:39.901315 IP 192.168.43.146.8880 > 192.168.43.147.7772: UDP, length 120
00:38:39.936823 IP 192.168.43.124.8880 > 192.168.43.146.7771: UDP, length 120
00:38:39.951315 IP 192.168.43.146.8880 > 192.168.43.147.7772: UDP, length 120
00:38:39.987784 IP 192.168.43.124.8880 > 192.168.43.146.7771: UDP, length 120
00:38:40.001314 IP 192.168.43.146.8880 > 192.168.43.147.7772: UDP, length 120
00:38:40.036439 IP 192.168.43.124.8880 > 192.168.43.146.7771: UDP, length 120
00:38:40.051314 IP 192.168.43.146.8880 > 192.168.43.147.7772: UDP, length 120
00:38:40.088541 IP 192.168.43.124.8880 > 192.168.43.146.7771: UDP, length 120
00:38:40.101318 IP 192.168.43.146.8880 > 192.168.43.147.7772: UDP, length 120
00:38:40.139135 IP 192.168.43.124.8880 > 192.168.43.146.7771: UDP, length 120
00:38:40.151317 IP 192.168.43.146.8880 > 192.168.43.147.7772: UDP, length 120
00:38:40.187119 IP 192.168.43.124.8880 > 192.168.43.146.7771: UDP, length 120
00:38:40.201315 IP 192.168.43.146.8880 > 192.168.43.147.7772: UDP, length 120
00:38:40.239426 IP 192.168.43.124.8880 > 192.168.43.146.7771: UDP, length 120
00:38:40.252447 IP 192.168.43.146.8880 > 192.168.43.147.7772: UDP, length 120
00:38:40.287319 IP 192.168.43.124.8880 > 192.168.43.146.7771: UDP, length 120
00:38:40.301341 IP 192.168.43.146.8880 > 192.168.43.147.7772: UDP, length 120
00:38:40.336838 IP 192.168.43.124.8880 > 192.168.43.146.7771: UDP, length 120
00:38:40.351321 IP 192.168.43.146.8880 > 192.168.43.147.7772: UDP, length 120
00:38:40.398614 IP 192.168.43.124.8880 > 192.168.43.146.7771: UDP, length 120
00:38:40.401314 IP 192.168.43.146.8880 > 192.168.43.147.7772: UDP, length 120
00:38:40.437175 IP 192.168.43.124.8880 > 192.168.43.146.7771: UDP, length 120
00:38:40.451316 IP 192.168.43.146.8880 > 192.168.43.147.7772: UDP, length 120
00:38:40.487168 IP 192.168.43.124.8880 > 192.168.43.146.7771: UDP, length 120
00:38:40.501315 IP 192.168.43.146.8880 > 192.168.43.147.7772: UDP, length 120
00:38:40.537111 IP 192.168.43.124.8880 > 192.168.43.146.7771: UDP, length 120
00:38:40.551315 IP 192.168.43.146.8880 > 192.168.43.147.7772: UDP, length 120
00:38:40.587098 IP 192.168.43.124.8880 > 192.168.43.146.7771: UDP, length 120
00:38:40.601314 IP 192.168.43.146.8880 > 192.168.43.147.7772: UDP, length 120
00:38:40.637150 IP 192.168.43.124.8880 > 192.168.43.146.7771: UDP, length 120
00:38:40.651429 IP 192.168.43.146.8880 > 192.168.43.147.7772: UDP, length 120
00:38:40.687326 IP 192.168.43.124.8880 > 192.168.43.146.7771: UDP, length 120
00:38:40.701417 IP 192.168.43.146.8880 > 192.168.43.147.7772: UDP, length 120
00:38:40.737001 IP 192.168.43.124.8880 > 192.168.43.146.7771: UDP, length 120
00:38:40.751374 IP 192.168.43.146.8880 > 192.168.43.147.7772: UDP, length 120
00:38:40.788436 IP 192.168.43.124.8880 > 192.168.43.146.7771: UDP, length 120
00:38:40.801362 IP 192.168.43.146.8880 > 192.168.43.147.7772: UDP, length 120
00:38:40.837670 IP 192.168.43.124.8880 > 192.168.43.146.7771: UDP, length 120
00:38:40.851377 IP 192.168.43.146.8880 > 192.168.43.147.7772: UDP, length 120
00:38:40.887405 IP 192.168.43.124.8880 > 192.168.43.146.7771: UDP, length 120
00:38:40.901360 IP 192.168.43.146.8880 > 192.168.43.147.7772: UDP, length 120
00:38:40.940202 IP 192.168.43.124.8880 > 192.168.43.146.7771: UDP, length 120
00:38:40.951376 IP 192.168.43.146.8880 > 192.168.43.147.7772: UDP, length 120
00:38:40.987980 IP 192.168.43.124.8880 > 192.168.43.146.7771: UDP, length 120
00:38:41.001372 IP 192.168.43.146.8880 > 192.168.43.147.7772: UDP, length 120
00:38:41.038857 IP 192.168.43.124.8880 > 192.168.43.146.7771: UDP, length 120
00:38:41.051360 IP 192.168.43.146.8880 > 192.168.43.147.7772: UDP, length 120
00:38:41.089331 IP 192.168.43.124.8880 > 192.168.43.146.7771: UDP, length 120
00:38:41.101337 IP 192.168.43.146.8880 > 192.168.43.147.7772: UDP, length 120
00:38:41.137829 IP 192.168.43.124.8880 > 192.168.43.146.7771: UDP, length 120
00:38:41.151305 IP 192.168.43.146.8880 > 192.168.43.147.7772: UDP, length 120
00:38:41.186912 IP 192.168.43.124.8880 > 192.168.43.146.7771: UDP, length 120
00:38:41.201302 IP 192.168.43.146.8880 > 192.168.43.147.7772: UDP, length 120
00:38:41.236810 IP 192.168.43.124.8880 > 192.168.43.146.7771: UDP, length 120
00:38:41.251295 IP 192.168.43.146.8880 > 192.168.43.147.7772: UDP, length 120
00:38:41.287096 IP 192.168.43.124.8880 > 192.168.43.146.7771: UDP, length 120
00:38:41.301288 IP 192.168.43.146.8880 > 192.168.43.147.7772: UDP, length 120
00:38:41.338227 IP 192.168.43.124.8880 > 192.168.43.146.7771: UDP, length 120
00:38:41.351290 IP 192.168.43.146.8880 > 192.168.43.147.7772: UDP, length 120
00:38:41.386872 IP 192.168.43.124.8880 > 192.168.43.146.7771: UDP, length 120
00:38:41.401288 IP 192.168.43.146.8880 > 192.168.43.147.7772: UDP, length 120
00:38:41.438784 IP 192.168.43.124.8880 > 192.168.43.146.7771: UDP, length 120
00:38:41.451288 IP 192.168.43.146.8880 > 192.168.43.147.7772: UDP, length 120
00:38:41.485161 IP 192.168.43.124.8880 > 192.168.43.146.7771: UDP, length 120
00:38:41.501287 IP 192.168.43.146.8880 > 192.168.43.147.7772: UDP, length 120
00:38:41.536873 IP 192.168.43.124.8880 > 192.168.43.146.7771: UDP, length 120
00:38:41.551290 IP 192.168.43.146.8880 > 192.168.43.147.7772: UDP, length 120
00:38:41.587124 IP 192.168.43.124.8880 > 192.168.43.146.7771: UDP, length 120
00:38:41.601289 IP 192.168.43.146.8880 > 192.168.43.147.7772: UDP, length 120
00:38:41.638023 IP 192.168.43.124.8880 > 192.168.43.146.7771: UDP, length 120
00:38:41.651289 IP 192.168.43.146.8880 > 192.168.43.147.7772: UDP, length 120
00:38:41.689084 IP 192.168.43.124.8880 > 192.168.43.146.7771: UDP, length 120
00:38:41.701292 IP 192.168.43.146.8880 > 192.168.43.147.7772: UDP, length 120
00:38:41.736913 IP 192.168.43.124.8880 > 192.168.43.146.7771: UDP, length 120
00:38:41.752840 IP 192.168.43.146.8880 > 192.168.43.147.7772: UDP, length 120
00:38:41.786380 IP 192.168.43.124.8880 > 192.168.43.146.7771: UDP, length 120
00:38:41.801331 IP 192.168.43.146.8880 > 192.168.43.147.7772: UDP, length 120
00:38:41.839761 IP 192.168.43.124.8880 > 192.168.43.146.7771: UDP, length 120
00:38:41.851300 IP 192.168.43.146.8880 > 192.168.43.147.7772: UDP, length 120
00:38:41.891750 IP 192.168.43.124.8880 > 192.168.43.146.7771: UDP, length 120
00:38:41.901290 IP 192.168.43.146.8880 > 192.168.43.147.7772: UDP, length 120
00:38:41.937014 IP 192.168.43.124.8880 > 192.168.43.146.7771: UDP, length 120
00:38:41.951288 IP 192.168.43.146.8880 > 192.168.43.147.7772: UDP, length 120
00:38:41.994198 IP 192.168.43.124.8880 > 192.168.43.146.7771: UDP, length 120
00:38:42.001287 IP 192.168.43.146.8880 > 192.168.43.147.7772: UDP, length 120
00:38:42.041546 IP 192.168.43.124.8880 > 192.168.43.146.7771: UDP, length 120
00:38:42.051288 IP 192.168.43.146.8880 > 192.168.43.147.7772: UDP, length 120
00:38:42.086892 IP 192.168.43.124.8880 > 192.168.43.146.7771: UDP, length 120
00:38:42.101289 IP 192.168.43.146.8880 > 192.168.43.147.7772: UDP, length 120
00:38:42.138566 IP 192.168.43.124.8880 > 192.168.43.146.7771: UDP, length 120
00:38:42.151292 IP 192.168.43.146.8880 > 192.168.43.147.7772: UDP, length 120
00:38:42.187345 IP 192.168.43.124.8880 > 192.168.43.146.7771: UDP, length 120
00:38:42.201288 IP 192.168.43.146.8880 > 192.168.43.147.7772: UDP, length 120
00:38:42.238844 IP 192.168.43.124.8880 > 192.168.43.146.7771: UDP, length 120
00:38:42.251296 IP 192.168.43.146.8880 > 192.168.43.147.7772: UDP, length 120
00:38:42.290500 IP 192.168.43.124.8880 > 192.168.43.146.7771: UDP, length 120
00:38:42.301288 IP 192.168.43.146.8880 > 192.168.43.147.7772: UDP, length 120
00:38:42.337007 IP 192.168.43.124.8880 > 192.168.43.146.7771: UDP, length 120
00:38:42.351288 IP 192.168.43.146.8880 > 192.168.43.147.7772: UDP, length 120
00:38:42.387465 IP 192.168.43.124.8880 > 192.168.43.146.7771: UDP, length 120
00:38:42.401287 IP 192.168.43.146.8880 > 192.168.43.147.7772: UDP, length 120
00:38:42.436999 IP 192.168.43.124.8880 > 192.168.43.146.7771: UDP, length 120
00:38:42.451287 IP 192.168.43.146.8880 > 192.168.43.147.7772: UDP, length 120
00:38:42.486629 IP 192.168.43.124.8880 > 192.168.43.146.7771: UDP, length 120
00:38:42.501288 IP 192.168.43.146.8880 > 192.168.43.147.7772: UDP, length 120
00:38:42.536150 IP 192.168.43.124.8880 > 192.168.43.146.7771: UDP, length 120
00:38:42.551288 IP 192.168.43.146.8880 > 192.168.43.147.7772: UDP, length 120
00:38:42.586073 IP 192.168.43.124.8880 > 192.168.43.146.7771: UDP, length 120
00:38:42.601287 IP 192.168.43.146.8880 > 192.168.43.147.7772: UDP, length 120
00:38:42.636493 IP 192.168.43.124.8880 > 192.168.43.146.7771: UDP, length 120
00:38:42.651312 IP 192.168.43.146.8880 > 192.168.43.147.7772: UDP, length 120
00:38:42.686892 IP 192.168.43.124.8880 > 192.168.43.146.7771: UDP, length 120
00:38:42.701341 IP 192.168.43.146.8880 > 192.168.43.147.7772: UDP, length 120
00:38:42.736565 IP 192.168.43.124.8880 > 192.168.43.146.7771: UDP, length 120
00:38:42.751319 IP 192.168.43.146.8880 > 192.168.43.147.7772: UDP, length 120
00:38:42.787061 IP 192.168.43.124.8880 > 192.168.43.146.7771: UDP, length 120
00:38:42.801387 IP 192.168.43.146.8880 > 192.168.43.147.7772: UDP, length 120
00:38:42.836720 IP 192.168.43.124.8880 > 192.168.43.146.7771: UDP, length 120
00:38:42.851343 IP 192.168.43.146.8880 > 192.168.43.147.7772: UDP, length 120
00:38:42.887113 IP 192.168.43.124.8880 > 192.168.43.146.7771: UDP, length 120
00:38:42.901316 IP 192.168.43.146.8880 > 192.168.43.147.7772: UDP, length 120
00:38:42.951308 IP 192.168.43.146.8880 > 192.168.43.147.7772: UDP, length 120
00:38:42.952867 IP 192.168.43.124.8880 > 192.168.43.146.7771: UDP, length 120
00:38:42.987802 IP 192.168.43.124.8880 > 192.168.43.146.7771: UDP, length 120
00:38:43.001313 IP 192.168.43.146.8880 > 192.168.43.147.7772: UDP, length 120
00:38:43.037014 IP 192.168.43.124.8880 > 192.168.43.146.7771: UDP, length 120
00:38:43.051313 IP 192.168.43.146.8880 > 192.168.43.147.7772: UDP, length 120
00:38:43.087250 IP 192.168.43.124.8880 > 192.168.43.146.7771: UDP, length 120
00:38:43.101313 IP 192.168.43.146.8880 > 192.168.43.147.7772: UDP, length 120
00:38:43.138408 IP 192.168.43.124.8880 > 192.168.43.146.7771: UDP, length 120
00:38:43.151316 IP 192.168.43.146.8880 > 192.168.43.147.7772: UDP, length 120
00:38:43.187326 IP 192.168.43.124.8880 > 192.168.43.146.7771: UDP, length 120
00:38:43.201312 IP 192.168.43.146.8880 > 192.168.43.147.7772: UDP, length 120
00:38:43.238697 IP 192.168.43.124.8880 > 192.168.43.146.7771: UDP, length 120
00:38:43.251316 IP 192.168.43.146.8880 > 192.168.43.147.7772: UDP, length 120
00:38:43.287283 IP 192.168.43.124.8880 > 192.168.43.146.7771: UDP, length 120
00:38:43.301364 IP 192.168.43.146.8880 > 192.168.43.147.7772: UDP, length 120
00:38:43.337076 IP 192.168.43.124.8880 > 192.168.43.146.7771: UDP, length 120
00:38:43.351330 IP 192.168.43.146.8880 > 192.168.43.147.7772: UDP, length 120
00:38:43.387115 IP 192.168.43.124.8880 > 192.168.43.146.7771: UDP, length 120
00:38:43.401318 IP 192.168.43.146.8880 > 192.168.43.147.7772: UDP, length 120
00:38:43.437069 IP 192.168.43.124.8880 > 192.168.43.146.7771: UDP, length 120
00:38:43.451315 IP 192.168.43.146.8880 > 192.168.43.147.7772: UDP, length 120
00:38:43.487097 IP 192.168.43.124.8880 > 192.168.43.146.7771: UDP, length 120
00:38:43.501314 IP 192.168.43.146.8880 > 192.168.43.147.7772: UDP, length 120
00:38:43.535289 IP 192.168.43.124.8880 > 192.168.43.146.7771: UDP, length 120
00:38:43.551321 IP 192.168.43.146.8880 > 192.168.43.147.7772: UDP, length 120
00:38:43.587075 IP 192.168.43.124.8880 > 192.168.43.146.7771: UDP, length 120
00:38:43.601314 IP 192.168.43.146.8880 > 192.168.43.147.7772: UDP, length 120
00:38:43.637066 IP 192.168.43.124.8880 > 192.168.43.146.7771: UDP, length 120
00:38:43.651318 IP 192.168.43.146.8880 > 192.168.43.147.7772: UDP, length 120
00:38:43.687367 IP 192.168.43.124.8880 > 192.168.43.146.7771: UDP, length 120
00:38:43.701323 IP 192.168.43.146.8880 > 192.168.43.147.7772: UDP, length 120
00:38:43.737840 IP 192.168.43.124.8880 > 192.168.43.146.7771: UDP, length 120
00:38:43.751314 IP 192.168.43.146.8880 > 192.168.43.147.7772: UDP, length 120
00:38:43.795977 IP 192.168.43.124.8880 > 192.168.43.146.7771: UDP, length 120
00:38:43.801418 IP 192.168.43.146.8880 > 192.168.43.147.7772: UDP, length 120
00:38:43.839744 IP 192.168.43.124.8880 > 192.168.43.146.7771: UDP, length 120
00:38:43.851369 IP 192.168.43.146.8880 > 192.168.43.147.7772: UDP, length 120
00:38:43.888191 IP 192.168.43.124.8880 > 192.168.43.146.7771: UDP, length 120
00:38:43.901321 IP 192.168.43.146.8880 > 192.168.43.147.7772: UDP, length 120
00:38:43.936593 IP 192.168.43.124.8880 > 192.168.43.146.7771: UDP, length 120
00:38:43.951319 IP 192.168.43.146.8880 > 192.168.43.147.7772: UDP, length 120
00:38:43.989426 IP 192.168.43.124.8880 > 192.168.43.146.7771: UDP, length 120
00:38:44.001315 IP 192.168.43.146.8880 > 192.168.43.147.7772: UDP, length 120
00:38:44.037389 IP 192.168.43.124.8880 > 192.168.43.146.7771: UDP, length 120
00:38:44.051316 IP 192.168.43.146.8880 > 192.168.43.147.7772: UDP, length 120
00:38:44.092596 IP 192.168.43.124.8880 > 192.168.43.146.7771: UDP, length 120
00:38:44.101312 IP 192.168.43.146.8880 > 192.168.43.147.7772: UDP, length 120
00:38:44.138981 IP 192.168.43.124.8880 > 192.168.43.146.7771: UDP, length 120
00:38:44.151341 IP 192.168.43.146.8880 > 192.168.43.147.7772: UDP, length 120
00:38:44.187076 IP 192.168.43.124.8880 > 192.168.43.146.7771: UDP, length 120
00:38:44.201319 IP 192.168.43.146.8880 > 192.168.43.147.7772: UDP, length 120
00:38:44.237431 IP 192.168.43.124.8880 > 192.168.43.146.7771: UDP, length 120
00:38:44.251317 IP 192.168.43.146.8880 > 192.168.43.147.7772: UDP, length 120
00:38:44.289058 IP 192.168.43.124.8880 > 192.168.43.146.7771: UDP, length 120
00:38:44.301313 IP 192.168.43.146.8880 > 192.168.43.147.7772: UDP, length 120
00:38:44.337188 IP 192.168.43.124.8880 > 192.168.43.146.7771: UDP, length 120
00:38:44.351318 IP 192.168.43.146.8880 > 192.168.43.147.7772: UDP, length 120
00:38:44.387174 IP 192.168.43.124.8880 > 192.168.43.146.7771: UDP, length 120
00:38:44.401321 IP 192.168.43.146.8880 > 192.168.43.147.7772: UDP, length 120
00:38:44.438031 IP 192.168.43.124.8880 > 192.168.43.146.7771: UDP, length 120
00:38:44.451318 IP 192.168.43.146.8880 > 192.168.43.147.7772: UDP, length 120
00:38:44.487878 IP 192.168.43.124.8880 > 192.168.43.146.7771: UDP, length 120
00:38:44.501313 IP 192.168.43.146.8880 > 192.168.43.147.7772: UDP, length 120
00:38:44.537054 IP 192.168.43.124.8880 > 192.168.43.146.7771: UDP, length 120
00:38:44.551315 IP 192.168.43.146.8880 > 192.168.43.147.7772: UDP, length 120
00:38:44.587223 IP 192.168.43.124.8880 > 192.168.43.146.7771: UDP, length 120
00:38:44.601313 IP 192.168.43.146.8880 > 192.168.43.147.7772: UDP, length 120
00:38:44.637074 IP 192.168.43.124.8880 > 192.168.43.146.7771: UDP, length 120
00:38:44.651316 IP 192.168.43.146.8880 > 192.168.43.147.7772: UDP, length 120
00:38:44.687088 IP 192.168.43.124.8880 > 192.168.43.146.7771: UDP, length 120
00:38:44.701316 IP 192.168.43.146.8880 > 192.168.43.147.7772: UDP, length 120
00:38:44.737142 IP 192.168.43.124.8880 > 192.168.43.146.7771: UDP, length 120
00:38:44.751317 IP 192.168.43.146.8880 > 192.168.43.147.7772: UDP, length 120
00:38:44.787262 IP 192.168.43.124.8880 > 192.168.43.146.7771: UDP, length 120
00:38:44.801363 IP 192.168.43.146.8880 > 192.168.43.147.7772: UDP, length 120
00:38:44.837131 IP 192.168.43.124.8880 > 192.168.43.146.7771: UDP, length 120
00:38:44.851316 IP 192.168.43.146.8880 > 192.168.43.147.7772: UDP, length 120
00:38:44.887103 IP 192.168.43.124.8880 > 192.168.43.146.7771: UDP, length 120
00:38:44.901383 IP 192.168.43.146.8880 > 192.168.43.147.7772: UDP, length 120
00:38:44.937113 IP 192.168.43.124.8880 > 192.168.43.146.7771: UDP, length 120
00:38:44.951313 IP 192.168.43.146.8880 > 192.168.43.147.7772: UDP, length 120
00:38:45.001313 IP 192.168.43.146.8880 > 192.168.43.147.7772: UDP, length 120
00:38:45.051314 IP 192.168.43.146.8880 > 192.168.43.147.7772: UDP, length 120
00:38:45.101312 IP 192.168.43.146.8880 > 192.168.43.147.7772: UDP, length 120
00:38:45.108627 IP 192.168.43.124.8880 > 192.168.43.146.7771: UDP, length 120
00:38:45.109441 IP 192.168.43.124.8880 > 192.168.43.146.7771: UDP, length 120
00:38:45.111953 IP 192.168.43.124.8880 > 192.168.43.146.7771: UDP, length 120
00:38:45.137219 IP 192.168.43.124.8880 > 192.168.43.146.7771: UDP, length 120
00:38:45.151325 IP 192.168.43.146.8880 > 192.168.43.147.7772: UDP, length 120
00:38:45.187128 IP 192.168.43.124.8880 > 192.168.43.146.7771: UDP, length 120
00:38:45.201315 IP 192.168.43.146.8880 > 192.168.43.147.7772: UDP, length 120
00:38:45.238255 IP 192.168.43.124.8880 > 192.168.43.146.7771: UDP, length 120
00:38:45.251311 IP 192.168.43.146.8880 > 192.168.43.147.7772: UDP, length 120
00:38:45.288075 IP 192.168.43.124.8880 > 192.168.43.146.7771: UDP, length 120
00:38:45.301309 IP 192.168.43.146.8880 > 192.168.43.147.7772: UDP, length 120
00:38:45.351313 IP 192.168.43.146.8880 > 192.168.43.147.7772: UDP, length 120
00:38:45.401313 IP 192.168.43.146.8880 > 192.168.43.147.7772: UDP, length 120
00:38:45.451314 IP 192.168.43.146.8880 > 192.168.43.147.7772: UDP, length 120
00:38:45.459849 IP 192.168.43.124.8880 > 192.168.43.146.7771: UDP, length 120
00:38:45.460072 IP 192.168.43.124.8880 > 192.168.43.146.7771: UDP, length 120
00:38:45.460183 IP 192.168.43.124.8880 > 192.168.43.146.7771: UDP, length 120
00:38:45.485583 IP 192.168.43.124.8880 > 192.168.43.146.7771: UDP, length 120
00:38:45.501314 IP 192.168.43.146.8880 > 192.168.43.147.7772: UDP, length 120
00:38:45.535322 IP 192.168.43.124.8880 > 192.168.43.146.7771: UDP, length 120
00:38:45.551314 IP 192.168.43.146.8880 > 192.168.43.147.7772: UDP, length 120
00:38:45.585683 IP 192.168.43.124.8880 > 192.168.43.146.7771: UDP, length 120
00:38:45.601309 IP 192.168.43.146.8880 > 192.168.43.147.7772: UDP, length 120
00:38:45.635358 IP 192.168.43.124.8880 > 192.168.43.146.7771: UDP, length 120
00:38:45.651313 IP 192.168.43.146.8880 > 192.168.43.147.7772: UDP, length 120
00:38:45.701316 IP 192.168.43.146.8880 > 192.168.43.147.7772: UDP, length 120
00:38:45.751314 IP 192.168.43.146.8880 > 192.168.43.147.7772: UDP, length 120
00:38:45.801307 IP 192.168.43.146.8880 > 192.168.43.147.7772: UDP, length 120
00:38:45.806016 IP 192.168.43.124.8880 > 192.168.43.146.7771: UDP, length 120
00:38:45.806240 IP 192.168.43.124.8880 > 192.168.43.146.7771: UDP, length 120
00:38:45.806360 IP 192.168.43.124.8880 > 192.168.43.146.7771: UDP, length 120
00:38:45.837391 IP 192.168.43.124.8880 > 192.168.43.146.7771: UDP, length 120
00:38:45.851393 IP 192.168.43.146.8880 > 192.168.43.147.7772: UDP, length 120
00:38:45.888076 IP 192.168.43.124.8880 > 192.168.43.146.7771: UDP, length 120
00:38:45.901390 IP 192.168.43.146.8880 > 192.168.43.147.7772: UDP, length 120
00:38:45.937368 IP 192.168.43.124.8880 > 192.168.43.146.7771: UDP, length 120
00:38:45.951405 IP 192.168.43.146.8880 > 192.168.43.147.7772: UDP, length 120
00:38:45.988026 IP 192.168.43.124.8880 > 192.168.43.146.7771: UDP, length 120
00:38:46.001379 IP 192.168.43.146.8880 > 192.168.43.147.7772: UDP, length 120
00:38:46.051318 IP 192.168.43.146.8880 > 192.168.43.147.7772: UDP, length 120
00:38:46.101378 IP 192.168.43.146.8880 > 192.168.43.147.7772: UDP, length 120
00:38:46.151388 IP 192.168.43.146.8880 > 192.168.43.147.7772: UDP, length 120
00:38:46.155046 IP 192.168.43.124.8880 > 192.168.43.146.7771: UDP, length 120
00:38:46.155276 IP 192.168.43.124.8880 > 192.168.43.146.7771: UDP, length 120
00:38:46.155435 IP 192.168.43.124.8880 > 192.168.43.146.7771: UDP, length 120
00:38:46.188153 IP 192.168.43.124.8880 > 192.168.43.146.7771: UDP, length 120
00:38:46.201411 IP 192.168.43.146.8880 > 192.168.43.147.7772: UDP, length 120
00:38:46.239994 IP 192.168.43.124.8880 > 192.168.43.146.7771: UDP, length 120
00:38:46.251396 IP 192.168.43.146.8880 > 192.168.43.147.7772: UDP, length 120
00:38:46.290228 IP 192.168.43.124.8880 > 192.168.43.146.7771: UDP, length 120
00:38:46.301370 IP 192.168.43.146.8880 > 192.168.43.147.7772: UDP, length 120
00:38:46.337326 IP 192.168.43.124.8880 > 192.168.43.146.7771: UDP, length 120
00:38:46.351383 IP 192.168.43.146.8880 > 192.168.43.147.7772: UDP, length 120
00:38:46.401352 IP 192.168.43.146.8880 > 192.168.43.147.7772: UDP, length 120
00:38:46.451353 IP 192.168.43.146.8880 > 192.168.43.147.7772: UDP, length 120
00:38:46.501371 IP 192.168.43.146.8880 > 192.168.43.147.7772: UDP, length 120
00:38:46.504313 IP 192.168.43.124.8880 > 192.168.43.146.7771: UDP, length 120
00:38:46.504568 IP 192.168.43.124.8880 > 192.168.43.146.7771: UDP, length 120
00:38:46.504729 IP 192.168.43.124.8880 > 192.168.43.146.7771: UDP, length 120
00:38:46.537252 IP 192.168.43.124.8880 > 192.168.43.146.7771: UDP, length 120
00:38:46.551359 IP 192.168.43.146.8880 > 192.168.43.147.7772: UDP, length 120
00:38:46.587099 IP 192.168.43.124.8880 > 192.168.43.146.7771: UDP, length 120
00:38:46.601312 IP 192.168.43.146.8880 > 192.168.43.147.7772: UDP, length 120
00:38:46.637093 IP 192.168.43.124.8880 > 192.168.43.146.7771: UDP, length 120
00:38:46.651297 IP 192.168.43.146.8880 > 192.168.43.147.7772: UDP, length 120
00:38:46.687099 IP 192.168.43.124.8880 > 192.168.43.146.7771: UDP, length 120
00:38:46.701296 IP 192.168.43.146.8880 > 192.168.43.147.7772: UDP, length 120
00:38:46.751289 IP 192.168.43.146.8880 > 192.168.43.147.7772: UDP, length 120
00:38:46.801286 IP 192.168.43.146.8880 > 192.168.43.147.7772: UDP, length 120
00:38:46.851287 IP 192.168.43.146.8880 > 192.168.43.147.7772: UDP, length 120
00:38:46.852495 IP 192.168.43.124.8880 > 192.168.43.146.7771: UDP, length 120
00:38:46.852655 IP 192.168.43.124.8880 > 192.168.43.146.7771: UDP, length 120
00:38:46.852779 IP 192.168.43.124.8880 > 192.168.43.146.7771: UDP, length 120
00:38:46.887099 IP 192.168.43.124.8880 > 192.168.43.146.7771: UDP, length 120
00:38:46.901291 IP 192.168.43.146.8880 > 192.168.43.147.7772: UDP, length 120
00:38:46.937080 IP 192.168.43.124.8880 > 192.168.43.146.7771: UDP, length 120
00:38:46.951288 IP 192.168.43.146.8880 > 192.168.43.147.7772: UDP, length 120
00:38:46.986983 IP 192.168.43.124.8880 > 192.168.43.146.7771: UDP, length 120
00:38:47.001368 IP 192.168.43.146.8880 > 192.168.43.147.7772: UDP, length 120
00:38:47.037099 IP 192.168.43.124.8880 > 192.168.43.146.7771: UDP, length 120
00:38:47.051327 IP 192.168.43.146.8880 > 192.168.43.147.7772: UDP, length 120
00:38:47.101291 IP 192.168.43.146.8880 > 192.168.43.147.7772: UDP, length 120
00:38:47.151295 IP 192.168.43.146.8880 > 192.168.43.147.7772: UDP, length 120
00:38:47.201290 IP 192.168.43.146.8880 > 192.168.43.147.7772: UDP, length 120
00:38:47.204562 IP 192.168.43.124.8880 > 192.168.43.146.7771: UDP, length 120
