00:02:05.433046 IP 192.168.43.146.8880 > 192.168.43.147.7772: UDP, length 120
00:02:05.483099 IP 192.168.43.146.8880 > 192.168.43.147.7772: UDP, length 120
00:02:05.533087 IP 192.168.43.146.8880 > 192.168.43.147.7772: UDP, length 120
00:02:05.583080 IP 192.168.43.146.8880 > 192.168.43.147.7772: UDP, length 120
00:02:05.633085 IP 192.168.43.146.8880 > 192.168.43.147.7772: UDP, length 120
00:02:05.683080 IP 192.168.43.146.8880 > 192.168.43.147.7772: UDP, length 120
00:02:05.733080 IP 192.168.43.146.8880 > 192.168.43.147.7772: UDP, length 120
00:02:05.783079 IP 192.168.43.146.8880 > 192.168.43.147.7772: UDP, length 120
00:02:05.833084 IP 192.168.43.146.8880 > 192.168.43.147.7772: UDP, length 120
00:02:05.883080 IP 192.168.43.146.8880 > 192.168.43.147.7772: UDP, length 120
00:02:05.933135 IP 192.168.43.146.8880 > 192.168.43.147.7772: UDP, length 120
00:02:05.983095 IP 192.168.43.146.8880 > 192.168.43.147.7772: UDP, length 120
00:02:06.033086 IP 192.168.43.146.8880 > 192.168.43.147.7772: UDP, length 120
00:02:06.083082 IP 192.168.43.146.8880 > 192.168.43.147.7772: UDP, length 120
00:02:06.133082 IP 192.168.43.146.8880 > 192.168.43.147.7772: UDP, length 120
00:02:06.183079 IP 192.168.43.146.8880 > 192.168.43.147.7772: UDP, length 120
00:02:06.233080 IP 192.168.43.146.8880 > 192.168.43.147.7772: UDP, length 120
00:02:06.283081 IP 192.168.43.146.8880 > 192.168.43.147.7772: UDP, length 120
00:02:06.333089 IP 192.168.43.146.8880 > 192.168.43.147.7772: UDP, length 120
00:02:06.383085 IP 192.168.43.146.8880 > 192.168.43.147.7772: UDP, length 120
00:02:06.433113 IP 192.168.43.146.8880 > 192.168.43.147.7772: UDP, length 120
00:02:06.483085 IP 192.168.43.146.8880 > 192.168.43.147.7772: UDP, length 120
00:02:06.533082 IP 192.168.43.146.8880 > 192.168.43.147.7772: UDP, length 120
00:02:06.583078 IP 192.168.43.146.8880 > 192.168.43.147.7772: UDP, length 120
00:02:06.633106 IP 192.168.43.146.8880 > 192.168.43.147.7772: UDP, length 120
00:02:06.683088 IP 192.168.43.146.8880 > 192.168.43.147.7772: UDP, length 120
00:02:06.733081 IP 192.168.43.146.8880 > 192.168.43.147.7772: UDP, length 120
00:02:06.783080 IP 192.168.43.146.8880 > 192.168.43.147.7772: UDP, length 120
00:02:06.833082 IP 192.168.43.146.8880 > 192.168.43.147.7772: UDP, length 120
00:02:06.883080 IP 192.168.43.146.8880 > 192.168.43.147.7772: UDP, length 120
00:02:06.933146 IP 192.168.43.146.8880 > 192.168.43.147.7772: UDP, length 120
00:02:06.983086 IP 192.168.43.146.8880 > 192.168.43.147.7772: UDP, length 120
00:02:07.033084 IP 192.168.43.146.8880 > 192.168.43.147.7772: UDP, length 120
00:02:07.083079 IP 192.168.43.146.8880 > 192.168.43.147.7772: UDP, length 120
00:02:07.133082 IP 192.168.43.146.8880 > 192.168.43.147.7772: UDP, length 120
00:02:07.183080 IP 192.168.43.146.8880 > 192.168.43.147.7772: UDP, length 120
00:02:07.233083 IP 192.168.43.146.8880 > 192.168.43.147.7772: UDP, length 120
00:02:07.283081 IP 192.168.43.146.8880 > 192.168.43.147.7772: UDP, length 120
00:02:07.333083 IP 192.168.43.146.8880 > 192.168.43.147.7772: UDP, length 120
00:02:07.383152 IP 192.168.43.146.8880 > 192.168.43.147.7772: UDP, length 120
00:02:07.433189 IP 192.168.43.146.8880 > 192.168.43.147.7772: UDP, length 120
00:02:07.483141 IP 192.168.43.146.8880 > 192.168.43.147.7772: UDP, length 120
00:02:07.533144 IP 192.168.43.146.8880 > 192.168.43.147.7772: UDP, length 120
00:02:07.583138 IP 192.168.43.146.8880 > 192.168.43.147.7772: UDP, length 120
00:02:07.633181 IP 192.168.43.146.8880 > 192.168.43.147.7772: UDP, length 120
00:02:07.683122 IP 192.168.43.146.8880 > 192.168.43.147.7772: UDP, length 120
00:02:07.733182 IP 192.168.43.146.8880 > 192.168.43.147.7772: UDP, length 120
00:02:07.783110 IP 192.168.43.146.8880 > 192.168.43.147.7772: UDP, length 120
00:02:07.833065 IP 192.168.43.146.8880 > 192.168.43.147.7772: UDP, length 120
00:02:07.883058 IP 192.168.43.146.8880 > 192.168.43.147.7772: UDP, length 120
00:02:07.933103 IP 192.168.43.146.8880 > 192.168.43.147.7772: UDP, length 120
00:02:07.983062 IP 192.168.43.146.8880 > 192.168.43.147.7772: UDP, length 120
00:02:08.033058 IP 192.168.43.146.8880 > 192.168.43.147.7772: UDP, length 120
00:02:08.083056 IP 192.168.43.146.8880 > 192.168.43.147.7772: UDP, length 120
00:02:08.133056 IP 192.168.43.146.8880 > 192.168.43.147.7772: UDP, length 120
00:02:08.183054 IP 192.168.43.146.8880 > 192.168.43.147.7772: UDP, length 120
00:02:08.233055 IP 192.168.43.146.8880 > 192.168.43.147.7772: UDP, length 120
00:02:08.283055 IP 192.168.43.146.8880 > 192.168.43.147.7772: UDP, length 120
00:02:08.333055 IP 192.168.43.146.8880 > 192.168.43.147.7772: UDP, length 120
00:02:08.383054 IP 192.168.43.146.8880 > 192.168.43.147.7772: UDP, length 120
00:02:08.433080 IP 192.168.43.146.8880 > 192.168.43.147.7772: UDP, length 120
00:02:08.483060 IP 192.168.43.146.8880 > 192.168.43.147.7772: UDP, length 120
00:02:08.533056 IP 192.168.43.146.8880 > 192.168.43.147.7772: UDP, length 120
00:02:08.583058 IP 192.168.43.146.8880 > 192.168.43.147.7772: UDP, length 120
00:02:08.633068 IP 192.168.43.146.8880 > 192.168.43.147.7772: UDP, length 120
00:02:08.683055 IP 192.168.43.146.8880 > 192.168.43.147.7772: UDP, length 120
00:02:08.733055 IP 192.168.43.146.8880 > 192.168.43.147.7772: UDP, length 120
00:02:08.783055 IP 192.168.43.146.8880 > 192.168.43.147.7772: UDP, length 120
00:02:08.833054 IP 192.168.43.146.8880 > 192.168.43.147.7772: UDP, length 120
00:02:08.883056 IP 192.168.43.146.8880 > 192.168.43.147.7772: UDP, length 120
00:02:08.933064 IP 192.168.43.146.8880 > 192.168.43.147.7772: UDP, length 120
00:02:08.983086 IP 192.168.43.146.8880 > 192.168.43.147.7772: UDP, length 120
00:02:09.033057 IP 192.168.43.146.8880 > 192.168.43.147.7772: UDP, length 120
00:02:09.083056 IP 192.168.43.146.8880 > 192.168.43.147.7772: UDP, length 120
00:02:09.133055 IP 192.168.43.146.8880 > 192.168.43.147.7772: UDP, length 120
00:02:09.183055 IP 192.168.43.146.8880 > 192.168.43.147.7772: UDP, length 120
00:02:09.233056 IP 192.168.43.146.8880 > 192.168.43.147.7772: UDP, length 120
00:02:09.283055 IP 192.168.43.146.8880 > 192.168.43.147.7772: UDP, length 120
00:02:09.333056 IP 192.168.43.146.8880 > 192.168.43.147.7772: UDP, length 120
00:02:09.383055 IP 192.168.43.146.8880 > 192.168.43.147.7772: UDP, length 120
00:02:09.433085 IP 192.168.43.146.8880 > 192.168.43.147.7772: UDP, length 120
00:02:09.483062 IP 192.168.43.146.8880 > 192.168.43.147.7772: UDP, length 120
00:02:09.533060 IP 192.168.43.146.8880 > 192.168.43.147.7772: UDP, length 120
00:02:09.583059 IP 192.168.43.146.8880 > 192.168.43.147.7772: UDP, length 120
00:02:09.633055 IP 192.168.43.146.8880 > 192.168.43.147.7772: UDP, length 120
00:02:09.683055 IP 192.168.43.146.8880 > 192.168.43.147.7772: UDP, length 120
00:02:09.733054 IP 192.168.43.146.8880 > 192.168.43.147.7772: UDP, length 120
00:02:09.783055 IP 192.168.43.146.8880 > 192.168.43.147.7772: UDP, length 120
00:02:09.833055 IP 192.168.43.146.8880 > 192.168.43.147.7772: UDP, length 120
00:02:09.883055 IP 192.168.43.146.8880 > 192.168.43.147.7772: UDP, length 120
00:02:09.933139 IP 192.168.43.146.8880 > 192.168.43.147.7772: UDP, length 120
00:02:09.983127 IP 192.168.43.146.8880 > 192.168.43.147.7772: UDP, length 120
00:02:10.021608 IP 192.168.43.124.8880 > 192.168.43.146.7771: UDP, length 120
00:02:10.021984 IP 192.168.43.124.8880 > 192.168.43.146.7771: UDP, length 120
00:02:10.022112 IP 192.168.43.124.8880 > 192.168.43.146.7771: UDP, length 120
00:02:10.033098 IP 192.168.43.146.8880 > 192.168.43.147.7772: UDP, length 120
00:02:10.083076 IP 192.168.43.146.8880 > 192.168.43.147.7772: UDP, length 120
00:02:10.117695 IP 192.168.43.124.8880 > 192.168.43.146.7771: UDP, length 120
00:02:10.117981 IP 192.168.43.124.8880 > 192.168.43.146.7771: UDP, length 120
00:02:10.133084 IP 192.168.43.146.8880 > 192.168.43.147.7772: UDP, length 120
00:02:10.167304 IP 192.168.43.124.8880 > 192.168.43.146.7771: UDP, length 120
00:02:10.183077 IP 192.168.43.146.8880 > 192.168.43.147.7772: UDP, length 120
00:02:10.218252 IP 192.168.43.124.8880 > 192.168.43.146.7771: UDP, length 120
00:02:10.233062 IP 192.168.43.146.8880 > 192.168.43.147.7772: UDP, length 120
00:02:10.269832 IP 192.168.43.124.8880 > 192.168.43.146.7771: UDP, length 120
00:02:10.283065 IP 192.168.43.146.8880 > 192.168.43.147.7772: UDP, length 120
00:02:10.325341 IP 192.168.43.124.8880 > 192.168.43.146.7771: UDP, length 120
00:02:10.333060 IP 192.168.43.146.8880 > 192.168.43.147.7772: UDP, length 120
00:02:10.367674 IP 192.168.43.124.8880 > 192.168.43.146.7771: UDP, length 120
00:02:10.383058 IP 192.168.43.146.8880 > 192.168.43.147.7772: UDP, length 120
00:02:10.415545 IP 192.168.43.124.8880 > 192.168.43.146.7771: UDP, length 120
00:02:10.433078 IP 192.168.43.146.8880 > 192.168.43.147.7772: UDP, length 120
00:02:10.473354 IP 192.168.43.124.8880 > 192.168.43.146.7771: UDP, length 120
00:02:10.483089 IP 192.168.43.146.8880 > 192.168.43.147.7772: UDP, length 120
00:02:10.522975 IP 192.168.43.124.8880 > 192.168.43.146.7771: UDP, length 120
00:02:10.533083 IP 192.168.43.146.8880 > 192.168.43.147.7772: UDP, length 120
00:02:10.564932 IP 192.168.43.124.8880 > 192.168.43.146.7771: UDP, length 120
00:02:10.583080 IP 192.168.43.146.8880 > 192.168.43.147.7772: UDP, length 120
00:02:10.620295 IP 192.168.43.124.8880 > 192.168.43.146.7771: UDP, length 120
00:02:10.633061 IP 192.168.43.146.8880 > 192.168.43.147.7772: UDP, length 120
00:02:10.683056 IP 192.168.43.146.8880 > 192.168.43.147.7772: UDP, length 120
00:02:10.686294 IP 192.168.43.124.8880 > 192.168.43.146.7771: UDP, length 120
00:02:10.721813 IP 192.168.43.124.8880 > 192.168.43.146.7771: UDP, length 120
00:02:10.733057 IP 192.168.43.146.8880 > 192.168.43.147.7772: UDP, length 120
00:02:10.768950 IP 192.168.43.124.8880 > 192.168.43.146.7771: UDP, length 120
00:02:10.783059 IP 192.168.43.146.8880 > 192.168.43.147.7772: UDP, length 120
00:02:10.817950 IP 192.168.43.124.8880 > 192.168.43.146.7771: UDP, length 120
00:02:10.833057 IP 192.168.43.146.8880 > 192.168.43.147.7772: UDP, length 120
00:02:10.867945 IP 192.168.43.124.8880 > 192.168.43.146.7771: UDP, length 120
00:02:10.883057 IP 192.168.43.146.8880 > 192.168.43.147.7772: UDP, length 120
00:02:10.927811 IP 192.168.43.124.8880 > 192.168.43.146.7771: UDP, length 120
00:02:10.933059 IP 192.168.43.146.8880 > 192.168.43.147.7772: UDP, length 120
00:02:10.968185 IP 192.168.43.124.8880 > 192.168.43.146.7771: UDP, length 120
00:02:10.983056 IP 192.168.43.146.8880 > 192.168.43.147.7772: UDP, length 120
00:02:11.017405 IP 192.168.43.124.8880 > 192.168.43.146.7771: UDP, length 120
00:02:11.033133 IP 192.168.43.146.8880 > 192.168.43.147.7772: UDP, length 120
00:02:11.078223 IP 192.168.43.124.8880 > 192.168.43.146.7771: UDP, length 120
00:02:11.083100 IP 192.168.43.146.8880 > 192.168.43.147.7772: UDP, length 120
00:02:11.119819 IP 192.168.43.124.8880 > 192.168.43.146.7771: UDP, length 120
00:02:11.133074 IP 192.168.43.146.8880 > 192.168.43.147.7772: UDP, length 120
00:02:11.165258 IP 192.168.43.124.8880 > 192.168.43.146.7771: UDP, length 120
00:02:11.183068 IP 192.168.43.146.8880 > 192.168.43.147.7772: UDP, length 120
00:02:11.218540 IP 192.168.43.124.8880 > 192.168.43.146.7771: UDP, length 120
00:02:11.233058 IP 192.168.43.146.8880 > 192.168.43.147.7772: UDP, length 120
00:02:11.268044 IP 192.168.43.124.8880 > 192.168.43.146.7771: UDP, length 120
00:02:11.283057 IP 192.168.43.146.8880 > 192.168.43.147.7772: UDP, length 120
00:02:11.333055 IP 192.168.43.146.8880 > 192.168.43.147.7772: UDP, length 120
00:02:11.336301 IP 192.168.43.124.8880 > 192.168.43.146.7771: UDP, length 120
00:02:11.368212 IP 192.168.43.124.8880 > 192.168.43.146.7771: UDP, length 120
00:02:11.383057 IP 192.168.43.146.8880 > 192.168.43.147.7772: UDP, length 120
00:02:11.415335 IP 192.168.43.124.8880 > 192.168.43.146.7771: UDP, length 120
00:02:11.433072 IP 192.168.43.146.8880 > 192.168.43.147.7772: UDP, length 120
00:02:11.478587 IP 192.168.43.124.8880 > 192.168.43.146.7771: UDP, length 120
00:02:11.483060 IP 192.168.43.146.8880 > 192.168.43.147.7772: UDP, length 120
00:02:11.519172 IP 192.168.43.124.8880 > 192.168.43.146.7771: UDP, length 120
00:02:11.533056 IP 192.168.43.146.8880 > 192.168.43.147.7772: UDP, length 120
00:02:11.578755 IP 192.168.43.124.8880 > 192.168.43.146.7771: UDP, length 120
00:02:11.583064 IP 192.168.43.146.8880 > 192.168.43.147.7772: UDP, length 120
00:02:11.618549 IP 192.168.43.124.8880 > 192.168.43.146.7771: UDP, length 120
00:02:11.633083 IP 192.168.43.146.8880 > 192.168.43.147.7772: UDP, length 120
00:02:11.670495 IP 192.168.43.124.8880 > 192.168.43.146.7771: UDP, length 120
00:02:11.683070 IP 192.168.43.146.8880 > 192.168.43.147.7772: UDP, length 120
00:02:11.720031 IP 192.168.43.124.8880 > 192.168.43.146.7771: UDP, length 120
00:02:11.733058 IP 192.168.43.146.8880 > 192.168.43.147.7772: UDP, length 120
00:02:11.771742 IP 192.168.43.124.8880 > 192.168.43.146.7771: UDP, length 120
00:02:11.783056 IP 192.168.43.146.8880 > 192.168.43.147.7772: UDP, length 120
00:02:11.817804 IP 192.168.43.124.8880 > 192.168.43.146.7771: UDP, length 120
00:02:11.833069 IP 192.168.43.146.8880 > 192.168.43.147.7772: UDP, length 120
00:02:11.871071 IP 192.168.43.124.8880 > 192.168.43.146.7771: UDP, length 120
00:02:11.883081 IP 192.168.43.146.8880 > 192.168.43.147.7772: UDP, length 120
00:02:11.920239 IP 192.168.43.124.8880 > 192.168.43.146.7771: UDP, length 120
00:02:11.933075 IP 192.168.43.146.8880 > 192.168.43.147.7772: UDP, length 120
00:02:11.974370 IP 192.168.43.124.8880 > 192.168.43.146.7771: UDP, length 120
00:02:11.983088 IP 192.168.43.146.8880 > 192.168.43.147.7772: UDP, length 120
00:02:12.020240 IP 192.168.43.124.8880 > 192.168.43.146.7771: UDP, length 120
00:02:12.033059 IP 192.168.43.146.8880 > 192.168.43.147.7772: UDP, length 120
00:02:12.070545 IP 192.168.43.124.8880 > 192.168.43.146.7771: UDP, length 120
00:02:12.083095 IP 192.168.43.146.8880 > 192.168.43.147.7772: UDP, length 120
00:02:12.120492 IP 192.168.43.124.8880 > 192.168.43.146.7771: UDP, length 120
00:02:12.133060 IP 192.168.43.146.8880 > 192.168.43.147.7772: UDP, length 120
00:02:12.170409 IP 192.168.43.124.8880 > 192.168.43.146.7771: UDP, length 120
00:02:12.183061 IP 192.168.43.146.8880 > 192.168.43.147.7772: UDP, length 120
00:02:12.220452 IP 192.168.43.124.8880 > 192.168.43.146.7771: UDP, length 120
00:02:12.233057 IP 192.168.43.146.8880 > 192.168.43.147.7772: UDP, length 120
00:02:12.270479 IP 192.168.43.124.8880 > 192.168.43.146.7771: UDP, length 120
00:02:12.283059 IP 192.168.43.146.8880 > 192.168.43.147.7772: UDP, length 120
00:02:12.320436 IP 192.168.43.124.8880 > 192.168.43.146.7771: UDP, length 120
00:02:12.333055 IP 192.168.43.146.8880 > 192.168.43.147.7772: UDP, length 120
00:02:12.370514 IP 192.168.43.124.8880 > 192.168.43.146.7771: UDP, length 120
00:02:12.383057 IP 192.168.43.146.8880 > 192.168.43.147.7772: UDP, length 120
00:02:12.418409 IP 192.168.43.124.8880 > 192.168.43.146.7771: UDP, length 120
00:02:12.433079 IP 192.168.43.146.8880 > 192.168.43.147.7772: UDP, length 120
00:02:12.470499 IP 192.168.43.124.8880 > 192.168.43.146.7771: UDP, length 120
00:02:12.483066 IP 192.168.43.146.8880 > 192.168.43.147.7772: UDP, length 120
00:02:12.521463 IP 192.168.43.124.8880 > 192.168.43.146.7771: UDP, length 120
00:02:12.533057 IP 192.168.43.146.8880 > 192.168.43.147.7772: UDP, length 120
00:02:12.570541 IP 192.168.43.124.8880 > 192.168.43.146.7771: UDP, length 120
00:02:12.583067 IP 192.168.43.146.8880 > 192.168.43.147.7772: UDP, length 120
00:02:12.617563 IP 192.168.43.124.8880 > 192.168.43.146.7771: UDP, length 120
00:02:12.633111 IP 192.168.43.146.8880 > 192.168.43.147.7772: UDP, length 120
00:02:12.670370 IP 192.168.43.124.8880 > 192.168.43.146.7771: UDP, length 120
00:02:12.683120 IP 192.168.43.146.8880 > 192.168.43.147.7772: UDP, length 120
00:02:12.717401 IP 192.168.43.124.8880 > 192.168.43.146.7771: UDP, length 120
00:02:12.733102 IP 192.168.43.146.8880 > 192.168.43.147.7772: UDP, length 120
00:02:12.770948 IP 192.168.43.124.8880 > 192.168.43.146.7771: UDP, length 120
00:02:12.783158 IP 192.168.43.146.8880 > 192.168.43.147.7772: UDP, length 120
00:02:12.821544 IP 192.168.43.124.8880 > 192.168.43.146.7771: UDP, length 120
00:02:12.833162 IP 192.168.43.146.8880 > 192.168.43.147.7772: UDP, length 120
00:02:12.875207 IP 192.168.43.124.8880 > 192.168.43.146.7771: UDP, length 120
00:02:12.883183 IP 192.168.43.146.8880 > 192.168.43.147.7772: UDP, length 120
00:02:12.919657 IP 192.168.43.124.8880 > 192.168.43.146.7771: UDP, length 120
00:02:12.933140 IP 192.168.43.146.8880 > 192.168.43.147.7772: UDP, length 120
00:02:12.980319 IP 192.168.43.124.8880 > 192.168.43.146.7771: UDP, length 120
00:02:12.983108 IP 192.168.43.146.8880 > 192.168.43.147.7772: UDP, length 120
00:02:13.020948 IP 192.168.43.124.8880 > 192.168.43.146.7771: UDP, length 120
00:02:13.033139 IP 192.168.43.146.8880 > 192.168.43.147.7772: UDP, length 120
00:02:13.070856 IP 192.168.43.124.8880 > 192.168.43.146.7771: UDP, length 120
00:02:13.083144 IP 192.168.43.146.8880 > 192.168.43.147.7772: UDP, length 120
00:02:13.120977 IP 192.168.43.124.8880 > 192.168.43.146.7771: UDP, length 120
00:02:13.133124 IP 192.168.43.146.8880 > 192.168.43.147.7772: UDP, length 120
00:02:13.170948 IP 192.168.43.124.8880 > 192.168.43.146.7771: UDP, length 120
00:02:13.183156 IP 192.168.43.146.8880 > 192.168.43.147.7772: UDP, length 120
00:02:13.221020 IP 192.168.43.124.8880 > 192.168.43.146.7771: UDP, length 120
00:02:13.233147 IP 192.168.43.146.8880 > 192.168.43.147.7772: UDP, length 120
00:02:13.271580 IP 192.168.43.124.8880 > 192.168.43.146.7771: UDP, length 120
00:02:13.283100 IP 192.168.43.146.8880 > 192.168.43.147.7772: UDP, length 120
00:02:13.320874 IP 192.168.43.124.8880 > 192.168.43.146.7771: UDP, length 120
00:02:13.333062 IP 192.168.43.146.8880 > 192.168.43.147.7772: UDP, length 120
00:02:13.371080 IP 192.168.43.124.8880 > 192.168.43.146.7771: UDP, length 120
00:02:13.383061 IP 192.168.43.146.8880 > 192.168.43.147.7772: UDP, length 120
00:02:13.418696 IP 192.168.43.124.8880 > 192.168.43.146.7771: UDP, length 120
00:02:13.433077 IP 192.168.43.146.8880 > 192.168.43.147.7772: UDP, length 120
00:02:13.472153 IP 192.168.43.124.8880 > 192.168.43.146.7771: UDP, length 120
00:02:13.483089 IP 192.168.43.146.8880 > 192.168.43.147.7772: UDP, length 120
00:02:13.520545 IP 192.168.43.124.8880 > 192.168.43.146.7771: UDP, length 120
00:02:13.533061 IP 192.168.43.146.8880 > 192.168.43.147.7772: UDP, length 120
00:02:13.571960 IP 192.168.43.124.8880 > 192.168.43.146.7771: UDP, length 120
00:02:13.583060 IP 192.168.43.146.8880 > 192.168.43.147.7772: UDP, length 120
00:02:13.620733 IP 192.168.43.124.8880 > 192.168.43.146.7771: UDP, length 120
00:02:13.633059 IP 192.168.43.146.8880 > 192.168.43.147.7772: UDP, length 120
00:02:13.671047 IP 192.168.43.124.8880 > 192.168.43.146.7771: UDP, length 120
00:02:13.683069 IP 192.168.43.146.8880 > 192.168.43.147.7772: UDP, length 120
00:02:13.720845 IP 192.168.43.124.8880 > 192.168.43.146.7771: UDP, length 120
00:02:13.733072 IP 192.168.43.146.8880 > 192.168.43.147.7772: UDP, length 120
00:02:13.771088 IP 192.168.43.124.8880 > 192.168.43.146.7771: UDP, length 120
00:02:13.783062 IP 192.168.43.146.8880 > 192.168.43.147.7772: UDP, length 120
00:02:13.820447 IP 192.168.43.124.8880 > 192.168.43.146.7771: UDP, length 120
00:02:13.833059 IP 192.168.43.146.8880 > 192.168.43.147.7772: UDP, length 120
00:02:13.869393 IP 192.168.43.124.8880 > 192.168.43.146.7771: UDP, length 120
00:02:13.883058 IP 192.168.43.146.8880 > 192.168.43.147.7772: UDP, length 120
00:02:13.922208 IP 192.168.43.124.8880 > 192.168.43.146.7771: UDP, length 120
00:02:13.933059 IP 192.168.43.146.8880 > 192.168.43.147.7772: UDP, length 120
00:02:13.977294 IP 192.168.43.124.8880 > 192.168.43.146.7771: UDP, length 120
00:02:13.983056 IP 192.168.43.146.8880 > 192.168.43.147.7772: UDP, length 120
00:02:14.032643 IP 192.168.43.124.8880 > 192.168.43.146.7771: UDP, length 120
00:02:14.033055 IP 192.168.43.146.8880 > 192.168.43.147.7772: UDP, length 120
00:02:14.071761 IP 192.168.43.124.8880 > 192.168.43.146.7771: UDP, length 120
00:02:14.083107 IP 192.168.43.146.8880 > 192.168.43.147.7772: UDP, length 120
00:02:14.133068 IP 192.168.43.146.8880 > 192.168.43.147.7772: UDP, length 120
00:02:14.183063 IP 192.168.43.146.8880 > 192.168.43.147.7772: UDP, length 120
00:02:14.233056 IP 192.168.43.146.8880 > 192.168.43.147.7772: UDP, length 120
00:02:14.275426 IP 192.168.43.124.8880 > 192.168.43.146.7771: UDP, length 120
00:02:14.275630 IP 192.168.43.124.8880 > 192.168.43.146.7771: UDP, length 120
00:02:14.275752 IP 192.168.43.124.8880 > 192.168.43.146.7771: UDP, length 120
00:02:14.283061 IP 192.168.43.146.8880 > 192.168.43.147.7772: UDP, length 120
00:02:14.333058 IP 192.168.43.146.8880 > 192.168.43.147.7772: UDP, length 120
00:02:14.383056 IP 192.168.43.146.8880 > 192.168.43.147.7772: UDP, length 120
00:02:14.433086 IP 192.168.43.146.8880 > 192.168.43.147.7772: UDP, length 120
00:02:14.436333 IP 192.168.43.124.8880 > 192.168.43.146.7771: UDP, length 120
00:02:14.436428 IP 192.168.43.124.8880 > 192.168.43.146.7771: UDP, length 120
00:02:14.483065 IP 192.168.43.146.8880 > 192.168.43.147.7772: UDP, length 120
00:02:14.533057 IP 192.168.43.146.8880 > 192.168.43.147.7772: UDP, length 120
00:02:14.546635 IP 192.168.43.124.8880 > 192.168.43.146.7771: UDP, length 120
00:02:14.546999 IP 192.168.43.124.8880 > 192.168.43.146.7771: UDP, length 120
00:02:14.555295 IP 192.168.43.124.8880 > 192.168.43.146.7771: UDP, length 120
00:02:14.583061 IP 192.168.43.146.8880 > 192.168.43.147.7772: UDP, length 120
00:02:14.633057 IP 192.168.43.146.8880 > 192.168.43.147.7772: UDP, length 120
00:02:14.659868 IP 192.168.43.124.8880 > 192.168.43.146.7771: UDP, length 120
00:02:14.660010 IP 192.168.43.124.8880 > 192.168.43.146.7771: UDP, length 120
00:02:14.683081 IP 192.168.43.146.8880 > 192.168.43.147.7772: UDP, length 120
00:02:14.733062 IP 192.168.43.146.8880 > 192.168.43.147.7772: UDP, length 120
00:02:14.777119 IP 192.168.43.124.8880 > 192.168.43.146.7771: UDP, length 120
00:02:14.777351 IP 192.168.43.124.8880 > 192.168.43.146.7771: UDP, length 120
00:02:14.783066 IP 192.168.43.146.8880 > 192.168.43.147.7772: UDP, length 120
00:02:14.833065 IP 192.168.43.146.8880 > 192.168.43.147.7772: UDP, length 120
00:02:14.883058 IP 192.168.43.146.8880 > 192.168.43.147.7772: UDP, length 120
00:02:14.896174 IP 192.168.43.124.8880 > 192.168.43.146.7771: UDP, length 120
00:02:14.896405 IP 192.168.43.124.8880 > 192.168.43.146.7771: UDP, length 120
00:02:14.896487 IP 192.168.43.124.8880 > 192.168.43.146.7771: UDP, length 120
00:02:14.933079 IP 192.168.43.146.8880 > 192.168.43.147.7772: UDP, length 120
00:02:14.983098 IP 192.168.43.146.8880 > 192.168.43.147.7772: UDP, length 120
00:02:15.013448 IP 192.168.43.124.8880 > 192.168.43.146.7771: UDP, length 120
00:02:15.013530 IP 192.168.43.124.8880 > 192.168.43.146.7771: UDP, length 120
00:02:15.033085 IP 192.168.43.146.8880 > 192.168.43.147.7772: UDP, length 120
00:02:15.083117 IP 192.168.43.146.8880 > 192.168.43.147.7772: UDP, length 120
00:02:15.133078 IP 192.168.43.146.8880 > 192.168.43.147.7772: UDP, length 120
00:02:15.137298 IP 192.168.43.124.8880 > 192.168.43.146.7771: UDP, length 120
00:02:15.137853 IP 192.168.43.124.8880 > 192.168.43.146.7771: UDP, length 120
00:02:15.138067 IP 192.168.43.124.8880 > 192.168.43.146.7771: UDP, length 120
00:02:15.183085 IP 192.168.43.146.8880 > 192.168.43.147.7772: UDP, length 120
00:02:15.233062 IP 192.168.43.146.8880 > 192.168.43.147.7772: UDP, length 120
00:02:15.268101 IP 192.168.43.124.8880 > 192.168.43.146.7771: UDP, length 120
00:02:15.268189 IP 192.168.43.124.8880 > 192.168.43.146.7771: UDP, length 120
00:02:15.283063 IP 192.168.43.146.8880 > 192.168.43.147.7772: UDP, length 120
00:02:15.333060 IP 192.168.43.146.8880 > 192.168.43.147.7772: UDP, length 120
00:02:15.383057 IP 192.168.43.146.8880 > 192.168.43.147.7772: UDP, length 120
00:02:15.386301 IP 192.168.43.124.8880 > 192.168.43.146.7771: UDP, length 120
00:02:15.386378 IP 192.168.43.124.8880 > 192.168.43.146.7771: UDP, length 120
00:02:15.386453 IP 192.168.43.124.8880 > 192.168.43.146.7771: UDP, length 120
00:02:15.433075 IP 192.168.43.146.8880 > 192.168.43.147.7772: UDP, length 120
00:02:15.483061 IP 192.168.43.146.8880 > 192.168.43.147.7772: UDP, length 120
00:02:15.492184 IP 192.168.43.124.8880 > 192.168.43.146.7771: UDP, length 120
00:02:15.492807 IP 192.168.43.124.8880 > 192.168.43.146.7771: UDP, length 120
00:02:15.519307 IP 192.168.43.124.8880 > 192.168.43.146.7771: UDP, length 120
00:02:15.533079 IP 192.168.43.146.8880 > 192.168.43.147.7772: UDP, length 120
00:02:15.570452 IP 192.168.43.124.8880 > 192.168.43.146.7771: UDP, length 120
00:02:15.583064 IP 192.168.43.146.8880 > 192.168.43.147.7772: UDP, length 120
00:02:15.618246 IP 192.168.43.124.8880 > 192.168.43.146.7771: UDP, length 120
00:02:15.633078 IP 192.168.43.146.8880 > 192.168.43.147.7772: UDP, length 120
00:02:15.670027 IP 192.168.43.124.8880 > 192.168.43.146.7771: UDP, length 120
00:02:15.683066 IP 192.168.43.146.8880 > 192.168.43.147.7772: UDP, length 120
00:02:15.729263 IP 192.168.43.124.8880 > 192.168.43.146.7771: UDP, length 120
00:02:15.733058 IP 192.168.43.146.8880 > 192.168.43.147.7772: UDP, length 120
00:02:15.770109 IP 192.168.43.124.8880 > 192.168.43.146.7771: UDP, length 120
00:02:15.783059 IP 192.168.43.146.8880 > 192.168.43.147.7772: UDP, length 120
00:02:15.820225 IP 192.168.43.124.8880 > 192.168.43.146.7771: UDP, length 120
00:02:15.833064 IP 192.168.43.146.8880 > 192.168.43.147.7772: UDP, length 120
00:02:15.870146 IP 192.168.43.124.8880 > 192.168.43.146.7771: UDP, length 120
00:02:15.883065 IP 192.168.43.146.8880 > 192.168.43.147.7772: UDP, length 120
00:02:15.921317 IP 192.168.43.124.8880 > 192.168.43.146.7771: UDP, length 120
00:02:15.933059 IP 192.168.43.146.8880 > 192.168.43.147.7772: UDP, length 120
00:02:15.978620 IP 192.168.43.124.8880 > 192.168.43.146.7771: UDP, length 120
00:02:15.983057 IP 192.168.43.146.8880 > 192.168.43.147.7772: UDP, length 120
00:02:16.033056 IP 192.168.43.146.8880 > 192.168.43.147.7772: UDP, length 120
00:02:16.034477 IP 192.168.43.124.8880 > 192.168.43.146.7771: UDP, length 120
00:02:16.068279 IP 192.168.43.124.8880 > 192.168.43.146.7771: UDP, length 120
00:02:16.083123 IP 192.168.43.146.8880 > 192.168.43.147.7772: UDP, length 120
00:02:16.120175 IP 192.168.43.124.8880 > 192.168.43.146.7771: UDP, length 120
00:02:16.133091 IP 192.168.43.146.8880 > 192.168.43.147.7772: UDP, length 120
00:02:16.175527 IP 192.168.43.124.8880 > 192.168.43.146.7771: UDP, length 120
00:02:16.183083 IP 192.168.43.146.8880 > 192.168.43.147.7772: UDP, length 120
00:02:16.221256 IP 192.168.43.124.8880 > 192.168.43.146.7771: UDP, length 120
00:02:16.233070 IP 192.168.43.146.8880 > 192.168.43.147.7772: UDP, length 120
00:02:16.277812 IP 192.168.43.124.8880 > 192.168.43.146.7771: UDP, length 120
00:02:16.283069 IP 192.168.43.146.8880 > 192.168.43.147.7772: UDP, length 120
00:02:16.317229 IP 192.168.43.124.8880 > 192.168.43.146.7771: UDP, length 120
00:02:16.333078 IP 192.168.43.146.8880 > 192.168.43.147.7772: UDP, length 120
00:02:16.379966 IP 192.168.43.124.8880 > 192.168.43.146.7771: UDP, length 120
00:02:16.383061 IP 192.168.43.146.8880 > 192.168.43.147.7772: UDP, length 120
00:02:16.430691 IP 192.168.43.124.8880 > 192.168.43.146.7771: UDP, length 120
00:02:16.433083 IP 192.168.43.146.8880 > 192.168.43.147.7772: UDP, length 120
00:02:16.470491 IP 192.168.43.124.8880 > 192.168.43.146.7771: UDP, length 120
00:02:16.483088 IP 192.168.43.146.8880 > 192.168.43.147.7772: UDP, length 120
00:02:16.517657 IP 192.168.43.124.8880 > 192.168.43.146.7771: UDP, length 120
00:02:16.533082 IP 192.168.43.146.8880 > 192.168.43.147.7772: UDP, length 120
00:02:16.570558 IP 192.168.43.124.8880 > 192.168.43.146.7771: UDP, length 120
00:02:16.583065 IP 192.168.43.146.8880 > 192.168.43.147.7772: UDP, length 120
00:02:16.620357 IP 192.168.43.124.8880 > 192.168.43.146.7771: UDP, length 120
00:02:16.633065 IP 192.168.43.146.8880 > 192.168.43.147.7772: UDP, length 120
00:02:16.683077 IP 192.168.43.146.8880 > 192.168.43.147.7772: UDP, length 120
00:02:16.694947 IP 192.168.43.124.8880 > 192.168.43.146.7771: UDP, length 120
00:02:16.733060 IP 192.168.43.146.8880 > 192.168.43.147.7772: UDP, length 120
00:02:16.734099 IP 192.168.43.124.8880 > 192.168.43.146.7771: UDP, length 120
00:02:16.770437 IP 192.168.43.124.8880 > 192.168.43.146.7771: UDP, length 120
00:02:16.783059 IP 192.168.43.146.8880 > 192.168.43.147.7772: UDP, length 120
00:02:16.820605 IP 192.168.43.124.8880 > 192.168.43.146.7771: UDP, length 120
00:02:16.833078 IP 192.168.43.146.8880 > 192.168.43.147.7772: UDP, length 120
00:02:16.869977 IP 192.168.43.124.8880 > 192.168.43.146.7771: UDP, length 120
00:02:16.883075 IP 192.168.43.146.8880 > 192.168.43.147.7772: UDP, length 120
00:02:16.920301 IP 192.168.43.124.8880 > 192.168.43.146.7771: UDP, length 120
00:02:16.933065 IP 192.168.43.146.8880 > 192.168.43.147.7772: UDP, length 120
00:02:16.973680 IP 192.168.43.124.8880 > 192.168.43.146.7771: UDP, length 120
00:02:16.983058 IP 192.168.43.146.8880 > 192.168.43.147.7772: UDP, length 120
00:02:17.033073 IP 192.168.43.146.8880 > 192.168.43.147.7772: UDP, length 120
00:02:17.036319 IP 192.168.43.124.8880 > 192.168.43.146.7771: UDP, length 120
00:02:17.072779 IP 192.168.43.124.8880 > 192.168.43.146.7771: UDP, length 120
00:02:17.083071 IP 192.168.43.146.8880 > 192.168.43.147.7772: UDP, length 120
00:02:17.130672 IP 192.168.43.124.8880 > 192.168.43.146.7771: UDP, length 120
00:02:17.133058 IP 192.168.43.146.8880 > 192.168.43.147.7772: UDP, length 120
00:02:17.172552 IP 192.168.43.124.8880 > 192.168.43.146.7771: UDP, length 120
00:02:17.183075 IP 192.168.43.146.8880 > 192.168.43.147.7772: UDP, length 120
00:02:17.220645 IP 192.168.43.124.8880 > 192.168.43.146.7771: UDP, length 120
00:02:17.233059 IP 192.168.43.146.8880 > 192.168.43.147.7772: UDP, length 120
00:02:17.283060 IP 192.168.43.146.8880 > 192.168.43.147.7772: UDP, length 120
00:02:17.283169 IP 192.168.43.124.8880 > 192.168.43.146.7771: UDP, length 120
00:02:17.317670 IP 192.168.43.124.8880 > 192.168.43.146.7771: UDP, length 120
00:02:17.333074 IP 192.168.43.146.8880 > 192.168.43.147.7772: UDP, length 120
00:02:17.372421 IP 192.168.43.124.8880 > 192.168.43.146.7771: UDP, length 120
00:02:17.383062 IP 192.168.43.146.8880 > 192.168.43.147.7772: UDP, length 120
00:02:17.427900 IP 192.168.43.124.8880 > 192.168.43.146.7771: UDP, length 120
00:02:17.433076 IP 192.168.43.146.8880 > 192.168.43.147.7772: UDP, length 120
00:02:17.483060 IP 192.168.43.146.8880 > 192.168.43.147.7772: UDP, length 120
00:02:17.490492 IP 192.168.43.124.8880 > 192.168.43.146.7771: UDP, length 120
00:02:17.522441 IP 192.168.43.124.8880 > 192.168.43.146.7771: UDP, length 120
00:02:17.533068 IP 192.168.43.146.8880 > 192.168.43.147.7772: UDP, length 120
00:02:17.571242 IP 192.168.43.124.8880 > 192.168.43.146.7771: UDP, length 120
00:02:17.583110 IP 192.168.43.146.8880 > 192.168.43.147.7772: UDP, length 120
00:02:17.621186 IP 192.168.43.124.8880 > 192.168.43.146.7771: UDP, length 120
00:02:17.633132 IP 192.168.43.146.8880 > 192.168.43.147.7772: UDP, length 120
00:02:17.683146 IP 192.168.43.146.8880 > 192.168.43.147.7772: UDP, length 120
00:02:17.685196 IP 192.168.43.124.8880 > 192.168.43.146.7771: UDP, length 120
00:02:17.721184 IP 192.168.43.124.8880 > 192.168.43.146.7771: UDP, length 120
00:02:17.733097 IP 192.168.43.146.8880 > 192.168.43.147.7772: UDP, length 120
00:02:17.771806 IP 192.168.43.124.8880 > 192.168.43.146.7771: UDP, length 120
00:02:17.783156 IP 192.168.43.146.8880 > 192.168.43.147.7772: UDP, length 120
00:02:17.833107 IP 192.168.43.146.8880 > 192.168.43.147.7772: UDP, length 120
00:02:17.834624 IP 192.168.43.124.8880 > 192.168.43.146.7771: UDP, length 120
00:02:17.883111 IP 192.168.43.146.8880 > 192.168.43.147.7772: UDP, length 120
00:02:17.894646 IP 192.168.43.124.8880 > 192.168.43.146.7771: UDP, length 120
00:02:17.918065 IP 192.168.43.124.8880 > 192.168.43.146.7771: UDP, length 120
00:02:17.933094 IP 192.168.43.146.8880 > 192.168.43.147.7772: UDP, length 120
00:02:17.983105 IP 192.168.43.146.8880 > 192.168.43.147.7772: UDP, length 120
00:02:17.986372 IP 192.168.43.124.8880 > 192.168.43.146.7771: UDP, length 120
00:02:18.025016 IP 192.168.43.124.8880 > 192.168.43.146.7771: UDP, length 120
00:02:18.033091 IP 192.168.43.146.8880 > 192.168.43.147.7772: UDP, length 120
00:02:18.081137 IP 192.168.43.124.8880 > 192.168.43.146.7771: UDP, length 120
00:02:18.083088 IP 192.168.43.146.8880 > 192.168.43.147.7772: UDP, length 120
00:02:18.133132 IP 192.168.43.146.8880 > 192.168.43.147.7772: UDP, length 120
00:02:18.143058 IP 192.168.43.124.8880 > 192.168.43.146.7771: UDP, length 120
00:02:18.171615 IP 192.168.43.124.8880 > 192.168.43.146.7771: UDP, length 120
00:02:18.183124 IP 192.168.43.146.8880 > 192.168.43.147.7772: UDP, length 120
00:02:18.220263 IP 192.168.43.124.8880 > 192.168.43.146.7771: UDP, length 120
00:02:18.233094 IP 192.168.43.146.8880 > 192.168.43.147.7772: UDP, length 120
00:02:18.271356 IP 192.168.43.124.8880 > 192.168.43.146.7771: UDP, length 120
00:02:18.283128 IP 192.168.43.146.8880 > 192.168.43.147.7772: UDP, length 120
00:02:18.330805 IP 192.168.43.124.8880 > 192.168.43.146.7771: UDP, length 120
00:02:18.333110 IP 192.168.43.146.8880 > 192.168.43.147.7772: UDP, length 120
00:02:18.383147 IP 192.168.43.146.8880 > 192.168.43.147.7772: UDP, length 120
00:02:18.389710 IP 192.168.43.124.8880 > 192.168.43.146.7771: UDP, length 120
00:02:18.425369 IP 192.168.43.124.8880 > 192.168.43.146.7771: UDP, length 120
00:02:18.433167 IP 192.168.43.146.8880 > 192.168.43.147.7772: UDP, length 120
00:02:18.468476 IP 192.168.43.124.8880 > 192.168.43.146.7771: UDP, length 120
00:02:18.483120 IP 192.168.43.146.8880 > 192.168.43.147.7772: UDP, length 120
00:02:18.529727 IP 192.168.43.124.8880 > 192.168.43.146.7771: UDP, length 120
00:02:18.533141 IP 192.168.43.146.8880 > 192.168.43.147.7772: UDP, length 120
00:02:18.581068 IP 192.168.43.124.8880 > 192.168.43.146.7771: UDP, length 120
00:02:18.583113 IP 192.168.43.146.8880 > 192.168.43.147.7772: UDP, length 120
00:02:18.633138 IP 192.168.43.146.8880 > 192.168.43.147.7772: UDP, length 120
00:02:18.639841 IP 192.168.43.124.8880 > 192.168.43.146.7771: UDP, length 120
00:02:18.671646 IP 192.168.43.124.8880 > 192.168.43.146.7771: UDP, length 120
00:02:18.683108 IP 192.168.43.146.8880 > 192.168.43.147.7772: UDP, length 120
00:02:18.723530 IP 192.168.43.124.8880 > 192.168.43.146.7771: UDP, length 120
00:02:18.733088 IP 192.168.43.146.8880 > 192.168.43.147.7772: UDP, length 120
00:02:18.772822 IP 192.168.43.124.8880 > 192.168.43.146.7771: UDP, length 120
00:02:18.783088 IP 192.168.43.146.8880 > 192.168.43.147.7772: UDP, length 120
00:02:18.823173 IP 192.168.43.124.8880 > 192.168.43.146.7771: UDP, length 120
00:02:18.833081 IP 192.168.43.146.8880 > 192.168.43.147.7772: UDP, length 120
00:02:18.873202 IP 192.168.43.124.8880 > 192.168.43.146.7771: UDP, length 120
00:02:18.883086 IP 192.168.43.146.8880 > 192.168.43.147.7772: UDP, length 120
00:02:18.923222 IP 192.168.43.124.8880 > 192.168.43.146.7771: UDP, length 120
00:02:18.933082 IP 192.168.43.146.8880 > 192.168.43.147.7772: UDP, length 120
00:02:18.970797 IP 192.168.43.124.8880 > 192.168.43.146.7771: UDP, length 120
00:02:18.983122 IP 192.168.43.146.8880 > 192.168.43.147.7772: UDP, length 120
00:02:19.022552 IP 192.168.43.124.8880 > 192.168.43.146.7771: UDP, length 120
00:02:19.033119 IP 192.168.43.146.8880 > 192.168.43.147.7772: UDP, length 120
00:02:19.069976 IP 192.168.43.124.8880 > 192.168.43.146.7771: UDP, length 120
00:02:19.083115 IP 192.168.43.146.8880 > 192.168.43.147.7772: UDP, length 120
00:02:19.123611 IP 192.168.43.124.8880 > 192.168.43.146.7771: UDP, length 120
00:02:19.133105 IP 192.168.43.146.8880 > 192.168.43.147.7772: UDP, length 120
00:02:19.173255 IP 192.168.43.124.8880 > 192.168.43.146.7771: UDP, length 120
00:02:19.183856 IP 192.168.43.146.8880 > 192.168.43.147.7772: UDP, length 120
00:02:19.231797 IP 192.168.43.124.8880 > 192.168.43.146.7771: UDP, length 120
00:02:19.233105 IP 192.168.43.146.8880 > 192.168.43.147.7772: UDP, length 120
00:02:19.272925 IP 192.168.43.124.8880 > 192.168.43.146.7771: UDP, length 120
00:02:19.283105 IP 192.168.43.146.8880 > 192.168.43.147.7772: UDP, length 120
00:02:19.328523 IP 192.168.43.124.8880 > 192.168.43.146.7771: UDP, length 120
00:02:19.333100 IP 192.168.43.146.8880 > 192.168.43.147.7772: UDP, length 120
00:02:19.373757 IP 192.168.43.124.8880 > 192.168.43.146.7771: UDP, length 120
00:02:19.383109 IP 192.168.43.146.8880 > 192.168.43.147.7772: UDP, length 120
00:02:19.418335 IP 192.168.43.124.8880 > 192.168.43.146.7771: UDP, length 120
00:02:19.433101 IP 192.168.43.146.8880 > 192.168.43.147.7772: UDP, length 120
00:02:19.476781 IP 192.168.43.124.8880 > 192.168.43.146.7771: UDP, length 120
00:02:19.483110 IP 192.168.43.146.8880 > 192.168.43.147.7772: UDP, length 120
00:02:19.525371 IP 192.168.43.124.8880 > 192.168.43.146.7771: UDP, length 120
00:02:19.533120 IP 192.168.43.146.8880 > 192.168.43.147.7772: UDP, length 120
00:02:19.573400 IP 192.168.43.124.8880 > 192.168.43.146.7771: UDP, length 120
00:02:19.583112 IP 192.168.43.146.8880 > 192.168.43.147.7772: UDP, length 120
00:02:19.623336 IP 192.168.43.124.8880 > 192.168.43.146.7771: UDP, length 120
00:02:19.633107 IP 192.168.43.146.8880 > 192.168.43.147.7772: UDP, length 120
00:02:19.670296 IP 192.168.43.124.8880 > 192.168.43.146.7771: UDP, length 120
00:02:19.683146 IP 192.168.43.146.8880 > 192.168.43.147.7772: UDP, length 120
00:02:19.724168 IP 192.168.43.124.8880 > 192.168.43.146.7771: UDP, length 120
00:02:19.733111 IP 192.168.43.146.8880 > 192.168.43.147.7772: UDP, length 120
00:02:19.773449 IP 192.168.43.124.8880 > 192.168.43.146.7771: UDP, length 120
00:02:19.783128 IP 192.168.43.146.8880 > 192.168.43.147.7772: UDP, length 120
00:02:19.823513 IP 192.168.43.124.8880 > 192.168.43.146.7771: UDP, length 120
00:02:19.833131 IP 192.168.43.146.8880 > 192.168.43.147.7772: UDP, length 120
00:02:19.873531 IP 192.168.43.124.8880 > 192.168.43.146.7771: UDP, length 120
00:02:19.883119 IP 192.168.43.146.8880 > 192.168.43.147.7772: UDP, length 120
00:02:19.924647 IP 192.168.43.124.8880 > 192.168.43.146.7771: UDP, length 120
00:02:19.933119 IP 192.168.43.146.8880 > 192.168.43.147.7772: UDP, length 120
00:02:19.973516 IP 192.168.43.124.8880 > 192.168.43.146.7771: UDP, length 120
00:02:19.983114 IP 192.168.43.146.8880 > 192.168.43.147.7772: UDP, length 120
00:02:20.027973 IP 192.168.43.124.8880 > 192.168.43.146.7771: UDP, length 120
00:02:20.033116 IP 192.168.43.146.8880 > 192.168.43.147.7772: UDP, length 120
00:02:20.070800 IP 192.168.43.124.8880 > 192.168.43.146.7771: UDP, length 120
00:02:20.083089 IP 192.168.43.146.8880 > 192.168.43.147.7772: UDP, length 120
00:02:20.126055 IP 192.168.43.124.8880 > 192.168.43.146.7771: UDP, length 120
00:02:20.133072 IP 192.168.43.146.8880 > 192.168.43.147.7772: UDP, length 120
00:02:20.173446 IP 192.168.43.124.8880 > 192.168.43.146.7771: UDP, length 120
00:02:20.183064 IP 192.168.43.146.8880 > 192.168.43.147.7772: UDP, length 120
00:02:20.223781 IP 192.168.43.124.8880 > 192.168.43.146.7771: UDP, length 120
00:02:20.233114 IP 192.168.43.146.8880 > 192.168.43.147.7772: UDP, length 120
00:02:20.273702 IP 192.168.43.124.8880 > 192.168.43.146.7771: UDP, length 120
00:02:20.283070 IP 192.168.43.146.8880 > 192.168.43.147.7772: UDP, length 120
00:02:20.323439 IP 192.168.43.124.8880 > 192.168.43.146.7771: UDP, length 120
00:02:20.333060 IP 192.168.43.146.8880 > 192.168.43.147.7772: UDP, length 120
00:02:20.373844 IP 192.168.43.124.8880 > 192.168.43.146.7771: UDP, length 120
00:02:20.383059 IP 192.168.43.146.8880 > 192.168.43.147.7772: UDP, length 120
00:02:20.420441 IP 192.168.43.124.8880 > 192.168.43.146.7771: UDP, length 120
00:02:20.433074 IP 192.168.43.146.8880 > 192.168.43.147.7772: UDP, length 120
00:02:20.476790 IP 192.168.43.124.8880 > 192.168.43.146.7771: UDP, length 120
