22:04:56.238253 IP 192.168.43.124.8880 > 192.168.43.146.7771: UDP, length 120
22:04:56.288398 IP 192.168.43.124.8880 > 192.168.43.146.7771: UDP, length 120
22:04:56.338397 IP 192.168.43.124.8880 > 192.168.43.146.7771: UDP, length 120
22:04:56.388398 IP 192.168.43.124.8880 > 192.168.43.146.7771: UDP, length 120
22:04:56.438396 IP 192.168.43.124.8880 > 192.168.43.146.7771: UDP, length 120
22:04:56.488395 IP 192.168.43.124.8880 > 192.168.43.146.7771: UDP, length 120
22:04:56.538395 IP 192.168.43.124.8880 > 192.168.43.146.7771: UDP, length 120
22:04:56.588397 IP 192.168.43.124.8880 > 192.168.43.146.7771: UDP, length 120
22:04:56.638393 IP 192.168.43.124.8880 > 192.168.43.146.7771: UDP, length 120
22:04:56.688418 IP 192.168.43.124.8880 > 192.168.43.146.7771: UDP, length 120
22:04:56.738399 IP 192.168.43.124.8880 > 192.168.43.146.7771: UDP, length 120
22:04:56.788402 IP 192.168.43.124.8880 > 192.168.43.146.7771: UDP, length 120
22:04:56.804138 IP 192.168.43.147.8880 > 192.168.43.124.7773: UDP, length 120
22:04:56.838397 IP 192.168.43.124.8880 > 192.168.43.146.7771: UDP, length 120
22:04:56.858601 IP 192.168.43.147.8880 > 192.168.43.124.7773: UDP, length 120
22:04:56.888394 IP 192.168.43.124.8880 > 192.168.43.146.7771: UDP, length 120
22:04:56.902840 IP 192.168.43.147.8880 > 192.168.43.124.7773: UDP, length 120
22:04:56.938394 IP 192.168.43.124.8880 > 192.168.43.146.7771: UDP, length 120
22:04:56.949875 IP 192.168.43.147.8880 > 192.168.43.124.7773: UDP, length 120
22:04:56.988397 IP 192.168.43.124.8880 > 192.168.43.146.7771: UDP, length 120
22:04:57.003677 IP 192.168.43.147.8880 > 192.168.43.124.7773: UDP, length 120
22:04:57.038396 IP 192.168.43.124.8880 > 192.168.43.146.7771: UDP, length 120
22:04:57.070536 IP 192.168.43.147.8880 > 192.168.43.124.7773: UDP, length 120
22:04:57.088451 IP 192.168.43.124.8880 > 192.168.43.146.7771: UDP, length 120
22:04:57.106232 IP 192.168.43.147.8880 > 192.168.43.124.7773: UDP, length 120
22:04:57.138445 IP 192.168.43.124.8880 > 192.168.43.146.7771: UDP, length 120
22:04:57.153535 IP 192.168.43.147.8880 > 192.168.43.124.7773: UDP, length 120
22:04:57.188450 IP 192.168.43.124.8880 > 192.168.43.146.7771: UDP, length 120
22:04:57.222211 IP 192.168.43.147.8880 > 192.168.43.124.7773: UDP, length 120
22:04:57.238448 IP 192.168.43.124.8880 > 192.168.43.146.7771: UDP, length 120
22:04:57.256115 IP 192.168.43.147.8880 > 192.168.43.124.7773: UDP, length 120
22:04:57.288450 IP 192.168.43.124.8880 > 192.168.43.146.7771: UDP, length 120
22:04:57.303409 IP 192.168.43.147.8880 > 192.168.43.124.7773: UDP, length 120
22:04:57.338448 IP 192.168.43.124.8880 > 192.168.43.146.7771: UDP, length 120
22:04:57.372231 IP 192.168.43.147.8880 > 192.168.43.124.7773: UDP, length 120
22:04:57.388452 IP 192.168.43.124.8880 > 192.168.43.146.7771: UDP, length 120
22:04:57.403355 IP 192.168.43.147.8880 > 192.168.43.124.7773: UDP, length 120
22:04:57.438448 IP 192.168.43.124.8880 > 192.168.43.146.7771: UDP, length 120
22:04:57.453065 IP 192.168.43.147.8880 > 192.168.43.124.7773: UDP, length 120
22:04:57.488331 IP 192.168.43.124.8880 > 192.168.43.146.7771: UDP, length 120
22:04:57.520695 IP 192.168.43.147.8880 > 192.168.43.124.7773: UDP, length 120
22:04:57.538313 IP 192.168.43.124.8880 > 192.168.43.146.7771: UDP, length 120
22:04:57.554852 IP 192.168.43.147.8880 > 192.168.43.124.7773: UDP, length 120
22:04:57.588358 IP 192.168.43.124.8880 > 192.168.43.146.7771: UDP, length 120
22:04:57.604082 IP 192.168.43.147.8880 > 192.168.43.124.7773: UDP, length 120
22:04:57.638395 IP 192.168.43.124.8880 > 192.168.43.146.7771: UDP, length 120
22:04:57.672016 IP 192.168.43.147.8880 > 192.168.43.124.7773: UDP, length 120
22:04:57.688397 IP 192.168.43.124.8880 > 192.168.43.146.7771: UDP, length 120
22:04:57.704299 IP 192.168.43.147.8880 > 192.168.43.124.7773: UDP, length 120
22:04:57.738395 IP 192.168.43.124.8880 > 192.168.43.146.7771: UDP, length 120
22:04:57.752813 IP 192.168.43.147.8880 > 192.168.43.124.7773: UDP, length 120
22:04:57.788398 IP 192.168.43.124.8880 > 192.168.43.146.7771: UDP, length 120
22:04:57.822830 IP 192.168.43.147.8880 > 192.168.43.124.7773: UDP, length 120
22:04:57.838397 IP 192.168.43.124.8880 > 192.168.43.146.7771: UDP, length 120
22:04:57.854379 IP 192.168.43.147.8880 > 192.168.43.124.7773: UDP, length 120
22:04:57.888398 IP 192.168.43.124.8880 > 192.168.43.146.7771: UDP, length 120
22:04:57.899813 IP 192.168.43.147.8880 > 192.168.43.124.7773: UDP, length 120
22:04:57.938394 IP 192.168.43.124.8880 > 192.168.43.146.7771: UDP, length 120
22:04:57.960470 IP 192.168.43.147.8880 > 192.168.43.124.7773: UDP, length 120
22:04:57.988397 IP 192.168.43.124.8880 > 192.168.43.146.7771: UDP, length 120
22:04:58.003310 IP 192.168.43.147.8880 > 192.168.43.124.7773: UDP, length 120
22:04:58.038452 IP 192.168.43.124.8880 > 192.168.43.146.7771: UDP, length 120
22:04:58.050529 IP 192.168.43.147.8880 > 192.168.43.124.7773: UDP, length 120
22:04:58.088399 IP 192.168.43.124.8880 > 192.168.43.146.7771: UDP, length 120
22:04:58.106486 IP 192.168.43.147.8880 > 192.168.43.124.7773: UDP, length 120
22:04:58.138401 IP 192.168.43.124.8880 > 192.168.43.146.7771: UDP, length 120
22:04:58.173541 IP 192.168.43.147.8880 > 192.168.43.124.7773: UDP, length 120
22:04:58.188394 IP 192.168.43.124.8880 > 192.168.43.146.7771: UDP, length 120
22:04:58.203552 IP 192.168.43.147.8880 > 192.168.43.124.7773: UDP, length 120
22:04:58.238396 IP 192.168.43.124.8880 > 192.168.43.146.7771: UDP, length 120
22:04:58.251155 IP 192.168.43.147.8880 > 192.168.43.124.7773: UDP, length 120
22:04:58.288342 IP 192.168.43.124.8880 > 192.168.43.146.7771: UDP, length 120
22:04:58.314043 IP 192.168.43.147.8880 > 192.168.43.124.7773: UDP, length 120
22:04:58.338400 IP 192.168.43.124.8880 > 192.168.43.146.7771: UDP, length 120
22:04:58.354456 IP 192.168.43.147.8880 > 192.168.43.124.7773: UDP, length 120
22:04:58.388311 IP 192.168.43.124.8880 > 192.168.43.146.7771: UDP, length 120
22:04:58.405003 IP 192.168.43.147.8880 > 192.168.43.124.7773: UDP, length 120
22:04:58.438395 IP 192.168.43.124.8880 > 192.168.43.146.7771: UDP, length 120
22:04:58.450215 IP 192.168.43.147.8880 > 192.168.43.124.7773: UDP, length 120
22:04:58.488348 IP 192.168.43.124.8880 > 192.168.43.146.7771: UDP, length 120
22:04:58.521211 IP 192.168.43.147.8880 > 192.168.43.124.7773: UDP, length 120
22:04:58.538396 IP 192.168.43.124.8880 > 192.168.43.146.7771: UDP, length 120
22:04:58.555169 IP 192.168.43.147.8880 > 192.168.43.124.7773: UDP, length 120
22:04:58.588396 IP 192.168.43.124.8880 > 192.168.43.146.7771: UDP, length 120
22:04:58.600901 IP 192.168.43.147.8880 > 192.168.43.124.7773: UDP, length 120
22:04:58.638397 IP 192.168.43.124.8880 > 192.168.43.146.7771: UDP, length 120
22:04:58.662096 IP 192.168.43.147.8880 > 192.168.43.124.7773: UDP, length 120
22:04:58.688399 IP 192.168.43.124.8880 > 192.168.43.146.7771: UDP, length 120
22:04:58.699786 IP 192.168.43.147.8880 > 192.168.43.124.7773: UDP, length 120
22:04:58.738471 IP 192.168.43.124.8880 > 192.168.43.146.7771: UDP, length 120
22:04:58.750764 IP 192.168.43.147.8880 > 192.168.43.124.7773: UDP, length 120
22:04:58.788396 IP 192.168.43.124.8880 > 192.168.43.146.7771: UDP, length 120
22:04:58.805133 IP 192.168.43.147.8880 > 192.168.43.124.7773: UDP, length 120
22:04:58.838396 IP 192.168.43.124.8880 > 192.168.43.146.7771: UDP, length 120
22:04:58.852825 IP 192.168.43.147.8880 > 192.168.43.124.7773: UDP, length 120
22:04:58.888427 IP 192.168.43.124.8880 > 192.168.43.146.7771: UDP, length 120
22:04:58.903010 IP 192.168.43.147.8880 > 192.168.43.124.7773: UDP, length 120
22:04:58.938398 IP 192.168.43.124.8880 > 192.168.43.146.7771: UDP, length 120
22:04:58.952766 IP 192.168.43.147.8880 > 192.168.43.124.7773: UDP, length 120
22:04:58.988426 IP 192.168.43.124.8880 > 192.168.43.146.7771: UDP, length 120
22:04:59.021336 IP 192.168.43.147.8880 > 192.168.43.124.7773: UDP, length 120
22:04:59.038427 IP 192.168.43.124.8880 > 192.168.43.146.7771: UDP, length 120
22:04:59.056916 IP 192.168.43.147.8880 > 192.168.43.124.7773: UDP, length 120
22:04:59.088431 IP 192.168.43.124.8880 > 192.168.43.146.7771: UDP, length 120
22:04:59.103224 IP 192.168.43.147.8880 > 192.168.43.124.7773: UDP, length 120
22:04:59.138423 IP 192.168.43.124.8880 > 192.168.43.146.7771: UDP, length 120
22:04:59.172048 IP 192.168.43.147.8880 > 192.168.43.124.7773: UDP, length 120
22:04:59.188432 IP 192.168.43.124.8880 > 192.168.43.146.7771: UDP, length 120
22:04:59.203111 IP 192.168.43.147.8880 > 192.168.43.124.7773: UDP, length 120
22:04:59.238427 IP 192.168.43.124.8880 > 192.168.43.146.7771: UDP, length 120
22:04:59.252739 IP 192.168.43.147.8880 > 192.168.43.124.7773: UDP, length 120
22:04:59.288430 IP 192.168.43.124.8880 > 192.168.43.146.7771: UDP, length 120
22:04:59.322368 IP 192.168.43.147.8880 > 192.168.43.124.7773: UDP, length 120
22:04:59.338451 IP 192.168.43.124.8880 > 192.168.43.146.7771: UDP, length 120
22:04:59.361390 IP 192.168.43.147.8880 > 192.168.43.124.7773: UDP, length 120
22:04:59.388454 IP 192.168.43.124.8880 > 192.168.43.146.7771: UDP, length 120
22:04:59.404814 IP 192.168.43.147.8880 > 192.168.43.124.7773: UDP, length 120
22:04:59.438348 IP 192.168.43.124.8880 > 192.168.43.146.7771: UDP, length 120
22:04:59.472849 IP 192.168.43.147.8880 > 192.168.43.124.7773: UDP, length 120
22:04:59.488397 IP 192.168.43.124.8880 > 192.168.43.146.7771: UDP, length 120
22:04:59.505578 IP 192.168.43.147.8880 > 192.168.43.124.7773: UDP, length 120
22:04:59.538447 IP 192.168.43.124.8880 > 192.168.43.146.7771: UDP, length 120
22:04:59.557133 IP 192.168.43.147.8880 > 192.168.43.124.7773: UDP, length 120
22:04:59.588315 IP 192.168.43.124.8880 > 192.168.43.146.7771: UDP, length 120
22:04:59.621423 IP 192.168.43.147.8880 > 192.168.43.124.7773: UDP, length 120
22:04:59.638415 IP 192.168.43.124.8880 > 192.168.43.146.7771: UDP, length 120
22:04:59.657824 IP 192.168.43.147.8880 > 192.168.43.124.7773: UDP, length 120
22:04:59.688416 IP 192.168.43.124.8880 > 192.168.43.146.7771: UDP, length 120
22:04:59.700288 IP 192.168.43.147.8880 > 192.168.43.124.7773: UDP, length 120
22:04:59.738443 IP 192.168.43.124.8880 > 192.168.43.146.7771: UDP, length 120
22:04:59.760298 IP 192.168.43.147.8880 > 192.168.43.124.7773: UDP, length 120
22:04:59.788398 IP 192.168.43.124.8880 > 192.168.43.146.7771: UDP, length 120
22:04:59.803876 IP 192.168.43.147.8880 > 192.168.43.124.7773: UDP, length 120
22:04:59.838395 IP 192.168.43.124.8880 > 192.168.43.146.7771: UDP, length 120
22:04:59.852802 IP 192.168.43.147.8880 > 192.168.43.124.7773: UDP, length 120
22:04:59.888313 IP 192.168.43.124.8880 > 192.168.43.146.7771: UDP, length 120
22:04:59.902715 IP 192.168.43.147.8880 > 192.168.43.124.7773: UDP, length 120
22:04:59.938395 IP 192.168.43.124.8880 > 192.168.43.146.7771: UDP, length 120
22:04:59.974325 IP 192.168.43.147.8880 > 192.168.43.124.7773: UDP, length 120
22:04:59.988402 IP 192.168.43.124.8880 > 192.168.43.146.7771: UDP, length 120
22:05:00.006183 IP 192.168.43.147.8880 > 192.168.43.124.7773: UDP, length 120
22:05:00.038402 IP 192.168.43.124.8880 > 192.168.43.146.7771: UDP, length 120
22:05:00.052786 IP 192.168.43.147.8880 > 192.168.43.124.7773: UDP, length 120
22:05:00.088381 IP 192.168.43.124.8880 > 192.168.43.146.7771: UDP, length 120
22:05:00.122074 IP 192.168.43.147.8880 > 192.168.43.124.7773: UDP, length 120
22:05:00.138396 IP 192.168.43.124.8880 > 192.168.43.146.7771: UDP, length 120
22:05:00.152805 IP 192.168.43.147.8880 > 192.168.43.124.7773: UDP, length 120
22:05:00.188397 IP 192.168.43.124.8880 > 192.168.43.146.7771: UDP, length 120
22:05:00.202736 IP 192.168.43.147.8880 > 192.168.43.124.7773: UDP, length 120
22:05:00.238340 IP 192.168.43.124.8880 > 192.168.43.146.7771: UDP, length 120
22:05:00.273573 IP 192.168.43.147.8880 > 192.168.43.124.7773: UDP, length 120
22:05:00.288397 IP 192.168.43.124.8880 > 192.168.43.146.7771: UDP, length 120
22:05:00.304027 IP 192.168.43.147.8880 > 192.168.43.124.7773: UDP, length 120
22:05:00.338399 IP 192.168.43.124.8880 > 192.168.43.146.7771: UDP, length 120
22:05:00.354355 IP 192.168.43.147.8880 > 192.168.43.124.7773: UDP, length 120
22:05:00.388402 IP 192.168.43.124.8880 > 192.168.43.146.7771: UDP, length 120
22:05:00.420843 IP 192.168.43.147.8880 > 192.168.43.124.7773: UDP, length 120
22:05:00.438397 IP 192.168.43.124.8880 > 192.168.43.146.7771: UDP, length 120
22:05:00.452785 IP 192.168.43.147.8880 > 192.168.43.124.7773: UDP, length 120
22:05:00.488324 IP 192.168.43.124.8880 > 192.168.43.146.7771: UDP, length 120
22:05:00.502526 IP 192.168.43.147.8880 > 192.168.43.124.7773: UDP, length 120
22:05:00.538293 IP 192.168.43.124.8880 > 192.168.43.146.7771: UDP, length 120
22:05:00.573209 IP 192.168.43.147.8880 > 192.168.43.124.7773: UDP, length 120
22:05:00.588395 IP 192.168.43.124.8880 > 192.168.43.146.7771: UDP, length 120
22:05:00.605622 IP 192.168.43.147.8880 > 192.168.43.124.7773: UDP, length 120
22:05:00.638396 IP 192.168.43.124.8880 > 192.168.43.146.7771: UDP, length 120
22:05:00.651988 IP 192.168.43.147.8880 > 192.168.43.124.7773: UDP, length 120
22:05:00.688397 IP 192.168.43.124.8880 > 192.168.43.146.7771: UDP, length 120
22:05:00.710358 IP 192.168.43.147.8880 > 192.168.43.124.7773: UDP, length 120
22:05:00.738340 IP 192.168.43.124.8880 > 192.168.43.146.7771: UDP, length 120
22:05:00.752749 IP 192.168.43.147.8880 > 192.168.43.124.7773: UDP, length 120
22:05:00.788397 IP 192.168.43.124.8880 > 192.168.43.146.7771: UDP, length 120
22:05:00.800092 IP 192.168.43.147.8880 > 192.168.43.124.7773: UDP, length 120
22:05:00.838362 IP 192.168.43.124.8880 > 192.168.43.146.7771: UDP, length 120
22:05:00.853377 IP 192.168.43.147.8880 > 192.168.43.124.7773: UDP, length 120
22:05:00.888448 IP 192.168.43.124.8880 > 192.168.43.146.7771: UDP, length 120
22:05:00.922721 IP 192.168.43.147.8880 > 192.168.43.124.7773: UDP, length 120
22:05:00.938396 IP 192.168.43.124.8880 > 192.168.43.146.7771: UDP, length 120
22:05:00.952680 IP 192.168.43.147.8880 > 192.168.43.124.7773: UDP, length 120
22:05:00.988359 IP 192.168.43.124.8880 > 192.168.43.146.7771: UDP, length 120
22:05:01.002864 IP 192.168.43.147.8880 > 192.168.43.124.7773: UDP, length 120
22:05:01.038444 IP 192.168.43.124.8880 > 192.168.43.146.7771: UDP, length 120
22:05:01.070007 IP 192.168.43.147.8880 > 192.168.43.124.7773: UDP, length 120
22:05:01.088351 IP 192.168.43.124.8880 > 192.168.43.146.7771: UDP, length 120
22:05:01.103339 IP 192.168.43.147.8880 > 192.168.43.124.7773: UDP, length 120
22:05:01.138395 IP 192.168.43.124.8880 > 192.168.43.146.7771: UDP, length 120
22:05:01.152782 IP 192.168.43.147.8880 > 192.168.43.124.7773: UDP, length 120
22:05:01.188451 IP 192.168.43.124.8880 > 192.168.43.146.7771: UDP, length 120
22:05:01.209695 IP 192.168.43.147.8880 > 192.168.43.124.7773: UDP, length 120
22:05:01.238326 IP 192.168.43.124.8880 > 192.168.43.146.7771: UDP, length 120
22:05:01.249863 IP 192.168.43.147.8880 > 192.168.43.124.7773: UDP, length 120
22:05:01.288343 IP 192.168.43.124.8880 > 192.168.43.146.7771: UDP, length 120
22:05:01.318007 IP 192.168.43.147.8880 > 192.168.43.124.7773: UDP, length 120
22:05:01.338449 IP 192.168.43.124.8880 > 192.168.43.146.7771: UDP, length 120
22:05:01.353085 IP 192.168.43.147.8880 > 192.168.43.124.7773: UDP, length 120
22:05:01.388360 IP 192.168.43.124.8880 > 192.168.43.146.7771: UDP, length 120
22:05:01.402961 IP 192.168.43.147.8880 > 192.168.43.124.7773: UDP, length 120
22:05:01.438489 IP 192.168.43.124.8880 > 192.168.43.146.7771: UDP, length 120
22:05:01.472010 IP 192.168.43.147.8880 > 192.168.43.124.7773: UDP, length 120
22:05:01.488370 IP 192.168.43.124.8880 > 192.168.43.146.7771: UDP, length 120
22:05:01.503415 IP 192.168.43.147.8880 > 192.168.43.124.7773: UDP, length 120
22:05:01.538420 IP 192.168.43.124.8880 > 192.168.43.146.7771: UDP, length 120
22:05:01.553127 IP 192.168.43.147.8880 > 192.168.43.124.7773: UDP, length 120
22:05:01.588359 IP 192.168.43.124.8880 > 192.168.43.146.7771: UDP, length 120
22:05:01.620452 IP 192.168.43.147.8880 > 192.168.43.124.7773: UDP, length 120
22:05:01.638338 IP 192.168.43.124.8880 > 192.168.43.146.7771: UDP, length 120
22:05:01.654669 IP 192.168.43.147.8880 > 192.168.43.124.7773: UDP, length 120
22:05:01.688317 IP 192.168.43.124.8880 > 192.168.43.146.7771: UDP, length 120
22:05:01.700588 IP 192.168.43.147.8880 > 192.168.43.124.7773: UDP, length 120
22:05:01.738359 IP 192.168.43.124.8880 > 192.168.43.146.7771: UDP, length 120
22:05:01.760664 IP 192.168.43.147.8880 > 192.168.43.124.7773: UDP, length 120
22:05:01.788473 IP 192.168.43.124.8880 > 192.168.43.146.7771: UDP, length 120
22:05:01.807346 IP 192.168.43.147.8880 > 192.168.43.124.7773: UDP, length 120
22:05:01.838400 IP 192.168.43.124.8880 > 192.168.43.146.7771: UDP, length 120
22:05:01.856165 IP 192.168.43.147.8880 > 192.168.43.124.7773: UDP, length 120
22:05:01.888396 IP 192.168.43.124.8880 > 192.168.43.146.7771: UDP, length 120
22:05:01.902642 IP 192.168.43.147.8880 > 192.168.43.124.7773: UDP, length 120
22:05:01.938361 IP 192.168.43.124.8880 > 192.168.43.146.7771: UDP, length 120
22:05:01.970362 IP 192.168.43.147.8880 > 192.168.43.124.7773: UDP, length 120
22:05:01.988448 IP 192.168.43.124.8880 > 192.168.43.146.7771: UDP, length 120
22:05:02.005202 IP 192.168.43.147.8880 > 192.168.43.124.7773: UDP, length 120
22:05:02.038396 IP 192.168.43.124.8880 > 192.168.43.146.7771: UDP, length 120
22:05:02.055613 IP 192.168.43.147.8880 > 192.168.43.124.7773: UDP, length 120
22:05:02.088395 IP 192.168.43.124.8880 > 192.168.43.146.7771: UDP, length 120
22:05:02.120535 IP 192.168.43.147.8880 > 192.168.43.124.7773: UDP, length 120
22:05:02.138395 IP 192.168.43.124.8880 > 192.168.43.146.7771: UDP, length 120
22:05:02.154540 IP 192.168.43.147.8880 > 192.168.43.124.7773: UDP, length 120
22:05:02.188397 IP 192.168.43.124.8880 > 192.168.43.146.7771: UDP, length 120
22:05:02.203686 IP 192.168.43.147.8880 > 192.168.43.124.7773: UDP, length 120
22:05:02.238399 IP 192.168.43.124.8880 > 192.168.43.146.7771: UDP, length 120
22:05:02.253485 IP 192.168.43.147.8880 > 192.168.43.124.7773: UDP, length 120
22:05:02.288398 IP 192.168.43.124.8880 > 192.168.43.146.7771: UDP, length 120
22:05:02.322269 IP 192.168.43.147.8880 > 192.168.43.124.7773: UDP, length 120
22:05:02.338402 IP 192.168.43.124.8880 > 192.168.43.146.7771: UDP, length 120
22:05:02.353724 IP 192.168.43.147.8880 > 192.168.43.124.7773: UDP, length 120
22:05:02.388398 IP 192.168.43.124.8880 > 192.168.43.146.7771: UDP, length 120
22:05:02.401791 IP 192.168.43.147.8880 > 192.168.43.124.7773: UDP, length 120
22:05:02.438398 IP 192.168.43.124.8880 > 192.168.43.146.7771: UDP, length 120
22:05:02.462645 IP 192.168.43.147.8880 > 192.168.43.124.7773: UDP, length 120
22:05:02.488403 IP 192.168.43.124.8880 > 192.168.43.146.7771: UDP, length 120
22:05:02.505401 IP 192.168.43.147.8880 > 192.168.43.124.7773: UDP, length 120
22:05:02.538400 IP 192.168.43.124.8880 > 192.168.43.146.7771: UDP, length 120
22:05:02.553090 IP 192.168.43.147.8880 > 192.168.43.124.7773: UDP, length 120
22:05:02.588334 IP 192.168.43.124.8880 > 192.168.43.146.7771: UDP, length 120
22:05:02.605874 IP 192.168.43.147.8880 > 192.168.43.124.7773: UDP, length 120
22:05:02.638317 IP 192.168.43.124.8880 > 192.168.43.146.7771: UDP, length 120
22:05:02.673893 IP 192.168.43.147.8880 > 192.168.43.124.7773: UDP, length 120
22:05:02.688341 IP 192.168.43.124.8880 > 192.168.43.146.7771: UDP, length 120
22:05:02.703184 IP 192.168.43.147.8880 > 192.168.43.124.7773: UDP, length 120
22:05:02.738393 IP 192.168.43.124.8880 > 192.168.43.146.7771: UDP, length 120
22:05:02.751863 IP 192.168.43.147.8880 > 192.168.43.124.7773: UDP, length 120
22:05:02.788346 IP 192.168.43.124.8880 > 192.168.43.146.7771: UDP, length 120
22:05:02.815563 IP 192.168.43.147.8880 > 192.168.43.124.7773: UDP, length 120
22:05:02.838397 IP 192.168.43.124.8880 > 192.168.43.146.7771: UDP, length 120
22:05:02.857893 IP 192.168.43.147.8880 > 192.168.43.124.7773: UDP, length 120
22:05:02.888398 IP 192.168.43.124.8880 > 192.168.43.146.7771: UDP, length 120
22:05:02.906156 IP 192.168.43.147.8880 > 192.168.43.124.7773: UDP, length 120
22:05:02.938399 IP 192.168.43.124.8880 > 192.168.43.146.7771: UDP, length 120
22:05:02.955588 IP 192.168.43.147.8880 > 192.168.43.124.7773: UDP, length 120
22:05:02.988395 IP 192.168.43.124.8880 > 192.168.43.146.7771: UDP, length 120
22:05:03.002783 IP 192.168.43.147.8880 > 192.168.43.124.7773: UDP, length 120
22:05:03.038333 IP 192.168.43.124.8880 > 192.168.43.146.7771: UDP, length 120
22:05:03.070929 IP 192.168.43.147.8880 > 192.168.43.124.7773: UDP, length 120
22:05:03.088396 IP 192.168.43.124.8880 > 192.168.43.146.7771: UDP, length 120
22:05:03.103705 IP 192.168.43.147.8880 > 192.168.43.124.7773: UDP, length 120
22:05:03.138396 IP 192.168.43.124.8880 > 192.168.43.146.7771: UDP, length 120
22:05:03.155753 IP 192.168.43.147.8880 > 192.168.43.124.7773: UDP, length 120
22:05:03.188410 IP 192.168.43.124.8880 > 192.168.43.146.7771: UDP, length 120
22:05:03.204306 IP 192.168.43.147.8880 > 192.168.43.124.7773: UDP, length 120
22:05:03.238398 IP 192.168.43.124.8880 > 192.168.43.146.7771: UDP, length 120
22:05:03.254638 IP 192.168.43.147.8880 > 192.168.43.124.7773: UDP, length 120
22:05:03.288397 IP 192.168.43.124.8880 > 192.168.43.146.7771: UDP, length 120
22:05:03.322047 IP 192.168.43.147.8880 > 192.168.43.124.7773: UDP, length 120
22:05:03.338399 IP 192.168.43.124.8880 > 192.168.43.146.7771: UDP, length 120
22:05:03.361304 IP 192.168.43.147.8880 > 192.168.43.124.7773: UDP, length 120
22:05:03.388396 IP 192.168.43.124.8880 > 192.168.43.146.7771: UDP, length 120
22:05:03.400707 IP 192.168.43.147.8880 > 192.168.43.124.7773: UDP, length 120
22:05:03.438317 IP 192.168.43.124.8880 > 192.168.43.146.7771: UDP, length 120
22:05:03.461842 IP 192.168.43.147.8880 > 192.168.43.124.7773: UDP, length 120
22:05:03.488398 IP 192.168.43.124.8880 > 192.168.43.146.7771: UDP, length 120
22:05:03.502871 IP 192.168.43.147.8880 > 192.168.43.124.7773: UDP, length 120
22:05:03.538399 IP 192.168.43.124.8880 > 192.168.43.146.7771: UDP, length 120
22:05:03.553556 IP 192.168.43.147.8880 > 192.168.43.124.7773: UDP, length 120
22:05:03.588396 IP 192.168.43.124.8880 > 192.168.43.146.7771: UDP, length 120
22:05:03.605719 IP 192.168.43.147.8880 > 192.168.43.124.7773: UDP, length 120
22:05:03.638397 IP 192.168.43.124.8880 > 192.168.43.146.7771: UDP, length 120
22:05:03.675213 IP 192.168.43.147.8880 > 192.168.43.124.7773: UDP, length 120
22:05:03.688417 IP 192.168.43.124.8880 > 192.168.43.146.7771: UDP, length 120
22:05:03.706084 IP 192.168.43.147.8880 > 192.168.43.124.7773: UDP, length 120
22:05:03.738376 IP 192.168.43.124.8880 > 192.168.43.146.7771: UDP, length 120
22:05:03.750740 IP 192.168.43.147.8880 > 192.168.43.124.7773: UDP, length 120
22:05:03.788400 IP 192.168.43.124.8880 > 192.168.43.146.7771: UDP, length 120
22:05:03.806195 IP 192.168.43.147.8880 > 192.168.43.124.7773: UDP, length 120
22:05:03.838449 IP 192.168.43.124.8880 > 192.168.43.146.7771: UDP, length 120
22:05:03.857740 IP 192.168.43.147.8880 > 192.168.43.124.7773: UDP, length 120
22:05:03.888448 IP 192.168.43.124.8880 > 192.168.43.146.7771: UDP, length 120
22:05:03.905829 IP 192.168.43.147.8880 > 192.168.43.124.7773: UDP, length 120
22:05:03.938368 IP 192.168.43.124.8880 > 192.168.43.146.7771: UDP, length 120
22:05:03.955000 IP 192.168.43.147.8880 > 192.168.43.124.7773: UDP, length 120
22:05:03.988338 IP 192.168.43.124.8880 > 192.168.43.146.7771: UDP, length 120
22:05:04.005540 IP 192.168.43.147.8880 > 192.168.43.124.7773: UDP, length 120
22:05:04.038396 IP 192.168.43.124.8880 > 192.168.43.146.7771: UDP, length 120
22:05:04.054499 IP 192.168.43.147.8880 > 192.168.43.124.7773: UDP, length 120
22:05:04.088356 IP 192.168.43.124.8880 > 192.168.43.146.7771: UDP, length 120
22:05:04.103799 IP 192.168.43.147.8880 > 192.168.43.124.7773: UDP, length 120
22:05:04.138397 IP 192.168.43.124.8880 > 192.168.43.146.7771: UDP, length 120
22:05:04.153377 IP 192.168.43.147.8880 > 192.168.43.124.7773: UDP, length 120
22:05:04.188352 IP 192.168.43.124.8880 > 192.168.43.146.7771: UDP, length 120
22:05:04.202034 IP 192.168.43.147.8880 > 192.168.43.124.7773: UDP, length 120
22:05:04.238388 IP 192.168.43.124.8880 > 192.168.43.146.7771: UDP, length 120
22:05:04.256526 IP 192.168.43.147.8880 > 192.168.43.124.7773: UDP, length 120
22:05:04.288453 IP 192.168.43.124.8880 > 192.168.43.146.7771: UDP, length 120
22:05:04.305165 IP 192.168.43.147.8880 > 192.168.43.124.7773: UDP, length 120
22:05:04.338449 IP 192.168.43.124.8880 > 192.168.43.146.7771: UDP, length 120
22:05:04.355121 IP 192.168.43.147.8880 > 192.168.43.124.7773: UDP, length 120
22:05:04.388450 IP 192.168.43.124.8880 > 192.168.43.146.7771: UDP, length 120
22:05:04.405721 IP 192.168.43.147.8880 > 192.168.43.124.7773: UDP, length 120
22:05:04.438452 IP 192.168.43.124.8880 > 192.168.43.146.7771: UDP, length 120
22:05:04.481692 IP 192.168.43.147.8880 > 192.168.43.124.7773: UDP, length 120
22:05:04.488453 IP 192.168.43.124.8880 > 192.168.43.146.7771: UDP, length 120
22:05:04.505159 IP 192.168.43.147.8880 > 192.168.43.124.7773: UDP, length 120
22:05:04.538450 IP 192.168.43.124.8880 > 192.168.43.146.7771: UDP, length 120
22:05:04.557336 IP 192.168.43.147.8880 > 192.168.43.124.7773: UDP, length 120
22:05:04.588452 IP 192.168.43.124.8880 > 192.168.43.146.7771: UDP, length 120
22:05:04.607326 IP 192.168.43.147.8880 > 192.168.43.124.7773: UDP, length 120
22:05:04.638380 IP 192.168.43.124.8880 > 192.168.43.146.7771: UDP, length 120
22:05:04.655381 IP 192.168.43.147.8880 > 192.168.43.124.7773: UDP, length 120
22:05:04.688451 IP 192.168.43.124.8880 > 192.168.43.146.7771: UDP, length 120
22:05:04.705750 IP 192.168.43.147.8880 > 192.168.43.124.7773: UDP, length 120
22:05:04.738451 IP 192.168.43.124.8880 > 192.168.43.146.7771: UDP, length 120
22:05:04.755086 IP 192.168.43.147.8880 > 192.168.43.124.7773: UDP, length 120
22:05:04.788401 IP 192.168.43.124.8880 > 192.168.43.146.7771: UDP, length 120
22:05:04.805725 IP 192.168.43.147.8880 > 192.168.43.124.7773: UDP, length 120
22:05:04.838396 IP 192.168.43.124.8880 > 192.168.43.146.7771: UDP, length 120
22:05:04.854883 IP 192.168.43.147.8880 > 192.168.43.124.7773: UDP, length 120
22:05:04.888400 IP 192.168.43.124.8880 > 192.168.43.146.7771: UDP, length 120
22:05:04.906409 IP 192.168.43.147.8880 > 192.168.43.124.7773: UDP, length 120
22:05:04.938439 IP 192.168.43.124.8880 > 192.168.43.146.7771: UDP, length 120
22:05:04.956940 IP 192.168.43.147.8880 > 192.168.43.124.7773: UDP, length 120
22:05:04.988393 IP 192.168.43.124.8880 > 192.168.43.146.7771: UDP, length 120
22:05:05.008835 IP 192.168.43.147.8880 > 192.168.43.124.7773: UDP, length 120
22:05:05.038396 IP 192.168.43.124.8880 > 192.168.43.146.7771: UDP, length 120
22:05:05.051653 IP 192.168.43.147.8880 > 192.168.43.124.7773: UDP, length 120
22:05:05.088398 IP 192.168.43.124.8880 > 192.168.43.146.7771: UDP, length 120
22:05:05.102303 IP 192.168.43.147.8880 > 192.168.43.124.7773: UDP, length 120
22:05:05.138396 IP 192.168.43.124.8880 > 192.168.43.146.7771: UDP, length 120
22:05:05.154578 IP 192.168.43.147.8880 > 192.168.43.124.7773: UDP, length 120
22:05:05.188398 IP 192.168.43.124.8880 > 192.168.43.146.7771: UDP, length 120
22:05:05.204602 IP 192.168.43.147.8880 > 192.168.43.124.7773: UDP, length 120
22:05:05.238398 IP 192.168.43.124.8880 > 192.168.43.146.7771: UDP, length 120
22:05:05.254635 IP 192.168.43.147.8880 > 192.168.43.124.7773: UDP, length 120
22:05:05.288400 IP 192.168.43.124.8880 > 192.168.43.146.7771: UDP, length 120
22:05:05.307356 IP 192.168.43.147.8880 > 192.168.43.124.7773: UDP, length 120
22:05:05.338396 IP 192.168.43.124.8880 > 192.168.43.146.7771: UDP, length 120
22:05:05.356112 IP 192.168.43.147.8880 > 192.168.43.124.7773: UDP, length 120
22:05:05.388395 IP 192.168.43.124.8880 > 192.168.43.146.7771: UDP, length 120
22:05:05.407270 IP 192.168.43.147.8880 > 192.168.43.124.7773: UDP, length 120
22:05:05.438396 IP 192.168.43.124.8880 > 192.168.43.146.7771: UDP, length 120
22:05:05.454242 IP 192.168.43.147.8880 > 192.168.43.124.7773: UDP, length 120
22:05:05.488397 IP 192.168.43.124.8880 > 192.168.43.146.7771: UDP, length 120
22:05:05.504674 IP 192.168.43.147.8880 > 192.168.43.124.7773: UDP, length 120
22:05:05.538452 IP 192.168.43.124.8880 > 192.168.43.146.7771: UDP, length 120
22:05:05.555691 IP 192.168.43.147.8880 > 192.168.43.124.7773: UDP, length 120
22:05:05.588449 IP 192.168.43.124.8880 > 192.168.43.146.7771: UDP, length 120
22:05:05.605576 IP 192.168.43.147.8880 > 192.168.43.124.7773: UDP, length 120
22:05:05.638450 IP 192.168.43.124.8880 > 192.168.43.146.7771: UDP, length 120
22:05:05.655094 IP 192.168.43.147.8880 > 192.168.43.124.7773: UDP, length 120
22:05:05.688451 IP 192.168.43.124.8880 > 192.168.43.146.7771: UDP, length 120
22:05:05.707471 IP 192.168.43.147.8880 > 192.168.43.124.7773: UDP, length 120
22:05:05.738451 IP 192.168.43.124.8880 > 192.168.43.146.7771: UDP, length 120
22:05:05.757505 IP 192.168.43.147.8880 > 192.168.43.124.7773: UDP, length 120
22:05:05.788428 IP 192.168.43.124.8880 > 192.168.43.146.7771: UDP, length 120
22:05:05.804381 IP 192.168.43.147.8880 > 192.168.43.124.7773: UDP, length 120
22:05:05.838397 IP 192.168.43.124.8880 > 192.168.43.146.7771: UDP, length 120
22:05:05.857675 IP 192.168.43.147.8880 > 192.168.43.124.7773: UDP, length 120
22:05:05.888397 IP 192.168.43.124.8880 > 192.168.43.146.7771: UDP, length 120
22:05:05.901588 IP 192.168.43.147.8880 > 192.168.43.124.7773: UDP, length 120
22:05:05.938399 IP 192.168.43.124.8880 > 192.168.43.146.7771: UDP, length 120
22:05:05.952426 IP 192.168.43.147.8880 > 192.168.43.124.7773: UDP, length 120
22:05:05.988337 IP 192.168.43.124.8880 > 192.168.43.146.7771: UDP, length 120
22:05:06.002452 IP 192.168.43.147.8880 > 192.168.43.124.7773: UDP, length 120
22:05:06.038396 IP 192.168.43.124.8880 > 192.168.43.146.7771: UDP, length 120
22:05:06.052449 IP 192.168.43.147.8880 > 192.168.43.124.7773: UDP, length 120
22:05:06.088395 IP 192.168.43.124.8880 > 192.168.43.146.7771: UDP, length 120
22:05:06.102829 IP 192.168.43.147.8880 > 192.168.43.124.7773: UDP, length 120
22:05:06.138397 IP 192.168.43.124.8880 > 192.168.43.146.7771: UDP, length 120
22:05:06.155332 IP 192.168.43.147.8880 > 192.168.43.124.7773: UDP, length 120
22:05:06.188399 IP 192.168.43.124.8880 > 192.168.43.146.7771: UDP, length 120
22:05:06.211057 IP 192.168.43.147.8880 > 192.168.43.124.7773: UDP, length 120
22:05:06.238394 IP 192.168.43.124.8880 > 192.168.43.146.7771: UDP, length 120
22:05:06.267662 IP 192.168.43.147.8880 > 192.168.43.124.7773: UDP, length 120
22:05:06.288447 IP 192.168.43.124.8880 > 192.168.43.146.7771: UDP, length 120
22:05:06.303307 IP 192.168.43.147.8880 > 192.168.43.124.7773: UDP, length 120
22:05:06.338447 IP 192.168.43.124.8880 > 192.168.43.146.7771: UDP, length 120
22:05:06.353299 IP 192.168.43.147.8880 > 192.168.43.124.7773: UDP, length 120
22:05:06.388401 IP 192.168.43.124.8880 > 192.168.43.146.7771: UDP, length 120
22:05:06.404498 IP 192.168.43.147.8880 > 192.168.43.124.7773: UDP, length 120
22:05:06.438400 IP 192.168.43.124.8880 > 192.168.43.146.7771: UDP, length 120
22:05:06.450169 IP 192.168.43.147.8880 > 192.168.43.124.7773: UDP, length 120
22:05:06.488400 IP 192.168.43.124.8880 > 192.168.43.146.7771: UDP, length 120
22:05:06.502958 IP 192.168.43.147.8880 > 192.168.43.124.7773: UDP, length 120
22:05:06.538401 IP 192.168.43.124.8880 > 192.168.43.146.7771: UDP, length 120
22:05:06.552719 IP 192.168.43.147.8880 > 192.168.43.124.7773: UDP, length 120
22:05:06.588402 IP 192.168.43.124.8880 > 192.168.43.146.7771: UDP, length 120
22:05:06.602748 IP 192.168.43.147.8880 > 192.168.43.124.7773: UDP, length 120
22:05:06.638399 IP 192.168.43.124.8880 > 192.168.43.146.7771: UDP, length 120
22:05:06.651287 IP 192.168.43.147.8880 > 192.168.43.124.7773: UDP, length 120
22:05:06.688342 IP 192.168.43.124.8880 > 192.168.43.146.7771: UDP, length 120
22:05:06.702429 IP 192.168.43.147.8880 > 192.168.43.124.7773: UDP, length 120
22:05:06.738319 IP 192.168.43.124.8880 > 192.168.43.146.7771: UDP, length 120
22:05:06.754043 IP 192.168.43.147.8880 > 192.168.43.124.7773: UDP, length 120
22:05:06.788398 IP 192.168.43.124.8880 > 192.168.43.146.7771: UDP, length 120
22:05:06.813232 IP 192.168.43.147.8880 > 192.168.43.124.7773: UDP, length 120
22:05:06.838394 IP 192.168.43.124.8880 > 192.168.43.146.7771: UDP, length 120
22:05:06.868728 IP 192.168.43.147.8880 > 192.168.43.124.7773: UDP, length 120
22:05:06.888397 IP 192.168.43.124.8880 > 192.168.43.146.7771: UDP, length 120
22:05:06.903347 IP 192.168.43.147.8880 > 192.168.43.124.7773: UDP, length 120
22:05:06.938396 IP 192.168.43.124.8880 > 192.168.43.146.7771: UDP, length 120
22:05:06.954276 IP 192.168.43.147.8880 > 192.168.43.124.7773: UDP, length 120
22:05:06.988399 IP 192.168.43.124.8880 > 192.168.43.146.7771: UDP, length 120
22:05:07.003817 IP 192.168.43.147.8880 > 192.168.43.124.7773: UDP, length 120
22:05:07.038397 IP 192.168.43.124.8880 > 192.168.43.146.7771: UDP, length 120
22:05:07.058833 IP 192.168.43.147.8880 > 192.168.43.124.7773: UDP, length 120
22:05:07.088396 IP 192.168.43.124.8880 > 192.168.43.146.7771: UDP, length 120
22:05:07.108922 IP 192.168.43.147.8880 > 192.168.43.124.7773: UDP, length 120
22:05:07.138397 IP 192.168.43.124.8880 > 192.168.43.146.7771: UDP, length 120
22:05:07.156408 IP 192.168.43.147.8880 > 192.168.43.124.7773: UDP, length 120
22:05:07.188398 IP 192.168.43.124.8880 > 192.168.43.146.7771: UDP, length 120
22:05:07.211447 IP 192.168.43.147.8880 > 192.168.43.124.7773: UDP, length 120
22:05:07.238395 IP 192.168.43.124.8880 > 192.168.43.146.7771: UDP, length 120
22:05:07.264108 IP 192.168.43.147.8880 > 192.168.43.124.7773: UDP, length 120
22:05:07.288400 IP 192.168.43.124.8880 > 192.168.43.146.7771: UDP, length 120
22:05:07.305065 IP 192.168.43.147.8880 > 192.168.43.124.7773: UDP, length 120
22:05:07.338399 IP 192.168.43.124.8880 > 192.168.43.146.7771: UDP, length 120
22:05:07.366436 IP 192.168.43.147.8880 > 192.168.43.124.7773: UDP, length 120
22:05:07.388397 IP 192.168.43.124.8880 > 192.168.43.146.7771: UDP, length 120
22:05:07.405578 IP 192.168.43.147.8880 > 192.168.43.124.7773: UDP, length 120
22:05:07.438397 IP 192.168.43.124.8880 > 192.168.43.146.7771: UDP, length 120
22:05:07.457406 IP 192.168.43.147.8880 > 192.168.43.124.7773: UDP, length 120
22:05:07.488398 IP 192.168.43.124.8880 > 192.168.43.146.7771: UDP, length 120
22:05:07.504883 IP 192.168.43.147.8880 > 192.168.43.124.7773: UDP, length 120
22:05:07.538400 IP 192.168.43.124.8880 > 192.168.43.146.7771: UDP, length 120
22:05:07.568879 IP 192.168.43.147.8880 > 192.168.43.124.7773: UDP, length 120
22:05:07.588397 IP 192.168.43.124.8880 > 192.168.43.146.7771: UDP, length 120
22:05:07.603795 IP 192.168.43.147.8880 > 192.168.43.124.7773: UDP, length 120
22:05:07.638393 IP 192.168.43.124.8880 > 192.168.43.146.7771: UDP, length 120
22:05:07.655294 IP 192.168.43.147.8880 > 192.168.43.124.7773: UDP, length 120
22:05:07.688332 IP 192.168.43.124.8880 > 192.168.43.146.7771: UDP, length 120
22:05:07.705867 IP 192.168.43.147.8880 > 192.168.43.124.7773: UDP, length 120
22:05:07.738317 IP 192.168.43.124.8880 > 192.168.43.146.7771: UDP, length 120
22:05:07.755405 IP 192.168.43.147.8880 > 192.168.43.124.7773: UDP, length 120
22:05:07.788360 IP 192.168.43.124.8880 > 192.168.43.146.7771: UDP, length 120
22:05:07.819812 IP 192.168.43.147.8880 > 192.168.43.124.7773: UDP, length 120
22:05:07.838398 IP 192.168.43.124.8880 > 192.168.43.146.7771: UDP, length 120
22:05:07.888398 IP 192.168.43.124.8880 > 192.168.43.146.7771: UDP, length 120
22:05:07.906073 IP 192.168.43.147.8880 > 192.168.43.124.7773: UDP, length 120
22:05:07.908564 IP 192.168.43.147.8880 > 192.168.43.124.7773: UDP, length 120
22:05:07.938396 IP 192.168.43.124.8880 > 192.168.43.146.7771: UDP, length 120
22:05:07.963042 IP 192.168.43.147.8880 > 192.168.43.124.7773: UDP, length 120
22:05:07.988396 IP 192.168.43.124.8880 > 192.168.43.146.7771: UDP, length 120
22:05:08.008289 IP 192.168.43.147.8880 > 192.168.43.124.7773: UDP, length 120
22:05:08.038397 IP 192.168.43.124.8880 > 192.168.43.146.7771: UDP, length 120
22:05:08.088397 IP 192.168.43.124.8880 > 192.168.43.146.7771: UDP, length 120
22:05:08.113989 IP 192.168.43.147.8880 > 192.168.43.124.7773: UDP, length 120
22:05:08.114001 IP 192.168.43.147.8880 > 192.168.43.124.7773: UDP, length 120
22:05:08.138394 IP 192.168.43.124.8880 > 192.168.43.146.7771: UDP, length 120
22:05:08.158787 IP 192.168.43.147.8880 > 192.168.43.124.7773: UDP, length 120
22:05:08.188396 IP 192.168.43.124.8880 > 192.168.43.146.7771: UDP, length 120
22:05:08.213333 IP 192.168.43.147.8880 > 192.168.43.124.7773: UDP, length 120
22:05:08.238395 IP 192.168.43.124.8880 > 192.168.43.146.7771: UDP, length 120
22:05:08.257696 IP 192.168.43.147.8880 > 192.168.43.124.7773: UDP, length 120
22:05:08.288397 IP 192.168.43.124.8880 > 192.168.43.146.7771: UDP, length 120
22:05:08.315668 IP 192.168.43.147.8880 > 192.168.43.124.7773: UDP, length 120
22:05:08.338400 IP 192.168.43.124.8880 > 192.168.43.146.7771: UDP, length 120
22:05:08.354709 IP 192.168.43.147.8880 > 192.168.43.124.7773: UDP, length 120
22:05:08.388397 IP 192.168.43.124.8880 > 192.168.43.146.7771: UDP, length 120
22:05:08.404570 IP 192.168.43.147.8880 > 192.168.43.124.7773: UDP, length 120
22:05:08.438395 IP 192.168.43.124.8880 > 192.168.43.146.7771: UDP, length 120
22:05:08.457637 IP 192.168.43.147.8880 > 192.168.43.124.7773: UDP, length 120
22:05:08.488331 IP 192.168.43.124.8880 > 192.168.43.146.7771: UDP, length 120
22:05:08.504624 IP 192.168.43.147.8880 > 192.168.43.124.7773: UDP, length 120
22:05:08.538344 IP 192.168.43.124.8880 > 192.168.43.146.7771: UDP, length 120
22:05:08.565529 IP 192.168.43.147.8880 > 192.168.43.124.7773: UDP, length 120
22:05:08.588346 IP 192.168.43.124.8880 > 192.168.43.146.7771: UDP, length 120
22:05:08.604835 IP 192.168.43.147.8880 > 192.168.43.124.7773: UDP, length 120
22:05:08.638400 IP 192.168.43.124.8880 > 192.168.43.146.7771: UDP, length 120
22:05:08.653788 IP 192.168.43.147.8880 > 192.168.43.124.7773: UDP, length 120
22:05:08.688399 IP 192.168.43.124.8880 > 192.168.43.146.7771: UDP, length 120
22:05:08.705969 IP 192.168.43.147.8880 > 192.168.43.124.7773: UDP, length 120
22:05:08.738400 IP 192.168.43.124.8880 > 192.168.43.146.7771: UDP, length 120
22:05:08.755659 IP 192.168.43.147.8880 > 192.168.43.124.7773: UDP, length 120
22:05:08.788401 IP 192.168.43.124.8880 > 192.168.43.146.7771: UDP, length 120
22:05:08.806325 IP 192.168.43.147.8880 > 192.168.43.124.7773: UDP, length 120
22:05:08.838396 IP 192.168.43.124.8880 > 192.168.43.146.7771: UDP, length 120
22:05:08.854806 IP 192.168.43.147.8880 > 192.168.43.124.7773: UDP, length 120
22:05:08.888397 IP 192.168.43.124.8880 > 192.168.43.146.7771: UDP, length 120
22:05:08.906913 IP 192.168.43.147.8880 > 192.168.43.124.7773: UDP, length 120
22:05:08.938396 IP 192.168.43.124.8880 > 192.168.43.146.7771: UDP, length 120
22:05:08.954653 IP 192.168.43.147.8880 > 192.168.43.124.7773: UDP, length 120
22:05:08.988399 IP 192.168.43.124.8880 > 192.168.43.146.7771: UDP, length 120
22:05:09.005107 IP 192.168.43.147.8880 > 192.168.43.124.7773: UDP, length 120
22:05:09.038396 IP 192.168.43.124.8880 > 192.168.43.146.7771: UDP, length 120
22:05:09.055375 IP 192.168.43.147.8880 > 192.168.43.124.7773: UDP, length 120
22:05:09.088396 IP 192.168.43.124.8880 > 192.168.43.146.7771: UDP, length 120
22:05:09.104416 IP 192.168.43.147.8880 > 192.168.43.124.7773: UDP, length 120
22:05:09.138397 IP 192.168.43.124.8880 > 192.168.43.146.7771: UDP, length 120
22:05:09.154458 IP 192.168.43.147.8880 > 192.168.43.124.7773: UDP, length 120
22:05:09.188398 IP 192.168.43.124.8880 > 192.168.43.146.7771: UDP, length 120
22:05:09.207299 IP 192.168.43.147.8880 > 192.168.43.124.7773: UDP, length 120
22:05:09.238451 IP 192.168.43.124.8880 > 192.168.43.146.7771: UDP, length 120
22:05:09.258312 IP 192.168.43.147.8880 > 192.168.43.124.7773: UDP, length 120
22:05:09.288451 IP 192.168.43.124.8880 > 192.168.43.146.7771: UDP, length 120
