00:14:10.345241 IP 192.168.43.124.8880 > 192.168.43.146.7771: UDP, length 120
00:14:10.383708 IP 192.168.43.124.8880 > 192.168.43.146.7771: UDP, length 120
00:14:10.443720 IP 192.168.43.124.8880 > 192.168.43.146.7771: UDP, length 120
00:14:10.483429 IP 192.168.43.124.8880 > 192.168.43.146.7771: UDP, length 120
00:14:10.543366 IP 192.168.43.124.8880 > 192.168.43.146.7771: UDP, length 120
00:14:10.583465 IP 192.168.43.124.8880 > 192.168.43.146.7771: UDP, length 120
00:14:10.643503 IP 192.168.43.124.8880 > 192.168.43.146.7771: UDP, length 120
00:14:10.683053 IP 192.168.43.124.8880 > 192.168.43.146.7771: UDP, length 120
00:14:10.734288 IP 192.168.43.124.8880 > 192.168.43.146.7771: UDP, length 120
00:14:10.763485 IP 192.168.43.146.8880 > 192.168.43.147.7772: UDP, length 120
00:14:10.796294 IP 192.168.43.124.8880 > 192.168.43.146.7771: UDP, length 120
00:14:10.813547 IP 192.168.43.146.8880 > 192.168.43.147.7772: UDP, length 120
00:14:10.830833 IP 192.168.43.124.8880 > 192.168.43.146.7771: UDP, length 120
00:14:10.863526 IP 192.168.43.146.8880 > 192.168.43.147.7772: UDP, length 120
00:14:10.880279 IP 192.168.43.124.8880 > 192.168.43.146.7771: UDP, length 120
00:14:10.913521 IP 192.168.43.146.8880 > 192.168.43.147.7772: UDP, length 120
00:14:10.954559 IP 192.168.43.124.8880 > 192.168.43.146.7771: UDP, length 120
00:14:10.963518 IP 192.168.43.146.8880 > 192.168.43.147.7772: UDP, length 120
00:14:10.984995 IP 192.168.43.124.8880 > 192.168.43.146.7771: UDP, length 120
00:14:11.013519 IP 192.168.43.146.8880 > 192.168.43.147.7772: UDP, length 120
00:14:11.037245 IP 192.168.43.124.8880 > 192.168.43.146.7771: UDP, length 120
00:14:11.063528 IP 192.168.43.146.8880 > 192.168.43.147.7772: UDP, length 120
00:14:11.104913 IP 192.168.43.124.8880 > 192.168.43.146.7771: UDP, length 120
00:14:11.113528 IP 192.168.43.146.8880 > 192.168.43.147.7772: UDP, length 120
00:14:11.130479 IP 192.168.43.124.8880 > 192.168.43.146.7771: UDP, length 120
00:14:11.163519 IP 192.168.43.146.8880 > 192.168.43.147.7772: UDP, length 120
00:14:11.180360 IP 192.168.43.124.8880 > 192.168.43.146.7771: UDP, length 120
00:14:11.213526 IP 192.168.43.146.8880 > 192.168.43.147.7772: UDP, length 120
00:14:11.250541 IP 192.168.43.124.8880 > 192.168.43.146.7771: UDP, length 120
00:14:11.263519 IP 192.168.43.146.8880 > 192.168.43.147.7772: UDP, length 120
00:14:11.280232 IP 192.168.43.124.8880 > 192.168.43.146.7771: UDP, length 120
00:14:11.313519 IP 192.168.43.146.8880 > 192.168.43.147.7772: UDP, length 120
00:14:11.330386 IP 192.168.43.124.8880 > 192.168.43.146.7771: UDP, length 120
00:14:11.363578 IP 192.168.43.146.8880 > 192.168.43.147.7772: UDP, length 120
00:14:11.401772 IP 192.168.43.124.8880 > 192.168.43.146.7771: UDP, length 120
00:14:11.413541 IP 192.168.43.146.8880 > 192.168.43.147.7772: UDP, length 120
00:14:11.430253 IP 192.168.43.124.8880 > 192.168.43.146.7771: UDP, length 120
00:14:11.463520 IP 192.168.43.146.8880 > 192.168.43.147.7772: UDP, length 120
00:14:11.497531 IP 192.168.43.124.8880 > 192.168.43.146.7771: UDP, length 120
00:14:11.513526 IP 192.168.43.146.8880 > 192.168.43.147.7772: UDP, length 120
00:14:11.530911 IP 192.168.43.124.8880 > 192.168.43.146.7771: UDP, length 120
00:14:11.563534 IP 192.168.43.146.8880 > 192.168.43.147.7772: UDP, length 120
00:14:11.580295 IP 192.168.43.124.8880 > 192.168.43.146.7771: UDP, length 120
00:14:11.613523 IP 192.168.43.146.8880 > 192.168.43.147.7772: UDP, length 120
00:14:11.637288 IP 192.168.43.124.8880 > 192.168.43.146.7771: UDP, length 120
00:14:11.663519 IP 192.168.43.146.8880 > 192.168.43.147.7772: UDP, length 120
00:14:11.680360 IP 192.168.43.124.8880 > 192.168.43.146.7771: UDP, length 120
00:14:11.713532 IP 192.168.43.146.8880 > 192.168.43.147.7772: UDP, length 120
00:14:11.730796 IP 192.168.43.124.8880 > 192.168.43.146.7771: UDP, length 120
00:14:11.763564 IP 192.168.43.146.8880 > 192.168.43.147.7772: UDP, length 120
00:14:11.800385 IP 192.168.43.124.8880 > 192.168.43.146.7771: UDP, length 120
00:14:11.813603 IP 192.168.43.146.8880 > 192.168.43.147.7772: UDP, length 120
00:14:11.829998 IP 192.168.43.124.8880 > 192.168.43.146.7771: UDP, length 120
00:14:11.863527 IP 192.168.43.146.8880 > 192.168.43.147.7772: UDP, length 120
00:14:11.880915 IP 192.168.43.124.8880 > 192.168.43.146.7771: UDP, length 120
00:14:11.913526 IP 192.168.43.146.8880 > 192.168.43.147.7772: UDP, length 120
00:14:11.952438 IP 192.168.43.124.8880 > 192.168.43.146.7771: UDP, length 120
00:14:11.963522 IP 192.168.43.146.8880 > 192.168.43.147.7772: UDP, length 120
00:14:11.987205 IP 192.168.43.124.8880 > 192.168.43.146.7771: UDP, length 120
00:14:12.013519 IP 192.168.43.146.8880 > 192.168.43.147.7772: UDP, length 120
00:14:12.029990 IP 192.168.43.124.8880 > 192.168.43.146.7771: UDP, length 120
00:14:12.063522 IP 192.168.43.146.8880 > 192.168.43.147.7772: UDP, length 120
00:14:12.100730 IP 192.168.43.124.8880 > 192.168.43.146.7771: UDP, length 120
00:14:12.113524 IP 192.168.43.146.8880 > 192.168.43.147.7772: UDP, length 120
00:14:12.130124 IP 192.168.43.124.8880 > 192.168.43.146.7771: UDP, length 120
00:14:12.163519 IP 192.168.43.146.8880 > 192.168.43.147.7772: UDP, length 120
00:14:12.180712 IP 192.168.43.124.8880 > 192.168.43.146.7771: UDP, length 120
00:14:12.213519 IP 192.168.43.146.8880 > 192.168.43.147.7772: UDP, length 120
00:14:12.261814 IP 192.168.43.124.8880 > 192.168.43.146.7771: UDP, length 120
00:14:12.263517 IP 192.168.43.146.8880 > 192.168.43.147.7772: UDP, length 120
00:14:12.280113 IP 192.168.43.124.8880 > 192.168.43.146.7771: UDP, length 120
00:14:12.313520 IP 192.168.43.146.8880 > 192.168.43.147.7772: UDP, length 120
00:14:12.330280 IP 192.168.43.124.8880 > 192.168.43.146.7771: UDP, length 120
00:14:12.363519 IP 192.168.43.146.8880 > 192.168.43.147.7772: UDP, length 120
00:14:12.401920 IP 192.168.43.124.8880 > 192.168.43.146.7771: UDP, length 120
00:14:12.413518 IP 192.168.43.146.8880 > 192.168.43.147.7772: UDP, length 120
00:14:12.430062 IP 192.168.43.124.8880 > 192.168.43.146.7771: UDP, length 120
00:14:12.463518 IP 192.168.43.146.8880 > 192.168.43.147.7772: UDP, length 120
00:14:12.480340 IP 192.168.43.124.8880 > 192.168.43.146.7771: UDP, length 120
00:14:12.513520 IP 192.168.43.146.8880 > 192.168.43.147.7772: UDP, length 120
00:14:12.551777 IP 192.168.43.124.8880 > 192.168.43.146.7771: UDP, length 120
00:14:12.563521 IP 192.168.43.146.8880 > 192.168.43.147.7772: UDP, length 120
00:14:12.580362 IP 192.168.43.124.8880 > 192.168.43.146.7771: UDP, length 120
00:14:12.613546 IP 192.168.43.146.8880 > 192.168.43.147.7772: UDP, length 120
00:14:12.640668 IP 192.168.43.124.8880 > 192.168.43.146.7771: UDP, length 120
00:14:12.663548 IP 192.168.43.146.8880 > 192.168.43.147.7772: UDP, length 120
00:14:12.680156 IP 192.168.43.124.8880 > 192.168.43.146.7771: UDP, length 120
00:14:12.713546 IP 192.168.43.146.8880 > 192.168.43.147.7772: UDP, length 120
00:14:12.743073 IP 192.168.43.124.8880 > 192.168.43.146.7771: UDP, length 120
00:14:12.763558 IP 192.168.43.146.8880 > 192.168.43.147.7772: UDP, length 120
00:14:12.780088 IP 192.168.43.124.8880 > 192.168.43.146.7771: UDP, length 120
00:14:12.813576 IP 192.168.43.146.8880 > 192.168.43.147.7772: UDP, length 120
00:14:12.839638 IP 192.168.43.124.8880 > 192.168.43.146.7771: UDP, length 120
00:14:12.863589 IP 192.168.43.146.8880 > 192.168.43.147.7772: UDP, length 120
00:14:12.880040 IP 192.168.43.124.8880 > 192.168.43.146.7771: UDP, length 120
00:14:12.913598 IP 192.168.43.146.8880 > 192.168.43.147.7772: UDP, length 120
00:14:12.942084 IP 192.168.43.124.8880 > 192.168.43.146.7771: UDP, length 120
00:14:12.963554 IP 192.168.43.146.8880 > 192.168.43.147.7772: UDP, length 120
00:14:12.980293 IP 192.168.43.124.8880 > 192.168.43.146.7771: UDP, length 120
00:14:13.013547 IP 192.168.43.146.8880 > 192.168.43.147.7772: UDP, length 120
00:14:13.030629 IP 192.168.43.124.8880 > 192.168.43.146.7771: UDP, length 120
00:14:13.063548 IP 192.168.43.146.8880 > 192.168.43.147.7772: UDP, length 120
00:14:13.088504 IP 192.168.43.124.8880 > 192.168.43.146.7771: UDP, length 120
00:14:13.113550 IP 192.168.43.146.8880 > 192.168.43.147.7772: UDP, length 120
00:14:13.129961 IP 192.168.43.124.8880 > 192.168.43.146.7771: UDP, length 120
00:14:13.163548 IP 192.168.43.146.8880 > 192.168.43.147.7772: UDP, length 120
00:14:13.188746 IP 192.168.43.124.8880 > 192.168.43.146.7771: UDP, length 120
00:14:13.213545 IP 192.168.43.146.8880 > 192.168.43.147.7772: UDP, length 120
00:14:13.251858 IP 192.168.43.124.8880 > 192.168.43.146.7771: UDP, length 120
00:14:13.263546 IP 192.168.43.146.8880 > 192.168.43.147.7772: UDP, length 120
00:14:13.281440 IP 192.168.43.124.8880 > 192.168.43.146.7771: UDP, length 120
00:14:13.313547 IP 192.168.43.146.8880 > 192.168.43.147.7772: UDP, length 120
00:14:13.339970 IP 192.168.43.124.8880 > 192.168.43.146.7771: UDP, length 120
00:14:13.363547 IP 192.168.43.146.8880 > 192.168.43.147.7772: UDP, length 120
00:14:13.379988 IP 192.168.43.124.8880 > 192.168.43.146.7771: UDP, length 120
00:14:13.413547 IP 192.168.43.146.8880 > 192.168.43.147.7772: UDP, length 120
00:14:13.440316 IP 192.168.43.124.8880 > 192.168.43.146.7771: UDP, length 120
00:14:13.463548 IP 192.168.43.146.8880 > 192.168.43.147.7772: UDP, length 120
00:14:13.479964 IP 192.168.43.124.8880 > 192.168.43.146.7771: UDP, length 120
00:14:13.513547 IP 192.168.43.146.8880 > 192.168.43.147.7772: UDP, length 120
00:14:13.530016 IP 192.168.43.124.8880 > 192.168.43.146.7771: UDP, length 120
00:14:13.563549 IP 192.168.43.146.8880 > 192.168.43.147.7772: UDP, length 120
00:14:13.580344 IP 192.168.43.124.8880 > 192.168.43.146.7771: UDP, length 120
00:14:13.613547 IP 192.168.43.146.8880 > 192.168.43.147.7772: UDP, length 120
00:14:13.629678 IP 192.168.43.124.8880 > 192.168.43.146.7771: UDP, length 120
00:14:13.663551 IP 192.168.43.146.8880 > 192.168.43.147.7772: UDP, length 120
00:14:13.681011 IP 192.168.43.124.8880 > 192.168.43.146.7771: UDP, length 120
00:14:13.713549 IP 192.168.43.146.8880 > 192.168.43.147.7772: UDP, length 120
00:14:13.735489 IP 192.168.43.124.8880 > 192.168.43.146.7771: UDP, length 120
00:14:13.763623 IP 192.168.43.146.8880 > 192.168.43.147.7772: UDP, length 120
00:14:13.786437 IP 192.168.43.124.8880 > 192.168.43.146.7771: UDP, length 120
00:14:13.813641 IP 192.168.43.146.8880 > 192.168.43.147.7772: UDP, length 120
00:14:13.831603 IP 192.168.43.124.8880 > 192.168.43.146.7771: UDP, length 120
00:14:13.863639 IP 192.168.43.146.8880 > 192.168.43.147.7772: UDP, length 120
00:14:13.888742 IP 192.168.43.124.8880 > 192.168.43.146.7771: UDP, length 120
00:14:13.913573 IP 192.168.43.146.8880 > 192.168.43.147.7772: UDP, length 120
00:14:13.930502 IP 192.168.43.124.8880 > 192.168.43.146.7771: UDP, length 120
00:14:13.963539 IP 192.168.43.146.8880 > 192.168.43.147.7772: UDP, length 120
00:14:13.990899 IP 192.168.43.124.8880 > 192.168.43.146.7771: UDP, length 120
00:14:14.013521 IP 192.168.43.146.8880 > 192.168.43.147.7772: UDP, length 120
00:14:14.031549 IP 192.168.43.124.8880 > 192.168.43.146.7771: UDP, length 120
00:14:14.063519 IP 192.168.43.146.8880 > 192.168.43.147.7772: UDP, length 120
00:14:14.085104 IP 192.168.43.124.8880 > 192.168.43.146.7771: UDP, length 120
00:14:14.113534 IP 192.168.43.146.8880 > 192.168.43.147.7772: UDP, length 120
00:14:14.131586 IP 192.168.43.124.8880 > 192.168.43.146.7771: UDP, length 120
00:14:14.163527 IP 192.168.43.146.8880 > 192.168.43.147.7772: UDP, length 120
00:14:14.181572 IP 192.168.43.124.8880 > 192.168.43.146.7771: UDP, length 120
00:14:14.213527 IP 192.168.43.146.8880 > 192.168.43.147.7772: UDP, length 120
00:14:14.238818 IP 192.168.43.124.8880 > 192.168.43.146.7771: UDP, length 120
00:14:14.263520 IP 192.168.43.146.8880 > 192.168.43.147.7772: UDP, length 120
00:14:14.281396 IP 192.168.43.124.8880 > 192.168.43.146.7771: UDP, length 120
00:14:14.313518 IP 192.168.43.146.8880 > 192.168.43.147.7772: UDP, length 120
00:14:14.335071 IP 192.168.43.124.8880 > 192.168.43.146.7771: UDP, length 120
00:14:14.363519 IP 192.168.43.146.8880 > 192.168.43.147.7772: UDP, length 120
00:14:14.381795 IP 192.168.43.124.8880 > 192.168.43.146.7771: UDP, length 120
00:14:14.413555 IP 192.168.43.146.8880 > 192.168.43.147.7772: UDP, length 120
00:14:14.431572 IP 192.168.43.124.8880 > 192.168.43.146.7771: UDP, length 120
00:14:14.463522 IP 192.168.43.146.8880 > 192.168.43.147.7772: UDP, length 120
00:14:14.487129 IP 192.168.43.124.8880 > 192.168.43.146.7771: UDP, length 120
00:14:14.513519 IP 192.168.43.146.8880 > 192.168.43.147.7772: UDP, length 120
00:14:14.535838 IP 192.168.43.124.8880 > 192.168.43.146.7771: UDP, length 120
00:14:14.563520 IP 192.168.43.146.8880 > 192.168.43.147.7772: UDP, length 120
00:14:14.586306 IP 192.168.43.124.8880 > 192.168.43.146.7771: UDP, length 120
00:14:14.613519 IP 192.168.43.146.8880 > 192.168.43.147.7772: UDP, length 120
00:14:14.631553 IP 192.168.43.124.8880 > 192.168.43.146.7771: UDP, length 120
00:14:14.663519 IP 192.168.43.146.8880 > 192.168.43.147.7772: UDP, length 120
00:14:14.680972 IP 192.168.43.124.8880 > 192.168.43.146.7771: UDP, length 120
00:14:14.713516 IP 192.168.43.146.8880 > 192.168.43.147.7772: UDP, length 120
00:14:14.735122 IP 192.168.43.124.8880 > 192.168.43.146.7771: UDP, length 120
00:14:14.763518 IP 192.168.43.146.8880 > 192.168.43.147.7772: UDP, length 120
00:14:14.794723 IP 192.168.43.124.8880 > 192.168.43.146.7771: UDP, length 120
00:14:14.813533 IP 192.168.43.146.8880 > 192.168.43.147.7772: UDP, length 120
00:14:14.830848 IP 192.168.43.124.8880 > 192.168.43.146.7771: UDP, length 120
00:14:14.863530 IP 192.168.43.146.8880 > 192.168.43.147.7772: UDP, length 120
00:14:14.881460 IP 192.168.43.124.8880 > 192.168.43.146.7771: UDP, length 120
00:14:14.913651 IP 192.168.43.146.8880 > 192.168.43.147.7772: UDP, length 120
00:14:14.931425 IP 192.168.43.124.8880 > 192.168.43.146.7771: UDP, length 120
00:14:14.963608 IP 192.168.43.146.8880 > 192.168.43.147.7772: UDP, length 120
00:14:14.985279 IP 192.168.43.124.8880 > 192.168.43.146.7771: UDP, length 120
00:14:15.013607 IP 192.168.43.146.8880 > 192.168.43.147.7772: UDP, length 120
00:14:15.030106 IP 192.168.43.124.8880 > 192.168.43.146.7771: UDP, length 120
00:14:15.063602 IP 192.168.43.146.8880 > 192.168.43.147.7772: UDP, length 120
00:14:15.086187 IP 192.168.43.124.8880 > 192.168.43.146.7771: UDP, length 120
00:14:15.113591 IP 192.168.43.146.8880 > 192.168.43.147.7772: UDP, length 120
00:14:15.131612 IP 192.168.43.124.8880 > 192.168.43.146.7771: UDP, length 120
00:14:15.163614 IP 192.168.43.146.8880 > 192.168.43.147.7772: UDP, length 120
00:14:15.181549 IP 192.168.43.124.8880 > 192.168.43.146.7771: UDP, length 120
00:14:15.213602 IP 192.168.43.146.8880 > 192.168.43.147.7772: UDP, length 120
00:14:15.235591 IP 192.168.43.124.8880 > 192.168.43.146.7771: UDP, length 120
00:14:15.264363 IP 192.168.43.146.8880 > 192.168.43.147.7772: UDP, length 120
00:14:15.285872 IP 192.168.43.124.8880 > 192.168.43.146.7771: UDP, length 120
00:14:15.313576 IP 192.168.43.146.8880 > 192.168.43.147.7772: UDP, length 120
00:14:15.331876 IP 192.168.43.124.8880 > 192.168.43.146.7771: UDP, length 120
00:14:15.363539 IP 192.168.43.146.8880 > 192.168.43.147.7772: UDP, length 120
00:14:15.381021 IP 192.168.43.124.8880 > 192.168.43.146.7771: UDP, length 120
00:14:15.413529 IP 192.168.43.146.8880 > 192.168.43.147.7772: UDP, length 120
00:14:15.431745 IP 192.168.43.124.8880 > 192.168.43.146.7771: UDP, length 120
00:14:15.463522 IP 192.168.43.146.8880 > 192.168.43.147.7772: UDP, length 120
00:14:15.486481 IP 192.168.43.124.8880 > 192.168.43.146.7771: UDP, length 120
00:14:15.513522 IP 192.168.43.146.8880 > 192.168.43.147.7772: UDP, length 120
00:14:15.537646 IP 192.168.43.124.8880 > 192.168.43.146.7771: UDP, length 120
00:14:15.563520 IP 192.168.43.146.8880 > 192.168.43.147.7772: UDP, length 120
00:14:15.585228 IP 192.168.43.124.8880 > 192.168.43.146.7771: UDP, length 120
00:14:15.613520 IP 192.168.43.146.8880 > 192.168.43.147.7772: UDP, length 120
00:14:15.631263 IP 192.168.43.124.8880 > 192.168.43.146.7771: UDP, length 120
00:14:15.663519 IP 192.168.43.146.8880 > 192.168.43.147.7772: UDP, length 120
00:14:15.679724 IP 192.168.43.124.8880 > 192.168.43.146.7771: UDP, length 120
00:14:15.713523 IP 192.168.43.146.8880 > 192.168.43.147.7772: UDP, length 120
00:14:15.731364 IP 192.168.43.124.8880 > 192.168.43.146.7771: UDP, length 120
00:14:15.763521 IP 192.168.43.146.8880 > 192.168.43.147.7772: UDP, length 120
00:14:15.788222 IP 192.168.43.124.8880 > 192.168.43.146.7771: UDP, length 120
00:14:15.813538 IP 192.168.43.146.8880 > 192.168.43.147.7772: UDP, length 120
00:14:15.845501 IP 192.168.43.124.8880 > 192.168.43.146.7771: UDP, length 120
00:14:15.863528 IP 192.168.43.146.8880 > 192.168.43.147.7772: UDP, length 120
00:14:15.881454 IP 192.168.43.124.8880 > 192.168.43.146.7771: UDP, length 120
00:14:15.913548 IP 192.168.43.146.8880 > 192.168.43.147.7772: UDP, length 120
00:14:15.937665 IP 192.168.43.124.8880 > 192.168.43.146.7771: UDP, length 120
00:14:15.963570 IP 192.168.43.146.8880 > 192.168.43.147.7772: UDP, length 120
00:14:15.979044 IP 192.168.43.124.8880 > 192.168.43.146.7771: UDP, length 120
00:14:16.013543 IP 192.168.43.146.8880 > 192.168.43.147.7772: UDP, length 120
00:14:16.044152 IP 192.168.43.124.8880 > 192.168.43.146.7771: UDP, length 120
00:14:16.063531 IP 192.168.43.146.8880 > 192.168.43.147.7772: UDP, length 120
00:14:16.099365 IP 192.168.43.124.8880 > 192.168.43.146.7771: UDP, length 120
00:14:16.113525 IP 192.168.43.146.8880 > 192.168.43.147.7772: UDP, length 120
00:14:16.129562 IP 192.168.43.124.8880 > 192.168.43.146.7771: UDP, length 120
00:14:16.163522 IP 192.168.43.146.8880 > 192.168.43.147.7772: UDP, length 120
00:14:16.184916 IP 192.168.43.124.8880 > 192.168.43.146.7771: UDP, length 120
00:14:16.213521 IP 192.168.43.146.8880 > 192.168.43.147.7772: UDP, length 120
00:14:16.237558 IP 192.168.43.124.8880 > 192.168.43.146.7771: UDP, length 120
00:14:16.263519 IP 192.168.43.146.8880 > 192.168.43.147.7772: UDP, length 120
00:14:16.313517 IP 192.168.43.146.8880 > 192.168.43.147.7772: UDP, length 120
00:14:16.329452 IP 192.168.43.124.8880 > 192.168.43.146.7771: UDP, length 120
00:14:16.363520 IP 192.168.43.146.8880 > 192.168.43.147.7772: UDP, length 120
00:14:16.381414 IP 192.168.43.124.8880 > 192.168.43.146.7771: UDP, length 120
00:14:16.413520 IP 192.168.43.146.8880 > 192.168.43.147.7772: UDP, length 120
00:14:16.437818 IP 192.168.43.124.8880 > 192.168.43.146.7771: UDP, length 120
00:14:16.463519 IP 192.168.43.146.8880 > 192.168.43.147.7772: UDP, length 120
00:14:16.492268 IP 192.168.43.124.8880 > 192.168.43.146.7771: UDP, length 120
00:14:16.513520 IP 192.168.43.146.8880 > 192.168.43.147.7772: UDP, length 120
00:14:16.545743 IP 192.168.43.124.8880 > 192.168.43.146.7771: UDP, length 120
00:14:16.563518 IP 192.168.43.146.8880 > 192.168.43.147.7772: UDP, length 120
00:14:16.580905 IP 192.168.43.124.8880 > 192.168.43.146.7771: UDP, length 120
00:14:16.613520 IP 192.168.43.146.8880 > 192.168.43.147.7772: UDP, length 120
00:14:16.631329 IP 192.168.43.124.8880 > 192.168.43.146.7771: UDP, length 120
00:14:16.663528 IP 192.168.43.146.8880 > 192.168.43.147.7772: UDP, length 120
00:14:16.689199 IP 192.168.43.124.8880 > 192.168.43.146.7771: UDP, length 120
00:14:16.713522 IP 192.168.43.146.8880 > 192.168.43.147.7772: UDP, length 120
00:14:16.743714 IP 192.168.43.124.8880 > 192.168.43.146.7771: UDP, length 120
00:14:16.763520 IP 192.168.43.146.8880 > 192.168.43.147.7772: UDP, length 120
00:14:16.797871 IP 192.168.43.124.8880 > 192.168.43.146.7771: UDP, length 120
00:14:16.813546 IP 192.168.43.146.8880 > 192.168.43.147.7772: UDP, length 120
00:14:16.829317 IP 192.168.43.124.8880 > 192.168.43.146.7771: UDP, length 120
00:14:16.863528 IP 192.168.43.146.8880 > 192.168.43.147.7772: UDP, length 120
00:14:16.879236 IP 192.168.43.124.8880 > 192.168.43.146.7771: UDP, length 120
00:14:16.913522 IP 192.168.43.146.8880 > 192.168.43.147.7772: UDP, length 120
00:14:16.934965 IP 192.168.43.124.8880 > 192.168.43.146.7771: UDP, length 120
00:14:16.963598 IP 192.168.43.146.8880 > 192.168.43.147.7772: UDP, length 120
00:14:16.990176 IP 192.168.43.124.8880 > 192.168.43.146.7771: UDP, length 120
00:14:17.013555 IP 192.168.43.146.8880 > 192.168.43.147.7772: UDP, length 120
00:14:17.028959 IP 192.168.43.124.8880 > 192.168.43.146.7771: UDP, length 120
00:14:17.063537 IP 192.168.43.146.8880 > 192.168.43.147.7772: UDP, length 120
00:14:17.079434 IP 192.168.43.124.8880 > 192.168.43.146.7771: UDP, length 120
00:14:17.113527 IP 192.168.43.146.8880 > 192.168.43.147.7772: UDP, length 120
00:14:17.131094 IP 192.168.43.124.8880 > 192.168.43.146.7771: UDP, length 120
00:14:17.163520 IP 192.168.43.146.8880 > 192.168.43.147.7772: UDP, length 120
00:14:17.181720 IP 192.168.43.124.8880 > 192.168.43.146.7771: UDP, length 120
00:14:17.213520 IP 192.168.43.146.8880 > 192.168.43.147.7772: UDP, length 120
00:14:17.239252 IP 192.168.43.124.8880 > 192.168.43.146.7771: UDP, length 120
00:14:17.263518 IP 192.168.43.146.8880 > 192.168.43.147.7772: UDP, length 120
00:14:17.294876 IP 192.168.43.124.8880 > 192.168.43.146.7771: UDP, length 120
00:14:17.313518 IP 192.168.43.146.8880 > 192.168.43.147.7772: UDP, length 120
00:14:17.354862 IP 192.168.43.124.8880 > 192.168.43.146.7771: UDP, length 120
00:14:17.363520 IP 192.168.43.146.8880 > 192.168.43.147.7772: UDP, length 120
00:14:17.379364 IP 192.168.43.124.8880 > 192.168.43.146.7771: UDP, length 120
00:14:17.413546 IP 192.168.43.146.8880 > 192.168.43.147.7772: UDP, length 120
00:14:17.428875 IP 192.168.43.124.8880 > 192.168.43.146.7771: UDP, length 120
00:14:17.463522 IP 192.168.43.146.8880 > 192.168.43.147.7772: UDP, length 120
00:14:17.480659 IP 192.168.43.124.8880 > 192.168.43.146.7771: UDP, length 120
00:14:17.513520 IP 192.168.43.146.8880 > 192.168.43.147.7772: UDP, length 120
00:14:17.529320 IP 192.168.43.124.8880 > 192.168.43.146.7771: UDP, length 120
00:14:17.563519 IP 192.168.43.146.8880 > 192.168.43.147.7772: UDP, length 120
00:14:17.579662 IP 192.168.43.124.8880 > 192.168.43.146.7771: UDP, length 120
00:14:17.613548 IP 192.168.43.146.8880 > 192.168.43.147.7772: UDP, length 120
00:14:17.630320 IP 192.168.43.124.8880 > 192.168.43.146.7771: UDP, length 120
00:14:17.663547 IP 192.168.43.146.8880 > 192.168.43.147.7772: UDP, length 120
00:14:17.687482 IP 192.168.43.124.8880 > 192.168.43.146.7771: UDP, length 120
00:14:17.713550 IP 192.168.43.146.8880 > 192.168.43.147.7772: UDP, length 120
00:14:17.744206 IP 192.168.43.124.8880 > 192.168.43.146.7771: UDP, length 120
00:14:17.763547 IP 192.168.43.146.8880 > 192.168.43.147.7772: UDP, length 120
00:14:17.778648 IP 192.168.43.124.8880 > 192.168.43.146.7771: UDP, length 120
00:14:17.813571 IP 192.168.43.146.8880 > 192.168.43.147.7772: UDP, length 120
00:14:17.829272 IP 192.168.43.124.8880 > 192.168.43.146.7771: UDP, length 120
00:14:17.863557 IP 192.168.43.146.8880 > 192.168.43.147.7772: UDP, length 120
00:14:17.886463 IP 192.168.43.124.8880 > 192.168.43.146.7771: UDP, length 120
00:14:17.913560 IP 192.168.43.146.8880 > 192.168.43.147.7772: UDP, length 120
00:14:17.929264 IP 192.168.43.124.8880 > 192.168.43.146.7771: UDP, length 120
00:14:17.963551 IP 192.168.43.146.8880 > 192.168.43.147.7772: UDP, length 120
00:14:17.988538 IP 192.168.43.124.8880 > 192.168.43.146.7771: UDP, length 120
00:14:18.013592 IP 192.168.43.146.8880 > 192.168.43.147.7772: UDP, length 120
00:14:18.043413 IP 192.168.43.124.8880 > 192.168.43.146.7771: UDP, length 120
00:14:18.063562 IP 192.168.43.146.8880 > 192.168.43.147.7772: UDP, length 120
00:14:18.087760 IP 192.168.43.124.8880 > 192.168.43.146.7771: UDP, length 120
00:14:18.113556 IP 192.168.43.146.8880 > 192.168.43.147.7772: UDP, length 120
00:14:18.130195 IP 192.168.43.124.8880 > 192.168.43.146.7771: UDP, length 120
00:14:18.163555 IP 192.168.43.146.8880 > 192.168.43.147.7772: UDP, length 120
00:14:18.193061 IP 192.168.43.124.8880 > 192.168.43.146.7771: UDP, length 120
00:14:18.213551 IP 192.168.43.146.8880 > 192.168.43.147.7772: UDP, length 120
00:14:18.229772 IP 192.168.43.124.8880 > 192.168.43.146.7771: UDP, length 120
00:14:18.263546 IP 192.168.43.146.8880 > 192.168.43.147.7772: UDP, length 120
00:14:18.279718 IP 192.168.43.124.8880 > 192.168.43.146.7771: UDP, length 120
00:14:18.313548 IP 192.168.43.146.8880 > 192.168.43.147.7772: UDP, length 120
00:14:18.345702 IP 192.168.43.124.8880 > 192.168.43.146.7771: UDP, length 120
00:14:18.363551 IP 192.168.43.146.8880 > 192.168.43.147.7772: UDP, length 120
00:14:18.379695 IP 192.168.43.124.8880 > 192.168.43.146.7771: UDP, length 120
00:14:18.413551 IP 192.168.43.146.8880 > 192.168.43.147.7772: UDP, length 120
00:14:18.429122 IP 192.168.43.124.8880 > 192.168.43.146.7771: UDP, length 120
00:14:18.463550 IP 192.168.43.146.8880 > 192.168.43.147.7772: UDP, length 120
00:14:18.496954 IP 192.168.43.124.8880 > 192.168.43.146.7771: UDP, length 120
00:14:18.513549 IP 192.168.43.146.8880 > 192.168.43.147.7772: UDP, length 120
00:14:18.528669 IP 192.168.43.124.8880 > 192.168.43.146.7771: UDP, length 120
00:14:18.563551 IP 192.168.43.146.8880 > 192.168.43.147.7772: UDP, length 120
00:14:18.578727 IP 192.168.43.124.8880 > 192.168.43.146.7771: UDP, length 120
00:14:18.613550 IP 192.168.43.146.8880 > 192.168.43.147.7772: UDP, length 120
00:14:18.647489 IP 192.168.43.124.8880 > 192.168.43.146.7771: UDP, length 120
00:14:18.663549 IP 192.168.43.146.8880 > 192.168.43.147.7772: UDP, length 120
00:14:18.679478 IP 192.168.43.124.8880 > 192.168.43.146.7771: UDP, length 120
00:14:18.713549 IP 192.168.43.146.8880 > 192.168.43.147.7772: UDP, length 120
00:14:18.736877 IP 192.168.43.124.8880 > 192.168.43.146.7771: UDP, length 120
00:14:18.763549 IP 192.168.43.146.8880 > 192.168.43.147.7772: UDP, length 120
00:14:18.800122 IP 192.168.43.124.8880 > 192.168.43.146.7771: UDP, length 120
00:14:18.813576 IP 192.168.43.146.8880 > 192.168.43.147.7772: UDP, length 120
00:14:18.829107 IP 192.168.43.124.8880 > 192.168.43.146.7771: UDP, length 120
00:14:18.863561 IP 192.168.43.146.8880 > 192.168.43.147.7772: UDP, length 120
00:14:18.888385 IP 192.168.43.124.8880 > 192.168.43.146.7771: UDP, length 120
00:14:18.913585 IP 192.168.43.146.8880 > 192.168.43.147.7772: UDP, length 120
00:14:18.950255 IP 192.168.43.124.8880 > 192.168.43.146.7771: UDP, length 120
00:14:18.963550 IP 192.168.43.146.8880 > 192.168.43.147.7772: UDP, length 120
00:14:18.979021 IP 192.168.43.124.8880 > 192.168.43.146.7771: UDP, length 120
00:14:19.013609 IP 192.168.43.146.8880 > 192.168.43.147.7772: UDP, length 120
00:14:19.029114 IP 192.168.43.124.8880 > 192.168.43.146.7771: UDP, length 120
00:14:19.063564 IP 192.168.43.146.8880 > 192.168.43.147.7772: UDP, length 120
00:14:19.089244 IP 192.168.43.124.8880 > 192.168.43.146.7771: UDP, length 120
00:14:19.113560 IP 192.168.43.146.8880 > 192.168.43.147.7772: UDP, length 120
00:14:19.129413 IP 192.168.43.124.8880 > 192.168.43.146.7771: UDP, length 120
00:14:19.163570 IP 192.168.43.146.8880 > 192.168.43.147.7772: UDP, length 120
00:14:19.190448 IP 192.168.43.124.8880 > 192.168.43.146.7771: UDP, length 120
00:14:19.213568 IP 192.168.43.146.8880 > 192.168.43.147.7772: UDP, length 120
00:14:19.248098 IP 192.168.43.124.8880 > 192.168.43.146.7771: UDP, length 120
00:14:19.263552 IP 192.168.43.146.8880 > 192.168.43.147.7772: UDP, length 120
00:14:19.281282 IP 192.168.43.124.8880 > 192.168.43.146.7771: UDP, length 120
00:14:19.313550 IP 192.168.43.146.8880 > 192.168.43.147.7772: UDP, length 120
00:14:19.329166 IP 192.168.43.124.8880 > 192.168.43.146.7771: UDP, length 120
00:14:19.363550 IP 192.168.43.146.8880 > 192.168.43.147.7772: UDP, length 120
00:14:19.379987 IP 192.168.43.124.8880 > 192.168.43.146.7771: UDP, length 120
00:14:19.413550 IP 192.168.43.146.8880 > 192.168.43.147.7772: UDP, length 120
00:14:19.431202 IP 192.168.43.124.8880 > 192.168.43.146.7771: UDP, length 120
00:14:19.463548 IP 192.168.43.146.8880 > 192.168.43.147.7772: UDP, length 120
00:14:19.492784 IP 192.168.43.124.8880 > 192.168.43.146.7771: UDP, length 120
00:14:19.513549 IP 192.168.43.146.8880 > 192.168.43.147.7772: UDP, length 120
00:14:19.529593 IP 192.168.43.124.8880 > 192.168.43.146.7771: UDP, length 120
00:14:19.563548 IP 192.168.43.146.8880 > 192.168.43.147.7772: UDP, length 120
00:14:19.579048 IP 192.168.43.124.8880 > 192.168.43.146.7771: UDP, length 120
00:14:19.613549 IP 192.168.43.146.8880 > 192.168.43.147.7772: UDP, length 120
00:14:19.654024 IP 192.168.43.124.8880 > 192.168.43.146.7771: UDP, length 120
00:14:19.663545 IP 192.168.43.146.8880 > 192.168.43.147.7772: UDP, length 120
00:14:19.679073 IP 192.168.43.124.8880 > 192.168.43.146.7771: UDP, length 120
00:14:19.713551 IP 192.168.43.146.8880 > 192.168.43.147.7772: UDP, length 120
00:14:19.729627 IP 192.168.43.124.8880 > 192.168.43.146.7771: UDP, length 120
00:14:19.763548 IP 192.168.43.146.8880 > 192.168.43.147.7772: UDP, length 120
00:14:19.802166 IP 192.168.43.124.8880 > 192.168.43.146.7771: UDP, length 120
00:14:19.813571 IP 192.168.43.146.8880 > 192.168.43.147.7772: UDP, length 120
00:14:19.830261 IP 192.168.43.124.8880 > 192.168.43.146.7771: UDP, length 120
00:14:19.863554 IP 192.168.43.146.8880 > 192.168.43.147.7772: UDP, length 120
00:14:19.879362 IP 192.168.43.124.8880 > 192.168.43.146.7771: UDP, length 120
00:14:19.913548 IP 192.168.43.146.8880 > 192.168.43.147.7772: UDP, length 120
00:14:19.940606 IP 192.168.43.124.8880 > 192.168.43.146.7771: UDP, length 120
00:14:19.963547 IP 192.168.43.146.8880 > 192.168.43.147.7772: UDP, length 120
00:14:19.987659 IP 192.168.43.124.8880 > 192.168.43.146.7771: UDP, length 120
00:14:20.013607 IP 192.168.43.146.8880 > 192.168.43.147.7772: UDP, length 120
00:14:20.031059 IP 192.168.43.124.8880 > 192.168.43.146.7771: UDP, length 120
00:14:20.063561 IP 192.168.43.146.8880 > 192.168.43.147.7772: UDP, length 120
00:14:20.104031 IP 192.168.43.124.8880 > 192.168.43.146.7771: UDP, length 120
00:14:20.113554 IP 192.168.43.146.8880 > 192.168.43.147.7772: UDP, length 120
00:14:20.129414 IP 192.168.43.124.8880 > 192.168.43.146.7771: UDP, length 120
00:14:20.163550 IP 192.168.43.146.8880 > 192.168.43.147.7772: UDP, length 120
00:14:20.179645 IP 192.168.43.124.8880 > 192.168.43.146.7771: UDP, length 120
00:14:20.213554 IP 192.168.43.146.8880 > 192.168.43.147.7772: UDP, length 120
00:14:20.253217 IP 192.168.43.124.8880 > 192.168.43.146.7771: UDP, length 120
00:14:20.263563 IP 192.168.43.146.8880 > 192.168.43.147.7772: UDP, length 120
00:14:20.278973 IP 192.168.43.124.8880 > 192.168.43.146.7771: UDP, length 120
00:14:20.313608 IP 192.168.43.146.8880 > 192.168.43.147.7772: UDP, length 120
00:14:20.329644 IP 192.168.43.124.8880 > 192.168.43.146.7771: UDP, length 120
00:14:20.363624 IP 192.168.43.146.8880 > 192.168.43.147.7772: UDP, length 120
00:14:20.401016 IP 192.168.43.124.8880 > 192.168.43.146.7771: UDP, length 120
00:14:20.413608 IP 192.168.43.146.8880 > 192.168.43.147.7772: UDP, length 120
00:14:20.429412 IP 192.168.43.124.8880 > 192.168.43.146.7771: UDP, length 120
00:14:20.463596 IP 192.168.43.146.8880 > 192.168.43.147.7772: UDP, length 120
00:14:20.480561 IP 192.168.43.124.8880 > 192.168.43.146.7771: UDP, length 120
00:14:20.513644 IP 192.168.43.146.8880 > 192.168.43.147.7772: UDP, length 120
00:14:20.546144 IP 192.168.43.124.8880 > 192.168.43.146.7771: UDP, length 120
00:14:20.563598 IP 192.168.43.146.8880 > 192.168.43.147.7772: UDP, length 120
00:14:20.578907 IP 192.168.43.124.8880 > 192.168.43.146.7771: UDP, length 120
00:14:20.613627 IP 192.168.43.146.8880 > 192.168.43.147.7772: UDP, length 120
00:14:20.629470 IP 192.168.43.124.8880 > 192.168.43.146.7771: UDP, length 120
00:14:20.663594 IP 192.168.43.146.8880 > 192.168.43.147.7772: UDP, length 120
00:14:20.699318 IP 192.168.43.124.8880 > 192.168.43.146.7771: UDP, length 120
00:14:20.713609 IP 192.168.43.146.8880 > 192.168.43.147.7772: UDP, length 120
00:14:20.729259 IP 192.168.43.124.8880 > 192.168.43.146.7771: UDP, length 120
00:14:20.763574 IP 192.168.43.146.8880 > 192.168.43.147.7772: UDP, length 120
00:14:20.790467 IP 192.168.43.124.8880 > 192.168.43.146.7771: UDP, length 120
00:14:20.813546 IP 192.168.43.146.8880 > 192.168.43.147.7772: UDP, length 120
00:14:20.851771 IP 192.168.43.124.8880 > 192.168.43.146.7771: UDP, length 120
00:14:20.863530 IP 192.168.43.146.8880 > 192.168.43.147.7772: UDP, length 120
00:14:20.879071 IP 192.168.43.124.8880 > 192.168.43.146.7771: UDP, length 120
00:14:20.913523 IP 192.168.43.146.8880 > 192.168.43.147.7772: UDP, length 120
00:14:20.936404 IP 192.168.43.124.8880 > 192.168.43.146.7771: UDP, length 120
00:14:20.963521 IP 192.168.43.146.8880 > 192.168.43.147.7772: UDP, length 120
00:14:20.986679 IP 192.168.43.124.8880 > 192.168.43.146.7771: UDP, length 120
00:14:21.013520 IP 192.168.43.146.8880 > 192.168.43.147.7772: UDP, length 120
00:14:21.028751 IP 192.168.43.124.8880 > 192.168.43.146.7771: UDP, length 120
00:14:21.063519 IP 192.168.43.146.8880 > 192.168.43.147.7772: UDP, length 120
00:14:21.102360 IP 192.168.43.124.8880 > 192.168.43.146.7771: UDP, length 120
00:14:21.113521 IP 192.168.43.146.8880 > 192.168.43.147.7772: UDP, length 120
00:14:21.128950 IP 192.168.43.124.8880 > 192.168.43.146.7771: UDP, length 120
00:14:21.163519 IP 192.168.43.146.8880 > 192.168.43.147.7772: UDP, length 120
00:14:21.180324 IP 192.168.43.124.8880 > 192.168.43.146.7771: UDP, length 120
00:14:21.213519 IP 192.168.43.146.8880 > 192.168.43.147.7772: UDP, length 120
00:14:21.252792 IP 192.168.43.124.8880 > 192.168.43.146.7771: UDP, length 120
00:14:21.263520 IP 192.168.43.146.8880 > 192.168.43.147.7772: UDP, length 120
00:14:21.278988 IP 192.168.43.124.8880 > 192.168.43.146.7771: UDP, length 120
00:14:21.313521 IP 192.168.43.146.8880 > 192.168.43.147.7772: UDP, length 120
00:14:21.329988 IP 192.168.43.124.8880 > 192.168.43.146.7771: UDP, length 120
00:14:21.363527 IP 192.168.43.146.8880 > 192.168.43.147.7772: UDP, length 120
00:14:21.400539 IP 192.168.43.124.8880 > 192.168.43.146.7771: UDP, length 120
00:14:21.413531 IP 192.168.43.146.8880 > 192.168.43.147.7772: UDP, length 120
00:14:21.428699 IP 192.168.43.124.8880 > 192.168.43.146.7771: UDP, length 120
00:14:21.463521 IP 192.168.43.146.8880 > 192.168.43.147.7772: UDP, length 120
00:14:21.493127 IP 192.168.43.124.8880 > 192.168.43.146.7771: UDP, length 120
00:14:21.513521 IP 192.168.43.146.8880 > 192.168.43.147.7772: UDP, length 120
00:14:21.529793 IP 192.168.43.124.8880 > 192.168.43.146.7771: UDP, length 120
00:14:21.563522 IP 192.168.43.146.8880 > 192.168.43.147.7772: UDP, length 120
00:14:21.578767 IP 192.168.43.124.8880 > 192.168.43.146.7771: UDP, length 120
00:14:21.613523 IP 192.168.43.146.8880 > 192.168.43.147.7772: UDP, length 120
00:14:21.650893 IP 192.168.43.124.8880 > 192.168.43.146.7771: UDP, length 120
00:14:21.663530 IP 192.168.43.146.8880 > 192.168.43.147.7772: UDP, length 120
00:14:21.679297 IP 192.168.43.124.8880 > 192.168.43.146.7771: UDP, length 120
00:14:21.713530 IP 192.168.43.146.8880 > 192.168.43.147.7772: UDP, length 120
00:14:21.728639 IP 192.168.43.124.8880 > 192.168.43.146.7771: UDP, length 120
00:14:21.763524 IP 192.168.43.146.8880 > 192.168.43.147.7772: UDP, length 120
00:14:21.801759 IP 192.168.43.124.8880 > 192.168.43.146.7771: UDP, length 120
00:14:21.813549 IP 192.168.43.146.8880 > 192.168.43.147.7772: UDP, length 120
00:14:21.828659 IP 192.168.43.124.8880 > 192.168.43.146.7771: UDP, length 120
00:14:21.863529 IP 192.168.43.146.8880 > 192.168.43.147.7772: UDP, length 120
00:14:21.879399 IP 192.168.43.124.8880 > 192.168.43.146.7771: UDP, length 120
00:14:21.913549 IP 192.168.43.146.8880 > 192.168.43.147.7772: UDP, length 120
00:14:21.951683 IP 192.168.43.124.8880 > 192.168.43.146.7771: UDP, length 120
00:14:21.963522 IP 192.168.43.146.8880 > 192.168.43.147.7772: UDP, length 120
00:14:21.981388 IP 192.168.43.124.8880 > 192.168.43.146.7771: UDP, length 120
00:14:22.013594 IP 192.168.43.146.8880 > 192.168.43.147.7772: UDP, length 120
00:14:22.037224 IP 192.168.43.124.8880 > 192.168.43.146.7771: UDP, length 120
00:14:22.063607 IP 192.168.43.146.8880 > 192.168.43.147.7772: UDP, length 120
00:14:22.078701 IP 192.168.43.124.8880 > 192.168.43.146.7771: UDP, length 120
00:14:22.113574 IP 192.168.43.146.8880 > 192.168.43.147.7772: UDP, length 120
00:14:22.140491 IP 192.168.43.124.8880 > 192.168.43.146.7771: UDP, length 120
00:14:22.163539 IP 192.168.43.146.8880 > 192.168.43.147.7772: UDP, length 120
00:14:22.180549 IP 192.168.43.124.8880 > 192.168.43.146.7771: UDP, length 120
00:14:22.213527 IP 192.168.43.146.8880 > 192.168.43.147.7772: UDP, length 120
00:14:22.229371 IP 192.168.43.124.8880 > 192.168.43.146.7771: UDP, length 120
00:14:22.263521 IP 192.168.43.146.8880 > 192.168.43.147.7772: UDP, length 120
00:14:22.302244 IP 192.168.43.124.8880 > 192.168.43.146.7771: UDP, length 120
00:14:22.313520 IP 192.168.43.146.8880 > 192.168.43.147.7772: UDP, length 120
00:14:22.328827 IP 192.168.43.124.8880 > 192.168.43.146.7771: UDP, length 120
00:14:22.363533 IP 192.168.43.146.8880 > 192.168.43.147.7772: UDP, length 120
00:14:22.381511 IP 192.168.43.124.8880 > 192.168.43.146.7771: UDP, length 120
00:14:22.413525 IP 192.168.43.146.8880 > 192.168.43.147.7772: UDP, length 120
00:14:22.451237 IP 192.168.43.124.8880 > 192.168.43.146.7771: UDP, length 120
00:14:22.463521 IP 192.168.43.146.8880 > 192.168.43.147.7772: UDP, length 120
00:14:22.492507 IP 192.168.43.124.8880 > 192.168.43.146.7771: UDP, length 120
00:14:22.513520 IP 192.168.43.146.8880 > 192.168.43.147.7772: UDP, length 120
00:14:22.530808 IP 192.168.43.124.8880 > 192.168.43.146.7771: UDP, length 120
00:14:22.563519 IP 192.168.43.146.8880 > 192.168.43.147.7772: UDP, length 120
00:14:22.578444 IP 192.168.43.124.8880 > 192.168.43.146.7771: UDP, length 120
00:14:22.613549 IP 192.168.43.146.8880 > 192.168.43.147.7772: UDP, length 120
00:14:22.640342 IP 192.168.43.124.8880 > 192.168.43.146.7771: UDP, length 120
00:14:22.663548 IP 192.168.43.146.8880 > 192.168.43.147.7772: UDP, length 120
00:14:22.678734 IP 192.168.43.124.8880 > 192.168.43.146.7771: UDP, length 120
00:14:22.713548 IP 192.168.43.146.8880 > 192.168.43.147.7772: UDP, length 120
00:14:22.741713 IP 192.168.43.124.8880 > 192.168.43.146.7771: UDP, length 120
00:14:22.763546 IP 192.168.43.146.8880 > 192.168.43.147.7772: UDP, length 120
00:14:22.778360 IP 192.168.43.124.8880 > 192.168.43.146.7771: UDP, length 120
00:14:22.813568 IP 192.168.43.146.8880 > 192.168.43.147.7772: UDP, length 120
00:14:22.828603 IP 192.168.43.124.8880 > 192.168.43.146.7771: UDP, length 120
00:14:22.863554 IP 192.168.43.146.8880 > 192.168.43.147.7772: UDP, length 120
00:14:22.892286 IP 192.168.43.124.8880 > 192.168.43.146.7771: UDP, length 120
00:14:22.913557 IP 192.168.43.146.8880 > 192.168.43.147.7772: UDP, length 120
00:14:22.929098 IP 192.168.43.124.8880 > 192.168.43.146.7771: UDP, length 120
00:14:22.963551 IP 192.168.43.146.8880 > 192.168.43.147.7772: UDP, length 120
00:14:22.999163 IP 192.168.43.124.8880 > 192.168.43.146.7771: UDP, length 120
00:14:23.013548 IP 192.168.43.146.8880 > 192.168.43.147.7772: UDP, length 120
00:14:23.028531 IP 192.168.43.124.8880 > 192.168.43.146.7771: UDP, length 120
00:14:23.063547 IP 192.168.43.146.8880 > 192.168.43.147.7772: UDP, length 120
00:14:23.089649 IP 192.168.43.124.8880 > 192.168.43.146.7771: UDP, length 120
00:14:23.113639 IP 192.168.43.146.8880 > 192.168.43.147.7772: UDP, length 120
00:14:23.128629 IP 192.168.43.124.8880 > 192.168.43.146.7771: UDP, length 120
00:14:23.163621 IP 192.168.43.146.8880 > 192.168.43.147.7772: UDP, length 120
00:14:23.188937 IP 192.168.43.124.8880 > 192.168.43.146.7771: UDP, length 120
00:14:23.213566 IP 192.168.43.146.8880 > 192.168.43.147.7772: UDP, length 120
00:14:23.228474 IP 192.168.43.124.8880 > 192.168.43.146.7771: UDP, length 120
00:14:23.263555 IP 192.168.43.146.8880 > 192.168.43.147.7772: UDP, length 120
00:14:23.287976 IP 192.168.43.124.8880 > 192.168.43.146.7771: UDP, length 120
00:14:23.313548 IP 192.168.43.146.8880 > 192.168.43.147.7772: UDP, length 120
00:14:23.338562 IP 192.168.43.124.8880 > 192.168.43.146.7771: UDP, length 120
