02:16:11.039642 IP 192.168.43.195.8880 > 192.168.43.124.7772: UDP, length 120
02:16:11.089679 IP 192.168.43.195.8880 > 192.168.43.124.7772: UDP, length 120
02:16:11.139659 IP 192.168.43.195.8880 > 192.168.43.124.7772: UDP, length 120
02:16:11.189662 IP 192.168.43.195.8880 > 192.168.43.124.7772: UDP, length 120
02:16:11.239664 IP 192.168.43.195.8880 > 192.168.43.124.7772: UDP, length 120
02:16:11.289681 IP 192.168.43.195.8880 > 192.168.43.124.7772: UDP, length 120
02:16:11.339673 IP 192.168.43.195.8880 > 192.168.43.124.7772: UDP, length 120
02:16:11.389657 IP 192.168.43.195.8880 > 192.168.43.124.7772: UDP, length 120
02:16:11.439660 IP 192.168.43.195.8880 > 192.168.43.124.7772: UDP, length 120
02:16:11.489660 IP 192.168.43.195.8880 > 192.168.43.124.7772: UDP, length 120
02:16:11.539664 IP 192.168.43.195.8880 > 192.168.43.124.7772: UDP, length 120
02:16:11.589663 IP 192.168.43.195.8880 > 192.168.43.124.7772: UDP, length 120
02:16:11.639661 IP 192.168.43.195.8880 > 192.168.43.124.7772: UDP, length 120
02:16:11.689660 IP 192.168.43.195.8880 > 192.168.43.124.7772: UDP, length 120
02:16:11.739656 IP 192.168.43.195.8880 > 192.168.43.124.7772: UDP, length 120
02:16:11.789660 IP 192.168.43.195.8880 > 192.168.43.124.7772: UDP, length 120
02:16:11.839666 IP 192.168.43.195.8880 > 192.168.43.124.7772: UDP, length 120
02:16:11.889665 IP 192.168.43.195.8880 > 192.168.43.124.7772: UDP, length 120
02:16:11.939655 IP 192.168.43.195.8880 > 192.168.43.124.7772: UDP, length 120
02:16:11.989658 IP 192.168.43.195.8880 > 192.168.43.124.7772: UDP, length 120
02:16:12.039689 IP 192.168.43.195.8880 > 192.168.43.124.7772: UDP, length 120
02:16:12.089668 IP 192.168.43.195.8880 > 192.168.43.124.7772: UDP, length 120
02:16:12.139665 IP 192.168.43.195.8880 > 192.168.43.124.7772: UDP, length 120
02:16:12.189659 IP 192.168.43.195.8880 > 192.168.43.124.7772: UDP, length 120
02:16:12.239662 IP 192.168.43.195.8880 > 192.168.43.124.7772: UDP, length 120
02:16:12.289659 IP 192.168.43.195.8880 > 192.168.43.124.7772: UDP, length 120
02:16:12.339706 IP 192.168.43.195.8880 > 192.168.43.124.7772: UDP, length 120
02:16:12.389672 IP 192.168.43.195.8880 > 192.168.43.124.7772: UDP, length 120
02:16:12.439661 IP 192.168.43.195.8880 > 192.168.43.124.7772: UDP, length 120
02:16:12.489661 IP 192.168.43.195.8880 > 192.168.43.124.7772: UDP, length 120
02:16:12.539659 IP 192.168.43.195.8880 > 192.168.43.124.7772: UDP, length 120
02:16:12.589678 IP 192.168.43.195.8880 > 192.168.43.124.7772: UDP, length 120
02:16:12.639665 IP 192.168.43.195.8880 > 192.168.43.124.7772: UDP, length 120
02:16:12.689662 IP 192.168.43.195.8880 > 192.168.43.124.7772: UDP, length 120
02:16:12.739660 IP 192.168.43.195.8880 > 192.168.43.124.7772: UDP, length 120
02:16:12.789664 IP 192.168.43.195.8880 > 192.168.43.124.7772: UDP, length 120
02:16:12.839658 IP 192.168.43.195.8880 > 192.168.43.124.7772: UDP, length 120
02:16:12.889661 IP 192.168.43.195.8880 > 192.168.43.124.7772: UDP, length 120
02:16:12.939661 IP 192.168.43.195.8880 > 192.168.43.124.7772: UDP, length 120
02:16:12.989658 IP 192.168.43.195.8880 > 192.168.43.124.7772: UDP, length 120
02:16:13.039661 IP 192.168.43.195.8880 > 192.168.43.124.7772: UDP, length 120
02:16:13.089671 IP 192.168.43.195.8880 > 192.168.43.124.7772: UDP, length 120
02:16:13.139658 IP 192.168.43.195.8880 > 192.168.43.124.7772: UDP, length 120
02:16:13.189658 IP 192.168.43.195.8880 > 192.168.43.124.7772: UDP, length 120
02:16:13.239661 IP 192.168.43.195.8880 > 192.168.43.124.7772: UDP, length 120
02:16:13.289658 IP 192.168.43.195.8880 > 192.168.43.124.7772: UDP, length 120
02:16:13.339660 IP 192.168.43.195.8880 > 192.168.43.124.7772: UDP, length 120
02:16:13.389668 IP 192.168.43.195.8880 > 192.168.43.124.7772: UDP, length 120
02:16:13.439667 IP 192.168.43.195.8880 > 192.168.43.124.7772: UDP, length 120
02:16:13.489658 IP 192.168.43.195.8880 > 192.168.43.124.7772: UDP, length 120
02:16:13.539658 IP 192.168.43.195.8880 > 192.168.43.124.7772: UDP, length 120
02:16:13.589657 IP 192.168.43.195.8880 > 192.168.43.124.7772: UDP, length 120
02:16:13.639658 IP 192.168.43.195.8880 > 192.168.43.124.7772: UDP, length 120
02:16:13.689659 IP 192.168.43.195.8880 > 192.168.43.124.7772: UDP, length 120
02:16:13.739663 IP 192.168.43.195.8880 > 192.168.43.124.7772: UDP, length 120
02:16:13.789664 IP 192.168.43.195.8880 > 192.168.43.124.7772: UDP, length 120
02:16:13.839705 IP 192.168.43.195.8880 > 192.168.43.124.7772: UDP, length 120
02:16:13.889663 IP 192.168.43.195.8880 > 192.168.43.124.7772: UDP, length 120
02:16:13.939650 IP 192.168.43.195.8880 > 192.168.43.124.7772: UDP, length 120
02:16:13.989659 IP 192.168.43.195.8880 > 192.168.43.124.7772: UDP, length 120
02:16:14.039664 IP 192.168.43.195.8880 > 192.168.43.124.7772: UDP, length 120
02:16:14.089661 IP 192.168.43.195.8880 > 192.168.43.124.7772: UDP, length 120
02:16:14.139660 IP 192.168.43.195.8880 > 192.168.43.124.7772: UDP, length 120
02:16:14.189660 IP 192.168.43.195.8880 > 192.168.43.124.7772: UDP, length 120
02:16:14.239660 IP 192.168.43.195.8880 > 192.168.43.124.7772: UDP, length 120
02:16:14.289659 IP 192.168.43.195.8880 > 192.168.43.124.7772: UDP, length 120
02:16:14.339657 IP 192.168.43.195.8880 > 192.168.43.124.7772: UDP, length 120
02:16:14.389660 IP 192.168.43.195.8880 > 192.168.43.124.7772: UDP, length 120
02:16:14.439659 IP 192.168.43.195.8880 > 192.168.43.124.7772: UDP, length 120
02:16:14.489662 IP 192.168.43.195.8880 > 192.168.43.124.7772: UDP, length 120
02:16:14.539663 IP 192.168.43.195.8880 > 192.168.43.124.7772: UDP, length 120
02:16:14.589660 IP 192.168.43.195.8880 > 192.168.43.124.7772: UDP, length 120
02:16:14.639659 IP 192.168.43.195.8880 > 192.168.43.124.7772: UDP, length 120
02:16:14.689659 IP 192.168.43.195.8880 > 192.168.43.124.7772: UDP, length 120
02:16:14.739658 IP 192.168.43.195.8880 > 192.168.43.124.7772: UDP, length 120
02:16:14.789661 IP 192.168.43.195.8880 > 192.168.43.124.7772: UDP, length 120
02:16:14.839660 IP 192.168.43.195.8880 > 192.168.43.124.7772: UDP, length 120
02:16:14.889659 IP 192.168.43.195.8880 > 192.168.43.124.7772: UDP, length 120
02:16:14.939658 IP 192.168.43.195.8880 > 192.168.43.124.7772: UDP, length 120
02:16:14.954202 IP 192.168.43.124.8880 > 192.168.43.195.7771: UDP, length 120
02:16:14.989665 IP 192.168.43.195.8880 > 192.168.43.124.7772: UDP, length 120
02:16:15.005122 IP 192.168.43.124.8880 > 192.168.43.195.7771: UDP, length 120
02:16:15.039674 IP 192.168.43.195.8880 > 192.168.43.124.7772: UDP, length 120
02:16:15.055994 IP 192.168.43.124.8880 > 192.168.43.195.7771: UDP, length 120
02:16:15.089670 IP 192.168.43.195.8880 > 192.168.43.124.7772: UDP, length 120
02:16:15.105810 IP 192.168.43.124.8880 > 192.168.43.195.7771: UDP, length 120
02:16:15.139666 IP 192.168.43.195.8880 > 192.168.43.124.7772: UDP, length 120
02:16:15.154037 IP 192.168.43.124.8880 > 192.168.43.195.7771: UDP, length 120
02:16:15.189662 IP 192.168.43.195.8880 > 192.168.43.124.7772: UDP, length 120
02:16:15.205201 IP 192.168.43.124.8880 > 192.168.43.195.7771: UDP, length 120
02:16:15.239664 IP 192.168.43.195.8880 > 192.168.43.124.7772: UDP, length 120
02:16:15.254343 IP 192.168.43.124.8880 > 192.168.43.195.7771: UDP, length 120
02:16:15.289664 IP 192.168.43.195.8880 > 192.168.43.124.7772: UDP, length 120
02:16:15.307620 IP 192.168.43.124.8880 > 192.168.43.195.7771: UDP, length 120
02:16:15.339707 IP 192.168.43.195.8880 > 192.168.43.124.7772: UDP, length 120
02:16:15.354049 IP 192.168.43.124.8880 > 192.168.43.195.7771: UDP, length 120
02:16:15.389679 IP 192.168.43.195.8880 > 192.168.43.124.7772: UDP, length 120
02:16:15.404149 IP 192.168.43.124.8880 > 192.168.43.195.7771: UDP, length 120
02:16:15.439667 IP 192.168.43.195.8880 > 192.168.43.124.7772: UDP, length 120
02:16:15.469310 IP 192.168.43.124.8880 > 192.168.43.195.7771: UDP, length 120
02:16:15.489673 IP 192.168.43.195.8880 > 192.168.43.124.7772: UDP, length 120
02:16:15.503780 IP 192.168.43.124.8880 > 192.168.43.195.7771: UDP, length 120
02:16:15.539674 IP 192.168.43.195.8880 > 192.168.43.124.7772: UDP, length 120
02:16:15.555077 IP 192.168.43.124.8880 > 192.168.43.195.7771: UDP, length 120
02:16:15.589667 IP 192.168.43.195.8880 > 192.168.43.124.7772: UDP, length 120
02:16:15.605483 IP 192.168.43.124.8880 > 192.168.43.195.7771: UDP, length 120
02:16:15.639670 IP 192.168.43.195.8880 > 192.168.43.124.7772: UDP, length 120
02:16:15.653891 IP 192.168.43.124.8880 > 192.168.43.195.7771: UDP, length 120
02:16:15.689664 IP 192.168.43.195.8880 > 192.168.43.124.7772: UDP, length 120
02:16:15.704021 IP 192.168.43.124.8880 > 192.168.43.195.7771: UDP, length 120
02:16:15.739663 IP 192.168.43.195.8880 > 192.168.43.124.7772: UDP, length 120
02:16:15.766642 IP 192.168.43.124.8880 > 192.168.43.195.7771: UDP, length 120
02:16:15.789664 IP 192.168.43.195.8880 > 192.168.43.124.7772: UDP, length 120
02:16:15.825388 IP 192.168.43.124.8880 > 192.168.43.195.7771: UDP, length 120
02:16:15.839666 IP 192.168.43.195.8880 > 192.168.43.124.7772: UDP, length 120
02:16:15.854091 IP 192.168.43.124.8880 > 192.168.43.195.7771: UDP, length 120
02:16:15.889664 IP 192.168.43.195.8880 > 192.168.43.124.7772: UDP, length 120
02:16:15.904317 IP 192.168.43.124.8880 > 192.168.43.195.7771: UDP, length 120
02:16:15.939664 IP 192.168.43.195.8880 > 192.168.43.124.7772: UDP, length 120
02:16:15.954204 IP 192.168.43.124.8880 > 192.168.43.195.7771: UDP, length 120
02:16:15.989663 IP 192.168.43.195.8880 > 192.168.43.124.7772: UDP, length 120
02:16:16.012164 IP 192.168.43.124.8880 > 192.168.43.195.7771: UDP, length 120
02:16:16.039698 IP 192.168.43.195.8880 > 192.168.43.124.7772: UDP, length 120
02:16:16.054072 IP 192.168.43.124.8880 > 192.168.43.195.7771: UDP, length 120
02:16:16.089677 IP 192.168.43.195.8880 > 192.168.43.124.7772: UDP, length 120
02:16:16.104347 IP 192.168.43.124.8880 > 192.168.43.195.7771: UDP, length 120
02:16:16.139666 IP 192.168.43.195.8880 > 192.168.43.124.7772: UDP, length 120
02:16:16.154119 IP 192.168.43.124.8880 > 192.168.43.195.7771: UDP, length 120
02:16:16.189664 IP 192.168.43.195.8880 > 192.168.43.124.7772: UDP, length 120
02:16:16.206324 IP 192.168.43.124.8880 > 192.168.43.195.7771: UDP, length 120
02:16:16.239669 IP 192.168.43.195.8880 > 192.168.43.124.7772: UDP, length 120
02:16:16.255896 IP 192.168.43.124.8880 > 192.168.43.195.7771: UDP, length 120
02:16:16.289662 IP 192.168.43.195.8880 > 192.168.43.124.7772: UDP, length 120
02:16:16.304184 IP 192.168.43.124.8880 > 192.168.43.195.7771: UDP, length 120
02:16:16.339662 IP 192.168.43.195.8880 > 192.168.43.124.7772: UDP, length 120
02:16:16.354102 IP 192.168.43.124.8880 > 192.168.43.195.7771: UDP, length 120
02:16:16.389664 IP 192.168.43.195.8880 > 192.168.43.124.7772: UDP, length 120
02:16:16.407068 IP 192.168.43.124.8880 > 192.168.43.195.7771: UDP, length 120
02:16:16.439663 IP 192.168.43.195.8880 > 192.168.43.124.7772: UDP, length 120
02:16:16.454256 IP 192.168.43.124.8880 > 192.168.43.195.7771: UDP, length 120
02:16:16.489665 IP 192.168.43.195.8880 > 192.168.43.124.7772: UDP, length 120
02:16:16.503955 IP 192.168.43.124.8880 > 192.168.43.195.7771: UDP, length 120
02:16:16.539671 IP 192.168.43.195.8880 > 192.168.43.124.7772: UDP, length 120
02:16:16.556320 IP 192.168.43.124.8880 > 192.168.43.195.7771: UDP, length 120
02:16:16.589673 IP 192.168.43.195.8880 > 192.168.43.124.7772: UDP, length 120
02:16:16.604259 IP 192.168.43.124.8880 > 192.168.43.195.7771: UDP, length 120
02:16:16.639668 IP 192.168.43.195.8880 > 192.168.43.124.7772: UDP, length 120
02:16:16.654069 IP 192.168.43.124.8880 > 192.168.43.195.7771: UDP, length 120
02:16:16.689665 IP 192.168.43.195.8880 > 192.168.43.124.7772: UDP, length 120
02:16:16.726936 IP 192.168.43.124.8880 > 192.168.43.195.7771: UDP, length 120
02:16:16.739664 IP 192.168.43.195.8880 > 192.168.43.124.7772: UDP, length 120
02:16:16.754135 IP 192.168.43.124.8880 > 192.168.43.195.7771: UDP, length 120
02:16:16.789663 IP 192.168.43.195.8880 > 192.168.43.124.7772: UDP, length 120
02:16:16.806136 IP 192.168.43.124.8880 > 192.168.43.195.7771: UDP, length 120
02:16:16.839705 IP 192.168.43.195.8880 > 192.168.43.124.7772: UDP, length 120
02:16:16.854654 IP 192.168.43.124.8880 > 192.168.43.195.7771: UDP, length 120
02:16:16.889668 IP 192.168.43.195.8880 > 192.168.43.124.7772: UDP, length 120
02:16:16.916952 IP 192.168.43.124.8880 > 192.168.43.195.7771: UDP, length 120
02:16:16.939663 IP 192.168.43.195.8880 > 192.168.43.124.7772: UDP, length 120
02:16:16.954715 IP 192.168.43.124.8880 > 192.168.43.195.7771: UDP, length 120
02:16:16.989664 IP 192.168.43.195.8880 > 192.168.43.124.7772: UDP, length 120
02:16:17.004351 IP 192.168.43.124.8880 > 192.168.43.195.7771: UDP, length 120
02:16:17.039671 IP 192.168.43.195.8880 > 192.168.43.124.7772: UDP, length 120
02:16:17.061420 IP 192.168.43.124.8880 > 192.168.43.195.7771: UDP, length 120
02:16:17.089666 IP 192.168.43.195.8880 > 192.168.43.124.7772: UDP, length 120
02:16:17.106521 IP 192.168.43.124.8880 > 192.168.43.195.7771: UDP, length 120
02:16:17.139664 IP 192.168.43.195.8880 > 192.168.43.124.7772: UDP, length 120
02:16:17.154284 IP 192.168.43.124.8880 > 192.168.43.195.7771: UDP, length 120
02:16:17.189662 IP 192.168.43.195.8880 > 192.168.43.124.7772: UDP, length 120
02:16:17.205408 IP 192.168.43.124.8880 > 192.168.43.195.7771: UDP, length 120
02:16:17.239666 IP 192.168.43.195.8880 > 192.168.43.124.7772: UDP, length 120
02:16:17.276683 IP 192.168.43.124.8880 > 192.168.43.195.7771: UDP, length 120
02:16:17.289664 IP 192.168.43.195.8880 > 192.168.43.124.7772: UDP, length 120
02:16:17.304099 IP 192.168.43.124.8880 > 192.168.43.195.7771: UDP, length 120
02:16:17.339662 IP 192.168.43.195.8880 > 192.168.43.124.7772: UDP, length 120
02:16:17.370421 IP 192.168.43.124.8880 > 192.168.43.195.7771: UDP, length 120
02:16:17.389666 IP 192.168.43.195.8880 > 192.168.43.124.7772: UDP, length 120
02:16:17.404152 IP 192.168.43.124.8880 > 192.168.43.195.7771: UDP, length 120
02:16:17.439663 IP 192.168.43.195.8880 > 192.168.43.124.7772: UDP, length 120
02:16:17.464638 IP 192.168.43.124.8880 > 192.168.43.195.7771: UDP, length 120
02:16:17.489665 IP 192.168.43.195.8880 > 192.168.43.124.7772: UDP, length 120
02:16:17.504221 IP 192.168.43.124.8880 > 192.168.43.195.7771: UDP, length 120
02:16:17.539662 IP 192.168.43.195.8880 > 192.168.43.124.7772: UDP, length 120
02:16:17.554058 IP 192.168.43.124.8880 > 192.168.43.195.7771: UDP, length 120
02:16:17.589673 IP 192.168.43.195.8880 > 192.168.43.124.7772: UDP, length 120
02:16:17.604177 IP 192.168.43.124.8880 > 192.168.43.195.7771: UDP, length 120
02:16:17.639667 IP 192.168.43.195.8880 > 192.168.43.124.7772: UDP, length 120
02:16:17.654819 IP 192.168.43.124.8880 > 192.168.43.195.7771: UDP, length 120
02:16:17.689674 IP 192.168.43.195.8880 > 192.168.43.124.7772: UDP, length 120
02:16:17.705330 IP 192.168.43.124.8880 > 192.168.43.195.7771: UDP, length 120
02:16:17.739665 IP 192.168.43.195.8880 > 192.168.43.124.7772: UDP, length 120
02:16:17.755655 IP 192.168.43.124.8880 > 192.168.43.195.7771: UDP, length 120
02:16:17.789664 IP 192.168.43.195.8880 > 192.168.43.124.7772: UDP, length 120
02:16:17.826363 IP 192.168.43.124.8880 > 192.168.43.195.7771: UDP, length 120
02:16:17.839666 IP 192.168.43.195.8880 > 192.168.43.124.7772: UDP, length 120
02:16:17.854150 IP 192.168.43.124.8880 > 192.168.43.195.7771: UDP, length 120
02:16:17.889674 IP 192.168.43.195.8880 > 192.168.43.124.7772: UDP, length 120
02:16:17.904164 IP 192.168.43.124.8880 > 192.168.43.195.7771: UDP, length 120
02:16:17.939666 IP 192.168.43.195.8880 > 192.168.43.124.7772: UDP, length 120
02:16:17.954232 IP 192.168.43.124.8880 > 192.168.43.195.7771: UDP, length 120
02:16:17.989662 IP 192.168.43.195.8880 > 192.168.43.124.7772: UDP, length 120
02:16:18.019835 IP 192.168.43.124.8880 > 192.168.43.195.7771: UDP, length 120
02:16:18.039671 IP 192.168.43.195.8880 > 192.168.43.124.7772: UDP, length 120
02:16:18.054344 IP 192.168.43.124.8880 > 192.168.43.195.7771: UDP, length 120
02:16:18.089664 IP 192.168.43.195.8880 > 192.168.43.124.7772: UDP, length 120
02:16:18.104147 IP 192.168.43.124.8880 > 192.168.43.195.7771: UDP, length 120
02:16:18.139664 IP 192.168.43.195.8880 > 192.168.43.124.7772: UDP, length 120
02:16:18.189664 IP 192.168.43.195.8880 > 192.168.43.124.7772: UDP, length 120
02:16:18.190190 IP 192.168.43.124.8880 > 192.168.43.195.7771: UDP, length 120
02:16:18.204081 IP 192.168.43.124.8880 > 192.168.43.195.7771: UDP, length 120
02:16:18.239673 IP 192.168.43.195.8880 > 192.168.43.124.7772: UDP, length 120
02:16:18.254213 IP 192.168.43.124.8880 > 192.168.43.195.7771: UDP, length 120
02:16:18.289665 IP 192.168.43.195.8880 > 192.168.43.124.7772: UDP, length 120
02:16:18.304225 IP 192.168.43.124.8880 > 192.168.43.195.7771: UDP, length 120
02:16:18.339716 IP 192.168.43.195.8880 > 192.168.43.124.7772: UDP, length 120
02:16:18.357371 IP 192.168.43.124.8880 > 192.168.43.195.7771: UDP, length 120
02:16:18.389677 IP 192.168.43.195.8880 > 192.168.43.124.7772: UDP, length 120
02:16:18.406642 IP 192.168.43.124.8880 > 192.168.43.195.7771: UDP, length 120
02:16:18.439663 IP 192.168.43.195.8880 > 192.168.43.124.7772: UDP, length 120
02:16:18.471601 IP 192.168.43.124.8880 > 192.168.43.195.7771: UDP, length 120
02:16:18.489667 IP 192.168.43.195.8880 > 192.168.43.124.7772: UDP, length 120
02:16:18.504127 IP 192.168.43.124.8880 > 192.168.43.195.7771: UDP, length 120
02:16:18.539660 IP 192.168.43.195.8880 > 192.168.43.124.7772: UDP, length 120
02:16:18.554362 IP 192.168.43.124.8880 > 192.168.43.195.7771: UDP, length 120
02:16:18.589663 IP 192.168.43.195.8880 > 192.168.43.124.7772: UDP, length 120
02:16:18.605907 IP 192.168.43.124.8880 > 192.168.43.195.7771: UDP, length 120
02:16:18.639667 IP 192.168.43.195.8880 > 192.168.43.124.7772: UDP, length 120
02:16:18.655947 IP 192.168.43.124.8880 > 192.168.43.195.7771: UDP, length 120
02:16:18.689688 IP 192.168.43.195.8880 > 192.168.43.124.7772: UDP, length 120
02:16:18.706063 IP 192.168.43.124.8880 > 192.168.43.195.7771: UDP, length 120
02:16:18.739676 IP 192.168.43.195.8880 > 192.168.43.124.7772: UDP, length 120
02:16:18.756273 IP 192.168.43.124.8880 > 192.168.43.195.7771: UDP, length 120
02:16:18.789667 IP 192.168.43.195.8880 > 192.168.43.124.7772: UDP, length 120
02:16:18.805912 IP 192.168.43.124.8880 > 192.168.43.195.7771: UDP, length 120
02:16:18.839665 IP 192.168.43.195.8880 > 192.168.43.124.7772: UDP, length 120
02:16:18.856576 IP 192.168.43.124.8880 > 192.168.43.195.7771: UDP, length 120
02:16:18.889664 IP 192.168.43.195.8880 > 192.168.43.124.7772: UDP, length 120
02:16:18.904494 IP 192.168.43.124.8880 > 192.168.43.195.7771: UDP, length 120
02:16:18.939662 IP 192.168.43.195.8880 > 192.168.43.124.7772: UDP, length 120
02:16:18.965168 IP 192.168.43.124.8880 > 192.168.43.195.7771: UDP, length 120
02:16:18.989671 IP 192.168.43.195.8880 > 192.168.43.124.7772: UDP, length 120
02:16:19.007114 IP 192.168.43.124.8880 > 192.168.43.195.7771: UDP, length 120
02:16:19.039671 IP 192.168.43.195.8880 > 192.168.43.124.7772: UDP, length 120
02:16:19.055941 IP 192.168.43.124.8880 > 192.168.43.195.7771: UDP, length 120
02:16:19.089668 IP 192.168.43.195.8880 > 192.168.43.124.7772: UDP, length 120
02:16:19.111414 IP 192.168.43.124.8880 > 192.168.43.195.7771: UDP, length 120
02:16:19.139663 IP 192.168.43.195.8880 > 192.168.43.124.7772: UDP, length 120
02:16:19.154406 IP 192.168.43.124.8880 > 192.168.43.195.7771: UDP, length 120
02:16:19.189666 IP 192.168.43.195.8880 > 192.168.43.124.7772: UDP, length 120
02:16:19.207659 IP 192.168.43.124.8880 > 192.168.43.195.7771: UDP, length 120
02:16:19.239665 IP 192.168.43.195.8880 > 192.168.43.124.7772: UDP, length 120
02:16:19.256866 IP 192.168.43.124.8880 > 192.168.43.195.7771: UDP, length 120
02:16:19.289664 IP 192.168.43.195.8880 > 192.168.43.124.7772: UDP, length 120
02:16:19.311279 IP 192.168.43.124.8880 > 192.168.43.195.7771: UDP, length 120
02:16:19.339663 IP 192.168.43.195.8880 > 192.168.43.124.7772: UDP, length 120
02:16:19.357616 IP 192.168.43.124.8880 > 192.168.43.195.7771: UDP, length 120
02:16:19.389664 IP 192.168.43.195.8880 > 192.168.43.124.7772: UDP, length 120
02:16:19.412822 IP 192.168.43.124.8880 > 192.168.43.195.7771: UDP, length 120
02:16:19.439662 IP 192.168.43.195.8880 > 192.168.43.124.7772: UDP, length 120
02:16:19.455938 IP 192.168.43.124.8880 > 192.168.43.195.7771: UDP, length 120
02:16:19.489662 IP 192.168.43.195.8880 > 192.168.43.124.7772: UDP, length 120
02:16:19.511449 IP 192.168.43.124.8880 > 192.168.43.195.7771: UDP, length 120
02:16:19.539662 IP 192.168.43.195.8880 > 192.168.43.124.7772: UDP, length 120
02:16:19.555420 IP 192.168.43.124.8880 > 192.168.43.195.7771: UDP, length 120
02:16:19.589660 IP 192.168.43.195.8880 > 192.168.43.124.7772: UDP, length 120
02:16:19.606899 IP 192.168.43.124.8880 > 192.168.43.195.7771: UDP, length 120
02:16:19.639664 IP 192.168.43.195.8880 > 192.168.43.124.7772: UDP, length 120
02:16:19.656658 IP 192.168.43.124.8880 > 192.168.43.195.7771: UDP, length 120
02:16:19.689666 IP 192.168.43.195.8880 > 192.168.43.124.7772: UDP, length 120
02:16:19.705914 IP 192.168.43.124.8880 > 192.168.43.195.7771: UDP, length 120
02:16:19.739671 IP 192.168.43.195.8880 > 192.168.43.124.7772: UDP, length 120
02:16:19.755905 IP 192.168.43.124.8880 > 192.168.43.195.7771: UDP, length 120
02:16:19.789675 IP 192.168.43.195.8880 > 192.168.43.124.7772: UDP, length 120
02:16:19.805941 IP 192.168.43.124.8880 > 192.168.43.195.7771: UDP, length 120
02:16:19.839707 IP 192.168.43.195.8880 > 192.168.43.124.7772: UDP, length 120
02:16:19.861529 IP 192.168.43.124.8880 > 192.168.43.195.7771: UDP, length 120
02:16:19.889673 IP 192.168.43.195.8880 > 192.168.43.124.7772: UDP, length 120
02:16:19.906332 IP 192.168.43.124.8880 > 192.168.43.195.7771: UDP, length 120
02:16:19.939661 IP 192.168.43.195.8880 > 192.168.43.124.7772: UDP, length 120
02:16:19.957945 IP 192.168.43.124.8880 > 192.168.43.195.7771: UDP, length 120
02:16:19.989662 IP 192.168.43.195.8880 > 192.168.43.124.7772: UDP, length 120
02:16:20.005912 IP 192.168.43.124.8880 > 192.168.43.195.7771: UDP, length 120
02:16:20.039672 IP 192.168.43.195.8880 > 192.168.43.124.7772: UDP, length 120
02:16:20.055899 IP 192.168.43.124.8880 > 192.168.43.195.7771: UDP, length 120
02:16:20.089664 IP 192.168.43.195.8880 > 192.168.43.124.7772: UDP, length 120
02:16:20.113755 IP 192.168.43.124.8880 > 192.168.43.195.7771: UDP, length 120
02:16:20.139663 IP 192.168.43.195.8880 > 192.168.43.124.7772: UDP, length 120
02:16:20.157289 IP 192.168.43.124.8880 > 192.168.43.195.7771: UDP, length 120
02:16:20.189662 IP 192.168.43.195.8880 > 192.168.43.124.7772: UDP, length 120
02:16:20.205853 IP 192.168.43.124.8880 > 192.168.43.195.7771: UDP, length 120
02:16:20.239661 IP 192.168.43.195.8880 > 192.168.43.124.7772: UDP, length 120
02:16:20.255668 IP 192.168.43.124.8880 > 192.168.43.195.7771: UDP, length 120
02:16:20.289661 IP 192.168.43.195.8880 > 192.168.43.124.7772: UDP, length 120
02:16:20.306007 IP 192.168.43.124.8880 > 192.168.43.195.7771: UDP, length 120
02:16:20.339660 IP 192.168.43.195.8880 > 192.168.43.124.7772: UDP, length 120
02:16:20.355918 IP 192.168.43.124.8880 > 192.168.43.195.7771: UDP, length 120
02:16:20.389663 IP 192.168.43.195.8880 > 192.168.43.124.7772: UDP, length 120
02:16:20.406868 IP 192.168.43.124.8880 > 192.168.43.195.7771: UDP, length 120
02:16:20.439671 IP 192.168.43.195.8880 > 192.168.43.124.7772: UDP, length 120
02:16:20.455914 IP 192.168.43.124.8880 > 192.168.43.195.7771: UDP, length 120
02:16:20.489675 IP 192.168.43.195.8880 > 192.168.43.124.7772: UDP, length 120
02:16:20.507154 IP 192.168.43.124.8880 > 192.168.43.195.7771: UDP, length 120
02:16:20.539664 IP 192.168.43.195.8880 > 192.168.43.124.7772: UDP, length 120
02:16:20.589660 IP 192.168.43.195.8880 > 192.168.43.124.7772: UDP, length 120
02:16:20.639659 IP 192.168.43.195.8880 > 192.168.43.124.7772: UDP, length 120
02:16:20.689658 IP 192.168.43.195.8880 > 192.168.43.124.7772: UDP, length 120
02:16:20.700288 IP 192.168.43.124.8880 > 192.168.43.195.7771: UDP, length 120
02:16:20.700563 IP 192.168.43.124.8880 > 192.168.43.195.7771: UDP, length 120
02:16:20.739662 IP 192.168.43.195.8880 > 192.168.43.124.7772: UDP, length 120
02:16:20.789672 IP 192.168.43.195.8880 > 192.168.43.124.7772: UDP, length 120
02:16:20.821099 IP 192.168.43.124.8880 > 192.168.43.195.7771: UDP, length 120
02:16:20.821231 IP 192.168.43.124.8880 > 192.168.43.195.7771: UDP, length 120
02:16:20.821347 IP 192.168.43.124.8880 > 192.168.43.195.7771: UDP, length 120
02:16:20.839670 IP 192.168.43.195.8880 > 192.168.43.124.7772: UDP, length 120
02:16:20.889665 IP 192.168.43.195.8880 > 192.168.43.124.7772: UDP, length 120
02:16:20.939665 IP 192.168.43.195.8880 > 192.168.43.124.7772: UDP, length 120
02:16:20.951498 IP 192.168.43.124.8880 > 192.168.43.195.7771: UDP, length 120
02:16:20.951755 IP 192.168.43.124.8880 > 192.168.43.195.7771: UDP, length 120
02:16:20.989667 IP 192.168.43.195.8880 > 192.168.43.124.7772: UDP, length 120
02:16:21.039690 IP 192.168.43.195.8880 > 192.168.43.124.7772: UDP, length 120
02:16:21.054864 IP 192.168.43.124.8880 > 192.168.43.195.7771: UDP, length 120
02:16:21.055759 IP 192.168.43.124.8880 > 192.168.43.195.7771: UDP, length 120
02:16:21.089675 IP 192.168.43.195.8880 > 192.168.43.124.7772: UDP, length 120
02:16:21.139660 IP 192.168.43.195.8880 > 192.168.43.124.7772: UDP, length 120
02:16:21.157518 IP 192.168.43.124.8880 > 192.168.43.195.7771: UDP, length 120
02:16:21.157686 IP 192.168.43.124.8880 > 192.168.43.195.7771: UDP, length 120
02:16:21.157812 IP 192.168.43.124.8880 > 192.168.43.195.7771: UDP, length 120
02:16:21.189663 IP 192.168.43.195.8880 > 192.168.43.124.7772: UDP, length 120
02:16:21.239665 IP 192.168.43.195.8880 > 192.168.43.124.7772: UDP, length 120
02:16:21.289665 IP 192.168.43.195.8880 > 192.168.43.124.7772: UDP, length 120
02:16:21.305833 IP 192.168.43.124.8880 > 192.168.43.195.7771: UDP, length 120
02:16:21.306106 IP 192.168.43.124.8880 > 192.168.43.195.7771: UDP, length 120
02:16:21.339716 IP 192.168.43.195.8880 > 192.168.43.124.7772: UDP, length 120
02:16:21.389666 IP 192.168.43.195.8880 > 192.168.43.124.7772: UDP, length 120
02:16:21.412522 IP 192.168.43.124.8880 > 192.168.43.195.7771: UDP, length 120
02:16:21.412667 IP 192.168.43.124.8880 > 192.168.43.195.7771: UDP, length 120
02:16:21.412782 IP 192.168.43.124.8880 > 192.168.43.195.7771: UDP, length 120
02:16:21.439672 IP 192.168.43.195.8880 > 192.168.43.124.7772: UDP, length 120
02:16:21.489662 IP 192.168.43.195.8880 > 192.168.43.124.7772: UDP, length 120
02:16:21.539661 IP 192.168.43.195.8880 > 192.168.43.124.7772: UDP, length 120
02:16:21.552964 IP 192.168.43.124.8880 > 192.168.43.195.7771: UDP, length 120
02:16:21.553279 IP 192.168.43.124.8880 > 192.168.43.195.7771: UDP, length 120
02:16:21.589667 IP 192.168.43.195.8880 > 192.168.43.124.7772: UDP, length 120
02:16:21.639663 IP 192.168.43.195.8880 > 192.168.43.124.7772: UDP, length 120
02:16:21.674396 IP 192.168.43.124.8880 > 192.168.43.195.7771: UDP, length 120
02:16:21.674713 IP 192.168.43.124.8880 > 192.168.43.195.7771: UDP, length 120
02:16:21.674934 IP 192.168.43.124.8880 > 192.168.43.195.7771: UDP, length 120
02:16:21.689666 IP 192.168.43.195.8880 > 192.168.43.124.7772: UDP, length 120
02:16:21.739658 IP 192.168.43.195.8880 > 192.168.43.124.7772: UDP, length 120
02:16:21.789636 IP 192.168.43.195.8880 > 192.168.43.124.7772: UDP, length 120
02:16:21.816419 IP 192.168.43.124.8880 > 192.168.43.195.7771: UDP, length 120
02:16:21.816731 IP 192.168.43.124.8880 > 192.168.43.195.7771: UDP, length 120
02:16:21.816953 IP 192.168.43.124.8880 > 192.168.43.195.7771: UDP, length 120
02:16:21.839670 IP 192.168.43.195.8880 > 192.168.43.124.7772: UDP, length 120
02:16:21.889671 IP 192.168.43.195.8880 > 192.168.43.124.7772: UDP, length 120
02:16:21.939667 IP 192.168.43.195.8880 > 192.168.43.124.7772: UDP, length 120
02:16:21.971484 IP 192.168.43.124.8880 > 192.168.43.195.7771: UDP, length 120
02:16:21.971837 IP 192.168.43.124.8880 > 192.168.43.195.7771: UDP, length 120
02:16:21.972061 IP 192.168.43.124.8880 > 192.168.43.195.7771: UDP, length 120
02:16:21.989665 IP 192.168.43.195.8880 > 192.168.43.124.7772: UDP, length 120
02:16:22.039665 IP 192.168.43.195.8880 > 192.168.43.124.7772: UDP, length 120
02:16:22.089661 IP 192.168.43.195.8880 > 192.168.43.124.7772: UDP, length 120
02:16:22.114497 IP 192.168.43.124.8880 > 192.168.43.195.7771: UDP, length 120
02:16:22.114808 IP 192.168.43.124.8880 > 192.168.43.195.7771: UDP, length 120
02:16:22.115031 IP 192.168.43.124.8880 > 192.168.43.195.7771: UDP, length 120
02:16:22.139674 IP 192.168.43.195.8880 > 192.168.43.124.7772: UDP, length 120
02:16:22.189661 IP 192.168.43.195.8880 > 192.168.43.124.7772: UDP, length 120
02:16:22.239661 IP 192.168.43.195.8880 > 192.168.43.124.7772: UDP, length 120
02:16:22.264279 IP 192.168.43.124.8880 > 192.168.43.195.7771: UDP, length 120
02:16:22.264578 IP 192.168.43.124.8880 > 192.168.43.195.7771: UDP, length 120
02:16:22.264802 IP 192.168.43.124.8880 > 192.168.43.195.7771: UDP, length 120
02:16:22.289666 IP 192.168.43.195.8880 > 192.168.43.124.7772: UDP, length 120
02:16:22.339659 IP 192.168.43.195.8880 > 192.168.43.124.7772: UDP, length 120
02:16:22.389660 IP 192.168.43.195.8880 > 192.168.43.124.7772: UDP, length 120
02:16:22.424615 IP 192.168.43.124.8880 > 192.168.43.195.7771: UDP, length 120
02:16:22.424911 IP 192.168.43.124.8880 > 192.168.43.195.7771: UDP, length 120
02:16:22.425122 IP 192.168.43.124.8880 > 192.168.43.195.7771: UDP, length 120
02:16:22.439667 IP 192.168.43.195.8880 > 192.168.43.124.7772: UDP, length 120
02:16:22.489660 IP 192.168.43.195.8880 > 192.168.43.124.7772: UDP, length 120
02:16:22.539657 IP 192.168.43.195.8880 > 192.168.43.124.7772: UDP, length 120
02:16:22.569329 IP 192.168.43.124.8880 > 192.168.43.195.7771: UDP, length 120
02:16:22.569646 IP 192.168.43.124.8880 > 192.168.43.195.7771: UDP, length 120
02:16:22.569865 IP 192.168.43.124.8880 > 192.168.43.195.7771: UDP, length 120
02:16:22.589678 IP 192.168.43.195.8880 > 192.168.43.124.7772: UDP, length 120
02:16:22.639665 IP 192.168.43.195.8880 > 192.168.43.124.7772: UDP, length 120
02:16:22.689664 IP 192.168.43.195.8880 > 192.168.43.124.7772: UDP, length 120
02:16:22.725786 IP 192.168.43.124.8880 > 192.168.43.195.7771: UDP, length 120
02:16:22.726014 IP 192.168.43.124.8880 > 192.168.43.195.7771: UDP, length 120
02:16:22.726173 IP 192.168.43.124.8880 > 192.168.43.195.7771: UDP, length 120
02:16:22.739663 IP 192.168.43.195.8880 > 192.168.43.124.7772: UDP, length 120
02:16:22.789660 IP 192.168.43.195.8880 > 192.168.43.124.7772: UDP, length 120
02:16:22.839704 IP 192.168.43.195.8880 > 192.168.43.124.7772: UDP, length 120
02:16:22.867787 IP 192.168.43.124.8880 > 192.168.43.195.7771: UDP, length 120
02:16:22.868029 IP 192.168.43.124.8880 > 192.168.43.195.7771: UDP, length 120
02:16:22.868142 IP 192.168.43.124.8880 > 192.168.43.195.7771: UDP, length 120
02:16:22.889684 IP 192.168.43.195.8880 > 192.168.43.124.7772: UDP, length 120
02:16:22.939668 IP 192.168.43.195.8880 > 192.168.43.124.7772: UDP, length 120
02:16:22.989670 IP 192.168.43.195.8880 > 192.168.43.124.7772: UDP, length 120
02:16:23.006512 IP 192.168.43.124.8880 > 192.168.43.195.7771: UDP, length 120
02:16:23.007352 IP 192.168.43.124.8880 > 192.168.43.195.7771: UDP, length 120
02:16:23.039674 IP 192.168.43.195.8880 > 192.168.43.124.7772: UDP, length 120
02:16:23.089651 IP 192.168.43.195.8880 > 192.168.43.124.7772: UDP, length 120
02:16:23.100315 IP 192.168.43.124.8880 > 192.168.43.195.7771: UDP, length 120
02:16:23.100443 IP 192.168.43.124.8880 > 192.168.43.195.7771: UDP, length 120
02:16:23.139665 IP 192.168.43.195.8880 > 192.168.43.124.7772: UDP, length 120
02:16:23.189660 IP 192.168.43.195.8880 > 192.168.43.124.7772: UDP, length 120
02:16:23.202151 IP 192.168.43.124.8880 > 192.168.43.195.7771: UDP, length 120
02:16:23.202271 IP 192.168.43.124.8880 > 192.168.43.195.7771: UDP, length 120
02:16:23.239665 IP 192.168.43.195.8880 > 192.168.43.124.7772: UDP, length 120
02:16:23.289661 IP 192.168.43.195.8880 > 192.168.43.124.7772: UDP, length 120
02:16:23.312522 IP 192.168.43.124.8880 > 192.168.43.195.7771: UDP, length 120
02:16:23.312763 IP 192.168.43.124.8880 > 192.168.43.195.7771: UDP, length 120
02:16:23.312880 IP 192.168.43.124.8880 > 192.168.43.195.7771: UDP, length 120
02:16:23.339663 IP 192.168.43.195.8880 > 192.168.43.124.7772: UDP, length 120
02:16:23.389661 IP 192.168.43.195.8880 > 192.168.43.124.7772: UDP, length 120
02:16:23.439659 IP 192.168.43.195.8880 > 192.168.43.124.7772: UDP, length 120
02:16:23.476034 IP 192.168.43.124.8880 > 192.168.43.195.7771: UDP, length 120
02:16:23.476270 IP 192.168.43.124.8880 > 192.168.43.195.7771: UDP, length 120
02:16:23.476386 IP 192.168.43.124.8880 > 192.168.43.195.7771: UDP, length 120
02:16:23.489661 IP 192.168.43.195.8880 > 192.168.43.124.7772: UDP, length 120
02:16:23.539658 IP 192.168.43.195.8880 > 192.168.43.124.7772: UDP, length 120
02:16:23.589658 IP 192.168.43.195.8880 > 192.168.43.124.7772: UDP, length 120
02:16:23.618882 IP 192.168.43.124.8880 > 192.168.43.195.7771: UDP, length 120
02:16:23.619122 IP 192.168.43.124.8880 > 192.168.43.195.7771: UDP, length 120
02:16:23.619240 IP 192.168.43.124.8880 > 192.168.43.195.7771: UDP, length 120
02:16:23.639678 IP 192.168.43.195.8880 > 192.168.43.124.7772: UDP, length 120
02:16:23.689665 IP 192.168.43.195.8880 > 192.168.43.124.7772: UDP, length 120
02:16:23.739659 IP 192.168.43.195.8880 > 192.168.43.124.7772: UDP, length 120
02:16:23.775175 IP 192.168.43.124.8880 > 192.168.43.195.7771: UDP, length 120
02:16:23.775310 IP 192.168.43.124.8880 > 192.168.43.195.7771: UDP, length 120
02:16:23.775425 IP 192.168.43.124.8880 > 192.168.43.195.7771: UDP, length 120
02:16:23.789664 IP 192.168.43.195.8880 > 192.168.43.124.7772: UDP, length 120
02:16:23.805947 IP 192.168.43.124.8880 > 192.168.43.195.7771: UDP, length 120
02:16:23.839664 IP 192.168.43.195.8880 > 192.168.43.124.7772: UDP, length 120
02:16:23.854469 IP 192.168.43.124.8880 > 192.168.43.195.7771: UDP, length 120
02:16:23.889663 IP 192.168.43.195.8880 > 192.168.43.124.7772: UDP, length 120
02:16:23.904289 IP 192.168.43.124.8880 > 192.168.43.195.7771: UDP, length 120
02:16:23.939662 IP 192.168.43.195.8880 > 192.168.43.124.7772: UDP, length 120
02:16:23.957656 IP 192.168.43.124.8880 > 192.168.43.195.7771: UDP, length 120
02:16:23.989674 IP 192.168.43.195.8880 > 192.168.43.124.7772: UDP, length 120
02:16:24.004223 IP 192.168.43.124.8880 > 192.168.43.195.7771: UDP, length 120
02:16:24.039673 IP 192.168.43.195.8880 > 192.168.43.124.7772: UDP, length 120
02:16:24.054514 IP 192.168.43.124.8880 > 192.168.43.195.7771: UDP, length 120
02:16:24.089683 IP 192.168.43.195.8880 > 192.168.43.124.7772: UDP, length 120
02:16:24.104979 IP 192.168.43.124.8880 > 192.168.43.195.7771: UDP, length 120
02:16:24.139669 IP 192.168.43.195.8880 > 192.168.43.124.7772: UDP, length 120
02:16:24.156925 IP 192.168.43.124.8880 > 192.168.43.195.7771: UDP, length 120
02:16:24.189664 IP 192.168.43.195.8880 > 192.168.43.124.7772: UDP, length 120
02:16:24.204409 IP 192.168.43.124.8880 > 192.168.43.195.7771: UDP, length 120
02:16:24.239665 IP 192.168.43.195.8880 > 192.168.43.124.7772: UDP, length 120
02:16:24.254204 IP 192.168.43.124.8880 > 192.168.43.195.7771: UDP, length 120
02:16:24.289667 IP 192.168.43.195.8880 > 192.168.43.124.7772: UDP, length 120
02:16:24.326152 IP 192.168.43.124.8880 > 192.168.43.195.7771: UDP, length 120
02:16:24.339706 IP 192.168.43.195.8880 > 192.168.43.124.7772: UDP, length 120
02:16:24.354275 IP 192.168.43.124.8880 > 192.168.43.195.7771: UDP, length 120
02:16:24.389671 IP 192.168.43.195.8880 > 192.168.43.124.7772: UDP, length 120
02:16:24.405325 IP 192.168.43.124.8880 > 192.168.43.195.7771: UDP, length 120
02:16:24.439662 IP 192.168.43.195.8880 > 192.168.43.124.7772: UDP, length 120
02:16:24.454245 IP 192.168.43.124.8880 > 192.168.43.195.7771: UDP, length 120
02:16:24.489663 IP 192.168.43.195.8880 > 192.168.43.124.7772: UDP, length 120
02:16:24.506441 IP 192.168.43.124.8880 > 192.168.43.195.7771: UDP, length 120
02:16:24.539663 IP 192.168.43.195.8880 > 192.168.43.124.7772: UDP, length 120
02:16:24.554470 IP 192.168.43.124.8880 > 192.168.43.195.7771: UDP, length 120
02:16:24.589669 IP 192.168.43.195.8880 > 192.168.43.124.7772: UDP, length 120
02:16:24.604186 IP 192.168.43.124.8880 > 192.168.43.195.7771: UDP, length 120
02:16:24.639670 IP 192.168.43.195.8880 > 192.168.43.124.7772: UDP, length 120
02:16:24.671769 IP 192.168.43.124.8880 > 192.168.43.195.7771: UDP, length 120
02:16:24.689670 IP 192.168.43.195.8880 > 192.168.43.124.7772: UDP, length 120
02:16:24.706260 IP 192.168.43.124.8880 > 192.168.43.195.7771: UDP, length 120
02:16:24.739664 IP 192.168.43.195.8880 > 192.168.43.124.7772: UDP, length 120
02:16:24.755111 IP 192.168.43.124.8880 > 192.168.43.195.7771: UDP, length 120
02:16:24.789663 IP 192.168.43.195.8880 > 192.168.43.124.7772: UDP, length 120
02:16:24.804322 IP 192.168.43.124.8880 > 192.168.43.195.7771: UDP, length 120
02:16:24.839663 IP 192.168.43.195.8880 > 192.168.43.124.7772: UDP, length 120
02:16:24.854941 IP 192.168.43.124.8880 > 192.168.43.195.7771: UDP, length 120
02:16:24.889671 IP 192.168.43.195.8880 > 192.168.43.124.7772: UDP, length 120
02:16:24.905702 IP 192.168.43.124.8880 > 192.168.43.195.7771: UDP, length 120
02:16:24.939667 IP 192.168.43.195.8880 > 192.168.43.124.7772: UDP, length 120
02:16:24.954221 IP 192.168.43.124.8880 > 192.168.43.195.7771: UDP, length 120
02:16:24.989663 IP 192.168.43.195.8880 > 192.168.43.124.7772: UDP, length 120
02:16:25.005338 IP 192.168.43.124.8880 > 192.168.43.195.7771: UDP, length 120
02:16:25.039670 IP 192.168.43.195.8880 > 192.168.43.124.7772: UDP, length 120
02:16:25.054303 IP 192.168.43.124.8880 > 192.168.43.195.7771: UDP, length 120
02:16:25.089681 IP 192.168.43.195.8880 > 192.168.43.124.7772: UDP, length 120
02:16:25.104956 IP 192.168.43.124.8880 > 192.168.43.195.7771: UDP, length 120
02:16:25.139671 IP 192.168.43.195.8880 > 192.168.43.124.7772: UDP, length 120
02:16:25.154406 IP 192.168.43.124.8880 > 192.168.43.195.7771: UDP, length 120
02:16:25.189665 IP 192.168.43.195.8880 > 192.168.43.124.7772: UDP, length 120
02:16:25.225598 IP 192.168.43.124.8880 > 192.168.43.195.7771: UDP, length 120
02:16:25.239669 IP 192.168.43.195.8880 > 192.168.43.124.7772: UDP, length 120
02:16:25.254291 IP 192.168.43.124.8880 > 192.168.43.195.7771: UDP, length 120
02:16:25.289663 IP 192.168.43.195.8880 > 192.168.43.124.7772: UDP, length 120
02:16:25.305224 IP 192.168.43.124.8880 > 192.168.43.195.7771: UDP, length 120
02:16:25.339674 IP 192.168.43.195.8880 > 192.168.43.124.7772: UDP, length 120
02:16:25.355020 IP 192.168.43.124.8880 > 192.168.43.195.7771: UDP, length 120
02:16:25.389665 IP 192.168.43.195.8880 > 192.168.43.124.7772: UDP, length 120
02:16:25.404783 IP 192.168.43.124.8880 > 192.168.43.195.7771: UDP, length 120
02:16:25.439663 IP 192.168.43.195.8880 > 192.168.43.124.7772: UDP, length 120
02:16:25.454542 IP 192.168.43.124.8880 > 192.168.43.195.7771: UDP, length 120
02:16:25.489663 IP 192.168.43.195.8880 > 192.168.43.124.7772: UDP, length 120
02:16:25.504193 IP 192.168.43.124.8880 > 192.168.43.195.7771: UDP, length 120
02:16:25.539663 IP 192.168.43.195.8880 > 192.168.43.124.7772: UDP, length 120
02:16:25.576655 IP 192.168.43.124.8880 > 192.168.43.195.7771: UDP, length 120
02:16:25.589667 IP 192.168.43.195.8880 > 192.168.43.124.7772: UDP, length 120
02:16:25.604291 IP 192.168.43.124.8880 > 192.168.43.195.7771: UDP, length 120
02:16:25.639666 IP 192.168.43.195.8880 > 192.168.43.124.7772: UDP, length 120
02:16:25.654413 IP 192.168.43.124.8880 > 192.168.43.195.7771: UDP, length 120
02:16:25.689666 IP 192.168.43.195.8880 > 192.168.43.124.7772: UDP, length 120
02:16:25.706354 IP 192.168.43.124.8880 > 192.168.43.195.7771: UDP, length 120
02:16:25.739668 IP 192.168.43.195.8880 > 192.168.43.124.7772: UDP, length 120
02:16:25.755597 IP 192.168.43.124.8880 > 192.168.43.195.7771: UDP, length 120
02:16:25.789663 IP 192.168.43.195.8880 > 192.168.43.124.7772: UDP, length 120
02:16:25.806864 IP 192.168.43.124.8880 > 192.168.43.195.7771: UDP, length 120
02:16:25.839717 IP 192.168.43.195.8880 > 192.168.43.124.7772: UDP, length 120
02:16:25.854198 IP 192.168.43.124.8880 > 192.168.43.195.7771: UDP, length 120
02:16:25.889671 IP 192.168.43.195.8880 > 192.168.43.124.7772: UDP, length 120
02:16:25.919321 IP 192.168.43.124.8880 > 192.168.43.195.7771: UDP, length 120
02:16:25.939664 IP 192.168.43.195.8880 > 192.168.43.124.7772: UDP, length 120
02:16:25.956141 IP 192.168.43.124.8880 > 192.168.43.195.7771: UDP, length 120
02:16:25.989660 IP 192.168.43.195.8880 > 192.168.43.124.7772: UDP, length 120
02:16:26.004441 IP 192.168.43.124.8880 > 192.168.43.195.7771: UDP, length 120
02:16:26.039696 IP 192.168.43.195.8880 > 192.168.43.124.7772: UDP, length 120
02:16:26.073442 IP 192.168.43.124.8880 > 192.168.43.195.7771: UDP, length 120
02:16:26.089684 IP 192.168.43.195.8880 > 192.168.43.124.7772: UDP, length 120
02:16:26.119006 IP 192.168.43.124.8880 > 192.168.43.195.7771: UDP, length 120
02:16:26.139679 IP 192.168.43.195.8880 > 192.168.43.124.7772: UDP, length 120
02:16:26.154613 IP 192.168.43.124.8880 > 192.168.43.195.7771: UDP, length 120
02:16:26.189668 IP 192.168.43.195.8880 > 192.168.43.124.7772: UDP, length 120
02:16:26.204831 IP 192.168.43.124.8880 > 192.168.43.195.7771: UDP, length 120
02:16:26.239665 IP 192.168.43.195.8880 > 192.168.43.124.7772: UDP, length 120
02:16:26.255677 IP 192.168.43.124.8880 > 192.168.43.195.7771: UDP, length 120
02:16:26.289664 IP 192.168.43.195.8880 > 192.168.43.124.7772: UDP, length 120
02:16:26.306832 IP 192.168.43.124.8880 > 192.168.43.195.7771: UDP, length 120
02:16:26.339661 IP 192.168.43.195.8880 > 192.168.43.124.7772: UDP, length 120
02:16:26.354403 IP 192.168.43.124.8880 > 192.168.43.195.7771: UDP, length 120
02:16:26.389665 IP 192.168.43.195.8880 > 192.168.43.124.7772: UDP, length 120
02:16:26.404321 IP 192.168.43.124.8880 > 192.168.43.195.7771: UDP, length 120
02:16:26.439663 IP 192.168.43.195.8880 > 192.168.43.124.7772: UDP, length 120
02:16:26.476627 IP 192.168.43.124.8880 > 192.168.43.195.7771: UDP, length 120
02:16:26.489664 IP 192.168.43.195.8880 > 192.168.43.124.7772: UDP, length 120
02:16:26.504299 IP 192.168.43.124.8880 > 192.168.43.195.7771: UDP, length 120
02:16:26.539661 IP 192.168.43.195.8880 > 192.168.43.124.7772: UDP, length 120
02:16:26.554371 IP 192.168.43.124.8880 > 192.168.43.195.7771: UDP, length 120
02:16:26.589663 IP 192.168.43.195.8880 > 192.168.43.124.7772: UDP, length 120
02:16:26.604277 IP 192.168.43.124.8880 > 192.168.43.195.7771: UDP, length 120
02:16:26.639662 IP 192.168.43.195.8880 > 192.168.43.124.7772: UDP, length 120
02:16:26.657275 IP 192.168.43.124.8880 > 192.168.43.195.7771: UDP, length 120
02:16:26.689661 IP 192.168.43.195.8880 > 192.168.43.124.7772: UDP, length 120
02:16:26.704684 IP 192.168.43.124.8880 > 192.168.43.195.7771: UDP, length 120
02:16:26.739669 IP 192.168.43.195.8880 > 192.168.43.124.7772: UDP, length 120
02:16:26.754234 IP 192.168.43.124.8880 > 192.168.43.195.7771: UDP, length 120
02:16:26.789662 IP 192.168.43.195.8880 > 192.168.43.124.7772: UDP, length 120
02:16:26.828921 IP 192.168.43.124.8880 > 192.168.43.195.7771: UDP, length 120
02:16:26.839662 IP 192.168.43.195.8880 > 192.168.43.124.7772: UDP, length 120
02:16:26.856484 IP 192.168.43.124.8880 > 192.168.43.195.7771: UDP, length 120
02:16:26.889662 IP 192.168.43.195.8880 > 192.168.43.124.7772: UDP, length 120
02:16:26.905786 IP 192.168.43.124.8880 > 192.168.43.195.7771: UDP, length 120
02:16:26.939662 IP 192.168.43.195.8880 > 192.168.43.124.7772: UDP, length 120
02:16:26.968604 IP 192.168.43.124.8880 > 192.168.43.195.7771: UDP, length 120
02:16:26.989665 IP 192.168.43.195.8880 > 192.168.43.124.7772: UDP, length 120
02:16:27.014976 IP 192.168.43.124.8880 > 192.168.43.195.7771: UDP, length 120
02:16:27.039678 IP 192.168.43.195.8880 > 192.168.43.124.7772: UDP, length 120
02:16:27.055953 IP 192.168.43.124.8880 > 192.168.43.195.7771: UDP, length 120
02:16:27.089667 IP 192.168.43.195.8880 > 192.168.43.124.7772: UDP, length 120
02:16:27.104765 IP 192.168.43.124.8880 > 192.168.43.195.7771: UDP, length 120
02:16:27.139671 IP 192.168.43.195.8880 > 192.168.43.124.7772: UDP, length 120
02:16:27.155746 IP 192.168.43.124.8880 > 192.168.43.195.7771: UDP, length 120
02:16:27.189671 IP 192.168.43.195.8880 > 192.168.43.124.7772: UDP, length 120
02:16:27.204271 IP 192.168.43.124.8880 > 192.168.43.195.7771: UDP, length 120
02:16:27.239671 IP 192.168.43.195.8880 > 192.168.43.124.7772: UDP, length 120
02:16:27.254588 IP 192.168.43.124.8880 > 192.168.43.195.7771: UDP, length 120
02:16:27.289669 IP 192.168.43.195.8880 > 192.168.43.124.7772: UDP, length 120
02:16:27.304654 IP 192.168.43.124.8880 > 192.168.43.195.7771: UDP, length 120
02:16:27.339717 IP 192.168.43.195.8880 > 192.168.43.124.7772: UDP, length 120
02:16:27.378011 IP 192.168.43.124.8880 > 192.168.43.195.7771: UDP, length 120
02:16:27.389675 IP 192.168.43.195.8880 > 192.168.43.124.7772: UDP, length 120
02:16:27.404918 IP 192.168.43.124.8880 > 192.168.43.195.7771: UDP, length 120
02:16:27.439669 IP 192.168.43.195.8880 > 192.168.43.124.7772: UDP, length 120
02:16:27.455955 IP 192.168.43.124.8880 > 192.168.43.195.7771: UDP, length 120
02:16:27.489670 IP 192.168.43.195.8880 > 192.168.43.124.7772: UDP, length 120
02:16:27.504814 IP 192.168.43.124.8880 > 192.168.43.195.7771: UDP, length 120
02:16:27.539663 IP 192.168.43.195.8880 > 192.168.43.124.7772: UDP, length 120
02:16:27.565030 IP 192.168.43.124.8880 > 192.168.43.195.7771: UDP, length 120
02:16:27.589663 IP 192.168.43.195.8880 > 192.168.43.124.7772: UDP, length 120
02:16:27.606578 IP 192.168.43.124.8880 > 192.168.43.195.7771: UDP, length 120
02:16:27.639684 IP 192.168.43.195.8880 > 192.168.43.124.7772: UDP, length 120
02:16:27.654427 IP 192.168.43.124.8880 > 192.168.43.195.7771: UDP, length 120
02:16:27.689672 IP 192.168.43.195.8880 > 192.168.43.124.7772: UDP, length 120
02:16:27.739663 IP 192.168.43.195.8880 > 192.168.43.124.7772: UDP, length 120
02:16:27.755074 IP 192.168.43.124.8880 > 192.168.43.195.7771: UDP, length 120
02:16:27.755866 IP 192.168.43.124.8880 > 192.168.43.195.7771: UDP, length 120
02:16:27.789664 IP 192.168.43.195.8880 > 192.168.43.124.7772: UDP, length 120
02:16:27.804780 IP 192.168.43.124.8880 > 192.168.43.195.7771: UDP, length 120
02:16:27.839665 IP 192.168.43.195.8880 > 192.168.43.124.7772: UDP, length 120
02:16:27.856856 IP 192.168.43.124.8880 > 192.168.43.195.7771: UDP, length 120
02:16:27.889664 IP 192.168.43.195.8880 > 192.168.43.124.7772: UDP, length 120
02:16:27.930978 IP 192.168.43.124.8880 > 192.168.43.195.7771: UDP, length 120
02:16:27.939665 IP 192.168.43.195.8880 > 192.168.43.124.7772: UDP, length 120
02:16:27.954404 IP 192.168.43.124.8880 > 192.168.43.195.7771: UDP, length 120
02:16:27.989669 IP 192.168.43.195.8880 > 192.168.43.124.7772: UDP, length 120
02:16:28.004752 IP 192.168.43.124.8880 > 192.168.43.195.7771: UDP, length 120
02:16:28.039676 IP 192.168.43.195.8880 > 192.168.43.124.7772: UDP, length 120
02:16:28.054601 IP 192.168.43.124.8880 > 192.168.43.195.7771: UDP, length 120
02:16:28.089667 IP 192.168.43.195.8880 > 192.168.43.124.7772: UDP, length 120
02:16:28.104836 IP 192.168.43.124.8880 > 192.168.43.195.7771: UDP, length 120
02:16:28.139664 IP 192.168.43.195.8880 > 192.168.43.124.7772: UDP, length 120
02:16:28.154662 IP 192.168.43.124.8880 > 192.168.43.195.7771: UDP, length 120
02:16:28.189661 IP 192.168.43.195.8880 > 192.168.43.124.7772: UDP, length 120
02:16:28.204378 IP 192.168.43.124.8880 > 192.168.43.195.7771: UDP, length 120
02:16:28.239674 IP 192.168.43.195.8880 > 192.168.43.124.7772: UDP, length 120
02:16:28.268979 IP 192.168.43.124.8880 > 192.168.43.195.7771: UDP, length 120
02:16:28.289678 IP 192.168.43.195.8880 > 192.168.43.124.7772: UDP, length 120
02:16:28.304979 IP 192.168.43.124.8880 > 192.168.43.195.7771: UDP, length 120
02:16:28.339667 IP 192.168.43.195.8880 > 192.168.43.124.7772: UDP, length 120
02:16:28.355315 IP 192.168.43.124.8880 > 192.168.43.195.7771: UDP, length 120
02:16:28.389664 IP 192.168.43.195.8880 > 192.168.43.124.7772: UDP, length 120
02:16:28.433549 IP 192.168.43.124.8880 > 192.168.43.195.7771: UDP, length 120
02:16:28.439661 IP 192.168.43.195.8880 > 192.168.43.124.7772: UDP, length 120
02:16:28.454482 IP 192.168.43.124.8880 > 192.168.43.195.7771: UDP, length 120
02:16:28.489662 IP 192.168.43.195.8880 > 192.168.43.124.7772: UDP, length 120
02:16:28.504644 IP 192.168.43.124.8880 > 192.168.43.195.7771: UDP, length 120
02:16:28.539678 IP 192.168.43.195.8880 > 192.168.43.124.7772: UDP, length 120
02:16:28.554552 IP 192.168.43.124.8880 > 192.168.43.195.7771: UDP, length 120
02:16:28.589669 IP 192.168.43.195.8880 > 192.168.43.124.7772: UDP, length 120
02:16:28.605485 IP 192.168.43.124.8880 > 192.168.43.195.7771: UDP, length 120
02:16:28.639663 IP 192.168.43.195.8880 > 192.168.43.124.7772: UDP, length 120
02:16:28.654681 IP 192.168.43.124.8880 > 192.168.43.195.7771: UDP, length 120
02:16:28.689665 IP 192.168.43.195.8880 > 192.168.43.124.7772: UDP, length 120
02:16:28.704449 IP 192.168.43.124.8880 > 192.168.43.195.7771: UDP, length 120
02:16:28.739663 IP 192.168.43.195.8880 > 192.168.43.124.7772: UDP, length 120
02:16:28.779761 IP 192.168.43.124.8880 > 192.168.43.195.7771: UDP, length 120
02:16:28.789662 IP 192.168.43.195.8880 > 192.168.43.124.7772: UDP, length 120
02:16:28.804492 IP 192.168.43.124.8880 > 192.168.43.195.7771: UDP, length 120
02:16:28.839712 IP 192.168.43.195.8880 > 192.168.43.124.7772: UDP, length 120
02:16:28.854616 IP 192.168.43.124.8880 > 192.168.43.195.7771: UDP, length 120
02:16:28.889675 IP 192.168.43.195.8880 > 192.168.43.124.7772: UDP, length 120
02:16:28.904927 IP 192.168.43.124.8880 > 192.168.43.195.7771: UDP, length 120
02:16:28.939675 IP 192.168.43.195.8880 > 192.168.43.124.7772: UDP, length 120
02:16:28.955378 IP 192.168.43.124.8880 > 192.168.43.195.7771: UDP, length 120
02:16:28.989673 IP 192.168.43.195.8880 > 192.168.43.124.7772: UDP, length 120
02:16:29.006615 IP 192.168.43.124.8880 > 192.168.43.195.7771: UDP, length 120
02:16:29.039679 IP 192.168.43.195.8880 > 192.168.43.124.7772: UDP, length 120
02:16:29.056226 IP 192.168.43.124.8880 > 192.168.43.195.7771: UDP, length 120
02:16:29.089670 IP 192.168.43.195.8880 > 192.168.43.124.7772: UDP, length 120
02:16:29.128795 IP 192.168.43.124.8880 > 192.168.43.195.7771: UDP, length 120
02:16:29.139667 IP 192.168.43.195.8880 > 192.168.43.124.7772: UDP, length 120
02:16:29.154558 IP 192.168.43.124.8880 > 192.168.43.195.7771: UDP, length 120
02:16:29.189662 IP 192.168.43.195.8880 > 192.168.43.124.7772: UDP, length 120
02:16:29.206697 IP 192.168.43.124.8880 > 192.168.43.195.7771: UDP, length 120
02:16:29.239662 IP 192.168.43.195.8880 > 192.168.43.124.7772: UDP, length 120
02:16:29.254564 IP 192.168.43.124.8880 > 192.168.43.195.7771: UDP, length 120
02:16:29.289665 IP 192.168.43.195.8880 > 192.168.43.124.7772: UDP, length 120
02:16:29.305875 IP 192.168.43.124.8880 > 192.168.43.195.7771: UDP, length 120
02:16:29.339675 IP 192.168.43.195.8880 > 192.168.43.124.7772: UDP, length 120
02:16:29.354744 IP 192.168.43.124.8880 > 192.168.43.195.7771: UDP, length 120
02:16:29.389666 IP 192.168.43.195.8880 > 192.168.43.124.7772: UDP, length 120
02:16:29.404770 IP 192.168.43.124.8880 > 192.168.43.195.7771: UDP, length 120
02:16:29.439665 IP 192.168.43.195.8880 > 192.168.43.124.7772: UDP, length 120
02:16:29.476656 IP 192.168.43.124.8880 > 192.168.43.195.7771: UDP, length 120
02:16:29.489664 IP 192.168.43.195.8880 > 192.168.43.124.7772: UDP, length 120
02:16:29.506596 IP 192.168.43.124.8880 > 192.168.43.195.7771: UDP, length 120
02:16:29.539661 IP 192.168.43.195.8880 > 192.168.43.124.7772: UDP, length 120
02:16:29.554830 IP 192.168.43.124.8880 > 192.168.43.195.7771: UDP, length 120
02:16:29.589663 IP 192.168.43.195.8880 > 192.168.43.124.7772: UDP, length 120
02:16:29.612296 IP 192.168.43.124.8880 > 192.168.43.195.7771: UDP, length 120
02:16:29.639666 IP 192.168.43.195.8880 > 192.168.43.124.7772: UDP, length 120
02:16:29.654793 IP 192.168.43.124.8880 > 192.168.43.195.7771: UDP, length 120
02:16:29.689664 IP 192.168.43.195.8880 > 192.168.43.124.7772: UDP, length 120
02:16:29.704544 IP 192.168.43.124.8880 > 192.168.43.195.7771: UDP, length 120
02:16:29.739663 IP 192.168.43.195.8880 > 192.168.43.124.7772: UDP, length 120
02:16:29.754763 IP 192.168.43.124.8880 > 192.168.43.195.7771: UDP, length 120
02:16:29.789663 IP 192.168.43.195.8880 > 192.168.43.124.7772: UDP, length 120
02:16:29.804400 IP 192.168.43.124.8880 > 192.168.43.195.7771: UDP, length 120
02:16:29.839661 IP 192.168.43.195.8880 > 192.168.43.124.7772: UDP, length 120
02:16:29.856033 IP 192.168.43.124.8880 > 192.168.43.195.7771: UDP, length 120
02:16:29.889664 IP 192.168.43.195.8880 > 192.168.43.124.7772: UDP, length 120
02:16:29.905850 IP 192.168.43.124.8880 > 192.168.43.195.7771: UDP, length 120
02:16:29.939660 IP 192.168.43.195.8880 > 192.168.43.124.7772: UDP, length 120
02:16:29.954337 IP 192.168.43.124.8880 > 192.168.43.195.7771: UDP, length 120
02:16:29.989662 IP 192.168.43.195.8880 > 192.168.43.124.7772: UDP, length 120
02:16:30.021717 IP 192.168.43.124.8880 > 192.168.43.195.7771: UDP, length 120
02:16:30.039670 IP 192.168.43.195.8880 > 192.168.43.124.7772: UDP, length 120
02:16:30.055299 IP 192.168.43.124.8880 > 192.168.43.195.7771: UDP, length 120
02:16:30.089664 IP 192.168.43.195.8880 > 192.168.43.124.7772: UDP, length 120
02:16:30.104679 IP 192.168.43.124.8880 > 192.168.43.195.7771: UDP, length 120
02:16:30.139662 IP 192.168.43.195.8880 > 192.168.43.124.7772: UDP, length 120
02:16:30.154967 IP 192.168.43.124.8880 > 192.168.43.195.7771: UDP, length 120
02:16:30.189705 IP 192.168.43.195.8880 > 192.168.43.124.7772: UDP, length 120
02:16:30.205483 IP 192.168.43.124.8880 > 192.168.43.195.7771: UDP, length 120
02:16:30.239674 IP 192.168.43.195.8880 > 192.168.43.124.7772: UDP, length 120
02:16:30.254605 IP 192.168.43.124.8880 > 192.168.43.195.7771: UDP, length 120
02:16:30.289666 IP 192.168.43.195.8880 > 192.168.43.124.7772: UDP, length 120
02:16:30.304327 IP 192.168.43.124.8880 > 192.168.43.195.7771: UDP, length 120
02:16:30.339715 IP 192.168.43.195.8880 > 192.168.43.124.7772: UDP, length 120
02:16:30.374263 IP 192.168.43.124.8880 > 192.168.43.195.7771: UDP, length 120
02:16:30.389695 IP 192.168.43.195.8880 > 192.168.43.124.7772: UDP, length 120
02:16:30.405542 IP 192.168.43.124.8880 > 192.168.43.195.7771: UDP, length 120
02:16:30.439690 IP 192.168.43.195.8880 > 192.168.43.124.7772: UDP, length 120
02:16:30.454693 IP 192.168.43.124.8880 > 192.168.43.195.7771: UDP, length 120
02:16:30.489673 IP 192.168.43.195.8880 > 192.168.43.124.7772: UDP, length 120
02:16:30.505865 IP 192.168.43.124.8880 > 192.168.43.195.7771: UDP, length 120
02:16:30.539666 IP 192.168.43.195.8880 > 192.168.43.124.7772: UDP, length 120
02:16:30.556795 IP 192.168.43.124.8880 > 192.168.43.195.7771: UDP, length 120
02:16:30.589664 IP 192.168.43.195.8880 > 192.168.43.124.7772: UDP, length 120
02:16:30.604421 IP 192.168.43.124.8880 > 192.168.43.195.7771: UDP, length 120
02:16:30.639664 IP 192.168.43.195.8880 > 192.168.43.124.7772: UDP, length 120
02:16:30.654337 IP 192.168.43.124.8880 > 192.168.43.195.7771: UDP, length 120
02:16:30.689663 IP 192.168.43.195.8880 > 192.168.43.124.7772: UDP, length 120
02:16:30.713294 IP 192.168.43.124.8880 > 192.168.43.195.7771: UDP, length 120
02:16:30.739668 IP 192.168.43.195.8880 > 192.168.43.124.7772: UDP, length 120
02:16:30.754550 IP 192.168.43.124.8880 > 192.168.43.195.7771: UDP, length 120
02:16:30.789670 IP 192.168.43.195.8880 > 192.168.43.124.7772: UDP, length 120
02:16:30.805503 IP 192.168.43.124.8880 > 192.168.43.195.7771: UDP, length 120
02:16:30.839661 IP 192.168.43.195.8880 > 192.168.43.124.7772: UDP, length 120
02:16:30.854441 IP 192.168.43.124.8880 > 192.168.43.195.7771: UDP, length 120
02:16:30.889663 IP 192.168.43.195.8880 > 192.168.43.124.7772: UDP, length 120
02:16:30.906433 IP 192.168.43.124.8880 > 192.168.43.195.7771: UDP, length 120
02:16:30.939664 IP 192.168.43.195.8880 > 192.168.43.124.7772: UDP, length 120
02:16:30.954425 IP 192.168.43.124.8880 > 192.168.43.195.7771: UDP, length 120
02:16:30.989668 IP 192.168.43.195.8880 > 192.168.43.124.7772: UDP, length 120
02:16:31.004457 IP 192.168.43.124.8880 > 192.168.43.195.7771: UDP, length 120
02:16:31.039700 IP 192.168.43.195.8880 > 192.168.43.124.7772: UDP, length 120
02:16:31.055140 IP 192.168.43.124.8880 > 192.168.43.195.7771: UDP, length 120
02:16:31.089678 IP 192.168.43.195.8880 > 192.168.43.124.7772: UDP, length 120
02:16:31.115811 IP 192.168.43.124.8880 > 192.168.43.195.7771: UDP, length 120
02:16:31.139668 IP 192.168.43.195.8880 > 192.168.43.124.7772: UDP, length 120
02:16:31.154372 IP 192.168.43.124.8880 > 192.168.43.195.7771: UDP, length 120
02:16:31.189665 IP 192.168.43.195.8880 > 192.168.43.124.7772: UDP, length 120
02:16:31.204656 IP 192.168.43.124.8880 > 192.168.43.195.7771: UDP, length 120
02:16:31.239665 IP 192.168.43.195.8880 > 192.168.43.124.7772: UDP, length 120
02:16:31.254406 IP 192.168.43.124.8880 > 192.168.43.195.7771: UDP, length 120
02:16:31.289672 IP 192.168.43.195.8880 > 192.168.43.124.7772: UDP, length 120
02:16:31.305527 IP 192.168.43.124.8880 > 192.168.43.195.7771: UDP, length 120
02:16:31.339670 IP 192.168.43.195.8880 > 192.168.43.124.7772: UDP, length 120
02:16:31.354595 IP 192.168.43.124.8880 > 192.168.43.195.7771: UDP, length 120
02:16:31.389661 IP 192.168.43.195.8880 > 192.168.43.124.7772: UDP, length 120
02:16:31.404453 IP 192.168.43.124.8880 > 192.168.43.195.7771: UDP, length 120
02:16:31.439668 IP 192.168.43.195.8880 > 192.168.43.124.7772: UDP, length 120
02:16:31.476376 IP 192.168.43.124.8880 > 192.168.43.195.7771: UDP, length 120
02:16:31.489679 IP 192.168.43.195.8880 > 192.168.43.124.7772: UDP, length 120
02:16:31.504593 IP 192.168.43.124.8880 > 192.168.43.195.7771: UDP, length 120
02:16:31.539668 IP 192.168.43.195.8880 > 192.168.43.124.7772: UDP, length 120
02:16:31.555199 IP 192.168.43.124.8880 > 192.168.43.195.7771: UDP, length 120
02:16:31.589668 IP 192.168.43.195.8880 > 192.168.43.124.7772: UDP, length 120
02:16:31.604880 IP 192.168.43.124.8880 > 192.168.43.195.7771: UDP, length 120
02:16:31.639666 IP 192.168.43.195.8880 > 192.168.43.124.7772: UDP, length 120
02:16:31.657915 IP 192.168.43.124.8880 > 192.168.43.195.7771: UDP, length 120
02:16:31.689666 IP 192.168.43.195.8880 > 192.168.43.124.7772: UDP, length 120
02:16:31.704498 IP 192.168.43.124.8880 > 192.168.43.195.7771: UDP, length 120
02:16:31.739662 IP 192.168.43.195.8880 > 192.168.43.124.7772: UDP, length 120
02:16:31.756477 IP 192.168.43.124.8880 > 192.168.43.195.7771: UDP, length 120
02:16:31.789669 IP 192.168.43.195.8880 > 192.168.43.124.7772: UDP, length 120
02:16:31.806930 IP 192.168.43.124.8880 > 192.168.43.195.7771: UDP, length 120
02:16:31.839709 IP 192.168.43.195.8880 > 192.168.43.124.7772: UDP, length 120
02:16:31.854570 IP 192.168.43.124.8880 > 192.168.43.195.7771: UDP, length 120
02:16:31.889676 IP 192.168.43.195.8880 > 192.168.43.124.7772: UDP, length 120
02:16:31.904432 IP 192.168.43.124.8880 > 192.168.43.195.7771: UDP, length 120
02:16:31.939666 IP 192.168.43.195.8880 > 192.168.43.124.7772: UDP, length 120
02:16:31.954360 IP 192.168.43.124.8880 > 192.168.43.195.7771: UDP, length 120
02:16:31.989664 IP 192.168.43.195.8880 > 192.168.43.124.7772: UDP, length 120
02:16:32.007671 IP 192.168.43.124.8880 > 192.168.43.195.7771: UDP, length 120
02:16:32.039676 IP 192.168.43.195.8880 > 192.168.43.124.7772: UDP, length 120
02:16:32.054557 IP 192.168.43.124.8880 > 192.168.43.195.7771: UDP, length 120
02:16:32.089669 IP 192.168.43.195.8880 > 192.168.43.124.7772: UDP, length 120
02:16:32.104321 IP 192.168.43.124.8880 > 192.168.43.195.7771: UDP, length 120
02:16:32.139665 IP 192.168.43.195.8880 > 192.168.43.124.7772: UDP, length 120
02:16:32.174522 IP 192.168.43.124.8880 > 192.168.43.195.7771: UDP, length 120
02:16:32.189664 IP 192.168.43.195.8880 > 192.168.43.124.7772: UDP, length 120
02:16:32.207195 IP 192.168.43.124.8880 > 192.168.43.195.7771: UDP, length 120
02:16:32.239663 IP 192.168.43.195.8880 > 192.168.43.124.7772: UDP, length 120
02:16:32.254607 IP 192.168.43.124.8880 > 192.168.43.195.7771: UDP, length 120
02:16:32.289663 IP 192.168.43.195.8880 > 192.168.43.124.7772: UDP, length 120
02:16:32.305327 IP 192.168.43.124.8880 > 192.168.43.195.7771: UDP, length 120
02:16:32.339663 IP 192.168.43.195.8880 > 192.168.43.124.7772: UDP, length 120
02:16:32.355388 IP 192.168.43.124.8880 > 192.168.43.195.7771: UDP, length 120
02:16:32.389668 IP 192.168.43.195.8880 > 192.168.43.124.7772: UDP, length 120
02:16:32.404450 IP 192.168.43.124.8880 > 192.168.43.195.7771: UDP, length 120
02:16:32.439664 IP 192.168.43.195.8880 > 192.168.43.124.7772: UDP, length 120
02:16:32.454335 IP 192.168.43.124.8880 > 192.168.43.195.7771: UDP, length 120
02:16:32.489673 IP 192.168.43.195.8880 > 192.168.43.124.7772: UDP, length 120
02:16:32.504760 IP 192.168.43.124.8880 > 192.168.43.195.7771: UDP, length 120
02:16:32.539669 IP 192.168.43.195.8880 > 192.168.43.124.7772: UDP, length 120
02:16:32.555465 IP 192.168.43.124.8880 > 192.168.43.195.7771: UDP, length 120
02:16:32.589665 IP 192.168.43.195.8880 > 192.168.43.124.7772: UDP, length 120
02:16:32.604548 IP 192.168.43.124.8880 > 192.168.43.195.7771: UDP, length 120
02:16:32.639667 IP 192.168.43.195.8880 > 192.168.43.124.7772: UDP, length 120
02:16:32.656613 IP 192.168.43.124.8880 > 192.168.43.195.7771: UDP, length 120
02:16:32.689663 IP 192.168.43.195.8880 > 192.168.43.124.7772: UDP, length 120
02:16:32.704449 IP 192.168.43.124.8880 > 192.168.43.195.7771: UDP, length 120
02:16:32.739662 IP 192.168.43.195.8880 > 192.168.43.124.7772: UDP, length 120
02:16:32.754828 IP 192.168.43.124.8880 > 192.168.43.195.7771: UDP, length 120
02:16:32.789663 IP 192.168.43.195.8880 > 192.168.43.124.7772: UDP, length 120
02:16:32.804732 IP 192.168.43.124.8880 > 192.168.43.195.7771: UDP, length 120
02:16:32.839707 IP 192.168.43.195.8880 > 192.168.43.124.7772: UDP, length 120
02:16:32.854357 IP 192.168.43.124.8880 > 192.168.43.195.7771: UDP, length 120
02:16:32.889663 IP 192.168.43.195.8880 > 192.168.43.124.7772: UDP, length 120
02:16:32.906638 IP 192.168.43.124.8880 > 192.168.43.195.7771: UDP, length 120
02:16:32.939664 IP 192.168.43.195.8880 > 192.168.43.124.7772: UDP, length 120
02:16:32.956446 IP 192.168.43.124.8880 > 192.168.43.195.7771: UDP, length 120
02:16:32.989663 IP 192.168.43.195.8880 > 192.168.43.124.7772: UDP, length 120
02:16:33.006245 IP 192.168.43.124.8880 > 192.168.43.195.7771: UDP, length 120
02:16:33.039678 IP 192.168.43.195.8880 > 192.168.43.124.7772: UDP, length 120
02:16:33.056263 IP 192.168.43.124.8880 > 192.168.43.195.7771: UDP, length 120
02:16:33.089670 IP 192.168.43.195.8880 > 192.168.43.124.7772: UDP, length 120
02:16:33.104176 IP 192.168.43.124.8880 > 192.168.43.195.7771: UDP, length 120
02:16:33.139662 IP 192.168.43.195.8880 > 192.168.43.124.7772: UDP, length 120
02:16:33.156227 IP 192.168.43.124.8880 > 192.168.43.195.7771: UDP, length 120
02:16:33.189661 IP 192.168.43.195.8880 > 192.168.43.124.7772: UDP, length 120
02:16:33.211584 IP 192.168.43.124.8880 > 192.168.43.195.7771: UDP, length 120
02:16:33.239660 IP 192.168.43.195.8880 > 192.168.43.124.7772: UDP, length 120
02:16:33.256465 IP 192.168.43.124.8880 > 192.168.43.195.7771: UDP, length 120
02:16:33.289661 IP 192.168.43.195.8880 > 192.168.43.124.7772: UDP, length 120
02:16:33.307596 IP 192.168.43.124.8880 > 192.168.43.195.7771: UDP, length 120
02:16:33.339707 IP 192.168.43.195.8880 > 192.168.43.124.7772: UDP, length 120
02:16:33.389666 IP 192.168.43.195.8880 > 192.168.43.124.7772: UDP, length 120
02:16:33.439659 IP 192.168.43.195.8880 > 192.168.43.124.7772: UDP, length 120
02:16:33.489664 IP 192.168.43.195.8880 > 192.168.43.124.7772: UDP, length 120
02:16:33.506564 IP 192.168.43.124.8880 > 192.168.43.195.7771: UDP, length 120
02:16:33.506971 IP 192.168.43.124.8880 > 192.168.43.195.7771: UDP, length 120
02:16:33.539676 IP 192.168.43.195.8880 > 192.168.43.124.7772: UDP, length 120
02:16:33.589662 IP 192.168.43.195.8880 > 192.168.43.124.7772: UDP, length 120
02:16:33.606346 IP 192.168.43.124.8880 > 192.168.43.195.7771: UDP, length 120
02:16:33.606680 IP 192.168.43.124.8880 > 192.168.43.195.7771: UDP, length 120
02:16:33.639674 IP 192.168.43.195.8880 > 192.168.43.124.7772: UDP, length 120
02:16:33.689666 IP 192.168.43.195.8880 > 192.168.43.124.7772: UDP, length 120
02:16:33.706896 IP 192.168.43.124.8880 > 192.168.43.195.7771: UDP, length 120
02:16:33.707241 IP 192.168.43.124.8880 > 192.168.43.195.7771: UDP, length 120
02:16:33.739672 IP 192.168.43.195.8880 > 192.168.43.124.7772: UDP, length 120
02:16:33.789666 IP 192.168.43.195.8880 > 192.168.43.124.7772: UDP, length 120
02:16:33.807648 IP 192.168.43.124.8880 > 192.168.43.195.7771: UDP, length 120
02:16:33.807796 IP 192.168.43.124.8880 > 192.168.43.195.7771: UDP, length 120
02:16:33.839666 IP 192.168.43.195.8880 > 192.168.43.124.7772: UDP, length 120
02:16:33.889668 IP 192.168.43.195.8880 > 192.168.43.124.7772: UDP, length 120
02:16:33.906956 IP 192.168.43.124.8880 > 192.168.43.195.7771: UDP, length 120
02:16:33.907209 IP 192.168.43.124.8880 > 192.168.43.195.7771: UDP, length 120
02:16:33.939665 IP 192.168.43.195.8880 > 192.168.43.124.7772: UDP, length 120
02:16:33.989663 IP 192.168.43.195.8880 > 192.168.43.124.7772: UDP, length 120
02:16:34.005886 IP 192.168.43.124.8880 > 192.168.43.195.7771: UDP, length 120
02:16:34.006192 IP 192.168.43.124.8880 > 192.168.43.195.7771: UDP, length 120
02:16:34.006423 IP 192.168.43.124.8880 > 192.168.43.195.7771: UDP, length 120
02:16:34.039673 IP 192.168.43.195.8880 > 192.168.43.124.7772: UDP, length 120
02:16:34.089668 IP 192.168.43.195.8880 > 192.168.43.124.7772: UDP, length 120
02:16:34.139659 IP 192.168.43.195.8880 > 192.168.43.124.7772: UDP, length 120
02:16:34.156851 IP 192.168.43.124.8880 > 192.168.43.195.7771: UDP, length 120
02:16:34.157169 IP 192.168.43.124.8880 > 192.168.43.195.7771: UDP, length 120
02:16:34.189666 IP 192.168.43.195.8880 > 192.168.43.124.7772: UDP, length 120
02:16:34.239662 IP 192.168.43.195.8880 > 192.168.43.124.7772: UDP, length 120
02:16:34.256702 IP 192.168.43.124.8880 > 192.168.43.195.7771: UDP, length 120
02:16:34.257000 IP 192.168.43.124.8880 > 192.168.43.195.7771: UDP, length 120
02:16:34.289670 IP 192.168.43.195.8880 > 192.168.43.124.7772: UDP, length 120
02:16:34.339665 IP 192.168.43.195.8880 > 192.168.43.124.7772: UDP, length 120
02:16:34.356840 IP 192.168.43.124.8880 > 192.168.43.195.7771: UDP, length 120
02:16:34.356968 IP 192.168.43.124.8880 > 192.168.43.195.7771: UDP, length 120
02:16:34.389666 IP 192.168.43.195.8880 > 192.168.43.124.7772: UDP, length 120
02:16:34.439661 IP 192.168.43.195.8880 > 192.168.43.124.7772: UDP, length 120
02:16:34.456862 IP 192.168.43.124.8880 > 192.168.43.195.7771: UDP, length 120
02:16:34.457141 IP 192.168.43.124.8880 > 192.168.43.195.7771: UDP, length 120
02:16:34.489664 IP 192.168.43.195.8880 > 192.168.43.124.7772: UDP, length 120
02:16:34.539659 IP 192.168.43.195.8880 > 192.168.43.124.7772: UDP, length 120
02:16:34.560999 IP 192.168.43.124.8880 > 192.168.43.195.7771: UDP, length 120
02:16:34.561126 IP 192.168.43.124.8880 > 192.168.43.195.7771: UDP, length 120
02:16:34.589670 IP 192.168.43.195.8880 > 192.168.43.124.7772: UDP, length 120
02:16:34.639667 IP 192.168.43.195.8880 > 192.168.43.124.7772: UDP, length 120
02:16:34.657293 IP 192.168.43.124.8880 > 192.168.43.195.7771: UDP, length 120
02:16:34.657433 IP 192.168.43.124.8880 > 192.168.43.195.7771: UDP, length 120
02:16:34.689671 IP 192.168.43.195.8880 > 192.168.43.124.7772: UDP, length 120
02:16:34.739664 IP 192.168.43.195.8880 > 192.168.43.124.7772: UDP, length 120
02:16:34.770055 IP 192.168.43.124.8880 > 192.168.43.195.7771: UDP, length 120
02:16:34.770187 IP 192.168.43.124.8880 > 192.168.43.195.7771: UDP, length 120
02:16:34.770300 IP 192.168.43.124.8880 > 192.168.43.195.7771: UDP, length 120
02:16:34.789674 IP 192.168.43.195.8880 > 192.168.43.124.7772: UDP, length 120
02:16:34.839711 IP 192.168.43.195.8880 > 192.168.43.124.7772: UDP, length 120
02:16:34.889664 IP 192.168.43.195.8880 > 192.168.43.124.7772: UDP, length 120
02:16:34.911854 IP 192.168.43.124.8880 > 192.168.43.195.7771: UDP, length 120
02:16:34.912003 IP 192.168.43.124.8880 > 192.168.43.195.7771: UDP, length 120
02:16:34.939664 IP 192.168.43.195.8880 > 192.168.43.124.7772: UDP, length 120
02:16:34.989663 IP 192.168.43.195.8880 > 192.168.43.124.7772: UDP, length 120
02:16:35.006027 IP 192.168.43.124.8880 > 192.168.43.195.7771: UDP, length 120
02:16:35.006306 IP 192.168.43.124.8880 > 192.168.43.195.7771: UDP, length 120
02:16:35.039673 IP 192.168.43.195.8880 > 192.168.43.124.7772: UDP, length 120
02:16:35.089672 IP 192.168.43.195.8880 > 192.168.43.124.7772: UDP, length 120
02:16:35.112145 IP 192.168.43.124.8880 > 192.168.43.195.7771: UDP, length 120
02:16:35.112281 IP 192.168.43.124.8880 > 192.168.43.195.7771: UDP, length 120
02:16:35.112414 IP 192.168.43.124.8880 > 192.168.43.195.7771: UDP, length 120
02:16:35.139675 IP 192.168.43.195.8880 > 192.168.43.124.7772: UDP, length 120
02:16:35.189660 IP 192.168.43.195.8880 > 192.168.43.124.7772: UDP, length 120
02:16:35.239660 IP 192.168.43.195.8880 > 192.168.43.124.7772: UDP, length 120
02:16:35.254119 IP 192.168.43.124.8880 > 192.168.43.195.7771: UDP, length 120
02:16:35.254565 IP 192.168.43.124.8880 > 192.168.43.195.7771: UDP, length 120
02:16:35.289665 IP 192.168.43.195.8880 > 192.168.43.124.7772: UDP, length 120
02:16:35.339660 IP 192.168.43.195.8880 > 192.168.43.124.7772: UDP, length 120
02:16:35.362796 IP 192.168.43.124.8880 > 192.168.43.195.7771: UDP, length 120
02:16:35.362918 IP 192.168.43.124.8880 > 192.168.43.195.7771: UDP, length 120
02:16:35.363029 IP 192.168.43.124.8880 > 192.168.43.195.7771: UDP, length 120
02:16:35.389673 IP 192.168.43.195.8880 > 192.168.43.124.7772: UDP, length 120
02:16:35.439661 IP 192.168.43.195.8880 > 192.168.43.124.7772: UDP, length 120
02:16:35.489659 IP 192.168.43.195.8880 > 192.168.43.124.7772: UDP, length 120
02:16:35.513922 IP 192.168.43.124.8880 > 192.168.43.195.7771: UDP, length 120
02:16:35.514049 IP 192.168.43.124.8880 > 192.168.43.195.7771: UDP, length 120
02:16:35.514168 IP 192.168.43.124.8880 > 192.168.43.195.7771: UDP, length 120
02:16:35.539664 IP 192.168.43.195.8880 > 192.168.43.124.7772: UDP, length 120
02:16:35.589660 IP 192.168.43.195.8880 > 192.168.43.124.7772: UDP, length 120
02:16:35.639659 IP 192.168.43.195.8880 > 192.168.43.124.7772: UDP, length 120
02:16:35.663177 IP 192.168.43.124.8880 > 192.168.43.195.7771: UDP, length 120
02:16:35.663300 IP 192.168.43.124.8880 > 192.168.43.195.7771: UDP, length 120
02:16:35.663418 IP 192.168.43.124.8880 > 192.168.43.195.7771: UDP, length 120
02:16:35.689671 IP 192.168.43.195.8880 > 192.168.43.124.7772: UDP, length 120
02:16:35.739665 IP 192.168.43.195.8880 > 192.168.43.124.7772: UDP, length 120
02:16:35.789659 IP 192.168.43.195.8880 > 192.168.43.124.7772: UDP, length 120
02:16:35.824485 IP 192.168.43.124.8880 > 192.168.43.195.7771: UDP, length 120
02:16:35.824622 IP 192.168.43.124.8880 > 192.168.43.195.7771: UDP, length 120
02:16:35.824747 IP 192.168.43.124.8880 > 192.168.43.195.7771: UDP, length 120
02:16:35.839667 IP 192.168.43.195.8880 > 192.168.43.124.7772: UDP, length 120
02:16:35.889660 IP 192.168.43.195.8880 > 192.168.43.124.7772: UDP, length 120
02:16:35.939659 IP 192.168.43.195.8880 > 192.168.43.124.7772: UDP, length 120
02:16:35.963689 IP 192.168.43.124.8880 > 192.168.43.195.7771: UDP, length 120
02:16:35.963812 IP 192.168.43.124.8880 > 192.168.43.195.7771: UDP, length 120
02:16:35.989669 IP 192.168.43.195.8880 > 192.168.43.124.7772: UDP, length 120
02:16:36.057403 IP 192.168.43.124.8880 > 192.168.43.195.7771: UDP, length 120
02:16:36.057641 IP 192.168.43.124.8880 > 192.168.43.195.7771: UDP, length 120
02:16:36.057761 IP 192.168.43.124.8880 > 192.168.43.195.7771: UDP, length 120
02:16:36.172323 IP 192.168.43.124.8880 > 192.168.43.195.7771: UDP, length 120
02:16:36.172457 IP 192.168.43.124.8880 > 192.168.43.195.7771: UDP, length 120
02:16:36.310311 IP 192.168.43.124.8880 > 192.168.43.195.7771: UDP, length 120
02:16:36.310917 IP 192.168.43.124.8880 > 192.168.43.195.7771: UDP, length 120
02:16:36.311138 IP 192.168.43.124.8880 > 192.168.43.195.7771: UDP, length 120
02:16:36.357758 IP 192.168.43.124.8880 > 192.168.43.195.7771: UDP, length 120
02:16:36.416231 IP 192.168.43.124.8880 > 192.168.43.195.7771: UDP, length 120
02:16:36.459900 IP 192.168.43.124.8880 > 192.168.43.195.7771: UDP, length 120
02:16:36.507389 IP 192.168.43.124.8880 > 192.168.43.195.7771: UDP, length 120
02:16:36.565455 IP 192.168.43.124.8880 > 192.168.43.195.7771: UDP, length 120
02:16:36.609212 IP 192.168.43.124.8880 > 192.168.43.195.7771: UDP, length 120
02:16:36.657593 IP 192.168.43.124.8880 > 192.168.43.195.7771: UDP, length 120
02:16:36.715188 IP 192.168.43.124.8880 > 192.168.43.195.7771: UDP, length 120
02:16:36.757760 IP 192.168.43.124.8880 > 192.168.43.195.7771: UDP, length 120
02:16:36.807433 IP 192.168.43.124.8880 > 192.168.43.195.7771: UDP, length 120
02:16:36.865692 IP 192.168.43.124.8880 > 192.168.43.195.7771: UDP, length 120
02:16:36.908583 IP 192.168.43.124.8880 > 192.168.43.195.7771: UDP, length 120
02:16:36.960213 IP 192.168.43.124.8880 > 192.168.43.195.7771: UDP, length 120
02:16:37.018622 IP 192.168.43.124.8880 > 192.168.43.195.7771: UDP, length 120
02:16:37.057841 IP 192.168.43.124.8880 > 192.168.43.195.7771: UDP, length 120
02:16:37.107724 IP 192.168.43.124.8880 > 192.168.43.195.7771: UDP, length 120
02:16:37.165030 IP 192.168.43.124.8880 > 192.168.43.195.7771: UDP, length 120
02:16:37.209019 IP 192.168.43.124.8880 > 192.168.43.195.7771: UDP, length 120
02:16:37.257539 IP 192.168.43.124.8880 > 192.168.43.195.7771: UDP, length 120
02:16:37.315471 IP 192.168.43.124.8880 > 192.168.43.195.7771: UDP, length 120
02:16:37.357663 IP 192.168.43.124.8880 > 192.168.43.195.7771: UDP, length 120
02:16:37.408891 IP 192.168.43.124.8880 > 192.168.43.195.7771: UDP, length 120
02:16:37.465603 IP 192.168.43.124.8880 > 192.168.43.195.7771: UDP, length 120
02:16:37.509654 IP 192.168.43.124.8880 > 192.168.43.195.7771: UDP, length 120
02:16:37.558722 IP 192.168.43.124.8880 > 192.168.43.195.7771: UDP, length 120
02:16:37.607649 IP 192.168.43.124.8880 > 192.168.43.195.7771: UDP, length 120
02:16:37.657833 IP 192.168.43.124.8880 > 192.168.43.195.7771: UDP, length 120
02:16:37.709189 IP 192.168.43.124.8880 > 192.168.43.195.7771: UDP, length 120
02:16:37.760464 IP 192.168.43.124.8880 > 192.168.43.195.7771: UDP, length 120
02:16:37.805638 IP 192.168.43.124.8880 > 192.168.43.195.7771: UDP, length 120
02:16:37.861144 IP 192.168.43.124.8880 > 192.168.43.195.7771: UDP, length 120
02:16:37.909471 IP 192.168.43.124.8880 > 192.168.43.195.7771: UDP, length 120
02:16:37.959103 IP 192.168.43.124.8880 > 192.168.43.195.7771: UDP, length 120
02:16:38.011376 IP 192.168.43.124.8880 > 192.168.43.195.7771: UDP, length 120
02:16:38.059455 IP 192.168.43.124.8880 > 192.168.43.195.7771: UDP, length 120
02:16:38.111605 IP 192.168.43.124.8880 > 192.168.43.195.7771: UDP, length 120
02:16:38.159277 IP 192.168.43.124.8880 > 192.168.43.195.7771: UDP, length 120
02:16:38.210840 IP 192.168.43.124.8880 > 192.168.43.195.7771: UDP, length 120
02:16:38.259706 IP 192.168.43.124.8880 > 192.168.43.195.7771: UDP, length 120
02:16:38.309576 IP 192.168.43.124.8880 > 192.168.43.195.7771: UDP, length 120
02:16:38.360452 IP 192.168.43.124.8880 > 192.168.43.195.7771: UDP, length 120
02:16:38.409583 IP 192.168.43.124.8880 > 192.168.43.195.7771: UDP, length 120
02:16:38.459567 IP 192.168.43.124.8880 > 192.168.43.195.7771: UDP, length 120
02:16:38.507152 IP 192.168.43.124.8880 > 192.168.43.195.7771: UDP, length 120
02:16:38.560712 IP 192.168.43.124.8880 > 192.168.43.195.7771: UDP, length 120
02:16:38.610347 IP 192.168.43.124.8880 > 192.168.43.195.7771: UDP, length 120
02:16:38.660892 IP 192.168.43.124.8880 > 192.168.43.195.7771: UDP, length 120
02:16:38.709549 IP 192.168.43.124.8880 > 192.168.43.195.7771: UDP, length 120
02:16:38.759578 IP 192.168.43.124.8880 > 192.168.43.195.7771: UDP, length 120
02:16:38.809305 IP 192.168.43.124.8880 > 192.168.43.195.7771: UDP, length 120
02:16:38.859625 IP 192.168.43.124.8880 > 192.168.43.195.7771: UDP, length 120
02:16:38.909581 IP 192.168.43.124.8880 > 192.168.43.195.7771: UDP, length 120
02:16:38.959316 IP 192.168.43.124.8880 > 192.168.43.195.7771: UDP, length 120
02:16:39.010272 IP 192.168.43.124.8880 > 192.168.43.195.7771: UDP, length 120
02:16:39.059605 IP 192.168.43.124.8880 > 192.168.43.195.7771: UDP, length 120
02:16:39.110417 IP 192.168.43.124.8880 > 192.168.43.195.7771: UDP, length 120
02:16:39.160924 IP 192.168.43.124.8880 > 192.168.43.195.7771: UDP, length 120
02:16:39.209663 IP 192.168.43.124.8880 > 192.168.43.195.7771: UDP, length 120
02:16:39.259633 IP 192.168.43.124.8880 > 192.168.43.195.7771: UDP, length 120
02:16:39.309739 IP 192.168.43.124.8880 > 192.168.43.195.7771: UDP, length 120
02:16:39.359667 IP 192.168.43.124.8880 > 192.168.43.195.7771: UDP, length 120
02:16:39.409608 IP 192.168.43.124.8880 > 192.168.43.195.7771: UDP, length 120
02:16:39.459625 IP 192.168.43.124.8880 > 192.168.43.195.7771: UDP, length 120
02:16:39.509746 IP 192.168.43.124.8880 > 192.168.43.195.7771: UDP, length 120
02:16:39.559565 IP 192.168.43.124.8880 > 192.168.43.195.7771: UDP, length 120
02:16:39.607731 IP 192.168.43.124.8880 > 192.168.43.195.7771: UDP, length 120
02:16:39.659744 IP 192.168.43.124.8880 > 192.168.43.195.7771: UDP, length 120
02:16:39.707645 IP 192.168.43.124.8880 > 192.168.43.195.7771: UDP, length 120
02:16:39.793017 IP 192.168.43.124.8880 > 192.168.43.195.7771: UDP, length 120
02:16:39.811657 IP 192.168.43.124.8880 > 192.168.43.195.7771: UDP, length 120
02:16:39.859511 IP 192.168.43.124.8880 > 192.168.43.195.7771: UDP, length 120
02:16:39.907710 IP 192.168.43.124.8880 > 192.168.43.195.7771: UDP, length 120
